00:00:00.000000 IP 10.0.1.1 > 10.0.2.2: ICMP echo request, id 10602, seq 1, length 64
00:00:00.008247 IP 10.0.1.1 > 10.0.2.2: ICMP echo request, id 10602, seq 2, length 64
00:00:00.011919 IP 10.0.1.1 > 10.0.2.2: ICMP echo request, id 10602, seq 3, length 64
00:00:00.016772 IP 10.0.1.1 > 10.0.2.2: ICMP echo request, id 10602, seq 4, length 64
00:00:00.021734 IP 10.0.1.1 > 10.0.2.2: ICMP echo request, id 10602, seq 5, length 64
00:00:00.026798 IP 10.0.1.1 > 10.0.2.2: ICMP echo request, id 10602, seq 6, length 64
00:00:00.031714 IP 10.0.1.1 > 10.0.2.2: ICMP echo request, id 10602, seq 7, length 64
00:00:00.036751 IP 10.0.1.1 > 10.0.2.2: ICMP echo request, id 10602, seq 8, length 64
00:00:00.041720 IP 10.0.1.1 > 10.0.2.2: ICMP echo request, id 10602, seq 9, length 64
00:00:00.046712 IP 10.0.1.1 > 10.0.2.2: ICMP echo request, id 10602, seq 10, length 64
00:00:00.051683 IP 10.0.1.1 > 10.0.2.2: ICMP echo request, id 10602, seq 11, length 64
00:00:00.056715 IP 10.0.1.1 > 10.0.2.2: ICMP echo request, id 10602, seq 12, length 64
00:00:00.061709 IP 10.0.1.1 > 10.0.2.2: ICMP echo request, id 10602, seq 13, length 64
00:00:00.066688 IP 10.0.1.1 > 10.0.2.2: ICMP echo request, id 10602, seq 14, length 64
00:00:00.071761 IP 10.0.1.1 > 10.0.2.2: ICMP echo request, id 10602, seq 15, length 64
00:00:00.076663 IP 10.0.1.1 > 10.0.2.2: ICMP echo request, id 10602, seq 16, length 64
00:00:00.081602 IP 10.0.1.1 > 10.0.2.2: ICMP echo request, id 10602, seq 17, length 64
00:00:00.086592 IP 10.0.1.1 > 10.0.2.2: ICMP echo request, id 10602, seq 18, length 64
00:00:00.091538 IP 10.0.1.1 > 10.0.2.2: ICMP echo request, id 10602, seq 19, length 64
00:00:00.096526 IP 10.0.1.1 > 10.0.2.2: ICMP echo request, id 10602, seq 20, length 64
00:00:00.101555 IP 10.0.1.1 > 10.0.2.2: ICMP echo request, id 10602, seq 21, length 64
00:00:00.106522 IP 10.0.1.1 > 10.0.2.2: ICMP echo request, id 10602, seq 22, length 64
00:00:00.111632 IP 10.0.1.1 > 10.0.2.2: ICMP echo request, id 10602, seq 23, length 64
00:00:00.116598 IP 10.0.1.1 > 10.0.2.2: ICMP echo request, id 10602, seq 24, length 64
00:00:00.121450 IP 10.0.1.1 > 10.0.2.2: ICMP echo request, id 10602, seq 25, length 64
00:00:00.126439 IP 10.0.1.1 > 10.0.2.2: ICMP echo request, id 10602, seq 26, length 64
00:00:00.131459 IP 10.0.1.1 > 10.0.2.2: ICMP echo request, id 10602, seq 27, length 64
00:00:00.136460 IP 10.0.1.1 > 10.0.2.2: ICMP echo request, id 10602, seq 28, length 64
00:00:00.141410 IP 10.0.1.1 > 10.0.2.2: ICMP echo request, id 10602, seq 29, length 64
00:00:00.146398 IP 10.0.1.1 > 10.0.2.2: ICMP echo request, id 10602, seq 30, length 64
00:00:00.151397 IP 10.0.1.1 > 10.0.2.2: ICMP echo request, id 10602, seq 31, length 64
00:00:00.156612 IP 10.0.1.1 > 10.0.2.2: ICMP echo request, id 10602, seq 32, length 64
00:00:00.161701 IP 10.0.1.1 > 10.0.2.2: ICMP echo request, id 10602, seq 33, length 64
00:00:00.166622 IP 10.0.1.1 > 10.0.2.2: ICMP echo request, id 10602, seq 34, length 64
00:00:00.171668 IP 10.0.1.1 > 10.0.2.2: ICMP echo request, id 10602, seq 35, length 64
00:00:00.176614 IP 10.0.1.1 > 10.0.2.2: ICMP echo request, id 10602, seq 36, length 64
00:00:00.181538 IP 10.0.1.1 > 10.0.2.2: ICMP echo request, id 10602, seq 37, length 64
00:00:00.186400 IP 10.0.1.1 > 10.0.2.2: ICMP echo request, id 10602, seq 38, length 64
00:00:00.191522 IP 10.0.1.1 > 10.0.2.2: ICMP echo request, id 10602, seq 39, length 64
00:00:00.196492 IP 10.0.1.1 > 10.0.2.2: ICMP echo request, id 10602, seq 40, length 64
00:00:00.201596 IP 10.0.1.1 > 10.0.2.2: ICMP echo request, id 10602, seq 41, length 64
00:00:00.206400 IP 10.0.1.1 > 10.0.2.2: ICMP echo request, id 10602, seq 42, length 64
00:00:00.213465 IP 10.0.1.1 > 10.0.2.2: ICMP echo request, id 10602, seq 43, length 64
00:00:00.216480 IP 10.0.1.1 > 10.0.2.2: ICMP echo request, id 10602, seq 44, length 64
00:00:00.221910 IP 10.0.1.1 > 10.0.2.2: ICMP echo request, id 10602, seq 45, length 64
00:00:00.226384 IP 10.0.1.1 > 10.0.2.2: ICMP echo request, id 10602, seq 46, length 64
00:00:00.231449 IP 10.0.1.1 > 10.0.2.2: ICMP echo request, id 10602, seq 47, length 64
00:00:00.236565 IP 10.0.1.1 > 10.0.2.2: ICMP echo request, id 10602, seq 48, length 64
00:00:00.241490 IP 10.0.1.1 > 10.0.2.2: ICMP echo request, id 10602, seq 49, length 64
00:00:00.246691 IP 10.0.1.1 > 10.0.2.2: ICMP echo request, id 10602, seq 50, length 64
00:00:00.251462 IP 10.0.1.1 > 10.0.2.2: ICMP echo request, id 10602, seq 51, length 64
00:00:00.256737 IP 10.0.1.1 > 10.0.2.2: ICMP echo request, id 10602, seq 52, length 64
00:00:00.261562 IP 10.0.1.1 > 10.0.2.2: ICMP echo request, id 10602, seq 53, length 64
00:00:00.266488 IP 10.0.1.1 > 10.0.2.2: ICMP echo request, id 10602, seq 54, length 64
00:00:00.271599 IP 10.0.1.1 > 10.0.2.2: ICMP echo request, id 10602, seq 55, length 64
00:00:00.276382 IP 10.0.1.1 > 10.0.2.2: ICMP echo request, id 10602, seq 56, length 64
00:00:00.281587 IP 10.0.1.1 > 10.0.2.2: ICMP echo request, id 10602, seq 57, length 64
00:00:00.286428 IP 10.0.1.1 > 10.0.2.2: ICMP echo request, id 10602, seq 58, length 64
00:00:00.291489 IP 10.0.1.1 > 10.0.2.2: ICMP echo request, id 10602, seq 59, length 64
00:00:00.296433 IP 10.0.1.1 > 10.0.2.2: ICMP echo request, id 10602, seq 60, length 64
00:00:00.302041 IP 10.0.1.1 > 10.0.2.2: ICMP echo request, id 10602, seq 61, length 64
00:00:00.306431 IP 10.0.1.1 > 10.0.2.2: ICMP echo request, id 10602, seq 62, length 64
00:00:00.311555 IP 10.0.1.1 > 10.0.2.2: ICMP echo request, id 10602, seq 63, length 64
00:00:00.316694 IP 10.0.1.1 > 10.0.2.2: ICMP echo request, id 10602, seq 64, length 64
00:00:00.321446 IP 10.0.1.1 > 10.0.2.2: ICMP echo request, id 10602, seq 65, length 64
00:00:00.326461 IP 10.0.1.1 > 10.0.2.2: ICMP echo request, id 10602, seq 66, length 64
00:00:00.331407 IP 10.0.1.1 > 10.0.2.2: ICMP echo request, id 10602, seq 67, length 64
00:00:00.336587 IP 10.0.1.1 > 10.0.2.2: ICMP echo request, id 10602, seq 68, length 64
00:00:00.341384 IP 10.0.1.1 > 10.0.2.2: ICMP echo request, id 10602, seq 69, length 64
00:00:00.346561 IP 10.0.1.1 > 10.0.2.2: ICMP echo request, id 10602, seq 70, length 64
00:00:00.351424 IP 10.0.1.1 > 10.0.2.2: ICMP echo request, id 10602, seq 71, length 64
00:00:00.356430 IP 10.0.1.1 > 10.0.2.2: ICMP echo request, id 10602, seq 72, length 64
00:00:00.361475 IP 10.0.1.1 > 10.0.2.2: ICMP echo request, id 10602, seq 73, length 64
00:00:00.366439 IP 10.0.1.1 > 10.0.2.2: ICMP echo request, id 10602, seq 74, length 64
00:00:00.371515 IP 10.0.1.1 > 10.0.2.2: ICMP echo request, id 10602, seq 75, length 64
00:00:00.376419 IP 10.0.1.1 > 10.0.2.2: ICMP echo request, id 10602, seq 76, length 64
00:00:00.381506 IP 10.0.1.1 > 10.0.2.2: ICMP echo request, id 10602, seq 77, length 64
00:00:00.386481 IP 10.0.1.1 > 10.0.2.2: ICMP echo request, id 10602, seq 78, length 64
00:00:00.391604 IP 10.0.1.1 > 10.0.2.2: ICMP echo request, id 10602, seq 79, length 64
00:00:00.396422 IP 10.0.1.1 > 10.0.2.2: ICMP echo request, id 10602, seq 80, length 64
00:00:00.401577 IP 10.0.1.1 > 10.0.2.2: ICMP echo request, id 10602, seq 81, length 64
00:00:00.406453 IP 10.0.1.1 > 10.0.2.2: ICMP echo request, id 10602, seq 82, length 64
00:00:00.411782 IP 10.0.1.1 > 10.0.2.2: ICMP echo request, id 10602, seq 83, length 64
00:00:00.416421 IP 10.0.1.1 > 10.0.2.2: ICMP echo request, id 10602, seq 84, length 64
00:00:00.421431 IP 10.0.1.1 > 10.0.2.2: ICMP echo request, id 10602, seq 85, length 64
00:00:00.426581 IP 10.0.1.1 > 10.0.2.2: ICMP echo request, id 10602, seq 86, length 64
00:00:00.431475 IP 10.0.1.1 > 10.0.2.2: ICMP echo request, id 10602, seq 87, length 64
00:00:00.436537 IP 10.0.1.1 > 10.0.2.2: ICMP echo request, id 10602, seq 88, length 64
00:00:00.441405 IP 10.0.1.1 > 10.0.2.2: ICMP echo request, id 10602, seq 89, length 64
00:00:00.446518 IP 10.0.1.1 > 10.0.2.2: ICMP echo request, id 10602, seq 90, length 64
00:00:00.451404 IP 10.0.1.1 > 10.0.2.2: ICMP echo request, id 10602, seq 91, length 64
00:00:00.456530 IP 10.0.1.1 > 10.0.2.2: ICMP echo request, id 10602, seq 92, length 64
00:00:00.461422 IP 10.0.1.1 > 10.0.2.2: ICMP echo request, id 10602, seq 93, length 64
00:00:00.466436 IP 10.0.1.1 > 10.0.2.2: ICMP echo request, id 10602, seq 94, length 64
00:00:00.471611 IP 10.0.1.1 > 10.0.2.2: ICMP echo request, id 10602, seq 95, length 64
00:00:00.476453 IP 10.0.1.1 > 10.0.2.2: ICMP echo request, id 10602, seq 96, length 64
00:00:00.481536 IP 10.0.1.1 > 10.0.2.2: ICMP echo request, id 10602, seq 97, length 64
00:00:00.486405 IP 10.0.1.1 > 10.0.2.2: ICMP echo request, id 10602, seq 98, length 64
00:00:00.491540 IP 10.0.1.1 > 10.0.2.2: ICMP echo request, id 10602, seq 99, length 64
00:00:00.496437 IP 10.0.1.1 > 10.0.2.2: ICMP echo request, id 10602, seq 100, length 64
00:00:00.501460 IP 10.0.1.1 > 10.0.2.2: ICMP echo request, id 10602, seq 101, length 64
00:00:00.506414 IP 10.0.1.1 > 10.0.2.2: ICMP echo request, id 10602, seq 102, length 64
00:00:00.511571 IP 10.0.1.1 > 10.0.2.2: ICMP echo request, id 10602, seq 103, length 64
00:00:00.516449 IP 10.0.1.1 > 10.0.2.2: ICMP echo request, id 10602, seq 104, length 64
00:00:00.521477 IP 10.0.1.1 > 10.0.2.2: ICMP echo request, id 10602, seq 105, length 64
00:00:00.526422 IP 10.0.1.1 > 10.0.2.2: ICMP echo request, id 10602, seq 106, length 64
00:00:00.531414 IP 10.0.1.1 > 10.0.2.2: ICMP echo request, id 10602, seq 107, length 64
00:00:00.536635 IP 10.0.1.1 > 10.0.2.2: ICMP echo request, id 10602, seq 108, length 64
00:00:00.541449 IP 10.0.1.1 > 10.0.2.2: ICMP echo request, id 10602, seq 109, length 64
00:00:00.546588 IP 10.0.1.1 > 10.0.2.2: ICMP echo request, id 10602, seq 110, length 64
00:00:00.551551 IP 10.0.1.1 > 10.0.2.2: ICMP echo request, id 10602, seq 111, length 64
00:00:00.557242 IP 10.0.1.1 > 10.0.2.2: ICMP echo request, id 10602, seq 112, length 64
00:00:00.561394 IP 10.0.1.1 > 10.0.2.2: ICMP echo request, id 10602, seq 113, length 64
00:00:00.566413 IP 10.0.1.1 > 10.0.2.2: ICMP echo request, id 10602, seq 114, length 64
00:00:00.571544 IP 10.0.1.1 > 10.0.2.2: ICMP echo request, id 10602, seq 115, length 64
00:00:00.576425 IP 10.0.1.1 > 10.0.2.2: ICMP echo request, id 10602, seq 116, length 64
00:00:00.581455 IP 10.0.1.1 > 10.0.2.2: ICMP echo request, id 10602, seq 117, length 64
00:00:00.586449 IP 10.0.1.1 > 10.0.2.2: ICMP echo request, id 10602, seq 118, length 64
00:00:00.591467 IP 10.0.1.1 > 10.0.2.2: ICMP echo request, id 10602, seq 119, length 64
00:00:00.596384 IP 10.0.1.1 > 10.0.2.2: ICMP echo request, id 10602, seq 120, length 64
00:00:00.601569 IP 10.0.1.1 > 10.0.2.2: ICMP echo request, id 10602, seq 121, length 64
00:00:00.606435 IP 10.0.1.1 > 10.0.2.2: ICMP echo request, id 10602, seq 122, length 64
00:00:00.611533 IP 10.0.1.1 > 10.0.2.2: ICMP echo request, id 10602, seq 123, length 64
00:00:00.616447 IP 10.0.1.1 > 10.0.2.2: ICMP echo request, id 10602, seq 124, length 64
00:00:00.621430 IP 10.0.1.1 > 10.0.2.2: ICMP echo request, id 10602, seq 125, length 64
00:00:00.626471 IP 10.0.1.1 > 10.0.2.2: ICMP echo request, id 10602, seq 126, length 64
00:00:00.631466 IP 10.0.1.1 > 10.0.2.2: ICMP echo request, id 10602, seq 127, length 64
00:00:00.636552 IP 10.0.1.1 > 10.0.2.2: ICMP echo request, id 10602, seq 128, length 64
00:00:00.641373 IP 10.0.1.1 > 10.0.2.2: ICMP echo request, id 10602, seq 129, length 64
00:00:00.646541 IP 10.0.1.1 > 10.0.2.2: ICMP echo request, id 10602, seq 130, length 64
00:00:00.651207 IP 10.0.1.1 > 10.0.2.2: ICMP echo request, id 10602, seq 131, length 64
00:00:00.656306 IP 10.0.1.1 > 10.0.2.2: ICMP echo request, id 10602, seq 132, length 64
00:00:00.661332 IP 10.0.1.1 > 10.0.2.2: ICMP echo request, id 10602, seq 133, length 64
00:00:00.666195 IP 10.0.1.1 > 10.0.2.2: ICMP echo request, id 10602, seq 134, length 64
00:00:00.672744 IP 10.0.1.1 > 10.0.2.2: ICMP echo request, id 10602, seq 135, length 64
00:00:00.676300 IP 10.0.1.1 > 10.0.2.2: ICMP echo request, id 10602, seq 136, length 64
00:00:00.681356 IP 10.0.1.1 > 10.0.2.2: ICMP echo request, id 10602, seq 137, length 64
00:00:00.686234 IP 10.0.1.1 > 10.0.2.2: ICMP echo request, id 10602, seq 138, length 64
00:00:00.691248 IP 10.0.1.1 > 10.0.2.2: ICMP echo request, id 10602, seq 139, length 64
00:00:00.696210 IP 10.0.1.1 > 10.0.2.2: ICMP echo request, id 10602, seq 140, length 64
00:00:00.701366 IP 10.0.1.1 > 10.0.2.2: ICMP echo request, id 10602, seq 141, length 64
00:00:00.706297 IP 10.0.1.1 > 10.0.2.2: ICMP echo request, id 10602, seq 142, length 64
00:00:00.711315 IP 10.0.1.1 > 10.0.2.2: ICMP echo request, id 10602, seq 143, length 64
00:00:00.716321 IP 10.0.1.1 > 10.0.2.2: ICMP echo request, id 10602, seq 144, length 64
00:00:00.721205 IP 10.0.1.1 > 10.0.2.2: ICMP echo request, id 10602, seq 145, length 64
00:00:00.726271 IP 10.0.1.1 > 10.0.2.2: ICMP echo request, id 10602, seq 146, length 64
00:00:00.731264 IP 10.0.1.1 > 10.0.2.2: ICMP echo request, id 10602, seq 147, length 64
00:00:00.736225 IP 10.0.1.1 > 10.0.2.2: ICMP echo request, id 10602, seq 148, length 64
00:00:00.741219 IP 10.0.1.1 > 10.0.2.2: ICMP echo request, id 10602, seq 149, length 64
00:00:00.746260 IP 10.0.1.1 > 10.0.2.2: ICMP echo request, id 10602, seq 150, length 64
00:00:00.751377 IP 10.0.1.1 > 10.0.2.2: ICMP echo request, id 10602, seq 151, length 64
00:00:00.756360 IP 10.0.1.1 > 10.0.2.2: ICMP echo request, id 10602, seq 152, length 64
00:00:00.761385 IP 10.0.1.1 > 10.0.2.2: ICMP echo request, id 10602, seq 153, length 64
00:00:00.766249 IP 10.0.1.1 > 10.0.2.2: ICMP echo request, id 10602, seq 154, length 64
00:00:00.771197 IP 10.0.1.1 > 10.0.2.2: ICMP echo request, id 10602, seq 155, length 64
00:00:00.776221 IP 10.0.1.1 > 10.0.2.2: ICMP echo request, id 10602, seq 156, length 64
00:00:00.781199 IP 10.0.1.1 > 10.0.2.2: ICMP echo request, id 10602, seq 157, length 64
00:00:00.786366 IP 10.0.1.1 > 10.0.2.2: ICMP echo request, id 10602, seq 158, length 64
00:00:00.791201 IP 10.0.1.1 > 10.0.2.2: ICMP echo request, id 10602, seq 159, length 64
00:00:00.796344 IP 10.0.1.1 > 10.0.2.2: ICMP echo request, id 10602, seq 160, length 64
00:00:00.801223 IP 10.0.1.1 > 10.0.2.2: ICMP echo request, id 10602, seq 161, length 64
00:00:00.806222 IP 10.0.1.1 > 10.0.2.2: ICMP echo request, id 10602, seq 162, length 64
00:00:00.811299 IP 10.0.1.1 > 10.0.2.2: ICMP echo request, id 10602, seq 163, length 64
00:00:00.816385 IP 10.0.1.1 > 10.0.2.2: ICMP echo request, id 10602, seq 164, length 64
00:00:00.821250 IP 10.0.1.1 > 10.0.2.2: ICMP echo request, id 10602, seq 165, length 64
00:00:00.826282 IP 10.0.1.1 > 10.0.2.2: ICMP echo request, id 10602, seq 166, length 64
00:00:00.831408 IP 10.0.1.1 > 10.0.2.2: ICMP echo request, id 10602, seq 167, length 64
00:00:00.836217 IP 10.0.1.1 > 10.0.2.2: ICMP echo request, id 10602, seq 168, length 64
00:00:00.841222 IP 10.0.1.1 > 10.0.2.2: ICMP echo request, id 10602, seq 169, length 64
00:00:00.846425 IP 10.0.1.1 > 10.0.2.2: ICMP echo request, id 10602, seq 170, length 64
00:00:00.851313 IP 10.0.1.1 > 10.0.2.2: ICMP echo request, id 10602, seq 171, length 64
00:00:00.856495 IP 10.0.1.1 > 10.0.2.2: ICMP echo request, id 10602, seq 172, length 64
00:00:00.871402 IP 10.0.1.1 > 10.0.2.2: ICMP echo request, id 10602, seq 173, length 64
00:00:00.871785 IP 10.0.1.1 > 10.0.2.2: ICMP echo request, id 10602, seq 174, length 64
00:00:00.876405 IP 10.0.1.1 > 10.0.2.2: ICMP echo request, id 10602, seq 175, length 64
00:00:00.881543 IP 10.0.1.1 > 10.0.2.2: ICMP echo request, id 10602, seq 176, length 64
00:00:00.886412 IP 10.0.1.1 > 10.0.2.2: ICMP echo request, id 10602, seq 177, length 64
00:00:00.891371 IP 10.0.1.1 > 10.0.2.2: ICMP echo request, id 10602, seq 178, length 64
00:00:00.896601 IP 10.0.1.1 > 10.0.2.2: ICMP echo request, id 10602, seq 179, length 64
00:00:00.901415 IP 10.0.1.1 > 10.0.2.2: ICMP echo request, id 10602, seq 180, length 64
00:00:00.906420 IP 10.0.1.1 > 10.0.2.2: ICMP echo request, id 10602, seq 181, length 64
00:00:00.913480 IP 10.0.1.1 > 10.0.2.2: ICMP echo request, id 10602, seq 182, length 64
00:00:00.916465 IP 10.0.1.1 > 10.0.2.2: ICMP echo request, id 10602, seq 183, length 64
00:00:00.921443 IP 10.0.1.1 > 10.0.2.2: ICMP echo request, id 10602, seq 184, length 64
00:00:00.926375 IP 10.0.1.1 > 10.0.2.2: ICMP echo request, id 10602, seq 185, length 64
00:00:00.931971 IP 10.0.1.1 > 10.0.2.2: ICMP echo request, id 10602, seq 186, length 64
00:00:00.936421 IP 10.0.1.1 > 10.0.2.2: ICMP echo request, id 10602, seq 187, length 64
00:00:00.941395 IP 10.0.1.1 > 10.0.2.2: ICMP echo request, id 10602, seq 188, length 64
00:00:00.946638 IP 10.0.1.1 > 10.0.2.2: ICMP echo request, id 10602, seq 189, length 64
00:00:00.951435 IP 10.0.1.1 > 10.0.2.2: ICMP echo request, id 10602, seq 190, length 64
00:00:00.956391 IP 10.0.1.1 > 10.0.2.2: ICMP echo request, id 10602, seq 191, length 64
00:00:00.961530 IP 10.0.1.1 > 10.0.2.2: ICMP echo request, id 10602, seq 192, length 64
00:00:00.966505 IP 10.0.1.1 > 10.0.2.2: ICMP echo request, id 10602, seq 193, length 64
00:00:00.971387 IP 10.0.1.1 > 10.0.2.2: ICMP echo request, id 10602, seq 194, length 64
00:00:00.976440 IP 10.0.1.1 > 10.0.2.2: ICMP echo request, id 10602, seq 195, length 64
00:00:00.981618 IP 10.0.1.1 > 10.0.2.2: ICMP echo request, id 10602, seq 196, length 64
00:00:00.986367 IP 10.0.1.1 > 10.0.2.2: ICMP echo request, id 10602, seq 197, length 64
00:00:00.991339 IP 10.0.1.1 > 10.0.2.2: ICMP echo request, id 10602, seq 198, length 64
00:00:00.997192 IP 10.0.1.1 > 10.0.2.2: ICMP echo request, id 10602, seq 199, length 64
00:00:01.002027 IP 10.0.1.1 > 10.0.2.2: ICMP echo request, id 10602, seq 200, length 64
00:00:01.006922 IP 10.0.1.1 > 10.0.2.2: ICMP echo request, id 10602, seq 201, length 64
00:00:01.012120 IP 10.0.1.1 > 10.0.2.2: ICMP echo request, id 10602, seq 202, length 64
00:00:01.017061 IP 10.0.1.1 > 10.0.2.2: ICMP echo request, id 10602, seq 203, length 64
00:00:01.022033 IP 10.0.1.1 > 10.0.2.2: ICMP echo request, id 10602, seq 204, length 64
00:00:01.026983 IP 10.0.1.1 > 10.0.2.2: ICMP echo request, id 10602, seq 205, length 64
00:00:01.032196 IP 10.0.1.1 > 10.0.2.2: ICMP echo request, id 10602, seq 206, length 64
00:00:01.037127 IP 10.0.1.1 > 10.0.2.2: ICMP echo request, id 10602, seq 207, length 64
00:00:01.041934 IP 10.0.1.1 > 10.0.2.2: ICMP echo request, id 10602, seq 208, length 64
00:00:01.047223 IP 10.0.1.1 > 10.0.2.2: ICMP echo request, id 10602, seq 209, length 64
00:00:01.052089 IP 10.0.1.1 > 10.0.2.2: ICMP echo request, id 10602, seq 210, length 64
00:00:01.057046 IP 10.0.1.1 > 10.0.2.2: ICMP echo request, id 10602, seq 211, length 64
00:00:01.062124 IP 10.0.1.1 > 10.0.2.2: ICMP echo request, id 10602, seq 212, length 64
00:00:01.067088 IP 10.0.1.1 > 10.0.2.2: ICMP echo request, id 10602, seq 213, length 64
00:00:01.071976 IP 10.0.1.1 > 10.0.2.2: ICMP echo request, id 10602, seq 214, length 64
00:00:01.077013 IP 10.0.1.1 > 10.0.2.2: ICMP echo request, id 10602, seq 215, length 64
00:00:01.082298 IP 10.0.1.1 > 10.0.2.2: ICMP echo request, id 10602, seq 216, length 64
00:00:01.087017 IP 10.0.1.1 > 10.0.2.2: ICMP echo request, id 10602, seq 217, length 64
00:00:01.091965 IP 10.0.1.1 > 10.0.2.2: ICMP echo request, id 10602, seq 218, length 64
00:00:01.097306 IP 10.0.1.1 > 10.0.2.2: ICMP echo request, id 10602, seq 219, length 64
00:00:01.102135 IP 10.0.1.1 > 10.0.2.2: ICMP echo request, id 10602, seq 220, length 64
00:00:01.107100 IP 10.0.1.1 > 10.0.2.2: ICMP echo request, id 10602, seq 221, length 64
00:00:01.112357 IP 10.0.1.1 > 10.0.2.2: ICMP echo request, id 10602, seq 222, length 64
00:00:01.117178 IP 10.0.1.1 > 10.0.2.2: ICMP echo request, id 10602, seq 223, length 64
00:00:01.122074 IP 10.0.1.1 > 10.0.2.2: ICMP echo request, id 10602, seq 224, length 64
00:00:01.127178 IP 10.0.1.1 > 10.0.2.2: ICMP echo request, id 10602, seq 225, length 64
00:00:01.132203 IP 10.0.1.1 > 10.0.2.2: ICMP echo request, id 10602, seq 226, length 64
00:00:01.137325 IP 10.0.1.1 > 10.0.2.2: ICMP echo request, id 10602, seq 227, length 64
00:00:01.142329 IP 10.0.1.1 > 10.0.2.2: ICMP echo request, id 10602, seq 228, length 64
00:00:01.147529 IP 10.0.1.1 > 10.0.2.2: ICMP echo request, id 10602, seq 229, length 64
00:00:01.152195 IP 10.0.1.1 > 10.0.2.2: ICMP echo request, id 10602, seq 230, length 64
00:00:01.157151 IP 10.0.1.1 > 10.0.2.2: ICMP echo request, id 10602, seq 231, length 64
00:00:01.162312 IP 10.0.1.1 > 10.0.2.2: ICMP echo request, id 10602, seq 232, length 64
00:00:01.167087 IP 10.0.1.1 > 10.0.2.2: ICMP echo request, id 10602, seq 233, length 64
00:00:01.172020 IP 10.0.1.1 > 10.0.2.2: ICMP echo request, id 10602, seq 234, length 64
00:00:01.177426 IP 10.0.1.1 > 10.0.2.2: ICMP echo request, id 10602, seq 235, length 64
00:00:01.182231 IP 10.0.1.1 > 10.0.2.2: ICMP echo request, id 10602, seq 236, length 64
00:00:01.187152 IP 10.0.1.1 > 10.0.2.2: ICMP echo request, id 10602, seq 237, length 64
00:00:01.192093 IP 10.0.1.1 > 10.0.2.2: ICMP echo request, id 10602, seq 238, length 64
00:00:01.197089 IP 10.0.1.1 > 10.0.2.2: ICMP echo request, id 10602, seq 239, length 64
00:00:01.202124 IP 10.0.1.1 > 10.0.2.2: ICMP echo request, id 10602, seq 240, length 64
00:00:01.207114 IP 10.0.1.1 > 10.0.2.2: ICMP echo request, id 10602, seq 241, length 64
00:00:01.212091 IP 10.0.1.1 > 10.0.2.2: ICMP echo request, id 10602, seq 242, length 64
00:00:01.217360 IP 10.0.1.1 > 10.0.2.2: ICMP echo request, id 10602, seq 243, length 64
00:00:01.222057 IP 10.0.1.1 > 10.0.2.2: ICMP echo request, id 10602, seq 244, length 64
00:00:01.227115 IP 10.0.1.1 > 10.0.2.2: ICMP echo request, id 10602, seq 245, length 64
00:00:01.232043 IP 10.0.1.1 > 10.0.2.2: ICMP echo request, id 10602, seq 246, length 64
00:00:01.237376 IP 10.0.1.1 > 10.0.2.2: ICMP echo request, id 10602, seq 247, length 64
00:00:01.242387 IP 10.0.1.1 > 10.0.2.2: ICMP echo request, id 10602, seq 248, length 64
00:00:01.247206 IP 10.0.1.1 > 10.0.2.2: ICMP echo request, id 10602, seq 249, length 64
00:00:01.252237 IP 10.0.1.1 > 10.0.2.2: ICMP echo request, id 10602, seq 250, length 64
00:00:01.257726 IP 10.0.1.1 > 10.0.2.2: ICMP echo request, id 10602, seq 251, length 64
00:00:01.262246 IP 10.0.1.1 > 10.0.2.2: ICMP echo request, id 10602, seq 252, length 64
00:00:01.267208 IP 10.0.1.1 > 10.0.2.2: ICMP echo request, id 10602, seq 253, length 64
00:00:01.272103 IP 10.0.1.1 > 10.0.2.2: ICMP echo request, id 10602, seq 254, length 64
00:00:01.277177 IP 10.0.1.1 > 10.0.2.2: ICMP echo request, id 10602, seq 255, length 64
00:00:01.282176 IP 10.0.1.1 > 10.0.2.2: ICMP echo request, id 10602, seq 256, length 64
00:00:01.287134 IP 10.0.1.1 > 10.0.2.2: ICMP echo request, id 10602, seq 257, length 64
00:00:01.292145 IP 10.0.1.1 > 10.0.2.2: ICMP echo request, id 10602, seq 258, length 64
00:00:01.297590 IP 10.0.1.1 > 10.0.2.2: ICMP echo request, id 10602, seq 259, length 64
00:00:01.302269 IP 10.0.1.1 > 10.0.2.2: ICMP echo request, id 10602, seq 260, length 64
00:00:01.307230 IP 10.0.1.1 > 10.0.2.2: ICMP echo request, id 10602, seq 261, length 64
00:00:01.312204 IP 10.0.1.1 > 10.0.2.2: ICMP echo request, id 10602, seq 262, length 64
00:00:01.317196 IP 10.0.1.1 > 10.0.2.2: ICMP echo request, id 10602, seq 263, length 64
00:00:01.322182 IP 10.0.1.1 > 10.0.2.2: ICMP echo request, id 10602, seq 264, length 64
00:00:01.327064 IP 10.0.1.1 > 10.0.2.2: ICMP echo request, id 10602, seq 265, length 64
00:00:01.332105 IP 10.0.1.1 > 10.0.2.2: ICMP echo request, id 10602, seq 266, length 64
00:00:01.337116 IP 10.0.1.1 > 10.0.2.2: ICMP echo request, id 10602, seq 267, length 64
00:00:01.342089 IP 10.0.1.1 > 10.0.2.2: ICMP echo request, id 10602, seq 268, length 64
00:00:01.347108 IP 10.0.1.1 > 10.0.2.2: ICMP echo request, id 10602, seq 269, length 64
00:00:01.352246 IP 10.0.1.1 > 10.0.2.2: ICMP echo request, id 10602, seq 270, length 64
00:00:01.357494 IP 10.0.1.1 > 10.0.2.2: ICMP echo request, id 10602, seq 271, length 64
00:00:01.362231 IP 10.0.1.1 > 10.0.2.2: ICMP echo request, id 10602, seq 272, length 64
00:00:01.367542 IP 10.0.1.1 > 10.0.2.2: ICMP echo request, id 10602, seq 273, length 64
00:00:01.372564 IP 10.0.1.1 > 10.0.2.2: ICMP echo request, id 10602, seq 274, length 64
00:00:01.377314 IP 10.0.1.1 > 10.0.2.2: ICMP echo request, id 10602, seq 275, length 64
00:00:01.382148 IP 10.0.1.1 > 10.0.2.2: ICMP echo request, id 10602, seq 276, length 64
00:00:01.387175 IP 10.0.1.1 > 10.0.2.2: ICMP echo request, id 10602, seq 277, length 64
00:00:01.392074 IP 10.0.1.1 > 10.0.2.2: ICMP echo request, id 10602, seq 278, length 64
00:00:01.397248 IP 10.0.1.1 > 10.0.2.2: ICMP echo request, id 10602, seq 279, length 64
00:00:01.402081 IP 10.0.1.1 > 10.0.2.2: ICMP echo request, id 10602, seq 280, length 64
00:00:01.407078 IP 10.0.1.1 > 10.0.2.2: ICMP echo request, id 10602, seq 281, length 64
00:00:01.412057 IP 10.0.1.1 > 10.0.2.2: ICMP echo request, id 10602, seq 282, length 64
00:00:01.417189 IP 10.0.1.1 > 10.0.2.2: ICMP echo request, id 10602, seq 283, length 64
00:00:01.422432 IP 10.0.1.1 > 10.0.2.2: ICMP echo request, id 10602, seq 284, length 64
00:00:01.427234 IP 10.0.1.1 > 10.0.2.2: ICMP echo request, id 10602, seq 285, length 64
00:00:01.432199 IP 10.0.1.1 > 10.0.2.2: ICMP echo request, id 10602, seq 286, length 64
00:00:01.437194 IP 10.0.1.1 > 10.0.2.2: ICMP echo request, id 10602, seq 287, length 64
00:00:01.442236 IP 10.0.1.1 > 10.0.2.2: ICMP echo request, id 10602, seq 288, length 64
00:00:01.447207 IP 10.0.1.1 > 10.0.2.2: ICMP echo request, id 10602, seq 289, length 64
00:00:01.452367 IP 10.0.1.1 > 10.0.2.2: ICMP echo request, id 10602, seq 290, length 64
00:00:01.457410 IP 10.0.1.1 > 10.0.2.2: ICMP echo request, id 10602, seq 291, length 64
00:00:01.462302 IP 10.0.1.1 > 10.0.2.2: ICMP echo request, id 10602, seq 292, length 64
00:00:01.467264 IP 10.0.1.1 > 10.0.2.2: ICMP echo request, id 10602, seq 293, length 64
00:00:01.472381 IP 10.0.1.1 > 10.0.2.2: ICMP echo request, id 10602, seq 294, length 64
00:00:01.477221 IP 10.0.1.1 > 10.0.2.2: ICMP echo request, id 10602, seq 295, length 64
00:00:01.482208 IP 10.0.1.1 > 10.0.2.2: ICMP echo request, id 10602, seq 296, length 64
00:00:01.487200 IP 10.0.1.1 > 10.0.2.2: ICMP echo request, id 10602, seq 297, length 64
00:00:01.492268 IP 10.0.1.1 > 10.0.2.2: ICMP echo request, id 10602, seq 298, length 64
00:00:01.497320 IP 10.0.1.1 > 10.0.2.2: ICMP echo request, id 10602, seq 299, length 64
00:00:01.502200 IP 10.0.1.1 > 10.0.2.2: ICMP echo request, id 10602, seq 300, length 64
00:00:01.507260 IP 10.0.1.1 > 10.0.2.2: ICMP echo request, id 10602, seq 301, length 64
00:00:01.512290 IP 10.0.1.1 > 10.0.2.2: ICMP echo request, id 10602, seq 302, length 64
00:00:01.517206 IP 10.0.1.1 > 10.0.2.2: ICMP echo request, id 10602, seq 303, length 64
00:00:01.522255 IP 10.0.1.1 > 10.0.2.2: ICMP echo request, id 10602, seq 304, length 64
00:00:01.527229 IP 10.0.1.1 > 10.0.2.2: ICMP echo request, id 10602, seq 305, length 64
00:00:01.532195 IP 10.0.1.1 > 10.0.2.2: ICMP echo request, id 10602, seq 306, length 64
00:00:01.537226 IP 10.0.1.1 > 10.0.2.2: ICMP echo request, id 10602, seq 307, length 64
00:00:01.542227 IP 10.0.1.1 > 10.0.2.2: ICMP echo request, id 10602, seq 308, length 64
00:00:01.547267 IP 10.0.1.1 > 10.0.2.2: ICMP echo request, id 10602, seq 309, length 64
00:00:01.552551 IP 10.0.1.1 > 10.0.2.2: ICMP echo request, id 10602, seq 310, length 64
00:00:01.557378 IP 10.0.1.1 > 10.0.2.2: ICMP echo request, id 10602, seq 311, length 64
00:00:01.562224 IP 10.0.1.1 > 10.0.2.2: ICMP echo request, id 10602, seq 312, length 64
00:00:01.567222 IP 10.0.1.1 > 10.0.2.2: ICMP echo request, id 10602, seq 313, length 64
00:00:01.572231 IP 10.0.1.1 > 10.0.2.2: ICMP echo request, id 10602, seq 314, length 64
00:00:01.577274 IP 10.0.1.1 > 10.0.2.2: ICMP echo request, id 10602, seq 315, length 64
00:00:01.582236 IP 10.0.1.1 > 10.0.2.2: ICMP echo request, id 10602, seq 316, length 64
00:00:01.587258 IP 10.0.1.1 > 10.0.2.2: ICMP echo request, id 10602, seq 317, length 64
00:00:01.592295 IP 10.0.1.1 > 10.0.2.2: ICMP echo request, id 10602, seq 318, length 64
00:00:01.597239 IP 10.0.1.1 > 10.0.2.2: ICMP echo request, id 10602, seq 319, length 64
00:00:01.602230 IP 10.0.1.1 > 10.0.2.2: ICMP echo request, id 10602, seq 320, length 64
00:00:01.607296 IP 10.0.1.1 > 10.0.2.2: ICMP echo request, id 10602, seq 321, length 64
00:00:01.612236 IP 10.0.1.1 > 10.0.2.2: ICMP echo request, id 10602, seq 322, length 64
00:00:01.617233 IP 10.0.1.1 > 10.0.2.2: ICMP echo request, id 10602, seq 323, length 64
00:00:01.622247 IP 10.0.1.1 > 10.0.2.2: ICMP echo request, id 10602, seq 324, length 64
00:00:01.627245 IP 10.0.1.1 > 10.0.2.2: ICMP echo request, id 10602, seq 325, length 64
00:00:01.632242 IP 10.0.1.1 > 10.0.2.2: ICMP echo request, id 10602, seq 326, length 64
00:00:01.637229 IP 10.0.1.1 > 10.0.2.2: ICMP echo request, id 10602, seq 327, length 64
00:00:01.642262 IP 10.0.1.1 > 10.0.2.2: ICMP echo request, id 10602, seq 328, length 64
00:00:01.647237 IP 10.0.1.1 > 10.0.2.2: ICMP echo request, id 10602, seq 329, length 64
00:00:01.651269 IP 10.0.1.1 > 10.0.2.2: ICMP echo request, id 10602, seq 330, length 64
00:00:01.656398 IP 10.0.1.1 > 10.0.2.2: ICMP echo request, id 10602, seq 331, length 64
00:00:01.661368 IP 10.0.1.1 > 10.0.2.2: ICMP echo request, id 10602, seq 332, length 64
00:00:01.666340 IP 10.0.1.1 > 10.0.2.2: ICMP echo request, id 10602, seq 333, length 64
00:00:01.671554 IP 10.0.1.1 > 10.0.2.2: ICMP echo request, id 10602, seq 334, length 64
00:00:01.676568 IP 10.0.1.1 > 10.0.2.2: ICMP echo request, id 10602, seq 335, length 64
00:00:01.681233 IP 10.0.1.1 > 10.0.2.2: ICMP echo request, id 10602, seq 336, length 64
00:00:01.686218 IP 10.0.1.1 > 10.0.2.2: ICMP echo request, id 10602, seq 337, length 64
00:00:01.691231 IP 10.0.1.1 > 10.0.2.2: ICMP echo request, id 10602, seq 338, length 64
00:00:01.696209 IP 10.0.1.1 > 10.0.2.2: ICMP echo request, id 10602, seq 339, length 64
00:00:01.701621 IP 10.0.1.1 > 10.0.2.2: ICMP echo request, id 10602, seq 340, length 64
00:00:01.706306 IP 10.0.1.1 > 10.0.2.2: ICMP echo request, id 10602, seq 341, length 64
00:00:01.711369 IP 10.0.1.1 > 10.0.2.2: ICMP echo request, id 10602, seq 342, length 64
00:00:01.716510 IP 10.0.1.1 > 10.0.2.2: ICMP echo request, id 10602, seq 343, length 64
00:00:01.721516 IP 10.0.1.1 > 10.0.2.2: ICMP echo request, id 10602, seq 344, length 64
00:00:01.726481 IP 10.0.1.1 > 10.0.2.2: ICMP echo request, id 10602, seq 345, length 64
00:00:01.731506 IP 10.0.1.1 > 10.0.2.2: ICMP echo request, id 10602, seq 346, length 64
00:00:01.736678 IP 10.0.1.1 > 10.0.2.2: ICMP echo request, id 10602, seq 347, length 64
00:00:01.741657 IP 10.0.1.1 > 10.0.2.2: ICMP echo request, id 10602, seq 348, length 64
00:00:01.746530 IP 10.0.1.1 > 10.0.2.2: ICMP echo request, id 10602, seq 349, length 64
00:00:01.751575 IP 10.0.1.1 > 10.0.2.2: ICMP echo request, id 10602, seq 350, length 64
00:00:01.757081 IP 10.0.1.1 > 10.0.2.2: ICMP echo request, id 10602, seq 351, length 64
00:00:01.761478 IP 10.0.1.1 > 10.0.2.2: ICMP echo request, id 10602, seq 352, length 64
00:00:01.766523 IP 10.0.1.1 > 10.0.2.2: ICMP echo request, id 10602, seq 353, length 64
00:00:01.771566 IP 10.0.1.1 > 10.0.2.2: ICMP echo request, id 10602, seq 354, length 64
00:00:01.776521 IP 10.0.1.1 > 10.0.2.2: ICMP echo request, id 10602, seq 355, length 64
00:00:01.781605 IP 10.0.1.1 > 10.0.2.2: ICMP echo request, id 10602, seq 356, length 64
00:00:01.786526 IP 10.0.1.1 > 10.0.2.2: ICMP echo request, id 10602, seq 357, length 64
00:00:01.791503 IP 10.0.1.1 > 10.0.2.2: ICMP echo request, id 10602, seq 358, length 64
00:00:01.796613 IP 10.0.1.1 > 10.0.2.2: ICMP echo request, id 10602, seq 359, length 64
00:00:01.801541 IP 10.0.1.1 > 10.0.2.2: ICMP echo request, id 10602, seq 360, length 64
00:00:01.806461 IP 10.0.1.1 > 10.0.2.2: ICMP echo request, id 10602, seq 361, length 64
00:00:01.811448 IP 10.0.1.1 > 10.0.2.2: ICMP echo request, id 10602, seq 362, length 64
00:00:01.816442 IP 10.0.1.1 > 10.0.2.2: ICMP echo request, id 10602, seq 363, length 64
00:00:01.821422 IP 10.0.1.1 > 10.0.2.2: ICMP echo request, id 10602, seq 364, length 64
00:00:01.826422 IP 10.0.1.1 > 10.0.2.2: ICMP echo request, id 10602, seq 365, length 64
00:00:01.831409 IP 10.0.1.1 > 10.0.2.2: ICMP echo request, id 10602, seq 366, length 64
00:00:01.836505 IP 10.0.1.1 > 10.0.2.2: ICMP echo request, id 10602, seq 367, length 64
00:00:01.841357 IP 10.0.1.1 > 10.0.2.2: ICMP echo request, id 10602, seq 368, length 64
00:00:01.846325 IP 10.0.1.1 > 10.0.2.2: ICMP echo request, id 10602, seq 369, length 64
00:00:01.851524 IP 10.0.1.1 > 10.0.2.2: ICMP echo request, id 10602, seq 370, length 64
00:00:01.856593 IP 10.0.1.1 > 10.0.2.2: ICMP echo request, id 10602, seq 371, length 64
00:00:01.861644 IP 10.0.1.1 > 10.0.2.2: ICMP echo request, id 10602, seq 372, length 64
00:00:01.866449 IP 10.0.1.1 > 10.0.2.2: ICMP echo request, id 10602, seq 373, length 64
00:00:01.871540 IP 10.0.1.1 > 10.0.2.2: ICMP echo request, id 10602, seq 374, length 64
00:00:01.876899 IP 10.0.1.1 > 10.0.2.2: ICMP echo request, id 10602, seq 375, length 64
00:00:01.881780 IP 10.0.1.1 > 10.0.2.2: ICMP echo request, id 10602, seq 376, length 64
00:00:01.886507 IP 10.0.1.1 > 10.0.2.2: ICMP echo request, id 10602, seq 377, length 64
00:00:01.891441 IP 10.0.1.1 > 10.0.2.2: ICMP echo request, id 10602, seq 378, length 64
00:00:01.896641 IP 10.0.1.1 > 10.0.2.2: ICMP echo request, id 10602, seq 379, length 64
00:00:01.901462 IP 10.0.1.1 > 10.0.2.2: ICMP echo request, id 10602, seq 380, length 64
00:00:01.906479 IP 10.0.1.1 > 10.0.2.2: ICMP echo request, id 10602, seq 381, length 64
00:00:01.911415 IP 10.0.1.1 > 10.0.2.2: ICMP echo request, id 10602, seq 382, length 64
00:00:01.916629 IP 10.0.1.1 > 10.0.2.2: ICMP echo request, id 10602, seq 383, length 64
00:00:01.921459 IP 10.0.1.1 > 10.0.2.2: ICMP echo request, id 10602, seq 384, length 64
00:00:01.926401 IP 10.0.1.1 > 10.0.2.2: ICMP echo request, id 10602, seq 385, length 64
00:00:01.931361 IP 10.0.1.1 > 10.0.2.2: ICMP echo request, id 10602, seq 386, length 64
00:00:01.936475 IP 10.0.1.1 > 10.0.2.2: ICMP echo request, id 10602, seq 387, length 64
00:00:01.941362 IP 10.0.1.1 > 10.0.2.2: ICMP echo request, id 10602, seq 388, length 64
00:00:01.946470 IP 10.0.1.1 > 10.0.2.2: ICMP echo request, id 10602, seq 389, length 64
00:00:01.951400 IP 10.0.1.1 > 10.0.2.2: ICMP echo request, id 10602, seq 390, length 64
00:00:01.956595 IP 10.0.1.1 > 10.0.2.2: ICMP echo request, id 10602, seq 391, length 64
00:00:01.961446 IP 10.0.1.1 > 10.0.2.2: ICMP echo request, id 10602, seq 392, length 64
00:00:01.966393 IP 10.0.1.1 > 10.0.2.2: ICMP echo request, id 10602, seq 393, length 64
00:00:01.971365 IP 10.0.1.1 > 10.0.2.2: ICMP echo request, id 10602, seq 394, length 64
00:00:01.976450 IP 10.0.1.1 > 10.0.2.2: ICMP echo request, id 10602, seq 395, length 64
00:00:01.981374 IP 10.0.1.1 > 10.0.2.2: ICMP echo request, id 10602, seq 396, length 64
00:00:01.986355 IP 10.0.1.1 > 10.0.2.2: ICMP echo request, id 10602, seq 397, length 64
00:00:01.991340 IP 10.0.1.1 > 10.0.2.2: ICMP echo request, id 10602, seq 398, length 64
00:00:01.996436 IP 10.0.1.1 > 10.0.2.2: ICMP echo request, id 10602, seq 399, length 64
00:00:02.001311 IP 10.0.1.1 > 10.0.2.2: ICMP echo request, id 10602, seq 400, length 64
00:00:02.006448 IP 10.0.1.1 > 10.0.2.2: ICMP echo request, id 10602, seq 401, length 64
00:00:02.011633 IP 10.0.1.1 > 10.0.2.2: ICMP echo request, id 10602, seq 402, length 64
00:00:02.016493 IP 10.0.1.1 > 10.0.2.2: ICMP echo request, id 10602, seq 403, length 64
00:00:02.021465 IP 10.0.1.1 > 10.0.2.2: ICMP echo request, id 10602, seq 404, length 64
00:00:02.026391 IP 10.0.1.1 > 10.0.2.2: ICMP echo request, id 10602, seq 405, length 64
00:00:02.031365 IP 10.0.1.1 > 10.0.2.2: ICMP echo request, id 10602, seq 406, length 64
00:00:02.036389 IP 10.0.1.1 > 10.0.2.2: ICMP echo request, id 10602, seq 407, length 64
00:00:02.041338 IP 10.0.1.1 > 10.0.2.2: ICMP echo request, id 10602, seq 408, length 64
00:00:02.046306 IP 10.0.1.1 > 10.0.2.2: ICMP echo request, id 10602, seq 409, length 64
00:00:02.051396 IP 10.0.1.1 > 10.0.2.2: ICMP echo request, id 10602, seq 410, length 64
00:00:02.056380 IP 10.0.1.1 > 10.0.2.2: ICMP echo request, id 10602, seq 411, length 64
00:00:02.061350 IP 10.0.1.1 > 10.0.2.2: ICMP echo request, id 10602, seq 412, length 64
00:00:02.066391 IP 10.0.1.1 > 10.0.2.2: ICMP echo request, id 10602, seq 413, length 64
00:00:02.071459 IP 10.0.1.1 > 10.0.2.2: ICMP echo request, id 10602, seq 414, length 64
00:00:02.076374 IP 10.0.1.1 > 10.0.2.2: ICMP echo request, id 10602, seq 415, length 64
00:00:02.081357 IP 10.0.1.1 > 10.0.2.2: ICMP echo request, id 10602, seq 416, length 64
00:00:02.086345 IP 10.0.1.1 > 10.0.2.2: ICMP echo request, id 10602, seq 417, length 64
00:00:02.091370 IP 10.0.1.1 > 10.0.2.2: ICMP echo request, id 10602, seq 418, length 64
00:00:02.096267 IP 10.0.1.1 > 10.0.2.2: ICMP echo request, id 10602, seq 419, length 64
00:00:02.101262 IP 10.0.1.1 > 10.0.2.2: ICMP echo request, id 10602, seq 420, length 64
00:00:02.106250 IP 10.0.1.1 > 10.0.2.2: ICMP echo request, id 10602, seq 421, length 64
00:00:02.111297 IP 10.0.1.1 > 10.0.2.2: ICMP echo request, id 10602, seq 422, length 64
00:00:02.116265 IP 10.0.1.1 > 10.0.2.2: ICMP echo request, id 10602, seq 423, length 64
00:00:02.121256 IP 10.0.1.1 > 10.0.2.2: ICMP echo request, id 10602, seq 424, length 64
00:00:02.126288 IP 10.0.1.1 > 10.0.2.2: ICMP echo request, id 10602, seq 425, length 64
00:00:02.131256 IP 10.0.1.1 > 10.0.2.2: ICMP echo request, id 10602, seq 426, length 64
00:00:02.136253 IP 10.0.1.1 > 10.0.2.2: ICMP echo request, id 10602, seq 427, length 64
00:00:02.141321 IP 10.0.1.1 > 10.0.2.2: ICMP echo request, id 10602, seq 428, length 64
00:00:02.146261 IP 10.0.1.1 > 10.0.2.2: ICMP echo request, id 10602, seq 429, length 64
00:00:02.151756 IP 10.0.1.1 > 10.0.2.2: ICMP echo request, id 10602, seq 430, length 64
00:00:02.156722 IP 10.0.1.1 > 10.0.2.2: ICMP echo request, id 10602, seq 431, length 64
00:00:02.161423 IP 10.0.1.1 > 10.0.2.2: ICMP echo request, id 10602, seq 432, length 64
00:00:02.166463 IP 10.0.1.1 > 10.0.2.2: ICMP echo request, id 10602, seq 433, length 64
00:00:02.171471 IP 10.0.1.1 > 10.0.2.2: ICMP echo request, id 10602, seq 434, length 64
00:00:02.176451 IP 10.0.1.1 > 10.0.2.2: ICMP echo request, id 10602, seq 435, length 64
00:00:02.181332 IP 10.0.1.1 > 10.0.2.2: ICMP echo request, id 10602, seq 436, length 64
00:00:02.186261 IP 10.0.1.1 > 10.0.2.2: ICMP echo request, id 10602, seq 437, length 64
00:00:02.191347 IP 10.0.1.1 > 10.0.2.2: ICMP echo request, id 10602, seq 438, length 64
00:00:02.196262 IP 10.0.1.1 > 10.0.2.2: ICMP echo request, id 10602, seq 439, length 64
00:00:02.201250 IP 10.0.1.1 > 10.0.2.2: ICMP echo request, id 10602, seq 440, length 64
00:00:02.206252 IP 10.0.1.1 > 10.0.2.2: ICMP echo request, id 10602, seq 441, length 64
00:00:02.211313 IP 10.0.1.1 > 10.0.2.2: ICMP echo request, id 10602, seq 442, length 64
00:00:02.216255 IP 10.0.1.1 > 10.0.2.2: ICMP echo request, id 10602, seq 443, length 64
00:00:02.221252 IP 10.0.1.1 > 10.0.2.2: ICMP echo request, id 10602, seq 444, length 64
00:00:02.226284 IP 10.0.1.1 > 10.0.2.2: ICMP echo request, id 10602, seq 445, length 64
00:00:02.231274 IP 10.0.1.1 > 10.0.2.2: ICMP echo request, id 10602, seq 446, length 64
00:00:02.236244 IP 10.0.1.1 > 10.0.2.2: ICMP echo request, id 10602, seq 447, length 64
00:00:02.241306 IP 10.0.1.1 > 10.0.2.2: ICMP echo request, id 10602, seq 448, length 64
00:00:02.246227 IP 10.0.1.1 > 10.0.2.2: ICMP echo request, id 10602, seq 449, length 64
00:00:02.251386 IP 10.0.1.1 > 10.0.2.2: ICMP echo request, id 10602, seq 450, length 64
00:00:02.256332 IP 10.0.1.1 > 10.0.2.2: ICMP echo request, id 10602, seq 451, length 64
00:00:02.261380 IP 10.0.1.1 > 10.0.2.2: ICMP echo request, id 10602, seq 452, length 64
00:00:02.266404 IP 10.0.1.1 > 10.0.2.2: ICMP echo request, id 10602, seq 453, length 64
00:00:02.271366 IP 10.0.1.1 > 10.0.2.2: ICMP echo request, id 10602, seq 454, length 64
00:00:02.276385 IP 10.0.1.1 > 10.0.2.2: ICMP echo request, id 10602, seq 455, length 64
