00:00:00.000000 IP 10.0.1.1 > 10.0.2.2: ICMP echo request, id 15516, seq 1, length 64
00:00:00.003678 IP 10.0.1.1 > 10.0.2.2: ICMP echo request, id 15516, seq 2, length 64
00:00:00.007431 IP 10.0.1.1 > 10.0.2.2: ICMP echo request, id 15516, seq 3, length 64
00:00:00.012513 IP 10.0.1.1 > 10.0.2.2: ICMP echo request, id 15516, seq 4, length 64
00:00:00.017411 IP 10.0.1.1 > 10.0.2.2: ICMP echo request, id 15516, seq 5, length 64
00:00:00.022380 IP 10.0.1.1 > 10.0.2.2: ICMP echo request, id 15516, seq 6, length 64
00:00:00.027354 IP 10.0.1.1 > 10.0.2.2: ICMP echo request, id 15516, seq 7, length 64
00:00:00.032436 IP 10.0.1.1 > 10.0.2.2: ICMP echo request, id 15516, seq 8, length 64
00:00:00.037327 IP 10.0.1.1 > 10.0.2.2: ICMP echo request, id 15516, seq 9, length 64
00:00:00.042317 IP 10.0.1.1 > 10.0.2.2: ICMP echo request, id 15516, seq 10, length 64
00:00:00.047331 IP 10.0.1.1 > 10.0.2.2: ICMP echo request, id 15516, seq 11, length 64
00:00:00.052329 IP 10.0.1.1 > 10.0.2.2: ICMP echo request, id 15516, seq 12, length 64
00:00:00.057368 IP 10.0.1.1 > 10.0.2.2: ICMP echo request, id 15516, seq 13, length 64
00:00:00.063633 IP 10.0.1.1 > 10.0.2.2: ICMP echo request, id 15516, seq 14, length 64
00:00:00.067340 IP 10.0.1.1 > 10.0.2.2: ICMP echo request, id 15516, seq 15, length 64
00:00:00.072400 IP 10.0.1.1 > 10.0.2.2: ICMP echo request, id 15516, seq 16, length 64
00:00:00.077360 IP 10.0.1.1 > 10.0.2.2: ICMP echo request, id 15516, seq 17, length 64
00:00:00.082329 IP 10.0.1.1 > 10.0.2.2: ICMP echo request, id 15516, seq 18, length 64
00:00:00.087320 IP 10.0.1.1 > 10.0.2.2: ICMP echo request, id 15516, seq 19, length 64
00:00:00.092358 IP 10.0.1.1 > 10.0.2.2: ICMP echo request, id 15516, seq 20, length 64
00:00:00.097282 IP 10.0.1.1 > 10.0.2.2: ICMP echo request, id 15516, seq 21, length 64
00:00:00.102306 IP 10.0.1.1 > 10.0.2.2: ICMP echo request, id 15516, seq 22, length 64
00:00:00.107301 IP 10.0.1.1 > 10.0.2.2: ICMP echo request, id 15516, seq 23, length 64
00:00:00.112285 IP 10.0.1.1 > 10.0.2.2: ICMP echo request, id 15516, seq 24, length 64
00:00:00.117306 IP 10.0.1.1 > 10.0.2.2: ICMP echo request, id 15516, seq 25, length 64
00:00:00.122525 IP 10.0.1.1 > 10.0.2.2: ICMP echo request, id 15516, seq 26, length 64
00:00:00.127313 IP 10.0.1.1 > 10.0.2.2: ICMP echo request, id 15516, seq 27, length 64
00:00:00.132428 IP 10.0.1.1 > 10.0.2.2: ICMP echo request, id 15516, seq 28, length 64
00:00:00.137347 IP 10.0.1.1 > 10.0.2.2: ICMP echo request, id 15516, seq 29, length 64
00:00:00.142797 IP 10.0.1.1 > 10.0.2.2: ICMP echo request, id 15516, seq 30, length 64
00:00:00.147312 IP 10.0.1.1 > 10.0.2.2: ICMP echo request, id 15516, seq 31, length 64
00:00:00.152317 IP 10.0.1.1 > 10.0.2.2: ICMP echo request, id 15516, seq 32, length 64
00:00:00.157331 IP 10.0.1.1 > 10.0.2.2: ICMP echo request, id 15516, seq 33, length 64
00:00:00.162513 IP 10.0.1.1 > 10.0.2.2: ICMP echo request, id 15516, seq 34, length 64
00:00:00.169200 IP 10.0.1.1 > 10.0.2.2: ICMP echo request, id 15516, seq 35, length 64
00:00:00.172146 IP 10.0.1.1 > 10.0.2.2: ICMP echo request, id 15516, seq 36, length 64
00:00:00.177065 IP 10.0.1.1 > 10.0.2.2: ICMP echo request, id 15516, seq 37, length 64
00:00:00.182316 IP 10.0.1.1 > 10.0.2.2: ICMP echo request, id 15516, seq 38, length 64
00:00:00.187146 IP 10.0.1.1 > 10.0.2.2: ICMP echo request, id 15516, seq 39, length 64
00:00:00.192110 IP 10.0.1.1 > 10.0.2.2: ICMP echo request, id 15516, seq 40, length 64
00:00:00.197235 IP 10.0.1.1 > 10.0.2.2: ICMP echo request, id 15516, seq 41, length 64
00:00:00.202260 IP 10.0.1.1 > 10.0.2.2: ICMP echo request, id 15516, seq 42, length 64
00:00:00.207137 IP 10.0.1.1 > 10.0.2.2: ICMP echo request, id 15516, seq 43, length 64
00:00:00.212194 IP 10.0.1.1 > 10.0.2.2: ICMP echo request, id 15516, seq 44, length 64
00:00:00.218012 IP 10.0.1.1 > 10.0.2.2: ICMP echo request, id 15516, seq 45, length 64
00:00:00.222408 IP 10.0.1.1 > 10.0.2.2: ICMP echo request, id 15516, seq 46, length 64
00:00:00.227236 IP 10.0.1.1 > 10.0.2.2: ICMP echo request, id 15516, seq 47, length 64
00:00:00.232455 IP 10.0.1.1 > 10.0.2.2: ICMP echo request, id 15516, seq 48, length 64
00:00:00.237410 IP 10.0.1.1 > 10.0.2.2: ICMP echo request, id 15516, seq 49, length 64
00:00:00.245433 IP 10.0.1.1 > 10.0.2.2: ICMP echo request, id 15516, seq 50, length 64
00:00:00.247912 IP 10.0.1.1 > 10.0.2.2: ICMP echo request, id 15516, seq 51, length 64
00:00:00.252927 IP 10.0.1.1 > 10.0.2.2: ICMP echo request, id 15516, seq 52, length 64
00:00:00.257976 IP 10.0.1.1 > 10.0.2.2: ICMP echo request, id 15516, seq 53, length 64
00:00:00.263015 IP 10.0.1.1 > 10.0.2.2: ICMP echo request, id 15516, seq 54, length 64
00:00:00.267846 IP 10.0.1.1 > 10.0.2.2: ICMP echo request, id 15516, seq 55, length 64
00:00:00.272944 IP 10.0.1.1 > 10.0.2.2: ICMP echo request, id 15516, seq 56, length 64
00:00:00.278260 IP 10.0.1.1 > 10.0.2.2: ICMP echo request, id 15516, seq 57, length 64
00:00:00.284314 IP 10.0.1.1 > 10.0.2.2: ICMP echo request, id 15516, seq 58, length 64
00:00:00.287858 IP 10.0.1.1 > 10.0.2.2: ICMP echo request, id 15516, seq 59, length 64
00:00:00.292760 IP 10.0.1.1 > 10.0.2.2: ICMP echo request, id 15516, seq 60, length 64
00:00:00.297883 IP 10.0.1.1 > 10.0.2.2: ICMP echo request, id 15516, seq 61, length 64
00:00:00.303018 IP 10.0.1.1 > 10.0.2.2: ICMP echo request, id 15516, seq 62, length 64
00:00:00.308005 IP 10.0.1.1 > 10.0.2.2: ICMP echo request, id 15516, seq 63, length 64
00:00:00.312778 IP 10.0.1.1 > 10.0.2.2: ICMP echo request, id 15516, seq 64, length 64
00:00:00.317949 IP 10.0.1.1 > 10.0.2.2: ICMP echo request, id 15516, seq 65, length 64
00:00:00.322748 IP 10.0.1.1 > 10.0.2.2: ICMP echo request, id 15516, seq 66, length 64
00:00:00.327818 IP 10.0.1.1 > 10.0.2.2: ICMP echo request, id 15516, seq 67, length 64
00:00:00.332926 IP 10.0.1.1 > 10.0.2.2: ICMP echo request, id 15516, seq 68, length 64
00:00:00.337746 IP 10.0.1.1 > 10.0.2.2: ICMP echo request, id 15516, seq 69, length 64
00:00:00.342764 IP 10.0.1.1 > 10.0.2.2: ICMP echo request, id 15516, seq 70, length 64
00:00:00.346804 IP 10.0.1.1 > 10.0.2.2: ICMP echo request, id 15516, seq 71, length 64
00:00:00.352003 IP 10.0.1.1 > 10.0.2.2: ICMP echo request, id 15516, seq 72, length 64
00:00:00.356730 IP 10.0.1.1 > 10.0.2.2: ICMP echo request, id 15516, seq 73, length 64
00:00:00.361808 IP 10.0.1.1 > 10.0.2.2: ICMP echo request, id 15516, seq 74, length 64
00:00:00.366921 IP 10.0.1.1 > 10.0.2.2: ICMP echo request, id 15516, seq 75, length 64
00:00:00.371917 IP 10.0.1.1 > 10.0.2.2: ICMP echo request, id 15516, seq 76, length 64
00:00:00.376725 IP 10.0.1.1 > 10.0.2.2: ICMP echo request, id 15516, seq 77, length 64
00:00:00.382006 IP 10.0.1.1 > 10.0.2.2: ICMP echo request, id 15516, seq 78, length 64
00:00:00.386871 IP 10.0.1.1 > 10.0.2.2: ICMP echo request, id 15516, seq 79, length 64
00:00:00.391749 IP 10.0.1.1 > 10.0.2.2: ICMP echo request, id 15516, seq 80, length 64
00:00:00.396811 IP 10.0.1.1 > 10.0.2.2: ICMP echo request, id 15516, seq 81, length 64
00:00:00.401887 IP 10.0.1.1 > 10.0.2.2: ICMP echo request, id 15516, seq 82, length 64
00:00:00.406716 IP 10.0.1.1 > 10.0.2.2: ICMP echo request, id 15516, seq 83, length 64
00:00:00.411811 IP 10.0.1.1 > 10.0.2.2: ICMP echo request, id 15516, seq 84, length 64
00:00:00.417030 IP 10.0.1.1 > 10.0.2.2: ICMP echo request, id 15516, seq 85, length 64
00:00:00.421766 IP 10.0.1.1 > 10.0.2.2: ICMP echo request, id 15516, seq 86, length 64
00:00:00.426742 IP 10.0.1.1 > 10.0.2.2: ICMP echo request, id 15516, seq 87, length 64
00:00:00.432014 IP 10.0.1.1 > 10.0.2.2: ICMP echo request, id 15516, seq 88, length 64
00:00:00.436906 IP 10.0.1.1 > 10.0.2.2: ICMP echo request, id 15516, seq 89, length 64
00:00:00.441738 IP 10.0.1.1 > 10.0.2.2: ICMP echo request, id 15516, seq 90, length 64
00:00:00.446823 IP 10.0.1.1 > 10.0.2.2: ICMP echo request, id 15516, seq 91, length 64
00:00:00.452024 IP 10.0.1.1 > 10.0.2.2: ICMP echo request, id 15516, seq 92, length 64
00:00:00.457205 IP 10.0.1.1 > 10.0.2.2: ICMP echo request, id 15516, seq 93, length 64
00:00:00.461793 IP 10.0.1.1 > 10.0.2.2: ICMP echo request, id 15516, seq 94, length 64
00:00:00.466966 IP 10.0.1.1 > 10.0.2.2: ICMP echo request, id 15516, seq 95, length 64
00:00:00.471797 IP 10.0.1.1 > 10.0.2.2: ICMP echo request, id 15516, seq 96, length 64
00:00:00.476788 IP 10.0.1.1 > 10.0.2.2: ICMP echo request, id 15516, seq 97, length 64
00:00:00.482024 IP 10.0.1.1 > 10.0.2.2: ICMP echo request, id 15516, seq 98, length 64
00:00:00.486826 IP 10.0.1.1 > 10.0.2.2: ICMP echo request, id 15516, seq 99, length 64
00:00:00.491676 IP 10.0.1.1 > 10.0.2.2: ICMP echo request, id 15516, seq 100, length 64
00:00:00.496758 IP 10.0.1.1 > 10.0.2.2: ICMP echo request, id 15516, seq 101, length 64
00:00:00.501825 IP 10.0.1.1 > 10.0.2.2: ICMP echo request, id 15516, seq 102, length 64
00:00:00.506754 IP 10.0.1.1 > 10.0.2.2: ICMP echo request, id 15516, seq 103, length 64
00:00:00.511721 IP 10.0.1.1 > 10.0.2.2: ICMP echo request, id 15516, seq 104, length 64
00:00:00.517008 IP 10.0.1.1 > 10.0.2.2: ICMP echo request, id 15516, seq 105, length 64
00:00:00.521819 IP 10.0.1.1 > 10.0.2.2: ICMP echo request, id 15516, seq 106, length 64
00:00:00.526788 IP 10.0.1.1 > 10.0.2.2: ICMP echo request, id 15516, seq 107, length 64
00:00:00.532010 IP 10.0.1.1 > 10.0.2.2: ICMP echo request, id 15516, seq 108, length 64
00:00:00.536773 IP 10.0.1.1 > 10.0.2.2: ICMP echo request, id 15516, seq 109, length 64
00:00:00.541670 IP 10.0.1.1 > 10.0.2.2: ICMP echo request, id 15516, seq 110, length 64
00:00:00.546914 IP 10.0.1.1 > 10.0.2.2: ICMP echo request, id 15516, seq 111, length 64
00:00:00.551880 IP 10.0.1.1 > 10.0.2.2: ICMP echo request, id 15516, seq 112, length 64
00:00:00.556720 IP 10.0.1.1 > 10.0.2.2: ICMP echo request, id 15516, seq 113, length 64
00:00:00.561785 IP 10.0.1.1 > 10.0.2.2: ICMP echo request, id 15516, seq 114, length 64
00:00:00.566869 IP 10.0.1.1 > 10.0.2.2: ICMP echo request, id 15516, seq 115, length 64
00:00:00.571680 IP 10.0.1.1 > 10.0.2.2: ICMP echo request, id 15516, seq 116, length 64
00:00:00.576722 IP 10.0.1.1 > 10.0.2.2: ICMP echo request, id 15516, seq 117, length 64
00:00:00.581847 IP 10.0.1.1 > 10.0.2.2: ICMP echo request, id 15516, seq 118, length 64
00:00:00.586909 IP 10.0.1.1 > 10.0.2.2: ICMP echo request, id 15516, seq 119, length 64
00:00:00.591735 IP 10.0.1.1 > 10.0.2.2: ICMP echo request, id 15516, seq 120, length 64
00:00:00.596856 IP 10.0.1.1 > 10.0.2.2: ICMP echo request, id 15516, seq 121, length 64
00:00:00.601963 IP 10.0.1.1 > 10.0.2.2: ICMP echo request, id 15516, seq 122, length 64
00:00:00.606775 IP 10.0.1.1 > 10.0.2.2: ICMP echo request, id 15516, seq 123, length 64
00:00:00.611972 IP 10.0.1.1 > 10.0.2.2: ICMP echo request, id 15516, seq 124, length 64
00:00:00.616996 IP 10.0.1.1 > 10.0.2.2: ICMP echo request, id 15516, seq 125, length 64
00:00:00.621840 IP 10.0.1.1 > 10.0.2.2: ICMP echo request, id 15516, seq 126, length 64
00:00:00.626835 IP 10.0.1.1 > 10.0.2.2: ICMP echo request, id 15516, seq 127, length 64
00:00:00.631994 IP 10.0.1.1 > 10.0.2.2: ICMP echo request, id 15516, seq 128, length 64
00:00:00.636880 IP 10.0.1.1 > 10.0.2.2: ICMP echo request, id 15516, seq 129, length 64
00:00:00.641934 IP 10.0.1.1 > 10.0.2.2: ICMP echo request, id 15516, seq 130, length 64
00:00:00.647012 IP 10.0.1.1 > 10.0.2.2: ICMP echo request, id 15516, seq 131, length 64
00:00:00.651975 IP 10.0.1.1 > 10.0.2.2: ICMP echo request, id 15516, seq 132, length 64
00:00:00.656867 IP 10.0.1.1 > 10.0.2.2: ICMP echo request, id 15516, seq 133, length 64
00:00:00.661734 IP 10.0.1.1 > 10.0.2.2: ICMP echo request, id 15516, seq 134, length 64
00:00:00.667003 IP 10.0.1.1 > 10.0.2.2: ICMP echo request, id 15516, seq 135, length 64
00:00:00.671770 IP 10.0.1.1 > 10.0.2.2: ICMP echo request, id 15516, seq 136, length 64
00:00:00.676781 IP 10.0.1.1 > 10.0.2.2: ICMP echo request, id 15516, seq 137, length 64
00:00:00.682001 IP 10.0.1.1 > 10.0.2.2: ICMP echo request, id 15516, seq 138, length 64
00:00:00.686859 IP 10.0.1.1 > 10.0.2.2: ICMP echo request, id 15516, seq 139, length 64
00:00:00.691740 IP 10.0.1.1 > 10.0.2.2: ICMP echo request, id 15516, seq 140, length 64
00:00:00.696826 IP 10.0.1.1 > 10.0.2.2: ICMP echo request, id 15516, seq 141, length 64
00:00:00.701929 IP 10.0.1.1 > 10.0.2.2: ICMP echo request, id 15516, seq 142, length 64
00:00:00.706762 IP 10.0.1.1 > 10.0.2.2: ICMP echo request, id 15516, seq 143, length 64
00:00:00.711740 IP 10.0.1.1 > 10.0.2.2: ICMP echo request, id 15516, seq 144, length 64
00:00:00.717495 IP 10.0.1.1 > 10.0.2.2: ICMP echo request, id 15516, seq 145, length 64
00:00:00.721971 IP 10.0.1.1 > 10.0.2.2: ICMP echo request, id 15516, seq 146, length 64
00:00:00.726968 IP 10.0.1.1 > 10.0.2.2: ICMP echo request, id 15516, seq 147, length 64
00:00:00.732151 IP 10.0.1.1 > 10.0.2.2: ICMP echo request, id 15516, seq 148, length 64
00:00:00.737100 IP 10.0.1.1 > 10.0.2.2: ICMP echo request, id 15516, seq 149, length 64
00:00:00.741915 IP 10.0.1.1 > 10.0.2.2: ICMP echo request, id 15516, seq 150, length 64
00:00:00.747167 IP 10.0.1.1 > 10.0.2.2: ICMP echo request, id 15516, seq 151, length 64
00:00:00.752319 IP 10.0.1.1 > 10.0.2.2: ICMP echo request, id 15516, seq 152, length 64
00:00:00.757119 IP 10.0.1.1 > 10.0.2.2: ICMP echo request, id 15516, seq 153, length 64
00:00:00.762073 IP 10.0.1.1 > 10.0.2.2: ICMP echo request, id 15516, seq 154, length 64
00:00:00.767271 IP 10.0.1.1 > 10.0.2.2: ICMP echo request, id 15516, seq 155, length 64
00:00:00.772121 IP 10.0.1.1 > 10.0.2.2: ICMP echo request, id 15516, seq 156, length 64
00:00:00.776954 IP 10.0.1.1 > 10.0.2.2: ICMP echo request, id 15516, seq 157, length 64
00:00:00.782110 IP 10.0.1.1 > 10.0.2.2: ICMP echo request, id 15516, seq 158, length 64
00:00:00.787144 IP 10.0.1.1 > 10.0.2.2: ICMP echo request, id 15516, seq 159, length 64
00:00:00.791948 IP 10.0.1.1 > 10.0.2.2: ICMP echo request, id 15516, seq 160, length 64
00:00:00.797022 IP 10.0.1.1 > 10.0.2.2: ICMP echo request, id 15516, seq 161, length 64
00:00:00.802199 IP 10.0.1.1 > 10.0.2.2: ICMP echo request, id 15516, seq 162, length 64
00:00:00.807047 IP 10.0.1.1 > 10.0.2.2: ICMP echo request, id 15516, seq 163, length 64
00:00:00.812026 IP 10.0.1.1 > 10.0.2.2: ICMP echo request, id 15516, seq 164, length 64
00:00:00.817265 IP 10.0.1.1 > 10.0.2.2: ICMP echo request, id 15516, seq 165, length 64
00:00:00.822119 IP 10.0.1.1 > 10.0.2.2: ICMP echo request, id 15516, seq 166, length 64
00:00:00.827057 IP 10.0.1.1 > 10.0.2.2: ICMP echo request, id 15516, seq 167, length 64
00:00:00.832310 IP 10.0.1.1 > 10.0.2.2: ICMP echo request, id 15516, seq 168, length 64
00:00:00.837205 IP 10.0.1.1 > 10.0.2.2: ICMP echo request, id 15516, seq 169, length 64
00:00:00.842048 IP 10.0.1.1 > 10.0.2.2: ICMP echo request, id 15516, seq 170, length 64
00:00:00.847114 IP 10.0.1.1 > 10.0.2.2: ICMP echo request, id 15516, seq 171, length 64
00:00:00.852156 IP 10.0.1.1 > 10.0.2.2: ICMP echo request, id 15516, seq 172, length 64
00:00:00.857142 IP 10.0.1.1 > 10.0.2.2: ICMP echo request, id 15516, seq 173, length 64
00:00:00.861947 IP 10.0.1.1 > 10.0.2.2: ICMP echo request, id 15516, seq 174, length 64
00:00:00.867146 IP 10.0.1.1 > 10.0.2.2: ICMP echo request, id 15516, seq 175, length 64
00:00:00.872077 IP 10.0.1.1 > 10.0.2.2: ICMP echo request, id 15516, seq 176, length 64
00:00:00.877111 IP 10.0.1.1 > 10.0.2.2: ICMP echo request, id 15516, seq 177, length 64
00:00:00.882121 IP 10.0.1.1 > 10.0.2.2: ICMP echo request, id 15516, seq 178, length 64
00:00:00.887103 IP 10.0.1.1 > 10.0.2.2: ICMP echo request, id 15516, seq 179, length 64
00:00:00.891984 IP 10.0.1.1 > 10.0.2.2: ICMP echo request, id 15516, seq 180, length 64
00:00:00.897294 IP 10.0.1.1 > 10.0.2.2: ICMP echo request, id 15516, seq 181, length 64
00:00:00.902262 IP 10.0.1.1 > 10.0.2.2: ICMP echo request, id 15516, seq 182, length 64
00:00:00.907030 IP 10.0.1.1 > 10.0.2.2: ICMP echo request, id 15516, seq 183, length 64
00:00:00.912106 IP 10.0.1.1 > 10.0.2.2: ICMP echo request, id 15516, seq 184, length 64
00:00:00.917226 IP 10.0.1.1 > 10.0.2.2: ICMP echo request, id 15516, seq 185, length 64
00:00:00.922037 IP 10.0.1.1 > 10.0.2.2: ICMP echo request, id 15516, seq 186, length 64
00:00:00.926926 IP 10.0.1.1 > 10.0.2.2: ICMP echo request, id 15516, seq 187, length 64
00:00:00.932186 IP 10.0.1.1 > 10.0.2.2: ICMP echo request, id 15516, seq 188, length 64
00:00:00.937087 IP 10.0.1.1 > 10.0.2.2: ICMP echo request, id 15516, seq 189, length 64
00:00:00.941977 IP 10.0.1.1 > 10.0.2.2: ICMP echo request, id 15516, seq 190, length 64
00:00:00.946980 IP 10.0.1.1 > 10.0.2.2: ICMP echo request, id 15516, seq 191, length 64
00:00:00.952214 IP 10.0.1.1 > 10.0.2.2: ICMP echo request, id 15516, seq 192, length 64
00:00:00.956963 IP 10.0.1.1 > 10.0.2.2: ICMP echo request, id 15516, seq 193, length 64
00:00:00.961956 IP 10.0.1.1 > 10.0.2.2: ICMP echo request, id 15516, seq 194, length 64
00:00:00.967195 IP 10.0.1.1 > 10.0.2.2: ICMP echo request, id 15516, seq 195, length 64
00:00:00.971994 IP 10.0.1.1 > 10.0.2.2: ICMP echo request, id 15516, seq 196, length 64
00:00:00.977113 IP 10.0.1.1 > 10.0.2.2: ICMP echo request, id 15516, seq 197, length 64
00:00:00.982198 IP 10.0.1.1 > 10.0.2.2: ICMP echo request, id 15516, seq 198, length 64
00:00:00.987189 IP 10.0.1.1 > 10.0.2.2: ICMP echo request, id 15516, seq 199, length 64
00:00:00.992061 IP 10.0.1.1 > 10.0.2.2: ICMP echo request, id 15516, seq 200, length 64
00:00:00.997113 IP 10.0.1.1 > 10.0.2.2: ICMP echo request, id 15516, seq 201, length 64
00:00:01.002189 IP 10.0.1.1 > 10.0.2.2: ICMP echo request, id 15516, seq 202, length 64
00:00:01.006992 IP 10.0.1.1 > 10.0.2.2: ICMP echo request, id 15516, seq 203, length 64
00:00:01.012190 IP 10.0.1.1 > 10.0.2.2: ICMP echo request, id 15516, seq 204, length 64
00:00:01.017368 IP 10.0.1.1 > 10.0.2.2: ICMP echo request, id 15516, seq 205, length 64
00:00:01.022049 IP 10.0.1.1 > 10.0.2.2: ICMP echo request, id 15516, seq 206, length 64
00:00:01.027027 IP 10.0.1.1 > 10.0.2.2: ICMP echo request, id 15516, seq 207, length 64
00:00:01.032225 IP 10.0.1.1 > 10.0.2.2: ICMP echo request, id 15516, seq 208, length 64
00:00:01.037157 IP 10.0.1.1 > 10.0.2.2: ICMP echo request, id 15516, seq 209, length 64
00:00:01.042021 IP 10.0.1.1 > 10.0.2.2: ICMP echo request, id 15516, seq 210, length 64
00:00:01.047108 IP 10.0.1.1 > 10.0.2.2: ICMP echo request, id 15516, seq 211, length 64
00:00:01.052215 IP 10.0.1.1 > 10.0.2.2: ICMP echo request, id 15516, seq 212, length 64
00:00:01.057125 IP 10.0.1.1 > 10.0.2.2: ICMP echo request, id 15516, seq 213, length 64
00:00:01.061927 IP 10.0.1.1 > 10.0.2.2: ICMP echo request, id 15516, seq 214, length 64
00:00:01.067160 IP 10.0.1.1 > 10.0.2.2: ICMP echo request, id 15516, seq 215, length 64
00:00:01.072017 IP 10.0.1.1 > 10.0.2.2: ICMP echo request, id 15516, seq 216, length 64
00:00:01.076994 IP 10.0.1.1 > 10.0.2.2: ICMP echo request, id 15516, seq 217, length 64
00:00:01.082128 IP 10.0.1.1 > 10.0.2.2: ICMP echo request, id 15516, seq 218, length 64
00:00:01.087066 IP 10.0.1.1 > 10.0.2.2: ICMP echo request, id 15516, seq 219, length 64
00:00:01.091962 IP 10.0.1.1 > 10.0.2.2: ICMP echo request, id 15516, seq 220, length 64
00:00:01.097171 IP 10.0.1.1 > 10.0.2.2: ICMP echo request, id 15516, seq 221, length 64
00:00:01.102117 IP 10.0.1.1 > 10.0.2.2: ICMP echo request, id 15516, seq 222, length 64
00:00:01.106937 IP 10.0.1.1 > 10.0.2.2: ICMP echo request, id 15516, seq 223, length 64
00:00:01.111975 IP 10.0.1.1 > 10.0.2.2: ICMP echo request, id 15516, seq 224, length 64
00:00:01.117230 IP 10.0.1.1 > 10.0.2.2: ICMP echo request, id 15516, seq 225, length 64
00:00:01.122213 IP 10.0.1.1 > 10.0.2.2: ICMP echo request, id 15516, seq 226, length 64
00:00:01.127509 IP 10.0.1.1 > 10.0.2.2: ICMP echo request, id 15516, seq 227, length 64
00:00:01.132481 IP 10.0.1.1 > 10.0.2.2: ICMP echo request, id 15516, seq 228, length 64
00:00:01.136982 IP 10.0.1.1 > 10.0.2.2: ICMP echo request, id 15516, seq 229, length 64
00:00:01.141938 IP 10.0.1.1 > 10.0.2.2: ICMP echo request, id 15516, seq 230, length 64
00:00:01.146924 IP 10.0.1.1 > 10.0.2.2: ICMP echo request, id 15516, seq 231, length 64
00:00:01.152201 IP 10.0.1.1 > 10.0.2.2: ICMP echo request, id 15516, seq 232, length 64
00:00:01.156967 IP 10.0.1.1 > 10.0.2.2: ICMP echo request, id 15516, seq 233, length 64
00:00:01.162011 IP 10.0.1.1 > 10.0.2.2: ICMP echo request, id 15516, seq 234, length 64
00:00:01.168742 IP 10.0.1.1 > 10.0.2.2: ICMP echo request, id 15516, seq 235, length 64
00:00:01.172114 IP 10.0.1.1 > 10.0.2.2: ICMP echo request, id 15516, seq 236, length 64
00:00:01.177065 IP 10.0.1.1 > 10.0.2.2: ICMP echo request, id 15516, seq 237, length 64
00:00:01.182095 IP 10.0.1.1 > 10.0.2.2: ICMP echo request, id 15516, seq 238, length 64
00:00:01.187163 IP 10.0.1.1 > 10.0.2.2: ICMP echo request, id 15516, seq 239, length 64
00:00:01.192070 IP 10.0.1.1 > 10.0.2.2: ICMP echo request, id 15516, seq 240, length 64
00:00:01.197062 IP 10.0.1.1 > 10.0.2.2: ICMP echo request, id 15516, seq 241, length 64
00:00:01.202102 IP 10.0.1.1 > 10.0.2.2: ICMP echo request, id 15516, seq 242, length 64
00:00:01.207014 IP 10.0.1.1 > 10.0.2.2: ICMP echo request, id 15516, seq 243, length 64
00:00:01.211987 IP 10.0.1.1 > 10.0.2.2: ICMP echo request, id 15516, seq 244, length 64
00:00:01.216992 IP 10.0.1.1 > 10.0.2.2: ICMP echo request, id 15516, seq 245, length 64
00:00:01.222046 IP 10.0.1.1 > 10.0.2.2: ICMP echo request, id 15516, seq 246, length 64
00:00:01.227019 IP 10.0.1.1 > 10.0.2.2: ICMP echo request, id 15516, seq 247, length 64
00:00:01.232012 IP 10.0.1.1 > 10.0.2.2: ICMP echo request, id 15516, seq 248, length 64
00:00:01.237053 IP 10.0.1.1 > 10.0.2.2: ICMP echo request, id 15516, seq 249, length 64
00:00:01.242116 IP 10.0.1.1 > 10.0.2.2: ICMP echo request, id 15516, seq 250, length 64
00:00:01.247099 IP 10.0.1.1 > 10.0.2.2: ICMP echo request, id 15516, seq 251, length 64
00:00:01.252048 IP 10.0.1.1 > 10.0.2.2: ICMP echo request, id 15516, seq 252, length 64
00:00:01.256995 IP 10.0.1.1 > 10.0.2.2: ICMP echo request, id 15516, seq 253, length 64
00:00:01.261914 IP 10.0.1.1 > 10.0.2.2: ICMP echo request, id 15516, seq 254, length 64
00:00:01.267037 IP 10.0.1.1 > 10.0.2.2: ICMP echo request, id 15516, seq 255, length 64
00:00:01.272017 IP 10.0.1.1 > 10.0.2.2: ICMP echo request, id 15516, seq 256, length 64
00:00:01.276926 IP 10.0.1.1 > 10.0.2.2: ICMP echo request, id 15516, seq 257, length 64
00:00:01.282110 IP 10.0.1.1 > 10.0.2.2: ICMP echo request, id 15516, seq 258, length 64
00:00:01.287071 IP 10.0.1.1 > 10.0.2.2: ICMP echo request, id 15516, seq 259, length 64
00:00:01.292070 IP 10.0.1.1 > 10.0.2.2: ICMP echo request, id 15516, seq 260, length 64
00:00:01.297152 IP 10.0.1.1 > 10.0.2.2: ICMP echo request, id 15516, seq 261, length 64
00:00:01.302257 IP 10.0.1.1 > 10.0.2.2: ICMP echo request, id 15516, seq 262, length 64
00:00:01.307115 IP 10.0.1.1 > 10.0.2.2: ICMP echo request, id 15516, seq 263, length 64
00:00:01.312139 IP 10.0.1.1 > 10.0.2.2: ICMP echo request, id 15516, seq 264, length 64
00:00:01.316999 IP 10.0.1.1 > 10.0.2.2: ICMP echo request, id 15516, seq 265, length 64
00:00:01.322390 IP 10.0.1.1 > 10.0.2.2: ICMP echo request, id 15516, seq 266, length 64
00:00:01.327287 IP 10.0.1.1 > 10.0.2.2: ICMP echo request, id 15516, seq 267, length 64
00:00:01.332231 IP 10.0.1.1 > 10.0.2.2: ICMP echo request, id 15516, seq 268, length 64
00:00:01.337237 IP 10.0.1.1 > 10.0.2.2: ICMP echo request, id 15516, seq 269, length 64
00:00:01.342304 IP 10.0.1.1 > 10.0.2.2: ICMP echo request, id 15516, seq 270, length 64
00:00:01.346246 IP 10.0.1.1 > 10.0.2.2: ICMP echo request, id 15516, seq 271, length 64
00:00:01.351220 IP 10.0.1.1 > 10.0.2.2: ICMP echo request, id 15516, seq 272, length 64
00:00:01.356382 IP 10.0.1.1 > 10.0.2.2: ICMP echo request, id 15516, seq 273, length 64
00:00:01.361644 IP 10.0.1.1 > 10.0.2.2: ICMP echo request, id 15516, seq 274, length 64
00:00:01.366353 IP 10.0.1.1 > 10.0.2.2: ICMP echo request, id 15516, seq 275, length 64
00:00:01.371320 IP 10.0.1.1 > 10.0.2.2: ICMP echo request, id 15516, seq 276, length 64
00:00:01.376305 IP 10.0.1.1 > 10.0.2.2: ICMP echo request, id 15516, seq 277, length 64
00:00:01.381492 IP 10.0.1.1 > 10.0.2.2: ICMP echo request, id 15516, seq 278, length 64
00:00:01.386207 IP 10.0.1.1 > 10.0.2.2: ICMP echo request, id 15516, seq 279, length 64
00:00:01.391197 IP 10.0.1.1 > 10.0.2.2: ICMP echo request, id 15516, seq 280, length 64
00:00:01.396191 IP 10.0.1.1 > 10.0.2.2: ICMP echo request, id 15516, seq 281, length 64
00:00:01.401532 IP 10.0.1.1 > 10.0.2.2: ICMP echo request, id 15516, seq 282, length 64
00:00:01.406311 IP 10.0.1.1 > 10.0.2.2: ICMP echo request, id 15516, seq 283, length 64
00:00:01.411223 IP 10.0.1.1 > 10.0.2.2: ICMP echo request, id 15516, seq 284, length 64
00:00:01.416389 IP 10.0.1.1 > 10.0.2.2: ICMP echo request, id 15516, seq 285, length 64
00:00:01.421256 IP 10.0.1.1 > 10.0.2.2: ICMP echo request, id 15516, seq 286, length 64
00:00:01.426205 IP 10.0.1.1 > 10.0.2.2: ICMP echo request, id 15516, seq 287, length 64
00:00:01.431190 IP 10.0.1.1 > 10.0.2.2: ICMP echo request, id 15516, seq 288, length 64
00:00:01.436251 IP 10.0.1.1 > 10.0.2.2: ICMP echo request, id 15516, seq 289, length 64
00:00:01.441472 IP 10.0.1.1 > 10.0.2.2: ICMP echo request, id 15516, seq 290, length 64
00:00:01.446611 IP 10.0.1.1 > 10.0.2.2: ICMP echo request, id 15516, seq 291, length 64
00:00:01.451670 IP 10.0.1.1 > 10.0.2.2: ICMP echo request, id 15516, seq 292, length 64
00:00:01.456675 IP 10.0.1.1 > 10.0.2.2: ICMP echo request, id 15516, seq 293, length 64
00:00:01.461602 IP 10.0.1.1 > 10.0.2.2: ICMP echo request, id 15516, seq 294, length 64
00:00:01.466545 IP 10.0.1.1 > 10.0.2.2: ICMP echo request, id 15516, seq 295, length 64
00:00:01.471382 IP 10.0.1.1 > 10.0.2.2: ICMP echo request, id 15516, seq 296, length 64
00:00:01.476521 IP 10.0.1.1 > 10.0.2.2: ICMP echo request, id 15516, seq 297, length 64
00:00:01.481440 IP 10.0.1.1 > 10.0.2.2: ICMP echo request, id 15516, seq 298, length 64
00:00:01.486640 IP 10.0.1.1 > 10.0.2.2: ICMP echo request, id 15516, seq 299, length 64
00:00:01.491452 IP 10.0.1.1 > 10.0.2.2: ICMP echo request, id 15516, seq 300, length 64
00:00:01.496583 IP 10.0.1.1 > 10.0.2.2: ICMP echo request, id 15516, seq 301, length 64
00:00:01.501444 IP 10.0.1.1 > 10.0.2.2: ICMP echo request, id 15516, seq 302, length 64
00:00:01.506442 IP 10.0.1.1 > 10.0.2.2: ICMP echo request, id 15516, seq 303, length 64
00:00:01.511399 IP 10.0.1.1 > 10.0.2.2: ICMP echo request, id 15516, seq 304, length 64
00:00:01.516673 IP 10.0.1.1 > 10.0.2.2: ICMP echo request, id 15516, seq 305, length 64
00:00:01.521472 IP 10.0.1.1 > 10.0.2.2: ICMP echo request, id 15516, seq 306, length 64
00:00:01.526721 IP 10.0.1.1 > 10.0.2.2: ICMP echo request, id 15516, seq 307, length 64
00:00:01.531634 IP 10.0.1.1 > 10.0.2.2: ICMP echo request, id 15516, seq 308, length 64
00:00:01.536718 IP 10.0.1.1 > 10.0.2.2: ICMP echo request, id 15516, seq 309, length 64
00:00:01.541558 IP 10.0.1.1 > 10.0.2.2: ICMP echo request, id 15516, seq 310, length 64
00:00:01.546606 IP 10.0.1.1 > 10.0.2.2: ICMP echo request, id 15516, seq 311, length 64
00:00:01.551692 IP 10.0.1.1 > 10.0.2.2: ICMP echo request, id 15516, seq 312, length 64
00:00:01.556587 IP 10.0.1.1 > 10.0.2.2: ICMP echo request, id 15516, seq 313, length 64
00:00:01.561683 IP 10.0.1.1 > 10.0.2.2: ICMP echo request, id 15516, seq 314, length 64
00:00:01.566626 IP 10.0.1.1 > 10.0.2.2: ICMP echo request, id 15516, seq 315, length 64
00:00:01.571604 IP 10.0.1.1 > 10.0.2.2: ICMP echo request, id 15516, seq 316, length 64
00:00:01.576631 IP 10.0.1.1 > 10.0.2.2: ICMP echo request, id 15516, seq 317, length 64
00:00:01.581553 IP 10.0.1.1 > 10.0.2.2: ICMP echo request, id 15516, seq 318, length 64
00:00:01.586613 IP 10.0.1.1 > 10.0.2.2: ICMP echo request, id 15516, seq 319, length 64
00:00:01.591544 IP 10.0.1.1 > 10.0.2.2: ICMP echo request, id 15516, seq 320, length 64
00:00:01.596579 IP 10.0.1.1 > 10.0.2.2: ICMP echo request, id 15516, seq 321, length 64
00:00:01.601609 IP 10.0.1.1 > 10.0.2.2: ICMP echo request, id 15516, seq 322, length 64
00:00:01.606597 IP 10.0.1.1 > 10.0.2.2: ICMP echo request, id 15516, seq 323, length 64
00:00:01.611546 IP 10.0.1.1 > 10.0.2.2: ICMP echo request, id 15516, seq 324, length 64
00:00:01.616592 IP 10.0.1.1 > 10.0.2.2: ICMP echo request, id 15516, seq 325, length 64
00:00:01.621548 IP 10.0.1.1 > 10.0.2.2: ICMP echo request, id 15516, seq 326, length 64
00:00:01.626539 IP 10.0.1.1 > 10.0.2.2: ICMP echo request, id 15516, seq 327, length 64
00:00:01.631548 IP 10.0.1.1 > 10.0.2.2: ICMP echo request, id 15516, seq 328, length 64
00:00:01.637097 IP 10.0.1.1 > 10.0.2.2: ICMP echo request, id 15516, seq 329, length 64
00:00:01.641746 IP 10.0.1.1 > 10.0.2.2: ICMP echo request, id 15516, seq 330, length 64
00:00:01.646698 IP 10.0.1.1 > 10.0.2.2: ICMP echo request, id 15516, seq 331, length 64
00:00:01.651675 IP 10.0.1.1 > 10.0.2.2: ICMP echo request, id 15516, seq 332, length 64
00:00:01.656716 IP 10.0.1.1 > 10.0.2.2: ICMP echo request, id 15516, seq 333, length 64
00:00:01.661679 IP 10.0.1.1 > 10.0.2.2: ICMP echo request, id 15516, seq 334, length 64
00:00:01.666688 IP 10.0.1.1 > 10.0.2.2: ICMP echo request, id 15516, seq 335, length 64
00:00:01.671676 IP 10.0.1.1 > 10.0.2.2: ICMP echo request, id 15516, seq 336, length 64
00:00:01.676698 IP 10.0.1.1 > 10.0.2.2: ICMP echo request, id 15516, seq 337, length 64
00:00:01.681741 IP 10.0.1.1 > 10.0.2.2: ICMP echo request, id 15516, seq 338, length 64
00:00:01.686765 IP 10.0.1.1 > 10.0.2.2: ICMP echo request, id 15516, seq 339, length 64
00:00:01.691650 IP 10.0.1.1 > 10.0.2.2: ICMP echo request, id 15516, seq 340, length 64
00:00:01.696662 IP 10.0.1.1 > 10.0.2.2: ICMP echo request, id 15516, seq 341, length 64
00:00:01.701865 IP 10.0.1.1 > 10.0.2.2: ICMP echo request, id 15516, seq 342, length 64
00:00:01.706733 IP 10.0.1.1 > 10.0.2.2: ICMP echo request, id 15516, seq 343, length 64
00:00:01.711678 IP 10.0.1.1 > 10.0.2.2: ICMP echo request, id 15516, seq 344, length 64
00:00:01.716722 IP 10.0.1.1 > 10.0.2.2: ICMP echo request, id 15516, seq 345, length 64
00:00:01.721709 IP 10.0.1.1 > 10.0.2.2: ICMP echo request, id 15516, seq 346, length 64
00:00:01.726862 IP 10.0.1.1 > 10.0.2.2: ICMP echo request, id 15516, seq 347, length 64
00:00:01.731732 IP 10.0.1.1 > 10.0.2.2: ICMP echo request, id 15516, seq 348, length 64
00:00:01.736731 IP 10.0.1.1 > 10.0.2.2: ICMP echo request, id 15516, seq 349, length 64
00:00:01.741671 IP 10.0.1.1 > 10.0.2.2: ICMP echo request, id 15516, seq 350, length 64
00:00:01.746778 IP 10.0.1.1 > 10.0.2.2: ICMP echo request, id 15516, seq 351, length 64
00:00:01.751743 IP 10.0.1.1 > 10.0.2.2: ICMP echo request, id 15516, seq 352, length 64
00:00:01.756712 IP 10.0.1.1 > 10.0.2.2: ICMP echo request, id 15516, seq 353, length 64
00:00:01.761754 IP 10.0.1.1 > 10.0.2.2: ICMP echo request, id 15516, seq 354, length 64
00:00:01.766721 IP 10.0.1.1 > 10.0.2.2: ICMP echo request, id 15516, seq 355, length 64
00:00:01.771707 IP 10.0.1.1 > 10.0.2.2: ICMP echo request, id 15516, seq 356, length 64
00:00:01.776771 IP 10.0.1.1 > 10.0.2.2: ICMP echo request, id 15516, seq 357, length 64
00:00:01.781724 IP 10.0.1.1 > 10.0.2.2: ICMP echo request, id 15516, seq 358, length 64
00:00:01.786708 IP 10.0.1.1 > 10.0.2.2: ICMP echo request, id 15516, seq 359, length 64
00:00:01.791788 IP 10.0.1.1 > 10.0.2.2: ICMP echo request, id 15516, seq 360, length 64
00:00:01.797016 IP 10.0.1.1 > 10.0.2.2: ICMP echo request, id 15516, seq 361, length 64
00:00:01.802011 IP 10.0.1.1 > 10.0.2.2: ICMP echo request, id 15516, seq 362, length 64
00:00:01.806872 IP 10.0.1.1 > 10.0.2.2: ICMP echo request, id 15516, seq 363, length 64
00:00:01.811738 IP 10.0.1.1 > 10.0.2.2: ICMP echo request, id 15516, seq 364, length 64
00:00:01.816830 IP 10.0.1.1 > 10.0.2.2: ICMP echo request, id 15516, seq 365, length 64
00:00:01.821756 IP 10.0.1.1 > 10.0.2.2: ICMP echo request, id 15516, seq 366, length 64
00:00:01.826766 IP 10.0.1.1 > 10.0.2.2: ICMP echo request, id 15516, seq 367, length 64
00:00:01.831755 IP 10.0.1.1 > 10.0.2.2: ICMP echo request, id 15516, seq 368, length 64
00:00:01.836710 IP 10.0.1.1 > 10.0.2.2: ICMP echo request, id 15516, seq 369, length 64
00:00:01.841740 IP 10.0.1.1 > 10.0.2.2: ICMP echo request, id 15516, seq 370, length 64
00:00:01.846788 IP 10.0.1.1 > 10.0.2.2: ICMP echo request, id 15516, seq 371, length 64
00:00:01.851724 IP 10.0.1.1 > 10.0.2.2: ICMP echo request, id 15516, seq 372, length 64
00:00:01.856728 IP 10.0.1.1 > 10.0.2.2: ICMP echo request, id 15516, seq 373, length 64
00:00:01.861746 IP 10.0.1.1 > 10.0.2.2: ICMP echo request, id 15516, seq 374, length 64
00:00:01.866727 IP 10.0.1.1 > 10.0.2.2: ICMP echo request, id 15516, seq 375, length 64
00:00:01.871710 IP 10.0.1.1 > 10.0.2.2: ICMP echo request, id 15516, seq 376, length 64
00:00:01.876732 IP 10.0.1.1 > 10.0.2.2: ICMP echo request, id 15516, seq 377, length 64
00:00:01.881705 IP 10.0.1.1 > 10.0.2.2: ICMP echo request, id 15516, seq 378, length 64
00:00:01.886755 IP 10.0.1.1 > 10.0.2.2: ICMP echo request, id 15516, seq 379, length 64
00:00:01.891699 IP 10.0.1.1 > 10.0.2.2: ICMP echo request, id 15516, seq 380, length 64
00:00:01.896745 IP 10.0.1.1 > 10.0.2.2: ICMP echo request, id 15516, seq 381, length 64
00:00:01.901705 IP 10.0.1.1 > 10.0.2.2: ICMP echo request, id 15516, seq 382, length 64
00:00:01.906713 IP 10.0.1.1 > 10.0.2.2: ICMP echo request, id 15516, seq 383, length 64
00:00:01.911748 IP 10.0.1.1 > 10.0.2.2: ICMP echo request, id 15516, seq 384, length 64
00:00:01.916722 IP 10.0.1.1 > 10.0.2.2: ICMP echo request, id 15516, seq 385, length 64
00:00:01.921710 IP 10.0.1.1 > 10.0.2.2: ICMP echo request, id 15516, seq 386, length 64
00:00:01.926798 IP 10.0.1.1 > 10.0.2.2: ICMP echo request, id 15516, seq 387, length 64
00:00:01.931716 IP 10.0.1.1 > 10.0.2.2: ICMP echo request, id 15516, seq 388, length 64
00:00:01.936706 IP 10.0.1.1 > 10.0.2.2: ICMP echo request, id 15516, seq 389, length 64
00:00:01.941713 IP 10.0.1.1 > 10.0.2.2: ICMP echo request, id 15516, seq 390, length 64
00:00:01.946760 IP 10.0.1.1 > 10.0.2.2: ICMP echo request, id 15516, seq 391, length 64
00:00:01.951709 IP 10.0.1.1 > 10.0.2.2: ICMP echo request, id 15516, seq 392, length 64
00:00:01.956705 IP 10.0.1.1 > 10.0.2.2: ICMP echo request, id 15516, seq 393, length 64
00:00:01.961746 IP 10.0.1.1 > 10.0.2.2: ICMP echo request, id 15516, seq 394, length 64
00:00:01.966727 IP 10.0.1.1 > 10.0.2.2: ICMP echo request, id 15516, seq 395, length 64
00:00:01.971724 IP 10.0.1.1 > 10.0.2.2: ICMP echo request, id 15516, seq 396, length 64
00:00:01.976736 IP 10.0.1.1 > 10.0.2.2: ICMP echo request, id 15516, seq 397, length 64
00:00:01.981747 IP 10.0.1.1 > 10.0.2.2: ICMP echo request, id 15516, seq 398, length 64
00:00:01.986724 IP 10.0.1.1 > 10.0.2.2: ICMP echo request, id 15516, seq 399, length 64
00:00:01.991701 IP 10.0.1.1 > 10.0.2.2: ICMP echo request, id 15516, seq 400, length 64
00:00:01.996748 IP 10.0.1.1 > 10.0.2.2: ICMP echo request, id 15516, seq 401, length 64
00:00:02.001704 IP 10.0.1.1 > 10.0.2.2: ICMP echo request, id 15516, seq 402, length 64
00:00:02.006718 IP 10.0.1.1 > 10.0.2.2: ICMP echo request, id 15516, seq 403, length 64
00:00:02.011766 IP 10.0.1.1 > 10.0.2.2: ICMP echo request, id 15516, seq 404, length 64
00:00:02.016703 IP 10.0.1.1 > 10.0.2.2: ICMP echo request, id 15516, seq 405, length 64
00:00:02.021701 IP 10.0.1.1 > 10.0.2.2: ICMP echo request, id 15516, seq 406, length 64
00:00:02.026754 IP 10.0.1.1 > 10.0.2.2: ICMP echo request, id 15516, seq 407, length 64
00:00:02.031688 IP 10.0.1.1 > 10.0.2.2: ICMP echo request, id 15516, seq 408, length 64
00:00:02.036796 IP 10.0.1.1 > 10.0.2.2: ICMP echo request, id 15516, seq 409, length 64
00:00:02.041700 IP 10.0.1.1 > 10.0.2.2: ICMP echo request, id 15516, seq 410, length 64
00:00:02.047061 IP 10.0.1.1 > 10.0.2.2: ICMP echo request, id 15516, seq 411, length 64
00:00:02.052112 IP 10.0.1.1 > 10.0.2.2: ICMP echo request, id 15516, seq 412, length 64
00:00:02.056997 IP 10.0.1.1 > 10.0.2.2: ICMP echo request, id 15516, seq 413, length 64
00:00:02.062008 IP 10.0.1.1 > 10.0.2.2: ICMP echo request, id 15516, seq 414, length 64
00:00:02.066733 IP 10.0.1.1 > 10.0.2.2: ICMP echo request, id 15516, seq 415, length 64
00:00:02.071755 IP 10.0.1.1 > 10.0.2.2: ICMP echo request, id 15516, seq 416, length 64
00:00:02.076772 IP 10.0.1.1 > 10.0.2.2: ICMP echo request, id 15516, seq 417, length 64
00:00:02.081796 IP 10.0.1.1 > 10.0.2.2: ICMP echo request, id 15516, seq 418, length 64
00:00:02.086740 IP 10.0.1.1 > 10.0.2.2: ICMP echo request, id 15516, seq 419, length 64
00:00:02.091702 IP 10.0.1.1 > 10.0.2.2: ICMP echo request, id 15516, seq 420, length 64
00:00:02.096771 IP 10.0.1.1 > 10.0.2.2: ICMP echo request, id 15516, seq 421, length 64
00:00:02.101742 IP 10.0.1.1 > 10.0.2.2: ICMP echo request, id 15516, seq 422, length 64
00:00:02.106722 IP 10.0.1.1 > 10.0.2.2: ICMP echo request, id 15516, seq 423, length 64
00:00:02.111749 IP 10.0.1.1 > 10.0.2.2: ICMP echo request, id 15516, seq 424, length 64
00:00:02.116707 IP 10.0.1.1 > 10.0.2.2: ICMP echo request, id 15516, seq 425, length 64
00:00:02.121723 IP 10.0.1.1 > 10.0.2.2: ICMP echo request, id 15516, seq 426, length 64
00:00:02.126768 IP 10.0.1.1 > 10.0.2.2: ICMP echo request, id 15516, seq 427, length 64
00:00:02.131720 IP 10.0.1.1 > 10.0.2.2: ICMP echo request, id 15516, seq 428, length 64
00:00:02.136724 IP 10.0.1.1 > 10.0.2.2: ICMP echo request, id 15516, seq 429, length 64
00:00:02.141709 IP 10.0.1.1 > 10.0.2.2: ICMP echo request, id 15516, seq 430, length 64
00:00:02.146779 IP 10.0.1.1 > 10.0.2.2: ICMP echo request, id 15516, seq 431, length 64
00:00:02.151719 IP 10.0.1.1 > 10.0.2.2: ICMP echo request, id 15516, seq 432, length 64
00:00:02.156710 IP 10.0.1.1 > 10.0.2.2: ICMP echo request, id 15516, seq 433, length 64
00:00:02.161751 IP 10.0.1.1 > 10.0.2.2: ICMP echo request, id 15516, seq 434, length 64
00:00:02.166756 IP 10.0.1.1 > 10.0.2.2: ICMP echo request, id 15516, seq 435, length 64
00:00:02.172056 IP 10.0.1.1 > 10.0.2.2: ICMP echo request, id 15516, seq 436, length 64
00:00:02.176805 IP 10.0.1.1 > 10.0.2.2: ICMP echo request, id 15516, seq 437, length 64
00:00:02.181715 IP 10.0.1.1 > 10.0.2.2: ICMP echo request, id 15516, seq 438, length 64
00:00:02.186725 IP 10.0.1.1 > 10.0.2.2: ICMP echo request, id 15516, seq 439, length 64
00:00:02.191713 IP 10.0.1.1 > 10.0.2.2: ICMP echo request, id 15516, seq 440, length 64
00:00:02.196769 IP 10.0.1.1 > 10.0.2.2: ICMP echo request, id 15516, seq 441, length 64
00:00:02.201701 IP 10.0.1.1 > 10.0.2.2: ICMP echo request, id 15516, seq 442, length 64
00:00:02.206709 IP 10.0.1.1 > 10.0.2.2: ICMP echo request, id 15516, seq 443, length 64
00:00:02.211741 IP 10.0.1.1 > 10.0.2.2: ICMP echo request, id 15516, seq 444, length 64
00:00:02.216976 IP 10.0.1.1 > 10.0.2.2: ICMP echo request, id 15516, seq 445, length 64
00:00:02.221934 IP 10.0.1.1 > 10.0.2.2: ICMP echo request, id 15516, seq 446, length 64
00:00:02.226957 IP 10.0.1.1 > 10.0.2.2: ICMP echo request, id 15516, seq 447, length 64
00:00:02.232118 IP 10.0.1.1 > 10.0.2.2: ICMP echo request, id 15516, seq 448, length 64
00:00:02.237047 IP 10.0.1.1 > 10.0.2.2: ICMP echo request, id 15516, seq 449, length 64
00:00:02.826586 IP 10.0.1.1 > 10.0.2.2: ICMP echo request, id 15516, seq 502, length 64
00:00:02.831456 IP 10.0.1.1 > 10.0.2.2: ICMP echo request, id 15516, seq 503, length 64
00:00:02.836567 IP 10.0.1.1 > 10.0.2.2: ICMP echo request, id 15516, seq 504, length 64
00:00:02.841350 IP 10.0.1.1 > 10.0.2.2: ICMP echo request, id 15516, seq 505, length 64
00:00:02.846340 IP 10.0.1.1 > 10.0.2.2: ICMP echo request, id 15516, seq 506, length 64
00:00:02.851824 IP 10.0.1.1 > 10.0.2.2: ICMP echo request, id 15516, seq 507, length 64
00:00:02.856368 IP 10.0.1.1 > 10.0.2.2: ICMP echo request, id 15516, seq 508, length 64
00:00:02.861459 IP 10.0.1.1 > 10.0.2.2: ICMP echo request, id 15516, seq 509, length 64
00:00:02.866513 IP 10.0.1.1 > 10.0.2.2: ICMP echo request, id 15516, seq 510, length 64
00:00:02.871319 IP 10.0.1.1 > 10.0.2.2: ICMP echo request, id 15516, seq 511, length 64
00:00:02.876255 IP 10.0.1.1 > 10.0.2.2: ICMP echo request, id 15516, seq 512, length 64
00:00:02.881286 IP 10.0.1.1 > 10.0.2.2: ICMP echo request, id 15516, seq 513, length 64
00:00:02.886430 IP 10.0.1.1 > 10.0.2.2: ICMP echo request, id 15516, seq 514, length 64
00:00:02.891285 IP 10.0.1.1 > 10.0.2.2: ICMP echo request, id 15516, seq 515, length 64
00:00:02.896212 IP 10.0.1.1 > 10.0.2.2: ICMP echo request, id 15516, seq 516, length 64
00:00:02.901412 IP 10.0.1.1 > 10.0.2.2: ICMP echo request, id 15516, seq 517, length 64
00:00:02.906352 IP 10.0.1.1 > 10.0.2.2: ICMP echo request, id 15516, seq 518, length 64
00:00:02.911159 IP 10.0.1.1 > 10.0.2.2: ICMP echo request, id 15516, seq 519, length 64
00:00:02.916370 IP 10.0.1.1 > 10.0.2.2: ICMP echo request, id 15516, seq 520, length 64
00:00:02.921212 IP 10.0.1.1 > 10.0.2.2: ICMP echo request, id 15516, seq 521, length 64
00:00:02.926102 IP 10.0.1.1 > 10.0.2.2: ICMP echo request, id 15516, seq 522, length 64
00:00:02.931211 IP 10.0.1.1 > 10.0.2.2: ICMP echo request, id 15516, seq 523, length 64
00:00:02.936190 IP 10.0.1.1 > 10.0.2.2: ICMP echo request, id 15516, seq 524, length 64
00:00:02.941105 IP 10.0.1.1 > 10.0.2.2: ICMP echo request, id 15516, seq 525, length 64
00:00:02.946203 IP 10.0.1.1 > 10.0.2.2: ICMP echo request, id 15516, seq 526, length 64
00:00:02.951463 IP 10.0.1.1 > 10.0.2.2: ICMP echo request, id 15516, seq 527, length 64
00:00:02.956062 IP 10.0.1.1 > 10.0.2.2: ICMP echo request, id 15516, seq 528, length 64
00:00:02.961089 IP 10.0.1.1 > 10.0.2.2: ICMP echo request, id 15516, seq 529, length 64
00:00:02.966383 IP 10.0.1.1 > 10.0.2.2: ICMP echo request, id 15516, seq 530, length 64
00:00:02.971106 IP 10.0.1.1 > 10.0.2.2: ICMP echo request, id 15516, seq 531, length 64
00:00:02.976139 IP 10.0.1.1 > 10.0.2.2: ICMP echo request, id 15516, seq 532, length 64
00:00:02.981211 IP 10.0.1.1 > 10.0.2.2: ICMP echo request, id 15516, seq 533, length 64
00:00:02.986331 IP 10.0.1.1 > 10.0.2.2: ICMP echo request, id 15516, seq 534, length 64
00:00:02.991183 IP 10.0.1.1 > 10.0.2.2: ICMP echo request, id 15516, seq 535, length 64
00:00:02.996379 IP 10.0.1.1 > 10.0.2.2: ICMP echo request, id 15516, seq 536, length 64
00:00:03.001421 IP 10.0.1.1 > 10.0.2.2: ICMP echo request, id 15516, seq 537, length 64
00:00:03.006172 IP 10.0.1.1 > 10.0.2.2: ICMP echo request, id 15516, seq 538, length 64
00:00:03.011228 IP 10.0.1.1 > 10.0.2.2: ICMP echo request, id 15516, seq 539, length 64
00:00:03.016481 IP 10.0.1.1 > 10.0.2.2: ICMP echo request, id 15516, seq 540, length 64
00:00:03.021194 IP 10.0.1.1 > 10.0.2.2: ICMP echo request, id 15516, seq 541, length 64
00:00:03.026336 IP 10.0.1.1 > 10.0.2.2: ICMP echo request, id 15516, seq 542, length 64
00:00:03.031651 IP 10.0.1.1 > 10.0.2.2: ICMP echo request, id 15516, seq 543, length 64
00:00:03.036220 IP 10.0.1.1 > 10.0.2.2: ICMP echo request, id 15516, seq 544, length 64
00:00:03.041219 IP 10.0.1.1 > 10.0.2.2: ICMP echo request, id 15516, seq 545, length 64
00:00:03.046307 IP 10.0.1.1 > 10.0.2.2: ICMP echo request, id 15516, seq 546, length 64
00:00:03.051390 IP 10.0.1.1 > 10.0.2.2: ICMP echo request, id 15516, seq 547, length 64
00:00:03.056200 IP 10.0.1.1 > 10.0.2.2: ICMP echo request, id 15516, seq 548, length 64
00:00:03.061872 IP 10.0.1.1 > 10.0.2.2: ICMP echo request, id 15516, seq 549, length 64
00:00:03.066411 IP 10.0.1.1 > 10.0.2.2: ICMP echo request, id 15516, seq 550, length 64
00:00:03.071217 IP 10.0.1.1 > 10.0.2.2: ICMP echo request, id 15516, seq 551, length 64
00:00:03.076200 IP 10.0.1.1 > 10.0.2.2: ICMP echo request, id 15516, seq 552, length 64
00:00:03.081639 IP 10.0.1.1 > 10.0.2.2: ICMP echo request, id 15516, seq 553, length 64
00:00:03.086226 IP 10.0.1.1 > 10.0.2.2: ICMP echo request, id 15516, seq 554, length 64
00:00:03.091161 IP 10.0.1.1 > 10.0.2.2: ICMP echo request, id 15516, seq 555, length 64
00:00:03.096236 IP 10.0.1.1 > 10.0.2.2: ICMP echo request, id 15516, seq 556, length 64
00:00:03.101396 IP 10.0.1.1 > 10.0.2.2: ICMP echo request, id 15516, seq 557, length 64
00:00:03.106221 IP 10.0.1.1 > 10.0.2.2: ICMP echo request, id 15516, seq 558, length 64
00:00:03.111181 IP 10.0.1.1 > 10.0.2.2: ICMP echo request, id 15516, seq 559, length 64
00:00:03.116407 IP 10.0.1.1 > 10.0.2.2: ICMP echo request, id 15516, seq 560, length 64
00:00:03.121305 IP 10.0.1.1 > 10.0.2.2: ICMP echo request, id 15516, seq 561, length 64
00:00:03.126198 IP 10.0.1.1 > 10.0.2.2: ICMP echo request, id 15516, seq 562, length 64
00:00:03.131562 IP 10.0.1.1 > 10.0.2.2: ICMP echo request, id 15516, seq 563, length 64
00:00:03.136211 IP 10.0.1.1 > 10.0.2.2: ICMP echo request, id 15516, seq 564, length 64
00:00:03.141191 IP 10.0.1.1 > 10.0.2.2: ICMP echo request, id 15516, seq 565, length 64
00:00:03.146238 IP 10.0.1.1 > 10.0.2.2: ICMP echo request, id 15516, seq 566, length 64
00:00:03.151483 IP 10.0.1.1 > 10.0.2.2: ICMP echo request, id 15516, seq 567, length 64
00:00:03.156155 IP 10.0.1.1 > 10.0.2.2: ICMP echo request, id 15516, seq 568, length 64
00:00:03.162096 IP 10.0.1.1 > 10.0.2.2: ICMP echo request, id 15516, seq 569, length 64
00:00:03.166697 IP 10.0.1.1 > 10.0.2.2: ICMP echo request, id 15516, seq 570, length 64
00:00:03.171323 IP 10.0.1.1 > 10.0.2.2: ICMP echo request, id 15516, seq 571, length 64
00:00:03.176344 IP 10.0.1.1 > 10.0.2.2: ICMP echo request, id 15516, seq 572, length 64
00:00:03.181492 IP 10.0.1.1 > 10.0.2.2: ICMP echo request, id 15516, seq 573, length 64
00:00:03.186391 IP 10.0.1.1 > 10.0.2.2: ICMP echo request, id 15516, seq 574, length 64
00:00:03.191549 IP 10.0.1.1 > 10.0.2.2: ICMP echo request, id 15516, seq 575, length 64
00:00:03.196508 IP 10.0.1.1 > 10.0.2.2: ICMP echo request, id 15516, seq 576, length 64
00:00:03.201512 IP 10.0.1.1 > 10.0.2.2: ICMP echo request, id 15516, seq 577, length 64
00:00:03.206357 IP 10.0.1.1 > 10.0.2.2: ICMP echo request, id 15516, seq 578, length 64
00:00:03.211327 IP 10.0.1.1 > 10.0.2.2: ICMP echo request, id 15516, seq 579, length 64
00:00:03.216607 IP 10.0.1.1 > 10.0.2.2: ICMP echo request, id 15516, seq 580, length 64
00:00:03.221349 IP 10.0.1.1 > 10.0.2.2: ICMP echo request, id 15516, seq 581, length 64
00:00:03.226796 IP 10.0.1.1 > 10.0.2.2: ICMP echo request, id 15516, seq 582, length 64
00:00:03.231475 IP 10.0.1.1 > 10.0.2.2: ICMP echo request, id 15516, seq 583, length 64
00:00:03.236516 IP 10.0.1.1 > 10.0.2.2: ICMP echo request, id 15516, seq 584, length 64
00:00:03.241311 IP 10.0.1.1 > 10.0.2.2: ICMP echo request, id 15516, seq 585, length 64
00:00:03.246280 IP 10.0.1.1 > 10.0.2.2: ICMP echo request, id 15516, seq 586, length 64
00:00:03.251472 IP 10.0.1.1 > 10.0.2.2: ICMP echo request, id 15516, seq 587, length 64
00:00:03.256512 IP 10.0.1.1 > 10.0.2.2: ICMP echo request, id 15516, seq 588, length 64
00:00:03.261245 IP 10.0.1.1 > 10.0.2.2: ICMP echo request, id 15516, seq 589, length 64
00:00:03.266500 IP 10.0.1.1 > 10.0.2.2: ICMP echo request, id 15516, seq 590, length 64
00:00:03.271231 IP 10.0.1.1 > 10.0.2.2: ICMP echo request, id 15516, seq 591, length 64
00:00:03.276437 IP 10.0.1.1 > 10.0.2.2: ICMP echo request, id 15516, seq 592, length 64
00:00:03.281403 IP 10.0.1.1 > 10.0.2.2: ICMP echo request, id 15516, seq 593, length 64
00:00:03.286465 IP 10.0.1.1 > 10.0.2.2: ICMP echo request, id 15516, seq 594, length 64
00:00:03.291307 IP 10.0.1.1 > 10.0.2.2: ICMP echo request, id 15516, seq 595, length 64
00:00:03.296427 IP 10.0.1.1 > 10.0.2.2: ICMP echo request, id 15516, seq 596, length 64
00:00:03.301431 IP 10.0.1.1 > 10.0.2.2: ICMP echo request, id 15516, seq 597, length 64
00:00:03.306275 IP 10.0.1.1 > 10.0.2.2: ICMP echo request, id 15516, seq 598, length 64
00:00:03.311234 IP 10.0.1.1 > 10.0.2.2: ICMP echo request, id 15516, seq 599, length 64
00:00:03.316513 IP 10.0.1.1 > 10.0.2.2: ICMP echo request, id 15516, seq 600, length 64
00:00:03.321383 IP 10.0.1.1 > 10.0.2.2: ICMP echo request, id 15516, seq 601, length 64
00:00:03.326226 IP 10.0.1.1 > 10.0.2.2: ICMP echo request, id 15516, seq 602, length 64
00:00:03.331411 IP 10.0.1.1 > 10.0.2.2: ICMP echo request, id 15516, seq 603, length 64
00:00:03.336507 IP 10.0.1.1 > 10.0.2.2: ICMP echo request, id 15516, seq 604, length 64
00:00:03.341225 IP 10.0.1.1 > 10.0.2.2: ICMP echo request, id 15516, seq 605, length 64
00:00:03.345252 IP 10.0.1.1 > 10.0.2.2: ICMP echo request, id 15516, seq 606, length 64
00:00:03.350551 IP 10.0.1.1 > 10.0.2.2: ICMP echo request, id 15516, seq 607, length 64
00:00:03.355249 IP 10.0.1.1 > 10.0.2.2: ICMP echo request, id 15516, seq 608, length 64
00:00:03.360311 IP 10.0.1.1 > 10.0.2.2: ICMP echo request, id 15516, seq 609, length 64
00:00:03.365589 IP 10.0.1.1 > 10.0.2.2: ICMP echo request, id 15516, seq 610, length 64
00:00:03.370464 IP 10.0.1.1 > 10.0.2.2: ICMP echo request, id 15516, seq 611, length 64
00:00:03.375259 IP 10.0.1.1 > 10.0.2.2: ICMP echo request, id 15516, seq 612, length 64
00:00:03.380298 IP 10.0.1.1 > 10.0.2.2: ICMP echo request, id 15516, seq 613, length 64
00:00:03.385484 IP 10.0.1.1 > 10.0.2.2: ICMP echo request, id 15516, seq 614, length 64
00:00:03.390242 IP 10.0.1.1 > 10.0.2.2: ICMP echo request, id 15516, seq 615, length 64
00:00:03.395209 IP 10.0.1.1 > 10.0.2.2: ICMP echo request, id 15516, seq 616, length 64
00:00:03.400540 IP 10.0.1.1 > 10.0.2.2: ICMP echo request, id 15516, seq 617, length 64
00:00:03.405396 IP 10.0.1.1 > 10.0.2.2: ICMP echo request, id 15516, seq 618, length 64
00:00:03.410265 IP 10.0.1.1 > 10.0.2.2: ICMP echo request, id 15516, seq 619, length 64
00:00:03.415411 IP 10.0.1.1 > 10.0.2.2: ICMP echo request, id 15516, seq 620, length 64
00:00:03.420616 IP 10.0.1.1 > 10.0.2.2: ICMP echo request, id 15516, seq 621, length 64
00:00:03.425283 IP 10.0.1.1 > 10.0.2.2: ICMP echo request, id 15516, seq 622, length 64
00:00:03.430362 IP 10.0.1.1 > 10.0.2.2: ICMP echo request, id 15516, seq 623, length 64
00:00:03.435460 IP 10.0.1.1 > 10.0.2.2: ICMP echo request, id 15516, seq 624, length 64
00:00:03.440425 IP 10.0.1.1 > 10.0.2.2: ICMP echo request, id 15516, seq 625, length 64
00:00:03.445236 IP 10.0.1.1 > 10.0.2.2: ICMP echo request, id 15516, seq 626, length 64
00:00:03.450671 IP 10.0.1.1 > 10.0.2.2: ICMP echo request, id 15516, seq 627, length 64
00:00:03.455529 IP 10.0.1.1 > 10.0.2.2: ICMP echo request, id 15516, seq 628, length 64
00:00:03.460427 IP 10.0.1.1 > 10.0.2.2: ICMP echo request, id 15516, seq 629, length 64
00:00:03.465632 IP 10.0.1.1 > 10.0.2.2: ICMP echo request, id 15516, seq 630, length 64
00:00:03.470587 IP 10.0.1.1 > 10.0.2.2: ICMP echo request, id 15516, seq 631, length 64
00:00:03.475360 IP 10.0.1.1 > 10.0.2.2: ICMP echo request, id 15516, seq 632, length 64
00:00:03.480538 IP 10.0.1.1 > 10.0.2.2: ICMP echo request, id 15516, seq 633, length 64
00:00:03.485560 IP 10.0.1.1 > 10.0.2.2: ICMP echo request, id 15516, seq 634, length 64
00:00:03.490455 IP 10.0.1.1 > 10.0.2.2: ICMP echo request, id 15516, seq 635, length 64
00:00:03.495362 IP 10.0.1.1 > 10.0.2.2: ICMP echo request, id 15516, seq 636, length 64
00:00:03.500683 IP 10.0.1.1 > 10.0.2.2: ICMP echo request, id 15516, seq 637, length 64
00:00:03.505479 IP 10.0.1.1 > 10.0.2.2: ICMP echo request, id 15516, seq 638, length 64
00:00:03.510383 IP 10.0.1.1 > 10.0.2.2: ICMP echo request, id 15516, seq 639, length 64
00:00:03.515543 IP 10.0.1.1 > 10.0.2.2: ICMP echo request, id 15516, seq 640, length 64
00:00:03.520527 IP 10.0.1.1 > 10.0.2.2: ICMP echo request, id 15516, seq 641, length 64
00:00:03.525367 IP 10.0.1.1 > 10.0.2.2: ICMP echo request, id 15516, seq 642, length 64
00:00:03.530434 IP 10.0.1.1 > 10.0.2.2: ICMP echo request, id 15516, seq 643, length 64
00:00:03.535515 IP 10.0.1.1 > 10.0.2.2: ICMP echo request, id 15516, seq 644, length 64
00:00:03.540471 IP 10.0.1.1 > 10.0.2.2: ICMP echo request, id 15516, seq 645, length 64
00:00:03.545383 IP 10.0.1.1 > 10.0.2.2: ICMP echo request, id 15516, seq 646, length 64
00:00:03.550572 IP 10.0.1.1 > 10.0.2.2: ICMP echo request, id 15516, seq 647, length 64
00:00:03.555570 IP 10.0.1.1 > 10.0.2.2: ICMP echo request, id 15516, seq 648, length 64
00:00:03.560579 IP 10.0.1.1 > 10.0.2.2: ICMP echo request, id 15516, seq 649, length 64
00:00:03.565558 IP 10.0.1.1 > 10.0.2.2: ICMP echo request, id 15516, seq 650, length 64
00:00:03.570592 IP 10.0.1.1 > 10.0.2.2: ICMP echo request, id 15516, seq 651, length 64
00:00:03.575366 IP 10.0.1.1 > 10.0.2.2: ICMP echo request, id 15516, seq 652, length 64
00:00:03.580615 IP 10.0.1.1 > 10.0.2.2: ICMP echo request, id 15516, seq 653, length 64
00:00:03.585509 IP 10.0.1.1 > 10.0.2.2: ICMP echo request, id 15516, seq 654, length 64
00:00:03.590414 IP 10.0.1.1 > 10.0.2.2: ICMP echo request, id 15516, seq 655, length 64
00:00:03.595383 IP 10.0.1.1 > 10.0.2.2: ICMP echo request, id 15516, seq 656, length 64
00:00:03.600607 IP 10.0.1.1 > 10.0.2.2: ICMP echo request, id 15516, seq 657, length 64
00:00:03.605500 IP 10.0.1.1 > 10.0.2.2: ICMP echo request, id 15516, seq 658, length 64
00:00:03.610446 IP 10.0.1.1 > 10.0.2.2: ICMP echo request, id 15516, seq 659, length 64
00:00:03.615603 IP 10.0.1.1 > 10.0.2.2: ICMP echo request, id 15516, seq 660, length 64
00:00:03.620672 IP 10.0.1.1 > 10.0.2.2: ICMP echo request, id 15516, seq 661, length 64
00:00:03.625477 IP 10.0.1.1 > 10.0.2.2: ICMP echo request, id 15516, seq 662, length 64
00:00:03.630429 IP 10.0.1.1 > 10.0.2.2: ICMP echo request, id 15516, seq 663, length 64
00:00:03.635555 IP 10.0.1.1 > 10.0.2.2: ICMP echo request, id 15516, seq 664, length 64
00:00:03.640552 IP 10.0.1.1 > 10.0.2.2: ICMP echo request, id 15516, seq 665, length 64
00:00:03.645379 IP 10.0.1.1 > 10.0.2.2: ICMP echo request, id 15516, seq 666, length 64
00:00:03.650580 IP 10.0.1.1 > 10.0.2.2: ICMP echo request, id 15516, seq 667, length 64
00:00:03.655430 IP 10.0.1.1 > 10.0.2.2: ICMP echo request, id 15516, seq 668, length 64
00:00:03.660486 IP 10.0.1.1 > 10.0.2.2: ICMP echo request, id 15516, seq 669, length 64
00:00:03.665667 IP 10.0.1.1 > 10.0.2.2: ICMP echo request, id 15516, seq 670, length 64
00:00:03.671041 IP 10.0.1.1 > 10.0.2.2: ICMP echo request, id 15516, seq 671, length 64
00:00:03.675784 IP 10.0.1.1 > 10.0.2.2: ICMP echo request, id 15516, seq 672, length 64
00:00:03.680535 IP 10.0.1.1 > 10.0.2.2: ICMP echo request, id 15516, seq 673, length 64
00:00:03.685580 IP 10.0.1.1 > 10.0.2.2: ICMP echo request, id 15516, seq 674, length 64
00:00:03.690556 IP 10.0.1.1 > 10.0.2.2: ICMP echo request, id 15516, seq 675, length 64
00:00:03.695553 IP 10.0.1.1 > 10.0.2.2: ICMP echo request, id 15516, seq 676, length 64
00:00:03.700681 IP 10.0.1.1 > 10.0.2.2: ICMP echo request, id 15516, seq 677, length 64
00:00:03.705566 IP 10.0.1.1 > 10.0.2.2: ICMP echo request, id 15516, seq 678, length 64
00:00:03.710416 IP 10.0.1.1 > 10.0.2.2: ICMP echo request, id 15516, seq 679, length 64
00:00:03.715560 IP 10.0.1.1 > 10.0.2.2: ICMP echo request, id 15516, seq 680, length 64
00:00:03.720606 IP 10.0.1.1 > 10.0.2.2: ICMP echo request, id 15516, seq 681, length 64
00:00:03.725361 IP 10.0.1.1 > 10.0.2.2: ICMP echo request, id 15516, seq 682, length 64
00:00:03.730504 IP 10.0.1.1 > 10.0.2.2: ICMP echo request, id 15516, seq 683, length 64
00:00:03.735461 IP 10.0.1.1 > 10.0.2.2: ICMP echo request, id 15516, seq 684, length 64
00:00:03.740446 IP 10.0.1.1 > 10.0.2.2: ICMP echo request, id 15516, seq 685, length 64
00:00:03.745350 IP 10.0.1.1 > 10.0.2.2: ICMP echo request, id 15516, seq 686, length 64
00:00:03.750589 IP 10.0.1.1 > 10.0.2.2: ICMP echo request, id 15516, seq 687, length 64
00:00:03.755435 IP 10.0.1.1 > 10.0.2.2: ICMP echo request, id 15516, seq 688, length 64
00:00:03.760441 IP 10.0.1.1 > 10.0.2.2: ICMP echo request, id 15516, seq 689, length 64
00:00:03.765566 IP 10.0.1.1 > 10.0.2.2: ICMP echo request, id 15516, seq 690, length 64
00:00:03.770502 IP 10.0.1.1 > 10.0.2.2: ICMP echo request, id 15516, seq 691, length 64
00:00:03.775385 IP 10.0.1.1 > 10.0.2.2: ICMP echo request, id 15516, seq 692, length 64
00:00:03.780552 IP 10.0.1.1 > 10.0.2.2: ICMP echo request, id 15516, seq 693, length 64
00:00:03.785503 IP 10.0.1.1 > 10.0.2.2: ICMP echo request, id 15516, seq 694, length 64
00:00:03.790465 IP 10.0.1.1 > 10.0.2.2: ICMP echo request, id 15516, seq 695, length 64
00:00:03.795363 IP 10.0.1.1 > 10.0.2.2: ICMP echo request, id 15516, seq 696, length 64
00:00:03.800681 IP 10.0.1.1 > 10.0.2.2: ICMP echo request, id 15516, seq 697, length 64
00:00:03.805473 IP 10.0.1.1 > 10.0.2.2: ICMP echo request, id 15516, seq 698, length 64
00:00:03.810401 IP 10.0.1.1 > 10.0.2.2: ICMP echo request, id 15516, seq 699, length 64
00:00:03.815530 IP 10.0.1.1 > 10.0.2.2: ICMP echo request, id 15516, seq 700, length 64
00:00:03.820502 IP 10.0.1.1 > 10.0.2.2: ICMP echo request, id 15516, seq 701, length 64
00:00:03.825366 IP 10.0.1.1 > 10.0.2.2: ICMP echo request, id 15516, seq 702, length 64
00:00:03.830523 IP 10.0.1.1 > 10.0.2.2: ICMP echo request, id 15516, seq 703, length 64
00:00:03.835466 IP 10.0.1.1 > 10.0.2.2: ICMP echo request, id 15516, seq 704, length 64
00:00:03.840490 IP 10.0.1.1 > 10.0.2.2: ICMP echo request, id 15516, seq 705, length 64
00:00:03.845368 IP 10.0.1.1 > 10.0.2.2: ICMP echo request, id 15516, seq 706, length 64
00:00:03.850599 IP 10.0.1.1 > 10.0.2.2: ICMP echo request, id 15516, seq 707, length 64
00:00:03.855509 IP 10.0.1.1 > 10.0.2.2: ICMP echo request, id 15516, seq 708, length 64
00:00:03.860391 IP 10.0.1.1 > 10.0.2.2: ICMP echo request, id 15516, seq 709, length 64
00:00:03.865546 IP 10.0.1.1 > 10.0.2.2: ICMP echo request, id 15516, seq 710, length 64
00:00:03.870550 IP 10.0.1.1 > 10.0.2.2: ICMP echo request, id 15516, seq 711, length 64
00:00:03.875465 IP 10.0.1.1 > 10.0.2.2: ICMP echo request, id 15516, seq 712, length 64
00:00:03.880566 IP 10.0.1.1 > 10.0.2.2: ICMP echo request, id 15516, seq 713, length 64
00:00:03.885517 IP 10.0.1.1 > 10.0.2.2: ICMP echo request, id 15516, seq 714, length 64
00:00:03.890492 IP 10.0.1.1 > 10.0.2.2: ICMP echo request, id 15516, seq 715, length 64
00:00:03.895341 IP 10.0.1.1 > 10.0.2.2: ICMP echo request, id 15516, seq 716, length 64
00:00:03.900609 IP 10.0.1.1 > 10.0.2.2: ICMP echo request, id 15516, seq 717, length 64
00:00:03.905499 IP 10.0.1.1 > 10.0.2.2: ICMP echo request, id 15516, seq 718, length 64
00:00:03.910373 IP 10.0.1.1 > 10.0.2.2: ICMP echo request, id 15516, seq 719, length 64
00:00:03.915605 IP 10.0.1.1 > 10.0.2.2: ICMP echo request, id 15516, seq 720, length 64
00:00:03.920910 IP 10.0.1.1 > 10.0.2.2: ICMP echo request, id 15516, seq 721, length 64
00:00:03.925465 IP 10.0.1.1 > 10.0.2.2: ICMP echo request, id 15516, seq 722, length 64
00:00:03.930529 IP 10.0.1.1 > 10.0.2.2: ICMP echo request, id 15516, seq 723, length 64
00:00:03.935426 IP 10.0.1.1 > 10.0.2.2: ICMP echo request, id 15516, seq 724, length 64
00:00:03.940578 IP 10.0.1.1 > 10.0.2.2: ICMP echo request, id 15516, seq 725, length 64
00:00:03.945505 IP 10.0.1.1 > 10.0.2.2: ICMP echo request, id 15516, seq 726, length 64
00:00:03.950491 IP 10.0.1.1 > 10.0.2.2: ICMP echo request, id 15516, seq 727, length 64
00:00:03.955509 IP 10.0.1.1 > 10.0.2.2: ICMP echo request, id 15516, seq 728, length 64
00:00:03.960470 IP 10.0.1.1 > 10.0.2.2: ICMP echo request, id 15516, seq 729, length 64
00:00:03.965439 IP 10.0.1.1 > 10.0.2.2: ICMP echo request, id 15516, seq 730, length 64
00:00:03.970683 IP 10.0.1.1 > 10.0.2.2: ICMP echo request, id 15516, seq 731, length 64
00:00:03.975730 IP 10.0.1.1 > 10.0.2.2: ICMP echo request, id 15516, seq 732, length 64
00:00:03.980432 IP 10.0.1.1 > 10.0.2.2: ICMP echo request, id 15516, seq 733, length 64
00:00:03.985850 IP 10.0.1.1 > 10.0.2.2: ICMP echo request, id 15516, seq 734, length 64
00:00:03.990760 IP 10.0.1.1 > 10.0.2.2: ICMP echo request, id 15516, seq 735, length 64
00:00:03.995829 IP 10.0.1.1 > 10.0.2.2: ICMP echo request, id 15516, seq 736, length 64
00:00:04.000591 IP 10.0.1.1 > 10.0.2.2: ICMP echo request, id 15516, seq 737, length 64
00:00:04.005497 IP 10.0.1.1 > 10.0.2.2: ICMP echo request, id 15516, seq 738, length 64
00:00:04.010474 IP 10.0.1.1 > 10.0.2.2: ICMP echo request, id 15516, seq 739, length 64
00:00:04.015526 IP 10.0.1.1 > 10.0.2.2: ICMP echo request, id 15516, seq 740, length 64
00:00:04.020548 IP 10.0.1.1 > 10.0.2.2: ICMP echo request, id 15516, seq 741, length 64
00:00:04.025456 IP 10.0.1.1 > 10.0.2.2: ICMP echo request, id 15516, seq 742, length 64
00:00:04.030462 IP 10.0.1.1 > 10.0.2.2: ICMP echo request, id 15516, seq 743, length 64
00:00:04.035440 IP 10.0.1.1 > 10.0.2.2: ICMP echo request, id 15516, seq 744, length 64
00:00:04.040907 IP 10.0.1.1 > 10.0.2.2: ICMP echo request, id 15516, seq 745, length 64
00:00:04.045756 IP 10.0.1.1 > 10.0.2.2: ICMP echo request, id 15516, seq 746, length 64
00:00:04.050688 IP 10.0.1.1 > 10.0.2.2: ICMP echo request, id 15516, seq 747, length 64
00:00:04.055666 IP 10.0.1.1 > 10.0.2.2: ICMP echo request, id 15516, seq 748, length 64
00:00:04.060593 IP 10.0.1.1 > 10.0.2.2: ICMP echo request, id 15516, seq 749, length 64
00:00:04.065516 IP 10.0.1.1 > 10.0.2.2: ICMP echo request, id 15516, seq 750, length 64
00:00:04.070590 IP 10.0.1.1 > 10.0.2.2: ICMP echo request, id 15516, seq 751, length 64
00:00:04.075572 IP 10.0.1.1 > 10.0.2.2: ICMP echo request, id 15516, seq 752, length 64
00:00:04.080597 IP 10.0.1.1 > 10.0.2.2: ICMP echo request, id 15516, seq 753, length 64
00:00:04.085553 IP 10.0.1.1 > 10.0.2.2: ICMP echo request, id 15516, seq 754, length 64
00:00:04.090585 IP 10.0.1.1 > 10.0.2.2: ICMP echo request, id 15516, seq 755, length 64
00:00:04.095486 IP 10.0.1.1 > 10.0.2.2: ICMP echo request, id 15516, seq 756, length 64
00:00:04.100536 IP 10.0.1.1 > 10.0.2.2: ICMP echo request, id 15516, seq 757, length 64
00:00:04.105727 IP 10.0.1.1 > 10.0.2.2: ICMP echo request, id 15516, seq 758, length 64
00:00:04.110506 IP 10.0.1.1 > 10.0.2.2: ICMP echo request, id 15516, seq 759, length 64
00:00:04.116061 IP 10.0.1.1 > 10.0.2.2: ICMP echo request, id 15516, seq 760, length 64
00:00:04.120720 IP 10.0.1.1 > 10.0.2.2: ICMP echo request, id 15516, seq 761, length 64
00:00:04.125703 IP 10.0.1.1 > 10.0.2.2: ICMP echo request, id 15516, seq 762, length 64
00:00:04.130703 IP 10.0.1.1 > 10.0.2.2: ICMP echo request, id 15516, seq 763, length 64
00:00:04.135624 IP 10.0.1.1 > 10.0.2.2: ICMP echo request, id 15516, seq 764, length 64
00:00:04.140740 IP 10.0.1.1 > 10.0.2.2: ICMP echo request, id 15516, seq 765, length 64
00:00:04.145777 IP 10.0.1.1 > 10.0.2.2: ICMP echo request, id 15516, seq 766, length 64
00:00:04.150758 IP 10.0.1.1 > 10.0.2.2: ICMP echo request, id 15516, seq 767, length 64
00:00:04.155751 IP 10.0.1.1 > 10.0.2.2: ICMP echo request, id 15516, seq 768, length 64
00:00:04.160774 IP 10.0.1.1 > 10.0.2.2: ICMP echo request, id 15516, seq 769, length 64
00:00:04.165747 IP 10.0.1.1 > 10.0.2.2: ICMP echo request, id 15516, seq 770, length 64
00:00:04.170737 IP 10.0.1.1 > 10.0.2.2: ICMP echo request, id 15516, seq 771, length 64
00:00:04.175762 IP 10.0.1.1 > 10.0.2.2: ICMP echo request, id 15516, seq 772, length 64
00:00:04.180744 IP 10.0.1.1 > 10.0.2.2: ICMP echo request, id 15516, seq 773, length 64
00:00:04.185745 IP 10.0.1.1 > 10.0.2.2: ICMP echo request, id 15516, seq 774, length 64
00:00:04.190739 IP 10.0.1.1 > 10.0.2.2: ICMP echo request, id 15516, seq 775, length 64
00:00:04.195898 IP 10.0.1.1 > 10.0.2.2: ICMP echo request, id 15516, seq 776, length 64
00:00:04.200770 IP 10.0.1.1 > 10.0.2.2: ICMP echo request, id 15516, seq 777, length 64
00:00:04.205753 IP 10.0.1.1 > 10.0.2.2: ICMP echo request, id 15516, seq 778, length 64
00:00:04.210755 IP 10.0.1.1 > 10.0.2.2: ICMP echo request, id 15516, seq 779, length 64
00:00:04.215811 IP 10.0.1.1 > 10.0.2.2: ICMP echo request, id 15516, seq 780, length 64
00:00:04.220743 IP 10.0.1.1 > 10.0.2.2: ICMP echo request, id 15516, seq 781, length 64
00:00:04.225754 IP 10.0.1.1 > 10.0.2.2: ICMP echo request, id 15516, seq 782, length 64
00:00:04.230916 IP 10.0.1.1 > 10.0.2.2: ICMP echo request, id 15516, seq 783, length 64
00:00:04.235747 IP 10.0.1.1 > 10.0.2.2: ICMP echo request, id 15516, seq 784, length 64
00:00:04.240919 IP 10.0.1.1 > 10.0.2.2: ICMP echo request, id 15516, seq 785, length 64
00:00:04.245938 IP 10.0.1.1 > 10.0.2.2: ICMP echo request, id 15516, seq 786, length 64
00:00:04.250776 IP 10.0.1.1 > 10.0.2.2: ICMP echo request, id 15516, seq 787, length 64
00:00:04.255817 IP 10.0.1.1 > 10.0.2.2: ICMP echo request, id 15516, seq 788, length 64
00:00:04.260854 IP 10.0.1.1 > 10.0.2.2: ICMP echo request, id 15516, seq 789, length 64
00:00:04.266007 IP 10.0.1.1 > 10.0.2.2: ICMP echo request, id 15516, seq 790, length 64
00:00:04.270798 IP 10.0.1.1 > 10.0.2.2: ICMP echo request, id 15516, seq 791, length 64
00:00:04.275860 IP 10.0.1.1 > 10.0.2.2: ICMP echo request, id 15516, seq 792, length 64
00:00:04.280989 IP 10.0.1.1 > 10.0.2.2: ICMP echo request, id 15516, seq 793, length 64
00:00:04.285953 IP 10.0.1.1 > 10.0.2.2: ICMP echo request, id 15516, seq 794, length 64
00:00:04.290909 IP 10.0.1.1 > 10.0.2.2: ICMP echo request, id 15516, seq 795, length 64
00:00:04.295964 IP 10.0.1.1 > 10.0.2.2: ICMP echo request, id 15516, seq 796, length 64
00:00:04.300861 IP 10.0.1.1 > 10.0.2.2: ICMP echo request, id 15516, seq 797, length 64
00:00:04.305742 IP 10.0.1.1 > 10.0.2.2: ICMP echo request, id 15516, seq 798, length 64
00:00:04.310809 IP 10.0.1.1 > 10.0.2.2: ICMP echo request, id 15516, seq 799, length 64
00:00:04.315778 IP 10.0.1.1 > 10.0.2.2: ICMP echo request, id 15516, seq 800, length 64
00:00:04.320752 IP 10.0.1.1 > 10.0.2.2: ICMP echo request, id 15516, seq 801, length 64
00:00:04.325715 IP 10.0.1.1 > 10.0.2.2: ICMP echo request, id 15516, seq 802, length 64
00:00:04.330781 IP 10.0.1.1 > 10.0.2.2: ICMP echo request, id 15516, seq 803, length 64
00:00:04.335730 IP 10.0.1.1 > 10.0.2.2: ICMP echo request, id 15516, seq 804, length 64
00:00:04.340722 IP 10.0.1.1 > 10.0.2.2: ICMP echo request, id 15516, seq 805, length 64
00:00:04.344728 IP 10.0.1.1 > 10.0.2.2: ICMP echo request, id 15516, seq 806, length 64
00:00:04.349943 IP 10.0.1.1 > 10.0.2.2: ICMP echo request, id 15516, seq 807, length 64
00:00:04.355032 IP 10.0.1.1 > 10.0.2.2: ICMP echo request, id 15516, seq 808, length 64
00:00:04.360152 IP 10.0.1.1 > 10.0.2.2: ICMP echo request, id 15516, seq 809, length 64
00:00:04.364862 IP 10.0.1.1 > 10.0.2.2: ICMP echo request, id 15516, seq 810, length 64
00:00:04.369899 IP 10.0.1.1 > 10.0.2.2: ICMP echo request, id 15516, seq 811, length 64
00:00:04.374815 IP 10.0.1.1 > 10.0.2.2: ICMP echo request, id 15516, seq 812, length 64
00:00:04.379840 IP 10.0.1.1 > 10.0.2.2: ICMP echo request, id 15516, seq 813, length 64
00:00:04.384832 IP 10.0.1.1 > 10.0.2.2: ICMP echo request, id 15516, seq 814, length 64
00:00:04.390118 IP 10.0.1.1 > 10.0.2.2: ICMP echo request, id 15516, seq 815, length 64
00:00:04.394886 IP 10.0.1.1 > 10.0.2.2: ICMP echo request, id 15516, seq 816, length 64
00:00:04.399868 IP 10.0.1.1 > 10.0.2.2: ICMP echo request, id 15516, seq 817, length 64
00:00:04.405081 IP 10.0.1.1 > 10.0.2.2: ICMP echo request, id 15516, seq 818, length 64
00:00:04.410110 IP 10.0.1.1 > 10.0.2.2: ICMP echo request, id 15516, seq 819, length 64
00:00:04.415089 IP 10.0.1.1 > 10.0.2.2: ICMP echo request, id 15516, seq 820, length 64
00:00:04.419804 IP 10.0.1.1 > 10.0.2.2: ICMP echo request, id 15516, seq 821, length 64
00:00:04.424879 IP 10.0.1.1 > 10.0.2.2: ICMP echo request, id 15516, seq 822, length 64
00:00:04.429806 IP 10.0.1.1 > 10.0.2.2: ICMP echo request, id 15516, seq 823, length 64
