00:00:00.000000 IP 10.0.0.1 > 10.0.0.2: ICMP echo request, id 25121, seq 7, length 64
00:00:00.011641 IP 10.0.0.1 > 10.0.0.2: ICMP echo request, id 25121, seq 8, length 64
00:00:00.022946 IP 10.0.0.1 > 10.0.0.2: ICMP echo request, id 25121, seq 9, length 64
00:00:00.035396 IP 10.0.0.1 > 10.0.0.2: ICMP echo request, id 25121, seq 10, length 64
00:00:00.047335 IP 10.0.0.1 > 10.0.0.2: ICMP echo request, id 25121, seq 11, length 64
00:00:00.060535 IP 10.0.0.1 > 10.0.0.2: ICMP echo request, id 25121, seq 12, length 64
00:00:00.071318 IP 10.0.0.1 > 10.0.0.2: ICMP echo request, id 25121, seq 13, length 64
00:00:00.083062 IP 10.0.0.1 > 10.0.0.2: ICMP echo request, id 25121, seq 14, length 64
00:00:00.097528 IP 10.0.0.1 > 10.0.0.2: ICMP echo request, id 25121, seq 15, length 64
00:00:00.107990 IP 10.0.0.1 > 10.0.0.2: ICMP echo request, id 25121, seq 16, length 64
00:00:00.122155 IP 10.0.0.1 > 10.0.0.2: ICMP echo request, id 25121, seq 17, length 64
00:00:00.132154 IP 10.0.0.1 > 10.0.0.2: ICMP echo request, id 25121, seq 18, length 64
00:00:00.143158 IP 10.0.0.1 > 10.0.0.2: ICMP echo request, id 25121, seq 19, length 64
00:00:00.156974 IP 10.0.0.1 > 10.0.0.2: ICMP echo request, id 25121, seq 20, length 64
00:00:00.167191 IP 10.0.0.1 > 10.0.0.2: ICMP echo request, id 25121, seq 21, length 64
00:00:00.179230 IP 10.0.0.1 > 10.0.0.2: ICMP echo request, id 25121, seq 22, length 64
00:00:00.191563 IP 10.0.0.1 > 10.0.0.2: ICMP echo request, id 25121, seq 23, length 64
00:00:00.208181 IP 10.0.0.1 > 10.0.0.2: ICMP echo request, id 25121, seq 24, length 64
00:00:00.220601 IP 10.0.0.1 > 10.0.0.2: ICMP echo request, id 25121, seq 25, length 64
00:00:00.231163 IP 10.0.0.1 > 10.0.0.2: ICMP echo request, id 25121, seq 26, length 64
00:00:00.242887 IP 10.0.0.1 > 10.0.0.2: ICMP echo request, id 25121, seq 27, length 64
00:00:00.256676 IP 10.0.0.1 > 10.0.0.2: ICMP echo request, id 25121, seq 28, length 64
00:00:00.269222 IP 10.0.0.1 > 10.0.0.2: ICMP echo request, id 25121, seq 29, length 64
00:00:00.279561 IP 10.0.0.1 > 10.0.0.2: ICMP echo request, id 25121, seq 30, length 64
00:00:00.296487 IP 10.0.0.1 > 10.0.0.2: ICMP echo request, id 25121, seq 31, length 64
00:00:00.308050 IP 10.0.0.1 > 10.0.0.2: ICMP echo request, id 25121, seq 32, length 64
00:00:00.319550 IP 10.0.0.1 > 10.0.0.2: ICMP echo request, id 25121, seq 33, length 64
00:00:00.334877 IP 10.0.0.1 > 10.0.0.2: ICMP echo request, id 25121, seq 34, length 64
00:00:00.345598 IP 10.0.0.1 > 10.0.0.2: ICMP echo request, id 25121, seq 35, length 64
00:00:00.356782 IP 10.0.0.1 > 10.0.0.2: ICMP echo request, id 25121, seq 36, length 64
00:00:00.367000 IP 10.0.0.1 > 10.0.0.2: ICMP echo request, id 25121, seq 37, length 64
00:00:00.383621 IP 10.0.0.1 > 10.0.0.2: ICMP echo request, id 25121, seq 38, length 64
00:00:00.395097 IP 10.0.0.1 > 10.0.0.2: ICMP echo request, id 25121, seq 39, length 64
00:00:00.411022 IP 10.0.0.1 > 10.0.0.2: ICMP echo request, id 25121, seq 40, length 64
00:00:00.425680 IP 10.0.0.1 > 10.0.0.2: ICMP echo request, id 25121, seq 41, length 64
00:00:00.435668 IP 10.0.0.1 > 10.0.0.2: ICMP echo request, id 25121, seq 42, length 64
00:00:00.452096 IP 10.0.0.1 > 10.0.0.2: ICMP echo request, id 25121, seq 43, length 64
00:00:00.464786 IP 10.0.0.1 > 10.0.0.2: ICMP echo request, id 25121, seq 44, length 64
00:00:00.478974 IP 10.0.0.1 > 10.0.0.2: ICMP echo request, id 25121, seq 45, length 64
00:00:00.491171 IP 10.0.0.1 > 10.0.0.2: ICMP echo request, id 25121, seq 46, length 64
00:00:00.503442 IP 10.0.0.1 > 10.0.0.2: ICMP echo request, id 25121, seq 47, length 64
00:00:00.515123 IP 10.0.0.1 > 10.0.0.2: ICMP echo request, id 25121, seq 48, length 64
00:00:00.530496 IP 10.0.0.1 > 10.0.0.2: ICMP echo request, id 25121, seq 49, length 64
00:00:00.541101 IP 10.0.0.1 > 10.0.0.2: ICMP echo request, id 25121, seq 50, length 64
00:00:00.551782 IP 10.0.0.1 > 10.0.0.2: ICMP echo request, id 25121, seq 51, length 64
00:00:00.563020 IP 10.0.0.1 > 10.0.0.2: ICMP echo request, id 25121, seq 52, length 64
00:00:00.577208 IP 10.0.0.1 > 10.0.0.2: ICMP echo request, id 25121, seq 53, length 64
00:00:00.589610 IP 10.0.0.1 > 10.0.0.2: ICMP echo request, id 25121, seq 54, length 64
00:00:00.600202 IP 10.0.0.1 > 10.0.0.2: ICMP echo request, id 25121, seq 55, length 64
00:00:00.610917 IP 10.0.0.1 > 10.0.0.2: ICMP echo request, id 25121, seq 56, length 64
00:00:00.626094 IP 10.0.0.1 > 10.0.0.2: ICMP echo request, id 25121, seq 57, length 64
00:00:00.636090 IP 10.0.0.1 > 10.0.0.2: ICMP echo request, id 25121, seq 58, length 64
00:00:00.647564 IP 10.0.0.1 > 10.0.0.2: ICMP echo request, id 25121, seq 59, length 64
00:00:00.659817 IP 10.0.0.1 > 10.0.0.2: ICMP echo request, id 25121, seq 60, length 64
00:00:00.674228 IP 10.0.0.1 > 10.0.0.2: ICMP echo request, id 25121, seq 61, length 64
00:00:00.684773 IP 10.0.0.1 > 10.0.0.2: ICMP echo request, id 25121, seq 62, length 64
00:00:00.695507 IP 10.0.0.1 > 10.0.0.2: ICMP echo request, id 25121, seq 63, length 64
00:00:00.709165 IP 10.0.0.1 > 10.0.0.2: ICMP echo request, id 25121, seq 64, length 64
00:00:00.722399 IP 10.0.0.1 > 10.0.0.2: ICMP echo request, id 25121, seq 65, length 64
00:00:00.732443 IP 10.0.0.1 > 10.0.0.2: ICMP echo request, id 25121, seq 66, length 64
00:00:00.743861 IP 10.0.0.1 > 10.0.0.2: ICMP echo request, id 25121, seq 67, length 64
00:00:00.755121 IP 10.0.0.1 > 10.0.0.2: ICMP echo request, id 25121, seq 68, length 64
00:00:00.767351 IP 10.0.0.1 > 10.0.0.2: ICMP echo request, id 25121, seq 69, length 64
00:00:00.779098 IP 10.0.0.1 > 10.0.0.2: ICMP echo request, id 25121, seq 70, length 64
00:00:00.791791 IP 10.0.0.1 > 10.0.0.2: ICMP echo request, id 25121, seq 71, length 64
00:00:00.803723 IP 10.0.0.1 > 10.0.0.2: ICMP echo request, id 25121, seq 72, length 64
00:00:00.818201 IP 10.0.0.1 > 10.0.0.2: ICMP echo request, id 25121, seq 73, length 64
00:00:00.828967 IP 10.0.0.1 > 10.0.0.2: ICMP echo request, id 25121, seq 74, length 64
00:00:00.844095 IP 10.0.0.1 > 10.0.0.2: ICMP echo request, id 25121, seq 75, length 64
00:00:00.856292 IP 10.0.0.1 > 10.0.0.2: ICMP echo request, id 25121, seq 76, length 64
00:00:00.870491 IP 10.0.0.1 > 10.0.0.2: ICMP echo request, id 25121, seq 77, length 64
00:00:00.881277 IP 10.0.0.1 > 10.0.0.2: ICMP echo request, id 25121, seq 78, length 64
00:00:00.891480 IP 10.0.0.1 > 10.0.0.2: ICMP echo request, id 25121, seq 79, length 64
00:00:00.903775 IP 10.0.0.1 > 10.0.0.2: ICMP echo request, id 25121, seq 80, length 64
00:00:00.918407 IP 10.0.0.1 > 10.0.0.2: ICMP echo request, id 25121, seq 81, length 64
00:00:00.928405 IP 10.0.0.1 > 10.0.0.2: ICMP echo request, id 25121, seq 82, length 64
00:00:00.939891 IP 10.0.0.1 > 10.0.0.2: ICMP echo request, id 25121, seq 83, length 64
00:00:00.952142 IP 10.0.0.1 > 10.0.0.2: ICMP echo request, id 25121, seq 84, length 64
00:00:00.962888 IP 10.0.0.1 > 10.0.0.2: ICMP echo request, id 25121, seq 85, length 64
00:00:00.976662 IP 10.0.0.1 > 10.0.0.2: ICMP echo request, id 25121, seq 86, length 64
00:00:00.986890 IP 10.0.0.1 > 10.0.0.2: ICMP echo request, id 25121, seq 87, length 64
00:00:01.001992 IP 10.0.0.1 > 10.0.0.2: ICMP echo request, id 25121, seq 88, length 64
00:00:01.011983 IP 10.0.0.1 > 10.0.0.2: ICMP echo request, id 25121, seq 89, length 64
00:00:01.022988 IP 10.0.0.1 > 10.0.0.2: ICMP echo request, id 25121, seq 90, length 64
00:00:01.036667 IP 10.0.0.1 > 10.0.0.2: ICMP echo request, id 25121, seq 91, length 64
00:00:01.050871 IP 10.0.0.1 > 10.0.0.2: ICMP echo request, id 25121, seq 92, length 64
00:00:01.066988 IP 10.0.0.1 > 10.0.0.2: ICMP echo request, id 25121, seq 93, length 64
00:00:01.078906 IP 10.0.0.1 > 10.0.0.2: ICMP echo request, id 25121, seq 94, length 64
00:00:01.091423 IP 10.0.0.1 > 10.0.0.2: ICMP echo request, id 25121, seq 95, length 64
00:00:01.103624 IP 10.0.0.1 > 10.0.0.2: ICMP echo request, id 25121, seq 96, length 64
00:00:01.119266 IP 10.0.0.1 > 10.0.0.2: ICMP echo request, id 25121, seq 97, length 64
00:00:01.135413 IP 10.0.0.1 > 10.0.0.2: ICMP echo request, id 25121, seq 98, length 64
00:00:01.148624 IP 10.0.0.1 > 10.0.0.2: ICMP echo request, id 25121, seq 99, length 64
00:00:01.160383 IP 10.0.0.1 > 10.0.0.2: ICMP echo request, id 25121, seq 100, length 64
00:00:01.173113 IP 10.0.0.1 > 10.0.0.2: ICMP echo request, id 25121, seq 101, length 64
00:00:01.186272 IP 10.0.0.1 > 10.0.0.2: ICMP echo request, id 25121, seq 102, length 64
00:00:01.197559 IP 10.0.0.1 > 10.0.0.2: ICMP echo request, id 25121, seq 103, length 64
00:00:01.207557 IP 10.0.0.1 > 10.0.0.2: ICMP echo request, id 25121, seq 104, length 64
00:00:01.220625 IP 10.0.0.1 > 10.0.0.2: ICMP echo request, id 25121, seq 105, length 64
00:00:01.231232 IP 10.0.0.1 > 10.0.0.2: ICMP echo request, id 25121, seq 106, length 64
00:00:01.246403 IP 10.0.0.1 > 10.0.0.2: ICMP echo request, id 25121, seq 107, length 64
00:00:01.256391 IP 10.0.0.1 > 10.0.0.2: ICMP echo request, id 25121, seq 108, length 64
00:00:01.267867 IP 10.0.0.1 > 10.0.0.2: ICMP echo request, id 25121, seq 109, length 64
00:00:01.279168 IP 10.0.0.1 > 10.0.0.2: ICMP echo request, id 25121, seq 110, length 64
00:00:01.291399 IP 10.0.0.1 > 10.0.0.2: ICMP echo request, id 25121, seq 111, length 64
00:00:01.303130 IP 10.0.0.1 > 10.0.0.2: ICMP echo request, id 25121, seq 112, length 64
00:00:01.315824 IP 10.0.0.1 > 10.0.0.2: ICMP echo request, id 25121, seq 113, length 64
00:00:01.327527 IP 10.0.0.1 > 10.0.0.2: ICMP echo request, id 25121, seq 114, length 64
00:00:01.341736 IP 10.0.0.1 > 10.0.0.2: ICMP echo request, id 25121, seq 115, length 64
00:00:01.351995 IP 10.0.0.1 > 10.0.0.2: ICMP echo request, id 25121, seq 116, length 64
00:00:01.363719 IP 10.0.0.1 > 10.0.0.2: ICMP echo request, id 25121, seq 117, length 64
00:00:01.376456 IP 10.0.0.1 > 10.0.0.2: ICMP echo request, id 25121, seq 118, length 64
00:00:01.387261 IP 10.0.0.1 > 10.0.0.2: ICMP echo request, id 25121, seq 119, length 64
00:00:01.400398 IP 10.0.0.1 > 10.0.0.2: ICMP echo request, id 25121, seq 120, length 64
00:00:01.412084 IP 10.0.0.1 > 10.0.0.2: ICMP echo request, id 25121, seq 121, length 64
00:00:01.426763 IP 10.0.0.1 > 10.0.0.2: ICMP echo request, id 25121, seq 122, length 64
00:00:01.436761 IP 10.0.0.1 > 10.0.0.2: ICMP echo request, id 25121, seq 123, length 64
00:00:01.447861 IP 10.0.0.1 > 10.0.0.2: ICMP echo request, id 25121, seq 124, length 64
00:00:01.463427 IP 10.0.0.1 > 10.0.0.2: ICMP echo request, id 25121, seq 125, length 64
00:00:01.477613 IP 10.0.0.1 > 10.0.0.2: ICMP echo request, id 25121, seq 126, length 64
00:00:01.487609 IP 10.0.0.1 > 10.0.0.2: ICMP echo request, id 25121, seq 127, length 64
00:00:01.499202 IP 10.0.0.1 > 10.0.0.2: ICMP echo request, id 25121, seq 128, length 64
00:00:01.511815 IP 10.0.0.1 > 10.0.0.2: ICMP echo request, id 25121, seq 129, length 64
00:00:01.526029 IP 10.0.0.1 > 10.0.0.2: ICMP echo request, id 25121, seq 130, length 64
00:00:01.536286 IP 10.0.0.1 > 10.0.0.2: ICMP echo request, id 25121, seq 131, length 64
00:00:01.547017 IP 10.0.0.1 > 10.0.0.2: ICMP echo request, id 25121, seq 132, length 64
00:00:01.562205 IP 10.0.0.1 > 10.0.0.2: ICMP echo request, id 25121, seq 133, length 64
00:00:01.574412 IP 10.0.0.1 > 10.0.0.2: ICMP echo request, id 25121, seq 134, length 64
00:00:01.584408 IP 10.0.0.1 > 10.0.0.2: ICMP echo request, id 25121, seq 135, length 64
00:00:01.598348 IP 10.0.0.1 > 10.0.0.2: ICMP echo request, id 25121, seq 136, length 64
00:00:01.608337 IP 10.0.0.1 > 10.0.0.2: ICMP echo request, id 25121, seq 137, length 64
00:00:01.620368 IP 10.0.0.1 > 10.0.0.2: ICMP echo request, id 25121, seq 138, length 64
00:00:01.631101 IP 10.0.0.1 > 10.0.0.2: ICMP echo request, id 25121, seq 139, length 64
00:00:01.643381 IP 10.0.0.1 > 10.0.0.2: ICMP echo request, id 25121, seq 140, length 64
00:00:01.657039 IP 10.0.0.1 > 10.0.0.2: ICMP echo request, id 25121, seq 141, length 64
00:00:01.667035 IP 10.0.0.1 > 10.0.0.2: ICMP echo request, id 25121, seq 142, length 64
00:00:01.679092 IP 10.0.0.1 > 10.0.0.2: ICMP echo request, id 25121, seq 143, length 64
00:00:01.691193 IP 10.0.0.1 > 10.0.0.2: ICMP echo request, id 25121, seq 144, length 64
00:00:01.703429 IP 10.0.0.1 > 10.0.0.2: ICMP echo request, id 25121, seq 145, length 64
00:00:01.715638 IP 10.0.0.1 > 10.0.0.2: ICMP echo request, id 25121, seq 146, length 64
00:00:01.728023 IP 10.0.0.1 > 10.0.0.2: ICMP echo request, id 25121, seq 147, length 64
00:00:01.740657 IP 10.0.0.1 > 10.0.0.2: ICMP echo request, id 25121, seq 148, length 64
00:00:01.751333 IP 10.0.0.1 > 10.0.0.2: ICMP echo request, id 25121, seq 149, length 64
00:00:01.763052 IP 10.0.0.1 > 10.0.0.2: ICMP echo request, id 25121, seq 150, length 64
00:00:01.777824 IP 10.0.0.1 > 10.0.0.2: ICMP echo request, id 25121, seq 151, length 64
00:00:01.789024 IP 10.0.0.1 > 10.0.0.2: ICMP echo request, id 25121, seq 152, length 64
00:00:01.799022 IP 10.0.0.1 > 10.0.0.2: ICMP echo request, id 25121, seq 153, length 64
00:00:01.814435 IP 10.0.0.1 > 10.0.0.2: ICMP echo request, id 25121, seq 154, length 64
00:00:01.824433 IP 10.0.0.1 > 10.0.0.2: ICMP echo request, id 25121, seq 155, length 64
00:00:01.836476 IP 10.0.0.1 > 10.0.0.2: ICMP echo request, id 25121, seq 156, length 64
00:00:01.847143 IP 10.0.0.1 > 10.0.0.2: ICMP echo request, id 25121, seq 157, length 64
00:00:01.860349 IP 10.0.0.1 > 10.0.0.2: ICMP echo request, id 25121, seq 158, length 64
00:00:01.872068 IP 10.0.0.1 > 10.0.0.2: ICMP echo request, id 25121, seq 159, length 64
00:00:01.884335 IP 10.0.0.1 > 10.0.0.2: ICMP echo request, id 25121, seq 160, length 64
00:00:01.894965 IP 10.0.0.1 > 10.0.0.2: ICMP echo request, id 25121, seq 161, length 64
00:00:01.909752 IP 10.0.0.1 > 10.0.0.2: ICMP echo request, id 25121, seq 162, length 64
00:00:01.920016 IP 10.0.0.1 > 10.0.0.2: ICMP echo request, id 25121, seq 163, length 64
00:00:01.931177 IP 10.0.0.1 > 10.0.0.2: ICMP echo request, id 25121, seq 164, length 64
00:00:01.974756 IP 10.0.0.1 > 10.0.0.2: ICMP echo request, id 25121, seq 166, length 64
00:00:01.979887 IP 10.0.0.1 > 10.0.0.2: ICMP echo request, id 25121, seq 167, length 64
00:00:01.989191 IP 10.0.0.1 > 10.0.0.2: ICMP echo request, id 25121, seq 168, length 64
00:00:01.999012 IP 10.0.0.1 > 10.0.0.2: ICMP echo request, id 25121, seq 169, length 64
00:00:02.013614 IP 10.0.0.1 > 10.0.0.2: ICMP echo request, id 25121, seq 170, length 64
00:00:02.023618 IP 10.0.0.1 > 10.0.0.2: ICMP echo request, id 25121, seq 171, length 64
00:00:02.035844 IP 10.0.0.1 > 10.0.0.2: ICMP echo request, id 25121, seq 172, length 64
00:00:02.048060 IP 10.0.0.1 > 10.0.0.2: ICMP echo request, id 25121, seq 173, length 64
00:00:02.059259 IP 10.0.0.1 > 10.0.0.2: ICMP echo request, id 25121, seq 174, length 64
00:00:02.071045 IP 10.0.0.1 > 10.0.0.2: ICMP echo request, id 25121, seq 175, length 64
00:00:02.082958 IP 10.0.0.1 > 10.0.0.2: ICMP echo request, id 25121, seq 176, length 64
00:00:02.096968 IP 10.0.0.1 > 10.0.0.2: ICMP echo request, id 25121, seq 177, length 64
00:00:02.110149 IP 10.0.0.1 > 10.0.0.2: ICMP echo request, id 25121, seq 178, length 64
00:00:02.120139 IP 10.0.0.1 > 10.0.0.2: ICMP echo request, id 25121, seq 179, length 64
00:00:02.131694 IP 10.0.0.1 > 10.0.0.2: ICMP echo request, id 25121, seq 180, length 64
00:00:02.145840 IP 10.0.0.1 > 10.0.0.2: ICMP echo request, id 25121, seq 181, length 64
00:00:02.157512 IP 10.0.0.1 > 10.0.0.2: ICMP echo request, id 25121, seq 182, length 64
00:00:02.167788 IP 10.0.0.1 > 10.0.0.2: ICMP echo request, id 25121, seq 183, length 64
00:00:02.179020 IP 10.0.0.1 > 10.0.0.2: ICMP echo request, id 25121, seq 184, length 64
00:00:02.191262 IP 10.0.0.1 > 10.0.0.2: ICMP echo request, id 25121, seq 185, length 64
00:00:02.202986 IP 10.0.0.1 > 10.0.0.2: ICMP echo request, id 25121, seq 186, length 64
00:00:02.215204 IP 10.0.0.1 > 10.0.0.2: ICMP echo request, id 25121, seq 187, length 64
00:00:02.226939 IP 10.0.0.1 > 10.0.0.2: ICMP echo request, id 25121, seq 188, length 64
00:00:02.239645 IP 10.0.0.1 > 10.0.0.2: ICMP echo request, id 25121, seq 189, length 64
00:00:02.252403 IP 10.0.0.1 > 10.0.0.2: ICMP echo request, id 25121, seq 190, length 64
00:00:02.263119 IP 10.0.0.1 > 10.0.0.2: ICMP echo request, id 25121, seq 191, length 64
00:00:02.277300 IP 10.0.0.1 > 10.0.0.2: ICMP echo request, id 25121, seq 192, length 64
00:00:02.287295 IP 10.0.0.1 > 10.0.0.2: ICMP echo request, id 25121, seq 193, length 64
00:00:02.299805 IP 10.0.0.1 > 10.0.0.2: ICMP echo request, id 25121, seq 194, length 64
00:00:02.311035 IP 10.0.0.1 > 10.0.0.2: ICMP echo request, id 25121, seq 195, length 64
00:00:02.327164 IP 10.0.0.1 > 10.0.0.2: ICMP echo request, id 25121, seq 196, length 64
00:00:02.341321 IP 10.0.0.1 > 10.0.0.2: ICMP echo request, id 25121, seq 197, length 64
00:00:02.351319 IP 10.0.0.1 > 10.0.0.2: ICMP echo request, id 25121, seq 198, length 64
00:00:02.364458 IP 10.0.0.1 > 10.0.0.2: ICMP echo request, id 25121, seq 199, length 64
00:00:02.375025 IP 10.0.0.1 > 10.0.0.2: ICMP echo request, id 25121, seq 200, length 64
00:00:02.387753 IP 10.0.0.1 > 10.0.0.2: ICMP echo request, id 25121, seq 201, length 64
00:00:02.399037 IP 10.0.0.1 > 10.0.0.2: ICMP echo request, id 25121, seq 202, length 64
00:00:02.411706 IP 10.0.0.1 > 10.0.0.2: ICMP echo request, id 25121, seq 203, length 64
00:00:02.427392 IP 10.0.0.1 > 10.0.0.2: ICMP echo request, id 25121, seq 204, length 64
00:00:02.439110 IP 10.0.0.1 > 10.0.0.2: ICMP echo request, id 25121, seq 205, length 64
00:00:02.451780 IP 10.0.0.1 > 10.0.0.2: ICMP echo request, id 25121, seq 206, length 64
00:00:02.463075 IP 10.0.0.1 > 10.0.0.2: ICMP echo request, id 25121, seq 207, length 64
00:00:02.475264 IP 10.0.0.1 > 10.0.0.2: ICMP echo request, id 25121, seq 208, length 64
00:00:02.487999 IP 10.0.0.1 > 10.0.0.2: ICMP echo request, id 25121, seq 209, length 64
00:00:02.501672 IP 10.0.0.1 > 10.0.0.2: ICMP echo request, id 25121, seq 210, length 64
00:00:02.511668 IP 10.0.0.1 > 10.0.0.2: ICMP echo request, id 25121, seq 211, length 64
00:00:02.526616 IP 10.0.0.1 > 10.0.0.2: ICMP echo request, id 25121, seq 212, length 64
00:00:02.536616 IP 10.0.0.1 > 10.0.0.2: ICMP echo request, id 25121, seq 213, length 64
00:00:02.549599 IP 10.0.0.1 > 10.0.0.2: ICMP echo request, id 25121, seq 214, length 64
00:00:02.559920 IP 10.0.0.1 > 10.0.0.2: ICMP echo request, id 25121, seq 215, length 64
00:00:02.575518 IP 10.0.0.1 > 10.0.0.2: ICMP echo request, id 25121, seq 216, length 64
00:00:02.587196 IP 10.0.0.1 > 10.0.0.2: ICMP echo request, id 25121, seq 217, length 64
00:00:02.599031 IP 10.0.0.1 > 10.0.0.2: ICMP echo request, id 25121, seq 218, length 64
00:00:02.611141 IP 10.0.0.1 > 10.0.0.2: ICMP echo request, id 25121, seq 219, length 64
00:00:02.622901 IP 10.0.0.1 > 10.0.0.2: ICMP echo request, id 25121, seq 220, length 64
00:00:02.635614 IP 10.0.0.1 > 10.0.0.2: ICMP echo request, id 25121, seq 221, length 64
00:00:02.649268 IP 10.0.0.1 > 10.0.0.2: ICMP echo request, id 25121, seq 222, length 64
00:00:02.660064 IP 10.0.0.1 > 10.0.0.2: ICMP echo request, id 25121, seq 223, length 64
00:00:02.673785 IP 10.0.0.1 > 10.0.0.2: ICMP echo request, id 25121, seq 224, length 64
00:00:02.683755 IP 10.0.0.1 > 10.0.0.2: ICMP echo request, id 25121, seq 225, length 64
00:00:02.697189 IP 10.0.0.1 > 10.0.0.2: ICMP echo request, id 25121, seq 226, length 64
00:00:02.707988 IP 10.0.0.1 > 10.0.0.2: ICMP echo request, id 25121, seq 227, length 64
00:00:02.722664 IP 10.0.0.1 > 10.0.0.2: ICMP echo request, id 25121, seq 228, length 64
00:00:02.732658 IP 10.0.0.1 > 10.0.0.2: ICMP echo request, id 25121, seq 229, length 64
00:00:02.743175 IP 10.0.0.1 > 10.0.0.2: ICMP echo request, id 25121, seq 230, length 64
00:00:02.755428 IP 10.0.0.1 > 10.0.0.2: ICMP echo request, id 25121, seq 231, length 64
00:00:02.771581 IP 10.0.0.1 > 10.0.0.2: ICMP echo request, id 25121, seq 232, length 64
00:00:02.786186 IP 10.0.0.1 > 10.0.0.2: ICMP echo request, id 25121, seq 233, length 64
00:00:02.798375 IP 10.0.0.1 > 10.0.0.2: ICMP echo request, id 25121, seq 234, length 64
00:00:02.809156 IP 10.0.0.1 > 10.0.0.2: ICMP echo request, id 25121, seq 235, length 64
00:00:02.819943 IP 10.0.0.1 > 10.0.0.2: ICMP echo request, id 25121, seq 236, length 64
00:00:02.835109 IP 10.0.0.1 > 10.0.0.2: ICMP echo request, id 25121, seq 237, length 64
00:00:02.847235 IP 10.0.0.1 > 10.0.0.2: ICMP echo request, id 25121, seq 238, length 64
