00:00:00.000000 IP 10.0.0.1 > 10.0.0.2: ICMP echo request, id 3251, seq 6, length 64
00:00:00.010375 IP 10.0.0.1 > 10.0.0.2: ICMP echo request, id 3251, seq 7, length 64
00:00:00.022503 IP 10.0.0.1 > 10.0.0.2: ICMP echo request, id 3251, seq 8, length 64
00:00:00.035668 IP 10.0.0.1 > 10.0.0.2: ICMP echo request, id 3251, seq 9, length 64
00:00:00.047353 IP 10.0.0.1 > 10.0.0.2: ICMP echo request, id 3251, seq 10, length 64
00:00:00.058641 IP 10.0.0.1 > 10.0.0.2: ICMP echo request, id 3251, seq 11, length 64
00:00:00.070341 IP 10.0.0.1 > 10.0.0.2: ICMP echo request, id 3251, seq 12, length 64
00:00:00.084537 IP 10.0.0.1 > 10.0.0.2: ICMP echo request, id 3251, seq 13, length 64
00:00:00.094532 IP 10.0.0.1 > 10.0.0.2: ICMP echo request, id 3251, seq 14, length 64
00:00:00.108450 IP 10.0.0.1 > 10.0.0.2: ICMP echo request, id 3251, seq 15, length 64
00:00:00.118707 IP 10.0.0.1 > 10.0.0.2: ICMP echo request, id 3251, seq 16, length 64
00:00:00.130947 IP 10.0.0.1 > 10.0.0.2: ICMP echo request, id 3251, seq 17, length 64
00:00:00.144665 IP 10.0.0.1 > 10.0.0.2: ICMP echo request, id 3251, seq 18, length 64
00:00:00.155364 IP 10.0.0.1 > 10.0.0.2: ICMP echo request, id 3251, seq 19, length 64
00:00:00.166630 IP 10.0.0.1 > 10.0.0.2: ICMP echo request, id 3251, seq 20, length 64
00:00:00.178391 IP 10.0.0.1 > 10.0.0.2: ICMP echo request, id 3251, seq 21, length 64
00:00:00.190685 IP 10.0.0.1 > 10.0.0.2: ICMP echo request, id 3251, seq 22, length 64
00:00:00.202792 IP 10.0.0.1 > 10.0.0.2: ICMP echo request, id 3251, seq 23, length 64
00:00:00.216034 IP 10.0.0.1 > 10.0.0.2: ICMP echo request, id 3251, seq 24, length 64
00:00:00.228721 IP 10.0.0.1 > 10.0.0.2: ICMP echo request, id 3251, seq 25, length 64
00:00:00.239019 IP 10.0.0.1 > 10.0.0.2: ICMP echo request, id 3251, seq 26, length 64
00:00:00.250424 IP 10.0.0.1 > 10.0.0.2: ICMP echo request, id 3251, seq 27, length 64
00:00:00.265961 IP 10.0.0.1 > 10.0.0.2: ICMP echo request, id 3251, seq 28, length 64
00:00:00.275963 IP 10.0.0.1 > 10.0.0.2: ICMP echo request, id 3251, seq 29, length 64
00:00:00.288751 IP 10.0.0.1 > 10.0.0.2: ICMP echo request, id 3251, seq 30, length 64
00:00:00.298726 IP 10.0.0.1 > 10.0.0.2: ICMP echo request, id 3251, seq 31, length 64
00:00:00.310310 IP 10.0.0.1 > 10.0.0.2: ICMP echo request, id 3251, seq 32, length 64
00:00:00.323565 IP 10.0.0.1 > 10.0.0.2: ICMP echo request, id 3251, seq 33, length 64
00:00:00.336984 IP 10.0.0.1 > 10.0.0.2: ICMP echo request, id 3251, seq 34, length 64
00:00:00.346985 IP 10.0.0.1 > 10.0.0.2: ICMP echo request, id 3251, seq 35, length 64
00:00:00.358788 IP 10.0.0.1 > 10.0.0.2: ICMP echo request, id 3251, seq 36, length 64
00:00:00.371478 IP 10.0.0.1 > 10.0.0.2: ICMP echo request, id 3251, seq 37, length 64
00:00:00.382707 IP 10.0.0.1 > 10.0.0.2: ICMP echo request, id 3251, seq 38, length 64
00:00:00.395366 IP 10.0.0.1 > 10.0.0.2: ICMP echo request, id 3251, seq 39, length 64
00:00:00.409532 IP 10.0.0.1 > 10.0.0.2: ICMP echo request, id 3251, seq 40, length 64
00:00:00.421273 IP 10.0.0.1 > 10.0.0.2: ICMP echo request, id 3251, seq 41, length 64
00:00:00.431268 IP 10.0.0.1 > 10.0.0.2: ICMP echo request, id 3251, seq 42, length 64
00:00:00.443275 IP 10.0.0.1 > 10.0.0.2: ICMP echo request, id 3251, seq 43, length 64
00:00:00.454534 IP 10.0.0.1 > 10.0.0.2: ICMP echo request, id 3251, seq 44, length 64
00:00:00.467227 IP 10.0.0.1 > 10.0.0.2: ICMP echo request, id 3251, seq 45, length 64
00:00:00.478529 IP 10.0.0.1 > 10.0.0.2: ICMP echo request, id 3251, seq 46, length 64
00:00:00.490679 IP 10.0.0.1 > 10.0.0.2: ICMP echo request, id 3251, seq 47, length 64
00:00:00.502448 IP 10.0.0.1 > 10.0.0.2: ICMP echo request, id 3251, seq 48, length 64
00:00:00.515653 IP 10.0.0.1 > 10.0.0.2: ICMP echo request, id 3251, seq 49, length 64
00:00:00.526387 IP 10.0.0.1 > 10.0.0.2: ICMP echo request, id 3251, seq 50, length 64
00:00:00.538574 IP 10.0.0.1 > 10.0.0.2: ICMP echo request, id 3251, seq 51, length 64
00:00:00.551393 IP 10.0.0.1 > 10.0.0.2: ICMP echo request, id 3251, seq 52, length 64
00:00:00.562563 IP 10.0.0.1 > 10.0.0.2: ICMP echo request, id 3251, seq 53, length 64
00:00:00.574346 IP 10.0.0.1 > 10.0.0.2: ICMP echo request, id 3251, seq 54, length 64
00:00:00.589316 IP 10.0.0.1 > 10.0.0.2: ICMP echo request, id 3251, seq 55, length 64
00:00:00.599310 IP 10.0.0.1 > 10.0.0.2: ICMP echo request, id 3251, seq 56, length 64
00:00:00.610957 IP 10.0.0.1 > 10.0.0.2: ICMP echo request, id 3251, seq 57, length 64
00:00:00.626144 IP 10.0.0.1 > 10.0.0.2: ICMP echo request, id 3251, seq 58, length 64
00:00:00.636127 IP 10.0.0.1 > 10.0.0.2: ICMP echo request, id 3251, seq 59, length 64
00:00:00.647169 IP 10.0.0.1 > 10.0.0.2: ICMP echo request, id 3251, seq 60, length 64
00:00:00.658977 IP 10.0.0.1 > 10.0.0.2: ICMP echo request, id 3251, seq 61, length 64
00:00:00.672069 IP 10.0.0.1 > 10.0.0.2: ICMP echo request, id 3251, seq 62, length 64
00:00:00.684260 IP 10.0.0.1 > 10.0.0.2: ICMP echo request, id 3251, seq 63, length 64
00:00:00.695526 IP 10.0.0.1 > 10.0.0.2: ICMP echo request, id 3251, seq 64, length 64
00:00:00.706405 IP 10.0.0.1 > 10.0.0.2: ICMP echo request, id 3251, seq 65, length 64
00:00:00.718472 IP 10.0.0.1 > 10.0.0.2: ICMP echo request, id 3251, seq 66, length 64
00:00:00.732718 IP 10.0.0.1 > 10.0.0.2: ICMP echo request, id 3251, seq 67, length 64
00:00:00.742712 IP 10.0.0.1 > 10.0.0.2: ICMP echo request, id 3251, seq 68, length 64
00:00:00.756855 IP 10.0.0.1 > 10.0.0.2: ICMP echo request, id 3251, seq 69, length 64
00:00:00.766841 IP 10.0.0.1 > 10.0.0.2: ICMP echo request, id 3251, seq 70, length 64
00:00:00.779126 IP 10.0.0.1 > 10.0.0.2: ICMP echo request, id 3251, seq 71, length 64
00:00:00.791332 IP 10.0.0.1 > 10.0.0.2: ICMP echo request, id 3251, seq 72, length 64
00:00:00.803052 IP 10.0.0.1 > 10.0.0.2: ICMP echo request, id 3251, seq 73, length 64
00:00:00.815309 IP 10.0.0.1 > 10.0.0.2: ICMP echo request, id 3251, seq 74, length 64
00:00:00.828539 IP 10.0.0.1 > 10.0.0.2: ICMP echo request, id 3251, seq 75, length 64
00:00:00.839403 IP 10.0.0.1 > 10.0.0.2: ICMP echo request, id 3251, seq 76, length 64
00:00:00.850457 IP 10.0.0.1 > 10.0.0.2: ICMP echo request, id 3251, seq 77, length 64
00:00:00.865191 IP 10.0.0.1 > 10.0.0.2: ICMP echo request, id 3251, seq 78, length 64
00:00:00.875192 IP 10.0.0.1 > 10.0.0.2: ICMP echo request, id 3251, seq 79, length 64
00:00:00.886650 IP 10.0.0.1 > 10.0.0.2: ICMP echo request, id 3251, seq 80, length 64
00:00:00.898391 IP 10.0.0.1 > 10.0.0.2: ICMP echo request, id 3251, seq 81, length 64
00:00:00.912582 IP 10.0.0.1 > 10.0.0.2: ICMP echo request, id 3251, seq 82, length 64
00:00:00.922853 IP 10.0.0.1 > 10.0.0.2: ICMP echo request, id 3251, seq 83, length 64
00:00:00.934545 IP 10.0.0.1 > 10.0.0.2: ICMP echo request, id 3251, seq 84, length 64
00:00:00.947756 IP 10.0.0.1 > 10.0.0.2: ICMP echo request, id 3251, seq 85, length 64
00:00:00.959692 IP 10.0.0.1 > 10.0.0.2: ICMP echo request, id 3251, seq 86, length 64
00:00:00.972697 IP 10.0.0.1 > 10.0.0.2: ICMP echo request, id 3251, seq 87, length 64
00:00:00.984447 IP 10.0.0.1 > 10.0.0.2: ICMP echo request, id 3251, seq 88, length 64
00:00:00.995167 IP 10.0.0.1 > 10.0.0.2: ICMP echo request, id 3251, seq 89, length 64
00:00:01.007856 IP 10.0.0.1 > 10.0.0.2: ICMP echo request, id 3251, seq 90, length 64
00:00:01.018632 IP 10.0.0.1 > 10.0.0.2: ICMP echo request, id 3251, seq 91, length 64
00:00:01.030855 IP 10.0.0.1 > 10.0.0.2: ICMP echo request, id 3251, seq 92, length 64
00:00:01.042554 IP 10.0.0.1 > 10.0.0.2: ICMP echo request, id 3251, seq 93, length 64
00:00:01.055291 IP 10.0.0.1 > 10.0.0.2: ICMP echo request, id 3251, seq 94, length 64
00:00:01.067021 IP 10.0.0.1 > 10.0.0.2: ICMP echo request, id 3251, seq 95, length 64
00:00:01.079252 IP 10.0.0.1 > 10.0.0.2: ICMP echo request, id 3251, seq 96, length 64
00:00:01.090447 IP 10.0.0.1 > 10.0.0.2: ICMP echo request, id 3251, seq 97, length 64
00:00:01.102690 IP 10.0.0.1 > 10.0.0.2: ICMP echo request, id 3251, seq 98, length 64
00:00:01.114480 IP 10.0.0.1 > 10.0.0.2: ICMP echo request, id 3251, seq 99, length 64
00:00:01.128697 IP 10.0.0.1 > 10.0.0.2: ICMP echo request, id 3251, seq 100, length 64
00:00:01.138846 IP 10.0.0.1 > 10.0.0.2: ICMP echo request, id 3251, seq 101, length 64
00:00:01.154992 IP 10.0.0.1 > 10.0.0.2: ICMP echo request, id 3251, seq 102, length 64
00:00:01.168200 IP 10.0.0.1 > 10.0.0.2: ICMP echo request, id 3251, seq 103, length 64
00:00:01.180422 IP 10.0.0.1 > 10.0.0.2: ICMP echo request, id 3251, seq 104, length 64
00:00:01.191156 IP 10.0.0.1 > 10.0.0.2: ICMP echo request, id 3251, seq 105, length 64
00:00:01.207276 IP 10.0.0.1 > 10.0.0.2: ICMP echo request, id 3251, seq 106, length 64
00:00:01.220011 IP 10.0.0.1 > 10.0.0.2: ICMP echo request, id 3251, seq 107, length 64
00:00:01.230331 IP 10.0.0.1 > 10.0.0.2: ICMP echo request, id 3251, seq 108, length 64
00:00:01.242504 IP 10.0.0.1 > 10.0.0.2: ICMP echo request, id 3251, seq 109, length 64
00:00:01.255215 IP 10.0.0.1 > 10.0.0.2: ICMP echo request, id 3251, seq 110, length 64
00:00:01.267967 IP 10.0.0.1 > 10.0.0.2: ICMP echo request, id 3251, seq 111, length 64
00:00:01.278285 IP 10.0.0.1 > 10.0.0.2: ICMP echo request, id 3251, seq 112, length 64
00:00:01.290433 IP 10.0.0.1 > 10.0.0.2: ICMP echo request, id 3251, seq 113, length 64
00:00:01.305038 IP 10.0.0.1 > 10.0.0.2: ICMP echo request, id 3251, seq 114, length 64
00:00:01.315050 IP 10.0.0.1 > 10.0.0.2: ICMP echo request, id 3251, seq 115, length 64
00:00:01.327600 IP 10.0.0.1 > 10.0.0.2: ICMP echo request, id 3251, seq 116, length 64
00:00:01.338303 IP 10.0.0.1 > 10.0.0.2: ICMP echo request, id 3251, seq 117, length 64
00:00:01.354594 IP 10.0.0.1 > 10.0.0.2: ICMP echo request, id 3251, seq 118, length 64
00:00:01.366651 IP 10.0.0.1 > 10.0.0.2: ICMP echo request, id 3251, seq 119, length 64
00:00:01.379873 IP 10.0.0.1 > 10.0.0.2: ICMP echo request, id 3251, seq 120, length 64
00:00:01.393074 IP 10.0.0.1 > 10.0.0.2: ICMP echo request, id 3251, seq 121, length 64
00:00:01.403330 IP 10.0.0.1 > 10.0.0.2: ICMP echo request, id 3251, seq 122, length 64
00:00:01.415544 IP 10.0.0.1 > 10.0.0.2: ICMP echo request, id 3251, seq 123, length 64
00:00:01.426775 IP 10.0.0.1 > 10.0.0.2: ICMP echo request, id 3251, seq 124, length 64
00:00:01.439487 IP 10.0.0.1 > 10.0.0.2: ICMP echo request, id 3251, seq 125, length 64
00:00:01.451669 IP 10.0.0.1 > 10.0.0.2: ICMP echo request, id 3251, seq 126, length 64
00:00:01.466375 IP 10.0.0.1 > 10.0.0.2: ICMP echo request, id 3251, seq 127, length 64
00:00:01.481520 IP 10.0.0.1 > 10.0.0.2: ICMP echo request, id 3251, seq 128, length 64
00:00:01.491511 IP 10.0.0.1 > 10.0.0.2: ICMP echo request, id 3251, seq 129, length 64
00:00:01.502604 IP 10.0.0.1 > 10.0.0.2: ICMP echo request, id 3251, seq 130, length 64
00:00:01.515232 IP 10.0.0.1 > 10.0.0.2: ICMP echo request, id 3251, seq 131, length 64
00:00:01.526493 IP 10.0.0.1 > 10.0.0.2: ICMP echo request, id 3251, seq 132, length 64
00:00:01.540160 IP 10.0.0.1 > 10.0.0.2: ICMP echo request, id 3251, seq 133, length 64
00:00:01.552924 IP 10.0.0.1 > 10.0.0.2: ICMP echo request, id 3251, seq 134, length 64
00:00:01.563619 IP 10.0.0.1 > 10.0.0.2: ICMP echo request, id 3251, seq 135, length 64
00:00:01.579302 IP 10.0.0.1 > 10.0.0.2: ICMP echo request, id 3251, seq 136, length 64
00:00:01.593455 IP 10.0.0.1 > 10.0.0.2: ICMP echo request, id 3251, seq 137, length 64
00:00:01.603459 IP 10.0.0.1 > 10.0.0.2: ICMP echo request, id 3251, seq 138, length 64
00:00:01.614948 IP 10.0.0.1 > 10.0.0.2: ICMP echo request, id 3251, seq 139, length 64
00:00:01.627663 IP 10.0.0.1 > 10.0.0.2: ICMP echo request, id 3251, seq 140, length 64
00:00:01.643324 IP 10.0.0.1 > 10.0.0.2: ICMP echo request, id 3251, seq 141, length 64
00:00:01.659923 IP 10.0.0.1 > 10.0.0.2: ICMP echo request, id 3251, seq 142, length 64
00:00:01.675114 IP 10.0.0.1 > 10.0.0.2: ICMP echo request, id 3251, seq 143, length 64
00:00:01.686295 IP 10.0.0.1 > 10.0.0.2: ICMP echo request, id 3251, seq 144, length 64
00:00:01.702014 IP 10.0.0.1 > 10.0.0.2: ICMP echo request, id 3251, seq 145, length 64
00:00:01.711994 IP 10.0.0.1 > 10.0.0.2: ICMP echo request, id 3251, seq 146, length 64
00:00:01.723476 IP 10.0.0.1 > 10.0.0.2: ICMP echo request, id 3251, seq 147, length 64
00:00:01.735212 IP 10.0.0.1 > 10.0.0.2: ICMP echo request, id 3251, seq 148, length 64
00:00:01.750414 IP 10.0.0.1 > 10.0.0.2: ICMP echo request, id 3251, seq 149, length 64
00:00:01.762668 IP 10.0.0.1 > 10.0.0.2: ICMP echo request, id 3251, seq 150, length 64
00:00:01.777250 IP 10.0.0.1 > 10.0.0.2: ICMP echo request, id 3251, seq 151, length 64
00:00:01.788020 IP 10.0.0.1 > 10.0.0.2: ICMP echo request, id 3251, seq 152, length 64
00:00:01.798759 IP 10.0.0.1 > 10.0.0.2: ICMP echo request, id 3251, seq 153, length 64
00:00:01.814923 IP 10.0.0.1 > 10.0.0.2: ICMP echo request, id 3251, seq 154, length 64
00:00:01.831006 IP 10.0.0.1 > 10.0.0.2: ICMP echo request, id 3251, seq 155, length 64
00:00:01.843232 IP 10.0.0.1 > 10.0.0.2: ICMP echo request, id 3251, seq 156, length 64
00:00:01.856906 IP 10.0.0.1 > 10.0.0.2: ICMP echo request, id 3251, seq 157, length 64
00:00:01.867669 IP 10.0.0.1 > 10.0.0.2: ICMP echo request, id 3251, seq 158, length 64
00:00:01.878444 IP 10.0.0.1 > 10.0.0.2: ICMP echo request, id 3251, seq 159, length 64
00:00:01.891619 IP 10.0.0.1 > 10.0.0.2: ICMP echo request, id 3251, seq 160, length 64
00:00:01.902488 IP 10.0.0.1 > 10.0.0.2: ICMP echo request, id 3251, seq 161, length 64
00:00:01.917545 IP 10.0.0.1 > 10.0.0.2: ICMP echo request, id 3251, seq 162, length 64
00:00:01.927540 IP 10.0.0.1 > 10.0.0.2: ICMP echo request, id 3251, seq 163, length 64
00:00:01.938559 IP 10.0.0.1 > 10.0.0.2: ICMP echo request, id 3251, seq 164, length 64
00:00:02.000719 IP 10.0.0.1 > 10.0.0.2: ICMP echo request, id 3251, seq 167, length 64
00:00:02.003180 IP 10.0.0.1 > 10.0.0.2: ICMP echo request, id 3251, seq 168, length 64
00:00:02.009121 IP 10.0.0.1 > 10.0.0.2: ICMP echo request, id 3251, seq 169, length 64
00:00:02.018995 IP 10.0.0.1 > 10.0.0.2: ICMP echo request, id 3251, seq 170, length 64
00:00:02.030516 IP 10.0.0.1 > 10.0.0.2: ICMP echo request, id 3251, seq 171, length 64
00:00:02.042700 IP 10.0.0.1 > 10.0.0.2: ICMP echo request, id 3251, seq 172, length 64
00:00:02.054327 IP 10.0.0.1 > 10.0.0.2: ICMP echo request, id 3251, seq 173, length 64
00:00:02.066304 IP 10.0.0.1 > 10.0.0.2: ICMP echo request, id 3251, seq 174, length 64
00:00:02.078338 IP 10.0.0.1 > 10.0.0.2: ICMP echo request, id 3251, seq 175, length 64
00:00:02.091125 IP 10.0.0.1 > 10.0.0.2: ICMP echo request, id 3251, seq 176, length 64
00:00:02.104761 IP 10.0.0.1 > 10.0.0.2: ICMP echo request, id 3251, seq 177, length 64
00:00:02.114759 IP 10.0.0.1 > 10.0.0.2: ICMP echo request, id 3251, seq 178, length 64
00:00:02.126780 IP 10.0.0.1 > 10.0.0.2: ICMP echo request, id 3251, seq 179, length 64
00:00:02.138495 IP 10.0.0.1 > 10.0.0.2: ICMP echo request, id 3251, seq 180, length 64
00:00:02.150318 IP 10.0.0.1 > 10.0.0.2: ICMP echo request, id 3251, seq 181, length 64
00:00:02.162500 IP 10.0.0.1 > 10.0.0.2: ICMP echo request, id 3251, seq 182, length 64
00:00:02.176424 IP 10.0.0.1 > 10.0.0.2: ICMP echo request, id 3251, seq 183, length 64
00:00:02.186421 IP 10.0.0.1 > 10.0.0.2: ICMP echo request, id 3251, seq 184, length 64
00:00:02.198584 IP 10.0.0.1 > 10.0.0.2: ICMP echo request, id 3251, seq 185, length 64
00:00:02.210323 IP 10.0.0.1 > 10.0.0.2: ICMP echo request, id 3251, seq 186, length 64
00:00:02.222547 IP 10.0.0.1 > 10.0.0.2: ICMP echo request, id 3251, seq 187, length 64
00:00:02.234771 IP 10.0.0.1 > 10.0.0.2: ICMP echo request, id 3251, seq 188, length 64
00:00:02.246476 IP 10.0.0.1 > 10.0.0.2: ICMP echo request, id 3251, seq 189, length 64
00:00:02.258283 IP 10.0.0.1 > 10.0.0.2: ICMP echo request, id 3251, seq 190, length 64
00:00:02.272925 IP 10.0.0.1 > 10.0.0.2: ICMP echo request, id 3251, seq 191, length 64
00:00:02.282907 IP 10.0.0.1 > 10.0.0.2: ICMP echo request, id 3251, seq 192, length 64
00:00:02.295873 IP 10.0.0.1 > 10.0.0.2: ICMP echo request, id 3251, seq 193, length 64
00:00:02.306595 IP 10.0.0.1 > 10.0.0.2: ICMP echo request, id 3251, seq 194, length 64
00:00:02.318359 IP 10.0.0.1 > 10.0.0.2: ICMP echo request, id 3251, seq 195, length 64
00:00:02.330539 IP 10.0.0.1 > 10.0.0.2: ICMP echo request, id 3251, seq 196, length 64
00:00:02.343336 IP 10.0.0.1 > 10.0.0.2: ICMP echo request, id 3251, seq 197, length 64
00:00:02.354551 IP 10.0.0.1 > 10.0.0.2: ICMP echo request, id 3251, seq 198, length 64
00:00:02.366341 IP 10.0.0.1 > 10.0.0.2: ICMP echo request, id 3251, seq 199, length 64
00:00:02.379480 IP 10.0.0.1 > 10.0.0.2: ICMP echo request, id 3251, seq 200, length 64
00:00:02.390749 IP 10.0.0.1 > 10.0.0.2: ICMP echo request, id 3251, seq 201, length 64
00:00:02.402460 IP 10.0.0.1 > 10.0.0.2: ICMP echo request, id 3251, seq 202, length 64
00:00:02.414299 IP 10.0.0.1 > 10.0.0.2: ICMP echo request, id 3251, seq 203, length 64
00:00:02.426883 IP 10.0.0.1 > 10.0.0.2: ICMP echo request, id 3251, seq 204, length 64
00:00:02.438312 IP 10.0.0.1 > 10.0.0.2: ICMP echo request, id 3251, seq 205, length 64
00:00:02.450842 IP 10.0.0.1 > 10.0.0.2: ICMP echo request, id 3251, seq 206, length 64
00:00:02.462568 IP 10.0.0.1 > 10.0.0.2: ICMP echo request, id 3251, seq 207, length 64
00:00:02.474325 IP 10.0.0.1 > 10.0.0.2: ICMP echo request, id 3251, seq 208, length 64
00:00:02.487488 IP 10.0.0.1 > 10.0.0.2: ICMP echo request, id 3251, seq 209, length 64
00:00:02.498291 IP 10.0.0.1 > 10.0.0.2: ICMP echo request, id 3251, seq 210, length 64
00:00:02.511006 IP 10.0.0.1 > 10.0.0.2: ICMP echo request, id 3251, seq 211, length 64
00:00:02.522689 IP 10.0.0.1 > 10.0.0.2: ICMP echo request, id 3251, seq 212, length 64
00:00:02.534409 IP 10.0.0.1 > 10.0.0.2: ICMP echo request, id 3251, seq 213, length 64
00:00:02.549095 IP 10.0.0.1 > 10.0.0.2: ICMP echo request, id 3251, seq 214, length 64
00:00:02.559077 IP 10.0.0.1 > 10.0.0.2: ICMP echo request, id 3251, seq 215, length 64
00:00:02.572061 IP 10.0.0.1 > 10.0.0.2: ICMP echo request, id 3251, seq 216, length 64
00:00:02.582328 IP 10.0.0.1 > 10.0.0.2: ICMP echo request, id 3251, seq 217, length 64
00:00:02.594563 IP 10.0.0.1 > 10.0.0.2: ICMP echo request, id 3251, seq 218, length 64
00:00:02.606759 IP 10.0.0.1 > 10.0.0.2: ICMP echo request, id 3251, seq 219, length 64
00:00:02.619074 IP 10.0.0.1 > 10.0.0.2: ICMP echo request, id 3251, seq 220, length 64
00:00:02.630704 IP 10.0.0.1 > 10.0.0.2: ICMP echo request, id 3251, seq 221, length 64
00:00:02.642447 IP 10.0.0.1 > 10.0.0.2: ICMP echo request, id 3251, seq 222, length 64
00:00:02.654686 IP 10.0.0.1 > 10.0.0.2: ICMP echo request, id 3251, seq 223, length 64
00:00:02.666385 IP 10.0.0.1 > 10.0.0.2: ICMP echo request, id 3251, seq 224, length 64
00:00:02.678640 IP 10.0.0.1 > 10.0.0.2: ICMP echo request, id 3251, seq 225, length 64
00:00:02.690368 IP 10.0.0.1 > 10.0.0.2: ICMP echo request, id 3251, seq 226, length 64
00:00:02.702590 IP 10.0.0.1 > 10.0.0.2: ICMP echo request, id 3251, seq 227, length 64
00:00:02.714322 IP 10.0.0.1 > 10.0.0.2: ICMP echo request, id 3251, seq 228, length 64
00:00:02.730441 IP 10.0.0.1 > 10.0.0.2: ICMP echo request, id 3251, seq 229, length 64
00:00:02.742676 IP 10.0.0.1 > 10.0.0.2: ICMP echo request, id 3251, seq 230, length 64
00:00:02.754867 IP 10.0.0.1 > 10.0.0.2: ICMP echo request, id 3251, seq 231, length 64
00:00:02.766616 IP 10.0.0.1 > 10.0.0.2: ICMP echo request, id 3251, seq 232, length 64
00:00:02.778352 IP 10.0.0.1 > 10.0.0.2: ICMP echo request, id 3251, seq 233, length 64
00:00:02.790547 IP 10.0.0.1 > 10.0.0.2: ICMP echo request, id 3251, seq 234, length 64
00:00:02.802770 IP 10.0.0.1 > 10.0.0.2: ICMP echo request, id 3251, seq 235, length 64
00:00:02.814508 IP 10.0.0.1 > 10.0.0.2: ICMP echo request, id 3251, seq 236, length 64
00:00:02.826757 IP 10.0.0.1 > 10.0.0.2: ICMP echo request, id 3251, seq 237, length 64
00:00:02.838462 IP 10.0.0.1 > 10.0.0.2: ICMP echo request, id 3251, seq 238, length 64
