00:00:00.000000 IP 10.0.0.1 > 10.0.0.2: ICMP echo request, id 21946, seq 5, length 64
00:00:00.012240 IP 10.0.0.1 > 10.0.0.2: ICMP echo request, id 21946, seq 6, length 64
00:00:00.028889 IP 10.0.0.1 > 10.0.0.2: ICMP echo request, id 21946, seq 7, length 64
00:00:00.044559 IP 10.0.0.1 > 10.0.0.2: ICMP echo request, id 21946, seq 8, length 64
00:00:00.055757 IP 10.0.0.1 > 10.0.0.2: ICMP echo request, id 21946, seq 9, length 64
00:00:00.071699 IP 10.0.0.1 > 10.0.0.2: ICMP echo request, id 21946, seq 10, length 64
00:00:00.082149 IP 10.0.0.1 > 10.0.0.2: ICMP echo request, id 21946, seq 11, length 64
00:00:00.096329 IP 10.0.0.1 > 10.0.0.2: ICMP echo request, id 21946, seq 12, length 64
00:00:00.107831 IP 10.0.0.1 > 10.0.0.2: ICMP echo request, id 21946, seq 13, length 64
00:00:00.119846 IP 10.0.0.1 > 10.0.0.2: ICMP echo request, id 21946, seq 14, length 64
00:00:00.132002 IP 10.0.0.1 > 10.0.0.2: ICMP echo request, id 21946, seq 15, length 64
00:00:00.144200 IP 10.0.0.1 > 10.0.0.2: ICMP echo request, id 21946, seq 16, length 64
00:00:00.155951 IP 10.0.0.1 > 10.0.0.2: ICMP echo request, id 21946, seq 17, length 64
00:00:00.168220 IP 10.0.0.1 > 10.0.0.2: ICMP echo request, id 21946, seq 18, length 64
00:00:00.180894 IP 10.0.0.1 > 10.0.0.2: ICMP echo request, id 21946, seq 19, length 64
00:00:00.197280 IP 10.0.0.1 > 10.0.0.2: ICMP echo request, id 21946, seq 20, length 64
00:00:00.207975 IP 10.0.0.1 > 10.0.0.2: ICMP echo request, id 21946, seq 21, length 64
00:00:00.220041 IP 10.0.0.1 > 10.0.0.2: ICMP echo request, id 21946, seq 22, length 64
00:00:00.232590 IP 10.0.0.1 > 10.0.0.2: ICMP echo request, id 21946, seq 23, length 64
00:00:00.246892 IP 10.0.0.1 > 10.0.0.2: ICMP echo request, id 21946, seq 24, length 64
00:00:00.256887 IP 10.0.0.1 > 10.0.0.2: ICMP echo request, id 21946, seq 25, length 64
00:00:00.268895 IP 10.0.0.1 > 10.0.0.2: ICMP echo request, id 21946, seq 26, length 64
00:00:00.283268 IP 10.0.0.1 > 10.0.0.2: ICMP echo request, id 21946, seq 27, length 64
00:00:00.295814 IP 10.0.0.1 > 10.0.0.2: ICMP echo request, id 21946, seq 28, length 64
00:00:00.307990 IP 10.0.0.1 > 10.0.0.2: ICMP echo request, id 21946, seq 29, length 64
00:00:00.320207 IP 10.0.0.1 > 10.0.0.2: ICMP echo request, id 21946, seq 30, length 64
00:00:00.332513 IP 10.0.0.1 > 10.0.0.2: ICMP echo request, id 21946, seq 31, length 64
00:00:00.345124 IP 10.0.0.1 > 10.0.0.2: ICMP echo request, id 21946, seq 32, length 64
00:00:00.360081 IP 10.0.0.1 > 10.0.0.2: ICMP echo request, id 21946, seq 33, length 64
00:00:00.375396 IP 10.0.0.1 > 10.0.0.2: ICMP echo request, id 21946, seq 34, length 64
00:00:00.385389 IP 10.0.0.1 > 10.0.0.2: ICMP echo request, id 21946, seq 35, length 64
00:00:00.396502 IP 10.0.0.1 > 10.0.0.2: ICMP echo request, id 21946, seq 36, length 64
00:00:00.408536 IP 10.0.0.1 > 10.0.0.2: ICMP echo request, id 21946, seq 37, length 64
00:00:00.421509 IP 10.0.0.1 > 10.0.0.2: ICMP echo request, id 21946, seq 38, length 64
00:00:00.432148 IP 10.0.0.1 > 10.0.0.2: ICMP echo request, id 21946, seq 39, length 64
00:00:00.444350 IP 10.0.0.1 > 10.0.0.2: ICMP echo request, id 21946, seq 40, length 64
00:00:00.456563 IP 10.0.0.1 > 10.0.0.2: ICMP echo request, id 21946, seq 41, length 64
00:00:00.467849 IP 10.0.0.1 > 10.0.0.2: ICMP echo request, id 21946, seq 42, length 64
00:00:00.480277 IP 10.0.0.1 > 10.0.0.2: ICMP echo request, id 21946, seq 43, length 64
00:00:00.492749 IP 10.0.0.1 > 10.0.0.2: ICMP echo request, id 21946, seq 44, length 64
00:00:00.504132 IP 10.0.0.1 > 10.0.0.2: ICMP echo request, id 21946, seq 45, length 64
00:00:00.515830 IP 10.0.0.1 > 10.0.0.2: ICMP echo request, id 21946, seq 46, length 64
00:00:00.528854 IP 10.0.0.1 > 10.0.0.2: ICMP echo request, id 21946, seq 47, length 64
00:00:00.540119 IP 10.0.0.1 > 10.0.0.2: ICMP echo request, id 21946, seq 48, length 64
00:00:00.551908 IP 10.0.0.1 > 10.0.0.2: ICMP echo request, id 21946, seq 49, length 64
00:00:00.564602 IP 10.0.0.1 > 10.0.0.2: ICMP echo request, id 21946, seq 50, length 64
00:00:00.575863 IP 10.0.0.1 > 10.0.0.2: ICMP echo request, id 21946, seq 51, length 64
00:00:00.589030 IP 10.0.0.1 > 10.0.0.2: ICMP echo request, id 21946, seq 52, length 64
00:00:00.600227 IP 10.0.0.1 > 10.0.0.2: ICMP echo request, id 21946, seq 53, length 64
00:00:00.612090 IP 10.0.0.1 > 10.0.0.2: ICMP echo request, id 21946, seq 54, length 64
00:00:00.627182 IP 10.0.0.1 > 10.0.0.2: ICMP echo request, id 21946, seq 55, length 64
00:00:00.637176 IP 10.0.0.1 > 10.0.0.2: ICMP echo request, id 21946, seq 56, length 64
00:00:00.648671 IP 10.0.0.1 > 10.0.0.2: ICMP echo request, id 21946, seq 57, length 64
00:00:00.660014 IP 10.0.0.1 > 10.0.0.2: ICMP echo request, id 21946, seq 58, length 64
00:00:00.672152 IP 10.0.0.1 > 10.0.0.2: ICMP echo request, id 21946, seq 59, length 64
00:00:00.687330 IP 10.0.0.1 > 10.0.0.2: ICMP echo request, id 21946, seq 60, length 64
00:00:00.697325 IP 10.0.0.1 > 10.0.0.2: ICMP echo request, id 21946, seq 61, length 64
00:00:00.710259 IP 10.0.0.1 > 10.0.0.2: ICMP echo request, id 21946, seq 62, length 64
00:00:00.720255 IP 10.0.0.1 > 10.0.0.2: ICMP echo request, id 21946, seq 63, length 64
00:00:00.732575 IP 10.0.0.1 > 10.0.0.2: ICMP echo request, id 21946, seq 64, length 64
00:00:00.744002 IP 10.0.0.1 > 10.0.0.2: ICMP echo request, id 21946, seq 65, length 64
00:00:00.757704 IP 10.0.0.1 > 10.0.0.2: ICMP echo request, id 21946, seq 66, length 64
00:00:00.767933 IP 10.0.0.1 > 10.0.0.2: ICMP echo request, id 21946, seq 67, length 64
00:00:00.780643 IP 10.0.0.1 > 10.0.0.2: ICMP echo request, id 21946, seq 68, length 64
00:00:00.791906 IP 10.0.0.1 > 10.0.0.2: ICMP echo request, id 21946, seq 69, length 64
00:00:00.804129 IP 10.0.0.1 > 10.0.0.2: ICMP echo request, id 21946, seq 70, length 64
00:00:00.815847 IP 10.0.0.1 > 10.0.0.2: ICMP echo request, id 21946, seq 71, length 64
00:00:00.828071 IP 10.0.0.1 > 10.0.0.2: ICMP echo request, id 21946, seq 72, length 64
00:00:00.840295 IP 10.0.0.1 > 10.0.0.2: ICMP echo request, id 21946, seq 73, length 64
00:00:00.852609 IP 10.0.0.1 > 10.0.0.2: ICMP echo request, id 21946, seq 74, length 64
00:00:00.865229 IP 10.0.0.1 > 10.0.0.2: ICMP echo request, id 21946, seq 75, length 64
00:00:00.876959 IP 10.0.0.1 > 10.0.0.2: ICMP echo request, id 21946, seq 76, length 64
00:00:00.888223 IP 10.0.0.1 > 10.0.0.2: ICMP echo request, id 21946, seq 77, length 64
00:00:00.901800 IP 10.0.0.1 > 10.0.0.2: ICMP echo request, id 21946, seq 78, length 64
00:00:00.911780 IP 10.0.0.1 > 10.0.0.2: ICMP echo request, id 21946, seq 79, length 64
00:00:00.923998 IP 10.0.0.1 > 10.0.0.2: ICMP echo request, id 21946, seq 80, length 64
00:00:00.935749 IP 10.0.0.1 > 10.0.0.2: ICMP echo request, id 21946, seq 81, length 64
00:00:00.948112 IP 10.0.0.1 > 10.0.0.2: ICMP echo request, id 21946, seq 82, length 64
00:00:00.963000 IP 10.0.0.1 > 10.0.0.2: ICMP echo request, id 21946, seq 83, length 64
00:00:00.972995 IP 10.0.0.1 > 10.0.0.2: ICMP echo request, id 21946, seq 84, length 64
00:00:00.984994 IP 10.0.0.1 > 10.0.0.2: ICMP echo request, id 21946, seq 85, length 64
00:00:00.996192 IP 10.0.0.1 > 10.0.0.2: ICMP echo request, id 21946, seq 86, length 64
00:00:01.012339 IP 10.0.0.1 > 10.0.0.2: ICMP echo request, id 21946, seq 87, length 64
00:00:01.023791 IP 10.0.0.1 > 10.0.0.2: ICMP echo request, id 21946, seq 88, length 64
00:00:01.036288 IP 10.0.0.1 > 10.0.0.2: ICMP echo request, id 21946, seq 89, length 64
00:00:01.048609 IP 10.0.0.1 > 10.0.0.2: ICMP echo request, id 21946, seq 90, length 64
00:00:01.060817 IP 10.0.0.1 > 10.0.0.2: ICMP echo request, id 21946, seq 91, length 64
00:00:01.076389 IP 10.0.0.1 > 10.0.0.2: ICMP echo request, id 21946, seq 92, length 64
00:00:01.090078 IP 10.0.0.1 > 10.0.0.2: ICMP echo request, id 21946, seq 93, length 64
00:00:01.100074 IP 10.0.0.1 > 10.0.0.2: ICMP echo request, id 21946, seq 94, length 64
00:00:01.111740 IP 10.0.0.1 > 10.0.0.2: ICMP echo request, id 21946, seq 95, length 64
00:00:01.124277 IP 10.0.0.1 > 10.0.0.2: ICMP echo request, id 21946, seq 96, length 64
00:00:01.139450 IP 10.0.0.1 > 10.0.0.2: ICMP echo request, id 21946, seq 97, length 64
00:00:01.149448 IP 10.0.0.1 > 10.0.0.2: ICMP echo request, id 21946, seq 98, length 64
00:00:01.160954 IP 10.0.0.1 > 10.0.0.2: ICMP echo request, id 21946, seq 99, length 64
00:00:01.175596 IP 10.0.0.1 > 10.0.0.2: ICMP echo request, id 21946, seq 100, length 64
00:00:01.186727 IP 10.0.0.1 > 10.0.0.2: ICMP echo request, id 21946, seq 101, length 64
00:00:01.196720 IP 10.0.0.1 > 10.0.0.2: ICMP echo request, id 21946, seq 102, length 64
00:00:01.208873 IP 10.0.0.1 > 10.0.0.2: ICMP echo request, id 21946, seq 103, length 64
00:00:01.220195 IP 10.0.0.1 > 10.0.0.2: ICMP echo request, id 21946, seq 104, length 64
00:00:01.233766 IP 10.0.0.1 > 10.0.0.2: ICMP echo request, id 21946, seq 105, length 64
00:00:01.244112 IP 10.0.0.1 > 10.0.0.2: ICMP echo request, id 21946, seq 106, length 64
00:00:01.257233 IP 10.0.0.1 > 10.0.0.2: ICMP echo request, id 21946, seq 107, length 64
00:00:01.267986 IP 10.0.0.1 > 10.0.0.2: ICMP echo request, id 21946, seq 108, length 64
00:00:01.280223 IP 10.0.0.1 > 10.0.0.2: ICMP echo request, id 21946, seq 109, length 64
00:00:01.294917 IP 10.0.0.1 > 10.0.0.2: ICMP echo request, id 21946, seq 110, length 64
00:00:01.304912 IP 10.0.0.1 > 10.0.0.2: ICMP echo request, id 21946, seq 111, length 64
00:00:01.316389 IP 10.0.0.1 > 10.0.0.2: ICMP echo request, id 21946, seq 112, length 64
00:00:01.329098 IP 10.0.0.1 > 10.0.0.2: ICMP echo request, id 21946, seq 113, length 64
00:00:01.342346 IP 10.0.0.1 > 10.0.0.2: ICMP echo request, id 21946, seq 114, length 64
00:00:01.353043 IP 10.0.0.1 > 10.0.0.2: ICMP echo request, id 21946, seq 115, length 64
00:00:01.363842 IP 10.0.0.1 > 10.0.0.2: ICMP echo request, id 21946, seq 116, length 64
00:00:01.377007 IP 10.0.0.1 > 10.0.0.2: ICMP echo request, id 21946, seq 117, length 64
00:00:01.389748 IP 10.0.0.1 > 10.0.0.2: ICMP echo request, id 21946, seq 118, length 64
00:00:01.400458 IP 10.0.0.1 > 10.0.0.2: ICMP echo request, id 21946, seq 119, length 64
00:00:01.412712 IP 10.0.0.1 > 10.0.0.2: ICMP echo request, id 21946, seq 120, length 64
00:00:01.427839 IP 10.0.0.1 > 10.0.0.2: ICMP echo request, id 21946, seq 121, length 64
00:00:01.442504 IP 10.0.0.1 > 10.0.0.2: ICMP echo request, id 21946, seq 122, length 64
00:00:01.452497 IP 10.0.0.1 > 10.0.0.2: ICMP echo request, id 21946, seq 123, length 64
00:00:01.464977 IP 10.0.0.1 > 10.0.0.2: ICMP echo request, id 21946, seq 124, length 64
00:00:01.475756 IP 10.0.0.1 > 10.0.0.2: ICMP echo request, id 21946, seq 125, length 64
00:00:01.488118 IP 10.0.0.1 > 10.0.0.2: ICMP echo request, id 21946, seq 126, length 64
00:00:01.500656 IP 10.0.0.1 > 10.0.0.2: ICMP echo request, id 21946, seq 127, length 64
00:00:01.513868 IP 10.0.0.1 > 10.0.0.2: ICMP echo request, id 21946, seq 128, length 64
00:00:01.524135 IP 10.0.0.1 > 10.0.0.2: ICMP echo request, id 21946, seq 129, length 64
00:00:01.538330 IP 10.0.0.1 > 10.0.0.2: ICMP echo request, id 21946, seq 130, length 64
00:00:01.548325 IP 10.0.0.1 > 10.0.0.2: ICMP echo request, id 21946, seq 131, length 64
00:00:01.559794 IP 10.0.0.1 > 10.0.0.2: ICMP echo request, id 21946, seq 132, length 64
00:00:01.572074 IP 10.0.0.1 > 10.0.0.2: ICMP echo request, id 21946, seq 133, length 64
00:00:01.583765 IP 10.0.0.1 > 10.0.0.2: ICMP echo request, id 21946, seq 134, length 64
00:00:01.595995 IP 10.0.0.1 > 10.0.0.2: ICMP echo request, id 21946, seq 135, length 64
00:00:01.607863 IP 10.0.0.1 > 10.0.0.2: ICMP echo request, id 21946, seq 136, length 64
00:00:01.620431 IP 10.0.0.1 > 10.0.0.2: ICMP echo request, id 21946, seq 137, length 64
00:00:01.633101 IP 10.0.0.1 > 10.0.0.2: ICMP echo request, id 21946, seq 138, length 64
00:00:01.643905 IP 10.0.0.1 > 10.0.0.2: ICMP echo request, id 21946, seq 139, length 64
00:00:01.657097 IP 10.0.0.1 > 10.0.0.2: ICMP echo request, id 21946, seq 140, length 64
00:00:01.668861 IP 10.0.0.1 > 10.0.0.2: ICMP echo request, id 21946, seq 141, length 64
00:00:01.684995 IP 10.0.0.1 > 10.0.0.2: ICMP echo request, id 21946, seq 142, length 64
00:00:01.695727 IP 10.0.0.1 > 10.0.0.2: ICMP echo request, id 21946, seq 143, length 64
00:00:01.709964 IP 10.0.0.1 > 10.0.0.2: ICMP echo request, id 21946, seq 144, length 64
00:00:01.720182 IP 10.0.0.1 > 10.0.0.2: ICMP echo request, id 21946, seq 145, length 64
00:00:01.731897 IP 10.0.0.1 > 10.0.0.2: ICMP echo request, id 21946, seq 146, length 64
00:00:01.744107 IP 10.0.0.1 > 10.0.0.2: ICMP echo request, id 21946, seq 147, length 64
00:00:01.756834 IP 10.0.0.1 > 10.0.0.2: ICMP echo request, id 21946, seq 148, length 64
00:00:01.770028 IP 10.0.0.1 > 10.0.0.2: ICMP echo request, id 21946, seq 149, length 64
00:00:01.780256 IP 10.0.0.1 > 10.0.0.2: ICMP echo request, id 21946, seq 150, length 64
00:00:01.793485 IP 10.0.0.1 > 10.0.0.2: ICMP echo request, id 21946, seq 151, length 64
00:00:01.803741 IP 10.0.0.1 > 10.0.0.2: ICMP echo request, id 21946, seq 152, length 64
00:00:01.815978 IP 10.0.0.1 > 10.0.0.2: ICMP echo request, id 21946, seq 153, length 64
00:00:01.828160 IP 10.0.0.1 > 10.0.0.2: ICMP echo request, id 21946, seq 154, length 64
00:00:01.843318 IP 10.0.0.1 > 10.0.0.2: ICMP echo request, id 21946, seq 155, length 64
00:00:01.853315 IP 10.0.0.1 > 10.0.0.2: ICMP echo request, id 21946, seq 156, length 64
00:00:01.864959 IP 10.0.0.1 > 10.0.0.2: ICMP echo request, id 21946, seq 157, length 64
00:00:01.878049 IP 10.0.0.1 > 10.0.0.2: ICMP echo request, id 21946, seq 158, length 64
00:00:01.888043 IP 10.0.0.1 > 10.0.0.2: ICMP echo request, id 21946, seq 159, length 64
00:00:01.900063 IP 10.0.0.1 > 10.0.0.2: ICMP echo request, id 21946, seq 160, length 64
00:00:01.911796 IP 10.0.0.1 > 10.0.0.2: ICMP echo request, id 21946, seq 161, length 64
00:00:01.923983 IP 10.0.0.1 > 10.0.0.2: ICMP echo request, id 21946, seq 162, length 64
00:00:01.936179 IP 10.0.0.1 > 10.0.0.2: ICMP echo request, id 21946, seq 163, length 64
00:00:01.948023 IP 10.0.0.1 > 10.0.0.2: ICMP echo request, id 21946, seq 164, length 64
00:00:01.976344 IP 10.0.0.1 > 10.0.0.2: ICMP echo request, id 21946, seq 166, length 64
00:00:01.982474 IP 10.0.0.1 > 10.0.0.2: ICMP echo request, id 21946, seq 167, length 64
00:00:01.991883 IP 10.0.0.1 > 10.0.0.2: ICMP echo request, id 21946, seq 168, length 64
00:00:02.002227 IP 10.0.0.1 > 10.0.0.2: ICMP echo request, id 21946, seq 169, length 64
00:00:02.012213 IP 10.0.0.1 > 10.0.0.2: ICMP echo request, id 21946, seq 170, length 64
00:00:02.027638 IP 10.0.0.1 > 10.0.0.2: ICMP echo request, id 21946, seq 171, length 64
00:00:02.037633 IP 10.0.0.1 > 10.0.0.2: ICMP echo request, id 21946, seq 172, length 64
00:00:02.048966 IP 10.0.0.1 > 10.0.0.2: ICMP echo request, id 21946, seq 173, length 64
00:00:02.065297 IP 10.0.0.1 > 10.0.0.2: ICMP echo request, id 21946, seq 174, length 64
00:00:02.080660 IP 10.0.0.1 > 10.0.0.2: ICMP echo request, id 21946, seq 175, length 64
00:00:02.092145 IP 10.0.0.1 > 10.0.0.2: ICMP echo request, id 21946, seq 176, length 64
00:00:02.103875 IP 10.0.0.1 > 10.0.0.2: ICMP echo request, id 21946, seq 177, length 64
00:00:02.116407 IP 10.0.0.1 > 10.0.0.2: ICMP echo request, id 21946, seq 178, length 64
00:00:02.128328 IP 10.0.0.1 > 10.0.0.2: ICMP echo request, id 21946, seq 179, length 64
00:00:02.144474 IP 10.0.0.1 > 10.0.0.2: ICMP echo request, id 21946, seq 180, length 64
00:00:02.156334 IP 10.0.0.1 > 10.0.0.2: ICMP echo request, id 21946, seq 181, length 64
00:00:02.167953 IP 10.0.0.1 > 10.0.0.2: ICMP echo request, id 21946, seq 182, length 64
00:00:02.180622 IP 10.0.0.1 > 10.0.0.2: ICMP echo request, id 21946, seq 183, length 64
00:00:02.194327 IP 10.0.0.1 > 10.0.0.2: ICMP echo request, id 21946, seq 184, length 64
00:00:02.204617 IP 10.0.0.1 > 10.0.0.2: ICMP echo request, id 21946, seq 185, length 64
00:00:02.217766 IP 10.0.0.1 > 10.0.0.2: ICMP echo request, id 21946, seq 186, length 64
00:00:02.228513 IP 10.0.0.1 > 10.0.0.2: ICMP echo request, id 21946, seq 187, length 64
00:00:02.243849 IP 10.0.0.1 > 10.0.0.2: ICMP echo request, id 21946, seq 188, length 64
00:00:02.255912 IP 10.0.0.1 > 10.0.0.2: ICMP echo request, id 21946, seq 189, length 64
00:00:02.270058 IP 10.0.0.1 > 10.0.0.2: ICMP echo request, id 21946, seq 190, length 64
00:00:02.279849 IP 10.0.0.1 > 10.0.0.2: ICMP echo request, id 21946, seq 191, length 64
00:00:02.292577 IP 10.0.0.1 > 10.0.0.2: ICMP echo request, id 21946, seq 192, length 64
00:00:02.303860 IP 10.0.0.1 > 10.0.0.2: ICMP echo request, id 21946, seq 193, length 64
00:00:02.318990 IP 10.0.0.1 > 10.0.0.2: ICMP echo request, id 21946, seq 194, length 64
00:00:02.328986 IP 10.0.0.1 > 10.0.0.2: ICMP echo request, id 21946, seq 195, length 64
00:00:02.340490 IP 10.0.0.1 > 10.0.0.2: ICMP echo request, id 21946, seq 196, length 64
00:00:02.352206 IP 10.0.0.1 > 10.0.0.2: ICMP echo request, id 21946, seq 197, length 64
00:00:02.364392 IP 10.0.0.1 > 10.0.0.2: ICMP echo request, id 21946, seq 198, length 64
00:00:02.376163 IP 10.0.0.1 > 10.0.0.2: ICMP echo request, id 21946, seq 199, length 64
00:00:02.387895 IP 10.0.0.1 > 10.0.0.2: ICMP echo request, id 21946, seq 200, length 64
00:00:02.400091 IP 10.0.0.1 > 10.0.0.2: ICMP echo request, id 21946, seq 201, length 64
00:00:02.411835 IP 10.0.0.1 > 10.0.0.2: ICMP echo request, id 21946, seq 202, length 64
00:00:02.425020 IP 10.0.0.1 > 10.0.0.2: ICMP echo request, id 21946, seq 203, length 64
00:00:02.435785 IP 10.0.0.1 > 10.0.0.2: ICMP echo request, id 21946, seq 204, length 64
00:00:02.447995 IP 10.0.0.1 > 10.0.0.2: ICMP echo request, id 21946, seq 205, length 64
00:00:02.462674 IP 10.0.0.1 > 10.0.0.2: ICMP echo request, id 21946, seq 206, length 64
00:00:02.472671 IP 10.0.0.1 > 10.0.0.2: ICMP echo request, id 21946, seq 207, length 64
00:00:02.488086 IP 10.0.0.1 > 10.0.0.2: ICMP echo request, id 21946, seq 208, length 64
00:00:02.499811 IP 10.0.0.1 > 10.0.0.2: ICMP echo request, id 21946, seq 209, length 64
00:00:02.513006 IP 10.0.0.1 > 10.0.0.2: ICMP echo request, id 21946, seq 210, length 64
00:00:02.523761 IP 10.0.0.1 > 10.0.0.2: ICMP echo request, id 21946, seq 211, length 64
00:00:02.537053 IP 10.0.0.1 > 10.0.0.2: ICMP echo request, id 21946, seq 212, length 64
00:00:02.547756 IP 10.0.0.1 > 10.0.0.2: ICMP echo request, id 21946, seq 213, length 64
00:00:02.560922 IP 10.0.0.1 > 10.0.0.2: ICMP echo request, id 21946, seq 214, length 64
00:00:02.574598 IP 10.0.0.1 > 10.0.0.2: ICMP echo request, id 21946, seq 215, length 64
00:00:02.585344 IP 10.0.0.1 > 10.0.0.2: ICMP echo request, id 21946, seq 216, length 64
00:00:02.596104 IP 10.0.0.1 > 10.0.0.2: ICMP echo request, id 21946, seq 217, length 64
00:00:02.608331 IP 10.0.0.1 > 10.0.0.2: ICMP echo request, id 21946, seq 218, length 64
00:00:02.620059 IP 10.0.0.1 > 10.0.0.2: ICMP echo request, id 21946, seq 219, length 64
00:00:02.631814 IP 10.0.0.1 > 10.0.0.2: ICMP echo request, id 21946, seq 220, length 64
00:00:02.644506 IP 10.0.0.1 > 10.0.0.2: ICMP echo request, id 21946, seq 221, length 64
00:00:02.656220 IP 10.0.0.1 > 10.0.0.2: ICMP echo request, id 21946, seq 222, length 64
00:00:02.667980 IP 10.0.0.1 > 10.0.0.2: ICMP echo request, id 21946, seq 223, length 64
00:00:02.681656 IP 10.0.0.1 > 10.0.0.2: ICMP echo request, id 21946, seq 224, length 64
00:00:02.692491 IP 10.0.0.1 > 10.0.0.2: ICMP echo request, id 21946, seq 225, length 64
00:00:02.704143 IP 10.0.0.1 > 10.0.0.2: ICMP echo request, id 21946, seq 226, length 64
00:00:02.718813 IP 10.0.0.1 > 10.0.0.2: ICMP echo request, id 21946, seq 227, length 64
00:00:02.728811 IP 10.0.0.1 > 10.0.0.2: ICMP echo request, id 21946, seq 228, length 64
00:00:02.740118 IP 10.0.0.1 > 10.0.0.2: ICMP echo request, id 21946, seq 229, length 64
00:00:02.752037 IP 10.0.0.1 > 10.0.0.2: ICMP echo request, id 21946, seq 230, length 64
00:00:02.766191 IP 10.0.0.1 > 10.0.0.2: ICMP echo request, id 21946, seq 231, length 64
00:00:02.776999 IP 10.0.0.1 > 10.0.0.2: ICMP echo request, id 21946, seq 232, length 64
00:00:02.791165 IP 10.0.0.1 > 10.0.0.2: ICMP echo request, id 21946, seq 233, length 64
00:00:02.801157 IP 10.0.0.1 > 10.0.0.2: ICMP echo request, id 21946, seq 234, length 64
00:00:02.813660 IP 10.0.0.1 > 10.0.0.2: ICMP echo request, id 21946, seq 235, length 64
