00:00:00.000000 IP 10.0.0.1 > 10.0.0.2: ICMP echo request, id 8773, seq 5, length 64
00:00:00.011035 IP 10.0.0.1 > 10.0.0.2: ICMP echo request, id 8773, seq 6, length 64
00:00:00.023246 IP 10.0.0.1 > 10.0.0.2: ICMP echo request, id 8773, seq 7, length 64
00:00:00.037436 IP 10.0.0.1 > 10.0.0.2: ICMP echo request, id 8773, seq 8, length 64
00:00:00.048232 IP 10.0.0.1 > 10.0.0.2: ICMP echo request, id 8773, seq 9, length 64
00:00:00.059763 IP 10.0.0.1 > 10.0.0.2: ICMP echo request, id 8773, seq 10, length 64
00:00:00.071197 IP 10.0.0.1 > 10.0.0.2: ICMP echo request, id 8773, seq 11, length 64
00:00:00.084336 IP 10.0.0.1 > 10.0.0.2: ICMP echo request, id 8773, seq 12, length 64
00:00:00.096148 IP 10.0.0.1 > 10.0.0.2: ICMP echo request, id 8773, seq 13, length 64
00:00:00.107910 IP 10.0.0.1 > 10.0.0.2: ICMP echo request, id 8773, seq 14, length 64
00:00:00.119148 IP 10.0.0.1 > 10.0.0.2: ICMP echo request, id 8773, seq 15, length 64
00:00:00.131239 IP 10.0.0.1 > 10.0.0.2: ICMP echo request, id 8773, seq 16, length 64
00:00:00.143179 IP 10.0.0.1 > 10.0.0.2: ICMP echo request, id 8773, seq 17, length 64
00:00:00.155271 IP 10.0.0.1 > 10.0.0.2: ICMP echo request, id 8773, seq 18, length 64
00:00:00.167031 IP 10.0.0.1 > 10.0.0.2: ICMP echo request, id 8773, seq 19, length 64
00:00:00.179752 IP 10.0.0.1 > 10.0.0.2: ICMP echo request, id 8773, seq 20, length 64
00:00:00.191946 IP 10.0.0.1 > 10.0.0.2: ICMP echo request, id 8773, seq 21, length 64
00:00:00.206058 IP 10.0.0.1 > 10.0.0.2: ICMP echo request, id 8773, seq 22, length 64
00:00:00.216053 IP 10.0.0.1 > 10.0.0.2: ICMP echo request, id 8773, seq 23, length 64
00:00:00.230082 IP 10.0.0.1 > 10.0.0.2: ICMP echo request, id 8773, seq 24, length 64
00:00:00.242749 IP 10.0.0.1 > 10.0.0.2: ICMP echo request, id 8773, seq 25, length 64
00:00:00.253512 IP 10.0.0.1 > 10.0.0.2: ICMP echo request, id 8773, seq 26, length 64
00:00:00.264241 IP 10.0.0.1 > 10.0.0.2: ICMP echo request, id 8773, seq 27, length 64
00:00:00.279915 IP 10.0.0.1 > 10.0.0.2: ICMP echo request, id 8773, seq 28, length 64
00:00:00.291709 IP 10.0.0.1 > 10.0.0.2: ICMP echo request, id 8773, seq 29, length 64
00:00:00.303392 IP 10.0.0.1 > 10.0.0.2: ICMP echo request, id 8773, seq 30, length 64
00:00:00.315703 IP 10.0.0.1 > 10.0.0.2: ICMP echo request, id 8773, seq 31, length 64
00:00:00.331716 IP 10.0.0.1 > 10.0.0.2: ICMP echo request, id 8773, seq 32, length 64
00:00:00.344419 IP 10.0.0.1 > 10.0.0.2: ICMP echo request, id 8773, seq 33, length 64
00:00:00.355185 IP 10.0.0.1 > 10.0.0.2: ICMP echo request, id 8773, seq 34, length 64
00:00:00.367194 IP 10.0.0.1 > 10.0.0.2: ICMP echo request, id 8773, seq 35, length 64
00:00:00.379123 IP 10.0.0.1 > 10.0.0.2: ICMP echo request, id 8773, seq 36, length 64
00:00:00.391337 IP 10.0.0.1 > 10.0.0.2: ICMP echo request, id 8773, seq 37, length 64
00:00:00.403618 IP 10.0.0.1 > 10.0.0.2: ICMP echo request, id 8773, seq 38, length 64
00:00:00.415817 IP 10.0.0.1 > 10.0.0.2: ICMP echo request, id 8773, seq 39, length 64
00:00:00.428003 IP 10.0.0.1 > 10.0.0.2: ICMP echo request, id 8773, seq 40, length 64
00:00:00.442163 IP 10.0.0.1 > 10.0.0.2: ICMP echo request, id 8773, seq 41, length 64
00:00:00.453430 IP 10.0.0.1 > 10.0.0.2: ICMP echo request, id 8773, seq 42, length 64
00:00:00.465166 IP 10.0.0.1 > 10.0.0.2: ICMP echo request, id 8773, seq 43, length 64
00:00:00.475912 IP 10.0.0.1 > 10.0.0.2: ICMP echo request, id 8773, seq 44, length 64
00:00:00.487180 IP 10.0.0.1 > 10.0.0.2: ICMP echo request, id 8773, seq 45, length 64
00:00:00.499403 IP 10.0.0.1 > 10.0.0.2: ICMP echo request, id 8773, seq 46, length 64
00:00:00.516465 IP 10.0.0.1 > 10.0.0.2: ICMP echo request, id 8773, seq 47, length 64
00:00:00.528185 IP 10.0.0.1 > 10.0.0.2: ICMP echo request, id 8773, seq 48, length 64
00:00:00.539974 IP 10.0.0.1 > 10.0.0.2: ICMP echo request, id 8773, seq 49, length 64
00:00:00.551246 IP 10.0.0.1 > 10.0.0.2: ICMP echo request, id 8773, seq 50, length 64
00:00:00.563905 IP 10.0.0.1 > 10.0.0.2: ICMP echo request, id 8773, seq 51, length 64
00:00:00.577095 IP 10.0.0.1 > 10.0.0.2: ICMP echo request, id 8773, seq 52, length 64
00:00:00.587861 IP 10.0.0.1 > 10.0.0.2: ICMP echo request, id 8773, seq 53, length 64
00:00:00.599089 IP 10.0.0.1 > 10.0.0.2: ICMP echo request, id 8773, seq 54, length 64
00:00:00.613759 IP 10.0.0.1 > 10.0.0.2: ICMP echo request, id 8773, seq 55, length 64
00:00:00.623756 IP 10.0.0.1 > 10.0.0.2: ICMP echo request, id 8773, seq 56, length 64
00:00:00.637749 IP 10.0.0.1 > 10.0.0.2: ICMP echo request, id 8773, seq 57, length 64
00:00:00.648917 IP 10.0.0.1 > 10.0.0.2: ICMP echo request, id 8773, seq 58, length 64
00:00:00.659728 IP 10.0.0.1 > 10.0.0.2: ICMP echo request, id 8773, seq 59, length 64
00:00:00.670905 IP 10.0.0.1 > 10.0.0.2: ICMP echo request, id 8773, seq 60, length 64
00:00:00.683298 IP 10.0.0.1 > 10.0.0.2: ICMP echo request, id 8773, seq 61, length 64
00:00:00.697785 IP 10.0.0.1 > 10.0.0.2: ICMP echo request, id 8773, seq 62, length 64
00:00:00.707885 IP 10.0.0.1 > 10.0.0.2: ICMP echo request, id 8773, seq 63, length 64
00:00:00.719345 IP 10.0.0.1 > 10.0.0.2: ICMP echo request, id 8773, seq 64, length 64
00:00:00.732075 IP 10.0.0.1 > 10.0.0.2: ICMP echo request, id 8773, seq 65, length 64
00:00:00.746712 IP 10.0.0.1 > 10.0.0.2: ICMP echo request, id 8773, seq 66, length 64
00:00:00.756698 IP 10.0.0.1 > 10.0.0.2: ICMP echo request, id 8773, seq 67, length 64
00:00:00.767173 IP 10.0.0.1 > 10.0.0.2: ICMP echo request, id 8773, seq 68, length 64
00:00:00.778923 IP 10.0.0.1 > 10.0.0.2: ICMP echo request, id 8773, seq 69, length 64
00:00:00.791626 IP 10.0.0.1 > 10.0.0.2: ICMP echo request, id 8773, seq 70, length 64
00:00:00.805385 IP 10.0.0.1 > 10.0.0.2: ICMP echo request, id 8773, seq 71, length 64
00:00:00.815365 IP 10.0.0.1 > 10.0.0.2: ICMP echo request, id 8773, seq 72, length 64
00:00:00.831222 IP 10.0.0.1 > 10.0.0.2: ICMP echo request, id 8773, seq 73, length 64
00:00:00.844434 IP 10.0.0.1 > 10.0.0.2: ICMP echo request, id 8773, seq 74, length 64
00:00:00.855230 IP 10.0.0.1 > 10.0.0.2: ICMP echo request, id 8773, seq 75, length 64
00:00:00.867372 IP 10.0.0.1 > 10.0.0.2: ICMP echo request, id 8773, seq 76, length 64
00:00:00.880097 IP 10.0.0.1 > 10.0.0.2: ICMP echo request, id 8773, seq 77, length 64
00:00:00.891405 IP 10.0.0.1 > 10.0.0.2: ICMP echo request, id 8773, seq 78, length 64
00:00:00.904101 IP 10.0.0.1 > 10.0.0.2: ICMP echo request, id 8773, seq 79, length 64
00:00:00.915770 IP 10.0.0.1 > 10.0.0.2: ICMP echo request, id 8773, seq 80, length 64
00:00:00.927592 IP 10.0.0.1 > 10.0.0.2: ICMP echo request, id 8773, seq 81, length 64
00:00:00.941721 IP 10.0.0.1 > 10.0.0.2: ICMP echo request, id 8773, seq 82, length 64
00:00:00.953004 IP 10.0.0.1 > 10.0.0.2: ICMP echo request, id 8773, seq 83, length 64
00:00:00.963190 IP 10.0.0.1 > 10.0.0.2: ICMP echo request, id 8773, seq 84, length 64
00:00:00.974924 IP 10.0.0.1 > 10.0.0.2: ICMP echo request, id 8773, seq 85, length 64
00:00:00.987166 IP 10.0.0.1 > 10.0.0.2: ICMP echo request, id 8773, seq 86, length 64
00:00:00.998923 IP 10.0.0.1 > 10.0.0.2: ICMP echo request, id 8773, seq 87, length 64
00:00:01.011617 IP 10.0.0.1 > 10.0.0.2: ICMP echo request, id 8773, seq 88, length 64
00:00:01.028223 IP 10.0.0.1 > 10.0.0.2: ICMP echo request, id 8773, seq 89, length 64
00:00:01.038951 IP 10.0.0.1 > 10.0.0.2: ICMP echo request, id 8773, seq 90, length 64
00:00:01.055113 IP 10.0.0.1 > 10.0.0.2: ICMP echo request, id 8773, seq 91, length 64
00:00:01.067821 IP 10.0.0.1 > 10.0.0.2: ICMP echo request, id 8773, seq 92, length 64
00:00:01.080109 IP 10.0.0.1 > 10.0.0.2: ICMP echo request, id 8773, seq 93, length 64
00:00:01.091776 IP 10.0.0.1 > 10.0.0.2: ICMP echo request, id 8773, seq 94, length 64
00:00:01.107913 IP 10.0.0.1 > 10.0.0.2: ICMP echo request, id 8773, seq 95, length 64
00:00:01.119125 IP 10.0.0.1 > 10.0.0.2: ICMP echo request, id 8773, seq 96, length 64
00:00:01.131438 IP 10.0.0.1 > 10.0.0.2: ICMP echo request, id 8773, seq 97, length 64
00:00:01.143091 IP 10.0.0.1 > 10.0.0.2: ICMP echo request, id 8773, seq 98, length 64
00:00:01.155805 IP 10.0.0.1 > 10.0.0.2: ICMP echo request, id 8773, seq 99, length 64
00:00:01.167077 IP 10.0.0.1 > 10.0.0.2: ICMP echo request, id 8773, seq 100, length 64
00:00:01.182702 IP 10.0.0.1 > 10.0.0.2: ICMP echo request, id 8773, seq 101, length 64
00:00:01.192921 IP 10.0.0.1 > 10.0.0.2: ICMP echo request, id 8773, seq 102, length 64
00:00:01.203755 IP 10.0.0.1 > 10.0.0.2: ICMP echo request, id 8773, seq 103, length 64
00:00:01.215954 IP 10.0.0.1 > 10.0.0.2: ICMP echo request, id 8773, seq 104, length 64
00:00:01.228646 IP 10.0.0.1 > 10.0.0.2: ICMP echo request, id 8773, seq 105, length 64
00:00:01.239393 IP 10.0.0.1 > 10.0.0.2: ICMP echo request, id 8773, seq 106, length 64
00:00:01.251127 IP 10.0.0.1 > 10.0.0.2: ICMP echo request, id 8773, seq 107, length 64
00:00:01.264890 IP 10.0.0.1 > 10.0.0.2: ICMP echo request, id 8773, seq 108, length 64
00:00:01.276064 IP 10.0.0.1 > 10.0.0.2: ICMP echo request, id 8773, seq 109, length 64
00:00:01.288274 IP 10.0.0.1 > 10.0.0.2: ICMP echo request, id 8773, seq 110, length 64
00:00:01.303418 IP 10.0.0.1 > 10.0.0.2: ICMP echo request, id 8773, seq 111, length 64
00:00:01.315129 IP 10.0.0.1 > 10.0.0.2: ICMP echo request, id 8773, seq 112, length 64
00:00:01.329830 IP 10.0.0.1 > 10.0.0.2: ICMP echo request, id 8773, seq 113, length 64
00:00:01.341535 IP 10.0.0.1 > 10.0.0.2: ICMP echo request, id 8773, seq 114, length 64
00:00:01.355263 IP 10.0.0.1 > 10.0.0.2: ICMP echo request, id 8773, seq 115, length 64
00:00:01.368398 IP 10.0.0.1 > 10.0.0.2: ICMP echo request, id 8773, seq 116, length 64
00:00:01.380659 IP 10.0.0.1 > 10.0.0.2: ICMP echo request, id 8773, seq 117, length 64
00:00:01.392914 IP 10.0.0.1 > 10.0.0.2: ICMP echo request, id 8773, seq 118, length 64
00:00:01.403608 IP 10.0.0.1 > 10.0.0.2: ICMP echo request, id 8773, seq 119, length 64
00:00:01.419761 IP 10.0.0.1 > 10.0.0.2: ICMP echo request, id 8773, seq 120, length 64
00:00:01.431021 IP 10.0.0.1 > 10.0.0.2: ICMP echo request, id 8773, seq 121, length 64
00:00:01.443207 IP 10.0.0.1 > 10.0.0.2: ICMP echo request, id 8773, seq 122, length 64
00:00:01.457390 IP 10.0.0.1 > 10.0.0.2: ICMP echo request, id 8773, seq 123, length 64
00:00:01.467386 IP 10.0.0.1 > 10.0.0.2: ICMP echo request, id 8773, seq 124, length 64
00:00:01.481864 IP 10.0.0.1 > 10.0.0.2: ICMP echo request, id 8773, seq 125, length 64
00:00:01.494532 IP 10.0.0.1 > 10.0.0.2: ICMP echo request, id 8773, seq 126, length 64
00:00:01.505270 IP 10.0.0.1 > 10.0.0.2: ICMP echo request, id 8773, seq 127, length 64
00:00:01.515060 IP 10.0.0.1 > 10.0.0.2: ICMP echo request, id 8773, seq 128, length 64
00:00:01.530738 IP 10.0.0.1 > 10.0.0.2: ICMP echo request, id 8773, seq 129, length 64
00:00:01.540724 IP 10.0.0.1 > 10.0.0.2: ICMP echo request, id 8773, seq 130, length 64
00:00:01.552187 IP 10.0.0.1 > 10.0.0.2: ICMP echo request, id 8773, seq 131, length 64
00:00:01.562982 IP 10.0.0.1 > 10.0.0.2: ICMP echo request, id 8773, seq 132, length 64
00:00:01.579122 IP 10.0.0.1 > 10.0.0.2: ICMP echo request, id 8773, seq 133, length 64
00:00:01.592779 IP 10.0.0.1 > 10.0.0.2: ICMP echo request, id 8773, seq 134, length 64
00:00:01.605483 IP 10.0.0.1 > 10.0.0.2: ICMP echo request, id 8773, seq 135, length 64
00:00:01.615473 IP 10.0.0.1 > 10.0.0.2: ICMP echo request, id 8773, seq 136, length 64
00:00:01.627023 IP 10.0.0.1 > 10.0.0.2: ICMP echo request, id 8773, seq 137, length 64
00:00:01.641179 IP 10.0.0.1 > 10.0.0.2: ICMP echo request, id 8773, seq 138, length 64
00:00:01.653382 IP 10.0.0.1 > 10.0.0.2: ICMP echo request, id 8773, seq 139, length 64
00:00:01.664139 IP 10.0.0.1 > 10.0.0.2: ICMP echo request, id 8773, seq 140, length 64
00:00:01.677360 IP 10.0.0.1 > 10.0.0.2: ICMP echo request, id 8773, seq 141, length 64
00:00:01.687362 IP 10.0.0.1 > 10.0.0.2: ICMP echo request, id 8773, seq 142, length 64
00:00:01.700834 IP 10.0.0.1 > 10.0.0.2: ICMP echo request, id 8773, seq 143, length 64
00:00:01.711619 IP 10.0.0.1 > 10.0.0.2: ICMP echo request, id 8773, seq 144, length 64
00:00:01.726241 IP 10.0.0.1 > 10.0.0.2: ICMP echo request, id 8773, seq 145, length 64
00:00:01.739916 IP 10.0.0.1 > 10.0.0.2: ICMP echo request, id 8773, seq 146, length 64
00:00:01.751636 IP 10.0.0.1 > 10.0.0.2: ICMP echo request, id 8773, seq 147, length 64
00:00:01.763878 IP 10.0.0.1 > 10.0.0.2: ICMP echo request, id 8773, seq 148, length 64
00:00:01.775132 IP 10.0.0.1 > 10.0.0.2: ICMP echo request, id 8773, seq 149, length 64
00:00:01.790248 IP 10.0.0.1 > 10.0.0.2: ICMP echo request, id 8773, seq 150, length 64
00:00:01.801024 IP 10.0.0.1 > 10.0.0.2: ICMP echo request, id 8773, seq 151, length 64
00:00:01.811789 IP 10.0.0.1 > 10.0.0.2: ICMP echo request, id 8773, seq 152, length 64
00:00:01.824490 IP 10.0.0.1 > 10.0.0.2: ICMP echo request, id 8773, seq 153, length 64
00:00:01.836168 IP 10.0.0.1 > 10.0.0.2: ICMP echo request, id 8773, seq 154, length 64
00:00:01.848881 IP 10.0.0.1 > 10.0.0.2: ICMP echo request, id 8773, seq 155, length 64
00:00:01.859171 IP 10.0.0.1 > 10.0.0.2: ICMP echo request, id 8773, seq 156, length 64
00:00:01.871952 IP 10.0.0.1 > 10.0.0.2: ICMP echo request, id 8773, seq 157, length 64
00:00:01.883147 IP 10.0.0.1 > 10.0.0.2: ICMP echo request, id 8773, seq 158, length 64
00:00:01.894921 IP 10.0.0.1 > 10.0.0.2: ICMP echo request, id 8773, seq 159, length 64
00:00:01.909064 IP 10.0.0.1 > 10.0.0.2: ICMP echo request, id 8773, seq 160, length 64
00:00:01.919064 IP 10.0.0.1 > 10.0.0.2: ICMP echo request, id 8773, seq 161, length 64
00:00:01.931122 IP 10.0.0.1 > 10.0.0.2: ICMP echo request, id 8773, seq 162, length 64
00:00:01.948660 IP 10.0.0.1 > 10.0.0.2: ICMP echo request, id 8773, seq 163, length 64
00:00:01.987882 IP 10.0.0.1 > 10.0.0.2: ICMP echo request, id 8773, seq 166, length 64
00:00:01.995723 IP 10.0.0.1 > 10.0.0.2: ICMP echo request, id 8773, seq 167, length 64
00:00:02.011216 IP 10.0.0.1 > 10.0.0.2: ICMP echo request, id 8773, seq 168, length 64
00:00:02.027351 IP 10.0.0.1 > 10.0.0.2: ICMP echo request, id 8773, seq 169, length 64
00:00:02.039052 IP 10.0.0.1 > 10.0.0.2: ICMP echo request, id 8773, seq 170, length 64
00:00:02.054250 IP 10.0.0.1 > 10.0.0.2: ICMP echo request, id 8773, seq 171, length 64
00:00:02.064247 IP 10.0.0.1 > 10.0.0.2: ICMP echo request, id 8773, seq 172, length 64
00:00:02.075245 IP 10.0.0.1 > 10.0.0.2: ICMP echo request, id 8773, seq 173, length 64
00:00:02.088450 IP 10.0.0.1 > 10.0.0.2: ICMP echo request, id 8773, seq 174, length 64
00:00:02.099206 IP 10.0.0.1 > 10.0.0.2: ICMP echo request, id 8773, seq 175, length 64
00:00:02.111429 IP 10.0.0.1 > 10.0.0.2: ICMP echo request, id 8773, seq 176, length 64
00:00:02.123661 IP 10.0.0.1 > 10.0.0.2: ICMP echo request, id 8773, seq 177, length 64
00:00:02.135381 IP 10.0.0.1 > 10.0.0.2: ICMP echo request, id 8773, seq 178, length 64
00:00:02.148069 IP 10.0.0.1 > 10.0.0.2: ICMP echo request, id 8773, seq 179, length 64
00:00:02.159985 IP 10.0.0.1 > 10.0.0.2: ICMP echo request, id 8773, seq 180, length 64
00:00:02.175988 IP 10.0.0.1 > 10.0.0.2: ICMP echo request, id 8773, seq 181, length 64
00:00:02.187206 IP 10.0.0.1 > 10.0.0.2: ICMP echo request, id 8773, seq 182, length 64
00:00:02.202346 IP 10.0.0.1 > 10.0.0.2: ICMP echo request, id 8773, seq 183, length 64
00:00:02.213068 IP 10.0.0.1 > 10.0.0.2: ICMP echo request, id 8773, seq 184, length 64
00:00:02.223388 IP 10.0.0.1 > 10.0.0.2: ICMP echo request, id 8773, seq 185, length 64
00:00:02.239539 IP 10.0.0.1 > 10.0.0.2: ICMP echo request, id 8773, seq 186, length 64
00:00:02.255713 IP 10.0.0.1 > 10.0.0.2: ICMP echo request, id 8773, seq 187, length 64
00:00:02.267871 IP 10.0.0.1 > 10.0.0.2: ICMP echo request, id 8773, seq 188, length 64
00:00:02.280593 IP 10.0.0.1 > 10.0.0.2: ICMP echo request, id 8773, seq 189, length 64
00:00:02.291328 IP 10.0.0.1 > 10.0.0.2: ICMP echo request, id 8773, seq 190, length 64
00:00:02.303563 IP 10.0.0.1 > 10.0.0.2: ICMP echo request, id 8773, seq 191, length 64
00:00:02.317219 IP 10.0.0.1 > 10.0.0.2: ICMP echo request, id 8773, seq 192, length 64
00:00:02.329959 IP 10.0.0.1 > 10.0.0.2: ICMP echo request, id 8773, seq 193, length 64
00:00:02.340684 IP 10.0.0.1 > 10.0.0.2: ICMP echo request, id 8773, seq 194, length 64
00:00:02.351436 IP 10.0.0.1 > 10.0.0.2: ICMP echo request, id 8773, seq 195, length 64
00:00:02.364143 IP 10.0.0.1 > 10.0.0.2: ICMP echo request, id 8773, seq 196, length 64
00:00:02.378333 IP 10.0.0.1 > 10.0.0.2: ICMP echo request, id 8773, seq 197, length 64
00:00:02.389096 IP 10.0.0.1 > 10.0.0.2: ICMP echo request, id 8773, seq 198, length 64
00:00:02.399846 IP 10.0.0.1 > 10.0.0.2: ICMP echo request, id 8773, seq 199, length 64
00:00:02.413027 IP 10.0.0.1 > 10.0.0.2: ICMP echo request, id 8773, seq 200, length 64
00:00:02.426236 IP 10.0.0.1 > 10.0.0.2: ICMP echo request, id 8773, seq 201, length 64
00:00:02.436227 IP 10.0.0.1 > 10.0.0.2: ICMP echo request, id 8773, seq 202, length 64
00:00:02.447749 IP 10.0.0.1 > 10.0.0.2: ICMP echo request, id 8773, seq 203, length 64
00:00:02.459469 IP 10.0.0.1 > 10.0.0.2: ICMP echo request, id 8773, seq 204, length 64
00:00:02.471227 IP 10.0.0.1 > 10.0.0.2: ICMP echo request, id 8773, seq 205, length 64
00:00:02.482939 IP 10.0.0.1 > 10.0.0.2: ICMP echo request, id 8773, seq 206, length 64
00:00:02.498592 IP 10.0.0.1 > 10.0.0.2: ICMP echo request, id 8773, seq 207, length 64
00:00:02.508589 IP 10.0.0.1 > 10.0.0.2: ICMP echo request, id 8773, seq 208, length 64
00:00:02.520914 IP 10.0.0.1 > 10.0.0.2: ICMP echo request, id 8773, seq 209, length 64
00:00:02.531324 IP 10.0.0.1 > 10.0.0.2: ICMP echo request, id 8773, seq 210, length 64
00:00:02.543534 IP 10.0.0.1 > 10.0.0.2: ICMP echo request, id 8773, seq 211, length 64
00:00:02.558714 IP 10.0.0.1 > 10.0.0.2: ICMP echo request, id 8773, seq 212, length 64
00:00:02.568717 IP 10.0.0.1 > 10.0.0.2: ICMP echo request, id 8773, seq 213, length 64
00:00:02.579271 IP 10.0.0.1 > 10.0.0.2: ICMP echo request, id 8773, seq 214, length 64
00:00:02.590962 IP 10.0.0.1 > 10.0.0.2: ICMP echo request, id 8773, seq 215, length 64
00:00:02.607112 IP 10.0.0.1 > 10.0.0.2: ICMP echo request, id 8773, seq 216, length 64
00:00:02.619289 IP 10.0.0.1 > 10.0.0.2: ICMP echo request, id 8773, seq 217, length 64
00:00:02.632966 IP 10.0.0.1 > 10.0.0.2: ICMP echo request, id 8773, seq 218, length 64
00:00:02.643704 IP 10.0.0.1 > 10.0.0.2: ICMP echo request, id 8773, seq 219, length 64
00:00:02.654991 IP 10.0.0.1 > 10.0.0.2: ICMP echo request, id 8773, seq 220, length 64
00:00:02.667185 IP 10.0.0.1 > 10.0.0.2: ICMP echo request, id 8773, seq 221, length 64
00:00:02.680859 IP 10.0.0.1 > 10.0.0.2: ICMP echo request, id 8773, seq 222, length 64
00:00:02.691620 IP 10.0.0.1 > 10.0.0.2: ICMP echo request, id 8773, seq 223, length 64
00:00:02.706313 IP 10.0.0.1 > 10.0.0.2: ICMP echo request, id 8773, seq 224, length 64
00:00:02.716307 IP 10.0.0.1 > 10.0.0.2: ICMP echo request, id 8773, seq 225, length 64
00:00:02.728774 IP 10.0.0.1 > 10.0.0.2: ICMP echo request, id 8773, seq 226, length 64
00:00:02.740012 IP 10.0.0.1 > 10.0.0.2: ICMP echo request, id 8773, seq 227, length 64
00:00:02.753717 IP 10.0.0.1 > 10.0.0.2: ICMP echo request, id 8773, seq 228, length 64
00:00:02.764944 IP 10.0.0.1 > 10.0.0.2: ICMP echo request, id 8773, seq 229, length 64
00:00:02.775687 IP 10.0.0.1 > 10.0.0.2: ICMP echo request, id 8773, seq 230, length 64
00:00:02.790356 IP 10.0.0.1 > 10.0.0.2: ICMP echo request, id 8773, seq 231, length 64
00:00:02.801615 IP 10.0.0.1 > 10.0.0.2: ICMP echo request, id 8773, seq 232, length 64
00:00:02.811607 IP 10.0.0.1 > 10.0.0.2: ICMP echo request, id 8773, seq 233, length 64
00:00:02.823100 IP 10.0.0.1 > 10.0.0.2: ICMP echo request, id 8773, seq 234, length 64
00:00:02.834901 IP 10.0.0.1 > 10.0.0.2: ICMP echo request, id 8773, seq 235, length 64
00:00:02.847090 IP 10.0.0.1 > 10.0.0.2: ICMP echo request, id 8773, seq 236, length 64
00:00:02.859273 IP 10.0.0.1 > 10.0.0.2: ICMP echo request, id 8773, seq 237, length 64
