00:00:00.000000 IP 10.0.1.1 > 10.0.2.2: ICMP echo request, id 24101, seq 31, length 64
00:00:00.001981 IP 10.0.1.1 > 10.0.2.2: ICMP echo request, id 24101, seq 32, length 64
00:00:00.004107 IP 10.0.1.1 > 10.0.2.2: ICMP echo request, id 24101, seq 33, length 64
00:00:00.006052 IP 10.0.1.1 > 10.0.2.2: ICMP echo request, id 24101, seq 34, length 64
00:00:00.008565 IP 10.0.1.1 > 10.0.2.2: ICMP echo request, id 24101, seq 35, length 64
00:00:00.010852 IP 10.0.1.1 > 10.0.2.2: ICMP echo request, id 24101, seq 36, length 64
00:00:00.012774 IP 10.0.1.1 > 10.0.2.2: ICMP echo request, id 24101, seq 37, length 64
00:00:00.014781 IP 10.0.1.1 > 10.0.2.2: ICMP echo request, id 24101, seq 38, length 64
00:00:00.016736 IP 10.0.1.1 > 10.0.2.2: ICMP echo request, id 24101, seq 39, length 64
00:00:00.018832 IP 10.0.1.1 > 10.0.2.2: ICMP echo request, id 24101, seq 40, length 64
00:00:00.020849 IP 10.0.1.1 > 10.0.2.2: ICMP echo request, id 24101, seq 41, length 64
00:00:00.022755 IP 10.0.1.1 > 10.0.2.2: ICMP echo request, id 24101, seq 42, length 64
00:00:00.024503 IP 10.0.1.1 > 10.0.2.2: ICMP echo request, id 24101, seq 43, length 64
00:00:00.026264 IP 10.0.1.1 > 10.0.2.2: ICMP echo request, id 24101, seq 44, length 64
00:00:00.028355 IP 10.0.1.1 > 10.0.2.2: ICMP echo request, id 24101, seq 45, length 64
00:00:00.030136 IP 10.0.1.1 > 10.0.2.2: ICMP echo request, id 24101, seq 46, length 64
00:00:00.031910 IP 10.0.1.1 > 10.0.2.2: ICMP echo request, id 24101, seq 47, length 64
00:00:00.033717 IP 10.0.1.1 > 10.0.2.2: ICMP echo request, id 24101, seq 48, length 64
00:00:00.035487 IP 10.0.1.1 > 10.0.2.2: ICMP echo request, id 24101, seq 49, length 64
00:00:00.037230 IP 10.0.1.1 > 10.0.2.2: ICMP echo request, id 24101, seq 50, length 64
00:00:00.039089 IP 10.0.1.1 > 10.0.2.2: ICMP echo request, id 24101, seq 51, length 64
00:00:00.040852 IP 10.0.1.1 > 10.0.2.2: ICMP echo request, id 24101, seq 52, length 64
00:00:00.042638 IP 10.0.1.1 > 10.0.2.2: ICMP echo request, id 24101, seq 53, length 64
00:00:00.044513 IP 10.0.1.1 > 10.0.2.2: ICMP echo request, id 24101, seq 54, length 64
00:00:00.046230 IP 10.0.1.1 > 10.0.2.2: ICMP echo request, id 24101, seq 55, length 64
00:00:00.047979 IP 10.0.1.1 > 10.0.2.2: ICMP echo request, id 24101, seq 56, length 64
00:00:00.049661 IP 10.0.1.1 > 10.0.2.2: ICMP echo request, id 24101, seq 57, length 64
00:00:00.051309 IP 10.0.1.1 > 10.0.2.2: ICMP echo request, id 24101, seq 58, length 64
00:00:00.053046 IP 10.0.1.1 > 10.0.2.2: ICMP echo request, id 24101, seq 59, length 64
00:00:00.054756 IP 10.0.1.1 > 10.0.2.2: ICMP echo request, id 24101, seq 60, length 64
00:00:00.056407 IP 10.0.1.1 > 10.0.2.2: ICMP echo request, id 24101, seq 61, length 64
00:00:00.058013 IP 10.0.1.1 > 10.0.2.2: ICMP echo request, id 24101, seq 62, length 64
00:00:00.059781 IP 10.0.1.1 > 10.0.2.2: ICMP echo request, id 24101, seq 63, length 64
00:00:00.061315 IP 10.0.1.1 > 10.0.2.2: ICMP echo request, id 24101, seq 64, length 64
00:00:00.062980 IP 10.0.1.1 > 10.0.2.2: ICMP echo request, id 24101, seq 65, length 64
00:00:00.064625 IP 10.0.1.1 > 10.0.2.2: ICMP echo request, id 24101, seq 66, length 64
00:00:00.066218 IP 10.0.1.1 > 10.0.2.2: ICMP echo request, id 24101, seq 67, length 64
00:00:00.067822 IP 10.0.1.1 > 10.0.2.2: ICMP echo request, id 24101, seq 68, length 64
00:00:00.069382 IP 10.0.1.1 > 10.0.2.2: ICMP echo request, id 24101, seq 69, length 64
00:00:00.071031 IP 10.0.1.1 > 10.0.2.2: ICMP echo request, id 24101, seq 70, length 64
00:00:00.072571 IP 10.0.1.1 > 10.0.2.2: ICMP echo request, id 24101, seq 71, length 64
00:00:00.074159 IP 10.0.1.1 > 10.0.2.2: ICMP echo request, id 24101, seq 72, length 64
00:00:00.075892 IP 10.0.1.1 > 10.0.2.2: ICMP echo request, id 24101, seq 73, length 64
00:00:00.077552 IP 10.0.1.1 > 10.0.2.2: ICMP echo request, id 24101, seq 74, length 64
00:00:00.079319 IP 10.0.1.1 > 10.0.2.2: ICMP echo request, id 24101, seq 75, length 64
00:00:00.080947 IP 10.0.1.1 > 10.0.2.2: ICMP echo request, id 24101, seq 76, length 64
00:00:00.082580 IP 10.0.1.1 > 10.0.2.2: ICMP echo request, id 24101, seq 77, length 64
00:00:00.084099 IP 10.0.1.1 > 10.0.2.2: ICMP echo request, id 24101, seq 78, length 64
00:00:00.085740 IP 10.0.1.1 > 10.0.2.2: ICMP echo request, id 24101, seq 79, length 64
00:00:00.087424 IP 10.0.1.1 > 10.0.2.2: ICMP echo request, id 24101, seq 80, length 64
00:00:00.089008 IP 10.0.1.1 > 10.0.2.2: ICMP echo request, id 24101, seq 81, length 64
00:00:00.090614 IP 10.0.1.1 > 10.0.2.2: ICMP echo request, id 24101, seq 82, length 64
00:00:00.092535 IP 10.0.1.1 > 10.0.2.2: ICMP echo request, id 24101, seq 83, length 64
00:00:00.094185 IP 10.0.1.1 > 10.0.2.2: ICMP echo request, id 24101, seq 84, length 64
00:00:00.095880 IP 10.0.1.1 > 10.0.2.2: ICMP echo request, id 24101, seq 85, length 64
00:00:00.097325 IP 10.0.1.1 > 10.0.2.2: ICMP echo request, id 24101, seq 86, length 64
00:00:00.098790 IP 10.0.1.1 > 10.0.2.2: ICMP echo request, id 24101, seq 87, length 64
00:00:00.100585 IP 10.0.1.1 > 10.0.2.2: ICMP echo request, id 24101, seq 88, length 64
00:00:00.102227 IP 10.0.1.1 > 10.0.2.2: ICMP echo request, id 24101, seq 89, length 64
00:00:00.103890 IP 10.0.1.1 > 10.0.2.2: ICMP echo request, id 24101, seq 90, length 64
00:00:00.106078 IP 10.0.1.1 > 10.0.2.2: ICMP echo request, id 24101, seq 91, length 64
00:00:00.108366 IP 10.0.1.1 > 10.0.2.2: ICMP echo request, id 24101, seq 92, length 64
00:00:00.110322 IP 10.0.1.1 > 10.0.2.2: ICMP echo request, id 24101, seq 93, length 64
00:00:00.112340 IP 10.0.1.1 > 10.0.2.2: ICMP echo request, id 24101, seq 94, length 64
00:00:00.114314 IP 10.0.1.1 > 10.0.2.2: ICMP echo request, id 24101, seq 95, length 64
00:00:00.116078 IP 10.0.1.1 > 10.0.2.2: ICMP echo request, id 24101, seq 96, length 64
00:00:00.117870 IP 10.0.1.1 > 10.0.2.2: ICMP echo request, id 24101, seq 97, length 64
00:00:00.119758 IP 10.0.1.1 > 10.0.2.2: ICMP echo request, id 24101, seq 98, length 64
00:00:00.121573 IP 10.0.1.1 > 10.0.2.2: ICMP echo request, id 24101, seq 99, length 64
00:00:00.123466 IP 10.0.1.1 > 10.0.2.2: ICMP echo request, id 24101, seq 100, length 64
00:00:00.125229 IP 10.0.1.1 > 10.0.2.2: ICMP echo request, id 24101, seq 101, length 64
00:00:00.126903 IP 10.0.1.1 > 10.0.2.2: ICMP echo request, id 24101, seq 102, length 64
00:00:00.128619 IP 10.0.1.1 > 10.0.2.2: ICMP echo request, id 24101, seq 103, length 64
00:00:00.130378 IP 10.0.1.1 > 10.0.2.2: ICMP echo request, id 24101, seq 104, length 64
00:00:00.132108 IP 10.0.1.1 > 10.0.2.2: ICMP echo request, id 24101, seq 105, length 64
00:00:00.133805 IP 10.0.1.1 > 10.0.2.2: ICMP echo request, id 24101, seq 106, length 64
00:00:00.135499 IP 10.0.1.1 > 10.0.2.2: ICMP echo request, id 24101, seq 107, length 64
00:00:00.137205 IP 10.0.1.1 > 10.0.2.2: ICMP echo request, id 24101, seq 108, length 64
00:00:00.138993 IP 10.0.1.1 > 10.0.2.2: ICMP echo request, id 24101, seq 109, length 64
00:00:00.140557 IP 10.0.1.1 > 10.0.2.2: ICMP echo request, id 24101, seq 110, length 64
00:00:00.142210 IP 10.0.1.1 > 10.0.2.2: ICMP echo request, id 24101, seq 111, length 64
00:00:00.143892 IP 10.0.1.1 > 10.0.2.2: ICMP echo request, id 24101, seq 112, length 64
00:00:00.145535 IP 10.0.1.1 > 10.0.2.2: ICMP echo request, id 24101, seq 113, length 64
00:00:00.147227 IP 10.0.1.1 > 10.0.2.2: ICMP echo request, id 24101, seq 114, length 64
00:00:00.148833 IP 10.0.1.1 > 10.0.2.2: ICMP echo request, id 24101, seq 115, length 64
00:00:00.150420 IP 10.0.1.1 > 10.0.2.2: ICMP echo request, id 24101, seq 116, length 64
00:00:00.152073 IP 10.0.1.1 > 10.0.2.2: ICMP echo request, id 24101, seq 117, length 64
00:00:00.153658 IP 10.0.1.1 > 10.0.2.2: ICMP echo request, id 24101, seq 118, length 64
00:00:00.155309 IP 10.0.1.1 > 10.0.2.2: ICMP echo request, id 24101, seq 119, length 64
00:00:00.156866 IP 10.0.1.1 > 10.0.2.2: ICMP echo request, id 24101, seq 120, length 64
00:00:00.158491 IP 10.0.1.1 > 10.0.2.2: ICMP echo request, id 24101, seq 121, length 64
00:00:00.160144 IP 10.0.1.1 > 10.0.2.2: ICMP echo request, id 24101, seq 122, length 64
00:00:00.161695 IP 10.0.1.1 > 10.0.2.2: ICMP echo request, id 24101, seq 123, length 64
00:00:00.163365 IP 10.0.1.1 > 10.0.2.2: ICMP echo request, id 24101, seq 124, length 64
00:00:00.164890 IP 10.0.1.1 > 10.0.2.2: ICMP echo request, id 24101, seq 125, length 64
00:00:00.166427 IP 10.0.1.1 > 10.0.2.2: ICMP echo request, id 24101, seq 126, length 64
00:00:00.168002 IP 10.0.1.1 > 10.0.2.2: ICMP echo request, id 24101, seq 127, length 64
00:00:00.169569 IP 10.0.1.1 > 10.0.2.2: ICMP echo request, id 24101, seq 128, length 64
00:00:00.171269 IP 10.0.1.1 > 10.0.2.2: ICMP echo request, id 24101, seq 129, length 64
00:00:00.172833 IP 10.0.1.1 > 10.0.2.2: ICMP echo request, id 24101, seq 130, length 64
00:00:00.174360 IP 10.0.1.1 > 10.0.2.2: ICMP echo request, id 24101, seq 131, length 64
00:00:00.175984 IP 10.0.1.1 > 10.0.2.2: ICMP echo request, id 24101, seq 132, length 64
00:00:00.177537 IP 10.0.1.1 > 10.0.2.2: ICMP echo request, id 24101, seq 133, length 64
00:00:00.179102 IP 10.0.1.1 > 10.0.2.2: ICMP echo request, id 24101, seq 134, length 64
00:00:00.180609 IP 10.0.1.1 > 10.0.2.2: ICMP echo request, id 24101, seq 135, length 64
00:00:00.182111 IP 10.0.1.1 > 10.0.2.2: ICMP echo request, id 24101, seq 136, length 64
00:00:00.183636 IP 10.0.1.1 > 10.0.2.2: ICMP echo request, id 24101, seq 137, length 64
00:00:00.185216 IP 10.0.1.1 > 10.0.2.2: ICMP echo request, id 24101, seq 138, length 64
00:00:00.186694 IP 10.0.1.1 > 10.0.2.2: ICMP echo request, id 24101, seq 139, length 64
00:00:00.188103 IP 10.0.1.1 > 10.0.2.2: ICMP echo request, id 24101, seq 140, length 64
00:00:00.189521 IP 10.0.1.1 > 10.0.2.2: ICMP echo request, id 24101, seq 141, length 64
00:00:00.190976 IP 10.0.1.1 > 10.0.2.2: ICMP echo request, id 24101, seq 142, length 64
00:00:00.192398 IP 10.0.1.1 > 10.0.2.2: ICMP echo request, id 24101, seq 143, length 64
00:00:00.193861 IP 10.0.1.1 > 10.0.2.2: ICMP echo request, id 24101, seq 144, length 64
00:00:00.195394 IP 10.0.1.1 > 10.0.2.2: ICMP echo request, id 24101, seq 145, length 64
00:00:00.196865 IP 10.0.1.1 > 10.0.2.2: ICMP echo request, id 24101, seq 146, length 64
00:00:00.198289 IP 10.0.1.1 > 10.0.2.2: ICMP echo request, id 24101, seq 147, length 64
00:00:00.199679 IP 10.0.1.1 > 10.0.2.2: ICMP echo request, id 24101, seq 148, length 64
00:00:00.201105 IP 10.0.1.1 > 10.0.2.2: ICMP echo request, id 24101, seq 149, length 64
00:00:00.202543 IP 10.0.1.1 > 10.0.2.2: ICMP echo request, id 24101, seq 150, length 64
00:00:00.204204 IP 10.0.1.1 > 10.0.2.2: ICMP echo request, id 24101, seq 151, length 64
00:00:00.205662 IP 10.0.1.1 > 10.0.2.2: ICMP echo request, id 24101, seq 152, length 64
00:00:00.207094 IP 10.0.1.1 > 10.0.2.2: ICMP echo request, id 24101, seq 153, length 64
00:00:00.208525 IP 10.0.1.1 > 10.0.2.2: ICMP echo request, id 24101, seq 154, length 64
00:00:00.209909 IP 10.0.1.1 > 10.0.2.2: ICMP echo request, id 24101, seq 155, length 64
00:00:00.211610 IP 10.0.1.1 > 10.0.2.2: ICMP echo request, id 24101, seq 156, length 64
00:00:00.213326 IP 10.0.1.1 > 10.0.2.2: ICMP echo request, id 24101, seq 157, length 64
00:00:00.215110 IP 10.0.1.1 > 10.0.2.2: ICMP echo request, id 24101, seq 158, length 64
00:00:00.216837 IP 10.0.1.1 > 10.0.2.2: ICMP echo request, id 24101, seq 159, length 64
00:00:00.218494 IP 10.0.1.1 > 10.0.2.2: ICMP echo request, id 24101, seq 160, length 64
00:00:00.220130 IP 10.0.1.1 > 10.0.2.2: ICMP echo request, id 24101, seq 161, length 64
00:00:00.221361 IP 10.0.1.1 > 10.0.2.2: ICMP echo request, id 24101, seq 162, length 64
00:00:00.222767 IP 10.0.1.1 > 10.0.2.2: ICMP echo request, id 24101, seq 163, length 64
00:00:00.223978 IP 10.0.1.1 > 10.0.2.2: ICMP echo request, id 24101, seq 164, length 64
00:00:00.225190 IP 10.0.1.1 > 10.0.2.2: ICMP echo request, id 24101, seq 165, length 64
00:00:00.226411 IP 10.0.1.1 > 10.0.2.2: ICMP echo request, id 24101, seq 166, length 64
00:00:00.227963 IP 10.0.1.1 > 10.0.2.2: ICMP echo request, id 24101, seq 167, length 64
00:00:00.229179 IP 10.0.1.1 > 10.0.2.2: ICMP echo request, id 24101, seq 168, length 64
00:00:00.230424 IP 10.0.1.1 > 10.0.2.2: ICMP echo request, id 24101, seq 169, length 64
00:00:00.231708 IP 10.0.1.1 > 10.0.2.2: ICMP echo request, id 24101, seq 170, length 64
00:00:00.233058 IP 10.0.1.1 > 10.0.2.2: ICMP echo request, id 24101, seq 171, length 64
00:00:00.234292 IP 10.0.1.1 > 10.0.2.2: ICMP echo request, id 24101, seq 172, length 64
00:00:00.235562 IP 10.0.1.1 > 10.0.2.2: ICMP echo request, id 24101, seq 173, length 64
00:00:00.236769 IP 10.0.1.1 > 10.0.2.2: ICMP echo request, id 24101, seq 174, length 64
00:00:00.237981 IP 10.0.1.1 > 10.0.2.2: ICMP echo request, id 24101, seq 175, length 64
00:00:00.239225 IP 10.0.1.1 > 10.0.2.2: ICMP echo request, id 24101, seq 176, length 64
00:00:00.240378 IP 10.0.1.1 > 10.0.2.2: ICMP echo request, id 24101, seq 177, length 64
00:00:00.241544 IP 10.0.1.1 > 10.0.2.2: ICMP echo request, id 24101, seq 178, length 64
00:00:00.242823 IP 10.0.1.1 > 10.0.2.2: ICMP echo request, id 24101, seq 179, length 64
00:00:00.243976 IP 10.0.1.1 > 10.0.2.2: ICMP echo request, id 24101, seq 180, length 64
00:00:00.245152 IP 10.0.1.1 > 10.0.2.2: ICMP echo request, id 24101, seq 181, length 64
00:00:00.246326 IP 10.0.1.1 > 10.0.2.2: ICMP echo request, id 24101, seq 182, length 64
00:00:00.247548 IP 10.0.1.1 > 10.0.2.2: ICMP echo request, id 24101, seq 183, length 64
00:00:00.248739 IP 10.0.1.1 > 10.0.2.2: ICMP echo request, id 24101, seq 184, length 64
00:00:00.249901 IP 10.0.1.1 > 10.0.2.2: ICMP echo request, id 24101, seq 185, length 64
00:00:00.251139 IP 10.0.1.1 > 10.0.2.2: ICMP echo request, id 24101, seq 186, length 64
00:00:00.252402 IP 10.0.1.1 > 10.0.2.2: ICMP echo request, id 24101, seq 187, length 64
00:00:00.253533 IP 10.0.1.1 > 10.0.2.2: ICMP echo request, id 24101, seq 188, length 64
00:00:00.254742 IP 10.0.1.1 > 10.0.2.2: ICMP echo request, id 24101, seq 189, length 64
00:00:00.255883 IP 10.0.1.1 > 10.0.2.2: ICMP echo request, id 24101, seq 190, length 64
00:00:00.256997 IP 10.0.1.1 > 10.0.2.2: ICMP echo request, id 24101, seq 191, length 64
00:00:00.258132 IP 10.0.1.1 > 10.0.2.2: ICMP echo request, id 24101, seq 192, length 64
00:00:00.259316 IP 10.0.1.1 > 10.0.2.2: ICMP echo request, id 24101, seq 193, length 64
00:00:00.260439 IP 10.0.1.1 > 10.0.2.2: ICMP echo request, id 24101, seq 194, length 64
00:00:00.261627 IP 10.0.1.1 > 10.0.2.2: ICMP echo request, id 24101, seq 195, length 64
00:00:00.262794 IP 10.0.1.1 > 10.0.2.2: ICMP echo request, id 24101, seq 196, length 64
00:00:00.263965 IP 10.0.1.1 > 10.0.2.2: ICMP echo request, id 24101, seq 197, length 64
00:00:00.265081 IP 10.0.1.1 > 10.0.2.2: ICMP echo request, id 24101, seq 198, length 64
00:00:00.266205 IP 10.0.1.1 > 10.0.2.2: ICMP echo request, id 24101, seq 199, length 64
00:00:00.267357 IP 10.0.1.1 > 10.0.2.2: ICMP echo request, id 24101, seq 200, length 64
00:00:00.268469 IP 10.0.1.1 > 10.0.2.2: ICMP echo request, id 24101, seq 201, length 64
00:00:00.269573 IP 10.0.1.1 > 10.0.2.2: ICMP echo request, id 24101, seq 202, length 64
00:00:00.270735 IP 10.0.1.1 > 10.0.2.2: ICMP echo request, id 24101, seq 203, length 64
00:00:00.272010 IP 10.0.1.1 > 10.0.2.2: ICMP echo request, id 24101, seq 204, length 64
00:00:00.273115 IP 10.0.1.1 > 10.0.2.2: ICMP echo request, id 24101, seq 205, length 64
00:00:00.274234 IP 10.0.1.1 > 10.0.2.2: ICMP echo request, id 24101, seq 206, length 64
00:00:00.275612 IP 10.0.1.1 > 10.0.2.2: ICMP echo request, id 24101, seq 207, length 64
00:00:00.276984 IP 10.0.1.1 > 10.0.2.2: ICMP echo request, id 24101, seq 208, length 64
00:00:00.278102 IP 10.0.1.1 > 10.0.2.2: ICMP echo request, id 24101, seq 209, length 64
00:00:00.279266 IP 10.0.1.1 > 10.0.2.2: ICMP echo request, id 24101, seq 210, length 64
00:00:00.280384 IP 10.0.1.1 > 10.0.2.2: ICMP echo request, id 24101, seq 211, length 64
00:00:00.281526 IP 10.0.1.1 > 10.0.2.2: ICMP echo request, id 24101, seq 212, length 64
00:00:00.282679 IP 10.0.1.1 > 10.0.2.2: ICMP echo request, id 24101, seq 213, length 64
00:00:00.283790 IP 10.0.1.1 > 10.0.2.2: ICMP echo request, id 24101, seq 214, length 64
00:00:00.284934 IP 10.0.1.1 > 10.0.2.2: ICMP echo request, id 24101, seq 215, length 64
00:00:00.286039 IP 10.0.1.1 > 10.0.2.2: ICMP echo request, id 24101, seq 216, length 64
00:00:00.287156 IP 10.0.1.1 > 10.0.2.2: ICMP echo request, id 24101, seq 217, length 64
00:00:00.288286 IP 10.0.1.1 > 10.0.2.2: ICMP echo request, id 24101, seq 218, length 64
00:00:00.289410 IP 10.0.1.1 > 10.0.2.2: ICMP echo request, id 24101, seq 219, length 64
00:00:00.290531 IP 10.0.1.1 > 10.0.2.2: ICMP echo request, id 24101, seq 220, length 64
00:00:00.292047 IP 10.0.1.1 > 10.0.2.2: ICMP echo request, id 24101, seq 221, length 64
00:00:00.293201 IP 10.0.1.1 > 10.0.2.2: ICMP echo request, id 24101, seq 222, length 64
00:00:00.294331 IP 10.0.1.1 > 10.0.2.2: ICMP echo request, id 24101, seq 223, length 64
00:00:00.295415 IP 10.0.1.1 > 10.0.2.2: ICMP echo request, id 24101, seq 224, length 64
00:00:00.296591 IP 10.0.1.1 > 10.0.2.2: ICMP echo request, id 24101, seq 225, length 64
00:00:00.297701 IP 10.0.1.1 > 10.0.2.2: ICMP echo request, id 24101, seq 226, length 64
00:00:00.298816 IP 10.0.1.1 > 10.0.2.2: ICMP echo request, id 24101, seq 227, length 64
00:00:00.299899 IP 10.0.1.1 > 10.0.2.2: ICMP echo request, id 24101, seq 228, length 64
00:00:00.301114 IP 10.0.1.1 > 10.0.2.2: ICMP echo request, id 24101, seq 229, length 64
00:00:00.302231 IP 10.0.1.1 > 10.0.2.2: ICMP echo request, id 24101, seq 230, length 64
00:00:00.303428 IP 10.0.1.1 > 10.0.2.2: ICMP echo request, id 24101, seq 231, length 64
00:00:00.304539 IP 10.0.1.1 > 10.0.2.2: ICMP echo request, id 24101, seq 232, length 64
00:00:00.305621 IP 10.0.1.1 > 10.0.2.2: ICMP echo request, id 24101, seq 233, length 64
00:00:00.306730 IP 10.0.1.1 > 10.0.2.2: ICMP echo request, id 24101, seq 234, length 64
00:00:00.307905 IP 10.0.1.1 > 10.0.2.2: ICMP echo request, id 24101, seq 235, length 64
00:00:00.309017 IP 10.0.1.1 > 10.0.2.2: ICMP echo request, id 24101, seq 236, length 64
00:00:00.310138 IP 10.0.1.1 > 10.0.2.2: ICMP echo request, id 24101, seq 237, length 64
00:00:00.311361 IP 10.0.1.1 > 10.0.2.2: ICMP echo request, id 24101, seq 238, length 64
00:00:00.312447 IP 10.0.1.1 > 10.0.2.2: ICMP echo request, id 24101, seq 239, length 64
00:00:00.313540 IP 10.0.1.1 > 10.0.2.2: ICMP echo request, id 24101, seq 240, length 64
00:00:00.314662 IP 10.0.1.1 > 10.0.2.2: ICMP echo request, id 24101, seq 241, length 64
00:00:00.315795 IP 10.0.1.1 > 10.0.2.2: ICMP echo request, id 24101, seq 242, length 64
00:00:00.316899 IP 10.0.1.1 > 10.0.2.2: ICMP echo request, id 24101, seq 243, length 64
00:00:00.318026 IP 10.0.1.1 > 10.0.2.2: ICMP echo request, id 24101, seq 244, length 64
00:00:00.319122 IP 10.0.1.1 > 10.0.2.2: ICMP echo request, id 24101, seq 245, length 64
00:00:00.320204 IP 10.0.1.1 > 10.0.2.2: ICMP echo request, id 24101, seq 246, length 64
00:00:00.321462 IP 10.0.1.1 > 10.0.2.2: ICMP echo request, id 24101, seq 247, length 64
00:00:00.322589 IP 10.0.1.1 > 10.0.2.2: ICMP echo request, id 24101, seq 248, length 64
00:00:00.323685 IP 10.0.1.1 > 10.0.2.2: ICMP echo request, id 24101, seq 249, length 64
00:00:00.324790 IP 10.0.1.1 > 10.0.2.2: ICMP echo request, id 24101, seq 250, length 64
00:00:00.326013 IP 10.0.1.1 > 10.0.2.2: ICMP echo request, id 24101, seq 251, length 64
00:00:00.327167 IP 10.0.1.1 > 10.0.2.2: ICMP echo request, id 24101, seq 252, length 64
00:00:00.328372 IP 10.0.1.1 > 10.0.2.2: ICMP echo request, id 24101, seq 253, length 64
00:00:00.329489 IP 10.0.1.1 > 10.0.2.2: ICMP echo request, id 24101, seq 254, length 64
00:00:00.330788 IP 10.0.1.1 > 10.0.2.2: ICMP echo request, id 24101, seq 255, length 64
00:00:00.331890 IP 10.0.1.1 > 10.0.2.2: ICMP echo request, id 24101, seq 256, length 64
00:00:00.333065 IP 10.0.1.1 > 10.0.2.2: ICMP echo request, id 24101, seq 257, length 64
00:00:00.334179 IP 10.0.1.1 > 10.0.2.2: ICMP echo request, id 24101, seq 258, length 64
00:00:00.335286 IP 10.0.1.1 > 10.0.2.2: ICMP echo request, id 24101, seq 259, length 64
00:00:00.336424 IP 10.0.1.1 > 10.0.2.2: ICMP echo request, id 24101, seq 260, length 64
00:00:00.337515 IP 10.0.1.1 > 10.0.2.2: ICMP echo request, id 24101, seq 261, length 64
00:00:00.338631 IP 10.0.1.1 > 10.0.2.2: ICMP echo request, id 24101, seq 262, length 64
00:00:00.339775 IP 10.0.1.1 > 10.0.2.2: ICMP echo request, id 24101, seq 263, length 64
00:00:00.340932 IP 10.0.1.1 > 10.0.2.2: ICMP echo request, id 24101, seq 264, length 64
00:00:00.342051 IP 10.0.1.1 > 10.0.2.2: ICMP echo request, id 24101, seq 265, length 64
00:00:00.343160 IP 10.0.1.1 > 10.0.2.2: ICMP echo request, id 24101, seq 266, length 64
00:00:00.344276 IP 10.0.1.1 > 10.0.2.2: ICMP echo request, id 24101, seq 267, length 64
00:00:00.345375 IP 10.0.1.1 > 10.0.2.2: ICMP echo request, id 24101, seq 268, length 64
00:00:00.346551 IP 10.0.1.1 > 10.0.2.2: ICMP echo request, id 24101, seq 269, length 64
00:00:00.347714 IP 10.0.1.1 > 10.0.2.2: ICMP echo request, id 24101, seq 270, length 64
00:00:00.349108 IP 10.0.1.1 > 10.0.2.2: ICMP echo request, id 24101, seq 271, length 64
00:00:00.350415 IP 10.0.1.1 > 10.0.2.2: ICMP echo request, id 24101, seq 272, length 64
00:00:00.351595 IP 10.0.1.1 > 10.0.2.2: ICMP echo request, id 24101, seq 273, length 64
00:00:00.352769 IP 10.0.1.1 > 10.0.2.2: ICMP echo request, id 24101, seq 274, length 64
00:00:00.353883 IP 10.0.1.1 > 10.0.2.2: ICMP echo request, id 24101, seq 275, length 64
00:00:00.354996 IP 10.0.1.1 > 10.0.2.2: ICMP echo request, id 24101, seq 276, length 64
00:00:00.356166 IP 10.0.1.1 > 10.0.2.2: ICMP echo request, id 24101, seq 277, length 64
00:00:00.357296 IP 10.0.1.1 > 10.0.2.2: ICMP echo request, id 24101, seq 278, length 64
00:00:00.358419 IP 10.0.1.1 > 10.0.2.2: ICMP echo request, id 24101, seq 279, length 64
00:00:00.359658 IP 10.0.1.1 > 10.0.2.2: ICMP echo request, id 24101, seq 280, length 64
00:00:00.360744 IP 10.0.1.1 > 10.0.2.2: ICMP echo request, id 24101, seq 281, length 64
00:00:00.361841 IP 10.0.1.1 > 10.0.2.2: ICMP echo request, id 24101, seq 282, length 64
00:00:00.363051 IP 10.0.1.1 > 10.0.2.2: ICMP echo request, id 24101, seq 283, length 64
00:00:00.364135 IP 10.0.1.1 > 10.0.2.2: ICMP echo request, id 24101, seq 284, length 64
00:00:00.365230 IP 10.0.1.1 > 10.0.2.2: ICMP echo request, id 24101, seq 285, length 64
00:00:00.366354 IP 10.0.1.1 > 10.0.2.2: ICMP echo request, id 24101, seq 286, length 64
00:00:00.367439 IP 10.0.1.1 > 10.0.2.2: ICMP echo request, id 24101, seq 287, length 64
00:00:00.368566 IP 10.0.1.1 > 10.0.2.2: ICMP echo request, id 24101, seq 288, length 64
00:00:00.369802 IP 10.0.1.1 > 10.0.2.2: ICMP echo request, id 24101, seq 289, length 64
00:00:00.370923 IP 10.0.1.1 > 10.0.2.2: ICMP echo request, id 24101, seq 290, length 64
00:00:00.372329 IP 10.0.1.1 > 10.0.2.2: ICMP echo request, id 24101, seq 291, length 64
00:00:00.373431 IP 10.0.1.1 > 10.0.2.2: ICMP echo request, id 24101, seq 292, length 64
00:00:00.374533 IP 10.0.1.1 > 10.0.2.2: ICMP echo request, id 24101, seq 293, length 64
00:00:00.375597 IP 10.0.1.1 > 10.0.2.2: ICMP echo request, id 24101, seq 294, length 64
00:00:00.376762 IP 10.0.1.1 > 10.0.2.2: ICMP echo request, id 24101, seq 295, length 64
00:00:00.377870 IP 10.0.1.1 > 10.0.2.2: ICMP echo request, id 24101, seq 296, length 64
00:00:00.379056 IP 10.0.1.1 > 10.0.2.2: ICMP echo request, id 24101, seq 297, length 64
00:00:00.380226 IP 10.0.1.1 > 10.0.2.2: ICMP echo request, id 24101, seq 298, length 64
00:00:00.381324 IP 10.0.1.1 > 10.0.2.2: ICMP echo request, id 24101, seq 299, length 64
00:00:00.382434 IP 10.0.1.1 > 10.0.2.2: ICMP echo request, id 24101, seq 300, length 64
00:00:00.383581 IP 10.0.1.1 > 10.0.2.2: ICMP echo request, id 24101, seq 301, length 64
00:00:00.384674 IP 10.0.1.1 > 10.0.2.2: ICMP echo request, id 24101, seq 302, length 64
00:00:00.385835 IP 10.0.1.1 > 10.0.2.2: ICMP echo request, id 24101, seq 303, length 64
00:00:00.387382 IP 10.0.1.1 > 10.0.2.2: ICMP echo request, id 24101, seq 304, length 64
00:00:00.388608 IP 10.0.1.1 > 10.0.2.2: ICMP echo request, id 24101, seq 305, length 64
00:00:00.389745 IP 10.0.1.1 > 10.0.2.2: ICMP echo request, id 24101, seq 306, length 64
00:00:00.390900 IP 10.0.1.1 > 10.0.2.2: ICMP echo request, id 24101, seq 307, length 64
00:00:00.392042 IP 10.0.1.1 > 10.0.2.2: ICMP echo request, id 24101, seq 308, length 64
00:00:00.393169 IP 10.0.1.1 > 10.0.2.2: ICMP echo request, id 24101, seq 309, length 64
00:00:00.394316 IP 10.0.1.1 > 10.0.2.2: ICMP echo request, id 24101, seq 310, length 64
00:00:00.395478 IP 10.0.1.1 > 10.0.2.2: ICMP echo request, id 24101, seq 311, length 64
00:00:00.396558 IP 10.0.1.1 > 10.0.2.2: ICMP echo request, id 24101, seq 312, length 64
00:00:00.397657 IP 10.0.1.1 > 10.0.2.2: ICMP echo request, id 24101, seq 313, length 64
00:00:00.398891 IP 10.0.1.1 > 10.0.2.2: ICMP echo request, id 24101, seq 314, length 64
