  1 0.000000000 172.31.31.144 -> 172.31.24.227 TCP 90 6633 → 50108 [PSH, ACK] Seq=1 Ack=1 Win=853 Len=24 TSval=425930 TSecr=393490802
  2 0.000026710 172.31.31.144 -> 172.31.24.227 TCP 82 6633 → 50108 [PSH, ACK] Seq=25 Ack=1 Win=853 Len=16 TSval=425930 TSecr=393490802
  3 0.000031072 172.31.31.144 -> 172.31.24.227 TCP 90 6633 → 50108 [PSH, ACK] Seq=41 Ack=1 Win=853 Len=24 TSval=425930 TSecr=393490802
  4 0.000114528 172.31.24.227 -> 172.31.31.144 OpenFlow 82 Type: OFPT_MULTIPART_REPLY, OFPMP_GROUP
  5 0.000138648 172.31.24.227 -> 172.31.31.144 OpenFlow 82 Type: OFPT_MULTIPART_REPLY, OFPMP_GROUP_DESC
  6 0.000172055 172.31.24.227 -> 172.31.31.144 OpenFlow 82 Type: OFPT_MULTIPART_REPLY, OFPMP_METER
  7 0.000378146 172.31.31.144 -> 172.31.24.227 TCP 66 6633 → 50108 [ACK] Seq=65 Ack=17 Win=853 Len=0 TSval=425930 TSecr=393491202
  8 0.000387080 172.31.31.144 -> 172.31.24.227 TCP 66 6633 → 50108 [ACK] Seq=65 Ack=33 Win=853 Len=0 TSval=425930 TSecr=393491202
  9 0.000389692 172.31.31.144 -> 172.31.24.227 TCP 66 6633 → 50108 [ACK] Seq=65 Ack=49 Win=853 Len=0 TSval=425930 TSecr=393491202
 10 0.032154403 137.158.125.247 -> 172.31.24.227 TCP 66 63468 → 22 [ACK] Seq=1 Ack=1 Win=32462 Len=0 SLE=261 SRE=297
 11 0.032167353 137.158.125.247 -> 172.31.24.227 TCP 54 63468 → 22 [ACK] Seq=1 Ack=297 Win=32314 Len=0
 12 0.064919567 137.158.125.247 -> 172.31.24.227 TCP 54 63468 → 22 [ACK] Seq=1 Ack=357 Win=32284 Len=0
 13 0.100241706 172.31.31.144 -> 172.31.24.227 TCP 90 6633 → 50106 [PSH, ACK] Seq=1 Ack=1 Win=853 Len=24 TSval=425955 TSecr=393490883
 14 0.100255662 172.31.31.144 -> 172.31.24.227 TCP 106 6633 → 50106 [PSH, ACK] Seq=25 Ack=1 Win=853 Len=40 TSval=425955 TSecr=393490883
 15 0.100259006 172.31.31.144 -> 172.31.24.227 TCP 90 6633 → 50112 [PSH, ACK] Seq=1 Ack=1 Win=853 Len=24 TSval=425955 TSecr=393490802
 16 0.100264315 172.31.31.144 -> 172.31.24.227 TCP 106 6633 → 50112 [PSH, ACK] Seq=25 Ack=1 Win=853 Len=40 TSval=425955 TSecr=393490802
 17 0.100266584 172.31.31.144 -> 172.31.24.227 TCP 90 6633 → 50110 [PSH, ACK] Seq=1 Ack=1 Win=853 Len=24 TSval=425955 TSecr=393490883
 18 0.100269692 172.31.31.144 -> 172.31.24.227 TCP 106 6633 → 50110 [PSH, ACK] Seq=25 Ack=1 Win=853 Len=40 TSval=425955 TSecr=393490883
 19 0.100368954 172.31.24.227 -> 172.31.31.144 OpenFlow 82 Type: OFPT_MULTIPART_REPLY, OFPMP_GROUP
 20 0.100393119 172.31.24.227 -> 172.31.31.144 OpenFlow 82 Type: OFPT_MULTIPART_REPLY, OFPMP_GROUP_DESC
 21 0.100428986 172.31.24.227 -> 172.31.31.144 OpenFlow 82 Type: OFPT_MULTIPART_REPLY, OFPMP_METER
 22 0.100440552 172.31.24.227 -> 172.31.31.144 OpenFlow 82 Type: OFPT_MULTIPART_REPLY, OFPMP_GROUP
 23 0.100465189 172.31.24.227 -> 172.31.31.144 OpenFlow 82 Type: OFPT_MULTIPART_REPLY, OFPMP_GROUP
 24 0.100515965 172.31.24.227 -> 172.31.31.144 OpenFlow 98 Type: OFPT_MULTIPART_REPLY, OFPMP_METER
 25 0.100522799 172.31.24.227 -> 172.31.31.144 OpenFlow 98 Type: OFPT_MULTIPART_REPLY, OFPMP_METER
 26 0.100655597 172.31.31.144 -> 172.31.24.227 TCP 66 6633 → 50106 [ACK] Seq=65 Ack=33 Win=853 Len=0 TSval=425955 TSecr=393491227
 27 0.100705478 172.31.31.144 -> 172.31.24.227 TCP 66 6633 → 50112 [ACK] Seq=65 Ack=17 Win=853 Len=0 TSval=425955 TSecr=393491227
 28 0.100752986 172.31.31.144 -> 172.31.24.227 TCP 66 6633 → 50112 [ACK] Seq=65 Ack=49 Win=853 Len=0 TSval=425955 TSecr=393491227
 29 0.101075221 172.31.31.144 -> 172.31.24.227 TCP 66 6633 → 50110 [ACK] Seq=65 Ack=49 Win=853 Len=0 TSval=425955 TSecr=393491227
 30 0.138857749 172.31.31.144 -> 172.31.24.227 TCP 66 6633 → 50106 [ACK] Seq=65 Ack=49 Win=853 Len=0 TSval=425965 TSecr=393491227
 31 0.659390324 172.31.24.227 -> 137.158.125.247 SSH 98 Server: Encrypted packet (len=44)
 32 0.715803479 172.31.24.227 -> 172.31.31.144 OpenFlow 146 Type: OFPT_PORT_STATUS
 33 0.715884699 172.31.24.227 -> 172.31.31.144 OpenFlow 146 Type: OFPT_PORT_STATUS
 34 0.716100049 172.31.31.144 -> 172.31.24.227 TCP 66 6633 → 50106 [ACK] Seq=65 Ack=129 Win=853 Len=0 TSval=426109 TSecr=393491381
 35 0.716116398 172.31.31.144 -> 172.31.24.227 TCP 66 6633 → 50112 [ACK] Seq=65 Ack=129 Win=853 Len=0 TSval=426109 TSecr=393491381
 36 0.741324001 172.31.31.144 -> 172.31.24.227 OpenFlow 146 Type: OFPT_FLOW_MOD
 37 0.741337388 172.31.31.144 -> 172.31.24.227 OpenFlow 146 Type: OFPT_FLOW_MOD
 38 0.741340933 172.31.31.144 -> 172.31.24.227 OpenFlow 74 Type: OFPT_BARRIER_REQUEST
 39 0.741343383 172.31.31.144 -> 172.31.24.227 OpenFlow 146 Type: OFPT_FLOW_MOD
 40 0.741346048 172.31.31.144 -> 172.31.24.227 OpenFlow 154 Type: OFPT_BARRIER_REQUEST
 41 0.741348388 172.31.31.144 -> 172.31.24.227 OpenFlow 146 Type: OFPT_FLOW_MOD
 42 0.741350755 172.31.31.144 -> 172.31.24.227 OpenFlow 154 Type: OFPT_BARRIER_REQUEST
 43 0.741429575 172.31.24.227 -> 172.31.31.144 TCP 66 50106 → 6633 [ACK] Seq=129 Ack=233 Win=211 Len=0 TSval=393491387 TSecr=426115
 44 0.741442629 172.31.24.227 -> 172.31.31.144 OpenFlow 74 Type: OFPT_BARRIER_REPLY
 45 0.741483349 172.31.24.227 -> 172.31.31.144 TCP 66 50108 → 6633 [ACK] Seq=49 Ack=233 Win=196 Len=0 TSval=393491387 TSecr=426115
 46 0.741492889 172.31.24.227 -> 172.31.31.144 OpenFlow 74 Type: OFPT_BARRIER_REPLY
 47 0.741523229 172.31.24.227 -> 172.31.31.144 TCP 66 50112 → 6633 [ACK] Seq=129 Ack=233 Win=213 Len=0 TSval=393491387 TSecr=426115
 48 0.741533207 172.31.24.227 -> 172.31.31.144 OpenFlow 74 Type: OFPT_BARRIER_REPLY
 49 0.741621094 172.31.31.144 -> 172.31.24.227 OpenFlow 146 Type: OFPT_FLOW_MOD
 50 0.741627035 172.31.31.144 -> 172.31.24.227 OpenFlow 146 Type: OFPT_FLOW_MOD
 51 0.741629412 172.31.31.144 -> 172.31.24.227 OpenFlow 74 Type: OFPT_BARRIER_REQUEST
 52 0.741652501 172.31.24.227 -> 172.31.31.144 OpenFlow 146 Type: OFPT_FLOW_REMOVED
 53 0.741668992 172.31.24.227 -> 172.31.31.144 OpenFlow 146 Type: OFPT_FLOW_REMOVED
 54 0.741707457 172.31.31.144 -> 172.31.24.227 OpenFlow 146 Type: OFPT_FLOW_MOD
 55 0.741714171 172.31.31.144 -> 172.31.24.227 OpenFlow 154 Type: OFPT_BARRIER_REQUEST
 56 0.741720025 172.31.24.227 -> 172.31.31.144 OpenFlow 226 Type: OFPT_FLOW_REMOVED
 57 0.741726280 172.31.24.227 -> 172.31.31.144 OpenFlow 146 Type: OFPT_FLOW_REMOVED
 58 0.741828633 172.31.31.144 -> 172.31.24.227 TCP 66 6633 → 50108 [ACK] Seq=401 Ack=57 Win=853 Len=0 TSval=426115 TSecr=393491387
 59 0.741837592 172.31.24.227 -> 172.31.31.144 OpenFlow 146 Type: OFPT_FLOW_REMOVED
 60 0.741843366 172.31.31.144 -> 172.31.24.227 OpenFlow 146 Type: OFPT_FLOW_MOD
 61 0.741846961 172.31.31.144 -> 172.31.24.227 OpenFlow 146 Type: OFPT_FLOW_MOD
 62 0.741849047 172.31.31.144 -> 172.31.24.227 OpenFlow 74 Type: OFPT_BARRIER_REQUEST
 63 0.741913074 172.31.31.144 -> 172.31.24.227 OpenFlow 146 Type: OFPT_FLOW_MOD
 64 0.741921698 172.31.31.144 -> 172.31.24.227 OpenFlow 154 Type: OFPT_BARRIER_REQUEST
 65 0.741961072 172.31.31.144 -> 172.31.24.227 TCP 66 6633 → 50108 [ACK] Seq=401 Ack=137 Win=853 Len=0 TSval=426115 TSecr=393491387
 66 0.742036152 172.31.24.227 -> 172.31.31.144 OpenFlow 74 Type: OFPT_BARRIER_REPLY
 67 0.742057744 172.31.31.144 -> 172.31.24.227 OpenFlow 146 Type: OFPT_FLOW_MOD
 68 0.742063090 172.31.31.144 -> 172.31.24.227 OpenFlow 322 Type: OFPT_BARRIER_REQUEST
 69 0.742075012 172.31.24.227 -> 172.31.31.144 OpenFlow 74 Type: OFPT_BARRIER_REPLY
 70 0.742103600 172.31.31.144 -> 172.31.24.227 TCP 66 6633 → 50108 [ACK] Seq=401 Ack=217 Win=853 Len=0 TSval=426115 TSecr=393491387
 71 0.742117928 172.31.24.227 -> 172.31.31.144 OpenFlow 74 Type: OFPT_BARRIER_REPLY
 72 0.742148305 172.31.24.227 -> 172.31.31.144 TCP 66 50110 → 6633 [ACK] Seq=49 Ack=233 Win=213 Len=0 TSval=393491388 TSecr=426115
 73 0.742165108 172.31.24.227 -> 172.31.31.144 OpenFlow 74 Type: OFPT_BARRIER_REPLY
 74 0.742188457 172.31.24.227 -> 172.31.31.144 OpenFlow 74 Type: OFPT_BARRIER_REPLY
 75 0.742227115 172.31.24.227 -> 172.31.31.144 OpenFlow 74 Type: OFPT_BARRIER_REPLY
 76 0.742313396 172.31.24.227 -> 172.31.31.144 OpenFlow 146 Type: OFPT_FLOW_REMOVED
 77 0.742324009 172.31.31.144 -> 172.31.24.227 TCP 66 6633 → 50108 [ACK] Seq=401 Ack=225 Win=853 Len=0 TSval=426115 TSecr=393491388
 78 0.742341304 172.31.24.227 -> 172.31.31.144 OpenFlow 146 Type: OFPT_FLOW_REMOVED
 79 0.742357245 172.31.24.227 -> 172.31.31.144 OpenFlow 226 Type: OFPT_FLOW_REMOVED
 80 0.742368040 172.31.24.227 -> 172.31.31.144 OpenFlow 146 Type: OFPT_FLOW_REMOVED
 81 0.742377080 172.31.24.227 -> 172.31.31.144 OpenFlow 146 Type: OFPT_FLOW_REMOVED
 82 0.742385274 172.31.24.227 -> 172.31.31.144 OpenFlow 146 Type: OFPT_FLOW_REMOVED
 83 0.742399935 172.31.31.144 -> 172.31.24.227 TCP 66 6633 → 50112 [ACK] Seq=569 Ack=313 Win=853 Len=0 TSval=426115 TSecr=393491388
 84 0.742405719 172.31.24.227 -> 172.31.31.144 OpenFlow 306 Type: OFPT_FLOW_REMOVED
 85 0.742478672 172.31.24.227 -> 172.31.31.144 OpenFlow 146 Type: OFPT_FLOW_REMOVED
 86 0.742482099 172.31.24.227 -> 172.31.31.144 OpenFlow 146 Type: OFPT_FLOW_REMOVED
 87 0.742591566 172.31.31.144 -> 172.31.24.227 TCP 66 6633 → 50108 [ACK] Seq=401 Ack=305 Win=853 Len=0 TSval=426115 TSecr=393491388
 88 0.742689124 172.31.31.144 -> 172.31.24.227 TCP 66 6633 → 50112 [ACK] Seq=569 Ack=633 Win=853 Len=0 TSval=426115 TSecr=393491388
 89 0.742692878 172.31.31.144 -> 172.31.24.227 TCP 66 6633 → 50108 [ACK] Seq=401 Ack=385 Win=853 Len=0 TSval=426115 TSecr=393491388
 90 0.743167841 172.31.31.144 -> 172.31.24.227 OpenFlow 170 Type: OFPT_FLOW_MOD
 91 0.743305511 172.31.31.144 -> 172.31.24.227 OpenFlow 170 Type: OFPT_FLOW_MOD
 92 0.743311624 172.31.31.144 -> 172.31.24.227 OpenFlow 178 Type: OFPT_BARRIER_REQUEST
 93 0.743354651 172.31.24.227 -> 172.31.31.144 TCP 66 50108 → 6633 [ACK] Seq=385 Ack=617 Win=196 Len=0 TSval=393491388 TSecr=426116
 94 0.743365542 172.31.24.227 -> 172.31.31.144 OpenFlow 74 Type: OFPT_BARRIER_REPLY
 95 0.743382530 172.31.31.144 -> 172.31.24.227 OpenFlow 170 Type: OFPT_FLOW_MOD
 96 0.743388881 172.31.31.144 -> 172.31.24.227 OpenFlow 178 Type: OFPT_BARRIER_REQUEST
 97 0.743451323 172.31.31.144 -> 172.31.24.227 OpenFlow 170 Type: OFPT_FLOW_MOD
 98 0.743507381 172.31.24.227 -> 172.31.31.144 TCP 66 50106 → 6633 [ACK] Seq=633 Ack=785 Win=211 Len=0 TSval=393491388 TSecr=426116
 99 0.743518076 172.31.24.227 -> 172.31.31.144 OpenFlow 74 Type: OFPT_BARRIER_REPLY
100 0.743531216 172.31.31.144 -> 172.31.24.227 OpenFlow 170 Type: OFPT_FLOW_MOD
101 0.743535061 172.31.31.144 -> 172.31.24.227 OpenFlow 74 Type: OFPT_BARRIER_REQUEST
102 0.743573302 172.31.24.227 -> 172.31.31.144 TCP 66 50110 → 6633 [ACK] Seq=217 Ack=449 Win=213 Len=0 TSval=393491388 TSecr=426116
103 0.743583717 172.31.24.227 -> 172.31.31.144 OpenFlow 74 Type: OFPT_BARRIER_REPLY
104 0.743678090 172.31.31.144 -> 172.31.24.227 OpenFlow 170 Type: OFPT_FLOW_MOD
105 0.744515203 172.31.31.144 -> 172.31.24.227 OpenFlow 170 Type: OFPT_FLOW_MOD
106 0.744523426 172.31.31.144 -> 172.31.24.227 OpenFlow 178 Type: OFPT_BARRIER_REQUEST
107 0.744589994 172.31.24.227 -> 172.31.31.144 TCP 66 50112 → 6633 [ACK] Seq=633 Ack=785 Win=213 Len=0 TSval=393491388 TSecr=426116
108 0.744606944 172.31.24.227 -> 172.31.31.144 OpenFlow 74 Type: OFPT_BARRIER_REPLY
109 0.744612353 172.31.31.144 -> 172.31.24.227 OpenFlow 170 Type: OFPT_FLOW_MOD
110 0.744617455 172.31.31.144 -> 172.31.24.227 OpenFlow 386 Type: OFPT_FLOW_MOD
111 0.744620179 172.31.31.144 -> 172.31.24.227 OpenFlow 74 Type: OFPT_BARRIER_REQUEST
112 0.744753877 172.31.31.144 -> 172.31.24.227 OpenFlow 170 Type: OFPT_FLOW_MOD
113 0.744760813 172.31.31.144 -> 172.31.24.227 OpenFlow 178 Type: OFPT_BARRIER_REQUEST
114 0.744763197 172.31.31.144 -> 172.31.24.227 OpenFlow 170 Type: OFPT_FLOW_MOD
115 0.744765694 172.31.31.144 -> 172.31.24.227 OpenFlow 386 Type: OFPT_FLOW_MOD
116 0.744767983 172.31.31.144 -> 172.31.24.227 OpenFlow 74 Type: OFPT_BARRIER_REQUEST
117 0.744775870 172.31.24.227 -> 172.31.31.144 OpenFlow 74 Type: OFPT_BARRIER_REPLY
118 0.744824083 172.31.24.227 -> 172.31.31.144 OpenFlow 74 Type: OFPT_BARRIER_REPLY
119 0.745019277 172.31.31.144 -> 172.31.24.227 TCP 66 6633 → 50110 [ACK] Seq=881 Ack=241 Win=853 Len=0 TSval=426116 TSecr=393491388
120 0.745032347 172.31.24.227 -> 172.31.31.144 OpenFlow 74 Type: OFPT_BARRIER_REPLY
121 0.745069875 172.31.24.227 -> 172.31.31.144 OpenFlow 74 Type: OFPT_BARRIER_REPLY
122 0.745109398 172.31.24.227 -> 172.31.31.144 TCP 66 50108 → 6633 [ACK] Seq=393 Ack=937 Win=196 Len=0 TSval=393491388 TSecr=426116
123 0.745119798 172.31.24.227 -> 172.31.31.144 OpenFlow 74 Type: OFPT_BARRIER_REPLY
124 0.745247961 172.31.31.144 -> 172.31.24.227 TCP 66 6633 → 50106 [ACK] Seq=1321 Ack=657 Win=853 Len=0 TSval=426116 TSecr=393491388
125 0.782844325 172.31.31.144 -> 172.31.24.227 TCP 66 6633 → 50112 [ACK] Seq=785 Ack=641 Win=853 Len=0 TSval=426126 TSecr=393491388
126 0.782851992 172.31.31.144 -> 172.31.24.227 TCP 66 6633 → 50108 [ACK] Seq=937 Ack=401 Win=853 Len=0 TSval=426126 TSecr=393491388
127 0.868244197 137.158.125.247 -> 172.31.24.227 TCP 54 63468 → 22 [ACK] Seq=1 Ack=401 Win=32262 Len=0
128 1.165579982 172.31.24.227 -> 137.158.125.247 SSH 98 Server: Encrypted packet (len=44)
129 1.373771614 137.158.125.247 -> 172.31.24.227 TCP 54 63468 → 22 [ACK] Seq=1 Ack=445 Win=32240 Len=0
130 1.400049749 172.31.31.144 -> 172.31.24.227 OpenFlow 187 Type: OFPT_PACKET_OUT
131 1.400074044 172.31.31.144 -> 172.31.24.227 OpenFlow 187 Type: OFPT_PACKET_OUT
132 1.400078996 172.31.31.144 -> 172.31.24.227 OpenFlow 187 Type: OFPT_PACKET_OUT
133 1.400101297 172.31.31.144 -> 172.31.24.227 OpenFlow 187 Type: OFPT_PACKET_OUT
134 1.400154523 172.31.31.144 -> 172.31.24.227 OpenFlow 187 Type: OFPT_PACKET_OUT
135 1.400208602 172.31.31.144 -> 172.31.24.227 OpenFlow 187 Type: OFPT_PACKET_OUT
136 1.400221364 172.31.24.227 -> 172.31.31.144 TCP 66 50108 → 6633 [ACK] Seq=401 Ack=1663 Win=196 Len=0 TSval=393491552 TSecr=426280
137 1.400579745 172.31.24.227 -> 172.31.31.144 OpenFlow 189 Type: OFPT_PACKET_IN
138 1.400602886 172.31.24.227 -> 172.31.31.144 OpenFlow 189 Type: OFPT_PACKET_IN
139 1.400621646 172.31.24.227 -> 172.31.31.144 OpenFlow 189 Type: OFPT_PACKET_IN
140 1.400661175 172.31.24.227 -> 172.31.31.144 OpenFlow 189 Type: OFPT_PACKET_IN
141 1.400858405 172.31.31.144 -> 172.31.24.227 TCP 66 6633 → 50112 [ACK] Seq=785 Ack=764 Win=853 Len=0 TSval=426280 TSecr=393491552
142 1.400865438 172.31.31.144 -> 172.31.24.227 TCP 66 6633 → 50112 [ACK] Seq=785 Ack=887 Win=853 Len=0 TSval=426280 TSecr=393491552
143 1.401006154 172.31.31.144 -> 172.31.24.227 TCP 66 6633 → 50110 [ACK] Seq=881 Ack=487 Win=853 Len=0 TSval=426280 TSecr=393491552
144 1.500597023 172.31.31.144 -> 172.31.24.227 OpenFlow 187 Type: OFPT_PACKET_OUT
145 1.500617089 172.31.31.144 -> 172.31.24.227 OpenFlow 187 Type: OFPT_PACKET_OUT
146 1.500633944 172.31.31.144 -> 172.31.24.227 OpenFlow 187 Type: OFPT_PACKET_OUT
147 1.500652962 172.31.31.144 -> 172.31.24.227 OpenFlow 187 Type: OFPT_PACKET_OUT
148 1.500716775 172.31.31.144 -> 172.31.24.227 OpenFlow 187 Type: OFPT_PACKET_OUT
149 1.500771750 172.31.31.144 -> 172.31.24.227 OpenFlow 187 Type: OFPT_PACKET_OUT
150 1.500848533 172.31.31.144 -> 172.31.24.227 OpenFlow 187 Type: OFPT_PACKET_OUT
151 1.500902863 172.31.31.144 -> 172.31.24.227 OpenFlow 187 Type: OFPT_PACKET_OUT
152 1.500967484 172.31.31.144 -> 172.31.24.227 OpenFlow 187 Type: OFPT_PACKET_OUT
153 1.501019604 172.31.31.144 -> 172.31.24.227 OpenFlow 187 Type: OFPT_PACKET_OUT
154 1.501056687 172.31.24.227 -> 172.31.31.144 TCP 66 50110 → 6633 [ACK] Seq=487 Ack=1607 Win=213 Len=0 TSval=393491577 TSecr=426305
155 1.501093219 172.31.31.144 -> 172.31.24.227 OpenFlow 187 Type: OFPT_PACKET_OUT
156 1.501143855 172.31.31.144 -> 172.31.24.227 OpenFlow 187 Type: OFPT_PACKET_OUT
157 1.501243860 172.31.24.227 -> 172.31.31.144 TCP 66 50112 → 6633 [ACK] Seq=887 Ack=1269 Win=213 Len=0 TSval=393491577 TSecr=426305
158 1.501303589 172.31.31.144 -> 172.31.24.227 OpenFlow 187 Type: OFPT_PACKET_OUT
159 1.501309638 172.31.31.144 -> 172.31.24.227 OpenFlow 187 Type: OFPT_PACKET_OUT
160 1.501373493 172.31.24.227 -> 172.31.31.144 OpenFlow 189 Type: OFPT_PACKET_IN
161 1.501401170 172.31.24.227 -> 172.31.31.144 OpenFlow 189 Type: OFPT_PACKET_IN
162 1.501542553 172.31.24.227 -> 172.31.31.144 OpenFlow 189 Type: OFPT_PACKET_IN
163 1.501563908 172.31.24.227 -> 172.31.31.144 OpenFlow 435 Type: OFPT_PACKET_IN
164 1.501582200 172.31.24.227 -> 172.31.31.144 OpenFlow 189 Type: OFPT_PACKET_IN
165 1.501619296 172.31.24.227 -> 172.31.31.144 OpenFlow 189 Type: OFPT_PACKET_IN
166 1.501783275 172.31.31.144 -> 172.31.24.227 TCP 66 6633 → 50108 [ACK] Seq=1663 Ack=524 Win=853 Len=0 TSval=426305 TSecr=393491577
167 1.501790361 172.31.31.144 -> 172.31.24.227 TCP 66 6633 → 50106 [ACK] Seq=1805 Ack=903 Win=853 Len=0 TSval=426305 TSecr=393491577
168 1.501793493 172.31.31.144 -> 172.31.24.227 TCP 66 6633 → 50108 [ACK] Seq=1663 Ack=893 Win=853 Len=0 TSval=426305 TSecr=393491577
169 1.502119167 172.31.31.144 -> 172.31.24.227 TCP 66 6633 → 50110 [ACK] Seq=1607 Ack=733 Win=853 Len=0 TSval=426305 TSecr=393491577
170 1.668685854 172.31.24.227 -> 137.158.125.247 SSH 98 Server: Encrypted packet (len=44)
171 1.877650503 137.158.125.247 -> 172.31.24.227 TCP 54 63468 → 22 [ACK] Seq=1 Ack=489 Win=32218 Len=0
172 2.172847364 172.31.24.227 -> 137.158.125.247 SSH 98 Server: Encrypted packet (len=44)
173 2.198274010 172.31.31.144 -> 172.31.24.227 OpenFlow 90 Type: OFPT_MULTIPART_REQUEST, OFPMP_PORT_STATS
174 2.198293317 172.31.31.144 -> 172.31.24.227 OpenFlow 122 Type: OFPT_MULTIPART_REQUEST, OFPMP_FLOW
175 2.198298167 172.31.31.144 -> 172.31.24.227 OpenFlow 82 Type: OFPT_MULTIPART_REQUEST, OFPMP_TABLE
176 2.198528891 172.31.24.227 -> 172.31.31.144 OpenFlow 530 Type: OFPT_MULTIPART_REPLY, OFPMP_PORT_STATS
177 2.198615732 172.31.24.227 -> 172.31.31.144 OpenFlow 1386 Type: OFPT_MULTIPART_REPLY, OFPMP_FLOW
178 2.198765950 172.31.31.144 -> 172.31.24.227 TCP 66 6633 → 50108 [ACK] Seq=1759 Ack=1357 Win=853 Len=0 TSval=426480 TSecr=393491752
179 2.198812751 172.31.24.227 -> 172.31.31.144 OpenFlow 6178 Type: OFPT_MULTIPART_REPLY, OFPMP_TABLE
180 2.198826204 172.31.31.144 -> 172.31.24.227 TCP 66 6633 → 50108 [ACK] Seq=1759 Ack=2677 Win=853 Len=0 TSval=426480 TSecr=393491752
181 2.199057638 172.31.31.144 -> 172.31.24.227 TCP 66 6633 → 50108 [ACK] Seq=1759 Ack=8789 Win=853 Len=0 TSval=426480 TSecr=393491752
182 2.200277465 172.31.31.144 -> 172.31.24.227 OpenFlow 82 Type: OFPT_MULTIPART_REQUEST, OFPMP_TABLE
183 2.200285224 172.31.31.144 -> 172.31.24.227 OpenFlow 146 Type: OFPT_MULTIPART_REQUEST, OFPMP_PORT_STATS
184 2.200451147 172.31.24.227 -> 172.31.31.144 OpenFlow 6178 Type: OFPT_MULTIPART_REPLY, OFPMP_TABLE
185 2.200502361 172.31.24.227 -> 172.31.31.144 OpenFlow 970 Type: OFPT_MULTIPART_REPLY, OFPMP_FLOW
186 2.200583763 172.31.24.227 -> 172.31.31.144 OpenFlow 530 Type: OFPT_MULTIPART_REPLY, OFPMP_PORT_STATS
187 2.200705722 172.31.31.144 -> 172.31.24.227 TCP 66 6633 → 50106 [ACK] Seq=1901 Ack=7919 Win=853 Len=0 TSval=426480 TSecr=393491752
188 2.203375692 172.31.31.144 -> 172.31.24.227 OpenFlow 90 Type: OFPT_MULTIPART_REQUEST, OFPMP_PORT_STATS
189 2.203519451 172.31.24.227 -> 172.31.31.144 OpenFlow 530 Type: OFPT_MULTIPART_REPLY, OFPMP_PORT_STATS
190 2.204497216 172.31.31.144 -> 172.31.24.227 OpenFlow 122 Type: OFPT_MULTIPART_REQUEST, OFPMP_FLOW
191 2.204587868 172.31.24.227 -> 172.31.31.144 OpenFlow 1386 Type: OFPT_MULTIPART_REPLY, OFPMP_FLOW
192 2.205681932 172.31.31.144 -> 172.31.24.227 OpenFlow 82 Type: OFPT_MULTIPART_REQUEST, OFPMP_TABLE
193 2.205690937 172.31.31.144 -> 172.31.24.227 OpenFlow 146 Type: OFPT_MULTIPART_REQUEST, OFPMP_PORT_STATS
194 2.205694140 172.31.31.144 -> 172.31.24.227 OpenFlow 82 Type: OFPT_MULTIPART_REQUEST, OFPMP_TABLE
195 2.205922842 172.31.24.227 -> 172.31.31.144 OpenFlow 6178 Type: OFPT_MULTIPART_REPLY, OFPMP_TABLE
196 2.206078309 172.31.24.227 -> 172.31.31.144 OpenFlow 6178 Type: OFPT_MULTIPART_REPLY, OFPMP_TABLE
197 2.206124175 172.31.24.227 -> 172.31.31.144 OpenFlow 970 Type: OFPT_MULTIPART_REPLY, OFPMP_FLOW
198 2.206198907 172.31.24.227 -> 172.31.31.144 OpenFlow 530 Type: OFPT_MULTIPART_REPLY, OFPMP_PORT_STATS
199 2.206420591 172.31.31.144 -> 172.31.24.227 TCP 66 6633 → 50112 [ACK] Seq=1365 Ack=6999 Win=853 Len=0 TSval=426481 TSecr=393491754
200 2.206427982 172.31.31.144 -> 172.31.24.227 TCP 66 6633 → 50112 [ACK] Seq=1365 Ack=7903 Win=853 Len=0 TSval=426481 TSecr=393491754
201 2.206430696 172.31.31.144 -> 172.31.24.227 TCP 66 6633 → 50112 [ACK] Seq=1365 Ack=8367 Win=853 Len=0 TSval=426481 TSecr=393491754
202 2.238845598 172.31.31.144 -> 172.31.24.227 TCP 66 6633 → 50106 [ACK] Seq=1901 Ack=8383 Win=853 Len=0 TSval=426490 TSecr=393491752
203 2.242822989 172.31.31.144 -> 172.31.24.227 TCP 66 6633 → 50110 [ACK] Seq=1703 Ack=8629 Win=853 Len=0 TSval=426491 TSecr=393491754
204 2.390094446 137.158.125.247 -> 172.31.24.227 TCP 54 63468 → 22 [ACK] Seq=1 Ack=533 Win=32196 Len=0
205 2.677091658 172.31.24.227 -> 137.158.125.247 SSH 98 Server: Encrypted packet (len=44)
