  1 0.000000000 172.31.31.144 -> 172.31.23.72 TCP 90 6633 → 45532 [PSH, ACK] Seq=1 Ack=1 Win=853 Len=24 TSval=1156462 TSecr=29978007
  2 0.000036126 172.31.31.144 -> 172.31.23.72 TCP 90 6633 → 45534 [PSH, ACK] Seq=1 Ack=1 Win=853 Len=24 TSval=1156462 TSecr=29978028
  3 0.000039564 172.31.31.144 -> 172.31.23.72 TCP 106 6633 → 45534 [PSH, ACK] Seq=25 Ack=1 Win=853 Len=40 TSval=1156462 TSecr=29978028
  4 0.000042369 172.31.31.144 -> 172.31.23.72 TCP 106 6633 → 45532 [PSH, ACK] Seq=25 Ack=1 Win=853 Len=40 TSval=1156462 TSecr=29978007
  5 0.000211540 172.31.23.72 -> 172.31.31.144 OpenFlow 82 Type: OFPT_MULTIPART_REPLY, OFPMP_GROUP
  6 0.000241138 172.31.23.72 -> 172.31.31.144 OpenFlow 98 Type: OFPT_MULTIPART_REPLY, OFPMP_METER
  7 0.000292314 172.31.23.72 -> 172.31.31.144 OpenFlow 82 Type: OFPT_MULTIPART_REPLY, OFPMP_GROUP
  8 0.000313057 172.31.23.72 -> 172.31.31.144 OpenFlow 98 Type: OFPT_MULTIPART_REPLY, OFPMP_METER
  9 0.000423478 172.31.31.144 -> 172.31.23.72 TCP 66 6633 → 45534 [ACK] Seq=65 Ack=17 Win=853 Len=0 TSval=1156462 TSecr=29978053
 10 0.000429707 172.31.31.144 -> 172.31.23.72 TCP 66 6633 → 45534 [ACK] Seq=65 Ack=49 Win=853 Len=0 TSval=1156462 TSecr=29978053
 11 0.000497912 172.31.31.144 -> 172.31.23.72 TCP 66 6633 → 45532 [ACK] Seq=65 Ack=49 Win=853 Len=0 TSval=1156462 TSecr=29978053
 12 0.100116867 172.31.31.144 -> 172.31.23.72 TCP 90 6633 → 45536 [PSH, ACK] Seq=1 Ack=1 Win=853 Len=24 TSval=1156487 TSecr=29978028
 13 0.100145261 172.31.31.144 -> 172.31.23.72 TCP 90 6633 → 45538 [PSH, ACK] Seq=1 Ack=1 Win=853 Len=24 TSval=1156487 TSecr=29978029
 14 0.100155481 172.31.23.72 -> 172.31.31.144 TCP 66 45538 → 6633 [ACK] Seq=1 Ack=25 Win=213 Len=0 TSval=29978078 TSecr=1156487
 15 0.100162711 172.31.31.144 -> 172.31.23.72 TCP 106 6633 → 45538 [PSH, ACK] Seq=25 Ack=1 Win=853 Len=40 TSval=1156487 TSecr=29978029
 16 0.100166847 172.31.23.72 -> 172.31.31.144 TCP 66 45538 → 6633 [ACK] Seq=1 Ack=65 Win=213 Len=0 TSval=29978078 TSecr=1156487
 17 0.100168551 172.31.31.144 -> 172.31.23.72 TCP 106 6633 → 45536 [PSH, ACK] Seq=25 Ack=1 Win=853 Len=40 TSval=1156487 TSecr=29978028
 18 0.100392191 172.31.23.72 -> 172.31.31.144 OpenFlow 82 Type: OFPT_MULTIPART_REPLY, OFPMP_GROUP
 19 0.100415578 172.31.23.72 -> 172.31.31.144 OpenFlow 98 Type: OFPT_MULTIPART_REPLY, OFPMP_METER
 20 0.100516619 172.31.23.72 -> 172.31.31.144 OpenFlow 82 Type: OFPT_MULTIPART_REPLY, OFPMP_GROUP
 21 0.100535908 172.31.23.72 -> 172.31.31.144 OpenFlow 98 Type: OFPT_MULTIPART_REPLY, OFPMP_METER
 22 0.100580584 172.31.31.144 -> 172.31.23.72 TCP 66 6633 → 45538 [ACK] Seq=65 Ack=49 Win=853 Len=0 TSval=1156487 TSecr=29978078
 23 0.100691851 172.31.31.144 -> 172.31.23.72 TCP 66 6633 → 45536 [ACK] Seq=65 Ack=17 Win=853 Len=0 TSval=1156487 TSecr=29978078
 24 0.100725796 172.31.31.144 -> 172.31.23.72 TCP 66 6633 → 45536 [ACK] Seq=65 Ack=49 Win=853 Len=0 TSval=1156487 TSecr=29978078
 25 0.200275788 172.31.31.144 -> 172.31.23.72 TCP 90 6633 → 45540 [PSH, ACK] Seq=1 Ack=1 Win=853 Len=24 TSval=1156512 TSecr=29978028
 26 0.200300870 172.31.31.144 -> 172.31.23.72 TCP 90 6633 → 45542 [PSH, ACK] Seq=1 Ack=1 Win=853 Len=24 TSval=1156512 TSecr=29978028
 27 0.200304049 172.31.31.144 -> 172.31.23.72 TCP 106 6633 → 45542 [PSH, ACK] Seq=25 Ack=1 Win=853 Len=40 TSval=1156512 TSecr=29978028
 28 0.200318934 172.31.31.144 -> 172.31.23.72 TCP 106 6633 → 45540 [PSH, ACK] Seq=25 Ack=1 Win=853 Len=40 TSval=1156512 TSecr=29978028
 29 0.200569367 172.31.23.72 -> 172.31.31.144 OpenFlow 82 Type: OFPT_MULTIPART_REPLY, OFPMP_GROUP
 30 0.200620914 172.31.23.72 -> 172.31.31.144 OpenFlow 98 Type: OFPT_MULTIPART_REPLY, OFPMP_METER
 31 0.200656613 172.31.23.72 -> 172.31.31.144 OpenFlow 82 Type: OFPT_MULTIPART_REPLY, OFPMP_GROUP
 32 0.200678451 172.31.23.72 -> 172.31.31.144 OpenFlow 98 Type: OFPT_MULTIPART_REPLY, OFPMP_METER
 33 0.200875521 172.31.31.144 -> 172.31.23.72 TCP 66 6633 → 45542 [ACK] Seq=65 Ack=17 Win=853 Len=0 TSval=1156512 TSecr=29978103
 34 0.200883154 172.31.31.144 -> 172.31.23.72 TCP 66 6633 → 45542 [ACK] Seq=65 Ack=49 Win=853 Len=0 TSval=1156512 TSecr=29978103
 35 0.200885699 172.31.31.144 -> 172.31.23.72 TCP 66 6633 → 45540 [ACK] Seq=65 Ack=49 Win=853 Len=0 TSval=1156512 TSecr=29978103
 36 0.299404823 172.31.31.144 -> 172.31.23.72 TCP 90 6633 → 45544 [PSH, ACK] Seq=1 Ack=1 Win=853 Len=24 TSval=1156536 TSecr=29978006
 37 0.299434243 172.31.31.144 -> 172.31.23.72 TCP 106 6633 → 45544 [PSH, ACK] Seq=25 Ack=1 Win=853 Len=40 TSval=1156536 TSecr=29978006
 38 0.299709958 172.31.23.72 -> 172.31.31.144 OpenFlow 82 Type: OFPT_MULTIPART_REPLY, OFPMP_GROUP
 39 0.299738735 172.31.23.72 -> 172.31.31.144 OpenFlow 98 Type: OFPT_MULTIPART_REPLY, OFPMP_METER
 40 0.299949731 172.31.31.144 -> 172.31.23.72 TCP 66 6633 → 45544 [ACK] Seq=65 Ack=17 Win=853 Len=0 TSval=1156537 TSecr=29978128
 41 0.299957365 172.31.31.144 -> 172.31.23.72 TCP 66 6633 → 45544 [ACK] Seq=65 Ack=49 Win=853 Len=0 TSval=1156537 TSecr=29978128
 42 0.399601949 172.31.31.144 -> 172.31.23.72 TCP 90 6633 → 45546 [PSH, ACK] Seq=1 Ack=1 Win=853 Len=24 TSval=1156561 TSecr=29978028
 43 0.399631081 172.31.31.144 -> 172.31.23.72 TCP 106 6633 → 45546 [PSH, ACK] Seq=25 Ack=1 Win=853 Len=40 TSval=1156561 TSecr=29978028
 44 0.399635517 172.31.31.144 -> 172.31.23.72 TCP 90 6633 → 45548 [PSH, ACK] Seq=1 Ack=1 Win=853 Len=24 TSval=1156561 TSecr=29978028
 45 0.399638618 172.31.31.144 -> 172.31.23.72 TCP 106 6633 → 45548 [PSH, ACK] Seq=25 Ack=1 Win=853 Len=40 TSval=1156561 TSecr=29978028
 46 0.399817043 172.31.23.72 -> 172.31.31.144 OpenFlow 82 Type: OFPT_MULTIPART_REPLY, OFPMP_GROUP
 47 0.399877889 172.31.23.72 -> 172.31.31.144 OpenFlow 98 Type: OFPT_MULTIPART_REPLY, OFPMP_METER
 48 0.399981485 172.31.23.72 -> 172.31.31.144 OpenFlow 82 Type: OFPT_MULTIPART_REPLY, OFPMP_GROUP
 49 0.400014128 172.31.23.72 -> 172.31.31.144 OpenFlow 98 Type: OFPT_MULTIPART_REPLY, OFPMP_METER
 50 0.400169527 172.31.31.144 -> 172.31.23.72 TCP 66 6633 → 45546 [ACK] Seq=65 Ack=17 Win=853 Len=0 TSval=1156562 TSecr=29978153
 51 0.400181496 172.31.31.144 -> 172.31.23.72 TCP 66 6633 → 45546 [ACK] Seq=65 Ack=49 Win=853 Len=0 TSval=1156562 TSecr=29978153
 52 0.400249587 172.31.31.144 -> 172.31.23.72 TCP 66 6633 → 45548 [ACK] Seq=65 Ack=17 Win=853 Len=0 TSval=1156562 TSecr=29978153
 53 0.400349469 172.31.31.144 -> 172.31.23.72 TCP 66 6633 → 45548 [ACK] Seq=65 Ack=49 Win=853 Len=0 TSval=1156562 TSecr=29978153
 54 0.499775349 172.31.31.144 -> 172.31.23.72 TCP 90 6633 → 45550 [PSH, ACK] Seq=1 Ack=1 Win=853 Len=24 TSval=1156586 TSecr=29978030
 55 0.499803341 172.31.31.144 -> 172.31.23.72 TCP 90 6633 → 45552 [PSH, ACK] Seq=1 Ack=1 Win=853 Len=24 TSval=1156586 TSecr=29978029
 56 0.499807427 172.31.31.144 -> 172.31.23.72 TCP 106 6633 → 45550 [PSH, ACK] Seq=25 Ack=1 Win=853 Len=40 TSval=1156586 TSecr=29978030
 57 0.499811277 172.31.31.144 -> 172.31.23.72 TCP 106 6633 → 45552 [PSH, ACK] Seq=25 Ack=1 Win=853 Len=40 TSval=1156586 TSecr=29978029
 58 0.499812949 172.31.31.144 -> 172.31.23.72 TCP 90 6633 → 45554 [PSH, ACK] Seq=1 Ack=1 Win=853 Len=24 TSval=1156586 TSecr=29978029
 59 0.499816511 172.31.31.144 -> 172.31.23.72 TCP 106 6633 → 45554 [PSH, ACK] Seq=25 Ack=1 Win=853 Len=40 TSval=1156586 TSecr=29978029
 60 0.500082972 172.31.23.72 -> 172.31.31.144 OpenFlow 82 Type: OFPT_MULTIPART_REPLY, OFPMP_GROUP
 61 0.500115027 172.31.23.72 -> 172.31.31.144 OpenFlow 82 Type: OFPT_MULTIPART_REPLY, OFPMP_GROUP
 62 0.500133096 172.31.23.72 -> 172.31.31.144 OpenFlow 82 Type: OFPT_MULTIPART_REPLY, OFPMP_GROUP
 63 0.500139192 172.31.23.72 -> 172.31.31.144 OpenFlow 98 Type: OFPT_MULTIPART_REPLY, OFPMP_METER
 64 0.500186172 172.31.23.72 -> 172.31.31.144 OpenFlow 98 Type: OFPT_MULTIPART_REPLY, OFPMP_METER
 65 0.500191165 172.31.23.72 -> 172.31.31.144 OpenFlow 98 Type: OFPT_MULTIPART_REPLY, OFPMP_METER
 66 0.500364364 172.31.31.144 -> 172.31.23.72 TCP 66 6633 → 45554 [ACK] Seq=65 Ack=17 Win=853 Len=0 TSval=1156587 TSecr=29978178
 67 0.500371888 172.31.31.144 -> 172.31.23.72 TCP 66 6633 → 45552 [ACK] Seq=65 Ack=17 Win=853 Len=0 TSval=1156587 TSecr=29978178
 68 0.500374056 172.31.31.144 -> 172.31.23.72 TCP 66 6633 → 45550 [ACK] Seq=65 Ack=17 Win=853 Len=0 TSval=1156587 TSecr=29978178
 69 0.500375752 172.31.31.144 -> 172.31.23.72 TCP 66 6633 → 45554 [ACK] Seq=65 Ack=49 Win=853 Len=0 TSval=1156587 TSecr=29978178
 70 0.500422756 172.31.31.144 -> 172.31.23.72 TCP 66 6633 → 45552 [ACK] Seq=65 Ack=49 Win=853 Len=0 TSval=1156587 TSecr=29978178
 71 0.500424972 172.31.31.144 -> 172.31.23.72 TCP 66 6633 → 45550 [ACK] Seq=65 Ack=49 Win=853 Len=0 TSval=1156587 TSecr=29978178
 72 2.677130140 172.31.23.72 -> 172.31.31.144 OpenFlow 146 Type: OFPT_PORT_STATUS
 73 2.677236949 172.31.23.72 -> 172.31.31.144 OpenFlow 146 Type: OFPT_PORT_STATUS
 74 2.677344411 172.31.31.144 -> 172.31.23.72 TCP 66 6633 → 45518 [ACK] Seq=1 Ack=81 Win=853 Len=0 TSval=1157131 TSecr=29978722
 75 2.702182321 172.31.31.144 -> 172.31.23.72 OpenFlow 146 Type: OFPT_FLOW_MOD
 76 2.702208237 172.31.31.144 -> 172.31.23.72 TCP 146 6633 → 45510 [PSH, ACK] Seq=1 Ack=1 Win=853 Len=80 TSval=1157137 TSecr=29978028
 77 2.702214976 172.31.31.144 -> 172.31.23.72 OpenFlow 146 Type: OFPT_FLOW_MOD
 78 2.702224571 172.31.23.72 -> 172.31.31.144 TCP 66 45518 → 6633 [ACK] Seq=81 Ack=81 Win=213 Len=0 TSval=29978728 TSecr=1157137
 79 2.702234752 172.31.31.144 -> 172.31.23.72 OpenFlow 146 Type: OFPT_FLOW_MOD
 80 2.702241324 172.31.23.72 -> 172.31.31.144 TCP 66 45518 → 6633 [ACK] Seq=81 Ack=161 Win=213 Len=0 TSval=29978728 TSecr=1157137
 81 2.702244174 172.31.31.144 -> 172.31.23.72 OpenFlow 74 Type: OFPT_BARRIER_REQUEST
 82 2.702247909 172.31.23.72 -> 172.31.31.144 TCP 66 45518 → 6633 [ACK] Seq=81 Ack=169 Win=213 Len=0 TSval=29978728 TSecr=1157137
 83 2.702255202 172.31.31.144 -> 172.31.23.72 TCP 146 6633 → 45510 [PSH, ACK] Seq=81 Ack=1 Win=853 Len=80 TSval=1157137 TSecr=29978028
 84 2.702258947 172.31.31.144 -> 172.31.23.72 OpenFlow 146 Type: OFPT_FLOW_MOD
 85 2.702262115 172.31.31.144 -> 172.31.23.72 OpenFlow 74 Type: OFPT_BARRIER_REQUEST
 86 2.702264741 172.31.31.144 -> 172.31.23.72 TCP 74 6633 → 45510 [PSH, ACK] Seq=161 Ack=1 Win=853 Len=8 TSval=1157137 TSecr=29978028
 87 2.702267665 172.31.31.144 -> 172.31.23.72 TCP 146 6633 → 45520 [PSH, ACK] Seq=1 Ack=1 Win=853 Len=80 TSval=1157137 TSecr=29978030
 88 2.702271971 172.31.31.144 -> 172.31.23.72 TCP 154 6633 → 45520 [PSH, ACK] Seq=81 Ack=1 Win=853 Len=88 TSval=1157137 TSecr=29978030
 89 2.702274834 172.31.31.144 -> 172.31.23.72 TCP 146 6633 → 45512 [PSH, ACK] Seq=1 Ack=1 Win=853 Len=80 TSval=1157137 TSecr=29978029
 90 2.702279522 172.31.31.144 -> 172.31.23.72 TCP 154 6633 → 45512 [PSH, ACK] Seq=81 Ack=1 Win=853 Len=88 TSval=1157137 TSecr=29978029
 91 2.702282869 172.31.31.144 -> 172.31.23.72 OpenFlow 146 Type: OFPT_FLOW_MOD
 92 2.702286608 172.31.23.72 -> 172.31.31.144 TCP 66 45518 → 6633 [ACK] Seq=81 Ack=249 Win=213 Len=0 TSval=29978728 TSecr=1157137
 93 2.702289548 172.31.31.144 -> 172.31.23.72 OpenFlow 146 Type: OFPT_FLOW_MOD
 94 2.702293775 172.31.31.144 -> 172.31.23.72 OpenFlow 154 Type: OFPT_BARRIER_REQUEST
 95 2.702297333 172.31.23.72 -> 172.31.31.144 TCP 66 45518 → 6633 [ACK] Seq=81 Ack=337 Win=213 Len=0 TSval=29978728 TSecr=1157137
 96 2.702299903 172.31.31.144 -> 172.31.23.72 OpenFlow 146 Type: OFPT_FLOW_MOD
 97 2.702303123 172.31.31.144 -> 172.31.23.72 TCP 146 6633 → 45528 [PSH, ACK] Seq=1 Ack=1 Win=853 Len=80 TSval=1157137 TSecr=29978029
 98 2.702307660 172.31.31.144 -> 172.31.23.72 TCP 154 6633 → 45528 [PSH, ACK] Seq=81 Ack=1 Win=853 Len=88 TSval=1157137 TSecr=29978029
 99 2.702310627 172.31.31.144 -> 172.31.23.72 OpenFlow 74 Type: OFPT_BARRIER_REQUEST
100 2.702313557 172.31.31.144 -> 172.31.23.72 OpenFlow 146 Type: OFPT_FLOW_MOD
101 2.702316394 172.31.31.144 -> 172.31.23.72 OpenFlow 394 Type: OFPT_FLOW_MOD
102 2.702320129 172.31.31.144 -> 172.31.23.72 OpenFlow 146 Type: OFPT_FLOW_MOD
103 2.702324349 172.31.23.72 -> 172.31.31.144 TCP 66 45518 → 6633 [ACK] Seq=81 Ack=417 Win=213 Len=0 TSval=29978728 TSecr=1157137
104 2.702331730 172.31.31.144 -> 172.31.23.72 TCP 146 6633 → 45522 [PSH, ACK] Seq=1 Ack=1 Win=853 Len=80 TSval=1157137 TSecr=29978029
105 2.702335902 172.31.31.144 -> 172.31.23.72 OpenFlow 74 Type: OFPT_BARRIER_REQUEST
106 2.702339063 172.31.31.144 -> 172.31.23.72 OpenFlow 154 Type: OFPT_BARRIER_REQUEST
107 2.702342681 172.31.23.72 -> 172.31.31.144 TCP 66 45518 → 6633 [ACK] Seq=81 Ack=505 Win=213 Len=0 TSval=29978728 TSecr=1157137
108 2.702356449 172.31.31.144 -> 172.31.23.72 OpenFlow 154 Type: OFPT_BARRIER_REQUEST
109 2.702358184 172.31.31.144 -> 172.31.23.72 TCP 146 6633 → 45520 [PSH, ACK] Seq=169 Ack=1 Win=853 Len=80 TSval=1157137 TSecr=29978030
110 2.702359620 172.31.31.144 -> 172.31.23.72 TCP 146 6633 → 45522 [PSH, ACK] Seq=81 Ack=1 Win=853 Len=80 TSval=1157137 TSecr=29978029
111 2.702361304 172.31.31.144 -> 172.31.23.72 TCP 146 6633 → 45514 [PSH, ACK] Seq=1 Ack=1 Win=853 Len=80 TSval=1157137 TSecr=29978028
112 2.702363741 172.31.31.144 -> 172.31.23.72 TCP 74 6633 → 45522 [PSH, ACK] Seq=161 Ack=1 Win=853 Len=8 TSval=1157137 TSecr=29978029
113 2.702368106 172.31.31.144 -> 172.31.23.72 TCP 154 6633 → 45514 [PSH, ACK] Seq=81 Ack=1 Win=853 Len=88 TSval=1157137 TSecr=29978028
114 2.702370029 172.31.31.144 -> 172.31.23.72 TCP 146 6633 → 45520 [PSH, ACK] Seq=249 Ack=1 Win=853 Len=80 TSval=1157137 TSecr=29978030
115 2.702371687 172.31.31.144 -> 172.31.23.72 TCP 74 6633 → 45520 [PSH, ACK] Seq=329 Ack=1 Win=853 Len=8 TSval=1157137 TSecr=29978030
116 2.702373336 172.31.31.144 -> 172.31.23.72 OpenFlow 146 Type: OFPT_FLOW_MOD
117 2.702375368 172.31.23.72 -> 172.31.31.144 TCP 66 45518 → 6633 [ACK] Seq=81 Ack=585 Win=213 Len=0 TSval=29978728 TSecr=1157137
118 2.702376941 172.31.31.144 -> 172.31.23.72 OpenFlow 154 Type: OFPT_BARRIER_REQUEST
119 2.702378779 172.31.23.72 -> 172.31.31.144 TCP 66 45518 → 6633 [ACK] Seq=81 Ack=673 Win=213 Len=0 TSval=29978728 TSecr=1157137
120 2.702379743 172.31.31.144 -> 172.31.23.72 OpenFlow 146 Type: OFPT_FLOW_MOD
121 2.702381624 172.31.31.144 -> 172.31.23.72 TCP 146 6633 → 45528 [PSH, ACK] Seq=169 Ack=1 Win=853 Len=80 TSval=1157137 TSecr=29978029
122 2.702383389 172.31.31.144 -> 172.31.23.72 TCP 154 6633 → 45528 [PSH, ACK] Seq=249 Ack=1 Win=853 Len=88 TSval=1157137 TSecr=29978029
123 2.702384903 172.31.31.144 -> 172.31.23.72 OpenFlow 146 Type: OFPT_FLOW_MOD
124 2.702387555 172.31.31.144 -> 172.31.23.72 OpenFlow 154 Type: OFPT_BARRIER_REQUEST
125 2.702389151 172.31.31.144 -> 172.31.23.72 OpenFlow 154 Type: OFPT_BARRIER_REQUEST
126 2.702390734 172.31.31.144 -> 172.31.23.72 TCP 146 6633 → 45528 [PSH, ACK] Seq=337 Ack=1 Win=853 Len=80 TSval=1157137 TSecr=29978029
127 2.702392332 172.31.31.144 -> 172.31.23.72 OpenFlow 146 Type: OFPT_FLOW_MOD
128 2.702394944 172.31.31.144 -> 172.31.23.72 OpenFlow 146 Type: OFPT_FLOW_MOD
129 2.702397583 172.31.31.144 -> 172.31.23.72 TCP 154 6633 → 45528 [PSH, ACK] Seq=417 Ack=1 Win=853 Len=88 TSval=1157137 TSecr=29978029
130 2.702399482 172.31.31.144 -> 172.31.23.72 OpenFlow 146 Type: OFPT_FLOW_MOD
131 2.702400972 172.31.31.144 -> 172.31.23.72 OpenFlow 146 Type: OFPT_FLOW_MOD
132 2.702403541 172.31.31.144 -> 172.31.23.72 OpenFlow 146 Type: OFPT_FLOW_MOD
133 2.702405059 172.31.31.144 -> 172.31.23.72 OpenFlow 146 Type: OFPT_FLOW_MOD
134 2.702406390 172.31.31.144 -> 172.31.23.72 OpenFlow 74 Type: OFPT_BARRIER_REQUEST
135 2.702407851 172.31.31.144 -> 172.31.23.72 OpenFlow 154 Type: OFPT_BARRIER_REQUEST
136 2.702409268 172.31.31.144 -> 172.31.23.72 OpenFlow 146 Type: OFPT_FLOW_MOD
137 2.702410918 172.31.23.72 -> 172.31.31.144 TCP 66 45518 → 6633 [ACK] Seq=81 Ack=753 Win=213 Len=0 TSval=29978728 TSecr=1157137
138 2.702412639 172.31.31.144 -> 172.31.23.72 OpenFlow 146 Type: OFPT_FLOW_MOD
139 2.702415093 172.31.31.144 -> 172.31.23.72 OpenFlow 146 Type: OFPT_FLOW_MOD
140 2.702417539 172.31.31.144 -> 172.31.23.72 OpenFlow 154 Type: OFPT_BARRIER_REQUEST
141 2.702419263 172.31.31.144 -> 172.31.23.72 OpenFlow 146 Type: OFPT_FLOW_MOD
142 2.702422016 172.31.31.144 -> 172.31.23.72 OpenFlow 146 Type: OFPT_FLOW_MOD
143 2.702424025 172.31.31.144 -> 172.31.23.72 OpenFlow 154 Type: OFPT_BARRIER_REQUEST
144 2.702425617 172.31.31.144 -> 172.31.23.72 OpenFlow 154 Type: OFPT_BARRIER_REQUEST
145 2.702427213 172.31.31.144 -> 172.31.23.72 OpenFlow 146 Type: OFPT_FLOW_MOD
146 2.702428574 172.31.31.144 -> 172.31.23.72 OpenFlow 74 Type: OFPT_BARRIER_REQUEST
147 2.702432566 172.31.31.144 -> 172.31.23.72 TCP 146 6633 → 45524 [PSH, ACK] Seq=1 Ack=1 Win=853 Len=80 TSval=1157137 TSecr=29978029
148 2.702434938 172.31.31.144 -> 172.31.23.72 OpenFlow 74 Type: OFPT_BARRIER_REQUEST
149 2.702468461 172.31.31.144 -> 172.31.23.72 TCP 146 6633 → 45526 [PSH, ACK] Seq=1 Ack=1 Win=853 Len=80 TSval=1157137 TSecr=29978007
150 2.702472368 172.31.31.144 -> 172.31.23.72 TCP 154 6633 → 45524 [PSH, ACK] Seq=81 Ack=1 Win=853 Len=88 TSval=1157137 TSecr=29978029
151 2.702474287 172.31.31.144 -> 172.31.23.72 TCP 154 6633 → 45526 [PSH, ACK] Seq=81 Ack=1 Win=853 Len=88 TSval=1157137 TSecr=29978007
152 2.702476094 172.31.31.144 -> 172.31.23.72 TCP 146 6633 → 45528 [PSH, ACK] Seq=505 Ack=1 Win=853 Len=80 TSval=1157137 TSecr=29978029
153 2.702477984 172.31.31.144 -> 172.31.23.72 OpenFlow 146 Type: OFPT_FLOW_MOD
154 2.702480555 172.31.31.144 -> 172.31.23.72 OpenFlow 146 Type: OFPT_FLOW_MOD
155 2.702482912 172.31.31.144 -> 172.31.23.72 OpenFlow 146 Type: OFPT_FLOW_MOD
156 2.702484623 172.31.31.144 -> 172.31.23.72 TCP 146 6633 → 45528 [PSH, ACK] Seq=585 Ack=1 Win=853 Len=80 TSval=1157137 TSecr=29978029
157 2.702486694 172.31.31.144 -> 172.31.23.72 OpenFlow 154 Type: OFPT_BARRIER_REQUEST
158 2.702488315 172.31.31.144 -> 172.31.23.72 TCP 146 6633 → 45530 [PSH, ACK] Seq=1 Ack=1 Win=853 Len=80 TSval=1157137 TSecr=29978028
159 2.702490562 172.31.31.144 -> 172.31.23.72 OpenFlow 146 Type: OFPT_FLOW_MOD
160 2.702491792 172.31.31.144 -> 172.31.23.72 OpenFlow 74 Type: OFPT_BARRIER_REQUEST
161 2.702492970 172.31.31.144 -> 172.31.23.72 TCP 74 6633 → 45528 [PSH, ACK] Seq=665 Ack=1 Win=853 Len=8 TSval=1157137 TSecr=29978029
162 2.702494335 172.31.31.144 -> 172.31.23.72 OpenFlow 154 Type: OFPT_BARRIER_REQUEST
163 2.702495747 172.31.31.144 -> 172.31.23.72 TCP 146 6633 → 45530 [PSH, ACK] Seq=81 Ack=1 Win=853 Len=80 TSval=1157137 TSecr=29978028
164 2.702497303 172.31.31.144 -> 172.31.23.72 TCP 74 6633 → 45530 [PSH, ACK] Seq=161 Ack=1 Win=853 Len=8 TSval=1157137 TSecr=29978028
165 2.702498636 172.31.31.144 -> 172.31.23.72 OpenFlow 658 Type: OFPT_BARRIER_REQUEST
166 2.702501730 172.31.23.72 -> 172.31.31.144 TCP 66 45518 → 6633 [ACK] Seq=81 Ack=1345 Win=212 Len=0 TSval=29978728 TSecr=1157137
167 2.702626173 172.31.23.72 -> 172.31.31.144 TCP 66 45546 → 6633 [ACK] Seq=49 Ack=233 Win=213 Len=0 TSval=29978728 TSecr=1157137
168 2.702633341 172.31.23.72 -> 172.31.31.144 OpenFlow 74 Type: OFPT_BARRIER_REPLY
169 2.702661162 172.31.23.72 -> 172.31.31.144 TCP 66 45534 → 6633 [ACK] Seq=49 Ack=233 Win=213 Len=0 TSval=29978728 TSecr=1157137
170 2.702665790 172.31.23.72 -> 172.31.31.144 OpenFlow 74 Type: OFPT_BARRIER_REPLY
171 2.702681726 172.31.23.72 -> 172.31.31.144 TCP 66 45530 → 6633 [ACK] Seq=1 Ack=169 Win=213 Len=0 TSval=29978728 TSecr=1157137
172 2.702685686 172.31.23.72 -> 172.31.31.144 OpenFlow 74 Type: OFPT_BARRIER_REPLY
173 2.702701310 172.31.23.72 -> 172.31.31.144 TCP 66 45514 → 6633 [ACK] Seq=1 Ack=169 Win=213 Len=0 TSval=29978728 TSecr=1157137
174 2.702705341 172.31.23.72 -> 172.31.31.144 OpenFlow 74 Type: OFPT_BARRIER_REPLY
175 2.702722481 172.31.23.72 -> 172.31.31.144 OpenFlow 74 Type: OFPT_BARRIER_REPLY
176 2.702791931 172.31.23.72 -> 172.31.31.144 OpenFlow 74 Type: OFPT_BARRIER_REPLY
177 2.702859397 172.31.23.72 -> 172.31.31.144 TCP 66 45512 → 6633 [ACK] Seq=1 Ack=169 Win=213 Len=0 TSval=29978728 TSecr=1157137
178 2.702863660 172.31.23.72 -> 172.31.31.144 OpenFlow 74 Type: OFPT_BARRIER_REPLY
179 2.702879998 172.31.23.72 -> 172.31.31.144 OpenFlow 74 Type: OFPT_BARRIER_REPLY
180 2.702907616 172.31.23.72 -> 172.31.31.144 TCP 66 45544 → 6633 [ACK] Seq=49 Ack=233 Win=213 Len=0 TSval=29978728 TSecr=1157137
181 2.702912027 172.31.23.72 -> 172.31.31.144 OpenFlow 74 Type: OFPT_BARRIER_REPLY
182 2.702927174 172.31.23.72 -> 172.31.31.144 TCP 66 45524 → 6633 [ACK] Seq=1 Ack=169 Win=213 Len=0 TSval=29978728 TSecr=1157137
183 2.702930476 172.31.23.72 -> 172.31.31.144 OpenFlow 74 Type: OFPT_BARRIER_REPLY
184 2.702945382 172.31.23.72 -> 172.31.31.144 TCP 66 45522 → 6633 [ACK] Seq=1 Ack=169 Win=213 Len=0 TSval=29978728 TSecr=1157137
185 2.702949075 172.31.23.72 -> 172.31.31.144 OpenFlow 74 Type: OFPT_BARRIER_REPLY
186 2.702963290 172.31.23.72 -> 172.31.31.144 TCP 66 45510 → 6633 [ACK] Seq=1 Ack=169 Win=213 Len=0 TSval=29978728 TSecr=1157137
187 2.702967531 172.31.23.72 -> 172.31.31.144 OpenFlow 74 Type: OFPT_BARRIER_REPLY
188 2.702982006 172.31.23.72 -> 172.31.31.144 TCP 66 45540 → 6633 [ACK] Seq=49 Ack=233 Win=213 Len=0 TSval=29978728 TSecr=1157137
189 2.702985582 172.31.23.72 -> 172.31.31.144 OpenFlow 74 Type: OFPT_BARRIER_REPLY
190 2.702993078 172.31.31.144 -> 172.31.23.72 TCP 66 6633 → 45546 [ACK] Seq=233 Ack=57 Win=853 Len=0 TSval=1157137 TSecr=29978728
191 2.702997179 172.31.31.144 -> 172.31.23.72 TCP 66 6633 → 45534 [ACK] Seq=233 Ack=57 Win=853 Len=0 TSval=1157137 TSecr=29978728
192 2.703017036 172.31.23.72 -> 172.31.31.144 TCP 66 45526 → 6633 [ACK] Seq=1 Ack=169 Win=213 Len=0 TSval=29978728 TSecr=1157137
193 2.703023870 172.31.23.72 -> 172.31.31.144 OpenFlow 90 Type: OFPT_BARRIER_REPLY
194 2.703028888 172.31.23.72 -> 172.31.31.144 OpenFlow 74 Type: OFPT_BARRIER_REPLY
195 2.703046201 172.31.23.72 -> 172.31.31.144 TCP 66 45554 → 6633 [ACK] Seq=49 Ack=233 Win=213 Len=0 TSval=29978728 TSecr=1157137
196 2.703049712 172.31.23.72 -> 172.31.31.144 OpenFlow 74 Type: OFPT_BARRIER_REPLY
197 2.703065044 172.31.23.72 -> 172.31.31.144 TCP 66 45552 → 6633 [ACK] Seq=49 Ack=233 Win=213 Len=0 TSval=29978728 TSecr=1157137
198 2.703071097 172.31.23.72 -> 172.31.31.144 OpenFlow 74 Type: OFPT_BARRIER_REPLY
199 2.703091873 172.31.23.72 -> 172.31.31.144 OpenFlow 74 Type: OFPT_BARRIER_REPLY
200 2.703094121 172.31.23.72 -> 172.31.31.144 OpenFlow 122 Type: OFPT_BARRIER_REPLY
201 2.703142274 172.31.23.72 -> 172.31.31.144 TCP 66 45548 → 6633 [ACK] Seq=49 Ack=233 Win=213 Len=0 TSval=29978728 TSecr=1157137
202 2.703146167 172.31.23.72 -> 172.31.31.144 OpenFlow 74 Type: OFPT_BARRIER_REPLY
203 2.703161241 172.31.23.72 -> 172.31.31.144 TCP 66 45542 → 6633 [ACK] Seq=49 Ack=233 Win=213 Len=0 TSval=29978728 TSecr=1157137
204 2.703165744 172.31.23.72 -> 172.31.31.144 OpenFlow 74 Type: OFPT_BARRIER_REPLY
205 2.703182318 172.31.23.72 -> 172.31.31.144 OpenFlow 74 Type: OFPT_BARRIER_REPLY
206 2.703206513 172.31.23.72 -> 172.31.31.144 OpenFlow 74 Type: OFPT_BARRIER_REPLY
207 2.703368751 172.31.23.72 -> 172.31.31.144 OpenFlow 146 Type: OFPT_FLOW_REMOVED
208 2.703372931 172.31.23.72 -> 172.31.31.144 OpenFlow 74 Type: OFPT_BARRIER_REPLY
209 2.703394229 172.31.23.72 -> 172.31.31.144 OpenFlow 146 Type: OFPT_FLOW_REMOVED
210 2.703402066 172.31.23.72 -> 172.31.31.144 OpenFlow 146 Type: OFPT_FLOW_REMOVED
211 2.703409472 172.31.23.72 -> 172.31.31.144 OpenFlow 146 Type: OFPT_FLOW_REMOVED
212 2.703464573 172.31.23.72 -> 172.31.31.144 OpenFlow 146 Type: OFPT_FLOW_REMOVED
213 2.703480523 172.31.23.72 -> 172.31.31.144 OpenFlow 146 Type: OFPT_FLOW_REMOVED
214 2.703488011 172.31.23.72 -> 172.31.31.144 OpenFlow 146 Type: OFPT_FLOW_REMOVED
215 2.703745897 172.31.31.144 -> 172.31.23.72 TCP 66 6633 → 45530 [ACK] Seq=169 Ack=9 Win=853 Len=0 TSval=1157137 TSecr=29978728
216 2.703753835 172.31.23.72 -> 172.31.31.144 OpenFlow 146 Type: OFPT_FLOW_REMOVED
217 2.703759192 172.31.31.144 -> 172.31.23.72 TCP 66 6633 → 45514 [ACK] Seq=169 Ack=9 Win=853 Len=0 TSval=1157137 TSecr=29978728
218 2.703762040 172.31.23.72 -> 172.31.31.144 OpenFlow 146 Type: OFPT_FLOW_REMOVED
219 2.703763425 172.31.31.144 -> 172.31.23.72 TCP 66 6633 → 45528 [ACK] Seq=673 Ack=9 Win=853 Len=0 TSval=1157137 TSecr=29978728
220 2.703765595 172.31.23.72 -> 172.31.31.144 OpenFlow 706 Type: OFPT_FLOW_REMOVED
221 2.703767025 172.31.31.144 -> 172.31.23.72 TCP 66 6633 → 45512 [ACK] Seq=169 Ack=9 Win=853 Len=0 TSval=1157137 TSecr=29978728
222 2.703769175 172.31.23.72 -> 172.31.31.144 OpenFlow 146 Type: OFPT_FLOW_REMOVED
223 2.703770550 172.31.31.144 -> 172.31.23.72 TCP 66 6633 → 45538 [ACK] Seq=401 Ack=57 Win=853 Len=0 TSval=1157137 TSecr=29978728
224 2.703772695 172.31.23.72 -> 172.31.31.144 OpenFlow 386 Type: OFPT_FLOW_REMOVED
225 2.703774173 172.31.31.144 -> 172.31.23.72 TCP 66 6633 → 45544 [ACK] Seq=233 Ack=57 Win=853 Len=0 TSval=1157137 TSecr=29978728
226 2.703776637 172.31.23.72 -> 172.31.31.144 OpenFlow 146 Type: OFPT_FLOW_REMOVED
227 2.703778417 172.31.31.144 -> 172.31.23.72 TCP 66 6633 → 45524 [ACK] Seq=169 Ack=9 Win=853 Len=0 TSval=1157137 TSecr=29978728
228 2.703780546 172.31.23.72 -> 172.31.31.144 OpenFlow 146 Type: OFPT_FLOW_REMOVED
229 2.703781944 172.31.31.144 -> 172.31.23.72 TCP 66 6633 → 45522 [ACK] Seq=169 Ack=9 Win=853 Len=0 TSval=1157137 TSecr=29978728
230 2.703784878 172.31.23.72 -> 172.31.31.144 OpenFlow 226 Type: OFPT_FLOW_REMOVED
231 2.703790907 172.31.23.72 -> 172.31.31.144 OpenFlow 226 Type: OFPT_FLOW_REMOVED
232 2.703793212 172.31.23.72 -> 172.31.31.144 OpenFlow 226 Type: OFPT_FLOW_REMOVED
233 2.704701660 172.31.23.72 -> 172.31.31.144 OpenFlow 226 Type: OFPT_FLOW_REMOVED
234 2.704703936 172.31.23.72 -> 172.31.31.144 OpenFlow 226 Type: OFPT_FLOW_REMOVED
235 2.704705516 172.31.23.72 -> 172.31.31.144 OpenFlow 226 Type: OFPT_FLOW_REMOVED
236 2.704707140 172.31.23.72 -> 172.31.31.144 OpenFlow 978 Type: OFPT_FLOW_REMOVED
237 2.704708867 172.31.23.72 -> 172.31.31.144 OpenFlow 1346 Type: OFPT_FLOW_REMOVED
238 2.704710703 172.31.23.72 -> 172.31.31.144 OpenFlow 226 Type: OFPT_FLOW_REMOVED
239 2.704712251 172.31.23.72 -> 172.31.31.144 OpenFlow 226 Type: OFPT_FLOW_REMOVED
240 2.704713831 172.31.23.72 -> 172.31.31.144 OpenFlow 394 Type: OFPT_FLOW_REMOVED
241 2.704715444 172.31.23.72 -> 172.31.31.144 OpenFlow 394 Type: OFPT_FLOW_REMOVED
242 2.704717007 172.31.23.72 -> 172.31.31.144 OpenFlow 146 Type: OFPT_FLOW_REMOVED
243 2.704718562 172.31.23.72 -> 172.31.31.144 OpenFlow 146 Type: OFPT_FLOW_REMOVED
244 2.705035260 172.31.31.144 -> 172.31.23.72 TCP 66 6633 → 45528 [ACK] Seq=673 Ack=33 Win=853 Len=0 TSval=1157138 TSecr=29978728
245 2.705038980 172.31.31.144 -> 172.31.23.72 TCP 66 6633 → 45526 [ACK] Seq=169 Ack=9 Win=853 Len=0 TSval=1157138 TSecr=29978728
246 2.705041431 172.31.31.144 -> 172.31.23.72 TCP 66 6633 → 45554 [ACK] Seq=233 Ack=57 Win=853 Len=0 TSval=1157138 TSecr=29978728
247 2.705043212 172.31.31.144 -> 172.31.23.72 TCP 66 6633 → 45552 [ACK] Seq=233 Ack=57 Win=853 Len=0 TSval=1157138 TSecr=29978728
248 2.705045136 172.31.31.144 -> 172.31.23.72 OpenFlow 490 Type: OFPT_BARRIER_REQUEST
249 2.705047798 172.31.31.144 -> 172.31.23.72 TCP 66 6633 → 45518 [ACK] Seq=1345 Ack=145 Win=853 Len=0 TSval=1157138 TSecr=29978728
250 2.705049790 172.31.31.144 -> 172.31.23.72 TCP 66 6633 → 45548 [ACK] Seq=233 Ack=57 Win=853 Len=0 TSval=1157138 TSecr=29978728
251 2.705051561 172.31.31.144 -> 172.31.23.72 TCP 66 6633 → 45542 [ACK] Seq=233 Ack=57 Win=853 Len=0 TSval=1157138 TSecr=29978728
252 2.705053696 172.31.31.144 -> 172.31.23.72 TCP 66 6633 → 45536 [ACK] Seq=401 Ack=57 Win=853 Len=0 TSval=1157138 TSecr=29978728
253 2.705055383 172.31.31.144 -> 172.31.23.72 TCP 66 6633 → 45520 [ACK] Seq=337 Ack=9 Win=853 Len=0 TSval=1157138 TSecr=29978728
254 2.705057230 172.31.31.144 -> 172.31.23.72 OpenFlow 170 Type: OFPT_FLOW_MOD
255 2.705059456 172.31.31.144 -> 172.31.23.72 OpenFlow 170 Type: OFPT_FLOW_MOD
256 2.705061114 172.31.31.144 -> 172.31.23.72 TCP 66 6633 → 45546 [ACK] Seq=233 Ack=137 Win=853 Len=0 TSval=1157138 TSecr=29978728
257 2.705062920 172.31.31.144 -> 172.31.23.72 OpenFlow 178 Type: OFPT_BARRIER_REQUEST
258 2.705064359 172.31.31.144 -> 172.31.23.72 OpenFlow 170 Type: OFPT_FLOW_MOD
259 2.705066035 172.31.31.144 -> 172.31.23.72 OpenFlow 74 Type: OFPT_BARRIER_REQUEST
260 2.705068196 172.31.31.144 -> 172.31.23.72 TCP 66 6633 → 45538 [ACK] Seq=401 Ack=65 Win=853 Len=0 TSval=1157138 TSecr=29978728
261 2.705069942 172.31.31.144 -> 172.31.23.72 TCP 66 6633 → 45534 [ACK] Seq=233 Ack=137 Win=853 Len=0 TSval=1157138 TSecr=29978728
262 2.705071640 172.31.31.144 -> 172.31.23.72 TCP 66 6633 → 45530 [ACK] Seq=169 Ack=89 Win=853 Len=0 TSval=1157138 TSecr=29978728
263 2.705073648 172.31.31.144 -> 172.31.23.72 TCP 66 6633 → 45514 [ACK] Seq=169 Ack=89 Win=853 Len=0 TSval=1157138 TSecr=29978728
264 2.705075658 172.31.31.144 -> 172.31.23.72 TCP 66 6633 → 45512 [ACK] Seq=169 Ack=89 Win=853 Len=0 TSval=1157138 TSecr=29978728
265 2.705077429 172.31.31.144 -> 172.31.23.72 TCP 66 6633 → 45544 [ACK] Seq=233 Ack=137 Win=853 Len=0 TSval=1157138 TSecr=29978728
266 2.705869337 172.31.23.72 -> 172.31.31.144 TCP 66 45510 → 6633 [ACK] Seq=169 Ack=385 Win=213 Len=0 TSval=29978729 TSecr=1157138
267 2.705882633 172.31.23.72 -> 172.31.31.144 OpenFlow 74 Type: OFPT_BARRIER_REPLY
268 2.705936115 172.31.23.72 -> 172.31.31.144 OpenFlow 74 Type: OFPT_BARRIER_REPLY
269 2.707074509 172.31.31.144 -> 172.31.23.72 TCP 66 6633 → 45524 [ACK] Seq=169 Ack=89 Win=853 Len=0 TSval=1157138 TSecr=29978728
270 2.707082021 172.31.31.144 -> 172.31.23.72 TCP 66 6633 → 45530 [ACK] Seq=169 Ack=169 Win=853 Len=0 TSval=1157138 TSecr=29978729
271 2.707084787 172.31.31.144 -> 172.31.23.72 TCP 66 6633 → 45514 [ACK] Seq=169 Ack=169 Win=853 Len=0 TSval=1157138 TSecr=29978729
272 2.707086472 172.31.31.144 -> 172.31.23.72 TCP 66 6633 → 45528 [ACK] Seq=673 Ack=673 Win=853 Len=0 TSval=1157138 TSecr=29978729
273 2.707088176 172.31.31.144 -> 172.31.23.72 TCP 66 6633 → 45512 [ACK] Seq=169 Ack=169 Win=853 Len=0 TSval=1157138 TSecr=29978729
274 2.707090161 172.31.31.144 -> 172.31.23.72 TCP 66 6633 → 45538 [ACK] Seq=401 Ack=385 Win=853 Len=0 TSval=1157138 TSecr=29978729
275 2.707091915 172.31.31.144 -> 172.31.23.72 TCP 66 6633 → 45544 [ACK] Seq=233 Ack=217 Win=853 Len=0 TSval=1157138 TSecr=29978729
276 2.707093512 172.31.31.144 -> 172.31.23.72 TCP 66 6633 → 45524 [ACK] Seq=169 Ack=169 Win=853 Len=0 TSval=1157138 TSecr=29978729
277 2.707095163 172.31.31.144 -> 172.31.23.72 TCP 66 6633 → 45522 [ACK] Seq=169 Ack=169 Win=853 Len=0 TSval=1157138 TSecr=29978729
278 2.707097170 172.31.31.144 -> 172.31.23.72 TCP 66 6633 → 45540 [ACK] Seq=233 Ack=217 Win=853 Len=0 TSval=1157138 TSecr=29978728
279 2.707099240 172.31.31.144 -> 172.31.23.72 TCP 66 6633 → 45526 [ACK] Seq=169 Ack=169 Win=853 Len=0 TSval=1157138 TSecr=29978729
280 2.707100990 172.31.31.144 -> 172.31.23.72 TCP 66 6633 → 45554 [ACK] Seq=233 Ack=217 Win=853 Len=0 TSval=1157138 TSecr=29978729
281 2.707102615 172.31.31.144 -> 172.31.23.72 TCP 66 6633 → 45552 [ACK] Seq=233 Ack=217 Win=853 Len=0 TSval=1157138 TSecr=29978729
282 2.707104483 172.31.31.144 -> 172.31.23.72 OpenFlow 170 Type: OFPT_FLOW_MOD
283 2.707106791 172.31.31.144 -> 172.31.23.72 TCP 66 6633 → 45548 [ACK] Seq=233 Ack=217 Win=853 Len=0 TSval=1157138 TSecr=29978729
284 2.707108525 172.31.31.144 -> 172.31.23.72 TCP 66 6633 → 45542 [ACK] Seq=233 Ack=217 Win=853 Len=0 TSval=1157138 TSecr=29978729
285 2.707110131 172.31.31.144 -> 172.31.23.72 OpenFlow 170 Type: OFPT_FLOW_MOD
286 2.707113685 172.31.23.72 -> 172.31.31.144 OpenFlow 490 Type: OFPT_FLOW_REMOVED
287 2.707119779 172.31.31.144 -> 172.31.23.72 TCP 66 6633 → 45536 [ACK] Seq=401 Ack=385 Win=853 Len=0 TSval=1157138 TSecr=29978729
288 2.707121977 172.31.31.144 -> 172.31.23.72 TCP 66 6633 → 45520 [ACK] Seq=337 Ack=337 Win=853 Len=0 TSval=1157138 TSecr=29978729
289 2.707123849 172.31.31.144 -> 172.31.23.72 TCP 66 6633 → 45546 [ACK] Seq=233 Ack=217 Win=853 Len=0 TSval=1157138 TSecr=29978729
290 2.707125598 172.31.31.144 -> 172.31.23.72 OpenFlow 170 Type: OFPT_FLOW_MOD
291 2.707127325 172.31.31.144 -> 172.31.23.72 OpenFlow 170 Type: OFPT_FLOW_MOD
292 2.707129006 172.31.31.144 -> 172.31.23.72 OpenFlow 170 Type: OFPT_FLOW_MOD
293 2.707130699 172.31.31.144 -> 172.31.23.72 OpenFlow 178 Type: OFPT_BARRIER_REQUEST
294 2.707132030 172.31.31.144 -> 172.31.23.72 OpenFlow 290 Type: OFPT_BARRIER_REQUEST
295 2.707133460 172.31.31.144 -> 172.31.23.72 OpenFlow 170 Type: OFPT_FLOW_MOD
296 2.707134623 172.31.31.144 -> 172.31.23.72 OpenFlow 170 Type: OFPT_FLOW_MOD
297 2.707135624 172.31.31.144 -> 172.31.23.72 OpenFlow 282 Type: OFPT_BARRIER_REQUEST
298 2.707136768 172.31.31.144 -> 172.31.23.72 OpenFlow 170 Type: OFPT_FLOW_MOD
299 2.707138588 172.31.31.144 -> 172.31.23.72 OpenFlow 170 Type: OFPT_FLOW_MOD
300 2.707140798 172.31.31.144 -> 172.31.23.72 OpenFlow 178 Type: OFPT_BARRIER_REQUEST
301 2.707142203 172.31.31.144 -> 172.31.23.72 OpenFlow 602 Type: OFPT_FLOW_MOD
302 2.707143802 172.31.31.144 -> 172.31.23.72 OpenFlow 170 Type: OFPT_FLOW_MOD
303 2.707145426 172.31.31.144 -> 172.31.23.72 OpenFlow 170 Type: OFPT_FLOW_MOD
304 2.707146773 172.31.31.144 -> 172.31.23.72 OpenFlow 170 Type: OFPT_FLOW_MOD
305 2.707147960 172.31.31.144 -> 172.31.23.72 OpenFlow 74 Type: OFPT_BARRIER_REQUEST
306 2.707149223 172.31.31.144 -> 172.31.23.72 OpenFlow 170 Type: OFPT_FLOW_MOD
307 2.707153342 172.31.31.144 -> 172.31.23.72 OpenFlow 74 Type: OFPT_BARRIER_REQUEST
308 2.707154836 172.31.31.144 -> 172.31.23.72 OpenFlow 274 Type: OFPT_FLOW_MOD
309 2.707157256 172.31.31.144 -> 172.31.23.72 OpenFlow 282 Type: OFPT_BARRIER_REQUEST
310 2.707158594 172.31.31.144 -> 172.31.23.72 OpenFlow 282 Type: OFPT_BARRIER_REQUEST
311 2.707159934 172.31.31.144 -> 172.31.23.72 OpenFlow 394 Type: OFPT_BARRIER_REQUEST
312 2.707161791 172.31.31.144 -> 172.31.23.72 OpenFlow 170 Type: OFPT_FLOW_MOD
313 2.707163282 172.31.31.144 -> 172.31.23.72 OpenFlow 74 Type: OFPT_BARRIER_REQUEST
314 2.707164278 172.31.31.144 -> 172.31.23.72 OpenFlow 178 Type: OFPT_BARRIER_REQUEST
315 2.707165389 172.31.31.144 -> 172.31.23.72 OpenFlow 170 Type: OFPT_FLOW_MOD
316 2.707166565 172.31.31.144 -> 172.31.23.72 OpenFlow 170 Type: OFPT_FLOW_MOD
317 2.707168080 172.31.31.144 -> 172.31.23.72 OpenFlow 170 Type: OFPT_FLOW_MOD
318 2.707169199 172.31.31.144 -> 172.31.23.72 OpenFlow 178 Type: OFPT_BARRIER_REQUEST
319 2.707170561 172.31.31.144 -> 172.31.23.72 OpenFlow 178 Type: OFPT_BARRIER_REQUEST
320 2.707171689 172.31.31.144 -> 172.31.23.72 OpenFlow 74 Type: OFPT_BARRIER_REQUEST
321 2.707172682 172.31.31.144 -> 172.31.23.72 OpenFlow 170 Type: OFPT_FLOW_MOD
322 2.707174180 172.31.31.144 -> 172.31.23.72 OpenFlow 178 Type: OFPT_BARRIER_REQUEST
323 2.707192335 172.31.31.144 -> 172.31.23.72 TCP 66 6633 → 45534 [ACK] Seq=233 Ack=217 Win=853 Len=0 TSval=1157138 TSecr=29978729
324 2.707381139 172.31.31.144 -> 172.31.23.72 TCP 66 6633 → 45508 [ACK] Seq=2529 Ack=1433 Win=853 Len=0 TSval=1157138 TSecr=29978729
325 2.707731682 172.31.23.72 -> 172.31.31.144 TCP 66 45530 → 6633 [ACK] Seq=169 Ack=385 Win=213 Len=0 TSval=29978730 TSecr=1157138
326 2.707742993 172.31.23.72 -> 172.31.31.144 OpenFlow 74 Type: OFPT_BARRIER_REPLY
327 2.707766711 172.31.23.72 -> 172.31.31.144 TCP 66 45514 → 6633 [ACK] Seq=169 Ack=385 Win=213 Len=0 TSval=29978730 TSecr=1157138
328 2.707770777 172.31.23.72 -> 172.31.31.144 OpenFlow 74 Type: OFPT_BARRIER_REPLY
329 2.707794986 172.31.23.72 -> 172.31.31.144 OpenFlow 74 Type: OFPT_BARRIER_REPLY
330 2.707826199 172.31.23.72 -> 172.31.31.144 OpenFlow 74 Type: OFPT_BARRIER_REPLY
331 2.707853286 172.31.23.72 -> 172.31.31.144 OpenFlow 74 Type: OFPT_BARRIER_REPLY
332 2.707894205 172.31.23.72 -> 172.31.31.144 TCP 66 45538 → 6633 [ACK] Seq=385 Ack=617 Win=213 Len=0 TSval=29978730 TSecr=1157138
333 2.707897766 172.31.23.72 -> 172.31.31.144 OpenFlow 74 Type: OFPT_BARRIER_REPLY
334 2.707920255 172.31.23.72 -> 172.31.31.144 TCP 66 45544 → 6633 [ACK] Seq=217 Ack=449 Win=213 Len=0 TSval=29978730 TSecr=1157138
335 2.707923992 172.31.23.72 -> 172.31.31.144 OpenFlow 74 Type: OFPT_BARRIER_REPLY
336 2.707963615 172.31.23.72 -> 172.31.31.144 OpenFlow 74 Type: OFPT_BARRIER_REPLY
337 2.708028380 172.31.23.72 -> 172.31.31.144 OpenFlow 74 Type: OFPT_BARRIER_REPLY
338 2.708082245 172.31.23.72 -> 172.31.31.144 OpenFlow 74 Type: OFPT_BARRIER_REPLY
339 2.708604036 172.31.31.144 -> 172.31.23.72 OpenFlow 170 Type: OFPT_FLOW_MOD
340 2.708612869 172.31.31.144 -> 172.31.23.72 OpenFlow 178 Type: OFPT_BARRIER_REQUEST
341 2.708614999 172.31.31.144 -> 172.31.23.72 OpenFlow 170 Type: OFPT_FLOW_MOD
342 2.708619775 172.31.23.72 -> 172.31.31.144 OpenFlow 90 Type: OFPT_BARRIER_REPLY
343 2.708626108 172.31.31.144 -> 172.31.23.72 OpenFlow 170 Type: OFPT_FLOW_MOD
344 2.708628272 172.31.31.144 -> 172.31.23.72 OpenFlow 178 Type: OFPT_BARRIER_REQUEST
345 2.708629798 172.31.31.144 -> 172.31.23.72 OpenFlow 178 Type: OFPT_BARRIER_REQUEST
346 2.708631611 172.31.31.144 -> 172.31.23.72 OpenFlow 170 Type: OFPT_FLOW_MOD
347 2.708633299 172.31.31.144 -> 172.31.23.72 OpenFlow 170 Type: OFPT_FLOW_MOD
348 2.708634986 172.31.31.144 -> 172.31.23.72 OpenFlow 170 Type: OFPT_FLOW_MOD
349 2.708636486 172.31.31.144 -> 172.31.23.72 OpenFlow 170 Type: OFPT_FLOW_MOD
350 2.708638110 172.31.31.144 -> 172.31.23.72 OpenFlow 178 Type: OFPT_BARRIER_REQUEST
351 2.708639511 172.31.31.144 -> 172.31.23.72 OpenFlow 178 Type: OFPT_BARRIER_REQUEST
352 2.708640839 172.31.31.144 -> 172.31.23.72 OpenFlow 178 Type: OFPT_BARRIER_REQUEST
353 2.708642154 172.31.31.144 -> 172.31.23.72 OpenFlow 170 Type: OFPT_FLOW_MOD
354 2.708643383 172.31.31.144 -> 172.31.23.72 OpenFlow 178 Type: OFPT_FLOW_MOD
355 2.708644512 172.31.31.144 -> 172.31.23.72 OpenFlow 170 Type: OFPT_FLOW_MOD
356 2.708645851 172.31.31.144 -> 172.31.23.72 OpenFlow 170 Type: OFPT_FLOW_MOD
357 2.708647174 172.31.31.144 -> 172.31.23.72 OpenFlow 170 Type: OFPT_FLOW_MOD
358 2.708648753 172.31.31.144 -> 172.31.23.72 OpenFlow 170 Type: OFPT_FLOW_MOD
359 2.708650339 172.31.31.144 -> 172.31.23.72 OpenFlow 170 Type: OFPT_FLOW_MOD
360 2.708651867 172.31.31.144 -> 172.31.23.72 OpenFlow 170 Type: OFPT_FLOW_MOD
361 2.708653418 172.31.31.144 -> 172.31.23.72 OpenFlow 178 Type: OFPT_BARRIER_REQUEST
362 2.708654914 172.31.31.144 -> 172.31.23.72 OpenFlow 170 Type: OFPT_FLOW_MOD
363 2.708656356 172.31.31.144 -> 172.31.23.72 OpenFlow 178 Type: OFPT_BARRIER_REQUEST
364 2.708657706 172.31.31.144 -> 172.31.23.72 OpenFlow 170 Type: OFPT_FLOW_MOD
365 2.708659345 172.31.31.144 -> 172.31.23.72 OpenFlow 178 Type: OFPT_BARRIER_REQUEST
366 2.708660816 172.31.31.144 -> 172.31.23.72 OpenFlow 178 Type: OFPT_BARRIER_REQUEST
367 2.708662314 172.31.31.144 -> 172.31.23.72 OpenFlow 170 Type: OFPT_FLOW_MOD
368 2.708663688 172.31.31.144 -> 172.31.23.72 OpenFlow 178 Type: OFPT_BARRIER_REQUEST
369 2.708664973 172.31.31.144 -> 172.31.23.72 OpenFlow 178 Type: OFPT_BARRIER_REQUEST
370 2.708666293 172.31.31.144 -> 172.31.23.72 OpenFlow 290 Type: OFPT_BARRIER_REQUEST
371 2.708667916 172.31.31.144 -> 172.31.23.72 OpenFlow 170 Type: OFPT_FLOW_MOD
372 2.708669728 172.31.31.144 -> 172.31.23.72 OpenFlow 170 Type: OFPT_FLOW_MOD
373 2.708670861 172.31.31.144 -> 172.31.23.72 OpenFlow 610 Type: OFPT_BARRIER_REQUEST
374 2.708672257 172.31.31.144 -> 172.31.23.72 OpenFlow 170 Type: OFPT_FLOW_MOD
375 2.708673861 172.31.31.144 -> 172.31.23.72 OpenFlow 74 Type: OFPT_BARRIER_REQUEST
376 2.708675214 172.31.31.144 -> 172.31.23.72 OpenFlow 170 Type: OFPT_FLOW_MOD
377 2.708676835 172.31.31.144 -> 172.31.23.72 OpenFlow 178 Type: OFPT_BARRIER_REQUEST
378 2.708678385 172.31.31.144 -> 172.31.23.72 OpenFlow 178 Type: OFPT_BARRIER_REQUEST
379 2.708679849 172.31.31.144 -> 172.31.23.72 OpenFlow 178 Type: OFPT_BARRIER_REQUEST
380 2.708874422 172.31.23.72 -> 172.31.31.144 OpenFlow 74 Type: OFPT_BARRIER_REPLY
381 2.708876946 172.31.23.72 -> 172.31.31.144 OpenFlow 74 Type: OFPT_BARRIER_REPLY
382 2.708878459 172.31.23.72 -> 172.31.31.144 OpenFlow 74 Type: OFPT_BARRIER_REPLY
383 2.708987443 172.31.23.72 -> 172.31.31.144 OpenFlow 90 Type: OFPT_BARRIER_REPLY
384 2.709223640 172.31.31.144 -> 172.31.23.72 TCP 66 6633 → 45510 [ACK] Seq=2001 Ack=209 Win=853 Len=0 TSval=1157139 TSecr=29978730
385 2.709228834 172.31.31.144 -> 172.31.23.72 TCP 66 6633 → 45528 [ACK] Seq=1537 Ack=689 Win=853 Len=0 TSval=1157139 TSecr=29978730
386 2.709231264 172.31.31.144 -> 172.31.23.72 TCP 66 6633 → 45518 [ACK] Seq=2425 Ack=1441 Win=853 Len=0 TSval=1157139 TSecr=29978730
