  1 0.000000000 172.31.31.144 -> 172.31.23.72 TCP 90 6633 → 45508 [PSH, ACK] Seq=1 Ack=1 Win=853 Len=24 TSval=1158434 TSecr=29979578
  2 0.000027032 172.31.31.144 -> 172.31.23.72 TCP 138 6633 → 45508 [PSH, ACK] Seq=25 Ack=1 Win=853 Len=72 TSval=1158434 TSecr=29979578
  3 0.000405009 172.31.23.72 -> 172.31.31.144 OpenFlow 530 Type: OFPT_MULTIPART_REPLY, OFPMP_PORT_STATS
  4 0.000605280 172.31.23.72 -> 172.31.31.144 OpenFlow 6178 Type: OFPT_MULTIPART_REPLY, OFPMP_TABLE
  5 0.000684172 172.31.23.72 -> 172.31.31.144 OpenFlow 2010 Type: OFPT_MULTIPART_REPLY, OFPMP_FLOW
  6 0.000877402 172.31.31.144 -> 172.31.23.72 TCP 66 6633 → 45508 [ACK] Seq=97 Ack=8521 Win=853 Len=0 TSval=1158434 TSecr=29980025
  7 0.080236237 172.31.31.144 -> 172.31.23.72 TCP 90 6633 → 45510 [PSH, ACK] Seq=1 Ack=1 Win=853 Len=24 TSval=1158454 TSecr=29979578
  8 0.080487634 172.31.23.72 -> 172.31.31.144 OpenFlow 642 Type: OFPT_MULTIPART_REPLY, OFPMP_PORT_STATS
  9 0.081387154 172.31.31.144 -> 172.31.23.72 OpenFlow 82 Type: OFPT_MULTIPART_REQUEST, OFPMP_TABLE
 10 0.081396928 172.31.31.144 -> 172.31.23.72 OpenFlow 122 Type: OFPT_MULTIPART_REQUEST, OFPMP_FLOW
 11 0.081676491 172.31.23.72 -> 172.31.31.144 OpenFlow 6178 Type: OFPT_MULTIPART_REPLY, OFPMP_TABLE
 12 0.081772899 172.31.23.72 -> 172.31.31.144 OpenFlow 3674 Type: OFPT_MULTIPART_REPLY, OFPMP_FLOW
 13 0.081987857 172.31.31.144 -> 172.31.23.72 TCP 66 6633 → 45510 [ACK] Seq=97 Ack=10297 Win=853 Len=0 TSval=1158455 TSecr=29980046
 14 0.087527501 172.31.31.144 -> 172.31.23.72 TCP 90 6633 → 45512 [PSH, ACK] Seq=1 Ack=1 Win=853 Len=24 TSval=1158456 TSecr=29979579
 15 0.087546411 172.31.31.144 -> 172.31.23.72 TCP 138 6633 → 45512 [PSH, ACK] Seq=25 Ack=1 Win=853 Len=72 TSval=1158456 TSecr=29979579
 16 0.087723882 172.31.23.72 -> 172.31.31.144 OpenFlow 754 Type: OFPT_MULTIPART_REPLY, OFPMP_PORT_STATS
 17 0.087886608 172.31.23.72 -> 172.31.31.144 OpenFlow 6178 Type: OFPT_MULTIPART_REPLY, OFPMP_TABLE
 18 0.087941030 172.31.31.144 -> 172.31.23.72 TCP 66 6633 → 45512 [ACK] Seq=97 Ack=689 Win=853 Len=0 TSval=1158456 TSecr=29980047
 19 0.087994001 172.31.23.72 -> 172.31.31.144 OpenFlow 2842 Type: OFPT_MULTIPART_REPLY, OFPMP_FLOW
 20 0.088137771 172.31.31.144 -> 172.31.23.72 TCP 66 6633 → 45512 [ACK] Seq=97 Ack=6801 Win=853 Len=0 TSval=1158456 TSecr=29980047
 21 0.088218314 172.31.31.144 -> 172.31.23.72 TCP 66 6633 → 45512 [ACK] Seq=97 Ack=9577 Win=853 Len=0 TSval=1158456 TSecr=29980047
 22 0.121671900 172.31.31.144 -> 172.31.23.72 TCP 90 6633 → 45514 [PSH, ACK] Seq=1 Ack=1 Win=853 Len=24 TSval=1158465 TSecr=29979578
 23 0.121681937 172.31.31.144 -> 172.31.23.72 TCP 138 6633 → 45514 [PSH, ACK] Seq=25 Ack=1 Win=853 Len=72 TSval=1158465 TSecr=29979578
 24 0.121875337 172.31.23.72 -> 172.31.31.144 OpenFlow 642 Type: OFPT_MULTIPART_REPLY, OFPMP_PORT_STATS
 25 0.122039654 172.31.23.72 -> 172.31.31.144 OpenFlow 6178 Type: OFPT_MULTIPART_REPLY, OFPMP_TABLE
 26 0.122102811 172.31.31.144 -> 172.31.23.72 TCP 66 6633 → 45514 [ACK] Seq=97 Ack=577 Win=853 Len=0 TSval=1158465 TSecr=29980056
 27 0.122126385 172.31.23.72 -> 172.31.31.144 OpenFlow 2218 Type: OFPT_MULTIPART_REPLY, OFPMP_FLOW
 28 0.122324588 172.31.31.144 -> 172.31.23.72 TCP 66 6633 → 45514 [ACK] Seq=97 Ack=6689 Win=853 Len=0 TSval=1158465 TSecr=29980056
 29 0.122329912 172.31.31.144 -> 172.31.23.72 TCP 66 6633 → 45514 [ACK] Seq=97 Ack=8841 Win=853 Len=0 TSval=1158465 TSecr=29980056
 30 0.160867951 172.31.31.144 -> 172.31.23.72 TCP 90 6633 → 45516 [PSH, ACK] Seq=1 Ack=1 Win=853 Len=24 TSval=1158474 TSecr=29979578
 31 0.160886713 172.31.31.144 -> 172.31.23.72 TCP 138 6633 → 45516 [PSH, ACK] Seq=25 Ack=1 Win=853 Len=72 TSval=1158474 TSecr=29979578
 32 0.161183797 172.31.23.72 -> 172.31.31.144 OpenFlow 530 Type: OFPT_MULTIPART_REPLY, OFPMP_PORT_STATS
 33 0.161239208 172.31.23.72 -> 172.31.31.144 OpenFlow 554 Type: OFPT_MULTIPART_REPLY, OFPMP_FLOW
 34 0.161370748 172.31.31.144 -> 172.31.23.72 TCP 66 6633 → 45516 [ACK] Seq=97 Ack=465 Win=853 Len=0 TSval=1158474 TSecr=29980065
 35 0.161402656 172.31.31.144 -> 172.31.23.72 TCP 66 6633 → 45516 [ACK] Seq=97 Ack=953 Win=853 Len=0 TSval=1158474 TSecr=29980065
 36 0.161434778 172.31.23.72 -> 172.31.31.144 OpenFlow 6178 Type: OFPT_MULTIPART_REPLY, OFPMP_TABLE
 37 0.161659851 172.31.31.144 -> 172.31.23.72 TCP 66 6633 → 45516 [ACK] Seq=97 Ack=7065 Win=853 Len=0 TSval=1158475 TSecr=29980066
 38 0.202976503 172.31.31.144 -> 172.31.23.72 TCP 122 6633 → 45518 [PSH, ACK] Seq=1 Ack=1 Win=853 Len=56 TSval=1158485 TSecr=29979578
 39 0.202995419 172.31.31.144 -> 172.31.23.72 TCP 106 6633 → 45518 [PSH, ACK] Seq=57 Ack=1 Win=853 Len=40 TSval=1158485 TSecr=29979578
 40 0.203263982 172.31.23.72 -> 172.31.31.144 OpenFlow 2842 Type: OFPT_MULTIPART_REPLY, OFPMP_FLOW
 41 0.203454055 172.31.23.72 -> 172.31.31.144 OpenFlow 6178 Type: OFPT_MULTIPART_REPLY, OFPMP_TABLE
 42 0.203578600 172.31.23.72 -> 172.31.31.144 OpenFlow 754 Type: OFPT_MULTIPART_REPLY, OFPMP_PORT_STATS
 43 0.203703554 172.31.31.144 -> 172.31.23.72 TCP 66 6633 → 45518 [ACK] Seq=97 Ack=8889 Win=853 Len=0 TSval=1158485 TSecr=29980076
 44 0.241651786 172.31.31.144 -> 172.31.23.72 TCP 66 6633 → 45518 [ACK] Seq=97 Ack=9577 Win=853 Len=0 TSval=1158495 TSecr=29980076
 45 0.246093015 172.31.31.144 -> 172.31.23.72 TCP 122 6633 → 45520 [PSH, ACK] Seq=1 Ack=1 Win=853 Len=56 TSval=1158496 TSecr=29979579
 46 0.246104491 172.31.31.144 -> 172.31.23.72 TCP 106 6633 → 45520 [PSH, ACK] Seq=57 Ack=1 Win=853 Len=40 TSval=1158496 TSecr=29979579
 47 0.246438308 172.31.23.72 -> 172.31.31.144 OpenFlow 1594 Type: OFPT_MULTIPART_REPLY, OFPMP_FLOW
 48 0.246561811 172.31.23.72 -> 172.31.31.144 OpenFlow 754 Type: OFPT_MULTIPART_REPLY, OFPMP_PORT_STATS
 49 0.246667265 172.31.31.144 -> 172.31.23.72 TCP 66 6633 → 45520 [ACK] Seq=97 Ack=1529 Win=853 Len=0 TSval=1158496 TSecr=29980087
 50 0.246738936 172.31.23.72 -> 172.31.31.144 OpenFlow 6178 Type: OFPT_MULTIPART_REPLY, OFPMP_TABLE
 51 0.246769644 172.31.31.144 -> 172.31.23.72 TCP 66 6633 → 45520 [ACK] Seq=97 Ack=2217 Win=853 Len=0 TSval=1158496 TSecr=29980087
 52 0.247002886 172.31.31.144 -> 172.31.23.72 TCP 66 6633 → 45520 [ACK] Seq=97 Ack=8329 Win=853 Len=0 TSval=1158496 TSecr=29980087
 53 0.284384376 172.31.31.144 -> 172.31.23.72 TCP 82 6633 → 45522 [PSH, ACK] Seq=1 Ack=1 Win=853 Len=16 TSval=1158505 TSecr=29979579
 54 0.284397295 172.31.31.144 -> 172.31.23.72 TCP 146 6633 → 45522 [PSH, ACK] Seq=17 Ack=1 Win=853 Len=80 TSval=1158505 TSecr=29979579
 55 0.284692577 172.31.23.72 -> 172.31.31.144 OpenFlow 6178 Type: OFPT_MULTIPART_REPLY, OFPMP_TABLE
 56 0.284775102 172.31.23.72 -> 172.31.31.144 OpenFlow 530 Type: OFPT_MULTIPART_REPLY, OFPMP_PORT_STATS
 57 0.284819998 172.31.23.72 -> 172.31.31.144 OpenFlow 970 Type: OFPT_MULTIPART_REPLY, OFPMP_FLOW
 58 0.284959567 172.31.31.144 -> 172.31.23.72 TCP 66 6633 → 45522 [ACK] Seq=97 Ack=6113 Win=853 Len=0 TSval=1158505 TSecr=29980096
 59 0.285000566 172.31.31.144 -> 172.31.23.72 TCP 66 6633 → 45522 [ACK] Seq=97 Ack=6577 Win=853 Len=0 TSval=1158505 TSecr=29980096
 60 0.285068923 172.31.31.144 -> 172.31.23.72 TCP 66 6633 → 45522 [ACK] Seq=97 Ack=7481 Win=853 Len=0 TSval=1158505 TSecr=29980096
 61 0.328522893 172.31.31.144 -> 172.31.23.72 TCP 82 6633 → 45524 [PSH, ACK] Seq=1 Ack=1 Win=853 Len=16 TSval=1158516 TSecr=29979579
 62 0.328546521 172.31.31.144 -> 172.31.23.72 TCP 146 6633 → 45524 [PSH, ACK] Seq=17 Ack=1 Win=853 Len=80 TSval=1158516 TSecr=29979579
 63 0.328848937 172.31.23.72 -> 172.31.31.144 OpenFlow 6178 Type: OFPT_MULTIPART_REPLY, OFPMP_TABLE
 64 0.328930715 172.31.23.72 -> 172.31.31.144 OpenFlow 2010 Type: OFPT_MULTIPART_REPLY, OFPMP_FLOW
 65 0.329041001 172.31.23.72 -> 172.31.31.144 OpenFlow 754 Type: OFPT_MULTIPART_REPLY, OFPMP_PORT_STATS
 66 0.329171948 172.31.31.144 -> 172.31.23.72 TCP 66 6633 → 45524 [ACK] Seq=97 Ack=6113 Win=853 Len=0 TSval=1158516 TSecr=29980107
 67 0.329177884 172.31.31.144 -> 172.31.23.72 TCP 66 6633 → 45524 [ACK] Seq=97 Ack=8057 Win=853 Len=0 TSval=1158516 TSecr=29980107
 68 0.329304293 172.31.31.144 -> 172.31.23.72 TCP 66 6633 → 45524 [ACK] Seq=97 Ack=8745 Win=853 Len=0 TSval=1158516 TSecr=29980107
 69 0.370632857 172.31.31.144 -> 172.31.23.72 TCP 82 6633 → 45526 [PSH, ACK] Seq=1 Ack=1 Win=853 Len=16 TSval=1158527 TSecr=29979553
 70 0.370643616 172.31.31.144 -> 172.31.23.72 TCP 146 6633 → 45526 [PSH, ACK] Seq=17 Ack=1 Win=853 Len=80 TSval=1158527 TSecr=29979553
 71 0.370913543 172.31.23.72 -> 172.31.31.144 OpenFlow 6178 Type: OFPT_MULTIPART_REPLY, OFPMP_TABLE
 72 0.370988687 172.31.23.72 -> 172.31.31.144 OpenFlow 1802 Type: OFPT_MULTIPART_REPLY, OFPMP_FLOW
 73 0.371079749 172.31.23.72 -> 172.31.31.144 OpenFlow 642 Type: OFPT_MULTIPART_REPLY, OFPMP_PORT_STATS
 74 0.371252400 172.31.31.144 -> 172.31.23.72 TCP 66 6633 → 45526 [ACK] Seq=97 Ack=6113 Win=853 Len=0 TSval=1158527 TSecr=29980118
 75 0.371258773 172.31.31.144 -> 172.31.23.72 TCP 66 6633 → 45526 [ACK] Seq=97 Ack=7849 Win=853 Len=0 TSval=1158527 TSecr=29980118
 76 0.371313721 172.31.31.144 -> 172.31.23.72 TCP 66 6633 → 45526 [ACK] Seq=97 Ack=8425 Win=853 Len=0 TSval=1158527 TSecr=29980118
 77 0.432761063 172.31.31.144 -> 172.31.23.72 TCP 90 6633 → 45528 [PSH, ACK] Seq=1 Ack=1 Win=853 Len=24 TSval=1158542 TSecr=29979578
 78 0.432782242 172.31.31.144 -> 172.31.23.72 TCP 138 6633 → 45528 [PSH, ACK] Seq=25 Ack=1 Win=853 Len=72 TSval=1158542 TSecr=29979578
 79 0.433089326 172.31.23.72 -> 172.31.31.144 OpenFlow 754 Type: OFPT_MULTIPART_REPLY, OFPMP_PORT_STATS
 80 0.433201474 172.31.23.72 -> 172.31.31.144 OpenFlow 3258 Type: OFPT_MULTIPART_REPLY, OFPMP_FLOW
 81 0.433275534 172.31.31.144 -> 172.31.23.72 TCP 66 6633 → 45528 [ACK] Seq=97 Ack=689 Win=853 Len=0 TSval=1158542 TSecr=29980133
 82 0.433377967 172.31.23.72 -> 172.31.31.144 OpenFlow 6178 Type: OFPT_MULTIPART_REPLY, OFPMP_TABLE
 83 0.433425166 172.31.31.144 -> 172.31.23.72 TCP 66 6633 → 45528 [ACK] Seq=97 Ack=3881 Win=853 Len=0 TSval=1158542 TSecr=29980133
 84 0.433628879 172.31.31.144 -> 172.31.23.72 TCP 66 6633 → 45528 [ACK] Seq=97 Ack=9993 Win=853 Len=0 TSval=1158543 TSecr=29980133
 85 0.467969330 172.31.31.144 -> 172.31.23.72 TCP 90 6633 → 45530 [PSH, ACK] Seq=1 Ack=1 Win=853 Len=24 TSval=1158551 TSecr=29979554
 86 0.467988151 172.31.31.144 -> 172.31.23.72 TCP 138 6633 → 45530 [PSH, ACK] Seq=25 Ack=1 Win=853 Len=72 TSval=1158551 TSecr=29979554
 87 0.468226448 172.31.23.72 -> 172.31.31.144 OpenFlow 642 Type: OFPT_MULTIPART_REPLY, OFPMP_PORT_STATS
 88 0.468298766 172.31.23.72 -> 172.31.31.144 OpenFlow 1594 Type: OFPT_MULTIPART_REPLY, OFPMP_FLOW
 89 0.468450350 172.31.31.144 -> 172.31.23.72 TCP 66 6633 → 45530 [ACK] Seq=97 Ack=577 Win=853 Len=0 TSval=1158551 TSecr=29980142
 90 0.468474271 172.31.23.72 -> 172.31.31.144 OpenFlow 6178 Type: OFPT_MULTIPART_REPLY, OFPMP_TABLE
 91 0.468518994 172.31.31.144 -> 172.31.23.72 TCP 66 6633 → 45530 [ACK] Seq=97 Ack=2105 Win=853 Len=0 TSval=1158551 TSecr=29980142
 92 0.468761581 172.31.31.144 -> 172.31.23.72 TCP 66 6633 → 45530 [ACK] Seq=97 Ack=8217 Win=853 Len=0 TSval=1158551 TSecr=29980142
 93 0.543193370 172.31.31.144 -> 172.31.23.72 TCP 90 6633 → 45532 [PSH, ACK] Seq=1 Ack=1 Win=853 Len=24 TSval=1158570 TSecr=29979553
 94 0.543538328 172.31.23.72 -> 172.31.31.144 OpenFlow 642 Type: OFPT_MULTIPART_REPLY, OFPMP_PORT_STATS
 95 0.544315354 172.31.31.144 -> 172.31.23.72 OpenFlow 82 Type: OFPT_MULTIPART_REQUEST, OFPMP_TABLE
 96 0.544325729 172.31.31.144 -> 172.31.23.72 OpenFlow 122 Type: OFPT_MULTIPART_REQUEST, OFPMP_FLOW
 97 0.544565463 172.31.23.72 -> 172.31.31.144 OpenFlow 6178 Type: OFPT_MULTIPART_REPLY, OFPMP_TABLE
 98 0.544625183 172.31.23.72 -> 172.31.31.144 OpenFlow 1178 Type: OFPT_MULTIPART_REPLY, OFPMP_FLOW
 99 0.544873886 172.31.31.144 -> 172.31.23.72 TCP 66 6633 → 45532 [ACK] Seq=97 Ack=7801 Win=853 Len=0 TSval=1158570 TSecr=29980161
100 0.588461039 172.31.31.144 -> 172.31.23.72 TCP 90 6633 → 45534 [PSH, ACK] Seq=1 Ack=1 Win=853 Len=24 TSval=1158581 TSecr=29979578
101 0.588479356 172.31.31.144 -> 172.31.23.72 TCP 122 6633 → 45534 [PSH, ACK] Seq=25 Ack=1 Win=853 Len=56 TSval=1158581 TSecr=29979578
102 0.588678813 172.31.23.72 -> 172.31.31.144 OpenFlow 530 Type: OFPT_MULTIPART_REPLY, OFPMP_PORT_STATS
103 0.588741633 172.31.23.72 -> 172.31.31.144 OpenFlow 1178 Type: OFPT_MULTIPART_REPLY, OFPMP_FLOW
104 0.588892593 172.31.31.144 -> 172.31.23.72 TCP 66 6633 → 45534 [ACK] Seq=81 Ack=465 Win=853 Len=0 TSval=1158581 TSecr=29980172
105 0.588936535 172.31.31.144 -> 172.31.23.72 TCP 66 6633 → 45534 [ACK] Seq=81 Ack=1577 Win=853 Len=0 TSval=1158581 TSecr=29980172
106 0.589530311 172.31.31.144 -> 172.31.23.72 OpenFlow 82 Type: OFPT_MULTIPART_REQUEST, OFPMP_TABLE
107 0.589741335 172.31.23.72 -> 172.31.31.144 OpenFlow 6178 Type: OFPT_MULTIPART_REPLY, OFPMP_TABLE
108 0.629677712 172.31.31.144 -> 172.31.23.72 TCP 66 6633 → 45534 [ACK] Seq=97 Ack=7689 Win=853 Len=0 TSval=1158592 TSecr=29980173
109 0.640772999 172.31.31.144 -> 172.31.23.72 TCP 122 6633 → 45536 [PSH, ACK] Seq=1 Ack=1 Win=853 Len=56 TSval=1158594 TSecr=29979578
110 0.640781070 172.31.31.144 -> 172.31.23.72 TCP 106 6633 → 45536 [PSH, ACK] Seq=57 Ack=1 Win=853 Len=40 TSval=1158594 TSecr=29979578
111 0.641029939 172.31.23.72 -> 172.31.31.144 OpenFlow 1802 Type: OFPT_MULTIPART_REPLY, OFPMP_FLOW
112 0.641201407 172.31.23.72 -> 172.31.31.144 OpenFlow 6178 Type: OFPT_MULTIPART_REPLY, OFPMP_TABLE
113 0.641291419 172.31.31.144 -> 172.31.23.72 TCP 66 6633 → 45536 [ACK] Seq=97 Ack=1737 Win=853 Len=0 TSval=1158594 TSecr=29980185
114 0.641302696 172.31.23.72 -> 172.31.31.144 OpenFlow 530 Type: OFPT_MULTIPART_REPLY, OFPMP_PORT_STATS
115 0.641494767 172.31.31.144 -> 172.31.23.72 TCP 66 6633 → 45536 [ACK] Seq=97 Ack=7849 Win=853 Len=0 TSval=1158594 TSecr=29980185
116 0.641501462 172.31.31.144 -> 172.31.23.72 TCP 66 6633 → 45536 [ACK] Seq=97 Ack=8313 Win=853 Len=0 TSval=1158594 TSecr=29980185
117 0.686866281 172.31.31.144 -> 172.31.23.72 TCP 82 6633 → 45538 [PSH, ACK] Seq=1 Ack=1 Win=853 Len=16 TSval=1158606 TSecr=29979579
118 0.686887923 172.31.23.72 -> 172.31.31.144 TCP 66 45538 → 6633 [ACK] Seq=1 Ack=17 Win=213 Len=0 TSval=29980197 TSecr=1158606
119 0.686893855 172.31.31.144 -> 172.31.23.72 TCP 146 6633 → 45538 [PSH, ACK] Seq=17 Ack=1 Win=853 Len=80 TSval=1158606 TSecr=29979579
120 0.686897919 172.31.23.72 -> 172.31.31.144 TCP 66 45538 → 6633 [ACK] Seq=1 Ack=97 Win=213 Len=0 TSval=29980197 TSecr=1158606
121 0.687223652 172.31.23.72 -> 172.31.31.144 OpenFlow 6178 Type: OFPT_MULTIPART_REPLY, OFPMP_TABLE
122 0.687347024 172.31.23.72 -> 172.31.31.144 OpenFlow 754 Type: OFPT_MULTIPART_REPLY, OFPMP_PORT_STATS
123 0.687426878 172.31.23.72 -> 172.31.31.144 OpenFlow 2842 Type: OFPT_MULTIPART_REPLY, OFPMP_FLOW
124 0.687491870 172.31.31.144 -> 172.31.23.72 TCP 66 6633 → 45538 [ACK] Seq=97 Ack=6113 Win=853 Len=0 TSval=1158606 TSecr=29980197
125 0.687522057 172.31.31.144 -> 172.31.23.72 TCP 66 6633 → 45538 [ACK] Seq=97 Ack=6801 Win=853 Len=0 TSval=1158606 TSecr=29980197
126 0.687648886 172.31.31.144 -> 172.31.23.72 TCP 66 6633 → 45538 [ACK] Seq=97 Ack=9577 Win=853 Len=0 TSval=1158606 TSecr=29980197
127 0.737017432 172.31.31.144 -> 172.31.23.72 TCP 90 6633 → 45540 [PSH, ACK] Seq=1 Ack=1 Win=853 Len=24 TSval=1158618 TSecr=29979578
128 0.737356536 172.31.23.72 -> 172.31.31.144 OpenFlow 754 Type: OFPT_MULTIPART_REPLY, OFPMP_PORT_STATS
129 0.738126692 172.31.31.144 -> 172.31.23.72 OpenFlow 82 Type: OFPT_MULTIPART_REQUEST, OFPMP_TABLE
130 0.738137067 172.31.31.144 -> 172.31.23.72 OpenFlow 122 Type: OFPT_MULTIPART_REQUEST, OFPMP_FLOW
131 0.738404223 172.31.23.72 -> 172.31.31.144 OpenFlow 6178 Type: OFPT_MULTIPART_REPLY, OFPMP_TABLE
132 0.738499015 172.31.23.72 -> 172.31.31.144 OpenFlow 2634 Type: OFPT_MULTIPART_REPLY, OFPMP_FLOW
133 0.738744177 172.31.31.144 -> 172.31.23.72 TCP 66 6633 → 45540 [ACK] Seq=97 Ack=9369 Win=853 Len=0 TSval=1158619 TSecr=29980210
134 0.788431132 172.31.31.144 -> 172.31.23.72 TCP 82 6633 → 45542 [PSH, ACK] Seq=1 Ack=1 Win=853 Len=16 TSval=1158631 TSecr=29979578
135 0.788457946 172.31.31.144 -> 172.31.23.72 TCP 146 6633 → 45542 [PSH, ACK] Seq=17 Ack=1 Win=853 Len=80 TSval=1158631 TSecr=29979578
136 0.788907348 172.31.23.72 -> 172.31.31.144 OpenFlow 6178 Type: OFPT_MULTIPART_REPLY, OFPMP_TABLE
137 0.788984046 172.31.23.72 -> 172.31.31.144 OpenFlow 2010 Type: OFPT_MULTIPART_REPLY, OFPMP_FLOW
138 0.789074547 172.31.23.72 -> 172.31.31.144 OpenFlow 530 Type: OFPT_MULTIPART_REPLY, OFPMP_PORT_STATS
139 0.789172852 172.31.31.144 -> 172.31.23.72 TCP 66 6633 → 45542 [ACK] Seq=97 Ack=6113 Win=853 Len=0 TSval=1158631 TSecr=29980222
140 0.789239648 172.31.31.144 -> 172.31.23.72 TCP 66 6633 → 45542 [ACK] Seq=97 Ack=8057 Win=853 Len=0 TSval=1158631 TSecr=29980222
141 0.789309891 172.31.31.144 -> 172.31.23.72 TCP 66 6633 → 45542 [ACK] Seq=97 Ack=8521 Win=853 Len=0 TSval=1158631 TSecr=29980222
142 0.850548785 172.31.31.144 -> 172.31.23.72 TCP 122 6633 → 45544 [PSH, ACK] Seq=1 Ack=1 Win=853 Len=56 TSval=1158647 TSecr=29979553
143 0.850571122 172.31.31.144 -> 172.31.23.72 TCP 106 6633 → 45544 [PSH, ACK] Seq=57 Ack=1 Win=853 Len=40 TSval=1158647 TSecr=29979553
144 0.850853473 172.31.23.72 -> 172.31.31.144 OpenFlow 2218 Type: OFPT_MULTIPART_REPLY, OFPMP_FLOW
145 0.851027465 172.31.23.72 -> 172.31.31.144 OpenFlow 6178 Type: OFPT_MULTIPART_REPLY, OFPMP_TABLE
146 0.851117457 172.31.31.144 -> 172.31.23.72 TCP 66 6633 → 45544 [ACK] Seq=97 Ack=2153 Win=853 Len=0 TSval=1158647 TSecr=29980238
147 0.851135970 172.31.23.72 -> 172.31.31.144 OpenFlow 530 Type: OFPT_MULTIPART_REPLY, OFPMP_PORT_STATS
148 0.851301006 172.31.31.144 -> 172.31.23.72 TCP 66 6633 → 45544 [ACK] Seq=97 Ack=8265 Win=853 Len=0 TSval=1158647 TSecr=29980238
149 0.851382427 172.31.31.144 -> 172.31.23.72 TCP 66 6633 → 45544 [ACK] Seq=97 Ack=8729 Win=853 Len=0 TSval=1158647 TSecr=29980238
150 0.910684407 172.31.31.144 -> 172.31.23.72 TCP 122 6633 → 45546 [PSH, ACK] Seq=1 Ack=1 Win=853 Len=56 TSval=1158662 TSecr=29979578
151 0.910705833 172.31.31.144 -> 172.31.23.72 TCP 106 6633 → 45546 [PSH, ACK] Seq=57 Ack=1 Win=853 Len=40 TSval=1158662 TSecr=29979578
152 0.910929785 172.31.23.72 -> 172.31.31.144 OpenFlow 2218 Type: OFPT_MULTIPART_REPLY, OFPMP_FLOW
153 0.911105300 172.31.23.72 -> 172.31.31.144 OpenFlow 6178 Type: OFPT_MULTIPART_REPLY, OFPMP_TABLE
154 0.911216468 172.31.23.72 -> 172.31.31.144 OpenFlow 642 Type: OFPT_MULTIPART_REPLY, OFPMP_PORT_STATS
155 0.911342010 172.31.31.144 -> 172.31.23.72 TCP 66 6633 → 45546 [ACK] Seq=97 Ack=2153 Win=853 Len=0 TSval=1158662 TSecr=29980253
156 0.911407178 172.31.31.144 -> 172.31.23.72 TCP 66 6633 → 45546 [ACK] Seq=97 Ack=8265 Win=853 Len=0 TSval=1158662 TSecr=29980253
157 0.911516812 172.31.31.144 -> 172.31.23.72 TCP 66 6633 → 45546 [ACK] Seq=97 Ack=8841 Win=853 Len=0 TSval=1158662 TSecr=29980253
158 0.975813154 172.31.31.144 -> 172.31.23.72 TCP 122 6633 → 45548 [PSH, ACK] Seq=1 Ack=1 Win=853 Len=56 TSval=1158678 TSecr=29979578
159 0.975837608 172.31.31.144 -> 172.31.23.72 TCP 106 6633 → 45548 [PSH, ACK] Seq=57 Ack=1 Win=853 Len=40 TSval=1158678 TSecr=29979578
160 0.976181263 172.31.23.72 -> 172.31.31.144 OpenFlow 2426 Type: OFPT_MULTIPART_REPLY, OFPMP_FLOW
161 0.976293814 172.31.23.72 -> 172.31.31.144 OpenFlow 642 Type: OFPT_MULTIPART_REPLY, OFPMP_PORT_STATS
162 0.976385210 172.31.31.144 -> 172.31.23.72 TCP 66 6633 → 45548 [ACK] Seq=97 Ack=2361 Win=853 Len=0 TSval=1158678 TSecr=29980269
163 0.976474421 172.31.23.72 -> 172.31.31.144 OpenFlow 6178 Type: OFPT_MULTIPART_REPLY, OFPMP_TABLE
164 0.976484857 172.31.31.144 -> 172.31.23.72 TCP 66 6633 → 45548 [ACK] Seq=97 Ack=2937 Win=853 Len=0 TSval=1158678 TSecr=29980269
165 0.976699562 172.31.31.144 -> 172.31.23.72 TCP 66 6633 → 45548 [ACK] Seq=97 Ack=9049 Win=853 Len=0 TSval=1158678 TSecr=29980269
166 1.038101061 172.31.31.144 -> 172.31.23.72 TCP 122 6633 → 45550 [PSH, ACK] Seq=1 Ack=1 Win=853 Len=56 TSval=1158694 TSecr=29979579
167 1.038143053 172.31.31.144 -> 172.31.23.72 TCP 106 6633 → 45550 [PSH, ACK] Seq=57 Ack=1 Win=853 Len=40 TSval=1158694 TSecr=29979579
168 1.038421385 172.31.23.72 -> 172.31.31.144 OpenFlow 346 Type: OFPT_MULTIPART_REPLY, OFPMP_FLOW
169 1.038590607 172.31.23.72 -> 172.31.31.144 OpenFlow 6178 Type: OFPT_MULTIPART_REPLY, OFPMP_TABLE
170 1.038636081 172.31.31.144 -> 172.31.23.72 TCP 66 6633 → 45550 [ACK] Seq=97 Ack=281 Win=853 Len=0 TSval=1158694 TSecr=29980285
171 1.038740437 172.31.23.72 -> 172.31.31.144 OpenFlow 642 Type: OFPT_MULTIPART_REPLY, OFPMP_PORT_STATS
172 1.038848554 172.31.31.144 -> 172.31.23.72 TCP 66 6633 → 45550 [ACK] Seq=97 Ack=6393 Win=853 Len=0 TSval=1158694 TSecr=29980285
173 1.038912340 172.31.31.144 -> 172.31.23.72 TCP 66 6633 → 45550 [ACK] Seq=97 Ack=6969 Win=853 Len=0 TSval=1158694 TSecr=29980285
174 1.078198667 172.31.31.144 -> 172.31.23.72 TCP 82 6633 → 45552 [PSH, ACK] Seq=1 Ack=1 Win=853 Len=16 TSval=1158704 TSecr=29979579
175 1.078217523 172.31.31.144 -> 172.31.23.72 TCP 146 6633 → 45552 [PSH, ACK] Seq=17 Ack=1 Win=853 Len=80 TSval=1158704 TSecr=29979579
176 1.078557965 172.31.23.72 -> 172.31.31.144 OpenFlow 6178 Type: OFPT_MULTIPART_REPLY, OFPMP_TABLE
177 1.078669300 172.31.23.72 -> 172.31.31.144 OpenFlow 642 Type: OFPT_MULTIPART_REPLY, OFPMP_PORT_STATS
178 1.078738803 172.31.23.72 -> 172.31.31.144 OpenFlow 2010 Type: OFPT_MULTIPART_REPLY, OFPMP_FLOW
179 1.078890835 172.31.31.144 -> 172.31.23.72 TCP 66 6633 → 45552 [ACK] Seq=97 Ack=6113 Win=853 Len=0 TSval=1158704 TSecr=29980295
180 1.078897901 172.31.31.144 -> 172.31.23.72 TCP 66 6633 → 45552 [ACK] Seq=97 Ack=6689 Win=853 Len=0 TSval=1158704 TSecr=29980295
181 1.079001932 172.31.31.144 -> 172.31.23.72 TCP 66 6633 → 45552 [ACK] Seq=97 Ack=8633 Win=853 Len=0 TSval=1158704 TSecr=29980295
182 1.107329003 172.31.31.144 -> 172.31.23.72 TCP 122 6633 → 45554 [PSH, ACK] Seq=1 Ack=1 Win=853 Len=56 TSval=1158711 TSecr=29979579
183 1.107354811 172.31.31.144 -> 172.31.23.72 TCP 106 6633 → 45554 [PSH, ACK] Seq=57 Ack=1 Win=853 Len=40 TSval=1158711 TSecr=29979579
184 1.107683308 172.31.23.72 -> 172.31.31.144 OpenFlow 2010 Type: OFPT_MULTIPART_REPLY, OFPMP_FLOW
185 1.107785347 172.31.23.72 -> 172.31.31.144 OpenFlow 530 Type: OFPT_MULTIPART_REPLY, OFPMP_PORT_STATS
186 1.107907857 172.31.31.144 -> 172.31.23.72 TCP 66 6633 → 45554 [ACK] Seq=97 Ack=1945 Win=853 Len=0 TSval=1158711 TSecr=29980302
187 1.107959572 172.31.31.144 -> 172.31.23.72 TCP 66 6633 → 45554 [ACK] Seq=97 Ack=2409 Win=853 Len=0 TSval=1158711 TSecr=29980302
188 1.107976178 172.31.23.72 -> 172.31.31.144 OpenFlow 6178 Type: OFPT_MULTIPART_REPLY, OFPMP_TABLE
189 1.108211679 172.31.31.144 -> 172.31.23.72 TCP 66 6633 → 45554 [ACK] Seq=97 Ack=8521 Win=853 Len=0 TSval=1158711 TSecr=29980302
190 1.110096525 172.31.31.144 -> 172.31.23.72 OpenFlow 187 Type: OFPT_PACKET_OUT
191 1.110146118 172.31.31.144 -> 172.31.23.72 OpenFlow 187 Type: OFPT_PACKET_OUT
192 1.110208572 172.31.31.144 -> 172.31.23.72 OpenFlow 187 Type: OFPT_PACKET_OUT
193 1.110263094 172.31.31.144 -> 172.31.23.72 OpenFlow 187 Type: OFPT_PACKET_OUT
194 1.110312585 172.31.31.144 -> 172.31.23.72 OpenFlow 187 Type: OFPT_PACKET_OUT
195 1.110363488 172.31.31.144 -> 172.31.23.72 OpenFlow 187 Type: OFPT_PACKET_OUT
196 1.110430743 172.31.31.144 -> 172.31.23.72 OpenFlow 187 Type: OFPT_PACKET_OUT
197 1.110509679 172.31.23.72 -> 172.31.31.144 TCP 66 45546 → 6633 [ACK] Seq=8841 Ack=944 Win=213 Len=0 TSval=29980303 TSecr=1158712
198 1.110522218 172.31.31.144 -> 172.31.23.72 OpenFlow 187 Type: OFPT_PACKET_OUT
199 1.110577827 172.31.31.144 -> 172.31.23.72 OpenFlow 187 Type: OFPT_PACKET_OUT
200 1.110627598 172.31.31.144 -> 172.31.23.72 OpenFlow 187 Type: OFPT_PACKET_OUT
201 1.110684626 172.31.31.144 -> 172.31.23.72 OpenFlow 187 Type: OFPT_PACKET_OUT
202 1.110741843 172.31.31.144 -> 172.31.23.72 OpenFlow 187 Type: OFPT_PACKET_OUT
203 1.110796188 172.31.31.144 -> 172.31.23.72 OpenFlow 187 Type: OFPT_PACKET_OUT
204 1.110856954 172.31.31.144 -> 172.31.23.72 OpenFlow 187 Type: OFPT_PACKET_OUT
205 1.110912473 172.31.31.144 -> 172.31.23.72 OpenFlow 187 Type: OFPT_PACKET_OUT
206 1.110933911 172.31.23.72 -> 172.31.31.144 TCP 66 45534 → 6633 [ACK] Seq=7689 Ack=823 Win=213 Len=0 TSval=29980303 TSecr=1158712
207 1.110990700 172.31.31.144 -> 172.31.23.72 OpenFlow 187 Type: OFPT_PACKET_OUT
208 1.110995722 172.31.31.144 -> 172.31.23.72 OpenFlow 187 Type: OFPT_PACKET_OUT
209 1.111091063 172.31.31.144 -> 172.31.23.72 OpenFlow 187 Type: OFPT_PACKET_OUT
210 1.111096160 172.31.31.144 -> 172.31.23.72 OpenFlow 187 Type: OFPT_PACKET_OUT
211 1.111162053 172.31.31.144 -> 172.31.23.72 OpenFlow 187 Type: OFPT_PACKET_OUT
212 1.111195572 172.31.31.144 -> 172.31.23.72 OpenFlow 187 Type: OFPT_PACKET_OUT
213 1.111250203 172.31.31.144 -> 172.31.23.72 OpenFlow 187 Type: OFPT_PACKET_OUT
214 1.111326329 172.31.31.144 -> 172.31.23.72 OpenFlow 187 Type: OFPT_PACKET_OUT
215 1.111358594 172.31.31.144 -> 172.31.23.72 OpenFlow 187 Type: OFPT_PACKET_OUT
216 1.111376198 172.31.23.72 -> 172.31.31.144 TCP 66 45530 → 6633 [ACK] Seq=8217 Ack=1065 Win=213 Len=0 TSval=29980303 TSecr=1158712
217 1.111417280 172.31.31.144 -> 172.31.23.72 OpenFlow 187 Type: OFPT_PACKET_OUT
218 1.111486426 172.31.31.144 -> 172.31.23.72 OpenFlow 187 Type: OFPT_PACKET_OUT
219 1.111565620 172.31.31.144 -> 172.31.23.72 OpenFlow 308 Type: OFPT_PACKET_OUT
220 1.111626714 172.31.23.72 -> 172.31.31.144 TCP 66 45514 → 6633 [ACK] Seq=8841 Ack=823 Win=213 Len=0 TSval=29980303 TSecr=1158712
221 1.111638120 172.31.31.144 -> 172.31.23.72 OpenFlow 187 Type: OFPT_PACKET_OUT
222 1.111717941 172.31.31.144 -> 172.31.23.72 OpenFlow 187 Type: OFPT_PACKET_OUT
223 1.111745080 172.31.31.144 -> 172.31.23.72 OpenFlow 187 Type: OFPT_PACKET_OUT
224 1.111755247 172.31.23.72 -> 172.31.31.144 TCP 66 45514 → 6633 [ACK] Seq=8841 Ack=1065 Win=213 Len=0 TSval=29980303 TSecr=1158712
225 1.111797879 172.31.31.144 -> 172.31.23.72 OpenFlow 187 Type: OFPT_PACKET_OUT
226 1.111834422 172.31.23.72 -> 172.31.31.144 OpenFlow 189 Type: OFPT_PACKET_IN
227 1.111875876 172.31.31.144 -> 172.31.23.72 OpenFlow 187 Type: OFPT_PACKET_OUT
228 1.111882446 172.31.23.72 -> 172.31.31.144 OpenFlow 189 Type: OFPT_PACKET_IN
229 1.111916502 172.31.31.144 -> 172.31.23.72 OpenFlow 187 Type: OFPT_PACKET_OUT
230 1.111999133 172.31.31.144 -> 172.31.23.72 OpenFlow 187 Type: OFPT_PACKET_OUT
231 1.112047280 172.31.31.144 -> 172.31.23.72 OpenFlow 187 Type: OFPT_PACKET_OUT
232 1.112099965 172.31.31.144 -> 172.31.23.72 OpenFlow 187 Type: OFPT_PACKET_OUT
233 1.112182810 172.31.23.72 -> 172.31.31.144 TCP 66 45528 → 6633 [ACK] Seq=10239 Ack=944 Win=213 Len=0 TSval=29980303 TSecr=1158712
234 1.112259873 172.31.31.144 -> 172.31.23.72 OpenFlow 187 Type: OFPT_PACKET_OUT
235 1.112265166 172.31.23.72 -> 172.31.31.144 OpenFlow 189 Type: OFPT_PACKET_IN
236 1.112345330 172.31.23.72 -> 172.31.31.144 OpenFlow 189 Type: OFPT_PACKET_IN
237 1.112364819 172.31.31.144 -> 172.31.23.72 OpenFlow 187 Type: OFPT_PACKET_OUT
238 1.112368599 172.31.31.144 -> 172.31.23.72 OpenFlow 187 Type: OFPT_PACKET_OUT
239 1.112370459 172.31.31.144 -> 172.31.23.72 OpenFlow 308 Type: OFPT_PACKET_OUT
240 1.112372536 172.31.31.144 -> 172.31.23.72 OpenFlow 187 Type: OFPT_PACKET_OUT
241 1.112375912 172.31.23.72 -> 172.31.31.144 OpenFlow 189 Type: OFPT_PACKET_IN
242 1.112387112 172.31.23.72 -> 172.31.31.144 OpenFlow 189 Type: OFPT_PACKET_IN
243 1.112403964 172.31.23.72 -> 172.31.31.144 OpenFlow 189 Type: OFPT_PACKET_IN
244 1.112420682 172.31.23.72 -> 172.31.31.144 OpenFlow 189 Type: OFPT_PACKET_IN
245 1.112423585 172.31.23.72 -> 172.31.31.144 OpenFlow 189 Type: OFPT_PACKET_IN
246 1.112437481 172.31.23.72 -> 172.31.31.144 OpenFlow 189 Type: OFPT_PACKET_IN
247 1.112455510 172.31.23.72 -> 172.31.31.144 OpenFlow 189 Type: OFPT_PACKET_IN
248 1.112470285 172.31.31.144 -> 172.31.23.72 OpenFlow 187 Type: OFPT_PACKET_OUT
249 1.112480619 172.31.31.144 -> 172.31.23.72 OpenFlow 187 Type: OFPT_PACKET_OUT
250 1.112497675 172.31.23.72 -> 172.31.31.144 OpenFlow 189 Type: OFPT_PACKET_IN
251 1.112527181 172.31.23.72 -> 172.31.31.144 OpenFlow 189 Type: OFPT_PACKET_IN
252 1.112540319 172.31.23.72 -> 172.31.31.144 OpenFlow 189 Type: OFPT_PACKET_IN
253 1.112552518 172.31.23.72 -> 172.31.31.144 OpenFlow 189 Type: OFPT_PACKET_IN
254 1.112567284 172.31.23.72 -> 172.31.31.144 OpenFlow 189 Type: OFPT_PACKET_IN
255 1.112584023 172.31.23.72 -> 172.31.31.144 OpenFlow 189 Type: OFPT_PACKET_IN
256 1.112677042 172.31.23.72 -> 172.31.31.144 OpenFlow 189 Type: OFPT_PACKET_IN
257 1.112681405 172.31.23.72 -> 172.31.31.144 OpenFlow 189 Type: OFPT_PACKET_IN
258 1.112683490 172.31.23.72 -> 172.31.31.144 OpenFlow 435 Type: OFPT_PACKET_IN
259 1.112685237 172.31.23.72 -> 172.31.31.144 OpenFlow 189 Type: OFPT_PACKET_IN
260 1.112804996 172.31.23.72 -> 172.31.31.144 TCP 66 45528 → 6633 [ACK] Seq=10239 Ack=1307 Win=213 Len=0 TSval=29980303 TSecr=1158712
261 1.112809151 172.31.23.72 -> 172.31.31.144 OpenFlow 435 Type: OFPT_PACKET_IN
262 1.112811343 172.31.23.72 -> 172.31.31.144 OpenFlow 189 Type: OFPT_PACKET_IN
263 1.112813547 172.31.23.72 -> 172.31.31.144 OpenFlow 189 Type: OFPT_PACKET_IN
264 1.112988406 172.31.23.72 -> 172.31.31.144 TCP 66 45518 → 6633 [ACK] Seq=9823 Ack=702 Win=213 Len=0 TSval=29980303 TSecr=1158712
265 1.112991998 172.31.23.72 -> 172.31.31.144 OpenFlow 189 Type: OFPT_PACKET_IN
266 1.112994224 172.31.23.72 -> 172.31.31.144 OpenFlow 189 Type: OFPT_PACKET_IN
267 1.113073279 172.31.31.144 -> 172.31.23.72 OpenFlow 187 Type: OFPT_PACKET_OUT
268 1.113078547 172.31.31.144 -> 172.31.23.72 TCP 66 6633 → 45518 [ACK] Seq=823 Ack=9700 Win=853 Len=0 TSval=1158712 TSecr=29980303
269 1.113082115 172.31.31.144 -> 172.31.23.72 OpenFlow 187 Type: OFPT_PACKET_OUT
270 1.113083860 172.31.31.144 -> 172.31.23.72 TCP 66 6633 → 45512 [ACK] Seq=97 Ack=9700 Win=853 Len=0 TSval=1158712 TSecr=29980303
271 1.113085955 172.31.31.144 -> 172.31.23.72 OpenFlow 187 Type: OFPT_PACKET_OUT
272 1.113087634 172.31.31.144 -> 172.31.23.72 OpenFlow 308 Type: OFPT_PACKET_OUT
273 1.113089747 172.31.31.144 -> 172.31.23.72 TCP 66 6633 → 45538 [ACK] Seq=97 Ack=9700 Win=853 Len=0 TSval=1158712 TSecr=29980303
274 1.113091754 172.31.31.144 -> 172.31.23.72 TCP 66 6633 → 45544 [ACK] Seq=97 Ack=8852 Win=853 Len=0 TSval=1158712 TSecr=29980303
275 1.113095173 172.31.23.72 -> 172.31.31.144 OpenFlow 312 Type: OFPT_PACKET_IN
276 1.113097189 172.31.31.144 -> 172.31.23.72 TCP 66 6633 → 45512 [ACK] Seq=97 Ack=9823 Win=853 Len=0 TSval=1158712 TSecr=29980303
277 1.113099116 172.31.31.144 -> 172.31.23.72 TCP 66 6633 → 45524 [ACK] Seq=97 Ack=8868 Win=853 Len=0 TSval=1158712 TSecr=29980303
278 1.113101162 172.31.31.144 -> 172.31.23.72 OpenFlow 187 Type: OFPT_PACKET_OUT
279 1.113102957 172.31.31.144 -> 172.31.23.72 OpenFlow 187 Type: OFPT_PACKET_OUT
280 1.113104967 172.31.31.144 -> 172.31.23.72 OpenFlow 187 Type: OFPT_PACKET_OUT
281 1.113106371 172.31.31.144 -> 172.31.23.72 TCP 66 6633 → 45522 [ACK] Seq=97 Ack=7604 Win=853 Len=0 TSval=1158712 TSecr=29980303
282 1.113108275 172.31.31.144 -> 172.31.23.72 TCP 66 6633 → 45526 [ACK] Seq=97 Ack=8548 Win=853 Len=0 TSval=1158712 TSecr=29980303
283 1.113110200 172.31.31.144 -> 172.31.23.72 TCP 66 6633 → 45548 [ACK] Seq=97 Ack=9172 Win=853 Len=0 TSval=1158712 TSecr=29980303
284 1.113118920 172.31.23.72 -> 172.31.31.144 OpenFlow 312 Type: OFPT_PACKET_IN
285 1.113146290 172.31.23.72 -> 172.31.31.144 OpenFlow 189 Type: OFPT_PACKET_IN
286 1.113149057 172.31.23.72 -> 172.31.31.144 OpenFlow 189 Type: OFPT_PACKET_IN
287 1.113180612 172.31.23.72 -> 172.31.31.144 OpenFlow 189 Type: OFPT_PACKET_IN
288 1.113206161 172.31.23.72 -> 172.31.31.144 OpenFlow 189 Type: OFPT_PACKET_IN
289 1.113208439 172.31.23.72 -> 172.31.31.144 OpenFlow 189 Type: OFPT_PACKET_IN
290 1.113507478 172.31.23.72 -> 172.31.31.144 TCP 66 45518 → 6633 [ACK] Seq=9823 Ack=1307 Win=213 Len=0 TSval=29980304 TSecr=1158712
291 1.113642153 172.31.23.72 -> 172.31.31.144 TCP 66 45512 → 6633 [ACK] Seq=9823 Ack=460 Win=213 Len=0 TSval=29980304 TSecr=1158712
292 1.113711156 172.31.23.72 -> 172.31.31.144 OpenFlow 189 Type: OFPT_PACKET_IN
293 1.113758158 172.31.31.144 -> 172.31.23.72 OpenFlow 187 Type: OFPT_PACKET_OUT
294 1.113762525 172.31.31.144 -> 172.31.23.72 TCP 66 6633 → 45542 [ACK] Seq=97 Ack=8644 Win=853 Len=0 TSval=1158712 TSecr=29980303
295 1.113765929 172.31.31.144 -> 172.31.23.72 OpenFlow 187 Type: OFPT_PACKET_OUT
296 1.113767640 172.31.31.144 -> 172.31.23.72 TCP 66 6633 → 45536 [ACK] Seq=97 Ack=8436 Win=853 Len=0 TSval=1158712 TSecr=29980303
297 1.113770903 172.31.23.72 -> 172.31.31.144 OpenFlow 189 Type: OFPT_PACKET_IN
298 1.113772752 172.31.31.144 -> 172.31.23.72 OpenFlow 187 Type: OFPT_PACKET_OUT
299 1.113774072 172.31.31.144 -> 172.31.23.72 TCP 66 6633 → 45520 [ACK] Seq=97 Ack=8452 Win=853 Len=0 TSval=1158712 TSecr=29980303
300 1.113776084 172.31.31.144 -> 172.31.23.72 TCP 66 6633 → 45516 [ACK] Seq=97 Ack=7188 Win=853 Len=0 TSval=1158712 TSecr=29980303
301 1.113777992 172.31.31.144 -> 172.31.23.72 OpenFlow 187 Type: OFPT_PACKET_OUT
302 1.113779806 172.31.31.144 -> 172.31.23.72 TCP 66 6633 → 45530 [ACK] Seq=1065 Ack=8340 Win=853 Len=0 TSval=1158712 TSecr=29980303
303 1.113781734 172.31.31.144 -> 172.31.23.72 TCP 66 6633 → 45538 [ACK] Seq=97 Ack=9823 Win=853 Len=0 TSval=1158712 TSecr=29980303
304 1.113784010 172.31.31.144 -> 172.31.23.72 OpenFlow 187 Type: OFPT_PACKET_OUT
305 1.113785454 172.31.31.144 -> 172.31.23.72 TCP 66 6633 → 45532 [ACK] Seq=97 Ack=8293 Win=853 Len=0 TSval=1158712 TSecr=29980303
306 1.113788060 172.31.31.144 -> 172.31.23.72 TCP 66 6633 → 45544 [ACK] Seq=97 Ack=8975 Win=853 Len=0 TSval=1158712 TSecr=29980303
307 1.113790047 172.31.31.144 -> 172.31.23.72 OpenFlow 187 Type: OFPT_PACKET_OUT
308 1.113791893 172.31.31.144 -> 172.31.23.72 TCP 66 6633 → 45524 [ACK] Seq=97 Ack=9237 Win=853 Len=0 TSval=1158712 TSecr=29980303
309 1.113794016 172.31.23.72 -> 172.31.31.144 OpenFlow 189 Type: OFPT_PACKET_IN
310 1.113795860 172.31.31.144 -> 172.31.23.72 OpenFlow 187 Type: OFPT_PACKET_OUT
311 1.113797505 172.31.31.144 -> 172.31.23.72 TCP 66 6633 → 45522 [ACK] Seq=97 Ack=7727 Win=853 Len=0 TSval=1158713 TSecr=29980303
312 1.113799616 172.31.31.144 -> 172.31.23.72 TCP 66 6633 → 45526 [ACK] Seq=97 Ack=8671 Win=853 Len=0 TSval=1158713 TSecr=29980303
313 1.113801529 172.31.31.144 -> 172.31.23.72 OpenFlow 187 Type: OFPT_PACKET_OUT
314 1.113803303 172.31.31.144 -> 172.31.23.72 TCP 66 6633 → 45548 [ACK] Seq=97 Ack=9295 Win=853 Len=0 TSval=1158713 TSecr=29980303
315 1.113804946 172.31.31.144 -> 172.31.23.72 TCP 66 6633 → 45542 [ACK] Seq=97 Ack=8767 Win=853 Len=0 TSval=1158713 TSecr=29980303
316 1.113936161 172.31.23.72 -> 172.31.31.144 OpenFlow 435 Type: OFPT_PACKET_IN
317 1.113943165 172.31.23.72 -> 172.31.31.144 OpenFlow 189 Type: OFPT_PACKET_IN
318 1.113945936 172.31.23.72 -> 172.31.31.144 OpenFlow 189 Type: OFPT_PACKET_IN
319 1.113958594 172.31.23.72 -> 172.31.31.144 OpenFlow 189 Type: OFPT_PACKET_IN
320 1.114170930 172.31.23.72 -> 172.31.31.144 TCP 66 45512 → 6633 [ACK] Seq=9823 Ack=1307 Win=213 Len=0 TSval=29980304 TSecr=1158712
321 1.114218257 172.31.31.144 -> 172.31.23.72 OpenFlow 187 Type: OFPT_PACKET_OUT
322 1.114223879 172.31.31.144 -> 172.31.23.72 TCP 66 6633 → 45544 [ACK] Seq=97 Ack=9221 Win=853 Len=0 TSval=1158713 TSecr=29980303
323 1.114230089 172.31.31.144 -> 172.31.23.72 OpenFlow 187 Type: OFPT_PACKET_OUT
324 1.114231768 172.31.31.144 -> 172.31.23.72 TCP 66 6633 → 45536 [ACK] Seq=97 Ack=8682 Win=853 Len=0 TSval=1158713 TSecr=29980303
325 1.114233943 172.31.31.144 -> 172.31.23.72 OpenFlow 187 Type: OFPT_PACKET_OUT
326 1.114235314 172.31.31.144 -> 172.31.23.72 TCP 66 6633 → 45516 [ACK] Seq=97 Ack=7311 Win=853 Len=0 TSval=1158713 TSecr=29980303
327 1.114237148 172.31.31.144 -> 172.31.23.72 OpenFlow 187 Type: OFPT_PACKET_OUT
328 1.114238617 172.31.31.144 -> 172.31.23.72 TCP 66 6633 → 45520 [ACK] Seq=97 Ack=8575 Win=853 Len=0 TSval=1158713 TSecr=29980303
329 1.114240491 172.31.31.144 -> 172.31.23.72 TCP 66 6633 → 45530 [ACK] Seq=1065 Ack=8463 Win=853 Len=0 TSval=1158713 TSecr=29980303
330 1.114242180 172.31.31.144 -> 172.31.23.72 OpenFlow 187 Type: OFPT_PACKET_OUT
331 1.114468605 172.31.23.72 -> 172.31.31.144 OpenFlow 189 Type: OFPT_PACKET_IN
332 1.114492251 172.31.23.72 -> 172.31.31.144 TCP 66 45538 → 6633 [ACK] Seq=9823 Ack=823 Win=213 Len=0 TSval=29980304 TSecr=1158713
333 1.114576064 172.31.31.144 -> 172.31.23.72 TCP 66 6633 → 45524 [ACK] Seq=97 Ack=9360 Win=853 Len=0 TSval=1158713 TSecr=29980304
334 1.114582146 172.31.31.144 -> 172.31.23.72 TCP 66 6633 → 45536 [ACK] Seq=97 Ack=8805 Win=853 Len=0 TSval=1158713 TSecr=29980304
335 1.114584459 172.31.31.144 -> 172.31.23.72 OpenFlow 187 Type: OFPT_PACKET_OUT
336 1.114586225 172.31.31.144 -> 172.31.23.72 TCP 66 6633 → 45524 [ACK] Seq=97 Ack=9483 Win=853 Len=0 TSval=1158713 TSecr=29980304
337 1.114588202 172.31.31.144 -> 172.31.23.72 OpenFlow 187 Type: OFPT_PACKET_OUT
338 1.114589914 172.31.31.144 -> 172.31.23.72 TCP 66 6633 → 45510 [ACK] Seq=97 Ack=10789 Win=853 Len=0 TSval=1158713 TSecr=29980303
339 1.114594616 172.31.31.144 -> 172.31.23.72 OpenFlow 187 Type: OFPT_PACKET_OUT
340 1.114596301 172.31.31.144 -> 172.31.23.72 OpenFlow 187 Type: OFPT_PACKET_OUT
341 1.114597794 172.31.31.144 -> 172.31.23.72 TCP 66 6633 → 45508 [ACK] Seq=97 Ack=8767 Win=853 Len=0 TSval=1158713 TSecr=29980303
342 1.114599774 172.31.31.144 -> 172.31.23.72 TCP 66 6633 → 45514 [ACK] Seq=1065 Ack=8964 Win=853 Len=0 TSval=1158713 TSecr=29980304
343 1.114617221 172.31.23.72 -> 172.31.31.144 OpenFlow 189 Type: OFPT_PACKET_IN
344 1.114641390 172.31.23.72 -> 172.31.31.144 OpenFlow 189 Type: OFPT_PACKET_IN
345 1.114680684 172.31.23.72 -> 172.31.31.144 OpenFlow 189 Type: OFPT_PACKET_IN
346 1.114696029 172.31.23.72 -> 172.31.31.144 OpenFlow 189 Type: OFPT_PACKET_IN
347 1.114707305 172.31.23.72 -> 172.31.31.144 OpenFlow 189 Type: OFPT_PACKET_IN
348 1.114711989 172.31.23.72 -> 172.31.31.144 OpenFlow 189 Type: OFPT_PACKET_IN
349 1.114782385 172.31.31.144 -> 172.31.23.72 TCP 66 6633 → 45528 [ACK] Seq=1307 Ack=10485 Win=853 Len=0 TSval=1158713 TSecr=29980304
350 1.114790550 172.31.23.72 -> 172.31.31.144 OpenFlow 189 Type: OFPT_PACKET_IN
351 1.114796948 172.31.23.72 -> 172.31.31.144 OpenFlow 189 Type: OFPT_PACKET_IN
352 1.114824687 172.31.23.72 -> 172.31.31.144 OpenFlow 189 Type: OFPT_PACKET_IN
353 1.114838045 172.31.23.72 -> 172.31.31.144 OpenFlow 189 Type: OFPT_PACKET_IN
354 1.114852623 172.31.31.144 -> 172.31.23.72 TCP 66 6633 → 45536 [ACK] Seq=97 Ack=8928 Win=853 Len=0 TSval=1158713 TSecr=29980304
355 1.115009990 172.31.23.72 -> 172.31.31.144 OpenFlow 189 Type: OFPT_PACKET_IN
356 1.115027486 172.31.23.72 -> 172.31.31.144 TCP 66 45538 → 6633 [ACK] Seq=9823 Ack=1307 Win=213 Len=0 TSval=29980304 TSecr=1158713
357 1.115063684 172.31.31.144 -> 172.31.23.72 TCP 66 6633 → 45520 [ACK] Seq=97 Ack=8698 Win=853 Len=0 TSval=1158713 TSecr=29980304
358 1.115069090 172.31.31.144 -> 172.31.23.72 TCP 66 6633 → 45540 [ACK] Seq=97 Ack=9615 Win=853 Len=0 TSval=1158713 TSecr=29980304
359 1.115071355 172.31.31.144 -> 172.31.23.72 TCP 66 6633 → 45516 [ACK] Seq=97 Ack=7434 Win=853 Len=0 TSval=1158713 TSecr=29980304
360 1.115073151 172.31.31.144 -> 172.31.23.72 TCP 66 6633 → 45536 [ACK] Seq=97 Ack=9051 Win=853 Len=0 TSval=1158713 TSecr=29980304
361 1.115074981 172.31.31.144 -> 172.31.23.72 TCP 66 6633 → 45520 [ACK] Seq=97 Ack=8821 Win=853 Len=0 TSval=1158713 TSecr=29980304
362 1.115124748 172.31.31.144 -> 172.31.23.72 TCP 66 6633 → 45516 [ACK] Seq=97 Ack=7557 Win=853 Len=0 TSval=1158713 TSecr=29980304
363 1.115161944 172.31.23.72 -> 172.31.31.144 OpenFlow 189 Type: OFPT_PACKET_IN
364 1.115184862 172.31.23.72 -> 172.31.31.144 OpenFlow 189 Type: OFPT_PACKET_IN
365 1.115226453 172.31.31.144 -> 172.31.23.72 TCP 66 6633 → 45514 [ACK] Seq=1065 Ack=9087 Win=853 Len=0 TSval=1158713 TSecr=29980304
366 1.115230996 172.31.31.144 -> 172.31.23.72 TCP 66 6633 → 45530 [ACK] Seq=1065 Ack=8586 Win=853 Len=0 TSval=1158713 TSecr=29980304
367 1.115232983 172.31.31.144 -> 172.31.23.72 TCP 66 6633 → 45530 [ACK] Seq=1065 Ack=8709 Win=853 Len=0 TSval=1158713 TSecr=29980304
368 1.115250171 172.31.23.72 -> 172.31.31.144 OpenFlow 189 Type: OFPT_PACKET_IN
369 1.115255448 172.31.23.72 -> 172.31.31.144 OpenFlow 189 Type: OFPT_PACKET_IN
