  1 0.000000000 172.31.31.144 -> 172.31.23.72 TCP 82 6633 → 45554 [PSH, ACK] Seq=1 Ack=1 Win=853 Len=16 TSval=1159961 TSecr=29981129
  2 0.000022919 172.31.31.144 -> 172.31.23.72 TCP 146 6633 → 45554 [PSH, ACK] Seq=17 Ack=1 Win=853 Len=80 TSval=1159961 TSecr=29981129
  3 0.000342925 172.31.23.72 -> 172.31.31.144 OpenFlow 6178 Type: OFPT_MULTIPART_REPLY, OFPMP_TABLE
  4 0.000415963 172.31.23.72 -> 172.31.31.144 OpenFlow 2010 Type: OFPT_MULTIPART_REPLY, OFPMP_FLOW
  5 0.000495691 172.31.23.72 -> 172.31.31.144 OpenFlow 530 Type: OFPT_MULTIPART_REPLY, OFPMP_PORT_STATS
  6 0.000713263 172.31.31.144 -> 172.31.23.72 TCP 66 6633 → 45554 [ACK] Seq=97 Ack=6113 Win=853 Len=0 TSval=1159961 TSecr=29981552
  7 0.000720771 172.31.31.144 -> 172.31.23.72 TCP 66 6633 → 45554 [ACK] Seq=97 Ack=8057 Win=853 Len=0 TSval=1159961 TSecr=29981552
  8 0.000722604 172.31.31.144 -> 172.31.23.72 TCP 66 6633 → 45554 [ACK] Seq=97 Ack=8521 Win=853 Len=0 TSval=1159961 TSecr=29981552
  9 1.202578148 172.31.31.144 -> 172.31.23.72 TCP 187 6633 → 45546 [PSH, ACK] Seq=1 Ack=1 Win=853 Len=121 TSval=1160262 TSecr=29981503
 10 1.202605889 172.31.31.144 -> 172.31.23.72 TCP 187 6633 → 45546 [PSH, ACK] Seq=122 Ack=1 Win=853 Len=121 TSval=1160262 TSecr=29981503
 11 1.202610163 172.31.31.144 -> 172.31.23.72 TCP 187 6633 → 45546 [PSH, ACK] Seq=243 Ack=1 Win=853 Len=121 TSval=1160262 TSecr=29981503
 12 1.202612586 172.31.31.144 -> 172.31.23.72 TCP 187 6633 → 45546 [PSH, ACK] Seq=364 Ack=1 Win=853 Len=121 TSval=1160262 TSecr=29981503
 13 1.202631764 172.31.31.144 -> 172.31.23.72 TCP 187 6633 → 45546 [PSH, ACK] Seq=485 Ack=1 Win=853 Len=121 TSval=1160262 TSecr=29981503
 14 1.202648851 172.31.31.144 -> 172.31.23.72 TCP 187 6633 → 45546 [PSH, ACK] Seq=606 Ack=1 Win=853 Len=121 TSval=1160262 TSecr=29981503
 15 1.202694782 172.31.31.144 -> 172.31.23.72 TCP 187 6633 → 45546 [PSH, ACK] Seq=727 Ack=1 Win=853 Len=121 TSval=1160262 TSecr=29981503
 16 1.202758381 172.31.31.144 -> 172.31.23.72 TCP 187 6633 → 45546 [PSH, ACK] Seq=848 Ack=1 Win=853 Len=121 TSval=1160262 TSecr=29981503
 17 1.202886826 172.31.31.144 -> 172.31.23.72 TCP 187 6633 → 45534 [PSH, ACK] Seq=1 Ack=1 Win=853 Len=121 TSval=1160262 TSecr=29981422
 18 1.202919294 172.31.31.144 -> 172.31.23.72 TCP 187 6633 → 45534 [PSH, ACK] Seq=122 Ack=1 Win=853 Len=121 TSval=1160262 TSecr=29981422
 19 1.202922666 172.31.31.144 -> 172.31.23.72 TCP 187 6633 → 45534 [PSH, ACK] Seq=243 Ack=1 Win=853 Len=121 TSval=1160262 TSecr=29981422
 20 1.202979179 172.31.31.144 -> 172.31.23.72 TCP 187 6633 → 45534 [PSH, ACK] Seq=364 Ack=1 Win=853 Len=121 TSval=1160262 TSecr=29981422
 21 1.203040586 172.31.31.144 -> 172.31.23.72 TCP 187 6633 → 45534 [PSH, ACK] Seq=485 Ack=1 Win=853 Len=121 TSval=1160262 TSecr=29981422
 22 1.203085485 172.31.31.144 -> 172.31.23.72 TCP 187 6633 → 45534 [PSH, ACK] Seq=606 Ack=1 Win=853 Len=121 TSval=1160262 TSecr=29981422
 23 1.203214977 172.31.31.144 -> 172.31.23.72 TCP 187 6633 → 45530 [PSH, ACK] Seq=1 Ack=1 Win=853 Len=121 TSval=1160262 TSecr=29981392
 24 1.203220671 172.31.31.144 -> 172.31.23.72 TCP 187 6633 → 45530 [PSH, ACK] Seq=122 Ack=1 Win=853 Len=121 TSval=1160262 TSecr=29981392
 25 1.203226784 172.31.23.72 -> 172.31.31.144 TCP 66 45546 → 6633 [ACK] Seq=1 Ack=969 Win=213 Len=0 TSval=29981853 TSecr=1160262
 26 1.203266850 172.31.31.144 -> 172.31.23.72 TCP 187 6633 → 45530 [PSH, ACK] Seq=243 Ack=1 Win=853 Len=121 TSval=1160262 TSecr=29981392
 27 1.203363656 172.31.31.144 -> 172.31.23.72 TCP 187 6633 → 45530 [PSH, ACK] Seq=364 Ack=1 Win=853 Len=121 TSval=1160262 TSecr=29981392
 28 1.203368723 172.31.31.144 -> 172.31.23.72 TCP 187 6633 → 45530 [PSH, ACK] Seq=485 Ack=1 Win=853 Len=121 TSval=1160262 TSecr=29981392
 29 1.203455904 172.31.31.144 -> 172.31.23.72 TCP 187 6633 → 45530 [PSH, ACK] Seq=606 Ack=1 Win=853 Len=121 TSval=1160262 TSecr=29981392
 30 1.203547774 172.31.31.144 -> 172.31.23.72 TCP 187 6633 → 45530 [PSH, ACK] Seq=727 Ack=1 Win=853 Len=121 TSval=1160262 TSecr=29981392
 31 1.203552559 172.31.31.144 -> 172.31.23.72 TCP 187 6633 → 45530 [PSH, ACK] Seq=848 Ack=1 Win=853 Len=121 TSval=1160262 TSecr=29981392
 32 1.203589176 172.31.23.72 -> 172.31.31.144 TCP 66 45534 → 6633 [ACK] Seq=1 Ack=727 Win=213 Len=0 TSval=29981853 TSecr=1160262
 33 1.203703923 172.31.31.144 -> 172.31.23.72 TCP 187 6633 → 45514 [PSH, ACK] Seq=1 Ack=1 Win=853 Len=121 TSval=1160262 TSecr=29981306
 34 1.203710281 172.31.31.144 -> 172.31.23.72 TCP 187 6633 → 45514 [PSH, ACK] Seq=122 Ack=1 Win=853 Len=121 TSval=1160262 TSecr=29981306
 35 1.203804378 172.31.31.144 -> 172.31.23.72 TCP 187 6633 → 45514 [PSH, ACK] Seq=243 Ack=1 Win=853 Len=121 TSval=1160262 TSecr=29981306
 36 1.203809101 172.31.31.144 -> 172.31.23.72 TCP 187 6633 → 45514 [PSH, ACK] Seq=364 Ack=1 Win=853 Len=121 TSval=1160262 TSecr=29981306
 37 1.203811045 172.31.31.144 -> 172.31.23.72 TCP 187 6633 → 45514 [PSH, ACK] Seq=485 Ack=1 Win=853 Len=121 TSval=1160262 TSecr=29981306
 38 1.203975847 172.31.31.144 -> 172.31.23.72 TCP 187 6633 → 45514 [PSH, ACK] Seq=606 Ack=1 Win=853 Len=121 TSval=1160262 TSecr=29981306
 39 1.203980350 172.31.31.144 -> 172.31.23.72 TCP 187 6633 → 45514 [PSH, ACK] Seq=727 Ack=1 Win=853 Len=121 TSval=1160262 TSecr=29981306
 40 1.203982109 172.31.31.144 -> 172.31.23.72 TCP 187 6633 → 45514 [PSH, ACK] Seq=848 Ack=1 Win=853 Len=121 TSval=1160262 TSecr=29981306
 41 1.204013408 172.31.23.72 -> 172.31.31.144 TCP 66 45530 → 6633 [ACK] Seq=1 Ack=969 Win=213 Len=0 TSval=29981853 TSecr=1160262
 42 1.204034104 172.31.31.144 -> 172.31.23.72 TCP 187 6633 → 45528 [PSH, ACK] Seq=1 Ack=1 Win=853 Len=121 TSval=1160262 TSecr=29981383
 43 1.204130991 172.31.31.144 -> 172.31.23.72 TCP 187 6633 → 45528 [PSH, ACK] Seq=122 Ack=1 Win=853 Len=121 TSval=1160262 TSecr=29981383
 44 1.204136115 172.31.31.144 -> 172.31.23.72 TCP 187 6633 → 45528 [PSH, ACK] Seq=243 Ack=1 Win=853 Len=121 TSval=1160262 TSecr=29981383
 45 1.204183069 172.31.31.144 -> 172.31.23.72 TCP 187 6633 → 45528 [PSH, ACK] Seq=364 Ack=1 Win=853 Len=121 TSval=1160262 TSecr=29981383
 46 1.204250576 172.31.31.144 -> 172.31.23.72 TCP 187 6633 → 45528 [PSH, ACK] Seq=485 Ack=1 Win=853 Len=121 TSval=1160262 TSecr=29981383
 47 1.204291093 172.31.31.144 -> 172.31.23.72 TCP 187 6633 → 45528 [PSH, ACK] Seq=606 Ack=1 Win=853 Len=121 TSval=1160262 TSecr=29981383
 48 1.204338325 172.31.31.144 -> 172.31.23.72 TCP 187 6633 → 45528 [PSH, ACK] Seq=727 Ack=1 Win=853 Len=121 TSval=1160262 TSecr=29981383
 49 1.204371666 172.31.23.72 -> 172.31.31.144 TCP 66 45514 → 6633 [ACK] Seq=1 Ack=969 Win=213 Len=0 TSval=29981853 TSecr=1160262
 50 1.204388589 172.31.31.144 -> 172.31.23.72 TCP 187 6633 → 45528 [PSH, ACK] Seq=848 Ack=1 Win=853 Len=121 TSval=1160262 TSecr=29981383
 51 1.204452970 172.31.31.144 -> 172.31.23.72 TCP 187 6633 → 45528 [PSH, ACK] Seq=969 Ack=1 Win=853 Len=121 TSval=1160262 TSecr=29981383
 52 1.204461685 172.31.23.72 -> 172.31.31.144 OpenFlow 189 Type: OFPT_PACKET_IN
 53 1.204491368 172.31.23.72 -> 172.31.31.144 OpenFlow 189 Type: OFPT_PACKET_IN
 54 1.204521718 172.31.31.144 -> 172.31.23.72 OpenFlow 187 Type: OFPT_PACKET_OUT
 55 1.204617337 172.31.31.144 -> 172.31.23.72 TCP 187 6633 → 45518 [PSH, ACK] Seq=1 Ack=1 Win=853 Len=121 TSval=1160262 TSecr=29981326
 56 1.204623250 172.31.31.144 -> 172.31.23.72 TCP 187 6633 → 45518 [PSH, ACK] Seq=122 Ack=1 Win=853 Len=121 TSval=1160262 TSecr=29981326
 57 1.204819889 172.31.31.144 -> 172.31.23.72 TCP 66 6633 → 45528 [ACK] Seq=1211 Ack=124 Win=853 Len=0 TSval=1160262 TSecr=29981853
 58 1.204831090 172.31.31.144 -> 172.31.23.72 TCP 187 6633 → 45518 [PSH, ACK] Seq=243 Ack=1 Win=853 Len=121 TSval=1160262 TSecr=29981326
 59 1.204832966 172.31.31.144 -> 172.31.23.72 TCP 187 6633 → 45518 [PSH, ACK] Seq=364 Ack=1 Win=853 Len=121 TSval=1160262 TSecr=29981326
 60 1.204834703 172.31.31.144 -> 172.31.23.72 TCP 66 6633 → 45528 [ACK] Seq=1211 Ack=247 Win=853 Len=0 TSval=1160262 TSecr=29981853
 61 1.204836606 172.31.31.144 -> 172.31.23.72 TCP 187 6633 → 45518 [PSH, ACK] Seq=485 Ack=1 Win=853 Len=121 TSval=1160262 TSecr=29981326
 62 1.204838050 172.31.31.144 -> 172.31.23.72 TCP 187 6633 → 45518 [PSH, ACK] Seq=606 Ack=1 Win=853 Len=121 TSval=1160262 TSecr=29981326
 63 1.204912761 172.31.31.144 -> 172.31.23.72 TCP 187 6633 → 45518 [PSH, ACK] Seq=727 Ack=1 Win=853 Len=121 TSval=1160262 TSecr=29981326
 64 1.204929150 172.31.31.144 -> 172.31.23.72 TCP 187 6633 → 45518 [PSH, ACK] Seq=848 Ack=1 Win=853 Len=121 TSval=1160262 TSecr=29981326
 65 1.204963277 172.31.31.144 -> 172.31.23.72 TCP 187 6633 → 45518 [PSH, ACK] Seq=969 Ack=1 Win=853 Len=121 TSval=1160262 TSecr=29981326
 66 1.205006861 172.31.23.72 -> 172.31.31.144 OpenFlow 189 Type: OFPT_PACKET_IN
 67 1.205052025 172.31.31.144 -> 172.31.23.72 OpenFlow 187 Type: OFPT_PACKET_OUT
 68 1.205058675 172.31.23.72 -> 172.31.31.144 OpenFlow 189 Type: OFPT_PACKET_IN
 69 1.205164566 172.31.31.144 -> 172.31.23.72 TCP 187 6633 → 45512 [PSH, ACK] Seq=1 Ack=1 Win=853 Len=121 TSval=1160262 TSecr=29981297
 70 1.205170569 172.31.31.144 -> 172.31.23.72 TCP 187 6633 → 45512 [PSH, ACK] Seq=122 Ack=1 Win=853 Len=121 TSval=1160262 TSecr=29981297
 71 1.205376666 172.31.31.144 -> 172.31.23.72 TCP 187 6633 → 45512 [PSH, ACK] Seq=243 Ack=1 Win=853 Len=121 TSval=1160262 TSecr=29981297
 72 1.205381629 172.31.31.144 -> 172.31.23.72 TCP 66 6633 → 45518 [ACK] Seq=1211 Ack=124 Win=853 Len=0 TSval=1160262 TSecr=29981853
 73 1.205384599 172.31.31.144 -> 172.31.23.72 TCP 187 6633 → 45512 [PSH, ACK] Seq=364 Ack=1 Win=853 Len=121 TSval=1160262 TSecr=29981297
 74 1.205386919 172.31.31.144 -> 172.31.23.72 TCP 187 6633 → 45512 [PSH, ACK] Seq=485 Ack=1 Win=853 Len=121 TSval=1160262 TSecr=29981297
 75 1.205388288 172.31.31.144 -> 172.31.23.72 TCP 66 6633 → 45518 [ACK] Seq=1211 Ack=247 Win=853 Len=0 TSval=1160262 TSecr=29981853
 76 1.205390287 172.31.31.144 -> 172.31.23.72 TCP 187 6633 → 45512 [PSH, ACK] Seq=606 Ack=1 Win=853 Len=121 TSval=1160262 TSecr=29981297
 77 1.205456202 172.31.31.144 -> 172.31.23.72 TCP 187 6633 → 45512 [PSH, ACK] Seq=727 Ack=1 Win=853 Len=121 TSval=1160262 TSecr=29981297
 78 1.205460902 172.31.31.144 -> 172.31.23.72 TCP 187 6633 → 45512 [PSH, ACK] Seq=848 Ack=1 Win=853 Len=121 TSval=1160262 TSecr=29981297
 79 1.205521884 172.31.31.144 -> 172.31.23.72 TCP 187 6633 → 45512 [PSH, ACK] Seq=969 Ack=1 Win=853 Len=121 TSval=1160262 TSecr=29981297
 80 1.205532917 172.31.23.72 -> 172.31.31.144 OpenFlow 189 Type: OFPT_PACKET_IN
 81 1.205578838 172.31.31.144 -> 172.31.23.72 OpenFlow 187 Type: OFPT_PACKET_OUT
 82 1.205585154 172.31.23.72 -> 172.31.31.144 OpenFlow 189 Type: OFPT_PACKET_IN
 83 1.205641403 172.31.31.144 -> 172.31.23.72 TCP 187 6633 → 45538 [PSH, ACK] Seq=1 Ack=1 Win=853 Len=121 TSval=1160262 TSecr=29981447
 84 1.205690073 172.31.31.144 -> 172.31.23.72 TCP 187 6633 → 45538 [PSH, ACK] Seq=122 Ack=1 Win=853 Len=121 TSval=1160262 TSecr=29981447
 85 1.205864633 172.31.31.144 -> 172.31.23.72 TCP 187 6633 → 45538 [PSH, ACK] Seq=243 Ack=1 Win=853 Len=121 TSval=1160262 TSecr=29981447
 86 1.205869276 172.31.31.144 -> 172.31.23.72 TCP 66 6633 → 45512 [ACK] Seq=1211 Ack=124 Win=853 Len=0 TSval=1160262 TSecr=29981853
 87 1.205872457 172.31.31.144 -> 172.31.23.72 TCP 187 6633 → 45538 [PSH, ACK] Seq=364 Ack=1 Win=853 Len=121 TSval=1160262 TSecr=29981447
 88 1.205874493 172.31.31.144 -> 172.31.23.72 TCP 66 6633 → 45512 [ACK] Seq=1211 Ack=247 Win=853 Len=0 TSval=1160262 TSecr=29981853
 89 1.205884728 172.31.31.144 -> 172.31.23.72 TCP 187 6633 → 45538 [PSH, ACK] Seq=485 Ack=1 Win=853 Len=121 TSval=1160262 TSecr=29981447
 90 1.205922706 172.31.31.144 -> 172.31.23.72 TCP 187 6633 → 45538 [PSH, ACK] Seq=606 Ack=1 Win=853 Len=121 TSval=1160263 TSecr=29981447
 91 1.205988671 172.31.31.144 -> 172.31.23.72 TCP 187 6633 → 45538 [PSH, ACK] Seq=727 Ack=1 Win=853 Len=121 TSval=1160263 TSecr=29981447
 92 1.206063903 172.31.23.72 -> 172.31.31.144 OpenFlow 189 Type: OFPT_PACKET_IN
 93 1.206091870 172.31.23.72 -> 172.31.31.144 OpenFlow 189 Type: OFPT_PACKET_IN
 94 1.206155379 172.31.31.144 -> 172.31.23.72 OpenFlow 187 Type: OFPT_PACKET_OUT
 95 1.206293457 172.31.31.144 -> 172.31.23.72 OpenFlow 187 Type: OFPT_PACKET_OUT
 96 1.206298167 172.31.31.144 -> 172.31.23.72 OpenFlow 187 Type: OFPT_PACKET_OUT
 97 1.206300888 172.31.31.144 -> 172.31.23.72 TCP 66 6633 → 45538 [ACK] Seq=1211 Ack=124 Win=853 Len=0 TSval=1160263 TSecr=29981854
 98 1.206367624 172.31.31.144 -> 172.31.23.72 TCP 66 6633 → 45538 [ACK] Seq=1211 Ack=247 Win=853 Len=0 TSval=1160263 TSecr=29981854
 99 1.206519388 172.31.23.72 -> 172.31.31.144 TCP 66 45538 → 6633 [ACK] Seq=247 Ack=1211 Win=213 Len=0 TSval=29981854 TSecr=1160263
100 1.206592455 172.31.23.72 -> 172.31.31.144 OpenFlow 189 Type: OFPT_PACKET_IN
101 1.206619702 172.31.23.72 -> 172.31.31.144 OpenFlow 435 Type: OFPT_PACKET_IN
102 1.206639127 172.31.23.72 -> 172.31.31.144 OpenFlow 189 Type: OFPT_PACKET_IN
103 1.206658272 172.31.23.72 -> 172.31.31.144 OpenFlow 189 Type: OFPT_PACKET_IN
104 1.206684552 172.31.23.72 -> 172.31.31.144 OpenFlow 189 Type: OFPT_PACKET_IN
105 1.206686897 172.31.23.72 -> 172.31.31.144 OpenFlow 435 Type: OFPT_PACKET_IN
106 1.206702648 172.31.23.72 -> 172.31.31.144 OpenFlow 189 Type: OFPT_PACKET_IN
107 1.206720080 172.31.23.72 -> 172.31.31.144 OpenFlow 189 Type: OFPT_PACKET_IN
108 1.206733714 172.31.23.72 -> 172.31.31.144 OpenFlow 189 Type: OFPT_PACKET_IN
109 1.206759749 172.31.23.72 -> 172.31.31.144 OpenFlow 189 Type: OFPT_PACKET_IN
110 1.206765703 172.31.23.72 -> 172.31.31.144 OpenFlow 681 Type: OFPT_PACKET_IN
111 1.206780743 172.31.23.72 -> 172.31.31.144 OpenFlow 189 Type: OFPT_PACKET_IN
112 1.206782994 172.31.23.72 -> 172.31.31.144 OpenFlow 189 Type: OFPT_PACKET_IN
113 1.206797674 172.31.23.72 -> 172.31.31.144 OpenFlow 189 Type: OFPT_PACKET_IN
114 1.206814771 172.31.23.72 -> 172.31.31.144 OpenFlow 189 Type: OFPT_PACKET_IN
115 1.206829067 172.31.23.72 -> 172.31.31.144 OpenFlow 189 Type: OFPT_PACKET_IN
116 1.206848422 172.31.23.72 -> 172.31.31.144 OpenFlow 189 Type: OFPT_PACKET_IN
117 1.206865567 172.31.23.72 -> 172.31.31.144 OpenFlow 189 Type: OFPT_PACKET_IN
118 1.206969107 172.31.23.72 -> 172.31.31.144 OpenFlow 189 Type: OFPT_PACKET_IN
119 1.206972311 172.31.23.72 -> 172.31.31.144 OpenFlow 435 Type: OFPT_PACKET_IN
120 1.206990099 172.31.23.72 -> 172.31.31.144 OpenFlow 189 Type: OFPT_PACKET_IN
121 1.207001401 172.31.23.72 -> 172.31.31.144 OpenFlow 189 Type: OFPT_PACKET_IN
122 1.207126883 172.31.31.144 -> 172.31.23.72 TCP 66 6633 → 45544 [ACK] Seq=1 Ack=124 Win=853 Len=0 TSval=1160263 TSecr=29981854
123 1.207132646 172.31.31.144 -> 172.31.23.72 TCP 66 6633 → 45524 [ACK] Seq=1 Ack=124 Win=853 Len=0 TSval=1160263 TSecr=29981854
124 1.207135307 172.31.31.144 -> 172.31.23.72 TCP 66 6633 → 45522 [ACK] Seq=1 Ack=124 Win=853 Len=0 TSval=1160263 TSecr=29981854
125 1.207137432 172.31.31.144 -> 172.31.23.72 TCP 66 6633 → 45544 [ACK] Seq=1 Ack=493 Win=853 Len=0 TSval=1160263 TSecr=29981854
126 1.207139670 172.31.31.144 -> 172.31.23.72 TCP 66 6633 → 45532 [ACK] Seq=1 Ack=493 Win=853 Len=0 TSval=1160263 TSecr=29981854
127 1.207141845 172.31.31.144 -> 172.31.23.72 TCP 66 6633 → 45510 [ACK] Seq=1 Ack=124 Win=853 Len=0 TSval=1160263 TSecr=29981854
128 1.207148385 172.31.23.72 -> 172.31.31.144 OpenFlow 189 Type: OFPT_PACKET_IN
129 1.207154697 172.31.23.72 -> 172.31.31.144 OpenFlow 189 Type: OFPT_PACKET_IN
130 1.207156797 172.31.23.72 -> 172.31.31.144 OpenFlow 189 Type: OFPT_PACKET_IN
131 1.207636058 172.31.23.72 -> 172.31.31.144 OpenFlow 189 Type: OFPT_PACKET_IN
132 1.207638717 172.31.23.72 -> 172.31.31.144 OpenFlow 435 Type: OFPT_PACKET_IN
133 1.207640424 172.31.23.72 -> 172.31.31.144 OpenFlow 189 Type: OFPT_PACKET_IN
134 1.207642025 172.31.23.72 -> 172.31.31.144 OpenFlow 681 Type: OFPT_PACKET_IN
135 1.207643673 172.31.23.72 -> 172.31.31.144 OpenFlow 435 Type: OFPT_PACKET_IN
136 1.207645333 172.31.23.72 -> 172.31.31.144 OpenFlow 435 Type: OFPT_PACKET_IN
137 1.208062972 172.31.31.144 -> 172.31.23.72 TCP 66 6633 → 45540 [ACK] Seq=1 Ack=124 Win=853 Len=0 TSval=1160263 TSecr=29981854
138 1.208065969 172.31.31.144 -> 172.31.23.72 TCP 66 6633 → 45526 [ACK] Seq=1 Ack=124 Win=853 Len=0 TSval=1160263 TSecr=29981854
139 1.208068245 172.31.31.144 -> 172.31.23.72 TCP 66 6633 → 45550 [ACK] Seq=1 Ack=124 Win=853 Len=0 TSval=1160263 TSecr=29981854
140 1.208070161 172.31.31.144 -> 172.31.23.72 TCP 66 6633 → 45524 [ACK] Seq=1 Ack=739 Win=853 Len=0 TSval=1160263 TSecr=29981854
141 1.208072047 172.31.31.144 -> 172.31.23.72 TCP 66 6633 → 45508 [ACK] Seq=1 Ack=124 Win=853 Len=0 TSval=1160263 TSecr=29981854
142 1.208073798 172.31.31.144 -> 172.31.23.72 TCP 66 6633 → 45522 [ACK] Seq=1 Ack=247 Win=853 Len=0 TSval=1160263 TSecr=29981854
143 1.208075554 172.31.31.144 -> 172.31.23.72 TCP 66 6633 → 45548 [ACK] Seq=1 Ack=124 Win=853 Len=0 TSval=1160263 TSecr=29981854
144 1.208077808 172.31.31.144 -> 172.31.23.72 TCP 66 6633 → 45542 [ACK] Seq=1 Ack=124 Win=853 Len=0 TSval=1160263 TSecr=29981854
145 1.208079594 172.31.31.144 -> 172.31.23.72 TCP 66 6633 → 45536 [ACK] Seq=1 Ack=124 Win=853 Len=0 TSval=1160263 TSecr=29981854
146 1.208081508 172.31.31.144 -> 172.31.23.72 TCP 66 6633 → 45520 [ACK] Seq=1 Ack=124 Win=853 Len=0 TSval=1160263 TSecr=29981854
147 1.208083390 172.31.31.144 -> 172.31.23.72 TCP 66 6633 → 45516 [ACK] Seq=1 Ack=124 Win=853 Len=0 TSval=1160263 TSecr=29981854
148 1.208085287 172.31.31.144 -> 172.31.23.72 TCP 66 6633 → 45530 [ACK] Seq=969 Ack=124 Win=853 Len=0 TSval=1160263 TSecr=29981854
149 1.208087941 172.31.23.72 -> 172.31.31.144 OpenFlow 435 Type: OFPT_PACKET_IN
150 1.208092141 172.31.31.144 -> 172.31.23.72 TCP 66 6633 → 45510 [ACK] Seq=1 Ack=493 Win=853 Len=0 TSval=1160263 TSecr=29981854
151 1.208094107 172.31.31.144 -> 172.31.23.72 TCP 66 6633 → 45514 [ACK] Seq=969 Ack=124 Win=853 Len=0 TSval=1160263 TSecr=29981854
152 1.208096333 172.31.23.72 -> 172.31.31.144 OpenFlow 189 Type: OFPT_PACKET_IN
153 1.208102810 172.31.23.72 -> 172.31.31.144 OpenFlow 189 Type: OFPT_PACKET_IN
154 1.208540971 172.31.31.144 -> 172.31.23.72 TCP 66 6633 → 45528 [ACK] Seq=1211 Ack=370 Win=853 Len=0 TSval=1160263 TSecr=29981854
155 1.208543312 172.31.31.144 -> 172.31.23.72 TCP 66 6633 → 45540 [ACK] Seq=1 Ack=247 Win=853 Len=0 TSval=1160263 TSecr=29981854
156 1.208545156 172.31.31.144 -> 172.31.23.72 TCP 66 6633 → 45526 [ACK] Seq=1 Ack=247 Win=853 Len=0 TSval=1160263 TSecr=29981854
157 1.208546752 172.31.31.144 -> 172.31.23.72 TCP 66 6633 → 45550 [ACK] Seq=1 Ack=247 Win=853 Len=0 TSval=1160263 TSecr=29981854
158 1.208560666 172.31.31.144 -> 172.31.23.72 TCP 66 6633 → 45508 [ACK] Seq=1 Ack=247 Win=853 Len=0 TSval=1160263 TSecr=29981854
159 1.208562408 172.31.31.144 -> 172.31.23.72 TCP 66 6633 → 45548 [ACK] Seq=1 Ack=493 Win=853 Len=0 TSval=1160263 TSecr=29981854
160 1.208736610 172.31.31.144 -> 172.31.23.72 TCP 66 6633 → 45542 [ACK] Seq=1 Ack=247 Win=853 Len=0 TSval=1160263 TSecr=29981854
161 1.208738771 172.31.31.144 -> 172.31.23.72 TCP 66 6633 → 45536 [ACK] Seq=1 Ack=739 Win=853 Len=0 TSval=1160263 TSecr=29981854
162 1.208740299 172.31.31.144 -> 172.31.23.72 TCP 66 6633 → 45520 [ACK] Seq=1 Ack=493 Win=853 Len=0 TSval=1160263 TSecr=29981854
163 1.208741848 172.31.31.144 -> 172.31.23.72 TCP 66 6633 → 45516 [ACK] Seq=1 Ack=493 Win=853 Len=0 TSval=1160263 TSecr=29981854
164 1.208792362 172.31.31.144 -> 172.31.23.72 TCP 66 6633 → 45530 [ACK] Seq=969 Ack=493 Win=853 Len=0 TSval=1160263 TSecr=29981854
165 1.208824083 172.31.31.144 -> 172.31.23.72 TCP 66 6633 → 45514 [ACK] Seq=969 Ack=247 Win=853 Len=0 TSval=1160263 TSecr=29981854
166 1.208938846 172.31.31.144 -> 172.31.23.72 TCP 66 6633 → 45528 [ACK] Seq=1211 Ack=493 Win=853 Len=0 TSval=1160263 TSecr=29981854
167 1.302598277 172.31.31.144 -> 172.31.23.72 OpenFlow 187 Type: OFPT_PACKET_OUT
168 1.302621168 172.31.31.144 -> 172.31.23.72 OpenFlow 187 Type: OFPT_PACKET_OUT
169 1.302637943 172.31.31.144 -> 172.31.23.72 OpenFlow 187 Type: OFPT_PACKET_OUT
170 1.302679555 172.31.31.144 -> 172.31.23.72 OpenFlow 187 Type: OFPT_PACKET_OUT
171 1.302723091 172.31.31.144 -> 172.31.23.72 OpenFlow 187 Type: OFPT_PACKET_OUT
172 1.302781403 172.31.31.144 -> 172.31.23.72 OpenFlow 187 Type: OFPT_PACKET_OUT
173 1.302836109 172.31.31.144 -> 172.31.23.72 OpenFlow 187 Type: OFPT_PACKET_OUT
174 1.303038472 172.31.31.144 -> 172.31.23.72 OpenFlow 187 Type: OFPT_PACKET_OUT
175 1.303044107 172.31.31.144 -> 172.31.23.72 OpenFlow 187 Type: OFPT_PACKET_OUT
176 1.303047558 172.31.31.144 -> 172.31.23.72 OpenFlow 187 Type: OFPT_PACKET_OUT
177 1.303049666 172.31.31.144 -> 172.31.23.72 OpenFlow 187 Type: OFPT_PACKET_OUT
178 1.303051134 172.31.31.144 -> 172.31.23.72 OpenFlow 187 Type: OFPT_PACKET_OUT
179 1.303093728 172.31.31.144 -> 172.31.23.72 OpenFlow 187 Type: OFPT_PACKET_OUT
180 1.303156757 172.31.31.144 -> 172.31.23.72 OpenFlow 187 Type: OFPT_PACKET_OUT
181 1.303258112 172.31.31.144 -> 172.31.23.72 OpenFlow 187 Type: OFPT_PACKET_OUT
182 1.303263896 172.31.31.144 -> 172.31.23.72 OpenFlow 187 Type: OFPT_PACKET_OUT
183 1.303305583 172.31.31.144 -> 172.31.23.72 OpenFlow 187 Type: OFPT_PACKET_OUT
184 1.303346256 172.31.23.72 -> 172.31.31.144 TCP 66 45532 → 6633 [ACK] Seq=493 Ack=969 Win=213 Len=0 TSval=29981878 TSecr=1160287
185 1.303360966 172.31.31.144 -> 172.31.23.72 OpenFlow 187 Type: OFPT_PACKET_OUT
186 1.303505402 172.31.31.144 -> 172.31.23.72 OpenFlow 187 Type: OFPT_PACKET_OUT
187 1.303510523 172.31.31.144 -> 172.31.23.72 OpenFlow 187 Type: OFPT_PACKET_OUT
188 1.303512519 172.31.31.144 -> 172.31.23.72 OpenFlow 187 Type: OFPT_PACKET_OUT
189 1.303570177 172.31.31.144 -> 172.31.23.72 OpenFlow 187 Type: OFPT_PACKET_OUT
190 1.303610981 172.31.23.72 -> 172.31.31.144 TCP 66 45544 → 6633 [ACK] Seq=493 Ack=727 Win=213 Len=0 TSval=29981878 TSecr=1160287
191 1.303622990 172.31.31.144 -> 172.31.23.72 OpenFlow 187 Type: OFPT_PACKET_OUT
192 1.303781460 172.31.31.144 -> 172.31.23.72 OpenFlow 187 Type: OFPT_PACKET_OUT
193 1.303786609 172.31.31.144 -> 172.31.23.72 OpenFlow 187 Type: OFPT_PACKET_OUT
194 1.303789354 172.31.31.144 -> 172.31.23.72 OpenFlow 187 Type: OFPT_PACKET_OUT
195 1.303829660 172.31.31.144 -> 172.31.23.72 OpenFlow 187 Type: OFPT_PACKET_OUT
196 1.303876274 172.31.31.144 -> 172.31.23.72 OpenFlow 187 Type: OFPT_PACKET_OUT
197 1.303941239 172.31.31.144 -> 172.31.23.72 OpenFlow 187 Type: OFPT_PACKET_OUT
198 1.303975520 172.31.31.144 -> 172.31.23.72 OpenFlow 187 Type: OFPT_PACKET_OUT
199 1.304117853 172.31.23.72 -> 172.31.31.144 TCP 66 45524 → 6633 [ACK] Seq=739 Ack=1211 Win=213 Len=0 TSval=29981878 TSecr=1160287
200 1.304147006 172.31.31.144 -> 172.31.23.72 OpenFlow 187 Type: OFPT_PACKET_OUT
201 1.304152053 172.31.31.144 -> 172.31.23.72 OpenFlow 187 Type: OFPT_PACKET_OUT
202 1.304244310 172.31.31.144 -> 172.31.23.72 OpenFlow 187 Type: OFPT_PACKET_OUT
203 1.304249137 172.31.31.144 -> 172.31.23.72 OpenFlow 187 Type: OFPT_PACKET_OUT
204 1.304251204 172.31.31.144 -> 172.31.23.72 OpenFlow 187 Type: OFPT_PACKET_OUT
205 1.304306497 172.31.31.144 -> 172.31.23.72 OpenFlow 187 Type: OFPT_PACKET_OUT
206 1.304349341 172.31.31.144 -> 172.31.23.72 OpenFlow 187 Type: OFPT_PACKET_OUT
207 1.304418235 172.31.31.144 -> 172.31.23.72 OpenFlow 187 Type: OFPT_PACKET_OUT
208 1.304461670 172.31.23.72 -> 172.31.31.144 TCP 66 45522 → 6633 [ACK] Seq=247 Ack=727 Win=213 Len=0 TSval=29981878 TSecr=1160287
209 1.304508154 172.31.31.144 -> 172.31.23.72 OpenFlow 187 Type: OFPT_PACKET_OUT
210 1.304513413 172.31.31.144 -> 172.31.23.72 OpenFlow 187 Type: OFPT_PACKET_OUT
211 1.304665963 172.31.31.144 -> 172.31.23.72 OpenFlow 187 Type: OFPT_PACKET_OUT
212 1.304670804 172.31.31.144 -> 172.31.23.72 OpenFlow 187 Type: OFPT_PACKET_OUT
213 1.304672825 172.31.31.144 -> 172.31.23.72 OpenFlow 187 Type: OFPT_PACKET_OUT
214 1.304722956 172.31.31.144 -> 172.31.23.72 OpenFlow 187 Type: OFPT_PACKET_OUT
215 1.304781087 172.31.31.144 -> 172.31.23.72 OpenFlow 187 Type: OFPT_PACKET_OUT
216 1.304806043 172.31.23.72 -> 172.31.31.144 TCP 66 45510 → 6633 [ACK] Seq=493 Ack=969 Win=213 Len=0 TSval=29981878 TSecr=1160287
217 1.304819255 172.31.31.144 -> 172.31.23.72 OpenFlow 187 Type: OFPT_PACKET_OUT
218 1.304887839 172.31.23.72 -> 172.31.31.144 OpenFlow 189 Type: OFPT_PACKET_IN
219 1.304915117 172.31.31.144 -> 172.31.23.72 OpenFlow 187 Type: OFPT_PACKET_OUT
220 1.304921667 172.31.23.72 -> 172.31.31.144 OpenFlow 189 Type: OFPT_PACKET_IN
221 1.304926835 172.31.31.144 -> 172.31.23.72 OpenFlow 187 Type: OFPT_PACKET_OUT
222 1.304981948 172.31.31.144 -> 172.31.23.72 OpenFlow 187 Type: OFPT_PACKET_OUT
223 1.305054943 172.31.31.144 -> 172.31.23.72 OpenFlow 187 Type: OFPT_PACKET_OUT
224 1.305204093 172.31.31.144 -> 172.31.23.72 OpenFlow 187 Type: OFPT_PACKET_OUT
225 1.305208805 172.31.31.144 -> 172.31.23.72 TCP 66 6633 → 45540 [ACK] Seq=1211 Ack=493 Win=853 Len=0 TSval=1160287 TSecr=29981878
226 1.305212622 172.31.31.144 -> 172.31.23.72 OpenFlow 187 Type: OFPT_PACKET_OUT
227 1.305214668 172.31.31.144 -> 172.31.23.72 OpenFlow 187 Type: OFPT_PACKET_OUT
228 1.305337870 172.31.31.144 -> 172.31.23.72 OpenFlow 187 Type: OFPT_PACKET_OUT
229 1.305385793 172.31.31.144 -> 172.31.23.72 OpenFlow 187 Type: OFPT_PACKET_OUT
230 1.305435120 172.31.23.72 -> 172.31.31.144 OpenFlow 189 Type: OFPT_PACKET_IN
231 1.305445950 172.31.31.144 -> 172.31.23.72 OpenFlow 187 Type: OFPT_PACKET_OUT
232 1.305468875 172.31.23.72 -> 172.31.31.144 OpenFlow 312 Type: OFPT_PACKET_IN
233 1.305609781 172.31.31.144 -> 172.31.23.72 OpenFlow 187 Type: OFPT_PACKET_OUT
234 1.305615995 172.31.31.144 -> 172.31.23.72 OpenFlow 187 Type: OFPT_PACKET_OUT
235 1.305618151 172.31.31.144 -> 172.31.23.72 OpenFlow 187 Type: OFPT_PACKET_OUT
236 1.305623257 172.31.23.72 -> 172.31.31.144 OpenFlow 435 Type: OFPT_PACKET_IN
237 1.305727421 172.31.31.144 -> 172.31.23.72 OpenFlow 187 Type: OFPT_PACKET_OUT
238 1.305732909 172.31.31.144 -> 172.31.23.72 TCP 66 6633 → 45526 [ACK] Seq=969 Ack=370 Win=853 Len=0 TSval=1160287 TSecr=29981878
239 1.305736118 172.31.31.144 -> 172.31.23.72 OpenFlow 187 Type: OFPT_PACKET_OUT
240 1.305845316 172.31.31.144 -> 172.31.23.72 OpenFlow 187 Type: OFPT_PACKET_OUT
241 1.305849982 172.31.31.144 -> 172.31.23.72 TCP 66 6633 → 45526 [ACK] Seq=969 Ack=616 Win=853 Len=0 TSval=1160287 TSecr=29981878
242 1.306055885 172.31.23.72 -> 172.31.31.144 TCP 66 45554 → 6633 [ACK] Seq=8521 Ack=823 Win=213 Len=0 TSval=29981879 TSecr=1160287
243 1.306086793 172.31.31.144 -> 172.31.23.72 TCP 66 6633 → 45526 [ACK] Seq=969 Ack=985 Win=853 Len=0 TSval=1160288 TSecr=29981878
244 1.306148687 172.31.23.72 -> 172.31.31.144 OpenFlow 189 Type: OFPT_PACKET_IN
245 1.306173554 172.31.23.72 -> 172.31.31.144 OpenFlow 435 Type: OFPT_PACKET_IN
246 1.306185708 172.31.23.72 -> 172.31.31.144 OpenFlow 189 Type: OFPT_PACKET_IN
247 1.306200186 172.31.23.72 -> 172.31.31.144 OpenFlow 189 Type: OFPT_PACKET_IN
248 1.306219280 172.31.23.72 -> 172.31.31.144 OpenFlow 189 Type: OFPT_PACKET_IN
249 1.306247170 172.31.23.72 -> 172.31.31.144 OpenFlow 189 Type: OFPT_PACKET_IN
250 1.306249373 172.31.23.72 -> 172.31.31.144 OpenFlow 189 Type: OFPT_PACKET_IN
251 1.306347336 172.31.23.72 -> 172.31.31.144 OpenFlow 189 Type: OFPT_PACKET_IN
252 1.306350737 172.31.23.72 -> 172.31.31.144 OpenFlow 189 Type: OFPT_PACKET_IN
253 1.306367080 172.31.23.72 -> 172.31.31.144 OpenFlow 189 Type: OFPT_PACKET_IN
254 1.306384698 172.31.31.144 -> 172.31.23.72 TCP 66 6633 → 45552 [ACK] Seq=1 Ack=124 Win=853 Len=0 TSval=1160288 TSecr=29981879
255 1.306389975 172.31.31.144 -> 172.31.23.72 TCP 66 6633 → 45552 [ACK] Seq=1 Ack=493 Win=853 Len=0 TSval=1160288 TSecr=29981879
256 1.306398316 172.31.23.72 -> 172.31.31.144 OpenFlow 189 Type: OFPT_PACKET_IN
257 1.306404660 172.31.23.72 -> 172.31.31.144 OpenFlow 435 Type: OFPT_PACKET_IN
258 1.306422616 172.31.23.72 -> 172.31.31.144 OpenFlow 189 Type: OFPT_PACKET_IN
259 1.306434498 172.31.23.72 -> 172.31.31.144 OpenFlow 189 Type: OFPT_PACKET_IN
260 1.306453366 172.31.23.72 -> 172.31.31.144 OpenFlow 189 Type: OFPT_PACKET_IN
261 1.306469655 172.31.23.72 -> 172.31.31.144 OpenFlow 189 Type: OFPT_PACKET_IN
262 1.306482246 172.31.23.72 -> 172.31.31.144 OpenFlow 189 Type: OFPT_PACKET_IN
263 1.306484632 172.31.23.72 -> 172.31.31.144 OpenFlow 435 Type: OFPT_PACKET_IN
264 1.306496800 172.31.23.72 -> 172.31.31.144 OpenFlow 189 Type: OFPT_PACKET_IN
265 1.306516383 172.31.23.72 -> 172.31.31.144 OpenFlow 189 Type: OFPT_PACKET_IN
266 1.306530062 172.31.23.72 -> 172.31.31.144 OpenFlow 189 Type: OFPT_PACKET_IN
267 1.306786963 172.31.31.144 -> 172.31.23.72 TCP 66 6633 → 45550 [ACK] Seq=1 Ack=370 Win=853 Len=0 TSval=1160288 TSecr=29981879
268 1.306793055 172.31.31.144 -> 172.31.23.72 TCP 66 6633 → 45508 [ACK] Seq=1 Ack=370 Win=853 Len=0 TSval=1160288 TSecr=29981879
269 1.306795302 172.31.31.144 -> 172.31.23.72 TCP 66 6633 → 45542 [ACK] Seq=1 Ack=370 Win=853 Len=0 TSval=1160288 TSecr=29981879
270 1.306797605 172.31.31.144 -> 172.31.23.72 TCP 66 6633 → 45520 [ACK] Seq=1 Ack=616 Win=853 Len=0 TSval=1160288 TSecr=29981879
271 1.306799660 172.31.31.144 -> 172.31.23.72 TCP 66 6633 → 45550 [ACK] Seq=1 Ack=493 Win=853 Len=0 TSval=1160288 TSecr=29981879
272 1.306801573 172.31.31.144 -> 172.31.23.72 TCP 66 6633 → 45546 [ACK] Seq=969 Ack=124 Win=853 Len=0 TSval=1160288 TSecr=29981879
273 1.306805386 172.31.23.72 -> 172.31.31.144 OpenFlow 189 Type: OFPT_PACKET_IN
274 1.306810954 172.31.31.144 -> 172.31.23.72 TCP 66 6633 → 45508 [ACK] Seq=1 Ack=493 Win=853 Len=0 TSval=1160288 TSecr=29981879
275 1.306816809 172.31.23.72 -> 172.31.31.144 OpenFlow 435 Type: OFPT_PACKET_IN
276 1.306818677 172.31.23.72 -> 172.31.31.144 OpenFlow 435 Type: OFPT_PACKET_IN
277 1.307190037 172.31.23.72 -> 172.31.31.144 OpenFlow 189 Type: OFPT_PACKET_IN
278 1.307191899 172.31.23.72 -> 172.31.31.144 OpenFlow 435 Type: OFPT_PACKET_IN
279 1.307193600 172.31.23.72 -> 172.31.31.144 OpenFlow 435 Type: OFPT_PACKET_IN
280 1.307195317 172.31.23.72 -> 172.31.31.144 OpenFlow 189 Type: OFPT_PACKET_IN
281 1.307196933 172.31.23.72 -> 172.31.31.144 OpenFlow 189 Type: OFPT_PACKET_IN
282 1.307442135 172.31.31.144 -> 172.31.23.72 TCP 66 6633 → 45534 [ACK] Seq=727 Ack=124 Win=853 Len=0 TSval=1160288 TSecr=29981879
283 1.307444684 172.31.31.144 -> 172.31.23.72 TCP 66 6633 → 45530 [ACK] Seq=969 Ack=616 Win=853 Len=0 TSval=1160288 TSecr=29981879
284 1.307446544 172.31.31.144 -> 172.31.23.72 TCP 66 6633 → 45542 [ACK] Seq=1 Ack=739 Win=853 Len=0 TSval=1160288 TSecr=29981879
285 1.307448375 172.31.31.144 -> 172.31.23.72 TCP 66 6633 → 45514 [ACK] Seq=969 Ack=370 Win=853 Len=0 TSval=1160288 TSecr=29981879
286 1.307450353 172.31.31.144 -> 172.31.23.72 TCP 66 6633 → 45528 [ACK] Seq=1211 Ack=616 Win=853 Len=0 TSval=1160288 TSecr=29981879
287 1.307452247 172.31.31.144 -> 172.31.23.72 TCP 66 6633 → 45518 [ACK] Seq=1211 Ack=370 Win=853 Len=0 TSval=1160288 TSecr=29981879
288 1.307461381 172.31.31.144 -> 172.31.23.72 TCP 66 6633 → 45512 [ACK] Seq=1211 Ack=370 Win=853 Len=0 TSval=1160288 TSecr=29981879
289 1.307463232 172.31.31.144 -> 172.31.23.72 TCP 66 6633 → 45538 [ACK] Seq=1211 Ack=370 Win=853 Len=0 TSval=1160288 TSecr=29981879
290 1.307465535 172.31.31.144 -> 172.31.23.72 TCP 66 6633 → 45520 [ACK] Seq=1 Ack=985 Win=853 Len=0 TSval=1160288 TSecr=29981879
291 1.307470612 172.31.23.72 -> 172.31.31.144 OpenFlow 435 Type: OFPT_PACKET_IN
292 1.307475585 172.31.23.72 -> 172.31.31.144 OpenFlow 189 Type: OFPT_PACKET_IN
293 1.307477128 172.31.23.72 -> 172.31.31.144 OpenFlow 189 Type: OFPT_PACKET_IN
294 1.307975595 172.31.31.144 -> 172.31.23.72 TCP 66 6633 → 45524 [ACK] Seq=1211 Ack=862 Win=853 Len=0 TSval=1160288 TSecr=29981879
295 1.307977819 172.31.31.144 -> 172.31.23.72 TCP 66 6633 → 45522 [ACK] Seq=727 Ack=370 Win=853 Len=0 TSval=1160288 TSecr=29981879
296 1.307979662 172.31.31.144 -> 172.31.23.72 TCP 66 6633 → 45546 [ACK] Seq=969 Ack=247 Win=853 Len=0 TSval=1160288 TSecr=29981879
297 1.307981629 172.31.31.144 -> 172.31.23.72 TCP 66 6633 → 45530 [ACK] Seq=969 Ack=985 Win=853 Len=0 TSval=1160288 TSecr=29981879
298 1.307983292 172.31.31.144 -> 172.31.23.72 TCP 66 6633 → 45534 [ACK] Seq=727 Ack=493 Win=853 Len=0 TSval=1160288 TSecr=29981879
299 1.307984869 172.31.31.144 -> 172.31.23.72 TCP 66 6633 → 45514 [ACK] Seq=969 Ack=493 Win=853 Len=0 TSval=1160288 TSecr=29981879
300 1.307986510 172.31.31.144 -> 172.31.23.72 TCP 66 6633 → 45528 [ACK] Seq=1211 Ack=985 Win=853 Len=0 TSval=1160288 TSecr=29981879
301 1.307988036 172.31.31.144 -> 172.31.23.72 TCP 66 6633 → 45518 [ACK] Seq=1211 Ack=739 Win=853 Len=0 TSval=1160288 TSecr=29981879
302 1.308163600 172.31.31.144 -> 172.31.23.72 TCP 66 6633 → 45512 [ACK] Seq=1211 Ack=493 Win=853 Len=0 TSval=1160288 TSecr=29981879
303 1.308165694 172.31.31.144 -> 172.31.23.72 TCP 66 6633 → 45538 [ACK] Seq=1211 Ack=493 Win=853 Len=0 TSval=1160288 TSecr=29981879
304 1.308167380 172.31.31.144 -> 172.31.23.72 TCP 66 6633 → 45532 [ACK] Seq=969 Ack=985 Win=853 Len=0 TSval=1160288 TSecr=29981879
305 1.308312771 172.31.31.144 -> 172.31.23.72 TCP 66 6633 → 45524 [ACK] Seq=1211 Ack=985 Win=853 Len=0 TSval=1160288 TSecr=29981879
306 1.308314778 172.31.31.144 -> 172.31.23.72 TCP 66 6633 → 45522 [ACK] Seq=727 Ack=493 Win=853 Len=0 TSval=1160288 TSecr=29981879
307 1.341711987 172.31.23.72 -> 172.31.31.144 TCP 66 45540 → 6633 [ACK] Seq=493 Ack=1211 Win=213 Len=0 TSval=29981888 TSecr=1160287
308 1.402144622 172.31.31.144 -> 172.31.23.72 OpenFlow 187 Type: OFPT_PACKET_OUT
309 1.402168910 172.31.31.144 -> 172.31.23.72 OpenFlow 187 Type: OFPT_PACKET_OUT
310 1.402190015 172.31.31.144 -> 172.31.23.72 OpenFlow 187 Type: OFPT_PACKET_OUT
311 1.402205967 172.31.31.144 -> 172.31.23.72 OpenFlow 187 Type: OFPT_PACKET_OUT
312 1.402257317 172.31.31.144 -> 172.31.23.72 OpenFlow 187 Type: OFPT_PACKET_OUT
313 1.402303279 172.31.31.144 -> 172.31.23.72 OpenFlow 187 Type: OFPT_PACKET_OUT
314 1.402373080 172.31.31.144 -> 172.31.23.72 OpenFlow 187 Type: OFPT_PACKET_OUT
315 1.402414797 172.31.31.144 -> 172.31.23.72 OpenFlow 187 Type: OFPT_PACKET_OUT
316 1.402534241 172.31.31.144 -> 172.31.23.72 OpenFlow 187 Type: OFPT_PACKET_OUT
317 1.402539622 172.31.31.144 -> 172.31.23.72 OpenFlow 187 Type: OFPT_PACKET_OUT
318 1.402581879 172.31.31.144 -> 172.31.23.72 OpenFlow 187 Type: OFPT_PACKET_OUT
319 1.402693557 172.31.31.144 -> 172.31.23.72 OpenFlow 187 Type: OFPT_PACKET_OUT
320 1.402699029 172.31.31.144 -> 172.31.23.72 OpenFlow 187 Type: OFPT_PACKET_OUT
321 1.402741291 172.31.31.144 -> 172.31.23.72 OpenFlow 187 Type: OFPT_PACKET_OUT
322 1.402786840 172.31.31.144 -> 172.31.23.72 OpenFlow 187 Type: OFPT_PACKET_OUT
323 1.402847514 172.31.31.144 -> 172.31.23.72 OpenFlow 187 Type: OFPT_PACKET_OUT
324 1.402871516 172.31.23.72 -> 172.31.31.144 TCP 66 45552 → 6633 [ACK] Seq=493 Ack=969 Win=213 Len=0 TSval=29981903 TSecr=1160312
325 1.402949750 172.31.31.144 -> 172.31.23.72 OpenFlow 187 Type: OFPT_PACKET_OUT
326 1.402958909 172.31.23.72 -> 172.31.31.144 OpenFlow 189 Type: OFPT_PACKET_IN
327 1.403110083 172.31.31.144 -> 172.31.23.72 OpenFlow 187 Type: OFPT_PACKET_OUT
328 1.403115651 172.31.31.144 -> 172.31.23.72 OpenFlow 187 Type: OFPT_PACKET_OUT
329 1.403117335 172.31.31.144 -> 172.31.23.72 OpenFlow 187 Type: OFPT_PACKET_OUT
330 1.403123008 172.31.23.72 -> 172.31.31.144 OpenFlow 189 Type: OFPT_PACKET_IN
331 1.403186143 172.31.31.144 -> 172.31.23.72 OpenFlow 187 Type: OFPT_PACKET_OUT
332 1.403195689 172.31.31.144 -> 172.31.23.72 OpenFlow 187 Type: OFPT_PACKET_OUT
333 1.403387966 172.31.31.144 -> 172.31.23.72 OpenFlow 187 Type: OFPT_PACKET_OUT
334 1.403393892 172.31.31.144 -> 172.31.23.72 OpenFlow 187 Type: OFPT_PACKET_OUT
335 1.403396197 172.31.31.144 -> 172.31.23.72 TCP 66 6633 → 45550 [ACK] Seq=969 Ack=616 Win=853 Len=0 TSval=1160312 TSecr=29981903
336 1.403399915 172.31.31.144 -> 172.31.23.72 OpenFlow 187 Type: OFPT_PACKET_OUT
337 1.403427301 172.31.31.144 -> 172.31.23.72 OpenFlow 187 Type: OFPT_PACKET_OUT
338 1.403535886 172.31.31.144 -> 172.31.23.72 OpenFlow 187 Type: OFPT_PACKET_OUT
339 1.403540443 172.31.31.144 -> 172.31.23.72 TCP 66 6633 → 45550 [ACK] Seq=969 Ack=739 Win=853 Len=0 TSval=1160312 TSecr=29981903
340 1.403543626 172.31.31.144 -> 172.31.23.72 OpenFlow 187 Type: OFPT_PACKET_OUT
341 1.403559853 172.31.23.72 -> 172.31.31.144 TCP 66 45508 → 6633 [ACK] Seq=493 Ack=727 Win=213 Len=0 TSval=29981903 TSecr=1160312
342 1.403597581 172.31.31.144 -> 172.31.23.72 OpenFlow 187 Type: OFPT_PACKET_OUT
343 1.403639102 172.31.23.72 -> 172.31.31.144 OpenFlow 189 Type: OFPT_PACKET_IN
344 1.403738018 172.31.31.144 -> 172.31.23.72 OpenFlow 187 Type: OFPT_PACKET_OUT
345 1.403747592 172.31.23.72 -> 172.31.31.144 OpenFlow 189 Type: OFPT_PACKET_IN
346 1.403754168 172.31.31.144 -> 172.31.23.72 OpenFlow 187 Type: OFPT_PACKET_OUT
347 1.403793142 172.31.31.144 -> 172.31.23.72 OpenFlow 187 Type: OFPT_PACKET_OUT
348 1.403800074 172.31.31.144 -> 172.31.23.72 OpenFlow 187 Type: OFPT_PACKET_OUT
349 1.403839510 172.31.31.144 -> 172.31.23.72 OpenFlow 187 Type: OFPT_PACKET_OUT
350 1.403966033 172.31.31.144 -> 172.31.23.72 OpenFlow 187 Type: OFPT_PACKET_OUT
351 1.403970352 172.31.31.144 -> 172.31.23.72 TCP 66 6633 → 45548 [ACK] Seq=969 Ack=616 Win=853 Len=0 TSval=1160312 TSecr=29981903
352 1.403981469 172.31.31.144 -> 172.31.23.72 OpenFlow 187 Type: OFPT_PACKET_OUT
353 1.404133347 172.31.31.144 -> 172.31.23.72 OpenFlow 187 Type: OFPT_PACKET_OUT
354 1.404138682 172.31.31.144 -> 172.31.23.72 TCP 66 6633 → 45548 [ACK] Seq=969 Ack=739 Win=853 Len=0 TSval=1160312 TSecr=29981903
355 1.404141518 172.31.31.144 -> 172.31.23.72 OpenFlow 187 Type: OFPT_PACKET_OUT
356 1.404143844 172.31.31.144 -> 172.31.23.72 OpenFlow 187 Type: OFPT_PACKET_OUT
357 1.404183789 172.31.31.144 -> 172.31.23.72 OpenFlow 187 Type: OFPT_PACKET_OUT
358 1.404225122 172.31.31.144 -> 172.31.23.72 OpenFlow 187 Type: OFPT_PACKET_OUT
359 1.404269053 172.31.23.72 -> 172.31.31.144 TCP 66 45542 → 6633 [ACK] Seq=739 Ack=727 Win=213 Len=0 TSval=29981903 TSecr=1160312
360 1.404283374 172.31.31.144 -> 172.31.23.72 OpenFlow 187 Type: OFPT_PACKET_OUT
361 1.404422938 172.31.31.144 -> 172.31.23.72 OpenFlow 187 Type: OFPT_PACKET_OUT
362 1.404428394 172.31.31.144 -> 172.31.23.72 OpenFlow 187 Type: OFPT_PACKET_OUT
363 1.404432234 172.31.31.144 -> 172.31.23.72 OpenFlow 187 Type: OFPT_PACKET_OUT
364 1.404497253 172.31.31.144 -> 172.31.23.72 OpenFlow 187 Type: OFPT_PACKET_OUT
365 1.404540844 172.31.31.144 -> 172.31.23.72 OpenFlow 187 Type: OFPT_PACKET_OUT
366 1.404587442 172.31.31.144 -> 172.31.23.72 OpenFlow 187 Type: OFPT_PACKET_OUT
367 1.404603707 172.31.23.72 -> 172.31.31.144 TCP 66 45536 → 6633 [ACK] Seq=739 Ack=727 Win=213 Len=0 TSval=29981903 TSecr=1160312
368 1.404649892 172.31.31.144 -> 172.31.23.72 OpenFlow 187 Type: OFPT_PACKET_OUT
369 1.404783996 172.31.31.144 -> 172.31.23.72 OpenFlow 187 Type: OFPT_PACKET_OUT
370 1.404788369 172.31.31.144 -> 172.31.23.72 OpenFlow 187 Type: OFPT_PACKET_OUT
371 1.404792459 172.31.31.144 -> 172.31.23.72 OpenFlow 187 Type: OFPT_PACKET_OUT
372 1.404968447 172.31.31.144 -> 172.31.23.72 OpenFlow 187 Type: OFPT_PACKET_OUT
373 1.404973454 172.31.31.144 -> 172.31.23.72 OpenFlow 187 Type: OFPT_PACKET_OUT
374 1.404975689 172.31.31.144 -> 172.31.23.72 OpenFlow 187 Type: OFPT_PACKET_OUT
375 1.405023056 172.31.31.144 -> 172.31.23.72 OpenFlow 187 Type: OFPT_PACKET_OUT
376 1.405075648 172.31.31.144 -> 172.31.23.72 OpenFlow 187 Type: OFPT_PACKET_OUT
377 1.405129071 172.31.23.72 -> 172.31.31.144 TCP 66 45520 → 6633 [ACK] Seq=985 Ack=1211 Win=213 Len=0 TSval=29981903 TSecr=1160312
378 1.405138564 172.31.31.144 -> 172.31.23.72 OpenFlow 187 Type: OFPT_PACKET_OUT
379 1.405208712 172.31.23.72 -> 172.31.31.144 OpenFlow 189 Type: OFPT_PACKET_IN
380 1.405232381 172.31.23.72 -> 172.31.31.144 OpenFlow 189 Type: OFPT_PACKET_IN
381 1.405423593 172.31.31.144 -> 172.31.23.72 TCP 66 6633 → 45516 [ACK] Seq=727 Ack=616 Win=853 Len=0 TSval=1160312 TSecr=29981903
382 1.405568802 172.31.31.144 -> 172.31.23.72 TCP 66 6633 → 45516 [ACK] Seq=727 Ack=739 Win=853 Len=0 TSval=1160312 TSecr=29981903
383 1.405606228 172.31.23.72 -> 172.31.31.144 OpenFlow 189 Type: OFPT_PACKET_IN
384 1.405643126 172.31.23.72 -> 172.31.31.144 OpenFlow 435 Type: OFPT_PACKET_IN
385 1.405656152 172.31.23.72 -> 172.31.31.144 OpenFlow 189 Type: OFPT_PACKET_IN
386 1.405698787 172.31.23.72 -> 172.31.31.144 OpenFlow 189 Type: OFPT_PACKET_IN
