  1 0.000000000 172.31.31.144 -> 172.31.23.72 TCP 82 6633 → 51142 [PSH, ACK] Seq=1 Ack=1 Win=853 Len=16 TSval=5352247 TSecr=23921634
  2 0.000020511 172.31.31.144 -> 172.31.23.72 TCP 146 6633 → 51142 [PSH, ACK] Seq=17 Ack=1 Win=853 Len=80 TSval=5352247 TSecr=23921634
  3 0.000296062 172.31.23.72 -> 172.31.31.144 OpenFlow 6178 Type: OFPT_MULTIPART_REPLY, OFPMP_TABLE
  4 0.000388328 172.31.23.72 -> 172.31.31.144 OpenFlow 754 Type: OFPT_MULTIPART_REPLY, OFPMP_PORT_STATS
  5 0.000446545 172.31.23.72 -> 172.31.31.144 OpenFlow 1802 Type: OFPT_MULTIPART_REPLY, OFPMP_FLOW
  6 0.000616162 172.31.31.144 -> 172.31.23.72 TCP 66 6633 → 51142 [ACK] Seq=97 Ack=6113 Win=853 Len=0 TSval=5352247 TSecr=23922373
  7 0.000644360 172.31.31.144 -> 172.31.23.72 TCP 66 6633 → 51142 [ACK] Seq=97 Ack=6801 Win=853 Len=0 TSval=5352247 TSecr=23922373
  8 0.000673420 172.31.31.144 -> 172.31.23.72 TCP 66 6633 → 51142 [ACK] Seq=97 Ack=8537 Win=853 Len=0 TSval=5352247 TSecr=23922373
  9 0.029179959 172.31.31.144 -> 172.31.23.72 TCP 90 6633 → 51144 [PSH, ACK] Seq=1 Ack=1 Win=853 Len=24 TSval=5352254 TSecr=23921634
 10 0.029213414 172.31.31.144 -> 172.31.23.72 TCP 122 6633 → 51144 [PSH, ACK] Seq=25 Ack=1 Win=853 Len=56 TSval=5352254 TSecr=23921634
 11 0.029513848 172.31.23.72 -> 172.31.31.144 OpenFlow 642 Type: OFPT_MULTIPART_REPLY, OFPMP_PORT_STATS
 12 0.029590405 172.31.23.72 -> 172.31.31.144 OpenFlow 1802 Type: OFPT_MULTIPART_REPLY, OFPMP_FLOW
 13 0.029855887 172.31.31.144 -> 172.31.23.72 TCP 66 6633 → 51144 [ACK] Seq=81 Ack=2313 Win=853 Len=0 TSval=5352255 TSecr=23922380
 14 0.030344818 172.31.31.144 -> 172.31.23.72 OpenFlow 82 Type: OFPT_MULTIPART_REQUEST, OFPMP_TABLE
 15 0.030603868 172.31.23.72 -> 172.31.31.144 OpenFlow 6178 Type: OFPT_MULTIPART_REPLY, OFPMP_TABLE
 16 0.068581283 172.31.31.144 -> 172.31.23.72 TCP 82 6633 → 51146 [PSH, ACK] Seq=1 Ack=1 Win=853 Len=16 TSval=5352264 TSecr=23921733
 17 0.068617708 172.31.31.144 -> 172.31.23.72 TCP 146 6633 → 51146 [PSH, ACK] Seq=17 Ack=1 Win=853 Len=80 TSval=5352264 TSecr=23921733
 18 0.068960228 172.31.23.72 -> 172.31.31.144 OpenFlow 6178 Type: OFPT_MULTIPART_REPLY, OFPMP_TABLE
 19 0.069053681 172.31.23.72 -> 172.31.31.144 OpenFlow 3050 Type: OFPT_MULTIPART_REPLY, OFPMP_FLOW
 20 0.069193001 172.31.23.72 -> 172.31.31.144 OpenFlow 754 Type: OFPT_MULTIPART_REPLY, OFPMP_PORT_STATS
 21 0.069277636 172.31.31.144 -> 172.31.23.72 TCP 66 6633 → 51146 [ACK] Seq=97 Ack=9097 Win=853 Len=0 TSval=5352264 TSecr=23922390
 22 0.069749090 172.31.31.144 -> 172.31.23.72 TCP 66 6633 → 51144 [ACK] Seq=97 Ack=8425 Win=853 Len=0 TSval=5352265 TSecr=23922380
 23 0.105868574 172.31.31.144 -> 172.31.23.72 TCP 66 6633 → 51146 [ACK] Seq=97 Ack=9785 Win=853 Len=0 TSval=5352274 TSecr=23922390
 24 0.114988455 172.31.31.144 -> 172.31.23.72 TCP 122 6633 → 51148 [PSH, ACK] Seq=1 Ack=1 Win=853 Len=56 TSval=5352276 TSecr=23921683
 25 0.115014894 172.31.31.144 -> 172.31.23.72 TCP 106 6633 → 51148 [PSH, ACK] Seq=57 Ack=1 Win=853 Len=40 TSval=5352276 TSecr=23921683
 26 0.115265317 172.31.23.72 -> 172.31.31.144 OpenFlow 1178 Type: OFPT_MULTIPART_REPLY, OFPMP_FLOW
 27 0.115385521 172.31.23.72 -> 172.31.31.144 OpenFlow 642 Type: OFPT_MULTIPART_REPLY, OFPMP_PORT_STATS
 28 0.115553484 172.31.23.72 -> 172.31.31.144 OpenFlow 6178 Type: OFPT_MULTIPART_REPLY, OFPMP_TABLE
 29 0.115665886 172.31.31.144 -> 172.31.23.72 TCP 66 6633 → 51148 [ACK] Seq=97 Ack=1689 Win=853 Len=0 TSval=5352276 TSecr=23922402
 30 0.137013002 172.31.31.144 -> 172.31.23.72 TCP 187 6633 → 51132 [PSH, ACK] Seq=1 Ack=1 Win=853 Len=121 TSval=5352281 TSecr=23922309
 31 0.137038918 172.31.31.144 -> 172.31.23.72 TCP 187 6633 → 51132 [PSH, ACK] Seq=122 Ack=1 Win=853 Len=121 TSval=5352281 TSecr=23922309
 32 0.137101048 172.31.31.144 -> 172.31.23.72 TCP 187 6633 → 51132 [PSH, ACK] Seq=243 Ack=1 Win=853 Len=121 TSval=5352281 TSecr=23922309
 33 0.137170653 172.31.31.144 -> 172.31.23.72 TCP 187 6633 → 51132 [PSH, ACK] Seq=364 Ack=1 Win=853 Len=121 TSval=5352281 TSecr=23922309
 34 0.137208891 172.31.31.144 -> 172.31.23.72 TCP 187 6633 → 51132 [PSH, ACK] Seq=485 Ack=1 Win=853 Len=121 TSval=5352281 TSecr=23922309
 35 0.137288690 172.31.31.144 -> 172.31.23.72 TCP 187 6633 → 51132 [PSH, ACK] Seq=606 Ack=1 Win=853 Len=121 TSval=5352281 TSecr=23922309
 36 0.137341593 172.31.31.144 -> 172.31.23.72 TCP 187 6633 → 51132 [PSH, ACK] Seq=727 Ack=1 Win=853 Len=121 TSval=5352281 TSecr=23922309
 37 0.137410637 172.31.31.144 -> 172.31.23.72 TCP 187 6633 → 51132 [PSH, ACK] Seq=848 Ack=1 Win=853 Len=121 TSval=5352281 TSecr=23922309
 38 0.137510083 172.31.31.144 -> 172.31.23.72 TCP 187 6633 → 51134 [PSH, ACK] Seq=1 Ack=1 Win=853 Len=121 TSval=5352281 TSecr=23922319
 39 0.137565281 172.31.31.144 -> 172.31.23.72 TCP 187 6633 → 51134 [PSH, ACK] Seq=122 Ack=1 Win=853 Len=121 TSval=5352281 TSecr=23922319
 40 0.137605408 172.31.23.72 -> 172.31.31.144 TCP 66 51132 → 6633 [ACK] Seq=1 Ack=969 Win=213 Len=0 TSval=23922407 TSecr=5352281
 41 0.137617708 172.31.31.144 -> 172.31.23.72 TCP 187 6633 → 51134 [PSH, ACK] Seq=243 Ack=1 Win=853 Len=121 TSval=5352281 TSecr=23922319
 42 0.137697231 172.31.31.144 -> 172.31.23.72 TCP 187 6633 → 51134 [PSH, ACK] Seq=364 Ack=1 Win=853 Len=121 TSval=5352281 TSecr=23922319
 43 0.137721534 172.31.23.72 -> 172.31.31.144 OpenFlow 189 Type: OFPT_PACKET_IN
 44 0.137744976 172.31.23.72 -> 172.31.31.144 OpenFlow 189 Type: OFPT_PACKET_IN
 45 0.137777246 172.31.31.144 -> 172.31.23.72 TCP 187 6633 → 51134 [PSH, ACK] Seq=485 Ack=1 Win=853 Len=121 TSval=5352282 TSecr=23922319
 46 0.137787976 172.31.23.72 -> 172.31.31.144 OpenFlow 189 Type: OFPT_PACKET_IN
 47 0.137813946 172.31.23.72 -> 172.31.31.144 OpenFlow 189 Type: OFPT_PACKET_IN
 48 0.137845824 172.31.31.144 -> 172.31.23.72 TCP 187 6633 → 51134 [PSH, ACK] Seq=606 Ack=1 Win=853 Len=121 TSval=5352282 TSecr=23922319
 49 0.137884827 172.31.23.72 -> 172.31.31.144 OpenFlow 189 Type: OFPT_PACKET_IN
 50 0.137909175 172.31.31.144 -> 172.31.23.72 TCP 187 6633 → 51136 [PSH, ACK] Seq=1 Ack=1 Win=853 Len=121 TSval=5352282 TSecr=23922341
 51 0.137916094 172.31.23.72 -> 172.31.31.144 OpenFlow 189 Type: OFPT_PACKET_IN
 52 0.137944230 172.31.31.144 -> 172.31.23.72 TCP 66 6633 → 51130 [ACK] Seq=1 Ack=124 Win=853 Len=0 TSval=5352282 TSecr=23922407
 53 0.137975145 172.31.31.144 -> 172.31.23.72 TCP 66 6633 → 51130 [ACK] Seq=1 Ack=247 Win=853 Len=0 TSval=5352282 TSecr=23922407
 54 0.137994453 172.31.31.144 -> 172.31.23.72 TCP 187 6633 → 51136 [PSH, ACK] Seq=122 Ack=1 Win=853 Len=121 TSval=5352282 TSecr=23922341
 55 0.138024157 172.31.31.144 -> 172.31.23.72 TCP 66 6633 → 51140 [ACK] Seq=1 Ack=247 Win=853 Len=0 TSval=5352282 TSecr=23922407
 56 0.138063303 172.31.31.144 -> 172.31.23.72 TCP 66 6633 → 51134 [ACK] Seq=727 Ack=124 Win=853 Len=0 TSval=5352282 TSecr=23922407
 57 0.138091743 172.31.31.144 -> 172.31.23.72 TCP 66 6633 → 51134 [ACK] Seq=727 Ack=247 Win=853 Len=0 TSval=5352282 TSecr=23922407
 58 0.138119131 172.31.31.144 -> 172.31.23.72 TCP 187 6633 → 51136 [PSH, ACK] Seq=243 Ack=1 Win=853 Len=121 TSval=5352282 TSecr=23922341
 59 0.138202633 172.31.31.144 -> 172.31.23.72 TCP 187 6633 → 51136 [PSH, ACK] Seq=364 Ack=1 Win=853 Len=121 TSval=5352282 TSecr=23922341
 60 0.138226900 172.31.31.144 -> 172.31.23.72 TCP 187 6633 → 51136 [PSH, ACK] Seq=485 Ack=1 Win=853 Len=121 TSval=5352282 TSecr=23922341
 61 0.138289044 172.31.31.144 -> 172.31.23.72 TCP 187 6633 → 51136 [PSH, ACK] Seq=606 Ack=1 Win=853 Len=121 TSval=5352282 TSecr=23922341
 62 0.138350602 172.31.31.144 -> 172.31.23.72 TCP 187 6633 → 51136 [PSH, ACK] Seq=727 Ack=1 Win=853 Len=121 TSval=5352282 TSecr=23922341
 63 0.138388153 172.31.23.72 -> 172.31.31.144 OpenFlow 189 Type: OFPT_PACKET_IN
 64 0.138413056 172.31.23.72 -> 172.31.31.144 OpenFlow 189 Type: OFPT_PACKET_IN
 65 0.138451039 172.31.31.144 -> 172.31.23.72 TCP 187 6633 → 51136 [PSH, ACK] Seq=848 Ack=1 Win=853 Len=121 TSval=5352282 TSecr=23922341
 66 0.138529530 172.31.31.144 -> 172.31.23.72 TCP 187 6633 → 51136 [PSH, ACK] Seq=969 Ack=1 Win=853 Len=121 TSval=5352282 TSecr=23922341
 67 0.138545041 172.31.31.144 -> 172.31.23.72 TCP 66 6633 → 51132 [ACK] Seq=969 Ack=124 Win=853 Len=0 TSval=5352282 TSecr=23922407
 68 0.138569966 172.31.31.144 -> 172.31.23.72 TCP 66 6633 → 51132 [ACK] Seq=969 Ack=247 Win=853 Len=0 TSval=5352282 TSecr=23922407
 69 0.138583686 172.31.31.144 -> 172.31.23.72 TCP 187 6633 → 51136 [PSH, ACK] Seq=1090 Ack=1 Win=853 Len=121 TSval=5352282 TSecr=23922341
 70 0.138650655 172.31.31.144 -> 172.31.23.72 TCP 187 6633 → 51138 [PSH, ACK] Seq=1 Ack=1 Win=853 Len=121 TSval=5352282 TSecr=23922350
 71 0.138720480 172.31.31.144 -> 172.31.23.72 TCP 187 6633 → 51138 [PSH, ACK] Seq=122 Ack=1 Win=853 Len=121 TSval=5352282 TSecr=23922350
 72 0.138800882 172.31.31.144 -> 172.31.23.72 TCP 187 6633 → 51138 [PSH, ACK] Seq=243 Ack=1 Win=853 Len=121 TSval=5352282 TSecr=23922350
 73 0.138877575 172.31.31.144 -> 172.31.23.72 TCP 187 6633 → 51138 [PSH, ACK] Seq=364 Ack=1 Win=853 Len=121 TSval=5352282 TSecr=23922350
 74 0.138925305 172.31.23.72 -> 172.31.31.144 TCP 66 51136 → 6633 [ACK] Seq=1 Ack=1211 Win=213 Len=0 TSval=23922407 TSecr=5352282
 75 0.138947176 172.31.31.144 -> 172.31.23.72 TCP 187 6633 → 51138 [PSH, ACK] Seq=485 Ack=1 Win=853 Len=121 TSval=5352282 TSecr=23922350
 76 0.139014146 172.31.23.72 -> 172.31.31.144 OpenFlow 189 Type: OFPT_PACKET_IN
 77 0.139029594 172.31.31.144 -> 172.31.23.72 TCP 187 6633 → 51138 [PSH, ACK] Seq=606 Ack=1 Win=853 Len=121 TSval=5352282 TSecr=23922350
 78 0.139036047 172.31.23.72 -> 172.31.31.144 OpenFlow 189 Type: OFPT_PACKET_IN
 79 0.139066046 172.31.23.72 -> 172.31.31.144 OpenFlow 189 Type: OFPT_PACKET_IN
 80 0.139075938 172.31.31.144 -> 172.31.23.72 TCP 187 6633 → 51138 [PSH, ACK] Seq=727 Ack=1 Win=853 Len=121 TSval=5352282 TSecr=23922350
 81 0.139092558 172.31.23.72 -> 172.31.31.144 OpenFlow 189 Type: OFPT_PACKET_IN
 82 0.139147988 172.31.23.72 -> 172.31.31.144 OpenFlow 189 Type: OFPT_PACKET_IN
 83 0.139151164 172.31.23.72 -> 172.31.31.144 OpenFlow 189 Type: OFPT_PACKET_IN
 84 0.139163504 172.31.31.144 -> 172.31.23.72 TCP 187 6633 → 51138 [PSH, ACK] Seq=848 Ack=1 Win=853 Len=121 TSval=5352282 TSecr=23922350
 85 0.139202441 172.31.23.72 -> 172.31.31.144 OpenFlow 189 Type: OFPT_PACKET_IN
 86 0.139211282 172.31.23.72 -> 172.31.31.144 OpenFlow 189 Type: OFPT_PACKET_IN
 87 0.139213427 172.31.23.72 -> 172.31.31.144 OpenFlow 189 Type: OFPT_PACKET_IN
 88 0.139281507 172.31.31.144 -> 172.31.23.72 TCP 66 6633 → 51130 [ACK] Seq=1 Ack=370 Win=853 Len=0 TSval=5352282 TSecr=23922407
 89 0.139287764 172.31.31.144 -> 172.31.23.72 OpenFlow 187 Type: OFPT_PACKET_OUT
 90 0.139291848 172.31.23.72 -> 172.31.31.144 OpenFlow 435 Type: OFPT_PACKET_IN
 91 0.139298154 172.31.31.144 -> 172.31.23.72 TCP 66 6633 → 51130 [ACK] Seq=1 Ack=493 Win=853 Len=0 TSval=5352282 TSecr=23922407
 92 0.139300479 172.31.31.144 -> 172.31.23.72 TCP 66 6633 → 51142 [ACK] Seq=97 Ack=8660 Win=853 Len=0 TSval=5352282 TSecr=23922407
 93 0.139417676 172.31.31.144 -> 172.31.23.72 OpenFlow 187 Type: OFPT_PACKET_OUT
 94 0.139422569 172.31.31.144 -> 172.31.23.72 TCP 66 6633 → 51128 [ACK] Seq=1 Ack=124 Win=853 Len=0 TSval=5352282 TSecr=23922407
 95 0.139425487 172.31.31.144 -> 172.31.23.72 TCP 66 6633 → 51142 [ACK] Seq=97 Ack=8783 Win=853 Len=0 TSval=5352282 TSecr=23922408
 96 0.139427612 172.31.31.144 -> 172.31.23.72 OpenFlow 187 Type: OFPT_PACKET_OUT
 97 0.139494823 172.31.31.144 -> 172.31.23.72 OpenFlow 187 Type: OFPT_PACKET_OUT
 98 0.139514614 172.31.31.144 -> 172.31.23.72 TCP 66 6633 → 51128 [ACK] Seq=1 Ack=247 Win=853 Len=0 TSval=5352282 TSecr=23922408
 99 0.139549103 172.31.31.144 -> 172.31.23.72 OpenFlow 187 Type: OFPT_PACKET_OUT
100 0.139671850 172.31.31.144 -> 172.31.23.72 TCP 66 6633 → 51138 [ACK] Seq=1211 Ack=493 Win=853 Len=0 TSval=5352282 TSecr=23922408
101 0.139699374 172.31.31.144 -> 172.31.23.72 TCP 66 6633 → 51126 [ACK] Seq=1 Ack=247 Win=853 Len=0 TSval=5352282 TSecr=23922408
102 0.139764779 172.31.23.72 -> 172.31.31.144 OpenFlow 189 Type: OFPT_PACKET_IN
103 0.139810442 172.31.23.72 -> 172.31.31.144 OpenFlow 189 Type: OFPT_PACKET_IN
104 0.139842517 172.31.31.144 -> 172.31.23.72 OpenFlow 187 Type: OFPT_PACKET_OUT
105 0.139899085 172.31.23.72 -> 172.31.31.144 OpenFlow 189 Type: OFPT_PACKET_IN
106 0.139917806 172.31.31.144 -> 172.31.23.72 OpenFlow 187 Type: OFPT_PACKET_OUT
107 0.139923349 172.31.23.72 -> 172.31.31.144 OpenFlow 189 Type: OFPT_PACKET_IN
108 0.139934921 172.31.23.72 -> 172.31.31.144 OpenFlow 189 Type: OFPT_PACKET_IN
109 0.139946273 172.31.23.72 -> 172.31.31.144 OpenFlow 189 Type: OFPT_PACKET_IN
110 0.139953175 172.31.31.144 -> 172.31.23.72 TCP 66 6633 → 51134 [ACK] Seq=727 Ack=370 Win=853 Len=0 TSval=5352282 TSecr=23922408
111 0.139978692 172.31.23.72 -> 172.31.31.144 OpenFlow 189 Type: OFPT_PACKET_IN
112 0.139994012 172.31.23.72 -> 172.31.31.144 OpenFlow 189 Type: OFPT_PACKET_IN
113 0.139996211 172.31.23.72 -> 172.31.31.144 OpenFlow 189 Type: OFPT_PACKET_IN
114 0.140057108 172.31.31.144 -> 172.31.23.72 TCP 66 6633 → 51134 [ACK] Seq=727 Ack=493 Win=853 Len=0 TSval=5352282 TSecr=23922408
115 0.140063018 172.31.31.144 -> 172.31.23.72 OpenFlow 187 Type: OFPT_PACKET_OUT
116 0.140067046 172.31.23.72 -> 172.31.31.144 OpenFlow 189 Type: OFPT_PACKET_IN
117 0.140075251 172.31.23.72 -> 172.31.31.144 OpenFlow 189 Type: OFPT_PACKET_IN
118 0.140077094 172.31.23.72 -> 172.31.31.144 OpenFlow 189 Type: OFPT_PACKET_IN
119 0.140155319 172.31.31.144 -> 172.31.23.72 TCP 66 6633 → 51146 [ACK] Seq=97 Ack=9908 Win=853 Len=0 TSval=5352282 TSecr=23922408
120 0.140161057 172.31.31.144 -> 172.31.23.72 OpenFlow 187 Type: OFPT_PACKET_OUT
121 0.140163697 172.31.31.144 -> 172.31.23.72 TCP 66 6633 → 51146 [ACK] Seq=97 Ack=10031 Win=853 Len=0 TSval=5352282 TSecr=23922408
122 0.140253019 172.31.31.144 -> 172.31.23.72 OpenFlow 187 Type: OFPT_PACKET_OUT
123 0.140257635 172.31.31.144 -> 172.31.23.72 TCP 66 6633 → 51136 [ACK] Seq=1211 Ack=124 Win=853 Len=0 TSval=5352282 TSecr=23922408
124 0.140260423 172.31.31.144 -> 172.31.23.72 TCP 66 6633 → 51130 [ACK] Seq=1 Ack=616 Win=853 Len=0 TSval=5352282 TSecr=23922408
125 0.140262357 172.31.31.144 -> 172.31.23.72 OpenFlow 187 Type: OFPT_PACKET_OUT
126 0.140267111 172.31.31.144 -> 172.31.23.72 TCP 66 6633 → 51136 [ACK] Seq=1211 Ack=247 Win=853 Len=0 TSval=5352282 TSecr=23922408
127 0.140301373 172.31.31.144 -> 172.31.23.72 TCP 66 6633 → 51140 [ACK] Seq=727 Ack=493 Win=853 Len=0 TSval=5352282 TSecr=23922408
128 0.140342972 172.31.31.144 -> 172.31.23.72 TCP 66 6633 → 51130 [ACK] Seq=1 Ack=739 Win=853 Len=0 TSval=5352282 TSecr=23922408
129 0.140421221 172.31.23.72 -> 172.31.31.144 OpenFlow 189 Type: OFPT_PACKET_IN
130 0.140453500 172.31.23.72 -> 172.31.31.144 OpenFlow 189 Type: OFPT_PACKET_IN
131 0.140480048 172.31.23.72 -> 172.31.31.144 OpenFlow 189 Type: OFPT_PACKET_IN
132 0.140522708 172.31.23.72 -> 172.31.31.144 OpenFlow 189 Type: OFPT_PACKET_IN
133 0.140550414 172.31.31.144 -> 172.31.23.72 OpenFlow 187 Type: OFPT_PACKET_OUT
134 0.140585244 172.31.31.144 -> 172.31.23.72 OpenFlow 187 Type: OFPT_PACKET_OUT
135 0.140600796 172.31.31.144 -> 172.31.23.72 TCP 66 6633 → 51144 [ACK] Seq=97 Ack=8548 Win=853 Len=0 TSval=5352282 TSecr=23922408
136 0.140615575 172.31.23.72 -> 172.31.31.144 OpenFlow 189 Type: OFPT_PACKET_IN
137 0.140630767 172.31.31.144 -> 172.31.23.72 TCP 66 6633 → 51144 [ACK] Seq=97 Ack=8671 Win=853 Len=0 TSval=5352282 TSecr=23922408
138 0.140638821 172.31.23.72 -> 172.31.31.144 OpenFlow 189 Type: OFPT_PACKET_IN
139 0.140736828 172.31.31.144 -> 172.31.23.72 TCP 66 6633 → 51138 [ACK] Seq=1211 Ack=739 Win=853 Len=0 TSval=5352282 TSecr=23922408
140 0.140778870 172.31.31.144 -> 172.31.23.72 OpenFlow 187 Type: OFPT_PACKET_OUT
141 0.140825413 172.31.31.144 -> 172.31.23.72 TCP 66 6633 → 51132 [ACK] Seq=969 Ack=370 Win=853 Len=0 TSval=5352282 TSecr=23922408
142 0.140891167 172.31.31.144 -> 172.31.23.72 TCP 66 6633 → 51132 [ACK] Seq=969 Ack=493 Win=853 Len=0 TSval=5352282 TSecr=23922408
143 0.140913429 172.31.31.144 -> 172.31.23.72 OpenFlow 187 Type: OFPT_PACKET_OUT
144 0.140947194 172.31.31.144 -> 172.31.23.72 OpenFlow 187 Type: OFPT_PACKET_OUT
145 0.141012665 172.31.31.144 -> 172.31.23.72 OpenFlow 187 Type: OFPT_PACKET_OUT
146 0.141098976 172.31.31.144 -> 172.31.23.72 OpenFlow 187 Type: OFPT_PACKET_OUT
147 0.141163983 172.31.23.72 -> 172.31.31.144 TCP 66 51142 → 6633 [ACK] Seq=9029 Ack=1307 Win=213 Len=0 TSval=23922408 TSecr=5352282
148 0.141185353 172.31.31.144 -> 172.31.23.72 OpenFlow 187 Type: OFPT_PACKET_OUT
149 0.141238836 172.31.31.144 -> 172.31.23.72 OpenFlow 187 Type: OFPT_PACKET_OUT
150 0.141273903 172.31.23.72 -> 172.31.31.144 OpenFlow 189 Type: OFPT_PACKET_IN
151 0.141298627 172.31.31.144 -> 172.31.23.72 OpenFlow 187 Type: OFPT_PACKET_OUT
152 0.141303444 172.31.23.72 -> 172.31.31.144 OpenFlow 189 Type: OFPT_PACKET_IN
153 0.141366001 172.31.31.144 -> 172.31.23.72 OpenFlow 187 Type: OFPT_PACKET_OUT
154 0.141419311 172.31.31.144 -> 172.31.23.72 OpenFlow 187 Type: OFPT_PACKET_OUT
155 0.141492618 172.31.31.144 -> 172.31.23.72 OpenFlow 187 Type: OFPT_PACKET_OUT
156 0.141578798 172.31.23.72 -> 172.31.31.144 TCP 66 51144 → 6633 [ACK] Seq=8917 Ack=823 Win=213 Len=0 TSval=23922408 TSecr=5352282
157 0.141671853 172.31.23.72 -> 172.31.31.144 OpenFlow 189 Type: OFPT_PACKET_IN
158 0.141697020 172.31.31.144 -> 172.31.23.72 OpenFlow 187 Type: OFPT_PACKET_OUT
159 0.141703346 172.31.23.72 -> 172.31.31.144 OpenFlow 189 Type: OFPT_PACKET_IN
160 0.141748245 172.31.31.144 -> 172.31.23.72 OpenFlow 187 Type: OFPT_PACKET_OUT
161 0.141810632 172.31.31.144 -> 172.31.23.72 OpenFlow 187 Type: OFPT_PACKET_OUT
162 0.141821134 172.31.23.72 -> 172.31.31.144 OpenFlow 189 Type: OFPT_PACKET_IN
163 0.141844319 172.31.23.72 -> 172.31.31.144 OpenFlow 189 Type: OFPT_PACKET_IN
164 0.141851879 172.31.23.72 -> 172.31.31.144 OpenFlow 189 Type: OFPT_PACKET_IN
165 0.141894733 172.31.31.144 -> 172.31.23.72 OpenFlow 187 Type: OFPT_PACKET_OUT
166 0.141900833 172.31.23.72 -> 172.31.31.144 OpenFlow 189 Type: OFPT_PACKET_IN
167 0.141967960 172.31.31.144 -> 172.31.23.72 OpenFlow 187 Type: OFPT_PACKET_OUT
168 0.141972794 172.31.31.144 -> 172.31.23.72 OpenFlow 187 Type: OFPT_PACKET_OUT
169 0.141974694 172.31.31.144 -> 172.31.23.72 TCP 66 6633 → 51138 [ACK] Seq=1211 Ack=985 Win=853 Len=0 TSval=5352283 TSecr=23922408
170 0.141977553 172.31.31.144 -> 172.31.23.72 OpenFlow 187 Type: OFPT_PACKET_OUT
171 0.141993048 172.31.31.144 -> 172.31.23.72 OpenFlow 187 Type: OFPT_PACKET_OUT
172 0.141995486 172.31.31.144 -> 172.31.23.72 TCP 66 6633 → 51148 [ACK] Seq=97 Ack=7924 Win=853 Len=0 TSval=5352283 TSecr=23922402
173 0.142044845 172.31.31.144 -> 172.31.23.72 OpenFlow 187 Type: OFPT_PACKET_OUT
174 0.142196554 172.31.23.72 -> 172.31.31.144 TCP 66 51146 → 6633 [ACK] Seq=10277 Ack=944 Win=213 Len=0 TSval=23922408 TSecr=5352283
175 0.142278236 172.31.23.72 -> 172.31.31.144 OpenFlow 189 Type: OFPT_PACKET_IN
176 0.142302637 172.31.23.72 -> 172.31.31.144 OpenFlow 435 Type: OFPT_PACKET_IN
177 0.142323741 172.31.23.72 -> 172.31.31.144 OpenFlow 189 Type: OFPT_PACKET_IN
178 0.142332219 172.31.31.144 -> 172.31.23.72 OpenFlow 187 Type: OFPT_PACKET_OUT
179 0.142352342 172.31.23.72 -> 172.31.31.144 OpenFlow 189 Type: OFPT_PACKET_IN
180 0.142372393 172.31.23.72 -> 172.31.31.144 OpenFlow 189 Type: OFPT_PACKET_IN
181 0.142374573 172.31.23.72 -> 172.31.31.144 OpenFlow 189 Type: OFPT_PACKET_IN
182 0.142394654 172.31.31.144 -> 172.31.23.72 OpenFlow 187 Type: OFPT_PACKET_OUT
183 0.142398181 172.31.31.144 -> 172.31.23.72 OpenFlow 308 Type: OFPT_PACKET_OUT
184 0.142400365 172.31.31.144 -> 172.31.23.72 OpenFlow 187 Type: OFPT_PACKET_OUT
185 0.142434519 172.31.23.72 -> 172.31.31.144 OpenFlow 435 Type: OFPT_PACKET_IN
186 0.142441047 172.31.23.72 -> 172.31.31.144 OpenFlow 189 Type: OFPT_PACKET_IN
187 0.142476960 172.31.23.72 -> 172.31.31.144 TCP 66 51144 → 6633 [ACK] Seq=8917 Ack=1065 Win=213 Len=0 TSval=23922408 TSecr=5352283
188 0.142487921 172.31.31.144 -> 172.31.23.72 OpenFlow 187 Type: OFPT_PACKET_OUT
189 0.142491347 172.31.31.144 -> 172.31.23.72 TCP 66 6633 → 51136 [ACK] Seq=1211 Ack=370 Win=853 Len=0 TSval=5352283 TSecr=23922408
190 0.142494479 172.31.31.144 -> 172.31.23.72 TCP 66 6633 → 51136 [ACK] Seq=1211 Ack=739 Win=853 Len=0 TSval=5352283 TSecr=23922408
191 0.142496335 172.31.31.144 -> 172.31.23.72 OpenFlow 187 Type: OFPT_PACKET_OUT
192 0.142588335 172.31.23.72 -> 172.31.31.144 OpenFlow 189 Type: OFPT_PACKET_IN
193 0.142612645 172.31.31.144 -> 172.31.23.72 OpenFlow 187 Type: OFPT_PACKET_OUT
194 0.142678285 172.31.31.144 -> 172.31.23.72 OpenFlow 187 Type: OFPT_PACKET_OUT
195 0.142709857 172.31.23.72 -> 172.31.31.144 OpenFlow 189 Type: OFPT_PACKET_IN
196 0.142733526 172.31.31.144 -> 172.31.23.72 TCP 66 6633 → 51142 [ACK] Seq=1307 Ack=9521 Win=853 Len=0 TSval=5352283 TSecr=23922408
197 0.142739707 172.31.23.72 -> 172.31.31.144 OpenFlow 189 Type: OFPT_PACKET_IN
198 0.142744795 172.31.23.72 -> 172.31.31.144 OpenFlow 189 Type: OFPT_PACKET_IN
199 0.142768223 172.31.31.144 -> 172.31.23.72 OpenFlow 187 Type: OFPT_PACKET_OUT
200 0.142773500 172.31.23.72 -> 172.31.31.144 OpenFlow 189 Type: OFPT_PACKET_IN
201 0.142831800 172.31.31.144 -> 172.31.23.72 TCP 66 6633 → 51150 [ACK] Seq=1 Ack=247 Win=853 Len=0 TSval=5352283 TSecr=23922408
202 0.142839037 172.31.31.144 -> 172.31.23.72 OpenFlow 187 Type: OFPT_PACKET_OUT
203 0.142860825 172.31.31.144 -> 172.31.23.72 TCP 66 6633 → 51140 [ACK] Seq=727 Ack=739 Win=853 Len=0 TSval=5352283 TSecr=23922408
204 0.142937954 172.31.31.144 -> 172.31.23.72 TCP 66 6633 → 51152 [ACK] Seq=1 Ack=247 Win=853 Len=0 TSval=5352283 TSecr=23922408
205 0.143170479 172.31.23.72 -> 172.31.31.144 OpenFlow 189 Type: OFPT_PACKET_IN
206 0.143198514 172.31.23.72 -> 172.31.31.144 OpenFlow 189 Type: OFPT_PACKET_IN
207 0.143285075 172.31.31.144 -> 172.31.23.72 OpenFlow 187 Type: OFPT_PACKET_OUT
208 0.143298157 172.31.31.144 -> 172.31.23.72 OpenFlow 308 Type: OFPT_PACKET_OUT
209 0.143370767 172.31.31.144 -> 172.31.23.72 TCP 66 6633 → 51146 [ACK] Seq=1307 Ack=10523 Win=853 Len=0 TSval=5352283 TSecr=23922409
210 0.143380350 172.31.23.72 -> 172.31.31.144 OpenFlow 189 Type: OFPT_PACKET_IN
211 0.143402210 172.31.23.72 -> 172.31.31.144 OpenFlow 189 Type: OFPT_PACKET_IN
212 0.143410446 172.31.23.72 -> 172.31.31.144 OpenFlow 189 Type: OFPT_PACKET_IN
213 0.143462482 172.31.23.72 -> 172.31.31.144 OpenFlow 189 Type: OFPT_PACKET_IN
214 0.143574980 172.31.23.72 -> 172.31.31.144 OpenFlow 189 Type: OFPT_PACKET_IN
215 0.143598424 172.31.23.72 -> 172.31.31.144 OpenFlow 189 Type: OFPT_PACKET_IN
216 0.143603299 172.31.23.72 -> 172.31.31.144 OpenFlow 189 Type: OFPT_PACKET_IN
217 0.143656173 172.31.23.72 -> 172.31.31.144 OpenFlow 189 Type: OFPT_PACKET_IN
218 0.143666606 172.31.23.72 -> 172.31.31.144 OpenFlow 189 Type: OFPT_PACKET_IN
219 0.143780222 172.31.23.72 -> 172.31.31.144 OpenFlow 189 Type: OFPT_PACKET_IN
220 0.143796264 172.31.23.72 -> 172.31.31.144 OpenFlow 189 Type: OFPT_PACKET_IN
221 0.143833567 172.31.23.72 -> 172.31.31.144 OpenFlow 189 Type: OFPT_PACKET_IN
222 0.155160173 172.31.23.72 -> 172.31.31.144 TCP 189 [TCP Retransmission] 51148 → 6633 [PSH, ACK] Seq=8416 Ack=1065 Win=213 Len=123 TSval=23922412 TSecr=5352283
223 0.155168774 172.31.23.72 -> 172.31.31.144 TCP 189 [TCP Retransmission] 51154 → 6633 [PSH, ACK] Seq=124 Ack=1 Win=213 Len=123 TSval=23922412 TSecr=5351607
224 0.155171663 172.31.23.72 -> 172.31.31.144 TCP 189 [TCP Retransmission] 51142 → 6633 [PSH, ACK] Seq=9644 Ack=1307 Win=213 Len=123 TSval=23922412 TSecr=5352283
225 0.155173993 172.31.23.72 -> 172.31.31.144 TCP 189 [TCP Retransmission] 51162 → 6633 [PSH, ACK] Seq=124 Ack=1 Win=213 Len=123 TSval=23922412 TSecr=5351607
226 0.155176475 172.31.23.72 -> 172.31.31.144 TCP 189 [TCP Retransmission] 51150 → 6633 [PSH, ACK] Seq=370 Ack=364 Win=213 Len=123 TSval=23922412 TSecr=5352283
227 0.155178996 172.31.23.72 -> 172.31.31.144 TCP 189 [TCP Retransmission] 51156 → 6633 [PSH, ACK] Seq=124 Ack=1 Win=213 Len=123 TSval=23922412 TSecr=5351657
228 0.155396509 172.31.31.144 -> 172.31.23.72 TCP 78 6633 → 51148 [ACK] Seq=1065 Ack=8539 Win=853 Len=0 TSval=5352286 TSecr=23922408 SLE=8416 SRE=8539
229 0.155406029 172.31.31.144 -> 172.31.23.72 TCP 78 6633 → 51154 [ACK] Seq=1 Ack=247 Win=853 Len=0 TSval=5352286 TSecr=23922408 SLE=124 SRE=247
230 0.155409963 172.31.31.144 -> 172.31.23.72 TCP 78 6633 → 51142 [ACK] Seq=1307 Ack=9767 Win=853 Len=0 TSval=5352286 TSecr=23922409 SLE=9644 SRE=9767
231 0.155436151 172.31.31.144 -> 172.31.23.72 TCP 78 6633 → 51162 [ACK] Seq=1 Ack=247 Win=853 Len=0 TSval=5352286 TSecr=23922409 SLE=124 SRE=247
232 0.155453952 172.31.31.144 -> 172.31.23.72 TCP 78 6633 → 51150 [ACK] Seq=364 Ack=493 Win=853 Len=0 TSval=5352286 TSecr=23922409 SLE=370 SRE=493
233 0.155504910 172.31.31.144 -> 172.31.23.72 TCP 78 6633 → 51156 [ACK] Seq=1 Ack=247 Win=853 Len=0 TSval=5352286 TSecr=23922409 SLE=124 SRE=247
234 0.181824133 172.31.31.144 -> 172.31.23.72 TCP 66 6633 → 51152 [ACK] Seq=1 Ack=370 Win=853 Len=0 TSval=5352293 TSecr=23922409
235 0.191340729 172.31.31.144 -> 172.31.23.72 OpenFlow 187 Type: OFPT_PACKET_OUT
236 0.191358999 172.31.31.144 -> 172.31.23.72 OpenFlow 162 Type: OFPT_MULTIPART_REQUEST, OFPMP_FLOW
237 0.191766998 172.31.31.144 -> 172.31.23.72 OpenFlow 187 Type: OFPT_PACKET_OUT
238 0.191810274 172.31.31.144 -> 172.31.23.72 OpenFlow 187 Type: OFPT_PACKET_OUT
239 0.191853133 172.31.23.72 -> 172.31.31.144 OpenFlow 6178 Type: OFPT_MULTIPART_REPLY, OFPMP_TABLE
240 0.191953038 172.31.31.144 -> 172.31.23.72 OpenFlow 187 Type: OFPT_PACKET_OUT
241 0.191970270 172.31.23.72 -> 172.31.31.144 OpenFlow 642 Type: OFPT_MULTIPART_REPLY, OFPMP_PORT_STATS
242 0.191983455 172.31.31.144 -> 172.31.23.72 OpenFlow 187 Type: OFPT_PACKET_OUT
243 0.192028934 172.31.23.72 -> 172.31.31.144 OpenFlow 970 Type: OFPT_MULTIPART_REPLY, OFPMP_FLOW
244 0.192110395 172.31.31.144 -> 172.31.23.72 OpenFlow 187 Type: OFPT_PACKET_OUT
245 0.192197198 172.31.31.144 -> 172.31.23.72 OpenFlow 187 Type: OFPT_PACKET_OUT
246 0.192249481 172.31.31.144 -> 172.31.23.72 TCP 66 6633 → 51150 [ACK] Seq=1065 Ack=7181 Win=853 Len=0 TSval=5352295 TSecr=23922421
247 0.192255145 172.31.31.144 -> 172.31.23.72 TCP 66 6633 → 51150 [ACK] Seq=1065 Ack=8085 Win=853 Len=0 TSval=5352295 TSecr=23922421
248 0.192315995 172.31.31.144 -> 172.31.23.72 OpenFlow 187 Type: OFPT_PACKET_OUT
249 0.192341569 172.31.23.72 -> 172.31.31.144 OpenFlow 189 Type: OFPT_PACKET_IN
250 0.192352201 172.31.31.144 -> 172.31.23.72 OpenFlow 187 Type: OFPT_PACKET_OUT
251 0.192368327 172.31.23.72 -> 172.31.31.144 OpenFlow 189 Type: OFPT_PACKET_IN
252 0.192383544 172.31.23.72 -> 172.31.31.144 OpenFlow 189 Type: OFPT_PACKET_IN
253 0.192408479 172.31.31.144 -> 172.31.23.72 OpenFlow 187 Type: OFPT_PACKET_OUT
254 0.192450027 172.31.23.72 -> 172.31.31.144 OpenFlow 189 Type: OFPT_PACKET_IN
255 0.192486126 172.31.31.144 -> 172.31.23.72 OpenFlow 187 Type: OFPT_PACKET_OUT
256 0.192530414 172.31.31.144 -> 172.31.23.72 TCP 66 6633 → 51158 [ACK] Seq=1 Ack=124 Win=853 Len=0 TSval=5352295 TSecr=23922421
257 0.192545494 172.31.31.144 -> 172.31.23.72 TCP 66 6633 → 51158 [ACK] Seq=1 Ack=247 Win=853 Len=0 TSval=5352295 TSecr=23922421
258 0.192575323 172.31.23.72 -> 172.31.31.144 OpenFlow 189 Type: OFPT_PACKET_IN
259 0.192643462 172.31.31.144 -> 172.31.23.72 TCP 66 6633 → 51144 [ACK] Seq=1065 Ack=9163 Win=853 Len=0 TSval=5352295 TSecr=23922421
260 0.192763603 172.31.31.144 -> 172.31.23.72 TCP 66 6633 → 51152 [ACK] Seq=727 Ack=493 Win=853 Len=0 TSval=5352295 TSecr=23922421
261 0.192910042 172.31.23.72 -> 172.31.31.144 OpenFlow 189 Type: OFPT_PACKET_IN
262 0.192943003 172.31.23.72 -> 172.31.31.144 OpenFlow 189 Type: OFPT_PACKET_IN
263 0.192962677 172.31.23.72 -> 172.31.31.144 OpenFlow 189 Type: OFPT_PACKET_IN
264 0.192995742 172.31.23.72 -> 172.31.31.144 OpenFlow 189 Type: OFPT_PACKET_IN
265 0.193048719 172.31.23.72 -> 172.31.31.144 OpenFlow 189 Type: OFPT_PACKET_IN
266 0.193054398 172.31.23.72 -> 172.31.31.144 OpenFlow 189 Type: OFPT_PACKET_IN
267 0.193156451 172.31.31.144 -> 172.31.23.72 TCP 66 6633 → 51150 [ACK] Seq=1065 Ack=8208 Win=853 Len=0 TSval=5352295 TSecr=23922421
268 0.193173015 172.31.31.144 -> 172.31.23.72 TCP 66 6633 → 51150 [ACK] Seq=1065 Ack=8331 Win=853 Len=0 TSval=5352295 TSecr=23922421
269 0.193189001 172.31.31.144 -> 172.31.23.72 TCP 66 6633 → 51160 [ACK] Seq=1 Ack=124 Win=853 Len=0 TSval=5352295 TSecr=23922421
270 0.193246357 172.31.31.144 -> 172.31.23.72 TCP 66 6633 → 51160 [ACK] Seq=1 Ack=247 Win=853 Len=0 TSval=5352295 TSecr=23922421
271 0.193484097 172.31.31.144 -> 172.31.23.72 TCP 66 6633 → 51144 [ACK] Seq=1065 Ack=9409 Win=853 Len=0 TSval=5352295 TSecr=23922421
272 0.215282111 172.31.31.144 -> 172.31.23.72 OpenFlow 82 Type: OFPT_MULTIPART_REQUEST, OFPMP_TABLE
273 0.215323155 172.31.31.144 -> 172.31.23.72 OpenFlow 146 Type: OFPT_MULTIPART_REQUEST, OFPMP_PORT_STATS
274 0.215624439 172.31.23.72 -> 172.31.31.144 OpenFlow 6178 Type: OFPT_MULTIPART_REPLY, OFPMP_TABLE
275 0.215689667 172.31.23.72 -> 172.31.31.144 OpenFlow 1178 Type: OFPT_MULTIPART_REPLY, OFPMP_FLOW
276 0.215777698 172.31.23.72 -> 172.31.31.144 OpenFlow 530 Type: OFPT_MULTIPART_REPLY, OFPMP_PORT_STATS
277 0.215954628 172.31.31.144 -> 172.31.23.72 TCP 66 6633 → 51152 [ACK] Seq=823 Ack=8181 Win=853 Len=0 TSval=5352301 TSecr=23922427
278 0.273067581 172.31.31.144 -> 172.31.23.72 OpenFlow 90 Type: OFPT_MULTIPART_REQUEST, OFPMP_PORT_STATS
279 0.273472715 172.31.23.72 -> 172.31.31.144 OpenFlow 530 Type: OFPT_MULTIPART_REPLY, OFPMP_PORT_STATS
280 0.273675407 172.31.31.144 -> 172.31.23.72 OpenFlow 82 Type: OFPT_MULTIPART_REQUEST, OFPMP_TABLE
281 0.273702629 172.31.31.144 -> 172.31.23.72 TCP 66 6633 → 51154 [ACK] Seq=41 Ack=711 Win=853 Len=0 TSval=5352315 TSecr=23922441
282 0.273739577 172.31.31.144 -> 172.31.23.72 OpenFlow 122 Type: OFPT_MULTIPART_REQUEST, OFPMP_FLOW
283 0.273997294 172.31.23.72 -> 172.31.31.144 OpenFlow 6178 Type: OFPT_MULTIPART_REPLY, OFPMP_TABLE
284 0.274072627 172.31.23.72 -> 172.31.31.144 OpenFlow 2218 Type: OFPT_MULTIPART_REPLY, OFPMP_FLOW
285 0.274304665 172.31.31.144 -> 172.31.23.72 TCP 66 6633 → 51154 [ACK] Seq=97 Ack=8975 Win=853 Len=0 TSval=5352316 TSecr=23922441
286 0.333906560 172.31.31.144 -> 172.31.23.72 OpenFlow 122 Type: OFPT_MULTIPART_REQUEST, OFPMP_FLOW
287 0.333941088 172.31.31.144 -> 172.31.23.72 OpenFlow 106 Type: OFPT_MULTIPART_REQUEST, OFPMP_PORT_STATS
288 0.334222238 172.31.23.72 -> 172.31.31.144 OpenFlow 3050 Type: OFPT_MULTIPART_REPLY, OFPMP_FLOW
289 0.334393188 172.31.23.72 -> 172.31.31.144 OpenFlow 6178 Type: OFPT_MULTIPART_REPLY, OFPMP_TABLE
290 0.334495434 172.31.31.144 -> 172.31.23.72 TCP 66 6633 → 51156 [ACK] Seq=97 Ack=3231 Win=853 Len=0 TSval=5352331 TSecr=23922456
291 0.334525076 172.31.23.72 -> 172.31.31.144 OpenFlow 754 Type: OFPT_MULTIPART_REPLY, OFPMP_PORT_STATS
292 0.334618865 172.31.31.144 -> 172.31.23.72 TCP 66 6633 → 51156 [ACK] Seq=97 Ack=9343 Win=853 Len=0 TSval=5352331 TSecr=23922456
293 0.334686949 172.31.31.144 -> 172.31.23.72 TCP 66 6633 → 51156 [ACK] Seq=97 Ack=10031 Win=853 Len=0 TSval=5352331 TSecr=23922456
294 0.336915665 172.31.31.144 -> 172.31.23.72 OpenFlow 90 Type: OFPT_MULTIPART_REQUEST, OFPMP_GROUP
295 0.336922635 172.31.31.144 -> 172.31.23.72 OpenFlow 82 Type: OFPT_MULTIPART_REQUEST, OFPMP_GROUP_DESC
296 0.336935015 172.31.31.144 -> 172.31.23.72 OpenFlow 90 Type: OFPT_MULTIPART_REQUEST, OFPMP_METER
297 0.336964261 172.31.31.144 -> 172.31.23.72 OpenFlow 187 Type: OFPT_PACKET_OUT
298 0.336991998 172.31.31.144 -> 172.31.23.72 OpenFlow 187 Type: OFPT_PACKET_OUT
299 0.337061158 172.31.31.144 -> 172.31.23.72 OpenFlow 187 Type: OFPT_PACKET_OUT
300 0.337080388 172.31.23.72 -> 172.31.31.144 OpenFlow 82 Type: OFPT_MULTIPART_REPLY, OFPMP_GROUP
301 0.337106531 172.31.31.144 -> 172.31.23.72 OpenFlow 187 Type: OFPT_PACKET_OUT
302 0.337114828 172.31.23.72 -> 172.31.31.144 OpenFlow 98 Type: OFPT_MULTIPART_REPLY, OFPMP_METER
303 0.337164796 172.31.31.144 -> 172.31.23.72 OpenFlow 187 Type: OFPT_PACKET_OUT
304 0.337230412 172.31.31.144 -> 172.31.23.72 OpenFlow 187 Type: OFPT_PACKET_OUT
305 0.337346326 172.31.31.144 -> 172.31.23.72 OpenFlow 187 Type: OFPT_PACKET_OUT
306 0.337364204 172.31.31.144 -> 172.31.23.72 TCP 66 6633 → 51126 [ACK] Seq=65 Ack=295 Win=853 Len=0 TSval=5352331 TSecr=23922457
307 0.337384376 172.31.31.144 -> 172.31.23.72 OpenFlow 308 Type: OFPT_PACKET_OUT
308 0.337443202 172.31.31.144 -> 172.31.23.72 OpenFlow 187 Type: OFPT_PACKET_OUT
309 0.337470423 172.31.23.72 -> 172.31.31.144 TCP 66 51154 → 6633 [ACK] Seq=8975 Ack=823 Win=213 Len=0 TSval=23922457 TSecr=5352331
310 0.337488453 172.31.31.144 -> 172.31.23.72 OpenFlow 187 Type: OFPT_PACKET_OUT
311 0.337548355 172.31.31.144 -> 172.31.23.72 OpenFlow 187 Type: OFPT_PACKET_OUT
312 0.337593595 172.31.31.144 -> 172.31.23.72 OpenFlow 187 Type: OFPT_PACKET_OUT
313 0.337646988 172.31.23.72 -> 172.31.31.144 OpenFlow 189 Type: OFPT_PACKET_IN
314 0.337657758 172.31.31.144 -> 172.31.23.72 OpenFlow 187 Type: OFPT_PACKET_OUT
315 0.337673180 172.31.23.72 -> 172.31.31.144 OpenFlow 189 Type: OFPT_PACKET_IN
316 0.337706399 172.31.23.72 -> 172.31.31.144 OpenFlow 189 Type: OFPT_PACKET_IN
317 0.337731356 172.31.23.72 -> 172.31.31.144 OpenFlow 189 Type: OFPT_PACKET_IN
318 0.337738476 172.31.31.144 -> 172.31.23.72 OpenFlow 187 Type: OFPT_PACKET_OUT
319 0.337744028 172.31.23.72 -> 172.31.31.144 OpenFlow 189 Type: OFPT_PACKET_IN
320 0.337749573 172.31.23.72 -> 172.31.31.144 OpenFlow 189 Type: OFPT_PACKET_IN
321 0.337867767 172.31.31.144 -> 172.31.23.72 OpenFlow 187 Type: OFPT_PACKET_OUT
322 0.337937417 172.31.31.144 -> 172.31.23.72 TCP 66 6633 → 51156 [ACK] Seq=1307 Ack=10277 Win=853 Len=0 TSval=5352332 TSecr=23922457
323 0.338119246 172.31.31.144 -> 172.31.23.72 TCP 66 6633 → 51164 [ACK] Seq=1 Ack=247 Win=853 Len=0 TSval=5352332 TSecr=23922457
324 0.338198690 172.31.31.144 -> 172.31.23.72 TCP 66 6633 → 51146 [ACK] Seq=1307 Ack=10769 Win=853 Len=0 TSval=5352332 TSecr=23922457
325 0.338268093 172.31.23.72 -> 172.31.31.144 OpenFlow 189 Type: OFPT_PACKET_IN
326 0.338298611 172.31.23.72 -> 172.31.31.144 OpenFlow 189 Type: OFPT_PACKET_IN
327 0.338311635 172.31.23.72 -> 172.31.31.144 OpenFlow 189 Type: OFPT_PACKET_IN
328 0.338329096 172.31.23.72 -> 172.31.31.144 OpenFlow 189 Type: OFPT_PACKET_IN
329 0.338349095 172.31.23.72 -> 172.31.31.144 OpenFlow 189 Type: OFPT_PACKET_IN
330 0.338395557 172.31.23.72 -> 172.31.31.144 OpenFlow 189 Type: OFPT_PACKET_IN
331 0.338401130 172.31.23.72 -> 172.31.31.144 OpenFlow 189 Type: OFPT_PACKET_IN
332 0.338452586 172.31.31.144 -> 172.31.23.72 TCP 66 6633 → 51158 [ACK] Seq=1 Ack=370 Win=853 Len=0 TSval=5352332 TSecr=23922457
333 0.338460745 172.31.23.72 -> 172.31.31.144 OpenFlow 189 Type: OFPT_PACKET_IN
334 0.338480712 172.31.23.72 -> 172.31.31.144 OpenFlow 189 Type: OFPT_PACKET_IN
335 0.338519994 172.31.31.144 -> 172.31.23.72 TCP 66 6633 → 51158 [ACK] Seq=1 Ack=493 Win=853 Len=0 TSval=5352332 TSecr=23922457
336 0.338523585 172.31.31.144 -> 172.31.23.72 TCP 66 6633 → 51168 [ACK] Seq=1 Ack=124 Win=853 Len=0 TSval=5352332 TSecr=23922457
337 0.338526590 172.31.31.144 -> 172.31.23.72 TCP 66 6633 → 51166 [ACK] Seq=1 Ack=124 Win=853 Len=0 TSval=5352332 TSecr=23922457
338 0.338553991 172.31.23.72 -> 172.31.31.144 OpenFlow 189 Type: OFPT_PACKET_IN
339 0.338586400 172.31.31.144 -> 172.31.23.72 TCP 66 6633 → 51168 [ACK] Seq=1 Ack=247 Win=853 Len=0 TSval=5352332 TSecr=23922457
340 0.338621152 172.31.31.144 -> 172.31.23.72 TCP 66 6633 → 51166 [ACK] Seq=1 Ack=247 Win=853 Len=0 TSval=5352332 TSecr=23922457
341 0.338690532 172.31.31.144 -> 172.31.23.72 TCP 66 6633 → 51148 [ACK] Seq=1065 Ack=8662 Win=853 Len=0 TSval=5352332 TSecr=23922457
342 0.338706950 172.31.31.144 -> 172.31.23.72 TCP 66 6633 → 51148 [ACK] Seq=1065 Ack=8785 Win=853 Len=0 TSval=5352332 TSecr=23922457
343 0.338923209 172.31.31.144 -> 172.31.23.72 TCP 66 6633 → 51154 [ACK] Seq=823 Ack=9221 Win=853 Len=0 TSval=5352332 TSecr=23922457
344 0.375180190 172.31.23.72 -> 172.31.31.144 TCP 66 51156 → 6633 [ACK] Seq=10277 Ack=1307 Win=213 Len=0 TSval=23922467 TSecr=5352332
345 0.382309465 172.31.31.144 -> 172.31.23.72 OpenFlow 122 Type: OFPT_MULTIPART_REQUEST, OFPMP_FLOW
346 0.382325787 172.31.31.144 -> 172.31.23.72 OpenFlow 106 Type: OFPT_MULTIPART_REQUEST, OFPMP_PORT_STATS
347 0.382656664 172.31.23.72 -> 172.31.31.144 OpenFlow 2842 Type: OFPT_MULTIPART_REPLY, OFPMP_FLOW
348 0.382836450 172.31.23.72 -> 172.31.31.144 OpenFlow 6178 Type: OFPT_MULTIPART_REPLY, OFPMP_TABLE
349 0.382936061 172.31.31.144 -> 172.31.23.72 TCP 66 6633 → 51158 [ACK] Seq=97 Ack=3269 Win=853 Len=0 TSval=5352343 TSecr=23922468
350 0.382970094 172.31.23.72 -> 172.31.31.144 OpenFlow 754 Type: OFPT_MULTIPART_REPLY, OFPMP_PORT_STATS
351 0.383195526 172.31.31.144 -> 172.31.23.72 TCP 66 6633 → 51158 [ACK] Seq=97 Ack=10069 Win=853 Len=0 TSval=5352343 TSecr=23922468
352 0.487498360 172.31.31.144 -> 172.31.23.72 OpenFlow 122 Type: OFPT_MULTIPART_REQUEST, OFPMP_FLOW
353 0.487526540 172.31.31.144 -> 172.31.23.72 OpenFlow 106 Type: OFPT_MULTIPART_REQUEST, OFPMP_TABLE
354 0.487876974 172.31.23.72 -> 172.31.31.144 OpenFlow 2010 Type: OFPT_MULTIPART_REPLY, OFPMP_FLOW
355 0.487972266 172.31.23.72 -> 172.31.31.144 OpenFlow 530 Type: OFPT_MULTIPART_REPLY, OFPMP_PORT_STATS
356 0.488124548 172.31.31.144 -> 172.31.23.72 TCP 66 6633 → 51160 [ACK] Seq=97 Ack=2191 Win=853 Len=0 TSval=5352369 TSecr=23922495
357 0.488132468 172.31.31.144 -> 172.31.23.72 TCP 66 6633 → 51160 [ACK] Seq=97 Ack=2655 Win=853 Len=0 TSval=5352369 TSecr=23922495
358 0.488153740 172.31.23.72 -> 172.31.31.144 OpenFlow 6178 Type: OFPT_MULTIPART_REPLY, OFPMP_TABLE
359 0.488354772 172.31.31.144 -> 172.31.23.72 TCP 66 6633 → 51160 [ACK] Seq=97 Ack=8767 Win=853 Len=0 TSval=5352369 TSecr=23922495
360 0.537287794 172.31.31.144 -> 172.31.23.72 OpenFlow 90 Type: OFPT_MULTIPART_REQUEST, OFPMP_GROUP
361 0.537313961 172.31.31.144 -> 172.31.23.72 OpenFlow 90 Type: OFPT_MULTIPART_REQUEST, OFPMP_GROUP
362 0.537332453 172.31.31.144 -> 172.31.23.72 OpenFlow 90 Type: OFPT_MULTIPART_REQUEST, OFPMP_GROUP
363 0.537335618 172.31.31.144 -> 172.31.23.72 OpenFlow 90 Type: OFPT_MULTIPART_REQUEST, OFPMP_GROUP
364 0.537338151 172.31.31.144 -> 172.31.23.72 OpenFlow 106 Type: OFPT_MULTIPART_REQUEST, OFPMP_METER
365 0.537351169 172.31.31.144 -> 172.31.23.72 OpenFlow 106 Type: OFPT_MULTIPART_REQUEST, OFPMP_METER
366 0.537371044 172.31.31.144 -> 172.31.23.72 OpenFlow 106 Type: OFPT_MULTIPART_REQUEST, OFPMP_METER
367 0.537390014 172.31.31.144 -> 172.31.23.72 OpenFlow 106 Type: OFPT_MULTIPART_REQUEST, OFPMP_METER
368 0.537408689 172.31.31.144 -> 172.31.23.72 OpenFlow 187 Type: OFPT_PACKET_OUT
369 0.537468319 172.31.31.144 -> 172.31.23.72 OpenFlow 187 Type: OFPT_PACKET_OUT
370 0.537549221 172.31.31.144 -> 172.31.23.72 OpenFlow 187 Type: OFPT_PACKET_OUT
371 0.537560383 172.31.23.72 -> 172.31.31.144 OpenFlow 82 Type: OFPT_MULTIPART_REPLY, OFPMP_GROUP
372 0.537585492 172.31.23.72 -> 172.31.31.144 OpenFlow 98 Type: OFPT_MULTIPART_REPLY, OFPMP_METER
373 0.537616414 172.31.31.144 -> 172.31.23.72 OpenFlow 187 Type: OFPT_PACKET_OUT
374 0.537623757 172.31.23.72 -> 172.31.31.144 OpenFlow 82 Type: OFPT_MULTIPART_REPLY, OFPMP_GROUP
375 0.537639844 172.31.23.72 -> 172.31.31.144 OpenFlow 98 Type: OFPT_MULTIPART_REPLY, OFPMP_METER
376 0.537684219 172.31.31.144 -> 172.31.23.72 OpenFlow 187 Type: OFPT_PACKET_OUT
377 0.537692530 172.31.23.72 -> 172.31.31.144 OpenFlow 82 Type: OFPT_MULTIPART_REPLY, OFPMP_GROUP
378 0.537712457 172.31.23.72 -> 172.31.31.144 OpenFlow 98 Type: OFPT_MULTIPART_REPLY, OFPMP_METER
379 0.537740182 172.31.31.144 -> 172.31.23.72 TCP 66 6633 → 51132 [ACK] Seq=1033 Ack=509 Win=853 Len=0 TSval=5352382 TSecr=23922507
380 0.537762381 172.31.31.144 -> 172.31.23.72 TCP 66 6633 → 51132 [ACK] Seq=1033 Ack=541 Win=853 Len=0 TSval=5352382 TSecr=23922507
381 0.537806056 172.31.31.144 -> 172.31.23.72 OpenFlow 187 Type: OFPT_PACKET_OUT
382 0.537823588 172.31.31.144 -> 172.31.23.72 TCP 66 6633 → 51130 [ACK] Seq=65 Ack=755 Win=853 Len=0 TSval=5352382 TSecr=23922507
383 0.537842079 172.31.31.144 -> 172.31.23.72 TCP 66 6633 → 51130 [ACK] Seq=65 Ack=787 Win=853 Len=0 TSval=5352382 TSecr=23922507
