  1 0.000000000 172.31.31.144 -> 172.31.23.72 TCP 187 6633 → 40144 [PSH, ACK] Seq=1 Ack=1 Win=853 Len=121 TSval=675525 TSecr=767839
  2 0.000028511 172.31.31.144 -> 172.31.23.72 TCP 187 6633 → 40144 [PSH, ACK] Seq=122 Ack=1 Win=853 Len=121 TSval=675525 TSecr=767839
  3 0.000051684 172.31.31.144 -> 172.31.23.72 TCP 187 6633 → 40144 [PSH, ACK] Seq=243 Ack=1 Win=853 Len=121 TSval=675525 TSecr=767839
  4 0.000110284 172.31.31.144 -> 172.31.23.72 TCP 187 6633 → 40144 [PSH, ACK] Seq=364 Ack=1 Win=853 Len=121 TSval=675525 TSecr=767839
  5 0.000185015 172.31.31.144 -> 172.31.23.72 TCP 187 6633 → 40144 [PSH, ACK] Seq=485 Ack=1 Win=853 Len=121 TSval=675525 TSecr=767839
  6 0.000244401 172.31.31.144 -> 172.31.23.72 TCP 187 6633 → 40144 [PSH, ACK] Seq=606 Ack=1 Win=853 Len=121 TSval=675525 TSecr=767839
  7 0.000358471 172.31.31.144 -> 172.31.23.72 TCP 187 6633 → 40152 [PSH, ACK] Seq=1 Ack=1 Win=853 Len=121 TSval=675525 TSecr=767840
  8 0.000434109 172.31.31.144 -> 172.31.23.72 TCP 187 6633 → 40152 [PSH, ACK] Seq=122 Ack=1 Win=853 Len=121 TSval=675525 TSecr=767840
  9 0.000450710 172.31.31.144 -> 172.31.23.72 TCP 187 6633 → 40152 [PSH, ACK] Seq=243 Ack=1 Win=853 Len=121 TSval=675525 TSecr=767840
 10 0.000512480 172.31.31.144 -> 172.31.23.72 TCP 187 6633 → 40152 [PSH, ACK] Seq=364 Ack=1 Win=853 Len=121 TSval=675525 TSecr=767840
 11 0.000560070 172.31.23.72 -> 172.31.31.144 TCP 66 40144 → 6633 [ACK] Seq=1 Ack=727 Win=379 Len=0 TSval=768364 TSecr=675525
 12 0.000579263 172.31.31.144 -> 172.31.23.72 TCP 187 6633 → 40152 [PSH, ACK] Seq=485 Ack=1 Win=853 Len=121 TSval=675525 TSecr=767840
 13 0.000640946 172.31.31.144 -> 172.31.23.72 TCP 187 6633 → 40152 [PSH, ACK] Seq=606 Ack=1 Win=853 Len=121 TSval=675525 TSecr=767840
 14 0.000725226 172.31.31.144 -> 172.31.23.72 TCP 187 6633 → 40152 [PSH, ACK] Seq=727 Ack=1 Win=853 Len=121 TSval=675525 TSecr=767840
 15 0.000766477 172.31.31.144 -> 172.31.23.72 TCP 187 6633 → 40152 [PSH, ACK] Seq=848 Ack=1 Win=853 Len=121 TSval=675525 TSecr=767840
 16 0.000826694 172.31.31.144 -> 172.31.23.72 TCP 187 6633 → 40152 [PSH, ACK] Seq=969 Ack=1 Win=853 Len=121 TSval=675525 TSecr=767840
 17 0.000916024 172.31.31.144 -> 172.31.23.72 TCP 187 6633 → 40152 [PSH, ACK] Seq=1090 Ack=1 Win=853 Len=121 TSval=675525 TSecr=767840
 18 0.001069288 172.31.31.144 -> 172.31.23.72 TCP 187 6633 → 40148 [PSH, ACK] Seq=1 Ack=1 Win=853 Len=121 TSval=675525 TSecr=767840
 19 0.001089286 172.31.31.144 -> 172.31.23.72 TCP 187 6633 → 40148 [PSH, ACK] Seq=122 Ack=1 Win=853 Len=121 TSval=675525 TSecr=767840
 20 0.001124530 172.31.23.72 -> 172.31.31.144 TCP 66 40152 → 6633 [ACK] Seq=1 Ack=1211 Win=385 Len=0 TSval=768364 TSecr=675525
 21 0.001142895 172.31.31.144 -> 172.31.23.72 TCP 187 6633 → 40148 [PSH, ACK] Seq=243 Ack=1 Win=853 Len=121 TSval=675525 TSecr=767840
 22 0.001204277 172.31.31.144 -> 172.31.23.72 TCP 187 6633 → 40148 [PSH, ACK] Seq=364 Ack=1 Win=853 Len=121 TSval=675525 TSecr=767840
 23 0.001220594 172.31.23.72 -> 172.31.31.144 OpenFlow 189 Type: OFPT_PACKET_IN
 24 0.001243828 172.31.23.72 -> 172.31.31.144 OpenFlow 189 Type: OFPT_PACKET_IN
 25 0.001253013 172.31.23.72 -> 172.31.31.144 OpenFlow 189 Type: OFPT_PACKET_IN
 26 0.001265972 172.31.31.144 -> 172.31.23.72 TCP 187 6633 → 40148 [PSH, ACK] Seq=485 Ack=1 Win=853 Len=121 TSval=675525 TSecr=767840
 27 0.001275951 172.31.23.72 -> 172.31.31.144 OpenFlow 189 Type: OFPT_PACKET_IN
 28 0.001306908 172.31.23.72 -> 172.31.31.144 OpenFlow 189 Type: OFPT_PACKET_IN
 29 0.001315111 172.31.23.72 -> 172.31.31.144 OpenFlow 189 Type: OFPT_PACKET_IN
 30 0.001317034 172.31.23.72 -> 172.31.31.144 OpenFlow 189 Type: OFPT_PACKET_IN
 31 0.001334450 172.31.31.144 -> 172.31.23.72 TCP 187 6633 → 40148 [PSH, ACK] Seq=606 Ack=1 Win=853 Len=121 TSval=675525 TSecr=767840
 32 0.001362742 172.31.23.72 -> 172.31.31.144 OpenFlow 189 Type: OFPT_PACKET_IN
 33 0.001367927 172.31.23.72 -> 172.31.31.144 OpenFlow 189 Type: OFPT_PACKET_IN
 34 0.001383094 172.31.23.72 -> 172.31.31.144 OpenFlow 189 Type: OFPT_PACKET_IN
 35 0.001427941 172.31.31.144 -> 172.31.23.72 TCP 66 6633 → 40156 [ACK] Seq=1 Ack=124 Win=853 Len=0 TSval=675525 TSecr=768364
 36 0.001454959 172.31.23.72 -> 172.31.31.144 OpenFlow 189 Type: OFPT_PACKET_IN
 37 0.001503085 172.31.31.144 -> 172.31.23.72 TCP 66 6633 → 40156 [ACK] Seq=1 Ack=247 Win=853 Len=0 TSval=675525 TSecr=768364
 38 0.001508127 172.31.31.144 -> 172.31.23.72 TCP 66 6633 → 40188 [ACK] Seq=1 Ack=124 Win=853 Len=0 TSval=675525 TSecr=768364
 39 0.001511026 172.31.31.144 -> 172.31.23.72 TCP 66 6633 → 40190 [ACK] Seq=1 Ack=124 Win=853 Len=0 TSval=675525 TSecr=768364
 40 0.001513144 172.31.31.144 -> 172.31.23.72 TCP 187 6633 → 40148 [PSH, ACK] Seq=727 Ack=1 Win=853 Len=121 TSval=675525 TSecr=767840
 41 0.001518338 172.31.23.72 -> 172.31.31.144 OpenFlow 189 Type: OFPT_PACKET_IN
 42 0.001528252 172.31.31.144 -> 172.31.23.72 TCP 66 6633 → 40198 [ACK] Seq=1 Ack=124 Win=853 Len=0 TSval=675525 TSecr=768364
 43 0.001530972 172.31.31.144 -> 172.31.23.72 TCP 187 6633 → 40148 [PSH, ACK] Seq=848 Ack=1 Win=853 Len=121 TSval=675525 TSecr=767840
 44 0.001553903 172.31.23.72 -> 172.31.31.144 OpenFlow 189 Type: OFPT_PACKET_IN
 45 0.001567825 172.31.31.144 -> 172.31.23.72 TCP 66 6633 → 40190 [ACK] Seq=1 Ack=247 Win=853 Len=0 TSval=675525 TSecr=768364
 46 0.001571662 172.31.23.72 -> 172.31.31.144 OpenFlow 189 Type: OFPT_PACKET_IN
 47 0.001593489 172.31.31.144 -> 172.31.23.72 TCP 66 6633 → 40188 [ACK] Seq=1 Ack=247 Win=853 Len=0 TSval=675525 TSecr=768364
 48 0.001603073 172.31.23.72 -> 172.31.31.144 OpenFlow 189 Type: OFPT_PACKET_IN
 49 0.001620855 172.31.31.144 -> 172.31.23.72 OpenFlow 187 Type: OFPT_PACKET_OUT
 50 0.001625367 172.31.23.72 -> 172.31.31.144 OpenFlow 189 Type: OFPT_PACKET_IN
 51 0.001629250 172.31.31.144 -> 172.31.23.72 TCP 66 6633 → 40198 [ACK] Seq=1 Ack=247 Win=853 Len=0 TSval=675525 TSecr=768364
 52 0.001645424 172.31.31.144 -> 172.31.23.72 TCP 66 6633 → 40212 [ACK] Seq=1 Ack=124 Win=853 Len=0 TSval=675525 TSecr=768364
 53 0.001677786 172.31.31.144 -> 172.31.23.72 OpenFlow 187 Type: OFPT_PACKET_OUT
 54 0.001692826 172.31.31.144 -> 172.31.23.72 TCP 66 6633 → 40212 [ACK] Seq=1 Ack=247 Win=853 Len=0 TSval=675525 TSecr=768364
 55 0.001763397 172.31.31.144 -> 172.31.23.72 TCP 66 6633 → 40142 [ACK] Seq=1 Ack=247 Win=853 Len=0 TSval=675525 TSecr=768364
 56 0.001794073 172.31.31.144 -> 172.31.23.72 TCP 66 6633 → 40148 [ACK] Seq=1211 Ack=124 Win=853 Len=0 TSval=675525 TSecr=768364
 57 0.001824948 172.31.31.144 -> 172.31.23.72 TCP 66 6633 → 40148 [ACK] Seq=1211 Ack=247 Win=853 Len=0 TSval=675525 TSecr=768364
 58 0.001852908 172.31.31.144 -> 172.31.23.72 TCP 187 6633 → 40154 [PSH, ACK] Seq=1 Ack=1 Win=853 Len=121 TSval=675525 TSecr=767840
 59 0.001873155 172.31.31.144 -> 172.31.23.72 TCP 66 6633 → 40210 [ACK] Seq=1 Ack=247 Win=853 Len=0 TSval=675525 TSecr=768364
 60 0.001908560 172.31.31.144 -> 172.31.23.72 TCP 187 6633 → 40154 [PSH, ACK] Seq=122 Ack=1 Win=853 Len=121 TSval=675525 TSecr=767840
 61 0.002126611 172.31.31.144 -> 172.31.23.72 TCP 187 6633 → 40154 [PSH, ACK] Seq=243 Ack=1 Win=853 Len=121 TSval=675525 TSecr=767840
 62 0.002196726 172.31.23.72 -> 172.31.31.144 OpenFlow 189 Type: OFPT_PACKET_IN
 63 0.002220215 172.31.23.72 -> 172.31.31.144 OpenFlow 189 Type: OFPT_PACKET_IN
 64 0.002317695 172.31.23.72 -> 172.31.31.144 TCP 66 40154 → 6633 [ACK] Seq=1 Ack=364 Win=385 Len=0 TSval=768364 TSecr=675525
 65 0.002328273 172.31.31.144 -> 172.31.23.72 TCP 187 6633 → 40154 [PSH, ACK] Seq=364 Ack=1 Win=853 Len=121 TSval=675525 TSecr=767840
 66 0.002401542 172.31.31.144 -> 172.31.23.72 TCP 187 6633 → 40154 [PSH, ACK] Seq=485 Ack=1 Win=853 Len=121 TSval=675525 TSecr=767840
 67 0.002424237 172.31.31.144 -> 172.31.23.72 TCP 66 6633 → 40152 [ACK] Seq=1211 Ack=247 Win=853 Len=0 TSval=675525 TSecr=768364
 68 0.002465392 172.31.23.72 -> 172.31.31.144 TCP 66 40154 → 6633 [ACK] Seq=1 Ack=606 Win=385 Len=0 TSval=768364 TSecr=675525
 69 0.002475235 172.31.31.144 -> 172.31.23.72 TCP 187 6633 → 40154 [PSH, ACK] Seq=606 Ack=1 Win=853 Len=121 TSval=675525 TSecr=768364
 70 0.002538369 172.31.31.144 -> 172.31.23.72 TCP 187 6633 → 40154 [PSH, ACK] Seq=727 Ack=1 Win=853 Len=121 TSval=675525 TSecr=768364
 71 0.002568519 172.31.23.72 -> 172.31.31.144 TCP 66 40154 → 6633 [ACK] Seq=1 Ack=848 Win=385 Len=0 TSval=768364 TSecr=675525
 72 0.002646061 172.31.31.144 -> 172.31.23.72 TCP 187 6633 → 40154 [PSH, ACK] Seq=848 Ack=1 Win=853 Len=121 TSval=675525 TSecr=768364
 73 0.002658240 172.31.23.72 -> 172.31.31.144 OpenFlow 189 Type: OFPT_PACKET_IN
 74 0.002679191 172.31.23.72 -> 172.31.31.144 OpenFlow 189 Type: OFPT_PACKET_IN
 75 0.002689949 172.31.23.72 -> 172.31.31.144 OpenFlow 189 Type: OFPT_PACKET_IN
 76 0.002707584 172.31.31.144 -> 172.31.23.72 TCP 187 6633 → 40154 [PSH, ACK] Seq=969 Ack=1 Win=853 Len=121 TSval=675525 TSecr=768364
 77 0.002712746 172.31.23.72 -> 172.31.31.144 OpenFlow 189 Type: OFPT_PACKET_IN
 78 0.002745055 172.31.23.72 -> 172.31.31.144 OpenFlow 189 Type: OFPT_PACKET_IN
 79 0.002747267 172.31.23.72 -> 172.31.31.144 OpenFlow 189 Type: OFPT_PACKET_IN
 80 0.002759435 172.31.23.72 -> 172.31.31.144 OpenFlow 189 Type: OFPT_PACKET_IN
 81 0.002765373 172.31.31.144 -> 172.31.23.72 TCP 187 6633 → 40154 [PSH, ACK] Seq=1090 Ack=1 Win=853 Len=121 TSval=675525 TSecr=768364
 82 0.002781721 172.31.23.72 -> 172.31.31.144 OpenFlow 189 Type: OFPT_PACKET_IN
 83 0.002786888 172.31.23.72 -> 172.31.31.144 OpenFlow 189 Type: OFPT_PACKET_IN
 84 0.002789126 172.31.23.72 -> 172.31.31.144 OpenFlow 189 Type: OFPT_PACKET_IN
 85 0.002805070 172.31.23.72 -> 172.31.31.144 OpenFlow 189 Type: OFPT_PACKET_IN
 86 0.002865373 172.31.31.144 -> 172.31.23.72 TCP 66 6633 → 40188 [ACK] Seq=1 Ack=370 Win=853 Len=0 TSval=675525 TSecr=768364
 87 0.002909212 172.31.23.72 -> 172.31.31.144 OpenFlow 189 Type: OFPT_PACKET_IN
 88 0.002915593 172.31.23.72 -> 172.31.31.144 OpenFlow 189 Type: OFPT_PACKET_IN
 89 0.002997311 172.31.31.144 -> 172.31.23.72 TCP 66 6633 → 40188 [ACK] Seq=1 Ack=493 Win=853 Len=0 TSval=675525 TSecr=768364
 90 0.003003020 172.31.31.144 -> 172.31.23.72 TCP 66 6633 → 40196 [ACK] Seq=1 Ack=124 Win=853 Len=0 TSval=675526 TSecr=768364
 91 0.003005976 172.31.31.144 -> 172.31.23.72 TCP 187 6633 → 40150 [PSH, ACK] Seq=1 Ack=1 Win=853 Len=121 TSval=675526 TSecr=768339
 92 0.003008549 172.31.31.144 -> 172.31.23.72 TCP 66 6633 → 40206 [ACK] Seq=1 Ack=124 Win=853 Len=0 TSval=675526 TSecr=768364
 93 0.003010501 172.31.31.144 -> 172.31.23.72 TCP 187 6633 → 40150 [PSH, ACK] Seq=122 Ack=1 Win=853 Len=121 TSval=675526 TSecr=768339
 94 0.003012215 172.31.31.144 -> 172.31.23.72 TCP 66 6633 → 40192 [ACK] Seq=1 Ack=247 Win=853 Len=0 TSval=675526 TSecr=768364
 95 0.003016724 172.31.31.144 -> 172.31.23.72 TCP 66 6633 → 40208 [ACK] Seq=1 Ack=124 Win=853 Len=0 TSval=675526 TSecr=768364
 96 0.003023187 172.31.23.72 -> 172.31.31.144 OpenFlow 189 Type: OFPT_PACKET_IN
 97 0.003028529 172.31.23.72 -> 172.31.31.144 OpenFlow 189 Type: OFPT_PACKET_IN
 98 0.003044930 172.31.31.144 -> 172.31.23.72 TCP 187 6633 → 40150 [PSH, ACK] Seq=243 Ack=1 Win=853 Len=121 TSval=675526 TSecr=768339
 99 0.003047213 172.31.31.144 -> 172.31.23.72 TCP 66 6633 → 40212 [ACK] Seq=1 Ack=370 Win=853 Len=0 TSval=675526 TSecr=768364
100 0.003049391 172.31.31.144 -> 172.31.23.72 TCP 66 6633 → 40196 [ACK] Seq=1 Ack=247 Win=853 Len=0 TSval=675526 TSecr=768364
101 0.003101262 172.31.31.144 -> 172.31.23.72 TCP 66 6633 → 40206 [ACK] Seq=1 Ack=247 Win=853 Len=0 TSval=675526 TSecr=768364
102 0.003105466 172.31.31.144 -> 172.31.23.72 TCP 187 6633 → 40150 [PSH, ACK] Seq=364 Ack=1 Win=853 Len=121 TSval=675526 TSecr=768339
103 0.003109294 172.31.31.144 -> 172.31.23.72 TCP 66 6633 → 40216 [ACK] Seq=1 Ack=124 Win=853 Len=0 TSval=675526 TSecr=768364
104 0.003133797 172.31.31.144 -> 172.31.23.72 TCP 187 6633 → 40150 [PSH, ACK] Seq=485 Ack=1 Win=853 Len=121 TSval=675526 TSecr=768339
105 0.003152057 172.31.31.144 -> 172.31.23.72 TCP 66 6633 → 40212 [ACK] Seq=1 Ack=493 Win=853 Len=0 TSval=675526 TSecr=768364
106 0.003157880 172.31.23.72 -> 172.31.31.144 TCP 66 40154 → 6633 [ACK] Seq=1 Ack=1211 Win=385 Len=0 TSval=768364 TSecr=675525
107 0.003205287 172.31.31.144 -> 172.31.23.72 TCP 66 6633 → 40216 [ACK] Seq=1 Ack=247 Win=853 Len=0 TSval=675526 TSecr=768364
108 0.003210334 172.31.31.144 -> 172.31.23.72 TCP 187 6633 → 40150 [PSH, ACK] Seq=606 Ack=1 Win=853 Len=121 TSval=675526 TSecr=768339
109 0.003289596 172.31.23.72 -> 172.31.31.144 OpenFlow 189 Type: OFPT_PACKET_IN
110 0.003312142 172.31.23.72 -> 172.31.31.144 OpenFlow 189 Type: OFPT_PACKET_IN
111 0.003322372 172.31.23.72 -> 172.31.31.144 OpenFlow 189 Type: OFPT_PACKET_IN
112 0.003483328 172.31.31.144 -> 172.31.23.72 TCP 66 6633 → 40208 [ACK] Seq=1 Ack=247 Win=853 Len=0 TSval=675526 TSecr=768364
113 0.003505339 172.31.31.144 -> 172.31.23.72 TCP 66 6633 → 40204 [ACK] Seq=1 Ack=247 Win=853 Len=0 TSval=675526 TSecr=768364
114 0.003523148 172.31.31.144 -> 172.31.23.72 TCP 66 6633 → 40142 [ACK] Seq=1 Ack=493 Win=853 Len=0 TSval=675526 TSecr=768364
115 0.003587394 172.31.31.144 -> 172.31.23.72 TCP 187 6633 → 40150 [PSH, ACK] Seq=727 Ack=1 Win=853 Len=121 TSval=675526 TSecr=768339
116 0.003613763 172.31.31.144 -> 172.31.23.72 TCP 187 6633 → 40150 [PSH, ACK] Seq=848 Ack=1 Win=853 Len=121 TSval=675526 TSecr=768339
117 0.003642587 172.31.23.72 -> 172.31.31.144 TCP 66 40150 → 6633 [ACK] Seq=1 Ack=969 Win=385 Len=0 TSval=768364 TSecr=675526
118 0.003740873 172.31.31.144 -> 172.31.23.72 TCP 187 6633 → 40150 [PSH, ACK] Seq=969 Ack=1 Win=853 Len=121 TSval=675526 TSecr=768339
119 0.003851192 172.31.31.144 -> 172.31.23.72 TCP 187 6633 → 40150 [PSH, ACK] Seq=1090 Ack=1 Win=853 Len=121 TSval=675526 TSecr=768364
120 0.003881722 172.31.23.72 -> 172.31.31.144 OpenFlow 189 Type: OFPT_PACKET_IN
121 0.003903335 172.31.23.72 -> 172.31.31.144 OpenFlow 189 Type: OFPT_PACKET_IN
122 0.003948503 172.31.31.144 -> 172.31.23.72 OpenFlow 187 Type: OFPT_PACKET_OUT
123 0.003953700 172.31.23.72 -> 172.31.31.144 OpenFlow 189 Type: OFPT_PACKET_IN
124 0.003973028 172.31.23.72 -> 172.31.31.144 OpenFlow 189 Type: OFPT_PACKET_IN
125 0.003976936 172.31.23.72 -> 172.31.31.144 OpenFlow 189 Type: OFPT_PACKET_IN
126 0.004021682 172.31.31.144 -> 172.31.23.72 OpenFlow 187 Type: OFPT_PACKET_OUT
127 0.004073899 172.31.31.144 -> 172.31.23.72 OpenFlow 187 Type: OFPT_PACKET_OUT
128 0.004077376 172.31.31.144 -> 172.31.23.72 TCP 66 6633 → 40192 [ACK] Seq=1 Ack=493 Win=853 Len=0 TSval=675526 TSecr=768364
129 0.004098985 172.31.31.144 -> 172.31.23.72 TCP 66 6633 → 40214 [ACK] Seq=1 Ack=124 Win=853 Len=0 TSval=675526 TSecr=768364
130 0.004116510 172.31.31.144 -> 172.31.23.72 OpenFlow 187 Type: OFPT_PACKET_OUT
131 0.004144966 172.31.31.144 -> 172.31.23.72 TCP 66 6633 → 40214 [ACK] Seq=1 Ack=247 Win=853 Len=0 TSval=675526 TSecr=768364
132 0.004162984 172.31.31.144 -> 172.31.23.72 OpenFlow 187 Type: OFPT_PACKET_OUT
133 0.004181377 172.31.31.144 -> 172.31.23.72 TCP 66 6633 → 40216 [ACK] Seq=1 Ack=370 Win=853 Len=0 TSval=675526 TSecr=768364
134 0.004227042 172.31.31.144 -> 172.31.23.72 OpenFlow 187 Type: OFPT_PACKET_OUT
135 0.004279902 172.31.31.144 -> 172.31.23.72 OpenFlow 187 Type: OFPT_PACKET_OUT
136 0.004348343 172.31.23.72 -> 172.31.31.144 TCP 66 40142 → 6633 [ACK] Seq=493 Ack=848 Win=384 Len=0 TSval=768365 TSecr=675526
137 0.004363463 172.31.31.144 -> 172.31.23.72 OpenFlow 187 Type: OFPT_PACKET_OUT
138 0.004495879 172.31.31.144 -> 172.31.23.72 OpenFlow 187 Type: OFPT_PACKET_OUT
139 0.004513322 172.31.31.144 -> 172.31.23.72 OpenFlow 187 Type: OFPT_PACKET_OUT
140 0.004563430 172.31.31.144 -> 172.31.23.72 OpenFlow 187 Type: OFPT_PACKET_OUT
141 0.004596751 172.31.23.72 -> 172.31.31.144 OpenFlow 189 Type: OFPT_PACKET_IN
142 0.004621542 172.31.31.144 -> 172.31.23.72 OpenFlow 187 Type: OFPT_PACKET_OUT
143 0.004627058 172.31.23.72 -> 172.31.31.144 OpenFlow 189 Type: OFPT_PACKET_IN
144 0.004634921 172.31.23.72 -> 172.31.31.144 TCP 66 40150 → 6633 [ACK] Seq=1 Ack=1211 Win=386 Len=0 TSval=768365 TSecr=675526
145 0.004701253 172.31.31.144 -> 172.31.23.72 OpenFlow 187 Type: OFPT_PACKET_OUT
146 0.004721833 172.31.23.72 -> 172.31.31.144 OpenFlow 189 Type: OFPT_PACKET_IN
147 0.004732867 172.31.31.144 -> 172.31.23.72 OpenFlow 187 Type: OFPT_PACKET_OUT
148 0.004743140 172.31.23.72 -> 172.31.31.144 OpenFlow 189 Type: OFPT_PACKET_IN
149 0.004757032 172.31.23.72 -> 172.31.31.144 OpenFlow 189 Type: OFPT_PACKET_IN
150 0.004781772 172.31.23.72 -> 172.31.31.144 OpenFlow 189 Type: OFPT_PACKET_IN
151 0.004797846 172.31.31.144 -> 172.31.23.72 TCP 66 6633 → 40146 [ACK] Seq=1 Ack=124 Win=853 Len=0 TSval=675526 TSecr=768365
152 0.004802130 172.31.31.144 -> 172.31.23.72 TCP 66 6633 → 40146 [ACK] Seq=1 Ack=247 Win=853 Len=0 TSval=675526 TSecr=768365
153 0.004824979 172.31.23.72 -> 172.31.31.144 OpenFlow 189 Type: OFPT_PACKET_IN
154 0.004876874 172.31.31.144 -> 172.31.23.72 OpenFlow 187 Type: OFPT_PACKET_OUT
155 0.004882388 172.31.23.72 -> 172.31.31.144 OpenFlow 189 Type: OFPT_PACKET_IN
156 0.004900734 172.31.31.144 -> 172.31.23.72 OpenFlow 187 Type: OFPT_PACKET_OUT
157 0.004939910 172.31.31.144 -> 172.31.23.72 TCP 66 6633 → 40152 [ACK] Seq=1211 Ack=493 Win=853 Len=0 TSval=675526 TSecr=768365
158 0.004957014 172.31.31.144 -> 172.31.23.72 TCP 66 6633 → 40154 [ACK] Seq=1211 Ack=124 Win=853 Len=0 TSval=675526 TSecr=768365
159 0.004975908 172.31.31.144 -> 172.31.23.72 TCP 187 6633 → 40140 [PSH, ACK] Seq=1 Ack=1 Win=853 Len=121 TSval=675526 TSecr=767840
160 0.005001926 172.31.31.144 -> 172.31.23.72 TCP 66 6633 → 40154 [ACK] Seq=1211 Ack=247 Win=853 Len=0 TSval=675526 TSecr=768365
161 0.005014873 172.31.31.144 -> 172.31.23.72 TCP 187 6633 → 40140 [PSH, ACK] Seq=122 Ack=1 Win=853 Len=121 TSval=675526 TSecr=767840
162 0.005037804 172.31.31.144 -> 172.31.23.72 TCP 66 6633 → 40156 [ACK] Seq=969 Ack=493 Win=853 Len=0 TSval=675526 TSecr=768365
163 0.005053120 172.31.31.144 -> 172.31.23.72 TCP 187 6633 → 40140 [PSH, ACK] Seq=243 Ack=1 Win=853 Len=121 TSval=675526 TSecr=767840
164 0.005221520 172.31.31.144 -> 172.31.23.72 TCP 187 6633 → 40140 [PSH, ACK] Seq=364 Ack=1 Win=853 Len=121 TSval=675526 TSecr=767840
165 0.005266418 172.31.23.72 -> 172.31.31.144 OpenFlow 189 Type: OFPT_PACKET_IN
166 0.005282199 172.31.31.144 -> 172.31.23.72 TCP 187 6633 → 40140 [PSH, ACK] Seq=485 Ack=1 Win=853 Len=121 TSval=675526 TSecr=767840
167 0.005287337 172.31.23.72 -> 172.31.31.144 OpenFlow 189 Type: OFPT_PACKET_IN
168 0.005318946 172.31.23.72 -> 172.31.31.144 OpenFlow 189 Type: OFPT_PACKET_IN
169 0.005334738 172.31.23.72 -> 172.31.31.144 OpenFlow 189 Type: OFPT_PACKET_IN
170 0.005342088 172.31.23.72 -> 172.31.31.144 OpenFlow 189 Type: OFPT_PACKET_IN
171 0.005363478 172.31.31.144 -> 172.31.23.72 TCP 187 6633 → 40140 [PSH, ACK] Seq=606 Ack=1 Win=853 Len=121 TSval=675526 TSecr=767840
172 0.005388373 172.31.23.72 -> 172.31.31.144 OpenFlow 189 Type: OFPT_PACKET_IN
173 0.005406044 172.31.23.72 -> 172.31.31.144 OpenFlow 189 Type: OFPT_PACKET_IN
174 0.005434799 172.31.31.144 -> 172.31.23.72 TCP 66 6633 → 40188 [ACK] Seq=1 Ack=616 Win=853 Len=0 TSval=675526 TSecr=768365
175 0.005458969 172.31.31.144 -> 172.31.23.72 TCP 66 6633 → 40188 [ACK] Seq=1 Ack=739 Win=853 Len=0 TSval=675526 TSecr=768365
176 0.005461634 172.31.31.144 -> 172.31.23.72 TCP 187 6633 → 40140 [PSH, ACK] Seq=727 Ack=1 Win=853 Len=121 TSval=675526 TSecr=767840
177 0.005475769 172.31.31.144 -> 172.31.23.72 TCP 66 6633 → 40196 [ACK] Seq=1 Ack=370 Win=853 Len=0 TSval=675526 TSecr=768365
178 0.005494834 172.31.31.144 -> 172.31.23.72 TCP 66 6633 → 40198 [ACK] Seq=1 Ack=370 Win=853 Len=0 TSval=675526 TSecr=768365
179 0.005542739 172.31.31.144 -> 172.31.23.72 TCP 66 6633 → 40196 [ACK] Seq=1 Ack=493 Win=853 Len=0 TSval=675526 TSecr=768365
180 0.005547753 172.31.31.144 -> 172.31.23.72 TCP 187 6633 → 40140 [PSH, ACK] Seq=848 Ack=1 Win=853 Len=121 TSval=675526 TSecr=767840
181 0.005556726 172.31.31.144 -> 172.31.23.72 TCP 66 6633 → 40198 [ACK] Seq=1 Ack=493 Win=853 Len=0 TSval=675526 TSecr=768365
182 0.005577339 172.31.31.144 -> 172.31.23.72 TCP 66 6633 → 40216 [ACK] Seq=1 Ack=493 Win=853 Len=0 TSval=675526 TSecr=768365
183 0.005765967 172.31.23.72 -> 172.31.31.144 TCP 66 40140 → 6633 [ACK] Seq=1 Ack=969 Win=385 Len=0 TSval=768365 TSecr=675526
184 0.005843111 172.31.23.72 -> 172.31.31.144 OpenFlow 189 Type: OFPT_PACKET_IN
185 0.005865658 172.31.23.72 -> 172.31.31.144 OpenFlow 189 Type: OFPT_PACKET_IN
186 0.005870735 172.31.23.72 -> 172.31.31.144 OpenFlow 189 Type: OFPT_PACKET_IN
187 0.005910365 172.31.23.72 -> 172.31.31.144 OpenFlow 189 Type: OFPT_PACKET_IN
188 0.005916896 172.31.23.72 -> 172.31.31.144 OpenFlow 189 Type: OFPT_PACKET_IN
189 0.005971584 172.31.23.72 -> 172.31.31.144 OpenFlow 189 Type: OFPT_PACKET_IN
190 0.005990876 172.31.23.72 -> 172.31.31.144 OpenFlow 189 Type: OFPT_PACKET_IN
191 0.005993045 172.31.23.72 -> 172.31.31.144 OpenFlow 189 Type: OFPT_PACKET_IN
192 0.006057028 172.31.23.72 -> 172.31.31.144 OpenFlow 189 Type: OFPT_PACKET_IN
193 0.006062646 172.31.23.72 -> 172.31.31.144 OpenFlow 189 Type: OFPT_PACKET_IN
194 0.006105024 172.31.31.144 -> 172.31.23.72 TCP 66 6633 → 40144 [ACK] Seq=727 Ack=124 Win=853 Len=0 TSval=675526 TSecr=768365
195 0.006110528 172.31.31.144 -> 172.31.23.72 TCP 66 6633 → 40142 [ACK] Seq=969 Ack=739 Win=853 Len=0 TSval=675526 TSecr=768365
196 0.006112875 172.31.31.144 -> 172.31.23.72 TCP 66 6633 → 40144 [ACK] Seq=727 Ack=247 Win=853 Len=0 TSval=675526 TSecr=768365
197 0.006152102 172.31.31.144 -> 172.31.23.72 TCP 66 6633 → 40190 [ACK] Seq=1 Ack=370 Win=853 Len=0 TSval=675526 TSecr=768365
198 0.006154223 172.31.31.144 -> 172.31.23.72 TCP 66 6633 → 40208 [ACK] Seq=1 Ack=370 Win=853 Len=0 TSval=675526 TSecr=768365
199 0.006191118 172.31.31.144 -> 172.31.23.72 TCP 66 6633 → 40212 [ACK] Seq=1 Ack=616 Win=853 Len=0 TSval=675526 TSecr=768365
200 0.006210438 172.31.31.144 -> 172.31.23.72 TCP 66 6633 → 40190 [ACK] Seq=1 Ack=493 Win=853 Len=0 TSval=675526 TSecr=768365
201 0.006228659 172.31.31.144 -> 172.31.23.72 TCP 66 6633 → 40208 [ACK] Seq=1 Ack=493 Win=853 Len=0 TSval=675526 TSecr=768365
202 0.006247239 172.31.31.144 -> 172.31.23.72 TCP 66 6633 → 40212 [ACK] Seq=1 Ack=739 Win=853 Len=0 TSval=675526 TSecr=768365
203 0.006723292 137.158.125.247 -> 172.31.23.72 TCP 54 52508 → 22 [ACK] Seq=1 Ack=1 Win=32434 Len=0
204 0.040369653 172.31.23.72 -> 172.31.31.144 TCP 66 40148 → 6633 [ACK] Seq=247 Ack=1211 Win=612 Len=0 TSval=768374 TSecr=675525
205 0.044373487 172.31.23.72 -> 172.31.31.144 TCP 66 40156 → 6633 [ACK] Seq=493 Ack=969 Win=213 Len=0 TSval=768375 TSecr=675526
206 0.119477482 137.158.125.247 -> 172.31.23.72 TCP 54 52508 → 22 [ACK] Seq=1 Ack=61 Win=32404 Len=0
207 0.667427838 172.31.23.72 -> 137.158.125.247 SSH 98 Server: Encrypted packet (len=44)
208 0.699094721 172.31.23.72 -> 172.31.31.144 OpenFlow 146 Type: OFPT_PORT_STATUS
209 0.699181073 172.31.23.72 -> 172.31.31.144 OpenFlow 146 Type: OFPT_PORT_STATUS
210 0.699320353 172.31.31.144 -> 172.31.23.72 TCP 66 6633 → 40148 [ACK] Seq=1211 Ack=327 Win=853 Len=0 TSval=675700 TSecr=768538
211 0.723395777 172.31.31.144 -> 172.31.23.72 TCP 146 6633 → 40140 [PSH, ACK] Seq=969 Ack=1 Win=853 Len=80 TSval=675706 TSecr=768365
212 0.723433913 172.31.31.144 -> 172.31.23.72 TCP 154 6633 → 40140 [PSH, ACK] Seq=1049 Ack=1 Win=853 Len=88 TSval=675706 TSecr=768365
213 0.723451233 172.31.31.144 -> 172.31.23.72 OpenFlow 146 Type: OFPT_FLOW_MOD
214 0.723501420 172.31.31.144 -> 172.31.23.72 OpenFlow 154 Type: OFPT_BARRIER_REQUEST
215 0.723654762 172.31.31.144 -> 172.31.23.72 OpenFlow 146 Type: OFPT_FLOW_MOD
216 0.723678054 172.31.31.144 -> 172.31.23.72 OpenFlow 146 Type: OFPT_FLOW_MOD
217 0.723686363 172.31.23.72 -> 172.31.31.144 TCP 66 40140 → 6633 [ACK] Seq=1 Ack=1137 Win=385 Len=0 TSval=768544 TSecr=675706
218 0.723698700 172.31.23.72 -> 172.31.31.144 OpenFlow 74 Type: OFPT_BARRIER_REPLY
219 0.723709114 172.31.31.144 -> 172.31.23.72 OpenFlow 154 Type: OFPT_BARRIER_REQUEST
220 0.723765322 172.31.31.144 -> 172.31.23.72 OpenFlow 146 Type: OFPT_FLOW_MOD
221 0.723768612 172.31.31.144 -> 172.31.23.72 OpenFlow 74 Type: OFPT_BARRIER_REQUEST
222 0.723770408 172.31.31.144 -> 172.31.23.72 TCP 146 6633 → 40150 [PSH, ACK] Seq=1211 Ack=1 Win=853 Len=80 TSval=675706 TSecr=768365
223 0.723803130 172.31.23.72 -> 172.31.31.144 OpenFlow 74 Type: OFPT_BARRIER_REPLY
224 0.723818390 172.31.31.144 -> 172.31.23.72 TCP 146 6633 → 40150 [PSH, ACK] Seq=1291 Ack=1 Win=853 Len=80 TSval=675706 TSecr=768365
225 0.723832640 172.31.23.72 -> 172.31.31.144 OpenFlow 74 Type: OFPT_BARRIER_REPLY
226 0.723846863 172.31.31.144 -> 172.31.23.72 TCP 74 6633 → 40150 [PSH, ACK] Seq=1371 Ack=1 Win=853 Len=8 TSval=675706 TSecr=768365
227 0.723869892 172.31.31.144 -> 172.31.23.72 TCP 66 6633 → 40140 [ACK] Seq=1137 Ack=9 Win=853 Len=0 TSval=675706 TSecr=768544
228 0.723912493 172.31.31.144 -> 172.31.23.72 OpenFlow 146 Type: OFPT_FLOW_MOD
229 0.723930692 172.31.31.144 -> 172.31.23.72 OpenFlow 146 Type: OFPT_FLOW_MOD
230 0.723945347 172.31.23.72 -> 172.31.31.144 OpenFlow 74 Type: OFPT_BARRIER_REPLY
231 0.724000123 172.31.31.144 -> 172.31.23.72 OpenFlow 146 Type: OFPT_FLOW_MOD
232 0.724025485 172.31.31.144 -> 172.31.23.72 OpenFlow 74 Type: OFPT_BARRIER_REQUEST
233 0.724056352 172.31.31.144 -> 172.31.23.72 OpenFlow 146 Type: OFPT_FLOW_MOD
234 0.724080855 172.31.31.144 -> 172.31.23.72 OpenFlow 74 Type: OFPT_BARRIER_REQUEST
235 0.724111295 172.31.31.144 -> 172.31.23.72 OpenFlow 146 Type: OFPT_FLOW_MOD
236 0.724116005 172.31.31.144 -> 172.31.23.72 TCP 66 6633 → 40216 [ACK] Seq=337 Ack=501 Win=853 Len=0 TSval=675706 TSecr=768544
237 0.724136320 172.31.31.144 -> 172.31.23.72 OpenFlow 146 Type: OFPT_FLOW_MOD
238 0.724146048 172.31.23.72 -> 172.31.31.144 OpenFlow 146 Type: OFPT_FLOW_REMOVED
239 0.724169666 172.31.31.144 -> 172.31.23.72 OpenFlow 154 Type: OFPT_BARRIER_REQUEST
240 0.724182515 172.31.23.72 -> 172.31.31.144 OpenFlow 146 Type: OFPT_FLOW_REMOVED
241 0.724187138 172.31.23.72 -> 172.31.31.144 OpenFlow 146 Type: OFPT_FLOW_REMOVED
242 0.724198395 172.31.23.72 -> 172.31.31.144 OpenFlow 146 Type: OFPT_FLOW_REMOVED
243 0.724206453 172.31.31.144 -> 172.31.23.72 OpenFlow 154 Type: OFPT_BARRIER_REQUEST
244 0.724233947 172.31.23.72 -> 172.31.31.144 OpenFlow 306 Type: OFPT_FLOW_REMOVED
245 0.724277814 172.31.31.144 -> 172.31.23.72 OpenFlow 146 Type: OFPT_FLOW_MOD
246 0.724281033 172.31.31.144 -> 172.31.23.72 OpenFlow 146 Type: OFPT_FLOW_MOD
247 0.724284564 172.31.23.72 -> 172.31.31.144 OpenFlow 226 Type: OFPT_FLOW_REMOVED
248 0.724303389 172.31.31.144 -> 172.31.23.72 OpenFlow 74 Type: OFPT_BARRIER_REQUEST
249 0.724354702 172.31.31.144 -> 172.31.23.72 TCP 66 6633 → 40140 [ACK] Seq=1137 Ack=89 Win=853 Len=0 TSval=675706 TSecr=768544
250 0.724359613 172.31.31.144 -> 172.31.23.72 TCP 66 6633 → 40140 [ACK] Seq=1137 Ack=169 Win=853 Len=0 TSval=675706 TSecr=768544
251 0.724384286 172.31.31.144 -> 172.31.23.72 TCP 66 6633 → 40216 [ACK] Seq=337 Ack=581 Win=853 Len=0 TSval=675706 TSecr=768544
252 0.724403496 172.31.31.144 -> 172.31.23.72 OpenFlow 146 Type: OFPT_FLOW_MOD
253 0.724422271 172.31.31.144 -> 172.31.23.72 TCP 66 6633 → 40192 [ACK] Seq=673 Ack=909 Win=853 Len=0 TSval=675706 TSecr=768544
254 0.724441353 172.31.31.144 -> 172.31.23.72 OpenFlow 146 Type: OFPT_FLOW_MOD
255 0.724459354 172.31.31.144 -> 172.31.23.72 TCP 66 6633 → 40216 [ACK] Seq=337 Ack=741 Win=853 Len=0 TSval=675706 TSecr=768544
256 0.724479515 172.31.31.144 -> 172.31.23.72 OpenFlow 146 Type: OFPT_FLOW_MOD
257 0.724509870 172.31.31.144 -> 172.31.23.72 OpenFlow 74 Type: OFPT_BARRIER_REQUEST
258 0.724511983 172.31.31.144 -> 172.31.23.72 OpenFlow 154 Type: OFPT_BARRIER_REQUEST
259 0.724661093 172.31.31.144 -> 172.31.23.72 OpenFlow 146 Type: OFPT_FLOW_MOD
260 0.724679955 172.31.31.144 -> 172.31.23.72 OpenFlow 146 Type: OFPT_FLOW_MOD
261 0.724718668 172.31.31.144 -> 172.31.23.72 OpenFlow 146 Type: OFPT_FLOW_MOD
262 0.724720725 172.31.31.144 -> 172.31.23.72 OpenFlow 154 Type: OFPT_BARRIER_REQUEST
263 0.724744542 172.31.31.144 -> 172.31.23.72 OpenFlow 74 Type: OFPT_BARRIER_REQUEST
264 0.724820627 172.31.31.144 -> 172.31.23.72 OpenFlow 146 Type: OFPT_FLOW_MOD
265 0.724835852 172.31.31.144 -> 172.31.23.72 OpenFlow 146 Type: OFPT_FLOW_MOD
266 0.724853952 172.31.31.144 -> 172.31.23.72 OpenFlow 154 Type: OFPT_BARRIER_REQUEST
267 0.724873589 172.31.31.144 -> 172.31.23.72 OpenFlow 146 Type: OFPT_FLOW_MOD
268 0.724891206 172.31.31.144 -> 172.31.23.72 OpenFlow 74 Type: OFPT_BARRIER_REQUEST
269 0.724953064 172.31.31.144 -> 172.31.23.72 OpenFlow 146 Type: OFPT_FLOW_MOD
270 0.724971048 172.31.31.144 -> 172.31.23.72 OpenFlow 154 Type: OFPT_BARRIER_REQUEST
271 0.725008092 172.31.31.144 -> 172.31.23.72 OpenFlow 146 Type: OFPT_FLOW_MOD
272 0.725027589 172.31.31.144 -> 172.31.23.72 OpenFlow 154 Type: OFPT_BARRIER_REQUEST
273 0.725094272 172.31.31.144 -> 172.31.23.72 OpenFlow 146 Type: OFPT_FLOW_MOD
274 0.725117473 172.31.31.144 -> 172.31.23.72 OpenFlow 154 Type: OFPT_BARRIER_REQUEST
275 0.725137525 172.31.31.144 -> 172.31.23.72 OpenFlow 146 Type: OFPT_FLOW_MOD
276 0.725164815 172.31.31.144 -> 172.31.23.72 OpenFlow 146 Type: OFPT_FLOW_MOD
277 0.725203240 172.31.31.144 -> 172.31.23.72 OpenFlow 74 Type: OFPT_BARRIER_REQUEST
278 0.725252344 172.31.31.144 -> 172.31.23.72 OpenFlow 146 Type: OFPT_FLOW_MOD
279 0.725275393 172.31.31.144 -> 172.31.23.72 TCP 146 6633 → 40202 [PSH, ACK] Seq=1 Ack=1 Win=853 Len=80 TSval=675706 TSecr=768026
280 0.725294838 172.31.31.144 -> 172.31.23.72 TCP 146 6633 → 40202 [PSH, ACK] Seq=81 Ack=1 Win=853 Len=80 TSval=675706 TSecr=768026
281 0.725313231 172.31.31.144 -> 172.31.23.72 OpenFlow 146 Type: OFPT_FLOW_MOD
282 0.725344384 172.31.31.144 -> 172.31.23.72 OpenFlow 146 Type: OFPT_FLOW_MOD
283 0.725346518 172.31.31.144 -> 172.31.23.72 OpenFlow 74 Type: OFPT_BARRIER_REQUEST
284 0.725369797 172.31.31.144 -> 172.31.23.72 TCP 74 6633 → 40202 [PSH, ACK] Seq=161 Ack=1 Win=853 Len=8 TSval=675706 TSecr=768026
285 0.725397864 172.31.31.144 -> 172.31.23.72 OpenFlow 154 Type: OFPT_BARRIER_REQUEST
286 0.725420638 172.31.31.144 -> 172.31.23.72 OpenFlow 146 Type: OFPT_FLOW_MOD
287 0.725438278 172.31.31.144 -> 172.31.23.72 OpenFlow 146 Type: OFPT_FLOW_MOD
288 0.725480897 172.31.31.144 -> 172.31.23.72 OpenFlow 74 Type: OFPT_BARRIER_REQUEST
289 0.725483101 172.31.31.144 -> 172.31.23.72 OpenFlow 146 Type: OFPT_FLOW_MOD
290 0.725496275 172.31.31.144 -> 172.31.23.72 OpenFlow 146 Type: OFPT_FLOW_MOD
291 0.725528322 172.31.31.144 -> 172.31.23.72 OpenFlow 154 Type: OFPT_BARRIER_REQUEST
292 0.725568704 172.31.31.144 -> 172.31.23.72 OpenFlow 146 Type: OFPT_FLOW_MOD
293 0.725593514 172.31.31.144 -> 172.31.23.72 OpenFlow 146 Type: OFPT_FLOW_MOD
294 0.725611699 172.31.31.144 -> 172.31.23.72 OpenFlow 154 Type: OFPT_BARRIER_REQUEST
295 0.725710703 172.31.31.144 -> 172.31.23.72 OpenFlow 146 Type: OFPT_FLOW_MOD
296 0.725747558 172.31.31.144 -> 172.31.23.72 OpenFlow 154 Type: OFPT_BARRIER_REQUEST
297 0.725764202 172.31.31.144 -> 172.31.23.72 OpenFlow 146 Type: OFPT_FLOW_MOD
298 0.725785615 172.31.31.144 -> 172.31.23.72 OpenFlow 154 Type: OFPT_BARRIER_REQUEST
299 0.725870012 172.31.31.144 -> 172.31.23.72 OpenFlow 146 Type: OFPT_FLOW_MOD
300 0.725902385 172.31.31.144 -> 172.31.23.72 OpenFlow 154 Type: OFPT_BARRIER_REQUEST
301 0.725931133 172.31.31.144 -> 172.31.23.72 OpenFlow 146 Type: OFPT_FLOW_MOD
302 0.725959696 172.31.31.144 -> 172.31.23.72 TCP 146 6633 → 40200 [PSH, ACK] Seq=1 Ack=1 Win=853 Len=80 TSval=675706 TSecr=768022
303 0.725998913 172.31.31.144 -> 172.31.23.72 OpenFlow 154 Type: OFPT_BARRIER_REQUEST
304 0.726028905 172.31.31.144 -> 172.31.23.72 TCP 154 6633 → 40200 [PSH, ACK] Seq=81 Ack=1 Win=853 Len=88 TSval=675706 TSecr=768022
305 0.726058473 172.31.31.144 -> 172.31.23.72 OpenFlow 146 Type: OFPT_FLOW_MOD
306 0.726088896 172.31.31.144 -> 172.31.23.72 OpenFlow 154 Type: OFPT_BARRIER_REQUEST
307 0.726118209 172.31.31.144 -> 172.31.23.72 OpenFlow 146 Type: OFPT_FLOW_MOD
308 0.726148687 172.31.31.144 -> 172.31.23.72 OpenFlow 154 Type: OFPT_BARRIER_REQUEST
309 0.726170295 172.31.31.144 -> 172.31.23.72 OpenFlow 146 Type: OFPT_FLOW_MOD
310 0.726188275 172.31.31.144 -> 172.31.23.72 OpenFlow 154 Type: OFPT_BARRIER_REQUEST
311 0.726250350 172.31.31.144 -> 172.31.23.72 OpenFlow 146 Type: OFPT_FLOW_MOD
312 0.726252914 172.31.31.144 -> 172.31.23.72 OpenFlow 146 Type: OFPT_FLOW_MOD
313 0.726254678 172.31.31.144 -> 172.31.23.72 OpenFlow 146 Type: OFPT_FLOW_MOD
314 0.726287636 172.31.31.144 -> 172.31.23.72 OpenFlow 154 Type: OFPT_BARRIER_REQUEST
315 0.726318965 172.31.31.144 -> 172.31.23.72 OpenFlow 146 Type: OFPT_FLOW_MOD
316 0.726349927 172.31.31.144 -> 172.31.23.72 OpenFlow 146 Type: OFPT_FLOW_MOD
317 0.726370133 172.31.31.144 -> 172.31.23.72 OpenFlow 154 Type: OFPT_BARRIER_REQUEST
318 0.726389988 172.31.31.144 -> 172.31.23.72 OpenFlow 154 Type: OFPT_BARRIER_REQUEST
319 0.726420425 172.31.31.144 -> 172.31.23.72 OpenFlow 146 Type: OFPT_FLOW_MOD
320 0.726452341 172.31.31.144 -> 172.31.23.72 OpenFlow 154 Type: OFPT_BARRIER_REQUEST
321 0.726500268 172.31.31.144 -> 172.31.23.72 TCP 146 6633 → 40202 [PSH, ACK] Seq=169 Ack=1 Win=853 Len=80 TSval=675706 TSecr=768026
322 0.726524140 172.31.31.144 -> 172.31.23.72 TCP 154 6633 → 40202 [PSH, ACK] Seq=249 Ack=1 Win=853 Len=88 TSval=675706 TSecr=768026
323 0.726554162 172.31.31.144 -> 172.31.23.72 OpenFlow 146 Type: OFPT_FLOW_MOD
324 0.726611732 172.31.31.144 -> 172.31.23.72 OpenFlow 154 Type: OFPT_BARRIER_REQUEST
325 0.726613889 172.31.31.144 -> 172.31.23.72 OpenFlow 146 Type: OFPT_FLOW_MOD
326 0.726658600 172.31.31.144 -> 172.31.23.72 OpenFlow 154 Type: OFPT_BARRIER_REQUEST
327 0.726677646 172.31.31.144 -> 172.31.23.72 OpenFlow 146 Type: OFPT_FLOW_MOD
328 0.726683777 172.31.23.72 -> 172.31.31.144 TCP 66 40156 → 6633 [ACK] Seq=493 Ack=1049 Win=213 Len=0 TSval=768545 TSecr=675706
329 0.726697171 172.31.31.144 -> 172.31.23.72 OpenFlow 146 Type: OFPT_FLOW_MOD
330 0.726727409 172.31.31.144 -> 172.31.23.72 OpenFlow 154 Type: OFPT_BARRIER_REQUEST
331 0.726730755 172.31.23.72 -> 172.31.31.144 TCP 66 40156 → 6633 [ACK] Seq=493 Ack=1137 Win=213 Len=0 TSval=768545 TSecr=675706
332 0.726735671 172.31.31.144 -> 172.31.23.72 OpenFlow 154 Type: OFPT_BARRIER_REQUEST
333 0.726820086 172.31.31.144 -> 172.31.23.72 TCP 146 6633 → 40200 [PSH, ACK] Seq=169 Ack=1 Win=853 Len=80 TSval=675706 TSecr=768022
334 0.726840423 172.31.31.144 -> 172.31.23.72 OpenFlow 146 Type: OFPT_FLOW_MOD
335 0.726858032 172.31.31.144 -> 172.31.23.72 OpenFlow 146 Type: OFPT_FLOW_MOD
336 0.726885722 172.31.31.144 -> 172.31.23.72 OpenFlow 154 Type: OFPT_BARRIER_REQUEST
337 0.726901974 172.31.31.144 -> 172.31.23.72 TCP 154 6633 → 40200 [PSH, ACK] Seq=249 Ack=1 Win=853 Len=88 TSval=675707 TSecr=768022
338 0.726905970 172.31.23.72 -> 172.31.31.144 OpenFlow 74 Type: OFPT_BARRIER_REPLY
339 0.726922461 172.31.31.144 -> 172.31.23.72 OpenFlow 154 Type: OFPT_BARRIER_REQUEST
340 0.726945311 172.31.23.72 -> 172.31.31.144 OpenFlow 74 Type: OFPT_BARRIER_REPLY
341 0.726973815 172.31.23.72 -> 172.31.31.144 OpenFlow 74 Type: OFPT_BARRIER_REPLY
342 0.727007990 172.31.23.72 -> 172.31.31.144 OpenFlow 74 Type: OFPT_BARRIER_REPLY
343 0.727016697 172.31.23.72 -> 172.31.31.144 OpenFlow 82 Type: OFPT_BARRIER_REPLY
344 0.727039828 172.31.31.144 -> 172.31.23.72 OpenFlow 146 Type: OFPT_FLOW_MOD
345 0.727043798 172.31.31.144 -> 172.31.23.72 OpenFlow 154 Type: OFPT_BARRIER_REQUEST
346 0.727065145 172.31.23.72 -> 172.31.31.144 OpenFlow 74 Type: OFPT_BARRIER_REPLY
347 0.727083322 172.31.31.144 -> 172.31.23.72 OpenFlow 146 Type: OFPT_FLOW_MOD
348 0.727101993 172.31.23.72 -> 172.31.31.144 TCP 66 40146 → 6633 [ACK] Seq=247 Ack=169 Win=384 Len=0 TSval=768545 TSecr=675706
349 0.727110936 172.31.23.72 -> 172.31.31.144 OpenFlow 74 Type: OFPT_BARRIER_REPLY
350 0.727115940 172.31.31.144 -> 172.31.23.72 OpenFlow 154 Type: OFPT_BARRIER_REQUEST
351 0.727118915 172.31.31.144 -> 172.31.23.72 OpenFlow 146 Type: OFPT_FLOW_MOD
352 0.727152631 172.31.23.72 -> 172.31.31.144 TCP 66 40150 → 6633 [ACK] Seq=1 Ack=1379 Win=386 Len=0 TSval=768545 TSecr=675706
353 0.727162530 172.31.31.144 -> 172.31.23.72 OpenFlow 146 Type: OFPT_FLOW_MOD
354 0.727165397 172.31.31.144 -> 172.31.23.72 TCP 66 6633 → 40144 [ACK] Seq=1063 Ack=255 Win=853 Len=0 TSval=675707 TSecr=768545
355 0.727169367 172.31.31.144 -> 172.31.23.72 OpenFlow 74 Type: OFPT_BARRIER_REQUEST
356 0.727175764 172.31.23.72 -> 172.31.31.144 OpenFlow 74 Type: OFPT_BARRIER_REPLY
357 0.727199360 172.31.31.144 -> 172.31.23.72 TCP 66 6633 → 40142 [ACK] Seq=1473 Ack=763 Win=853 Len=0 TSval=675707 TSecr=768545
358 0.727216111 172.31.23.72 -> 172.31.31.144 OpenFlow 74 Type: OFPT_BARRIER_REPLY
359 0.727231596 172.31.31.144 -> 172.31.23.72 TCP 66 6633 → 40140 [ACK] Seq=1473 Ack=185 Win=853 Len=0 TSval=675707 TSecr=768545
360 0.727241450 172.31.23.72 -> 172.31.31.144 OpenFlow 74 Type: OFPT_BARRIER_REPLY
361 0.727258122 172.31.31.144 -> 172.31.23.72 TCP 66 6633 → 40144 [ACK] Seq=1063 Ack=263 Win=853 Len=0 TSval=675707 TSecr=768545
362 0.727261371 172.31.31.144 -> 172.31.23.72 OpenFlow 146 Type: OFPT_FLOW_MOD
363 0.727264413 172.31.23.72 -> 172.31.31.144 TCP 66 40148 → 6633 [ACK] Seq=327 Ack=1291 Win=612 Len=0 TSval=768545 TSecr=675707
364 0.727289103 172.31.31.144 -> 172.31.23.72 TCP 66 6633 → 40146 [ACK] Seq=169 Ack=255 Win=853 Len=0 TSval=675707 TSecr=768545
365 0.727302876 172.31.23.72 -> 172.31.31.144 OpenFlow 74 Type: OFPT_BARRIER_REPLY
366 0.727312164 172.31.31.144 -> 172.31.23.72 OpenFlow 570 Type: OFPT_FLOW_MOD
367 0.727317924 172.31.23.72 -> 172.31.31.144 TCP 66 40148 → 6633 [ACK] Seq=327 Ack=1795 Win=612 Len=0 TSval=768545 TSecr=675707
368 0.727338993 172.31.31.144 -> 172.31.23.72 OpenFlow 314 Type: OFPT_FLOW_MOD
369 0.727342702 172.31.23.72 -> 172.31.31.144 TCP 66 40148 → 6633 [ACK] Seq=327 Ack=2043 Win=612 Len=0 TSval=768545 TSecr=675707
370 0.727357301 172.31.23.72 -> 172.31.31.144 OpenFlow 74 Type: OFPT_BARRIER_REPLY
371 0.727391828 172.31.31.144 -> 172.31.23.72 OpenFlow 410 Type: OFPT_BARRIER_REQUEST
372 0.727396108 172.31.23.72 -> 172.31.31.144 TCP 66 40148 → 6633 [ACK] Seq=327 Ack=2387 Win=612 Len=0 TSval=768545 TSecr=675707
373 0.727400526 172.31.31.144 -> 172.31.23.72 OpenFlow 562 Type: OFPT_FLOW_MOD
374 0.727402619 172.31.23.72 -> 172.31.31.144 TCP 66 40148 → 6633 [ACK] Seq=327 Ack=2883 Win=612 Len=0 TSval=768545 TSecr=675707
375 0.727403773 172.31.31.144 -> 172.31.23.72 OpenFlow 402 Type: OFPT_FLOW_MOD
376 0.727406160 172.31.23.72 -> 172.31.31.144 TCP 66 40148 → 6633 [ACK] Seq=327 Ack=3219 Win=612 Len=0 TSval=768545 TSecr=675707
377 0.727422800 172.31.23.72 -> 172.31.31.144 OpenFlow 74 Type: OFPT_BARRIER_REPLY
378 0.727425305 172.31.23.72 -> 172.31.31.144 OpenFlow 90 Type: OFPT_BARRIER_REPLY
379 0.727437608 172.31.31.144 -> 172.31.23.72 OpenFlow 74 Type: OFPT_BARRIER_REQUEST
380 0.727440779 172.31.23.72 -> 172.31.31.144 TCP 66 40148 → 6633 [ACK] Seq=327 Ack=3227 Win=612 Len=0 TSval=768545 TSecr=675707
381 0.727445200 172.31.31.144 -> 172.31.23.72 OpenFlow 146 Type: OFPT_FLOW_MOD
382 0.727488192 172.31.23.72 -> 172.31.31.144 OpenFlow 74 Type: OFPT_BARRIER_REPLY
383 0.727549470 172.31.31.144 -> 172.31.23.72 OpenFlow 570 Type: OFPT_FLOW_MOD
384 0.727552852 172.31.31.144 -> 172.31.23.72 TCP 66 6633 → 40154 [ACK] Seq=1547 Ack=255 Win=853 Len=0 TSval=675707 TSecr=768545
385 0.727555494 172.31.31.144 -> 172.31.23.72 TCP 66 6633 → 40154 [ACK] Seq=1547 Ack=263 Win=853 Len=0 TSval=675707 TSecr=768545
386 0.727557175 172.31.31.144 -> 172.31.23.72 OpenFlow 490 Type: OFPT_BARRIER_REQUEST
387 0.727558738 172.31.31.144 -> 172.31.23.72 TCP 66 6633 → 40188 [ACK] Seq=673 Ack=747 Win=853 Len=0 TSval=675707 TSecr=768545
388 0.727564176 172.31.23.72 -> 172.31.31.144 OpenFlow 90 Type: OFPT_BARRIER_REPLY
389 0.727572512 172.31.23.72 -> 172.31.31.144 OpenFlow 114 Type: OFPT_BARRIER_REPLY
390 0.727594395 172.31.23.72 -> 172.31.31.144 OpenFlow 74 Type: OFPT_BARRIER_REPLY
391 0.727624717 172.31.23.72 -> 172.31.31.144 OpenFlow 74 Type: OFPT_BARRIER_REPLY
392 0.727653561 172.31.23.72 -> 172.31.31.144 OpenFlow 74 Type: OFPT_BARRIER_REPLY
393 0.727658079 172.31.23.72 -> 172.31.31.144 OpenFlow 74 Type: OFPT_BARRIER_REPLY
394 0.727662211 172.31.23.72 -> 172.31.31.144 OpenFlow 74 Type: OFPT_BARRIER_REPLY
