  1 0.000000000 172.31.31.144 -> 172.31.24.227 TCP 187 6633 → 50430 [PSH, ACK] Seq=1 Ack=1 Win=853 Len=121 TSval=1220305 TSecr=394284926
  2 0.000036065 172.31.31.144 -> 172.31.24.227 TCP 187 6633 → 50430 [PSH, ACK] Seq=122 Ack=1 Win=853 Len=121 TSval=1220305 TSecr=394284926
  3 0.000041632 172.31.31.144 -> 172.31.24.227 TCP 550 6633 → 50430 [PSH, ACK] Seq=243 Ack=1 Win=853 Len=484 TSval=1220305 TSecr=394284926
  4 0.000653803 172.31.24.227 -> 172.31.31.144 TCP 66 50430 → 6633 [ACK] Seq=1 Ack=727 Win=213 Len=0 TSval=394285577 TSecr=1220305
  5 0.000891189 172.31.24.227 -> 172.31.31.144 OpenFlow 189 Type: OFPT_PACKET_IN
  6 0.000914302 172.31.24.227 -> 172.31.31.144 OpenFlow 189 Type: OFPT_PACKET_IN
  7 0.000967716 172.31.24.227 -> 172.31.31.144 OpenFlow 189 Type: OFPT_PACKET_IN
  8 0.000989475 172.31.24.227 -> 172.31.31.144 OpenFlow 189 Type: OFPT_PACKET_IN
  9 0.001114643 172.31.31.144 -> 172.31.24.227 TCP 66 6633 → 50440 [ACK] Seq=1 Ack=124 Win=853 Len=0 TSval=1220305 TSecr=394285577
 10 0.001125020 172.31.31.144 -> 172.31.24.227 TCP 66 6633 → 50440 [ACK] Seq=1 Ack=247 Win=853 Len=0 TSval=1220305 TSecr=394285577
 11 0.001200405 172.31.31.144 -> 172.31.24.227 TCP 66 6633 → 50432 [ACK] Seq=1 Ack=124 Win=853 Len=0 TSval=1220305 TSecr=394285577
 12 0.001206020 172.31.31.144 -> 172.31.24.227 TCP 66 6633 → 50432 [ACK] Seq=1 Ack=247 Win=853 Len=0 TSval=1220305 TSecr=394285577
 13 0.099171265 172.31.31.144 -> 172.31.24.227 OpenFlow 187 Type: OFPT_PACKET_OUT
 14 0.099187903 172.31.31.144 -> 172.31.24.227 OpenFlow 187 Type: OFPT_PACKET_OUT
 15 0.099225487 172.31.31.144 -> 172.31.24.227 OpenFlow 187 Type: OFPT_PACKET_OUT
 16 0.099283511 172.31.31.144 -> 172.31.24.227 OpenFlow 187 Type: OFPT_PACKET_OUT
 17 0.099366475 172.31.31.144 -> 172.31.24.227 OpenFlow 187 Type: OFPT_PACKET_OUT
 18 0.099419684 172.31.31.144 -> 172.31.24.227 OpenFlow 187 Type: OFPT_PACKET_OUT
 19 0.099463153 172.31.31.144 -> 172.31.24.227 OpenFlow 187 Type: OFPT_PACKET_OUT
 20 0.099505407 172.31.31.144 -> 172.31.24.227 OpenFlow 187 Type: OFPT_PACKET_OUT
 21 0.099574207 172.31.31.144 -> 172.31.24.227 TCP 187 6633 → 50434 [PSH, ACK] Seq=1 Ack=1 Win=853 Len=121 TSval=1220330 TSecr=394285181
 22 0.099640097 172.31.31.144 -> 172.31.24.227 TCP 187 6633 → 50434 [PSH, ACK] Seq=122 Ack=1 Win=853 Len=121 TSval=1220330 TSecr=394285181
 23 0.099708369 172.31.31.144 -> 172.31.24.227 TCP 187 6633 → 50434 [PSH, ACK] Seq=243 Ack=1 Win=853 Len=121 TSval=1220330 TSecr=394285181
 24 0.099755808 172.31.24.227 -> 172.31.31.144 TCP 66 50432 → 6633 [ACK] Seq=247 Ack=969 Win=213 Len=0 TSval=394285602 TSecr=1220330
 25 0.099790460 172.31.31.144 -> 172.31.24.227 TCP 187 6633 → 50434 [PSH, ACK] Seq=364 Ack=1 Win=853 Len=121 TSval=1220330 TSecr=394285181
 26 0.099859481 172.31.31.144 -> 172.31.24.227 TCP 308 6633 → 50434 [PSH, ACK] Seq=485 Ack=1 Win=853 Len=242 TSval=1220330 TSecr=394285181
 27 0.099885045 172.31.24.227 -> 172.31.31.144 OpenFlow 189 Type: OFPT_PACKET_IN
 28 0.099941593 172.31.31.144 -> 172.31.24.227 TCP 187 6633 → 50434 [PSH, ACK] Seq=727 Ack=1 Win=853 Len=121 TSval=1220330 TSecr=394285181
 29 0.099950665 172.31.24.227 -> 172.31.31.144 OpenFlow 189 Type: OFPT_PACKET_IN
 30 0.100039394 172.31.31.144 -> 172.31.24.227 TCP 187 6633 → 50434 [PSH, ACK] Seq=848 Ack=1 Win=853 Len=121 TSval=1220330 TSecr=394285181
 31 0.100074058 172.31.31.144 -> 172.31.24.227 TCP 187 6633 → 50434 [PSH, ACK] Seq=969 Ack=1 Win=853 Len=121 TSval=1220330 TSecr=394285181
 32 0.100113811 172.31.31.144 -> 172.31.24.227 TCP 66 6633 → 50430 [ACK] Seq=727 Ack=124 Win=853 Len=0 TSval=1220330 TSecr=394285602
 33 0.100140591 172.31.24.227 -> 172.31.31.144 OpenFlow 189 Type: OFPT_PACKET_IN
 34 0.100163656 172.31.24.227 -> 172.31.31.144 OpenFlow 189 Type: OFPT_PACKET_IN
 35 0.100174332 172.31.31.144 -> 172.31.24.227 OpenFlow 187 Type: OFPT_PACKET_OUT
 36 0.100177534 172.31.31.144 -> 172.31.24.227 TCP 66 6633 → 50430 [ACK] Seq=727 Ack=247 Win=853 Len=0 TSval=1220330 TSecr=394285602
 37 0.100183769 172.31.24.227 -> 172.31.31.144 OpenFlow 189 Type: OFPT_PACKET_IN
 38 0.100231847 172.31.24.227 -> 172.31.31.144 OpenFlow 189 Type: OFPT_PACKET_IN
 39 0.100354590 172.31.31.144 -> 172.31.24.227 TCP 66 6633 → 50440 [ACK] Seq=1 Ack=370 Win=853 Len=0 TSval=1220330 TSecr=394285602
 40 0.100398896 172.31.31.144 -> 172.31.24.227 TCP 66 6633 → 50440 [ACK] Seq=1 Ack=493 Win=853 Len=0 TSval=1220330 TSecr=394285602
 41 0.100532774 172.31.31.144 -> 172.31.24.227 TCP 66 6633 → 50434 [ACK] Seq=1211 Ack=247 Win=853 Len=0 TSval=1220330 TSecr=394285602
 42 0.100760996 172.31.24.227 -> 172.31.31.144 OpenFlow 189 Type: OFPT_PACKET_IN
 43 0.100782485 172.31.24.227 -> 172.31.31.144 OpenFlow 189 Type: OFPT_PACKET_IN
 44 0.100861170 172.31.24.227 -> 172.31.31.144 OpenFlow 189 Type: OFPT_PACKET_IN
 45 0.100879940 172.31.24.227 -> 172.31.31.144 OpenFlow 189 Type: OFPT_PACKET_IN
 46 0.100895827 172.31.24.227 -> 172.31.31.144 OpenFlow 189 Type: OFPT_PACKET_IN
 47 0.100937592 172.31.24.227 -> 172.31.31.144 OpenFlow 189 Type: OFPT_PACKET_IN
 48 0.101029981 172.31.31.144 -> 172.31.24.227 TCP 66 6633 → 50432 [ACK] Seq=969 Ack=370 Win=853 Len=0 TSval=1220330 TSecr=394285602
 49 0.101037400 172.31.31.144 -> 172.31.24.227 TCP 66 6633 → 50432 [ACK] Seq=969 Ack=493 Win=853 Len=0 TSval=1220330 TSecr=394285602
 50 0.101061857 172.31.24.227 -> 172.31.31.144 OpenFlow 189 Type: OFPT_PACKET_IN
 51 0.101098497 172.31.31.144 -> 172.31.24.227 TCP 66 6633 → 50442 [ACK] Seq=1 Ack=124 Win=853 Len=0 TSval=1220330 TSecr=394285602
 52 0.101107798 172.31.31.144 -> 172.31.24.227 TCP 66 6633 → 50442 [ACK] Seq=1 Ack=247 Win=853 Len=0 TSval=1220330 TSecr=394285602
 53 0.101113563 172.31.24.227 -> 172.31.31.144 OpenFlow 189 Type: OFPT_PACKET_IN
 54 0.101173825 172.31.31.144 -> 172.31.24.227 TCP 66 6633 → 50438 [ACK] Seq=1 Ack=124 Win=853 Len=0 TSval=1220330 TSecr=394285602
 55 0.101241210 172.31.31.144 -> 172.31.24.227 TCP 66 6633 → 50438 [ACK] Seq=1 Ack=247 Win=853 Len=0 TSval=1220330 TSecr=394285602
 56 0.101351918 172.31.31.144 -> 172.31.24.227 TCP 66 6633 → 50436 [ACK] Seq=1 Ack=247 Win=853 Len=0 TSval=1220330 TSecr=394285602
 57 0.199430472 172.31.31.144 -> 172.31.24.227 OpenFlow 187 Type: OFPT_PACKET_OUT
 58 0.199441273 172.31.31.144 -> 172.31.24.227 OpenFlow 187 Type: OFPT_PACKET_OUT
 59 0.199445323 172.31.31.144 -> 172.31.24.227 OpenFlow 187 Type: OFPT_PACKET_OUT
 60 0.199462420 172.31.31.144 -> 172.31.24.227 OpenFlow 187 Type: OFPT_PACKET_OUT
 61 0.199524182 172.31.31.144 -> 172.31.24.227 OpenFlow 187 Type: OFPT_PACKET_OUT
 62 0.199579050 172.31.31.144 -> 172.31.24.227 OpenFlow 187 Type: OFPT_PACKET_OUT
 63 0.199615640 172.31.31.144 -> 172.31.24.227 OpenFlow 187 Type: OFPT_PACKET_OUT
 64 0.199674391 172.31.31.144 -> 172.31.24.227 OpenFlow 187 Type: OFPT_PACKET_OUT
 65 0.199748595 172.31.31.144 -> 172.31.24.227 OpenFlow 187 Type: OFPT_PACKET_OUT
 66 0.199788793 172.31.31.144 -> 172.31.24.227 OpenFlow 187 Type: OFPT_PACKET_OUT
 67 0.199845301 172.31.31.144 -> 172.31.24.227 OpenFlow 187 Type: OFPT_PACKET_OUT
 68 0.199900413 172.31.31.144 -> 172.31.24.227 OpenFlow 187 Type: OFPT_PACKET_OUT
 69 0.199963980 172.31.24.227 -> 172.31.31.144 TCP 66 50436 → 6633 [ACK] Seq=247 Ack=969 Win=213 Len=0 TSval=394285627 TSecr=1220355
 70 0.199995927 172.31.31.144 -> 172.31.24.227 OpenFlow 187 Type: OFPT_PACKET_OUT
 71 0.200057231 172.31.31.144 -> 172.31.24.227 OpenFlow 187 Type: OFPT_PACKET_OUT
 72 0.200087956 172.31.24.227 -> 172.31.31.144 OpenFlow 189 Type: OFPT_PACKET_IN
 73 0.200107029 172.31.24.227 -> 172.31.31.144 OpenFlow 189 Type: OFPT_PACKET_IN
 74 0.200145737 172.31.24.227 -> 172.31.31.144 OpenFlow 189 Type: OFPT_PACKET_IN
 75 0.200163376 172.31.24.227 -> 172.31.31.144 OpenFlow 189 Type: OFPT_PACKET_IN
 76 0.200242682 172.31.24.227 -> 172.31.31.144 OpenFlow 189 Type: OFPT_PACKET_IN
 77 0.200260340 172.31.24.227 -> 172.31.31.144 OpenFlow 189 Type: OFPT_PACKET_IN
 78 0.200324966 172.31.31.144 -> 172.31.24.227 TCP 66 6633 → 50444 [ACK] Seq=1 Ack=124 Win=853 Len=0 TSval=1220355 TSecr=394285627
 79 0.200381271 172.31.31.144 -> 172.31.24.227 TCP 66 6633 → 50444 [ACK] Seq=1 Ack=247 Win=853 Len=0 TSval=1220355 TSecr=394285627
 80 0.200447023 172.31.31.144 -> 172.31.24.227 TCP 66 6633 → 50434 [ACK] Seq=1211 Ack=493 Win=853 Len=0 TSval=1220355 TSecr=394285627
 81 0.200586257 172.31.31.144 -> 172.31.24.227 TCP 66 6633 → 50438 [ACK] Seq=727 Ack=493 Win=853 Len=0 TSval=1220355 TSecr=394285627
 82 0.200761120 172.31.24.227 -> 172.31.31.144 OpenFlow 189 Type: OFPT_PACKET_IN
 83 0.200780902 172.31.24.227 -> 172.31.31.144 OpenFlow 189 Type: OFPT_PACKET_IN
 84 0.200812155 172.31.24.227 -> 172.31.31.144 OpenFlow 189 Type: OFPT_PACKET_IN
 85 0.200837761 172.31.24.227 -> 172.31.31.144 OpenFlow 189 Type: OFPT_PACKET_IN
 86 0.200912477 172.31.24.227 -> 172.31.31.144 OpenFlow 189 Type: OFPT_PACKET_IN
 87 0.200930597 172.31.24.227 -> 172.31.31.144 OpenFlow 189 Type: OFPT_PACKET_IN
 88 0.201073372 172.31.31.144 -> 172.31.24.227 TCP 66 6633 → 50434 [ACK] Seq=1211 Ack=739 Win=853 Len=0 TSval=1220355 TSecr=394285627
 89 0.201080571 172.31.31.144 -> 172.31.24.227 TCP 66 6633 → 50436 [ACK] Seq=969 Ack=493 Win=853 Len=0 TSval=1220355 TSecr=394285627
 90 0.201122867 172.31.31.144 -> 172.31.24.227 TCP 66 6633 → 50442 [ACK] Seq=1 Ack=370 Win=853 Len=0 TSval=1220355 TSecr=394285627
 91 0.201126762 172.31.31.144 -> 172.31.24.227 TCP 66 6633 → 50442 [ACK] Seq=1 Ack=493 Win=853 Len=0 TSval=1220355 TSecr=394285627
 92 0.299373669 172.31.31.144 -> 172.31.24.227 OpenFlow 187 Type: OFPT_PACKET_OUT
 93 0.299451233 172.31.31.144 -> 172.31.24.227 OpenFlow 187 Type: OFPT_PACKET_OUT
 94 0.299525326 172.31.31.144 -> 172.31.24.227 OpenFlow 187 Type: OFPT_PACKET_OUT
 95 0.299591390 172.31.31.144 -> 172.31.24.227 OpenFlow 187 Type: OFPT_PACKET_OUT
 96 0.299654963 172.31.31.144 -> 172.31.24.227 OpenFlow 187 Type: OFPT_PACKET_OUT
 97 0.299735661 172.31.31.144 -> 172.31.24.227 OpenFlow 187 Type: OFPT_PACKET_OUT
 98 0.299741869 172.31.31.144 -> 172.31.24.227 OpenFlow 187 Type: OFPT_PACKET_OUT
 99 0.299855050 172.31.31.144 -> 172.31.24.227 OpenFlow 187 Type: OFPT_PACKET_OUT
100 0.299861433 172.31.31.144 -> 172.31.24.227 OpenFlow 187 Type: OFPT_PACKET_OUT
101 0.299967019 172.31.31.144 -> 172.31.24.227 OpenFlow 187 Type: OFPT_PACKET_OUT
102 0.299973113 172.31.31.144 -> 172.31.24.227 OpenFlow 187 Type: OFPT_PACKET_OUT
103 0.300081971 172.31.31.144 -> 172.31.24.227 OpenFlow 187 Type: OFPT_PACKET_OUT
104 0.300088369 172.31.31.144 -> 172.31.24.227 OpenFlow 187 Type: OFPT_PACKET_OUT
105 0.300184401 172.31.31.144 -> 172.31.24.227 OpenFlow 187 Type: OFPT_PACKET_OUT
106 0.300190799 172.31.31.144 -> 172.31.24.227 OpenFlow 187 Type: OFPT_PACKET_OUT
107 0.300218950 172.31.31.144 -> 172.31.24.227 OpenFlow 187 Type: OFPT_PACKET_OUT
108 0.300273402 172.31.31.144 -> 172.31.24.227 OpenFlow 187 Type: OFPT_PACKET_OUT
109 0.300296094 172.31.24.227 -> 172.31.31.144 TCP 66 50440 → 6633 [ACK] Seq=493 Ack=1211 Win=213 Len=0 TSval=394285652 TSecr=1220380
110 0.300347384 172.31.31.144 -> 172.31.24.227 OpenFlow 187 Type: OFPT_PACKET_OUT
111 0.300400551 172.31.31.144 -> 172.31.24.227 OpenFlow 187 Type: OFPT_PACKET_OUT
112 0.300431154 172.31.31.144 -> 172.31.24.227 OpenFlow 187 Type: OFPT_PACKET_OUT
113 0.300463549 172.31.24.227 -> 172.31.31.144 OpenFlow 189 Type: OFPT_PACKET_IN
114 0.300483370 172.31.24.227 -> 172.31.31.144 OpenFlow 189 Type: OFPT_PACKET_IN
115 0.300508453 172.31.24.227 -> 172.31.31.144 OpenFlow 189 Type: OFPT_PACKET_IN
116 0.300543630 172.31.24.227 -> 172.31.31.144 OpenFlow 189 Type: OFPT_PACKET_IN
117 0.300581357 172.31.24.227 -> 172.31.31.144 OpenFlow 189 Type: OFPT_PACKET_IN
118 0.300604635 172.31.24.227 -> 172.31.31.144 OpenFlow 189 Type: OFPT_PACKET_IN
119 0.300634816 172.31.24.227 -> 172.31.31.144 OpenFlow 189 Type: OFPT_PACKET_IN
120 0.300674026 172.31.31.144 -> 172.31.24.227 TCP 66 6633 → 50446 [ACK] Seq=1 Ack=124 Win=853 Len=0 TSval=1220380 TSecr=394285652
121 0.300683648 172.31.31.144 -> 172.31.24.227 TCP 66 6633 → 50446 [ACK] Seq=1 Ack=247 Win=853 Len=0 TSval=1220380 TSecr=394285652
122 0.300736340 172.31.24.227 -> 172.31.31.144 OpenFlow 189 Type: OFPT_PACKET_IN
123 0.300781768 172.31.31.144 -> 172.31.24.227 TCP 66 6633 → 50432 [ACK] Seq=969 Ack=616 Win=853 Len=0 TSval=1220380 TSecr=394285652
124 0.300790497 172.31.31.144 -> 172.31.24.227 TCP 66 6633 → 50430 [ACK] Seq=727 Ack=370 Win=853 Len=0 TSval=1220380 TSecr=394285652
125 0.300848137 172.31.31.144 -> 172.31.24.227 TCP 66 6633 → 50432 [ACK] Seq=969 Ack=739 Win=853 Len=0 TSval=1220380 TSecr=394285652
126 0.300854463 172.31.31.144 -> 172.31.24.227 TCP 66 6633 → 50430 [ACK] Seq=727 Ack=493 Win=853 Len=0 TSval=1220380 TSecr=394285652
127 0.301110384 172.31.31.144 -> 172.31.24.227 TCP 66 6633 → 50442 [ACK] Seq=1211 Ack=739 Win=853 Len=0 TSval=1220380 TSecr=394285652
128 0.301272316 172.31.24.227 -> 172.31.31.144 OpenFlow 189 Type: OFPT_PACKET_IN
129 0.301292007 172.31.24.227 -> 172.31.31.144 OpenFlow 189 Type: OFPT_PACKET_IN
130 0.301411835 172.31.24.227 -> 172.31.31.144 OpenFlow 189 Type: OFPT_PACKET_IN
131 0.301431513 172.31.24.227 -> 172.31.31.144 OpenFlow 189 Type: OFPT_PACKET_IN
132 0.301447790 172.31.24.227 -> 172.31.31.144 OpenFlow 189 Type: OFPT_PACKET_IN
133 0.301464248 172.31.24.227 -> 172.31.31.144 OpenFlow 189 Type: OFPT_PACKET_IN
134 0.301496360 172.31.31.144 -> 172.31.24.227 TCP 66 6633 → 50438 [ACK] Seq=727 Ack=616 Win=853 Len=0 TSval=1220380 TSecr=394285652
135 0.301502219 172.31.31.144 -> 172.31.24.227 TCP 66 6633 → 50438 [ACK] Seq=727 Ack=739 Win=853 Len=0 TSval=1220380 TSecr=394285652
136 0.301509315 172.31.24.227 -> 172.31.31.144 OpenFlow 189 Type: OFPT_PACKET_IN
137 0.301533086 172.31.24.227 -> 172.31.31.144 OpenFlow 189 Type: OFPT_PACKET_IN
138 0.301536461 172.31.24.227 -> 172.31.31.144 OpenFlow 189 Type: OFPT_PACKET_IN
139 0.301603661 172.31.31.144 -> 172.31.24.227 TCP 66 6633 → 50450 [ACK] Seq=1 Ack=124 Win=853 Len=0 TSval=1220380 TSecr=394285652
140 0.301612500 172.31.24.227 -> 172.31.31.144 OpenFlow 189 Type: OFPT_PACKET_IN
141 0.301618659 172.31.24.227 -> 172.31.31.144 OpenFlow 189 Type: OFPT_PACKET_IN
142 0.301721488 172.31.31.144 -> 172.31.24.227 TCP 66 6633 → 50450 [ACK] Seq=1 Ack=247 Win=853 Len=0 TSval=1220380 TSecr=394285652
143 0.301727919 172.31.31.144 -> 172.31.24.227 TCP 66 6633 → 50440 [ACK] Seq=1211 Ack=616 Win=853 Len=0 TSval=1220380 TSecr=394285652
144 0.301734196 172.31.24.227 -> 172.31.31.144 OpenFlow 189 Type: OFPT_PACKET_IN
145 0.301809071 172.31.31.144 -> 172.31.24.227 TCP 66 6633 → 50446 [ACK] Seq=1 Ack=370 Win=853 Len=0 TSval=1220380 TSecr=394285652
146 0.301813378 172.31.31.144 -> 172.31.24.227 TCP 66 6633 → 50444 [ACK] Seq=1 Ack=370 Win=853 Len=0 TSval=1220380 TSecr=394285652
147 0.301985235 172.31.31.144 -> 172.31.24.227 TCP 66 6633 → 50446 [ACK] Seq=1 Ack=493 Win=853 Len=0 TSval=1220380 TSecr=394285652
148 0.301988737 172.31.31.144 -> 172.31.24.227 TCP 66 6633 → 50440 [ACK] Seq=1211 Ack=739 Win=853 Len=0 TSval=1220380 TSecr=394285652
149 0.301991213 172.31.31.144 -> 172.31.24.227 TCP 66 6633 → 50434 [ACK] Seq=1211 Ack=985 Win=853 Len=0 TSval=1220380 TSecr=394285652
150 0.301993968 172.31.31.144 -> 172.31.24.227 TCP 66 6633 → 50444 [ACK] Seq=1 Ack=493 Win=853 Len=0 TSval=1220380 TSecr=394285653
151 0.399703926 172.31.31.144 -> 172.31.24.227 OpenFlow 187 Type: OFPT_PACKET_OUT
152 0.399736824 172.31.31.144 -> 172.31.24.227 OpenFlow 187 Type: OFPT_PACKET_OUT
153 0.399778902 172.31.31.144 -> 172.31.24.227 OpenFlow 187 Type: OFPT_PACKET_OUT
154 0.399805181 172.31.31.144 -> 172.31.24.227 OpenFlow 187 Type: OFPT_PACKET_OUT
155 0.399870599 172.31.31.144 -> 172.31.24.227 OpenFlow 187 Type: OFPT_PACKET_OUT
156 0.399932748 172.31.31.144 -> 172.31.24.227 OpenFlow 187 Type: OFPT_PACKET_OUT
157 0.400012969 172.31.31.144 -> 172.31.24.227 OpenFlow 187 Type: OFPT_PACKET_OUT
158 0.400044740 172.31.31.144 -> 172.31.24.227 OpenFlow 187 Type: OFPT_PACKET_OUT
159 0.400105864 172.31.31.144 -> 172.31.24.227 OpenFlow 187 Type: OFPT_PACKET_OUT
160 0.400156030 172.31.31.144 -> 172.31.24.227 OpenFlow 187 Type: OFPT_PACKET_OUT
161 0.400211114 172.31.31.144 -> 172.31.24.227 OpenFlow 187 Type: OFPT_PACKET_OUT
162 0.400320685 172.31.31.144 -> 172.31.24.227 OpenFlow 187 Type: OFPT_PACKET_OUT
163 0.400325787 172.31.31.144 -> 172.31.24.227 OpenFlow 187 Type: OFPT_PACKET_OUT
164 0.400391744 172.31.31.144 -> 172.31.24.227 OpenFlow 187 Type: OFPT_PACKET_OUT
165 0.400438521 172.31.31.144 -> 172.31.24.227 OpenFlow 187 Type: OFPT_PACKET_OUT
166 0.400487656 172.31.31.144 -> 172.31.24.227 OpenFlow 187 Type: OFPT_PACKET_OUT
167 0.401832302 172.31.24.227 -> 172.31.31.144 TCP 66 50446 → 6633 [ACK] Seq=493 Ack=1211 Win=213 Len=0 TSval=394285678 TSecr=1220405
168 0.402131855 172.31.24.227 -> 172.31.31.144 TCP 66 50444 → 6633 [ACK] Seq=493 Ack=727 Win=213 Len=0 TSval=394285678 TSecr=1220405
169 0.402241041 172.31.24.227 -> 172.31.31.144 OpenFlow 189 Type: OFPT_PACKET_IN
170 0.402262426 172.31.24.227 -> 172.31.31.144 OpenFlow 312 Type: OFPT_PACKET_IN
171 0.402336956 172.31.24.227 -> 172.31.31.144 OpenFlow 189 Type: OFPT_PACKET_IN
172 0.402420006 172.31.24.227 -> 172.31.31.144 OpenFlow 189 Type: OFPT_PACKET_IN
173 0.402427717 172.31.24.227 -> 172.31.31.144 OpenFlow 435 Type: OFPT_PACKET_IN
174 0.402647517 172.31.31.144 -> 172.31.24.227 TCP 66 6633 → 50448 [ACK] Seq=1 Ack=124 Win=853 Len=0 TSval=1220406 TSecr=394285678
175 0.402656835 172.31.31.144 -> 172.31.24.227 TCP 66 6633 → 50448 [ACK] Seq=1 Ack=370 Win=853 Len=0 TSval=1220406 TSecr=394285678
176 0.402659528 172.31.31.144 -> 172.31.24.227 TCP 66 6633 → 50442 [ACK] Seq=1211 Ack=862 Win=853 Len=0 TSval=1220406 TSecr=394285678
177 0.402664921 172.31.31.144 -> 172.31.24.227 TCP 66 6633 → 50448 [ACK] Seq=1 Ack=493 Win=853 Len=0 TSval=1220406 TSecr=394285678
178 0.402737177 172.31.31.144 -> 172.31.24.227 TCP 66 6633 → 50442 [ACK] Seq=1211 Ack=1231 Win=853 Len=0 TSval=1220406 TSecr=394285678
179 0.408130252 172.31.24.227 -> 172.31.31.144 OpenFlow 189 Type: OFPT_PACKET_IN
180 0.408152824 172.31.24.227 -> 172.31.31.144 OpenFlow 189 Type: OFPT_PACKET_IN
181 0.408171569 172.31.24.227 -> 172.31.31.144 OpenFlow 189 Type: OFPT_PACKET_IN
182 0.408189336 172.31.24.227 -> 172.31.31.144 OpenFlow 189 Type: OFPT_PACKET_IN
183 0.408212080 172.31.24.227 -> 172.31.31.144 OpenFlow 189 Type: OFPT_PACKET_IN
184 0.408215297 172.31.24.227 -> 172.31.31.144 OpenFlow 189 Type: OFPT_PACKET_IN
185 0.408261947 172.31.24.227 -> 172.31.31.144 OpenFlow 189 Type: OFPT_PACKET_IN
186 0.408268518 172.31.24.227 -> 172.31.31.144 OpenFlow 189 Type: OFPT_PACKET_IN
187 0.408296235 172.31.24.227 -> 172.31.31.144 OpenFlow 146 Type: OFPT_PORT_STATUS
188 0.408325053 172.31.31.144 -> 172.31.24.227 TCP 66 6633 → 50452 [ACK] Seq=1 Ack=124 Win=853 Len=0 TSval=1220407 TSecr=394285679
189 0.408447665 172.31.24.227 -> 172.31.31.144 OpenFlow 146 Type: OFPT_PORT_STATUS
190 0.408463851 172.31.31.144 -> 172.31.24.227 TCP 66 6633 → 50452 [ACK] Seq=1 Ack=247 Win=853 Len=0 TSval=1220407 TSecr=394285679
191 0.408468768 172.31.31.144 -> 172.31.24.227 TCP 66 6633 → 50450 [ACK] Seq=1 Ack=370 Win=853 Len=0 TSval=1220407 TSecr=394285679
192 0.408471999 172.31.31.144 -> 172.31.24.227 TCP 66 6633 → 50436 [ACK] Seq=969 Ack=739 Win=853 Len=0 TSval=1220407 TSecr=394285679
193 0.408506703 172.31.31.144 -> 172.31.24.227 TCP 66 6633 → 50450 [ACK] Seq=1 Ack=493 Win=853 Len=0 TSval=1220407 TSecr=394285679
194 0.408728387 172.31.31.144 -> 172.31.24.227 TCP 66 6633 → 50438 [ACK] Seq=727 Ack=819 Win=853 Len=0 TSval=1220407 TSecr=394285679
195 0.408969342 172.31.31.144 -> 172.31.24.227 TCP 66 6633 → 50440 [ACK] Seq=1211 Ack=985 Win=853 Len=0 TSval=1220407 TSecr=394285679
196 0.432780701 172.31.31.144 -> 172.31.24.227 OpenFlow 146 Type: OFPT_FLOW_MOD
197 0.432790515 172.31.31.144 -> 172.31.24.227 OpenFlow 154 Type: OFPT_BARRIER_REQUEST
198 0.432794675 172.31.31.144 -> 172.31.24.227 OpenFlow 146 Type: OFPT_FLOW_MOD
199 0.432797280 172.31.31.144 -> 172.31.24.227 OpenFlow 146 Type: OFPT_FLOW_MOD
200 0.432799183 172.31.31.144 -> 172.31.24.227 OpenFlow 74 Type: OFPT_BARRIER_REQUEST
201 0.432823881 172.31.31.144 -> 172.31.24.227 OpenFlow 146 Type: OFPT_FLOW_MOD
202 0.432827456 172.31.31.144 -> 172.31.24.227 OpenFlow 154 Type: OFPT_BARRIER_REQUEST
203 0.432904280 172.31.31.144 -> 172.31.24.227 OpenFlow 146 Type: OFPT_FLOW_MOD
204 0.432910108 172.31.31.144 -> 172.31.24.227 OpenFlow 146 Type: OFPT_FLOW_MOD
205 0.432912043 172.31.31.144 -> 172.31.24.227 OpenFlow 74 Type: OFPT_BARRIER_REQUEST
206 0.432934857 172.31.24.227 -> 172.31.31.144 OpenFlow 74 Type: OFPT_BARRIER_REPLY
207 0.433032565 172.31.31.144 -> 172.31.24.227 OpenFlow 146 Type: OFPT_FLOW_MOD
208 0.433039220 172.31.31.144 -> 172.31.24.227 OpenFlow 146 Type: OFPT_FLOW_MOD
209 0.433043408 172.31.31.144 -> 172.31.24.227 OpenFlow 322 Type: OFPT_BARRIER_REQUEST
210 0.433046353 172.31.31.144 -> 172.31.24.227 OpenFlow 154 Type: OFPT_BARRIER_REQUEST
211 0.433052967 172.31.24.227 -> 172.31.31.144 OpenFlow 74 Type: OFPT_BARRIER_REPLY
212 0.433097643 172.31.24.227 -> 172.31.31.144 OpenFlow 74 Type: OFPT_BARRIER_REPLY
213 0.433120746 172.31.24.227 -> 172.31.31.144 OpenFlow 74 Type: OFPT_BARRIER_REPLY
214 0.433246984 172.31.24.227 -> 172.31.31.144 OpenFlow 146 Type: OFPT_FLOW_REMOVED
215 0.433264443 172.31.31.144 -> 172.31.24.227 TCP 66 6633 → 50436 [ACK] Seq=1305 Ack=755 Win=853 Len=0 TSval=1220413 TSecr=394285685
216 0.433273996 172.31.24.227 -> 172.31.31.144 OpenFlow 146 Type: OFPT_FLOW_REMOVED
217 0.433292653 172.31.24.227 -> 172.31.31.144 OpenFlow 226 Type: OFPT_FLOW_REMOVED
218 0.433297622 172.31.24.227 -> 172.31.31.144 OpenFlow 146 Type: OFPT_FLOW_REMOVED
219 0.433346390 172.31.24.227 -> 172.31.31.144 OpenFlow 306 Type: OFPT_FLOW_REMOVED
220 0.433404542 172.31.31.144 -> 172.31.24.227 TCP 66 6633 → 50438 [ACK] Seq=1063 Ack=835 Win=853 Len=0 TSval=1220413 TSecr=394285685
221 0.433469590 172.31.31.144 -> 172.31.24.227 TCP 66 6633 → 50436 [ACK] Seq=1305 Ack=915 Win=853 Len=0 TSval=1220413 TSecr=394285685
222 0.433588265 172.31.31.144 -> 172.31.24.227 TCP 66 6633 → 50438 [ACK] Seq=1063 Ack=1155 Win=853 Len=0 TSval=1220413 TSecr=394285685
223 0.435263799 172.31.24.227 -> 172.31.31.144 OpenFlow 74 Type: OFPT_BARRIER_REPLY
224 0.435307874 172.31.24.227 -> 172.31.31.144 OpenFlow 74 Type: OFPT_BARRIER_REPLY
225 0.435377865 172.31.24.227 -> 172.31.31.144 TCP 66 50432 → 6633 [ACK] Seq=739 Ack=1137 Win=213 Len=0 TSval=394285686 TSecr=1220413
226 0.435388432 172.31.24.227 -> 172.31.31.144 OpenFlow 74 Type: OFPT_BARRIER_REPLY
227 0.435501087 172.31.31.144 -> 172.31.24.227 TCP 66 6633 → 50434 [ACK] Seq=1547 Ack=1081 Win=853 Len=0 TSval=1220414 TSecr=394285686
228 0.435581561 172.31.24.227 -> 172.31.31.144 OpenFlow 146 Type: OFPT_FLOW_REMOVED
229 0.435600979 172.31.24.227 -> 172.31.31.144 OpenFlow 146 Type: OFPT_FLOW_REMOVED
230 0.435614343 172.31.24.227 -> 172.31.31.144 OpenFlow 146 Type: OFPT_FLOW_REMOVED
231 0.435763295 172.31.24.227 -> 172.31.31.144 OpenFlow 226 Type: OFPT_FLOW_REMOVED
232 0.435770092 172.31.24.227 -> 172.31.31.144 OpenFlow 146 Type: OFPT_FLOW_REMOVED
233 0.435793649 172.31.31.144 -> 172.31.24.227 TCP 66 6633 → 50432 [ACK] Seq=1137 Ack=747 Win=853 Len=0 TSval=1220414 TSecr=394285686
234 0.435799086 172.31.31.144 -> 172.31.24.227 OpenFlow 170 Type: OFPT_FLOW_MOD
235 0.435802240 172.31.31.144 -> 172.31.24.227 OpenFlow 170 Type: OFPT_FLOW_MOD
236 0.435804424 172.31.31.144 -> 172.31.24.227 OpenFlow 178 Type: OFPT_BARRIER_REQUEST
237 0.435806589 172.31.31.144 -> 172.31.24.227 OpenFlow 178 Type: OFPT_BARRIER_REQUEST
238 0.436056139 172.31.31.144 -> 172.31.24.227 OpenFlow 170 Type: OFPT_FLOW_MOD
239 0.436060657 172.31.31.144 -> 172.31.24.227 OpenFlow 170 Type: OFPT_FLOW_MOD
240 0.436063959 172.31.31.144 -> 172.31.24.227 OpenFlow 170 Type: OFPT_FLOW_MOD
241 0.436066020 172.31.31.144 -> 172.31.24.227 OpenFlow 170 Type: OFPT_FLOW_MOD
242 0.436067899 172.31.31.144 -> 172.31.24.227 OpenFlow 170 Type: OFPT_FLOW_MOD
243 0.436070622 172.31.31.144 -> 172.31.24.227 OpenFlow 170 Type: OFPT_FLOW_MOD
244 0.436072778 172.31.31.144 -> 172.31.24.227 OpenFlow 74 Type: OFPT_BARRIER_REQUEST
245 0.436075345 172.31.31.144 -> 172.31.24.227 OpenFlow 74 Type: OFPT_BARRIER_REQUEST
246 0.436077082 172.31.31.144 -> 172.31.24.227 OpenFlow 74 Type: OFPT_BARRIER_REQUEST
247 0.436115294 172.31.31.144 -> 172.31.24.227 OpenFlow 170 Type: OFPT_FLOW_MOD
248 0.436240798 172.31.31.144 -> 172.31.24.227 OpenFlow 170 Type: OFPT_FLOW_MOD
249 0.436338228 172.31.31.144 -> 172.31.24.227 OpenFlow 170 Type: OFPT_FLOW_MOD
250 0.436403244 172.31.31.144 -> 172.31.24.227 OpenFlow 170 Type: OFPT_FLOW_MOD
251 0.437135966 172.31.24.227 -> 172.31.31.144 OpenFlow 74 Type: OFPT_BARRIER_REPLY
252 0.437169621 172.31.24.227 -> 172.31.31.144 OpenFlow 74 Type: OFPT_BARRIER_REPLY
253 0.437218942 172.31.24.227 -> 172.31.31.144 OpenFlow 74 Type: OFPT_BARRIER_REPLY
254 0.437268608 172.31.24.227 -> 172.31.31.144 OpenFlow 74 Type: OFPT_BARRIER_REPLY
255 0.437354373 172.31.31.144 -> 172.31.24.227 TCP 66 6633 → 50436 [ACK] Seq=1737 Ack=1091 Win=853 Len=0 TSval=1220414 TSecr=394285686
256 0.437370411 172.31.24.227 -> 172.31.31.144 OpenFlow 74 Type: OFPT_BARRIER_REPLY
257 0.437445209 172.31.31.144 -> 172.31.24.227 TCP 66 6633 → 50434 [ACK] Seq=2187 Ack=1417 Win=853 Len=0 TSval=1220414 TSecr=394285686
258 0.474057238 172.31.31.144 -> 172.31.24.227 TCP 66 6633 → 50432 [ACK] Seq=1561 Ack=915 Win=853 Len=0 TSval=1220424 TSecr=394285686
259 0.499769577 172.31.31.144 -> 172.31.24.227 OpenFlow 187 Type: OFPT_PACKET_OUT
260 0.499795383 172.31.31.144 -> 172.31.24.227 OpenFlow 187 Type: OFPT_PACKET_OUT
261 0.499843251 172.31.31.144 -> 172.31.24.227 OpenFlow 187 Type: OFPT_PACKET_OUT
262 0.499905631 172.31.31.144 -> 172.31.24.227 OpenFlow 187 Type: OFPT_PACKET_OUT
263 0.499955457 172.31.31.144 -> 172.31.24.227 OpenFlow 187 Type: OFPT_PACKET_OUT
264 0.500008967 172.31.31.144 -> 172.31.24.227 OpenFlow 187 Type: OFPT_PACKET_OUT
265 0.500071150 172.31.31.144 -> 172.31.24.227 OpenFlow 187 Type: OFPT_PACKET_OUT
266 0.500110725 172.31.31.144 -> 172.31.24.227 OpenFlow 187 Type: OFPT_PACKET_OUT
267 0.500178827 172.31.31.144 -> 172.31.24.227 OpenFlow 187 Type: OFPT_PACKET_OUT
268 0.500226603 172.31.31.144 -> 172.31.24.227 OpenFlow 187 Type: OFPT_PACKET_OUT
269 0.500277863 172.31.31.144 -> 172.31.24.227 OpenFlow 187 Type: OFPT_PACKET_OUT
270 0.500339189 172.31.31.144 -> 172.31.24.227 OpenFlow 187 Type: OFPT_PACKET_OUT
271 0.500390137 172.31.31.144 -> 172.31.24.227 OpenFlow 187 Type: OFPT_PACKET_OUT
272 0.500440869 172.31.31.144 -> 172.31.24.227 OpenFlow 187 Type: OFPT_PACKET_OUT
273 0.500487004 172.31.31.144 -> 172.31.24.227 OpenFlow 187 Type: OFPT_PACKET_OUT
274 0.500535557 172.31.31.144 -> 172.31.24.227 OpenFlow 187 Type: OFPT_PACKET_OUT
275 0.500566717 172.31.24.227 -> 172.31.31.144 TCP 66 50448 → 6633 [ACK] Seq=493 Ack=969 Win=213 Len=0 TSval=394285702 TSecr=1220430
276 0.500593193 172.31.31.144 -> 172.31.24.227 OpenFlow 187 Type: OFPT_PACKET_OUT
277 0.500642817 172.31.31.144 -> 172.31.24.227 OpenFlow 187 Type: OFPT_PACKET_OUT
278 0.500793514 172.31.24.227 -> 172.31.31.144 OpenFlow 189 Type: OFPT_PACKET_IN
279 0.500816072 172.31.24.227 -> 172.31.31.144 OpenFlow 189 Type: OFPT_PACKET_IN
280 0.501012884 172.31.31.144 -> 172.31.24.227 TCP 66 6633 → 50456 [ACK] Seq=1 Ack=124 Win=853 Len=0 TSval=1220430 TSecr=394285702
281 0.501021342 172.31.31.144 -> 172.31.24.227 TCP 66 6633 → 50456 [ACK] Seq=1 Ack=247 Win=853 Len=0 TSval=1220430 TSecr=394285702
282 0.501306219 172.31.24.227 -> 172.31.31.144 TCP 66 50450 → 6633 [ACK] Seq=493 Ack=1211 Win=213 Len=0 TSval=394285702 TSecr=1220430
283 0.501382128 172.31.24.227 -> 172.31.31.144 OpenFlow 189 Type: OFPT_PACKET_IN
284 0.501416758 172.31.24.227 -> 172.31.31.144 OpenFlow 189 Type: OFPT_PACKET_IN
285 0.501447507 172.31.24.227 -> 172.31.31.144 OpenFlow 189 Type: OFPT_PACKET_IN
286 0.501471949 172.31.24.227 -> 172.31.31.144 OpenFlow 189 Type: OFPT_PACKET_IN
287 0.501477538 172.31.24.227 -> 172.31.31.144 OpenFlow 189 Type: OFPT_PACKET_IN
288 0.501495209 172.31.24.227 -> 172.31.31.144 OpenFlow 189 Type: OFPT_PACKET_IN
289 0.501501212 172.31.24.227 -> 172.31.31.144 OpenFlow 189 Type: OFPT_PACKET_IN
290 0.501521194 172.31.24.227 -> 172.31.31.144 OpenFlow 189 Type: OFPT_PACKET_IN
291 0.501579578 172.31.24.227 -> 172.31.31.144 OpenFlow 189 Type: OFPT_PACKET_IN
292 0.501586058 172.31.24.227 -> 172.31.31.144 OpenFlow 435 Type: OFPT_PACKET_IN
293 0.501727319 172.31.24.227 -> 172.31.31.144 OpenFlow 189 Type: OFPT_PACKET_IN
294 0.501732111 172.31.24.227 -> 172.31.31.144 OpenFlow 189 Type: OFPT_PACKET_IN
295 0.501739249 172.31.31.144 -> 172.31.24.227 TCP 66 6633 → 50440 [ACK] Seq=1211 Ack=1108 Win=853 Len=0 TSval=1220430 TSecr=394285702
296 0.501744652 172.31.31.144 -> 172.31.24.227 TCP 66 6633 → 50454 [ACK] Seq=1 Ack=124 Win=853 Len=0 TSval=1220430 TSecr=394285702
297 0.501748424 172.31.31.144 -> 172.31.24.227 TCP 66 6633 → 50466 [ACK] Seq=1 Ack=124 Win=853 Len=0 TSval=1220430 TSecr=394285702
298 0.501751256 172.31.31.144 -> 172.31.24.227 TCP 66 6633 → 50454 [ACK] Seq=1 Ack=247 Win=853 Len=0 TSval=1220430 TSecr=394285702
299 0.501753931 172.31.31.144 -> 172.31.24.227 TCP 66 6633 → 50440 [ACK] Seq=1211 Ack=1231 Win=853 Len=0 TSval=1220430 TSecr=394285702
300 0.501813894 172.31.24.227 -> 172.31.31.144 OpenFlow 189 Type: OFPT_PACKET_IN
301 0.501820524 172.31.24.227 -> 172.31.31.144 OpenFlow 189 Type: OFPT_PACKET_IN
302 0.501873831 172.31.31.144 -> 172.31.24.227 TCP 66 6633 → 50466 [ACK] Seq=1 Ack=247 Win=853 Len=0 TSval=1220430 TSecr=394285702
303 0.501984577 172.31.31.144 -> 172.31.24.227 TCP 66 6633 → 50458 [ACK] Seq=1 Ack=124 Win=853 Len=0 TSval=1220430 TSecr=394285702
304 0.501991724 172.31.31.144 -> 172.31.24.227 TCP 66 6633 → 50452 [ACK] Seq=1 Ack=370 Win=853 Len=0 TSval=1220430 TSecr=394285703
305 0.502106336 172.31.31.144 -> 172.31.24.227 TCP 66 6633 → 50458 [ACK] Seq=1 Ack=247 Win=853 Len=0 TSval=1220431 TSecr=394285703
306 0.502109947 172.31.31.144 -> 172.31.24.227 TCP 66 6633 → 50446 [ACK] Seq=1211 Ack=985 Win=853 Len=0 TSval=1220431 TSecr=394285702
307 0.502112809 172.31.31.144 -> 172.31.24.227 TCP 66 6633 → 50452 [ACK] Seq=1 Ack=493 Win=853 Len=0 TSval=1220431 TSecr=394285703
308 0.502223675 172.31.31.144 -> 172.31.24.227 TCP 66 6633 → 50444 [ACK] Seq=727 Ack=739 Win=853 Len=0 TSval=1220431 TSecr=394285702
309 0.598990745 172.31.31.144 -> 172.31.24.227 OpenFlow 187 Type: OFPT_PACKET_OUT
310 0.599016492 172.31.31.144 -> 172.31.24.227 OpenFlow 187 Type: OFPT_PACKET_OUT
311 0.599314590 172.31.24.227 -> 172.31.31.144 TCP 66 50452 → 6633 [ACK] Seq=493 Ack=243 Win=213 Len=0 TSval=394285727 TSecr=1220455
312 0.599426950 172.31.24.227 -> 172.31.31.144 OpenFlow 189 Type: OFPT_PACKET_IN
313 0.599461029 172.31.24.227 -> 172.31.31.144 OpenFlow 189 Type: OFPT_PACKET_IN
314 0.607402178 172.31.31.144 -> 172.31.24.227 TCP 66 6633 → 50450 [ACK] Seq=1211 Ack=739 Win=853 Len=0 TSval=1220457 TSecr=394285727
315 0.607761787 172.31.31.144 -> 172.31.24.227 OpenFlow 187 Type: OFPT_PACKET_OUT
316 0.607768322 172.31.31.144 -> 172.31.24.227 OpenFlow 671 Type: OFPT_PACKET_OUT
317 0.607771526 172.31.31.144 -> 172.31.24.227 OpenFlow 187 Type: OFPT_PACKET_OUT
318 0.607798830 172.31.31.144 -> 172.31.24.227 OpenFlow 187 Type: OFPT_PACKET_OUT
319 0.607869354 172.31.31.144 -> 172.31.24.227 OpenFlow 187 Type: OFPT_PACKET_OUT
320 0.607909119 172.31.31.144 -> 172.31.24.227 OpenFlow 187 Type: OFPT_PACKET_OUT
321 0.607976292 172.31.31.144 -> 172.31.24.227 OpenFlow 187 Type: OFPT_PACKET_OUT
322 0.608026904 172.31.31.144 -> 172.31.24.227 OpenFlow 187 Type: OFPT_PACKET_OUT
323 0.608078352 172.31.31.144 -> 172.31.24.227 OpenFlow 187 Type: OFPT_PACKET_OUT
324 0.608136778 172.31.31.144 -> 172.31.24.227 OpenFlow 187 Type: OFPT_PACKET_OUT
325 0.608178908 172.31.24.227 -> 172.31.31.144 TCP 66 50452 → 6633 [ACK] Seq=493 Ack=969 Win=213 Len=0 TSval=394285729 TSecr=1220457
326 0.608274897 172.31.24.227 -> 172.31.31.144 OpenFlow 189 Type: OFPT_PACKET_IN
327 0.608294675 172.31.24.227 -> 172.31.31.144 OpenFlow 189 Type: OFPT_PACKET_IN
328 0.608310359 172.31.24.227 -> 172.31.31.144 OpenFlow 189 Type: OFPT_PACKET_IN
329 0.608350656 172.31.24.227 -> 172.31.31.144 OpenFlow 189 Type: OFPT_PACKET_IN
330 0.608459168 172.31.31.144 -> 172.31.24.227 TCP 66 6633 → 50460 [ACK] Seq=1 Ack=124 Win=853 Len=0 TSval=1220457 TSecr=394285729
331 0.608508716 172.31.31.144 -> 172.31.24.227 TCP 66 6633 → 50460 [ACK] Seq=1 Ack=247 Win=853 Len=0 TSval=1220457 TSecr=394285729
332 0.608564573 172.31.31.144 -> 172.31.24.227 TCP 66 6633 → 50454 [ACK] Seq=969 Ack=493 Win=853 Len=0 TSval=1220457 TSecr=394285729
333 0.608765443 172.31.24.227 -> 172.31.31.144 OpenFlow 189 Type: OFPT_PACKET_IN
334 0.608784729 172.31.24.227 -> 172.31.31.144 OpenFlow 189 Type: OFPT_PACKET_IN
335 0.608815035 172.31.24.227 -> 172.31.31.144 OpenFlow 189 Type: OFPT_PACKET_IN
336 0.608835224 172.31.24.227 -> 172.31.31.144 OpenFlow 189 Type: OFPT_PACKET_IN
337 0.608843649 172.31.24.227 -> 172.31.31.144 OpenFlow 189 Type: OFPT_PACKET_IN
338 0.608910446 172.31.24.227 -> 172.31.31.144 OpenFlow 189 Type: OFPT_PACKET_IN
339 0.608953835 172.31.31.144 -> 172.31.24.227 TCP 66 6633 → 50446 [ACK] Seq=1211 Ack=1108 Win=853 Len=0 TSval=1220457 TSecr=394285729
340 0.609002865 172.31.31.144 -> 172.31.24.227 TCP 66 6633 → 50462 [ACK] Seq=1 Ack=124 Win=853 Len=0 TSval=1220457 TSecr=394285729
341 0.609037530 172.31.24.227 -> 172.31.31.144 OpenFlow 189 Type: OFPT_PACKET_IN
342 0.609066788 172.31.24.227 -> 172.31.31.144 OpenFlow 189 Type: OFPT_PACKET_IN
343 0.609098162 172.31.31.144 -> 172.31.24.227 TCP 66 6633 → 50462 [ACK] Seq=1 Ack=247 Win=853 Len=0 TSval=1220457 TSecr=394285729
344 0.609102999 172.31.31.144 -> 172.31.24.227 TCP 66 6633 → 50448 [ACK] Seq=969 Ack=616 Win=853 Len=0 TSval=1220457 TSecr=394285729
345 0.609129233 172.31.24.227 -> 172.31.31.144 OpenFlow 189 Type: OFPT_PACKET_IN
346 0.609135352 172.31.24.227 -> 172.31.31.144 OpenFlow 189 Type: OFPT_PACKET_IN
347 0.609309013 172.31.31.144 -> 172.31.24.227 TCP 66 6633 → 50448 [ACK] Seq=969 Ack=739 Win=853 Len=0 TSval=1220457 TSecr=394285729
348 0.609315870 172.31.31.144 -> 172.31.24.227 TCP 66 6633 → 50446 [ACK] Seq=1211 Ack=1231 Win=853 Len=0 TSval=1220457 TSecr=394285729
349 0.609318221 172.31.31.144 -> 172.31.24.227 TCP 66 6633 → 50456 [ACK] Seq=1 Ack=370 Win=853 Len=0 TSval=1220457 TSecr=394285729
350 0.609365011 172.31.31.144 -> 172.31.24.227 TCP 66 6633 → 50456 [ACK] Seq=1 Ack=493 Win=853 Len=0 TSval=1220457 TSecr=394285729
351 0.609512830 172.31.31.144 -> 172.31.24.227 TCP 66 6633 → 50452 [ACK] Seq=969 Ack=739 Win=853 Len=0 TSval=1220457 TSecr=394285729
352 0.699459769 172.31.31.144 -> 172.31.24.227 OpenFlow 187 Type: OFPT_PACKET_OUT
353 0.699470346 172.31.31.144 -> 172.31.24.227 OpenFlow 187 Type: OFPT_PACKET_OUT
354 0.699474396 172.31.31.144 -> 172.31.24.227 OpenFlow 187 Type: OFPT_PACKET_OUT
355 0.699487255 172.31.31.144 -> 172.31.24.227 OpenFlow 187 Type: OFPT_PACKET_OUT
356 0.699525991 172.31.31.144 -> 172.31.24.227 OpenFlow 187 Type: OFPT_PACKET_OUT
357 0.699586214 172.31.31.144 -> 172.31.24.227 OpenFlow 187 Type: OFPT_PACKET_OUT
358 0.699630904 172.31.31.144 -> 172.31.24.227 OpenFlow 187 Type: OFPT_PACKET_OUT
359 0.699674331 172.31.31.144 -> 172.31.24.227 OpenFlow 187 Type: OFPT_PACKET_OUT
360 0.699720174 172.31.31.144 -> 172.31.24.227 OpenFlow 187 Type: OFPT_PACKET_OUT
361 0.699765156 172.31.31.144 -> 172.31.24.227 OpenFlow 187 Type: OFPT_PACKET_OUT
362 0.699810811 172.31.31.144 -> 172.31.24.227 OpenFlow 187 Type: OFPT_PACKET_OUT
363 0.699858876 172.31.31.144 -> 172.31.24.227 OpenFlow 187 Type: OFPT_PACKET_OUT
364 0.699936821 172.31.24.227 -> 172.31.31.144 TCP 66 50456 → 6633 [ACK] Seq=493 Ack=727 Win=213 Len=0 TSval=394285752 TSecr=1220480
365 0.700054553 172.31.24.227 -> 172.31.31.144 OpenFlow 189 Type: OFPT_PACKET_IN
366 0.700074213 172.31.24.227 -> 172.31.31.144 OpenFlow 189 Type: OFPT_PACKET_IN
367 0.700133484 172.31.24.227 -> 172.31.31.144 OpenFlow 189 Type: OFPT_PACKET_IN
368 0.700150597 172.31.24.227 -> 172.31.31.144 OpenFlow 189 Type: OFPT_PACKET_IN
369 0.700209644 172.31.24.227 -> 172.31.31.144 OpenFlow 189 Type: OFPT_PACKET_IN
370 0.700227083 172.31.24.227 -> 172.31.31.144 OpenFlow 189 Type: OFPT_PACKET_IN
371 0.700274729 172.31.31.144 -> 172.31.24.227 TCP 66 6633 → 50454 [ACK] Seq=969 Ack=739 Win=853 Len=0 TSval=1220480 TSecr=394285752
372 0.700352268 172.31.31.144 -> 172.31.24.227 TCP 66 6633 → 50448 [ACK] Seq=969 Ack=985 Win=853 Len=0 TSval=1220480 TSecr=394285752
373 0.700402083 172.31.31.144 -> 172.31.24.227 TCP 66 6633 → 50464 [ACK] Seq=1 Ack=124 Win=853 Len=0 TSval=1220480 TSecr=394285752
374 0.700433167 172.31.31.144 -> 172.31.24.227 TCP 66 6633 → 50464 [ACK] Seq=1 Ack=247 Win=853 Len=0 TSval=1220480 TSecr=394285752
375 0.700538109 172.31.24.227 -> 172.31.31.144 TCP 66 50458 → 6633 [ACK] Seq=247 Ack=727 Win=213 Len=0 TSval=394285752 TSecr=1220480
376 0.700685976 172.31.24.227 -> 172.31.31.144 OpenFlow 189 Type: OFPT_PACKET_IN
377 0.700705732 172.31.24.227 -> 172.31.31.144 OpenFlow 189 Type: OFPT_PACKET_IN
378 0.700741952 172.31.24.227 -> 172.31.31.144 OpenFlow 189 Type: OFPT_PACKET_IN
379 0.700760594 172.31.24.227 -> 172.31.31.144 OpenFlow 189 Type: OFPT_PACKET_IN
380 0.700785119 172.31.24.227 -> 172.31.31.144 OpenFlow 189 Type: OFPT_PACKET_IN
381 0.700814032 172.31.24.227 -> 172.31.31.144 OpenFlow 189 Type: OFPT_PACKET_IN
382 0.700920320 172.31.31.144 -> 172.31.24.227 TCP 66 6633 → 50468 [ACK] Seq=1 Ack=124 Win=853 Len=0 TSval=1220480 TSecr=394285752
383 0.700928195 172.31.31.144 -> 172.31.24.227 TCP 66 6633 → 50468 [ACK] Seq=1 Ack=247 Win=853 Len=0 TSval=1220480 TSecr=394285752
384 0.700930749 172.31.31.144 -> 172.31.24.227 TCP 66 6633 → 50450 [ACK] Seq=1211 Ack=862 Win=853 Len=0 TSval=1220480 TSecr=394285752
385 0.701023474 172.31.31.144 -> 172.31.24.227 TCP 66 6633 → 50460 [ACK] Seq=1 Ack=370 Win=853 Len=0 TSval=1220480 TSecr=394285752
386 0.701049405 172.31.31.144 -> 172.31.24.227 TCP 66 6633 → 50460 [ACK] Seq=1 Ack=493 Win=853 Len=0 TSval=1220480 TSecr=394285752
387 0.701092152 172.31.31.144 -> 172.31.24.227 TCP 66 6633 → 50450 [ACK] Seq=1211 Ack=985 Win=853 Len=0 TSval=1220480 TSecr=394285752
388 0.799347285 172.31.31.144 -> 172.31.24.227 OpenFlow 187 Type: OFPT_PACKET_OUT
389 0.799371553 172.31.31.144 -> 172.31.24.227 OpenFlow 187 Type: OFPT_PACKET_OUT
390 0.799376624 172.31.31.144 -> 172.31.24.227 OpenFlow 187 Type: OFPT_PACKET_OUT
391 0.799379196 172.31.31.144 -> 172.31.24.227 OpenFlow 187 Type: OFPT_PACKET_OUT
392 0.799409664 172.31.31.144 -> 172.31.24.227 OpenFlow 187 Type: OFPT_PACKET_OUT
393 0.799442111 172.31.31.144 -> 172.31.24.227 OpenFlow 187 Type: OFPT_PACKET_OUT
394 0.799479528 172.31.31.144 -> 172.31.24.227 OpenFlow 187 Type: OFPT_PACKET_OUT
395 0.799534182 172.31.31.144 -> 172.31.24.227 OpenFlow 187 Type: OFPT_PACKET_OUT
396 0.799599490 172.31.31.144 -> 172.31.24.227 OpenFlow 187 Type: OFPT_PACKET_OUT
397 0.799639787 172.31.31.144 -> 172.31.24.227 OpenFlow 187 Type: OFPT_PACKET_OUT
398 0.799747272 172.31.31.144 -> 172.31.24.227 OpenFlow 187 Type: OFPT_PACKET_OUT
399 0.799753849 172.31.31.144 -> 172.31.24.227 OpenFlow 187 Type: OFPT_PACKET_OUT
400 0.799800869 172.31.31.144 -> 172.31.24.227 OpenFlow 187 Type: OFPT_PACKET_OUT
401 0.799854005 172.31.31.144 -> 172.31.24.227 OpenFlow 187 Type: OFPT_PACKET_OUT
402 0.799916500 172.31.31.144 -> 172.31.24.227 OpenFlow 187 Type: OFPT_PACKET_OUT
403 0.799960823 172.31.31.144 -> 172.31.24.227 OpenFlow 187 Type: OFPT_PACKET_OUT
404 0.800016216 172.31.31.144 -> 172.31.24.227 OpenFlow 187 Type: OFPT_PACKET_OUT
405 0.800063855 172.31.31.144 -> 172.31.24.227 OpenFlow 187 Type: OFPT_PACKET_OUT
406 0.800122561 172.31.31.144 -> 172.31.24.227 OpenFlow 187 Type: OFPT_PACKET_OUT
407 0.800175737 172.31.31.144 -> 172.31.24.227 OpenFlow 187 Type: OFPT_PACKET_OUT
408 0.800301251 172.31.24.227 -> 172.31.31.144 TCP 66 50460 → 6633 [ACK] Seq=493 Ack=1211 Win=213 Len=0 TSval=394285777 TSecr=1220505
409 0.800408794 172.31.24.227 -> 172.31.31.144 OpenFlow 189 Type: OFPT_PACKET_IN
410 0.800429112 172.31.24.227 -> 172.31.31.144 OpenFlow 189 Type: OFPT_PACKET_IN
411 0.800651369 172.31.31.144 -> 172.31.24.227 TCP 66 6633 → 50462 [ACK] Seq=1211 Ack=370 Win=853 Len=0 TSval=1220505 TSecr=394285777
412 0.800659890 172.31.31.144 -> 172.31.24.227 TCP 66 6633 → 50462 [ACK] Seq=1211 Ack=493 Win=853 Len=0 TSval=1220505 TSecr=394285777
413 0.800974219 172.31.24.227 -> 172.31.31.144 OpenFlow 189 Type: OFPT_PACKET_IN
414 0.800994286 172.31.24.227 -> 172.31.31.144 OpenFlow 189 Type: OFPT_PACKET_IN
415 0.801011276 172.31.24.227 -> 172.31.31.144 OpenFlow 189 Type: OFPT_PACKET_IN
416 0.801038409 172.31.24.227 -> 172.31.31.144 OpenFlow 189 Type: OFPT_PACKET_IN
417 0.801048393 172.31.24.227 -> 172.31.31.144 OpenFlow 435 Type: OFPT_PACKET_IN
418 0.801067355 172.31.24.227 -> 172.31.31.144 OpenFlow 189 Type: OFPT_PACKET_IN
419 0.801087993 172.31.24.227 -> 172.31.31.144 OpenFlow 189 Type: OFPT_PACKET_IN
420 0.801091285 172.31.24.227 -> 172.31.31.144 OpenFlow 189 Type: OFPT_PACKET_IN
421 0.801155019 172.31.24.227 -> 172.31.31.144 OpenFlow 189 Type: OFPT_PACKET_IN
422 0.801164295 172.31.24.227 -> 172.31.31.144 OpenFlow 189 Type: OFPT_PACKET_IN
423 0.801223714 172.31.24.227 -> 172.31.31.144 OpenFlow 189 Type: OFPT_PACKET_IN
424 0.801259657 172.31.24.227 -> 172.31.31.144 OpenFlow 189 Type: OFPT_PACKET_IN
425 0.801276079 172.31.24.227 -> 172.31.31.144 OpenFlow 189 Type: OFPT_PACKET_IN
426 0.801328203 172.31.31.144 -> 172.31.24.227 TCP 66 6633 → 50474 [ACK] Seq=1 Ack=124 Win=853 Len=0 TSval=1220505 TSecr=394285777
427 0.801335672 172.31.31.144 -> 172.31.24.227 TCP 66 6633 → 50474 [ACK] Seq=1 Ack=247 Win=853 Len=0 TSval=1220505 TSecr=394285777
428 0.801338430 172.31.31.144 -> 172.31.24.227 TCP 66 6633 → 50472 [ACK] Seq=1 Ack=124 Win=853 Len=0 TSval=1220505 TSecr=394285777
429 0.801341315 172.31.31.144 -> 172.31.24.227 TCP 66 6633 → 50470 [ACK] Seq=1 Ack=124 Win=853 Len=0 TSval=1220505 TSecr=394285777
430 0.801344077 172.31.31.144 -> 172.31.24.227 TCP 66 6633 → 50472 [ACK] Seq=1 Ack=493 Win=853 Len=0 TSval=1220505 TSecr=394285777
431 0.801346220 172.31.31.144 -> 172.31.24.227 TCP 66 6633 → 50464 [ACK] Seq=1 Ack=370 Win=853 Len=0 TSval=1220505 TSecr=394285777
432 0.801348744 172.31.31.144 -> 172.31.24.227 TCP 66 6633 → 50458 [ACK] Seq=727 Ack=370 Win=853 Len=0 TSval=1220505 TSecr=394285777
433 0.801381738 172.31.24.227 -> 172.31.31.144 OpenFlow 189 Type: OFPT_PACKET_IN
434 0.801444351 172.31.24.227 -> 172.31.31.144 OpenFlow 189 Type: OFPT_PACKET_IN
435 0.801447958 172.31.24.227 -> 172.31.31.144 OpenFlow 189 Type: OFPT_PACKET_IN
436 0.801470840 172.31.31.144 -> 172.31.24.227 TCP 66 6633 → 50470 [ACK] Seq=1 Ack=247 Win=853 Len=0 TSval=1220505 TSecr=394285777
437 0.801578910 172.31.31.144 -> 172.31.24.227 TCP 66 6633 → 50464 [ACK] Seq=1 Ack=493 Win=853 Len=0 TSval=1220505 TSecr=394285777
438 0.801583258 172.31.31.144 -> 172.31.24.227 TCP 66 6633 → 50458 [ACK] Seq=727 Ack=493 Win=853 Len=0 TSval=1220505 TSecr=394285777
439 0.801912180 172.31.31.144 -> 172.31.24.227 TCP 66 6633 → 50452 [ACK] Seq=969 Ack=985 Win=853 Len=0 TSval=1220505 TSecr=394285777
440 0.802116885 172.31.31.144 -> 172.31.24.227 TCP 66 6633 → 50460 [ACK] Seq=1211 Ack=739 Win=853 Len=0 TSval=1220506 TSecr=394285777
441 0.802251334 172.31.31.144 -> 172.31.24.227 TCP 66 6633 → 50454 [ACK] Seq=969 Ack=985 Win=853 Len=0 TSval=1220506 TSecr=394285777
442 0.899525760 172.31.31.144 -> 172.31.24.227 OpenFlow 187 Type: OFPT_PACKET_OUT
443 0.899544526 172.31.31.144 -> 172.31.24.227 OpenFlow 187 Type: OFPT_PACKET_OUT
444 0.899548906 172.31.31.144 -> 172.31.24.227 OpenFlow 187 Type: OFPT_PACKET_OUT
445 0.899565083 172.31.31.144 -> 172.31.24.227 OpenFlow 187 Type: OFPT_PACKET_OUT
446 0.899609743 172.31.31.144 -> 172.31.24.227 OpenFlow 187 Type: OFPT_PACKET_OUT
447 0.899664659 172.31.31.144 -> 172.31.24.227 OpenFlow 187 Type: OFPT_PACKET_OUT
448 0.900064403 172.31.24.227 -> 172.31.31.144 TCP 66 50464 → 6633 [ACK] Seq=493 Ack=727 Win=213 Len=0 TSval=394285802 TSecr=1220530
449 0.900246812 172.31.24.227 -> 172.31.31.144 OpenFlow 189 Type: OFPT_PACKET_IN
450 0.900269086 172.31.24.227 -> 172.31.31.144 OpenFlow 189 Type: OFPT_PACKET_IN
451 0.900340046 172.31.24.227 -> 172.31.31.144 OpenFlow 189 Type: OFPT_PACKET_IN
452 0.900368960 172.31.24.227 -> 172.31.31.144 OpenFlow 189 Type: OFPT_PACKET_IN
453 0.900387606 172.31.24.227 -> 172.31.31.144 OpenFlow 189 Type: OFPT_PACKET_IN
454 0.900464419 172.31.24.227 -> 172.31.31.144 OpenFlow 189 Type: OFPT_PACKET_IN
455 0.900489932 172.31.31.144 -> 172.31.24.227 TCP 66 6633 → 50456 [ACK] Seq=727 Ack=616 Win=853 Len=0 TSval=1220530 TSecr=394285802
456 0.900499030 172.31.31.144 -> 172.31.24.227 TCP 66 6633 → 50456 [ACK] Seq=727 Ack=739 Win=853 Len=0 TSval=1220530 TSecr=394285802
457 0.900571818 172.31.31.144 -> 172.31.24.227 TCP 66 6633 → 50462 [ACK] Seq=1211 Ack=739 Win=853 Len=0 TSval=1220530 TSecr=394285802
458 0.900658767 172.31.31.144 -> 172.31.24.227 TCP 66 6633 → 50476 [ACK] Seq=1 Ack=124 Win=853 Len=0 TSval=1220530 TSecr=394285802
459 0.900664219 172.31.31.144 -> 172.31.24.227 TCP 66 6633 → 50476 [ACK] Seq=1 Ack=247 Win=853 Len=0 TSval=1220530 TSecr=394285802
460 0.998967181 172.31.31.144 -> 172.31.24.227 OpenFlow 187 Type: OFPT_PACKET_OUT
461 0.998997859 172.31.31.144 -> 172.31.24.227 OpenFlow 187 Type: OFPT_PACKET_OUT
462 0.999023919 172.31.31.144 -> 172.31.24.227 OpenFlow 187 Type: OFPT_PACKET_OUT
463 0.999072377 172.31.31.144 -> 172.31.24.227 OpenFlow 187 Type: OFPT_PACKET_OUT
464 0.999126780 172.31.31.144 -> 172.31.24.227 OpenFlow 187 Type: OFPT_PACKET_OUT
465 0.999191013 172.31.31.144 -> 172.31.24.227 OpenFlow 187 Type: OFPT_PACKET_OUT
466 0.999260757 172.31.31.144 -> 172.31.24.227 OpenFlow 187 Type: OFPT_PACKET_OUT
467 0.999321693 172.31.31.144 -> 172.31.24.227 OpenFlow 187 Type: OFPT_PACKET_OUT
468 0.999366309 172.31.31.144 -> 172.31.24.227 OpenFlow 187 Type: OFPT_PACKET_OUT
469 0.999416122 172.31.31.144 -> 172.31.24.227 OpenFlow 187 Type: OFPT_PACKET_OUT
470 0.999481742 172.31.31.144 -> 172.31.24.227 OpenFlow 187 Type: OFPT_PACKET_OUT
471 0.999530296 172.31.24.227 -> 172.31.31.144 TCP 66 50466 → 6633 [ACK] Seq=247 Ack=727 Win=213 Len=0 TSval=394285827 TSecr=1220555
472 0.999633872 172.31.31.144 -> 172.31.24.227 OpenFlow 187 Type: OFPT_PACKET_OUT
473 0.999640460 172.31.31.144 -> 172.31.24.227 OpenFlow 187 Type: OFPT_PACKET_OUT
474 0.999643112 172.31.31.144 -> 172.31.24.227 OpenFlow 187 Type: OFPT_PACKET_OUT
475 0.999790859 172.31.24.227 -> 172.31.31.144 OpenFlow 189 Type: OFPT_PACKET_IN
476 0.999812129 172.31.24.227 -> 172.31.31.144 OpenFlow 189 Type: OFPT_PACKET_IN
477 1.000034167 172.31.31.144 -> 172.31.24.227 TCP 66 6633 → 50468 [ACK] Seq=969 Ack=370 Win=853 Len=0 TSval=1220555 TSecr=394285827
478 1.000041950 172.31.31.144 -> 172.31.24.227 TCP 66 6633 → 50468 [ACK] Seq=969 Ack=493 Win=853 Len=0 TSval=1220555 TSecr=394285827
479 1.000203218 172.31.24.227 -> 172.31.31.144 OpenFlow 189 Type: OFPT_PACKET_IN
480 1.000223180 172.31.24.227 -> 172.31.31.144 OpenFlow 189 Type: OFPT_PACKET_IN
481 1.000261403 172.31.24.227 -> 172.31.31.144 OpenFlow 189 Type: OFPT_PACKET_IN
482 1.000278208 172.31.24.227 -> 172.31.31.144 OpenFlow 189 Type: OFPT_PACKET_IN
483 1.000338735 172.31.24.227 -> 172.31.31.144 OpenFlow 189 Type: OFPT_PACKET_IN
484 1.000356701 172.31.24.227 -> 172.31.31.144 OpenFlow 189 Type: OFPT_PACKET_IN
485 1.000376672 172.31.24.227 -> 172.31.31.144 OpenFlow 189 Type: OFPT_PACKET_IN
486 1.000462139 172.31.31.144 -> 172.31.24.227 TCP 66 6633 → 50450 [ACK] Seq=1211 Ack=1108 Win=853 Len=0 TSval=1220555 TSecr=394285827
487 1.000469158 172.31.31.144 -> 172.31.24.227 TCP 66 6633 → 50450 [ACK] Seq=1211 Ack=1231 Win=853 Len=0 TSval=1220555 TSecr=394285827
488 1.000471882 172.31.31.144 -> 172.31.24.227 TCP 66 6633 → 50466 [ACK] Seq=727 Ack=370 Win=853 Len=0 TSval=1220555 TSecr=394285827
489 1.000474073 172.31.31.144 -> 172.31.24.227 TCP 66 6633 → 50466 [ACK] Seq=727 Ack=493 Win=853 Len=0 TSval=1220555 TSecr=394285827
490 1.000490816 172.31.24.227 -> 172.31.31.144 OpenFlow 189 Type: OFPT_PACKET_IN
491 1.000529239 172.31.31.144 -> 172.31.24.227 TCP 66 6633 → 50470 [ACK] Seq=1 Ack=370 Win=853 Len=0 TSval=1220555 TSecr=394285827
492 1.000621279 172.31.31.144 -> 172.31.24.227 TCP 66 6633 → 50470 [ACK] Seq=1 Ack=493 Win=853 Len=0 TSval=1220555 TSecr=394285827
493 1.000690111 172.31.31.144 -> 172.31.24.227 TCP 66 6633 → 50458 [ACK] Seq=727 Ack=616 Win=853 Len=0 TSval=1220555 TSecr=394285827
494 1.000693561 172.31.31.144 -> 172.31.24.227 TCP 66 6633 → 50458 [ACK] Seq=727 Ack=739 Win=853 Len=0 TSval=1220555 TSecr=394285827
495 1.099041944 172.31.31.144 -> 172.31.24.227 OpenFlow 187 Type: OFPT_PACKET_OUT
496 1.099062416 172.31.31.144 -> 172.31.24.227 OpenFlow 187 Type: OFPT_PACKET_OUT
497 1.099067094 172.31.31.144 -> 172.31.24.227 OpenFlow 187 Type: OFPT_PACKET_OUT
498 1.099082900 172.31.31.144 -> 172.31.24.227 OpenFlow 187 Type: OFPT_PACKET_OUT
499 1.099120141 172.31.31.144 -> 172.31.24.227 OpenFlow 187 Type: OFPT_PACKET_OUT
500 1.099166461 172.31.31.144 -> 172.31.24.227 OpenFlow 187 Type: OFPT_PACKET_OUT
501 1.099233973 172.31.31.144 -> 172.31.24.227 OpenFlow 187 Type: OFPT_PACKET_OUT
502 1.099272362 172.31.31.144 -> 172.31.24.227 OpenFlow 187 Type: OFPT_PACKET_OUT
503 1.099685713 172.31.24.227 -> 172.31.31.144 TCP 66 50470 → 6633 [ACK] Seq=493 Ack=969 Win=213 Len=0 TSval=394285852 TSecr=1220580
504 1.099857767 172.31.24.227 -> 172.31.31.144 OpenFlow 189 Type: OFPT_PACKET_IN
505 1.099877945 172.31.24.227 -> 172.31.31.144 OpenFlow 189 Type: OFPT_PACKET_IN
506 1.099927493 172.31.24.227 -> 172.31.31.144 OpenFlow 189 Type: OFPT_PACKET_IN
507 1.099945163 172.31.24.227 -> 172.31.31.144 OpenFlow 189 Type: OFPT_PACKET_IN
508 1.100004686 172.31.24.227 -> 172.31.31.144 OpenFlow 189 Type: OFPT_PACKET_IN
509 1.100021990 172.31.24.227 -> 172.31.31.144 OpenFlow 189 Type: OFPT_PACKET_IN
510 1.100127797 172.31.31.144 -> 172.31.24.227 TCP 66 6633 → 50468 [ACK] Seq=969 Ack=616 Win=853 Len=0 TSval=1220580 TSecr=394285852
511 1.100135804 172.31.31.144 -> 172.31.24.227 TCP 66 6633 → 50468 [ACK] Seq=969 Ack=739 Win=853 Len=0 TSval=1220580 TSecr=394285852
512 1.100138696 172.31.31.144 -> 172.31.24.227 TCP 66 6633 → 50460 [ACK] Seq=1211 Ack=862 Win=853 Len=0 TSval=1220580 TSecr=394285852
513 1.100141132 172.31.31.144 -> 172.31.24.227 TCP 66 6633 → 50460 [ACK] Seq=1211 Ack=985 Win=853 Len=0 TSval=1220580 TSecr=394285852
514 1.100210092 172.31.31.144 -> 172.31.24.227 TCP 66 6633 → 50472 [ACK] Seq=1 Ack=616 Win=853 Len=0 TSval=1220580 TSecr=394285852
515 1.100299704 172.31.31.144 -> 172.31.24.227 TCP 66 6633 → 50472 [ACK] Seq=1 Ack=739 Win=853 Len=0 TSval=1220580 TSecr=394285852
516 1.199692001 172.31.31.144 -> 172.31.24.227 OpenFlow 187 Type: OFPT_PACKET_OUT
517 1.199709226 172.31.31.144 -> 172.31.24.227 OpenFlow 187 Type: OFPT_PACKET_OUT
518 1.199713390 172.31.31.144 -> 172.31.24.227 OpenFlow 187 Type: OFPT_PACKET_OUT
519 1.199716038 172.31.31.144 -> 172.31.24.227 OpenFlow 187 Type: OFPT_PACKET_OUT
520 1.199754338 172.31.31.144 -> 172.31.24.227 OpenFlow 187 Type: OFPT_PACKET_OUT
521 1.199790817 172.31.31.144 -> 172.31.24.227 OpenFlow 187 Type: OFPT_PACKET_OUT
522 1.199822682 172.31.31.144 -> 172.31.24.227 OpenFlow 187 Type: OFPT_PACKET_OUT
523 1.199887905 172.31.31.144 -> 172.31.24.227 OpenFlow 187 Type: OFPT_PACKET_OUT
524 1.199949726 172.31.31.144 -> 172.31.24.227 OpenFlow 187 Type: OFPT_PACKET_OUT
525 1.199997846 172.31.31.144 -> 172.31.24.227 OpenFlow 187 Type: OFPT_PACKET_OUT
526 1.200032088 172.31.31.144 -> 172.31.24.227 OpenFlow 187 Type: OFPT_PACKET_OUT
527 1.200076230 172.31.31.144 -> 172.31.24.227 OpenFlow 187 Type: OFPT_PACKET_OUT
528 1.200121794 172.31.31.144 -> 172.31.24.227 OpenFlow 187 Type: OFPT_PACKET_OUT
529 1.200167478 172.31.31.144 -> 172.31.24.227 OpenFlow 187 Type: OFPT_PACKET_OUT
530 1.200216110 172.31.31.144 -> 172.31.24.227 OpenFlow 187 Type: OFPT_PACKET_OUT
531 1.200260681 172.31.31.144 -> 172.31.24.227 OpenFlow 187 Type: OFPT_PACKET_OUT
532 1.200418104 172.31.24.227 -> 172.31.31.144 TCP 66 50472 → 6633 [ACK] Seq=739 Ack=969 Win=213 Len=0 TSval=394285877 TSecr=1220605
533 1.200503095 172.31.24.227 -> 172.31.31.144 OpenFlow 189 Type: OFPT_PACKET_IN
534 1.200523369 172.31.24.227 -> 172.31.31.144 OpenFlow 189 Type: OFPT_PACKET_IN
535 1.200664429 172.31.24.227 -> 172.31.31.144 OpenFlow 189 Type: OFPT_PACKET_IN
536 1.200683413 172.31.24.227 -> 172.31.31.144 OpenFlow 189 Type: OFPT_PACKET_IN
537 1.200723925 172.31.24.227 -> 172.31.31.144 OpenFlow 189 Type: OFPT_PACKET_IN
538 1.200730753 172.31.31.144 -> 172.31.24.227 TCP 66 6633 → 50470 [ACK] Seq=969 Ack=616 Win=853 Len=0 TSval=1220605 TSecr=394285877
539 1.200761916 172.31.24.227 -> 172.31.31.144 OpenFlow 189 Type: OFPT_PACKET_IN
540 1.200777598 172.31.24.227 -> 172.31.31.144 OpenFlow 189 Type: OFPT_PACKET_IN
541 1.200817554 172.31.24.227 -> 172.31.31.144 OpenFlow 189 Type: OFPT_PACKET_IN
542 1.200913301 172.31.31.144 -> 172.31.24.227 TCP 66 6633 → 50470 [ACK] Seq=969 Ack=739 Win=853 Len=0 TSval=1220605 TSecr=394285877
543 1.200920331 172.31.31.144 -> 172.31.24.227 TCP 66 6633 → 50460 [ACK] Seq=1211 Ack=1108 Win=853 Len=0 TSval=1220605 TSecr=394285877
544 1.200923120 172.31.31.144 -> 172.31.24.227 TCP 66 6633 → 50460 [ACK] Seq=1211 Ack=1231 Win=853 Len=0 TSval=1220605 TSecr=394285877
545 1.200925396 172.31.31.144 -> 172.31.24.227 TCP 66 6633 → 50462 [ACK] Seq=1211 Ack=862 Win=853 Len=0 TSval=1220605 TSecr=394285877
546 1.200959515 172.31.31.144 -> 172.31.24.227 TCP 66 6633 → 50462 [ACK] Seq=1211 Ack=985 Win=853 Len=0 TSval=1220605 TSecr=394285877
547 1.200990355 172.31.31.144 -> 172.31.24.227 TCP 66 6633 → 50474 [ACK] Seq=969 Ack=370 Win=853 Len=0 TSval=1220605 TSecr=394285877
548 1.201079906 172.31.31.144 -> 172.31.24.227 TCP 66 6633 → 50474 [ACK] Seq=969 Ack=493 Win=853 Len=0 TSval=1220605 TSecr=394285877
549 1.201202079 172.31.24.227 -> 172.31.31.144 OpenFlow 189 Type: OFPT_PACKET_IN
550 1.201221294 172.31.24.227 -> 172.31.31.144 OpenFlow 189 Type: OFPT_PACKET_IN
551 1.201394282 172.31.24.227 -> 172.31.31.144 OpenFlow 189 Type: OFPT_PACKET_IN
552 1.201421619 172.31.24.227 -> 172.31.31.144 OpenFlow 189 Type: OFPT_PACKET_IN
553 1.201434323 172.31.31.144 -> 172.31.24.227 TCP 66 6633 → 50472 [ACK] Seq=969 Ack=862 Win=853 Len=0 TSval=1220605 TSecr=394285877
554 1.201440158 172.31.31.144 -> 172.31.24.227 TCP 66 6633 → 50472 [ACK] Seq=969 Ack=985 Win=853 Len=0 TSval=1220605 TSecr=394285877
555 1.201462543 172.31.24.227 -> 172.31.31.144 OpenFlow 189 Type: OFPT_PACKET_IN
556 1.201468579 172.31.24.227 -> 172.31.31.144 OpenFlow 189 Type: OFPT_PACKET_IN
557 1.201640757 172.31.31.144 -> 172.31.24.227 TCP 66 6633 → 50462 [ACK] Seq=1211 Ack=1108 Win=853 Len=0 TSval=1220605 TSecr=394285877
558 1.201647493 172.31.31.144 -> 172.31.24.227 TCP 66 6633 → 50476 [ACK] Seq=1 Ack=370 Win=853 Len=0 TSval=1220605 TSecr=394285877
559 1.201650312 172.31.31.144 -> 172.31.24.227 TCP 66 6633 → 50462 [ACK] Seq=1211 Ack=1231 Win=853 Len=0 TSval=1220605 TSecr=394285877
560 1.201665147 172.31.31.144 -> 172.31.24.227 TCP 66 6633 → 50476 [ACK] Seq=1 Ack=493 Win=853 Len=0 TSval=1220605 TSecr=394285877
561 1.299696024 172.31.31.144 -> 172.31.24.227 OpenFlow 187 Type: OFPT_PACKET_OUT
562 1.299714384 172.31.31.144 -> 172.31.24.227 OpenFlow 187 Type: OFPT_PACKET_OUT
563 1.299719042 172.31.31.144 -> 172.31.24.227 OpenFlow 187 Type: OFPT_PACKET_OUT
564 1.299734051 172.31.31.144 -> 172.31.24.227 OpenFlow 187 Type: OFPT_PACKET_OUT
565 1.299763940 172.31.31.144 -> 172.31.24.227 OpenFlow 187 Type: OFPT_PACKET_OUT
566 1.299812705 172.31.31.144 -> 172.31.24.227 OpenFlow 187 Type: OFPT_PACKET_OUT
567 1.300145948 172.31.24.227 -> 172.31.31.144 TCP 66 50476 → 6633 [ACK] Seq=493 Ack=727 Win=213 Len=0 TSval=394285902 TSecr=1220630
568 1.300245741 172.31.24.227 -> 172.31.31.144 OpenFlow 189 Type: OFPT_PACKET_IN
569 1.300279426 172.31.24.227 -> 172.31.31.144 OpenFlow 189 Type: OFPT_PACKET_IN
570 1.300317685 172.31.24.227 -> 172.31.31.144 OpenFlow 189 Type: OFPT_PACKET_IN
571 1.300338011 172.31.24.227 -> 172.31.31.144 OpenFlow 189 Type: OFPT_PACKET_IN
572 1.300529348 172.31.31.144 -> 172.31.24.227 TCP 66 6633 → 50474 [ACK] Seq=969 Ack=616 Win=853 Len=0 TSval=1220630 TSecr=394285902
573 1.300537128 172.31.31.144 -> 172.31.24.227 TCP 66 6633 → 50474 [ACK] Seq=969 Ack=739 Win=853 Len=0 TSval=1220630 TSecr=394285902
574 1.300539900 172.31.31.144 -> 172.31.24.227 TCP 66 6633 → 50464 [ACK] Seq=727 Ack=616 Win=853 Len=0 TSval=1220630 TSecr=394285902
575 1.300542680 172.31.31.144 -> 172.31.24.227 TCP 66 6633 → 50464 [ACK] Seq=727 Ack=739 Win=853 Len=0 TSval=1220630 TSecr=394285902
