  1 0.000000000 172.31.31.144 -> 172.31.23.72 TCP 187 6633 → 33668 [PSH, ACK] Seq=1 Ack=1 Win=853 Len=121 TSval=1241036 TSecr=26079413
  2 0.000027902 172.31.31.144 -> 172.31.23.72 TCP 187 6633 → 33668 [PSH, ACK] Seq=122 Ack=1 Win=853 Len=121 TSval=1241036 TSecr=26079413
  3 0.000031852 172.31.31.144 -> 172.31.23.72 TCP 187 6633 → 33668 [PSH, ACK] Seq=243 Ack=1 Win=853 Len=121 TSval=1241036 TSecr=26079413
  4 0.000034339 172.31.31.144 -> 172.31.23.72 TCP 187 6633 → 33668 [PSH, ACK] Seq=364 Ack=1 Win=853 Len=121 TSval=1241036 TSecr=26079413
  5 0.000053962 172.31.31.144 -> 172.31.23.72 TCP 187 6633 → 33668 [PSH, ACK] Seq=485 Ack=1 Win=853 Len=121 TSval=1241036 TSecr=26079413
  6 0.000065674 172.31.31.144 -> 172.31.23.72 TCP 187 6633 → 33668 [PSH, ACK] Seq=606 Ack=1 Win=853 Len=121 TSval=1241036 TSecr=26079413
  7 0.000117089 172.31.31.144 -> 172.31.23.72 TCP 187 6633 → 33668 [PSH, ACK] Seq=727 Ack=1 Win=853 Len=121 TSval=1241036 TSecr=26079413
  8 0.000173236 172.31.31.144 -> 172.31.23.72 TCP 187 6633 → 33668 [PSH, ACK] Seq=848 Ack=1 Win=853 Len=121 TSval=1241036 TSecr=26079413
  9 0.000529574 172.31.23.72 -> 172.31.31.144 TCP 66 33668 → 6633 [ACK] Seq=1 Ack=969 Win=213 Len=0 TSval=26080137 TSecr=1241036
 10 0.000673795 172.31.23.72 -> 172.31.31.144 OpenFlow 189 Type: OFPT_PACKET_IN
 11 0.000698898 172.31.23.72 -> 172.31.31.144 OpenFlow 189 Type: OFPT_PACKET_IN
 12 0.000763692 172.31.23.72 -> 172.31.31.144 OpenFlow 189 Type: OFPT_PACKET_IN
 13 0.000784514 172.31.23.72 -> 172.31.31.144 OpenFlow 189 Type: OFPT_PACKET_IN
 14 0.000796889 172.31.23.72 -> 172.31.31.144 OpenFlow 189 Type: OFPT_PACKET_IN
 15 0.000856239 172.31.23.72 -> 172.31.31.144 OpenFlow 189 Type: OFPT_PACKET_IN
 16 0.000931629 172.31.31.144 -> 172.31.23.72 TCP 66 6633 → 33666 [ACK] Seq=1 Ack=247 Win=853 Len=0 TSval=1241036 TSecr=26080137
 17 0.001003487 172.31.31.144 -> 172.31.23.72 TCP 66 6633 → 33670 [ACK] Seq=1 Ack=247 Win=853 Len=0 TSval=1241036 TSecr=26080137
 18 0.001050796 172.31.31.144 -> 172.31.23.72 TCP 66 6633 → 33658 [ACK] Seq=1 Ack=124 Win=853 Len=0 TSval=1241036 TSecr=26080137
 19 0.001088578 172.31.31.144 -> 172.31.23.72 TCP 66 6633 → 33658 [ACK] Seq=1 Ack=247 Win=853 Len=0 TSval=1241036 TSecr=26080137
 20 0.099458548 172.31.31.144 -> 172.31.23.72 TCP 187 6633 → 33656 [PSH, ACK] Seq=1 Ack=1 Win=853 Len=121 TSval=1241061 TSecr=26079413
 21 0.099485168 172.31.31.144 -> 172.31.23.72 TCP 187 6633 → 33656 [PSH, ACK] Seq=122 Ack=1 Win=853 Len=121 TSval=1241061 TSecr=26079413
 22 0.099503487 172.31.31.144 -> 172.31.23.72 TCP 187 6633 → 33656 [PSH, ACK] Seq=243 Ack=1 Win=853 Len=121 TSval=1241061 TSecr=26079413
 23 0.099559083 172.31.31.144 -> 172.31.23.72 TCP 187 6633 → 33656 [PSH, ACK] Seq=364 Ack=1 Win=853 Len=121 TSval=1241061 TSecr=26079413
 24 0.099604467 172.31.31.144 -> 172.31.23.72 TCP 187 6633 → 33656 [PSH, ACK] Seq=485 Ack=1 Win=853 Len=121 TSval=1241061 TSecr=26079413
 25 0.099657854 172.31.31.144 -> 172.31.23.72 TCP 187 6633 → 33656 [PSH, ACK] Seq=606 Ack=1 Win=853 Len=121 TSval=1241061 TSecr=26079413
 26 0.099780745 172.31.31.144 -> 172.31.23.72 TCP 187 6633 → 33652 [PSH, ACK] Seq=1 Ack=1 Win=853 Len=121 TSval=1241061 TSecr=26079389
 27 0.099787346 172.31.31.144 -> 172.31.23.72 TCP 187 6633 → 33652 [PSH, ACK] Seq=122 Ack=1 Win=853 Len=121 TSval=1241061 TSecr=26079389
 28 0.099857212 172.31.31.144 -> 172.31.23.72 TCP 187 6633 → 33652 [PSH, ACK] Seq=243 Ack=1 Win=853 Len=121 TSval=1241061 TSecr=26079389
 29 0.099889870 172.31.31.144 -> 172.31.23.72 TCP 187 6633 → 33652 [PSH, ACK] Seq=364 Ack=1 Win=853 Len=121 TSval=1241061 TSecr=26079389
 30 0.099970903 172.31.31.144 -> 172.31.23.72 TCP 187 6633 → 33652 [PSH, ACK] Seq=485 Ack=1 Win=853 Len=121 TSval=1241061 TSecr=26079389
 31 0.100011752 172.31.31.144 -> 172.31.23.72 TCP 187 6633 → 33652 [PSH, ACK] Seq=606 Ack=1 Win=853 Len=121 TSval=1241061 TSecr=26079389
 32 0.100076841 172.31.23.72 -> 172.31.31.144 TCP 66 33656 → 6633 [ACK] Seq=1 Ack=727 Win=213 Len=0 TSval=26080162 TSecr=1241061
 33 0.100085011 172.31.31.144 -> 172.31.23.72 TCP 187 6633 → 33652 [PSH, ACK] Seq=727 Ack=1 Win=853 Len=121 TSval=1241061 TSecr=26079389
 34 0.100183007 172.31.31.144 -> 172.31.23.72 TCP 187 6633 → 33652 [PSH, ACK] Seq=848 Ack=1 Win=853 Len=121 TSval=1241061 TSecr=26079389
 35 0.100187967 172.31.31.144 -> 172.31.23.72 TCP 187 6633 → 33636 [PSH, ACK] Seq=1 Ack=1 Win=853 Len=121 TSval=1241061 TSecr=26079414
 36 0.100280229 172.31.31.144 -> 172.31.23.72 TCP 187 6633 → 33636 [PSH, ACK] Seq=122 Ack=1 Win=853 Len=121 TSval=1241061 TSecr=26079414
 37 0.100285623 172.31.31.144 -> 172.31.23.72 TCP 187 6633 → 33636 [PSH, ACK] Seq=243 Ack=1 Win=853 Len=121 TSval=1241061 TSecr=26079414
 38 0.100345644 172.31.31.144 -> 172.31.23.72 TCP 187 6633 → 33636 [PSH, ACK] Seq=364 Ack=1 Win=853 Len=121 TSval=1241061 TSecr=26079414
 39 0.100414377 172.31.31.144 -> 172.31.23.72 TCP 187 6633 → 33636 [PSH, ACK] Seq=485 Ack=1 Win=853 Len=121 TSval=1241061 TSecr=26079414
 40 0.100452180 172.31.31.144 -> 172.31.23.72 TCP 187 6633 → 33636 [PSH, ACK] Seq=606 Ack=1 Win=853 Len=121 TSval=1241061 TSecr=26079414
 41 0.100511657 172.31.31.144 -> 172.31.23.72 TCP 187 6633 → 33636 [PSH, ACK] Seq=727 Ack=1 Win=853 Len=121 TSval=1241061 TSecr=26079414
 42 0.100541301 172.31.23.72 -> 172.31.31.144 TCP 66 33652 → 6633 [ACK] Seq=1 Ack=969 Win=213 Len=0 TSval=26080162 TSecr=1241061
 43 0.100561841 172.31.31.144 -> 172.31.23.72 TCP 187 6633 → 33636 [PSH, ACK] Seq=848 Ack=1 Win=853 Len=121 TSval=1241061 TSecr=26079414
 44 0.100639495 172.31.31.144 -> 172.31.23.72 TCP 187 6633 → 33650 [PSH, ACK] Seq=1 Ack=1 Win=853 Len=121 TSval=1241061 TSecr=26079413
 45 0.100732555 172.31.31.144 -> 172.31.23.72 TCP 187 6633 → 33650 [PSH, ACK] Seq=122 Ack=1 Win=853 Len=121 TSval=1241061 TSecr=26079413
 46 0.100737356 172.31.31.144 -> 172.31.23.72 TCP 187 6633 → 33650 [PSH, ACK] Seq=243 Ack=1 Win=853 Len=121 TSval=1241061 TSecr=26079413
 47 0.100785748 172.31.31.144 -> 172.31.23.72 TCP 187 6633 → 33650 [PSH, ACK] Seq=364 Ack=1 Win=853 Len=121 TSval=1241061 TSecr=26079413
 48 0.100838858 172.31.31.144 -> 172.31.23.72 TCP 187 6633 → 33650 [PSH, ACK] Seq=485 Ack=1 Win=853 Len=121 TSval=1241061 TSecr=26079413
 49 0.100891602 172.31.31.144 -> 172.31.23.72 TCP 187 6633 → 33650 [PSH, ACK] Seq=606 Ack=1 Win=853 Len=121 TSval=1241061 TSecr=26079413
 50 0.100936558 172.31.23.72 -> 172.31.31.144 TCP 66 33636 → 6633 [ACK] Seq=1 Ack=969 Win=213 Len=0 TSval=26080162 TSecr=1241061
 51 0.100974687 172.31.31.144 -> 172.31.23.72 TCP 187 6633 → 33650 [PSH, ACK] Seq=727 Ack=1 Win=853 Len=121 TSval=1241061 TSecr=26079413
 52 0.101024305 172.31.31.144 -> 172.31.23.72 TCP 187 6633 → 33650 [PSH, ACK] Seq=848 Ack=1 Win=853 Len=121 TSval=1241061 TSecr=26079413
 53 0.101040346 172.31.23.72 -> 172.31.31.144 OpenFlow 189 Type: OFPT_PACKET_IN
 54 0.101051960 172.31.31.144 -> 172.31.23.72 OpenFlow 187 Type: OFPT_PACKET_OUT
 55 0.101062598 172.31.23.72 -> 172.31.31.144 OpenFlow 189 Type: OFPT_PACKET_IN
 56 0.101124762 172.31.31.144 -> 172.31.23.72 OpenFlow 187 Type: OFPT_PACKET_OUT
 57 0.101199662 172.31.31.144 -> 172.31.23.72 TCP 187 6633 → 33640 [PSH, ACK] Seq=1 Ack=1 Win=853 Len=121 TSval=1241061 TSecr=26079413
 58 0.101231790 172.31.31.144 -> 172.31.23.72 TCP 187 6633 → 33640 [PSH, ACK] Seq=122 Ack=1 Win=853 Len=121 TSval=1241061 TSecr=26079413
 59 0.101294814 172.31.31.144 -> 172.31.23.72 TCP 187 6633 → 33640 [PSH, ACK] Seq=243 Ack=1 Win=853 Len=121 TSval=1241061 TSecr=26079413
 60 0.101358477 172.31.31.144 -> 172.31.23.72 TCP 187 6633 → 33640 [PSH, ACK] Seq=364 Ack=1 Win=853 Len=121 TSval=1241061 TSecr=26079413
 61 0.101431806 172.31.31.144 -> 172.31.23.72 TCP 187 6633 → 33640 [PSH, ACK] Seq=485 Ack=1 Win=853 Len=121 TSval=1241061 TSecr=26079413
 62 0.101436088 172.31.31.144 -> 172.31.23.72 TCP 66 6633 → 33650 [ACK] Seq=1211 Ack=247 Win=853 Len=0 TSval=1241061 TSecr=26080162
 63 0.101476126 172.31.31.144 -> 172.31.23.72 TCP 187 6633 → 33640 [PSH, ACK] Seq=606 Ack=1 Win=853 Len=121 TSval=1241061 TSecr=26079413
 64 0.101529582 172.31.31.144 -> 172.31.23.72 TCP 187 6633 → 33640 [PSH, ACK] Seq=727 Ack=1 Win=853 Len=121 TSval=1241061 TSecr=26079413
 65 0.101576208 172.31.31.144 -> 172.31.23.72 TCP 187 6633 → 33640 [PSH, ACK] Seq=848 Ack=1 Win=853 Len=121 TSval=1241061 TSecr=26079413
 66 0.101635118 172.31.23.72 -> 172.31.31.144 OpenFlow 189 Type: OFPT_PACKET_IN
 67 0.101642147 172.31.31.144 -> 172.31.23.72 OpenFlow 187 Type: OFPT_PACKET_OUT
 68 0.101684896 172.31.31.144 -> 172.31.23.72 OpenFlow 187 Type: OFPT_PACKET_OUT
 69 0.101690963 172.31.23.72 -> 172.31.31.144 OpenFlow 189 Type: OFPT_PACKET_IN
 70 0.101793325 172.31.31.144 -> 172.31.23.72 TCP 187 6633 → 33634 [PSH, ACK] Seq=1 Ack=1 Win=853 Len=121 TSval=1241061 TSecr=26079414
 71 0.101799807 172.31.31.144 -> 172.31.23.72 TCP 187 6633 → 33634 [PSH, ACK] Seq=122 Ack=1 Win=853 Len=121 TSval=1241061 TSecr=26079414
 72 0.101863181 172.31.31.144 -> 172.31.23.72 TCP 187 6633 → 33634 [PSH, ACK] Seq=243 Ack=1 Win=853 Len=121 TSval=1241061 TSecr=26079414
 73 0.101968926 172.31.31.144 -> 172.31.23.72 TCP 66 6633 → 33640 [ACK] Seq=1211 Ack=247 Win=853 Len=0 TSval=1241061 TSecr=26080162
 74 0.101974346 172.31.31.144 -> 172.31.23.72 TCP 187 6633 → 33634 [PSH, ACK] Seq=364 Ack=1 Win=853 Len=121 TSval=1241061 TSecr=26079414
 75 0.101976696 172.31.31.144 -> 172.31.23.72 TCP 187 6633 → 33634 [PSH, ACK] Seq=485 Ack=1 Win=853 Len=121 TSval=1241061 TSecr=26079414
 76 0.102035426 172.31.31.144 -> 172.31.23.72 TCP 187 6633 → 33634 [PSH, ACK] Seq=606 Ack=1 Win=853 Len=121 TSval=1241061 TSecr=26079414
 77 0.102086281 172.31.31.144 -> 172.31.23.72 TCP 187 6633 → 33634 [PSH, ACK] Seq=727 Ack=1 Win=853 Len=121 TSval=1241061 TSecr=26079414
 78 0.102142785 172.31.31.144 -> 172.31.23.72 TCP 187 6633 → 33634 [PSH, ACK] Seq=848 Ack=1 Win=853 Len=121 TSval=1241061 TSecr=26079414
 79 0.102197957 172.31.31.144 -> 172.31.23.72 TCP 187 6633 → 33634 [PSH, ACK] Seq=969 Ack=1 Win=853 Len=121 TSval=1241061 TSecr=26079414
 80 0.102235827 172.31.23.72 -> 172.31.31.144 OpenFlow 189 Type: OFPT_PACKET_IN
 81 0.102254433 172.31.31.144 -> 172.31.23.72 OpenFlow 187 Type: OFPT_PACKET_OUT
 82 0.102259395 172.31.23.72 -> 172.31.31.144 OpenFlow 189 Type: OFPT_PACKET_IN
 83 0.102321947 172.31.31.144 -> 172.31.23.72 TCP 187 6633 → 33660 [PSH, ACK] Seq=1 Ack=1 Win=853 Len=121 TSval=1241061 TSecr=26079413
 84 0.102356415 172.31.31.144 -> 172.31.23.72 TCP 187 6633 → 33660 [PSH, ACK] Seq=122 Ack=1 Win=853 Len=121 TSval=1241062 TSecr=26079413
 85 0.102454537 172.31.31.144 -> 172.31.23.72 TCP 187 6633 → 33660 [PSH, ACK] Seq=243 Ack=1 Win=853 Len=121 TSval=1241062 TSecr=26079413
 86 0.102519141 172.31.31.144 -> 172.31.23.72 TCP 66 6633 → 33634 [ACK] Seq=1211 Ack=247 Win=853 Len=0 TSval=1241062 TSecr=26080163
 87 0.102524525 172.31.31.144 -> 172.31.23.72 TCP 187 6633 → 33660 [PSH, ACK] Seq=364 Ack=1 Win=853 Len=121 TSval=1241062 TSecr=26079413
 88 0.102558666 172.31.31.144 -> 172.31.23.72 TCP 187 6633 → 33660 [PSH, ACK] Seq=485 Ack=1 Win=853 Len=121 TSval=1241062 TSecr=26079413
 89 0.102604901 172.31.31.144 -> 172.31.23.72 TCP 187 6633 → 33660 [PSH, ACK] Seq=606 Ack=1 Win=853 Len=121 TSval=1241062 TSecr=26079413
 90 0.102663325 172.31.31.144 -> 172.31.23.72 TCP 187 6633 → 33660 [PSH, ACK] Seq=727 Ack=1 Win=853 Len=121 TSval=1241062 TSecr=26079413
 91 0.102719615 172.31.31.144 -> 172.31.23.72 TCP 187 6633 → 33660 [PSH, ACK] Seq=848 Ack=1 Win=853 Len=121 TSval=1241062 TSecr=26079413
 92 0.102747813 172.31.23.72 -> 172.31.31.144 OpenFlow 189 Type: OFPT_PACKET_IN
 93 0.102775229 172.31.31.144 -> 172.31.23.72 OpenFlow 187 Type: OFPT_PACKET_OUT
 94 0.102780591 172.31.23.72 -> 172.31.31.144 OpenFlow 189 Type: OFPT_PACKET_IN
 95 0.102819659 172.31.31.144 -> 172.31.23.72 OpenFlow 187 Type: OFPT_PACKET_OUT
 96 0.102948224 172.31.31.144 -> 172.31.23.72 TCP 187 6633 → 33654 [PSH, ACK] Seq=1 Ack=1 Win=853 Len=121 TSval=1241062 TSecr=26079413
 97 0.102953930 172.31.31.144 -> 172.31.23.72 TCP 187 6633 → 33654 [PSH, ACK] Seq=122 Ack=1 Win=853 Len=121 TSval=1241062 TSecr=26079413
 98 0.103025241 172.31.31.144 -> 172.31.23.72 TCP 187 6633 → 33654 [PSH, ACK] Seq=243 Ack=1 Win=853 Len=121 TSval=1241062 TSecr=26079413
 99 0.103075315 172.31.31.144 -> 172.31.23.72 TCP 187 6633 → 33654 [PSH, ACK] Seq=364 Ack=1 Win=853 Len=121 TSval=1241062 TSecr=26079413
100 0.103162346 172.31.31.144 -> 172.31.23.72 TCP 187 6633 → 33654 [PSH, ACK] Seq=485 Ack=1 Win=853 Len=121 TSval=1241062 TSecr=26079413
101 0.103166734 172.31.31.144 -> 172.31.23.72 TCP 66 6633 → 33660 [ACK] Seq=1211 Ack=247 Win=853 Len=0 TSval=1241062 TSecr=26080163
102 0.103207058 172.31.31.144 -> 172.31.23.72 TCP 187 6633 → 33654 [PSH, ACK] Seq=606 Ack=1 Win=853 Len=121 TSval=1241062 TSecr=26079413
103 0.103258849 172.31.31.144 -> 172.31.23.72 TCP 187 6633 → 33654 [PSH, ACK] Seq=727 Ack=1 Win=853 Len=121 TSval=1241062 TSecr=26079413
104 0.103311900 172.31.31.144 -> 172.31.23.72 TCP 187 6633 → 33654 [PSH, ACK] Seq=848 Ack=1 Win=853 Len=121 TSval=1241062 TSecr=26079413
105 0.103318191 172.31.23.72 -> 172.31.31.144 OpenFlow 189 Type: OFPT_PACKET_IN
106 0.103366618 172.31.31.144 -> 172.31.23.72 OpenFlow 187 Type: OFPT_PACKET_OUT
107 0.103373966 172.31.23.72 -> 172.31.31.144 OpenFlow 435 Type: OFPT_PACKET_IN
108 0.103412251 172.31.31.144 -> 172.31.23.72 OpenFlow 187 Type: OFPT_PACKET_OUT
109 0.103456724 172.31.31.144 -> 172.31.23.72 OpenFlow 187 Type: OFPT_PACKET_OUT
110 0.103507371 172.31.31.144 -> 172.31.23.72 OpenFlow 187 Type: OFPT_PACKET_OUT
111 0.103564887 172.31.31.144 -> 172.31.23.72 OpenFlow 187 Type: OFPT_PACKET_OUT
112 0.103631977 172.31.31.144 -> 172.31.23.72 OpenFlow 187 Type: OFPT_PACKET_OUT
113 0.103709476 172.31.31.144 -> 172.31.23.72 TCP 187 6633 → 33646 [PSH, ACK] Seq=1 Ack=1 Win=853 Len=121 TSval=1241062 TSecr=26079414
114 0.103784970 172.31.23.72 -> 172.31.31.144 OpenFlow 189 Type: OFPT_PACKET_IN
115 0.103836383 172.31.31.144 -> 172.31.23.72 TCP 187 6633 → 33646 [PSH, ACK] Seq=122 Ack=1 Win=853 Len=121 TSval=1241062 TSecr=26079414
116 0.103841899 172.31.31.144 -> 172.31.23.72 TCP 66 6633 → 33654 [ACK] Seq=969 Ack=493 Win=853 Len=0 TSval=1241062 TSecr=26080163
117 0.103848497 172.31.23.72 -> 172.31.31.144 OpenFlow 189 Type: OFPT_PACKET_IN
118 0.103859001 172.31.31.144 -> 172.31.23.72 TCP 187 6633 → 33646 [PSH, ACK] Seq=243 Ack=1 Win=853 Len=121 TSval=1241062 TSecr=26079414
119 0.103929366 172.31.31.144 -> 172.31.23.72 TCP 187 6633 → 33646 [PSH, ACK] Seq=364 Ack=1 Win=853 Len=121 TSval=1241062 TSecr=26079414
120 0.104000540 172.31.31.144 -> 172.31.23.72 TCP 187 6633 → 33646 [PSH, ACK] Seq=485 Ack=1 Win=853 Len=121 TSval=1241062 TSecr=26079414
121 0.104067369 172.31.23.72 -> 172.31.31.144 OpenFlow 189 Type: OFPT_PACKET_IN
122 0.104116013 172.31.31.144 -> 172.31.23.72 OpenFlow 187 Type: OFPT_PACKET_OUT
123 0.104125356 172.31.23.72 -> 172.31.31.144 OpenFlow 681 Type: OFPT_PACKET_IN
124 0.104172240 172.31.31.144 -> 172.31.23.72 TCP 66 6633 → 33666 [ACK] Seq=727 Ack=493 Win=853 Len=0 TSval=1241062 TSecr=26080163
125 0.104177741 172.31.31.144 -> 172.31.23.72 OpenFlow 187 Type: OFPT_PACKET_OUT
126 0.104180596 172.31.31.144 -> 172.31.23.72 OpenFlow 187 Type: OFPT_PACKET_OUT
127 0.104229424 172.31.31.144 -> 172.31.23.72 OpenFlow 187 Type: OFPT_PACKET_OUT
128 0.104267902 172.31.31.144 -> 172.31.23.72 OpenFlow 187 Type: OFPT_PACKET_OUT
129 0.104367634 172.31.31.144 -> 172.31.23.72 TCP 187 6633 → 33644 [PSH, ACK] Seq=1 Ack=1 Win=853 Len=121 TSval=1241062 TSecr=26079413
130 0.104373152 172.31.31.144 -> 172.31.23.72 TCP 187 6633 → 33644 [PSH, ACK] Seq=122 Ack=1 Win=853 Len=121 TSval=1241062 TSecr=26079413
131 0.104427680 172.31.31.144 -> 172.31.23.72 TCP 187 6633 → 33644 [PSH, ACK] Seq=243 Ack=1 Win=853 Len=121 TSval=1241062 TSecr=26079413
132 0.104505828 172.31.31.144 -> 172.31.23.72 TCP 187 6633 → 33644 [PSH, ACK] Seq=364 Ack=1 Win=853 Len=121 TSval=1241062 TSecr=26079413
133 0.104517974 172.31.31.144 -> 172.31.23.72 TCP 66 6633 → 33646 [ACK] Seq=1211 Ack=739 Win=853 Len=0 TSval=1241062 TSecr=26080163
134 0.104553199 172.31.31.144 -> 172.31.23.72 TCP 187 6633 → 33644 [PSH, ACK] Seq=485 Ack=1 Win=853 Len=121 TSval=1241062 TSecr=26079413
135 0.104589264 172.31.31.144 -> 172.31.23.72 TCP 187 6633 → 33644 [PSH, ACK] Seq=606 Ack=1 Win=853 Len=121 TSval=1241062 TSecr=26079413
136 0.104614111 172.31.23.72 -> 172.31.31.144 TCP 66 33646 → 6633 [ACK] Seq=739 Ack=1211 Win=213 Len=0 TSval=26080163 TSecr=1241062
137 0.104685585 172.31.23.72 -> 172.31.31.144 OpenFlow 189 Type: OFPT_PACKET_IN
138 0.104736893 172.31.23.72 -> 172.31.31.144 OpenFlow 189 Type: OFPT_PACKET_IN
139 0.104970325 172.31.23.72 -> 172.31.31.144 OpenFlow 189 Type: OFPT_PACKET_IN
140 0.104987269 172.31.31.144 -> 172.31.23.72 TCP 66 6633 → 33644 [ACK] Seq=727 Ack=247 Win=853 Len=0 TSval=1241062 TSecr=26080163
141 0.104994064 172.31.23.72 -> 172.31.31.144 OpenFlow 189 Type: OFPT_PACKET_IN
142 0.105012304 172.31.23.72 -> 172.31.31.144 OpenFlow 312 Type: OFPT_PACKET_IN
143 0.105025627 172.31.23.72 -> 172.31.31.144 OpenFlow 189 Type: OFPT_PACKET_IN
144 0.105043519 172.31.23.72 -> 172.31.31.144 OpenFlow 189 Type: OFPT_PACKET_IN
145 0.105086552 172.31.23.72 -> 172.31.31.144 OpenFlow 435 Type: OFPT_PACKET_IN
146 0.105091207 172.31.23.72 -> 172.31.31.144 OpenFlow 927 Type: OFPT_PACKET_IN
147 0.105094826 172.31.23.72 -> 172.31.31.144 OpenFlow 189 Type: OFPT_PACKET_IN
148 0.105110379 172.31.23.72 -> 172.31.31.144 OpenFlow 189 Type: OFPT_PACKET_IN
149 0.105127831 172.31.23.72 -> 172.31.31.144 OpenFlow 189 Type: OFPT_PACKET_IN
150 0.105141566 172.31.23.72 -> 172.31.31.144 OpenFlow 189 Type: OFPT_PACKET_IN
151 0.105155869 172.31.23.72 -> 172.31.31.144 OpenFlow 189 Type: OFPT_PACKET_IN
152 0.105173038 172.31.23.72 -> 172.31.31.144 OpenFlow 189 Type: OFPT_PACKET_IN
153 0.105195821 172.31.23.72 -> 172.31.31.144 OpenFlow 189 Type: OFPT_PACKET_IN
154 0.105295461 172.31.23.72 -> 172.31.31.144 OpenFlow 189 Type: OFPT_PACKET_IN
155 0.105299000 172.31.23.72 -> 172.31.31.144 OpenFlow 189 Type: OFPT_PACKET_IN
156 0.105315204 172.31.23.72 -> 172.31.31.144 OpenFlow 189 Type: OFPT_PACKET_IN
157 0.105327912 172.31.23.72 -> 172.31.31.144 OpenFlow 189 Type: OFPT_PACKET_IN
158 0.105351064 172.31.31.144 -> 172.31.23.72 TCP 66 6633 → 33632 [ACK] Seq=1 Ack=124 Win=853 Len=0 TSval=1241062 TSecr=26080163
159 0.105356440 172.31.31.144 -> 172.31.23.72 TCP 66 6633 → 33632 [ACK] Seq=1 Ack=247 Win=853 Len=0 TSval=1241062 TSecr=26080163
160 0.105358634 172.31.31.144 -> 172.31.23.72 TCP 66 6633 → 33632 [ACK] Seq=1 Ack=493 Win=853 Len=0 TSval=1241062 TSecr=26080163
161 0.105360492 172.31.31.144 -> 172.31.23.72 TCP 66 6633 → 33662 [ACK] Seq=1 Ack=124 Win=853 Len=0 TSval=1241062 TSecr=26080163
162 0.105362508 172.31.31.144 -> 172.31.23.72 TCP 66 6633 → 33648 [ACK] Seq=1 Ack=124 Win=853 Len=0 TSval=1241062 TSecr=26080163
163 0.105364475 172.31.31.144 -> 172.31.23.72 TCP 66 6633 → 33662 [ACK] Seq=1 Ack=493 Win=853 Len=0 TSval=1241062 TSecr=26080163
164 0.105365984 172.31.31.144 -> 172.31.23.72 TCP 66 6633 → 33648 [ACK] Seq=1 Ack=985 Win=853 Len=0 TSval=1241062 TSecr=26080163
165 0.105378305 172.31.23.72 -> 172.31.31.144 OpenFlow 189 Type: OFPT_PACKET_IN
166 0.105385279 172.31.23.72 -> 172.31.31.144 OpenFlow 189 Type: OFPT_PACKET_IN
167 0.105386983 172.31.23.72 -> 172.31.31.144 OpenFlow 189 Type: OFPT_PACKET_IN
168 0.105405703 172.31.23.72 -> 172.31.31.144 OpenFlow 189 Type: OFPT_PACKET_IN
169 0.105408397 172.31.23.72 -> 172.31.31.144 OpenFlow 189 Type: OFPT_PACKET_IN
170 0.105426469 172.31.23.72 -> 172.31.31.144 OpenFlow 189 Type: OFPT_PACKET_IN
171 0.105428804 172.31.23.72 -> 172.31.31.144 OpenFlow 435 Type: OFPT_PACKET_IN
172 0.105761700 172.31.31.144 -> 172.31.23.72 TCP 66 6633 → 33630 [ACK] Seq=1 Ack=124 Win=853 Len=0 TSval=1241062 TSecr=26080163
173 0.105768898 172.31.31.144 -> 172.31.23.72 TCP 66 6633 → 33664 [ACK] Seq=1 Ack=124 Win=853 Len=0 TSval=1241062 TSecr=26080163
174 0.105771181 172.31.31.144 -> 172.31.23.72 TCP 66 6633 → 33658 [ACK] Seq=1 Ack=370 Win=853 Len=0 TSval=1241062 TSecr=26080163
175 0.105773435 172.31.31.144 -> 172.31.23.72 TCP 66 6633 → 33638 [ACK] Seq=1 Ack=124 Win=853 Len=0 TSval=1241062 TSecr=26080163
176 0.105777810 172.31.23.72 -> 172.31.31.144 OpenFlow 435 Type: OFPT_PACKET_IN
177 0.105782868 172.31.31.144 -> 172.31.23.72 TCP 66 6633 → 33668 [ACK] Seq=969 Ack=124 Win=853 Len=0 TSval=1241062 TSecr=26080163
178 0.105785627 172.31.23.72 -> 172.31.31.144 OpenFlow 189 Type: OFPT_PACKET_IN
179 0.105790087 172.31.23.72 -> 172.31.31.144 OpenFlow 435 Type: OFPT_PACKET_IN
180 0.105791948 172.31.23.72 -> 172.31.31.144 OpenFlow 927 Type: OFPT_PACKET_IN
181 0.105793883 172.31.23.72 -> 172.31.31.144 OpenFlow 189 Type: OFPT_PACKET_IN
182 0.105795685 172.31.23.72 -> 172.31.31.144 OpenFlow 927 Type: OFPT_PACKET_IN
183 0.105979536 172.31.31.144 -> 172.31.23.72 TCP 66 6633 → 33672 [ACK] Seq=1 Ack=247 Win=853 Len=0 TSval=1241062 TSecr=26080163
184 0.105982102 172.31.31.144 -> 172.31.23.72 TCP 66 6633 → 33656 [ACK] Seq=727 Ack=124 Win=853 Len=0 TSval=1241062 TSecr=26080163
185 0.105984109 172.31.31.144 -> 172.31.23.72 TCP 66 6633 → 33652 [ACK] Seq=969 Ack=124 Win=853 Len=0 TSval=1241062 TSecr=26080163
186 0.105987533 172.31.23.72 -> 172.31.31.144 OpenFlow 681 Type: OFPT_PACKET_IN
187 0.105992149 172.31.23.72 -> 172.31.31.144 OpenFlow 189 Type: OFPT_PACKET_IN
188 0.106178553 172.31.31.144 -> 172.31.23.72 TCP 66 6633 → 33630 [ACK] Seq=1 Ack=247 Win=853 Len=0 TSval=1241062 TSecr=26080163
189 0.106180988 172.31.31.144 -> 172.31.23.72 TCP 66 6633 → 33670 [ACK] Seq=1 Ack=493 Win=853 Len=0 TSval=1241062 TSecr=26080163
190 0.106183068 172.31.31.144 -> 172.31.23.72 TCP 66 6633 → 33664 [ACK] Seq=1 Ack=247 Win=853 Len=0 TSval=1241062 TSecr=26080163
191 0.106309175 172.31.31.144 -> 172.31.23.72 TCP 66 6633 → 33638 [ACK] Seq=1 Ack=493 Win=853 Len=0 TSval=1241062 TSecr=26080164
192 0.106311426 172.31.31.144 -> 172.31.23.72 TCP 66 6633 → 33658 [ACK] Seq=1 Ack=739 Win=853 Len=0 TSval=1241062 TSecr=26080163
193 0.106313334 172.31.31.144 -> 172.31.23.72 TCP 66 6633 → 33668 [ACK] Seq=969 Ack=247 Win=853 Len=0 TSval=1241062 TSecr=26080164
194 0.106315021 172.31.31.144 -> 172.31.23.72 TCP 66 6633 → 33636 [ACK] Seq=969 Ack=493 Win=853 Len=0 TSval=1241062 TSecr=26080163
195 0.106413475 172.31.31.144 -> 172.31.23.72 TCP 66 6633 → 33642 [ACK] Seq=1 Ack=985 Win=853 Len=0 TSval=1241063 TSecr=26080163
196 0.106416304 172.31.31.144 -> 172.31.23.72 TCP 66 6633 → 33656 [ACK] Seq=727 Ack=247 Win=853 Len=0 TSval=1241063 TSecr=26080164
197 0.106417926 172.31.31.144 -> 172.31.23.72 TCP 66 6633 → 33652 [ACK] Seq=969 Ack=985 Win=853 Len=0 TSval=1241063 TSecr=26080164
198 0.106528795 172.31.31.144 -> 172.31.23.72 TCP 66 6633 → 33650 [ACK] Seq=1211 Ack=985 Win=853 Len=0 TSval=1241063 TSecr=26080163
199 0.106531063 172.31.31.144 -> 172.31.23.72 TCP 66 6633 → 33640 [ACK] Seq=1211 Ack=493 Win=853 Len=0 TSval=1241063 TSecr=26080163
200 0.141757560 172.31.23.72 -> 172.31.31.144 TCP 66 33660 → 6633 [ACK] Seq=247 Ack=1211 Win=213 Len=0 TSval=26080173 TSecr=1241062
201 0.199879946 172.31.31.144 -> 172.31.23.72 OpenFlow 187 Type: OFPT_PACKET_OUT
202 0.199904911 172.31.31.144 -> 172.31.23.72 OpenFlow 187 Type: OFPT_PACKET_OUT
203 0.199926616 172.31.31.144 -> 172.31.23.72 OpenFlow 187 Type: OFPT_PACKET_OUT
204 0.199955369 172.31.31.144 -> 172.31.23.72 OpenFlow 187 Type: OFPT_PACKET_OUT
205 0.200002699 172.31.31.144 -> 172.31.23.72 OpenFlow 187 Type: OFPT_PACKET_OUT
206 0.200063861 172.31.31.144 -> 172.31.23.72 OpenFlow 187 Type: OFPT_PACKET_OUT
207 0.200110233 172.31.31.144 -> 172.31.23.72 OpenFlow 187 Type: OFPT_PACKET_OUT
208 0.200159041 172.31.31.144 -> 172.31.23.72 OpenFlow 187 Type: OFPT_PACKET_OUT
209 0.200246942 172.31.31.144 -> 172.31.23.72 OpenFlow 187 Type: OFPT_PACKET_OUT
210 0.200293377 172.31.31.144 -> 172.31.23.72 OpenFlow 187 Type: OFPT_PACKET_OUT
211 0.200338323 172.31.31.144 -> 172.31.23.72 OpenFlow 187 Type: OFPT_PACKET_OUT
212 0.200395439 172.31.31.144 -> 172.31.23.72 OpenFlow 187 Type: OFPT_PACKET_OUT
213 0.200450097 172.31.31.144 -> 172.31.23.72 OpenFlow 187 Type: OFPT_PACKET_OUT
214 0.200503855 172.31.31.144 -> 172.31.23.72 OpenFlow 187 Type: OFPT_PACKET_OUT
215 0.200561579 172.31.31.144 -> 172.31.23.72 OpenFlow 187 Type: OFPT_PACKET_OUT
216 0.200607515 172.31.23.72 -> 172.31.31.144 TCP 66 33632 → 6633 [ACK] Seq=493 Ack=969 Win=213 Len=0 TSval=26080187 TSecr=1241086
217 0.200616160 172.31.31.144 -> 172.31.23.72 OpenFlow 187 Type: OFPT_PACKET_OUT
218 0.200675314 172.31.31.144 -> 172.31.23.72 OpenFlow 187 Type: OFPT_PACKET_OUT
219 0.200718948 172.31.31.144 -> 172.31.23.72 OpenFlow 187 Type: OFPT_PACKET_OUT
220 0.200784415 172.31.31.144 -> 172.31.23.72 OpenFlow 187 Type: OFPT_PACKET_OUT
221 0.200837544 172.31.31.144 -> 172.31.23.72 OpenFlow 187 Type: OFPT_PACKET_OUT
222 0.200886641 172.31.31.144 -> 172.31.23.72 OpenFlow 187 Type: OFPT_PACKET_OUT
223 0.200966223 172.31.31.144 -> 172.31.23.72 OpenFlow 187 Type: OFPT_PACKET_OUT
224 0.201002795 172.31.31.144 -> 172.31.23.72 OpenFlow 187 Type: OFPT_PACKET_OUT
225 0.201071485 172.31.31.144 -> 172.31.23.72 OpenFlow 187 Type: OFPT_PACKET_OUT
226 0.201114818 172.31.31.144 -> 172.31.23.72 OpenFlow 187 Type: OFPT_PACKET_OUT
227 0.201166508 172.31.31.144 -> 172.31.23.72 OpenFlow 187 Type: OFPT_PACKET_OUT
228 0.201201621 172.31.23.72 -> 172.31.31.144 TCP 66 33662 → 6633 [ACK] Seq=493 Ack=1211 Win=213 Len=0 TSval=26080187 TSecr=1241086
229 0.201247966 172.31.31.144 -> 172.31.23.72 TCP 187 6633 → 33676 [PSH, ACK] Seq=1 Ack=1 Win=853 Len=121 TSval=1241086 TSecr=26079427
230 0.201346069 172.31.31.144 -> 172.31.23.72 TCP 187 6633 → 33676 [PSH, ACK] Seq=122 Ack=1 Win=853 Len=121 TSval=1241086 TSecr=26079427
231 0.201351343 172.31.31.144 -> 172.31.23.72 TCP 187 6633 → 33676 [PSH, ACK] Seq=243 Ack=1 Win=853 Len=121 TSval=1241086 TSecr=26079427
232 0.201392330 172.31.31.144 -> 172.31.23.72 TCP 187 6633 → 33676 [PSH, ACK] Seq=364 Ack=1 Win=853 Len=121 TSval=1241086 TSecr=26079427
233 0.201453394 172.31.31.144 -> 172.31.23.72 TCP 187 6633 → 33676 [PSH, ACK] Seq=485 Ack=1 Win=853 Len=121 TSval=1241086 TSecr=26079427
234 0.201503077 172.31.31.144 -> 172.31.23.72 TCP 187 6633 → 33676 [PSH, ACK] Seq=606 Ack=1 Win=853 Len=121 TSval=1241086 TSecr=26079427
235 0.201616350 172.31.31.144 -> 172.31.23.72 TCP 187 6633 → 33674 [PSH, ACK] Seq=1 Ack=1 Win=853 Len=121 TSval=1241086 TSecr=26079422
236 0.201622126 172.31.31.144 -> 172.31.23.72 TCP 187 6633 → 33674 [PSH, ACK] Seq=122 Ack=1 Win=853 Len=121 TSval=1241086 TSecr=26079422
237 0.201653438 172.31.23.72 -> 172.31.31.144 TCP 66 33648 → 6633 [ACK] Seq=985 Ack=969 Win=213 Len=0 TSval=26080187 TSecr=1241086
238 0.201671986 172.31.31.144 -> 172.31.23.72 TCP 187 6633 → 33674 [PSH, ACK] Seq=243 Ack=1 Win=853 Len=121 TSval=1241086 TSecr=26079422
239 0.201730922 172.31.31.144 -> 172.31.23.72 TCP 187 6633 → 33674 [PSH, ACK] Seq=364 Ack=1 Win=853 Len=121 TSval=1241086 TSecr=26079422
240 0.201774042 172.31.31.144 -> 172.31.23.72 TCP 187 6633 → 33674 [PSH, ACK] Seq=485 Ack=1 Win=853 Len=121 TSval=1241086 TSecr=26079422
241 0.201830766 172.31.31.144 -> 172.31.23.72 TCP 187 6633 → 33674 [PSH, ACK] Seq=606 Ack=1 Win=853 Len=121 TSval=1241086 TSecr=26079422
242 0.201911143 172.31.31.144 -> 172.31.23.72 TCP 187 6633 → 33674 [PSH, ACK] Seq=727 Ack=1 Win=853 Len=121 TSval=1241086 TSecr=26079422
243 0.201950098 172.31.31.144 -> 172.31.23.72 TCP 187 6633 → 33674 [PSH, ACK] Seq=848 Ack=1 Win=853 Len=121 TSval=1241086 TSecr=26079422
244 0.201956461 172.31.23.72 -> 172.31.31.144 TCP 66 33676 → 6633 [ACK] Seq=1 Ack=727 Win=213 Len=0 TSval=26080188 TSecr=1241086
245 0.202025966 172.31.31.144 -> 172.31.23.72 OpenFlow 187 Type: OFPT_PACKET_OUT
246 0.202045403 172.31.23.72 -> 172.31.31.144 OpenFlow 189 Type: OFPT_PACKET_IN
247 0.202074598 172.31.31.144 -> 172.31.23.72 OpenFlow 187 Type: OFPT_PACKET_OUT
248 0.202081096 172.31.23.72 -> 172.31.31.144 OpenFlow 435 Type: OFPT_PACKET_IN
249 0.202119337 172.31.31.144 -> 172.31.23.72 OpenFlow 187 Type: OFPT_PACKET_OUT
250 0.202180734 172.31.31.144 -> 172.31.23.72 OpenFlow 187 Type: OFPT_PACKET_OUT
251 0.202233520 172.31.31.144 -> 172.31.23.72 OpenFlow 187 Type: OFPT_PACKET_OUT
252 0.202298363 172.31.31.144 -> 172.31.23.72 TCP 66 6633 → 33674 [ACK] Seq=969 Ack=124 Win=853 Len=0 TSval=1241086 TSecr=26080188
253 0.202304902 172.31.31.144 -> 172.31.23.72 OpenFlow 187 Type: OFPT_PACKET_OUT
254 0.202370118 172.31.31.144 -> 172.31.23.72 TCP 66 6633 → 33674 [ACK] Seq=969 Ack=493 Win=853 Len=0 TSval=1241087 TSecr=26080188
255 0.202374147 172.31.31.144 -> 172.31.23.72 OpenFlow 187 Type: OFPT_PACKET_OUT
256 0.202415975 172.31.31.144 -> 172.31.23.72 OpenFlow 187 Type: OFPT_PACKET_OUT
257 0.202449876 172.31.23.72 -> 172.31.31.144 OpenFlow 189 Type: OFPT_PACKET_IN
258 0.202499549 172.31.23.72 -> 172.31.31.144 OpenFlow 435 Type: OFPT_PACKET_IN
259 0.202522875 172.31.31.144 -> 172.31.23.72 OpenFlow 187 Type: OFPT_PACKET_OUT
260 0.202528528 172.31.23.72 -> 172.31.31.144 TCP 66 33630 → 6633 [ACK] Seq=247 Ack=122 Win=213 Len=0 TSval=26080188 TSecr=1241087
261 0.202574965 172.31.31.144 -> 172.31.23.72 OpenFlow 187 Type: OFPT_PACKET_OUT
262 0.202581531 172.31.23.72 -> 172.31.31.144 TCP 66 33630 → 6633 [ACK] Seq=247 Ack=243 Win=213 Len=0 TSval=26080188 TSecr=1241087
263 0.202621181 172.31.31.144 -> 172.31.23.72 OpenFlow 187 Type: OFPT_PACKET_OUT
264 0.202628867 172.31.23.72 -> 172.31.31.144 TCP 66 33630 → 6633 [ACK] Seq=247 Ack=364 Win=213 Len=0 TSval=26080188 TSecr=1241087
265 0.202669694 172.31.31.144 -> 172.31.23.72 OpenFlow 187 Type: OFPT_PACKET_OUT
266 0.202677873 172.31.23.72 -> 172.31.31.144 TCP 66 33630 → 6633 [ACK] Seq=247 Ack=485 Win=213 Len=0 TSval=26080188 TSecr=1241087
267 0.202720361 172.31.31.144 -> 172.31.23.72 OpenFlow 187 Type: OFPT_PACKET_OUT
268 0.202725744 172.31.23.72 -> 172.31.31.144 TCP 66 33630 → 6633 [ACK] Seq=247 Ack=606 Win=213 Len=0 TSval=26080188 TSecr=1241087
269 0.202762198 172.31.31.144 -> 172.31.23.72 OpenFlow 187 Type: OFPT_PACKET_OUT
270 0.202770214 172.31.23.72 -> 172.31.31.144 TCP 66 33630 → 6633 [ACK] Seq=247 Ack=727 Win=213 Len=0 TSval=26080188 TSecr=1241087
271 0.202815596 172.31.31.144 -> 172.31.23.72 OpenFlow 187 Type: OFPT_PACKET_OUT
272 0.202821568 172.31.23.72 -> 172.31.31.144 TCP 66 33670 → 6633 [ACK] Seq=493 Ack=122 Win=213 Len=0 TSval=26080188 TSecr=1241087
273 0.202880972 172.31.31.144 -> 172.31.23.72 OpenFlow 187 Type: OFPT_PACKET_OUT
274 0.202887104 172.31.23.72 -> 172.31.31.144 TCP 66 33670 → 6633 [ACK] Seq=493 Ack=243 Win=213 Len=0 TSval=26080188 TSecr=1241087
275 0.202946802 172.31.31.144 -> 172.31.23.72 TCP 66 6633 → 33672 [ACK] Seq=969 Ack=739 Win=853 Len=0 TSval=1241087 TSecr=26080188
276 0.202952590 172.31.31.144 -> 172.31.23.72 OpenFlow 187 Type: OFPT_PACKET_OUT
277 0.202955871 172.31.23.72 -> 172.31.31.144 TCP 66 33670 → 6633 [ACK] Seq=493 Ack=364 Win=213 Len=0 TSval=26080188 TSecr=1241087
278 0.203024597 172.31.31.144 -> 172.31.23.72 OpenFlow 187 Type: OFPT_PACKET_OUT
279 0.203030635 172.31.23.72 -> 172.31.31.144 TCP 66 33670 → 6633 [ACK] Seq=493 Ack=485 Win=213 Len=0 TSval=26080188 TSecr=1241087
280 0.203080178 172.31.23.72 -> 172.31.31.144 OpenFlow 189 Type: OFPT_PACKET_IN
281 0.203095371 172.31.31.144 -> 172.31.23.72 OpenFlow 187 Type: OFPT_PACKET_OUT
282 0.203101703 172.31.23.72 -> 172.31.31.144 TCP 66 33670 → 6633 [ACK] Seq=493 Ack=606 Win=213 Len=0 TSval=26080188 TSecr=1241087
283 0.203107554 172.31.23.72 -> 172.31.31.144 OpenFlow 189 Type: OFPT_PACKET_IN
284 0.203143936 172.31.31.144 -> 172.31.23.72 OpenFlow 187 Type: OFPT_PACKET_OUT
285 0.203149874 172.31.23.72 -> 172.31.31.144 TCP 66 33670 → 6633 [ACK] Seq=493 Ack=727 Win=213 Len=0 TSval=26080188 TSecr=1241087
286 0.203213619 172.31.31.144 -> 172.31.23.72 OpenFlow 187 Type: OFPT_PACKET_OUT
287 0.203219918 172.31.23.72 -> 172.31.31.144 TCP 66 33670 → 6633 [ACK] Seq=493 Ack=848 Win=213 Len=0 TSval=26080188 TSecr=1241087
288 0.203285675 172.31.31.144 -> 172.31.23.72 OpenFlow 187 Type: OFPT_PACKET_OUT
289 0.203291015 172.31.23.72 -> 172.31.31.144 TCP 66 33670 → 6633 [ACK] Seq=493 Ack=969 Win=213 Len=0 TSval=26080188 TSecr=1241087
290 0.203328350 172.31.31.144 -> 172.31.23.72 TCP 66 6633 → 33630 [ACK] Seq=727 Ack=370 Win=853 Len=0 TSval=1241087 TSecr=26080188
291 0.203395862 172.31.31.144 -> 172.31.23.72 TCP 66 6633 → 33630 [ACK] Seq=727 Ack=493 Win=853 Len=0 TSval=1241087 TSecr=26080188
292 0.203401553 172.31.31.144 -> 172.31.23.72 OpenFlow 187 Type: OFPT_PACKET_OUT
293 0.203415067 172.31.23.72 -> 172.31.31.144 OpenFlow 189 Type: OFPT_PACKET_IN
294 0.203462698 172.31.31.144 -> 172.31.23.72 OpenFlow 187 Type: OFPT_PACKET_OUT
295 0.203469693 172.31.23.72 -> 172.31.31.144 OpenFlow 189 Type: OFPT_PACKET_IN
296 0.203512638 172.31.31.144 -> 172.31.23.72 OpenFlow 187 Type: OFPT_PACKET_OUT
297 0.203566464 172.31.31.144 -> 172.31.23.72 OpenFlow 187 Type: OFPT_PACKET_OUT
298 0.203599589 172.31.31.144 -> 172.31.23.72 OpenFlow 187 Type: OFPT_PACKET_OUT
299 0.203657324 172.31.31.144 -> 172.31.23.72 OpenFlow 187 Type: OFPT_PACKET_OUT
300 0.203726326 172.31.31.144 -> 172.31.23.72 OpenFlow 187 Type: OFPT_PACKET_OUT
301 0.203778751 172.31.31.144 -> 172.31.23.72 OpenFlow 187 Type: OFPT_PACKET_OUT
302 0.203815454 172.31.23.72 -> 172.31.31.144 OpenFlow 189 Type: OFPT_PACKET_IN
303 0.203876915 172.31.31.144 -> 172.31.23.72 OpenFlow 187 Type: OFPT_PACKET_OUT
304 0.203881448 172.31.31.144 -> 172.31.23.72 TCP 66 6633 → 33670 [ACK] Seq=969 Ack=739 Win=853 Len=0 TSval=1241087 TSecr=26080188
305 0.203887968 172.31.23.72 -> 172.31.31.144 OpenFlow 435 Type: OFPT_PACKET_IN
306 0.203900659 172.31.31.144 -> 172.31.23.72 OpenFlow 187 Type: OFPT_PACKET_OUT
307 0.203977951 172.31.31.144 -> 172.31.23.72 OpenFlow 187 Type: OFPT_PACKET_OUT
308 0.204021995 172.31.31.144 -> 172.31.23.72 OpenFlow 187 Type: OFPT_PACKET_OUT
309 0.204143897 172.31.31.144 -> 172.31.23.72 TCP 66 6633 → 33664 [ACK] Seq=727 Ack=370 Win=853 Len=0 TSval=1241087 TSecr=26080188
310 0.204149325 172.31.31.144 -> 172.31.23.72 TCP 66 6633 → 33664 [ACK] Seq=727 Ack=739 Win=853 Len=0 TSval=1241087 TSecr=26080188
311 0.204151294 172.31.31.144 -> 172.31.23.72 OpenFlow 187 Type: OFPT_PACKET_OUT
312 0.204154057 172.31.31.144 -> 172.31.23.72 OpenFlow 187 Type: OFPT_PACKET_OUT
313 0.204196361 172.31.31.144 -> 172.31.23.72 OpenFlow 187 Type: OFPT_PACKET_OUT
314 0.204251401 172.31.31.144 -> 172.31.23.72 OpenFlow 187 Type: OFPT_PACKET_OUT
315 0.204306423 172.31.31.144 -> 172.31.23.72 OpenFlow 187 Type: OFPT_PACKET_OUT
316 0.204366460 172.31.31.144 -> 172.31.23.72 OpenFlow 187 Type: OFPT_PACKET_OUT
317 0.204420305 172.31.31.144 -> 172.31.23.72 OpenFlow 187 Type: OFPT_PACKET_OUT
318 0.204456972 172.31.23.72 -> 172.31.31.144 TCP 66 33658 → 6633 [ACK] Seq=739 Ack=727 Win=213 Len=0 TSval=26080188 TSecr=1241087
319 0.204478104 172.31.31.144 -> 172.31.23.72 OpenFlow 187 Type: OFPT_PACKET_OUT
320 0.204523613 172.31.31.144 -> 172.31.23.72 OpenFlow 187 Type: OFPT_PACKET_OUT
321 0.204612417 172.31.31.144 -> 172.31.23.72 OpenFlow 187 Type: OFPT_PACKET_OUT
322 0.204659852 172.31.31.144 -> 172.31.23.72 OpenFlow 187 Type: OFPT_PACKET_OUT
323 0.204666568 172.31.23.72 -> 172.31.31.144 TCP 66 33638 → 6633 [ACK] Seq=493 Ack=122 Win=213 Len=0 TSval=26080188 TSecr=1241087
324 0.204802596 172.31.31.144 -> 172.31.23.72 OpenFlow 187 Type: OFPT_PACKET_OUT
325 0.204809068 172.31.23.72 -> 172.31.31.144 TCP 66 33638 → 6633 [ACK] Seq=493 Ack=243 Win=213 Len=0 TSval=26080188 TSecr=1241087
326 0.204814518 172.31.31.144 -> 172.31.23.72 OpenFlow 187 Type: OFPT_PACKET_OUT
327 0.204816843 172.31.23.72 -> 172.31.31.144 TCP 66 33638 → 6633 [ACK] Seq=493 Ack=364 Win=213 Len=0 TSval=26080188 TSecr=1241087
328 0.204826537 172.31.31.144 -> 172.31.23.72 OpenFlow 187 Type: OFPT_PACKET_OUT
329 0.204829696 172.31.23.72 -> 172.31.31.144 TCP 66 33638 → 6633 [ACK] Seq=493 Ack=485 Win=213 Len=0 TSval=26080188 TSecr=1241087
330 0.204922175 172.31.31.144 -> 172.31.23.72 OpenFlow 187 Type: OFPT_PACKET_OUT
331 0.204928307 172.31.23.72 -> 172.31.31.144 TCP 66 33638 → 6633 [ACK] Seq=493 Ack=606 Win=213 Len=0 TSval=26080188 TSecr=1241087
332 0.204934121 172.31.31.144 -> 172.31.23.72 OpenFlow 187 Type: OFPT_PACKET_OUT
333 0.204936659 172.31.23.72 -> 172.31.31.144 TCP 66 33638 → 6633 [ACK] Seq=493 Ack=727 Win=213 Len=0 TSval=26080188 TSecr=1241087
334 0.205025194 172.31.23.72 -> 172.31.31.144 TCP 66 33642 → 6633 [ACK] Seq=985 Ack=1211 Win=213 Len=0 TSval=26080188 TSecr=1241087
335 0.205096037 172.31.23.72 -> 172.31.31.144 OpenFlow 189 Type: OFPT_PACKET_IN
336 0.205120088 172.31.23.72 -> 172.31.31.144 OpenFlow 189 Type: OFPT_PACKET_IN
337 0.205310604 172.31.31.144 -> 172.31.23.72 TCP 66 6633 → 33638 [ACK] Seq=727 Ack=616 Win=853 Len=0 TSval=1241087 TSecr=26080188
338 0.205454524 172.31.31.144 -> 172.31.23.72 TCP 66 6633 → 33638 [ACK] Seq=727 Ack=739 Win=853 Len=0 TSval=1241087 TSecr=26080188
339 0.205480150 172.31.23.72 -> 172.31.31.144 OpenFlow 189 Type: OFPT_PACKET_IN
340 0.205507044 172.31.23.72 -> 172.31.31.144 OpenFlow 435 Type: OFPT_PACKET_IN
341 0.205520582 172.31.23.72 -> 172.31.31.144 OpenFlow 189 Type: OFPT_PACKET_IN
342 0.205540136 172.31.23.72 -> 172.31.31.144 OpenFlow 189 Type: OFPT_PACKET_IN
343 0.205557452 172.31.23.72 -> 172.31.31.144 OpenFlow 189 Type: OFPT_PACKET_IN
344 0.205559819 172.31.23.72 -> 172.31.31.144 OpenFlow 435 Type: OFPT_PACKET_IN
345 0.205573044 172.31.23.72 -> 172.31.31.144 OpenFlow 189 Type: OFPT_PACKET_IN
346 0.205595339 172.31.23.72 -> 172.31.31.144 OpenFlow 189 Type: OFPT_PACKET_IN
347 0.205597651 172.31.23.72 -> 172.31.31.144 OpenFlow 189 Type: OFPT_PACKET_IN
348 0.205599900 172.31.23.72 -> 172.31.31.144 OpenFlow 189 Type: OFPT_PACKET_IN
349 0.205618394 172.31.23.72 -> 172.31.31.144 OpenFlow 189 Type: OFPT_PACKET_IN
350 0.205639554 172.31.23.72 -> 172.31.31.144 OpenFlow 189 Type: OFPT_PACKET_IN
351 0.205658695 172.31.23.72 -> 172.31.31.144 OpenFlow 189 Type: OFPT_PACKET_IN
352 0.205663982 172.31.23.72 -> 172.31.31.144 OpenFlow 681 Type: OFPT_PACKET_IN
353 0.205680866 172.31.23.72 -> 172.31.31.144 OpenFlow 189 Type: OFPT_PACKET_IN
354 0.205695142 172.31.23.72 -> 172.31.31.144 OpenFlow 189 Type: OFPT_PACKET_IN
355 0.205706279 172.31.23.72 -> 172.31.31.144 OpenFlow 189 Type: OFPT_PACKET_IN
356 0.205751310 172.31.23.72 -> 172.31.31.144 OpenFlow 189 Type: OFPT_PACKET_IN
357 0.205754422 172.31.23.72 -> 172.31.31.144 OpenFlow 681 Type: OFPT_PACKET_IN
358 0.205770008 172.31.23.72 -> 172.31.31.144 OpenFlow 189 Type: OFPT_PACKET_IN
359 0.205782739 172.31.23.72 -> 172.31.31.144 OpenFlow 189 Type: OFPT_PACKET_IN
360 0.205810391 172.31.23.72 -> 172.31.31.144 OpenFlow 189 Type: OFPT_PACKET_IN
361 0.205880585 172.31.31.144 -> 172.31.23.72 TCP 66 6633 → 33668 [ACK] Seq=969 Ack=370 Win=853 Len=0 TSval=1241087 TSecr=26080188
362 0.205886782 172.31.31.144 -> 172.31.23.72 TCP 66 6633 → 33668 [ACK] Seq=969 Ack=739 Win=853 Len=0 TSval=1241087 TSecr=26080188
363 0.205888820 172.31.31.144 -> 172.31.23.72 TCP 66 6633 → 33656 [ACK] Seq=727 Ack=370 Win=853 Len=0 TSval=1241087 TSecr=26080188
364 0.205890736 172.31.31.144 -> 172.31.23.72 TCP 66 6633 → 33656 [ACK] Seq=727 Ack=739 Win=853 Len=0 TSval=1241087 TSecr=26080188
365 0.205896300 172.31.23.72 -> 172.31.31.144 OpenFlow 927 Type: OFPT_PACKET_IN
366 0.205909953 172.31.23.72 -> 172.31.31.144 OpenFlow 435 Type: OFPT_PACKET_IN
367 0.205911996 172.31.23.72 -> 172.31.31.144 OpenFlow 435 Type: OFPT_PACKET_IN
368 0.206094235 172.31.23.72 -> 172.31.31.144 OpenFlow 435 Type: OFPT_PACKET_IN
369 0.206096545 172.31.23.72 -> 172.31.31.144 OpenFlow 189 Type: OFPT_PACKET_IN
370 0.206098197 172.31.23.72 -> 172.31.31.144 OpenFlow 681 Type: OFPT_PACKET_IN
371 0.206099835 172.31.23.72 -> 172.31.31.144 OpenFlow 435 Type: OFPT_PACKET_IN
372 0.206101579 172.31.23.72 -> 172.31.31.144 OpenFlow 189 Type: OFPT_PACKET_IN
373 0.206179516 172.31.31.144 -> 172.31.23.72 TCP 66 6633 → 33636 [ACK] Seq=969 Ack=739 Win=853 Len=0 TSval=1241087 TSecr=26080188
374 0.206182707 172.31.31.144 -> 172.31.23.72 TCP 66 6633 → 33650 [ACK] Seq=1211 Ack=1231 Win=853 Len=0 TSval=1241087 TSecr=26080188
375 0.206184817 172.31.31.144 -> 172.31.23.72 TCP 66 6633 → 33640 [ACK] Seq=1211 Ack=1231 Win=853 Len=0 TSval=1241087 TSecr=26080188
