  1 0.000000000 172.31.31.144 -> 172.31.23.72 TCP 82 6633 → 45458 [PSH, ACK] Seq=1 Ack=1 Win=853 Len=16 TSval=784019 TSecr=19353682
  2 0.000029906 172.31.31.144 -> 172.31.23.72 TCP 146 6633 → 45458 [PSH, ACK] Seq=17 Ack=1 Win=853 Len=80 TSval=784019 TSecr=19353682
  3 0.000329411 172.31.23.72 -> 172.31.31.144 OpenFlow 6178 Type: OFPT_MULTIPART_REPLY, OFPMP_TABLE
  4 0.000411531 172.31.23.72 -> 172.31.31.144 OpenFlow 642 Type: OFPT_MULTIPART_REPLY, OFPMP_PORT_STATS
  5 0.000476662 172.31.23.72 -> 172.31.31.144 OpenFlow 2010 Type: OFPT_MULTIPART_REPLY, OFPMP_FLOW
  6 0.000592722 172.31.31.144 -> 172.31.23.72 TCP 66 6633 → 45458 [ACK] Seq=97 Ack=6113 Win=853 Len=0 TSval=784019 TSecr=19354144
  7 0.000601879 172.31.31.144 -> 172.31.23.72 TCP 66 6633 → 45458 [ACK] Seq=97 Ack=6689 Win=853 Len=0 TSval=784019 TSecr=19354144
  8 0.000626043 172.31.31.144 -> 172.31.23.72 TCP 66 6633 → 45458 [ACK] Seq=97 Ack=8633 Win=853 Len=0 TSval=784019 TSecr=19354144
  9 0.026192935 172.31.31.144 -> 172.31.23.72 TCP 90 6633 → 45460 [PSH, ACK] Seq=1 Ack=1 Win=853 Len=24 TSval=784026 TSecr=19353683
 10 0.026207296 172.31.31.144 -> 172.31.23.72 TCP 138 6633 → 45460 [PSH, ACK] Seq=25 Ack=1 Win=853 Len=72 TSval=784026 TSecr=19353683
 11 0.026448248 172.31.23.72 -> 172.31.31.144 OpenFlow 530 Type: OFPT_MULTIPART_REPLY, OFPMP_PORT_STATS
 12 0.026618604 172.31.23.72 -> 172.31.31.144 OpenFlow 6178 Type: OFPT_MULTIPART_REPLY, OFPMP_TABLE
 13 0.026684425 172.31.23.72 -> 172.31.31.144 OpenFlow 2010 Type: OFPT_MULTIPART_REPLY, OFPMP_FLOW
 14 0.026866248 172.31.31.144 -> 172.31.23.72 TCP 66 6633 → 45460 [ACK] Seq=97 Ack=6577 Win=853 Len=0 TSval=784026 TSecr=19354150
 15 0.066132864 172.31.31.144 -> 172.31.23.72 TCP 66 6633 → 45460 [ACK] Seq=97 Ack=8521 Win=853 Len=0 TSval=784036 TSecr=19354150
 16 0.430019304 172.31.31.144 -> 172.31.23.72 TCP 90 6633 → 45462 [PSH, ACK] Seq=1 Ack=1 Win=853 Len=24 TSval=784126 TSecr=19353682
 17 0.430047932 172.31.31.144 -> 172.31.23.72 TCP 138 6633 → 45462 [PSH, ACK] Seq=25 Ack=1 Win=853 Len=72 TSval=784126 TSecr=19353682
 18 0.430315971 172.31.23.72 -> 172.31.31.144 OpenFlow 530 Type: OFPT_MULTIPART_REPLY, OFPMP_PORT_STATS
 19 0.430534604 172.31.23.72 -> 172.31.31.144 OpenFlow 7290 Type: OFPT_MULTIPART_REPLY, OFPMP_TABLE
 20 0.431810504 172.31.31.144 -> 172.31.23.72 TCP 66 6633 → 45462 [ACK] Seq=97 Ack=465 Win=853 Len=0 TSval=784127 TSecr=19354251
 21 0.431818858 172.31.31.144 -> 172.31.23.72 TCP 66 6633 → 45462 [ACK] Seq=97 Ack=7689 Win=853 Len=0 TSval=784127 TSecr=19354251
 22 0.450706677 172.31.31.144 -> 172.31.23.72 TCP 90 6633 → 45414 [PSH, ACK] Seq=1 Ack=1 Win=853 Len=24 TSval=784132 TSecr=19353879
 23 0.450716489 172.31.31.144 -> 172.31.23.72 TCP 106 6633 → 45414 [PSH, ACK] Seq=25 Ack=1 Win=853 Len=40 TSval=784132 TSecr=19353879
 24 0.450857554 172.31.23.72 -> 172.31.31.144 OpenFlow 82 Type: OFPT_MULTIPART_REPLY, OFPMP_GROUP
 25 0.451740235 172.31.23.72 -> 172.31.31.144 OpenFlow 98 Type: OFPT_MULTIPART_REPLY, OFPMP_METER
 26 0.453356896 172.31.31.144 -> 172.31.23.72 TCP 66 6633 → 45414 [ACK] Seq=65 Ack=49 Win=853 Len=0 TSval=784132 TSecr=19354256
 27 0.549355156 172.31.31.144 -> 172.31.23.72 TCP 90 6633 → 45416 [PSH, ACK] Seq=1 Ack=1 Win=853 Len=24 TSval=784156 TSecr=19353891
 28 0.549378525 172.31.31.144 -> 172.31.23.72 TCP 90 6633 → 45418 [PSH, ACK] Seq=1 Ack=1 Win=853 Len=24 TSval=784156 TSecr=19353899
 29 0.549392637 172.31.31.144 -> 172.31.23.72 TCP 106 6633 → 45418 [PSH, ACK] Seq=25 Ack=1 Win=853 Len=40 TSval=784156 TSecr=19353899
 30 0.549396600 172.31.31.144 -> 172.31.23.72 TCP 90 6633 → 45420 [PSH, ACK] Seq=1 Ack=1 Win=853 Len=24 TSval=784156 TSecr=19353906
 31 0.549411357 172.31.31.144 -> 172.31.23.72 TCP 106 6633 → 45416 [PSH, ACK] Seq=25 Ack=1 Win=853 Len=40 TSval=784156 TSecr=19353891
 32 0.549430330 172.31.31.144 -> 172.31.23.72 TCP 106 6633 → 45420 [PSH, ACK] Seq=25 Ack=1 Win=853 Len=40 TSval=784156 TSecr=19353906
 33 0.549568106 172.31.23.72 -> 172.31.31.144 OpenFlow 82 Type: OFPT_MULTIPART_REPLY, OFPMP_GROUP
 34 0.549598890 172.31.23.72 -> 172.31.31.144 OpenFlow 98 Type: OFPT_MULTIPART_REPLY, OFPMP_METER
 35 0.549627635 172.31.23.72 -> 172.31.31.144 OpenFlow 82 Type: OFPT_MULTIPART_REPLY, OFPMP_GROUP
 36 0.549648708 172.31.23.72 -> 172.31.31.144 OpenFlow 98 Type: OFPT_MULTIPART_REPLY, OFPMP_METER
 37 0.549689054 172.31.23.72 -> 172.31.31.144 OpenFlow 82 Type: OFPT_MULTIPART_REPLY, OFPMP_GROUP
 38 0.549709616 172.31.23.72 -> 172.31.31.144 OpenFlow 98 Type: OFPT_MULTIPART_REPLY, OFPMP_METER
 39 0.549778258 172.31.31.144 -> 172.31.23.72 TCP 66 6633 → 45420 [ACK] Seq=65 Ack=17 Win=853 Len=0 TSval=784156 TSecr=19354281
 40 0.549795846 172.31.31.144 -> 172.31.23.72 TCP 66 6633 → 45420 [ACK] Seq=65 Ack=49 Win=853 Len=0 TSval=784156 TSecr=19354281
 41 0.549884542 172.31.31.144 -> 172.31.23.72 TCP 66 6633 → 45418 [ACK] Seq=65 Ack=49 Win=853 Len=0 TSval=784156 TSecr=19354281
 42 0.549901350 172.31.31.144 -> 172.31.23.72 TCP 66 6633 → 45416 [ACK] Seq=65 Ack=49 Win=853 Len=0 TSval=784156 TSecr=19354281
 43 0.649549538 172.31.31.144 -> 172.31.23.72 TCP 90 6633 → 45422 [PSH, ACK] Seq=1 Ack=1 Win=853 Len=24 TSval=784181 TSecr=19353916
 44 0.649569270 172.31.31.144 -> 172.31.23.72 TCP 90 6633 → 45424 [PSH, ACK] Seq=1 Ack=1 Win=853 Len=24 TSval=784181 TSecr=19353926
 45 0.649585035 172.31.31.144 -> 172.31.23.72 TCP 106 6633 → 45422 [PSH, ACK] Seq=25 Ack=1 Win=853 Len=40 TSval=784181 TSecr=19353916
 46 0.649630169 172.31.31.144 -> 172.31.23.72 TCP 106 6633 → 45424 [PSH, ACK] Seq=25 Ack=1 Win=853 Len=40 TSval=784181 TSecr=19353926
 47 0.649780494 172.31.23.72 -> 172.31.31.144 OpenFlow 82 Type: OFPT_MULTIPART_REPLY, OFPMP_GROUP
 48 0.649806526 172.31.23.72 -> 172.31.31.144 OpenFlow 98 Type: OFPT_MULTIPART_REPLY, OFPMP_METER
 49 0.649910921 172.31.23.72 -> 172.31.31.144 OpenFlow 82 Type: OFPT_MULTIPART_REPLY, OFPMP_GROUP
 50 0.649934620 172.31.31.144 -> 172.31.23.72 TCP 66 6633 → 45424 [ACK] Seq=65 Ack=17 Win=853 Len=0 TSval=784181 TSecr=19354306
 51 0.649942841 172.31.23.72 -> 172.31.31.144 OpenFlow 98 Type: OFPT_MULTIPART_REPLY, OFPMP_METER
 52 0.649981486 172.31.31.144 -> 172.31.23.72 TCP 66 6633 → 45424 [ACK] Seq=65 Ack=49 Win=853 Len=0 TSval=784181 TSecr=19354306
 53 0.650069561 172.31.31.144 -> 172.31.23.72 TCP 66 6633 → 45422 [ACK] Seq=65 Ack=17 Win=853 Len=0 TSval=784182 TSecr=19354306
 54 0.650087121 172.31.31.144 -> 172.31.23.72 TCP 66 6633 → 45422 [ACK] Seq=65 Ack=49 Win=853 Len=0 TSval=784182 TSecr=19354306
 55 0.749704928 172.31.31.144 -> 172.31.23.72 TCP 90 6633 → 45426 [PSH, ACK] Seq=1 Ack=1 Win=853 Len=24 TSval=784206 TSecr=19353945
 56 0.749727180 172.31.31.144 -> 172.31.23.72 TCP 106 6633 → 45426 [PSH, ACK] Seq=25 Ack=1 Win=853 Len=40 TSval=784206 TSecr=19353945
 57 0.750011354 172.31.23.72 -> 172.31.31.144 OpenFlow 82 Type: OFPT_MULTIPART_REPLY, OFPMP_GROUP
 58 0.750038657 172.31.23.72 -> 172.31.31.144 OpenFlow 98 Type: OFPT_MULTIPART_REPLY, OFPMP_METER
 59 0.750189246 172.31.31.144 -> 172.31.23.72 TCP 66 6633 → 45426 [ACK] Seq=65 Ack=17 Win=853 Len=0 TSval=784207 TSecr=19354331
 60 0.750205806 172.31.31.144 -> 172.31.23.72 TCP 66 6633 → 45426 [ACK] Seq=65 Ack=49 Win=853 Len=0 TSval=784207 TSecr=19354331
 61 0.762608721 172.31.23.72 -> 172.31.31.144 OpenFlow 146 Type: OFPT_PORT_STATUS
 62 0.762675834 172.31.23.72 -> 172.31.31.144 OpenFlow 146 Type: OFPT_PORT_STATUS
 63 0.762822889 172.31.31.144 -> 172.31.23.72 TCP 66 6633 → 45420 [ACK] Seq=65 Ack=129 Win=853 Len=0 TSval=784210 TSecr=19354334
 64 0.786765125 172.31.31.144 -> 172.31.23.72 OpenFlow 146 Type: OFPT_FLOW_MOD
 65 0.786781169 172.31.31.144 -> 172.31.23.72 OpenFlow 146 Type: OFPT_FLOW_MOD
 66 0.786785083 172.31.31.144 -> 172.31.23.72 OpenFlow 154 Type: OFPT_BARRIER_REQUEST
 67 0.786798650 172.31.31.144 -> 172.31.23.72 OpenFlow 146 Type: OFPT_FLOW_MOD
 68 0.786803258 172.31.31.144 -> 172.31.23.72 OpenFlow 146 Type: OFPT_FLOW_MOD
 69 0.786831074 172.31.31.144 -> 172.31.23.72 OpenFlow 146 Type: OFPT_FLOW_MOD
 70 0.786850705 172.31.31.144 -> 172.31.23.72 OpenFlow 74 Type: OFPT_BARRIER_REQUEST
 71 0.786870442 172.31.31.144 -> 172.31.23.72 OpenFlow 74 Type: OFPT_BARRIER_REQUEST
 72 0.786912505 172.31.31.144 -> 172.31.23.72 OpenFlow 146 Type: OFPT_FLOW_MOD
 73 0.786940095 172.31.31.144 -> 172.31.23.72 OpenFlow 146 Type: OFPT_FLOW_MOD
 74 0.786960656 172.31.31.144 -> 172.31.23.72 OpenFlow 154 Type: OFPT_BARRIER_REQUEST
 75 0.786977639 172.31.23.72 -> 172.31.31.144 OpenFlow 74 Type: OFPT_BARRIER_REPLY
 76 0.787044633 172.31.23.72 -> 172.31.31.144 OpenFlow 74 Type: OFPT_BARRIER_REPLY
 77 0.787071548 172.31.23.72 -> 172.31.31.144 OpenFlow 74 Type: OFPT_BARRIER_REPLY
 78 0.787089210 172.31.31.144 -> 172.31.23.72 OpenFlow 146 Type: OFPT_FLOW_MOD
 79 0.787111162 172.31.31.144 -> 172.31.23.72 OpenFlow 74 Type: OFPT_BARRIER_REQUEST
 80 0.787150332 172.31.23.72 -> 172.31.31.144 TCP 66 45416 → 6633 [ACK] Seq=49 Ack=233 Win=213 Len=0 TSval=19354341 TSecr=784216
 81 0.787158674 172.31.23.72 -> 172.31.31.144 OpenFlow 74 Type: OFPT_BARRIER_REPLY
 82 0.787220488 172.31.31.144 -> 172.31.23.72 TCP 146 6633 → 45432 [PSH, ACK] Seq=1 Ack=1 Win=853 Len=80 TSval=784216 TSecr=19353979
 83 0.787225655 172.31.31.144 -> 172.31.23.72 TCP 66 6633 → 45418 [ACK] Seq=401 Ack=145 Win=853 Len=0 TSval=784216 TSecr=19354340
 84 0.787254403 172.31.31.144 -> 172.31.23.72 TCP 146 6633 → 45428 [PSH, ACK] Seq=1 Ack=1 Win=853 Len=80 TSval=784216 TSecr=19353957
 85 0.787276087 172.31.31.144 -> 172.31.23.72 TCP 154 6633 → 45428 [PSH, ACK] Seq=81 Ack=1 Win=853 Len=88 TSval=784216 TSecr=19353957
 86 0.787358842 172.31.31.144 -> 172.31.23.72 OpenFlow 146 Type: OFPT_FLOW_MOD
 87 0.787377138 172.31.31.144 -> 172.31.23.72 TCP 146 6633 → 45432 [PSH, ACK] Seq=81 Ack=1 Win=853 Len=80 TSval=784216 TSecr=19353979
 88 0.787397218 172.31.31.144 -> 172.31.23.72 OpenFlow 146 Type: OFPT_FLOW_MOD
 89 0.787417067 172.31.31.144 -> 172.31.23.72 OpenFlow 154 Type: OFPT_BARRIER_REQUEST
 90 0.787435464 172.31.23.72 -> 172.31.31.144 OpenFlow 146 Type: OFPT_FLOW_REMOVED
 91 0.787441208 172.31.31.144 -> 172.31.23.72 TCP 74 6633 → 45432 [PSH, ACK] Seq=161 Ack=1 Win=853 Len=8 TSval=784216 TSecr=19353979
 92 0.787456024 172.31.31.144 -> 172.31.23.72 OpenFlow 146 Type: OFPT_FLOW_MOD
 93 0.787460379 172.31.23.72 -> 172.31.31.144 OpenFlow 146 Type: OFPT_FLOW_REMOVED
 94 0.787470666 172.31.23.72 -> 172.31.31.144 OpenFlow 146 Type: OFPT_FLOW_REMOVED
 95 0.787481256 172.31.31.144 -> 172.31.23.72 OpenFlow 146 Type: OFPT_FLOW_MOD
 96 0.787489922 172.31.23.72 -> 172.31.31.144 OpenFlow 146 Type: OFPT_FLOW_REMOVED
 97 0.787494637 172.31.23.72 -> 172.31.31.144 OpenFlow 146 Type: OFPT_FLOW_REMOVED
 98 0.787546719 172.31.31.144 -> 172.31.23.72 OpenFlow 74 Type: OFPT_BARRIER_REQUEST
 99 0.787550364 172.31.31.144 -> 172.31.23.72 OpenFlow 154 Type: OFPT_BARRIER_REQUEST
100 0.787552367 172.31.31.144 -> 172.31.23.72 OpenFlow 146 Type: OFPT_FLOW_MOD
101 0.787558782 172.31.23.72 -> 172.31.31.144 OpenFlow 306 Type: OFPT_FLOW_REMOVED
102 0.787564498 172.31.23.72 -> 172.31.31.144 OpenFlow 146 Type: OFPT_FLOW_REMOVED
103 0.787597451 172.31.31.144 -> 172.31.23.72 TCP 146 6633 → 45428 [PSH, ACK] Seq=169 Ack=1 Win=853 Len=80 TSval=784216 TSecr=19353957
104 0.787600088 172.31.31.144 -> 172.31.23.72 OpenFlow 146 Type: OFPT_FLOW_MOD
105 0.787601901 172.31.31.144 -> 172.31.23.72 OpenFlow 154 Type: OFPT_BARRIER_REQUEST
106 0.787646608 172.31.31.144 -> 172.31.23.72 OpenFlow 146 Type: OFPT_FLOW_MOD
107 0.787649124 172.31.31.144 -> 172.31.23.72 TCP 146 6633 → 45428 [PSH, ACK] Seq=249 Ack=1 Win=853 Len=80 TSval=784216 TSecr=19353957
108 0.787650720 172.31.31.144 -> 172.31.23.72 TCP 146 6633 → 45432 [PSH, ACK] Seq=169 Ack=1 Win=853 Len=80 TSval=784216 TSecr=19353979
109 0.787680564 172.31.31.144 -> 172.31.23.72 OpenFlow 74 Type: OFPT_BARRIER_REQUEST
110 0.787712814 172.31.31.144 -> 172.31.23.72 TCP 74 6633 → 45428 [PSH, ACK] Seq=329 Ack=1 Win=853 Len=8 TSval=784216 TSecr=19353957
111 0.787732068 172.31.31.144 -> 172.31.23.72 OpenFlow 146 Type: OFPT_FLOW_MOD
112 0.787753187 172.31.31.144 -> 172.31.23.72 TCP 146 6633 → 45432 [PSH, ACK] Seq=249 Ack=1 Win=853 Len=80 TSval=784216 TSecr=19353979
113 0.787773245 172.31.31.144 -> 172.31.23.72 OpenFlow 146 Type: OFPT_FLOW_MOD
114 0.787792525 172.31.31.144 -> 172.31.23.72 OpenFlow 154 Type: OFPT_BARRIER_REQUEST
115 0.787812253 172.31.31.144 -> 172.31.23.72 OpenFlow 154 Type: OFPT_BARRIER_REQUEST
116 0.787830945 172.31.31.144 -> 172.31.23.72 TCP 66 6633 → 45416 [ACK] Seq=233 Ack=137 Win=853 Len=0 TSval=784216 TSecr=19354341
117 0.787850058 172.31.31.144 -> 172.31.23.72 TCP 66 6633 → 45420 [ACK] Seq=737 Ack=377 Win=853 Len=0 TSval=784216 TSecr=19354341
118 0.787870300 172.31.31.144 -> 172.31.23.72 TCP 74 6633 → 45432 [PSH, ACK] Seq=329 Ack=1 Win=853 Len=8 TSval=784216 TSecr=19353979
119 0.787889045 172.31.31.144 -> 172.31.23.72 OpenFlow 170 Type: OFPT_FLOW_MOD
120 0.787909346 172.31.31.144 -> 172.31.23.72 OpenFlow 146 Type: OFPT_FLOW_MOD
121 0.787928565 172.31.31.144 -> 172.31.23.72 OpenFlow 170 Type: OFPT_FLOW_MOD
122 0.787947306 172.31.31.144 -> 172.31.23.72 OpenFlow 154 Type: OFPT_BARRIER_REQUEST
123 0.787966439 172.31.31.144 -> 172.31.23.72 TCP 146 6633 → 45448 [PSH, ACK] Seq=1 Ack=1 Win=853 Len=80 TSval=784216 TSecr=19354071
124 0.787986779 172.31.31.144 -> 172.31.23.72 OpenFlow 170 Type: OFPT_FLOW_MOD
125 0.788005530 172.31.31.144 -> 172.31.23.72 OpenFlow 170 Type: OFPT_FLOW_MOD
126 0.788031219 172.31.31.144 -> 172.31.23.72 OpenFlow 74 Type: OFPT_BARRIER_REQUEST
127 0.788061833 172.31.31.144 -> 172.31.23.72 TCP 146 6633 → 45448 [PSH, ACK] Seq=81 Ack=1 Win=853 Len=80 TSval=784216 TSecr=19354071
128 0.788080839 172.31.31.144 -> 172.31.23.72 OpenFlow 74 Type: OFPT_BARRIER_REQUEST
129 0.788100635 172.31.31.144 -> 172.31.23.72 OpenFlow 146 Type: OFPT_FLOW_MOD
130 0.788120554 172.31.31.144 -> 172.31.23.72 TCP 154 6633 → 45448 [PSH, ACK] Seq=161 Ack=1 Win=853 Len=88 TSval=784216 TSecr=19354071
131 0.788147385 172.31.31.144 -> 172.31.23.72 OpenFlow 370 Type: OFPT_BARRIER_REQUEST
132 0.788169736 172.31.31.144 -> 172.31.23.72 TCP 146 6633 → 45448 [PSH, ACK] Seq=249 Ack=1 Win=853 Len=80 TSval=784216 TSecr=19354071
133 0.788190571 172.31.31.144 -> 172.31.23.72 OpenFlow 170 Type: OFPT_FLOW_MOD
134 0.788210566 172.31.31.144 -> 172.31.23.72 TCP 74 6633 → 45448 [PSH, ACK] Seq=329 Ack=1 Win=853 Len=8 TSval=784216 TSecr=19354071
135 0.788229955 172.31.31.144 -> 172.31.23.72 OpenFlow 170 Type: OFPT_FLOW_MOD
136 0.789768493 172.31.23.72 -> 172.31.31.144 OpenFlow 74 Type: OFPT_BARRIER_REPLY
137 0.789797439 172.31.23.72 -> 172.31.31.144 OpenFlow 74 Type: OFPT_BARRIER_REPLY
138 0.789824767 172.31.23.72 -> 172.31.31.144 OpenFlow 74 Type: OFPT_BARRIER_REPLY
139 0.789845630 172.31.23.72 -> 172.31.31.144 OpenFlow 74 Type: OFPT_BARRIER_REPLY
140 0.789869045 172.31.23.72 -> 172.31.31.144 OpenFlow 74 Type: OFPT_BARRIER_REPLY
141 0.789890547 172.31.23.72 -> 172.31.31.144 OpenFlow 74 Type: OFPT_BARRIER_REPLY
142 0.789928262 172.31.23.72 -> 172.31.31.144 OpenFlow 74 Type: OFPT_BARRIER_REPLY
143 0.789950365 172.31.23.72 -> 172.31.31.144 OpenFlow 74 Type: OFPT_BARRIER_REPLY
144 0.789973535 172.31.23.72 -> 172.31.31.144 OpenFlow 74 Type: OFPT_BARRIER_REPLY
145 0.789997564 172.31.31.144 -> 172.31.23.72 TCP 66 6633 → 45462 [ACK] Seq=433 Ack=7697 Win=853 Len=0 TSval=784216 TSecr=19354341
146 0.790020275 172.31.31.144 -> 172.31.23.72 TCP 66 6633 → 45462 [ACK] Seq=433 Ack=7705 Win=853 Len=0 TSval=784216 TSecr=19354341
147 0.790058806 172.31.23.72 -> 172.31.31.144 OpenFlow 74 Type: OFPT_BARRIER_REPLY
148 0.790075024 172.31.31.144 -> 172.31.23.72 TCP 66 6633 → 45420 [ACK] Seq=1057 Ack=409 Win=853 Len=0 TSval=784217 TSecr=19354341
149 0.790089890 172.31.23.72 -> 172.31.31.144 OpenFlow 74 Type: OFPT_BARRIER_REPLY
150 0.790117075 172.31.23.72 -> 172.31.31.144 TCP 66 45416 → 6633 [ACK] Seq=217 Ack=401 Win=213 Len=0 TSval=19354341 TSecr=784216
151 0.790124140 172.31.23.72 -> 172.31.31.144 OpenFlow 74 Type: OFPT_BARRIER_REPLY
152 0.790135787 172.31.31.144 -> 172.31.23.72 TCP 66 6633 → 45418 [ACK] Seq=1057 Ack=489 Win=853 Len=0 TSval=784217 TSecr=19354341
153 0.790163609 172.31.23.72 -> 172.31.31.144 OpenFlow 74 Type: OFPT_BARRIER_REPLY
154 0.790182139 172.31.23.72 -> 172.31.31.144 OpenFlow 74 Type: OFPT_BARRIER_REPLY
155 0.790208873 172.31.31.144 -> 172.31.23.72 TCP 66 6633 → 45428 [ACK] Seq=337 Ack=9 Win=853 Len=0 TSval=784217 TSecr=19354341
156 0.790217546 172.31.23.72 -> 172.31.31.144 OpenFlow 74 Type: OFPT_BARRIER_REPLY
157 0.790234259 172.31.31.144 -> 172.31.23.72 TCP 66 6633 → 45428 [ACK] Seq=337 Ack=17 Win=853 Len=0 TSval=784217 TSecr=19354341
158 0.790243871 172.31.23.72 -> 172.31.31.144 OpenFlow 74 Type: OFPT_BARRIER_REPLY
159 0.790291159 172.31.23.72 -> 172.31.31.144 OpenFlow 74 Type: OFPT_BARRIER_REPLY
160 0.790314329 172.31.23.72 -> 172.31.31.144 OpenFlow 74 Type: OFPT_BARRIER_REPLY
161 0.790349880 172.31.23.72 -> 172.31.31.144 TCP 66 45422 → 6633 [ACK] Seq=49 Ack=281 Win=213 Len=0 TSval=19354341 TSecr=784216
162 0.790357895 172.31.23.72 -> 172.31.31.144 OpenFlow 74 Type: OFPT_BARRIER_REPLY
163 0.790372014 172.31.31.144 -> 172.31.23.72 TCP 66 6633 → 45460 [ACK] Seq=433 Ack=8529 Win=853 Len=0 TSval=784217 TSecr=19354341
164 0.790422510 172.31.31.144 -> 172.31.23.72 TCP 66 6633 → 45460 [ACK] Seq=433 Ack=8537 Win=853 Len=0 TSval=784217 TSecr=19354341
165 0.790425989 172.31.31.144 -> 172.31.23.72 TCP 66 6633 → 45432 [ACK] Seq=337 Ack=17 Win=853 Len=0 TSval=784217 TSecr=19354341
166 0.790428142 172.31.31.144 -> 172.31.23.72 TCP 66 6633 → 45448 [ACK] Seq=337 Ack=9 Win=853 Len=0 TSval=784217 TSecr=19354341
167 0.790454719 172.31.31.144 -> 172.31.23.72 TCP 66 6633 → 45448 [ACK] Seq=337 Ack=17 Win=853 Len=0 TSval=784217 TSecr=19354341
168 0.790487276 172.31.31.144 -> 172.31.23.72 OpenFlow 170 Type: OFPT_FLOW_MOD
169 0.790506554 172.31.31.144 -> 172.31.23.72 TCP 66 6633 → 45422 [ACK] Seq=281 Ack=57 Win=853 Len=0 TSval=784217 TSecr=19354341
170 0.790525062 172.31.31.144 -> 172.31.23.72 OpenFlow 178 Type: OFPT_BARRIER_REQUEST
171 0.790537047 172.31.23.72 -> 172.31.31.144 OpenFlow 146 Type: OFPT_FLOW_REMOVED
172 0.790553813 172.31.23.72 -> 172.31.31.144 OpenFlow 146 Type: OFPT_FLOW_REMOVED
173 0.790561416 172.31.23.72 -> 172.31.31.144 OpenFlow 306 Type: OFPT_FLOW_REMOVED
174 0.790574634 172.31.23.72 -> 172.31.31.144 OpenFlow 146 Type: OFPT_FLOW_REMOVED
175 0.790582424 172.31.31.144 -> 172.31.23.72 OpenFlow 170 Type: OFPT_FLOW_MOD
176 0.790592383 172.31.23.72 -> 172.31.31.144 OpenFlow 146 Type: OFPT_FLOW_REMOVED
177 0.790597390 172.31.23.72 -> 172.31.31.144 OpenFlow 386 Type: OFPT_FLOW_REMOVED
178 0.790610224 172.31.23.72 -> 172.31.31.144 OpenFlow 146 Type: OFPT_FLOW_REMOVED
179 0.790617786 172.31.23.72 -> 172.31.31.144 OpenFlow 146 Type: OFPT_FLOW_REMOVED
180 0.790628571 172.31.23.72 -> 172.31.31.144 OpenFlow 146 Type: OFPT_FLOW_REMOVED
181 0.790630654 172.31.23.72 -> 172.31.31.144 OpenFlow 306 Type: OFPT_FLOW_REMOVED
182 0.790642282 172.31.23.72 -> 172.31.31.144 OpenFlow 146 Type: OFPT_FLOW_REMOVED
183 0.790653426 172.31.31.144 -> 172.31.23.72 OpenFlow 178 Type: OFPT_BARRIER_REQUEST
184 0.790655777 172.31.31.144 -> 172.31.23.72 OpenFlow 170 Type: OFPT_FLOW_MOD
185 0.790657475 172.31.31.144 -> 172.31.23.72 OpenFlow 170 Type: OFPT_FLOW_MOD
186 0.790728637 172.31.23.72 -> 172.31.31.144 OpenFlow 306 Type: OFPT_FLOW_REMOVED
187 0.790734759 172.31.23.72 -> 172.31.31.144 OpenFlow 146 Type: OFPT_FLOW_REMOVED
188 0.790736543 172.31.23.72 -> 172.31.31.144 OpenFlow 306 Type: OFPT_FLOW_REMOVED
189 0.790812905 172.31.31.144 -> 172.31.23.72 OpenFlow 178 Type: OFPT_BARRIER_REQUEST
190 0.790816468 172.31.31.144 -> 172.31.23.72 OpenFlow 178 Type: OFPT_BARRIER_REQUEST
191 0.790818095 172.31.31.144 -> 172.31.23.72 TCP 66 6633 → 45462 [ACK] Seq=433 Ack=7785 Win=853 Len=0 TSval=784217 TSecr=19354341
192 0.790820685 172.31.31.144 -> 172.31.23.72 TCP 66 6633 → 45462 [ACK] Seq=433 Ack=8025 Win=853 Len=0 TSval=784217 TSecr=19354341
193 0.790822572 172.31.31.144 -> 172.31.23.72 TCP 66 6633 → 45428 [ACK] Seq=337 Ack=97 Win=853 Len=0 TSval=784217 TSecr=19354341
194 0.790827861 172.31.23.72 -> 172.31.31.144 OpenFlow 306 Type: OFPT_FLOW_REMOVED
195 0.790833410 172.31.23.72 -> 172.31.31.144 OpenFlow 306 Type: OFPT_FLOW_REMOVED
196 0.790880423 172.31.31.144 -> 172.31.23.72 TCP 66 6633 → 45460 [ACK] Seq=433 Ack=8617 Win=853 Len=0 TSval=784217 TSecr=19354341
197 0.790883065 172.31.31.144 -> 172.31.23.72 TCP 66 6633 → 45420 [ACK] Seq=1273 Ack=809 Win=853 Len=0 TSval=784217 TSecr=19354341
198 0.790925233 172.31.31.144 -> 172.31.23.72 TCP 66 6633 → 45448 [ACK] Seq=337 Ack=97 Win=853 Len=0 TSval=784217 TSecr=19354341
199 0.790957395 172.31.31.144 -> 172.31.23.72 TCP 66 6633 → 45418 [ACK] Seq=1273 Ack=809 Win=853 Len=0 TSval=784217 TSecr=19354341
200 0.790975823 172.31.31.144 -> 172.31.23.72 TCP 66 6633 → 45428 [ACK] Seq=337 Ack=337 Win=853 Len=0 TSval=784217 TSecr=19354341
201 0.790994986 172.31.31.144 -> 172.31.23.72 TCP 66 6633 → 45460 [ACK] Seq=433 Ack=8857 Win=853 Len=0 TSval=784217 TSecr=19354341
202 0.791017326 172.31.31.144 -> 172.31.23.72 TCP 66 6633 → 45416 [ACK] Seq=617 Ack=385 Win=853 Len=0 TSval=784217 TSecr=19354341
203 0.791042982 172.31.31.144 -> 172.31.23.72 TCP 66 6633 → 45448 [ACK] Seq=337 Ack=337 Win=853 Len=0 TSval=784217 TSecr=19354341
204 0.791056145 172.31.31.144 -> 172.31.23.72 OpenFlow 170 Type: OFPT_FLOW_MOD
205 0.791086070 172.31.31.144 -> 172.31.23.72 OpenFlow 178 Type: OFPT_BARRIER_REQUEST
206 0.791103752 172.31.31.144 -> 172.31.23.72 OpenFlow 170 Type: OFPT_FLOW_MOD
207 0.791122559 172.31.31.144 -> 172.31.23.72 OpenFlow 178 Type: OFPT_BARRIER_REQUEST
208 0.791141473 172.31.31.144 -> 172.31.23.72 OpenFlow 170 Type: OFPT_FLOW_MOD
209 0.791160656 172.31.31.144 -> 172.31.23.72 OpenFlow 170 Type: OFPT_FLOW_MOD
210 0.791179277 172.31.31.144 -> 172.31.23.72 OpenFlow 170 Type: OFPT_FLOW_MOD
211 0.791198305 172.31.31.144 -> 172.31.23.72 OpenFlow 170 Type: OFPT_FLOW_MOD
212 0.791257070 172.31.31.144 -> 172.31.23.72 OpenFlow 170 Type: OFPT_FLOW_MOD
213 0.791274420 172.31.31.144 -> 172.31.23.72 OpenFlow 74 Type: OFPT_BARRIER_REQUEST
214 0.791294429 172.31.31.144 -> 172.31.23.72 OpenFlow 170 Type: OFPT_FLOW_MOD
215 0.791312705 172.31.31.144 -> 172.31.23.72 OpenFlow 170 Type: OFPT_FLOW_MOD
216 0.791332146 172.31.31.144 -> 172.31.23.72 OpenFlow 74 Type: OFPT_BARRIER_REQUEST
217 0.791351619 172.31.31.144 -> 172.31.23.72 OpenFlow 170 Type: OFPT_FLOW_MOD
218 0.791371579 172.31.31.144 -> 172.31.23.72 OpenFlow 170 Type: OFPT_FLOW_MOD
219 0.791391844 172.31.31.144 -> 172.31.23.72 TCP 170 6633 → 45430 [PSH, ACK] Seq=1 Ack=1 Win=853 Len=104 TSval=784217 TSecr=19353971
220 0.791411567 172.31.31.144 -> 172.31.23.72 OpenFlow 170 Type: OFPT_FLOW_MOD
221 0.791430731 172.31.31.144 -> 172.31.23.72 OpenFlow 178 Type: OFPT_BARRIER_REQUEST
222 0.791450192 172.31.31.144 -> 172.31.23.72 OpenFlow 170 Type: OFPT_FLOW_MOD
223 0.791469442 172.31.31.144 -> 172.31.23.72 OpenFlow 170 Type: OFPT_FLOW_MOD
224 0.791489618 172.31.31.144 -> 172.31.23.72 OpenFlow 282 Type: OFPT_BARRIER_REQUEST
225 0.791508443 172.31.31.144 -> 172.31.23.72 TCP 178 6633 → 45430 [PSH, ACK] Seq=105 Ack=1 Win=853 Len=112 TSval=784217 TSecr=19353971
226 0.791533537 172.31.31.144 -> 172.31.23.72 OpenFlow 170 Type: OFPT_FLOW_MOD
227 0.791553152 172.31.31.144 -> 172.31.23.72 OpenFlow 170 Type: OFPT_FLOW_MOD
228 0.791570077 172.31.31.144 -> 172.31.23.72 OpenFlow 170 Type: OFPT_FLOW_MOD
229 0.791590090 172.31.31.144 -> 172.31.23.72 OpenFlow 74 Type: OFPT_BARRIER_REQUEST
230 0.791608788 172.31.31.144 -> 172.31.23.72 OpenFlow 170 Type: OFPT_FLOW_MOD
231 0.791628446 172.31.31.144 -> 172.31.23.72 OpenFlow 74 Type: OFPT_BARRIER_REQUEST
232 0.791648554 172.31.31.144 -> 172.31.23.72 OpenFlow 282 Type: OFPT_FLOW_MOD
233 0.791667349 172.31.31.144 -> 172.31.23.72 OpenFlow 170 Type: OFPT_FLOW_MOD
234 0.791687708 172.31.31.144 -> 172.31.23.72 OpenFlow 282 Type: OFPT_BARRIER_REQUEST
235 0.791707562 172.31.31.144 -> 172.31.23.72 OpenFlow 170 Type: OFPT_FLOW_MOD
236 0.791726463 172.31.31.144 -> 172.31.23.72 OpenFlow 170 Type: OFPT_FLOW_MOD
237 0.791754084 172.31.31.144 -> 172.31.23.72 OpenFlow 282 Type: OFPT_FLOW_MOD
238 0.791795920 172.31.31.144 -> 172.31.23.72 OpenFlow 170 Type: OFPT_FLOW_MOD
239 0.791824110 172.31.31.144 -> 172.31.23.72 OpenFlow 378 Type: OFPT_FLOW_MOD
240 0.791850589 172.31.31.144 -> 172.31.23.72 OpenFlow 74 Type: OFPT_BARRIER_REQUEST
241 0.791870310 172.31.31.144 -> 172.31.23.72 OpenFlow 170 Type: OFPT_FLOW_MOD
242 0.791895901 172.31.31.144 -> 172.31.23.72 OpenFlow 274 Type: OFPT_FLOW_MOD
243 0.791914459 172.31.31.144 -> 172.31.23.72 OpenFlow 170 Type: OFPT_FLOW_MOD
244 0.791934700 172.31.31.144 -> 172.31.23.72 OpenFlow 74 Type: OFPT_BARRIER_REQUEST
245 0.791953633 172.31.31.144 -> 172.31.23.72 OpenFlow 170 Type: OFPT_FLOW_MOD
246 0.791981049 172.31.31.144 -> 172.31.23.72 OpenFlow 170 Type: OFPT_FLOW_MOD
247 0.792570204 172.31.23.72 -> 172.31.31.144 OpenFlow 74 Type: OFPT_BARRIER_REPLY
248 0.792602118 172.31.23.72 -> 172.31.31.144 OpenFlow 74 Type: OFPT_BARRIER_REPLY
249 0.792642924 172.31.23.72 -> 172.31.31.144 OpenFlow 74 Type: OFPT_BARRIER_REPLY
250 0.792681684 172.31.23.72 -> 172.31.31.144 TCP 66 45424 → 6633 [ACK] Seq=49 Ack=281 Win=213 Len=0 TSval=19354342 TSecr=784217
251 0.792689891 172.31.23.72 -> 172.31.31.144 OpenFlow 74 Type: OFPT_BARRIER_REPLY
252 0.792711696 172.31.23.72 -> 172.31.31.144 OpenFlow 74 Type: OFPT_BARRIER_REPLY
253 0.792763537 172.31.23.72 -> 172.31.31.144 TCP 66 45430 → 6633 [ACK] Seq=1 Ack=217 Win=213 Len=0 TSval=19354342 TSecr=784217
254 0.792768246 172.31.23.72 -> 172.31.31.144 OpenFlow 74 Type: OFPT_BARRIER_REPLY
255 0.792780910 172.31.31.144 -> 172.31.23.72 TCP 66 6633 → 45462 [ACK] Seq=1073 Ack=8041 Win=853 Len=0 TSval=784217 TSecr=19354342
256 0.792800347 172.31.23.72 -> 172.31.31.144 TCP 66 45428 → 6633 [ACK] Seq=337 Ack=553 Win=213 Len=0 TSval=19354342 TSecr=784217
257 0.792810029 172.31.23.72 -> 172.31.31.144 OpenFlow 74 Type: OFPT_BARRIER_REPLY
258 0.792815055 172.31.23.72 -> 172.31.31.144 OpenFlow 74 Type: OFPT_BARRIER_REPLY
259 0.792837667 172.31.23.72 -> 172.31.31.144 OpenFlow 74 Type: OFPT_BARRIER_REPLY
260 0.792876565 172.31.23.72 -> 172.31.31.144 OpenFlow 74 Type: OFPT_BARRIER_REPLY
261 0.792924415 172.31.23.72 -> 172.31.31.144 OpenFlow 74 Type: OFPT_BARRIER_REPLY
262 0.792960077 172.31.31.144 -> 172.31.23.72 TCP 66 6633 → 45424 [ACK] Seq=281 Ack=57 Win=853 Len=0 TSval=784217 TSecr=19354342
263 0.792964322 172.31.31.144 -> 172.31.23.72 TCP 66 6633 → 45430 [ACK] Seq=217 Ack=9 Win=853 Len=0 TSval=784217 TSecr=19354342
264 0.792968515 172.31.23.72 -> 172.31.31.144 OpenFlow 74 Type: OFPT_BARRIER_REPLY
265 0.792974341 172.31.23.72 -> 172.31.31.144 OpenFlow 74 Type: OFPT_BARRIER_REPLY
266 0.793008139 172.31.23.72 -> 172.31.31.144 OpenFlow 74 Type: OFPT_BARRIER_REPLY
267 0.793029451 172.31.23.72 -> 172.31.31.144 OpenFlow 74 Type: OFPT_BARRIER_REPLY
268 0.793047402 172.31.31.144 -> 172.31.23.72 TCP 66 6633 → 45418 [ACK] Seq=1593 Ack=825 Win=853 Len=0 TSval=784217 TSecr=19354342
269 0.793080666 172.31.23.72 -> 172.31.31.144 OpenFlow 74 Type: OFPT_BARRIER_REPLY
270 0.793154159 172.31.31.144 -> 172.31.23.72 TCP 66 6633 → 45416 [ACK] Seq=937 Ack=401 Win=853 Len=0 TSval=784217 TSecr=19354342
271 0.793167618 172.31.31.144 -> 172.31.23.72 TCP 66 6633 → 45432 [ACK] Seq=1081 Ack=353 Win=853 Len=0 TSval=784217 TSecr=19354342
272 0.793178867 172.31.23.72 -> 172.31.31.144 TCP 66 45426 → 6633 [ACK] Seq=49 Ack=281 Win=213 Len=0 TSval=19354342 TSecr=784217
273 0.793188459 172.31.23.72 -> 172.31.31.144 OpenFlow 74 Type: OFPT_BARRIER_REPLY
274 0.793196362 172.31.31.144 -> 172.31.23.72 TCP 66 6633 → 45460 [ACK] Seq=1281 Ack=8873 Win=853 Len=0 TSval=784217 TSecr=19354342
275 0.793225271 172.31.23.72 -> 172.31.31.144 TCP 66 45422 → 6633 [ACK] Seq=57 Ack=497 Win=213 Len=0 TSval=19354342 TSecr=784217
276 0.793233282 172.31.23.72 -> 172.31.31.144 OpenFlow 74 Type: OFPT_BARRIER_REPLY
277 0.793242701 172.31.31.144 -> 172.31.23.72 TCP 66 6633 → 45448 [ACK] Seq=1185 Ack=353 Win=853 Len=0 TSval=784217 TSecr=19354342
278 0.793324445 172.31.31.144 -> 172.31.23.72 TCP 66 6633 → 45426 [ACK] Seq=281 Ack=57 Win=853 Len=0 TSval=784217 TSecr=19354342
279 0.830204562 172.31.31.144 -> 172.31.23.72 TCP 66 6633 → 45428 [ACK] Seq=553 Ack=345 Win=853 Len=0 TSval=784227 TSecr=19354342
280 0.830225140 172.31.31.144 -> 172.31.23.72 TCP 66 6633 → 45422 [ACK] Seq=497 Ack=65 Win=853 Len=0 TSval=784227 TSecr=19354342
281 0.830272917 172.31.31.144 -> 172.31.23.72 TCP 66 6633 → 45420 [ACK] Seq=1377 Ack=817 Win=853 Len=0 TSval=784227 TSecr=19354342
282 0.849897913 172.31.31.144 -> 172.31.23.72 OpenFlow 90 Type: OFPT_MULTIPART_REQUEST, OFPMP_GROUP
283 0.849935584 172.31.31.144 -> 172.31.23.72 OpenFlow 90 Type: OFPT_MULTIPART_REQUEST, OFPMP_GROUP
284 0.849957822 172.31.31.144 -> 172.31.23.72 OpenFlow 90 Type: OFPT_MULTIPART_REQUEST, OFPMP_GROUP
285 0.850003507 172.31.31.144 -> 172.31.23.72 OpenFlow 106 Type: OFPT_MULTIPART_REQUEST, OFPMP_METER
286 0.850021469 172.31.31.144 -> 172.31.23.72 OpenFlow 106 Type: OFPT_MULTIPART_REQUEST, OFPMP_METER
287 0.850040758 172.31.31.144 -> 172.31.23.72 OpenFlow 106 Type: OFPT_MULTIPART_REQUEST, OFPMP_METER
288 0.850164554 172.31.23.72 -> 172.31.31.144 OpenFlow 82 Type: OFPT_MULTIPART_REPLY, OFPMP_GROUP
289 0.850185886 172.31.23.72 -> 172.31.31.144 OpenFlow 82 Type: OFPT_MULTIPART_REPLY, OFPMP_GROUP_DESC
290 0.850204857 172.31.23.72 -> 172.31.31.144 OpenFlow 82 Type: OFPT_MULTIPART_REPLY, OFPMP_GROUP
291 0.850212500 172.31.23.72 -> 172.31.31.144 OpenFlow 82 Type: OFPT_MULTIPART_REPLY, OFPMP_METER
292 0.850239209 172.31.23.72 -> 172.31.31.144 OpenFlow 82 Type: OFPT_MULTIPART_REPLY, OFPMP_GROUP
293 0.850244098 172.31.23.72 -> 172.31.31.144 OpenFlow 98 Type: OFPT_MULTIPART_REPLY, OFPMP_METER
294 0.850289160 172.31.23.72 -> 172.31.31.144 OpenFlow 98 Type: OFPT_MULTIPART_REPLY, OFPMP_METER
295 0.850362469 172.31.31.144 -> 172.31.23.72 TCP 66 6633 → 45430 [ACK] Seq=281 Ack=25 Win=853 Len=0 TSval=784232 TSecr=19354356
296 0.850385225 172.31.31.144 -> 172.31.23.72 TCP 66 6633 → 45430 [ACK] Seq=281 Ack=41 Win=853 Len=0 TSval=784232 TSecr=19354356
297 0.850416380 172.31.31.144 -> 172.31.23.72 TCP 66 6633 → 45430 [ACK] Seq=281 Ack=57 Win=853 Len=0 TSval=784232 TSecr=19354356
298 0.850442557 172.31.31.144 -> 172.31.23.72 TCP 66 6633 → 45428 [ACK] Seq=617 Ack=393 Win=853 Len=0 TSval=784232 TSecr=19354356
299 0.850510537 172.31.31.144 -> 172.31.23.72 TCP 66 6633 → 45432 [ACK] Seq=1145 Ack=401 Win=853 Len=0 TSval=784232 TSecr=19354356
300 0.950055380 172.31.31.144 -> 172.31.23.72 TCP 90 6633 → 45434 [PSH, ACK] Seq=1 Ack=1 Win=853 Len=24 TSval=784257 TSecr=19353990
301 0.950074421 172.31.31.144 -> 172.31.23.72 TCP 90 6633 → 45436 [PSH, ACK] Seq=1 Ack=1 Win=853 Len=24 TSval=784257 TSecr=19354000
302 0.950089951 172.31.31.144 -> 172.31.23.72 TCP 106 6633 → 45436 [PSH, ACK] Seq=25 Ack=1 Win=853 Len=40 TSval=784257 TSecr=19354000
303 0.950095240 172.31.31.144 -> 172.31.23.72 TCP 106 6633 → 45434 [PSH, ACK] Seq=25 Ack=1 Win=853 Len=40 TSval=784257 TSecr=19353990
304 0.950215179 172.31.23.72 -> 172.31.31.144 OpenFlow 82 Type: OFPT_MULTIPART_REPLY, OFPMP_GROUP
305 0.950241401 172.31.23.72 -> 172.31.31.144 OpenFlow 98 Type: OFPT_MULTIPART_REPLY, OFPMP_METER
306 0.950260923 172.31.23.72 -> 172.31.31.144 OpenFlow 82 Type: OFPT_MULTIPART_REPLY, OFPMP_GROUP
307 0.950292280 172.31.23.72 -> 172.31.31.144 OpenFlow 98 Type: OFPT_MULTIPART_REPLY, OFPMP_METER
308 0.950404995 172.31.31.144 -> 172.31.23.72 TCP 66 6633 → 45436 [ACK] Seq=65 Ack=17 Win=853 Len=0 TSval=784257 TSecr=19354381
309 0.950410792 172.31.31.144 -> 172.31.23.72 TCP 66 6633 → 45436 [ACK] Seq=65 Ack=49 Win=853 Len=0 TSval=784257 TSecr=19354381
310 0.950438879 172.31.31.144 -> 172.31.23.72 TCP 66 6633 → 45434 [ACK] Seq=65 Ack=17 Win=853 Len=0 TSval=784257 TSecr=19354381
311 0.950458439 172.31.31.144 -> 172.31.23.72 TCP 66 6633 → 45434 [ACK] Seq=65 Ack=49 Win=853 Len=0 TSval=784257 TSecr=19354381
312 1.049236443 172.31.31.144 -> 172.31.23.72 TCP 90 6633 → 45438 [PSH, ACK] Seq=1 Ack=1 Win=853 Len=24 TSval=784281 TSecr=19354009
313 1.049275744 172.31.31.144 -> 172.31.23.72 TCP 106 6633 → 45438 [PSH, ACK] Seq=25 Ack=1 Win=853 Len=40 TSval=784281 TSecr=19354009
314 1.049385727 172.31.31.144 -> 172.31.23.72 TCP 187 6633 → 45452 [PSH, ACK] Seq=1 Ack=1 Win=853 Len=121 TSval=784281 TSecr=19354100
315 1.049404061 172.31.31.144 -> 172.31.23.72 TCP 187 6633 → 45452 [PSH, ACK] Seq=122 Ack=1 Win=853 Len=121 TSval=784281 TSecr=19354100
316 1.049449487 172.31.31.144 -> 172.31.23.72 TCP 187 6633 → 45452 [PSH, ACK] Seq=243 Ack=1 Win=853 Len=121 TSval=784281 TSecr=19354100
317 1.049501181 172.31.31.144 -> 172.31.23.72 TCP 187 6633 → 45452 [PSH, ACK] Seq=364 Ack=1 Win=853 Len=121 TSval=784281 TSecr=19354100
318 1.049555320 172.31.31.144 -> 172.31.23.72 TCP 187 6633 → 45452 [PSH, ACK] Seq=485 Ack=1 Win=853 Len=121 TSval=784281 TSecr=19354100
319 1.049608151 172.31.31.144 -> 172.31.23.72 TCP 187 6633 → 45452 [PSH, ACK] Seq=606 Ack=1 Win=853 Len=121 TSval=784281 TSecr=19354100
320 1.049666085 172.31.31.144 -> 172.31.23.72 TCP 187 6633 → 45452 [PSH, ACK] Seq=727 Ack=1 Win=853 Len=121 TSval=784281 TSecr=19354100
321 1.049721458 172.31.31.144 -> 172.31.23.72 TCP 187 6633 → 45452 [PSH, ACK] Seq=848 Ack=1 Win=853 Len=121 TSval=784281 TSecr=19354100
322 1.049793920 172.31.31.144 -> 172.31.23.72 OpenFlow 187 Type: OFPT_PACKET_OUT
323 1.049823859 172.31.31.144 -> 172.31.23.72 OpenFlow 187 Type: OFPT_PACKET_OUT
324 1.049849062 172.31.23.72 -> 172.31.31.144 TCP 66 45452 → 6633 [ACK] Seq=1 Ack=969 Win=213 Len=0 TSval=19354406 TSecr=784281
325 1.049885729 172.31.31.144 -> 172.31.23.72 OpenFlow 187 Type: OFPT_PACKET_OUT
326 1.049932962 172.31.31.144 -> 172.31.23.72 OpenFlow 187 Type: OFPT_PACKET_OUT
327 1.049967359 172.31.31.144 -> 172.31.23.72 OpenFlow 187 Type: OFPT_PACKET_OUT
328 1.050018874 172.31.31.144 -> 172.31.23.72 OpenFlow 187 Type: OFPT_PACKET_OUT
329 1.050152751 172.31.31.144 -> 172.31.23.72 OpenFlow 187 Type: OFPT_PACKET_OUT
330 1.050179374 172.31.31.144 -> 172.31.23.72 OpenFlow 187 Type: OFPT_PACKET_OUT
331 1.050212756 172.31.23.72 -> 172.31.31.144 TCP 66 45462 → 6633 [ACK] Seq=8041 Ack=1799 Win=213 Len=0 TSval=19354406 TSecr=784281
332 1.050248596 172.31.31.144 -> 172.31.23.72 OpenFlow 187 Type: OFPT_PACKET_OUT
333 1.050294266 172.31.31.144 -> 172.31.23.72 OpenFlow 187 Type: OFPT_PACKET_OUT
334 1.050347052 172.31.31.144 -> 172.31.23.72 OpenFlow 187 Type: OFPT_PACKET_OUT
335 1.050435349 172.31.31.144 -> 172.31.23.72 OpenFlow 187 Type: OFPT_PACKET_OUT
336 1.050451305 172.31.31.144 -> 172.31.23.72 OpenFlow 187 Type: OFPT_PACKET_OUT
337 1.050579693 172.31.23.72 -> 172.31.31.144 TCP 66 45436 → 6633 [ACK] Seq=49 Ack=912 Win=213 Len=0 TSval=19354406 TSecr=784282
338 1.050658828 172.31.23.72 -> 172.31.31.144 OpenFlow 189 Type: OFPT_PACKET_IN
339 1.050689895 172.31.23.72 -> 172.31.31.144 OpenFlow 189 Type: OFPT_PACKET_IN
340 1.050703260 172.31.23.72 -> 172.31.31.144 OpenFlow 189 Type: OFPT_PACKET_IN
341 1.050736700 172.31.23.72 -> 172.31.31.144 OpenFlow 189 Type: OFPT_PACKET_IN
342 1.050751763 172.31.23.72 -> 172.31.31.144 OpenFlow 189 Type: OFPT_PACKET_IN
343 1.050783807 172.31.23.72 -> 172.31.31.144 OpenFlow 189 Type: OFPT_PACKET_IN
344 1.050823225 172.31.23.72 -> 172.31.31.144 OpenFlow 189 Type: OFPT_PACKET_IN
345 1.050838197 172.31.23.72 -> 172.31.31.144 OpenFlow 189 Type: OFPT_PACKET_IN
346 1.050852607 172.31.23.72 -> 172.31.31.144 OpenFlow 189 Type: OFPT_PACKET_IN
347 1.050909415 172.31.31.144 -> 172.31.23.72 OpenFlow 187 Type: OFPT_PACKET_OUT
348 1.051055736 172.31.23.72 -> 172.31.31.144 OpenFlow 189 Type: OFPT_PACKET_IN
349 1.051062893 172.31.23.72 -> 172.31.31.144 OpenFlow 483 Type: OFPT_MULTIPART_REPLY, OFPMP_METER
350 1.051064694 172.31.23.72 -> 172.31.31.144 OpenFlow 189 Type: OFPT_PACKET_IN
351 1.051066489 172.31.23.72 -> 172.31.31.144 OpenFlow 189 Type: OFPT_PACKET_IN
352 1.051069056 172.31.23.72 -> 172.31.31.144 OpenFlow 189 Type: OFPT_PACKET_IN
353 1.051070597 172.31.23.72 -> 172.31.31.144 OpenFlow 189 Type: OFPT_PACKET_IN
354 1.051120692 172.31.23.72 -> 172.31.31.144 OpenFlow 189 Type: OFPT_PACKET_IN
355 1.051123746 172.31.23.72 -> 172.31.31.144 OpenFlow 189 Type: OFPT_PACKET_IN
356 1.051125783 172.31.23.72 -> 172.31.31.144 OpenFlow 189 Type: OFPT_PACKET_IN
357 1.051132956 172.31.31.144 -> 172.31.23.72 TCP 66 6633 → 45434 [ACK] Seq=65 Ack=172 Win=853 Len=0 TSval=784282 TSecr=19354406
358 1.051139263 172.31.31.144 -> 172.31.23.72 TCP 66 6633 → 45438 [ACK] Seq=65 Ack=124 Win=853 Len=0 TSval=784282 TSecr=19354406
359 1.051347431 172.31.31.144 -> 172.31.23.72 TCP 66 6633 → 45450 [ACK] Seq=1 Ack=124 Win=853 Len=0 TSval=784282 TSecr=19354406
360 1.051353867 172.31.31.144 -> 172.31.23.72 TCP 66 6633 → 45430 [ACK] Seq=281 Ack=180 Win=853 Len=0 TSval=784282 TSecr=19354406
361 1.051356276 172.31.31.144 -> 172.31.23.72 TCP 66 6633 → 45454 [ACK] Seq=1 Ack=124 Win=853 Len=0 TSval=784282 TSecr=19354406
362 1.051359245 172.31.31.144 -> 172.31.23.72 TCP 66 6633 → 45442 [ACK] Seq=1 Ack=124 Win=853 Len=0 TSval=784282 TSecr=19354406
363 1.051361389 172.31.31.144 -> 172.31.23.72 TCP 66 6633 → 45434 [ACK] Seq=65 Ack=295 Win=853 Len=0 TSval=784282 TSecr=19354407
364 1.051363857 172.31.31.144 -> 172.31.23.72 TCP 66 6633 → 45438 [ACK] Seq=65 Ack=541 Win=853 Len=0 TSval=784282 TSecr=19354407
365 1.051365660 172.31.31.144 -> 172.31.23.72 TCP 66 6633 → 45450 [ACK] Seq=1 Ack=247 Win=853 Len=0 TSval=784282 TSecr=19354407
366 1.051385744 172.31.31.144 -> 172.31.23.72 TCP 66 6633 → 45454 [ACK] Seq=1 Ack=247 Win=853 Len=0 TSval=784282 TSecr=19354407
367 1.051424183 172.31.31.144 -> 172.31.23.72 TCP 66 6633 → 45442 [ACK] Seq=1 Ack=247 Win=853 Len=0 TSval=784282 TSecr=19354407
368 1.051481408 172.31.31.144 -> 172.31.23.72 TCP 66 6633 → 45444 [ACK] Seq=1 Ack=247 Win=853 Len=0 TSval=784282 TSecr=19354406
369 1.051511314 172.31.31.144 -> 172.31.23.72 TCP 66 6633 → 45432 [ACK] Seq=1145 Ack=647 Win=853 Len=0 TSval=784282 TSecr=19354406
370 1.053148089 172.31.31.144 -> 172.31.23.72 TCP 66 6633 → 45430 [ACK] Seq=281 Ack=303 Win=853 Len=0 TSval=784282 TSecr=19354407
371 1.053480744 172.31.31.144 -> 172.31.23.72 TCP 66 6633 → 45448 [ACK] Seq=1185 Ack=599 Win=853 Len=0 TSval=784282 TSecr=19354406
372 1.087085632 172.31.23.72 -> 172.31.31.144 TCP 66 45436 → 6633 [ACK] Seq=49 Ack=1033 Win=213 Len=0 TSval=19354416 TSecr=784282
373 1.149825834 172.31.31.144 -> 172.31.23.72 OpenFlow 90 Type: OFPT_MULTIPART_REQUEST, OFPMP_GROUP
374 1.149852215 172.31.31.144 -> 172.31.23.72 OpenFlow 90 Type: OFPT_MULTIPART_REQUEST, OFPMP_GROUP
375 1.149855869 172.31.31.144 -> 172.31.23.72 OpenFlow 106 Type: OFPT_MULTIPART_REQUEST, OFPMP_METER
376 1.149861074 172.31.31.144 -> 172.31.23.72 OpenFlow 106 Type: OFPT_MULTIPART_REQUEST, OFPMP_METER
377 1.149899015 172.31.31.144 -> 172.31.23.72 OpenFlow 187 Type: OFPT_PACKET_OUT
378 1.149955304 172.31.31.144 -> 172.31.23.72 OpenFlow 187 Type: OFPT_PACKET_OUT
379 1.150012875 172.31.31.144 -> 172.31.23.72 OpenFlow 187 Type: OFPT_PACKET_OUT
380 1.150140922 172.31.31.144 -> 172.31.23.72 OpenFlow 187 Type: OFPT_PACKET_OUT
381 1.150147300 172.31.23.72 -> 172.31.31.144 TCP 66 45420 → 6633 [ACK] Seq=817 Ack=1740 Win=213 Len=0 TSval=19354431 TSecr=784306
382 1.150217715 172.31.31.144 -> 172.31.23.72 OpenFlow 187 Type: OFPT_PACKET_OUT
383 1.150291905 172.31.31.144 -> 172.31.23.72 OpenFlow 187 Type: OFPT_PACKET_OUT
384 1.150354033 172.31.31.144 -> 172.31.23.72 OpenFlow 187 Type: OFPT_PACKET_OUT
385 1.150405389 172.31.23.72 -> 172.31.31.144 TCP 66 45420 → 6633 [ACK] Seq=817 Ack=2103 Win=213 Len=0 TSval=19354431 TSecr=784307
386 1.150420576 172.31.31.144 -> 172.31.23.72 OpenFlow 187 Type: OFPT_PACKET_OUT
387 1.150486105 172.31.31.144 -> 172.31.23.72 OpenFlow 187 Type: OFPT_PACKET_OUT
388 1.150531599 172.31.31.144 -> 172.31.23.72 OpenFlow 187 Type: OFPT_PACKET_OUT
389 1.150595838 172.31.31.144 -> 172.31.23.72 OpenFlow 187 Type: OFPT_PACKET_OUT
390 1.150628124 172.31.31.144 -> 172.31.23.72 OpenFlow 187 Type: OFPT_PACKET_OUT
391 1.150697468 172.31.31.144 -> 172.31.23.72 OpenFlow 187 Type: OFPT_PACKET_OUT
392 1.150767261 172.31.31.144 -> 172.31.23.72 OpenFlow 187 Type: OFPT_PACKET_OUT
393 1.150843613 172.31.31.144 -> 172.31.23.72 OpenFlow 187 Type: OFPT_PACKET_OUT
394 1.150898467 172.31.31.144 -> 172.31.23.72 OpenFlow 187 Type: OFPT_PACKET_OUT
395 1.150991799 172.31.23.72 -> 172.31.31.144 TCP 66 45424 → 6633 [ACK] Seq=57 Ack=1491 Win=213 Len=0 TSval=19354431 TSecr=784307
396 1.151101057 172.31.23.72 -> 172.31.31.144 OpenFlow 82 Type: OFPT_MULTIPART_REPLY, OFPMP_GROUP
397 1.151139811 172.31.23.72 -> 172.31.31.144 OpenFlow 189 Type: OFPT_PACKET_IN
398 1.151155977 172.31.23.72 -> 172.31.31.144 OpenFlow 189 Type: OFPT_PACKET_IN
399 1.151171218 172.31.23.72 -> 172.31.31.144 OpenFlow 189 Type: OFPT_PACKET_IN
400 1.151221722 172.31.31.144 -> 172.31.23.72 OpenFlow 187 Type: OFPT_PACKET_OUT
401 1.151226240 172.31.31.144 -> 172.31.23.72 OpenFlow 187 Type: OFPT_PACKET_OUT
402 1.151228581 172.31.31.144 -> 172.31.23.72 OpenFlow 187 Type: OFPT_PACKET_OUT
403 1.151230275 172.31.31.144 -> 172.31.23.72 OpenFlow 187 Type: OFPT_PACKET_OUT
404 1.151231776 172.31.31.144 -> 172.31.23.72 OpenFlow 187 Type: OFPT_PACKET_OUT
405 1.151235886 172.31.23.72 -> 172.31.31.144 OpenFlow 189 Type: OFPT_PACKET_IN
406 1.151268143 172.31.23.72 -> 172.31.31.144 OpenFlow 82 Type: OFPT_MULTIPART_REPLY, OFPMP_GROUP
407 1.151293406 172.31.23.72 -> 172.31.31.144 OpenFlow 189 Type: OFPT_PACKET_IN
408 1.151307626 172.31.23.72 -> 172.31.31.144 OpenFlow 189 Type: OFPT_PACKET_IN
409 1.151428095 172.31.23.72 -> 172.31.31.144 OpenFlow 189 Type: OFPT_PACKET_IN
410 1.151431974 172.31.23.72 -> 172.31.31.144 OpenFlow 98 Type: OFPT_MULTIPART_REPLY, OFPMP_METER
411 1.151434251 172.31.23.72 -> 172.31.31.144 OpenFlow 189 Type: OFPT_PACKET_IN
412 1.151570221 172.31.31.144 -> 172.31.23.72 OpenFlow 187 Type: OFPT_PACKET_OUT
413 1.151578276 172.31.23.72 -> 172.31.31.144 OpenFlow 189 Type: OFPT_PACKET_IN
414 1.151585032 172.31.31.144 -> 172.31.23.72 OpenFlow 187 Type: OFPT_PACKET_OUT
415 1.151587719 172.31.31.144 -> 172.31.23.72 OpenFlow 187 Type: OFPT_PACKET_OUT
416 1.151589616 172.31.31.144 -> 172.31.23.72 OpenFlow 187 Type: OFPT_PACKET_OUT
417 1.151592035 172.31.31.144 -> 172.31.23.72 OpenFlow 187 Type: OFPT_PACKET_OUT
418 1.151597221 172.31.23.72 -> 172.31.31.144 OpenFlow 98 Type: OFPT_MULTIPART_REPLY, OFPMP_METER
419 1.151599304 172.31.23.72 -> 172.31.31.144 OpenFlow 189 Type: OFPT_PACKET_IN
420 1.151601145 172.31.23.72 -> 172.31.31.144 OpenFlow 189 Type: OFPT_PACKET_IN
421 1.151602776 172.31.23.72 -> 172.31.31.144 OpenFlow 189 Type: OFPT_PACKET_IN
422 1.151604753 172.31.23.72 -> 172.31.31.144 OpenFlow 189 Type: OFPT_PACKET_IN
423 1.151731747 172.31.31.144 -> 172.31.23.72 TCP 66 6633 → 45428 [ACK] Seq=617 Ack=516 Win=853 Len=0 TSval=784307 TSecr=19354432
424 1.151739273 172.31.31.144 -> 172.31.23.72 OpenFlow 187 Type: OFPT_PACKET_OUT
425 1.151742391 172.31.31.144 -> 172.31.23.72 OpenFlow 187 Type: OFPT_PACKET_OUT
426 1.151744079 172.31.31.144 -> 172.31.23.72 TCP 66 6633 → 45430 [ACK] Seq=281 Ack=426 Win=853 Len=0 TSval=784307 TSecr=19354432
427 1.151746657 172.31.31.144 -> 172.31.23.72 OpenFlow 187 Type: OFPT_PACKET_OUT
428 1.151752200 172.31.23.72 -> 172.31.31.144 OpenFlow 189 Type: OFPT_PACKET_IN
429 1.151911089 172.31.23.72 -> 172.31.31.144 TCP 66 45434 → 6633 [ACK] Seq=541 Ack=1275 Win=213 Len=0 TSval=19354432 TSecr=784307
430 1.151951821 172.31.31.144 -> 172.31.23.72 TCP 66 6633 → 45442 [ACK] Seq=65 Ack=263 Win=853 Len=0 TSval=784307 TSecr=19354432
431 1.151957220 172.31.31.144 -> 172.31.23.72 OpenFlow 187 Type: OFPT_PACKET_OUT
432 1.151959453 172.31.31.144 -> 172.31.23.72 TCP 66 6633 → 45426 [ACK] Seq=281 Ack=180 Win=853 Len=0 TSval=784307 TSecr=19354432
433 1.151961466 172.31.31.144 -> 172.31.23.72 TCP 66 6633 → 45422 [ACK] Seq=497 Ack=188 Win=853 Len=0 TSval=784307 TSecr=19354432
434 1.151963544 172.31.31.144 -> 172.31.23.72 TCP 66 6633 → 45444 [ACK] Seq=65 Ack=295 Win=853 Len=0 TSval=784307 TSecr=19354432
435 1.151966057 172.31.31.144 -> 172.31.23.72 TCP 66 6633 → 45434 [ACK] Seq=1275 Ack=418 Win=853 Len=0 TSval=784307 TSecr=19354432
436 1.151967963 172.31.31.144 -> 172.31.23.72 OpenFlow 187 Type: OFPT_PACKET_OUT
437 1.151969505 172.31.31.144 -> 172.31.23.72 OpenFlow 187 Type: OFPT_PACKET_OUT
438 1.152009387 172.31.23.72 -> 172.31.31.144 OpenFlow 189 Type: OFPT_PACKET_IN
439 1.152016878 172.31.31.144 -> 172.31.23.72 TCP 66 6633 → 45442 [ACK] Seq=65 Ack=295 Win=853 Len=0 TSval=784307 TSecr=19354432
440 1.152020478 172.31.31.144 -> 172.31.23.72 TCP 66 6633 → 45428 [ACK] Seq=617 Ack=639 Win=853 Len=0 TSval=784307 TSecr=19354432
441 1.152030368 172.31.31.144 -> 172.31.23.72 TCP 66 6633 → 45416 [ACK] Seq=937 Ack=647 Win=853 Len=0 TSval=784307 TSecr=19354432
442 1.152037689 172.31.23.72 -> 172.31.31.144 OpenFlow 189 Type: OFPT_PACKET_IN
443 1.152068072 172.31.31.144 -> 172.31.23.72 TCP 66 6633 → 45426 [ACK] Seq=281 Ack=303 Win=853 Len=0 TSval=784307 TSecr=19354432
444 1.152090494 172.31.31.144 -> 172.31.23.72 TCP 66 6633 → 45422 [ACK] Seq=497 Ack=311 Win=853 Len=0 TSval=784307 TSecr=19354432
445 1.152145053 172.31.31.144 -> 172.31.23.72 OpenFlow 187 Type: OFPT_PACKET_OUT
446 1.152149633 172.31.31.144 -> 172.31.23.72 TCP 66 6633 → 45434 [ACK] Seq=1275 Ack=541 Win=853 Len=0 TSval=784307 TSecr=19354432
447 1.152192573 172.31.31.144 -> 172.31.23.72 TCP 66 6633 → 45424 [ACK] Seq=1491 Ack=180 Win=853 Len=0 TSval=784307 TSecr=19354432
448 1.152239300 172.31.31.144 -> 172.31.23.72 TCP 66 6633 → 45424 [ACK] Seq=1491 Ack=303 Win=853 Len=0 TSval=784307 TSecr=19354432
449 1.152272305 172.31.31.144 -> 172.31.23.72 TCP 66 6633 → 45414 [ACK] Seq=65 Ack=295 Win=853 Len=0 TSval=784307 TSecr=19354432
450 1.152278176 172.31.31.144 -> 172.31.23.72 TCP 66 6633 → 45430 [ACK] Seq=281 Ack=549 Win=853 Len=0 TSval=784307 TSecr=19354432
451 1.152310613 172.31.31.144 -> 172.31.23.72 OpenFlow 187 Type: OFPT_PACKET_OUT
452 1.152390969 172.31.23.72 -> 172.31.31.144 TCP 66 45418 → 6633 [ACK] Seq=825 Ack=2561 Win=213 Len=0 TSval=19354432 TSecr=784307
453 1.152401629 172.31.31.144 -> 172.31.23.72 OpenFlow 187 Type: OFPT_PACKET_OUT
454 1.152475675 172.31.31.144 -> 172.31.23.72 OpenFlow 187 Type: OFPT_PACKET_OUT
455 1.152522010 172.31.23.72 -> 172.31.31.144 TCP 66 45444 → 6633 [ACK] Seq=295 Ack=307 Win=213 Len=0 TSval=19354432 TSecr=784307
456 1.152593416 172.31.23.72 -> 172.31.31.144 OpenFlow 189 Type: OFPT_PACKET_IN
457 1.152612782 172.31.23.72 -> 172.31.31.144 OpenFlow 189 Type: OFPT_PACKET_IN
458 1.152628936 172.31.23.72 -> 172.31.31.144 OpenFlow 189 Type: OFPT_PACKET_IN
459 1.152634601 172.31.23.72 -> 172.31.31.144 OpenFlow 189 Type: OFPT_PACKET_IN
460 1.152677952 172.31.23.72 -> 172.31.31.144 OpenFlow 189 Type: OFPT_PACKET_IN
461 1.152680040 172.31.23.72 -> 172.31.31.144 OpenFlow 189 Type: OFPT_PACKET_IN
462 1.152694403 172.31.23.72 -> 172.31.31.144 OpenFlow 189 Type: OFPT_PACKET_IN
463 1.152705338 172.31.23.72 -> 172.31.31.144 OpenFlow 189 Type: OFPT_PACKET_IN
464 1.152711169 172.31.31.144 -> 172.31.23.72 OpenFlow 187 Type: OFPT_PACKET_OUT
465 1.152804966 172.31.23.72 -> 172.31.31.144 OpenFlow 189 Type: OFPT_PACKET_IN
466 1.152812731 172.31.23.72 -> 172.31.31.144 OpenFlow 189 Type: OFPT_PACKET_IN
467 1.152814934 172.31.23.72 -> 172.31.31.144 OpenFlow 435 Type: OFPT_PACKET_IN
468 1.152940515 172.31.23.72 -> 172.31.31.144 OpenFlow 189 Type: OFPT_PACKET_IN
469 1.152944247 172.31.23.72 -> 172.31.31.144 OpenFlow 189 Type: OFPT_PACKET_IN
470 1.152946309 172.31.23.72 -> 172.31.31.144 OpenFlow 189 Type: OFPT_PACKET_IN
471 1.152990668 172.31.31.144 -> 172.31.23.72 OpenFlow 187 Type: OFPT_PACKET_OUT
472 1.152994176 172.31.31.144 -> 172.31.23.72 TCP 66 6633 → 45450 [ACK] Seq=1 Ack=370 Win=853 Len=0 TSval=784307 TSecr=19354432
473 1.152997491 172.31.31.144 -> 172.31.23.72 OpenFlow 187 Type: OFPT_PACKET_OUT
474 1.152999209 172.31.31.144 -> 172.31.23.72 TCP 66 6633 → 45430 [ACK] Seq=281 Ack=672 Win=853 Len=0 TSval=784307 TSecr=19354432
475 1.153001133 172.31.31.144 -> 172.31.23.72 OpenFlow 187 Type: OFPT_PACKET_OUT
476 1.153002794 172.31.31.144 -> 172.31.23.72 TCP 66 6633 → 45450 [ACK] Seq=1 Ack=493 Win=853 Len=0 TSval=784307 TSecr=19354432
477 1.153112357 172.31.23.72 -> 172.31.31.144 OpenFlow 189 Type: OFPT_PACKET_IN
478 1.153248285 172.31.31.144 -> 172.31.23.72 TCP 66 6633 → 45442 [ACK] Seq=65 Ack=418 Win=853 Len=0 TSval=784307 TSecr=19354432
479 1.153254405 172.31.31.144 -> 172.31.23.72 OpenFlow 187 Type: OFPT_PACKET_OUT
480 1.153256992 172.31.31.144 -> 172.31.23.72 TCP 66 6633 → 45426 [ACK] Seq=281 Ack=426 Win=853 Len=0 TSval=784307 TSecr=19354432
481 1.153258931 172.31.31.144 -> 172.31.23.72 TCP 66 6633 → 45430 [ACK] Seq=281 Ack=795 Win=853 Len=0 TSval=784307 TSecr=19354432
482 1.153261209 172.31.31.144 -> 172.31.23.72 TCP 66 6633 → 45422 [ACK] Seq=497 Ack=434 Win=853 Len=0 TSval=784307 TSecr=19354432
483 1.153263037 172.31.31.144 -> 172.31.23.72 TCP 66 6633 → 45436 [ACK] Seq=1033 Ack=172 Win=853 Len=0 TSval=784307 TSecr=19354432
484 1.153264952 172.31.31.144 -> 172.31.23.72 OpenFlow 187 Type: OFPT_PACKET_OUT
485 1.153266538 172.31.31.144 -> 172.31.23.72 TCP 66 6633 → 45416 [ACK] Seq=937 Ack=893 Win=853 Len=0 TSval=784307 TSecr=19354432
486 1.153286869 172.31.31.144 -> 172.31.23.72 TCP 66 6633 → 45446 [ACK] Seq=1 Ack=124 Win=853 Len=0 TSval=784307 TSecr=19354432
487 1.153291484 172.31.31.144 -> 172.31.23.72 TCP 66 6633 → 45442 [ACK] Seq=65 Ack=787 Win=853 Len=0 TSval=784307 TSecr=19354432
488 1.153293549 172.31.31.144 -> 172.31.23.72 OpenFlow 187 Type: OFPT_PACKET_OUT
489 1.153297219 172.31.31.144 -> 172.31.23.72 TCP 66 6633 → 45426 [ACK] Seq=281 Ack=549 Win=853 Len=0 TSval=784307 TSecr=19354432
490 1.153317619 172.31.31.144 -> 172.31.23.72 TCP 66 6633 → 45422 [ACK] Seq=497 Ack=557 Win=853 Len=0 TSval=784307 TSecr=19354432
491 1.153428389 172.31.23.72 -> 172.31.31.144 TCP 66 45444 → 6633 [ACK] Seq=295 Ack=1154 Win=213 Len=0 TSval=19354432 TSecr=784307
492 1.153439141 172.31.31.144 -> 172.31.23.72 TCP 66 6633 → 45436 [ACK] Seq=1033 Ack=295 Win=853 Len=0 TSval=784307 TSecr=19354432
493 1.153496496 172.31.31.144 -> 172.31.23.72 OpenFlow 187 Type: OFPT_PACKET_OUT
494 1.153537280 172.31.23.72 -> 172.31.31.144 OpenFlow 189 Type: OFPT_PACKET_IN
495 1.153570203 172.31.23.72 -> 172.31.31.144 OpenFlow 189 Type: OFPT_PACKET_IN
496 1.153588992 172.31.23.72 -> 172.31.31.144 OpenFlow 189 Type: OFPT_PACKET_IN
497 1.153622317 172.31.23.72 -> 172.31.31.144 OpenFlow 189 Type: OFPT_PACKET_IN
498 1.153713299 172.31.23.72 -> 172.31.31.144 OpenFlow 189 Type: OFPT_PACKET_IN
499 1.153730719 172.31.31.144 -> 172.31.23.72 TCP 66 6633 → 45446 [ACK] Seq=1 Ack=247 Win=853 Len=0 TSval=784307 TSecr=19354432
500 1.153766844 172.31.23.72 -> 172.31.31.144 OpenFlow 189 Type: OFPT_PACKET_IN
501 1.153799178 172.31.31.144 -> 172.31.23.72 TCP 66 6633 → 45454 [ACK] Seq=1 Ack=370 Win=853 Len=0 TSval=784307 TSecr=19354432
502 1.153802961 172.31.31.144 -> 172.31.23.72 OpenFlow 187 Type: OFPT_PACKET_OUT
503 1.153844270 172.31.31.144 -> 172.31.23.72 OpenFlow 187 Type: OFPT_PACKET_OUT
504 1.153848512 172.31.31.144 -> 172.31.23.72 TCP 66 6633 → 45454 [ACK] Seq=1 Ack=493 Win=853 Len=0 TSval=784307 TSecr=19354432
505 1.153932687 172.31.31.144 -> 172.31.23.72 TCP 66 6633 → 45436 [ACK] Seq=1033 Ack=418 Win=853 Len=0 TSval=784307 TSecr=19354432
506 1.153952503 172.31.23.72 -> 172.31.31.144 TCP 66 45438 → 6633 [ACK] Seq=541 Ack=307 Win=213 Len=0 TSval=19354432 TSecr=784307
507 1.153986238 172.31.31.144 -> 172.31.23.72 OpenFlow 187 Type: OFPT_PACKET_OUT
508 1.154081296 172.31.31.144 -> 172.31.23.72 OpenFlow 187 Type: OFPT_PACKET_OUT
509 1.154120348 172.31.23.72 -> 172.31.31.144 OpenFlow 189 Type: OFPT_PACKET_IN
510 1.154185240 172.31.31.144 -> 172.31.23.72 OpenFlow 187 Type: OFPT_PACKET_OUT
511 1.154234543 172.31.31.144 -> 172.31.23.72 OpenFlow 187 Type: OFPT_PACKET_OUT
512 1.154252285 172.31.23.72 -> 172.31.31.144 OpenFlow 189 Type: OFPT_PACKET_IN
513 1.154268009 172.31.23.72 -> 172.31.31.144 OpenFlow 189 Type: OFPT_PACKET_IN
514 1.154304482 172.31.23.72 -> 172.31.31.144 OpenFlow 189 Type: OFPT_PACKET_IN
515 1.154328745 172.31.31.144 -> 172.31.23.72 TCP 66 6633 → 45436 [ACK] Seq=1033 Ack=541 Win=853 Len=0 TSval=784308 TSecr=19354432
516 1.154333451 172.31.31.144 -> 172.31.23.72 TCP 66 6633 → 45456 [ACK] Seq=1 Ack=247 Win=853 Len=0 TSval=784308 TSecr=19354432
517 1.154390926 172.31.31.144 -> 172.31.23.72 OpenFlow 187 Type: OFPT_PACKET_OUT
518 1.154438306 172.31.31.144 -> 172.31.23.72 OpenFlow 187 Type: OFPT_PACKET_OUT
519 1.154529362 172.31.23.72 -> 172.31.31.144 TCP 66 45438 → 6633 [ACK] Seq=541 Ack=1033 Win=213 Len=0 TSval=19354432 TSecr=784307
520 1.154543872 172.31.31.144 -> 172.31.23.72 OpenFlow 187 Type: OFPT_PACKET_OUT
521 1.154624064 172.31.31.144 -> 172.31.23.72 TCP 66 6633 → 45436 [ACK] Seq=1033 Ack=787 Win=853 Len=0 TSval=784308 TSecr=19354432
522 1.154630842 172.31.31.144 -> 172.31.23.72 OpenFlow 187 Type: OFPT_PACKET_OUT
523 1.154664980 172.31.23.72 -> 172.31.31.144 TCP 66 45450 → 6633 [ACK] Seq=493 Ack=243 Win=213 Len=0 TSval=19354432 TSecr=784308
524 1.154731990 172.31.31.144 -> 172.31.23.72 OpenFlow 187 Type: OFPT_PACKET_OUT
525 1.154757011 172.31.23.72 -> 172.31.31.144 OpenFlow 189 Type: OFPT_PACKET_IN
526 1.154775311 172.31.23.72 -> 172.31.31.144 OpenFlow 189 Type: OFPT_PACKET_IN
527 1.154824141 172.31.23.72 -> 172.31.31.144 OpenFlow 189 Type: OFPT_PACKET_IN
528 1.154829060 172.31.23.72 -> 172.31.31.144 OpenFlow 189 Type: OFPT_PACKET_IN
529 1.154849753 172.31.31.144 -> 172.31.23.72 OpenFlow 187 Type: OFPT_PACKET_OUT
530 1.154901750 172.31.31.144 -> 172.31.23.72 OpenFlow 187 Type: OFPT_PACKET_OUT
531 1.154918907 172.31.23.72 -> 172.31.31.144 OpenFlow 189 Type: OFPT_PACKET_IN
532 1.154939755 172.31.23.72 -> 172.31.31.144 OpenFlow 189 Type: OFPT_PACKET_IN
533 1.154948185 172.31.31.144 -> 172.31.23.72 TCP 66 6633 → 45446 [ACK] Seq=1 Ack=370 Win=853 Len=0 TSval=784308 TSecr=19354432
534 1.154984105 172.31.23.72 -> 172.31.31.144 OpenFlow 189 Type: OFPT_PACKET_IN
535 1.155028716 172.31.31.144 -> 172.31.23.72 TCP 66 6633 → 45446 [ACK] Seq=1 Ack=493 Win=853 Len=0 TSval=784308 TSecr=19354432
536 1.155044728 172.31.31.144 -> 172.31.23.72 OpenFlow 187 Type: OFPT_PACKET_OUT
537 1.155116460 172.31.23.72 -> 172.31.31.144 TCP 66 45450 → 6633 [ACK] Seq=493 Ack=727 Win=213 Len=0 TSval=19354433 TSecr=784308
538 1.155138692 172.31.31.144 -> 172.31.23.72 TCP 66 6633 → 45462 [ACK] Seq=1799 Ack=8287 Win=853 Len=0 TSval=784308 TSecr=19354432
539 1.155175424 172.31.31.144 -> 172.31.23.72 TCP 66 6633 → 45432 [ACK] Seq=1145 Ack=893 Win=853 Len=0 TSval=784308 TSecr=19354432
540 1.155295771 172.31.31.144 -> 172.31.23.72 OpenFlow 187 Type: OFPT_PACKET_OUT
541 1.155342304 172.31.23.72 -> 172.31.31.144 OpenFlow 189 Type: OFPT_PACKET_IN
542 1.155368861 172.31.23.72 -> 172.31.31.144 OpenFlow 189 Type: OFPT_PACKET_IN
543 1.155393811 172.31.31.144 -> 172.31.23.72 OpenFlow 187 Type: OFPT_PACKET_OUT
544 1.155416049 172.31.31.144 -> 172.31.23.72 TCP 66 6633 → 45452 [ACK] Seq=969 Ack=247 Win=853 Len=0 TSval=784308 TSecr=19354432
545 1.155448575 172.31.31.144 -> 172.31.23.72 OpenFlow 187 Type: OFPT_PACKET_OUT
546 1.155518175 172.31.23.72 -> 172.31.31.144 TCP 66 45430 → 6633 [ACK] Seq=795 Ack=644 Win=213 Len=0 TSval=19354433 TSecr=784308
547 1.155529349 172.31.31.144 -> 172.31.23.72 OpenFlow 187 Type: OFPT_PACKET_OUT
548 1.155532120 172.31.31.144 -> 172.31.23.72 TCP 66 6633 → 45434 [ACK] Seq=1275 Ack=787 Win=853 Len=0 TSval=784308 TSecr=19354433
549 1.155587717 172.31.31.144 -> 172.31.23.72 OpenFlow 187 Type: OFPT_PACKET_OUT
550 1.155635771 172.31.31.144 -> 172.31.23.72 OpenFlow 187 Type: OFPT_PACKET_OUT
551 1.155700919 172.31.23.72 -> 172.31.31.144 TCP 66 45430 → 6633 [ACK] Seq=795 Ack=1007 Win=213 Len=0 TSval=19354433 TSecr=784308
552 1.155728347 172.31.31.144 -> 172.31.23.72 OpenFlow 187 Type: OFPT_PACKET_OUT
553 1.155820490 172.31.31.144 -> 172.31.23.72 OpenFlow 187 Type: OFPT_PACKET_OUT
554 1.155847537 172.31.23.72 -> 172.31.31.144 OpenFlow 189 Type: OFPT_PACKET_IN
555 1.155870846 172.31.23.72 -> 172.31.31.144 OpenFlow 189 Type: OFPT_PACKET_IN
556 1.155894811 172.31.31.144 -> 172.31.23.72 OpenFlow 187 Type: OFPT_PACKET_OUT
557 1.155915835 172.31.23.72 -> 172.31.31.144 OpenFlow 189 Type: OFPT_PACKET_IN
558 1.155938489 172.31.31.144 -> 172.31.23.72 OpenFlow 187 Type: OFPT_PACKET_OUT
559 1.155943700 172.31.23.72 -> 172.31.31.144 OpenFlow 189 Type: OFPT_PACKET_IN
560 1.156038176 172.31.31.144 -> 172.31.23.72 TCP 66 6633 → 45432 [ACK] Seq=1145 Ack=1139 Win=853 Len=0 TSval=784308 TSecr=19354433
561 1.156044842 172.31.23.72 -> 172.31.31.144 OpenFlow 189 Type: OFPT_PACKET_IN
562 1.156066301 172.31.31.144 -> 172.31.23.72 OpenFlow 187 Type: OFPT_PACKET_OUT
563 1.156072222 172.31.23.72 -> 172.31.31.144 OpenFlow 189 Type: OFPT_PACKET_IN
564 1.156096398 172.31.31.144 -> 172.31.23.72 TCP 66 6633 → 45426 [ACK] Seq=281 Ack=672 Win=853 Len=0 TSval=784308 TSecr=19354433
565 1.156099841 172.31.31.144 -> 172.31.23.72 OpenFlow 187 Type: OFPT_PACKET_OUT
566 1.156104219 172.31.23.72 -> 172.31.31.144 OpenFlow 189 Type: OFPT_PACKET_IN
567 1.156121235 172.31.31.144 -> 172.31.23.72 OpenFlow 187 Type: OFPT_PACKET_OUT
568 1.156157985 172.31.31.144 -> 172.31.23.72 TCP 66 6633 → 45426 [ACK] Seq=281 Ack=795 Win=853 Len=0 TSval=784308 TSecr=19354433
569 1.156193495 172.31.31.144 -> 172.31.23.72 OpenFlow 187 Type: OFPT_PACKET_OUT
570 1.156238279 172.31.31.144 -> 172.31.23.72 TCP 66 6633 → 45434 [ACK] Seq=1275 Ack=910 Win=853 Len=0 TSval=784308 TSecr=19354433
571 1.156249454 172.31.31.144 -> 172.31.23.72 TCP 66 6633 → 45424 [ACK] Seq=1491 Ack=426 Win=853 Len=0 TSval=784308 TSecr=19354433
572 1.156252091 172.31.31.144 -> 172.31.23.72 OpenFlow 187 Type: OFPT_PACKET_OUT
573 1.156286821 172.31.23.72 -> 172.31.31.144 TCP 66 45430 → 6633 [ACK] Seq=795 Ack=1491 Win=213 Len=0 TSval=19354433 TSecr=784308
574 1.156296255 172.31.31.144 -> 172.31.23.72 TCP 66 6633 → 45424 [ACK] Seq=1491 Ack=549 Win=853 Len=0 TSval=784308 TSecr=19354433
575 1.156330507 172.31.31.144 -> 172.31.23.72 OpenFlow 187 Type: OFPT_PACKET_OUT
576 1.156404709 172.31.31.144 -> 172.31.23.72 OpenFlow 187 Type: OFPT_PACKET_OUT
577 1.156434622 172.31.31.144 -> 172.31.23.72 OpenFlow 187 Type: OFPT_PACKET_OUT
578 1.156513104 172.31.31.144 -> 172.31.23.72 OpenFlow 187 Type: OFPT_PACKET_OUT
579 1.156580451 172.31.31.144 -> 172.31.23.72 OpenFlow 187 Type: OFPT_PACKET_OUT
580 1.156613326 172.31.23.72 -> 172.31.31.144 TCP 66 45428 → 6633 [ACK] Seq=639 Ack=1343 Win=213 Len=0 TSval=19354433 TSecr=784308
581 1.156641958 172.31.31.144 -> 172.31.23.72 OpenFlow 187 Type: OFPT_PACKET_OUT
582 1.156705662 172.31.31.144 -> 172.31.23.72 OpenFlow 187 Type: OFPT_PACKET_OUT
583 1.156763603 172.31.31.144 -> 172.31.23.72 OpenFlow 187 Type: OFPT_PACKET_OUT
584 1.156832824 172.31.31.144 -> 172.31.23.72 OpenFlow 187 Type: OFPT_PACKET_OUT
585 1.156933664 172.31.23.72 -> 172.31.31.144 TCP 66 45416 → 6633 [ACK] Seq=893 Ack=1905 Win=213 Len=0 TSval=19354433 TSecr=784308
586 1.157006420 172.31.23.72 -> 172.31.31.144 OpenFlow 189 Type: OFPT_PACKET_IN
587 1.157029926 172.31.23.72 -> 172.31.31.144 OpenFlow 189 Type: OFPT_PACKET_IN
588 1.157054112 172.31.23.72 -> 172.31.31.144 OpenFlow 189 Type: OFPT_PACKET_IN
589 1.157070609 172.31.23.72 -> 172.31.31.144 OpenFlow 189 Type: OFPT_PACKET_IN
590 1.157092915 172.31.23.72 -> 172.31.31.144 OpenFlow 189 Type: OFPT_PACKET_IN
591 1.157112074 172.31.23.72 -> 172.31.31.144 OpenFlow 189 Type: OFPT_PACKET_IN
592 1.157203719 172.31.23.72 -> 172.31.31.144 OpenFlow 189 Type: OFPT_PACKET_IN
593 1.157221312 172.31.23.72 -> 172.31.31.144 OpenFlow 189 Type: OFPT_PACKET_IN
594 1.157229912 172.31.31.144 -> 172.31.23.72 TCP 66 6633 → 45426 [ACK] Seq=281 Ack=918 Win=853 Len=0 TSval=784308 TSecr=19354433
595 1.157236129 172.31.23.72 -> 172.31.31.144 OpenFlow 189 Type: OFPT_PACKET_IN
596 1.157250223 172.31.23.72 -> 172.31.31.144 OpenFlow 189 Type: OFPT_PACKET_IN
597 1.157275810 172.31.23.72 -> 172.31.31.144 OpenFlow 189 Type: OFPT_PACKET_IN
598 1.157286594 172.31.23.72 -> 172.31.31.144 OpenFlow 189 Type: OFPT_PACKET_IN
599 1.157298483 172.31.23.72 -> 172.31.31.144 OpenFlow 189 Type: OFPT_PACKET_IN
600 1.157315683 172.31.31.144 -> 172.31.23.72 TCP 66 6633 → 45414 [ACK] Seq=65 Ack=541 Win=853 Len=0 TSval=784308 TSecr=19354433
601 1.157319685 172.31.31.144 -> 172.31.23.72 TCP 66 6633 → 45426 [ACK] Seq=281 Ack=1041 Win=853 Len=0 TSval=784308 TSecr=19354433
602 1.157359893 172.31.23.72 -> 172.31.31.144 OpenFlow 189 Type: OFPT_PACKET_IN
603 1.157426527 172.31.31.144 -> 172.31.23.72 TCP 66 6633 → 45432 [ACK] Seq=1145 Ack=1385 Win=853 Len=0 TSval=784308 TSecr=19354433
604 1.157431107 172.31.31.144 -> 172.31.23.72 TCP 66 6633 → 45436 [ACK] Seq=1033 Ack=910 Win=853 Len=0 TSval=784308 TSecr=19354433
605 1.157433269 172.31.31.144 -> 172.31.23.72 TCP 66 6633 → 45420 [ACK] Seq=2103 Ack=940 Win=853 Len=0 TSval=784308 TSecr=19354433
606 1.157437716 172.31.23.72 -> 172.31.31.144 OpenFlow 189 Type: OFPT_PACKET_IN
607 1.157517274 172.31.31.144 -> 172.31.23.72 TCP 66 6633 → 45420 [ACK] Seq=2103 Ack=1063 Win=853 Len=0 TSval=784308 TSecr=19354433
608 1.157520678 172.31.31.144 -> 172.31.23.72 TCP 66 6633 → 45424 [ACK] Seq=1491 Ack=672 Win=853 Len=0 TSval=784308 TSecr=19354433
609 1.157522857 172.31.31.144 -> 172.31.23.72 TCP 66 6633 → 45434 [ACK] Seq=1275 Ack=1033 Win=853 Len=0 TSval=784308 TSecr=19354433
610 1.157549946 172.31.31.144 -> 172.31.23.72 TCP 66 6633 → 45436 [ACK] Seq=1033 Ack=1033 Win=853 Len=0 TSval=784308 TSecr=19354433
611 1.157590795 172.31.31.144 -> 172.31.23.72 TCP 66 6633 → 45424 [ACK] Seq=1491 Ack=795 Win=853 Len=0 TSval=784308 TSecr=19354433
612 1.157915317 172.31.31.144 -> 172.31.23.72 TCP 66 6633 → 45418 [ACK] Seq=2561 Ack=1071 Win=853 Len=0 TSval=784308 TSecr=19354433
613 1.191068121 172.31.23.72 -> 172.31.31.144 TCP 66 45444 → 6633 [ACK] Seq=295 Ack=1275 Win=213 Len=0 TSval=19354442 TSecr=784307
614 1.250216637 172.31.31.144 -> 172.31.23.72 OpenFlow 187 Type: OFPT_PACKET_OUT
615 1.250254740 172.31.31.144 -> 172.31.23.72 OpenFlow 187 Type: OFPT_PACKET_OUT
616 1.250304753 172.31.31.144 -> 172.31.23.72 OpenFlow 187 Type: OFPT_PACKET_OUT
617 1.250371858 172.31.31.144 -> 172.31.23.72 OpenFlow 187 Type: OFPT_PACKET_OUT
618 1.250431113 172.31.31.144 -> 172.31.23.72 OpenFlow 187 Type: OFPT_PACKET_OUT
619 1.250521650 172.31.31.144 -> 172.31.23.72 OpenFlow 187 Type: OFPT_PACKET_OUT
620 1.250560791 172.31.31.144 -> 172.31.23.72 OpenFlow 187 Type: OFPT_PACKET_OUT
621 1.250622283 172.31.31.144 -> 172.31.23.72 OpenFlow 187 Type: OFPT_PACKET_OUT
622 1.250679588 172.31.31.144 -> 172.31.23.72 OpenFlow 187 Type: OFPT_PACKET_OUT
623 1.250738255 172.31.31.144 -> 172.31.23.72 OpenFlow 187 Type: OFPT_PACKET_OUT
624 1.250840102 172.31.31.144 -> 172.31.23.72 OpenFlow 187 Type: OFPT_PACKET_OUT
625 1.250914110 172.31.31.144 -> 172.31.23.72 OpenFlow 187 Type: OFPT_PACKET_OUT
626 1.250933483 172.31.31.144 -> 172.31.23.72 OpenFlow 187 Type: OFPT_PACKET_OUT
627 1.250997228 172.31.31.144 -> 172.31.23.72 OpenFlow 187 Type: OFPT_PACKET_OUT
628 1.251058133 172.31.31.144 -> 172.31.23.72 OpenFlow 187 Type: OFPT_PACKET_OUT
629 1.251077541 172.31.23.72 -> 172.31.31.144 TCP 66 45446 → 6633 [ACK] Seq=493 Ack=1211 Win=213 Len=0 TSval=19354457 TSecr=784332
630 1.251131263 172.31.31.144 -> 172.31.23.72 OpenFlow 187 Type: OFPT_PACKET_OUT
631 1.251227723 172.31.31.144 -> 172.31.23.72 OpenFlow 187 Type: OFPT_PACKET_OUT
632 1.251246778 172.31.31.144 -> 172.31.23.72 OpenFlow 187 Type: OFPT_PACKET_OUT
633 1.251343057 172.31.31.144 -> 172.31.23.72 OpenFlow 187 Type: OFPT_PACKET_OUT
634 1.251359495 172.31.31.144 -> 172.31.23.72 OpenFlow 187 Type: OFPT_PACKET_OUT
635 1.251436173 172.31.31.144 -> 172.31.23.72 OpenFlow 187 Type: OFPT_PACKET_OUT
636 1.251492979 172.31.31.144 -> 172.31.23.72 OpenFlow 187 Type: OFPT_PACKET_OUT
637 1.251505159 172.31.23.72 -> 172.31.31.144 TCP 66 45432 → 6633 [ACK] Seq=1385 Ack=2113 Win=213 Len=0 TSval=19354457 TSecr=784332
638 1.251588212 172.31.31.144 -> 172.31.23.72 OpenFlow 187 Type: OFPT_PACKET_OUT
639 1.251617941 172.31.31.144 -> 172.31.23.72 OpenFlow 187 Type: OFPT_PACKET_OUT
640 1.251733462 172.31.23.72 -> 172.31.31.144 TCP 66 45460 → 6633 [ACK] Seq=8873 Ack=2007 Win=213 Len=0 TSval=19354457 TSecr=784332
641 1.251753690 172.31.31.144 -> 172.31.23.72 OpenFlow 187 Type: OFPT_PACKET_OUT
642 1.251791386 172.31.31.144 -> 172.31.23.72 OpenFlow 187 Type: OFPT_PACKET_OUT
643 1.251805074 172.31.31.144 -> 172.31.23.72 OpenFlow 187 Type: OFPT_PACKET_OUT
644 1.251839360 172.31.23.72 -> 172.31.31.144 OpenFlow 189 Type: OFPT_PACKET_IN
645 1.251864162 172.31.31.144 -> 172.31.23.72 OpenFlow 187 Type: OFPT_PACKET_OUT
646 1.251869811 172.31.23.72 -> 172.31.31.144 OpenFlow 435 Type: OFPT_PACKET_IN
647 1.251949560 172.31.31.144 -> 172.31.23.72 OpenFlow 187 Type: OFPT_PACKET_OUT
648 1.252001728 172.31.31.144 -> 172.31.23.72 TCP 66 6633 → 45458 [ACK] Seq=702 Ack=8756 Win=853 Len=0 TSval=784332 TSecr=19354457
649 1.252023558 172.31.31.144 -> 172.31.23.72 OpenFlow 187 Type: OFPT_PACKET_OUT
650 1.252094525 172.31.23.72 -> 172.31.31.144 TCP 66 45458 → 6633 [ACK] Seq=9125 Ack=823 Win=213 Len=0 TSval=19354457 TSecr=784332
651 1.252128235 172.31.23.72 -> 172.31.31.144 OpenFlow 189 Type: OFPT_PACKET_IN
652 1.252159876 172.31.23.72 -> 172.31.31.144 OpenFlow 435 Type: OFPT_PACKET_IN
653 1.252183299 172.31.23.72 -> 172.31.31.144 OpenFlow 189 Type: OFPT_PACKET_IN
654 1.252215889 172.31.23.72 -> 172.31.31.144 OpenFlow 435 Type: OFPT_PACKET_IN
655 1.252303075 172.31.31.144 -> 172.31.23.72 OpenFlow 187 Type: OFPT_PACKET_OUT
656 1.252341303 172.31.31.144 -> 172.31.23.72 OpenFlow 187 Type: OFPT_PACKET_OUT
657 1.252349893 172.31.23.72 -> 172.31.31.144 OpenFlow 189 Type: OFPT_PACKET_IN
658 1.252369935 172.31.23.72 -> 172.31.31.144 OpenFlow 189 Type: OFPT_PACKET_IN
659 1.252402611 172.31.23.72 -> 172.31.31.144 OpenFlow 189 Type: OFPT_PACKET_IN
660 1.252420528 172.31.31.144 -> 172.31.23.72 TCP 66 6633 → 45448 [ACK] Seq=1185 Ack=1091 Win=853 Len=0 TSval=784332 TSecr=19354457
661 1.252431722 172.31.23.72 -> 172.31.31.144 OpenFlow 189 Type: OFPT_PACKET_IN
662 1.252439017 172.31.23.72 -> 172.31.31.144 OpenFlow 189 Type: OFPT_PACKET_IN
663 1.252465583 172.31.23.72 -> 172.31.31.144 OpenFlow 189 Type: OFPT_PACKET_IN
664 1.252470924 172.31.23.72 -> 172.31.31.144 OpenFlow 435 Type: OFPT_PACKET_IN
665 1.252483630 172.31.23.72 -> 172.31.31.144 OpenFlow 189 Type: OFPT_PACKET_IN
666 1.252505471 172.31.23.72 -> 172.31.31.144 OpenFlow 189 Type: OFPT_PACKET_IN
667 1.252583867 172.31.23.72 -> 172.31.31.144 OpenFlow 189 Type: OFPT_PACKET_IN
668 1.252590527 172.31.23.72 -> 172.31.31.144 OpenFlow 189 Type: OFPT_PACKET_IN
669 1.252607184 172.31.23.72 -> 172.31.31.144 TCP 66 45456 → 6633 [ACK] Seq=739 Ack=243 Win=213 Len=0 TSval=19354457 TSecr=784332
670 1.252609160 172.31.23.72 -> 172.31.31.144 OpenFlow 189 Type: OFPT_PACKET_IN
671 1.252653819 172.31.31.144 -> 172.31.23.72 TCP 66 6633 → 45462 [ACK] Seq=1799 Ack=8533 Win=853 Len=0 TSval=784332 TSecr=19354457
672 1.252692353 172.31.23.72 -> 172.31.31.144 OpenFlow 189 Type: OFPT_PACKET_IN
673 1.252748510 172.31.31.144 -> 172.31.23.72 TCP 66 6633 → 45438 [ACK] Seq=1033 Ack=664 Win=853 Len=0 TSval=784332 TSecr=19354457
674 1.252766973 172.31.23.72 -> 172.31.31.144 OpenFlow 189 Type: OFPT_PACKET_IN
675 1.252799408 172.31.31.144 -> 172.31.23.72 OpenFlow 187 Type: OFPT_PACKET_OUT
676 1.252853534 172.31.31.144 -> 172.31.23.72 OpenFlow 187 Type: OFPT_PACKET_OUT
677 1.252864842 172.31.31.144 -> 172.31.23.72 OpenFlow 187 Type: OFPT_PACKET_OUT
678 1.252953590 172.31.31.144 -> 172.31.23.72 TCP 66 6633 → 45454 [ACK] Seq=1 Ack=616 Win=853 Len=0 TSval=784332 TSecr=19354457
679 1.252971970 172.31.31.144 -> 172.31.23.72 TCP 66 6633 → 45438 [ACK] Seq=1033 Ack=1033 Win=853 Len=0 TSval=784332 TSecr=19354457
680 1.252974481 172.31.31.144 -> 172.31.23.72 TCP 66 6633 → 45454 [ACK] Seq=1 Ack=739 Win=853 Len=0 TSval=784332 TSecr=19354457
681 1.252990870 172.31.31.144 -> 172.31.23.72 TCP 66 6633 → 45444 [ACK] Seq=1275 Ack=541 Win=853 Len=0 TSval=784332 TSecr=19354457
682 1.253002149 172.31.31.144 -> 172.31.23.72 TCP 66 6633 → 45460 [ACK] Seq=2007 Ack=9119 Win=853 Len=0 TSval=784332 TSecr=19354457
683 1.253016906 172.31.31.144 -> 172.31.23.72 TCP 66 6633 → 45428 [ACK] Seq=1343 Ack=885 Win=853 Len=0 TSval=784332 TSecr=19354457
684 1.253036997 172.31.23.72 -> 172.31.31.144 TCP 66 45458 → 6633 [ACK] Seq=9125 Ack=1065 Win=213 Len=0 TSval=19354457 TSecr=784332
685 1.253045731 172.31.31.144 -> 172.31.23.72 OpenFlow 187 Type: OFPT_PACKET_OUT
686 1.253082745 172.31.31.144 -> 172.31.23.72 OpenFlow 671 Type: OFPT_PACKET_OUT
687 1.253103155 172.31.31.144 -> 172.31.23.72 TCP 66 6633 → 45430 [ACK] Seq=1491 Ack=1041 Win=853 Len=0 TSval=784332 TSecr=19354457
688 1.253140645 172.31.31.144 -> 172.31.23.72 OpenFlow 187 Type: OFPT_PACKET_OUT
689 1.253191981 172.31.31.144 -> 172.31.23.72 OpenFlow 187 Type: OFPT_PACKET_OUT
690 1.253250035 172.31.31.144 -> 172.31.23.72 OpenFlow 187 Type: OFPT_PACKET_OUT
691 1.253331373 172.31.31.144 -> 172.31.23.72 OpenFlow 187 Type: OFPT_PACKET_OUT
692 1.253391563 172.31.31.144 -> 172.31.23.72 OpenFlow 187 Type: OFPT_PACKET_OUT
693 1.253407938 172.31.23.72 -> 172.31.31.144 TCP 66 45456 → 6633 [ACK] Seq=739 Ack=969 Win=213 Len=0 TSval=19354457 TSecr=784332
694 1.253497999 172.31.31.144 -> 172.31.23.72 OpenFlow 187 Type: OFPT_PACKET_OUT
695 1.253541955 172.31.31.144 -> 172.31.23.72 OpenFlow 187 Type: OFPT_PACKET_OUT
696 1.253582499 172.31.31.144 -> 172.31.23.72 OpenFlow 187 Type: OFPT_PACKET_OUT
697 1.253652775 172.31.23.72 -> 172.31.31.144 TCP 66 45414 → 6633 [ACK] Seq=541 Ack=791 Win=213 Len=0 TSval=19354457 TSecr=784332
698 1.253664163 172.31.31.144 -> 172.31.23.72 OpenFlow 187 Type: OFPT_PACKET_OUT
699 1.253728932 172.31.31.144 -> 172.31.23.72 OpenFlow 187 Type: OFPT_PACKET_OUT
700 1.253766477 172.31.31.144 -> 172.31.23.72 OpenFlow 187 Type: OFPT_PACKET_OUT
701 1.253825035 172.31.31.144 -> 172.31.23.72 OpenFlow 187 Type: OFPT_PACKET_OUT
702 1.253877460 172.31.31.144 -> 172.31.23.72 OpenFlow 187 Type: OFPT_PACKET_OUT
703 1.253974109 172.31.31.144 -> 172.31.23.72 OpenFlow 187 Type: OFPT_PACKET_OUT
704 1.253999202 172.31.31.144 -> 172.31.23.72 OpenFlow 187 Type: OFPT_PACKET_OUT
705 1.254018865 172.31.23.72 -> 172.31.31.144 TCP 66 45454 → 6633 [ACK] Seq=739 Ack=969 Win=213 Len=0 TSval=19354457 TSecr=784332
706 1.254067834 172.31.31.144 -> 172.31.23.72 OpenFlow 187 Type: OFPT_PACKET_OUT
707 1.254150004 172.31.31.144 -> 172.31.23.72 OpenFlow 187 Type: OFPT_PACKET_OUT
708 1.254202976 172.31.31.144 -> 172.31.23.72 OpenFlow 187 Type: OFPT_PACKET_OUT
709 1.254276775 172.31.31.144 -> 172.31.23.72 OpenFlow 187 Type: OFPT_PACKET_OUT
710 1.254350701 172.31.23.72 -> 172.31.31.144 TCP 66 45448 → 6633 [ACK] Seq=1091 Ack=1911 Win=213 Len=0 TSval=19354457 TSecr=784332
711 1.254366883 172.31.31.144 -> 172.31.23.72 OpenFlow 187 Type: OFPT_PACKET_OUT
712 1.254403848 172.31.31.144 -> 172.31.23.72 OpenFlow 187 Type: OFPT_PACKET_OUT
713 1.254421204 172.31.31.144 -> 172.31.23.72 OpenFlow 187 Type: OFPT_PACKET_OUT
714 1.254478365 172.31.31.144 -> 172.31.23.72 OpenFlow 187 Type: OFPT_PACKET_OUT
715 1.254540048 172.31.31.144 -> 172.31.23.72 OpenFlow 187 Type: OFPT_PACKET_OUT
716 1.254590291 172.31.31.144 -> 172.31.23.72 OpenFlow 187 Type: OFPT_PACKET_OUT
717 1.254678408 172.31.23.72 -> 172.31.31.144 TCP 66 45442 → 6633 [ACK] Seq=787 Ack=791 Win=213 Len=0 TSval=19354457 TSecr=784333
718 1.254816325 172.31.23.72 -> 172.31.31.144 OpenFlow 189 Type: OFPT_PACKET_IN
719 1.254838076 172.31.23.72 -> 172.31.31.144 OpenFlow 435 Type: OFPT_PACKET_IN
720 1.254850770 172.31.23.72 -> 172.31.31.144 OpenFlow 189 Type: OFPT_PACKET_IN
721 1.254870696 172.31.23.72 -> 172.31.31.144 OpenFlow 189 Type: OFPT_PACKET_IN
722 1.254886683 172.31.23.72 -> 172.31.31.144 OpenFlow 189 Type: OFPT_PACKET_IN
723 1.254888973 172.31.23.72 -> 172.31.31.144 OpenFlow 189 Type: OFPT_PACKET_IN
724 1.254903900 172.31.23.72 -> 172.31.31.144 OpenFlow 189 Type: OFPT_PACKET_IN
725 1.254908869 172.31.23.72 -> 172.31.31.144 OpenFlow 189 Type: OFPT_PACKET_IN
726 1.254943433 172.31.23.72 -> 172.31.31.144 OpenFlow 189 Type: OFPT_PACKET_IN
727 1.254945880 172.31.23.72 -> 172.31.31.144 OpenFlow 189 Type: OFPT_PACKET_IN
728 1.254957113 172.31.23.72 -> 172.31.31.144 OpenFlow 189 Type: OFPT_PACKET_IN
729 1.254977750 172.31.23.72 -> 172.31.31.144 OpenFlow 189 Type: OFPT_PACKET_IN
730 1.254983033 172.31.23.72 -> 172.31.31.144 OpenFlow 681 Type: OFPT_PACKET_IN
731 1.254996307 172.31.23.72 -> 172.31.31.144 OpenFlow 189 Type: OFPT_PACKET_IN
732 1.255019027 172.31.23.72 -> 172.31.31.144 OpenFlow 189 Type: OFPT_PACKET_IN
733 1.255021232 172.31.23.72 -> 172.31.31.144 OpenFlow 189 Type: OFPT_PACKET_IN
734 1.255127407 172.31.31.144 -> 172.31.23.72 TCP 66 6633 → 45452 [ACK] Seq=969 Ack=739 Win=853 Len=0 TSval=784333 TSecr=19354457
735 1.255134031 172.31.31.144 -> 172.31.23.72 TCP 66 6633 → 45434 [ACK] Seq=1275 Ack=1156 Win=853 Len=0 TSval=784333 TSecr=19354457
736 1.255136262 172.31.31.144 -> 172.31.23.72 TCP 66 6633 → 45424 [ACK] Seq=1491 Ack=918 Win=853 Len=0 TSval=784333 TSecr=19354457
737 1.255138169 172.31.31.144 -> 172.31.23.72 TCP 66 6633 → 45462 [ACK] Seq=1799 Ack=8779 Win=853 Len=0 TSval=784333 TSecr=19354457
738 1.255143912 172.31.23.72 -> 172.31.31.144 OpenFlow 681 Type: OFPT_PACKET_IN
739 1.255150319 172.31.23.72 -> 172.31.31.144 OpenFlow 189 Type: OFPT_PACKET_IN
740 1.255211338 172.31.23.72 -> 172.31.31.144 OpenFlow 189 Type: OFPT_PACKET_IN
741 1.255213364 172.31.23.72 -> 172.31.31.144 OpenFlow 189 Type: OFPT_PACKET_IN
742 1.255242639 172.31.31.144 -> 172.31.23.72 TCP 66 6633 → 45424 [ACK] Seq=1491 Ack=1041 Win=853 Len=0 TSval=784333 TSecr=19354457
743 1.255346887 172.31.31.144 -> 172.31.23.72 TCP 66 6633 → 45446 [ACK] Seq=1211 Ack=616 Win=853 Len=0 TSval=784333 TSecr=19354457
744 1.255502725 172.31.31.144 -> 172.31.23.72 TCP 66 6633 → 45446 [ACK] Seq=1211 Ack=1231 Win=853 Len=0 TSval=784333 TSecr=19354458
745 1.255524969 172.31.31.144 -> 172.31.23.72 TCP 66 6633 → 45460 [ACK] Seq=2007 Ack=9365 Win=853 Len=0 TSval=784333 TSecr=19354457
746 1.255615814 172.31.31.144 -> 172.31.23.72 TCP 66 6633 → 45456 [ACK] Seq=969 Ack=985 Win=853 Len=0 TSval=784333 TSecr=19354457
747 1.255687087 172.31.31.144 -> 172.31.23.72 TCP 66 6633 → 45458 [ACK] Seq=1065 Ack=9371 Win=853 Len=0 TSval=784333 TSecr=19354457
748 1.255689194 172.31.31.144 -> 172.31.23.72 TCP 66 6633 → 45434 [ACK] Seq=1275 Ack=1279 Win=853 Len=0 TSval=784333 TSecr=19354457
749 1.255822311 172.31.31.144 -> 172.31.23.72 TCP 66 6633 → 45416 [ACK] Seq=1905 Ack=1139 Win=853 Len=0 TSval=784333 TSecr=19354457
750 1.255888595 172.31.31.144 -> 172.31.23.72 TCP 66 6633 → 45444 [ACK] Seq=1275 Ack=1279 Win=853 Len=0 TSval=784333 TSecr=19354457
751 1.350019654 172.31.31.144 -> 172.31.23.72 OpenFlow 187 Type: OFPT_PACKET_OUT
752 1.350061116 172.31.31.144 -> 172.31.23.72 OpenFlow 187 Type: OFPT_PACKET_OUT
753 1.350074439 172.31.31.144 -> 172.31.23.72 OpenFlow 187 Type: OFPT_PACKET_OUT
754 1.350139612 172.31.31.144 -> 172.31.23.72 OpenFlow 187 Type: OFPT_PACKET_OUT
755 1.350215996 172.31.31.144 -> 172.31.23.72 OpenFlow 187 Type: OFPT_PACKET_OUT
756 1.350294840 172.31.31.144 -> 172.31.23.72 OpenFlow 187 Type: OFPT_PACKET_OUT
757 1.350360571 172.31.31.144 -> 172.31.23.72 OpenFlow 187 Type: OFPT_PACKET_OUT
758 1.350407836 172.31.31.144 -> 172.31.23.72 OpenFlow 187 Type: OFPT_PACKET_OUT
759 1.350477622 172.31.31.144 -> 172.31.23.72 OpenFlow 187 Type: OFPT_PACKET_OUT
760 1.350516116 172.31.31.144 -> 172.31.23.72 OpenFlow 187 Type: OFPT_PACKET_OUT
761 1.350663299 172.31.31.144 -> 172.31.23.72 OpenFlow 187 Type: OFPT_PACKET_OUT
762 1.350696137 172.31.31.144 -> 172.31.23.72 OpenFlow 187 Type: OFPT_PACKET_OUT
763 1.350726497 172.31.31.144 -> 172.31.23.72 OpenFlow 187 Type: OFPT_PACKET_OUT
764 1.350793840 172.31.31.144 -> 172.31.23.72 OpenFlow 187 Type: OFPT_PACKET_OUT
765 1.350847942 172.31.23.72 -> 172.31.31.144 TCP 66 45426 → 6633 [ACK] Seq=1041 Ack=1491 Win=213 Len=0 TSval=19354481 TSecr=784356
766 1.350856074 172.31.31.144 -> 172.31.23.72 OpenFlow 187 Type: OFPT_PACKET_OUT
767 1.350935942 172.31.31.144 -> 172.31.23.72 OpenFlow 187 Type: OFPT_PACKET_OUT
768 1.350944546 172.31.23.72 -> 172.31.31.144 OpenFlow 189 Type: OFPT_PACKET_IN
769 1.350968222 172.31.23.72 -> 172.31.31.144 OpenFlow 189 Type: OFPT_PACKET_IN
770 1.351168886 172.31.31.144 -> 172.31.23.72 TCP 66 6633 → 45422 [ACK] Seq=1223 Ack=803 Win=853 Len=0 TSval=784357 TSecr=19354481
771 1.351353140 172.31.23.72 -> 172.31.31.144 OpenFlow 189 Type: OFPT_PACKET_IN
772 1.351390093 172.31.23.72 -> 172.31.31.144 OpenFlow 189 Type: OFPT_PACKET_IN
773 1.351395586 172.31.23.72 -> 172.31.31.144 OpenFlow 189 Type: OFPT_PACKET_IN
774 1.351410687 172.31.23.72 -> 172.31.31.144 OpenFlow 189 Type: OFPT_PACKET_IN
775 1.351416204 172.31.23.72 -> 172.31.31.144 OpenFlow 189 Type: OFPT_PACKET_IN
776 1.351445363 172.31.23.72 -> 172.31.31.144 OpenFlow 189 Type: OFPT_PACKET_IN
777 1.351455541 172.31.23.72 -> 172.31.31.144 OpenFlow 435 Type: OFPT_PACKET_IN
778 1.351469766 172.31.23.72 -> 172.31.31.144 OpenFlow 189 Type: OFPT_PACKET_IN
779 1.351521450 172.31.23.72 -> 172.31.31.144 OpenFlow 189 Type: OFPT_PACKET_IN
780 1.351526738 172.31.23.72 -> 172.31.31.144 OpenFlow 189 Type: OFPT_PACKET_IN
781 1.351591046 172.31.31.144 -> 172.31.23.72 TCP 66 6633 → 45420 [ACK] Seq=2103 Ack=1186 Win=853 Len=0 TSval=784357 TSecr=19354482
782 1.351597258 172.31.31.144 -> 172.31.23.72 TCP 66 6633 → 45420 [ACK] Seq=2103 Ack=1309 Win=853 Len=0 TSval=784357 TSecr=19354482
783 1.351601848 172.31.23.72 -> 172.31.31.144 OpenFlow 189 Type: OFPT_PACKET_IN
784 1.351607859 172.31.23.72 -> 172.31.31.144 OpenFlow 189 Type: OFPT_PACKET_IN
785 1.351634551 172.31.31.144 -> 172.31.23.72 TCP 66 6633 → 45424 [ACK] Seq=1491 Ack=1287 Win=853 Len=0 TSval=784357 TSecr=19354482
786 1.351697126 172.31.31.144 -> 172.31.23.72 TCP 66 6633 → 45418 [ACK] Seq=2561 Ack=1563 Win=853 Len=0 TSval=784357 TSecr=19354482
787 1.351754145 172.31.31.144 -> 172.31.23.72 TCP 66 6633 → 45426 [ACK] Seq=1491 Ack=1164 Win=853 Len=0 TSval=784357 TSecr=19354482
788 1.351908302 172.31.31.144 -> 172.31.23.72 TCP 66 6633 → 45430 [ACK] Seq=1491 Ack=1287 Win=853 Len=0 TSval=784357 TSecr=19354482
789 1.352019778 172.31.31.144 -> 172.31.23.72 TCP 66 6633 → 45428 [ACK] Seq=1343 Ack=1131 Win=853 Len=0 TSval=784357 TSecr=19354482
790 1.352104388 172.31.31.144 -> 172.31.23.72 TCP 66 6633 → 45426 [ACK] Seq=1491 Ack=1287 Win=853 Len=0 TSval=784357 TSecr=19354482
791 1.450192720 172.31.31.144 -> 172.31.23.72 OpenFlow 90 Type: OFPT_MULTIPART_REQUEST, OFPMP_GROUP
792 1.450219630 172.31.31.144 -> 172.31.23.72 OpenFlow 90 Type: OFPT_MULTIPART_REQUEST, OFPMP_GROUP
793 1.450223333 172.31.31.144 -> 172.31.23.72 OpenFlow 90 Type: OFPT_MULTIPART_REQUEST, OFPMP_GROUP
794 1.450225967 172.31.31.144 -> 172.31.23.72 OpenFlow 90 Type: OFPT_MULTIPART_REQUEST, OFPMP_GROUP
795 1.450228943 172.31.31.144 -> 172.31.23.72 OpenFlow 90 Type: OFPT_MULTIPART_REQUEST, OFPMP_GROUP
796 1.450251391 172.31.31.144 -> 172.31.23.72 OpenFlow 106 Type: OFPT_MULTIPART_REQUEST, OFPMP_METER
797 1.450255319 172.31.31.144 -> 172.31.23.72 OpenFlow 106 Type: OFPT_MULTIPART_REQUEST, OFPMP_METER
798 1.450257199 172.31.31.144 -> 172.31.23.72 OpenFlow 106 Type: OFPT_MULTIPART_REQUEST, OFPMP_METER
799 1.450259008 172.31.31.144 -> 172.31.23.72 OpenFlow 106 Type: OFPT_MULTIPART_REQUEST, OFPMP_METER
800 1.450264152 172.31.31.144 -> 172.31.23.72 OpenFlow 106 Type: OFPT_MULTIPART_REQUEST, OFPMP_METER
801 1.450412184 172.31.23.72 -> 172.31.31.144 OpenFlow 82 Type: OFPT_MULTIPART_REPLY, OFPMP_GROUP
802 1.450440639 172.31.23.72 -> 172.31.31.144 OpenFlow 98 Type: OFPT_MULTIPART_REPLY, OFPMP_METER
803 1.450514992 172.31.23.72 -> 172.31.31.144 OpenFlow 82 Type: OFPT_MULTIPART_REPLY, OFPMP_GROUP
804 1.450535683 172.31.23.72 -> 172.31.31.144 OpenFlow 98 Type: OFPT_MULTIPART_REPLY, OFPMP_METER
805 1.450566206 172.31.23.72 -> 172.31.31.144 OpenFlow 82 Type: OFPT_MULTIPART_REPLY, OFPMP_GROUP
806 1.450582403 172.31.23.72 -> 172.31.31.144 OpenFlow 98 Type: OFPT_MULTIPART_REPLY, OFPMP_METER
807 1.450626209 172.31.23.72 -> 172.31.31.144 OpenFlow 82 Type: OFPT_MULTIPART_REPLY, OFPMP_GROUP
808 1.450647344 172.31.23.72 -> 172.31.31.144 OpenFlow 98 Type: OFPT_MULTIPART_REPLY, OFPMP_METER
809 1.450655881 172.31.23.72 -> 172.31.31.144 OpenFlow 82 Type: OFPT_MULTIPART_REPLY, OFPMP_GROUP
810 1.450694620 172.31.23.72 -> 172.31.31.144 OpenFlow 98 Type: OFPT_MULTIPART_REPLY, OFPMP_METER
811 1.450718961 172.31.31.144 -> 172.31.23.72 TCP 66 6633 → 45452 [ACK] Seq=1033 Ack=787 Win=853 Len=0 TSval=784382 TSecr=19354506
812 1.450741525 172.31.31.144 -> 172.31.23.72 TCP 66 6633 → 45446 [ACK] Seq=1275 Ack=1247 Win=853 Len=0 TSval=784382 TSecr=19354506
813 1.450769514 172.31.31.144 -> 172.31.23.72 TCP 66 6633 → 45446 [ACK] Seq=1275 Ack=1279 Win=853 Len=0 TSval=784382 TSecr=19354506
814 1.450801195 172.31.31.144 -> 172.31.23.72 TCP 66 6633 → 45450 [ACK] Seq=791 Ack=541 Win=853 Len=0 TSval=784382 TSecr=19354506
815 1.450829323 172.31.31.144 -> 172.31.23.72 TCP 66 6633 → 45454 [ACK] Seq=1033 Ack=787 Win=853 Len=0 TSval=784382 TSecr=19354506
816 1.450907300 172.31.31.144 -> 172.31.23.72 TCP 66 6633 → 45448 [ACK] Seq=1975 Ack=1139 Win=853 Len=0 TSval=784382 TSecr=19354506
817 1.549417476 172.31.31.144 -> 172.31.23.72 OpenFlow 90 Type: OFPT_MULTIPART_REQUEST, OFPMP_GROUP
818 1.549440881 172.31.31.144 -> 172.31.23.72 OpenFlow 90 Type: OFPT_MULTIPART_REQUEST, OFPMP_GROUP
819 1.549444298 172.31.31.144 -> 172.31.23.72 OpenFlow 90 Type: OFPT_MULTIPART_REQUEST, OFPMP_GROUP
820 1.549459667 172.31.31.144 -> 172.31.23.72 OpenFlow 106 Type: OFPT_MULTIPART_REQUEST, OFPMP_METER
821 1.549463644 172.31.31.144 -> 172.31.23.72 OpenFlow 106 Type: OFPT_MULTIPART_REQUEST, OFPMP_METER
822 1.549476697 172.31.31.144 -> 172.31.23.72 OpenFlow 106 Type: OFPT_MULTIPART_REQUEST, OFPMP_METER
823 1.549709340 172.31.23.72 -> 172.31.31.144 OpenFlow 82 Type: OFPT_MULTIPART_REPLY, OFPMP_GROUP
824 1.549737201 172.31.23.72 -> 172.31.31.144 OpenFlow 98 Type: OFPT_MULTIPART_REPLY, OFPMP_METER
825 1.549764111 172.31.23.72 -> 172.31.31.144 OpenFlow 82 Type: OFPT_MULTIPART_REPLY, OFPMP_GROUP
826 1.549792280 172.31.23.72 -> 172.31.31.144 OpenFlow 98 Type: OFPT_MULTIPART_REPLY, OFPMP_METER
827 1.549797173 172.31.23.72 -> 172.31.31.144 OpenFlow 82 Type: OFPT_MULTIPART_REPLY, OFPMP_GROUP
828 1.549837186 172.31.23.72 -> 172.31.31.144 OpenFlow 98 Type: OFPT_MULTIPART_REPLY, OFPMP_METER
829 1.549972031 172.31.31.144 -> 172.31.23.72 TCP 66 6633 → 45458 [ACK] Seq=1129 Ack=9419 Win=853 Len=0 TSval=784406 TSecr=19354531
830 1.550011360 172.31.31.144 -> 172.31.23.72 TCP 66 6633 → 45460 [ACK] Seq=2071 Ack=9413 Win=853 Len=0 TSval=784406 TSecr=19354531
831 1.550024793 172.31.31.144 -> 172.31.23.72 TCP 66 6633 → 45456 [ACK] Seq=1033 Ack=1033 Win=853 Len=0 TSval=784406 TSecr=19354531
832 1.950208668 172.31.31.144 -> 172.31.23.72 OpenFlow 90 Type: OFPT_MULTIPART_REQUEST, OFPMP_GROUP
833 1.950236449 172.31.31.144 -> 172.31.23.72 OpenFlow 106 Type: OFPT_MULTIPART_REQUEST, OFPMP_METER
834 1.950418947 172.31.23.72 -> 172.31.31.144 OpenFlow 82 Type: OFPT_MULTIPART_REPLY, OFPMP_GROUP
835 1.950501054 172.31.23.72 -> 172.31.31.144 OpenFlow 98 Type: OFPT_MULTIPART_REPLY, OFPMP_METER
836 1.950841481 172.31.31.144 -> 172.31.23.72 TCP 66 6633 → 45462 [ACK] Seq=1863 Ack=8827 Win=853 Len=0 TSval=784507 TSecr=19354631
