  1 0.000000000 172.31.31.144 -> 172.31.23.72 TCP 82 6633 → 45518 [PSH, ACK] Seq=1 Ack=1 Win=853 Len=16 TSval=1163485 TSecr=29985004
  2 0.000020700 172.31.31.144 -> 172.31.23.72 TCP 146 6633 → 45518 [PSH, ACK] Seq=17 Ack=1 Win=853 Len=80 TSval=1163485 TSecr=29985004
  3 0.000268603 172.31.23.72 -> 172.31.31.144 OpenFlow 6178 Type: OFPT_MULTIPART_REPLY, OFPMP_TABLE
  4 0.000354199 172.31.23.72 -> 172.31.31.144 OpenFlow 3050 Type: OFPT_MULTIPART_REPLY, OFPMP_FLOW
  5 0.000457308 172.31.23.72 -> 172.31.31.144 OpenFlow 754 Type: OFPT_MULTIPART_REPLY, OFPMP_PORT_STATS
  6 0.000556787 172.31.31.144 -> 172.31.23.72 TCP 66 6633 → 45518 [ACK] Seq=97 Ack=6113 Win=853 Len=0 TSval=1163485 TSecr=29985076
  7 0.000563859 172.31.31.144 -> 172.31.23.72 TCP 66 6633 → 45518 [ACK] Seq=97 Ack=9097 Win=853 Len=0 TSval=1163485 TSecr=29985076
  8 0.000662072 172.31.31.144 -> 172.31.23.72 TCP 66 6633 → 45518 [ACK] Seq=97 Ack=9785 Win=853 Len=0 TSval=1163485 TSecr=29985076
  9 0.042398159 172.31.31.144 -> 172.31.23.72 TCP 122 6633 → 45520 [PSH, ACK] Seq=1 Ack=1 Win=853 Len=56 TSval=1163496 TSecr=29985004
 10 0.042415378 172.31.31.144 -> 172.31.23.72 TCP 106 6633 → 45520 [PSH, ACK] Seq=57 Ack=1 Win=853 Len=40 TSval=1163496 TSecr=29985004
 11 0.042753527 172.31.23.72 -> 172.31.31.144 OpenFlow 2426 Type: OFPT_MULTIPART_REPLY, OFPMP_FLOW
 12 0.043044257 172.31.23.72 -> 172.31.31.144 OpenFlow 6866 Type: OFPT_MULTIPART_REPLY, OFPMP_TABLE
 13 0.045137585 172.31.31.144 -> 172.31.23.72 TCP 66 6633 → 45520 [ACK] Seq=97 Ack=2361 Win=853 Len=0 TSval=1163496 TSecr=29985087
 14 0.045144890 172.31.31.144 -> 172.31.23.72 TCP 66 6633 → 45520 [ACK] Seq=97 Ack=9161 Win=853 Len=0 TSval=1163496 TSecr=29985087
 15 0.080439565 172.31.31.144 -> 172.31.23.72 TCP 90 6633 → 45522 [PSH, ACK] Seq=1 Ack=1 Win=853 Len=24 TSval=1163505 TSecr=29985004
 16 0.080451799 172.31.31.144 -> 172.31.23.72 TCP 138 6633 → 45522 [PSH, ACK] Seq=25 Ack=1 Win=853 Len=72 TSval=1163505 TSecr=29985004
 17 0.080618951 172.31.23.72 -> 172.31.31.144 OpenFlow 530 Type: OFPT_MULTIPART_REPLY, OFPMP_PORT_STATS
 18 0.080797619 172.31.23.72 -> 172.31.31.144 OpenFlow 6178 Type: OFPT_MULTIPART_REPLY, OFPMP_TABLE
 19 0.080849441 172.31.23.72 -> 172.31.31.144 OpenFlow 1386 Type: OFPT_MULTIPART_REPLY, OFPMP_FLOW
 20 0.080949786 172.31.31.144 -> 172.31.23.72 TCP 66 6633 → 45522 [ACK] Seq=97 Ack=465 Win=853 Len=0 TSval=1163505 TSecr=29985096
 21 0.081153367 172.31.31.144 -> 172.31.23.72 TCP 66 6633 → 45522 [ACK] Seq=97 Ack=6577 Win=853 Len=0 TSval=1163505 TSecr=29985096
 22 0.081157486 172.31.31.144 -> 172.31.23.72 TCP 66 6633 → 45522 [ACK] Seq=97 Ack=7897 Win=853 Len=0 TSval=1163505 TSecr=29985096
 23 0.126040455 172.31.31.144 -> 172.31.23.72 TCP 122 6633 → 45524 [PSH, ACK] Seq=1 Ack=1 Win=853 Len=56 TSval=1163516 TSecr=29985004
 24 0.126074482 172.31.31.144 -> 172.31.23.72 TCP 106 6633 → 45524 [PSH, ACK] Seq=57 Ack=1 Win=853 Len=40 TSval=1163516 TSecr=29985004
 25 0.126368371 172.31.23.72 -> 172.31.31.144 OpenFlow 1802 Type: OFPT_MULTIPART_REPLY, OFPMP_FLOW
 26 0.126649495 172.31.23.72 -> 172.31.31.144 OpenFlow 6866 Type: OFPT_MULTIPART_REPLY, OFPMP_TABLE
 27 0.128498372 172.31.31.144 -> 172.31.23.72 TCP 66 6633 → 45524 [ACK] Seq=97 Ack=1737 Win=853 Len=0 TSval=1163517 TSecr=29985108
 28 0.128506774 172.31.31.144 -> 172.31.23.72 TCP 66 6633 → 45524 [ACK] Seq=97 Ack=8537 Win=853 Len=0 TSval=1163517 TSecr=29985108
 29 0.167777817 172.31.31.144 -> 172.31.23.72 TCP 90 6633 → 45526 [PSH, ACK] Seq=1 Ack=1 Win=853 Len=24 TSval=1163527 TSecr=29984989
 30 0.167795880 172.31.23.72 -> 172.31.31.144 TCP 66 45526 → 6633 [ACK] Seq=1 Ack=25 Win=213 Len=0 TSval=29985118 TSecr=1163527
 31 0.167801169 172.31.31.144 -> 172.31.23.72 TCP 138 6633 → 45526 [PSH, ACK] Seq=25 Ack=1 Win=853 Len=72 TSval=1163527 TSecr=29984989
 32 0.167804579 172.31.23.72 -> 172.31.31.144 TCP 66 45526 → 6633 [ACK] Seq=1 Ack=97 Win=213 Len=0 TSval=29985118 TSecr=1163527
 33 0.168068965 172.31.23.72 -> 172.31.31.144 OpenFlow 642 Type: OFPT_MULTIPART_REPLY, OFPMP_PORT_STATS
 34 0.168135208 172.31.23.72 -> 172.31.31.144 OpenFlow 1802 Type: OFPT_MULTIPART_REPLY, OFPMP_FLOW
 35 0.168284431 172.31.23.72 -> 172.31.31.144 OpenFlow 6178 Type: OFPT_MULTIPART_REPLY, OFPMP_TABLE
 36 0.173510796 172.31.31.144 -> 172.31.23.72 TCP 66 6633 → 45526 [ACK] Seq=97 Ack=577 Win=853 Len=0 TSval=1163528 TSecr=29985118
 37 0.173518519 172.31.31.144 -> 172.31.23.72 TCP 66 6633 → 45526 [ACK] Seq=97 Ack=2313 Win=853 Len=0 TSval=1163528 TSecr=29985118
 38 0.173520491 172.31.31.144 -> 172.31.23.72 TCP 66 6633 → 45526 [ACK] Seq=97 Ack=8425 Win=853 Len=0 TSval=1163528 TSecr=29985118
 39 0.230204157 172.31.31.144 -> 172.31.23.72 TCP 82 6633 → 45528 [PSH, ACK] Seq=1 Ack=1 Win=853 Len=16 TSval=1163542 TSecr=29985004
 40 0.230219845 172.31.31.144 -> 172.31.23.72 TCP 146 6633 → 45528 [PSH, ACK] Seq=17 Ack=1 Win=853 Len=80 TSval=1163542 TSecr=29985004
 41 0.230537110 172.31.23.72 -> 172.31.31.144 OpenFlow 6178 Type: OFPT_MULTIPART_REPLY, OFPMP_TABLE
 42 0.232466079 172.31.23.72 -> 172.31.31.144 OpenFlow 4154 Type: OFPT_MULTIPART_REPLY, OFPMP_PORT_STATS
 43 0.237026613 172.31.31.144 -> 172.31.23.72 TCP 66 6633 → 45528 [ACK] Seq=97 Ack=6113 Win=853 Len=0 TSval=1163543 TSecr=29985134
 44 0.237035082 172.31.31.144 -> 172.31.23.72 TCP 66 6633 → 45528 [ACK] Seq=97 Ack=10201 Win=853 Len=0 TSval=1163543 TSecr=29985134
 45 0.265168276 172.31.31.144 -> 172.31.23.72 TCP 82 6633 → 45530 [PSH, ACK] Seq=1 Ack=1 Win=853 Len=16 TSval=1163551 TSecr=29984979
 46 0.265181041 172.31.31.144 -> 172.31.23.72 TCP 146 6633 → 45530 [PSH, ACK] Seq=17 Ack=1 Win=853 Len=80 TSval=1163551 TSecr=29984979
 47 0.265487883 172.31.23.72 -> 172.31.31.144 OpenFlow 6178 Type: OFPT_MULTIPART_REPLY, OFPMP_TABLE
 48 0.267520287 172.31.23.72 -> 172.31.31.144 OpenFlow 2378 Type: OFPT_MULTIPART_REPLY, OFPMP_PORT_STATS
 49 0.269885808 172.31.31.144 -> 172.31.23.72 TCP 66 6633 → 45530 [ACK] Seq=97 Ack=6113 Win=853 Len=0 TSval=1163552 TSecr=29985142
 50 0.269895151 172.31.31.144 -> 172.31.23.72 TCP 66 6633 → 45530 [ACK] Seq=97 Ack=8425 Win=853 Len=0 TSval=1163552 TSecr=29985143
 51 0.341022304 172.31.31.144 -> 172.31.23.72 TCP 90 6633 → 45532 [PSH, ACK] Seq=1 Ack=1 Win=853 Len=24 TSval=1163570 TSecr=29984979
 52 0.341048185 172.31.31.144 -> 172.31.23.72 TCP 82 6633 → 45532 [PSH, ACK] Seq=25 Ack=1 Win=853 Len=16 TSval=1163570 TSecr=29984979
 53 0.341051992 172.31.31.144 -> 172.31.23.72 TCP 122 6633 → 45532 [PSH, ACK] Seq=41 Ack=1 Win=853 Len=56 TSval=1163570 TSecr=29984979
 54 0.341373998 172.31.23.72 -> 172.31.31.144 OpenFlow 642 Type: OFPT_MULTIPART_REPLY, OFPMP_PORT_STATS
 55 0.341554191 172.31.23.72 -> 172.31.31.144 OpenFlow 6178 Type: OFPT_MULTIPART_REPLY, OFPMP_TABLE
 56 0.342688573 172.31.23.72 -> 172.31.31.144 OpenFlow 970 Type: OFPT_MULTIPART_REPLY, OFPMP_FLOW
 57 0.344463955 172.31.31.144 -> 172.31.23.72 TCP 66 6633 → 45532 [ACK] Seq=97 Ack=577 Win=853 Len=0 TSval=1163571 TSecr=29985161
 58 0.344471453 172.31.31.144 -> 172.31.23.72 TCP 66 6633 → 45532 [ACK] Seq=97 Ack=6689 Win=853 Len=0 TSval=1163571 TSecr=29985161
 59 0.344473770 172.31.31.144 -> 172.31.23.72 TCP 66 6633 → 45532 [ACK] Seq=97 Ack=7593 Win=853 Len=0 TSval=1163571 TSecr=29985162
 60 0.384856964 172.31.31.144 -> 172.31.23.72 TCP 90 6633 → 45534 [PSH, ACK] Seq=1 Ack=1 Win=853 Len=24 TSval=1163581 TSecr=29985004
 61 0.384894173 172.31.31.144 -> 172.31.23.72 TCP 122 6633 → 45534 [PSH, ACK] Seq=25 Ack=1 Win=853 Len=56 TSval=1163581 TSecr=29985004
 62 0.385160313 172.31.23.72 -> 172.31.31.144 OpenFlow 530 Type: OFPT_MULTIPART_REPLY, OFPMP_PORT_STATS
 63 0.386634908 172.31.31.144 -> 172.31.23.72 OpenFlow 82 Type: OFPT_MULTIPART_REQUEST, OFPMP_TABLE
 64 0.386648463 172.31.23.72 -> 172.31.31.144 OpenFlow 1178 Type: OFPT_MULTIPART_REPLY, OFPMP_FLOW
 65 0.386864925 172.31.23.72 -> 172.31.31.144 OpenFlow 6178 Type: OFPT_MULTIPART_REPLY, OFPMP_TABLE
 66 0.387475582 172.31.31.144 -> 172.31.23.72 TCP 66 6633 → 45534 [ACK] Seq=97 Ack=465 Win=853 Len=0 TSval=1163582 TSecr=29985172
 67 0.387483069 172.31.31.144 -> 172.31.23.72 TCP 66 6633 → 45534 [ACK] Seq=97 Ack=1577 Win=853 Len=0 TSval=1163582 TSecr=29985173
 68 0.387685676 172.31.31.144 -> 172.31.23.72 TCP 66 6633 → 45534 [ACK] Seq=97 Ack=7689 Win=853 Len=0 TSval=1163582 TSecr=29985173
 69 0.436717122 172.31.31.144 -> 172.31.23.72 TCP 122 6633 → 45536 [PSH, ACK] Seq=1 Ack=1 Win=853 Len=56 TSval=1163594 TSecr=29985003
 70 0.436735630 172.31.31.144 -> 172.31.23.72 TCP 106 6633 → 45536 [PSH, ACK] Seq=57 Ack=1 Win=853 Len=40 TSval=1163594 TSecr=29985003
 71 0.436931027 172.31.23.72 -> 172.31.31.144 OpenFlow 1178 Type: OFPT_MULTIPART_REPLY, OFPMP_FLOW
 72 0.437087000 172.31.23.72 -> 172.31.31.144 OpenFlow 6178 Type: OFPT_MULTIPART_REPLY, OFPMP_TABLE
 73 0.439303272 172.31.23.72 -> 172.31.31.144 OpenFlow 530 Type: OFPT_MULTIPART_REPLY, OFPMP_PORT_STATS
 74 0.439389766 172.31.31.144 -> 172.31.23.72 TCP 66 6633 → 45536 [ACK] Seq=97 Ack=1113 Win=853 Len=0 TSval=1163595 TSecr=29985185
 75 0.445986998 172.31.31.144 -> 172.31.23.72 TCP 66 6633 → 45536 [ACK] Seq=97 Ack=7225 Win=853 Len=0 TSval=1163595 TSecr=29985185
 76 0.445992458 172.31.31.144 -> 172.31.23.72 TCP 66 6633 → 45536 [ACK] Seq=97 Ack=7689 Win=853 Len=0 TSval=1163595 TSecr=29985186
 77 0.483750686 172.31.31.144 -> 172.31.23.72 TCP 82 6633 → 45538 [PSH, ACK] Seq=1 Ack=1 Win=853 Len=16 TSval=1163606 TSecr=29985004
 78 0.483762867 172.31.23.72 -> 172.31.31.144 TCP 66 45538 → 6633 [ACK] Seq=1 Ack=17 Win=213 Len=0 TSval=29985197 TSecr=1163606
 79 0.483772892 172.31.31.144 -> 172.31.23.72 TCP 146 6633 → 45538 [PSH, ACK] Seq=17 Ack=1 Win=853 Len=80 TSval=1163606 TSecr=29985004
 80 0.483776352 172.31.23.72 -> 172.31.31.144 TCP 66 45538 → 6633 [ACK] Seq=1 Ack=97 Win=213 Len=0 TSval=29985197 TSecr=1163606
 81 0.483993006 172.31.23.72 -> 172.31.31.144 OpenFlow 6178 Type: OFPT_MULTIPART_REPLY, OFPMP_TABLE
 82 0.484093491 172.31.23.72 -> 172.31.31.144 OpenFlow 754 Type: OFPT_MULTIPART_REPLY, OFPMP_PORT_STATS
 83 0.484183297 172.31.23.72 -> 172.31.31.144 OpenFlow 3050 Type: OFPT_MULTIPART_REPLY, OFPMP_FLOW
 84 0.484318178 172.31.31.144 -> 172.31.23.72 TCP 66 6633 → 45538 [ACK] Seq=97 Ack=6113 Win=853 Len=0 TSval=1163606 TSecr=29985197
 85 0.484324415 172.31.31.144 -> 172.31.23.72 TCP 66 6633 → 45538 [ACK] Seq=97 Ack=6801 Win=853 Len=0 TSval=1163606 TSecr=29985197
 86 0.484452258 172.31.31.144 -> 172.31.23.72 TCP 66 6633 → 45538 [ACK] Seq=97 Ack=9785 Win=853 Len=0 TSval=1163606 TSecr=29985197
 87 0.537751778 172.31.31.144 -> 172.31.23.72 TCP 90 6633 → 45540 [PSH, ACK] Seq=1 Ack=1 Win=853 Len=24 TSval=1163618 TSecr=29985004
 88 0.537768929 172.31.31.144 -> 172.31.23.72 TCP 82 6633 → 45540 [PSH, ACK] Seq=25 Ack=1 Win=853 Len=16 TSval=1163619 TSecr=29985004
 89 0.537771920 172.31.31.144 -> 172.31.23.72 TCP 122 6633 → 45540 [PSH, ACK] Seq=41 Ack=1 Win=853 Len=56 TSval=1163619 TSecr=29985004
 90 0.538095869 172.31.23.72 -> 172.31.31.144 ESP 754 ESP (SPI=0x041302b0)
 91 0.538257928 172.31.23.72 -> 172.31.31.144 OpenFlow 6178 Type: OFPT_MULTIPART_REPLY, OFPMP_TABLE
 92 0.540572388 172.31.23.72 -> 172.31.31.144 OpenFlow 2426 Type: OFPT_MULTIPART_REPLY, OFPMP_FLOW
 93 0.543677978 172.31.31.144 -> 172.31.23.72 TCP 66 6633 → 45540 [ACK] Seq=97 Ack=689 Win=853 Len=0 TSval=1163620 TSecr=29985211
 94 0.543684890 172.31.31.144 -> 172.31.23.72 TCP 66 6633 → 45540 [ACK] Seq=97 Ack=6801 Win=853 Len=0 TSval=1163620 TSecr=29985211
 95 0.545601615 172.31.31.144 -> 172.31.23.72 TCP 66 6633 → 45540 [ACK] Seq=97 Ack=9161 Win=853 Len=0 TSval=1163621 TSecr=29985211
 96 0.585888674 172.31.31.144 -> 172.31.23.72 TCP 82 6633 → 45542 [PSH, ACK] Seq=1 Ack=1 Win=853 Len=16 TSval=1163631 TSecr=29985003
 97 0.585903641 172.31.31.144 -> 172.31.23.72 TCP 146 6633 → 45542 [PSH, ACK] Seq=17 Ack=1 Win=853 Len=80 TSval=1163631 TSecr=29985003
 98 0.586301049 172.31.23.72 -> 172.31.31.144 OpenFlow 6178 Type: OFPT_MULTIPART_REPLY, OFPMP_TABLE
 99 0.588311844 172.31.23.72 -> 172.31.31.144 OpenFlow 2474 Type: OFPT_MULTIPART_REPLY, OFPMP_PORT_STATS
100 0.590536032 172.31.31.144 -> 172.31.23.72 TCP 66 6633 → 45542 [ACK] Seq=97 Ack=6113 Win=853 Len=0 TSval=1163632 TSecr=29985223
101 0.590544011 172.31.31.144 -> 172.31.23.72 TCP 66 6633 → 45542 [ACK] Seq=97 Ack=8521 Win=853 Len=0 TSval=1163632 TSecr=29985223
102 0.650583126 172.31.31.144 -> 172.31.23.72 TCP 122 6633 → 45544 [PSH, ACK] Seq=1 Ack=1 Win=853 Len=56 TSval=1163647 TSecr=29984978
103 0.650610823 172.31.31.144 -> 172.31.23.72 TCP 106 6633 → 45544 [PSH, ACK] Seq=57 Ack=1 Win=853 Len=40 TSval=1163647 TSecr=29984978
104 0.650927309 172.31.23.72 -> 172.31.31.144 OpenFlow 2842 Type: OFPT_MULTIPART_REPLY, OFPMP_FLOW
105 0.651096430 172.31.23.72 -> 172.31.31.144 OpenFlow 6178 Type: OFPT_MULTIPART_REPLY, OFPMP_TABLE
106 0.652730442 172.31.23.72 -> 172.31.31.144 OpenFlow 530 Type: OFPT_MULTIPART_REPLY, OFPMP_PORT_STATS
107 0.657251866 172.31.31.144 -> 172.31.23.72 TCP 66 6633 → 45544 [ACK] Seq=97 Ack=2777 Win=853 Len=0 TSval=1163648 TSecr=29985239
108 0.657261264 172.31.31.144 -> 172.31.23.72 TCP 66 6633 → 45544 [ACK] Seq=97 Ack=8889 Win=853 Len=0 TSval=1163648 TSecr=29985239
109 0.657263336 172.31.31.144 -> 172.31.23.72 TCP 66 6633 → 45544 [ACK] Seq=97 Ack=9353 Win=853 Len=0 TSval=1163648 TSecr=29985239
110 0.706869016 172.31.31.144 -> 172.31.23.72 TCP 122 6633 → 45546 [PSH, ACK] Seq=1 Ack=1 Win=853 Len=56 TSval=1163662 TSecr=29985004
111 0.706893656 172.31.31.144 -> 172.31.23.72 TCP 106 6633 → 45546 [PSH, ACK] Seq=57 Ack=1 Win=853 Len=40 TSval=1163662 TSecr=29985004
112 0.707128534 172.31.23.72 -> 172.31.31.144 OpenFlow 2218 Type: OFPT_MULTIPART_REPLY, OFPMP_FLOW
113 0.707304819 172.31.23.72 -> 172.31.31.144 OpenFlow 6178 Type: OFPT_MULTIPART_REPLY, OFPMP_TABLE
114 0.709199082 172.31.23.72 -> 172.31.31.144 OpenFlow 642 Type: OFPT_MULTIPART_REPLY, OFPMP_PORT_STATS
115 0.712906275 172.31.31.144 -> 172.31.23.72 TCP 66 6633 → 45546 [ACK] Seq=97 Ack=2153 Win=853 Len=0 TSval=1163662 TSecr=29985253
116 0.712914415 172.31.31.144 -> 172.31.23.72 TCP 66 6633 → 45546 [ACK] Seq=97 Ack=8265 Win=853 Len=0 TSval=1163662 TSecr=29985253
117 0.712916649 172.31.31.144 -> 172.31.23.72 TCP 66 6633 → 45546 [ACK] Seq=97 Ack=8841 Win=853 Len=0 TSval=1163662 TSecr=29985253
118 0.774178905 172.31.31.144 -> 172.31.23.72 TCP 122 6633 → 45548 [PSH, ACK] Seq=1 Ack=1 Win=853 Len=56 TSval=1163678 TSecr=29985003
119 0.774194587 172.31.31.144 -> 172.31.23.72 TCP 90 6633 → 45548 [PSH, ACK] Seq=57 Ack=1 Win=853 Len=24 TSval=1163678 TSecr=29985003
120 0.774197328 172.31.31.144 -> 172.31.23.72 TCP 82 6633 → 45548 [PSH, ACK] Seq=81 Ack=1 Win=853 Len=16 TSval=1163678 TSecr=29985003
121 0.774555103 172.31.23.72 -> 172.31.31.144 OpenFlow 2426 Type: OFPT_MULTIPART_REPLY, OFPMP_FLOW
122 0.774789807 172.31.23.72 -> 172.31.31.144 OpenFlow 6754 Type: OFPT_MULTIPART_REPLY, OFPMP_TABLE
123 0.781575871 172.31.31.144 -> 172.31.23.72 TCP 66 6633 → 45548 [ACK] Seq=97 Ack=2361 Win=853 Len=0 TSval=1163679 TSecr=29985270
124 0.781590000 172.31.31.144 -> 172.31.23.72 TCP 66 6633 → 45548 [ACK] Seq=97 Ack=9049 Win=853 Len=0 TSval=1163679 TSecr=29985270
125 0.834964250 172.31.31.144 -> 172.31.23.72 TCP 90 6633 → 45550 [PSH, ACK] Seq=1 Ack=1 Win=853 Len=24 TSval=1163694 TSecr=29985004
126 0.834987540 172.31.31.144 -> 172.31.23.72 TCP 138 6633 → 45550 [PSH, ACK] Seq=25 Ack=1 Win=853 Len=72 TSval=1163694 TSecr=29985004
127 0.835285977 172.31.23.72 -> 172.31.31.144 OpenFlow 642 Type: OFPT_MULTIPART_REPLY, OFPMP_PORT_STATS
128 0.835456454 172.31.23.72 -> 172.31.31.144 OpenFlow 6178 Type: OFPT_MULTIPART_REPLY, OFPMP_TABLE
129 0.835510152 172.31.23.72 -> 172.31.31.144 OpenFlow 554 Type: OFPT_MULTIPART_REPLY, OFPMP_FLOW
130 0.835544601 172.31.31.144 -> 172.31.23.72 TCP 66 6633 → 45550 [ACK] Seq=97 Ack=577 Win=853 Len=0 TSval=1163694 TSecr=29985285
131 0.835729684 172.31.31.144 -> 172.31.23.72 TCP 66 6633 → 45550 [ACK] Seq=97 Ack=6689 Win=853 Len=0 TSval=1163694 TSecr=29985285
132 0.835745492 172.31.31.144 -> 172.31.23.72 TCP 66 6633 → 45550 [ACK] Seq=97 Ack=7177 Win=853 Len=0 TSval=1163694 TSecr=29985285
133 0.874223183 172.31.31.144 -> 172.31.23.72 TCP 90 6633 → 45552 [PSH, ACK] Seq=1 Ack=1 Win=853 Len=24 TSval=1163704 TSecr=29985004
134 0.874236026 172.31.31.144 -> 172.31.23.72 TCP 138 6633 → 45552 [PSH, ACK] Seq=25 Ack=1 Win=853 Len=72 TSval=1163704 TSecr=29985004
135 0.874498453 172.31.23.72 -> 172.31.31.144 OpenFlow 642 Type: OFPT_MULTIPART_REPLY, OFPMP_PORT_STATS
136 0.874654094 172.31.23.72 -> 172.31.31.144 OpenFlow 6178 Type: OFPT_MULTIPART_REPLY, OFPMP_TABLE
137 0.874727120 172.31.31.144 -> 172.31.23.72 TCP 66 6633 → 45552 [ACK] Seq=97 Ack=577 Win=853 Len=0 TSval=1163704 TSecr=29985295
138 0.874741572 172.31.23.72 -> 172.31.31.144 OpenFlow 2010 Type: OFPT_MULTIPART_REPLY, OFPMP_FLOW
139 0.874908795 172.31.31.144 -> 172.31.23.72 TCP 66 6633 → 45552 [ACK] Seq=97 Ack=6689 Win=853 Len=0 TSval=1163704 TSecr=29985295
140 0.874972865 172.31.31.144 -> 172.31.23.72 TCP 66 6633 → 45552 [ACK] Seq=97 Ack=8633 Win=853 Len=0 TSval=1163704 TSecr=29985295
141 0.903383863 172.31.31.144 -> 172.31.23.72 TCP 90 6633 → 45554 [PSH, ACK] Seq=1 Ack=1 Win=853 Len=24 TSval=1163711 TSecr=29985004
142 0.903398136 172.31.31.144 -> 172.31.23.72 TCP 138 6633 → 45554 [PSH, ACK] Seq=25 Ack=1 Win=853 Len=72 TSval=1163711 TSecr=29985004
143 0.903625480 172.31.23.72 -> 172.31.31.144 OpenFlow 530 Type: OFPT_MULTIPART_REPLY, OFPMP_PORT_STATS
144 0.903772092 172.31.23.72 -> 172.31.31.144 OpenFlow 6178 Type: OFPT_MULTIPART_REPLY, OFPMP_TABLE
145 0.903833743 172.31.23.72 -> 172.31.31.144 OpenFlow 2010 Type: OFPT_MULTIPART_REPLY, OFPMP_FLOW
146 0.903883549 172.31.31.144 -> 172.31.23.72 TCP 66 6633 → 45554 [ACK] Seq=97 Ack=465 Win=853 Len=0 TSval=1163711 TSecr=29985302
147 0.904035944 172.31.31.144 -> 172.31.23.72 TCP 66 6633 → 45554 [ACK] Seq=97 Ack=6577 Win=853 Len=0 TSval=1163711 TSecr=29985302
148 0.904100718 172.31.31.144 -> 172.31.23.72 TCP 66 6633 → 45554 [ACK] Seq=97 Ack=8521 Win=853 Len=0 TSval=1163711 TSecr=29985302
149 1.610328879 172.31.31.144 -> 172.31.23.72 TCP 90 6633 → 45508 [PSH, ACK] Seq=1 Ack=1 Win=853 Len=24 TSval=1163886 TSecr=29985026
150 1.610357574 172.31.31.144 -> 172.31.23.72 TCP 106 6633 → 45508 [PSH, ACK] Seq=25 Ack=1 Win=853 Len=40 TSval=1163886 TSecr=29985026
151 1.610635611 172.31.23.72 -> 172.31.31.144 OpenFlow 82 Type: OFPT_MULTIPART_REPLY, OFPMP_GROUP
152 1.612671814 172.31.23.72 -> 172.31.31.144 OpenFlow 98 Type: OFPT_MULTIPART_REPLY, OFPMP_METER
153 1.615191692 172.31.31.144 -> 172.31.23.72 TCP 66 6633 → 45508 [ACK] Seq=65 Ack=17 Win=853 Len=0 TSval=1163888 TSecr=29985479
154 1.615200246 172.31.31.144 -> 172.31.23.72 TCP 66 6633 → 45508 [ACK] Seq=65 Ack=49 Win=853 Len=0 TSval=1163888 TSecr=29985479
155 1.707058877 172.31.31.144 -> 172.31.23.72 TCP 90 6633 → 45510 [PSH, ACK] Seq=1 Ack=1 Win=853 Len=24 TSval=1163911 TSecr=29985046
156 1.707087760 172.31.31.144 -> 172.31.23.72 TCP 106 6633 → 45510 [PSH, ACK] Seq=25 Ack=1 Win=853 Len=40 TSval=1163911 TSecr=29985046
157 1.707091943 172.31.31.144 -> 172.31.23.72 TCP 90 6633 → 45512 [PSH, ACK] Seq=1 Ack=1 Win=853 Len=24 TSval=1163911 TSecr=29985047
158 1.707095401 172.31.31.144 -> 172.31.23.72 TCP 106 6633 → 45512 [PSH, ACK] Seq=25 Ack=1 Win=853 Len=40 TSval=1163911 TSecr=29985047
159 1.707314772 172.31.23.72 -> 172.31.31.144 OpenFlow 82 Type: OFPT_MULTIPART_REPLY, OFPMP_GROUP
160 1.707375227 172.31.23.72 -> 172.31.31.144 OpenFlow 82 Type: OFPT_MULTIPART_REPLY, OFPMP_GROUP
161 1.710989669 172.31.23.72 -> 172.31.31.144 OpenFlow 98 Type: OFPT_MULTIPART_REPLY, OFPMP_METER
162 1.710996204 172.31.23.72 -> 172.31.31.144 OpenFlow 98 Type: OFPT_MULTIPART_REPLY, OFPMP_METER
163 1.716744524 172.31.31.144 -> 172.31.23.72 TCP 66 6633 → 45512 [ACK] Seq=65 Ack=17 Win=853 Len=0 TSval=1163913 TSecr=29985503
164 1.720073264 172.31.31.144 -> 172.31.23.72 TCP 66 6633 → 45512 [ACK] Seq=65 Ack=49 Win=853 Len=0 TSval=1163914 TSecr=29985504
165 1.720079361 172.31.31.144 -> 172.31.23.72 TCP 66 6633 → 45510 [ACK] Seq=65 Ack=49 Win=853 Len=0 TSval=1163914 TSecr=29985503
166 1.808323719 172.31.31.144 -> 172.31.23.72 TCP 90 6633 → 45514 [PSH, ACK] Seq=1 Ack=1 Win=853 Len=24 TSval=1163936 TSecr=29985056
167 1.808346834 172.31.31.144 -> 172.31.23.72 OpenFlow 90 Type: OFPT_MULTIPART_REQUEST, OFPMP_GROUP
168 1.808349958 172.31.31.144 -> 172.31.23.72 TCP 90 6633 → 45516 [PSH, ACK] Seq=1 Ack=1 Win=853 Len=24 TSval=1163936 TSecr=29985066
169 1.808352606 172.31.31.144 -> 172.31.23.72 TCP 106 6633 → 45514 [PSH, ACK] Seq=25 Ack=1 Win=853 Len=40 TSval=1163936 TSecr=29985056
170 1.808355891 172.31.31.144 -> 172.31.23.72 TCP 106 6633 → 45516 [PSH, ACK] Seq=25 Ack=1 Win=853 Len=40 TSval=1163936 TSecr=29985066
171 1.808357375 172.31.31.144 -> 172.31.23.72 OpenFlow 106 Type: OFPT_MULTIPART_REQUEST, OFPMP_METER
172 1.808553822 172.31.23.72 -> 172.31.31.144 OpenFlow 82 Type: OFPT_MULTIPART_REPLY, OFPMP_GROUP
173 1.808586728 172.31.23.72 -> 172.31.31.144 OpenFlow 82 Type: OFPT_MULTIPART_REPLY, OFPMP_GROUP
174 1.808694058 172.31.23.72 -> 172.31.31.144 OpenFlow 82 Type: OFPT_MULTIPART_REPLY, OFPMP_GROUP
175 1.811951804 172.31.23.72 -> 172.31.31.144 OpenFlow 98 Type: OFPT_MULTIPART_REPLY, OFPMP_METER
176 1.811958059 172.31.23.72 -> 172.31.31.144 OpenFlow 98 Type: OFPT_MULTIPART_REPLY, OFPMP_METER
177 1.813331354 172.31.31.144 -> 172.31.23.72 TCP 66 6633 → 45514 [ACK] Seq=65 Ack=17 Win=853 Len=0 TSval=1163938 TSecr=29985528
178 1.813349981 172.31.31.144 -> 172.31.23.72 TCP 66 6633 → 45518 [ACK] Seq=161 Ack=9801 Win=853 Len=0 TSval=1163938 TSecr=29985528
179 1.813352142 172.31.31.144 -> 172.31.23.72 TCP 66 6633 → 45516 [ACK] Seq=65 Ack=17 Win=853 Len=0 TSval=1163938 TSecr=29985528
180 1.813355719 172.31.23.72 -> 172.31.31.144 OpenFlow 98 Type: OFPT_MULTIPART_REPLY, OFPMP_METER
181 1.814413175 172.31.31.144 -> 172.31.23.72 TCP 66 6633 → 45514 [ACK] Seq=65 Ack=49 Win=853 Len=0 TSval=1163938 TSecr=29985529
182 1.814417920 172.31.31.144 -> 172.31.23.72 TCP 66 6633 → 45518 [ACK] Seq=161 Ack=9833 Win=853 Len=0 TSval=1163938 TSecr=29985529
183 1.817611864 172.31.31.144 -> 172.31.23.72 TCP 66 6633 → 45516 [ACK] Seq=65 Ack=49 Win=853 Len=0 TSval=1163939 TSecr=29985529
184 1.903256044 06:be:66:4e:57:f9 -> 06:a7:bc:8b:a8:cd ARP 56 Who has 172.31.23.72? Tell 172.31.16.1
185 1.903270209 06:a7:bc:8b:a8:cd -> 06:be:66:4e:57:f9 ARP 42 172.31.23.72 is at 06:a7:bc:8b:a8:cd
186 1.905979206 172.31.31.144 -> 172.31.23.72 OpenFlow 90 Type: OFPT_MULTIPART_REQUEST, OFPMP_GROUP
187 1.906001787 172.31.31.144 -> 172.31.23.72 OpenFlow 90 Type: OFPT_MULTIPART_REQUEST, OFPMP_GROUP
188 1.906019402 172.31.31.144 -> 172.31.23.72 OpenFlow 106 Type: OFPT_MULTIPART_REQUEST, OFPMP_METER
189 1.906022996 172.31.31.144 -> 172.31.23.72 OpenFlow 106 Type: OFPT_MULTIPART_REQUEST, OFPMP_METER
190 1.906265545 172.31.23.72 -> 172.31.31.144 OpenFlow 82 Type: OFPT_MULTIPART_REPLY, OFPMP_GROUP
191 1.906297463 172.31.23.72 -> 172.31.31.144 OpenFlow 98 Type: OFPT_MULTIPART_REPLY, OFPMP_METER
192 1.906379553 172.31.23.72 -> 172.31.31.144 OpenFlow 82 Type: OFPT_MULTIPART_REPLY, OFPMP_GROUP
193 1.906403390 172.31.23.72 -> 172.31.31.144 OpenFlow 98 Type: OFPT_MULTIPART_REPLY, OFPMP_METER
194 1.906490114 172.31.31.144 -> 172.31.23.72 TCP 66 6633 → 45522 [ACK] Seq=161 Ack=7913 Win=853 Len=0 TSval=1163962 TSecr=29985553
195 1.906520521 172.31.31.144 -> 172.31.23.72 TCP 66 6633 → 45522 [ACK] Seq=161 Ack=7945 Win=853 Len=0 TSval=1163962 TSecr=29985553
196 1.906620612 172.31.31.144 -> 172.31.23.72 TCP 66 6633 → 45520 [ACK] Seq=161 Ack=9177 Win=853 Len=0 TSval=1163962 TSecr=29985553
197 1.906636387 172.31.31.144 -> 172.31.23.72 TCP 66 6633 → 45520 [ACK] Seq=161 Ack=9209 Win=853 Len=0 TSval=1163962 TSecr=29985553
198 2.006094432 172.31.31.144 -> 172.31.23.72 OpenFlow 90 Type: OFPT_MULTIPART_REQUEST, OFPMP_GROUP
199 2.006116507 172.31.31.144 -> 172.31.23.72 OpenFlow 90 Type: OFPT_MULTIPART_REQUEST, OFPMP_GROUP
200 2.006129498 172.31.31.144 -> 172.31.23.72 OpenFlow 106 Type: OFPT_MULTIPART_REQUEST, OFPMP_METER
201 2.006133492 172.31.31.144 -> 172.31.23.72 OpenFlow 106 Type: OFPT_MULTIPART_REQUEST, OFPMP_METER
202 2.006323228 172.31.23.72 -> 172.31.31.144 OpenFlow 82 Type: OFPT_MULTIPART_REPLY, OFPMP_GROUP
203 2.006352862 172.31.23.72 -> 172.31.31.144 OpenFlow 98 Type: OFPT_MULTIPART_REPLY, OFPMP_METER
204 2.006381601 172.31.23.72 -> 172.31.31.144 OpenFlow 82 Type: OFPT_MULTIPART_REPLY, OFPMP_GROUP
205 2.006430608 172.31.23.72 -> 172.31.31.144 OpenFlow 98 Type: OFPT_MULTIPART_REPLY, OFPMP_METER
206 2.006560390 172.31.31.144 -> 172.31.23.72 TCP 66 6633 → 45524 [ACK] Seq=161 Ack=8553 Win=853 Len=0 TSval=1163987 TSecr=29985578
207 2.006568965 172.31.31.144 -> 172.31.23.72 TCP 66 6633 → 45524 [ACK] Seq=161 Ack=8585 Win=853 Len=0 TSval=1163987 TSecr=29985578
208 2.006596944 172.31.31.144 -> 172.31.23.72 TCP 66 6633 → 45526 [ACK] Seq=161 Ack=8441 Win=853 Len=0 TSval=1163987 TSecr=29985578
209 2.006645237 172.31.31.144 -> 172.31.23.72 TCP 66 6633 → 45526 [ACK] Seq=161 Ack=8473 Win=853 Len=0 TSval=1163987 TSecr=29985578
210 2.106276825 172.31.31.144 -> 172.31.23.72 OpenFlow 90 Type: OFPT_MULTIPART_REQUEST, OFPMP_GROUP
211 2.106303075 172.31.31.144 -> 172.31.23.72 OpenFlow 90 Type: OFPT_MULTIPART_REQUEST, OFPMP_GROUP
212 2.106324978 172.31.31.144 -> 172.31.23.72 OpenFlow 106 Type: OFPT_MULTIPART_REQUEST, OFPMP_METER
213 2.106329558 172.31.31.144 -> 172.31.23.72 OpenFlow 106 Type: OFPT_MULTIPART_REQUEST, OFPMP_METER
214 2.106518909 172.31.23.72 -> 172.31.31.144 OpenFlow 82 Type: OFPT_MULTIPART_REPLY, OFPMP_GROUP
215 2.106550794 172.31.23.72 -> 172.31.31.144 OpenFlow 98 Type: OFPT_MULTIPART_REPLY, OFPMP_METER
216 2.106570732 172.31.23.72 -> 172.31.31.144 OpenFlow 82 Type: OFPT_MULTIPART_REPLY, OFPMP_GROUP
217 2.106625045 172.31.23.72 -> 172.31.31.144 OpenFlow 98 Type: OFPT_MULTIPART_REPLY, OFPMP_METER
218 2.106739011 172.31.31.144 -> 172.31.23.72 TCP 66 6633 → 45530 [ACK] Seq=161 Ack=8441 Win=853 Len=0 TSval=1164012 TSecr=29985603
219 2.106759663 172.31.31.144 -> 172.31.23.72 TCP 66 6633 → 45530 [ACK] Seq=161 Ack=8473 Win=853 Len=0 TSval=1164012 TSecr=29985603
220 2.106823648 172.31.31.144 -> 172.31.23.72 TCP 66 6633 → 45528 [ACK] Seq=161 Ack=10217 Win=853 Len=0 TSval=1164012 TSecr=29985603
221 2.106851480 172.31.31.144 -> 172.31.23.72 TCP 66 6633 → 45528 [ACK] Seq=161 Ack=10249 Win=853 Len=0 TSval=1164012 TSecr=29985603
222 2.206459490 172.31.31.144 -> 172.31.23.72 OpenFlow 90 Type: OFPT_MULTIPART_REQUEST, OFPMP_GROUP
223 2.206493723 172.31.31.144 -> 172.31.23.72 OpenFlow 90 Type: OFPT_MULTIPART_REQUEST, OFPMP_GROUP
224 2.206497543 172.31.31.144 -> 172.31.23.72 OpenFlow 106 Type: OFPT_MULTIPART_REQUEST, OFPMP_METER
225 2.206500783 172.31.31.144 -> 172.31.23.72 OpenFlow 106 Type: OFPT_MULTIPART_REQUEST, OFPMP_METER
226 2.206685887 172.31.23.72 -> 172.31.31.144 OpenFlow 82 Type: OFPT_MULTIPART_REPLY, OFPMP_GROUP
227 2.206715048 172.31.23.72 -> 172.31.31.144 OpenFlow 98 Type: OFPT_MULTIPART_REPLY, OFPMP_METER
228 2.206768698 172.31.23.72 -> 172.31.31.144 OpenFlow 82 Type: OFPT_MULTIPART_REPLY, OFPMP_GROUP
229 2.206789864 172.31.23.72 -> 172.31.31.144 OpenFlow 98 Type: OFPT_MULTIPART_REPLY, OFPMP_METER
230 2.206954257 172.31.31.144 -> 172.31.23.72 TCP 66 6633 → 45534 [ACK] Seq=161 Ack=7705 Win=853 Len=0 TSval=1164037 TSecr=29985628
231 2.206961634 172.31.31.144 -> 172.31.23.72 TCP 66 6633 → 45534 [ACK] Seq=161 Ack=7737 Win=853 Len=0 TSval=1164037 TSecr=29985628
232 2.207055188 172.31.31.144 -> 172.31.23.72 TCP 66 6633 → 45532 [ACK] Seq=161 Ack=7609 Win=853 Len=0 TSval=1164037 TSecr=29985628
233 2.207078935 172.31.31.144 -> 172.31.23.72 TCP 66 6633 → 45532 [ACK] Seq=161 Ack=7641 Win=853 Len=0 TSval=1164037 TSecr=29985628
234 2.305621331 172.31.31.144 -> 172.31.23.72 OpenFlow 90 Type: OFPT_MULTIPART_REQUEST, OFPMP_GROUP
235 2.305643261 172.31.31.144 -> 172.31.23.72 OpenFlow 90 Type: OFPT_MULTIPART_REQUEST, OFPMP_GROUP
236 2.305646865 172.31.31.144 -> 172.31.23.72 OpenFlow 106 Type: OFPT_MULTIPART_REQUEST, OFPMP_METER
237 2.305650012 172.31.31.144 -> 172.31.23.72 OpenFlow 106 Type: OFPT_MULTIPART_REQUEST, OFPMP_METER
238 2.305859404 172.31.23.72 -> 172.31.31.144 OpenFlow 82 Type: OFPT_MULTIPART_REPLY, OFPMP_GROUP
239 2.305891813 172.31.23.72 -> 172.31.31.144 OpenFlow 98 Type: OFPT_MULTIPART_REPLY, OFPMP_METER
240 2.305980114 172.31.23.72 -> 172.31.31.144 OpenFlow 82 Type: OFPT_MULTIPART_REPLY, OFPMP_GROUP
241 2.306011438 172.31.23.72 -> 172.31.31.144 OpenFlow 98 Type: OFPT_MULTIPART_REPLY, OFPMP_METER
242 2.306080061 172.31.31.144 -> 172.31.23.72 TCP 66 6633 → 45538 [ACK] Seq=161 Ack=9801 Win=853 Len=0 TSval=1164062 TSecr=29985653
243 2.306101113 172.31.31.144 -> 172.31.23.72 TCP 66 6633 → 45538 [ACK] Seq=161 Ack=9833 Win=853 Len=0 TSval=1164062 TSecr=29985653
244 2.306201171 172.31.31.144 -> 172.31.23.72 TCP 66 6633 → 45536 [ACK] Seq=161 Ack=7705 Win=853 Len=0 TSval=1164062 TSecr=29985653
245 2.306237109 172.31.31.144 -> 172.31.23.72 TCP 66 6633 → 45536 [ACK] Seq=161 Ack=7737 Win=853 Len=0 TSval=1164062 TSecr=29985653
246 2.405756921 172.31.31.144 -> 172.31.23.72 OpenFlow 90 Type: OFPT_MULTIPART_REQUEST, OFPMP_GROUP
247 2.405777410 172.31.31.144 -> 172.31.23.72 OpenFlow 106 Type: OFPT_MULTIPART_REQUEST, OFPMP_METER
248 2.405984150 172.31.23.72 -> 172.31.31.144 OpenFlow 82 Type: OFPT_MULTIPART_REPLY, OFPMP_GROUP
249 2.406019929 172.31.23.72 -> 172.31.31.144 OpenFlow 98 Type: OFPT_MULTIPART_REPLY, OFPMP_METER
250 2.406068819 172.31.31.144 -> 172.31.23.72 OpenFlow 90 Type: OFPT_MULTIPART_REQUEST, OFPMP_GROUP
251 2.406109535 172.31.31.144 -> 172.31.23.72 OpenFlow 106 Type: OFPT_MULTIPART_REQUEST, OFPMP_METER
252 2.406236191 172.31.31.144 -> 172.31.23.72 TCP 66 6633 → 45540 [ACK] Seq=161 Ack=9177 Win=853 Len=0 TSval=1164087 TSecr=29985678
253 2.406242116 172.31.31.144 -> 172.31.23.72 TCP 66 6633 → 45540 [ACK] Seq=161 Ack=9209 Win=853 Len=0 TSval=1164087 TSecr=29985678
254 2.406281764 172.31.23.72 -> 172.31.31.144 OpenFlow 82 Type: OFPT_MULTIPART_REPLY, OFPMP_GROUP
255 2.406309992 172.31.23.72 -> 172.31.31.144 OpenFlow 98 Type: OFPT_MULTIPART_REPLY, OFPMP_METER
256 2.406942085 172.31.31.144 -> 172.31.23.72 TCP 66 6633 → 45542 [ACK] Seq=161 Ack=8537 Win=853 Len=0 TSval=1164087 TSecr=29985678
257 2.406971030 172.31.31.144 -> 172.31.23.72 TCP 66 6633 → 45542 [ACK] Seq=161 Ack=8569 Win=853 Len=0 TSval=1164087 TSecr=29985678
258 2.505863564 172.31.31.144 -> 172.31.23.72 OpenFlow 90 Type: OFPT_MULTIPART_REQUEST, OFPMP_GROUP
259 2.505886098 172.31.31.144 -> 172.31.23.72 OpenFlow 106 Type: OFPT_MULTIPART_REQUEST, OFPMP_METER
260 2.506095748 172.31.23.72 -> 172.31.31.144 OpenFlow 82 Type: OFPT_MULTIPART_REPLY, OFPMP_GROUP
261 2.506129295 172.31.23.72 -> 172.31.31.144 OpenFlow 98 Type: OFPT_MULTIPART_REPLY, OFPMP_METER
262 2.506322356 172.31.31.144 -> 172.31.23.72 TCP 66 6633 → 45544 [ACK] Seq=161 Ack=9369 Win=853 Len=0 TSval=1164112 TSecr=29985703
263 2.506349056 172.31.31.144 -> 172.31.23.72 TCP 66 6633 → 45544 [ACK] Seq=161 Ack=9401 Win=853 Len=0 TSval=1164112 TSecr=29985703
264 2.606014608 172.31.31.144 -> 172.31.23.72 OpenFlow 90 Type: OFPT_MULTIPART_REQUEST, OFPMP_GROUP
265 2.606040385 172.31.31.144 -> 172.31.23.72 OpenFlow 90 Type: OFPT_MULTIPART_REQUEST, OFPMP_GROUP
266 2.606043600 172.31.31.144 -> 172.31.23.72 OpenFlow 106 Type: OFPT_MULTIPART_REQUEST, OFPMP_METER
267 2.606047236 172.31.31.144 -> 172.31.23.72 OpenFlow 106 Type: OFPT_MULTIPART_REQUEST, OFPMP_METER
268 2.606093660 172.31.31.144 -> 172.31.23.72 OpenFlow 187 Type: OFPT_PACKET_OUT
269 2.606145151 172.31.31.144 -> 172.31.23.72 OpenFlow 187 Type: OFPT_PACKET_OUT
270 2.606222849 172.31.23.72 -> 172.31.31.144 OpenFlow 82 Type: OFPT_MULTIPART_REPLY, OFPMP_GROUP
271 2.606235660 172.31.31.144 -> 172.31.23.72 OpenFlow 187 Type: OFPT_PACKET_OUT
272 2.606252634 172.31.23.72 -> 172.31.31.144 OpenFlow 82 Type: OFPT_MULTIPART_REPLY, OFPMP_GROUP_DESC
273 2.606299123 172.31.31.144 -> 172.31.23.72 OpenFlow 187 Type: OFPT_PACKET_OUT
274 2.606307427 172.31.23.72 -> 172.31.31.144 OpenFlow 82 Type: OFPT_MULTIPART_REPLY, OFPMP_METER
275 2.606345892 172.31.31.144 -> 172.31.23.72 OpenFlow 187 Type: OFPT_PACKET_OUT
276 2.606389891 172.31.31.144 -> 172.31.23.72 OpenFlow 187 Type: OFPT_PACKET_OUT
277 2.606444117 172.31.31.144 -> 172.31.23.72 TCP 66 6633 → 45546 [ACK] Seq=887 Ack=8857 Win=853 Len=0 TSval=1164137 TSecr=29985728
278 2.606461805 172.31.31.144 -> 172.31.23.72 OpenFlow 187 Type: OFPT_PACKET_OUT
279 2.606532080 172.31.31.144 -> 172.31.23.72 OpenFlow 187 Type: OFPT_PACKET_OUT
280 2.606668262 172.31.23.72 -> 172.31.31.144 TCP 66 45546 → 6633 [ACK] Seq=8889 Ack=1129 Win=213 Len=0 TSval=29985728 TSecr=1164137
281 2.606734933 172.31.31.144 -> 172.31.23.72 OpenFlow 187 Type: OFPT_PACKET_OUT
282 2.606741245 172.31.31.144 -> 172.31.23.72 OpenFlow 187 Type: OFPT_PACKET_OUT
283 2.606743498 172.31.31.144 -> 172.31.23.72 OpenFlow 187 Type: OFPT_PACKET_OUT
284 2.606745202 172.31.31.144 -> 172.31.23.72 OpenFlow 187 Type: OFPT_PACKET_OUT
285 2.606834076 172.31.31.144 -> 172.31.23.72 OpenFlow 187 Type: OFPT_PACKET_OUT
286 2.606838996 172.31.31.144 -> 172.31.23.72 OpenFlow 187 Type: OFPT_PACKET_OUT
287 2.606914426 172.31.31.144 -> 172.31.23.72 OpenFlow 187 Type: OFPT_PACKET_OUT
288 2.606953559 172.31.31.144 -> 172.31.23.72 OpenFlow 187 Type: OFPT_PACKET_OUT
289 2.607007905 172.31.31.144 -> 172.31.23.72 OpenFlow 187 Type: OFPT_PACKET_OUT
290 2.607043818 172.31.23.72 -> 172.31.31.144 TCP 66 45534 → 6633 [ACK] Seq=7737 Ack=887 Win=213 Len=0 TSval=29985728 TSecr=1164137
291 2.607057450 172.31.31.144 -> 172.31.23.72 OpenFlow 187 Type: OFPT_PACKET_OUT
292 2.607116693 172.31.31.144 -> 172.31.23.72 OpenFlow 187 Type: OFPT_PACKET_OUT
293 2.607158363 172.31.31.144 -> 172.31.23.72 OpenFlow 187 Type: OFPT_PACKET_OUT
294 2.607204842 172.31.31.144 -> 172.31.23.72 OpenFlow 187 Type: OFPT_PACKET_OUT
295 2.607251842 172.31.31.144 -> 172.31.23.72 OpenFlow 187 Type: OFPT_PACKET_OUT
296 2.607330450 172.31.31.144 -> 172.31.23.72 OpenFlow 187 Type: OFPT_PACKET_OUT
297 2.607383358 172.31.31.144 -> 172.31.23.72 OpenFlow 187 Type: OFPT_PACKET_OUT
298 2.607429362 172.31.31.144 -> 172.31.23.72 OpenFlow 187 Type: OFPT_PACKET_OUT
299 2.607490218 172.31.31.144 -> 172.31.23.72 OpenFlow 187 Type: OFPT_PACKET_OUT
300 2.607517977 172.31.23.72 -> 172.31.31.144 TCP 66 45530 → 6633 [ACK] Seq=8473 Ack=1129 Win=213 Len=0 TSval=29985728 TSecr=1164137
301 2.607527239 172.31.31.144 -> 172.31.23.72 OpenFlow 187 Type: OFPT_PACKET_OUT
302 2.607578877 172.31.31.144 -> 172.31.23.72 OpenFlow 187 Type: OFPT_PACKET_OUT
303 2.607640365 172.31.31.144 -> 172.31.23.72 OpenFlow 187 Type: OFPT_PACKET_OUT
304 2.607688416 172.31.31.144 -> 172.31.23.72 OpenFlow 187 Type: OFPT_PACKET_OUT
305 2.607779933 172.31.31.144 -> 172.31.23.72 OpenFlow 187 Type: OFPT_PACKET_OUT
306 2.607813215 172.31.31.144 -> 172.31.23.72 OpenFlow 187 Type: OFPT_PACKET_OUT
307 2.607857789 172.31.31.144 -> 172.31.23.72 OpenFlow 187 Type: OFPT_PACKET_OUT
308 2.607895951 172.31.31.144 -> 172.31.23.72 OpenFlow 187 Type: OFPT_PACKET_OUT
309 2.607920975 172.31.23.72 -> 172.31.31.144 TCP 66 45514 → 6633 [ACK] Seq=49 Ack=1033 Win=213 Len=0 TSval=29985728 TSecr=1164137
310 2.607957300 172.31.31.144 -> 172.31.23.72 OpenFlow 187 Type: OFPT_PACKET_OUT
311 2.608016492 172.31.31.144 -> 172.31.23.72 OpenFlow 187 Type: OFPT_PACKET_OUT
312 2.608033687 172.31.23.72 -> 172.31.31.144 OpenFlow 189 Type: OFPT_PACKET_IN
313 2.608050015 172.31.31.144 -> 172.31.23.72 OpenFlow 187 Type: OFPT_PACKET_OUT
314 2.608056682 172.31.23.72 -> 172.31.31.144 OpenFlow 189 Type: OFPT_PACKET_IN
315 2.608098286 172.31.31.144 -> 172.31.23.72 OpenFlow 187 Type: OFPT_PACKET_OUT
316 2.608156408 172.31.31.144 -> 172.31.23.72 OpenFlow 187 Type: OFPT_PACKET_OUT
317 2.608206286 172.31.31.144 -> 172.31.23.72 OpenFlow 187 Type: OFPT_PACKET_OUT
318 2.608217454 172.31.31.144 -> 172.31.23.72 TCP 66 6633 → 45528 [ACK] Seq=1371 Ack=10372 Win=853 Len=0 TSval=1164137 TSecr=29985728
319 2.608269379 172.31.31.144 -> 172.31.23.72 OpenFlow 187 Type: OFPT_PACKET_OUT
320 2.608287464 172.31.31.144 -> 172.31.23.72 TCP 66 6633 → 45528 [ACK] Seq=1371 Ack=10495 Win=853 Len=0 TSval=1164137 TSecr=29985728
321 2.608347928 172.31.31.144 -> 172.31.23.72 OpenFlow 187 Type: OFPT_PACKET_OUT
322 2.608373703 172.31.31.144 -> 172.31.23.72 OpenFlow 187 Type: OFPT_PACKET_OUT
323 2.608440538 172.31.31.144 -> 172.31.23.72 OpenFlow 187 Type: OFPT_PACKET_OUT
324 2.608493505 172.31.31.144 -> 172.31.23.72 OpenFlow 187 Type: OFPT_PACKET_OUT
325 2.608529538 172.31.31.144 -> 172.31.23.72 OpenFlow 187 Type: OFPT_PACKET_OUT
326 2.608579652 172.31.23.72 -> 172.31.31.144 TCP 66 45528 → 6633 [ACK] Seq=10495 Ack=1371 Win=213 Len=0 TSval=29985728 TSecr=1164137
327 2.608597217 172.31.31.144 -> 172.31.23.72 OpenFlow 187 Type: OFPT_PACKET_OUT
328 2.608645023 172.31.31.144 -> 172.31.23.72 OpenFlow 187 Type: OFPT_PACKET_OUT
329 2.608666335 172.31.23.72 -> 172.31.31.144 OpenFlow 189 Type: OFPT_PACKET_IN
330 2.608686557 172.31.31.144 -> 172.31.23.72 OpenFlow 187 Type: OFPT_PACKET_OUT
331 2.608690928 172.31.23.72 -> 172.31.31.144 OpenFlow 189 Type: OFPT_PACKET_IN
332 2.608862296 172.31.31.144 -> 172.31.23.72 OpenFlow 187 Type: OFPT_PACKET_OUT
333 2.608867216 172.31.31.144 -> 172.31.23.72 OpenFlow 187 Type: OFPT_PACKET_OUT
334 2.608870191 172.31.31.144 -> 172.31.23.72 OpenFlow 187 Type: OFPT_PACKET_OUT
335 2.608873784 172.31.31.144 -> 172.31.23.72 TCP 66 6633 → 45518 [ACK] Seq=1371 Ack=9956 Win=853 Len=0 TSval=1164137 TSecr=29985728
336 2.608979431 172.31.31.144 -> 172.31.23.72 TCP 66 6633 → 45518 [ACK] Seq=1371 Ack=10079 Win=853 Len=0 TSval=1164137 TSecr=29985728
337 2.608984508 172.31.31.144 -> 172.31.23.72 OpenFlow 187 Type: OFPT_PACKET_OUT
338 2.608986575 172.31.31.144 -> 172.31.23.72 OpenFlow 187 Type: OFPT_PACKET_OUT
339 2.609079758 172.31.31.144 -> 172.31.23.72 OpenFlow 187 Type: OFPT_PACKET_OUT
340 2.609084110 172.31.31.144 -> 172.31.23.72 OpenFlow 187 Type: OFPT_PACKET_OUT
341 2.609158994 172.31.23.72 -> 172.31.31.144 OpenFlow 189 Type: OFPT_PACKET_IN
342 2.609183971 172.31.31.144 -> 172.31.23.72 OpenFlow 187 Type: OFPT_PACKET_OUT
343 2.609189753 172.31.23.72 -> 172.31.31.144 OpenFlow 189 Type: OFPT_PACKET_IN
344 2.609194486 172.31.31.144 -> 172.31.23.72 OpenFlow 187 Type: OFPT_PACKET_OUT
345 2.609306547 172.31.31.144 -> 172.31.23.72 OpenFlow 187 Type: OFPT_PACKET_OUT
346 2.609312713 172.31.31.144 -> 172.31.23.72 OpenFlow 187 Type: OFPT_PACKET_OUT
347 2.609507908 172.31.23.72 -> 172.31.31.144 TCP 66 45512 → 6633 [ACK] Seq=295 Ack=1275 Win=213 Len=0 TSval=29985728 TSecr=1164137
348 2.609568344 172.31.31.144 -> 172.31.23.72 OpenFlow 187 Type: OFPT_PACKET_OUT
349 2.609574274 172.31.31.144 -> 172.31.23.72 TCP 66 6633 → 45512 [ACK] Seq=1275 Ack=172 Win=853 Len=0 TSval=1164137 TSecr=29985728
350 2.609589244 172.31.31.144 -> 172.31.23.72 OpenFlow 187 Type: OFPT_PACKET_OUT
351 2.609591714 172.31.31.144 -> 172.31.23.72 OpenFlow 187 Type: OFPT_PACKET_OUT
352 2.609593306 172.31.31.144 -> 172.31.23.72 TCP 66 6633 → 45512 [ACK] Seq=1275 Ack=295 Win=853 Len=0 TSval=1164137 TSecr=29985728
353 2.609595491 172.31.31.144 -> 172.31.23.72 OpenFlow 187 Type: OFPT_PACKET_OUT
354 2.609597165 172.31.31.144 -> 172.31.23.72 OpenFlow 187 Type: OFPT_PACKET_OUT
355 2.609623183 172.31.23.72 -> 172.31.31.144 OpenFlow 189 Type: OFPT_PACKET_IN
356 2.609665210 172.31.31.144 -> 172.31.23.72 OpenFlow 187 Type: OFPT_PACKET_OUT
357 2.609671273 172.31.23.72 -> 172.31.31.144 OpenFlow 189 Type: OFPT_PACKET_IN
358 2.609679688 172.31.31.144 -> 172.31.23.72 OpenFlow 187 Type: OFPT_PACKET_OUT
359 2.609781328 172.31.31.144 -> 172.31.23.72 OpenFlow 187 Type: OFPT_PACKET_OUT
360 2.609786028 172.31.31.144 -> 172.31.23.72 OpenFlow 187 Type: OFPT_PACKET_OUT
361 2.609900417 172.31.31.144 -> 172.31.23.72 OpenFlow 187 Type: OFPT_PACKET_OUT
362 2.609905012 172.31.31.144 -> 172.31.23.72 TCP 66 6633 → 45538 [ACK] Seq=1371 Ack=9956 Win=853 Len=0 TSval=1164137 TSecr=29985729
363 2.610004086 172.31.31.144 -> 172.31.23.72 TCP 66 6633 → 45538 [ACK] Seq=1371 Ack=10079 Win=853 Len=0 TSval=1164138 TSecr=29985729
364 2.610083061 172.31.23.72 -> 172.31.31.144 TCP 66 45538 → 6633 [ACK] Seq=10079 Ack=1371 Win=213 Len=0 TSval=29985729 TSecr=1164137
365 2.610161124 172.31.23.72 -> 172.31.31.144 OpenFlow 189 Type: OFPT_PACKET_IN
366 2.610187732 172.31.23.72 -> 172.31.31.144 OpenFlow 435 Type: OFPT_PACKET_IN
367 2.610196121 172.31.23.72 -> 172.31.31.144 OpenFlow 189 Type: OFPT_PACKET_IN
368 2.610215475 172.31.23.72 -> 172.31.31.144 OpenFlow 189 Type: OFPT_PACKET_IN
369 2.610239922 172.31.23.72 -> 172.31.31.144 OpenFlow 189 Type: OFPT_PACKET_IN
370 2.610255273 172.31.23.72 -> 172.31.31.144 OpenFlow 189 Type: OFPT_PACKET_IN
371 2.610257522 172.31.23.72 -> 172.31.31.144 OpenFlow 435 Type: OFPT_PACKET_IN
372 2.610274900 172.31.23.72 -> 172.31.31.144 OpenFlow 189 Type: OFPT_PACKET_IN
373 2.610289162 172.31.23.72 -> 172.31.31.144 OpenFlow 189 Type: OFPT_PACKET_IN
374 2.610314270 172.31.23.72 -> 172.31.31.144 OpenFlow 189 Type: OFPT_PACKET_IN
375 2.610319234 172.31.23.72 -> 172.31.31.144 OpenFlow 681 Type: OFPT_PACKET_IN
376 2.610347237 172.31.23.72 -> 172.31.31.144 OpenFlow 189 Type: OFPT_PACKET_IN
377 2.610349675 172.31.23.72 -> 172.31.31.144 OpenFlow 189 Type: OFPT_PACKET_IN
378 2.610363598 172.31.23.72 -> 172.31.31.144 OpenFlow 189 Type: OFPT_PACKET_IN
379 2.610366013 172.31.23.72 -> 172.31.31.144 OpenFlow 435 Type: OFPT_PACKET_IN
380 2.610402402 172.31.23.72 -> 172.31.31.144 OpenFlow 189 Type: OFPT_PACKET_IN
381 2.610417600 172.31.23.72 -> 172.31.31.144 OpenFlow 189 Type: OFPT_PACKET_IN
382 2.610438345 172.31.23.72 -> 172.31.31.144 OpenFlow 189 Type: OFPT_PACKET_IN
383 2.610455108 172.31.23.72 -> 172.31.31.144 OpenFlow 189 Type: OFPT_PACKET_IN
384 2.610556761 172.31.23.72 -> 172.31.31.144 OpenFlow 189 Type: OFPT_PACKET_IN
385 2.610560369 172.31.23.72 -> 172.31.31.144 OpenFlow 189 Type: OFPT_PACKET_IN
386 2.610562486 172.31.23.72 -> 172.31.31.144 OpenFlow 189 Type: OFPT_PACKET_IN
387 2.610578704 172.31.23.72 -> 172.31.31.144 OpenFlow 189 Type: OFPT_PACKET_IN
388 2.610593921 172.31.31.144 -> 172.31.23.72 TCP 66 6633 → 45532 [ACK] Seq=161 Ack=7764 Win=853 Len=0 TSval=1164138 TSecr=29985729
389 2.610599257 172.31.31.144 -> 172.31.23.72 TCP 66 6633 → 45532 [ACK] Seq=161 Ack=8133 Win=853 Len=0 TSval=1164138 TSecr=29985729
390 2.610601424 172.31.31.144 -> 172.31.23.72 TCP 66 6633 → 45544 [ACK] Seq=161 Ack=9524 Win=853 Len=0 TSval=1164138 TSecr=29985729
391 2.610603575 172.31.31.144 -> 172.31.23.72 TCP 66 6633 → 45524 [ACK] Seq=161 Ack=8708 Win=853 Len=0 TSval=1164138 TSecr=29985729
392 2.610605419 172.31.31.144 -> 172.31.23.72 TCP 66 6633 → 45522 [ACK] Seq=161 Ack=8068 Win=853 Len=0 TSval=1164138 TSecr=29985729
393 2.610613688 172.31.23.72 -> 172.31.31.144 OpenFlow 189 Type: OFPT_PACKET_IN
394 2.610995365 172.31.23.72 -> 172.31.31.144 OpenFlow 189 Type: OFPT_PACKET_IN
395 2.610998402 172.31.23.72 -> 172.31.31.144 OpenFlow 189 Type: OFPT_PACKET_IN
396 2.611000105 172.31.23.72 -> 172.31.31.144 OpenFlow 483 Type: OFPT_MULTIPART_REPLY, OFPMP_METER
397 2.611001801 172.31.23.72 -> 172.31.31.144 OpenFlow 189 Type: OFPT_PACKET_IN
398 2.611003575 172.31.23.72 -> 172.31.31.144 OpenFlow 681 Type: OFPT_PACKET_IN
399 2.611377232 172.31.31.144 -> 172.31.23.72 TCP 66 6633 → 45544 [ACK] Seq=161 Ack=9893 Win=853 Len=0 TSval=1164138 TSecr=29985729
400 2.611382686 172.31.31.144 -> 172.31.23.72 TCP 66 6633 → 45540 [ACK] Seq=161 Ack=9332 Win=853 Len=0 TSval=1164138 TSecr=29985729
401 2.611384889 172.31.31.144 -> 172.31.23.72 TCP 66 6633 → 45526 [ACK] Seq=161 Ack=8596 Win=853 Len=0 TSval=1164138 TSecr=29985729
402 2.611387191 172.31.31.144 -> 172.31.23.72 TCP 66 6633 → 45550 [ACK] Seq=97 Ack=7300 Win=853 Len=0 TSval=1164138 TSecr=29985729
403 2.611389053 172.31.31.144 -> 172.31.23.72 TCP 66 6633 → 45524 [ACK] Seq=161 Ack=9323 Win=853 Len=0 TSval=1164138 TSecr=29985729
404 2.611391418 172.31.31.144 -> 172.31.23.72 TCP 66 6633 → 45508 [ACK] Seq=65 Ack=172 Win=853 Len=0 TSval=1164138 TSecr=29985729
405 2.611393633 172.31.31.144 -> 172.31.23.72 TCP 66 6633 → 45522 [ACK] Seq=161 Ack=8191 Win=853 Len=0 TSval=1164138 TSecr=29985729
406 2.611395476 172.31.31.144 -> 172.31.23.72 TCP 66 6633 → 45548 [ACK] Seq=161 Ack=9172 Win=853 Len=0 TSval=1164138 TSecr=29985729
407 2.611397359 172.31.31.144 -> 172.31.23.72 TCP 66 6633 → 45542 [ACK] Seq=161 Ack=8692 Win=853 Len=0 TSval=1164138 TSecr=29985729
408 2.611399302 172.31.31.144 -> 172.31.23.72 TCP 66 6633 → 45510 [ACK] Seq=65 Ack=541 Win=853 Len=0 TSval=1164138 TSecr=29985729
409 2.611401578 172.31.31.144 -> 172.31.23.72 TCP 66 6633 → 45536 [ACK] Seq=161 Ack=7860 Win=853 Len=0 TSval=1164138 TSecr=29985729
410 2.611403533 172.31.31.144 -> 172.31.23.72 TCP 66 6633 → 45520 [ACK] Seq=161 Ack=9332 Win=853 Len=0 TSval=1164138 TSecr=29985729
411 2.611406962 172.31.23.72 -> 172.31.31.144 OpenFlow 435 Type: OFPT_PACKET_IN
412 2.611411561 172.31.31.144 -> 172.31.23.72 TCP 66 6633 → 45516 [ACK] Seq=65 Ack=172 Win=853 Len=0 TSval=1164138 TSecr=29985729
413 2.611414367 172.31.23.72 -> 172.31.31.144 OpenFlow 435 Type: OFPT_PACKET_IN
414 2.611421340 172.31.23.72 -> 172.31.31.144 OpenFlow 435 Type: OFPT_PACKET_IN
415 2.611423304 172.31.23.72 -> 172.31.31.144 OpenFlow 189 Type: OFPT_PACKET_IN
416 2.611424850 172.31.23.72 -> 172.31.31.144 OpenFlow 189 Type: OFPT_PACKET_IN
417 2.611648421 172.31.31.144 -> 172.31.23.72 TCP 66 6633 → 45530 [ACK] Seq=1129 Ack=8596 Win=853 Len=0 TSval=1164138 TSecr=29985729
418 2.611650596 172.31.31.144 -> 172.31.23.72 TCP 66 6633 → 45540 [ACK] Seq=161 Ack=9455 Win=853 Len=0 TSval=1164138 TSecr=29985729
419 2.611652383 172.31.31.144 -> 172.31.23.72 TCP 66 6633 → 45526 [ACK] Seq=161 Ack=8719 Win=853 Len=0 TSval=1164138 TSecr=29985729
420 2.611654349 172.31.31.144 -> 172.31.23.72 TCP 66 6633 → 45514 [ACK] Seq=1033 Ack=172 Win=853 Len=0 TSval=1164138 TSecr=29985729
421 2.611655953 172.31.31.144 -> 172.31.23.72 TCP 66 6633 → 45528 [ACK] Seq=1371 Ack=10618 Win=853 Len=0 TSval=1164138 TSecr=29985729
422 2.611657715 172.31.31.144 -> 172.31.23.72 TCP 66 6633 → 45550 [ACK] Seq=97 Ack=7423 Win=853 Len=0 TSval=1164138 TSecr=29985729
423 2.611659457 172.31.31.144 -> 172.31.23.72 TCP 66 6633 → 45508 [ACK] Seq=65 Ack=295 Win=853 Len=0 TSval=1164138 TSecr=29985729
424 2.611867671 172.31.31.144 -> 172.31.23.72 TCP 66 6633 → 45548 [ACK] Seq=161 Ack=9589 Win=853 Len=0 TSval=1164138 TSecr=29985729
425 2.611870069 172.31.31.144 -> 172.31.23.72 TCP 66 6633 → 45542 [ACK] Seq=161 Ack=8815 Win=853 Len=0 TSval=1164138 TSecr=29985729
426 2.611871792 172.31.31.144 -> 172.31.23.72 TCP 66 6633 → 45536 [ACK] Seq=161 Ack=8475 Win=853 Len=0 TSval=1164138 TSecr=29985729
427 2.611873218 172.31.31.144 -> 172.31.23.72 TCP 66 6633 → 45520 [ACK] Seq=161 Ack=9701 Win=853 Len=0 TSval=1164138 TSecr=29985729
428 2.611904598 172.31.31.144 -> 172.31.23.72 TCP 66 6633 → 45516 [ACK] Seq=65 Ack=541 Win=853 Len=0 TSval=1164138 TSecr=29985729
429 2.611944334 172.31.31.144 -> 172.31.23.72 TCP 66 6633 → 45530 [ACK] Seq=1129 Ack=8965 Win=853 Len=0 TSval=1164138 TSecr=29985729
430 2.611964938 172.31.31.144 -> 172.31.23.72 TCP 66 6633 → 45514 [ACK] Seq=1033 Ack=295 Win=853 Len=0 TSval=1164138 TSecr=29985729
431 2.611994313 172.31.31.144 -> 172.31.23.72 TCP 66 6633 → 45528 [ACK] Seq=1371 Ack=10741 Win=853 Len=0 TSval=1164138 TSecr=29985729
432 2.645597239 172.31.23.72 -> 172.31.31.144 TCP 66 45518 → 6633 [ACK] Seq=10079 Ack=1371 Win=213 Len=0 TSval=29985738 TSecr=1164137
433 2.645992209 172.31.31.144 -> 172.31.23.72 TCP 66 6633 → 45546 [ACK] Seq=1129 Ack=8889 Win=853 Len=0 TSval=1164147 TSecr=29985728
434 2.706092224 172.31.31.144 -> 172.31.23.72 OpenFlow 90 Type: OFPT_MULTIPART_REQUEST, OFPMP_GROUP
435 2.706109388 172.31.31.144 -> 172.31.23.72 OpenFlow 90 Type: OFPT_MULTIPART_REQUEST, OFPMP_GROUP
436 2.706113520 172.31.31.144 -> 172.31.23.72 OpenFlow 90 Type: OFPT_MULTIPART_REQUEST, OFPMP_GROUP
437 2.706117127 172.31.31.144 -> 172.31.23.72 OpenFlow 106 Type: OFPT_MULTIPART_REQUEST, OFPMP_METER
438 2.706120206 172.31.31.144 -> 172.31.23.72 OpenFlow 106 Type: OFPT_MULTIPART_REQUEST, OFPMP_METER
439 2.706122112 172.31.31.144 -> 172.31.23.72 OpenFlow 106 Type: OFPT_MULTIPART_REQUEST, OFPMP_METER
440 2.706123817 172.31.31.144 -> 172.31.23.72 OpenFlow 187 Type: OFPT_PACKET_OUT
441 2.706141204 172.31.31.144 -> 172.31.23.72 OpenFlow 187 Type: OFPT_PACKET_OUT
442 2.706174453 172.31.31.144 -> 172.31.23.72 OpenFlow 187 Type: OFPT_PACKET_OUT
443 2.706215484 172.31.31.144 -> 172.31.23.72 OpenFlow 187 Type: OFPT_PACKET_OUT
444 2.706265846 172.31.31.144 -> 172.31.23.72 OpenFlow 187 Type: OFPT_PACKET_OUT
445 2.706353792 172.31.31.144 -> 172.31.23.72 OpenFlow 187 Type: OFPT_PACKET_OUT
446 2.706421804 172.31.31.144 -> 172.31.23.72 OpenFlow 187 Type: OFPT_PACKET_OUT
447 2.706491859 172.31.31.144 -> 172.31.23.72 OpenFlow 187 Type: OFPT_PACKET_OUT
448 2.706521847 172.31.31.144 -> 172.31.23.72 OpenFlow 187 Type: OFPT_PACKET_OUT
449 2.706541712 172.31.31.144 -> 172.31.23.72 OpenFlow 187 Type: OFPT_PACKET_OUT
450 2.706619039 172.31.31.144 -> 172.31.23.72 OpenFlow 187 Type: OFPT_PACKET_OUT
451 2.706653441 172.31.31.144 -> 172.31.23.72 OpenFlow 187 Type: OFPT_PACKET_OUT
452 2.706719732 172.31.31.144 -> 172.31.23.72 OpenFlow 187 Type: OFPT_PACKET_OUT
453 2.706833545 172.31.31.144 -> 172.31.23.72 OpenFlow 187 Type: OFPT_PACKET_OUT
454 2.706838178 172.31.31.144 -> 172.31.23.72 OpenFlow 187 Type: OFPT_PACKET_OUT
455 2.706862837 172.31.31.144 -> 172.31.23.72 OpenFlow 187 Type: OFPT_PACKET_OUT
456 2.706875474 172.31.23.72 -> 172.31.31.144 TCP 66 45532 → 6633 [ACK] Seq=8133 Ack=1129 Win=213 Len=0 TSval=29985753 TSecr=1164162
457 2.706911440 172.31.31.144 -> 172.31.23.72 OpenFlow 187 Type: OFPT_PACKET_OUT
458 2.707000923 172.31.31.144 -> 172.31.23.72 OpenFlow 187 Type: OFPT_PACKET_OUT
459 2.707006116 172.31.31.144 -> 172.31.23.72 OpenFlow 187 Type: OFPT_PACKET_OUT
460 2.707064060 172.31.31.144 -> 172.31.23.72 OpenFlow 187 Type: OFPT_PACKET_OUT
461 2.707128651 172.31.31.144 -> 172.31.23.72 OpenFlow 187 Type: OFPT_PACKET_OUT
462 2.707145037 172.31.23.72 -> 172.31.31.144 TCP 66 45544 → 6633 [ACK] Seq=9893 Ack=887 Win=213 Len=0 TSval=29985753 TSecr=1164162
463 2.707166451 172.31.31.144 -> 172.31.23.72 OpenFlow 187 Type: OFPT_PACKET_OUT
464 2.707221131 172.31.31.144 -> 172.31.23.72 OpenFlow 187 Type: OFPT_PACKET_OUT
465 2.707270876 172.31.31.144 -> 172.31.23.72 OpenFlow 187 Type: OFPT_PACKET_OUT
466 2.707331551 172.31.31.144 -> 172.31.23.72 OpenFlow 187 Type: OFPT_PACKET_OUT
467 2.707384536 172.31.31.144 -> 172.31.23.72 OpenFlow 187 Type: OFPT_PACKET_OUT
468 2.707429221 172.31.31.144 -> 172.31.23.72 OpenFlow 187 Type: OFPT_PACKET_OUT
469 2.707495169 172.31.31.144 -> 172.31.23.72 OpenFlow 187 Type: OFPT_PACKET_OUT
470 2.707546443 172.31.31.144 -> 172.31.23.72 OpenFlow 187 Type: OFPT_PACKET_OUT
471 2.707584999 172.31.31.144 -> 172.31.23.72 OpenFlow 187 Type: OFPT_PACKET_OUT
472 2.707708840 172.31.31.144 -> 172.31.23.72 OpenFlow 187 Type: OFPT_PACKET_OUT
473 2.707735800 172.31.23.72 -> 172.31.31.144 TCP 66 45524 → 6633 [ACK] Seq=9323 Ack=1371 Win=213 Len=0 TSval=29985753 TSecr=1164162
474 2.707745598 172.31.31.144 -> 172.31.23.72 OpenFlow 187 Type: OFPT_PACKET_OUT
475 2.707748730 172.31.31.144 -> 172.31.23.72 OpenFlow 187 Type: OFPT_PACKET_OUT
476 2.707906586 172.31.31.144 -> 172.31.23.72 OpenFlow 187 Type: OFPT_PACKET_OUT
477 2.707912127 172.31.31.144 -> 172.31.23.72 OpenFlow 187 Type: OFPT_PACKET_OUT
478 2.707913823 172.31.31.144 -> 172.31.23.72 OpenFlow 187 Type: OFPT_PACKET_OUT
479 2.707960049 172.31.31.144 -> 172.31.23.72 OpenFlow 187 Type: OFPT_PACKET_OUT
480 2.708009483 172.31.31.144 -> 172.31.23.72 OpenFlow 187 Type: OFPT_PACKET_OUT
481 2.708070606 172.31.31.144 -> 172.31.23.72 OpenFlow 187 Type: OFPT_PACKET_OUT
482 2.708082275 172.31.23.72 -> 172.31.31.144 TCP 66 45522 → 6633 [ACK] Seq=8191 Ack=887 Win=213 Len=0 TSval=29985753 TSecr=1164162
483 2.708122785 172.31.31.144 -> 172.31.23.72 OpenFlow 187 Type: OFPT_PACKET_OUT
484 2.708272494 172.31.31.144 -> 172.31.23.72 OpenFlow 187 Type: OFPT_PACKET_OUT
485 2.708277421 172.31.31.144 -> 172.31.23.72 OpenFlow 187 Type: OFPT_PACKET_OUT
486 2.708279489 172.31.31.144 -> 172.31.23.72 OpenFlow 187 Type: OFPT_PACKET_OUT
487 2.708335184 172.31.31.144 -> 172.31.23.72 OpenFlow 187 Type: OFPT_PACKET_OUT
488 2.708385594 172.31.31.144 -> 172.31.23.72 OpenFlow 187 Type: OFPT_PACKET_OUT
489 2.708424872 172.31.31.144 -> 172.31.23.72 OpenFlow 187 Type: OFPT_PACKET_OUT
490 2.708444989 172.31.23.72 -> 172.31.31.144 TCP 66 45510 → 6633 [ACK] Seq=541 Ack=1033 Win=213 Len=0 TSval=29985753 TSecr=1164162
491 2.708493724 172.31.31.144 -> 172.31.23.72 OpenFlow 187 Type: OFPT_PACKET_OUT
492 2.708523084 172.31.23.72 -> 172.31.31.144 OpenFlow 189 Type: OFPT_PACKET_IN
493 2.708570171 172.31.23.72 -> 172.31.31.144 OpenFlow 189 Type: OFPT_PACKET_IN
494 2.708607974 172.31.31.144 -> 172.31.23.72 OpenFlow 187 Type: OFPT_PACKET_OUT
495 2.708657510 172.31.31.144 -> 172.31.23.72 OpenFlow 187 Type: OFPT_PACKET_OUT
496 2.708662656 172.31.31.144 -> 172.31.23.72 OpenFlow 187 Type: OFPT_PACKET_OUT
497 2.708715103 172.31.31.144 -> 172.31.23.72 OpenFlow 187 Type: OFPT_PACKET_OUT
498 2.708782661 172.31.31.144 -> 172.31.23.72 OpenFlow 187 Type: OFPT_PACKET_OUT
499 2.708795791 172.31.31.144 -> 172.31.23.72 TCP 66 6633 → 45540 [ACK] Seq=1371 Ack=9578 Win=853 Len=0 TSval=1164162 TSecr=29985753
500 2.708818976 172.31.31.144 -> 172.31.23.72 OpenFlow 187 Type: OFPT_PACKET_OUT
501 2.708858309 172.31.31.144 -> 172.31.23.72 OpenFlow 187 Type: OFPT_PACKET_OUT
502 2.708940203 172.31.31.144 -> 172.31.23.72 OpenFlow 187 Type: OFPT_PACKET_OUT
503 2.708944926 172.31.31.144 -> 172.31.23.72 TCP 66 6633 → 45540 [ACK] Seq=1371 Ack=9701 Win=853 Len=0 TSval=1164162 TSecr=29985753
504 2.708969298 172.31.31.144 -> 172.31.23.72 OpenFlow 187 Type: OFPT_PACKET_OUT
505 2.709038979 172.31.31.144 -> 172.31.23.72 OpenFlow 187 Type: OFPT_PACKET_OUT
506 2.709083412 172.31.31.144 -> 172.31.23.72 OpenFlow 187 Type: OFPT_PACKET_OUT
507 2.709131219 172.31.23.72 -> 172.31.31.144 OpenFlow 189 Type: OFPT_PACKET_IN
508 2.709142245 172.31.31.144 -> 172.31.23.72 OpenFlow 187 Type: OFPT_PACKET_OUT
509 2.709190755 172.31.31.144 -> 172.31.23.72 OpenFlow 187 Type: OFPT_PACKET_OUT
510 2.709197447 172.31.23.72 -> 172.31.31.144 OpenFlow 681 Type: OFPT_PACKET_IN
511 2.709304766 172.31.31.144 -> 172.31.23.72 OpenFlow 187 Type: OFPT_PACKET_OUT
512 2.709309497 172.31.31.144 -> 172.31.23.72 OpenFlow 187 Type: OFPT_PACKET_OUT
513 2.709384405 172.31.31.144 -> 172.31.23.72 TCP 66 6633 → 45526 [ACK] Seq=1129 Ack=8842 Win=853 Len=0 TSval=1164162 TSecr=29985753
514 2.709537199 172.31.31.144 -> 172.31.23.72 TCP 66 6633 → 45526 [ACK] Seq=1129 Ack=9457 Win=853 Len=0 TSval=1164162 TSecr=29985753
515 2.709618622 172.31.23.72 -> 172.31.31.144 OpenFlow 82 Type: OFPT_MULTIPART_REPLY, OFPMP_GROUP
516 2.709646185 172.31.23.72 -> 172.31.31.144 OpenFlow 98 Type: OFPT_MULTIPART_REPLY, OFPMP_METER
517 2.709842826 172.31.23.72 -> 172.31.31.144 OpenFlow 189 Type: OFPT_PACKET_IN
518 2.709872143 172.31.31.144 -> 172.31.23.72 TCP 66 6633 → 45554 [ACK] Seq=887 Ack=8537 Win=853 Len=0 TSval=1164162 TSecr=29985754
519 2.709876703 172.31.31.144 -> 172.31.23.72 TCP 66 6633 → 45554 [ACK] Seq=887 Ack=8569 Win=853 Len=0 TSval=1164162 TSecr=29985754
520 2.709881263 172.31.23.72 -> 172.31.31.144 OpenFlow 189 Type: OFPT_PACKET_IN
521 2.709913474 172.31.23.72 -> 172.31.31.144 OpenFlow 360 Type: OFPT_MULTIPART_REPLY, OFPMP_METER
522 2.709921705 172.31.23.72 -> 172.31.31.144 OpenFlow 189 Type: OFPT_PACKET_IN
523 2.709945418 172.31.23.72 -> 172.31.31.144 OpenFlow 189 Type: OFPT_PACKET_IN
524 2.709968451 172.31.23.72 -> 172.31.31.144 OpenFlow 189 Type: OFPT_PACKET_IN
525 2.709999753 172.31.23.72 -> 172.31.31.144 OpenFlow 189 Type: OFPT_PACKET_IN
526 2.710099138 172.31.23.72 -> 172.31.31.144 OpenFlow 237 Type: OFPT_MULTIPART_REPLY, OFPMP_METER
527 2.710105240 172.31.23.72 -> 172.31.31.144 OpenFlow 189 Type: OFPT_PACKET_IN
528 2.710107101 172.31.23.72 -> 172.31.31.144 OpenFlow 435 Type: OFPT_PACKET_IN
529 2.710109274 172.31.23.72 -> 172.31.31.144 OpenFlow 189 Type: OFPT_PACKET_IN
530 2.710129897 172.31.23.72 -> 172.31.31.144 OpenFlow 189 Type: OFPT_PACKET_IN
531 2.710132565 172.31.23.72 -> 172.31.31.144 OpenFlow 435 Type: OFPT_PACKET_IN
532 2.710148517 172.31.23.72 -> 172.31.31.144 OpenFlow 189 Type: OFPT_PACKET_IN
533 2.710164177 172.31.23.72 -> 172.31.31.144 OpenFlow 189 Type: OFPT_PACKET_IN
534 2.710176241 172.31.31.144 -> 172.31.23.72 TCP 66 6633 → 45552 [ACK] Seq=161 Ack=8756 Win=853 Len=0 TSval=1164163 TSecr=29985754
535 2.710181272 172.31.31.144 -> 172.31.23.72 TCP 66 6633 → 45552 [ACK] Seq=161 Ack=8879 Win=853 Len=0 TSval=1164163 TSecr=29985754
536 2.710183213 172.31.31.144 -> 172.31.23.72 TCP 66 6633 → 45552 [ACK] Seq=161 Ack=9173 Win=853 Len=0 TSval=1164163 TSecr=29985754
537 2.710192294 172.31.23.72 -> 172.31.31.144 OpenFlow 189 Type: OFPT_PACKET_IN
538 2.710212427 172.31.23.72 -> 172.31.31.144 OpenFlow 189 Type: OFPT_PACKET_IN
539 2.710227430 172.31.23.72 -> 172.31.31.144 OpenFlow 189 Type: OFPT_PACKET_IN
540 2.710239364 172.31.23.72 -> 172.31.31.144 OpenFlow 189 Type: OFPT_PACKET_IN
541 2.710250814 172.31.23.72 -> 172.31.31.144 OpenFlow 189 Type: OFPT_PACKET_IN
542 2.710269417 172.31.23.72 -> 172.31.31.144 OpenFlow 189 Type: OFPT_PACKET_IN
543 2.710281617 172.31.23.72 -> 172.31.31.144 OpenFlow 189 Type: OFPT_PACKET_IN
544 2.710641264 172.31.31.144 -> 172.31.23.72 TCP 66 6633 → 45550 [ACK] Seq=161 Ack=7546 Win=853 Len=0 TSval=1164163 TSecr=29985754
545 2.710647423 172.31.31.144 -> 172.31.23.72 TCP 66 6633 → 45508 [ACK] Seq=65 Ack=418 Win=853 Len=0 TSval=1164163 TSecr=29985754
546 2.710649731 172.31.31.144 -> 172.31.23.72 TCP 66 6633 → 45542 [ACK] Seq=161 Ack=8938 Win=853 Len=0 TSval=1164163 TSecr=29985754
547 2.710651725 172.31.31.144 -> 172.31.23.72 TCP 66 6633 → 45520 [ACK] Seq=161 Ack=9824 Win=853 Len=0 TSval=1164163 TSecr=29985754
548 2.710653477 172.31.31.144 -> 172.31.23.72 TCP 66 6633 → 45550 [ACK] Seq=161 Ack=7717 Win=853 Len=0 TSval=1164163 TSecr=29985754
549 2.710655384 172.31.31.144 -> 172.31.23.72 TCP 66 6633 → 45508 [ACK] Seq=65 Ack=541 Win=853 Len=0 TSval=1164163 TSecr=29985754
550 2.710656924 172.31.31.144 -> 172.31.23.72 TCP 66 6633 → 45542 [ACK] Seq=161 Ack=9307 Win=853 Len=0 TSval=1164163 TSecr=29985754
551 2.710658409 172.31.31.144 -> 172.31.23.72 TCP 66 6633 → 45546 [ACK] Seq=1129 Ack=9012 Win=853 Len=0 TSval=1164163 TSecr=29985754
552 2.710662262 172.31.23.72 -> 172.31.31.144 OpenFlow 189 Type: OFPT_PACKET_IN
553 2.710667069 172.31.31.144 -> 172.31.23.72 TCP 66 6633 → 45534 [ACK] Seq=887 Ack=7860 Win=853 Len=0 TSval=1164163 TSecr=29985754
554 2.710669667 172.31.23.72 -> 172.31.31.144 OpenFlow 435 Type: OFPT_PACKET_IN
555 2.710671150 172.31.31.144 -> 172.31.23.72 TCP 66 6633 → 45520 [ACK] Seq=161 Ack=10193 Win=853 Len=0 TSval=1164163 TSecr=29985754
556 2.710677650 172.31.23.72 -> 172.31.31.144 OpenFlow 435 Type: OFPT_PACKET_IN
557 2.710679625 172.31.23.72 -> 172.31.31.144 OpenFlow 435 Type: OFPT_PACKET_IN
558 2.710681424 172.31.23.72 -> 172.31.31.144 OpenFlow 189 Type: OFPT_PACKET_IN
559 2.710938262 172.31.23.72 -> 172.31.31.144 OpenFlow 435 Type: OFPT_PACKET_IN
560 2.710939737 172.31.23.72 -> 172.31.31.144 OpenFlow 189 Type: OFPT_PACKET_IN
561 2.710941350 172.31.23.72 -> 172.31.31.144 OpenFlow 189 Type: OFPT_PACKET_IN
562 2.710942985 172.31.23.72 -> 172.31.31.144 OpenFlow 435 Type: OFPT_PACKET_IN
563 2.710944447 172.31.23.72 -> 172.31.31.144 OpenFlow 189 Type: OFPT_PACKET_IN
564 2.710945861 172.31.23.72 -> 172.31.31.144 OpenFlow 189 Type: OFPT_PACKET_IN
565 2.710991757 172.31.31.144 -> 172.31.23.72 TCP 66 6633 → 45530 [ACK] Seq=1129 Ack=9088 Win=853 Len=0 TSval=1164163 TSecr=29985754
566 2.710994453 172.31.31.144 -> 172.31.23.72 TCP 66 6633 → 45514 [ACK] Seq=1033 Ack=418 Win=853 Len=0 TSval=1164163 TSecr=29985754
567 2.710996237 172.31.31.144 -> 172.31.23.72 TCP 66 6633 → 45528 [ACK] Seq=1371 Ack=10864 Win=853 Len=0 TSval=1164163 TSecr=29985754
568 2.710997794 172.31.31.144 -> 172.31.23.72 TCP 66 6633 → 45512 [ACK] Seq=1275 Ack=418 Win=853 Len=0 TSval=1164163 TSecr=29985754
569 2.710999623 172.31.31.144 -> 172.31.23.72 TCP 66 6633 → 45518 [ACK] Seq=1371 Ack=10202 Win=853 Len=0 TSval=1164163 TSecr=29985754
570 2.711001387 172.31.31.144 -> 172.31.23.72 TCP 66 6633 → 45538 [ACK] Seq=1371 Ack=10202 Win=853 Len=0 TSval=1164163 TSecr=29985754
571 2.711592659 172.31.31.144 -> 172.31.23.72 TCP 66 6633 → 45532 [ACK] Seq=1129 Ack=8256 Win=853 Len=0 TSval=1164163 TSecr=29985754
572 2.711594753 172.31.31.144 -> 172.31.23.72 TCP 66 6633 → 45524 [ACK] Seq=1371 Ack=9446 Win=853 Len=0 TSval=1164163 TSecr=29985754
573 2.711596431 172.31.31.144 -> 172.31.23.72 TCP 66 6633 → 45522 [ACK] Seq=887 Ack=8314 Win=853 Len=0 TSval=1164163 TSecr=29985754
574 2.711597958 172.31.31.144 -> 172.31.23.72 TCP 66 6633 → 45546 [ACK] Seq=1129 Ack=9135 Win=853 Len=0 TSval=1164163 TSecr=29985754
575 2.711599600 172.31.31.144 -> 172.31.23.72 TCP 66 6633 → 45534 [ACK] Seq=887 Ack=8229 Win=853 Len=0 TSval=1164163 TSecr=29985754
576 2.711601116 172.31.31.144 -> 172.31.23.72 TCP 66 6633 → 45528 [ACK] Seq=1371 Ack=11233 Win=853 Len=0 TSval=1164163 TSecr=29985754
577 2.711602632 172.31.31.144 -> 172.31.23.72 TCP 66 6633 → 45530 [ACK] Seq=1129 Ack=9457 Win=853 Len=0 TSval=1164163 TSecr=29985754
578 2.711604097 172.31.31.144 -> 172.31.23.72 TCP 66 6633 → 45514 [ACK] Seq=1033 Ack=541 Win=853 Len=0 TSval=1164163 TSecr=29985754
579 2.711605551 172.31.31.144 -> 172.31.23.72 TCP 66 6633 → 45518 [ACK] Seq=1371 Ack=10571 Win=853 Len=0 TSval=1164163 TSecr=29985754
580 2.711607046 172.31.31.144 -> 172.31.23.72 TCP 66 6633 → 45512 [ACK] Seq=1275 Ack=541 Win=853 Len=0 TSval=1164163 TSecr=29985754
581 2.711608536 172.31.31.144 -> 172.31.23.72 TCP 66 6633 → 45538 [ACK] Seq=1371 Ack=10325 Win=853 Len=0 TSval=1164163 TSecr=29985754
582 2.711609921 172.31.31.144 -> 172.31.23.72 TCP 66 6633 → 45532 [ACK] Seq=1129 Ack=8625 Win=853 Len=0 TSval=1164163 TSecr=29985754
583 2.711639223 172.31.31.144 -> 172.31.23.72 TCP 66 6633 → 45524 [ACK] Seq=1371 Ack=9569 Win=853 Len=0 TSval=1164163 TSecr=29985754
584 2.711743097 172.31.31.144 -> 172.31.23.72 TCP 66 6633 → 45522 [ACK] Seq=887 Ack=8437 Win=853 Len=0 TSval=1164163 TSecr=29985754
585 2.745603040 172.31.23.72 -> 172.31.31.144 TCP 66 45540 → 6633 [ACK] Seq=9701 Ack=1371 Win=213 Len=0 TSval=29985763 TSecr=1164162
586 2.748868440 172.31.23.72 -> 172.31.31.144 OpenFlow 146 Type: OFPT_PORT_STATUS
587 2.749021851 172.31.23.72 -> 172.31.31.144 OpenFlow 146 Type: OFPT_PORT_STATUS
588 2.749081202 172.31.31.144 -> 172.31.23.72 TCP 66 6633 → 45512 [ACK] Seq=1275 Ack=621 Win=853 Len=0 TSval=1164172 TSecr=29985763
589 2.749279869 172.31.31.144 -> 172.31.23.72 TCP 66 6633 → 45516 [ACK] Seq=65 Ack=621 Win=853 Len=0 TSval=1164172 TSecr=29985763
590 2.771430381 172.31.31.144 -> 172.31.23.72 OpenFlow 146 Type: OFPT_FLOW_MOD
591 2.771442108 172.31.31.144 -> 172.31.23.72 OpenFlow 146 Type: OFPT_FLOW_MOD
592 2.771445943 172.31.31.144 -> 172.31.23.72 OpenFlow 146 Type: OFPT_FLOW_MOD
593 2.771449421 172.31.31.144 -> 172.31.23.72 OpenFlow 146 Type: OFPT_FLOW_MOD
594 2.771452002 172.31.31.144 -> 172.31.23.72 OpenFlow 322 Type: OFPT_BARRIER_REQUEST
595 2.771454908 172.31.31.144 -> 172.31.23.72 OpenFlow 234 Type: OFPT_BARRIER_REQUEST
596 2.771456622 172.31.31.144 -> 172.31.23.72 OpenFlow 234 Type: OFPT_BARRIER_REQUEST
597 2.771458388 172.31.31.144 -> 172.31.23.72 OpenFlow 146 Type: OFPT_FLOW_MOD
598 2.771460222 172.31.31.144 -> 172.31.23.72 OpenFlow 154 Type: OFPT_BARRIER_REQUEST
599 2.771461828 172.31.31.144 -> 172.31.23.72 OpenFlow 146 Type: OFPT_FLOW_MOD
600 2.771463045 172.31.31.144 -> 172.31.23.72 OpenFlow 74 Type: OFPT_BARRIER_REQUEST
601 2.771464525 172.31.31.144 -> 172.31.23.72 OpenFlow 74 Type: OFPT_BARRIER_REQUEST
602 2.771621844 172.31.23.72 -> 172.31.31.144 OpenFlow 74 Type: OFPT_BARRIER_REPLY
603 2.771655582 172.31.23.72 -> 172.31.31.144 OpenFlow 74 Type: OFPT_BARRIER_REPLY
604 2.771687858 172.31.23.72 -> 172.31.31.144 OpenFlow 74 Type: OFPT_BARRIER_REPLY
605 2.771732838 172.31.23.72 -> 172.31.31.144 TCP 66 45510 → 6633 [ACK] Seq=541 Ack=1201 Win=213 Len=0 TSval=29985769 TSecr=1164178
606 2.771741826 172.31.23.72 -> 172.31.31.144 OpenFlow 74 Type: OFPT_BARRIER_REPLY
607 2.771807994 172.31.23.72 -> 172.31.31.144 OpenFlow 74 Type: OFPT_BARRIER_REPLY
608 2.771815109 172.31.23.72 -> 172.31.31.144 OpenFlow 74 Type: OFPT_BARRIER_REPLY
609 2.771923747 172.31.23.72 -> 172.31.31.144 OpenFlow 74 Type: OFPT_BARRIER_REPLY
610 2.771970032 172.31.31.144 -> 172.31.23.72 TCP 66 6633 → 45514 [ACK] Seq=1369 Ack=549 Win=853 Len=0 TSval=1164178 TSecr=29985769
611 2.771976547 172.31.31.144 -> 172.31.23.72 TCP 66 6633 → 45514 [ACK] Seq=1369 Ack=557 Win=853 Len=0 TSval=1164178 TSecr=29985769
612 2.772000473 172.31.23.72 -> 172.31.31.144 OpenFlow 146 Type: OFPT_FLOW_REMOVED
613 2.772017634 172.31.23.72 -> 172.31.31.144 OpenFlow 146 Type: OFPT_FLOW_REMOVED
614 2.772025053 172.31.23.72 -> 172.31.31.144 OpenFlow 306 Type: OFPT_FLOW_REMOVED
615 2.772038202 172.31.23.72 -> 172.31.31.144 OpenFlow 146 Type: OFPT_FLOW_REMOVED
616 2.772046508 172.31.23.72 -> 172.31.31.144 OpenFlow 146 Type: OFPT_FLOW_REMOVED
617 2.772094700 172.31.31.144 -> 172.31.23.72 TCP 66 6633 → 45512 [ACK] Seq=1611 Ack=637 Win=853 Len=0 TSval=1164178 TSecr=29985769
618 2.772100105 172.31.23.72 -> 172.31.31.144 OpenFlow 306 Type: OFPT_FLOW_REMOVED
619 2.772206335 172.31.23.72 -> 172.31.31.144 OpenFlow 146 Type: OFPT_FLOW_REMOVED
620 2.772269050 172.31.31.144 -> 172.31.23.72 TCP 66 6633 → 45516 [ACK] Seq=401 Ack=637 Win=853 Len=0 TSval=1164178 TSecr=29985769
621 2.772273619 172.31.23.72 -> 172.31.31.144 OpenFlow 306 Type: OFPT_FLOW_REMOVED
622 2.772277797 172.31.31.144 -> 172.31.23.72 TCP 66 6633 → 45514 [ACK] Seq=1369 Ack=637 Win=853 Len=0 TSval=1164178 TSecr=29985769
623 2.772528829 172.31.31.144 -> 172.31.23.72 OpenFlow 170 Type: OFPT_FLOW_MOD
624 2.772532682 172.31.31.144 -> 172.31.23.72 OpenFlow 178 Type: OFPT_BARRIER_REQUEST
625 2.772535391 172.31.31.144 -> 172.31.23.72 OpenFlow 170 Type: OFPT_FLOW_MOD
626 2.772537571 172.31.31.144 -> 172.31.23.72 OpenFlow 170 Type: OFPT_FLOW_MOD
627 2.772539804 172.31.31.144 -> 172.31.23.72 OpenFlow 178 Type: OFPT_BARRIER_REQUEST
628 2.772541585 172.31.31.144 -> 172.31.23.72 OpenFlow 170 Type: OFPT_FLOW_MOD
629 2.772543041 172.31.31.144 -> 172.31.23.72 OpenFlow 282 Type: OFPT_FLOW_MOD
630 2.772544539 172.31.31.144 -> 172.31.23.72 OpenFlow 178 Type: OFPT_BARRIER_REQUEST
631 2.772546712 172.31.31.144 -> 172.31.23.72 OpenFlow 170 Type: OFPT_FLOW_MOD
632 2.772547843 172.31.31.144 -> 172.31.23.72 OpenFlow 74 Type: OFPT_BARRIER_REQUEST
633 2.772673575 172.31.31.144 -> 172.31.23.72 OpenFlow 170 Type: OFPT_FLOW_MOD
634 2.772676049 172.31.31.144 -> 172.31.23.72 OpenFlow 170 Type: OFPT_FLOW_MOD
635 2.772678155 172.31.31.144 -> 172.31.23.72 OpenFlow 170 Type: OFPT_FLOW_MOD
636 2.772680329 172.31.31.144 -> 172.31.23.72 OpenFlow 170 Type: OFPT_FLOW_MOD
637 2.772759464 172.31.31.144 -> 172.31.23.72 TCP 66 6633 → 45516 [ACK] Seq=401 Ack=957 Win=853 Len=0 TSval=1164178 TSecr=29985769
638 2.772801653 172.31.31.144 -> 172.31.23.72 OpenFlow 170 Type: OFPT_FLOW_MOD
639 2.774323737 172.31.23.72 -> 172.31.31.144 OpenFlow 74 Type: OFPT_BARRIER_REPLY
640 2.774357672 172.31.23.72 -> 172.31.31.144 OpenFlow 74 Type: OFPT_BARRIER_REPLY
641 2.774412144 172.31.23.72 -> 172.31.31.144 OpenFlow 74 Type: OFPT_BARRIER_REPLY
642 2.774460215 172.31.23.72 -> 172.31.31.144 OpenFlow 74 Type: OFPT_BARRIER_REPLY
643 2.774503414 172.31.23.72 -> 172.31.31.144 OpenFlow 74 Type: OFPT_BARRIER_REPLY
644 2.774607374 172.31.31.144 -> 172.31.23.72 TCP 66 6633 → 45514 [ACK] Seq=1905 Ack=893 Win=853 Len=0 TSval=1164179 TSecr=29985770
645 2.774678033 172.31.31.144 -> 172.31.23.72 TCP 66 6633 → 45512 [ACK] Seq=2251 Ack=973 Win=853 Len=0 TSval=1164179 TSecr=29985770
646 2.806561473 172.31.31.144 -> 172.31.23.72 OpenFlow 187 Type: OFPT_PACKET_OUT
647 2.806591256 172.31.31.144 -> 172.31.23.72 OpenFlow 187 Type: OFPT_PACKET_OUT
648 2.806613344 172.31.31.144 -> 172.31.23.72 OpenFlow 187 Type: OFPT_PACKET_OUT
649 2.806651506 172.31.31.144 -> 172.31.23.72 OpenFlow 187 Type: OFPT_PACKET_OUT
650 2.806702390 172.31.31.144 -> 172.31.23.72 OpenFlow 187 Type: OFPT_PACKET_OUT
651 2.806761978 172.31.31.144 -> 172.31.23.72 OpenFlow 187 Type: OFPT_PACKET_OUT
652 2.806815187 172.31.31.144 -> 172.31.23.72 OpenFlow 187 Type: OFPT_PACKET_OUT
653 2.806867165 172.31.31.144 -> 172.31.23.72 OpenFlow 187 Type: OFPT_PACKET_OUT
654 2.806975214 172.31.31.144 -> 172.31.23.72 OpenFlow 187 Type: OFPT_PACKET_OUT
655 2.807005987 172.31.31.144 -> 172.31.23.72 OpenFlow 187 Type: OFPT_PACKET_OUT
656 2.807035971 172.31.31.144 -> 172.31.23.72 OpenFlow 187 Type: OFPT_PACKET_OUT
657 2.807096225 172.31.31.144 -> 172.31.23.72 OpenFlow 187 Type: OFPT_PACKET_OUT
658 2.807134642 172.31.31.144 -> 172.31.23.72 OpenFlow 187 Type: OFPT_PACKET_OUT
659 2.807186038 172.31.31.144 -> 172.31.23.72 OpenFlow 187 Type: OFPT_PACKET_OUT
660 2.807239640 172.31.31.144 -> 172.31.23.72 OpenFlow 187 Type: OFPT_PACKET_OUT
661 2.807308146 172.31.31.144 -> 172.31.23.72 OpenFlow 187 Type: OFPT_PACKET_OUT
662 2.807358238 172.31.23.72 -> 172.31.31.144 TCP 66 45552 → 6633 [ACK] Seq=9173 Ack=1129 Win=213 Len=0 TSval=29985778 TSecr=1164187
663 2.807432285 172.31.23.72 -> 172.31.31.144 OpenFlow 189 Type: OFPT_PACKET_IN
664 2.807469812 172.31.31.144 -> 172.31.23.72 OpenFlow 187 Type: OFPT_PACKET_OUT
665 2.807475938 172.31.31.144 -> 172.31.23.72 OpenFlow 187 Type: OFPT_PACKET_OUT
666 2.807478167 172.31.31.144 -> 172.31.23.72 OpenFlow 187 Type: OFPT_PACKET_OUT
667 2.807537997 172.31.23.72 -> 172.31.31.144 OpenFlow 189 Type: OFPT_PACKET_IN
668 2.807654040 172.31.31.144 -> 172.31.23.72 OpenFlow 187 Type: OFPT_PACKET_OUT
669 2.807659346 172.31.31.144 -> 172.31.23.72 OpenFlow 187 Type: OFPT_PACKET_OUT
670 2.807661180 172.31.31.144 -> 172.31.23.72 OpenFlow 187 Type: OFPT_PACKET_OUT
671 2.807696841 172.31.31.144 -> 172.31.23.72 OpenFlow 187 Type: OFPT_PACKET_OUT
672 2.807751112 172.31.31.144 -> 172.31.23.72 TCP 66 6633 → 45550 [ACK] Seq=1129 Ack=7840 Win=853 Len=0 TSval=1164187 TSecr=29985778
673 2.807757724 172.31.31.144 -> 172.31.23.72 OpenFlow 187 Type: OFPT_PACKET_OUT
674 2.807794631 172.31.31.144 -> 172.31.23.72 OpenFlow 187 Type: OFPT_PACKET_OUT
675 2.807858685 172.31.31.144 -> 172.31.23.72 OpenFlow 187 Type: OFPT_PACKET_OUT
676 2.807904014 172.31.31.144 -> 172.31.23.72 OpenFlow 187 Type: OFPT_PACKET_OUT
677 2.807933607 172.31.31.144 -> 172.31.23.72 TCP 66 6633 → 45550 [ACK] Seq=1129 Ack=7963 Win=853 Len=0 TSval=1164187 TSecr=29985778
678 2.807954581 172.31.31.144 -> 172.31.23.72 OpenFlow 187 Type: OFPT_PACKET_OUT
679 2.807999268 172.31.31.144 -> 172.31.23.72 OpenFlow 187 Type: OFPT_PACKET_OUT
680 2.808052386 172.31.31.144 -> 172.31.23.72 OpenFlow 187 Type: OFPT_PACKET_OUT
681 2.808104189 172.31.23.72 -> 172.31.31.144 TCP 66 45508 → 6633 [ACK] Seq=541 Ack=791 Win=213 Len=0 TSval=29985778 TSecr=1164187
682 2.808177616 172.31.23.72 -> 172.31.31.144 OpenFlow 189 Type: OFPT_PACKET_IN
683 2.808193060 172.31.31.144 -> 172.31.23.72 OpenFlow 187 Type: OFPT_PACKET_OUT
684 2.808197801 172.31.31.144 -> 172.31.23.72 OpenFlow 187 Type: OFPT_PACKET_OUT
685 2.808206108 172.31.23.72 -> 172.31.31.144 OpenFlow 189 Type: OFPT_PACKET_IN
686 2.808268352 172.31.31.144 -> 172.31.23.72 OpenFlow 187 Type: OFPT_PACKET_OUT
687 2.808274285 172.31.31.144 -> 172.31.23.72 OpenFlow 187 Type: OFPT_PACKET_OUT
688 2.808351919 172.31.31.144 -> 172.31.23.72 OpenFlow 187 Type: OFPT_PACKET_OUT
689 2.808377261 172.31.31.144 -> 172.31.23.72 OpenFlow 187 Type: OFPT_PACKET_OUT
690 2.808417524 172.31.31.144 -> 172.31.23.72 TCP 66 6633 → 45548 [ACK] Seq=1129 Ack=9712 Win=853 Len=0 TSval=1164187 TSecr=29985778
691 2.808433577 172.31.31.144 -> 172.31.23.72 TCP 66 6633 → 45548 [ACK] Seq=1129 Ack=9835 Win=853 Len=0 TSval=1164187 TSecr=29985778
692 2.808444273 172.31.31.144 -> 172.31.23.72 OpenFlow 187 Type: OFPT_PACKET_OUT
693 2.808479360 172.31.31.144 -> 172.31.23.72 OpenFlow 187 Type: OFPT_PACKET_OUT
694 2.808554833 172.31.31.144 -> 172.31.23.72 OpenFlow 187 Type: OFPT_PACKET_OUT
695 2.808590549 172.31.31.144 -> 172.31.23.72 OpenFlow 187 Type: OFPT_PACKET_OUT
696 2.808649691 172.31.31.144 -> 172.31.23.72 OpenFlow 187 Type: OFPT_PACKET_OUT
697 2.808713934 172.31.31.144 -> 172.31.23.72 OpenFlow 187 Type: OFPT_PACKET_OUT
698 2.808772012 172.31.31.144 -> 172.31.23.72 OpenFlow 187 Type: OFPT_PACKET_OUT
699 2.808822819 172.31.31.144 -> 172.31.23.72 OpenFlow 187 Type: OFPT_PACKET_OUT
700 2.808856269 172.31.23.72 -> 172.31.31.144 TCP 66 45542 → 6633 [ACK] Seq=9307 Ack=887 Win=213 Len=0 TSval=29985778 TSecr=1164187
701 2.808869452 172.31.31.144 -> 172.31.23.72 OpenFlow 187 Type: OFPT_PACKET_OUT
702 2.808929872 172.31.31.144 -> 172.31.23.72 OpenFlow 187 Type: OFPT_PACKET_OUT
703 2.808984607 172.31.31.144 -> 172.31.23.72 OpenFlow 187 Type: OFPT_PACKET_OUT
704 2.809029091 172.31.31.144 -> 172.31.23.72 OpenFlow 187 Type: OFPT_PACKET_OUT
705 2.809082613 172.31.31.144 -> 172.31.23.72 OpenFlow 187 Type: OFPT_PACKET_OUT
706 2.809139905 172.31.31.144 -> 172.31.23.72 OpenFlow 187 Type: OFPT_PACKET_OUT
707 2.809195412 172.31.23.72 -> 172.31.31.144 TCP 66 45536 → 6633 [ACK] Seq=8475 Ack=887 Win=213 Len=0 TSval=29985778 TSecr=1164187
708 2.809205899 172.31.31.144 -> 172.31.23.72 OpenFlow 187 Type: OFPT_PACKET_OUT
709 2.809263708 172.31.31.144 -> 172.31.23.72 OpenFlow 187 Type: OFPT_PACKET_OUT
710 2.809308476 172.31.31.144 -> 172.31.23.72 OpenFlow 187 Type: OFPT_PACKET_OUT
711 2.809336531 172.31.31.144 -> 172.31.23.72 OpenFlow 187 Type: OFPT_PACKET_OUT
712 2.809393328 172.31.31.144 -> 172.31.23.72 OpenFlow 187 Type: OFPT_PACKET_OUT
713 2.809453677 172.31.31.144 -> 172.31.23.72 OpenFlow 187 Type: OFPT_PACKET_OUT
714 2.809745840 172.31.23.72 -> 172.31.31.144 TCP 66 45520 → 6633 [ACK] Seq=10193 Ack=1371 Win=213 Len=0 TSval=29985779 TSecr=1164187
715 2.809815552 172.31.23.72 -> 172.31.31.144 OpenFlow 189 Type: OFPT_PACKET_IN
716 2.809867511 172.31.23.72 -> 172.31.31.144 OpenFlow 189 Type: OFPT_PACKET_IN
717 2.810076179 172.31.31.144 -> 172.31.23.72 TCP 66 6633 → 45516 [ACK] Seq=885 Ack=1203 Win=853 Len=0 TSval=1164188 TSecr=29985779
718 2.810128982 172.31.23.72 -> 172.31.31.144 OpenFlow 189 Type: OFPT_PACKET_IN
719 2.810158460 172.31.23.72 -> 172.31.31.144 OpenFlow 189 Type: OFPT_PACKET_IN
720 2.810176106 172.31.23.72 -> 172.31.31.144 OpenFlow 189 Type: OFPT_PACKET_IN
721 2.810182227 172.31.23.72 -> 172.31.31.144 OpenFlow 435 Type: OFPT_PACKET_IN
722 2.810196901 172.31.23.72 -> 172.31.31.144 OpenFlow 189 Type: OFPT_PACKET_IN
723 2.810209966 172.31.23.72 -> 172.31.31.144 OpenFlow 189 Type: OFPT_PACKET_IN
724 2.810212119 172.31.23.72 -> 172.31.31.144 OpenFlow 189 Type: OFPT_PACKET_IN
725 2.810227344 172.31.23.72 -> 172.31.31.144 OpenFlow 189 Type: OFPT_PACKET_IN
726 2.810239912 172.31.23.72 -> 172.31.31.144 OpenFlow 189 Type: OFPT_PACKET_IN
727 2.810245056 172.31.23.72 -> 172.31.31.144 OpenFlow 189 Type: OFPT_PACKET_IN
728 2.810274513 172.31.23.72 -> 172.31.31.144 OpenFlow 189 Type: OFPT_PACKET_IN
729 2.810287453 172.31.23.72 -> 172.31.31.144 OpenFlow 189 Type: OFPT_PACKET_IN
730 2.810289663 172.31.23.72 -> 172.31.31.144 OpenFlow 189 Type: OFPT_PACKET_IN
731 2.810302342 172.31.23.72 -> 172.31.31.144 OpenFlow 189 Type: OFPT_PACKET_IN
732 2.810316438 172.31.23.72 -> 172.31.31.144 OpenFlow 189 Type: OFPT_PACKET_IN
733 2.810340403 172.31.23.72 -> 172.31.31.144 OpenFlow 189 Type: OFPT_PACKET_IN
734 2.810355841 172.31.23.72 -> 172.31.31.144 OpenFlow 189 Type: OFPT_PACKET_IN
735 2.810367365 172.31.23.72 -> 172.31.31.144 OpenFlow 189 Type: OFPT_PACKET_IN
736 2.810395284 172.31.23.72 -> 172.31.31.144 OpenFlow 189 Type: OFPT_PACKET_IN
737 2.810397777 172.31.23.72 -> 172.31.31.144 OpenFlow 435 Type: OFPT_PACKET_IN
738 2.810526766 172.31.31.144 -> 172.31.23.72 TCP 66 6633 → 45546 [ACK] Seq=1129 Ack=9258 Win=853 Len=0 TSval=1164188 TSecr=29985779
739 2.810533750 172.31.31.144 -> 172.31.23.72 TCP 66 6633 → 45534 [ACK] Seq=887 Ack=8352 Win=853 Len=0 TSval=1164188 TSecr=29985779
740 2.810536018 172.31.31.144 -> 172.31.23.72 TCP 66 6633 → 45546 [ACK] Seq=1129 Ack=9627 Win=853 Len=0 TSval=1164188 TSecr=29985779
741 2.810537953 172.31.31.144 -> 172.31.23.72 TCP 66 6633 → 45528 [ACK] Seq=1371 Ack=11356 Win=853 Len=0 TSval=1164188 TSecr=29985779
742 2.810543673 172.31.23.72 -> 172.31.31.144 OpenFlow 189 Type: OFPT_PACKET_IN
743 2.810549952 172.31.23.72 -> 172.31.31.144 OpenFlow 681 Type: OFPT_PACKET_IN
744 2.810807097 172.31.23.72 -> 172.31.31.144 OpenFlow 189 Type: OFPT_PACKET_IN
745 2.810809045 172.31.23.72 -> 172.31.31.144 OpenFlow 189 Type: OFPT_PACKET_IN
746 2.810810774 172.31.23.72 -> 172.31.31.144 OpenFlow 189 Type: OFPT_PACKET_IN
747 2.810812618 172.31.23.72 -> 172.31.31.144 OpenFlow 681 Type: OFPT_PACKET_IN
748 2.810814176 172.31.23.72 -> 172.31.31.144 OpenFlow 435 Type: OFPT_PACKET_IN
749 2.811006337 172.31.31.144 -> 172.31.23.72 TCP 66 6633 → 45518 [ACK] Seq=1371 Ack=10694 Win=853 Len=0 TSval=1164188 TSecr=29985779
750 2.811009289 172.31.31.144 -> 172.31.23.72 TCP 66 6633 → 45534 [ACK] Seq=887 Ack=8475 Win=853 Len=0 TSval=1164188 TSecr=29985779
751 2.811011336 172.31.31.144 -> 172.31.23.72 TCP 66 6633 → 45538 [ACK] Seq=1371 Ack=10448 Win=853 Len=0 TSval=1164188 TSecr=29985779
752 2.811013397 172.31.31.144 -> 172.31.23.72 TCP 66 6633 → 45514 [ACK] Seq=1905 Ack=1139 Win=853 Len=0 TSval=1164188 TSecr=29985779
753 2.811015796 172.31.31.144 -> 172.31.23.72 TCP 66 6633 → 45528 [ACK] Seq=1371 Ack=11479 Win=853 Len=0 TSval=1164188 TSecr=29985779
754 2.811017439 172.31.31.144 -> 172.31.23.72 TCP 66 6633 → 45524 [ACK] Seq=1371 Ack=9692 Win=853 Len=0 TSval=1164188 TSecr=29985779
755 2.811019408 172.31.31.144 -> 172.31.23.72 TCP 66 6633 → 45522 [ACK] Seq=887 Ack=8560 Win=853 Len=0 TSval=1164188 TSecr=29985779
756 2.811021440 172.31.31.144 -> 172.31.23.72 TCP 66 6633 → 45510 [ACK] Seq=1625 Ack=840 Win=853 Len=0 TSval=1164188 TSecr=29985770
757 2.811023530 172.31.31.144 -> 172.31.23.72 TCP 66 6633 → 45540 [ACK] Seq=1371 Ack=9824 Win=853 Len=0 TSval=1164188 TSecr=29985779
758 2.811026179 172.31.31.144 -> 172.31.23.72 TCP 66 6633 → 45554 [ACK] Seq=887 Ack=8692 Win=853 Len=0 TSval=1164188 TSecr=29985779
759 2.811031777 172.31.23.72 -> 172.31.31.144 OpenFlow 189 Type: OFPT_PACKET_IN
760 2.811044541 172.31.23.72 -> 172.31.31.144 OpenFlow 189 Type: OFPT_PACKET_IN
761 2.811046466 172.31.23.72 -> 172.31.31.144 OpenFlow 189 Type: OFPT_PACKET_IN
762 2.811277510 172.31.31.144 -> 172.31.23.72 TCP 66 6633 → 45552 [ACK] Seq=1129 Ack=9296 Win=853 Len=0 TSval=1164188 TSecr=29985779
763 2.811280038 172.31.31.144 -> 172.31.23.72 TCP 66 6633 → 45550 [ACK] Seq=1129 Ack=8086 Win=853 Len=0 TSval=1164188 TSecr=29985779
764 2.811281804 172.31.31.144 -> 172.31.23.72 TCP 66 6633 → 45520 [ACK] Seq=1371 Ack=10316 Win=853 Len=0 TSval=1164188 TSecr=29985779
765 2.811283556 172.31.31.144 -> 172.31.23.72 TCP 66 6633 → 45518 [ACK] Seq=1371 Ack=11063 Win=853 Len=0 TSval=1164188 TSecr=29985779
766 2.811285520 172.31.31.144 -> 172.31.23.72 TCP 66 6633 → 45512 [ACK] Seq=2251 Ack=1219 Win=853 Len=0 TSval=1164188 TSecr=29985779
767 2.811287547 172.31.31.144 -> 172.31.23.72 TCP 66 6633 → 45538 [ACK] Seq=1371 Ack=11063 Win=853 Len=0 TSval=1164188 TSecr=29985779
768 2.811399133 172.31.31.144 -> 172.31.23.72 TCP 66 6633 → 45524 [ACK] Seq=1371 Ack=9815 Win=853 Len=0 TSval=1164188 TSecr=29985779
769 2.811401276 172.31.31.144 -> 172.31.23.72 TCP 66 6633 → 45522 [ACK] Seq=887 Ack=8683 Win=853 Len=0 TSval=1164188 TSecr=29985779
770 2.811402817 172.31.31.144 -> 172.31.23.72 TCP 66 6633 → 45540 [ACK] Seq=1371 Ack=10439 Win=853 Len=0 TSval=1164188 TSecr=29985779
771 2.811404697 172.31.31.144 -> 172.31.23.72 TCP 66 6633 → 45554 [ACK] Seq=887 Ack=9061 Win=853 Len=0 TSval=1164188 TSecr=29985779
772 2.811468506 172.31.31.144 -> 172.31.23.72 TCP 66 6633 → 45552 [ACK] Seq=1129 Ack=9419 Win=853 Len=0 TSval=1164188 TSecr=29985779
773 2.811557137 172.31.31.144 -> 172.31.23.72 TCP 66 6633 → 45550 [ACK] Seq=1129 Ack=8209 Win=853 Len=0 TSval=1164188 TSecr=29985779
774 2.811560656 172.31.31.144 -> 172.31.23.72 TCP 66 6633 → 45520 [ACK] Seq=1371 Ack=10439 Win=853 Len=0 TSval=1164188 TSecr=29985779
775 2.849994743 172.31.31.144 -> 172.31.23.72 TCP 66 6633 → 45510 [ACK] Seq=1625 Ack=963 Win=853 Len=0 TSval=1164198 TSecr=29985779
776 4.796460481 172.31.31.144 -> 172.31.23.72 OpenFlow 122 Type: OFPT_MULTIPART_REQUEST, OFPMP_FLOW
777 4.796481634 172.31.31.144 -> 172.31.23.72 OpenFlow 106 Type: OFPT_MULTIPART_REQUEST, OFPMP_PORT_STATS
778 4.796776233 172.31.23.72 -> 172.31.31.144 OpenFlow 2634 Type: OFPT_MULTIPART_REPLY, OFPMP_FLOW
779 4.796945361 172.31.23.72 -> 172.31.31.144 OpenFlow 6178 Type: OFPT_MULTIPART_REPLY, OFPMP_TABLE
780 4.797032745 172.31.31.144 -> 172.31.23.72 TCP 66 6633 → 45508 [ACK] Seq=887 Ack=3109 Win=853 Len=0 TSval=1164684 TSecr=29986275
781 4.797049657 172.31.23.72 -> 172.31.31.144 OpenFlow 530 Type: OFPT_MULTIPART_REPLY, OFPMP_PORT_STATS
782 4.797179085 172.31.31.144 -> 172.31.23.72 TCP 66 6633 → 45508 [ACK] Seq=887 Ack=9221 Win=853 Len=0 TSval=1164684 TSecr=29986275
783 4.797224872 172.31.31.144 -> 172.31.23.72 TCP 66 6633 → 45508 [ACK] Seq=887 Ack=9685 Win=853 Len=0 TSval=1164684 TSecr=29986275
784 4.876764283 172.31.31.144 -> 172.31.23.72 OpenFlow 90 Type: OFPT_MULTIPART_REQUEST, OFPMP_PORT_STATS
785 4.877127428 172.31.23.72 -> 172.31.31.144 OpenFlow 642 Type: OFPT_MULTIPART_REPLY, OFPMP_PORT_STATS
786 4.877377297 172.31.31.144 -> 172.31.23.72 TCP 66 6633 → 45510 [ACK] Seq=1649 Ack=1539 Win=853 Len=0 TSval=1164704 TSecr=29986295
787 4.877845142 172.31.31.144 -> 172.31.23.72 OpenFlow 122 Type: OFPT_MULTIPART_REQUEST, OFPMP_FLOW
788 4.877856720 172.31.31.144 -> 172.31.23.72 OpenFlow 82 Type: OFPT_MULTIPART_REQUEST, OFPMP_TABLE
789 4.878061554 172.31.23.72 -> 172.31.31.144 OpenFlow 2010 Type: OFPT_MULTIPART_REPLY, OFPMP_FLOW
790 4.878233976 172.31.23.72 -> 172.31.31.144 OpenFlow 6178 Type: OFPT_MULTIPART_REPLY, OFPMP_TABLE
791 4.878484072 172.31.31.144 -> 172.31.23.72 TCP 66 6633 → 45510 [ACK] Seq=1721 Ack=9595 Win=853 Len=0 TSval=1164705 TSecr=29986296
792 4.884009953 172.31.31.144 -> 172.31.23.72 OpenFlow 82 Type: OFPT_MULTIPART_REQUEST, OFPMP_TABLE
793 4.884018212 172.31.31.144 -> 172.31.23.72 OpenFlow 146 Type: OFPT_MULTIPART_REQUEST, OFPMP_FLOW
794 4.884237592 172.31.23.72 -> 172.31.31.144 OpenFlow 6178 Type: OFPT_MULTIPART_REPLY, OFPMP_TABLE
795 4.884346446 172.31.23.72 -> 172.31.31.144 OpenFlow 754 Type: OFPT_MULTIPART_REPLY, OFPMP_PORT_STATS
796 4.884415052 172.31.23.72 -> 172.31.31.144 OpenFlow 2426 Type: OFPT_MULTIPART_REPLY, OFPMP_FLOW
797 4.884536112 172.31.31.144 -> 172.31.23.72 TCP 66 6633 → 45512 [ACK] Seq=2347 Ack=8019 Win=853 Len=0 TSval=1164706 TSecr=29986297
798 4.918137969 172.31.31.144 -> 172.31.23.72 OpenFlow 122 Type: OFPT_MULTIPART_REQUEST, OFPMP_FLOW
799 4.918157627 172.31.31.144 -> 172.31.23.72 OpenFlow 106 Type: OFPT_MULTIPART_REQUEST, OFPMP_TABLE
800 4.918294526 172.31.23.72 -> 172.31.31.144 OpenFlow 2010 Type: OFPT_MULTIPART_REPLY, OFPMP_FLOW
801 4.918388695 172.31.23.72 -> 172.31.31.144 OpenFlow 642 Type: OFPT_MULTIPART_REPLY, OFPMP_PORT_STATS
802 4.918560894 172.31.23.72 -> 172.31.31.144 OpenFlow 6178 Type: OFPT_MULTIPART_REPLY, OFPMP_TABLE
803 4.918626731 172.31.31.144 -> 172.31.23.72 TCP 66 6633 → 45514 [ACK] Seq=2001 Ack=3659 Win=853 Len=0 TSval=1164715 TSecr=29986306
804 4.921978113 172.31.31.144 -> 172.31.23.72 TCP 66 6633 → 45512 [ACK] Seq=2347 Ack=10379 Win=853 Len=0 TSval=1164716 TSecr=29986297
805 4.956335994 172.31.31.144 -> 172.31.23.72 OpenFlow 90 Type: OFPT_MULTIPART_REQUEST, OFPMP_PORT_STATS
806 4.956354102 172.31.31.144 -> 172.31.23.72 OpenFlow 138 Type: OFPT_MULTIPART_REQUEST, OFPMP_FLOW
807 4.956720258 172.31.23.72 -> 172.31.31.144 OpenFlow 530 Type: OFPT_MULTIPART_REPLY, OFPMP_PORT_STATS
808 4.956891822 172.31.23.72 -> 172.31.31.144 OpenFlow 6178 Type: OFPT_MULTIPART_REPLY, OFPMP_TABLE
809 4.956940688 172.31.23.72 -> 172.31.31.144 OpenFlow 762 Type: OFPT_MULTIPART_REPLY, OFPMP_FLOW
810 4.957185028 172.31.31.144 -> 172.31.23.72 TCP 66 6633 → 45516 [ACK] Seq=981 Ack=8475 Win=853 Len=0 TSval=1164724 TSecr=29986315
811 4.958031380 172.31.31.144 -> 172.31.23.72 TCP 66 6633 → 45514 [ACK] Seq=2001 Ack=9771 Win=853 Len=0 TSval=1164725 TSecr=29986306
812 4.999403223 172.31.31.144 -> 172.31.23.72 OpenFlow 90 Type: OFPT_MULTIPART_REQUEST, OFPMP_PORT_STATS
813 4.999420294 172.31.23.72 -> 172.31.31.144 TCP 66 45518 → 6633 [ACK] Seq=11063 Ack=1395 Win=213 Len=0 TSval=29986326 TSecr=1164735
814 4.999427370 172.31.31.144 -> 172.31.23.72 OpenFlow 138 Type: OFPT_MULTIPART_REQUEST, OFPMP_TABLE
815 4.999430962 172.31.23.72 -> 172.31.31.144 TCP 66 45518 → 6633 [ACK] Seq=11063 Ack=1467 Win=213 Len=0 TSval=29986326 TSecr=1164735
816 5.002832069 172.31.23.72 -> 172.31.31.144 OpenFlow 754 Type: OFPT_MULTIPART_REPLY, OFPMP_PORT_STATS
817 5.002917644 172.31.23.72 -> 172.31.31.144 OpenFlow 3050 Type: OFPT_MULTIPART_REPLY, OFPMP_FLOW
818 5.003063619 172.31.23.72 -> 172.31.31.144 OpenFlow 6178 Type: OFPT_MULTIPART_REPLY, OFPMP_TABLE
819 5.003088873 172.31.31.144 -> 172.31.23.72 TCP 66 6633 → 45518 [ACK] Seq=1467 Ack=11751 Win=853 Len=0 TSval=1164736 TSecr=29986327
820 5.003123239 172.31.31.144 -> 172.31.23.72 TCP 66 6633 → 45518 [ACK] Seq=1467 Ack=14735 Win=853 Len=0 TSval=1164736 TSecr=29986327
821 5.003300918 172.31.31.144 -> 172.31.23.72 TCP 66 6633 → 45518 [ACK] Seq=1467 Ack=20847 Win=853 Len=0 TSval=1164736 TSecr=29986327
822 5.042588185 172.31.31.144 -> 172.31.23.72 OpenFlow 122 Type: OFPT_MULTIPART_REQUEST, OFPMP_FLOW
823 5.042624667 172.31.31.144 -> 172.31.23.72 OpenFlow 106 Type: OFPT_MULTIPART_REQUEST, OFPMP_PORT_STATS
824 5.043002478 172.31.23.72 -> 172.31.31.144 OpenFlow 2426 Type: OFPT_MULTIPART_REPLY, OFPMP_FLOW
825 5.043174280 172.31.23.72 -> 172.31.31.144 OpenFlow 6178 Type: OFPT_MULTIPART_REPLY, OFPMP_TABLE
826 5.043245036 172.31.31.144 -> 172.31.23.72 TCP 66 6633 → 45520 [ACK] Seq=1467 Ack=12799 Win=853 Len=0 TSval=1164746 TSecr=29986337
827 5.043310054 172.31.23.72 -> 172.31.31.144 OpenFlow 754 Type: OFPT_MULTIPART_REPLY, OFPMP_PORT_STATS
828 5.043428129 172.31.31.144 -> 172.31.23.72 TCP 66 6633 → 45520 [ACK] Seq=1467 Ack=18911 Win=853 Len=0 TSval=1164746 TSecr=29986337
829 5.043500402 172.31.31.144 -> 172.31.23.72 TCP 66 6633 → 45520 [ACK] Seq=1467 Ack=19599 Win=853 Len=0 TSval=1164746 TSecr=29986337
830 5.080711775 172.31.31.144 -> 172.31.23.72 OpenFlow 122 Type: OFPT_MULTIPART_REQUEST, OFPMP_FLOW
831 5.080723371 172.31.31.144 -> 172.31.23.72 OpenFlow 106 Type: OFPT_MULTIPART_REQUEST, OFPMP_TABLE
832 5.080902051 172.31.23.72 -> 172.31.31.144 OpenFlow 1386 Type: OFPT_MULTIPART_REPLY, OFPMP_FLOW
833 5.080981765 172.31.23.72 -> 172.31.31.144 OpenFlow 530 Type: OFPT_MULTIPART_REPLY, OFPMP_PORT_STATS
834 5.081131386 172.31.31.144 -> 172.31.23.72 TCP 66 6633 → 45522 [ACK] Seq=983 Ack=10003 Win=853 Len=0 TSval=1164755 TSecr=29986346
835 5.081162773 172.31.23.72 -> 172.31.31.144 OpenFlow 6178 Type: OFPT_MULTIPART_REPLY, OFPMP_TABLE
836 5.081217307 172.31.31.144 -> 172.31.23.72 TCP 66 6633 → 45522 [ACK] Seq=983 Ack=10467 Win=853 Len=0 TSval=1164755 TSecr=29986346
837 5.081397616 172.31.31.144 -> 172.31.23.72 TCP 66 6633 → 45522 [ACK] Seq=983 Ack=16579 Win=853 Len=0 TSval=1164755 TSecr=29986346
838 5.125004867 172.31.31.144 -> 172.31.23.72 OpenFlow 90 Type: OFPT_MULTIPART_REQUEST, OFPMP_PORT_STATS
839 5.125029609 172.31.31.144 -> 172.31.23.72 OpenFlow 138 Type: OFPT_MULTIPART_REQUEST, OFPMP_TABLE
840 5.125397262 172.31.23.72 -> 172.31.31.144 OpenFlow 754 Type: OFPT_MULTIPART_REPLY, OFPMP_PORT_STATS
841 5.125474979 172.31.23.72 -> 172.31.31.144 OpenFlow 1802 Type: OFPT_MULTIPART_REPLY, OFPMP_FLOW
842 5.125640525 172.31.31.144 -> 172.31.23.72 TCP 66 6633 → 45524 [ACK] Seq=1467 Ack=10503 Win=853 Len=0 TSval=1164766 TSecr=29986357
843 5.125657989 172.31.31.144 -> 172.31.23.72 TCP 66 6633 → 45524 [ACK] Seq=1467 Ack=12239 Win=853 Len=0 TSval=1164766 TSecr=29986357
844 5.125698124 172.31.23.72 -> 172.31.31.144 OpenFlow 6178 Type: OFPT_MULTIPART_REPLY, OFPMP_TABLE
845 5.125931958 172.31.31.144 -> 172.31.23.72 TCP 66 6633 → 45524 [ACK] Seq=1467 Ack=18351 Win=853 Len=0 TSval=1164767 TSecr=29986358
846 5.167156406 172.31.31.144 -> 172.31.23.72 OpenFlow 90 Type: OFPT_MULTIPART_REQUEST, OFPMP_PORT_STATS
847 5.167174213 172.31.31.144 -> 172.31.23.72 OpenFlow 138 Type: OFPT_MULTIPART_REQUEST, OFPMP_FLOW
848 5.167433633 172.31.23.72 -> 172.31.31.144 OpenFlow 642 Type: OFPT_MULTIPART_REPLY, OFPMP_PORT_STATS
849 5.167601387 172.31.23.72 -> 172.31.31.144 OpenFlow 6178 Type: OFPT_MULTIPART_REPLY, OFPMP_TABLE
850 5.167669533 172.31.23.72 -> 172.31.31.144 OpenFlow 1802 Type: OFPT_MULTIPART_REPLY, OFPMP_FLOW
851 5.167693385 172.31.31.144 -> 172.31.23.72 TCP 66 6633 → 45526 [ACK] Seq=1225 Ack=10033 Win=853 Len=0 TSval=1164777 TSecr=29986368
852 5.167867657 172.31.31.144 -> 172.31.23.72 TCP 66 6633 → 45526 [ACK] Seq=1225 Ack=16145 Win=853 Len=0 TSval=1164777 TSecr=29986368
853 5.167888561 172.31.31.144 -> 172.31.23.72 TCP 66 6633 → 45526 [ACK] Seq=1225 Ack=17881 Win=853 Len=0 TSval=1164777 TSecr=29986368
854 5.228324042 172.31.31.144 -> 172.31.23.72 OpenFlow 122 Type: OFPT_MULTIPART_REQUEST, OFPMP_FLOW
855 5.228349273 172.31.31.144 -> 172.31.23.72 OpenFlow 106 Type: OFPT_MULTIPART_REQUEST, OFPMP_TABLE
856 5.228650735 172.31.23.72 -> 172.31.31.144 OpenFlow 3466 Type: OFPT_MULTIPART_REPLY, OFPMP_FLOW
857 5.228795522 172.31.23.72 -> 172.31.31.144 OpenFlow 754 Type: OFPT_MULTIPART_REPLY, OFPMP_PORT_STATS
858 5.228918017 172.31.31.144 -> 172.31.23.72 TCP 66 6633 → 45528 [ACK] Seq=1467 Ack=14879 Win=853 Len=0 TSval=1164792 TSecr=29986383
859 5.228964721 172.31.23.72 -> 172.31.31.144 OpenFlow 6178 Type: OFPT_MULTIPART_REPLY, OFPMP_TABLE
860 5.228971112 172.31.31.144 -> 172.31.23.72 TCP 66 6633 → 45528 [ACK] Seq=1467 Ack=15567 Win=853 Len=0 TSval=1164792 TSecr=29986383
861 5.229234350 172.31.31.144 -> 172.31.23.72 TCP 66 6633 → 45528 [ACK] Seq=1467 Ack=21679 Win=853 Len=0 TSval=1164792 TSecr=29986383
862 5.264431794 172.31.31.144 -> 172.31.23.72 OpenFlow 90 Type: OFPT_MULTIPART_REQUEST, OFPMP_PORT_STATS
863 5.264453786 172.31.31.144 -> 172.31.23.72 OpenFlow 138 Type: OFPT_MULTIPART_REQUEST, OFPMP_FLOW
864 5.264715511 172.31.23.72 -> 172.31.31.144 OpenFlow 642 Type: OFPT_MULTIPART_REPLY, OFPMP_PORT_STATS
865 5.264891854 172.31.23.72 -> 172.31.31.144 OpenFlow 6178 Type: OFPT_MULTIPART_REPLY, OFPMP_TABLE
866 5.264958406 172.31.23.72 -> 172.31.31.144 OpenFlow 1802 Type: OFPT_MULTIPART_REPLY, OFPMP_FLOW
867 5.264966748 172.31.31.144 -> 172.31.23.72 TCP 66 6633 → 45530 [ACK] Seq=1225 Ack=10033 Win=853 Len=0 TSval=1164801 TSecr=29986392
868 5.265149458 172.31.31.144 -> 172.31.23.72 TCP 66 6633 → 45530 [ACK] Seq=1225 Ack=16145 Win=853 Len=0 TSval=1164801 TSecr=29986392
869 5.265167544 172.31.31.144 -> 172.31.23.72 TCP 66 6633 → 45530 [ACK] Seq=1225 Ack=17881 Win=853 Len=0 TSval=1164801 TSecr=29986392
870 5.339586396 172.31.31.144 -> 172.31.23.72 OpenFlow 90 Type: OFPT_MULTIPART_REQUEST, OFPMP_PORT_STATS
871 5.339902445 172.31.23.72 -> 172.31.31.144 OpenFlow 642 Type: OFPT_MULTIPART_REPLY, OFPMP_PORT_STATS
872 5.340164868 172.31.31.144 -> 172.31.23.72 TCP 66 6633 → 45532 [ACK] Seq=1153 Ack=9201 Win=853 Len=0 TSval=1164820 TSecr=29986411
873 5.340689477 172.31.31.144 -> 172.31.23.72 OpenFlow 122 Type: OFPT_MULTIPART_REQUEST, OFPMP_FLOW
874 5.340699964 172.31.31.144 -> 172.31.23.72 OpenFlow 82 Type: OFPT_MULTIPART_REQUEST, OFPMP_TABLE
875 5.340829373 172.31.23.72 -> 172.31.31.144 OpenFlow 970 Type: OFPT_MULTIPART_REPLY, OFPMP_FLOW
876 5.341003593 172.31.23.72 -> 172.31.31.144 OpenFlow 6178 Type: OFPT_MULTIPART_REPLY, OFPMP_TABLE
877 5.341305986 172.31.31.144 -> 172.31.23.72 TCP 66 6633 → 45532 [ACK] Seq=1225 Ack=16217 Win=853 Len=0 TSval=1164820 TSecr=29986411
878 5.384982883 172.31.31.144 -> 172.31.23.72 OpenFlow 122 Type: OFPT_MULTIPART_REQUEST, OFPMP_FLOW
879 5.385001396 172.31.31.144 -> 172.31.23.72 OpenFlow 90 Type: OFPT_MULTIPART_REQUEST, OFPMP_PORT_STATS
880 5.385179508 172.31.23.72 -> 172.31.31.144 OpenFlow 1178 Type: OFPT_MULTIPART_REPLY, OFPMP_FLOW
881 5.385275412 172.31.23.72 -> 172.31.31.144 OpenFlow 530 Type: OFPT_MULTIPART_REPLY, OFPMP_PORT_STATS
882 5.385388754 172.31.31.144 -> 172.31.23.72 TCP 66 6633 → 45534 [ACK] Seq=967 Ack=9587 Win=853 Len=0 TSval=1164831 TSecr=29986422
883 5.385462192 172.31.31.144 -> 172.31.23.72 TCP 66 6633 → 45534 [ACK] Seq=967 Ack=10051 Win=853 Len=0 TSval=1164831 TSecr=29986422
884 5.386056437 172.31.31.144 -> 172.31.23.72 OpenFlow 82 Type: OFPT_MULTIPART_REQUEST, OFPMP_TABLE
885 5.386270159 172.31.23.72 -> 172.31.31.144 OpenFlow 6178 Type: OFPT_MULTIPART_REPLY, OFPMP_TABLE
886 5.426037257 172.31.31.144 -> 172.31.23.72 TCP 66 6633 → 45534 [ACK] Seq=983 Ack=16163 Win=853 Len=0 TSval=1164842 TSecr=29986423
887 5.436208008 172.31.31.144 -> 172.31.23.72 OpenFlow 90 Type: OFPT_MULTIPART_REQUEST, OFPMP_PORT_STATS
888 5.436225221 172.31.31.144 -> 172.31.23.72 OpenFlow 138 Type: OFPT_MULTIPART_REQUEST, OFPMP_FLOW
889 5.436452787 172.31.23.72 -> 172.31.31.144 OpenFlow 530 Type: OFPT_MULTIPART_REPLY, OFPMP_PORT_STATS
890 5.436610538 172.31.23.72 -> 172.31.31.144 OpenFlow 6178 Type: OFPT_MULTIPART_REPLY, OFPMP_TABLE
891 5.436662391 172.31.23.72 -> 172.31.31.144 OpenFlow 1178 Type: OFPT_MULTIPART_REPLY, OFPMP_FLOW
892 5.436672515 172.31.31.144 -> 172.31.23.72 TCP 66 6633 → 45536 [ACK] Seq=983 Ack=8939 Win=853 Len=0 TSval=1164844 TSecr=29986435
893 5.436850566 172.31.31.144 -> 172.31.23.72 TCP 66 6633 → 45536 [ACK] Seq=983 Ack=15051 Win=853 Len=0 TSval=1164844 TSecr=29986435
894 5.436868295 172.31.31.144 -> 172.31.23.72 TCP 66 6633 → 45536 [ACK] Seq=983 Ack=16163 Win=853 Len=0 TSval=1164844 TSecr=29986435
895 5.483386367 172.31.31.144 -> 172.31.23.72 OpenFlow 122 Type: OFPT_MULTIPART_REQUEST, OFPMP_FLOW
896 5.483402759 172.31.31.144 -> 172.31.23.72 OpenFlow 106 Type: OFPT_MULTIPART_REQUEST, OFPMP_TABLE
897 5.483630541 172.31.23.72 -> 172.31.31.144 OpenFlow 3050 Type: OFPT_MULTIPART_REPLY, OFPMP_FLOW
898 5.483747215 172.31.23.72 -> 172.31.31.144 OpenFlow 754 Type: OFPT_MULTIPART_REPLY, OFPMP_PORT_STATS
899 5.483869821 172.31.31.144 -> 172.31.23.72 TCP 66 6633 → 45538 [ACK] Seq=1467 Ack=14047 Win=853 Len=0 TSval=1164856 TSecr=29986447
900 5.483919687 172.31.23.72 -> 172.31.31.144 OpenFlow 6178 Type: OFPT_MULTIPART_REPLY, OFPMP_TABLE
901 5.483926247 172.31.31.144 -> 172.31.23.72 TCP 66 6633 → 45538 [ACK] Seq=1467 Ack=14735 Win=853 Len=0 TSval=1164856 TSecr=29986447
902 5.484153500 172.31.31.144 -> 172.31.23.72 TCP 66 6633 → 45538 [ACK] Seq=1467 Ack=20847 Win=853 Len=0 TSval=1164856 TSecr=29986447
