  1 0.000000000 172.31.31.144 -> 172.31.23.72 TCP 90 6633 → 45420 [PSH, ACK] Seq=1 Ack=1 Win=853 Len=24 TSval=785031 TSecr=19354847
  2 0.000012294 172.31.31.144 -> 172.31.23.72 TCP 138 6633 → 45420 [PSH, ACK] Seq=25 Ack=1 Win=853 Len=72 TSval=785031 TSecr=19354847
  3 0.000165049 172.31.23.72 -> 172.31.31.144 OpenFlow 642 Type: OFPT_MULTIPART_REPLY, OFPMP_PORT_STATS
  4 0.000333797 172.31.23.72 -> 172.31.31.144 OpenFlow 6178 Type: OFPT_MULTIPART_REPLY, OFPMP_TABLE
  5 0.000397783 172.31.23.72 -> 172.31.31.144 OpenFlow 2010 Type: OFPT_MULTIPART_REPLY, OFPMP_FLOW
  6 0.000597440 172.31.31.144 -> 172.31.23.72 TCP 66 6633 → 45420 [ACK] Seq=97 Ack=8633 Win=853 Len=0 TSval=785031 TSecr=19355156
  7 0.014405019 172.31.31.144 -> 172.31.23.72 TCP 66 6633 → 45418 [ACK] Seq=1 Ack=1 Win=853 Len=0 TSval=785035 TSecr=19355149
  8 0.040277517 172.31.31.144 -> 172.31.23.72 TCP 90 6633 → 45422 [PSH, ACK] Seq=1 Ack=1 Win=853 Len=24 TSval=785041 TSecr=19354481
  9 0.040296177 172.31.31.144 -> 172.31.23.72 TCP 138 6633 → 45422 [PSH, ACK] Seq=25 Ack=1 Win=853 Len=72 TSval=785041 TSecr=19354481
 10 0.040554322 172.31.23.72 -> 172.31.31.144 OpenFlow 530 Type: OFPT_MULTIPART_REPLY, OFPMP_PORT_STATS
 11 0.040613245 172.31.23.72 -> 172.31.31.144 OpenFlow 1178 Type: OFPT_MULTIPART_REPLY, OFPMP_FLOW
 12 0.040750555 172.31.31.144 -> 172.31.23.72 TCP 66 6633 → 45422 [ACK] Seq=97 Ack=465 Win=853 Len=0 TSval=785041 TSecr=19355166
 13 0.040780051 172.31.31.144 -> 172.31.23.72 TCP 66 6633 → 45422 [ACK] Seq=97 Ack=1577 Win=853 Len=0 TSval=785041 TSecr=19355166
 14 0.040805763 172.31.23.72 -> 172.31.31.144 OpenFlow 6178 Type: OFPT_MULTIPART_REPLY, OFPMP_TABLE
 15 0.041015042 172.31.31.144 -> 172.31.23.72 TCP 66 6633 → 45422 [ACK] Seq=97 Ack=7689 Win=853 Len=0 TSval=785041 TSecr=19355166
 16 0.081438223 172.31.31.144 -> 172.31.23.72 TCP 90 6633 → 45424 [PSH, ACK] Seq=1 Ack=1 Win=853 Len=24 TSval=785051 TSecr=19354482
 17 0.081468777 172.31.31.144 -> 172.31.23.72 TCP 138 6633 → 45424 [PSH, ACK] Seq=25 Ack=1 Win=853 Len=72 TSval=785051 TSecr=19354482
 18 0.081636287 172.31.23.72 -> 172.31.31.144 OpenFlow 754 Type: OFPT_MULTIPART_REPLY, OFPMP_PORT_STATS
 19 0.081798615 172.31.23.72 -> 172.31.31.144 OpenFlow 6178 Type: OFPT_MULTIPART_REPLY, OFPMP_TABLE
 20 0.081808189 172.31.31.144 -> 172.31.23.72 TCP 66 6633 → 45424 [ACK] Seq=97 Ack=689 Win=853 Len=0 TSval=785051 TSecr=19355176
 21 0.081896413 172.31.23.72 -> 172.31.31.144 OpenFlow 3258 Type: OFPT_MULTIPART_REPLY, OFPMP_FLOW
 22 0.082000706 172.31.31.144 -> 172.31.23.72 TCP 66 6633 → 45424 [ACK] Seq=97 Ack=6801 Win=853 Len=0 TSval=785051 TSecr=19355176
 23 0.082064506 172.31.31.144 -> 172.31.23.72 TCP 66 6633 → 45424 [ACK] Seq=97 Ack=9993 Win=853 Len=0 TSval=785051 TSecr=19355176
 24 0.102494966 172.31.31.144 -> 172.31.23.72 TCP 187 6633 → 45452 [PSH, ACK] Seq=1 Ack=1 Win=853 Len=121 TSval=785057 TSecr=19354506
 25 0.102519078 172.31.31.144 -> 172.31.23.72 TCP 187 6633 → 45452 [PSH, ACK] Seq=122 Ack=1 Win=853 Len=121 TSval=785057 TSecr=19354506
 26 0.102574559 172.31.31.144 -> 172.31.23.72 TCP 187 6633 → 45452 [PSH, ACK] Seq=243 Ack=1 Win=853 Len=121 TSval=785057 TSecr=19354506
 27 0.102698353 172.31.23.72 -> 172.31.31.144 TCP 66 45452 → 6633 [ACK] Seq=1 Ack=364 Win=213 Len=0 TSval=19355181 TSecr=785057
 28 0.102721972 172.31.31.144 -> 172.31.23.72 TCP 187 6633 → 45452 [PSH, ACK] Seq=364 Ack=1 Win=853 Len=121 TSval=785057 TSecr=19354506
 29 0.102725004 172.31.31.144 -> 172.31.23.72 TCP 187 6633 → 45452 [PSH, ACK] Seq=485 Ack=1 Win=853 Len=121 TSval=785057 TSecr=19354506
 30 0.102782565 172.31.31.144 -> 172.31.23.72 TCP 187 6633 → 45452 [PSH, ACK] Seq=606 Ack=1 Win=853 Len=121 TSval=785057 TSecr=19354506
 31 0.102856831 172.31.31.144 -> 172.31.23.72 TCP 187 6633 → 45452 [PSH, ACK] Seq=727 Ack=1 Win=853 Len=121 TSval=785057 TSecr=19354506
 32 0.102873139 172.31.31.144 -> 172.31.23.72 TCP 187 6633 → 45452 [PSH, ACK] Seq=848 Ack=1 Win=853 Len=121 TSval=785057 TSecr=19354506
 33 0.102928188 172.31.23.72 -> 172.31.31.144 TCP 66 45452 → 6633 [ACK] Seq=1 Ack=969 Win=213 Len=0 TSval=19355181 TSecr=785057
 34 0.102987229 172.31.31.144 -> 172.31.23.72 TCP 187 6633 → 45462 [PSH, ACK] Seq=1 Ack=1 Win=853 Len=121 TSval=785057 TSecr=19354631
 35 0.103043804 172.31.31.144 -> 172.31.23.72 TCP 187 6633 → 45462 [PSH, ACK] Seq=122 Ack=1 Win=853 Len=121 TSval=785057 TSecr=19354631
 36 0.103093451 172.31.23.72 -> 172.31.31.144 TCP 66 45462 → 6633 [ACK] Seq=1 Ack=243 Win=213 Len=0 TSval=19355181 TSecr=785057
 37 0.103103962 172.31.31.144 -> 172.31.23.72 TCP 187 6633 → 45462 [PSH, ACK] Seq=243 Ack=1 Win=853 Len=121 TSval=785057 TSecr=19354631
 38 0.103180760 172.31.31.144 -> 172.31.23.72 TCP 187 6633 → 45462 [PSH, ACK] Seq=364 Ack=1 Win=853 Len=121 TSval=785057 TSecr=19354631
 39 0.103212161 172.31.23.72 -> 172.31.31.144 TCP 66 45462 → 6633 [ACK] Seq=1 Ack=485 Win=213 Len=0 TSval=19355181 TSecr=785057
 40 0.103277209 172.31.31.144 -> 172.31.23.72 TCP 187 6633 → 45462 [PSH, ACK] Seq=485 Ack=1 Win=853 Len=121 TSval=785057 TSecr=19355181
 41 0.103337471 172.31.23.72 -> 172.31.31.144 OpenFlow 189 Type: OFPT_PACKET_IN
 42 0.103347178 172.31.31.144 -> 172.31.23.72 TCP 187 6633 → 45462 [PSH, ACK] Seq=606 Ack=1 Win=853 Len=121 TSval=785057 TSecr=19355181
 43 0.103361339 172.31.23.72 -> 172.31.31.144 OpenFlow 189 Type: OFPT_PACKET_IN
 44 0.103378200 172.31.23.72 -> 172.31.31.144 OpenFlow 189 Type: OFPT_PACKET_IN
 45 0.103408459 172.31.23.72 -> 172.31.31.144 OpenFlow 189 Type: OFPT_PACKET_IN
 46 0.103424929 172.31.23.72 -> 172.31.31.144 OpenFlow 189 Type: OFPT_PACKET_IN
 47 0.103431633 172.31.31.144 -> 172.31.23.72 TCP 187 6633 → 45436 [PSH, ACK] Seq=1 Ack=1 Win=853 Len=121 TSval=785057 TSecr=19354433
 48 0.103436216 172.31.23.72 -> 172.31.31.144 TCP 66 45436 → 6633 [ACK] Seq=1 Ack=122 Win=213 Len=0 TSval=19355182 TSecr=785057
 49 0.103469090 172.31.23.72 -> 172.31.31.144 OpenFlow 189 Type: OFPT_PACKET_IN
 50 0.103471487 172.31.23.72 -> 172.31.31.144 OpenFlow 189 Type: OFPT_PACKET_IN
 51 0.103481463 172.31.31.144 -> 172.31.23.72 TCP 187 6633 → 45436 [PSH, ACK] Seq=122 Ack=1 Win=853 Len=121 TSval=785057 TSecr=19354433
 52 0.103485076 172.31.23.72 -> 172.31.31.144 TCP 66 45436 → 6633 [ACK] Seq=1 Ack=243 Win=213 Len=0 TSval=19355182 TSecr=785057
 53 0.103506037 172.31.23.72 -> 172.31.31.144 OpenFlow 189 Type: OFPT_PACKET_IN
 54 0.103606997 172.31.31.144 -> 172.31.23.72 TCP 187 6633 → 45436 [PSH, ACK] Seq=243 Ack=1 Win=853 Len=121 TSval=785057 TSecr=19354433
 55 0.103612736 172.31.23.72 -> 172.31.31.144 TCP 66 45436 → 6633 [ACK] Seq=1 Ack=364 Win=213 Len=0 TSval=19355182 TSecr=785057
 56 0.103621456 172.31.31.144 -> 172.31.23.72 TCP 66 6633 → 45438 [ACK] Seq=1 Ack=124 Win=853 Len=0 TSval=785057 TSecr=19355182
 57 0.103625639 172.31.31.144 -> 172.31.23.72 TCP 66 6633 → 45450 [ACK] Seq=1 Ack=247 Win=853 Len=0 TSval=785057 TSecr=19355182
 58 0.103628212 172.31.31.144 -> 172.31.23.72 TCP 66 6633 → 45438 [ACK] Seq=1 Ack=247 Win=853 Len=0 TSval=785057 TSecr=19355182
 59 0.103630127 172.31.31.144 -> 172.31.23.72 TCP 187 6633 → 45436 [PSH, ACK] Seq=364 Ack=1 Win=853 Len=121 TSval=785057 TSecr=19354433
 60 0.103632860 172.31.23.72 -> 172.31.31.144 TCP 66 45436 → 6633 [ACK] Seq=1 Ack=485 Win=213 Len=0 TSval=19355182 TSecr=785057
 61 0.103640469 172.31.23.72 -> 172.31.31.144 OpenFlow 189 Type: OFPT_PACKET_IN
 62 0.103645631 172.31.23.72 -> 172.31.31.144 OpenFlow 189 Type: OFPT_PACKET_IN
 63 0.103647532 172.31.31.144 -> 172.31.23.72 TCP 187 6633 → 45436 [PSH, ACK] Seq=485 Ack=1 Win=853 Len=121 TSval=785057 TSecr=19354433
 64 0.103649579 172.31.23.72 -> 172.31.31.144 TCP 66 45436 → 6633 [ACK] Seq=1 Ack=606 Win=213 Len=0 TSval=19355182 TSecr=785057
 65 0.103716296 172.31.31.144 -> 172.31.23.72 TCP 187 6633 → 45436 [PSH, ACK] Seq=606 Ack=1 Win=853 Len=121 TSval=785057 TSecr=19355182
 66 0.103722779 172.31.23.72 -> 172.31.31.144 TCP 66 45436 → 6633 [ACK] Seq=1 Ack=727 Win=213 Len=0 TSval=19355182 TSecr=785057
 67 0.103764001 172.31.23.72 -> 172.31.31.144 TCP 66 45462 → 6633 [ACK] Seq=1 Ack=727 Win=213 Len=0 TSval=19355182 TSecr=785057
 68 0.103826221 172.31.31.144 -> 172.31.23.72 TCP 66 6633 → 45442 [ACK] Seq=1 Ack=124 Win=853 Len=0 TSval=785057 TSecr=19355182
 69 0.103832923 172.31.31.144 -> 172.31.23.72 TCP 187 6633 → 45436 [PSH, ACK] Seq=727 Ack=1 Win=853 Len=121 TSval=785057 TSecr=19355182
 70 0.103837241 172.31.23.72 -> 172.31.31.144 TCP 66 45436 → 6633 [ACK] Seq=1 Ack=848 Win=213 Len=0 TSval=19355182 TSecr=785057
 71 0.103843027 172.31.31.144 -> 172.31.23.72 TCP 187 6633 → 45436 [PSH, ACK] Seq=848 Ack=1 Win=853 Len=121 TSval=785057 TSecr=19355182
 72 0.103845039 172.31.23.72 -> 172.31.31.144 TCP 66 45436 → 6633 [ACK] Seq=1 Ack=969 Win=213 Len=0 TSval=19355182 TSecr=785057
 73 0.103875328 172.31.31.144 -> 172.31.23.72 TCP 66 6633 → 45442 [ACK] Seq=1 Ack=247 Win=853 Len=0 TSval=785057 TSecr=19355182
 74 0.104051136 172.31.31.144 -> 172.31.23.72 TCP 66 6633 → 45454 [ACK] Seq=1 Ack=247 Win=853 Len=0 TSval=785057 TSecr=19355182
 75 0.104159050 172.31.31.144 -> 172.31.23.72 TCP 66 6633 → 45432 [ACK] Seq=1 Ack=247 Win=853 Len=0 TSval=785057 TSecr=19355182
 76 0.104249413 172.31.23.72 -> 172.31.31.144 OpenFlow 189 Type: OFPT_PACKET_IN
 77 0.104273006 172.31.23.72 -> 172.31.31.144 OpenFlow 189 Type: OFPT_PACKET_IN
 78 0.104290449 172.31.23.72 -> 172.31.31.144 OpenFlow 189 Type: OFPT_PACKET_IN
 79 0.104315306 172.31.23.72 -> 172.31.31.144 OpenFlow 189 Type: OFPT_PACKET_IN
 80 0.104332335 172.31.23.72 -> 172.31.31.144 OpenFlow 189 Type: OFPT_PACKET_IN
 81 0.104337751 172.31.23.72 -> 172.31.31.144 OpenFlow 189 Type: OFPT_PACKET_IN
 82 0.104385509 172.31.23.72 -> 172.31.31.144 OpenFlow 189 Type: OFPT_PACKET_IN
 83 0.104387841 172.31.23.72 -> 172.31.31.144 OpenFlow 189 Type: OFPT_PACKET_IN
 84 0.104484437 172.31.23.72 -> 172.31.31.144 OpenFlow 189 Type: OFPT_PACKET_IN
 85 0.104490611 172.31.23.72 -> 172.31.31.144 OpenFlow 189 Type: OFPT_PACKET_IN
 86 0.104538843 172.31.31.144 -> 172.31.23.72 TCP 66 6633 → 45434 [ACK] Seq=1 Ack=124 Win=853 Len=0 TSval=785057 TSecr=19355182
 87 0.104544268 172.31.31.144 -> 172.31.23.72 TCP 66 6633 → 45434 [ACK] Seq=1 Ack=247 Win=853 Len=0 TSval=785057 TSecr=19355182
 88 0.104548739 172.31.31.144 -> 172.31.23.72 TCP 66 6633 → 45438 [ACK] Seq=1 Ack=370 Win=853 Len=0 TSval=785057 TSecr=19355182
 89 0.104613145 172.31.31.144 -> 172.31.23.72 TCP 66 6633 → 45438 [ACK] Seq=1 Ack=493 Win=853 Len=0 TSval=785057 TSecr=19355182
 90 0.104678584 172.31.31.144 -> 172.31.23.72 TCP 66 6633 → 45448 [ACK] Seq=1 Ack=247 Win=853 Len=0 TSval=785057 TSecr=19355182
 91 0.104779160 172.31.31.144 -> 172.31.23.72 TCP 66 6633 → 45444 [ACK] Seq=1 Ack=247 Win=853 Len=0 TSval=785057 TSecr=19355182
 92 0.104842468 172.31.31.144 -> 172.31.23.72 TCP 66 6633 → 45430 [ACK] Seq=1 Ack=247 Win=853 Len=0 TSval=785057 TSecr=19355182
 93 0.155563752 172.31.31.144 -> 172.31.23.72 TCP 122 6633 → 45426 [PSH, ACK] Seq=1 Ack=1 Win=853 Len=56 TSval=785070 TSecr=19354482
 94 0.155577799 172.31.31.144 -> 172.31.23.72 TCP 106 6633 → 45426 [PSH, ACK] Seq=57 Ack=1 Win=853 Len=40 TSval=785070 TSecr=19354482
 95 0.155838391 172.31.23.72 -> 172.31.31.144 OpenFlow 2218 Type: OFPT_MULTIPART_REPLY, OFPMP_FLOW
 96 0.155999500 172.31.23.72 -> 172.31.31.144 OpenFlow 6178 Type: OFPT_MULTIPART_REPLY, OFPMP_TABLE
 97 0.156056185 172.31.31.144 -> 172.31.23.72 TCP 66 6633 → 45426 [ACK] Seq=97 Ack=2153 Win=853 Len=0 TSval=785070 TSecr=19355195
 98 0.156121054 172.31.23.72 -> 172.31.31.144 OpenFlow 754 Type: OFPT_MULTIPART_REPLY, OFPMP_PORT_STATS
 99 0.156208782 172.31.31.144 -> 172.31.23.72 TCP 66 6633 → 45426 [ACK] Seq=97 Ack=8265 Win=853 Len=0 TSval=785070 TSecr=19355195
100 0.156293615 172.31.31.144 -> 172.31.23.72 TCP 66 6633 → 45426 [ACK] Seq=97 Ack=8953 Win=853 Len=0 TSval=785070 TSecr=19355195
101 0.202242071 172.31.31.144 -> 172.31.23.72 OpenFlow 187 Type: OFPT_PACKET_OUT
102 0.202285300 172.31.31.144 -> 172.31.23.72 OpenFlow 187 Type: OFPT_PACKET_OUT
103 0.202338087 172.31.31.144 -> 172.31.23.72 OpenFlow 187 Type: OFPT_PACKET_OUT
104 0.202424793 172.31.31.144 -> 172.31.23.72 OpenFlow 187 Type: OFPT_PACKET_OUT
105 0.202498132 172.31.31.144 -> 172.31.23.72 OpenFlow 187 Type: OFPT_PACKET_OUT
106 0.202554290 172.31.31.144 -> 172.31.23.72 OpenFlow 187 Type: OFPT_PACKET_OUT
107 0.202611908 172.31.31.144 -> 172.31.23.72 OpenFlow 187 Type: OFPT_PACKET_OUT
108 0.202681524 172.31.31.144 -> 172.31.23.72 OpenFlow 187 Type: OFPT_PACKET_OUT
109 0.202774975 172.31.31.144 -> 172.31.23.72 OpenFlow 187 Type: OFPT_PACKET_OUT
110 0.202819140 172.31.31.144 -> 172.31.23.72 OpenFlow 187 Type: OFPT_PACKET_OUT
111 0.202847450 172.31.23.72 -> 172.31.31.144 TCP 66 45420 → 6633 [ACK] Seq=8633 Ack=1065 Win=213 Len=0 TSval=19355206 TSecr=785081
112 0.202870485 172.31.31.144 -> 172.31.23.72 OpenFlow 187 Type: OFPT_PACKET_OUT
113 0.202934359 172.31.31.144 -> 172.31.23.72 OpenFlow 187 Type: OFPT_PACKET_OUT
114 0.202992556 172.31.31.144 -> 172.31.23.72 OpenFlow 187 Type: OFPT_PACKET_OUT
115 0.203054814 172.31.31.144 -> 172.31.23.72 OpenFlow 187 Type: OFPT_PACKET_OUT
116 0.203127733 172.31.31.144 -> 172.31.23.72 OpenFlow 187 Type: OFPT_PACKET_OUT
117 0.203178488 172.31.31.144 -> 172.31.23.72 OpenFlow 187 Type: OFPT_PACKET_OUT
118 0.203231834 172.31.31.144 -> 172.31.23.72 OpenFlow 187 Type: OFPT_PACKET_OUT
119 0.203296406 172.31.31.144 -> 172.31.23.72 OpenFlow 187 Type: OFPT_PACKET_OUT
120 0.203358883 172.31.31.144 -> 172.31.23.72 OpenFlow 187 Type: OFPT_PACKET_OUT
121 0.203430318 172.31.23.72 -> 172.31.31.144 TCP 66 45424 → 6633 [ACK] Seq=9993 Ack=1307 Win=213 Len=0 TSval=19355207 TSecr=785082
122 0.203491500 172.31.31.144 -> 172.31.23.72 OpenFlow 187 Type: OFPT_PACKET_OUT
123 0.203529104 172.31.23.72 -> 172.31.31.144 OpenFlow 189 Type: OFPT_PACKET_IN
124 0.203556158 172.31.31.144 -> 172.31.23.72 OpenFlow 187 Type: OFPT_PACKET_OUT
125 0.203562220 172.31.31.144 -> 172.31.23.72 OpenFlow 187 Type: OFPT_PACKET_OUT
126 0.203567229 172.31.23.72 -> 172.31.31.144 OpenFlow 189 Type: OFPT_PACKET_IN
127 0.203592999 172.31.23.72 -> 172.31.31.144 OpenFlow 189 Type: OFPT_PACKET_IN
128 0.203609791 172.31.23.72 -> 172.31.31.144 OpenFlow 189 Type: OFPT_PACKET_IN
129 0.203624124 172.31.23.72 -> 172.31.31.144 OpenFlow 189 Type: OFPT_PACKET_IN
130 0.203655190 172.31.31.144 -> 172.31.23.72 OpenFlow 187 Type: OFPT_PACKET_OUT
131 0.203676277 172.31.23.72 -> 172.31.31.144 OpenFlow 189 Type: OFPT_PACKET_IN
132 0.203711553 172.31.23.72 -> 172.31.31.144 OpenFlow 189 Type: OFPT_PACKET_IN
133 0.203725703 172.31.23.72 -> 172.31.31.144 OpenFlow 189 Type: OFPT_PACKET_IN
134 0.203830626 172.31.23.72 -> 172.31.31.144 OpenFlow 189 Type: OFPT_PACKET_IN
135 0.203834713 172.31.23.72 -> 172.31.31.144 OpenFlow 189 Type: OFPT_PACKET_IN
136 0.203837001 172.31.23.72 -> 172.31.31.144 OpenFlow 189 Type: OFPT_PACKET_IN
137 0.203912248 172.31.31.144 -> 172.31.23.72 OpenFlow 187 Type: OFPT_PACKET_OUT
138 0.203919933 172.31.23.72 -> 172.31.31.144 OpenFlow 189 Type: OFPT_PACKET_IN
139 0.203926609 172.31.31.144 -> 172.31.23.72 OpenFlow 82 Type: OFPT_MULTIPART_REQUEST, OFPMP_TABLE
140 0.203930495 172.31.31.144 -> 172.31.23.72 OpenFlow 187 Type: OFPT_PACKET_OUT
141 0.203932400 172.31.31.144 -> 172.31.23.72 TCP 66 6633 → 45418 [ACK] Seq=1 Ack=124 Win=853 Len=0 TSval=785082 TSecr=19355207
142 0.203935705 172.31.31.144 -> 172.31.23.72 OpenFlow 146 Type: OFPT_MULTIPART_REQUEST, OFPMP_PORT_STATS
143 0.203938040 172.31.31.144 -> 172.31.23.72 OpenFlow 187 Type: OFPT_PACKET_OUT
144 0.203939551 172.31.31.144 -> 172.31.23.72 TCP 66 6633 → 45418 [ACK] Seq=1 Ack=247 Win=853 Len=0 TSval=785082 TSecr=19355207
145 0.203941731 172.31.31.144 -> 172.31.23.72 OpenFlow 187 Type: OFPT_PACKET_OUT
146 0.203943638 172.31.31.144 -> 172.31.23.72 OpenFlow 187 Type: OFPT_PACKET_OUT
147 0.203950793 172.31.23.72 -> 172.31.31.144 OpenFlow 189 Type: OFPT_PACKET_IN
148 0.203953200 172.31.23.72 -> 172.31.31.144 OpenFlow 189 Type: OFPT_PACKET_IN
149 0.203955007 172.31.23.72 -> 172.31.31.144 OpenFlow 189 Type: OFPT_PACKET_IN
150 0.204064021 172.31.31.144 -> 172.31.23.72 TCP 66 6633 → 45416 [ACK] Seq=1 Ack=124 Win=853 Len=0 TSval=785082 TSecr=19355207
151 0.204072604 172.31.23.72 -> 172.31.31.144 OpenFlow 189 Type: OFPT_PACKET_IN
152 0.204201712 172.31.31.144 -> 172.31.23.72 TCP 66 6633 → 45426 [ACK] Seq=97 Ack=9076 Win=853 Len=0 TSval=785082 TSecr=19355207
153 0.204207104 172.31.31.144 -> 172.31.23.72 TCP 66 6633 → 45422 [ACK] Seq=97 Ack=7812 Win=853 Len=0 TSval=785082 TSecr=19355207
154 0.204209235 172.31.31.144 -> 172.31.23.72 TCP 66 6633 → 45434 [ACK] Seq=1211 Ack=370 Win=853 Len=0 TSval=785082 TSecr=19355207
155 0.204217934 172.31.31.144 -> 172.31.23.72 TCP 66 6633 → 45430 [ACK] Seq=1 Ack=493 Win=853 Len=0 TSval=785082 TSecr=19355207
156 0.204292849 172.31.31.144 -> 172.31.23.72 TCP 66 6633 → 45416 [ACK] Seq=1 Ack=247 Win=853 Len=0 TSval=785082 TSecr=19355207
157 0.204298250 172.31.31.144 -> 172.31.23.72 TCP 66 6633 → 45426 [ACK] Seq=97 Ack=9199 Win=853 Len=0 TSval=785082 TSecr=19355207
158 0.204311967 172.31.31.144 -> 172.31.23.72 TCP 66 6633 → 45428 [ACK] Seq=97 Ack=247 Win=853 Len=0 TSval=785082 TSecr=19355207
159 0.204314661 172.31.31.144 -> 172.31.23.72 TCP 66 6633 → 45422 [ACK] Seq=97 Ack=7935 Win=853 Len=0 TSval=785082 TSecr=19355207
160 0.204395628 172.31.23.72 -> 172.31.31.144 TCP 66 45434 → 6633 [ACK] Seq=493 Ack=1211 Win=213 Len=0 TSval=19355207 TSecr=785082
161 0.204406075 172.31.31.144 -> 172.31.23.72 TCP 66 6633 → 45434 [ACK] Seq=1211 Ack=493 Win=853 Len=0 TSval=785082 TSecr=19355207
162 0.204475458 172.31.23.72 -> 172.31.31.144 OpenFlow 189 Type: OFPT_PACKET_IN
163 0.204494554 172.31.31.144 -> 172.31.23.72 TCP 66 6633 → 45414 [ACK] Seq=1 Ack=247 Win=853 Len=0 TSval=785082 TSecr=19355207
164 0.204501826 172.31.23.72 -> 172.31.31.144 OpenFlow 189 Type: OFPT_PACKET_IN
165 0.204533746 172.31.23.72 -> 172.31.31.144 OpenFlow 189 Type: OFPT_PACKET_IN
166 0.204553724 172.31.23.72 -> 172.31.31.144 OpenFlow 189 Type: OFPT_PACKET_IN
167 0.204558620 172.31.23.72 -> 172.31.31.144 OpenFlow 189 Type: OFPT_PACKET_IN
168 0.204613660 172.31.23.72 -> 172.31.31.144 OpenFlow 189 Type: OFPT_PACKET_IN
169 0.204637733 172.31.31.144 -> 172.31.23.72 OpenFlow 187 Type: OFPT_PACKET_OUT
170 0.204640599 172.31.31.144 -> 172.31.23.72 OpenFlow 550 Type: OFPT_PACKET_OUT
171 0.204660597 172.31.31.144 -> 172.31.23.72 TCP 66 6633 → 45424 [ACK] Seq=1307 Ack=10239 Win=853 Len=0 TSval=785082 TSecr=19355207
172 0.204763393 172.31.31.144 -> 172.31.23.72 TCP 66 6633 → 45450 [ACK] Seq=1 Ack=493 Win=853 Len=0 TSval=785082 TSecr=19355207
173 0.204776119 172.31.23.72 -> 172.31.31.144 OpenFlow 6178 Type: OFPT_MULTIPART_REPLY, OFPMP_TABLE
174 0.204833247 172.31.23.72 -> 172.31.31.144 OpenFlow 1386 Type: OFPT_MULTIPART_REPLY, OFPMP_FLOW
175 0.204899769 172.31.31.144 -> 172.31.23.72 OpenFlow 187 Type: OFPT_PACKET_OUT
176 0.204933865 172.31.31.144 -> 172.31.23.72 OpenFlow 187 Type: OFPT_PACKET_OUT
177 0.204953488 172.31.23.72 -> 172.31.31.144 OpenFlow 530 Type: OFPT_MULTIPART_REPLY, OFPMP_PORT_STATS
178 0.205002200 172.31.31.144 -> 172.31.23.72 TCP 66 6633 → 45430 [ACK] Seq=1 Ack=739 Win=853 Len=0 TSval=785082 TSecr=19355207
179 0.205011209 172.31.31.144 -> 172.31.23.72 OpenFlow 187 Type: OFPT_PACKET_OUT
180 0.205037575 172.31.23.72 -> 172.31.31.144 OpenFlow 189 Type: OFPT_PACKET_IN
181 0.205058626 172.31.23.72 -> 172.31.31.144 OpenFlow 189 Type: OFPT_PACKET_IN
182 0.205083768 172.31.31.144 -> 172.31.23.72 OpenFlow 187 Type: OFPT_PACKET_OUT
183 0.205119408 172.31.31.144 -> 172.31.23.72 TCP 66 6633 → 45428 [ACK] Seq=97 Ack=8143 Win=853 Len=0 TSval=785082 TSecr=19355207
184 0.205153231 172.31.31.144 -> 172.31.23.72 OpenFlow 187 Type: OFPT_PACKET_OUT
185 0.205166398 172.31.31.144 -> 172.31.23.72 TCP 66 6633 → 45442 [ACK] Seq=1 Ack=370 Win=853 Len=0 TSval=785082 TSecr=19355207
186 0.205200423 172.31.23.72 -> 172.31.31.144 OpenFlow 189 Type: OFPT_PACKET_IN
187 0.205219915 172.31.23.72 -> 172.31.31.144 OpenFlow 189 Type: OFPT_PACKET_IN
188 0.205249368 172.31.31.144 -> 172.31.23.72 TCP 66 6633 → 45442 [ACK] Seq=1 Ack=493 Win=853 Len=0 TSval=785082 TSecr=19355207
189 0.205294634 172.31.31.144 -> 172.31.23.72 OpenFlow 187 Type: OFPT_PACKET_OUT
190 0.205300368 172.31.23.72 -> 172.31.31.144 TCP 66 45444 → 6633 [ACK] Seq=247 Ack=122 Win=213 Len=0 TSval=19355207 TSecr=785082
191 0.205305835 172.31.31.144 -> 172.31.23.72 OpenFlow 187 Type: OFPT_PACKET_OUT
192 0.205308760 172.31.23.72 -> 172.31.31.144 TCP 66 45444 → 6633 [ACK] Seq=247 Ack=243 Win=213 Len=0 TSval=19355207 TSecr=785082
193 0.205363704 172.31.31.144 -> 172.31.23.72 OpenFlow 187 Type: OFPT_PACKET_OUT
194 0.205369167 172.31.23.72 -> 172.31.31.144 TCP 66 45444 → 6633 [ACK] Seq=247 Ack=364 Win=213 Len=0 TSval=19355207 TSecr=785082
195 0.205374650 172.31.31.144 -> 172.31.23.72 TCP 66 6633 → 45436 [ACK] Seq=969 Ack=124 Win=853 Len=0 TSval=785082 TSecr=19355207
196 0.205379365 172.31.31.144 -> 172.31.23.72 TCP 66 6633 → 45436 [ACK] Seq=969 Ack=247 Win=853 Len=0 TSval=785082 TSecr=19355207
197 0.205422138 172.31.31.144 -> 172.31.23.72 OpenFlow 187 Type: OFPT_PACKET_OUT
198 0.205427320 172.31.23.72 -> 172.31.31.144 TCP 66 45444 → 6633 [ACK] Seq=247 Ack=485 Win=213 Len=0 TSval=19355207 TSecr=785082
199 0.205474976 172.31.31.144 -> 172.31.23.72 OpenFlow 187 Type: OFPT_PACKET_OUT
200 0.205480468 172.31.23.72 -> 172.31.31.144 TCP 66 45444 → 6633 [ACK] Seq=247 Ack=606 Win=213 Len=0 TSval=19355207 TSecr=785082
201 0.205691663 172.31.31.144 -> 172.31.23.72 OpenFlow 187 Type: OFPT_PACKET_OUT
202 0.205709945 172.31.23.72 -> 172.31.31.144 TCP 66 45444 → 6633 [ACK] Seq=247 Ack=727 Win=213 Len=0 TSval=19355207 TSecr=785082
203 0.205716848 172.31.31.144 -> 172.31.23.72 OpenFlow 187 Type: OFPT_PACKET_OUT
204 0.205719301 172.31.23.72 -> 172.31.31.144 TCP 66 45444 → 6633 [ACK] Seq=247 Ack=848 Win=213 Len=0 TSval=19355207 TSecr=785082
205 0.205731595 172.31.23.72 -> 172.31.31.144 TCP 66 45418 → 6633 [ACK] Seq=247 Ack=1211 Win=213 Len=0 TSval=19355207 TSecr=785082
206 0.205814449 172.31.31.144 -> 172.31.23.72 OpenFlow 187 Type: OFPT_PACKET_OUT
207 0.205820822 172.31.23.72 -> 172.31.31.144 TCP 66 45444 → 6633 [ACK] Seq=247 Ack=969 Win=213 Len=0 TSval=19355207 TSecr=785082
208 0.205862841 172.31.31.144 -> 172.31.23.72 OpenFlow 187 Type: OFPT_PACKET_OUT
209 0.205868659 172.31.23.72 -> 172.31.31.144 TCP 66 45444 → 6633 [ACK] Seq=247 Ack=1090 Win=213 Len=0 TSval=19355207 TSecr=785082
210 0.205933262 172.31.31.144 -> 172.31.23.72 OpenFlow 187 Type: OFPT_PACKET_OUT
211 0.205939178 172.31.23.72 -> 172.31.31.144 TCP 66 45444 → 6633 [ACK] Seq=247 Ack=1211 Win=213 Len=0 TSval=19355207 TSecr=785082
212 0.206029840 172.31.31.144 -> 172.31.23.72 OpenFlow 187 Type: OFPT_PACKET_OUT
213 0.206045023 172.31.31.144 -> 172.31.23.72 OpenFlow 187 Type: OFPT_PACKET_OUT
214 0.206118607 172.31.31.144 -> 172.31.23.72 OpenFlow 187 Type: OFPT_PACKET_OUT
215 0.206184640 172.31.31.144 -> 172.31.23.72 OpenFlow 187 Type: OFPT_PACKET_OUT
216 0.206241128 172.31.31.144 -> 172.31.23.72 OpenFlow 187 Type: OFPT_PACKET_OUT
217 0.206306257 172.31.31.144 -> 172.31.23.72 OpenFlow 187 Type: OFPT_PACKET_OUT
218 0.206425826 172.31.31.144 -> 172.31.23.72 OpenFlow 187 Type: OFPT_PACKET_OUT
219 0.206485734 172.31.31.144 -> 172.31.23.72 OpenFlow 187 Type: OFPT_PACKET_OUT
220 0.206570751 172.31.31.144 -> 172.31.23.72 OpenFlow 187 Type: OFPT_PACKET_OUT
221 0.206620290 172.31.31.144 -> 172.31.23.72 OpenFlow 187 Type: OFPT_PACKET_OUT
222 0.206676230 172.31.31.144 -> 172.31.23.72 OpenFlow 187 Type: OFPT_PACKET_OUT
223 0.206733971 172.31.31.144 -> 172.31.23.72 OpenFlow 187 Type: OFPT_PACKET_OUT
224 0.206746357 172.31.23.72 -> 172.31.31.144 TCP 66 45438 → 6633 [ACK] Seq=493 Ack=969 Win=213 Len=0 TSval=19355207 TSecr=785082
225 0.206805324 172.31.31.144 -> 172.31.23.72 OpenFlow 187 Type: OFPT_PACKET_OUT
226 0.206865453 172.31.31.144 -> 172.31.23.72 OpenFlow 187 Type: OFPT_PACKET_OUT
227 0.206974577 172.31.31.144 -> 172.31.23.72 OpenFlow 187 Type: OFPT_PACKET_OUT
228 0.206988346 172.31.31.144 -> 172.31.23.72 OpenFlow 187 Type: OFPT_PACKET_OUT
229 0.206992547 172.31.23.72 -> 172.31.31.144 TCP 66 45450 → 6633 [ACK] Seq=493 Ack=727 Win=213 Len=0 TSval=19355207 TSecr=785083
230 0.207068869 172.31.31.144 -> 172.31.23.72 OpenFlow 187 Type: OFPT_PACKET_OUT
231 0.207115844 172.31.31.144 -> 172.31.23.72 OpenFlow 187 Type: OFPT_PACKET_OUT
232 0.207186256 172.31.31.144 -> 172.31.23.72 OpenFlow 187 Type: OFPT_PACKET_OUT
233 0.207241987 172.31.31.144 -> 172.31.23.72 OpenFlow 187 Type: OFPT_PACKET_OUT
234 0.207307679 172.31.31.144 -> 172.31.23.72 OpenFlow 187 Type: OFPT_PACKET_OUT
235 0.207368626 172.31.31.144 -> 172.31.23.72 OpenFlow 187 Type: OFPT_PACKET_OUT
236 0.207423002 172.31.31.144 -> 172.31.23.72 OpenFlow 187 Type: OFPT_PACKET_OUT
237 0.207484193 172.31.31.144 -> 172.31.23.72 OpenFlow 187 Type: OFPT_PACKET_OUT
238 0.207597492 172.31.23.72 -> 172.31.31.144 TCP 66 45430 → 6633 [ACK] Seq=739 Ack=1211 Win=213 Len=0 TSval=19355208 TSecr=785083
239 0.207617000 172.31.31.144 -> 172.31.23.72 OpenFlow 187 Type: OFPT_PACKET_OUT
240 0.207643045 172.31.31.144 -> 172.31.23.72 OpenFlow 187 Type: OFPT_PACKET_OUT
241 0.207661305 172.31.31.144 -> 172.31.23.72 OpenFlow 187 Type: OFPT_PACKET_OUT
242 0.207728230 172.31.31.144 -> 172.31.23.72 OpenFlow 187 Type: OFPT_PACKET_OUT
243 0.207808429 172.31.31.144 -> 172.31.23.72 OpenFlow 187 Type: OFPT_PACKET_OUT
244 0.207841883 172.31.31.144 -> 172.31.23.72 OpenFlow 187 Type: OFPT_PACKET_OUT
245 0.207939654 172.31.31.144 -> 172.31.23.72 OpenFlow 187 Type: OFPT_PACKET_OUT
246 0.207981411 172.31.31.144 -> 172.31.23.72 OpenFlow 187 Type: OFPT_PACKET_OUT
247 0.207986546 172.31.23.72 -> 172.31.31.144 TCP 66 45428 → 6633 [ACK] Seq=8143 Ack=823 Win=213 Len=0 TSval=19355208 TSecr=785083
248 0.208045694 172.31.31.144 -> 172.31.23.72 OpenFlow 187 Type: OFPT_PACKET_OUT
249 0.208066924 172.31.23.72 -> 172.31.31.144 OpenFlow 189 Type: OFPT_PACKET_IN
250 0.208106603 172.31.31.144 -> 172.31.23.72 OpenFlow 187 Type: OFPT_PACKET_OUT
251 0.208112757 172.31.23.72 -> 172.31.31.144 OpenFlow 189 Type: OFPT_PACKET_IN
252 0.208163576 172.31.31.144 -> 172.31.23.72 OpenFlow 187 Type: OFPT_PACKET_OUT
253 0.208229269 172.31.31.144 -> 172.31.23.72 OpenFlow 187 Type: OFPT_PACKET_OUT
254 0.208294140 172.31.31.144 -> 172.31.23.72 OpenFlow 187 Type: OFPT_PACKET_OUT
255 0.208365364 172.31.23.72 -> 172.31.31.144 TCP 66 45416 → 6633 [ACK] Seq=493 Ack=848 Win=213 Len=0 TSval=19355208 TSecr=785083
256 0.208435944 172.31.23.72 -> 172.31.31.144 OpenFlow 189 Type: OFPT_PACKET_IN
257 0.208459028 172.31.23.72 -> 172.31.31.144 OpenFlow 435 Type: OFPT_PACKET_IN
258 0.208472014 172.31.23.72 -> 172.31.31.144 OpenFlow 189 Type: OFPT_PACKET_IN
259 0.208500768 172.31.23.72 -> 172.31.31.144 OpenFlow 681 Type: OFPT_PACKET_IN
260 0.208508825 172.31.23.72 -> 172.31.31.144 OpenFlow 189 Type: OFPT_PACKET_IN
261 0.208522607 172.31.23.72 -> 172.31.31.144 OpenFlow 189 Type: OFPT_PACKET_IN
262 0.208539778 172.31.23.72 -> 172.31.31.144 OpenFlow 189 Type: OFPT_PACKET_IN
263 0.208541983 172.31.23.72 -> 172.31.31.144 OpenFlow 189 Type: OFPT_PACKET_IN
264 0.208558773 172.31.23.72 -> 172.31.31.144 OpenFlow 189 Type: OFPT_PACKET_IN
265 0.208564167 172.31.23.72 -> 172.31.31.144 OpenFlow 189 Type: OFPT_PACKET_IN
266 0.208580995 172.31.23.72 -> 172.31.31.144 OpenFlow 189 Type: OFPT_PACKET_IN
267 0.208583207 172.31.23.72 -> 172.31.31.144 OpenFlow 189 Type: OFPT_PACKET_IN
268 0.208600803 172.31.23.72 -> 172.31.31.144 OpenFlow 189 Type: OFPT_PACKET_IN
269 0.208631501 172.31.31.144 -> 172.31.23.72 TCP 66 6633 → 45446 [ACK] Seq=1 Ack=124 Win=853 Len=0 TSval=785083 TSecr=19355208
270 0.208637426 172.31.31.144 -> 172.31.23.72 TCP 66 6633 → 45446 [ACK] Seq=1 Ack=493 Win=853 Len=0 TSval=785083 TSecr=19355208
271 0.208678449 172.31.23.72 -> 172.31.31.144 OpenFlow 189 Type: OFPT_PACKET_IN
272 0.208684456 172.31.23.72 -> 172.31.31.144 OpenFlow 681 Type: OFPT_PACKET_IN
273 0.208736560 172.31.23.72 -> 172.31.31.144 OpenFlow 189 Type: OFPT_PACKET_IN
274 0.208739473 172.31.23.72 -> 172.31.31.144 OpenFlow 189 Type: OFPT_PACKET_IN
275 0.208754073 172.31.31.144 -> 172.31.23.72 TCP 66 6633 → 45432 [ACK] Seq=1 Ack=985 Win=853 Len=0 TSval=785083 TSecr=19355208
276 0.208759442 172.31.31.144 -> 172.31.23.72 OpenFlow 187 Type: OFPT_PACKET_OUT
277 0.208772788 172.31.23.72 -> 172.31.31.144 OpenFlow 189 Type: OFPT_PACKET_IN
278 0.208792161 172.31.23.72 -> 172.31.31.144 OpenFlow 189 Type: OFPT_PACKET_IN
279 0.208794588 172.31.23.72 -> 172.31.31.144 OpenFlow 189 Type: OFPT_PACKET_IN
280 0.208813225 172.31.23.72 -> 172.31.31.144 OpenFlow 189 Type: OFPT_PACKET_IN
281 0.208829497 172.31.23.72 -> 172.31.31.144 OpenFlow 189 Type: OFPT_PACKET_IN
282 0.208837916 172.31.31.144 -> 172.31.23.72 TCP 66 6633 → 45442 [ACK] Seq=1 Ack=616 Win=853 Len=0 TSval=785083 TSecr=19355208
283 0.208841560 172.31.31.144 -> 172.31.23.72 TCP 66 6633 → 45426 [ACK] Seq=97 Ack=9322 Win=853 Len=0 TSval=785083 TSecr=19355208
284 0.208843366 172.31.31.144 -> 172.31.23.72 TCP 66 6633 → 45422 [ACK] Seq=97 Ack=8058 Win=853 Len=0 TSval=785083 TSecr=19355208
285 0.208859611 172.31.23.72 -> 172.31.31.144 OpenFlow 189 Type: OFPT_PACKET_IN
286 0.208865428 172.31.23.72 -> 172.31.31.144 OpenFlow 189 Type: OFPT_PACKET_IN
287 0.208867094 172.31.23.72 -> 172.31.31.144 OpenFlow 681 Type: OFPT_PACKET_IN
288 0.208882241 172.31.23.72 -> 172.31.31.144 OpenFlow 189 Type: OFPT_PACKET_IN
289 0.208946835 172.31.31.144 -> 172.31.23.72 TCP 66 6633 → 45456 [ACK] Seq=1 Ack=247 Win=853 Len=0 TSval=785083 TSecr=19355208
290 0.208953143 172.31.31.144 -> 172.31.23.72 TCP 66 6633 → 45442 [ACK] Seq=1 Ack=739 Win=853 Len=0 TSval=785083 TSecr=19355208
291 0.208954990 172.31.31.144 -> 172.31.23.72 TCP 66 6633 → 45414 [ACK] Seq=1 Ack=493 Win=853 Len=0 TSval=785083 TSecr=19355208
292 0.208957227 172.31.31.144 -> 172.31.23.72 TCP 66 6633 → 45426 [ACK] Seq=97 Ack=9937 Win=853 Len=0 TSval=785083 TSecr=19355208
293 0.208958808 172.31.31.144 -> 172.31.23.72 TCP 66 6633 → 45422 [ACK] Seq=97 Ack=8181 Win=853 Len=0 TSval=785083 TSecr=19355208
294 0.208964605 172.31.23.72 -> 172.31.31.144 OpenFlow 435 Type: OFPT_PACKET_IN
295 0.208971386 172.31.23.72 -> 172.31.31.144 OpenFlow 435 Type: OFPT_PACKET_IN
296 0.208973388 172.31.23.72 -> 172.31.31.144 OpenFlow 312 Type: OFPT_PACKET_IN
297 0.209029998 172.31.31.144 -> 172.31.23.72 TCP 66 6633 → 45454 [ACK] Seq=1 Ack=493 Win=853 Len=0 TSval=785083 TSecr=19355208
298 0.209035521 172.31.31.144 -> 172.31.23.72 TCP 66 6633 → 45436 [ACK] Seq=969 Ack=370 Win=853 Len=0 TSval=785083 TSecr=19355208
299 0.209040577 172.31.23.72 -> 172.31.31.144 OpenFlow 189 Type: OFPT_PACKET_IN
300 0.209135407 172.31.31.144 -> 172.31.23.72 TCP 66 6633 → 45434 [ACK] Seq=1211 Ack=616 Win=853 Len=0 TSval=785083 TSecr=19355208
301 0.209140183 172.31.31.144 -> 172.31.23.72 TCP 66 6633 → 45424 [ACK] Seq=1307 Ack=10362 Win=853 Len=0 TSval=785083 TSecr=19355208
302 0.209142232 172.31.31.144 -> 172.31.23.72 TCP 66 6633 → 45436 [ACK] Seq=969 Ack=985 Win=853 Len=0 TSval=785083 TSecr=19355208
303 0.209198162 172.31.23.72 -> 172.31.31.144 OpenFlow 189 Type: OFPT_PACKET_IN
304 0.209302320 172.31.31.144 -> 172.31.23.72 TCP 66 6633 → 45434 [ACK] Seq=1211 Ack=985 Win=853 Len=0 TSval=785083 TSecr=19355208
305 0.209336778 172.31.31.144 -> 172.31.23.72 TCP 66 6633 → 45462 [ACK] Seq=727 Ack=247 Win=853 Len=0 TSval=785083 TSecr=19355208
306 0.209538692 172.31.31.144 -> 172.31.23.72 TCP 66 6633 → 45418 [ACK] Seq=1211 Ack=493 Win=853 Len=0 TSval=785083 TSecr=19355208
307 0.209653196 172.31.31.144 -> 172.31.23.72 TCP 66 6633 → 45424 [ACK] Seq=1307 Ack=10731 Win=853 Len=0 TSval=785083 TSecr=19355208
308 0.209740103 172.31.31.144 -> 172.31.23.72 TCP 66 6633 → 45420 [ACK] Seq=1065 Ack=9125 Win=853 Len=0 TSval=785083 TSecr=19355208
309 0.209803101 172.31.31.144 -> 172.31.23.72 TCP 66 6633 → 45452 [ACK] Seq=969 Ack=247 Win=853 Len=0 TSval=785083 TSecr=19355208
310 0.247314726 172.31.23.72 -> 172.31.31.144 TCP 66 45416 → 6633 [ACK] Seq=493 Ack=969 Win=213 Len=0 TSval=19355218 TSecr=785083
311 0.256030397 172.31.31.144 -> 172.31.23.72 OpenFlow 82 Type: OFPT_MULTIPART_REQUEST, OFPMP_TABLE
312 0.256048987 172.31.31.144 -> 172.31.23.72 OpenFlow 146 Type: OFPT_MULTIPART_REQUEST, OFPMP_PORT_STATS
313 0.256323915 172.31.23.72 -> 172.31.31.144 OpenFlow 6178 Type: OFPT_MULTIPART_REPLY, OFPMP_TABLE
314 0.256393816 172.31.23.72 -> 172.31.31.144 OpenFlow 1802 Type: OFPT_MULTIPART_REPLY, OFPMP_FLOW
315 0.256507172 172.31.23.72 -> 172.31.31.144 OpenFlow 754 Type: OFPT_MULTIPART_REPLY, OFPMP_PORT_STATS
316 0.256647163 172.31.31.144 -> 172.31.23.72 TCP 66 6633 → 45430 [ACK] Seq=1307 Ack=8587 Win=853 Len=0 TSval=785095 TSecr=19355220
317 0.293248794 172.31.31.144 -> 172.31.23.72 OpenFlow 122 Type: OFPT_MULTIPART_REQUEST, OFPMP_FLOW
318 0.293276045 172.31.31.144 -> 172.31.23.72 OpenFlow 106 Type: OFPT_MULTIPART_REQUEST, OFPMP_TABLE
319 0.293511429 172.31.23.72 -> 172.31.31.144 OpenFlow 1802 Type: OFPT_MULTIPART_REPLY, OFPMP_FLOW
320 0.293623600 172.31.23.72 -> 172.31.31.144 OpenFlow 642 Type: OFPT_MULTIPART_REPLY, OFPMP_PORT_STATS
321 0.293794049 172.31.23.72 -> 172.31.31.144 OpenFlow 6178 Type: OFPT_MULTIPART_REPLY, OFPMP_TABLE
322 0.293883990 172.31.31.144 -> 172.31.23.72 TCP 66 6633 → 45432 [ACK] Seq=97 Ack=3297 Win=853 Len=0 TSval=785104 TSecr=19355229
323 0.294359933 172.31.31.144 -> 172.31.23.72 TCP 66 6633 → 45430 [ACK] Seq=1307 Ack=9275 Win=853 Len=0 TSval=785105 TSecr=19355220
324 0.301831219 172.31.31.144 -> 172.31.23.72 OpenFlow 187 Type: OFPT_PACKET_OUT
325 0.301837952 172.31.31.144 -> 172.31.23.72 OpenFlow 187 Type: OFPT_PACKET_OUT
326 0.301860937 172.31.31.144 -> 172.31.23.72 OpenFlow 187 Type: OFPT_PACKET_OUT
327 0.301925327 172.31.31.144 -> 172.31.23.72 OpenFlow 187 Type: OFPT_PACKET_OUT
328 0.301999985 172.31.31.144 -> 172.31.23.72 OpenFlow 187 Type: OFPT_PACKET_OUT
329 0.302063622 172.31.31.144 -> 172.31.23.72 OpenFlow 187 Type: OFPT_PACKET_OUT
330 0.302123385 172.31.31.144 -> 172.31.23.72 OpenFlow 187 Type: OFPT_PACKET_OUT
331 0.302195253 172.31.31.144 -> 172.31.23.72 OpenFlow 187 Type: OFPT_PACKET_OUT
332 0.302253946 172.31.31.144 -> 172.31.23.72 OpenFlow 187 Type: OFPT_PACKET_OUT
333 0.302297382 172.31.31.144 -> 172.31.23.72 OpenFlow 187 Type: OFPT_PACKET_OUT
334 0.302442920 172.31.31.144 -> 172.31.23.72 OpenFlow 187 Type: OFPT_PACKET_OUT
335 0.302473238 172.31.23.72 -> 172.31.31.144 TCP 66 45446 → 6633 [ACK] Seq=493 Ack=1211 Win=213 Len=0 TSval=19355231 TSecr=785106
336 0.302523896 172.31.31.144 -> 172.31.23.72 OpenFlow 187 Type: OFPT_PACKET_OUT
337 0.302552852 172.31.31.144 -> 172.31.23.72 OpenFlow 187 Type: OFPT_PACKET_OUT
338 0.302650248 172.31.31.144 -> 172.31.23.72 OpenFlow 187 Type: OFPT_PACKET_OUT
339 0.302655846 172.31.23.72 -> 172.31.31.144 TCP 66 45432 → 6633 [ACK] Seq=9409 Ack=460 Win=213 Len=0 TSval=19355231 TSecr=785107
340 0.302669495 172.31.31.144 -> 172.31.23.72 OpenFlow 187 Type: OFPT_PACKET_OUT
341 0.302737928 172.31.31.144 -> 172.31.23.72 OpenFlow 187 Type: OFPT_PACKET_OUT
342 0.302811402 172.31.31.144 -> 172.31.23.72 OpenFlow 187 Type: OFPT_PACKET_OUT
343 0.302850628 172.31.31.144 -> 172.31.23.72 OpenFlow 187 Type: OFPT_PACKET_OUT
344 0.302919295 172.31.23.72 -> 172.31.31.144 TCP 66 45432 → 6633 [ACK] Seq=9409 Ack=1065 Win=213 Len=0 TSval=19355231 TSecr=785107
345 0.302965472 172.31.31.144 -> 172.31.23.72 TCP 187 6633 → 45460 [PSH, ACK] Seq=1 Ack=1 Win=853 Len=121 TSval=785107 TSecr=19354531
346 0.302973826 172.31.31.144 -> 172.31.23.72 TCP 187 6633 → 45460 [PSH, ACK] Seq=122 Ack=1 Win=853 Len=121 TSval=785107 TSecr=19354531
347 0.303032632 172.31.31.144 -> 172.31.23.72 TCP 187 6633 → 45460 [PSH, ACK] Seq=243 Ack=1 Win=853 Len=121 TSval=785107 TSecr=19354531
348 0.303100463 172.31.31.144 -> 172.31.23.72 TCP 187 6633 → 45460 [PSH, ACK] Seq=364 Ack=1 Win=853 Len=121 TSval=785107 TSecr=19354531
349 0.303136067 172.31.23.72 -> 172.31.31.144 TCP 66 45460 → 6633 [ACK] Seq=1 Ack=485 Win=213 Len=0 TSval=19355231 TSecr=785107
350 0.303177136 172.31.31.144 -> 172.31.23.72 TCP 187 6633 → 45460 [PSH, ACK] Seq=485 Ack=1 Win=853 Len=121 TSval=785107 TSecr=19354531
351 0.303181920 172.31.23.72 -> 172.31.31.144 OpenFlow 189 Type: OFPT_PACKET_IN
352 0.303203876 172.31.23.72 -> 172.31.31.144 OpenFlow 435 Type: OFPT_PACKET_IN
353 0.303217923 172.31.23.72 -> 172.31.31.144 OpenFlow 189 Type: OFPT_PACKET_IN
354 0.303240147 172.31.23.72 -> 172.31.31.144 OpenFlow 189 Type: OFPT_PACKET_IN
355 0.303248588 172.31.23.72 -> 172.31.31.144 OpenFlow 189 Type: OFPT_PACKET_IN
356 0.303267656 172.31.31.144 -> 172.31.23.72 TCP 187 6633 → 45460 [PSH, ACK] Seq=606 Ack=1 Win=853 Len=121 TSval=785107 TSecr=19354531
357 0.303303307 172.31.23.72 -> 172.31.31.144 OpenFlow 189 Type: OFPT_PACKET_IN
358 0.303346071 172.31.31.144 -> 172.31.23.72 OpenFlow 187 Type: OFPT_PACKET_OUT
359 0.303364043 172.31.31.144 -> 172.31.23.72 OpenFlow 187 Type: OFPT_PACKET_OUT
360 0.303420469 172.31.31.144 -> 172.31.23.72 TCP 66 6633 → 45456 [ACK] Seq=1 Ack=493 Win=853 Len=0 TSval=785107 TSecr=19355231
361 0.303435882 172.31.23.72 -> 172.31.31.144 OpenFlow 189 Type: OFPT_PACKET_IN
362 0.303457126 172.31.23.72 -> 172.31.31.144 OpenFlow 189 Type: OFPT_PACKET_IN
363 0.303487116 172.31.23.72 -> 172.31.31.144 OpenFlow 189 Type: OFPT_PACKET_IN
364 0.303501282 172.31.23.72 -> 172.31.31.144 OpenFlow 189 Type: OFPT_PACKET_IN
365 0.303511818 172.31.23.72 -> 172.31.31.144 OpenFlow 189 Type: OFPT_PACKET_IN
366 0.303530760 172.31.23.72 -> 172.31.31.144 OpenFlow 189 Type: OFPT_PACKET_IN
367 0.303547079 172.31.23.72 -> 172.31.31.144 OpenFlow 189 Type: OFPT_PACKET_IN
368 0.303549396 172.31.23.72 -> 172.31.31.144 OpenFlow 435 Type: OFPT_PACKET_IN
369 0.303586094 172.31.23.72 -> 172.31.31.144 OpenFlow 189 Type: OFPT_PACKET_IN
370 0.303592081 172.31.23.72 -> 172.31.31.144 OpenFlow 189 Type: OFPT_PACKET_IN
371 0.303654195 172.31.23.72 -> 172.31.31.144 TCP 66 45460 → 6633 [ACK] Seq=1 Ack=727 Win=213 Len=0 TSval=19355232 TSecr=785107
372 0.303693653 172.31.31.144 -> 172.31.23.72 TCP 66 6633 → 45462 [ACK] Seq=727 Ack=493 Win=853 Len=0 TSval=785107 TSecr=19355232
373 0.303699692 172.31.31.144 -> 172.31.23.72 TCP 66 6633 → 45444 [ACK] Seq=1211 Ack=493 Win=853 Len=0 TSval=785107 TSecr=19355232
374 0.303728659 172.31.31.144 -> 172.31.23.72 TCP 66 6633 → 45438 [ACK] Seq=969 Ack=616 Win=853 Len=0 TSval=785107 TSecr=19355232
375 0.303752898 172.31.31.144 -> 172.31.23.72 TCP 66 6633 → 45430 [ACK] Seq=1307 Ack=9398 Win=853 Len=0 TSval=785107 TSecr=19355232
376 0.303756456 172.31.31.144 -> 172.31.23.72 TCP 66 6633 → 45438 [ACK] Seq=969 Ack=985 Win=853 Len=0 TSval=785107 TSecr=19355232
377 0.303808515 172.31.23.72 -> 172.31.31.144 TCP 66 45458 → 6633 [ACK] Seq=493 Ack=243 Win=213 Len=0 TSval=19355232 TSecr=785107
378 0.303879784 172.31.23.72 -> 172.31.31.144 OpenFlow 189 Type: OFPT_PACKET_IN
379 0.303904845 172.31.23.72 -> 172.31.31.144 OpenFlow 189 Type: OFPT_PACKET_IN
380 0.303919137 172.31.23.72 -> 172.31.31.144 OpenFlow 189 Type: OFPT_PACKET_IN
381 0.303926865 172.31.31.144 -> 172.31.23.72 TCP 66 6633 → 45448 [ACK] Seq=1 Ack=493 Win=853 Len=0 TSval=785107 TSecr=19355231
382 0.303931824 172.31.23.72 -> 172.31.31.144 OpenFlow 189 Type: OFPT_PACKET_IN
383 0.304027396 172.31.31.144 -> 172.31.23.72 TCP 66 6633 → 45430 [ACK] Seq=1307 Ack=9521 Win=853 Len=0 TSval=785107 TSecr=19355232
384 0.304228519 172.31.31.144 -> 172.31.23.72 OpenFlow 187 Type: OFPT_PACKET_OUT
385 0.304335034 172.31.31.144 -> 172.31.23.72 TCP 66 6633 → 45428 [ACK] Seq=823 Ack=8389 Win=853 Len=0 TSval=785107 TSecr=19355232
386 0.304429510 172.31.23.72 -> 172.31.31.144 OpenFlow 189 Type: OFPT_PACKET_IN
387 0.304605568 172.31.31.144 -> 172.31.23.72 OpenFlow 187 Type: OFPT_PACKET_OUT
388 0.304720830 172.31.31.144 -> 172.31.23.72 OpenFlow 187 Type: OFPT_PACKET_OUT
389 0.304730487 172.31.23.72 -> 172.31.31.144 TCP 66 45456 → 6633 [ACK] Seq=739 Ack=243 Win=213 Len=0 TSval=19355232 TSecr=785107
390 0.304739549 172.31.31.144 -> 172.31.23.72 OpenFlow 671 Type: OFPT_PACKET_OUT
391 0.304775062 172.31.31.144 -> 172.31.23.72 TCP 66 6633 → 45448 [ACK] Seq=1 Ack=739 Win=853 Len=0 TSval=785107 TSecr=19355232
392 0.304835217 172.31.23.72 -> 172.31.31.144 OpenFlow 189 Type: OFPT_PACKET_IN
393 0.304922129 172.31.31.144 -> 172.31.23.72 OpenFlow 187 Type: OFPT_PACKET_OUT
394 0.305001964 172.31.31.144 -> 172.31.23.72 OpenFlow 187 Type: OFPT_PACKET_OUT
395 0.305029071 172.31.31.144 -> 172.31.23.72 TCP 66 6633 → 45454 [ACK] Seq=1 Ack=739 Win=853 Len=0 TSval=785107 TSecr=19355232
396 0.305112536 172.31.31.144 -> 172.31.23.72 OpenFlow 187 Type: OFPT_PACKET_OUT
397 0.305213975 172.31.23.72 -> 172.31.31.144 TCP 66 45458 → 6633 [ACK] Seq=493 Ack=969 Win=213 Len=0 TSval=19355232 TSecr=785107
398 0.305262170 172.31.31.144 -> 172.31.23.72 OpenFlow 187 Type: OFPT_PACKET_OUT
399 0.305327409 172.31.31.144 -> 172.31.23.72 OpenFlow 187 Type: OFPT_PACKET_OUT
400 0.305391944 172.31.31.144 -> 172.31.23.72 OpenFlow 187 Type: OFPT_PACKET_OUT
401 0.305498858 172.31.31.144 -> 172.31.23.72 OpenFlow 187 Type: OFPT_PACKET_OUT
402 0.305539804 172.31.23.72 -> 172.31.31.144 TCP 66 45456 → 6633 [ACK] Seq=739 Ack=969 Win=213 Len=0 TSval=19355232 TSecr=785107
403 0.305546196 172.31.31.144 -> 172.31.23.72 OpenFlow 187 Type: OFPT_PACKET_OUT
404 0.305585394 172.31.31.144 -> 172.31.23.72 OpenFlow 187 Type: OFPT_PACKET_OUT
405 0.305643129 172.31.31.144 -> 172.31.23.72 OpenFlow 187 Type: OFPT_PACKET_OUT
406 0.305711868 172.31.31.144 -> 172.31.23.72 OpenFlow 187 Type: OFPT_PACKET_OUT
407 0.305755541 172.31.23.72 -> 172.31.31.144 TCP 66 45414 → 6633 [ACK] Seq=493 Ack=606 Win=213 Len=0 TSval=19355232 TSecr=785107
408 0.305766087 172.31.31.144 -> 172.31.23.72 OpenFlow 187 Type: OFPT_PACKET_OUT
409 0.305853376 172.31.31.144 -> 172.31.23.72 OpenFlow 187 Type: OFPT_PACKET_OUT
410 0.305920729 172.31.31.144 -> 172.31.23.72 OpenFlow 187 Type: OFPT_PACKET_OUT
411 0.305940392 172.31.23.72 -> 172.31.31.144 TCP 66 45454 → 6633 [ACK] Seq=739 Ack=243 Win=213 Len=0 TSval=19355232 TSecr=785107
412 0.305970686 172.31.31.144 -> 172.31.23.72 OpenFlow 187 Type: OFPT_PACKET_OUT
413 0.306025997 172.31.31.144 -> 172.31.23.72 OpenFlow 187 Type: OFPT_PACKET_OUT
414 0.306060927 172.31.23.72 -> 172.31.31.144 TCP 66 45454 → 6633 [ACK] Seq=739 Ack=485 Win=213 Len=0 TSval=19355232 TSecr=785107
415 0.306105869 172.31.31.144 -> 172.31.23.72 OpenFlow 187 Type: OFPT_PACKET_OUT
416 0.306156692 172.31.31.144 -> 172.31.23.72 OpenFlow 187 Type: OFPT_PACKET_OUT
417 0.306228659 172.31.31.144 -> 172.31.23.72 OpenFlow 187 Type: OFPT_PACKET_OUT
418 0.306265545 172.31.31.144 -> 172.31.23.72 OpenFlow 187 Type: OFPT_PACKET_OUT
419 0.306274925 172.31.23.72 -> 172.31.31.144 OpenFlow 189 Type: OFPT_PACKET_IN
420 0.306298633 172.31.23.72 -> 172.31.31.144 OpenFlow 189 Type: OFPT_PACKET_IN
421 0.306328685 172.31.23.72 -> 172.31.31.144 OpenFlow 189 Type: OFPT_PACKET_IN
422 0.306344884 172.31.23.72 -> 172.31.31.144 OpenFlow 189 Type: OFPT_PACKET_IN
423 0.306358370 172.31.23.72 -> 172.31.31.144 OpenFlow 189 Type: OFPT_PACKET_IN
424 0.306387473 172.31.23.72 -> 172.31.31.144 OpenFlow 189 Type: OFPT_PACKET_IN
425 0.306393504 172.31.23.72 -> 172.31.31.144 OpenFlow 189 Type: OFPT_PACKET_IN
426 0.306406632 172.31.23.72 -> 172.31.31.144 OpenFlow 189 Type: OFPT_PACKET_IN
427 0.306429651 172.31.23.72 -> 172.31.31.144 OpenFlow 189 Type: OFPT_PACKET_IN
428 0.306432022 172.31.23.72 -> 172.31.31.144 OpenFlow 189 Type: OFPT_PACKET_IN
429 0.306443016 172.31.23.72 -> 172.31.31.144 OpenFlow 189 Type: OFPT_PACKET_IN
430 0.306449965 172.31.31.144 -> 172.31.23.72 OpenFlow 187 Type: OFPT_PACKET_OUT
431 0.306466303 172.31.23.72 -> 172.31.31.144 OpenFlow 189 Type: OFPT_PACKET_IN
432 0.306472219 172.31.23.72 -> 172.31.31.144 OpenFlow 435 Type: OFPT_PACKET_IN
433 0.306474462 172.31.23.72 -> 172.31.31.144 OpenFlow 189 Type: OFPT_PACKET_IN
434 0.306539658 172.31.31.144 -> 172.31.23.72 OpenFlow 187 Type: OFPT_PACKET_OUT
435 0.306544815 172.31.31.144 -> 172.31.23.72 TCP 66 6633 → 45424 [ACK] Seq=1307 Ack=10977 Win=853 Len=0 TSval=785108 TSecr=19355232
436 0.306551408 172.31.23.72 -> 172.31.31.144 OpenFlow 189 Type: OFPT_PACKET_IN
437 0.306557863 172.31.23.72 -> 172.31.31.144 OpenFlow 189 Type: OFPT_PACKET_IN
438 0.306591179 172.31.23.72 -> 172.31.31.144 TCP 66 45454 → 6633 [ACK] Seq=739 Ack=969 Win=213 Len=0 TSval=19355232 TSecr=785107
439 0.306617836 172.31.31.144 -> 172.31.23.72 OpenFlow 187 Type: OFPT_PACKET_OUT
440 0.306621737 172.31.31.144 -> 172.31.23.72 TCP 66 6633 → 45452 [ACK] Seq=969 Ack=493 Win=853 Len=0 TSval=785108 TSecr=19355232
441 0.306624993 172.31.31.144 -> 172.31.23.72 TCP 66 6633 → 45444 [ACK] Seq=1211 Ack=739 Win=853 Len=0 TSval=785108 TSecr=19355232
442 0.306700844 172.31.31.144 -> 172.31.23.72 OpenFlow 187 Type: OFPT_PACKET_OUT
443 0.306705412 172.31.31.144 -> 172.31.23.72 TCP 66 6633 → 45446 [ACK] Seq=1211 Ack=616 Win=853 Len=0 TSval=785108 TSecr=19355232
444 0.306708476 172.31.31.144 -> 172.31.23.72 TCP 66 6633 → 45416 [ACK] Seq=969 Ack=739 Win=853 Len=0 TSval=785108 TSecr=19355232
445 0.306710731 172.31.31.144 -> 172.31.23.72 OpenFlow 187 Type: OFPT_PACKET_OUT
446 0.306712285 172.31.31.144 -> 172.31.23.72 OpenFlow 187 Type: OFPT_PACKET_OUT
447 0.306805176 172.31.31.144 -> 172.31.23.72 TCP 66 6633 → 45458 [ACK] Seq=969 Ack=739 Win=853 Len=0 TSval=785108 TSecr=19355232
448 0.306880521 172.31.31.144 -> 172.31.23.72 TCP 66 6633 → 45446 [ACK] Seq=1211 Ack=985 Win=853 Len=0 TSval=785108 TSecr=19355232
449 0.306933596 172.31.23.72 -> 172.31.31.144 TCP 66 45448 → 6633 [ACK] Seq=739 Ack=727 Win=213 Len=0 TSval=19355232 TSecr=785108
450 0.306979959 172.31.31.144 -> 172.31.23.72 TCP 66 6633 → 45456 [ACK] Seq=969 Ack=985 Win=853 Len=0 TSval=785108 TSecr=19355232
451 0.307037619 172.31.31.144 -> 172.31.23.72 TCP 66 6633 → 45460 [ACK] Seq=727 Ack=247 Win=853 Len=0 TSval=785108 TSecr=19355232
452 0.307110903 172.31.23.72 -> 172.31.31.144 OpenFlow 189 Type: OFPT_PACKET_IN
453 0.307133496 172.31.23.72 -> 172.31.31.144 OpenFlow 189 Type: OFPT_PACKET_IN
454 0.307163225 172.31.23.72 -> 172.31.31.144 OpenFlow 189 Type: OFPT_PACKET_IN
455 0.307176956 172.31.23.72 -> 172.31.31.144 OpenFlow 189 Type: OFPT_PACKET_IN
456 0.307200393 172.31.31.144 -> 172.31.23.72 OpenFlow 187 Type: OFPT_PACKET_OUT
457 0.307222856 172.31.23.72 -> 172.31.31.144 OpenFlow 189 Type: OFPT_PACKET_IN
458 0.307243788 172.31.23.72 -> 172.31.31.144 OpenFlow 189 Type: OFPT_PACKET_IN
459 0.307250882 172.31.23.72 -> 172.31.31.144 OpenFlow 189 Type: OFPT_PACKET_IN
460 0.307311206 172.31.23.72 -> 172.31.31.144 OpenFlow 189 Type: OFPT_PACKET_IN
461 0.307334178 172.31.31.144 -> 172.31.23.72 TCP 66 6633 → 45462 [ACK] Seq=727 Ack=739 Win=853 Len=0 TSval=785108 TSecr=19355232
462 0.307339642 172.31.31.144 -> 172.31.23.72 OpenFlow 187 Type: OFPT_PACKET_OUT
463 0.307363939 172.31.31.144 -> 172.31.23.72 TCP 66 6633 → 45444 [ACK] Seq=1211 Ack=985 Win=853 Len=0 TSval=785108 TSecr=19355232
464 0.307404432 172.31.23.72 -> 172.31.31.144 TCP 66 45442 → 6633 [ACK] Seq=739 Ack=243 Win=213 Len=0 TSval=19355233 TSecr=785108
465 0.307444816 172.31.31.144 -> 172.31.23.72 OpenFlow 187 Type: OFPT_PACKET_OUT
466 0.307460193 172.31.31.144 -> 172.31.23.72 TCP 66 6633 → 45460 [ACK] Seq=727 Ack=493 Win=853 Len=0 TSval=785108 TSecr=19355232
467 0.307621620 172.31.23.72 -> 172.31.31.144 OpenFlow 189 Type: OFPT_PACKET_IN
468 0.307659893 172.31.23.72 -> 172.31.31.144 OpenFlow 189 Type: OFPT_PACKET_IN
469 0.307699886 172.31.23.72 -> 172.31.31.144 OpenFlow 189 Type: OFPT_PACKET_IN
470 0.307760278 172.31.31.144 -> 172.31.23.72 OpenFlow 187 Type: OFPT_PACKET_OUT
471 0.307849951 172.31.31.144 -> 172.31.23.72 TCP 66 6633 → 45444 [ACK] Seq=1211 Ack=1231 Win=853 Len=0 TSval=785108 TSecr=19355233
472 0.307855259 172.31.31.144 -> 172.31.23.72 TCP 66 6633 → 45434 [ACK] Seq=1211 Ack=1108 Win=853 Len=0 TSval=785108 TSecr=19355233
473 0.307890353 172.31.31.144 -> 172.31.23.72 OpenFlow 187 Type: OFPT_PACKET_OUT
474 0.307893866 172.31.31.144 -> 172.31.23.72 TCP 66 6633 → 45446 [ACK] Seq=1211 Ack=1231 Win=853 Len=0 TSval=785108 TSecr=19355232
475 0.307967289 172.31.31.144 -> 172.31.23.72 OpenFlow 187 Type: OFPT_PACKET_OUT
476 0.308048765 172.31.23.72 -> 172.31.31.144 TCP 66 45442 → 6633 [ACK] Seq=739 Ack=727 Win=213 Len=0 TSval=19355233 TSecr=785108
477 0.308184219 172.31.23.72 -> 172.31.31.144 OpenFlow 189 Type: OFPT_PACKET_IN
478 0.308212020 172.31.23.72 -> 172.31.31.144 OpenFlow 189 Type: OFPT_PACKET_IN
479 0.308230632 172.31.23.72 -> 172.31.31.144 OpenFlow 189 Type: OFPT_PACKET_IN
480 0.308420347 172.31.31.144 -> 172.31.23.72 TCP 66 6633 → 45452 [ACK] Seq=969 Ack=739 Win=853 Len=0 TSval=785108 TSecr=19355233
481 0.308427007 172.31.31.144 -> 172.31.23.72 TCP 66 6633 → 45434 [ACK] Seq=1211 Ack=1231 Win=853 Len=0 TSval=785108 TSecr=19355233
482 0.338448930 172.31.31.144 -> 172.31.23.72 OpenFlow 122 Type: OFPT_MULTIPART_REQUEST, OFPMP_FLOW
483 0.338478915 172.31.31.144 -> 172.31.23.72 OpenFlow 106 Type: OFPT_MULTIPART_REQUEST, OFPMP_TABLE
484 0.338616772 172.31.23.72 -> 172.31.31.144 OpenFlow 3258 Type: OFPT_MULTIPART_REPLY, OFPMP_FLOW
485 0.338723338 172.31.23.72 -> 172.31.31.144 OpenFlow 754 Type: OFPT_MULTIPART_REPLY, OFPMP_PORT_STATS
486 0.338890074 172.31.23.72 -> 172.31.31.144 OpenFlow 6178 Type: OFPT_MULTIPART_REPLY, OFPMP_TABLE
487 0.338899723 172.31.31.144 -> 172.31.23.72 TCP 66 6633 → 45434 [ACK] Seq=1307 Ack=5111 Win=853 Len=0 TSval=785116 TSecr=19355240
488 0.343323378 172.31.23.72 -> 172.31.31.144 TCP 66 45414 → 6633 [ACK] Seq=493 Ack=727 Win=213 Len=0 TSval=19355242 TSecr=785107
489 0.375645772 172.31.31.144 -> 172.31.23.72 OpenFlow 90 Type: OFPT_MULTIPART_REQUEST, OFPMP_PORT_STATS
490 0.375662957 172.31.23.72 -> 172.31.31.144 TCP 66 45436 → 6633 [ACK] Seq=985 Ack=993 Win=213 Len=0 TSval=19355250 TSecr=785125
491 0.375680086 172.31.31.144 -> 172.31.23.72 OpenFlow 138 Type: OFPT_MULTIPART_REQUEST, OFPMP_FLOW
492 0.375685502 172.31.23.72 -> 172.31.31.144 TCP 66 45436 → 6633 [ACK] Seq=985 Ack=1065 Win=213 Len=0 TSval=19355250 TSecr=785125
493 0.375921569 172.31.23.72 -> 172.31.31.144 OpenFlow 642 Type: OFPT_MULTIPART_REPLY, OFPMP_PORT_STATS
494 0.376082127 172.31.31.144 -> 172.31.23.72 TCP 66 6633 → 45436 [ACK] Seq=1065 Ack=1561 Win=853 Len=0 TSval=785125 TSecr=19355250
495 0.376117601 172.31.23.72 -> 172.31.31.144 OpenFlow 6178 Type: OFPT_MULTIPART_REPLY, OFPMP_TABLE
496 0.376175386 172.31.23.72 -> 172.31.31.144 OpenFlow 1178 Type: OFPT_MULTIPART_REPLY, OFPMP_FLOW
497 0.376456153 172.31.31.144 -> 172.31.23.72 TCP 66 6633 → 45436 [ACK] Seq=1065 Ack=8785 Win=853 Len=0 TSval=785125 TSecr=19355250
498 0.378385793 172.31.31.144 -> 172.31.23.72 TCP 66 6633 → 45434 [ACK] Seq=1307 Ack=11223 Win=853 Len=0 TSval=785126 TSecr=19355240
499 0.402367406 172.31.31.144 -> 172.31.23.72 OpenFlow 187 Type: OFPT_PACKET_OUT
500 0.402426245 172.31.31.144 -> 172.31.23.72 OpenFlow 187 Type: OFPT_PACKET_OUT
501 0.402492595 172.31.31.144 -> 172.31.23.72 OpenFlow 187 Type: OFPT_PACKET_OUT
502 0.402564975 172.31.31.144 -> 172.31.23.72 OpenFlow 187 Type: OFPT_PACKET_OUT
503 0.402619623 172.31.31.144 -> 172.31.23.72 OpenFlow 187 Type: OFPT_PACKET_OUT
504 0.402679044 172.31.31.144 -> 172.31.23.72 OpenFlow 187 Type: OFPT_PACKET_OUT
505 0.402742147 172.31.31.144 -> 172.31.23.72 OpenFlow 187 Type: OFPT_PACKET_OUT
506 0.402799537 172.31.31.144 -> 172.31.23.72 OpenFlow 187 Type: OFPT_PACKET_OUT
507 0.402856146 172.31.31.144 -> 172.31.23.72 OpenFlow 187 Type: OFPT_PACKET_OUT
508 0.402919274 172.31.31.144 -> 172.31.23.72 OpenFlow 187 Type: OFPT_PACKET_OUT
509 0.403053586 172.31.31.144 -> 172.31.23.72 OpenFlow 187 Type: OFPT_PACKET_OUT
510 0.403070792 172.31.31.144 -> 172.31.23.72 OpenFlow 187 Type: OFPT_PACKET_OUT
511 0.403105618 172.31.31.144 -> 172.31.23.72 OpenFlow 187 Type: OFPT_PACKET_OUT
512 0.403141911 172.31.23.72 -> 172.31.31.144 TCP 66 45426 → 6633 [ACK] Seq=9937 Ack=1307 Win=213 Len=0 TSval=19355256 TSecr=785132
513 0.403205428 172.31.31.144 -> 172.31.23.72 OpenFlow 187 Type: OFPT_PACKET_OUT
514 0.403228843 172.31.31.144 -> 172.31.23.72 OpenFlow 187 Type: OFPT_PACKET_OUT
515 0.403238565 172.31.23.72 -> 172.31.31.144 OpenFlow 189 Type: OFPT_PACKET_IN
516 0.403269198 172.31.23.72 -> 172.31.31.144 OpenFlow 189 Type: OFPT_PACKET_IN
517 0.403294178 172.31.31.144 -> 172.31.23.72 OpenFlow 187 Type: OFPT_PACKET_OUT
518 0.403460205 172.31.31.144 -> 172.31.23.72 TCP 66 6633 → 45422 [ACK] Seq=823 Ack=8427 Win=853 Len=0 TSval=785132 TSecr=19355256
519 0.403662383 172.31.23.72 -> 172.31.31.144 OpenFlow 189 Type: OFPT_PACKET_IN
520 0.403683497 172.31.23.72 -> 172.31.31.144 OpenFlow 189 Type: OFPT_PACKET_IN
521 0.403702996 172.31.23.72 -> 172.31.31.144 OpenFlow 189 Type: OFPT_PACKET_IN
522 0.403723180 172.31.23.72 -> 172.31.31.144 OpenFlow 189 Type: OFPT_PACKET_IN
523 0.403727919 172.31.23.72 -> 172.31.31.144 OpenFlow 189 Type: OFPT_PACKET_IN
524 0.403757500 172.31.23.72 -> 172.31.31.144 OpenFlow 189 Type: OFPT_PACKET_IN
525 0.403765986 172.31.23.72 -> 172.31.31.144 OpenFlow 435 Type: OFPT_PACKET_IN
526 0.403780793 172.31.23.72 -> 172.31.31.144 OpenFlow 189 Type: OFPT_PACKET_IN
527 0.403786126 172.31.23.72 -> 172.31.31.144 OpenFlow 189 Type: OFPT_PACKET_IN
528 0.403826945 172.31.23.72 -> 172.31.31.144 OpenFlow 189 Type: OFPT_PACKET_IN
529 0.403848756 172.31.23.72 -> 172.31.31.144 OpenFlow 189 Type: OFPT_PACKET_IN
530 0.403886139 172.31.31.144 -> 172.31.23.72 TCP 66 6633 → 45420 [ACK] Seq=1065 Ack=9371 Win=853 Len=0 TSval=785132 TSecr=19355257
531 0.403910213 172.31.23.72 -> 172.31.31.144 OpenFlow 189 Type: OFPT_PACKET_IN
532 0.403931740 172.31.31.144 -> 172.31.23.72 TCP 66 6633 → 45424 [ACK] Seq=1307 Ack=11223 Win=853 Len=0 TSval=785132 TSecr=19355257
533 0.404011842 172.31.31.144 -> 172.31.23.72 TCP 66 6633 → 45430 [ACK] Seq=1307 Ack=9767 Win=853 Len=0 TSval=785132 TSecr=19355257
534 0.404029461 172.31.31.144 -> 172.31.23.72 TCP 66 6633 → 45418 [ACK] Seq=1211 Ack=985 Win=853 Len=0 TSval=785132 TSecr=19355257
535 0.404084173 172.31.31.144 -> 172.31.23.72 TCP 66 6633 → 45426 [ACK] Seq=1307 Ack=10183 Win=853 Len=0 TSval=785132 TSecr=19355257
536 0.404272315 172.31.31.144 -> 172.31.23.72 TCP 66 6633 → 45428 [ACK] Seq=823 Ack=8635 Win=853 Len=0 TSval=785132 TSecr=19355257
537 0.410829319 172.31.31.144 -> 172.31.23.72 OpenFlow 122 Type: OFPT_MULTIPART_REQUEST, OFPMP_FLOW
538 0.410882901 172.31.31.144 -> 172.31.23.72 OpenFlow 90 Type: OFPT_MULTIPART_REQUEST, OFPMP_PORT_STATS
539 0.410973826 172.31.23.72 -> 172.31.31.144 OpenFlow 1386 Type: OFPT_MULTIPART_REPLY, OFPMP_FLOW
540 0.411066638 172.31.23.72 -> 172.31.31.144 OpenFlow 642 Type: OFPT_MULTIPART_REPLY, OFPMP_PORT_STATS
541 0.411328248 172.31.31.144 -> 172.31.23.72 TCP 66 6633 → 45438 [ACK] Seq=1049 Ack=2305 Win=853 Len=0 TSval=785134 TSecr=19355258
542 0.411372440 172.31.31.144 -> 172.31.23.72 TCP 66 6633 → 45438 [ACK] Seq=1049 Ack=2881 Win=853 Len=0 TSval=785134 TSecr=19355258
543 0.411982208 172.31.31.144 -> 172.31.23.72 OpenFlow 82 Type: OFPT_MULTIPART_REQUEST, OFPMP_TABLE
544 0.412211681 172.31.23.72 -> 172.31.31.144 OpenFlow 6178 Type: OFPT_MULTIPART_REPLY, OFPMP_TABLE
545 0.443317367 172.31.23.72 -> 172.31.31.144 TCP 66 45422 → 6633 [ACK] Seq=8427 Ack=823 Win=213 Len=0 TSval=19355267 TSecr=785132
546 0.450335387 172.31.31.144 -> 172.31.23.72 TCP 66 6633 → 45438 [ACK] Seq=1065 Ack=8993 Win=853 Len=0 TSval=785144 TSecr=19355259
547 0.509397384 172.31.31.144 -> 172.31.23.72 OpenFlow 122 Type: OFPT_MULTIPART_REQUEST, OFPMP_FLOW
548 0.509410012 172.31.31.144 -> 172.31.23.72 OpenFlow 106 Type: OFPT_MULTIPART_REQUEST, OFPMP_TABLE
549 0.509641597 172.31.23.72 -> 172.31.31.144 OpenFlow 1802 Type: OFPT_MULTIPART_REPLY, OFPMP_FLOW
550 0.509727036 172.31.23.72 -> 172.31.31.144 OpenFlow 530 Type: OFPT_MULTIPART_REPLY, OFPMP_PORT_STATS
551 0.509915093 172.31.23.72 -> 172.31.31.144 OpenFlow 6178 Type: OFPT_MULTIPART_REPLY, OFPMP_TABLE
552 0.509927713 172.31.31.144 -> 172.31.23.72 TCP 66 6633 → 45442 [ACK] Seq=823 Ack=2475 Win=853 Len=0 TSval=785158 TSecr=19355283
553 0.509961578 172.31.31.144 -> 172.31.23.72 TCP 66 6633 → 45442 [ACK] Seq=823 Ack=2939 Win=853 Len=0 TSval=785158 TSecr=19355283
554 0.510127118 172.31.31.144 -> 172.31.23.72 TCP 66 6633 → 45442 [ACK] Seq=823 Ack=9051 Win=853 Len=0 TSval=785158 TSecr=19355283
555 0.569635442 172.31.31.144 -> 172.31.23.72 OpenFlow 122 Type: OFPT_MULTIPART_REQUEST, OFPMP_FLOW
556 0.569650102 172.31.23.72 -> 172.31.31.144 TCP 66 45444 → 6633 [ACK] Seq=1231 Ack=1267 Win=213 Len=0 TSval=19355298 TSecr=785173
557 0.569655968 172.31.31.144 -> 172.31.23.72 OpenFlow 106 Type: OFPT_MULTIPART_REQUEST, OFPMP_TABLE
558 0.569659085 172.31.23.72 -> 172.31.31.144 TCP 66 45444 → 6633 [ACK] Seq=1231 Ack=1307 Win=213 Len=0 TSval=19355298 TSecr=785173
559 0.569840260 172.31.23.72 -> 172.31.31.144 OpenFlow 2218 Type: OFPT_MULTIPART_REPLY, OFPMP_FLOW
560 0.569949707 172.31.23.72 -> 172.31.31.144 OpenFlow 754 Type: OFPT_MULTIPART_REPLY, OFPMP_PORT_STATS
561 0.570106845 172.31.23.72 -> 172.31.31.144 OpenFlow 6178 Type: OFPT_MULTIPART_REPLY, OFPMP_TABLE
562 0.570159529 172.31.31.144 -> 172.31.23.72 TCP 66 6633 → 45444 [ACK] Seq=1307 Ack=4071 Win=853 Len=0 TSval=785173 TSecr=19355298
563 0.608828240 172.31.31.144 -> 172.31.23.72 OpenFlow 122 Type: OFPT_MULTIPART_REQUEST, OFPMP_FLOW
564 0.608856811 172.31.31.144 -> 172.31.23.72 OpenFlow 106 Type: OFPT_MULTIPART_REQUEST, OFPMP_TABLE
565 0.609126318 172.31.23.72 -> 172.31.31.144 OpenFlow 2842 Type: OFPT_MULTIPART_REPLY, OFPMP_FLOW
566 0.609251368 172.31.23.72 -> 172.31.31.144 OpenFlow 754 Type: OFPT_MULTIPART_REPLY, OFPMP_PORT_STATS
567 0.609366977 172.31.31.144 -> 172.31.23.72 TCP 66 6633 → 45446 [ACK] Seq=1307 Ack=4007 Win=853 Len=0 TSval=785183 TSecr=19355308
568 0.609398905 172.31.31.144 -> 172.31.23.72 TCP 66 6633 → 45446 [ACK] Seq=1307 Ack=4695 Win=853 Len=0 TSval=785183 TSecr=19355308
569 0.609434658 172.31.23.72 -> 172.31.31.144 OpenFlow 6178 Type: OFPT_MULTIPART_REPLY, OFPMP_TABLE
570 0.609640599 172.31.31.144 -> 172.31.23.72 TCP 66 6633 → 45446 [ACK] Seq=1307 Ack=10807 Win=853 Len=0 TSval=785183 TSecr=19355308
571 0.610365185 172.31.31.144 -> 172.31.23.72 TCP 66 6633 → 45444 [ACK] Seq=1307 Ack=10183 Win=853 Len=0 TSval=785184 TSecr=19355298
572 0.661020958 172.31.31.144 -> 172.31.23.72 OpenFlow 90 Type: OFPT_MULTIPART_REQUEST, OFPMP_PORT_STATS
573 0.661037855 172.31.31.144 -> 172.31.23.72 OpenFlow 138 Type: OFPT_MULTIPART_REQUEST, OFPMP_FLOW
574 0.661288409 172.31.23.72 -> 172.31.31.144 OpenFlow 530 Type: OFPT_MULTIPART_REPLY, OFPMP_PORT_STATS
575 0.661455511 172.31.23.72 -> 172.31.31.144 OpenFlow 6178 Type: OFPT_MULTIPART_REPLY, OFPMP_TABLE
576 0.661524132 172.31.23.72 -> 172.31.31.144 OpenFlow 2010 Type: OFPT_MULTIPART_REPLY, OFPMP_FLOW
577 0.661706762 172.31.31.144 -> 172.31.23.72 TCP 66 6633 → 45448 [ACK] Seq=823 Ack=9259 Win=853 Len=0 TSval=785196 TSecr=19355321
578 0.717277515 172.31.31.144 -> 172.31.23.72 OpenFlow 82 Type: OFPT_MULTIPART_REQUEST, OFPMP_TABLE
579 0.717290747 172.31.31.144 -> 172.31.23.72 OpenFlow 146 Type: OFPT_MULTIPART_REQUEST, OFPMP_PORT_STATS
580 0.717613764 172.31.23.72 -> 172.31.31.144 OpenFlow 6178 Type: OFPT_MULTIPART_REPLY, OFPMP_TABLE
581 0.717695712 172.31.23.72 -> 172.31.31.144 OpenFlow 2426 Type: OFPT_MULTIPART_REPLY, OFPMP_FLOW
582 0.717781224 172.31.23.72 -> 172.31.31.144 OpenFlow 530 Type: OFPT_MULTIPART_REPLY, OFPMP_PORT_STATS
583 0.717923634 172.31.31.144 -> 172.31.23.72 TCP 66 6633 → 45450 [ACK] Seq=823 Ack=8965 Win=853 Len=0 TSval=785210 TSecr=19355335
584 0.750533767 172.31.23.72 -> 172.31.31.144 OpenFlow 146 Type: OFPT_PORT_STATUS
585 0.750664831 172.31.23.72 -> 172.31.31.144 OpenFlow 146 Type: OFPT_PORT_STATUS
586 0.750879583 172.31.31.144 -> 172.31.23.72 TCP 66 6633 → 45422 [ACK] Seq=823 Ack=8507 Win=853 Len=0 TSval=785219 TSecr=19355343
587 0.754385338 172.31.31.144 -> 172.31.23.72 TCP 66 6633 → 45450 [ACK] Seq=823 Ack=9429 Win=853 Len=0 TSval=785220 TSecr=19355335
588 0.774330817 172.31.31.144 -> 172.31.23.72 OpenFlow 146 Type: OFPT_FLOW_MOD
589 0.774361796 172.31.23.72 -> 172.31.31.144 TCP 66 45422 → 6633 [ACK] Seq=8507 Ack=903 Win=213 Len=0 TSval=19355349 TSecr=785224
590 0.774367434 172.31.31.144 -> 172.31.23.72 OpenFlow 154 Type: OFPT_BARRIER_REQUEST
591 0.774371454 172.31.23.72 -> 172.31.31.144 TCP 66 45422 → 6633 [ACK] Seq=8507 Ack=991 Win=213 Len=0 TSval=19355349 TSecr=785225
592 0.774373526 172.31.31.144 -> 172.31.23.72 OpenFlow 146 Type: OFPT_FLOW_MOD
593 0.774380490 172.31.31.144 -> 172.31.23.72 OpenFlow 146 Type: OFPT_FLOW_MOD
594 0.774395421 172.31.31.144 -> 172.31.23.72 OpenFlow 154 Type: OFPT_BARRIER_REQUEST
595 0.774398161 172.31.31.144 -> 172.31.23.72 OpenFlow 154 Type: OFPT_BARRIER_REQUEST
596 0.774399969 172.31.31.144 -> 172.31.23.72 OpenFlow 146 Type: OFPT_FLOW_MOD
597 0.774543891 172.31.31.144 -> 172.31.23.72 OpenFlow 146 Type: OFPT_FLOW_MOD
598 0.774549818 172.31.23.72 -> 172.31.31.144 TCP 66 45422 → 6633 [ACK] Seq=8507 Ack=1071 Win=213 Len=0 TSval=19355349 TSecr=785225
599 0.774555648 172.31.31.144 -> 172.31.23.72 OpenFlow 146 Type: OFPT_FLOW_MOD
600 0.774561147 172.31.23.72 -> 172.31.31.144 TCP 66 45416 → 6633 [ACK] Seq=739 Ack=1049 Win=213 Len=0 TSval=19355349 TSecr=785225
601 0.774562676 172.31.31.144 -> 172.31.23.72 OpenFlow 146 Type: OFPT_FLOW_MOD
602 0.774564532 172.31.23.72 -> 172.31.31.144 TCP 66 45422 → 6633 [ACK] Seq=8507 Ack=1151 Win=213 Len=0 TSval=19355349 TSecr=785225
603 0.774575647 172.31.31.144 -> 172.31.23.72 OpenFlow 146 Type: OFPT_FLOW_MOD
604 0.774577118 172.31.31.144 -> 172.31.23.72 OpenFlow 146 Type: OFPT_FLOW_MOD
605 0.774579089 172.31.23.72 -> 172.31.31.144 TCP 66 45416 → 6633 [ACK] Seq=739 Ack=1129 Win=213 Len=0 TSval=19355349 TSecr=785225
606 0.774583714 172.31.31.144 -> 172.31.23.72 OpenFlow 74 Type: OFPT_BARRIER_REQUEST
607 0.774584962 172.31.31.144 -> 172.31.23.72 OpenFlow 74 Type: OFPT_BARRIER_REQUEST
608 0.774586796 172.31.23.72 -> 172.31.31.144 TCP 66 45422 → 6633 [ACK] Seq=8507 Ack=1159 Win=213 Len=0 TSval=19355349 TSecr=785225
609 0.774587947 172.31.31.144 -> 172.31.23.72 OpenFlow 74 Type: OFPT_BARRIER_REQUEST
610 0.774589793 172.31.23.72 -> 172.31.31.144 TCP 66 45416 → 6633 [ACK] Seq=739 Ack=1137 Win=213 Len=0 TSval=19355349 TSecr=785225
611 0.774591404 172.31.31.144 -> 172.31.23.72 OpenFlow 146 Type: OFPT_FLOW_MOD
612 0.774647713 172.31.31.144 -> 172.31.23.72 OpenFlow 146 Type: OFPT_FLOW_MOD
613 0.774650569 172.31.31.144 -> 172.31.23.72 OpenFlow 74 Type: OFPT_BARRIER_REQUEST
614 0.774694452 172.31.23.72 -> 172.31.31.144 OpenFlow 74 Type: OFPT_BARRIER_REPLY
615 0.774717796 172.31.23.72 -> 172.31.31.144 OpenFlow 74 Type: OFPT_BARRIER_REPLY
616 0.774768459 172.31.23.72 -> 172.31.31.144 OpenFlow 74 Type: OFPT_BARRIER_REPLY
617 0.774789498 172.31.23.72 -> 172.31.31.144 OpenFlow 74 Type: OFPT_BARRIER_REPLY
618 0.774858785 172.31.23.72 -> 172.31.31.144 OpenFlow 74 Type: OFPT_BARRIER_REPLY
619 0.774880916 172.31.31.144 -> 172.31.23.72 TCP 66 6633 → 45420 [ACK] Seq=1401 Ack=9387 Win=853 Len=0 TSval=785225 TSecr=19355349
620 0.774978425 172.31.31.144 -> 172.31.23.72 TCP 66 6633 → 45418 [ACK] Seq=1547 Ack=1081 Win=853 Len=0 TSval=785225 TSecr=19355349
621 0.774994699 172.31.23.72 -> 172.31.31.144 OpenFlow 74 Type: OFPT_BARRIER_REPLY
622 0.775013940 172.31.23.72 -> 172.31.31.144 OpenFlow 74 Type: OFPT_BARRIER_REPLY
623 0.775180349 172.31.31.144 -> 172.31.23.72 TCP 66 6633 → 45422 [ACK] Seq=1159 Ack=8523 Win=853 Len=0 TSval=785225 TSecr=19355349
624 0.775188726 172.31.23.72 -> 172.31.31.144 OpenFlow 146 Type: OFPT_FLOW_REMOVED
625 0.775209042 172.31.23.72 -> 172.31.31.144 OpenFlow 306 Type: OFPT_FLOW_REMOVED
626 0.775215781 172.31.23.72 -> 172.31.31.144 OpenFlow 146 Type: OFPT_FLOW_REMOVED
627 0.775228328 172.31.23.72 -> 172.31.31.144 OpenFlow 146 Type: OFPT_FLOW_REMOVED
628 0.775239418 172.31.23.72 -> 172.31.31.144 OpenFlow 146 Type: OFPT_FLOW_REMOVED
629 0.775302048 172.31.23.72 -> 172.31.31.144 OpenFlow 306 Type: OFPT_FLOW_REMOVED
630 0.775310302 172.31.23.72 -> 172.31.31.144 OpenFlow 146 Type: OFPT_FLOW_REMOVED
631 0.775312388 172.31.23.72 -> 172.31.31.144 OpenFlow 306 Type: OFPT_FLOW_REMOVED
632 0.775350518 172.31.31.144 -> 172.31.23.72 TCP 66 6633 → 45420 [ACK] Seq=1401 Ack=9707 Win=853 Len=0 TSval=785225 TSecr=19355349
633 0.775541922 172.31.31.144 -> 172.31.23.72 TCP 66 6633 → 45416 [ACK] Seq=1137 Ack=907 Win=853 Len=0 TSval=785225 TSecr=19355349
634 0.775546974 172.31.31.144 -> 172.31.23.72 OpenFlow 170 Type: OFPT_FLOW_MOD
635 0.775549230 172.31.31.144 -> 172.31.23.72 OpenFlow 170 Type: OFPT_FLOW_MOD
636 0.775561864 172.31.31.144 -> 172.31.23.72 TCP 66 6633 → 45422 [ACK] Seq=1159 Ack=8843 Win=853 Len=0 TSval=785225 TSecr=19355349
637 0.775635739 172.31.31.144 -> 172.31.23.72 OpenFlow 170 Type: OFPT_FLOW_MOD
638 0.775645865 172.31.31.144 -> 172.31.23.72 OpenFlow 170 Type: OFPT_FLOW_MOD
639 0.775647610 172.31.31.144 -> 172.31.23.72 OpenFlow 74 Type: OFPT_BARRIER_REQUEST
640 0.775649096 172.31.31.144 -> 172.31.23.72 OpenFlow 178 Type: OFPT_FLOW_MOD
641 0.775650496 172.31.31.144 -> 172.31.23.72 OpenFlow 386 Type: OFPT_FLOW_MOD
642 0.775728531 172.31.31.144 -> 172.31.23.72 OpenFlow 170 Type: OFPT_FLOW_MOD
643 0.775770588 172.31.31.144 -> 172.31.23.72 OpenFlow 170 Type: OFPT_FLOW_MOD
644 0.775797774 172.31.31.144 -> 172.31.23.72 OpenFlow 170 Type: OFPT_FLOW_MOD
645 0.775825716 172.31.31.144 -> 172.31.23.72 OpenFlow 170 Type: OFPT_FLOW_MOD
646 0.775852777 172.31.31.144 -> 172.31.23.72 OpenFlow 170 Type: OFPT_FLOW_MOD
647 0.775880331 172.31.31.144 -> 172.31.23.72 OpenFlow 74 Type: OFPT_BARRIER_REQUEST
648 0.775908260 172.31.31.144 -> 172.31.23.72 OpenFlow 178 Type: OFPT_FLOW_MOD
649 0.775974681 172.31.31.144 -> 172.31.23.72 OpenFlow 170 Type: OFPT_FLOW_MOD
650 0.776001663 172.31.31.144 -> 172.31.23.72 OpenFlow 170 Type: OFPT_FLOW_MOD
651 0.776536321 172.31.31.144 -> 172.31.23.72 OpenFlow 82 Type: OFPT_MULTIPART_REQUEST, OFPMP_TABLE
652 0.776594008 172.31.31.144 -> 172.31.23.72 OpenFlow 146 Type: OFPT_MULTIPART_REQUEST, OFPMP_PORT_STATS
653 0.777809364 172.31.23.72 -> 172.31.31.144 OpenFlow 6178 Type: OFPT_MULTIPART_REPLY, OFPMP_TABLE
654 0.777900682 172.31.23.72 -> 172.31.31.144 OpenFlow 2426 Type: OFPT_MULTIPART_REPLY, OFPMP_FLOW
655 0.777996690 172.31.23.72 -> 172.31.31.144 OpenFlow 642 Type: OFPT_MULTIPART_REPLY, OFPMP_PORT_STATS
656 0.778053235 172.31.23.72 -> 172.31.31.144 OpenFlow 74 Type: OFPT_BARRIER_REPLY
657 0.778076227 172.31.23.72 -> 172.31.31.144 OpenFlow 74 Type: OFPT_BARRIER_REPLY
658 0.778098312 172.31.31.144 -> 172.31.23.72 TCP 66 6633 → 45452 [ACK] Seq=1065 Ack=9211 Win=853 Len=0 TSval=785225 TSecr=19355350
659 0.778140721 172.31.23.72 -> 172.31.31.144 OpenFlow 74 Type: OFPT_BARRIER_REPLY
660 0.778164645 172.31.23.72 -> 172.31.31.144 OpenFlow 74 Type: OFPT_BARRIER_REPLY
661 0.778223629 172.31.31.144 -> 172.31.23.72 TCP 66 6633 → 45420 [ACK] Seq=2041 Ack=9723 Win=853 Len=0 TSval=785225 TSecr=19355350
662 0.778240503 172.31.23.72 -> 172.31.31.144 OpenFlow 74 Type: OFPT_BARRIER_REPLY
663 0.778404025 172.31.31.144 -> 172.31.23.72 TCP 66 6633 → 45418 [ACK] Seq=2187 Ack=1417 Win=853 Len=0 TSval=785226 TSecr=19355350
664 0.814361672 172.31.31.144 -> 172.31.23.72 TCP 66 6633 → 45452 [ACK] Seq=1065 Ack=9787 Win=853 Len=0 TSval=785235 TSecr=19355350
665 0.818391296 172.31.31.144 -> 172.31.23.72 TCP 66 6633 → 45416 [ACK] Seq=1561 Ack=915 Win=853 Len=0 TSval=785236 TSecr=19355350
666 0.835671006 172.31.31.144 -> 172.31.23.72 OpenFlow 90 Type: OFPT_MULTIPART_REQUEST, OFPMP_PORT_STATS
667 0.835703320 172.31.31.144 -> 172.31.23.72 OpenFlow 138 Type: OFPT_MULTIPART_REQUEST, OFPMP_TABLE
668 0.836010565 172.31.23.72 -> 172.31.31.144 OpenFlow 642 Type: OFPT_MULTIPART_REPLY, OFPMP_PORT_STATS
669 0.836112842 172.31.23.72 -> 172.31.31.144 OpenFlow 2634 Type: OFPT_MULTIPART_REPLY, OFPMP_FLOW
670 0.836263576 172.31.23.72 -> 172.31.31.144 OpenFlow 6178 Type: OFPT_MULTIPART_REPLY, OFPMP_TABLE
671 0.836365233 172.31.31.144 -> 172.31.23.72 TCP 66 6633 → 45454 [ACK] Seq=1065 Ack=3883 Win=853 Len=0 TSval=785240 TSecr=19355365
672 0.874372596 172.31.31.144 -> 172.31.23.72 TCP 66 6633 → 45454 [ACK] Seq=1065 Ack=9995 Win=853 Len=0 TSval=785250 TSecr=19355365
673 0.901880238 172.31.31.144 -> 172.31.23.72 OpenFlow 90 Type: OFPT_MULTIPART_REQUEST, OFPMP_PORT_STATS
674 0.901896933 172.31.31.144 -> 172.31.23.72 OpenFlow 138 Type: OFPT_MULTIPART_REQUEST, OFPMP_FLOW
675 0.902208454 172.31.23.72 -> 172.31.31.144 OpenFlow 642 Type: OFPT_MULTIPART_REPLY, OFPMP_PORT_STATS
676 0.902386944 172.31.23.72 -> 172.31.31.144 OpenFlow 6178 Type: OFPT_MULTIPART_REPLY, OFPMP_TABLE
677 0.902447825 172.31.23.72 -> 172.31.31.144 OpenFlow 762 Type: OFPT_MULTIPART_REPLY, OFPMP_FLOW
678 0.902613513 172.31.31.144 -> 172.31.23.72 TCP 66 6633 → 45456 [ACK] Seq=1065 Ack=8369 Win=853 Len=0 TSval=785257 TSecr=19355381
679 0.952071815 172.31.31.144 -> 172.31.23.72 OpenFlow 122 Type: OFPT_MULTIPART_REQUEST, OFPMP_FLOW
680 0.952100653 172.31.31.144 -> 172.31.23.72 OpenFlow 106 Type: OFPT_MULTIPART_REQUEST, OFPMP_PORT_STATS
681 0.952437695 172.31.23.72 -> 172.31.31.144 OpenFlow 2010 Type: OFPT_MULTIPART_REPLY, OFPMP_FLOW
682 0.952612859 172.31.23.72 -> 172.31.31.144 OpenFlow 6178 Type: OFPT_MULTIPART_REPLY, OFPMP_TABLE
683 0.952720239 172.31.23.72 -> 172.31.31.144 OpenFlow 642 Type: OFPT_MULTIPART_REPLY, OFPMP_PORT_STATS
684 0.952888168 172.31.31.144 -> 172.31.23.72 TCP 66 6633 → 45458 [ACK] Seq=1065 Ack=8795 Win=853 Len=0 TSval=785269 TSecr=19355394
685 0.978164407 172.31.31.144 -> 172.31.23.72 OpenFlow 122 Type: OFPT_MULTIPART_REQUEST, OFPMP_FLOW
686 0.978214269 172.31.31.144 -> 172.31.23.72 OpenFlow 106 Type: OFPT_MULTIPART_REQUEST, OFPMP_TABLE
687 0.978486458 172.31.23.72 -> 172.31.31.144 OpenFlow 2010 Type: OFPT_MULTIPART_REPLY, OFPMP_FLOW
688 0.978582583 172.31.23.72 -> 172.31.31.144 OpenFlow 530 Type: OFPT_MULTIPART_REPLY, OFPMP_PORT_STATS
689 0.978748345 172.31.23.72 -> 172.31.31.144 OpenFlow 6178 Type: OFPT_MULTIPART_REPLY, OFPMP_TABLE
690 0.978758809 172.31.31.144 -> 172.31.23.72 TCP 66 6633 → 45460 [ACK] Seq=823 Ack=2901 Win=853 Len=0 TSval=785276 TSecr=19355400
691 0.990346186 172.31.31.144 -> 172.31.23.72 TCP 66 6633 → 45458 [ACK] Seq=1065 Ack=9371 Win=853 Len=0 TSval=785279 TSecr=19355394
692 1.018427677 172.31.31.144 -> 172.31.23.72 TCP 66 6633 → 45460 [ACK] Seq=823 Ack=9013 Win=853 Len=0 TSval=785286 TSecr=19355400
693 1.380755787 172.31.31.144 -> 172.31.23.72 OpenFlow 82 Type: OFPT_MULTIPART_REQUEST, OFPMP_TABLE
694 1.380793064 172.31.31.144 -> 172.31.23.72 OpenFlow 146 Type: OFPT_MULTIPART_REQUEST, OFPMP_PORT_STATS
695 1.381126724 172.31.23.72 -> 172.31.31.144 OpenFlow 6178 Type: OFPT_MULTIPART_REPLY, OFPMP_TABLE
696 1.381194473 172.31.23.72 -> 172.31.31.144 OpenFlow 1178 Type: OFPT_MULTIPART_REPLY, OFPMP_FLOW
697 1.381296482 172.31.23.72 -> 172.31.31.144 OpenFlow 530 Type: OFPT_MULTIPART_REPLY, OFPMP_PORT_STATS
698 1.381458719 172.31.31.144 -> 172.31.23.72 TCP 66 6633 → 45462 [ACK] Seq=823 Ack=7963 Win=853 Len=0 TSval=785376 TSecr=19355501
699 1.418357184 172.31.31.144 -> 172.31.23.72 TCP 66 6633 → 45462 [ACK] Seq=823 Ack=8427 Win=853 Len=0 TSval=785386 TSecr=19355501
