  1 0.000000000 172.31.31.144 -> 172.31.23.72 TCP 187 6633 → 45546 [PSH, ACK] Seq=1 Ack=1 Win=853 Len=121 TSval=1165686 TSecr=29986554
  2 0.000022846 172.31.31.144 -> 172.31.23.72 TCP 187 6633 → 45546 [PSH, ACK] Seq=122 Ack=1 Win=853 Len=121 TSval=1165686 TSecr=29986554
  3 0.000039342 172.31.31.144 -> 172.31.23.72 TCP 187 6633 → 45546 [PSH, ACK] Seq=243 Ack=1 Win=853 Len=121 TSval=1165686 TSecr=29986554
  4 0.000042077 172.31.31.144 -> 172.31.23.72 TCP 187 6633 → 45546 [PSH, ACK] Seq=364 Ack=1 Win=853 Len=121 TSval=1165686 TSecr=29986554
  5 0.000059731 172.31.31.144 -> 172.31.23.72 TCP 187 6633 → 45546 [PSH, ACK] Seq=485 Ack=1 Win=853 Len=121 TSval=1165687 TSecr=29986554
  6 0.000130904 172.31.31.144 -> 172.31.23.72 TCP 187 6633 → 45546 [PSH, ACK] Seq=606 Ack=1 Win=853 Len=121 TSval=1165687 TSecr=29986554
  7 0.000189665 172.31.31.144 -> 172.31.23.72 TCP 187 6633 → 45546 [PSH, ACK] Seq=727 Ack=1 Win=853 Len=121 TSval=1165687 TSecr=29986554
  8 0.000255446 172.31.31.144 -> 172.31.23.72 TCP 187 6633 → 45546 [PSH, ACK] Seq=848 Ack=1 Win=853 Len=121 TSval=1165687 TSecr=29986554
  9 0.000336475 172.31.31.144 -> 172.31.23.72 TCP 187 6633 → 45534 [PSH, ACK] Seq=1 Ack=1 Win=853 Len=121 TSval=1165687 TSecr=29986554
 10 0.000365003 172.31.31.144 -> 172.31.23.72 TCP 187 6633 → 45534 [PSH, ACK] Seq=122 Ack=1 Win=853 Len=121 TSval=1165687 TSecr=29986554
 11 0.000415143 172.31.31.144 -> 172.31.23.72 TCP 187 6633 → 45534 [PSH, ACK] Seq=243 Ack=1 Win=853 Len=121 TSval=1165687 TSecr=29986554
 12 0.000466354 172.31.31.144 -> 172.31.23.72 TCP 187 6633 → 45534 [PSH, ACK] Seq=364 Ack=1 Win=853 Len=121 TSval=1165687 TSecr=29986554
 13 0.000516764 172.31.31.144 -> 172.31.23.72 TCP 187 6633 → 45534 [PSH, ACK] Seq=485 Ack=1 Win=853 Len=121 TSval=1165687 TSecr=29986554
 14 0.000567373 172.31.31.144 -> 172.31.23.72 TCP 187 6633 → 45534 [PSH, ACK] Seq=606 Ack=1 Win=853 Len=121 TSval=1165687 TSecr=29986554
 15 0.000655295 172.31.23.72 -> 172.31.31.144 TCP 66 45546 → 6633 [ACK] Seq=1 Ack=969 Win=213 Len=0 TSval=29987278 TSecr=1165686
 16 0.000692805 172.31.31.144 -> 172.31.23.72 TCP 187 6633 → 45530 [PSH, ACK] Seq=1 Ack=1 Win=853 Len=121 TSval=1165687 TSecr=29986529
 17 0.000767522 172.31.31.144 -> 172.31.23.72 TCP 187 6633 → 45530 [PSH, ACK] Seq=122 Ack=1 Win=853 Len=121 TSval=1165687 TSecr=29986529
 18 0.000772303 172.31.31.144 -> 172.31.23.72 TCP 187 6633 → 45530 [PSH, ACK] Seq=243 Ack=1 Win=853 Len=121 TSval=1165687 TSecr=29986529
 19 0.000794264 172.31.31.144 -> 172.31.23.72 TCP 187 6633 → 45530 [PSH, ACK] Seq=364 Ack=1 Win=853 Len=121 TSval=1165687 TSecr=29986529
 20 0.000838304 172.31.31.144 -> 172.31.23.72 TCP 187 6633 → 45530 [PSH, ACK] Seq=485 Ack=1 Win=853 Len=121 TSval=1165687 TSecr=29986529
 21 0.000886324 172.31.31.144 -> 172.31.23.72 TCP 187 6633 → 45530 [PSH, ACK] Seq=606 Ack=1 Win=853 Len=121 TSval=1165687 TSecr=29986529
 22 0.000940986 172.31.31.144 -> 172.31.23.72 TCP 187 6633 → 45530 [PSH, ACK] Seq=727 Ack=1 Win=853 Len=121 TSval=1165687 TSecr=29986529
 23 0.000988876 172.31.31.144 -> 172.31.23.72 TCP 187 6633 → 45530 [PSH, ACK] Seq=848 Ack=1 Win=853 Len=121 TSval=1165687 TSecr=29986529
 24 0.001046790 172.31.23.72 -> 172.31.31.144 TCP 66 45534 → 6633 [ACK] Seq=1 Ack=727 Win=213 Len=0 TSval=29987278 TSecr=1165687
 25 0.001205119 172.31.31.144 -> 172.31.23.72 TCP 187 6633 → 45514 [PSH, ACK] Seq=1 Ack=1 Win=853 Len=121 TSval=1165687 TSecr=29986554
 26 0.001211367 172.31.31.144 -> 172.31.23.72 TCP 187 6633 → 45514 [PSH, ACK] Seq=122 Ack=1 Win=853 Len=121 TSval=1165687 TSecr=29986554
 27 0.001213384 172.31.31.144 -> 172.31.23.72 TCP 187 6633 → 45514 [PSH, ACK] Seq=243 Ack=1 Win=853 Len=121 TSval=1165687 TSecr=29986554
 28 0.001215247 172.31.31.144 -> 172.31.23.72 TCP 187 6633 → 45514 [PSH, ACK] Seq=364 Ack=1 Win=853 Len=121 TSval=1165687 TSecr=29986554
 29 0.001247710 172.31.31.144 -> 172.31.23.72 TCP 187 6633 → 45514 [PSH, ACK] Seq=485 Ack=1 Win=853 Len=121 TSval=1165687 TSecr=29986554
 30 0.001297032 172.31.31.144 -> 172.31.23.72 TCP 187 6633 → 45514 [PSH, ACK] Seq=606 Ack=1 Win=853 Len=121 TSval=1165687 TSecr=29986554
 31 0.001347871 172.31.31.144 -> 172.31.23.72 TCP 187 6633 → 45514 [PSH, ACK] Seq=727 Ack=1 Win=853 Len=121 TSval=1165687 TSecr=29986554
 32 0.001400822 172.31.31.144 -> 172.31.23.72 TCP 187 6633 → 45514 [PSH, ACK] Seq=848 Ack=1 Win=853 Len=121 TSval=1165687 TSecr=29986554
 33 0.001476900 172.31.31.144 -> 172.31.23.72 TCP 187 6633 → 45528 [PSH, ACK] Seq=1 Ack=1 Win=853 Len=121 TSval=1165687 TSecr=29986554
 34 0.001510439 172.31.31.144 -> 172.31.23.72 TCP 187 6633 → 45528 [PSH, ACK] Seq=122 Ack=1 Win=853 Len=121 TSval=1165687 TSecr=29986554
 35 0.001525813 172.31.23.72 -> 172.31.31.144 TCP 66 45530 → 6633 [ACK] Seq=1 Ack=969 Win=213 Len=0 TSval=29987278 TSecr=1165687
 36 0.001568529 172.31.31.144 -> 172.31.23.72 TCP 187 6633 → 45528 [PSH, ACK] Seq=243 Ack=1 Win=853 Len=121 TSval=1165687 TSecr=29986554
 37 0.001610989 172.31.31.144 -> 172.31.23.72 TCP 187 6633 → 45528 [PSH, ACK] Seq=364 Ack=1 Win=853 Len=121 TSval=1165687 TSecr=29986554
 38 0.001662847 172.31.31.144 -> 172.31.23.72 TCP 187 6633 → 45528 [PSH, ACK] Seq=485 Ack=1 Win=853 Len=121 TSval=1165687 TSecr=29986554
 39 0.001718452 172.31.31.144 -> 172.31.23.72 TCP 187 6633 → 45528 [PSH, ACK] Seq=606 Ack=1 Win=853 Len=121 TSval=1165687 TSecr=29986554
 40 0.001780700 172.31.31.144 -> 172.31.23.72 TCP 187 6633 → 45528 [PSH, ACK] Seq=727 Ack=1 Win=853 Len=121 TSval=1165687 TSecr=29986554
 41 0.001818128 172.31.31.144 -> 172.31.23.72 TCP 187 6633 → 45528 [PSH, ACK] Seq=848 Ack=1 Win=853 Len=121 TSval=1165687 TSecr=29986554
 42 0.001873174 172.31.31.144 -> 172.31.23.72 TCP 187 6633 → 45528 [PSH, ACK] Seq=969 Ack=1 Win=853 Len=121 TSval=1165687 TSecr=29986554
 43 0.001919190 172.31.31.144 -> 172.31.23.72 TCP 187 6633 → 45528 [PSH, ACK] Seq=1090 Ack=1 Win=853 Len=121 TSval=1165687 TSecr=29986554
 44 0.001940216 172.31.23.72 -> 172.31.31.144 TCP 66 45514 → 6633 [ACK] Seq=1 Ack=969 Win=213 Len=0 TSval=29987278 TSecr=1165687
 45 0.002004043 172.31.31.144 -> 172.31.23.72 TCP 187 6633 → 45518 [PSH, ACK] Seq=1 Ack=1 Win=853 Len=121 TSval=1165687 TSecr=29986554
 46 0.002011291 172.31.23.72 -> 172.31.31.144 TCP 66 45518 → 6633 [ACK] Seq=1 Ack=122 Win=213 Len=0 TSval=29987278 TSecr=1165687
 47 0.002038795 172.31.31.144 -> 172.31.23.72 TCP 187 6633 → 45518 [PSH, ACK] Seq=122 Ack=1 Win=853 Len=121 TSval=1165687 TSecr=29986554
 48 0.002055886 172.31.23.72 -> 172.31.31.144 TCP 66 45518 → 6633 [ACK] Seq=1 Ack=243 Win=213 Len=0 TSval=29987278 TSecr=1165687
 49 0.002062138 172.31.23.72 -> 172.31.31.144 OpenFlow 189 Type: OFPT_PACKET_IN
 50 0.002084745 172.31.31.144 -> 172.31.23.72 TCP 187 6633 → 45518 [PSH, ACK] Seq=243 Ack=1 Win=853 Len=121 TSval=1165687 TSecr=29986554
 51 0.002089322 172.31.23.72 -> 172.31.31.144 TCP 66 45518 → 6633 [ACK] Seq=1 Ack=364 Win=213 Len=0 TSval=29987278 TSecr=1165687
 52 0.002165593 172.31.31.144 -> 172.31.23.72 TCP 187 6633 → 45518 [PSH, ACK] Seq=364 Ack=1 Win=853 Len=121 TSval=1165687 TSecr=29986554
 53 0.002172339 172.31.23.72 -> 172.31.31.144 TCP 66 45518 → 6633 [ACK] Seq=1 Ack=485 Win=213 Len=0 TSval=29987278 TSecr=1165687
 54 0.002179851 172.31.23.72 -> 172.31.31.144 OpenFlow 189 Type: OFPT_PACKET_IN
 55 0.002205009 172.31.31.144 -> 172.31.23.72 TCP 187 6633 → 45518 [PSH, ACK] Seq=485 Ack=1 Win=853 Len=121 TSval=1165687 TSecr=29987278
 56 0.002209634 172.31.23.72 -> 172.31.31.144 TCP 66 45518 → 6633 [ACK] Seq=1 Ack=606 Win=213 Len=0 TSval=29987278 TSecr=1165687
 57 0.002276411 172.31.31.144 -> 172.31.23.72 TCP 187 6633 → 45518 [PSH, ACK] Seq=606 Ack=1 Win=853 Len=121 TSval=1165687 TSecr=29987278
 58 0.002283172 172.31.23.72 -> 172.31.31.144 TCP 66 45518 → 6633 [ACK] Seq=1 Ack=727 Win=213 Len=0 TSval=29987278 TSecr=1165687
 59 0.002322090 172.31.31.144 -> 172.31.23.72 TCP 187 6633 → 45518 [PSH, ACK] Seq=727 Ack=1 Win=853 Len=121 TSval=1165687 TSecr=29987278
 60 0.002330574 172.31.23.72 -> 172.31.31.144 TCP 66 45518 → 6633 [ACK] Seq=1 Ack=848 Win=213 Len=0 TSval=29987278 TSecr=1165687
 61 0.002370518 172.31.31.144 -> 172.31.23.72 TCP 187 6633 → 45518 [PSH, ACK] Seq=848 Ack=1 Win=853 Len=121 TSval=1165687 TSecr=29987278
 62 0.002378516 172.31.23.72 -> 172.31.31.144 TCP 66 45518 → 6633 [ACK] Seq=1 Ack=969 Win=213 Len=0 TSval=29987278 TSecr=1165687
 63 0.002418247 172.31.31.144 -> 172.31.23.72 TCP 187 6633 → 45518 [PSH, ACK] Seq=969 Ack=1 Win=853 Len=121 TSval=1165687 TSecr=29987278
 64 0.002426280 172.31.23.72 -> 172.31.31.144 TCP 66 45518 → 6633 [ACK] Seq=1 Ack=1090 Win=213 Len=0 TSval=29987278 TSecr=1165687
 65 0.002477369 172.31.31.144 -> 172.31.23.72 TCP 187 6633 → 45518 [PSH, ACK] Seq=1090 Ack=1 Win=853 Len=121 TSval=1165687 TSecr=29987278
 66 0.002482979 172.31.23.72 -> 172.31.31.144 TCP 66 45518 → 6633 [ACK] Seq=1 Ack=1211 Win=213 Len=0 TSval=29987278 TSecr=1165687
 67 0.002561155 172.31.31.144 -> 172.31.23.72 TCP 187 6633 → 45512 [PSH, ACK] Seq=1 Ack=1 Win=853 Len=121 TSval=1165687 TSecr=29986554
 68 0.002601346 172.31.31.144 -> 172.31.23.72 TCP 187 6633 → 45512 [PSH, ACK] Seq=122 Ack=1 Win=853 Len=121 TSval=1165687 TSecr=29986554
 69 0.002646770 172.31.31.144 -> 172.31.23.72 TCP 187 6633 → 45512 [PSH, ACK] Seq=243 Ack=1 Win=853 Len=121 TSval=1165687 TSecr=29986554
 70 0.002718128 172.31.31.144 -> 172.31.23.72 TCP 187 6633 → 45512 [PSH, ACK] Seq=364 Ack=1 Win=853 Len=121 TSval=1165687 TSecr=29986554
 71 0.002734288 172.31.31.144 -> 172.31.23.72 TCP 66 6633 → 45528 [ACK] Seq=1211 Ack=247 Win=853 Len=0 TSval=1165687 TSecr=29987278
 72 0.002761631 172.31.31.144 -> 172.31.23.72 TCP 187 6633 → 45512 [PSH, ACK] Seq=485 Ack=1 Win=853 Len=121 TSval=1165687 TSecr=29986554
 73 0.002801866 172.31.31.144 -> 172.31.23.72 TCP 187 6633 → 45512 [PSH, ACK] Seq=606 Ack=1 Win=853 Len=121 TSval=1165687 TSecr=29986554
 74 0.002813436 172.31.23.72 -> 172.31.31.144 OpenFlow 189 Type: OFPT_PACKET_IN
 75 0.002856310 172.31.31.144 -> 172.31.23.72 TCP 187 6633 → 45512 [PSH, ACK] Seq=727 Ack=1 Win=853 Len=121 TSval=1165687 TSecr=29986554
 76 0.002863228 172.31.23.72 -> 172.31.31.144 OpenFlow 189 Type: OFPT_PACKET_IN
 77 0.002923180 172.31.31.144 -> 172.31.23.72 TCP 187 6633 → 45512 [PSH, ACK] Seq=848 Ack=1 Win=853 Len=121 TSval=1165687 TSecr=29986554
 78 0.002952046 172.31.31.144 -> 172.31.23.72 TCP 187 6633 → 45512 [PSH, ACK] Seq=969 Ack=1 Win=853 Len=121 TSval=1165687 TSecr=29986554
 79 0.003050937 172.31.31.144 -> 172.31.23.72 TCP 187 6633 → 45512 [PSH, ACK] Seq=1090 Ack=1 Win=853 Len=121 TSval=1165687 TSecr=29986554
 80 0.003055773 172.31.31.144 -> 172.31.23.72 TCP 66 6633 → 45518 [ACK] Seq=1211 Ack=124 Win=853 Len=0 TSval=1165687 TSecr=29987278
 81 0.003058917 172.31.31.144 -> 172.31.23.72 TCP 66 6633 → 45518 [ACK] Seq=1211 Ack=247 Win=853 Len=0 TSval=1165687 TSecr=29987278
 82 0.003086093 172.31.31.144 -> 172.31.23.72 TCP 187 6633 → 45538 [PSH, ACK] Seq=1 Ack=1 Win=853 Len=121 TSval=1165687 TSecr=29986554
 83 0.003116668 172.31.31.144 -> 172.31.23.72 TCP 187 6633 → 45538 [PSH, ACK] Seq=122 Ack=1 Win=853 Len=121 TSval=1165687 TSecr=29986554
 84 0.003263310 172.31.31.144 -> 172.31.23.72 TCP 187 6633 → 45538 [PSH, ACK] Seq=243 Ack=1 Win=853 Len=121 TSval=1165687 TSecr=29986554
 85 0.003343099 172.31.31.144 -> 172.31.23.72 TCP 187 6633 → 45538 [PSH, ACK] Seq=364 Ack=1 Win=853 Len=121 TSval=1165687 TSecr=29986554
 86 0.003391376 172.31.23.72 -> 172.31.31.144 OpenFlow 189 Type: OFPT_PACKET_IN
 87 0.003405260 172.31.31.144 -> 172.31.23.72 TCP 187 6633 → 45538 [PSH, ACK] Seq=485 Ack=1 Win=853 Len=121 TSval=1165687 TSecr=29986554
 88 0.003414889 172.31.23.72 -> 172.31.31.144 OpenFlow 189 Type: OFPT_PACKET_IN
 89 0.003457902 172.31.31.144 -> 172.31.23.72 TCP 187 6633 → 45538 [PSH, ACK] Seq=606 Ack=1 Win=853 Len=121 TSval=1165687 TSecr=29986554
 90 0.003509572 172.31.31.144 -> 172.31.23.72 TCP 187 6633 → 45538 [PSH, ACK] Seq=727 Ack=1 Win=853 Len=121 TSval=1165687 TSecr=29986554
 91 0.003547909 172.31.31.144 -> 172.31.23.72 TCP 187 6633 → 45538 [PSH, ACK] Seq=848 Ack=1 Win=853 Len=121 TSval=1165687 TSecr=29986554
 92 0.003633847 172.31.31.144 -> 172.31.23.72 TCP 187 6633 → 45538 [PSH, ACK] Seq=969 Ack=1 Win=853 Len=121 TSval=1165687 TSecr=29986554
 93 0.003638488 172.31.31.144 -> 172.31.23.72 TCP 66 6633 → 45512 [ACK] Seq=1211 Ack=247 Win=853 Len=0 TSval=1165687 TSecr=29987278
 94 0.003664303 172.31.31.144 -> 172.31.23.72 TCP 187 6633 → 45538 [PSH, ACK] Seq=1090 Ack=1 Win=853 Len=121 TSval=1165687 TSecr=29986554
 95 0.003881452 172.31.23.72 -> 172.31.31.144 OpenFlow 189 Type: OFPT_PACKET_IN
 96 0.003904742 172.31.23.72 -> 172.31.31.144 OpenFlow 189 Type: OFPT_PACKET_IN
 97 0.004093332 172.31.31.144 -> 172.31.23.72 TCP 66 6633 → 45538 [ACK] Seq=1211 Ack=124 Win=853 Len=0 TSval=1165688 TSecr=29987279
 98 0.004099439 172.31.31.144 -> 172.31.23.72 TCP 66 6633 → 45538 [ACK] Seq=1211 Ack=247 Win=853 Len=0 TSval=1165688 TSecr=29987279
 99 0.004343594 172.31.23.72 -> 172.31.31.144 OpenFlow 189 Type: OFPT_PACKET_IN
100 0.004367567 172.31.23.72 -> 172.31.31.144 OpenFlow 435 Type: OFPT_PACKET_IN
101 0.004381051 172.31.23.72 -> 172.31.31.144 OpenFlow 189 Type: OFPT_PACKET_IN
102 0.004399615 172.31.23.72 -> 172.31.31.144 OpenFlow 189 Type: OFPT_PACKET_IN
103 0.004425300 172.31.23.72 -> 172.31.31.144 OpenFlow 189 Type: OFPT_PACKET_IN
104 0.004427996 172.31.23.72 -> 172.31.31.144 OpenFlow 435 Type: OFPT_PACKET_IN
105 0.004443323 172.31.23.72 -> 172.31.31.144 OpenFlow 189 Type: OFPT_PACKET_IN
106 0.004450093 172.31.23.72 -> 172.31.31.144 OpenFlow 681 Type: OFPT_PACKET_IN
107 0.004468610 172.31.23.72 -> 172.31.31.144 OpenFlow 189 Type: OFPT_PACKET_IN
108 0.004482512 172.31.23.72 -> 172.31.31.144 OpenFlow 189 Type: OFPT_PACKET_IN
109 0.004506489 172.31.23.72 -> 172.31.31.144 OpenFlow 189 Type: OFPT_PACKET_IN
110 0.004508972 172.31.23.72 -> 172.31.31.144 OpenFlow 189 Type: OFPT_PACKET_IN
111 0.004523210 172.31.23.72 -> 172.31.31.144 OpenFlow 189 Type: OFPT_PACKET_IN
112 0.004537856 172.31.23.72 -> 172.31.31.144 OpenFlow 189 Type: OFPT_PACKET_IN
113 0.004549803 172.31.31.144 -> 172.31.23.72 TCP 66 6633 → 45532 [ACK] Seq=1 Ack=124 Win=853 Len=0 TSval=1165688 TSecr=29987279
114 0.004568923 172.31.23.72 -> 172.31.31.144 OpenFlow 189 Type: OFPT_PACKET_IN
115 0.004575377 172.31.23.72 -> 172.31.31.144 OpenFlow 435 Type: OFPT_PACKET_IN
116 0.004597151 172.31.23.72 -> 172.31.31.144 OpenFlow 189 Type: OFPT_PACKET_IN
117 0.004625740 172.31.23.72 -> 172.31.31.144 OpenFlow 189 Type: OFPT_PACKET_IN
118 0.004643953 172.31.23.72 -> 172.31.31.144 OpenFlow 189 Type: OFPT_PACKET_IN
119 0.004646229 172.31.23.72 -> 172.31.31.144 OpenFlow 189 Type: OFPT_PACKET_IN
120 0.004749392 172.31.23.72 -> 172.31.31.144 OpenFlow 189 Type: OFPT_PACKET_IN
121 0.004753593 172.31.23.72 -> 172.31.31.144 OpenFlow 189 Type: OFPT_PACKET_IN
122 0.004755757 172.31.23.72 -> 172.31.31.144 OpenFlow 189 Type: OFPT_PACKET_IN
123 0.004757314 172.31.23.72 -> 172.31.31.144 OpenFlow 189 Type: OFPT_PACKET_IN
124 0.004774718 172.31.23.72 -> 172.31.31.144 OpenFlow 189 Type: OFPT_PACKET_IN
125 0.004777040 172.31.23.72 -> 172.31.31.144 OpenFlow 435 Type: OFPT_PACKET_IN
126 0.004790560 172.31.23.72 -> 172.31.31.144 OpenFlow 189 Type: OFPT_PACKET_IN
127 0.004804823 172.31.31.144 -> 172.31.23.72 TCP 66 6633 → 45532 [ACK] Seq=1 Ack=493 Win=853 Len=0 TSval=1165688 TSecr=29987279
128 0.004809843 172.31.31.144 -> 172.31.23.72 TCP 66 6633 → 45544 [ACK] Seq=1 Ack=124 Win=853 Len=0 TSval=1165688 TSecr=29987279
129 0.004811957 172.31.31.144 -> 172.31.23.72 TCP 66 6633 → 45522 [ACK] Seq=1 Ack=124 Win=853 Len=0 TSval=1165688 TSecr=29987279
130 0.004813937 172.31.31.144 -> 172.31.23.72 TCP 66 6633 → 45524 [ACK] Seq=1 Ack=124 Win=853 Len=0 TSval=1165688 TSecr=29987279
131 0.004815741 172.31.31.144 -> 172.31.23.72 TCP 66 6633 → 45544 [ACK] Seq=1 Ack=493 Win=853 Len=0 TSval=1165688 TSecr=29987279
132 0.004817746 172.31.31.144 -> 172.31.23.72 TCP 66 6633 → 45510 [ACK] Seq=1 Ack=124 Win=853 Len=0 TSval=1165688 TSecr=29987279
133 0.004820281 172.31.31.144 -> 172.31.23.72 TCP 66 6633 → 45524 [ACK] Seq=1 Ack=739 Win=853 Len=0 TSval=1165688 TSecr=29987279
134 0.005035870 172.31.23.72 -> 172.31.31.144 OpenFlow 189 Type: OFPT_PACKET_IN
135 0.005041758 172.31.23.72 -> 172.31.31.144 OpenFlow 681 Type: OFPT_PACKET_IN
136 0.005043663 172.31.23.72 -> 172.31.31.144 OpenFlow 435 Type: OFPT_PACKET_IN
137 0.005045392 172.31.23.72 -> 172.31.31.144 OpenFlow 435 Type: OFPT_PACKET_IN
138 0.005047040 172.31.23.72 -> 172.31.31.144 OpenFlow 435 Type: OFPT_PACKET_IN
139 0.005194968 172.31.23.72 -> 172.31.31.144 OpenFlow 189 Type: OFPT_PACKET_IN
140 0.005197072 172.31.23.72 -> 172.31.31.144 OpenFlow 189 Type: OFPT_PACKET_IN
141 0.005312971 172.31.31.144 -> 172.31.23.72 TCP 66 6633 → 45526 [ACK] Seq=1 Ack=124 Win=853 Len=0 TSval=1165688 TSecr=29987279
142 0.005317338 172.31.31.144 -> 172.31.23.72 TCP 66 6633 → 45522 [ACK] Seq=1 Ack=247 Win=853 Len=0 TSval=1165688 TSecr=29987279
143 0.005319834 172.31.31.144 -> 172.31.23.72 TCP 66 6633 → 45550 [ACK] Seq=1 Ack=124 Win=853 Len=0 TSval=1165688 TSecr=29987279
144 0.005321716 172.31.31.144 -> 172.31.23.72 TCP 66 6633 → 45508 [ACK] Seq=1 Ack=124 Win=853 Len=0 TSval=1165688 TSecr=29987279
145 0.005323592 172.31.31.144 -> 172.31.23.72 TCP 66 6633 → 45548 [ACK] Seq=1 Ack=124 Win=853 Len=0 TSval=1165688 TSecr=29987279
146 0.005325580 172.31.31.144 -> 172.31.23.72 TCP 66 6633 → 45542 [ACK] Seq=1 Ack=124 Win=853 Len=0 TSval=1165688 TSecr=29987279
147 0.005327675 172.31.31.144 -> 172.31.23.72 TCP 66 6633 → 45510 [ACK] Seq=1 Ack=493 Win=853 Len=0 TSval=1165688 TSecr=29987279
148 0.005329459 172.31.31.144 -> 172.31.23.72 TCP 66 6633 → 45536 [ACK] Seq=1 Ack=124 Win=853 Len=0 TSval=1165688 TSecr=29987279
149 0.005331257 172.31.31.144 -> 172.31.23.72 TCP 66 6633 → 45520 [ACK] Seq=1 Ack=124 Win=853 Len=0 TSval=1165688 TSecr=29987279
150 0.005333103 172.31.31.144 -> 172.31.23.72 TCP 66 6633 → 45530 [ACK] Seq=969 Ack=124 Win=853 Len=0 TSval=1165688 TSecr=29987279
151 0.005334831 172.31.31.144 -> 172.31.23.72 TCP 66 6633 → 45540 [ACK] Seq=1 Ack=247 Win=853 Len=0 TSval=1165688 TSecr=29987279
152 0.005337014 172.31.31.144 -> 172.31.23.72 TCP 66 6633 → 45526 [ACK] Seq=1 Ack=247 Win=853 Len=0 TSval=1165688 TSecr=29987279
153 0.005338700 172.31.31.144 -> 172.31.23.72 TCP 66 6633 → 45508 [ACK] Seq=1 Ack=247 Win=853 Len=0 TSval=1165688 TSecr=29987279
154 0.005340314 172.31.31.144 -> 172.31.23.72 TCP 66 6633 → 45550 [ACK] Seq=1 Ack=247 Win=853 Len=0 TSval=1165688 TSecr=29987279
155 0.005341837 172.31.31.144 -> 172.31.23.72 TCP 66 6633 → 45514 [ACK] Seq=969 Ack=124 Win=853 Len=0 TSval=1165688 TSecr=29987279
156 0.005507079 172.31.31.144 -> 172.31.23.72 TCP 66 6633 → 45548 [ACK] Seq=1 Ack=493 Win=853 Len=0 TSval=1165688 TSecr=29987279
157 0.005509610 172.31.31.144 -> 172.31.23.72 TCP 66 6633 → 45542 [ACK] Seq=1 Ack=247 Win=853 Len=0 TSval=1165688 TSecr=29987279
158 0.005511293 172.31.31.144 -> 172.31.23.72 TCP 66 6633 → 45536 [ACK] Seq=1 Ack=739 Win=853 Len=0 TSval=1165688 TSecr=29987279
159 0.005608678 172.31.31.144 -> 172.31.23.72 TCP 66 6633 → 45520 [ACK] Seq=1 Ack=493 Win=853 Len=0 TSval=1165688 TSecr=29987279
160 0.005610893 172.31.31.144 -> 172.31.23.72 TCP 66 6633 → 45516 [ACK] Seq=1 Ack=493 Win=853 Len=0 TSval=1165688 TSecr=29987279
161 0.005613308 172.31.31.144 -> 172.31.23.72 TCP 66 6633 → 45530 [ACK] Seq=969 Ack=493 Win=853 Len=0 TSval=1165688 TSecr=29987279
162 0.005614864 172.31.31.144 -> 172.31.23.72 TCP 66 6633 → 45514 [ACK] Seq=969 Ack=247 Win=853 Len=0 TSval=1165688 TSecr=29987279
163 0.005642741 172.31.31.144 -> 172.31.23.72 TCP 66 6633 → 45528 [ACK] Seq=1211 Ack=493 Win=853 Len=0 TSval=1165688 TSecr=29987279
164 0.099965189 172.31.31.144 -> 172.31.23.72 OpenFlow 187 Type: OFPT_PACKET_OUT
165 0.099987319 172.31.31.144 -> 172.31.23.72 OpenFlow 187 Type: OFPT_PACKET_OUT
166 0.100015953 172.31.31.144 -> 172.31.23.72 OpenFlow 187 Type: OFPT_PACKET_OUT
167 0.100042128 172.31.31.144 -> 172.31.23.72 OpenFlow 187 Type: OFPT_PACKET_OUT
168 0.100099206 172.31.31.144 -> 172.31.23.72 OpenFlow 187 Type: OFPT_PACKET_OUT
169 0.100150618 172.31.31.144 -> 172.31.23.72 OpenFlow 187 Type: OFPT_PACKET_OUT
170 0.100223627 172.31.31.144 -> 172.31.23.72 OpenFlow 187 Type: OFPT_PACKET_OUT
171 0.100270692 172.31.31.144 -> 172.31.23.72 OpenFlow 187 Type: OFPT_PACKET_OUT
172 0.100344392 172.31.31.144 -> 172.31.23.72 OpenFlow 187 Type: OFPT_PACKET_OUT
173 0.100361649 172.31.31.144 -> 172.31.23.72 OpenFlow 187 Type: OFPT_PACKET_OUT
174 0.100415538 172.31.31.144 -> 172.31.23.72 OpenFlow 187 Type: OFPT_PACKET_OUT
175 0.100468166 172.31.31.144 -> 172.31.23.72 OpenFlow 187 Type: OFPT_PACKET_OUT
176 0.100525602 172.31.31.144 -> 172.31.23.72 OpenFlow 187 Type: OFPT_PACKET_OUT
177 0.100571585 172.31.31.144 -> 172.31.23.72 OpenFlow 187 Type: OFPT_PACKET_OUT
178 0.100665454 172.31.31.144 -> 172.31.23.72 OpenFlow 187 Type: OFPT_PACKET_OUT
179 0.100683037 172.31.31.144 -> 172.31.23.72 OpenFlow 187 Type: OFPT_PACKET_OUT
180 0.100736286 172.31.31.144 -> 172.31.23.72 OpenFlow 187 Type: OFPT_PACKET_OUT
181 0.100766084 172.31.23.72 -> 172.31.31.144 TCP 66 45532 → 6633 [ACK] Seq=493 Ack=969 Win=213 Len=0 TSval=29987303 TSecr=1165711
182 0.100783934 172.31.31.144 -> 172.31.23.72 OpenFlow 187 Type: OFPT_PACKET_OUT
183 0.100834674 172.31.31.144 -> 172.31.23.72 OpenFlow 187 Type: OFPT_PACKET_OUT
184 0.100926123 172.31.31.144 -> 172.31.23.72 OpenFlow 187 Type: OFPT_PACKET_OUT
185 0.100935341 172.31.31.144 -> 172.31.23.72 OpenFlow 187 Type: OFPT_PACKET_OUT
186 0.100992150 172.31.31.144 -> 172.31.23.72 OpenFlow 187 Type: OFPT_PACKET_OUT
187 0.101036320 172.31.23.72 -> 172.31.31.144 TCP 66 45544 → 6633 [ACK] Seq=493 Ack=727 Win=213 Len=0 TSval=29987303 TSecr=1165712
188 0.101046795 172.31.31.144 -> 172.31.23.72 OpenFlow 187 Type: OFPT_PACKET_OUT
189 0.101100961 172.31.31.144 -> 172.31.23.72 OpenFlow 187 Type: OFPT_PACKET_OUT
190 0.101157021 172.31.31.144 -> 172.31.23.72 OpenFlow 187 Type: OFPT_PACKET_OUT
191 0.101195860 172.31.31.144 -> 172.31.23.72 OpenFlow 187 Type: OFPT_PACKET_OUT
192 0.101251291 172.31.31.144 -> 172.31.23.72 OpenFlow 187 Type: OFPT_PACKET_OUT
193 0.101298815 172.31.31.144 -> 172.31.23.72 OpenFlow 187 Type: OFPT_PACKET_OUT
194 0.101351703 172.31.31.144 -> 172.31.23.72 OpenFlow 187 Type: OFPT_PACKET_OUT
195 0.101399612 172.31.31.144 -> 172.31.23.72 OpenFlow 187 Type: OFPT_PACKET_OUT
196 0.101478002 172.31.31.144 -> 172.31.23.72 OpenFlow 187 Type: OFPT_PACKET_OUT
197 0.101513190 172.31.31.144 -> 172.31.23.72 OpenFlow 187 Type: OFPT_PACKET_OUT
198 0.101569711 172.31.31.144 -> 172.31.23.72 OpenFlow 187 Type: OFPT_PACKET_OUT
199 0.101587711 172.31.23.72 -> 172.31.31.144 TCP 66 45524 → 6633 [ACK] Seq=739 Ack=1211 Win=213 Len=0 TSval=29987303 TSecr=1165712
200 0.101626371 172.31.31.144 -> 172.31.23.72 OpenFlow 187 Type: OFPT_PACKET_OUT
201 0.101671002 172.31.31.144 -> 172.31.23.72 OpenFlow 187 Type: OFPT_PACKET_OUT
202 0.101720014 172.31.31.144 -> 172.31.23.72 OpenFlow 187 Type: OFPT_PACKET_OUT
203 0.101791566 172.31.31.144 -> 172.31.23.72 OpenFlow 187 Type: OFPT_PACKET_OUT
204 0.101826429 172.31.31.144 -> 172.31.23.72 OpenFlow 187 Type: OFPT_PACKET_OUT
205 0.101891359 172.31.31.144 -> 172.31.23.72 OpenFlow 187 Type: OFPT_PACKET_OUT
206 0.101933025 172.31.31.144 -> 172.31.23.72 OpenFlow 187 Type: OFPT_PACKET_OUT
207 0.101962440 172.31.23.72 -> 172.31.31.144 TCP 66 45522 → 6633 [ACK] Seq=247 Ack=727 Win=213 Len=0 TSval=29987303 TSecr=1165712
208 0.101993607 172.31.31.144 -> 172.31.23.72 OpenFlow 187 Type: OFPT_PACKET_OUT
209 0.102036241 172.31.31.144 -> 172.31.23.72 OpenFlow 187 Type: OFPT_PACKET_OUT
210 0.102087878 172.31.31.144 -> 172.31.23.72 OpenFlow 187 Type: OFPT_PACKET_OUT
211 0.102140095 172.31.31.144 -> 172.31.23.72 OpenFlow 187 Type: OFPT_PACKET_OUT
212 0.102197492 172.31.31.144 -> 172.31.23.72 OpenFlow 187 Type: OFPT_PACKET_OUT
213 0.102247904 172.31.31.144 -> 172.31.23.72 OpenFlow 187 Type: OFPT_PACKET_OUT
214 0.102297372 172.31.31.144 -> 172.31.23.72 OpenFlow 187 Type: OFPT_PACKET_OUT
215 0.102346963 172.31.31.144 -> 172.31.23.72 OpenFlow 187 Type: OFPT_PACKET_OUT
216 0.102367540 172.31.23.72 -> 172.31.31.144 TCP 66 45510 → 6633 [ACK] Seq=493 Ack=969 Win=213 Len=0 TSval=29987303 TSecr=1165712
217 0.102438253 172.31.31.144 -> 172.31.23.72 OpenFlow 187 Type: OFPT_PACKET_OUT
218 0.102453162 172.31.23.72 -> 172.31.31.144 OpenFlow 189 Type: OFPT_PACKET_IN
219 0.102470769 172.31.31.144 -> 172.31.23.72 OpenFlow 187 Type: OFPT_PACKET_OUT
220 0.102476192 172.31.23.72 -> 172.31.31.144 OpenFlow 189 Type: OFPT_PACKET_IN
221 0.102549762 172.31.31.144 -> 172.31.23.72 OpenFlow 187 Type: OFPT_PACKET_OUT
222 0.102603317 172.31.31.144 -> 172.31.23.72 OpenFlow 187 Type: OFPT_PACKET_OUT
223 0.102629233 172.31.31.144 -> 172.31.23.72 OpenFlow 187 Type: OFPT_PACKET_OUT
224 0.102667305 172.31.31.144 -> 172.31.23.72 OpenFlow 187 Type: OFPT_PACKET_OUT
225 0.102729603 172.31.31.144 -> 172.31.23.72 OpenFlow 187 Type: OFPT_PACKET_OUT
226 0.102769305 172.31.31.144 -> 172.31.23.72 OpenFlow 187 Type: OFPT_PACKET_OUT
227 0.102848569 172.31.31.144 -> 172.31.23.72 TCP 66 6633 → 45540 [ACK] Seq=1211 Ack=493 Win=853 Len=0 TSval=1165712 TSecr=29987303
228 0.102855425 172.31.31.144 -> 172.31.23.72 TCP 187 6633 → 45554 [PSH, ACK] Seq=1 Ack=1 Win=853 Len=121 TSval=1165712 TSecr=29986554
229 0.102890864 172.31.31.144 -> 172.31.23.72 TCP 187 6633 → 45554 [PSH, ACK] Seq=122 Ack=1 Win=853 Len=121 TSval=1165712 TSecr=29986554
230 0.102936025 172.31.31.144 -> 172.31.23.72 TCP 187 6633 → 45554 [PSH, ACK] Seq=243 Ack=1 Win=853 Len=121 TSval=1165712 TSecr=29986554
231 0.102986841 172.31.31.144 -> 172.31.23.72 TCP 187 6633 → 45554 [PSH, ACK] Seq=364 Ack=1 Win=853 Len=121 TSval=1165712 TSecr=29986554
232 0.103037396 172.31.31.144 -> 172.31.23.72 TCP 187 6633 → 45554 [PSH, ACK] Seq=485 Ack=1 Win=853 Len=121 TSval=1165712 TSecr=29986554
233 0.103089109 172.31.31.144 -> 172.31.23.72 TCP 187 6633 → 45554 [PSH, ACK] Seq=606 Ack=1 Win=853 Len=121 TSval=1165712 TSecr=29986554
234 0.103110315 172.31.23.72 -> 172.31.31.144 OpenFlow 189 Type: OFPT_PACKET_IN
235 0.103132361 172.31.23.72 -> 172.31.31.144 OpenFlow 681 Type: OFPT_PACKET_IN
236 0.103358014 172.31.31.144 -> 172.31.23.72 TCP 66 6633 → 45526 [ACK] Seq=969 Ack=370 Win=853 Len=0 TSval=1165712 TSecr=29987303
237 0.103364152 172.31.31.144 -> 172.31.23.72 TCP 66 6633 → 45526 [ACK] Seq=969 Ack=985 Win=853 Len=0 TSval=1165712 TSecr=29987303
238 0.103638460 172.31.23.72 -> 172.31.31.144 TCP 66 45554 → 6633 [ACK] Seq=1 Ack=727 Win=213 Len=0 TSval=29987303 TSecr=1165712
239 0.103725748 172.31.23.72 -> 172.31.31.144 OpenFlow 189 Type: OFPT_PACKET_IN
240 0.103752439 172.31.23.72 -> 172.31.31.144 OpenFlow 435 Type: OFPT_PACKET_IN
241 0.103764703 172.31.23.72 -> 172.31.31.144 OpenFlow 189 Type: OFPT_PACKET_IN
242 0.103779420 172.31.23.72 -> 172.31.31.144 OpenFlow 189 Type: OFPT_PACKET_IN
243 0.103802977 172.31.23.72 -> 172.31.31.144 OpenFlow 189 Type: OFPT_PACKET_IN
244 0.103839015 172.31.23.72 -> 172.31.31.144 OpenFlow 189 Type: OFPT_PACKET_IN
245 0.103841077 172.31.23.72 -> 172.31.31.144 OpenFlow 189 Type: OFPT_PACKET_IN
246 0.103933939 172.31.23.72 -> 172.31.31.144 OpenFlow 189 Type: OFPT_PACKET_IN
247 0.103944419 172.31.23.72 -> 172.31.31.144 OpenFlow 189 Type: OFPT_PACKET_IN
248 0.103946646 172.31.23.72 -> 172.31.31.144 OpenFlow 435 Type: OFPT_PACKET_IN
249 0.103948190 172.31.23.72 -> 172.31.31.144 OpenFlow 435 Type: OFPT_PACKET_IN
250 0.103964550 172.31.23.72 -> 172.31.31.144 OpenFlow 189 Type: OFPT_PACKET_IN
251 0.103978483 172.31.23.72 -> 172.31.31.144 OpenFlow 189 Type: OFPT_PACKET_IN
252 0.103996960 172.31.23.72 -> 172.31.31.144 OpenFlow 189 Type: OFPT_PACKET_IN
253 0.104021271 172.31.23.72 -> 172.31.31.144 OpenFlow 189 Type: OFPT_PACKET_IN
254 0.104036823 172.31.23.72 -> 172.31.31.144 OpenFlow 189 Type: OFPT_PACKET_IN
255 0.104051714 172.31.23.72 -> 172.31.31.144 OpenFlow 189 Type: OFPT_PACKET_IN
256 0.104064470 172.31.23.72 -> 172.31.31.144 OpenFlow 189 Type: OFPT_PACKET_IN
257 0.104072571 172.31.31.144 -> 172.31.23.72 TCP 66 6633 → 45550 [ACK] Seq=1 Ack=370 Win=853 Len=0 TSval=1165712 TSecr=29987304
258 0.104090210 172.31.23.72 -> 172.31.31.144 OpenFlow 189 Type: OFPT_PACKET_IN
259 0.104122958 172.31.23.72 -> 172.31.31.144 OpenFlow 189 Type: OFPT_PACKET_IN
260 0.104125411 172.31.23.72 -> 172.31.31.144 OpenFlow 189 Type: OFPT_PACKET_IN
261 0.104137152 172.31.23.72 -> 172.31.31.144 OpenFlow 189 Type: OFPT_PACKET_IN
262 0.104609665 172.31.23.72 -> 172.31.31.144 OpenFlow 435 Type: OFPT_PACKET_IN
263 0.104612639 172.31.23.72 -> 172.31.31.144 OpenFlow 435 Type: OFPT_PACKET_IN
264 0.104614357 172.31.23.72 -> 172.31.31.144 OpenFlow 189 Type: OFPT_PACKET_IN
265 0.104616060 172.31.23.72 -> 172.31.31.144 OpenFlow 435 Type: OFPT_PACKET_IN
266 0.104617634 172.31.23.72 -> 172.31.31.144 OpenFlow 435 Type: OFPT_PACKET_IN
267 0.104740400 172.31.31.144 -> 172.31.23.72 TCP 66 6633 → 45508 [ACK] Seq=1 Ack=370 Win=853 Len=0 TSval=1165712 TSecr=29987304
268 0.104744836 172.31.31.144 -> 172.31.23.72 TCP 66 6633 → 45542 [ACK] Seq=1 Ack=370 Win=853 Len=0 TSval=1165713 TSecr=29987304
269 0.104747018 172.31.31.144 -> 172.31.23.72 TCP 66 6633 → 45520 [ACK] Seq=1 Ack=616 Win=853 Len=0 TSval=1165713 TSecr=29987304
270 0.104748834 172.31.31.144 -> 172.31.23.72 TCP 66 6633 → 45550 [ACK] Seq=1 Ack=493 Win=853 Len=0 TSval=1165713 TSecr=29987304
271 0.104751047 172.31.31.144 -> 172.31.23.72 TCP 66 6633 → 45552 [ACK] Seq=1 Ack=493 Win=853 Len=0 TSval=1165713 TSecr=29987304
272 0.104753269 172.31.31.144 -> 172.31.23.72 TCP 66 6633 → 45546 [ACK] Seq=969 Ack=124 Win=853 Len=0 TSval=1165713 TSecr=29987304
273 0.104755061 172.31.31.144 -> 172.31.23.72 TCP 66 6633 → 45508 [ACK] Seq=1 Ack=493 Win=853 Len=0 TSval=1165713 TSecr=29987304
274 0.104756685 172.31.31.144 -> 172.31.23.72 TCP 66 6633 → 45542 [ACK] Seq=1 Ack=739 Win=853 Len=0 TSval=1165713 TSecr=29987304
275 0.104758093 172.31.31.144 -> 172.31.23.72 TCP 66 6633 → 45520 [ACK] Seq=1 Ack=985 Win=853 Len=0 TSval=1165713 TSecr=29987304
276 0.104759664 172.31.31.144 -> 172.31.23.72 TCP 66 6633 → 45534 [ACK] Seq=727 Ack=124 Win=853 Len=0 TSval=1165713 TSecr=29987304
277 0.104761593 172.31.31.144 -> 172.31.23.72 TCP 66 6633 → 45530 [ACK] Seq=969 Ack=616 Win=853 Len=0 TSval=1165713 TSecr=29987304
278 0.104763693 172.31.31.144 -> 172.31.23.72 TCP 66 6633 → 45514 [ACK] Seq=969 Ack=370 Win=853 Len=0 TSval=1165713 TSecr=29987304
279 0.104772957 172.31.23.72 -> 172.31.31.144 OpenFlow 189 Type: OFPT_PACKET_IN
280 0.104778046 172.31.23.72 -> 172.31.31.144 OpenFlow 189 Type: OFPT_PACKET_IN
281 0.104981204 172.31.23.72 -> 172.31.31.144 OpenFlow 435 Type: OFPT_PACKET_IN
282 0.104983119 172.31.23.72 -> 172.31.31.144 OpenFlow 189 Type: OFPT_PACKET_IN
283 0.104984868 172.31.23.72 -> 172.31.31.144 OpenFlow 189 Type: OFPT_PACKET_IN
284 0.105261084 172.31.31.144 -> 172.31.23.72 TCP 66 6633 → 45518 [ACK] Seq=1211 Ack=370 Win=853 Len=0 TSval=1165713 TSecr=29987304
285 0.105263717 172.31.31.144 -> 172.31.23.72 TCP 66 6633 → 45538 [ACK] Seq=1211 Ack=370 Win=853 Len=0 TSval=1165713 TSecr=29987304
286 0.105265920 172.31.31.144 -> 172.31.23.72 TCP 66 6633 → 45532 [ACK] Seq=969 Ack=616 Win=853 Len=0 TSval=1165713 TSecr=29987304
287 0.105267677 172.31.31.144 -> 172.31.23.72 TCP 66 6633 → 45546 [ACK] Seq=969 Ack=247 Win=853 Len=0 TSval=1165713 TSecr=29987304
288 0.105269398 172.31.31.144 -> 172.31.23.72 TCP 66 6633 → 45524 [ACK] Seq=1211 Ack=862 Win=853 Len=0 TSval=1165713 TSecr=29987304
289 0.105271029 172.31.31.144 -> 172.31.23.72 TCP 66 6633 → 45522 [ACK] Seq=727 Ack=370 Win=853 Len=0 TSval=1165713 TSecr=29987304
290 0.105272868 172.31.31.144 -> 172.31.23.72 TCP 66 6633 → 45534 [ACK] Seq=727 Ack=493 Win=853 Len=0 TSval=1165713 TSecr=29987304
291 0.105274610 172.31.31.144 -> 172.31.23.72 TCP 66 6633 → 45530 [ACK] Seq=969 Ack=985 Win=853 Len=0 TSval=1165713 TSecr=29987304
292 0.105276326 172.31.31.144 -> 172.31.23.72 TCP 66 6633 → 45514 [ACK] Seq=969 Ack=493 Win=853 Len=0 TSval=1165713 TSecr=29987304
293 0.105536364 172.31.31.144 -> 172.31.23.72 TCP 66 6633 → 45528 [ACK] Seq=1211 Ack=985 Win=853 Len=0 TSval=1165713 TSecr=29987304
294 0.105539315 172.31.31.144 -> 172.31.23.72 TCP 66 6633 → 45518 [ACK] Seq=1211 Ack=739 Win=853 Len=0 TSval=1165713 TSecr=29987304
295 0.105541032 172.31.31.144 -> 172.31.23.72 TCP 66 6633 → 45512 [ACK] Seq=1211 Ack=493 Win=853 Len=0 TSval=1165713 TSecr=29987304
296 0.105543203 172.31.31.144 -> 172.31.23.72 TCP 66 6633 → 45538 [ACK] Seq=1211 Ack=493 Win=853 Len=0 TSval=1165713 TSecr=29987304
297 0.105578906 172.31.31.144 -> 172.31.23.72 TCP 66 6633 → 45532 [ACK] Seq=969 Ack=985 Win=853 Len=0 TSval=1165713 TSecr=29987304
298 0.105601032 172.31.31.144 -> 172.31.23.72 TCP 66 6633 → 45524 [ACK] Seq=1211 Ack=985 Win=853 Len=0 TSval=1165713 TSecr=29987304
299 0.105700383 172.31.31.144 -> 172.31.23.72 TCP 66 6633 → 45522 [ACK] Seq=727 Ack=493 Win=853 Len=0 TSval=1165713 TSecr=29987304
300 0.200345924 172.31.31.144 -> 172.31.23.72 OpenFlow 187 Type: OFPT_PACKET_OUT
301 0.200378647 172.31.31.144 -> 172.31.23.72 OpenFlow 187 Type: OFPT_PACKET_OUT
302 0.200401603 172.31.31.144 -> 172.31.23.72 OpenFlow 187 Type: OFPT_PACKET_OUT
303 0.200449433 172.31.31.144 -> 172.31.23.72 OpenFlow 187 Type: OFPT_PACKET_OUT
304 0.200501534 172.31.31.144 -> 172.31.23.72 OpenFlow 187 Type: OFPT_PACKET_OUT
305 0.200550675 172.31.31.144 -> 172.31.23.72 OpenFlow 187 Type: OFPT_PACKET_OUT
306 0.200596908 172.31.31.144 -> 172.31.23.72 OpenFlow 187 Type: OFPT_PACKET_OUT
307 0.200653155 172.31.31.144 -> 172.31.23.72 OpenFlow 187 Type: OFPT_PACKET_OUT
308 0.200747720 172.31.31.144 -> 172.31.23.72 OpenFlow 187 Type: OFPT_PACKET_OUT
309 0.200782594 172.31.31.144 -> 172.31.23.72 OpenFlow 187 Type: OFPT_PACKET_OUT
310 0.200844079 172.31.31.144 -> 172.31.23.72 OpenFlow 187 Type: OFPT_PACKET_OUT
311 0.200874082 172.31.31.144 -> 172.31.23.72 OpenFlow 187 Type: OFPT_PACKET_OUT
312 0.200925138 172.31.31.144 -> 172.31.23.72 OpenFlow 187 Type: OFPT_PACKET_OUT
313 0.200991757 172.31.31.144 -> 172.31.23.72 OpenFlow 187 Type: OFPT_PACKET_OUT
314 0.201041739 172.31.31.144 -> 172.31.23.72 OpenFlow 187 Type: OFPT_PACKET_OUT
315 0.201094394 172.31.31.144 -> 172.31.23.72 OpenFlow 187 Type: OFPT_PACKET_OUT
316 0.201152439 172.31.31.144 -> 172.31.23.72 OpenFlow 187 Type: OFPT_PACKET_OUT
317 0.201194442 172.31.31.144 -> 172.31.23.72 OpenFlow 187 Type: OFPT_PACKET_OUT
318 0.201242018 172.31.31.144 -> 172.31.23.72 OpenFlow 187 Type: OFPT_PACKET_OUT
319 0.201258617 172.31.23.72 -> 172.31.31.144 TCP 66 45552 → 6633 [ACK] Seq=493 Ack=969 Win=213 Len=0 TSval=29987328 TSecr=1165737
320 0.201304104 172.31.31.144 -> 172.31.23.72 OpenFlow 187 Type: OFPT_PACKET_OUT
321 0.201339002 172.31.23.72 -> 172.31.31.144 OpenFlow 189 Type: OFPT_PACKET_IN
322 0.201365848 172.31.31.144 -> 172.31.23.72 OpenFlow 187 Type: OFPT_PACKET_OUT
323 0.201392714 172.31.23.72 -> 172.31.31.144 OpenFlow 189 Type: OFPT_PACKET_IN
324 0.201427510 172.31.31.144 -> 172.31.23.72 OpenFlow 187 Type: OFPT_PACKET_OUT
325 0.201458429 172.31.31.144 -> 172.31.23.72 OpenFlow 187 Type: OFPT_PACKET_OUT
326 0.201464615 172.31.23.72 -> 172.31.31.144 TCP 66 45548 → 6633 [ACK] Seq=493 Ack=122 Win=213 Len=0 TSval=29987328 TSecr=1165737
327 0.201510048 172.31.31.144 -> 172.31.23.72 OpenFlow 187 Type: OFPT_PACKET_OUT
328 0.201515895 172.31.23.72 -> 172.31.31.144 TCP 66 45548 → 6633 [ACK] Seq=493 Ack=243 Win=213 Len=0 TSval=29987328 TSecr=1165737
329 0.201586126 172.31.31.144 -> 172.31.23.72 OpenFlow 187 Type: OFPT_PACKET_OUT
330 0.201596759 172.31.23.72 -> 172.31.31.144 TCP 66 45548 → 6633 [ACK] Seq=493 Ack=364 Win=213 Len=0 TSval=29987328 TSecr=1165737
331 0.201602280 172.31.31.144 -> 172.31.23.72 TCP 66 6633 → 45550 [ACK] Seq=969 Ack=739 Win=853 Len=0 TSval=1165737 TSecr=29987328
332 0.201646626 172.31.31.144 -> 172.31.23.72 OpenFlow 187 Type: OFPT_PACKET_OUT
333 0.201652782 172.31.23.72 -> 172.31.31.144 TCP 66 45548 → 6633 [ACK] Seq=493 Ack=485 Win=213 Len=0 TSval=29987328 TSecr=1165737
334 0.201728055 172.31.31.144 -> 172.31.23.72 OpenFlow 187 Type: OFPT_PACKET_OUT
335 0.201733352 172.31.23.72 -> 172.31.31.144 TCP 66 45548 → 6633 [ACK] Seq=493 Ack=606 Win=213 Len=0 TSval=29987328 TSecr=1165737
336 0.201739130 172.31.31.144 -> 172.31.23.72 OpenFlow 187 Type: OFPT_PACKET_OUT
337 0.201741526 172.31.23.72 -> 172.31.31.144 TCP 66 45548 → 6633 [ACK] Seq=493 Ack=727 Win=213 Len=0 TSval=29987328 TSecr=1165737
338 0.201778038 172.31.31.144 -> 172.31.23.72 OpenFlow 187 Type: OFPT_PACKET_OUT
339 0.201780453 172.31.23.72 -> 172.31.31.144 TCP 66 45548 → 6633 [ACK] Seq=493 Ack=848 Win=213 Len=0 TSval=29987328 TSecr=1165737
340 0.201849147 172.31.31.144 -> 172.31.23.72 OpenFlow 187 Type: OFPT_PACKET_OUT
341 0.201854850 172.31.23.72 -> 172.31.31.144 TCP 66 45548 → 6633 [ACK] Seq=493 Ack=969 Win=213 Len=0 TSval=29987328 TSecr=1165737
342 0.201933133 172.31.31.144 -> 172.31.23.72 OpenFlow 187 Type: OFPT_PACKET_OUT
343 0.201988041 172.31.31.144 -> 172.31.23.72 OpenFlow 187 Type: OFPT_PACKET_OUT
344 0.202036232 172.31.31.144 -> 172.31.23.72 OpenFlow 187 Type: OFPT_PACKET_OUT
345 0.202090137 172.31.31.144 -> 172.31.23.72 OpenFlow 187 Type: OFPT_PACKET_OUT
346 0.202138940 172.31.31.144 -> 172.31.23.72 OpenFlow 187 Type: OFPT_PACKET_OUT
347 0.202203311 172.31.31.144 -> 172.31.23.72 OpenFlow 187 Type: OFPT_PACKET_OUT
348 0.202302333 172.31.31.144 -> 172.31.23.72 OpenFlow 187 Type: OFPT_PACKET_OUT
349 0.202314055 172.31.31.144 -> 172.31.23.72 OpenFlow 187 Type: OFPT_PACKET_OUT
350 0.202366457 172.31.31.144 -> 172.31.23.72 OpenFlow 187 Type: OFPT_PACKET_OUT
351 0.202404140 172.31.31.144 -> 172.31.23.72 OpenFlow 187 Type: OFPT_PACKET_OUT
352 0.202450525 172.31.31.144 -> 172.31.23.72 OpenFlow 187 Type: OFPT_PACKET_OUT
353 0.202503660 172.31.31.144 -> 172.31.23.72 OpenFlow 187 Type: OFPT_PACKET_OUT
354 0.202594638 172.31.31.144 -> 172.31.23.72 OpenFlow 187 Type: OFPT_PACKET_OUT
355 0.202601085 172.31.23.72 -> 172.31.31.144 TCP 66 45508 → 6633 [ACK] Seq=493 Ack=727 Win=213 Len=0 TSval=29987328 TSecr=1165737
356 0.202611184 172.31.31.144 -> 172.31.23.72 OpenFlow 187 Type: OFPT_PACKET_OUT
357 0.202666710 172.31.31.144 -> 172.31.23.72 OpenFlow 187 Type: OFPT_PACKET_OUT
358 0.202685219 172.31.23.72 -> 172.31.31.144 OpenFlow 189 Type: OFPT_PACKET_IN
359 0.202725203 172.31.31.144 -> 172.31.23.72 OpenFlow 187 Type: OFPT_PACKET_OUT
360 0.202731866 172.31.23.72 -> 172.31.31.144 OpenFlow 189 Type: OFPT_PACKET_IN
361 0.202784214 172.31.31.144 -> 172.31.23.72 OpenFlow 187 Type: OFPT_PACKET_OUT
362 0.202824257 172.31.31.144 -> 172.31.23.72 OpenFlow 187 Type: OFPT_PACKET_OUT
363 0.202873977 172.31.31.144 -> 172.31.23.72 OpenFlow 187 Type: OFPT_PACKET_OUT
364 0.202906920 172.31.31.144 -> 172.31.23.72 TCP 66 6633 → 45548 [ACK] Seq=969 Ack=739 Win=853 Len=0 TSval=1165737 TSecr=29987328
365 0.202928521 172.31.31.144 -> 172.31.23.72 OpenFlow 187 Type: OFPT_PACKET_OUT
366 0.202991805 172.31.31.144 -> 172.31.23.72 OpenFlow 187 Type: OFPT_PACKET_OUT
367 0.203040521 172.31.31.144 -> 172.31.23.72 OpenFlow 187 Type: OFPT_PACKET_OUT
368 0.203109910 172.31.31.144 -> 172.31.23.72 OpenFlow 187 Type: OFPT_PACKET_OUT
369 0.203116355 172.31.23.72 -> 172.31.31.144 TCP 66 45516 → 6633 [ACK] Seq=493 Ack=122 Win=213 Len=0 TSval=29987328 TSecr=1165737
370 0.203159732 172.31.31.144 -> 172.31.23.72 OpenFlow 187 Type: OFPT_PACKET_OUT
371 0.203167471 172.31.23.72 -> 172.31.31.144 TCP 66 45516 → 6633 [ACK] Seq=493 Ack=243 Win=213 Len=0 TSval=29987328 TSecr=1165737
372 0.203213389 172.31.31.144 -> 172.31.23.72 OpenFlow 187 Type: OFPT_PACKET_OUT
373 0.203222031 172.31.23.72 -> 172.31.31.144 TCP 66 45516 → 6633 [ACK] Seq=493 Ack=364 Win=213 Len=0 TSval=29987328 TSecr=1165737
374 0.203320281 172.31.31.144 -> 172.31.23.72 OpenFlow 187 Type: OFPT_PACKET_OUT
375 0.203326792 172.31.23.72 -> 172.31.31.144 TCP 66 45516 → 6633 [ACK] Seq=493 Ack=485 Win=213 Len=0 TSval=29987328 TSecr=1165737
376 0.203331854 172.31.31.144 -> 172.31.23.72 OpenFlow 187 Type: OFPT_PACKET_OUT
377 0.203334006 172.31.23.72 -> 172.31.31.144 TCP 66 45516 → 6633 [ACK] Seq=493 Ack=606 Win=213 Len=0 TSval=29987328 TSecr=1165737
378 0.203375184 172.31.31.144 -> 172.31.23.72 OpenFlow 187 Type: OFPT_PACKET_OUT
