  1 0.000000000 172.31.31.144 -> 172.31.23.72 TCP 187 6633 → 45452 [PSH, ACK] Seq=1 Ack=1 Win=853 Len=121 TSval=788156 TSecr=19357850
  2 0.000148263 172.31.31.144 -> 172.31.23.72 TCP 187 6633 → 45452 [PSH, ACK] Seq=122 Ack=1 Win=853 Len=121 TSval=788156 TSecr=19357850
  3 0.000154330 172.31.31.144 -> 172.31.23.72 TCP 187 6633 → 45452 [PSH, ACK] Seq=243 Ack=1 Win=853 Len=121 TSval=788156 TSecr=19357850
  4 0.000258455 172.31.31.144 -> 172.31.23.72 TCP 187 6633 → 45452 [PSH, ACK] Seq=364 Ack=1 Win=853 Len=121 TSval=788156 TSecr=19357850
  5 0.000340449 172.31.23.72 -> 172.31.31.144 TCP 66 45452 → 6633 [ACK] Seq=1 Ack=485 Win=213 Len=0 TSval=19358281 TSecr=788156
  6 0.000417039 172.31.31.144 -> 172.31.23.72 TCP 187 6633 → 45452 [PSH, ACK] Seq=485 Ack=1 Win=853 Len=121 TSval=788156 TSecr=19357850
  7 0.000422346 172.31.31.144 -> 172.31.23.72 TCP 187 6633 → 45452 [PSH, ACK] Seq=606 Ack=1 Win=853 Len=121 TSval=788157 TSecr=19357850
  8 0.000424381 172.31.31.144 -> 172.31.23.72 TCP 187 6633 → 45452 [PSH, ACK] Seq=727 Ack=1 Win=853 Len=121 TSval=788157 TSecr=19357850
  9 0.000484771 172.31.23.72 -> 172.31.31.144 OpenFlow 189 Type: OFPT_PACKET_IN
 10 0.000545716 172.31.23.72 -> 172.31.31.144 OpenFlow 189 Type: OFPT_PACKET_IN
 11 0.000569233 172.31.31.144 -> 172.31.23.72 TCP 187 6633 → 45452 [PSH, ACK] Seq=848 Ack=1 Win=853 Len=121 TSval=788157 TSecr=19357850
 12 0.000573102 172.31.31.144 -> 172.31.23.72 TCP 187 6633 → 45462 [PSH, ACK] Seq=1 Ack=1 Win=853 Len=121 TSval=788157 TSecr=19358001
 13 0.000575967 172.31.31.144 -> 172.31.23.72 TCP 187 6633 → 45462 [PSH, ACK] Seq=122 Ack=1 Win=853 Len=121 TSval=788157 TSecr=19358001
 14 0.000577643 172.31.31.144 -> 172.31.23.72 TCP 187 6633 → 45462 [PSH, ACK] Seq=243 Ack=1 Win=853 Len=121 TSval=788157 TSecr=19358001
 15 0.000579382 172.31.31.144 -> 172.31.23.72 TCP 187 6633 → 45462 [PSH, ACK] Seq=364 Ack=1 Win=853 Len=121 TSval=788157 TSecr=19358001
 16 0.000640954 172.31.23.72 -> 172.31.31.144 OpenFlow 189 Type: OFPT_PACKET_IN
 17 0.000647743 172.31.23.72 -> 172.31.31.144 OpenFlow 189 Type: OFPT_PACKET_IN
 18 0.000705572 172.31.31.144 -> 172.31.23.72 TCP 187 6633 → 45462 [PSH, ACK] Seq=485 Ack=1 Win=853 Len=121 TSval=788157 TSecr=19358001
 19 0.000710077 172.31.31.144 -> 172.31.23.72 TCP 187 6633 → 45462 [PSH, ACK] Seq=606 Ack=1 Win=853 Len=121 TSval=788157 TSecr=19358001
 20 0.000788703 172.31.23.72 -> 172.31.31.144 TCP 66 45452 → 6633 [ACK] Seq=1 Ack=969 Win=213 Len=0 TSval=19358281 TSecr=788156
 21 0.000818439 172.31.31.144 -> 172.31.23.72 TCP 187 6633 → 45436 [PSH, ACK] Seq=1 Ack=1 Win=853 Len=121 TSval=788157 TSecr=19357750
 22 0.000823984 172.31.31.144 -> 172.31.23.72 TCP 66 6633 → 45454 [ACK] Seq=1 Ack=124 Win=853 Len=0 TSval=788157 TSecr=19358281
 23 0.000909488 172.31.31.144 -> 172.31.23.72 TCP 66 6633 → 45450 [ACK] Seq=1 Ack=124 Win=853 Len=0 TSval=788157 TSecr=19358281
 24 0.000916221 172.31.31.144 -> 172.31.23.72 TCP 66 6633 → 45450 [ACK] Seq=1 Ack=247 Win=853 Len=0 TSval=788157 TSecr=19358281
 25 0.000918364 172.31.31.144 -> 172.31.23.72 TCP 187 6633 → 45436 [PSH, ACK] Seq=122 Ack=1 Win=853 Len=121 TSval=788157 TSecr=19357750
 26 0.000942690 172.31.31.144 -> 172.31.23.72 TCP 66 6633 → 45454 [ACK] Seq=1 Ack=247 Win=853 Len=0 TSval=788157 TSecr=19358281
 27 0.000967986 172.31.31.144 -> 172.31.23.72 TCP 187 6633 → 45436 [PSH, ACK] Seq=243 Ack=1 Win=853 Len=121 TSval=788157 TSecr=19357750
 28 0.001080927 172.31.31.144 -> 172.31.23.72 TCP 187 6633 → 45436 [PSH, ACK] Seq=364 Ack=1 Win=853 Len=121 TSval=788157 TSecr=19357750
 29 0.001146063 172.31.31.144 -> 172.31.23.72 TCP 187 6633 → 45436 [PSH, ACK] Seq=485 Ack=1 Win=853 Len=121 TSval=788157 TSecr=19357750
 30 0.001203673 172.31.23.72 -> 172.31.31.144 TCP 66 45462 → 6633 [ACK] Seq=1 Ack=727 Win=213 Len=0 TSval=19358282 TSecr=788157
 31 0.001421314 172.31.23.72 -> 172.31.31.144 TCP 66 45436 → 6633 [ACK] Seq=1 Ack=606 Win=213 Len=0 TSval=19358282 TSecr=788157
 32 0.001500227 172.31.23.72 -> 172.31.31.144 OpenFlow 189 Type: OFPT_PACKET_IN
 33 0.001533305 172.31.23.72 -> 172.31.31.144 OpenFlow 189 Type: OFPT_PACKET_IN
 34 0.001553111 172.31.23.72 -> 172.31.31.144 OpenFlow 189 Type: OFPT_PACKET_IN
 35 0.001559123 172.31.23.72 -> 172.31.31.144 OpenFlow 189 Type: OFPT_PACKET_IN
 36 0.001582995 172.31.23.72 -> 172.31.31.144 OpenFlow 189 Type: OFPT_PACKET_IN
 37 0.001597105 172.31.23.72 -> 172.31.31.144 OpenFlow 435 Type: OFPT_PACKET_IN
 38 0.001631099 172.31.23.72 -> 172.31.31.144 OpenFlow 189 Type: OFPT_PACKET_IN
 39 0.001648310 172.31.23.72 -> 172.31.31.144 OpenFlow 189 Type: OFPT_PACKET_IN
 40 0.001714748 172.31.23.72 -> 172.31.31.144 OpenFlow 189 Type: OFPT_PACKET_IN
 41 0.001829674 172.31.23.72 -> 172.31.31.144 OpenFlow 189 Type: OFPT_PACKET_IN
 42 0.001834450 172.31.23.72 -> 172.31.31.144 OpenFlow 189 Type: OFPT_PACKET_IN
 43 0.002115949 172.31.31.144 -> 172.31.23.72 TCP 66 6633 → 45442 [ACK] Seq=1 Ack=124 Win=853 Len=0 TSval=788157 TSecr=19358282
 44 0.002121727 172.31.31.144 -> 172.31.23.72 TCP 66 6633 → 45438 [ACK] Seq=1 Ack=124 Win=853 Len=0 TSval=788157 TSecr=19358282
 45 0.002124278 172.31.31.144 -> 172.31.23.72 TCP 66 6633 → 45434 [ACK] Seq=1 Ack=124 Win=853 Len=0 TSval=788157 TSecr=19358282
 46 0.002126642 172.31.31.144 -> 172.31.23.72 TCP 66 6633 → 45434 [ACK] Seq=1 Ack=247 Win=853 Len=0 TSval=788157 TSecr=19358282
 47 0.002128754 172.31.31.144 -> 172.31.23.72 TCP 66 6633 → 45432 [ACK] Seq=1 Ack=124 Win=853 Len=0 TSval=788157 TSecr=19358282
 48 0.002130815 172.31.31.144 -> 172.31.23.72 TCP 66 6633 → 45438 [ACK] Seq=1 Ack=493 Win=853 Len=0 TSval=788157 TSecr=19358282
 49 0.002412932 172.31.31.144 -> 172.31.23.72 TCP 66 6633 → 45442 [ACK] Seq=1 Ack=247 Win=853 Len=0 TSval=788157 TSecr=19358282
 50 0.002415130 172.31.31.144 -> 172.31.23.72 TCP 66 6633 → 45448 [ACK] Seq=1 Ack=124 Win=853 Len=0 TSval=788157 TSecr=19358282
 51 0.002417203 172.31.31.144 -> 172.31.23.72 TCP 66 6633 → 45432 [ACK] Seq=1 Ack=247 Win=853 Len=0 TSval=788157 TSecr=19358282
 52 0.002748611 172.31.31.144 -> 172.31.23.72 TCP 66 6633 → 45448 [ACK] Seq=1 Ack=247 Win=853 Len=0 TSval=788157 TSecr=19358282
 53 0.003716447 172.31.31.144 -> 172.31.23.72 TCP 187 6633 → 45436 [PSH, ACK] Seq=606 Ack=1 Win=853 Len=121 TSval=788157 TSecr=19358282
 54 0.003733544 172.31.31.144 -> 172.31.23.72 TCP 187 6633 → 45436 [PSH, ACK] Seq=727 Ack=1 Win=853 Len=121 TSval=788157 TSecr=19358282
 55 0.003863797 172.31.23.72 -> 172.31.31.144 TCP 66 45436 → 6633 [ACK] Seq=1 Ack=848 Win=213 Len=0 TSval=19358282 TSecr=788157
 56 0.003961739 172.31.23.72 -> 172.31.31.144 OpenFlow 189 Type: OFPT_PACKET_IN
 57 0.003982700 172.31.23.72 -> 172.31.31.144 OpenFlow 189 Type: OFPT_PACKET_IN
 58 0.004318399 172.31.31.144 -> 172.31.23.72 TCP 187 6633 → 45436 [PSH, ACK] Seq=848 Ack=1 Win=853 Len=121 TSval=788157 TSecr=19358282
 59 0.004472659 172.31.23.72 -> 172.31.31.144 OpenFlow 189 Type: OFPT_PACKET_IN
 60 0.005131650 172.31.31.144 -> 172.31.23.72 TCP 66 6633 → 45444 [ACK] Seq=1 Ack=124 Win=853 Len=0 TSval=788158 TSecr=19358282
 61 0.005139601 172.31.31.144 -> 172.31.23.72 TCP 66 6633 → 45430 [ACK] Seq=1 Ack=247 Win=853 Len=0 TSval=788158 TSecr=19358282
 62 0.005823475 172.31.31.144 -> 172.31.23.72 TCP 66 6633 → 45444 [ACK] Seq=1 Ack=247 Win=853 Len=0 TSval=788158 TSecr=19358282
 63 0.041046602 172.31.23.72 -> 172.31.31.144 TCP 66 45436 → 6633 [ACK] Seq=1 Ack=969 Win=213 Len=0 TSval=19358292 TSecr=788157
 64 0.102885383 172.31.31.144 -> 172.31.23.72 TCP 187 6633 → 45420 [PSH, ACK] Seq=1 Ack=1 Win=853 Len=121 TSval=788182 TSecr=19357875
 65 0.102904800 172.31.31.144 -> 172.31.23.72 TCP 187 6633 → 45420 [PSH, ACK] Seq=122 Ack=1 Win=853 Len=121 TSval=788182 TSecr=19357875
 66 0.102908165 172.31.31.144 -> 172.31.23.72 TCP 187 6633 → 45420 [PSH, ACK] Seq=243 Ack=1 Win=853 Len=121 TSval=788182 TSecr=19357875
 67 0.102910195 172.31.31.144 -> 172.31.23.72 TCP 187 6633 → 45420 [PSH, ACK] Seq=364 Ack=1 Win=853 Len=121 TSval=788182 TSecr=19357875
 68 0.102911966 172.31.31.144 -> 172.31.23.72 TCP 187 6633 → 45420 [PSH, ACK] Seq=485 Ack=1 Win=853 Len=121 TSval=788182 TSecr=19357875
 69 0.102913422 172.31.31.144 -> 172.31.23.72 TCP 187 6633 → 45420 [PSH, ACK] Seq=606 Ack=1 Win=853 Len=121 TSval=788182 TSecr=19357875
 70 0.102914833 172.31.31.144 -> 172.31.23.72 TCP 187 6633 → 45420 [PSH, ACK] Seq=727 Ack=1 Win=853 Len=121 TSval=788182 TSecr=19357875
 71 0.102916175 172.31.31.144 -> 172.31.23.72 TCP 187 6633 → 45420 [PSH, ACK] Seq=848 Ack=1 Win=853 Len=121 TSval=788182 TSecr=19357875
 72 0.102918097 172.31.31.144 -> 172.31.23.72 TCP 187 6633 → 45424 [PSH, ACK] Seq=1 Ack=1 Win=853 Len=121 TSval=788182 TSecr=19357676
 73 0.102922949 172.31.31.144 -> 172.31.23.72 TCP 187 6633 → 45424 [PSH, ACK] Seq=122 Ack=1 Win=853 Len=121 TSval=788182 TSecr=19357676
 74 0.102924481 172.31.31.144 -> 172.31.23.72 TCP 187 6633 → 45424 [PSH, ACK] Seq=243 Ack=1 Win=853 Len=121 TSval=788182 TSecr=19357676
 75 0.103308247 172.31.23.72 -> 172.31.31.144 TCP 66 45420 → 6633 [ACK] Seq=1 Ack=969 Win=213 Len=0 TSval=19358307 TSecr=788182
 76 0.103467983 172.31.23.72 -> 172.31.31.144 TCP 66 45424 → 6633 [ACK] Seq=1 Ack=364 Win=213 Len=0 TSval=19358307 TSecr=788182
 77 0.103536182 172.31.23.72 -> 172.31.31.144 OpenFlow 189 Type: OFPT_PACKET_IN
 78 0.103575669 172.31.31.144 -> 172.31.23.72 TCP 187 6633 → 45424 [PSH, ACK] Seq=364 Ack=1 Win=853 Len=121 TSval=788182 TSecr=19357676
 79 0.103580683 172.31.31.144 -> 172.31.23.72 TCP 187 6633 → 45424 [PSH, ACK] Seq=485 Ack=1 Win=853 Len=121 TSval=788182 TSecr=19357676
 80 0.103582860 172.31.31.144 -> 172.31.23.72 TCP 187 6633 → 45424 [PSH, ACK] Seq=606 Ack=1 Win=853 Len=121 TSval=788182 TSecr=19357676
 81 0.103584712 172.31.31.144 -> 172.31.23.72 TCP 187 6633 → 45424 [PSH, ACK] Seq=727 Ack=1 Win=853 Len=121 TSval=788182 TSecr=19357676
 82 0.103586609 172.31.31.144 -> 172.31.23.72 TCP 187 6633 → 45424 [PSH, ACK] Seq=848 Ack=1 Win=853 Len=121 TSval=788182 TSecr=19357676
 83 0.103587936 172.31.31.144 -> 172.31.23.72 TCP 187 6633 → 45424 [PSH, ACK] Seq=969 Ack=1 Win=853 Len=121 TSval=788182 TSecr=19357676
 84 0.103589542 172.31.31.144 -> 172.31.23.72 TCP 187 6633 → 45424 [PSH, ACK] Seq=1090 Ack=1 Win=853 Len=121 TSval=788182 TSecr=19357676
 85 0.103590943 172.31.31.144 -> 172.31.23.72 OpenFlow 187 Type: OFPT_PACKET_OUT
 86 0.103593260 172.31.31.144 -> 172.31.23.72 OpenFlow 187 Type: OFPT_PACKET_OUT
 87 0.103594680 172.31.31.144 -> 172.31.23.72 OpenFlow 187 Type: OFPT_PACKET_OUT
 88 0.103596231 172.31.31.144 -> 172.31.23.72 OpenFlow 187 Type: OFPT_PACKET_OUT
 89 0.103601141 172.31.31.144 -> 172.31.23.72 OpenFlow 187 Type: OFPT_PACKET_OUT
 90 0.103602604 172.31.31.144 -> 172.31.23.72 OpenFlow 187 Type: OFPT_PACKET_OUT
 91 0.103621501 172.31.23.72 -> 172.31.31.144 OpenFlow 189 Type: OFPT_PACKET_IN
 92 0.103627707 172.31.23.72 -> 172.31.31.144 OpenFlow 189 Type: OFPT_PACKET_IN
 93 0.103649725 172.31.31.144 -> 172.31.23.72 OpenFlow 187 Type: OFPT_PACKET_OUT
 94 0.103682279 172.31.23.72 -> 172.31.31.144 OpenFlow 189 Type: OFPT_PACKET_IN
 95 0.103712826 172.31.23.72 -> 172.31.31.144 OpenFlow 189 Type: OFPT_PACKET_IN
 96 0.103726550 172.31.23.72 -> 172.31.31.144 OpenFlow 189 Type: OFPT_PACKET_IN
 97 0.104076158 172.31.23.72 -> 172.31.31.144 TCP 66 45434 → 6633 [ACK] Seq=247 Ack=848 Win=213 Len=0 TSval=19358307 TSecr=788182
 98 0.104080447 172.31.23.72 -> 172.31.31.144 OpenFlow 189 Type: OFPT_PACKET_IN
 99 0.104139595 172.31.23.72 -> 172.31.31.144 OpenFlow 189 Type: OFPT_PACKET_IN
100 0.104294617 172.31.31.144 -> 172.31.23.72 OpenFlow 187 Type: OFPT_PACKET_OUT
101 0.104299869 172.31.31.144 -> 172.31.23.72 OpenFlow 187 Type: OFPT_PACKET_OUT
102 0.104301720 172.31.31.144 -> 172.31.23.72 OpenFlow 187 Type: OFPT_PACKET_OUT
103 0.104303387 172.31.31.144 -> 172.31.23.72 OpenFlow 187 Type: OFPT_PACKET_OUT
104 0.104307747 172.31.31.144 -> 172.31.23.72 OpenFlow 187 Type: OFPT_PACKET_OUT
105 0.104310003 172.31.31.144 -> 172.31.23.72 OpenFlow 187 Type: OFPT_PACKET_OUT
106 0.104311495 172.31.31.144 -> 172.31.23.72 OpenFlow 187 Type: OFPT_PACKET_OUT
107 0.104313210 172.31.31.144 -> 172.31.23.72 OpenFlow 187 Type: OFPT_PACKET_OUT
108 0.104314884 172.31.31.144 -> 172.31.23.72 OpenFlow 187 Type: OFPT_PACKET_OUT
109 0.104316025 172.31.31.144 -> 172.31.23.72 OpenFlow 187 Type: OFPT_PACKET_OUT
110 0.104318071 172.31.31.144 -> 172.31.23.72 OpenFlow 187 Type: OFPT_PACKET_OUT
111 0.104319815 172.31.31.144 -> 172.31.23.72 OpenFlow 187 Type: OFPT_PACKET_OUT
112 0.104363454 172.31.23.72 -> 172.31.31.144 OpenFlow 189 Type: OFPT_PACKET_IN
113 0.104370700 172.31.23.72 -> 172.31.31.144 OpenFlow 189 Type: OFPT_PACKET_IN
114 0.104503466 172.31.23.72 -> 172.31.31.144 OpenFlow 189 Type: OFPT_PACKET_IN
115 0.104771149 172.31.23.72 -> 172.31.31.144 TCP 66 45418 → 6633 [ACK] Seq=247 Ack=1090 Win=213 Len=0 TSval=19358307 TSecr=788182
116 0.104847834 172.31.23.72 -> 172.31.31.144 OpenFlow 189 Type: OFPT_PACKET_IN
117 0.104871054 172.31.23.72 -> 172.31.31.144 OpenFlow 189 Type: OFPT_PACKET_IN
118 0.104906024 172.31.23.72 -> 172.31.31.144 OpenFlow 189 Type: OFPT_PACKET_IN
119 0.104924884 172.31.23.72 -> 172.31.31.144 OpenFlow 189 Type: OFPT_PACKET_IN
120 0.104935084 172.31.23.72 -> 172.31.31.144 OpenFlow 189 Type: OFPT_PACKET_IN
121 0.104944347 172.31.23.72 -> 172.31.31.144 OpenFlow 189 Type: OFPT_PACKET_IN
122 0.105055633 172.31.23.72 -> 172.31.31.144 OpenFlow 189 Type: OFPT_PACKET_IN
123 0.105070008 172.31.23.72 -> 172.31.31.144 OpenFlow 189 Type: OFPT_PACKET_IN
124 0.105081617 172.31.31.144 -> 172.31.23.72 OpenFlow 187 Type: OFPT_PACKET_OUT
125 0.105085364 172.31.31.144 -> 172.31.23.72 OpenFlow 187 Type: OFPT_PACKET_OUT
126 0.105087836 172.31.31.144 -> 172.31.23.72 OpenFlow 187 Type: OFPT_PACKET_OUT
127 0.105090262 172.31.31.144 -> 172.31.23.72 OpenFlow 187 Type: OFPT_PACKET_OUT
128 0.105091750 172.31.31.144 -> 172.31.23.72 OpenFlow 187 Type: OFPT_PACKET_OUT
129 0.105093364 172.31.31.144 -> 172.31.23.72 OpenFlow 187 Type: OFPT_PACKET_OUT
130 0.105094582 172.31.31.144 -> 172.31.23.72 OpenFlow 187 Type: OFPT_PACKET_OUT
131 0.105110787 172.31.23.72 -> 172.31.31.144 OpenFlow 189 Type: OFPT_PACKET_IN
132 0.105214748 172.31.23.72 -> 172.31.31.144 OpenFlow 435 Type: OFPT_PACKET_IN
133 0.105218060 172.31.23.72 -> 172.31.31.144 OpenFlow 435 Type: OFPT_PACKET_IN
134 0.105312692 172.31.31.144 -> 172.31.23.72 OpenFlow 187 Type: OFPT_PACKET_OUT
135 0.105330085 172.31.23.72 -> 172.31.31.144 OpenFlow 189 Type: OFPT_PACKET_IN
136 0.105337101 172.31.23.72 -> 172.31.31.144 OpenFlow 189 Type: OFPT_PACKET_IN
137 0.105338947 172.31.23.72 -> 172.31.31.144 OpenFlow 189 Type: OFPT_PACKET_IN
138 0.105609700 172.31.23.72 -> 172.31.31.144 TCP 66 45444 → 6633 [ACK] Seq=247 Ack=848 Win=213 Len=0 TSval=19358308 TSecr=788182
139 0.105613585 172.31.23.72 -> 172.31.31.144 OpenFlow 189 Type: OFPT_PACKET_IN
140 0.105676874 172.31.23.72 -> 172.31.31.144 OpenFlow 189 Type: OFPT_PACKET_IN
141 0.105705938 172.31.23.72 -> 172.31.31.144 OpenFlow 189 Type: OFPT_PACKET_IN
142 0.105739538 172.31.23.72 -> 172.31.31.144 OpenFlow 189 Type: OFPT_PACKET_IN
143 0.105753327 172.31.23.72 -> 172.31.31.144 OpenFlow 189 Type: OFPT_PACKET_IN
144 0.105766518 172.31.23.72 -> 172.31.31.144 OpenFlow 189 Type: OFPT_PACKET_IN
145 0.106328319 172.31.31.144 -> 172.31.23.72 TCP 66 6633 → 45442 [ACK] Seq=1 Ack=370 Win=853 Len=0 TSval=788183 TSecr=19358307
146 0.106337448 172.31.23.72 -> 172.31.31.144 OpenFlow 312 Type: OFPT_PACKET_IN
147 0.106343384 172.31.31.144 -> 172.31.23.72 OpenFlow 187 Type: OFPT_PACKET_OUT
148 0.106347812 172.31.31.144 -> 172.31.23.72 OpenFlow 187 Type: OFPT_PACKET_OUT
149 0.106349963 172.31.31.144 -> 172.31.23.72 OpenFlow 187 Type: OFPT_PACKET_OUT
150 0.106351516 172.31.31.144 -> 172.31.23.72 OpenFlow 187 Type: OFPT_PACKET_OUT
151 0.106353772 172.31.31.144 -> 172.31.23.72 OpenFlow 187 Type: OFPT_PACKET_OUT
152 0.106355711 172.31.31.144 -> 172.31.23.72 OpenFlow 187 Type: OFPT_PACKET_OUT
153 0.106357219 172.31.31.144 -> 172.31.23.72 OpenFlow 187 Type: OFPT_PACKET_OUT
154 0.106358896 172.31.31.144 -> 172.31.23.72 OpenFlow 187 Type: OFPT_PACKET_OUT
155 0.106360462 172.31.31.144 -> 172.31.23.72 OpenFlow 187 Type: OFPT_PACKET_OUT
156 0.106361993 172.31.31.144 -> 172.31.23.72 OpenFlow 187 Type: OFPT_PACKET_OUT
157 0.106363499 172.31.31.144 -> 172.31.23.72 OpenFlow 187 Type: OFPT_PACKET_OUT
158 0.106364951 172.31.31.144 -> 172.31.23.72 TCP 66 6633 → 45418 [ACK] Seq=1211 Ack=124 Win=853 Len=0 TSval=788182 TSecr=19358307
159 0.106366996 172.31.31.144 -> 172.31.23.72 OpenFlow 187 Type: OFPT_PACKET_OUT
160 0.106369693 172.31.23.72 -> 172.31.31.144 OpenFlow 189 Type: OFPT_PACKET_IN
161 0.106371587 172.31.31.144 -> 172.31.23.72 OpenFlow 187 Type: OFPT_PACKET_OUT
162 0.106373656 172.31.31.144 -> 172.31.23.72 TCP 66 6633 → 45418 [ACK] Seq=1211 Ack=247 Win=853 Len=0 TSval=788182 TSecr=19358307
163 0.106375705 172.31.31.144 -> 172.31.23.72 OpenFlow 187 Type: OFPT_PACKET_OUT
164 0.106377188 172.31.31.144 -> 172.31.23.72 TCP 66 6633 → 45428 [ACK] Seq=1 Ack=124 Win=853 Len=0 TSval=788182 TSecr=19358307
165 0.106380513 172.31.31.144 -> 172.31.23.72 OpenFlow 187 Type: OFPT_PACKET_OUT
166 0.106382412 172.31.31.144 -> 172.31.23.72 OpenFlow 187 Type: OFPT_PACKET_OUT
167 0.106384137 172.31.31.144 -> 172.31.23.72 OpenFlow 187 Type: OFPT_PACKET_OUT
168 0.106385763 172.31.31.144 -> 172.31.23.72 OpenFlow 187 Type: OFPT_PACKET_OUT
169 0.106387970 172.31.31.144 -> 172.31.23.72 OpenFlow 187 Type: OFPT_PACKET_OUT
170 0.106390120 172.31.31.144 -> 172.31.23.72 OpenFlow 187 Type: OFPT_PACKET_OUT
171 0.106392062 172.31.31.144 -> 172.31.23.72 OpenFlow 187 Type: OFPT_PACKET_OUT
172 0.106393626 172.31.31.144 -> 172.31.23.72 TCP 66 6633 → 45414 [ACK] Seq=1 Ack=124 Win=853 Len=0 TSval=788183 TSecr=19358307
173 0.106395700 172.31.31.144 -> 172.31.23.72 OpenFlow 187 Type: OFPT_PACKET_OUT
174 0.106397642 172.31.31.144 -> 172.31.23.72 TCP 66 6633 → 45428 [ACK] Seq=1 Ack=247 Win=853 Len=0 TSval=788183 TSecr=19358307
175 0.106399669 172.31.31.144 -> 172.31.23.72 OpenFlow 187 Type: OFPT_PACKET_OUT
176 0.106401273 172.31.31.144 -> 172.31.23.72 TCP 66 6633 → 45424 [ACK] Seq=1211 Ack=124 Win=853 Len=0 TSval=788183 TSecr=19358307
177 0.106403237 172.31.31.144 -> 172.31.23.72 OpenFlow 187 Type: OFPT_PACKET_OUT
178 0.106405074 172.31.31.144 -> 172.31.23.72 OpenFlow 187 Type: OFPT_PACKET_OUT
179 0.106406661 172.31.31.144 -> 172.31.23.72 TCP 66 6633 → 45422 [ACK] Seq=1 Ack=247 Win=853 Len=0 TSval=788183 TSecr=19358307
180 0.106409052 172.31.31.144 -> 172.31.23.72 OpenFlow 187 Type: OFPT_PACKET_OUT
181 0.106410710 172.31.31.144 -> 172.31.23.72 TCP 66 6633 → 45426 [ACK] Seq=1 Ack=247 Win=853 Len=0 TSval=788183 TSecr=19358307
182 0.106413297 172.31.31.144 -> 172.31.23.72 OpenFlow 187 Type: OFPT_PACKET_OUT
183 0.106414607 172.31.31.144 -> 172.31.23.72 OpenFlow 187 Type: OFPT_PACKET_OUT
184 0.106415963 172.31.31.144 -> 172.31.23.72 OpenFlow 187 Type: OFPT_PACKET_OUT
185 0.106417493 172.31.31.144 -> 172.31.23.72 OpenFlow 187 Type: OFPT_PACKET_OUT
186 0.106419130 172.31.31.144 -> 172.31.23.72 OpenFlow 187 Type: OFPT_PACKET_OUT
187 0.106439492 172.31.23.72 -> 172.31.31.144 OpenFlow 312 Type: OFPT_PACKET_IN
188 0.106507236 172.31.23.72 -> 172.31.31.144 OpenFlow 189 Type: OFPT_PACKET_IN
189 0.106553057 172.31.31.144 -> 172.31.23.72 TCP 66 6633 → 45424 [ACK] Seq=1211 Ack=247 Win=853 Len=0 TSval=788183 TSecr=19358307
190 0.106558819 172.31.31.144 -> 172.31.23.72 OpenFlow 187 Type: OFPT_PACKET_OUT
191 0.106561242 172.31.31.144 -> 172.31.23.72 OpenFlow 187 Type: OFPT_PACKET_OUT
192 0.106563429 172.31.31.144 -> 172.31.23.72 TCP 66 6633 → 45416 [ACK] Seq=1 Ack=124 Win=853 Len=0 TSval=788183 TSecr=19358307
193 0.106566230 172.31.31.144 -> 172.31.23.72 TCP 66 6633 → 45414 [ACK] Seq=1 Ack=247 Win=853 Len=0 TSval=788183 TSecr=19358307
194 0.106568776 172.31.31.144 -> 172.31.23.72 TCP 66 6633 → 45436 [ACK] Seq=969 Ack=124 Win=853 Len=0 TSval=788183 TSecr=19358308
195 0.106570968 172.31.31.144 -> 172.31.23.72 OpenFlow 187 Type: OFPT_PACKET_OUT
196 0.106572525 172.31.31.144 -> 172.31.23.72 TCP 66 6633 → 45434 [ACK] Seq=1211 Ack=370 Win=853 Len=0 TSval=788183 TSecr=19358308
197 0.106574727 172.31.31.144 -> 172.31.23.72 OpenFlow 187 Type: OFPT_PACKET_OUT
198 0.106576927 172.31.31.144 -> 172.31.23.72 TCP 66 6633 → 45430 [ACK] Seq=1211 Ack=739 Win=853 Len=0 TSval=788183 TSecr=19358307
199 0.106665722 172.31.23.72 -> 172.31.31.144 TCP 66 45444 → 6633 [ACK] Seq=247 Ack=1211 Win=213 Len=0 TSval=19358308 TSecr=788182
200 0.106999148 172.31.23.72 -> 172.31.31.144 TCP 66 45438 → 6633 [ACK] Seq=493 Ack=969 Win=213 Len=0 TSval=19358308 TSecr=788182
201 0.107143264 172.31.31.144 -> 172.31.23.72 OpenFlow 187 Type: OFPT_PACKET_OUT
202 0.107148733 172.31.31.144 -> 172.31.23.72 OpenFlow 671 Type: OFPT_PACKET_OUT
203 0.107151182 172.31.31.144 -> 172.31.23.72 TCP 66 6633 → 45442 [ACK] Seq=1 Ack=493 Win=853 Len=0 TSval=788183 TSecr=19358308
204 0.107153944 172.31.31.144 -> 172.31.23.72 TCP 66 6633 → 45436 [ACK] Seq=969 Ack=247 Win=853 Len=0 TSval=788183 TSecr=19358308
205 0.107155953 172.31.31.144 -> 172.31.23.72 TCP 66 6633 → 45422 [ACK] Seq=1 Ack=493 Win=853 Len=0 TSval=788183 TSecr=19358307
206 0.107158075 172.31.31.144 -> 172.31.23.72 TCP 66 6633 → 45420 [ACK] Seq=969 Ack=247 Win=853 Len=0 TSval=788183 TSecr=19358308
207 0.107163003 172.31.31.144 -> 172.31.23.72 TCP 66 6633 → 45434 [ACK] Seq=1211 Ack=493 Win=853 Len=0 TSval=788183 TSecr=19358308
208 0.107165000 172.31.31.144 -> 172.31.23.72 TCP 66 6633 → 45446 [ACK] Seq=1 Ack=124 Win=853 Len=0 TSval=788183 TSecr=19358308
209 0.107167746 172.31.31.144 -> 172.31.23.72 TCP 66 6633 → 45442 [ACK] Seq=1 Ack=739 Win=853 Len=0 TSval=788183 TSecr=19358308
210 0.107169183 172.31.31.144 -> 172.31.23.72 TCP 66 6633 → 45454 [ACK] Seq=1 Ack=370 Win=853 Len=0 TSval=788183 TSecr=19358308
211 0.107171116 172.31.31.144 -> 172.31.23.72 TCP 66 6633 → 45450 [ACK] Seq=727 Ack=370 Win=853 Len=0 TSval=788183 TSecr=19358308
212 0.107172663 172.31.31.144 -> 172.31.23.72 TCP 66 6633 → 45426 [ACK] Seq=1 Ack=493 Win=853 Len=0 TSval=788183 TSecr=19358307
213 0.107174785 172.31.31.144 -> 172.31.23.72 TCP 66 6633 → 45436 [ACK] Seq=969 Ack=493 Win=853 Len=0 TSval=788183 TSecr=19358308
214 0.107176442 172.31.31.144 -> 172.31.23.72 TCP 66 6633 → 45450 [ACK] Seq=727 Ack=493 Win=853 Len=0 TSval=788183 TSecr=19358308
215 0.107177624 172.31.31.144 -> 172.31.23.72 TCP 66 6633 → 45446 [ACK] Seq=1 Ack=247 Win=853 Len=0 TSval=788183 TSecr=19358308
216 0.107250790 172.31.23.72 -> 172.31.31.144 TCP 66 45450 → 6633 [ACK] Seq=493 Ack=727 Win=213 Len=0 TSval=19358308 TSecr=788182
217 0.107649899 172.31.23.72 -> 172.31.31.144 TCP 66 45430 → 6633 [ACK] Seq=739 Ack=1211 Win=213 Len=0 TSval=19358308 TSecr=788183
218 0.107889790 172.31.23.72 -> 172.31.31.144 TCP 66 45428 → 6633 [ACK] Seq=247 Ack=727 Win=213 Len=0 TSval=19358308 TSecr=788183
219 0.108144327 172.31.23.72 -> 172.31.31.144 TCP 66 45416 → 6633 [ACK] Seq=493 Ack=969 Win=213 Len=0 TSval=19358308 TSecr=788183
220 0.108199798 172.31.23.72 -> 172.31.31.144 OpenFlow 189 Type: OFPT_PACKET_IN
221 0.108226808 172.31.23.72 -> 172.31.31.144 OpenFlow 189 Type: OFPT_PACKET_IN
222 0.108253698 172.31.23.72 -> 172.31.31.144 OpenFlow 189 Type: OFPT_PACKET_IN
223 0.108269468 172.31.23.72 -> 172.31.31.144 OpenFlow 189 Type: OFPT_PACKET_IN
224 0.108284919 172.31.23.72 -> 172.31.31.144 OpenFlow 189 Type: OFPT_PACKET_IN
225 0.108305535 172.31.23.72 -> 172.31.31.144 OpenFlow 189 Type: OFPT_PACKET_IN
226 0.108395641 172.31.23.72 -> 172.31.31.144 OpenFlow 189 Type: OFPT_PACKET_IN
227 0.108398908 172.31.23.72 -> 172.31.31.144 OpenFlow 189 Type: OFPT_PACKET_IN
228 0.108415749 172.31.23.72 -> 172.31.31.144 OpenFlow 189 Type: OFPT_PACKET_IN
229 0.108417969 172.31.23.72 -> 172.31.31.144 OpenFlow 681 Type: OFPT_PACKET_IN
230 0.108430326 172.31.23.72 -> 172.31.31.144 OpenFlow 189 Type: OFPT_PACKET_IN
231 0.108444451 172.31.23.72 -> 172.31.31.144 OpenFlow 189 Type: OFPT_PACKET_IN
232 0.108455364 172.31.23.72 -> 172.31.31.144 OpenFlow 189 Type: OFPT_PACKET_IN
233 0.108469784 172.31.23.72 -> 172.31.31.144 OpenFlow 189 Type: OFPT_PACKET_IN
234 0.108483900 172.31.23.72 -> 172.31.31.144 OpenFlow 189 Type: OFPT_PACKET_IN
235 0.109527913 172.31.31.144 -> 172.31.23.72 TCP 66 6633 → 45446 [ACK] Seq=1 Ack=370 Win=853 Len=0 TSval=788184 TSecr=19358308
236 0.109535497 172.31.31.144 -> 172.31.23.72 TCP 66 6633 → 45432 [ACK] Seq=1 Ack=370 Win=853 Len=0 TSval=788184 TSecr=19358308
237 0.109537855 172.31.31.144 -> 172.31.23.72 TCP 66 6633 → 45414 [ACK] Seq=1 Ack=370 Win=853 Len=0 TSval=788184 TSecr=19358308
238 0.109541871 172.31.23.72 -> 172.31.31.144 OpenFlow 189 Type: OFPT_PACKET_IN
239 0.109547442 172.31.31.144 -> 172.31.23.72 TCP 66 6633 → 45454 [ACK] Seq=1 Ack=493 Win=853 Len=0 TSval=788184 TSecr=19358308
240 0.109552373 172.31.23.72 -> 172.31.31.144 OpenFlow 435 Type: OFPT_PACKET_IN
241 0.109554587 172.31.23.72 -> 172.31.31.144 OpenFlow 189 Type: OFPT_PACKET_IN
242 0.109556923 172.31.23.72 -> 172.31.31.144 OpenFlow 189 Type: OFPT_PACKET_IN
243 0.109694672 172.31.23.72 -> 172.31.31.144 OpenFlow 189 Type: OFPT_PACKET_IN
244 0.109696314 172.31.23.72 -> 172.31.31.144 OpenFlow 435 Type: OFPT_PACKET_IN
245 0.109698062 172.31.23.72 -> 172.31.31.144 OpenFlow 189 Type: OFPT_PACKET_IN
246 0.109699709 172.31.23.72 -> 172.31.31.144 OpenFlow 435 Type: OFPT_PACKET_IN
247 0.109701085 172.31.23.72 -> 172.31.31.144 OpenFlow 435 Type: OFPT_PACKET_IN
248 0.109788153 172.31.31.144 -> 172.31.23.72 TCP 66 6633 → 45452 [ACK] Seq=969 Ack=124 Win=853 Len=0 TSval=788184 TSecr=19358308
249 0.109790749 172.31.31.144 -> 172.31.23.72 TCP 66 6633 → 45446 [ACK] Seq=1 Ack=493 Win=853 Len=0 TSval=788184 TSecr=19358308
250 0.109792611 172.31.31.144 -> 172.31.23.72 TCP 66 6633 → 45462 [ACK] Seq=727 Ack=124 Win=853 Len=0 TSval=788184 TSecr=19358308
251 0.109796483 172.31.23.72 -> 172.31.31.144 OpenFlow 189 Type: OFPT_PACKET_IN
252 0.111705992 172.31.31.144 -> 172.31.23.72 TCP 66 6633 → 45432 [ACK] Seq=1 Ack=985 Win=853 Len=0 TSval=788184 TSecr=19358308
253 0.111708429 172.31.31.144 -> 172.31.23.72 TCP 66 6633 → 45436 [ACK] Seq=969 Ack=616 Win=853 Len=0 TSval=788184 TSecr=19358308
254 0.111710324 172.31.31.144 -> 172.31.23.72 TCP 66 6633 → 45424 [ACK] Seq=1211 Ack=370 Win=853 Len=0 TSval=788184 TSecr=19358308
255 0.111712018 172.31.31.144 -> 172.31.23.72 TCP 66 6633 → 45418 [ACK] Seq=1211 Ack=370 Win=853 Len=0 TSval=788184 TSecr=19358308
256 0.111714047 172.31.31.144 -> 172.31.23.72 TCP 66 6633 → 45434 [ACK] Seq=1211 Ack=616 Win=853 Len=0 TSval=788184 TSecr=19358308
257 0.111715868 172.31.31.144 -> 172.31.23.72 TCP 66 6633 → 45414 [ACK] Seq=1 Ack=493 Win=853 Len=0 TSval=788184 TSecr=19358309
258 0.111717680 172.31.31.144 -> 172.31.23.72 TCP 66 6633 → 45426 [ACK] Seq=1 Ack=985 Win=853 Len=0 TSval=788184 TSecr=19358308
259 0.111719549 172.31.31.144 -> 172.31.23.72 TCP 66 6633 → 45452 [ACK] Seq=969 Ack=247 Win=853 Len=0 TSval=788184 TSecr=19358309
260 0.111721317 172.31.31.144 -> 172.31.23.72 TCP 66 6633 → 45456 [ACK] Seq=1 Ack=247 Win=853 Len=0 TSval=788184 TSecr=19358308
261 0.111723374 172.31.31.144 -> 172.31.23.72 TCP 66 6633 → 45462 [ACK] Seq=727 Ack=247 Win=853 Len=0 TSval=788184 TSecr=19358309
262 0.111725090 172.31.31.144 -> 172.31.23.72 TCP 66 6633 → 45436 [ACK] Seq=969 Ack=985 Win=853 Len=0 TSval=788184 TSecr=19358309
263 0.111726600 172.31.31.144 -> 172.31.23.72 TCP 66 6633 → 45420 [ACK] Seq=969 Ack=493 Win=853 Len=0 TSval=788184 TSecr=19358308
264 0.111728403 172.31.31.144 -> 172.31.23.72 TCP 66 6633 → 45434 [ACK] Seq=1211 Ack=985 Win=853 Len=0 TSval=788184 TSecr=19358309
265 0.111730102 172.31.31.144 -> 172.31.23.72 TCP 66 6633 → 45424 [ACK] Seq=1211 Ack=739 Win=853 Len=0 TSval=788184 TSecr=19358309
266 0.111731620 172.31.31.144 -> 172.31.23.72 TCP 66 6633 → 45418 [ACK] Seq=1211 Ack=493 Win=853 Len=0 TSval=788184 TSecr=19358309
267 0.199437081 172.31.31.144 -> 172.31.23.72 OpenFlow 187 Type: OFPT_PACKET_OUT
268 0.199466221 172.31.31.144 -> 172.31.23.72 OpenFlow 187 Type: OFPT_PACKET_OUT
269 0.199478148 172.31.31.144 -> 172.31.23.72 OpenFlow 187 Type: OFPT_PACKET_OUT
270 0.199547739 172.31.31.144 -> 172.31.23.72 OpenFlow 187 Type: OFPT_PACKET_OUT
271 0.199605319 172.31.31.144 -> 172.31.23.72 OpenFlow 187 Type: OFPT_PACKET_OUT
272 0.199684024 172.31.31.144 -> 172.31.23.72 OpenFlow 187 Type: OFPT_PACKET_OUT
273 0.199731240 172.31.31.144 -> 172.31.23.72 OpenFlow 187 Type: OFPT_PACKET_OUT
274 0.199798918 172.31.31.144 -> 172.31.23.72 OpenFlow 187 Type: OFPT_PACKET_OUT
275 0.199850084 172.31.31.144 -> 172.31.23.72 OpenFlow 187 Type: OFPT_PACKET_OUT
276 0.199901216 172.31.31.144 -> 172.31.23.72 OpenFlow 187 Type: OFPT_PACKET_OUT
277 0.200035942 172.31.31.144 -> 172.31.23.72 OpenFlow 187 Type: OFPT_PACKET_OUT
278 0.200084896 172.31.31.144 -> 172.31.23.72 OpenFlow 187 Type: OFPT_PACKET_OUT
279 0.200135579 172.31.31.144 -> 172.31.23.72 OpenFlow 187 Type: OFPT_PACKET_OUT
280 0.200191566 172.31.31.144 -> 172.31.23.72 OpenFlow 187 Type: OFPT_PACKET_OUT
281 0.200198033 172.31.23.72 -> 172.31.31.144 TCP 66 45446 → 6633 [ACK] Seq=493 Ack=1211 Win=213 Len=0 TSval=19358331 TSecr=788206
282 0.200247755 172.31.31.144 -> 172.31.23.72 OpenFlow 187 Type: OFPT_PACKET_OUT
283 0.200308987 172.31.31.144 -> 172.31.23.72 OpenFlow 187 Type: OFPT_PACKET_OUT
284 0.200362663 172.31.31.144 -> 172.31.23.72 OpenFlow 187 Type: OFPT_PACKET_OUT
285 0.200422800 172.31.31.144 -> 172.31.23.72 OpenFlow 187 Type: OFPT_PACKET_OUT
286 0.200514016 172.31.31.144 -> 172.31.23.72 TCP 187 6633 → 45460 [PSH, ACK] Seq=1 Ack=1 Win=853 Len=121 TSval=788207 TSecr=19357900
287 0.200599377 172.31.31.144 -> 172.31.23.72 TCP 187 6633 → 45460 [PSH, ACK] Seq=122 Ack=1 Win=853 Len=121 TSval=788207 TSecr=19357900
288 0.200634170 172.31.31.144 -> 172.31.23.72 TCP 187 6633 → 45460 [PSH, ACK] Seq=243 Ack=1 Win=853 Len=121 TSval=788207 TSecr=19357900
289 0.200646616 172.31.23.72 -> 172.31.31.144 TCP 66 45432 → 6633 [ACK] Seq=985 Ack=969 Win=213 Len=0 TSval=19358331 TSecr=788207
290 0.200691820 172.31.31.144 -> 172.31.23.72 TCP 187 6633 → 45460 [PSH, ACK] Seq=364 Ack=1 Win=853 Len=121 TSval=788207 TSecr=19357900
291 0.200748576 172.31.31.144 -> 172.31.23.72 TCP 187 6633 → 45460 [PSH, ACK] Seq=485 Ack=1 Win=853 Len=121 TSval=788207 TSecr=19357900
292 0.200799252 172.31.31.144 -> 172.31.23.72 TCP 187 6633 → 45460 [PSH, ACK] Seq=606 Ack=1 Win=853 Len=121 TSval=788207 TSecr=19357900
293 0.200891325 172.31.31.144 -> 172.31.23.72 TCP 187 6633 → 45458 [PSH, ACK] Seq=1 Ack=1 Win=853 Len=121 TSval=788207 TSecr=19357894
294 0.200911841 172.31.23.72 -> 172.31.31.144 TCP 66 45460 → 6633 [ACK] Seq=1 Ack=727 Win=213 Len=0 TSval=19358331 TSecr=788207
295 0.200959603 172.31.31.144 -> 172.31.23.72 TCP 187 6633 → 45458 [PSH, ACK] Seq=122 Ack=1 Win=853 Len=121 TSval=788207 TSecr=19357894
296 0.201002113 172.31.23.72 -> 172.31.31.144 OpenFlow 189 Type: OFPT_PACKET_IN
297 0.201025046 172.31.31.144 -> 172.31.23.72 OpenFlow 187 Type: OFPT_PACKET_OUT
298 0.201046291 172.31.23.72 -> 172.31.31.144 OpenFlow 189 Type: OFPT_PACKET_IN
299 0.201068947 172.31.31.144 -> 172.31.23.72 OpenFlow 187 Type: OFPT_PACKET_OUT
300 0.201074044 172.31.23.72 -> 172.31.31.144 OpenFlow 312 Type: OFPT_PACKET_IN
301 0.201096713 172.31.31.144 -> 172.31.23.72 OpenFlow 187 Type: OFPT_PACKET_OUT
302 0.201176592 172.31.31.144 -> 172.31.23.72 TCP 66 6633 → 45458 [ACK] Seq=606 Ack=124 Win=853 Len=0 TSval=788207 TSecr=19358331
303 0.201195104 172.31.31.144 -> 172.31.23.72 OpenFlow 187 Type: OFPT_PACKET_OUT
304 0.201300433 172.31.23.72 -> 172.31.31.144 TCP 66 45458 → 6633 [ACK] Seq=493 Ack=727 Win=213 Len=0 TSval=19358332 TSecr=788207
305 0.201337013 172.31.23.72 -> 172.31.31.144 OpenFlow 189 Type: OFPT_PACKET_IN
306 0.201361682 172.31.23.72 -> 172.31.31.144 OpenFlow 435 Type: OFPT_PACKET_IN
307 0.201384765 172.31.23.72 -> 172.31.31.144 OpenFlow 189 Type: OFPT_PACKET_IN
308 0.201407227 172.31.23.72 -> 172.31.31.144 OpenFlow 435 Type: OFPT_PACKET_IN
309 0.201469905 172.31.31.144 -> 172.31.23.72 OpenFlow 187 Type: OFPT_PACKET_OUT
310 0.201487172 172.31.31.144 -> 172.31.23.72 OpenFlow 187 Type: OFPT_PACKET_OUT
311 0.201534926 172.31.23.72 -> 172.31.31.144 OpenFlow 189 Type: OFPT_PACKET_IN
312 0.201545615 172.31.31.144 -> 172.31.23.72 TCP 66 6633 → 45448 [ACK] Seq=1 Ack=370 Win=853 Len=0 TSval=788207 TSecr=19358332
313 0.201561805 172.31.31.144 -> 172.31.23.72 TCP 66 6633 → 45448 [ACK] Seq=1 Ack=739 Win=853 Len=0 TSval=788207 TSecr=19358332
314 0.201566531 172.31.23.72 -> 172.31.31.144 OpenFlow 189 Type: OFPT_PACKET_IN
315 0.201605108 172.31.23.72 -> 172.31.31.144 OpenFlow 189 Type: OFPT_PACKET_IN
316 0.201624135 172.31.23.72 -> 172.31.31.144 OpenFlow 189 Type: OFPT_PACKET_IN
317 0.201628727 172.31.23.72 -> 172.31.31.144 OpenFlow 189 Type: OFPT_PACKET_IN
318 0.201650086 172.31.23.72 -> 172.31.31.144 OpenFlow 189 Type: OFPT_PACKET_IN
319 0.201655334 172.31.23.72 -> 172.31.31.144 OpenFlow 435 Type: OFPT_PACKET_IN
320 0.201668884 172.31.23.72 -> 172.31.31.144 OpenFlow 189 Type: OFPT_PACKET_IN
321 0.201691575 172.31.31.144 -> 172.31.23.72 OpenFlow 187 Type: OFPT_PACKET_OUT
322 0.201702794 172.31.23.72 -> 172.31.31.144 OpenFlow 189 Type: OFPT_PACKET_IN
323 0.201708053 172.31.23.72 -> 172.31.31.144 OpenFlow 189 Type: OFPT_PACKET_IN
324 0.201763958 172.31.31.144 -> 172.31.23.72 TCP 66 6633 → 45462 [ACK] Seq=727 Ack=370 Win=853 Len=0 TSval=788207 TSecr=19358332
325 0.201769951 172.31.31.144 -> 172.31.23.72 TCP 66 6633 → 45462 [ACK] Seq=727 Ack=493 Win=853 Len=0 TSval=788207 TSecr=19358332
326 0.201771901 172.31.31.144 -> 172.31.23.72 OpenFlow 187 Type: OFPT_PACKET_OUT
327 0.201776990 172.31.23.72 -> 172.31.31.144 OpenFlow 189 Type: OFPT_PACKET_IN
328 0.201786023 172.31.23.72 -> 172.31.31.144 OpenFlow 189 Type: OFPT_PACKET_IN
329 0.201806527 172.31.31.144 -> 172.31.23.72 TCP 66 6633 → 45438 [ACK] Seq=969 Ack=616 Win=853 Len=0 TSval=788207 TSecr=19358332
330 0.201826717 172.31.23.72 -> 172.31.31.144 TCP 66 45458 → 6633 [ACK] Seq=493 Ack=969 Win=213 Len=0 TSval=19358332 TSecr=788207
331 0.201862575 172.31.31.144 -> 172.31.23.72 TCP 66 6633 → 45444 [ACK] Seq=1211 Ack=493 Win=853 Len=0 TSval=788207 TSecr=19358332
332 0.201898544 172.31.31.144 -> 172.31.23.72 TCP 66 6633 → 45460 [ACK] Seq=727 Ack=124 Win=853 Len=0 TSval=788207 TSecr=19358332
333 0.201943931 172.31.31.144 -> 172.31.23.72 TCP 66 6633 → 45460 [ACK] Seq=727 Ack=247 Win=853 Len=0 TSval=788207 TSecr=19358332
334 0.201982708 172.31.23.72 -> 172.31.31.144 TCP 66 45456 → 6633 [ACK] Seq=739 Ack=243 Win=213 Len=0 TSval=19358332 TSecr=788207
335 0.202028296 172.31.31.144 -> 172.31.23.72 OpenFlow 187 Type: OFPT_PACKET_OUT
336 0.202084854 172.31.31.144 -> 172.31.23.72 TCP 66 6633 → 45438 [ACK] Seq=969 Ack=985 Win=853 Len=0 TSval=788207 TSecr=19358332
337 0.202139936 172.31.23.72 -> 172.31.31.144 OpenFlow 189 Type: OFPT_PACKET_IN
338 0.202163554 172.31.23.72 -> 172.31.31.144 OpenFlow 189 Type: OFPT_PACKET_IN
339 0.202187926 172.31.31.144 -> 172.31.23.72 TCP 66 6633 → 45428 [ACK] Seq=727 Ack=493 Win=853 Len=0 TSval=788207 TSecr=19358332
340 0.202280905 172.31.31.144 -> 172.31.23.72 TCP 66 6633 → 45454 [ACK] Seq=1 Ack=616 Win=853 Len=0 TSval=788207 TSecr=19358332
341 0.202297114 172.31.31.144 -> 172.31.23.72 TCP 66 6633 → 45430 [ACK] Seq=1211 Ack=985 Win=853 Len=0 TSval=788207 TSecr=19358332
342 0.202316382 172.31.31.144 -> 172.31.23.72 TCP 66 6633 → 45454 [ACK] Seq=1 Ack=739 Win=853 Len=0 TSval=788207 TSecr=19358332
343 0.202352576 172.31.23.72 -> 172.31.31.144 OpenFlow 189 Type: OFPT_PACKET_IN
344 0.202368716 172.31.23.72 -> 172.31.31.144 OpenFlow 189 Type: OFPT_PACKET_IN
345 0.202397520 172.31.23.72 -> 172.31.31.144 OpenFlow 189 Type: OFPT_PACKET_IN
346 0.202476326 172.31.31.144 -> 172.31.23.72 OpenFlow 187 Type: OFPT_PACKET_OUT
347 0.202555869 172.31.31.144 -> 172.31.23.72 OpenFlow 187 Type: OFPT_PACKET_OUT
348 0.202573084 172.31.31.144 -> 172.31.23.72 TCP 66 6633 → 45446 [ACK] Seq=1211 Ack=739 Win=853 Len=0 TSval=788207 TSecr=19358332
349 0.202593055 172.31.31.144 -> 172.31.23.72 OpenFlow 671 Type: OFPT_PACKET_OUT
350 0.202648483 172.31.31.144 -> 172.31.23.72 OpenFlow 187 Type: OFPT_PACKET_OUT
351 0.202731869 172.31.31.144 -> 172.31.23.72 OpenFlow 187 Type: OFPT_PACKET_OUT
352 0.202789710 172.31.31.144 -> 172.31.23.72 OpenFlow 187 Type: OFPT_PACKET_OUT
353 0.202862914 172.31.31.144 -> 172.31.23.72 OpenFlow 187 Type: OFPT_PACKET_OUT
354 0.202871060 172.31.23.72 -> 172.31.31.144 TCP 66 45456 → 6633 [ACK] Seq=739 Ack=969 Win=213 Len=0 TSval=19358332 TSecr=788207
355 0.202942952 172.31.31.144 -> 172.31.23.72 OpenFlow 187 Type: OFPT_PACKET_OUT
356 0.202995077 172.31.31.144 -> 172.31.23.72 OpenFlow 187 Type: OFPT_PACKET_OUT
357 0.203064162 172.31.31.144 -> 172.31.23.72 OpenFlow 187 Type: OFPT_PACKET_OUT
358 0.203075733 172.31.23.72 -> 172.31.31.144 TCP 66 45414 → 6633 [ACK] Seq=493 Ack=727 Win=213 Len=0 TSval=19358332 TSecr=788207
359 0.203120372 172.31.31.144 -> 172.31.23.72 OpenFlow 187 Type: OFPT_PACKET_OUT
360 0.203181621 172.31.31.144 -> 172.31.23.72 OpenFlow 187 Type: OFPT_PACKET_OUT
361 0.203232902 172.31.31.144 -> 172.31.23.72 OpenFlow 187 Type: OFPT_PACKET_OUT
362 0.203290435 172.31.31.144 -> 172.31.23.72 OpenFlow 187 Type: OFPT_PACKET_OUT
363 0.203346741 172.31.31.144 -> 172.31.23.72 OpenFlow 187 Type: OFPT_PACKET_OUT
364 0.203417479 172.31.31.144 -> 172.31.23.72 OpenFlow 187 Type: OFPT_PACKET_OUT
365 0.203438174 172.31.23.72 -> 172.31.31.144 TCP 66 45454 → 6633 [ACK] Seq=739 Ack=969 Win=213 Len=0 TSval=19358332 TSecr=788207
366 0.203467610 172.31.31.144 -> 172.31.23.72 OpenFlow 187 Type: OFPT_PACKET_OUT
367 0.203536756 172.31.31.144 -> 172.31.23.72 OpenFlow 187 Type: OFPT_PACKET_OUT
368 0.203577389 172.31.31.144 -> 172.31.23.72 OpenFlow 187 Type: OFPT_PACKET_OUT
369 0.203631826 172.31.31.144 -> 172.31.23.72 OpenFlow 187 Type: OFPT_PACKET_OUT
370 0.203694211 172.31.31.144 -> 172.31.23.72 OpenFlow 187 Type: OFPT_PACKET_OUT
371 0.203767663 172.31.31.144 -> 172.31.23.72 OpenFlow 187 Type: OFPT_PACKET_OUT
372 0.203780777 172.31.23.72 -> 172.31.31.144 TCP 66 45448 → 6633 [ACK] Seq=739 Ack=727 Win=213 Len=0 TSval=19358332 TSecr=788207
373 0.203822440 172.31.31.144 -> 172.31.23.72 OpenFlow 187 Type: OFPT_PACKET_OUT
374 0.203879319 172.31.31.144 -> 172.31.23.72 OpenFlow 187 Type: OFPT_PACKET_OUT
375 0.203934048 172.31.31.144 -> 172.31.23.72 OpenFlow 187 Type: OFPT_PACKET_OUT
376 0.204007984 172.31.31.144 -> 172.31.23.72 OpenFlow 187 Type: OFPT_PACKET_OUT
377 0.204064378 172.31.23.72 -> 172.31.31.144 TCP 66 45442 → 6633 [ACK] Seq=739 Ack=606 Win=213 Len=0 TSval=19358332 TSecr=788207
378 0.204108574 172.31.31.144 -> 172.31.23.72 OpenFlow 187 Type: OFPT_PACKET_OUT
379 0.204254433 172.31.23.72 -> 172.31.31.144 OpenFlow 189 Type: OFPT_PACKET_IN
380 0.204280210 172.31.23.72 -> 172.31.31.144 OpenFlow 435 Type: OFPT_PACKET_IN
381 0.204292623 172.31.23.72 -> 172.31.31.144 OpenFlow 189 Type: OFPT_PACKET_IN
382 0.204312832 172.31.23.72 -> 172.31.31.144 OpenFlow 189 Type: OFPT_PACKET_IN
383 0.204329633 172.31.23.72 -> 172.31.31.144 OpenFlow 189 Type: OFPT_PACKET_IN
384 0.204331778 172.31.23.72 -> 172.31.31.144 OpenFlow 189 Type: OFPT_PACKET_IN
385 0.204347392 172.31.23.72 -> 172.31.31.144 OpenFlow 189 Type: OFPT_PACKET_IN
386 0.204352254 172.31.23.72 -> 172.31.31.144 OpenFlow 189 Type: OFPT_PACKET_IN
387 0.204384969 172.31.23.72 -> 172.31.31.144 OpenFlow 189 Type: OFPT_PACKET_IN
388 0.204387480 172.31.23.72 -> 172.31.31.144 OpenFlow 189 Type: OFPT_PACKET_IN
389 0.204396983 172.31.23.72 -> 172.31.31.144 OpenFlow 189 Type: OFPT_PACKET_IN
390 0.204405005 172.31.31.144 -> 172.31.23.72 TCP 66 6633 → 45452 [ACK] Seq=969 Ack=370 Win=853 Len=0 TSval=788208 TSecr=19358332
391 0.204427236 172.31.23.72 -> 172.31.31.144 OpenFlow 189 Type: OFPT_PACKET_IN
392 0.204433467 172.31.23.72 -> 172.31.31.144 OpenFlow 681 Type: OFPT_PACKET_IN
393 0.204446351 172.31.23.72 -> 172.31.31.144 OpenFlow 189 Type: OFPT_PACKET_IN
394 0.204459099 172.31.23.72 -> 172.31.31.144 OpenFlow 189 Type: OFPT_PACKET_IN
395 0.204515471 172.31.31.144 -> 172.31.23.72 TCP 66 6633 → 45452 [ACK] Seq=969 Ack=739 Win=853 Len=0 TSval=788208 TSecr=19358332
396 0.204520268 172.31.31.144 -> 172.31.23.72 TCP 66 6633 → 45462 [ACK] Seq=727 Ack=616 Win=853 Len=0 TSval=788208 TSecr=19358332
397 0.204522414 172.31.31.144 -> 172.31.23.72 TCP 66 6633 → 45424 [ACK] Seq=1211 Ack=862 Win=853 Len=0 TSval=788208 TSecr=19358332
398 0.204524263 172.31.31.144 -> 172.31.23.72 TCP 66 6633 → 45462 [ACK] Seq=727 Ack=739 Win=853 Len=0 TSval=788208 TSecr=19358332
399 0.204529709 172.31.23.72 -> 172.31.31.144 OpenFlow 435 Type: OFPT_PACKET_IN
400 0.204535903 172.31.23.72 -> 172.31.31.144 OpenFlow 189 Type: OFPT_PACKET_IN
401 0.204603647 172.31.31.144 -> 172.31.23.72 TCP 66 6633 → 45434 [ACK] Seq=1211 Ack=1108 Win=853 Len=0 TSval=788208 TSecr=19358332
402 0.204610006 172.31.23.72 -> 172.31.31.144 OpenFlow 189 Type: OFPT_PACKET_IN
403 0.204614871 172.31.23.72 -> 172.31.31.144 OpenFlow 189 Type: OFPT_PACKET_IN
404 0.204651199 172.31.31.144 -> 172.31.23.72 TCP 66 6633 → 45424 [ACK] Seq=1211 Ack=985 Win=853 Len=0 TSval=788208 TSecr=19358332
405 0.204653790 172.31.31.144 -> 172.31.23.72 TCP 66 6633 → 45416 [ACK] Seq=969 Ack=739 Win=853 Len=0 TSval=788208 TSecr=19358332
406 0.204655887 172.31.31.144 -> 172.31.23.72 TCP 66 6633 → 45444 [ACK] Seq=1211 Ack=616 Win=853 Len=0 TSval=788208 TSecr=19358332
407 0.204698291 172.31.31.144 -> 172.31.23.72 TCP 66 6633 → 45460 [ACK] Seq=727 Ack=370 Win=853 Len=0 TSval=788208 TSecr=19358332
408 0.204700406 172.31.31.144 -> 172.31.23.72 TCP 66 6633 → 45446 [ACK] Seq=1211 Ack=862 Win=853 Len=0 TSval=788208 TSecr=19358332
409 0.204751938 172.31.31.144 -> 172.31.23.72 TCP 66 6633 → 45460 [ACK] Seq=727 Ack=493 Win=853 Len=0 TSval=788208 TSecr=19358332
410 0.204818577 172.31.31.144 -> 172.31.23.72 TCP 66 6633 → 45434 [ACK] Seq=1211 Ack=1231 Win=853 Len=0 TSval=788208 TSecr=19358332
411 0.204941007 172.31.31.144 -> 172.31.23.72 TCP 66 6633 → 45456 [ACK] Seq=969 Ack=985 Win=853 Len=0 TSval=788208 TSecr=19358332
412 0.205031151 172.31.31.144 -> 172.31.23.72 TCP 66 6633 → 45446 [ACK] Seq=1211 Ack=1231 Win=853 Len=0 TSval=788208 TSecr=19358332
413 0.205123194 172.31.31.144 -> 172.31.23.72 TCP 66 6633 → 45458 [ACK] Seq=969 Ack=739 Win=853 Len=0 TSval=788208 TSecr=19358332
414 0.205225543 172.31.31.144 -> 172.31.23.72 TCP 66 6633 → 45444 [ACK] Seq=1211 Ack=1231 Win=853 Len=0 TSval=788208 TSecr=19358332
415 0.241051879 172.31.23.72 -> 172.31.31.144 TCP 66 45442 → 6633 [ACK] Seq=739 Ack=727 Win=213 Len=0 TSval=19358342 TSecr=788208
416 0.299482678 172.31.31.144 -> 172.31.23.72 OpenFlow 187 Type: OFPT_PACKET_OUT
417 0.299503453 172.31.31.144 -> 172.31.23.72 OpenFlow 187 Type: OFPT_PACKET_OUT
418 0.299540774 172.31.31.144 -> 172.31.23.72 OpenFlow 187 Type: OFPT_PACKET_OUT
419 0.299593438 172.31.31.144 -> 172.31.23.72 OpenFlow 187 Type: OFPT_PACKET_OUT
420 0.299664758 172.31.31.144 -> 172.31.23.72 OpenFlow 187 Type: OFPT_PACKET_OUT
421 0.299735972 172.31.31.144 -> 172.31.23.72 OpenFlow 187 Type: OFPT_PACKET_OUT
422 0.299783425 172.31.31.144 -> 172.31.23.72 OpenFlow 187 Type: OFPT_PACKET_OUT
423 0.299844321 172.31.31.144 -> 172.31.23.72 OpenFlow 187 Type: OFPT_PACKET_OUT
424 0.299906831 172.31.31.144 -> 172.31.23.72 OpenFlow 187 Type: OFPT_PACKET_OUT
425 0.299999530 172.31.31.144 -> 172.31.23.72 OpenFlow 187 Type: OFPT_PACKET_OUT
426 0.300141053 172.31.31.144 -> 172.31.23.72 OpenFlow 187 Type: OFPT_PACKET_OUT
427 0.300184689 172.31.31.144 -> 172.31.23.72 OpenFlow 187 Type: OFPT_PACKET_OUT
428 0.300248272 172.31.31.144 -> 172.31.23.72 OpenFlow 187 Type: OFPT_PACKET_OUT
429 0.300320097 172.31.31.144 -> 172.31.23.72 OpenFlow 187 Type: OFPT_PACKET_OUT
430 0.300390519 172.31.31.144 -> 172.31.23.72 OpenFlow 187 Type: OFPT_PACKET_OUT
431 0.300399392 172.31.23.72 -> 172.31.31.144 TCP 66 45426 → 6633 [ACK] Seq=985 Ack=1211 Win=213 Len=0 TSval=19358356 TSecr=788231
432 0.300459428 172.31.31.144 -> 172.31.23.72 OpenFlow 187 Type: OFPT_PACKET_OUT
433 0.300504987 172.31.23.72 -> 172.31.31.144 OpenFlow 189 Type: OFPT_PACKET_IN
434 0.300550820 172.31.23.72 -> 172.31.31.144 OpenFlow 189 Type: OFPT_PACKET_IN
435 0.300727406 172.31.31.144 -> 172.31.23.72 TCP 66 6633 → 45422 [ACK] Seq=727 Ack=739 Win=853 Len=0 TSval=788232 TSecr=19358356
436 0.300923615 172.31.23.72 -> 172.31.31.144 OpenFlow 189 Type: OFPT_PACKET_IN
437 0.300947642 172.31.23.72 -> 172.31.31.144 OpenFlow 189 Type: OFPT_PACKET_IN
438 0.300962267 172.31.23.72 -> 172.31.31.144 OpenFlow 189 Type: OFPT_PACKET_IN
439 0.300984448 172.31.23.72 -> 172.31.31.144 OpenFlow 189 Type: OFPT_PACKET_IN
440 0.300992500 172.31.23.72 -> 172.31.31.144 OpenFlow 189 Type: OFPT_PACKET_IN
441 0.301033760 172.31.23.72 -> 172.31.31.144 OpenFlow 435 Type: OFPT_PACKET_IN
442 0.301058562 172.31.23.72 -> 172.31.31.144 OpenFlow 189 Type: OFPT_PACKET_IN
443 0.301074961 172.31.23.72 -> 172.31.31.144 OpenFlow 189 Type: OFPT_PACKET_IN
444 0.301084390 172.31.23.72 -> 172.31.31.144 OpenFlow 189 Type: OFPT_PACKET_IN
445 0.301097096 172.31.31.144 -> 172.31.23.72 TCP 66 6633 → 45420 [ACK] Seq=969 Ack=739 Win=853 Len=0 TSval=788232 TSecr=19358356
446 0.301120906 172.31.23.72 -> 172.31.31.144 OpenFlow 189 Type: OFPT_PACKET_IN
447 0.301145613 172.31.31.144 -> 172.31.23.72 TCP 66 6633 → 45424 [ACK] Seq=1211 Ack=1108 Win=853 Len=0 TSval=788232 TSecr=19358356
448 0.301149284 172.31.31.144 -> 172.31.23.72 TCP 66 6633 → 45424 [ACK] Seq=1211 Ack=1231 Win=853 Len=0 TSval=788232 TSecr=19358356
449 0.301167058 172.31.31.144 -> 172.31.23.72 TCP 66 6633 → 45418 [ACK] Seq=1211 Ack=616 Win=853 Len=0 TSval=788232 TSecr=19358356
450 0.301183266 172.31.31.144 -> 172.31.23.72 TCP 66 6633 → 45418 [ACK] Seq=1211 Ack=985 Win=853 Len=0 TSval=788232 TSecr=19358357
451 0.301188735 172.31.23.72 -> 172.31.31.144 OpenFlow 189 Type: OFPT_PACKET_IN
452 0.301208808 172.31.23.72 -> 172.31.31.144 OpenFlow 189 Type: OFPT_PACKET_IN
453 0.301233128 172.31.31.144 -> 172.31.23.72 TCP 66 6633 → 45430 [ACK] Seq=1211 Ack=1231 Win=853 Len=0 TSval=788232 TSecr=19358357
454 0.301382085 172.31.31.144 -> 172.31.23.72 TCP 66 6633 → 45426 [ACK] Seq=1211 Ack=1231 Win=853 Len=0 TSval=788232 TSecr=19358357
455 0.301521731 172.31.31.144 -> 172.31.23.72 TCP 66 6633 → 45428 [ACK] Seq=727 Ack=739 Win=853 Len=0 TSval=788232 TSecr=19358357
456 0.359507004 172.31.23.72 -> 172.31.31.144 OpenFlow 146 Type: OFPT_PORT_STATUS
457 0.359590562 172.31.23.72 -> 172.31.31.144 OpenFlow 146 Type: OFPT_PORT_STATUS
458 0.402028437 172.31.31.144 -> 172.31.23.72 TCP 66 6633 → 45420 [ACK] Seq=969 Ack=819 Win=853 Len=0 TSval=788257 TSecr=19358371
459 0.402049140 172.31.31.144 -> 172.31.23.72 TCP 66 6633 → 45428 [ACK] Seq=727 Ack=819 Win=853 Len=0 TSval=788257 TSecr=19358371
460 0.427736570 172.31.31.144 -> 172.31.23.72 OpenFlow 146 Type: OFPT_FLOW_MOD
461 0.427760480 172.31.23.72 -> 172.31.31.144 TCP 66 45442 → 6633 [ACK] Seq=739 Ack=807 Win=213 Len=0 TSval=19358388 TSecr=788263
462 0.427766837 172.31.31.144 -> 172.31.23.72 OpenFlow 146 Type: OFPT_FLOW_MOD
463 0.427771104 172.31.23.72 -> 172.31.31.144 TCP 66 45442 → 6633 [ACK] Seq=739 Ack=887 Win=213 Len=0 TSval=19358388 TSecr=788263
464 0.427772514 172.31.31.144 -> 172.31.23.72 OpenFlow 74 Type: OFPT_BARRIER_REQUEST
465 0.427774647 172.31.23.72 -> 172.31.31.144 TCP 66 45442 → 6633 [ACK] Seq=739 Ack=895 Win=213 Len=0 TSval=19358388 TSecr=788263
466 0.428085717 172.31.23.72 -> 172.31.31.144 OpenFlow 74 Type: OFPT_BARRIER_REPLY
467 0.428509336 172.31.31.144 -> 172.31.23.72 OpenFlow 146 Type: OFPT_FLOW_MOD
468 0.428515712 172.31.31.144 -> 172.31.23.72 OpenFlow 154 Type: OFPT_BARRIER_REQUEST
469 0.428518748 172.31.31.144 -> 172.31.23.72 OpenFlow 146 Type: OFPT_FLOW_MOD
470 0.428522409 172.31.31.144 -> 172.31.23.72 OpenFlow 146 Type: OFPT_FLOW_MOD
471 0.428525118 172.31.31.144 -> 172.31.23.72 OpenFlow 154 Type: OFPT_BARRIER_REQUEST
472 0.428526925 172.31.31.144 -> 172.31.23.72 OpenFlow 154 Type: OFPT_BARRIER_REQUEST
473 0.428528529 172.31.31.144 -> 172.31.23.72 OpenFlow 146 Type: OFPT_FLOW_MOD
474 0.428530748 172.31.31.144 -> 172.31.23.72 OpenFlow 146 Type: OFPT_FLOW_MOD
475 0.428533282 172.31.31.144 -> 172.31.23.72 OpenFlow 146 Type: OFPT_FLOW_MOD
476 0.428535256 172.31.31.144 -> 172.31.23.72 OpenFlow 154 Type: OFPT_BARRIER_REQUEST
477 0.428695274 172.31.23.72 -> 172.31.31.144 OpenFlow 226 Type: OFPT_FLOW_REMOVED
478 0.429205503 172.31.31.144 -> 172.31.23.72 OpenFlow 146 Type: OFPT_FLOW_MOD
479 0.429210114 172.31.31.144 -> 172.31.23.72 OpenFlow 146 Type: OFPT_FLOW_MOD
480 0.429212082 172.31.31.144 -> 172.31.23.72 OpenFlow 146 Type: OFPT_FLOW_MOD
481 0.429215284 172.31.31.144 -> 172.31.23.72 OpenFlow 74 Type: OFPT_BARRIER_REQUEST
482 0.429216790 172.31.31.144 -> 172.31.23.72 OpenFlow 154 Type: OFPT_BARRIER_REQUEST
483 0.429218104 172.31.31.144 -> 172.31.23.72 OpenFlow 74 Type: OFPT_BARRIER_REQUEST
484 0.429219637 172.31.31.144 -> 172.31.23.72 OpenFlow 146 Type: OFPT_FLOW_MOD
485 0.429221744 172.31.31.144 -> 172.31.23.72 OpenFlow 154 Type: OFPT_BARRIER_REQUEST
486 0.429222886 172.31.31.144 -> 172.31.23.72 OpenFlow 146 Type: OFPT_FLOW_MOD
487 0.429234122 172.31.31.144 -> 172.31.23.72 OpenFlow 154 Type: OFPT_BARRIER_REQUEST
488 0.429235618 172.31.31.144 -> 172.31.23.72 OpenFlow 146 Type: OFPT_FLOW_MOD
489 0.429236901 172.31.31.144 -> 172.31.23.72 OpenFlow 154 Type: OFPT_BARRIER_REQUEST
490 0.429238372 172.31.31.144 -> 172.31.23.72 OpenFlow 146 Type: OFPT_FLOW_MOD
491 0.429240872 172.31.31.144 -> 172.31.23.72 OpenFlow 146 Type: OFPT_FLOW_MOD
492 0.429242239 172.31.31.144 -> 172.31.23.72 OpenFlow 154 Type: OFPT_BARRIER_REQUEST
493 0.429243576 172.31.31.144 -> 172.31.23.72 TCP 66 6633 → 45442 [ACK] Seq=895 Ack=747 Win=853 Len=0 TSval=788264 TSecr=19358388
494 0.429246870 172.31.31.144 -> 172.31.23.72 OpenFlow 146 Type: OFPT_FLOW_MOD
495 0.429249418 172.31.31.144 -> 172.31.23.72 OpenFlow 146 Type: OFPT_FLOW_MOD
496 0.429251203 172.31.31.144 -> 172.31.23.72 OpenFlow 154 Type: OFPT_BARRIER_REQUEST
497 0.429256112 172.31.31.144 -> 172.31.23.72 OpenFlow 146 Type: OFPT_FLOW_MOD
498 0.429257863 172.31.31.144 -> 172.31.23.72 OpenFlow 146 Type: OFPT_FLOW_MOD
499 0.429259646 172.31.31.144 -> 172.31.23.72 OpenFlow 146 Type: OFPT_FLOW_MOD
500 0.429261130 172.31.31.144 -> 172.31.23.72 OpenFlow 154 Type: OFPT_BARRIER_REQUEST
501 0.429262498 172.31.31.144 -> 172.31.23.72 OpenFlow 146 Type: OFPT_FLOW_MOD
502 0.429263786 172.31.31.144 -> 172.31.23.72 OpenFlow 146 Type: OFPT_FLOW_MOD
503 0.429265172 172.31.31.144 -> 172.31.23.72 OpenFlow 74 Type: OFPT_BARRIER_REQUEST
504 0.429266488 172.31.31.144 -> 172.31.23.72 OpenFlow 146 Type: OFPT_FLOW_MOD
505 0.429267848 172.31.31.144 -> 172.31.23.72 OpenFlow 154 Type: OFPT_BARRIER_REQUEST
506 0.429268860 172.31.31.144 -> 172.31.23.72 OpenFlow 146 Type: OFPT_FLOW_MOD
507 0.429270113 172.31.31.144 -> 172.31.23.72 OpenFlow 154 Type: OFPT_BARRIER_REQUEST
508 0.429271744 172.31.31.144 -> 172.31.23.72 OpenFlow 146 Type: OFPT_FLOW_MOD
509 0.430741654 172.31.23.72 -> 172.31.31.144 OpenFlow 74 Type: OFPT_BARRIER_REPLY
510 0.430786776 172.31.23.72 -> 172.31.31.144 OpenFlow 74 Type: OFPT_BARRIER_REPLY
511 0.430829078 172.31.23.72 -> 172.31.31.144 TCP 66 45424 → 6633 [ACK] Seq=1231 Ack=1379 Win=213 Len=0 TSval=19358389 TSecr=788263
512 0.430833099 172.31.23.72 -> 172.31.31.144 OpenFlow 74 Type: OFPT_BARRIER_REPLY
513 0.430850280 172.31.23.72 -> 172.31.31.144 TCP 66 45418 → 6633 [ACK] Seq=985 Ack=1379 Win=213 Len=0 TSval=19358389 TSecr=788263
514 0.430854289 172.31.23.72 -> 172.31.31.144 OpenFlow 74 Type: OFPT_BARRIER_REPLY
515 0.430897088 172.31.23.72 -> 172.31.31.144 TCP 66 45450 → 6633 [ACK] Seq=493 Ack=887 Win=213 Len=0 TSval=19358389 TSecr=788263
516 0.430927329 172.31.23.72 -> 172.31.31.144 OpenFlow 74 Type: OFPT_BARRIER_REPLY
517 0.430971541 172.31.23.72 -> 172.31.31.144 OpenFlow 74 Type: OFPT_BARRIER_REPLY
518 0.430998842 172.31.23.72 -> 172.31.31.144 OpenFlow 74 Type: OFPT_BARRIER_REPLY
519 0.431042793 172.31.23.72 -> 172.31.31.144 OpenFlow 74 Type: OFPT_BARRIER_REPLY
520 0.431069912 172.31.23.72 -> 172.31.31.144 TCP 66 45426 → 6633 [ACK] Seq=1231 Ack=1379 Win=213 Len=0 TSval=19358389 TSecr=788263
521 0.431073917 172.31.23.72 -> 172.31.31.144 OpenFlow 74 Type: OFPT_BARRIER_REPLY
522 0.431101774 172.31.31.144 -> 172.31.23.72 OpenFlow 74 Type: OFPT_BARRIER_REQUEST
523 0.431106116 172.31.31.144 -> 172.31.23.72 OpenFlow 74 Type: OFPT_BARRIER_REQUEST
524 0.431107809 172.31.31.144 -> 172.31.23.72 OpenFlow 146 Type: OFPT_FLOW_MOD
525 0.431109611 172.31.31.144 -> 172.31.23.72 OpenFlow 146 Type: OFPT_FLOW_MOD
526 0.431111167 172.31.31.144 -> 172.31.23.72 OpenFlow 146 Type: OFPT_FLOW_MOD
527 0.431114294 172.31.31.144 -> 172.31.23.72 OpenFlow 74 Type: OFPT_BARRIER_REQUEST
528 0.431116195 172.31.31.144 -> 172.31.23.72 OpenFlow 154 Type: OFPT_BARRIER_REQUEST
529 0.431117947 172.31.31.144 -> 172.31.23.72 OpenFlow 146 Type: OFPT_FLOW_MOD
530 0.431121164 172.31.31.144 -> 172.31.23.72 OpenFlow 146 Type: OFPT_FLOW_MOD
531 0.431122845 172.31.31.144 -> 172.31.23.72 OpenFlow 146 Type: OFPT_FLOW_MOD
532 0.431124579 172.31.31.144 -> 172.31.23.72 OpenFlow 146 Type: OFPT_FLOW_MOD
533 0.431127081 172.31.31.144 -> 172.31.23.72 OpenFlow 154 Type: OFPT_BARRIER_REQUEST
534 0.431128582 172.31.31.144 -> 172.31.23.72 OpenFlow 226 Type: OFPT_FLOW_MOD
535 0.431130546 172.31.31.144 -> 172.31.23.72 OpenFlow 74 Type: OFPT_BARRIER_REQUEST
536 0.431132044 172.31.31.144 -> 172.31.23.72 OpenFlow 154 Type: OFPT_BARRIER_REQUEST
537 0.431133523 172.31.31.144 -> 172.31.23.72 TCP 66 6633 → 45442 [ACK] Seq=895 Ack=907 Win=853 Len=0 TSval=788264 TSecr=19358388
538 0.431136809 172.31.31.144 -> 172.31.23.72 OpenFlow 154 Type: OFPT_BARRIER_REQUEST
539 0.431138207 172.31.31.144 -> 172.31.23.72 OpenFlow 74 Type: OFPT_BARRIER_REQUEST
540 0.431139682 172.31.31.144 -> 172.31.23.72 OpenFlow 146 Type: OFPT_FLOW_MOD
541 0.431142225 172.31.31.144 -> 172.31.23.72 OpenFlow 146 Type: OFPT_FLOW_MOD
542 0.431143972 172.31.31.144 -> 172.31.23.72 OpenFlow 146 Type: OFPT_FLOW_MOD
543 0.431145904 172.31.31.144 -> 172.31.23.72 OpenFlow 154 Type: OFPT_BARRIER_REQUEST
544 0.431147669 172.31.31.144 -> 172.31.23.72 OpenFlow 146 Type: OFPT_FLOW_MOD
545 0.431149177 172.31.31.144 -> 172.31.23.72 OpenFlow 146 Type: OFPT_FLOW_MOD
546 0.431150683 172.31.31.144 -> 172.31.23.72 OpenFlow 146 Type: OFPT_FLOW_MOD
547 0.431152085 172.31.31.144 -> 172.31.23.72 OpenFlow 146 Type: OFPT_FLOW_MOD
548 0.431153567 172.31.31.144 -> 172.31.23.72 OpenFlow 146 Type: OFPT_FLOW_MOD
549 0.431154889 172.31.31.144 -> 172.31.23.72 OpenFlow 154 Type: OFPT_FLOW_MOD
550 0.431156015 172.31.31.144 -> 172.31.23.72 OpenFlow 74 Type: OFPT_BARRIER_REQUEST
551 0.431157262 172.31.31.144 -> 172.31.23.72 OpenFlow 74 Type: OFPT_BARRIER_REQUEST
552 0.431158421 172.31.31.144 -> 172.31.23.72 OpenFlow 154 Type: OFPT_BARRIER_REQUEST
553 0.431160107 172.31.31.144 -> 172.31.23.72 OpenFlow 146 Type: OFPT_FLOW_MOD
554 0.431162609 172.31.31.144 -> 172.31.23.72 OpenFlow 146 Type: OFPT_FLOW_MOD
555 0.431164466 172.31.31.144 -> 172.31.23.72 OpenFlow 154 Type: OFPT_BARRIER_REQUEST
556 0.431165720 172.31.31.144 -> 172.31.23.72 OpenFlow 146 Type: OFPT_FLOW_MOD
557 0.431168579 172.31.31.144 -> 172.31.23.72 OpenFlow 154 Type: OFPT_BARRIER_REQUEST
558 0.431169960 172.31.31.144 -> 172.31.23.72 OpenFlow 146 Type: OFPT_FLOW_MOD
559 0.431171320 172.31.31.144 -> 172.31.23.72 OpenFlow 234 Type: OFPT_BARRIER_REQUEST
560 0.431172991 172.31.31.144 -> 172.31.23.72 OpenFlow 146 Type: OFPT_FLOW_MOD
561 0.431174951 172.31.31.144 -> 172.31.23.72 OpenFlow 146 Type: OFPT_FLOW_MOD
562 0.431176257 172.31.31.144 -> 172.31.23.72 OpenFlow 146 Type: OFPT_FLOW_MOD
563 0.431177370 172.31.31.144 -> 172.31.23.72 OpenFlow 322 Type: OFPT_BARRIER_REQUEST
564 0.431178702 172.31.31.144 -> 172.31.23.72 OpenFlow 146 Type: OFPT_FLOW_MOD
565 0.431179815 172.31.31.144 -> 172.31.23.72 OpenFlow 74 Type: OFPT_BARRIER_REQUEST
566 0.431181071 172.31.31.144 -> 172.31.23.72 OpenFlow 146 Type: OFPT_FLOW_MOD
567 0.431182474 172.31.31.144 -> 172.31.23.72 OpenFlow 242 Type: OFPT_BARRIER_REQUEST
568 0.431183972 172.31.31.144 -> 172.31.23.72 OpenFlow 154 Type: OFPT_BARRIER_REQUEST
569 0.431185150 172.31.31.144 -> 172.31.23.72 OpenFlow 146 Type: OFPT_FLOW_MOD
570 0.431186567 172.31.31.144 -> 172.31.23.72 OpenFlow 74 Type: OFPT_BARRIER_REQUEST
571 0.431286268 172.31.23.72 -> 172.31.31.144 OpenFlow 74 Type: OFPT_BARRIER_REPLY
572 0.431293793 172.31.23.72 -> 172.31.31.144 OpenFlow 82 Type: OFPT_BARRIER_REPLY
573 0.431372152 172.31.23.72 -> 172.31.31.144 OpenFlow 146 Type: OFPT_FLOW_REMOVED
574 0.431375926 172.31.23.72 -> 172.31.31.144 OpenFlow 82 Type: OFPT_BARRIER_REPLY
575 0.431377880 172.31.23.72 -> 172.31.31.144 OpenFlow 74 Type: OFPT_BARRIER_REPLY
576 0.431379528 172.31.23.72 -> 172.31.31.144 OpenFlow 74 Type: OFPT_BARRIER_REPLY
577 0.431384771 172.31.23.72 -> 172.31.31.144 OpenFlow 146 Type: OFPT_FLOW_REMOVED
578 0.431393036 172.31.23.72 -> 172.31.31.144 OpenFlow 146 Type: OFPT_FLOW_REMOVED
579 0.431399649 172.31.23.72 -> 172.31.31.144 OpenFlow 146 Type: OFPT_FLOW_REMOVED
580 0.431442873 172.31.23.72 -> 172.31.31.144 OpenFlow 146 Type: OFPT_FLOW_REMOVED
581 0.431455230 172.31.23.72 -> 172.31.31.144 OpenFlow 146 Type: OFPT_FLOW_REMOVED
582 0.431771397 172.31.23.72 -> 172.31.31.144 OpenFlow 386 Type: OFPT_FLOW_REMOVED
583 0.431780474 172.31.23.72 -> 172.31.31.144 OpenFlow 546 Type: OFPT_FLOW_REMOVED
584 0.431782364 172.31.23.72 -> 172.31.31.144 OpenFlow 546 Type: OFPT_FLOW_REMOVED
585 0.431784185 172.31.23.72 -> 172.31.31.144 OpenFlow 386 Type: OFPT_FLOW_REMOVED
586 0.431786139 172.31.23.72 -> 172.31.31.144 OpenFlow 386 Type: OFPT_FLOW_REMOVED
587 0.432925657 172.31.23.72 -> 172.31.31.144 TCP 66 45452 → 6633 [ACK] Seq=739 Ack=1137 Win=213 Len=0 TSval=19358389 TSecr=788263
588 0.432929814 172.31.23.72 -> 172.31.31.144 OpenFlow 146 Type: OFPT_FLOW_REMOVED
589 0.432932041 172.31.23.72 -> 172.31.31.144 OpenFlow 146 Type: OFPT_FLOW_REMOVED
590 0.432933683 172.31.23.72 -> 172.31.31.144 OpenFlow 146 Type: OFPT_FLOW_REMOVED
591 0.432935367 172.31.23.72 -> 172.31.31.144 OpenFlow 306 Type: OFPT_FLOW_REMOVED
592 0.432936933 172.31.23.72 -> 172.31.31.144 OpenFlow 146 Type: OFPT_FLOW_REMOVED
593 0.432945513 172.31.31.144 -> 172.31.23.72 TCP 66 6633 → 45462 [ACK] Seq=1063 Ack=747 Win=853 Len=0 TSval=788264 TSecr=19358389
594 0.432950276 172.31.31.144 -> 172.31.23.72 OpenFlow 490 Type: OFPT_BARRIER_REQUEST
595 0.432953394 172.31.31.144 -> 172.31.23.72 TCP 66 6633 → 45424 [ACK] Seq=1547 Ack=1239 Win=853 Len=0 TSval=788264 TSecr=19358389
596 0.432955348 172.31.31.144 -> 172.31.23.72 TCP 66 6633 → 45418 [ACK] Seq=1547 Ack=993 Win=853 Len=0 TSval=788264 TSecr=19358389
597 0.432956922 172.31.31.144 -> 172.31.23.72 OpenFlow 402 Type: OFPT_BARRIER_REQUEST
598 0.432960242 172.31.31.144 -> 172.31.23.72 TCP 66 6633 → 45432 [ACK] Seq=1809 Ack=993 Win=853 Len=0 TSval=788264 TSecr=19358389
599 0.432962206 172.31.31.144 -> 172.31.23.72 TCP 66 6633 → 45460 [ACK] Seq=1063 Ack=501 Win=853 Len=0 TSval=788264 TSecr=19358389
600 0.432971071 172.31.23.72 -> 172.31.31.144 OpenFlow 74 Type: OFPT_BARRIER_REPLY
601 0.433025338 172.31.23.72 -> 172.31.31.144 OpenFlow 74 Type: OFPT_BARRIER_REPLY
602 0.433082332 172.31.23.72 -> 172.31.31.144 OpenFlow 74 Type: OFPT_BARRIER_REPLY
603 0.433109921 172.31.23.72 -> 172.31.31.144 OpenFlow 74 Type: OFPT_BARRIER_REPLY
604 0.433148484 172.31.23.72 -> 172.31.31.144 OpenFlow 74 Type: OFPT_BARRIER_REPLY
605 0.433169845 172.31.23.72 -> 172.31.31.144 TCP 66 45444 → 6633 [ACK] Seq=1231 Ack=1379 Win=213 Len=0 TSval=19358390 TSecr=788263
606 0.433174367 172.31.23.72 -> 172.31.31.144 OpenFlow 74 Type: OFPT_BARRIER_REPLY
607 0.433195784 172.31.31.144 -> 172.31.23.72 TCP 66 6633 → 45462 [ACK] Seq=1063 Ack=755 Win=853 Len=0 TSval=788264 TSecr=19358389
608 0.433203778 172.31.23.72 -> 172.31.31.144 OpenFlow 74 Type: OFPT_BARRIER_REPLY
609 0.433240332 172.31.23.72 -> 172.31.31.144 OpenFlow 74 Type: OFPT_BARRIER_REPLY
610 0.433269199 172.31.23.72 -> 172.31.31.144 OpenFlow 74 Type: OFPT_BARRIER_REPLY
611 0.433311781 172.31.23.72 -> 172.31.31.144 OpenFlow 74 Type: OFPT_BARRIER_REPLY
612 0.433314600 172.31.23.72 -> 172.31.31.144 OpenFlow 90 Type: OFPT_BARRIER_REPLY
613 0.433348260 172.31.23.72 -> 172.31.31.144 OpenFlow 74 Type: OFPT_BARRIER_REPLY
614 0.433386213 172.31.23.72 -> 172.31.31.144 OpenFlow 74 Type: OFPT_BARRIER_REPLY
615 0.433388973 172.31.23.72 -> 172.31.31.144 OpenFlow 74 Type: OFPT_BARRIER_REPLY
616 0.433423721 172.31.23.72 -> 172.31.31.144 TCP 66 45454 → 6633 [ACK] Seq=739 Ack=1137 Win=213 Len=0 TSval=19358390 TSecr=788263
617 0.433428122 172.31.23.72 -> 172.31.31.144 OpenFlow 74 Type: OFPT_BARRIER_REPLY
618 0.433439127 172.31.23.72 -> 172.31.31.144 OpenFlow 74 Type: OFPT_BARRIER_REPLY
619 0.433461009 172.31.23.72 -> 172.31.31.144 OpenFlow 74 Type: OFPT_BARRIER_REPLY
620 0.433603474 172.31.23.72 -> 172.31.31.144 OpenFlow 146 Type: OFPT_FLOW_REMOVED
621 0.433636185 172.31.23.72 -> 172.31.31.144 OpenFlow 146 Type: OFPT_FLOW_REMOVED
622 0.433645167 172.31.23.72 -> 172.31.31.144 OpenFlow 146 Type: OFPT_FLOW_REMOVED
623 0.433652895 172.31.23.72 -> 172.31.31.144 OpenFlow 146 Type: OFPT_FLOW_REMOVED
624 0.434249526 172.31.31.144 -> 172.31.23.72 TCP 66 6633 → 45434 [ACK] Seq=1547 Ack=1311 Win=853 Len=0 TSval=788264 TSecr=19358389
625 0.434256691 172.31.23.72 -> 172.31.31.144 OpenFlow 306 Type: OFPT_FLOW_REMOVED
626 0.434263629 172.31.31.144 -> 172.31.23.72 OpenFlow 170 Type: OFPT_FLOW_MOD
627 0.434266807 172.31.23.72 -> 172.31.31.144 OpenFlow 730 Type: OFPT_FLOW_REMOVED
628 0.434268481 172.31.31.144 -> 172.31.23.72 OpenFlow 170 Type: OFPT_FLOW_MOD
629 0.434270469 172.31.31.144 -> 172.31.23.72 TCP 66 6633 → 45432 [ACK] Seq=1809 Ack=1001 Win=853 Len=0 TSval=788264 TSecr=19358389
630 0.434272810 172.31.23.72 -> 172.31.31.144 OpenFlow 562 Type: OFPT_FLOW_REMOVED
631 0.434274180 172.31.31.144 -> 172.31.23.72 OpenFlow 74 Type: OFPT_BARRIER_REQUEST
632 0.434275659 172.31.31.144 -> 172.31.23.72 TCP 66 6633 → 45460 [ACK] Seq=1063 Ack=509 Win=853 Len=0 TSval=788264 TSecr=19358389
633 0.434277850 172.31.31.144 -> 172.31.23.72 OpenFlow 170 Type: OFPT_FLOW_MOD
634 0.434279731 172.31.31.144 -> 172.31.23.72 OpenFlow 170 Type: OFPT_FLOW_MOD
635 0.434281277 172.31.31.144 -> 172.31.23.72 OpenFlow 170 Type: OFPT_FLOW_MOD
636 0.434282620 172.31.31.144 -> 172.31.23.72 OpenFlow 170 Type: OFPT_FLOW_MOD
637 0.434285297 172.31.23.72 -> 172.31.31.144 OpenFlow 146 Type: OFPT_FLOW_REMOVED
638 0.434287376 172.31.31.144 -> 172.31.23.72 TCP 66 6633 → 45424 [ACK] Seq=1547 Ack=1319 Win=853 Len=0 TSval=788265 TSecr=19358389
639 0.434289901 172.31.23.72 -> 172.31.31.144 OpenFlow 146 Type: OFPT_FLOW_REMOVED
640 0.434291366 172.31.31.144 -> 172.31.23.72 OpenFlow 170 Type: OFPT_FLOW_MOD
641 0.434292992 172.31.31.144 -> 172.31.23.72 OpenFlow 178 Type: OFPT_BARRIER_REQUEST
642 0.434295332 172.31.31.144 -> 172.31.23.72 TCP 66 6633 → 45450 [ACK] Seq=895 Ack=573 Win=853 Len=0 TSval=788265 TSecr=19358389
643 0.434302912 172.31.23.72 -> 172.31.31.144 OpenFlow 562 Type: OFPT_FLOW_REMOVED
644 0.434305753 172.31.23.72 -> 172.31.31.144 OpenFlow 562 Type: OFPT_FLOW_REMOVED
645 0.434505719 172.31.23.72 -> 172.31.31.144 OpenFlow 706 Type: OFPT_FLOW_REMOVED
646 0.434508089 172.31.23.72 -> 172.31.31.144 OpenFlow 394 Type: OFPT_FLOW_REMOVED
647 0.434510159 172.31.23.72 -> 172.31.31.144 OpenFlow 226 Type: OFPT_FLOW_REMOVED
648 0.434511716 172.31.23.72 -> 172.31.31.144 OpenFlow 226 Type: OFPT_FLOW_REMOVED
649 0.434513481 172.31.23.72 -> 172.31.31.144 OpenFlow 146 Type: OFPT_FLOW_REMOVED
650 0.434625541 172.31.31.144 -> 172.31.23.72 OpenFlow 178 Type: OFPT_BARRIER_REQUEST
651 0.434628082 172.31.31.144 -> 172.31.23.72 OpenFlow 178 Type: OFPT_BARRIER_REQUEST
652 0.434629861 172.31.31.144 -> 172.31.23.72 OpenFlow 170 Type: OFPT_FLOW_MOD
653 0.434632620 172.31.31.144 -> 172.31.23.72 OpenFlow 74 Type: OFPT_BARRIER_REQUEST
654 0.434634176 172.31.31.144 -> 172.31.23.72 OpenFlow 170 Type: OFPT_FLOW_MOD
655 0.434636556 172.31.31.144 -> 172.31.23.72 OpenFlow 178 Type: OFPT_BARRIER_REQUEST
656 0.434637980 172.31.31.144 -> 172.31.23.72 OpenFlow 170 Type: OFPT_FLOW_MOD
657 0.434640325 172.31.31.144 -> 172.31.23.72 OpenFlow 74 Type: OFPT_BARRIER_REQUEST
658 0.434642378 172.31.31.144 -> 172.31.23.72 OpenFlow 170 Type: OFPT_FLOW_MOD
659 0.434648249 172.31.23.72 -> 172.31.31.144 OpenFlow 146 Type: OFPT_FLOW_REMOVED
660 0.435295601 172.31.23.72 -> 172.31.31.144 TCP 66 45462 → 6633 [ACK] Seq=1075 Ack=1279 Win=213 Len=0 TSval=19358390 TSecr=788265
661 0.435307361 172.31.23.72 -> 172.31.31.144 OpenFlow 74 Type: OFPT_BARRIER_REPLY
662 0.435348553 172.31.23.72 -> 172.31.31.144 OpenFlow 74 Type: OFPT_BARRIER_REPLY
663 0.435387814 172.31.23.72 -> 172.31.31.144 TCP 66 45428 → 6633 [ACK] Seq=1995 Ack=2119 Win=213 Len=0 TSval=19358390 TSecr=788264
664 0.435392457 172.31.23.72 -> 172.31.31.144 OpenFlow 74 Type: OFPT_BARRIER_REPLY
665 0.435420622 172.31.23.72 -> 172.31.31.144 TCP 66 45432 → 6633 [ACK] Seq=1825 Ack=2025 Win=213 Len=0 TSval=19358390 TSecr=788264
666 0.435424356 172.31.23.72 -> 172.31.31.144 OpenFlow 74 Type: OFPT_BARRIER_REPLY
667 0.435442861 172.31.23.72 -> 172.31.31.144 TCP 66 45460 → 6633 [ACK] Seq=829 Ack=1279 Win=213 Len=0 TSval=19358390 TSecr=788264
668 0.435446159 172.31.23.72 -> 172.31.31.144 OpenFlow 74 Type: OFPT_BARRIER_REPLY
669 0.435481902 172.31.23.72 -> 172.31.31.144 OpenFlow 74 Type: OFPT_BARRIER_REPLY
670 0.435510764 172.31.23.72 -> 172.31.31.144 TCP 66 45426 → 6633 [ACK] Seq=1567 Ack=1763 Win=213 Len=0 TSval=19358390 TSecr=788265
671 0.435514812 172.31.23.72 -> 172.31.31.144 OpenFlow 74 Type: OFPT_BARRIER_REPLY
672 0.436659079 172.31.31.144 -> 172.31.23.72 OpenFlow 170 Type: OFPT_FLOW_MOD
673 0.436665719 172.31.31.144 -> 172.31.23.72 OpenFlow 170 Type: OFPT_FLOW_MOD
674 0.436667877 172.31.31.144 -> 172.31.23.72 OpenFlow 74 Type: OFPT_BARRIER_REQUEST
675 0.436910314 172.31.31.144 -> 172.31.23.72 TCP 66 6633 → 45420 [ACK] Seq=2145 Ack=1323 Win=853 Len=0 TSval=788265 TSecr=19358389
676 0.436915042 172.31.31.144 -> 172.31.23.72 TCP 66 6633 → 45424 [ACK] Seq=1547 Ack=1399 Win=853 Len=0 TSval=788265 TSecr=19358389
677 0.437822218 172.31.23.72 -> 172.31.31.144 TCP 66 45442 → 6633 [ACK] Seq=907 Ack=1111 Win=213 Len=0 TSval=19358391 TSecr=788265
678 0.437835076 172.31.23.72 -> 172.31.31.144 OpenFlow 74 Type: OFPT_BARRIER_REPLY
679 0.438136533 172.31.31.144 -> 172.31.23.72 TCP 66 6633 → 45450 [ACK] Seq=895 Ack=653 Win=853 Len=0 TSval=788265 TSecr=19358389
680 0.438142847 172.31.31.144 -> 172.31.23.72 OpenFlow 170 Type: OFPT_FLOW_MOD
681 0.438145647 172.31.31.144 -> 172.31.23.72 OpenFlow 170 Type: OFPT_FLOW_MOD
682 0.438147106 172.31.31.144 -> 172.31.23.72 TCP 66 6633 → 45452 [ACK] Seq=1137 Ack=747 Win=853 Len=0 TSval=788265 TSecr=19358389
683 0.438149220 172.31.31.144 -> 172.31.23.72 TCP 66 6633 → 45434 [ACK] Seq=1547 Ack=1319 Win=853 Len=0 TSval=788265 TSecr=19358390
684 0.438152948 172.31.31.144 -> 172.31.23.72 OpenFlow 170 Type: OFPT_FLOW_MOD
685 0.438155181 172.31.31.144 -> 172.31.23.72 OpenFlow 170 Type: OFPT_FLOW_MOD
686 0.438156687 172.31.31.144 -> 172.31.23.72 OpenFlow 170 Type: OFPT_FLOW_MOD
687 0.438158844 172.31.31.144 -> 172.31.23.72 OpenFlow 170 Type: OFPT_FLOW_MOD
688 0.438160328 172.31.31.144 -> 172.31.23.72 OpenFlow 170 Type: OFPT_FLOW_MOD
689 0.438162608 172.31.31.144 -> 172.31.23.72 TCP 66 6633 → 45444 [ACK] Seq=1379 Ack=1239 Win=853 Len=0 TSval=788265 TSecr=19358390
690 0.438167574 172.31.31.144 -> 172.31.23.72 OpenFlow 170 Type: OFPT_FLOW_MOD
691 0.438169863 172.31.31.144 -> 172.31.23.72 TCP 66 6633 → 45424 [ACK] Seq=1547 Ack=1407 Win=853 Len=0 TSval=788265 TSecr=19358390
692 0.438172033 172.31.31.144 -> 172.31.23.72 OpenFlow 170 Type: OFPT_FLOW_MOD
693 0.439111069 172.31.31.144 -> 172.31.23.72 TCP 66 6633 → 45438 [ACK] Seq=1473 Ack=993 Win=853 Len=0 TSval=788265 TSecr=19358390
694 0.439375065 172.31.23.72 -> 172.31.31.144 TCP 66 45462 → 6633 [ACK] Seq=1083 Ack=1487 Win=213 Len=0 TSval=19358391 TSecr=788265
695 0.439462908 172.31.23.72 -> 172.31.31.144 TCP 66 45432 → 6633 [ACK] Seq=1833 Ack=2233 Win=213 Len=0 TSval=19358391 TSecr=788265
696 0.439481164 172.31.23.72 -> 172.31.31.144 TCP 66 45460 → 6633 [ACK] Seq=837 Ack=1487 Win=213 Len=0 TSval=19358391 TSecr=788265
697 0.439835500 172.31.31.144 -> 172.31.23.72 TCP 66 6633 → 45450 [ACK] Seq=895 Ack=661 Win=853 Len=0 TSval=788265 TSecr=19358390
698 0.439842092 172.31.31.144 -> 172.31.23.72 TCP 66 6633 → 45446 [ACK] Seq=1715 Ack=1239 Win=853 Len=0 TSval=788265 TSecr=19358390
699 0.439844523 172.31.31.144 -> 172.31.23.72 TCP 66 6633 → 45434 [ACK] Seq=1547 Ack=1327 Win=853 Len=0 TSval=788265 TSecr=19358390
700 0.439846817 172.31.31.144 -> 172.31.23.72 TCP 66 6633 → 45420 [ACK] Seq=2145 Ack=1355 Win=853 Len=0 TSval=788265 TSecr=19358389
701 0.440523554 172.31.31.144 -> 172.31.23.72 TCP 66 6633 → 45452 [ACK] Seq=1137 Ack=827 Win=853 Len=0 TSval=788265 TSecr=19358390
702 0.440527268 172.31.31.144 -> 172.31.23.72 TCP 66 6633 → 45444 [ACK] Seq=1379 Ack=1319 Win=853 Len=0 TSval=788265 TSecr=19358390
703 0.440529161 172.31.31.144 -> 172.31.23.72 TCP 66 6633 → 45424 [ACK] Seq=1547 Ack=1487 Win=853 Len=0 TSval=788265 TSecr=19358390
704 0.440531161 172.31.31.144 -> 172.31.23.72 OpenFlow 170 Type: OFPT_FLOW_MOD
705 0.440533203 172.31.31.144 -> 172.31.23.72 TCP 66 6633 → 45426 [ACK] Seq=1763 Ack=1407 Win=853 Len=0 TSval=788265 TSecr=19358389
706 0.440535659 172.31.31.144 -> 172.31.23.72 OpenFlow 178 Type: OFPT_BARRIER_REQUEST
707 0.440537362 172.31.31.144 -> 172.31.23.72 OpenFlow 170 Type: OFPT_FLOW_MOD
708 0.440538997 172.31.31.144 -> 172.31.23.72 OpenFlow 170 Type: OFPT_FLOW_MOD
709 0.440540402 172.31.31.144 -> 172.31.23.72 OpenFlow 74 Type: OFPT_BARRIER_REQUEST
710 0.440541832 172.31.31.144 -> 172.31.23.72 OpenFlow 170 Type: OFPT_FLOW_MOD
711 0.441154542 172.31.23.72 -> 172.31.31.144 TCP 66 45434 → 6633 [ACK] Seq=1567 Ack=1763 Win=213 Len=0 TSval=19358392 TSecr=788265
712 0.441166240 172.31.23.72 -> 172.31.31.144 OpenFlow 74 Type: OFPT_BARRIER_REPLY
713 0.441266773 172.31.31.144 -> 172.31.23.72 OpenFlow 178 Type: OFPT_BARRIER_REQUEST
714 0.441270967 172.31.31.144 -> 172.31.23.72 OpenFlow 170 Type: OFPT_FLOW_MOD
715 0.441273244 172.31.31.144 -> 172.31.23.72 OpenFlow 170 Type: OFPT_FLOW_MOD
716 0.441274767 172.31.31.144 -> 172.31.23.72 OpenFlow 74 Type: OFPT_BARRIER_REQUEST
717 0.441276489 172.31.31.144 -> 172.31.23.72 OpenFlow 170 Type: OFPT_FLOW_MOD
718 0.441278219 172.31.31.144 -> 172.31.23.72 OpenFlow 170 Type: OFPT_FLOW_MOD
719 0.441281013 172.31.31.144 -> 172.31.23.72 OpenFlow 170 Type: OFPT_FLOW_MOD
720 0.441284201 172.31.31.144 -> 172.31.23.72 OpenFlow 178 Type: OFPT_BARRIER_REQUEST
721 0.441285935 172.31.31.144 -> 172.31.23.72 OpenFlow 170 Type: OFPT_FLOW_MOD
722 0.441287605 172.31.31.144 -> 172.31.23.72 OpenFlow 170 Type: OFPT_FLOW_MOD
723 0.441289510 172.31.31.144 -> 172.31.23.72 OpenFlow 170 Type: OFPT_FLOW_MOD
724 0.441292044 172.31.31.144 -> 172.31.23.72 OpenFlow 170 Type: OFPT_FLOW_MOD
725 0.441293190 172.31.31.144 -> 172.31.23.72 OpenFlow 74 Type: OFPT_BARRIER_REQUEST
726 0.441294504 172.31.31.144 -> 172.31.23.72 OpenFlow 74 Type: OFPT_BARRIER_REQUEST
727 0.441295784 172.31.31.144 -> 172.31.23.72 OpenFlow 170 Type: OFPT_FLOW_MOD
728 0.441298390 172.31.31.144 -> 172.31.23.72 OpenFlow 170 Type: OFPT_FLOW_MOD
729 0.441305687 172.31.23.72 -> 172.31.31.144 TCP 66 45426 → 6633 [ACK] Seq=1575 Ack=1979 Win=213 Len=0 TSval=19358392 TSecr=788265
730 0.441316410 172.31.23.72 -> 172.31.31.144 OpenFlow 74 Type: OFPT_BARRIER_REPLY
731 0.441348336 172.31.23.72 -> 172.31.31.144 TCP 66 45422 → 6633 [ACK] Seq=739 Ack=943 Win=213 Len=0 TSval=19358392 TSecr=788265
732 0.441353693 172.31.23.72 -> 172.31.31.144 OpenFlow 74 Type: OFPT_BARRIER_REPLY
733 0.441360110 172.31.31.144 -> 172.31.23.72 OpenFlow 170 Type: OFPT_FLOW_MOD
734 0.441363002 172.31.31.144 -> 172.31.23.72 OpenFlow 178 Type: OFPT_BARRIER_REQUEST
735 0.441364450 172.31.31.144 -> 172.31.23.72 TCP 66 6633 → 45428 [ACK] Seq=2223 Ack=1995 Win=853 Len=0 TSval=788265 TSecr=19358390
736 0.441367144 172.31.31.144 -> 172.31.23.72 OpenFlow 170 Type: OFPT_FLOW_MOD
737 0.441369008 172.31.31.144 -> 172.31.23.72 OpenFlow 170 Type: OFPT_FLOW_MOD
738 0.441371062 172.31.31.144 -> 172.31.23.72 OpenFlow 74 Type: OFPT_BARRIER_REQUEST
739 0.442570403 172.31.31.144 -> 172.31.23.72 OpenFlow 74 Type: OFPT_BARRIER_REQUEST
740 0.442578711 172.31.31.144 -> 172.31.23.72 OpenFlow 170 Type: OFPT_FLOW_MOD
741 0.442580660 172.31.31.144 -> 172.31.23.72 OpenFlow 394 Type: OFPT_BARRIER_REQUEST
742 0.442582520 172.31.31.144 -> 172.31.23.72 OpenFlow 178 Type: OFPT_BARRIER_REQUEST
743 0.442584116 172.31.31.144 -> 172.31.23.72 OpenFlow 170 Type: OFPT_FLOW_MOD
744 0.442585607 172.31.31.144 -> 172.31.23.72 OpenFlow 170 Type: OFPT_FLOW_MOD
745 0.442592292 172.31.23.72 -> 172.31.31.144 TCP 66 45436 → 6633 [ACK] Seq=985 Ack=1073 Win=213 Len=0 TSval=19358392 TSecr=788265
746 0.442598791 172.31.31.144 -> 172.31.23.72 OpenFlow 170 Type: OFPT_FLOW_MOD
747 0.442600866 172.31.31.144 -> 172.31.23.72 OpenFlow 178 Type: OFPT_BARRIER_REQUEST
748 0.442602539 172.31.31.144 -> 172.31.23.72 OpenFlow 178 Type: OFPT_BARRIER_REQUEST
749 0.442605148 172.31.23.72 -> 172.31.31.144 TCP 66 45436 → 6633 [ACK] Seq=985 Ack=1185 Win=213 Len=0 TSval=19358392 TSecr=788265
750 0.442606659 172.31.31.144 -> 172.31.23.72 OpenFlow 178 Type: OFPT_BARRIER_REQUEST
751 0.442608090 172.31.31.144 -> 172.31.23.72 TCP 66 6633 → 45438 [ACK] Seq=1473 Ack=1489 Win=853 Len=0 TSval=788265 TSecr=19358390
752 0.442610547 172.31.31.144 -> 172.31.23.72 OpenFlow 170 Type: OFPT_FLOW_MOD
753 0.442612064 172.31.31.144 -> 172.31.23.72 TCP 66 6633 → 45424 [ACK] Seq=1547 Ack=1567 Win=853 Len=0 TSval=788265 TSecr=19358390
754 0.442614165 172.31.31.144 -> 172.31.23.72 TCP 66 6633 → 45446 [ACK] Seq=1715 Ack=1735 Win=853 Len=0 TSval=788265 TSecr=19358390
755 0.442616130 172.31.31.144 -> 172.31.23.72 OpenFlow 170 Type: OFPT_FLOW_MOD
756 0.442618468 172.31.31.144 -> 172.31.23.72 OpenFlow 178 Type: OFPT_BARRIER_REQUEST
757 0.442620007 172.31.31.144 -> 172.31.23.72 OpenFlow 170 Type: OFPT_FLOW_MOD
758 0.442622041 172.31.31.144 -> 172.31.23.72 OpenFlow 170 Type: OFPT_FLOW_MOD
759 0.442623640 172.31.31.144 -> 172.31.23.72 OpenFlow 170 Type: OFPT_FLOW_MOD
760 0.442624910 172.31.31.144 -> 172.31.23.72 TCP 66 6633 → 45458 [ACK] Seq=1305 Ack=1075 Win=853 Len=0 TSval=788265 TSecr=19358390
761 0.442627323 172.31.31.144 -> 172.31.23.72 OpenFlow 170 Type: OFPT_FLOW_MOD
762 0.442629136 172.31.31.144 -> 172.31.23.72 OpenFlow 290 Type: OFPT_BARRIER_REQUEST
763 0.442630784 172.31.31.144 -> 172.31.23.72 OpenFlow 74 Type: OFPT_BARRIER_REQUEST
764 0.442632952 172.31.31.144 -> 172.31.23.72 OpenFlow 170 Type: OFPT_FLOW_MOD
765 0.442634558 172.31.31.144 -> 172.31.23.72 OpenFlow 74 Type: OFPT_BARRIER_REQUEST
766 0.442635783 172.31.31.144 -> 172.31.23.72 TCP 66 6633 → 45452 [ACK] Seq=1137 Ack=907 Win=853 Len=0 TSval=788265 TSecr=19358390
767 0.442637871 172.31.31.144 -> 172.31.23.72 OpenFlow 170 Type: OFPT_FLOW_MOD
768 0.442639191 172.31.31.144 -> 172.31.23.72 OpenFlow 170 Type: OFPT_FLOW_MOD
769 0.442640839 172.31.31.144 -> 172.31.23.72 OpenFlow 178 Type: OFPT_BARRIER_REQUEST
770 0.442642606 172.31.31.144 -> 172.31.23.72 OpenFlow 170 Type: OFPT_FLOW_MOD
771 0.442644143 172.31.31.144 -> 172.31.23.72 OpenFlow 74 Type: OFPT_BARRIER_REQUEST
772 0.442645571 172.31.31.144 -> 172.31.23.72 OpenFlow 170 Type: OFPT_FLOW_MOD
773 0.442647322 172.31.31.144 -> 172.31.23.72 OpenFlow 178 Type: OFPT_BARRIER_REQUEST
774 0.442648811 172.31.31.144 -> 172.31.23.72 OpenFlow 170 Type: OFPT_FLOW_MOD
775 0.442650347 172.31.31.144 -> 172.31.23.72 OpenFlow 178 Type: OFPT_BARRIER_REQUEST
776 0.442651799 172.31.31.144 -> 172.31.23.72 OpenFlow 170 Type: OFPT_FLOW_MOD
777 0.442653959 172.31.31.144 -> 172.31.23.72 OpenFlow 178 Type: OFPT_BARRIER_REQUEST
778 0.442655692 172.31.31.144 -> 172.31.23.72 OpenFlow 170 Type: OFPT_FLOW_MOD
779 0.442657551 172.31.31.144 -> 172.31.23.72 OpenFlow 170 Type: OFPT_FLOW_MOD
780 0.442659167 172.31.31.144 -> 172.31.23.72 OpenFlow 178 Type: OFPT_BARRIER_REQUEST
781 0.442672518 172.31.31.144 -> 172.31.23.72 OpenFlow 170 Type: OFPT_FLOW_MOD
782 0.442674247 172.31.31.144 -> 172.31.23.72 OpenFlow 170 Type: OFPT_FLOW_MOD
783 0.442975163 172.31.31.144 -> 172.31.23.72 OpenFlow 74 Type: OFPT_BARRIER_REQUEST
784 0.442978480 172.31.31.144 -> 172.31.23.72 OpenFlow 170 Type: OFPT_FLOW_MOD
785 0.442980344 172.31.31.144 -> 172.31.23.72 OpenFlow 170 Type: OFPT_FLOW_MOD
786 0.442990812 172.31.31.144 -> 172.31.23.72 OpenFlow 170 Type: OFPT_FLOW_MOD
787 0.442992530 172.31.31.144 -> 172.31.23.72 OpenFlow 170 Type: OFPT_FLOW_MOD
788 0.443038728 172.31.31.144 -> 172.31.23.72 TCP 66 6633 → 45444 [ACK] Seq=1379 Ack=1399 Win=853 Len=0 TSval=788266 TSecr=19358390
789 0.443041543 172.31.31.144 -> 172.31.23.72 OpenFlow 74 Type: OFPT_BARRIER_REQUEST
790 0.443427509 172.31.31.144 -> 172.31.23.72 OpenFlow 170 Type: OFPT_FLOW_MOD
791 0.443430389 172.31.31.144 -> 172.31.23.72 OpenFlow 170 Type: OFPT_FLOW_MOD
792 0.443432043 172.31.31.144 -> 172.31.23.72 OpenFlow 170 Type: OFPT_FLOW_MOD
793 0.443433545 172.31.31.144 -> 172.31.23.72 OpenFlow 170 Type: OFPT_FLOW_MOD
794 0.443435314 172.31.31.144 -> 172.31.23.72 OpenFlow 74 Type: OFPT_BARRIER_REQUEST
795 0.443436638 172.31.31.144 -> 172.31.23.72 OpenFlow 170 Type: OFPT_FLOW_MOD
796 0.443438356 172.31.31.144 -> 172.31.23.72 OpenFlow 170 Type: OFPT_FLOW_MOD
797 0.443447429 172.31.31.144 -> 172.31.23.72 OpenFlow 74 Type: OFPT_BARRIER_REQUEST
798 0.443661959 172.31.23.72 -> 172.31.31.144 TCP 66 45452 → 6633 [ACK] Seq=907 Ack=1353 Win=213 Len=0 TSval=19358392 TSecr=788265
799 0.443673551 172.31.23.72 -> 172.31.31.144 OpenFlow 74 Type: OFPT_BARRIER_REPLY
800 0.443701095 172.31.23.72 -> 172.31.31.144 TCP 66 45462 → 6633 [ACK] Seq=1083 Ack=1703 Win=213 Len=0 TSval=19358392 TSecr=788265
801 0.443705184 172.31.23.72 -> 172.31.31.144 OpenFlow 74 Type: OFPT_BARRIER_REPLY
802 0.443734349 172.31.23.72 -> 172.31.31.144 OpenFlow 74 Type: OFPT_BARRIER_REPLY
803 0.443755780 172.31.23.72 -> 172.31.31.144 OpenFlow 74 Type: OFPT_BARRIER_REPLY
804 0.443817350 172.31.23.72 -> 172.31.31.144 TCP 66 45434 → 6633 [ACK] Seq=1575 Ack=2083 Win=213 Len=0 TSval=19358392 TSecr=788265
805 0.443821895 172.31.23.72 -> 172.31.31.144 OpenFlow 74 Type: OFPT_BARRIER_REPLY
806 0.443852043 172.31.31.144 -> 172.31.23.72 OpenFlow 178 Type: OFPT_BARRIER_REQUEST
807 0.443856448 172.31.31.144 -> 172.31.23.72 OpenFlow 170 Type: OFPT_FLOW_MOD
808 0.443858210 172.31.31.144 -> 172.31.23.72 OpenFlow 170 Type: OFPT_FLOW_MOD
809 0.443860466 172.31.31.144 -> 172.31.23.72 OpenFlow 170 Type: OFPT_FLOW_MOD
810 0.443862054 172.31.31.144 -> 172.31.23.72 OpenFlow 170 Type: OFPT_FLOW_MOD
811 0.443865239 172.31.31.144 -> 172.31.23.72 OpenFlow 170 Type: OFPT_FLOW_MOD
812 0.443866912 172.31.31.144 -> 172.31.23.72 OpenFlow 178 Type: OFPT_BARRIER_REQUEST
813 0.443868446 172.31.31.144 -> 172.31.23.72 OpenFlow 178 Type: OFPT_BARRIER_REQUEST
814 0.443876043 172.31.23.72 -> 172.31.31.144 OpenFlow 74 Type: OFPT_BARRIER_REPLY
815 0.443922942 172.31.23.72 -> 172.31.31.144 TCP 66 45444 → 6633 [ACK] Seq=1399 Ack=1595 Win=213 Len=0 TSval=19358392 TSecr=788266
816 0.443928303 172.31.23.72 -> 172.31.31.144 OpenFlow 74 Type: OFPT_BARRIER_REPLY
817 0.443948397 172.31.23.72 -> 172.31.31.144 TCP 66 45438 → 6633 [ACK] Seq=1489 Ack=1689 Win=213 Len=0 TSval=19358392 TSecr=788266
818 0.443952669 172.31.23.72 -> 172.31.31.144 OpenFlow 74 Type: OFPT_BARRIER_REPLY
819 0.443955007 172.31.23.72 -> 172.31.31.144 OpenFlow 90 Type: OFPT_BARRIER_REPLY
820 0.443974962 172.31.23.72 -> 172.31.31.144 TCP 66 45450 → 6633 [ACK] Seq=661 Ack=1111 Win=213 Len=0 TSval=19358392 TSecr=788265
821 0.443979394 172.31.23.72 -> 172.31.31.144 OpenFlow 74 Type: OFPT_BARRIER_REPLY
822 0.444001142 172.31.23.72 -> 172.31.31.144 OpenFlow 74 Type: OFPT_BARRIER_REPLY
823 0.444045880 172.31.31.144 -> 172.31.23.72 OpenFlow 170 Type: OFPT_FLOW_MOD
824 0.444049798 172.31.31.144 -> 172.31.23.72 OpenFlow 170 Type: OFPT_FLOW_MOD
825 0.444051460 172.31.31.144 -> 172.31.23.72 OpenFlow 170 Type: OFPT_FLOW_MOD
826 0.444053203 172.31.31.144 -> 172.31.23.72 OpenFlow 170 Type: OFPT_FLOW_MOD
827 0.444054661 172.31.31.144 -> 172.31.23.72 OpenFlow 178 Type: OFPT_BARRIER_REQUEST
828 0.444056876 172.31.31.144 -> 172.31.23.72 OpenFlow 170 Type: OFPT_FLOW_MOD
829 0.444104613 172.31.23.72 -> 172.31.31.144 TCP 66 45446 → 6633 [ACK] Seq=1735 Ack=1931 Win=213 Len=0 TSval=19358392 TSecr=788265
830 0.444113497 172.31.23.72 -> 172.31.31.144 OpenFlow 74 Type: OFPT_BARRIER_REPLY
831 0.444135767 172.31.23.72 -> 172.31.31.144 OpenFlow 74 Type: OFPT_BARRIER_REPLY
832 0.444175141 172.31.23.72 -> 172.31.31.144 TCP 66 45460 → 6633 [ACK] Seq=837 Ack=1703 Win=213 Len=0 TSval=19358392 TSecr=788265
833 0.444177702 172.31.23.72 -> 172.31.31.144 OpenFlow 74 Type: OFPT_BARRIER_REPLY
834 0.444181915 172.31.23.72 -> 172.31.31.144 OpenFlow 74 Type: OFPT_BARRIER_REPLY
835 0.444203010 172.31.23.72 -> 172.31.31.144 OpenFlow 74 Type: OFPT_BARRIER_REPLY
836 0.444248464 172.31.23.72 -> 172.31.31.144 TCP 66 45454 → 6633 [ACK] Seq=907 Ack=1353 Win=213 Len=0 TSval=19358392 TSecr=788266
837 0.444253116 172.31.23.72 -> 172.31.31.144 OpenFlow 74 Type: OFPT_BARRIER_REPLY
838 0.444272779 172.31.23.72 -> 172.31.31.144 TCP 66 45448 → 6633 [ACK] Seq=1083 Ack=1703 Win=213 Len=0 TSval=19358392 TSecr=788265
839 0.444276871 172.31.23.72 -> 172.31.31.144 OpenFlow 74 Type: OFPT_BARRIER_REPLY
840 0.444299375 172.31.23.72 -> 172.31.31.144 OpenFlow 74 Type: OFPT_BARRIER_REPLY
841 0.444358456 172.31.23.72 -> 172.31.31.144 OpenFlow 74 Type: OFPT_BARRIER_REPLY
842 0.445306499 172.31.31.144 -> 172.31.23.72 OpenFlow 74 Type: OFPT_BARRIER_REQUEST
843 0.445312338 172.31.31.144 -> 172.31.23.72 OpenFlow 170 Type: OFPT_FLOW_MOD
844 0.445314235 172.31.31.144 -> 172.31.23.72 OpenFlow 74 Type: OFPT_BARRIER_REQUEST
845 0.445315895 172.31.31.144 -> 172.31.23.72 OpenFlow 170 Type: OFPT_FLOW_MOD
846 0.445317620 172.31.31.144 -> 172.31.23.72 OpenFlow 170 Type: OFPT_FLOW_MOD
847 0.445319283 172.31.31.144 -> 172.31.23.72 OpenFlow 170 Type: OFPT_FLOW_MOD
848 0.445320880 172.31.31.144 -> 172.31.23.72 OpenFlow 170 Type: OFPT_FLOW_MOD
849 0.445322437 172.31.31.144 -> 172.31.23.72 OpenFlow 178 Type: OFPT_BARRIER_REQUEST
850 0.445323930 172.31.31.144 -> 172.31.23.72 OpenFlow 178 Type: OFPT_BARRIER_REQUEST
851 0.445325260 172.31.31.144 -> 172.31.23.72 OpenFlow 74 Type: OFPT_BARRIER_REQUEST
852 0.445326880 172.31.31.144 -> 172.31.23.72 OpenFlow 170 Type: OFPT_FLOW_MOD
853 0.445334101 172.31.23.72 -> 172.31.31.144 OpenFlow 90 Type: OFPT_BARRIER_REPLY
854 0.445476631 172.31.23.72 -> 172.31.31.144 OpenFlow 82 Type: OFPT_BARRIER_REPLY
855 0.445556978 172.31.23.72 -> 172.31.31.144 OpenFlow 90 Type: OFPT_BARRIER_REPLY
856 0.445559085 172.31.23.72 -> 172.31.31.144 OpenFlow 74 Type: OFPT_BARRIER_REPLY
857 0.446031654 172.31.23.72 -> 172.31.31.144 OpenFlow 74 Type: OFPT_BARRIER_REPLY
858 0.446066900 172.31.23.72 -> 172.31.31.144 TCP 66 45418 → 6633 [ACK] Seq=1345 Ack=2515 Win=213 Len=0 TSval=19358393 TSecr=788266
859 0.446071182 172.31.23.72 -> 172.31.31.144 OpenFlow 74 Type: OFPT_BARRIER_REPLY
860 0.446094980 172.31.23.72 -> 172.31.31.144 TCP 66 45438 → 6633 [ACK] Seq=1497 Ack=1905 Win=213 Len=0 TSval=19358393 TSecr=788266
861 0.446098536 172.31.23.72 -> 172.31.31.144 OpenFlow 74 Type: OFPT_BARRIER_REPLY
862 0.446133865 172.31.23.72 -> 172.31.31.144 TCP 66 45446 → 6633 [ACK] Seq=1743 Ack=2147 Win=213 Len=0 TSval=19358393 TSecr=788266
863 0.446137498 172.31.23.72 -> 172.31.31.144 OpenFlow 74 Type: OFPT_BARRIER_REPLY
864 0.446155957 172.31.23.72 -> 172.31.31.144 OpenFlow 74 Type: OFPT_BARRIER_REPLY
865 0.446178779 172.31.23.72 -> 172.31.31.144 TCP 66 45454 → 6633 [ACK] Seq=915 Ack=1561 Win=213 Len=0 TSval=19358393 TSecr=788266
866 0.446200732 172.31.23.72 -> 172.31.31.144 OpenFlow 74 Type: OFPT_BARRIER_REPLY
867 0.449089199 172.31.31.144 -> 172.31.23.72 TCP 66 6633 → 45426 [ACK] Seq=3059 Ack=1583 Win=853 Len=0 TSval=788267 TSecr=19358390
868 0.452621353 172.31.31.144 -> 172.31.23.72 TCP 66 6633 → 45436 [ACK] Seq=1185 Ack=993 Win=853 Len=0 TSval=788268 TSecr=19358392
869 0.452629104 172.31.31.144 -> 172.31.23.72 TCP 66 6633 → 45462 [ACK] Seq=1703 Ack=1091 Win=853 Len=0 TSval=788268 TSecr=19358390
870 0.452631675 172.31.31.144 -> 172.31.23.72 TCP 66 6633 → 45434 [ACK] Seq=2083 Ack=1583 Win=853 Len=0 TSval=788268 TSecr=19358392
871 0.453053078 172.31.23.72 -> 172.31.31.144 TCP 74 [TCP Retransmission] 45460 → 6633 [PSH, ACK] Seq=837 Ack=1703 Win=213 Len=8 TSval=19358395 TSecr=788265
872 0.453223609 172.31.31.144 -> 172.31.23.72 TCP 66 6633 → 45418 [ACK] Seq=2515 Ack=1337 Win=853 Len=0 TSval=788268 TSecr=19358390
873 0.453537434 172.31.31.144 -> 172.31.23.72 TCP 66 6633 → 45420 [ACK] Seq=3433 Ack=2027 Win=853 Len=0 TSval=788268 TSecr=19358392
874 0.453540157 172.31.31.144 -> 172.31.23.72 OpenFlow 290 Type: OFPT_BARRIER_REQUEST
875 0.453630108 172.31.23.72 -> 172.31.31.144 OpenFlow 74 Type: OFPT_BARRIER_REPLY
876 0.454780662 172.31.23.72 -> 172.31.31.144 OpenFlow 74 Type: OFPT_BARRIER_REPLY
877 0.455463674 172.31.31.144 -> 172.31.23.72 TCP 66 6633 → 45432 [ACK] Seq=2881 Ack=1841 Win=853 Len=0 TSval=788268 TSecr=19358390
878 0.455470778 172.31.31.144 -> 172.31.23.72 TCP 66 6633 → 45460 [ACK] Seq=1703 Ack=845 Win=853 Len=0 TSval=788268 TSecr=19358390
879 0.455473256 172.31.31.144 -> 172.31.23.72 TCP 66 6633 → 45448 [ACK] Seq=1703 Ack=1091 Win=853 Len=0 TSval=788268 TSecr=19358390
880 0.455475749 172.31.31.144 -> 172.31.23.72 TCP 66 6633 → 45422 [ACK] Seq=1375 Ack=755 Win=853 Len=0 TSval=788268 TSecr=19358392
881 0.455477969 172.31.31.144 -> 172.31.23.72 TCP 66 6633 → 45426 [ACK] Seq=3059 Ack=1615 Win=853 Len=0 TSval=788268 TSecr=19358392
882 0.456913319 172.31.31.144 -> 172.31.23.72 TCP 66 6633 → 45438 [ACK] Seq=1905 Ack=1505 Win=853 Len=0 TSval=788268 TSecr=19358392
883 0.456920829 172.31.31.144 -> 172.31.23.72 TCP 66 6633 → 45418 [ACK] Seq=2515 Ack=1353 Win=853 Len=0 TSval=788268 TSecr=19358392
884 0.456923164 172.31.31.144 -> 172.31.23.72 TCP 66 6633 → 45446 [ACK] Seq=2147 Ack=1751 Win=853 Len=0 TSval=788268 TSecr=19358392
885 0.456925359 172.31.31.144 -> 172.31.23.72 TCP 66 6633 → 45458 [ACK] Seq=1945 Ack=1091 Win=853 Len=0 TSval=788268 TSecr=19358392
886 0.461640101 172.31.31.144 -> 172.31.23.72 TCP 78 [TCP Dup ACK 878#1] 6633 → 45460 [ACK] Seq=1703 Ack=845 Win=853 Len=0 TSval=788270 TSecr=19358395 SLE=837 SRE=845
887 0.462712069 172.31.31.144 -> 172.31.23.72 TCP 66 6633 → 45430 [ACK] Seq=2507 Ack=1271 Win=853 Len=0 TSval=788270 TSecr=19358393
888 0.476998422 172.31.31.144 -> 172.31.23.72 TCP 66 6633 → 45428 [ACK] Seq=2223 Ack=2003 Win=853 Len=0 TSval=788276 TSecr=19358390
889 0.477004288 172.31.31.144 -> 172.31.23.72 TCP 66 6633 → 45442 [ACK] Seq=1111 Ack=915 Win=853 Len=0 TSval=788276 TSecr=19358391
890 0.477025834 172.31.23.72 -> 172.31.31.144 TCP 66 45428 → 6633 [ACK] Seq=2003 Ack=2223 Win=213 Len=0 TSval=19358401 TSecr=788265
891 0.481044953 172.31.23.72 -> 172.31.31.144 TCP 66 45452 → 6633 [ACK] Seq=915 Ack=1457 Win=213 Len=0 TSval=19358402 TSecr=788266
892 0.486482882 172.31.31.144 -> 172.31.23.72 TCP 66 6633 → 45422 [ACK] Seq=1375 Ack=763 Win=853 Len=0 TSval=788278 TSecr=19358393
893 0.486489997 172.31.31.144 -> 172.31.23.72 TCP 66 6633 → 45454 [ACK] Seq=1561 Ack=915 Win=853 Len=0 TSval=788278 TSecr=19358392
894 0.486493011 172.31.31.144 -> 172.31.23.72 TCP 66 6633 → 45452 [ACK] Seq=1457 Ack=915 Win=853 Len=0 TSval=788278 TSecr=19358392
895 0.486495371 172.31.31.144 -> 172.31.23.72 TCP 66 6633 → 45444 [ACK] Seq=1595 Ack=1407 Win=853 Len=0 TSval=788278 TSecr=19358392
896 0.486498100 172.31.31.144 -> 172.31.23.72 TCP 66 6633 → 45432 [ACK] Seq=2881 Ack=1857 Win=853 Len=0 TSval=788278 TSecr=19358393
897 0.486500766 172.31.31.144 -> 172.31.23.72 TCP 66 6633 → 45426 [ACK] Seq=3059 Ack=1623 Win=853 Len=0 TSval=788278 TSecr=19358393
898 0.486502964 172.31.31.144 -> 172.31.23.72 TCP 66 6633 → 45420 [ACK] Seq=3433 Ack=2035 Win=853 Len=0 TSval=788278 TSecr=19358393
899 0.486505732 172.31.31.144 -> 172.31.23.72 TCP 66 6633 → 45450 [ACK] Seq=1111 Ack=669 Win=853 Len=0 TSval=788278 TSecr=19358392
900 0.492746787 172.31.31.144 -> 172.31.23.72 TCP 66 6633 → 45430 [ACK] Seq=2507 Ack=1279 Win=853 Len=0 TSval=788280 TSecr=19358395
