  1 0.000000000 172.31.31.144 -> 172.31.23.72 TCP 90 6633 → 33630 [PSH, ACK] Seq=1 Ack=1 Win=853 Len=24 TSval=1244136 TSecr=26082907
  2 0.000020638 172.31.31.144 -> 172.31.23.72 TCP 106 6633 → 33630 [PSH, ACK] Seq=25 Ack=1 Win=853 Len=40 TSval=1244136 TSecr=26082907
  3 0.000123024 172.31.31.144 -> 172.31.23.72 TCP 187 6633 → 33668 [PSH, ACK] Seq=1 Ack=1 Win=853 Len=121 TSval=1244136 TSecr=26083131
  4 0.000157011 172.31.31.144 -> 172.31.23.72 TCP 187 6633 → 33668 [PSH, ACK] Seq=122 Ack=1 Win=853 Len=121 TSval=1244136 TSecr=26083131
  5 0.000223965 172.31.31.144 -> 172.31.23.72 TCP 187 6633 → 33668 [PSH, ACK] Seq=243 Ack=1 Win=853 Len=121 TSval=1244136 TSecr=26083131
  6 0.000278456 172.31.31.144 -> 172.31.23.72 TCP 187 6633 → 33668 [PSH, ACK] Seq=364 Ack=1 Win=853 Len=121 TSval=1244136 TSecr=26083131
  7 0.000333223 172.31.31.144 -> 172.31.23.72 TCP 187 6633 → 33668 [PSH, ACK] Seq=485 Ack=1 Win=853 Len=121 TSval=1244136 TSecr=26083131
  8 0.000359469 172.31.23.72 -> 172.31.31.144 OpenFlow 82 Type: OFPT_MULTIPART_REPLY, OFPMP_GROUP
  9 0.000384256 172.31.23.72 -> 172.31.31.144 OpenFlow 98 Type: OFPT_MULTIPART_REPLY, OFPMP_METER
 10 0.000426664 172.31.31.144 -> 172.31.23.72 TCP 187 6633 → 33668 [PSH, ACK] Seq=606 Ack=1 Win=853 Len=121 TSval=1244136 TSecr=26083131
 11 0.000460024 172.31.31.144 -> 172.31.23.72 TCP 187 6633 → 33668 [PSH, ACK] Seq=727 Ack=1 Win=853 Len=121 TSval=1244136 TSecr=26083131
 12 0.000507174 172.31.31.144 -> 172.31.23.72 TCP 187 6633 → 33668 [PSH, ACK] Seq=848 Ack=1 Win=853 Len=121 TSval=1244136 TSecr=26083131
 13 0.000722781 172.31.31.144 -> 172.31.23.72 TCP 66 6633 → 33630 [ACK] Seq=65 Ack=17 Win=853 Len=0 TSval=1244136 TSecr=26083237
 14 0.000738343 172.31.31.144 -> 172.31.23.72 TCP 66 6633 → 33630 [ACK] Seq=65 Ack=49 Win=853 Len=0 TSval=1244136 TSecr=26083237
 15 0.000848278 172.31.23.72 -> 172.31.31.144 TCP 66 33668 → 6633 [ACK] Seq=1 Ack=969 Win=213 Len=0 TSval=26083237 TSecr=1244136
 16 0.000963065 172.31.23.72 -> 172.31.31.144 OpenFlow 189 Type: OFPT_PACKET_IN
 17 0.000989629 172.31.23.72 -> 172.31.31.144 OpenFlow 189 Type: OFPT_PACKET_IN
 18 0.001035285 172.31.23.72 -> 172.31.31.144 OpenFlow 189 Type: OFPT_PACKET_IN
 19 0.001056729 172.31.23.72 -> 172.31.31.144 OpenFlow 189 Type: OFPT_PACKET_IN
 20 0.001066308 172.31.23.72 -> 172.31.31.144 OpenFlow 189 Type: OFPT_PACKET_IN
 21 0.001106839 172.31.23.72 -> 172.31.31.144 OpenFlow 189 Type: OFPT_PACKET_IN
 22 0.001208881 172.31.31.144 -> 172.31.23.72 TCP 66 6633 → 33666 [ACK] Seq=1 Ack=124 Win=853 Len=0 TSval=1244136 TSecr=26083237
 23 0.001249525 172.31.31.144 -> 172.31.23.72 TCP 66 6633 → 33666 [ACK] Seq=1 Ack=247 Win=853 Len=0 TSval=1244136 TSecr=26083237
 24 0.001274769 172.31.31.144 -> 172.31.23.72 TCP 66 6633 → 33670 [ACK] Seq=1 Ack=124 Win=853 Len=0 TSval=1244136 TSecr=26083237
 25 0.001295855 172.31.31.144 -> 172.31.23.72 TCP 66 6633 → 33670 [ACK] Seq=1 Ack=247 Win=853 Len=0 TSval=1244136 TSecr=26083237
 26 0.001355571 172.31.31.144 -> 172.31.23.72 TCP 66 6633 → 33658 [ACK] Seq=1 Ack=124 Win=853 Len=0 TSval=1244136 TSecr=26083237
 27 0.001358051 172.31.31.144 -> 172.31.23.72 TCP 66 6633 → 33658 [ACK] Seq=1 Ack=247 Win=853 Len=0 TSval=1244136 TSecr=26083237
 28 0.100943415 172.31.31.144 -> 172.31.23.72 TCP 90 6633 → 33632 [PSH, ACK] Seq=1 Ack=1 Win=853 Len=24 TSval=1244161 TSecr=26082918
 29 0.100962249 172.31.31.144 -> 172.31.23.72 TCP 90 6633 → 33636 [PSH, ACK] Seq=1 Ack=1 Win=853 Len=24 TSval=1244161 TSecr=26082936
 30 0.100965032 172.31.31.144 -> 172.31.23.72 TCP 90 6633 → 33634 [PSH, ACK] Seq=1 Ack=1 Win=853 Len=24 TSval=1244161 TSecr=26082926
 31 0.100967423 172.31.31.144 -> 172.31.23.72 TCP 106 6633 → 33636 [PSH, ACK] Seq=25 Ack=1 Win=853 Len=40 TSval=1244161 TSecr=26082936
 32 0.100970237 172.31.31.144 -> 172.31.23.72 TCP 106 6633 → 33632 [PSH, ACK] Seq=25 Ack=1 Win=853 Len=40 TSval=1244161 TSecr=26082918
 33 0.100971911 172.31.31.144 -> 172.31.23.72 TCP 106 6633 → 33634 [PSH, ACK] Seq=25 Ack=1 Win=853 Len=40 TSval=1244161 TSecr=26082926
 34 0.100981852 172.31.31.144 -> 172.31.23.72 TCP 187 6633 → 33656 [PSH, ACK] Seq=1 Ack=1 Win=853 Len=121 TSval=1244161 TSecr=26083050
 35 0.100995861 172.31.31.144 -> 172.31.23.72 TCP 187 6633 → 33656 [PSH, ACK] Seq=122 Ack=1 Win=853 Len=121 TSval=1244161 TSecr=26083050
 36 0.101053668 172.31.31.144 -> 172.31.23.72 TCP 187 6633 → 33656 [PSH, ACK] Seq=243 Ack=1 Win=853 Len=121 TSval=1244161 TSecr=26083050
 37 0.101114248 172.31.31.144 -> 172.31.23.72 TCP 187 6633 → 33656 [PSH, ACK] Seq=364 Ack=1 Win=853 Len=121 TSval=1244161 TSecr=26083050
 38 0.101171829 172.31.31.144 -> 172.31.23.72 TCP 187 6633 → 33656 [PSH, ACK] Seq=485 Ack=1 Win=853 Len=121 TSval=1244161 TSecr=26083050
 39 0.101262188 172.31.31.144 -> 172.31.23.72 TCP 187 6633 → 33656 [PSH, ACK] Seq=606 Ack=1 Win=853 Len=121 TSval=1244161 TSecr=26083050
 40 0.101311095 172.31.31.144 -> 172.31.23.72 TCP 187 6633 → 33652 [PSH, ACK] Seq=1 Ack=1 Win=853 Len=121 TSval=1244161 TSecr=26083028
 41 0.101356400 172.31.31.144 -> 172.31.23.72 TCP 187 6633 → 33652 [PSH, ACK] Seq=122 Ack=1 Win=853 Len=121 TSval=1244161 TSecr=26083028
 42 0.101390396 172.31.31.144 -> 172.31.23.72 TCP 187 6633 → 33652 [PSH, ACK] Seq=243 Ack=1 Win=853 Len=121 TSval=1244161 TSecr=26083028
 43 0.101418430 172.31.23.72 -> 172.31.31.144 TCP 66 33656 → 6633 [ACK] Seq=1 Ack=727 Win=213 Len=0 TSval=26083262 TSecr=1244161
 44 0.101450134 172.31.31.144 -> 172.31.23.72 TCP 187 6633 → 33652 [PSH, ACK] Seq=364 Ack=1 Win=853 Len=121 TSval=1244161 TSecr=26083028
 45 0.101499242 172.31.31.144 -> 172.31.23.72 TCP 187 6633 → 33652 [PSH, ACK] Seq=485 Ack=1 Win=853 Len=121 TSval=1244161 TSecr=26083028
 46 0.101558336 172.31.31.144 -> 172.31.23.72 TCP 187 6633 → 33652 [PSH, ACK] Seq=606 Ack=1 Win=853 Len=121 TSval=1244161 TSecr=26083028
 47 0.101606550 172.31.31.144 -> 172.31.23.72 TCP 187 6633 → 33652 [PSH, ACK] Seq=727 Ack=1 Win=853 Len=121 TSval=1244161 TSecr=26083028
 48 0.101654309 172.31.31.144 -> 172.31.23.72 TCP 187 6633 → 33652 [PSH, ACK] Seq=848 Ack=1 Win=853 Len=121 TSval=1244161 TSecr=26083028
 49 0.101762338 172.31.31.144 -> 172.31.23.72 TCP 187 6633 → 33636 [PSH, ACK] Seq=65 Ack=1 Win=853 Len=121 TSval=1244161 TSecr=26082936
 50 0.101812868 172.31.31.144 -> 172.31.23.72 TCP 187 6633 → 33636 [PSH, ACK] Seq=186 Ack=1 Win=853 Len=121 TSval=1244161 TSecr=26082936
 51 0.101853786 172.31.31.144 -> 172.31.23.72 TCP 187 6633 → 33636 [PSH, ACK] Seq=307 Ack=1 Win=853 Len=121 TSval=1244161 TSecr=26082936
 52 0.101876815 172.31.23.72 -> 172.31.31.144 TCP 66 33652 → 6633 [ACK] Seq=1 Ack=969 Win=213 Len=0 TSval=26083262 TSecr=1244161
 53 0.101915495 172.31.31.144 -> 172.31.23.72 TCP 187 6633 → 33636 [PSH, ACK] Seq=428 Ack=1 Win=853 Len=121 TSval=1244161 TSecr=26082936
 54 0.101961126 172.31.23.72 -> 172.31.31.144 OpenFlow 82 Type: OFPT_MULTIPART_REPLY, OFPMP_GROUP
 55 0.101971827 172.31.31.144 -> 172.31.23.72 OpenFlow 187 Type: OFPT_PACKET_OUT
 56 0.101989242 172.31.23.72 -> 172.31.31.144 OpenFlow 82 Type: OFPT_MULTIPART_REPLY, OFPMP_GROUP_DESC
 57 0.102007500 172.31.31.144 -> 172.31.23.72 OpenFlow 187 Type: OFPT_PACKET_OUT
 58 0.102014273 172.31.23.72 -> 172.31.31.144 OpenFlow 82 Type: OFPT_MULTIPART_REPLY, OFPMP_METER
 59 0.102076577 172.31.31.144 -> 172.31.23.72 OpenFlow 187 Type: OFPT_PACKET_OUT
 60 0.102127284 172.31.31.144 -> 172.31.23.72 OpenFlow 187 Type: OFPT_PACKET_OUT
 61 0.102202003 172.31.31.144 -> 172.31.23.72 TCP 66 6633 → 33636 [ACK] Seq=1033 Ack=17 Win=853 Len=0 TSval=1244161 TSecr=26083262
 62 0.102207862 172.31.31.144 -> 172.31.23.72 TCP 187 6633 → 33650 [PSH, ACK] Seq=1 Ack=1 Win=853 Len=121 TSval=1244161 TSecr=26083017
 63 0.102238849 172.31.31.144 -> 172.31.23.72 TCP 187 6633 → 33650 [PSH, ACK] Seq=122 Ack=1 Win=853 Len=121 TSval=1244161 TSecr=26083017
 64 0.102313214 172.31.23.72 -> 172.31.31.144 TCP 66 33636 → 6633 [ACK] Seq=49 Ack=1033 Win=213 Len=0 TSval=26083262 TSecr=1244161
 65 0.102324214 172.31.31.144 -> 172.31.23.72 TCP 66 6633 → 33636 [ACK] Seq=1033 Ack=33 Win=853 Len=0 TSval=1244161 TSecr=26083262
 66 0.102326768 172.31.31.144 -> 172.31.23.72 TCP 187 6633 → 33650 [PSH, ACK] Seq=243 Ack=1 Win=853 Len=121 TSval=1244161 TSecr=26083017
 67 0.102329203 172.31.31.144 -> 172.31.23.72 TCP 66 6633 → 33636 [ACK] Seq=1033 Ack=49 Win=853 Len=0 TSval=1244161 TSecr=26083262
 68 0.102330749 172.31.31.144 -> 172.31.23.72 TCP 187 6633 → 33650 [PSH, ACK] Seq=364 Ack=1 Win=853 Len=121 TSval=1244161 TSecr=26083017
 69 0.102382176 172.31.31.144 -> 172.31.23.72 TCP 187 6633 → 33650 [PSH, ACK] Seq=485 Ack=1 Win=853 Len=121 TSval=1244161 TSecr=26083017
 70 0.102414595 172.31.23.72 -> 172.31.31.144 OpenFlow 189 Type: OFPT_PACKET_IN
 71 0.102445006 172.31.31.144 -> 172.31.23.72 OpenFlow 187 Type: OFPT_PACKET_OUT
 72 0.102450959 172.31.23.72 -> 172.31.31.144 OpenFlow 189 Type: OFPT_PACKET_IN
 73 0.102490102 172.31.31.144 -> 172.31.23.72 OpenFlow 187 Type: OFPT_PACKET_OUT
 74 0.102546516 172.31.31.144 -> 172.31.23.72 OpenFlow 187 Type: OFPT_PACKET_OUT
 75 0.102601725 172.31.31.144 -> 172.31.23.72 OpenFlow 187 Type: OFPT_PACKET_OUT
 76 0.102661219 172.31.31.144 -> 172.31.23.72 TCP 66 6633 → 33650 [ACK] Seq=1090 Ack=124 Win=853 Len=0 TSval=1244161 TSecr=26083262
 77 0.102666714 172.31.31.144 -> 172.31.23.72 OpenFlow 187 Type: OFPT_PACKET_OUT
 78 0.102730876 172.31.31.144 -> 172.31.23.72 TCP 187 6633 → 33640 [PSH, ACK] Seq=1 Ack=1 Win=853 Len=121 TSval=1244161 TSecr=26082955
 79 0.102796589 172.31.31.144 -> 172.31.23.72 TCP 187 6633 → 33640 [PSH, ACK] Seq=122 Ack=1 Win=853 Len=121 TSval=1244161 TSecr=26082955
 80 0.102843171 172.31.31.144 -> 172.31.23.72 TCP 187 6633 → 33640 [PSH, ACK] Seq=243 Ack=1 Win=853 Len=121 TSval=1244161 TSecr=26082955
 81 0.102879811 172.31.31.144 -> 172.31.23.72 TCP 187 6633 → 33640 [PSH, ACK] Seq=364 Ack=1 Win=853 Len=121 TSval=1244161 TSecr=26082955
 82 0.102930467 172.31.31.144 -> 172.31.23.72 TCP 187 6633 → 33640 [PSH, ACK] Seq=485 Ack=1 Win=853 Len=121 TSval=1244161 TSecr=26082955
 83 0.102961196 172.31.23.72 -> 172.31.31.144 TCP 66 33650 → 6633 [ACK] Seq=247 Ack=1211 Win=213 Len=0 TSval=26083263 TSecr=1244161
 84 0.102991840 172.31.31.144 -> 172.31.23.72 TCP 187 6633 → 33640 [PSH, ACK] Seq=606 Ack=1 Win=853 Len=121 TSval=1244161 TSecr=26082955
 85 0.103043254 172.31.31.144 -> 172.31.23.72 TCP 187 6633 → 33640 [PSH, ACK] Seq=727 Ack=1 Win=853 Len=121 TSval=1244161 TSecr=26082955
 86 0.103050041 172.31.23.72 -> 172.31.31.144 OpenFlow 189 Type: OFPT_PACKET_IN
 87 0.103071454 172.31.23.72 -> 172.31.31.144 OpenFlow 189 Type: OFPT_PACKET_IN
 88 0.103114285 172.31.31.144 -> 172.31.23.72 OpenFlow 187 Type: OFPT_PACKET_OUT
 89 0.103162011 172.31.31.144 -> 172.31.23.72 OpenFlow 187 Type: OFPT_PACKET_OUT
 90 0.103206774 172.31.31.144 -> 172.31.23.72 OpenFlow 187 Type: OFPT_PACKET_OUT
 91 0.103259227 172.31.31.144 -> 172.31.23.72 TCP 66 6633 → 33640 [ACK] Seq=1211 Ack=124 Win=853 Len=0 TSval=1244162 TSecr=26083263
 92 0.103347110 172.31.31.144 -> 172.31.23.72 TCP 66 6633 → 33640 [ACK] Seq=1211 Ack=247 Win=853 Len=0 TSval=1244162 TSecr=26083263
 93 0.103351929 172.31.31.144 -> 172.31.23.72 TCP 187 6633 → 33634 [PSH, ACK] Seq=65 Ack=1 Win=853 Len=121 TSval=1244162 TSecr=26082926
 94 0.103378104 172.31.31.144 -> 172.31.23.72 TCP 187 6633 → 33634 [PSH, ACK] Seq=186 Ack=1 Win=853 Len=121 TSval=1244162 TSecr=26082926
 95 0.103429248 172.31.31.144 -> 172.31.23.72 TCP 187 6633 → 33634 [PSH, ACK] Seq=307 Ack=1 Win=853 Len=121 TSval=1244162 TSecr=26082926
 96 0.103489360 172.31.31.144 -> 172.31.23.72 TCP 187 6633 → 33634 [PSH, ACK] Seq=428 Ack=1 Win=853 Len=121 TSval=1244162 TSecr=26082926
 97 0.103544988 172.31.31.144 -> 172.31.23.72 TCP 187 6633 → 33634 [PSH, ACK] Seq=549 Ack=1 Win=853 Len=121 TSval=1244162 TSecr=26082926
 98 0.103596257 172.31.31.144 -> 172.31.23.72 TCP 187 6633 → 33634 [PSH, ACK] Seq=670 Ack=1 Win=853 Len=121 TSval=1244162 TSecr=26082926
 99 0.103603114 172.31.23.72 -> 172.31.31.144 TCP 66 33640 → 6633 [ACK] Seq=247 Ack=1211 Win=213 Len=0 TSval=26083263 TSecr=1244161
100 0.103667341 172.31.31.144 -> 172.31.23.72 TCP 187 6633 → 33634 [PSH, ACK] Seq=791 Ack=1 Win=853 Len=121 TSval=1244162 TSecr=26082926
101 0.103685084 172.31.23.72 -> 172.31.31.144 OpenFlow 189 Type: OFPT_PACKET_IN
102 0.103733917 172.31.31.144 -> 172.31.23.72 OpenFlow 187 Type: OFPT_PACKET_OUT
103 0.103740220 172.31.23.72 -> 172.31.31.144 OpenFlow 237 Type: OFPT_MULTIPART_REPLY, OFPMP_METER
104 0.103886868 172.31.31.144 -> 172.31.23.72 TCP 187 6633 → 33660 [PSH, ACK] Seq=1 Ack=1 Win=853 Len=121 TSval=1244162 TSecr=26083077
105 0.103945382 172.31.31.144 -> 172.31.23.72 TCP 187 6633 → 33660 [PSH, ACK] Seq=122 Ack=1 Win=853 Len=121 TSval=1244162 TSecr=26083077
106 0.103949853 172.31.31.144 -> 172.31.23.72 OpenFlow 308 Type: OFPT_PACKET_OUT
107 0.103990429 172.31.31.144 -> 172.31.23.72 TCP 187 6633 → 33660 [PSH, ACK] Seq=243 Ack=1 Win=853 Len=121 TSval=1244162 TSecr=26083077
108 0.104087941 172.31.31.144 -> 172.31.23.72 TCP 187 6633 → 33660 [PSH, ACK] Seq=364 Ack=1 Win=853 Len=121 TSval=1244162 TSecr=26083077
109 0.104143298 172.31.31.144 -> 172.31.23.72 TCP 187 6633 → 33660 [PSH, ACK] Seq=485 Ack=1 Win=853 Len=121 TSval=1244162 TSecr=26083077
110 0.104156820 172.31.23.72 -> 172.31.31.144 OpenFlow 189 Type: OFPT_PACKET_IN
111 0.104187593 172.31.23.72 -> 172.31.31.144 OpenFlow 189 Type: OFPT_PACKET_IN
112 0.104216821 172.31.31.144 -> 172.31.23.72 OpenFlow 187 Type: OFPT_PACKET_OUT
113 0.104241344 172.31.31.144 -> 172.31.23.72 OpenFlow 187 Type: OFPT_PACKET_OUT
114 0.104301546 172.31.31.144 -> 172.31.23.72 OpenFlow 187 Type: OFPT_PACKET_OUT
115 0.104342532 172.31.31.144 -> 172.31.23.72 OpenFlow 187 Type: OFPT_PACKET_OUT
116 0.104414418 172.31.31.144 -> 172.31.23.72 OpenFlow 187 Type: OFPT_PACKET_OUT
117 0.104438048 172.31.31.144 -> 172.31.23.72 TCP 66 6633 → 33660 [ACK] Seq=1211 Ack=124 Win=853 Len=0 TSval=1244162 TSecr=26083263
118 0.104451161 172.31.31.144 -> 172.31.23.72 TCP 66 6633 → 33660 [ACK] Seq=1211 Ack=247 Win=853 Len=0 TSval=1244162 TSecr=26083263
119 0.104479485 172.31.31.144 -> 172.31.23.72 TCP 187 6633 → 33654 [PSH, ACK] Seq=1 Ack=1 Win=853 Len=121 TSval=1244162 TSecr=26083039
120 0.104517876 172.31.31.144 -> 172.31.23.72 TCP 187 6633 → 33654 [PSH, ACK] Seq=122 Ack=1 Win=853 Len=121 TSval=1244162 TSecr=26083039
121 0.104577330 172.31.31.144 -> 172.31.23.72 TCP 187 6633 → 33654 [PSH, ACK] Seq=243 Ack=1 Win=853 Len=121 TSval=1244162 TSecr=26083039
122 0.104640150 172.31.31.144 -> 172.31.23.72 TCP 187 6633 → 33654 [PSH, ACK] Seq=364 Ack=1 Win=853 Len=121 TSval=1244162 TSecr=26083039
123 0.104690339 172.31.23.72 -> 172.31.31.144 TCP 66 33660 → 6633 [ACK] Seq=247 Ack=1211 Win=213 Len=0 TSval=26083263 TSecr=1244162
124 0.104731231 172.31.31.144 -> 172.31.23.72 TCP 187 6633 → 33654 [PSH, ACK] Seq=485 Ack=1 Win=853 Len=121 TSval=1244162 TSecr=26083039
125 0.104749629 172.31.31.144 -> 172.31.23.72 TCP 187 6633 → 33654 [PSH, ACK] Seq=606 Ack=1 Win=853 Len=121 TSval=1244162 TSecr=26083039
126 0.104786152 172.31.23.72 -> 172.31.31.144 OpenFlow 189 Type: OFPT_PACKET_IN
127 0.104807603 172.31.31.144 -> 172.31.23.72 OpenFlow 187 Type: OFPT_PACKET_OUT
128 0.104812323 172.31.23.72 -> 172.31.31.144 OpenFlow 435 Type: OFPT_PACKET_IN
129 0.104858372 172.31.31.144 -> 172.31.23.72 OpenFlow 187 Type: OFPT_PACKET_OUT
130 0.104942117 172.31.31.144 -> 172.31.23.72 OpenFlow 187 Type: OFPT_PACKET_OUT
131 0.104966734 172.31.31.144 -> 172.31.23.72 OpenFlow 187 Type: OFPT_PACKET_OUT
132 0.105035563 172.31.31.144 -> 172.31.23.72 OpenFlow 187 Type: OFPT_PACKET_OUT
133 0.105096489 172.31.31.144 -> 172.31.23.72 TCP 66 6633 → 33654 [ACK] Seq=969 Ack=124 Win=853 Len=0 TSval=1244162 TSecr=26083263
134 0.105101646 172.31.31.144 -> 172.31.23.72 TCP 66 6633 → 33654 [ACK] Seq=969 Ack=493 Win=853 Len=0 TSval=1244162 TSecr=26083263
135 0.105105174 172.31.31.144 -> 172.31.23.72 OpenFlow 187 Type: OFPT_PACKET_OUT
136 0.105129893 172.31.31.144 -> 172.31.23.72 OpenFlow 187 Type: OFPT_PACKET_OUT
137 0.105224302 172.31.31.144 -> 172.31.23.72 OpenFlow 187 Type: OFPT_PACKET_OUT
138 0.105262880 172.31.23.72 -> 172.31.31.144 OpenFlow 189 Type: OFPT_PACKET_IN
139 0.105286393 172.31.31.144 -> 172.31.23.72 TCP 187 6633 → 33646 [PSH, ACK] Seq=1 Ack=1 Win=853 Len=121 TSval=1244162 TSecr=26082997
140 0.105293457 172.31.23.72 -> 172.31.31.144 OpenFlow 189 Type: OFPT_PACKET_IN
141 0.105352634 172.31.31.144 -> 172.31.23.72 TCP 187 6633 → 33646 [PSH, ACK] Seq=122 Ack=1 Win=853 Len=121 TSval=1244162 TSecr=26082997
142 0.105414494 172.31.31.144 -> 172.31.23.72 TCP 187 6633 → 33646 [PSH, ACK] Seq=243 Ack=1 Win=853 Len=121 TSval=1244162 TSecr=26082997
143 0.105516210 172.31.31.144 -> 172.31.23.72 TCP 187 6633 → 33646 [PSH, ACK] Seq=364 Ack=1 Win=853 Len=121 TSval=1244162 TSecr=26082997
144 0.105520918 172.31.31.144 -> 172.31.23.72 TCP 66 6633 → 33666 [ACK] Seq=727 Ack=493 Win=853 Len=0 TSval=1244162 TSecr=26083263
145 0.105560608 172.31.31.144 -> 172.31.23.72 TCP 187 6633 → 33646 [PSH, ACK] Seq=485 Ack=1 Win=853 Len=121 TSval=1244162 TSecr=26082997
146 0.105566320 172.31.23.72 -> 172.31.31.144 OpenFlow 189 Type: OFPT_PACKET_IN
147 0.105678172 172.31.31.144 -> 172.31.23.72 OpenFlow 187 Type: OFPT_PACKET_OUT
148 0.105685065 172.31.23.72 -> 172.31.31.144 OpenFlow 681 Type: OFPT_PACKET_IN
149 0.105691016 172.31.31.144 -> 172.31.23.72 OpenFlow 187 Type: OFPT_PACKET_OUT
150 0.105754486 172.31.31.144 -> 172.31.23.72 OpenFlow 187 Type: OFPT_PACKET_OUT
151 0.105776228 172.31.31.144 -> 172.31.23.72 OpenFlow 187 Type: OFPT_PACKET_OUT
152 0.105835881 172.31.31.144 -> 172.31.23.72 OpenFlow 187 Type: OFPT_PACKET_OUT
153 0.105903325 172.31.31.144 -> 172.31.23.72 TCP 187 6633 → 33644 [PSH, ACK] Seq=1 Ack=1 Win=853 Len=121 TSval=1244162 TSecr=26082976
154 0.105933014 172.31.31.144 -> 172.31.23.72 TCP 187 6633 → 33644 [PSH, ACK] Seq=122 Ack=1 Win=853 Len=121 TSval=1244162 TSecr=26082976
155 0.105989841 172.31.31.144 -> 172.31.23.72 TCP 187 6633 → 33644 [PSH, ACK] Seq=243 Ack=1 Win=853 Len=121 TSval=1244162 TSecr=26082976
156 0.106062712 172.31.31.144 -> 172.31.23.72 TCP 187 6633 → 33644 [PSH, ACK] Seq=364 Ack=1 Win=853 Len=121 TSval=1244162 TSecr=26082976
157 0.106067091 172.31.31.144 -> 172.31.23.72 TCP 66 6633 → 33646 [ACK] Seq=1211 Ack=739 Win=853 Len=0 TSval=1244162 TSecr=26083263
158 0.106115617 172.31.31.144 -> 172.31.23.72 TCP 187 6633 → 33644 [PSH, ACK] Seq=485 Ack=1 Win=853 Len=121 TSval=1244162 TSecr=26082976
159 0.106124421 172.31.23.72 -> 172.31.31.144 TCP 66 33646 → 6633 [ACK] Seq=739 Ack=1211 Win=213 Len=0 TSval=26083263 TSecr=1244162
160 0.106169028 172.31.31.144 -> 172.31.23.72 TCP 187 6633 → 33644 [PSH, ACK] Seq=606 Ack=1 Win=853 Len=121 TSval=1244162 TSecr=26082976
161 0.106212168 172.31.23.72 -> 172.31.31.144 OpenFlow 189 Type: OFPT_PACKET_IN
162 0.106234401 172.31.23.72 -> 172.31.31.144 OpenFlow 189 Type: OFPT_PACKET_IN
163 0.106419217 172.31.31.144 -> 172.31.23.72 TCP 66 6633 → 33644 [ACK] Seq=727 Ack=124 Win=853 Len=0 TSval=1244162 TSecr=26083263
164 0.106450888 172.31.31.144 -> 172.31.23.72 TCP 66 6633 → 33644 [ACK] Seq=727 Ack=247 Win=853 Len=0 TSval=1244162 TSecr=26083263
165 0.106546032 172.31.23.72 -> 172.31.31.144 OpenFlow 189 Type: OFPT_PACKET_IN
166 0.106569760 172.31.23.72 -> 172.31.31.144 OpenFlow 435 Type: OFPT_PACKET_IN
167 0.106608134 172.31.23.72 -> 172.31.31.144 OpenFlow 114 Type: OFPT_MULTIPART_REPLY, OFPMP_METER
168 0.106622245 172.31.23.72 -> 172.31.31.144 OpenFlow 189 Type: OFPT_PACKET_IN
169 0.106648219 172.31.23.72 -> 172.31.31.144 OpenFlow 435 Type: OFPT_PACKET_IN
170 0.106653605 172.31.23.72 -> 172.31.31.144 OpenFlow 189 Type: OFPT_PACKET_IN
171 0.106688066 172.31.23.72 -> 172.31.31.144 OpenFlow 189 Type: OFPT_PACKET_IN
172 0.106696061 172.31.23.72 -> 172.31.31.144 OpenFlow 927 Type: OFPT_PACKET_IN
173 0.106711076 172.31.23.72 -> 172.31.31.144 OpenFlow 189 Type: OFPT_PACKET_IN
174 0.106735603 172.31.23.72 -> 172.31.31.144 OpenFlow 189 Type: OFPT_PACKET_IN
175 0.106741115 172.31.23.72 -> 172.31.31.144 OpenFlow 189 Type: OFPT_PACKET_IN
176 0.106756149 172.31.23.72 -> 172.31.31.144 OpenFlow 189 Type: OFPT_PACKET_IN
177 0.106770040 172.31.23.72 -> 172.31.31.144 OpenFlow 189 Type: OFPT_PACKET_IN
178 0.106784843 172.31.23.72 -> 172.31.31.144 OpenFlow 189 Type: OFPT_PACKET_IN
179 0.106805419 172.31.23.72 -> 172.31.31.144 OpenFlow 189 Type: OFPT_PACKET_IN
180 0.106889489 172.31.23.72 -> 172.31.31.144 OpenFlow 189 Type: OFPT_PACKET_IN
181 0.106892956 172.31.23.72 -> 172.31.31.144 OpenFlow 189 Type: OFPT_PACKET_IN
182 0.106908708 172.31.23.72 -> 172.31.31.144 OpenFlow 189 Type: OFPT_PACKET_IN
183 0.106920603 172.31.31.144 -> 172.31.23.72 TCP 66 6633 → 33632 [ACK] Seq=65 Ack=124 Win=853 Len=0 TSval=1244162 TSecr=26083263
184 0.106925406 172.31.31.144 -> 172.31.23.72 TCP 66 6633 → 33632 [ACK] Seq=65 Ack=493 Win=853 Len=0 TSval=1244162 TSecr=26083263
185 0.106927233 172.31.31.144 -> 172.31.23.72 TCP 66 6633 → 33632 [ACK] Seq=65 Ack=541 Win=853 Len=0 TSval=1244162 TSecr=26083264
186 0.106929601 172.31.31.144 -> 172.31.23.72 TCP 66 6633 → 33662 [ACK] Seq=1 Ack=124 Win=853 Len=0 TSval=1244162 TSecr=26083264
187 0.106931663 172.31.31.144 -> 172.31.23.72 TCP 66 6633 → 33662 [ACK] Seq=1 Ack=493 Win=853 Len=0 TSval=1244162 TSecr=26083264
188 0.106933422 172.31.31.144 -> 172.31.23.72 TCP 66 6633 → 33648 [ACK] Seq=1 Ack=124 Win=853 Len=0 TSval=1244162 TSecr=26083264
189 0.106947358 172.31.23.72 -> 172.31.31.144 OpenFlow 189 Type: OFPT_PACKET_IN
190 0.106954268 172.31.23.72 -> 172.31.31.144 OpenFlow 189 Type: OFPT_PACKET_IN
191 0.106976560 172.31.23.72 -> 172.31.31.144 OpenFlow 189 Type: OFPT_PACKET_IN
192 0.106993276 172.31.23.72 -> 172.31.31.144 OpenFlow 189 Type: OFPT_PACKET_IN
193 0.107010183 172.31.23.72 -> 172.31.31.144 OpenFlow 189 Type: OFPT_PACKET_IN
194 0.107012544 172.31.23.72 -> 172.31.31.144 OpenFlow 189 Type: OFPT_PACKET_IN
195 0.107196335 172.31.31.144 -> 172.31.23.72 TCP 66 6633 → 33672 [ACK] Seq=1 Ack=124 Win=853 Len=0 TSval=1244162 TSecr=26083264
196 0.107202102 172.31.31.144 -> 172.31.23.72 TCP 66 6633 → 33648 [ACK] Seq=1 Ack=985 Win=853 Len=0 TSval=1244162 TSecr=26083264
197 0.107204127 172.31.31.144 -> 172.31.23.72 TCP 66 6633 → 33630 [ACK] Seq=65 Ack=172 Win=853 Len=0 TSval=1244162 TSecr=26083264
198 0.107206397 172.31.31.144 -> 172.31.23.72 TCP 66 6633 → 33670 [ACK] Seq=1 Ack=370 Win=853 Len=0 TSval=1244162 TSecr=26083264
199 0.107211433 172.31.23.72 -> 172.31.31.144 OpenFlow 435 Type: OFPT_PACKET_IN
200 0.107216978 172.31.23.72 -> 172.31.31.144 OpenFlow 927 Type: OFPT_PACKET_IN
201 0.107218958 172.31.23.72 -> 172.31.31.144 OpenFlow 435 Type: OFPT_PACKET_IN
202 0.107220824 172.31.23.72 -> 172.31.31.144 OpenFlow 189 Type: OFPT_PACKET_IN
203 0.107222524 172.31.23.72 -> 172.31.31.144 OpenFlow 189 Type: OFPT_PACKET_IN
204 0.107224389 172.31.23.72 -> 172.31.31.144 OpenFlow 927 Type: OFPT_PACKET_IN
205 0.107373457 172.31.31.144 -> 172.31.23.72 TCP 66 6633 → 33672 [ACK] Seq=1 Ack=247 Win=853 Len=0 TSval=1244162 TSecr=26083264
206 0.107375916 172.31.31.144 -> 172.31.23.72 TCP 66 6633 → 33664 [ACK] Seq=1 Ack=124 Win=853 Len=0 TSval=1244163 TSecr=26083264
207 0.107377848 172.31.31.144 -> 172.31.23.72 TCP 66 6633 → 33658 [ACK] Seq=1 Ack=370 Win=853 Len=0 TSval=1244163 TSecr=26083264
208 0.107381829 172.31.23.72 -> 172.31.31.144 OpenFlow 435 Type: OFPT_PACKET_IN
209 0.107397936 172.31.23.72 -> 172.31.31.144 OpenFlow 681 Type: OFPT_PACKET_IN
210 0.107400019 172.31.23.72 -> 172.31.31.144 OpenFlow 189 Type: OFPT_PACKET_IN
211 0.107553329 172.31.31.144 -> 172.31.23.72 TCP 66 6633 → 33638 [ACK] Seq=1 Ack=124 Win=853 Len=0 TSval=1244163 TSecr=26083264
212 0.107555673 172.31.31.144 -> 172.31.23.72 TCP 66 6633 → 33668 [ACK] Seq=969 Ack=124 Win=853 Len=0 TSval=1244163 TSecr=26083264
213 0.107657125 172.31.31.144 -> 172.31.23.72 TCP 66 6633 → 33630 [ACK] Seq=65 Ack=295 Win=853 Len=0 TSval=1244163 TSecr=26083264
214 0.107659138 172.31.31.144 -> 172.31.23.72 TCP 66 6633 → 33656 [ACK] Seq=727 Ack=124 Win=853 Len=0 TSval=1244163 TSecr=26083264
215 0.107661473 172.31.31.144 -> 172.31.23.72 TCP 66 6633 → 33652 [ACK] Seq=969 Ack=124 Win=853 Len=0 TSval=1244163 TSecr=26083264
216 0.107663362 172.31.31.144 -> 172.31.23.72 TCP 66 6633 → 33670 [ACK] Seq=1 Ack=493 Win=853 Len=0 TSval=1244163 TSecr=26083264
217 0.107809966 172.31.31.144 -> 172.31.23.72 TCP 66 6633 → 33636 [ACK] Seq=1033 Ack=172 Win=853 Len=0 TSval=1244163 TSecr=26083264
218 0.107812086 172.31.31.144 -> 172.31.23.72 TCP 66 6633 → 33640 [ACK] Seq=1211 Ack=370 Win=853 Len=0 TSval=1244163 TSecr=26083264
219 0.107813847 172.31.31.144 -> 172.31.23.72 TCP 66 6633 → 33664 [ACK] Seq=1 Ack=247 Win=853 Len=0 TSval=1244163 TSecr=26083264
220 0.107815566 172.31.31.144 -> 172.31.23.72 TCP 66 6633 → 33658 [ACK] Seq=1 Ack=739 Win=853 Len=0 TSval=1244163 TSecr=26083264
221 0.107817325 172.31.31.144 -> 172.31.23.72 TCP 66 6633 → 33650 [ACK] Seq=1211 Ack=370 Win=853 Len=0 TSval=1244163 TSecr=26083262
222 0.107819255 172.31.31.144 -> 172.31.23.72 TCP 66 6633 → 33638 [ACK] Seq=1 Ack=493 Win=853 Len=0 TSval=1244163 TSecr=26083264
223 0.107820974 172.31.31.144 -> 172.31.23.72 TCP 66 6633 → 33668 [ACK] Seq=969 Ack=247 Win=853 Len=0 TSval=1244163 TSecr=26083264
224 0.107993522 172.31.31.144 -> 172.31.23.72 TCP 66 6633 → 33642 [ACK] Seq=1 Ack=985 Win=853 Len=0 TSval=1244163 TSecr=26083264
225 0.107996091 172.31.31.144 -> 172.31.23.72 TCP 66 6633 → 33656 [ACK] Seq=727 Ack=247 Win=853 Len=0 TSval=1244163 TSecr=26083264
226 0.108049305 172.31.31.144 -> 172.31.23.72 TCP 66 6633 → 33652 [ACK] Seq=969 Ack=985 Win=853 Len=0 TSval=1244163 TSecr=26083264
227 0.108051154 172.31.31.144 -> 172.31.23.72 TCP 66 6633 → 33636 [ACK] Seq=1033 Ack=541 Win=853 Len=0 TSval=1244163 TSecr=26083264
228 0.108052807 172.31.31.144 -> 172.31.23.72 TCP 66 6633 → 33640 [ACK] Seq=1211 Ack=493 Win=853 Len=0 TSval=1244163 TSecr=26083264
229 0.142626296 172.31.23.72 -> 172.31.31.144 TCP 66 33654 → 6633 [ACK] Seq=493 Ack=969 Win=213 Len=0 TSval=26083273 TSecr=1244162
230 0.142633135 172.31.23.72 -> 172.31.31.144 TCP 66 33634 → 6633 [ACK] Seq=295 Ack=1275 Win=213 Len=0 TSval=26083273 TSecr=1244162
231 0.142977766 172.31.31.144 -> 172.31.23.72 TCP 66 6633 → 33634 [ACK] Seq=1275 Ack=295 Win=853 Len=0 TSval=1244171 TSecr=26083263
232 0.147259260 172.31.31.144 -> 172.31.23.72 TCP 66 6633 → 33650 [ACK] Seq=1211 Ack=985 Win=853 Len=0 TSval=1244173 TSecr=26083264
233 0.200506257 172.31.31.144 -> 172.31.23.72 OpenFlow 90 Type: OFPT_MULTIPART_REQUEST, OFPMP_GROUP
234 0.200519115 172.31.31.144 -> 172.31.23.72 OpenFlow 90 Type: OFPT_MULTIPART_REQUEST, OFPMP_GROUP
235 0.200523169 172.31.31.144 -> 172.31.23.72 OpenFlow 106 Type: OFPT_MULTIPART_REQUEST, OFPMP_METER
236 0.200526098 172.31.31.144 -> 172.31.23.72 OpenFlow 106 Type: OFPT_MULTIPART_REQUEST, OFPMP_METER
237 0.200561231 172.31.31.144 -> 172.31.23.72 OpenFlow 187 Type: OFPT_PACKET_OUT
238 0.200618860 172.31.31.144 -> 172.31.23.72 OpenFlow 187 Type: OFPT_PACKET_OUT
239 0.200675725 172.31.31.144 -> 172.31.23.72 OpenFlow 187 Type: OFPT_PACKET_OUT
240 0.200730548 172.31.31.144 -> 172.31.23.72 OpenFlow 187 Type: OFPT_PACKET_OUT
241 0.200754761 172.31.23.72 -> 172.31.31.144 OpenFlow 82 Type: OFPT_MULTIPART_REPLY, OFPMP_GROUP
242 0.200785663 172.31.31.144 -> 172.31.23.72 OpenFlow 187 Type: OFPT_PACKET_OUT
243 0.200838047 172.31.23.72 -> 172.31.31.144 OpenFlow 98 Type: OFPT_MULTIPART_REPLY, OFPMP_METER
244 0.200861355 172.31.31.144 -> 172.31.23.72 OpenFlow 187 Type: OFPT_PACKET_OUT
245 0.200909636 172.31.31.144 -> 172.31.23.72 OpenFlow 187 Type: OFPT_PACKET_OUT
246 0.200940980 172.31.31.144 -> 172.31.23.72 OpenFlow 187 Type: OFPT_PACKET_OUT
247 0.201025615 172.31.31.144 -> 172.31.23.72 OpenFlow 187 Type: OFPT_PACKET_OUT
248 0.201176385 172.31.31.144 -> 172.31.23.72 OpenFlow 187 Type: OFPT_PACKET_OUT
249 0.201193243 172.31.31.144 -> 172.31.23.72 TCP 66 6633 → 33640 [ACK] Seq=1275 Ack=509 Win=853 Len=0 TSval=1244186 TSecr=26083287
250 0.201196710 172.31.31.144 -> 172.31.23.72 TCP 66 6633 → 33640 [ACK] Seq=1275 Ack=541 Win=853 Len=0 TSval=1244186 TSecr=26083287
251 0.201198665 172.31.31.144 -> 172.31.23.72 OpenFlow 187 Type: OFPT_PACKET_OUT
252 0.201202831 172.31.31.144 -> 172.31.23.72 OpenFlow 187 Type: OFPT_PACKET_OUT
253 0.201265342 172.31.23.72 -> 172.31.31.144 TCP 66 33632 → 6633 [ACK] Seq=541 Ack=1033 Win=213 Len=0 TSval=26083287 TSecr=1244186
254 0.201311829 172.31.31.144 -> 172.31.23.72 OpenFlow 187 Type: OFPT_PACKET_OUT
255 0.201316039 172.31.31.144 -> 172.31.23.72 OpenFlow 187 Type: OFPT_PACKET_OUT
256 0.201355800 172.31.31.144 -> 172.31.23.72 OpenFlow 187 Type: OFPT_PACKET_OUT
257 0.201402112 172.31.31.144 -> 172.31.23.72 OpenFlow 187 Type: OFPT_PACKET_OUT
258 0.201443121 172.31.31.144 -> 172.31.23.72 OpenFlow 187 Type: OFPT_PACKET_OUT
259 0.201499061 172.31.31.144 -> 172.31.23.72 OpenFlow 187 Type: OFPT_PACKET_OUT
260 0.201626990 172.31.31.144 -> 172.31.23.72 OpenFlow 187 Type: OFPT_PACKET_OUT
261 0.201632267 172.31.31.144 -> 172.31.23.72 OpenFlow 187 Type: OFPT_PACKET_OUT
262 0.201713370 172.31.31.144 -> 172.31.23.72 OpenFlow 187 Type: OFPT_PACKET_OUT
263 0.201763002 172.31.31.144 -> 172.31.23.72 OpenFlow 187 Type: OFPT_PACKET_OUT
264 0.201799371 172.31.31.144 -> 172.31.23.72 OpenFlow 187 Type: OFPT_PACKET_OUT
265 0.201854162 172.31.31.144 -> 172.31.23.72 OpenFlow 187 Type: OFPT_PACKET_OUT
266 0.201873442 172.31.23.72 -> 172.31.31.144 TCP 66 33662 → 6633 [ACK] Seq=493 Ack=1211 Win=213 Len=0 TSval=26083287 TSecr=1244186
267 0.201900429 172.31.31.144 -> 172.31.23.72 OpenFlow 187 Type: OFPT_PACKET_OUT
268 0.201937369 172.31.31.144 -> 172.31.23.72 OpenFlow 187 Type: OFPT_PACKET_OUT
269 0.202024704 172.31.31.144 -> 172.31.23.72 TCP 187 6633 → 33676 [PSH, ACK] Seq=1 Ack=1 Win=853 Len=121 TSval=1244186 TSecr=26083177
270 0.202065932 172.31.31.144 -> 172.31.23.72 TCP 187 6633 → 33676 [PSH, ACK] Seq=122 Ack=1 Win=853 Len=121 TSval=1244186 TSecr=26083177
271 0.202125738 172.31.31.144 -> 172.31.23.72 TCP 187 6633 → 33676 [PSH, ACK] Seq=243 Ack=1 Win=853 Len=121 TSval=1244186 TSecr=26083177
272 0.202160754 172.31.31.144 -> 172.31.23.72 TCP 187 6633 → 33676 [PSH, ACK] Seq=364 Ack=1 Win=853 Len=121 TSval=1244186 TSecr=26083177
273 0.202226307 172.31.31.144 -> 172.31.23.72 TCP 187 6633 → 33676 [PSH, ACK] Seq=485 Ack=1 Win=853 Len=121 TSval=1244186 TSecr=26083177
274 0.202279195 172.31.31.144 -> 172.31.23.72 TCP 187 6633 → 33676 [PSH, ACK] Seq=606 Ack=1 Win=853 Len=121 TSval=1244186 TSecr=26083177
275 0.202357192 172.31.23.72 -> 172.31.31.144 TCP 66 33648 → 6633 [ACK] Seq=985 Ack=969 Win=213 Len=0 TSval=26083287 TSecr=1244186
276 0.202386403 172.31.31.144 -> 172.31.23.72 TCP 187 6633 → 33674 [PSH, ACK] Seq=1 Ack=1 Win=853 Len=121 TSval=1244186 TSecr=26083173
277 0.202394360 172.31.31.144 -> 172.31.23.72 TCP 187 6633 → 33674 [PSH, ACK] Seq=122 Ack=1 Win=853 Len=121 TSval=1244186 TSecr=26083173
278 0.202437676 172.31.31.144 -> 172.31.23.72 TCP 187 6633 → 33674 [PSH, ACK] Seq=243 Ack=1 Win=853 Len=121 TSval=1244186 TSecr=26083173
279 0.202483890 172.31.31.144 -> 172.31.23.72 TCP 187 6633 → 33674 [PSH, ACK] Seq=364 Ack=1 Win=853 Len=121 TSval=1244186 TSecr=26083173
280 0.202541241 172.31.31.144 -> 172.31.23.72 TCP 187 6633 → 33674 [PSH, ACK] Seq=485 Ack=1 Win=853 Len=121 TSval=1244186 TSecr=26083173
281 0.202607759 172.31.31.144 -> 172.31.23.72 TCP 187 6633 → 33674 [PSH, ACK] Seq=606 Ack=1 Win=853 Len=121 TSval=1244186 TSecr=26083173
282 0.202654921 172.31.31.144 -> 172.31.23.72 TCP 187 6633 → 33674 [PSH, ACK] Seq=727 Ack=1 Win=853 Len=121 TSval=1244186 TSecr=26083173
283 0.202675335 172.31.23.72 -> 172.31.31.144 TCP 66 33676 → 6633 [ACK] Seq=1 Ack=727 Win=213 Len=0 TSval=26083288 TSecr=1244186
284 0.202701614 172.31.31.144 -> 172.31.23.72 TCP 187 6633 → 33674 [PSH, ACK] Seq=848 Ack=1 Win=853 Len=121 TSval=1244186 TSecr=26083173
285 0.202769724 172.31.23.72 -> 172.31.31.144 OpenFlow 189 Type: OFPT_PACKET_IN
286 0.202787340 172.31.31.144 -> 172.31.23.72 OpenFlow 187 Type: OFPT_PACKET_OUT
287 0.202793656 172.31.23.72 -> 172.31.31.144 OpenFlow 189 Type: OFPT_PACKET_IN
288 0.202837012 172.31.31.144 -> 172.31.23.72 OpenFlow 187 Type: OFPT_PACKET_OUT
289 0.202844020 172.31.23.72 -> 172.31.31.144 OpenFlow 312 Type: OFPT_PACKET_IN
290 0.202918013 172.31.31.144 -> 172.31.23.72 OpenFlow 187 Type: OFPT_PACKET_OUT
291 0.202939621 172.31.31.144 -> 172.31.23.72 OpenFlow 187 Type: OFPT_PACKET_OUT
292 0.203010174 172.31.31.144 -> 172.31.23.72 TCP 66 6633 → 33674 [ACK] Seq=969 Ack=124 Win=853 Len=0 TSval=1244186 TSecr=26083288
293 0.203016201 172.31.31.144 -> 172.31.23.72 OpenFlow 187 Type: OFPT_PACKET_OUT
294 0.203051665 172.31.31.144 -> 172.31.23.72 TCP 66 6633 → 33674 [ACK] Seq=969 Ack=247 Win=853 Len=0 TSval=1244186 TSecr=26083288
295 0.203056202 172.31.31.144 -> 172.31.23.72 OpenFlow 187 Type: OFPT_PACKET_OUT
296 0.203115419 172.31.31.144 -> 172.31.23.72 TCP 66 6633 → 33674 [ACK] Seq=969 Ack=493 Win=853 Len=0 TSval=1244186 TSecr=26083288
297 0.203120616 172.31.31.144 -> 172.31.23.72 OpenFlow 187 Type: OFPT_PACKET_OUT
298 0.203152335 172.31.31.144 -> 172.31.23.72 OpenFlow 187 Type: OFPT_PACKET_OUT
299 0.203208085 172.31.23.72 -> 172.31.31.144 OpenFlow 189 Type: OFPT_PACKET_IN
300 0.203231406 172.31.23.72 -> 172.31.31.144 OpenFlow 435 Type: OFPT_PACKET_IN
301 0.203279529 172.31.31.144 -> 172.31.23.72 OpenFlow 187 Type: OFPT_PACKET_OUT
302 0.203300733 172.31.31.144 -> 172.31.23.72 OpenFlow 187 Type: OFPT_PACKET_OUT
303 0.203371843 172.31.31.144 -> 172.31.23.72 OpenFlow 187 Type: OFPT_PACKET_OUT
304 0.203414812 172.31.31.144 -> 172.31.23.72 OpenFlow 187 Type: OFPT_PACKET_OUT
305 0.203446479 172.31.31.144 -> 172.31.23.72 TCP 66 6633 → 33672 [ACK] Seq=969 Ack=739 Win=853 Len=0 TSval=1244187 TSecr=26083288
306 0.203470137 172.31.31.144 -> 172.31.23.72 OpenFlow 187 Type: OFPT_PACKET_OUT
307 0.203538419 172.31.31.144 -> 172.31.23.72 OpenFlow 187 Type: OFPT_PACKET_OUT
308 0.203644237 172.31.31.144 -> 172.31.23.72 OpenFlow 187 Type: OFPT_PACKET_OUT
309 0.203666728 172.31.23.72 -> 172.31.31.144 OpenFlow 189 Type: OFPT_PACKET_IN
310 0.203684355 172.31.31.144 -> 172.31.23.72 OpenFlow 187 Type: OFPT_PACKET_OUT
311 0.203689718 172.31.23.72 -> 172.31.31.144 OpenFlow 189 Type: OFPT_PACKET_IN
312 0.203778202 172.31.31.144 -> 172.31.23.72 OpenFlow 187 Type: OFPT_PACKET_OUT
313 0.203831366 172.31.31.144 -> 172.31.23.72 OpenFlow 187 Type: OFPT_PACKET_OUT
314 0.203872953 172.31.31.144 -> 172.31.23.72 OpenFlow 187 Type: OFPT_PACKET_OUT
315 0.203924740 172.31.31.144 -> 172.31.23.72 TCP 66 6633 → 33630 [ACK] Seq=791 Ack=541 Win=853 Len=0 TSval=1244187 TSecr=26083288
316 0.203939747 172.31.23.72 -> 172.31.31.144 OpenFlow 189 Type: OFPT_PACKET_IN
317 0.203951768 172.31.31.144 -> 172.31.23.72 OpenFlow 187 Type: OFPT_PACKET_OUT
318 0.203957876 172.31.23.72 -> 172.31.31.144 OpenFlow 189 Type: OFPT_PACKET_IN
319 0.204006249 172.31.31.144 -> 172.31.23.72 OpenFlow 187 Type: OFPT_PACKET_OUT
320 0.204052463 172.31.31.144 -> 172.31.23.72 OpenFlow 187 Type: OFPT_PACKET_OUT
321 0.204166729 172.31.31.144 -> 172.31.23.72 OpenFlow 187 Type: OFPT_PACKET_OUT
322 0.204190116 172.31.31.144 -> 172.31.23.72 OpenFlow 187 Type: OFPT_PACKET_OUT
323 0.204251448 172.31.23.72 -> 172.31.31.144 TCP 66 33670 → 6633 [ACK] Seq=739 Ack=969 Win=213 Len=0 TSval=26083288 TSecr=1244187
324 0.204261716 172.31.31.144 -> 172.31.23.72 OpenFlow 187 Type: OFPT_PACKET_OUT
325 0.204277009 172.31.31.144 -> 172.31.23.72 TCP 66 6633 → 33670 [ACK] Seq=969 Ack=739 Win=853 Len=0 TSval=1244187 TSecr=26083288
326 0.204333215 172.31.23.72 -> 172.31.31.144 OpenFlow 189 Type: OFPT_PACKET_IN
327 0.204343289 172.31.31.144 -> 172.31.23.72 OpenFlow 187 Type: OFPT_PACKET_OUT
328 0.204357872 172.31.23.72 -> 172.31.31.144 OpenFlow 189 Type: OFPT_PACKET_IN
329 0.204393072 172.31.31.144 -> 172.31.23.72 OpenFlow 187 Type: OFPT_PACKET_OUT
330 0.204398643 172.31.23.72 -> 172.31.31.144 OpenFlow 312 Type: OFPT_PACKET_IN
331 0.204529893 172.31.31.144 -> 172.31.23.72 OpenFlow 187 Type: OFPT_PACKET_OUT
332 0.204534755 172.31.31.144 -> 172.31.23.72 OpenFlow 187 Type: OFPT_PACKET_OUT
333 0.204537239 172.31.31.144 -> 172.31.23.72 OpenFlow 187 Type: OFPT_PACKET_OUT
334 0.204539402 172.31.31.144 -> 172.31.23.72 OpenFlow 187 Type: OFPT_PACKET_OUT
335 0.204778070 172.31.23.72 -> 172.31.31.144 TCP 66 33658 → 6633 [ACK] Seq=739 Ack=364 Win=213 Len=0 TSval=26083288 TSecr=1244187
336 0.204813344 172.31.31.144 -> 172.31.23.72 TCP 66 6633 → 33664 [ACK] Seq=727 Ack=370 Win=853 Len=0 TSval=1244187 TSecr=26083288
337 0.204818225 172.31.31.144 -> 172.31.23.72 OpenFlow 187 Type: OFPT_PACKET_OUT
338 0.204831819 172.31.31.144 -> 172.31.23.72 OpenFlow 187 Type: OFPT_PACKET_OUT
339 0.204833969 172.31.31.144 -> 172.31.23.72 OpenFlow 308 Type: OFPT_PACKET_OUT
340 0.204955483 172.31.23.72 -> 172.31.31.144 TCP 66 33658 → 6633 [ACK] Seq=739 Ack=727 Win=213 Len=0 TSval=26083288 TSecr=1244187
341 0.205035022 172.31.31.144 -> 172.31.23.72 OpenFlow 187 Type: OFPT_PACKET_OUT
342 0.205039338 172.31.31.144 -> 172.31.23.72 TCP 66 6633 → 33664 [ACK] Seq=727 Ack=493 Win=853 Len=0 TSval=1244187 TSecr=26083288
343 0.205042072 172.31.31.144 -> 172.31.23.72 OpenFlow 550 Type: OFPT_PACKET_OUT
344 0.205234036 172.31.23.72 -> 172.31.31.144 TCP 66 33642 → 6633 [ACK] Seq=985 Ack=727 Win=213 Len=0 TSval=26083288 TSecr=1244187
345 0.205302843 172.31.23.72 -> 172.31.31.144 OpenFlow 82 Type: OFPT_MULTIPART_REPLY, OFPMP_GROUP
346 0.205324295 172.31.23.72 -> 172.31.31.144 OpenFlow 98 Type: OFPT_MULTIPART_REPLY, OFPMP_METER
347 0.205406273 172.31.23.72 -> 172.31.31.144 OpenFlow 189 Type: OFPT_PACKET_IN
348 0.205425025 172.31.23.72 -> 172.31.31.144 OpenFlow 189 Type: OFPT_PACKET_IN
349 0.205445956 172.31.23.72 -> 172.31.31.144 OpenFlow 189 Type: OFPT_PACKET_IN
350 0.205457531 172.31.23.72 -> 172.31.31.144 OpenFlow 189 Type: OFPT_PACKET_IN
351 0.205474048 172.31.23.72 -> 172.31.31.144 OpenFlow 189 Type: OFPT_PACKET_IN
352 0.205495994 172.31.23.72 -> 172.31.31.144 OpenFlow 189 Type: OFPT_PACKET_IN
353 0.205498402 172.31.23.72 -> 172.31.31.144 OpenFlow 435 Type: OFPT_PACKET_IN
354 0.205518424 172.31.23.72 -> 172.31.31.144 OpenFlow 189 Type: OFPT_PACKET_IN
355 0.205536004 172.31.23.72 -> 172.31.31.144 OpenFlow 189 Type: OFPT_PACKET_IN
356 0.205546573 172.31.23.72 -> 172.31.31.144 OpenFlow 189 Type: OFPT_PACKET_IN
357 0.205560650 172.31.23.72 -> 172.31.31.144 OpenFlow 189 Type: OFPT_PACKET_IN
358 0.205571053 172.31.23.72 -> 172.31.31.144 OpenFlow 189 Type: OFPT_PACKET_IN
359 0.205573123 172.31.23.72 -> 172.31.31.144 OpenFlow 435 Type: OFPT_PACKET_IN
360 0.205606382 172.31.23.72 -> 172.31.31.144 OpenFlow 189 Type: OFPT_PACKET_IN
361 0.205621353 172.31.23.72 -> 172.31.31.144 OpenFlow 189 Type: OFPT_PACKET_IN
362 0.205632332 172.31.23.72 -> 172.31.31.144 OpenFlow 189 Type: OFPT_PACKET_IN
363 0.205757629 172.31.31.144 -> 172.31.23.72 TCP 66 6633 → 33664 [ACK] Seq=727 Ack=739 Win=853 Len=0 TSval=1244187 TSecr=26083288
364 0.205763998 172.31.31.144 -> 172.31.23.72 OpenFlow 187 Type: OFPT_PACKET_OUT
365 0.205768564 172.31.31.144 -> 172.31.23.72 OpenFlow 187 Type: OFPT_PACKET_OUT
366 0.205770351 172.31.31.144 -> 172.31.23.72 OpenFlow 429 Type: OFPT_PACKET_OUT
367 0.205772501 172.31.31.144 -> 172.31.23.72 OpenFlow 187 Type: OFPT_PACKET_OUT
368 0.205774180 172.31.31.144 -> 172.31.23.72 OpenFlow 187 Type: OFPT_PACKET_OUT
369 0.205776795 172.31.31.144 -> 172.31.23.72 OpenFlow 187 Type: OFPT_PACKET_OUT
370 0.205778304 172.31.31.144 -> 172.31.23.72 OpenFlow 187 Type: OFPT_PACKET_OUT
371 0.205779899 172.31.31.144 -> 172.31.23.72 TCP 66 6633 → 33638 [ACK] Seq=670 Ack=509 Win=853 Len=0 TSval=1244187 TSecr=26083288
372 0.205781776 172.31.31.144 -> 172.31.23.72 OpenFlow 187 Type: OFPT_PACKET_OUT
373 0.205783043 172.31.31.144 -> 172.31.23.72 TCP 66 6633 → 33668 [ACK] Seq=969 Ack=370 Win=853 Len=0 TSval=1244187 TSecr=26083288
374 0.205795131 172.31.23.72 -> 172.31.31.144 OpenFlow 189 Type: OFPT_PACKET_IN
375 0.205801670 172.31.23.72 -> 172.31.31.144 OpenFlow 681 Type: OFPT_PACKET_IN
376 0.205803834 172.31.23.72 -> 172.31.31.144 OpenFlow 435 Type: OFPT_PACKET_IN
377 0.206004222 172.31.23.72 -> 172.31.31.144 OpenFlow 927 Type: OFPT_PACKET_IN
