  1 0.000000000 41.177.127.217 -> 172.31.24.227 TCP 54 58416 → 22 [ACK] Seq=1 Ack=1 Win=32600 Len=0
  2 0.002165769 41.177.127.217 -> 172.31.24.227 TCP 54 58416 → 22 [ACK] Seq=1 Ack=297 Win=32452 Len=0
  3 0.039791948 41.177.127.217 -> 172.31.24.227 TCP 54 58416 → 22 [ACK] Seq=1 Ack=333 Win=32434 Len=0
  4 0.119100045 41.177.127.217 -> 172.31.24.227 TCP 54 58416 → 22 [ACK] Seq=1 Ack=429 Win=32386 Len=0
  5 0.651773028 172.31.24.227 -> 41.177.127.217 SSH 90 Server: Encrypted packet (len=36)
  6 0.918637054 41.177.127.217 -> 172.31.24.227 TCP 54 58416 → 22 [ACK] Seq=1 Ack=465 Win=32368 Len=0
  7 1.153859305 172.31.24.227 -> 41.177.127.217 SSH 98 Server: Encrypted packet (len=44)
  8 1.243906318 172.31.31.144 -> 172.31.24.227 TCP 90 6633 → 39486 [PSH, ACK] Seq=1 Ack=1 Win=853 Len=24 TSval=344154 TSecr=118904352
  9 1.244492056 172.31.24.227 -> 172.31.31.144 OpenFlow 642 Type: OFPT_MULTIPART_REPLY, OFPMP_PORT_STATS
 10 1.244764584 172.31.31.144 -> 172.31.24.227 TCP 66 6633 → 39486 [ACK] Seq=25 Ack=577 Win=853 Len=0 TSval=344155 TSecr=118904764
 11 1.247027196 172.31.31.144 -> 172.31.24.227 OpenFlow 122 Type: OFPT_MULTIPART_REQUEST, OFPMP_FLOW
 12 1.247239569 172.31.24.227 -> 172.31.31.144 OpenFlow 2010 Type: OFPT_MULTIPART_REPLY, OFPMP_FLOW
 13 1.248240635 172.31.31.144 -> 172.31.24.227 OpenFlow 82 Type: OFPT_MULTIPART_REQUEST, OFPMP_TABLE
 14 1.248543374 172.31.24.227 -> 172.31.31.144 OpenFlow 6178 Type: OFPT_MULTIPART_REPLY, OFPMP_TABLE
 15 1.259409557 172.31.31.144 -> 172.31.24.227 TCP 90 6633 → 39490 [PSH, ACK] Seq=1 Ack=1 Win=853 Len=24 TSval=344158 TSecr=118904353
 16 1.259420427 172.31.24.227 -> 172.31.31.144 TCP 66 39490 → 6633 [ACK] Seq=1 Ack=25 Win=55 Len=0 TSval=118904768 TSecr=344158
 17 1.259674656 172.31.24.227 -> 172.31.31.144 OpenFlow 754 Type: OFPT_MULTIPART_REPLY, OFPMP_PORT_STATS
 18 1.262489169 172.31.31.144 -> 172.31.24.227 OpenFlow 122 Type: OFPT_MULTIPART_REQUEST, OFPMP_FLOW
 19 1.262667591 172.31.24.227 -> 172.31.31.144 OpenFlow 970 Type: OFPT_MULTIPART_REPLY, OFPMP_FLOW
 20 1.263612112 172.31.31.144 -> 172.31.24.227 OpenFlow 82 Type: OFPT_MULTIPART_REQUEST, OFPMP_TABLE
 21 1.263892509 172.31.24.227 -> 172.31.31.144 OpenFlow 6178 Type: OFPT_MULTIPART_REPLY, OFPMP_TABLE
 22 1.266811207 172.31.31.144 -> 172.31.24.227 TCP 90 6633 → 39492 [PSH, ACK] Seq=1 Ack=1 Win=853 Len=24 TSval=344160 TSecr=118904352
 23 1.266819627 172.31.31.144 -> 172.31.24.227 TCP 122 6633 → 39492 [PSH, ACK] Seq=25 Ack=1 Win=853 Len=56 TSval=344160 TSecr=118904352
 24 1.267050349 172.31.24.227 -> 172.31.31.144 OpenFlow 754 Type: OFPT_MULTIPART_REPLY, OFPMP_PORT_STATS
 25 1.267099470 172.31.24.227 -> 172.31.31.144 OpenFlow 970 Type: OFPT_MULTIPART_REPLY, OFPMP_FLOW
 26 1.267354160 172.31.31.144 -> 172.31.24.227 TCP 66 6633 → 39492 [ACK] Seq=81 Ack=1593 Win=853 Len=0 TSval=344160 TSecr=118904770
 27 1.267907788 172.31.31.144 -> 172.31.24.227 OpenFlow 82 Type: OFPT_MULTIPART_REQUEST, OFPMP_TABLE
 28 1.268353440 172.31.24.227 -> 172.31.31.144 OpenFlow 6178 Type: OFPT_MULTIPART_REPLY, OFPMP_TABLE
 29 1.273139195 172.31.31.144 -> 172.31.24.227 TCP 90 6633 → 39458 [PSH, ACK] Seq=1 Ack=1 Win=853 Len=24 TSval=344162 TSecr=118904352
 30 1.273147456 172.31.31.144 -> 172.31.24.227 TCP 122 6633 → 39458 [PSH, ACK] Seq=25 Ack=1 Win=853 Len=56 TSval=344162 TSecr=118904352
 31 1.273396077 172.31.24.227 -> 172.31.31.144 OpenFlow 1314 Type: OFPT_MULTIPART_REPLY, OFPMP_PORT_STATS
 32 1.273483733 172.31.24.227 -> 172.31.31.144 OpenFlow 2634 Type: OFPT_MULTIPART_REPLY, OFPMP_FLOW
 33 1.273683536 172.31.31.144 -> 172.31.24.227 TCP 66 6633 → 39458 [ACK] Seq=81 Ack=1249 Win=853 Len=0 TSval=344162 TSecr=118904772
 34 1.273700718 172.31.31.144 -> 172.31.24.227 TCP 66 6633 → 39458 [ACK] Seq=81 Ack=3817 Win=853 Len=0 TSval=344162 TSecr=118904772
 35 1.274242723 172.31.31.144 -> 172.31.24.227 OpenFlow 82 Type: OFPT_MULTIPART_REQUEST, OFPMP_TABLE
 36 1.274464410 172.31.24.227 -> 172.31.31.144 OpenFlow 6178 Type: OFPT_MULTIPART_REPLY, OFPMP_TABLE
 37 1.277395670 172.31.31.144 -> 172.31.24.227 TCP 122 6633 → 39476 [PSH, ACK] Seq=1 Ack=1 Win=853 Len=56 TSval=344163 TSecr=118904351
 38 1.277426000 172.31.31.144 -> 172.31.24.227 TCP 106 6633 → 39476 [PSH, ACK] Seq=57 Ack=1 Win=853 Len=40 TSval=344163 TSecr=118904351
 39 1.277568540 172.31.24.227 -> 172.31.31.144 OpenFlow 2010 Type: OFPT_MULTIPART_REPLY, OFPMP_FLOW
 40 1.277648384 172.31.24.227 -> 172.31.31.144 OpenFlow 530 Type: OFPT_MULTIPART_REPLY, OFPMP_PORT_STATS
 41 1.277804310 172.31.24.227 -> 172.31.31.144 OpenFlow 6178 Type: OFPT_MULTIPART_REPLY, OFPMP_TABLE
 42 1.277896993 172.31.31.144 -> 172.31.24.227 TCP 66 6633 → 39476 [ACK] Seq=97 Ack=2409 Win=853 Len=0 TSval=344163 TSecr=118904773
 43 1.282590168 172.31.31.144 -> 172.31.24.227 TCP 122 6633 → 39452 [PSH, ACK] Seq=1 Ack=1 Win=853 Len=56 TSval=344164 TSecr=118904352
 44 1.282629231 172.31.31.144 -> 172.31.24.227 TCP 90 6633 → 39452 [PSH, ACK] Seq=57 Ack=1 Win=853 Len=24 TSval=344164 TSecr=118904352
 45 1.282727874 172.31.24.227 -> 172.31.31.144 OpenFlow 2842 Type: OFPT_MULTIPART_REPLY, OFPMP_FLOW
 46 1.282866238 172.31.24.227 -> 172.31.31.144 OpenFlow 866 Type: OFPT_MULTIPART_REPLY, OFPMP_PORT_STATS
 47 1.283038143 172.31.31.144 -> 172.31.24.227 TCP 66 6633 → 39452 [ACK] Seq=81 Ack=2777 Win=853 Len=0 TSval=344164 TSecr=118904774
 48 1.283056495 172.31.31.144 -> 172.31.24.227 TCP 66 6633 → 39452 [ACK] Seq=81 Ack=3577 Win=853 Len=0 TSval=344164 TSecr=118904774
 49 1.283713707 172.31.31.144 -> 172.31.24.227 OpenFlow 82 Type: OFPT_MULTIPART_REQUEST, OFPMP_TABLE
 50 1.283914398 172.31.24.227 -> 172.31.31.144 OpenFlow 6178 Type: OFPT_MULTIPART_REPLY, OFPMP_TABLE
 51 1.286915966 172.31.31.144 -> 172.31.24.227 TCP 90 6633 → 39480 [PSH, ACK] Seq=1 Ack=1 Win=853 Len=24 TSval=344165 TSecr=118904354
 52 1.286932665 172.31.31.144 -> 172.31.24.227 TCP 122 6633 → 39480 [PSH, ACK] Seq=25 Ack=1 Win=853 Len=56 TSval=344165 TSecr=118904354
 53 1.287136244 172.31.24.227 -> 172.31.31.144 OpenFlow 866 Type: OFPT_MULTIPART_REPLY, OFPMP_PORT_STATS
 54 1.287191475 172.31.24.227 -> 172.31.31.144 OpenFlow 1178 Type: OFPT_MULTIPART_REPLY, OFPMP_FLOW
 55 1.287425937 172.31.31.144 -> 172.31.24.227 TCP 66 6633 → 39480 [ACK] Seq=81 Ack=1913 Win=853 Len=0 TSval=344165 TSecr=118904775
 56 1.288017135 172.31.31.144 -> 172.31.24.227 OpenFlow 82 Type: OFPT_MULTIPART_REQUEST, OFPMP_TABLE
 57 1.288260918 172.31.24.227 -> 172.31.31.144 OpenFlow 6178 Type: OFPT_MULTIPART_REPLY, OFPMP_TABLE
 58 1.288277974 172.31.31.144 -> 172.31.24.227 TCP 66 6633 → 39486 [ACK] Seq=97 Ack=8633 Win=853 Len=0 TSval=344166 TSecr=118904765
 59 1.296273984 172.31.31.144 -> 172.31.24.227 TCP 90 6633 → 39464 [PSH, ACK] Seq=1 Ack=1 Win=853 Len=24 TSval=344168 TSecr=118904354
 60 1.296290024 172.31.31.144 -> 172.31.24.227 TCP 122 6633 → 39464 [PSH, ACK] Seq=25 Ack=1 Win=853 Len=56 TSval=344168 TSecr=118904354
 61 1.296481369 172.31.24.227 -> 172.31.31.144 OpenFlow 978 Type: OFPT_MULTIPART_REPLY, OFPMP_PORT_STATS
 62 1.296550856 172.31.24.227 -> 172.31.31.144 OpenFlow 2218 Type: OFPT_MULTIPART_REPLY, OFPMP_FLOW
 63 1.296819785 172.31.31.144 -> 172.31.24.227 TCP 66 6633 → 39464 [ACK] Seq=81 Ack=3065 Win=853 Len=0 TSval=344168 TSecr=118904777
 64 1.297427618 172.31.31.144 -> 172.31.24.227 OpenFlow 82 Type: OFPT_MULTIPART_REQUEST, OFPMP_TABLE
 65 1.297650219 172.31.24.227 -> 172.31.31.144 OpenFlow 6178 Type: OFPT_MULTIPART_REPLY, OFPMP_TABLE
 66 1.299645105 172.31.31.144 -> 172.31.24.227 TCP 122 6633 → 39482 [PSH, ACK] Seq=1 Ack=1 Win=853 Len=56 TSval=344168 TSecr=118904353
 67 1.299663959 172.31.24.227 -> 172.31.31.144 TCP 66 39482 → 6633 [ACK] Seq=1 Ack=57 Win=135 Len=0 TSval=118904778 TSecr=344168
 68 1.299679071 172.31.31.144 -> 172.31.24.227 TCP 90 6633 → 39482 [PSH, ACK] Seq=57 Ack=1 Win=853 Len=24 TSval=344168 TSecr=118904353
 69 1.299686100 172.31.24.227 -> 172.31.31.144 TCP 66 39482 → 6633 [ACK] Seq=1 Ack=81 Win=135 Len=0 TSval=118904778 TSecr=344168
 70 1.299978478 172.31.24.227 -> 172.31.31.144 OpenFlow 970 Type: OFPT_MULTIPART_REPLY, OFPMP_FLOW
 71 1.300103555 172.31.24.227 -> 172.31.31.144 OpenFlow 978 Type: OFPT_MULTIPART_REPLY, OFPMP_PORT_STATS
 72 1.300355922 172.31.31.144 -> 172.31.24.227 TCP 66 6633 → 39482 [ACK] Seq=81 Ack=1817 Win=853 Len=0 TSval=344169 TSecr=118904778
 73 1.300746944 172.31.31.144 -> 172.31.24.227 OpenFlow 82 Type: OFPT_MULTIPART_REQUEST, OFPMP_TABLE
 74 1.301007474 172.31.24.227 -> 172.31.31.144 OpenFlow 6178 Type: OFPT_MULTIPART_REPLY, OFPMP_TABLE
 75 1.303907491 172.31.31.144 -> 172.31.24.227 TCP 90 6633 → 39446 [PSH, ACK] Seq=1 Ack=1 Win=853 Len=24 TSval=344169 TSecr=118904353
 76 1.303933320 172.31.31.144 -> 172.31.24.227 TCP 122 6633 → 39446 [PSH, ACK] Seq=25 Ack=1 Win=853 Len=56 TSval=344169 TSecr=118904353
 77 1.304086130 172.31.24.227 -> 172.31.31.144 OpenFlow 1090 Type: OFPT_MULTIPART_REPLY, OFPMP_PORT_STATS
 78 1.304151382 172.31.24.227 -> 172.31.31.144 OpenFlow 1594 Type: OFPT_MULTIPART_REPLY, OFPMP_FLOW
 79 1.304345011 172.31.31.144 -> 172.31.24.227 TCP 66 6633 → 39490 [ACK] Seq=97 Ack=7705 Win=853 Len=0 TSval=344170 TSecr=118904769
 80 1.304368051 172.31.31.144 -> 172.31.24.227 TCP 66 6633 → 39446 [ACK] Seq=81 Ack=1025 Win=853 Len=0 TSval=344170 TSecr=118904779
 81 1.304397389 172.31.31.144 -> 172.31.24.227 TCP 66 6633 → 39446 [ACK] Seq=81 Ack=2553 Win=853 Len=0 TSval=344170 TSecr=118904779
 82 1.306082742 172.31.31.144 -> 172.31.24.227 OpenFlow 82 Type: OFPT_MULTIPART_REQUEST, OFPMP_TABLE
 83 1.306101839 172.31.31.144 -> 172.31.24.227 TCP 90 6633 → 39484 [PSH, ACK] Seq=1 Ack=1 Win=853 Len=24 TSval=344170 TSecr=118904353
 84 1.306274975 172.31.24.227 -> 172.31.31.144 OpenFlow 6178 Type: OFPT_MULTIPART_REPLY, OFPMP_TABLE
 85 1.306484828 172.31.24.227 -> 172.31.31.144 OpenFlow 1090 Type: OFPT_MULTIPART_REPLY, OFPMP_PORT_STATS
 86 1.307291615 172.31.31.144 -> 172.31.24.227 OpenFlow 122 Type: OFPT_MULTIPART_REQUEST, OFPMP_FLOW
 87 1.307449990 172.31.24.227 -> 172.31.31.144 OpenFlow 1594 Type: OFPT_MULTIPART_REPLY, OFPMP_FLOW
 88 1.308244721 172.31.31.144 -> 172.31.24.227 TCP 66 6633 → 39492 [ACK] Seq=97 Ack=7705 Win=853 Len=0 TSval=344171 TSecr=118904770
 89 1.308457720 172.31.31.144 -> 172.31.24.227 OpenFlow 82 Type: OFPT_MULTIPART_REQUEST, OFPMP_TABLE
 90 1.308733019 172.31.24.227 -> 172.31.31.144 OpenFlow 6178 Type: OFPT_MULTIPART_REPLY, OFPMP_TABLE
 91 1.312333856 172.31.31.144 -> 172.31.24.227 TCP 66 6633 → 39458 [ACK] Seq=97 Ack=9929 Win=853 Len=0 TSval=344172 TSecr=118904772
 92 1.316309294 172.31.31.144 -> 172.31.24.227 TCP 66 6633 → 39476 [ACK] Seq=97 Ack=8521 Win=853 Len=0 TSval=344173 TSecr=118904773
 93 1.317642628 172.31.31.144 -> 172.31.24.227 TCP 122 6633 → 39462 [PSH, ACK] Seq=1 Ack=1 Win=853 Len=56 TSval=344173 TSecr=118904354
 94 1.317651764 172.31.31.144 -> 172.31.24.227 TCP 90 6633 → 39462 [PSH, ACK] Seq=57 Ack=1 Win=853 Len=24 TSval=344173 TSecr=118904354
 95 1.317772602 172.31.24.227 -> 172.31.31.144 OpenFlow 554 Type: OFPT_MULTIPART_REPLY, OFPMP_FLOW
 96 1.317885080 172.31.24.227 -> 172.31.31.144 OpenFlow 866 Type: OFPT_MULTIPART_REPLY, OFPMP_PORT_STATS
 97 1.317982516 172.31.31.144 -> 172.31.24.227 TCP 66 6633 → 39462 [ACK] Seq=81 Ack=489 Win=853 Len=0 TSval=344173 TSecr=118904783
 98 1.318126600 172.31.31.144 -> 172.31.24.227 TCP 66 6633 → 39462 [ACK] Seq=81 Ack=1289 Win=853 Len=0 TSval=344173 TSecr=118904783
 99 1.318735469 172.31.31.144 -> 172.31.24.227 OpenFlow 82 Type: OFPT_MULTIPART_REQUEST, OFPMP_TABLE
100 1.319180600 172.31.24.227 -> 172.31.31.144 OpenFlow 6178 Type: OFPT_MULTIPART_REPLY, OFPMP_TABLE
101 1.319913632 172.31.31.144 -> 172.31.24.227 TCP 90 6633 → 39478 [PSH, ACK] Seq=1 Ack=1 Win=853 Len=24 TSval=344173 TSecr=118904353
102 1.320272831 172.31.24.227 -> 172.31.31.144 ESP 754 ESP (SPI=0x041302b0)
103 1.320987226 172.31.31.144 -> 172.31.24.227 TCP 122 6633 → 39478 [PSH, ACK] Seq=25 Ack=689 Win=853 Len=56 TSval=344174 TSecr=118904783
104 1.321049525 172.31.31.144 -> 172.31.24.227 TCP 82 6633 → 39478 [PSH, ACK] Seq=81 Ack=689 Win=853 Len=16 TSval=344174 TSecr=118904783
105 1.321147692 172.31.24.227 -> 172.31.31.144 OpenFlow 1178 Type: OFPT_MULTIPART_REPLY, OFPMP_FLOW
106 1.321296106 172.31.24.227 -> 172.31.31.144 OpenFlow 6178 Type: OFPT_MULTIPART_REPLY, OFPMP_TABLE
107 1.321550401 172.31.31.144 -> 172.31.24.227 TCP 66 6633 → 39478 [ACK] Seq=97 Ack=7913 Win=853 Len=0 TSval=344174 TSecr=118904784
108 1.324171000 172.31.31.144 -> 172.31.24.227 TCP 90 6633 → 39450 [PSH, ACK] Seq=1 Ack=1 Win=853 Len=24 TSval=344174 TSecr=118904352
109 1.324257153 172.31.31.144 -> 172.31.24.227 TCP 66 6633 → 39452 [ACK] Seq=97 Ack=9689 Win=853 Len=0 TSval=344175 TSecr=118904774
110 1.324507170 172.31.24.227 -> 172.31.31.144 OpenFlow 1090 Type: OFPT_MULTIPART_REPLY, OFPMP_PORT_STATS
111 1.325303150 172.31.31.144 -> 172.31.24.227 TCP 90 6633 → 39448 [PSH, ACK] Seq=1 Ack=1 Win=853 Len=24 TSval=344175 TSecr=118904353
112 1.325328751 172.31.31.144 -> 172.31.24.227 TCP 138 6633 → 39448 [PSH, ACK] Seq=25 Ack=1 Win=853 Len=72 TSval=344175 TSecr=118904353
113 1.325372028 172.31.31.144 -> 172.31.24.227 OpenFlow 122 Type: OFPT_MULTIPART_REQUEST, OFPMP_FLOW
114 1.325457130 172.31.24.227 -> 172.31.31.144 OpenFlow 754 Type: OFPT_MULTIPART_REPLY, OFPMP_PORT_STATS
115 1.325500040 172.31.24.227 -> 172.31.31.144 OpenFlow 762 Type: OFPT_MULTIPART_REPLY, OFPMP_FLOW
116 1.325656323 172.31.24.227 -> 172.31.31.144 OpenFlow 6178 Type: OFPT_MULTIPART_REPLY, OFPMP_TABLE
117 1.325729033 172.31.31.144 -> 172.31.24.227 TCP 66 6633 → 39448 [ACK] Seq=97 Ack=1385 Win=853 Len=0 TSval=344175 TSecr=118904785
118 1.325735112 172.31.24.227 -> 172.31.31.144 OpenFlow 1386 Type: OFPT_MULTIPART_REPLY, OFPMP_FLOW
119 1.327439993 172.31.31.144 -> 172.31.24.227 OpenFlow 82 Type: OFPT_MULTIPART_REQUEST, OFPMP_TABLE
120 1.327649227 172.31.24.227 -> 172.31.31.144 OpenFlow 6178 Type: OFPT_MULTIPART_REPLY, OFPMP_TABLE
121 1.328271518 172.31.31.144 -> 172.31.24.227 TCP 66 6633 → 39480 [ACK] Seq=97 Ack=8025 Win=853 Len=0 TSval=344176 TSecr=118904775
122 1.329635504 172.31.31.144 -> 172.31.24.227 TCP 90 6633 → 39454 [PSH, ACK] Seq=1 Ack=1 Win=853 Len=24 TSval=344176 TSecr=118904353
123 1.329793719 172.31.24.227 -> 172.31.31.144 OpenFlow 866 Type: OFPT_MULTIPART_REPLY, OFPMP_PORT_STATS
124 1.330734543 172.31.31.144 -> 172.31.24.227 OpenFlow 82 Type: OFPT_MULTIPART_REQUEST, OFPMP_TABLE
125 1.330767309 172.31.31.144 -> 172.31.24.227 OpenFlow 122 Type: OFPT_MULTIPART_REQUEST, OFPMP_FLOW
126 1.330949997 172.31.24.227 -> 172.31.31.144 OpenFlow 6178 Type: OFPT_MULTIPART_REPLY, OFPMP_TABLE
127 1.330997778 172.31.24.227 -> 172.31.31.144 OpenFlow 1178 Type: OFPT_MULTIPART_REPLY, OFPMP_FLOW
128 1.331264373 172.31.31.144 -> 172.31.24.227 TCP 66 6633 → 39454 [ACK] Seq=97 Ack=8025 Win=853 Len=0 TSval=344176 TSecr=118904786
129 1.333887483 172.31.31.144 -> 172.31.24.227 TCP 122 6633 → 39470 [PSH, ACK] Seq=1 Ack=1 Win=853 Len=56 TSval=344177 TSecr=118904351
130 1.333904318 172.31.31.144 -> 172.31.24.227 TCP 90 6633 → 39474 [PSH, ACK] Seq=1 Ack=1 Win=853 Len=24 TSval=344177 TSecr=118904353
131 1.333937221 172.31.31.144 -> 172.31.24.227 TCP 122 6633 → 39474 [PSH, ACK] Seq=25 Ack=1 Win=853 Len=56 TSval=344177 TSecr=118904353
132 1.333957088 172.31.31.144 -> 172.31.24.227 TCP 90 6633 → 39470 [PSH, ACK] Seq=57 Ack=1 Win=853 Len=24 TSval=344177 TSecr=118904351
133 1.334071897 172.31.24.227 -> 172.31.31.144 OpenFlow 3050 Type: OFPT_MULTIPART_REPLY, OFPMP_FLOW
134 1.334172223 172.31.24.227 -> 172.31.31.144 OpenFlow 754 Type: OFPT_MULTIPART_REPLY, OFPMP_PORT_STATS
135 1.334309241 172.31.24.227 -> 172.31.31.144 OpenFlow 978 Type: OFPT_MULTIPART_REPLY, OFPMP_PORT_STATS
136 1.334350991 172.31.31.144 -> 172.31.24.227 TCP 66 6633 → 39470 [ACK] Seq=81 Ack=2985 Win=853 Len=0 TSval=344177 TSecr=118904787
137 1.334377857 172.31.24.227 -> 172.31.31.144 OpenFlow 2010 Type: OFPT_MULTIPART_REPLY, OFPMP_FLOW
138 1.334384888 172.31.31.144 -> 172.31.24.227 TCP 66 6633 → 39470 [ACK] Seq=81 Ack=3673 Win=853 Len=0 TSval=344177 TSecr=118904787
139 1.334639006 172.31.31.144 -> 172.31.24.227 TCP 66 6633 → 39474 [ACK] Seq=81 Ack=2857 Win=853 Len=0 TSval=344177 TSecr=118904787
140 1.335060624 172.31.31.144 -> 172.31.24.227 OpenFlow 82 Type: OFPT_MULTIPART_REQUEST, OFPMP_TABLE
141 1.335283614 172.31.24.227 -> 172.31.31.144 OpenFlow 6178 Type: OFPT_MULTIPART_REPLY, OFPMP_TABLE
142 1.336205062 172.31.31.144 -> 172.31.24.227 OpenFlow 82 Type: OFPT_MULTIPART_REQUEST, OFPMP_TABLE
143 1.336253358 172.31.31.144 -> 172.31.24.227 TCP 66 6633 → 39464 [ACK] Seq=97 Ack=9177 Win=853 Len=0 TSval=344178 TSecr=118904778
144 1.336440315 172.31.24.227 -> 172.31.31.144 OpenFlow 6178 Type: OFPT_MULTIPART_REPLY, OFPMP_TABLE
145 1.340289548 172.31.31.144 -> 172.31.24.227 TCP 66 6633 → 39482 [ACK] Seq=97 Ack=7929 Win=853 Len=0 TSval=344179 TSecr=118904779
146 1.344304708 172.31.31.144 -> 172.31.24.227 TCP 66 6633 → 39446 [ACK] Seq=97 Ack=8665 Win=853 Len=0 TSval=344180 TSecr=118904780
147 1.347452542 172.31.31.144 -> 172.31.24.227 TCP 90 6633 → 39468 [PSH, ACK] Seq=1 Ack=1 Win=853 Len=24 TSval=344180 TSecr=118904354
148 1.347458622 172.31.31.144 -> 172.31.24.227 TCP 122 6633 → 39488 [PSH, ACK] Seq=1 Ack=1 Win=853 Len=56 TSval=344180 TSecr=118904353
149 1.347468186 172.31.31.144 -> 172.31.24.227 TCP 106 6633 → 39488 [PSH, ACK] Seq=57 Ack=1 Win=853 Len=40 TSval=344180 TSecr=118904353
150 1.347657157 172.31.24.227 -> 172.31.31.144 OpenFlow 978 Type: OFPT_MULTIPART_REPLY, OFPMP_PORT_STATS
151 1.347773416 172.31.24.227 -> 172.31.31.144 OpenFlow 2842 Type: OFPT_MULTIPART_REPLY, OFPMP_FLOW
152 1.347862090 172.31.24.227 -> 172.31.31.144 OpenFlow 642 Type: OFPT_MULTIPART_REPLY, OFPMP_PORT_STATS
153 1.347869611 172.31.31.144 -> 172.31.24.227 TCP 66 6633 → 39468 [ACK] Seq=25 Ack=913 Win=853 Len=0 TSval=344180 TSecr=118904790
154 1.348015339 172.31.24.227 -> 172.31.31.144 OpenFlow 6178 Type: OFPT_MULTIPART_REPLY, OFPMP_TABLE
155 1.348068843 172.31.31.144 -> 172.31.24.227 TCP 66 6633 → 39488 [ACK] Seq=97 Ack=2777 Win=853 Len=0 TSval=344180 TSecr=118904790
156 1.348073749 172.31.31.144 -> 172.31.24.227 TCP 66 6633 → 39488 [ACK] Seq=97 Ack=3353 Win=853 Len=0 TSval=344180 TSecr=118904790
157 1.348248302 172.31.31.144 -> 172.31.24.227 TCP 66 6633 → 39484 [ACK] Seq=97 Ack=8665 Win=853 Len=0 TSval=344181 TSecr=118904781
158 1.348306815 172.31.31.144 -> 172.31.24.227 TCP 66 6633 → 39488 [ACK] Seq=97 Ack=9465 Win=853 Len=0 TSval=344181 TSecr=118904790
159 1.349554631 172.31.31.144 -> 172.31.24.227 OpenFlow 122 Type: OFPT_MULTIPART_REQUEST, OFPMP_FLOW
160 1.349745065 172.31.24.227 -> 172.31.31.144 OpenFlow 2634 Type: OFPT_MULTIPART_REPLY, OFPMP_FLOW
161 1.353774753 172.31.31.144 -> 172.31.24.227 OpenFlow 82 Type: OFPT_MULTIPART_REQUEST, OFPMP_TABLE
162 1.354260996 172.31.24.227 -> 172.31.31.144 OpenFlow 6178 Type: OFPT_MULTIPART_REPLY, OFPMP_TABLE
163 1.356304418 172.31.31.144 -> 172.31.24.227 TCP 66 6633 → 39462 [ACK] Seq=97 Ack=7401 Win=853 Len=0 TSval=344183 TSecr=118904783
164 1.357999672 172.31.31.144 -> 172.31.24.227 TCP 122 6633 → 39460 [PSH, ACK] Seq=1 Ack=1 Win=853 Len=56 TSval=344183 TSecr=118904352
165 1.358008710 172.31.24.227 -> 172.31.31.144 TCP 66 39460 → 6633 [ACK] Seq=1 Ack=57 Win=63 Len=0 TSval=118904793 TSecr=344183
166 1.358013263 172.31.31.144 -> 172.31.24.227 TCP 90 6633 → 39456 [PSH, ACK] Seq=1 Ack=1 Win=853 Len=24 TSval=344183 TSecr=118904353
167 1.358018755 172.31.31.144 -> 172.31.24.227 TCP 106 6633 → 39460 [PSH, ACK] Seq=57 Ack=1 Win=853 Len=40 TSval=344183 TSecr=118904352
168 1.358034201 172.31.24.227 -> 172.31.31.144 TCP 66 39460 → 6633 [ACK] Seq=1 Ack=97 Win=63 Len=0 TSval=118904793 TSecr=344183
169 1.358035670 172.31.31.144 -> 172.31.24.227 TCP 138 6633 → 39456 [PSH, ACK] Seq=25 Ack=1 Win=853 Len=72 TSval=344183 TSecr=118904353
170 1.358216411 172.31.24.227 -> 172.31.31.144 OpenFlow 866 Type: OFPT_MULTIPART_REPLY, OFPMP_PORT_STATS
171 1.358270764 172.31.24.227 -> 172.31.31.144 OpenFlow 1386 Type: OFPT_MULTIPART_REPLY, OFPMP_FLOW
172 1.358425827 172.31.24.227 -> 172.31.31.144 OpenFlow 6178 Type: OFPT_MULTIPART_REPLY, OFPMP_TABLE
173 1.358478551 172.31.31.144 -> 172.31.24.227 TCP 66 6633 → 39456 [ACK] Seq=97 Ack=801 Win=853 Len=0 TSval=344183 TSecr=118904793
174 1.358489960 172.31.31.144 -> 172.31.24.227 TCP 66 6633 → 39456 [ACK] Seq=97 Ack=2121 Win=853 Len=0 TSval=344183 TSecr=118904793
175 1.358524117 172.31.24.227 -> 172.31.31.144 OpenFlow 2426 Type: OFPT_MULTIPART_REPLY, OFPMP_FLOW
176 1.358603746 172.31.24.227 -> 172.31.31.144 OpenFlow 642 Type: OFPT_MULTIPART_REPLY, OFPMP_PORT_STATS
177 1.358665544 172.31.31.144 -> 172.31.24.227 TCP 66 6633 → 39456 [ACK] Seq=97 Ack=8233 Win=853 Len=0 TSval=344183 TSecr=118904793
178 1.358767303 172.31.24.227 -> 172.31.31.144 OpenFlow 6178 Type: OFPT_MULTIPART_REPLY, OFPMP_TABLE
179 1.358908726 172.31.31.144 -> 172.31.24.227 TCP 66 6633 → 39460 [ACK] Seq=97 Ack=2937 Win=853 Len=0 TSval=344183 TSecr=118904793
180 1.359079198 172.31.31.144 -> 172.31.24.227 TCP 122 6633 → 39472 [PSH, ACK] Seq=1 Ack=1 Win=853 Len=56 TSval=344183 TSecr=118904353
181 1.359140776 172.31.31.144 -> 172.31.24.227 TCP 106 6633 → 39472 [PSH, ACK] Seq=57 Ack=1 Win=853 Len=40 TSval=344183 TSecr=118904353
182 1.359254473 172.31.24.227 -> 172.31.31.144 OpenFlow 2634 Type: OFPT_MULTIPART_REPLY, OFPMP_FLOW
183 1.359335008 172.31.24.227 -> 172.31.31.144 OpenFlow 642 Type: OFPT_MULTIPART_REPLY, OFPMP_PORT_STATS
184 1.359477939 172.31.24.227 -> 172.31.31.144 OpenFlow 6178 Type: OFPT_MULTIPART_REPLY, OFPMP_TABLE
185 1.359637915 172.31.31.144 -> 172.31.24.227 TCP 66 6633 → 39472 [ACK] Seq=97 Ack=3145 Win=853 Len=0 TSval=344183 TSecr=118904793
186 1.363205867 172.31.31.144 -> 172.31.24.227 TCP 90 6633 → 39466 [PSH, ACK] Seq=1 Ack=1 Win=853 Len=24 TSval=344184 TSecr=118904352
187 1.363425105 172.31.24.227 -> 172.31.31.144 OpenFlow 1202 Type: OFPT_MULTIPART_REPLY, OFPMP_PORT_STATS
188 1.364279192 172.31.31.144 -> 172.31.24.227 TCP 66 6633 → 39450 [ACK] Seq=97 Ack=8457 Win=853 Len=0 TSval=344185 TSecr=118904785
189 1.364300641 172.31.31.144 -> 172.31.24.227 TCP 66 6633 → 39448 [ACK] Seq=97 Ack=7497 Win=853 Len=0 TSval=344185 TSecr=118904785
190 1.364363727 172.31.31.144 -> 172.31.24.227 OpenFlow 122 Type: OFPT_MULTIPART_REQUEST, OFPMP_FLOW
191 1.364402951 172.31.31.144 -> 172.31.24.227 OpenFlow 82 Type: OFPT_MULTIPART_REQUEST, OFPMP_TABLE
192 1.364541903 172.31.24.227 -> 172.31.31.144 OpenFlow 3466 Type: OFPT_MULTIPART_REPLY, OFPMP_FLOW
193 1.364693465 172.31.24.227 -> 172.31.31.144 OpenFlow 6178 Type: OFPT_MULTIPART_REPLY, OFPMP_TABLE
194 1.364929845 172.31.31.144 -> 172.31.24.227 TCP 66 6633 → 39466 [ACK] Seq=97 Ack=10649 Win=853 Len=0 TSval=344185 TSecr=118904794
195 1.372297208 172.31.31.144 -> 172.31.24.227 TCP 66 6633 → 39470 [ACK] Seq=97 Ack=9785 Win=853 Len=0 TSval=344187 TSecr=118904787
196 1.376260296 172.31.31.144 -> 172.31.24.227 TCP 66 6633 → 39474 [ACK] Seq=97 Ack=8969 Win=853 Len=0 TSval=344188 TSecr=118904787
197 1.392367822 172.31.31.144 -> 172.31.24.227 TCP 66 6633 → 39468 [ACK] Seq=97 Ack=9593 Win=853 Len=0 TSval=344192 TSecr=118904792
198 1.396318127 172.31.31.144 -> 172.31.24.227 TCP 66 6633 → 39460 [ACK] Seq=97 Ack=9049 Win=853 Len=0 TSval=344193 TSecr=118904793
199 1.396323482 172.31.31.144 -> 172.31.24.227 TCP 66 6633 → 39472 [ACK] Seq=97 Ack=9257 Win=853 Len=0 TSval=344193 TSecr=118904793
200 1.429855366 41.177.127.217 -> 172.31.24.227 TCP 54 58416 → 22 [ACK] Seq=1 Ack=509 Win=32346 Len=0
201 1.662199348 172.31.24.227 -> 41.177.127.217 SSH 98 Server: Encrypted packet (len=44)
202 1.907052406 41.177.127.217 -> 172.31.24.227 TCP 54 58416 → 22 [ACK] Seq=1 Ack=553 Win=32324 Len=0
203 2.163366496 172.31.24.227 -> 41.177.127.217 SSH 98 Server: Encrypted packet (len=44)
204 2.425748431 41.177.127.217 -> 172.31.24.227 TCP 54 58416 → 22 [ACK] Seq=1 Ack=597 Win=32302 Len=0
205 2.488533050 172.31.31.144 -> 172.31.24.227 OpenFlow 187 Type: OFPT_PACKET_OUT
206 2.488561583 172.31.31.144 -> 172.31.24.227 OpenFlow 187 Type: OFPT_PACKET_OUT
207 2.488574861 172.31.31.144 -> 172.31.24.227 OpenFlow 187 Type: OFPT_PACKET_OUT
208 2.488599748 172.31.31.144 -> 172.31.24.227 OpenFlow 187 Type: OFPT_PACKET_OUT
209 2.488604328 172.31.31.144 -> 172.31.24.227 OpenFlow 187 Type: OFPT_PACKET_OUT
210 2.488617486 172.31.24.227 -> 172.31.31.144 TCP 66 39480 → 6633 [ACK] Seq=8025 Ack=702 Win=70 Len=0 TSval=118905075 TSecr=344466
211 2.488630436 172.31.31.144 -> 172.31.24.227 OpenFlow 187 Type: OFPT_PACKET_OUT
212 2.488735473 172.31.31.144 -> 172.31.24.227 OpenFlow 187 Type: OFPT_PACKET_OUT
213 2.488761877 172.31.31.144 -> 172.31.24.227 OpenFlow 187 Type: OFPT_PACKET_OUT
214 2.488793461 172.31.31.144 -> 172.31.24.227 OpenFlow 187 Type: OFPT_PACKET_OUT
215 2.488826152 172.31.31.144 -> 172.31.24.227 OpenFlow 187 Type: OFPT_PACKET_OUT
216 2.488830926 172.31.24.227 -> 172.31.31.144 TCP 66 39480 → 6633 [ACK] Seq=8025 Ack=1307 Win=70 Len=0 TSval=118905076 TSecr=344466
217 2.488882030 172.31.31.144 -> 172.31.24.227 OpenFlow 187 Type: OFPT_PACKET_OUT
218 2.488930596 172.31.31.144 -> 172.31.24.227 OpenFlow 187 Type: OFPT_PACKET_OUT
219 2.489041749 172.31.31.144 -> 172.31.24.227 OpenFlow 187 Type: OFPT_PACKET_OUT
220 2.489063235 172.31.31.144 -> 172.31.24.227 OpenFlow 187 Type: OFPT_PACKET_OUT
221 2.489111919 172.31.31.144 -> 172.31.24.227 OpenFlow 187 Type: OFPT_PACKET_OUT
222 2.489152028 172.31.31.144 -> 172.31.24.227 OpenFlow 187 Type: OFPT_PACKET_OUT
223 2.489209052 172.31.31.144 -> 172.31.24.227 OpenFlow 187 Type: OFPT_PACKET_OUT
224 2.489215778 172.31.24.227 -> 172.31.31.144 TCP 66 39456 → 6633 [ACK] Seq=8233 Ack=702 Win=61 Len=0 TSval=118905076 TSecr=344466
225 2.489260367 172.31.31.144 -> 172.31.24.227 OpenFlow 187 Type: OFPT_PACKET_OUT
226 2.489310285 172.31.31.144 -> 172.31.24.227 OpenFlow 187 Type: OFPT_PACKET_OUT
227 2.489346455 172.31.31.144 -> 172.31.24.227 OpenFlow 187 Type: OFPT_PACKET_OUT
228 2.489391134 172.31.31.144 -> 172.31.24.227 OpenFlow 187 Type: OFPT_PACKET_OUT
229 2.489445350 172.31.31.144 -> 172.31.24.227 OpenFlow 187 Type: OFPT_PACKET_OUT
230 2.489450760 172.31.24.227 -> 172.31.31.144 TCP 66 39456 → 6633 [ACK] Seq=8233 Ack=1307 Win=61 Len=0 TSval=118905076 TSecr=344466
231 2.489495177 172.31.31.144 -> 172.31.24.227 OpenFlow 187 Type: OFPT_PACKET_OUT
232 2.489570472 172.31.31.144 -> 172.31.24.227 OpenFlow 187 Type: OFPT_PACKET_OUT
233 2.489612143 172.31.31.144 -> 172.31.24.227 OpenFlow 187 Type: OFPT_PACKET_OUT
234 2.489651819 172.31.31.144 -> 172.31.24.227 OpenFlow 187 Type: OFPT_PACKET_OUT
235 2.489673789 172.31.24.227 -> 172.31.31.144 TCP 66 39480 → 6633 [ACK] Seq=8025 Ack=1549 Win=70 Len=0 TSval=118905076 TSecr=344466
236 2.489717354 172.31.31.144 -> 172.31.24.227 OpenFlow 187 Type: OFPT_PACKET_OUT
237 2.489766562 172.31.31.144 -> 172.31.24.227 OpenFlow 187 Type: OFPT_PACKET_OUT
238 2.489772530 172.31.24.227 -> 172.31.31.144 OpenFlow 189 Type: OFPT_PACKET_IN
239 2.489792246 172.31.24.227 -> 172.31.31.144 OpenFlow 435 Type: OFPT_PACKET_IN
240 2.489817844 172.31.31.144 -> 172.31.24.227 OpenFlow 187 Type: OFPT_PACKET_OUT
241 2.489843352 172.31.31.144 -> 172.31.24.227 OpenFlow 187 Type: OFPT_PACKET_OUT
242 2.489847937 172.31.24.227 -> 172.31.31.144 TCP 66 39486 → 6633 [ACK] Seq=8633 Ack=823 Win=73 Len=0 TSval=118905076 TSecr=344466
243 2.489908097 172.31.31.144 -> 172.31.24.227 OpenFlow 187 Type: OFPT_PACKET_OUT
244 2.489949410 172.31.31.144 -> 172.31.24.227 OpenFlow 187 Type: OFPT_PACKET_OUT
245 2.489967602 172.31.31.144 -> 172.31.24.227 TCP 66 6633 → 39484 [ACK] Seq=97 Ack=8788 Win=853 Len=0 TSval=344466 TSecr=118905076
246 2.489987496 172.31.31.144 -> 172.31.24.227 TCP 66 6633 → 39484 [ACK] Seq=97 Ack=9157 Win=853 Len=0 TSval=344466 TSecr=118905076
247 2.490071429 172.31.31.144 -> 172.31.24.227 OpenFlow 187 Type: OFPT_PACKET_OUT
248 2.490101720 172.31.31.144 -> 172.31.24.227 OpenFlow 187 Type: OFPT_PACKET_OUT
249 2.490125916 172.31.24.227 -> 172.31.31.144 TCP 66 39486 → 6633 [ACK] Seq=8633 Ack=1065 Win=73 Len=0 TSval=118905076 TSecr=344466
250 2.490141648 172.31.31.144 -> 172.31.24.227 OpenFlow 187 Type: OFPT_PACKET_OUT
251 2.490181252 172.31.31.144 -> 172.31.24.227 OpenFlow 187 Type: OFPT_PACKET_OUT
252 2.490226545 172.31.31.144 -> 172.31.24.227 OpenFlow 187 Type: OFPT_PACKET_OUT
253 2.490231822 172.31.24.227 -> 172.31.31.144 TCP 66 39468 → 6633 [ACK] Seq=9593 Ack=702 Win=76 Len=0 TSval=118905076 TSecr=344466
254 2.490241710 172.31.24.227 -> 172.31.31.144 OpenFlow 189 Type: OFPT_PACKET_IN
255 2.490249304 172.31.31.144 -> 172.31.24.227 OpenFlow 187 Type: OFPT_PACKET_OUT
256 2.490279081 172.31.24.227 -> 172.31.31.144 OpenFlow 189 Type: OFPT_PACKET_IN
257 2.490323740 172.31.31.144 -> 172.31.24.227 OpenFlow 187 Type: OFPT_PACKET_OUT
258 2.490353451 172.31.31.144 -> 172.31.24.227 OpenFlow 187 Type: OFPT_PACKET_OUT
259 2.490401990 172.31.31.144 -> 172.31.24.227 OpenFlow 187 Type: OFPT_PACKET_OUT
260 2.490425049 172.31.31.144 -> 172.31.24.227 TCP 66 6633 → 39492 [ACK] Seq=97 Ack=7828 Win=853 Len=0 TSval=344466 TSecr=118905076
261 2.490440630 172.31.31.144 -> 172.31.24.227 TCP 66 6633 → 39492 [ACK] Seq=97 Ack=7951 Win=853 Len=0 TSval=344466 TSecr=118905076
262 2.490460552 172.31.31.144 -> 172.31.24.227 OpenFlow 187 Type: OFPT_PACKET_OUT
263 2.490464800 172.31.24.227 -> 172.31.31.144 TCP 66 39468 → 6633 [ACK] Seq=9593 Ack=1307 Win=76 Len=0 TSval=118905076 TSecr=344466
264 2.490514236 172.31.31.144 -> 172.31.24.227 OpenFlow 187 Type: OFPT_PACKET_OUT
265 2.490567357 172.31.31.144 -> 172.31.24.227 OpenFlow 187 Type: OFPT_PACKET_OUT
266 2.490592430 172.31.31.144 -> 172.31.24.227 OpenFlow 187 Type: OFPT_PACKET_OUT
267 2.490645135 172.31.31.144 -> 172.31.24.227 OpenFlow 187 Type: OFPT_PACKET_OUT
268 2.490762073 172.31.31.144 -> 172.31.24.227 OpenFlow 187 Type: OFPT_PACKET_OUT
269 2.490779591 172.31.31.144 -> 172.31.24.227 OpenFlow 187 Type: OFPT_PACKET_OUT
270 2.490805775 172.31.31.144 -> 172.31.24.227 OpenFlow 187 Type: OFPT_PACKET_OUT
271 2.490944331 172.31.31.144 -> 172.31.24.227 OpenFlow 187 Type: OFPT_PACKET_OUT
272 2.490978748 172.31.24.227 -> 172.31.31.144 TCP 66 39456 → 6633 [ACK] Seq=8233 Ack=1549 Win=61 Len=0 TSval=118905076 TSecr=344466
273 2.491049392 172.31.31.144 -> 172.31.24.227 OpenFlow 187 Type: OFPT_PACKET_OUT
274 2.491054992 172.31.24.227 -> 172.31.31.144 OpenFlow 189 Type: OFPT_PACKET_IN
275 2.491076814 172.31.24.227 -> 172.31.31.144 OpenFlow 189 Type: OFPT_PACKET_IN
276 2.491095329 172.31.24.227 -> 172.31.31.144 OpenFlow 189 Type: OFPT_PACKET_IN
277 2.491161809 172.31.24.227 -> 172.31.31.144 OpenFlow 681 Type: OFPT_PACKET_IN
278 2.491198930 172.31.31.144 -> 172.31.24.227 OpenFlow 187 Type: OFPT_PACKET_OUT
279 2.491204138 172.31.31.144 -> 172.31.24.227 OpenFlow 187 Type: OFPT_PACKET_OUT
280 2.491243582 172.31.31.144 -> 172.31.24.227 TCP 66 6633 → 39458 [ACK] Seq=97 Ack=10052 Win=853 Len=0 TSval=344466 TSecr=118905076
281 2.491263607 172.31.31.144 -> 172.31.24.227 OpenFlow 187 Type: OFPT_PACKET_OUT
282 2.491300328 172.31.31.144 -> 172.31.24.227 TCP 66 6633 → 39458 [ACK] Seq=97 Ack=10175 Win=853 Len=0 TSval=344466 TSecr=118905076
283 2.491335043 172.31.31.144 -> 172.31.24.227 TCP 66 6633 → 39464 [ACK] Seq=97 Ack=9300 Win=853 Len=0 TSval=344466 TSecr=118905076
284 2.491352431 172.31.31.144 -> 172.31.24.227 OpenFlow 187 Type: OFPT_PACKET_OUT
285 2.491372177 172.31.31.144 -> 172.31.24.227 TCP 66 6633 → 39464 [ACK] Seq=97 Ack=9915 Win=853 Len=0 TSval=344466 TSecr=118905076
286 2.491392773 172.31.31.144 -> 172.31.24.227 OpenFlow 187 Type: OFPT_PACKET_OUT
287 2.491570474 172.31.24.227 -> 172.31.31.144 TCP 66 39466 → 6633 [ACK] Seq=10649 Ack=1307 Win=187 Len=0 TSval=118905076 TSecr=344466
288 2.491793320 172.31.31.144 -> 172.31.24.227 OpenFlow 792 Type: OFPT_PACKET_OUT
289 2.491815611 172.31.31.144 -> 172.31.24.227 OpenFlow 187 Type: OFPT_PACKET_OUT
290 2.491884084 172.31.31.144 -> 172.31.24.227 OpenFlow 187 Type: OFPT_PACKET_OUT
291 2.492025296 172.31.31.144 -> 172.31.24.227 OpenFlow 187 Type: OFPT_PACKET_OUT
292 2.492062173 172.31.31.144 -> 172.31.24.227 OpenFlow 187 Type: OFPT_PACKET_OUT
293 2.492125959 172.31.24.227 -> 172.31.31.144 TCP 66 39468 → 6633 [ACK] Seq=9593 Ack=1791 Win=76 Len=0 TSval=118905076 TSecr=344466
294 2.492175860 172.31.31.144 -> 172.31.24.227 OpenFlow 187 Type: OFPT_PACKET_OUT
295 2.492204260 172.31.24.227 -> 172.31.31.144 OpenFlow 189 Type: OFPT_PACKET_IN
296 2.492231110 172.31.24.227 -> 172.31.31.144 OpenFlow 681 Type: OFPT_PACKET_IN
297 2.492238844 172.31.24.227 -> 172.31.31.144 OpenFlow 189 Type: OFPT_PACKET_IN
298 2.492254146 172.31.31.144 -> 172.31.24.227 OpenFlow 187 Type: OFPT_PACKET_OUT
299 2.492264094 172.31.24.227 -> 172.31.31.144 OpenFlow 189 Type: OFPT_PACKET_IN
300 2.492281512 172.31.24.227 -> 172.31.31.144 OpenFlow 189 Type: OFPT_PACKET_IN
301 2.492283772 172.31.24.227 -> 172.31.31.144 OpenFlow 189 Type: OFPT_PACKET_IN
302 2.492329870 172.31.24.227 -> 172.31.31.144 OpenFlow 189 Type: OFPT_PACKET_IN
303 2.492335710 172.31.24.227 -> 172.31.31.144 OpenFlow 435 Type: OFPT_PACKET_IN
304 2.492371756 172.31.31.144 -> 172.31.24.227 OpenFlow 187 Type: OFPT_PACKET_OUT
305 2.492388670 172.31.24.227 -> 172.31.31.144 TCP 66 39490 → 6633 [ACK] Seq=7705 Ack=702 Win=55 Len=0 TSval=118905076 TSecr=344466
306 2.492432546 172.31.31.144 -> 172.31.24.227 TCP 66 6633 → 39470 [ACK] Seq=97 Ack=9908 Win=853 Len=0 TSval=344467 TSecr=118905076
307 2.492458030 172.31.31.144 -> 172.31.24.227 TCP 66 6633 → 39470 [ACK] Seq=97 Ack=10523 Win=853 Len=0 TSval=344467 TSecr=118905076
308 2.492461852 172.31.31.144 -> 172.31.24.227 TCP 66 6633 → 39472 [ACK] Seq=97 Ack=9380 Win=853 Len=0 TSval=344467 TSecr=118905076
309 2.492477125 172.31.31.144 -> 172.31.24.227 OpenFlow 187 Type: OFPT_PACKET_OUT
310 2.492495685 172.31.31.144 -> 172.31.24.227 TCP 66 6633 → 39476 [ACK] Seq=97 Ack=8644 Win=853 Len=0 TSval=344467 TSecr=118905076
311 2.492533245 172.31.31.144 -> 172.31.24.227 OpenFlow 187 Type: OFPT_PACKET_OUT
312 2.492549744 172.31.31.144 -> 172.31.24.227 TCP 66 6633 → 39472 [ACK] Seq=97 Ack=9503 Win=853 Len=0 TSval=344467 TSecr=118905076
313 2.492575464 172.31.31.144 -> 172.31.24.227 OpenFlow 187 Type: OFPT_PACKET_OUT
314 2.492589047 172.31.31.144 -> 172.31.24.227 TCP 66 6633 → 39476 [ACK] Seq=97 Ack=8767 Win=853 Len=0 TSval=344467 TSecr=118905076
315 2.492609093 172.31.31.144 -> 172.31.24.227 OpenFlow 187 Type: OFPT_PACKET_OUT
316 2.492691241 172.31.31.144 -> 172.31.24.227 OpenFlow 187 Type: OFPT_PACKET_OUT
317 2.492709287 172.31.24.227 -> 172.31.31.144 TCP 66 39490 → 6633 [ACK] Seq=7705 Ack=1307 Win=55 Len=0 TSval=118905077 TSecr=344467
318 2.492804686 172.31.31.144 -> 172.31.24.227 TCP 66 6633 → 39478 [ACK] Seq=97 Ack=8405 Win=853 Len=0 TSval=344467 TSecr=118905076
319 2.492926187 172.31.24.227 -> 172.31.31.144 OpenFlow 189 Type: OFPT_PACKET_IN
320 2.492946340 172.31.24.227 -> 172.31.31.144 OpenFlow 435 Type: OFPT_PACKET_IN
321 2.493031584 172.31.24.227 -> 172.31.31.144 OpenFlow 189 Type: OFPT_PACKET_IN
322 2.493051019 172.31.24.227 -> 172.31.31.144 OpenFlow 804 Type: OFPT_PACKET_IN
323 2.493069507 172.31.24.227 -> 172.31.31.144 OpenFlow 189 Type: OFPT_PACKET_IN
324 2.493077095 172.31.24.227 -> 172.31.31.144 OpenFlow 189 Type: OFPT_PACKET_IN
325 2.493090591 172.31.24.227 -> 172.31.31.144 OpenFlow 189 Type: OFPT_PACKET_IN
326 2.493098933 172.31.31.144 -> 172.31.24.227 TCP 66 6633 → 39492 [ACK] Seq=97 Ack=8074 Win=853 Len=0 TSval=344467 TSecr=118905077
327 2.493116323 172.31.24.227 -> 172.31.31.144 OpenFlow 189 Type: OFPT_PACKET_IN
328 2.493121622 172.31.24.227 -> 172.31.31.144 OpenFlow 189 Type: OFPT_PACKET_IN
329 2.493159560 172.31.24.227 -> 172.31.31.144 OpenFlow 189 Type: OFPT_PACKET_IN
330 2.493161591 172.31.24.227 -> 172.31.31.144 OpenFlow 435 Type: OFPT_PACKET_IN
331 2.493177852 172.31.31.144 -> 172.31.24.227 TCP 66 6633 → 39492 [ACK] Seq=97 Ack=8443 Win=853 Len=0 TSval=344467 TSecr=118905077
332 2.493186720 172.31.24.227 -> 172.31.31.144 OpenFlow 189 Type: OFPT_PACKET_IN
333 2.493191358 172.31.24.227 -> 172.31.31.144 OpenFlow 681 Type: OFPT_PACKET_IN
334 2.493210872 172.31.24.227 -> 172.31.31.144 OpenFlow 189 Type: OFPT_PACKET_IN
335 2.493271894 172.31.31.144 -> 172.31.24.227 TCP 66 6633 → 39446 [ACK] Seq=97 Ack=8788 Win=853 Len=0 TSval=344467 TSecr=118905077
336 2.493277893 172.31.31.144 -> 172.31.24.227 TCP 66 6633 → 39446 [ACK] Seq=97 Ack=9526 Win=853 Len=0 TSval=344467 TSecr=118905077
337 2.493279777 172.31.31.144 -> 172.31.24.227 TCP 66 6633 → 39448 [ACK] Seq=97 Ack=7620 Win=853 Len=0 TSval=344467 TSecr=118905077
338 2.493285458 172.31.24.227 -> 172.31.31.144 OpenFlow 189 Type: OFPT_PACKET_IN
339 2.493291617 172.31.24.227 -> 172.31.31.144 OpenFlow 681 Type: OFPT_PACKET_IN
340 2.493343264 172.31.31.144 -> 172.31.24.227 TCP 66 6633 → 39446 [ACK] Seq=97 Ack=9649 Win=853 Len=0 TSval=344467 TSecr=118905077
341 2.493348497 172.31.31.144 -> 172.31.24.227 TCP 66 6633 → 39450 [ACK] Seq=97 Ack=8580 Win=853 Len=0 TSval=344467 TSecr=118905077
342 2.493350543 172.31.31.144 -> 172.31.24.227 TCP 66 6633 → 39452 [ACK] Seq=97 Ack=9812 Win=853 Len=0 TSval=344467 TSecr=118905077
343 2.493356262 172.31.24.227 -> 172.31.31.144 OpenFlow 189 Type: OFPT_PACKET_IN
344 2.493396863 172.31.31.144 -> 172.31.24.227 TCP 66 6633 → 39448 [ACK] Seq=97 Ack=7743 Win=853 Len=0 TSval=344467 TSecr=118905077
345 2.493401263 172.31.31.144 -> 172.31.24.227 TCP 66 6633 → 39458 [ACK] Seq=97 Ack=10298 Win=853 Len=0 TSval=344467 TSecr=118905077
346 2.493403182 172.31.31.144 -> 172.31.24.227 TCP 66 6633 → 39450 [ACK] Seq=97 Ack=8949 Win=853 Len=0 TSval=344467 TSecr=118905077
347 2.493442950 172.31.31.144 -> 172.31.24.227 TCP 66 6633 → 39462 [ACK] Seq=97 Ack=7524 Win=853 Len=0 TSval=344467 TSecr=118905077
348 2.493459942 172.31.31.144 -> 172.31.24.227 TCP 66 6633 → 39452 [ACK] Seq=97 Ack=10427 Win=853 Len=0 TSval=344467 TSecr=118905077
349 2.493478843 172.31.31.144 -> 172.31.24.227 TCP 66 6633 → 39464 [ACK] Seq=97 Ack=10038 Win=853 Len=0 TSval=344467 TSecr=118905077
350 2.493498493 172.31.31.144 -> 172.31.24.227 TCP 66 6633 → 39458 [ACK] Seq=97 Ack=10421 Win=853 Len=0 TSval=344467 TSecr=118905077
351 2.493522337 172.31.31.144 -> 172.31.24.227 TCP 66 6633 → 39462 [ACK] Seq=97 Ack=8139 Win=853 Len=0 TSval=344467 TSecr=118905077
352 2.493545310 172.31.31.144 -> 172.31.24.227 TCP 66 6633 → 39464 [ACK] Seq=97 Ack=10161 Win=853 Len=0 TSval=344467 TSecr=118905077
353 2.493633313 172.31.24.227 -> 172.31.31.144 TCP 66 39466 → 6633 [ACK] Seq=10649 Ack=2275 Win=193 Len=0 TSval=118905077 TSecr=344466
354 2.493827627 172.31.24.227 -> 172.31.31.144 OpenFlow 189 Type: OFPT_PACKET_IN
355 2.493849058 172.31.24.227 -> 172.31.31.144 OpenFlow 189 Type: OFPT_PACKET_IN
356 2.493873090 172.31.24.227 -> 172.31.31.144 OpenFlow 189 Type: OFPT_PACKET_IN
357 2.493895404 172.31.24.227 -> 172.31.31.144 OpenFlow 681 Type: OFPT_PACKET_IN
358 2.493995738 172.31.31.144 -> 172.31.24.227 TCP 66 6633 → 39450 [ACK] Seq=97 Ack=9072 Win=853 Len=0 TSval=344467 TSecr=118905077
359 2.494022658 172.31.31.144 -> 172.31.24.227 TCP 66 6633 → 39450 [ACK] Seq=97 Ack=9195 Win=853 Len=0 TSval=344467 TSecr=118905077
360 2.494051550 172.31.31.144 -> 172.31.24.227 TCP 66 6633 → 39458 [ACK] Seq=97 Ack=10544 Win=853 Len=0 TSval=344467 TSecr=118905077
361 2.494086405 172.31.31.144 -> 172.31.24.227 TCP 66 6633 → 39458 [ACK] Seq=97 Ack=11159 Win=853 Len=0 TSval=344467 TSecr=118905077
362 2.588142321 172.31.31.144 -> 172.31.24.227 OpenFlow 187 Type: OFPT_PACKET_OUT
363 2.588168522 172.31.31.144 -> 172.31.24.227 OpenFlow 187 Type: OFPT_PACKET_OUT
364 2.588190874 172.31.31.144 -> 172.31.24.227 OpenFlow 187 Type: OFPT_PACKET_OUT
365 2.588250297 172.31.31.144 -> 172.31.24.227 OpenFlow 187 Type: OFPT_PACKET_OUT
366 2.588317677 172.31.31.144 -> 172.31.24.227 OpenFlow 187 Type: OFPT_PACKET_OUT
367 2.588327707 172.31.24.227 -> 172.31.31.144 TCP 66 39472 → 6633 [ACK] Seq=9503 Ack=702 Win=61 Len=0 TSval=118905100 TSecr=344490
368 2.588411610 172.31.31.144 -> 172.31.24.227 OpenFlow 187 Type: OFPT_PACKET_OUT
369 2.588437026 172.31.31.144 -> 172.31.24.227 OpenFlow 187 Type: OFPT_PACKET_OUT
370 2.588504988 172.31.31.144 -> 172.31.24.227 OpenFlow 187 Type: OFPT_PACKET_OUT
371 2.588577310 172.31.31.144 -> 172.31.24.227 OpenFlow 187 Type: OFPT_PACKET_OUT
