  1 0.000000000 172.31.31.144 -> 172.31.23.72 TCP 90 6633 → 33642 [PSH, ACK] Seq=1 Ack=1 Win=853 Len=24 TSval=1247614 TSecr=26086389
  2 0.000246308 172.31.23.72 -> 172.31.31.144 OpenFlow 754 Type: OFPT_MULTIPART_REPLY, OFPMP_PORT_STATS
  3 0.000532762 172.31.31.144 -> 172.31.23.72 TCP 66 6633 → 33642 [ACK] Seq=25 Ack=689 Win=853 Len=0 TSval=1247614 TSecr=26086715
  4 0.001161314 172.31.31.144 -> 172.31.23.72 OpenFlow 122 Type: OFPT_MULTIPART_REQUEST, OFPMP_FLOW
  5 0.001166831 172.31.31.144 -> 172.31.23.72 OpenFlow 82 Type: OFPT_MULTIPART_REQUEST, OFPMP_TABLE
  6 0.005158907 172.31.23.72 -> 172.31.31.144 OpenFlow 1594 Type: OFPT_MULTIPART_REPLY, OFPMP_FLOW
  7 0.005339350 172.31.23.72 -> 172.31.31.144 OpenFlow 6178 Type: OFPT_MULTIPART_REPLY, OFPMP_TABLE
  8 0.005652680 172.31.31.144 -> 172.31.23.72 TCP 66 6633 → 33642 [ACK] Seq=97 Ack=8329 Win=853 Len=0 TSval=1247615 TSecr=26086716
  9 0.043407400 172.31.31.144 -> 172.31.23.72 TCP 122 6633 → 33644 [PSH, ACK] Seq=1 Ack=1 Win=853 Len=56 TSval=1247625 TSecr=26086412
 10 0.043428668 172.31.31.144 -> 172.31.23.72 TCP 106 6633 → 33644 [PSH, ACK] Seq=57 Ack=1 Win=853 Len=40 TSval=1247625 TSecr=26086412
 11 0.043694356 172.31.23.72 -> 172.31.31.144 OpenFlow 762 Type: OFPT_MULTIPART_REPLY, OFPMP_FLOW
 12 0.043794184 172.31.23.72 -> 172.31.31.144 OpenFlow 530 Type: OFPT_MULTIPART_REPLY, OFPMP_PORT_STATS
 13 0.043973629 172.31.23.72 -> 172.31.31.144 OpenFlow 6178 Type: OFPT_MULTIPART_REPLY, OFPMP_TABLE
 14 0.044068215 172.31.31.144 -> 172.31.23.72 TCP 66 6633 → 33644 [ACK] Seq=97 Ack=1161 Win=853 Len=0 TSval=1247625 TSecr=26086726
 15 0.082902535 172.31.31.144 -> 172.31.23.72 TCP 66 6633 → 33644 [ACK] Seq=97 Ack=7273 Win=853 Len=0 TSval=1247635 TSecr=26086726
 16 0.127621138 172.31.31.144 -> 172.31.23.72 TCP 90 6633 → 33646 [PSH, ACK] Seq=1 Ack=1 Win=853 Len=24 TSval=1247646 TSecr=26086388
 17 0.127658456 172.31.23.72 -> 172.31.31.144 TCP 66 33646 → 6633 [ACK] Seq=1 Ack=25 Win=213 Len=0 TSval=26086747 TSecr=1247646
 18 0.127665161 172.31.31.144 -> 172.31.23.72 TCP 138 6633 → 33646 [PSH, ACK] Seq=25 Ack=1 Win=853 Len=72 TSval=1247646 TSecr=26086388
 19 0.127670858 172.31.23.72 -> 172.31.31.144 TCP 66 33646 → 6633 [ACK] Seq=1 Ack=97 Win=213 Len=0 TSval=26086747 TSecr=1247646
 20 0.128008478 172.31.23.72 -> 172.31.31.144 OpenFlow 754 Type: OFPT_MULTIPART_REPLY, OFPMP_PORT_STATS
 21 0.128097562 172.31.23.72 -> 172.31.31.144 OpenFlow 2010 Type: OFPT_MULTIPART_REPLY, OFPMP_FLOW
 22 0.128279913 172.31.23.72 -> 172.31.31.144 OpenFlow 6178 Type: OFPT_MULTIPART_REPLY, OFPMP_TABLE
 23 0.128408158 172.31.31.144 -> 172.31.23.72 TCP 66 6633 → 33646 [ACK] Seq=97 Ack=2633 Win=853 Len=0 TSval=1247646 TSecr=26086747
 24 0.164788692 172.31.31.144 -> 172.31.23.72 TCP 122 6633 → 33648 [PSH, ACK] Seq=1 Ack=1 Win=853 Len=56 TSval=1247655 TSecr=26086387
 25 0.164819643 172.31.31.144 -> 172.31.23.72 TCP 106 6633 → 33648 [PSH, ACK] Seq=57 Ack=1 Win=853 Len=40 TSval=1247655 TSecr=26086387
 26 0.165134373 172.31.23.72 -> 172.31.31.144 OpenFlow 1802 Type: OFPT_MULTIPART_REPLY, OFPMP_FLOW
 27 0.165244228 172.31.23.72 -> 172.31.31.144 OpenFlow 642 Type: OFPT_MULTIPART_REPLY, OFPMP_PORT_STATS
 28 0.165438176 172.31.31.144 -> 172.31.23.72 TCP 66 6633 → 33648 [ACK] Seq=97 Ack=1737 Win=853 Len=0 TSval=1247655 TSecr=26086756
 29 0.165444345 172.31.23.72 -> 172.31.31.144 OpenFlow 6178 Type: OFPT_MULTIPART_REPLY, OFPMP_TABLE
 30 0.165502314 172.31.31.144 -> 172.31.23.72 TCP 66 6633 → 33648 [ACK] Seq=97 Ack=2313 Win=853 Len=0 TSval=1247655 TSecr=26086756
 31 0.165798649 172.31.31.144 -> 172.31.23.72 TCP 66 6633 → 33648 [ACK] Seq=97 Ack=8425 Win=853 Len=0 TSval=1247655 TSecr=26086756
 32 0.166909014 172.31.31.144 -> 172.31.23.72 TCP 66 6633 → 33646 [ACK] Seq=97 Ack=8745 Win=853 Len=0 TSval=1247656 TSecr=26086747
 33 0.207937647 172.31.31.144 -> 172.31.23.72 TCP 82 6633 → 33650 [PSH, ACK] Seq=1 Ack=1 Win=853 Len=16 TSval=1247666 TSecr=26086388
 34 0.207976494 172.31.31.144 -> 172.31.23.72 TCP 146 6633 → 33650 [PSH, ACK] Seq=17 Ack=1 Win=853 Len=80 TSval=1247666 TSecr=26086388
 35 0.208340311 172.31.23.72 -> 172.31.31.144 OpenFlow 6178 Type: OFPT_MULTIPART_REPLY, OFPMP_TABLE
 36 0.208467347 172.31.23.72 -> 172.31.31.144 OpenFlow 754 Type: OFPT_MULTIPART_REPLY, OFPMP_PORT_STATS
 37 0.208561582 172.31.23.72 -> 172.31.31.144 OpenFlow 3466 Type: OFPT_MULTIPART_REPLY, OFPMP_FLOW
 38 0.208723281 172.31.31.144 -> 172.31.23.72 TCP 66 6633 → 33650 [ACK] Seq=97 Ack=6801 Win=853 Len=0 TSval=1247666 TSecr=26086767
 39 0.246923516 172.31.31.144 -> 172.31.23.72 TCP 66 6633 → 33650 [ACK] Seq=97 Ack=10201 Win=853 Len=0 TSval=1247676 TSecr=26086767
 40 0.263721409 172.31.31.144 -> 172.31.23.72 TCP 90 6633 → 33652 [PSH, ACK] Seq=1 Ack=1 Win=853 Len=24 TSval=1247680 TSecr=26086363
 41 0.263754464 172.31.31.144 -> 172.31.23.72 TCP 138 6633 → 33652 [PSH, ACK] Seq=25 Ack=1 Win=853 Len=72 TSval=1247680 TSecr=26086363
 42 0.264035098 172.31.23.72 -> 172.31.31.144 OpenFlow 642 Type: OFPT_MULTIPART_REPLY, OFPMP_PORT_STATS
 43 0.264225292 172.31.23.72 -> 172.31.31.144 OpenFlow 6178 Type: OFPT_MULTIPART_REPLY, OFPMP_TABLE
 44 0.264291419 172.31.23.72 -> 172.31.31.144 OpenFlow 1594 Type: OFPT_MULTIPART_REPLY, OFPMP_FLOW
 45 0.264571134 172.31.31.144 -> 172.31.23.72 TCP 66 6633 → 33652 [ACK] Seq=97 Ack=6689 Win=853 Len=0 TSval=1247680 TSecr=26086781
 46 0.296912904 172.31.31.144 -> 172.31.23.72 TCP 90 6633 → 33654 [PSH, ACK] Seq=1 Ack=1 Win=853 Len=24 TSval=1247688 TSecr=26086388
 47 0.296940055 172.31.31.144 -> 172.31.23.72 TCP 138 6633 → 33654 [PSH, ACK] Seq=25 Ack=1 Win=853 Len=72 TSval=1247688 TSecr=26086388
 48 0.297250506 172.31.23.72 -> 172.31.31.144 OpenFlow 642 Type: OFPT_MULTIPART_REPLY, OFPMP_PORT_STATS
 49 0.297447993 172.31.23.72 -> 172.31.31.144 OpenFlow 6178 Type: OFPT_MULTIPART_REPLY, OFPMP_TABLE
 50 0.297510117 172.31.23.72 -> 172.31.31.144 OpenFlow 1386 Type: OFPT_MULTIPART_REPLY, OFPMP_FLOW
 51 0.297544226 172.31.31.144 -> 172.31.23.72 TCP 66 6633 → 33654 [ACK] Seq=97 Ack=577 Win=853 Len=0 TSval=1247688 TSecr=26086789
 52 0.297764202 172.31.31.144 -> 172.31.23.72 TCP 66 6633 → 33654 [ACK] Seq=97 Ack=6689 Win=853 Len=0 TSval=1247688 TSecr=26086789
 53 0.297785195 172.31.31.144 -> 172.31.23.72 TCP 66 6633 → 33654 [ACK] Seq=97 Ack=8009 Win=853 Len=0 TSval=1247688 TSecr=26086789
 54 0.302918629 172.31.31.144 -> 172.31.23.72 TCP 66 6633 → 33652 [ACK] Seq=97 Ack=8217 Win=853 Len=0 TSval=1247690 TSecr=26086781
 55 0.339148087 172.31.31.144 -> 172.31.23.72 TCP 82 6633 → 33656 [PSH, ACK] Seq=1 Ack=1 Win=853 Len=16 TSval=1247699 TSecr=26086388
 56 0.339173719 172.31.31.144 -> 172.31.23.72 TCP 146 6633 → 33656 [PSH, ACK] Seq=17 Ack=1 Win=853 Len=80 TSval=1247699 TSecr=26086388
 57 0.339517999 172.31.23.72 -> 172.31.31.144 OpenFlow 6178 Type: OFPT_MULTIPART_REPLY, OFPMP_TABLE
 58 0.339584260 172.31.23.72 -> 172.31.31.144 OpenFlow 1178 Type: OFPT_MULTIPART_REPLY, OFPMP_FLOW
 59 0.339672785 172.31.23.72 -> 172.31.31.144 OpenFlow 530 Type: OFPT_MULTIPART_REPLY, OFPMP_PORT_STATS
 60 0.339904546 172.31.31.144 -> 172.31.23.72 TCP 66 6633 → 33656 [ACK] Seq=97 Ack=7225 Win=853 Len=0 TSval=1247699 TSecr=26086800
 61 0.378932726 172.31.31.144 -> 172.31.23.72 TCP 66 6633 → 33656 [ACK] Seq=97 Ack=7689 Win=853 Len=0 TSval=1247709 TSecr=26086800
 62 0.394268023 172.31.31.144 -> 172.31.23.72 TCP 90 6633 → 33658 [PSH, ACK] Seq=1 Ack=1 Win=853 Len=24 TSval=1247712 TSecr=26086388
 63 0.394290590 172.31.31.144 -> 172.31.23.72 TCP 138 6633 → 33658 [PSH, ACK] Seq=25 Ack=1 Win=853 Len=72 TSval=1247712 TSecr=26086388
 64 0.394656974 172.31.23.72 -> 172.31.31.144 OpenFlow 530 Type: OFPT_MULTIPART_REPLY, OFPMP_PORT_STATS
 65 0.394748611 172.31.23.72 -> 172.31.31.144 OpenFlow 1802 Type: OFPT_MULTIPART_REPLY, OFPMP_FLOW
 66 0.394920441 172.31.23.72 -> 172.31.31.144 OpenFlow 6178 Type: OFPT_MULTIPART_REPLY, OFPMP_TABLE
 67 0.394984615 172.31.31.144 -> 172.31.23.72 TCP 66 6633 → 33658 [ACK] Seq=97 Ack=465 Win=853 Len=0 TSval=1247713 TSecr=26086814
 68 0.395031102 172.31.31.144 -> 172.31.23.72 TCP 66 6633 → 33658 [ACK] Seq=97 Ack=2201 Win=853 Len=0 TSval=1247713 TSecr=26086814
 69 0.395281965 172.31.31.144 -> 172.31.23.72 TCP 66 6633 → 33658 [ACK] Seq=97 Ack=8313 Win=853 Len=0 TSval=1247713 TSecr=26086814
 70 0.446427620 172.31.31.144 -> 172.31.23.72 TCP 90 6633 → 33660 [PSH, ACK] Seq=1 Ack=1 Win=853 Len=24 TSval=1247725 TSecr=26086388
 71 0.446456849 172.31.31.144 -> 172.31.23.72 TCP 138 6633 → 33660 [PSH, ACK] Seq=25 Ack=1 Win=853 Len=72 TSval=1247725 TSecr=26086388
 72 0.446783620 172.31.23.72 -> 172.31.31.144 OpenFlow 754 Type: OFPT_MULTIPART_REPLY, OFPMP_PORT_STATS
 73 0.446879122 172.31.23.72 -> 172.31.31.144 OpenFlow 2218 Type: OFPT_MULTIPART_REPLY, OFPMP_FLOW
 74 0.447050341 172.31.23.72 -> 172.31.31.144 OpenFlow 6178 Type: OFPT_MULTIPART_REPLY, OFPMP_TABLE
 75 0.447135635 172.31.31.144 -> 172.31.23.72 TCP 66 6633 → 33660 [ACK] Seq=97 Ack=2841 Win=853 Len=0 TSval=1247726 TSecr=26086827
 76 0.486934198 172.31.31.144 -> 172.31.23.72 TCP 66 6633 → 33660 [ACK] Seq=97 Ack=8953 Win=853 Len=0 TSval=1247736 TSecr=26086827
 77 0.496573322 172.31.31.144 -> 172.31.23.72 TCP 82 6633 → 33662 [PSH, ACK] Seq=1 Ack=1 Win=853 Len=16 TSval=1247738 TSecr=26086389
 78 0.496599327 172.31.31.144 -> 172.31.23.72 TCP 146 6633 → 33662 [PSH, ACK] Seq=17 Ack=1 Win=853 Len=80 TSval=1247738 TSecr=26086389
 79 0.497043358 172.31.23.72 -> 172.31.31.144 OpenFlow 6178 Type: OFPT_MULTIPART_REPLY, OFPMP_TABLE
 80 0.497144416 172.31.23.72 -> 172.31.31.144 OpenFlow 2426 Type: OFPT_MULTIPART_REPLY, OFPMP_FLOW
 81 0.497264981 172.31.23.72 -> 172.31.31.144 OpenFlow 754 Type: OFPT_MULTIPART_REPLY, OFPMP_PORT_STATS
 82 0.497376280 172.31.31.144 -> 172.31.23.72 TCP 66 6633 → 33662 [ACK] Seq=97 Ack=6113 Win=853 Len=0 TSval=1247738 TSecr=26086839
 83 0.497430102 172.31.31.144 -> 172.31.23.72 TCP 66 6633 → 33662 [ACK] Seq=97 Ack=8473 Win=853 Len=0 TSval=1247738 TSecr=26086839
 84 0.497592159 172.31.31.144 -> 172.31.23.72 TCP 66 6633 → 33662 [ACK] Seq=97 Ack=9161 Win=853 Len=0 TSval=1247738 TSecr=26086839
 85 0.552851230 172.31.31.144 -> 172.31.23.72 TCP 90 6633 → 33664 [PSH, ACK] Seq=1 Ack=1 Win=853 Len=24 TSval=1247752 TSecr=26086388
 86 0.552880937 172.31.31.144 -> 172.31.23.72 TCP 138 6633 → 33664 [PSH, ACK] Seq=25 Ack=1 Win=853 Len=72 TSval=1247752 TSecr=26086388
 87 0.553277386 172.31.23.72 -> 172.31.31.144 OpenFlow 530 Type: OFPT_MULTIPART_REPLY, OFPMP_PORT_STATS
 88 0.553466935 172.31.23.72 -> 172.31.31.144 OpenFlow 6178 Type: OFPT_MULTIPART_REPLY, OFPMP_TABLE
 89 0.553546647 172.31.23.72 -> 172.31.31.144 OpenFlow 2010 Type: OFPT_MULTIPART_REPLY, OFPMP_FLOW
 90 0.553588043 172.31.31.144 -> 172.31.23.72 TCP 66 6633 → 33664 [ACK] Seq=97 Ack=465 Win=853 Len=0 TSval=1247752 TSecr=26086853
 91 0.553834023 172.31.31.144 -> 172.31.23.72 TCP 66 6633 → 33664 [ACK] Seq=97 Ack=6577 Win=853 Len=0 TSval=1247752 TSecr=26086853
 92 0.553839417 172.31.31.144 -> 172.31.23.72 TCP 66 6633 → 33664 [ACK] Seq=97 Ack=8521 Win=853 Len=0 TSval=1247752 TSecr=26086853
 93 0.609957037 172.31.31.144 -> 172.31.23.72 TCP 122 6633 → 33666 [PSH, ACK] Seq=1 Ack=1 Win=853 Len=56 TSval=1247766 TSecr=26086363
 94 0.609998157 172.31.31.144 -> 172.31.23.72 TCP 106 6633 → 33666 [PSH, ACK] Seq=57 Ack=1 Win=853 Len=40 TSval=1247766 TSecr=26086363
 95 0.610332489 172.31.23.72 -> 172.31.31.144 OpenFlow 2634 Type: OFPT_MULTIPART_REPLY, OFPMP_FLOW
 96 0.610432539 172.31.23.72 -> 172.31.31.144 OpenFlow 530 Type: OFPT_MULTIPART_REPLY, OFPMP_PORT_STATS
 97 0.610601341 172.31.23.72 -> 172.31.31.144 OpenFlow 6178 Type: OFPT_MULTIPART_REPLY, OFPMP_TABLE
 98 0.610620034 172.31.31.144 -> 172.31.23.72 TCP 66 6633 → 33666 [ACK] Seq=97 Ack=2569 Win=853 Len=0 TSval=1247766 TSecr=26086868
 99 0.610676737 172.31.31.144 -> 172.31.23.72 TCP 66 6633 → 33666 [ACK] Seq=97 Ack=3033 Win=853 Len=0 TSval=1247766 TSecr=26086868
100 0.610943384 172.31.31.144 -> 172.31.23.72 TCP 66 6633 → 33666 [ACK] Seq=97 Ack=9145 Win=853 Len=0 TSval=1247767 TSecr=26086868
101 0.663107134 172.31.31.144 -> 172.31.23.72 TCP 122 6633 → 33668 [PSH, ACK] Seq=1 Ack=1 Win=853 Len=56 TSval=1247780 TSecr=26086388
102 0.663136845 172.31.31.144 -> 172.31.23.72 TCP 106 6633 → 33668 [PSH, ACK] Seq=57 Ack=1 Win=853 Len=40 TSval=1247780 TSecr=26086388
103 0.663395076 172.31.23.72 -> 172.31.31.144 OpenFlow 2426 Type: OFPT_MULTIPART_REPLY, OFPMP_FLOW
104 0.663570865 172.31.23.72 -> 172.31.31.144 OpenFlow 6178 Type: OFPT_MULTIPART_REPLY, OFPMP_TABLE
105 0.663666592 172.31.31.144 -> 172.31.23.72 TCP 66 6633 → 33668 [ACK] Seq=97 Ack=2361 Win=853 Len=0 TSval=1247780 TSecr=26086881
106 0.663698000 172.31.23.72 -> 172.31.31.144 OpenFlow 642 Type: OFPT_MULTIPART_REPLY, OFPMP_PORT_STATS
107 0.663851008 172.31.31.144 -> 172.31.23.72 TCP 66 6633 → 33668 [ACK] Seq=97 Ack=8473 Win=853 Len=0 TSval=1247780 TSecr=26086881
108 0.663904140 172.31.31.144 -> 172.31.23.72 TCP 66 6633 → 33668 [ACK] Seq=97 Ack=9049 Win=853 Len=0 TSval=1247780 TSecr=26086881
109 0.764224522 172.31.31.144 -> 172.31.23.72 TCP 122 6633 → 33670 [PSH, ACK] Seq=1 Ack=1 Win=853 Len=56 TSval=1247805 TSecr=26086398
110 0.764256025 172.31.23.72 -> 172.31.31.144 TCP 66 33670 → 6633 [ACK] Seq=1 Ack=57 Win=213 Len=0 TSval=26086906 TSecr=1247805
111 0.764270691 172.31.31.144 -> 172.31.23.72 TCP 106 6633 → 33670 [PSH, ACK] Seq=57 Ack=1 Win=853 Len=40 TSval=1247805 TSecr=26086398
112 0.764279353 172.31.23.72 -> 172.31.31.144 TCP 66 33670 → 6633 [ACK] Seq=1 Ack=97 Win=213 Len=0 TSval=26086906 TSecr=1247805
113 0.764612431 172.31.23.72 -> 172.31.31.144 OpenFlow 2010 Type: OFPT_MULTIPART_REPLY, OFPMP_FLOW
114 0.764785584 172.31.23.72 -> 172.31.31.144 OpenFlow 6178 Type: OFPT_MULTIPART_REPLY, OFPMP_TABLE
115 0.764867355 172.31.31.144 -> 172.31.23.72 TCP 66 6633 → 33670 [ACK] Seq=97 Ack=1945 Win=853 Len=0 TSval=1247805 TSecr=26086906
116 0.764907005 172.31.23.72 -> 172.31.31.144 OpenFlow 642 Type: OFPT_MULTIPART_REPLY, OFPMP_PORT_STATS
117 0.765072236 172.31.31.144 -> 172.31.23.72 TCP 66 6633 → 33670 [ACK] Seq=97 Ack=8057 Win=853 Len=0 TSval=1247805 TSecr=26086906
118 0.765171174 172.31.31.144 -> 172.31.23.72 TCP 66 6633 → 33670 [ACK] Seq=97 Ack=8633 Win=853 Len=0 TSval=1247805 TSecr=26086906
119 0.819548657 172.31.31.144 -> 172.31.23.72 TCP 90 6633 → 33672 [PSH, ACK] Seq=1 Ack=1 Win=853 Len=24 TSval=1247819 TSecr=26086389
120 0.819575313 172.31.31.144 -> 172.31.23.72 TCP 138 6633 → 33672 [PSH, ACK] Seq=25 Ack=1 Win=853 Len=72 TSval=1247819 TSecr=26086389
121 0.820010965 172.31.23.72 -> 172.31.31.144 OpenFlow 642 Type: OFPT_MULTIPART_REPLY, OFPMP_PORT_STATS
122 0.820192991 172.31.23.72 -> 172.31.31.144 OpenFlow 6178 Type: OFPT_MULTIPART_REPLY, OFPMP_TABLE
123 0.820241845 172.31.23.72 -> 172.31.31.144 OpenFlow 554 Type: OFPT_MULTIPART_REPLY, OFPMP_FLOW
124 0.820315728 172.31.31.144 -> 172.31.23.72 TCP 66 6633 → 33672 [ACK] Seq=97 Ack=577 Win=853 Len=0 TSval=1247819 TSecr=26086920
125 0.820561864 172.31.31.144 -> 172.31.23.72 TCP 66 6633 → 33672 [ACK] Seq=97 Ack=6689 Win=853 Len=0 TSval=1247819 TSecr=26086920
126 0.820567799 172.31.31.144 -> 172.31.23.72 TCP 66 6633 → 33672 [ACK] Seq=97 Ack=7177 Win=853 Len=0 TSval=1247819 TSecr=26086920
127 0.829625909 172.31.31.144 -> 172.31.23.72 TCP 122 6633 → 33674 [PSH, ACK] Seq=1 Ack=1 Win=853 Len=56 TSval=1247821 TSecr=26086388
128 0.829636820 172.31.31.144 -> 172.31.23.72 TCP 106 6633 → 33674 [PSH, ACK] Seq=57 Ack=1 Win=853 Len=40 TSval=1247821 TSecr=26086388
129 0.829829700 172.31.23.72 -> 172.31.31.144 OpenFlow 2010 Type: OFPT_MULTIPART_REPLY, OFPMP_FLOW
130 0.830010641 172.31.23.72 -> 172.31.31.144 OpenFlow 6178 Type: OFPT_MULTIPART_REPLY, OFPMP_TABLE
131 0.830103765 172.31.23.72 -> 172.31.31.144 OpenFlow 642 Type: OFPT_MULTIPART_REPLY, OFPMP_PORT_STATS
132 0.830294059 172.31.31.144 -> 172.31.23.72 TCP 66 6633 → 33674 [ACK] Seq=97 Ack=8057 Win=853 Len=0 TSval=1247821 TSecr=26086922
133 0.847796054 172.31.31.144 -> 172.31.23.72 TCP 82 6633 → 33676 [PSH, ACK] Seq=1 Ack=1 Win=853 Len=16 TSval=1247826 TSecr=26086389
134 0.847821553 172.31.31.144 -> 172.31.23.72 TCP 146 6633 → 33676 [PSH, ACK] Seq=17 Ack=1 Win=853 Len=80 TSval=1247826 TSecr=26086389
135 0.848268567 172.31.23.72 -> 172.31.31.144 OpenFlow 6178 Type: OFPT_MULTIPART_REPLY, OFPMP_TABLE
136 0.848360938 172.31.23.72 -> 172.31.31.144 OpenFlow 2010 Type: OFPT_MULTIPART_REPLY, OFPMP_FLOW
137 0.848452705 172.31.23.72 -> 172.31.31.144 OpenFlow 530 Type: OFPT_MULTIPART_REPLY, OFPMP_PORT_STATS
138 0.848658507 172.31.31.144 -> 172.31.23.72 TCP 66 6633 → 33676 [ACK] Seq=97 Ack=6113 Win=853 Len=0 TSval=1247826 TSecr=26086927
139 0.848666051 172.31.31.144 -> 172.31.23.72 TCP 66 6633 → 33676 [ACK] Seq=97 Ack=8057 Win=853 Len=0 TSval=1247826 TSecr=26086927
140 0.848668444 172.31.31.144 -> 172.31.23.72 TCP 66 6633 → 33676 [ACK] Seq=97 Ack=8521 Win=851 Len=0 TSval=1247826 TSecr=26086927
141 0.866911642 172.31.31.144 -> 172.31.23.72 TCP 66 6633 → 33674 [ACK] Seq=97 Ack=8633 Win=853 Len=0 TSval=1247831 TSecr=26086922
142 1.587780227 172.31.31.144 -> 172.31.23.72 OpenFlow 187 Type: OFPT_PACKET_OUT
143 1.587805861 172.31.31.144 -> 172.31.23.72 OpenFlow 187 Type: OFPT_PACKET_OUT
144 1.587822817 172.31.31.144 -> 172.31.23.72 OpenFlow 187 Type: OFPT_PACKET_OUT
145 1.587854255 172.31.31.144 -> 172.31.23.72 OpenFlow 187 Type: OFPT_PACKET_OUT
146 1.587915496 172.31.31.144 -> 172.31.23.72 OpenFlow 187 Type: OFPT_PACKET_OUT
147 1.587968744 172.31.31.144 -> 172.31.23.72 OpenFlow 187 Type: OFPT_PACKET_OUT
148 1.588032502 172.31.31.144 -> 172.31.23.72 OpenFlow 187 Type: OFPT_PACKET_OUT
149 1.588082898 172.31.31.144 -> 172.31.23.72 OpenFlow 187 Type: OFPT_PACKET_OUT
150 1.588322370 172.31.23.72 -> 172.31.31.144 TCP 66 33668 → 6633 [ACK] Seq=9049 Ack=1065 Win=213 Len=0 TSval=26087112 TSecr=1248011
151 1.588472701 172.31.23.72 -> 172.31.31.144 OpenFlow 189 Type: OFPT_PACKET_IN
152 1.588513797 172.31.23.72 -> 172.31.31.144 OpenFlow 189 Type: OFPT_PACKET_IN
153 1.588563392 172.31.23.72 -> 172.31.31.144 OpenFlow 189 Type: OFPT_PACKET_IN
154 1.588586969 172.31.23.72 -> 172.31.31.144 OpenFlow 189 Type: OFPT_PACKET_IN
155 1.588641447 172.31.23.72 -> 172.31.31.144 OpenFlow 189 Type: OFPT_PACKET_IN
156 1.588646884 172.31.23.72 -> 172.31.31.144 OpenFlow 189 Type: OFPT_PACKET_IN
157 1.588861348 172.31.31.144 -> 172.31.23.72 TCP 66 6633 → 33666 [ACK] Seq=97 Ack=9268 Win=853 Len=0 TSval=1248011 TSecr=26087112
158 1.588868374 172.31.31.144 -> 172.31.23.72 TCP 66 6633 → 33666 [ACK] Seq=97 Ack=9391 Win=853 Len=0 TSval=1248011 TSecr=26087112
159 1.588870707 172.31.31.144 -> 172.31.23.72 TCP 66 6633 → 33670 [ACK] Seq=97 Ack=8756 Win=853 Len=0 TSval=1248011 TSecr=26087112
160 1.588872900 172.31.31.144 -> 172.31.23.72 TCP 66 6633 → 33658 [ACK] Seq=97 Ack=8436 Win=853 Len=0 TSval=1248011 TSecr=26087112
161 1.588926180 172.31.31.144 -> 172.31.23.72 TCP 66 6633 → 33670 [ACK] Seq=97 Ack=8879 Win=853 Len=0 TSval=1248011 TSecr=26087112
162 1.589003082 172.31.31.144 -> 172.31.23.72 TCP 66 6633 → 33658 [ACK] Seq=97 Ack=8559 Win=853 Len=0 TSval=1248011 TSecr=26087112
163 1.688399915 172.31.31.144 -> 172.31.23.72 OpenFlow 187 Type: OFPT_PACKET_OUT
164 1.688439508 172.31.31.144 -> 172.31.23.72 OpenFlow 187 Type: OFPT_PACKET_OUT
165 1.688443410 172.31.31.144 -> 172.31.23.72 OpenFlow 187 Type: OFPT_PACKET_OUT
166 1.688454396 172.31.31.144 -> 172.31.23.72 OpenFlow 187 Type: OFPT_PACKET_OUT
167 1.688508508 172.31.31.144 -> 172.31.23.72 OpenFlow 187 Type: OFPT_PACKET_OUT
168 1.688571274 172.31.31.144 -> 172.31.23.72 OpenFlow 187 Type: OFPT_PACKET_OUT
169 1.688659979 172.31.31.144 -> 172.31.23.72 OpenFlow 187 Type: OFPT_PACKET_OUT
170 1.688699089 172.31.31.144 -> 172.31.23.72 OpenFlow 187 Type: OFPT_PACKET_OUT
171 1.688745549 172.31.31.144 -> 172.31.23.72 OpenFlow 187 Type: OFPT_PACKET_OUT
172 1.688805375 172.31.31.144 -> 172.31.23.72 OpenFlow 187 Type: OFPT_PACKET_OUT
173 1.688866665 172.31.31.144 -> 172.31.23.72 OpenFlow 187 Type: OFPT_PACKET_OUT
174 1.688920661 172.31.31.144 -> 172.31.23.72 OpenFlow 187 Type: OFPT_PACKET_OUT
175 1.688975224 172.31.31.144 -> 172.31.23.72 OpenFlow 187 Type: OFPT_PACKET_OUT
176 1.689016579 172.31.23.72 -> 172.31.31.144 TCP 66 33656 → 6633 [ACK] Seq=7689 Ack=823 Win=213 Len=0 TSval=26087137 TSecr=1248036
177 1.689027947 172.31.31.144 -> 172.31.23.72 OpenFlow 187 Type: OFPT_PACKET_OUT
178 1.689143879 172.31.31.144 -> 172.31.23.72 TCP 187 6633 → 33636 [PSH, ACK] Seq=1 Ack=1 Win=853 Len=121 TSval=1248036 TSecr=26086686
179 1.689150074 172.31.31.144 -> 172.31.23.72 TCP 187 6633 → 33636 [PSH, ACK] Seq=122 Ack=1 Win=853 Len=121 TSval=1248036 TSecr=26086686
180 1.689196684 172.31.31.144 -> 172.31.23.72 TCP 187 6633 → 33636 [PSH, ACK] Seq=243 Ack=1 Win=853 Len=121 TSval=1248036 TSecr=26086686
181 1.689251121 172.31.31.144 -> 172.31.23.72 TCP 187 6633 → 33636 [PSH, ACK] Seq=364 Ack=1 Win=853 Len=121 TSval=1248036 TSecr=26086686
182 1.689308099 172.31.31.144 -> 172.31.23.72 TCP 187 6633 → 33636 [PSH, ACK] Seq=485 Ack=1 Win=853 Len=121 TSval=1248036 TSecr=26086686
183 1.689361686 172.31.31.144 -> 172.31.23.72 TCP 187 6633 → 33636 [PSH, ACK] Seq=606 Ack=1 Win=853 Len=121 TSval=1248036 TSecr=26086686
184 1.689412904 172.31.31.144 -> 172.31.23.72 TCP 187 6633 → 33636 [PSH, ACK] Seq=727 Ack=1 Win=853 Len=121 TSval=1248036 TSecr=26086686
185 1.689467410 172.31.31.144 -> 172.31.23.72 TCP 187 6633 → 33636 [PSH, ACK] Seq=848 Ack=1 Win=853 Len=121 TSval=1248036 TSecr=26086686
186 1.689496195 172.31.23.72 -> 172.31.31.144 TCP 66 33652 → 6633 [ACK] Seq=8217 Ack=1065 Win=213 Len=0 TSval=26087137 TSecr=1248036
187 1.689547788 172.31.31.144 -> 172.31.23.72 OpenFlow 187 Type: OFPT_PACKET_OUT
188 1.689608992 172.31.31.144 -> 172.31.23.72 OpenFlow 187 Type: OFPT_PACKET_OUT
189 1.689651701 172.31.31.144 -> 172.31.23.72 OpenFlow 187 Type: OFPT_PACKET_OUT
190 1.689695978 172.31.31.144 -> 172.31.23.72 OpenFlow 187 Type: OFPT_PACKET_OUT
191 1.689757604 172.31.31.144 -> 172.31.23.72 OpenFlow 187 Type: OFPT_PACKET_OUT
192 1.689812489 172.31.31.144 -> 172.31.23.72 OpenFlow 187 Type: OFPT_PACKET_OUT
193 1.689861836 172.31.31.144 -> 172.31.23.72 OpenFlow 187 Type: OFPT_PACKET_OUT
194 1.689897635 172.31.23.72 -> 172.31.31.144 TCP 66 33636 → 6633 [ACK] Seq=1 Ack=969 Win=213 Len=0 TSval=26087137 TSecr=1248036
195 1.689921049 172.31.31.144 -> 172.31.23.72 OpenFlow 187 Type: OFPT_PACKET_OUT
196 1.689983193 172.31.31.144 -> 172.31.23.72 OpenFlow 187 Type: OFPT_PACKET_OUT
197 1.689995375 172.31.23.72 -> 172.31.31.144 OpenFlow 189 Type: OFPT_PACKET_IN
198 1.690039868 172.31.31.144 -> 172.31.23.72 OpenFlow 187 Type: OFPT_PACKET_OUT
199 1.690046618 172.31.23.72 -> 172.31.31.144 OpenFlow 189 Type: OFPT_PACKET_IN
200 1.690108993 172.31.31.144 -> 172.31.23.72 TCP 187 6633 → 33640 [PSH, ACK] Seq=1 Ack=1 Win=853 Len=121 TSval=1248036 TSecr=26086705
201 1.690195753 172.31.31.144 -> 172.31.23.72 TCP 187 6633 → 33640 [PSH, ACK] Seq=122 Ack=1 Win=853 Len=121 TSval=1248036 TSecr=26086705
202 1.690200579 172.31.31.144 -> 172.31.23.72 TCP 187 6633 → 33640 [PSH, ACK] Seq=243 Ack=1 Win=853 Len=121 TSval=1248036 TSecr=26086705
203 1.690353724 172.31.31.144 -> 172.31.23.72 TCP 66 6633 → 33650 [ACK] Seq=1307 Ack=10324 Win=853 Len=0 TSval=1248036 TSecr=26087137
204 1.690360632 172.31.31.144 -> 172.31.23.72 TCP 187 6633 → 33640 [PSH, ACK] Seq=364 Ack=1 Win=853 Len=121 TSval=1248036 TSecr=26086705
205 1.690363198 172.31.31.144 -> 172.31.23.72 TCP 187 6633 → 33640 [PSH, ACK] Seq=485 Ack=1 Win=853 Len=121 TSval=1248036 TSecr=26086705
206 1.690364599 172.31.31.144 -> 172.31.23.72 TCP 66 6633 → 33650 [ACK] Seq=1307 Ack=10447 Win=853 Len=0 TSval=1248036 TSecr=26087137
207 1.690366848 172.31.31.144 -> 172.31.23.72 TCP 187 6633 → 33640 [PSH, ACK] Seq=606 Ack=1 Win=853 Len=121 TSval=1248036 TSecr=26086705
208 1.690406889 172.31.31.144 -> 172.31.23.72 TCP 187 6633 → 33640 [PSH, ACK] Seq=727 Ack=1 Win=853 Len=121 TSval=1248036 TSecr=26086705
209 1.690461660 172.31.31.144 -> 172.31.23.72 TCP 187 6633 → 33640 [PSH, ACK] Seq=848 Ack=1 Win=853 Len=121 TSval=1248036 TSecr=26086705
210 1.690523922 172.31.31.144 -> 172.31.23.72 TCP 187 6633 → 33640 [PSH, ACK] Seq=969 Ack=1 Win=853 Len=121 TSval=1248036 TSecr=26086705
211 1.690575045 172.31.31.144 -> 172.31.23.72 TCP 187 6633 → 33640 [PSH, ACK] Seq=1090 Ack=1 Win=853 Len=121 TSval=1248036 TSecr=26086705
212 1.690606955 172.31.23.72 -> 172.31.31.144 OpenFlow 189 Type: OFPT_PACKET_IN
213 1.690649189 172.31.31.144 -> 172.31.23.72 TCP 187 6633 → 33634 [PSH, ACK] Seq=1 Ack=1 Win=853 Len=121 TSval=1248036 TSecr=26086676
214 1.690678592 172.31.23.72 -> 172.31.31.144 OpenFlow 189 Type: OFPT_PACKET_IN
215 1.690744364 172.31.31.144 -> 172.31.23.72 TCP 187 6633 → 33634 [PSH, ACK] Seq=122 Ack=1 Win=853 Len=121 TSval=1248036 TSecr=26086676
216 1.690749515 172.31.31.144 -> 172.31.23.72 TCP 187 6633 → 33634 [PSH, ACK] Seq=243 Ack=1 Win=853 Len=121 TSval=1248036 TSecr=26086676
217 1.690804164 172.31.31.144 -> 172.31.23.72 TCP 187 6633 → 33634 [PSH, ACK] Seq=364 Ack=1 Win=853 Len=121 TSval=1248037 TSecr=26086676
218 1.690859588 172.31.31.144 -> 172.31.23.72 TCP 187 6633 → 33634 [PSH, ACK] Seq=485 Ack=1 Win=853 Len=121 TSval=1248037 TSecr=26086676
219 1.690934260 172.31.31.144 -> 172.31.23.72 TCP 66 6633 → 33640 [ACK] Seq=1211 Ack=124 Win=853 Len=0 TSval=1248037 TSecr=26087138
220 1.690939483 172.31.31.144 -> 172.31.23.72 TCP 187 6633 → 33634 [PSH, ACK] Seq=606 Ack=1 Win=853 Len=121 TSval=1248037 TSecr=26086676
221 1.691032211 172.31.31.144 -> 172.31.23.72 TCP 66 6633 → 33640 [ACK] Seq=1211 Ack=247 Win=853 Len=0 TSval=1248037 TSecr=26087138
222 1.691037314 172.31.31.144 -> 172.31.23.72 TCP 187 6633 → 33634 [PSH, ACK] Seq=727 Ack=1 Win=853 Len=121 TSval=1248037 TSecr=26086676
223 1.691039709 172.31.31.144 -> 172.31.23.72 TCP 187 6633 → 33634 [PSH, ACK] Seq=848 Ack=1 Win=853 Len=121 TSval=1248037 TSecr=26086676
224 1.691089623 172.31.31.144 -> 172.31.23.72 TCP 187 6633 → 33634 [PSH, ACK] Seq=969 Ack=1 Win=853 Len=121 TSval=1248037 TSecr=26086676
225 1.691143646 172.31.31.144 -> 172.31.23.72 TCP 187 6633 → 33634 [PSH, ACK] Seq=1090 Ack=1 Win=853 Len=121 TSval=1248037 TSecr=26086676
226 1.691191199 172.31.23.72 -> 172.31.31.144 OpenFlow 189 Type: OFPT_PACKET_IN
227 1.691213101 172.31.31.144 -> 172.31.23.72 OpenFlow 187 Type: OFPT_PACKET_OUT
228 1.691220186 172.31.23.72 -> 172.31.31.144 OpenFlow 189 Type: OFPT_PACKET_IN
229 1.691275938 172.31.31.144 -> 172.31.23.72 OpenFlow 187 Type: OFPT_PACKET_OUT
230 1.691375065 172.31.31.144 -> 172.31.23.72 OpenFlow 187 Type: OFPT_PACKET_OUT
231 1.691379479 172.31.31.144 -> 172.31.23.72 OpenFlow 187 Type: OFPT_PACKET_OUT
232 1.691481185 172.31.31.144 -> 172.31.23.72 TCP 66 6633 → 33634 [ACK] Seq=1211 Ack=124 Win=853 Len=0 TSval=1248037 TSecr=26087138
233 1.691486499 172.31.31.144 -> 172.31.23.72 OpenFlow 187 Type: OFPT_PACKET_OUT
234 1.691488598 172.31.31.144 -> 172.31.23.72 OpenFlow 187 Type: OFPT_PACKET_OUT
235 1.691584077 172.31.31.144 -> 172.31.23.72 TCP 66 6633 → 33634 [ACK] Seq=1211 Ack=247 Win=853 Len=0 TSval=1248037 TSecr=26087138
236 1.691589386 172.31.31.144 -> 172.31.23.72 OpenFlow 187 Type: OFPT_PACKET_OUT
237 1.691591805 172.31.31.144 -> 172.31.23.72 OpenFlow 187 Type: OFPT_PACKET_OUT
238 1.691643435 172.31.31.144 -> 172.31.23.72 OpenFlow 187 Type: OFPT_PACKET_OUT
239 1.691686676 172.31.23.72 -> 172.31.31.144 OpenFlow 189 Type: OFPT_PACKET_IN
240 1.691699961 172.31.31.144 -> 172.31.23.72 OpenFlow 187 Type: OFPT_PACKET_OUT
241 1.691711219 172.31.23.72 -> 172.31.31.144 OpenFlow 189 Type: OFPT_PACKET_IN
242 1.691795794 172.31.31.144 -> 172.31.23.72 OpenFlow 187 Type: OFPT_PACKET_OUT
243 1.691820228 172.31.31.144 -> 172.31.23.72 OpenFlow 187 Type: OFPT_PACKET_OUT
244 1.691878584 172.31.31.144 -> 172.31.23.72 OpenFlow 187 Type: OFPT_PACKET_OUT
245 1.691918263 172.31.31.144 -> 172.31.23.72 TCP 66 6633 → 33660 [ACK] Seq=1307 Ack=9076 Win=853 Len=0 TSval=1248037 TSecr=26087138
246 1.691923128 172.31.31.144 -> 172.31.23.72 OpenFlow 187 Type: OFPT_PACKET_OUT
247 1.691967967 172.31.31.144 -> 172.31.23.72 TCP 66 6633 → 33660 [ACK] Seq=1307 Ack=9199 Win=853 Len=0 TSval=1248037 TSecr=26087138
248 1.691973055 172.31.31.144 -> 172.31.23.72 OpenFlow 187 Type: OFPT_PACKET_OUT
249 1.692033982 172.31.31.144 -> 172.31.23.72 OpenFlow 187 Type: OFPT_PACKET_OUT
250 1.692087333 172.31.31.144 -> 172.31.23.72 OpenFlow 187 Type: OFPT_PACKET_OUT
251 1.692154806 172.31.31.144 -> 172.31.23.72 OpenFlow 187 Type: OFPT_PACKET_OUT
252 1.692208215 172.31.31.144 -> 172.31.23.72 OpenFlow 187 Type: OFPT_PACKET_OUT
253 1.692256127 172.31.31.144 -> 172.31.23.72 OpenFlow 187 Type: OFPT_PACKET_OUT
254 1.692299373 172.31.23.72 -> 172.31.31.144 OpenFlow 189 Type: OFPT_PACKET_IN
255 1.692309721 172.31.31.144 -> 172.31.23.72 OpenFlow 187 Type: OFPT_PACKET_OUT
256 1.692358493 172.31.23.72 -> 172.31.31.144 OpenFlow 435 Type: OFPT_PACKET_IN
257 1.692427778 172.31.31.144 -> 172.31.23.72 OpenFlow 187 Type: OFPT_PACKET_OUT
258 1.692432769 172.31.31.144 -> 172.31.23.72 OpenFlow 187 Type: OFPT_PACKET_OUT
259 1.692484616 172.31.31.144 -> 172.31.23.72 OpenFlow 187 Type: OFPT_PACKET_OUT
260 1.692581721 172.31.31.144 -> 172.31.23.72 OpenFlow 187 Type: OFPT_PACKET_OUT
261 1.692587317 172.31.31.144 -> 172.31.23.72 OpenFlow 187 Type: OFPT_PACKET_OUT
262 1.692589240 172.31.31.144 -> 172.31.23.72 TCP 66 6633 → 33654 [ACK] Seq=1065 Ack=8132 Win=853 Len=0 TSval=1248037 TSecr=26087138
263 1.692649811 172.31.31.144 -> 172.31.23.72 TCP 66 6633 → 33654 [ACK] Seq=1065 Ack=8501 Win=853 Len=0 TSval=1248037 TSecr=26087138
264 1.692654737 172.31.31.144 -> 172.31.23.72 OpenFlow 187 Type: OFPT_PACKET_OUT
265 1.692688657 172.31.31.144 -> 172.31.23.72 OpenFlow 187 Type: OFPT_PACKET_OUT
266 1.692745242 172.31.31.144 -> 172.31.23.72 OpenFlow 187 Type: OFPT_PACKET_OUT
267 1.692783553 172.31.23.72 -> 172.31.31.144 OpenFlow 189 Type: OFPT_PACKET_IN
268 1.692802561 172.31.31.144 -> 172.31.23.72 OpenFlow 187 Type: OFPT_PACKET_OUT
269 1.692809364 172.31.23.72 -> 172.31.31.144 OpenFlow 189 Type: OFPT_PACKET_IN
270 1.692867978 172.31.31.144 -> 172.31.23.72 OpenFlow 187 Type: OFPT_PACKET_OUT
271 1.692966936 172.31.31.144 -> 172.31.23.72 OpenFlow 187 Type: OFPT_PACKET_OUT
272 1.692971629 172.31.31.144 -> 172.31.23.72 OpenFlow 187 Type: OFPT_PACKET_OUT
273 1.693042575 172.31.23.72 -> 172.31.31.144 OpenFlow 189 Type: OFPT_PACKET_IN
274 1.693089878 172.31.31.144 -> 172.31.23.72 OpenFlow 187 Type: OFPT_PACKET_OUT
275 1.693095911 172.31.23.72 -> 172.31.31.144 OpenFlow 681 Type: OFPT_PACKET_IN
276 1.693100800 172.31.31.144 -> 172.31.23.72 TCP 66 6633 → 33666 [ACK] Seq=823 Ack=9514 Win=853 Len=0 TSval=1248037 TSecr=26087138
277 1.693265501 172.31.31.144 -> 172.31.23.72 OpenFlow 187 Type: OFPT_PACKET_OUT
278 1.693271335 172.31.31.144 -> 172.31.23.72 OpenFlow 187 Type: OFPT_PACKET_OUT
279 1.693273366 172.31.31.144 -> 172.31.23.72 TCP 66 6633 → 33666 [ACK] Seq=823 Ack=9637 Win=853 Len=0 TSval=1248037 TSecr=26087138
280 1.693275962 172.31.31.144 -> 172.31.23.72 OpenFlow 187 Type: OFPT_PACKET_OUT
281 1.693396669 172.31.31.144 -> 172.31.23.72 OpenFlow 187 Type: OFPT_PACKET_OUT
282 1.693401119 172.31.31.144 -> 172.31.23.72 TCP 66 6633 → 33646 [ACK] Seq=1307 Ack=8868 Win=853 Len=0 TSval=1248037 TSecr=26087138
283 1.693404051 172.31.31.144 -> 172.31.23.72 OpenFlow 187 Type: OFPT_PACKET_OUT
284 1.693405628 172.31.31.144 -> 172.31.23.72 OpenFlow 187 Type: OFPT_PACKET_OUT
285 1.693557187 172.31.23.72 -> 172.31.31.144 OpenFlow 189 Type: OFPT_PACKET_IN
286 1.693567782 172.31.31.144 -> 172.31.23.72 TCP 66 6633 → 33646 [ACK] Seq=1307 Ack=9483 Win=853 Len=0 TSval=1248037 TSecr=26087138
287 1.693585713 172.31.23.72 -> 172.31.31.144 OpenFlow 189 Type: OFPT_PACKET_IN
288 1.693830534 172.31.31.144 -> 172.31.23.72 TCP 66 6633 → 33644 [ACK] Seq=823 Ack=7396 Win=853 Len=0 TSval=1248037 TSecr=26087138
289 1.693836471 172.31.31.144 -> 172.31.23.72 TCP 66 6633 → 33644 [ACK] Seq=823 Ack=7519 Win=853 Len=0 TSval=1248037 TSecr=26087138
290 1.693870469 172.31.23.72 -> 172.31.31.144 OpenFlow 189 Type: OFPT_PACKET_IN
291 1.693897442 172.31.23.72 -> 172.31.31.144 OpenFlow 435 Type: OFPT_PACKET_IN
292 1.693910555 172.31.23.72 -> 172.31.31.144 OpenFlow 189 Type: OFPT_PACKET_IN
293 1.693928912 172.31.23.72 -> 172.31.31.144 OpenFlow 189 Type: OFPT_PACKET_IN
294 1.693969618 172.31.23.72 -> 172.31.31.144 OpenFlow 435 Type: OFPT_PACKET_IN
295 1.693977058 172.31.23.72 -> 172.31.31.144 OpenFlow 189 Type: OFPT_PACKET_IN
296 1.693992742 172.31.23.72 -> 172.31.31.144 OpenFlow 189 Type: OFPT_PACKET_IN
297 1.694007059 172.31.23.72 -> 172.31.31.144 OpenFlow 189 Type: OFPT_PACKET_IN
298 1.694012957 172.31.23.72 -> 172.31.31.144 OpenFlow 927 Type: OFPT_PACKET_IN
299 1.694029820 172.31.23.72 -> 172.31.31.144 OpenFlow 189 Type: OFPT_PACKET_IN
300 1.694044860 172.31.23.72 -> 172.31.31.144 OpenFlow 189 Type: OFPT_PACKET_IN
301 1.694062425 172.31.23.72 -> 172.31.31.144 OpenFlow 189 Type: OFPT_PACKET_IN
302 1.694084858 172.31.23.72 -> 172.31.31.144 OpenFlow 189 Type: OFPT_PACKET_IN
303 1.694184279 172.31.23.72 -> 172.31.31.144 OpenFlow 189 Type: OFPT_PACKET_IN
304 1.694188045 172.31.23.72 -> 172.31.31.144 OpenFlow 189 Type: OFPT_PACKET_IN
305 1.694190301 172.31.23.72 -> 172.31.31.144 OpenFlow 189 Type: OFPT_PACKET_IN
306 1.694207291 172.31.23.72 -> 172.31.31.144 OpenFlow 189 Type: OFPT_PACKET_IN
307 1.694219591 172.31.23.72 -> 172.31.31.144 OpenFlow 189 Type: OFPT_PACKET_IN
308 1.694240008 172.31.23.72 -> 172.31.31.144 OpenFlow 189 Type: OFPT_PACKET_IN
309 1.694279042 172.31.23.72 -> 172.31.31.144 OpenFlow 189 Type: OFPT_PACKET_IN
310 1.694297981 172.31.31.144 -> 172.31.23.72 TCP 66 6633 → 33632 [ACK] Seq=1 Ack=124 Win=853 Len=0 TSval=1248037 TSecr=26087138
311 1.694302516 172.31.31.144 -> 172.31.23.72 TCP 66 6633 → 33632 [ACK] Seq=1 Ack=493 Win=853 Len=0 TSval=1248037 TSecr=26087138
312 1.694304426 172.31.31.144 -> 172.31.23.72 TCP 66 6633 → 33662 [ACK] Seq=97 Ack=9284 Win=853 Len=0 TSval=1248037 TSecr=26087138
313 1.694306768 172.31.31.144 -> 172.31.23.72 TCP 66 6633 → 33648 [ACK] Seq=97 Ack=8548 Win=853 Len=0 TSval=1248037 TSecr=26087138
314 1.694308772 172.31.31.144 -> 172.31.23.72 TCP 66 6633 → 33662 [ACK] Seq=97 Ack=9653 Win=853 Len=0 TSval=1248037 TSecr=26087138
315 1.694334617 172.31.23.72 -> 172.31.31.144 OpenFlow 189 Type: OFPT_PACKET_IN
316 1.694340634 172.31.23.72 -> 172.31.31.144 OpenFlow 189 Type: OFPT_PACKET_IN
317 1.694734043 172.31.23.72 -> 172.31.31.144 OpenFlow 189 Type: OFPT_PACKET_IN
318 1.694737543 172.31.23.72 -> 172.31.31.144 OpenFlow 435 Type: OFPT_PACKET_IN
319 1.694739288 172.31.23.72 -> 172.31.31.144 OpenFlow 927 Type: OFPT_PACKET_IN
320 1.694752413 172.31.23.72 -> 172.31.31.144 OpenFlow 435 Type: OFPT_PACKET_IN
321 1.694754100 172.31.23.72 -> 172.31.31.144 OpenFlow 189 Type: OFPT_PACKET_IN
322 1.695063838 172.31.31.144 -> 172.31.23.72 TCP 66 6633 → 33672 [ACK] Seq=97 Ack=7300 Win=853 Len=0 TSval=1248037 TSecr=26087138
323 1.695068091 172.31.31.144 -> 172.31.23.72 TCP 66 6633 → 33630 [ACK] Seq=1 Ack=124 Win=853 Len=0 TSval=1248037 TSecr=26087138
324 1.695070205 172.31.31.144 -> 172.31.23.72 TCP 66 6633 → 33670 [ACK] Seq=97 Ack=9002 Win=853 Len=0 TSval=1248037 TSecr=26087138
325 1.695072207 172.31.31.144 -> 172.31.23.72 TCP 66 6633 → 33648 [ACK] Seq=97 Ack=9409 Win=853 Len=0 TSval=1248037 TSecr=26087138
326 1.695074043 172.31.31.144 -> 172.31.23.72 TCP 66 6633 → 33664 [ACK] Seq=97 Ack=8644 Win=853 Len=0 TSval=1248037 TSecr=26087138
327 1.695075966 172.31.31.144 -> 172.31.23.72 TCP 66 6633 → 33658 [ACK] Seq=97 Ack=8682 Win=853 Len=0 TSval=1248037 TSecr=26087138
328 1.695077903 172.31.31.144 -> 172.31.23.72 TCP 66 6633 → 33638 [ACK] Seq=1 Ack=124 Win=853 Len=0 TSval=1248037 TSecr=26087138
329 1.695079774 172.31.31.144 -> 172.31.23.72 TCP 66 6633 → 33668 [ACK] Seq=1065 Ack=9172 Win=853 Len=0 TSval=1248037 TSecr=26087138
330 1.695081748 172.31.31.144 -> 172.31.23.72 TCP 66 6633 → 33672 [ACK] Seq=97 Ack=7423 Win=853 Len=0 TSval=1248038 TSecr=26087138
331 1.695083397 172.31.31.144 -> 172.31.23.72 TCP 66 6633 → 33630 [ACK] Seq=1 Ack=247 Win=853 Len=0 TSval=1248038 TSecr=26087138
332 1.695085077 172.31.31.144 -> 172.31.23.72 TCP 66 6633 → 33656 [ACK] Seq=823 Ack=7812 Win=853 Len=0 TSval=1248038 TSecr=26087138
333 1.695088165 172.31.23.72 -> 172.31.31.144 OpenFlow 189 Type: OFPT_PACKET_IN
334 1.695097213 172.31.23.72 -> 172.31.31.144 OpenFlow 189 Type: OFPT_PACKET_IN
335 1.695099273 172.31.23.72 -> 172.31.31.144 OpenFlow 927 Type: OFPT_PACKET_IN
336 1.695100992 172.31.23.72 -> 172.31.31.144 OpenFlow 435 Type: OFPT_PACKET_IN
337 1.695102812 172.31.23.72 -> 172.31.31.144 OpenFlow 681 Type: OFPT_PACKET_IN
338 1.695441142 172.31.31.144 -> 172.31.23.72 TCP 66 6633 → 33652 [ACK] Seq=1065 Ack=8340 Win=853 Len=0 TSval=1248038 TSecr=26087138
339 1.695443649 172.31.31.144 -> 172.31.23.72 TCP 66 6633 → 33636 [ACK] Seq=969 Ack=124 Win=853 Len=0 TSval=1248038 TSecr=26087138
340 1.695445450 172.31.31.144 -> 172.31.23.72 TCP 66 6633 → 33650 [ACK] Seq=1307 Ack=10570 Win=853 Len=0 TSval=1248038 TSecr=26087139
341 1.695447052 172.31.31.144 -> 172.31.23.72 TCP 66 6633 → 33640 [ACK] Seq=1211 Ack=370 Win=853 Len=0 TSval=1248038 TSecr=26087139
342 1.695448742 172.31.31.144 -> 172.31.23.72 TCP 66 6633 → 33670 [ACK] Seq=97 Ack=9125 Win=853 Len=0 TSval=1248038 TSecr=26087139
343 1.695450753 172.31.31.144 -> 172.31.23.72 TCP 66 6633 → 33664 [ACK] Seq=97 Ack=8767 Win=853 Len=0 TSval=1248038 TSecr=26087139
344 1.695780225 172.31.31.144 -> 172.31.23.72 TCP 66 6633 → 33658 [ACK] Seq=97 Ack=9051 Win=853 Len=0 TSval=1248038 TSecr=26087139
345 1.695782353 172.31.31.144 -> 172.31.23.72 TCP 66 6633 → 33638 [ACK] Seq=1 Ack=493 Win=853 Len=0 TSval=1248038 TSecr=26087139
346 1.695783999 172.31.31.144 -> 172.31.23.72 TCP 66 6633 → 33642 [ACK] Seq=97 Ack=9313 Win=853 Len=0 TSval=1248038 TSecr=26087138
347 1.695786400 172.31.31.144 -> 172.31.23.72 TCP 66 6633 → 33668 [ACK] Seq=1065 Ack=9295 Win=853 Len=0 TSval=1248038 TSecr=26087139
348 1.695788311 172.31.31.144 -> 172.31.23.72 TCP 66 6633 → 33656 [ACK] Seq=823 Ack=7935 Win=853 Len=0 TSval=1248038 TSecr=26087139
349 1.695849890 172.31.31.144 -> 172.31.23.72 TCP 66 6633 → 33640 [ACK] Seq=1211 Ack=493 Win=853 Len=0 TSval=1248038 TSecr=26087139
350 1.695957478 172.31.31.144 -> 172.31.23.72 TCP 66 6633 → 33652 [ACK] Seq=1065 Ack=9201 Win=853 Len=0 TSval=1248038 TSecr=26087139
351 1.695959581 172.31.31.144 -> 172.31.23.72 TCP 66 6633 → 33636 [ACK] Seq=969 Ack=493 Win=853 Len=0 TSval=1248038 TSecr=26087139
352 1.695961054 172.31.31.144 -> 172.31.23.72 TCP 66 6633 → 33650 [ACK] Seq=1307 Ack=11185 Win=853 Len=0 TSval=1248038 TSecr=26087139
353 1.787699831 172.31.31.144 -> 172.31.23.72 OpenFlow 187 Type: OFPT_PACKET_OUT
354 1.787723979 172.31.31.144 -> 172.31.23.72 OpenFlow 187 Type: OFPT_PACKET_OUT
355 1.787729347 172.31.31.144 -> 172.31.23.72 OpenFlow 187 Type: OFPT_PACKET_OUT
356 1.787741797 172.31.31.144 -> 172.31.23.72 OpenFlow 187 Type: OFPT_PACKET_OUT
357 1.787781382 172.31.31.144 -> 172.31.23.72 OpenFlow 187 Type: OFPT_PACKET_OUT
358 1.787831625 172.31.31.144 -> 172.31.23.72 OpenFlow 187 Type: OFPT_PACKET_OUT
359 1.787899872 172.31.31.144 -> 172.31.23.72 OpenFlow 187 Type: OFPT_PACKET_OUT
360 1.787938548 172.31.31.144 -> 172.31.23.72 OpenFlow 187 Type: OFPT_PACKET_OUT
361 1.788027511 172.31.31.144 -> 172.31.23.72 OpenFlow 187 Type: OFPT_PACKET_OUT
362 1.788069945 172.31.31.144 -> 172.31.23.72 OpenFlow 187 Type: OFPT_PACKET_OUT
363 1.788118857 172.31.31.144 -> 172.31.23.72 OpenFlow 187 Type: OFPT_PACKET_OUT
364 1.788172975 172.31.31.144 -> 172.31.23.72 OpenFlow 187 Type: OFPT_PACKET_OUT
365 1.788230931 172.31.31.144 -> 172.31.23.72 OpenFlow 187 Type: OFPT_PACKET_OUT
366 1.788328251 172.31.31.144 -> 172.31.23.72 OpenFlow 187 Type: OFPT_PACKET_OUT
367 1.788333109 172.31.31.144 -> 172.31.23.72 OpenFlow 187 Type: OFPT_PACKET_OUT
368 1.788386034 172.31.31.144 -> 172.31.23.72 OpenFlow 187 Type: OFPT_PACKET_OUT
369 1.788410346 172.31.23.72 -> 172.31.31.144 TCP 66 33632 → 6633 [ACK] Seq=493 Ack=969 Win=213 Len=0 TSval=26087162 TSecr=1248061
370 1.788445263 172.31.31.144 -> 172.31.23.72 OpenFlow 187 Type: OFPT_PACKET_OUT
371 1.788518135 172.31.31.144 -> 172.31.23.72 OpenFlow 187 Type: OFPT_PACKET_OUT
