  1 0.000000000 172.31.23.72 -> 172.31.31.144 TCP 66 51130 → 6633 [ACK] Seq=1 Ack=1 Win=213 Len=0 TSval=23934693 TSecr=5364557
  2 0.343316632 172.31.31.144 -> 172.31.23.72 TCP 122 6633 → 51126 [PSH, ACK] Seq=1 Ack=1 Win=853 Len=56 TSval=5364653 TSecr=23934682
  3 0.343382100 172.31.31.144 -> 172.31.23.72 TCP 106 6633 → 51126 [PSH, ACK] Seq=57 Ack=1 Win=853 Len=40 TSval=5364653 TSecr=23934682
  4 0.343841780 172.31.23.72 -> 172.31.31.144 OpenFlow 2634 Type: OFPT_MULTIPART_REPLY, OFPMP_FLOW
  5 0.343940795 172.31.23.72 -> 172.31.31.144 OpenFlow 530 Type: OFPT_MULTIPART_REPLY, OFPMP_PORT_STATS
  6 0.344076643 172.31.31.144 -> 172.31.23.72 TCP 66 6633 → 51126 [ACK] Seq=97 Ack=2569 Win=853 Len=0 TSval=5364653 TSecr=23934778
  7 0.344101841 172.31.31.144 -> 172.31.23.72 TCP 66 6633 → 51126 [ACK] Seq=97 Ack=3033 Win=853 Len=0 TSval=5364653 TSecr=23934778
  8 0.344157605 172.31.23.72 -> 172.31.31.144 OpenFlow 6178 Type: OFPT_MULTIPART_REPLY, OFPMP_TABLE
  9 0.344360942 172.31.31.144 -> 172.31.23.72 TCP 66 6633 → 51126 [ACK] Seq=97 Ack=9145 Win=853 Len=0 TSval=5364653 TSecr=23934779
 10 0.377485225 172.31.31.144 -> 172.31.23.72 TCP 82 6633 → 51128 [PSH, ACK] Seq=1 Ack=1 Win=853 Len=16 TSval=5364661 TSecr=23934683
 11 0.377512216 172.31.31.144 -> 172.31.23.72 TCP 146 6633 → 51128 [PSH, ACK] Seq=17 Ack=1 Win=853 Len=80 TSval=5364661 TSecr=23934683
 12 0.377788514 172.31.23.72 -> 172.31.31.144 OpenFlow 6178 Type: OFPT_MULTIPART_REPLY, OFPMP_TABLE
 13 0.377876288 172.31.23.72 -> 172.31.31.144 OpenFlow 3050 Type: OFPT_MULTIPART_REPLY, OFPMP_FLOW
 14 0.377971245 172.31.23.72 -> 172.31.31.144 OpenFlow 642 Type: OFPT_MULTIPART_REPLY, OFPMP_PORT_STATS
 15 0.378079027 172.31.31.144 -> 172.31.23.72 TCP 66 6633 → 51128 [ACK] Seq=97 Ack=6113 Win=853 Len=0 TSval=5364661 TSecr=23934787
 16 0.378096544 172.31.31.144 -> 172.31.23.72 TCP 66 6633 → 51128 [ACK] Seq=97 Ack=9097 Win=853 Len=0 TSval=5364661 TSecr=23934787
 17 0.378115944 172.31.31.144 -> 172.31.23.72 TCP 66 6633 → 51128 [ACK] Seq=97 Ack=9673 Win=853 Len=0 TSval=5364661 TSecr=23934787
 18 0.413916838 172.31.31.144 -> 172.31.23.72 TCP 90 6633 → 51130 [PSH, ACK] Seq=1 Ack=1 Win=853 Len=24 TSval=5364670 TSecr=23934693
 19 0.413943987 172.31.23.72 -> 172.31.31.144 TCP 66 51130 → 6633 [ACK] Seq=1 Ack=25 Win=213 Len=0 TSval=23934796 TSecr=5364670
 20 0.414234270 172.31.23.72 -> 172.31.31.144 OpenFlow 754 Type: OFPT_MULTIPART_REPLY, OFPMP_PORT_STATS
 21 0.415071522 172.31.31.144 -> 172.31.23.72 OpenFlow 82 Type: OFPT_MULTIPART_REQUEST, OFPMP_TABLE
 22 0.415086246 172.31.31.144 -> 172.31.23.72 OpenFlow 122 Type: OFPT_MULTIPART_REQUEST, OFPMP_FLOW
 23 0.415359734 172.31.23.72 -> 172.31.31.144 OpenFlow 6178 Type: OFPT_MULTIPART_REPLY, OFPMP_TABLE
 24 0.415449792 172.31.23.72 -> 172.31.31.144 OpenFlow 2842 Type: OFPT_MULTIPART_REPLY, OFPMP_FLOW
 25 0.415669705 172.31.31.144 -> 172.31.23.72 TCP 66 6633 → 51130 [ACK] Seq=97 Ack=9577 Win=853 Len=0 TSval=5364671 TSecr=23934796
 26 0.458080946 172.31.31.144 -> 172.31.23.72 TCP 187 6633 → 51132 [PSH, ACK] Seq=1 Ack=1 Win=853 Len=121 TSval=5364681 TSecr=23934683
 27 0.458094424 172.31.31.144 -> 172.31.23.72 TCP 187 6633 → 51132 [PSH, ACK] Seq=122 Ack=1 Win=853 Len=121 TSval=5364681 TSecr=23934683
 28 0.458161522 172.31.31.144 -> 172.31.23.72 TCP 187 6633 → 51132 [PSH, ACK] Seq=243 Ack=1 Win=853 Len=121 TSval=5364681 TSecr=23934683
 29 0.458192918 172.31.31.144 -> 172.31.23.72 TCP 187 6633 → 51132 [PSH, ACK] Seq=364 Ack=1 Win=853 Len=121 TSval=5364681 TSecr=23934683
 30 0.458279048 172.31.31.144 -> 172.31.23.72 TCP 187 6633 → 51132 [PSH, ACK] Seq=485 Ack=1 Win=853 Len=121 TSval=5364681 TSecr=23934683
 31 0.458333159 172.31.31.144 -> 172.31.23.72 TCP 187 6633 → 51132 [PSH, ACK] Seq=606 Ack=1 Win=853 Len=121 TSval=5364681 TSecr=23934683
 32 0.458405386 172.31.31.144 -> 172.31.23.72 TCP 187 6633 → 51132 [PSH, ACK] Seq=727 Ack=1 Win=853 Len=121 TSval=5364681 TSecr=23934683
 33 0.458479264 172.31.31.144 -> 172.31.23.72 TCP 187 6633 → 51132 [PSH, ACK] Seq=848 Ack=1 Win=853 Len=121 TSval=5364681 TSecr=23934683
 34 0.458577477 172.31.23.72 -> 172.31.31.144 TCP 66 51132 → 6633 [ACK] Seq=1 Ack=969 Win=213 Len=0 TSval=23934807 TSecr=5364681
 35 0.458650737 172.31.31.144 -> 172.31.23.72 TCP 187 6633 → 51134 [PSH, ACK] Seq=1 Ack=1 Win=853 Len=121 TSval=5364682 TSecr=23934683
 36 0.458668169 172.31.31.144 -> 172.31.23.72 TCP 187 6633 → 51134 [PSH, ACK] Seq=122 Ack=1 Win=853 Len=121 TSval=5364682 TSecr=23934683
 37 0.458698243 172.31.23.72 -> 172.31.31.144 OpenFlow 189 Type: OFPT_PACKET_IN
 38 0.458728746 172.31.23.72 -> 172.31.31.144 OpenFlow 189 Type: OFPT_PACKET_IN
 39 0.458753111 172.31.31.144 -> 172.31.23.72 TCP 187 6633 → 51134 [PSH, ACK] Seq=243 Ack=1 Win=853 Len=121 TSval=5364682 TSecr=23934683
 40 0.458765672 172.31.23.72 -> 172.31.31.144 OpenFlow 189 Type: OFPT_PACKET_IN
 41 0.458786344 172.31.23.72 -> 172.31.31.144 OpenFlow 189 Type: OFPT_PACKET_IN
 42 0.458836079 172.31.23.72 -> 172.31.31.144 OpenFlow 189 Type: OFPT_PACKET_IN
 43 0.458852792 172.31.31.144 -> 172.31.23.72 OpenFlow 187 Type: OFPT_PACKET_OUT
 44 0.458856794 172.31.23.72 -> 172.31.31.144 OpenFlow 189 Type: OFPT_PACKET_IN
 45 0.458900189 172.31.31.144 -> 172.31.23.72 OpenFlow 187 Type: OFPT_PACKET_OUT
 46 0.458964057 172.31.31.144 -> 172.31.23.72 OpenFlow 187 Type: OFPT_PACKET_OUT
 47 0.458979634 172.31.31.144 -> 172.31.23.72 TCP 66 6633 → 51130 [ACK] Seq=97 Ack=9823 Win=853 Len=0 TSval=5364682 TSecr=23934807
 48 0.458998083 172.31.31.144 -> 172.31.23.72 TCP 66 6633 → 51140 [ACK] Seq=1 Ack=247 Win=853 Len=0 TSval=5364682 TSecr=23934807
 49 0.459046020 172.31.31.144 -> 172.31.23.72 TCP 66 6633 → 51134 [ACK] Seq=727 Ack=247 Win=853 Len=0 TSval=5364682 TSecr=23934807
 50 0.459123343 172.31.31.144 -> 172.31.23.72 TCP 187 6633 → 51136 [PSH, ACK] Seq=1 Ack=1 Win=853 Len=121 TSval=5364682 TSecr=23934683
 51 0.459142251 172.31.23.72 -> 172.31.31.144 TCP 66 51134 → 6633 [ACK] Seq=247 Ack=727 Win=213 Len=0 TSval=23934807 TSecr=5364682
 52 0.459152268 172.31.31.144 -> 172.31.23.72 TCP 187 6633 → 51136 [PSH, ACK] Seq=122 Ack=1 Win=853 Len=121 TSval=5364682 TSecr=23934683
 53 0.459291141 172.31.23.72 -> 172.31.31.144 OpenFlow 189 Type: OFPT_PACKET_IN
 54 0.459317449 172.31.23.72 -> 172.31.31.144 OpenFlow 189 Type: OFPT_PACKET_IN
 55 0.459374048 172.31.31.144 -> 172.31.23.72 TCP 187 6633 → 51136 [PSH, ACK] Seq=243 Ack=1 Win=853 Len=121 TSval=5364682 TSecr=23934683
 56 0.459471508 172.31.31.144 -> 172.31.23.72 TCP 187 6633 → 51136 [PSH, ACK] Seq=364 Ack=1 Win=853 Len=121 TSval=5364682 TSecr=23934683
 57 0.459518657 172.31.31.144 -> 172.31.23.72 TCP 66 6633 → 51132 [ACK] Seq=969 Ack=247 Win=853 Len=0 TSval=5364682 TSecr=23934807
 58 0.459547012 172.31.31.144 -> 172.31.23.72 TCP 187 6633 → 51136 [PSH, ACK] Seq=485 Ack=1 Win=853 Len=121 TSval=5364682 TSecr=23934683
 59 0.459551652 172.31.23.72 -> 172.31.31.144 TCP 66 51136 → 6633 [ACK] Seq=1 Ack=485 Win=213 Len=0 TSval=23934807 TSecr=5364682
 60 0.459631540 172.31.31.144 -> 172.31.23.72 TCP 187 6633 → 51136 [PSH, ACK] Seq=606 Ack=1 Win=853 Len=121 TSval=5364682 TSecr=23934683
 61 0.459675060 172.31.23.72 -> 172.31.31.144 TCP 66 51136 → 6633 [ACK] Seq=1 Ack=727 Win=213 Len=0 TSval=23934807 TSecr=5364682
 62 0.459691414 172.31.31.144 -> 172.31.23.72 TCP 187 6633 → 51136 [PSH, ACK] Seq=727 Ack=1 Win=853 Len=121 TSval=5364682 TSecr=23934683
 63 0.459769943 172.31.31.144 -> 172.31.23.72 TCP 187 6633 → 51136 [PSH, ACK] Seq=848 Ack=1 Win=853 Len=121 TSval=5364682 TSecr=23934807
 64 0.459809382 172.31.23.72 -> 172.31.31.144 TCP 66 51136 → 6633 [ACK] Seq=1 Ack=969 Win=213 Len=0 TSval=23934807 TSecr=5364682
 65 0.459841185 172.31.31.144 -> 172.31.23.72 TCP 187 6633 → 51136 [PSH, ACK] Seq=969 Ack=1 Win=853 Len=121 TSval=5364682 TSecr=23934807
 66 0.459915120 172.31.31.144 -> 172.31.23.72 TCP 187 6633 → 51136 [PSH, ACK] Seq=1090 Ack=1 Win=853 Len=121 TSval=5364682 TSecr=23934807
 67 0.459931901 172.31.23.72 -> 172.31.31.144 TCP 66 51136 → 6633 [ACK] Seq=1 Ack=1211 Win=213 Len=0 TSval=23934807 TSecr=5364682
 68 0.459997146 172.31.31.144 -> 172.31.23.72 TCP 187 6633 → 51138 [PSH, ACK] Seq=1 Ack=1 Win=853 Len=121 TSval=5364682 TSecr=23934683
 69 0.460030172 172.31.23.72 -> 172.31.31.144 OpenFlow 189 Type: OFPT_PACKET_IN
 70 0.460051266 172.31.31.144 -> 172.31.23.72 TCP 187 6633 → 51138 [PSH, ACK] Seq=122 Ack=1 Win=853 Len=121 TSval=5364682 TSecr=23934683
 71 0.460057441 172.31.23.72 -> 172.31.31.144 OpenFlow 189 Type: OFPT_PACKET_IN
 72 0.460101712 172.31.23.72 -> 172.31.31.144 OpenFlow 189 Type: OFPT_PACKET_IN
 73 0.460128316 172.31.31.144 -> 172.31.23.72 TCP 187 6633 → 51138 [PSH, ACK] Seq=243 Ack=1 Win=853 Len=121 TSval=5364682 TSecr=23934683
 74 0.460132894 172.31.23.72 -> 172.31.31.144 OpenFlow 189 Type: OFPT_PACKET_IN
 75 0.460151986 172.31.23.72 -> 172.31.31.144 OpenFlow 189 Type: OFPT_PACKET_IN
 76 0.460179541 172.31.23.72 -> 172.31.31.144 OpenFlow 189 Type: OFPT_PACKET_IN
 77 0.460203597 172.31.31.144 -> 172.31.23.72 TCP 187 6633 → 51138 [PSH, ACK] Seq=364 Ack=1 Win=853 Len=121 TSval=5364682 TSecr=23934683
 78 0.460219614 172.31.23.72 -> 172.31.31.144 OpenFlow 189 Type: OFPT_PACKET_IN
 79 0.460241088 172.31.23.72 -> 172.31.31.144 OpenFlow 189 Type: OFPT_PACKET_IN
 80 0.460257824 172.31.23.72 -> 172.31.31.144 OpenFlow 189 Type: OFPT_PACKET_IN
 81 0.460265628 172.31.31.144 -> 172.31.23.72 TCP 66 6633 → 51130 [ACK] Seq=97 Ack=10069 Win=853 Len=0 TSval=5364682 TSecr=23934808
 82 0.460269499 172.31.31.144 -> 172.31.23.72 OpenFlow 187 Type: OFPT_PACKET_OUT
 83 0.460272406 172.31.23.72 -> 172.31.31.144 OpenFlow 189 Type: OFPT_PACKET_IN
 84 0.460314749 172.31.31.144 -> 172.31.23.72 OpenFlow 187 Type: OFPT_PACKET_OUT
 85 0.460320607 172.31.23.72 -> 172.31.31.144 OpenFlow 312 Type: OFPT_PACKET_IN
 86 0.460338904 172.31.31.144 -> 172.31.23.72 TCP 66 6633 → 51128 [ACK] Seq=97 Ack=9796 Win=853 Len=0 TSval=5364682 TSecr=23934808
 87 0.460362556 172.31.31.144 -> 172.31.23.72 TCP 66 6633 → 51142 [ACK] Seq=1 Ack=247 Win=853 Len=0 TSval=5364682 TSecr=23934808
 88 0.460367730 172.31.31.144 -> 172.31.23.72 TCP 66 6633 → 51128 [ACK] Seq=97 Ack=9919 Win=853 Len=0 TSval=5364682 TSecr=23934808
 89 0.460387574 172.31.31.144 -> 172.31.23.72 TCP 66 6633 → 51126 [ACK] Seq=97 Ack=9268 Win=853 Len=0 TSval=5364682 TSecr=23934808
 90 0.460405705 172.31.31.144 -> 172.31.23.72 TCP 66 6633 → 51126 [ACK] Seq=97 Ack=9391 Win=853 Len=0 TSval=5364682 TSecr=23934808
 91 0.460434962 172.31.31.144 -> 172.31.23.72 OpenFlow 187 Type: OFPT_PACKET_OUT
 92 0.460453881 172.31.31.144 -> 172.31.23.72 TCP 66 6633 → 51138 [ACK] Seq=848 Ack=493 Win=853 Len=0 TSval=5364682 TSecr=23934808
 93 0.460664359 172.31.23.72 -> 172.31.31.144 OpenFlow 189 Type: OFPT_PACKET_IN
 94 0.460776983 172.31.23.72 -> 172.31.31.144 OpenFlow 189 Type: OFPT_PACKET_IN
 95 0.460799675 172.31.23.72 -> 172.31.31.144 OpenFlow 189 Type: OFPT_PACKET_IN
 96 0.460804720 172.31.23.72 -> 172.31.31.144 OpenFlow 189 Type: OFPT_PACKET_IN
 97 0.460817072 172.31.23.72 -> 172.31.31.144 OpenFlow 189 Type: OFPT_PACKET_IN
 98 0.460848571 172.31.23.72 -> 172.31.31.144 OpenFlow 189 Type: OFPT_PACKET_IN
 99 0.460850773 172.31.23.72 -> 172.31.31.144 OpenFlow 189 Type: OFPT_PACKET_IN
100 0.460896738 172.31.23.72 -> 172.31.31.144 OpenFlow 189 Type: OFPT_PACKET_IN
101 0.460901272 172.31.23.72 -> 172.31.31.144 OpenFlow 189 Type: OFPT_PACKET_IN
102 0.460980390 172.31.31.144 -> 172.31.23.72 TCP 66 6633 → 51136 [ACK] Seq=1211 Ack=124 Win=853 Len=0 TSval=5364682 TSecr=23934808
103 0.460998379 172.31.31.144 -> 172.31.23.72 TCP 66 6633 → 51146 [ACK] Seq=1 Ack=247 Win=853 Len=0 TSval=5364682 TSecr=23934808
104 0.461042481 172.31.31.144 -> 172.31.23.72 TCP 66 6633 → 51136 [ACK] Seq=1211 Ack=247 Win=853 Len=0 TSval=5364682 TSecr=23934808
105 0.461067963 172.31.31.144 -> 172.31.23.72 TCP 66 6633 → 51130 [ACK] Seq=97 Ack=10315 Win=853 Len=0 TSval=5364682 TSecr=23934808
106 0.461284040 172.31.31.144 -> 172.31.23.72 OpenFlow 187 Type: OFPT_PACKET_OUT
107 0.461319212 172.31.31.144 -> 172.31.23.72 OpenFlow 187 Type: OFPT_PACKET_OUT
108 0.461351895 172.31.31.144 -> 172.31.23.72 OpenFlow 187 Type: OFPT_PACKET_OUT
109 0.461382273 172.31.31.144 -> 172.31.23.72 OpenFlow 308 Type: OFPT_PACKET_OUT
110 0.461456887 172.31.23.72 -> 172.31.31.144 TCP 66 51140 → 6633 [ACK] Seq=493 Ack=243 Win=213 Len=0 TSval=23934808 TSecr=5364682
111 0.461565762 172.31.31.144 -> 172.31.23.72 OpenFlow 187 Type: OFPT_PACKET_OUT
112 0.461579042 172.31.23.72 -> 172.31.31.144 OpenFlow 189 Type: OFPT_PACKET_IN
113 0.461600362 172.31.23.72 -> 172.31.31.144 OpenFlow 189 Type: OFPT_PACKET_IN
114 0.461743046 172.31.31.144 -> 172.31.23.72 OpenFlow 187 Type: OFPT_PACKET_OUT
115 0.461757398 172.31.23.72 -> 172.31.31.144 OpenFlow 189 Type: OFPT_PACKET_IN
116 0.461772985 172.31.31.144 -> 172.31.23.72 TCP 66 6633 → 51138 [ACK] Seq=1211 Ack=739 Win=853 Len=0 TSval=5364682 TSecr=23934808
117 0.461796606 172.31.31.144 -> 172.31.23.72 OpenFlow 187 Type: OFPT_PACKET_OUT
118 0.461864242 172.31.31.144 -> 172.31.23.72 OpenFlow 187 Type: OFPT_PACKET_OUT
119 0.461899417 172.31.23.72 -> 172.31.31.144 OpenFlow 189 Type: OFPT_PACKET_IN
120 0.461919583 172.31.23.72 -> 172.31.31.144 OpenFlow 189 Type: OFPT_PACKET_IN
121 0.461962266 172.31.31.144 -> 172.31.23.72 TCP 66 6633 → 51134 [ACK] Seq=727 Ack=493 Win=853 Len=0 TSval=5364682 TSecr=23934808
122 0.462027142 172.31.31.144 -> 172.31.23.72 OpenFlow 187 Type: OFPT_PACKET_OUT
123 0.462076097 172.31.31.144 -> 172.31.23.72 TCP 66 6633 → 51142 [ACK] Seq=122 Ack=493 Win=853 Len=0 TSval=5364682 TSecr=23934808
124 0.462120595 172.31.23.72 -> 172.31.31.144 TCP 66 51140 → 6633 [ACK] Seq=493 Ack=727 Win=213 Len=0 TSval=23934808 TSecr=5364682
125 0.462208220 172.31.23.72 -> 172.31.31.144 OpenFlow 189 Type: OFPT_PACKET_IN
126 0.462238214 172.31.23.72 -> 172.31.31.144 OpenFlow 189 Type: OFPT_PACKET_IN
127 0.462356787 172.31.23.72 -> 172.31.31.144 OpenFlow 189 Type: OFPT_PACKET_IN
128 0.462378704 172.31.23.72 -> 172.31.31.144 OpenFlow 189 Type: OFPT_PACKET_IN
129 0.462403304 172.31.31.144 -> 172.31.23.72 TCP 66 6633 → 51144 [ACK] Seq=1 Ack=247 Win=853 Len=0 TSval=5364682 TSecr=23934808
130 0.462496083 172.31.23.72 -> 172.31.31.144 OpenFlow 189 Type: OFPT_PACKET_IN
131 0.462547041 172.31.31.144 -> 172.31.23.72 TCP 66 6633 → 51132 [ACK] Seq=969 Ack=493 Win=853 Len=0 TSval=5364683 TSecr=23934808
132 0.462566307 172.31.31.144 -> 172.31.23.72 OpenFlow 187 Type: OFPT_PACKET_OUT
133 0.462593721 172.31.31.144 -> 172.31.23.72 OpenFlow 550 Type: OFPT_PACKET_OUT
134 0.462612713 172.31.31.144 -> 172.31.23.72 OpenFlow 187 Type: OFPT_PACKET_OUT
135 0.462856843 172.31.31.144 -> 172.31.23.72 OpenFlow 187 Type: OFPT_PACKET_OUT
136 0.462914062 172.31.31.144 -> 172.31.23.72 OpenFlow 187 Type: OFPT_PACKET_OUT
137 0.462994908 172.31.31.144 -> 172.31.23.72 OpenFlow 187 Type: OFPT_PACKET_OUT
138 0.463067294 172.31.23.72 -> 172.31.31.144 TCP 66 51142 → 6633 [ACK] Seq=493 Ack=1211 Win=213 Len=0 TSval=23934808 TSecr=5364682
139 0.463145820 172.31.31.144 -> 172.31.23.72 OpenFlow 187 Type: OFPT_PACKET_OUT
140 0.463160492 172.31.31.144 -> 172.31.23.72 OpenFlow 82 Type: OFPT_MULTIPART_REQUEST, OFPMP_TABLE
141 0.463175566 172.31.23.72 -> 172.31.31.144 OpenFlow 189 Type: OFPT_PACKET_IN
142 0.463183707 172.31.31.144 -> 172.31.23.72 OpenFlow 146 Type: OFPT_MULTIPART_REQUEST, OFPMP_FLOW
143 0.463199964 172.31.31.144 -> 172.31.23.72 OpenFlow 187 Type: OFPT_PACKET_OUT
144 0.463224212 172.31.31.144 -> 172.31.23.72 OpenFlow 187 Type: OFPT_PACKET_OUT
145 0.463290936 172.31.23.72 -> 172.31.31.144 TCP 66 51144 → 6633 [ACK] Seq=493 Ack=364 Win=213 Len=0 TSval=23934808 TSecr=5364683
146 0.463302035 172.31.31.144 -> 172.31.23.72 OpenFlow 187 Type: OFPT_PACKET_OUT
147 0.463421807 172.31.23.72 -> 172.31.31.144 OpenFlow 189 Type: OFPT_PACKET_IN
148 0.463444625 172.31.23.72 -> 172.31.31.144 OpenFlow 189 Type: OFPT_PACKET_IN
149 0.463535231 172.31.23.72 -> 172.31.31.144 OpenFlow 189 Type: OFPT_PACKET_IN
150 0.463557069 172.31.23.72 -> 172.31.31.144 OpenFlow 189 Type: OFPT_PACKET_IN
151 0.463601029 172.31.31.144 -> 172.31.23.72 TCP 66 6633 → 51138 [ACK] Seq=1211 Ack=985 Win=853 Len=0 TSval=5364683 TSecr=23934808
152 0.463612425 172.31.31.144 -> 172.31.23.72 OpenFlow 187 Type: OFPT_PACKET_OUT
153 0.463630720 172.31.31.144 -> 172.31.23.72 OpenFlow 187 Type: OFPT_PACKET_OUT
154 0.463649393 172.31.31.144 -> 172.31.23.72 OpenFlow 308 Type: OFPT_PACKET_OUT
155 0.463668909 172.31.31.144 -> 172.31.23.72 OpenFlow 187 Type: OFPT_PACKET_OUT
156 0.463688000 172.31.31.144 -> 172.31.23.72 OpenFlow 187 Type: OFPT_PACKET_OUT
157 0.463714852 172.31.31.144 -> 172.31.23.72 TCP 66 6633 → 51148 [ACK] Seq=1 Ack=247 Win=853 Len=0 TSval=5364683 TSecr=23934808
158 0.463745443 172.31.23.72 -> 172.31.31.144 OpenFlow 6178 Type: OFPT_MULTIPART_REPLY, OFPMP_TABLE
159 0.463775682 172.31.31.144 -> 172.31.23.72 OpenFlow 187 Type: OFPT_PACKET_OUT
160 0.463853508 172.31.31.144 -> 172.31.23.72 OpenFlow 187 Type: OFPT_PACKET_OUT
161 0.463877051 172.31.23.72 -> 172.31.31.144 OpenFlow 642 Type: OFPT_MULTIPART_REPLY, OFPMP_PORT_STATS
162 0.463934362 172.31.23.72 -> 172.31.31.144 OpenFlow 2010 Type: OFPT_MULTIPART_REPLY, OFPMP_FLOW
163 0.463955171 172.31.23.72 -> 172.31.31.144 OpenFlow 189 Type: OFPT_PACKET_IN
164 0.463997545 172.31.23.72 -> 172.31.31.144 OpenFlow 189 Type: OFPT_PACKET_IN
165 0.464082812 172.31.31.144 -> 172.31.23.72 OpenFlow 187 Type: OFPT_PACKET_OUT
166 0.464098525 172.31.31.144 -> 172.31.23.72 TCP 66 6633 → 51132 [ACK] Seq=1065 Ack=9125 Win=853 Len=0 TSval=5364683 TSecr=23934808
167 0.464128519 172.31.31.144 -> 172.31.23.72 OpenFlow 187 Type: OFPT_PACKET_OUT
168 0.464256827 172.31.23.72 -> 172.31.31.144 TCP 66 51146 → 6633 [ACK] Seq=493 Ack=727 Win=213 Len=0 TSval=23934809 TSecr=5364683
169 0.464343876 172.31.23.72 -> 172.31.31.144 OpenFlow 189 Type: OFPT_PACKET_IN
170 0.464376848 172.31.23.72 -> 172.31.31.144 OpenFlow 435 Type: OFPT_PACKET_IN
171 0.464402657 172.31.23.72 -> 172.31.31.144 OpenFlow 189 Type: OFPT_PACKET_IN
172 0.464421717 172.31.31.144 -> 172.31.23.72 OpenFlow 187 Type: OFPT_PACKET_OUT
173 0.464428064 172.31.23.72 -> 172.31.31.144 OpenFlow 435 Type: OFPT_PACKET_IN
174 0.464437618 172.31.23.72 -> 172.31.31.144 OpenFlow 189 Type: OFPT_PACKET_IN
175 0.464468155 172.31.31.144 -> 172.31.23.72 OpenFlow 429 Type: OFPT_PACKET_OUT
176 0.464472926 172.31.23.72 -> 172.31.31.144 OpenFlow 189 Type: OFPT_PACKET_IN
177 0.464514617 172.31.31.144 -> 172.31.23.72 TCP 66 6633 → 51136 [ACK] Seq=1211 Ack=370 Win=853 Len=0 TSval=5364683 TSecr=23934809
178 0.464519664 172.31.31.144 -> 172.31.23.72 TCP 66 6633 → 51136 [ACK] Seq=1211 Ack=739 Win=853 Len=0 TSval=5364683 TSecr=23934809
179 0.464614446 172.31.31.144 -> 172.31.23.72 TCP 66 6633 → 51142 [ACK] Seq=1211 Ack=985 Win=853 Len=0 TSval=5364683 TSecr=23934809
180 0.464623951 172.31.23.72 -> 172.31.31.144 TCP 66 51144 → 6633 [ACK] Seq=493 Ack=969 Win=213 Len=0 TSval=23934809 TSecr=5364683
181 0.464631898 172.31.31.144 -> 172.31.23.72 OpenFlow 187 Type: OFPT_PACKET_OUT
182 0.464643879 172.31.31.144 -> 172.31.23.72 OpenFlow 187 Type: OFPT_PACKET_OUT
183 0.464667928 172.31.31.144 -> 172.31.23.72 TCP 66 6633 → 51140 [ACK] Seq=727 Ack=739 Win=853 Len=0 TSval=5364683 TSecr=23934809
184 0.464695570 172.31.31.144 -> 172.31.23.72 OpenFlow 187 Type: OFPT_PACKET_OUT
185 0.464783267 172.31.31.144 -> 172.31.23.72 OpenFlow 187 Type: OFPT_PACKET_OUT
186 0.464820687 172.31.23.72 -> 172.31.31.144 OpenFlow 189 Type: OFPT_PACKET_IN
187 0.464831324 172.31.31.144 -> 172.31.23.72 OpenFlow 187 Type: OFPT_PACKET_OUT
188 0.464841685 172.31.23.72 -> 172.31.31.144 OpenFlow 189 Type: OFPT_PACKET_IN
189 0.464871332 172.31.23.72 -> 172.31.31.144 OpenFlow 189 Type: OFPT_PACKET_IN
190 0.464894670 172.31.23.72 -> 172.31.31.144 OpenFlow 189 Type: OFPT_PACKET_IN
191 0.464917329 172.31.31.144 -> 172.31.23.72 OpenFlow 187 Type: OFPT_PACKET_OUT
192 0.465038514 172.31.31.144 -> 172.31.23.72 OpenFlow 187 Type: OFPT_PACKET_OUT
193 0.465054856 172.31.31.144 -> 172.31.23.72 TCP 66 6633 → 51152 [ACK] Seq=1 Ack=247 Win=853 Len=0 TSval=5364683 TSecr=23934809
194 0.465180128 172.31.23.72 -> 172.31.31.144 TCP 66 51148 → 6633 [ACK] Seq=493 Ack=848 Win=213 Len=0 TSval=23934809 TSecr=5364683
195 0.465222717 172.31.31.144 -> 172.31.23.72 TCP 187 6633 → 51150 [PSH, ACK] Seq=1 Ack=1 Win=853 Len=121 TSval=5364683 TSecr=23934133
196 0.465267430 172.31.23.72 -> 172.31.31.144 OpenFlow 189 Type: OFPT_PACKET_IN
197 0.465277813 172.31.31.144 -> 172.31.23.72 TCP 187 6633 → 51150 [PSH, ACK] Seq=122 Ack=1 Win=853 Len=121 TSval=5364683 TSecr=23934133
198 0.465290378 172.31.23.72 -> 172.31.31.144 OpenFlow 189 Type: OFPT_PACKET_IN
199 0.465334686 172.31.31.144 -> 172.31.23.72 TCP 187 6633 → 51150 [PSH, ACK] Seq=243 Ack=1 Win=853 Len=121 TSval=5364683 TSecr=23934133
200 0.465428407 172.31.31.144 -> 172.31.23.72 TCP 187 6633 → 51150 [PSH, ACK] Seq=364 Ack=1 Win=853 Len=121 TSval=5364683 TSecr=23934133
201 0.465432946 172.31.31.144 -> 172.31.23.72 TCP 66 6633 → 51146 [ACK] Seq=1211 Ack=739 Win=853 Len=0 TSval=5364683 TSecr=23934809
202 0.465500174 172.31.31.144 -> 172.31.23.72 OpenFlow 187 Type: OFPT_PACKET_OUT
203 0.465530477 172.31.23.72 -> 172.31.31.144 OpenFlow 189 Type: OFPT_PACKET_IN
204 0.465552369 172.31.31.144 -> 172.31.23.72 TCP 187 6633 → 51150 [PSH, ACK] Seq=485 Ack=1 Win=853 Len=121 TSval=5364683 TSecr=23934133
205 0.465557042 172.31.23.72 -> 172.31.31.144 OpenFlow 189 Type: OFPT_PACKET_IN
206 0.465578276 172.31.31.144 -> 172.31.23.72 OpenFlow 187 Type: OFPT_PACKET_OUT
207 0.465584646 172.31.23.72 -> 172.31.31.144 OpenFlow 435 Type: OFPT_PACKET_IN
208 0.465631700 172.31.31.144 -> 172.31.23.72 OpenFlow 187 Type: OFPT_PACKET_OUT
209 0.465698354 172.31.31.144 -> 172.31.23.72 OpenFlow 187 Type: OFPT_PACKET_OUT
210 0.465773530 172.31.31.144 -> 172.31.23.72 TCP 66 6633 → 51150 [ACK] Seq=969 Ack=493 Win=853 Len=0 TSval=5364683 TSecr=23934809
211 0.465801530 172.31.31.144 -> 172.31.23.72 OpenFlow 187 Type: OFPT_PACKET_OUT
212 0.465876235 172.31.31.144 -> 172.31.23.72 OpenFlow 187 Type: OFPT_PACKET_OUT
213 0.465948945 172.31.23.72 -> 172.31.31.144 TCP 66 51150 → 6633 [ACK] Seq=493 Ack=969 Win=213 Len=0 TSval=23934809 TSecr=5364683
214 0.465978443 172.31.31.144 -> 172.31.23.72 OpenFlow 187 Type: OFPT_PACKET_OUT
215 0.466024536 172.31.23.72 -> 172.31.31.144 OpenFlow 189 Type: OFPT_PACKET_IN
216 0.466055718 172.31.23.72 -> 172.31.31.144 OpenFlow 189 Type: OFPT_PACKET_IN
217 0.466061972 172.31.23.72 -> 172.31.31.144 OpenFlow 189 Type: OFPT_PACKET_IN
218 0.466081954 172.31.31.144 -> 172.31.23.72 OpenFlow 187 Type: OFPT_PACKET_OUT
219 0.466092837 172.31.23.72 -> 172.31.31.144 OpenFlow 189 Type: OFPT_PACKET_IN
220 0.466109385 172.31.23.72 -> 172.31.31.144 OpenFlow 189 Type: OFPT_PACKET_IN
221 0.466111691 172.31.23.72 -> 172.31.31.144 OpenFlow 189 Type: OFPT_PACKET_IN
222 0.466146936 172.31.23.72 -> 172.31.31.144 OpenFlow 189 Type: OFPT_PACKET_IN
223 0.466151452 172.31.23.72 -> 172.31.31.144 OpenFlow 189 Type: OFPT_PACKET_IN
224 0.466161331 172.31.23.72 -> 172.31.31.144 OpenFlow 189 Type: OFPT_PACKET_IN
225 0.466185599 172.31.31.144 -> 172.31.23.72 OpenFlow 187 Type: OFPT_PACKET_OUT
226 0.466231259 172.31.23.72 -> 172.31.31.144 OpenFlow 189 Type: OFPT_PACKET_IN
227 0.466258527 172.31.31.144 -> 172.31.23.72 TCP 66 6633 → 51162 [ACK] Seq=1 Ack=124 Win=853 Len=0 TSval=5364683 TSecr=23934809
228 0.466263367 172.31.31.144 -> 172.31.23.72 TCP 66 6633 → 51162 [ACK] Seq=1 Ack=247 Win=853 Len=0 TSval=5364683 TSecr=23934809
229 0.466265393 172.31.31.144 -> 172.31.23.72 OpenFlow 187 Type: OFPT_PACKET_OUT
230 0.466267437 172.31.31.144 -> 172.31.23.72 TCP 66 6633 → 51158 [ACK] Seq=1 Ack=124 Win=853 Len=0 TSval=5364683 TSecr=23934809
231 0.466291815 172.31.23.72 -> 172.31.31.144 OpenFlow 189 Type: OFPT_PACKET_IN
232 0.466324763 172.31.23.72 -> 172.31.31.144 OpenFlow 189 Type: OFPT_PACKET_IN
233 0.466338642 172.31.31.144 -> 172.31.23.72 TCP 66 6633 → 51158 [ACK] Seq=1 Ack=247 Win=853 Len=0 TSval=5364683 TSecr=23934809
234 0.466342495 172.31.31.144 -> 172.31.23.72 TCP 66 6633 → 51144 [ACK] Seq=969 Ack=739 Win=853 Len=0 TSval=5364683 TSecr=23934809
235 0.466360212 172.31.31.144 -> 172.31.23.72 TCP 66 6633 → 51154 [ACK] Seq=1 Ack=124 Win=853 Len=0 TSval=5364683 TSecr=23934809
236 0.466371317 172.31.31.144 -> 172.31.23.72 TCP 66 6633 → 51154 [ACK] Seq=1 Ack=247 Win=853 Len=0 TSval=5364683 TSecr=23934809
237 0.466453659 172.31.31.144 -> 172.31.23.72 TCP 66 6633 → 51152 [ACK] Seq=727 Ack=493 Win=853 Len=0 TSval=5364683 TSecr=23934809
238 0.466701843 172.31.31.144 -> 172.31.23.72 TCP 66 6633 → 51142 [ACK] Seq=1211 Ack=1231 Win=853 Len=0 TSval=5364684 TSecr=23934809
239 0.466980590 172.31.23.72 -> 172.31.31.144 OpenFlow 189 Type: OFPT_PACKET_IN
240 0.467003142 172.31.23.72 -> 172.31.31.144 OpenFlow 189 Type: OFPT_PACKET_IN
241 0.467093285 172.31.23.72 -> 172.31.31.144 OpenFlow 189 Type: OFPT_PACKET_IN
242 0.467109909 172.31.23.72 -> 172.31.31.144 OpenFlow 189 Type: OFPT_PACKET_IN
243 0.467137553 172.31.23.72 -> 172.31.31.144 OpenFlow 189 Type: OFPT_PACKET_IN
244 0.467160267 172.31.23.72 -> 172.31.31.144 OpenFlow 189 Type: OFPT_PACKET_IN
245 0.467183656 172.31.31.144 -> 172.31.23.72 TCP 66 6633 → 51148 [ACK] Seq=969 Ack=739 Win=853 Len=0 TSval=5364684 TSecr=23934809
246 0.467190696 172.31.23.72 -> 172.31.31.144 OpenFlow 189 Type: OFPT_PACKET_IN
247 0.467219477 172.31.23.72 -> 172.31.31.144 OpenFlow 189 Type: OFPT_PACKET_IN
248 0.467239025 172.31.23.72 -> 172.31.31.144 OpenFlow 189 Type: OFPT_PACKET_IN
249 0.467283948 172.31.31.144 -> 172.31.23.72 TCP 66 6633 → 51156 [ACK] Seq=1 Ack=247 Win=853 Len=0 TSval=5364684 TSecr=23934809
250 0.467335405 172.31.31.144 -> 172.31.23.72 TCP 66 6633 → 51150 [ACK] Seq=969 Ack=739 Win=853 Len=0 TSval=5364684 TSecr=23934809
251 0.467359543 172.31.31.144 -> 172.31.23.72 TCP 66 6633 → 51144 [ACK] Seq=969 Ack=985 Win=853 Len=0 TSval=5364684 TSecr=23934809
252 0.467442444 172.31.31.144 -> 172.31.23.72 TCP 66 6633 → 51160 [ACK] Seq=1 Ack=247 Win=853 Len=0 TSval=5364684 TSecr=23934809
253 0.504422414 172.31.31.144 -> 172.31.23.72 OpenFlow 122 Type: OFPT_MULTIPART_REQUEST, OFPMP_FLOW
254 0.504430855 172.31.31.144 -> 172.31.23.72 OpenFlow 106 Type: OFPT_MULTIPART_REQUEST, OFPMP_PORT_STATS
255 0.504623276 172.31.23.72 -> 172.31.31.144 OpenFlow 970 Type: OFPT_MULTIPART_REPLY, OFPMP_FLOW
256 0.504798118 172.31.23.72 -> 172.31.31.144 OpenFlow 6178 Type: OFPT_MULTIPART_REPLY, OFPMP_TABLE
257 0.504871164 172.31.23.72 -> 172.31.31.144 OpenFlow 530 Type: OFPT_MULTIPART_REPLY, OFPMP_PORT_STATS
258 0.505033520 172.31.31.144 -> 172.31.23.72 TCP 66 6633 → 51134 [ACK] Seq=823 Ack=7973 Win=853 Len=0 TSval=5364693 TSecr=23934819
259 0.588702635 172.31.31.144 -> 172.31.23.72 OpenFlow 122 Type: OFPT_MULTIPART_REQUEST, OFPMP_FLOW
260 0.588747582 172.31.31.144 -> 172.31.23.72 OpenFlow 106 Type: OFPT_MULTIPART_REQUEST, OFPMP_PORT_STATS
261 0.589040272 172.31.23.72 -> 172.31.31.144 OpenFlow 3258 Type: OFPT_MULTIPART_REPLY, OFPMP_FLOW
262 0.589210533 172.31.23.72 -> 172.31.31.144 OpenFlow 6178 Type: OFPT_MULTIPART_REPLY, OFPMP_TABLE
263 0.589329100 172.31.23.72 -> 172.31.31.144 OpenFlow 754 Type: OFPT_MULTIPART_REPLY, OFPMP_PORT_STATS
264 0.589406289 172.31.31.144 -> 172.31.23.72 TCP 66 6633 → 51136 [ACK] Seq=1307 Ack=3931 Win=853 Len=0 TSval=5364714 TSecr=23934840
265 0.589438602 172.31.31.144 -> 172.31.23.72 TCP 66 6633 → 51136 [ACK] Seq=1307 Ack=10043 Win=853 Len=0 TSval=5364714 TSecr=23934840
266 0.589636980 172.31.31.144 -> 172.31.23.72 TCP 66 6633 → 51136 [ACK] Seq=1307 Ack=10731 Win=853 Len=0 TSval=5364714 TSecr=23934840
267 0.629897966 172.31.31.144 -> 172.31.23.72 OpenFlow 122 Type: OFPT_MULTIPART_REQUEST, OFPMP_FLOW
268 0.629914020 172.31.31.144 -> 172.31.23.72 OpenFlow 106 Type: OFPT_MULTIPART_REQUEST, OFPMP_TABLE
269 0.630120043 172.31.23.72 -> 172.31.31.144 OpenFlow 1802 Type: OFPT_MULTIPART_REPLY, OFPMP_FLOW
270 0.630216469 172.31.23.72 -> 172.31.31.144 OpenFlow 754 Type: OFPT_MULTIPART_REPLY, OFPMP_PORT_STATS
271 0.630345904 172.31.23.72 -> 172.31.31.144 OpenFlow 6178 Type: OFPT_MULTIPART_REPLY, OFPMP_TABLE
272 0.630410167 172.31.31.144 -> 172.31.23.72 TCP 66 6633 → 51138 [ACK] Seq=1307 Ack=3409 Win=853 Len=0 TSval=5364724 TSecr=23934850
273 0.643069187 172.31.31.144 -> 172.31.23.72 OpenFlow 82 Type: OFPT_MULTIPART_REQUEST, OFPMP_TABLE
274 0.643104784 172.31.31.144 -> 172.31.23.72 OpenFlow 146 Type: OFPT_MULTIPART_REQUEST, OFPMP_FLOW
275 0.643332678 172.31.23.72 -> 172.31.31.144 OpenFlow 6178 Type: OFPT_MULTIPART_REPLY, OFPMP_TABLE
276 0.643407548 172.31.23.72 -> 172.31.31.144 OpenFlow 530 Type: OFPT_MULTIPART_REPLY, OFPMP_PORT_STATS
277 0.643446824 172.31.23.72 -> 172.31.31.144 OpenFlow 554 Type: OFPT_MULTIPART_REPLY, OFPMP_FLOW
278 0.643689546 172.31.31.144 -> 172.31.23.72 TCP 66 6633 → 51140 [ACK] Seq=823 Ack=7803 Win=853 Len=0 TSval=5364728 TSecr=23934853
279 0.658839979 172.31.31.144 -> 172.31.23.72 OpenFlow 187 Type: OFPT_PACKET_OUT
280 0.658889827 172.31.31.144 -> 172.31.23.72 OpenFlow 187 Type: OFPT_PACKET_OUT
281 0.658911900 172.31.31.144 -> 172.31.23.72 OpenFlow 187 Type: OFPT_PACKET_OUT
282 0.658979286 172.31.31.144 -> 172.31.23.72 OpenFlow 187 Type: OFPT_PACKET_OUT
283 0.659050854 172.31.31.144 -> 172.31.23.72 OpenFlow 187 Type: OFPT_PACKET_OUT
284 0.659176136 172.31.31.144 -> 172.31.23.72 OpenFlow 187 Type: OFPT_PACKET_OUT
285 0.659260003 172.31.31.144 -> 172.31.23.72 OpenFlow 187 Type: OFPT_PACKET_OUT
286 0.659312679 172.31.31.144 -> 172.31.23.72 OpenFlow 187 Type: OFPT_PACKET_OUT
287 0.659336001 172.31.23.72 -> 172.31.31.144 TCP 66 51154 → 6633 [ACK] Seq=247 Ack=727 Win=213 Len=0 TSval=23934857 TSecr=5364732
288 0.659399800 172.31.31.144 -> 172.31.23.72 OpenFlow 187 Type: OFPT_PACKET_OUT
289 0.659462970 172.31.31.144 -> 172.31.23.72 OpenFlow 187 Type: OFPT_PACKET_OUT
290 0.659514231 172.31.23.72 -> 172.31.31.144 OpenFlow 189 Type: OFPT_PACKET_IN
291 0.659548350 172.31.31.144 -> 172.31.23.72 OpenFlow 187 Type: OFPT_PACKET_OUT
292 0.659558216 172.31.23.72 -> 172.31.31.144 OpenFlow 189 Type: OFPT_PACKET_IN
293 0.659571362 172.31.23.72 -> 172.31.31.144 OpenFlow 189 Type: OFPT_PACKET_IN
294 0.659593045 172.31.23.72 -> 172.31.31.144 OpenFlow 189 Type: OFPT_PACKET_IN
295 0.659598982 172.31.31.144 -> 172.31.23.72 OpenFlow 187 Type: OFPT_PACKET_OUT
296 0.659660124 172.31.23.72 -> 172.31.31.144 OpenFlow 189 Type: OFPT_PACKET_IN
297 0.659700424 172.31.31.144 -> 172.31.23.72 OpenFlow 187 Type: OFPT_PACKET_OUT
298 0.659705934 172.31.23.72 -> 172.31.31.144 OpenFlow 189 Type: OFPT_PACKET_IN
299 0.659723746 172.31.31.144 -> 172.31.23.72 TCP 66 6633 → 51164 [ACK] Seq=1 Ack=124 Win=853 Len=0 TSval=5364732 TSecr=23934857
300 0.659750921 172.31.31.144 -> 172.31.23.72 OpenFlow 187 Type: OFPT_PACKET_OUT
301 0.659776457 172.31.31.144 -> 172.31.23.72 TCP 66 6633 → 51164 [ACK] Seq=1 Ack=247 Win=853 Len=0 TSval=5364732 TSecr=23934857
302 0.659803629 172.31.31.144 -> 172.31.23.72 OpenFlow 187 Type: OFPT_PACKET_OUT
303 0.659844071 172.31.31.144 -> 172.31.23.72 TCP 66 6633 → 51146 [ACK] Seq=1211 Ack=985 Win=853 Len=0 TSval=5364732 TSecr=23934857
304 0.660103914 172.31.23.72 -> 172.31.31.144 TCP 66 51156 → 6633 [ACK] Seq=493 Ack=1090 Win=213 Len=0 TSval=23934858 TSecr=5364732
305 0.660114688 172.31.31.144 -> 172.31.23.72 OpenFlow 187 Type: OFPT_PACKET_OUT
306 0.660240069 172.31.23.72 -> 172.31.31.144 OpenFlow 189 Type: OFPT_PACKET_IN
307 0.660262850 172.31.23.72 -> 172.31.31.144 OpenFlow 189 Type: OFPT_PACKET_IN
308 0.660308785 172.31.23.72 -> 172.31.31.144 OpenFlow 189 Type: OFPT_PACKET_IN
309 0.660323755 172.31.23.72 -> 172.31.31.144 OpenFlow 189 Type: OFPT_PACKET_IN
310 0.660337039 172.31.23.72 -> 172.31.31.144 OpenFlow 189 Type: OFPT_PACKET_IN
311 0.660351671 172.31.23.72 -> 172.31.31.144 OpenFlow 189 Type: OFPT_PACKET_IN
312 0.660395676 172.31.23.72 -> 172.31.31.144 OpenFlow 189 Type: OFPT_PACKET_IN
313 0.660400711 172.31.23.72 -> 172.31.31.144 OpenFlow 189 Type: OFPT_PACKET_IN
314 0.660477336 172.31.31.144 -> 172.31.23.72 TCP 66 6633 → 51158 [ACK] Seq=1 Ack=370 Win=853 Len=0 TSval=5364732 TSecr=23934858
315 0.660482998 172.31.31.144 -> 172.31.23.72 TCP 66 6633 → 51158 [ACK] Seq=1 Ack=493 Win=853 Len=0 TSval=5364732 TSecr=23934858
316 0.660485033 172.31.31.144 -> 172.31.23.72 TCP 66 6633 → 51168 [ACK] Seq=1 Ack=124 Win=853 Len=0 TSval=5364732 TSecr=23934858
317 0.660504904 172.31.23.72 -> 172.31.31.144 OpenFlow 189 Type: OFPT_PACKET_IN
318 0.660659181 172.31.31.144 -> 172.31.23.72 TCP 66 6633 → 51168 [ACK] Seq=1 Ack=247 Win=853 Len=0 TSval=5364732 TSecr=23934858
319 0.660663975 172.31.31.144 -> 172.31.23.72 TCP 66 6633 → 51166 [ACK] Seq=1 Ack=124 Win=853 Len=0 TSval=5364732 TSecr=23934858
320 0.660666558 172.31.31.144 -> 172.31.23.72 TCP 66 6633 → 51166 [ACK] Seq=1 Ack=247 Win=853 Len=0 TSval=5364732 TSecr=23934858
321 0.660668297 172.31.31.144 -> 172.31.23.72 TCP 66 6633 → 51154 [ACK] Seq=727 Ack=493 Win=853 Len=0 TSval=5364732 TSecr=23934858
322 0.660678301 172.31.23.72 -> 172.31.31.144 OpenFlow 189 Type: OFPT_PACKET_IN
323 0.660886367 172.31.31.144 -> 172.31.23.72 TCP 66 6633 → 51148 [ACK] Seq=969 Ack=985 Win=853 Len=0 TSval=5364732 TSecr=23934858
324 0.670583794 172.31.31.144 -> 172.31.23.72 TCP 66 6633 → 51138 [ACK] Seq=1307 Ack=9521 Win=853 Len=0 TSval=5364735 TSecr=23934850
325 0.700011221 172.31.23.72 -> 172.31.31.144 TCP 66 51156 → 6633 [ACK] Seq=493 Ack=1211 Win=213 Len=0 TSval=23934868 TSecr=5364732
326 0.721514757 172.31.31.144 -> 172.31.23.72 OpenFlow 122 Type: OFPT_MULTIPART_REQUEST, OFPMP_FLOW
327 0.721530776 172.31.31.144 -> 172.31.23.72 OpenFlow 106 Type: OFPT_MULTIPART_REQUEST, OFPMP_PORT_STATS
328 0.721706724 172.31.23.72 -> 172.31.31.144 OpenFlow 2010 Type: OFPT_MULTIPART_REPLY, OFPMP_FLOW
329 0.721915866 172.31.23.72 -> 172.31.31.144 OpenFlow 6178 Type: OFPT_MULTIPART_REPLY, OFPMP_TABLE
330 0.722036495 172.31.23.72 -> 172.31.31.144 OpenFlow 754 Type: OFPT_MULTIPART_REPLY, OFPMP_PORT_STATS
331 0.722120294 172.31.31.144 -> 172.31.23.72 TCP 66 6633 → 51142 [ACK] Seq=1307 Ack=9287 Win=853 Len=0 TSval=5364747 TSecr=23934873
332 0.750738470 172.31.31.144 -> 172.31.23.72 OpenFlow 90 Type: OFPT_MULTIPART_REQUEST, OFPMP_PORT_STATS
333 0.750767942 172.31.31.144 -> 172.31.23.72 OpenFlow 138 Type: OFPT_MULTIPART_REQUEST, OFPMP_TABLE
334 0.751002592 172.31.23.72 -> 172.31.31.144 OpenFlow 642 Type: OFPT_MULTIPART_REPLY, OFPMP_PORT_STATS
335 0.751067711 172.31.23.72 -> 172.31.31.144 OpenFlow 1386 Type: OFPT_MULTIPART_REPLY, OFPMP_FLOW
336 0.751225668 172.31.23.72 -> 172.31.31.144 OpenFlow 6178 Type: OFPT_MULTIPART_REPLY, OFPMP_TABLE
337 0.751325108 172.31.31.144 -> 172.31.23.72 TCP 66 6633 → 51144 [ACK] Seq=1065 Ack=2881 Win=853 Len=0 TSval=5364755 TSecr=23934880
338 0.758583216 172.31.31.144 -> 172.31.23.72 TCP 66 6633 → 51142 [ACK] Seq=1307 Ack=9975 Win=853 Len=0 TSval=5364757 TSecr=23934873
339 0.788949298 172.31.31.144 -> 172.31.23.72 OpenFlow 122 Type: OFPT_MULTIPART_REQUEST, OFPMP_FLOW
340 0.788985840 172.31.31.144 -> 172.31.23.72 OpenFlow 106 Type: OFPT_MULTIPART_REQUEST, OFPMP_PORT_STATS
341 0.789250183 172.31.23.72 -> 172.31.31.144 OpenFlow 3258 Type: OFPT_MULTIPART_REPLY, OFPMP_FLOW
342 0.789410008 172.31.23.72 -> 172.31.31.144 OpenFlow 6178 Type: OFPT_MULTIPART_REPLY, OFPMP_TABLE
343 0.789517646 172.31.23.72 -> 172.31.31.144 OpenFlow 754 Type: OFPT_MULTIPART_REPLY, OFPMP_PORT_STATS
344 0.789611133 172.31.31.144 -> 172.31.23.72 TCP 66 6633 → 51146 [ACK] Seq=1307 Ack=10289 Win=853 Len=0 TSval=5364764 TSecr=23934890
345 0.790535735 172.31.31.144 -> 172.31.23.72 TCP 66 6633 → 51144 [ACK] Seq=1065 Ack=8993 Win=853 Len=0 TSval=5364765 TSecr=23934880
346 0.826627040 172.31.31.144 -> 172.31.23.72 TCP 66 6633 → 51146 [ACK] Seq=1307 Ack=10977 Win=853 Len=0 TSval=5364774 TSecr=23934890
347 0.836286553 172.31.31.144 -> 172.31.23.72 OpenFlow 122 Type: OFPT_MULTIPART_REQUEST, OFPMP_FLOW
348 0.836301231 172.31.31.144 -> 172.31.23.72 OpenFlow 106 Type: OFPT_MULTIPART_REQUEST, OFPMP_TABLE
349 0.836564252 172.31.23.72 -> 172.31.31.144 OpenFlow 1594 Type: OFPT_MULTIPART_REPLY, OFPMP_FLOW
350 0.836695618 172.31.23.72 -> 172.31.31.144 OpenFlow 642 Type: OFPT_MULTIPART_REPLY, OFPMP_PORT_STATS
351 0.836861839 172.31.23.72 -> 172.31.31.144 OpenFlow 6178 Type: OFPT_MULTIPART_REPLY, OFPMP_TABLE
352 0.836919676 172.31.31.144 -> 172.31.23.72 TCP 66 6633 → 51148 [ACK] Seq=1065 Ack=3089 Win=853 Len=0 TSval=5364776 TSecr=23934902
353 0.858613231 172.31.31.144 -> 172.31.23.72 OpenFlow 187 Type: OFPT_PACKET_OUT
354 0.858645424 172.31.31.144 -> 172.31.23.72 OpenFlow 187 Type: OFPT_PACKET_OUT
355 0.858725177 172.31.31.144 -> 172.31.23.72 OpenFlow 187 Type: OFPT_PACKET_OUT
356 0.858806728 172.31.31.144 -> 172.31.23.72 OpenFlow 187 Type: OFPT_PACKET_OUT
357 0.858874748 172.31.31.144 -> 172.31.23.72 OpenFlow 187 Type: OFPT_PACKET_OUT
358 0.858944531 172.31.31.144 -> 172.31.23.72 OpenFlow 187 Type: OFPT_PACKET_OUT
359 0.859014814 172.31.31.144 -> 172.31.23.72 OpenFlow 187 Type: OFPT_PACKET_OUT
360 0.859093847 172.31.31.144 -> 172.31.23.72 OpenFlow 187 Type: OFPT_PACKET_OUT
361 0.859168869 172.31.31.144 -> 172.31.23.72 OpenFlow 187 Type: OFPT_PACKET_OUT
362 0.859226781 172.31.31.144 -> 172.31.23.72 OpenFlow 187 Type: OFPT_PACKET_OUT
363 0.859305040 172.31.23.72 -> 172.31.31.144 TCP 66 51158 → 6633 [ACK] Seq=493 Ack=1211 Win=213 Len=0 TSval=23934907 TSecr=5364782
364 0.859322078 172.31.31.144 -> 172.31.23.72 OpenFlow 187 Type: OFPT_PACKET_OUT
365 0.859395964 172.31.31.144 -> 172.31.23.72 OpenFlow 187 Type: OFPT_PACKET_OUT
366 0.859414551 172.31.23.72 -> 172.31.31.144 OpenFlow 189 Type: OFPT_PACKET_IN
367 0.859443504 172.31.23.72 -> 172.31.31.144 OpenFlow 189 Type: OFPT_PACKET_IN
368 0.859463993 172.31.23.72 -> 172.31.31.144 OpenFlow 189 Type: OFPT_PACKET_IN
369 0.859470398 172.31.23.72 -> 172.31.31.144 OpenFlow 189 Type: OFPT_PACKET_IN
370 0.859472862 172.31.23.72 -> 172.31.31.144 OpenFlow 189 Type: OFPT_PACKET_IN
371 0.859497647 172.31.31.144 -> 172.31.23.72 OpenFlow 187 Type: OFPT_PACKET_OUT
372 0.859503465 172.31.23.72 -> 172.31.31.144 OpenFlow 189 Type: OFPT_PACKET_IN
373 0.859565301 172.31.31.144 -> 172.31.23.72 OpenFlow 187 Type: OFPT_PACKET_OUT
374 0.859604431 172.31.31.144 -> 172.31.23.72 OpenFlow 187 Type: OFPT_PACKET_OUT
375 0.859621949 172.31.31.144 -> 172.31.23.72 TCP 66 6633 → 51170 [ACK] Seq=1 Ack=124 Win=853 Len=0 TSval=5364782 TSecr=23934907
376 0.859641734 172.31.31.144 -> 172.31.23.72 TCP 66 6633 → 51168 [ACK] Seq=1 Ack=370 Win=853 Len=0 TSval=5364782 TSecr=23934907
377 0.859665314 172.31.31.144 -> 172.31.23.72 TCP 66 6633 → 51170 [ACK] Seq=1 Ack=247 Win=853 Len=0 TSval=5364782 TSecr=23934907
378 0.859680534 172.31.31.144 -> 172.31.23.72 TCP 66 6633 → 51168 [ACK] Seq=1 Ack=493 Win=853 Len=0 TSval=5364782 TSecr=23934907
379 0.859750333 172.31.31.144 -> 172.31.23.72 OpenFlow 187 Type: OFPT_PACKET_OUT
380 0.859813258 172.31.23.72 -> 172.31.31.144 TCP 66 51160 → 6633 [ACK] Seq=493 Ack=727 Win=213 Len=0 TSval=23934907 TSecr=5364782
381 0.859857861 172.31.31.144 -> 172.31.23.72 OpenFlow 187 Type: OFPT_PACKET_OUT
382 0.859873995 172.31.31.144 -> 172.31.23.72 OpenFlow 187 Type: OFPT_PACKET_OUT
383 0.860011718 172.31.23.72 -> 172.31.31.144 OpenFlow 189 Type: OFPT_PACKET_IN
384 0.860034373 172.31.23.72 -> 172.31.31.144 OpenFlow 189 Type: OFPT_PACKET_IN
385 0.860067158 172.31.23.72 -> 172.31.31.144 OpenFlow 189 Type: OFPT_PACKET_IN
386 0.860082685 172.31.23.72 -> 172.31.31.144 OpenFlow 189 Type: OFPT_PACKET_IN
387 0.860123676 172.31.23.72 -> 172.31.31.144 OpenFlow 189 Type: OFPT_PACKET_IN
388 0.860130289 172.31.23.72 -> 172.31.31.144 OpenFlow 189 Type: OFPT_PACKET_IN
389 0.860137025 172.31.31.144 -> 172.31.23.72 OpenFlow 187 Type: OFPT_PACKET_OUT
390 0.860221299 172.31.31.144 -> 172.31.23.72 TCP 66 6633 → 51152 [ACK] Seq=727 Ack=739 Win=853 Len=0 TSval=5364782 TSecr=23934908
391 0.860248893 172.31.23.72 -> 172.31.31.144 TCP 66 51162 → 6633 [ACK] Seq=247 Ack=364 Win=213 Len=0 TSval=23934908 TSecr=5364782
392 0.860301656 172.31.23.72 -> 172.31.31.144 OpenFlow 189 Type: OFPT_PACKET_IN
393 0.860325469 172.31.31.144 -> 172.31.23.72 TCP 66 6633 → 51156 [ACK] Seq=1211 Ack=739 Win=853 Len=0 TSval=5364782 TSecr=23934908
