  1 0.000000000 137.158.125.247 -> 172.31.23.72 TCP 54 52508 → 22 [ACK] Seq=1 Ack=1 Win=32582 Len=0
  2 0.000021941 137.158.125.247 -> 172.31.23.72 TCP 54 52508 → 22 [ACK] Seq=1 Ack=297 Win=32434 Len=0
  3 0.108398396 137.158.125.247 -> 172.31.23.72 TCP 54 52508 → 22 [ACK] Seq=1 Ack=357 Win=32404 Len=0
  4 0.369040048 172.31.31.144 -> 172.31.23.72 TCP 90 6633 → 40146 [PSH, ACK] Seq=1 Ack=1 Win=853 Len=24 TSval=681675 TSecr=774098
  5 0.369075917 172.31.31.144 -> 172.31.23.72 TCP 90 6633 → 40144 [PSH, ACK] Seq=1 Ack=1 Win=853 Len=24 TSval=681675 TSecr=774039
  6 0.369083027 172.31.31.144 -> 172.31.23.72 TCP 90 6633 → 40150 [PSH, ACK] Seq=1 Ack=1 Win=853 Len=24 TSval=681675 TSecr=774040
  7 0.369087556 172.31.31.144 -> 172.31.23.72 TCP 106 6633 → 40146 [PSH, ACK] Seq=25 Ack=1 Win=853 Len=40 TSval=681675 TSecr=774098
  8 0.369098702 172.31.31.144 -> 172.31.23.72 TCP 106 6633 → 40150 [PSH, ACK] Seq=25 Ack=1 Win=853 Len=40 TSval=681675 TSecr=774040
  9 0.369117494 172.31.31.144 -> 172.31.23.72 TCP 106 6633 → 40144 [PSH, ACK] Seq=25 Ack=1 Win=853 Len=40 TSval=681675 TSecr=774039
 10 0.369287773 172.31.23.72 -> 172.31.31.144 OpenFlow 82 Type: OFPT_MULTIPART_REPLY, OFPMP_GROUP
 11 0.369329385 172.31.23.72 -> 172.31.31.144 OpenFlow 98 Type: OFPT_MULTIPART_REPLY, OFPMP_METER
 12 0.369343603 172.31.23.72 -> 172.31.31.144 OpenFlow 82 Type: OFPT_MULTIPART_REPLY, OFPMP_GROUP
 13 0.369366781 172.31.23.72 -> 172.31.31.144 OpenFlow 82 Type: OFPT_MULTIPART_REPLY, OFPMP_GROUP
 14 0.369437418 172.31.23.72 -> 172.31.31.144 OpenFlow 98 Type: OFPT_MULTIPART_REPLY, OFPMP_METER
 15 0.369442079 172.31.23.72 -> 172.31.31.144 OpenFlow 98 Type: OFPT_MULTIPART_REPLY, OFPMP_METER
 16 0.369544321 172.31.31.144 -> 172.31.23.72 TCP 66 6633 → 40144 [ACK] Seq=65 Ack=17 Win=853 Len=0 TSval=681675 TSecr=774513
 17 0.369563341 172.31.31.144 -> 172.31.23.72 TCP 66 6633 → 40144 [ACK] Seq=65 Ack=49 Win=853 Len=0 TSval=681675 TSecr=774513
 18 0.369658482 172.31.31.144 -> 172.31.23.72 TCP 66 6633 → 40150 [ACK] Seq=65 Ack=17 Win=853 Len=0 TSval=681675 TSecr=774513
 19 0.369663167 172.31.31.144 -> 172.31.23.72 TCP 66 6633 → 40150 [ACK] Seq=65 Ack=49 Win=853 Len=0 TSval=681675 TSecr=774513
 20 0.369675691 172.31.31.144 -> 172.31.23.72 TCP 66 6633 → 40146 [ACK] Seq=65 Ack=49 Win=853 Len=0 TSval=681675 TSecr=774513
 21 0.404249586 172.31.23.72 -> 137.158.125.247 SSH 90 Server: Encrypted packet (len=36)
 22 0.469239878 172.31.31.144 -> 172.31.23.72 TCP 90 6633 → 40154 [PSH, ACK] Seq=1 Ack=1 Win=853 Len=24 TSval=681700 TSecr=774040
 23 0.469265866 172.31.31.144 -> 172.31.23.72 TCP 90 6633 → 40152 [PSH, ACK] Seq=1 Ack=1 Win=853 Len=24 TSval=681700 TSecr=774039
 24 0.469279880 172.31.31.144 -> 172.31.23.72 TCP 90 6633 → 40148 [PSH, ACK] Seq=1 Ack=1 Win=853 Len=24 TSval=681700 TSecr=774041
 25 0.469283022 172.31.31.144 -> 172.31.23.72 TCP 90 6633 → 40142 [PSH, ACK] Seq=1 Ack=1 Win=853 Len=24 TSval=681700 TSecr=774017
 26 0.469298644 172.31.31.144 -> 172.31.23.72 TCP 90 6633 → 40156 [PSH, ACK] Seq=1 Ack=1 Win=853 Len=24 TSval=681700 TSecr=774040
 27 0.469314677 172.31.31.144 -> 172.31.23.72 TCP 106 6633 → 40148 [PSH, ACK] Seq=25 Ack=1 Win=853 Len=40 TSval=681700 TSecr=774041
 28 0.469333445 172.31.31.144 -> 172.31.23.72 TCP 90 6633 → 40140 [PSH, ACK] Seq=1 Ack=1 Win=853 Len=24 TSval=681700 TSecr=774040
 29 0.469353018 172.31.31.144 -> 172.31.23.72 TCP 106 6633 → 40152 [PSH, ACK] Seq=25 Ack=1 Win=853 Len=40 TSval=681700 TSecr=774039
 30 0.469380916 172.31.31.144 -> 172.31.23.72 TCP 106 6633 → 40154 [PSH, ACK] Seq=25 Ack=1 Win=853 Len=40 TSval=681700 TSecr=774040
 31 0.469397622 172.31.31.144 -> 172.31.23.72 TCP 106 6633 → 40156 [PSH, ACK] Seq=25 Ack=1 Win=853 Len=40 TSval=681700 TSecr=774040
 32 0.469404033 172.31.23.72 -> 172.31.31.144 OpenFlow 82 Type: OFPT_MULTIPART_REPLY, OFPMP_GROUP
 33 0.469416761 172.31.31.144 -> 172.31.23.72 OpenFlow 106 Type: OFPT_MULTIPART_REQUEST, OFPMP_METER
 34 0.469452510 172.31.23.72 -> 172.31.31.144 OpenFlow 82 Type: OFPT_MULTIPART_REPLY, OFPMP_GROUP
 35 0.469481078 172.31.23.72 -> 172.31.31.144 OpenFlow 82 Type: OFPT_MULTIPART_REPLY, OFPMP_GROUP
 36 0.469488247 172.31.31.144 -> 172.31.23.72 OpenFlow 106 Type: OFPT_MULTIPART_REQUEST, OFPMP_METER
 37 0.469490707 172.31.31.144 -> 172.31.23.72 OpenFlow 187 Type: OFPT_PACKET_OUT
 38 0.469509993 172.31.31.144 -> 172.31.23.72 OpenFlow 187 Type: OFPT_PACKET_OUT
 39 0.469514786 172.31.23.72 -> 172.31.31.144 OpenFlow 98 Type: OFPT_MULTIPART_REPLY, OFPMP_METER
 40 0.469538213 172.31.23.72 -> 172.31.31.144 OpenFlow 82 Type: OFPT_MULTIPART_REPLY, OFPMP_GROUP
 41 0.469557352 172.31.31.144 -> 172.31.23.72 OpenFlow 187 Type: OFPT_PACKET_OUT
 42 0.469562153 172.31.23.72 -> 172.31.31.144 OpenFlow 98 Type: OFPT_MULTIPART_REPLY, OFPMP_METER
 43 0.469575105 172.31.23.72 -> 172.31.31.144 OpenFlow 82 Type: OFPT_MULTIPART_REPLY, OFPMP_GROUP
 44 0.469580015 172.31.31.144 -> 172.31.23.72 TCP 66 6633 → 40140 [ACK] Seq=65 Ack=17 Win=853 Len=0 TSval=681700 TSecr=774538
 45 0.469604768 172.31.23.72 -> 172.31.31.144 OpenFlow 98 Type: OFPT_MULTIPART_REPLY, OFPMP_METER
 46 0.469609954 172.31.23.72 -> 172.31.31.144 OpenFlow 82 Type: OFPT_MULTIPART_REPLY, OFPMP_GROUP
 47 0.469625912 172.31.31.144 -> 172.31.23.72 OpenFlow 187 Type: OFPT_PACKET_OUT
 48 0.469671163 172.31.23.72 -> 172.31.31.144 OpenFlow 98 Type: OFPT_MULTIPART_REPLY, OFPMP_METER
 49 0.469687855 172.31.31.144 -> 172.31.23.72 TCP 66 6633 → 40148 [ACK] Seq=65 Ack=17 Win=853 Len=0 TSval=681700 TSecr=774538
 50 0.469692121 172.31.31.144 -> 172.31.23.72 TCP 66 6633 → 40148 [ACK] Seq=65 Ack=49 Win=853 Len=0 TSval=681700 TSecr=774538
 51 0.469708591 172.31.31.144 -> 172.31.23.72 TCP 66 6633 → 40152 [ACK] Seq=65 Ack=17 Win=853 Len=0 TSval=681700 TSecr=774538
 52 0.469721196 172.31.31.144 -> 172.31.23.72 OpenFlow 187 Type: OFPT_PACKET_OUT
 53 0.469748414 172.31.31.144 -> 172.31.23.72 TCP 66 6633 → 40152 [ACK] Seq=65 Ack=49 Win=853 Len=0 TSval=681700 TSecr=774538
 54 0.469767531 172.31.31.144 -> 172.31.23.72 TCP 66 6633 → 40154 [ACK] Seq=65 Ack=17 Win=853 Len=0 TSval=681700 TSecr=774538
 55 0.469786513 172.31.31.144 -> 172.31.23.72 OpenFlow 187 Type: OFPT_PACKET_OUT
 56 0.469838797 172.31.31.144 -> 172.31.23.72 TCP 66 6633 → 40154 [ACK] Seq=65 Ack=49 Win=853 Len=0 TSval=681700 TSecr=774538
 57 0.469842805 172.31.31.144 -> 172.31.23.72 TCP 66 6633 → 40156 [ACK] Seq=65 Ack=17 Win=853 Len=0 TSval=681700 TSecr=774538
 58 0.469844630 172.31.31.144 -> 172.31.23.72 TCP 66 6633 → 40156 [ACK] Seq=65 Ack=49 Win=853 Len=0 TSval=681700 TSecr=774539
 59 0.469868195 172.31.31.144 -> 172.31.23.72 OpenFlow 187 Type: OFPT_PACKET_OUT
 60 0.469885964 172.31.31.144 -> 172.31.23.72 OpenFlow 187 Type: OFPT_PACKET_OUT
 61 0.469891140 172.31.23.72 -> 172.31.31.144 OpenFlow 82 Type: OFPT_MULTIPART_REPLY, OFPMP_GROUP_DESC
 62 0.469912485 172.31.23.72 -> 172.31.31.144 OpenFlow 82 Type: OFPT_MULTIPART_REPLY, OFPMP_METER
 63 0.469924029 172.31.23.72 -> 172.31.31.144 OpenFlow 82 Type: OFPT_MULTIPART_REPLY, OFPMP_GROUP_DESC
 64 0.469962714 172.31.23.72 -> 172.31.31.144 OpenFlow 82 Type: OFPT_MULTIPART_REPLY, OFPMP_METER
 65 0.470043984 172.31.31.144 -> 172.31.23.72 TCP 66 6633 → 40140 [ACK] Seq=65 Ack=33 Win=853 Len=0 TSval=681700 TSecr=774539
 66 0.470059374 172.31.31.144 -> 172.31.23.72 TCP 66 6633 → 40140 [ACK] Seq=65 Ack=49 Win=853 Len=0 TSval=681700 TSecr=774539
 67 0.470086950 172.31.31.144 -> 172.31.23.72 TCP 66 6633 → 40142 [ACK] Seq=65 Ack=49 Win=853 Len=0 TSval=681700 TSecr=774538
 68 0.470286606 172.31.23.72 -> 172.31.31.144 TCP 66 40146 → 6633 [ACK] Seq=49 Ack=1033 Win=384 Len=0 TSval=774539 TSecr=681700
 69 0.470368539 172.31.23.72 -> 172.31.31.144 OpenFlow 189 Type: OFPT_PACKET_IN
 70 0.470392297 172.31.23.72 -> 172.31.31.144 OpenFlow 189 Type: OFPT_PACKET_IN
 71 0.470428776 172.31.23.72 -> 172.31.31.144 OpenFlow 189 Type: OFPT_PACKET_IN
 72 0.470458054 172.31.23.72 -> 172.31.31.144 OpenFlow 189 Type: OFPT_PACKET_IN
 73 0.470514408 172.31.23.72 -> 172.31.31.144 OpenFlow 189 Type: OFPT_PACKET_IN
 74 0.470533481 172.31.23.72 -> 172.31.31.144 OpenFlow 189 Type: OFPT_PACKET_IN
 75 0.470589599 172.31.31.144 -> 172.31.23.72 TCP 66 6633 → 40150 [ACK] Seq=65 Ack=172 Win=853 Len=0 TSval=681700 TSecr=774539
 76 0.470594838 172.31.31.144 -> 172.31.23.72 TCP 66 6633 → 40150 [ACK] Seq=65 Ack=295 Win=853 Len=0 TSval=681700 TSecr=774539
 77 0.470652245 172.31.31.144 -> 172.31.23.72 TCP 66 6633 → 40194 [ACK] Seq=1 Ack=247 Win=853 Len=0 TSval=681700 TSecr=774539
 78 0.470668939 172.31.31.144 -> 172.31.23.72 TCP 66 6633 → 40214 [ACK] Seq=1 Ack=124 Win=853 Len=0 TSval=681700 TSecr=774539
 79 0.470727680 172.31.31.144 -> 172.31.23.72 TCP 66 6633 → 40214 [ACK] Seq=1 Ack=247 Win=853 Len=0 TSval=681700 TSecr=774539
 80 0.569300618 172.31.31.144 -> 172.31.23.72 OpenFlow 187 Type: OFPT_PACKET_OUT
 81 0.569352468 172.31.31.144 -> 172.31.23.72 OpenFlow 187 Type: OFPT_PACKET_OUT
 82 0.569374612 172.31.31.144 -> 172.31.23.72 OpenFlow 187 Type: OFPT_PACKET_OUT
 83 0.569425621 172.31.31.144 -> 172.31.23.72 OpenFlow 187 Type: OFPT_PACKET_OUT
 84 0.569478125 172.31.31.144 -> 172.31.23.72 OpenFlow 187 Type: OFPT_PACKET_OUT
 85 0.569567354 172.31.31.144 -> 172.31.23.72 OpenFlow 187 Type: OFPT_PACKET_OUT
 86 0.569613614 172.31.31.144 -> 172.31.23.72 OpenFlow 187 Type: OFPT_PACKET_OUT
 87 0.569685513 172.31.31.144 -> 172.31.23.72 OpenFlow 187 Type: OFPT_PACKET_OUT
 88 0.569745689 172.31.31.144 -> 172.31.23.72 OpenFlow 187 Type: OFPT_PACKET_OUT
 89 0.569802456 172.31.31.144 -> 172.31.23.72 OpenFlow 187 Type: OFPT_PACKET_OUT
 90 0.569898793 172.31.31.144 -> 172.31.23.72 OpenFlow 187 Type: OFPT_PACKET_OUT
 91 0.569926427 172.31.31.144 -> 172.31.23.72 OpenFlow 187 Type: OFPT_PACKET_OUT
 92 0.570011140 172.31.31.144 -> 172.31.23.72 OpenFlow 187 Type: OFPT_PACKET_OUT
 93 0.570044622 172.31.31.144 -> 172.31.23.72 OpenFlow 187 Type: OFPT_PACKET_OUT
 94 0.570100862 172.31.31.144 -> 172.31.23.72 OpenFlow 187 Type: OFPT_PACKET_OUT
 95 0.570144099 172.31.23.72 -> 172.31.31.144 TCP 66 40144 → 6633 [ACK] Seq=49 Ack=791 Win=379 Len=0 TSval=774564 TSecr=681725
 96 0.570160566 172.31.31.144 -> 172.31.23.72 OpenFlow 187 Type: OFPT_PACKET_OUT
 97 0.570304836 172.31.31.144 -> 172.31.23.72 OpenFlow 187 Type: OFPT_PACKET_OUT
 98 0.570322731 172.31.31.144 -> 172.31.23.72 OpenFlow 187 Type: OFPT_PACKET_OUT
 99 0.570341189 172.31.31.144 -> 172.31.23.72 OpenFlow 187 Type: OFPT_PACKET_OUT
100 0.570408172 172.31.31.144 -> 172.31.23.72 OpenFlow 187 Type: OFPT_PACKET_OUT
101 0.570464908 172.31.31.144 -> 172.31.23.72 OpenFlow 187 Type: OFPT_PACKET_OUT
102 0.570532034 172.31.31.144 -> 172.31.23.72 OpenFlow 187 Type: OFPT_PACKET_OUT
103 0.570584117 172.31.31.144 -> 172.31.23.72 OpenFlow 187 Type: OFPT_PACKET_OUT
104 0.570652096 172.31.31.144 -> 172.31.23.72 OpenFlow 187 Type: OFPT_PACKET_OUT
105 0.570703878 172.31.31.144 -> 172.31.23.72 OpenFlow 187 Type: OFPT_PACKET_OUT
106 0.570755267 172.31.31.144 -> 172.31.23.72 OpenFlow 187 Type: OFPT_PACKET_OUT
107 0.570832487 172.31.31.144 -> 172.31.23.72 OpenFlow 187 Type: OFPT_PACKET_OUT
108 0.570858114 172.31.23.72 -> 172.31.31.144 TCP 66 40152 → 6633 [ACK] Seq=49 Ack=1275 Win=385 Len=0 TSval=774564 TSecr=681725
109 0.570922285 172.31.31.144 -> 172.31.23.72 OpenFlow 187 Type: OFPT_PACKET_OUT
110 0.570978225 172.31.31.144 -> 172.31.23.72 OpenFlow 187 Type: OFPT_PACKET_OUT
111 0.571040713 172.31.31.144 -> 172.31.23.72 OpenFlow 187 Type: OFPT_PACKET_OUT
112 0.571086196 172.31.31.144 -> 172.31.23.72 OpenFlow 187 Type: OFPT_PACKET_OUT
113 0.571141847 172.31.31.144 -> 172.31.23.72 OpenFlow 187 Type: OFPT_PACKET_OUT
114 0.571207646 172.31.31.144 -> 172.31.23.72 OpenFlow 187 Type: OFPT_PACKET_OUT
115 0.571275162 172.31.31.144 -> 172.31.23.72 OpenFlow 187 Type: OFPT_PACKET_OUT
116 0.571293678 172.31.23.72 -> 172.31.31.144 TCP 66 40154 → 6633 [ACK] Seq=49 Ack=1033 Win=384 Len=0 TSval=774564 TSecr=681725
117 0.571353391 172.31.31.144 -> 172.31.23.72 OpenFlow 187 Type: OFPT_PACKET_OUT
118 0.571388932 172.31.31.144 -> 172.31.23.72 OpenFlow 187 Type: OFPT_PACKET_OUT
119 0.571469027 172.31.31.144 -> 172.31.23.72 OpenFlow 187 Type: OFPT_PACKET_OUT
120 0.571521181 172.31.31.144 -> 172.31.23.72 OpenFlow 187 Type: OFPT_PACKET_OUT
121 0.571560672 172.31.23.72 -> 172.31.31.144 TCP 66 40154 → 6633 [ACK] Seq=49 Ack=1275 Win=385 Len=0 TSval=774564 TSecr=681725
122 0.571582298 172.31.31.144 -> 172.31.23.72 OpenFlow 187 Type: OFPT_PACKET_OUT
123 0.571644071 172.31.31.144 -> 172.31.23.72 OpenFlow 187 Type: OFPT_PACKET_OUT
124 0.571664511 172.31.23.72 -> 172.31.31.144 OpenFlow 189 Type: OFPT_PACKET_IN
125 0.571688660 172.31.23.72 -> 172.31.31.144 OpenFlow 189 Type: OFPT_PACKET_IN
126 0.571702707 172.31.23.72 -> 172.31.31.144 OpenFlow 189 Type: OFPT_PACKET_IN
127 0.571726881 172.31.23.72 -> 172.31.31.144 OpenFlow 189 Type: OFPT_PACKET_IN
128 0.571735977 172.31.31.144 -> 172.31.23.72 OpenFlow 187 Type: OFPT_PACKET_OUT
129 0.571749692 172.31.23.72 -> 172.31.31.144 OpenFlow 189 Type: OFPT_PACKET_IN
130 0.571756082 172.31.23.72 -> 172.31.31.144 OpenFlow 189 Type: OFPT_PACKET_IN
131 0.571782190 172.31.23.72 -> 172.31.31.144 OpenFlow 189 Type: OFPT_PACKET_IN
132 0.571784747 172.31.23.72 -> 172.31.31.144 OpenFlow 189 Type: OFPT_PACKET_IN
133 0.571812392 172.31.23.72 -> 172.31.31.144 OpenFlow 189 Type: OFPT_PACKET_IN
134 0.571814799 172.31.23.72 -> 172.31.31.144 OpenFlow 189 Type: OFPT_PACKET_IN
135 0.571831990 172.31.23.72 -> 172.31.31.144 OpenFlow 189 Type: OFPT_PACKET_IN
136 0.571845251 172.31.23.72 -> 172.31.31.144 OpenFlow 189 Type: OFPT_PACKET_IN
137 0.571893085 172.31.31.144 -> 172.31.23.72 OpenFlow 187 Type: OFPT_PACKET_OUT
138 0.571897103 172.31.31.144 -> 172.31.23.72 OpenFlow 187 Type: OFPT_PACKET_OUT
139 0.571898677 172.31.31.144 -> 172.31.23.72 TCP 66 6633 → 40156 [ACK] Seq=65 Ack=172 Win=853 Len=0 TSval=681725 TSecr=774564
140 0.571905891 172.31.23.72 -> 172.31.31.144 OpenFlow 189 Type: OFPT_PACKET_IN
141 0.571912066 172.31.23.72 -> 172.31.31.144 OpenFlow 189 Type: OFPT_PACKET_IN
142 0.572000830 172.31.23.72 -> 172.31.31.144 OpenFlow 189 Type: OFPT_PACKET_IN
143 0.572004603 172.31.23.72 -> 172.31.31.144 OpenFlow 189 Type: OFPT_PACKET_IN
144 0.572030239 172.31.23.72 -> 172.31.31.144 OpenFlow 189 Type: OFPT_PACKET_IN
145 0.572032651 172.31.23.72 -> 172.31.31.144 OpenFlow 189 Type: OFPT_PACKET_IN
146 0.572217643 172.31.31.144 -> 172.31.23.72 TCP 66 6633 → 40188 [ACK] Seq=1 Ack=124 Win=853 Len=0 TSval=681725 TSecr=774564
147 0.572224317 172.31.31.144 -> 172.31.23.72 TCP 66 6633 → 40190 [ACK] Seq=1 Ack=124 Win=853 Len=0 TSval=681725 TSecr=774564
148 0.572226431 172.31.31.144 -> 172.31.23.72 OpenFlow 187 Type: OFPT_PACKET_OUT
149 0.572228525 172.31.31.144 -> 172.31.23.72 OpenFlow 187 Type: OFPT_PACKET_OUT
150 0.572230716 172.31.31.144 -> 172.31.23.72 OpenFlow 187 Type: OFPT_PACKET_OUT
151 0.572232216 172.31.31.144 -> 172.31.23.72 TCP 66 6633 → 40196 [ACK] Seq=1 Ack=124 Win=853 Len=0 TSval=681725 TSecr=774564
152 0.572234405 172.31.31.144 -> 172.31.23.72 TCP 66 6633 → 40198 [ACK] Seq=1 Ack=124 Win=853 Len=0 TSval=681725 TSecr=774564
153 0.572236386 172.31.31.144 -> 172.31.23.72 TCP 66 6633 → 40156 [ACK] Seq=65 Ack=295 Win=853 Len=0 TSval=681725 TSecr=774564
154 0.572238892 172.31.31.144 -> 172.31.23.72 OpenFlow 187 Type: OFPT_PACKET_OUT
155 0.572242892 172.31.23.72 -> 172.31.31.144 OpenFlow 435 Type: OFPT_PACKET_IN
156 0.572249334 172.31.31.144 -> 172.31.23.72 TCP 66 6633 → 40188 [ACK] Seq=1 Ack=247 Win=853 Len=0 TSval=681725 TSecr=774564
157 0.572251301 172.31.31.144 -> 172.31.23.72 TCP 66 6633 → 40208 [ACK] Seq=1 Ack=124 Win=853 Len=0 TSval=681725 TSecr=774564
158 0.572253604 172.31.31.144 -> 172.31.23.72 TCP 66 6633 → 40190 [ACK] Seq=1 Ack=247 Win=853 Len=0 TSval=681725 TSecr=774564
159 0.572261324 172.31.23.72 -> 172.31.31.144 OpenFlow 189 Type: OFPT_PACKET_IN
160 0.572263782 172.31.23.72 -> 172.31.31.144 OpenFlow 435 Type: OFPT_PACKET_IN
161 0.572386540 172.31.23.72 -> 172.31.31.144 OpenFlow 189 Type: OFPT_PACKET_IN
162 0.572422156 172.31.31.144 -> 172.31.23.72 OpenFlow 187 Type: OFPT_PACKET_OUT
163 0.572426530 172.31.31.144 -> 172.31.23.72 TCP 66 6633 → 40212 [ACK] Seq=1 Ack=124 Win=853 Len=0 TSval=681725 TSecr=774564
164 0.572429680 172.31.31.144 -> 172.31.23.72 TCP 66 6633 → 40196 [ACK] Seq=1 Ack=247 Win=853 Len=0 TSval=681725 TSecr=774564
165 0.572431600 172.31.31.144 -> 172.31.23.72 TCP 66 6633 → 40198 [ACK] Seq=1 Ack=247 Win=853 Len=0 TSval=681725 TSecr=774564
166 0.572433817 172.31.31.144 -> 172.31.23.72 OpenFlow 187 Type: OFPT_PACKET_OUT
167 0.572614015 172.31.31.144 -> 172.31.23.72 TCP 66 6633 → 40208 [ACK] Seq=1 Ack=247 Win=853 Len=0 TSval=681726 TSecr=774564
168 0.572619683 172.31.31.144 -> 172.31.23.72 TCP 66 6633 → 40148 [ACK] Seq=1275 Ack=172 Win=853 Len=0 TSval=681726 TSecr=774564
169 0.572621811 172.31.31.144 -> 172.31.23.72 TCP 66 6633 → 40204 [ACK] Seq=1 Ack=247 Win=853 Len=0 TSval=681726 TSecr=774564
170 0.572626798 172.31.23.72 -> 172.31.31.144 TCP 66 40150 → 6633 [ACK] Seq=295 Ack=1275 Win=384 Len=0 TSval=774564 TSecr=681725
171 0.572689045 172.31.31.144 -> 172.31.23.72 TCP 66 6633 → 40210 [ACK] Seq=1 Ack=247 Win=853 Len=0 TSval=681726 TSecr=774564
172 0.572694668 172.31.31.144 -> 172.31.23.72 TCP 66 6633 → 40212 [ACK] Seq=1 Ack=493 Win=853 Len=0 TSval=681726 TSecr=774564
173 0.572866575 172.31.31.144 -> 172.31.23.72 TCP 66 6633 → 40142 [ACK] Seq=428 Ack=541 Win=853 Len=0 TSval=681726 TSecr=774564
174 0.573016313 172.31.23.72 -> 172.31.31.144 OpenFlow 189 Type: OFPT_PACKET_IN
175 0.573042017 172.31.23.72 -> 172.31.31.144 OpenFlow 189 Type: OFPT_PACKET_IN
176 0.573057085 172.31.23.72 -> 172.31.31.144 OpenFlow 189 Type: OFPT_PACKET_IN
177 0.573073532 172.31.23.72 -> 172.31.31.144 OpenFlow 189 Type: OFPT_PACKET_IN
178 0.573117071 172.31.23.72 -> 172.31.31.144 OpenFlow 189 Type: OFPT_PACKET_IN
179 0.573119347 172.31.23.72 -> 172.31.31.144 OpenFlow 189 Type: OFPT_PACKET_IN
180 0.573143305 172.31.23.72 -> 172.31.31.144 OpenFlow 189 Type: OFPT_PACKET_IN
181 0.573148376 172.31.23.72 -> 172.31.31.144 OpenFlow 435 Type: OFPT_PACKET_IN
182 0.573161803 172.31.23.72 -> 172.31.31.144 OpenFlow 189 Type: OFPT_PACKET_IN
183 0.573164118 172.31.23.72 -> 172.31.31.144 OpenFlow 189 Type: OFPT_PACKET_IN
184 0.573264148 172.31.31.144 -> 172.31.23.72 TCP 66 6633 → 40148 [ACK] Seq=1275 Ack=295 Win=853 Len=0 TSval=681726 TSecr=774564
185 0.573270554 172.31.31.144 -> 172.31.23.72 TCP 66 6633 → 40152 [ACK] Seq=1275 Ack=295 Win=853 Len=0 TSval=681726 TSecr=774564
186 0.573272928 172.31.31.144 -> 172.31.23.72 TCP 66 6633 → 40188 [ACK] Seq=1 Ack=370 Win=853 Len=0 TSval=681726 TSecr=774564
187 0.573335446 172.31.23.72 -> 172.31.31.144 OpenFlow 189 Type: OFPT_PACKET_IN
188 0.573342434 172.31.23.72 -> 172.31.31.144 OpenFlow 435 Type: OFPT_PACKET_IN
189 0.573392187 172.31.31.144 -> 172.31.23.72 TCP 66 6633 → 40192 [ACK] Seq=1 Ack=124 Win=853 Len=0 TSval=681726 TSecr=774564
190 0.573397736 172.31.31.144 -> 172.31.23.72 TCP 66 6633 → 40206 [ACK] Seq=1 Ack=124 Win=853 Len=0 TSval=681726 TSecr=774564
191 0.573399757 172.31.31.144 -> 172.31.23.72 TCP 66 6633 → 40188 [ACK] Seq=1 Ack=493 Win=853 Len=0 TSval=681726 TSecr=774564
192 0.573410108 172.31.23.72 -> 172.31.31.144 TCP 66 40142 → 6633 [ACK] Seq=541 Ack=428 Win=385 Len=0 TSval=774564 TSecr=681725
193 0.573468423 172.31.31.144 -> 172.31.23.72 TCP 66 6633 → 40214 [ACK] Seq=1 Ack=370 Win=853 Len=0 TSval=681726 TSecr=774564
194 0.573474255 172.31.31.144 -> 172.31.23.72 TCP 66 6633 → 40192 [ACK] Seq=1 Ack=493 Win=853 Len=0 TSval=681726 TSecr=774564
195 0.573476174 172.31.31.144 -> 172.31.23.72 TCP 66 6633 → 40216 [ACK] Seq=1 Ack=124 Win=853 Len=0 TSval=681726 TSecr=774564
196 0.573500924 172.31.23.72 -> 172.31.31.144 OpenFlow 189 Type: OFPT_PACKET_IN
197 0.573510857 172.31.31.144 -> 172.31.23.72 TCP 66 6633 → 40206 [ACK] Seq=1 Ack=247 Win=853 Len=0 TSval=681726 TSecr=774564
198 0.573513828 172.31.31.144 -> 172.31.23.72 OpenFlow 187 Type: OFPT_PACKET_OUT
199 0.573526961 172.31.31.144 -> 172.31.23.72 TCP 66 6633 → 40214 [ACK] Seq=1 Ack=493 Win=853 Len=0 TSval=681726 TSecr=774564
200 0.573533478 172.31.23.72 -> 172.31.31.144 OpenFlow 189 Type: OFPT_PACKET_IN
201 0.573558020 172.31.23.72 -> 172.31.31.144 OpenFlow 189 Type: OFPT_PACKET_IN
202 0.573581216 172.31.23.72 -> 172.31.31.144 OpenFlow 189 Type: OFPT_PACKET_IN
203 0.573630984 172.31.31.144 -> 172.31.23.72 TCP 66 6633 → 40216 [ACK] Seq=1 Ack=493 Win=853 Len=0 TSval=681726 TSecr=774564
204 0.573666793 172.31.23.72 -> 172.31.31.144 OpenFlow 189 Type: OFPT_PACKET_IN
205 0.573740937 172.31.31.144 -> 172.31.23.72 TCP 66 6633 → 40146 [ACK] Seq=1033 Ack=295 Win=853 Len=0 TSval=681726 TSecr=774564
206 0.573795857 172.31.31.144 -> 172.31.23.72 OpenFlow 187 Type: OFPT_PACKET_OUT
207 0.573811152 172.31.31.144 -> 172.31.23.72 TCP 66 6633 → 40152 [ACK] Seq=1275 Ack=418 Win=853 Len=0 TSval=681726 TSecr=774564
208 0.573831530 172.31.31.144 -> 172.31.23.72 OpenFlow 550 Type: OFPT_PACKET_OUT
209 0.573866143 172.31.23.72 -> 172.31.31.144 OpenFlow 189 Type: OFPT_PACKET_IN
210 0.574002401 172.31.31.144 -> 172.31.23.72 TCP 66 6633 → 40152 [ACK] Seq=1275 Ack=541 Win=853 Len=0 TSval=681726 TSecr=774565
211 0.574142710 172.31.23.72 -> 172.31.31.144 OpenFlow 189 Type: OFPT_PACKET_IN
212 0.574162155 172.31.23.72 -> 172.31.31.144 OpenFlow 189 Type: OFPT_PACKET_IN
213 0.574172334 172.31.31.144 -> 172.31.23.72 OpenFlow 187 Type: OFPT_PACKET_OUT
214 0.574186287 172.31.23.72 -> 172.31.31.144 OpenFlow 189 Type: OFPT_PACKET_IN
215 0.574191797 172.31.23.72 -> 172.31.31.144 OpenFlow 189 Type: OFPT_PACKET_IN
216 0.574253658 172.31.31.144 -> 172.31.23.72 OpenFlow 187 Type: OFPT_PACKET_OUT
217 0.574290561 172.31.23.72 -> 172.31.31.144 OpenFlow 189 Type: OFPT_PACKET_IN
218 0.574419287 172.31.31.144 -> 172.31.23.72 TCP 66 6633 → 40154 [ACK] Seq=1275 Ack=172 Win=853 Len=0 TSval=681726 TSecr=774565
219 0.574425148 172.31.31.144 -> 172.31.23.72 OpenFlow 187 Type: OFPT_PACKET_OUT
220 0.574427716 172.31.31.144 -> 172.31.23.72 TCP 66 6633 → 40188 [ACK] Seq=1 Ack=616 Win=853 Len=0 TSval=681726 TSecr=774565
221 0.574492190 172.31.31.144 -> 172.31.23.72 TCP 66 6633 → 40188 [ACK] Seq=1 Ack=739 Win=853 Len=0 TSval=681726 TSecr=774565
222 0.574532825 172.31.23.72 -> 172.31.31.144 TCP 66 40156 → 6633 [ACK] Seq=541 Ack=549 Win=213 Len=0 TSval=774565 TSecr=681726
223 0.574542896 172.31.31.144 -> 172.31.23.72 TCP 66 6633 → 40154 [ACK] Seq=1275 Ack=295 Win=853 Len=0 TSval=681726 TSecr=774565
224 0.574611028 172.31.31.144 -> 172.31.23.72 OpenFlow 187 Type: OFPT_PACKET_OUT
225 0.574616525 172.31.31.144 -> 172.31.23.72 OpenFlow 187 Type: OFPT_PACKET_OUT
226 0.574675003 172.31.31.144 -> 172.31.23.72 OpenFlow 187 Type: OFPT_PACKET_OUT
227 0.574759638 172.31.23.72 -> 172.31.31.144 OpenFlow 189 Type: OFPT_PACKET_IN
228 0.574769711 172.31.31.144 -> 172.31.23.72 OpenFlow 187 Type: OFPT_PACKET_OUT
229 0.574790915 172.31.23.72 -> 172.31.31.144 OpenFlow 189 Type: OFPT_PACKET_IN
230 0.574818740 172.31.23.72 -> 172.31.31.144 OpenFlow 189 Type: OFPT_PACKET_IN
231 0.574866871 172.31.31.144 -> 172.31.23.72 OpenFlow 187 Type: OFPT_PACKET_OUT
232 0.574924440 172.31.31.144 -> 172.31.23.72 OpenFlow 187 Type: OFPT_PACKET_OUT
233 0.575001524 172.31.31.144 -> 172.31.23.72 TCP 66 6633 → 40144 [ACK] Seq=791 Ack=172 Win=853 Len=0 TSval=681726 TSecr=774565
234 0.575018820 172.31.31.144 -> 172.31.23.72 TCP 66 6633 → 40142 [ACK] Seq=1033 Ack=787 Win=853 Len=0 TSval=681726 TSecr=774565
235 0.575039138 172.31.31.144 -> 172.31.23.72 OpenFlow 187 Type: OFPT_PACKET_OUT
236 0.575056710 172.31.31.144 -> 172.31.23.72 OpenFlow 187 Type: OFPT_PACKET_OUT
237 0.575063199 172.31.23.72 -> 172.31.31.144 TCP 66 40156 → 6633 [ACK] Seq=541 Ack=1033 Win=213 Len=0 TSval=774565 TSecr=681726
238 0.575150736 172.31.23.72 -> 172.31.31.144 OpenFlow 189 Type: OFPT_PACKET_IN
239 0.575161167 172.31.31.144 -> 172.31.23.72 TCP 66 6633 → 40144 [ACK] Seq=791 Ack=295 Win=853 Len=0 TSval=681726 TSecr=774565
240 0.575177294 172.31.31.144 -> 172.31.23.72 OpenFlow 187 Type: OFPT_PACKET_OUT
241 0.575184514 172.31.23.72 -> 172.31.31.144 OpenFlow 189 Type: OFPT_PACKET_IN
242 0.575198622 172.31.23.72 -> 172.31.31.144 OpenFlow 189 Type: OFPT_PACKET_IN
243 0.575260034 172.31.23.72 -> 172.31.31.144 OpenFlow 189 Type: OFPT_PACKET_IN
244 0.575290861 172.31.31.144 -> 172.31.23.72 OpenFlow 187 Type: OFPT_PACKET_OUT
245 0.575326699 172.31.31.144 -> 172.31.23.72 TCP 66 6633 → 40196 [ACK] Seq=1 Ack=370 Win=853 Len=0 TSval=681726 TSecr=774565
246 0.575345364 172.31.31.144 -> 172.31.23.72 OpenFlow 187 Type: OFPT_PACKET_OUT
247 0.575362269 172.31.31.144 -> 172.31.23.72 TCP 66 6633 → 40196 [ACK] Seq=1 Ack=493 Win=853 Len=0 TSval=681726 TSecr=774565
248 0.575386405 172.31.31.144 -> 172.31.23.72 TCP 66 6633 → 40198 [ACK] Seq=1 Ack=370 Win=853 Len=0 TSval=681726 TSecr=774565
249 0.575400180 172.31.31.144 -> 172.31.23.72 OpenFlow 187 Type: OFPT_PACKET_OUT
250 0.575419627 172.31.31.144 -> 172.31.23.72 TCP 66 6633 → 40198 [ACK] Seq=1 Ack=493 Win=853 Len=0 TSval=681726 TSecr=774565
251 0.575612399 172.31.23.72 -> 172.31.31.144 TCP 66 40140 → 6633 [ACK] Seq=49 Ack=1033 Win=385 Len=0 TSval=774565 TSecr=681726
252 0.575720906 172.31.23.72 -> 172.31.31.144 OpenFlow 189 Type: OFPT_PACKET_IN
253 0.575753043 172.31.23.72 -> 172.31.31.144 OpenFlow 189 Type: OFPT_PACKET_IN
254 0.575790035 172.31.23.72 -> 172.31.31.144 OpenFlow 189 Type: OFPT_PACKET_IN
255 0.575808974 172.31.23.72 -> 172.31.31.144 OpenFlow 189 Type: OFPT_PACKET_IN
256 0.575854534 172.31.23.72 -> 172.31.31.144 OpenFlow 189 Type: OFPT_PACKET_IN
257 0.575859726 172.31.23.72 -> 172.31.31.144 OpenFlow 189 Type: OFPT_PACKET_IN
258 0.575925903 172.31.31.144 -> 172.31.23.72 TCP 66 6633 → 40190 [ACK] Seq=1 Ack=370 Win=853 Len=0 TSval=681726 TSecr=774565
259 0.575931253 172.31.31.144 -> 172.31.23.72 TCP 66 6633 → 40190 [ACK] Seq=1 Ack=493 Win=853 Len=0 TSval=681726 TSecr=774565
260 0.575990808 172.31.31.144 -> 172.31.23.72 TCP 66 6633 → 40208 [ACK] Seq=1 Ack=370 Win=853 Len=0 TSval=681726 TSecr=774565
261 0.576014979 172.31.31.144 -> 172.31.23.72 TCP 66 6633 → 40212 [ACK] Seq=1 Ack=616 Win=853 Len=0 TSval=681726 TSecr=774565
262 0.576063108 172.31.31.144 -> 172.31.23.72 TCP 66 6633 → 40208 [ACK] Seq=1 Ack=493 Win=853 Len=0 TSval=681726 TSecr=774565
263 0.576102926 172.31.31.144 -> 172.31.23.72 TCP 66 6633 → 40212 [ACK] Seq=1 Ack=739 Win=853 Len=0 TSval=681726 TSecr=774565
264 0.614538668 137.158.125.247 -> 172.31.23.72 TCP 54 52508 → 22 [ACK] Seq=1 Ack=393 Win=32386 Len=0
265 0.688298352 172.31.23.72 -> 172.31.31.144 OpenFlow 146 Type: OFPT_PORT_STATUS
266 0.688355449 172.31.23.72 -> 172.31.31.144 OpenFlow 146 Type: OFPT_PORT_STATUS
267 0.688540749 172.31.31.144 -> 172.31.23.72 TCP 66 6633 → 40214 [ACK] Seq=1 Ack=573 Win=853 Len=0 TSval=681755 TSecr=774593
268 0.688572628 172.31.31.144 -> 172.31.23.72 TCP 66 6633 → 40216 [ACK] Seq=1 Ack=573 Win=853 Len=0 TSval=681755 TSecr=774593
269 0.713061615 172.31.31.144 -> 172.31.23.72 OpenFlow 146 Type: OFPT_FLOW_MOD
270 0.713073459 172.31.31.144 -> 172.31.23.72 TCP 146 6633 → 40200 [PSH, ACK] Seq=1 Ack=1 Win=853 Len=80 TSval=681761 TSecr=774279
271 0.713087858 172.31.31.144 -> 172.31.23.72 OpenFlow 154 Type: OFPT_BARRIER_REQUEST
272 0.713098132 172.31.31.144 -> 172.31.23.72 OpenFlow 146 Type: OFPT_FLOW_MOD
273 0.713163181 172.31.31.144 -> 172.31.23.72 TCP 154 6633 → 40200 [PSH, ACK] Seq=81 Ack=1 Win=853 Len=88 TSval=681761 TSecr=774279
274 0.713168011 172.31.31.144 -> 172.31.23.72 OpenFlow 146 Type: OFPT_FLOW_MOD
275 0.713170332 172.31.31.144 -> 172.31.23.72 OpenFlow 146 Type: OFPT_FLOW_MOD
276 0.713184696 172.31.31.144 -> 172.31.23.72 OpenFlow 146 Type: OFPT_FLOW_MOD
277 0.713204945 172.31.31.144 -> 172.31.23.72 OpenFlow 146 Type: OFPT_FLOW_MOD
278 0.713221734 172.31.31.144 -> 172.31.23.72 OpenFlow 154 Type: OFPT_BARRIER_REQUEST
279 0.713240934 172.31.31.144 -> 172.31.23.72 OpenFlow 74 Type: OFPT_BARRIER_REQUEST
280 0.713259675 172.31.31.144 -> 172.31.23.72 OpenFlow 146 Type: OFPT_FLOW_MOD
281 0.713279017 172.31.31.144 -> 172.31.23.72 OpenFlow 146 Type: OFPT_FLOW_MOD
282 0.713297672 172.31.31.144 -> 172.31.23.72 OpenFlow 146 Type: OFPT_FLOW_MOD
283 0.713316269 172.31.31.144 -> 172.31.23.72 OpenFlow 74 Type: OFPT_BARRIER_REQUEST
284 0.713320125 172.31.23.72 -> 172.31.31.144 TCP 66 40194 → 6633 [ACK] Seq=247 Ack=161 Win=385 Len=0 TSval=774599 TSecr=681761
285 0.713337293 172.31.31.144 -> 172.31.23.72 OpenFlow 146 Type: OFPT_FLOW_MOD
286 0.713348035 172.31.23.72 -> 172.31.31.144 OpenFlow 74 Type: OFPT_BARRIER_REPLY
287 0.713384710 172.31.31.144 -> 172.31.23.72 OpenFlow 146 Type: OFPT_FLOW_MOD
288 0.713388413 172.31.31.144 -> 172.31.23.72 OpenFlow 74 Type: OFPT_BARRIER_REQUEST
289 0.713393427 172.31.23.72 -> 172.31.31.144 TCP 66 40198 → 6633 [ACK] Seq=493 Ack=169 Win=385 Len=0 TSval=774599 TSecr=681761
290 0.713401685 172.31.23.72 -> 172.31.31.144 OpenFlow 74 Type: OFPT_BARRIER_REPLY
291 0.713427016 172.31.31.144 -> 172.31.23.72 OpenFlow 74 Type: OFPT_BARRIER_REQUEST
292 0.713429690 172.31.31.144 -> 172.31.23.72 OpenFlow 146 Type: OFPT_FLOW_MOD
293 0.713447383 172.31.23.72 -> 172.31.31.144 TCP 66 40200 → 6633 [ACK] Seq=1 Ack=169 Win=401 Len=0 TSval=774599 TSecr=681761
294 0.713456311 172.31.23.72 -> 172.31.31.144 OpenFlow 74 Type: OFPT_BARRIER_REPLY
295 0.713483657 172.31.23.72 -> 172.31.31.144 TCP 66 40204 → 6633 [ACK] Seq=247 Ack=169 Win=308 Len=0 TSval=774599 TSecr=681761
296 0.713487726 172.31.23.72 -> 172.31.31.144 OpenFlow 74 Type: OFPT_BARRIER_REPLY
297 0.713525239 172.31.23.72 -> 172.31.31.144 TCP 66 40214 → 6633 [ACK] Seq=573 Ack=161 Win=197 Len=0 TSval=774599 TSecr=681761
298 0.713533597 172.31.31.144 -> 172.31.23.72 OpenFlow 242 Type: OFPT_BARRIER_REQUEST
299 0.713536815 172.31.31.144 -> 172.31.23.72 OpenFlow 146 Type: OFPT_FLOW_MOD
300 0.713539930 172.31.31.144 -> 172.31.23.72 OpenFlow 146 Type: OFPT_FLOW_MOD
301 0.713542186 172.31.31.144 -> 172.31.23.72 OpenFlow 146 Type: OFPT_FLOW_MOD
302 0.713544137 172.31.31.144 -> 172.31.23.72 OpenFlow 154 Type: OFPT_BARRIER_REQUEST
303 0.713556105 172.31.23.72 -> 172.31.31.144 OpenFlow 74 Type: OFPT_BARRIER_REPLY
304 0.713586495 172.31.23.72 -> 172.31.31.144 OpenFlow 74 Type: OFPT_BARRIER_REPLY
305 0.713742185 172.31.31.144 -> 172.31.23.72 OpenFlow 146 Type: OFPT_FLOW_MOD
306 0.713747718 172.31.31.144 -> 172.31.23.72 OpenFlow 146 Type: OFPT_FLOW_MOD
307 0.713749717 172.31.31.144 -> 172.31.23.72 OpenFlow 154 Type: OFPT_BARRIER_REQUEST
308 0.713751483 172.31.31.144 -> 172.31.23.72 OpenFlow 154 Type: OFPT_BARRIER_REQUEST
309 0.713753448 172.31.31.144 -> 172.31.23.72 OpenFlow 146 Type: OFPT_FLOW_MOD
310 0.713755608 172.31.31.144 -> 172.31.23.72 OpenFlow 146 Type: OFPT_FLOW_MOD
311 0.713758613 172.31.31.144 -> 172.31.23.72 OpenFlow 146 Type: OFPT_FLOW_MOD
312 0.713760170 172.31.31.144 -> 172.31.23.72 OpenFlow 146 Type: OFPT_FLOW_MOD
313 0.713761480 172.31.31.144 -> 172.31.23.72 OpenFlow 162 Type: OFPT_BARRIER_REQUEST
314 0.713775585 172.31.23.72 -> 172.31.31.144 OpenFlow 74 Type: OFPT_BARRIER_REPLY
315 0.713781790 172.31.23.72 -> 172.31.31.144 OpenFlow 74 Type: OFPT_BARRIER_REPLY
316 0.713812060 172.31.31.144 -> 172.31.23.72 OpenFlow 146 Type: OFPT_FLOW_MOD
317 0.713815660 172.31.31.144 -> 172.31.23.72 OpenFlow 146 Type: OFPT_FLOW_MOD
318 0.713817673 172.31.31.144 -> 172.31.23.72 OpenFlow 146 Type: OFPT_FLOW_MOD
319 0.713820822 172.31.31.144 -> 172.31.23.72 OpenFlow 74 Type: OFPT_BARRIER_REQUEST
320 0.713829808 172.31.23.72 -> 172.31.31.144 OpenFlow 146 Type: OFPT_FLOW_REMOVED
321 0.713843838 172.31.23.72 -> 172.31.31.144 OpenFlow 146 Type: OFPT_FLOW_REMOVED
322 0.713851193 172.31.23.72 -> 172.31.31.144 OpenFlow 146 Type: OFPT_FLOW_REMOVED
323 0.713862733 172.31.23.72 -> 172.31.31.144 OpenFlow 146 Type: OFPT_FLOW_REMOVED
324 0.713869463 172.31.23.72 -> 172.31.31.144 OpenFlow 146 Type: OFPT_FLOW_REMOVED
325 0.713881165 172.31.23.72 -> 172.31.31.144 OpenFlow 146 Type: OFPT_FLOW_REMOVED
326 0.713930835 172.31.31.144 -> 172.31.23.72 TCP 146 6633 → 40202 [PSH, ACK] Seq=1 Ack=1 Win=853 Len=80 TSval=681761 TSecr=774279
327 0.713936077 172.31.31.144 -> 172.31.23.72 OpenFlow 146 Type: OFPT_FLOW_MOD
328 0.713938522 172.31.31.144 -> 172.31.23.72 TCP 154 6633 → 40202 [PSH, ACK] Seq=81 Ack=1 Win=853 Len=88 TSval=681761 TSecr=774279
329 0.713940460 172.31.31.144 -> 172.31.23.72 OpenFlow 154 Type: OFPT_BARRIER_REQUEST
330 0.713941984 172.31.31.144 -> 172.31.23.72 OpenFlow 154 Type: OFPT_BARRIER_REQUEST
331 0.713943891 172.31.31.144 -> 172.31.23.72 OpenFlow 74 Type: OFPT_BARRIER_REQUEST
332 0.714025577 172.31.23.72 -> 172.31.31.144 OpenFlow 146 Type: OFPT_FLOW_REMOVED
333 0.714031579 172.31.23.72 -> 172.31.31.144 OpenFlow 146 Type: OFPT_FLOW_REMOVED
334 0.714033460 172.31.23.72 -> 172.31.31.144 OpenFlow 146 Type: OFPT_FLOW_REMOVED
335 0.714035025 172.31.23.72 -> 172.31.31.144 OpenFlow 146 Type: OFPT_FLOW_REMOVED
336 0.714139397 172.31.31.144 -> 172.31.23.72 OpenFlow 154 Type: OFPT_BARRIER_REQUEST
337 0.714142650 172.31.31.144 -> 172.31.23.72 OpenFlow 146 Type: OFPT_FLOW_MOD
338 0.714145240 172.31.31.144 -> 172.31.23.72 OpenFlow 146 Type: OFPT_FLOW_MOD
339 0.714150886 172.31.31.144 -> 172.31.23.72 OpenFlow 154 Type: OFPT_BARRIER_REQUEST
340 0.714152651 172.31.31.144 -> 172.31.23.72 OpenFlow 146 Type: OFPT_FLOW_MOD
341 0.714155130 172.31.31.144 -> 172.31.23.72 OpenFlow 154 Type: OFPT_BARRIER_REQUEST
342 0.714156454 172.31.31.144 -> 172.31.23.72 TCP 66 6633 → 40198 [ACK] Seq=169 Ack=501 Win=853 Len=0 TSval=681761 TSecr=774599
343 0.714159872 172.31.31.144 -> 172.31.23.72 OpenFlow 146 Type: OFPT_FLOW_MOD
344 0.714161392 172.31.31.144 -> 172.31.23.72 OpenFlow 74 Type: OFPT_BARRIER_REQUEST
345 0.714162939 172.31.31.144 -> 172.31.23.72 TCP 66 6633 → 40200 [ACK] Seq=169 Ack=9 Win=853 Len=0 TSval=681761 TSecr=774599
346 0.714165046 172.31.31.144 -> 172.31.23.72 TCP 66 6633 → 40214 [ACK] Seq=505 Ack=589 Win=853 Len=0 TSval=681761 TSecr=774599
347 0.714168096 172.31.23.72 -> 172.31.31.144 OpenFlow 306 Type: OFPT_FLOW_REMOVED
348 0.714178109 172.31.23.72 -> 172.31.31.144 OpenFlow 306 Type: OFPT_FLOW_REMOVED
349 0.714317335 172.31.31.144 -> 172.31.23.72 TCP 66 6633 → 40216 [ACK] Seq=505 Ack=589 Win=853 Len=0 TSval=681761 TSecr=774599
350 0.714321026 172.31.31.144 -> 172.31.23.72 TCP 66 6633 → 40194 [ACK] Seq=169 Ack=335 Win=853 Len=0 TSval=681761 TSecr=774599
351 0.714322991 172.31.31.144 -> 172.31.23.72 TCP 66 6633 → 40198 [ACK] Seq=169 Ack=581 Win=853 Len=0 TSval=681761 TSecr=774600
352 0.714324754 172.31.31.144 -> 172.31.23.72 TCP 66 6633 → 40200 [ACK] Seq=169 Ack=89 Win=853 Len=0 TSval=681761 TSecr=774600
353 0.714326451 172.31.31.144 -> 172.31.23.72 TCP 66 6633 → 40204 [ACK] Seq=169 Ack=335 Win=853 Len=0 TSval=681761 TSecr=774599
354 0.714389581 172.31.31.144 -> 172.31.23.72 TCP 66 6633 → 40198 [ACK] Seq=169 Ack=661 Win=853 Len=0 TSval=681761 TSecr=774600
355 0.714392517 172.31.31.144 -> 172.31.23.72 TCP 66 6633 → 40200 [ACK] Seq=169 Ack=169 Win=853 Len=0 TSval=681761 TSecr=774600
356 0.714485513 172.31.31.144 -> 172.31.23.72 TCP 66 6633 → 40214 [ACK] Seq=505 Ack=909 Win=853 Len=0 TSval=681761 TSecr=774600
357 0.714507511 172.31.31.144 -> 172.31.23.72 TCP 66 6633 → 40216 [ACK] Seq=505 Ack=909 Win=853 Len=0 TSval=681761 TSecr=774600
358 0.716016167 172.31.23.72 -> 172.31.31.144 TCP 66 40140 → 6633 [ACK] Seq=49 Ack=1201 Win=385 Len=0 TSval=774600 TSecr=681761
359 0.716028483 172.31.23.72 -> 172.31.31.144 OpenFlow 74 Type: OFPT_BARRIER_REPLY
360 0.716053384 172.31.23.72 -> 172.31.31.144 TCP 66 40142 → 6633 [ACK] Seq=787 Ack=1201 Win=385 Len=0 TSval=774600 TSecr=681761
361 0.716062267 172.31.23.72 -> 172.31.31.144 OpenFlow 74 Type: OFPT_BARRIER_REPLY
362 0.716080959 172.31.23.72 -> 172.31.31.144 TCP 66 40144 → 6633 [ACK] Seq=295 Ack=959 Win=379 Len=0 TSval=774600 TSecr=681761
363 0.716085806 172.31.23.72 -> 172.31.31.144 OpenFlow 74 Type: OFPT_BARRIER_REPLY
364 0.716103980 172.31.23.72 -> 172.31.31.144 OpenFlow 74 Type: OFPT_BARRIER_REPLY
365 0.716144051 172.31.23.72 -> 172.31.31.144 TCP 66 40152 → 6633 [ACK] Seq=541 Ack=1443 Win=385 Len=0 TSval=774600 TSecr=681761
366 0.716152646 172.31.23.72 -> 172.31.31.144 OpenFlow 74 Type: OFPT_BARRIER_REPLY
367 0.716190058 172.31.23.72 -> 172.31.31.144 TCP 66 40154 → 6633 [ACK] Seq=295 Ack=1443 Win=385 Len=0 TSval=774600 TSecr=681761
368 0.716195381 172.31.23.72 -> 172.31.31.144 OpenFlow 74 Type: OFPT_BARRIER_REPLY
369 0.716225812 172.31.23.72 -> 172.31.31.144 OpenFlow 74 Type: OFPT_BARRIER_REPLY
370 0.716248767 172.31.23.72 -> 172.31.31.144 TCP 66 40190 → 6633 [ACK] Seq=493 Ack=169 Win=385 Len=0 TSval=774600 TSecr=681761
371 0.716252615 172.31.23.72 -> 172.31.31.144 OpenFlow 74 Type: OFPT_BARRIER_REPLY
372 0.716296398 172.31.31.144 -> 172.31.23.72 TCP 66 6633 → 40140 [ACK] Seq=1201 Ack=57 Win=853 Len=0 TSval=681761 TSecr=774600
373 0.716303807 172.31.23.72 -> 172.31.31.144 OpenFlow 82 Type: OFPT_BARRIER_REPLY
374 0.716310022 172.31.23.72 -> 172.31.31.144 TCP 66 40202 → 6633 [ACK] Seq=1 Ack=169 Win=213 Len=0 TSval=774600 TSecr=681761
375 0.716314983 172.31.23.72 -> 172.31.31.144 OpenFlow 74 Type: OFPT_BARRIER_REPLY
376 0.716359982 172.31.23.72 -> 172.31.31.144 TCP 66 40210 → 6633 [ACK] Seq=247 Ack=169 Win=384 Len=0 TSval=774600 TSecr=681761
377 0.716364280 172.31.23.72 -> 172.31.31.144 OpenFlow 74 Type: OFPT_BARRIER_REPLY
378 0.716397489 172.31.23.72 -> 172.31.31.144 OpenFlow 74 Type: OFPT_BARRIER_REPLY
379 0.716415728 172.31.23.72 -> 172.31.31.144 OpenFlow 74 Type: OFPT_BARRIER_REPLY
380 0.716533990 172.31.23.72 -> 172.31.31.144 OpenFlow 146 Type: OFPT_FLOW_REMOVED
381 0.716538166 172.31.23.72 -> 172.31.31.144 OpenFlow 74 Type: OFPT_BARRIER_REPLY
382 0.716546756 172.31.23.72 -> 172.31.31.144 OpenFlow 146 Type: OFPT_FLOW_REMOVED
383 0.716553137 172.31.23.72 -> 172.31.31.144 OpenFlow 146 Type: OFPT_FLOW_REMOVED
384 0.716567253 172.31.31.144 -> 172.31.23.72 TCP 66 6633 → 40144 [ACK] Seq=959 Ack=303 Win=853 Len=0 TSval=681761 TSecr=774600
385 0.716572636 172.31.23.72 -> 172.31.31.144 OpenFlow 146 Type: OFPT_FLOW_REMOVED
386 0.716574425 172.31.31.144 -> 172.31.23.72 TCP 66 6633 → 40152 [ACK] Seq=1443 Ack=549 Win=853 Len=0 TSval=681762 TSecr=774600
387 0.716576532 172.31.31.144 -> 172.31.23.72 TCP 66 6633 → 40154 [ACK] Seq=1443 Ack=303 Win=853 Len=0 TSval=681762 TSecr=774600
388 0.716591089 172.31.23.72 -> 172.31.31.144 OpenFlow 146 Type: OFPT_FLOW_REMOVED
389 0.716597396 172.31.23.72 -> 172.31.31.144 OpenFlow 546 Type: OFPT_FLOW_REMOVED
390 0.716605244 172.31.23.72 -> 172.31.31.144 OpenFlow 146 Type: OFPT_FLOW_REMOVED
391 0.716622539 172.31.23.72 -> 172.31.31.144 OpenFlow 146 Type: OFPT_FLOW_REMOVED
392 0.716860870 172.31.23.72 -> 172.31.31.144 OpenFlow 226 Type: OFPT_FLOW_REMOVED
393 0.716863699 172.31.23.72 -> 172.31.31.144 OpenFlow 226 Type: OFPT_FLOW_REMOVED
394 0.716865378 172.31.23.72 -> 172.31.31.144 OpenFlow 226 Type: OFPT_FLOW_REMOVED
395 0.716867020 172.31.23.72 -> 172.31.31.144 OpenFlow 226 Type: OFPT_FLOW_REMOVED
396 0.716868651 172.31.23.72 -> 172.31.31.144 OpenFlow 146 Type: OFPT_FLOW_REMOVED
397 0.716870259 172.31.23.72 -> 172.31.31.144 OpenFlow 386 Type: OFPT_FLOW_REMOVED
398 0.716871740 172.31.23.72 -> 172.31.31.144 OpenFlow 146 Type: OFPT_FLOW_REMOVED
399 0.716984383 172.31.31.144 -> 172.31.23.72 TCP 66 6633 → 40190 [ACK] Seq=169 Ack=501 Win=853 Len=0 TSval=681762 TSecr=774600
400 0.716989294 172.31.23.72 -> 172.31.31.144 OpenFlow 146 Type: OFPT_FLOW_REMOVED
401 0.716991308 172.31.31.144 -> 172.31.23.72 TCP 66 6633 → 40188 [ACK] Seq=337 Ack=747 Win=853 Len=0 TSval=681762 TSecr=774600
402 0.716993360 172.31.31.144 -> 172.31.23.72 TCP 66 6633 → 40146 [ACK] Seq=1537 Ack=319 Win=853 Len=0 TSval=681762 TSecr=774600
403 0.716995387 172.31.31.144 -> 172.31.23.72 TCP 66 6633 → 40202 [ACK] Seq=169 Ack=9 Win=853 Len=0 TSval=681762 TSecr=774600
404 0.716997132 172.31.31.144 -> 172.31.23.72 TCP 66 6633 → 40140 [ACK] Seq=1201 Ack=137 Win=853 Len=0 TSval=681762 TSecr=774600
405 0.716998796 172.31.31.144 -> 172.31.23.72 TCP 66 6633 → 40188 [ACK] Seq=337 Ack=755 Win=853 Len=0 TSval=681762 TSecr=774600
406 0.717204110 172.31.23.72 -> 172.31.31.144 OpenFlow 146 Type: OFPT_FLOW_REMOVED
407 0.717209909 172.31.23.72 -> 172.31.31.144 OpenFlow 146 Type: OFPT_FLOW_REMOVED
408 0.717457312 172.31.31.144 -> 172.31.23.72 TCP 66 6633 → 40144 [ACK] Seq=959 Ack=383 Win=853 Len=0 TSval=681762 TSecr=774600
409 0.717460910 172.31.31.144 -> 172.31.23.72 TCP 66 6633 → 40142 [ACK] Seq=1201 Ack=875 Win=853 Len=0 TSval=681762 TSecr=774600
410 0.717463192 172.31.31.144 -> 172.31.23.72 TCP 66 6633 → 40144 [ACK] Seq=959 Ack=463 Win=853 Len=0 TSval=681762 TSecr=774600
411 0.717464949 172.31.31.144 -> 172.31.23.72 TCP 66 6633 → 40152 [ACK] Seq=1443 Ack=629 Win=853 Len=0 TSval=681762 TSecr=774600
412 0.717466810 172.31.31.144 -> 172.31.23.72 OpenFlow 170 Type: OFPT_FLOW_MOD
413 0.717469323 172.31.31.144 -> 172.31.23.72 OpenFlow 170 Type: OFPT_FLOW_MOD
414 0.717470892 172.31.31.144 -> 172.31.23.72 TCP 66 6633 → 40154 [ACK] Seq=1443 Ack=383 Win=853 Len=0 TSval=681762 TSecr=774600
415 0.717472598 172.31.31.144 -> 172.31.23.72 TCP 66 6633 → 40202 [ACK] Seq=169 Ack=169 Win=853 Len=0 TSval=681762 TSecr=774600
416 0.717474328 172.31.31.144 -> 172.31.23.72 OpenFlow 74 Type: OFPT_BARRIER_REQUEST
417 0.717475608 172.31.31.144 -> 172.31.23.72 TCP 66 6633 → 40190 [ACK] Seq=169 Ack=581 Win=853 Len=0 TSval=681762 TSecr=774600
418 0.717477397 172.31.31.144 -> 172.31.23.72 TCP 66 6633 → 40210 [ACK] Seq=169 Ack=415 Win=853 Len=0 TSval=681762 TSecr=774600
419 0.717479559 172.31.31.144 -> 172.31.23.72 OpenFlow 170 Type: OFPT_FLOW_MOD
420 0.717483085 172.31.31.144 -> 172.31.23.72 OpenFlow 170 Type: OFPT_FLOW_MOD
421 0.717541859 172.31.31.144 -> 172.31.23.72 OpenFlow 170 Type: OFPT_FLOW_MOD
422 0.717544861 172.31.31.144 -> 172.31.23.72 TCP 66 6633 → 40216 [ACK] Seq=505 Ack=1077 Win=853 Len=0 TSval=681762 TSecr=774600
423 0.717547020 172.31.31.144 -> 172.31.23.72 OpenFlow 170 Type: OFPT_FLOW_MOD
424 0.717548645 172.31.31.144 -> 172.31.23.72 TCP 66 6633 → 40140 [ACK] Seq=1201 Ack=217 Win=853 Len=0 TSval=681762 TSecr=774600
425 0.717550579 172.31.31.144 -> 172.31.23.72 OpenFlow 170 Type: OFPT_FLOW_MOD
426 0.717555006 172.31.31.144 -> 172.31.23.72 OpenFlow 178 Type: OFPT_BARRIER_REQUEST
427 0.717577431 172.31.31.144 -> 172.31.23.72 OpenFlow 178 Type: OFPT_BARRIER_REQUEST
428 0.717595967 172.31.31.144 -> 172.31.23.72 OpenFlow 170 Type: OFPT_FLOW_MOD
429 0.717614317 172.31.31.144 -> 172.31.23.72 OpenFlow 170 Type: OFPT_FLOW_MOD
430 0.717633098 172.31.31.144 -> 172.31.23.72 TCP 66 6633 → 40188 [ACK] Seq=337 Ack=1075 Win=853 Len=0 TSval=681762 TSecr=774600
431 0.717654727 172.31.31.144 -> 172.31.23.72 OpenFlow 74 Type: OFPT_BARRIER_REQUEST
432 0.717670944 172.31.31.144 -> 172.31.23.72 OpenFlow 170 Type: OFPT_FLOW_MOD
433 0.717689647 172.31.31.144 -> 172.31.23.72 OpenFlow 170 Type: OFPT_FLOW_MOD
434 0.717758958 172.31.31.144 -> 172.31.23.72 OpenFlow 170 Type: OFPT_FLOW_MOD
435 0.717761209 172.31.31.144 -> 172.31.23.72 OpenFlow 74 Type: OFPT_BARRIER_REQUEST
436 0.717762752 172.31.31.144 -> 172.31.23.72 OpenFlow 74 Type: OFPT_BARRIER_REQUEST
437 0.717776388 172.31.31.144 -> 172.31.23.72 OpenFlow 170 Type: OFPT_FLOW_MOD
438 0.717815893 172.31.31.144 -> 172.31.23.72 OpenFlow 170 Type: OFPT_FLOW_MOD
439 0.717847458 172.31.31.144 -> 172.31.23.72 OpenFlow 170 Type: OFPT_FLOW_MOD
440 0.717864884 172.31.31.144 -> 172.31.23.72 OpenFlow 282 Type: OFPT_FLOW_MOD
441 0.717883031 172.31.31.144 -> 172.31.23.72 OpenFlow 290 Type: OFPT_FLOW_MOD
442 0.717908027 172.31.31.144 -> 172.31.23.72 TCP 66 6633 → 40154 [ACK] Seq=1443 Ack=463 Win=853 Len=0 TSval=681762 TSecr=774600
443 0.717930826 172.31.31.144 -> 172.31.23.72 OpenFlow 170 Type: OFPT_FLOW_MOD
444 0.717948262 172.31.31.144 -> 172.31.23.72 OpenFlow 178 Type: OFPT_BARRIER_REQUEST
445 0.717966933 172.31.31.144 -> 172.31.23.72 OpenFlow 170 Type: OFPT_FLOW_MOD
446 0.717984842 172.31.31.144 -> 172.31.23.72 OpenFlow 170 Type: OFPT_FLOW_MOD
447 0.718003990 172.31.31.144 -> 172.31.23.72 OpenFlow 170 Type: OFPT_FLOW_MOD
448 0.718021517 172.31.31.144 -> 172.31.23.72 OpenFlow 170 Type: OFPT_FLOW_MOD
449 0.718078763 172.31.31.144 -> 172.31.23.72 OpenFlow 386 Type: OFPT_BARRIER_REQUEST
450 0.718081245 172.31.31.144 -> 172.31.23.72 OpenFlow 170 Type: OFPT_FLOW_MOD
451 0.718082720 172.31.31.144 -> 172.31.23.72 OpenFlow 74 Type: OFPT_BARRIER_REQUEST
452 0.718105758 172.31.31.144 -> 172.31.23.72 OpenFlow 170 Type: OFPT_FLOW_MOD
453 0.718135869 172.31.31.144 -> 172.31.23.72 OpenFlow 170 Type: OFPT_FLOW_MOD
454 0.718168681 172.31.31.144 -> 172.31.23.72 OpenFlow 170 Type: OFPT_FLOW_MOD
455 0.718198520 172.31.31.144 -> 172.31.23.72 OpenFlow 170 Type: OFPT_FLOW_MOD
456 0.718220420 172.31.31.144 -> 172.31.23.72 OpenFlow 74 Type: OFPT_BARRIER_REQUEST
457 0.718238346 172.31.31.144 -> 172.31.23.72 OpenFlow 170 Type: OFPT_FLOW_MOD
458 0.718255446 172.31.31.144 -> 172.31.23.72 OpenFlow 178 Type: OFPT_FLOW_MOD
459 0.718272934 172.31.31.144 -> 172.31.23.72 OpenFlow 170 Type: OFPT_FLOW_MOD
460 0.718290865 172.31.31.144 -> 172.31.23.72 OpenFlow 178 Type: OFPT_BARRIER_REQUEST
461 0.718308860 172.31.31.144 -> 172.31.23.72 OpenFlow 178 Type: OFPT_BARRIER_REQUEST
462 0.718325652 172.31.31.144 -> 172.31.23.72 OpenFlow 74 Type: OFPT_BARRIER_REQUEST
463 0.718342873 172.31.31.144 -> 172.31.23.72 OpenFlow 178 Type: OFPT_BARRIER_REQUEST
464 0.718360853 172.31.31.144 -> 172.31.23.72 OpenFlow 170 Type: OFPT_FLOW_MOD
465 0.718378560 172.31.31.144 -> 172.31.23.72 OpenFlow 178 Type: OFPT_BARRIER_REQUEST
466 0.718395829 172.31.31.144 -> 172.31.23.72 OpenFlow 170 Type: OFPT_FLOW_MOD
467 0.718474956 172.31.31.144 -> 172.31.23.72 TCP 66 6633 → 40214 [ACK] Seq=505 Ack=1077 Win=853 Len=0 TSval=681762 TSecr=774600
468 0.718478060 172.31.31.144 -> 172.31.23.72 OpenFlow 170 Type: OFPT_FLOW_MOD
469 0.718480858 172.31.31.144 -> 172.31.23.72 OpenFlow 170 Type: OFPT_FLOW_MOD
470 0.718607710 172.31.23.72 -> 172.31.31.144 TCP 66 40140 → 6633 [ACK] Seq=217 Ack=1521 Win=385 Len=0 TSval=774601 TSecr=681762
471 0.718617885 172.31.23.72 -> 172.31.31.144 OpenFlow 74 Type: OFPT_BARRIER_REPLY
472 0.718646799 172.31.23.72 -> 172.31.31.144 TCP 66 40144 → 6633 [ACK] Seq=463 Ack=1175 Win=379 Len=0 TSval=774601 TSecr=681762
473 0.718655028 172.31.23.72 -> 172.31.31.144 OpenFlow 74 Type: OFPT_BARRIER_REPLY
474 0.718675659 172.31.23.72 -> 172.31.31.144 OpenFlow 74 Type: OFPT_BARRIER_REPLY
475 0.718723158 172.31.23.72 -> 172.31.31.144 OpenFlow 74 Type: OFPT_BARRIER_REPLY
476 0.718759013 172.31.23.72 -> 172.31.31.144 TCP 66 40156 → 6633 [ACK] Seq=541 Ack=1249 Win=213 Len=0 TSval=774601 TSecr=681762
477 0.718768181 172.31.23.72 -> 172.31.31.144 OpenFlow 74 Type: OFPT_BARRIER_REPLY
478 0.718786789 172.31.23.72 -> 172.31.31.144 OpenFlow 74 Type: OFPT_BARRIER_REPLY
479 0.718789172 172.31.23.72 -> 172.31.31.144 OpenFlow 82 Type: OFPT_BARRIER_REPLY
480 0.718812478 172.31.23.72 -> 172.31.31.144 OpenFlow 74 Type: OFPT_BARRIER_REPLY
481 0.718845933 172.31.23.72 -> 172.31.31.144 OpenFlow 74 Type: OFPT_BARRIER_REPLY
482 0.718881539 172.31.23.72 -> 172.31.31.144 TCP 66 40196 → 6633 [ACK] Seq=493 Ack=217 Win=213 Len=0 TSval=774601 TSecr=681762
483 0.718885774 172.31.23.72 -> 172.31.31.144 OpenFlow 74 Type: OFPT_BARRIER_REPLY
484 0.718903842 172.31.23.72 -> 172.31.31.144 OpenFlow 74 Type: OFPT_BARRIER_REPLY
485 0.718939160 172.31.23.72 -> 172.31.31.144 TCP 66 40200 → 6633 [ACK] Seq=169 Ack=385 Win=401 Len=0 TSval=774601 TSecr=681762
486 0.718943280 172.31.23.72 -> 172.31.31.144 OpenFlow 74 Type: OFPT_BARRIER_REPLY
487 0.718961612 172.31.23.72 -> 172.31.31.144 OpenFlow 74 Type: OFPT_BARRIER_REPLY
488 0.719002299 172.31.23.72 -> 172.31.31.144 TCP 66 40210 → 6633 [ACK] Seq=415 Ack=593 Win=384 Len=0 TSval=774601 TSecr=681762
489 0.719006544 172.31.23.72 -> 172.31.31.144 OpenFlow 74 Type: OFPT_BARRIER_REPLY
490 0.719163089 172.31.23.72 -> 172.31.31.144 OpenFlow 82 Type: OFPT_BARRIER_REPLY
491 0.719170099 172.31.23.72 -> 172.31.31.144 OpenFlow 82 Type: OFPT_BARRIER_REPLY
492 0.719341943 172.31.31.144 -> 172.31.23.72 TCP 66 6633 → 40146 [ACK] Seq=2289 Ack=823 Win=853 Len=0 TSval=681762 TSecr=774601
493 0.719347661 172.31.31.144 -> 172.31.23.72 TCP 66 6633 → 40196 [ACK] Seq=217 Ack=501 Win=853 Len=0 TSval=681762 TSecr=774601
494 0.719527233 172.31.31.144 -> 172.31.23.72 TCP 66 6633 → 40194 [ACK] Seq=817 Ack=439 Win=853 Len=0 TSval=681762 TSecr=774601
495 0.719541466 172.31.31.144 -> 172.31.23.72 TCP 66 6633 → 40198 [ACK] Seq=817 Ack=685 Win=853 Len=0 TSval=681762 TSecr=774601
496 0.752571996 172.31.31.144 -> 172.31.23.72 TCP 66 6633 → 40204 [ACK] Seq=169 Ack=415 Win=853 Len=0 TSval=681771 TSecr=774600
497 0.756518728 172.31.31.144 -> 172.31.23.72 TCP 66 6633 → 40202 [ACK] Seq=489 Ack=177 Win=853 Len=0 TSval=681772 TSecr=774601
498 0.756523377 172.31.31.144 -> 172.31.23.72 TCP 66 6633 → 40200 [ACK] Seq=385 Ack=177 Win=853 Len=0 TSval=681772 TSecr=774601
499 0.756553264 172.31.31.144 -> 172.31.23.72 TCP 66 6633 → 40190 [ACK] Seq=489 Ack=669 Win=853 Len=0 TSval=681772 TSecr=774601
500 0.756603745 172.31.31.144 -> 172.31.23.72 TCP 66 6633 → 40156 [ACK] Seq=1249 Ack=549 Win=853 Len=0 TSval=681772 TSecr=774601
501 0.756606145 172.31.31.144 -> 172.31.23.72 TCP 66 6633 → 40140 [ACK] Seq=1521 Ack=225 Win=853 Len=0 TSval=681772 TSecr=774601
502 0.756608136 172.31.31.144 -> 172.31.23.72 TCP 66 6633 → 40142 [ACK] Seq=1201 Ack=955 Win=853 Len=0 TSval=681772 TSecr=774600
503 0.756618795 172.31.31.144 -> 172.31.23.72 TCP 66 6633 → 40210 [ACK] Seq=593 Ack=423 Win=853 Len=0 TSval=681772 TSecr=774601
504 0.756651791 172.31.31.144 -> 172.31.23.72 TCP 66 6633 → 40152 [ACK] Seq=1763 Ack=717 Win=853 Len=0 TSval=681772 TSecr=774601
505 0.756667894 172.31.31.144 -> 172.31.23.72 TCP 66 6633 → 40144 [ACK] Seq=1175 Ack=471 Win=853 Len=0 TSval=681772 TSecr=774601
506 0.756686104 172.31.31.144 -> 172.31.23.72 TCP 66 6633 → 40188 [ACK] Seq=657 Ack=1083 Win=853 Len=0 TSval=681772 TSecr=774601
507 0.911138000 172.31.23.72 -> 137.158.125.247 SSH 98 Server: Encrypted packet (len=44)
508 1.121881588 137.158.125.247 -> 172.31.23.72 TCP 54 52508 → 22 [ACK] Seq=1 Ack=437 Win=32364 Len=0
509 1.369110882 172.31.31.144 -> 172.31.23.72 OpenFlow 187 Type: OFPT_PACKET_OUT
510 1.369168224 172.31.31.144 -> 172.31.23.72 OpenFlow 187 Type: OFPT_PACKET_OUT
511 1.369173512 172.31.31.144 -> 172.31.23.72 OpenFlow 187 Type: OFPT_PACKET_OUT
512 1.369197406 172.31.31.144 -> 172.31.23.72 OpenFlow 187 Type: OFPT_PACKET_OUT
513 1.369258015 172.31.31.144 -> 172.31.23.72 OpenFlow 187 Type: OFPT_PACKET_OUT
514 1.369338053 172.31.31.144 -> 172.31.23.72 OpenFlow 187 Type: OFPT_PACKET_OUT
515 1.369382676 172.31.31.144 -> 172.31.23.72 OpenFlow 187 Type: OFPT_PACKET_OUT
516 1.369487885 172.31.31.144 -> 172.31.23.72 OpenFlow 187 Type: OFPT_PACKET_OUT
517 1.369515475 172.31.31.144 -> 172.31.23.72 OpenFlow 187 Type: OFPT_PACKET_OUT
518 1.369576947 172.31.31.144 -> 172.31.23.72 OpenFlow 187 Type: OFPT_PACKET_OUT
519 1.369932400 172.31.23.72 -> 172.31.31.144 TCP 66 40188 → 6633 [ACK] Seq=1083 Ack=1867 Win=213 Len=0 TSval=774764 TSecr=681925
520 1.370046696 172.31.23.72 -> 172.31.31.144 OpenFlow 189 Type: OFPT_PACKET_IN
521 1.370079484 172.31.23.72 -> 172.31.31.144 OpenFlow 189 Type: OFPT_PACKET_IN
522 1.370119587 172.31.23.72 -> 172.31.31.144 OpenFlow 189 Type: OFPT_PACKET_IN
523 1.370170410 172.31.23.72 -> 172.31.31.144 OpenFlow 189 Type: OFPT_PACKET_IN
524 1.370230943 172.31.23.72 -> 172.31.31.144 OpenFlow 189 Type: OFPT_PACKET_IN
525 1.370256042 172.31.23.72 -> 172.31.31.144 OpenFlow 189 Type: OFPT_PACKET_IN
526 1.370271917 172.31.23.72 -> 172.31.31.144 OpenFlow 189 Type: OFPT_PACKET_IN
527 1.370277922 172.31.31.144 -> 172.31.23.72 TCP 66 6633 → 40198 [ACK] Seq=817 Ack=931 Win=853 Len=0 TSval=681925 TSecr=774764
528 1.370318790 172.31.23.72 -> 172.31.31.144 OpenFlow 189 Type: OFPT_PACKET_IN
529 1.370327578 172.31.23.72 -> 172.31.31.144 OpenFlow 189 Type: OFPT_PACKET_IN
530 1.370355868 172.31.23.72 -> 172.31.31.144 OpenFlow 189 Type: OFPT_PACKET_IN
531 1.370386048 172.31.31.144 -> 172.31.23.72 TCP 66 6633 → 40142 [ACK] Seq=1201 Ack=1078 Win=853 Len=0 TSval=681925 TSecr=774764
532 1.370407165 172.31.31.144 -> 172.31.23.72 TCP 66 6633 → 40142 [ACK] Seq=1201 Ack=1201 Win=853 Len=0 TSval=681925 TSecr=774764
533 1.370450391 172.31.31.144 -> 172.31.23.72 TCP 66 6633 → 40148 [ACK] Seq=1275 Ack=418 Win=853 Len=0 TSval=681925 TSecr=774764
534 1.370469124 172.31.31.144 -> 172.31.23.72 TCP 66 6633 → 40148 [ACK] Seq=1275 Ack=541 Win=853 Len=0 TSval=681925 TSecr=774764
535 1.370487950 172.31.31.144 -> 172.31.23.72 TCP 66 6633 → 40152 [ACK] Seq=1763 Ack=840 Win=853 Len=0 TSval=681925 TSecr=774764
536 1.370507277 172.31.31.144 -> 172.31.23.72 TCP 66 6633 → 40152 [ACK] Seq=1763 Ack=963 Win=853 Len=0 TSval=681925 TSecr=774764
537 1.370753239 172.31.31.144 -> 172.31.23.72 TCP 66 6633 → 40216 [ACK] Seq=505 Ack=1323 Win=853 Len=0 TSval=681925 TSecr=774764
538 1.414097735 172.31.23.72 -> 137.158.125.247 SSH 98 Server: Encrypted packet (len=44)
539 1.468868812 172.31.31.144 -> 172.31.23.72 OpenFlow 90 Type: OFPT_MULTIPART_REQUEST, OFPMP_GROUP
540 1.468891217 172.31.31.144 -> 172.31.23.72 OpenFlow 90 Type: OFPT_MULTIPART_REQUEST, OFPMP_GROUP
541 1.468913168 172.31.31.144 -> 172.31.23.72 OpenFlow 90 Type: OFPT_MULTIPART_REQUEST, OFPMP_GROUP
542 1.468916640 172.31.31.144 -> 172.31.23.72 OpenFlow 90 Type: OFPT_MULTIPART_REQUEST, OFPMP_GROUP
543 1.468921246 172.31.31.144 -> 172.31.23.72 OpenFlow 90 Type: OFPT_MULTIPART_REQUEST, OFPMP_GROUP
544 1.468942541 172.31.31.144 -> 172.31.23.72 OpenFlow 82 Type: OFPT_MULTIPART_REQUEST, OFPMP_GROUP_DESC
545 1.468959871 172.31.31.144 -> 172.31.23.72 OpenFlow 106 Type: OFPT_MULTIPART_REQUEST, OFPMP_METER
546 1.468980469 172.31.31.144 -> 172.31.23.72 OpenFlow 106 Type: OFPT_MULTIPART_REQUEST, OFPMP_METER
547 1.468997292 172.31.31.144 -> 172.31.23.72 OpenFlow 90 Type: OFPT_MULTIPART_REQUEST, OFPMP_GROUP
548 1.469017898 172.31.31.144 -> 172.31.23.72 OpenFlow 106 Type: OFPT_MULTIPART_REQUEST, OFPMP_METER
549 1.469036118 172.31.31.144 -> 172.31.23.72 OpenFlow 90 Type: OFPT_MULTIPART_REQUEST, OFPMP_GROUP
550 1.469055287 172.31.31.144 -> 172.31.23.72 OpenFlow 106 Type: OFPT_MULTIPART_REQUEST, OFPMP_METER
551 1.469074215 172.31.31.144 -> 172.31.23.72 OpenFlow 90 Type: OFPT_MULTIPART_REQUEST, OFPMP_METER
552 1.469132926 172.31.31.144 -> 172.31.23.72 OpenFlow 90 Type: OFPT_MULTIPART_REQUEST, OFPMP_GROUP
553 1.469138590 172.31.31.144 -> 172.31.23.72 OpenFlow 90 Type: OFPT_MULTIPART_REQUEST, OFPMP_GROUP
554 1.469140941 172.31.31.144 -> 172.31.23.72 OpenFlow 90 Type: OFPT_MULTIPART_REQUEST, OFPMP_GROUP
555 1.469162902 172.31.31.144 -> 172.31.23.72 OpenFlow 106 Type: OFPT_MULTIPART_REQUEST, OFPMP_METER
556 1.469182184 172.31.31.144 -> 172.31.23.72 OpenFlow 90 Type: OFPT_MULTIPART_REQUEST, OFPMP_GROUP
557 1.469200472 172.31.31.144 -> 172.31.23.72 OpenFlow 90 Type: OFPT_MULTIPART_REQUEST, OFPMP_GROUP
558 1.469211422 172.31.23.72 -> 172.31.31.144 OpenFlow 82 Type: OFPT_MULTIPART_REPLY, OFPMP_GROUP
559 1.469221583 172.31.31.144 -> 172.31.23.72 OpenFlow 106 Type: OFPT_MULTIPART_REQUEST, OFPMP_METER
560 1.469238408 172.31.23.72 -> 172.31.31.144 OpenFlow 82 Type: OFPT_MULTIPART_REPLY, OFPMP_GROUP_DESC
561 1.469266280 172.31.31.144 -> 172.31.23.72 OpenFlow 106 Type: OFPT_MULTIPART_REQUEST, OFPMP_METER
562 1.469269641 172.31.31.144 -> 172.31.23.72 OpenFlow 106 Type: OFPT_MULTIPART_REQUEST, OFPMP_METER
563 1.469274228 172.31.23.72 -> 172.31.31.144 OpenFlow 82 Type: OFPT_MULTIPART_REPLY, OFPMP_METER
564 1.469289891 172.31.31.144 -> 172.31.23.72 OpenFlow 90 Type: OFPT_MULTIPART_REQUEST, OFPMP_GROUP
565 1.469298417 172.31.23.72 -> 172.31.31.144 OpenFlow 82 Type: OFPT_MULTIPART_REPLY, OFPMP_GROUP
566 1.469314655 172.31.31.144 -> 172.31.23.72 OpenFlow 106 Type: OFPT_MULTIPART_REQUEST, OFPMP_METER
567 1.469318706 172.31.23.72 -> 172.31.31.144 OpenFlow 82 Type: OFPT_MULTIPART_REPLY, OFPMP_GROUP_DESC
568 1.469345439 172.31.23.72 -> 172.31.31.144 OpenFlow 82 Type: OFPT_MULTIPART_REPLY, OFPMP_GROUP
569 1.469354053 172.31.31.144 -> 172.31.23.72 OpenFlow 90 Type: OFPT_MULTIPART_REQUEST, OFPMP_GROUP
570 1.469357797 172.31.31.144 -> 172.31.23.72 OpenFlow 106 Type: OFPT_MULTIPART_REQUEST, OFPMP_METER
571 1.469361285 172.31.23.72 -> 172.31.31.144 OpenFlow 82 Type: OFPT_MULTIPART_REPLY, OFPMP_METER
572 1.469374949 172.31.31.144 -> 172.31.23.72 OpenFlow 106 Type: OFPT_MULTIPART_REQUEST, OFPMP_METER
573 1.469389349 172.31.23.72 -> 172.31.31.144 OpenFlow 82 Type: OFPT_MULTIPART_REPLY, OFPMP_GROUP
574 1.469394760 172.31.23.72 -> 172.31.31.144 OpenFlow 98 Type: OFPT_MULTIPART_REPLY, OFPMP_METER
575 1.469408620 172.31.23.72 -> 172.31.31.144 OpenFlow 82 Type: OFPT_MULTIPART_REPLY, OFPMP_GROUP
576 1.469433846 172.31.31.144 -> 172.31.23.72 OpenFlow 106 Type: OFPT_MULTIPART_REQUEST, OFPMP_METER
577 1.469436624 172.31.31.144 -> 172.31.23.72 OpenFlow 106 Type: OFPT_MULTIPART_REQUEST, OFPMP_METER
578 1.469446521 172.31.23.72 -> 172.31.31.144 OpenFlow 82 Type: OFPT_MULTIPART_REPLY, OFPMP_GROUP
579 1.469469138 172.31.23.72 -> 172.31.31.144 OpenFlow 82 Type: OFPT_MULTIPART_REPLY, OFPMP_GROUP
580 1.469486097 172.31.23.72 -> 172.31.31.144 OpenFlow 82 Type: OFPT_MULTIPART_REPLY, OFPMP_GROUP
581 1.469502265 172.31.23.72 -> 172.31.31.144 OpenFlow 82 Type: OFPT_MULTIPART_REPLY, OFPMP_GROUP
582 1.469504368 172.31.23.72 -> 172.31.31.144 OpenFlow 98 Type: OFPT_MULTIPART_REPLY, OFPMP_METER
583 1.469537011 172.31.31.144 -> 172.31.23.72 OpenFlow 90 Type: OFPT_MULTIPART_REQUEST, OFPMP_GROUP
584 1.469540098 172.31.31.144 -> 172.31.23.72 OpenFlow 106 Type: OFPT_MULTIPART_REQUEST, OFPMP_METER
585 1.469541807 172.31.31.144 -> 172.31.23.72 TCP 66 6633 → 40188 [ACK] Seq=1931 Ack=1099 Win=853 Len=0 TSval=681950 TSecr=774788
586 1.469546091 172.31.31.144 -> 172.31.23.72 TCP 66 6633 → 40188 [ACK] Seq=1931 Ack=1115 Win=853 Len=0 TSval=681950 TSecr=774788
587 1.469550823 172.31.23.72 -> 172.31.31.144 OpenFlow 82 Type: OFPT_MULTIPART_REPLY, OFPMP_GROUP
588 1.469561546 172.31.23.72 -> 172.31.31.144 OpenFlow 98 Type: OFPT_MULTIPART_REPLY, OFPMP_METER
589 1.469582357 172.31.23.72 -> 172.31.31.144 OpenFlow 82 Type: OFPT_MULTIPART_REPLY, OFPMP_GROUP
590 1.469584736 172.31.23.72 -> 172.31.31.144 OpenFlow 98 Type: OFPT_MULTIPART_REPLY, OFPMP_METER
591 1.469602905 172.31.23.72 -> 172.31.31.144 OpenFlow 82 Type: OFPT_MULTIPART_REPLY, OFPMP_GROUP
592 1.469605089 172.31.23.72 -> 172.31.31.144 OpenFlow 98 Type: OFPT_MULTIPART_REPLY, OFPMP_METER
593 1.469622888 172.31.23.72 -> 172.31.31.144 OpenFlow 82 Type: OFPT_MULTIPART_REPLY, OFPMP_GROUP
594 1.469625023 172.31.23.72 -> 172.31.31.144 OpenFlow 98 Type: OFPT_MULTIPART_REPLY, OFPMP_METER
595 1.469670245 172.31.23.72 -> 172.31.31.144 OpenFlow 82 Type: OFPT_MULTIPART_REPLY, OFPMP_GROUP
596 1.469694351 172.31.31.144 -> 172.31.23.72 TCP 66 6633 → 40188 [ACK] Seq=1931 Ack=1131 Win=853 Len=0 TSval=681950 TSecr=774788
597 1.469699345 172.31.31.144 -> 172.31.23.72 TCP 66 6633 → 40192 [ACK] Seq=65 Ack=509 Win=853 Len=0 TSval=681950 TSecr=774788
598 1.469701588 172.31.31.144 -> 172.31.23.72 TCP 66 6633 → 40192 [ACK] Seq=65 Ack=525 Win=853 Len=0 TSval=681950 TSecr=774788
599 1.469703237 172.31.31.144 -> 172.31.23.72 TCP 66 6633 → 40192 [ACK] Seq=65 Ack=541 Win=853 Len=0 TSval=681950 TSecr=774788
600 1.469704946 172.31.31.144 -> 172.31.23.72 TCP 66 6633 → 40196 [ACK] Seq=281 Ack=517 Win=853 Len=0 TSval=681950 TSecr=774788
601 1.469793051 172.31.23.72 -> 172.31.31.144 OpenFlow 98 Type: OFPT_MULTIPART_REPLY, OFPMP_METER
602 1.469799576 172.31.23.72 -> 172.31.31.144 OpenFlow 98 Type: OFPT_MULTIPART_REPLY, OFPMP_METER
603 1.469801602 172.31.23.72 -> 172.31.31.144 OpenFlow 98 Type: OFPT_MULTIPART_REPLY, OFPMP_METER
604 1.469855397 172.31.23.72 -> 172.31.31.144 OpenFlow 82 Type: OFPT_MULTIPART_REPLY, OFPMP_GROUP
605 1.469858147 172.31.23.72 -> 172.31.31.144 OpenFlow 98 Type: OFPT_MULTIPART_REPLY, OFPMP_METER
606 1.469883605 172.31.23.72 -> 172.31.31.144 OpenFlow 82 Type: OFPT_MULTIPART_REPLY, OFPMP_GROUP_DESC
607 1.469885772 172.31.23.72 -> 172.31.31.144 OpenFlow 98 Type: OFPT_MULTIPART_REPLY, OFPMP_METER
608 1.469945181 172.31.31.144 -> 172.31.23.72 TCP 66 6633 → 40194 [ACK] Seq=881 Ack=487 Win=853 Len=0 TSval=681950 TSecr=774788
609 1.469950267 172.31.31.144 -> 172.31.23.72 TCP 66 6633 → 40200 [ACK] Seq=449 Ack=193 Win=853 Len=0 TSval=681950 TSecr=774788
610 1.469952310 172.31.31.144 -> 172.31.23.72 TCP 66 6633 → 40202 [ACK] Seq=553 Ack=193 Win=853 Len=0 TSval=681950 TSecr=774788
611 1.469954174 172.31.31.144 -> 172.31.23.72 TCP 66 6633 → 40204 [ACK] Seq=233 Ack=431 Win=853 Len=0 TSval=681950 TSecr=774788
612 1.469955918 172.31.31.144 -> 172.31.23.72 TCP 66 6633 → 40206 [ACK] Seq=65 Ack=263 Win=853 Len=0 TSval=681950 TSecr=774788
613 1.469957946 172.31.31.144 -> 172.31.23.72 TCP 66 6633 → 40198 [ACK] Seq=881 Ack=979 Win=853 Len=0 TSval=681950 TSecr=774788
614 1.469959760 172.31.31.144 -> 172.31.23.72 TCP 66 6633 → 40208 [ACK] Seq=65 Ack=509 Win=853 Len=0 TSval=681950 TSecr=774788
615 1.469961625 172.31.31.144 -> 172.31.23.72 TCP 66 6633 → 40210 [ACK] Seq=657 Ack=439 Win=853 Len=0 TSval=681950 TSecr=774788
616 1.469963483 172.31.31.144 -> 172.31.23.72 TCP 66 6633 → 40200 [ACK] Seq=449 Ack=225 Win=853 Len=0 TSval=681950 TSecr=774788
617 1.469965405 172.31.31.144 -> 172.31.23.72 TCP 66 6633 → 40202 [ACK] Seq=553 Ack=225 Win=853 Len=0 TSval=681950 TSecr=774788
618 1.470019348 172.31.23.72 -> 172.31.31.144 OpenFlow 98 Type: OFPT_MULTIPART_REPLY, OFPMP_METER
619 1.470077882 172.31.23.72 -> 172.31.31.144 OpenFlow 82 Type: OFPT_MULTIPART_REPLY, OFPMP_METER
620 1.470103273 172.31.31.144 -> 172.31.23.72 TCP 66 6633 → 40212 [ACK] Seq=65 Ack=755 Win=853 Len=0 TSval=681950 TSecr=774788
621 1.470106776 172.31.31.144 -> 172.31.23.72 TCP 66 6633 → 40204 [ACK] Seq=233 Ack=463 Win=853 Len=0 TSval=681950 TSecr=774788
622 1.470108824 172.31.31.144 -> 172.31.23.72 TCP 66 6633 → 40206 [ACK] Seq=65 Ack=295 Win=853 Len=0 TSval=681950 TSecr=774788
623 1.470110640 172.31.31.144 -> 172.31.23.72 TCP 66 6633 → 40208 [ACK] Seq=65 Ack=541 Win=853 Len=0 TSval=681950 TSecr=774789
624 1.470177574 172.31.31.144 -> 172.31.23.72 TCP 66 6633 → 40210 [ACK] Seq=657 Ack=471 Win=853 Len=0 TSval=681950 TSecr=774789
625 1.470179861 172.31.31.144 -> 172.31.23.72 TCP 66 6633 → 40212 [ACK] Seq=65 Ack=787 Win=853 Len=0 TSval=681950 TSecr=774789
626 1.470181532 172.31.31.144 -> 172.31.23.72 TCP 66 6633 → 40190 [ACK] Seq=553 Ack=685 Win=853 Len=0 TSval=681950 TSecr=774789
627 1.470185143 172.31.31.144 -> 172.31.23.72 TCP 66 6633 → 40196 [ACK] Seq=281 Ack=533 Win=853 Len=0 TSval=681950 TSecr=774789
628 1.470207110 172.31.31.144 -> 172.31.23.72 TCP 66 6633 → 40214 [ACK] Seq=569 Ack=1125 Win=853 Len=0 TSval=681950 TSecr=774788
629 1.470253662 172.31.31.144 -> 172.31.23.72 TCP 66 6633 → 40216 [ACK] Seq=569 Ack=1371 Win=853 Len=0 TSval=681950 TSecr=774789
630 1.470255991 172.31.31.144 -> 172.31.23.72 TCP 66 6633 → 40190 [ACK] Seq=553 Ack=717 Win=853 Len=0 TSval=681950 TSecr=774789
631 1.470281401 172.31.31.144 -> 172.31.23.72 TCP 66 6633 → 40196 [ACK] Seq=281 Ack=549 Win=853 Len=0 TSval=681950 TSecr=774789
632 1.569426339 172.31.31.144 -> 172.31.23.72 OpenFlow 187 Type: OFPT_PACKET_OUT
633 1.569463925 172.31.31.144 -> 172.31.23.72 OpenFlow 187 Type: OFPT_PACKET_OUT
634 1.569486119 172.31.31.144 -> 172.31.23.72 OpenFlow 187 Type: OFPT_PACKET_OUT
635 1.569531019 172.31.31.144 -> 172.31.23.72 OpenFlow 187 Type: OFPT_PACKET_OUT
636 1.569657788 172.31.31.144 -> 172.31.23.72 OpenFlow 187 Type: OFPT_PACKET_OUT
637 1.569681502 172.31.31.144 -> 172.31.23.72 OpenFlow 187 Type: OFPT_PACKET_OUT
638 1.569711394 172.31.31.144 -> 172.31.23.72 OpenFlow 187 Type: OFPT_PACKET_OUT
639 1.569806372 172.31.31.144 -> 172.31.23.72 OpenFlow 187 Type: OFPT_PACKET_OUT
640 1.569873342 172.31.31.144 -> 172.31.23.72 OpenFlow 187 Type: OFPT_PACKET_OUT
641 1.569907853 172.31.31.144 -> 172.31.23.72 OpenFlow 187 Type: OFPT_PACKET_OUT
642 1.569966635 172.31.31.144 -> 172.31.23.72 OpenFlow 187 Type: OFPT_PACKET_OUT
643 1.570043107 172.31.31.144 -> 172.31.23.72 OpenFlow 187 Type: OFPT_PACKET_OUT
644 1.570052660 172.31.23.72 -> 172.31.31.144 TCP 66 40204 → 6633 [ACK] Seq=463 Ack=1201 Win=308 Len=0 TSval=774814 TSecr=681975
645 1.570155869 172.31.31.144 -> 172.31.23.72 OpenFlow 187 Type: OFPT_PACKET_OUT
646 1.570179852 172.31.31.144 -> 172.31.23.72 OpenFlow 187 Type: OFPT_PACKET_OUT
647 1.570209182 172.31.31.144 -> 172.31.23.72 OpenFlow 187 Type: OFPT_PACKET_OUT
648 1.570308277 172.31.31.144 -> 172.31.23.72 OpenFlow 187 Type: OFPT_PACKET_OUT
649 1.570335896 172.31.23.72 -> 172.31.31.144 OpenFlow 189 Type: OFPT_PACKET_IN
650 1.570357158 172.31.31.144 -> 172.31.23.72 OpenFlow 187 Type: OFPT_PACKET_OUT
651 1.570363438 172.31.23.72 -> 172.31.31.144 OpenFlow 189 Type: OFPT_PACKET_IN
652 1.570412778 172.31.31.144 -> 172.31.23.72 OpenFlow 187 Type: OFPT_PACKET_OUT
653 1.570503974 172.31.31.144 -> 172.31.23.72 TCP 66 6633 → 40208 [ACK] Seq=65 Ack=664 Win=853 Len=0 TSval=681975 TSecr=774814
654 1.570528404 172.31.31.144 -> 172.31.23.72 TCP 66 6633 → 40208 [ACK] Seq=65 Ack=787 Win=853 Len=0 TSval=681975 TSecr=774814
655 1.570571299 172.31.31.144 -> 172.31.23.72 OpenFlow 187 Type: OFPT_PACKET_OUT
656 1.570594239 172.31.31.144 -> 172.31.23.72 OpenFlow 187 Type: OFPT_PACKET_OUT
657 1.570621715 172.31.31.144 -> 172.31.23.72 OpenFlow 187 Type: OFPT_PACKET_OUT
658 1.570656493 172.31.31.144 -> 172.31.23.72 OpenFlow 187 Type: OFPT_PACKET_OUT
659 1.570681349 172.31.23.72 -> 172.31.31.144 TCP 66 40212 → 6633 [ACK] Seq=787 Ack=791 Win=385 Len=0 TSval=774814 TSecr=681975
660 1.570767964 172.31.31.144 -> 172.31.23.72 OpenFlow 187 Type: OFPT_PACKET_OUT
661 1.570840077 172.31.31.144 -> 172.31.23.72 OpenFlow 187 Type: OFPT_PACKET_OUT
662 1.570887001 172.31.31.144 -> 172.31.23.72 OpenFlow 187 Type: OFPT_PACKET_OUT
663 1.570921359 172.31.23.72 -> 172.31.31.144 TCP 66 40214 → 6633 [ACK] Seq=1125 Ack=1053 Win=200 Len=0 TSval=774814 TSecr=681975
664 1.570965564 172.31.31.144 -> 172.31.23.72 OpenFlow 187 Type: OFPT_PACKET_OUT
665 1.571036765 172.31.31.144 -> 172.31.23.72 OpenFlow 187 Type: OFPT_PACKET_OUT
666 1.571094588 172.31.23.72 -> 172.31.31.144 OpenFlow 189 Type: OFPT_PACKET_IN
667 1.571117454 172.31.31.144 -> 172.31.23.72 OpenFlow 187 Type: OFPT_PACKET_OUT
668 1.571123369 172.31.23.72 -> 172.31.31.144 OpenFlow 189 Type: OFPT_PACKET_IN
669 1.571148476 172.31.23.72 -> 172.31.31.144 OpenFlow 189 Type: OFPT_PACKET_IN
670 1.571170887 172.31.31.144 -> 172.31.23.72 OpenFlow 187 Type: OFPT_PACKET_OUT
671 1.571176428 172.31.23.72 -> 172.31.31.144 OpenFlow 189 Type: OFPT_PACKET_IN
672 1.571187140 172.31.23.72 -> 172.31.31.144 OpenFlow 189 Type: OFPT_PACKET_IN
673 1.571220829 172.31.23.72 -> 172.31.31.144 OpenFlow 189 Type: OFPT_PACKET_IN
674 1.571226906 172.31.31.144 -> 172.31.23.72 OpenFlow 187 Type: OFPT_PACKET_OUT
675 1.571252572 172.31.23.72 -> 172.31.31.144 OpenFlow 189 Type: OFPT_PACKET_IN
676 1.571257857 172.31.23.72 -> 172.31.31.144 OpenFlow 189 Type: OFPT_PACKET_IN
677 1.571260127 172.31.23.72 -> 172.31.31.144 OpenFlow 189 Type: OFPT_PACKET_IN
678 1.571284064 172.31.31.144 -> 172.31.23.72 TCP 66 6633 → 40140 [ACK] Seq=1521 Ack=348 Win=853 Len=0 TSval=681975 TSecr=774814
679 1.571314692 172.31.23.72 -> 172.31.31.144 OpenFlow 435 Type: OFPT_PACKET_IN
680 1.571388749 172.31.31.144 -> 172.31.23.72 TCP 66 6633 → 40140 [ACK] Seq=1521 Ack=471 Win=853 Len=0 TSval=681975 TSecr=774814
681 1.571394780 172.31.31.144 -> 172.31.23.72 OpenFlow 187 Type: OFPT_PACKET_OUT
682 1.571397531 172.31.31.144 -> 172.31.23.72 OpenFlow 187 Type: OFPT_PACKET_OUT
683 1.571399165 172.31.31.144 -> 172.31.23.72 TCP 66 6633 → 40146 [ACK] Seq=2289 Ack=1069 Win=853 Len=0 TSval=681975 TSecr=774814
684 1.571416657 172.31.31.144 -> 172.31.23.72 TCP 66 6633 → 40150 [ACK] Seq=1275 Ack=418 Win=853 Len=0 TSval=681975 TSecr=774814
685 1.571432185 172.31.31.144 -> 172.31.23.72 TCP 66 6633 → 40152 [ACK] Seq=1763 Ack=1086 Win=853 Len=0 TSval=681975 TSecr=774814
686 1.571463461 172.31.31.144 -> 172.31.23.72 OpenFlow 187 Type: OFPT_PACKET_OUT
687 1.571504340 172.31.31.144 -> 172.31.23.72 TCP 66 6633 → 40154 [ACK] Seq=1443 Ack=586 Win=853 Len=0 TSval=681975 TSecr=774814
688 1.571529307 172.31.31.144 -> 172.31.23.72 TCP 66 6633 → 40152 [ACK] Seq=1763 Ack=1209 Win=853 Len=0 TSval=681975 TSecr=774814
689 1.571557011 172.31.31.144 -> 172.31.23.72 TCP 66 6633 → 40150 [ACK] Seq=1275 Ack=541 Win=853 Len=0 TSval=681975 TSecr=774814
690 1.571584559 172.31.31.144 -> 172.31.23.72 OpenFlow 187 Type: OFPT_PACKET_OUT
691 1.571611825 172.31.31.144 -> 172.31.23.72 TCP 66 6633 → 40154 [ACK] Seq=1443 Ack=955 Win=853 Len=0 TSval=681975 TSecr=774814
692 1.571640187 172.31.31.144 -> 172.31.23.72 OpenFlow 187 Type: OFPT_PACKET_OUT
693 1.571666967 172.31.31.144 -> 172.31.23.72 OpenFlow 187 Type: OFPT_PACKET_OUT
694 1.571693589 172.31.31.144 -> 172.31.23.72 OpenFlow 187 Type: OFPT_PACKET_OUT
695 1.571710230 172.31.23.72 -> 172.31.31.144 TCP 66 40192 → 6633 [ACK] Seq=541 Ack=1033 Win=383 Len=0 TSval=774814 TSecr=681975
696 1.571742657 172.31.31.144 -> 172.31.23.72 OpenFlow 187 Type: OFPT_PACKET_OUT
697 1.571796900 172.31.31.144 -> 172.31.23.72 OpenFlow 187 Type: OFPT_PACKET_OUT
698 1.571813051 172.31.23.72 -> 172.31.31.144 OpenFlow 189 Type: OFPT_PACKET_IN
699 1.571830762 172.31.23.72 -> 172.31.31.144 TCP 66 40198 → 6633 [ACK] Seq=979 Ack=1849 Win=384 Len=0 TSval=774814 TSecr=681975
700 1.571881220 172.31.23.72 -> 172.31.31.144 OpenFlow 189 Type: OFPT_PACKET_IN
701 1.571994169 172.31.31.144 -> 172.31.23.72 TCP 66 6633 → 40196 [ACK] Seq=281 Ack=672 Win=853 Len=0 TSval=681975 TSecr=774814
702 1.572030004 172.31.31.144 -> 172.31.23.72 TCP 66 6633 → 40196 [ACK] Seq=281 Ack=795 Win=853 Len=0 TSval=681975 TSecr=774814
703 1.572054516 172.31.31.144 -> 172.31.23.72 OpenFlow 187 Type: OFPT_PACKET_OUT
704 1.572137713 172.31.31.144 -> 172.31.23.72 OpenFlow 187 Type: OFPT_PACKET_OUT
705 1.572180733 172.31.31.144 -> 172.31.23.72 OpenFlow 187 Type: OFPT_PACKET_OUT
706 1.572247920 172.31.31.144 -> 172.31.23.72 OpenFlow 187 Type: OFPT_PACKET_OUT
707 1.572257180 172.31.23.72 -> 172.31.31.144 OpenFlow 189 Type: OFPT_PACKET_IN
708 1.572278483 172.31.23.72 -> 172.31.31.144 OpenFlow 189 Type: OFPT_PACKET_IN
709 1.572291046 172.31.23.72 -> 172.31.31.144 OpenFlow 189 Type: OFPT_PACKET_IN
710 1.572302615 172.31.31.144 -> 172.31.23.72 OpenFlow 187 Type: OFPT_PACKET_OUT
711 1.572339489 172.31.23.72 -> 172.31.31.144 OpenFlow 189 Type: OFPT_PACKET_IN
712 1.572384498 172.31.31.144 -> 172.31.23.72 OpenFlow 187 Type: OFPT_PACKET_OUT
713 1.572442455 172.31.31.144 -> 172.31.23.72 TCP 66 6633 → 40202 [ACK] Seq=553 Ack=348 Win=853 Len=0 TSval=681975 TSecr=774814
714 1.572447589 172.31.31.144 -> 172.31.23.72 TCP 66 6633 → 40202 [ACK] Seq=553 Ack=471 Win=853 Len=0 TSval=681975 TSecr=774814
715 1.572456448 172.31.23.72 -> 172.31.31.144 TCP 66 40210 → 6633 [ACK] Seq=471 Ack=1262 Win=383 Len=0 TSval=774814 TSecr=681975
716 1.572476266 172.31.31.144 -> 172.31.23.72 OpenFlow 187 Type: OFPT_PACKET_OUT
717 1.572500445 172.31.31.144 -> 172.31.23.72 TCP 66 6633 → 40206 [ACK] Seq=65 Ack=418 Win=853 Len=0 TSval=681976 TSecr=774814
718 1.572527530 172.31.31.144 -> 172.31.23.72 TCP 66 6633 → 40206 [ACK] Seq=65 Ack=541 Win=853 Len=0 TSval=681976 TSecr=774814
719 1.572652212 172.31.31.144 -> 172.31.23.72 OpenFlow 187 Type: OFPT_PACKET_OUT
720 1.572791255 172.31.23.72 -> 172.31.31.144 OpenFlow 189 Type: OFPT_PACKET_IN
721 1.572815594 172.31.23.72 -> 172.31.31.144 OpenFlow 435 Type: OFPT_PACKET_IN
722 1.572835144 172.31.23.72 -> 172.31.31.144 OpenFlow 189 Type: OFPT_PACKET_IN
723 1.572849306 172.31.31.144 -> 172.31.23.72 OpenFlow 187 Type: OFPT_PACKET_OUT
724 1.572855394 172.31.23.72 -> 172.31.31.144 OpenFlow 189 Type: OFPT_PACKET_IN
725 1.572881422 172.31.23.72 -> 172.31.31.144 OpenFlow 189 Type: OFPT_PACKET_IN
726 1.572883662 172.31.23.72 -> 172.31.31.144 OpenFlow 189 Type: OFPT_PACKET_IN
727 1.572896763 172.31.23.72 -> 172.31.31.144 OpenFlow 189 Type: OFPT_PACKET_IN
728 1.572902191 172.31.23.72 -> 172.31.31.144 OpenFlow 189 Type: OFPT_PACKET_IN
729 1.572968988 172.31.31.144 -> 172.31.23.72 OpenFlow 187 Type: OFPT_PACKET_OUT
730 1.572974017 172.31.31.144 -> 172.31.23.72 TCP 66 6633 → 40144 [ACK] Seq=1175 Ack=594 Win=853 Len=0 TSval=681976 TSecr=774814
731 1.572980349 172.31.23.72 -> 172.31.31.144 OpenFlow 189 Type: OFPT_PACKET_IN
732 1.572986265 172.31.23.72 -> 172.31.31.144 OpenFlow 189 Type: OFPT_PACKET_IN
733 1.573015630 172.31.31.144 -> 172.31.23.72 TCP 66 6633 → 40144 [ACK] Seq=1175 Ack=963 Win=853 Len=0 TSval=681976 TSecr=774814
734 1.573019844 172.31.31.144 -> 172.31.23.72 OpenFlow 187 Type: OFPT_PACKET_OUT
735 1.573063783 172.31.31.144 -> 172.31.23.72 TCP 66 6633 → 40148 [ACK] Seq=1275 Ack=664 Win=853 Len=0 TSval=681976 TSecr=774814
736 1.573068754 172.31.31.144 -> 172.31.23.72 TCP 66 6633 → 40150 [ACK] Seq=1275 Ack=664 Win=853 Len=0 TSval=681976 TSecr=774814
737 1.573084811 172.31.31.144 -> 172.31.23.72 TCP 66 6633 → 40156 [ACK] Seq=1249 Ack=672 Win=853 Len=0 TSval=681976 TSecr=774814
738 1.573111875 172.31.31.144 -> 172.31.23.72 TCP 66 6633 → 40148 [ACK] Seq=1275 Ack=787 Win=853 Len=0 TSval=681976 TSecr=774814
739 1.573162465 172.31.31.144 -> 172.31.23.72 OpenFlow 187 Type: OFPT_PACKET_OUT
740 1.573166892 172.31.31.144 -> 172.31.23.72 TCP 66 6633 → 40188 [ACK] Seq=1931 Ack=1254 Win=853 Len=0 TSval=681976 TSecr=774814
741 1.573180027 172.31.23.72 -> 172.31.31.144 TCP 66 40190 → 6633 [ACK] Seq=717 Ack=1279 Win=385 Len=0 TSval=774814 TSecr=681975
742 1.573201876 172.31.31.144 -> 172.31.23.72 TCP 66 6633 → 40150 [ACK] Seq=1275 Ack=787 Win=853 Len=0 TSval=681976 TSecr=774814
743 1.573224738 172.31.31.144 -> 172.31.23.72 OpenFlow 187 Type: OFPT_PACKET_OUT
744 1.573256970 172.31.31.144 -> 172.31.23.72 TCP 66 6633 → 40156 [ACK] Seq=1249 Ack=795 Win=853 Len=0 TSval=681976 TSecr=774814
745 1.573278764 172.31.23.72 -> 172.31.31.144 OpenFlow 189 Type: OFPT_PACKET_IN
746 1.573287627 172.31.31.144 -> 172.31.23.72 TCP 66 6633 → 40188 [ACK] Seq=1931 Ack=1377 Win=853 Len=0 TSval=681976 TSecr=774814
747 1.573300399 172.31.23.72 -> 172.31.31.144 OpenFlow 189 Type: OFPT_PACKET_IN
748 1.573344424 172.31.31.144 -> 172.31.23.72 OpenFlow 187 Type: OFPT_PACKET_OUT
749 1.573350853 172.31.31.144 -> 172.31.23.72 OpenFlow 187 Type: OFPT_PACKET_OUT
750 1.573376757 172.31.31.144 -> 172.31.23.72 OpenFlow 187 Type: OFPT_PACKET_OUT
751 1.573462531 172.31.31.144 -> 172.31.23.72 TCP 66 6633 → 40194 [ACK] Seq=1607 Ack=733 Win=853 Len=0 TSval=681976 TSecr=774814
752 1.573616656 172.31.23.72 -> 172.31.31.144 OpenFlow 189 Type: OFPT_PACKET_IN
753 1.573639540 172.31.23.72 -> 172.31.31.144 OpenFlow 189 Type: OFPT_PACKET_IN
754 1.573666477 172.31.23.72 -> 172.31.31.144 OpenFlow 189 Type: OFPT_PACKET_IN
755 1.573688183 172.31.23.72 -> 172.31.31.144 OpenFlow 189 Type: OFPT_PACKET_IN
756 1.573693399 172.31.23.72 -> 172.31.31.144 OpenFlow 189 Type: OFPT_PACKET_IN
757 1.573745214 172.31.23.72 -> 172.31.31.144 OpenFlow 189 Type: OFPT_PACKET_IN
758 1.573786348 172.31.31.144 -> 172.31.23.72 TCP 66 6633 → 40196 [ACK] Seq=281 Ack=918 Win=853 Len=0 TSval=681976 TSecr=774814
759 1.573806561 172.31.31.144 -> 172.31.23.72 TCP 66 6633 → 40196 [ACK] Seq=281 Ack=1041 Win=853 Len=0 TSval=681976 TSecr=774814
760 1.573852277 172.31.23.72 -> 172.31.31.144 TCP 66 40208 → 6633 [ACK] Seq=787 Ack=428 Win=384 Len=0 TSval=774815 TSecr=681976
761 1.573882198 172.31.31.144 -> 172.31.23.72 TCP 66 6633 → 40200 [ACK] Seq=449 Ack=348 Win=853 Len=0 TSval=681976 TSecr=774815
762 1.573913417 172.31.31.144 -> 172.31.23.72 TCP 66 6633 → 40200 [ACK] Seq=449 Ack=471 Win=853 Len=0 TSval=681976 TSecr=774815
763 1.573943404 172.31.31.144 -> 172.31.23.72 OpenFlow 187 Type: OFPT_PACKET_OUT
764 1.573964063 172.31.23.72 -> 172.31.31.144 OpenFlow 189 Type: OFPT_PACKET_IN
765 1.573973155 172.31.31.144 -> 172.31.23.72 OpenFlow 187 Type: OFPT_PACKET_OUT
766 1.573984861 172.31.23.72 -> 172.31.31.144 OpenFlow 189 Type: OFPT_PACKET_IN
767 1.574009952 172.31.31.144 -> 172.31.23.72 OpenFlow 550 Type: OFPT_PACKET_OUT
768 1.574078732 172.31.23.72 -> 172.31.31.144 OpenFlow 189 Type: OFPT_PACKET_IN
769 1.574106458 172.31.23.72 -> 172.31.31.144 OpenFlow 435 Type: OFPT_PACKET_IN
770 1.574122105 172.31.23.72 -> 172.31.31.144 OpenFlow 189 Type: OFPT_PACKET_IN
771 1.574147793 172.31.23.72 -> 172.31.31.144 OpenFlow 189 Type: OFPT_PACKET_IN
772 1.574165355 172.31.31.144 -> 172.31.23.72 TCP 66 6633 → 40198 [ACK] Seq=1849 Ack=1225 Win=853 Len=0 TSval=681976 TSecr=774815
773 1.574169931 172.31.31.144 -> 172.31.23.72 TCP 66 6633 → 40216 [ACK] Seq=569 Ack=1617 Win=853 Len=0 TSval=681976 TSecr=774815
774 1.574218135 172.31.23.72 -> 172.31.31.144 OpenFlow 189 Type: OFPT_PACKET_IN
775 1.574260725 172.31.31.144 -> 172.31.23.72 TCP 66 6633 → 40140 [ACK] Seq=1521 Ack=594 Win=853 Len=0 TSval=681976 TSecr=774815
776 1.574268312 172.31.23.72 -> 172.31.31.144 OpenFlow 189 Type: OFPT_PACKET_IN
777 1.574315785 172.31.23.72 -> 172.31.31.144 OpenFlow 189 Type: OFPT_PACKET_IN
778 1.574320944 172.31.31.144 -> 172.31.23.72 TCP 66 6633 → 40140 [ACK] Seq=1521 Ack=963 Win=853 Len=0 TSval=681976 TSecr=774815
779 1.574342722 172.31.23.72 -> 172.31.31.144 OpenFlow 189 Type: OFPT_PACKET_IN
780 1.574361448 172.31.31.144 -> 172.31.23.72 OpenFlow 187 Type: OFPT_PACKET_OUT
781 1.574384758 172.31.31.144 -> 172.31.23.72 TCP 66 6633 → 40152 [ACK] Seq=1763 Ack=1332 Win=853 Len=0 TSval=681976 TSecr=774815
782 1.574407337 172.31.31.144 -> 172.31.23.72 OpenFlow 187 Type: OFPT_PACKET_OUT
783 1.574450030 172.31.31.144 -> 172.31.23.72 OpenFlow 187 Type: OFPT_PACKET_OUT
784 1.574462297 172.31.31.144 -> 172.31.23.72 OpenFlow 187 Type: OFPT_PACKET_OUT
785 1.574494615 172.31.31.144 -> 172.31.23.72 OpenFlow 308 Type: OFPT_PACKET_OUT
786 1.574519746 172.31.31.144 -> 172.31.23.72 TCP 66 6633 → 40152 [ACK] Seq=1763 Ack=1455 Win=853 Len=0 TSval=681976 TSecr=774815
787 1.574541474 172.31.23.72 -> 172.31.31.144 TCP 66 40208 → 6633 [ACK] Seq=787 Ack=1033 Win=384 Len=0 TSval=774815 TSecr=681976
788 1.574550159 172.31.31.144 -> 172.31.23.72 OpenFlow 187 Type: OFPT_PACKET_OUT
789 1.574582862 172.31.31.144 -> 172.31.23.72 OpenFlow 187 Type: OFPT_PACKET_OUT
790 1.574606347 172.31.31.144 -> 172.31.23.72 TCP 66 6633 → 40204 [ACK] Seq=1201 Ack=586 Win=853 Len=0 TSval=681976 TSecr=774815
791 1.574634961 172.31.31.144 -> 172.31.23.72 TCP 66 6633 → 40146 [ACK] Seq=2289 Ack=1315 Win=853 Len=0 TSval=681976 TSecr=774815
792 1.574750796 172.31.23.72 -> 172.31.31.144 OpenFlow 189 Type: OFPT_PACKET_IN
793 1.574773287 172.31.23.72 -> 172.31.31.144 OpenFlow 189 Type: OFPT_PACKET_IN
794 1.574797734 172.31.31.144 -> 172.31.23.72 OpenFlow 187 Type: OFPT_PACKET_OUT
795 1.574911235 172.31.31.144 -> 172.31.23.72 TCP 66 6633 → 40154 [ACK] Seq=1443 Ack=1078 Win=853 Len=0 TSval=681976 TSecr=774815
796 1.574939247 172.31.31.144 -> 172.31.23.72 TCP 66 6633 → 40154 [ACK] Seq=1443 Ack=1201 Win=853 Len=0 TSval=681976 TSecr=774815
797 1.574960334 172.31.23.72 -> 172.31.31.144 TCP 66 40200 → 6633 [ACK] Seq=471 Ack=1175 Win=401 Len=0 TSval=774815 TSecr=681976
798 1.575004178 172.31.31.144 -> 172.31.23.72 OpenFlow 187 Type: OFPT_PACKET_OUT
799 1.575039985 172.31.23.72 -> 172.31.31.144 OpenFlow 189 Type: OFPT_PACKET_IN
800 1.575063229 172.31.31.144 -> 172.31.23.72 OpenFlow 187 Type: OFPT_PACKET_OUT
801 1.575136177 172.31.31.144 -> 172.31.23.72 OpenFlow 187 Type: OFPT_PACKET_OUT
802 1.575204159 172.31.31.144 -> 172.31.23.72 OpenFlow 187 Type: OFPT_PACKET_OUT
803 1.575337923 172.31.23.72 -> 172.31.31.144 TCP 66 40202 → 6633 [ACK] Seq=717 Ack=1521 Win=213 Len=0 TSval=774815 TSecr=681976
804 1.575369990 172.31.31.144 -> 172.31.23.72 OpenFlow 187 Type: OFPT_PACKET_OUT
805 1.575374539 172.31.31.144 -> 172.31.23.72 OpenFlow 187 Type: OFPT_PACKET_OUT
806 1.575418384 172.31.23.72 -> 172.31.31.144 OpenFlow 189 Type: OFPT_PACKET_IN
807 1.575431588 172.31.31.144 -> 172.31.23.72 OpenFlow 187 Type: OFPT_PACKET_OUT
808 1.575440383 172.31.23.72 -> 172.31.31.144 OpenFlow 189 Type: OFPT_PACKET_IN
809 1.575463399 172.31.23.72 -> 172.31.31.144 OpenFlow 189 Type: OFPT_PACKET_IN
810 1.575476324 172.31.23.72 -> 172.31.31.144 OpenFlow 189 Type: OFPT_PACKET_IN
811 1.575509488 172.31.23.72 -> 172.31.31.144 OpenFlow 189 Type: OFPT_PACKET_IN
812 1.575536554 172.31.31.144 -> 172.31.23.72 OpenFlow 187 Type: OFPT_PACKET_OUT
813 1.575559482 172.31.31.144 -> 172.31.23.72 OpenFlow 187 Type: OFPT_PACKET_OUT
814 1.575609164 172.31.31.144 -> 172.31.23.72 OpenFlow 187 Type: OFPT_PACKET_OUT
815 1.575647966 172.31.31.144 -> 172.31.23.72 TCP 66 6633 → 40204 [ACK] Seq=1201 Ack=955 Win=853 Len=0 TSval=681976 TSecr=774815
816 1.575662641 172.31.31.144 -> 172.31.23.72 TCP 66 6633 → 40210 [ACK] Seq=1383 Ack=717 Win=853 Len=0 TSval=681976 TSecr=774815
817 1.575675373 172.31.23.72 -> 172.31.31.144 OpenFlow 189 Type: OFPT_PACKET_IN
818 1.575697908 172.31.31.144 -> 172.31.23.72 OpenFlow 187 Type: OFPT_PACKET_OUT
819 1.575702434 172.31.23.72 -> 172.31.31.144 OpenFlow 189 Type: OFPT_PACKET_IN
820 1.575742139 172.31.31.144 -> 172.31.23.72 OpenFlow 187 Type: OFPT_PACKET_OUT
821 1.575818132 172.31.31.144 -> 172.31.23.72 OpenFlow 187 Type: OFPT_PACKET_OUT
822 1.575851403 172.31.31.144 -> 172.31.23.72 OpenFlow 187 Type: OFPT_PACKET_OUT
823 1.575955541 172.31.31.144 -> 172.31.23.72 OpenFlow 187 Type: OFPT_PACKET_OUT
824 1.576003102 172.31.31.144 -> 172.31.23.72 OpenFlow 187 Type: OFPT_PACKET_OUT
825 1.576064459 172.31.31.144 -> 172.31.23.72 OpenFlow 187 Type: OFPT_PACKET_OUT
826 1.576141625 172.31.31.144 -> 172.31.23.72 OpenFlow 187 Type: OFPT_PACKET_OUT
827 1.576177544 172.31.23.72 -> 172.31.31.144 TCP 66 40196 → 6633 [ACK] Seq=1287 Ack=1491 Win=213 Len=0 TSval=774815 TSecr=681976
828 1.576188762 172.31.31.144 -> 172.31.23.72 OpenFlow 187 Type: OFPT_PACKET_OUT
829 1.576251391 172.31.31.144 -> 172.31.23.72 OpenFlow 187 Type: OFPT_PACKET_OUT
830 1.576270808 172.31.23.72 -> 172.31.31.144 OpenFlow 189 Type: OFPT_PACKET_IN
831 1.576292066 172.31.23.72 -> 172.31.31.144 OpenFlow 189 Type: OFPT_PACKET_IN
832 1.576297054 172.31.23.72 -> 172.31.31.144 OpenFlow 189 Type: OFPT_PACKET_IN
833 1.576313417 172.31.23.72 -> 172.31.31.144 OpenFlow 189 Type: OFPT_PACKET_IN
834 1.576317986 172.31.31.144 -> 172.31.23.72 OpenFlow 187 Type: OFPT_PACKET_OUT
835 1.576344009 172.31.23.72 -> 172.31.31.144 OpenFlow 189 Type: OFPT_PACKET_IN
836 1.576386439 172.31.31.144 -> 172.31.23.72 OpenFlow 187 Type: OFPT_PACKET_OUT
837 1.576394694 172.31.23.72 -> 172.31.31.144 OpenFlow 189 Type: OFPT_PACKET_IN
838 1.576401014 172.31.23.72 -> 172.31.31.144 OpenFlow 189 Type: OFPT_PACKET_IN
839 1.576433551 172.31.23.72 -> 172.31.31.144 OpenFlow 189 Type: OFPT_PACKET_IN
840 1.576487567 172.31.31.144 -> 172.31.23.72 OpenFlow 187 Type: OFPT_PACKET_OUT
841 1.576509457 172.31.31.144 -> 172.31.23.72 OpenFlow 187 Type: OFPT_PACKET_OUT
842 1.576521213 172.31.31.144 -> 172.31.23.72 TCP 66 6633 → 40202 [ACK] Seq=1521 Ack=840 Win=853 Len=0 TSval=681977 TSecr=774815
843 1.576578621 172.31.31.144 -> 172.31.23.72 TCP 66 6633 → 40200 [ACK] Seq=1175 Ack=717 Win=853 Len=0 TSval=681977 TSecr=774815
844 1.576604972 172.31.31.144 -> 172.31.23.72 TCP 66 6633 → 40210 [ACK] Seq=1383 Ack=840 Win=853 Len=0 TSval=681977 TSecr=774815
845 1.576632446 172.31.31.144 -> 172.31.23.72 OpenFlow 187 Type: OFPT_PACKET_OUT
846 1.576660907 172.31.31.144 -> 172.31.23.72 TCP 66 6633 → 40204 [ACK] Seq=1201 Ack=1201 Win=853 Len=0 TSval=681977 TSecr=774815
847 1.576688446 172.31.31.144 -> 172.31.23.72 OpenFlow 187 Type: OFPT_PACKET_OUT
848 1.576750001 172.31.31.144 -> 172.31.23.72 OpenFlow 187 Type: OFPT_PACKET_OUT
849 1.576794349 172.31.23.72 -> 172.31.31.144 TCP 66 40216 → 6633 [ACK] Seq=1617 Ack=1537 Win=213 Len=0 TSval=774815 TSecr=681976
850 1.576838795 172.31.31.144 -> 172.31.23.72 TCP 66 6633 → 40210 [ACK] Seq=1383 Ack=963 Win=853 Len=0 TSval=681977 TSecr=774815
851 1.576952501 172.31.23.72 -> 172.31.31.144 OpenFlow 189 Type: OFPT_PACKET_IN
852 1.576973672 172.31.23.72 -> 172.31.31.144 OpenFlow 189 Type: OFPT_PACKET_IN
853 1.576978068 172.31.23.72 -> 172.31.31.144 OpenFlow 189 Type: OFPT_PACKET_IN
854 1.576996821 172.31.31.144 -> 172.31.23.72 OpenFlow 187 Type: OFPT_PACKET_OUT
855 1.577002294 172.31.23.72 -> 172.31.31.144 OpenFlow 189 Type: OFPT_PACKET_IN
856 1.577006837 172.31.23.72 -> 172.31.31.144 OpenFlow 189 Type: OFPT_PACKET_IN
857 1.577021640 172.31.23.72 -> 172.31.31.144 OpenFlow 189 Type: OFPT_PACKET_IN
858 1.577032641 172.31.23.72 -> 172.31.31.144 OpenFlow 189 Type: OFPT_PACKET_IN
859 1.577051103 172.31.23.72 -> 172.31.31.144 OpenFlow 189 Type: OFPT_PACKET_IN
860 1.577113620 172.31.23.72 -> 172.31.31.144 OpenFlow 189 Type: OFPT_PACKET_IN
861 1.577119409 172.31.23.72 -> 172.31.31.144 OpenFlow 189 Type: OFPT_PACKET_IN
862 1.577189770 172.31.31.144 -> 172.31.23.72 TCP 66 6633 → 40148 [ACK] Seq=1275 Ack=910 Win=853 Len=0 TSval=681977 TSecr=774815
863 1.577195482 172.31.31.144 -> 172.31.23.72 TCP 66 6633 → 40150 [ACK] Seq=1275 Ack=910 Win=853 Len=0 TSval=681977 TSecr=774815
864 1.577197430 172.31.31.144 -> 172.31.23.72 TCP 66 6633 → 40148 [ACK] Seq=1275 Ack=1033 Win=853 Len=0 TSval=681977 TSecr=774815
865 1.577202339 172.31.23.72 -> 172.31.31.144 OpenFlow 189 Type: OFPT_PACKET_IN
866 1.577210636 172.31.23.72 -> 172.31.31.144 OpenFlow 189 Type: OFPT_PACKET_IN
867 1.577235260 172.31.31.144 -> 172.31.23.72 TCP 66 6633 → 40154 [ACK] Seq=1443 Ack=1324 Win=853 Len=0 TSval=681977 TSecr=774815
868 1.577282605 172.31.31.144 -> 172.31.23.72 TCP 66 6633 → 40150 [ACK] Seq=1275 Ack=1033 Win=853 Len=0 TSval=681977 TSecr=774815
869 1.577286935 172.31.31.144 -> 172.31.23.72 TCP 66 6633 → 40156 [ACK] Seq=1249 Ack=918 Win=853 Len=0 TSval=681977 TSecr=774815
870 1.577304633 172.31.31.144 -> 172.31.23.72 TCP 66 6633 → 40188 [ACK] Seq=1931 Ack=1500 Win=853 Len=0 TSval=681977 TSecr=774815
871 1.577325690 172.31.31.144 -> 172.31.23.72 TCP 66 6633 → 40154 [ACK] Seq=1443 Ack=1447 Win=853 Len=0 TSval=681977 TSecr=774815
872 1.577347601 172.31.23.72 -> 172.31.31.144 TCP 66 40206 → 6633 [ACK] Seq=541 Ack=791 Win=402 Len=0 TSval=774815 TSecr=681976
873 1.577356526 172.31.31.144 -> 172.31.23.72 TCP 66 6633 → 40156 [ACK] Seq=1249 Ack=1041 Win=853 Len=0 TSval=681977 TSecr=774815
874 1.577392130 172.31.31.144 -> 172.31.23.72 TCP 66 6633 → 40188 [ACK] Seq=1931 Ack=1623 Win=853 Len=0 TSval=681977 TSecr=774815
875 1.577530137 172.31.23.72 -> 172.31.31.144 OpenFlow 189 Type: OFPT_PACKET_IN
876 1.577553228 172.31.23.72 -> 172.31.31.144 OpenFlow 189 Type: OFPT_PACKET_IN
877 1.577586151 172.31.23.72 -> 172.31.31.144 OpenFlow 189 Type: OFPT_PACKET_IN
878 1.577610566 172.31.23.72 -> 172.31.31.144 OpenFlow 189 Type: OFPT_PACKET_IN
879 1.577663091 172.31.31.144 -> 172.31.23.72 TCP 66 6633 → 40194 [ACK] Seq=1607 Ack=979 Win=853 Len=0 TSval=681977 TSecr=774815
880 1.577708962 172.31.31.144 -> 172.31.23.72 TCP 66 6633 → 40148 [ACK] Seq=1275 Ack=1156 Win=853 Len=0 TSval=681977 TSecr=774815
881 1.577735083 172.31.31.144 -> 172.31.23.72 TCP 66 6633 → 40148 [ACK] Seq=1275 Ack=1279 Win=853 Len=0 TSval=681977 TSecr=774815
882 1.577785092 172.31.31.144 -> 172.31.23.72 TCP 66 6633 → 40192 [ACK] Seq=1033 Ack=787 Win=853 Len=0 TSval=681977 TSecr=774815
883 1.612566857 172.31.31.144 -> 172.31.23.72 TCP 66 6633 → 40196 [ACK] Seq=1491 Ack=1287 Win=853 Len=0 TSval=681986 TSecr=774815
884 1.616582804 172.31.31.144 -> 172.31.23.72 TCP 66 6633 → 40202 [ACK] Seq=1521 Ack=963 Win=853 Len=0 TSval=681987 TSecr=774815
885 1.621800676 137.158.125.247 -> 172.31.23.72 TCP 54 52508 → 22 [ACK] Seq=1 Ack=481 Win=32342 Len=0
886 1.919527038 172.31.23.72 -> 137.158.125.247 SSH 98 Server: Encrypted packet (len=44)
887 2.127261646 137.158.125.247 -> 172.31.23.72 TCP 54 52508 → 22 [ACK] Seq=1 Ack=525 Win=32320 Len=0
888 2.420239330 172.31.23.72 -> 137.158.125.247 SSH 98 Server: Encrypted packet (len=44)
889 2.628876087 137.158.125.247 -> 172.31.23.72 TCP 54 52508 → 22 [ACK] Seq=1 Ack=569 Win=32298 Len=0
