  1 0.000000000 172.31.31.144 -> 172.31.24.227 TCP 187 6633 → 50476 [PSH, ACK] Seq=1 Ack=1 Win=853 Len=121 TSval=1225280 TSecr=394290527
  2 0.000014237 172.31.31.144 -> 172.31.24.227 TCP 187 6633 → 50476 [PSH, ACK] Seq=122 Ack=1 Win=853 Len=121 TSval=1225280 TSecr=394290527
  3 0.000018817 172.31.31.144 -> 172.31.24.227 TCP 187 6633 → 50476 [PSH, ACK] Seq=243 Ack=1 Win=853 Len=121 TSval=1225280 TSecr=394290527
  4 0.000021019 172.31.31.144 -> 172.31.24.227 TCP 187 6633 → 50476 [PSH, ACK] Seq=364 Ack=1 Win=853 Len=121 TSval=1225280 TSecr=394290527
  5 0.000033350 172.31.31.144 -> 172.31.24.227 TCP 187 6633 → 50476 [PSH, ACK] Seq=485 Ack=1 Win=853 Len=121 TSval=1225280 TSecr=394290527
  6 0.000061241 172.31.31.144 -> 172.31.24.227 TCP 187 6633 → 50476 [PSH, ACK] Seq=606 Ack=1 Win=853 Len=121 TSval=1225280 TSecr=394290527
  7 0.000386357 172.31.24.227 -> 172.31.31.144 TCP 66 50476 → 6633 [ACK] Seq=1 Ack=727 Win=213 Len=0 TSval=394290552 TSecr=1225280
  8 0.000477741 172.31.24.227 -> 172.31.31.144 OpenFlow 189 Type: OFPT_PACKET_IN
  9 0.000498775 172.31.24.227 -> 172.31.31.144 OpenFlow 189 Type: OFPT_PACKET_IN
 10 0.000532576 172.31.24.227 -> 172.31.31.144 OpenFlow 189 Type: OFPT_PACKET_IN
 11 0.000554081 172.31.24.227 -> 172.31.31.144 OpenFlow 189 Type: OFPT_PACKET_IN
 12 0.000741387 172.31.31.144 -> 172.31.24.227 TCP 66 6633 → 50474 [ACK] Seq=1 Ack=124 Win=853 Len=0 TSval=1225280 TSecr=394290552
 13 0.000749047 172.31.31.144 -> 172.31.24.227 TCP 66 6633 → 50474 [ACK] Seq=1 Ack=247 Win=853 Len=0 TSval=1225280 TSecr=394290552
 14 0.000751811 172.31.31.144 -> 172.31.24.227 TCP 66 6633 → 50464 [ACK] Seq=1 Ack=124 Win=853 Len=0 TSval=1225280 TSecr=394290552
 15 0.000754263 172.31.31.144 -> 172.31.24.227 TCP 66 6633 → 50464 [ACK] Seq=1 Ack=247 Win=853 Len=0 TSval=1225280 TSecr=394290552
 16 0.693113728 172.31.24.227 -> 172.31.31.144 OpenFlow 146 Type: OFPT_PORT_STATUS
 17 0.693278462 172.31.24.227 -> 172.31.31.144 OpenFlow 146 Type: OFPT_PORT_STATUS
 18 0.693389855 172.31.31.144 -> 172.31.24.227 TCP 66 6633 → 50440 [ACK] Seq=1 Ack=81 Win=853 Len=0 TSval=1225453 TSecr=394290725
 19 0.730787071 172.31.31.144 -> 172.31.24.227 TCP 66 6633 → 50442 [ACK] Seq=1 Ack=81 Win=853 Len=0 TSval=1225463 TSecr=394290725
 20 1.800545678 172.31.31.144 -> 172.31.24.227 TCP 187 6633 → 50430 [PSH, ACK] Seq=1 Ack=1 Win=853 Len=121 TSval=1225730 TSecr=394290302
 21 1.800575982 172.31.31.144 -> 172.31.24.227 TCP 187 6633 → 50430 [PSH, ACK] Seq=122 Ack=1 Win=853 Len=121 TSval=1225730 TSecr=394290302
 22 1.800591277 172.31.31.144 -> 172.31.24.227 TCP 187 6633 → 50430 [PSH, ACK] Seq=243 Ack=1 Win=853 Len=121 TSval=1225730 TSecr=394290302
 23 1.800604679 172.31.31.144 -> 172.31.24.227 TCP 187 6633 → 50430 [PSH, ACK] Seq=364 Ack=1 Win=853 Len=121 TSval=1225730 TSecr=394290302
 24 1.800649013 172.31.31.144 -> 172.31.24.227 TCP 187 6633 → 50430 [PSH, ACK] Seq=485 Ack=1 Win=853 Len=121 TSval=1225730 TSecr=394290302
 25 1.800710135 172.31.31.144 -> 172.31.24.227 TCP 187 6633 → 50430 [PSH, ACK] Seq=606 Ack=1 Win=853 Len=121 TSval=1225730 TSecr=394290302
 26 1.801066097 172.31.24.227 -> 172.31.31.144 TCP 66 50430 → 6633 [ACK] Seq=1 Ack=727 Win=213 Len=0 TSval=394291002 TSecr=1225730
 27 1.801272625 172.31.24.227 -> 172.31.31.144 OpenFlow 189 Type: OFPT_PACKET_IN
 28 1.801293841 172.31.24.227 -> 172.31.31.144 OpenFlow 189 Type: OFPT_PACKET_IN
 29 1.801343343 172.31.24.227 -> 172.31.31.144 OpenFlow 189 Type: OFPT_PACKET_IN
 30 1.801359452 172.31.24.227 -> 172.31.31.144 OpenFlow 189 Type: OFPT_PACKET_IN
 31 1.801496104 172.31.31.144 -> 172.31.24.227 TCP 66 6633 → 50440 [ACK] Seq=1 Ack=204 Win=853 Len=0 TSval=1225730 TSecr=394291002
 32 1.801505074 172.31.31.144 -> 172.31.24.227 TCP 66 6633 → 50440 [ACK] Seq=1 Ack=327 Win=853 Len=0 TSval=1225730 TSecr=394291002
 33 1.801566397 172.31.31.144 -> 172.31.24.227 TCP 66 6633 → 50432 [ACK] Seq=1 Ack=124 Win=853 Len=0 TSval=1225730 TSecr=394291002
 34 1.801572888 172.31.31.144 -> 172.31.24.227 TCP 66 6633 → 50432 [ACK] Seq=1 Ack=247 Win=853 Len=0 TSval=1225730 TSecr=394291002
 35 1.900077045 172.31.31.144 -> 172.31.24.227 OpenFlow 187 Type: OFPT_PACKET_OUT
 36 1.900099305 172.31.31.144 -> 172.31.24.227 OpenFlow 187 Type: OFPT_PACKET_OUT
 37 1.900119565 172.31.31.144 -> 172.31.24.227 OpenFlow 187 Type: OFPT_PACKET_OUT
 38 1.900149947 172.31.31.144 -> 172.31.24.227 OpenFlow 187 Type: OFPT_PACKET_OUT
 39 1.900182404 172.31.31.144 -> 172.31.24.227 OpenFlow 187 Type: OFPT_PACKET_OUT
 40 1.900237961 172.31.31.144 -> 172.31.24.227 OpenFlow 187 Type: OFPT_PACKET_OUT
 41 1.900309896 172.31.31.144 -> 172.31.24.227 OpenFlow 187 Type: OFPT_PACKET_OUT
 42 1.900352309 172.31.31.144 -> 172.31.24.227 OpenFlow 187 Type: OFPT_PACKET_OUT
 43 1.900416476 172.31.31.144 -> 172.31.24.227 TCP 187 6633 → 50434 [PSH, ACK] Seq=1 Ack=1 Win=853 Len=121 TSval=1225755 TSecr=394290302
 44 1.900469509 172.31.31.144 -> 172.31.24.227 TCP 187 6633 → 50434 [PSH, ACK] Seq=122 Ack=1 Win=853 Len=121 TSval=1225755 TSecr=394290302
 45 1.900521063 172.31.31.144 -> 172.31.24.227 TCP 187 6633 → 50434 [PSH, ACK] Seq=243 Ack=1 Win=853 Len=121 TSval=1225755 TSecr=394290302
 46 1.900572750 172.31.31.144 -> 172.31.24.227 TCP 187 6633 → 50434 [PSH, ACK] Seq=364 Ack=1 Win=853 Len=121 TSval=1225755 TSecr=394290302
 47 1.900640268 172.31.31.144 -> 172.31.24.227 TCP 187 6633 → 50434 [PSH, ACK] Seq=485 Ack=1 Win=853 Len=121 TSval=1225755 TSecr=394290302
 48 1.900672032 172.31.31.144 -> 172.31.24.227 TCP 187 6633 → 50434 [PSH, ACK] Seq=606 Ack=1 Win=853 Len=121 TSval=1225755 TSecr=394290302
 49 1.900722117 172.31.31.144 -> 172.31.24.227 TCP 187 6633 → 50434 [PSH, ACK] Seq=727 Ack=1 Win=853 Len=121 TSval=1225755 TSecr=394290302
 50 1.900772948 172.31.31.144 -> 172.31.24.227 TCP 187 6633 → 50434 [PSH, ACK] Seq=848 Ack=1 Win=853 Len=121 TSval=1225755 TSecr=394290302
 51 1.900831424 172.31.31.144 -> 172.31.24.227 TCP 187 6633 → 50434 [PSH, ACK] Seq=969 Ack=1 Win=853 Len=121 TSval=1225755 TSecr=394290302
 52 1.900856765 172.31.24.227 -> 172.31.31.144 TCP 66 50432 → 6633 [ACK] Seq=247 Ack=969 Win=213 Len=0 TSval=394291027 TSecr=1225755
 53 1.900878200 172.31.31.144 -> 172.31.24.227 TCP 187 6633 → 50434 [PSH, ACK] Seq=1090 Ack=1 Win=853 Len=121 TSval=1225755 TSecr=394290302
 54 1.900989331 172.31.24.227 -> 172.31.31.144 OpenFlow 189 Type: OFPT_PACKET_IN
 55 1.901011698 172.31.24.227 -> 172.31.31.144 OpenFlow 189 Type: OFPT_PACKET_IN
 56 1.901161887 172.31.24.227 -> 172.31.31.144 OpenFlow 189 Type: OFPT_PACKET_IN
 57 1.901186140 172.31.24.227 -> 172.31.31.144 OpenFlow 189 Type: OFPT_PACKET_IN
 58 1.901212478 172.31.31.144 -> 172.31.24.227 TCP 66 6633 → 50430 [ACK] Seq=727 Ack=124 Win=853 Len=0 TSval=1225755 TSecr=394291027
 59 1.901219661 172.31.31.144 -> 172.31.24.227 TCP 66 6633 → 50430 [ACK] Seq=727 Ack=247 Win=853 Len=0 TSval=1225755 TSecr=394291027
 60 1.901255052 172.31.24.227 -> 172.31.31.144 OpenFlow 189 Type: OFPT_PACKET_IN
 61 1.901261849 172.31.24.227 -> 172.31.31.144 OpenFlow 189 Type: OFPT_PACKET_IN
 62 1.901419554 172.31.31.144 -> 172.31.24.227 TCP 66 6633 → 50440 [ACK] Seq=1 Ack=450 Win=853 Len=0 TSval=1225755 TSecr=394291027
 63 1.901426284 172.31.31.144 -> 172.31.24.227 TCP 66 6633 → 50434 [ACK] Seq=1211 Ack=124 Win=853 Len=0 TSval=1225755 TSecr=394291027
 64 1.901479537 172.31.31.144 -> 172.31.24.227 TCP 66 6633 → 50440 [ACK] Seq=1 Ack=573 Win=853 Len=0 TSval=1225755 TSecr=394291027
 65 1.901485706 172.31.31.144 -> 172.31.24.227 TCP 66 6633 → 50434 [ACK] Seq=1211 Ack=247 Win=853 Len=0 TSval=1225755 TSecr=394291027
 66 1.901719498 172.31.24.227 -> 172.31.31.144 OpenFlow 189 Type: OFPT_PACKET_IN
 67 1.901739614 172.31.24.227 -> 172.31.31.144 OpenFlow 189 Type: OFPT_PACKET_IN
 68 1.901830130 172.31.24.227 -> 172.31.31.144 OpenFlow 189 Type: OFPT_PACKET_IN
 69 1.901850272 172.31.24.227 -> 172.31.31.144 OpenFlow 189 Type: OFPT_PACKET_IN
 70 1.901866355 172.31.24.227 -> 172.31.31.144 OpenFlow 189 Type: OFPT_PACKET_IN
 71 1.901927561 172.31.24.227 -> 172.31.31.144 OpenFlow 189 Type: OFPT_PACKET_IN
 72 1.901952366 172.31.31.144 -> 172.31.24.227 TCP 66 6633 → 50432 [ACK] Seq=969 Ack=370 Win=853 Len=0 TSval=1225755 TSecr=394291027
 73 1.902000841 172.31.24.227 -> 172.31.31.144 OpenFlow 189 Type: OFPT_PACKET_IN
 74 1.902062668 172.31.31.144 -> 172.31.24.227 TCP 66 6633 → 50432 [ACK] Seq=969 Ack=493 Win=853 Len=0 TSval=1225755 TSecr=394291027
 75 1.902068316 172.31.31.144 -> 172.31.24.227 TCP 66 6633 → 50442 [ACK] Seq=1 Ack=204 Win=853 Len=0 TSval=1225755 TSecr=394291027
 76 1.902070968 172.31.31.144 -> 172.31.24.227 TCP 66 6633 → 50442 [ACK] Seq=1 Ack=327 Win=853 Len=0 TSval=1225755 TSecr=394291027
 77 1.902077058 172.31.24.227 -> 172.31.31.144 OpenFlow 189 Type: OFPT_PACKET_IN
 78 1.902150664 172.31.31.144 -> 172.31.24.227 TCP 66 6633 → 50438 [ACK] Seq=1 Ack=247 Win=853 Len=0 TSval=1225755 TSecr=394291027
 79 1.902237258 172.31.31.144 -> 172.31.24.227 TCP 66 6633 → 50436 [ACK] Seq=1 Ack=124 Win=853 Len=0 TSval=1225755 TSecr=394291027
 80 1.902287650 172.31.31.144 -> 172.31.24.227 TCP 66 6633 → 50436 [ACK] Seq=1 Ack=247 Win=853 Len=0 TSval=1225755 TSecr=394291027
 81 2.000320999 172.31.31.144 -> 172.31.24.227 OpenFlow 187 Type: OFPT_PACKET_OUT
 82 2.000335552 172.31.31.144 -> 172.31.24.227 OpenFlow 187 Type: OFPT_PACKET_OUT
 83 2.000340041 172.31.31.144 -> 172.31.24.227 OpenFlow 187 Type: OFPT_PACKET_OUT
 84 2.000342804 172.31.31.144 -> 172.31.24.227 OpenFlow 187 Type: OFPT_PACKET_OUT
 85 2.000351689 172.31.31.144 -> 172.31.24.227 OpenFlow 187 Type: OFPT_PACKET_OUT
 86 2.000408028 172.31.31.144 -> 172.31.24.227 OpenFlow 187 Type: OFPT_PACKET_OUT
 87 2.000455544 172.31.31.144 -> 172.31.24.227 OpenFlow 187 Type: OFPT_PACKET_OUT
 88 2.000519427 172.31.31.144 -> 172.31.24.227 OpenFlow 187 Type: OFPT_PACKET_OUT
 89 2.000573142 172.31.31.144 -> 172.31.24.227 OpenFlow 187 Type: OFPT_PACKET_OUT
 90 2.000622191 172.31.31.144 -> 172.31.24.227 OpenFlow 187 Type: OFPT_PACKET_OUT
 91 2.000676474 172.31.31.144 -> 172.31.24.227 OpenFlow 187 Type: OFPT_PACKET_OUT
 92 2.000706143 172.31.31.144 -> 172.31.24.227 OpenFlow 187 Type: OFPT_PACKET_OUT
 93 2.000756953 172.31.31.144 -> 172.31.24.227 OpenFlow 187 Type: OFPT_PACKET_OUT
 94 2.000805337 172.31.31.144 -> 172.31.24.227 OpenFlow 187 Type: OFPT_PACKET_OUT
 95 2.000867019 172.31.24.227 -> 172.31.31.144 TCP 66 50436 → 6633 [ACK] Seq=247 Ack=969 Win=213 Len=0 TSval=394291052 TSecr=1225780
 96 2.000953424 172.31.24.227 -> 172.31.31.144 OpenFlow 189 Type: OFPT_PACKET_IN
 97 2.000974429 172.31.24.227 -> 172.31.31.144 OpenFlow 189 Type: OFPT_PACKET_IN
 98 2.001015029 172.31.24.227 -> 172.31.31.144 OpenFlow 189 Type: OFPT_PACKET_IN
 99 2.001030543 172.31.24.227 -> 172.31.31.144 OpenFlow 189 Type: OFPT_PACKET_IN
100 2.001099508 172.31.24.227 -> 172.31.31.144 OpenFlow 189 Type: OFPT_PACKET_IN
101 2.001118134 172.31.24.227 -> 172.31.31.144 OpenFlow 189 Type: OFPT_PACKET_IN
102 2.001234210 172.31.31.144 -> 172.31.24.227 TCP 66 6633 → 50434 [ACK] Seq=1211 Ack=370 Win=853 Len=0 TSval=1225780 TSecr=394291052
103 2.001242041 172.31.31.144 -> 172.31.24.227 TCP 66 6633 → 50434 [ACK] Seq=1211 Ack=493 Win=853 Len=0 TSval=1225780 TSecr=394291052
104 2.001244811 172.31.31.144 -> 172.31.24.227 TCP 66 6633 → 50444 [ACK] Seq=1 Ack=124 Win=853 Len=0 TSval=1225780 TSecr=394291052
105 2.001248616 172.31.31.144 -> 172.31.24.227 TCP 66 6633 → 50444 [ACK] Seq=1 Ack=247 Win=853 Len=0 TSval=1225780 TSecr=394291052
106 2.001475407 172.31.31.144 -> 172.31.24.227 TCP 66 6633 → 50438 [ACK] Seq=727 Ack=493 Win=853 Len=0 TSval=1225780 TSecr=394291052
107 2.001568301 172.31.24.227 -> 172.31.31.144 OpenFlow 189 Type: OFPT_PACKET_IN
108 2.001588491 172.31.24.227 -> 172.31.31.144 OpenFlow 189 Type: OFPT_PACKET_IN
109 2.001615395 172.31.24.227 -> 172.31.31.144 OpenFlow 189 Type: OFPT_PACKET_IN
110 2.001644098 172.31.24.227 -> 172.31.31.144 OpenFlow 189 Type: OFPT_PACKET_IN
111 2.001718356 172.31.24.227 -> 172.31.31.144 OpenFlow 189 Type: OFPT_PACKET_IN
112 2.001736972 172.31.24.227 -> 172.31.31.144 OpenFlow 189 Type: OFPT_PACKET_IN
113 2.001806502 172.31.31.144 -> 172.31.24.227 TCP 66 6633 → 50436 [ACK] Seq=969 Ack=493 Win=853 Len=0 TSval=1225780 TSecr=394291052
114 2.001813169 172.31.31.144 -> 172.31.24.227 TCP 66 6633 → 50434 [ACK] Seq=1211 Ack=616 Win=853 Len=0 TSval=1225780 TSecr=394291052
115 2.001850059 172.31.31.144 -> 172.31.24.227 TCP 66 6633 → 50434 [ACK] Seq=1211 Ack=739 Win=853 Len=0 TSval=1225780 TSecr=394291052
116 2.001922011 172.31.31.144 -> 172.31.24.227 TCP 66 6633 → 50442 [ACK] Seq=1 Ack=450 Win=853 Len=0 TSval=1225780 TSecr=394291052
117 2.001972571 172.31.31.144 -> 172.31.24.227 TCP 66 6633 → 50442 [ACK] Seq=1 Ack=573 Win=853 Len=0 TSval=1225780 TSecr=394291052
118 2.100155317 172.31.31.144 -> 172.31.24.227 OpenFlow 187 Type: OFPT_PACKET_OUT
119 2.100166898 172.31.31.144 -> 172.31.24.227 OpenFlow 187 Type: OFPT_PACKET_OUT
120 2.100195851 172.31.31.144 -> 172.31.24.227 OpenFlow 187 Type: OFPT_PACKET_OUT
121 2.100259129 172.31.31.144 -> 172.31.24.227 OpenFlow 187 Type: OFPT_PACKET_OUT
122 2.100319217 172.31.31.144 -> 172.31.24.227 OpenFlow 187 Type: OFPT_PACKET_OUT
123 2.100379998 172.31.31.144 -> 172.31.24.227 OpenFlow 187 Type: OFPT_PACKET_OUT
124 2.100422892 172.31.31.144 -> 172.31.24.227 OpenFlow 187 Type: OFPT_PACKET_OUT
125 2.100492125 172.31.31.144 -> 172.31.24.227 OpenFlow 187 Type: OFPT_PACKET_OUT
126 2.100544331 172.31.31.144 -> 172.31.24.227 OpenFlow 187 Type: OFPT_PACKET_OUT
127 2.100597401 172.31.31.144 -> 172.31.24.227 OpenFlow 187 Type: OFPT_PACKET_OUT
128 2.100652361 172.31.31.144 -> 172.31.24.227 OpenFlow 187 Type: OFPT_PACKET_OUT
129 2.100720051 172.31.31.144 -> 172.31.24.227 OpenFlow 187 Type: OFPT_PACKET_OUT
130 2.100758434 172.31.31.144 -> 172.31.24.227 OpenFlow 187 Type: OFPT_PACKET_OUT
131 2.100818122 172.31.31.144 -> 172.31.24.227 OpenFlow 187 Type: OFPT_PACKET_OUT
132 2.100862219 172.31.31.144 -> 172.31.24.227 OpenFlow 187 Type: OFPT_PACKET_OUT
133 2.100871744 172.31.24.227 -> 172.31.31.144 TCP 66 50440 → 6633 [ACK] Seq=573 Ack=969 Win=213 Len=0 TSval=394291077 TSecr=1225805
134 2.100916607 172.31.31.144 -> 172.31.24.227 OpenFlow 187 Type: OFPT_PACKET_OUT
135 2.100982864 172.31.24.227 -> 172.31.31.144 OpenFlow 189 Type: OFPT_PACKET_IN
136 2.101004376 172.31.24.227 -> 172.31.31.144 OpenFlow 189 Type: OFPT_PACKET_IN
137 2.101027033 172.31.24.227 -> 172.31.31.144 OpenFlow 189 Type: OFPT_PACKET_IN
138 2.101062651 172.31.24.227 -> 172.31.31.144 OpenFlow 189 Type: OFPT_PACKET_IN
139 2.101092003 172.31.24.227 -> 172.31.31.144 OpenFlow 189 Type: OFPT_PACKET_IN
140 2.101119025 172.31.24.227 -> 172.31.31.144 OpenFlow 189 Type: OFPT_PACKET_IN
141 2.101208803 172.31.31.144 -> 172.31.24.227 TCP 66 6633 → 50446 [ACK] Seq=1 Ack=124 Win=853 Len=0 TSval=1225805 TSecr=394291077
142 2.101217306 172.31.31.144 -> 172.31.24.227 TCP 66 6633 → 50446 [ACK] Seq=1 Ack=247 Win=853 Len=0 TSval=1225805 TSecr=394291077
143 2.101298856 172.31.31.144 -> 172.31.24.227 TCP 66 6633 → 50432 [ACK] Seq=969 Ack=739 Win=853 Len=0 TSval=1225805 TSecr=394291077
144 2.101307568 172.31.31.144 -> 172.31.24.227 TCP 66 6633 → 50430 [ACK] Seq=727 Ack=370 Win=853 Len=0 TSval=1225805 TSecr=394291077
145 2.101310248 172.31.31.144 -> 172.31.24.227 TCP 66 6633 → 50430 [ACK] Seq=727 Ack=493 Win=853 Len=0 TSval=1225805 TSecr=394291077
146 2.101534265 172.31.24.227 -> 172.31.31.144 TCP 66 50442 → 6633 [ACK] Seq=573 Ack=969 Win=213 Len=0 TSval=394291077 TSecr=1225805
147 2.101618404 172.31.24.227 -> 172.31.31.144 OpenFlow 189 Type: OFPT_PACKET_IN
148 2.101639976 172.31.24.227 -> 172.31.31.144 OpenFlow 189 Type: OFPT_PACKET_IN
149 2.101894199 172.31.24.227 -> 172.31.31.144 OpenFlow 189 Type: OFPT_PACKET_IN
150 2.101926926 172.31.24.227 -> 172.31.31.144 OpenFlow 189 Type: OFPT_PACKET_IN
151 2.101951287 172.31.31.144 -> 172.31.24.227 TCP 66 6633 → 50438 [ACK] Seq=727 Ack=739 Win=853 Len=0 TSval=1225805 TSecr=394291077
152 2.101989748 172.31.24.227 -> 172.31.31.144 OpenFlow 189 Type: OFPT_PACKET_IN
153 2.101996653 172.31.24.227 -> 172.31.31.144 OpenFlow 189 Type: OFPT_PACKET_IN
154 2.102012403 172.31.24.227 -> 172.31.31.144 OpenFlow 189 Type: OFPT_PACKET_IN
155 2.102032175 172.31.24.227 -> 172.31.31.144 OpenFlow 189 Type: OFPT_PACKET_IN
156 2.102123160 172.31.24.227 -> 172.31.31.144 OpenFlow 189 Type: OFPT_PACKET_IN
157 2.102208512 172.31.31.144 -> 172.31.24.227 TCP 66 6633 → 50450 [ACK] Seq=1 Ack=124 Win=853 Len=0 TSval=1225805 TSecr=394291077
158 2.102217217 172.31.31.144 -> 172.31.24.227 TCP 66 6633 → 50434 [ACK] Seq=1211 Ack=862 Win=853 Len=0 TSval=1225805 TSecr=394291077
159 2.102220323 172.31.31.144 -> 172.31.24.227 TCP 66 6633 → 50450 [ACK] Seq=1 Ack=247 Win=853 Len=0 TSval=1225805 TSecr=394291077
160 2.102226974 172.31.24.227 -> 172.31.31.144 OpenFlow 189 Type: OFPT_PACKET_IN
161 2.102300524 172.31.31.144 -> 172.31.24.227 TCP 66 6633 → 50434 [ACK] Seq=1211 Ack=985 Win=853 Len=0 TSval=1225805 TSecr=394291077
162 2.102304724 172.31.31.144 -> 172.31.24.227 TCP 66 6633 → 50446 [ACK] Seq=1 Ack=370 Win=853 Len=0 TSval=1225805 TSecr=394291077
163 2.102395771 172.31.31.144 -> 172.31.24.227 TCP 66 6633 → 50444 [ACK] Seq=1 Ack=370 Win=853 Len=0 TSval=1225805 TSecr=394291077
164 2.102474425 172.31.31.144 -> 172.31.24.227 TCP 66 6633 → 50446 [ACK] Seq=1 Ack=493 Win=853 Len=0 TSval=1225805 TSecr=394291077
165 2.102478924 172.31.31.144 -> 172.31.24.227 TCP 66 6633 → 50444 [ACK] Seq=1 Ack=493 Win=853 Len=0 TSval=1225805 TSecr=394291077
166 2.200309320 172.31.31.144 -> 172.31.24.227 OpenFlow 187 Type: OFPT_PACKET_OUT
167 2.200325343 172.31.31.144 -> 172.31.24.227 OpenFlow 187 Type: OFPT_PACKET_OUT
168 2.200329977 172.31.31.144 -> 172.31.24.227 OpenFlow 187 Type: OFPT_PACKET_OUT
169 2.200338608 172.31.31.144 -> 172.31.24.227 OpenFlow 187 Type: OFPT_PACKET_OUT
170 2.200388204 172.31.31.144 -> 172.31.24.227 OpenFlow 187 Type: OFPT_PACKET_OUT
171 2.200446032 172.31.31.144 -> 172.31.24.227 OpenFlow 187 Type: OFPT_PACKET_OUT
172 2.200507502 172.31.31.144 -> 172.31.24.227 OpenFlow 187 Type: OFPT_PACKET_OUT
173 2.200576772 172.31.31.144 -> 172.31.24.227 OpenFlow 187 Type: OFPT_PACKET_OUT
174 2.200631914 172.31.31.144 -> 172.31.24.227 OpenFlow 187 Type: OFPT_PACKET_OUT
175 2.200665974 172.31.31.144 -> 172.31.24.227 OpenFlow 187 Type: OFPT_PACKET_OUT
176 2.200724143 172.31.31.144 -> 172.31.24.227 OpenFlow 187 Type: OFPT_PACKET_OUT
177 2.200788930 172.31.31.144 -> 172.31.24.227 OpenFlow 187 Type: OFPT_PACKET_OUT
178 2.200831590 172.31.31.144 -> 172.31.24.227 OpenFlow 187 Type: OFPT_PACKET_OUT
179 2.200890292 172.31.31.144 -> 172.31.24.227 OpenFlow 187 Type: OFPT_PACKET_OUT
180 2.200934558 172.31.24.227 -> 172.31.31.144 TCP 66 50444 → 6633 [ACK] Seq=493 Ack=727 Win=213 Len=0 TSval=394291102 TSecr=1225830
181 2.200946233 172.31.31.144 -> 172.31.24.227 OpenFlow 187 Type: OFPT_PACKET_OUT
182 2.201024130 172.31.31.144 -> 172.31.24.227 OpenFlow 187 Type: OFPT_PACKET_OUT
183 2.201084132 172.31.24.227 -> 172.31.31.144 OpenFlow 189 Type: OFPT_PACKET_IN
184 2.201104439 172.31.24.227 -> 172.31.31.144 OpenFlow 189 Type: OFPT_PACKET_IN
185 2.201157387 172.31.24.227 -> 172.31.31.144 OpenFlow 189 Type: OFPT_PACKET_IN
186 2.201186223 172.31.24.227 -> 172.31.31.144 OpenFlow 189 Type: OFPT_PACKET_IN
187 2.201320807 172.31.31.144 -> 172.31.24.227 TCP 66 6633 → 50448 [ACK] Seq=1 Ack=124 Win=853 Len=0 TSval=1225830 TSecr=394291102
188 2.201328567 172.31.31.144 -> 172.31.24.227 TCP 66 6633 → 50448 [ACK] Seq=1 Ack=247 Win=853 Len=0 TSval=1225830 TSecr=394291102
189 2.201333831 172.31.24.227 -> 172.31.31.144 OpenFlow 189 Type: OFPT_PACKET_IN
190 2.201350307 172.31.24.227 -> 172.31.31.144 OpenFlow 189 Type: OFPT_PACKET_IN
191 2.201397636 172.31.31.144 -> 172.31.24.227 TCP 66 6633 → 50442 [ACK] Seq=969 Ack=696 Win=853 Len=0 TSval=1225830 TSecr=394291102
192 2.201500515 172.31.31.144 -> 172.31.24.227 TCP 66 6633 → 50442 [ACK] Seq=969 Ack=819 Win=853 Len=0 TSval=1225830 TSecr=394291102
193 2.201614646 172.31.31.144 -> 172.31.24.227 TCP 66 6633 → 50436 [ACK] Seq=969 Ack=739 Win=853 Len=0 TSval=1225830 TSecr=394291102
194 2.201878956 172.31.24.227 -> 172.31.31.144 TCP 66 50446 → 6633 [ACK] Seq=493 Ack=1211 Win=213 Len=0 TSval=394291102 TSecr=1225830
195 2.201971708 172.31.24.227 -> 172.31.31.144 OpenFlow 189 Type: OFPT_PACKET_IN
196 2.201991574 172.31.24.227 -> 172.31.31.144 OpenFlow 189 Type: OFPT_PACKET_IN
197 2.202045567 172.31.24.227 -> 172.31.31.144 OpenFlow 189 Type: OFPT_PACKET_IN
198 2.202075281 172.31.24.227 -> 172.31.31.144 OpenFlow 189 Type: OFPT_PACKET_IN
199 2.202198505 172.31.31.144 -> 172.31.24.227 TCP 66 6633 → 50448 [ACK] Seq=1 Ack=370 Win=853 Len=0 TSval=1225830 TSecr=394291102
200 2.202205515 172.31.31.144 -> 172.31.24.227 TCP 66 6633 → 50448 [ACK] Seq=1 Ack=493 Win=853 Len=0 TSval=1225830 TSecr=394291102
201 2.202228089 172.31.24.227 -> 172.31.31.144 OpenFlow 189 Type: OFPT_PACKET_IN
202 2.202255793 172.31.24.227 -> 172.31.31.144 OpenFlow 189 Type: OFPT_PACKET_IN
203 2.202267855 172.31.31.144 -> 172.31.24.227 TCP 66 6633 → 50442 [ACK] Seq=969 Ack=942 Win=853 Len=0 TSval=1225830 TSecr=394291102
204 2.202283087 172.31.24.227 -> 172.31.31.144 OpenFlow 189 Type: OFPT_PACKET_IN
205 2.202289814 172.31.24.227 -> 172.31.31.144 OpenFlow 189 Type: OFPT_PACKET_IN
206 2.202328425 172.31.24.227 -> 172.31.31.144 OpenFlow 189 Type: OFPT_PACKET_IN
207 2.202334308 172.31.24.227 -> 172.31.31.144 OpenFlow 189 Type: OFPT_PACKET_IN
208 2.202554075 172.31.31.144 -> 172.31.24.227 TCP 66 6633 → 50442 [ACK] Seq=969 Ack=1065 Win=853 Len=0 TSval=1225830 TSecr=394291102
209 2.202560878 172.31.31.144 -> 172.31.24.227 TCP 66 6633 → 50452 [ACK] Seq=1 Ack=124 Win=853 Len=0 TSval=1225830 TSecr=394291102
210 2.202564528 172.31.31.144 -> 172.31.24.227 TCP 66 6633 → 50450 [ACK] Seq=1 Ack=370 Win=853 Len=0 TSval=1225830 TSecr=394291102
211 2.202566898 172.31.31.144 -> 172.31.24.227 TCP 66 6633 → 50440 [ACK] Seq=969 Ack=696 Win=853 Len=0 TSval=1225830 TSecr=394291102
212 2.202569158 172.31.31.144 -> 172.31.24.227 TCP 66 6633 → 50452 [ACK] Seq=1 Ack=247 Win=853 Len=0 TSval=1225830 TSecr=394291102
213 2.202571258 172.31.31.144 -> 172.31.24.227 TCP 66 6633 → 50450 [ACK] Seq=1 Ack=493 Win=853 Len=0 TSval=1225830 TSecr=394291102
214 2.202611368 172.31.31.144 -> 172.31.24.227 TCP 66 6633 → 50440 [ACK] Seq=969 Ack=819 Win=853 Len=0 TSval=1225830 TSecr=394291102
215 2.300432507 172.31.31.144 -> 172.31.24.227 OpenFlow 187 Type: OFPT_PACKET_OUT
216 2.300458188 172.31.31.144 -> 172.31.24.227 OpenFlow 187 Type: OFPT_PACKET_OUT
217 2.300464065 172.31.31.144 -> 172.31.24.227 OpenFlow 187 Type: OFPT_PACKET_OUT
218 2.300466818 172.31.31.144 -> 172.31.24.227 OpenFlow 187 Type: OFPT_PACKET_OUT
219 2.300485545 172.31.31.144 -> 172.31.24.227 OpenFlow 187 Type: OFPT_PACKET_OUT
220 2.300503653 172.31.31.144 -> 172.31.24.227 OpenFlow 187 Type: OFPT_PACKET_OUT
221 2.300537250 172.31.31.144 -> 172.31.24.227 OpenFlow 187 Type: OFPT_PACKET_OUT
222 2.300590802 172.31.31.144 -> 172.31.24.227 OpenFlow 187 Type: OFPT_PACKET_OUT
223 2.300658244 172.31.31.144 -> 172.31.24.227 OpenFlow 187 Type: OFPT_PACKET_OUT
224 2.300684184 172.31.31.144 -> 172.31.24.227 OpenFlow 187 Type: OFPT_PACKET_OUT
225 2.300751323 172.31.31.144 -> 172.31.24.227 OpenFlow 187 Type: OFPT_PACKET_OUT
226 2.300788632 172.31.31.144 -> 172.31.24.227 OpenFlow 187 Type: OFPT_PACKET_OUT
227 2.300891847 172.31.31.144 -> 172.31.24.227 OpenFlow 187 Type: OFPT_PACKET_OUT
228 2.300898060 172.31.31.144 -> 172.31.24.227 OpenFlow 187 Type: OFPT_PACKET_OUT
229 2.300938737 172.31.31.144 -> 172.31.24.227 OpenFlow 187 Type: OFPT_PACKET_OUT
230 2.300965692 172.31.31.144 -> 172.31.24.227 OpenFlow 187 Type: OFPT_PACKET_OUT
231 2.301018042 172.31.31.144 -> 172.31.24.227 OpenFlow 187 Type: OFPT_PACKET_OUT
232 2.301077608 172.31.31.144 -> 172.31.24.227 OpenFlow 187 Type: OFPT_PACKET_OUT
233 2.301372641 172.31.24.227 -> 172.31.31.144 TCP 66 50450 → 6633 [ACK] Seq=493 Ack=1211 Win=213 Len=0 TSval=394291127 TSecr=1225855
234 2.301455860 172.31.24.227 -> 172.31.31.144 OpenFlow 189 Type: OFPT_PACKET_IN
235 2.301475868 172.31.24.227 -> 172.31.31.144 OpenFlow 189 Type: OFPT_PACKET_IN
236 2.301517861 172.31.24.227 -> 172.31.31.144 OpenFlow 189 Type: OFPT_PACKET_IN
237 2.301532154 172.31.24.227 -> 172.31.31.144 OpenFlow 189 Type: OFPT_PACKET_IN
238 2.301549557 172.31.24.227 -> 172.31.31.144 OpenFlow 189 Type: OFPT_PACKET_IN
239 2.301584805 172.31.24.227 -> 172.31.31.144 OpenFlow 189 Type: OFPT_PACKET_IN
240 2.301648346 172.31.31.144 -> 172.31.24.227 TCP 66 6633 → 50440 [ACK] Seq=969 Ack=942 Win=853 Len=0 TSval=1225855 TSecr=394291127
241 2.301656127 172.31.31.144 -> 172.31.24.227 TCP 66 6633 → 50440 [ACK] Seq=969 Ack=1065 Win=853 Len=0 TSval=1225855 TSecr=394291127
242 2.301691439 172.31.31.144 -> 172.31.24.227 TCP 66 6633 → 50466 [ACK] Seq=1 Ack=124 Win=853 Len=0 TSval=1225855 TSecr=394291127
243 2.301720682 172.31.31.144 -> 172.31.24.227 TCP 66 6633 → 50466 [ACK] Seq=1 Ack=247 Win=853 Len=0 TSval=1225855 TSecr=394291127
244 2.301929122 172.31.31.144 -> 172.31.24.227 TCP 66 6633 → 50446 [ACK] Seq=1211 Ack=739 Win=853 Len=0 TSval=1225855 TSecr=394291127
245 2.302052720 172.31.24.227 -> 172.31.31.144 TCP 66 50448 → 6633 [ACK] Seq=493 Ack=969 Win=213 Len=0 TSval=394291127 TSecr=1225855
246 2.302208724 172.31.24.227 -> 172.31.31.144 OpenFlow 189 Type: OFPT_PACKET_IN
247 2.302230237 172.31.24.227 -> 172.31.31.144 OpenFlow 189 Type: OFPT_PACKET_IN
248 2.302400113 172.31.24.227 -> 172.31.31.144 OpenFlow 189 Type: OFPT_PACKET_IN
249 2.302440559 172.31.31.144 -> 172.31.24.227 TCP 66 6633 → 50458 [ACK] Seq=1 Ack=124 Win=853 Len=0 TSval=1225855 TSecr=394291127
250 2.302447401 172.31.31.144 -> 172.31.24.227 TCP 66 6633 → 50458 [ACK] Seq=1 Ack=247 Win=853 Len=0 TSval=1225855 TSecr=394291127
251 2.302453607 172.31.24.227 -> 172.31.31.144 OpenFlow 189 Type: OFPT_PACKET_IN
252 2.302467077 172.31.24.227 -> 172.31.31.144 OpenFlow 189 Type: OFPT_PACKET_IN
253 2.302497617 172.31.24.227 -> 172.31.31.144 OpenFlow 189 Type: OFPT_PACKET_IN
254 2.302544689 172.31.24.227 -> 172.31.31.144 OpenFlow 189 Type: OFPT_PACKET_IN
255 2.302569086 172.31.24.227 -> 172.31.31.144 OpenFlow 189 Type: OFPT_PACKET_IN
256 2.302582726 172.31.24.227 -> 172.31.31.144 OpenFlow 189 Type: OFPT_PACKET_IN
257 2.302599886 172.31.24.227 -> 172.31.31.144 OpenFlow 189 Type: OFPT_PACKET_IN
258 2.302633326 172.31.31.144 -> 172.31.24.227 TCP 66 6633 → 50456 [ACK] Seq=1 Ack=124 Win=853 Len=0 TSval=1225855 TSecr=394291128
259 2.302639593 172.31.31.144 -> 172.31.24.227 TCP 66 6633 → 50456 [ACK] Seq=1 Ack=247 Win=853 Len=0 TSval=1225856 TSecr=394291128
260 2.302727598 172.31.24.227 -> 172.31.31.144 OpenFlow 189 Type: OFPT_PACKET_IN
261 2.302813924 172.31.31.144 -> 172.31.24.227 TCP 66 6633 → 50452 [ACK] Seq=1 Ack=370 Win=853 Len=0 TSval=1225856 TSecr=394291128
262 2.302820661 172.31.31.144 -> 172.31.24.227 TCP 66 6633 → 50452 [ACK] Seq=1 Ack=493 Win=853 Len=0 TSval=1225856 TSecr=394291128
263 2.302823129 172.31.31.144 -> 172.31.24.227 TCP 66 6633 → 50454 [ACK] Seq=1 Ack=124 Win=853 Len=0 TSval=1225856 TSecr=394291128
264 2.302830192 172.31.24.227 -> 172.31.31.144 OpenFlow 189 Type: OFPT_PACKET_IN
265 2.302837908 172.31.31.144 -> 172.31.24.227 TCP 66 6633 → 50454 [ACK] Seq=1 Ack=247 Win=853 Len=0 TSval=1225856 TSecr=394291128
266 2.302989135 172.31.31.144 -> 172.31.24.227 TCP 66 6633 → 50444 [ACK] Seq=727 Ack=616 Win=853 Len=0 TSval=1225856 TSecr=394291128
267 2.303039191 172.31.31.144 -> 172.31.24.227 TCP 66 6633 → 50444 [ACK] Seq=727 Ack=739 Win=853 Len=0 TSval=1225856 TSecr=394291128
268 2.303244039 172.31.31.144 -> 172.31.24.227 TCP 66 6633 → 50446 [ACK] Seq=1211 Ack=985 Win=853 Len=0 TSval=1225856 TSecr=394291128
269 2.400593529 172.31.31.144 -> 172.31.24.227 OpenFlow 187 Type: OFPT_PACKET_OUT
270 2.400622952 172.31.31.144 -> 172.31.24.227 OpenFlow 187 Type: OFPT_PACKET_OUT
271 2.400629686 172.31.31.144 -> 172.31.24.227 OpenFlow 187 Type: OFPT_PACKET_OUT
272 2.400632273 172.31.31.144 -> 172.31.24.227 OpenFlow 187 Type: OFPT_PACKET_OUT
273 2.400656173 172.31.31.144 -> 172.31.24.227 OpenFlow 187 Type: OFPT_PACKET_OUT
274 2.400660823 172.31.31.144 -> 172.31.24.227 OpenFlow 187 Type: OFPT_PACKET_OUT
275 2.400711632 172.31.31.144 -> 172.31.24.227 OpenFlow 187 Type: OFPT_PACKET_OUT
276 2.400766437 172.31.31.144 -> 172.31.24.227 OpenFlow 187 Type: OFPT_PACKET_OUT
277 2.400828728 172.31.31.144 -> 172.31.24.227 OpenFlow 187 Type: OFPT_PACKET_OUT
278 2.400872623 172.31.31.144 -> 172.31.24.227 OpenFlow 187 Type: OFPT_PACKET_OUT
279 2.400928578 172.31.31.144 -> 172.31.24.227 OpenFlow 187 Type: OFPT_PACKET_OUT
280 2.400973458 172.31.31.144 -> 172.31.24.227 OpenFlow 187 Type: OFPT_PACKET_OUT
281 2.401026114 172.31.31.144 -> 172.31.24.227 OpenFlow 187 Type: OFPT_PACKET_OUT
282 2.401074217 172.31.31.144 -> 172.31.24.227 OpenFlow 187 Type: OFPT_PACKET_OUT
283 2.401125473 172.31.31.144 -> 172.31.24.227 OpenFlow 187 Type: OFPT_PACKET_OUT
284 2.401182503 172.31.31.144 -> 172.31.24.227 OpenFlow 187 Type: OFPT_PACKET_OUT
285 2.401385730 172.31.24.227 -> 172.31.31.144 TCP 66 50452 → 6633 [ACK] Seq=493 Ack=969 Win=213 Len=0 TSval=394291152 TSecr=1225880
286 2.401480325 172.31.24.227 -> 172.31.31.144 OpenFlow 189 Type: OFPT_PACKET_IN
287 2.401501571 172.31.24.227 -> 172.31.31.144 OpenFlow 189 Type: OFPT_PACKET_IN
288 2.401542341 172.31.24.227 -> 172.31.31.144 OpenFlow 189 Type: OFPT_PACKET_IN
289 2.401561461 172.31.24.227 -> 172.31.31.144 OpenFlow 189 Type: OFPT_PACKET_IN
290 2.401576277 172.31.24.227 -> 172.31.31.144 OpenFlow 189 Type: OFPT_PACKET_IN
291 2.401618161 172.31.24.227 -> 172.31.31.144 OpenFlow 189 Type: OFPT_PACKET_IN
292 2.401759028 172.31.31.144 -> 172.31.24.227 TCP 66 6633 → 50450 [ACK] Seq=1211 Ack=616 Win=853 Len=0 TSval=1225880 TSecr=394291152
293 2.401768007 172.31.31.144 -> 172.31.24.227 TCP 66 6633 → 50450 [ACK] Seq=1211 Ack=739 Win=853 Len=0 TSval=1225880 TSecr=394291152
294 2.401770788 172.31.31.144 -> 172.31.24.227 TCP 66 6633 → 50460 [ACK] Seq=1 Ack=124 Win=853 Len=0 TSval=1225880 TSecr=394291152
295 2.401775515 172.31.31.144 -> 172.31.24.227 TCP 66 6633 → 50460 [ACK] Seq=1 Ack=247 Win=853 Len=0 TSval=1225880 TSecr=394291152
296 2.402002380 172.31.31.144 -> 172.31.24.227 TCP 66 6633 → 50454 [ACK] Seq=969 Ack=493 Win=853 Len=0 TSval=1225880 TSecr=394291152
297 2.402085828 172.31.24.227 -> 172.31.31.144 OpenFlow 189 Type: OFPT_PACKET_IN
298 2.402119183 172.31.24.227 -> 172.31.31.144 OpenFlow 189 Type: OFPT_PACKET_IN
299 2.402154350 172.31.24.227 -> 172.31.31.144 OpenFlow 189 Type: OFPT_PACKET_IN
300 2.402177294 172.31.24.227 -> 172.31.31.144 OpenFlow 189 Type: OFPT_PACKET_IN
301 2.402189131 172.31.24.227 -> 172.31.31.144 OpenFlow 189 Type: OFPT_PACKET_IN
302 2.402229064 172.31.24.227 -> 172.31.31.144 OpenFlow 189 Type: OFPT_PACKET_IN
303 2.402357673 172.31.24.227 -> 172.31.31.144 OpenFlow 189 Type: OFPT_PACKET_IN
304 2.402392682 172.31.31.144 -> 172.31.24.227 TCP 66 6633 → 50446 [ACK] Seq=1211 Ack=1231 Win=853 Len=0 TSval=1225880 TSecr=394291152
305 2.402399068 172.31.31.144 -> 172.31.24.227 TCP 66 6633 → 50462 [ACK] Seq=1 Ack=124 Win=853 Len=0 TSval=1225880 TSecr=394291152
306 2.402402866 172.31.31.144 -> 172.31.24.227 TCP 66 6633 → 50462 [ACK] Seq=1 Ack=247 Win=853 Len=0 TSval=1225880 TSecr=394291152
307 2.402425215 172.31.24.227 -> 172.31.31.144 OpenFlow 189 Type: OFPT_PACKET_IN
308 2.402452047 172.31.24.227 -> 172.31.31.144 OpenFlow 189 Type: OFPT_PACKET_IN
309 2.402487500 172.31.24.227 -> 172.31.31.144 OpenFlow 189 Type: OFPT_PACKET_IN
310 2.402536133 172.31.31.144 -> 172.31.24.227 TCP 66 6633 → 50456 [ACK] Seq=1 Ack=370 Win=853 Len=0 TSval=1225880 TSecr=394291152
311 2.402603046 172.31.31.144 -> 172.31.24.227 TCP 66 6633 → 50456 [ACK] Seq=1 Ack=493 Win=853 Len=0 TSval=1225880 TSecr=394291153
312 2.402718919 172.31.31.144 -> 172.31.24.227 TCP 66 6633 → 50448 [ACK] Seq=969 Ack=739 Win=853 Len=0 TSval=1225881 TSecr=394291152
313 2.403257728 172.31.31.144 -> 172.31.24.227 TCP 66 6633 → 50452 [ACK] Seq=969 Ack=739 Win=853 Len=0 TSval=1225881 TSecr=394291153
