  1 0.000000000 172.31.31.144 -> 172.31.24.227 TCP 187 6633 → 53166 [PSH, ACK] Seq=1 Ack=1 Win=853 Len=121 TSval=1764068 TSecr=388656761
  2 0.000075230 172.31.31.144 -> 172.31.24.227 TCP 187 6633 → 53166 [PSH, ACK] Seq=122 Ack=1 Win=853 Len=121 TSval=1764068 TSecr=388656761
  3 0.000143965 172.31.31.144 -> 172.31.24.227 TCP 187 6633 → 53166 [PSH, ACK] Seq=243 Ack=1 Win=853 Len=121 TSval=1764068 TSecr=388656761
  4 0.000212878 172.31.31.144 -> 172.31.24.227 TCP 187 6633 → 53166 [PSH, ACK] Seq=364 Ack=1 Win=853 Len=121 TSval=1764068 TSecr=388656761
  5 0.000288366 172.31.31.144 -> 172.31.24.227 TCP 187 6633 → 53166 [PSH, ACK] Seq=485 Ack=1 Win=853 Len=121 TSval=1764068 TSecr=388656761
  6 0.000354338 172.31.31.144 -> 172.31.24.227 TCP 187 6633 → 53166 [PSH, ACK] Seq=606 Ack=1 Win=853 Len=121 TSval=1764068 TSecr=388656761
  7 0.000434539 172.31.31.144 -> 172.31.24.227 TCP 187 6633 → 53166 [PSH, ACK] Seq=727 Ack=1 Win=853 Len=121 TSval=1764068 TSecr=388656761
  8 0.000563326 172.31.31.144 -> 172.31.24.227 TCP 187 6633 → 53188 [PSH, ACK] Seq=1 Ack=1 Win=853 Len=121 TSval=1764068 TSecr=388656766
  9 0.000631636 172.31.31.144 -> 172.31.24.227 TCP 187 6633 → 53188 [PSH, ACK] Seq=122 Ack=1 Win=853 Len=121 TSval=1764068 TSecr=388656766
 10 0.000738637 172.31.31.144 -> 172.31.24.227 TCP 187 6633 → 53188 [PSH, ACK] Seq=243 Ack=1 Win=853 Len=121 TSval=1764068 TSecr=388656766
 11 0.000842246 172.31.31.144 -> 172.31.24.227 TCP 187 6633 → 53188 [PSH, ACK] Seq=364 Ack=1 Win=853 Len=121 TSval=1764068 TSecr=388656766
 12 0.000951071 172.31.31.144 -> 172.31.24.227 TCP 187 6633 → 53188 [PSH, ACK] Seq=485 Ack=1 Win=853 Len=121 TSval=1764068 TSecr=388656766
 13 0.001057075 172.31.31.144 -> 172.31.24.227 TCP 187 6633 → 53188 [PSH, ACK] Seq=606 Ack=1 Win=853 Len=121 TSval=1764068 TSecr=388656766
 14 0.001274715 172.31.31.144 -> 172.31.24.227 TCP 187 6633 → 53178 [PSH, ACK] Seq=1 Ack=1 Win=853 Len=121 TSval=1764068 TSecr=388656766
 15 0.001377175 172.31.31.144 -> 172.31.24.227 TCP 187 6633 → 53178 [PSH, ACK] Seq=122 Ack=1 Win=853 Len=121 TSval=1764068 TSecr=388656766
 16 0.001477691 172.31.31.144 -> 172.31.24.227 TCP 187 6633 → 53178 [PSH, ACK] Seq=243 Ack=1 Win=853 Len=121 TSval=1764068 TSecr=388656766
 17 0.001598586 172.31.24.227 -> 172.31.31.144 TCP 66 53152 → 6633 [ACK] Seq=1 Ack=1 Win=213 Len=0 TSval=388656924 TSecr=1764068
 18 0.001606803 172.31.31.144 -> 172.31.24.227 TCP 187 6633 → 53178 [PSH, ACK] Seq=364 Ack=1 Win=853 Len=121 TSval=1764068 TSecr=388656766
 19 0.001678204 172.31.31.144 -> 172.31.24.227 TCP 187 6633 → 53178 [PSH, ACK] Seq=485 Ack=1 Win=853 Len=121 TSval=1764068 TSecr=388656766
 20 0.001769502 172.31.31.144 -> 172.31.24.227 TCP 187 6633 → 53178 [PSH, ACK] Seq=606 Ack=1 Win=853 Len=121 TSval=1764068 TSecr=388656766
 21 0.001891670 172.31.31.144 -> 172.31.24.227 TCP 187 6633 → 53178 [PSH, ACK] Seq=727 Ack=1 Win=853 Len=121 TSval=1764068 TSecr=388656766
 22 0.001969038 172.31.24.227 -> 172.31.31.144 TCP 66 53154 → 6633 [ACK] Seq=1 Ack=1 Win=213 Len=0 TSval=388656924 TSecr=1764068
 23 0.001995726 172.31.31.144 -> 172.31.24.227 TCP 187 6633 → 53178 [PSH, ACK] Seq=848 Ack=1 Win=853 Len=121 TSval=1764068 TSecr=388656766
 24 0.002083598 172.31.31.144 -> 172.31.24.227 TCP 187 6633 → 53178 [PSH, ACK] Seq=969 Ack=1 Win=853 Len=121 TSval=1764068 TSecr=388656766
 25 0.002204173 172.31.31.144 -> 172.31.24.227 TCP 187 6633 → 53178 [PSH, ACK] Seq=1090 Ack=1 Win=853 Len=121 TSval=1764068 TSecr=388656766
 26 0.002312585 172.31.31.144 -> 172.31.24.227 TCP 187 6633 → 53182 [PSH, ACK] Seq=1 Ack=1 Win=853 Len=121 TSval=1764068 TSecr=388656765
 27 0.002387507 172.31.31.144 -> 172.31.24.227 TCP 187 6633 → 53182 [PSH, ACK] Seq=122 Ack=1 Win=853 Len=121 TSval=1764069 TSecr=388656765
 28 0.002449433 172.31.24.227 -> 172.31.31.144 TCP 66 53156 → 6633 [ACK] Seq=1 Ack=1 Win=213 Len=0 TSval=388656924 TSecr=1764068
 29 0.002460196 172.31.31.144 -> 172.31.24.227 TCP 187 6633 → 53182 [PSH, ACK] Seq=243 Ack=1 Win=853 Len=121 TSval=1764069 TSecr=388656765
 30 0.002538111 172.31.31.144 -> 172.31.24.227 TCP 187 6633 → 53182 [PSH, ACK] Seq=364 Ack=1 Win=853 Len=121 TSval=1764069 TSecr=388656765
 31 0.002615647 172.31.31.144 -> 172.31.24.227 TCP 187 6633 → 53182 [PSH, ACK] Seq=485 Ack=1 Win=853 Len=121 TSval=1764069 TSecr=388656765
 32 0.002697826 172.31.31.144 -> 172.31.24.227 TCP 187 6633 → 53182 [PSH, ACK] Seq=606 Ack=1 Win=853 Len=121 TSval=1764069 TSecr=388656765
 33 0.002782266 172.31.31.144 -> 172.31.24.227 TCP 187 6633 → 53174 [PSH, ACK] Seq=1 Ack=1 Win=853 Len=121 TSval=1764069 TSecr=388656765
 34 0.002850618 172.31.31.144 -> 172.31.24.227 TCP 187 6633 → 53174 [PSH, ACK] Seq=122 Ack=1 Win=853 Len=121 TSval=1764069 TSecr=388656765
 35 0.002885735 172.31.24.227 -> 172.31.31.144 TCP 66 53158 → 6633 [ACK] Seq=1 Ack=1 Win=213 Len=0 TSval=388656924 TSecr=1764067
 36 0.002922588 172.31.31.144 -> 172.31.24.227 TCP 187 6633 → 53174 [PSH, ACK] Seq=243 Ack=1 Win=853 Len=121 TSval=1764069 TSecr=388656765
 37 0.002980681 172.31.24.227 -> 172.31.31.144 OpenFlow 189 Type: OFPT_PACKET_IN
 38 0.002991300 172.31.31.144 -> 172.31.24.227 TCP 187 6633 → 53174 [PSH, ACK] Seq=364 Ack=1 Win=853 Len=121 TSval=1764069 TSecr=388656765
 39 0.003007755 172.31.24.227 -> 172.31.31.144 OpenFlow 189 Type: OFPT_PACKET_IN
 40 0.003063797 172.31.31.144 -> 172.31.24.227 TCP 187 6633 → 53174 [PSH, ACK] Seq=485 Ack=1 Win=853 Len=121 TSval=1764069 TSecr=388656765
 41 0.003135074 172.31.31.144 -> 172.31.24.227 TCP 187 6633 → 53174 [PSH, ACK] Seq=606 Ack=1 Win=853 Len=121 TSval=1764069 TSecr=388656765
 42 0.003196439 172.31.31.144 -> 172.31.24.227 TCP 66 6633 → 53160 [ACK] Seq=1 Ack=124 Win=853 Len=0 TSval=1764069 TSecr=388656924
 43 0.003228630 172.31.31.144 -> 172.31.24.227 TCP 66 6633 → 53160 [ACK] Seq=1 Ack=247 Win=853 Len=0 TSval=1764069 TSecr=388656924
 44 0.003569845 172.31.24.227 -> 172.31.31.144 OpenFlow 189 Type: OFPT_PACKET_IN
 45 0.003595092 172.31.24.227 -> 172.31.31.144 OpenFlow 189 Type: OFPT_PACKET_IN
 46 0.003809227 172.31.31.144 -> 172.31.24.227 TCP 66 6633 → 53162 [ACK] Seq=1 Ack=247 Win=853 Len=0 TSval=1764069 TSecr=388656924
 47 0.004132152 172.31.24.227 -> 172.31.31.144 OpenFlow 189 Type: OFPT_PACKET_IN
 48 0.004157339 172.31.24.227 -> 172.31.31.144 OpenFlow 189 Type: OFPT_PACKET_IN
 49 0.004398669 172.31.31.144 -> 172.31.24.227 TCP 66 6633 → 53164 [ACK] Seq=1 Ack=124 Win=853 Len=0 TSval=1764069 TSecr=388656925
 50 0.004405511 172.31.31.144 -> 172.31.24.227 TCP 66 6633 → 53164 [ACK] Seq=1 Ack=247 Win=853 Len=0 TSval=1764069 TSecr=388656925
 51 0.004638391 172.31.24.227 -> 172.31.31.144 OpenFlow 189 Type: OFPT_PACKET_IN
 52 0.004662924 172.31.24.227 -> 172.31.31.144 OpenFlow 189 Type: OFPT_PACKET_IN
 53 0.004882122 172.31.31.144 -> 172.31.24.227 TCP 66 6633 → 53166 [ACK] Seq=848 Ack=247 Win=853 Len=0 TSval=1764069 TSecr=388656925
 54 0.005217973 172.31.24.227 -> 172.31.31.144 OpenFlow 189 Type: OFPT_PACKET_IN
 55 0.005243749 172.31.24.227 -> 172.31.31.144 OpenFlow 435 Type: OFPT_PACKET_IN
 56 0.005259991 172.31.24.227 -> 172.31.31.144 OpenFlow 189 Type: OFPT_PACKET_IN
 57 0.005312022 172.31.24.227 -> 172.31.31.144 OpenFlow 435 Type: OFPT_PACKET_IN
 58 0.005459414 172.31.31.144 -> 172.31.24.227 TCP 66 6633 → 53168 [ACK] Seq=1 Ack=124 Win=853 Len=0 TSval=1764069 TSecr=388656925
 59 0.005467493 172.31.31.144 -> 172.31.24.227 TCP 66 6633 → 53168 [ACK] Seq=1 Ack=493 Win=853 Len=0 TSval=1764069 TSecr=388656925
 60 0.005551890 172.31.24.227 -> 172.31.31.144 OpenFlow 189 Type: OFPT_PACKET_IN
 61 0.005574844 172.31.24.227 -> 172.31.31.144 OpenFlow 558 Type: OFPT_PACKET_IN
 62 0.005597354 172.31.24.227 -> 172.31.31.144 OpenFlow 189 Type: OFPT_PACKET_IN
 63 0.005645049 172.31.24.227 -> 172.31.31.144 OpenFlow 189 Type: OFPT_PACKET_IN
 64 0.005652334 172.31.24.227 -> 172.31.31.144 OpenFlow 189 Type: OFPT_PACKET_IN
 65 0.005934706 172.31.24.227 -> 172.31.31.144 OpenFlow 189 Type: OFPT_PACKET_IN
 66 0.005959148 172.31.24.227 -> 172.31.31.144 OpenFlow 435 Type: OFPT_PACKET_IN
 67 0.005978268 172.31.24.227 -> 172.31.31.144 OpenFlow 189 Type: OFPT_PACKET_IN
 68 0.006019162 172.31.31.144 -> 172.31.24.227 TCP 66 6633 → 53170 [ACK] Seq=1 Ack=493 Win=853 Len=0 TSval=1764069 TSecr=388656925
 69 0.006051803 172.31.24.227 -> 172.31.31.144 OpenFlow 189 Type: OFPT_PACKET_IN
 70 0.006153274 172.31.31.144 -> 172.31.24.227 TCP 66 6633 → 53176 [ACK] Seq=1 Ack=124 Win=853 Len=0 TSval=1764069 TSecr=388656925
 71 0.006241983 172.31.31.144 -> 172.31.24.227 TCP 66 6633 → 53176 [ACK] Seq=1 Ack=493 Win=853 Len=0 TSval=1764069 TSecr=388656925
 72 0.006248744 172.31.31.144 -> 172.31.24.227 TCP 66 6633 → 53178 [ACK] Seq=1211 Ack=124 Win=853 Len=0 TSval=1764069 TSecr=388656925
 73 0.006251302 172.31.31.144 -> 172.31.24.227 TCP 66 6633 → 53178 [ACK] Seq=1211 Ack=247 Win=853 Len=0 TSval=1764069 TSecr=388656925
 74 0.006393497 172.31.31.144 -> 172.31.24.227 TCP 187 6633 → 53190 [PSH, ACK] Seq=1 Ack=1 Win=853 Len=121 TSval=1764070 TSecr=388656757
 75 0.006402565 172.31.24.227 -> 172.31.31.144 TCP 78 53190 → 6633 [ACK] Seq=1 Ack=122 Win=212 Len=0 TSval=388656925 TSecr=1764067 SLE=1 SRE=122
 76 0.006595386 172.31.24.227 -> 172.31.31.144 OpenFlow 189 Type: OFPT_PACKET_IN
 77 0.006618761 172.31.24.227 -> 172.31.31.144 OpenFlow 435 Type: OFPT_PACKET_IN
 78 0.006636461 172.31.24.227 -> 172.31.31.144 TCP 66 53182 → 6633 [ACK] Seq=1 Ack=727 Win=212 Len=0 TSval=388656925 TSecr=1764068
 79 0.006861629 172.31.31.144 -> 172.31.24.227 TCP 66 6633 → 53180 [ACK] Seq=1 Ack=124 Win=853 Len=0 TSval=1764070 TSecr=388656925
 80 0.006869466 172.31.31.144 -> 172.31.24.227 TCP 66 6633 → 53180 [ACK] Seq=1 Ack=493 Win=853 Len=0 TSval=1764070 TSecr=388656925
 81 0.006871896 172.31.31.144 -> 172.31.24.227 TCP 66 6633 → 53174 [ACK] Seq=727 Ack=247 Win=853 Len=0 TSval=1764070 TSecr=388656925
 82 0.006894882 172.31.24.227 -> 172.31.31.144 OpenFlow 189 Type: OFPT_PACKET_IN
 83 0.006914315 172.31.24.227 -> 172.31.31.144 OpenFlow 435 Type: OFPT_PACKET_IN
 84 0.006934869 172.31.24.227 -> 172.31.31.144 OpenFlow 189 Type: OFPT_PACKET_IN
 85 0.006956163 172.31.24.227 -> 172.31.31.144 OpenFlow 189 Type: OFPT_PACKET_IN
 86 0.007009837 172.31.24.227 -> 172.31.31.144 OpenFlow 435 Type: OFPT_PACKET_IN
 87 0.007016837 172.31.24.227 -> 172.31.31.144 OpenFlow 189 Type: OFPT_PACKET_IN
 88 0.007169095 172.31.31.144 -> 172.31.24.227 TCP 66 6633 → 53184 [ACK] Seq=1 Ack=124 Win=853 Len=0 TSval=1764070 TSecr=388656925
 89 0.007176714 172.31.31.144 -> 172.31.24.227 TCP 66 6633 → 53184 [ACK] Seq=1 Ack=493 Win=853 Len=0 TSval=1764070 TSecr=388656925
 90 0.007179229 172.31.31.144 -> 172.31.24.227 TCP 66 6633 → 53186 [ACK] Seq=1 Ack=124 Win=853 Len=0 TSval=1764070 TSecr=388656925
 91 0.007181900 172.31.31.144 -> 172.31.24.227 TCP 66 6633 → 53188 [ACK] Seq=727 Ack=124 Win=853 Len=0 TSval=1764070 TSecr=388656925
 92 0.007234950 172.31.31.144 -> 172.31.24.227 TCP 66 6633 → 53186 [ACK] Seq=1 Ack=493 Win=853 Len=0 TSval=1764070 TSecr=388656925
 93 0.007241303 172.31.31.144 -> 172.31.24.227 TCP 66 6633 → 53188 [ACK] Seq=727 Ack=247 Win=853 Len=0 TSval=1764070 TSecr=388656925
 94 0.007280752 172.31.24.227 -> 172.31.31.144 OpenFlow 189 Type: OFPT_PACKET_IN
 95 0.007302735 172.31.24.227 -> 172.31.31.144 OpenFlow 435 Type: OFPT_PACKET_IN
 96 0.007521566 172.31.31.144 -> 172.31.24.227 TCP 66 6633 → 53190 [ACK] Seq=122 Ack=124 Win=853 Len=0 TSval=1764070 TSecr=388656925
 97 0.007528362 172.31.31.144 -> 172.31.24.227 TCP 66 6633 → 53190 [ACK] Seq=122 Ack=493 Win=853 Len=0 TSval=1764070 TSecr=388656925
 98 0.007649230 172.31.31.144 -> 172.31.24.227 TCP 66 6633 → 53172 [ACK] Seq=1 Ack=739 Win=853 Len=0 TSval=1764070 TSecr=388656925
 99 0.007679972 172.31.24.227 -> 172.31.31.144 OpenFlow 189 Type: OFPT_PACKET_IN
100 0.007699941 172.31.24.227 -> 172.31.31.144 OpenFlow 435 Type: OFPT_PACKET_IN
101 0.007724173 172.31.24.227 -> 172.31.31.144 OpenFlow 189 Type: OFPT_PACKET_IN
102 0.007747770 172.31.24.227 -> 172.31.31.144 OpenFlow 189 Type: OFPT_PACKET_IN
103 0.007753864 172.31.24.227 -> 172.31.31.144 OpenFlow 312 Type: OFPT_PACKET_IN
104 0.007779222 172.31.24.227 -> 172.31.31.144 OpenFlow 189 Type: OFPT_PACKET_IN
105 0.007782033 172.31.24.227 -> 172.31.31.144 OpenFlow 681 Type: OFPT_PACKET_IN
106 0.007892536 172.31.24.227 -> 172.31.31.144 OpenFlow 681 Type: OFPT_PACKET_IN
107 0.007899733 172.31.24.227 -> 172.31.31.144 OpenFlow 435 Type: OFPT_PACKET_IN
108 0.008004212 172.31.31.144 -> 172.31.24.227 TCP 66 6633 → 53192 [ACK] Seq=1 Ack=124 Win=853 Len=0 TSval=1764070 TSecr=388656925
109 0.008010783 172.31.31.144 -> 172.31.24.227 TCP 66 6633 → 53192 [ACK] Seq=1 Ack=493 Win=853 Len=0 TSval=1764070 TSecr=388656925
110 0.008013153 172.31.31.144 -> 172.31.24.227 TCP 66 6633 → 53194 [ACK] Seq=1 Ack=124 Win=853 Len=0 TSval=1764070 TSecr=388656925
111 0.008027517 172.31.31.144 -> 172.31.24.227 TCP 66 6633 → 53196 [ACK] Seq=1 Ack=124 Win=853 Len=0 TSval=1764070 TSecr=388656925
112 0.008030685 172.31.31.144 -> 172.31.24.227 TCP 66 6633 → 53192 [ACK] Seq=1 Ack=739 Win=853 Len=0 TSval=1764070 TSecr=388656925
113 0.008077413 172.31.31.144 -> 172.31.24.227 TCP 66 6633 → 53198 [ACK] Seq=1 Ack=124 Win=853 Len=0 TSval=1764070 TSecr=388656925
114 0.008141458 172.31.31.144 -> 172.31.24.227 TCP 66 6633 → 53194 [ACK] Seq=1 Ack=739 Win=853 Len=0 TSval=1764070 TSecr=388656925
115 0.008184490 172.31.31.144 -> 172.31.24.227 TCP 66 6633 → 53196 [ACK] Seq=1 Ack=739 Win=853 Len=0 TSval=1764070 TSecr=388656925
116 0.008241603 172.31.31.144 -> 172.31.24.227 TCP 66 6633 → 53198 [ACK] Seq=1 Ack=493 Win=853 Len=0 TSval=1764070 TSecr=388656925
117 0.013771231 172.31.24.227 -> 172.31.31.144 OpenFlow 189 Type: OFPT_PACKET_IN
118 0.013799111 172.31.24.227 -> 172.31.31.144 OpenFlow 435 Type: OFPT_PACKET_IN
119 0.013826354 172.31.24.227 -> 172.31.31.144 OpenFlow 189 Type: OFPT_PACKET_IN
120 0.013846447 172.31.24.227 -> 172.31.31.144 OpenFlow 189 Type: OFPT_PACKET_IN
121 0.013872153 172.31.24.227 -> 172.31.31.144 OpenFlow 189 Type: OFPT_PACKET_IN
122 0.013875346 172.31.24.227 -> 172.31.31.144 OpenFlow 435 Type: OFPT_PACKET_IN
123 0.013896240 172.31.24.227 -> 172.31.31.144 OpenFlow 189 Type: OFPT_PACKET_IN
124 0.013902614 172.31.24.227 -> 172.31.31.144 OpenFlow 435 Type: OFPT_PACKET_IN
125 0.013927089 172.31.24.227 -> 172.31.31.144 OpenFlow 189 Type: OFPT_PACKET_IN
126 0.013930131 172.31.24.227 -> 172.31.31.144 OpenFlow 435 Type: OFPT_PACKET_IN
127 0.013950959 172.31.24.227 -> 172.31.31.144 OpenFlow 189 Type: OFPT_PACKET_IN
128 0.013986731 172.31.24.227 -> 172.31.31.144 OpenFlow 189 Type: OFPT_PACKET_IN
129 0.014027006 172.31.24.227 -> 172.31.31.144 OpenFlow 189 Type: OFPT_PACKET_IN
130 0.014051253 172.31.31.144 -> 172.31.24.227 TCP 66 6633 → 53152 [ACK] Seq=1 Ack=124 Win=853 Len=0 TSval=1764071 TSecr=388656927
131 0.014057807 172.31.31.144 -> 172.31.24.227 TCP 66 6633 → 53152 [ACK] Seq=1 Ack=493 Win=853 Len=0 TSval=1764071 TSecr=388656927
132 0.014060489 172.31.31.144 -> 172.31.24.227 TCP 66 6633 → 53156 [ACK] Seq=1 Ack=124 Win=853 Len=0 TSval=1764071 TSecr=388656927
133 0.014174202 172.31.24.227 -> 172.31.31.144 OpenFlow 189 Type: OFPT_PACKET_IN
134 0.014181086 172.31.24.227 -> 172.31.31.144 OpenFlow 435 Type: OFPT_PACKET_IN
135 0.014243557 172.31.24.227 -> 172.31.31.144 OpenFlow 189 Type: OFPT_PACKET_IN
136 0.014246861 172.31.24.227 -> 172.31.31.144 OpenFlow 189 Type: OFPT_PACKET_IN
137 0.014249018 172.31.24.227 -> 172.31.31.144 OpenFlow 189 Type: OFPT_PACKET_IN
138 0.014298597 172.31.31.144 -> 172.31.24.227 TCP 66 6633 → 53158 [ACK] Seq=1 Ack=124 Win=853 Len=0 TSval=1764071 TSecr=388656927
139 0.014304812 172.31.31.144 -> 172.31.24.227 TCP 66 6633 → 53160 [ACK] Seq=1 Ack=370 Win=853 Len=0 TSval=1764071 TSecr=388656927
140 0.014307302 172.31.31.144 -> 172.31.24.227 TCP 66 6633 → 53156 [ACK] Seq=1 Ack=493 Win=853 Len=0 TSval=1764071 TSecr=388656927
141 0.014309742 172.31.31.144 -> 172.31.24.227 TCP 66 6633 → 53158 [ACK] Seq=1 Ack=493 Win=853 Len=0 TSval=1764071 TSecr=388656927
142 0.014511503 172.31.31.144 -> 172.31.24.227 TCP 66 6633 → 53160 [ACK] Seq=1 Ack=739 Win=853 Len=0 TSval=1764071 TSecr=388656927
143 0.014515775 172.31.31.144 -> 172.31.24.227 TCP 66 6633 → 53176 [ACK] Seq=1 Ack=616 Win=853 Len=0 TSval=1764072 TSecr=388656927
144 0.014518399 172.31.31.144 -> 172.31.24.227 TCP 66 6633 → 53168 [ACK] Seq=1 Ack=616 Win=853 Len=0 TSval=1764072 TSecr=388656927
145 0.014520534 172.31.31.144 -> 172.31.24.227 TCP 66 6633 → 53186 [ACK] Seq=1 Ack=616 Win=853 Len=0 TSval=1764072 TSecr=388656927
146 0.014685846 172.31.31.144 -> 172.31.24.227 TCP 66 6633 → 53176 [ACK] Seq=1 Ack=739 Win=853 Len=0 TSval=1764072 TSecr=388656927
147 0.014689659 172.31.31.144 -> 172.31.24.227 TCP 66 6633 → 53186 [ACK] Seq=1 Ack=739 Win=853 Len=0 TSval=1764072 TSecr=388656927
148 0.014692272 172.31.31.144 -> 172.31.24.227 TCP 66 6633 → 53162 [ACK] Seq=1 Ack=493 Win=853 Len=0 TSval=1764072 TSecr=388656927
149 0.014695149 172.31.31.144 -> 172.31.24.227 TCP 66 6633 → 53168 [ACK] Seq=1 Ack=739 Win=853 Len=0 TSval=1764072 TSecr=388656927
150 0.016319487 172.31.31.144 -> 172.31.24.227 TCP 66 6633 → 53166 [ACK] Seq=848 Ack=739 Win=853 Len=0 TSval=1764072 TSecr=388656927
151 0.061799083 137.158.125.247 -> 172.31.24.227 TCP 54 63468 → 22 [ACK] Seq=1 Ack=1 Win=32464 Len=0
152 0.099594546 172.31.31.144 -> 172.31.24.227 TCP 90 6633 → 53154 [PSH, ACK] Seq=1 Ack=1 Win=853 Len=24 TSval=1764093 TSecr=388656924
153 0.099608325 172.31.31.144 -> 172.31.24.227 TCP 82 6633 → 53154 [PSH, ACK] Seq=25 Ack=1 Win=853 Len=16 TSval=1764093 TSecr=388656924
154 0.099611608 172.31.31.144 -> 172.31.24.227 TCP 90 6633 → 53154 [PSH, ACK] Seq=41 Ack=1 Win=853 Len=24 TSval=1764093 TSecr=388656924
155 0.099613629 172.31.31.144 -> 172.31.24.227 OpenFlow 90 Type: OFPT_MULTIPART_REQUEST, OFPMP_GROUP
156 0.099617121 172.31.31.144 -> 172.31.24.227 OpenFlow 106 Type: OFPT_MULTIPART_REQUEST, OFPMP_METER
157 0.099619192 172.31.31.144 -> 172.31.24.227 OpenFlow 90 Type: OFPT_MULTIPART_REQUEST, OFPMP_GROUP
158 0.099621772 172.31.31.144 -> 172.31.24.227 OpenFlow 82 Type: OFPT_MULTIPART_REQUEST, OFPMP_GROUP_DESC
159 0.099623888 172.31.31.144 -> 172.31.24.227 OpenFlow 90 Type: OFPT_MULTIPART_REQUEST, OFPMP_METER
160 0.099625805 172.31.31.144 -> 172.31.24.227 OpenFlow 90 Type: OFPT_MULTIPART_REQUEST, OFPMP_GROUP
161 0.099628641 172.31.31.144 -> 172.31.24.227 OpenFlow 90 Type: OFPT_MULTIPART_REQUEST, OFPMP_GROUP
162 0.099631364 172.31.31.144 -> 172.31.24.227 OpenFlow 90 Type: OFPT_MULTIPART_REQUEST, OFPMP_GROUP
163 0.099633894 172.31.31.144 -> 172.31.24.227 OpenFlow 82 Type: OFPT_MULTIPART_REQUEST, OFPMP_GROUP_DESC
164 0.099636457 172.31.31.144 -> 172.31.24.227 OpenFlow 1316 Type: OFPT_PACKET_OUT
165 0.099647390 172.31.24.227 -> 172.31.31.144 TCP 66 53196 → 6633 [ACK] Seq=739 Ack=1275 Win=213 Len=0 TSval=388656948 TSecr=1764093
166 0.099653667 172.31.31.144 -> 172.31.24.227 OpenFlow 106 Type: OFPT_MULTIPART_REQUEST, OFPMP_METER
167 0.099656209 172.31.31.144 -> 172.31.24.227 OpenFlow 453 Type: OFPT_PACKET_OUT
168 0.099658409 172.31.31.144 -> 172.31.24.227 OpenFlow 550 Type: OFPT_PACKET_OUT
169 0.099665155 172.31.24.227 -> 172.31.31.144 TCP 66 53186 → 6633 [ACK] Seq=739 Ack=912 Win=213 Len=0 TSval=388656948 TSecr=1764093
170 0.099669198 172.31.31.144 -> 172.31.24.227 OpenFlow 187 Type: OFPT_PACKET_OUT
171 0.099672254 172.31.31.144 -> 172.31.24.227 OpenFlow 90 Type: OFPT_MULTIPART_REQUEST, OFPMP_GROUP
172 0.099675356 172.31.31.144 -> 172.31.24.227 OpenFlow 106 Type: OFPT_MULTIPART_REQUEST, OFPMP_METER
173 0.099677222 172.31.31.144 -> 172.31.24.227 OpenFlow 90 Type: OFPT_MULTIPART_REQUEST, OFPMP_GROUP
174 0.099680357 172.31.31.144 -> 172.31.24.227 OpenFlow 106 Type: OFPT_MULTIPART_REQUEST, OFPMP_METER
175 0.099682085 172.31.31.144 -> 172.31.24.227 OpenFlow 90 Type: OFPT_MULTIPART_REQUEST, OFPMP_GROUP
176 0.099684503 172.31.31.144 -> 172.31.24.227 OpenFlow 106 Type: OFPT_MULTIPART_REQUEST, OFPMP_METER
177 0.099686320 172.31.31.144 -> 172.31.24.227 TCP 90 6633 → 53182 [PSH, ACK] Seq=727 Ack=1 Win=853 Len=24 TSval=1764093 TSecr=388656925
178 0.099689085 172.31.31.144 -> 172.31.24.227 TCP 82 6633 → 53182 [PSH, ACK] Seq=751 Ack=1 Win=853 Len=16 TSval=1764093 TSecr=388656925
179 0.099690823 172.31.31.144 -> 172.31.24.227 TCP 90 6633 → 53182 [PSH, ACK] Seq=767 Ack=1 Win=853 Len=24 TSval=1764093 TSecr=388656925
180 0.099692541 172.31.31.144 -> 172.31.24.227 OpenFlow 90 Type: OFPT_MULTIPART_REQUEST, OFPMP_GROUP
181 0.099698010 172.31.31.144 -> 172.31.24.227 OpenFlow 82 Type: OFPT_MULTIPART_REQUEST, OFPMP_GROUP_DESC
182 0.099699827 172.31.31.144 -> 172.31.24.227 OpenFlow 90 Type: OFPT_MULTIPART_REQUEST, OFPMP_METER
183 0.099701866 172.31.31.144 -> 172.31.24.227 OpenFlow 90 Type: OFPT_MULTIPART_REQUEST, OFPMP_GROUP
184 0.099704654 172.31.31.144 -> 172.31.24.227 OpenFlow 82 Type: OFPT_MULTIPART_REQUEST, OFPMP_GROUP_DESC
185 0.099706567 172.31.31.144 -> 172.31.24.227 OpenFlow 332 Type: OFPT_PACKET_OUT
186 0.099708614 172.31.31.144 -> 172.31.24.227 OpenFlow 550 Type: OFPT_PACKET_OUT
187 0.099712147 172.31.24.227 -> 172.31.31.144 TCP 66 53198 → 6633 [ACK] Seq=493 Ack=791 Win=108 Len=0 TSval=388656948 TSecr=1764093
188 0.099716273 172.31.31.144 -> 172.31.24.227 OpenFlow 90 Type: OFPT_MULTIPART_REQUEST, OFPMP_GROUP
189 0.099719473 172.31.31.144 -> 172.31.24.227 OpenFlow 106 Type: OFPT_MULTIPART_REQUEST, OFPMP_METER
190 0.099721321 172.31.31.144 -> 172.31.24.227 OpenFlow 90 Type: OFPT_MULTIPART_REQUEST, OFPMP_GROUP
191 0.099726357 172.31.31.144 -> 172.31.24.227 OpenFlow 82 Type: OFPT_MULTIPART_REQUEST, OFPMP_GROUP_DESC
192 0.099728475 172.31.31.144 -> 172.31.24.227 OpenFlow 90 Type: OFPT_MULTIPART_REQUEST, OFPMP_METER
193 0.099730171 172.31.31.144 -> 172.31.24.227 OpenFlow 90 Type: OFPT_MULTIPART_REQUEST, OFPMP_GROUP
194 0.099732677 172.31.31.144 -> 172.31.24.227 OpenFlow 106 Type: OFPT_MULTIPART_REQUEST, OFPMP_METER
195 0.099734639 172.31.31.144 -> 172.31.24.227 OpenFlow 90 Type: OFPT_MULTIPART_REQUEST, OFPMP_GROUP
196 0.099737111 172.31.31.144 -> 172.31.24.227 OpenFlow 90 Type: OFPT_MULTIPART_REQUEST, OFPMP_GROUP
197 0.099739598 172.31.31.144 -> 172.31.24.227 OpenFlow 1074 Type: OFPT_PACKET_OUT
198 0.099743626 172.31.24.227 -> 172.31.31.144 TCP 66 53180 → 6633 [ACK] Seq=493 Ack=1033 Win=177 Len=0 TSval=388656948 TSecr=1764093
199 0.099747153 172.31.31.144 -> 172.31.24.227 OpenFlow 82 Type: OFPT_MULTIPART_REQUEST, OFPMP_GROUP_DESC
200 0.099749607 172.31.31.144 -> 172.31.24.227 OpenFlow 453 Type: OFPT_PACKET_OUT
201 0.099751861 172.31.31.144 -> 172.31.24.227 OpenFlow 429 Type: OFPT_PACKET_OUT
202 0.099754800 172.31.24.227 -> 172.31.31.144 TCP 66 53194 → 6633 [ACK] Seq=739 Ack=791 Win=213 Len=0 TSval=388656948 TSecr=1764093
203 0.099756654 172.31.31.144 -> 172.31.24.227 OpenFlow 90 Type: OFPT_MULTIPART_REQUEST, OFPMP_GROUP
204 0.099759247 172.31.31.144 -> 172.31.24.227 OpenFlow 469 Type: OFPT_PACKET_OUT
205 0.099761485 172.31.31.144 -> 172.31.24.227 OpenFlow 671 Type: OFPT_PACKET_OUT
206 0.099763399 172.31.31.144 -> 172.31.24.227 OpenFlow 308 Type: OFPT_PACKET_OUT
207 0.099765395 172.31.31.144 -> 172.31.24.227 OpenFlow 90 Type: OFPT_MULTIPART_REQUEST, OFPMP_GROUP
208 0.099767792 172.31.31.144 -> 172.31.24.227 OpenFlow 106 Type: OFPT_MULTIPART_REQUEST, OFPMP_METER
209 0.099769438 172.31.31.144 -> 172.31.24.227 OpenFlow 90 Type: OFPT_MULTIPART_REQUEST, OFPMP_GROUP
210 0.099772327 172.31.31.144 -> 172.31.24.227 OpenFlow 106 Type: OFPT_MULTIPART_REQUEST, OFPMP_METER
211 0.099774106 172.31.31.144 -> 172.31.24.227 OpenFlow 90 Type: OFPT_MULTIPART_REQUEST, OFPMP_GROUP
212 0.099776350 172.31.31.144 -> 172.31.24.227 OpenFlow 348 Type: OFPT_PACKET_OUT
213 0.099778147 172.31.31.144 -> 172.31.24.227 OpenFlow 550 Type: OFPT_PACKET_OUT
214 0.099780154 172.31.31.144 -> 172.31.24.227 OpenFlow 90 Type: OFPT_MULTIPART_REQUEST, OFPMP_GROUP
215 0.099785477 172.31.31.144 -> 172.31.24.227 OpenFlow 308 Type: OFPT_PACKET_OUT
216 0.099787912 172.31.31.144 -> 172.31.24.227 OpenFlow 469 Type: OFPT_PACKET_OUT
217 0.099790316 172.31.31.144 -> 172.31.24.227 OpenFlow 429 Type: OFPT_PACKET_OUT
218 0.099793147 172.31.24.227 -> 172.31.31.144 TCP 66 53192 → 6633 [ACK] Seq=739 Ack=791 Win=213 Len=0 TSval=388656948 TSecr=1764093
219 0.099797331 172.31.31.144 -> 172.31.24.227 OpenFlow 90 Type: OFPT_MULTIPART_REQUEST, OFPMP_GROUP
220 0.099800137 172.31.31.144 -> 172.31.24.227 OpenFlow 348 Type: OFPT_PACKET_OUT
221 0.099837799 172.31.31.144 -> 172.31.24.227 OpenFlow 187 Type: OFPT_PACKET_OUT
222 0.099982421 172.31.31.144 -> 172.31.24.227 OpenFlow 187 Type: OFPT_PACKET_OUT
223 0.100086543 172.31.31.144 -> 172.31.24.227 OpenFlow 187 Type: OFPT_PACKET_OUT
224 0.100105218 172.31.24.227 -> 172.31.31.144 OpenFlow 82 Type: OFPT_MULTIPART_REPLY, OFPMP_GROUP
225 0.100133242 172.31.24.227 -> 172.31.31.144 OpenFlow 98 Type: OFPT_MULTIPART_REPLY, OFPMP_METER
226 0.100163551 172.31.24.227 -> 172.31.31.144 OpenFlow 82 Type: OFPT_MULTIPART_REPLY, OFPMP_GROUP
227 0.100181593 172.31.31.144 -> 172.31.24.227 OpenFlow 187 Type: OFPT_PACKET_OUT
228 0.100198671 172.31.24.227 -> 172.31.31.144 OpenFlow 82 Type: OFPT_MULTIPART_REPLY, OFPMP_GROUP
229 0.100225255 172.31.24.227 -> 172.31.31.144 OpenFlow 82 Type: OFPT_MULTIPART_REPLY, OFPMP_GROUP
230 0.100228431 172.31.24.227 -> 172.31.31.144 OpenFlow 98 Type: OFPT_MULTIPART_REPLY, OFPMP_METER
231 0.100248705 172.31.24.227 -> 172.31.31.144 OpenFlow 82 Type: OFPT_MULTIPART_REPLY, OFPMP_GROUP
232 0.100254776 172.31.24.227 -> 172.31.31.144 OpenFlow 98 Type: OFPT_MULTIPART_REPLY, OFPMP_METER
233 0.100276003 172.31.24.227 -> 172.31.31.144 OpenFlow 82 Type: OFPT_MULTIPART_REPLY, OFPMP_GROUP
234 0.100296031 172.31.24.227 -> 172.31.31.144 OpenFlow 82 Type: OFPT_MULTIPART_REPLY, OFPMP_GROUP
235 0.100298591 172.31.24.227 -> 172.31.31.144 OpenFlow 98 Type: OFPT_MULTIPART_REPLY, OFPMP_METER
236 0.100318060 172.31.24.227 -> 172.31.31.144 OpenFlow 82 Type: OFPT_MULTIPART_REPLY, OFPMP_GROUP
237 0.100336062 172.31.24.227 -> 172.31.31.144 TCP 66 53168 → 6633 [ACK] Seq=739 Ack=1033 Win=212 Len=0 TSval=388656949 TSecr=1764093
238 0.100341774 172.31.24.227 -> 172.31.31.144 OpenFlow 82 Type: OFPT_MULTIPART_REPLY, OFPMP_GROUP
239 0.100429882 172.31.31.144 -> 172.31.24.227 OpenFlow 187 Type: OFPT_PACKET_OUT
240 0.100435875 172.31.31.144 -> 172.31.24.227 TCP 66 6633 → 53152 [ACK] Seq=65 Ack=509 Win=853 Len=0 TSval=1764093 TSecr=388656949
241 0.100439912 172.31.31.144 -> 172.31.24.227 TCP 66 6633 → 53152 [ACK] Seq=65 Ack=541 Win=853 Len=0 TSval=1764093 TSecr=388656949
242 0.100442853 172.31.31.144 -> 172.31.24.227 TCP 66 6633 → 53154 [ACK] Seq=65 Ack=17 Win=853 Len=0 TSval=1764093 TSecr=388656949
243 0.100445164 172.31.31.144 -> 172.31.24.227 TCP 66 6633 → 53156 [ACK] Seq=65 Ack=509 Win=853 Len=0 TSval=1764093 TSecr=388656949
244 0.100623628 172.31.24.227 -> 172.31.31.144 OpenFlow 98 Type: OFPT_MULTIPART_REPLY, OFPMP_METER
245 0.100631417 172.31.24.227 -> 172.31.31.144 OpenFlow 98 Type: OFPT_MULTIPART_REPLY, OFPMP_METER
246 0.100633556 172.31.24.227 -> 172.31.31.144 OpenFlow 98 Type: OFPT_MULTIPART_REPLY, OFPMP_METER
247 0.100801197 172.31.31.144 -> 172.31.24.227 TCP 66 6633 → 53158 [ACK] Seq=65 Ack=509 Win=853 Len=0 TSval=1764093 TSecr=388656949
248 0.100807979 172.31.31.144 -> 172.31.24.227 TCP 66 6633 → 53154 [ACK] Seq=65 Ack=49 Win=853 Len=0 TSval=1764093 TSecr=388656949
249 0.100810800 172.31.31.144 -> 172.31.24.227 TCP 66 6633 → 53160 [ACK] Seq=65 Ack=755 Win=853 Len=0 TSval=1764093 TSecr=388656949
250 0.100813249 172.31.31.144 -> 172.31.24.227 TCP 66 6633 → 53156 [ACK] Seq=65 Ack=541 Win=853 Len=0 TSval=1764093 TSecr=388656949
251 0.100815541 172.31.31.144 -> 172.31.24.227 TCP 66 6633 → 53164 [ACK] Seq=65 Ack=263 Win=853 Len=0 TSval=1764093 TSecr=388656949
252 0.100817870 172.31.31.144 -> 172.31.24.227 TCP 66 6633 → 53158 [ACK] Seq=65 Ack=541 Win=853 Len=0 TSval=1764093 TSecr=388656949
253 0.100825616 172.31.24.227 -> 172.31.31.144 OpenFlow 98 Type: OFPT_MULTIPART_REPLY, OFPMP_METER
254 0.100835980 172.31.24.227 -> 172.31.31.144 OpenFlow 98 Type: OFPT_MULTIPART_REPLY, OFPMP_METER
255 0.101014885 172.31.24.227 -> 172.31.31.144 OpenFlow 82 Type: OFPT_MULTIPART_REPLY, OFPMP_GROUP
256 0.101034752 172.31.31.144 -> 172.31.24.227 TCP 66 6633 → 53168 [ACK] Seq=1033 Ack=755 Win=853 Len=0 TSval=1764093 TSecr=388656949
257 0.101040255 172.31.31.144 -> 172.31.24.227 TCP 66 6633 → 53160 [ACK] Seq=65 Ack=787 Win=853 Len=0 TSval=1764093 TSecr=388656949
258 0.101042718 172.31.31.144 -> 172.31.24.227 TCP 66 6633 → 53162 [ACK] Seq=65 Ack=541 Win=853 Len=0 TSval=1764093 TSecr=388656949
259 0.101045513 172.31.31.144 -> 172.31.24.227 TCP 66 6633 → 53164 [ACK] Seq=65 Ack=295 Win=853 Len=0 TSval=1764093 TSecr=388656949
260 0.101064168 172.31.24.227 -> 172.31.31.144 OpenFlow 82 Type: OFPT_MULTIPART_REPLY, OFPMP_GROUP_DESC
261 0.101087778 172.31.24.227 -> 172.31.31.144 TCP 66 53172 → 6633 [ACK] Seq=739 Ack=1275 Win=212 Len=0 TSval=388656949 TSecr=1764093
262 0.101095382 172.31.31.144 -> 172.31.24.227 TCP 66 6633 → 53166 [ACK] Seq=912 Ack=787 Win=853 Len=0 TSval=1764093 TSecr=388656949
263 0.101103770 172.31.24.227 -> 172.31.31.144 OpenFlow 82 Type: OFPT_MULTIPART_REPLY, OFPMP_GROUP
264 0.101160585 172.31.24.227 -> 172.31.31.144 OpenFlow 82 Type: OFPT_MULTIPART_REPLY, OFPMP_METER
265 0.101203806 172.31.31.144 -> 172.31.24.227 TCP 66 6633 → 53168 [ACK] Seq=1033 Ack=787 Win=853 Len=0 TSval=1764093 TSecr=388656949
266 0.101214790 172.31.24.227 -> 172.31.31.144 OpenFlow 98 Type: OFPT_MULTIPART_REPLY, OFPMP_METER
267 0.101252014 172.31.31.144 -> 172.31.24.227 OpenFlow 187 Type: OFPT_PACKET_OUT
268 0.101421122 172.31.31.144 -> 172.31.24.227 TCP 66 6633 → 53172 [ACK] Seq=1275 Ack=787 Win=853 Len=0 TSval=1764093 TSecr=388656949
269 0.101454070 172.31.31.144 -> 172.31.24.227 TCP 66 6633 → 53170 [ACK] Seq=65 Ack=541 Win=853 Len=0 TSval=1764093 TSecr=388656949
270 0.101566814 172.31.31.144 -> 172.31.24.227 OpenFlow 187 Type: OFPT_PACKET_OUT
271 0.101684858 172.31.31.144 -> 172.31.24.227 OpenFlow 187 Type: OFPT_PACKET_OUT
272 0.101711202 172.31.24.227 -> 172.31.31.144 OpenFlow 82 Type: OFPT_MULTIPART_REPLY, OFPMP_GROUP
273 0.101729332 172.31.24.227 -> 172.31.31.144 OpenFlow 82 Type: OFPT_MULTIPART_REPLY, OFPMP_GROUP_DESC
274 0.101758492 172.31.24.227 -> 172.31.31.144 OpenFlow 82 Type: OFPT_MULTIPART_REPLY, OFPMP_METER
275 0.101833934 172.31.24.227 -> 172.31.31.144 TCP 66 53176 → 6633 [ACK] Seq=739 Ack=243 Win=213 Len=0 TSval=388656949 TSecr=1764093
276 0.101843781 172.31.31.144 -> 172.31.24.227 OpenFlow 187 Type: OFPT_PACKET_OUT
277 0.101941008 172.31.31.144 -> 172.31.24.227 TCP 66 6633 → 53174 [ACK] Seq=791 Ack=279 Win=853 Len=0 TSval=1764093 TSecr=388656949
278 0.101983159 172.31.24.227 -> 172.31.31.144 OpenFlow 189 Type: OFPT_PACKET_IN
279 0.102003202 172.31.24.227 -> 172.31.31.144 OpenFlow 189 Type: OFPT_PACKET_IN
280 0.102031722 172.31.24.227 -> 172.31.31.144 OpenFlow 189 Type: OFPT_PACKET_IN
281 0.102050622 172.31.31.144 -> 172.31.24.227 OpenFlow 187 Type: OFPT_PACKET_OUT
282 0.102104998 172.31.24.227 -> 172.31.31.144 OpenFlow 114 Type: OFPT_MULTIPART_REPLY, OFPMP_METER
283 0.102111458 172.31.24.227 -> 172.31.31.144 OpenFlow 483 Type: OFPT_MULTIPART_REPLY, OFPMP_METER
284 0.102170096 172.31.31.144 -> 172.31.24.227 OpenFlow 187 Type: OFPT_PACKET_OUT
285 0.102175305 172.31.31.144 -> 172.31.24.227 TCP 66 6633 → 53178 [ACK] Seq=1275 Ack=370 Win=853 Len=0 TSval=1764093 TSecr=388656949
286 0.102236242 172.31.31.144 -> 172.31.24.227 TCP 66 6633 → 53178 [ACK] Seq=1275 Ack=493 Win=853 Len=0 TSval=1764093 TSecr=388656949
287 0.102261301 172.31.31.144 -> 172.31.24.227 TCP 66 6633 → 53180 [ACK] Seq=1033 Ack=616 Win=853 Len=0 TSval=1764093 TSecr=388656949
288 0.102326725 172.31.31.144 -> 172.31.24.227 TCP 66 6633 → 53178 [ACK] Seq=1275 Ack=541 Win=853 Len=0 TSval=1764093 TSecr=388656949
289 0.102367045 172.31.31.144 -> 172.31.24.227 TCP 66 6633 → 53180 [ACK] Seq=1033 Ack=1033 Win=853 Len=0 TSval=1764093 TSecr=388656949
290 0.102567905 172.31.24.227 -> 172.31.31.144 OpenFlow 82 Type: OFPT_MULTIPART_REPLY, OFPMP_GROUP
291 0.102587699 172.31.24.227 -> 172.31.31.144 OpenFlow 82 Type: OFPT_MULTIPART_REPLY, OFPMP_GROUP_DESC
292 0.102605977 172.31.24.227 -> 172.31.31.144 TCP 66 53184 → 6633 [ACK] Seq=493 Ack=1033 Win=211 Len=0 TSval=388656949 TSecr=1764093
293 0.102612048 172.31.24.227 -> 172.31.31.144 OpenFlow 82 Type: OFPT_MULTIPART_REPLY, OFPMP_GROUP
294 0.102617592 172.31.24.227 -> 172.31.31.144 OpenFlow 82 Type: OFPT_MULTIPART_REPLY, OFPMP_METER
295 0.102687845 172.31.24.227 -> 172.31.31.144 OpenFlow 98 Type: OFPT_MULTIPART_REPLY, OFPMP_METER
296 0.102789673 172.31.31.144 -> 172.31.24.227 TCP 66 6633 → 53182 [ACK] Seq=791 Ack=17 Win=853 Len=0 TSval=1764094 TSecr=388656949
297 0.102795843 172.31.31.144 -> 172.31.24.227 TCP 66 6633 → 53182 [ACK] Seq=791 Ack=33 Win=853 Len=0 TSval=1764094 TSecr=388656949
298 0.102877071 172.31.31.144 -> 172.31.24.227 TCP 66 6633 → 53182 [ACK] Seq=791 Ack=49 Win=853 Len=0 TSval=1764094 TSecr=388656949
299 0.103028041 172.31.24.227 -> 172.31.31.144 OpenFlow 189 Type: OFPT_PACKET_IN
300 0.103048339 172.31.24.227 -> 172.31.31.144 OpenFlow 189 Type: OFPT_PACKET_IN
301 0.103077066 172.31.24.227 -> 172.31.31.144 OpenFlow 114 Type: OFPT_MULTIPART_REPLY, OFPMP_METER
302 0.103433975 172.31.31.144 -> 172.31.24.227 TCP 66 6633 → 53186 [ACK] Seq=1033 Ack=1033 Win=853 Len=0 TSval=1764094 TSecr=388656949
303 0.103474548 172.31.24.227 -> 172.31.31.144 OpenFlow 189 Type: OFPT_PACKET_IN
304 0.103493590 172.31.24.227 -> 172.31.31.144 OpenFlow 189 Type: OFPT_PACKET_IN
305 0.103521373 172.31.24.227 -> 172.31.31.144 OpenFlow 114 Type: OFPT_MULTIPART_REPLY, OFPMP_METER
306 0.103529918 172.31.24.227 -> 172.31.31.144 OpenFlow 189 Type: OFPT_PACKET_IN
307 0.103557416 172.31.24.227 -> 172.31.31.144 OpenFlow 82 Type: OFPT_MULTIPART_REPLY, OFPMP_GROUP
308 0.103598915 172.31.24.227 -> 172.31.31.144 OpenFlow 237 Type: OFPT_MULTIPART_REPLY, OFPMP_METER
309 0.103605072 172.31.24.227 -> 172.31.31.144 OpenFlow 98 Type: OFPT_MULTIPART_REPLY, OFPMP_METER
310 0.103779500 172.31.31.144 -> 172.31.24.227 TCP 66 6633 → 53188 [ACK] Seq=791 Ack=370 Win=853 Len=0 TSval=1764094 TSecr=388656949
311 0.103785657 172.31.31.144 -> 172.31.24.227 TCP 66 6633 → 53188 [ACK] Seq=791 Ack=493 Win=853 Len=0 TSval=1764094 TSecr=388656949
312 0.103787896 172.31.31.144 -> 172.31.24.227 TCP 66 6633 → 53188 [ACK] Seq=791 Ack=541 Win=853 Len=0 TSval=1764094 TSecr=388656949
313 0.103790092 172.31.31.144 -> 172.31.24.227 TCP 66 6633 → 53190 [ACK] Seq=186 Ack=616 Win=853 Len=0 TSval=1764094 TSecr=388656949
314 0.103792085 172.31.31.144 -> 172.31.24.227 TCP 66 6633 → 53192 [ACK] Seq=791 Ack=755 Win=853 Len=0 TSval=1764094 TSecr=388656949
315 0.103796217 172.31.31.144 -> 172.31.24.227 TCP 66 6633 → 53190 [ACK] Seq=186 Ack=787 Win=853 Len=0 TSval=1764094 TSecr=388656949
316 0.103861707 172.31.31.144 -> 172.31.24.227 TCP 66 6633 → 53192 [ACK] Seq=791 Ack=787 Win=853 Len=0 TSval=1764094 TSecr=388656949
317 0.103927063 172.31.24.227 -> 172.31.31.144 OpenFlow 82 Type: OFPT_MULTIPART_REPLY, OFPMP_GROUP
318 0.103945913 172.31.24.227 -> 172.31.31.144 OpenFlow 82 Type: OFPT_MULTIPART_REPLY, OFPMP_GROUP_DESC
319 0.103981391 172.31.24.227 -> 172.31.31.144 OpenFlow 82 Type: OFPT_MULTIPART_REPLY, OFPMP_METER
320 0.104148390 172.31.31.144 -> 172.31.24.227 TCP 66 6633 → 53194 [ACK] Seq=791 Ack=755 Win=853 Len=0 TSval=1764094 TSecr=388656949
321 0.104153292 172.31.31.144 -> 172.31.24.227 TCP 66 6633 → 53194 [ACK] Seq=791 Ack=771 Win=853 Len=0 TSval=1764094 TSecr=388656949
322 0.104312061 172.31.24.227 -> 172.31.31.144 OpenFlow 189 Type: OFPT_PACKET_IN
323 0.104332406 172.31.24.227 -> 172.31.31.144 OpenFlow 189 Type: OFPT_PACKET_IN
324 0.104361660 172.31.24.227 -> 172.31.31.144 OpenFlow 114 Type: OFPT_MULTIPART_REPLY, OFPMP_METER
325 0.104523013 172.31.31.144 -> 172.31.24.227 TCP 66 6633 → 53196 [ACK] Seq=1275 Ack=862 Win=853 Len=0 TSval=1764094 TSecr=388656950
326 0.104527662 172.31.31.144 -> 172.31.24.227 TCP 66 6633 → 53196 [ACK] Seq=1275 Ack=985 Win=853 Len=0 TSval=1764094 TSecr=388656950
327 0.104561884 172.31.31.144 -> 172.31.24.227 TCP 66 6633 → 53196 [ACK] Seq=1275 Ack=1033 Win=853 Len=0 TSval=1764094 TSecr=388656950
328 0.104601168 172.31.31.144 -> 172.31.24.227 TCP 66 6633 → 53194 [ACK] Seq=791 Ack=787 Win=853 Len=0 TSval=1764094 TSecr=388656949
329 0.104703304 172.31.31.144 -> 172.31.24.227 TCP 66 6633 → 53184 [ACK] Seq=1033 Ack=541 Win=853 Len=0 TSval=1764094 TSecr=388656949
330 0.104895268 172.31.24.227 -> 172.31.31.144 OpenFlow 189 Type: OFPT_PACKET_IN
331 0.104914307 172.31.24.227 -> 172.31.31.144 OpenFlow 189 Type: OFPT_PACKET_IN
332 0.104942697 172.31.24.227 -> 172.31.31.144 OpenFlow 114 Type: OFPT_MULTIPART_REPLY, OFPMP_METER
333 0.105147131 172.31.31.144 -> 172.31.24.227 OpenFlow 187 Type: OFPT_PACKET_OUT
334 0.105152613 172.31.31.144 -> 172.31.24.227 TCP 66 6633 → 53198 [ACK] Seq=791 Ack=616 Win=853 Len=0 TSval=1764094 TSecr=388656950
335 0.105155682 172.31.31.144 -> 172.31.24.227 TCP 66 6633 → 53198 [ACK] Seq=791 Ack=739 Win=853 Len=0 TSval=1764094 TSecr=388656950
336 0.105157817 172.31.31.144 -> 172.31.24.227 TCP 66 6633 → 53198 [ACK] Seq=791 Ack=787 Win=853 Len=0 TSval=1764094 TSecr=388656950
337 0.105337196 172.31.24.227 -> 172.31.31.144 OpenFlow 189 Type: OFPT_PACKET_IN
338 0.105358445 172.31.24.227 -> 172.31.31.144 OpenFlow 189 Type: OFPT_PACKET_IN
339 0.105374178 172.31.24.227 -> 172.31.31.144 OpenFlow 189 Type: OFPT_PACKET_IN
340 0.105409536 172.31.24.227 -> 172.31.31.144 OpenFlow 189 Type: OFPT_PACKET_IN
341 0.105433046 172.31.24.227 -> 172.31.31.144 OpenFlow 189 Type: OFPT_PACKET_IN
342 0.105436057 172.31.24.227 -> 172.31.31.144 OpenFlow 681 Type: OFPT_PACKET_IN
343 0.105450928 172.31.24.227 -> 172.31.31.144 OpenFlow 189 Type: OFPT_PACKET_IN
344 0.105483996 172.31.24.227 -> 172.31.31.144 OpenFlow 189 Type: OFPT_PACKET_IN
345 0.105490731 172.31.24.227 -> 172.31.31.144 OpenFlow 435 Type: OFPT_PACKET_IN
346 0.105511425 172.31.24.227 -> 172.31.31.144 OpenFlow 189 Type: OFPT_PACKET_IN
347 0.105531943 172.31.24.227 -> 172.31.31.144 OpenFlow 189 Type: OFPT_PACKET_IN
348 0.105550674 172.31.24.227 -> 172.31.31.144 OpenFlow 189 Type: OFPT_PACKET_IN
349 0.105571546 172.31.24.227 -> 172.31.31.144 OpenFlow 189 Type: OFPT_PACKET_IN
350 0.105590293 172.31.24.227 -> 172.31.31.144 OpenFlow 189 Type: OFPT_PACKET_IN
351 0.105593371 172.31.24.227 -> 172.31.31.144 OpenFlow 189 Type: OFPT_PACKET_IN
352 0.105696007 172.31.31.144 -> 172.31.24.227 TCP 66 6633 → 53152 [ACK] Seq=65 Ack=664 Win=853 Len=0 TSval=1764094 TSecr=388656950
353 0.105703292 172.31.31.144 -> 172.31.24.227 TCP 66 6633 → 53152 [ACK] Seq=65 Ack=787 Win=853 Len=0 TSval=1764094 TSecr=388656950
354 0.105705823 172.31.31.144 -> 172.31.24.227 TCP 66 6633 → 53154 [ACK] Seq=65 Ack=172 Win=853 Len=0 TSval=1764094 TSecr=388656950
355 0.105708043 172.31.31.144 -> 172.31.24.227 TCP 66 6633 → 53156 [ACK] Seq=65 Ack=664 Win=853 Len=0 TSval=1764094 TSecr=388656950
356 0.105714333 172.31.24.227 -> 172.31.31.144 OpenFlow 435 Type: OFPT_PACKET_IN
357 0.105721427 172.31.24.227 -> 172.31.31.144 OpenFlow 435 Type: OFPT_PACKET_IN
358 0.105745554 172.31.24.227 -> 172.31.31.144 TCP 66 53176 → 6633 [ACK] Seq=739 Ack=727 Win=213 Len=0 TSval=388656950 TSecr=1764093
359 0.105776865 172.31.24.227 -> 172.31.31.144 OpenFlow 189 Type: OFPT_PACKET_IN
360 0.105822553 172.31.24.227 -> 172.31.31.144 OpenFlow 189 Type: OFPT_PACKET_IN
361 0.105826065 172.31.24.227 -> 172.31.31.144 OpenFlow 558 Type: OFPT_PACKET_IN
362 0.105828831 172.31.24.227 -> 172.31.31.144 OpenFlow 435 Type: OFPT_PACKET_IN
363 0.105849522 172.31.24.227 -> 172.31.31.144 OpenFlow 189 Type: OFPT_PACKET_IN
364 0.105852603 172.31.24.227 -> 172.31.31.144 OpenFlow 189 Type: OFPT_PACKET_IN
365 0.105894321 172.31.24.227 -> 172.31.31.144 OpenFlow 189 Type: OFPT_PACKET_IN
366 0.105897490 172.31.24.227 -> 172.31.31.144 OpenFlow 435 Type: OFPT_PACKET_IN
367 0.106005073 172.31.31.144 -> 172.31.24.227 TCP 66 6633 → 53158 [ACK] Seq=65 Ack=664 Win=853 Len=0 TSval=1764094 TSecr=388656950
368 0.106012021 172.31.31.144 -> 172.31.24.227 TCP 66 6633 → 53154 [ACK] Seq=65 Ack=787 Win=853 Len=0 TSval=1764094 TSecr=388656950
