  1 0.000000000 137.158.125.247 -> 172.31.23.72 TCP 54 52508 → 22 [ACK] Seq=1 Ack=1 Win=32582 Len=0
  2 0.000024254 137.158.125.247 -> 172.31.23.72 TCP 54 52508 → 22 [ACK] Seq=1 Ack=297 Win=32434 Len=0
  3 0.113585091 137.158.125.247 -> 172.31.23.72 TCP 54 52508 → 22 [ACK] Seq=1 Ack=357 Win=32404 Len=0
  4 0.659962126 172.31.23.72 -> 137.158.125.247 SSH 90 Server: Encrypted packet (len=36)
  5 0.702775519 172.31.23.72 -> 172.31.31.144 OpenFlow 146 Type: OFPT_PORT_STATUS
  6 0.702851384 172.31.23.72 -> 172.31.31.144 OpenFlow 146 Type: OFPT_PORT_STATUS
  7 0.703093897 172.31.31.144 -> 172.31.23.72 TCP 66 6633 → 40152 [ACK] Seq=1 Ack=81 Win=853 Len=0 TSval=684785 TSecr=777623
  8 0.741953651 172.31.31.144 -> 172.31.23.72 TCP 66 6633 → 40148 [ACK] Seq=1 Ack=81 Win=853 Len=0 TSval=684795 TSecr=777623
  9 0.759884922 172.31.31.144 -> 172.31.23.72 TCP 146 6633 → 40190 [PSH, ACK] Seq=1 Ack=1 Win=853 Len=80 TSval=684799 TSecr=777314
 10 0.759913166 172.31.31.144 -> 172.31.23.72 TCP 154 6633 → 40190 [PSH, ACK] Seq=81 Ack=1 Win=853 Len=88 TSval=684799 TSecr=777314
 11 0.759965001 172.31.31.144 -> 172.31.23.72 TCP 146 6633 → 40192 [PSH, ACK] Seq=1 Ack=1 Win=853 Len=80 TSval=684799 TSecr=777314
 12 0.760029855 172.31.31.144 -> 172.31.23.72 TCP 154 6633 → 40192 [PSH, ACK] Seq=81 Ack=1 Win=853 Len=88 TSval=684799 TSecr=777314
 13 0.760126799 172.31.31.144 -> 172.31.23.72 TCP 146 6633 → 40140 [PSH, ACK] Seq=1 Ack=1 Win=853 Len=80 TSval=684799 TSecr=777140
 14 0.760143578 172.31.31.144 -> 172.31.23.72 TCP 154 6633 → 40140 [PSH, ACK] Seq=81 Ack=1 Win=853 Len=88 TSval=684799 TSecr=777140
 15 0.760220304 172.31.23.72 -> 172.31.31.144 TCP 66 40190 → 6633 [ACK] Seq=1 Ack=169 Win=385 Len=0 TSval=777638 TSecr=684799
 16 0.760236264 172.31.23.72 -> 172.31.31.144 OpenFlow 74 Type: OFPT_BARRIER_REPLY
 17 0.760246475 172.31.31.144 -> 172.31.23.72 TCP 146 6633 → 40206 [PSH, ACK] Seq=1 Ack=1 Win=853 Len=80 TSval=684799 TSecr=777314
 18 0.760272843 172.31.23.72 -> 172.31.31.144 TCP 66 40192 → 6633 [ACK] Seq=1 Ack=169 Win=383 Len=0 TSval=777638 TSecr=684799
 19 0.760286926 172.31.23.72 -> 172.31.31.144 OpenFlow 74 Type: OFPT_BARRIER_REPLY
 20 0.760302754 172.31.31.144 -> 172.31.23.72 TCP 146 6633 → 40206 [PSH, ACK] Seq=81 Ack=1 Win=853 Len=80 TSval=684799 TSecr=777314
 21 0.760349445 172.31.31.144 -> 172.31.23.72 TCP 74 6633 → 40206 [PSH, ACK] Seq=161 Ack=1 Win=853 Len=8 TSval=684799 TSecr=777314
 22 0.760361951 172.31.23.72 -> 172.31.31.144 TCP 66 40206 → 6633 [ACK] Seq=1 Ack=169 Win=402 Len=0 TSval=777638 TSecr=684799
 23 0.760370260 172.31.23.72 -> 172.31.31.144 OpenFlow 74 Type: OFPT_BARRIER_REPLY
 24 0.760383282 172.31.31.144 -> 172.31.23.72 TCP 66 6633 → 40190 [ACK] Seq=169 Ack=9 Win=853 Len=0 TSval=684799 TSecr=777638
 25 0.760464824 172.31.31.144 -> 172.31.23.72 OpenFlow 146 Type: OFPT_FLOW_MOD
 26 0.760469635 172.31.31.144 -> 172.31.23.72 OpenFlow 154 Type: OFPT_BARRIER_REQUEST
 27 0.760471368 172.31.31.144 -> 172.31.23.72 TCP 66 6633 → 40192 [ACK] Seq=169 Ack=9 Win=853 Len=0 TSval=684799 TSecr=777638
 28 0.760578909 172.31.23.72 -> 172.31.31.144 OpenFlow 146 Type: OFPT_FLOW_REMOVED
 29 0.760594046 172.31.23.72 -> 172.31.31.144 OpenFlow 146 Type: OFPT_FLOW_REMOVED
 30 0.760602283 172.31.23.72 -> 172.31.31.144 OpenFlow 146 Type: OFPT_FLOW_REMOVED
 31 0.760607097 172.31.23.72 -> 172.31.31.144 OpenFlow 146 Type: OFPT_FLOW_REMOVED
 32 0.760654740 172.31.31.144 -> 172.31.23.72 OpenFlow 146 Type: OFPT_FLOW_MOD
 33 0.760658897 172.31.31.144 -> 172.31.23.72 OpenFlow 154 Type: OFPT_BARRIER_REQUEST
 34 0.760663964 172.31.23.72 -> 172.31.31.144 OpenFlow 146 Type: OFPT_FLOW_REMOVED
 35 0.760669840 172.31.23.72 -> 172.31.31.144 OpenFlow 146 Type: OFPT_FLOW_REMOVED
 36 0.760745200 172.31.31.144 -> 172.31.23.72 TCP 66 6633 → 40190 [ACK] Seq=169 Ack=89 Win=853 Len=0 TSval=684799 TSecr=777638
 37 0.760749119 172.31.31.144 -> 172.31.23.72 TCP 146 6633 → 40212 [PSH, ACK] Seq=1 Ack=1 Win=853 Len=80 TSval=684799 TSecr=777314
 38 0.760766147 172.31.31.144 -> 172.31.23.72 OpenFlow 146 Type: OFPT_FLOW_MOD
 39 0.760806780 172.31.31.144 -> 172.31.23.72 TCP 154 6633 → 40212 [PSH, ACK] Seq=81 Ack=1 Win=853 Len=88 TSval=684799 TSecr=777314
 40 0.760809690 172.31.31.144 -> 172.31.23.72 TCP 66 6633 → 40190 [ACK] Seq=169 Ack=169 Win=853 Len=0 TSval=684799 TSecr=777638
 41 0.760828884 172.31.31.144 -> 172.31.23.72 OpenFlow 146 Type: OFPT_FLOW_MOD
 42 0.760847736 172.31.31.144 -> 172.31.23.72 TCP 66 6633 → 40206 [ACK] Seq=169 Ack=89 Win=853 Len=0 TSval=684799 TSecr=777638
 43 0.760866610 172.31.31.144 -> 172.31.23.72 OpenFlow 146 Type: OFPT_FLOW_MOD
 44 0.760885123 172.31.31.144 -> 172.31.23.72 TCP 146 6633 → 40208 [PSH, ACK] Seq=1 Ack=1 Win=853 Len=80 TSval=684799 TSecr=777314
 45 0.760905779 172.31.31.144 -> 172.31.23.72 OpenFlow 74 Type: OFPT_BARRIER_REQUEST
 46 0.760925319 172.31.31.144 -> 172.31.23.72 OpenFlow 154 Type: OFPT_BARRIER_REQUEST
 47 0.760944264 172.31.31.144 -> 172.31.23.72 OpenFlow 146 Type: OFPT_FLOW_MOD
 48 0.760962881 172.31.31.144 -> 172.31.23.72 TCP 154 6633 → 40208 [PSH, ACK] Seq=81 Ack=1 Win=853 Len=88 TSval=684799 TSecr=777314
 49 0.760982113 172.31.31.144 -> 172.31.23.72 TCP 146 6633 → 40150 [PSH, ACK] Seq=1 Ack=1 Win=853 Len=80 TSval=684799 TSecr=777140
 50 0.761000533 172.31.31.144 -> 172.31.23.72 OpenFlow 146 Type: OFPT_FLOW_MOD
 51 0.761020442 172.31.31.144 -> 172.31.23.72 OpenFlow 146 Type: OFPT_FLOW_MOD
 52 0.761039573 172.31.31.144 -> 172.31.23.72 TCP 146 6633 → 40150 [PSH, ACK] Seq=81 Ack=1 Win=853 Len=80 TSval=684799 TSecr=777140
 53 0.761059359 172.31.31.144 -> 172.31.23.72 OpenFlow 146 Type: OFPT_FLOW_MOD
 54 0.761076549 172.31.31.144 -> 172.31.23.72 OpenFlow 74 Type: OFPT_BARRIER_REQUEST
 55 0.761095659 172.31.31.144 -> 172.31.23.72 TCP 146 6633 → 40150 [PSH, ACK] Seq=161 Ack=1 Win=853 Len=80 TSval=684799 TSecr=777140
 56 0.761114745 172.31.31.144 -> 172.31.23.72 OpenFlow 146 Type: OFPT_FLOW_MOD
 57 0.761133210 172.31.31.144 -> 172.31.23.72 OpenFlow 74 Type: OFPT_BARRIER_REQUEST
 58 0.761185582 172.31.31.144 -> 172.31.23.72 TCP 146 6633 → 40150 [PSH, ACK] Seq=241 Ack=1 Win=853 Len=80 TSval=684799 TSecr=777140
 59 0.761187986 172.31.31.144 -> 172.31.23.72 TCP 82 6633 → 40150 [PSH, ACK] Seq=321 Ack=1 Win=853 Len=16 TSval=684799 TSecr=777140
 60 0.761189612 172.31.31.144 -> 172.31.23.72 OpenFlow 146 Type: OFPT_FLOW_MOD
 61 0.761223906 172.31.31.144 -> 172.31.23.72 OpenFlow 146 Type: OFPT_FLOW_MOD
 62 0.761255763 172.31.31.144 -> 172.31.23.72 OpenFlow 154 Type: OFPT_BARRIER_REQUEST
 63 0.761286435 172.31.31.144 -> 172.31.23.72 OpenFlow 234 Type: OFPT_BARRIER_REQUEST
 64 0.761303895 172.31.31.144 -> 172.31.23.72 OpenFlow 146 Type: OFPT_FLOW_MOD
 65 0.761322465 172.31.31.144 -> 172.31.23.72 OpenFlow 154 Type: OFPT_BARRIER_REQUEST
 66 0.761342149 172.31.31.144 -> 172.31.23.72 OpenFlow 146 Type: OFPT_FLOW_MOD
 67 0.761360343 172.31.31.144 -> 172.31.23.72 TCP 146 6633 → 40212 [PSH, ACK] Seq=169 Ack=1 Win=853 Len=80 TSval=684799 TSecr=777314
 68 0.761379412 172.31.31.144 -> 172.31.23.72 OpenFlow 154 Type: OFPT_BARRIER_REQUEST
 69 0.761397705 172.31.31.144 -> 172.31.23.72 TCP 154 6633 → 40212 [PSH, ACK] Seq=249 Ack=1 Win=853 Len=88 TSval=684799 TSecr=777314
 70 0.761416172 172.31.31.144 -> 172.31.23.72 OpenFlow 146 Type: OFPT_FLOW_MOD
 71 0.761435014 172.31.31.144 -> 172.31.23.72 TCP 146 6633 → 40142 [PSH, ACK] Seq=1 Ack=1 Win=853 Len=80 TSval=684799 TSecr=777089
 72 0.761453923 172.31.31.144 -> 172.31.23.72 TCP 154 6633 → 40142 [PSH, ACK] Seq=81 Ack=1 Win=853 Len=88 TSval=684799 TSecr=777089
 73 0.761472416 172.31.31.144 -> 172.31.23.72 TCP 146 6633 → 40208 [PSH, ACK] Seq=169 Ack=1 Win=853 Len=80 TSval=684799 TSecr=777314
 74 0.761491310 172.31.31.144 -> 172.31.23.72 TCP 146 6633 → 40154 [PSH, ACK] Seq=1 Ack=1 Win=853 Len=80 TSval=684799 TSecr=777140
 75 0.761510059 172.31.31.144 -> 172.31.23.72 OpenFlow 146 Type: OFPT_FLOW_MOD
 76 0.761550921 172.31.31.144 -> 172.31.23.72 OpenFlow 242 Type: OFPT_BARRIER_REQUEST
 77 0.761553356 172.31.31.144 -> 172.31.23.72 TCP 154 6633 → 40208 [PSH, ACK] Seq=249 Ack=1 Win=853 Len=88 TSval=684799 TSecr=777314
 78 0.761572564 172.31.31.144 -> 172.31.23.72 TCP 146 6633 → 40154 [PSH, ACK] Seq=81 Ack=1 Win=853 Len=80 TSval=684799 TSecr=777140
 79 0.761591517 172.31.31.144 -> 172.31.23.72 TCP 154 6633 → 40154 [PSH, ACK] Seq=161 Ack=1 Win=853 Len=88 TSval=684799 TSecr=777140
 80 0.761609459 172.31.31.144 -> 172.31.23.72 TCP 146 6633 → 40142 [PSH, ACK] Seq=169 Ack=1 Win=853 Len=80 TSval=684799 TSecr=777089
 81 0.761627964 172.31.31.144 -> 172.31.23.72 TCP 146 6633 → 40150 [PSH, ACK] Seq=337 Ack=1 Win=853 Len=80 TSval=684799 TSecr=777140
 82 0.761646670 172.31.31.144 -> 172.31.23.72 TCP 146 6633 → 40208 [PSH, ACK] Seq=337 Ack=1 Win=853 Len=80 TSval=684799 TSecr=777314
 83 0.761665538 172.31.31.144 -> 172.31.23.72 TCP 146 6633 → 40154 [PSH, ACK] Seq=249 Ack=1 Win=853 Len=80 TSval=684799 TSecr=777140
 84 0.761684754 172.31.31.144 -> 172.31.23.72 TCP 154 6633 → 40208 [PSH, ACK] Seq=417 Ack=1 Win=853 Len=88 TSval=684799 TSecr=777314
 85 0.761705927 172.31.31.144 -> 172.31.23.72 TCP 154 6633 → 40150 [PSH, ACK] Seq=417 Ack=1 Win=853 Len=88 TSval=684799 TSecr=777140
 86 0.761722104 172.31.31.144 -> 172.31.23.72 TCP 74 6633 → 40154 [PSH, ACK] Seq=329 Ack=1 Win=853 Len=8 TSval=684799 TSecr=777140
 87 0.761739611 172.31.31.144 -> 172.31.23.72 TCP 146 6633 → 40142 [PSH, ACK] Seq=249 Ack=1 Win=853 Len=80 TSval=684799 TSecr=777089
 88 0.761757928 172.31.31.144 -> 172.31.23.72 TCP 146 6633 → 40198 [PSH, ACK] Seq=1 Ack=1 Win=853 Len=80 TSval=684799 TSecr=777314
 89 0.761777195 172.31.31.144 -> 172.31.23.72 TCP 146 6633 → 40144 [PSH, ACK] Seq=1 Ack=1 Win=853 Len=80 TSval=684799 TSecr=777139
 90 0.761795671 172.31.31.144 -> 172.31.23.72 TCP 154 6633 → 40198 [PSH, ACK] Seq=81 Ack=1 Win=853 Len=88 TSval=684799 TSecr=777314
 91 0.761813821 172.31.31.144 -> 172.31.23.72 TCP 74 6633 → 40142 [PSH, ACK] Seq=329 Ack=1 Win=853 Len=8 TSval=684799 TSecr=777089
 92 0.761832738 172.31.31.144 -> 172.31.23.72 TCP 146 6633 → 40188 [PSH, ACK] Seq=1 Ack=1 Win=853 Len=80 TSval=684799 TSecr=777314
 93 0.761850972 172.31.31.144 -> 172.31.23.72 TCP 146 6633 → 40144 [PSH, ACK] Seq=81 Ack=1 Win=853 Len=80 TSval=684799 TSecr=777139
 94 0.761869428 172.31.31.144 -> 172.31.23.72 TCP 154 6633 → 40188 [PSH, ACK] Seq=81 Ack=1 Win=853 Len=88 TSval=684799 TSecr=777314
 95 0.761918464 172.31.31.144 -> 172.31.23.72 TCP 146 6633 → 40204 [PSH, ACK] Seq=1 Ack=1 Win=853 Len=80 TSval=684799 TSecr=777314
 96 0.761923076 172.31.31.144 -> 172.31.23.72 TCP 146 6633 → 40210 [PSH, ACK] Seq=1 Ack=1 Win=853 Len=80 TSval=684799 TSecr=777314
 97 0.761925588 172.31.31.144 -> 172.31.23.72 OpenFlow 146 Type: OFPT_FLOW_MOD
 98 0.761958657 172.31.31.144 -> 172.31.23.72 TCP 74 6633 → 40144 [PSH, ACK] Seq=161 Ack=1 Win=853 Len=8 TSval=684799 TSecr=777139
 99 0.761989492 172.31.31.144 -> 172.31.23.72 TCP 146 6633 → 40212 [PSH, ACK] Seq=337 Ack=1 Win=853 Len=80 TSval=684799 TSecr=777314
100 0.762021328 172.31.31.144 -> 172.31.23.72 TCP 154 6633 → 40210 [PSH, ACK] Seq=81 Ack=1 Win=853 Len=88 TSval=684799 TSecr=777314
101 0.762035242 172.31.31.144 -> 172.31.23.72 TCP 146 6633 → 40154 [PSH, ACK] Seq=337 Ack=1 Win=853 Len=80 TSval=684799 TSecr=777140
102 0.762054323 172.31.31.144 -> 172.31.23.72 TCP 146 6633 → 40202 [PSH, ACK] Seq=1 Ack=1 Win=853 Len=80 TSval=684799 TSecr=777314
103 0.762073780 172.31.31.144 -> 172.31.23.72 TCP 154 6633 → 40212 [PSH, ACK] Seq=417 Ack=1 Win=853 Len=88 TSval=684799 TSecr=777314
104 0.762093560 172.31.31.144 -> 172.31.23.72 OpenFlow 154 Type: OFPT_BARRIER_REQUEST
105 0.762111780 172.31.31.144 -> 172.31.23.72 TCP 154 6633 → 40204 [PSH, ACK] Seq=81 Ack=1 Win=853 Len=88 TSval=684799 TSecr=777314
106 0.762131349 172.31.31.144 -> 172.31.23.72 TCP 154 6633 → 40202 [PSH, ACK] Seq=81 Ack=1 Win=853 Len=88 TSval=684799 TSecr=777314
107 0.762150021 172.31.31.144 -> 172.31.23.72 TCP 146 6633 → 40212 [PSH, ACK] Seq=505 Ack=1 Win=853 Len=80 TSval=684799 TSecr=777314
108 0.762168537 172.31.31.144 -> 172.31.23.72 TCP 154 6633 → 40154 [PSH, ACK] Seq=417 Ack=1 Win=853 Len=88 TSval=684799 TSecr=777140
109 0.762186622 172.31.31.144 -> 172.31.23.72 OpenFlow 146 Type: OFPT_FLOW_MOD
110 0.762205483 172.31.31.144 -> 172.31.23.72 TCP 146 6633 → 40196 [PSH, ACK] Seq=1 Ack=1 Win=853 Len=80 TSval=684799 TSecr=777314
111 0.762225159 172.31.31.144 -> 172.31.23.72 TCP 146 6633 → 40204 [PSH, ACK] Seq=169 Ack=1 Win=853 Len=80 TSval=684799 TSecr=777314
112 0.762243774 172.31.31.144 -> 172.31.23.72 TCP 146 6633 → 40202 [PSH, ACK] Seq=169 Ack=1 Win=853 Len=80 TSval=684799 TSecr=777314
113 0.762262490 172.31.31.144 -> 172.31.23.72 TCP 146 6633 → 40196 [PSH, ACK] Seq=81 Ack=1 Win=853 Len=80 TSval=684799 TSecr=777314
114 0.762313100 172.31.31.144 -> 172.31.23.72 TCP 146 6633 → 40212 [PSH, ACK] Seq=585 Ack=1 Win=853 Len=80 TSval=684799 TSecr=777314
115 0.762315684 172.31.31.144 -> 172.31.23.72 TCP 146 6633 → 40154 [PSH, ACK] Seq=505 Ack=1 Win=853 Len=80 TSval=684799 TSecr=777140
116 0.762326075 172.31.31.144 -> 172.31.23.72 TCP 146 6633 → 40202 [PSH, ACK] Seq=249 Ack=1 Win=853 Len=80 TSval=684799 TSecr=777314
117 0.762358165 172.31.31.144 -> 172.31.23.72 TCP 154 6633 → 40204 [PSH, ACK] Seq=249 Ack=1 Win=853 Len=88 TSval=684799 TSecr=777314
118 0.762386752 172.31.31.144 -> 172.31.23.72 TCP 154 6633 → 40154 [PSH, ACK] Seq=585 Ack=1 Win=853 Len=88 TSval=684799 TSecr=777140
119 0.762411219 172.31.31.144 -> 172.31.23.72 TCP 74 6633 → 40196 [PSH, ACK] Seq=161 Ack=1 Win=853 Len=8 TSval=684799 TSecr=777314
120 0.762430975 172.31.31.144 -> 172.31.23.72 TCP 74 6633 → 40212 [PSH, ACK] Seq=665 Ack=1 Win=853 Len=8 TSval=684799 TSecr=777314
121 0.762449446 172.31.31.144 -> 172.31.23.72 TCP 146 6633 → 40200 [PSH, ACK] Seq=1 Ack=1 Win=853 Len=80 TSval=684799 TSecr=777314
122 0.762468003 172.31.31.144 -> 172.31.23.72 TCP 242 6633 → 40202 [PSH, ACK] Seq=329 Ack=1 Win=853 Len=176 TSval=684799 TSecr=777314
123 0.762486716 172.31.31.144 -> 172.31.23.72 TCP 146 6633 → 40142 [PSH, ACK] Seq=337 Ack=1 Win=853 Len=80 TSval=684799 TSecr=777089
124 0.762506141 172.31.31.144 -> 172.31.23.72 TCP 322 6633 → 40200 [PSH, ACK] Seq=81 Ack=1 Win=853 Len=256 TSval=684799 TSecr=777314
125 0.762525493 172.31.31.144 -> 172.31.23.72 OpenFlow 146 Type: OFPT_FLOW_MOD
126 0.762544262 172.31.31.144 -> 172.31.23.72 TCP 146 6633 → 40154 [PSH, ACK] Seq=673 Ack=1 Win=853 Len=80 TSval=684800 TSecr=777140
127 0.762562602 172.31.31.144 -> 172.31.23.72 TCP 154 6633 → 40142 [PSH, ACK] Seq=417 Ack=1 Win=853 Len=88 TSval=684800 TSecr=777089
128 0.762581506 172.31.31.144 -> 172.31.23.72 TCP 146 6633 → 40140 [PSH, ACK] Seq=169 Ack=1 Win=853 Len=80 TSval=684800 TSecr=777140
129 0.762600004 172.31.31.144 -> 172.31.23.72 TCP 490 6633 → 40140 [PSH, ACK] Seq=249 Ack=1 Win=853 Len=424 TSval=684800 TSecr=777140
130 0.762620215 172.31.31.144 -> 172.31.23.72 OpenFlow 738 Type: OFPT_FLOW_MOD
131 0.762638848 172.31.31.144 -> 172.31.23.72 OpenFlow 322 Type: OFPT_BARRIER_REQUEST
132 0.762678892 172.31.31.144 -> 172.31.23.72 TCP 187 6633 → 40146 [PSH, ACK] Seq=1 Ack=1 Win=853 Len=121 TSval=684800 TSecr=777140
133 0.762682087 172.31.31.144 -> 172.31.23.72 TCP 187 6633 → 40146 [PSH, ACK] Seq=122 Ack=1 Win=853 Len=121 TSval=684800 TSecr=777140
134 0.762701112 172.31.31.144 -> 172.31.23.72 TCP 187 6633 → 40146 [PSH, ACK] Seq=243 Ack=1 Win=853 Len=121 TSval=684800 TSecr=777140
135 0.762720907 172.31.31.144 -> 172.31.23.72 OpenFlow 146 Type: OFPT_FLOW_MOD
136 0.762739563 172.31.31.144 -> 172.31.23.72 OpenFlow 402 Type: OFPT_FLOW_MOD
137 0.762757993 172.31.31.144 -> 172.31.23.72 TCP 187 6633 → 40146 [PSH, ACK] Seq=364 Ack=1 Win=853 Len=121 TSval=684800 TSecr=777140
138 0.762779523 172.31.31.144 -> 172.31.23.72 OpenFlow 1490 Type: OFPT_FLOW_MOD
139 0.762797488 172.31.31.144 -> 172.31.23.72 OpenFlow 410 Type: OFPT_BARRIER_REQUEST
140 0.762816298 172.31.31.144 -> 172.31.23.72 TCP 187 6633 → 40146 [PSH, ACK] Seq=485 Ack=1 Win=853 Len=121 TSval=684800 TSecr=777140
141 0.762845013 172.31.31.144 -> 172.31.23.72 TCP 187 6633 → 40146 [PSH, ACK] Seq=606 Ack=1 Win=853 Len=121 TSval=684800 TSecr=777140
142 0.762916278 172.31.31.144 -> 172.31.23.72 TCP 187 6633 → 40146 [PSH, ACK] Seq=727 Ack=1 Win=853 Len=121 TSval=684800 TSecr=777140
143 0.762960111 172.31.31.144 -> 172.31.23.72 TCP 187 6633 → 40146 [PSH, ACK] Seq=848 Ack=1 Win=853 Len=121 TSval=684800 TSecr=777140
144 0.763676260 172.31.23.72 -> 172.31.31.144 OpenFlow 74 Type: OFPT_BARRIER_REPLY
145 0.763703339 172.31.23.72 -> 172.31.31.144 OpenFlow 74 Type: OFPT_BARRIER_REPLY
146 0.763730810 172.31.23.72 -> 172.31.31.144 OpenFlow 82 Type: OFPT_BARRIER_REPLY
147 0.763762081 172.31.23.72 -> 172.31.31.144 OpenFlow 74 Type: OFPT_BARRIER_REPLY
148 0.763780053 172.31.23.72 -> 172.31.31.144 OpenFlow 74 Type: OFPT_BARRIER_REPLY
149 0.763828779 172.31.23.72 -> 172.31.31.144 OpenFlow 74 Type: OFPT_BARRIER_REPLY
150 0.763843795 172.31.23.72 -> 172.31.31.144 TCP 66 40144 → 6633 [ACK] Seq=1 Ack=169 Win=379 Len=0 TSval=777639 TSecr=684799
151 0.763855742 172.31.23.72 -> 172.31.31.144 OpenFlow 74 Type: OFPT_BARRIER_REPLY
152 0.763872539 172.31.31.144 -> 172.31.23.72 TCP 66 6633 → 40140 [ACK] Seq=673 Ack=9 Win=853 Len=0 TSval=684800 TSecr=777639
153 0.763927446 172.31.31.144 -> 172.31.23.72 TCP 66 6633 → 40140 [ACK] Seq=673 Ack=17 Win=853 Len=0 TSval=684800 TSecr=777639
154 0.763932127 172.31.31.144 -> 172.31.23.72 TCP 66 6633 → 40140 [ACK] Seq=673 Ack=33 Win=853 Len=0 TSval=684800 TSecr=777639
155 0.763969418 172.31.31.144 -> 172.31.23.72 TCP 66 6633 → 40142 [ACK] Seq=505 Ack=17 Win=853 Len=0 TSval=684800 TSecr=777639
156 0.764004379 172.31.31.144 -> 172.31.23.72 TCP 66 6633 → 40144 [ACK] Seq=169 Ack=9 Win=853 Len=0 TSval=684800 TSecr=777639
157 0.764226999 172.31.23.72 -> 172.31.31.144 TCP 66 40146 → 6633 [ACK] Seq=1 Ack=969 Win=384 Len=0 TSval=777639 TSecr=684800
158 0.764318637 172.31.23.72 -> 172.31.31.144 OpenFlow 74 Type: OFPT_BARRIER_REPLY
159 0.764341948 172.31.23.72 -> 172.31.31.144 OpenFlow 74 Type: OFPT_BARRIER_REPLY
160 0.764368146 172.31.23.72 -> 172.31.31.144 OpenFlow 74 Type: OFPT_BARRIER_REPLY
161 0.764385210 172.31.23.72 -> 172.31.31.144 OpenFlow 189 Type: OFPT_PACKET_IN
162 0.764413587 172.31.23.72 -> 172.31.31.144 OpenFlow 189 Type: OFPT_PACKET_IN
163 0.764436091 172.31.23.72 -> 172.31.31.144 OpenFlow 82 Type: OFPT_BARRIER_REPLY
164 0.764454055 172.31.23.72 -> 172.31.31.144 TCP 66 40152 → 6633 [ACK] Seq=81 Ack=2185 Win=381 Len=0 TSval=777639 TSecr=684800
165 0.764461581 172.31.23.72 -> 172.31.31.144 OpenFlow 74 Type: OFPT_BARRIER_REPLY
166 0.764475267 172.31.23.72 -> 172.31.31.144 OpenFlow 74 Type: OFPT_BARRIER_REPLY
167 0.764528133 172.31.23.72 -> 172.31.31.144 OpenFlow 98 Type: OFPT_BARRIER_REPLY
168 0.764581835 172.31.31.144 -> 172.31.23.72 OpenFlow 1586 Type: OFPT_BARRIER_REQUEST
169 0.764588039 172.31.31.144 -> 172.31.23.72 TCP 66 6633 → 40150 [ACK] Seq=505 Ack=124 Win=853 Len=0 TSval=684800 TSecr=777639
170 0.764592848 172.31.23.72 -> 172.31.31.144 OpenFlow 122 Type: OFPT_BARRIER_REPLY
171 0.764609710 172.31.31.144 -> 172.31.23.72 TCP 66 6633 → 40150 [ACK] Seq=505 Ack=247 Win=853 Len=0 TSval=684800 TSecr=777639
172 0.764612529 172.31.31.144 -> 172.31.23.72 TCP 66 6633 → 40150 [ACK] Seq=505 Ack=263 Win=853 Len=0 TSval=684800 TSecr=777639
173 0.764619392 172.31.23.72 -> 172.31.31.144 OpenFlow 74 Type: OFPT_BARRIER_REPLY
174 0.764635357 172.31.31.144 -> 172.31.23.72 TCP 66 6633 → 40148 [ACK] Seq=2185 Ack=105 Win=853 Len=0 TSval=684800 TSecr=777639
175 0.764658298 172.31.31.144 -> 172.31.23.72 TCP 66 6633 → 40150 [ACK] Seq=505 Ack=271 Win=853 Len=0 TSval=684800 TSecr=777639
176 0.764663660 172.31.23.72 -> 172.31.31.144 OpenFlow 74 Type: OFPT_BARRIER_REPLY
177 0.764686707 172.31.31.144 -> 172.31.23.72 TCP 66 6633 → 40152 [ACK] Seq=2185 Ack=89 Win=853 Len=0 TSval=684800 TSecr=777639
178 0.764691584 172.31.23.72 -> 172.31.31.144 OpenFlow 74 Type: OFPT_BARRIER_REPLY
179 0.764717073 172.31.31.144 -> 172.31.23.72 TCP 66 6633 → 40152 [ACK] Seq=2185 Ack=121 Win=853 Len=0 TSval=684800 TSecr=777639
180 0.764721909 172.31.23.72 -> 172.31.31.144 OpenFlow 82 Type: OFPT_BARRIER_REPLY
181 0.764743075 172.31.31.144 -> 172.31.23.72 TCP 66 6633 → 40152 [ACK] Seq=2185 Ack=177 Win=853 Len=0 TSval=684800 TSecr=777639
182 0.764764819 172.31.23.72 -> 172.31.31.144 TCP 66 40188 → 6633 [ACK] Seq=1 Ack=169 Win=213 Len=0 TSval=777639 TSecr=684799
183 0.764772950 172.31.23.72 -> 172.31.31.144 OpenFlow 74 Type: OFPT_BARRIER_REPLY
184 0.764791278 172.31.23.72 -> 172.31.31.144 OpenFlow 74 Type: OFPT_BARRIER_REPLY
185 0.764837819 172.31.31.144 -> 172.31.23.72 TCP 66 6633 → 40152 [ACK] Seq=2185 Ack=185 Win=853 Len=0 TSval=684800 TSecr=777639
186 0.764841665 172.31.31.144 -> 172.31.23.72 OpenFlow 154 Type: OFPT_BARRIER_REQUEST
187 0.764846542 172.31.23.72 -> 172.31.31.144 OpenFlow 90 Type: OFPT_BARRIER_REPLY
188 0.764862970 172.31.31.144 -> 172.31.23.72 TCP 66 6633 → 40154 [ACK] Seq=841 Ack=33 Win=853 Len=0 TSval=684800 TSecr=777639
189 0.764867304 172.31.23.72 -> 172.31.31.144 OpenFlow 74 Type: OFPT_BARRIER_REPLY
190 0.764887045 172.31.23.72 -> 172.31.31.144 OpenFlow 74 Type: OFPT_BARRIER_REPLY
191 0.764909422 172.31.23.72 -> 172.31.31.144 OpenFlow 74 Type: OFPT_BARRIER_REPLY
192 0.764950732 172.31.23.72 -> 172.31.31.144 OpenFlow 189 Type: OFPT_PACKET_IN
193 0.764973775 172.31.23.72 -> 172.31.31.144 TCP 66 40196 → 6633 [ACK] Seq=1 Ack=169 Win=213 Len=0 TSval=777639 TSecr=684799
194 0.764982768 172.31.23.72 -> 172.31.31.144 OpenFlow 98 Type: OFPT_BARRIER_REPLY
195 0.764984861 172.31.23.72 -> 172.31.31.144 OpenFlow 189 Type: OFPT_PACKET_IN
196 0.764989495 172.31.23.72 -> 172.31.31.144 OpenFlow 74 Type: OFPT_BARRIER_REPLY
197 0.765003316 172.31.31.144 -> 172.31.23.72 TCP 66 6633 → 40190 [ACK] Seq=841 Ack=201 Win=853 Len=0 TSval=684800 TSecr=777639
198 0.765018263 172.31.23.72 -> 172.31.31.144 TCP 66 40198 → 6633 [ACK] Seq=1 Ack=169 Win=385 Len=0 TSval=777639 TSecr=684799
199 0.765026453 172.31.23.72 -> 172.31.31.144 OpenFlow 74 Type: OFPT_BARRIER_REPLY
200 0.765051765 172.31.23.72 -> 172.31.31.144 OpenFlow 74 Type: OFPT_BARRIER_REPLY
201 0.765081164 172.31.23.72 -> 172.31.31.144 OpenFlow 74 Type: OFPT_BARRIER_REPLY
202 0.765092062 172.31.31.144 -> 172.31.23.72 OpenFlow 170 Type: OFPT_FLOW_MOD
203 0.765095322 172.31.31.144 -> 172.31.23.72 OpenFlow 170 Type: OFPT_FLOW_MOD
204 0.765129598 172.31.23.72 -> 172.31.31.144 OpenFlow 74 Type: OFPT_BARRIER_REPLY
205 0.765138578 172.31.23.72 -> 172.31.31.144 OpenFlow 74 Type: OFPT_BARRIER_REPLY
206 0.765167438 172.31.23.72 -> 172.31.31.144 OpenFlow 74 Type: OFPT_BARRIER_REPLY
207 0.765169683 172.31.23.72 -> 172.31.31.144 OpenFlow 82 Type: OFPT_BARRIER_REPLY
208 0.765187414 172.31.31.144 -> 172.31.23.72 OpenFlow 170 Type: OFPT_FLOW_MOD
209 0.765190596 172.31.31.144 -> 172.31.23.72 OpenFlow 170 Type: OFPT_FLOW_MOD
210 0.765192139 172.31.31.144 -> 172.31.23.72 TCP 66 6633 → 40192 [ACK] Seq=1345 Ack=193 Win=853 Len=0 TSval=684800 TSecr=777639
211 0.765195351 172.31.31.144 -> 172.31.23.72 OpenFlow 74 Type: OFPT_BARRIER_REQUEST
212 0.765196856 172.31.31.144 -> 172.31.23.72 OpenFlow 170 Type: OFPT_FLOW_MOD
213 0.765234426 172.31.23.72 -> 172.31.31.144 OpenFlow 74 Type: OFPT_BARRIER_REPLY
214 0.765239321 172.31.23.72 -> 172.31.31.144 OpenFlow 98 Type: OFPT_BARRIER_REPLY
215 0.765259112 172.31.23.72 -> 172.31.31.144 OpenFlow 74 Type: OFPT_BARRIER_REPLY
216 0.765283490 172.31.31.144 -> 172.31.23.72 OpenFlow 74 Type: OFPT_BARRIER_REQUEST
217 0.765286413 172.31.31.144 -> 172.31.23.72 OpenFlow 170 Type: OFPT_FLOW_MOD
218 0.765289059 172.31.31.144 -> 172.31.23.72 OpenFlow 170 Type: OFPT_FLOW_MOD
219 0.765290917 172.31.31.144 -> 172.31.23.72 OpenFlow 170 Type: OFPT_FLOW_MOD
220 0.765293004 172.31.31.144 -> 172.31.23.72 OpenFlow 178 Type: OFPT_BARRIER_REQUEST
221 0.765294461 172.31.31.144 -> 172.31.23.72 TCP 66 6633 → 40198 [ACK] Seq=169 Ack=9 Win=853 Len=0 TSval=684800 TSecr=777639
222 0.765319900 172.31.23.72 -> 172.31.31.144 TCP 66 40210 → 6633 [ACK] Seq=1 Ack=169 Win=384 Len=0 TSval=777639 TSecr=684799
223 0.765328080 172.31.23.72 -> 172.31.31.144 OpenFlow 74 Type: OFPT_BARRIER_REPLY
224 0.765347411 172.31.23.72 -> 172.31.31.144 OpenFlow 74 Type: OFPT_BARRIER_REPLY
225 0.765383536 172.31.31.144 -> 172.31.23.72 OpenFlow 178 Type: OFPT_BARRIER_REQUEST
226 0.765386508 172.31.31.144 -> 172.31.23.72 OpenFlow 74 Type: OFPT_BARRIER_REQUEST
227 0.765388109 172.31.31.144 -> 172.31.23.72 OpenFlow 170 Type: OFPT_FLOW_MOD
228 0.765389815 172.31.31.144 -> 172.31.23.72 OpenFlow 178 Type: OFPT_BARRIER_REQUEST
229 0.765391208 172.31.31.144 -> 172.31.23.72 TCP 66 6633 → 40200 [ACK] Seq=337 Ack=17 Win=853 Len=0 TSval=684800 TSecr=777639
230 0.765397095 172.31.23.72 -> 172.31.31.144 OpenFlow 82 Type: OFPT_BARRIER_REPLY
231 0.765408154 172.31.23.72 -> 172.31.31.144 OpenFlow 189 Type: OFPT_PACKET_IN
232 0.765459540 172.31.31.144 -> 172.31.23.72 OpenFlow 154 Type: OFPT_BARRIER_REQUEST
233 0.765465197 172.31.31.144 -> 172.31.23.72 TCP 66 6633 → 40194 [ACK] Seq=1 Ack=247 Win=853 Len=0 TSval=684800 TSecr=777639
234 0.765468707 172.31.31.144 -> 172.31.23.72 TCP 66 6633 → 40202 [ACK] Seq=505 Ack=25 Win=853 Len=0 TSval=684800 TSecr=777639
235 0.765473854 172.31.23.72 -> 172.31.31.144 OpenFlow 90 Type: OFPT_BARRIER_REPLY
236 0.765505662 172.31.31.144 -> 172.31.23.72 TCP 66 6633 → 40204 [ACK] Seq=337 Ack=17 Win=853 Len=0 TSval=684800 TSecr=777639
237 0.765511040 172.31.23.72 -> 172.31.31.144 OpenFlow 189 Type: OFPT_PACKET_IN
238 0.765562266 172.31.31.144 -> 172.31.23.72 TCP 66 6633 → 40212 [ACK] Seq=673 Ack=9 Win=853 Len=0 TSval=684800 TSecr=777639
239 0.765601772 172.31.31.144 -> 172.31.23.72 TCP 66 6633 → 40208 [ACK] Seq=505 Ack=25 Win=853 Len=0 TSval=684800 TSecr=777639
240 0.765619349 172.31.31.144 -> 172.31.23.72 TCP 66 6633 → 40214 [ACK] Seq=1 Ack=124 Win=853 Len=0 TSval=684800 TSecr=777639
241 0.765637378 172.31.31.144 -> 172.31.23.72 TCP 66 6633 → 40212 [ACK] Seq=673 Ack=33 Win=853 Len=0 TSval=684800 TSecr=777639
242 0.765655480 172.31.31.144 -> 172.31.23.72 TCP 66 6633 → 40214 [ACK] Seq=1 Ack=247 Win=853 Len=0 TSval=684800 TSecr=777639
243 0.765674276 172.31.31.144 -> 172.31.23.72 OpenFlow 170 Type: OFPT_FLOW_MOD
244 0.765683900 172.31.23.72 -> 172.31.31.144 OpenFlow 146 Type: OFPT_FLOW_REMOVED
245 0.765708597 172.31.23.72 -> 172.31.31.144 OpenFlow 146 Type: OFPT_FLOW_REMOVED
246 0.765719905 172.31.31.144 -> 172.31.23.72 OpenFlow 170 Type: OFPT_FLOW_MOD
247 0.765730981 172.31.23.72 -> 172.31.31.144 OpenFlow 146 Type: OFPT_FLOW_REMOVED
248 0.765735509 172.31.23.72 -> 172.31.31.144 OpenFlow 626 Type: OFPT_FLOW_REMOVED
249 0.765744986 172.31.23.72 -> 172.31.31.144 OpenFlow 146 Type: OFPT_FLOW_REMOVED
250 0.765746850 172.31.23.72 -> 172.31.31.144 OpenFlow 466 Type: OFPT_FLOW_REMOVED
251 0.765768117 172.31.31.144 -> 172.31.23.72 OpenFlow 74 Type: OFPT_BARRIER_REQUEST
252 0.765771544 172.31.23.72 -> 172.31.31.144 OpenFlow 146 Type: OFPT_FLOW_REMOVED
253 0.765776154 172.31.23.72 -> 172.31.31.144 OpenFlow 146 Type: OFPT_FLOW_REMOVED
254 0.765791857 172.31.23.72 -> 172.31.31.144 OpenFlow 146 Type: OFPT_FLOW_REMOVED
255 0.765830163 172.31.23.72 -> 172.31.31.144 OpenFlow 1506 Type: OFPT_FLOW_REMOVED
256 0.765832584 172.31.23.72 -> 172.31.31.144 OpenFlow 626 Type: OFPT_FLOW_REMOVED
257 0.765851137 172.31.23.72 -> 172.31.31.144 OpenFlow 146 Type: OFPT_FLOW_REMOVED
258 0.765873188 172.31.31.144 -> 172.31.23.72 OpenFlow 170 Type: OFPT_FLOW_MOD
259 0.765876265 172.31.31.144 -> 172.31.23.72 OpenFlow 170 Type: OFPT_FLOW_MOD
260 0.765877967 172.31.31.144 -> 172.31.23.72 OpenFlow 170 Type: OFPT_FLOW_MOD
261 0.765879699 172.31.31.144 -> 172.31.23.72 OpenFlow 178 Type: OFPT_BARRIER_REQUEST
262 0.765887398 172.31.23.72 -> 172.31.31.144 OpenFlow 146 Type: OFPT_FLOW_REMOVED
263 0.765892034 172.31.23.72 -> 172.31.31.144 OpenFlow 466 Type: OFPT_FLOW_REMOVED
264 0.765899665 172.31.23.72 -> 172.31.31.144 OpenFlow 146 Type: OFPT_FLOW_REMOVED
265 0.765918654 172.31.23.72 -> 172.31.31.144 OpenFlow 146 Type: OFPT_FLOW_REMOVED
266 0.765949554 172.31.23.72 -> 172.31.31.144 OpenFlow 146 Type: OFPT_FLOW_REMOVED
267 0.765951942 172.31.23.72 -> 172.31.31.144 OpenFlow 626 Type: OFPT_FLOW_REMOVED
268 0.765959266 172.31.23.72 -> 172.31.31.144 OpenFlow 146 Type: OFPT_FLOW_REMOVED
269 0.765966287 172.31.23.72 -> 172.31.31.144 OpenFlow 146 Type: OFPT_FLOW_REMOVED
270 0.765978568 172.31.23.72 -> 172.31.31.144 OpenFlow 146 Type: OFPT_FLOW_REMOVED
271 0.765993069 172.31.23.72 -> 172.31.31.144 OpenFlow 146 Type: OFPT_FLOW_REMOVED
272 0.765995034 172.31.23.72 -> 172.31.31.144 OpenFlow 706 Type: OFPT_FLOW_REMOVED
273 0.766005583 172.31.23.72 -> 172.31.31.144 OpenFlow 146 Type: OFPT_FLOW_REMOVED
274 0.766018942 172.31.31.144 -> 172.31.23.72 OpenFlow 170 Type: OFPT_FLOW_MOD
275 0.766021104 172.31.31.144 -> 172.31.23.72 TCP 66 6633 → 40142 [ACK] Seq=505 Ack=105 Win=853 Len=0 TSval=684801 TSecr=777639
276 0.766023936 172.31.31.144 -> 172.31.23.72 OpenFlow 178 Type: OFPT_BARRIER_REQUEST
277 0.766025440 172.31.31.144 -> 172.31.23.72 OpenFlow 178 Type: OFPT_BARRIER_REQUEST
278 0.766028153 172.31.23.72 -> 172.31.31.144 OpenFlow 146 Type: OFPT_FLOW_REMOVED
279 0.766032646 172.31.31.144 -> 172.31.23.72 TCP 66 6633 → 40144 [ACK] Seq=169 Ack=89 Win=853 Len=0 TSval=684801 TSecr=777639
280 0.766034793 172.31.31.144 -> 172.31.23.72 OpenFlow 170 Type: OFPT_FLOW_MOD
281 0.766036367 172.31.31.144 -> 172.31.23.72 TCP 66 6633 → 40140 [ACK] Seq=889 Ack=673 Win=853 Len=0 TSval=684801 TSecr=777639
282 0.766038412 172.31.31.144 -> 172.31.23.72 OpenFlow 74 Type: OFPT_BARRIER_REQUEST
283 0.766060116 172.31.23.72 -> 172.31.31.144 OpenFlow 146 Type: OFPT_FLOW_REMOVED
284 0.766075590 172.31.23.72 -> 172.31.31.144 OpenFlow 146 Type: OFPT_FLOW_REMOVED
285 0.766077638 172.31.23.72 -> 172.31.31.144 OpenFlow 626 Type: OFPT_FLOW_REMOVED
286 0.766084829 172.31.23.72 -> 172.31.31.144 OpenFlow 146 Type: OFPT_FLOW_REMOVED
287 0.766265657 172.31.23.72 -> 172.31.31.144 OpenFlow 1106 Type: OFPT_FLOW_REMOVED
288 0.766268277 172.31.23.72 -> 172.31.31.144 OpenFlow 146 Type: OFPT_FLOW_REMOVED
289 0.766270006 172.31.23.72 -> 172.31.31.144 OpenFlow 146 Type: OFPT_FLOW_REMOVED
290 0.766271708 172.31.23.72 -> 172.31.31.144 OpenFlow 306 Type: OFPT_FLOW_REMOVED
291 0.766273227 172.31.23.72 -> 172.31.31.144 OpenFlow 466 Type: OFPT_FLOW_REMOVED
292 0.766275020 172.31.23.72 -> 172.31.31.144 OpenFlow 306 Type: OFPT_FLOW_REMOVED
293 0.766332706 172.31.31.144 -> 172.31.23.72 TCP 66 6633 → 40150 [ACK] Seq=505 Ack=351 Win=853 Len=0 TSval=684801 TSecr=777639
294 0.766336612 172.31.31.144 -> 172.31.23.72 OpenFlow 170 Type: OFPT_FLOW_MOD
295 0.766338949 172.31.31.144 -> 172.31.23.72 TCP 66 6633 → 40144 [ACK] Seq=169 Ack=169 Win=853 Len=0 TSval=684801 TSecr=777639
296 0.766340955 172.31.31.144 -> 172.31.23.72 OpenFlow 170 Type: OFPT_FLOW_MOD
297 0.766343419 172.31.31.144 -> 172.31.23.72 OpenFlow 170 Type: OFPT_FLOW_MOD
298 0.766345517 172.31.31.144 -> 172.31.23.72 OpenFlow 170 Type: OFPT_FLOW_MOD
299 0.766347141 172.31.31.144 -> 172.31.23.72 OpenFlow 170 Type: OFPT_FLOW_MOD
300 0.766348949 172.31.31.144 -> 172.31.23.72 OpenFlow 170 Type: OFPT_FLOW_MOD
301 0.766350525 172.31.31.144 -> 172.31.23.72 OpenFlow 178 Type: OFPT_BARRIER_REQUEST
302 0.766352422 172.31.31.144 -> 172.31.23.72 OpenFlow 74 Type: OFPT_BARRIER_REQUEST
303 0.766353959 172.31.31.144 -> 172.31.23.72 OpenFlow 178 Type: OFPT_BARRIER_REQUEST
304 0.766355366 172.31.31.144 -> 172.31.23.72 OpenFlow 170 Type: OFPT_FLOW_MOD
305 0.766357157 172.31.31.144 -> 172.31.23.72 TCP 66 6633 → 40152 [ACK] Seq=2617 Ack=1705 Win=853 Len=0 TSval=684801 TSecr=777639
306 0.766359437 172.31.31.144 -> 172.31.23.72 OpenFlow 74 Type: OFPT_BARRIER_REQUEST
307 0.766360885 172.31.31.144 -> 172.31.23.72 OpenFlow 170 Type: OFPT_FLOW_MOD
308 0.766362739 172.31.31.144 -> 172.31.23.72 TCP 66 6633 → 40150 [ACK] Seq=505 Ack=751 Win=853 Len=0 TSval=684801 TSecr=777639
309 0.766364449 172.31.31.144 -> 172.31.23.72 OpenFlow 74 Type: OFPT_BARRIER_REQUEST
310 0.766373428 172.31.23.72 -> 172.31.31.144 OpenFlow 866 Type: OFPT_FLOW_REMOVED
311 0.766379757 172.31.23.72 -> 172.31.31.144 OpenFlow 466 Type: OFPT_FLOW_REMOVED
312 0.766513875 172.31.23.72 -> 172.31.31.144 OpenFlow 146 Type: OFPT_FLOW_REMOVED
313 0.766516055 172.31.23.72 -> 172.31.31.144 OpenFlow 626 Type: OFPT_FLOW_REMOVED
314 0.766619055 172.31.31.144 -> 172.31.23.72 OpenFlow 170 Type: OFPT_FLOW_MOD
315 0.766622004 172.31.31.144 -> 172.31.23.72 OpenFlow 170 Type: OFPT_FLOW_MOD
316 0.766623423 172.31.31.144 -> 172.31.23.72 TCP 66 6633 → 40198 [ACK] Seq=169 Ack=89 Win=853 Len=0 TSval=684801 TSecr=777639
317 0.766625781 172.31.31.144 -> 172.31.23.72 TCP 66 6633 → 40196 [ACK] Seq=169 Ack=89 Win=853 Len=0 TSval=684801 TSecr=777639
318 0.766627833 172.31.31.144 -> 172.31.23.72 OpenFlow 170 Type: OFPT_FLOW_MOD
319 0.766629579 172.31.31.144 -> 172.31.23.72 OpenFlow 170 Type: OFPT_FLOW_MOD
320 0.766631736 172.31.31.144 -> 172.31.23.72 OpenFlow 170 Type: OFPT_FLOW_MOD
321 0.766634067 172.31.31.144 -> 172.31.23.72 OpenFlow 170 Type: OFPT_FLOW_MOD
322 0.766635432 172.31.31.144 -> 172.31.23.72 TCP 66 6633 → 40188 [ACK] Seq=817 Ack=169 Win=853 Len=0 TSval=684801 TSecr=777639
323 0.766637260 172.31.31.144 -> 172.31.23.72 OpenFlow 74 Type: OFPT_BARRIER_REQUEST
324 0.766639101 172.31.31.144 -> 172.31.23.72 TCP 66 6633 → 40210 [ACK] Seq=169 Ack=89 Win=853 Len=0 TSval=684801 TSecr=777639
325 0.766641016 172.31.31.144 -> 172.31.23.72 TCP 66 6633 → 40212 [ACK] Seq=673 Ack=113 Win=853 Len=0 TSval=684801 TSecr=777639
326 0.766716635 172.31.31.144 -> 172.31.23.72 OpenFlow 170 Type: OFPT_FLOW_MOD
327 0.766719428 172.31.31.144 -> 172.31.23.72 OpenFlow 170 Type: OFPT_FLOW_MOD
328 0.766721334 172.31.31.144 -> 172.31.23.72 TCP 66 6633 → 40192 [ACK] Seq=1777 Ack=1345 Win=853 Len=0 TSval=684801 TSecr=777639
329 0.766723469 172.31.31.144 -> 172.31.23.72 TCP 66 6633 → 40190 [ACK] Seq=1273 Ack=841 Win=853 Len=0 TSval=684801 TSecr=777639
330 0.766725394 172.31.31.144 -> 172.31.23.72 TCP 66 6633 → 40198 [ACK] Seq=169 Ack=169 Win=853 Len=0 TSval=684801 TSecr=777639
331 0.766727130 172.31.31.144 -> 172.31.23.72 TCP 66 6633 → 40200 [ACK] Seq=337 Ack=337 Win=853 Len=0 TSval=684801 TSecr=777639
332 0.766731025 172.31.31.144 -> 172.31.23.72 TCP 66 6633 → 40202 [ACK] Seq=505 Ack=505 Win=853 Len=0 TSval=684801 TSecr=777639
333 0.766747143 172.31.31.144 -> 172.31.23.72 TCP 66 6633 → 40204 [ACK] Seq=337 Ack=337 Win=853 Len=0 TSval=684801 TSecr=777639
334 0.766783489 172.31.31.144 -> 172.31.23.72 TCP 66 6633 → 40206 [ACK] Seq=1393 Ack=1089 Win=853 Len=0 TSval=684801 TSecr=777639
335 0.766801386 172.31.31.144 -> 172.31.23.72 TCP 66 6633 → 40212 [ACK] Seq=673 Ack=673 Win=853 Len=0 TSval=684801 TSecr=777639
336 0.766869507 172.31.31.144 -> 172.31.23.72 OpenFlow 170 Type: OFPT_FLOW_MOD
337 0.766893118 172.31.31.144 -> 172.31.23.72 OpenFlow 170 Type: OFPT_FLOW_MOD
338 0.767044207 172.31.31.144 -> 172.31.23.72 OpenFlow 170 Type: OFPT_FLOW_MOD
339 0.767154994 172.31.31.144 -> 172.31.23.72 OpenFlow 170 Type: OFPT_FLOW_MOD
340 0.767226906 172.31.31.144 -> 172.31.23.72 OpenFlow 170 Type: OFPT_FLOW_MOD
341 0.767229567 172.31.31.144 -> 172.31.23.72 OpenFlow 170 Type: OFPT_FLOW_MOD
342 0.767718501 172.31.31.144 -> 172.31.23.72 OpenFlow 170 Type: OFPT_FLOW_MOD
343 0.767860434 172.31.23.72 -> 172.31.31.144 OpenFlow 74 Type: OFPT_BARRIER_REPLY
344 0.767906961 172.31.23.72 -> 172.31.31.144 TCP 66 40142 → 6633 [ACK] Seq=505 Ack=721 Win=385 Len=0 TSval=777640 TSecr=684801
345 0.767915886 172.31.23.72 -> 172.31.31.144 OpenFlow 74 Type: OFPT_BARRIER_REPLY
346 0.767935070 172.31.23.72 -> 172.31.31.144 OpenFlow 74 Type: OFPT_BARRIER_REPLY
347 0.768001279 172.31.23.72 -> 172.31.31.144 OpenFlow 114 Type: OFPT_BARRIER_REPLY
348 0.768032942 172.31.23.72 -> 172.31.31.144 OpenFlow 74 Type: OFPT_BARRIER_REPLY
349 0.768053505 172.31.23.72 -> 172.31.31.144 OpenFlow 74 Type: OFPT_BARRIER_REPLY
350 0.768070929 172.31.23.72 -> 172.31.31.144 OpenFlow 74 Type: OFPT_BARRIER_REPLY
351 0.768100412 172.31.23.72 -> 172.31.31.144 OpenFlow 74 Type: OFPT_BARRIER_REPLY
352 0.768122659 172.31.23.72 -> 172.31.31.144 OpenFlow 82 Type: OFPT_BARRIER_REPLY
353 0.768164793 172.31.23.72 -> 172.31.31.144 OpenFlow 74 Type: OFPT_BARRIER_REPLY
354 0.768186309 172.31.23.72 -> 172.31.31.144 OpenFlow 74 Type: OFPT_BARRIER_REPLY
355 0.768214713 172.31.31.144 -> 172.31.23.72 TCP 66 6633 → 40148 [ACK] Seq=3041 Ack=817 Win=853 Len=0 TSval=684801 TSecr=777640
356 0.768227521 172.31.23.72 -> 172.31.31.144 OpenFlow 74 Type: OFPT_BARRIER_REPLY
357 0.768251582 172.31.23.72 -> 172.31.31.144 OpenFlow 74 Type: OFPT_BARRIER_REPLY
358 0.768276347 172.31.31.144 -> 172.31.23.72 TCP 66 6633 → 40148 [ACK] Seq=3041 Ack=833 Win=853 Len=0 TSval=684801 TSecr=777640
359 0.768296347 172.31.23.72 -> 172.31.31.144 OpenFlow 74 Type: OFPT_BARRIER_REPLY
360 0.768318355 172.31.23.72 -> 172.31.31.144 OpenFlow 74 Type: OFPT_BARRIER_REPLY
361 0.768352013 172.31.23.72 -> 172.31.31.144 OpenFlow 74 Type: OFPT_BARRIER_REPLY
362 0.768394253 172.31.23.72 -> 172.31.31.144 OpenFlow 74 Type: OFPT_BARRIER_REPLY
363 0.768399291 172.31.23.72 -> 172.31.31.144 OpenFlow 74 Type: OFPT_BARRIER_REPLY
364 0.768401528 172.31.23.72 -> 172.31.31.144 OpenFlow 74 Type: OFPT_BARRIER_REPLY
365 0.768463590 172.31.23.72 -> 172.31.31.144 OpenFlow 74 Type: OFPT_BARRIER_REPLY
366 0.768474316 172.31.23.72 -> 172.31.31.144 OpenFlow 74 Type: OFPT_BARRIER_REPLY
367 0.768498248 172.31.31.144 -> 172.31.23.72 TCP 66 6633 → 40152 [ACK] Seq=2825 Ack=2281 Win=853 Len=0 TSval=684801 TSecr=777640
368 0.768502560 172.31.31.144 -> 172.31.23.72 TCP 66 6633 → 40154 [ACK] Seq=1057 Ack=769 Win=853 Len=0 TSval=684801 TSecr=777639
369 0.768526305 172.31.23.72 -> 172.31.31.144 OpenFlow 74 Type: OFPT_BARRIER_REPLY
370 0.768544424 172.31.23.72 -> 172.31.31.144 OpenFlow 74 Type: OFPT_BARRIER_REPLY
371 0.768556134 172.31.31.144 -> 172.31.23.72 TCP 66 6633 → 40188 [ACK] Seq=817 Ack=185 Win=853 Len=0 TSval=684801 TSecr=777640
372 0.768559843 172.31.31.144 -> 172.31.23.72 TCP 66 6633 → 40190 [ACK] Seq=1481 Ack=857 Win=853 Len=0 TSval=684801 TSecr=777640
373 0.768653874 172.31.31.144 -> 172.31.23.72 OpenFlow 170 Type: OFPT_FLOW_MOD
374 0.768658825 172.31.31.144 -> 172.31.23.72 TCP 66 6633 → 40192 [ACK] Seq=1985 Ack=1361 Win=853 Len=0 TSval=684801 TSecr=777640
375 0.768661754 172.31.31.144 -> 172.31.23.72 OpenFlow 178 Type: OFPT_BARRIER_REQUEST
376 0.768675542 172.31.31.144 -> 172.31.23.72 TCP 170 6633 → 40216 [PSH, ACK] Seq=1 Ack=1 Win=853 Len=104 TSval=684801 TSecr=777314
377 0.768693234 172.31.31.144 -> 172.31.23.72 OpenFlow 170 Type: OFPT_FLOW_MOD
378 0.768712182 172.31.31.144 -> 172.31.23.72 OpenFlow 178 Type: OFPT_BARRIER_REQUEST
379 0.768744169 172.31.23.72 -> 172.31.31.144 OpenFlow 146 Type: OFPT_FLOW_REMOVED
380 0.768772803 172.31.31.144 -> 172.31.23.72 TCP 178 6633 → 40216 [PSH, ACK] Seq=105 Ack=1 Win=853 Len=112 TSval=684801 TSecr=777314
381 0.768776417 172.31.31.144 -> 172.31.23.72 TCP 66 6633 → 40206 [ACK] Seq=1601 Ack=1105 Win=853 Len=0 TSval=684801 TSecr=777640
382 0.768779135 172.31.31.144 -> 172.31.23.72 OpenFlow 170 Type: OFPT_FLOW_MOD
383 0.768784399 172.31.23.72 -> 172.31.31.144 OpenFlow 626 Type: OFPT_FLOW_REMOVED
384 0.768802907 172.31.31.144 -> 172.31.23.72 OpenFlow 170 Type: OFPT_FLOW_MOD
385 0.768806545 172.31.23.72 -> 172.31.31.144 OpenFlow 306 Type: OFPT_FLOW_REMOVED
386 0.768830627 172.31.31.144 -> 172.31.23.72 OpenFlow 170 Type: OFPT_FLOW_MOD
387 0.768834094 172.31.23.72 -> 172.31.31.144 OpenFlow 546 Type: OFPT_FLOW_REMOVED
388 0.768844565 172.31.23.72 -> 172.31.31.144 OpenFlow 146 Type: OFPT_FLOW_REMOVED
389 0.768849859 172.31.23.72 -> 172.31.31.144 OpenFlow 146 Type: OFPT_FLOW_REMOVED
390 0.768858978 172.31.31.144 -> 172.31.23.72 OpenFlow 290 Type: OFPT_BARRIER_REQUEST
391 0.768888146 172.31.23.72 -> 172.31.31.144 OpenFlow 146 Type: OFPT_FLOW_REMOVED
392 0.768934975 172.31.31.144 -> 172.31.23.72 OpenFlow 170 Type: OFPT_FLOW_MOD
393 0.768938720 172.31.31.144 -> 172.31.23.72 OpenFlow 74 Type: OFPT_BARRIER_REQUEST
394 0.768940339 172.31.31.144 -> 172.31.23.72 OpenFlow 170 Type: OFPT_FLOW_MOD
395 0.768958840 172.31.31.144 -> 172.31.23.72 OpenFlow 170 Type: OFPT_FLOW_MOD
