  1 0.000000000 41.177.127.217 -> 172.31.24.227 TCP 54 58416 → 22 [ACK] Seq=1 Ack=1 Win=32452 Len=0
  2 0.043451802 41.177.127.217 -> 172.31.24.227 TCP 54 58416 → 22 [ACK] Seq=1 Ack=37 Win=32434 Len=0
  3 0.119434756 41.177.127.217 -> 172.31.24.227 TCP 54 58416 → 22 [ACK] Seq=1 Ack=133 Win=32386 Len=0
  4 0.466852372 172.31.31.144 -> 172.31.24.227 TCP 187 6633 → 39480 [PSH, ACK] Seq=1 Ack=1 Win=853 Len=121 TSval=354540 TSecr=118914777
  5 0.466875281 172.31.31.144 -> 172.31.24.227 TCP 187 6633 → 39480 [PSH, ACK] Seq=122 Ack=1 Win=853 Len=121 TSval=354540 TSecr=118914777
  6 0.466889813 172.31.31.144 -> 172.31.24.227 TCP 187 6633 → 39480 [PSH, ACK] Seq=243 Ack=1 Win=853 Len=121 TSval=354540 TSecr=118914777
  7 0.466934307 172.31.31.144 -> 172.31.24.227 TCP 187 6633 → 39480 [PSH, ACK] Seq=364 Ack=1 Win=853 Len=121 TSval=354540 TSecr=118914777
  8 0.466980333 172.31.31.144 -> 172.31.24.227 TCP 187 6633 → 39480 [PSH, ACK] Seq=485 Ack=1 Win=853 Len=121 TSval=354540 TSecr=118914777
  9 0.466990102 172.31.24.227 -> 172.31.31.144 TCP 66 39480 → 6633 [ACK] Seq=1 Ack=606 Win=70 Len=0 TSval=118915150 TSecr=354540
 10 0.467043525 172.31.31.144 -> 172.31.24.227 TCP 187 6633 → 39480 [PSH, ACK] Seq=606 Ack=1 Win=853 Len=121 TSval=354540 TSecr=118914777
 11 0.467094188 172.31.31.144 -> 172.31.24.227 TCP 187 6633 → 39480 [PSH, ACK] Seq=727 Ack=1 Win=853 Len=121 TSval=354540 TSecr=118914777
 12 0.467141295 172.31.31.144 -> 172.31.24.227 TCP 187 6633 → 39480 [PSH, ACK] Seq=848 Ack=1 Win=853 Len=121 TSval=354540 TSecr=118914777
 13 0.467198584 172.31.31.144 -> 172.31.24.227 TCP 187 6633 → 39480 [PSH, ACK] Seq=969 Ack=1 Win=853 Len=121 TSval=354540 TSecr=118915150
 14 0.467246416 172.31.31.144 -> 172.31.24.227 TCP 187 6633 → 39480 [PSH, ACK] Seq=1090 Ack=1 Win=853 Len=121 TSval=354540 TSecr=118915150
 15 0.467250896 172.31.24.227 -> 172.31.31.144 TCP 66 39480 → 6633 [ACK] Seq=1 Ack=1211 Win=70 Len=0 TSval=118915150 TSecr=354540
 16 0.467309031 172.31.31.144 -> 172.31.24.227 TCP 187 6633 → 39480 [PSH, ACK] Seq=1211 Ack=1 Win=853 Len=121 TSval=354540 TSecr=118915150
 17 0.467364432 172.31.31.144 -> 172.31.24.227 TCP 187 6633 → 39480 [PSH, ACK] Seq=1332 Ack=1 Win=853 Len=121 TSval=354541 TSecr=118915150
 18 0.467520248 172.31.31.144 -> 172.31.24.227 TCP 187 6633 → 39456 [PSH, ACK] Seq=1 Ack=1 Win=853 Len=121 TSval=354541 TSecr=118914793
 19 0.467552812 172.31.31.144 -> 172.31.24.227 TCP 187 6633 → 39456 [PSH, ACK] Seq=122 Ack=1 Win=853 Len=121 TSval=354541 TSecr=118914793
 20 0.467593275 172.31.31.144 -> 172.31.24.227 TCP 187 6633 → 39456 [PSH, ACK] Seq=243 Ack=1 Win=853 Len=121 TSval=354541 TSecr=118914793
 21 0.467653940 172.31.31.144 -> 172.31.24.227 TCP 187 6633 → 39456 [PSH, ACK] Seq=364 Ack=1 Win=853 Len=121 TSval=354541 TSecr=118914793
 22 0.467722351 172.31.31.144 -> 172.31.24.227 TCP 187 6633 → 39456 [PSH, ACK] Seq=485 Ack=1 Win=853 Len=121 TSval=354541 TSecr=118914793
 23 0.467728174 172.31.24.227 -> 172.31.31.144 TCP 66 39456 → 6633 [ACK] Seq=1 Ack=606 Win=61 Len=0 TSval=118915150 TSecr=354541
 24 0.467800818 172.31.31.144 -> 172.31.24.227 TCP 187 6633 → 39456 [PSH, ACK] Seq=606 Ack=1 Win=853 Len=121 TSval=354541 TSecr=118914793
 25 0.467845203 172.31.31.144 -> 172.31.24.227 TCP 187 6633 → 39456 [PSH, ACK] Seq=727 Ack=1 Win=853 Len=121 TSval=354541 TSecr=118914793
 26 0.467911254 172.31.31.144 -> 172.31.24.227 TCP 187 6633 → 39456 [PSH, ACK] Seq=848 Ack=1 Win=853 Len=121 TSval=354541 TSecr=118914793
 27 0.467961768 172.31.31.144 -> 172.31.24.227 TCP 187 6633 → 39456 [PSH, ACK] Seq=969 Ack=1 Win=853 Len=121 TSval=354541 TSecr=118915150
 28 0.467991676 172.31.24.227 -> 172.31.31.144 TCP 66 39480 → 6633 [ACK] Seq=1 Ack=1453 Win=70 Len=0 TSval=118915151 TSecr=354540
 29 0.468037163 172.31.31.144 -> 172.31.24.227 TCP 187 6633 → 39456 [PSH, ACK] Seq=1090 Ack=1 Win=853 Len=121 TSval=354541 TSecr=118915150
 30 0.468042769 172.31.24.227 -> 172.31.31.144 TCP 66 39456 → 6633 [ACK] Seq=1 Ack=1211 Win=61 Len=0 TSval=118915151 TSecr=354541
 31 0.468093910 172.31.31.144 -> 172.31.24.227 TCP 187 6633 → 39456 [PSH, ACK] Seq=1211 Ack=1 Win=853 Len=121 TSval=354541 TSecr=118915150
 32 0.468108052 172.31.24.227 -> 172.31.31.144 OpenFlow 189 Type: OFPT_PACKET_IN
 33 0.468127989 172.31.24.227 -> 172.31.31.144 OpenFlow 435 Type: OFPT_PACKET_IN
 34 0.468152503 172.31.31.144 -> 172.31.24.227 TCP 187 6633 → 39456 [PSH, ACK] Seq=1332 Ack=1 Win=853 Len=121 TSval=354541 TSecr=118915150
 35 0.468166750 172.31.24.227 -> 172.31.31.144 OpenFlow 189 Type: OFPT_PACKET_IN
 36 0.468186791 172.31.24.227 -> 172.31.31.144 OpenFlow 189 Type: OFPT_PACKET_IN
 37 0.468233705 172.31.31.144 -> 172.31.24.227 TCP 187 6633 → 39486 [PSH, ACK] Seq=1 Ack=1 Win=853 Len=121 TSval=354541 TSecr=118914765
 38 0.468301217 172.31.31.144 -> 172.31.24.227 TCP 66 6633 → 39484 [ACK] Seq=1 Ack=124 Win=853 Len=0 TSval=354541 TSecr=118915151
 39 0.468327964 172.31.31.144 -> 172.31.24.227 TCP 66 6633 → 39484 [ACK] Seq=1 Ack=493 Win=853 Len=0 TSval=354541 TSecr=118915151
 40 0.468352675 172.31.31.144 -> 172.31.24.227 TCP 187 6633 → 39486 [PSH, ACK] Seq=122 Ack=1 Win=853 Len=121 TSval=354541 TSecr=118914765
 41 0.468373470 172.31.31.144 -> 172.31.24.227 TCP 66 6633 → 39492 [ACK] Seq=1 Ack=124 Win=853 Len=0 TSval=354541 TSecr=118915151
 42 0.468392030 172.31.31.144 -> 172.31.24.227 TCP 187 6633 → 39486 [PSH, ACK] Seq=243 Ack=1 Win=853 Len=121 TSval=354541 TSecr=118914765
 43 0.468410742 172.31.31.144 -> 172.31.24.227 TCP 66 6633 → 39492 [ACK] Seq=1 Ack=247 Win=853 Len=0 TSval=354541 TSecr=118915151
 44 0.468430561 172.31.31.144 -> 172.31.24.227 TCP 187 6633 → 39486 [PSH, ACK] Seq=364 Ack=1 Win=853 Len=121 TSval=354541 TSecr=118914765
 45 0.468449750 172.31.31.144 -> 172.31.24.227 TCP 187 6633 → 39486 [PSH, ACK] Seq=485 Ack=1 Win=853 Len=121 TSval=354541 TSecr=118914765
 46 0.468519034 172.31.31.144 -> 172.31.24.227 TCP 187 6633 → 39486 [PSH, ACK] Seq=606 Ack=1 Win=853 Len=121 TSval=354541 TSecr=118914765
 47 0.468525700 172.31.24.227 -> 172.31.31.144 TCP 66 39486 → 6633 [ACK] Seq=1 Ack=727 Win=78 Len=0 TSval=118915151 TSecr=354541
 48 0.468578451 172.31.31.144 -> 172.31.24.227 TCP 187 6633 → 39486 [PSH, ACK] Seq=727 Ack=1 Win=853 Len=121 TSval=354541 TSecr=118914765
 49 0.468863964 172.31.24.227 -> 172.31.31.144 TCP 66 39456 → 6633 [ACK] Seq=1 Ack=1453 Win=61 Len=0 TSval=118915151 TSecr=354541
 50 0.468932283 172.31.24.227 -> 172.31.31.144 OpenFlow 189 Type: OFPT_PACKET_IN
 51 0.468965250 172.31.24.227 -> 172.31.31.144 OpenFlow 189 Type: OFPT_PACKET_IN
 52 0.468983566 172.31.24.227 -> 172.31.31.144 OpenFlow 189 Type: OFPT_PACKET_IN
 53 0.469009624 172.31.24.227 -> 172.31.31.144 OpenFlow 681 Type: OFPT_PACKET_IN
 54 0.469127067 172.31.31.144 -> 172.31.24.227 TCP 66 6633 → 39458 [ACK] Seq=1 Ack=124 Win=853 Len=0 TSval=354541 TSecr=118915151
 55 0.469144760 172.31.31.144 -> 172.31.24.227 TCP 66 6633 → 39458 [ACK] Seq=1 Ack=247 Win=853 Len=0 TSval=354541 TSecr=118915151
 56 0.469165066 172.31.31.144 -> 172.31.24.227 TCP 66 6633 → 39464 [ACK] Seq=1 Ack=124 Win=853 Len=0 TSval=354541 TSecr=118915151
 57 0.469192700 172.31.31.144 -> 172.31.24.227 TCP 66 6633 → 39464 [ACK] Seq=1 Ack=739 Win=853 Len=0 TSval=354541 TSecr=118915151
 58 0.469387971 172.31.24.227 -> 172.31.31.144 OpenFlow 189 Type: OFPT_PACKET_IN
 59 0.469408855 172.31.24.227 -> 172.31.31.144 OpenFlow 681 Type: OFPT_PACKET_IN
 60 0.469425622 172.31.24.227 -> 172.31.31.144 OpenFlow 189 Type: OFPT_PACKET_IN
 61 0.469445116 172.31.24.227 -> 172.31.31.144 OpenFlow 189 Type: OFPT_PACKET_IN
 62 0.469477916 172.31.24.227 -> 172.31.31.144 OpenFlow 189 Type: OFPT_PACKET_IN
 63 0.469482370 172.31.24.227 -> 172.31.31.144 OpenFlow 189 Type: OFPT_PACKET_IN
 64 0.469506096 172.31.24.227 -> 172.31.31.144 OpenFlow 189 Type: OFPT_PACKET_IN
 65 0.469529014 172.31.24.227 -> 172.31.31.144 OpenFlow 189 Type: OFPT_PACKET_IN
 66 0.469565851 172.31.24.227 -> 172.31.31.144 OpenFlow 189 Type: OFPT_PACKET_IN
 67 0.469570296 172.31.24.227 -> 172.31.31.144 OpenFlow 312 Type: OFPT_PACKET_IN
 68 0.469592672 172.31.31.144 -> 172.31.24.227 TCP 66 6633 → 39446 [ACK] Seq=1 Ack=124 Win=853 Len=0 TSval=354541 TSecr=118915151
 69 0.469648345 172.31.31.144 -> 172.31.24.227 TCP 66 6633 → 39446 [ACK] Seq=1 Ack=739 Win=853 Len=0 TSval=354541 TSecr=118915151
 70 0.469651638 172.31.31.144 -> 172.31.24.227 TCP 66 6633 → 39448 [ACK] Seq=1 Ack=124 Win=853 Len=0 TSval=354541 TSecr=118915151
 71 0.469667358 172.31.31.144 -> 172.31.24.227 TCP 66 6633 → 39450 [ACK] Seq=1 Ack=124 Win=853 Len=0 TSval=354541 TSecr=118915151
 72 0.469688735 172.31.31.144 -> 172.31.24.227 TCP 66 6633 → 39448 [ACK] Seq=1 Ack=247 Win=853 Len=0 TSval=354541 TSecr=118915151
 73 0.469708826 172.31.31.144 -> 172.31.24.227 TCP 66 6633 → 39450 [ACK] Seq=1 Ack=247 Win=853 Len=0 TSval=354541 TSecr=118915151
 74 0.469729714 172.31.31.144 -> 172.31.24.227 TCP 66 6633 → 39472 [ACK] Seq=1 Ack=124 Win=853 Len=0 TSval=354541 TSecr=118915151
 75 0.469750260 172.31.31.144 -> 172.31.24.227 TCP 66 6633 → 39478 [ACK] Seq=1 Ack=124 Win=853 Len=0 TSval=354541 TSecr=118915151
 76 0.469771702 172.31.31.144 -> 172.31.24.227 TCP 66 6633 → 39472 [ACK] Seq=1 Ack=247 Win=853 Len=0 TSval=354541 TSecr=118915151
 77 0.469804327 172.31.31.144 -> 172.31.24.227 TCP 66 6633 → 39478 [ACK] Seq=1 Ack=370 Win=853 Len=0 TSval=354541 TSecr=118915151
 78 0.473067132 172.31.31.144 -> 172.31.24.227 TCP 187 6633 → 39486 [PSH, ACK] Seq=848 Ack=1 Win=853 Len=121 TSval=354542 TSecr=118915151
 79 0.473393168 172.31.31.144 -> 172.31.24.227 TCP 187 6633 → 39468 [PSH, ACK] Seq=1 Ack=1 Win=853 Len=121 TSval=354542 TSecr=118914792
 80 0.473517728 172.31.31.144 -> 172.31.24.227 TCP 187 6633 → 39468 [PSH, ACK] Seq=122 Ack=1 Win=853 Len=121 TSval=354542 TSecr=118914792
 81 0.473525952 172.31.31.144 -> 172.31.24.227 TCP 187 6633 → 39468 [PSH, ACK] Seq=243 Ack=1 Win=853 Len=121 TSval=354542 TSecr=118914792
 82 0.473608133 172.31.31.144 -> 172.31.24.227 TCP 187 6633 → 39468 [PSH, ACK] Seq=364 Ack=1 Win=853 Len=121 TSval=354542 TSecr=118914792
 83 0.473721255 172.31.31.144 -> 172.31.24.227 TCP 187 6633 → 39468 [PSH, ACK] Seq=485 Ack=1 Win=853 Len=121 TSval=354542 TSecr=118914792
 84 0.473726128 172.31.24.227 -> 172.31.31.144 TCP 66 39468 → 6633 [ACK] Seq=1 Ack=606 Win=76 Len=0 TSval=118915152 TSecr=354542
 85 0.473827720 172.31.31.144 -> 172.31.24.227 TCP 187 6633 → 39468 [PSH, ACK] Seq=606 Ack=1 Win=853 Len=121 TSval=354542 TSecr=118914792
 86 0.473979814 172.31.31.144 -> 172.31.24.227 TCP 187 6633 → 39468 [PSH, ACK] Seq=727 Ack=1 Win=853 Len=121 TSval=354542 TSecr=118915152
 87 0.474035954 172.31.31.144 -> 172.31.24.227 TCP 187 6633 → 39468 [PSH, ACK] Seq=848 Ack=1 Win=853 Len=121 TSval=354542 TSecr=118915152
 88 0.474092971 172.31.31.144 -> 172.31.24.227 TCP 187 6633 → 39468 [PSH, ACK] Seq=969 Ack=1 Win=853 Len=121 TSval=354542 TSecr=118915152
 89 0.474147323 172.31.31.144 -> 172.31.24.227 TCP 187 6633 → 39468 [PSH, ACK] Seq=1090 Ack=1 Win=853 Len=121 TSval=354542 TSecr=118915152
 90 0.474150963 172.31.24.227 -> 172.31.31.144 TCP 66 39468 → 6633 [ACK] Seq=1 Ack=1211 Win=76 Len=0 TSval=118915152 TSecr=354542
 91 0.474228445 172.31.31.144 -> 172.31.24.227 TCP 187 6633 → 39468 [PSH, ACK] Seq=1211 Ack=1 Win=853 Len=121 TSval=354542 TSecr=118915152
 92 0.474272588 172.31.31.144 -> 172.31.24.227 TCP 187 6633 → 39468 [PSH, ACK] Seq=1332 Ack=1 Win=853 Len=121 TSval=354542 TSecr=118915152
 93 0.474327177 172.31.31.144 -> 172.31.24.227 TCP 187 6633 → 39468 [PSH, ACK] Seq=1453 Ack=1 Win=853 Len=121 TSval=354542 TSecr=118915152
 94 0.474400351 172.31.31.144 -> 172.31.24.227 TCP 187 6633 → 39468 [PSH, ACK] Seq=1574 Ack=1 Win=853 Len=121 TSval=354542 TSecr=118915152
 95 0.474464579 172.31.31.144 -> 172.31.24.227 TCP 187 6633 → 39466 [PSH, ACK] Seq=1 Ack=1 Win=853 Len=121 TSval=354542 TSecr=118914794
 96 0.474522800 172.31.31.144 -> 172.31.24.227 TCP 187 6633 → 39466 [PSH, ACK] Seq=122 Ack=1 Win=853 Len=121 TSval=354542 TSecr=118914794
 97 0.474579334 172.31.31.144 -> 172.31.24.227 TCP 187 6633 → 39466 [PSH, ACK] Seq=243 Ack=1 Win=853 Len=121 TSval=354542 TSecr=118914794
 98 0.474627443 172.31.31.144 -> 172.31.24.227 TCP 187 6633 → 39466 [PSH, ACK] Seq=364 Ack=1 Win=853 Len=121 TSval=354542 TSecr=118914794
 99 0.474685440 172.31.31.144 -> 172.31.24.227 TCP 187 6633 → 39466 [PSH, ACK] Seq=485 Ack=1 Win=853 Len=121 TSval=354542 TSecr=118914794
100 0.474752243 172.31.31.144 -> 172.31.24.227 TCP 187 6633 → 39466 [PSH, ACK] Seq=606 Ack=1 Win=853 Len=121 TSval=354542 TSecr=118914794
101 0.474820422 172.31.31.144 -> 172.31.24.227 TCP 187 6633 → 39466 [PSH, ACK] Seq=727 Ack=1 Win=853 Len=121 TSval=354542 TSecr=118914794
102 0.474872974 172.31.31.144 -> 172.31.24.227 TCP 187 6633 → 39466 [PSH, ACK] Seq=848 Ack=1 Win=853 Len=121 TSval=354542 TSecr=118914794
103 0.474936062 172.31.31.144 -> 172.31.24.227 TCP 187 6633 → 39466 [PSH, ACK] Seq=969 Ack=1 Win=853 Len=121 TSval=354542 TSecr=118914794
104 0.474998309 172.31.31.144 -> 172.31.24.227 TCP 187 6633 → 39466 [PSH, ACK] Seq=1090 Ack=1 Win=853 Len=121 TSval=354542 TSecr=118914794
105 0.475597406 172.31.31.144 -> 172.31.24.227 TCP 187 6633 → 39490 [PSH, ACK] Seq=1 Ack=1 Win=853 Len=121 TSval=354543 TSecr=118914770
106 0.475648800 172.31.31.144 -> 172.31.24.227 TCP 187 6633 → 39490 [PSH, ACK] Seq=122 Ack=1 Win=853 Len=121 TSval=354543 TSecr=118914770
107 0.475689488 172.31.31.144 -> 172.31.24.227 TCP 187 6633 → 39490 [PSH, ACK] Seq=243 Ack=1 Win=853 Len=121 TSval=354543 TSecr=118914770
108 0.475756410 172.31.31.144 -> 172.31.24.227 TCP 187 6633 → 39490 [PSH, ACK] Seq=364 Ack=1 Win=853 Len=121 TSval=354543 TSecr=118914770
109 0.475823551 172.31.31.144 -> 172.31.24.227 TCP 187 6633 → 39490 [PSH, ACK] Seq=485 Ack=1 Win=853 Len=121 TSval=354543 TSecr=118914770
110 0.475828499 172.31.24.227 -> 172.31.31.144 TCP 66 39490 → 6633 [ACK] Seq=1 Ack=606 Win=57 Len=0 TSval=118915153 TSecr=354543
111 0.475867117 172.31.31.144 -> 172.31.24.227 TCP 187 6633 → 39490 [PSH, ACK] Seq=606 Ack=1 Win=853 Len=121 TSval=354543 TSecr=118914770
112 0.475929533 172.31.31.144 -> 172.31.24.227 TCP 187 6633 → 39490 [PSH, ACK] Seq=727 Ack=1 Win=853 Len=121 TSval=354543 TSecr=118914770
113 0.475972085 172.31.31.144 -> 172.31.24.227 TCP 187 6633 → 39490 [PSH, ACK] Seq=848 Ack=1 Win=853 Len=121 TSval=354543 TSecr=118914770
114 0.476071996 172.31.31.144 -> 172.31.24.227 TCP 187 6633 → 39490 [PSH, ACK] Seq=969 Ack=1 Win=853 Len=121 TSval=354543 TSecr=118915153
115 0.476090831 172.31.31.144 -> 172.31.24.227 TCP 187 6633 → 39490 [PSH, ACK] Seq=1090 Ack=1 Win=853 Len=121 TSval=354543 TSecr=118915153
116 0.476094299 172.31.24.227 -> 172.31.31.144 TCP 66 39490 → 6633 [ACK] Seq=1 Ack=1211 Win=57 Len=0 TSval=118915153 TSecr=354543
117 0.483435866 172.31.31.144 -> 172.31.24.227 TCP 1034 6633 → 39466 [PSH, ACK] Seq=1211 Ack=1 Win=853 Len=968 TSval=354545 TSecr=118914794
118 0.483444328 172.31.24.227 -> 172.31.31.144 TCP 66 39466 → 6633 [ACK] Seq=1 Ack=2179 Win=281 Len=0 TSval=118915154 TSecr=354542
119 0.483450751 172.31.31.144 -> 172.31.24.227 TCP 187 [TCP Retransmission] 6633 → 39468 [PSH, ACK] Seq=1574 Ack=1 Win=853 Len=121 TSval=354545 TSecr=118915152
120 0.483454219 172.31.24.227 -> 172.31.31.144 TCP 78 39468 → 6633 [ACK] Seq=1 Ack=1695 Win=76 Len=0 TSval=118915154 TSecr=354542 SLE=1574 SRE=1695
121 0.483478633 172.31.31.144 -> 172.31.24.227 TCP 187 [TCP Retransmission] 6633 → 39486 [PSH, ACK] Seq=848 Ack=1 Win=853 Len=121 TSval=354545 TSecr=118915151
122 0.483481980 172.31.24.227 -> 172.31.31.144 TCP 78 39486 → 6633 [ACK] Seq=1 Ack=969 Win=78 Len=0 TSval=118915154 TSecr=354541 SLE=848 SRE=969
123 0.486597531 172.31.24.227 -> 172.31.31.144 OpenFlow 189 Type: OFPT_PACKET_IN
124 0.486639246 172.31.24.227 -> 172.31.31.144 OpenFlow 681 Type: OFPT_PACKET_IN
125 0.486654721 172.31.24.227 -> 172.31.31.144 OpenFlow 189 Type: OFPT_PACKET_IN
126 0.486686403 172.31.24.227 -> 172.31.31.144 OpenFlow 189 Type: OFPT_PACKET_IN
127 0.486850502 172.31.31.144 -> 172.31.24.227 TCP 66 6633 → 39470 [ACK] Seq=1 Ack=124 Win=853 Len=0 TSval=354545 TSecr=118915155
128 0.486889425 172.31.31.144 -> 172.31.24.227 TCP 66 6633 → 39470 [ACK] Seq=1 Ack=739 Win=853 Len=0 TSval=354545 TSecr=118915155
129 0.486929176 172.31.31.144 -> 172.31.24.227 TCP 66 6633 → 39476 [ACK] Seq=1 Ack=124 Win=853 Len=0 TSval=354545 TSecr=118915155
130 0.486979684 172.31.31.144 -> 172.31.24.227 TCP 66 6633 → 39476 [ACK] Seq=1 Ack=247 Win=853 Len=0 TSval=354545 TSecr=118915155
131 0.487215385 172.31.24.227 -> 172.31.31.144 OpenFlow 189 Type: OFPT_PACKET_IN
132 0.487237835 172.31.24.227 -> 172.31.31.144 OpenFlow 435 Type: OFPT_PACKET_IN
133 0.487417028 172.31.31.144 -> 172.31.24.227 TCP 66 6633 → 39492 [ACK] Seq=1 Ack=370 Win=853 Len=0 TSval=354546 TSecr=118915155
134 0.487433253 172.31.31.144 -> 172.31.24.227 TCP 66 6633 → 39492 [ACK] Seq=1 Ack=739 Win=853 Len=0 TSval=354546 TSecr=118915155
135 0.487596318 172.31.24.227 -> 172.31.31.144 OpenFlow 189 Type: OFPT_PACKET_IN
136 0.487616858 172.31.24.227 -> 172.31.31.144 OpenFlow 189 Type: OFPT_PACKET_IN
137 0.487632800 172.31.24.227 -> 172.31.31.144 OpenFlow 189 Type: OFPT_PACKET_IN
138 0.487647569 172.31.24.227 -> 172.31.31.144 OpenFlow 189 Type: OFPT_PACKET_IN
139 0.487676869 172.31.24.227 -> 172.31.31.144 OpenFlow 189 Type: OFPT_PACKET_IN
140 0.487678935 172.31.24.227 -> 172.31.31.144 OpenFlow 435 Type: OFPT_PACKET_IN
141 0.487702601 172.31.24.227 -> 172.31.31.144 OpenFlow 189 Type: OFPT_PACKET_IN
142 0.487710934 172.31.24.227 -> 172.31.31.144 OpenFlow 681 Type: OFPT_PACKET_IN
143 0.487712638 172.31.24.227 -> 172.31.31.144 OpenFlow 927 Type: OFPT_PACKET_IN
144 0.487731324 172.31.24.227 -> 172.31.31.144 OpenFlow 189 Type: OFPT_PACKET_IN
145 0.487767141 172.31.24.227 -> 172.31.31.144 OpenFlow 189 Type: OFPT_PACKET_IN
146 0.487778024 172.31.24.227 -> 172.31.31.144 OpenFlow 681 Type: OFPT_PACKET_IN
147 0.487836288 172.31.24.227 -> 172.31.31.144 OpenFlow 189 Type: OFPT_PACKET_IN
148 0.487868950 172.31.31.144 -> 172.31.24.227 TCP 66 6633 → 39446 [ACK] Seq=1 Ack=862 Win=853 Len=0 TSval=354546 TSecr=118915155
149 0.487879055 172.31.31.144 -> 172.31.24.227 TCP 66 6633 → 39446 [ACK] Seq=1 Ack=985 Win=853 Len=0 TSval=354546 TSecr=118915155
150 0.487880983 172.31.31.144 -> 172.31.24.227 TCP 66 6633 → 39450 [ACK] Seq=1 Ack=370 Win=853 Len=0 TSval=354546 TSecr=118915155
151 0.487956604 172.31.31.144 -> 172.31.24.227 TCP 66 6633 → 39452 [ACK] Seq=1 Ack=124 Win=853 Len=0 TSval=354546 TSecr=118915155
152 0.487961122 172.31.31.144 -> 172.31.24.227 TCP 66 6633 → 39458 [ACK] Seq=1 Ack=370 Win=853 Len=0 TSval=354546 TSecr=118915155
153 0.487963000 172.31.31.144 -> 172.31.24.227 TCP 66 6633 → 39450 [ACK] Seq=1 Ack=739 Win=853 Len=0 TSval=354546 TSecr=118915155
154 0.487964867 172.31.31.144 -> 172.31.24.227 TCP 66 6633 → 39462 [ACK] Seq=1 Ack=124 Win=853 Len=0 TSval=354546 TSecr=118915155
155 0.487968626 172.31.31.144 -> 172.31.24.227 TCP 66 6633 → 39452 [ACK] Seq=1 Ack=739 Win=853 Len=0 TSval=354546 TSecr=118915155
156 0.487986221 172.31.31.144 -> 172.31.24.227 TCP 66 6633 → 39458 [ACK] Seq=1 Ack=1231 Win=853 Len=0 TSval=354546 TSecr=118915155
157 0.488006078 172.31.31.144 -> 172.31.24.227 TCP 66 6633 → 39464 [ACK] Seq=1 Ack=862 Win=853 Len=0 TSval=354546 TSecr=118915155
158 0.488049006 172.31.31.144 -> 172.31.24.227 TCP 66 6633 → 39478 [ACK] Seq=1 Ack=493 Win=853 Len=0 TSval=354546 TSecr=118915155
159 0.488070484 172.31.31.144 -> 172.31.24.227 TCP 66 6633 → 39464 [ACK] Seq=1 Ack=985 Win=853 Len=0 TSval=354546 TSecr=118915156
160 0.488091490 172.31.31.144 -> 172.31.24.227 TCP 66 6633 → 39462 [ACK] Seq=1 Ack=739 Win=853 Len=0 TSval=354546 TSecr=118915155
161 0.567578356 172.31.31.144 -> 172.31.24.227 OpenFlow 187 Type: OFPT_PACKET_OUT
162 0.567620626 172.31.31.144 -> 172.31.24.227 OpenFlow 187 Type: OFPT_PACKET_OUT
163 0.567627545 172.31.31.144 -> 172.31.24.227 OpenFlow 187 Type: OFPT_PACKET_OUT
164 0.567667818 172.31.31.144 -> 172.31.24.227 OpenFlow 187 Type: OFPT_PACKET_OUT
165 0.567741660 172.31.31.144 -> 172.31.24.227 OpenFlow 187 Type: OFPT_PACKET_OUT
166 0.567751267 172.31.24.227 -> 172.31.31.144 TCP 66 39472 → 6633 [ACK] Seq=247 Ack=606 Win=63 Len=0 TSval=118915175 TSecr=354566
167 0.567800778 172.31.31.144 -> 172.31.24.227 OpenFlow 187 Type: OFPT_PACKET_OUT
168 0.567860409 172.31.31.144 -> 172.31.24.227 OpenFlow 187 Type: OFPT_PACKET_OUT
169 0.567916854 172.31.31.144 -> 172.31.24.227 OpenFlow 187 Type: OFPT_PACKET_OUT
170 0.567981457 172.31.31.144 -> 172.31.24.227 OpenFlow 187 Type: OFPT_PACKET_OUT
171 0.568034555 172.31.31.144 -> 172.31.24.227 OpenFlow 187 Type: OFPT_PACKET_OUT
172 0.568085281 172.31.31.144 -> 172.31.24.227 OpenFlow 187 Type: OFPT_PACKET_OUT
173 0.568139724 172.31.31.144 -> 172.31.24.227 OpenFlow 187 Type: OFPT_PACKET_OUT
174 0.568199034 172.31.31.144 -> 172.31.24.227 OpenFlow 187 Type: OFPT_PACKET_OUT
175 0.568205250 172.31.24.227 -> 172.31.31.144 TCP 66 39492 → 6633 [ACK] Seq=739 Ack=606 Win=68 Len=0 TSval=118915176 TSecr=354566
176 0.568276676 172.31.31.144 -> 172.31.24.227 OpenFlow 187 Type: OFPT_PACKET_OUT
177 0.568296209 172.31.24.227 -> 172.31.31.144 TCP 66 39472 → 6633 [ACK] Seq=247 Ack=969 Win=63 Len=0 TSval=118915176 TSecr=354566
178 0.568339770 172.31.31.144 -> 172.31.24.227 OpenFlow 187 Type: OFPT_PACKET_OUT
179 0.568367767 172.31.31.144 -> 172.31.24.227 OpenFlow 187 Type: OFPT_PACKET_OUT
180 0.568388428 172.31.24.227 -> 172.31.31.144 OpenFlow 189 Type: OFPT_PACKET_IN
181 0.568407869 172.31.24.227 -> 172.31.31.144 OpenFlow 189 Type: OFPT_PACKET_IN
182 0.568440629 172.31.24.227 -> 172.31.31.144 OpenFlow 189 Type: OFPT_PACKET_IN
183 0.568468373 172.31.31.144 -> 172.31.24.227 OpenFlow 187 Type: OFPT_PACKET_OUT
184 0.568473764 172.31.24.227 -> 172.31.31.144 OpenFlow 189 Type: OFPT_PACKET_IN
185 0.568495461 172.31.31.144 -> 172.31.24.227 OpenFlow 187 Type: OFPT_PACKET_OUT
186 0.568498936 172.31.24.227 -> 172.31.31.144 TCP 66 39492 → 6633 [ACK] Seq=739 Ack=1211 Win=68 Len=0 TSval=118915176 TSecr=354566
187 0.568508710 172.31.24.227 -> 172.31.31.144 OpenFlow 189 Type: OFPT_PACKET_IN
188 0.568543719 172.31.24.227 -> 172.31.31.144 OpenFlow 189 Type: OFPT_PACKET_IN
189 0.568589193 172.31.31.144 -> 172.31.24.227 TCP 66 6633 → 39474 [ACK] Seq=1 Ack=124 Win=853 Len=0 TSval=354566 TSecr=118915176
190 0.568595755 172.31.31.144 -> 172.31.24.227 TCP 66 6633 → 39474 [ACK] Seq=1 Ack=247 Win=853 Len=0 TSval=354566 TSecr=118915176
191 0.568616206 172.31.31.144 -> 172.31.24.227 TCP 187 6633 → 39460 [PSH, ACK] Seq=1 Ack=1 Win=853 Len=121 TSval=354566 TSecr=118914793
192 0.568635923 172.31.31.144 -> 172.31.24.227 TCP 66 6633 → 39482 [ACK] Seq=1 Ack=124 Win=853 Len=0 TSval=354566 TSecr=118915176
193 0.568658130 172.31.31.144 -> 172.31.24.227 TCP 187 6633 → 39460 [PSH, ACK] Seq=122 Ack=1 Win=853 Len=121 TSval=354566 TSecr=118914793
194 0.568678433 172.31.31.144 -> 172.31.24.227 TCP 66 6633 → 39482 [ACK] Seq=1 Ack=247 Win=853 Len=0 TSval=354566 TSecr=118915176
195 0.568699604 172.31.31.144 -> 172.31.24.227 TCP 187 6633 → 39460 [PSH, ACK] Seq=243 Ack=1 Win=853 Len=121 TSval=354566 TSecr=118914793
196 0.568727578 172.31.31.144 -> 172.31.24.227 TCP 66 6633 → 39486 [ACK] Seq=969 Ack=124 Win=853 Len=0 TSval=354566 TSecr=118915176
197 0.568741614 172.31.31.144 -> 172.31.24.227 TCP 66 6633 → 39486 [ACK] Seq=969 Ack=247 Win=853 Len=0 TSval=354566 TSecr=118915176
198 0.568763016 172.31.31.144 -> 172.31.24.227 TCP 187 6633 → 39460 [PSH, ACK] Seq=364 Ack=1 Win=853 Len=121 TSval=354566 TSecr=118914793
199 0.568823448 172.31.31.144 -> 172.31.24.227 TCP 187 6633 → 39460 [PSH, ACK] Seq=485 Ack=1 Win=853 Len=121 TSval=354566 TSecr=118914793
200 0.568878413 172.31.31.144 -> 172.31.24.227 TCP 187 6633 → 39460 [PSH, ACK] Seq=606 Ack=1 Win=853 Len=121 TSval=354566 TSecr=118914793
201 0.568884562 172.31.24.227 -> 172.31.31.144 TCP 66 39460 → 6633 [ACK] Seq=1 Ack=727 Win=65 Len=0 TSval=118915176 TSecr=354566
202 0.568940855 172.31.31.144 -> 172.31.24.227 TCP 187 6633 → 39460 [PSH, ACK] Seq=727 Ack=1 Win=853 Len=121 TSval=354566 TSecr=118914793
203 0.568997350 172.31.31.144 -> 172.31.24.227 TCP 187 6633 → 39460 [PSH, ACK] Seq=848 Ack=1 Win=853 Len=121 TSval=354566 TSecr=118914793
204 0.569081649 172.31.31.144 -> 172.31.24.227 TCP 187 6633 → 39488 [PSH, ACK] Seq=1 Ack=1 Win=853 Len=121 TSval=354566 TSecr=118914790
205 0.569137198 172.31.31.144 -> 172.31.24.227 TCP 187 6633 → 39488 [PSH, ACK] Seq=122 Ack=1 Win=853 Len=121 TSval=354566 TSecr=118914790
206 0.569197009 172.31.31.144 -> 172.31.24.227 TCP 187 6633 → 39488 [PSH, ACK] Seq=243 Ack=1 Win=853 Len=121 TSval=354566 TSecr=118914790
207 0.569253174 172.31.31.144 -> 172.31.24.227 TCP 187 6633 → 39488 [PSH, ACK] Seq=364 Ack=1 Win=853 Len=121 TSval=354566 TSecr=118914790
208 0.569283842 172.31.24.227 -> 172.31.31.144 OpenFlow 189 Type: OFPT_PACKET_IN
209 0.569315950 172.31.24.227 -> 172.31.31.144 OpenFlow 189 Type: OFPT_PACKET_IN
210 0.569342416 172.31.31.144 -> 172.31.24.227 TCP 187 6633 → 39488 [PSH, ACK] Seq=485 Ack=1 Win=853 Len=121 TSval=354566 TSecr=118914790
211 0.569346828 172.31.24.227 -> 172.31.31.144 TCP 66 39488 → 6633 [ACK] Seq=1 Ack=606 Win=59 Len=0 TSval=118915176 TSecr=354566
212 0.569390439 172.31.31.144 -> 172.31.24.227 TCP 187 6633 → 39488 [PSH, ACK] Seq=606 Ack=1 Win=853 Len=121 TSval=354566 TSecr=118914790
213 0.569446562 172.31.31.144 -> 172.31.24.227 TCP 187 6633 → 39488 [PSH, ACK] Seq=727 Ack=1 Win=853 Len=121 TSval=354566 TSecr=118914790
214 0.569489056 172.31.31.144 -> 172.31.24.227 TCP 66 6633 → 39450 [ACK] Seq=1 Ack=862 Win=853 Len=0 TSval=354566 TSecr=118915176
215 0.569510475 172.31.31.144 -> 172.31.24.227 TCP 66 6633 → 39450 [ACK] Seq=1 Ack=985 Win=853 Len=0 TSval=354566 TSecr=118915176
216 0.569537214 172.31.31.144 -> 172.31.24.227 TCP 187 6633 → 39488 [PSH, ACK] Seq=848 Ack=1 Win=853 Len=121 TSval=354566 TSecr=118914790
217 0.569578707 172.31.31.144 -> 172.31.24.227 OpenFlow 187 Type: OFPT_PACKET_OUT
218 0.569640051 172.31.31.144 -> 172.31.24.227 OpenFlow 187 Type: OFPT_PACKET_OUT
219 0.569694853 172.31.31.144 -> 172.31.24.227 OpenFlow 187 Type: OFPT_PACKET_OUT
220 0.569705811 172.31.24.227 -> 172.31.31.144 TCP 66 39460 → 6633 [ACK] Seq=1 Ack=969 Win=65 Len=0 TSval=118915176 TSecr=354566
221 0.569748784 172.31.31.144 -> 172.31.24.227 OpenFlow 187 Type: OFPT_PACKET_OUT
222 0.569782797 172.31.24.227 -> 172.31.31.144 OpenFlow 189 Type: OFPT_PACKET_IN
223 0.569801248 172.31.31.144 -> 172.31.24.227 OpenFlow 187 Type: OFPT_PACKET_OUT
224 0.569806698 172.31.24.227 -> 172.31.31.144 OpenFlow 189 Type: OFPT_PACKET_IN
225 0.569827764 172.31.24.227 -> 172.31.31.144 OpenFlow 189 Type: OFPT_PACKET_IN
226 0.569843635 172.31.24.227 -> 172.31.31.144 OpenFlow 189 Type: OFPT_PACKET_IN
227 0.569851107 172.31.24.227 -> 172.31.31.144 OpenFlow 189 Type: OFPT_PACKET_IN
228 0.569871791 172.31.31.144 -> 172.31.24.227 OpenFlow 187 Type: OFPT_PACKET_OUT
229 0.569905417 172.31.24.227 -> 172.31.31.144 OpenFlow 189 Type: OFPT_PACKET_IN
230 0.569961106 172.31.31.144 -> 172.31.24.227 TCP 66 6633 → 39462 [ACK] Seq=1 Ack=862 Win=853 Len=0 TSval=354566 TSecr=118915176
231 0.569991821 172.31.31.144 -> 172.31.24.227 TCP 66 6633 → 39462 [ACK] Seq=1 Ack=985 Win=853 Len=0 TSval=354566 TSecr=118915176
232 0.570009554 172.31.31.144 -> 172.31.24.227 OpenFlow 187 Type: OFPT_PACKET_OUT
233 0.570014302 172.31.24.227 -> 172.31.31.144 TCP 66 39474 → 6633 [ACK] Seq=247 Ack=848 Win=183 Len=0 TSval=118915176 TSecr=354566
234 0.570071655 172.31.31.144 -> 172.31.24.227 OpenFlow 187 Type: OFPT_PACKET_OUT
235 0.570084086 172.31.31.144 -> 172.31.24.227 TCP 66 6633 → 39468 [ACK] Seq=1695 Ack=124 Win=853 Len=0 TSval=354566 TSecr=118915176
236 0.570113278 172.31.31.144 -> 172.31.24.227 TCP 66 6633 → 39466 [ACK] Seq=2179 Ack=247 Win=853 Len=0 TSval=354566 TSecr=118915176
237 0.570131206 172.31.31.144 -> 172.31.24.227 TCP 66 6633 → 39468 [ACK] Seq=1695 Ack=247 Win=853 Len=0 TSval=354566 TSecr=118915176
238 0.570166245 172.31.31.144 -> 172.31.24.227 OpenFlow 187 Type: OFPT_PACKET_OUT
239 0.570229995 172.31.31.144 -> 172.31.24.227 OpenFlow 187 Type: OFPT_PACKET_OUT
240 0.570263897 172.31.31.144 -> 172.31.24.227 OpenFlow 187 Type: OFPT_PACKET_OUT
241 0.570337511 172.31.31.144 -> 172.31.24.227 OpenFlow 187 Type: OFPT_PACKET_OUT
242 0.570397628 172.31.31.144 -> 172.31.24.227 OpenFlow 187 Type: OFPT_PACKET_OUT
243 0.570489551 172.31.31.144 -> 172.31.24.227 OpenFlow 187 Type: OFPT_PACKET_OUT
244 0.570499812 172.31.24.227 -> 172.31.31.144 TCP 66 39474 → 6633 [ACK] Seq=247 Ack=1695 Win=182 Len=0 TSval=118915176 TSecr=354566
245 0.570646643 172.31.24.227 -> 172.31.31.144 OpenFlow 189 Type: OFPT_PACKET_IN
246 0.570669468 172.31.24.227 -> 172.31.31.144 OpenFlow 189 Type: OFPT_PACKET_IN
247 0.570676263 172.31.24.227 -> 172.31.31.144 OpenFlow 189 Type: OFPT_PACKET_IN
248 0.570702750 172.31.24.227 -> 172.31.31.144 OpenFlow 189 Type: OFPT_PACKET_IN
249 0.570739206 172.31.24.227 -> 172.31.31.144 OpenFlow 681 Type: OFPT_PACKET_IN
250 0.570744910 172.31.24.227 -> 172.31.31.144 OpenFlow 189 Type: OFPT_PACKET_IN
251 0.570839155 172.31.31.144 -> 172.31.24.227 TCP 66 6633 → 39480 [ACK] Seq=1453 Ack=124 Win=853 Len=0 TSval=354566 TSecr=118915176
252 0.570856891 172.31.31.144 -> 172.31.24.227 TCP 66 6633 → 39480 [ACK] Seq=1453 Ack=247 Win=853 Len=0 TSval=354566 TSecr=118915176
253 0.570877520 172.31.31.144 -> 172.31.24.227 TCP 66 6633 → 39482 [ACK] Seq=1 Ack=370 Win=853 Len=0 TSval=354566 TSecr=118915176
254 0.570927112 172.31.31.144 -> 172.31.24.227 TCP 66 6633 → 39482 [ACK] Seq=1 Ack=985 Win=853 Len=0 TSval=354566 TSecr=118915176
255 0.570946518 172.31.31.144 -> 172.31.24.227 TCP 66 6633 → 39488 [ACK] Seq=969 Ack=124 Win=853 Len=0 TSval=354566 TSecr=118915176
256 0.570973733 172.31.31.144 -> 172.31.24.227 TCP 66 6633 → 39488 [ACK] Seq=969 Ack=247 Win=853 Len=0 TSval=354566 TSecr=118915176
257 0.571126620 172.31.24.227 -> 172.31.31.144 OpenFlow 189 Type: OFPT_PACKET_IN
258 0.571147083 172.31.24.227 -> 172.31.31.144 OpenFlow 558 Type: OFPT_PACKET_IN
259 0.571171596 172.31.24.227 -> 172.31.31.144 OpenFlow 189 Type: OFPT_PACKET_IN
260 0.571182988 172.31.24.227 -> 172.31.31.144 OpenFlow 189 Type: OFPT_PACKET_IN
261 0.571205770 172.31.24.227 -> 172.31.31.144 OpenFlow 189 Type: OFPT_PACKET_IN
262 0.571239525 172.31.24.227 -> 172.31.31.144 OpenFlow 435 Type: OFPT_PACKET_IN
263 0.571243910 172.31.24.227 -> 172.31.31.144 OpenFlow 435 Type: OFPT_PACKET_IN
264 0.571258660 172.31.24.227 -> 172.31.31.144 OpenFlow 189 Type: OFPT_PACKET_IN
265 0.571274214 172.31.24.227 -> 172.31.31.144 OpenFlow 189 Type: OFPT_PACKET_IN
266 0.571309379 172.31.24.227 -> 172.31.31.144 OpenFlow 189 Type: OFPT_PACKET_IN
267 0.571358081 172.31.31.144 -> 172.31.24.227 TCP 66 6633 → 39446 [ACK] Seq=1 Ack=1108 Win=853 Len=0 TSval=354566 TSecr=118915176
268 0.571363781 172.31.31.144 -> 172.31.24.227 TCP 66 6633 → 39446 [ACK] Seq=1 Ack=1600 Win=853 Len=0 TSval=354566 TSecr=118915176
269 0.571365626 172.31.31.144 -> 172.31.24.227 TCP 66 6633 → 39452 [ACK] Seq=1 Ack=862 Win=853 Len=0 TSval=354567 TSecr=118915176
270 0.571371281 172.31.24.227 -> 172.31.31.144 OpenFlow 189 Type: OFPT_PACKET_IN
271 0.571390343 172.31.31.144 -> 172.31.24.227 TCP 66 6633 → 39446 [ACK] Seq=1 Ack=1723 Win=853 Len=0 TSval=354567 TSecr=118915176
272 0.571414875 172.31.31.144 -> 172.31.24.227 TCP 66 6633 → 39458 [ACK] Seq=1 Ack=1354 Win=853 Len=0 TSval=354567 TSecr=118915176
273 0.571436699 172.31.31.144 -> 172.31.24.227 TCP 66 6633 → 39452 [ACK] Seq=1 Ack=1231 Win=853 Len=0 TSval=354567 TSecr=118915176
274 0.571451982 172.31.31.144 -> 172.31.24.227 TCP 66 6633 → 39458 [ACK] Seq=1 Ack=1723 Win=853 Len=0 TSval=354567 TSecr=118915176
275 0.571537843 172.31.31.144 -> 172.31.24.227 TCP 66 6633 → 39472 [ACK] Seq=969 Ack=493 Win=853 Len=0 TSval=354567 TSecr=118915176
276 0.571716905 172.31.31.144 -> 172.31.24.227 TCP 66 6633 → 39474 [ACK] Seq=1695 Ack=493 Win=853 Len=0 TSval=354567 TSecr=118915176
277 0.666873380 172.31.31.144 -> 172.31.24.227 OpenFlow 187 Type: OFPT_PACKET_OUT
278 0.666896371 172.31.31.144 -> 172.31.24.227 OpenFlow 187 Type: OFPT_PACKET_OUT
279 0.666913418 172.31.31.144 -> 172.31.24.227 OpenFlow 187 Type: OFPT_PACKET_OUT
280 0.666967601 172.31.31.144 -> 172.31.24.227 OpenFlow 187 Type: OFPT_PACKET_OUT
281 0.667028736 172.31.31.144 -> 172.31.24.227 OpenFlow 187 Type: OFPT_PACKET_OUT
282 0.667088138 172.31.31.144 -> 172.31.24.227 OpenFlow 187 Type: OFPT_PACKET_OUT
283 0.667209266 172.31.31.144 -> 172.31.24.227 OpenFlow 187 Type: OFPT_PACKET_OUT
284 0.667218801 172.31.24.227 -> 172.31.31.144 TCP 66 39470 → 6633 [ACK] Seq=739 Ack=848 Win=82 Len=0 TSval=118915200 TSecr=354590
285 0.667227080 172.31.31.144 -> 172.31.24.227 OpenFlow 187 Type: OFPT_PACKET_OUT
286 0.667286538 172.31.31.144 -> 172.31.24.227 OpenFlow 187 Type: OFPT_PACKET_OUT
287 0.667334416 172.31.31.144 -> 172.31.24.227 OpenFlow 187 Type: OFPT_PACKET_OUT
288 0.667429779 172.31.31.144 -> 172.31.24.227 OpenFlow 187 Type: OFPT_PACKET_OUT
289 0.667523998 172.31.31.144 -> 172.31.24.227 OpenFlow 187 Type: OFPT_PACKET_OUT
290 0.667597337 172.31.31.144 -> 172.31.24.227 OpenFlow 187 Type: OFPT_PACKET_OUT
291 0.667623163 172.31.31.144 -> 172.31.24.227 OpenFlow 187 Type: OFPT_PACKET_OUT
292 0.667640671 172.31.24.227 -> 172.31.31.144 TCP 66 39470 → 6633 [ACK] Seq=739 Ack=1211 Win=82 Len=0 TSval=118915200 TSecr=354590
293 0.667708655 172.31.31.144 -> 172.31.24.227 OpenFlow 187 Type: OFPT_PACKET_OUT
294 0.667714956 172.31.24.227 -> 172.31.31.144 TCP 66 39458 → 6633 [ACK] Seq=1723 Ack=606 Win=68 Len=0 TSval=118915200 TSecr=354591
295 0.667757431 172.31.31.144 -> 172.31.24.227 OpenFlow 187 Type: OFPT_PACKET_OUT
296 0.667765090 172.31.24.227 -> 172.31.31.144 OpenFlow 189 Type: OFPT_PACKET_IN
297 0.667785820 172.31.24.227 -> 172.31.31.144 OpenFlow 189 Type: OFPT_PACKET_IN
298 0.667819734 172.31.31.144 -> 172.31.24.227 OpenFlow 187 Type: OFPT_PACKET_OUT
299 0.667895707 172.31.31.144 -> 172.31.24.227 OpenFlow 187 Type: OFPT_PACKET_OUT
300 0.667937739 172.31.31.144 -> 172.31.24.227 OpenFlow 187 Type: OFPT_PACKET_OUT
301 0.667957860 172.31.31.144 -> 172.31.24.227 TCP 66 6633 → 39476 [ACK] Seq=1 Ack=370 Win=853 Len=0 TSval=354591 TSecr=118915200
302 0.667978547 172.31.31.144 -> 172.31.24.227 TCP 66 6633 → 39476 [ACK] Seq=1 Ack=493 Win=853 Len=0 TSval=354591 TSecr=118915200
303 0.667998866 172.31.31.144 -> 172.31.24.227 OpenFlow 187 Type: OFPT_PACKET_OUT
304 0.668003257 172.31.24.227 -> 172.31.31.144 TCP 66 39458 → 6633 [ACK] Seq=1723 Ack=1211 Win=68 Len=0 TSval=118915201 TSecr=354591
305 0.668086999 172.31.31.144 -> 172.31.24.227 OpenFlow 187 Type: OFPT_PACKET_OUT
306 0.668144248 172.31.31.144 -> 172.31.24.227 OpenFlow 187 Type: OFPT_PACKET_OUT
307 0.668172726 172.31.31.144 -> 172.31.24.227 OpenFlow 187 Type: OFPT_PACKET_OUT
308 0.668292296 172.31.31.144 -> 172.31.24.227 OpenFlow 187 Type: OFPT_PACKET_OUT
309 0.668360369 172.31.31.144 -> 172.31.24.227 OpenFlow 187 Type: OFPT_PACKET_OUT
310 0.668366039 172.31.24.227 -> 172.31.31.144 TCP 66 39458 → 6633 [ACK] Seq=1723 Ack=1816 Win=68 Len=0 TSval=118915201 TSecr=354591
311 0.668430894 172.31.31.144 -> 172.31.24.227 OpenFlow 187 Type: OFPT_PACKET_OUT
312 0.668479888 172.31.31.144 -> 172.31.24.227 OpenFlow 187 Type: OFPT_PACKET_OUT
313 0.668548766 172.31.31.144 -> 172.31.24.227 OpenFlow 187 Type: OFPT_PACKET_OUT
314 0.668612195 172.31.31.144 -> 172.31.24.227 OpenFlow 187 Type: OFPT_PACKET_OUT
315 0.668653853 172.31.31.144 -> 172.31.24.227 OpenFlow 187 Type: OFPT_PACKET_OUT
316 0.668659035 172.31.24.227 -> 172.31.31.144 TCP 66 39458 → 6633 [ACK] Seq=1723 Ack=2421 Win=68 Len=0 TSval=118915201 TSecr=354591
317 0.668753957 172.31.31.144 -> 172.31.24.227 TCP 187 6633 → 39454 [PSH, ACK] Seq=1 Ack=1 Win=853 Len=121 TSval=354591 TSecr=118914786
318 0.668801426 172.31.31.144 -> 172.31.24.227 TCP 187 6633 → 39454 [PSH, ACK] Seq=122 Ack=1 Win=853 Len=121 TSval=354591 TSecr=118914786
319 0.668856472 172.31.24.227 -> 41.177.127.217 SSH 90 Server: Encrypted packet (len=36)
320 0.668874520 172.31.31.144 -> 172.31.24.227 TCP 187 6633 → 39454 [PSH, ACK] Seq=243 Ack=1 Win=853 Len=121 TSval=354591 TSecr=118914786
321 0.668922153 172.31.31.144 -> 172.31.24.227 TCP 187 6633 → 39454 [PSH, ACK] Seq=364 Ack=1 Win=853 Len=121 TSval=354591 TSecr=118914786
322 0.668970602 172.31.31.144 -> 172.31.24.227 TCP 187 6633 → 39454 [PSH, ACK] Seq=485 Ack=1 Win=853 Len=121 TSval=354591 TSecr=118914786
323 0.668976305 172.31.24.227 -> 172.31.31.144 TCP 66 39454 → 6633 [ACK] Seq=1 Ack=606 Win=55 Len=0 TSval=118915201 TSecr=354591
324 0.669027915 172.31.31.144 -> 172.31.24.227 TCP 187 6633 → 39454 [PSH, ACK] Seq=606 Ack=1 Win=853 Len=121 TSval=354591 TSecr=118914786
325 0.669084341 172.31.31.144 -> 172.31.24.227 TCP 187 6633 → 39454 [PSH, ACK] Seq=727 Ack=1 Win=853 Len=121 TSval=354591 TSecr=118914786
326 0.669155653 172.31.31.144 -> 172.31.24.227 TCP 187 6633 → 39454 [PSH, ACK] Seq=848 Ack=1 Win=853 Len=121 TSval=354591 TSecr=118915201
327 0.669233505 172.31.31.144 -> 172.31.24.227 TCP 187 6633 → 39454 [PSH, ACK] Seq=969 Ack=1 Win=853 Len=121 TSval=354591 TSecr=118915201
328 0.669259093 172.31.31.144 -> 172.31.24.227 TCP 187 6633 → 39454 [PSH, ACK] Seq=1090 Ack=1 Win=853 Len=121 TSval=354591 TSecr=118915201
329 0.669263636 172.31.24.227 -> 172.31.31.144 TCP 66 39454 → 6633 [ACK] Seq=1 Ack=1211 Win=55 Len=0 TSval=118915201 TSecr=354591
330 0.669345434 172.31.31.144 -> 172.31.24.227 TCP 187 6633 → 39454 [PSH, ACK] Seq=1211 Ack=1 Win=853 Len=121 TSval=354591 TSecr=118915201
331 0.669388406 172.31.31.144 -> 172.31.24.227 TCP 187 6633 → 39454 [PSH, ACK] Seq=1332 Ack=1 Win=853 Len=121 TSval=354591 TSecr=118915201
332 0.669444100 172.31.24.227 -> 172.31.31.144 OpenFlow 189 Type: OFPT_PACKET_IN
333 0.669475607 172.31.24.227 -> 172.31.31.144 OpenFlow 435 Type: OFPT_PACKET_IN
334 0.669499425 172.31.31.144 -> 172.31.24.227 OpenFlow 187 Type: OFPT_PACKET_OUT
335 0.669505707 172.31.24.227 -> 172.31.31.144 OpenFlow 189 Type: OFPT_PACKET_IN
336 0.669525657 172.31.31.144 -> 172.31.24.227 OpenFlow 187 Type: OFPT_PACKET_OUT
337 0.669530196 172.31.24.227 -> 172.31.31.144 OpenFlow 681 Type: OFPT_PACKET_IN
338 0.669551312 172.31.24.227 -> 172.31.31.144 OpenFlow 558 Type: OFPT_PACKET_IN
339 0.669562128 172.31.24.227 -> 172.31.31.144 OpenFlow 189 Type: OFPT_PACKET_IN
340 0.669601108 172.31.24.227 -> 172.31.31.144 OpenFlow 189 Type: OFPT_PACKET_IN
341 0.669621489 172.31.31.144 -> 172.31.24.227 OpenFlow 187 Type: OFPT_PACKET_OUT
342 0.669699915 172.31.31.144 -> 172.31.24.227 OpenFlow 187 Type: OFPT_PACKET_OUT
343 0.669704687 172.31.31.144 -> 172.31.24.227 TCP 66 6633 → 39460 [ACK] Seq=969 Ack=124 Win=853 Len=0 TSval=354591 TSecr=118915201
344 0.669707932 172.31.31.144 -> 172.31.24.227 TCP 66 6633 → 39460 [ACK] Seq=969 Ack=493 Win=853 Len=0 TSval=354591 TSecr=118915201
345 0.669717993 172.31.31.144 -> 172.31.24.227 TCP 66 6633 → 39466 [ACK] Seq=2179 Ack=985 Win=853 Len=0 TSval=354591 TSecr=118915201
346 0.669738393 172.31.31.144 -> 172.31.24.227 OpenFlow 187 Type: OFPT_PACKET_OUT
347 0.669755298 172.31.24.227 -> 172.31.31.144 TCP 66 39476 → 6633 [ACK] Seq=493 Ack=606 Win=76 Len=0 TSval=118915201 TSecr=354591
348 0.669763358 172.31.31.144 -> 172.31.24.227 TCP 66 6633 → 39468 [ACK] Seq=1695 Ack=370 Win=853 Len=0 TSval=354591 TSecr=118915201
349 0.669775294 172.31.31.144 -> 172.31.24.227 OpenFlow 187 Type: OFPT_PACKET_OUT
350 0.669804276 172.31.31.144 -> 172.31.24.227 TCP 66 6633 → 39468 [ACK] Seq=1695 Ack=493 Win=853 Len=0 TSval=354591 TSecr=118915201
351 0.669827598 172.31.31.144 -> 172.31.24.227 OpenFlow 187 Type: OFPT_PACKET_OUT
352 0.669883134 172.31.31.144 -> 172.31.24.227 OpenFlow 187 Type: OFPT_PACKET_OUT
353 0.669925830 172.31.24.227 -> 172.31.31.144 OpenFlow 189 Type: OFPT_PACKET_IN
354 0.669953486 172.31.24.227 -> 172.31.31.144 OpenFlow 189 Type: OFPT_PACKET_IN
355 0.669978412 172.31.31.144 -> 172.31.24.227 OpenFlow 187 Type: OFPT_PACKET_OUT
356 0.670074488 172.31.31.144 -> 172.31.24.227 OpenFlow 187 Type: OFPT_PACKET_OUT
357 0.670127538 172.31.31.144 -> 172.31.24.227 TCP 66 6633 → 39490 [ACK] Seq=1211 Ack=124 Win=853 Len=0 TSval=354591 TSecr=118915201
