  1 0.000000000 137.158.125.247 -> 172.31.23.72 TCP 54 52508 → 22 [ACK] Seq=1 Ack=1 Win=32434 Len=0
  2 0.109739439 137.158.125.247 -> 172.31.23.72 TCP 54 52508 → 22 [ACK] Seq=1 Ack=61 Win=32404 Len=0
  3 0.311943541 172.31.31.144 -> 172.31.23.72 TCP 82 6633 → 40188 [PSH, ACK] Seq=1 Ack=1 Win=853 Len=16 TSval=682669 TSecr=775340
  4 0.311978101 172.31.31.144 -> 172.31.23.72 TCP 146 6633 → 40188 [PSH, ACK] Seq=17 Ack=1 Win=853 Len=80 TSval=682669 TSecr=775340
  5 0.311996496 172.31.31.144 -> 172.31.23.72 TCP 122 6633 → 40192 [PSH, ACK] Seq=1 Ack=1 Win=853 Len=56 TSval=682669 TSecr=775339
  6 0.312015109 172.31.31.144 -> 172.31.23.72 TCP 106 6633 → 40192 [PSH, ACK] Seq=57 Ack=1 Win=853 Len=40 TSval=682669 TSecr=775339
  7 0.312350628 172.31.23.72 -> 172.31.31.144 OpenFlow 6178 Type: OFPT_MULTIPART_REPLY, OFPMP_TABLE
  8 0.312476525 172.31.23.72 -> 172.31.31.144 OpenFlow 754 Type: OFPT_MULTIPART_REPLY, OFPMP_PORT_STATS
  9 0.312544395 172.31.23.72 -> 172.31.31.144 OpenFlow 2010 Type: OFPT_MULTIPART_REPLY, OFPMP_FLOW
 10 0.312623729 172.31.31.144 -> 172.31.23.72 TCP 66 6633 → 40188 [ACK] Seq=97 Ack=6113 Win=853 Len=0 TSval=682670 TSecr=775508
 11 0.312647455 172.31.23.72 -> 172.31.31.144 OpenFlow 3050 Type: OFPT_MULTIPART_REPLY, OFPMP_FLOW
 12 0.312676230 172.31.31.144 -> 172.31.23.72 TCP 66 6633 → 40188 [ACK] Seq=97 Ack=6801 Win=853 Len=0 TSval=682670 TSecr=775508
 13 0.312780674 172.31.31.144 -> 172.31.23.72 TCP 66 6633 → 40188 [ACK] Seq=97 Ack=8745 Win=853 Len=0 TSval=682670 TSecr=775508
 14 0.312805285 172.31.23.72 -> 172.31.31.144 OpenFlow 6178 Type: OFPT_MULTIPART_REPLY, OFPMP_TABLE
 15 0.312888474 172.31.31.144 -> 172.31.23.72 TCP 66 6633 → 40192 [ACK] Seq=97 Ack=2985 Win=853 Len=0 TSval=682670 TSecr=775508
 16 0.312897638 172.31.23.72 -> 172.31.31.144 OpenFlow 642 Type: OFPT_MULTIPART_REPLY, OFPMP_PORT_STATS
 17 0.313024530 172.31.31.144 -> 172.31.23.72 TCP 66 6633 → 40192 [ACK] Seq=97 Ack=9097 Win=853 Len=0 TSval=682670 TSecr=775508
 18 0.313087376 172.31.31.144 -> 172.31.23.72 TCP 66 6633 → 40192 [ACK] Seq=97 Ack=9673 Win=853 Len=0 TSval=682670 TSecr=775508
 19 0.314165974 172.31.31.144 -> 172.31.23.72 TCP 90 6633 → 40204 [PSH, ACK] Seq=1 Ack=1 Win=853 Len=24 TSval=682670 TSecr=775339
 20 0.314390276 172.31.23.72 -> 172.31.31.144 OpenFlow 642 Type: OFPT_MULTIPART_REPLY, OFPMP_PORT_STATS
 21 0.314594938 172.31.31.144 -> 172.31.23.72 TCP 66 6633 → 40204 [ACK] Seq=25 Ack=577 Win=853 Len=0 TSval=682670 TSecr=775509
 22 0.315203354 172.31.31.144 -> 172.31.23.72 OpenFlow 122 Type: OFPT_MULTIPART_REQUEST, OFPMP_FLOW
 23 0.315207223 172.31.31.144 -> 172.31.23.72 OpenFlow 82 Type: OFPT_MULTIPART_REQUEST, OFPMP_TABLE
 24 0.315351430 172.31.23.72 -> 172.31.31.144 OpenFlow 554 Type: OFPT_MULTIPART_REPLY, OFPMP_FLOW
 25 0.315494930 172.31.23.72 -> 172.31.31.144 OpenFlow 6178 Type: OFPT_MULTIPART_REPLY, OFPMP_TABLE
 26 0.315804533 172.31.31.144 -> 172.31.23.72 TCP 66 6633 → 40204 [ACK] Seq=97 Ack=7177 Win=853 Len=0 TSval=682670 TSecr=775509
 27 0.321565484 172.31.31.144 -> 172.31.23.72 TCP 90 6633 → 40190 [PSH, ACK] Seq=1 Ack=1 Win=853 Len=24 TSval=682672 TSecr=775340
 28 0.321596976 172.31.31.144 -> 172.31.23.72 TCP 138 6633 → 40190 [PSH, ACK] Seq=25 Ack=1 Win=853 Len=72 TSval=682672 TSecr=775340
 29 0.321635600 172.31.31.144 -> 172.31.23.72 TCP 122 6633 → 40194 [PSH, ACK] Seq=1 Ack=1 Win=853 Len=56 TSval=682672 TSecr=775314
 30 0.321672485 172.31.31.144 -> 172.31.23.72 TCP 106 6633 → 40194 [PSH, ACK] Seq=57 Ack=1 Win=853 Len=40 TSval=682672 TSecr=775314
 31 0.321934116 172.31.23.72 -> 172.31.31.144 OpenFlow 530 Type: OFPT_MULTIPART_REPLY, OFPMP_PORT_STATS
 32 0.322105212 172.31.23.72 -> 172.31.31.144 OpenFlow 6178 Type: OFPT_MULTIPART_REPLY, OFPMP_TABLE
 33 0.322136150 172.31.31.144 -> 172.31.23.72 TCP 66 6633 → 40190 [ACK] Seq=97 Ack=465 Win=853 Len=0 TSval=682672 TSecr=775511
 34 0.322183860 172.31.23.72 -> 172.31.31.144 OpenFlow 2634 Type: OFPT_MULTIPART_REPLY, OFPMP_FLOW
 35 0.322241898 172.31.23.72 -> 172.31.31.144 OpenFlow 1178 Type: OFPT_MULTIPART_REPLY, OFPMP_FLOW
 36 0.322346711 172.31.31.144 -> 172.31.23.72 TCP 66 6633 → 40190 [ACK] Seq=97 Ack=6577 Win=853 Len=0 TSval=682672 TSecr=775511
 37 0.322372887 172.31.31.144 -> 172.31.23.72 TCP 66 6633 → 40190 [ACK] Seq=97 Ack=9145 Win=853 Len=0 TSval=682672 TSecr=775511
 38 0.322409804 172.31.23.72 -> 172.31.31.144 OpenFlow 6178 Type: OFPT_MULTIPART_REPLY, OFPMP_TABLE
 39 0.322480650 172.31.23.72 -> 172.31.31.144 OpenFlow 530 Type: OFPT_MULTIPART_REPLY, OFPMP_PORT_STATS
 40 0.322634161 172.31.31.144 -> 172.31.23.72 TCP 66 6633 → 40194 [ACK] Seq=97 Ack=7689 Win=853 Len=0 TSval=682672 TSecr=775511
 41 0.322799202 172.31.31.144 -> 172.31.23.72 TCP 122 6633 → 40212 [PSH, ACK] Seq=1 Ack=1 Win=853 Len=56 TSval=682672 TSecr=775340
 42 0.322844885 172.31.31.144 -> 172.31.23.72 TCP 106 6633 → 40212 [PSH, ACK] Seq=57 Ack=1 Win=853 Len=40 TSval=682672 TSecr=775340
 43 0.322862747 172.31.31.144 -> 172.31.23.72 TCP 122 6633 → 40214 [PSH, ACK] Seq=1 Ack=1 Win=853 Len=56 TSval=682672 TSecr=775339
 44 0.322881410 172.31.31.144 -> 172.31.23.72 TCP 106 6633 → 40214 [PSH, ACK] Seq=57 Ack=1 Win=853 Len=40 TSval=682672 TSecr=775339
 45 0.322999114 172.31.23.72 -> 172.31.31.144 OpenFlow 2010 Type: OFPT_MULTIPART_REPLY, OFPMP_FLOW
 46 0.323069447 172.31.23.72 -> 172.31.31.144 OpenFlow 530 Type: OFPT_MULTIPART_REPLY, OFPMP_PORT_STATS
 47 0.323208041 172.31.23.72 -> 172.31.31.144 OpenFlow 6178 Type: OFPT_MULTIPART_REPLY, OFPMP_TABLE
 48 0.323227676 172.31.31.144 -> 172.31.23.72 TCP 66 6633 → 40212 [ACK] Seq=97 Ack=1945 Win=853 Len=0 TSval=682672 TSecr=775511
 49 0.323261161 172.31.23.72 -> 172.31.31.144 OpenFlow 346 Type: OFPT_MULTIPART_REPLY, OFPMP_FLOW
 50 0.323291016 172.31.31.144 -> 172.31.23.72 TCP 66 6633 → 40212 [ACK] Seq=97 Ack=2409 Win=853 Len=0 TSval=682672 TSecr=775511
 51 0.323348795 172.31.23.72 -> 172.31.31.144 OpenFlow 530 Type: OFPT_MULTIPART_REPLY, OFPMP_PORT_STATS
 52 0.323432836 172.31.31.144 -> 172.31.23.72 TCP 66 6633 → 40212 [ACK] Seq=97 Ack=8521 Win=853 Len=0 TSval=682672 TSecr=775511
 53 0.323486196 172.31.23.72 -> 172.31.31.144 OpenFlow 6178 Type: OFPT_MULTIPART_REPLY, OFPMP_TABLE
 54 0.323560556 172.31.31.144 -> 172.31.23.72 TCP 66 6633 → 40214 [ACK] Seq=97 Ack=745 Win=853 Len=0 TSval=682672 TSecr=775511
 55 0.324854736 172.31.31.144 -> 172.31.23.72 TCP 90 6633 → 40210 [PSH, ACK] Seq=1 Ack=1 Win=853 Len=24 TSval=682673 TSecr=775339
 56 0.324885002 172.31.31.144 -> 172.31.23.72 TCP 90 6633 → 40198 [PSH, ACK] Seq=1 Ack=1 Win=853 Len=24 TSval=682673 TSecr=775340
 57 0.325030900 172.31.23.72 -> 172.31.31.144 OpenFlow 642 Type: OFPT_MULTIPART_REPLY, OFPMP_PORT_STATS
 58 0.325126478 172.31.23.72 -> 172.31.31.144 OpenFlow 530 Type: OFPT_MULTIPART_REPLY, OFPMP_PORT_STATS
 59 0.325319904 172.31.31.144 -> 172.31.23.72 TCP 66 6633 → 40210 [ACK] Seq=25 Ack=465 Win=853 Len=0 TSval=682673 TSecr=775511
 60 0.328017221 172.31.31.144 -> 172.31.23.72 OpenFlow 122 Type: OFPT_MULTIPART_REQUEST, OFPMP_FLOW
 61 0.328189409 172.31.23.72 -> 172.31.31.144 OpenFlow 2010 Type: OFPT_MULTIPART_REPLY, OFPMP_FLOW
 62 0.329182214 172.31.31.144 -> 172.31.23.72 OpenFlow 122 Type: OFPT_MULTIPART_REQUEST, OFPMP_FLOW
 63 0.329211937 172.31.31.144 -> 172.31.23.72 OpenFlow 82 Type: OFPT_MULTIPART_REQUEST, OFPMP_TABLE
 64 0.329381722 172.31.23.72 -> 172.31.31.144 OpenFlow 2010 Type: OFPT_MULTIPART_REPLY, OFPMP_FLOW
 65 0.329527976 172.31.23.72 -> 172.31.31.144 OpenFlow 6178 Type: OFPT_MULTIPART_REPLY, OFPMP_TABLE
 66 0.329732601 172.31.31.144 -> 172.31.23.72 TCP 66 6633 → 40210 [ACK] Seq=97 Ack=8521 Win=853 Len=0 TSval=682674 TSecr=775512
 67 0.336421598 172.31.31.144 -> 172.31.23.72 OpenFlow 82 Type: OFPT_MULTIPART_REQUEST, OFPMP_TABLE
 68 0.336822430 172.31.23.72 -> 172.31.31.144 OpenFlow 6178 Type: OFPT_MULTIPART_REPLY, OFPMP_TABLE
 69 0.354683073 172.31.31.144 -> 172.31.23.72 TCP 90 6633 → 40216 [PSH, ACK] Seq=1 Ack=1 Win=853 Len=24 TSval=682680 TSecr=775339
 70 0.354705034 172.31.31.144 -> 172.31.23.72 TCP 122 6633 → 40216 [PSH, ACK] Seq=25 Ack=1 Win=853 Len=56 TSval=682680 TSecr=775339
 71 0.354749019 172.31.31.144 -> 172.31.23.72 TCP 82 6633 → 40216 [PSH, ACK] Seq=81 Ack=1 Win=853 Len=16 TSval=682680 TSecr=775339
 72 0.354959248 172.31.23.72 -> 172.31.31.144 OpenFlow 754 Type: OFPT_MULTIPART_REPLY, OFPMP_PORT_STATS
 73 0.355026903 172.31.23.72 -> 172.31.31.144 OpenFlow 1178 Type: OFPT_MULTIPART_REPLY, OFPMP_FLOW
 74 0.355171115 172.31.23.72 -> 172.31.31.144 OpenFlow 6178 Type: OFPT_MULTIPART_REPLY, OFPMP_TABLE
 75 0.355322659 172.31.31.144 -> 172.31.23.72 TCP 66 6633 → 40216 [ACK] Seq=97 Ack=1801 Win=853 Len=0 TSval=682680 TSecr=775519
 76 0.360588610 172.31.31.144 -> 172.31.23.72 TCP 66 6633 → 40214 [ACK] Seq=97 Ack=6857 Win=853 Len=0 TSval=682682 TSecr=775511
 77 0.367889405 172.31.31.144 -> 172.31.23.72 TCP 90 6633 → 40200 [PSH, ACK] Seq=1 Ack=1 Win=853 Len=24 TSval=682683 TSecr=774815
 78 0.367930576 172.31.31.144 -> 172.31.23.72 TCP 138 6633 → 40200 [PSH, ACK] Seq=25 Ack=1 Win=853 Len=72 TSval=682683 TSecr=774815
 79 0.368087561 172.31.23.72 -> 172.31.31.144 OpenFlow 530 Type: OFPT_MULTIPART_REPLY, OFPMP_PORT_STATS
 80 0.368243710 172.31.23.72 -> 172.31.31.144 OpenFlow 6178 Type: OFPT_MULTIPART_REPLY, OFPMP_TABLE
 81 0.368298679 172.31.23.72 -> 172.31.31.144 OpenFlow 2010 Type: OFPT_MULTIPART_REPLY, OFPMP_FLOW
 82 0.368512908 172.31.31.144 -> 172.31.23.72 TCP 66 6633 → 40200 [ACK] Seq=97 Ack=6577 Win=853 Len=0 TSval=682684 TSecr=775522
 83 0.374077217 172.31.31.144 -> 172.31.23.72 TCP 122 6633 → 40196 [PSH, ACK] Seq=1 Ack=1 Win=853 Len=56 TSval=682685 TSecr=775340
 84 0.374141868 172.31.31.144 -> 172.31.23.72 TCP 106 6633 → 40196 [PSH, ACK] Seq=57 Ack=1 Win=853 Len=40 TSval=682685 TSecr=775340
 85 0.374243049 172.31.23.72 -> 172.31.31.144 OpenFlow 2426 Type: OFPT_MULTIPART_REPLY, OFPMP_FLOW
 86 0.374335151 172.31.23.72 -> 172.31.31.144 OpenFlow 754 Type: OFPT_MULTIPART_REPLY, OFPMP_PORT_STATS
 87 0.374430638 172.31.31.144 -> 172.31.23.72 TCP 66 6633 → 40196 [ACK] Seq=97 Ack=2361 Win=853 Len=0 TSval=682685 TSecr=775524
 88 0.374474284 172.31.23.72 -> 172.31.31.144 OpenFlow 6178 Type: OFPT_MULTIPART_REPLY, OFPMP_TABLE
 89 0.374533977 172.31.31.144 -> 172.31.23.72 TCP 66 6633 → 40196 [ACK] Seq=97 Ack=3049 Win=853 Len=0 TSval=682685 TSecr=775524
 90 0.374687904 172.31.31.144 -> 172.31.23.72 TCP 66 6633 → 40196 [ACK] Seq=97 Ack=9161 Win=853 Len=0 TSval=682685 TSecr=775524
 91 0.376553979 172.31.31.144 -> 172.31.23.72 TCP 66 6633 → 40198 [ACK] Seq=97 Ack=8633 Win=853 Len=0 TSval=682686 TSecr=775514
 92 0.383341071 172.31.31.144 -> 172.31.23.72 TCP 82 6633 → 40206 [PSH, ACK] Seq=1 Ack=1 Win=853 Len=16 TSval=682687 TSecr=775339
 93 0.383347791 172.31.31.144 -> 172.31.23.72 TCP 82 6633 → 40202 [PSH, ACK] Seq=1 Ack=1 Win=853 Len=16 TSval=682687 TSecr=774815
 94 0.383351377 172.31.31.144 -> 172.31.23.72 TCP 146 6633 → 40202 [PSH, ACK] Seq=17 Ack=1 Win=853 Len=80 TSval=682687 TSecr=774815
 95 0.383360756 172.31.31.144 -> 172.31.23.72 TCP 146 6633 → 40206 [PSH, ACK] Seq=17 Ack=1 Win=853 Len=80 TSval=682687 TSecr=775339
 96 0.383602787 172.31.23.72 -> 172.31.31.144 OpenFlow 6178 Type: OFPT_MULTIPART_REPLY, OFPMP_TABLE
 97 0.383700431 172.31.23.72 -> 172.31.31.144 OpenFlow 642 Type: OFPT_MULTIPART_REPLY, OFPMP_PORT_STATS
 98 0.383759654 172.31.23.72 -> 172.31.31.144 OpenFlow 2010 Type: OFPT_MULTIPART_REPLY, OFPMP_FLOW
 99 0.383876644 172.31.31.144 -> 172.31.23.72 TCP 66 6633 → 40202 [ACK] Seq=97 Ack=6113 Win=853 Len=0 TSval=682687 TSecr=775526
100 0.383881689 172.31.31.144 -> 172.31.23.72 TCP 66 6633 → 40202 [ACK] Seq=97 Ack=6689 Win=853 Len=0 TSval=682687 TSecr=775526
101 0.383920664 172.31.23.72 -> 172.31.31.144 OpenFlow 6178 Type: OFPT_MULTIPART_REPLY, OFPMP_TABLE
102 0.383974031 172.31.31.144 -> 172.31.23.72 TCP 66 6633 → 40202 [ACK] Seq=97 Ack=8633 Win=853 Len=0 TSval=682687 TSecr=775526
103 0.383988746 172.31.23.72 -> 172.31.31.144 OpenFlow 2634 Type: OFPT_MULTIPART_REPLY, OFPMP_FLOW
104 0.384066377 172.31.23.72 -> 172.31.31.144 OpenFlow 530 Type: OFPT_MULTIPART_REPLY, OFPMP_PORT_STATS
105 0.384187766 172.31.31.144 -> 172.31.23.72 TCP 66 6633 → 40206 [ACK] Seq=97 Ack=8681 Win=853 Len=0 TSval=682687 TSecr=775526
106 0.392569415 172.31.31.144 -> 172.31.23.72 TCP 66 6633 → 40216 [ACK] Seq=97 Ack=7913 Win=853 Len=0 TSval=682690 TSecr=775519
107 0.396516445 172.31.31.144 -> 172.31.23.72 TCP 90 6633 → 40208 [PSH, ACK] Seq=1 Ack=1 Win=853 Len=24 TSval=682691 TSecr=775340
108 0.396541096 172.31.31.144 -> 172.31.23.72 TCP 122 6633 → 40208 [PSH, ACK] Seq=25 Ack=1 Win=853 Len=56 TSval=682691 TSecr=775340
109 0.396721968 172.31.23.72 -> 172.31.31.144 OpenFlow 642 Type: OFPT_MULTIPART_REPLY, OFPMP_PORT_STATS
110 0.396799321 172.31.23.72 -> 172.31.31.144 OpenFlow 2218 Type: OFPT_MULTIPART_REPLY, OFPMP_FLOW
111 0.397071799 172.31.31.144 -> 172.31.23.72 TCP 66 6633 → 40208 [ACK] Seq=81 Ack=2729 Win=853 Len=0 TSval=682691 TSecr=775529
112 0.397615228 172.31.31.144 -> 172.31.23.72 OpenFlow 82 Type: OFPT_MULTIPART_REQUEST, OFPMP_TABLE
113 0.397878665 172.31.23.72 -> 172.31.31.144 OpenFlow 6178 Type: OFPT_MULTIPART_REPLY, OFPMP_TABLE
114 0.408584293 172.31.31.144 -> 172.31.23.72 TCP 66 6633 → 40200 [ACK] Seq=97 Ack=8521 Win=853 Len=0 TSval=682694 TSecr=775522
115 0.410155072 172.31.23.72 -> 137.158.125.247 SSH 90 Server: Encrypted packet (len=36)
116 0.420576763 172.31.31.144 -> 172.31.23.72 TCP 66 6633 → 40206 [ACK] Seq=97 Ack=9145 Win=853 Len=0 TSval=682697 TSecr=775526
117 0.433832759 172.31.31.144 -> 172.31.23.72 OpenFlow 187 Type: OFPT_PACKET_OUT
118 0.433859602 172.31.31.144 -> 172.31.23.72 OpenFlow 187 Type: OFPT_PACKET_OUT
119 0.433879593 172.31.31.144 -> 172.31.23.72 OpenFlow 187 Type: OFPT_PACKET_OUT
120 0.433944214 172.31.31.144 -> 172.31.23.72 OpenFlow 187 Type: OFPT_PACKET_OUT
121 0.434026432 172.31.31.144 -> 172.31.23.72 OpenFlow 187 Type: OFPT_PACKET_OUT
122 0.434090881 172.31.31.144 -> 172.31.23.72 OpenFlow 187 Type: OFPT_PACKET_OUT
123 0.434161664 172.31.31.144 -> 172.31.23.72 OpenFlow 187 Type: OFPT_PACKET_OUT
124 0.434237953 172.31.31.144 -> 172.31.23.72 OpenFlow 187 Type: OFPT_PACKET_OUT
125 0.434294091 172.31.31.144 -> 172.31.23.72 OpenFlow 187 Type: OFPT_PACKET_OUT
126 0.434370267 172.31.31.144 -> 172.31.23.72 OpenFlow 187 Type: OFPT_PACKET_OUT
127 0.434456067 172.31.23.72 -> 172.31.31.144 TCP 66 40188 → 6633 [ACK] Seq=8745 Ack=1307 Win=213 Len=0 TSval=775539 TSecr=682700
128 0.434543529 172.31.23.72 -> 172.31.31.144 OpenFlow 189 Type: OFPT_PACKET_IN
129 0.434577107 172.31.23.72 -> 172.31.31.144 OpenFlow 189 Type: OFPT_PACKET_IN
130 0.434620110 172.31.23.72 -> 172.31.31.144 OpenFlow 189 Type: OFPT_PACKET_IN
131 0.434642597 172.31.23.72 -> 172.31.31.144 OpenFlow 189 Type: OFPT_PACKET_IN
132 0.434705617 172.31.31.144 -> 172.31.23.72 TCP 66 6633 → 40198 [ACK] Seq=97 Ack=8756 Win=853 Len=0 TSval=682700 TSecr=775539
133 0.434722737 172.31.31.144 -> 172.31.23.72 TCP 66 6633 → 40198 [ACK] Seq=97 Ack=8879 Win=853 Len=0 TSval=682700 TSecr=775539
134 0.434742002 172.31.23.72 -> 172.31.31.144 OpenFlow 189 Type: OFPT_PACKET_IN
135 0.434764845 172.31.23.72 -> 172.31.31.144 OpenFlow 189 Type: OFPT_PACKET_IN
136 0.434777067 172.31.23.72 -> 172.31.31.144 OpenFlow 189 Type: OFPT_PACKET_IN
137 0.434787309 172.31.31.144 -> 172.31.23.72 TCP 66 6633 → 40216 [ACK] Seq=97 Ack=8036 Win=853 Len=0 TSval=682700 TSecr=775539
138 0.434803130 172.31.23.72 -> 172.31.31.144 OpenFlow 189 Type: OFPT_PACKET_IN
139 0.434837345 172.31.31.144 -> 172.31.23.72 TCP 66 6633 → 40216 [ACK] Seq=97 Ack=8159 Win=853 Len=0 TSval=682700 TSecr=775539
140 0.434843102 172.31.23.72 -> 172.31.31.144 OpenFlow 189 Type: OFPT_PACKET_IN
141 0.434847633 172.31.23.72 -> 172.31.31.144 OpenFlow 189 Type: OFPT_PACKET_IN
142 0.434948582 172.31.31.144 -> 172.31.23.72 TCP 66 6633 → 40148 [ACK] Seq=1 Ack=124 Win=853 Len=0 TSval=682700 TSecr=775539
143 0.435006344 172.31.31.144 -> 172.31.23.72 TCP 66 6633 → 40152 [ACK] Seq=1 Ack=124 Win=853 Len=0 TSval=682700 TSecr=775539
144 0.435035660 172.31.31.144 -> 172.31.23.72 TCP 66 6633 → 40152 [ACK] Seq=1 Ack=247 Win=853 Len=0 TSval=682700 TSecr=775539
145 0.435079296 172.31.31.144 -> 172.31.23.72 TCP 66 6633 → 40142 [ACK] Seq=1 Ack=247 Win=853 Len=0 TSval=682700 TSecr=775539
146 0.435099130 172.31.31.144 -> 172.31.23.72 TCP 66 6633 → 40148 [ACK] Seq=1 Ack=247 Win=853 Len=0 TSval=682700 TSecr=775539
147 0.436504748 172.31.31.144 -> 172.31.23.72 TCP 66 6633 → 40208 [ACK] Seq=97 Ack=8841 Win=853 Len=0 TSval=682701 TSecr=775530
148 0.622068210 137.158.125.247 -> 172.31.23.72 TCP 54 52508 → 22 [ACK] Seq=1 Ack=97 Win=32386 Len=0
149 0.632982371 172.31.31.144 -> 172.31.23.72 OpenFlow 187 Type: OFPT_PACKET_OUT
150 0.633025821 172.31.31.144 -> 172.31.23.72 OpenFlow 187 Type: OFPT_PACKET_OUT
151 0.633059551 172.31.31.144 -> 172.31.23.72 OpenFlow 187 Type: OFPT_PACKET_OUT
152 0.633104326 172.31.31.144 -> 172.31.23.72 OpenFlow 187 Type: OFPT_PACKET_OUT
153 0.633154154 172.31.31.144 -> 172.31.23.72 OpenFlow 187 Type: OFPT_PACKET_OUT
154 0.633238186 172.31.31.144 -> 172.31.23.72 OpenFlow 187 Type: OFPT_PACKET_OUT
155 0.633304207 172.31.31.144 -> 172.31.23.72 OpenFlow 187 Type: OFPT_PACKET_OUT
156 0.633340628 172.31.31.144 -> 172.31.23.72 OpenFlow 187 Type: OFPT_PACKET_OUT
157 0.633402506 172.31.31.144 -> 172.31.23.72 OpenFlow 187 Type: OFPT_PACKET_OUT
158 0.633457120 172.31.31.144 -> 172.31.23.72 OpenFlow 187 Type: OFPT_PACKET_OUT
159 0.633512717 172.31.31.144 -> 172.31.23.72 OpenFlow 187 Type: OFPT_PACKET_OUT
160 0.633573169 172.31.31.144 -> 172.31.23.72 OpenFlow 187 Type: OFPT_PACKET_OUT
161 0.633630655 172.31.31.144 -> 172.31.23.72 OpenFlow 187 Type: OFPT_PACKET_OUT
162 0.633687522 172.31.31.144 -> 172.31.23.72 OpenFlow 187 Type: OFPT_PACKET_OUT
163 0.633696759 172.31.23.72 -> 172.31.31.144 TCP 66 40204 → 6633 [ACK] Seq=7177 Ack=1065 Win=308 Len=0 TSval=775589 TSecr=682750
164 0.633727252 172.31.23.72 -> 172.31.31.144 TCP 66 40214 → 6633 [ACK] Seq=6857 Ack=823 Win=200 Len=0 TSval=775589 TSecr=682750
165 0.633804063 172.31.23.72 -> 172.31.31.144 OpenFlow 189 Type: OFPT_PACKET_IN
166 0.633827419 172.31.23.72 -> 172.31.31.144 OpenFlow 189 Type: OFPT_PACKET_IN
167 0.633851675 172.31.31.144 -> 172.31.23.72 OpenFlow 187 Type: OFPT_PACKET_OUT
168 0.633888078 172.31.31.144 -> 172.31.23.72 OpenFlow 187 Type: OFPT_PACKET_OUT
169 0.633918597 172.31.31.144 -> 172.31.23.72 OpenFlow 187 Type: OFPT_PACKET_OUT
170 0.633958614 172.31.31.144 -> 172.31.23.72 OpenFlow 187 Type: OFPT_PACKET_OUT
171 0.633980673 172.31.31.144 -> 172.31.23.72 TCP 66 6633 → 40216 [ACK] Seq=97 Ack=8282 Win=853 Len=0 TSval=682750 TSecr=775589
172 0.633985739 172.31.23.72 -> 172.31.31.144 OpenFlow 189 Type: OFPT_PACKET_IN
173 0.633995539 172.31.31.144 -> 172.31.23.72 TCP 66 6633 → 40216 [ACK] Seq=97 Ack=8405 Win=853 Len=0 TSval=682750 TSecr=775589
174 0.634009340 172.31.23.72 -> 172.31.31.144 OpenFlow 189 Type: OFPT_PACKET_IN
175 0.634024960 172.31.23.72 -> 172.31.31.144 OpenFlow 189 Type: OFPT_PACKET_IN
176 0.634033469 172.31.31.144 -> 172.31.23.72 OpenFlow 187 Type: OFPT_PACKET_OUT
177 0.634058792 172.31.23.72 -> 172.31.31.144 OpenFlow 189 Type: OFPT_PACKET_IN
178 0.634082387 172.31.31.144 -> 172.31.23.72 OpenFlow 187 Type: OFPT_PACKET_OUT
179 0.634167945 172.31.31.144 -> 172.31.23.72 TCP 66 6633 → 40146 [ACK] Seq=1 Ack=124 Win=853 Len=0 TSval=682750 TSecr=775589
180 0.634187898 172.31.31.144 -> 172.31.23.72 TCP 66 6633 → 40146 [ACK] Seq=1 Ack=247 Win=853 Len=0 TSval=682750 TSecr=775589
181 0.634206791 172.31.31.144 -> 172.31.23.72 OpenFlow 187 Type: OFPT_PACKET_OUT
182 0.634225046 172.31.31.144 -> 172.31.23.72 TCP 66 6633 → 40150 [ACK] Seq=1 Ack=124 Win=853 Len=0 TSval=682750 TSecr=775589
183 0.634244239 172.31.31.144 -> 172.31.23.72 TCP 66 6633 → 40150 [ACK] Seq=1 Ack=247 Win=853 Len=0 TSval=682750 TSecr=775589
184 0.634276686 172.31.31.144 -> 172.31.23.72 OpenFlow 187 Type: OFPT_PACKET_OUT
185 0.634343090 172.31.31.144 -> 172.31.23.72 OpenFlow 187 Type: OFPT_PACKET_OUT
186 0.634419773 172.31.31.144 -> 172.31.23.72 OpenFlow 187 Type: OFPT_PACKET_OUT
187 0.634488732 172.31.31.144 -> 172.31.23.72 OpenFlow 187 Type: OFPT_PACKET_OUT
188 0.634560699 172.31.23.72 -> 172.31.31.144 OpenFlow 189 Type: OFPT_PACKET_IN
189 0.634571567 172.31.31.144 -> 172.31.23.72 OpenFlow 187 Type: OFPT_PACKET_OUT
190 0.634585144 172.31.23.72 -> 172.31.31.144 OpenFlow 189 Type: OFPT_PACKET_IN
191 0.634636298 172.31.31.144 -> 172.31.23.72 OpenFlow 187 Type: OFPT_PACKET_OUT
192 0.634678733 172.31.31.144 -> 172.31.23.72 OpenFlow 187 Type: OFPT_PACKET_OUT
193 0.634721550 172.31.31.144 -> 172.31.23.72 TCP 66 6633 → 40208 [ACK] Seq=97 Ack=8964 Win=853 Len=0 TSval=682750 TSecr=775589
194 0.634739083 172.31.31.144 -> 172.31.23.72 TCP 66 6633 → 40208 [ACK] Seq=97 Ack=9087 Win=853 Len=0 TSval=682750 TSecr=775589
195 0.634787902 172.31.31.144 -> 172.31.23.72 OpenFlow 187 Type: OFPT_PACKET_OUT
196 0.634839248 172.31.31.144 -> 172.31.23.72 OpenFlow 187 Type: OFPT_PACKET_OUT
197 0.634890768 172.31.23.72 -> 172.31.31.144 TCP 66 40212 → 6633 [ACK] Seq=8521 Ack=823 Win=385 Len=0 TSval=775589 TSecr=682750
198 0.634904718 172.31.31.144 -> 172.31.23.72 OpenFlow 187 Type: OFPT_PACKET_OUT
199 0.635047745 172.31.23.72 -> 172.31.31.144 OpenFlow 189 Type: OFPT_PACKET_IN
200 0.635075891 172.31.23.72 -> 172.31.31.144 OpenFlow 189 Type: OFPT_PACKET_IN
201 0.635106719 172.31.23.72 -> 172.31.31.144 OpenFlow 189 Type: OFPT_PACKET_IN
202 0.635124896 172.31.31.144 -> 172.31.23.72 OpenFlow 187 Type: OFPT_PACKET_OUT
203 0.635132379 172.31.23.72 -> 172.31.31.144 OpenFlow 189 Type: OFPT_PACKET_IN
204 0.635140461 172.31.23.72 -> 172.31.31.144 OpenFlow 189 Type: OFPT_PACKET_IN
205 0.635169946 172.31.23.72 -> 172.31.31.144 OpenFlow 435 Type: OFPT_PACKET_IN
206 0.635225517 172.31.31.144 -> 172.31.23.72 TCP 66 6633 → 40140 [ACK] Seq=1 Ack=124 Win=853 Len=0 TSval=682750 TSecr=775589
207 0.635242252 172.31.31.144 -> 172.31.23.72 TCP 66 6633 → 40140 [ACK] Seq=1 Ack=247 Win=853 Len=0 TSval=682750 TSecr=775589
208 0.635288294 172.31.31.144 -> 172.31.23.72 OpenFlow 187 Type: OFPT_PACKET_OUT
209 0.635292573 172.31.31.144 -> 172.31.23.72 TCP 66 6633 → 40152 [ACK] Seq=1 Ack=370 Win=853 Len=0 TSval=682750 TSecr=775589
210 0.635301817 172.31.31.144 -> 172.31.23.72 TCP 66 6633 → 40152 [ACK] Seq=1 Ack=493 Win=853 Len=0 TSval=682750 TSecr=775589
211 0.635335529 172.31.31.144 -> 172.31.23.72 TCP 66 6633 → 40154 [ACK] Seq=1 Ack=124 Win=853 Len=0 TSval=682750 TSecr=775589
212 0.635365685 172.31.31.144 -> 172.31.23.72 TCP 66 6633 → 40154 [ACK] Seq=1 Ack=493 Win=853 Len=0 TSval=682750 TSecr=775589
213 0.635392543 172.31.31.144 -> 172.31.23.72 OpenFlow 187 Type: OFPT_PACKET_OUT
214 0.635418842 172.31.31.144 -> 172.31.23.72 OpenFlow 187 Type: OFPT_PACKET_OUT
215 0.635467294 172.31.31.144 -> 172.31.23.72 OpenFlow 187 Type: OFPT_PACKET_OUT
216 0.635538182 172.31.23.72 -> 172.31.31.144 TCP 66 40192 → 6633 [ACK] Seq=9673 Ack=1065 Win=383 Len=0 TSval=775589 TSecr=682750
217 0.635569059 172.31.31.144 -> 172.31.23.72 OpenFlow 187 Type: OFPT_PACKET_OUT
218 0.635634515 172.31.23.72 -> 172.31.31.144 OpenFlow 189 Type: OFPT_PACKET_IN
219 0.635653320 172.31.23.72 -> 172.31.31.144 TCP 66 40198 → 6633 [ACK] Seq=8879 Ack=1065 Win=384 Len=0 TSval=775589 TSecr=682750
220 0.635704766 172.31.23.72 -> 172.31.31.144 OpenFlow 189 Type: OFPT_PACKET_IN
221 0.635747011 172.31.31.144 -> 172.31.23.72 OpenFlow 187 Type: OFPT_PACKET_OUT
222 0.635801020 172.31.31.144 -> 172.31.23.72 OpenFlow 187 Type: OFPT_PACKET_OUT
223 0.635848720 172.31.31.144 -> 172.31.23.72 TCP 66 6633 → 40196 [ACK] Seq=97 Ack=9284 Win=853 Len=0 TSval=682750 TSecr=775589
224 0.635865800 172.31.31.144 -> 172.31.23.72 OpenFlow 187 Type: OFPT_PACKET_OUT
225 0.635885926 172.31.31.144 -> 172.31.23.72 TCP 66 6633 → 40196 [ACK] Seq=97 Ack=9407 Win=853 Len=0 TSval=682750 TSecr=775589
226 0.635922053 172.31.31.144 -> 172.31.23.72 OpenFlow 187 Type: OFPT_PACKET_OUT
227 0.635984554 172.31.31.144 -> 172.31.23.72 OpenFlow 187 Type: OFPT_PACKET_OUT
228 0.636108442 172.31.23.72 -> 172.31.31.144 OpenFlow 189 Type: OFPT_PACKET_IN
229 0.636124299 172.31.31.144 -> 172.31.23.72 OpenFlow 187 Type: OFPT_PACKET_OUT
230 0.636132180 172.31.23.72 -> 172.31.31.144 OpenFlow 189 Type: OFPT_PACKET_IN
231 0.636156043 172.31.23.72 -> 172.31.31.144 OpenFlow 189 Type: OFPT_PACKET_IN
232 0.636179352 172.31.23.72 -> 172.31.31.144 OpenFlow 189 Type: OFPT_PACKET_IN
233 0.636210404 172.31.31.144 -> 172.31.23.72 OpenFlow 187 Type: OFPT_PACKET_OUT
234 0.636249851 172.31.23.72 -> 172.31.31.144 TCP 66 40210 → 6633 [ACK] Seq=8521 Ack=339 Win=384 Len=0 TSval=775589 TSecr=682750
235 0.636259929 172.31.31.144 -> 172.31.23.72 OpenFlow 187 Type: OFPT_PACKET_OUT
236 0.636284005 172.31.31.144 -> 172.31.23.72 TCP 66 6633 → 40202 [ACK] Seq=97 Ack=8756 Win=853 Len=0 TSval=682750 TSecr=775589
237 0.636306987 172.31.31.144 -> 172.31.23.72 TCP 66 6633 → 40202 [ACK] Seq=97 Ack=8879 Win=853 Len=0 TSval=682750 TSecr=775589
238 0.636326033 172.31.31.144 -> 172.31.23.72 OpenFlow 187 Type: OFPT_PACKET_OUT
239 0.636345854 172.31.31.144 -> 172.31.23.72 TCP 66 6633 → 40206 [ACK] Seq=97 Ack=9268 Win=853 Len=0 TSval=682750 TSecr=775589
240 0.636362831 172.31.31.144 -> 172.31.23.72 TCP 66 6633 → 40206 [ACK] Seq=97 Ack=9391 Win=853 Len=0 TSval=682750 TSecr=775589
241 0.636382362 172.31.31.144 -> 172.31.23.72 OpenFlow 187 Type: OFPT_PACKET_OUT
242 0.636439667 172.31.31.144 -> 172.31.23.72 OpenFlow 187 Type: OFPT_PACKET_OUT
243 0.636505827 172.31.23.72 -> 172.31.31.144 TCP 66 40210 → 6633 [ACK] Seq=8521 Ack=823 Win=384 Len=0 TSval=775589 TSecr=682750
244 0.636559980 172.31.31.144 -> 172.31.23.72 OpenFlow 187 Type: OFPT_PACKET_OUT
245 0.636649183 172.31.31.144 -> 172.31.23.72 OpenFlow 187 Type: OFPT_PACKET_OUT
246 0.636694558 172.31.23.72 -> 172.31.31.144 OpenFlow 189 Type: OFPT_PACKET_IN
247 0.636719309 172.31.31.144 -> 172.31.23.72 OpenFlow 187 Type: OFPT_PACKET_OUT
248 0.636724365 172.31.23.72 -> 172.31.31.144 OpenFlow 189 Type: OFPT_PACKET_IN
249 0.636744753 172.31.23.72 -> 172.31.31.144 OpenFlow 312 Type: OFPT_PACKET_IN
250 0.636758087 172.31.23.72 -> 172.31.31.144 OpenFlow 189 Type: OFPT_PACKET_IN
251 0.636769831 172.31.23.72 -> 172.31.31.144 OpenFlow 189 Type: OFPT_PACKET_IN
252 0.636793753 172.31.23.72 -> 172.31.31.144 OpenFlow 189 Type: OFPT_PACKET_IN
253 0.636806311 172.31.23.72 -> 172.31.31.144 OpenFlow 189 Type: OFPT_PACKET_IN
254 0.636808688 172.31.23.72 -> 172.31.31.144 OpenFlow 189 Type: OFPT_PACKET_IN
255 0.636832855 172.31.31.144 -> 172.31.23.72 OpenFlow 187 Type: OFPT_PACKET_OUT
256 0.636882506 172.31.23.72 -> 172.31.31.144 OpenFlow 189 Type: OFPT_PACKET_IN
257 0.636888754 172.31.23.72 -> 172.31.31.144 OpenFlow 189 Type: OFPT_PACKET_IN
258 0.636890614 172.31.23.72 -> 172.31.31.144 OpenFlow 189 Type: OFPT_PACKET_IN
259 0.636931027 172.31.31.144 -> 172.31.23.72 TCP 66 6633 → 40144 [ACK] Seq=1 Ack=124 Win=853 Len=0 TSval=682751 TSecr=775589
260 0.636936898 172.31.31.144 -> 172.31.23.72 OpenFlow 187 Type: OFPT_PACKET_OUT
261 0.636938806 172.31.31.144 -> 172.31.23.72 TCP 66 6633 → 40144 [ACK] Seq=1 Ack=247 Win=853 Len=0 TSval=682751 TSecr=775589
262 0.637005037 172.31.31.144 -> 172.31.23.72 TCP 66 6633 → 40144 [ACK] Seq=1 Ack=493 Win=853 Len=0 TSval=682751 TSecr=775589
263 0.637009901 172.31.31.144 -> 172.31.23.72 OpenFlow 187 Type: OFPT_PACKET_OUT
264 0.637012033 172.31.31.144 -> 172.31.23.72 TCP 66 6633 → 40148 [ACK] Seq=1 Ack=370 Win=853 Len=0 TSval=682751 TSecr=775589
265 0.637014466 172.31.31.144 -> 172.31.23.72 TCP 66 6633 → 40150 [ACK] Seq=1 Ack=370 Win=853 Len=0 TSval=682751 TSecr=775589
266 0.637018694 172.31.31.144 -> 172.31.23.72 OpenFlow 187 Type: OFPT_PACKET_OUT
267 0.637034154 172.31.31.144 -> 172.31.23.72 TCP 66 6633 → 40188 [ACK] Seq=1307 Ack=8868 Win=853 Len=0 TSval=682751 TSecr=775589
268 0.637053015 172.31.31.144 -> 172.31.23.72 TCP 66 6633 → 40148 [ACK] Seq=1 Ack=493 Win=853 Len=0 TSval=682751 TSecr=775589
269 0.637071332 172.31.31.144 -> 172.31.23.72 TCP 66 6633 → 40150 [ACK] Seq=1 Ack=493 Win=853 Len=0 TSval=682751 TSecr=775589
270 0.637090955 172.31.31.144 -> 172.31.23.72 OpenFlow 187 Type: OFPT_PACKET_OUT
271 0.637108813 172.31.31.144 -> 172.31.23.72 TCP 66 6633 → 40188 [ACK] Seq=1307 Ack=8991 Win=853 Len=0 TSval=682751 TSecr=775589
272 0.637119310 172.31.23.72 -> 172.31.31.144 TCP 66 40190 → 6633 [ACK] Seq=9145 Ack=823 Win=385 Len=0 TSval=775589 TSecr=682750
273 0.637207013 172.31.23.72 -> 172.31.31.144 OpenFlow 189 Type: OFPT_PACKET_IN
274 0.637231893 172.31.23.72 -> 172.31.31.144 OpenFlow 189 Type: OFPT_PACKET_IN
275 0.637255077 172.31.31.144 -> 172.31.23.72 OpenFlow 187 Type: OFPT_PACKET_OUT
276 0.637387731 172.31.31.144 -> 172.31.23.72 TCP 66 6633 → 40194 [ACK] Seq=823 Ack=7935 Win=853 Len=0 TSval=682751 TSecr=775589
277 0.637483878 172.31.31.144 -> 172.31.23.72 OpenFlow 187 Type: OFPT_PACKET_OUT
278 0.637502540 172.31.31.144 -> 172.31.23.72 TCP 66 6633 → 40156 [ACK] Seq=1 Ack=247 Win=853 Len=0 TSval=682751 TSecr=775589
279 0.637535774 172.31.23.72 -> 172.31.31.144 OpenFlow 189 Type: OFPT_PACKET_IN
280 0.637555267 172.31.23.72 -> 172.31.31.144 OpenFlow 189 Type: OFPT_PACKET_IN
281 0.637563766 172.31.23.72 -> 172.31.31.144 OpenFlow 189 Type: OFPT_PACKET_IN
282 0.637577775 172.31.23.72 -> 172.31.31.144 OpenFlow 189 Type: OFPT_PACKET_IN
283 0.637623047 172.31.23.72 -> 172.31.31.144 OpenFlow 189 Type: OFPT_PACKET_IN
284 0.637631376 172.31.23.72 -> 172.31.31.144 OpenFlow 189 Type: OFPT_PACKET_IN
285 0.637668864 172.31.31.144 -> 172.31.23.72 OpenFlow 187 Type: OFPT_PACKET_OUT
286 0.637718446 172.31.31.144 -> 172.31.23.72 TCP 66 6633 → 40196 [ACK] Seq=97 Ack=9530 Win=853 Len=0 TSval=682751 TSecr=775589
287 0.637723913 172.31.31.144 -> 172.31.23.72 OpenFlow 187 Type: OFPT_PACKET_OUT
288 0.637740209 172.31.31.144 -> 172.31.23.72 TCP 66 6633 → 40196 [ACK] Seq=97 Ack=9653 Win=853 Len=0 TSval=682751 TSecr=775589
289 0.637758246 172.31.31.144 -> 172.31.23.72 TCP 66 6633 → 40200 [ACK] Seq=97 Ack=8644 Win=853 Len=0 TSval=682751 TSecr=775589
290 0.637776280 172.31.31.144 -> 172.31.23.72 TCP 66 6633 → 40198 [ACK] Seq=1065 Ack=9002 Win=853 Len=0 TSval=682751 TSecr=775589
291 0.637795766 172.31.31.144 -> 172.31.23.72 OpenFlow 187 Type: OFPT_PACKET_OUT
292 0.637816568 172.31.31.144 -> 172.31.23.72 TCP 66 6633 → 40200 [ACK] Seq=97 Ack=8767 Win=853 Len=0 TSval=682751 TSecr=775590
293 0.637851218 172.31.23.72 -> 172.31.31.144 TCP 66 40208 → 6633 [ACK] Seq=9087 Ack=944 Win=383 Len=0 TSval=775590 TSecr=682751
294 0.637900441 172.31.31.144 -> 172.31.23.72 OpenFlow 187 Type: OFPT_PACKET_OUT
295 0.638021294 172.31.31.144 -> 172.31.23.72 TCP 66 6633 → 40198 [ACK] Seq=1065 Ack=9125 Win=853 Len=0 TSval=682751 TSecr=775590
296 0.638055694 172.31.23.72 -> 172.31.31.144 OpenFlow 189 Type: OFPT_PACKET_IN
297 0.638078248 172.31.23.72 -> 172.31.31.144 OpenFlow 189 Type: OFPT_PACKET_IN
298 0.638123463 172.31.31.144 -> 172.31.23.72 OpenFlow 187 Type: OFPT_PACKET_OUT
299 0.638162051 172.31.23.72 -> 172.31.31.144 OpenFlow 189 Type: OFPT_PACKET_IN
300 0.638185625 172.31.23.72 -> 172.31.31.144 OpenFlow 435 Type: OFPT_PACKET_IN
301 0.638209743 172.31.31.144 -> 172.31.23.72 TCP 66 6633 → 40216 [ACK] Seq=97 Ack=8528 Win=853 Len=0 TSval=682751 TSecr=775590
302 0.638215269 172.31.23.72 -> 172.31.31.144 OpenFlow 189 Type: OFPT_PACKET_IN
303 0.638234296 172.31.31.144 -> 172.31.23.72 TCP 66 6633 → 40216 [ACK] Seq=97 Ack=8651 Win=853 Len=0 TSval=682751 TSecr=775590
304 0.638239152 172.31.23.72 -> 172.31.31.144 OpenFlow 189 Type: OFPT_PACKET_IN
305 0.638259938 172.31.23.72 -> 172.31.31.144 OpenFlow 189 Type: OFPT_PACKET_IN
306 0.638275108 172.31.23.72 -> 172.31.31.144 OpenFlow 189 Type: OFPT_PACKET_IN
307 0.638282029 172.31.23.72 -> 172.31.31.144 OpenFlow 189 Type: OFPT_PACKET_IN
308 0.638327793 172.31.31.144 -> 172.31.23.72 TCP 66 6633 → 40140 [ACK] Seq=1 Ack=370 Win=853 Len=0 TSval=682751 TSecr=775590
309 0.638331827 172.31.31.144 -> 172.31.23.72 OpenFlow 187 Type: OFPT_PACKET_OUT
310 0.638359281 172.31.23.72 -> 172.31.31.144 OpenFlow 189 Type: OFPT_PACKET_IN
311 0.638377946 172.31.31.144 -> 172.31.23.72 TCP 66 6633 → 40140 [ACK] Seq=1 Ack=739 Win=853 Len=0 TSval=682751 TSecr=775590
312 0.638381536 172.31.31.144 -> 172.31.23.72 OpenFlow 308 Type: OFPT_PACKET_OUT
313 0.638409488 172.31.31.144 -> 172.31.23.72 TCP 66 6633 → 40146 [ACK] Seq=1 Ack=370 Win=853 Len=0 TSval=682751 TSecr=775590
314 0.638427739 172.31.31.144 -> 172.31.23.72 TCP 66 6633 → 40146 [ACK] Seq=1 Ack=493 Win=853 Len=0 TSval=682751 TSecr=775590
315 0.638444551 172.31.31.144 -> 172.31.23.72 OpenFlow 187 Type: OFPT_PACKET_OUT
316 0.638463243 172.31.31.144 -> 172.31.23.72 TCP 66 6633 → 40152 [ACK] Seq=1 Ack=616 Win=853 Len=0 TSval=682751 TSecr=775590
317 0.638482816 172.31.31.144 -> 172.31.23.72 OpenFlow 187 Type: OFPT_PACKET_OUT
318 0.638500900 172.31.31.144 -> 172.31.23.72 TCP 66 6633 → 40154 [ACK] Seq=1 Ack=616 Win=853 Len=0 TSval=682751 TSecr=775590
319 0.638519150 172.31.31.144 -> 172.31.23.72 TCP 66 6633 → 40152 [ACK] Seq=1 Ack=739 Win=853 Len=0 TSval=682751 TSecr=775590
320 0.638538036 172.31.31.144 -> 172.31.23.72 TCP 66 6633 → 40154 [ACK] Seq=1 Ack=739 Win=853 Len=0 TSval=682751 TSecr=775590
321 0.638588703 172.31.23.72 -> 172.31.31.144 TCP 66 40200 → 6633 [ACK] Seq=8767 Ack=823 Win=401 Len=0 TSval=775590 TSecr=682751
322 0.638669489 172.31.23.72 -> 172.31.31.144 OpenFlow 189 Type: OFPT_PACKET_IN
323 0.638689753 172.31.23.72 -> 172.31.31.144 OpenFlow 189 Type: OFPT_PACKET_IN
324 0.638709730 172.31.23.72 -> 172.31.31.144 OpenFlow 189 Type: OFPT_PACKET_IN
325 0.638715590 172.31.23.72 -> 172.31.31.144 OpenFlow 189 Type: OFPT_PACKET_IN
326 0.638765167 172.31.23.72 -> 172.31.31.144 OpenFlow 189 Type: OFPT_PACKET_IN
327 0.638770536 172.31.23.72 -> 172.31.31.144 OpenFlow 189 Type: OFPT_PACKET_IN
328 0.638850296 172.31.31.144 -> 172.31.23.72 TCP 66 6633 → 40202 [ACK] Seq=97 Ack=9002 Win=853 Len=0 TSval=682751 TSecr=775590
329 0.638865379 172.31.31.144 -> 172.31.23.72 OpenFlow 187 Type: OFPT_PACKET_OUT
330 0.638950263 172.31.31.144 -> 172.31.23.72 TCP 66 6633 → 40204 [ACK] Seq=1065 Ack=7423 Win=853 Len=0 TSval=682751 TSecr=775590
331 0.639049857 172.31.23.72 -> 172.31.31.144 OpenFlow 189 Type: OFPT_PACKET_IN
332 0.639169088 172.31.31.144 -> 172.31.23.72 OpenFlow 187 Type: OFPT_PACKET_OUT
333 0.639204278 172.31.31.144 -> 172.31.23.72 TCP 66 6633 → 40210 [ACK] Seq=823 Ack=8767 Win=853 Len=0 TSval=682751 TSecr=775590
334 0.639214749 172.31.31.144 -> 172.31.23.72 OpenFlow 308 Type: OFPT_PACKET_OUT
335 0.639395093 172.31.23.72 -> 172.31.31.144 TCP 66 40202 → 6633 [ACK] Seq=9125 Ack=581 Win=213 Len=0 TSval=775590 TSecr=682751
336 0.639466139 172.31.23.72 -> 172.31.31.144 OpenFlow 189 Type: OFPT_PACKET_IN
337 0.639522153 172.31.31.144 -> 172.31.23.72 OpenFlow 187 Type: OFPT_PACKET_OUT
338 0.639546365 172.31.31.144 -> 172.31.23.72 OpenFlow 308 Type: OFPT_PACKET_OUT
339 0.639621141 172.31.31.144 -> 172.31.23.72 OpenFlow 187 Type: OFPT_PACKET_OUT
340 0.639655616 172.31.23.72 -> 172.31.31.144 OpenFlow 189 Type: OFPT_PACKET_IN
341 0.639664152 172.31.31.144 -> 172.31.23.72 TCP 66 6633 → 40204 [ACK] Seq=1065 Ack=7669 Win=853 Len=0 TSval=682751 TSecr=775590
342 0.639680211 172.31.23.72 -> 172.31.31.144 OpenFlow 189 Type: OFPT_PACKET_IN
343 0.639760218 172.31.31.144 -> 172.31.23.72 OpenFlow 187 Type: OFPT_PACKET_OUT
344 0.639775221 172.31.31.144 -> 172.31.23.72 OpenFlow 187 Type: OFPT_PACKET_OUT
345 0.639789913 172.31.23.72 -> 172.31.31.144 TCP 66 40202 → 6633 [ACK] Seq=9125 Ack=1065 Win=213 Len=0 TSval=775590 TSecr=682751
346 0.639855781 172.31.31.144 -> 172.31.23.72 TCP 66 6633 → 40200 [ACK] Seq=823 Ack=9013 Win=853 Len=0 TSval=682751 TSecr=775590
347 0.639936751 172.31.31.144 -> 172.31.23.72 OpenFlow 187 Type: OFPT_PACKET_OUT
348 0.639979761 172.31.31.144 -> 172.31.23.72 OpenFlow 187 Type: OFPT_PACKET_OUT
349 0.640033596 172.31.31.144 -> 172.31.23.72 OpenFlow 187 Type: OFPT_PACKET_OUT
350 0.640048530 172.31.23.72 -> 172.31.31.144 OpenFlow 189 Type: OFPT_PACKET_IN
351 0.640069872 172.31.23.72 -> 172.31.31.144 OpenFlow 189 Type: OFPT_PACKET_IN
352 0.640097893 172.31.31.144 -> 172.31.23.72 OpenFlow 187 Type: OFPT_PACKET_OUT
353 0.640162525 172.31.31.144 -> 172.31.23.72 OpenFlow 187 Type: OFPT_PACKET_OUT
354 0.640265291 172.31.31.144 -> 172.31.23.72 OpenFlow 187 Type: OFPT_PACKET_OUT
355 0.640285190 172.31.31.144 -> 172.31.23.72 OpenFlow 187 Type: OFPT_PACKET_OUT
356 0.640435533 172.31.31.144 -> 172.31.23.72 OpenFlow 187 Type: OFPT_PACKET_OUT
357 0.640444671 172.31.23.72 -> 172.31.31.144 TCP 66 40196 → 6633 [ACK] Seq=9899 Ack=1186 Win=213 Len=0 TSval=775590 TSecr=682751
358 0.640503198 172.31.31.144 -> 172.31.23.72 OpenFlow 187 Type: OFPT_PACKET_OUT
359 0.640549030 172.31.23.72 -> 172.31.31.144 OpenFlow 189 Type: OFPT_PACKET_IN
360 0.640566297 172.31.23.72 -> 172.31.31.144 OpenFlow 189 Type: OFPT_PACKET_IN
361 0.640585728 172.31.23.72 -> 172.31.31.144 OpenFlow 189 Type: OFPT_PACKET_IN
362 0.640600932 172.31.31.144 -> 172.31.23.72 OpenFlow 187 Type: OFPT_PACKET_OUT
363 0.640629630 172.31.23.72 -> 172.31.31.144 OpenFlow 189 Type: OFPT_PACKET_IN
364 0.640672313 172.31.31.144 -> 172.31.23.72 OpenFlow 187 Type: OFPT_PACKET_OUT
365 0.640679454 172.31.23.72 -> 172.31.31.144 OpenFlow 189 Type: OFPT_PACKET_IN
366 0.640724340 172.31.31.144 -> 172.31.23.72 OpenFlow 187 Type: OFPT_PACKET_OUT
367 0.640774720 172.31.31.144 -> 172.31.23.72 OpenFlow 187 Type: OFPT_PACKET_OUT
368 0.640816105 172.31.31.144 -> 172.31.23.72 TCP 66 6633 → 40204 [ACK] Seq=1065 Ack=7915 Win=853 Len=0 TSval=682752 TSecr=775590
369 0.640838632 172.31.31.144 -> 172.31.23.72 OpenFlow 187 Type: OFPT_PACKET_OUT
370 0.640853123 172.31.31.144 -> 172.31.23.72 OpenFlow 187 Type: OFPT_PACKET_OUT
371 0.640918609 172.31.31.144 -> 172.31.23.72 OpenFlow 187 Type: OFPT_PACKET_OUT
372 0.641028635 172.31.23.72 -> 172.31.31.144 TCP 66 40216 → 6633 [ACK] Seq=8651 Ack=1065 Win=213 Len=0 TSval=775590 TSecr=682751
373 0.641038655 172.31.31.144 -> 172.31.23.72 TCP 66 6633 → 40210 [ACK] Seq=823 Ack=9013 Win=853 Len=0 TSval=682752 TSecr=775590
374 0.641050472 172.31.31.144 -> 172.31.23.72 OpenFlow 187 Type: OFPT_PACKET_OUT
375 0.641115031 172.31.31.144 -> 172.31.23.72 OpenFlow 187 Type: OFPT_PACKET_OUT
376 0.641147228 172.31.23.72 -> 172.31.31.144 TCP 66 40216 → 6633 [ACK] Seq=8651 Ack=1307 Win=213 Len=0 TSval=775590 TSecr=682752
377 0.641244667 172.31.31.144 -> 172.31.23.72 OpenFlow 187 Type: OFPT_PACKET_OUT
378 0.641274201 172.31.31.144 -> 172.31.23.72 OpenFlow 187 Type: OFPT_PACKET_OUT
379 0.641299044 172.31.23.72 -> 172.31.31.144 OpenFlow 189 Type: OFPT_PACKET_IN
380 0.641315773 172.31.23.72 -> 172.31.31.144 OpenFlow 189 Type: OFPT_PACKET_IN
381 0.641323095 172.31.23.72 -> 172.31.31.144 OpenFlow 189 Type: OFPT_PACKET_IN
382 0.641341184 172.31.23.72 -> 172.31.31.144 OpenFlow 189 Type: OFPT_PACKET_IN
383 0.641351363 172.31.23.72 -> 172.31.31.144 OpenFlow 189 Type: OFPT_PACKET_IN
384 0.641361879 172.31.23.72 -> 172.31.31.144 OpenFlow 189 Type: OFPT_PACKET_IN
385 0.641367869 172.31.31.144 -> 172.31.23.72 OpenFlow 187 Type: OFPT_PACKET_OUT
386 0.641388834 172.31.23.72 -> 172.31.31.144 OpenFlow 189 Type: OFPT_PACKET_IN
387 0.641404477 172.31.23.72 -> 172.31.31.144 OpenFlow 189 Type: OFPT_PACKET_IN
388 0.641468059 172.31.23.72 -> 172.31.31.144 OpenFlow 189 Type: OFPT_PACKET_IN
389 0.641471076 172.31.23.72 -> 172.31.31.144 OpenFlow 189 Type: OFPT_PACKET_IN
390 0.641472848 172.31.23.72 -> 172.31.31.144 OpenFlow 189 Type: OFPT_PACKET_IN
391 0.641494604 172.31.31.144 -> 172.31.23.72 OpenFlow 187 Type: OFPT_PACKET_OUT
392 0.641498885 172.31.31.144 -> 172.31.23.72 TCP 66 6633 → 40148 [ACK] Seq=1 Ack=616 Win=853 Len=0 TSval=682752 TSecr=775590
393 0.641501726 172.31.31.144 -> 172.31.23.72 OpenFlow 187 Type: OFPT_PACKET_OUT
394 0.641517244 172.31.23.72 -> 172.31.31.144 OpenFlow 189 Type: OFPT_PACKET_IN
395 0.641531242 172.31.23.72 -> 172.31.31.144 OpenFlow 189 Type: OFPT_PACKET_IN
396 0.641626166 172.31.31.144 -> 172.31.23.72 TCP 66 6633 → 40150 [ACK] Seq=1 Ack=616 Win=853 Len=0 TSval=682752 TSecr=775590
397 0.641632182 172.31.31.144 -> 172.31.23.72 TCP 66 6633 → 40148 [ACK] Seq=1 Ack=739 Win=853 Len=0 TSval=682752 TSecr=775590
398 0.641634535 172.31.31.144 -> 172.31.23.72 OpenFlow 187 Type: OFPT_PACKET_OUT
399 0.641636582 172.31.31.144 -> 172.31.23.72 TCP 66 6633 → 40154 [ACK] Seq=1 Ack=862 Win=853 Len=0 TSval=682752 TSecr=775590
400 0.641638442 172.31.31.144 -> 172.31.23.72 TCP 66 6633 → 40188 [ACK] Seq=1307 Ack=9114 Win=853 Len=0 TSval=682752 TSecr=775590
401 0.641669334 172.31.31.144 -> 172.31.23.72 TCP 66 6633 → 40150 [ACK] Seq=1 Ack=739 Win=853 Len=0 TSval=682752 TSecr=775590
402 0.641682389 172.31.31.144 -> 172.31.23.72 TCP 66 6633 → 40154 [ACK] Seq=1 Ack=985 Win=853 Len=0 TSval=682752 TSecr=775590
403 0.641700601 172.31.31.144 -> 172.31.23.72 TCP 66 6633 → 40188 [ACK] Seq=1307 Ack=9237 Win=853 Len=0 TSval=682752 TSecr=775590
404 0.641789936 172.31.31.144 -> 172.31.23.72 TCP 66 6633 → 40202 [ACK] Seq=1065 Ack=9371 Win=853 Len=0 TSval=682752 TSecr=775590
405 0.641817400 172.31.23.72 -> 172.31.31.144 TCP 66 40206 → 6633 [ACK] Seq=9391 Ack=823 Win=402 Len=0 TSval=775591 TSecr=682752
406 0.641918444 172.31.23.72 -> 172.31.31.144 OpenFlow 189 Type: OFPT_PACKET_IN
407 0.641929085 172.31.31.144 -> 172.31.23.72 TCP 66 6633 → 40156 [ACK] Seq=1 Ack=493 Win=853 Len=0 TSval=682752 TSecr=775590
408 0.641942871 172.31.23.72 -> 172.31.31.144 OpenFlow 189 Type: OFPT_PACKET_IN
409 0.642049248 172.31.23.72 -> 172.31.31.144 OpenFlow 189 Type: OFPT_PACKET_IN
410 0.642069041 172.31.31.144 -> 172.31.23.72 TCP 66 6633 → 40194 [ACK] Seq=823 Ack=8181 Win=853 Len=0 TSval=682752 TSecr=775590
411 0.642075269 172.31.23.72 -> 172.31.31.144 OpenFlow 189 Type: OFPT_PACKET_IN
412 0.642104206 172.31.23.72 -> 172.31.31.144 OpenFlow 189 Type: OFPT_PACKET_IN
413 0.642116842 172.31.31.144 -> 172.31.23.72 TCP 66 6633 → 40214 [ACK] Seq=823 Ack=6980 Win=853 Len=0 TSval=682752 TSecr=775591
414 0.642120136 172.31.31.144 -> 172.31.23.72 TCP 66 6633 → 40214 [ACK] Seq=823 Ack=7103 Win=853 Len=0 TSval=682752 TSecr=775591
415 0.642140235 172.31.23.72 -> 172.31.31.144 OpenFlow 189 Type: OFPT_PACKET_IN
416 0.642203466 172.31.31.144 -> 172.31.23.72 TCP 66 6633 → 40148 [ACK] Seq=1 Ack=862 Win=853 Len=0 TSval=682752 TSecr=775591
417 0.642231261 172.31.31.144 -> 172.31.23.72 TCP 66 6633 → 40148 [ACK] Seq=1 Ack=985 Win=853 Len=0 TSval=682752 TSecr=775591
418 0.642253323 172.31.31.144 -> 172.31.23.72 TCP 66 6633 → 40192 [ACK] Seq=1065 Ack=9796 Win=853 Len=0 TSval=682752 TSecr=775591
419 0.642268730 172.31.31.144 -> 172.31.23.72 TCP 66 6633 → 40192 [ACK] Seq=1065 Ack=9919 Win=853 Len=0 TSval=682752 TSecr=775591
420 0.677649098 172.31.23.72 -> 172.31.31.144 TCP 66 40196 → 6633 [ACK] Seq=9899 Ack=1307 Win=213 Len=0 TSval=775600 TSecr=682752
421 0.677656488 172.31.23.72 -> 172.31.31.144 TCP 66 40208 → 6633 [ACK] Seq=9087 Ack=1065 Win=384 Len=0 TSval=775600 TSecr=682751
422 0.690698422 172.31.23.72 -> 172.31.31.144 OpenFlow 146 Type: OFPT_PORT_STATUS
423 0.690829146 172.31.23.72 -> 172.31.31.144 OpenFlow 146 Type: OFPT_PORT_STATUS
424 0.690948220 172.31.31.144 -> 172.31.23.72 TCP 66 6633 → 40148 [ACK] Seq=1 Ack=1065 Win=853 Len=0 TSval=682764 TSecr=775603
425 0.728537331 172.31.31.144 -> 172.31.23.72 TCP 66 6633 → 40216 [ACK] Seq=1307 Ack=8731 Win=853 Len=0 TSval=682774 TSecr=775603
426 0.916535854 172.31.23.72 -> 137.158.125.247 SSH 98 Server: Encrypted packet (len=44)
427 1.156206664 137.158.125.247 -> 172.31.23.72 TCP 54 52508 → 22 [ACK] Seq=1 Ack=141 Win=32364 Len=0
428 1.416318255 172.31.23.72 -> 137.158.125.247 SSH 98 Server: Encrypted packet (len=44)
429 1.632956382 137.158.125.247 -> 172.31.23.72 TCP 54 52508 → 22 [ACK] Seq=1 Ack=185 Win=32342 Len=0
430 1.921404431 172.31.23.72 -> 137.158.125.247 SSH 98 Server: Encrypted packet (len=44)
431 2.130159962 137.158.125.247 -> 172.31.23.72 TCP 54 52508 → 22 [ACK] Seq=1 Ack=229 Win=32320 Len=0
432 2.424206366 172.31.23.72 -> 137.158.125.247 SSH 98 Server: Encrypted packet (len=44)
433 2.633031307 172.31.31.144 -> 172.31.23.72 OpenFlow 187 Type: OFPT_PACKET_OUT
434 2.633068405 172.31.31.144 -> 172.31.23.72 OpenFlow 187 Type: OFPT_PACKET_OUT
435 2.633073385 172.31.31.144 -> 172.31.23.72 OpenFlow 187 Type: OFPT_PACKET_OUT
436 2.633113701 172.31.31.144 -> 172.31.23.72 OpenFlow 187 Type: OFPT_PACKET_OUT
437 2.633199813 172.31.31.144 -> 172.31.23.72 OpenFlow 187 Type: OFPT_PACKET_OUT
438 2.633251309 172.31.31.144 -> 172.31.23.72 OpenFlow 187 Type: OFPT_PACKET_OUT
439 2.633301649 172.31.31.144 -> 172.31.23.72 OpenFlow 187 Type: OFPT_PACKET_OUT
440 2.633393799 172.31.31.144 -> 172.31.23.72 OpenFlow 187 Type: OFPT_PACKET_OUT
441 2.633689809 172.31.23.72 -> 172.31.31.144 TCP 66 40146 → 6633 [ACK] Seq=493 Ack=969 Win=384 Len=0 TSval=776089 TSecr=683250
442 2.633786295 172.31.23.72 -> 172.31.31.144 OpenFlow 189 Type: OFPT_PACKET_IN
443 2.633817336 172.31.23.72 -> 172.31.31.144 OpenFlow 189 Type: OFPT_PACKET_IN
444 2.633868052 172.31.23.72 -> 172.31.31.144 OpenFlow 189 Type: OFPT_PACKET_IN
445 2.633889640 172.31.23.72 -> 172.31.31.144 OpenFlow 189 Type: OFPT_PACKET_IN
446 2.633949189 172.31.23.72 -> 172.31.31.144 OpenFlow 189 Type: OFPT_PACKET_IN
447 2.633971221 172.31.23.72 -> 172.31.31.144 OpenFlow 189 Type: OFPT_PACKET_IN
448 2.633997174 172.31.31.144 -> 172.31.23.72 TCP 66 6633 → 40150 [ACK] Seq=1 Ack=862 Win=853 Len=0 TSval=683250 TSecr=776089
449 2.634020388 172.31.31.144 -> 172.31.23.72 TCP 66 6633 → 40150 [ACK] Seq=1 Ack=985 Win=853 Len=0 TSval=683250 TSecr=776089
450 2.634116145 172.31.31.144 -> 172.31.23.72 TCP 66 6633 → 40194 [ACK] Seq=823 Ack=8427 Win=853 Len=0 TSval=683250 TSecr=776089
451 2.634121348 172.31.31.144 -> 172.31.23.72 TCP 66 6633 → 40214 [ACK] Seq=823 Ack=7226 Win=853 Len=0 TSval=683250 TSecr=776089
452 2.634125334 172.31.31.144 -> 172.31.23.72 TCP 66 6633 → 40214 [ACK] Seq=823 Ack=7349 Win=853 Len=0 TSval=683250 TSecr=776089
453 2.634488210 137.158.125.247 -> 172.31.23.72 TCP 54 52508 → 22 [ACK] Seq=1 Ack=273 Win=32298 Len=0
