  1 0.000000000 172.31.23.72 -> 172.31.31.144 TCP 66 51172 → 6633 [ACK] Seq=1 Ack=1 Win=213 Len=0 TSval=23943483 TSecr=5373357
  2 0.000093566 172.31.23.72 -> 172.31.31.144 OpenFlow 189 Type: OFPT_PACKET_IN
  3 0.000117587 172.31.23.72 -> 172.31.31.144 OpenFlow 189 Type: OFPT_PACKET_IN
  4 0.000272967 172.31.31.144 -> 172.31.23.72 TCP 66 6633 → 51170 [ACK] Seq=1 Ack=247 Win=853 Len=0 TSval=5373358 TSecr=23943483
  5 0.000403794 172.31.23.72 -> 172.31.31.144 OpenFlow 189 Type: OFPT_PACKET_IN
  6 0.000431055 172.31.23.72 -> 172.31.31.144 OpenFlow 189 Type: OFPT_PACKET_IN
  7 0.000619001 172.31.31.144 -> 172.31.23.72 TCP 66 6633 → 51168 [ACK] Seq=1 Ack=247 Win=853 Len=0 TSval=5373358 TSecr=23943483
  8 0.000808800 172.31.23.72 -> 172.31.31.144 OpenFlow 189 Type: OFPT_PACKET_IN
  9 0.000829859 172.31.23.72 -> 172.31.31.144 OpenFlow 189 Type: OFPT_PACKET_IN
 10 0.000838596 172.31.23.72 -> 172.31.31.144 OpenFlow 189 Type: OFPT_PACKET_IN
 11 0.000883857 172.31.23.72 -> 172.31.31.144 OpenFlow 189 Type: OFPT_PACKET_IN
 12 0.001010432 172.31.31.144 -> 172.31.23.72 TCP 66 6633 → 51166 [ACK] Seq=1 Ack=124 Win=853 Len=0 TSval=5373358 TSecr=23943484
 13 0.001036873 172.31.31.144 -> 172.31.23.72 TCP 66 6633 → 51160 [ACK] Seq=1 Ack=124 Win=853 Len=0 TSval=5373358 TSecr=23943484
 14 0.001067877 172.31.31.144 -> 172.31.23.72 TCP 66 6633 → 51160 [ACK] Seq=1 Ack=247 Win=853 Len=0 TSval=5373358 TSecr=23943484
 15 0.001187686 172.31.31.144 -> 172.31.23.72 TCP 66 6633 → 51166 [ACK] Seq=1 Ack=247 Win=853 Len=0 TSval=5373358 TSecr=23943484
 16 0.005469466 172.31.23.72 -> 172.31.31.144 OpenFlow 189 Type: OFPT_PACKET_IN
 17 0.005500287 172.31.23.72 -> 172.31.31.144 OpenFlow 189 Type: OFPT_PACKET_IN
 18 0.005528884 172.31.23.72 -> 172.31.31.144 OpenFlow 189 Type: OFPT_PACKET_IN
 19 0.005549301 172.31.23.72 -> 172.31.31.144 OpenFlow 189 Type: OFPT_PACKET_IN
 20 0.005566994 172.31.23.72 -> 172.31.31.144 OpenFlow 189 Type: OFPT_PACKET_IN
 21 0.005569135 172.31.23.72 -> 172.31.31.144 OpenFlow 435 Type: OFPT_PACKET_IN
 22 0.005630046 172.31.23.72 -> 172.31.31.144 OpenFlow 189 Type: OFPT_PACKET_IN
 23 0.005635373 172.31.23.72 -> 172.31.31.144 OpenFlow 189 Type: OFPT_PACKET_IN
 24 0.005686017 172.31.31.144 -> 172.31.23.72 TCP 66 6633 → 51158 [ACK] Seq=1 Ack=124 Win=853 Len=0 TSval=5373359 TSecr=23943485
 25 0.005755210 172.31.31.144 -> 172.31.23.72 TCP 66 6633 → 51156 [ACK] Seq=1 Ack=247 Win=853 Len=0 TSval=5373359 TSecr=23943485
 26 0.005760345 172.31.31.144 -> 172.31.23.72 TCP 66 6633 → 51172 [ACK] Seq=1 Ack=124 Win=853 Len=0 TSval=5373359 TSecr=23943485
 27 0.005780888 172.31.31.144 -> 172.31.23.72 TCP 66 6633 → 51158 [ACK] Seq=1 Ack=493 Win=853 Len=0 TSval=5373359 TSecr=23943485
 28 0.005830812 172.31.31.144 -> 172.31.23.72 TCP 66 6633 → 51172 [ACK] Seq=1 Ack=247 Win=853 Len=0 TSval=5373359 TSecr=23943485
 29 0.005844973 172.31.31.144 -> 172.31.23.72 TCP 66 6633 → 51170 [ACK] Seq=1 Ack=370 Win=853 Len=0 TSval=5373359 TSecr=23943485
 30 0.006066946 172.31.31.144 -> 172.31.23.72 TCP 66 6633 → 51170 [ACK] Seq=1 Ack=493 Win=853 Len=0 TSval=5373359 TSecr=23943485
 31 0.180249898 172.31.31.144 -> 172.31.23.72 TCP 82 6633 → 51126 [PSH, ACK] Seq=1 Ack=1 Win=853 Len=16 TSval=5373403 TSecr=23943334
 32 0.180293350 172.31.31.144 -> 172.31.23.72 TCP 146 6633 → 51126 [PSH, ACK] Seq=17 Ack=1 Win=853 Len=80 TSval=5373403 TSecr=23943334
 33 0.180810195 172.31.23.72 -> 172.31.31.144 OpenFlow 6178 Type: OFPT_MULTIPART_REPLY, OFPMP_TABLE
 34 0.180898090 172.31.23.72 -> 172.31.31.144 OpenFlow 2010 Type: OFPT_MULTIPART_REPLY, OFPMP_FLOW
 35 0.180989078 172.31.23.72 -> 172.31.31.144 OpenFlow 530 Type: OFPT_MULTIPART_REPLY, OFPMP_PORT_STATS
 36 0.181125407 172.31.31.144 -> 172.31.23.72 TCP 66 6633 → 51126 [ACK] Seq=97 Ack=6113 Win=853 Len=0 TSval=5373403 TSecr=23943529
 37 0.181149189 172.31.31.144 -> 172.31.23.72 TCP 66 6633 → 51126 [ACK] Seq=97 Ack=8057 Win=853 Len=0 TSval=5373403 TSecr=23943529
 38 0.181176219 172.31.31.144 -> 172.31.23.72 TCP 66 6633 → 51126 [ACK] Seq=97 Ack=8521 Win=853 Len=0 TSval=5373403 TSecr=23943529
 39 0.213450269 172.31.31.144 -> 172.31.23.72 TCP 122 6633 → 51128 [PSH, ACK] Seq=1 Ack=1 Win=853 Len=56 TSval=5373411 TSecr=23943334
 40 0.213476972 172.31.31.144 -> 172.31.23.72 TCP 106 6633 → 51128 [PSH, ACK] Seq=57 Ack=1 Win=853 Len=40 TSval=5373411 TSecr=23943334
 41 0.213751119 172.31.23.72 -> 172.31.31.144 OpenFlow 2426 Type: OFPT_MULTIPART_REPLY, OFPMP_FLOW
 42 0.213857707 172.31.23.72 -> 172.31.31.144 OpenFlow 642 Type: OFPT_MULTIPART_REPLY, OFPMP_PORT_STATS
 43 0.214029629 172.31.23.72 -> 172.31.31.144 OpenFlow 6178 Type: OFPT_MULTIPART_REPLY, OFPMP_TABLE
 44 0.214121132 172.31.31.144 -> 172.31.23.72 TCP 66 6633 → 51128 [ACK] Seq=97 Ack=2937 Win=853 Len=0 TSval=5373411 TSecr=23943537
 45 0.250647856 172.31.31.144 -> 172.31.23.72 TCP 90 6633 → 51130 [PSH, ACK] Seq=1 Ack=1 Win=853 Len=24 TSval=5373420 TSecr=23943334
 46 0.250906246 172.31.23.72 -> 172.31.31.144 OpenFlow 754 Type: OFPT_MULTIPART_REPLY, OFPMP_PORT_STATS
 47 0.251158414 172.31.31.144 -> 172.31.23.72 TCP 66 6633 → 51128 [ACK] Seq=97 Ack=9049 Win=853 Len=0 TSval=5373421 TSecr=23943537
 48 0.251801176 172.31.31.144 -> 172.31.23.72 OpenFlow 122 Type: OFPT_MULTIPART_REQUEST, OFPMP_FLOW
 49 0.251894748 172.31.31.144 -> 172.31.23.72 OpenFlow 82 Type: OFPT_MULTIPART_REQUEST, OFPMP_TABLE
 50 0.251972167 172.31.23.72 -> 172.31.31.144 OpenFlow 3258 Type: OFPT_MULTIPART_REPLY, OFPMP_FLOW
 51 0.252155693 172.31.23.72 -> 172.31.31.144 OpenFlow 6178 Type: OFPT_MULTIPART_REPLY, OFPMP_TABLE
 52 0.252366731 172.31.31.144 -> 172.31.23.72 TCP 66 6633 → 51130 [ACK] Seq=97 Ack=9993 Win=853 Len=0 TSval=5373421 TSecr=23943546
 53 0.300049637 172.31.31.144 -> 172.31.23.72 TCP 90 6633 → 51132 [PSH, ACK] Seq=1 Ack=1 Win=853 Len=24 TSval=5373433 TSecr=23943334
 54 0.300084292 172.31.31.144 -> 172.31.23.72 TCP 138 6633 → 51132 [PSH, ACK] Seq=25 Ack=1 Win=853 Len=72 TSval=5373433 TSecr=23943334
 55 0.300261952 172.31.23.72 -> 172.31.31.144 OpenFlow 642 Type: OFPT_MULTIPART_REPLY, OFPMP_PORT_STATS
 56 0.300459382 172.31.23.72 -> 172.31.31.144 OpenFlow 6178 Type: OFPT_MULTIPART_REPLY, OFPMP_TABLE
 57 0.300528453 172.31.23.72 -> 172.31.31.144 OpenFlow 2218 Type: OFPT_MULTIPART_REPLY, OFPMP_FLOW
 58 0.300619684 172.31.31.144 -> 172.31.23.72 TCP 66 6633 → 51132 [ACK] Seq=97 Ack=577 Win=853 Len=0 TSval=5373433 TSecr=23943558
 59 0.300726661 172.31.31.144 -> 172.31.23.72 TCP 66 6633 → 51132 [ACK] Seq=97 Ack=6689 Win=853 Len=0 TSval=5373433 TSecr=23943558
 60 0.300753113 172.31.31.144 -> 172.31.23.72 TCP 66 6633 → 51132 [ACK] Seq=97 Ack=8841 Win=853 Len=0 TSval=5373433 TSecr=23943558
 61 0.340504196 172.31.31.144 -> 172.31.23.72 TCP 122 6633 → 51134 [PSH, ACK] Seq=1 Ack=1 Win=853 Len=56 TSval=5373443 TSecr=23943334
 62 0.340515260 172.31.31.144 -> 172.31.23.72 TCP 106 6633 → 51134 [PSH, ACK] Seq=57 Ack=1 Win=853 Len=40 TSval=5373443 TSecr=23943334
 63 0.340726235 172.31.23.72 -> 172.31.31.144 OpenFlow 346 Type: OFPT_MULTIPART_REPLY, OFPMP_FLOW
 64 0.340879380 172.31.23.72 -> 172.31.31.144 OpenFlow 6178 Type: OFPT_MULTIPART_REPLY, OFPMP_TABLE
 65 0.340959016 172.31.23.72 -> 172.31.31.144 OpenFlow 530 Type: OFPT_MULTIPART_REPLY, OFPMP_PORT_STATS
 66 0.340968569 172.31.31.144 -> 172.31.23.72 TCP 66 6633 → 51134 [ACK] Seq=97 Ack=281 Win=853 Len=0 TSval=5373443 TSecr=23943569
 67 0.341098820 172.31.31.144 -> 172.31.23.72 TCP 66 6633 → 51134 [ACK] Seq=97 Ack=6393 Win=853 Len=0 TSval=5373443 TSecr=23943569
 68 0.341128138 172.31.31.144 -> 172.31.23.72 TCP 66 6633 → 51134 [ACK] Seq=97 Ack=6857 Win=853 Len=0 TSval=5373443 TSecr=23943569
 69 0.424630664 172.31.31.144 -> 172.31.23.72 TCP 82 6633 → 51136 [PSH, ACK] Seq=1 Ack=1 Win=853 Len=16 TSval=5373464 TSecr=23943335
 70 0.424670084 172.31.31.144 -> 172.31.23.72 TCP 146 6633 → 51136 [PSH, ACK] Seq=17 Ack=1 Win=853 Len=80 TSval=5373464 TSecr=23943335
 71 0.425035974 172.31.23.72 -> 172.31.31.144 OpenFlow 6178 Type: OFPT_MULTIPART_REPLY, OFPMP_TABLE
 72 0.425116022 172.31.23.72 -> 172.31.31.144 OpenFlow 2218 Type: OFPT_MULTIPART_REPLY, OFPMP_FLOW
 73 0.425234488 172.31.23.72 -> 172.31.31.144 OpenFlow 754 Type: OFPT_MULTIPART_REPLY, OFPMP_PORT_STATS
 74 0.425340496 172.31.31.144 -> 172.31.23.72 TCP 66 6633 → 51136 [ACK] Seq=97 Ack=6113 Win=853 Len=0 TSval=5373464 TSecr=23943590
 75 0.425380697 172.31.31.144 -> 172.31.23.72 TCP 66 6633 → 51136 [ACK] Seq=97 Ack=8265 Win=853 Len=0 TSval=5373464 TSecr=23943590
 76 0.425408641 172.31.31.144 -> 172.31.23.72 TCP 66 6633 → 51136 [ACK] Seq=97 Ack=8953 Win=853 Len=0 TSval=5373464 TSecr=23943590
 77 0.466847013 172.31.31.144 -> 172.31.23.72 TCP 90 6633 → 51138 [PSH, ACK] Seq=1 Ack=1 Win=853 Len=24 TSval=5373474 TSecr=23943335
 78 0.466877454 172.31.31.144 -> 172.31.23.72 TCP 138 6633 → 51138 [PSH, ACK] Seq=25 Ack=1 Win=853 Len=72 TSval=5373474 TSecr=23943335
 79 0.467144642 172.31.23.72 -> 172.31.31.144 OpenFlow 754 Type: OFPT_MULTIPART_REPLY, OFPMP_PORT_STATS
 80 0.467226058 172.31.23.72 -> 172.31.31.144 OpenFlow 2010 Type: OFPT_MULTIPART_REPLY, OFPMP_FLOW
 81 0.467363509 172.31.23.72 -> 172.31.31.144 OpenFlow 6178 Type: OFPT_MULTIPART_REPLY, OFPMP_TABLE
 82 0.467511297 172.31.31.144 -> 172.31.23.72 TCP 66 6633 → 51138 [ACK] Seq=97 Ack=2633 Win=853 Len=0 TSval=5373475 TSecr=23943600
 83 0.480058750 172.31.31.144 -> 172.31.23.72 TCP 90 6633 → 51140 [PSH, ACK] Seq=1 Ack=1 Win=853 Len=24 TSval=5373478 TSecr=23943334
 84 0.480065544 172.31.31.144 -> 172.31.23.72 TCP 138 6633 → 51140 [PSH, ACK] Seq=25 Ack=1 Win=853 Len=72 TSval=5373478 TSecr=23943334
 85 0.480212962 172.31.23.72 -> 172.31.31.144 OpenFlow 530 Type: OFPT_MULTIPART_REPLY, OFPMP_PORT_STATS
 86 0.480261151 172.31.23.72 -> 172.31.31.144 OpenFlow 970 Type: OFPT_MULTIPART_REPLY, OFPMP_FLOW
 87 0.480407723 172.31.23.72 -> 172.31.31.144 OpenFlow 6178 Type: OFPT_MULTIPART_REPLY, OFPMP_TABLE
 88 0.480450294 172.31.31.144 -> 172.31.23.72 TCP 66 6633 → 51140 [ACK] Seq=97 Ack=465 Win=853 Len=0 TSval=5373478 TSecr=23943603
 89 0.480489614 172.31.31.144 -> 172.31.23.72 TCP 66 6633 → 51140 [ACK] Seq=97 Ack=1369 Win=853 Len=0 TSval=5373478 TSecr=23943603
 90 0.480640663 172.31.31.144 -> 172.31.23.72 TCP 66 6633 → 51140 [ACK] Seq=97 Ack=7481 Win=853 Len=0 TSval=5373478 TSecr=23943603
 91 0.507204604 172.31.31.144 -> 172.31.23.72 TCP 66 6633 → 51138 [ACK] Seq=97 Ack=8745 Win=853 Len=0 TSval=5373485 TSecr=23943600
 92 0.557437682 172.31.31.144 -> 172.31.23.72 TCP 82 6633 → 51142 [PSH, ACK] Seq=1 Ack=1 Win=853 Len=16 TSval=5373497 TSecr=23943335
 93 0.557484270 172.31.31.144 -> 172.31.23.72 TCP 146 6633 → 51142 [PSH, ACK] Seq=17 Ack=1 Win=853 Len=80 TSval=5373497 TSecr=23943335
 94 0.557871824 172.31.23.72 -> 172.31.31.144 OpenFlow 6178 Type: OFPT_MULTIPART_REPLY, OFPMP_TABLE
 95 0.558004506 172.31.23.72 -> 172.31.31.144 OpenFlow 754 Type: OFPT_MULTIPART_REPLY, OFPMP_PORT_STATS
 96 0.558104194 172.31.23.72 -> 172.31.31.144 OpenFlow 3882 Type: OFPT_MULTIPART_REPLY, OFPMP_FLOW
 97 0.558202993 172.31.31.144 -> 172.31.23.72 TCP 66 6633 → 51142 [ACK] Seq=97 Ack=6801 Win=853 Len=0 TSval=5373497 TSecr=23943623
 98 0.586674718 172.31.31.144 -> 172.31.23.72 TCP 122 6633 → 51144 [PSH, ACK] Seq=1 Ack=1 Win=853 Len=56 TSval=5373504 TSecr=23943335
 99 0.586694998 172.31.31.144 -> 172.31.23.72 TCP 90 6633 → 51144 [PSH, ACK] Seq=57 Ack=1 Win=853 Len=24 TSval=5373504 TSecr=23943335
100 0.586893344 172.31.23.72 -> 172.31.31.144 OpenFlow 1594 Type: OFPT_MULTIPART_REPLY, OFPMP_FLOW
101 0.587017982 172.31.23.72 -> 172.31.31.144 OpenFlow 642 Type: OFPT_MULTIPART_REPLY, OFPMP_PORT_STATS
102 0.587233874 172.31.31.144 -> 172.31.23.72 TCP 66 6633 → 51144 [ACK] Seq=81 Ack=2105 Win=853 Len=0 TSval=5373505 TSecr=23943630
103 0.587817753 172.31.31.144 -> 172.31.23.72 OpenFlow 82 Type: OFPT_MULTIPART_REQUEST, OFPMP_TABLE
104 0.588077736 172.31.23.72 -> 172.31.31.144 OpenFlow 6178 Type: OFPT_MULTIPART_REPLY, OFPMP_TABLE
105 0.595239656 172.31.31.144 -> 172.31.23.72 TCP 66 6633 → 51142 [ACK] Seq=97 Ack=10617 Win=853 Len=0 TSval=5373507 TSecr=23943623
106 0.626418650 172.31.31.144 -> 172.31.23.72 TCP 90 6633 → 51146 [PSH, ACK] Seq=1 Ack=1 Win=853 Len=24 TSval=5373514 TSecr=23943433
107 0.626437242 172.31.31.144 -> 172.31.23.72 TCP 138 6633 → 51146 [PSH, ACK] Seq=25 Ack=1 Win=853 Len=72 TSval=5373514 TSecr=23943433
108 0.626628668 172.31.23.72 -> 172.31.31.144 OpenFlow 754 Type: OFPT_MULTIPART_REPLY, OFPMP_PORT_STATS
109 0.626708023 172.31.23.72 -> 172.31.31.144 OpenFlow 2426 Type: OFPT_MULTIPART_REPLY, OFPMP_FLOW
110 0.626863846 172.31.23.72 -> 172.31.31.144 OpenFlow 6178 Type: OFPT_MULTIPART_REPLY, OFPMP_TABLE
111 0.626882911 172.31.31.144 -> 172.31.23.72 TCP 66 6633 → 51146 [ACK] Seq=97 Ack=3049 Win=853 Len=0 TSval=5373514 TSecr=23943640
112 0.627107923 172.31.31.144 -> 172.31.23.72 TCP 66 6633 → 51144 [ACK] Seq=97 Ack=8217 Win=853 Len=0 TSval=5373515 TSecr=23943630
113 0.667185041 172.31.31.144 -> 172.31.23.72 TCP 66 6633 → 51146 [ACK] Seq=97 Ack=9161 Win=853 Len=0 TSval=5373525 TSecr=23943640
114 0.673234140 172.31.31.144 -> 172.31.23.72 TCP 90 6633 → 51148 [PSH, ACK] Seq=1 Ack=1 Win=853 Len=24 TSval=5373526 TSecr=23943382
115 0.673268732 172.31.31.144 -> 172.31.23.72 TCP 138 6633 → 51148 [PSH, ACK] Seq=25 Ack=1 Win=853 Len=72 TSval=5373526 TSecr=23943382
116 0.673408276 172.31.23.72 -> 172.31.31.144 OpenFlow 642 Type: OFPT_MULTIPART_REPLY, OFPMP_PORT_STATS
117 0.673561687 172.31.23.72 -> 172.31.31.144 OpenFlow 6178 Type: OFPT_MULTIPART_REPLY, OFPMP_TABLE
118 0.673627448 172.31.23.72 -> 172.31.31.144 OpenFlow 1802 Type: OFPT_MULTIPART_REPLY, OFPMP_FLOW
119 0.673853058 172.31.31.144 -> 172.31.23.72 TCP 66 6633 → 51148 [ACK] Seq=97 Ack=6689 Win=853 Len=0 TSval=5373526 TSecr=23943652
120 0.711227208 172.31.31.144 -> 172.31.23.72 TCP 66 6633 → 51148 [ACK] Seq=97 Ack=8425 Win=853 Len=0 TSval=5373536 TSecr=23943652
121 0.721489076 172.31.31.144 -> 172.31.23.72 TCP 122 6633 → 51150 [PSH, ACK] Seq=1 Ack=1 Win=853 Len=56 TSval=5373538 TSecr=23943432
122 0.721516485 172.31.31.144 -> 172.31.23.72 TCP 106 6633 → 51150 [PSH, ACK] Seq=57 Ack=1 Win=853 Len=40 TSval=5373538 TSecr=23943432
123 0.721726350 172.31.23.72 -> 172.31.31.144 OpenFlow 1178 Type: OFPT_MULTIPART_REPLY, OFPMP_FLOW
124 0.721895681 172.31.23.72 -> 172.31.31.144 OpenFlow 6178 Type: OFPT_MULTIPART_REPLY, OFPMP_TABLE
125 0.721999088 172.31.23.72 -> 172.31.31.144 OpenFlow 642 Type: OFPT_MULTIPART_REPLY, OFPMP_PORT_STATS
126 0.722168635 172.31.31.144 -> 172.31.23.72 TCP 66 6633 → 51150 [ACK] Seq=97 Ack=7225 Win=853 Len=0 TSval=5373538 TSecr=23943664
127 0.759219232 172.31.31.144 -> 172.31.23.72 TCP 66 6633 → 51150 [ACK] Seq=97 Ack=7801 Win=853 Len=0 TSval=5373548 TSecr=23943664
128 0.772742045 172.31.31.144 -> 172.31.23.72 TCP 122 6633 → 51152 [PSH, ACK] Seq=1 Ack=1 Win=853 Len=56 TSval=5373551 TSecr=23943432
129 0.772764260 172.31.31.144 -> 172.31.23.72 TCP 106 6633 → 51152 [PSH, ACK] Seq=57 Ack=1 Win=853 Len=40 TSval=5373551 TSecr=23943432
130 0.772962535 172.31.23.72 -> 172.31.31.144 OpenFlow 1178 Type: OFPT_MULTIPART_REPLY, OFPMP_FLOW
131 0.773112863 172.31.23.72 -> 172.31.31.144 OpenFlow 530 Type: OFPT_MULTIPART_REPLY, OFPMP_PORT_STATS
132 0.773263331 172.31.23.72 -> 172.31.31.144 OpenFlow 6178 Type: OFPT_MULTIPART_REPLY, OFPMP_TABLE
133 0.773292092 172.31.31.144 -> 172.31.23.72 TCP 66 6633 → 51152 [ACK] Seq=97 Ack=1577 Win=853 Len=0 TSval=5373551 TSecr=23943677
134 0.811204163 172.31.31.144 -> 172.31.23.72 TCP 66 6633 → 51152 [ACK] Seq=97 Ack=7689 Win=853 Len=0 TSval=5373561 TSecr=23943677
135 0.831046734 172.31.31.144 -> 172.31.23.72 TCP 90 6633 → 51154 [PSH, ACK] Seq=1 Ack=1 Win=853 Len=24 TSval=5373565 TSecr=23943433
136 0.831489926 172.31.23.72 -> 172.31.31.144 OpenFlow 530 Type: OFPT_MULTIPART_REPLY, OFPMP_PORT_STATS
137 0.831503413 172.31.31.144 -> 172.31.23.72 OpenFlow 122 Type: OFPT_MULTIPART_REQUEST, OFPMP_FLOW
138 0.831506567 172.31.31.144 -> 172.31.23.72 OpenFlow 82 Type: OFPT_MULTIPART_REQUEST, OFPMP_TABLE
139 0.831580005 172.31.23.72 -> 172.31.31.144 OpenFlow 1802 Type: OFPT_MULTIPART_REPLY, OFPMP_FLOW
140 0.831740278 172.31.23.72 -> 172.31.31.144 OpenFlow 6178 Type: OFPT_MULTIPART_REPLY, OFPMP_TABLE
141 0.832298922 172.31.31.144 -> 172.31.23.72 TCP 66 6633 → 51154 [ACK] Seq=97 Ack=2201 Win=853 Len=0 TSval=5373566 TSecr=23943691
142 0.871216816 172.31.31.144 -> 172.31.23.72 TCP 66 6633 → 51154 [ACK] Seq=97 Ack=8313 Win=853 Len=0 TSval=5373576 TSecr=23943691
143 0.890506135 172.31.31.144 -> 172.31.23.72 OpenFlow 90 Type: OFPT_MULTIPART_REQUEST, OFPMP_PORT_STATS
144 0.890535814 172.31.31.144 -> 172.31.23.72 OpenFlow 138 Type: OFPT_MULTIPART_REQUEST, OFPMP_TABLE
145 0.890830180 172.31.23.72 -> 172.31.31.144 OpenFlow 754 Type: OFPT_MULTIPART_REPLY, OFPMP_PORT_STATS
146 0.890926144 172.31.23.72 -> 172.31.31.144 OpenFlow 2634 Type: OFPT_MULTIPART_REPLY, OFPMP_FLOW
147 0.891092492 172.31.23.72 -> 172.31.31.144 OpenFlow 6178 Type: OFPT_MULTIPART_REPLY, OFPMP_TABLE
148 0.891103173 172.31.31.144 -> 172.31.23.72 TCP 66 6633 → 51156 [ACK] Seq=97 Ack=935 Win=853 Len=0 TSval=5373581 TSecr=23943706
149 0.891114517 172.31.31.144 -> 172.31.23.72 TCP 66 6633 → 51156 [ACK] Seq=97 Ack=3503 Win=853 Len=0 TSval=5373581 TSecr=23943706
150 0.891313072 172.31.31.144 -> 172.31.23.72 TCP 66 6633 → 51156 [ACK] Seq=97 Ack=9615 Win=853 Len=0 TSval=5373581 TSecr=23943706
151 0.940178348 172.31.31.144 -> 172.31.23.72 OpenFlow 90 Type: OFPT_MULTIPART_REQUEST, OFPMP_PORT_STATS
152 0.940196937 172.31.31.144 -> 172.31.23.72 OpenFlow 138 Type: OFPT_MULTIPART_REQUEST, OFPMP_FLOW
153 0.940510213 172.31.23.72 -> 172.31.31.144 OpenFlow 754 Type: OFPT_MULTIPART_REPLY, OFPMP_PORT_STATS
154 0.940700055 172.31.23.72 -> 172.31.31.144 OpenFlow 6178 Type: OFPT_MULTIPART_REPLY, OFPMP_TABLE
155 0.941158660 172.31.23.72 -> 172.31.31.144 OpenFlow 2634 Type: OFPT_MULTIPART_REPLY, OFPMP_FLOW
156 0.942191070 172.31.31.144 -> 172.31.23.72 TCP 66 6633 → 51158 [ACK] Seq=97 Ack=1181 Win=853 Len=0 TSval=5373593 TSecr=23943718
157 0.942197919 172.31.31.144 -> 172.31.23.72 TCP 66 6633 → 51158 [ACK] Seq=97 Ack=7293 Win=853 Len=0 TSval=5373593 TSecr=23943719
158 0.942199967 172.31.31.144 -> 172.31.23.72 TCP 66 6633 → 51158 [ACK] Seq=97 Ack=9861 Win=853 Len=0 TSval=5373593 TSecr=23943719
159 1.046688174 172.31.31.144 -> 172.31.23.72 OpenFlow 82 Type: OFPT_MULTIPART_REQUEST, OFPMP_TABLE
160 1.046717578 172.31.23.72 -> 172.31.31.144 TCP 66 51160 → 6633 [ACK] Seq=247 Ack=17 Win=213 Len=0 TSval=23943745 TSecr=5373619
161 1.046735072 172.31.31.144 -> 172.31.23.72 OpenFlow 90 Type: OFPT_MULTIPART_REQUEST, OFPMP_PORT_STATS
162 1.046740759 172.31.23.72 -> 172.31.31.144 TCP 66 51160 → 6633 [ACK] Seq=247 Ack=41 Win=213 Len=0 TSval=23943745 TSecr=5373619
163 1.046742774 172.31.31.144 -> 172.31.23.72 OpenFlow 122 Type: OFPT_MULTIPART_REQUEST, OFPMP_FLOW
164 1.046745267 172.31.23.72 -> 172.31.31.144 TCP 66 51160 → 6633 [ACK] Seq=247 Ack=97 Win=213 Len=0 TSval=23943745 TSecr=5373619
165 1.047161355 172.31.23.72 -> 172.31.31.144 OpenFlow 6178 Type: OFPT_MULTIPART_REPLY, OFPMP_TABLE
166 1.047256274 172.31.23.72 -> 172.31.31.144 OpenFlow 530 Type: OFPT_MULTIPART_REPLY, OFPMP_PORT_STATS
167 1.047324317 172.31.23.72 -> 172.31.31.144 OpenFlow 2010 Type: OFPT_MULTIPART_REPLY, OFPMP_FLOW
168 1.048103992 172.31.31.144 -> 172.31.23.72 TCP 66 6633 → 51160 [ACK] Seq=97 Ack=6359 Win=853 Len=0 TSval=5373620 TSecr=23943745
169 1.048193994 172.31.31.144 -> 172.31.23.72 TCP 66 6633 → 51160 [ACK] Seq=97 Ack=6823 Win=853 Len=0 TSval=5373620 TSecr=23943745
170 1.048196476 172.31.31.144 -> 172.31.23.72 TCP 66 6633 → 51160 [ACK] Seq=97 Ack=8767 Win=853 Len=0 TSval=5373620 TSecr=23943745
171 1.134377732 172.31.31.144 -> 172.31.23.72 TCP 122 6633 → 51162 [PSH, ACK] Seq=1 Ack=1 Win=853 Len=56 TSval=5373641 TSecr=23943433
172 1.134400819 172.31.31.144 -> 172.31.23.72 TCP 90 6633 → 51162 [PSH, ACK] Seq=57 Ack=1 Win=853 Len=24 TSval=5373641 TSecr=23943433
173 1.134418257 172.31.31.144 -> 172.31.23.72 TCP 82 6633 → 51162 [PSH, ACK] Seq=81 Ack=1 Win=853 Len=16 TSval=5373641 TSecr=23943433
174 1.134707590 172.31.23.72 -> 172.31.31.144 OpenFlow 2218 Type: OFPT_MULTIPART_REPLY, OFPMP_FLOW
175 1.134821290 172.31.23.72 -> 172.31.31.144 OpenFlow 530 Type: OFPT_MULTIPART_REPLY, OFPMP_PORT_STATS
176 1.134965007 172.31.31.144 -> 172.31.23.72 TCP 66 6633 → 51162 [ACK] Seq=97 Ack=2153 Win=853 Len=0 TSval=5373641 TSecr=23943767
177 1.134982936 172.31.31.144 -> 172.31.23.72 TCP 66 6633 → 51162 [ACK] Seq=97 Ack=2617 Win=853 Len=0 TSval=5373641 TSecr=23943767
178 1.135005631 172.31.23.72 -> 172.31.31.144 OpenFlow 6178 Type: OFPT_MULTIPART_REPLY, OFPMP_TABLE
179 1.135228058 172.31.31.144 -> 172.31.23.72 TCP 66 6633 → 51162 [ACK] Seq=97 Ack=8729 Win=853 Len=0 TSval=5373642 TSecr=23943767
180 1.162369743 172.31.31.144 -> 172.31.23.72 TCP 122 6633 → 51164 [PSH, ACK] Seq=1 Ack=1 Win=853 Len=56 TSval=5373648 TSecr=23943457
181 1.162379163 172.31.31.144 -> 172.31.23.72 TCP 106 6633 → 51164 [PSH, ACK] Seq=57 Ack=1 Win=853 Len=40 TSval=5373648 TSecr=23943457
182 1.162518244 172.31.23.72 -> 172.31.31.144 OpenFlow 2426 Type: OFPT_MULTIPART_REPLY, OFPMP_FLOW
183 1.162626980 172.31.23.72 -> 172.31.31.144 OpenFlow 642 Type: OFPT_MULTIPART_REPLY, OFPMP_PORT_STATS
184 1.162772773 172.31.23.72 -> 172.31.31.144 OpenFlow 6178 Type: OFPT_MULTIPART_REPLY, OFPMP_TABLE
185 1.162827052 172.31.31.144 -> 172.31.23.72 TCP 66 6633 → 51164 [ACK] Seq=97 Ack=2361 Win=853 Len=0 TSval=5373648 TSecr=23943774
186 1.162834015 172.31.31.144 -> 172.31.23.72 TCP 66 6633 → 51164 [ACK] Seq=97 Ack=2937 Win=853 Len=0 TSval=5373648 TSecr=23943774
187 1.162979446 172.31.31.144 -> 172.31.23.72 TCP 66 6633 → 51164 [ACK] Seq=97 Ack=9049 Win=853 Len=0 TSval=5373648 TSecr=23943774
188 1.236068022 172.31.31.144 -> 172.31.23.72 OpenFlow 122 Type: OFPT_MULTIPART_REQUEST, OFPMP_FLOW
189 1.236105392 172.31.31.144 -> 172.31.23.72 OpenFlow 106 Type: OFPT_MULTIPART_REQUEST, OFPMP_PORT_STATS
190 1.236436582 172.31.23.72 -> 172.31.31.144 OpenFlow 2426 Type: OFPT_MULTIPART_REPLY, OFPMP_FLOW
191 1.236635911 172.31.23.72 -> 172.31.31.144 OpenFlow 6178 Type: OFPT_MULTIPART_REPLY, OFPMP_TABLE
192 1.236746710 172.31.23.72 -> 172.31.31.144 OpenFlow 642 Type: OFPT_MULTIPART_REPLY, OFPMP_PORT_STATS
193 1.239338511 172.31.31.144 -> 172.31.23.72 TCP 66 6633 → 51166 [ACK] Seq=97 Ack=2607 Win=853 Len=0 TSval=5373667 TSecr=23943792
194 1.239598337 172.31.31.144 -> 172.31.23.72 TCP 66 6633 → 51166 [ACK] Seq=97 Ack=8719 Win=853 Len=0 TSval=5373667 TSecr=23943793
195 1.239910514 172.31.31.144 -> 172.31.23.72 TCP 66 6633 → 51166 [ACK] Seq=97 Ack=9295 Win=853 Len=0 TSval=5373667 TSecr=23943793
196 1.292065761 172.31.31.144 -> 172.31.23.72 OpenFlow 122 Type: OFPT_MULTIPART_REQUEST, OFPMP_FLOW
197 1.292089253 172.31.31.144 -> 172.31.23.72 OpenFlow 106 Type: OFPT_MULTIPART_REQUEST, OFPMP_TABLE
198 1.292312191 172.31.23.72 -> 172.31.31.144 OpenFlow 554 Type: OFPT_MULTIPART_REPLY, OFPMP_FLOW
199 1.292424945 172.31.23.72 -> 172.31.31.144 OpenFlow 642 Type: OFPT_MULTIPART_REPLY, OFPMP_PORT_STATS
200 1.292547516 172.31.31.144 -> 172.31.23.72 TCP 66 6633 → 51168 [ACK] Seq=97 Ack=735 Win=853 Len=0 TSval=5373681 TSecr=23943806
201 1.292612398 172.31.31.144 -> 172.31.23.72 TCP 66 6633 → 51168 [ACK] Seq=97 Ack=1311 Win=853 Len=0 TSval=5373681 TSecr=23943806
202 1.292629830 172.31.23.72 -> 172.31.31.144 OpenFlow 6178 Type: OFPT_MULTIPART_REPLY, OFPMP_TABLE
203 1.292861296 172.31.31.144 -> 172.31.23.72 TCP 66 6633 → 51168 [ACK] Seq=97 Ack=7423 Win=853 Len=0 TSval=5373681 TSecr=23943807
204 1.306141996 172.31.31.144 -> 172.31.23.72 OpenFlow 122 Type: OFPT_MULTIPART_REQUEST, OFPMP_FLOW
205 1.306151151 172.31.31.144 -> 172.31.23.72 OpenFlow 106 Type: OFPT_MULTIPART_REQUEST, OFPMP_PORT_STATS
206 1.306337763 172.31.23.72 -> 172.31.31.144 OpenFlow 2010 Type: OFPT_MULTIPART_REPLY, OFPMP_FLOW
207 1.306484724 172.31.23.72 -> 172.31.31.144 OpenFlow 6178 Type: OFPT_MULTIPART_REPLY, OFPMP_TABLE
208 1.306926138 172.31.23.72 -> 172.31.31.144 OpenFlow 642 Type: OFPT_MULTIPART_REPLY, OFPMP_PORT_STATS
209 1.308970507 172.31.31.144 -> 172.31.23.72 TCP 66 6633 → 51170 [ACK] Seq=97 Ack=2437 Win=853 Len=0 TSval=5373684 TSecr=23943810
210 1.308977484 172.31.31.144 -> 172.31.23.72 TCP 66 6633 → 51170 [ACK] Seq=97 Ack=8549 Win=853 Len=0 TSval=5373684 TSecr=23943810
211 1.309300236 172.31.31.144 -> 172.31.23.72 TCP 66 6633 → 51170 [ACK] Seq=97 Ack=9125 Win=853 Len=0 TSval=5373685 TSecr=23943810
212 1.334503756 172.31.31.144 -> 172.31.23.72 OpenFlow 90 Type: OFPT_MULTIPART_REQUEST, OFPMP_PORT_STATS
213 1.334515352 172.31.31.144 -> 172.31.23.72 OpenFlow 122 Type: OFPT_MULTIPART_REQUEST, OFPMP_FLOW
214 1.334574609 172.31.31.144 -> 172.31.23.72 OpenFlow 82 Type: OFPT_MULTIPART_REQUEST, OFPMP_TABLE
215 1.334740866 172.31.23.72 -> 172.31.31.144 OpenFlow 530 Type: OFPT_MULTIPART_REPLY, OFPMP_PORT_STATS
216 1.334815328 172.31.23.72 -> 172.31.31.144 OpenFlow 2010 Type: OFPT_MULTIPART_REPLY, OFPMP_FLOW
217 1.334963549 172.31.23.72 -> 172.31.31.144 OpenFlow 6178 Type: OFPT_MULTIPART_REPLY, OFPMP_TABLE
218 1.335137947 172.31.31.144 -> 172.31.23.72 TCP 66 6633 → 51172 [ACK] Seq=97 Ack=711 Win=853 Len=0 TSval=5373691 TSecr=23943817
219 1.335144419 172.31.31.144 -> 172.31.23.72 TCP 66 6633 → 51172 [ACK] Seq=97 Ack=2655 Win=853 Len=0 TSval=5373691 TSecr=23943817
220 1.335409959 172.31.31.144 -> 172.31.23.72 TCP 66 6633 → 51172 [ACK] Seq=97 Ack=8767 Win=853 Len=0 TSval=5373692 TSecr=23943817
221 1.995509194 172.31.31.144 -> 172.31.23.72 OpenFlow 187 Type: OFPT_PACKET_OUT
222 1.995551816 172.31.31.144 -> 172.31.23.72 OpenFlow 187 Type: OFPT_PACKET_OUT
223 1.995572363 172.31.31.144 -> 172.31.23.72 OpenFlow 187 Type: OFPT_PACKET_OUT
224 1.995647389 172.31.31.144 -> 172.31.23.72 OpenFlow 187 Type: OFPT_PACKET_OUT
225 1.995724306 172.31.31.144 -> 172.31.23.72 OpenFlow 187 Type: OFPT_PACKET_OUT
226 1.995790223 172.31.31.144 -> 172.31.23.72 OpenFlow 187 Type: OFPT_PACKET_OUT
227 1.995937663 172.31.31.144 -> 172.31.23.72 OpenFlow 187 Type: OFPT_PACKET_OUT
228 1.995966585 172.31.31.144 -> 172.31.23.72 OpenFlow 187 Type: OFPT_PACKET_OUT
229 1.996032076 172.31.31.144 -> 172.31.23.72 OpenFlow 187 Type: OFPT_PACKET_OUT
230 1.996103368 172.31.31.144 -> 172.31.23.72 OpenFlow 187 Type: OFPT_PACKET_OUT
231 1.996169909 172.31.31.144 -> 172.31.23.72 OpenFlow 187 Type: OFPT_PACKET_OUT
232 1.996203580 172.31.23.72 -> 172.31.31.144 TCP 66 51126 → 6633 [ACK] Seq=8521 Ack=823 Win=387 Len=0 TSval=23943982 TSecr=5373857
233 1.996264699 172.31.31.144 -> 172.31.23.72 OpenFlow 187 Type: OFPT_PACKET_OUT
234 1.996330523 172.31.31.144 -> 172.31.23.72 OpenFlow 187 Type: OFPT_PACKET_OUT
235 1.996448037 172.31.31.144 -> 172.31.23.72 OpenFlow 187 Type: OFPT_PACKET_OUT
236 1.996462844 172.31.23.72 -> 172.31.31.144 OpenFlow 189 Type: OFPT_PACKET_IN
237 1.996510029 172.31.23.72 -> 172.31.31.144 OpenFlow 189 Type: OFPT_PACKET_IN
238 1.996610531 172.31.23.72 -> 172.31.31.144 OpenFlow 189 Type: OFPT_PACKET_IN
239 1.996617402 172.31.23.72 -> 172.31.31.144 OpenFlow 189 Type: OFPT_PACKET_IN
240 1.996824390 172.31.31.144 -> 172.31.23.72 OpenFlow 187 Type: OFPT_PACKET_OUT
241 1.996905118 172.31.23.72 -> 172.31.31.144 OpenFlow 189 Type: OFPT_PACKET_IN
242 1.997037144 172.31.23.72 -> 172.31.31.144 OpenFlow 189 Type: OFPT_PACKET_IN
243 1.997052483 172.31.23.72 -> 172.31.31.144 OpenFlow 189 Type: OFPT_PACKET_IN
244 1.997149171 172.31.23.72 -> 172.31.31.144 OpenFlow 189 Type: OFPT_PACKET_IN
245 1.997232983 172.31.31.144 -> 172.31.23.72 TCP 66 6633 → 51128 [ACK] Seq=1065 Ack=9172 Win=853 Len=0 TSval=5373857 TSecr=23943982
246 1.997240443 172.31.31.144 -> 172.31.23.72 OpenFlow 187 Type: OFPT_PACKET_OUT
247 1.997242448 172.31.31.144 -> 172.31.23.72 TCP 66 6633 → 51128 [ACK] Seq=1065 Ack=9295 Win=853 Len=0 TSval=5373857 TSecr=23943983
248 1.997244528 172.31.31.144 -> 172.31.23.72 OpenFlow 187 Type: OFPT_PACKET_OUT
249 1.997248919 172.31.23.72 -> 172.31.31.144 OpenFlow 189 Type: OFPT_PACKET_IN
250 1.997256257 172.31.31.144 -> 172.31.23.72 TCP 66 6633 → 51136 [ACK] Seq=97 Ack=9076 Win=853 Len=0 TSval=5373857 TSecr=23943982
251 1.997259642 172.31.23.72 -> 172.31.31.144 OpenFlow 189 Type: OFPT_PACKET_IN
252 1.997261206 172.31.31.144 -> 172.31.23.72 OpenFlow 187 Type: OFPT_PACKET_OUT
253 1.997268258 172.31.23.72 -> 172.31.31.144 OpenFlow 189 Type: OFPT_PACKET_IN
254 1.997340407 172.31.31.144 -> 172.31.23.72 OpenFlow 187 Type: OFPT_PACKET_OUT
255 1.997345843 172.31.31.144 -> 172.31.23.72 TCP 66 6633 → 51136 [ACK] Seq=97 Ack=9199 Win=853 Len=0 TSval=5373857 TSecr=23943983
256 1.997519316 172.31.23.72 -> 172.31.31.144 TCP 66 51130 → 6633 [ACK] Seq=10239 Ack=702 Win=213 Len=0 TSval=23943983 TSecr=5373857
257 1.997576615 172.31.23.72 -> 172.31.31.144 OpenFlow 189 Type: OFPT_PACKET_IN
258 1.997707626 172.31.23.72 -> 172.31.31.144 OpenFlow 189 Type: OFPT_PACKET_IN
259 1.997967519 172.31.31.144 -> 172.31.23.72 OpenFlow 187 Type: OFPT_PACKET_OUT
260 1.997974638 172.31.31.144 -> 172.31.23.72 OpenFlow 187 Type: OFPT_PACKET_OUT
261 1.997976576 172.31.31.144 -> 172.31.23.72 TCP 66 6633 → 51128 [ACK] Seq=1065 Ack=9418 Win=853 Len=0 TSval=5373857 TSecr=23943983
262 1.997979709 172.31.31.144 -> 172.31.23.72 OpenFlow 187 Type: OFPT_PACKET_OUT
263 1.997981373 172.31.31.144 -> 172.31.23.72 OpenFlow 187 Type: OFPT_PACKET_OUT
264 1.997982855 172.31.31.144 -> 172.31.23.72 OpenFlow 187 Type: OFPT_PACKET_OUT
265 1.998037421 172.31.23.72 -> 172.31.31.144 OpenFlow 189 Type: OFPT_PACKET_IN
266 1.998220121 172.31.23.72 -> 172.31.31.144 TCP 66 51130 → 6633 [ACK] Seq=10239 Ack=1307 Win=213 Len=0 TSval=23943983 TSecr=5373857
267 1.998345258 172.31.23.72 -> 172.31.31.144 OpenFlow 189 Type: OFPT_PACKET_IN
268 1.998360205 172.31.23.72 -> 172.31.31.144 OpenFlow 189 Type: OFPT_PACKET_IN
269 1.999019091 172.31.31.144 -> 172.31.23.72 TCP 66 6633 → 51128 [ACK] Seq=1065 Ack=9541 Win=853 Len=0 TSval=5373857 TSecr=23943983
270 1.999036617 172.31.31.144 -> 172.31.23.72 TCP 66 6633 → 51126 [ACK] Seq=823 Ack=8644 Win=853 Len=0 TSval=5373857 TSecr=23943983
271 1.999039007 172.31.31.144 -> 172.31.23.72 TCP 66 6633 → 51136 [ACK] Seq=97 Ack=9322 Win=853 Len=0 TSval=5373857 TSecr=23943983
272 1.999041300 172.31.31.144 -> 172.31.23.72 TCP 66 6633 → 51136 [ACK] Seq=97 Ack=9445 Win=853 Len=0 TSval=5373857 TSecr=23943983
273 1.999043086 172.31.31.144 -> 172.31.23.72 TCP 66 6633 → 51126 [ACK] Seq=823 Ack=8767 Win=853 Len=0 TSval=5373857 TSecr=23943983
274 1.999052142 172.31.23.72 -> 172.31.31.144 OpenFlow 189 Type: OFPT_PACKET_IN
275 1.999229034 172.31.23.72 -> 172.31.31.144 OpenFlow 189 Type: OFPT_PACKET_IN
276 2.000222327 172.31.31.144 -> 172.31.23.72 TCP 66 6633 → 51130 [ACK] Seq=1307 Ack=10239 Win=853 Len=0 TSval=5373857 TSecr=23943983
277 2.000225106 172.31.31.144 -> 172.31.23.72 TCP 66 6633 → 51132 [ACK] Seq=97 Ack=8964 Win=853 Len=0 TSval=5373857 TSecr=23943983
278 2.000227192 172.31.31.144 -> 172.31.23.72 TCP 66 6633 → 51132 [ACK] Seq=97 Ack=9087 Win=853 Len=0 TSval=5373857 TSecr=23943983
279 2.000228774 172.31.31.144 -> 172.31.23.72 TCP 66 6633 → 51138 [ACK] Seq=97 Ack=8868 Win=853 Len=0 TSval=5373858 TSecr=23943983
280 2.000278364 172.31.31.144 -> 172.31.23.72 TCP 66 6633 → 51134 [ACK] Seq=97 Ack=6980 Win=853 Len=0 TSval=5373858 TSecr=23943983
281 2.000280760 172.31.31.144 -> 172.31.23.72 TCP 66 6633 → 51138 [ACK] Seq=97 Ack=8991 Win=853 Len=0 TSval=5373858 TSecr=23943983
282 2.001345669 172.31.31.144 -> 172.31.23.72 TCP 66 6633 → 51134 [ACK] Seq=97 Ack=7103 Win=853 Len=0 TSval=5373858 TSecr=23943983
283 2.495832786 172.31.31.144 -> 172.31.23.72 OpenFlow 187 Type: OFPT_PACKET_OUT
284 2.495862051 172.31.31.144 -> 172.31.23.72 OpenFlow 187 Type: OFPT_PACKET_OUT
285 2.495866241 172.31.31.144 -> 172.31.23.72 OpenFlow 187 Type: OFPT_PACKET_OUT
286 2.496235488 172.31.23.72 -> 172.31.31.144 TCP 66 51132 → 6633 [ACK] Seq=9087 Ack=460 Win=213 Len=0 TSval=23944107 TSecr=5373982
287 2.496297188 172.31.23.72 -> 172.31.31.144 OpenFlow 189 Type: OFPT_PACKET_IN
288 2.496460475 172.31.31.144 -> 172.31.23.72 OpenFlow 187 Type: OFPT_PACKET_OUT
289 2.496465959 172.31.31.144 -> 172.31.23.72 OpenFlow 187 Type: OFPT_PACKET_OUT
290 2.496468024 172.31.31.144 -> 172.31.23.72 OpenFlow 187 Type: OFPT_PACKET_OUT
291 2.496485318 172.31.23.72 -> 172.31.31.144 OpenFlow 189 Type: OFPT_PACKET_IN
292 2.496657419 172.31.23.72 -> 172.31.31.144 TCP 66 51132 → 6633 [ACK] Seq=9087 Ack=823 Win=213 Len=0 TSval=23944108 TSecr=5373982
293 2.496811445 172.31.23.72 -> 172.31.31.144 OpenFlow 189 Type: OFPT_PACKET_IN
294 2.497050052 172.31.31.144 -> 172.31.23.72 OpenFlow 187 Type: OFPT_PACKET_OUT
295 2.497074974 172.31.23.72 -> 172.31.31.144 OpenFlow 189 Type: OFPT_PACKET_IN
296 2.497113835 172.31.31.144 -> 172.31.23.72 OpenFlow 187 Type: OFPT_PACKET_OUT
297 2.497195975 172.31.23.72 -> 172.31.31.144 TCP 66 51132 → 6633 [ACK] Seq=9087 Ack=1065 Win=213 Len=0 TSval=23944108 TSecr=5373982
298 2.497295186 172.31.23.72 -> 172.31.31.144 OpenFlow 189 Type: OFPT_PACKET_IN
299 2.498165975 172.31.31.144 -> 172.31.23.72 OpenFlow 187 Type: OFPT_PACKET_OUT
300 2.498175028 172.31.31.144 -> 172.31.23.72 OpenFlow 187 Type: OFPT_PACKET_OUT
301 2.498177960 172.31.31.144 -> 172.31.23.72 OpenFlow 187 Type: OFPT_PACKET_OUT
302 2.498182848 172.31.31.144 -> 172.31.23.72 OpenFlow 187 Type: OFPT_PACKET_OUT
303 2.498184840 172.31.31.144 -> 172.31.23.72 OpenFlow 187 Type: OFPT_PACKET_OUT
304 2.498186650 172.31.31.144 -> 172.31.23.72 OpenFlow 187 Type: OFPT_PACKET_OUT
305 2.498188143 172.31.31.144 -> 172.31.23.72 OpenFlow 187 Type: OFPT_PACKET_OUT
306 2.498190679 172.31.31.144 -> 172.31.23.72 OpenFlow 187 Type: OFPT_PACKET_OUT
307 2.498192105 172.31.31.144 -> 172.31.23.72 OpenFlow 187 Type: OFPT_PACKET_OUT
308 2.498193889 172.31.31.144 -> 172.31.23.72 OpenFlow 187 Type: OFPT_PACKET_OUT
309 2.498195420 172.31.31.144 -> 172.31.23.72 OpenFlow 187 Type: OFPT_PACKET_OUT
310 2.498196810 172.31.31.144 -> 172.31.23.72 OpenFlow 187 Type: OFPT_PACKET_OUT
311 2.498198332 172.31.31.144 -> 172.31.23.72 OpenFlow 187 Type: OFPT_PACKET_OUT
312 2.498209042 172.31.23.72 -> 172.31.31.144 OpenFlow 189 Type: OFPT_PACKET_IN
313 2.498541113 172.31.23.72 -> 172.31.31.144 TCP 66 51136 → 6633 [ACK] Seq=9445 Ack=944 Win=213 Len=0 TSval=23944108 TSecr=5373982
314 2.498638024 172.31.23.72 -> 172.31.31.144 OpenFlow 189 Type: OFPT_PACKET_IN
315 2.498654294 172.31.23.72 -> 172.31.31.144 OpenFlow 189 Type: OFPT_PACKET_IN
316 2.498686894 172.31.23.72 -> 172.31.31.144 OpenFlow 189 Type: OFPT_PACKET_IN
317 2.498711786 172.31.23.72 -> 172.31.31.144 OpenFlow 189 Type: OFPT_PACKET_IN
318 2.498929621 172.31.23.72 -> 172.31.31.144 TCP 66 51134 → 6633 [ACK] Seq=7349 Ack=823 Win=213 Len=0 TSval=23944108 TSecr=5373982
319 2.499061233 172.31.23.72 -> 172.31.31.144 OpenFlow 189 Type: OFPT_PACKET_IN
320 2.499084003 172.31.23.72 -> 172.31.31.144 OpenFlow 189 Type: OFPT_PACKET_IN
321 2.499237354 172.31.31.144 -> 172.31.23.72 OpenFlow 187 Type: OFPT_PACKET_OUT
322 2.499244497 172.31.31.144 -> 172.31.23.72 OpenFlow 187 Type: OFPT_PACKET_OUT
323 2.499246577 172.31.31.144 -> 172.31.23.72 OpenFlow 187 Type: OFPT_PACKET_OUT
324 2.499248308 172.31.31.144 -> 172.31.23.72 OpenFlow 187 Type: OFPT_PACKET_OUT
325 2.499252924 172.31.23.72 -> 172.31.31.144 OpenFlow 435 Type: OFPT_PACKET_IN
326 2.499258676 172.31.31.144 -> 172.31.23.72 TCP 66 6633 → 51130 [ACK] Seq=1307 Ack=10485 Win=853 Len=0 TSval=5373982 TSecr=23944107
327 2.499263071 172.31.23.72 -> 172.31.31.144 OpenFlow 189 Type: OFPT_PACKET_IN
328 2.499265011 172.31.31.144 -> 172.31.23.72 OpenFlow 187 Type: OFPT_PACKET_OUT
329 2.499267406 172.31.31.144 -> 172.31.23.72 TCP 66 6633 → 51134 [ACK] Seq=823 Ack=7226 Win=853 Len=0 TSval=5373982 TSecr=23944108
330 2.499269565 172.31.31.144 -> 172.31.23.72 OpenFlow 187 Type: OFPT_PACKET_OUT
331 2.499271148 172.31.31.144 -> 172.31.23.72 OpenFlow 187 Type: OFPT_PACKET_OUT
332 2.499273457 172.31.31.144 -> 172.31.23.72 TCP 66 6633 → 51134 [ACK] Seq=823 Ack=7349 Win=853 Len=0 TSval=5373982 TSecr=23944108
333 2.499275524 172.31.31.144 -> 172.31.23.72 OpenFlow 187 Type: OFPT_PACKET_OUT
334 2.499277320 172.31.31.144 -> 172.31.23.72 OpenFlow 187 Type: OFPT_PACKET_OUT
335 2.499278788 172.31.31.144 -> 172.31.23.72 OpenFlow 187 Type: OFPT_PACKET_OUT
336 2.499366130 172.31.23.72 -> 172.31.31.144 OpenFlow 189 Type: OFPT_PACKET_IN
337 2.499369232 172.31.23.72 -> 172.31.31.144 OpenFlow 189 Type: OFPT_PACKET_IN
338 2.499371147 172.31.23.72 -> 172.31.31.144 OpenFlow 189 Type: OFPT_PACKET_IN
339 2.499429351 172.31.31.144 -> 172.31.23.72 OpenFlow 187 Type: OFPT_PACKET_OUT
340 2.499434539 172.31.31.144 -> 172.31.23.72 OpenFlow 187 Type: OFPT_PACKET_OUT
341 2.499437516 172.31.31.144 -> 172.31.23.72 OpenFlow 187 Type: OFPT_PACKET_OUT
342 2.499439076 172.31.31.144 -> 172.31.23.72 OpenFlow 187 Type: OFPT_PACKET_OUT
343 2.499441554 172.31.31.144 -> 172.31.23.72 OpenFlow 187 Type: OFPT_PACKET_OUT
344 2.499443231 172.31.31.144 -> 172.31.23.72 OpenFlow 187 Type: OFPT_PACKET_OUT
345 2.499445113 172.31.31.144 -> 172.31.23.72 OpenFlow 187 Type: OFPT_PACKET_OUT
346 2.499446911 172.31.31.144 -> 172.31.23.72 OpenFlow 187 Type: OFPT_PACKET_OUT
347 2.499448746 172.31.31.144 -> 172.31.23.72 OpenFlow 187 Type: OFPT_PACKET_OUT
348 2.499450187 172.31.31.144 -> 172.31.23.72 OpenFlow 187 Type: OFPT_PACKET_OUT
349 2.499508397 172.31.23.72 -> 172.31.31.144 TCP 66 51136 → 6633 [ACK] Seq=9445 Ack=1307 Win=213 Len=0 TSval=23944108 TSecr=5373982
350 2.499601868 172.31.23.72 -> 172.31.31.144 OpenFlow 189 Type: OFPT_PACKET_IN
351 2.499862589 172.31.23.72 -> 172.31.31.144 TCP 66 51140 → 6633 [ACK] Seq=7727 Ack=823 Win=213 Len=0 TSval=23944108 TSecr=5373982
352 2.499926824 172.31.23.72 -> 172.31.31.144 OpenFlow 189 Type: OFPT_PACKET_IN
353 2.499969445 172.31.23.72 -> 172.31.31.144 OpenFlow 189 Type: OFPT_PACKET_IN
354 2.500352426 172.31.23.72 -> 172.31.31.144 OpenFlow 189 Type: OFPT_PACKET_IN
355 2.500459718 172.31.23.72 -> 172.31.31.144 OpenFlow 189 Type: OFPT_PACKET_IN
356 2.500473747 172.31.23.72 -> 172.31.31.144 OpenFlow 189 Type: OFPT_PACKET_IN
357 2.500486258 172.31.23.72 -> 172.31.31.144 OpenFlow 189 Type: OFPT_PACKET_IN
358 2.500497553 172.31.23.72 -> 172.31.31.144 OpenFlow 189 Type: OFPT_PACKET_IN
359 2.500529577 172.31.23.72 -> 172.31.31.144 OpenFlow 189 Type: OFPT_PACKET_IN
360 2.500761439 172.31.31.144 -> 172.31.23.72 TCP 66 6633 → 51128 [ACK] Seq=1065 Ack=9664 Win=853 Len=0 TSval=5373983 TSecr=23944108
361 2.500768745 172.31.31.144 -> 172.31.23.72 OpenFlow 187 Type: OFPT_PACKET_OUT
362 2.500772478 172.31.31.144 -> 172.31.23.72 TCP 66 6633 → 51140 [ACK] Seq=823 Ack=7604 Win=853 Len=0 TSval=5373982 TSecr=23944108
363 2.500776390 172.31.23.72 -> 172.31.31.144 OpenFlow 189 Type: OFPT_PACKET_IN
364 2.500782465 172.31.31.144 -> 172.31.23.72 OpenFlow 187 Type: OFPT_PACKET_OUT
365 2.500785821 172.31.23.72 -> 172.31.31.144 OpenFlow 312 Type: OFPT_PACKET_IN
366 2.500787638 172.31.31.144 -> 172.31.23.72 OpenFlow 187 Type: OFPT_PACKET_OUT
367 2.500789822 172.31.31.144 -> 172.31.23.72 OpenFlow 187 Type: OFPT_PACKET_OUT
368 2.500791579 172.31.31.144 -> 172.31.23.72 OpenFlow 187 Type: OFPT_PACKET_OUT
369 2.500793238 172.31.31.144 -> 172.31.23.72 OpenFlow 187 Type: OFPT_PACKET_OUT
370 2.500794647 172.31.31.144 -> 172.31.23.72 OpenFlow 187 Type: OFPT_PACKET_OUT
371 2.500796416 172.31.31.144 -> 172.31.23.72 OpenFlow 187 Type: OFPT_PACKET_OUT
372 2.500798058 172.31.31.144 -> 172.31.23.72 OpenFlow 187 Type: OFPT_PACKET_OUT
373 2.500799361 172.31.31.144 -> 172.31.23.72 TCP 66 6633 → 51128 [ACK] Seq=1065 Ack=9787 Win=853 Len=0 TSval=5373983 TSecr=23944108
374 2.500801348 172.31.31.144 -> 172.31.23.72 TCP 66 6633 → 51140 [ACK] Seq=823 Ack=7727 Win=853 Len=0 TSval=5373982 TSecr=23944108
375 2.500802956 172.31.31.144 -> 172.31.23.72 OpenFlow 187 Type: OFPT_PACKET_OUT
376 2.500805637 172.31.23.72 -> 172.31.31.144 OpenFlow 312 Type: OFPT_PACKET_IN
377 2.500807295 172.31.31.144 -> 172.31.23.72 OpenFlow 187 Type: OFPT_PACKET_OUT
378 2.500809436 172.31.31.144 -> 172.31.23.72 OpenFlow 187 Type: OFPT_PACKET_OUT
379 2.500811125 172.31.31.144 -> 172.31.23.72 OpenFlow 187 Type: OFPT_PACKET_OUT
380 2.500812919 172.31.31.144 -> 172.31.23.72 TCP 66 6633 → 51142 [ACK] Seq=1307 Ack=10740 Win=853 Len=0 TSval=5373983 TSecr=23944108
