  1 0.000000000 41.177.127.217 -> 172.31.24.227 TCP 54 58416 → 22 [ACK] Seq=1 Ack=1 Win=32600 Len=0
  2 0.001015197 41.177.127.217 -> 172.31.24.227 TCP 54 58416 → 22 [ACK] Seq=1 Ack=297 Win=32452 Len=0
  3 0.040069047 41.177.127.217 -> 172.31.24.227 TCP 54 58416 → 22 [ACK] Seq=1 Ack=333 Win=32434 Len=0
  4 0.115464768 41.177.127.217 -> 172.31.24.227 TCP 54 58416 → 22 [ACK] Seq=1 Ack=429 Win=32386 Len=0
  5 0.303956785 172.31.31.144 -> 172.31.24.227 TCP 90 6633 → 39486 [PSH, ACK] Seq=1 Ack=1 Win=853 Len=24 TSval=359790 TSecr=118919852
  6 0.303982558 172.31.31.144 -> 172.31.24.227 TCP 90 6633 → 39458 [PSH, ACK] Seq=1 Ack=1 Win=853 Len=24 TSval=359790 TSecr=118919852
  7 0.303986009 172.31.31.144 -> 172.31.24.227 TCP 90 6633 → 39490 [PSH, ACK] Seq=1 Ack=1 Win=853 Len=24 TSval=359790 TSecr=118919853
  8 0.303988990 172.31.31.144 -> 172.31.24.227 TCP 90 6633 → 39476 [PSH, ACK] Seq=1 Ack=1 Win=853 Len=24 TSval=359790 TSecr=118919851
  9 0.303991861 172.31.31.144 -> 172.31.24.227 TCP 90 6633 → 39492 [PSH, ACK] Seq=1 Ack=1 Win=853 Len=24 TSval=359790 TSecr=118919986
 10 0.303994811 172.31.31.144 -> 172.31.24.227 TCP 90 6633 → 39452 [PSH, ACK] Seq=1 Ack=1 Win=853 Len=24 TSval=359790 TSecr=118919863
 11 0.304005305 172.31.24.227 -> 172.31.31.144 TCP 66 39452 → 6633 [ACK] Seq=1 Ack=25 Win=68 Len=0 TSval=118920400 TSecr=359790
 12 0.304011377 172.31.31.144 -> 172.31.24.227 TCP 106 6633 → 39476 [PSH, ACK] Seq=25 Ack=1 Win=853 Len=40 TSval=359790 TSecr=118919851
 13 0.304014806 172.31.31.144 -> 172.31.24.227 TCP 106 6633 → 39492 [PSH, ACK] Seq=25 Ack=1 Win=853 Len=40 TSval=359790 TSecr=118919986
 14 0.304016618 172.31.31.144 -> 172.31.24.227 TCP 106 6633 → 39490 [PSH, ACK] Seq=25 Ack=1 Win=853 Len=40 TSval=359790 TSecr=118919853
 15 0.304018750 172.31.31.144 -> 172.31.24.227 TCP 106 6633 → 39458 [PSH, ACK] Seq=25 Ack=1 Win=853 Len=40 TSval=359790 TSecr=118919852
 16 0.304020472 172.31.31.144 -> 172.31.24.227 TCP 106 6633 → 39452 [PSH, ACK] Seq=25 Ack=1 Win=853 Len=40 TSval=359790 TSecr=118919863
 17 0.304023164 172.31.24.227 -> 172.31.31.144 TCP 66 39452 → 6633 [ACK] Seq=1 Ack=65 Win=68 Len=0 TSval=118920400 TSecr=359790
 18 0.304030577 172.31.31.144 -> 172.31.24.227 TCP 106 6633 → 39486 [PSH, ACK] Seq=25 Ack=1 Win=853 Len=40 TSval=359790 TSecr=118919852
 19 0.304241647 172.31.24.227 -> 172.31.31.144 OpenFlow 82 Type: OFPT_MULTIPART_REPLY, OFPMP_GROUP
 20 0.304269094 172.31.24.227 -> 172.31.31.144 OpenFlow 98 Type: OFPT_MULTIPART_REPLY, OFPMP_METER
 21 0.304294485 172.31.24.227 -> 172.31.31.144 OpenFlow 82 Type: OFPT_MULTIPART_REPLY, OFPMP_GROUP
 22 0.304339233 172.31.24.227 -> 172.31.31.144 OpenFlow 98 Type: OFPT_MULTIPART_REPLY, OFPMP_METER
 23 0.304364875 172.31.24.227 -> 172.31.31.144 OpenFlow 82 Type: OFPT_MULTIPART_REPLY, OFPMP_GROUP
 24 0.304407810 172.31.24.227 -> 172.31.31.144 OpenFlow 98 Type: OFPT_MULTIPART_REPLY, OFPMP_METER
 25 0.304423167 172.31.24.227 -> 172.31.31.144 OpenFlow 82 Type: OFPT_MULTIPART_REPLY, OFPMP_GROUP
 26 0.304447106 172.31.24.227 -> 172.31.31.144 OpenFlow 82 Type: OFPT_MULTIPART_REPLY, OFPMP_GROUP
 27 0.304468348 172.31.24.227 -> 172.31.31.144 OpenFlow 82 Type: OFPT_MULTIPART_REPLY, OFPMP_GROUP
 28 0.304472140 172.31.24.227 -> 172.31.31.144 OpenFlow 98 Type: OFPT_MULTIPART_REPLY, OFPMP_METER
 29 0.304506915 172.31.31.144 -> 172.31.24.227 TCP 66 6633 → 39452 [ACK] Seq=65 Ack=17 Win=853 Len=0 TSval=359791 TSecr=118920401
 30 0.304513537 172.31.31.144 -> 172.31.24.227 TCP 66 6633 → 39452 [ACK] Seq=65 Ack=49 Win=853 Len=0 TSval=359791 TSecr=118920401
 31 0.304545464 172.31.24.227 -> 172.31.31.144 OpenFlow 98 Type: OFPT_MULTIPART_REPLY, OFPMP_METER
 32 0.304551010 172.31.24.227 -> 172.31.31.144 OpenFlow 98 Type: OFPT_MULTIPART_REPLY, OFPMP_METER
 33 0.304611096 172.31.31.144 -> 172.31.24.227 TCP 66 6633 → 39458 [ACK] Seq=65 Ack=17 Win=853 Len=0 TSval=359791 TSecr=118920401
 34 0.304615103 172.31.31.144 -> 172.31.24.227 TCP 66 6633 → 39458 [ACK] Seq=65 Ack=49 Win=853 Len=0 TSval=359791 TSecr=118920401
 35 0.304682544 172.31.31.144 -> 172.31.24.227 TCP 66 6633 → 39476 [ACK] Seq=65 Ack=49 Win=853 Len=0 TSval=359791 TSecr=118920401
 36 0.304685188 172.31.31.144 -> 172.31.24.227 TCP 66 6633 → 39486 [ACK] Seq=65 Ack=17 Win=853 Len=0 TSval=359791 TSecr=118920401
 37 0.304687135 172.31.31.144 -> 172.31.24.227 TCP 66 6633 → 39490 [ACK] Seq=65 Ack=17 Win=853 Len=0 TSval=359791 TSecr=118920401
 38 0.304746497 172.31.31.144 -> 172.31.24.227 TCP 66 6633 → 39486 [ACK] Seq=65 Ack=49 Win=853 Len=0 TSval=359791 TSecr=118920401
 39 0.304785288 172.31.31.144 -> 172.31.24.227 TCP 66 6633 → 39490 [ACK] Seq=65 Ack=49 Win=853 Len=0 TSval=359791 TSecr=118920401
 40 0.304831775 172.31.31.144 -> 172.31.24.227 TCP 66 6633 → 39492 [ACK] Seq=65 Ack=49 Win=853 Len=0 TSval=359791 TSecr=118920401
 41 0.403825325 172.31.31.144 -> 172.31.24.227 TCP 90 6633 → 39480 [PSH, ACK] Seq=1 Ack=1 Win=853 Len=24 TSval=359816 TSecr=118919990
 42 0.403844983 172.31.31.144 -> 172.31.24.227 TCP 90 6633 → 39446 [PSH, ACK] Seq=1 Ack=1 Win=853 Len=24 TSval=359816 TSecr=118919855
 43 0.403859316 172.31.31.144 -> 172.31.24.227 TCP 90 6633 → 39464 [PSH, ACK] Seq=1 Ack=1 Win=853 Len=24 TSval=359816 TSecr=118919865
 44 0.403870313 172.31.24.227 -> 172.31.31.144 TCP 66 39464 → 6633 [ACK] Seq=1 Ack=25 Win=68 Len=0 TSval=118920425 TSecr=359816
 45 0.403875546 172.31.31.144 -> 172.31.24.227 TCP 90 6633 → 39484 [PSH, ACK] Seq=1 Ack=1 Win=853 Len=24 TSval=359816 TSecr=118919863
 46 0.403879286 172.31.24.227 -> 172.31.31.144 TCP 66 39484 → 6633 [ACK] Seq=1 Ack=25 Win=84 Len=0 TSval=118920425 TSecr=359816
 47 0.403881887 172.31.31.144 -> 172.31.24.227 TCP 90 6633 → 39482 [PSH, ACK] Seq=1 Ack=1 Win=853 Len=24 TSval=359816 TSecr=118919865
 48 0.403885182 172.31.24.227 -> 172.31.31.144 TCP 66 39482 → 6633 [ACK] Seq=1 Ack=25 Win=160 Len=0 TSval=118920425 TSecr=359816
 49 0.403960569 172.31.24.227 -> 172.31.31.144 OpenFlow 82 Type: OFPT_MULTIPART_REPLY, OFPMP_GROUP
 50 0.404011588 172.31.24.227 -> 172.31.31.144 OpenFlow 82 Type: OFPT_MULTIPART_REPLY, OFPMP_GROUP
 51 0.404018678 172.31.31.144 -> 172.31.24.227 TCP 90 6633 → 39478 [PSH, ACK] Seq=1 Ack=1 Win=853 Len=24 TSval=359816 TSecr=118919853
 52 0.404022901 172.31.31.144 -> 172.31.24.227 TCP 90 6633 → 39462 [PSH, ACK] Seq=1 Ack=1 Win=853 Len=24 TSval=359816 TSecr=118919855
 53 0.404025168 172.31.31.144 -> 172.31.24.227 OpenFlow 106 Type: OFPT_MULTIPART_REQUEST, OFPMP_METER
 54 0.404026783 172.31.31.144 -> 172.31.24.227 TCP 90 6633 → 39448 [PSH, ACK] Seq=1 Ack=1 Win=853 Len=24 TSval=359816 TSecr=118919854
 55 0.404028912 172.31.31.144 -> 172.31.24.227 OpenFlow 106 Type: OFPT_MULTIPART_REQUEST, OFPMP_METER
 56 0.404030308 172.31.31.144 -> 172.31.24.227 TCP 106 6633 → 39478 [PSH, ACK] Seq=25 Ack=1 Win=853 Len=40 TSval=359816 TSecr=118919853
 57 0.404054227 172.31.24.227 -> 172.31.31.144 OpenFlow 98 Type: OFPT_MULTIPART_REPLY, OFPMP_METER
 58 0.404087161 172.31.24.227 -> 172.31.31.144 OpenFlow 82 Type: OFPT_MULTIPART_REPLY, OFPMP_GROUP
 59 0.404097183 172.31.31.144 -> 172.31.24.227 TCP 106 6633 → 39480 [PSH, ACK] Seq=25 Ack=1 Win=853 Len=40 TSval=359816 TSecr=118919990
 60 0.404109393 172.31.31.144 -> 172.31.24.227 TCP 106 6633 → 39462 [PSH, ACK] Seq=25 Ack=1 Win=853 Len=40 TSval=359816 TSecr=118919855
 61 0.404111441 172.31.31.144 -> 172.31.24.227 TCP 106 6633 → 39484 [PSH, ACK] Seq=25 Ack=1 Win=853 Len=40 TSval=359816 TSecr=118919863
 62 0.404114263 172.31.24.227 -> 172.31.31.144 TCP 66 39484 → 6633 [ACK] Seq=1 Ack=65 Win=84 Len=0 TSval=118920426 TSecr=359816
 63 0.404117853 172.31.31.144 -> 172.31.24.227 TCP 106 6633 → 39482 [PSH, ACK] Seq=25 Ack=1 Win=853 Len=40 TSval=359816 TSecr=118919865
 64 0.404119938 172.31.24.227 -> 172.31.31.144 TCP 66 39482 → 6633 [ACK] Seq=1 Ack=65 Win=160 Len=0 TSval=118920426 TSecr=359816
 65 0.404121485 172.31.31.144 -> 172.31.24.227 TCP 82 6633 → 39448 [PSH, ACK] Seq=25 Ack=1 Win=853 Len=16 TSval=359816 TSecr=118919854
 66 0.404148166 172.31.24.227 -> 172.31.31.144 OpenFlow 82 Type: OFPT_MULTIPART_REPLY, OFPMP_GROUP
 67 0.404150778 172.31.24.227 -> 172.31.31.144 OpenFlow 98 Type: OFPT_MULTIPART_REPLY, OFPMP_METER
 68 0.404166350 172.31.24.227 -> 172.31.31.144 OpenFlow 82 Type: OFPT_MULTIPART_REPLY, OFPMP_GROUP
 69 0.404171493 172.31.31.144 -> 172.31.24.227 TCP 90 6633 → 39448 [PSH, ACK] Seq=41 Ack=1 Win=853 Len=24 TSval=359816 TSecr=118919854
 70 0.404174048 172.31.31.144 -> 172.31.24.227 TCP 90 6633 → 39450 [PSH, ACK] Seq=1 Ack=1 Win=853 Len=24 TSval=359816 TSecr=118919853
 71 0.404177141 172.31.31.144 -> 172.31.24.227 TCP 90 6633 → 39454 [PSH, ACK] Seq=1 Ack=1 Win=853 Len=24 TSval=359816 TSecr=118919853
 72 0.404179375 172.31.31.144 -> 172.31.24.227 TCP 106 6633 → 39450 [PSH, ACK] Seq=25 Ack=1 Win=853 Len=40 TSval=359816 TSecr=118919853
 73 0.404199853 172.31.24.227 -> 172.31.31.144 OpenFlow 82 Type: OFPT_MULTIPART_REPLY, OFPMP_GROUP
 74 0.404271893 172.31.24.227 -> 172.31.31.144 OpenFlow 98 Type: OFPT_MULTIPART_REPLY, OFPMP_METER
 75 0.404310593 172.31.24.227 -> 172.31.31.144 OpenFlow 82 Type: OFPT_MULTIPART_REPLY, OFPMP_GROUP_DESC
 76 0.404313218 172.31.24.227 -> 172.31.31.144 OpenFlow 98 Type: OFPT_MULTIPART_REPLY, OFPMP_METER
 77 0.404330536 172.31.24.227 -> 172.31.31.144 OpenFlow 82 Type: OFPT_MULTIPART_REPLY, OFPMP_GROUP
 78 0.404349109 172.31.31.144 -> 172.31.24.227 TCP 82 6633 → 39454 [PSH, ACK] Seq=25 Ack=1 Win=853 Len=16 TSval=359816 TSecr=118919853
 79 0.404352990 172.31.31.144 -> 172.31.24.227 TCP 90 6633 → 39474 [PSH, ACK] Seq=1 Ack=1 Win=853 Len=24 TSval=359816 TSecr=118919855
 80 0.404359737 172.31.24.227 -> 172.31.31.144 TCP 66 39474 → 6633 [ACK] Seq=1 Ack=25 Win=186 Len=0 TSval=118920426 TSecr=359816
 81 0.404364296 172.31.31.144 -> 172.31.24.227 TCP 90 6633 → 39470 [PSH, ACK] Seq=1 Ack=1 Win=853 Len=24 TSval=359816 TSecr=118919852
 82 0.404366728 172.31.31.144 -> 172.31.24.227 TCP 106 6633 → 39474 [PSH, ACK] Seq=25 Ack=1 Win=853 Len=40 TSval=359816 TSecr=118919855
 83 0.404368990 172.31.24.227 -> 172.31.31.144 TCP 66 39474 → 6633 [ACK] Seq=1 Ack=65 Win=186 Len=0 TSval=118920426 TSecr=359816
 84 0.404370361 172.31.31.144 -> 172.31.24.227 TCP 90 6633 → 39454 [PSH, ACK] Seq=41 Ack=1 Win=853 Len=24 TSval=359816 TSecr=118919853
 85 0.404371952 172.31.31.144 -> 172.31.24.227 TCP 82 6633 → 39470 [PSH, ACK] Seq=25 Ack=1 Win=853 Len=16 TSval=359816 TSecr=118919852
 86 0.404373293 172.31.31.144 -> 172.31.24.227 TCP 90 6633 → 39468 [PSH, ACK] Seq=1 Ack=1 Win=853 Len=24 TSval=359816 TSecr=118919853
 87 0.404375101 172.31.31.144 -> 172.31.24.227 TCP 82 6633 → 39468 [PSH, ACK] Seq=25 Ack=1 Win=853 Len=16 TSval=359816 TSecr=118919853
 88 0.404381244 172.31.24.227 -> 172.31.31.144 OpenFlow 98 Type: OFPT_MULTIPART_REPLY, OFPMP_METER
 89 0.404386204 172.31.24.227 -> 172.31.31.144 OpenFlow 82 Type: OFPT_MULTIPART_REPLY, OFPMP_GROUP
 90 0.404408374 172.31.24.227 -> 172.31.31.144 OpenFlow 82 Type: OFPT_MULTIPART_REPLY, OFPMP_GROUP
 91 0.404434935 172.31.24.227 -> 172.31.31.144 OpenFlow 82 Type: OFPT_MULTIPART_REPLY, OFPMP_GROUP
 92 0.404436947 172.31.24.227 -> 172.31.31.144 OpenFlow 82 Type: OFPT_MULTIPART_REPLY, OFPMP_METER
 93 0.404459547 172.31.24.227 -> 172.31.31.144 OpenFlow 82 Type: OFPT_MULTIPART_REPLY, OFPMP_GROUP
 94 0.404472856 172.31.24.227 -> 172.31.31.144 OpenFlow 82 Type: OFPT_MULTIPART_REPLY, OFPMP_GROUP
 95 0.404501858 172.31.24.227 -> 172.31.31.144 OpenFlow 82 Type: OFPT_MULTIPART_REPLY, OFPMP_GROUP
 96 0.404503998 172.31.24.227 -> 172.31.31.144 OpenFlow 98 Type: OFPT_MULTIPART_REPLY, OFPMP_METER
 97 0.404546782 172.31.31.144 -> 172.31.24.227 TCP 90 6633 → 39456 [PSH, ACK] Seq=1 Ack=1 Win=853 Len=24 TSval=359816 TSecr=118919853
 98 0.404550536 172.31.31.144 -> 172.31.24.227 TCP 106 6633 → 39456 [PSH, ACK] Seq=25 Ack=1 Win=853 Len=40 TSval=359816 TSecr=118919853
 99 0.404552220 172.31.31.144 -> 172.31.24.227 TCP 90 6633 → 39488 [PSH, ACK] Seq=1 Ack=1 Win=853 Len=24 TSval=359816 TSecr=118919855
100 0.404554440 172.31.31.144 -> 172.31.24.227 TCP 90 6633 → 39472 [PSH, ACK] Seq=1 Ack=1 Win=853 Len=24 TSval=359816 TSecr=118919855
101 0.404556309 172.31.31.144 -> 172.31.24.227 TCP 90 6633 → 39460 [PSH, ACK] Seq=1 Ack=1 Win=853 Len=24 TSval=359816 TSecr=118919853
102 0.404558386 172.31.31.144 -> 172.31.24.227 OpenFlow 90 Type: OFPT_MULTIPART_REQUEST, OFPMP_METER
103 0.404559809 172.31.31.144 -> 172.31.24.227 TCP 66 6633 → 39446 [ACK] Seq=65 Ack=17 Win=853 Len=0 TSval=359816 TSecr=118920425
104 0.404563803 172.31.31.144 -> 172.31.24.227 TCP 106 6633 → 39460 [PSH, ACK] Seq=25 Ack=1 Win=853 Len=40 TSval=359816 TSecr=118919853
105 0.404565254 172.31.31.144 -> 172.31.24.227 TCP 82 6633 → 39488 [PSH, ACK] Seq=25 Ack=1 Win=853 Len=16 TSval=359816 TSecr=118919855
106 0.404566626 172.31.31.144 -> 172.31.24.227 TCP 82 6633 → 39472 [PSH, ACK] Seq=25 Ack=1 Win=853 Len=16 TSval=359816 TSecr=118919855
107 0.404670708 172.31.24.227 -> 172.31.31.144 OpenFlow 82 Type: OFPT_MULTIPART_REPLY, OFPMP_GROUP
108 0.404677998 172.31.24.227 -> 172.31.31.144 OpenFlow 98 Type: OFPT_MULTIPART_REPLY, OFPMP_METER
109 0.404700313 172.31.24.227 -> 172.31.31.144 OpenFlow 82 Type: OFPT_MULTIPART_REPLY, OFPMP_GROUP
110 0.404702433 172.31.24.227 -> 172.31.31.144 OpenFlow 98 Type: OFPT_MULTIPART_REPLY, OFPMP_METER
111 0.404739466 172.31.24.227 -> 172.31.31.144 OpenFlow 82 Type: OFPT_MULTIPART_REPLY, OFPMP_GROUP
112 0.404741388 172.31.24.227 -> 172.31.31.144 OpenFlow 98 Type: OFPT_MULTIPART_REPLY, OFPMP_METER
113 0.404791540 172.31.24.227 -> 172.31.31.144 OpenFlow 82 Type: OFPT_MULTIPART_REPLY, OFPMP_GROUP
114 0.404793524 172.31.24.227 -> 172.31.31.144 OpenFlow 82 Type: OFPT_MULTIPART_REPLY, OFPMP_GROUP_DESC
115 0.404938941 172.31.31.144 -> 172.31.24.227 TCP 90 6633 → 39466 [PSH, ACK] Seq=1 Ack=1 Win=853 Len=24 TSval=359816 TSecr=118919852
116 0.404947754 172.31.24.227 -> 172.31.31.144 TCP 66 39466 → 6633 [ACK] Seq=1 Ack=25 Win=341 Len=0 TSval=118920426 TSecr=359816
117 0.404952016 172.31.31.144 -> 172.31.24.227 TCP 82 6633 → 39466 [PSH, ACK] Seq=25 Ack=1 Win=853 Len=16 TSval=359816 TSecr=118919852
118 0.404954554 172.31.24.227 -> 172.31.31.144 TCP 66 39466 → 6633 [ACK] Seq=1 Ack=41 Win=341 Len=0 TSval=118920426 TSecr=359816
119 0.404955788 172.31.31.144 -> 172.31.24.227 OpenFlow 90 Type: OFPT_MULTIPART_REQUEST, OFPMP_METER
120 0.404957483 172.31.31.144 -> 172.31.24.227 OpenFlow 90 Type: OFPT_MULTIPART_REQUEST, OFPMP_METER
121 0.404958921 172.31.31.144 -> 172.31.24.227 OpenFlow 90 Type: OFPT_MULTIPART_REQUEST, OFPMP_METER
122 0.404960303 172.31.31.144 -> 172.31.24.227 TCP 66 6633 → 39464 [ACK] Seq=65 Ack=49 Win=853 Len=0 TSval=359816 TSecr=118920425
123 0.404963171 172.31.31.144 -> 172.31.24.227 TCP 90 6633 → 39466 [PSH, ACK] Seq=41 Ack=1 Win=853 Len=24 TSval=359816 TSecr=118919852
124 0.404965066 172.31.24.227 -> 172.31.31.144 TCP 66 39466 → 6633 [ACK] Seq=1 Ack=65 Win=341 Len=0 TSval=118920426 TSecr=359816
125 0.404966634 172.31.31.144 -> 172.31.24.227 TCP 66 6633 → 39478 [ACK] Seq=65 Ack=49 Win=853 Len=0 TSval=359816 TSecr=118920425
126 0.404968546 172.31.31.144 -> 172.31.24.227 TCP 66 6633 → 39480 [ACK] Seq=65 Ack=49 Win=853 Len=0 TSval=359816 TSecr=118920426
127 0.404970222 172.31.31.144 -> 172.31.24.227 TCP 66 6633 → 39446 [ACK] Seq=65 Ack=33 Win=853 Len=0 TSval=359816 TSecr=118920426
128 0.404972193 172.31.31.144 -> 172.31.24.227 TCP 66 6633 → 39482 [ACK] Seq=65 Ack=49 Win=853 Len=0 TSval=359816 TSecr=118920426
129 0.404974407 172.31.31.144 -> 172.31.24.227 TCP 66 6633 → 39448 [ACK] Seq=65 Ack=17 Win=853 Len=0 TSval=359816 TSecr=118920426
130 0.404976123 172.31.31.144 -> 172.31.24.227 TCP 66 6633 → 39484 [ACK] Seq=65 Ack=49 Win=853 Len=0 TSval=359816 TSecr=118920426
131 0.404978008 172.31.31.144 -> 172.31.24.227 TCP 66 6633 → 39462 [ACK] Seq=65 Ack=17 Win=853 Len=0 TSval=359816 TSecr=118920426
132 0.404988565 172.31.24.227 -> 172.31.31.144 OpenFlow 98 Type: OFPT_MULTIPART_REPLY, OFPMP_METER
133 0.404990938 172.31.24.227 -> 172.31.31.144 OpenFlow 98 Type: OFPT_MULTIPART_REPLY, OFPMP_METER
134 0.404992502 172.31.24.227 -> 172.31.31.144 OpenFlow 98 Type: OFPT_MULTIPART_REPLY, OFPMP_METER
135 0.405086172 172.31.24.227 -> 172.31.31.144 OpenFlow 82 Type: OFPT_MULTIPART_REPLY, OFPMP_GROUP
136 0.405089036 172.31.24.227 -> 172.31.31.144 OpenFlow 98 Type: OFPT_MULTIPART_REPLY, OFPMP_METER
137 0.405090928 172.31.24.227 -> 172.31.31.144 OpenFlow 82 Type: OFPT_MULTIPART_REPLY, OFPMP_GROUP_DESC
138 0.405204270 172.31.31.144 -> 172.31.24.227 TCP 66 6633 → 39446 [ACK] Seq=65 Ack=49 Win=853 Len=0 TSval=359816 TSecr=118920426
139 0.405209468 172.31.31.144 -> 172.31.24.227 TCP 66 6633 → 39470 [ACK] Seq=65 Ack=17 Win=853 Len=0 TSval=359816 TSecr=118920426
140 0.405211549 172.31.31.144 -> 172.31.24.227 TCP 66 6633 → 39448 [ACK] Seq=65 Ack=49 Win=853 Len=0 TSval=359816 TSecr=118920426
141 0.405213391 172.31.31.144 -> 172.31.24.227 TCP 66 6633 → 39460 [ACK] Seq=65 Ack=17 Win=853 Len=0 TSval=359816 TSecr=118920426
142 0.405215042 172.31.31.144 -> 172.31.24.227 TCP 66 6633 → 39450 [ACK] Seq=65 Ack=49 Win=853 Len=0 TSval=359816 TSecr=118920426
143 0.405220662 172.31.24.227 -> 172.31.31.144 OpenFlow 98 Type: OFPT_MULTIPART_REPLY, OFPMP_METER
144 0.405226141 172.31.24.227 -> 172.31.31.144 OpenFlow 82 Type: OFPT_MULTIPART_REPLY, OFPMP_METER
145 0.405413708 172.31.24.227 -> 172.31.31.144 OpenFlow 98 Type: OFPT_MULTIPART_REPLY, OFPMP_METER
146 0.405521428 172.31.31.144 -> 172.31.24.227 TCP 66 6633 → 39472 [ACK] Seq=65 Ack=17 Win=853 Len=0 TSval=359816 TSecr=118920426
147 0.405524568 172.31.24.227 -> 172.31.31.144 OpenFlow 82 Type: OFPT_MULTIPART_REPLY, OFPMP_METER
148 0.405528612 172.31.31.144 -> 172.31.24.227 TCP 66 6633 → 39454 [ACK] Seq=65 Ack=49 Win=853 Len=0 TSval=359816 TSecr=118920426
149 0.405530729 172.31.31.144 -> 172.31.24.227 TCP 66 6633 → 39462 [ACK] Seq=65 Ack=49 Win=853 Len=0 TSval=359816 TSecr=118920426
150 0.405532469 172.31.31.144 -> 172.31.24.227 TCP 66 6633 → 39488 [ACK] Seq=65 Ack=17 Win=853 Len=0 TSval=359816 TSecr=118920426
151 0.405534250 172.31.31.144 -> 172.31.24.227 TCP 66 6633 → 39468 [ACK] Seq=65 Ack=33 Win=853 Len=0 TSval=359816 TSecr=118920426
152 0.405536458 172.31.31.144 -> 172.31.24.227 TCP 66 6633 → 39456 [ACK] Seq=65 Ack=49 Win=853 Len=0 TSval=359816 TSecr=118920426
153 0.405628508 172.31.31.144 -> 172.31.24.227 TCP 66 6633 → 39470 [ACK] Seq=65 Ack=49 Win=853 Len=0 TSval=359816 TSecr=118920426
154 0.405630619 172.31.31.144 -> 172.31.24.227 TCP 66 6633 → 39474 [ACK] Seq=65 Ack=49 Win=853 Len=0 TSval=359816 TSecr=118920426
155 0.405632373 172.31.31.144 -> 172.31.24.227 TCP 66 6633 → 39460 [ACK] Seq=65 Ack=49 Win=853 Len=0 TSval=359816 TSecr=118920426
156 0.405664576 172.31.31.144 -> 172.31.24.227 TCP 66 6633 → 39472 [ACK] Seq=65 Ack=33 Win=853 Len=0 TSval=359816 TSecr=118920426
157 0.405698541 172.31.31.144 -> 172.31.24.227 TCP 66 6633 → 39488 [ACK] Seq=65 Ack=49 Win=853 Len=0 TSval=359816 TSecr=118920426
158 0.405787341 172.31.31.144 -> 172.31.24.227 TCP 66 6633 → 39466 [ACK] Seq=65 Ack=49 Win=853 Len=0 TSval=359816 TSecr=118920426
159 0.405807425 172.31.31.144 -> 172.31.24.227 TCP 66 6633 → 39472 [ACK] Seq=65 Ack=49 Win=853 Len=0 TSval=359816 TSecr=118920426
160 0.410701992 172.31.24.227 -> 41.177.127.217 SSH 90 Server: Encrypted packet (len=36)
161 0.443857640 172.31.31.144 -> 172.31.24.227 TCP 66 6633 → 39468 [ACK] Seq=65 Ack=49 Win=853 Len=0 TSval=359826 TSecr=118920426
162 0.670038998 41.177.127.217 -> 172.31.24.227 TCP 54 58416 → 22 [ACK] Seq=1 Ack=465 Win=32368 Len=0
163 0.916095812 172.31.24.227 -> 41.177.127.217 SSH 98 Server: Encrypted packet (len=44)
164 1.003282012 172.31.31.144 -> 172.31.24.227 OpenFlow 187 Type: OFPT_PACKET_OUT
165 1.003310584 172.31.31.144 -> 172.31.24.227 OpenFlow 187 Type: OFPT_PACKET_OUT
166 1.003331610 172.31.31.144 -> 172.31.24.227 OpenFlow 187 Type: OFPT_PACKET_OUT
167 1.003352366 172.31.31.144 -> 172.31.24.227 OpenFlow 187 Type: OFPT_PACKET_OUT
168 1.003410150 172.31.31.144 -> 172.31.24.227 OpenFlow 187 Type: OFPT_PACKET_OUT
169 1.003419742 172.31.24.227 -> 172.31.31.144 TCP 66 39480 → 6633 [ACK] Seq=49 Ack=670 Win=70 Len=0 TSval=118920575 TSecr=359965
170 1.003488799 172.31.31.144 -> 172.31.24.227 OpenFlow 187 Type: OFPT_PACKET_OUT
171 1.003537346 172.31.31.144 -> 172.31.24.227 OpenFlow 187 Type: OFPT_PACKET_OUT
172 1.003605373 172.31.31.144 -> 172.31.24.227 OpenFlow 187 Type: OFPT_PACKET_OUT
173 1.003690945 172.31.31.144 -> 172.31.24.227 OpenFlow 187 Type: OFPT_PACKET_OUT
174 1.003744313 172.31.31.144 -> 172.31.24.227 OpenFlow 187 Type: OFPT_PACKET_OUT
175 1.003750316 172.31.24.227 -> 172.31.31.144 TCP 66 39480 → 6633 [ACK] Seq=49 Ack=1275 Win=70 Len=0 TSval=118920575 TSecr=359965
176 1.003851062 172.31.31.144 -> 172.31.24.227 OpenFlow 187 Type: OFPT_PACKET_OUT
177 1.003916032 172.31.31.144 -> 172.31.24.227 OpenFlow 187 Type: OFPT_PACKET_OUT
178 1.004070272 172.31.31.144 -> 172.31.24.227 OpenFlow 187 Type: OFPT_PACKET_OUT
179 1.004088203 172.31.31.144 -> 172.31.24.227 OpenFlow 187 Type: OFPT_PACKET_OUT
180 1.004123161 172.31.31.144 -> 172.31.24.227 OpenFlow 187 Type: OFPT_PACKET_OUT
181 1.004179876 172.31.31.144 -> 172.31.24.227 OpenFlow 187 Type: OFPT_PACKET_OUT
182 1.004246435 172.31.31.144 -> 172.31.24.227 OpenFlow 187 Type: OFPT_PACKET_OUT
183 1.004252634 172.31.24.227 -> 172.31.31.144 TCP 66 39456 → 6633 [ACK] Seq=49 Ack=670 Win=61 Len=0 TSval=118920576 TSecr=359966
184 1.004311705 172.31.31.144 -> 172.31.24.227 OpenFlow 187 Type: OFPT_PACKET_OUT
185 1.004357705 172.31.31.144 -> 172.31.24.227 OpenFlow 187 Type: OFPT_PACKET_OUT
186 1.004401424 172.31.24.227 -> 172.31.31.144 TCP 66 39480 → 6633 [ACK] Seq=49 Ack=1517 Win=70 Len=0 TSval=118920576 TSecr=359966
187 1.004411685 172.31.31.144 -> 172.31.24.227 OpenFlow 187 Type: OFPT_PACKET_OUT
188 1.004486324 172.31.31.144 -> 172.31.24.227 OpenFlow 187 Type: OFPT_PACKET_OUT
189 1.004500776 172.31.24.227 -> 172.31.31.144 OpenFlow 189 Type: OFPT_PACKET_IN
190 1.004520911 172.31.24.227 -> 172.31.31.144 OpenFlow 435 Type: OFPT_PACKET_IN
191 1.004551525 172.31.31.144 -> 172.31.24.227 OpenFlow 187 Type: OFPT_PACKET_OUT
192 1.004555711 172.31.24.227 -> 172.31.31.144 TCP 66 39456 → 6633 [ACK] Seq=49 Ack=1275 Win=61 Len=0 TSval=118920576 TSecr=359966
193 1.004571631 172.31.24.227 -> 172.31.31.144 OpenFlow 189 Type: OFPT_PACKET_IN
194 1.004576803 172.31.31.144 -> 172.31.24.227 OpenFlow 187 Type: OFPT_PACKET_OUT
195 1.004605033 172.31.24.227 -> 172.31.31.144 OpenFlow 189 Type: OFPT_PACKET_IN
196 1.004651183 172.31.31.144 -> 172.31.24.227 OpenFlow 187 Type: OFPT_PACKET_OUT
197 1.004772184 172.31.31.144 -> 172.31.24.227 TCP 66 6633 → 39484 [ACK] Seq=65 Ack=541 Win=853 Len=0 TSval=359966 TSecr=118920576
198 1.004789891 172.31.31.144 -> 172.31.24.227 OpenFlow 187 Type: OFPT_PACKET_OUT
199 1.004814736 172.31.31.144 -> 172.31.24.227 OpenFlow 187 Type: OFPT_PACKET_OUT
200 1.004836064 172.31.31.144 -> 172.31.24.227 TCP 66 6633 → 39492 [ACK] Seq=65 Ack=295 Win=853 Len=0 TSval=359966 TSecr=118920576
201 1.004859161 172.31.31.144 -> 172.31.24.227 OpenFlow 187 Type: OFPT_PACKET_OUT
202 1.004928175 172.31.31.144 -> 172.31.24.227 OpenFlow 187 Type: OFPT_PACKET_OUT
203 1.004992899 172.31.31.144 -> 172.31.24.227 OpenFlow 187 Type: OFPT_PACKET_OUT
204 1.005055700 172.31.31.144 -> 172.31.24.227 OpenFlow 187 Type: OFPT_PACKET_OUT
205 1.005062660 172.31.24.227 -> 172.31.31.144 TCP 66 39486 → 6633 [ACK] Seq=49 Ack=791 Win=78 Len=0 TSval=118920576 TSecr=359966
206 1.005242572 172.31.31.144 -> 172.31.24.227 OpenFlow 187 Type: OFPT_PACKET_OUT
207 1.005266466 172.31.24.227 -> 172.31.31.144 TCP 66 39456 → 6633 [ACK] Seq=49 Ack=1517 Win=61 Len=0 TSval=118920576 TSecr=359966
208 1.005321820 172.31.31.144 -> 172.31.24.227 OpenFlow 187 Type: OFPT_PACKET_OUT
209 1.005343521 172.31.24.227 -> 172.31.31.144 OpenFlow 189 Type: OFPT_PACKET_IN
210 1.005364337 172.31.24.227 -> 172.31.31.144 OpenFlow 189 Type: OFPT_PACKET_IN
211 1.005382989 172.31.24.227 -> 172.31.31.144 OpenFlow 189 Type: OFPT_PACKET_IN
212 1.005416068 172.31.24.227 -> 172.31.31.144 OpenFlow 681 Type: OFPT_PACKET_IN
213 1.005530280 172.31.31.144 -> 172.31.24.227 TCP 66 6633 → 39458 [ACK] Seq=65 Ack=172 Win=853 Len=0 TSval=359966 TSecr=118920576
214 1.005548118 172.31.31.144 -> 172.31.24.227 TCP 66 6633 → 39458 [ACK] Seq=65 Ack=295 Win=853 Len=0 TSval=359966 TSecr=118920576
215 1.005694071 172.31.24.227 -> 172.31.31.144 TCP 66 39486 → 6633 [ACK] Seq=49 Ack=1033 Win=78 Len=0 TSval=118920576 TSecr=359966
216 1.005835949 172.31.24.227 -> 172.31.31.144 OpenFlow 189 Type: OFPT_PACKET_IN
217 1.005857892 172.31.24.227 -> 172.31.31.144 OpenFlow 681 Type: OFPT_PACKET_IN
218 1.005875194 172.31.24.227 -> 172.31.31.144 OpenFlow 189 Type: OFPT_PACKET_IN
219 1.005888388 172.31.24.227 -> 172.31.31.144 OpenFlow 189 Type: OFPT_PACKET_IN
220 1.005933568 172.31.24.227 -> 172.31.31.144 OpenFlow 189 Type: OFPT_PACKET_IN
221 1.005938618 172.31.24.227 -> 172.31.31.144 OpenFlow 189 Type: OFPT_PACKET_IN
222 1.005957269 172.31.24.227 -> 172.31.31.144 OpenFlow 189 Type: OFPT_PACKET_IN
223 1.005982487 172.31.24.227 -> 172.31.31.144 OpenFlow 189 Type: OFPT_PACKET_IN
224 1.006026637 172.31.24.227 -> 172.31.31.144 OpenFlow 189 Type: OFPT_PACKET_IN
225 1.006031199 172.31.24.227 -> 172.31.31.144 OpenFlow 435 Type: OFPT_PACKET_IN
226 1.006048930 172.31.31.144 -> 172.31.24.227 TCP 66 6633 → 39446 [ACK] Seq=65 Ack=172 Win=853 Len=0 TSval=359966 TSecr=118920576
227 1.006108283 172.31.31.144 -> 172.31.24.227 TCP 66 6633 → 39446 [ACK] Seq=65 Ack=787 Win=853 Len=0 TSval=359966 TSecr=118920576
228 1.006111804 172.31.31.144 -> 172.31.24.227 TCP 66 6633 → 39448 [ACK] Seq=65 Ack=172 Win=853 Len=0 TSval=359966 TSecr=118920576
229 1.006114215 172.31.31.144 -> 172.31.24.227 TCP 66 6633 → 39448 [ACK] Seq=65 Ack=295 Win=853 Len=0 TSval=359966 TSecr=118920576
230 1.006173855 172.31.31.144 -> 172.31.24.227 TCP 66 6633 → 39472 [ACK] Seq=65 Ack=172 Win=853 Len=0 TSval=359966 TSecr=118920576
231 1.006210858 172.31.31.144 -> 172.31.24.227 TCP 66 6633 → 39472 [ACK] Seq=65 Ack=295 Win=853 Len=0 TSval=359966 TSecr=118920576
232 1.006476279 172.31.31.144 -> 172.31.24.227 TCP 66 6633 → 39478 [ACK] Seq=65 Ack=541 Win=853 Len=0 TSval=359966 TSecr=118920576
233 1.006543846 172.31.31.144 -> 172.31.24.227 TCP 66 6633 → 39450 [ACK] Seq=65 Ack=295 Win=853 Len=0 TSval=359966 TSecr=118920576
234 1.006584003 172.31.31.144 -> 172.31.24.227 TCP 66 6633 → 39464 [ACK] Seq=65 Ack=787 Win=853 Len=0 TSval=359966 TSecr=118920576
235 1.006645993 172.31.31.144 -> 172.31.24.227 OpenFlow 187 Type: OFPT_PACKET_OUT
236 1.006800049 172.31.31.144 -> 172.31.24.227 OpenFlow 187 Type: OFPT_PACKET_OUT
237 1.006813545 172.31.24.227 -> 172.31.31.144 TCP 66 39468 → 6633 [ACK] Seq=49 Ack=307 Win=78 Len=0 TSval=118920576 TSecr=359966
238 1.006886477 172.31.24.227 -> 172.31.31.144 OpenFlow 189 Type: OFPT_PACKET_IN
239 1.009866028 172.31.31.144 -> 172.31.24.227 OpenFlow 187 Type: OFPT_PACKET_OUT
240 1.009877991 172.31.31.144 -> 172.31.24.227 OpenFlow 187 Type: OFPT_PACKET_OUT
241 1.009881434 172.31.31.144 -> 172.31.24.227 OpenFlow 187 Type: OFPT_PACKET_OUT
242 1.009883089 172.31.31.144 -> 172.31.24.227 OpenFlow 187 Type: OFPT_PACKET_OUT
243 1.009884912 172.31.31.144 -> 172.31.24.227 OpenFlow 187 Type: OFPT_PACKET_OUT
244 1.009889603 172.31.24.227 -> 172.31.31.144 TCP 66 39468 → 6633 [ACK] Seq=49 Ack=912 Win=78 Len=0 TSval=118920577 TSecr=359966
245 1.009895400 172.31.31.144 -> 172.31.24.227 OpenFlow 187 Type: OFPT_PACKET_OUT
246 1.009897941 172.31.31.144 -> 172.31.24.227 OpenFlow 187 Type: OFPT_PACKET_OUT
247 1.009899616 172.31.31.144 -> 172.31.24.227 OpenFlow 187 Type: OFPT_PACKET_OUT
248 1.009901126 172.31.31.144 -> 172.31.24.227 OpenFlow 187 Type: OFPT_PACKET_OUT
249 1.009902570 172.31.31.144 -> 172.31.24.227 OpenFlow 187 Type: OFPT_PACKET_OUT
250 1.009904273 172.31.24.227 -> 172.31.31.144 TCP 66 39468 → 6633 [ACK] Seq=49 Ack=1517 Win=78 Len=0 TSval=118920577 TSecr=359967
251 1.009906147 172.31.31.144 -> 172.31.24.227 OpenFlow 187 Type: OFPT_PACKET_OUT
252 1.009908982 172.31.31.144 -> 172.31.24.227 OpenFlow 187 Type: OFPT_PACKET_OUT
253 1.009910824 172.31.31.144 -> 172.31.24.227 OpenFlow 187 Type: OFPT_PACKET_OUT
254 1.009912507 172.31.31.144 -> 172.31.24.227 OpenFlow 187 Type: OFPT_PACKET_OUT
255 1.009914311 172.31.31.144 -> 172.31.24.227 OpenFlow 187 Type: OFPT_PACKET_OUT
256 1.009915826 172.31.31.144 -> 172.31.24.227 OpenFlow 187 Type: OFPT_PACKET_OUT
257 1.009917224 172.31.31.144 -> 172.31.24.227 OpenFlow 187 Type: OFPT_PACKET_OUT
258 1.009918871 172.31.31.144 -> 172.31.24.227 OpenFlow 187 Type: OFPT_PACKET_OUT
259 1.009920614 172.31.31.144 -> 172.31.24.227 OpenFlow 187 Type: OFPT_PACKET_OUT
260 1.009922153 172.31.31.144 -> 172.31.24.227 OpenFlow 187 Type: OFPT_PACKET_OUT
261 1.009923433 172.31.31.144 -> 172.31.24.227 OpenFlow 187 Type: OFPT_PACKET_OUT
262 1.009925869 172.31.31.144 -> 172.31.24.227 OpenFlow 187 Type: OFPT_PACKET_OUT
263 1.009927051 172.31.31.144 -> 172.31.24.227 OpenFlow 187 Type: OFPT_PACKET_OUT
264 1.009928445 172.31.31.144 -> 172.31.24.227 OpenFlow 187 Type: OFPT_PACKET_OUT
265 1.009945236 172.31.31.144 -> 172.31.24.227 OpenFlow 187 Type: OFPT_PACKET_OUT
266 1.009948360 172.31.24.227 -> 172.31.31.144 TCP 66 39490 → 6633 [ACK] Seq=49 Ack=670 Win=57 Len=0 TSval=118920577 TSecr=359967
267 1.009952894 172.31.31.144 -> 172.31.24.227 OpenFlow 187 Type: OFPT_PACKET_OUT
268 1.009954781 172.31.31.144 -> 172.31.24.227 OpenFlow 187 Type: OFPT_PACKET_OUT
269 1.009959446 172.31.24.227 -> 172.31.31.144 OpenFlow 189 Type: OFPT_PACKET_IN
270 1.009994077 172.31.31.144 -> 172.31.24.227 OpenFlow 187 Type: OFPT_PACKET_OUT
271 1.010062664 172.31.31.144 -> 172.31.24.227 TCP 66 6633 → 39470 [ACK] Seq=65 Ack=172 Win=853 Len=0 TSval=359967 TSecr=118920576
272 1.010069838 172.31.31.144 -> 172.31.24.227 OpenFlow 187 Type: OFPT_PACKET_OUT
273 1.010103487 172.31.31.144 -> 172.31.24.227 OpenFlow 308 Type: OFPT_PACKET_OUT
274 1.010121432 172.31.31.144 -> 172.31.24.227 OpenFlow 187 Type: OFPT_PACKET_OUT
275 1.010125469 172.31.24.227 -> 172.31.31.144 TCP 66 39490 → 6633 [ACK] Seq=49 Ack=1275 Win=57 Len=0 TSval=118920577 TSecr=359967
276 1.010199919 172.31.31.144 -> 172.31.24.227 TCP 66 6633 → 39470 [ACK] Seq=65 Ack=295 Win=853 Len=0 TSval=359967 TSecr=118920577
277 1.010504964 172.31.24.227 -> 172.31.31.144 TCP 66 39466 → 6633 [ACK] Seq=49 Ack=1275 Win=341 Len=0 TSval=118920577 TSecr=359967
278 1.010725231 172.31.31.144 -> 172.31.24.227 OpenFlow 1034 Type: OFPT_PACKET_OUT
279 1.010998654 172.31.24.227 -> 172.31.31.144 OpenFlow 189 Type: OFPT_PACKET_IN
280 1.011024312 172.31.24.227 -> 172.31.31.144 OpenFlow 435 Type: OFPT_PACKET_IN
281 1.011043787 172.31.24.227 -> 172.31.31.144 OpenFlow 189 Type: OFPT_PACKET_IN
282 1.011090868 172.31.24.227 -> 172.31.31.144 OpenFlow 189 Type: OFPT_PACKET_IN
283 1.011205650 172.31.31.144 -> 172.31.24.227 TCP 66 6633 → 39470 [ACK] Seq=65 Ack=418 Win=853 Len=0 TSval=359967 TSecr=118920577
284 1.011223392 172.31.31.144 -> 172.31.24.227 TCP 66 6633 → 39470 [ACK] Seq=65 Ack=787 Win=853 Len=0 TSval=359967 TSecr=118920577
285 1.011315466 172.31.31.144 -> 172.31.24.227 TCP 66 6633 → 39476 [ACK] Seq=65 Ack=295 Win=853 Len=0 TSval=359967 TSecr=118920577
286 1.011509917 172.31.24.227 -> 172.31.31.144 OpenFlow 189 Type: OFPT_PACKET_IN
287 1.011533634 172.31.24.227 -> 172.31.31.144 OpenFlow 435 Type: OFPT_PACKET_IN
288 1.011614943 172.31.24.227 -> 172.31.31.144 OpenFlow 189 Type: OFPT_PACKET_IN
289 1.011637771 172.31.24.227 -> 172.31.31.144 OpenFlow 189 Type: OFPT_PACKET_IN
290 1.011649226 172.31.24.227 -> 172.31.31.144 OpenFlow 189 Type: OFPT_PACKET_IN
291 1.011661769 172.31.24.227 -> 172.31.31.144 OpenFlow 189 Type: OFPT_PACKET_IN
292 1.011688132 172.31.24.227 -> 172.31.31.144 OpenFlow 189 Type: OFPT_PACKET_IN
293 1.011710015 172.31.24.227 -> 172.31.31.144 OpenFlow 189 Type: OFPT_PACKET_IN
294 1.011712501 172.31.24.227 -> 172.31.31.144 OpenFlow 189 Type: OFPT_PACKET_IN
295 1.011731969 172.31.24.227 -> 172.31.31.144 OpenFlow 189 Type: OFPT_PACKET_IN
296 1.011734329 172.31.24.227 -> 172.31.31.144 OpenFlow 681 Type: OFPT_PACKET_IN
297 1.011838956 172.31.24.227 -> 172.31.31.144 OpenFlow 189 Type: OFPT_PACKET_IN
298 1.011845750 172.31.24.227 -> 172.31.31.144 OpenFlow 681 Type: OFPT_PACKET_IN
299 1.011934701 172.31.31.144 -> 172.31.24.227 TCP 66 6633 → 39492 [ACK] Seq=65 Ack=787 Win=853 Len=0 TSval=359968 TSecr=118920577
300 1.011941093 172.31.31.144 -> 172.31.24.227 TCP 66 6633 → 39446 [ACK] Seq=65 Ack=910 Win=853 Len=0 TSval=359968 TSecr=118920577
301 1.011943318 172.31.31.144 -> 172.31.24.227 TCP 66 6633 → 39446 [ACK] Seq=65 Ack=1033 Win=853 Len=0 TSval=359968 TSecr=118920577
302 1.011944919 172.31.31.144 -> 172.31.24.227 TCP 66 6633 → 39452 [ACK] Seq=65 Ack=172 Win=853 Len=0 TSval=359968 TSecr=118920577
303 1.011950898 172.31.24.227 -> 172.31.31.144 OpenFlow 189 Type: OFPT_PACKET_IN
304 1.012006419 172.31.31.144 -> 172.31.24.227 TCP 66 6633 → 39458 [ACK] Seq=65 Ack=418 Win=853 Len=0 TSval=359968 TSecr=118920577
305 1.012011531 172.31.31.144 -> 172.31.24.227 TCP 66 6633 → 39462 [ACK] Seq=65 Ack=172 Win=853 Len=0 TSval=359968 TSecr=118920577
306 1.012064444 172.31.31.144 -> 172.31.24.227 TCP 66 6633 → 39452 [ACK] Seq=65 Ack=787 Win=853 Len=0 TSval=359968 TSecr=118920577
307 1.012114827 172.31.31.144 -> 172.31.24.227 TCP 66 6633 → 39458 [ACK] Seq=65 Ack=541 Win=853 Len=0 TSval=359968 TSecr=118920577
308 1.012147173 172.31.31.144 -> 172.31.24.227 TCP 66 6633 → 39462 [ACK] Seq=65 Ack=787 Win=853 Len=0 TSval=359968 TSecr=118920577
309 1.012283727 172.31.31.144 -> 172.31.24.227 TCP 66 6633 → 39450 [ACK] Seq=65 Ack=541 Win=853 Len=0 TSval=359968 TSecr=118920577
310 1.012355542 172.31.24.227 -> 172.31.31.144 OpenFlow 189 Type: OFPT_PACKET_IN
311 1.012366272 172.31.31.144 -> 172.31.24.227 TCP 66 6633 → 39464 [ACK] Seq=65 Ack=1033 Win=853 Len=0 TSval=359968 TSecr=118920577
312 1.012380309 172.31.24.227 -> 172.31.31.144 OpenFlow 189 Type: OFPT_PACKET_IN
313 1.012405305 172.31.24.227 -> 172.31.31.144 OpenFlow 189 Type: OFPT_PACKET_IN
314 1.012466911 172.31.24.227 -> 172.31.31.144 OpenFlow 681 Type: OFPT_PACKET_IN
315 1.012605949 172.31.31.144 -> 172.31.24.227 TCP 66 6633 → 39450 [ACK] Seq=65 Ack=787 Win=853 Len=0 TSval=359968 TSecr=118920578
316 1.012639571 172.31.31.144 -> 172.31.24.227 TCP 66 6633 → 39458 [ACK] Seq=65 Ack=664 Win=853 Len=0 TSval=359968 TSecr=118920578
317 1.012660162 172.31.31.144 -> 172.31.24.227 TCP 66 6633 → 39458 [ACK] Seq=65 Ack=1279 Win=853 Len=0 TSval=359968 TSecr=118920578
318 1.048152831 172.31.24.227 -> 172.31.31.144 TCP 66 39466 → 6633 [ACK] Seq=49 Ack=2243 Win=347 Len=0 TSval=118920587 TSecr=359967
319 1.048160506 172.31.24.227 -> 172.31.31.144 TCP 66 39468 → 6633 [ACK] Seq=49 Ack=1759 Win=80 Len=0 TSval=118920587 TSecr=359967
320 1.103505740 172.31.31.144 -> 172.31.24.227 OpenFlow 187 Type: OFPT_PACKET_OUT
321 1.103530014 172.31.31.144 -> 172.31.24.227 OpenFlow 187 Type: OFPT_PACKET_OUT
322 1.103549486 172.31.31.144 -> 172.31.24.227 OpenFlow 187 Type: OFPT_PACKET_OUT
323 1.103559661 172.31.31.144 -> 172.31.24.227 OpenFlow 187 Type: OFPT_PACKET_OUT
324 1.103609894 172.31.31.144 -> 172.31.24.227 OpenFlow 187 Type: OFPT_PACKET_OUT
325 1.103618146 172.31.24.227 -> 172.31.31.144 TCP 66 39472 → 6633 [ACK] Seq=295 Ack=670 Win=63 Len=0 TSval=118920600 TSecr=359990
326 1.103690726 172.31.31.144 -> 172.31.24.227 OpenFlow 187 Type: OFPT_PACKET_OUT
327 1.103715952 172.31.31.144 -> 172.31.24.227 OpenFlow 187 Type: OFPT_PACKET_OUT
328 1.103798814 172.31.31.144 -> 172.31.24.227 OpenFlow 187 Type: OFPT_PACKET_OUT
329 1.103960150 172.31.31.144 -> 172.31.24.227 OpenFlow 187 Type: OFPT_PACKET_OUT
330 1.104026716 172.31.31.144 -> 172.31.24.227 OpenFlow 187 Type: OFPT_PACKET_OUT
331 1.104111698 172.31.31.144 -> 172.31.24.227 OpenFlow 187 Type: OFPT_PACKET_OUT
332 1.104177316 172.31.24.227 -> 172.31.31.144 TCP 66 39472 → 6633 [ACK] Seq=295 Ack=1033 Win=63 Len=0 TSval=118920601 TSecr=359990
333 1.104187643 172.31.31.144 -> 172.31.24.227 OpenFlow 187 Type: OFPT_PACKET_OUT
334 1.104261886 172.31.24.227 -> 172.31.31.144 OpenFlow 189 Type: OFPT_PACKET_IN
335 1.104272873 172.31.31.144 -> 172.31.24.227 OpenFlow 187 Type: OFPT_PACKET_OUT
336 1.104276922 172.31.24.227 -> 172.31.31.144 TCP 66 39492 → 6633 [ACK] Seq=787 Ack=670 Win=70 Len=0 TSval=118920601 TSecr=359991
337 1.104290072 172.31.24.227 -> 172.31.31.144 OpenFlow 189 Type: OFPT_PACKET_IN
338 1.104320852 172.31.24.227 -> 172.31.31.144 OpenFlow 189 Type: OFPT_PACKET_IN
339 1.104345498 172.31.24.227 -> 172.31.31.144 OpenFlow 189 Type: OFPT_PACKET_IN
340 1.104393359 172.31.31.144 -> 172.31.24.227 OpenFlow 187 Type: OFPT_PACKET_OUT
341 1.104422800 172.31.24.227 -> 172.31.31.144 OpenFlow 189 Type: OFPT_PACKET_IN
342 1.104429237 172.31.24.227 -> 172.31.31.144 OpenFlow 189 Type: OFPT_PACKET_IN
343 1.104452430 172.31.31.144 -> 172.31.24.227 OpenFlow 187 Type: OFPT_PACKET_OUT
344 1.104595706 172.31.31.144 -> 172.31.24.227 TCP 66 6633 → 39486 [ACK] Seq=1033 Ack=172 Win=853 Len=0 TSval=359991 TSecr=118920601
345 1.104620163 172.31.31.144 -> 172.31.24.227 OpenFlow 187 Type: OFPT_PACKET_OUT
346 1.104670204 172.31.31.144 -> 172.31.24.227 TCP 66 6633 → 39486 [ACK] Seq=1033 Ack=295 Win=853 Len=0 TSval=359991 TSecr=118920601
347 1.104705972 172.31.31.144 -> 172.31.24.227 TCP 66 6633 → 39474 [ACK] Seq=65 Ack=295 Win=853 Len=0 TSval=359991 TSecr=118920601
348 1.104732502 172.31.31.144 -> 172.31.24.227 OpenFlow 187 Type: OFPT_PACKET_OUT
349 1.104802526 172.31.24.227 -> 172.31.31.144 TCP 66 39492 → 6633 [ACK] Seq=787 Ack=1154 Win=70 Len=0 TSval=118920601 TSecr=359991
350 1.104814052 172.31.31.144 -> 172.31.24.227 TCP 66 6633 → 39482 [ACK] Seq=65 Ack=295 Win=853 Len=0 TSval=359991 TSecr=118920601
351 1.104865303 172.31.31.144 -> 172.31.24.227 OpenFlow 187 Type: OFPT_PACKET_OUT
352 1.104915836 172.31.31.144 -> 172.31.24.227 OpenFlow 187 Type: OFPT_PACKET_OUT
353 1.105008702 172.31.31.144 -> 172.31.24.227 OpenFlow 187 Type: OFPT_PACKET_OUT
354 1.105044663 172.31.24.227 -> 172.31.31.144 OpenFlow 189 Type: OFPT_PACKET_IN
355 1.105067344 172.31.24.227 -> 172.31.31.144 OpenFlow 189 Type: OFPT_PACKET_IN
356 1.105144355 172.31.31.144 -> 172.31.24.227 OpenFlow 187 Type: OFPT_PACKET_OUT
357 1.105198871 172.31.31.144 -> 172.31.24.227 OpenFlow 187 Type: OFPT_PACKET_OUT
358 1.105240066 172.31.24.227 -> 172.31.31.144 TCP 66 39460 → 6633 [ACK] Seq=49 Ack=549 Win=73 Len=0 TSval=118920601 TSecr=359991
359 1.105273486 172.31.24.227 -> 172.31.31.144 OpenFlow 189 Type: OFPT_PACKET_IN
360 1.105295928 172.31.24.227 -> 172.31.31.144 OpenFlow 189 Type: OFPT_PACKET_IN
361 1.105305538 172.31.24.227 -> 172.31.31.144 OpenFlow 189 Type: OFPT_PACKET_IN
362 1.105317671 172.31.24.227 -> 172.31.31.144 OpenFlow 189 Type: OFPT_PACKET_IN
363 1.105349485 172.31.24.227 -> 172.31.31.144 OpenFlow 189 Type: OFPT_PACKET_IN
364 1.105392429 172.31.24.227 -> 172.31.31.144 OpenFlow 189 Type: OFPT_PACKET_IN
365 1.105394827 172.31.24.227 -> 172.31.31.144 OpenFlow 189 Type: OFPT_PACKET_IN
366 1.105424083 172.31.31.144 -> 172.31.24.227 OpenFlow 187 Type: OFPT_PACKET_OUT
367 1.105464233 172.31.24.227 -> 172.31.31.144 OpenFlow 189 Type: OFPT_PACKET_IN
368 1.105501078 172.31.24.227 -> 172.31.31.144 OpenFlow 189 Type: OFPT_PACKET_IN
369 1.105540806 172.31.31.144 -> 172.31.24.227 TCP 66 6633 → 39450 [ACK] Seq=65 Ack=1033 Win=853 Len=0 TSval=359991 TSecr=118920601
370 1.105546409 172.31.31.144 -> 172.31.24.227 OpenFlow 187 Type: OFPT_PACKET_OUT
371 1.105548190 172.31.31.144 -> 172.31.24.227 TCP 66 6633 → 39462 [ACK] Seq=65 Ack=910 Win=853 Len=0 TSval=359991 TSecr=118920601
372 1.105550366 172.31.31.144 -> 172.31.24.227 TCP 66 6633 → 39462 [ACK] Seq=65 Ack=1033 Win=853 Len=0 TSval=359991 TSecr=118920601
373 1.105582909 172.31.24.227 -> 172.31.31.144 OpenFlow 189 Type: OFPT_PACKET_IN
374 1.105612349 172.31.31.144 -> 172.31.24.227 TCP 66 6633 → 39468 [ACK] Seq=1759 Ack=172 Win=853 Len=0 TSval=359991 TSecr=118920601
375 1.105630646 172.31.24.227 -> 172.31.31.144 TCP 66 39460 → 6633 [ACK] Seq=49 Ack=791 Win=73 Len=0 TSval=118920601 TSecr=359991
376 1.105752969 172.31.31.144 -> 172.31.24.227 TCP 66 6633 → 39468 [ACK] Seq=1759 Ack=295 Win=853 Len=0 TSval=359991 TSecr=118920601
