  1 0.000000000 41.177.127.217 -> 172.31.24.227 TCP 54 58416 → 22 [ACK] Seq=1 Ack=1 Win=32600 Len=0
  2 0.002319041 41.177.127.217 -> 172.31.24.227 TCP 54 58416 → 22 [ACK] Seq=1 Ack=297 Win=32452 Len=0
  3 0.080074178 41.177.127.217 -> 172.31.24.227 TCP 54 58416 → 22 [ACK] Seq=1 Ack=333 Win=32434 Len=0
  4 0.117770337 41.177.127.217 -> 172.31.24.227 TCP 54 58416 → 22 [ACK] Seq=1 Ack=429 Win=32386 Len=0
  5 0.435427017 172.31.24.227 -> 41.177.127.217 SSH 90 Server: Encrypted packet (len=36)
  6 0.691787328 41.177.127.217 -> 172.31.24.227 TCP 54 58416 → 22 [ACK] Seq=1 Ack=465 Win=32368 Len=0
  7 0.937220777 172.31.24.227 -> 41.177.127.217 SSH 98 Server: Encrypted packet (len=44)
  8 1.184897964 41.177.127.217 -> 172.31.24.227 TCP 54 58416 → 22 [ACK] Seq=1 Ack=509 Win=32346 Len=0
  9 1.441290486 172.31.24.227 -> 41.177.127.217 SSH 98 Server: Encrypted packet (len=44)
 10 1.696214397 41.177.127.217 -> 172.31.24.227 TCP 54 58416 → 22 [ACK] Seq=1 Ack=553 Win=32324 Len=0
 11 1.943586591 172.31.24.227 -> 41.177.127.217 SSH 98 Server: Encrypted packet (len=44)
 12 2.212915259 41.177.127.217 -> 172.31.24.227 TCP 54 58416 → 22 [ACK] Seq=1 Ack=597 Win=32302 Len=0
 13 2.422657478 172.31.31.144 -> 172.31.24.227 TCP 187 6633 → 39480 [PSH, ACK] Seq=1 Ack=1 Win=853 Len=121 TSval=363841 TSecr=118923734
 14 2.422685028 172.31.31.144 -> 172.31.24.227 TCP 187 6633 → 39480 [PSH, ACK] Seq=122 Ack=1 Win=853 Len=121 TSval=363841 TSecr=118923734
 15 2.422702733 172.31.31.144 -> 172.31.24.227 TCP 187 6633 → 39480 [PSH, ACK] Seq=243 Ack=1 Win=853 Len=121 TSval=363841 TSecr=118923734
 16 2.422757379 172.31.31.144 -> 172.31.24.227 TCP 187 6633 → 39480 [PSH, ACK] Seq=364 Ack=1 Win=853 Len=121 TSval=363841 TSecr=118923734
 17 2.422859912 172.31.31.144 -> 172.31.24.227 TCP 187 6633 → 39480 [PSH, ACK] Seq=485 Ack=1 Win=853 Len=121 TSval=363841 TSecr=118923734
 18 2.422870241 172.31.24.227 -> 172.31.31.144 TCP 66 39480 → 6633 [ACK] Seq=1 Ack=606 Win=70 Len=0 TSval=118924451 TSecr=363841
 19 2.422879040 172.31.31.144 -> 172.31.24.227 TCP 187 6633 → 39480 [PSH, ACK] Seq=606 Ack=1 Win=853 Len=121 TSval=363841 TSecr=118923734
 20 2.422941083 172.31.31.144 -> 172.31.24.227 TCP 187 6633 → 39480 [PSH, ACK] Seq=727 Ack=1 Win=853 Len=121 TSval=363841 TSecr=118923734
 21 2.423008145 172.31.31.144 -> 172.31.24.227 TCP 187 6633 → 39480 [PSH, ACK] Seq=848 Ack=1 Win=853 Len=121 TSval=363841 TSecr=118923734
 22 2.423093506 172.31.31.144 -> 172.31.24.227 TCP 187 6633 → 39480 [PSH, ACK] Seq=969 Ack=1 Win=853 Len=121 TSval=363841 TSecr=118924451
 23 2.423113259 172.31.31.144 -> 172.31.24.227 TCP 187 6633 → 39480 [PSH, ACK] Seq=1090 Ack=1 Win=853 Len=121 TSval=363841 TSecr=118924451
 24 2.423117800 172.31.24.227 -> 172.31.31.144 TCP 66 39480 → 6633 [ACK] Seq=1 Ack=1211 Win=70 Len=0 TSval=118924451 TSecr=363841
 25 2.423193365 172.31.31.144 -> 172.31.24.227 TCP 187 6633 → 39480 [PSH, ACK] Seq=1211 Ack=1 Win=853 Len=121 TSval=363841 TSecr=118924451
 26 2.423243316 172.31.31.144 -> 172.31.24.227 TCP 187 6633 → 39480 [PSH, ACK] Seq=1332 Ack=1 Win=853 Len=121 TSval=363841 TSecr=118924451
 27 2.423352217 172.31.31.144 -> 172.31.24.227 TCP 187 6633 → 39456 [PSH, ACK] Seq=1 Ack=1 Win=853 Len=121 TSval=363841 TSecr=118923733
 28 2.423394365 172.31.31.144 -> 172.31.24.227 TCP 187 6633 → 39456 [PSH, ACK] Seq=122 Ack=1 Win=853 Len=121 TSval=363841 TSecr=118923733
 29 2.423455132 172.31.31.144 -> 172.31.24.227 TCP 187 6633 → 39456 [PSH, ACK] Seq=243 Ack=1 Win=853 Len=121 TSval=363841 TSecr=118923733
 30 2.423505922 172.31.31.144 -> 172.31.24.227 TCP 187 6633 → 39456 [PSH, ACK] Seq=364 Ack=1 Win=853 Len=121 TSval=363841 TSecr=118923733
 31 2.423563289 172.31.31.144 -> 172.31.24.227 TCP 187 6633 → 39456 [PSH, ACK] Seq=485 Ack=1 Win=853 Len=121 TSval=363841 TSecr=118923733
 32 2.423569124 172.31.24.227 -> 172.31.31.144 TCP 66 39456 → 6633 [ACK] Seq=1 Ack=606 Win=61 Len=0 TSval=118924451 TSecr=363841
 33 2.423614072 172.31.31.144 -> 172.31.24.227 TCP 187 6633 → 39456 [PSH, ACK] Seq=606 Ack=1 Win=853 Len=121 TSval=363841 TSecr=118923733
 34 2.423675695 172.31.31.144 -> 172.31.24.227 TCP 187 6633 → 39456 [PSH, ACK] Seq=727 Ack=1 Win=853 Len=121 TSval=363841 TSecr=118923733
 35 2.423730522 172.31.31.144 -> 172.31.24.227 TCP 187 6633 → 39456 [PSH, ACK] Seq=848 Ack=1 Win=853 Len=121 TSval=363841 TSecr=118923733
 36 2.423742302 172.31.24.227 -> 172.31.31.144 TCP 66 39480 → 6633 [ACK] Seq=1 Ack=1453 Win=70 Len=0 TSval=118924451 TSecr=363841
 37 2.423807433 172.31.31.144 -> 172.31.24.227 TCP 187 6633 → 39456 [PSH, ACK] Seq=969 Ack=1 Win=853 Len=121 TSval=363841 TSecr=118924451
 38 2.423831002 172.31.24.227 -> 172.31.31.144 OpenFlow 189 Type: OFPT_PACKET_IN
 39 2.423850478 172.31.24.227 -> 172.31.31.144 OpenFlow 435 Type: OFPT_PACKET_IN
 40 2.423875611 172.31.31.144 -> 172.31.24.227 TCP 187 6633 → 39456 [PSH, ACK] Seq=1090 Ack=1 Win=853 Len=121 TSval=363841 TSecr=118924451
 41 2.423879434 172.31.24.227 -> 172.31.31.144 TCP 66 39456 → 6633 [ACK] Seq=1 Ack=1211 Win=61 Len=0 TSval=118924451 TSecr=363841
 42 2.423901116 172.31.24.227 -> 172.31.31.144 OpenFlow 189 Type: OFPT_PACKET_IN
 43 2.423925259 172.31.24.227 -> 172.31.31.144 OpenFlow 189 Type: OFPT_PACKET_IN
 44 2.423949588 172.31.31.144 -> 172.31.24.227 TCP 187 6633 → 39456 [PSH, ACK] Seq=1211 Ack=1 Win=853 Len=121 TSval=363841 TSecr=118924451
 45 2.423980235 172.31.31.144 -> 172.31.24.227 TCP 187 6633 → 39456 [PSH, ACK] Seq=1332 Ack=1 Win=853 Len=121 TSval=363841 TSecr=118924451
 46 2.424067059 172.31.31.144 -> 172.31.24.227 TCP 187 6633 → 39486 [PSH, ACK] Seq=1 Ack=1 Win=853 Len=121 TSval=363841 TSecr=118923733
 47 2.424087127 172.31.31.144 -> 172.31.24.227 TCP 66 6633 → 39484 [ACK] Seq=1 Ack=493 Win=853 Len=0 TSval=363841 TSecr=118924451
 48 2.424107108 172.31.31.144 -> 172.31.24.227 TCP 66 6633 → 39492 [ACK] Seq=1 Ack=124 Win=853 Len=0 TSval=363841 TSecr=118924451
 49 2.424129075 172.31.31.144 -> 172.31.24.227 TCP 66 6633 → 39492 [ACK] Seq=1 Ack=247 Win=853 Len=0 TSval=363841 TSecr=118924451
 50 2.424157392 172.31.31.144 -> 172.31.24.227 TCP 187 6633 → 39486 [PSH, ACK] Seq=122 Ack=1 Win=853 Len=121 TSval=363841 TSecr=118923733
 51 2.424171276 172.31.31.144 -> 172.31.24.227 TCP 187 6633 → 39486 [PSH, ACK] Seq=243 Ack=1 Win=853 Len=121 TSval=363841 TSecr=118923733
 52 2.424230390 172.31.31.144 -> 172.31.24.227 TCP 187 6633 → 39486 [PSH, ACK] Seq=364 Ack=1 Win=853 Len=121 TSval=363841 TSecr=118923733
 53 2.424315369 172.31.31.144 -> 172.31.24.227 TCP 187 6633 → 39486 [PSH, ACK] Seq=485 Ack=1 Win=853 Len=121 TSval=363841 TSecr=118923733
 54 2.424393810 172.31.31.144 -> 172.31.24.227 TCP 187 6633 → 39486 [PSH, ACK] Seq=606 Ack=1 Win=853 Len=121 TSval=363841 TSecr=118923733
 55 2.424399685 172.31.24.227 -> 172.31.31.144 TCP 66 39486 → 6633 [ACK] Seq=1 Ack=727 Win=78 Len=0 TSval=118924451 TSecr=363841
 56 2.424482615 172.31.31.144 -> 172.31.24.227 TCP 187 6633 → 39486 [PSH, ACK] Seq=727 Ack=1 Win=853 Len=121 TSval=363841 TSecr=118923733
 57 2.424561900 172.31.31.144 -> 172.31.24.227 TCP 187 6633 → 39486 [PSH, ACK] Seq=848 Ack=1 Win=853 Len=121 TSval=363841 TSecr=118923733
 58 2.424598261 172.31.24.227 -> 172.31.31.144 TCP 66 39456 → 6633 [ACK] Seq=1 Ack=1453 Win=61 Len=0 TSval=118924451 TSecr=363841
 59 2.424626157 172.31.31.144 -> 172.31.24.227 TCP 187 6633 → 39468 [PSH, ACK] Seq=1 Ack=1 Win=853 Len=121 TSval=363841 TSecr=118923734
 60 2.424672605 172.31.24.227 -> 172.31.31.144 OpenFlow 189 Type: OFPT_PACKET_IN
 61 2.424694842 172.31.24.227 -> 172.31.31.144 OpenFlow 189 Type: OFPT_PACKET_IN
 62 2.424711640 172.31.24.227 -> 172.31.31.144 OpenFlow 189 Type: OFPT_PACKET_IN
 63 2.424743509 172.31.24.227 -> 172.31.31.144 OpenFlow 681 Type: OFPT_PACKET_IN
 64 2.424814535 172.31.24.227 -> 172.31.31.144 OpenFlow 189 Type: OFPT_PACKET_IN
 65 2.424885373 172.31.31.144 -> 172.31.24.227 TCP 66 6633 → 39458 [ACK] Seq=1 Ack=124 Win=853 Len=0 TSval=363841 TSecr=118924451
 66 2.424904683 172.31.31.144 -> 172.31.24.227 TCP 66 6633 → 39458 [ACK] Seq=1 Ack=247 Win=853 Len=0 TSval=363841 TSecr=118924451
 67 2.424924710 172.31.31.144 -> 172.31.24.227 TCP 187 6633 → 39468 [PSH, ACK] Seq=122 Ack=1 Win=853 Len=121 TSval=363841 TSecr=118923734
 68 2.425025244 172.31.31.144 -> 172.31.24.227 TCP 66 6633 → 39470 [ACK] Seq=1 Ack=124 Win=853 Len=0 TSval=363841 TSecr=118924451
 69 2.425101287 172.31.31.144 -> 172.31.24.227 TCP 187 6633 → 39468 [PSH, ACK] Seq=243 Ack=1 Win=853 Len=121 TSval=363841 TSecr=118923734
 70 2.425120543 172.31.31.144 -> 172.31.24.227 TCP 187 6633 → 39468 [PSH, ACK] Seq=364 Ack=1 Win=853 Len=121 TSval=363841 TSecr=118923734
 71 2.425127802 172.31.24.227 -> 172.31.31.144 TCP 66 39486 → 6633 [ACK] Seq=1 Ack=969 Win=78 Len=0 TSval=118924451 TSecr=363841
 72 2.425255227 172.31.31.144 -> 172.31.24.227 TCP 187 6633 → 39468 [PSH, ACK] Seq=485 Ack=1 Win=853 Len=121 TSval=363841 TSecr=118923734
 73 2.425262509 172.31.24.227 -> 172.31.31.144 TCP 66 39468 → 6633 [ACK] Seq=1 Ack=606 Win=80 Len=0 TSval=118924451 TSecr=363841
 74 2.425274097 172.31.31.144 -> 172.31.24.227 TCP 66 6633 → 39464 [ACK] Seq=1 Ack=739 Win=853 Len=0 TSval=363841 TSecr=118924451
 75 2.425292802 172.31.24.227 -> 172.31.31.144 OpenFlow 189 Type: OFPT_PACKET_IN
 76 2.425320584 172.31.24.227 -> 172.31.31.144 OpenFlow 681 Type: OFPT_PACKET_IN
 77 2.425330928 172.31.24.227 -> 172.31.31.144 OpenFlow 189 Type: OFPT_PACKET_IN
 78 2.425343680 172.31.24.227 -> 172.31.31.144 OpenFlow 189 Type: OFPT_PACKET_IN
 79 2.425356581 172.31.31.144 -> 172.31.24.227 TCP 187 6633 → 39468 [PSH, ACK] Seq=606 Ack=1 Win=853 Len=121 TSval=363841 TSecr=118923734
 80 2.425400877 172.31.24.227 -> 172.31.31.144 OpenFlow 189 Type: OFPT_PACKET_IN
 81 2.425488089 172.31.31.144 -> 172.31.24.227 TCP 187 6633 → 39468 [PSH, ACK] Seq=727 Ack=1 Win=853 Len=121 TSval=363841 TSecr=118923734
 82 2.425493279 172.31.31.144 -> 172.31.24.227 TCP 187 6633 → 39468 [PSH, ACK] Seq=848 Ack=1 Win=853 Len=121 TSval=363841 TSecr=118924451
 83 2.425498315 172.31.24.227 -> 172.31.31.144 OpenFlow 189 Type: OFPT_PACKET_IN
 84 2.425534035 172.31.31.144 -> 172.31.24.227 TCP 66 6633 → 39446 [ACK] Seq=1 Ack=124 Win=853 Len=0 TSval=363841 TSecr=118924451
 85 2.425577318 172.31.31.144 -> 172.31.24.227 TCP 66 6633 → 39446 [ACK] Seq=1 Ack=739 Win=853 Len=0 TSval=363841 TSecr=118924451
 86 2.425581742 172.31.31.144 -> 172.31.24.227 TCP 187 6633 → 39468 [PSH, ACK] Seq=969 Ack=1 Win=853 Len=121 TSval=363841 TSecr=118924451
 87 2.425622044 172.31.31.144 -> 172.31.24.227 TCP 187 6633 → 39468 [PSH, ACK] Seq=1090 Ack=1 Win=853 Len=121 TSval=363841 TSecr=118924451
 88 2.425627692 172.31.24.227 -> 172.31.31.144 TCP 66 39468 → 6633 [ACK] Seq=1 Ack=1211 Win=80 Len=0 TSval=118924451 TSecr=363841
 89 2.425739527 172.31.31.144 -> 172.31.24.227 TCP 187 6633 → 39468 [PSH, ACK] Seq=1211 Ack=1 Win=853 Len=121 TSval=363841 TSecr=118924451
 90 2.425848997 172.31.24.227 -> 172.31.31.144 OpenFlow 189 Type: OFPT_PACKET_IN
 91 2.425866918 172.31.24.227 -> 172.31.31.144 OpenFlow 189 Type: OFPT_PACKET_IN
 92 2.425895137 172.31.24.227 -> 172.31.31.144 OpenFlow 189 Type: OFPT_PACKET_IN
 93 2.425913019 172.31.31.144 -> 172.31.24.227 TCP 66 6633 → 39450 [ACK] Seq=1 Ack=247 Win=853 Len=0 TSval=363841 TSecr=118924451
 94 2.425954402 172.31.24.227 -> 172.31.31.144 OpenFlow 189 Type: OFPT_PACKET_IN
 95 2.425959524 172.31.24.227 -> 172.31.31.144 OpenFlow 435 Type: OFPT_PACKET_IN
 96 2.425987624 172.31.31.144 -> 172.31.24.227 TCP 187 6633 → 39468 [PSH, ACK] Seq=1332 Ack=1 Win=853 Len=121 TSval=363841 TSecr=118924451
 97 2.426061486 172.31.31.144 -> 172.31.24.227 TCP 66 6633 → 39470 [ACK] Seq=1 Ack=247 Win=853 Len=0 TSval=363841 TSecr=118924451
 98 2.426081694 172.31.31.144 -> 172.31.24.227 TCP 66 6633 → 39448 [ACK] Seq=1 Ack=247 Win=853 Len=0 TSval=363841 TSecr=118924451
 99 2.426090766 172.31.24.227 -> 172.31.31.144 OpenFlow 189 Type: OFPT_PACKET_IN
100 2.426102951 172.31.31.144 -> 172.31.24.227 TCP 66 6633 → 39472 [ACK] Seq=1 Ack=124 Win=853 Len=0 TSval=363841 TSecr=118924451
101 2.426109557 172.31.24.227 -> 172.31.31.144 OpenFlow 189 Type: OFPT_PACKET_IN
102 2.426129247 172.31.24.227 -> 172.31.31.144 OpenFlow 189 Type: OFPT_PACKET_IN
103 2.426144533 172.31.24.227 -> 172.31.31.144 TCP 66 39468 → 6633 [ACK] Seq=1 Ack=1453 Win=80 Len=0 TSval=118924451 TSecr=363841
104 2.426149536 172.31.24.227 -> 172.31.31.144 OpenFlow 435 Type: OFPT_PACKET_IN
105 2.426225838 172.31.31.144 -> 172.31.24.227 TCP 66 6633 → 39472 [ACK] Seq=1 Ack=247 Win=853 Len=0 TSval=363841 TSecr=118924451
106 2.426232203 172.31.31.144 -> 172.31.24.227 TCP 187 6633 → 39468 [PSH, ACK] Seq=1453 Ack=1 Win=853 Len=121 TSval=363841 TSecr=118924451
107 2.426234212 172.31.31.144 -> 172.31.24.227 TCP 66 6633 → 39478 [ACK] Seq=1 Ack=493 Win=853 Len=0 TSval=363841 TSecr=118924451
108 2.426240256 172.31.24.227 -> 172.31.31.144 OpenFlow 189 Type: OFPT_PACKET_IN
109 2.426299865 172.31.31.144 -> 172.31.24.227 TCP 66 6633 → 39462 [ACK] Seq=1 Ack=124 Win=853 Len=0 TSval=363842 TSecr=118924451
110 2.426347067 172.31.31.144 -> 172.31.24.227 TCP 66 6633 → 39462 [ACK] Seq=1 Ack=247 Win=853 Len=0 TSval=363842 TSecr=118924451
111 2.426367106 172.31.31.144 -> 172.31.24.227 TCP 187 6633 → 39468 [PSH, ACK] Seq=1574 Ack=1 Win=853 Len=121 TSval=363842 TSecr=118924451
112 2.426410792 172.31.24.227 -> 172.31.31.144 OpenFlow 189 Type: OFPT_PACKET_IN
113 2.426467060 172.31.31.144 -> 172.31.24.227 TCP 66 6633 → 39462 [ACK] Seq=1 Ack=616 Win=853 Len=0 TSval=363842 TSecr=118924451
114 2.426471966 172.31.31.144 -> 172.31.24.227 TCP 187 6633 → 39466 [PSH, ACK] Seq=1 Ack=1 Win=853 Len=121 TSval=363842 TSecr=118923732
115 2.426507855 172.31.24.227 -> 172.31.31.144 TCP 66 39468 → 6633 [ACK] Seq=1 Ack=1695 Win=80 Len=0 TSval=118924451 TSecr=363841
116 2.426524330 172.31.31.144 -> 172.31.24.227 TCP 187 6633 → 39466 [PSH, ACK] Seq=122 Ack=1 Win=853 Len=121 TSval=363842 TSecr=118923732
117 2.426611797 172.31.31.144 -> 172.31.24.227 TCP 66 6633 → 39462 [ACK] Seq=1 Ack=739 Win=853 Len=0 TSval=363842 TSecr=118924451
118 2.426633613 172.31.31.144 -> 172.31.24.227 TCP 187 6633 → 39466 [PSH, ACK] Seq=243 Ack=1 Win=853 Len=121 TSval=363842 TSecr=118923732
119 2.426648100 172.31.31.144 -> 172.31.24.227 TCP 66 6633 → 39464 [ACK] Seq=1 Ack=985 Win=853 Len=0 TSval=363842 TSecr=118924451
120 2.426668892 172.31.31.144 -> 172.31.24.227 TCP 187 6633 → 39466 [PSH, ACK] Seq=364 Ack=1 Win=853 Len=121 TSval=363842 TSecr=118923732
121 2.426675037 172.31.24.227 -> 172.31.31.144 OpenFlow 189 Type: OFPT_PACKET_IN
122 2.426695795 172.31.24.227 -> 172.31.31.144 OpenFlow 189 Type: OFPT_PACKET_IN
123 2.426741557 172.31.31.144 -> 172.31.24.227 TCP 187 6633 → 39466 [PSH, ACK] Seq=485 Ack=1 Win=853 Len=121 TSval=363842 TSecr=118923732
124 2.426803807 172.31.31.144 -> 172.31.24.227 TCP 187 6633 → 39466 [PSH, ACK] Seq=606 Ack=1 Win=853 Len=121 TSval=363842 TSecr=118923732
125 2.426862459 172.31.31.144 -> 172.31.24.227 TCP 66 6633 → 39492 [ACK] Seq=1 Ack=370 Win=853 Len=0 TSval=363842 TSecr=118924452
126 2.426873562 172.31.31.144 -> 172.31.24.227 TCP 66 6633 → 39492 [ACK] Seq=1 Ack=493 Win=853 Len=0 TSval=363842 TSecr=118924452
127 2.426897622 172.31.31.144 -> 172.31.24.227 TCP 187 6633 → 39466 [PSH, ACK] Seq=727 Ack=1 Win=853 Len=121 TSval=363842 TSecr=118923732
128 2.426954128 172.31.31.144 -> 172.31.24.227 TCP 187 6633 → 39466 [PSH, ACK] Seq=848 Ack=1 Win=853 Len=121 TSval=363842 TSecr=118923732
129 2.427141446 172.31.24.227 -> 172.31.31.144 TCP 66 39466 → 6633 [ACK] Seq=1 Ack=969 Win=363 Len=0 TSval=118924452 TSecr=363842
130 2.427210445 172.31.24.227 -> 172.31.31.144 OpenFlow 189 Type: OFPT_PACKET_IN
131 2.427220933 172.31.31.144 -> 172.31.24.227 TCP 187 6633 → 39466 [PSH, ACK] Seq=969 Ack=1 Win=853 Len=121 TSval=363842 TSecr=118923732
132 2.427233672 172.31.24.227 -> 172.31.31.144 OpenFlow 189 Type: OFPT_PACKET_IN
133 2.427259513 172.31.24.227 -> 172.31.31.144 OpenFlow 189 Type: OFPT_PACKET_IN
134 2.427292508 172.31.24.227 -> 172.31.31.144 OpenFlow 312 Type: OFPT_PACKET_IN
135 2.427296993 172.31.24.227 -> 172.31.31.144 OpenFlow 189 Type: OFPT_PACKET_IN
136 2.427308379 172.31.24.227 -> 172.31.31.144 OpenFlow 189 Type: OFPT_PACKET_IN
137 2.427315217 172.31.31.144 -> 172.31.24.227 TCP 187 6633 → 39466 [PSH, ACK] Seq=1090 Ack=1 Win=853 Len=121 TSval=363842 TSecr=118923732
138 2.427362817 172.31.24.227 -> 172.31.31.144 OpenFlow 189 Type: OFPT_PACKET_IN
139 2.427386412 172.31.31.144 -> 172.31.24.227 TCP 187 6633 → 39466 [PSH, ACK] Seq=1211 Ack=1 Win=853 Len=121 TSval=363842 TSecr=118924452
140 2.427409756 172.31.31.144 -> 172.31.24.227 TCP 66 6633 → 39470 [ACK] Seq=1 Ack=370 Win=853 Len=0 TSval=363842 TSecr=118924452
141 2.427412968 172.31.31.144 -> 172.31.24.227 TCP 66 6633 → 39470 [ACK] Seq=1 Ack=493 Win=853 Len=0 TSval=363842 TSecr=118924452
142 2.427468270 172.31.31.144 -> 172.31.24.227 TCP 187 6633 → 39466 [PSH, ACK] Seq=1332 Ack=1 Win=853 Len=121 TSval=363842 TSecr=118924452
143 2.427486315 172.31.31.144 -> 172.31.24.227 TCP 66 6633 → 39470 [ACK] Seq=1 Ack=739 Win=853 Len=0 TSval=363842 TSecr=118924452
144 2.427510048 172.31.31.144 -> 172.31.24.227 TCP 187 6633 → 39466 [PSH, ACK] Seq=1453 Ack=1 Win=853 Len=121 TSval=363842 TSecr=118924452
145 2.427527492 172.31.31.144 -> 172.31.24.227 TCP 66 6633 → 39492 [ACK] Seq=1 Ack=616 Win=853 Len=0 TSval=363842 TSecr=118924452
146 2.427546891 172.31.31.144 -> 172.31.24.227 TCP 66 6633 → 39492 [ACK] Seq=1 Ack=739 Win=853 Len=0 TSval=363842 TSecr=118924452
147 2.427567742 172.31.31.144 -> 172.31.24.227 TCP 187 6633 → 39466 [PSH, ACK] Seq=1574 Ack=1 Win=853 Len=121 TSval=363842 TSecr=118924452
148 2.427663277 172.31.31.144 -> 172.31.24.227 TCP 187 6633 → 39466 [PSH, ACK] Seq=1695 Ack=1 Win=853 Len=121 TSval=363842 TSecr=118924452
149 2.427741127 172.31.31.144 -> 172.31.24.227 TCP 187 6633 → 39466 [PSH, ACK] Seq=1816 Ack=1 Win=853 Len=121 TSval=363842 TSecr=118924452
150 2.427792764 172.31.31.144 -> 172.31.24.227 TCP 187 6633 → 39466 [PSH, ACK] Seq=1937 Ack=1 Win=853 Len=121 TSval=363842 TSecr=118924452
151 2.427812714 172.31.31.144 -> 172.31.24.227 TCP 66 6633 → 39476 [ACK] Seq=1 Ack=247 Win=853 Len=0 TSval=363842 TSecr=118924452
152 2.427867769 172.31.24.227 -> 172.31.31.144 TCP 66 39466 → 6633 [ACK] Seq=1 Ack=2058 Win=363 Len=0 TSval=118924452 TSecr=363842
153 2.427878899 172.31.31.144 -> 172.31.24.227 TCP 187 6633 → 39466 [PSH, ACK] Seq=2058 Ack=1 Win=853 Len=121 TSval=363842 TSecr=118924452
154 2.427992637 172.31.31.144 -> 172.31.24.227 TCP 187 6633 → 39490 [PSH, ACK] Seq=1 Ack=1 Win=853 Len=121 TSval=363842 TSecr=118923734
155 2.428010954 172.31.31.144 -> 172.31.24.227 TCP 187 6633 → 39490 [PSH, ACK] Seq=122 Ack=1 Win=853 Len=121 TSval=363842 TSecr=118923734
156 2.428074908 172.31.24.227 -> 172.31.31.144 TCP 66 39490 → 6633 [ACK] Seq=1 Ack=243 Win=57 Len=0 TSval=118924452 TSecr=363842
157 2.428085565 172.31.31.144 -> 172.31.24.227 TCP 187 6633 → 39490 [PSH, ACK] Seq=243 Ack=1 Win=853 Len=121 TSval=363842 TSecr=118923734
158 2.428152757 172.31.31.144 -> 172.31.24.227 TCP 187 6633 → 39490 [PSH, ACK] Seq=364 Ack=1 Win=853 Len=121 TSval=363842 TSecr=118923734
159 2.428182334 172.31.24.227 -> 172.31.31.144 TCP 66 39490 → 6633 [ACK] Seq=1 Ack=485 Win=57 Len=0 TSval=118924452 TSecr=363842
160 2.428209018 172.31.31.144 -> 172.31.24.227 TCP 187 6633 → 39490 [PSH, ACK] Seq=485 Ack=1 Win=853 Len=121 TSval=363842 TSecr=118923734
161 2.428287395 172.31.31.144 -> 172.31.24.227 TCP 187 6633 → 39490 [PSH, ACK] Seq=606 Ack=1 Win=853 Len=121 TSval=363842 TSecr=118924452
162 2.428327989 172.31.31.144 -> 172.31.24.227 TCP 187 6633 → 39490 [PSH, ACK] Seq=727 Ack=1 Win=853 Len=121 TSval=363842 TSecr=118924452
163 2.428368501 172.31.24.227 -> 172.31.31.144 OpenFlow 189 Type: OFPT_PACKET_IN
164 2.428388208 172.31.31.144 -> 172.31.24.227 TCP 187 6633 → 39490 [PSH, ACK] Seq=848 Ack=1 Win=853 Len=121 TSval=363842 TSecr=118924452
165 2.428393499 172.31.24.227 -> 172.31.31.144 OpenFlow 189 Type: OFPT_PACKET_IN
166 2.428414142 172.31.24.227 -> 172.31.31.144 OpenFlow 189 Type: OFPT_PACKET_IN
167 2.428436418 172.31.24.227 -> 172.31.31.144 OpenFlow 435 Type: OFPT_PACKET_IN
168 2.428440733 172.31.24.227 -> 172.31.31.144 OpenFlow 189 Type: OFPT_PACKET_IN
169 2.428458355 172.31.31.144 -> 172.31.24.227 TCP 187 6633 → 39490 [PSH, ACK] Seq=969 Ack=1 Win=853 Len=121 TSval=363842 TSecr=118924452
170 2.428462345 172.31.24.227 -> 172.31.31.144 TCP 66 39490 → 6633 [ACK] Seq=1 Ack=1090 Win=57 Len=0 TSval=118924452 TSecr=363842
171 2.428472652 172.31.24.227 -> 172.31.31.144 OpenFlow 189 Type: OFPT_PACKET_IN
172 2.428506039 172.31.31.144 -> 172.31.24.227 TCP 187 6633 → 39490 [PSH, ACK] Seq=1090 Ack=1 Win=853 Len=121 TSval=363842 TSecr=118924452
173 2.428532137 172.31.24.227 -> 172.31.31.144 OpenFlow 927 Type: OFPT_PACKET_IN
174 2.428555897 172.31.31.144 -> 172.31.24.227 TCP 66 6633 → 39446 [ACK] Seq=1 Ack=862 Win=853 Len=0 TSval=363842 TSecr=118924452
175 2.428580912 172.31.31.144 -> 172.31.24.227 TCP 66 6633 → 39446 [ACK] Seq=1 Ack=985 Win=853 Len=0 TSval=363842 TSecr=118924452
176 2.428646357 172.31.31.144 -> 172.31.24.227 TCP 66 6633 → 39452 [ACK] Seq=1 Ack=124 Win=853 Len=0 TSval=363842 TSecr=118924452
177 2.428673550 172.31.31.144 -> 172.31.24.227 TCP 66 6633 → 39450 [ACK] Seq=1 Ack=739 Win=853 Len=0 TSval=363842 TSecr=118924452
178 2.428708662 172.31.31.144 -> 172.31.24.227 TCP 66 6633 → 39458 [ACK] Seq=1 Ack=370 Win=853 Len=0 TSval=363842 TSecr=118924452
179 2.428732401 172.31.31.144 -> 172.31.24.227 TCP 66 6633 → 39458 [ACK] Seq=1 Ack=1231 Win=853 Len=0 TSval=363842 TSecr=118924452
180 2.428914510 172.31.24.227 -> 172.31.31.144 OpenFlow 189 Type: OFPT_PACKET_IN
181 2.428934649 172.31.24.227 -> 172.31.31.144 OpenFlow 558 Type: OFPT_PACKET_IN
182 2.429098124 172.31.31.144 -> 172.31.24.227 TCP 66 6633 → 39452 [ACK] Seq=1 Ack=247 Win=853 Len=0 TSval=363842 TSecr=118924452
183 2.429115629 172.31.31.144 -> 172.31.24.227 TCP 66 6633 → 39452 [ACK] Seq=1 Ack=739 Win=853 Len=0 TSval=363842 TSecr=118924452
184 2.447577754 172.31.24.227 -> 41.177.127.217 SSH 98 Server: Encrypted packet (len=44)
185 2.466667429 172.31.24.227 -> 172.31.31.144 TCP 66 39490 → 6633 [ACK] Seq=1 Ack=1211 Win=57 Len=0 TSval=118924462 TSecr=363842
186 2.466680901 172.31.24.227 -> 172.31.31.144 TCP 66 39466 → 6633 [ACK] Seq=1 Ack=2179 Win=363 Len=0 TSval=118924462 TSecr=363842
187 2.521982526 172.31.31.144 -> 172.31.24.227 OpenFlow 187 Type: OFPT_PACKET_OUT
188 2.522008950 172.31.31.144 -> 172.31.24.227 OpenFlow 187 Type: OFPT_PACKET_OUT
189 2.522031183 172.31.31.144 -> 172.31.24.227 OpenFlow 187 Type: OFPT_PACKET_OUT
190 2.522085852 172.31.31.144 -> 172.31.24.227 OpenFlow 187 Type: OFPT_PACKET_OUT
191 2.522140070 172.31.31.144 -> 172.31.24.227 OpenFlow 187 Type: OFPT_PACKET_OUT
192 2.522147197 172.31.24.227 -> 172.31.31.144 TCP 66 39472 → 6633 [ACK] Seq=247 Ack=606 Win=63 Len=0 TSval=118924475 TSecr=363865
193 2.522197927 172.31.31.144 -> 172.31.24.227 OpenFlow 187 Type: OFPT_PACKET_OUT
194 2.522230743 172.31.31.144 -> 172.31.24.227 OpenFlow 187 Type: OFPT_PACKET_OUT
195 2.522292782 172.31.31.144 -> 172.31.24.227 OpenFlow 187 Type: OFPT_PACKET_OUT
196 2.522452192 172.31.31.144 -> 172.31.24.227 OpenFlow 187 Type: OFPT_PACKET_OUT
197 2.522481534 172.31.31.144 -> 172.31.24.227 OpenFlow 187 Type: OFPT_PACKET_OUT
198 2.522550871 172.31.31.144 -> 172.31.24.227 OpenFlow 187 Type: OFPT_PACKET_OUT
199 2.522568290 172.31.24.227 -> 172.31.31.144 TCP 66 39472 → 6633 [ACK] Seq=247 Ack=969 Win=63 Len=0 TSval=118924475 TSecr=363865
200 2.522609331 172.31.31.144 -> 172.31.24.227 OpenFlow 187 Type: OFPT_PACKET_OUT
201 2.522654756 172.31.31.144 -> 172.31.24.227 OpenFlow 187 Type: OFPT_PACKET_OUT
202 2.522660497 172.31.24.227 -> 172.31.31.144 TCP 66 39492 → 6633 [ACK] Seq=739 Ack=606 Win=70 Len=0 TSval=118924476 TSecr=363866
203 2.522706558 172.31.24.227 -> 172.31.31.144 OpenFlow 189 Type: OFPT_PACKET_IN
204 2.522726941 172.31.24.227 -> 172.31.31.144 OpenFlow 189 Type: OFPT_PACKET_IN
205 2.522755752 172.31.31.144 -> 172.31.24.227 OpenFlow 187 Type: OFPT_PACKET_OUT
206 2.522762709 172.31.24.227 -> 172.31.31.144 OpenFlow 189 Type: OFPT_PACKET_IN
207 2.522781120 172.31.31.144 -> 172.31.24.227 OpenFlow 187 Type: OFPT_PACKET_OUT
208 2.522786440 172.31.24.227 -> 172.31.31.144 OpenFlow 189 Type: OFPT_PACKET_IN
209 2.522824168 172.31.24.227 -> 172.31.31.144 OpenFlow 189 Type: OFPT_PACKET_IN
210 2.522846991 172.31.24.227 -> 172.31.31.144 OpenFlow 189 Type: OFPT_PACKET_IN
211 2.522872339 172.31.31.144 -> 172.31.24.227 OpenFlow 187 Type: OFPT_PACKET_OUT
212 2.522896022 172.31.31.144 -> 172.31.24.227 OpenFlow 187 Type: OFPT_PACKET_OUT
213 2.522960689 172.31.31.144 -> 172.31.24.227 OpenFlow 187 Type: OFPT_PACKET_OUT
214 2.522966202 172.31.24.227 -> 172.31.31.144 TCP 66 39492 → 6633 [ACK] Seq=739 Ack=1211 Win=70 Len=0 TSval=118924476 TSecr=363866
215 2.523006800 172.31.31.144 -> 172.31.24.227 TCP 66 6633 → 39474 [ACK] Seq=1 Ack=247 Win=853 Len=0 TSval=363866 TSecr=118924476
216 2.523012810 172.31.31.144 -> 172.31.24.227 TCP 66 6633 → 39486 [ACK] Seq=969 Ack=124 Win=853 Len=0 TSval=363866 TSecr=118924476
217 2.523032606 172.31.31.144 -> 172.31.24.227 TCP 66 6633 → 39482 [ACK] Seq=1 Ack=247 Win=853 Len=0 TSval=363866 TSecr=118924476
218 2.523052911 172.31.31.144 -> 172.31.24.227 TCP 66 6633 → 39486 [ACK] Seq=969 Ack=247 Win=853 Len=0 TSval=363866 TSecr=118924476
219 2.523111409 172.31.31.144 -> 172.31.24.227 TCP 187 6633 → 39460 [PSH, ACK] Seq=1 Ack=1 Win=853 Len=121 TSval=363866 TSecr=118923733
220 2.523153664 172.31.31.144 -> 172.31.24.227 TCP 187 6633 → 39460 [PSH, ACK] Seq=122 Ack=1 Win=853 Len=121 TSval=363866 TSecr=118923733
221 2.523172120 172.31.31.144 -> 172.31.24.227 TCP 187 6633 → 39460 [PSH, ACK] Seq=243 Ack=1 Win=853 Len=121 TSval=363866 TSecr=118923733
222 2.523263130 172.31.31.144 -> 172.31.24.227 TCP 187 6633 → 39460 [PSH, ACK] Seq=364 Ack=1 Win=853 Len=121 TSval=363866 TSecr=118923733
223 2.523296728 172.31.31.144 -> 172.31.24.227 TCP 187 6633 → 39460 [PSH, ACK] Seq=485 Ack=1 Win=853 Len=121 TSval=363866 TSecr=118923733
224 2.523375681 172.31.31.144 -> 172.31.24.227 TCP 187 6633 → 39460 [PSH, ACK] Seq=606 Ack=1 Win=853 Len=121 TSval=363866 TSecr=118923733
225 2.523381659 172.31.24.227 -> 172.31.31.144 TCP 66 39460 → 6633 [ACK] Seq=1 Ack=727 Win=73 Len=0 TSval=118924476 TSecr=363866
226 2.523464252 172.31.31.144 -> 172.31.24.227 TCP 187 6633 → 39460 [PSH, ACK] Seq=727 Ack=1 Win=853 Len=121 TSval=363866 TSecr=118923733
227 2.523503524 172.31.24.227 -> 172.31.31.144 OpenFlow 189 Type: OFPT_PACKET_IN
228 2.523522785 172.31.31.144 -> 172.31.24.227 TCP 187 6633 → 39460 [PSH, ACK] Seq=848 Ack=1 Win=853 Len=121 TSval=363866 TSecr=118923733
229 2.523529036 172.31.24.227 -> 172.31.31.144 OpenFlow 189 Type: OFPT_PACKET_IN
230 2.523646391 172.31.31.144 -> 172.31.24.227 TCP 187 6633 → 39488 [PSH, ACK] Seq=1 Ack=1 Win=853 Len=121 TSval=363866 TSecr=118923734
231 2.523663482 172.31.31.144 -> 172.31.24.227 TCP 187 6633 → 39488 [PSH, ACK] Seq=122 Ack=1 Win=853 Len=121 TSval=363866 TSecr=118923734
232 2.523711299 172.31.31.144 -> 172.31.24.227 TCP 187 6633 → 39488 [PSH, ACK] Seq=243 Ack=1 Win=853 Len=121 TSval=363866 TSecr=118923734
233 2.523740118 172.31.31.144 -> 172.31.24.227 TCP 66 6633 → 39450 [ACK] Seq=1 Ack=985 Win=853 Len=0 TSval=363866 TSecr=118924476
234 2.523773129 172.31.31.144 -> 172.31.24.227 TCP 187 6633 → 39488 [PSH, ACK] Seq=364 Ack=1 Win=853 Len=121 TSval=363866 TSecr=118923734
235 2.523821386 172.31.31.144 -> 172.31.24.227 TCP 187 6633 → 39488 [PSH, ACK] Seq=485 Ack=1 Win=853 Len=121 TSval=363866 TSecr=118923734
236 2.523826841 172.31.24.227 -> 172.31.31.144 TCP 66 39488 → 6633 [ACK] Seq=1 Ack=606 Win=59 Len=0 TSval=118924476 TSecr=363866
237 2.523859557 172.31.24.227 -> 172.31.31.144 TCP 66 39460 → 6633 [ACK] Seq=1 Ack=969 Win=73 Len=0 TSval=118924476 TSecr=363866
238 2.523902139 172.31.31.144 -> 172.31.24.227 TCP 187 6633 → 39488 [PSH, ACK] Seq=606 Ack=1 Win=853 Len=121 TSval=363866 TSecr=118923734
239 2.523932667 172.31.24.227 -> 172.31.31.144 OpenFlow 189 Type: OFPT_PACKET_IN
240 2.523952379 172.31.24.227 -> 172.31.31.144 OpenFlow 189 Type: OFPT_PACKET_IN
241 2.523964583 172.31.24.227 -> 172.31.31.144 OpenFlow 189 Type: OFPT_PACKET_IN
242 2.523975953 172.31.24.227 -> 172.31.31.144 OpenFlow 189 Type: OFPT_PACKET_IN
243 2.524028848 172.31.24.227 -> 172.31.31.144 OpenFlow 189 Type: OFPT_PACKET_IN
244 2.524031013 172.31.24.227 -> 172.31.31.144 OpenFlow 189 Type: OFPT_PACKET_IN
245 2.524036726 172.31.31.144 -> 172.31.24.227 TCP 187 6633 → 39488 [PSH, ACK] Seq=727 Ack=1 Win=853 Len=121 TSval=363866 TSecr=118924476
246 2.524065787 172.31.24.227 -> 172.31.31.144 OpenFlow 189 Type: OFPT_PACKET_IN
247 2.524070536 172.31.24.227 -> 172.31.31.144 OpenFlow 189 Type: OFPT_PACKET_IN
248 2.524109265 172.31.31.144 -> 172.31.24.227 TCP 187 6633 → 39488 [PSH, ACK] Seq=848 Ack=1 Win=853 Len=121 TSval=363866 TSecr=118924476
249 2.524156179 172.31.31.144 -> 172.31.24.227 TCP 66 6633 → 39462 [ACK] Seq=1 Ack=862 Win=853 Len=0 TSval=363866 TSecr=118924476
250 2.524170851 172.31.31.144 -> 172.31.24.227 TCP 66 6633 → 39462 [ACK] Seq=1 Ack=985 Win=853 Len=0 TSval=363866 TSecr=118924476
251 2.524193421 172.31.31.144 -> 172.31.24.227 TCP 66 6633 → 39468 [ACK] Seq=1695 Ack=124 Win=853 Len=0 TSval=363866 TSecr=118924476
252 2.524212128 172.31.31.144 -> 172.31.24.227 TCP 66 6633 → 39480 [ACK] Seq=1453 Ack=124 Win=853 Len=0 TSval=363866 TSecr=118924476
253 2.524215432 172.31.31.144 -> 172.31.24.227 OpenFlow 187 Type: OFPT_PACKET_OUT
254 2.524229975 172.31.31.144 -> 172.31.24.227 OpenFlow 187 Type: OFPT_PACKET_OUT
255 2.524250377 172.31.31.144 -> 172.31.24.227 OpenFlow 187 Type: OFPT_PACKET_OUT
256 2.524272993 172.31.31.144 -> 172.31.24.227 TCP 66 6633 → 39468 [ACK] Seq=1695 Ack=247 Win=853 Len=0 TSval=363866 TSecr=118924476
257 2.524276478 172.31.31.144 -> 172.31.24.227 TCP 66 6633 → 39480 [ACK] Seq=1453 Ack=247 Win=853 Len=0 TSval=363866 TSecr=118924476
258 2.524365398 172.31.24.227 -> 172.31.31.144 TCP 66 39488 → 6633 [ACK] Seq=1 Ack=969 Win=59 Len=0 TSval=118924476 TSecr=363866
259 2.524460103 172.31.31.144 -> 172.31.24.227 TCP 66 6633 → 39466 [ACK] Seq=2179 Ack=247 Win=853 Len=0 TSval=363866 TSecr=118924476
260 2.524524941 172.31.24.227 -> 172.31.31.144 OpenFlow 189 Type: OFPT_PACKET_IN
261 2.524535481 172.31.31.144 -> 172.31.24.227 OpenFlow 187 Type: OFPT_PACKET_OUT
262 2.524550493 172.31.24.227 -> 172.31.31.144 OpenFlow 189 Type: OFPT_PACKET_IN
263 2.524577774 172.31.24.227 -> 172.31.31.144 OpenFlow 189 Type: OFPT_PACKET_IN
264 2.524591726 172.31.31.144 -> 172.31.24.227 OpenFlow 187 Type: OFPT_PACKET_OUT
265 2.524595979 172.31.24.227 -> 172.31.31.144 OpenFlow 312 Type: OFPT_PACKET_IN
266 2.524615003 172.31.24.227 -> 172.31.31.144 OpenFlow 189 Type: OFPT_PACKET_IN
267 2.524627642 172.31.24.227 -> 172.31.31.144 OpenFlow 189 Type: OFPT_PACKET_IN
268 2.524670830 172.31.24.227 -> 172.31.31.144 OpenFlow 435 Type: OFPT_PACKET_IN
269 2.524689550 172.31.24.227 -> 172.31.31.144 OpenFlow 189 Type: OFPT_PACKET_IN
270 2.524698466 172.31.31.144 -> 172.31.24.227 OpenFlow 187 Type: OFPT_PACKET_OUT
271 2.524720357 172.31.24.227 -> 172.31.31.144 OpenFlow 189 Type: OFPT_PACKET_IN
272 2.524745828 172.31.31.144 -> 172.31.24.227 TCP 66 6633 → 39446 [ACK] Seq=1 Ack=1108 Win=853 Len=0 TSval=363866 TSecr=118924476
273 2.524750230 172.31.31.144 -> 172.31.24.227 OpenFlow 187 Type: OFPT_PACKET_OUT
274 2.524769415 172.31.31.144 -> 172.31.24.227 TCP 66 6633 → 39446 [ACK] Seq=1 Ack=1231 Win=853 Len=0 TSval=363866 TSecr=118924476
275 2.524784029 172.31.31.144 -> 172.31.24.227 TCP 66 6633 → 39452 [ACK] Seq=1 Ack=862 Win=853 Len=0 TSval=363866 TSecr=118924476
276 2.524822711 172.31.31.144 -> 172.31.24.227 TCP 66 6633 → 39452 [ACK] Seq=1 Ack=1108 Win=853 Len=0 TSval=363866 TSecr=118924476
277 2.524837223 172.31.31.144 -> 172.31.24.227 TCP 66 6633 → 39452 [ACK] Seq=1 Ack=1231 Win=853 Len=0 TSval=363866 TSecr=118924476
278 2.524859237 172.31.31.144 -> 172.31.24.227 OpenFlow 187 Type: OFPT_PACKET_OUT
279 2.524881112 172.31.31.144 -> 172.31.24.227 TCP 66 6633 → 39458 [ACK] Seq=1 Ack=1354 Win=853 Len=0 TSval=363866 TSecr=118924476
280 2.524902814 172.31.31.144 -> 172.31.24.227 TCP 66 6633 → 39458 [ACK] Seq=1 Ack=1723 Win=853 Len=0 TSval=363866 TSecr=118924476
281 2.524924618 172.31.31.144 -> 172.31.24.227 OpenFlow 187 Type: OFPT_PACKET_OUT
282 2.525109528 172.31.24.227 -> 172.31.31.144 TCP 66 39474 → 6633 [ACK] Seq=493 Ack=1090 Win=200 Len=0 TSval=118924476 TSecr=363866
283 2.525186953 172.31.24.227 -> 172.31.31.144 OpenFlow 189 Type: OFPT_PACKET_IN
284 2.525216315 172.31.24.227 -> 172.31.31.144 OpenFlow 189 Type: OFPT_PACKET_IN
285 2.525228358 172.31.24.227 -> 172.31.31.144 OpenFlow 189 Type: OFPT_PACKET_IN
286 2.525313537 172.31.24.227 -> 172.31.31.144 OpenFlow 189 Type: OFPT_PACKET_IN
287 2.525332012 172.31.24.227 -> 172.31.31.144 OpenFlow 435 Type: OFPT_PACKET_IN
288 2.525388870 172.31.31.144 -> 172.31.24.227 TCP 66 6633 → 39488 [ACK] Seq=969 Ack=124 Win=853 Len=0 TSval=363866 TSecr=118924476
289 2.525412138 172.31.31.144 -> 172.31.24.227 TCP 66 6633 → 39488 [ACK] Seq=969 Ack=247 Win=853 Len=0 TSval=363866 TSecr=118924476
290 2.525424356 172.31.24.227 -> 172.31.31.144 OpenFlow 189 Type: OFPT_PACKET_IN
291 2.525432752 172.31.31.144 -> 172.31.24.227 OpenFlow 187 Type: OFPT_PACKET_OUT
292 2.525441918 172.31.24.227 -> 172.31.31.144 OpenFlow 189 Type: OFPT_PACKET_IN
293 2.525465717 172.31.31.144 -> 172.31.24.227 OpenFlow 429 Type: OFPT_PACKET_OUT
294 2.525511751 172.31.31.144 -> 172.31.24.227 TCP 66 6633 → 39446 [ACK] Seq=1 Ack=1354 Win=853 Len=0 TSval=363866 TSecr=118924476
295 2.525528843 172.31.31.144 -> 172.31.24.227 TCP 66 6633 → 39446 [ACK] Seq=1 Ack=1723 Win=853 Len=0 TSval=363866 TSecr=118924476
296 2.525622512 172.31.31.144 -> 172.31.24.227 OpenFlow 187 Type: OFPT_PACKET_OUT
297 2.525641299 172.31.31.144 -> 172.31.24.227 TCP 66 6633 → 39472 [ACK] Seq=969 Ack=493 Win=853 Len=0 TSval=363866 TSecr=118924476
298 2.525686667 172.31.24.227 -> 172.31.31.144 TCP 66 39474 → 6633 [ACK] Seq=493 Ack=1695 Win=203 Len=0 TSval=118924476 TSecr=363866
299 2.525760444 172.31.24.227 -> 172.31.31.144 OpenFlow 189 Type: OFPT_PACKET_IN
300 2.525780262 172.31.24.227 -> 172.31.31.144 OpenFlow 558 Type: OFPT_PACKET_IN
301 2.525982659 172.31.31.144 -> 172.31.24.227 TCP 66 6633 → 39482 [ACK] Seq=1 Ack=985 Win=853 Len=0 TSval=363866 TSecr=118924476
302 2.622095886 172.31.31.144 -> 172.31.24.227 OpenFlow 187 Type: OFPT_PACKET_OUT
303 2.622116999 172.31.31.144 -> 172.31.24.227 OpenFlow 187 Type: OFPT_PACKET_OUT
304 2.622135086 172.31.31.144 -> 172.31.24.227 OpenFlow 187 Type: OFPT_PACKET_OUT
305 2.622189608 172.31.31.144 -> 172.31.24.227 OpenFlow 187 Type: OFPT_PACKET_OUT
306 2.622237874 172.31.31.144 -> 172.31.24.227 OpenFlow 187 Type: OFPT_PACKET_OUT
307 2.622290682 172.31.31.144 -> 172.31.24.227 OpenFlow 187 Type: OFPT_PACKET_OUT
308 2.622395398 172.31.31.144 -> 172.31.24.227 OpenFlow 187 Type: OFPT_PACKET_OUT
309 2.622405330 172.31.24.227 -> 172.31.31.144 TCP 66 39470 → 6633 [ACK] Seq=739 Ack=848 Win=88 Len=0 TSval=118924500 TSecr=363890
310 2.622485917 172.31.31.144 -> 172.31.24.227 OpenFlow 187 Type: OFPT_PACKET_OUT
311 2.622539912 172.31.31.144 -> 172.31.24.227 OpenFlow 187 Type: OFPT_PACKET_OUT
312 2.622618633 172.31.31.144 -> 172.31.24.227 OpenFlow 187 Type: OFPT_PACKET_OUT
313 2.622723683 172.31.31.144 -> 172.31.24.227 OpenFlow 187 Type: OFPT_PACKET_OUT
314 2.622763530 172.31.31.144 -> 172.31.24.227 OpenFlow 187 Type: OFPT_PACKET_OUT
315 2.622809726 172.31.31.144 -> 172.31.24.227 OpenFlow 187 Type: OFPT_PACKET_OUT
316 2.622863810 172.31.31.144 -> 172.31.24.227 OpenFlow 187 Type: OFPT_PACKET_OUT
317 2.622907875 172.31.31.144 -> 172.31.24.227 OpenFlow 187 Type: OFPT_PACKET_OUT
318 2.622913986 172.31.24.227 -> 172.31.31.144 TCP 66 39458 → 6633 [ACK] Seq=1723 Ack=606 Win=80 Len=0 TSval=118924501 TSecr=363891
319 2.622956399 172.31.24.227 -> 172.31.31.144 TCP 66 39470 → 6633 [ACK] Seq=739 Ack=1211 Win=88 Len=0 TSval=118924501 TSecr=363891
320 2.622985790 172.31.31.144 -> 172.31.24.227 OpenFlow 187 Type: OFPT_PACKET_OUT
321 2.623037605 172.31.31.144 -> 172.31.24.227 OpenFlow 187 Type: OFPT_PACKET_OUT
322 2.623060780 172.31.24.227 -> 172.31.31.144 OpenFlow 189 Type: OFPT_PACKET_IN
323 2.623086865 172.31.24.227 -> 172.31.31.144 OpenFlow 189 Type: OFPT_PACKET_IN
324 2.623135031 172.31.31.144 -> 172.31.24.227 OpenFlow 187 Type: OFPT_PACKET_OUT
325 2.623158132 172.31.31.144 -> 172.31.24.227 OpenFlow 187 Type: OFPT_PACKET_OUT
326 2.623221045 172.31.31.144 -> 172.31.24.227 OpenFlow 187 Type: OFPT_PACKET_OUT
327 2.623225594 172.31.24.227 -> 172.31.31.144 TCP 66 39458 → 6633 [ACK] Seq=1723 Ack=1211 Win=80 Len=0 TSval=118924501 TSecr=363891
328 2.623307743 172.31.31.144 -> 172.31.24.227 OpenFlow 187 Type: OFPT_PACKET_OUT
329 2.623377200 172.31.31.144 -> 172.31.24.227 OpenFlow 187 Type: OFPT_PACKET_OUT
330 2.623395018 172.31.31.144 -> 172.31.24.227 TCP 66 6633 → 39476 [ACK] Seq=1 Ack=493 Win=853 Len=0 TSval=363891 TSecr=118924501
331 2.623413062 172.31.31.144 -> 172.31.24.227 OpenFlow 187 Type: OFPT_PACKET_OUT
332 2.623462269 172.31.31.144 -> 172.31.24.227 OpenFlow 187 Type: OFPT_PACKET_OUT
333 2.623514080 172.31.31.144 -> 172.31.24.227 OpenFlow 187 Type: OFPT_PACKET_OUT
334 2.623522436 172.31.24.227 -> 172.31.31.144 TCP 66 39458 → 6633 [ACK] Seq=1723 Ack=1816 Win=80 Len=0 TSval=118924501 TSecr=363891
335 2.623572046 172.31.31.144 -> 172.31.24.227 OpenFlow 187 Type: OFPT_PACKET_OUT
336 2.623705716 172.31.31.144 -> 172.31.24.227 OpenFlow 187 Type: OFPT_PACKET_OUT
337 2.623760432 172.31.31.144 -> 172.31.24.227 OpenFlow 187 Type: OFPT_PACKET_OUT
338 2.623817772 172.31.31.144 -> 172.31.24.227 OpenFlow 187 Type: OFPT_PACKET_OUT
339 2.623890528 172.31.31.144 -> 172.31.24.227 OpenFlow 187 Type: OFPT_PACKET_OUT
340 2.623895833 172.31.24.227 -> 172.31.31.144 TCP 66 39458 → 6633 [ACK] Seq=1723 Ack=2421 Win=80 Len=0 TSval=118924501 TSecr=363891
341 2.623993306 172.31.31.144 -> 172.31.24.227 TCP 187 6633 → 39454 [PSH, ACK] Seq=1 Ack=1 Win=853 Len=121 TSval=363891 TSecr=118923733
342 2.624061048 172.31.31.144 -> 172.31.24.227 TCP 187 6633 → 39454 [PSH, ACK] Seq=122 Ack=1 Win=853 Len=121 TSval=363891 TSecr=118923733
343 2.624110671 172.31.31.144 -> 172.31.24.227 TCP 187 6633 → 39454 [PSH, ACK] Seq=243 Ack=1 Win=853 Len=121 TSval=363891 TSecr=118923733
344 2.624170665 172.31.31.144 -> 172.31.24.227 TCP 187 6633 → 39454 [PSH, ACK] Seq=364 Ack=1 Win=853 Len=121 TSval=363891 TSecr=118923733
345 2.624240003 172.31.31.144 -> 172.31.24.227 TCP 187 6633 → 39454 [PSH, ACK] Seq=485 Ack=1 Win=853 Len=121 TSval=363891 TSecr=118923733
346 2.624245694 172.31.24.227 -> 172.31.31.144 TCP 66 39454 → 6633 [ACK] Seq=1 Ack=606 Win=55 Len=0 TSval=118924501 TSecr=363891
347 2.624289999 172.31.31.144 -> 172.31.24.227 TCP 187 6633 → 39454 [PSH, ACK] Seq=606 Ack=1 Win=853 Len=121 TSval=363891 TSecr=118923733
348 2.624347332 172.31.24.227 -> 172.31.31.144 OpenFlow 189 Type: OFPT_PACKET_IN
349 2.624369403 172.31.31.144 -> 172.31.24.227 TCP 187 6633 → 39454 [PSH, ACK] Seq=727 Ack=1 Win=853 Len=121 TSval=363891 TSecr=118923733
350 2.624375419 172.31.24.227 -> 172.31.31.144 OpenFlow 435 Type: OFPT_PACKET_IN
351 2.624401937 172.31.24.227 -> 172.31.31.144 OpenFlow 189 Type: OFPT_PACKET_IN
352 2.624417537 172.31.31.144 -> 172.31.24.227 TCP 187 6633 → 39454 [PSH, ACK] Seq=848 Ack=1 Win=853 Len=121 TSval=363891 TSecr=118923733
353 2.624421897 172.31.24.227 -> 172.31.31.144 OpenFlow 435 Type: OFPT_PACKET_IN
354 2.624441238 172.31.24.227 -> 172.31.31.144 OpenFlow 804 Type: OFPT_PACKET_IN
355 2.624454341 172.31.24.227 -> 172.31.31.144 OpenFlow 189 Type: OFPT_PACKET_IN
356 2.624463746 172.31.31.144 -> 172.31.24.227 TCP 187 6633 → 39454 [PSH, ACK] Seq=969 Ack=1 Win=853 Len=121 TSval=363891 TSecr=118924501
357 2.624492959 172.31.24.227 -> 172.31.31.144 OpenFlow 189 Type: OFPT_PACKET_IN
358 2.624527883 172.31.31.144 -> 172.31.24.227 TCP 187 6633 → 39454 [PSH, ACK] Seq=1090 Ack=1 Win=853 Len=121 TSval=363891 TSecr=118924501
359 2.624531363 172.31.24.227 -> 172.31.31.144 TCP 66 39454 → 6633 [ACK] Seq=1 Ack=1211 Win=55 Len=0 TSval=118924501 TSecr=363891
