  1 0.000000000 172.31.23.72 -> 172.31.31.144 OpenFlow 146 Type: OFPT_PORT_STATUS
  2 0.000066692 172.31.23.72 -> 172.31.31.144 OpenFlow 146 Type: OFPT_PORT_STATUS
  3 0.000224467 172.31.31.144 -> 172.31.23.72 TCP 66 6633 → 48334 [ACK] Seq=1 Ack=81 Win=853 Len=0 TSval=3407956 TSecr=21978082
  4 0.038374897 172.31.31.144 -> 172.31.23.72 TCP 66 6633 → 48338 [ACK] Seq=1 Ack=81 Win=853 Len=0 TSval=3407966 TSecr=21978082
  5 0.042331471 172.31.31.144 -> 172.31.23.72 OpenFlow 146 Type: OFPT_FLOW_MOD
  6 0.042341870 172.31.31.144 -> 172.31.23.72 TCP 146 6633 → 48352 [PSH, ACK] Seq=1 Ack=1 Win=853 Len=80 TSval=3407967 TSecr=21977410
  7 0.042345990 172.31.31.144 -> 172.31.23.72 TCP 154 6633 → 48352 [PSH, ACK] Seq=81 Ack=1 Win=853 Len=88 TSval=3407967 TSecr=21977410
  8 0.042361533 172.31.31.144 -> 172.31.23.72 TCP 146 6633 → 48364 [PSH, ACK] Seq=1 Ack=1 Win=853 Len=80 TSval=3407967 TSecr=21977409
  9 0.042376390 172.31.31.144 -> 172.31.23.72 TCP 146 6633 → 48344 [PSH, ACK] Seq=1 Ack=1 Win=853 Len=80 TSval=3407967 TSecr=21977409
 10 0.042396378 172.31.31.144 -> 172.31.23.72 OpenFlow 154 Type: OFPT_BARRIER_REQUEST
 11 0.042416830 172.31.31.144 -> 172.31.23.72 TCP 154 6633 → 48364 [PSH, ACK] Seq=81 Ack=1 Win=853 Len=88 TSval=3407967 TSecr=21977409
 12 0.042437463 172.31.31.144 -> 172.31.23.72 TCP 146 6633 → 48326 [PSH, ACK] Seq=1 Ack=1 Win=853 Len=80 TSval=3407967 TSecr=21977410
 13 0.042458288 172.31.31.144 -> 172.31.23.72 OpenFlow 146 Type: OFPT_FLOW_MOD
 14 0.042477611 172.31.31.144 -> 172.31.23.72 OpenFlow 154 Type: OFPT_BARRIER_REQUEST
 15 0.042497171 172.31.31.144 -> 172.31.23.72 TCP 146 6633 → 48344 [PSH, ACK] Seq=81 Ack=1 Win=853 Len=80 TSval=3407967 TSecr=21977409
 16 0.042525469 172.31.31.144 -> 172.31.23.72 TCP 146 6633 → 48326 [PSH, ACK] Seq=81 Ack=1 Win=853 Len=80 TSval=3407967 TSecr=21977410
 17 0.042528808 172.31.31.144 -> 172.31.23.72 TCP 74 6633 → 48326 [PSH, ACK] Seq=161 Ack=1 Win=853 Len=8 TSval=3407967 TSecr=21977410
 18 0.042559548 172.31.31.144 -> 172.31.23.72 TCP 74 6633 → 48344 [PSH, ACK] Seq=161 Ack=1 Win=853 Len=8 TSval=3407967 TSecr=21977409
 19 0.042610559 172.31.23.72 -> 172.31.31.144 TCP 66 48326 → 6633 [ACK] Seq=1 Ack=169 Win=213 Len=0 TSval=21978092 TSecr=3407967
 20 0.042624880 172.31.23.72 -> 172.31.31.144 OpenFlow 74 Type: OFPT_BARRIER_REPLY
 21 0.042684983 172.31.23.72 -> 172.31.31.144 TCP 66 48344 → 6633 [ACK] Seq=1 Ack=169 Win=213 Len=0 TSval=21978092 TSecr=3407967
 22 0.042694984 172.31.23.72 -> 172.31.31.144 OpenFlow 74 Type: OFPT_BARRIER_REPLY
 23 0.042733881 172.31.23.72 -> 172.31.31.144 TCP 66 48334 → 6633 [ACK] Seq=81 Ack=169 Win=213 Len=0 TSval=21978092 TSecr=3407967
 24 0.042747297 172.31.23.72 -> 172.31.31.144 OpenFlow 74 Type: OFPT_BARRIER_REPLY
 25 0.042782431 172.31.23.72 -> 172.31.31.144 TCP 66 48352 → 6633 [ACK] Seq=1 Ack=169 Win=213 Len=0 TSval=21978092 TSecr=3407967
 26 0.042790224 172.31.23.72 -> 172.31.31.144 OpenFlow 74 Type: OFPT_BARRIER_REPLY
 27 0.042812172 172.31.23.72 -> 172.31.31.144 TCP 66 48338 → 6633 [ACK] Seq=81 Ack=169 Win=213 Len=0 TSval=21978092 TSecr=3407967
 28 0.042816993 172.31.23.72 -> 172.31.31.144 OpenFlow 74 Type: OFPT_BARRIER_REPLY
 29 0.042852290 172.31.23.72 -> 172.31.31.144 TCP 66 48364 → 6633 [ACK] Seq=1 Ack=169 Win=213 Len=0 TSval=21978092 TSecr=3407967
 30 0.042862009 172.31.23.72 -> 172.31.31.144 OpenFlow 74 Type: OFPT_BARRIER_REPLY
 31 0.042881996 172.31.31.144 -> 172.31.23.72 TCP 146 6633 → 48366 [PSH, ACK] Seq=1 Ack=1 Win=853 Len=80 TSval=3407967 TSecr=21977410
 32 0.042887293 172.31.31.144 -> 172.31.23.72 TCP 66 6633 → 48326 [ACK] Seq=169 Ack=9 Win=853 Len=0 TSval=3407967 TSecr=21978092
 33 0.042947342 172.31.31.144 -> 172.31.23.72 OpenFlow 146 Type: OFPT_FLOW_MOD
 34 0.042950258 172.31.31.144 -> 172.31.23.72 TCP 66 6633 → 48344 [ACK] Seq=169 Ack=9 Win=853 Len=0 TSval=3407967 TSecr=21978092
 35 0.042952814 172.31.31.144 -> 172.31.23.72 TCP 154 6633 → 48366 [PSH, ACK] Seq=81 Ack=1 Win=853 Len=88 TSval=3407967 TSecr=21977410
 36 0.042954985 172.31.31.144 -> 172.31.23.72 TCP 146 6633 → 48346 [PSH, ACK] Seq=1 Ack=1 Win=853 Len=80 TSval=3407967 TSecr=21977410
 37 0.042960130 172.31.31.144 -> 172.31.23.72 TCP 66 6633 → 48334 [ACK] Seq=169 Ack=89 Win=853 Len=0 TSval=3407967 TSecr=21978092
 38 0.042978891 172.31.31.144 -> 172.31.23.72 OpenFlow 154 Type: OFPT_BARRIER_REQUEST
 39 0.042997561 172.31.31.144 -> 172.31.23.72 TCP 146 6633 → 48354 [PSH, ACK] Seq=1 Ack=1 Win=853 Len=80 TSval=3407967 TSecr=21977410
 40 0.043017249 172.31.31.144 -> 172.31.23.72 OpenFlow 146 Type: OFPT_FLOW_MOD
 41 0.043036113 172.31.31.144 -> 172.31.23.72 OpenFlow 154 Type: OFPT_BARRIER_REQUEST
 42 0.043057084 172.31.31.144 -> 172.31.23.72 TCP 154 6633 → 48354 [PSH, ACK] Seq=81 Ack=1 Win=853 Len=88 TSval=3407967 TSecr=21977410
 43 0.043074884 172.31.31.144 -> 172.31.23.72 OpenFlow 146 Type: OFPT_FLOW_MOD
 44 0.043104057 172.31.31.144 -> 172.31.23.72 TCP 66 6633 → 48338 [ACK] Seq=337 Ack=89 Win=853 Len=0 TSval=3407967 TSecr=21978092
 45 0.043129466 172.31.31.144 -> 172.31.23.72 TCP 234 6633 → 48346 [PSH, ACK] Seq=81 Ack=1 Win=853 Len=168 TSval=3407967 TSecr=21977410
 46 0.043144205 172.31.31.144 -> 172.31.23.72 OpenFlow 322 Type: OFPT_BARRIER_REQUEST
 47 0.043164694 172.31.31.144 -> 172.31.23.72 TCP 154 6633 → 48346 [PSH, ACK] Seq=249 Ack=1 Win=853 Len=88 TSval=3407967 TSecr=21977410
 48 0.043185420 172.31.31.144 -> 172.31.23.72 TCP 146 6633 → 48354 [PSH, ACK] Seq=169 Ack=1 Win=853 Len=80 TSval=3407967 TSecr=21977410
 49 0.043203137 172.31.31.144 -> 172.31.23.72 OpenFlow 146 Type: OFPT_FLOW_MOD
 50 0.043222707 172.31.31.144 -> 172.31.23.72 OpenFlow 146 Type: OFPT_FLOW_MOD
 51 0.043230983 172.31.23.72 -> 172.31.31.144 OpenFlow 146 Type: OFPT_FLOW_REMOVED
 52 0.043253641 172.31.31.144 -> 172.31.23.72 OpenFlow 146 Type: OFPT_FLOW_MOD
 53 0.043269892 172.31.31.144 -> 172.31.23.72 TCP 146 6633 → 48324 [PSH, ACK] Seq=1 Ack=1 Win=853 Len=80 TSval=3407967 TSecr=21977410
 54 0.043280029 172.31.31.144 -> 172.31.23.72 OpenFlow 146 Type: OFPT_FLOW_MOD
 55 0.043285810 172.31.23.72 -> 172.31.31.144 OpenFlow 146 Type: OFPT_FLOW_REMOVED
 56 0.043296089 172.31.23.72 -> 172.31.31.144 OpenFlow 146 Type: OFPT_FLOW_REMOVED
 57 0.043302519 172.31.31.144 -> 172.31.23.72 TCP 146 6633 → 48354 [PSH, ACK] Seq=249 Ack=1 Win=853 Len=80 TSval=3407967 TSecr=21977410
 58 0.043310590 172.31.23.72 -> 172.31.31.144 OpenFlow 146 Type: OFPT_FLOW_REMOVED
 59 0.043321708 172.31.23.72 -> 172.31.31.144 OpenFlow 146 Type: OFPT_FLOW_REMOVED
 60 0.043330617 172.31.23.72 -> 172.31.31.144 OpenFlow 146 Type: OFPT_FLOW_REMOVED
 61 0.043333150 172.31.23.72 -> 172.31.31.144 OpenFlow 146 Type: OFPT_FLOW_REMOVED
 62 0.043341519 172.31.23.72 -> 172.31.31.144 OpenFlow 146 Type: OFPT_FLOW_REMOVED
 63 0.043352193 172.31.31.144 -> 172.31.23.72 OpenFlow 74 Type: OFPT_BARRIER_REQUEST
 64 0.043355843 172.31.23.72 -> 172.31.31.144 OpenFlow 146 Type: OFPT_FLOW_REMOVED
 65 0.043360945 172.31.31.144 -> 172.31.23.72 OpenFlow 146 Type: OFPT_FLOW_MOD
 66 0.043450496 172.31.23.72 -> 172.31.31.144 OpenFlow 146 Type: OFPT_FLOW_REMOVED
 67 0.043453057 172.31.23.72 -> 172.31.31.144 OpenFlow 146 Type: OFPT_FLOW_REMOVED
 68 0.043504197 172.31.31.144 -> 172.31.23.72 TCP 146 6633 → 48324 [PSH, ACK] Seq=81 Ack=1 Win=853 Len=80 TSval=3407967 TSecr=21977410
 69 0.043507195 172.31.31.144 -> 172.31.23.72 TCP 146 6633 → 48332 [PSH, ACK] Seq=1 Ack=1 Win=853 Len=80 TSval=3407967 TSecr=21977585
 70 0.043510317 172.31.31.144 -> 172.31.23.72 OpenFlow 146 Type: OFPT_FLOW_MOD
 71 0.043513737 172.31.23.72 -> 172.31.31.144 OpenFlow 146 Type: OFPT_FLOW_REMOVED
 72 0.043518967 172.31.31.144 -> 172.31.23.72 OpenFlow 146 Type: OFPT_FLOW_MOD
 73 0.043520927 172.31.31.144 -> 172.31.23.72 TCP 146 6633 → 48366 [PSH, ACK] Seq=169 Ack=1 Win=853 Len=80 TSval=3407967 TSecr=21977410
 74 0.043522662 172.31.31.144 -> 172.31.23.72 TCP 146 6633 → 48360 [PSH, ACK] Seq=1 Ack=1 Win=853 Len=80 TSval=3407967 TSecr=21977409
 75 0.043525632 172.31.31.144 -> 172.31.23.72 TCP 154 6633 → 48332 [PSH, ACK] Seq=81 Ack=1 Win=853 Len=88 TSval=3407967 TSecr=21977585
 76 0.043530614 172.31.31.144 -> 172.31.23.72 TCP 154 6633 → 48360 [PSH, ACK] Seq=81 Ack=1 Win=853 Len=88 TSval=3407967 TSecr=21977409
 77 0.043532451 172.31.31.144 -> 172.31.23.72 OpenFlow 146 Type: OFPT_FLOW_MOD
 78 0.043534320 172.31.31.144 -> 172.31.23.72 OpenFlow 146 Type: OFPT_FLOW_MOD
 79 0.043574335 172.31.31.144 -> 172.31.23.72 TCP 74 6633 → 48324 [PSH, ACK] Seq=161 Ack=1 Win=853 Len=8 TSval=3407967 TSecr=21977410
 80 0.043576815 172.31.31.144 -> 172.31.23.72 OpenFlow 74 Type: OFPT_BARRIER_REQUEST
 81 0.043578988 172.31.31.144 -> 172.31.23.72 OpenFlow 154 Type: OFPT_BARRIER_REQUEST
 82 0.043580485 172.31.31.144 -> 172.31.23.72 OpenFlow 322 Type: OFPT_BARRIER_REQUEST
 83 0.043595591 172.31.31.144 -> 172.31.23.72 TCP 146 6633 → 48366 [PSH, ACK] Seq=249 Ack=1 Win=853 Len=80 TSval=3407967 TSecr=21977410
 84 0.043597573 172.31.31.144 -> 172.31.23.72 TCP 146 6633 → 48340 [PSH, ACK] Seq=1 Ack=1 Win=853 Len=80 TSval=3407967 TSecr=21977410
 85 0.043630065 172.31.31.144 -> 172.31.23.72 TCP 74 6633 → 48354 [PSH, ACK] Seq=329 Ack=1 Win=853 Len=8 TSval=3407967 TSecr=21977410
 86 0.043647670 172.31.31.144 -> 172.31.23.72 OpenFlow 146 Type: OFPT_FLOW_MOD
 87 0.043667148 172.31.31.144 -> 172.31.23.72 OpenFlow 154 Type: OFPT_BARRIER_REQUEST
 88 0.043687484 172.31.31.144 -> 172.31.23.72 TCP 74 6633 → 48366 [PSH, ACK] Seq=329 Ack=1 Win=853 Len=8 TSval=3407967 TSecr=21977410
 89 0.043706761 172.31.31.144 -> 172.31.23.72 OpenFlow 74 Type: OFPT_BARRIER_REQUEST
 90 0.043726168 172.31.31.144 -> 172.31.23.72 TCP 146 6633 → 48340 [PSH, ACK] Seq=81 Ack=1 Win=853 Len=80 TSval=3407967 TSecr=21977410
 91 0.043745828 172.31.31.144 -> 172.31.23.72 OpenFlow 234 Type: OFPT_BARRIER_REQUEST
 92 0.043764881 172.31.31.144 -> 172.31.23.72 TCP 74 6633 → 48340 [PSH, ACK] Seq=161 Ack=1 Win=853 Len=8 TSval=3407967 TSecr=21977410
 93 0.043784804 172.31.31.144 -> 172.31.23.72 TCP 146 6633 → 48324 [PSH, ACK] Seq=169 Ack=1 Win=853 Len=80 TSval=3407967 TSecr=21977410
 94 0.043810143 172.31.31.144 -> 172.31.23.72 TCP 146 6633 → 48356 [PSH, ACK] Seq=1 Ack=1 Win=853 Len=80 TSval=3407967 TSecr=21977408
 95 0.043829495 172.31.31.144 -> 172.31.23.72 TCP 154 6633 → 48356 [PSH, ACK] Seq=81 Ack=1 Win=853 Len=88 TSval=3407967 TSecr=21977408
 96 0.043850354 172.31.31.144 -> 172.31.23.72 TCP 146 6633 → 48336 [PSH, ACK] Seq=1 Ack=1 Win=853 Len=80 TSval=3407967 TSecr=21977585
 97 0.043868596 172.31.31.144 -> 172.31.23.72 OpenFlow 146 Type: OFPT_FLOW_MOD
 98 0.043888221 172.31.31.144 -> 172.31.23.72 OpenFlow 146 Type: OFPT_FLOW_MOD
 99 0.043907663 172.31.31.144 -> 172.31.23.72 TCP 154 6633 → 48324 [PSH, ACK] Seq=249 Ack=1 Win=853 Len=88 TSval=3407967 TSecr=21977410
100 0.043939983 172.31.31.144 -> 172.31.23.72 OpenFlow 146 Type: OFPT_FLOW_MOD
101 0.043943002 172.31.31.144 -> 172.31.23.72 OpenFlow 154 Type: OFPT_BARRIER_REQUEST
102 0.043963522 172.31.31.144 -> 172.31.23.72 TCP 154 6633 → 48336 [PSH, ACK] Seq=81 Ack=1 Win=853 Len=88 TSval=3407967 TSecr=21977585
103 0.043982113 172.31.31.144 -> 172.31.23.72 TCP 146 6633 → 48350 [PSH, ACK] Seq=1 Ack=1 Win=853 Len=80 TSval=3407967 TSecr=21977410
104 0.044002092 172.31.31.144 -> 172.31.23.72 TCP 146 6633 → 48342 [PSH, ACK] Seq=1 Ack=1 Win=853 Len=80 TSval=3407967 TSecr=21977408
105 0.044021082 172.31.31.144 -> 172.31.23.72 OpenFlow 146 Type: OFPT_FLOW_MOD
106 0.044040545 172.31.31.144 -> 172.31.23.72 TCP 146 6633 → 48336 [PSH, ACK] Seq=169 Ack=1 Win=853 Len=80 TSval=3407967 TSecr=21977585
107 0.044059340 172.31.31.144 -> 172.31.23.72 OpenFlow 154 Type: OFPT_BARRIER_REQUEST
108 0.044079460 172.31.31.144 -> 172.31.23.72 OpenFlow 146 Type: OFPT_FLOW_MOD
109 0.044108555 172.31.31.144 -> 172.31.23.72 TCP 154 6633 → 48342 [PSH, ACK] Seq=81 Ack=1 Win=853 Len=88 TSval=3407967 TSecr=21977408
110 0.044127612 172.31.31.144 -> 172.31.23.72 TCP 146 6633 → 48350 [PSH, ACK] Seq=81 Ack=1 Win=853 Len=80 TSval=3407967 TSecr=21977410
111 0.044146106 172.31.31.144 -> 172.31.23.72 OpenFlow 74 Type: OFPT_BARRIER_REQUEST
112 0.044164815 172.31.31.144 -> 172.31.23.72 TCP 74 6633 → 48350 [PSH, ACK] Seq=161 Ack=1 Win=853 Len=8 TSval=3407967 TSecr=21977410
113 0.044183692 172.31.31.144 -> 172.31.23.72 OpenFlow 170 Type: OFPT_FLOW_MOD
114 0.044202502 172.31.31.144 -> 172.31.23.72 TCP 170 6633 → 48362 [PSH, ACK] Seq=1 Ack=1 Win=853 Len=104 TSval=3407967 TSecr=21977409
115 0.044221028 172.31.31.144 -> 172.31.23.72 OpenFlow 170 Type: OFPT_FLOW_MOD
116 0.044239846 172.31.31.144 -> 172.31.23.72 TCP 170 6633 → 48332 [PSH, ACK] Seq=169 Ack=1 Win=853 Len=104 TSval=3407967 TSecr=21977585
117 0.044259156 172.31.31.144 -> 172.31.23.72 OpenFlow 146 Type: OFPT_FLOW_MOD
118 0.044277586 172.31.31.144 -> 172.31.23.72 OpenFlow 178 Type: OFPT_BARRIER_REQUEST
119 0.044296559 172.31.31.144 -> 172.31.23.72 OpenFlow 170 Type: OFPT_FLOW_MOD
120 0.044315135 172.31.31.144 -> 172.31.23.72 OpenFlow 146 Type: OFPT_FLOW_MOD
121 0.044333673 172.31.31.144 -> 172.31.23.72 TCP 170 6633 → 48342 [PSH, ACK] Seq=169 Ack=1 Win=853 Len=104 TSval=3407967 TSecr=21977408
122 0.044353030 172.31.31.144 -> 172.31.23.72 TCP 170 6633 → 48350 [PSH, ACK] Seq=169 Ack=1 Win=853 Len=104 TSval=3407967 TSecr=21977410
123 0.044371992 172.31.31.144 -> 172.31.23.72 TCP 178 6633 → 48342 [PSH, ACK] Seq=273 Ack=1 Win=853 Len=112 TSval=3407967 TSecr=21977408
124 0.044390159 172.31.31.144 -> 172.31.23.72 TCP 170 6633 → 48350 [PSH, ACK] Seq=273 Ack=1 Win=853 Len=104 TSval=3407967 TSecr=21977410
125 0.044412220 172.31.31.144 -> 172.31.23.72 TCP 66 6633 → 48344 [ACK] Seq=337 Ack=169 Win=853 Len=0 TSval=3407967 TSecr=21978093
126 0.044430981 172.31.31.144 -> 172.31.23.72 TCP 74 6633 → 48350 [PSH, ACK] Seq=377 Ack=1 Win=853 Len=8 TSval=3407967 TSecr=21977410
127 0.044449840 172.31.31.144 -> 172.31.23.72 OpenFlow 74 Type: OFPT_BARRIER_REQUEST
128 0.044471234 172.31.31.144 -> 172.31.23.72 OpenFlow 290 Type: OFPT_BARRIER_REQUEST
129 0.044488574 172.31.31.144 -> 172.31.23.72 TCP 66 6633 → 48338 [ACK] Seq=1009 Ack=249 Win=853 Len=0 TSval=3407967 TSecr=21978093
130 0.044508059 172.31.31.144 -> 172.31.23.72 TCP 178 6633 → 48332 [PSH, ACK] Seq=273 Ack=1 Win=853 Len=112 TSval=3407967 TSecr=21977585
131 0.044526852 172.31.31.144 -> 172.31.23.72 TCP 178 6633 → 48362 [PSH, ACK] Seq=105 Ack=1 Win=853 Len=112 TSval=3407967 TSecr=21977409
132 0.044546062 172.31.31.144 -> 172.31.23.72 OpenFlow 74 Type: OFPT_BARRIER_REQUEST
133 0.044565635 172.31.31.144 -> 172.31.23.72 OpenFlow 170 Type: OFPT_FLOW_MOD
134 0.044584443 172.31.31.144 -> 172.31.23.72 OpenFlow 170 Type: OFPT_FLOW_MOD
135 0.044603049 172.31.31.144 -> 172.31.23.72 OpenFlow 170 Type: OFPT_FLOW_MOD
136 0.044633203 172.31.31.144 -> 172.31.23.72 TCP 146 6633 → 48336 [PSH, ACK] Seq=249 Ack=1 Win=853 Len=80 TSval=3407967 TSecr=21977585
137 0.044648777 172.31.31.144 -> 172.31.23.72 TCP 290 6633 → 48336 [PSH, ACK] Seq=329 Ack=1 Win=853 Len=224 TSval=3407967 TSecr=21977585
138 0.044667637 172.31.31.144 -> 172.31.23.72 OpenFlow 170 Type: OFPT_FLOW_MOD
139 0.046151337 172.31.23.72 -> 172.31.31.144 OpenFlow 74 Type: OFPT_BARRIER_REPLY
140 0.046179560 172.31.23.72 -> 172.31.31.144 OpenFlow 74 Type: OFPT_BARRIER_REPLY
141 0.046207201 172.31.23.72 -> 172.31.31.144 OpenFlow 74 Type: OFPT_BARRIER_REPLY
142 0.046237318 172.31.23.72 -> 172.31.31.144 OpenFlow 74 Type: OFPT_BARRIER_REPLY
143 0.046266001 172.31.23.72 -> 172.31.31.144 OpenFlow 74 Type: OFPT_BARRIER_REPLY
144 0.046283616 172.31.23.72 -> 172.31.31.144 OpenFlow 74 Type: OFPT_BARRIER_REPLY
145 0.046304811 172.31.23.72 -> 172.31.31.144 OpenFlow 74 Type: OFPT_BARRIER_REPLY
146 0.046330162 172.31.31.144 -> 172.31.23.72 TCP 66 6633 → 48346 [ACK] Seq=337 Ack=9 Win=853 Len=0 TSval=3407968 TSecr=21978093
147 0.046338324 172.31.23.72 -> 172.31.31.144 OpenFlow 74 Type: OFPT_BARRIER_REPLY
148 0.046355047 172.31.31.144 -> 172.31.23.72 TCP 66 6633 → 48346 [ACK] Seq=337 Ack=17 Win=853 Len=0 TSval=3407968 TSecr=21978093
149 0.046361222 172.31.23.72 -> 172.31.31.144 OpenFlow 74 Type: OFPT_BARRIER_REPLY
150 0.046399277 172.31.31.144 -> 172.31.23.72 TCP 66 6633 → 48342 [ACK] Seq=385 Ack=9 Win=853 Len=0 TSval=3407968 TSecr=21978093
151 0.046410095 172.31.31.144 -> 172.31.23.72 TCP 66 6633 → 48342 [ACK] Seq=385 Ack=17 Win=853 Len=0 TSval=3407968 TSecr=21978093
152 0.046445749 172.31.23.72 -> 172.31.31.144 TCP 66 48340 → 6633 [ACK] Seq=1 Ack=169 Win=213 Len=0 TSval=21978093 TSecr=3407967
153 0.046456077 172.31.23.72 -> 172.31.31.144 OpenFlow 74 Type: OFPT_BARRIER_REPLY
154 0.046465464 172.31.31.144 -> 172.31.23.72 TCP 66 6633 → 48326 [ACK] Seq=1265 Ack=193 Win=853 Len=0 TSval=3407968 TSecr=21978093
155 0.046499101 172.31.23.72 -> 172.31.31.144 OpenFlow 74 Type: OFPT_BARRIER_REPLY
156 0.046513903 172.31.31.144 -> 172.31.23.72 TCP 66 6633 → 48326 [ACK] Seq=1265 Ack=209 Win=853 Len=0 TSval=3407968 TSecr=21978093
157 0.046526577 172.31.23.72 -> 172.31.31.144 OpenFlow 74 Type: OFPT_BARRIER_REPLY
158 0.046556487 172.31.23.72 -> 172.31.31.144 OpenFlow 74 Type: OFPT_BARRIER_REPLY
159 0.046580166 172.31.23.72 -> 172.31.31.144 OpenFlow 74 Type: OFPT_BARRIER_REPLY
160 0.046605645 172.31.23.72 -> 172.31.31.144 TCP 66 48344 → 6633 [ACK] Seq=169 Ack=337 Win=213 Len=0 TSval=21978093 TSecr=3407967
161 0.046612707 172.31.23.72 -> 172.31.31.144 OpenFlow 74 Type: OFPT_BARRIER_REPLY
162 0.046630645 172.31.23.72 -> 172.31.31.144 TCP 66 48356 → 6633 [ACK] Seq=1 Ack=169 Win=213 Len=0 TSval=21978093 TSecr=3407967
163 0.046638269 172.31.23.72 -> 172.31.31.144 OpenFlow 74 Type: OFPT_BARRIER_REPLY
164 0.046657442 172.31.23.72 -> 172.31.31.144 OpenFlow 74 Type: OFPT_BARRIER_REPLY
165 0.046666335 172.31.31.144 -> 172.31.23.72 TCP 66 6633 → 48324 [ACK] Seq=337 Ack=9 Win=853 Len=0 TSval=3407968 TSecr=21978093
166 0.046670138 172.31.31.144 -> 172.31.23.72 TCP 66 6633 → 48324 [ACK] Seq=337 Ack=17 Win=853 Len=0 TSval=3407968 TSecr=21978093
167 0.046713231 172.31.23.72 -> 172.31.31.144 OpenFlow 82 Type: OFPT_BARRIER_REPLY
168 0.046729400 172.31.23.72 -> 172.31.31.144 OpenFlow 74 Type: OFPT_BARRIER_REPLY
169 0.046735375 172.31.31.144 -> 172.31.23.72 TCP 66 6633 → 48350 [ACK] Seq=385 Ack=9 Win=853 Len=0 TSval=3407968 TSecr=21978093
170 0.046738558 172.31.31.144 -> 172.31.23.72 TCP 66 6633 → 48350 [ACK] Seq=385 Ack=17 Win=853 Len=0 TSval=3407968 TSecr=21978093
171 0.046760949 172.31.23.72 -> 172.31.31.144 OpenFlow 82 Type: OFPT_BARRIER_REPLY
172 0.046787184 172.31.23.72 -> 172.31.31.144 OpenFlow 82 Type: OFPT_BARRIER_REPLY
173 0.046812097 172.31.31.144 -> 172.31.23.72 TCP 66 6633 → 48356 [ACK] Seq=169 Ack=9 Win=853 Len=0 TSval=3407968 TSecr=21978093
174 0.046817486 172.31.23.72 -> 172.31.31.144 OpenFlow 74 Type: OFPT_BARRIER_REPLY
175 0.046848732 172.31.23.72 -> 172.31.31.144 TCP 66 48352 → 6633 [ACK] Seq=169 Ack=337 Win=213 Len=0 TSval=21978093 TSecr=3407967
176 0.046856463 172.31.23.72 -> 172.31.31.144 OpenFlow 74 Type: OFPT_BARRIER_REPLY
177 0.046875351 172.31.23.72 -> 172.31.31.144 OpenFlow 74 Type: OFPT_BARRIER_REPLY
178 0.046881761 172.31.31.144 -> 172.31.23.72 TCP 66 6633 → 48336 [ACK] Seq=553 Ack=25 Win=853 Len=0 TSval=3407968 TSecr=21978093
179 0.046928259 172.31.23.72 -> 172.31.31.144 OpenFlow 98 Type: OFPT_BARRIER_REPLY
180 0.046951590 172.31.23.72 -> 172.31.31.144 OpenFlow 74 Type: OFPT_BARRIER_REPLY
181 0.046968463 172.31.31.144 -> 172.31.23.72 TCP 66 6633 → 48334 [ACK] Seq=1329 Ack=273 Win=853 Len=0 TSval=3407968 TSecr=21978093
182 0.046989109 172.31.23.72 -> 172.31.31.144 OpenFlow 74 Type: OFPT_BARRIER_REPLY
183 0.047033391 172.31.23.72 -> 172.31.31.144 TCP 66 48362 → 6633 [ACK] Seq=1 Ack=217 Win=213 Len=0 TSval=21978093 TSecr=3407967
184 0.047035980 172.31.23.72 -> 172.31.31.144 OpenFlow 74 Type: OFPT_BARRIER_REPLY
185 0.047045660 172.31.31.144 -> 172.31.23.72 TCP 66 6633 → 48334 [ACK] Seq=1329 Ack=297 Win=853 Len=0 TSval=3407968 TSecr=21978093
186 0.047050478 172.31.23.72 -> 172.31.31.144 OpenFlow 74 Type: OFPT_BARRIER_REPLY
187 0.047056384 172.31.23.72 -> 172.31.31.144 OpenFlow 74 Type: OFPT_BARRIER_REPLY
188 0.047082332 172.31.23.72 -> 172.31.31.144 TCP 66 48360 → 6633 [ACK] Seq=1 Ack=169 Win=213 Len=0 TSval=21978093 TSecr=3407967
189 0.047086695 172.31.23.72 -> 172.31.31.144 OpenFlow 74 Type: OFPT_BARRIER_REPLY
190 0.047105004 172.31.23.72 -> 172.31.31.144 OpenFlow 74 Type: OFPT_BARRIER_REPLY
191 0.047119818 172.31.31.144 -> 172.31.23.72 TCP 66 6633 → 48338 [ACK] Seq=1009 Ack=289 Win=853 Len=0 TSval=3407968 TSecr=21978093
192 0.047148885 172.31.23.72 -> 172.31.31.144 OpenFlow 74 Type: OFPT_BARRIER_REPLY
193 0.047329965 172.31.31.144 -> 172.31.23.72 TCP 66 6633 → 48366 [ACK] Seq=337 Ack=9 Win=853 Len=0 TSval=3407968 TSecr=21978093
194 0.047336457 172.31.31.144 -> 172.31.23.72 TCP 66 6633 → 48366 [ACK] Seq=337 Ack=17 Win=853 Len=0 TSval=3407968 TSecr=21978093
195 0.047338457 172.31.31.144 -> 172.31.23.72 TCP 66 6633 → 48364 [ACK] Seq=657 Ack=185 Win=853 Len=0 TSval=3407968 TSecr=21978093
196 0.047340662 172.31.31.144 -> 172.31.23.72 TCP 66 6633 → 48362 [ACK] Seq=217 Ack=9 Win=853 Len=0 TSval=3407968 TSecr=21978093
197 0.047346443 172.31.23.72 -> 172.31.31.144 OpenFlow 74 Type: OFPT_BARRIER_REPLY
198 0.047352852 172.31.23.72 -> 172.31.31.144 OpenFlow 74 Type: OFPT_BARRIER_REPLY
199 0.047378332 172.31.23.72 -> 172.31.31.144 OpenFlow 146 Type: OFPT_FLOW_REMOVED
200 0.047394496 172.31.23.72 -> 172.31.31.144 OpenFlow 146 Type: OFPT_FLOW_REMOVED
201 0.047404759 172.31.23.72 -> 172.31.31.144 OpenFlow 146 Type: OFPT_FLOW_REMOVED
202 0.047429625 172.31.31.144 -> 172.31.23.72 OpenFlow 170 Type: OFPT_FLOW_MOD
203 0.047433617 172.31.23.72 -> 172.31.31.144 OpenFlow 146 Type: OFPT_FLOW_REMOVED
204 0.047438921 172.31.23.72 -> 172.31.31.144 OpenFlow 306 Type: OFPT_FLOW_REMOVED
205 0.047448461 172.31.23.72 -> 172.31.31.144 OpenFlow 146 Type: OFPT_FLOW_REMOVED
206 0.047460361 172.31.23.72 -> 172.31.31.144 OpenFlow 146 Type: OFPT_FLOW_REMOVED
207 0.047468029 172.31.23.72 -> 172.31.31.144 OpenFlow 146 Type: OFPT_FLOW_REMOVED
208 0.047469939 172.31.23.72 -> 172.31.31.144 OpenFlow 146 Type: OFPT_FLOW_REMOVED
209 0.047477451 172.31.23.72 -> 172.31.31.144 OpenFlow 146 Type: OFPT_FLOW_REMOVED
210 0.047484923 172.31.23.72 -> 172.31.31.144 OpenFlow 146 Type: OFPT_FLOW_REMOVED
211 0.047501402 172.31.23.72 -> 172.31.31.144 OpenFlow 146 Type: OFPT_FLOW_REMOVED
212 0.047524013 172.31.23.72 -> 172.31.31.144 OpenFlow 146 Type: OFPT_FLOW_REMOVED
213 0.047525839 172.31.23.72 -> 172.31.31.144 OpenFlow 626 Type: OFPT_FLOW_REMOVED
214 0.047533411 172.31.23.72 -> 172.31.31.144 OpenFlow 146 Type: OFPT_FLOW_REMOVED
215 0.047547109 172.31.31.144 -> 172.31.23.72 OpenFlow 170 Type: OFPT_FLOW_MOD
216 0.047550970 172.31.31.144 -> 172.31.23.72 OpenFlow 178 Type: OFPT_BARRIER_REQUEST
217 0.047553078 172.31.31.144 -> 172.31.23.72 OpenFlow 170 Type: OFPT_FLOW_MOD
218 0.047555769 172.31.23.72 -> 172.31.31.144 OpenFlow 146 Type: OFPT_FLOW_REMOVED
219 0.047572981 172.31.23.72 -> 172.31.31.144 OpenFlow 146 Type: OFPT_FLOW_REMOVED
220 0.047587864 172.31.23.72 -> 172.31.31.144 OpenFlow 146 Type: OFPT_FLOW_REMOVED
221 0.047595111 172.31.23.72 -> 172.31.31.144 OpenFlow 146 Type: OFPT_FLOW_REMOVED
222 0.047602176 172.31.23.72 -> 172.31.31.144 OpenFlow 146 Type: OFPT_FLOW_REMOVED
223 0.047613703 172.31.23.72 -> 172.31.31.144 OpenFlow 146 Type: OFPT_FLOW_REMOVED
224 0.047869551 172.31.23.72 -> 172.31.31.144 OpenFlow 306 Type: OFPT_FLOW_REMOVED
225 0.047872487 172.31.23.72 -> 172.31.31.144 OpenFlow 146 Type: OFPT_FLOW_REMOVED
226 0.047874329 172.31.23.72 -> 172.31.31.144 OpenFlow 146 Type: OFPT_FLOW_REMOVED
227 0.047876058 172.31.23.72 -> 172.31.31.144 OpenFlow 146 Type: OFPT_FLOW_REMOVED
228 0.047877780 172.31.23.72 -> 172.31.31.144 OpenFlow 306 Type: OFPT_FLOW_REMOVED
229 0.047879511 172.31.23.72 -> 172.31.31.144 OpenFlow 786 Type: OFPT_FLOW_REMOVED
230 0.047881152 172.31.23.72 -> 172.31.31.144 OpenFlow 146 Type: OFPT_FLOW_REMOVED
231 0.048019151 172.31.31.144 -> 172.31.23.72 TCP 66 6633 → 48354 [ACK] Seq=337 Ack=17 Win=853 Len=0 TSval=3407968 TSecr=21978093
232 0.048024314 172.31.23.72 -> 172.31.31.144 OpenFlow 306 Type: OFPT_FLOW_REMOVED
233 0.048026122 172.31.31.144 -> 172.31.23.72 OpenFlow 178 Type: OFPT_BARRIER_REQUEST
234 0.048028768 172.31.23.72 -> 172.31.31.144 OpenFlow 146 Type: OFPT_FLOW_REMOVED
235 0.048030818 172.31.31.144 -> 172.31.23.72 OpenFlow 170 Type: OFPT_FLOW_MOD
236 0.048032446 172.31.31.144 -> 172.31.23.72 OpenFlow 170 Type: OFPT_FLOW_MOD
237 0.048034168 172.31.31.144 -> 172.31.23.72 OpenFlow 178 Type: OFPT_BARRIER_REQUEST
238 0.048035792 172.31.31.144 -> 172.31.23.72 TCP 66 6633 → 48346 [ACK] Seq=337 Ack=97 Win=853 Len=0 TSval=3407968 TSecr=21978094
239 0.048037480 172.31.31.144 -> 172.31.23.72 TCP 66 6633 → 48342 [ACK] Seq=385 Ack=97 Win=853 Len=0 TSval=3407968 TSecr=21978094
240 0.048039254 172.31.31.144 -> 172.31.23.72 OpenFlow 74 Type: OFPT_BARRIER_REQUEST
241 0.048040658 172.31.31.144 -> 172.31.23.72 OpenFlow 170 Type: OFPT_FLOW_MOD
242 0.048042227 172.31.31.144 -> 172.31.23.72 OpenFlow 170 Type: OFPT_FLOW_MOD
243 0.048044129 172.31.31.144 -> 172.31.23.72 OpenFlow 178 Type: OFPT_BARRIER_REQUEST
244 0.048046166 172.31.31.144 -> 172.31.23.72 OpenFlow 170 Type: OFPT_FLOW_MOD
245 0.048048707 172.31.31.144 -> 172.31.23.72 OpenFlow 170 Type: OFPT_FLOW_MOD
246 0.048050213 172.31.31.144 -> 172.31.23.72 OpenFlow 74 Type: OFPT_BARRIER_REQUEST
247 0.048052132 172.31.31.144 -> 172.31.23.72 OpenFlow 170 Type: OFPT_FLOW_MOD
248 0.048053677 172.31.31.144 -> 172.31.23.72 OpenFlow 170 Type: OFPT_FLOW_MOD
249 0.048056200 172.31.23.72 -> 172.31.31.144 OpenFlow 146 Type: OFPT_FLOW_REMOVED
250 0.048062245 172.31.31.144 -> 172.31.23.72 OpenFlow 170 Type: OFPT_FLOW_MOD
251 0.048064033 172.31.31.144 -> 172.31.23.72 OpenFlow 178 Type: OFPT_BARRIER_REQUEST
252 0.048065646 172.31.31.144 -> 172.31.23.72 OpenFlow 170 Type: OFPT_FLOW_MOD
253 0.048067329 172.31.31.144 -> 172.31.23.72 OpenFlow 178 Type: OFPT_BARRIER_REQUEST
254 0.048068763 172.31.31.144 -> 172.31.23.72 OpenFlow 178 Type: OFPT_BARRIER_REQUEST
255 0.048070532 172.31.31.144 -> 172.31.23.72 TCP 66 6633 → 48346 [ACK] Seq=337 Ack=337 Win=853 Len=0 TSval=3407968 TSecr=21978094
256 0.048072341 172.31.31.144 -> 172.31.23.72 OpenFlow 170 Type: OFPT_FLOW_MOD
257 0.048074000 172.31.31.144 -> 172.31.23.72 OpenFlow 178 Type: OFPT_BARRIER_REQUEST
258 0.048075931 172.31.31.144 -> 172.31.23.72 OpenFlow 178 Type: OFPT_BARRIER_REQUEST
259 0.048077363 172.31.31.144 -> 172.31.23.72 TCP 66 6633 → 48350 [ACK] Seq=385 Ack=97 Win=853 Len=0 TSval=3407968 TSecr=21978094
260 0.048089746 172.31.23.72 -> 172.31.31.144 OpenFlow 306 Type: OFPT_FLOW_REMOVED
261 0.048091946 172.31.23.72 -> 172.31.31.144 OpenFlow 786 Type: OFPT_FLOW_REMOVED
262 0.048093868 172.31.23.72 -> 172.31.31.144 OpenFlow 146 Type: OFPT_FLOW_REMOVED
263 0.048581570 172.31.31.144 -> 172.31.23.72 OpenFlow 170 Type: OFPT_FLOW_MOD
264 0.048584181 172.31.31.144 -> 172.31.23.72 OpenFlow 170 Type: OFPT_FLOW_MOD
265 0.048585904 172.31.31.144 -> 172.31.23.72 OpenFlow 178 Type: OFPT_BARRIER_REQUEST
266 0.048587507 172.31.31.144 -> 172.31.23.72 OpenFlow 170 Type: OFPT_FLOW_MOD
267 0.048589093 172.31.31.144 -> 172.31.23.72 OpenFlow 170 Type: OFPT_FLOW_MOD
268 0.048591094 172.31.31.144 -> 172.31.23.72 OpenFlow 170 Type: OFPT_FLOW_MOD
269 0.048592845 172.31.31.144 -> 172.31.23.72 OpenFlow 178 Type: OFPT_BARRIER_REQUEST
270 0.048594987 172.31.31.144 -> 172.31.23.72 TCP 66 6633 → 48344 [ACK] Seq=337 Ack=257 Win=853 Len=0 TSval=3407968 TSecr=21978093
271 0.048597328 172.31.31.144 -> 172.31.23.72 OpenFlow 170 Type: OFPT_FLOW_MOD
272 0.048599452 172.31.31.144 -> 172.31.23.72 OpenFlow 178 Type: OFPT_BARRIER_REQUEST
273 0.048600965 172.31.31.144 -> 172.31.23.72 OpenFlow 170 Type: OFPT_FLOW_MOD
274 0.048602374 172.31.31.144 -> 172.31.23.72 OpenFlow 170 Type: OFPT_FLOW_MOD
275 0.048603707 172.31.31.144 -> 172.31.23.72 OpenFlow 170 Type: OFPT_FLOW_MOD
276 0.048605908 172.31.31.144 -> 172.31.23.72 OpenFlow 170 Type: OFPT_FLOW_MOD
277 0.048607389 172.31.31.144 -> 172.31.23.72 OpenFlow 170 Type: OFPT_FLOW_MOD
278 0.048608925 172.31.31.144 -> 172.31.23.72 OpenFlow 178 Type: OFPT_BARRIER_REQUEST
279 0.048610231 172.31.31.144 -> 172.31.23.72 OpenFlow 74 Type: OFPT_BARRIER_REQUEST
280 0.048611384 172.31.31.144 -> 172.31.23.72 OpenFlow 290 Type: OFPT_BARRIER_REQUEST
281 0.048612910 172.31.31.144 -> 172.31.23.72 OpenFlow 170 Type: OFPT_FLOW_MOD
282 0.048614936 172.31.31.144 -> 172.31.23.72 TCP 66 6633 → 48352 [ACK] Seq=337 Ack=257 Win=853 Len=0 TSval=3407968 TSecr=21978093
283 0.048616999 172.31.31.144 -> 172.31.23.72 OpenFlow 74 Type: OFPT_BARRIER_REQUEST
284 0.048618733 172.31.31.144 -> 172.31.23.72 OpenFlow 170 Type: OFPT_FLOW_MOD
285 0.048620303 172.31.31.144 -> 172.31.23.72 OpenFlow 170 Type: OFPT_FLOW_MOD
286 0.048621609 172.31.31.144 -> 172.31.23.72 OpenFlow 74 Type: OFPT_BARRIER_REQUEST
287 0.048622859 172.31.31.144 -> 172.31.23.72 OpenFlow 170 Type: OFPT_FLOW_MOD
288 0.048624340 172.31.31.144 -> 172.31.23.72 OpenFlow 170 Type: OFPT_FLOW_MOD
289 0.048626398 172.31.31.144 -> 172.31.23.72 OpenFlow 170 Type: OFPT_FLOW_MOD
290 0.048627785 172.31.31.144 -> 172.31.23.72 OpenFlow 170 Type: OFPT_FLOW_MOD
291 0.048629309 172.31.31.144 -> 172.31.23.72 OpenFlow 74 Type: OFPT_BARRIER_REQUEST
292 0.048630556 172.31.31.144 -> 172.31.23.72 OpenFlow 170 Type: OFPT_FLOW_MOD
293 0.048632315 172.31.31.144 -> 172.31.23.72 OpenFlow 170 Type: OFPT_FLOW_MOD
294 0.048634351 172.31.31.144 -> 172.31.23.72 OpenFlow 170 Type: OFPT_FLOW_MOD
295 0.048715018 172.31.31.144 -> 172.31.23.72 OpenFlow 170 Type: OFPT_FLOW_MOD
296 0.048717892 172.31.31.144 -> 172.31.23.72 OpenFlow 170 Type: OFPT_FLOW_MOD
297 0.048720209 172.31.31.144 -> 172.31.23.72 OpenFlow 170 Type: OFPT_FLOW_MOD
298 0.048722648 172.31.31.144 -> 172.31.23.72 OpenFlow 74 Type: OFPT_BARRIER_REQUEST
299 0.048724065 172.31.31.144 -> 172.31.23.72 OpenFlow 170 Type: OFPT_FLOW_MOD
300 0.048725741 172.31.31.144 -> 172.31.23.72 OpenFlow 170 Type: OFPT_FLOW_MOD
301 0.048728067 172.31.31.144 -> 172.31.23.72 OpenFlow 178 Type: OFPT_BARRIER_REQUEST
302 0.048729576 172.31.31.144 -> 172.31.23.72 OpenFlow 170 Type: OFPT_FLOW_MOD
303 0.048731232 172.31.31.144 -> 172.31.23.72 OpenFlow 170 Type: OFPT_FLOW_MOD
304 0.048732955 172.31.31.144 -> 172.31.23.72 OpenFlow 274 Type: OFPT_FLOW_MOD
305 0.048738296 172.31.31.144 -> 172.31.23.72 OpenFlow 74 Type: OFPT_BARRIER_REQUEST
306 0.048748909 172.31.31.144 -> 172.31.23.72 OpenFlow 170 Type: OFPT_FLOW_MOD
307 0.048777895 172.31.31.144 -> 172.31.23.72 OpenFlow 170 Type: OFPT_FLOW_MOD
308 0.048784187 172.31.31.144 -> 172.31.23.72 OpenFlow 170 Type: OFPT_FLOW_MOD
309 0.048808314 172.31.31.144 -> 172.31.23.72 OpenFlow 178 Type: OFPT_BARRIER_REQUEST
310 0.048826049 172.31.31.144 -> 172.31.23.72 OpenFlow 170 Type: OFPT_FLOW_MOD
311 0.048844948 172.31.31.144 -> 172.31.23.72 OpenFlow 170 Type: OFPT_FLOW_MOD
312 0.048865300 172.31.31.144 -> 172.31.23.72 OpenFlow 178 Type: OFPT_BARRIER_REQUEST
313 0.048883051 172.31.31.144 -> 172.31.23.72 OpenFlow 170 Type: OFPT_FLOW_MOD
314 0.048901669 172.31.31.144 -> 172.31.23.72 OpenFlow 170 Type: OFPT_FLOW_MOD
315 0.048921312 172.31.31.144 -> 172.31.23.72 OpenFlow 170 Type: OFPT_FLOW_MOD
316 0.048939072 172.31.31.144 -> 172.31.23.72 OpenFlow 74 Type: OFPT_BARRIER_REQUEST
317 0.048958660 172.31.31.144 -> 172.31.23.72 OpenFlow 170 Type: OFPT_FLOW_MOD
318 0.048980060 172.31.31.144 -> 172.31.23.72 OpenFlow 170 Type: OFPT_FLOW_MOD
319 0.048982476 172.31.31.144 -> 172.31.23.72 OpenFlow 170 Type: OFPT_FLOW_MOD
320 0.049004767 172.31.31.144 -> 172.31.23.72 OpenFlow 74 Type: OFPT_BARRIER_REQUEST
321 0.049023226 172.31.31.144 -> 172.31.23.72 OpenFlow 74 Type: OFPT_BARRIER_REQUEST
322 0.049042668 172.31.31.144 -> 172.31.23.72 OpenFlow 170 Type: OFPT_FLOW_MOD
323 0.049076679 172.31.31.144 -> 172.31.23.72 OpenFlow 178 Type: OFPT_BARRIER_REQUEST
324 0.049078882 172.31.31.144 -> 172.31.23.72 OpenFlow 170 Type: OFPT_FLOW_MOD
325 0.049096620 172.31.31.144 -> 172.31.23.72 OpenFlow 282 Type: OFPT_BARRIER_REQUEST
326 0.049116277 172.31.31.144 -> 172.31.23.72 OpenFlow 274 Type: OFPT_FLOW_MOD
327 0.049134972 172.31.31.144 -> 172.31.23.72 OpenFlow 170 Type: OFPT_FLOW_MOD
328 0.049154335 172.31.31.144 -> 172.31.23.72 OpenFlow 74 Type: OFPT_BARRIER_REQUEST
329 0.049174447 172.31.31.144 -> 172.31.23.72 OpenFlow 170 Type: OFPT_FLOW_MOD
330 0.049191440 172.31.31.144 -> 172.31.23.72 OpenFlow 74 Type: OFPT_BARRIER_REQUEST
331 0.049209991 172.31.31.144 -> 172.31.23.72 OpenFlow 170 Type: OFPT_FLOW_MOD
332 0.049229119 172.31.31.144 -> 172.31.23.72 OpenFlow 170 Type: OFPT_FLOW_MOD
333 0.049248030 172.31.31.144 -> 172.31.23.72 OpenFlow 170 Type: OFPT_FLOW_MOD
334 0.049268139 172.31.31.144 -> 172.31.23.72 OpenFlow 170 Type: OFPT_FLOW_MOD
335 0.049286943 172.31.31.144 -> 172.31.23.72 OpenFlow 170 Type: OFPT_FLOW_MOD
336 0.049307795 172.31.31.144 -> 172.31.23.72 OpenFlow 170 Type: OFPT_FLOW_MOD
337 0.049326045 172.31.31.144 -> 172.31.23.72 OpenFlow 170 Type: OFPT_FLOW_MOD
338 0.049344677 172.31.31.144 -> 172.31.23.72 OpenFlow 170 Type: OFPT_FLOW_MOD
339 0.049363504 172.31.31.144 -> 172.31.23.72 OpenFlow 170 Type: OFPT_FLOW_MOD
340 0.049383368 172.31.31.144 -> 172.31.23.72 OpenFlow 274 Type: OFPT_FLOW_MOD
341 0.049402825 172.31.31.144 -> 172.31.23.72 OpenFlow 170 Type: OFPT_FLOW_MOD
342 0.049421333 172.31.31.144 -> 172.31.23.72 OpenFlow 170 Type: OFPT_FLOW_MOD
343 0.049440833 172.31.31.144 -> 172.31.23.72 OpenFlow 170 Type: OFPT_FLOW_MOD
344 0.049460644 172.31.31.144 -> 172.31.23.72 OpenFlow 170 Type: OFPT_FLOW_MOD
345 0.049478506 172.31.31.144 -> 172.31.23.72 OpenFlow 170 Type: OFPT_FLOW_MOD
346 0.049498680 172.31.31.144 -> 172.31.23.72 OpenFlow 170 Type: OFPT_FLOW_MOD
347 0.049516731 172.31.31.144 -> 172.31.23.72 OpenFlow 170 Type: OFPT_FLOW_MOD
348 0.049536199 172.31.31.144 -> 172.31.23.72 OpenFlow 170 Type: OFPT_FLOW_MOD
349 0.049555094 172.31.31.144 -> 172.31.23.72 OpenFlow 170 Type: OFPT_FLOW_MOD
350 0.049683905 172.31.23.72 -> 172.31.31.144 OpenFlow 74 Type: OFPT_BARRIER_REPLY
351 0.049718875 172.31.23.72 -> 172.31.31.144 OpenFlow 74 Type: OFPT_BARRIER_REPLY
352 0.049746872 172.31.23.72 -> 172.31.31.144 OpenFlow 74 Type: OFPT_BARRIER_REPLY
353 0.049791356 172.31.23.72 -> 172.31.31.144 OpenFlow 74 Type: OFPT_BARRIER_REPLY
354 0.049808787 172.31.23.72 -> 172.31.31.144 OpenFlow 74 Type: OFPT_BARRIER_REPLY
355 0.049856925 172.31.23.72 -> 172.31.31.144 OpenFlow 82 Type: OFPT_BARRIER_REPLY
356 0.049882043 172.31.23.72 -> 172.31.31.144 OpenFlow 74 Type: OFPT_BARRIER_REPLY
357 0.049891582 172.31.31.144 -> 172.31.23.72 TCP 66 6633 → 48346 [ACK] Seq=977 Ack=353 Win=853 Len=0 TSval=3407968 TSecr=21978094
358 0.049935324 172.31.23.72 -> 172.31.31.144 OpenFlow 74 Type: OFPT_BARRIER_REPLY
359 0.049963651 172.31.31.144 -> 172.31.23.72 TCP 66 6633 → 48342 [ACK] Seq=1025 Ack=193 Win=853 Len=0 TSval=3407968 TSecr=21978094
360 0.050003703 172.31.23.72 -> 172.31.31.144 OpenFlow 82 Type: OFPT_BARRIER_REPLY
361 0.050021303 172.31.23.72 -> 172.31.31.144 OpenFlow 74 Type: OFPT_BARRIER_REPLY
362 0.050044229 172.31.31.144 -> 172.31.23.72 TCP 66 6633 → 48326 [ACK] Seq=2433 Ack=873 Win=853 Len=0 TSval=3407968 TSecr=21978094
363 0.050077548 172.31.23.72 -> 172.31.31.144 OpenFlow 74 Type: OFPT_BARRIER_REPLY
364 0.050087169 172.31.23.72 -> 172.31.31.144 OpenFlow 74 Type: OFPT_BARRIER_REPLY
365 0.050142280 172.31.23.72 -> 172.31.31.144 OpenFlow 74 Type: OFPT_BARRIER_REPLY
366 0.050183584 172.31.23.72 -> 172.31.31.144 OpenFlow 82 Type: OFPT_BARRIER_REPLY
367 0.050215229 172.31.31.144 -> 172.31.23.72 TCP 66 6633 → 48324 [ACK] Seq=1193 Ack=361 Win=853 Len=0 TSval=3407968 TSecr=21978094
368 0.050238406 172.31.23.72 -> 172.31.31.144 OpenFlow 74 Type: OFPT_BARRIER_REPLY
369 0.050261724 172.31.23.72 -> 172.31.31.144 OpenFlow 74 Type: OFPT_BARRIER_REPLY
370 0.050309490 172.31.23.72 -> 172.31.31.144 OpenFlow 74 Type: OFPT_BARRIER_REPLY
371 0.050316990 172.31.31.144 -> 172.31.23.72 TCP 66 6633 → 48350 [ACK] Seq=1025 Ack=193 Win=853 Len=0 TSval=3407969 TSecr=21978094
372 0.050359286 172.31.31.144 -> 172.31.23.72 OpenFlow 394 Type: OFPT_FLOW_MOD
373 0.050366600 172.31.23.72 -> 172.31.31.144 OpenFlow 74 Type: OFPT_BARRIER_REPLY
374 0.050391802 172.31.23.72 -> 172.31.31.144 OpenFlow 74 Type: OFPT_BARRIER_REPLY
375 0.050432487 172.31.23.72 -> 172.31.31.144 OpenFlow 74 Type: OFPT_BARRIER_REPLY
376 0.050470084 172.31.31.144 -> 172.31.23.72 TCP 66 6633 → 48334 [ACK] Seq=1969 Ack=1113 Win=853 Len=0 TSval=3407969 TSecr=21978094
377 0.050480632 172.31.23.72 -> 172.31.31.144 OpenFlow 74 Type: OFPT_BARRIER_REPLY
378 0.050516285 172.31.23.72 -> 172.31.31.144 TCP 66 48362 → 6633 [ACK] Seq=9 Ack=433 Win=213 Len=0 TSval=21978094 TSecr=3407968
379 0.050524233 172.31.23.72 -> 172.31.31.144 OpenFlow 74 Type: OFPT_BARRIER_REPLY
380 0.050532145 172.31.31.144 -> 172.31.23.72 TCP 66 6633 → 48338 [ACK] Seq=1649 Ack=1105 Win=853 Len=0 TSval=3407969 TSecr=21978094
381 0.050561831 172.31.23.72 -> 172.31.31.144 OpenFlow 74 Type: OFPT_BARRIER_REPLY
382 0.050598151 172.31.31.144 -> 172.31.23.72 TCP 66 6633 → 48366 [ACK] Seq=1185 Ack=353 Win=853 Len=0 TSval=3407969 TSecr=21978094
383 0.050613618 172.31.23.72 -> 172.31.31.144 OpenFlow 74 Type: OFPT_BARRIER_REPLY
384 0.050641648 172.31.23.72 -> 172.31.31.144 OpenFlow 74 Type: OFPT_BARRIER_REPLY
385 0.050690629 172.31.23.72 -> 172.31.31.144 OpenFlow 74 Type: OFPT_BARRIER_REPLY
386 0.050725228 172.31.23.72 -> 172.31.31.144 OpenFlow 74 Type: OFPT_BARRIER_REPLY
387 0.050797092 172.31.31.144 -> 172.31.23.72 TCP 66 6633 → 48354 [ACK] Seq=1185 Ack=353 Win=853 Len=0 TSval=3407969 TSecr=21978094
388 0.050898970 172.31.31.144 -> 172.31.23.72 TCP 66 6633 → 48332 [ACK] Seq=1569 Ack=193 Win=853 Len=0 TSval=3407969 TSecr=21978094
389 0.051358666 172.31.23.72 -> 172.31.31.144 OpenFlow 74 Type: OFPT_BARRIER_REPLY
390 0.051397849 172.31.23.72 -> 172.31.31.144 OpenFlow 74 Type: OFPT_BARRIER_REPLY
391 0.051434169 172.31.23.72 -> 172.31.31.144 OpenFlow 74 Type: OFPT_BARRIER_REPLY
392 0.051582025 172.31.31.144 -> 172.31.23.72 TCP 66 6633 → 48332 [ACK] Seq=1569 Ack=209 Win=853 Len=0 TSval=3407969 TSecr=21978095
393 0.053021456 172.31.23.72 -> 172.31.31.144 OpenFlow 74 Type: OFPT_BARRIER_REPLY
394 0.053073787 172.31.23.72 -> 172.31.31.144 OpenFlow 74 Type: OFPT_BARRIER_REPLY
395 0.053229139 172.31.31.144 -> 172.31.23.72 TCP 66 6633 → 48336 [ACK] Seq=1841 Ack=377 Win=853 Len=0 TSval=3407969 TSecr=21978094
396 0.086452018 172.31.31.144 -> 172.31.23.72 TCP 66 6633 → 48344 [ACK] Seq=337 Ack=337 Win=853 Len=0 TSval=3407978 TSecr=21978094
397 0.086471486 172.31.31.144 -> 172.31.23.72 TCP 66 6633 → 48340 [ACK] Seq=593 Ack=177 Win=853 Len=0 TSval=3407978 TSecr=21978094
398 0.086500944 172.31.31.144 -> 172.31.23.72 TCP 66 6633 → 48356 [ACK] Seq=593 Ack=177 Win=853 Len=0 TSval=3407978 TSecr=21978094
399 0.086537927 172.31.31.144 -> 172.31.23.72 TCP 66 6633 → 48352 [ACK] Seq=337 Ack=337 Win=853 Len=0 TSval=3407978 TSecr=21978094
400 0.090380812 172.31.31.144 -> 172.31.23.72 TCP 66 6633 → 48332 [ACK] Seq=1569 Ack=217 Win=853 Len=0 TSval=3407979 TSecr=21978095
401 0.090385671 172.31.31.144 -> 172.31.23.72 TCP 66 6633 → 48336 [ACK] Seq=1841 Ack=385 Win=853 Len=0 TSval=3407979 TSecr=21978095
402 0.090411860 172.31.31.144 -> 172.31.23.72 TCP 66 6633 → 48360 [ACK] Seq=593 Ack=177 Win=853 Len=0 TSval=3407979 TSecr=21978094
403 0.090414000 172.31.31.144 -> 172.31.23.72 TCP 66 6633 → 48362 [ACK] Seq=433 Ack=17 Win=853 Len=0 TSval=3407979 TSecr=21978094
404 0.090434112 172.31.31.144 -> 172.31.23.72 TCP 66 6633 → 48364 [ACK] Seq=977 Ack=353 Win=853 Len=0 TSval=3407979 TSecr=21978094
405 0.202689379 172.31.31.144 -> 172.31.23.72 TCP 187 6633 → 48358 [PSH, ACK] Seq=1 Ack=1 Win=853 Len=121 TSval=3408007 TSecr=21977410
406 0.202735346 172.31.23.72 -> 172.31.31.144 TCP 66 48358 → 6633 [ACK] Seq=1 Ack=122 Win=213 Len=0 TSval=21978132 TSecr=3408007
407 0.202771880 172.31.31.144 -> 172.31.23.72 TCP 187 6633 → 48358 [PSH, ACK] Seq=122 Ack=1 Win=853 Len=121 TSval=3408007 TSecr=21977410
408 0.202781044 172.31.23.72 -> 172.31.31.144 TCP 66 48358 → 6633 [ACK] Seq=1 Ack=243 Win=213 Len=0 TSval=21978132 TSecr=3408007
409 0.202789147 172.31.31.144 -> 172.31.23.72 TCP 187 6633 → 48358 [PSH, ACK] Seq=243 Ack=1 Win=853 Len=121 TSval=3408007 TSecr=21977410
410 0.202793614 172.31.23.72 -> 172.31.31.144 TCP 66 48358 → 6633 [ACK] Seq=1 Ack=364 Win=213 Len=0 TSval=21978132 TSecr=3408007
411 0.202802498 172.31.31.144 -> 172.31.23.72 TCP 187 6633 → 48358 [PSH, ACK] Seq=364 Ack=1 Win=853 Len=121 TSval=3408007 TSecr=21977410
412 0.202807683 172.31.23.72 -> 172.31.31.144 TCP 66 48358 → 6633 [ACK] Seq=1 Ack=485 Win=213 Len=0 TSval=21978132 TSecr=3408007
413 0.202851408 172.31.31.144 -> 172.31.23.72 TCP 187 6633 → 48358 [PSH, ACK] Seq=485 Ack=1 Win=853 Len=121 TSval=3408007 TSecr=21977410
414 0.202856630 172.31.23.72 -> 172.31.31.144 TCP 66 48358 → 6633 [ACK] Seq=1 Ack=606 Win=213 Len=0 TSval=21978132 TSecr=3408007
415 0.202932719 172.31.31.144 -> 172.31.23.72 TCP 187 6633 → 48358 [PSH, ACK] Seq=606 Ack=1 Win=853 Len=121 TSval=3408007 TSecr=21977410
416 0.202938710 172.31.23.72 -> 172.31.31.144 TCP 66 48358 → 6633 [ACK] Seq=1 Ack=727 Win=213 Len=0 TSval=21978132 TSecr=3408007
417 0.202997783 172.31.31.144 -> 172.31.23.72 TCP 187 6633 → 48358 [PSH, ACK] Seq=727 Ack=1 Win=853 Len=121 TSval=3408007 TSecr=21978132
418 0.203001530 172.31.23.72 -> 172.31.31.144 TCP 66 48358 → 6633 [ACK] Seq=1 Ack=848 Win=213 Len=0 TSval=21978132 TSecr=3408007
419 0.203042895 172.31.31.144 -> 172.31.23.72 TCP 187 6633 → 48358 [PSH, ACK] Seq=848 Ack=1 Win=853 Len=121 TSval=3408007 TSecr=21978132
420 0.203047481 172.31.23.72 -> 172.31.31.144 TCP 66 48358 → 6633 [ACK] Seq=1 Ack=969 Win=213 Len=0 TSval=21978132 TSecr=3408007
421 0.203164905 172.31.31.144 -> 172.31.23.72 OpenFlow 187 Type: OFPT_PACKET_OUT
422 0.203181663 172.31.31.144 -> 172.31.23.72 OpenFlow 187 Type: OFPT_PACKET_OUT
423 0.203259529 172.31.31.144 -> 172.31.23.72 OpenFlow 187 Type: OFPT_PACKET_OUT
424 0.203288894 172.31.31.144 -> 172.31.23.72 OpenFlow 187 Type: OFPT_PACKET_OUT
425 0.203348086 172.31.31.144 -> 172.31.23.72 OpenFlow 187 Type: OFPT_PACKET_OUT
426 0.203413668 172.31.31.144 -> 172.31.23.72 OpenFlow 187 Type: OFPT_PACKET_OUT
427 0.203504175 172.31.31.144 -> 172.31.23.72 OpenFlow 187 Type: OFPT_PACKET_OUT
428 0.203523014 172.31.31.144 -> 172.31.23.72 OpenFlow 187 Type: OFPT_PACKET_OUT
429 0.203593284 172.31.31.144 -> 172.31.23.72 OpenFlow 187 Type: OFPT_PACKET_OUT
430 0.203648922 172.31.31.144 -> 172.31.23.72 OpenFlow 187 Type: OFPT_PACKET_OUT
431 0.203710312 172.31.31.144 -> 172.31.23.72 OpenFlow 187 Type: OFPT_PACKET_OUT
432 0.203762850 172.31.31.144 -> 172.31.23.72 OpenFlow 187 Type: OFPT_PACKET_OUT
433 0.203821709 172.31.31.144 -> 172.31.23.72 OpenFlow 187 Type: OFPT_PACKET_OUT
434 0.203882806 172.31.31.144 -> 172.31.23.72 OpenFlow 187 Type: OFPT_PACKET_OUT
435 0.203892659 172.31.23.72 -> 172.31.31.144 TCP 66 48346 → 6633 [ACK] Seq=353 Ack=1703 Win=213 Len=0 TSval=21978133 TSecr=3408007
436 0.203958627 172.31.31.144 -> 172.31.23.72 OpenFlow 187 Type: OFPT_PACKET_OUT
437 0.204065568 172.31.31.144 -> 172.31.23.72 OpenFlow 187 Type: OFPT_PACKET_OUT
438 0.204083622 172.31.31.144 -> 172.31.23.72 OpenFlow 187 Type: OFPT_PACKET_OUT
439 0.204131655 172.31.31.144 -> 172.31.23.72 OpenFlow 187 Type: OFPT_PACKET_OUT
440 0.204193910 172.31.31.144 -> 172.31.23.72 OpenFlow 187 Type: OFPT_PACKET_OUT
441 0.204268675 172.31.31.144 -> 172.31.23.72 OpenFlow 187 Type: OFPT_PACKET_OUT
442 0.204338153 172.31.31.144 -> 172.31.23.72 OpenFlow 187 Type: OFPT_PACKET_OUT
443 0.204353391 172.31.23.72 -> 172.31.31.144 TCP 66 48342 → 6633 [ACK] Seq=193 Ack=1993 Win=213 Len=0 TSval=21978133 TSecr=3408007
444 0.204390012 172.31.31.144 -> 172.31.23.72 OpenFlow 187 Type: OFPT_PACKET_OUT
445 0.204444359 172.31.31.144 -> 172.31.23.72 OpenFlow 187 Type: OFPT_PACKET_OUT
446 0.204523366 172.31.31.144 -> 172.31.23.72 OpenFlow 187 Type: OFPT_PACKET_OUT
447 0.204565700 172.31.31.144 -> 172.31.23.72 OpenFlow 187 Type: OFPT_PACKET_OUT
448 0.204623456 172.31.31.144 -> 172.31.23.72 OpenFlow 187 Type: OFPT_PACKET_OUT
449 0.204686444 172.31.31.144 -> 172.31.23.72 OpenFlow 187 Type: OFPT_PACKET_OUT
450 0.204734126 172.31.31.144 -> 172.31.23.72 OpenFlow 187 Type: OFPT_PACKET_OUT
451 0.204769821 172.31.23.72 -> 172.31.31.144 TCP 66 48326 → 6633 [ACK] Seq=873 Ack=3401 Win=213 Len=0 TSval=21978133 TSecr=3408007
452 0.204819136 172.31.31.144 -> 172.31.23.72 OpenFlow 187 Type: OFPT_PACKET_OUT
453 0.204849609 172.31.31.144 -> 172.31.23.72 OpenFlow 187 Type: OFPT_PACKET_OUT
454 0.204863012 172.31.23.72 -> 172.31.31.144 OpenFlow 189 Type: OFPT_PACKET_IN
455 0.204885541 172.31.23.72 -> 172.31.31.144 OpenFlow 189 Type: OFPT_PACKET_IN
456 0.204910272 172.31.31.144 -> 172.31.23.72 OpenFlow 187 Type: OFPT_PACKET_OUT
457 0.204967758 172.31.31.144 -> 172.31.23.72 OpenFlow 187 Type: OFPT_PACKET_OUT
458 0.205041921 172.31.31.144 -> 172.31.23.72 TCP 66 6633 → 48340 [ACK] Seq=1803 Ack=423 Win=853 Len=0 TSval=3408007 TSecr=21978133
459 0.205073083 172.31.31.144 -> 172.31.23.72 TCP 187 6633 → 48330 [PSH, ACK] Seq=1 Ack=1 Win=853 Len=121 TSval=3408007 TSecr=21977410
460 0.205090170 172.31.31.144 -> 172.31.23.72 TCP 187 6633 → 48330 [PSH, ACK] Seq=122 Ack=1 Win=853 Len=121 TSval=3408007 TSecr=21977410
461 0.205164091 172.31.31.144 -> 172.31.23.72 TCP 187 6633 → 48330 [PSH, ACK] Seq=243 Ack=1 Win=853 Len=121 TSval=3408007 TSecr=21977410
462 0.205224621 172.31.31.144 -> 172.31.23.72 TCP 187 6633 → 48330 [PSH, ACK] Seq=364 Ack=1 Win=853 Len=121 TSval=3408007 TSecr=21977410
463 0.205301841 172.31.31.144 -> 172.31.23.72 TCP 187 6633 → 48330 [PSH, ACK] Seq=485 Ack=1 Win=853 Len=121 TSval=3408007 TSecr=21977410
464 0.205329653 172.31.23.72 -> 172.31.31.144 TCP 66 48340 → 6633 [ACK] Seq=423 Ack=1803 Win=213 Len=0 TSval=21978133 TSecr=3408007
465 0.205374154 172.31.31.144 -> 172.31.23.72 TCP 187 6633 → 48330 [PSH, ACK] Seq=606 Ack=1 Win=853 Len=121 TSval=3408007 TSecr=21977410
466 0.205420405 172.31.23.72 -> 172.31.31.144 OpenFlow 189 Type: OFPT_PACKET_IN
467 0.205441971 172.31.31.144 -> 172.31.23.72 OpenFlow 187 Type: OFPT_PACKET_OUT
468 0.205447085 172.31.23.72 -> 172.31.31.144 OpenFlow 189 Type: OFPT_PACKET_IN
469 0.205488562 172.31.31.144 -> 172.31.23.72 OpenFlow 187 Type: OFPT_PACKET_OUT
470 0.205583070 172.31.31.144 -> 172.31.23.72 OpenFlow 187 Type: OFPT_PACKET_OUT
471 0.205738755 172.31.31.144 -> 172.31.23.72 OpenFlow 187 Type: OFPT_PACKET_OUT
472 0.205798761 172.31.31.144 -> 172.31.23.72 OpenFlow 187 Type: OFPT_PACKET_OUT
473 0.205856378 172.31.23.72 -> 172.31.31.144 TCP 66 48330 → 6633 [ACK] Seq=247 Ack=1090 Win=213 Len=0 TSval=21978133 TSecr=3408007
474 0.205866726 172.31.31.144 -> 172.31.23.72 OpenFlow 187 Type: OFPT_PACKET_OUT
475 0.205932620 172.31.31.144 -> 172.31.23.72 OpenFlow 187 Type: OFPT_PACKET_OUT
476 0.205955739 172.31.23.72 -> 172.31.31.144 OpenFlow 189 Type: OFPT_PACKET_IN
477 0.205977612 172.31.31.144 -> 172.31.23.72 OpenFlow 187 Type: OFPT_PACKET_OUT
478 0.205982234 172.31.23.72 -> 172.31.31.144 OpenFlow 189 Type: OFPT_PACKET_IN
479 0.206010049 172.31.31.144 -> 172.31.23.72 OpenFlow 187 Type: OFPT_PACKET_OUT
480 0.206042059 172.31.31.144 -> 172.31.23.72 OpenFlow 187 Type: OFPT_PACKET_OUT
481 0.206112545 172.31.31.144 -> 172.31.23.72 OpenFlow 187 Type: OFPT_PACKET_OUT
482 0.206237296 172.31.23.72 -> 172.31.31.144 TCP 66 48324 → 6633 [ACK] Seq=607 Ack=2040 Win=213 Len=0 TSval=21978133 TSecr=3408007
483 0.206306470 172.31.23.72 -> 172.31.31.144 OpenFlow 189 Type: OFPT_PACKET_IN
484 0.206329499 172.31.23.72 -> 172.31.31.144 OpenFlow 189 Type: OFPT_PACKET_IN
485 0.206340075 172.31.23.72 -> 172.31.31.144 OpenFlow 189 Type: OFPT_PACKET_IN
486 0.206360019 172.31.23.72 -> 172.31.31.144 OpenFlow 189 Type: OFPT_PACKET_IN
487 0.206381800 172.31.23.72 -> 172.31.31.144 OpenFlow 189 Type: OFPT_PACKET_IN
488 0.206384333 172.31.23.72 -> 172.31.31.144 OpenFlow 435 Type: OFPT_PACKET_IN
489 0.206406721 172.31.23.72 -> 172.31.31.144 OpenFlow 189 Type: OFPT_PACKET_IN
490 0.206415039 172.31.23.72 -> 172.31.31.144 OpenFlow 435 Type: OFPT_PACKET_IN
491 0.206416818 172.31.23.72 -> 172.31.31.144 OpenFlow 681 Type: OFPT_PACKET_IN
492 0.206433726 172.31.23.72 -> 172.31.31.144 OpenFlow 189 Type: OFPT_PACKET_IN
493 0.206457669 172.31.23.72 -> 172.31.31.144 OpenFlow 189 Type: OFPT_PACKET_IN
494 0.206463275 172.31.23.72 -> 172.31.31.144 OpenFlow 189 Type: OFPT_PACKET_IN
495 0.206495354 172.31.23.72 -> 172.31.31.144 OpenFlow 189 Type: OFPT_PACKET_IN
496 0.206510548 172.31.23.72 -> 172.31.31.144 OpenFlow 189 Type: OFPT_PACKET_IN
497 0.206524209 172.31.23.72 -> 172.31.31.144 OpenFlow 189 Type: OFPT_PACKET_IN
498 0.206526400 172.31.23.72 -> 172.31.31.144 OpenFlow 435 Type: OFPT_PACKET_IN
499 0.206544083 172.31.23.72 -> 172.31.31.144 OpenFlow 189 Type: OFPT_PACKET_IN
500 0.206547651 172.31.31.144 -> 172.31.23.72 TCP 66 6633 → 48344 [ACK] Seq=337 Ack=460 Win=853 Len=0 TSval=3408008 TSecr=21978133
501 0.206552353 172.31.31.144 -> 172.31.23.72 TCP 66 6633 → 48350 [ACK] Seq=1025 Ack=439 Win=853 Len=0 TSval=3408008 TSecr=21978133
502 0.206555050 172.31.31.144 -> 172.31.23.72 TCP 66 6633 → 48356 [ACK] Seq=593 Ack=300 Win=853 Len=0 TSval=3408008 TSecr=21978133
503 0.206578262 172.31.23.72 -> 172.31.31.144 OpenFlow 189 Type: OFPT_PACKET_IN
504 0.206584443 172.31.23.72 -> 172.31.31.144 OpenFlow 189 Type: OFPT_PACKET_IN
505 0.206599734 172.31.23.72 -> 172.31.31.144 OpenFlow 189 Type: OFPT_PACKET_IN
506 0.206601979 172.31.23.72 -> 172.31.31.144 OpenFlow 189 Type: OFPT_PACKET_IN
507 0.206701549 172.31.23.72 -> 172.31.31.144 OpenFlow 189 Type: OFPT_PACKET_IN
508 0.206710258 172.31.31.144 -> 172.31.23.72 TCP 66 6633 → 48336 [ACK] Seq=1841 Ack=508 Win=853 Len=0 TSval=3408008 TSecr=21978133
509 0.206715014 172.31.31.144 -> 172.31.23.72 TCP 66 6633 → 48356 [ACK] Seq=593 Ack=669 Win=853 Len=0 TSval=3408008 TSecr=21978133
510 0.206717183 172.31.31.144 -> 172.31.23.72 OpenFlow 187 Type: OFPT_PACKET_OUT
511 0.206719704 172.31.31.144 -> 172.31.23.72 OpenFlow 308 Type: OFPT_PACKET_OUT
512 0.206724252 172.31.31.144 -> 172.31.23.72 TCP 66 6633 → 48322 [ACK] Seq=1 Ack=124 Win=853 Len=0 TSval=3408008 TSecr=21978133
513 0.206727209 172.31.31.144 -> 172.31.23.72 TCP 66 6633 → 48344 [ACK] Seq=337 Ack=829 Win=853 Len=0 TSval=3408008 TSecr=21978133
514 0.206732987 172.31.23.72 -> 172.31.31.144 OpenFlow 189 Type: OFPT_PACKET_IN
515 0.206739468 172.31.23.72 -> 172.31.31.144 OpenFlow 189 Type: OFPT_PACKET_IN
516 0.206741283 172.31.23.72 -> 172.31.31.144 OpenFlow 435 Type: OFPT_PACKET_IN
517 0.206743194 172.31.23.72 -> 172.31.31.144 OpenFlow 189 Type: OFPT_PACKET_IN
518 0.206760653 172.31.23.72 -> 172.31.31.144 OpenFlow 189 Type: OFPT_PACKET_IN
519 0.206763167 172.31.23.72 -> 172.31.31.144 OpenFlow 312 Type: OFPT_PACKET_IN
520 0.206775565 172.31.23.72 -> 172.31.31.144 OpenFlow 189 Type: OFPT_PACKET_IN
521 0.206816089 172.31.31.144 -> 172.31.23.72 TCP 66 6633 → 48360 [ACK] Seq=593 Ack=300 Win=853 Len=0 TSval=3408008 TSecr=21978133
522 0.206821671 172.31.31.144 -> 172.31.23.72 TCP 66 6633 → 48322 [ACK] Seq=1 Ack=493 Win=853 Len=0 TSval=3408008 TSecr=21978133
523 0.206826387 172.31.23.72 -> 172.31.31.144 OpenFlow 189 Type: OFPT_PACKET_IN
524 0.206906914 172.31.23.72 -> 172.31.31.144 OpenFlow 189 Type: OFPT_PACKET_IN
525 0.206985317 172.31.23.72 -> 172.31.31.144 TCP 66 48324 → 6633 [ACK] Seq=607 Ack=2403 Win=213 Len=0 TSval=21978133 TSecr=3408008
526 0.207060454 172.31.31.144 -> 172.31.23.72 TCP 66 6633 → 48332 [ACK] Seq=1569 Ack=340 Win=853 Len=0 TSval=3408008 TSecr=21978133
527 0.207066482 172.31.31.144 -> 172.31.23.72 TCP 66 6633 → 48336 [ACK] Seq=1841 Ack=1123 Win=853 Len=0 TSval=3408008 TSecr=21978133
528 0.207068552 172.31.31.144 -> 172.31.23.72 TCP 66 6633 → 48360 [ACK] Seq=593 Ack=423 Win=853 Len=0 TSval=3408008 TSecr=21978133
529 0.207070379 172.31.31.144 -> 172.31.23.72 TCP 66 6633 → 48334 [ACK] Seq=1969 Ack=1359 Win=853 Len=0 TSval=3408008 TSecr=21978133
530 0.207072642 172.31.31.144 -> 172.31.23.72 TCP 66 6633 → 48338 [ACK] Seq=1649 Ack=1351 Win=853 Len=0 TSval=3408008 TSecr=21978133
531 0.207128777 172.31.23.72 -> 172.31.31.144 OpenFlow 189 Type: OFPT_PACKET_IN
532 0.207148141 172.31.23.72 -> 172.31.31.144 OpenFlow 189 Type: OFPT_PACKET_IN
533 0.207180358 172.31.31.144 -> 172.31.23.72 TCP 66 6633 → 48354 [ACK] Seq=1185 Ack=599 Win=853 Len=0 TSval=3408008 TSecr=21978133
534 0.207185320 172.31.31.144 -> 172.31.23.72 TCP 66 6633 → 48348 [ACK] Seq=1 Ack=493 Win=853 Len=0 TSval=3408008 TSecr=21978133
535 0.207188211 172.31.31.144 -> 172.31.23.72 TCP 66 6633 → 48340 [ACK] Seq=1803 Ack=546 Win=853 Len=0 TSval=3408008 TSecr=21978133
536 0.207217361 172.31.23.72 -> 172.31.31.144 OpenFlow 189 Type: OFPT_PACKET_IN
537 0.207256605 172.31.31.144 -> 172.31.23.72 TCP 66 6633 → 48332 [ACK] Seq=1569 Ack=463 Win=853 Len=0 TSval=3408008 TSecr=21978133
538 0.207285408 172.31.31.144 -> 172.31.23.72 TCP 66 6633 → 48320 [ACK] Seq=1 Ack=247 Win=853 Len=0 TSval=3408008 TSecr=21978133
539 0.207320636 172.31.23.72 -> 172.31.31.144 OpenFlow 189 Type: OFPT_PACKET_IN
540 0.207441515 172.31.31.144 -> 172.31.23.72 TCP 66 6633 → 48332 [ACK] Seq=1569 Ack=709 Win=853 Len=0 TSval=3408008 TSecr=21978133
541 0.207517567 172.31.31.144 -> 172.31.23.72 TCP 66 6633 → 48340 [ACK] Seq=1803 Ack=669 Win=853 Len=0 TSval=3408008 TSecr=21978134
542 0.207684236 172.31.31.144 -> 172.31.23.72 TCP 66 6633 → 48326 [ACK] Seq=3401 Ack=1119 Win=853 Len=0 TSval=3408008 TSecr=21978133
543 0.207808181 172.31.31.144 -> 172.31.23.72 TCP 66 6633 → 48342 [ACK] Seq=1993 Ack=439 Win=853 Len=0 TSval=3408008 TSecr=21978133
544 0.207931936 172.31.31.144 -> 172.31.23.72 TCP 66 6633 → 48328 [ACK] Seq=1 Ack=493 Win=853 Len=0 TSval=3408008 TSecr=21978133
545 0.243281317 172.31.23.72 -> 172.31.31.144 TCP 66 48330 → 6633 [ACK] Seq=247 Ack=1211 Win=213 Len=0 TSval=21978143 TSecr=3408007
546 0.401910797 172.31.31.144 -> 172.31.23.72 OpenFlow 187 Type: OFPT_PACKET_OUT
547 0.401946682 172.31.31.144 -> 172.31.23.72 OpenFlow 187 Type: OFPT_PACKET_OUT
548 0.401966797 172.31.31.144 -> 172.31.23.72 OpenFlow 187 Type: OFPT_PACKET_OUT
549 0.401985114 172.31.31.144 -> 172.31.23.72 OpenFlow 187 Type: OFPT_PACKET_OUT
550 0.402046991 172.31.31.144 -> 172.31.23.72 OpenFlow 187 Type: OFPT_PACKET_OUT
551 0.402134087 172.31.31.144 -> 172.31.23.72 OpenFlow 187 Type: OFPT_PACKET_OUT
552 0.402174923 172.31.31.144 -> 172.31.23.72 OpenFlow 187 Type: OFPT_PACKET_OUT
553 0.402246330 172.31.31.144 -> 172.31.23.72 OpenFlow 187 Type: OFPT_PACKET_OUT
554 0.402298922 172.31.31.144 -> 172.31.23.72 OpenFlow 187 Type: OFPT_PACKET_OUT
555 0.402391354 172.31.31.144 -> 172.31.23.72 OpenFlow 187 Type: OFPT_PACKET_OUT
556 0.402547406 172.31.31.144 -> 172.31.23.72 OpenFlow 187 Type: OFPT_PACKET_OUT
557 0.402579009 172.31.31.144 -> 172.31.23.72 OpenFlow 187 Type: OFPT_PACKET_OUT
558 0.402601190 172.31.31.144 -> 172.31.23.72 OpenFlow 187 Type: OFPT_PACKET_OUT
559 0.402682451 172.31.31.144 -> 172.31.23.72 OpenFlow 187 Type: OFPT_PACKET_OUT
560 0.402743687 172.31.23.72 -> 172.31.31.144 TCP 66 48350 → 6633 [ACK] Seq=439 Ack=2235 Win=213 Len=0 TSval=21978182 TSecr=3408056
561 0.402751741 172.31.31.144 -> 172.31.23.72 OpenFlow 187 Type: OFPT_PACKET_OUT
562 0.402838416 172.31.31.144 -> 172.31.23.72 OpenFlow 187 Type: OFPT_PACKET_OUT
563 0.402888462 172.31.31.144 -> 172.31.23.72 OpenFlow 187 Type: OFPT_PACKET_OUT
564 0.402937723 172.31.31.144 -> 172.31.23.72 OpenFlow 187 Type: OFPT_PACKET_OUT
565 0.403023893 172.31.31.144 -> 172.31.23.72 OpenFlow 187 Type: OFPT_PACKET_OUT
566 0.403063495 172.31.31.144 -> 172.31.23.72 OpenFlow 187 Type: OFPT_PACKET_OUT
567 0.403145429 172.31.31.144 -> 172.31.23.72 OpenFlow 187 Type: OFPT_PACKET_OUT
568 0.403191171 172.31.31.144 -> 172.31.23.72 OpenFlow 187 Type: OFPT_PACKET_OUT
569 0.403250360 172.31.31.144 -> 172.31.23.72 OpenFlow 187 Type: OFPT_PACKET_OUT
570 0.403263457 172.31.23.72 -> 172.31.31.144 TCP 66 48344 → 6633 [ACK] Seq=829 Ack=1305 Win=213 Len=0 TSval=21978183 TSecr=3408057
571 0.403310820 172.31.31.144 -> 172.31.23.72 OpenFlow 187 Type: OFPT_PACKET_OUT
572 0.403449637 172.31.31.144 -> 172.31.23.72 OpenFlow 187 Type: OFPT_PACKET_OUT
573 0.403455100 172.31.31.144 -> 172.31.23.72 OpenFlow 187 Type: OFPT_PACKET_OUT
574 0.403496616 172.31.31.144 -> 172.31.23.72 OpenFlow 187 Type: OFPT_PACKET_OUT
575 0.403517905 172.31.23.72 -> 172.31.31.144 TCP 66 48356 → 6633 [ACK] Seq=669 Ack=1319 Win=213 Len=0 TSval=21978183 TSecr=3408057
576 0.403570044 172.31.31.144 -> 172.31.23.72 OpenFlow 187 Type: OFPT_PACKET_OUT
577 0.403605972 172.31.31.144 -> 172.31.23.72 OpenFlow 187 Type: OFPT_PACKET_OUT
578 0.403665216 172.31.31.144 -> 172.31.23.72 OpenFlow 187 Type: OFPT_PACKET_OUT
579 0.403750800 172.31.31.144 -> 172.31.23.72 OpenFlow 187 Type: OFPT_PACKET_OUT
580 0.403782783 172.31.31.144 -> 172.31.23.72 OpenFlow 187 Type: OFPT_PACKET_OUT
581 0.403850370 172.31.31.144 -> 172.31.23.72 OpenFlow 187 Type: OFPT_PACKET_OUT
582 0.403907178 172.31.31.144 -> 172.31.23.72 OpenFlow 187 Type: OFPT_PACKET_OUT
583 0.404031346 172.31.23.72 -> 172.31.31.144 TCP 66 48336 → 6633 [ACK] Seq=1123 Ack=3051 Win=213 Len=0 TSval=21978183 TSecr=3408057
584 0.404042007 172.31.31.144 -> 172.31.23.72 OpenFlow 187 Type: OFPT_PACKET_OUT
585 0.404071072 172.31.31.144 -> 172.31.23.72 OpenFlow 187 Type: OFPT_PACKET_OUT
586 0.404119111 172.31.31.144 -> 172.31.23.72 OpenFlow 187 Type: OFPT_PACKET_OUT
587 0.404168322 172.31.31.144 -> 172.31.23.72 OpenFlow 187 Type: OFPT_PACKET_OUT
588 0.404267046 172.31.23.72 -> 172.31.31.144 TCP 66 48334 → 6633 [ACK] Seq=1359 Ack=2453 Win=213 Len=0 TSval=21978183 TSecr=3408057
589 0.404296995 172.31.31.144 -> 172.31.23.72 OpenFlow 187 Type: OFPT_PACKET_OUT
590 0.404314630 172.31.31.144 -> 172.31.23.72 OpenFlow 187 Type: OFPT_PACKET_OUT
591 0.404359016 172.31.31.144 -> 172.31.23.72 OpenFlow 187 Type: OFPT_PACKET_OUT
592 0.404415484 172.31.31.144 -> 172.31.23.72 OpenFlow 187 Type: OFPT_PACKET_OUT
593 0.404481942 172.31.31.144 -> 172.31.23.72 OpenFlow 187 Type: OFPT_PACKET_OUT
594 0.404538567 172.31.31.144 -> 172.31.23.72 OpenFlow 187 Type: OFPT_PACKET_OUT
595 0.404584094 172.31.23.72 -> 172.31.31.144 TCP 66 48322 → 6633 [ACK] Seq=493 Ack=727 Win=213 Len=0 TSval=21978183 TSecr=3408057
596 0.404596648 172.31.31.144 -> 172.31.23.72 OpenFlow 187 Type: OFPT_PACKET_OUT
597 0.404658801 172.31.31.144 -> 172.31.23.72 OpenFlow 187 Type: OFPT_PACKET_OUT
598 0.404670554 172.31.23.72 -> 172.31.31.144 TCP 66 48322 → 6633 [ACK] Seq=493 Ack=969 Win=213 Len=0 TSval=21978183 TSecr=3408057
599 0.404743933 172.31.23.72 -> 172.31.31.144 OpenFlow 189 Type: OFPT_PACKET_IN
600 0.404768189 172.31.31.144 -> 172.31.23.72 OpenFlow 187 Type: OFPT_PACKET_OUT
601 0.404774105 172.31.23.72 -> 172.31.31.144 OpenFlow 435 Type: OFPT_PACKET_IN
602 0.404831707 172.31.31.144 -> 172.31.23.72 OpenFlow 187 Type: OFPT_PACKET_OUT
603 0.404852557 172.31.31.144 -> 172.31.23.72 OpenFlow 187 Type: OFPT_PACKET_OUT
604 0.404898879 172.31.31.144 -> 172.31.23.72 TCP 66 6633 → 48352 [ACK] Seq=700 Ack=460 Win=853 Len=0 TSval=3408057 TSecr=21978183
605 0.404909223 172.31.23.72 -> 172.31.31.144 TCP 66 48352 → 6633 [ACK] Seq=829 Ack=700 Win=213 Len=0 TSval=21978183 TSecr=3408057
606 0.404917457 172.31.31.144 -> 172.31.23.72 OpenFlow 187 Type: OFPT_PACKET_OUT
607 0.405019675 172.31.23.72 -> 172.31.31.144 OpenFlow 189 Type: OFPT_PACKET_IN
608 0.405044814 172.31.23.72 -> 172.31.31.144 OpenFlow 435 Type: OFPT_PACKET_IN
609 0.405073513 172.31.23.72 -> 172.31.31.144 OpenFlow 189 Type: OFPT_PACKET_IN
610 0.405088762 172.31.23.72 -> 172.31.31.144 OpenFlow 189 Type: OFPT_PACKET_IN
611 0.405102804 172.31.23.72 -> 172.31.31.144 OpenFlow 189 Type: OFPT_PACKET_IN
612 0.405117860 172.31.23.72 -> 172.31.31.144 OpenFlow 189 Type: OFPT_PACKET_IN
613 0.405137338 172.31.23.72 -> 172.31.31.144 OpenFlow 189 Type: OFPT_PACKET_IN
614 0.405139635 172.31.23.72 -> 172.31.31.144 OpenFlow 189 Type: OFPT_PACKET_IN
615 0.405154990 172.31.23.72 -> 172.31.31.144 OpenFlow 189 Type: OFPT_PACKET_IN
616 0.405160247 172.31.23.72 -> 172.31.31.144 OpenFlow 189 Type: OFPT_PACKET_IN
617 0.405175349 172.31.23.72 -> 172.31.31.144 OpenFlow 189 Type: OFPT_PACKET_IN
618 0.405177581 172.31.23.72 -> 172.31.31.144 OpenFlow 189 Type: OFPT_PACKET_IN
619 0.405218029 172.31.31.144 -> 172.31.23.72 OpenFlow 187 Type: OFPT_PACKET_OUT
620 0.405223307 172.31.31.144 -> 172.31.23.72 OpenFlow 308 Type: OFPT_PACKET_OUT
621 0.405265089 172.31.23.72 -> 172.31.31.144 OpenFlow 189 Type: OFPT_PACKET_IN
622 0.405270966 172.31.23.72 -> 172.31.31.144 OpenFlow 435 Type: OFPT_PACKET_IN
623 0.405310706 172.31.31.144 -> 172.31.23.72 TCP 66 6633 → 48362 [ACK] Seq=433 Ack=140 Win=853 Len=0 TSval=3408057 TSecr=21978183
624 0.405315445 172.31.31.144 -> 172.31.23.72 TCP 66 6633 → 48362 [ACK] Seq=433 Ack=263 Win=853 Len=0 TSval=3408057 TSecr=21978183
625 0.405317562 172.31.31.144 -> 172.31.23.72 TCP 66 6633 → 48360 [ACK] Seq=593 Ack=546 Win=853 Len=0 TSval=3408057 TSecr=21978183
626 0.405319632 172.31.31.144 -> 172.31.23.72 TCP 66 6633 → 48338 [ACK] Seq=1649 Ack=1843 Win=853 Len=0 TSval=3408057 TSecr=21978183
627 0.405324017 172.31.23.72 -> 172.31.31.144 OpenFlow 189 Type: OFPT_PACKET_IN
628 0.405351313 172.31.23.72 -> 172.31.31.144 OpenFlow 189 Type: OFPT_PACKET_IN
629 0.405361253 172.31.31.144 -> 172.31.23.72 TCP 66 6633 → 48320 [ACK] Seq=1 Ack=493 Win=853 Len=0 TSval=3408057 TSecr=21978183
630 0.405366217 172.31.23.72 -> 172.31.31.144 OpenFlow 189 Type: OFPT_PACKET_IN
631 0.405382079 172.31.23.72 -> 172.31.31.144 OpenFlow 189 Type: OFPT_PACKET_IN
632 0.405387269 172.31.23.72 -> 172.31.31.144 OpenFlow 189 Type: OFPT_PACKET_IN
633 0.405407533 172.31.23.72 -> 172.31.31.144 OpenFlow 189 Type: OFPT_PACKET_IN
634 0.405431849 172.31.23.72 -> 172.31.31.144 OpenFlow 189 Type: OFPT_PACKET_IN
635 0.405437052 172.31.23.72 -> 172.31.31.144 OpenFlow 681 Type: OFPT_PACKET_IN
636 0.405453541 172.31.23.72 -> 172.31.31.144 OpenFlow 189 Type: OFPT_PACKET_IN
637 0.405469240 172.31.23.72 -> 172.31.31.144 OpenFlow 189 Type: OFPT_PACKET_IN
638 0.405471104 172.31.23.72 -> 172.31.31.144 OpenFlow 189 Type: OFPT_PACKET_IN
639 0.405482804 172.31.23.72 -> 172.31.31.144 OpenFlow 189 Type: OFPT_PACKET_IN
640 0.405502046 172.31.31.144 -> 172.31.23.72 TCP 66 6633 → 48332 [ACK] Seq=1569 Ack=832 Win=853 Len=0 TSval=3408057 TSecr=21978183
641 0.405505474 172.31.31.144 -> 172.31.23.72 TCP 66 6633 → 48358 [ACK] Seq=969 Ack=124 Win=853 Len=0 TSval=3408057 TSecr=21978183
642 0.405574281 172.31.23.72 -> 172.31.31.144 OpenFlow 435 Type: OFPT_PACKET_IN
643 0.405581181 172.31.23.72 -> 172.31.31.144 OpenFlow 435 Type: OFPT_PACKET_IN
644 0.405582855 172.31.23.72 -> 172.31.31.144 OpenFlow 189 Type: OFPT_PACKET_IN
645 0.405643615 172.31.31.144 -> 172.31.23.72 TCP 66 6633 → 48358 [ACK] Seq=969 Ack=247 Win=853 Len=0 TSval=3408057 TSecr=21978183
646 0.405649205 172.31.31.144 -> 172.31.23.72 TCP 66 6633 → 48354 [ACK] Seq=1185 Ack=845 Win=853 Len=0 TSval=3408057 TSecr=21978183
647 0.405654772 172.31.23.72 -> 172.31.31.144 OpenFlow 189 Type: OFPT_PACKET_IN
648 0.405702309 172.31.23.72 -> 172.31.31.144 TCP 66 48352 → 6633 [ACK] Seq=829 Ack=1184 Win=213 Len=0 TSval=21978183 TSecr=3408057
649 0.405710090 172.31.31.144 -> 172.31.23.72 TCP 66 6633 → 48360 [ACK] Seq=593 Ack=669 Win=853 Len=0 TSval=3408057 TSecr=21978183
650 0.405713964 172.31.31.144 -> 172.31.23.72 TCP 66 6633 → 48340 [ACK] Seq=1803 Ack=792 Win=853 Len=0 TSval=3408057 TSecr=21978183
651 0.405716548 172.31.31.144 -> 172.31.23.72 TCP 66 6633 → 48332 [ACK] Seq=1569 Ack=1201 Win=853 Len=0 TSval=3408057 TSecr=21978183
652 0.405807803 172.31.23.72 -> 172.31.31.144 OpenFlow 189 Type: OFPT_PACKET_IN
653 0.405831834 172.31.31.144 -> 172.31.23.72 OpenFlow 187 Type: OFPT_PACKET_OUT
654 0.405856123 172.31.31.144 -> 172.31.23.72 OpenFlow 308 Type: OFPT_PACKET_OUT
655 0.405870901 172.31.31.144 -> 172.31.23.72 TCP 66 6633 → 48330 [ACK] Seq=1211 Ack=739 Win=853 Len=0 TSval=3408057 TSecr=21978183
656 0.405889121 172.31.31.144 -> 172.31.23.72 TCP 66 6633 → 48348 [ACK] Seq=1 Ack=739 Win=853 Len=0 TSval=3408057 TSecr=21978183
657 0.405949861 172.31.31.144 -> 172.31.23.72 TCP 66 6633 → 48362 [ACK] Seq=433 Ack=386 Win=853 Len=0 TSval=3408057 TSecr=21978183
658 0.405997336 172.31.23.72 -> 172.31.31.144 OpenFlow 189 Type: OFPT_PACKET_IN
659 0.406018138 172.31.23.72 -> 172.31.31.144 OpenFlow 189 Type: OFPT_PACKET_IN
660 0.406043495 172.31.31.144 -> 172.31.23.72 TCP 66 6633 → 48324 [ACK] Seq=2403 Ack=853 Win=853 Len=0 TSval=3408057 TSecr=21978183
661 0.406047335 172.31.31.144 -> 172.31.23.72 TCP 66 6633 → 48342 [ACK] Seq=1993 Ack=1177 Win=853 Len=0 TSval=3408057 TSecr=21978183
662 0.406152576 172.31.23.72 -> 172.31.31.144 TCP 66 48352 → 6633 [ACK] Seq=829 Ack=1547 Win=213 Len=0 TSval=21978183 TSecr=3408057
663 0.406169636 172.31.31.144 -> 172.31.23.72 TCP 66 6633 → 48344 [ACK] Seq=1305 Ack=1075 Win=853 Len=0 TSval=3408057 TSecr=21978183
664 0.406208275 172.31.31.144 -> 172.31.23.72 TCP 66 6633 → 48350 [ACK] Seq=2235 Ack=685 Win=853 Len=0 TSval=3408057 TSecr=21978183
665 0.406225388 172.31.31.144 -> 172.31.23.72 TCP 66 6633 → 48326 [ACK] Seq=3401 Ack=1365 Win=853 Len=0 TSval=3408057 TSecr=21978183
666 0.406256796 172.31.23.72 -> 172.31.31.144 OpenFlow 189 Type: OFPT_PACKET_IN
667 0.406277530 172.31.23.72 -> 172.31.31.144 OpenFlow 189 Type: OFPT_PACKET_IN
668 0.406283611 172.31.23.72 -> 172.31.31.144 OpenFlow 189 Type: OFPT_PACKET_IN
669 0.406410647 172.31.31.144 -> 172.31.23.72 TCP 66 6633 → 48364 [ACK] Seq=977 Ack=476 Win=853 Len=0 TSval=3408058 TSecr=21978183
670 0.406426381 172.31.31.144 -> 172.31.23.72 TCP 66 6633 → 48364 [ACK] Seq=977 Ack=599 Win=853 Len=0 TSval=3408058 TSecr=21978183
671 0.406444240 172.31.31.144 -> 172.31.23.72 TCP 66 6633 → 48340 [ACK] Seq=1803 Ack=1161 Win=853 Len=0 TSval=3408058 TSecr=21978183
672 0.406474420 172.31.31.144 -> 172.31.23.72 TCP 66 6633 → 48362 [ACK] Seq=433 Ack=509 Win=853 Len=0 TSval=3408058 TSecr=21978183
673 0.406680058 172.31.31.144 -> 172.31.23.72 TCP 66 6633 → 48346 [ACK] Seq=1703 Ack=599 Win=853 Len=0 TSval=3408058 TSecr=21978183
674 0.407251717 172.31.31.144 -> 172.31.23.72 OpenFlow 187 Type: OFPT_PACKET_OUT
675 0.407333325 172.31.31.144 -> 172.31.23.72 OpenFlow 187 Type: OFPT_PACKET_OUT
676 0.407392563 172.31.31.144 -> 172.31.23.72 OpenFlow 187 Type: OFPT_PACKET_OUT
677 0.407429234 172.31.31.144 -> 172.31.23.72 OpenFlow 187 Type: OFPT_PACKET_OUT
678 0.407480890 172.31.31.144 -> 172.31.23.72 OpenFlow 187 Type: OFPT_PACKET_OUT
679 0.407507258 172.31.31.144 -> 172.31.23.72 OpenFlow 187 Type: OFPT_PACKET_OUT
680 0.407538132 172.31.31.144 -> 172.31.23.72 OpenFlow 187 Type: OFPT_PACKET_OUT
681 0.407557286 172.31.31.144 -> 172.31.23.72 OpenFlow 671 Type: OFPT_PACKET_OUT
682 0.407578012 172.31.31.144 -> 172.31.23.72 OpenFlow 187 Type: OFPT_PACKET_OUT
683 0.407593741 172.31.31.144 -> 172.31.23.72 OpenFlow 187 Type: OFPT_PACKET_OUT
684 0.407633542 172.31.23.72 -> 172.31.31.144 TCP 66 48366 → 6633 [ACK] Seq=353 Ack=1911 Win=213 Len=0 TSval=21978184 TSecr=3408058
685 0.407664501 172.31.31.144 -> 172.31.23.72 OpenFlow 187 Type: OFPT_PACKET_OUT
686 0.407707065 172.31.31.144 -> 172.31.23.72 OpenFlow 187 Type: OFPT_PACKET_OUT
687 0.407724239 172.31.23.72 -> 172.31.31.144 OpenFlow 189 Type: OFPT_PACKET_IN
688 0.407740623 172.31.31.144 -> 172.31.23.72 OpenFlow 187 Type: OFPT_PACKET_OUT
689 0.407747286 172.31.23.72 -> 172.31.31.144 OpenFlow 189 Type: OFPT_PACKET_IN
690 0.407791250 172.31.31.144 -> 172.31.23.72 OpenFlow 187 Type: OFPT_PACKET_OUT
691 0.407842669 172.31.31.144 -> 172.31.23.72 OpenFlow 187 Type: OFPT_PACKET_OUT
692 0.407868173 172.31.31.144 -> 172.31.23.72 OpenFlow 187 Type: OFPT_PACKET_OUT
693 0.407932652 172.31.31.144 -> 172.31.23.72 OpenFlow 187 Type: OFPT_PACKET_OUT
694 0.407955147 172.31.31.144 -> 172.31.23.72 OpenFlow 187 Type: OFPT_PACKET_OUT
695 0.407998647 172.31.31.144 -> 172.31.23.72 OpenFlow 187 Type: OFPT_PACKET_OUT
696 0.408039093 172.31.31.144 -> 172.31.23.72 OpenFlow 187 Type: OFPT_PACKET_OUT
697 0.408079654 172.31.23.72 -> 172.31.31.144 TCP 66 48364 → 6633 [ACK] Seq=845 Ack=1945 Win=213 Len=0 TSval=21978184 TSecr=3408058
698 0.408095682 172.31.31.144 -> 172.31.23.72 OpenFlow 187 Type: OFPT_PACKET_OUT
699 0.408151839 172.31.23.72 -> 172.31.31.144 OpenFlow 189 Type: OFPT_PACKET_IN
700 0.408163107 172.31.31.144 -> 172.31.23.72 TCP 66 6633 → 48364 [ACK] Seq=1945 Ack=845 Win=853 Len=0 TSval=3408058 TSecr=21978184
701 0.408167658 172.31.31.144 -> 172.31.23.72 OpenFlow 187 Type: OFPT_PACKET_OUT
702 0.408169292 172.31.31.144 -> 172.31.23.72 OpenFlow 187 Type: OFPT_PACKET_OUT
703 0.408177362 172.31.31.144 -> 172.31.23.72 OpenFlow 187 Type: OFPT_PACKET_OUT
704 0.408187037 172.31.23.72 -> 172.31.31.144 OpenFlow 189 Type: OFPT_PACKET_IN
705 0.408287704 172.31.31.144 -> 172.31.23.72 OpenFlow 187 Type: OFPT_PACKET_OUT
706 0.408293667 172.31.23.72 -> 172.31.31.144 TCP 66 48320 → 6633 [ACK] Seq=493 Ack=122 Win=213 Len=0 TSval=21978184 TSecr=3408058
707 0.408310476 172.31.31.144 -> 172.31.23.72 OpenFlow 187 Type: OFPT_PACKET_OUT
708 0.408317093 172.31.23.72 -> 172.31.31.144 TCP 66 48320 → 6633 [ACK] Seq=493 Ack=243 Win=213 Len=0 TSval=21978184 TSecr=3408058
709 0.408355127 172.31.31.144 -> 172.31.23.72 OpenFlow 187 Type: OFPT_PACKET_OUT
710 0.408360418 172.31.23.72 -> 172.31.31.144 TCP 66 48320 → 6633 [ACK] Seq=493 Ack=364 Win=213 Len=0 TSval=21978184 TSecr=3408058
711 0.408389331 172.31.31.144 -> 172.31.23.72 OpenFlow 187 Type: OFPT_PACKET_OUT
712 0.408396277 172.31.23.72 -> 172.31.31.144 TCP 66 48320 → 6633 [ACK] Seq=493 Ack=485 Win=213 Len=0 TSval=21978184 TSecr=3408058
713 0.408430831 172.31.31.144 -> 172.31.23.72 OpenFlow 187 Type: OFPT_PACKET_OUT
714 0.408435274 172.31.23.72 -> 172.31.31.144 TCP 66 48320 → 6633 [ACK] Seq=493 Ack=606 Win=213 Len=0 TSval=21978184 TSecr=3408058
715 0.408472734 172.31.31.144 -> 172.31.23.72 OpenFlow 187 Type: OFPT_PACKET_OUT
716 0.408478306 172.31.23.72 -> 172.31.31.144 TCP 66 48320 → 6633 [ACK] Seq=493 Ack=727 Win=213 Len=0 TSval=21978184 TSecr=3408058
717 0.408482970 172.31.31.144 -> 172.31.23.72 TCP 66 6633 → 48362 [ACK] Seq=1401 Ack=755 Win=853 Len=0 TSval=3408058 TSecr=21978184
718 0.408510300 172.31.31.144 -> 172.31.23.72 OpenFlow 187 Type: OFPT_PACKET_OUT
719 0.408553049 172.31.31.144 -> 172.31.23.72 OpenFlow 187 Type: OFPT_PACKET_OUT
720 0.408557398 172.31.31.144 -> 172.31.23.72 OpenFlow 187 Type: OFPT_PACKET_OUT
721 0.408608518 172.31.31.144 -> 172.31.23.72 OpenFlow 187 Type: OFPT_PACKET_OUT
722 0.408636687 172.31.31.144 -> 172.31.23.72 OpenFlow 187 Type: OFPT_PACKET_OUT
723 0.408660025 172.31.31.144 -> 172.31.23.72 OpenFlow 187 Type: OFPT_PACKET_OUT
724 0.408705394 172.31.31.144 -> 172.31.23.72 OpenFlow 187 Type: OFPT_PACKET_OUT
725 0.408770601 172.31.31.144 -> 172.31.23.72 OpenFlow 187 Type: OFPT_PACKET_OUT
726 0.408864085 172.31.31.144 -> 172.31.23.72 OpenFlow 187 Type: OFPT_PACKET_OUT
727 0.408887986 172.31.31.144 -> 172.31.23.72 OpenFlow 187 Type: OFPT_PACKET_OUT
728 0.408926266 172.31.31.144 -> 172.31.23.72 OpenFlow 187 Type: OFPT_PACKET_OUT
729 0.408965702 172.31.31.144 -> 172.31.23.72 OpenFlow 187 Type: OFPT_PACKET_OUT
730 0.409024285 172.31.31.144 -> 172.31.23.72 OpenFlow 187 Type: OFPT_PACKET_OUT
731 0.409040726 172.31.23.72 -> 172.31.31.144 OpenFlow 189 Type: OFPT_PACKET_IN
732 0.409062097 172.31.31.144 -> 172.31.23.72 OpenFlow 187 Type: OFPT_PACKET_OUT
733 0.409070039 172.31.23.72 -> 172.31.31.144 OpenFlow 189 Type: OFPT_PACKET_IN
734 0.409111222 172.31.31.144 -> 172.31.23.72 OpenFlow 187 Type: OFPT_PACKET_OUT
735 0.409116820 172.31.23.72 -> 172.31.31.144 TCP 66 48348 → 6633 [ACK] Seq=739 Ack=122 Win=213 Len=0 TSval=21978184 TSecr=3408058
736 0.409147775 172.31.31.144 -> 172.31.23.72 OpenFlow 187 Type: OFPT_PACKET_OUT
737 0.409152568 172.31.23.72 -> 172.31.31.144 TCP 66 48348 → 6633 [ACK] Seq=739 Ack=243 Win=213 Len=0 TSval=21978184 TSecr=3408058
738 0.409184584 172.31.31.144 -> 172.31.23.72 OpenFlow 187 Type: OFPT_PACKET_OUT
739 0.409189165 172.31.23.72 -> 172.31.31.144 TCP 66 48348 → 6633 [ACK] Seq=739 Ack=364 Win=213 Len=0 TSval=21978184 TSecr=3408058
740 0.409252048 172.31.31.144 -> 172.31.23.72 OpenFlow 187 Type: OFPT_PACKET_OUT
741 0.409258190 172.31.23.72 -> 172.31.31.144 TCP 66 48348 → 6633 [ACK] Seq=739 Ack=485 Win=213 Len=0 TSval=21978184 TSecr=3408058
742 0.409263268 172.31.31.144 -> 172.31.23.72 OpenFlow 187 Type: OFPT_PACKET_OUT
743 0.409265376 172.31.23.72 -> 172.31.31.144 TCP 66 48348 → 6633 [ACK] Seq=739 Ack=606 Win=213 Len=0 TSval=21978184 TSecr=3408058
744 0.409268583 172.31.31.144 -> 172.31.23.72 OpenFlow 187 Type: OFPT_PACKET_OUT
745 0.409271052 172.31.23.72 -> 172.31.31.144 TCP 66 48348 → 6633 [ACK] Seq=739 Ack=727 Win=213 Len=0 TSval=21978184 TSecr=3408058
746 0.409341513 172.31.31.144 -> 172.31.23.72 TCP 66 6633 → 48360 [ACK] Seq=1561 Ack=915 Win=853 Len=0 TSval=3408058 TSecr=21978184
747 0.409346967 172.31.31.144 -> 172.31.23.72 OpenFlow 187 Type: OFPT_PACKET_OUT
748 0.409389478 172.31.31.144 -> 172.31.23.72 OpenFlow 187 Type: OFPT_PACKET_OUT
749 0.409404295 172.31.31.144 -> 172.31.23.72 OpenFlow 187 Type: OFPT_PACKET_OUT
750 0.409462325 172.31.31.144 -> 172.31.23.72 OpenFlow 187 Type: OFPT_PACKET_OUT
751 0.409493745 172.31.23.72 -> 172.31.31.144 OpenFlow 189 Type: OFPT_PACKET_IN
752 0.409531649 172.31.31.144 -> 172.31.23.72 OpenFlow 187 Type: OFPT_PACKET_OUT
753 0.409537913 172.31.23.72 -> 172.31.31.144 OpenFlow 189 Type: OFPT_PACKET_IN
754 0.409576436 172.31.31.144 -> 172.31.23.72 OpenFlow 187 Type: OFPT_PACKET_OUT
755 0.409618654 172.31.31.144 -> 172.31.23.72 OpenFlow 187 Type: OFPT_PACKET_OUT
756 0.409650742 172.31.31.144 -> 172.31.23.72 OpenFlow 187 Type: OFPT_PACKET_OUT
757 0.409680970 172.31.31.144 -> 172.31.23.72 OpenFlow 187 Type: OFPT_PACKET_OUT
758 0.409713339 172.31.31.144 -> 172.31.23.72 OpenFlow 187 Type: OFPT_PACKET_OUT
759 0.409752240 172.31.31.144 -> 172.31.23.72 TCP 66 6633 → 48354 [ACK] Seq=1911 Ack=1091 Win=853 Len=0 TSval=3408058 TSecr=21978184
760 0.409804377 172.31.31.144 -> 172.31.23.72 OpenFlow 187 Type: OFPT_PACKET_OUT
761 0.409810584 172.31.23.72 -> 172.31.31.144 TCP 66 48328 → 6633 [ACK] Seq=493 Ack=122 Win=213 Len=0 TSval=21978184 TSecr=3408058
762 0.409817716 172.31.31.144 -> 172.31.23.72 OpenFlow 187 Type: OFPT_PACKET_OUT
763 0.409820296 172.31.23.72 -> 172.31.31.144 TCP 66 48328 → 6633 [ACK] Seq=493 Ack=243 Win=213 Len=0 TSval=21978184 TSecr=3408058
764 0.409832525 172.31.31.144 -> 172.31.23.72 OpenFlow 187 Type: OFPT_PACKET_OUT
765 0.409835171 172.31.23.72 -> 172.31.31.144 TCP 66 48328 → 6633 [ACK] Seq=493 Ack=364 Win=213 Len=0 TSval=21978184 TSecr=3408058
766 0.409901108 172.31.31.144 -> 172.31.23.72 OpenFlow 187 Type: OFPT_PACKET_OUT
767 0.409907383 172.31.23.72 -> 172.31.31.144 TCP 66 48328 → 6633 [ACK] Seq=493 Ack=485 Win=213 Len=0 TSval=21978184 TSecr=3408058
768 0.409939259 172.31.31.144 -> 172.31.23.72 OpenFlow 187 Type: OFPT_PACKET_OUT
769 0.409943417 172.31.23.72 -> 172.31.31.144 TCP 66 48328 → 6633 [ACK] Seq=493 Ack=606 Win=213 Len=0 TSval=21978184 TSecr=3408058
770 0.409948225 172.31.31.144 -> 172.31.23.72 OpenFlow 187 Type: OFPT_PACKET_OUT
771 0.409950438 172.31.23.72 -> 172.31.31.144 TCP 66 48328 → 6633 [ACK] Seq=493 Ack=727 Win=213 Len=0 TSval=21978184 TSecr=3408058
772 0.410542843 172.31.23.72 -> 172.31.31.144 TCP 66 48332 → 6633 [ACK] Seq=1201 Ack=2779 Win=213 Len=0 TSval=21978184 TSecr=3408058
773 0.410610271 172.31.23.72 -> 172.31.31.144 OpenFlow 189 Type: OFPT_PACKET_IN
774 0.410637580 172.31.23.72 -> 172.31.31.144 OpenFlow 189 Type: OFPT_PACKET_IN
775 0.410883946 172.31.31.144 -> 172.31.23.72 TCP 66 6633 → 48328 [ACK] Seq=727 Ack=739 Win=853 Len=0 TSval=3408059 TSecr=21978184
776 0.410966796 172.31.23.72 -> 172.31.31.144 OpenFlow 189 Type: OFPT_PACKET_IN
777 0.410995875 172.31.23.72 -> 172.31.31.144 OpenFlow 435 Type: OFPT_PACKET_IN
778 0.411003386 172.31.23.72 -> 172.31.31.144 OpenFlow 189 Type: OFPT_PACKET_IN
779 0.411019817 172.31.23.72 -> 172.31.31.144 OpenFlow 189 Type: OFPT_PACKET_IN
780 0.411030712 172.31.23.72 -> 172.31.31.144 OpenFlow 189 Type: OFPT_PACKET_IN
781 0.411058616 172.31.23.72 -> 172.31.31.144 OpenFlow 189 Type: OFPT_PACKET_IN
782 0.411060698 172.31.23.72 -> 172.31.31.144 OpenFlow 189 Type: OFPT_PACKET_IN
783 0.411075372 172.31.23.72 -> 172.31.31.144 OpenFlow 189 Type: OFPT_PACKET_IN
784 0.411077163 172.31.23.72 -> 172.31.31.144 OpenFlow 189 Type: OFPT_PACKET_IN
785 0.411091261 172.31.23.72 -> 172.31.31.144 OpenFlow 189 Type: OFPT_PACKET_IN
786 0.411097280 172.31.23.72 -> 172.31.31.144 OpenFlow 189 Type: OFPT_PACKET_IN
787 0.411122716 172.31.23.72 -> 172.31.31.144 OpenFlow 189 Type: OFPT_PACKET_IN
788 0.411124867 172.31.23.72 -> 172.31.31.144 OpenFlow 435 Type: OFPT_PACKET_IN
789 0.411136475 172.31.23.72 -> 172.31.31.144 OpenFlow 189 Type: OFPT_PACKET_IN
790 0.411147544 172.31.23.72 -> 172.31.31.144 OpenFlow 189 Type: OFPT_PACKET_IN
791 0.411158682 172.31.23.72 -> 172.31.31.144 OpenFlow 189 Type: OFPT_PACKET_IN
792 0.411160829 172.31.23.72 -> 172.31.31.144 OpenFlow 435 Type: OFPT_PACKET_IN
793 0.411205232 172.31.31.144 -> 172.31.23.72 TCP 66 6633 → 48358 [ACK] Seq=969 Ack=370 Win=853 Len=0 TSval=3408059 TSecr=21978184
794 0.411210943 172.31.31.144 -> 172.31.23.72 TCP 66 6633 → 48358 [ACK] Seq=969 Ack=739 Win=853 Len=0 TSval=3408059 TSecr=21978184
795 0.411312513 172.31.23.72 -> 172.31.31.144 OpenFlow 681 Type: OFPT_PACKET_IN
796 0.411319121 172.31.23.72 -> 172.31.31.144 OpenFlow 189 Type: OFPT_PACKET_IN
797 0.411320784 172.31.23.72 -> 172.31.31.144 OpenFlow 189 Type: OFPT_PACKET_IN
798 0.411323044 172.31.23.72 -> 172.31.31.144 OpenFlow 189 Type: OFPT_PACKET_IN
799 0.411385543 172.31.31.144 -> 172.31.23.72 TCP 66 6633 → 48340 [ACK] Seq=1803 Ack=1284 Win=853 Len=0 TSval=3408059 TSecr=21978184
800 0.411394364 172.31.23.72 -> 172.31.31.144 OpenFlow 681 Type: OFPT_PACKET_IN
801 0.411479637 172.31.31.144 -> 172.31.23.72 TCP 66 6633 → 48346 [ACK] Seq=1703 Ack=845 Win=853 Len=0 TSval=3408059 TSecr=21978184
802 0.411485421 172.31.31.144 -> 172.31.23.72 TCP 66 6633 → 48336 [ACK] Seq=3051 Ack=1246 Win=853 Len=0 TSval=3408059 TSecr=21978184
803 0.411487693 172.31.31.144 -> 172.31.23.72 TCP 66 6633 → 48326 [ACK] Seq=3401 Ack=1611 Win=853 Len=0 TSval=3408059 TSecr=21978184
804 0.411489795 172.31.31.144 -> 172.31.23.72 TCP 66 6633 → 48322 [ACK] Seq=969 Ack=616 Win=853 Len=0 TSval=3408059 TSecr=21978184
805 0.411566227 172.31.31.144 -> 172.31.23.72 TCP 66 6633 → 48340 [ACK] Seq=1803 Ack=1407 Win=853 Len=0 TSval=3408059 TSecr=21978184
806 0.411582517 172.31.31.144 -> 172.31.23.72 TCP 66 6633 → 48330 [ACK] Seq=1211 Ack=1231 Win=853 Len=0 TSval=3408059 TSecr=21978184
807 0.411589976 172.31.23.72 -> 172.31.31.144 TCP 66 48338 → 6633 [ACK] Seq=1843 Ack=2375 Win=213 Len=0 TSval=21978185 TSecr=3408058
808 0.411641075 172.31.31.144 -> 172.31.23.72 TCP 66 6633 → 48324 [ACK] Seq=2403 Ack=1345 Win=853 Len=0 TSval=3408059 TSecr=21978184
809 0.411669747 172.31.23.72 -> 172.31.31.144 OpenFlow 189 Type: OFPT_PACKET_IN
810 0.411679383 172.31.31.144 -> 172.31.23.72 TCP 66 6633 → 48334 [ACK] Seq=2453 Ack=1605 Win=853 Len=0 TSval=3408059 TSecr=21978184
811 0.411682475 172.31.31.144 -> 172.31.23.72 TCP 66 6633 → 48336 [ACK] Seq=3051 Ack=1369 Win=853 Len=0 TSval=3408059 TSecr=21978185
812 0.411693774 172.31.23.72 -> 172.31.31.144 OpenFlow 189 Type: OFPT_PACKET_IN
813 0.411716938 172.31.23.72 -> 172.31.31.144 OpenFlow 312 Type: OFPT_PACKET_IN
814 0.411722046 172.31.23.72 -> 172.31.31.144 OpenFlow 189 Type: OFPT_PACKET_IN
815 0.411734469 172.31.23.72 -> 172.31.31.144 OpenFlow 189 Type: OFPT_PACKET_IN
816 0.411763622 172.31.23.72 -> 172.31.31.144 OpenFlow 189 Type: OFPT_PACKET_IN
817 0.411765571 172.31.23.72 -> 172.31.31.144 OpenFlow 189 Type: OFPT_PACKET_IN
818 0.411778195 172.31.31.144 -> 172.31.23.72 TCP 66 6633 → 48350 [ACK] Seq=2235 Ack=1423 Win=853 Len=0 TSval=3408059 TSecr=21978184
819 0.411804668 172.31.23.72 -> 172.31.31.144 OpenFlow 189 Type: OFPT_PACKET_IN
820 0.411810536 172.31.23.72 -> 172.31.31.144 OpenFlow 189 Type: OFPT_PACKET_IN
821 0.411882528 172.31.23.72 -> 172.31.31.144 OpenFlow 189 Type: OFPT_PACKET_IN
822 0.411891624 172.31.31.144 -> 172.31.23.72 TCP 66 6633 → 48366 [ACK] Seq=1911 Ack=599 Win=853 Len=0 TSval=3408059 TSecr=21978185
823 0.411895767 172.31.31.144 -> 172.31.23.72 TCP 66 6633 → 48352 [ACK] Seq=1547 Ack=1567 Win=853 Len=0 TSval=3408059 TSecr=21978184
824 0.411907891 172.31.23.72 -> 172.31.31.144 OpenFlow 189 Type: OFPT_PACKET_IN
825 0.411946389 172.31.23.72 -> 172.31.31.144 OpenFlow 189 Type: OFPT_PACKET_IN
826 0.411953926 172.31.31.144 -> 172.31.23.72 TCP 66 6633 → 48322 [ACK] Seq=969 Ack=739 Win=853 Len=0 TSval=3408059 TSecr=21978185
827 0.411979858 172.31.23.72 -> 172.31.31.144 OpenFlow 189 Type: OFPT_PACKET_IN
828 0.412009199 172.31.31.144 -> 172.31.23.72 TCP 66 6633 → 48332 [ACK] Seq=2779 Ack=1447 Win=853 Len=0 TSval=3408059 TSecr=21978185
829 0.412014919 172.31.23.72 -> 172.31.31.144 OpenFlow 189 Type: OFPT_PACKET_IN
830 0.412033679 172.31.23.72 -> 172.31.31.144 OpenFlow 189 Type: OFPT_PACKET_IN
831 0.412134849 172.31.31.144 -> 172.31.23.72 TCP 66 6633 → 48344 [ACK] Seq=1305 Ack=1321 Win=853 Len=0 TSval=3408059 TSecr=21978185
832 0.412170034 172.31.31.144 -> 172.31.23.72 TCP 66 6633 → 48336 [ACK] Seq=3051 Ack=1492 Win=853 Len=0 TSval=3408059 TSecr=21978185
833 0.412183828 172.31.31.144 -> 172.31.23.72 TCP 66 6633 → 48336 [ACK] Seq=3051 Ack=1615 Win=853 Len=0 TSval=3408059 TSecr=21978185
834 0.412304443 172.31.31.144 -> 172.31.23.72 TCP 66 6633 → 48362 [ACK] Seq=1401 Ack=1001 Win=853 Len=0 TSval=3408059 TSecr=21978185
835 0.412407232 172.31.31.144 -> 172.31.23.72 TCP 66 6633 → 48364 [ACK] Seq=1945 Ack=1091 Win=853 Len=0 TSval=3408059 TSecr=21978185
836 0.412680648 172.31.31.144 -> 172.31.23.72 TCP 66 6633 → 48346 [ACK] Seq=1703 Ack=1091 Win=853 Len=0 TSval=3408059 TSecr=21978185
837 0.450450216 172.31.31.144 -> 172.31.23.72 TCP 66 6633 → 48366 [ACK] Seq=1911 Ack=845 Win=853 Len=0 TSval=3408069 TSecr=21978185
838 1.026126260 172.31.31.144 -> 172.31.23.72 OpenFlow 90 Type: OFPT_MULTIPART_REQUEST, OFPMP_PORT_STATS
839 1.026160770 172.31.23.72 -> 172.31.31.144 TCP 66 48320 → 6633 [ACK] Seq=493 Ack=751 Win=213 Len=0 TSval=21978338 TSecr=3408212
840 1.026190238 172.31.31.144 -> 172.31.23.72 OpenFlow 138 Type: OFPT_MULTIPART_REQUEST, OFPMP_FLOW
841 1.026200194 172.31.23.72 -> 172.31.31.144 TCP 66 48320 → 6633 [ACK] Seq=493 Ack=823 Win=213 Len=0 TSval=21978338 TSecr=3408212
842 1.026556137 172.31.23.72 -> 172.31.31.144 OpenFlow 530 Type: OFPT_MULTIPART_REPLY, OFPMP_PORT_STATS
843 1.026734700 172.31.23.72 -> 172.31.31.144 OpenFlow 6178 Type: OFPT_MULTIPART_REPLY, OFPMP_TABLE
844 1.026811419 172.31.23.72 -> 172.31.31.144 OpenFlow 2010 Type: OFPT_MULTIPART_REPLY, OFPMP_FLOW
845 1.027025544 172.31.31.144 -> 172.31.23.72 TCP 66 6633 → 48320 [ACK] Seq=823 Ack=9013 Win=853 Len=0 TSval=3408213 TSecr=21978338
846 1.087313121 172.31.31.144 -> 172.31.23.72 OpenFlow 90 Type: OFPT_MULTIPART_REQUEST, OFPMP_PORT_STATS
847 1.087547625 172.31.23.72 -> 172.31.31.144 OpenFlow 642 Type: OFPT_MULTIPART_REPLY, OFPMP_PORT_STATS
848 1.087829091 172.31.31.144 -> 172.31.23.72 TCP 66 6633 → 48322 [ACK] Seq=993 Ack=1315 Win=853 Len=0 TSval=3408228 TSecr=21978354
849 1.103138994 172.31.31.144 -> 172.31.23.72 OpenFlow 82 Type: OFPT_MULTIPART_REQUEST, OFPMP_TABLE
850 1.103147623 172.31.31.144 -> 172.31.23.72 OpenFlow 122 Type: OFPT_MULTIPART_REQUEST, OFPMP_FLOW
851 1.103442872 172.31.23.72 -> 172.31.31.144 OpenFlow 6178 Type: OFPT_MULTIPART_REPLY, OFPMP_TABLE
852 1.103528405 172.31.23.72 -> 172.31.31.144 OpenFlow 2842 Type: OFPT_MULTIPART_REPLY, OFPMP_FLOW
853 1.103747759 172.31.31.144 -> 172.31.23.72 TCP 66 6633 → 48322 [ACK] Seq=1065 Ack=10203 Win=853 Len=0 TSval=3408232 TSecr=21978358
854 1.105350859 172.31.31.144 -> 172.31.23.72 OpenFlow 122 Type: OFPT_MULTIPART_REQUEST, OFPMP_FLOW
855 1.105361707 172.31.31.144 -> 172.31.23.72 OpenFlow 106 Type: OFPT_MULTIPART_REQUEST, OFPMP_TABLE
856 1.105500348 172.31.23.72 -> 172.31.31.144 OpenFlow 2634 Type: OFPT_MULTIPART_REPLY, OFPMP_FLOW
857 1.105603366 172.31.23.72 -> 172.31.31.144 OpenFlow 754 Type: OFPT_MULTIPART_REPLY, OFPMP_PORT_STATS
858 1.105749348 172.31.23.72 -> 172.31.31.144 OpenFlow 6178 Type: OFPT_MULTIPART_REPLY, OFPMP_TABLE
859 1.105822471 172.31.31.144 -> 172.31.23.72 TCP 66 6633 → 48324 [ACK] Seq=2499 Ack=4601 Win=853 Len=0 TSval=3408232 TSecr=21978358
860 1.133553218 172.31.31.144 -> 172.31.23.72 OpenFlow 122 Type: OFPT_MULTIPART_REQUEST, OFPMP_FLOW
861 1.133563938 172.31.31.144 -> 172.31.23.72 OpenFlow 106 Type: OFPT_MULTIPART_REQUEST, OFPMP_PORT_STATS
862 1.133728501 172.31.23.72 -> 172.31.31.144 OpenFlow 2010 Type: OFPT_MULTIPART_REPLY, OFPMP_FLOW
863 1.133879423 172.31.23.72 -> 172.31.31.144 OpenFlow 6178 Type: OFPT_MULTIPART_REPLY, OFPMP_TABLE
864 1.133970237 172.31.23.72 -> 172.31.31.144 OpenFlow 642 Type: OFPT_MULTIPART_REPLY, OFPMP_PORT_STATS
865 1.134109579 172.31.31.144 -> 172.31.23.72 TCP 66 6633 → 48326 [ACK] Seq=3497 Ack=9667 Win=853 Len=0 TSval=3408239 TSecr=21978365
866 1.142409884 172.31.31.144 -> 172.31.23.72 TCP 66 6633 → 48324 [ACK] Seq=2499 Ack=10713 Win=853 Len=0 TSval=3408242 TSecr=21978358
867 1.170451527 172.31.31.144 -> 172.31.23.72 TCP 66 6633 → 48326 [ACK] Seq=3497 Ack=10243 Win=853 Len=0 TSval=3408249 TSecr=21978365
868 1.173802022 172.31.31.144 -> 172.31.23.72 OpenFlow 82 Type: OFPT_MULTIPART_REQUEST, OFPMP_TABLE
869 1.173820162 172.31.31.144 -> 172.31.23.72 OpenFlow 146 Type: OFPT_MULTIPART_REQUEST, OFPMP_PORT_STATS
870 1.174135935 172.31.23.72 -> 172.31.31.144 OpenFlow 6178 Type: OFPT_MULTIPART_REPLY, OFPMP_TABLE
871 1.174184796 172.31.23.72 -> 172.31.31.144 OpenFlow 554 Type: OFPT_MULTIPART_REPLY, OFPMP_FLOW
872 1.174265912 172.31.23.72 -> 172.31.31.144 OpenFlow 530 Type: OFPT_MULTIPART_REPLY, OFPMP_PORT_STATS
873 1.174479644 172.31.31.144 -> 172.31.23.72 TCP 66 6633 → 48328 [ACK] Seq=823 Ack=7803 Win=853 Len=0 TSval=3408250 TSecr=21978375
874 1.213124673 172.31.31.144 -> 172.31.23.72 OpenFlow 122 Type: OFPT_MULTIPART_REQUEST, OFPMP_FLOW
875 1.213140252 172.31.23.72 -> 172.31.31.144 TCP 66 48330 → 6633 [ACK] Seq=1231 Ack=1267 Win=213 Len=0 TSval=21978385 TSecr=3408259
876 1.213154244 172.31.31.144 -> 172.31.23.72 OpenFlow 106 Type: OFPT_MULTIPART_REQUEST, OFPMP_TABLE
877 1.213161656 172.31.23.72 -> 172.31.31.144 TCP 66 48330 → 6633 [ACK] Seq=1231 Ack=1307 Win=213 Len=0 TSval=21978385 TSecr=3408259
878 1.213350505 172.31.23.72 -> 172.31.31.144 OpenFlow 3258 Type: OFPT_MULTIPART_REPLY, OFPMP_FLOW
879 1.213459993 172.31.23.72 -> 172.31.31.144 OpenFlow 754 Type: OFPT_MULTIPART_REPLY, OFPMP_PORT_STATS
880 1.213612034 172.31.23.72 -> 172.31.31.144 OpenFlow 6178 Type: OFPT_MULTIPART_REPLY, OFPMP_TABLE
881 1.213719402 172.31.31.144 -> 172.31.23.72 TCP 66 6633 → 48330 [ACK] Seq=1307 Ack=5111 Win=853 Len=0 TSval=3408259 TSecr=21978385
882 1.250416405 172.31.31.144 -> 172.31.23.72 TCP 66 6633 → 48330 [ACK] Seq=1307 Ack=11223 Win=853 Len=0 TSval=3408269 TSecr=21978385
883 1.255374019 172.31.31.144 -> 172.31.23.72 OpenFlow 122 Type: OFPT_MULTIPART_REQUEST, OFPMP_FLOW
884 1.255387514 172.31.31.144 -> 172.31.23.72 OpenFlow 106 Type: OFPT_MULTIPART_REQUEST, OFPMP_TABLE
885 1.255615343 172.31.23.72 -> 172.31.31.144 OpenFlow 2010 Type: OFPT_MULTIPART_REPLY, OFPMP_FLOW
886 1.255716749 172.31.23.72 -> 172.31.31.144 OpenFlow 754 Type: OFPT_MULTIPART_REPLY, OFPMP_PORT_STATS
887 1.255853617 172.31.23.72 -> 172.31.31.144 OpenFlow 6178 Type: OFPT_MULTIPART_REPLY, OFPMP_TABLE
888 1.256014096 172.31.31.144 -> 172.31.23.72 TCP 66 6633 → 48332 [ACK] Seq=2875 Ack=4079 Win=853 Len=0 TSval=3408270 TSecr=21978396
889 1.289586517 172.31.31.144 -> 172.31.23.72 OpenFlow 90 Type: OFPT_MULTIPART_REQUEST, OFPMP_PORT_STATS
890 1.289604528 172.31.31.144 -> 172.31.23.72 OpenFlow 138 Type: OFPT_MULTIPART_REQUEST, OFPMP_TABLE
891 1.289839096 172.31.23.72 -> 172.31.31.144 OpenFlow 530 Type: OFPT_MULTIPART_REPLY, OFPMP_PORT_STATS
892 1.289941558 172.31.23.72 -> 172.31.31.144 OpenFlow 970 Type: OFPT_MULTIPART_REPLY, OFPMP_FLOW
893 1.290054312 172.31.23.72 -> 172.31.31.144 OpenFlow 6178 Type: OFPT_MULTIPART_REPLY, OFPMP_TABLE
894 1.290204419 172.31.31.144 -> 172.31.23.72 TCP 66 6633 → 48334 [ACK] Seq=2549 Ack=2973 Win=853 Len=0 TSval=3408278 TSecr=21978404
895 1.294415492 172.31.31.144 -> 172.31.23.72 TCP 66 6633 → 48332 [ACK] Seq=2875 Ack=10191 Win=853 Len=0 TSval=3408280 TSecr=21978396
896 1.326398364 172.31.31.144 -> 172.31.23.72 TCP 66 6633 → 48334 [ACK] Seq=2549 Ack=9085 Win=853 Len=0 TSval=3408288 TSecr=21978404
897 1.373739976 172.31.31.144 -> 172.31.23.72 OpenFlow 82 Type: OFPT_MULTIPART_REQUEST, OFPMP_TABLE
898 1.373752168 172.31.31.144 -> 172.31.23.72 OpenFlow 146 Type: OFPT_MULTIPART_REQUEST, OFPMP_FLOW
899 1.374058175 172.31.23.72 -> 172.31.31.144 OpenFlow 6178 Type: OFPT_MULTIPART_REPLY, OFPMP_TABLE
900 1.374198570 172.31.23.72 -> 172.31.31.144 OpenFlow 754 Type: OFPT_MULTIPART_REPLY, OFPMP_PORT_STATS
901 1.374291011 172.31.23.72 -> 172.31.31.144 OpenFlow 3674 Type: OFPT_MULTIPART_REPLY, OFPMP_FLOW
902 1.374381462 172.31.31.144 -> 172.31.23.72 TCP 66 6633 → 48336 [ACK] Seq=3147 Ack=7727 Win=853 Len=0 TSval=3408300 TSecr=21978425
903 1.374409385 172.31.31.144 -> 172.31.23.72 TCP 66 6633 → 48336 [ACK] Seq=3147 Ack=8415 Win=853 Len=0 TSval=3408300 TSecr=21978425
904 1.374490669 172.31.31.144 -> 172.31.23.72 TCP 66 6633 → 48336 [ACK] Seq=3147 Ack=12023 Win=853 Len=0 TSval=3408300 TSecr=21978425
905 1.415945996 172.31.31.144 -> 172.31.23.72 OpenFlow 82 Type: OFPT_MULTIPART_REQUEST, OFPMP_TABLE
906 1.415980940 172.31.31.144 -> 172.31.23.72 OpenFlow 146 Type: OFPT_MULTIPART_REQUEST, OFPMP_PORT_STATS
907 1.416254293 172.31.23.72 -> 172.31.31.144 OpenFlow 6178 Type: OFPT_MULTIPART_REPLY, OFPMP_TABLE
908 1.416307271 172.31.23.72 -> 172.31.31.144 OpenFlow 1178 Type: OFPT_MULTIPART_REPLY, OFPMP_FLOW
909 1.416395841 172.31.23.72 -> 172.31.31.144 OpenFlow 642 Type: OFPT_MULTIPART_REPLY, OFPMP_PORT_STATS
910 1.416540190 172.31.31.144 -> 172.31.23.72 TCP 66 6633 → 48338 [ACK] Seq=2471 Ack=9643 Win=853 Len=0 TSval=3408310 TSecr=21978436
911 1.485381115 172.31.31.144 -> 172.31.23.72 OpenFlow 122 Type: OFPT_MULTIPART_REQUEST, OFPMP_FLOW
912 1.485413461 172.31.31.144 -> 172.31.23.72 OpenFlow 106 Type: OFPT_MULTIPART_REQUEST, OFPMP_PORT_STATS
913 1.485697039 172.31.23.72 -> 172.31.31.144 OpenFlow 2842 Type: OFPT_MULTIPART_REPLY, OFPMP_FLOW
914 1.485905465 172.31.23.72 -> 172.31.31.144 OpenFlow 6178 Type: OFPT_MULTIPART_REPLY, OFPMP_TABLE
915 1.485919691 172.31.31.144 -> 172.31.23.72 TCP 66 6633 → 48340 [ACK] Seq=1899 Ack=4183 Win=853 Len=0 TSval=3408327 TSecr=21978453
916 1.486046822 172.31.23.72 -> 172.31.31.144 OpenFlow 754 Type: OFPT_MULTIPART_REPLY, OFPMP_PORT_STATS
917 1.486094004 172.31.31.144 -> 172.31.23.72 TCP 66 6633 → 48340 [ACK] Seq=1899 Ack=10295 Win=853 Len=0 TSval=3408327 TSecr=21978453
918 1.486262009 172.31.31.144 -> 172.31.23.72 TCP 66 6633 → 48340 [ACK] Seq=1899 Ack=10983 Win=853 Len=0 TSval=3408327 TSecr=21978453
919 1.525609176 172.31.31.144 -> 172.31.23.72 OpenFlow 122 Type: OFPT_MULTIPART_REQUEST, OFPMP_FLOW
920 1.525631326 172.31.31.144 -> 172.31.23.72 OpenFlow 106 Type: OFPT_MULTIPART_REQUEST, OFPMP_PORT_STATS
921 1.525896148 172.31.23.72 -> 172.31.31.144 OpenFlow 2010 Type: OFPT_MULTIPART_REPLY, OFPMP_FLOW
922 1.526076286 172.31.23.72 -> 172.31.31.144 OpenFlow 6178 Type: OFPT_MULTIPART_REPLY, OFPMP_TABLE
923 1.526182406 172.31.23.72 -> 172.31.31.144 OpenFlow 642 Type: OFPT_MULTIPART_REPLY, OFPMP_PORT_STATS
924 1.526306212 172.31.31.144 -> 172.31.23.72 TCP 66 6633 → 48342 [ACK] Seq=2089 Ack=9233 Win=853 Len=0 TSval=3408337 TSecr=21978463
925 1.566492132 172.31.31.144 -> 172.31.23.72 TCP 66 6633 → 48342 [ACK] Seq=2089 Ack=9809 Win=853 Len=0 TSval=3408348 TSecr=21978463
926 1.575808451 172.31.31.144 -> 172.31.23.72 OpenFlow 122 Type: OFPT_MULTIPART_REQUEST, OFPMP_FLOW
927 1.575828264 172.31.31.144 -> 172.31.23.72 OpenFlow 106 Type: OFPT_MULTIPART_REQUEST, OFPMP_TABLE
928 1.576077629 172.31.23.72 -> 172.31.31.144 OpenFlow 554 Type: OFPT_MULTIPART_REPLY, OFPMP_FLOW
929 1.576193864 172.31.23.72 -> 172.31.31.144 OpenFlow 642 Type: OFPT_MULTIPART_REPLY, OFPMP_PORT_STATS
930 1.576362940 172.31.23.72 -> 172.31.31.144 OpenFlow 6178 Type: OFPT_MULTIPART_REPLY, OFPMP_TABLE
931 1.576379757 172.31.31.144 -> 172.31.23.72 TCP 66 6633 → 48344 [ACK] Seq=1401 Ack=1809 Win=853 Len=0 TSval=3408350 TSecr=21978476
932 1.576443982 172.31.31.144 -> 172.31.23.72 TCP 66 6633 → 48344 [ACK] Seq=1401 Ack=2385 Win=853 Len=0 TSval=3408350 TSecr=21978476
933 1.576622365 172.31.31.144 -> 172.31.23.72 TCP 66 6633 → 48344 [ACK] Seq=1401 Ack=8497 Win=853 Len=0 TSval=3408350 TSecr=21978476
934 1.592983932 172.31.31.144 -> 172.31.23.72 OpenFlow 122 Type: OFPT_MULTIPART_REQUEST, OFPMP_FLOW
935 1.592992318 172.31.31.144 -> 172.31.23.72 OpenFlow 106 Type: OFPT_MULTIPART_REQUEST, OFPMP_TABLE
936 1.593105519 172.31.23.72 -> 172.31.31.144 OpenFlow 1178 Type: OFPT_MULTIPART_REPLY, OFPMP_FLOW
937 1.593175564 172.31.23.72 -> 172.31.31.144 OpenFlow 530 Type: OFPT_MULTIPART_REPLY, OFPMP_PORT_STATS
938 1.593305137 172.31.23.72 -> 172.31.31.144 OpenFlow 6178 Type: OFPT_MULTIPART_REPLY, OFPMP_TABLE
939 1.593391550 172.31.31.144 -> 172.31.23.72 TCP 66 6633 → 48346 [ACK] Seq=1799 Ack=2667 Win=853 Len=0 TSval=3408354 TSecr=21978480
940 1.630398055 172.31.31.144 -> 172.31.23.72 TCP 66 6633 → 48346 [ACK] Seq=1799 Ack=8779 Win=853 Len=0 TSval=3408364 TSecr=21978480
941 1.642188284 172.31.31.144 -> 172.31.23.72 OpenFlow 90 Type: OFPT_MULTIPART_REQUEST, OFPMP_PORT_STATS
942 1.642200944 172.31.23.72 -> 172.31.31.144 TCP 66 48348 → 6633 [ACK] Seq=739 Ack=751 Win=213 Len=0 TSval=21978492 TSecr=3408366
943 1.642206581 172.31.31.144 -> 172.31.23.72 OpenFlow 122 Type: OFPT_MULTIPART_REQUEST, OFPMP_FLOW
944 1.642210262 172.31.23.72 -> 172.31.31.144 TCP 66 48348 → 6633 [ACK] Seq=739 Ack=807 Win=213 Len=0 TSval=21978492 TSecr=3408366
945 1.642431521 172.31.23.72 -> 172.31.31.144 OpenFlow 530 Type: OFPT_MULTIPART_REPLY, OFPMP_PORT_STATS
946 1.642515019 172.31.23.72 -> 172.31.31.144 OpenFlow 1594 Type: OFPT_MULTIPART_REPLY, OFPMP_FLOW
947 1.642741480 172.31.31.144 -> 172.31.23.72 TCP 66 6633 → 48348 [ACK] Seq=807 Ack=2731 Win=853 Len=0 TSval=3408367 TSecr=21978492
948 1.643326361 172.31.31.144 -> 172.31.23.72 OpenFlow 82 Type: OFPT_MULTIPART_REQUEST, OFPMP_TABLE
949 1.643605717 172.31.23.72 -> 172.31.31.144 OpenFlow 6178 Type: OFPT_MULTIPART_REPLY, OFPMP_TABLE
950 1.682462677 172.31.31.144 -> 172.31.23.72 TCP 66 6633 → 48348 [ACK] Seq=823 Ack=8843 Win=853 Len=0 TSval=3408377 TSecr=21978493
951 1.691712863 172.31.31.144 -> 172.31.23.72 OpenFlow 82 Type: OFPT_MULTIPART_REQUEST, OFPMP_TABLE
952 1.691731794 172.31.31.144 -> 172.31.23.72 OpenFlow 146 Type: OFPT_MULTIPART_REQUEST, OFPMP_PORT_STATS
953 1.692027185 172.31.23.72 -> 172.31.31.144 OpenFlow 6178 Type: OFPT_MULTIPART_REPLY, OFPMP_TABLE
954 1.692111260 172.31.23.72 -> 172.31.31.144 OpenFlow 2842 Type: OFPT_MULTIPART_REPLY, OFPMP_FLOW
955 1.692230901 172.31.23.72 -> 172.31.31.144 OpenFlow 754 Type: OFPT_MULTIPART_REPLY, OFPMP_PORT_STATS
956 1.692311334 172.31.31.144 -> 172.31.23.72 TCP 66 6633 → 48350 [ACK] Seq=2331 Ack=10311 Win=853 Len=0 TSval=3408379 TSecr=21978505
957 1.730424889 172.31.31.144 -> 172.31.23.72 TCP 66 6633 → 48350 [ACK] Seq=2331 Ack=10999 Win=853 Len=0 TSval=3408389 TSecr=21978505
958 1.747968184 172.31.31.144 -> 172.31.23.72 OpenFlow 82 Type: OFPT_MULTIPART_REQUEST, OFPMP_TABLE
959 1.747981982 172.31.31.144 -> 172.31.23.72 OpenFlow 146 Type: OFPT_MULTIPART_REQUEST, OFPMP_PORT_STATS
960 1.748298416 172.31.23.72 -> 172.31.31.144 OpenFlow 6178 Type: OFPT_MULTIPART_REPLY, OFPMP_TABLE
961 1.748366014 172.31.23.72 -> 172.31.31.144 OpenFlow 2010 Type: OFPT_MULTIPART_REPLY, OFPMP_FLOW
962 1.748465295 172.31.23.72 -> 172.31.31.144 OpenFlow 754 Type: OFPT_MULTIPART_REPLY, OFPMP_PORT_STATS
963 1.748547873 172.31.31.144 -> 172.31.23.72 TCP 66 6633 → 48352 [ACK] Seq=1643 Ack=9623 Win=853 Len=0 TSval=3408393 TSecr=21978519
964 1.786363993 172.31.31.144 -> 172.31.23.72 TCP 66 6633 → 48352 [ACK] Seq=1643 Ack=10311 Win=853 Len=0 TSval=3408403 TSecr=21978519
965 1.807107197 172.31.31.144 -> 172.31.23.72 OpenFlow 122 Type: OFPT_MULTIPART_REQUEST, OFPMP_FLOW
966 1.807132510 172.31.31.144 -> 172.31.23.72 OpenFlow 106 Type: OFPT_MULTIPART_REQUEST, OFPMP_PORT_STATS
967 1.807495389 172.31.23.72 -> 172.31.31.144 OpenFlow 2010 Type: OFPT_MULTIPART_REPLY, OFPMP_FLOW
968 1.807647286 172.31.23.72 -> 172.31.31.144 OpenFlow 6178 Type: OFPT_MULTIPART_REPLY, OFPMP_TABLE
969 1.807732132 172.31.23.72 -> 172.31.31.144 OpenFlow 530 Type: OFPT_MULTIPART_REPLY, OFPMP_PORT_STATS
970 1.807855362 172.31.31.144 -> 172.31.23.72 TCP 66 6633 → 48354 [ACK] Seq=2007 Ack=9147 Win=853 Len=0 TSval=3408408 TSecr=21978534
971 1.846406108 172.31.31.144 -> 172.31.23.72 TCP 66 6633 → 48354 [ACK] Seq=2007 Ack=9611 Win=853 Len=0 TSval=3408418 TSecr=21978534
972 1.880425093 172.31.31.144 -> 172.31.23.72 OpenFlow 82 Type: OFPT_MULTIPART_REQUEST, OFPMP_TABLE
973 1.880437592 172.31.31.144 -> 172.31.23.72 OpenFlow 146 Type: OFPT_MULTIPART_REQUEST, OFPMP_PORT_STATS
974 1.880758470 172.31.23.72 -> 172.31.31.144 OpenFlow 6178 Type: OFPT_MULTIPART_REPLY, OFPMP_TABLE
975 1.880851790 172.31.23.72 -> 172.31.31.144 OpenFlow 2634 Type: OFPT_MULTIPART_REPLY, OFPMP_FLOW
976 1.880927091 172.31.23.72 -> 172.31.31.144 OpenFlow 530 Type: OFPT_MULTIPART_REPLY, OFPMP_PORT_STATS
977 1.881054929 172.31.31.144 -> 172.31.23.72 TCP 66 6633 → 48356 [ACK] Seq=1415 Ack=6781 Win=853 Len=0 TSval=3408426 TSecr=21978552
978 1.881083233 172.31.31.144 -> 172.31.23.72 TCP 66 6633 → 48356 [ACK] Seq=1415 Ack=9349 Win=853 Len=0 TSval=3408426 TSecr=21978552
979 1.881102551 172.31.31.144 -> 172.31.23.72 TCP 66 6633 → 48356 [ACK] Seq=1415 Ack=9813 Win=853 Len=0 TSval=3408426 TSecr=21978552
980 1.921581371 172.31.31.144 -> 172.31.23.72 OpenFlow 90 Type: OFPT_MULTIPART_REQUEST, OFPMP_PORT_STATS
981 1.921610662 172.31.23.72 -> 172.31.31.144 TCP 66 48358 → 6633 [ACK] Seq=739 Ack=993 Win=213 Len=0 TSval=21978562 TSecr=3408436
982 1.921633002 172.31.31.144 -> 172.31.23.72 OpenFlow 138 Type: OFPT_MULTIPART_REQUEST, OFPMP_TABLE
983 1.921638917 172.31.23.72 -> 172.31.31.144 TCP 66 48358 → 6633 [ACK] Seq=739 Ack=1065 Win=213 Len=0 TSval=21978562 TSecr=3408436
984 1.921837838 172.31.23.72 -> 172.31.31.144 OpenFlow 642 Type: OFPT_MULTIPART_REPLY, OFPMP_PORT_STATS
985 1.921924247 172.31.23.72 -> 172.31.31.144 OpenFlow 2218 Type: OFPT_MULTIPART_REPLY, OFPMP_FLOW
986 1.922007012 172.31.31.144 -> 172.31.23.72 TCP 66 6633 → 48358 [ACK] Seq=1065 Ack=1315 Win=853 Len=0 TSval=3408436 TSecr=21978562
987 1.922096245 172.31.23.72 -> 172.31.31.144 OpenFlow 6178 Type: OFPT_MULTIPART_REPLY, OFPMP_TABLE
988 1.922106534 172.31.31.144 -> 172.31.23.72 TCP 66 6633 → 48358 [ACK] Seq=1065 Ack=3467 Win=853 Len=0 TSval=3408436 TSecr=21978562
989 1.922322202 172.31.31.144 -> 172.31.23.72 TCP 66 6633 → 48358 [ACK] Seq=1065 Ack=9579 Win=853 Len=0 TSval=3408437 TSecr=21978562
990 1.978879167 172.31.31.144 -> 172.31.23.72 OpenFlow 82 Type: OFPT_MULTIPART_REQUEST, OFPMP_TABLE
991 1.978914646 172.31.31.144 -> 172.31.23.72 OpenFlow 146 Type: OFPT_MULTIPART_REQUEST, OFPMP_FLOW
992 1.979334492 172.31.23.72 -> 172.31.31.144 OpenFlow 6178 Type: OFPT_MULTIPART_REPLY, OFPMP_TABLE
993 1.979436069 172.31.23.72 -> 172.31.31.144 OpenFlow 642 Type: OFPT_MULTIPART_REPLY, OFPMP_PORT_STATS
994 1.979510642 172.31.23.72 -> 172.31.31.144 OpenFlow 2426 Type: OFPT_MULTIPART_REPLY, OFPMP_FLOW
995 1.979714851 172.31.31.144 -> 172.31.23.72 TCP 66 6633 → 48360 [ACK] Seq=1657 Ack=9963 Win=853 Len=0 TSval=3408451 TSecr=21978577
