  1 0.000000000 41.177.127.217 -> 172.31.24.227 TCP 54 58416 → 22 [ACK] Seq=1 Ack=1 Win=32600 Len=0
  2 0.001972174 41.177.127.217 -> 172.31.24.227 TCP 54 58416 → 22 [ACK] Seq=1 Ack=297 Win=32452 Len=0
  3 0.076364351 41.177.127.217 -> 172.31.24.227 TCP 54 58416 → 22 [ACK] Seq=1 Ack=333 Win=32434 Len=0
  4 0.143379749 41.177.127.217 -> 172.31.24.227 TCP 54 58416 → 22 [ACK] Seq=1 Ack=429 Win=32386 Len=0
  5 0.174606272 172.31.31.144 -> 172.31.24.227 TCP 187 6633 → 39480 [PSH, ACK] Seq=1 Ack=1 Win=853 Len=121 TSval=361515 TSecr=118921404
  6 0.174653859 172.31.31.144 -> 172.31.24.227 TCP 187 6633 → 39480 [PSH, ACK] Seq=122 Ack=1 Win=853 Len=121 TSval=361516 TSecr=118921404
  7 0.174675004 172.31.31.144 -> 172.31.24.227 TCP 187 6633 → 39480 [PSH, ACK] Seq=243 Ack=1 Win=853 Len=121 TSval=361516 TSecr=118921404
  8 0.174757879 172.31.31.144 -> 172.31.24.227 TCP 187 6633 → 39480 [PSH, ACK] Seq=364 Ack=1 Win=853 Len=121 TSval=361516 TSecr=118921404
  9 0.174778167 172.31.31.144 -> 172.31.24.227 TCP 187 6633 → 39480 [PSH, ACK] Seq=485 Ack=1 Win=853 Len=121 TSval=361516 TSecr=118921404
 10 0.174788246 172.31.24.227 -> 172.31.31.144 TCP 66 39480 → 6633 [ACK] Seq=1 Ack=606 Win=70 Len=0 TSval=118922125 TSecr=361515
 11 0.174844566 172.31.31.144 -> 172.31.24.227 TCP 187 6633 → 39480 [PSH, ACK] Seq=606 Ack=1 Win=853 Len=121 TSval=361516 TSecr=118921404
 12 0.174896593 172.31.31.144 -> 172.31.24.227 TCP 187 6633 → 39480 [PSH, ACK] Seq=727 Ack=1 Win=853 Len=121 TSval=361516 TSecr=118921404
 13 0.174962312 172.31.31.144 -> 172.31.24.227 TCP 187 6633 → 39480 [PSH, ACK] Seq=848 Ack=1 Win=853 Len=121 TSval=361516 TSecr=118921404
 14 0.175005622 172.31.31.144 -> 172.31.24.227 TCP 187 6633 → 39480 [PSH, ACK] Seq=969 Ack=1 Win=853 Len=121 TSval=361516 TSecr=118922125
 15 0.175083121 172.31.31.144 -> 172.31.24.227 TCP 187 6633 → 39480 [PSH, ACK] Seq=1090 Ack=1 Win=853 Len=121 TSval=361516 TSecr=118922125
 16 0.175089537 172.31.24.227 -> 172.31.31.144 TCP 66 39480 → 6633 [ACK] Seq=1 Ack=1211 Win=70 Len=0 TSval=118922126 TSecr=361516
 17 0.175133598 172.31.31.144 -> 172.31.24.227 TCP 187 6633 → 39480 [PSH, ACK] Seq=1211 Ack=1 Win=853 Len=121 TSval=361516 TSecr=118922125
 18 0.175188401 172.31.31.144 -> 172.31.24.227 TCP 187 6633 → 39480 [PSH, ACK] Seq=1332 Ack=1 Win=853 Len=121 TSval=361516 TSecr=118922125
 19 0.175279119 172.31.31.144 -> 172.31.24.227 TCP 187 6633 → 39456 [PSH, ACK] Seq=1 Ack=1 Win=853 Len=121 TSval=361516 TSecr=118921403
 20 0.175325911 172.31.31.144 -> 172.31.24.227 TCP 187 6633 → 39456 [PSH, ACK] Seq=122 Ack=1 Win=853 Len=121 TSval=361516 TSecr=118921403
 21 0.175379053 172.31.31.144 -> 172.31.24.227 TCP 187 6633 → 39456 [PSH, ACK] Seq=243 Ack=1 Win=853 Len=121 TSval=361516 TSecr=118921403
 22 0.175458392 172.31.31.144 -> 172.31.24.227 TCP 187 6633 → 39456 [PSH, ACK] Seq=364 Ack=1 Win=853 Len=121 TSval=361516 TSecr=118921403
 23 0.175517859 172.31.31.144 -> 172.31.24.227 TCP 187 6633 → 39456 [PSH, ACK] Seq=485 Ack=1 Win=853 Len=121 TSval=361516 TSecr=118921403
 24 0.175524867 172.31.24.227 -> 172.31.31.144 TCP 66 39456 → 6633 [ACK] Seq=1 Ack=606 Win=61 Len=0 TSval=118922126 TSecr=361516
 25 0.175570314 172.31.31.144 -> 172.31.24.227 TCP 187 6633 → 39456 [PSH, ACK] Seq=606 Ack=1 Win=853 Len=121 TSval=361516 TSecr=118921403
 26 0.175637399 172.31.31.144 -> 172.31.24.227 TCP 187 6633 → 39456 [PSH, ACK] Seq=727 Ack=1 Win=853 Len=121 TSval=361516 TSecr=118921403
 27 0.175677682 172.31.31.144 -> 172.31.24.227 TCP 187 6633 → 39456 [PSH, ACK] Seq=848 Ack=1 Win=853 Len=121 TSval=361516 TSecr=118921403
 28 0.175721727 172.31.24.227 -> 172.31.31.144 TCP 66 39480 → 6633 [ACK] Seq=1 Ack=1453 Win=70 Len=0 TSval=118922126 TSecr=361516
 29 0.175738012 172.31.31.144 -> 172.31.24.227 TCP 187 6633 → 39456 [PSH, ACK] Seq=969 Ack=1 Win=853 Len=121 TSval=361516 TSecr=118921403
 30 0.175812891 172.31.24.227 -> 172.31.31.144 OpenFlow 189 Type: OFPT_PACKET_IN
 31 0.175827575 172.31.31.144 -> 172.31.24.227 TCP 187 6633 → 39456 [PSH, ACK] Seq=1090 Ack=1 Win=853 Len=121 TSval=361516 TSecr=118922126
 32 0.175831607 172.31.24.227 -> 172.31.31.144 TCP 66 39456 → 6633 [ACK] Seq=1 Ack=1211 Win=61 Len=0 TSval=118922126 TSecr=361516
 33 0.175841194 172.31.24.227 -> 172.31.31.144 OpenFlow 189 Type: OFPT_PACKET_IN
 34 0.175878150 172.31.24.227 -> 172.31.31.144 OpenFlow 312 Type: OFPT_PACKET_IN
 35 0.175887185 172.31.24.227 -> 172.31.31.144 OpenFlow 189 Type: OFPT_PACKET_IN
 36 0.175899286 172.31.31.144 -> 172.31.24.227 TCP 187 6633 → 39456 [PSH, ACK] Seq=1211 Ack=1 Win=853 Len=121 TSval=361516 TSecr=118922126
 37 0.175926803 172.31.24.227 -> 172.31.31.144 OpenFlow 189 Type: OFPT_PACKET_IN
 38 0.175951050 172.31.31.144 -> 172.31.24.227 TCP 187 6633 → 39456 [PSH, ACK] Seq=1332 Ack=1 Win=853 Len=121 TSval=361516 TSecr=118922126
 39 0.176083854 172.31.31.144 -> 172.31.24.227 TCP 66 6633 → 39484 [ACK] Seq=1 Ack=493 Win=853 Len=0 TSval=361516 TSecr=118922126
 40 0.176091522 172.31.31.144 -> 172.31.24.227 TCP 187 6633 → 39486 [PSH, ACK] Seq=1 Ack=1 Win=853 Len=121 TSval=361516 TSecr=118921402
 41 0.176141211 172.31.31.144 -> 172.31.24.227 TCP 187 6633 → 39486 [PSH, ACK] Seq=122 Ack=1 Win=853 Len=121 TSval=361516 TSecr=118921402
 42 0.176146293 172.31.31.144 -> 172.31.24.227 TCP 187 6633 → 39486 [PSH, ACK] Seq=243 Ack=1 Win=853 Len=121 TSval=361516 TSecr=118921402
 43 0.176188604 172.31.31.144 -> 172.31.24.227 TCP 66 6633 → 39492 [ACK] Seq=1 Ack=247 Win=853 Len=0 TSval=361516 TSecr=118922126
 44 0.176193979 172.31.31.144 -> 172.31.24.227 TCP 187 6633 → 39486 [PSH, ACK] Seq=364 Ack=1 Win=853 Len=121 TSval=361516 TSecr=118921402
 45 0.176231380 172.31.31.144 -> 172.31.24.227 TCP 187 6633 → 39486 [PSH, ACK] Seq=485 Ack=1 Win=853 Len=121 TSval=361516 TSecr=118921402
 46 0.176281621 172.31.31.144 -> 172.31.24.227 TCP 187 6633 → 39486 [PSH, ACK] Seq=606 Ack=1 Win=853 Len=121 TSval=361516 TSecr=118921402
 47 0.176288640 172.31.24.227 -> 172.31.31.144 TCP 66 39486 → 6633 [ACK] Seq=1 Ack=727 Win=78 Len=0 TSval=118922126 TSecr=361516
 48 0.176352813 172.31.31.144 -> 172.31.24.227 TCP 187 6633 → 39486 [PSH, ACK] Seq=727 Ack=1 Win=853 Len=121 TSval=361516 TSecr=118921402
 49 0.176405473 172.31.31.144 -> 172.31.24.227 TCP 187 6633 → 39486 [PSH, ACK] Seq=848 Ack=1 Win=853 Len=121 TSval=361516 TSecr=118921402
 50 0.176493458 172.31.31.144 -> 172.31.24.227 TCP 187 6633 → 39468 [PSH, ACK] Seq=1 Ack=1 Win=853 Len=121 TSval=361516 TSecr=118921404
 51 0.176532720 172.31.31.144 -> 172.31.24.227 TCP 187 6633 → 39468 [PSH, ACK] Seq=122 Ack=1 Win=853 Len=121 TSval=361516 TSecr=118921404
 52 0.176594837 172.31.31.144 -> 172.31.24.227 TCP 187 6633 → 39468 [PSH, ACK] Seq=243 Ack=1 Win=853 Len=121 TSval=361516 TSecr=118921404
 53 0.176614213 172.31.24.227 -> 172.31.31.144 TCP 66 39456 → 6633 [ACK] Seq=1 Ack=1453 Win=61 Len=0 TSval=118922126 TSecr=361516
 54 0.176679529 172.31.24.227 -> 172.31.31.144 OpenFlow 189 Type: OFPT_PACKET_IN
 55 0.176700987 172.31.24.227 -> 172.31.31.144 OpenFlow 189 Type: OFPT_PACKET_IN
 56 0.176719579 172.31.24.227 -> 172.31.31.144 OpenFlow 189 Type: OFPT_PACKET_IN
 57 0.176756115 172.31.24.227 -> 172.31.31.144 OpenFlow 681 Type: OFPT_PACKET_IN
 58 0.176852953 172.31.24.227 -> 172.31.31.144 TCP 66 39468 → 6633 [ACK] Seq=1 Ack=364 Win=80 Len=0 TSval=118922126 TSecr=361516
 59 0.176871892 172.31.31.144 -> 172.31.24.227 TCP 66 6633 → 39458 [ACK] Seq=1 Ack=124 Win=853 Len=0 TSval=361516 TSecr=118922126
 60 0.176895408 172.31.31.144 -> 172.31.24.227 TCP 66 6633 → 39458 [ACK] Seq=1 Ack=247 Win=853 Len=0 TSval=361516 TSecr=118922126
 61 0.176939534 172.31.24.227 -> 172.31.31.144 OpenFlow 189 Type: OFPT_PACKET_IN
 62 0.176959821 172.31.24.227 -> 172.31.31.144 OpenFlow 189 Type: OFPT_PACKET_IN
 63 0.177119665 172.31.31.144 -> 172.31.24.227 TCP 66 6633 → 39470 [ACK] Seq=1 Ack=124 Win=853 Len=0 TSval=361516 TSecr=118922126
 64 0.177138256 172.31.31.144 -> 172.31.24.227 TCP 66 6633 → 39470 [ACK] Seq=1 Ack=247 Win=853 Len=0 TSval=361516 TSecr=118922126
 65 0.177225481 172.31.24.227 -> 172.31.31.144 TCP 66 39486 → 6633 [ACK] Seq=1 Ack=969 Win=78 Len=0 TSval=118922126 TSecr=361516
 66 0.177363679 172.31.24.227 -> 172.31.31.144 OpenFlow 189 Type: OFPT_PACKET_IN
 67 0.177384707 172.31.24.227 -> 172.31.31.144 OpenFlow 681 Type: OFPT_PACKET_IN
 68 0.177402526 172.31.24.227 -> 172.31.31.144 OpenFlow 189 Type: OFPT_PACKET_IN
 69 0.177422615 172.31.24.227 -> 172.31.31.144 OpenFlow 189 Type: OFPT_PACKET_IN
 70 0.177453058 172.31.24.227 -> 172.31.31.144 OpenFlow 189 Type: OFPT_PACKET_IN
 71 0.177461497 172.31.24.227 -> 172.31.31.144 OpenFlow 189 Type: OFPT_PACKET_IN
 72 0.177472620 172.31.24.227 -> 172.31.31.144 OpenFlow 189 Type: OFPT_PACKET_IN
 73 0.177498484 172.31.24.227 -> 172.31.31.144 OpenFlow 189 Type: OFPT_PACKET_IN
 74 0.177518518 172.31.24.227 -> 172.31.31.144 OpenFlow 189 Type: OFPT_PACKET_IN
 75 0.177566286 172.31.31.144 -> 172.31.24.227 TCP 66 6633 → 39446 [ACK] Seq=1 Ack=124 Win=853 Len=0 TSval=361516 TSecr=118922126
 76 0.177572099 172.31.31.144 -> 172.31.24.227 TCP 66 6633 → 39446 [ACK] Seq=1 Ack=739 Win=853 Len=0 TSval=361516 TSecr=118922126
 77 0.177577090 172.31.24.227 -> 172.31.31.144 OpenFlow 189 Type: OFPT_PACKET_IN
 78 0.177582382 172.31.24.227 -> 172.31.31.144 OpenFlow 435 Type: OFPT_PACKET_IN
 79 0.177711742 172.31.31.144 -> 172.31.24.227 TCP 66 6633 → 39472 [ACK] Seq=1 Ack=124 Win=853 Len=0 TSval=361516 TSecr=118922126
 80 0.177797038 172.31.31.144 -> 172.31.24.227 TCP 66 6633 → 39472 [ACK] Seq=1 Ack=247 Win=853 Len=0 TSval=361516 TSecr=118922126
 81 0.177847241 172.31.31.144 -> 172.31.24.227 TCP 66 6633 → 39478 [ACK] Seq=1 Ack=493 Win=853 Len=0 TSval=361516 TSecr=118922126
 82 0.177898878 172.31.31.144 -> 172.31.24.227 TCP 66 6633 → 39448 [ACK] Seq=1 Ack=247 Win=853 Len=0 TSval=361516 TSecr=118922126
 83 0.177901943 172.31.31.144 -> 172.31.24.227 TCP 66 6633 → 39450 [ACK] Seq=1 Ack=247 Win=853 Len=0 TSval=361516 TSecr=118922126
 84 0.177979866 172.31.31.144 -> 172.31.24.227 TCP 66 6633 → 39464 [ACK] Seq=1 Ack=862 Win=853 Len=0 TSval=361516 TSecr=118922126
 85 0.178115993 172.31.31.144 -> 172.31.24.227 TCP 187 6633 → 39468 [PSH, ACK] Seq=364 Ack=1 Win=853 Len=121 TSval=361516 TSecr=118922126
 86 0.178400871 172.31.31.144 -> 172.31.24.227 TCP 187 6633 → 39468 [PSH, ACK] Seq=485 Ack=1 Win=853 Len=121 TSval=361516 TSecr=118922126
 87 0.178423661 172.31.24.227 -> 172.31.31.144 OpenFlow 189 Type: OFPT_PACKET_IN
 88 0.178447039 172.31.24.227 -> 172.31.31.144 TCP 66 39468 → 6633 [ACK] Seq=1 Ack=606 Win=80 Len=0 TSval=118922126 TSecr=361516
 89 0.178718249 172.31.31.144 -> 172.31.24.227 TCP 187 6633 → 39468 [PSH, ACK] Seq=606 Ack=1 Win=853 Len=121 TSval=361517 TSecr=118922126
 90 0.178787175 172.31.31.144 -> 172.31.24.227 TCP 187 6633 → 39468 [PSH, ACK] Seq=727 Ack=1 Win=853 Len=121 TSval=361517 TSecr=118922126
 91 0.178835919 172.31.24.227 -> 172.31.31.144 TCP 66 39468 → 6633 [ACK] Seq=1 Ack=848 Win=80 Len=0 TSval=118922126 TSecr=361517
 92 0.178845564 172.31.31.144 -> 172.31.24.227 TCP 187 6633 → 39468 [PSH, ACK] Seq=848 Ack=1 Win=853 Len=121 TSval=361517 TSecr=118922126
 93 0.178992139 172.31.31.144 -> 172.31.24.227 TCP 187 6633 → 39468 [PSH, ACK] Seq=969 Ack=1 Win=853 Len=121 TSval=361517 TSecr=118922126
 94 0.179099019 172.31.31.144 -> 172.31.24.227 TCP 187 6633 → 39468 [PSH, ACK] Seq=1090 Ack=1 Win=853 Len=121 TSval=361517 TSecr=118922126
 95 0.179131514 172.31.24.227 -> 172.31.31.144 OpenFlow 189 Type: OFPT_PACKET_IN
 96 0.179152515 172.31.24.227 -> 172.31.31.144 OpenFlow 189 Type: OFPT_PACKET_IN
 97 0.179181222 172.31.31.144 -> 172.31.24.227 TCP 187 6633 → 39468 [PSH, ACK] Seq=1211 Ack=1 Win=853 Len=121 TSval=361517 TSecr=118922126
 98 0.179272757 172.31.24.227 -> 172.31.31.144 TCP 66 39468 → 6633 [ACK] Seq=1 Ack=1332 Win=80 Len=0 TSval=118922127 TSecr=361517
 99 0.179288997 172.31.31.144 -> 172.31.24.227 TCP 187 6633 → 39468 [PSH, ACK] Seq=1332 Ack=1 Win=853 Len=121 TSval=361517 TSecr=118922126
100 0.179314877 172.31.31.144 -> 172.31.24.227 TCP 66 6633 → 39462 [ACK] Seq=1 Ack=124 Win=853 Len=0 TSval=361517 TSecr=118922127
101 0.179342099 172.31.31.144 -> 172.31.24.227 TCP 66 6633 → 39462 [ACK] Seq=1 Ack=247 Win=853 Len=0 TSval=361517 TSecr=118922127
102 0.179352356 172.31.31.144 -> 172.31.24.227 TCP 187 6633 → 39468 [PSH, ACK] Seq=1453 Ack=1 Win=853 Len=121 TSval=361517 TSecr=118922126
103 0.179402259 172.31.24.227 -> 172.31.31.144 TCP 66 39468 → 6633 [ACK] Seq=1 Ack=1574 Win=80 Len=0 TSval=118922127 TSecr=361517
104 0.179452395 172.31.31.144 -> 172.31.24.227 TCP 187 6633 → 39468 [PSH, ACK] Seq=1574 Ack=1 Win=853 Len=121 TSval=361517 TSecr=118922126
105 0.179512661 172.31.31.144 -> 172.31.24.227 TCP 187 6633 → 39466 [PSH, ACK] Seq=1 Ack=1 Win=853 Len=121 TSval=361517 TSecr=118921402
106 0.179575884 172.31.24.227 -> 172.31.31.144 OpenFlow 189 Type: OFPT_PACKET_IN
107 0.179597096 172.31.31.144 -> 172.31.24.227 TCP 187 6633 → 39466 [PSH, ACK] Seq=122 Ack=1 Win=853 Len=121 TSval=361517 TSecr=118921402
108 0.179603593 172.31.24.227 -> 172.31.31.144 OpenFlow 189 Type: OFPT_PACKET_IN
109 0.179659035 172.31.31.144 -> 172.31.24.227 TCP 187 6633 → 39466 [PSH, ACK] Seq=243 Ack=1 Win=853 Len=121 TSval=361517 TSecr=118921402
110 0.179713545 172.31.31.144 -> 172.31.24.227 TCP 187 6633 → 39466 [PSH, ACK] Seq=364 Ack=1 Win=853 Len=121 TSval=361517 TSecr=118921402
111 0.179731880 172.31.24.227 -> 172.31.31.144 OpenFlow 189 Type: OFPT_PACKET_IN
112 0.179751732 172.31.24.227 -> 172.31.31.144 OpenFlow 435 Type: OFPT_PACKET_IN
113 0.179777999 172.31.31.144 -> 172.31.24.227 TCP 187 6633 → 39466 [PSH, ACK] Seq=485 Ack=1 Win=853 Len=121 TSval=361517 TSecr=118921402
114 0.179802750 172.31.31.144 -> 172.31.24.227 TCP 66 6633 → 39492 [ACK] Seq=1 Ack=493 Win=853 Len=0 TSval=361517 TSecr=118922127
115 0.179839350 172.31.31.144 -> 172.31.24.227 TCP 187 6633 → 39466 [PSH, ACK] Seq=606 Ack=1 Win=853 Len=121 TSval=361517 TSecr=118921402
116 0.179908916 172.31.31.144 -> 172.31.24.227 TCP 187 6633 → 39466 [PSH, ACK] Seq=727 Ack=1 Win=853 Len=121 TSval=361517 TSecr=118921402
117 0.179914481 172.31.31.144 -> 172.31.24.227 TCP 66 6633 → 39462 [ACK] Seq=1 Ack=370 Win=853 Len=0 TSval=361517 TSecr=118922127
118 0.179948745 172.31.31.144 -> 172.31.24.227 TCP 66 6633 → 39462 [ACK] Seq=1 Ack=739 Win=853 Len=0 TSval=361517 TSecr=118922127
119 0.179952913 172.31.31.144 -> 172.31.24.227 TCP 187 6633 → 39466 [PSH, ACK] Seq=848 Ack=1 Win=853 Len=121 TSval=361517 TSecr=118921402
120 0.180005911 172.31.31.144 -> 172.31.24.227 TCP 187 6633 → 39466 [PSH, ACK] Seq=969 Ack=1 Win=853 Len=121 TSval=361517 TSecr=118921402
121 0.180063326 172.31.31.144 -> 172.31.24.227 TCP 187 6633 → 39466 [PSH, ACK] Seq=1090 Ack=1 Win=853 Len=121 TSval=361517 TSecr=118921402
122 0.180199104 172.31.24.227 -> 172.31.31.144 TCP 66 39466 → 6633 [ACK] Seq=1 Ack=1211 Win=352 Len=0 TSval=118922127 TSecr=361517
123 0.180269869 172.31.24.227 -> 172.31.31.144 OpenFlow 189 Type: OFPT_PACKET_IN
124 0.180300162 172.31.24.227 -> 172.31.31.144 OpenFlow 435 Type: OFPT_PACKET_IN
125 0.180325112 172.31.24.227 -> 172.31.31.144 OpenFlow 189 Type: OFPT_PACKET_IN
126 0.180341999 172.31.24.227 -> 172.31.31.144 OpenFlow 189 Type: OFPT_PACKET_IN
127 0.180380428 172.31.24.227 -> 172.31.31.144 OpenFlow 189 Type: OFPT_PACKET_IN
128 0.180397751 172.31.24.227 -> 172.31.31.144 OpenFlow 189 Type: OFPT_PACKET_IN
129 0.180444237 172.31.31.144 -> 172.31.24.227 TCP 550 6633 → 39466 [PSH, ACK] Seq=1211 Ack=1 Win=853 Len=484 TSval=361517 TSecr=118922127
130 0.180467722 172.31.31.144 -> 172.31.24.227 TCP 66 6633 → 39470 [ACK] Seq=1 Ack=370 Win=853 Len=0 TSval=361517 TSecr=118922127
131 0.180471451 172.31.31.144 -> 172.31.24.227 TCP 187 6633 → 39466 [PSH, ACK] Seq=1695 Ack=1 Win=853 Len=121 TSval=361517 TSecr=118922127
132 0.180488757 172.31.31.144 -> 172.31.24.227 TCP 66 6633 → 39470 [ACK] Seq=1 Ack=739 Win=853 Len=0 TSval=361517 TSecr=118922127
133 0.180491741 172.31.31.144 -> 172.31.24.227 TCP 187 6633 → 39466 [PSH, ACK] Seq=1816 Ack=1 Win=853 Len=121 TSval=361517 TSecr=118922127
134 0.180510827 172.31.24.227 -> 172.31.31.144 OpenFlow 189 Type: OFPT_PACKET_IN
135 0.180529894 172.31.24.227 -> 172.31.31.144 OpenFlow 189 Type: OFPT_PACKET_IN
136 0.180557995 172.31.31.144 -> 172.31.24.227 TCP 187 6633 → 39466 [PSH, ACK] Seq=1937 Ack=1 Win=853 Len=121 TSval=361517 TSecr=118922127
137 0.180560927 172.31.31.144 -> 172.31.24.227 TCP 66 6633 → 39476 [ACK] Seq=1 Ack=247 Win=853 Len=0 TSval=361517 TSecr=118922127
138 0.180611780 172.31.31.144 -> 172.31.24.227 TCP 187 6633 → 39466 [PSH, ACK] Seq=2058 Ack=1 Win=853 Len=121 TSval=361517 TSecr=118922127
139 0.180616071 172.31.31.144 -> 172.31.24.227 TCP 66 6633 → 39492 [ACK] Seq=1 Ack=739 Win=853 Len=0 TSval=361517 TSecr=118922127
140 0.180691529 172.31.31.144 -> 172.31.24.227 TCP 187 6633 → 39490 [PSH, ACK] Seq=1 Ack=1 Win=853 Len=121 TSval=361517 TSecr=118921403
141 0.180725272 172.31.31.144 -> 172.31.24.227 TCP 66 6633 → 39450 [ACK] Seq=1 Ack=493 Win=853 Len=0 TSval=361517 TSecr=118922127
142 0.180889798 172.31.24.227 -> 172.31.31.144 TCP 66 39466 → 6633 [ACK] Seq=1 Ack=2179 Win=358 Len=0 TSval=118922127 TSecr=361517
143 0.181025220 172.31.31.144 -> 172.31.24.227 TCP 187 6633 → 39490 [PSH, ACK] Seq=122 Ack=1 Win=853 Len=121 TSval=361517 TSecr=118921403
144 0.181059408 172.31.24.227 -> 172.31.31.144 TCP 66 39490 → 6633 [ACK] Seq=1 Ack=243 Win=57 Len=0 TSval=118922127 TSecr=361517
145 0.181117194 172.31.31.144 -> 172.31.24.227 TCP 187 6633 → 39490 [PSH, ACK] Seq=243 Ack=1 Win=853 Len=121 TSval=361517 TSecr=118921403
146 0.181193542 172.31.24.227 -> 172.31.31.144 OpenFlow 189 Type: OFPT_PACKET_IN
147 0.181221434 172.31.31.144 -> 172.31.24.227 TCP 187 6633 → 39490 [PSH, ACK] Seq=364 Ack=1 Win=853 Len=121 TSval=361517 TSecr=118921403
148 0.181228035 172.31.24.227 -> 172.31.31.144 OpenFlow 189 Type: OFPT_PACKET_IN
149 0.181235687 172.31.24.227 -> 172.31.31.144 OpenFlow 189 Type: OFPT_PACKET_IN
150 0.181260043 172.31.24.227 -> 172.31.31.144 OpenFlow 189 Type: OFPT_PACKET_IN
151 0.181267773 172.31.24.227 -> 172.31.31.144 OpenFlow 189 Type: OFPT_PACKET_IN
152 0.181312783 172.31.24.227 -> 172.31.31.144 OpenFlow 681 Type: OFPT_PACKET_IN
153 0.181336854 172.31.31.144 -> 172.31.24.227 TCP 187 6633 → 39490 [PSH, ACK] Seq=485 Ack=1 Win=853 Len=121 TSval=361517 TSecr=118922127
154 0.181361977 172.31.31.144 -> 172.31.24.227 TCP 187 6633 → 39490 [PSH, ACK] Seq=606 Ack=1 Win=853 Len=121 TSval=361517 TSecr=118922127
155 0.181395280 172.31.31.144 -> 172.31.24.227 TCP 66 6633 → 39446 [ACK] Seq=1 Ack=862 Win=853 Len=0 TSval=361517 TSecr=118922127
156 0.181437069 172.31.31.144 -> 172.31.24.227 TCP 66 6633 → 39446 [ACK] Seq=1 Ack=985 Win=853 Len=0 TSval=361517 TSecr=118922127
157 0.181455442 172.31.31.144 -> 172.31.24.227 TCP 66 6633 → 39458 [ACK] Seq=1 Ack=370 Win=853 Len=0 TSval=361517 TSecr=118922127
158 0.181458465 172.31.31.144 -> 172.31.24.227 TCP 187 6633 → 39490 [PSH, ACK] Seq=727 Ack=1 Win=853 Len=121 TSval=361517 TSecr=118922127
159 0.181462187 172.31.24.227 -> 172.31.31.144 TCP 66 39490 → 6633 [ACK] Seq=1 Ack=848 Win=57 Len=0 TSval=118922127 TSecr=361517
160 0.181510137 172.31.31.144 -> 172.31.24.227 TCP 66 6633 → 39458 [ACK] Seq=1 Ack=985 Win=853 Len=0 TSval=361517 TSecr=118922127
161 0.181515034 172.31.31.144 -> 172.31.24.227 TCP 187 6633 → 39490 [PSH, ACK] Seq=848 Ack=1 Win=853 Len=121 TSval=361517 TSecr=118922127
162 0.181557590 172.31.31.144 -> 172.31.24.227 TCP 187 6633 → 39490 [PSH, ACK] Seq=969 Ack=1 Win=853 Len=121 TSval=361517 TSecr=118922127
163 0.181654037 172.31.31.144 -> 172.31.24.227 TCP 66 6633 → 39450 [ACK] Seq=1 Ack=739 Win=853 Len=0 TSval=361517 TSecr=118922127
164 0.181697618 172.31.24.227 -> 172.31.31.144 TCP 66 39490 → 6633 [ACK] Seq=1 Ack=1090 Win=57 Len=0 TSval=118922127 TSecr=361517
165 0.181721260 172.31.31.144 -> 172.31.24.227 TCP 187 6633 → 39490 [PSH, ACK] Seq=1090 Ack=1 Win=853 Len=121 TSval=361517 TSecr=118922127
166 0.181880303 172.31.24.227 -> 172.31.31.144 OpenFlow 189 Type: OFPT_PACKET_IN
167 0.181901813 172.31.24.227 -> 172.31.31.144 OpenFlow 681 Type: OFPT_PACKET_IN
168 0.181925623 172.31.24.227 -> 172.31.31.144 OpenFlow 189 Type: OFPT_PACKET_IN
169 0.181948112 172.31.24.227 -> 172.31.31.144 OpenFlow 189 Type: OFPT_PACKET_IN
170 0.182083068 172.31.31.144 -> 172.31.24.227 TCP 66 6633 → 39452 [ACK] Seq=1 Ack=124 Win=853 Len=0 TSval=361517 TSecr=118922127
171 0.182113942 172.31.31.144 -> 172.31.24.227 TCP 66 6633 → 39452 [ACK] Seq=1 Ack=739 Win=853 Len=0 TSval=361517 TSecr=118922127
172 0.182116631 172.31.31.144 -> 172.31.24.227 TCP 66 6633 → 39458 [ACK] Seq=1 Ack=1108 Win=853 Len=0 TSval=361517 TSecr=118922127
173 0.182142433 172.31.31.144 -> 172.31.24.227 TCP 66 6633 → 39458 [ACK] Seq=1 Ack=1231 Win=853 Len=0 TSval=361517 TSecr=118922127
174 0.218642785 172.31.31.144 -> 172.31.24.227 TCP 66 6633 → 39464 [ACK] Seq=1 Ack=985 Win=853 Len=0 TSval=361527 TSecr=118922126
175 0.218944680 172.31.24.227 -> 172.31.31.144 TCP 66 39490 → 6633 [ACK] Seq=1 Ack=1211 Win=57 Len=0 TSval=118922137 TSecr=361517
176 0.218950332 172.31.24.227 -> 172.31.31.144 TCP 66 39468 → 6633 [ACK] Seq=1 Ack=1695 Win=80 Len=0 TSval=118922137 TSecr=361517
177 0.274070394 172.31.31.144 -> 172.31.24.227 OpenFlow 187 Type: OFPT_PACKET_OUT
178 0.274090011 172.31.31.144 -> 172.31.24.227 OpenFlow 187 Type: OFPT_PACKET_OUT
179 0.274154701 172.31.31.144 -> 172.31.24.227 OpenFlow 187 Type: OFPT_PACKET_OUT
180 0.274241824 172.31.31.144 -> 172.31.24.227 OpenFlow 187 Type: OFPT_PACKET_OUT
181 0.274323958 172.31.31.144 -> 172.31.24.227 OpenFlow 187 Type: OFPT_PACKET_OUT
182 0.274332074 172.31.24.227 -> 172.31.31.144 TCP 66 39472 → 6633 [ACK] Seq=247 Ack=606 Win=63 Len=0 TSval=118922150 TSecr=361540
183 0.274399697 172.31.31.144 -> 172.31.24.227 OpenFlow 187 Type: OFPT_PACKET_OUT
184 0.274488505 172.31.31.144 -> 172.31.24.227 OpenFlow 187 Type: OFPT_PACKET_OUT
185 0.274572590 172.31.31.144 -> 172.31.24.227 OpenFlow 187 Type: OFPT_PACKET_OUT
186 0.274701962 172.31.24.227 -> 172.31.31.144 TCP 66 39472 → 6633 [ACK] Seq=247 Ack=969 Win=63 Len=0 TSval=118922150 TSecr=361540
187 0.274740024 172.31.31.144 -> 172.31.24.227 OpenFlow 187 Type: OFPT_PACKET_OUT
188 0.274766265 172.31.31.144 -> 172.31.24.227 OpenFlow 187 Type: OFPT_PACKET_OUT
189 0.274799395 172.31.24.227 -> 172.31.31.144 OpenFlow 189 Type: OFPT_PACKET_IN
190 0.274808855 172.31.31.144 -> 172.31.24.227 OpenFlow 187 Type: OFPT_PACKET_OUT
191 0.274821366 172.31.24.227 -> 172.31.31.144 OpenFlow 189 Type: OFPT_PACKET_IN
192 0.274845430 172.31.31.144 -> 172.31.24.227 OpenFlow 187 Type: OFPT_PACKET_OUT
193 0.274867396 172.31.24.227 -> 172.31.31.144 OpenFlow 189 Type: OFPT_PACKET_IN
194 0.274887068 172.31.24.227 -> 172.31.31.144 OpenFlow 189 Type: OFPT_PACKET_IN
195 0.274902912 172.31.24.227 -> 172.31.31.144 OpenFlow 189 Type: OFPT_PACKET_IN
196 0.274911616 172.31.31.144 -> 172.31.24.227 OpenFlow 187 Type: OFPT_PACKET_OUT
197 0.274915109 172.31.24.227 -> 172.31.31.144 TCP 66 39492 → 6633 [ACK] Seq=739 Ack=606 Win=70 Len=0 TSval=118922150 TSecr=361541
198 0.274963481 172.31.31.144 -> 172.31.24.227 OpenFlow 187 Type: OFPT_PACKET_OUT
199 0.274970290 172.31.24.227 -> 172.31.31.144 OpenFlow 189 Type: OFPT_PACKET_IN
200 0.275010469 172.31.31.144 -> 172.31.24.227 OpenFlow 187 Type: OFPT_PACKET_OUT
201 0.275069745 172.31.31.144 -> 172.31.24.227 OpenFlow 187 Type: OFPT_PACKET_OUT
202 0.275118645 172.31.31.144 -> 172.31.24.227 TCP 66 6633 → 39474 [ACK] Seq=1 Ack=247 Win=853 Len=0 TSval=361541 TSecr=118922150
203 0.275125823 172.31.31.144 -> 172.31.24.227 OpenFlow 187 Type: OFPT_PACKET_OUT
204 0.275128094 172.31.31.144 -> 172.31.24.227 TCP 66 6633 → 39486 [ACK] Seq=969 Ack=124 Win=853 Len=0 TSval=361541 TSecr=118922150
205 0.275155210 172.31.31.144 -> 172.31.24.227 TCP 66 6633 → 39482 [ACK] Seq=1 Ack=247 Win=853 Len=0 TSval=361541 TSecr=118922150
206 0.275159607 172.31.31.144 -> 172.31.24.227 TCP 66 6633 → 39486 [ACK] Seq=969 Ack=247 Win=853 Len=0 TSval=361541 TSecr=118922151
207 0.275169371 172.31.31.144 -> 172.31.24.227 OpenFlow 187 Type: OFPT_PACKET_OUT
208 0.275174142 172.31.24.227 -> 172.31.31.144 TCP 66 39492 → 6633 [ACK] Seq=739 Ack=1211 Win=70 Len=0 TSval=118922151 TSecr=361541
209 0.275287238 172.31.31.144 -> 172.31.24.227 TCP 187 6633 → 39460 [PSH, ACK] Seq=1 Ack=1 Win=853 Len=121 TSval=361541 TSecr=118921402
210 0.275457601 172.31.31.144 -> 172.31.24.227 TCP 187 6633 → 39460 [PSH, ACK] Seq=122 Ack=1 Win=853 Len=121 TSval=361541 TSecr=118921402
211 0.275544434 172.31.31.144 -> 172.31.24.227 TCP 187 6633 → 39460 [PSH, ACK] Seq=243 Ack=1 Win=853 Len=121 TSval=361541 TSecr=118921402
212 0.275584775 172.31.24.227 -> 172.31.31.144 OpenFlow 189 Type: OFPT_PACKET_IN
213 0.275611666 172.31.31.144 -> 172.31.24.227 TCP 187 6633 → 39460 [PSH, ACK] Seq=364 Ack=1 Win=853 Len=121 TSval=361541 TSecr=118921402
214 0.275617979 172.31.24.227 -> 172.31.31.144 OpenFlow 189 Type: OFPT_PACKET_IN
215 0.275678518 172.31.31.144 -> 172.31.24.227 TCP 187 6633 → 39460 [PSH, ACK] Seq=485 Ack=1 Win=853 Len=121 TSval=361541 TSecr=118921402
216 0.275736284 172.31.31.144 -> 172.31.24.227 TCP 187 6633 → 39460 [PSH, ACK] Seq=606 Ack=1 Win=853 Len=121 TSval=361541 TSecr=118921402
217 0.275743808 172.31.24.227 -> 172.31.31.144 TCP 66 39460 → 6633 [ACK] Seq=1 Ack=727 Win=73 Len=0 TSval=118922151 TSecr=361541
218 0.275799505 172.31.31.144 -> 172.31.24.227 TCP 187 6633 → 39460 [PSH, ACK] Seq=727 Ack=1 Win=853 Len=121 TSval=361541 TSecr=118921402
219 0.275839749 172.31.31.144 -> 172.31.24.227 TCP 66 6633 → 39450 [ACK] Seq=1 Ack=985 Win=853 Len=0 TSval=361541 TSecr=118922151
220 0.275863183 172.31.31.144 -> 172.31.24.227 TCP 187 6633 → 39460 [PSH, ACK] Seq=848 Ack=1 Win=853 Len=121 TSval=361541 TSecr=118921402
221 0.275946614 172.31.24.227 -> 172.31.31.144 TCP 66 39460 → 6633 [ACK] Seq=1 Ack=969 Win=73 Len=0 TSval=118922151 TSecr=361541
222 0.276005006 172.31.31.144 -> 172.31.24.227 TCP 187 6633 → 39488 [PSH, ACK] Seq=1 Ack=1 Win=853 Len=121 TSval=361541 TSecr=118921403
223 0.276024545 172.31.24.227 -> 172.31.31.144 OpenFlow 189 Type: OFPT_PACKET_IN
224 0.276033290 172.31.31.144 -> 172.31.24.227 TCP 187 6633 → 39488 [PSH, ACK] Seq=122 Ack=1 Win=853 Len=121 TSval=361541 TSecr=118921403
225 0.276045799 172.31.24.227 -> 172.31.31.144 OpenFlow 189 Type: OFPT_PACKET_IN
226 0.276064800 172.31.24.227 -> 172.31.31.144 OpenFlow 189 Type: OFPT_PACKET_IN
227 0.276083393 172.31.24.227 -> 172.31.31.144 OpenFlow 189 Type: OFPT_PACKET_IN
228 0.276093101 172.31.31.144 -> 172.31.24.227 TCP 187 6633 → 39488 [PSH, ACK] Seq=243 Ack=1 Win=853 Len=121 TSval=361541 TSecr=118921403
229 0.276119273 172.31.24.227 -> 172.31.31.144 OpenFlow 189 Type: OFPT_PACKET_IN
230 0.276124014 172.31.24.227 -> 172.31.31.144 OpenFlow 189 Type: OFPT_PACKET_IN
231 0.276135313 172.31.24.227 -> 172.31.31.144 OpenFlow 189 Type: OFPT_PACKET_IN
232 0.276141749 172.31.31.144 -> 172.31.24.227 TCP 187 6633 → 39488 [PSH, ACK] Seq=364 Ack=1 Win=853 Len=121 TSval=361541 TSecr=118921403
233 0.276194862 172.31.24.227 -> 172.31.31.144 OpenFlow 189 Type: OFPT_PACKET_IN
234 0.276218473 172.31.31.144 -> 172.31.24.227 TCP 187 6633 → 39488 [PSH, ACK] Seq=485 Ack=1 Win=853 Len=121 TSval=361541 TSecr=118921403
235 0.276223918 172.31.24.227 -> 172.31.31.144 TCP 66 39488 → 6633 [ACK] Seq=1 Ack=606 Win=59 Len=0 TSval=118922151 TSecr=361541
236 0.276228234 172.31.31.144 -> 172.31.24.227 TCP 66 6633 → 39462 [ACK] Seq=1 Ack=862 Win=853 Len=0 TSval=361541 TSecr=118922151
237 0.276244883 172.31.31.144 -> 172.31.24.227 TCP 66 6633 → 39462 [ACK] Seq=1 Ack=985 Win=853 Len=0 TSval=361541 TSecr=118922151
238 0.276280324 172.31.31.144 -> 172.31.24.227 TCP 187 6633 → 39488 [PSH, ACK] Seq=606 Ack=1 Win=853 Len=121 TSval=361541 TSecr=118921403
239 0.276284667 172.31.31.144 -> 172.31.24.227 TCP 66 6633 → 39468 [ACK] Seq=1695 Ack=124 Win=853 Len=0 TSval=361541 TSecr=118922151
240 0.276342591 172.31.31.144 -> 172.31.24.227 TCP 187 6633 → 39488 [PSH, ACK] Seq=727 Ack=1 Win=853 Len=121 TSval=361541 TSecr=118921403
241 0.276365764 172.31.31.144 -> 172.31.24.227 TCP 66 6633 → 39480 [ACK] Seq=1453 Ack=124 Win=853 Len=0 TSval=361541 TSecr=118922151
242 0.276369431 172.31.31.144 -> 172.31.24.227 TCP 66 6633 → 39468 [ACK] Seq=1695 Ack=247 Win=853 Len=0 TSval=361541 TSecr=118922151
243 0.276372505 172.31.31.144 -> 172.31.24.227 TCP 66 6633 → 39466 [ACK] Seq=2179 Ack=247 Win=853 Len=0 TSval=361541 TSecr=118922151
244 0.276381283 172.31.31.144 -> 172.31.24.227 TCP 66 6633 → 39480 [ACK] Seq=1453 Ack=247 Win=853 Len=0 TSval=361541 TSecr=118922151
245 0.276464529 172.31.24.227 -> 172.31.31.144 TCP 66 39488 → 6633 [ACK] Seq=1 Ack=848 Win=59 Len=0 TSval=118922151 TSecr=361541
246 0.276544604 172.31.31.144 -> 172.31.24.227 TCP 187 6633 → 39488 [PSH, ACK] Seq=848 Ack=1 Win=853 Len=121 TSval=361541 TSecr=118922151
247 0.276612509 172.31.24.227 -> 172.31.31.144 OpenFlow 189 Type: OFPT_PACKET_IN
248 0.276650132 172.31.24.227 -> 172.31.31.144 OpenFlow 189 Type: OFPT_PACKET_IN
249 0.276667794 172.31.24.227 -> 172.31.31.144 OpenFlow 435 Type: OFPT_PACKET_IN
250 0.276685712 172.31.24.227 -> 172.31.31.144 OpenFlow 189 Type: OFPT_PACKET_IN
251 0.276698391 172.31.31.144 -> 172.31.24.227 OpenFlow 187 Type: OFPT_PACKET_OUT
252 0.276737145 172.31.24.227 -> 172.31.31.144 OpenFlow 435 Type: OFPT_PACKET_IN
253 0.276747958 172.31.24.227 -> 172.31.31.144 OpenFlow 189 Type: OFPT_PACKET_IN
254 0.276770567 172.31.31.144 -> 172.31.24.227 OpenFlow 187 Type: OFPT_PACKET_OUT
255 0.276796911 172.31.24.227 -> 172.31.31.144 OpenFlow 189 Type: OFPT_PACKET_IN
256 0.276819551 172.31.31.144 -> 172.31.24.227 TCP 66 6633 → 39446 [ACK] Seq=1 Ack=1108 Win=853 Len=0 TSval=361541 TSecr=118922151
257 0.276849814 172.31.31.144 -> 172.31.24.227 TCP 66 6633 → 39452 [ACK] Seq=1 Ack=862 Win=853 Len=0 TSval=361541 TSecr=118922151
258 0.276877885 172.31.31.144 -> 172.31.24.227 OpenFlow 187 Type: OFPT_PACKET_OUT
259 0.276881462 172.31.31.144 -> 172.31.24.227 TCP 66 6633 → 39452 [ACK] Seq=1 Ack=1231 Win=853 Len=0 TSval=361541 TSecr=118922151
260 0.276911990 172.31.31.144 -> 172.31.24.227 TCP 66 6633 → 39458 [ACK] Seq=1 Ack=1354 Win=853 Len=0 TSval=361541 TSecr=118922151
261 0.276917100 172.31.31.144 -> 172.31.24.227 OpenFlow 187 Type: OFPT_PACKET_OUT
262 0.276927445 172.31.31.144 -> 172.31.24.227 TCP 66 6633 → 39458 [ACK] Seq=1 Ack=1723 Win=853 Len=0 TSval=361541 TSecr=118922151
263 0.276972574 172.31.24.227 -> 172.31.31.144 TCP 66 39474 → 6633 [ACK] Seq=493 Ack=485 Win=192 Len=0 TSval=118922151 TSecr=361541
264 0.277059993 172.31.24.227 -> 172.31.31.144 OpenFlow 189 Type: OFPT_PACKET_IN
265 0.277080969 172.31.24.227 -> 172.31.31.144 OpenFlow 189 Type: OFPT_PACKET_IN
266 0.277212493 172.31.24.227 -> 172.31.31.144 OpenFlow 189 Type: OFPT_PACKET_IN
267 0.277255614 172.31.31.144 -> 172.31.24.227 TCP 66 6633 → 39488 [ACK] Seq=969 Ack=124 Win=853 Len=0 TSval=361541 TSecr=118922151
268 0.277275615 172.31.31.144 -> 172.31.24.227 TCP 66 6633 → 39488 [ACK] Seq=969 Ack=247 Win=853 Len=0 TSval=361541 TSecr=118922151
269 0.277302667 172.31.31.144 -> 172.31.24.227 OpenFlow 187 Type: OFPT_PACKET_OUT
270 0.277313522 172.31.24.227 -> 172.31.31.144 OpenFlow 189 Type: OFPT_PACKET_IN
271 0.277332934 172.31.31.144 -> 172.31.24.227 OpenFlow 308 Type: OFPT_PACKET_OUT
272 0.277337223 172.31.24.227 -> 172.31.31.144 OpenFlow 189 Type: OFPT_PACKET_IN
273 0.277402677 172.31.31.144 -> 172.31.24.227 TCP 66 6633 → 39446 [ACK] Seq=1 Ack=1231 Win=853 Len=0 TSval=361541 TSecr=118922151
274 0.277457114 172.31.24.227 -> 172.31.31.144 TCP 66 39474 → 6633 [ACK] Seq=493 Ack=848 Win=195 Len=0 TSval=118922151 TSecr=361541
275 0.277541488 172.31.31.144 -> 172.31.24.227 TCP 66 6633 → 39472 [ACK] Seq=969 Ack=493 Win=853 Len=0 TSval=361541 TSecr=118922151
276 0.277596814 172.31.31.144 -> 172.31.24.227 OpenFlow 187 Type: OFPT_PACKET_OUT
277 0.277640057 172.31.24.227 -> 172.31.31.144 OpenFlow 189 Type: OFPT_PACKET_IN
278 0.277653281 172.31.31.144 -> 172.31.24.227 OpenFlow 308 Type: OFPT_PACKET_OUT
279 0.277660225 172.31.24.227 -> 172.31.31.144 OpenFlow 189 Type: OFPT_PACKET_IN
280 0.277682070 172.31.24.227 -> 172.31.31.144 OpenFlow 189 Type: OFPT_PACKET_IN
281 0.277705527 172.31.31.144 -> 172.31.24.227 OpenFlow 187 Type: OFPT_PACKET_OUT
282 0.277774912 172.31.31.144 -> 172.31.24.227 OpenFlow 187 Type: OFPT_PACKET_OUT
283 0.277835708 172.31.31.144 -> 172.31.24.227 OpenFlow 187 Type: OFPT_PACKET_OUT
284 0.277840432 172.31.31.144 -> 172.31.24.227 TCP 66 6633 → 39446 [ACK] Seq=1 Ack=1354 Win=853 Len=0 TSval=361541 TSecr=118922151
285 0.277890469 172.31.31.144 -> 172.31.24.227 TCP 66 6633 → 39446 [ACK] Seq=1 Ack=1477 Win=853 Len=0 TSval=361541 TSecr=118922151
286 0.277895467 172.31.31.144 -> 172.31.24.227 OpenFlow 187 Type: OFPT_PACKET_OUT
287 0.277899404 172.31.24.227 -> 172.31.31.144 TCP 66 39474 → 6633 [ACK] Seq=493 Ack=1695 Win=198 Len=0 TSval=118922151 TSecr=361541
288 0.278111748 172.31.24.227 -> 172.31.31.144 OpenFlow 189 Type: OFPT_PACKET_IN
289 0.278135312 172.31.24.227 -> 172.31.31.144 OpenFlow 681 Type: OFPT_PACKET_IN
290 0.278186420 172.31.31.144 -> 172.31.24.227 TCP 66 6633 → 39446 [ACK] Seq=1 Ack=1600 Win=853 Len=0 TSval=361541 TSecr=118922151
291 0.278243925 172.31.24.227 -> 172.31.31.144 OpenFlow 189 Type: OFPT_PACKET_IN
292 0.278343270 172.31.31.144 -> 172.31.24.227 TCP 66 6633 → 39482 [ACK] Seq=1 Ack=985 Win=853 Len=0 TSval=361541 TSecr=118922151
293 0.278467878 172.31.31.144 -> 172.31.24.227 TCP 66 6633 → 39446 [ACK] Seq=1 Ack=1723 Win=853 Len=0 TSval=361541 TSecr=118922151
294 0.374332471 172.31.31.144 -> 172.31.24.227 OpenFlow 187 Type: OFPT_PACKET_OUT
295 0.374378775 172.31.31.144 -> 172.31.24.227 OpenFlow 187 Type: OFPT_PACKET_OUT
296 0.374385858 172.31.31.144 -> 172.31.24.227 OpenFlow 187 Type: OFPT_PACKET_OUT
297 0.374434618 172.31.31.144 -> 172.31.24.227 OpenFlow 187 Type: OFPT_PACKET_OUT
298 0.374493534 172.31.31.144 -> 172.31.24.227 OpenFlow 187 Type: OFPT_PACKET_OUT
299 0.374558284 172.31.31.144 -> 172.31.24.227 OpenFlow 187 Type: OFPT_PACKET_OUT
300 0.374648849 172.31.31.144 -> 172.31.24.227 OpenFlow 187 Type: OFPT_PACKET_OUT
301 0.374658797 172.31.24.227 -> 172.31.31.144 TCP 66 39470 → 6633 [ACK] Seq=739 Ack=848 Win=85 Len=0 TSval=118922175 TSecr=361565
302 0.374752303 172.31.31.144 -> 172.31.24.227 OpenFlow 187 Type: OFPT_PACKET_OUT
303 0.374766710 172.31.31.144 -> 172.31.24.227 OpenFlow 187 Type: OFPT_PACKET_OUT
304 0.374824303 172.31.31.144 -> 172.31.24.227 OpenFlow 187 Type: OFPT_PACKET_OUT
305 0.374963364 172.31.31.144 -> 172.31.24.227 OpenFlow 187 Type: OFPT_PACKET_OUT
306 0.374982545 172.31.31.144 -> 172.31.24.227 OpenFlow 187 Type: OFPT_PACKET_OUT
307 0.375042310 172.31.31.144 -> 172.31.24.227 OpenFlow 187 Type: OFPT_PACKET_OUT
308 0.375072840 172.31.31.144 -> 172.31.24.227 OpenFlow 187 Type: OFPT_PACKET_OUT
309 0.375154453 172.31.31.144 -> 172.31.24.227 OpenFlow 187 Type: OFPT_PACKET_OUT
310 0.375160585 172.31.24.227 -> 172.31.31.144 TCP 66 39458 → 6633 [ACK] Seq=1723 Ack=606 Win=78 Len=0 TSval=118922176 TSecr=361566
311 0.375173941 172.31.24.227 -> 172.31.31.144 TCP 66 39470 → 6633 [ACK] Seq=739 Ack=1211 Win=85 Len=0 TSval=118922176 TSecr=361566
312 0.375198252 172.31.31.144 -> 172.31.24.227 OpenFlow 187 Type: OFPT_PACKET_OUT
313 0.375253801 172.31.31.144 -> 172.31.24.227 OpenFlow 187 Type: OFPT_PACKET_OUT
314 0.375276744 172.31.24.227 -> 172.31.31.144 OpenFlow 189 Type: OFPT_PACKET_IN
315 0.375296603 172.31.24.227 -> 172.31.31.144 OpenFlow 189 Type: OFPT_PACKET_IN
316 0.375321942 172.31.31.144 -> 172.31.24.227 OpenFlow 187 Type: OFPT_PACKET_OUT
317 0.375393903 172.31.31.144 -> 172.31.24.227 OpenFlow 187 Type: OFPT_PACKET_OUT
318 0.375442943 172.31.31.144 -> 172.31.24.227 OpenFlow 187 Type: OFPT_PACKET_OUT
319 0.375447976 172.31.24.227 -> 172.31.31.144 TCP 66 39458 → 6633 [ACK] Seq=1723 Ack=1211 Win=78 Len=0 TSval=118922176 TSecr=361566
320 0.375490441 172.31.31.144 -> 172.31.24.227 OpenFlow 187 Type: OFPT_PACKET_OUT
321 0.375542609 172.31.31.144 -> 172.31.24.227 TCP 66 6633 → 39476 [ACK] Seq=1 Ack=493 Win=853 Len=0 TSval=361566 TSecr=118922176
322 0.375563315 172.31.31.144 -> 172.31.24.227 OpenFlow 187 Type: OFPT_PACKET_OUT
323 0.375621175 172.31.31.144 -> 172.31.24.227 OpenFlow 187 Type: OFPT_PACKET_OUT
324 0.375677672 172.31.31.144 -> 172.31.24.227 OpenFlow 187 Type: OFPT_PACKET_OUT
325 0.375748394 172.31.31.144 -> 172.31.24.227 OpenFlow 187 Type: OFPT_PACKET_OUT
326 0.375753940 172.31.24.227 -> 172.31.31.144 TCP 66 39458 → 6633 [ACK] Seq=1723 Ack=1816 Win=78 Len=0 TSval=118922176 TSecr=361566
327 0.375797308 172.31.31.144 -> 172.31.24.227 OpenFlow 187 Type: OFPT_PACKET_OUT
328 0.375849674 172.31.31.144 -> 172.31.24.227 OpenFlow 187 Type: OFPT_PACKET_OUT
329 0.375908711 172.31.31.144 -> 172.31.24.227 OpenFlow 187 Type: OFPT_PACKET_OUT
330 0.375967237 172.31.31.144 -> 172.31.24.227 OpenFlow 187 Type: OFPT_PACKET_OUT
331 0.376039537 172.31.31.144 -> 172.31.24.227 OpenFlow 187 Type: OFPT_PACKET_OUT
332 0.376045055 172.31.24.227 -> 172.31.31.144 TCP 66 39458 → 6633 [ACK] Seq=1723 Ack=2421 Win=78 Len=0 TSval=118922176 TSecr=361566
333 0.376160254 172.31.31.144 -> 172.31.24.227 TCP 187 6633 → 39454 [PSH, ACK] Seq=1 Ack=1 Win=853 Len=121 TSval=361566 TSecr=118921403
334 0.376190306 172.31.31.144 -> 172.31.24.227 TCP 187 6633 → 39454 [PSH, ACK] Seq=122 Ack=1 Win=853 Len=121 TSval=361566 TSecr=118921403
335 0.376219566 172.31.31.144 -> 172.31.24.227 TCP 187 6633 → 39454 [PSH, ACK] Seq=243 Ack=1 Win=853 Len=121 TSval=361566 TSecr=118921403
336 0.376272543 172.31.31.144 -> 172.31.24.227 TCP 187 6633 → 39454 [PSH, ACK] Seq=364 Ack=1 Win=853 Len=121 TSval=361566 TSecr=118921403
337 0.376330653 172.31.31.144 -> 172.31.24.227 TCP 187 6633 → 39454 [PSH, ACK] Seq=485 Ack=1 Win=853 Len=121 TSval=361566 TSecr=118921403
338 0.376338727 172.31.24.227 -> 172.31.31.144 TCP 66 39454 → 6633 [ACK] Seq=1 Ack=606 Win=55 Len=0 TSval=118922176 TSecr=361566
339 0.376395165 172.31.31.144 -> 172.31.24.227 TCP 187 6633 → 39454 [PSH, ACK] Seq=606 Ack=1 Win=853 Len=121 TSval=361566 TSecr=118921403
340 0.376453598 172.31.31.144 -> 172.31.24.227 TCP 187 6633 → 39454 [PSH, ACK] Seq=727 Ack=1 Win=853 Len=121 TSval=361566 TSecr=118921403
341 0.376509966 172.31.31.144 -> 172.31.24.227 TCP 187 6633 → 39454 [PSH, ACK] Seq=848 Ack=1 Win=853 Len=121 TSval=361566 TSecr=118921403
342 0.376555118 172.31.24.227 -> 172.31.31.144 OpenFlow 189 Type: OFPT_PACKET_IN
343 0.376574182 172.31.31.144 -> 172.31.24.227 TCP 187 6633 → 39454 [PSH, ACK] Seq=969 Ack=1 Win=853 Len=121 TSval=361566 TSecr=118922176
344 0.376579913 172.31.24.227 -> 172.31.31.144 OpenFlow 435 Type: OFPT_PACKET_IN
345 0.376608885 172.31.24.227 -> 172.31.31.144 OpenFlow 189 Type: OFPT_PACKET_IN
346 0.376636236 172.31.24.227 -> 172.31.31.144 OpenFlow 189 Type: OFPT_PACKET_IN
347 0.376640742 172.31.31.144 -> 172.31.24.227 TCP 187 6633 → 39454 [PSH, ACK] Seq=1090 Ack=1 Win=853 Len=121 TSval=361566 TSecr=118922176
348 0.376643653 172.31.24.227 -> 172.31.31.144 TCP 66 39454 → 6633 [ACK] Seq=1 Ack=1211 Win=55 Len=0 TSval=118922176 TSecr=361566
349 0.376649812 172.31.24.227 -> 172.31.31.144 OpenFlow 1173 Type: OFPT_PACKET_IN
350 0.376705282 172.31.31.144 -> 172.31.24.227 TCP 187 6633 → 39454 [PSH, ACK] Seq=1211 Ack=1 Win=853 Len=121 TSval=361566 TSecr=118922176
351 0.376710619 172.31.24.227 -> 172.31.31.144 OpenFlow 189 Type: OFPT_PACKET_IN
352 0.376718729 172.31.24.227 -> 172.31.31.144 OpenFlow 189 Type: OFPT_PACKET_IN
353 0.376771391 172.31.31.144 -> 172.31.24.227 TCP 187 6633 → 39454 [PSH, ACK] Seq=1332 Ack=1 Win=853 Len=121 TSval=361566 TSecr=118922176
354 0.376810577 172.31.24.227 -> 172.31.31.144 OpenFlow 189 Type: OFPT_PACKET_IN
355 0.376839432 172.31.24.227 -> 172.31.31.144 OpenFlow 189 Type: OFPT_PACKET_IN
356 0.376854041 172.31.31.144 -> 172.31.24.227 TCP 66 6633 → 39460 [ACK] Seq=969 Ack=124 Win=853 Len=0 TSval=361566 TSecr=118922176
357 0.376858704 172.31.31.144 -> 172.31.24.227 TCP 66 6633 → 39468 [ACK] Seq=1695 Ack=370 Win=853 Len=0 TSval=361566 TSecr=118922176
358 0.376860757 172.31.31.144 -> 172.31.24.227 TCP 66 6633 → 39460 [ACK] Seq=969 Ack=493 Win=853 Len=0 TSval=361566 TSecr=118922176
359 0.376862625 172.31.31.144 -> 172.31.24.227 OpenFlow 187 Type: OFPT_PACKET_OUT
