  1 0.000000000 137.158.125.247 -> 172.31.24.227 TCP 66 63468 → 22 [ACK] Seq=1 Ack=1 Win=32612 Len=0 SLE=61 SRE=97
  2 0.000862520 137.158.125.247 -> 172.31.24.227 TCP 54 63468 → 22 [ACK] Seq=1 Ack=97 Win=32564 Len=0
  3 0.000871117 137.158.125.247 -> 172.31.24.227 TCP 54 63468 → 22 [ACK] Seq=1 Ack=393 Win=32416 Len=0
  4 0.039274732 137.158.125.247 -> 172.31.24.227 TCP 54 63468 → 22 [ACK] Seq=1 Ack=453 Win=32386 Len=0
  5 0.584804524 172.31.31.144 -> 172.31.24.227 TCP 187 6633 → 59288 [PSH, ACK] Seq=1 Ack=1 Win=853 Len=121 TSval=436260 TSecr=389339380
  6 0.584832439 172.31.31.144 -> 172.31.24.227 TCP 187 6633 → 59288 [PSH, ACK] Seq=122 Ack=1 Win=853 Len=121 TSval=436260 TSecr=389339380
  7 0.584837426 172.31.31.144 -> 172.31.24.227 TCP 187 6633 → 59288 [PSH, ACK] Seq=243 Ack=1 Win=853 Len=121 TSval=436260 TSecr=389339380
  8 0.584849338 172.31.31.144 -> 172.31.24.227 TCP 187 6633 → 59288 [PSH, ACK] Seq=364 Ack=1 Win=853 Len=121 TSval=436260 TSecr=389339380
  9 0.584916553 172.31.31.144 -> 172.31.24.227 TCP 187 6633 → 59288 [PSH, ACK] Seq=485 Ack=1 Win=853 Len=121 TSval=436260 TSecr=389339380
 10 0.584963617 172.31.31.144 -> 172.31.24.227 TCP 187 6633 → 59288 [PSH, ACK] Seq=606 Ack=1 Win=853 Len=121 TSval=436260 TSecr=389339380
 11 0.585043016 172.31.31.144 -> 172.31.24.227 TCP 187 6633 → 59290 [PSH, ACK] Seq=1 Ack=1 Win=853 Len=121 TSval=436260 TSecr=389339355
 12 0.585096389 172.31.31.144 -> 172.31.24.227 TCP 187 6633 → 59290 [PSH, ACK] Seq=122 Ack=1 Win=853 Len=121 TSval=436260 TSecr=389339355
 13 0.585154224 172.31.31.144 -> 172.31.24.227 TCP 187 6633 → 59290 [PSH, ACK] Seq=243 Ack=1 Win=853 Len=121 TSval=436260 TSecr=389339355
 14 0.585209803 172.31.31.144 -> 172.31.24.227 TCP 187 6633 → 59290 [PSH, ACK] Seq=364 Ack=1 Win=853 Len=121 TSval=436260 TSecr=389339355
 15 0.585290141 172.31.31.144 -> 172.31.24.227 TCP 187 6633 → 59290 [PSH, ACK] Seq=485 Ack=1 Win=853 Len=121 TSval=436260 TSecr=389339355
 16 0.585320829 172.31.24.227 -> 172.31.31.144 TCP 66 59288 → 6633 [ACK] Seq=1 Ack=727 Win=213 Len=0 TSval=389340130 TSecr=436260
 17 0.585334888 172.31.31.144 -> 172.31.24.227 TCP 187 6633 → 59290 [PSH, ACK] Seq=606 Ack=1 Win=853 Len=121 TSval=436260 TSecr=389339355
 18 0.585436611 172.31.31.144 -> 172.31.24.227 TCP 187 6633 → 59292 [PSH, ACK] Seq=1 Ack=1 Win=853 Len=121 TSval=436260 TSecr=389339404
 19 0.585447890 172.31.24.227 -> 172.31.31.144 OpenFlow 189 Type: OFPT_PACKET_IN
 20 0.585478251 172.31.31.144 -> 172.31.24.227 TCP 187 6633 → 59292 [PSH, ACK] Seq=122 Ack=1 Win=853 Len=121 TSval=436260 TSecr=389339404
 21 0.585486509 172.31.24.227 -> 172.31.31.144 OpenFlow 189 Type: OFPT_PACKET_IN
 22 0.585494691 172.31.24.227 -> 172.31.31.144 OpenFlow 189 Type: OFPT_PACKET_IN
 23 0.585529809 172.31.31.144 -> 172.31.24.227 TCP 187 6633 → 59292 [PSH, ACK] Seq=243 Ack=1 Win=853 Len=121 TSval=436260 TSecr=389339404
 24 0.585562238 172.31.24.227 -> 172.31.31.144 OpenFlow 189 Type: OFPT_PACKET_IN
 25 0.585606395 172.31.31.144 -> 172.31.24.227 TCP 187 6633 → 59292 [PSH, ACK] Seq=364 Ack=1 Win=853 Len=121 TSval=436260 TSecr=389339404
 26 0.585673363 172.31.31.144 -> 172.31.24.227 TCP 187 6633 → 59292 [PSH, ACK] Seq=485 Ack=1 Win=853 Len=121 TSval=436260 TSecr=389339404
 27 0.585779644 172.31.31.144 -> 172.31.24.227 TCP 187 6633 → 59292 [PSH, ACK] Seq=606 Ack=1 Win=853 Len=121 TSval=436260 TSecr=389339404
 28 0.585785670 172.31.31.144 -> 172.31.24.227 TCP 66 6633 → 59290 [ACK] Seq=727 Ack=124 Win=853 Len=0 TSval=436260 TSecr=389340130
 29 0.585790479 172.31.31.144 -> 172.31.24.227 TCP 66 6633 → 59290 [ACK] Seq=727 Ack=247 Win=853 Len=0 TSval=436260 TSecr=389340130
 30 0.585891608 172.31.24.227 -> 172.31.31.144 OpenFlow 189 Type: OFPT_PACKET_IN
 31 0.585922315 172.31.24.227 -> 172.31.31.144 OpenFlow 189 Type: OFPT_PACKET_IN
 32 0.585928403 172.31.24.227 -> 172.31.31.144 OpenFlow 189 Type: OFPT_PACKET_IN
 33 0.586021201 172.31.24.227 -> 172.31.31.144 OpenFlow 189 Type: OFPT_PACKET_IN
 34 0.586043526 172.31.31.144 -> 172.31.24.227 TCP 66 6633 → 59294 [ACK] Seq=1 Ack=247 Win=853 Len=0 TSval=436261 TSecr=389340130
 35 0.586129293 172.31.31.144 -> 172.31.24.227 TCP 66 6633 → 59288 [ACK] Seq=727 Ack=124 Win=853 Len=0 TSval=436261 TSecr=389340130
 36 0.586168541 172.31.31.144 -> 172.31.24.227 TCP 66 6633 → 59288 [ACK] Seq=727 Ack=247 Win=853 Len=0 TSval=436261 TSecr=389340130
 37 0.586238385 172.31.24.227 -> 172.31.31.144 OpenFlow 189 Type: OFPT_PACKET_IN
 38 0.586257480 172.31.24.227 -> 172.31.31.144 OpenFlow 189 Type: OFPT_PACKET_IN
 39 0.586274217 172.31.24.227 -> 172.31.31.144 OpenFlow 189 Type: OFPT_PACKET_IN
 40 0.586312875 172.31.24.227 -> 172.31.31.144 OpenFlow 189 Type: OFPT_PACKET_IN
 41 0.586515142 172.31.31.144 -> 172.31.24.227 TCP 66 6633 → 59290 [ACK] Seq=727 Ack=370 Win=853 Len=0 TSval=436261 TSecr=389340130
 42 0.586521038 172.31.31.144 -> 172.31.24.227 TCP 66 6633 → 59290 [ACK] Seq=727 Ack=493 Win=853 Len=0 TSval=436261 TSecr=389340130
 43 0.587032914 172.31.31.144 -> 172.31.24.227 TCP 66 6633 → 59292 [ACK] Seq=727 Ack=247 Win=853 Len=0 TSval=436261 TSecr=389340130
 44 0.587036490 172.31.31.144 -> 172.31.24.227 TCP 66 6633 → 59294 [ACK] Seq=1 Ack=493 Win=853 Len=0 TSval=436261 TSecr=389340130
 45 0.628988240 172.31.24.227 -> 137.158.125.247 SSH 98 Server: Encrypted packet (len=44)
 46 0.684070424 172.31.31.144 -> 172.31.24.227 OpenFlow 187 Type: OFPT_PACKET_OUT
 47 0.684092026 172.31.31.144 -> 172.31.24.227 OpenFlow 187 Type: OFPT_PACKET_OUT
 48 0.684098014 172.31.31.144 -> 172.31.24.227 OpenFlow 187 Type: OFPT_PACKET_OUT
 49 0.684114504 172.31.31.144 -> 172.31.24.227 OpenFlow 187 Type: OFPT_PACKET_OUT
 50 0.684150325 172.31.31.144 -> 172.31.24.227 OpenFlow 187 Type: OFPT_PACKET_OUT
 51 0.684210693 172.31.31.144 -> 172.31.24.227 OpenFlow 187 Type: OFPT_PACKET_OUT
 52 0.684256655 172.31.24.227 -> 172.31.31.144 TCP 66 59294 → 6633 [ACK] Seq=493 Ack=727 Win=212 Len=0 TSval=389340155 TSecr=436285
 53 0.684658314 172.31.24.227 -> 172.31.31.144 OpenFlow 189 Type: OFPT_PACKET_IN
 54 0.684680529 172.31.24.227 -> 172.31.31.144 OpenFlow 189 Type: OFPT_PACKET_IN
 55 0.684698985 172.31.24.227 -> 172.31.31.144 OpenFlow 189 Type: OFPT_PACKET_IN
 56 0.684741362 172.31.24.227 -> 172.31.31.144 OpenFlow 189 Type: OFPT_PACKET_IN
 57 0.684889915 172.31.31.144 -> 172.31.24.227 TCP 66 6633 → 59288 [ACK] Seq=727 Ack=370 Win=853 Len=0 TSval=436285 TSecr=389340155
 58 0.684898752 172.31.31.144 -> 172.31.24.227 TCP 66 6633 → 59288 [ACK] Seq=727 Ack=493 Win=853 Len=0 TSval=436285 TSecr=389340155
 59 0.685070943 172.31.31.144 -> 172.31.24.227 TCP 66 6633 → 59292 [ACK] Seq=727 Ack=493 Win=853 Len=0 TSval=436285 TSecr=389340155
 60 0.837310066 137.158.125.247 -> 172.31.24.227 TCP 54 63468 → 22 [ACK] Seq=1 Ack=497 Win=32364 Len=0
 61 0.884674320 172.31.31.144 -> 172.31.24.227 OpenFlow 90 Type: OFPT_MULTIPART_REQUEST, OFPMP_GROUP
 62 0.884686517 172.31.31.144 -> 172.31.24.227 OpenFlow 90 Type: OFPT_MULTIPART_REQUEST, OFPMP_GROUP
 63 0.884691309 172.31.31.144 -> 172.31.24.227 OpenFlow 106 Type: OFPT_MULTIPART_REQUEST, OFPMP_METER
 64 0.884695082 172.31.31.144 -> 172.31.24.227 OpenFlow 90 Type: OFPT_MULTIPART_REQUEST, OFPMP_GROUP
 65 0.884697643 172.31.31.144 -> 172.31.24.227 OpenFlow 106 Type: OFPT_MULTIPART_REQUEST, OFPMP_METER
 66 0.884699583 172.31.31.144 -> 172.31.24.227 OpenFlow 106 Type: OFPT_MULTIPART_REQUEST, OFPMP_METER
 67 0.884771618 172.31.24.227 -> 172.31.31.144 OpenFlow 82 Type: OFPT_MULTIPART_REPLY, OFPMP_GROUP
 68 0.884797169 172.31.24.227 -> 172.31.31.144 OpenFlow 82 Type: OFPT_MULTIPART_REPLY, OFPMP_GROUP_DESC
 69 0.884824024 172.31.24.227 -> 172.31.31.144 OpenFlow 82 Type: OFPT_MULTIPART_REPLY, OFPMP_GROUP
 70 0.884833864 172.31.24.227 -> 172.31.31.144 OpenFlow 82 Type: OFPT_MULTIPART_REPLY, OFPMP_METER
 71 0.884863878 172.31.24.227 -> 172.31.31.144 OpenFlow 82 Type: OFPT_MULTIPART_REPLY, OFPMP_GROUP
 72 0.884870555 172.31.24.227 -> 172.31.31.144 OpenFlow 98 Type: OFPT_MULTIPART_REPLY, OFPMP_METER
 73 0.884940426 172.31.24.227 -> 172.31.31.144 OpenFlow 98 Type: OFPT_MULTIPART_REPLY, OFPMP_METER
 74 0.885028510 172.31.31.144 -> 172.31.24.227 TCP 66 6633 → 59288 [ACK] Seq=791 Ack=509 Win=853 Len=0 TSval=436335 TSecr=389340205
 75 0.885034762 172.31.31.144 -> 172.31.24.227 TCP 66 6633 → 59288 [ACK] Seq=791 Ack=525 Win=853 Len=0 TSval=436335 TSecr=389340205
 76 0.885139059 172.31.31.144 -> 172.31.24.227 TCP 66 6633 → 59290 [ACK] Seq=791 Ack=509 Win=853 Len=0 TSval=436335 TSecr=389340205
 77 0.885142815 172.31.31.144 -> 172.31.24.227 TCP 66 6633 → 59288 [ACK] Seq=791 Ack=541 Win=853 Len=0 TSval=436335 TSecr=389340205
 78 0.885232622 172.31.31.144 -> 172.31.24.227 TCP 66 6633 → 59292 [ACK] Seq=791 Ack=541 Win=853 Len=0 TSval=436335 TSecr=389340205
 79 0.885236319 172.31.31.144 -> 172.31.24.227 TCP 66 6633 → 59290 [ACK] Seq=791 Ack=541 Win=853 Len=0 TSval=436335 TSecr=389340205
 80 0.984795518 172.31.31.144 -> 172.31.24.227 OpenFlow 90 Type: OFPT_MULTIPART_REQUEST, OFPMP_GROUP
 81 0.984811920 172.31.31.144 -> 172.31.24.227 OpenFlow 106 Type: OFPT_MULTIPART_REQUEST, OFPMP_METER
 82 0.984905803 172.31.24.227 -> 172.31.31.144 OpenFlow 82 Type: OFPT_MULTIPART_REPLY, OFPMP_GROUP
 83 0.984927093 172.31.24.227 -> 172.31.31.144 OpenFlow 82 Type: OFPT_MULTIPART_REPLY, OFPMP_GROUP_DESC
 84 0.984959184 172.31.24.227 -> 172.31.31.144 OpenFlow 82 Type: OFPT_MULTIPART_REPLY, OFPMP_METER
 85 0.985153916 172.31.31.144 -> 172.31.24.227 TCP 66 6633 → 59294 [ACK] Seq=791 Ack=541 Win=853 Len=0 TSval=436360 TSecr=389340230
 86 1.135410064 172.31.24.227 -> 137.158.125.247 SSH 98 Server: Encrypted packet (len=44)
 87 1.241999472 172.31.31.144 -> 172.31.24.227 OpenFlow 90 Type: OFPT_MULTIPART_REQUEST, OFPMP_PORT_STATS
 88 1.242013920 172.31.31.144 -> 172.31.24.227 OpenFlow 138 Type: OFPT_MULTIPART_REQUEST, OFPMP_FLOW
 89 1.242198827 172.31.24.227 -> 172.31.31.144 OpenFlow 530 Type: OFPT_MULTIPART_REPLY, OFPMP_PORT_STATS
 90 1.242382974 172.31.24.227 -> 172.31.31.144 OpenFlow 6178 Type: OFPT_MULTIPART_REPLY, OFPMP_TABLE
 91 1.242408105 172.31.31.144 -> 172.31.24.227 TCP 66 6633 → 59288 [ACK] Seq=887 Ack=1005 Win=853 Len=0 TSval=436425 TSecr=389340294
 92 1.242468350 172.31.24.227 -> 172.31.31.144 OpenFlow 1562 Type: OFPT_MULTIPART_REPLY, OFPMP_FLOW
 93 1.242648102 172.31.31.144 -> 172.31.24.227 TCP 66 6633 → 59288 [ACK] Seq=887 Ack=7117 Win=853 Len=0 TSval=436425 TSecr=389340294
 94 1.242679031 172.31.31.144 -> 172.31.24.227 TCP 66 6633 → 59288 [ACK] Seq=887 Ack=8613 Win=853 Len=0 TSval=436425 TSecr=389340294
 95 1.263162413 172.31.31.144 -> 172.31.24.227 OpenFlow 90 Type: OFPT_MULTIPART_REQUEST, OFPMP_PORT_STATS
 96 1.263171238 172.31.31.144 -> 172.31.24.227 OpenFlow 138 Type: OFPT_MULTIPART_REQUEST, OFPMP_TABLE
 97 1.263304788 172.31.24.227 -> 172.31.31.144 OpenFlow 530 Type: OFPT_MULTIPART_REPLY, OFPMP_PORT_STATS
 98 1.263382015 172.31.24.227 -> 172.31.31.144 OpenFlow 1562 Type: OFPT_MULTIPART_REPLY, OFPMP_FLOW
 99 1.263511555 172.31.31.144 -> 172.31.24.227 TCP 66 6633 → 59290 [ACK] Seq=887 Ack=1005 Win=853 Len=0 TSval=436430 TSecr=389340299
100 1.263534886 172.31.24.227 -> 172.31.31.144 OpenFlow 6178 Type: OFPT_MULTIPART_REPLY, OFPMP_TABLE
101 1.263620301 172.31.31.144 -> 172.31.24.227 TCP 66 6633 → 59290 [ACK] Seq=887 Ack=2501 Win=853 Len=0 TSval=436430 TSecr=389340299
102 1.263782605 172.31.31.144 -> 172.31.24.227 TCP 66 6633 → 59290 [ACK] Seq=887 Ack=8613 Win=853 Len=0 TSval=436430 TSecr=389340299
103 1.283268364 172.31.31.144 -> 172.31.24.227 OpenFlow 90 Type: OFPT_MULTIPART_REQUEST, OFPMP_PORT_STATS
104 1.283279966 172.31.31.144 -> 172.31.24.227 OpenFlow 138 Type: OFPT_MULTIPART_REQUEST, OFPMP_FLOW
105 1.283409702 172.31.24.227 -> 172.31.31.144 OpenFlow 530 Type: OFPT_MULTIPART_REPLY, OFPMP_PORT_STATS
106 1.283565620 172.31.24.227 -> 172.31.31.144 OpenFlow 6178 Type: OFPT_MULTIPART_REPLY, OFPMP_TABLE
107 1.283632823 172.31.24.227 -> 172.31.31.144 OpenFlow 1146 Type: OFPT_MULTIPART_REPLY, OFPMP_FLOW
108 1.283821612 172.31.31.144 -> 172.31.24.227 TCP 66 6633 → 59292 [ACK] Seq=887 Ack=7117 Win=853 Len=0 TSval=436435 TSecr=389340304
109 1.308399419 172.31.31.144 -> 172.31.24.227 OpenFlow 122 Type: OFPT_MULTIPART_REQUEST, OFPMP_FLOW
110 1.308410239 172.31.31.144 -> 172.31.24.227 OpenFlow 106 Type: OFPT_MULTIPART_REQUEST, OFPMP_PORT_STATS
111 1.308528861 172.31.24.227 -> 172.31.31.144 OpenFlow 1146 Type: OFPT_MULTIPART_REPLY, OFPMP_FLOW
112 1.308694278 172.31.24.227 -> 172.31.31.144 OpenFlow 6178 Type: OFPT_MULTIPART_REPLY, OFPMP_TABLE
113 1.308781289 172.31.24.227 -> 172.31.31.144 OpenFlow 530 Type: OFPT_MULTIPART_REPLY, OFPMP_PORT_STATS
114 1.308957223 172.31.31.144 -> 172.31.24.227 TCP 66 6633 → 59294 [ACK] Seq=887 Ack=7733 Win=853 Len=0 TSval=436441 TSecr=389340311
115 1.322055431 172.31.31.144 -> 172.31.24.227 TCP 66 6633 → 59292 [ACK] Seq=887 Ack=8197 Win=853 Len=0 TSval=436445 TSecr=389340304
116 1.343853068 137.158.125.247 -> 172.31.24.227 TCP 54 63468 → 22 [ACK] Seq=1 Ack=541 Win=32342 Len=0
117 1.346068147 172.31.31.144 -> 172.31.24.227 TCP 66 6633 → 59294 [ACK] Seq=887 Ack=8197 Win=853 Len=0 TSval=436451 TSecr=389340311
118 1.639452127 172.31.24.227 -> 137.158.125.247 SSH 98 Server: Encrypted packet (len=44)
119 1.847161360 137.158.125.247 -> 172.31.24.227 TCP 54 63468 → 22 [ACK] Seq=1 Ack=585 Win=32320 Len=0
120 2.142639876 172.31.24.227 -> 137.158.125.247 SSH 98 Server: Encrypted packet (len=44)
121 2.351434793 137.158.125.247 -> 172.31.24.227 TCP 54 63468 → 22 [ACK] Seq=1 Ack=629 Win=32298 Len=0
122 2.646593554 172.31.24.227 -> 137.158.125.247 SSH 98 Server: Encrypted packet (len=44)
123 2.854139176 137.158.125.247 -> 172.31.24.227 TCP 54 63468 → 22 [ACK] Seq=1 Ack=673 Win=32276 Len=0
124 3.150608253 172.31.24.227 -> 137.158.125.247 SSH 98 Server: Encrypted packet (len=44)
125 3.358378281 137.158.125.247 -> 172.31.24.227 TCP 54 63468 → 22 [ACK] Seq=1 Ack=717 Win=32254 Len=0
126 3.654564643 172.31.24.227 -> 137.158.125.247 SSH 98 Server: Encrypted packet (len=44)
127 3.684368057 172.31.31.144 -> 172.31.24.227 OpenFlow 187 Type: OFPT_PACKET_OUT
128 3.684387143 172.31.31.144 -> 172.31.24.227 OpenFlow 187 Type: OFPT_PACKET_OUT
129 3.684391980 172.31.31.144 -> 172.31.24.227 OpenFlow 187 Type: OFPT_PACKET_OUT
130 3.684418379 172.31.31.144 -> 172.31.24.227 OpenFlow 187 Type: OFPT_PACKET_OUT
131 3.684472010 172.31.31.144 -> 172.31.24.227 OpenFlow 187 Type: OFPT_PACKET_OUT
132 3.684528058 172.31.31.144 -> 172.31.24.227 OpenFlow 187 Type: OFPT_PACKET_OUT
133 3.684611657 172.31.31.144 -> 172.31.24.227 OpenFlow 187 Type: OFPT_PACKET_OUT
134 3.684655075 172.31.31.144 -> 172.31.24.227 OpenFlow 187 Type: OFPT_PACKET_OUT
135 3.684713136 172.31.31.144 -> 172.31.24.227 OpenFlow 187 Type: OFPT_PACKET_OUT
136 3.684768119 172.31.31.144 -> 172.31.24.227 OpenFlow 187 Type: OFPT_PACKET_OUT
137 3.684826829 172.31.31.144 -> 172.31.24.227 OpenFlow 187 Type: OFPT_PACKET_OUT
138 3.684840296 172.31.24.227 -> 172.31.31.144 TCP 66 59288 → 6633 [ACK] Seq=8613 Ack=1613 Win=213 Len=0 TSval=389340905 TSecr=437035
139 3.684883487 172.31.31.144 -> 172.31.24.227 OpenFlow 187 Type: OFPT_PACKET_OUT
140 3.684950043 172.31.24.227 -> 172.31.31.144 OpenFlow 189 Type: OFPT_PACKET_IN
141 3.684960763 172.31.31.144 -> 172.31.24.227 OpenFlow 187 Type: OFPT_PACKET_OUT
142 3.684977763 172.31.24.227 -> 172.31.31.144 OpenFlow 189 Type: OFPT_PACKET_IN
143 3.684998521 172.31.24.227 -> 172.31.31.144 OpenFlow 189 Type: OFPT_PACKET_IN
144 3.685016284 172.31.31.144 -> 172.31.24.227 OpenFlow 187 Type: OFPT_PACKET_OUT
145 3.685073160 172.31.24.227 -> 172.31.31.144 OpenFlow 189 Type: OFPT_PACKET_IN
146 3.685090395 172.31.31.144 -> 172.31.24.227 OpenFlow 187 Type: OFPT_PACKET_OUT
147 3.685155759 172.31.31.144 -> 172.31.24.227 OpenFlow 187 Type: OFPT_PACKET_OUT
148 3.685161501 172.31.31.144 -> 172.31.24.227 TCP 66 6633 → 59294 [ACK] Seq=887 Ack=8320 Win=853 Len=0 TSval=437035 TSecr=389340905
149 3.685246936 172.31.31.144 -> 172.31.24.227 OpenFlow 187 Type: OFPT_PACKET_OUT
150 3.685252524 172.31.31.144 -> 172.31.24.227 TCP 66 6633 → 59294 [ACK] Seq=887 Ack=8443 Win=853 Len=0 TSval=437035 TSecr=389340905
151 3.685256115 172.31.31.144 -> 172.31.24.227 OpenFlow 187 Type: OFPT_PACKET_OUT
152 3.685281818 172.31.31.144 -> 172.31.24.227 TCP 66 6633 → 59290 [ACK] Seq=1613 Ack=8736 Win=853 Len=0 TSval=437035 TSecr=389340905
153 3.685321988 172.31.31.144 -> 172.31.24.227 TCP 66 6633 → 59290 [ACK] Seq=1613 Ack=8859 Win=853 Len=0 TSval=437035 TSecr=389340905
154 3.685385770 172.31.24.227 -> 172.31.31.144 OpenFlow 189 Type: OFPT_PACKET_IN
155 3.685404380 172.31.24.227 -> 172.31.31.144 OpenFlow 189 Type: OFPT_PACKET_IN
156 3.685420884 172.31.24.227 -> 172.31.31.144 OpenFlow 189 Type: OFPT_PACKET_IN
157 3.685459832 172.31.24.227 -> 172.31.31.144 OpenFlow 189 Type: OFPT_PACKET_IN
158 3.685569048 172.31.31.144 -> 172.31.24.227 TCP 66 6633 → 59288 [ACK] Seq=1613 Ack=8736 Win=853 Len=0 TSval=437035 TSecr=389340905
159 3.685679309 172.31.31.144 -> 172.31.24.227 TCP 66 6633 → 59288 [ACK] Seq=1613 Ack=8859 Win=853 Len=0 TSval=437035 TSecr=389340905
160 3.685685523 172.31.31.144 -> 172.31.24.227 TCP 66 6633 → 59292 [ACK] Seq=1613 Ack=8320 Win=853 Len=0 TSval=437035 TSecr=389340905
161 3.685687918 172.31.31.144 -> 172.31.24.227 TCP 66 6633 → 59292 [ACK] Seq=1613 Ack=8443 Win=853 Len=0 TSval=437035 TSecr=389340905
162 3.685704077 172.31.24.227 -> 172.31.31.144 OpenFlow 189 Type: OFPT_PACKET_IN
163 3.685722459 172.31.24.227 -> 172.31.31.144 OpenFlow 189 Type: OFPT_PACKET_IN
164 3.685737008 172.31.24.227 -> 172.31.31.144 OpenFlow 189 Type: OFPT_PACKET_IN
165 3.685778595 172.31.24.227 -> 172.31.31.144 OpenFlow 189 Type: OFPT_PACKET_IN
166 3.685906530 172.31.31.144 -> 172.31.24.227 TCP 66 6633 → 59294 [ACK] Seq=887 Ack=8566 Win=853 Len=0 TSval=437036 TSecr=389340905
167 3.686007287 172.31.31.144 -> 172.31.24.227 TCP 66 6633 → 59294 [ACK] Seq=887 Ack=8689 Win=853 Len=0 TSval=437036 TSecr=389340905
168 3.686010711 172.31.31.144 -> 172.31.24.227 TCP 66 6633 → 59290 [ACK] Seq=1613 Ack=8982 Win=853 Len=0 TSval=437036 TSecr=389340905
169 3.686012970 172.31.31.144 -> 172.31.24.227 TCP 66 6633 → 59290 [ACK] Seq=1613 Ack=9105 Win=853 Len=0 TSval=437036 TSecr=389340905
170 3.784611258 172.31.31.144 -> 172.31.24.227 OpenFlow 187 Type: OFPT_PACKET_OUT
171 3.784620332 172.31.31.144 -> 172.31.24.227 OpenFlow 187 Type: OFPT_PACKET_OUT
172 3.784623805 172.31.31.144 -> 172.31.24.227 OpenFlow 187 Type: OFPT_PACKET_OUT
173 3.784645179 172.31.31.144 -> 172.31.24.227 OpenFlow 187 Type: OFPT_PACKET_OUT
174 3.784705752 172.31.31.144 -> 172.31.24.227 OpenFlow 187 Type: OFPT_PACKET_OUT
175 3.784770550 172.31.31.144 -> 172.31.24.227 OpenFlow 187 Type: OFPT_PACKET_OUT
176 3.784794693 172.31.24.227 -> 172.31.31.144 TCP 66 59294 → 6633 [ACK] Seq=8689 Ack=1613 Win=212 Len=0 TSval=389340930 TSecr=437060
177 3.785002411 172.31.24.227 -> 172.31.31.144 OpenFlow 189 Type: OFPT_PACKET_IN
178 3.785023808 172.31.24.227 -> 172.31.31.144 OpenFlow 189 Type: OFPT_PACKET_IN
179 3.785038957 172.31.24.227 -> 172.31.31.144 OpenFlow 189 Type: OFPT_PACKET_IN
180 3.785081361 172.31.24.227 -> 172.31.31.144 OpenFlow 189 Type: OFPT_PACKET_IN
181 3.785215405 172.31.31.144 -> 172.31.24.227 TCP 66 6633 → 59288 [ACK] Seq=1613 Ack=8982 Win=853 Len=0 TSval=437060 TSecr=389340930
182 3.785380591 172.31.31.144 -> 172.31.24.227 TCP 66 6633 → 59288 [ACK] Seq=1613 Ack=9105 Win=853 Len=0 TSval=437060 TSecr=389340930
183 3.785391670 172.31.31.144 -> 172.31.24.227 TCP 66 6633 → 59292 [ACK] Seq=1613 Ack=8566 Win=853 Len=0 TSval=437060 TSecr=389340930
184 3.785395721 172.31.31.144 -> 172.31.24.227 TCP 66 6633 → 59292 [ACK] Seq=1613 Ack=8689 Win=853 Len=0 TSval=437060 TSecr=389340930
185 3.863179743 137.158.125.247 -> 172.31.24.227 TCP 54 63468 → 22 [ACK] Seq=1 Ack=761 Win=32232 Len=0
186 4.159410616 172.31.24.227 -> 137.158.125.247 SSH 98 Server: Encrypted packet (len=44)
187 4.376455659 137.158.125.247 -> 172.31.24.227 TCP 54 63468 → 22 [ACK] Seq=1 Ack=805 Win=32210 Len=0
188 4.662581578 172.31.24.227 -> 137.158.125.247 SSH 98 Server: Encrypted packet (len=44)
189 4.679602663 172.31.24.227 -> 172.31.31.144 OpenFlow 146 Type: OFPT_PORT_STATUS
190 4.679662236 172.31.24.227 -> 172.31.31.144 OpenFlow 146 Type: OFPT_PORT_STATUS
191 4.679872591 172.31.31.144 -> 172.31.24.227 TCP 66 6633 → 59288 [ACK] Seq=1613 Ack=9185 Win=853 Len=0 TSval=437284 TSecr=389341153
192 4.679889551 172.31.31.144 -> 172.31.24.227 TCP 66 6633 → 59294 [ACK] Seq=1613 Ack=8769 Win=853 Len=0 TSval=437284 TSecr=389341153
193 4.721485072 172.31.31.144 -> 172.31.24.227 OpenFlow 146 Type: OFPT_FLOW_MOD
194 4.721500273 172.31.31.144 -> 172.31.24.227 OpenFlow 146 Type: OFPT_FLOW_MOD
195 4.721503683 172.31.31.144 -> 172.31.24.227 OpenFlow 146 Type: OFPT_FLOW_MOD
196 4.721506388 172.31.31.144 -> 172.31.24.227 OpenFlow 146 Type: OFPT_FLOW_MOD
197 4.721510114 172.31.31.144 -> 172.31.24.227 OpenFlow 154 Type: OFPT_BARRIER_REQUEST
198 4.721513446 172.31.31.144 -> 172.31.24.227 OpenFlow 490 Type: OFPT_BARRIER_REQUEST
199 4.721516378 172.31.31.144 -> 172.31.24.227 OpenFlow 490 Type: OFPT_BARRIER_REQUEST
200 4.721518878 172.31.31.144 -> 172.31.24.227 OpenFlow 322 Type: OFPT_BARRIER_REQUEST
201 4.721604740 172.31.24.227 -> 172.31.31.144 OpenFlow 74 Type: OFPT_BARRIER_REPLY
202 4.721637813 172.31.24.227 -> 172.31.31.144 OpenFlow 74 Type: OFPT_BARRIER_REPLY
203 4.721660830 172.31.24.227 -> 172.31.31.144 OpenFlow 74 Type: OFPT_BARRIER_REPLY
204 4.721708684 172.31.24.227 -> 172.31.31.144 TCP 66 59292 → 6633 [ACK] Seq=8689 Ack=1781 Win=213 Len=0 TSval=389341164 TSecr=437294
205 4.721718075 172.31.24.227 -> 172.31.31.144 OpenFlow 74 Type: OFPT_BARRIER_REPLY
206 4.721744608 172.31.24.227 -> 172.31.31.144 OpenFlow 74 Type: OFPT_BARRIER_REPLY
207 4.721785894 172.31.24.227 -> 172.31.31.144 OpenFlow 82 Type: OFPT_BARRIER_REPLY
208 4.721835901 172.31.24.227 -> 172.31.31.144 OpenFlow 74 Type: OFPT_BARRIER_REPLY
209 4.721933586 172.31.31.144 -> 172.31.24.227 TCP 66 6633 → 59288 [ACK] Seq=2117 Ack=9193 Win=853 Len=0 TSval=437295 TSecr=389341164
210 4.721940949 172.31.31.144 -> 172.31.24.227 TCP 66 6633 → 59288 [ACK] Seq=2117 Ack=9201 Win=853 Len=0 TSval=437295 TSecr=389341164
211 4.721943557 172.31.31.144 -> 172.31.24.227 TCP 66 6633 → 59288 [ACK] Seq=2117 Ack=9209 Win=853 Len=0 TSval=437295 TSecr=389341164
212 4.721950183 172.31.24.227 -> 172.31.31.144 OpenFlow 74 Type: OFPT_BARRIER_REPLY
213 4.722000096 172.31.24.227 -> 172.31.31.144 OpenFlow 146 Type: OFPT_FLOW_REMOVED
214 4.722022650 172.31.31.144 -> 172.31.24.227 TCP 66 6633 → 59292 [ACK] Seq=1781 Ack=8697 Win=853 Len=0 TSval=437295 TSecr=389341164
215 4.722027657 172.31.31.144 -> 172.31.24.227 TCP 66 6633 → 59294 [ACK] Seq=2117 Ack=8777 Win=853 Len=0 TSval=437295 TSecr=389341164
216 4.722030493 172.31.31.144 -> 172.31.24.227 TCP 66 6633 → 59294 [ACK] Seq=2117 Ack=8793 Win=853 Len=0 TSval=437295 TSecr=389341164
217 4.722038452 172.31.24.227 -> 172.31.31.144 OpenFlow 146 Type: OFPT_FLOW_REMOVED
218 4.722053093 172.31.24.227 -> 172.31.31.144 OpenFlow 146 Type: OFPT_FLOW_REMOVED
219 4.722073851 172.31.24.227 -> 172.31.31.144 OpenFlow 146 Type: OFPT_FLOW_REMOVED
220 4.722076898 172.31.24.227 -> 172.31.31.144 OpenFlow 466 Type: OFPT_FLOW_REMOVED
221 4.722110443 172.31.31.144 -> 172.31.24.227 TCP 66 6633 → 59290 [ACK] Seq=1949 Ack=9113 Win=853 Len=0 TSval=437295 TSecr=389341164
222 4.722117556 172.31.24.227 -> 172.31.31.144 OpenFlow 306 Type: OFPT_FLOW_REMOVED
223 4.722125705 172.31.24.227 -> 172.31.31.144 OpenFlow 146 Type: OFPT_FLOW_REMOVED
224 4.722241955 172.31.24.227 -> 172.31.31.144 OpenFlow 466 Type: OFPT_FLOW_REMOVED
225 4.722458818 172.31.31.144 -> 172.31.24.227 TCP 66 6633 → 59290 [ACK] Seq=1949 Ack=9121 Win=853 Len=0 TSval=437295 TSecr=389341164
226 4.722465806 172.31.31.144 -> 172.31.24.227 TCP 66 6633 → 59288 [ACK] Seq=2117 Ack=9289 Win=853 Len=0 TSval=437295 TSecr=389341164
227 4.722468883 172.31.31.144 -> 172.31.24.227 OpenFlow 170 Type: OFPT_FLOW_MOD
228 4.722472885 172.31.31.144 -> 172.31.24.227 TCP 66 6633 → 59294 [ACK] Seq=2117 Ack=8873 Win=853 Len=0 TSval=437295 TSecr=389341164
229 4.722668875 172.31.31.144 -> 172.31.24.227 OpenFlow 178 Type: OFPT_BARRIER_REQUEST
230 4.722676238 172.31.31.144 -> 172.31.24.227 OpenFlow 170 Type: OFPT_FLOW_MOD
231 4.722678750 172.31.31.144 -> 172.31.24.227 OpenFlow 170 Type: OFPT_FLOW_MOD
232 4.722680721 172.31.31.144 -> 172.31.24.227 OpenFlow 170 Type: OFPT_FLOW_MOD
233 4.722682404 172.31.31.144 -> 172.31.24.227 OpenFlow 394 Type: OFPT_BARRIER_REQUEST
234 4.722684744 172.31.31.144 -> 172.31.24.227 OpenFlow 170 Type: OFPT_FLOW_MOD
235 4.722686532 172.31.31.144 -> 172.31.24.227 OpenFlow 178 Type: OFPT_BARRIER_REQUEST
236 4.722687936 172.31.31.144 -> 172.31.24.227 OpenFlow 178 Type: OFPT_BARRIER_REQUEST
237 4.722690535 172.31.31.144 -> 172.31.24.227 OpenFlow 178 Type: OFPT_BARRIER_REQUEST
238 4.722696540 172.31.31.144 -> 172.31.24.227 OpenFlow 170 Type: OFPT_FLOW_MOD
239 4.722698583 172.31.31.144 -> 172.31.24.227 OpenFlow 170 Type: OFPT_FLOW_MOD
240 4.722700750 172.31.31.144 -> 172.31.24.227 OpenFlow 282 Type: OFPT_FLOW_MOD
241 4.722703237 172.31.31.144 -> 172.31.24.227 OpenFlow 170 Type: OFPT_FLOW_MOD
242 4.722705152 172.31.31.144 -> 172.31.24.227 OpenFlow 282 Type: OFPT_BARRIER_REQUEST
243 4.722706759 172.31.31.144 -> 172.31.24.227 OpenFlow 178 Type: OFPT_BARRIER_REQUEST
244 4.722747012 172.31.24.227 -> 172.31.31.144 OpenFlow 74 Type: OFPT_BARRIER_REPLY
245 4.722753486 172.31.31.144 -> 172.31.24.227 OpenFlow 170 Type: OFPT_FLOW_MOD
246 4.722785595 172.31.24.227 -> 172.31.31.144 OpenFlow 74 Type: OFPT_BARRIER_REPLY
247 4.722898133 172.31.24.227 -> 172.31.31.144 OpenFlow 74 Type: OFPT_BARRIER_REPLY
248 4.722939467 172.31.24.227 -> 172.31.31.144 OpenFlow 74 Type: OFPT_BARRIER_REPLY
249 4.722966421 172.31.31.144 -> 172.31.24.227 OpenFlow 170 Type: OFPT_FLOW_MOD
250 4.722978010 172.31.24.227 -> 172.31.31.144 OpenFlow 74 Type: OFPT_BARRIER_REPLY
251 4.723007780 172.31.24.227 -> 172.31.31.144 OpenFlow 74 Type: OFPT_BARRIER_REPLY
252 4.723033539 172.31.24.227 -> 172.31.31.144 TCP 66 59294 → 6633 [ACK] Seq=9273 Ack=2869 Win=212 Len=0 TSval=389341164 TSecr=437295
253 4.723055420 172.31.24.227 -> 172.31.31.144 OpenFlow 74 Type: OFPT_BARRIER_REPLY
254 4.723079627 172.31.31.144 -> 172.31.24.227 OpenFlow 170 Type: OFPT_FLOW_MOD
255 4.723086821 172.31.24.227 -> 172.31.31.144 OpenFlow 74 Type: OFPT_BARRIER_REPLY
256 4.723091960 172.31.31.144 -> 172.31.24.227 TCP 66 6633 → 59290 [ACK] Seq=2485 Ack=9457 Win=853 Len=0 TSval=437295 TSecr=389341164
257 4.723095073 172.31.31.144 -> 172.31.24.227 OpenFlow 170 Type: OFPT_FLOW_MOD
258 4.723148986 172.31.24.227 -> 172.31.31.144 OpenFlow 74 Type: OFPT_BARRIER_REPLY
259 4.723170546 172.31.31.144 -> 172.31.24.227 TCP 66 6633 → 59292 [ACK] Seq=2533 Ack=8865 Win=853 Len=0 TSval=437295 TSecr=389341164
260 4.723274781 172.31.31.144 -> 172.31.24.227 TCP 66 6633 → 59292 [ACK] Seq=2533 Ack=8881 Win=853 Len=0 TSval=437295 TSecr=389341164
261 4.723357380 172.31.31.144 -> 172.31.24.227 TCP 66 6633 → 59294 [ACK] Seq=3077 Ack=9289 Win=853 Len=0 TSval=437295 TSecr=389341164
262 4.760009682 172.31.24.227 -> 172.31.31.144 TCP 66 59290 → 6633 [ACK] Seq=9457 Ack=2485 Win=213 Len=0 TSval=389341174 TSecr=437295
263 4.761926026 172.31.31.144 -> 172.31.24.227 TCP 66 6633 → 59294 [ACK] Seq=3077 Ack=9297 Win=853 Len=0 TSval=437305 TSecr=389341164
264 4.761932409 172.31.31.144 -> 172.31.24.227 TCP 66 6633 → 59288 [ACK] Seq=2437 Ack=9697 Win=853 Len=0 TSval=437305 TSecr=389341164
265 4.878802298 137.158.125.247 -> 172.31.24.227 TCP 54 63468 → 22 [ACK] Seq=1 Ack=849 Win=32188 Len=0
266 5.167671219 172.31.24.227 -> 137.158.125.247 SSH 98 Server: Encrypted packet (len=44)
267 5.377652583 137.158.125.247 -> 172.31.24.227 TCP 54 63468 → 22 [ACK] Seq=1 Ack=893 Win=32166 Len=0
268 5.670562925 172.31.24.227 -> 137.158.125.247 SSH 98 Server: Encrypted packet (len=44)
269 5.885343625 137.158.125.247 -> 172.31.24.227 TCP 54 63468 → 22 [ACK] Seq=1 Ack=937 Win=32144 Len=0
270 6.174608341 172.31.24.227 -> 137.158.125.247 SSH 98 Server: Encrypted packet (len=44)
271 6.242262887 172.31.31.144 -> 172.31.24.227 OpenFlow 122 Type: OFPT_MULTIPART_REQUEST, OFPMP_FLOW
272 6.242289055 172.31.31.144 -> 172.31.24.227 OpenFlow 106 Type: OFPT_MULTIPART_REQUEST, OFPMP_TABLE
273 6.242524024 172.31.24.227 -> 172.31.31.144 OpenFlow 1146 Type: OFPT_MULTIPART_REPLY, OFPMP_FLOW
274 6.242647224 172.31.24.227 -> 172.31.31.144 OpenFlow 530 Type: OFPT_MULTIPART_REPLY, OFPMP_PORT_STATS
275 6.242808150 172.31.24.227 -> 172.31.31.144 OpenFlow 6178 Type: OFPT_MULTIPART_REPLY, OFPMP_TABLE
276 6.242921258 172.31.31.144 -> 172.31.24.227 TCP 66 6633 → 59288 [ACK] Seq=2533 Ack=10777 Win=853 Len=0 TSval=437675 TSecr=389341544
277 6.242930285 172.31.31.144 -> 172.31.24.227 TCP 66 6633 → 59288 [ACK] Seq=2533 Ack=11241 Win=853 Len=0 TSval=437675 TSecr=389341544
278 6.243104626 172.31.31.144 -> 172.31.24.227 TCP 66 6633 → 59288 [ACK] Seq=2533 Ack=17353 Win=853 Len=0 TSval=437675 TSecr=389341544
279 6.263456207 172.31.31.144 -> 172.31.24.227 OpenFlow 82 Type: OFPT_MULTIPART_REQUEST, OFPMP_TABLE
280 6.263496664 172.31.24.227 -> 172.31.31.144 TCP 66 59290 → 6633 [ACK] Seq=9457 Ack=2501 Win=213 Len=0 TSval=389341549 TSecr=437680
281 6.263503856 172.31.31.144 -> 172.31.24.227 OpenFlow 146 Type: OFPT_MULTIPART_REQUEST, OFPMP_PORT_STATS
282 6.263509763 172.31.24.227 -> 172.31.31.144 TCP 66 59290 → 6633 [ACK] Seq=9457 Ack=2581 Win=213 Len=0 TSval=389341549 TSecr=437680
283 6.263853469 172.31.24.227 -> 172.31.31.144 OpenFlow 6178 Type: OFPT_MULTIPART_REPLY, OFPMP_TABLE
284 6.263925779 172.31.24.227 -> 172.31.31.144 OpenFlow 1562 Type: OFPT_MULTIPART_REPLY, OFPMP_FLOW
285 6.264051269 172.31.24.227 -> 172.31.31.144 OpenFlow 530 Type: OFPT_MULTIPART_REPLY, OFPMP_PORT_STATS
286 6.264136761 172.31.31.144 -> 172.31.24.227 TCP 66 6633 → 59290 [ACK] Seq=2581 Ack=17065 Win=853 Len=0 TSval=437680 TSecr=389341549
287 6.282449851 172.31.31.144 -> 172.31.24.227 OpenFlow 82 Type: OFPT_MULTIPART_REQUEST, OFPMP_TABLE
288 6.282459366 172.31.31.144 -> 172.31.24.227 OpenFlow 146 Type: OFPT_MULTIPART_REQUEST, OFPMP_FLOW
289 6.282630203 172.31.24.227 -> 172.31.31.144 OpenFlow 6178 Type: OFPT_MULTIPART_REPLY, OFPMP_TABLE
290 6.282707949 172.31.24.227 -> 172.31.31.144 OpenFlow 530 Type: OFPT_MULTIPART_REPLY, OFPMP_PORT_STATS
291 6.282761736 172.31.24.227 -> 172.31.31.144 OpenFlow 1562 Type: OFPT_MULTIPART_REPLY, OFPMP_FLOW
292 6.282902384 172.31.31.144 -> 172.31.24.227 TCP 66 6633 → 59292 [ACK] Seq=2629 Ack=15457 Win=853 Len=0 TSval=437685 TSecr=389341554
293 6.301952119 172.31.31.144 -> 172.31.24.227 TCP 66 6633 → 59290 [ACK] Seq=2581 Ack=17529 Win=853 Len=0 TSval=437690 TSecr=389341550
294 6.308578652 172.31.31.144 -> 172.31.24.227 OpenFlow 90 Type: OFPT_MULTIPART_REQUEST, OFPMP_PORT_STATS
295 6.308587794 172.31.31.144 -> 172.31.24.227 OpenFlow 138 Type: OFPT_MULTIPART_REQUEST, OFPMP_TABLE
296 6.308713782 172.31.24.227 -> 172.31.31.144 OpenFlow 530 Type: OFPT_MULTIPART_REPLY, OFPMP_PORT_STATS
297 6.308767806 172.31.24.227 -> 172.31.31.144 OpenFlow 1146 Type: OFPT_MULTIPART_REPLY, OFPMP_FLOW
298 6.308907117 172.31.24.227 -> 172.31.31.144 OpenFlow 6178 Type: OFPT_MULTIPART_REPLY, OFPMP_TABLE
299 6.308936695 172.31.31.144 -> 172.31.24.227 TCP 66 6633 → 59294 [ACK] Seq=3173 Ack=9761 Win=853 Len=0 TSval=437691 TSecr=389341561
300 6.308997652 172.31.31.144 -> 172.31.24.227 TCP 66 6633 → 59294 [ACK] Seq=3173 Ack=10841 Win=853 Len=0 TSval=437691 TSecr=389341561
301 6.309173967 172.31.31.144 -> 172.31.24.227 TCP 66 6633 → 59294 [ACK] Seq=3173 Ack=16953 Win=853 Len=0 TSval=437691 TSecr=389341561
302 6.321940104 172.31.31.144 -> 172.31.24.227 TCP 66 6633 → 59292 [ACK] Seq=2629 Ack=16953 Win=853 Len=0 TSval=437695 TSecr=389341554
303 6.387152798 137.158.125.247 -> 172.31.24.227 TCP 54 63468 → 22 [ACK] Seq=1 Ack=981 Win=32122 Len=0
304 6.679125106 172.31.24.227 -> 137.158.125.247 SSH 98 Server: Encrypted packet (len=44)
305 6.785054478 172.31.31.144 -> 172.31.24.227 OpenFlow 187 Type: OFPT_PACKET_OUT
306 6.785073689 172.31.31.144 -> 172.31.24.227 OpenFlow 187 Type: OFPT_PACKET_OUT
307 6.785077854 172.31.31.144 -> 172.31.24.227 OpenFlow 308 Type: OFPT_PACKET_OUT
308 6.785106591 172.31.31.144 -> 172.31.24.227 OpenFlow 187 Type: OFPT_PACKET_OUT
309 6.785151977 172.31.31.144 -> 172.31.24.227 OpenFlow 187 Type: OFPT_PACKET_OUT
310 6.785228044 172.31.31.144 -> 172.31.24.227 OpenFlow 187 Type: OFPT_PACKET_OUT
311 6.785261888 172.31.31.144 -> 172.31.24.227 OpenFlow 187 Type: OFPT_PACKET_OUT
312 6.785345152 172.31.31.144 -> 172.31.24.227 OpenFlow 187 Type: OFPT_PACKET_OUT
313 6.785355631 172.31.24.227 -> 172.31.31.144 TCP 66 59288 → 6633 [ACK] Seq=17353 Ack=3017 Win=213 Len=0 TSval=389341680 TSecr=437810
314 6.785390878 172.31.31.144 -> 172.31.24.227 OpenFlow 187 Type: OFPT_PACKET_OUT
315 6.785470400 172.31.31.144 -> 172.31.24.227 OpenFlow 187 Type: OFPT_PACKET_OUT
316 6.785480764 172.31.24.227 -> 172.31.31.144 OpenFlow 189 Type: OFPT_PACKET_IN
317 6.785517212 172.31.31.144 -> 172.31.24.227 OpenFlow 187 Type: OFPT_PACKET_OUT
318 6.785530228 172.31.24.227 -> 172.31.31.144 OpenFlow 189 Type: OFPT_PACKET_IN
319 6.785644321 172.31.31.144 -> 172.31.24.227 OpenFlow 187 Type: OFPT_PACKET_OUT
320 6.785650573 172.31.31.144 -> 172.31.24.227 OpenFlow 187 Type: OFPT_PACKET_OUT
321 6.785695524 172.31.31.144 -> 172.31.24.227 OpenFlow 187 Type: OFPT_PACKET_OUT
322 6.785774225 172.31.31.144 -> 172.31.24.227 OpenFlow 187 Type: OFPT_PACKET_OUT
323 6.785779878 172.31.31.144 -> 172.31.24.227 TCP 66 6633 → 59290 [ACK] Seq=3307 Ack=17652 Win=853 Len=0 TSval=437810 TSecr=389341680
324 6.785832578 172.31.31.144 -> 172.31.24.227 TCP 66 6633 → 59290 [ACK] Seq=3307 Ack=17775 Win=853 Len=0 TSval=437811 TSecr=389341680
325 6.785904299 172.31.24.227 -> 172.31.31.144 OpenFlow 189 Type: OFPT_PACKET_IN
326 6.785924398 172.31.24.227 -> 172.31.31.144 OpenFlow 189 Type: OFPT_PACKET_IN
327 6.785942267 172.31.24.227 -> 172.31.31.144 OpenFlow 189 Type: OFPT_PACKET_IN
328 6.785994865 172.31.24.227 -> 172.31.31.144 OpenFlow 189 Type: OFPT_PACKET_IN
329 6.786110993 172.31.31.144 -> 172.31.24.227 TCP 66 6633 → 59288 [ACK] Seq=3017 Ack=17476 Win=853 Len=0 TSval=437811 TSecr=389341680
330 6.786162755 172.31.31.144 -> 172.31.24.227 TCP 66 6633 → 59288 [ACK] Seq=3017 Ack=17599 Win=853 Len=0 TSval=437811 TSecr=389341680
331 6.786250003 172.31.31.144 -> 172.31.24.227 TCP 66 6633 → 59292 [ACK] Seq=3355 Ack=17076 Win=853 Len=0 TSval=437811 TSecr=389341680
332 6.786256225 172.31.31.144 -> 172.31.24.227 TCP 66 6633 → 59292 [ACK] Seq=3355 Ack=17199 Win=853 Len=0 TSval=437811 TSecr=389341680
333 6.786284329 172.31.24.227 -> 172.31.31.144 OpenFlow 189 Type: OFPT_PACKET_IN
334 6.786303355 172.31.24.227 -> 172.31.31.144 OpenFlow 189 Type: OFPT_PACKET_IN
335 6.786319253 172.31.24.227 -> 172.31.31.144 OpenFlow 189 Type: OFPT_PACKET_IN
336 6.786372592 172.31.24.227 -> 172.31.31.144 OpenFlow 189 Type: OFPT_PACKET_IN
337 6.786542375 172.31.31.144 -> 172.31.24.227 TCP 66 6633 → 59294 [ACK] Seq=3173 Ack=17076 Win=853 Len=0 TSval=437811 TSecr=389341680
338 6.786548480 172.31.31.144 -> 172.31.24.227 TCP 66 6633 → 59294 [ACK] Seq=3173 Ack=17199 Win=853 Len=0 TSval=437811 TSecr=389341680
339 6.786605727 172.31.31.144 -> 172.31.24.227 TCP 66 6633 → 59290 [ACK] Seq=3307 Ack=17898 Win=853 Len=0 TSval=437811 TSecr=389341680
340 6.786609133 172.31.31.144 -> 172.31.24.227 TCP 66 6633 → 59290 [ACK] Seq=3307 Ack=18021 Win=853 Len=0 TSval=437811 TSecr=389341680
341 6.884170929 172.31.31.144 -> 172.31.24.227 OpenFlow 187 Type: OFPT_PACKET_OUT
342 6.884182336 172.31.31.144 -> 172.31.24.227 OpenFlow 187 Type: OFPT_PACKET_OUT
343 6.884186414 172.31.31.144 -> 172.31.24.227 OpenFlow 187 Type: OFPT_PACKET_OUT
344 6.884201777 172.31.31.144 -> 172.31.24.227 OpenFlow 187 Type: OFPT_PACKET_OUT
345 6.884351318 172.31.24.227 -> 172.31.31.144 TCP 66 59294 → 6633 [ACK] Seq=17199 Ack=3657 Win=213 Len=0 TSval=389341705 TSecr=437835
346 6.884488064 172.31.24.227 -> 172.31.31.144 OpenFlow 189 Type: OFPT_PACKET_IN
347 6.884511049 172.31.24.227 -> 172.31.31.144 OpenFlow 189 Type: OFPT_PACKET_IN
348 6.884747776 172.31.31.144 -> 172.31.24.227 TCP 66 6633 → 59292 [ACK] Seq=3355 Ack=17322 Win=853 Len=0 TSval=437835 TSecr=389341705
349 6.884755323 172.31.31.144 -> 172.31.24.227 TCP 66 6633 → 59292 [ACK] Seq=3355 Ack=17445 Win=853 Len=0 TSval=437835 TSecr=389341705
350 6.901357157 137.158.125.247 -> 172.31.24.227 TCP 54 63468 → 22 [ACK] Seq=1 Ack=1025 Win=32100 Len=0
351 7.183179700 172.31.24.227 -> 137.158.125.247 SSH 98 Server: Encrypted packet (len=44)
352 7.391086391 137.158.125.247 -> 172.31.24.227 TCP 54 63468 → 22 [ACK] Seq=1 Ack=1069 Win=32078 Len=0
353 7.686585000 172.31.24.227 -> 137.158.125.247 SSH 98 Server: Encrypted packet (len=44)
354 7.894310331 137.158.125.247 -> 172.31.24.227 TCP 54 63468 → 22 [ACK] Seq=1 Ack=1113 Win=32056 Len=0
355 8.190654619 172.31.24.227 -> 137.158.125.247 SSH 98 Server: Encrypted packet (len=44)
356 8.399360773 137.158.125.247 -> 172.31.24.227 TCP 54 63468 → 22 [ACK] Seq=1 Ack=1157 Win=32768 Len=0
357 8.694561078 172.31.24.227 -> 137.158.125.247 SSH 98 Server: Encrypted packet (len=44)
358 8.903301632 137.158.125.247 -> 172.31.24.227 TCP 54 63468 → 22 [ACK] Seq=1 Ack=1201 Win=32746 Len=0
359 9.198562387 172.31.24.227 -> 137.158.125.247 SSH 98 Server: Encrypted packet (len=44)
360 9.407311394 137.158.125.247 -> 172.31.24.227 TCP 54 63468 → 22 [ACK] Seq=1 Ack=1245 Win=32724 Len=0
