  1 0.000000000 172.31.31.144 -> 172.31.23.72 TCP 90 6633 → 45508 [PSH, ACK] Seq=1 Ack=1 Win=853 Len=24 TSval=1183434 TSecr=30004388
  2 0.000046553 172.31.23.72 -> 172.31.31.144 TCP 66 45508 → 6633 [ACK] Seq=1 Ack=25 Win=213 Len=0 TSval=30005025 TSecr=1183434
  3 0.000053697 172.31.31.144 -> 172.31.23.72 TCP 138 6633 → 45508 [PSH, ACK] Seq=25 Ack=1 Win=853 Len=72 TSval=1183434 TSecr=30004388
  4 0.000058475 172.31.23.72 -> 172.31.31.144 TCP 66 45508 → 6633 [ACK] Seq=1 Ack=97 Win=213 Len=0 TSval=30005025 TSecr=1183434
  5 0.000473019 172.31.23.72 -> 172.31.31.144 OpenFlow 530 Type: OFPT_MULTIPART_REPLY, OFPMP_PORT_STATS
  6 0.000671187 172.31.31.144 -> 172.31.23.72 TCP 66 6633 → 45508 [ACK] Seq=97 Ack=465 Win=853 Len=0 TSval=1183434 TSecr=30005025
  7 0.000691236 172.31.23.72 -> 172.31.31.144 OpenFlow 6178 Type: OFPT_MULTIPART_REPLY, OFPMP_TABLE
  8 0.000762759 172.31.23.72 -> 172.31.31.144 OpenFlow 2010 Type: OFPT_MULTIPART_REPLY, OFPMP_FLOW
  9 0.000956832 172.31.31.144 -> 172.31.23.72 TCP 66 6633 → 45508 [ACK] Seq=97 Ack=6577 Win=853 Len=0 TSval=1183434 TSecr=30005026
 10 0.000963309 172.31.31.144 -> 172.31.23.72 TCP 66 6633 → 45508 [ACK] Seq=97 Ack=8521 Win=853 Len=0 TSval=1183434 TSecr=30005026
 11 0.080127928 172.31.31.144 -> 172.31.23.72 TCP 90 6633 → 45510 [PSH, ACK] Seq=1 Ack=1 Win=853 Len=24 TSval=1183454 TSecr=30004378
 12 0.080469032 172.31.23.72 -> 172.31.31.144 OpenFlow 642 Type: OFPT_MULTIPART_REPLY, OFPMP_PORT_STATS
 13 0.081276906 172.31.31.144 -> 172.31.23.72 OpenFlow 82 Type: OFPT_MULTIPART_REQUEST, OFPMP_TABLE
 14 0.081286327 172.31.31.144 -> 172.31.23.72 OpenFlow 122 Type: OFPT_MULTIPART_REQUEST, OFPMP_FLOW
 15 0.081580064 172.31.23.72 -> 172.31.31.144 OpenFlow 6178 Type: OFPT_MULTIPART_REPLY, OFPMP_TABLE
 16 0.081678139 172.31.23.72 -> 172.31.31.144 OpenFlow 2842 Type: OFPT_MULTIPART_REPLY, OFPMP_FLOW
 17 0.081916853 172.31.31.144 -> 172.31.23.72 TCP 66 6633 → 45510 [ACK] Seq=97 Ack=9465 Win=853 Len=0 TSval=1183455 TSecr=30005046
 18 0.087405787 172.31.31.144 -> 172.31.23.72 TCP 122 6633 → 45512 [PSH, ACK] Seq=1 Ack=1 Win=853 Len=56 TSval=1183456 TSecr=30004380
 19 0.087415639 172.31.23.72 -> 172.31.31.144 TCP 66 45512 → 6633 [ACK] Seq=1 Ack=57 Win=213 Len=0 TSval=30005047 TSecr=1183456
 20 0.087420355 172.31.31.144 -> 172.31.23.72 TCP 106 6633 → 45512 [PSH, ACK] Seq=57 Ack=1 Win=853 Len=40 TSval=1183456 TSecr=30004380
 21 0.087423601 172.31.23.72 -> 172.31.31.144 TCP 66 45512 → 6633 [ACK] Seq=1 Ack=97 Win=213 Len=0 TSval=30005047 TSecr=1183456
 22 0.087575325 172.31.23.72 -> 172.31.31.144 OpenFlow 2634 Type: OFPT_MULTIPART_REPLY, OFPMP_FLOW
 23 0.087731356 172.31.23.72 -> 172.31.31.144 OpenFlow 6178 Type: OFPT_MULTIPART_REPLY, OFPMP_TABLE
 24 0.087845775 172.31.23.72 -> 172.31.31.144 OpenFlow 754 Type: OFPT_MULTIPART_REPLY, OFPMP_PORT_STATS
 25 0.087854050 172.31.31.144 -> 172.31.23.72 TCP 66 6633 → 45512 [ACK] Seq=97 Ack=2569 Win=853 Len=0 TSval=1183456 TSecr=30005047
 26 0.088090228 172.31.31.144 -> 172.31.23.72 TCP 66 6633 → 45512 [ACK] Seq=97 Ack=8681 Win=853 Len=0 TSval=1183456 TSecr=30005047
 27 0.088095872 172.31.31.144 -> 172.31.23.72 TCP 66 6633 → 45512 [ACK] Seq=97 Ack=9369 Win=853 Len=0 TSval=1183456 TSecr=30005047
 28 0.121525543 172.31.31.144 -> 172.31.23.72 TCP 82 6633 → 45514 [PSH, ACK] Seq=1 Ack=1 Win=853 Len=16 TSval=1183465 TSecr=30004380
 29 0.121537147 172.31.31.144 -> 172.31.23.72 TCP 146 6633 → 45514 [PSH, ACK] Seq=17 Ack=1 Win=853 Len=80 TSval=1183465 TSecr=30004380
 30 0.121752548 172.31.23.72 -> 172.31.31.144 OpenFlow 6178 Type: OFPT_MULTIPART_REPLY, OFPMP_TABLE
 31 0.121821547 172.31.23.72 -> 172.31.31.144 OpenFlow 2010 Type: OFPT_MULTIPART_REPLY, OFPMP_FLOW
 32 0.121920677 172.31.23.72 -> 172.31.31.144 OpenFlow 642 Type: OFPT_MULTIPART_REPLY, OFPMP_PORT_STATS
 33 0.122050980 172.31.31.144 -> 172.31.23.72 TCP 66 6633 → 45514 [ACK] Seq=97 Ack=6113 Win=853 Len=0 TSval=1183465 TSecr=30005056
 34 0.122057590 172.31.31.144 -> 172.31.23.72 TCP 66 6633 → 45514 [ACK] Seq=97 Ack=8057 Win=853 Len=0 TSval=1183465 TSecr=30005056
 35 0.122096072 172.31.31.144 -> 172.31.23.72 TCP 66 6633 → 45514 [ACK] Seq=97 Ack=8633 Win=853 Len=0 TSval=1183465 TSecr=30005056
 36 0.159656782 172.31.31.144 -> 172.31.23.72 TCP 90 6633 → 45516 [PSH, ACK] Seq=1 Ack=1 Win=853 Len=24 TSval=1183474 TSecr=30004380
 37 0.159670194 172.31.31.144 -> 172.31.23.72 TCP 138 6633 → 45516 [PSH, ACK] Seq=25 Ack=1 Win=853 Len=72 TSval=1183474 TSecr=30004380
 38 0.159972649 172.31.23.72 -> 172.31.31.144 OpenFlow 530 Type: OFPT_MULTIPART_REPLY, OFPMP_PORT_STATS
 39 0.160030975 172.31.23.72 -> 172.31.31.144 OpenFlow 970 Type: OFPT_MULTIPART_REPLY, OFPMP_FLOW
 40 0.160203177 172.31.23.72 -> 172.31.31.144 OpenFlow 6178 Type: OFPT_MULTIPART_REPLY, OFPMP_TABLE
 41 0.160218177 172.31.31.144 -> 172.31.23.72 TCP 66 6633 → 45516 [ACK] Seq=97 Ack=465 Win=853 Len=0 TSval=1183474 TSecr=30005065
 42 0.160225512 172.31.31.144 -> 172.31.23.72 TCP 66 6633 → 45516 [ACK] Seq=97 Ack=1369 Win=853 Len=0 TSval=1183474 TSecr=30005065
 43 0.160435698 172.31.31.144 -> 172.31.23.72 TCP 66 6633 → 45516 [ACK] Seq=97 Ack=7481 Win=853 Len=0 TSval=1183474 TSecr=30005065
 44 0.202933511 172.31.31.144 -> 172.31.23.72 TCP 122 6633 → 45518 [PSH, ACK] Seq=1 Ack=1 Win=853 Len=56 TSval=1183485 TSecr=30004380
 45 0.202944433 172.31.31.144 -> 172.31.23.72 TCP 106 6633 → 45518 [PSH, ACK] Seq=57 Ack=1 Win=853 Len=40 TSval=1183485 TSecr=30004380
 46 0.203111454 172.31.23.72 -> 172.31.31.144 OpenFlow 3466 Type: OFPT_MULTIPART_REPLY, OFPMP_FLOW
 47 0.203262310 172.31.23.72 -> 172.31.31.144 OpenFlow 6178 Type: OFPT_MULTIPART_REPLY, OFPMP_TABLE
 48 0.203388028 172.31.31.144 -> 172.31.23.72 TCP 66 6633 → 45518 [ACK] Seq=97 Ack=3401 Win=853 Len=0 TSval=1183485 TSecr=30005076
 49 0.203409973 172.31.23.72 -> 172.31.31.144 OpenFlow 754 Type: OFPT_MULTIPART_REPLY, OFPMP_PORT_STATS
 50 0.203560433 172.31.31.144 -> 172.31.23.72 TCP 66 6633 → 45518 [ACK] Seq=97 Ack=9513 Win=853 Len=0 TSval=1183485 TSecr=30005076
 51 0.203644074 172.31.31.144 -> 172.31.23.72 TCP 66 6633 → 45518 [ACK] Seq=97 Ack=10201 Win=853 Len=0 TSval=1183485 TSecr=30005076
 52 0.246063052 172.31.31.144 -> 172.31.23.72 TCP 82 6633 → 45520 [PSH, ACK] Seq=1 Ack=1 Win=853 Len=16 TSval=1183496 TSecr=30004380
 53 0.246085598 172.31.31.144 -> 172.31.23.72 TCP 146 6633 → 45520 [PSH, ACK] Seq=17 Ack=1 Win=853 Len=80 TSval=1183496 TSecr=30004380
 54 0.246529017 172.31.23.72 -> 172.31.31.144 OpenFlow 6178 Type: OFPT_MULTIPART_REPLY, OFPMP_TABLE
 55 0.246615552 172.31.23.72 -> 172.31.31.144 OpenFlow 2010 Type: OFPT_MULTIPART_REPLY, OFPMP_FLOW
 56 0.246755987 172.31.23.72 -> 172.31.31.144 OpenFlow 754 Type: OFPT_MULTIPART_REPLY, OFPMP_PORT_STATS
 57 0.246845246 172.31.31.144 -> 172.31.23.72 TCP 66 6633 → 45520 [ACK] Seq=97 Ack=6113 Win=853 Len=0 TSval=1183496 TSecr=30005087
 58 0.246852053 172.31.31.144 -> 172.31.23.72 TCP 66 6633 → 45520 [ACK] Seq=97 Ack=8057 Win=853 Len=0 TSval=1183496 TSecr=30005087
 59 0.246952943 172.31.31.144 -> 172.31.23.72 TCP 66 6633 → 45520 [ACK] Seq=97 Ack=8745 Win=853 Len=0 TSval=1183496 TSecr=30005087
 60 0.284209897 172.31.31.144 -> 172.31.23.72 TCP 82 6633 → 45522 [PSH, ACK] Seq=1 Ack=1 Win=853 Len=16 TSval=1183505 TSecr=30004380
 61 0.284235753 172.31.31.144 -> 172.31.23.72 TCP 146 6633 → 45522 [PSH, ACK] Seq=17 Ack=1 Win=853 Len=80 TSval=1183505 TSecr=30004380
 62 0.284671989 172.31.23.72 -> 172.31.31.144 OpenFlow 6178 Type: OFPT_MULTIPART_REPLY, OFPMP_TABLE
 63 0.284782778 172.31.23.72 -> 172.31.31.144 OpenFlow 530 Type: OFPT_MULTIPART_REPLY, OFPMP_PORT_STATS
 64 0.284829246 172.31.23.72 -> 172.31.31.144 OpenFlow 554 Type: OFPT_MULTIPART_REPLY, OFPMP_FLOW
 65 0.285000969 172.31.31.144 -> 172.31.23.72 TCP 66 6633 → 45522 [ACK] Seq=97 Ack=6577 Win=853 Len=0 TSval=1183505 TSecr=30005097
 66 0.309614271 172.31.31.144 -> 172.31.23.72 TCP 187 6633 → 45546 [PSH, ACK] Seq=1 Ack=1 Win=853 Len=121 TSval=1183512 TSecr=30004379
 67 0.309625257 172.31.31.144 -> 172.31.23.72 TCP 187 6633 → 45546 [PSH, ACK] Seq=122 Ack=1 Win=853 Len=121 TSval=1183512 TSecr=30004379
 68 0.309644715 172.31.31.144 -> 172.31.23.72 TCP 187 6633 → 45546 [PSH, ACK] Seq=243 Ack=1 Win=853 Len=121 TSval=1183512 TSecr=30004379
 69 0.309687679 172.31.31.144 -> 172.31.23.72 TCP 187 6633 → 45546 [PSH, ACK] Seq=364 Ack=1 Win=853 Len=121 TSval=1183512 TSecr=30004379
 70 0.309755540 172.31.31.144 -> 172.31.23.72 TCP 187 6633 → 45546 [PSH, ACK] Seq=485 Ack=1 Win=853 Len=121 TSval=1183512 TSecr=30004379
 71 0.309811121 172.31.31.144 -> 172.31.23.72 TCP 187 6633 → 45546 [PSH, ACK] Seq=606 Ack=1 Win=853 Len=121 TSval=1183512 TSecr=30004379
 72 0.309868870 172.31.31.144 -> 172.31.23.72 TCP 187 6633 → 45546 [PSH, ACK] Seq=727 Ack=1 Win=853 Len=121 TSval=1183512 TSecr=30004379
 73 0.309907093 172.31.31.144 -> 172.31.23.72 TCP 187 6633 → 45546 [PSH, ACK] Seq=848 Ack=1 Win=853 Len=121 TSval=1183512 TSecr=30004379
 74 0.309973356 172.31.31.144 -> 172.31.23.72 TCP 187 6633 → 45534 [PSH, ACK] Seq=1 Ack=1 Win=853 Len=121 TSval=1183512 TSecr=30004379
 75 0.310024723 172.31.31.144 -> 172.31.23.72 TCP 187 6633 → 45534 [PSH, ACK] Seq=122 Ack=1 Win=853 Len=121 TSval=1183512 TSecr=30004379
 76 0.310083479 172.31.31.144 -> 172.31.23.72 TCP 187 6633 → 45534 [PSH, ACK] Seq=243 Ack=1 Win=853 Len=121 TSval=1183512 TSecr=30004379
 77 0.310119872 172.31.23.72 -> 172.31.31.144 TCP 66 45546 → 6633 [ACK] Seq=1 Ack=969 Win=213 Len=0 TSval=30005103 TSecr=1183512
 78 0.310143032 172.31.31.144 -> 172.31.23.72 TCP 187 6633 → 45534 [PSH, ACK] Seq=364 Ack=1 Win=853 Len=121 TSval=1183512 TSecr=30004379
 79 0.310200355 172.31.31.144 -> 172.31.23.72 TCP 187 6633 → 45534 [PSH, ACK] Seq=485 Ack=1 Win=853 Len=121 TSval=1183512 TSecr=30004379
 80 0.310261964 172.31.31.144 -> 172.31.23.72 TCP 187 6633 → 45534 [PSH, ACK] Seq=606 Ack=1 Win=853 Len=121 TSval=1183512 TSecr=30004379
 81 0.310324576 172.31.31.144 -> 172.31.23.72 TCP 187 6633 → 45530 [PSH, ACK] Seq=1 Ack=1 Win=853 Len=121 TSval=1183512 TSecr=30004354
 82 0.310404358 172.31.31.144 -> 172.31.23.72 TCP 187 6633 → 45530 [PSH, ACK] Seq=122 Ack=1 Win=853 Len=121 TSval=1183512 TSecr=30004354
 83 0.310409093 172.31.31.144 -> 172.31.23.72 TCP 187 6633 → 45530 [PSH, ACK] Seq=243 Ack=1 Win=853 Len=121 TSval=1183512 TSecr=30004354
 84 0.310481286 172.31.23.72 -> 172.31.31.144 TCP 66 45534 → 6633 [ACK] Seq=1 Ack=727 Win=213 Len=0 TSval=30005103 TSecr=1183512
 85 0.310564757 172.31.31.144 -> 172.31.23.72 TCP 187 6633 → 45530 [PSH, ACK] Seq=364 Ack=1 Win=853 Len=121 TSval=1183512 TSecr=30004354
 86 0.310569719 172.31.31.144 -> 172.31.23.72 TCP 187 6633 → 45530 [PSH, ACK] Seq=485 Ack=1 Win=853 Len=121 TSval=1183512 TSecr=30004354
 87 0.310708594 172.31.31.144 -> 172.31.23.72 TCP 187 6633 → 45530 [PSH, ACK] Seq=606 Ack=1 Win=853 Len=121 TSval=1183512 TSecr=30004354
 88 0.310713466 172.31.31.144 -> 172.31.23.72 TCP 187 6633 → 45530 [PSH, ACK] Seq=727 Ack=1 Win=853 Len=121 TSval=1183512 TSecr=30004354
 89 0.310715149 172.31.31.144 -> 172.31.23.72 TCP 187 6633 → 45530 [PSH, ACK] Seq=848 Ack=1 Win=853 Len=121 TSval=1183512 TSecr=30004354
 90 0.310768137 172.31.31.144 -> 172.31.23.72 OpenFlow 187 Type: OFPT_PACKET_OUT
 91 0.310804701 172.31.31.144 -> 172.31.23.72 OpenFlow 187 Type: OFPT_PACKET_OUT
 92 0.310870789 172.31.31.144 -> 172.31.23.72 OpenFlow 187 Type: OFPT_PACKET_OUT
 93 0.310935985 172.31.31.144 -> 172.31.23.72 OpenFlow 187 Type: OFPT_PACKET_OUT
 94 0.310969157 172.31.31.144 -> 172.31.23.72 OpenFlow 187 Type: OFPT_PACKET_OUT
 95 0.310977694 172.31.23.72 -> 172.31.31.144 TCP 66 45530 → 6633 [ACK] Seq=1 Ack=969 Win=213 Len=0 TSval=30005103 TSecr=1183512
 96 0.311040857 172.31.31.144 -> 172.31.23.72 OpenFlow 187 Type: OFPT_PACKET_OUT
 97 0.311069721 172.31.31.144 -> 172.31.23.72 OpenFlow 187 Type: OFPT_PACKET_OUT
 98 0.311139445 172.31.31.144 -> 172.31.23.72 OpenFlow 187 Type: OFPT_PACKET_OUT
 99 0.311195199 172.31.31.144 -> 172.31.23.72 TCP 187 6633 → 45528 [PSH, ACK] Seq=1 Ack=1 Win=853 Len=121 TSval=1183512 TSecr=30004379
100 0.311257850 172.31.31.144 -> 172.31.23.72 TCP 187 6633 → 45528 [PSH, ACK] Seq=122 Ack=1 Win=853 Len=121 TSval=1183512 TSecr=30004379
101 0.311316610 172.31.31.144 -> 172.31.23.72 TCP 187 6633 → 45528 [PSH, ACK] Seq=243 Ack=1 Win=853 Len=121 TSval=1183512 TSecr=30004379
102 0.311326250 172.31.23.72 -> 172.31.31.144 TCP 66 45514 → 6633 [ACK] Seq=8633 Ack=1065 Win=213 Len=0 TSval=30005103 TSecr=1183512
103 0.311359820 172.31.31.144 -> 172.31.23.72 TCP 187 6633 → 45528 [PSH, ACK] Seq=364 Ack=1 Win=853 Len=121 TSval=1183512 TSecr=30004379
104 0.311410103 172.31.23.72 -> 172.31.31.144 OpenFlow 189 Type: OFPT_PACKET_IN
105 0.311430374 172.31.31.144 -> 172.31.23.72 OpenFlow 187 Type: OFPT_PACKET_OUT
106 0.311472291 172.31.31.144 -> 172.31.23.72 OpenFlow 187 Type: OFPT_PACKET_OUT
107 0.311478153 172.31.23.72 -> 172.31.31.144 OpenFlow 189 Type: OFPT_PACKET_IN
108 0.311509217 172.31.31.144 -> 172.31.23.72 OpenFlow 187 Type: OFPT_PACKET_OUT
109 0.311555842 172.31.31.144 -> 172.31.23.72 OpenFlow 187 Type: OFPT_PACKET_OUT
110 0.311639930 172.31.31.144 -> 172.31.23.72 TCP 66 6633 → 45528 [ACK] Seq=969 Ack=124 Win=853 Len=0 TSval=1183512 TSecr=30005103
111 0.311645609 172.31.31.144 -> 172.31.23.72 OpenFlow 187 Type: OFPT_PACKET_OUT
112 0.311718187 172.31.31.144 -> 172.31.23.72 OpenFlow 187 Type: OFPT_PACKET_OUT
113 0.311760236 172.31.31.144 -> 172.31.23.72 OpenFlow 187 Type: OFPT_PACKET_OUT
114 0.311820704 172.31.31.144 -> 172.31.23.72 OpenFlow 187 Type: OFPT_PACKET_OUT
115 0.311888909 172.31.31.144 -> 172.31.23.72 OpenFlow 187 Type: OFPT_PACKET_OUT
116 0.311894086 172.31.31.144 -> 172.31.23.72 OpenFlow 187 Type: OFPT_PACKET_OUT
117 0.311931702 172.31.31.144 -> 172.31.23.72 OpenFlow 187 Type: OFPT_PACKET_OUT
118 0.311961983 172.31.31.144 -> 172.31.23.72 OpenFlow 187 Type: OFPT_PACKET_OUT
119 0.311995611 172.31.23.72 -> 172.31.31.144 TCP 66 45528 → 6633 [ACK] Seq=247 Ack=1211 Win=213 Len=0 TSval=30005103 TSecr=1183512
120 0.312024396 172.31.31.144 -> 172.31.23.72 OpenFlow 187 Type: OFPT_PACKET_OUT
121 0.312063950 172.31.31.144 -> 172.31.23.72 OpenFlow 187 Type: OFPT_PACKET_OUT
122 0.312080689 172.31.23.72 -> 172.31.31.144 OpenFlow 189 Type: OFPT_PACKET_IN
123 0.312133360 172.31.31.144 -> 172.31.23.72 OpenFlow 187 Type: OFPT_PACKET_OUT
124 0.312139569 172.31.23.72 -> 172.31.31.144 OpenFlow 189 Type: OFPT_PACKET_IN
125 0.312179751 172.31.31.144 -> 172.31.23.72 OpenFlow 187 Type: OFPT_PACKET_OUT
126 0.312321552 172.31.31.144 -> 172.31.23.72 OpenFlow 187 Type: OFPT_PACKET_OUT
127 0.312326989 172.31.31.144 -> 172.31.23.72 OpenFlow 187 Type: OFPT_PACKET_OUT
128 0.312329089 172.31.31.144 -> 172.31.23.72 TCP 66 6633 → 45518 [ACK] Seq=1307 Ack=10324 Win=853 Len=0 TSval=1183512 TSecr=30005103
129 0.312354144 172.31.31.144 -> 172.31.23.72 OpenFlow 187 Type: OFPT_PACKET_OUT
130 0.312404456 172.31.31.144 -> 172.31.23.72 OpenFlow 187 Type: OFPT_PACKET_OUT
131 0.312467217 172.31.31.144 -> 172.31.23.72 TCP 66 6633 → 45518 [ACK] Seq=1307 Ack=10447 Win=853 Len=0 TSval=1183512 TSecr=30005103
132 0.312472167 172.31.31.144 -> 172.31.23.72 OpenFlow 187 Type: OFPT_PACKET_OUT
133 0.312511379 172.31.31.144 -> 172.31.23.72 OpenFlow 187 Type: OFPT_PACKET_OUT
134 0.312577603 172.31.31.144 -> 172.31.23.72 OpenFlow 187 Type: OFPT_PACKET_OUT
135 0.312617861 172.31.31.144 -> 172.31.23.72 OpenFlow 187 Type: OFPT_PACKET_OUT
136 0.312677430 172.31.23.72 -> 172.31.31.144 OpenFlow 189 Type: OFPT_PACKET_IN
137 0.312699586 172.31.31.144 -> 172.31.23.72 OpenFlow 187 Type: OFPT_PACKET_OUT
138 0.312713757 172.31.23.72 -> 172.31.31.144 OpenFlow 189 Type: OFPT_PACKET_IN
139 0.312757056 172.31.31.144 -> 172.31.23.72 OpenFlow 187 Type: OFPT_PACKET_OUT
140 0.312806762 172.31.31.144 -> 172.31.23.72 TCP 187 6633 → 45538 [PSH, ACK] Seq=1 Ack=1 Win=853 Len=121 TSval=1183512 TSecr=30004379
141 0.312826793 172.31.31.144 -> 172.31.23.72 TCP 187 6633 → 45538 [PSH, ACK] Seq=122 Ack=1 Win=853 Len=121 TSval=1183512 TSecr=30004379
142 0.312921161 172.31.31.144 -> 172.31.23.72 TCP 66 6633 → 45512 [ACK] Seq=1307 Ack=9492 Win=853 Len=0 TSval=1183512 TSecr=30005104
143 0.312926776 172.31.31.144 -> 172.31.23.72 TCP 187 6633 → 45538 [PSH, ACK] Seq=243 Ack=1 Win=853 Len=121 TSval=1183512 TSecr=30004379
144 0.312928626 172.31.31.144 -> 172.31.23.72 TCP 66 6633 → 45512 [ACK] Seq=1307 Ack=9615 Win=853 Len=0 TSval=1183512 TSecr=30005104
145 0.312951766 172.31.31.144 -> 172.31.23.72 TCP 187 6633 → 45538 [PSH, ACK] Seq=364 Ack=1 Win=853 Len=121 TSval=1183512 TSecr=30004379
146 0.312992582 172.31.31.144 -> 172.31.23.72 TCP 187 6633 → 45538 [PSH, ACK] Seq=485 Ack=1 Win=853 Len=121 TSval=1183512 TSecr=30004379
147 0.313048116 172.31.31.144 -> 172.31.23.72 TCP 187 6633 → 45538 [PSH, ACK] Seq=606 Ack=1 Win=853 Len=121 TSval=1183512 TSecr=30004379
148 0.313104299 172.31.31.144 -> 172.31.23.72 TCP 187 6633 → 45538 [PSH, ACK] Seq=727 Ack=1 Win=853 Len=121 TSval=1183512 TSecr=30004379
149 0.313160993 172.31.31.144 -> 172.31.23.72 TCP 187 6633 → 45538 [PSH, ACK] Seq=848 Ack=1 Win=853 Len=121 TSval=1183512 TSecr=30004379
150 0.313230022 172.31.31.144 -> 172.31.23.72 TCP 187 6633 → 45538 [PSH, ACK] Seq=969 Ack=1 Win=853 Len=121 TSval=1183512 TSecr=30004379
151 0.313259764 172.31.31.144 -> 172.31.23.72 TCP 187 6633 → 45538 [PSH, ACK] Seq=1090 Ack=1 Win=853 Len=121 TSval=1183512 TSecr=30004379
152 0.313265453 172.31.23.72 -> 172.31.31.144 OpenFlow 189 Type: OFPT_PACKET_IN
153 0.313288210 172.31.23.72 -> 172.31.31.144 OpenFlow 189 Type: OFPT_PACKET_IN
154 0.313492740 172.31.31.144 -> 172.31.23.72 TCP 66 6633 → 45538 [ACK] Seq=1211 Ack=124 Win=853 Len=0 TSval=1183513 TSecr=30005104
155 0.313497975 172.31.31.144 -> 172.31.23.72 TCP 66 6633 → 45538 [ACK] Seq=1211 Ack=247 Win=853 Len=0 TSval=1183513 TSecr=30005104
156 0.313692722 172.31.23.72 -> 172.31.31.144 OpenFlow 189 Type: OFPT_PACKET_IN
157 0.313716665 172.31.23.72 -> 172.31.31.144 OpenFlow 435 Type: OFPT_PACKET_IN
158 0.313728883 172.31.23.72 -> 172.31.31.144 OpenFlow 189 Type: OFPT_PACKET_IN
159 0.313745822 172.31.23.72 -> 172.31.31.144 OpenFlow 189 Type: OFPT_PACKET_IN
160 0.313769715 172.31.23.72 -> 172.31.31.144 OpenFlow 189 Type: OFPT_PACKET_IN
161 0.313771946 172.31.23.72 -> 172.31.31.144 OpenFlow 435 Type: OFPT_PACKET_IN
162 0.313793638 172.31.23.72 -> 172.31.31.144 OpenFlow 189 Type: OFPT_PACKET_IN
163 0.313809645 172.31.23.72 -> 172.31.31.144 OpenFlow 189 Type: OFPT_PACKET_IN
164 0.313814989 172.31.23.72 -> 172.31.31.144 OpenFlow 681 Type: OFPT_PACKET_IN
165 0.313829498 172.31.23.72 -> 172.31.31.144 OpenFlow 189 Type: OFPT_PACKET_IN
166 0.313851086 172.31.23.72 -> 172.31.31.144 OpenFlow 189 Type: OFPT_PACKET_IN
167 0.313853547 172.31.23.72 -> 172.31.31.144 OpenFlow 189 Type: OFPT_PACKET_IN
168 0.313866170 172.31.23.72 -> 172.31.31.144 OpenFlow 189 Type: OFPT_PACKET_IN
169 0.313880058 172.31.23.72 -> 172.31.31.144 OpenFlow 189 Type: OFPT_PACKET_IN
170 0.313882065 172.31.23.72 -> 172.31.31.144 OpenFlow 435 Type: OFPT_PACKET_IN
171 0.313897388 172.31.23.72 -> 172.31.31.144 OpenFlow 189 Type: OFPT_PACKET_IN
172 0.313910080 172.31.23.72 -> 172.31.31.144 OpenFlow 189 Type: OFPT_PACKET_IN
173 0.313928839 172.31.23.72 -> 172.31.31.144 OpenFlow 189 Type: OFPT_PACKET_IN
174 0.313957297 172.31.23.72 -> 172.31.31.144 OpenFlow 189 Type: OFPT_PACKET_IN
175 0.314062352 172.31.23.72 -> 172.31.31.144 OpenFlow 189 Type: OFPT_PACKET_IN
176 0.314066011 172.31.23.72 -> 172.31.31.144 OpenFlow 189 Type: OFPT_PACKET_IN
177 0.314082957 172.31.23.72 -> 172.31.31.144 OpenFlow 189 Type: OFPT_PACKET_IN
178 0.314085322 172.31.23.72 -> 172.31.31.144 OpenFlow 189 Type: OFPT_PACKET_IN
179 0.314098489 172.31.23.72 -> 172.31.31.144 OpenFlow 189 Type: OFPT_PACKET_IN
180 0.314101012 172.31.23.72 -> 172.31.31.144 OpenFlow 189 Type: OFPT_PACKET_IN
181 0.314363145 172.31.31.144 -> 172.31.23.72 TCP 66 6633 → 45544 [ACK] Seq=1 Ack=124 Win=853 Len=0 TSval=1183513 TSecr=30005104
182 0.314369329 172.31.31.144 -> 172.31.23.72 TCP 66 6633 → 45524 [ACK] Seq=1 Ack=124 Win=853 Len=0 TSval=1183513 TSecr=30005104
183 0.314371333 172.31.31.144 -> 172.31.23.72 TCP 66 6633 → 45522 [ACK] Seq=97 Ack=7188 Win=853 Len=0 TSval=1183513 TSecr=30005097
184 0.314373380 172.31.31.144 -> 172.31.23.72 TCP 66 6633 → 45544 [ACK] Seq=1 Ack=493 Win=853 Len=0 TSval=1183513 TSecr=30005104
185 0.314375194 172.31.31.144 -> 172.31.23.72 TCP 66 6633 → 45532 [ACK] Seq=1 Ack=493 Win=853 Len=0 TSval=1183513 TSecr=30005104
186 0.314377133 172.31.31.144 -> 172.31.23.72 TCP 66 6633 → 45524 [ACK] Seq=1 Ack=739 Win=853 Len=0 TSval=1183513 TSecr=30005104
187 0.314379067 172.31.31.144 -> 172.31.23.72 TCP 66 6633 → 45550 [ACK] Seq=1 Ack=124 Win=853 Len=0 TSval=1183513 TSecr=30005104
188 0.314381079 172.31.31.144 -> 172.31.23.72 TCP 66 6633 → 45508 [ACK] Seq=97 Ack=8644 Win=853 Len=0 TSval=1183513 TSecr=30005104
189 0.314384419 172.31.23.72 -> 172.31.31.144 OpenFlow 189 Type: OFPT_PACKET_IN
190 0.314393277 172.31.23.72 -> 172.31.31.144 OpenFlow 435 Type: OFPT_PACKET_IN
191 0.314395068 172.31.23.72 -> 172.31.31.144 OpenFlow 189 Type: OFPT_PACKET_IN
192 0.314396629 172.31.23.72 -> 172.31.31.144 OpenFlow 681 Type: OFPT_PACKET_IN
193 0.314398357 172.31.23.72 -> 172.31.31.144 OpenFlow 435 Type: OFPT_PACKET_IN
194 0.314633530 172.31.23.72 -> 172.31.31.144 OpenFlow 435 Type: OFPT_PACKET_IN
195 0.314641320 172.31.23.72 -> 172.31.31.144 OpenFlow 435 Type: OFPT_PACKET_IN
196 0.314643004 172.31.23.72 -> 172.31.31.144 OpenFlow 189 Type: OFPT_PACKET_IN
197 0.314644671 172.31.23.72 -> 172.31.31.144 OpenFlow 189 Type: OFPT_PACKET_IN
198 0.314733873 172.31.31.144 -> 172.31.23.72 TCP 66 6633 → 45510 [ACK] Seq=97 Ack=9957 Win=853 Len=0 TSval=1183513 TSecr=30005104
199 0.314737085 172.31.31.144 -> 172.31.23.72 TCP 66 6633 → 45542 [ACK] Seq=1 Ack=124 Win=853 Len=0 TSval=1183513 TSecr=30005104
200 0.314738845 172.31.31.144 -> 172.31.23.72 TCP 66 6633 → 45536 [ACK] Seq=1 Ack=124 Win=853 Len=0 TSval=1183513 TSecr=30005104
201 0.314740546 172.31.31.144 -> 172.31.23.72 TCP 66 6633 → 45520 [ACK] Seq=97 Ack=8868 Win=853 Len=0 TSval=1183513 TSecr=30005104
202 0.314742323 172.31.31.144 -> 172.31.23.72 TCP 66 6633 → 45516 [ACK] Seq=97 Ack=7604 Win=853 Len=0 TSval=1183513 TSecr=30005104
203 0.314744439 172.31.31.144 -> 172.31.23.72 TCP 66 6633 → 45530 [ACK] Seq=969 Ack=124 Win=853 Len=0 TSval=1183513 TSecr=30005104
204 0.314746069 172.31.31.144 -> 172.31.23.72 TCP 66 6633 → 45540 [ACK] Seq=1 Ack=247 Win=853 Len=0 TSval=1183513 TSecr=30005104
205 0.314747958 172.31.31.144 -> 172.31.23.72 TCP 66 6633 → 45514 [ACK] Seq=1065 Ack=8756 Win=853 Len=0 TSval=1183513 TSecr=30005104
206 0.314749712 172.31.31.144 -> 172.31.23.72 TCP 66 6633 → 45526 [ACK] Seq=1 Ack=247 Win=853 Len=0 TSval=1183513 TSecr=30005104
207 0.315125826 172.31.31.144 -> 172.31.23.72 TCP 66 6633 → 45550 [ACK] Seq=1 Ack=247 Win=853 Len=0 TSval=1183513 TSecr=30005104
208 0.315128081 172.31.31.144 -> 172.31.23.72 TCP 66 6633 → 45508 [ACK] Seq=97 Ack=8767 Win=853 Len=0 TSval=1183513 TSecr=30005104
209 0.315129761 172.31.31.144 -> 172.31.23.72 TCP 66 6633 → 45542 [ACK] Seq=1 Ack=247 Win=853 Len=0 TSval=1183513 TSecr=30005104
210 0.315131231 172.31.31.144 -> 172.31.23.72 TCP 66 6633 → 45548 [ACK] Seq=1 Ack=493 Win=853 Len=0 TSval=1183513 TSecr=30005104
211 0.315133329 172.31.31.144 -> 172.31.23.72 TCP 66 6633 → 45536 [ACK] Seq=1 Ack=739 Win=853 Len=0 TSval=1183513 TSecr=30005104
212 0.315135463 172.31.31.144 -> 172.31.23.72 TCP 66 6633 → 45520 [ACK] Seq=97 Ack=9237 Win=853 Len=0 TSval=1183513 TSecr=30005104
213 0.315136909 172.31.31.144 -> 172.31.23.72 TCP 66 6633 → 45516 [ACK] Seq=97 Ack=7973 Win=853 Len=0 TSval=1183513 TSecr=30005104
214 0.315138514 172.31.31.144 -> 172.31.23.72 TCP 66 6633 → 45530 [ACK] Seq=969 Ack=493 Win=853 Len=0 TSval=1183513 TSecr=30005104
215 0.315251211 172.31.31.144 -> 172.31.23.72 TCP 66 6633 → 45514 [ACK] Seq=1065 Ack=8879 Win=853 Len=0 TSval=1183513 TSecr=30005104
216 0.315253559 172.31.31.144 -> 172.31.23.72 TCP 66 6633 → 45528 [ACK] Seq=1211 Ack=493 Win=853 Len=0 TSval=1183513 TSecr=30005104
217 0.328363891 172.31.31.144 -> 172.31.23.72 OpenFlow 122 Type: OFPT_MULTIPART_REQUEST, OFPMP_FLOW
218 0.328370195 172.31.31.144 -> 172.31.23.72 OpenFlow 106 Type: OFPT_MULTIPART_REQUEST, OFPMP_PORT_STATS
219 0.328540219 172.31.23.72 -> 172.31.31.144 OpenFlow 3466 Type: OFPT_MULTIPART_REPLY, OFPMP_FLOW
220 0.328710463 172.31.23.72 -> 172.31.31.144 OpenFlow 6178 Type: OFPT_MULTIPART_REPLY, OFPMP_TABLE
221 0.328826250 172.31.23.72 -> 172.31.31.144 OpenFlow 754 Type: OFPT_MULTIPART_REPLY, OFPMP_PORT_STATS
222 0.328953754 172.31.31.144 -> 172.31.23.72 TCP 66 6633 → 45524 [ACK] Seq=97 Ack=10251 Win=853 Len=0 TSval=1183516 TSecr=30005107
223 0.348670828 172.31.23.72 -> 172.31.31.144 TCP 66 45518 → 6633 [ACK] Seq=10447 Ack=1307 Win=213 Len=0 TSval=30005113 TSecr=1183512
224 0.352665183 172.31.23.72 -> 172.31.31.144 TCP 66 45512 → 6633 [ACK] Seq=9615 Ack=1307 Win=213 Len=0 TSval=30005114 TSecr=1183512
225 0.353445016 172.31.31.144 -> 172.31.23.72 TCP 66 6633 → 45522 [ACK] Seq=97 Ack=7311 Win=853 Len=0 TSval=1183523 TSecr=30005104
226 0.365439503 172.31.31.144 -> 172.31.23.72 TCP 66 6633 → 45524 [ACK] Seq=97 Ack=10939 Win=853 Len=0 TSval=1183526 TSecr=30005108
227 0.370487861 172.31.31.144 -> 172.31.23.72 OpenFlow 82 Type: OFPT_MULTIPART_REQUEST, OFPMP_TABLE
228 0.370494339 172.31.31.144 -> 172.31.23.72 OpenFlow 146 Type: OFPT_MULTIPART_REQUEST, OFPMP_FLOW
229 0.370806969 172.31.23.72 -> 172.31.31.144 OpenFlow 6178 Type: OFPT_MULTIPART_REPLY, OFPMP_TABLE
230 0.370911854 172.31.23.72 -> 172.31.31.144 OpenFlow 642 Type: OFPT_MULTIPART_REPLY, OFPMP_PORT_STATS
231 0.370989524 172.31.23.72 -> 172.31.31.144 OpenFlow 1802 Type: OFPT_MULTIPART_REPLY, OFPMP_FLOW
232 0.371125144 172.31.31.144 -> 172.31.23.72 TCP 66 6633 → 45526 [ACK] Seq=97 Ack=6935 Win=853 Len=0 TSval=1183527 TSecr=30005118
233 0.383386582 172.31.23.72 -> 172.31.31.144 OpenFlow 146 Type: OFPT_PORT_STATUS
234 0.383450577 172.31.23.72 -> 172.31.31.144 OpenFlow 146 Type: OFPT_PORT_STATUS
235 0.383609735 172.31.31.144 -> 172.31.23.72 TCP 66 6633 → 45524 [ACK] Seq=97 Ack=11019 Win=853 Len=0 TSval=1183530 TSecr=30005121
236 0.383665011 172.31.31.144 -> 172.31.23.72 TCP 66 6633 → 45526 [ACK] Seq=97 Ack=8751 Win=853 Len=0 TSval=1183530 TSecr=30005118
237 0.408414065 172.31.31.144 -> 172.31.23.72 OpenFlow 146 Type: OFPT_FLOW_MOD
238 0.408424082 172.31.31.144 -> 172.31.23.72 TCP 146 6633 → 45552 [PSH, ACK] Seq=1 Ack=1 Win=853 Len=80 TSval=1183536 TSecr=30004379
239 0.408429045 172.31.31.144 -> 172.31.23.72 TCP 154 6633 → 45552 [PSH, ACK] Seq=81 Ack=1 Win=853 Len=88 TSval=1183536 TSecr=30004379
240 0.408431976 172.31.31.144 -> 172.31.23.72 OpenFlow 154 Type: OFPT_BARRIER_REQUEST
241 0.408433795 172.31.31.144 -> 172.31.23.72 OpenFlow 146 Type: OFPT_FLOW_MOD
242 0.408440092 172.31.23.72 -> 172.31.31.144 TCP 66 45540 → 6633 [ACK] Seq=247 Ack=81 Win=213 Len=0 TSval=30005127 TSecr=1183536
243 0.408445201 172.31.31.144 -> 172.31.23.72 OpenFlow 146 Type: OFPT_FLOW_MOD
244 0.408448016 172.31.31.144 -> 172.31.23.72 OpenFlow 146 Type: OFPT_FLOW_MOD
245 0.408450956 172.31.31.144 -> 172.31.23.72 OpenFlow 154 Type: OFPT_BARRIER_REQUEST
246 0.408453434 172.31.23.72 -> 172.31.31.144 TCP 66 45540 → 6633 [ACK] Seq=247 Ack=169 Win=213 Len=0 TSval=30005127 TSecr=1183536
247 0.408457593 172.31.31.144 -> 172.31.23.72 OpenFlow 154 Type: OFPT_BARRIER_REQUEST
248 0.408459511 172.31.31.144 -> 172.31.23.72 OpenFlow 146 Type: OFPT_FLOW_MOD
249 0.408462099 172.31.31.144 -> 172.31.23.72 OpenFlow 322 Type: OFPT_BARRIER_REQUEST
250 0.408464236 172.31.31.144 -> 172.31.23.72 OpenFlow 146 Type: OFPT_FLOW_MOD
251 0.408466144 172.31.31.144 -> 172.31.23.72 OpenFlow 154 Type: OFPT_BARRIER_REQUEST
252 0.408468093 172.31.31.144 -> 172.31.23.72 TCP 146 6633 → 45554 [PSH, ACK] Seq=1 Ack=1 Win=853 Len=80 TSval=1183536 TSecr=30004379
253 0.408470862 172.31.31.144 -> 172.31.23.72 OpenFlow 146 Type: OFPT_FLOW_MOD
254 0.408472666 172.31.31.144 -> 172.31.23.72 OpenFlow 146 Type: OFPT_FLOW_MOD
255 0.408474440 172.31.31.144 -> 172.31.23.72 TCP 146 6633 → 45554 [PSH, ACK] Seq=81 Ack=1 Win=853 Len=80 TSval=1183536 TSecr=30004379
256 0.408475954 172.31.31.144 -> 172.31.23.72 OpenFlow 74 Type: OFPT_BARRIER_REQUEST
257 0.408477432 172.31.31.144 -> 172.31.23.72 OpenFlow 146 Type: OFPT_FLOW_MOD
258 0.408480490 172.31.23.72 -> 172.31.31.144 TCP 66 45512 → 6633 [ACK] Seq=9615 Ack=1387 Win=213 Len=0 TSval=30005127 TSecr=1183536
259 0.408481943 172.31.31.144 -> 172.31.23.72 OpenFlow 146 Type: OFPT_FLOW_MOD
260 0.408484443 172.31.31.144 -> 172.31.23.72 OpenFlow 146 Type: OFPT_FLOW_MOD
261 0.408486478 172.31.31.144 -> 172.31.23.72 OpenFlow 154 Type: OFPT_BARRIER_REQUEST
262 0.408488222 172.31.23.72 -> 172.31.31.144 TCP 66 45512 → 6633 [ACK] Seq=9615 Ack=1475 Win=213 Len=0 TSval=30005127 TSecr=1183536
263 0.408489485 172.31.31.144 -> 172.31.23.72 TCP 74 6633 → 45554 [PSH, ACK] Seq=161 Ack=1 Win=853 Len=8 TSval=1183536 TSecr=30004379
264 0.408490870 172.31.31.144 -> 172.31.23.72 OpenFlow 154 Type: OFPT_BARRIER_REQUEST
265 0.408492344 172.31.31.144 -> 172.31.23.72 OpenFlow 146 Type: OFPT_FLOW_MOD
266 0.408493867 172.31.31.144 -> 172.31.23.72 OpenFlow 154 Type: OFPT_FLOW_MOD
267 0.408495410 172.31.31.144 -> 172.31.23.72 TCP 146 6633 → 45552 [PSH, ACK] Seq=169 Ack=1 Win=853 Len=80 TSval=1183536 TSecr=30004379
268 0.408497152 172.31.31.144 -> 172.31.23.72 OpenFlow 154 Type: OFPT_BARRIER_REQUEST
269 0.408498743 172.31.31.144 -> 172.31.23.72 TCP 146 6633 → 45552 [PSH, ACK] Seq=249 Ack=1 Win=853 Len=80 TSval=1183536 TSecr=30004379
270 0.408500096 172.31.31.144 -> 172.31.23.72 OpenFlow 154 Type: OFPT_BARRIER_REQUEST
271 0.408501820 172.31.31.144 -> 172.31.23.72 OpenFlow 146 Type: OFPT_FLOW_MOD
272 0.408507369 172.31.31.144 -> 172.31.23.72 TCP 74 6633 → 45552 [PSH, ACK] Seq=329 Ack=1 Win=853 Len=8 TSval=1183536 TSecr=30004379
273 0.408508928 172.31.31.144 -> 172.31.23.72 OpenFlow 146 Type: OFPT_FLOW_MOD
274 0.408510724 172.31.23.72 -> 172.31.31.144 TCP 66 45512 → 6633 [ACK] Seq=9615 Ack=1555 Win=213 Len=0 TSval=30005127 TSecr=1183536
275 0.408512686 172.31.31.144 -> 172.31.23.72 OpenFlow 322 Type: OFPT_BARRIER_REQUEST
276 0.408514500 172.31.31.144 -> 172.31.23.72 OpenFlow 154 Type: OFPT_BARRIER_REQUEST
277 0.408516292 172.31.23.72 -> 172.31.31.144 TCP 66 45512 → 6633 [ACK] Seq=9615 Ack=1643 Win=213 Len=0 TSval=30005127 TSecr=1183536
278 0.408517618 172.31.31.144 -> 172.31.23.72 OpenFlow 146 Type: OFPT_FLOW_MOD
279 0.408519136 172.31.31.144 -> 172.31.23.72 OpenFlow 146 Type: OFPT_FLOW_MOD
280 0.408520930 172.31.31.144 -> 172.31.23.72 OpenFlow 146 Type: OFPT_FLOW_MOD
281 0.408522379 172.31.23.72 -> 172.31.31.144 TCP 66 45540 → 6633 [ACK] Seq=247 Ack=249 Win=213 Len=0 TSval=30005127 TSecr=1183536
282 0.408523669 172.31.31.144 -> 172.31.23.72 OpenFlow 146 Type: OFPT_FLOW_MOD
283 0.408525067 172.31.31.144 -> 172.31.23.72 OpenFlow 154 Type: OFPT_BARRIER_REQUEST
284 0.408526760 172.31.23.72 -> 172.31.31.144 TCP 66 45540 → 6633 [ACK] Seq=247 Ack=337 Win=213 Len=0 TSval=30005127 TSecr=1183536
285 0.408528231 172.31.31.144 -> 172.31.23.72 OpenFlow 154 Type: OFPT_BARRIER_REQUEST
286 0.408530193 172.31.31.144 -> 172.31.23.72 OpenFlow 146 Type: OFPT_FLOW_MOD
287 0.408531882 172.31.23.72 -> 172.31.31.144 TCP 66 45512 → 6633 [ACK] Seq=9615 Ack=1723 Win=213 Len=0 TSval=30005127 TSecr=1183536
288 0.408533283 172.31.31.144 -> 172.31.23.72 OpenFlow 146 Type: OFPT_FLOW_MOD
289 0.408535040 172.31.31.144 -> 172.31.23.72 OpenFlow 146 Type: OFPT_FLOW_MOD
290 0.408537115 172.31.23.72 -> 172.31.31.144 TCP 66 45540 → 6633 [ACK] Seq=247 Ack=417 Win=213 Len=0 TSval=30005127 TSecr=1183536
291 0.408538662 172.31.31.144 -> 172.31.23.72 OpenFlow 154 Type: OFPT_BARRIER_REQUEST
292 0.408540694 172.31.23.72 -> 172.31.31.144 TCP 66 45512 → 6633 [ACK] Seq=9615 Ack=1811 Win=213 Len=0 TSval=30005127 TSecr=1183536
293 0.408542310 172.31.31.144 -> 172.31.23.72 OpenFlow 146 Type: OFPT_FLOW_MOD
294 0.408544527 172.31.31.144 -> 172.31.23.72 OpenFlow 146 Type: OFPT_FLOW_MOD
295 0.408546065 172.31.31.144 -> 172.31.23.72 OpenFlow 154 Type: OFPT_BARRIER_REQUEST
296 0.408547617 172.31.23.72 -> 172.31.31.144 TCP 66 45540 → 6633 [ACK] Seq=247 Ack=505 Win=213 Len=0 TSval=30005127 TSecr=1183536
297 0.408551486 172.31.31.144 -> 172.31.23.72 OpenFlow 146 Type: OFPT_FLOW_MOD
298 0.408554110 172.31.31.144 -> 172.31.23.72 OpenFlow 74 Type: OFPT_BARRIER_REQUEST
299 0.408555712 172.31.31.144 -> 172.31.23.72 OpenFlow 234 Type: OFPT_BARRIER_REQUEST
300 0.408557359 172.31.31.144 -> 172.31.23.72 OpenFlow 242 Type: OFPT_BARRIER_REQUEST
301 0.408558855 172.31.31.144 -> 172.31.23.72 OpenFlow 154 Type: OFPT_BARRIER_REQUEST
302 0.408560904 172.31.31.144 -> 172.31.23.72 OpenFlow 146 Type: OFPT_FLOW_MOD
303 0.408562445 172.31.31.144 -> 172.31.23.72 OpenFlow 146 Type: OFPT_FLOW_MOD
304 0.408563658 172.31.31.144 -> 172.31.23.72 OpenFlow 234 Type: OFPT_FLOW_MOD
305 0.408564800 172.31.31.144 -> 172.31.23.72 OpenFlow 146 Type: OFPT_FLOW_MOD
306 0.408567100 172.31.31.144 -> 172.31.23.72 OpenFlow 146 Type: OFPT_FLOW_MOD
307 0.408570380 172.31.23.72 -> 172.31.31.144 TCP 66 45518 → 6633 [ACK] Seq=10447 Ack=1387 Win=213 Len=0 TSval=30005127 TSecr=1183536
308 0.408572062 172.31.31.144 -> 172.31.23.72 OpenFlow 154 Type: OFPT_BARRIER_REQUEST
309 0.408573945 172.31.31.144 -> 172.31.23.72 OpenFlow 146 Type: OFPT_FLOW_MOD
310 0.408575839 172.31.31.144 -> 172.31.23.72 OpenFlow 234 Type: OFPT_FLOW_MOD
311 0.408577749 172.31.23.72 -> 172.31.31.144 TCP 66 45518 → 6633 [ACK] Seq=10447 Ack=1555 Win=213 Len=0 TSval=30005127 TSecr=1183536
312 0.408578944 172.31.31.144 -> 172.31.23.72 OpenFlow 146 Type: OFPT_FLOW_MOD
313 0.408580448 172.31.31.144 -> 172.31.23.72 TCP 146 6633 → 45552 [PSH, ACK] Seq=337 Ack=1 Win=853 Len=80 TSval=1183536 TSecr=30004379
314 0.408585737 172.31.31.144 -> 172.31.23.72 OpenFlow 146 Type: OFPT_FLOW_MOD
315 0.408587651 172.31.23.72 -> 172.31.31.144 TCP 66 45518 → 6633 [ACK] Seq=10447 Ack=1635 Win=213 Len=0 TSval=30005127 TSecr=1183536
316 0.408610655 172.31.31.144 -> 172.31.23.72 OpenFlow 146 Type: OFPT_FLOW_MOD
317 0.408613168 172.31.31.144 -> 172.31.23.72 TCP 146 6633 → 45554 [PSH, ACK] Seq=169 Ack=1 Win=853 Len=80 TSval=1183536 TSecr=30004379
318 0.408615351 172.31.31.144 -> 172.31.23.72 OpenFlow 154 Type: OFPT_BARRIER_REQUEST
319 0.408616880 172.31.31.144 -> 172.31.23.72 OpenFlow 242 Type: OFPT_BARRIER_REQUEST
320 0.408619275 172.31.23.72 -> 172.31.31.144 TCP 66 45518 → 6633 [ACK] Seq=10447 Ack=1811 Win=213 Len=0 TSval=30005127 TSecr=1183536
321 0.408621071 172.31.31.144 -> 172.31.23.72 TCP 146 6633 → 45534 [PSH, ACK] Seq=727 Ack=1 Win=853 Len=80 TSval=1183536 TSecr=30005103
322 0.408624246 172.31.31.144 -> 172.31.23.72 TCP 154 6633 → 45552 [PSH, ACK] Seq=417 Ack=1 Win=853 Len=88 TSval=1183536 TSecr=30004379
323 0.408625667 172.31.31.144 -> 172.31.23.72 TCP 322 6633 → 45554 [PSH, ACK] Seq=249 Ack=1 Win=853 Len=256 TSval=1183536 TSecr=30004379
324 0.408627256 172.31.31.144 -> 172.31.23.72 OpenFlow 74 Type: OFPT_BARRIER_REQUEST
325 0.408628780 172.31.31.144 -> 172.31.23.72 TCP 234 6633 → 45554 [PSH, ACK] Seq=505 Ack=1 Win=853 Len=168 TSval=1183536 TSecr=30004379
326 0.408638492 172.31.31.144 -> 172.31.23.72 TCP 658 6633 → 45534 [PSH, ACK] Seq=807 Ack=1 Win=853 Len=592 TSval=1183536 TSecr=30005103
327 0.408640941 172.31.31.144 -> 172.31.23.72 OpenFlow 146 Type: OFPT_FLOW_MOD
328 0.408642741 172.31.31.144 -> 172.31.23.72 OpenFlow 146 Type: OFPT_FLOW_MOD
329 0.408645215 172.31.31.144 -> 172.31.23.72 OpenFlow 322 Type: OFPT_BARRIER_REQUEST
330 0.408647315 172.31.31.144 -> 172.31.23.72 OpenFlow 322 Type: OFPT_BARRIER_REQUEST
331 0.408760085 172.31.23.72 -> 172.31.31.144 OpenFlow 74 Type: OFPT_BARRIER_REPLY
332 0.408811696 172.31.23.72 -> 172.31.31.144 OpenFlow 74 Type: OFPT_BARRIER_REPLY
333 0.408841955 172.31.23.72 -> 172.31.31.144 OpenFlow 74 Type: OFPT_BARRIER_REPLY
334 0.408913571 172.31.23.72 -> 172.31.31.144 OpenFlow 74 Type: OFPT_BARRIER_REPLY
335 0.408958176 172.31.23.72 -> 172.31.31.144 OpenFlow 74 Type: OFPT_BARRIER_REPLY
336 0.408994037 172.31.23.72 -> 172.31.31.144 OpenFlow 74 Type: OFPT_BARRIER_REPLY
337 0.409054210 172.31.23.72 -> 172.31.31.144 OpenFlow 74 Type: OFPT_BARRIER_REPLY
338 0.409082784 172.31.23.72 -> 172.31.31.144 OpenFlow 74 Type: OFPT_BARRIER_REPLY
339 0.409085957 172.31.23.72 -> 172.31.31.144 OpenFlow 90 Type: OFPT_BARRIER_REPLY
340 0.409120299 172.31.23.72 -> 172.31.31.144 OpenFlow 74 Type: OFPT_BARRIER_REPLY
341 0.409122685 172.31.23.72 -> 172.31.31.144 OpenFlow 74 Type: OFPT_BARRIER_REPLY
342 0.409124482 172.31.23.72 -> 172.31.31.144 OpenFlow 82 Type: OFPT_BARRIER_REPLY
343 0.409174780 172.31.23.72 -> 172.31.31.144 OpenFlow 74 Type: OFPT_BARRIER_REPLY
344 0.409181357 172.31.23.72 -> 172.31.31.144 OpenFlow 82 Type: OFPT_BARRIER_REPLY
345 0.409183101 172.31.23.72 -> 172.31.31.144 OpenFlow 82 Type: OFPT_BARRIER_REPLY
346 0.409226369 172.31.23.72 -> 172.31.31.144 OpenFlow 74 Type: OFPT_BARRIER_REPLY
347 0.409228589 172.31.23.72 -> 172.31.31.144 OpenFlow 90 Type: OFPT_BARRIER_REPLY
348 0.409264695 172.31.23.72 -> 172.31.31.144 TCP 66 45508 → 6633 [ACK] Seq=8767 Ack=265 Win=213 Len=0 TSval=30005128 TSecr=1183536
349 0.409267017 172.31.23.72 -> 172.31.31.144 OpenFlow 74 Type: OFPT_BARRIER_REPLY
350 0.409271268 172.31.23.72 -> 172.31.31.144 OpenFlow 74 Type: OFPT_BARRIER_REPLY
351 0.409293387 172.31.23.72 -> 172.31.31.144 OpenFlow 74 Type: OFPT_BARRIER_REPLY
352 0.409353432 172.31.23.72 -> 172.31.31.144 OpenFlow 74 Type: OFPT_BARRIER_REPLY
353 0.409355886 172.31.23.72 -> 172.31.31.144 OpenFlow 82 Type: OFPT_BARRIER_REPLY
354 0.409393259 172.31.23.72 -> 172.31.31.144 TCP 66 45516 → 6633 [ACK] Seq=7973 Ack=265 Win=213 Len=0 TSval=30005128 TSecr=1183536
355 0.409395518 172.31.23.72 -> 172.31.31.144 OpenFlow 98 Type: OFPT_BARRIER_REPLY
356 0.409399785 172.31.23.72 -> 172.31.31.144 OpenFlow 74 Type: OFPT_BARRIER_REPLY
357 0.409457661 172.31.31.144 -> 172.31.23.72 TCP 66 6633 → 45534 [ACK] Seq=1399 Ack=9 Win=853 Len=0 TSval=1183536 TSecr=30005128
358 0.409463899 172.31.31.144 -> 172.31.23.72 TCP 66 6633 → 45514 [ACK] Seq=1401 Ack=8887 Win=853 Len=0 TSval=1183536 TSecr=30005128
359 0.409465807 172.31.31.144 -> 172.31.23.72 TCP 66 6633 → 45518 [ACK] Seq=1811 Ack=10455 Win=853 Len=0 TSval=1183536 TSecr=30005128
360 0.409467621 172.31.31.144 -> 172.31.23.72 TCP 66 6633 → 45512 [ACK] Seq=1811 Ack=9623 Win=853 Len=0 TSval=1183537 TSecr=30005128
361 0.409469476 172.31.31.144 -> 172.31.23.72 OpenFlow 410 Type: OFPT_BARRIER_REQUEST
362 0.409586132 172.31.23.72 -> 172.31.31.144 OpenFlow 146 Type: OFPT_FLOW_REMOVED
363 0.409594756 172.31.23.72 -> 172.31.31.144 OpenFlow 90 Type: OFPT_BARRIER_REPLY
364 0.409616030 172.31.23.72 -> 172.31.31.144 OpenFlow 146 Type: OFPT_FLOW_REMOVED
365 0.409626287 172.31.23.72 -> 172.31.31.144 OpenFlow 146 Type: OFPT_FLOW_REMOVED
366 0.409643070 172.31.23.72 -> 172.31.31.144 OpenFlow 146 Type: OFPT_FLOW_REMOVED
367 0.410285471 172.31.23.72 -> 172.31.31.144 OpenFlow 546 Type: OFPT_FLOW_REMOVED
368 0.410288305 172.31.23.72 -> 172.31.31.144 OpenFlow 562 Type: OFPT_FLOW_REMOVED
369 0.410290206 172.31.23.72 -> 172.31.31.144 OpenFlow 866 Type: OFPT_FLOW_REMOVED
370 0.410291924 172.31.23.72 -> 172.31.31.144 OpenFlow 386 Type: OFPT_FLOW_REMOVED
371 0.410293687 172.31.23.72 -> 172.31.31.144 OpenFlow 226 Type: OFPT_FLOW_REMOVED
372 0.410295253 172.31.23.72 -> 172.31.31.144 OpenFlow 730 Type: OFPT_FLOW_REMOVED
373 0.410297157 172.31.23.72 -> 172.31.31.144 OpenFlow 730 Type: OFPT_FLOW_REMOVED
374 0.410298827 172.31.23.72 -> 172.31.31.144 OpenFlow 546 Type: OFPT_FLOW_REMOVED
375 0.410626435 172.31.31.144 -> 172.31.23.72 TCP 66 6633 → 45534 [ACK] Seq=1399 Ack=33 Win=853 Len=0 TSval=1183537 TSecr=30005128
376 0.410643846 172.31.23.72 -> 172.31.31.144 OpenFlow 626 Type: OFPT_FLOW_REMOVED
377 0.410646009 172.31.31.144 -> 172.31.23.72 OpenFlow 187 Type: OFPT_PACKET_OUT
378 0.410648600 172.31.31.144 -> 172.31.23.72 OpenFlow 322 Type: OFPT_BARRIER_REQUEST
379 0.410651398 172.31.23.72 -> 172.31.31.144 OpenFlow 946 Type: OFPT_FLOW_REMOVED
380 0.410657418 172.31.31.144 -> 172.31.23.72 OpenFlow 187 Type: OFPT_PACKET_OUT
