  1 0.000000000 172.31.31.144 -> 172.31.23.72 TCP 90 6633 → 33630 [PSH, ACK] Seq=1 Ack=1 Win=853 Len=24 TSval=1261811 TSecr=26100407
  2 0.000018605 172.31.31.144 -> 172.31.23.72 TCP 106 6633 → 33630 [PSH, ACK] Seq=25 Ack=1 Win=853 Len=40 TSval=1261811 TSecr=26100407
  3 0.003096133 172.31.23.72 -> 172.31.31.144 OpenFlow 82 Type: OFPT_MULTIPART_REPLY, OFPMP_GROUP
  4 0.003145211 172.31.23.72 -> 172.31.31.144 OpenFlow 98 Type: OFPT_MULTIPART_REPLY, OFPMP_METER
  5 0.003438686 172.31.31.144 -> 172.31.23.72 TCP 66 6633 → 33630 [ACK] Seq=65 Ack=49 Win=853 Len=0 TSval=1261812 TSecr=26100913
  6 0.100196486 172.31.31.144 -> 172.31.23.72 TCP 90 6633 → 33632 [PSH, ACK] Seq=1 Ack=1 Win=853 Len=24 TSval=1261836 TSecr=26100418
  7 0.100227999 172.31.31.144 -> 172.31.23.72 TCP 90 6633 → 33634 [PSH, ACK] Seq=1 Ack=1 Win=853 Len=24 TSval=1261836 TSecr=26100426
  8 0.100232000 172.31.31.144 -> 172.31.23.72 TCP 90 6633 → 33636 [PSH, ACK] Seq=1 Ack=1 Win=853 Len=24 TSval=1261836 TSecr=26100436
  9 0.100262137 172.31.31.144 -> 172.31.23.72 TCP 106 6633 → 33632 [PSH, ACK] Seq=25 Ack=1 Win=853 Len=40 TSval=1261836 TSecr=26100418
 10 0.100266742 172.31.31.144 -> 172.31.23.72 TCP 106 6633 → 33634 [PSH, ACK] Seq=25 Ack=1 Win=853 Len=40 TSval=1261836 TSecr=26100426
 11 0.100270897 172.31.31.144 -> 172.31.23.72 TCP 106 6633 → 33636 [PSH, ACK] Seq=25 Ack=1 Win=853 Len=40 TSval=1261836 TSecr=26100436
 12 0.100468671 172.31.23.72 -> 172.31.31.144 OpenFlow 82 Type: OFPT_MULTIPART_REPLY, OFPMP_GROUP
 13 0.100496854 172.31.23.72 -> 172.31.31.144 OpenFlow 98 Type: OFPT_MULTIPART_REPLY, OFPMP_METER
 14 0.100527270 172.31.23.72 -> 172.31.31.144 OpenFlow 82 Type: OFPT_MULTIPART_REPLY, OFPMP_GROUP
 15 0.100564232 172.31.23.72 -> 172.31.31.144 OpenFlow 98 Type: OFPT_MULTIPART_REPLY, OFPMP_METER
 16 0.100590991 172.31.23.72 -> 172.31.31.144 OpenFlow 82 Type: OFPT_MULTIPART_REPLY, OFPMP_GROUP
 17 0.100613547 172.31.23.72 -> 172.31.31.144 OpenFlow 98 Type: OFPT_MULTIPART_REPLY, OFPMP_METER
 18 0.100753660 172.31.31.144 -> 172.31.23.72 TCP 66 6633 → 33636 [ACK] Seq=65 Ack=17 Win=853 Len=0 TSval=1261836 TSecr=26100937
 19 0.100778398 172.31.31.144 -> 172.31.23.72 TCP 66 6633 → 33636 [ACK] Seq=65 Ack=49 Win=853 Len=0 TSval=1261836 TSecr=26100937
 20 0.100796001 172.31.31.144 -> 172.31.23.72 TCP 66 6633 → 33634 [ACK] Seq=65 Ack=17 Win=853 Len=0 TSval=1261836 TSecr=26100937
 21 0.100810388 172.31.31.144 -> 172.31.23.72 TCP 66 6633 → 33634 [ACK] Seq=65 Ack=49 Win=853 Len=0 TSval=1261836 TSecr=26100937
 22 0.100829037 172.31.31.144 -> 172.31.23.72 TCP 66 6633 → 33632 [ACK] Seq=65 Ack=17 Win=853 Len=0 TSval=1261836 TSecr=26100937
 23 0.100847791 172.31.31.144 -> 172.31.23.72 TCP 66 6633 → 33632 [ACK] Seq=65 Ack=49 Win=853 Len=0 TSval=1261836 TSecr=26100937
 24 0.200335102 172.31.31.144 -> 172.31.23.72 TCP 90 6633 → 33638 [PSH, ACK] Seq=1 Ack=1 Win=853 Len=24 TSval=1261861 TSecr=26100445
 25 0.200371119 172.31.31.144 -> 172.31.23.72 TCP 90 6633 → 33640 [PSH, ACK] Seq=1 Ack=1 Win=853 Len=24 TSval=1261861 TSecr=26100455
 26 0.200390407 172.31.31.144 -> 172.31.23.72 TCP 106 6633 → 33638 [PSH, ACK] Seq=25 Ack=1 Win=853 Len=40 TSval=1261861 TSecr=26100445
 27 0.200395002 172.31.31.144 -> 172.31.23.72 TCP 106 6633 → 33640 [PSH, ACK] Seq=25 Ack=1 Win=853 Len=40 TSval=1261861 TSecr=26100455
 28 0.200594841 172.31.23.72 -> 172.31.31.144 OpenFlow 82 Type: OFPT_MULTIPART_REPLY, OFPMP_GROUP
 29 0.200623546 172.31.23.72 -> 172.31.31.144 OpenFlow 98 Type: OFPT_MULTIPART_REPLY, OFPMP_METER
 30 0.200740686 172.31.23.72 -> 172.31.31.144 OpenFlow 82 Type: OFPT_MULTIPART_REPLY, OFPMP_GROUP
 31 0.200763993 172.31.23.72 -> 172.31.31.144 OpenFlow 98 Type: OFPT_MULTIPART_REPLY, OFPMP_METER
 32 0.200887477 172.31.31.144 -> 172.31.23.72 TCP 66 6633 → 33640 [ACK] Seq=65 Ack=17 Win=853 Len=0 TSval=1261861 TSecr=26100962
 33 0.200901159 172.31.31.144 -> 172.31.23.72 TCP 66 6633 → 33640 [ACK] Seq=65 Ack=49 Win=853 Len=0 TSval=1261861 TSecr=26100962
 34 0.200957680 172.31.31.144 -> 172.31.23.72 TCP 66 6633 → 33638 [ACK] Seq=65 Ack=17 Win=853 Len=0 TSval=1261861 TSecr=26100962
 35 0.201024869 172.31.31.144 -> 172.31.23.72 TCP 66 6633 → 33638 [ACK] Seq=65 Ack=49 Win=853 Len=0 TSval=1261861 TSecr=26100962
 36 0.299549275 172.31.31.144 -> 172.31.23.72 TCP 90 6633 → 33642 [PSH, ACK] Seq=1 Ack=1 Win=853 Len=24 TSval=1261886 TSecr=26100465
 37 0.299571875 172.31.31.144 -> 172.31.23.72 TCP 90 6633 → 33644 [PSH, ACK] Seq=1 Ack=1 Win=853 Len=24 TSval=1261886 TSecr=26100477
 38 0.299586231 172.31.31.144 -> 172.31.23.72 TCP 106 6633 → 33642 [PSH, ACK] Seq=25 Ack=1 Win=853 Len=40 TSval=1261886 TSecr=26100465
 39 0.299638091 172.31.31.144 -> 172.31.23.72 TCP 106 6633 → 33644 [PSH, ACK] Seq=25 Ack=1 Win=853 Len=40 TSval=1261886 TSecr=26100477
 40 0.299741029 172.31.23.72 -> 172.31.31.144 OpenFlow 82 Type: OFPT_MULTIPART_REPLY, OFPMP_GROUP
 41 0.299769520 172.31.23.72 -> 172.31.31.144 OpenFlow 98 Type: OFPT_MULTIPART_REPLY, OFPMP_METER
 42 0.299827905 172.31.23.72 -> 172.31.31.144 OpenFlow 82 Type: OFPT_MULTIPART_REPLY, OFPMP_GROUP
 43 0.299856141 172.31.23.72 -> 172.31.31.144 OpenFlow 98 Type: OFPT_MULTIPART_REPLY, OFPMP_METER
 44 0.300076082 172.31.31.144 -> 172.31.23.72 TCP 66 6633 → 33644 [ACK] Seq=65 Ack=49 Win=853 Len=0 TSval=1261886 TSecr=26100987
 45 0.300132971 172.31.31.144 -> 172.31.23.72 TCP 66 6633 → 33642 [ACK] Seq=65 Ack=49 Win=853 Len=0 TSval=1261886 TSecr=26100987
 46 0.399796839 172.31.31.144 -> 172.31.23.72 TCP 90 6633 → 33646 [PSH, ACK] Seq=1 Ack=1 Win=853 Len=24 TSval=1261911 TSecr=26100497
 47 0.399823536 172.31.31.144 -> 172.31.23.72 TCP 90 6633 → 33648 [PSH, ACK] Seq=1 Ack=1 Win=853 Len=24 TSval=1261911 TSecr=26100508
 48 0.399827510 172.31.31.144 -> 172.31.23.72 TCP 106 6633 → 33646 [PSH, ACK] Seq=25 Ack=1 Win=853 Len=40 TSval=1261911 TSecr=26100497
 49 0.399831152 172.31.31.144 -> 172.31.23.72 TCP 106 6633 → 33648 [PSH, ACK] Seq=25 Ack=1 Win=853 Len=40 TSval=1261911 TSecr=26100508
 50 0.400083676 172.31.23.72 -> 172.31.31.144 OpenFlow 82 Type: OFPT_MULTIPART_REPLY, OFPMP_GROUP
 51 0.400130327 172.31.23.72 -> 172.31.31.144 OpenFlow 98 Type: OFPT_MULTIPART_REPLY, OFPMP_METER
 52 0.400142177 172.31.23.72 -> 172.31.31.144 OpenFlow 82 Type: OFPT_MULTIPART_REPLY, OFPMP_GROUP
 53 0.400187115 172.31.23.72 -> 172.31.31.144 OpenFlow 98 Type: OFPT_MULTIPART_REPLY, OFPMP_METER
 54 0.400382048 172.31.31.144 -> 172.31.23.72 TCP 66 6633 → 33646 [ACK] Seq=65 Ack=17 Win=853 Len=0 TSval=1261911 TSecr=26101012
 55 0.400398489 172.31.31.144 -> 172.31.23.72 TCP 66 6633 → 33646 [ACK] Seq=65 Ack=49 Win=853 Len=0 TSval=1261911 TSecr=26101012
 56 0.400414049 172.31.31.144 -> 172.31.23.72 TCP 66 6633 → 33648 [ACK] Seq=65 Ack=49 Win=853 Len=0 TSval=1261911 TSecr=26101012
 57 0.499830752 172.31.31.144 -> 172.31.23.72 TCP 90 6633 → 33650 [PSH, ACK] Seq=1 Ack=1 Win=853 Len=24 TSval=1261936 TSecr=26100517
 58 0.499852050 172.31.31.144 -> 172.31.23.72 TCP 90 6633 → 33652 [PSH, ACK] Seq=1 Ack=1 Win=853 Len=24 TSval=1261936 TSecr=26100528
 59 0.499860764 172.31.31.144 -> 172.31.23.72 TCP 106 6633 → 33650 [PSH, ACK] Seq=25 Ack=1 Win=853 Len=40 TSval=1261936 TSecr=26100517
 60 0.499864774 172.31.31.144 -> 172.31.23.72 TCP 106 6633 → 33652 [PSH, ACK] Seq=25 Ack=1 Win=853 Len=40 TSval=1261936 TSecr=26100528
 61 0.499944262 172.31.23.72 -> 172.31.31.144 OpenFlow 82 Type: OFPT_MULTIPART_REPLY, OFPMP_GROUP
 62 0.499975469 172.31.23.72 -> 172.31.31.144 OpenFlow 98 Type: OFPT_MULTIPART_REPLY, OFPMP_METER
 63 0.499992507 172.31.23.72 -> 172.31.31.144 OpenFlow 82 Type: OFPT_MULTIPART_REPLY, OFPMP_GROUP
 64 0.500059986 172.31.23.72 -> 172.31.31.144 OpenFlow 98 Type: OFPT_MULTIPART_REPLY, OFPMP_METER
 65 0.500198355 172.31.31.144 -> 172.31.23.72 TCP 66 6633 → 33652 [ACK] Seq=65 Ack=17 Win=853 Len=0 TSval=1261936 TSecr=26101037
 66 0.500231000 172.31.31.144 -> 172.31.23.72 TCP 66 6633 → 33652 [ACK] Seq=65 Ack=49 Win=853 Len=0 TSval=1261936 TSecr=26101037
 67 0.500247574 172.31.31.144 -> 172.31.23.72 TCP 66 6633 → 33650 [ACK] Seq=65 Ack=17 Win=853 Len=0 TSval=1261936 TSecr=26101037
 68 0.500302943 172.31.31.144 -> 172.31.23.72 TCP 66 6633 → 33650 [ACK] Seq=65 Ack=49 Win=853 Len=0 TSval=1261936 TSecr=26101037
 69 0.599995082 172.31.31.144 -> 172.31.23.72 TCP 90 6633 → 33654 [PSH, ACK] Seq=1 Ack=1 Win=853 Len=24 TSval=1261961 TSecr=26100539
 70 0.600014160 172.31.31.144 -> 172.31.23.72 TCP 90 6633 → 33656 [PSH, ACK] Seq=1 Ack=1 Win=853 Len=24 TSval=1261961 TSecr=26100550
 71 0.600029059 172.31.31.144 -> 172.31.23.72 TCP 106 6633 → 33654 [PSH, ACK] Seq=25 Ack=1 Win=853 Len=40 TSval=1261961 TSecr=26100539
 72 0.600032755 172.31.31.144 -> 172.31.23.72 TCP 106 6633 → 33656 [PSH, ACK] Seq=25 Ack=1 Win=853 Len=40 TSval=1261961 TSecr=26100550
 73 0.600162375 172.31.23.72 -> 172.31.31.144 OpenFlow 82 Type: OFPT_MULTIPART_REPLY, OFPMP_GROUP
 74 0.600190649 172.31.31.144 -> 172.31.23.72 TCP 187 6633 → 33668 [PSH, ACK] Seq=1 Ack=1 Win=853 Len=121 TSval=1261961 TSecr=26100631
 75 0.600201676 172.31.23.72 -> 172.31.31.144 OpenFlow 98 Type: OFPT_MULTIPART_REPLY, OFPMP_METER
 76 0.600248374 172.31.23.72 -> 172.31.31.144 OpenFlow 82 Type: OFPT_MULTIPART_REPLY, OFPMP_GROUP
 77 0.600283937 172.31.31.144 -> 172.31.23.72 TCP 187 6633 → 33668 [PSH, ACK] Seq=122 Ack=1 Win=853 Len=121 TSval=1261961 TSecr=26100631
 78 0.600289772 172.31.23.72 -> 172.31.31.144 OpenFlow 98 Type: OFPT_MULTIPART_REPLY, OFPMP_METER
 79 0.600352156 172.31.31.144 -> 172.31.23.72 TCP 187 6633 → 33668 [PSH, ACK] Seq=243 Ack=1 Win=853 Len=121 TSval=1261961 TSecr=26100631
 80 0.600434395 172.31.31.144 -> 172.31.23.72 TCP 187 6633 → 33668 [PSH, ACK] Seq=364 Ack=1 Win=853 Len=121 TSval=1261961 TSecr=26100631
 81 0.600449098 172.31.31.144 -> 172.31.23.72 TCP 66 6633 → 33656 [ACK] Seq=65 Ack=17 Win=853 Len=0 TSval=1261961 TSecr=26101062
 82 0.600467636 172.31.31.144 -> 172.31.23.72 TCP 66 6633 → 33656 [ACK] Seq=65 Ack=49 Win=853 Len=0 TSval=1261961 TSecr=26101062
 83 0.600560018 172.31.31.144 -> 172.31.23.72 TCP 187 6633 → 33668 [PSH, ACK] Seq=485 Ack=1 Win=853 Len=121 TSval=1261961 TSecr=26100631
 84 0.600575620 172.31.31.144 -> 172.31.23.72 TCP 66 6633 → 33654 [ACK] Seq=65 Ack=17 Win=853 Len=0 TSval=1261961 TSecr=26101062
 85 0.600596244 172.31.31.144 -> 172.31.23.72 TCP 66 6633 → 33654 [ACK] Seq=65 Ack=49 Win=853 Len=0 TSval=1261961 TSecr=26101062
 86 0.600625325 172.31.31.144 -> 172.31.23.72 TCP 187 6633 → 33668 [PSH, ACK] Seq=606 Ack=1 Win=853 Len=121 TSval=1261961 TSecr=26100631
 87 0.600750760 172.31.31.144 -> 172.31.23.72 TCP 187 6633 → 33668 [PSH, ACK] Seq=727 Ack=1 Win=853 Len=121 TSval=1261961 TSecr=26100631
 88 0.600765389 172.31.31.144 -> 172.31.23.72 TCP 187 6633 → 33668 [PSH, ACK] Seq=848 Ack=1 Win=853 Len=121 TSval=1261961 TSecr=26100631
 89 0.600873449 172.31.23.72 -> 172.31.31.144 TCP 66 33668 → 6633 [ACK] Seq=1 Ack=969 Win=213 Len=0 TSval=26101062 TSecr=1261961
 90 0.600995227 172.31.23.72 -> 172.31.31.144 OpenFlow 189 Type: OFPT_PACKET_IN
 91 0.601053575 172.31.23.72 -> 172.31.31.144 OpenFlow 189 Type: OFPT_PACKET_IN
 92 0.601057900 172.31.23.72 -> 172.31.31.144 OpenFlow 189 Type: OFPT_PACKET_IN
 93 0.601075927 172.31.23.72 -> 172.31.31.144 OpenFlow 189 Type: OFPT_PACKET_IN
 94 0.601141915 172.31.23.72 -> 172.31.31.144 OpenFlow 189 Type: OFPT_PACKET_IN
 95 0.601235574 172.31.23.72 -> 172.31.31.144 OpenFlow 189 Type: OFPT_PACKET_IN
 96 0.601295197 172.31.31.144 -> 172.31.23.72 TCP 66 6633 → 33666 [ACK] Seq=1 Ack=124 Win=853 Len=0 TSval=1261961 TSecr=26101062
 97 0.601343522 172.31.31.144 -> 172.31.23.72 TCP 66 6633 → 33666 [ACK] Seq=1 Ack=247 Win=853 Len=0 TSval=1261961 TSecr=26101062
 98 0.601346053 172.31.31.144 -> 172.31.23.72 TCP 66 6633 → 33670 [ACK] Seq=1 Ack=124 Win=853 Len=0 TSval=1261961 TSecr=26101062
 99 0.601452190 172.31.31.144 -> 172.31.23.72 TCP 66 6633 → 33658 [ACK] Seq=1 Ack=124 Win=853 Len=0 TSval=1261961 TSecr=26101062
100 0.601454956 172.31.31.144 -> 172.31.23.72 TCP 66 6633 → 33670 [ACK] Seq=1 Ack=247 Win=853 Len=0 TSval=1261961 TSecr=26101062
101 0.601548501 172.31.31.144 -> 172.31.23.72 TCP 66 6633 → 33658 [ACK] Seq=1 Ack=247 Win=853 Len=0 TSval=1261961 TSecr=26101062
102 0.700120526 172.31.31.144 -> 172.31.23.72 OpenFlow 90 Type: OFPT_MULTIPART_REQUEST, OFPMP_GROUP
103 0.700157170 172.31.31.144 -> 172.31.23.72 TCP 90 6633 → 33660 [PSH, ACK] Seq=1 Ack=1 Win=853 Len=24 TSval=1261986 TSecr=26100577
104 0.700193587 172.31.31.144 -> 172.31.23.72 OpenFlow 106 Type: OFPT_MULTIPART_REQUEST, OFPMP_METER
105 0.700236968 172.31.31.144 -> 172.31.23.72 TCP 106 6633 → 33660 [PSH, ACK] Seq=25 Ack=1 Win=853 Len=40 TSval=1261986 TSecr=26100577
106 0.700277584 172.31.31.144 -> 172.31.23.72 OpenFlow 187 Type: OFPT_PACKET_OUT
107 0.700322150 172.31.31.144 -> 172.31.23.72 OpenFlow 187 Type: OFPT_PACKET_OUT
108 0.700388826 172.31.31.144 -> 172.31.23.72 OpenFlow 187 Type: OFPT_PACKET_OUT
109 0.700486768 172.31.31.144 -> 172.31.23.72 OpenFlow 187 Type: OFPT_PACKET_OUT
110 0.700572186 172.31.31.144 -> 172.31.23.72 OpenFlow 187 Type: OFPT_PACKET_OUT
111 0.700648729 172.31.31.144 -> 172.31.23.72 OpenFlow 187 Type: OFPT_PACKET_OUT
112 0.700712131 172.31.23.72 -> 172.31.31.144 TCP 66 33656 → 6633 [ACK] Seq=49 Ack=791 Win=213 Len=0 TSval=26101087 TSecr=1261986
113 0.700753414 172.31.31.144 -> 172.31.23.72 OpenFlow 187 Type: OFPT_PACKET_OUT
114 0.700806469 172.31.31.144 -> 172.31.23.72 OpenFlow 187 Type: OFPT_PACKET_OUT
115 0.700869292 172.31.23.72 -> 172.31.31.144 TCP 66 33652 → 6633 [ACK] Seq=49 Ack=307 Win=213 Len=0 TSval=26101087 TSecr=1261986
116 0.700905157 172.31.31.144 -> 172.31.23.72 OpenFlow 187 Type: OFPT_PACKET_OUT
117 0.700968784 172.31.31.144 -> 172.31.23.72 OpenFlow 187 Type: OFPT_PACKET_OUT
118 0.701001387 172.31.23.72 -> 172.31.31.144 TCP 66 33652 → 6633 [ACK] Seq=49 Ack=549 Win=213 Len=0 TSval=26101087 TSecr=1261986
119 0.701064169 172.31.31.144 -> 172.31.23.72 OpenFlow 187 Type: OFPT_PACKET_OUT
120 0.701098439 172.31.23.72 -> 172.31.31.144 OpenFlow 189 Type: OFPT_PACKET_IN
121 0.701107438 172.31.31.144 -> 172.31.23.72 OpenFlow 187 Type: OFPT_PACKET_OUT
122 0.701122278 172.31.23.72 -> 172.31.31.144 OpenFlow 189 Type: OFPT_PACKET_IN
123 0.701156310 172.31.23.72 -> 172.31.31.144 OpenFlow 82 Type: OFPT_MULTIPART_REPLY, OFPMP_GROUP
124 0.701177435 172.31.23.72 -> 172.31.31.144 OpenFlow 189 Type: OFPT_PACKET_IN
125 0.701230724 172.31.31.144 -> 172.31.23.72 OpenFlow 187 Type: OFPT_PACKET_OUT
126 0.701237732 172.31.23.72 -> 172.31.31.144 OpenFlow 435 Type: OFPT_PACKET_IN
127 0.701242495 172.31.23.72 -> 172.31.31.144 OpenFlow 98 Type: OFPT_MULTIPART_REPLY, OFPMP_METER
128 0.701249285 172.31.23.72 -> 172.31.31.144 OpenFlow 189 Type: OFPT_PACKET_IN
129 0.701264590 172.31.31.144 -> 172.31.23.72 OpenFlow 187 Type: OFPT_PACKET_OUT
130 0.701306254 172.31.23.72 -> 172.31.31.144 OpenFlow 189 Type: OFPT_PACKET_IN
131 0.701327347 172.31.23.72 -> 172.31.31.144 OpenFlow 82 Type: OFPT_MULTIPART_REPLY, OFPMP_GROUP
132 0.701329554 172.31.23.72 -> 172.31.31.144 OpenFlow 189 Type: OFPT_PACKET_IN
133 0.701359130 172.31.31.144 -> 172.31.23.72 TCP 66 6633 → 33650 [ACK] Seq=65 Ack=172 Win=853 Len=0 TSval=1261986 TSecr=26101087
134 0.701396254 172.31.23.72 -> 172.31.31.144 OpenFlow 189 Type: OFPT_PACKET_IN
135 0.701402161 172.31.23.72 -> 172.31.31.144 OpenFlow 98 Type: OFPT_MULTIPART_REPLY, OFPMP_METER
136 0.701442086 172.31.31.144 -> 172.31.23.72 OpenFlow 187 Type: OFPT_PACKET_OUT
137 0.701446390 172.31.31.144 -> 172.31.23.72 TCP 66 6633 → 33650 [ACK] Seq=65 Ack=295 Win=853 Len=0 TSval=1261986 TSecr=26101087
138 0.701497175 172.31.31.144 -> 172.31.23.72 TCP 66 6633 → 33660 [ACK] Seq=65 Ack=17 Win=853 Len=0 TSval=1261986 TSecr=26101087
139 0.701502307 172.31.31.144 -> 172.31.23.72 OpenFlow 187 Type: OFPT_PACKET_OUT
140 0.701504600 172.31.31.144 -> 172.31.23.72 TCP 66 6633 → 33654 [ACK] Seq=65 Ack=172 Win=853 Len=0 TSval=1261986 TSecr=26101087
141 0.701534248 172.31.31.144 -> 172.31.23.72 TCP 66 6633 → 33654 [ACK] Seq=65 Ack=541 Win=853 Len=0 TSval=1261986 TSecr=26101087
142 0.701553866 172.31.31.144 -> 172.31.23.72 TCP 66 6633 → 33660 [ACK] Seq=65 Ack=49 Win=853 Len=0 TSval=1261986 TSecr=26101087
143 0.701587536 172.31.31.144 -> 172.31.23.72 OpenFlow 187 Type: OFPT_PACKET_OUT
144 0.701611556 172.31.31.144 -> 172.31.23.72 TCP 66 6633 → 33664 [ACK] Seq=1 Ack=124 Win=853 Len=0 TSval=1261986 TSecr=26101087
145 0.701629646 172.31.31.144 -> 172.31.23.72 OpenFlow 187 Type: OFPT_PACKET_OUT
146 0.701648648 172.31.31.144 -> 172.31.23.72 TCP 66 6633 → 33658 [ACK] Seq=65 Ack=263 Win=853 Len=0 TSval=1261986 TSecr=26101087
147 0.701706017 172.31.31.144 -> 172.31.23.72 OpenFlow 187 Type: OFPT_PACKET_OUT
148 0.701732251 172.31.31.144 -> 172.31.23.72 TCP 66 6633 → 33664 [ACK] Seq=1 Ack=247 Win=853 Len=0 TSval=1261986 TSecr=26101087
149 0.701739196 172.31.23.72 -> 172.31.31.144 TCP 66 33652 → 6633 [ACK] Seq=49 Ack=1033 Win=213 Len=0 TSval=26101087 TSecr=1261986
150 0.701751207 172.31.31.144 -> 172.31.23.72 TCP 66 6633 → 33658 [ACK] Seq=65 Ack=295 Win=853 Len=0 TSval=1261986 TSecr=26101087
151 0.701810892 172.31.31.144 -> 172.31.23.72 TCP 66 6633 → 33648 [ACK] Seq=65 Ack=295 Win=853 Len=0 TSval=1261986 TSecr=26101087
152 0.701904310 172.31.31.144 -> 172.31.23.72 OpenFlow 187 Type: OFPT_PACKET_OUT
153 0.701984755 172.31.23.72 -> 172.31.31.144 TCP 66 33636 → 6633 [ACK] Seq=49 Ack=791 Win=213 Len=0 TSval=26101087 TSecr=1261986
154 0.702053530 172.31.31.144 -> 172.31.23.72 OpenFlow 187 Type: OFPT_PACKET_OUT
155 0.702075980 172.31.23.72 -> 172.31.31.144 OpenFlow 189 Type: OFPT_PACKET_IN
156 0.702094485 172.31.23.72 -> 172.31.31.144 OpenFlow 189 Type: OFPT_PACKET_IN
157 0.702102757 172.31.23.72 -> 172.31.31.144 OpenFlow 189 Type: OFPT_PACKET_IN
158 0.702124936 172.31.23.72 -> 172.31.31.144 OpenFlow 189 Type: OFPT_PACKET_IN
159 0.702169695 172.31.23.72 -> 172.31.31.144 OpenFlow 189 Type: OFPT_PACKET_IN
160 0.702195815 172.31.23.72 -> 172.31.31.144 OpenFlow 189 Type: OFPT_PACKET_IN
161 0.702198220 172.31.23.72 -> 172.31.31.144 OpenFlow 189 Type: OFPT_PACKET_IN
162 0.702215928 172.31.31.144 -> 172.31.23.72 OpenFlow 187 Type: OFPT_PACKET_OUT
163 0.702219146 172.31.31.144 -> 172.31.23.72 OpenFlow 187 Type: OFPT_PACKET_OUT
164 0.702243207 172.31.23.72 -> 172.31.31.144 OpenFlow 189 Type: OFPT_PACKET_IN
165 0.702286800 172.31.31.144 -> 172.31.23.72 OpenFlow 187 Type: OFPT_PACKET_OUT
166 0.702356616 172.31.31.144 -> 172.31.23.72 TCP 66 6633 → 33634 [ACK] Seq=65 Ack=172 Win=853 Len=0 TSval=1261986 TSecr=26101087
167 0.702368118 172.31.31.144 -> 172.31.23.72 OpenFlow 187 Type: OFPT_PACKET_OUT
168 0.702410714 172.31.31.144 -> 172.31.23.72 TCP 66 6633 → 33660 [ACK] Seq=65 Ack=172 Win=853 Len=0 TSval=1261986 TSecr=26101087
169 0.702427759 172.31.31.144 -> 172.31.23.72 TCP 66 6633 → 33634 [ACK] Seq=65 Ack=295 Win=853 Len=0 TSval=1261986 TSecr=26101087
170 0.702451912 172.31.23.72 -> 172.31.31.144 TCP 66 33636 → 6633 [ACK] Seq=49 Ack=1033 Win=213 Len=0 TSval=26101088 TSecr=1261986
171 0.702461556 172.31.31.144 -> 172.31.23.72 TCP 66 6633 → 33646 [ACK] Seq=65 Ack=172 Win=853 Len=0 TSval=1261986 TSecr=26101087
172 0.702478676 172.31.31.144 -> 172.31.23.72 OpenFlow 187 Type: OFPT_PACKET_OUT
173 0.702510784 172.31.31.144 -> 172.31.23.72 TCP 66 6633 → 33660 [ACK] Seq=65 Ack=295 Win=853 Len=0 TSval=1261986 TSecr=26101087
174 0.702515233 172.31.31.144 -> 172.31.23.72 TCP 66 6633 → 33638 [ACK] Seq=65 Ack=172 Win=853 Len=0 TSval=1261986 TSecr=26101087
175 0.702532110 172.31.31.144 -> 172.31.23.72 TCP 66 6633 → 33646 [ACK] Seq=65 Ack=295 Win=853 Len=0 TSval=1261986 TSecr=26101087
176 0.702551302 172.31.31.144 -> 172.31.23.72 TCP 66 6633 → 33638 [ACK] Seq=65 Ack=295 Win=853 Len=0 TSval=1261986 TSecr=26101087
177 0.702589648 172.31.31.144 -> 172.31.23.72 OpenFlow 187 Type: OFPT_PACKET_OUT
178 0.702602656 172.31.31.144 -> 172.31.23.72 OpenFlow 187 Type: OFPT_PACKET_OUT
179 0.702678618 172.31.31.144 -> 172.31.23.72 OpenFlow 187 Type: OFPT_PACKET_OUT
180 0.702792735 172.31.31.144 -> 172.31.23.72 OpenFlow 187 Type: OFPT_PACKET_OUT
181 0.702861331 172.31.31.144 -> 172.31.23.72 OpenFlow 187 Type: OFPT_PACKET_OUT
182 0.702941748 172.31.31.144 -> 172.31.23.72 OpenFlow 187 Type: OFPT_PACKET_OUT
183 0.703001722 172.31.23.72 -> 172.31.31.144 TCP 66 33650 → 6633 [ACK] Seq=295 Ack=1275 Win=213 Len=0 TSval=26101088 TSecr=1261986
184 0.703053861 172.31.31.144 -> 172.31.23.72 OpenFlow 187 Type: OFPT_PACKET_OUT
185 0.703085852 172.31.23.72 -> 172.31.31.144 OpenFlow 189 Type: OFPT_PACKET_IN
186 0.703096094 172.31.31.144 -> 172.31.23.72 OpenFlow 187 Type: OFPT_PACKET_OUT
187 0.703113381 172.31.23.72 -> 172.31.31.144 OpenFlow 189 Type: OFPT_PACKET_IN
188 0.703181587 172.31.31.144 -> 172.31.23.72 OpenFlow 187 Type: OFPT_PACKET_OUT
189 0.703248070 172.31.31.144 -> 172.31.23.72 OpenFlow 187 Type: OFPT_PACKET_OUT
190 0.703281253 172.31.23.72 -> 172.31.31.144 TCP 66 33640 → 6633 [ACK] Seq=295 Ack=549 Win=213 Len=0 TSval=26101088 TSecr=1261987
191 0.703330174 172.31.31.144 -> 172.31.23.72 TCP 66 6633 → 33640 [ACK] Seq=549 Ack=172 Win=853 Len=0 TSval=1261987 TSecr=26101088
192 0.703345350 172.31.31.144 -> 172.31.23.72 OpenFlow 187 Type: OFPT_PACKET_OUT
193 0.703428970 172.31.23.72 -> 172.31.31.144 OpenFlow 189 Type: OFPT_PACKET_IN
194 0.703452446 172.31.23.72 -> 172.31.31.144 OpenFlow 189 Type: OFPT_PACKET_IN
195 0.703457339 172.31.23.72 -> 172.31.31.144 OpenFlow 189 Type: OFPT_PACKET_IN
196 0.703471248 172.31.23.72 -> 172.31.31.144 OpenFlow 189 Type: OFPT_PACKET_IN
197 0.703482852 172.31.23.72 -> 172.31.31.144 OpenFlow 189 Type: OFPT_PACKET_IN
198 0.703517722 172.31.23.72 -> 172.31.31.144 OpenFlow 189 Type: OFPT_PACKET_IN
199 0.703520173 172.31.23.72 -> 172.31.31.144 OpenFlow 189 Type: OFPT_PACKET_IN
200 0.703539771 172.31.23.72 -> 172.31.31.144 OpenFlow 189 Type: OFPT_PACKET_IN
201 0.703542191 172.31.23.72 -> 172.31.31.144 OpenFlow 189 Type: OFPT_PACKET_IN
202 0.703555062 172.31.31.144 -> 172.31.23.72 OpenFlow 187 Type: OFPT_PACKET_OUT
203 0.703560046 172.31.31.144 -> 172.31.23.72 OpenFlow 308 Type: OFPT_PACKET_OUT
204 0.703567560 172.31.23.72 -> 172.31.31.144 OpenFlow 189 Type: OFPT_PACKET_IN
205 0.703624570 172.31.23.72 -> 172.31.31.144 OpenFlow 189 Type: OFPT_PACKET_IN
206 0.703627191 172.31.23.72 -> 172.31.31.144 OpenFlow 189 Type: OFPT_PACKET_IN
207 0.703681491 172.31.23.72 -> 172.31.31.144 OpenFlow 189 Type: OFPT_PACKET_IN
208 0.703698225 172.31.31.144 -> 172.31.23.72 OpenFlow 187 Type: OFPT_PACKET_OUT
209 0.703702053 172.31.31.144 -> 172.31.23.72 TCP 66 6633 → 33666 [ACK] Seq=1 Ack=370 Win=853 Len=0 TSval=1261987 TSecr=26101088
210 0.703705194 172.31.31.144 -> 172.31.23.72 OpenFlow 187 Type: OFPT_PACKET_OUT
211 0.703766744 172.31.23.72 -> 172.31.31.144 OpenFlow 189 Type: OFPT_PACKET_IN
212 0.703837038 172.31.31.144 -> 172.31.23.72 TCP 66 6633 → 33666 [ACK] Seq=1 Ack=493 Win=853 Len=0 TSval=1261987 TSecr=26101088
213 0.703842864 172.31.31.144 -> 172.31.23.72 TCP 66 6633 → 33646 [ACK] Seq=65 Ack=418 Win=853 Len=0 TSval=1261987 TSecr=26101088
214 0.703845117 172.31.31.144 -> 172.31.23.72 OpenFlow 187 Type: OFPT_PACKET_OUT
215 0.703847320 172.31.31.144 -> 172.31.23.72 TCP 66 6633 → 33632 [ACK] Seq=65 Ack=172 Win=853 Len=0 TSval=1261987 TSecr=26101088
216 0.703853700 172.31.23.72 -> 172.31.31.144 OpenFlow 189 Type: OFPT_PACKET_IN
217 0.703873894 172.31.31.144 -> 172.31.23.72 TCP 66 6633 → 33646 [ACK] Seq=65 Ack=541 Win=853 Len=0 TSval=1261987 TSecr=26101088
218 0.703879672 172.31.31.144 -> 172.31.23.72 OpenFlow 187 Type: OFPT_PACKET_OUT
219 0.703912270 172.31.31.144 -> 172.31.23.72 TCP 66 6633 → 33658 [ACK] Seq=65 Ack=418 Win=853 Len=0 TSval=1261987 TSecr=26101088
220 0.703952475 172.31.31.144 -> 172.31.23.72 OpenFlow 187 Type: OFPT_PACKET_OUT
221 0.703978503 172.31.31.144 -> 172.31.23.72 TCP 66 6633 → 33644 [ACK] Seq=65 Ack=295 Win=853 Len=0 TSval=1261987 TSecr=26101088
222 0.704021560 172.31.31.144 -> 172.31.23.72 TCP 66 6633 → 33630 [ACK] Seq=65 Ack=295 Win=853 Len=0 TSval=1261987 TSecr=26101088
223 0.704028907 172.31.23.72 -> 172.31.31.144 TCP 66 33640 → 6633 [ACK] Seq=295 Ack=1275 Win=213 Len=0 TSval=26101088 TSecr=1261987
224 0.704040041 172.31.31.144 -> 172.31.23.72 OpenFlow 187 Type: OFPT_PACKET_OUT
225 0.704072407 172.31.31.144 -> 172.31.23.72 TCP 66 6633 → 33652 [ACK] Seq=1033 Ack=172 Win=853 Len=0 TSval=1261987 TSecr=26101088
226 0.704161396 172.31.31.144 -> 172.31.23.72 TCP 66 6633 → 33642 [ACK] Seq=65 Ack=295 Win=853 Len=0 TSval=1261987 TSecr=26101088
227 0.704178865 172.31.31.144 -> 172.31.23.72 TCP 66 6633 → 33658 [ACK] Seq=65 Ack=541 Win=853 Len=0 TSval=1261987 TSecr=26101088
228 0.704200824 172.31.31.144 -> 172.31.23.72 OpenFlow 187 Type: OFPT_PACKET_OUT
229 0.704229117 172.31.31.144 -> 172.31.23.72 TCP 66 6633 → 33652 [ACK] Seq=1033 Ack=295 Win=853 Len=0 TSval=1261987 TSecr=26101088
230 0.704276471 172.31.31.144 -> 172.31.23.72 OpenFlow 187 Type: OFPT_PACKET_OUT
231 0.704354294 172.31.23.72 -> 172.31.31.144 TCP 66 33634 → 6633 [ACK] Seq=295 Ack=791 Win=213 Len=0 TSval=26101088 TSecr=1261987
232 0.704364961 172.31.31.144 -> 172.31.23.72 OpenFlow 187 Type: OFPT_PACKET_OUT
233 0.704443390 172.31.31.144 -> 172.31.23.72 OpenFlow 187 Type: OFPT_PACKET_OUT
234 0.704464784 172.31.23.72 -> 172.31.31.144 OpenFlow 189 Type: OFPT_PACKET_IN
235 0.704487593 172.31.23.72 -> 172.31.31.144 OpenFlow 189 Type: OFPT_PACKET_IN
236 0.704497895 172.31.23.72 -> 172.31.31.144 OpenFlow 189 Type: OFPT_PACKET_IN
237 0.704534836 172.31.23.72 -> 172.31.31.144 OpenFlow 312 Type: OFPT_PACKET_IN
238 0.704561320 172.31.31.144 -> 172.31.23.72 OpenFlow 187 Type: OFPT_PACKET_OUT
239 0.704569552 172.31.23.72 -> 172.31.31.144 OpenFlow 189 Type: OFPT_PACKET_IN
240 0.704625290 172.31.31.144 -> 172.31.23.72 OpenFlow 187 Type: OFPT_PACKET_OUT
241 0.704680828 172.31.23.72 -> 172.31.31.144 OpenFlow 189 Type: OFPT_PACKET_IN
242 0.704701891 172.31.31.144 -> 172.31.23.72 OpenFlow 187 Type: OFPT_PACKET_OUT
243 0.704707473 172.31.23.72 -> 172.31.31.144 OpenFlow 189 Type: OFPT_PACKET_IN
244 0.704713581 172.31.23.72 -> 172.31.31.144 OpenFlow 189 Type: OFPT_PACKET_IN
245 0.704730168 172.31.31.144 -> 172.31.23.72 TCP 66 6633 → 33646 [ACK] Seq=65 Ack=664 Win=853 Len=0 TSval=1261987 TSecr=26101088
246 0.704756717 172.31.23.72 -> 172.31.31.144 OpenFlow 189 Type: OFPT_PACKET_IN
247 0.704786230 172.31.31.144 -> 172.31.23.72 TCP 66 6633 → 33646 [ACK] Seq=65 Ack=787 Win=853 Len=0 TSval=1261987 TSecr=26101088
248 0.704790588 172.31.31.144 -> 172.31.23.72 TCP 66 6633 → 33632 [ACK] Seq=65 Ack=295 Win=853 Len=0 TSval=1261987 TSecr=26101088
249 0.704793066 172.31.31.144 -> 172.31.23.72 OpenFlow 187 Type: OFPT_PACKET_OUT
250 0.704808655 172.31.31.144 -> 172.31.23.72 TCP 66 6633 → 33632 [ACK] Seq=65 Ack=541 Win=853 Len=0 TSval=1261987 TSecr=26101088
251 0.704824288 172.31.31.144 -> 172.31.23.72 TCP 66 6633 → 33638 [ACK] Seq=65 Ack=418 Win=853 Len=0 TSval=1261987 TSecr=26101088
252 0.704854987 172.31.31.144 -> 172.31.23.72 OpenFlow 187 Type: OFPT_PACKET_OUT
253 0.704902409 172.31.23.72 -> 172.31.31.144 TCP 66 33634 → 6633 [ACK] Seq=295 Ack=1275 Win=213 Len=0 TSval=26101088 TSecr=1261987
254 0.705050598 172.31.23.72 -> 172.31.31.144 TCP 66 33660 → 6633 [ACK] Seq=295 Ack=428 Win=213 Len=0 TSval=26101088 TSecr=1261987
255 0.705146678 172.31.23.72 -> 172.31.31.144 OpenFlow 189 Type: OFPT_PACKET_IN
256 0.705197071 172.31.23.72 -> 172.31.31.144 OpenFlow 189 Type: OFPT_PACKET_IN
257 0.705212242 172.31.23.72 -> 172.31.31.144 OpenFlow 189 Type: OFPT_PACKET_IN
258 0.705223382 172.31.23.72 -> 172.31.31.144 OpenFlow 189 Type: OFPT_PACKET_IN
259 0.705228607 172.31.23.72 -> 172.31.31.144 OpenFlow 189 Type: OFPT_PACKET_IN
260 0.705275676 172.31.23.72 -> 172.31.31.144 OpenFlow 189 Type: OFPT_PACKET_IN
261 0.705343351 172.31.31.144 -> 172.31.23.72 TCP 66 6633 → 33636 [ACK] Seq=1033 Ack=172 Win=853 Len=0 TSval=1261987 TSecr=26101088
262 0.705360152 172.31.31.144 -> 172.31.23.72 TCP 66 6633 → 33636 [ACK] Seq=1033 Ack=295 Win=853 Len=0 TSval=1261987 TSecr=26101088
263 0.705375753 172.31.31.144 -> 172.31.23.72 OpenFlow 187 Type: OFPT_PACKET_OUT
264 0.705393868 172.31.31.144 -> 172.31.23.72 OpenFlow 671 Type: OFPT_PACKET_OUT
265 0.705413479 172.31.31.144 -> 172.31.23.72 TCP 66 6633 → 33650 [ACK] Seq=1275 Ack=541 Win=853 Len=0 TSval=1261987 TSecr=26101088
266 0.705434969 172.31.31.144 -> 172.31.23.72 TCP 66 6633 → 33662 [ACK] Seq=1 Ack=124 Win=853 Len=0 TSval=1261987 TSecr=26101088
267 0.705453568 172.31.31.144 -> 172.31.23.72 OpenFlow 187 Type: OFPT_PACKET_OUT
268 0.705483939 172.31.31.144 -> 172.31.23.72 TCP 66 6633 → 33658 [ACK] Seq=65 Ack=664 Win=853 Len=0 TSval=1261987 TSecr=26101088
269 0.705513784 172.31.31.144 -> 172.31.23.72 TCP 66 6633 → 33638 [ACK] Seq=65 Ack=541 Win=853 Len=0 TSval=1261987 TSecr=26101088
270 0.705532525 172.31.31.144 -> 172.31.23.72 OpenFlow 187 Type: OFPT_PACKET_OUT
271 0.705662197 172.31.31.144 -> 172.31.23.72 TCP 66 6633 → 33642 [ACK] Seq=65 Ack=541 Win=853 Len=0 TSval=1261987 TSecr=26101088
272 0.705703054 172.31.31.144 -> 172.31.23.72 TCP 66 6633 → 33658 [ACK] Seq=65 Ack=787 Win=853 Len=0 TSval=1261987 TSecr=26101088
273 0.705727839 172.31.31.144 -> 172.31.23.72 OpenFlow 187 Type: OFPT_PACKET_OUT
274 0.705806334 172.31.23.72 -> 172.31.31.144 TCP 66 33660 → 6633 [ACK] Seq=295 Ack=1275 Win=213 Len=0 TSval=26101088 TSecr=1261987
275 0.705828858 172.31.31.144 -> 172.31.23.72 OpenFlow 187 Type: OFPT_PACKET_OUT
276 0.705924043 172.31.31.144 -> 172.31.23.72 OpenFlow 187 Type: OFPT_PACKET_OUT
277 0.705977686 172.31.31.144 -> 172.31.23.72 OpenFlow 187 Type: OFPT_PACKET_OUT
278 0.706049583 172.31.31.144 -> 172.31.23.72 OpenFlow 187 Type: OFPT_PACKET_OUT
279 0.706125318 172.31.23.72 -> 172.31.31.144 TCP 66 33654 → 6633 [ACK] Seq=541 Ack=791 Win=213 Len=0 TSval=26101088 TSecr=1261987
280 0.706136146 172.31.31.144 -> 172.31.23.72 OpenFlow 187 Type: OFPT_PACKET_OUT
281 0.706211317 172.31.31.144 -> 172.31.23.72 OpenFlow 187 Type: OFPT_PACKET_OUT
282 0.706246907 172.31.23.72 -> 172.31.31.144 TCP 66 33654 → 6633 [ACK] Seq=541 Ack=1033 Win=213 Len=0 TSval=26101088 TSecr=1261987
283 0.706292130 172.31.31.144 -> 172.31.23.72 OpenFlow 187 Type: OFPT_PACKET_OUT
284 0.706367863 172.31.31.144 -> 172.31.23.72 OpenFlow 187 Type: OFPT_PACKET_OUT
285 0.706406977 172.31.23.72 -> 172.31.31.144 TCP 66 33666 → 6633 [ACK] Seq=493 Ack=243 Win=213 Len=0 TSval=26101089 TSecr=1261987
286 0.706453111 172.31.31.144 -> 172.31.23.72 OpenFlow 187 Type: OFPT_PACKET_OUT
287 0.706517948 172.31.31.144 -> 172.31.23.72 OpenFlow 187 Type: OFPT_PACKET_OUT
288 0.706525503 172.31.23.72 -> 172.31.31.144 OpenFlow 189 Type: OFPT_PACKET_IN
289 0.706546411 172.31.23.72 -> 172.31.31.144 OpenFlow 312 Type: OFPT_PACKET_IN
290 0.706557953 172.31.23.72 -> 172.31.31.144 OpenFlow 189 Type: OFPT_PACKET_IN
291 0.706577591 172.31.23.72 -> 172.31.31.144 OpenFlow 189 Type: OFPT_PACKET_IN
292 0.706596996 172.31.23.72 -> 172.31.31.144 OpenFlow 189 Type: OFPT_PACKET_IN
293 0.706599118 172.31.23.72 -> 172.31.31.144 OpenFlow 189 Type: OFPT_PACKET_IN
294 0.706627203 172.31.31.144 -> 172.31.23.72 OpenFlow 187 Type: OFPT_PACKET_OUT
295 0.706655283 172.31.23.72 -> 172.31.31.144 OpenFlow 189 Type: OFPT_PACKET_IN
296 0.706660284 172.31.23.72 -> 172.31.31.144 OpenFlow 189 Type: OFPT_PACKET_IN
297 0.706709533 172.31.31.144 -> 172.31.23.72 OpenFlow 187 Type: OFPT_PACKET_OUT
298 0.706737640 172.31.23.72 -> 172.31.31.144 OpenFlow 189 Type: OFPT_PACKET_IN
299 0.706759135 172.31.31.144 -> 172.31.23.72 TCP 66 6633 → 33662 [ACK] Seq=1 Ack=247 Win=853 Len=0 TSval=1261988 TSecr=26101089
300 0.706765525 172.31.23.72 -> 172.31.31.144 OpenFlow 189 Type: OFPT_PACKET_IN
301 0.706778021 172.31.23.72 -> 172.31.31.144 OpenFlow 189 Type: OFPT_PACKET_IN
302 0.706784692 172.31.31.144 -> 172.31.23.72 TCP 66 6633 → 33662 [ACK] Seq=1 Ack=493 Win=853 Len=0 TSval=1261988 TSecr=26101089
303 0.706798611 172.31.23.72 -> 172.31.31.144 OpenFlow 189 Type: OFPT_PACKET_IN
304 0.706833700 172.31.31.144 -> 172.31.23.72 OpenFlow 187 Type: OFPT_PACKET_OUT
305 0.706838744 172.31.23.72 -> 172.31.31.144 OpenFlow 189 Type: OFPT_PACKET_IN
306 0.706843488 172.31.23.72 -> 172.31.31.144 OpenFlow 435 Type: OFPT_PACKET_IN
307 0.706859916 172.31.31.144 -> 172.31.23.72 OpenFlow 187 Type: OFPT_PACKET_OUT
308 0.706908156 172.31.31.144 -> 172.31.23.72 TCP 66 6633 → 33672 [ACK] Seq=1 Ack=124 Win=853 Len=0 TSval=1261988 TSecr=26101089
309 0.706913332 172.31.31.144 -> 172.31.23.72 TCP 66 6633 → 33670 [ACK] Seq=1 Ack=370 Win=853 Len=0 TSval=1261988 TSecr=26101089
310 0.706925557 172.31.31.144 -> 172.31.23.72 TCP 66 6633 → 33672 [ACK] Seq=1 Ack=247 Win=853 Len=0 TSval=1261988 TSecr=26101089
311 0.706951770 172.31.31.144 -> 172.31.23.72 TCP 66 6633 → 33670 [ACK] Seq=1 Ack=493 Win=853 Len=0 TSval=1261988 TSecr=26101089
312 0.706974043 172.31.23.72 -> 172.31.31.144 TCP 66 33666 → 6633 [ACK] Seq=493 Ack=727 Win=213 Len=0 TSval=26101089 TSecr=1261987
313 0.706980152 172.31.31.144 -> 172.31.23.72 OpenFlow 187 Type: OFPT_PACKET_OUT
314 0.706997927 172.31.31.144 -> 172.31.23.72 TCP 66 6633 → 33668 [ACK] Seq=969 Ack=124 Win=853 Len=0 TSval=1261988 TSecr=26101089
315 0.707057890 172.31.31.144 -> 172.31.23.72 TCP 66 6633 → 33668 [ACK] Seq=969 Ack=247 Win=853 Len=0 TSval=1261988 TSecr=26101089
316 0.707075071 172.31.31.144 -> 172.31.23.72 OpenFlow 187 Type: OFPT_PACKET_OUT
317 0.707094119 172.31.31.144 -> 172.31.23.72 TCP 66 6633 → 33656 [ACK] Seq=791 Ack=172 Win=853 Len=0 TSval=1261988 TSecr=26101089
318 0.707113024 172.31.31.144 -> 172.31.23.72 TCP 66 6633 → 33652 [ACK] Seq=1033 Ack=418 Win=853 Len=0 TSval=1261988 TSecr=26101089
319 0.707131514 172.31.31.144 -> 172.31.23.72 TCP 66 6633 → 33648 [ACK] Seq=65 Ack=541 Win=853 Len=0 TSval=1261988 TSecr=26101089
320 0.707150768 172.31.31.144 -> 172.31.23.72 OpenFlow 187 Type: OFPT_PACKET_OUT
321 0.707205820 172.31.31.144 -> 172.31.23.72 TCP 66 6633 → 33652 [ACK] Seq=1033 Ack=787 Win=853 Len=0 TSval=1261988 TSecr=26101089
322 0.707270548 172.31.31.144 -> 172.31.23.72 TCP 66 6633 → 33656 [ACK] Seq=791 Ack=295 Win=853 Len=0 TSval=1261988 TSecr=26101089
323 0.707304275 172.31.23.72 -> 172.31.31.144 TCP 66 33646 → 6633 [ACK] Seq=787 Ack=670 Win=213 Len=0 TSval=26101089 TSecr=1261988
324 0.707382882 172.31.31.144 -> 172.31.23.72 OpenFlow 187 Type: OFPT_PACKET_OUT
325 0.707403756 172.31.23.72 -> 172.31.31.144 OpenFlow 189 Type: OFPT_PACKET_IN
326 0.707426308 172.31.23.72 -> 172.31.31.144 OpenFlow 189 Type: OFPT_PACKET_IN
327 0.707465041 172.31.23.72 -> 172.31.31.144 OpenFlow 189 Type: OFPT_PACKET_IN
328 0.707487452 172.31.31.144 -> 172.31.23.72 OpenFlow 187 Type: OFPT_PACKET_OUT
329 0.707566418 172.31.31.144 -> 172.31.23.72 OpenFlow 187 Type: OFPT_PACKET_OUT
330 0.707584621 172.31.23.72 -> 172.31.31.144 OpenFlow 189 Type: OFPT_PACKET_IN
331 0.707605336 172.31.23.72 -> 172.31.31.144 OpenFlow 189 Type: OFPT_PACKET_IN
332 0.707610861 172.31.23.72 -> 172.31.31.144 OpenFlow 189 Type: OFPT_PACKET_IN
333 0.707630535 172.31.31.144 -> 172.31.23.72 OpenFlow 187 Type: OFPT_PACKET_OUT
334 0.707656837 172.31.23.72 -> 172.31.31.144 OpenFlow 189 Type: OFPT_PACKET_IN
335 0.707687309 172.31.31.144 -> 172.31.23.72 TCP 66 6633 → 33648 [ACK] Seq=65 Ack=787 Win=853 Len=0 TSval=1261988 TSecr=26101089
336 0.707716546 172.31.31.144 -> 172.31.23.72 OpenFlow 187 Type: OFPT_PACKET_OUT
337 0.707809371 172.31.31.144 -> 172.31.23.72 OpenFlow 187 Type: OFPT_PACKET_OUT
338 0.707878971 172.31.23.72 -> 172.31.31.144 TCP 66 33646 → 6633 [ACK] Seq=787 Ack=1275 Win=213 Len=0 TSval=26101089 TSecr=1261988
339 0.707937331 172.31.31.144 -> 172.31.23.72 OpenFlow 187 Type: OFPT_PACKET_OUT
340 0.707955271 172.31.31.144 -> 172.31.23.72 TCP 66 6633 → 33650 [ACK] Seq=1275 Ack=787 Win=853 Len=0 TSval=1261988 TSecr=26101089
341 0.707975150 172.31.31.144 -> 172.31.23.72 OpenFlow 187 Type: OFPT_PACKET_OUT
342 0.707993599 172.31.31.144 -> 172.31.23.72 TCP 66 6633 → 33640 [ACK] Seq=1275 Ack=541 Win=853 Len=0 TSval=1261988 TSecr=26101089
343 0.708067194 172.31.23.72 -> 172.31.31.144 TCP 66 33644 → 6633 [ACK] Seq=295 Ack=428 Win=213 Len=0 TSval=26101089 TSecr=1261988
344 0.708077825 172.31.31.144 -> 172.31.23.72 OpenFlow 187 Type: OFPT_PACKET_OUT
345 0.708170688 172.31.31.144 -> 172.31.23.72 OpenFlow 187 Type: OFPT_PACKET_OUT
346 0.708206629 172.31.23.72 -> 172.31.31.144 TCP 66 33644 → 6633 [ACK] Seq=295 Ack=670 Win=213 Len=0 TSval=26101089 TSecr=1261988
347 0.708249837 172.31.31.144 -> 172.31.23.72 OpenFlow 187 Type: OFPT_PACKET_OUT
348 0.708334462 172.31.23.72 -> 172.31.31.144 OpenFlow 189 Type: OFPT_PACKET_IN
349 0.708358336 172.31.23.72 -> 172.31.31.144 OpenFlow 189 Type: OFPT_PACKET_IN
350 0.708396100 172.31.23.72 -> 172.31.31.144 OpenFlow 189 Type: OFPT_PACKET_IN
351 0.708416000 172.31.23.72 -> 172.31.31.144 OpenFlow 312 Type: OFPT_PACKET_IN
352 0.708515800 172.31.23.72 -> 172.31.31.144 OpenFlow 189 Type: OFPT_PACKET_IN
353 0.708545891 172.31.23.72 -> 172.31.31.144 OpenFlow 189 Type: OFPT_PACKET_IN
354 0.708560467 172.31.23.72 -> 172.31.31.144 OpenFlow 189 Type: OFPT_PACKET_IN
355 0.708609846 172.31.31.144 -> 172.31.23.72 TCP 66 6633 → 33648 [ACK] Seq=65 Ack=1033 Win=853 Len=0 TSval=1261988 TSecr=26101089
356 0.708617056 172.31.23.72 -> 172.31.31.144 OpenFlow 189 Type: OFPT_PACKET_IN
357 0.708622395 172.31.23.72 -> 172.31.31.144 OpenFlow 189 Type: OFPT_PACKET_IN
358 0.708657431 172.31.31.144 -> 172.31.23.72 TCP 66 6633 → 33642 [ACK] Seq=65 Ack=787 Win=853 Len=0 TSval=1261988 TSecr=26101089
359 0.708662423 172.31.23.72 -> 172.31.31.144 OpenFlow 189 Type: OFPT_PACKET_IN
360 0.708794389 172.31.31.144 -> 172.31.23.72 TCP 66 6633 → 33652 [ACK] Seq=1033 Ack=910 Win=853 Len=0 TSval=1261988 TSecr=26101089
361 0.708811850 172.31.31.144 -> 172.31.23.72 TCP 66 6633 → 33636 [ACK] Seq=1033 Ack=418 Win=853 Len=0 TSval=1261988 TSecr=26101089
362 0.709022562 172.31.31.144 -> 172.31.23.72 TCP 66 6633 → 33652 [ACK] Seq=1033 Ack=1033 Win=853 Len=0 TSval=1261988 TSecr=26101089
363 0.709041902 172.31.31.144 -> 172.31.23.72 TCP 66 6633 → 33636 [ACK] Seq=1033 Ack=541 Win=853 Len=0 TSval=1261988 TSecr=26101089
364 0.709073039 172.31.31.144 -> 172.31.23.72 TCP 66 6633 → 33650 [ACK] Seq=1275 Ack=1033 Win=853 Len=0 TSval=1261988 TSecr=26101089
365 0.746391357 172.31.23.72 -> 172.31.31.144 TCP 66 33644 → 6633 [ACK] Seq=295 Ack=791 Win=213 Len=0 TSval=26101099 TSecr=1261988
366 0.750816264 172.31.31.144 -> 172.31.23.72 TCP 66 6633 → 33642 [ACK] Seq=65 Ack=1033 Win=853 Len=0 TSval=1261999 TSecr=26101089
367 0.799544122 172.31.31.144 -> 172.31.23.72 OpenFlow 90 Type: OFPT_MULTIPART_REQUEST, OFPMP_GROUP
368 0.799568032 172.31.31.144 -> 172.31.23.72 OpenFlow 90 Type: OFPT_MULTIPART_REQUEST, OFPMP_GROUP
369 0.799584353 172.31.31.144 -> 172.31.23.72 OpenFlow 106 Type: OFPT_MULTIPART_REQUEST, OFPMP_METER
370 0.799589794 172.31.31.144 -> 172.31.23.72 OpenFlow 106 Type: OFPT_MULTIPART_REQUEST, OFPMP_METER
371 0.799677846 172.31.31.144 -> 172.31.23.72 OpenFlow 187 Type: OFPT_PACKET_OUT
372 0.799724430 172.31.31.144 -> 172.31.23.72 OpenFlow 187 Type: OFPT_PACKET_OUT
373 0.799809779 172.31.31.144 -> 172.31.23.72 OpenFlow 187 Type: OFPT_PACKET_OUT
374 0.799890275 172.31.31.144 -> 172.31.23.72 OpenFlow 187 Type: OFPT_PACKET_OUT
375 0.799989043 172.31.31.144 -> 172.31.23.72 OpenFlow 187 Type: OFPT_PACKET_OUT
376 0.800061455 172.31.31.144 -> 172.31.23.72 OpenFlow 187 Type: OFPT_PACKET_OUT
377 0.800137320 172.31.31.144 -> 172.31.23.72 OpenFlow 187 Type: OFPT_PACKET_OUT
378 0.800191225 172.31.23.72 -> 172.31.31.144 TCP 66 33632 → 6633 [ACK] Seq=541 Ack=912 Win=213 Len=0 TSval=26101112 TSecr=1262011
379 0.800207385 172.31.31.144 -> 172.31.23.72 OpenFlow 187 Type: OFPT_PACKET_OUT
380 0.800294103 172.31.31.144 -> 172.31.23.72 OpenFlow 187 Type: OFPT_PACKET_OUT
381 0.800331961 172.31.23.72 -> 172.31.31.144 OpenFlow 82 Type: OFPT_MULTIPART_REPLY, OFPMP_GROUP
382 0.800359831 172.31.31.144 -> 172.31.23.72 OpenFlow 187 Type: OFPT_PACKET_OUT
383 0.800378505 172.31.23.72 -> 172.31.31.144 OpenFlow 98 Type: OFPT_MULTIPART_REPLY, OFPMP_METER
384 0.800436269 172.31.31.144 -> 172.31.23.72 OpenFlow 187 Type: OFPT_PACKET_OUT
385 0.800526889 172.31.31.144 -> 172.31.23.72 OpenFlow 187 Type: OFPT_PACKET_OUT
