  1 0.000000000 41.177.127.217 -> 172.31.24.227 TCP 54 58416 → 22 [ACK] Seq=1 Ack=1 Win=32452 Len=0
  2 0.038922543 41.177.127.217 -> 172.31.24.227 TCP 54 58416 → 22 [ACK] Seq=1 Ack=37 Win=32434 Len=0
  3 0.146369439 41.177.127.217 -> 172.31.24.227 TCP 54 58416 → 22 [ACK] Seq=1 Ack=97 Win=32404 Len=0
  4 0.655682501 172.31.24.227 -> 41.177.127.217 SSH 90 Server: Encrypted packet (len=36)
  5 0.923184673 41.177.127.217 -> 172.31.24.227 TCP 54 58416 → 22 [ACK] Seq=1 Ack=133 Win=32386 Len=0
  6 1.159609670 172.31.24.227 -> 41.177.127.217 SSH 98 Server: Encrypted packet (len=44)
  7 1.406157734 41.177.127.217 -> 172.31.24.227 TCP 54 58416 → 22 [ACK] Seq=1 Ack=177 Win=32364 Len=0
  8 1.530190855 172.31.31.144 -> 172.31.24.227 TCP 187 6633 → 39480 [PSH, ACK] Seq=1 Ack=1 Win=853 Len=121 TSval=365390 TSecr=118925475
  9 1.530226494 172.31.31.144 -> 172.31.24.227 TCP 187 6633 → 39480 [PSH, ACK] Seq=122 Ack=1 Win=853 Len=121 TSval=365390 TSecr=118925475
 10 1.530233136 172.31.31.144 -> 172.31.24.227 TCP 187 6633 → 39480 [PSH, ACK] Seq=243 Ack=1 Win=853 Len=121 TSval=365390 TSecr=118925475
 11 1.530260109 172.31.31.144 -> 172.31.24.227 TCP 187 6633 → 39480 [PSH, ACK] Seq=364 Ack=1 Win=853 Len=121 TSval=365390 TSecr=118925475
 12 1.530300673 172.31.31.144 -> 172.31.24.227 TCP 187 6633 → 39480 [PSH, ACK] Seq=485 Ack=1 Win=853 Len=121 TSval=365391 TSecr=118925475
 13 1.530315441 172.31.24.227 -> 172.31.31.144 TCP 66 39480 → 6633 [ACK] Seq=1 Ack=606 Win=74 Len=0 TSval=118926000 TSecr=365390
 14 1.530416267 172.31.31.144 -> 172.31.24.227 TCP 187 6633 → 39480 [PSH, ACK] Seq=606 Ack=1 Win=853 Len=121 TSval=365391 TSecr=118925475
 15 1.530467603 172.31.31.144 -> 172.31.24.227 TCP 187 6633 → 39480 [PSH, ACK] Seq=727 Ack=1 Win=853 Len=121 TSval=365391 TSecr=118925475
 16 1.530532613 172.31.31.144 -> 172.31.24.227 TCP 187 6633 → 39480 [PSH, ACK] Seq=848 Ack=1 Win=853 Len=121 TSval=365391 TSecr=118925475
 17 1.530583272 172.31.31.144 -> 172.31.24.227 TCP 187 6633 → 39480 [PSH, ACK] Seq=969 Ack=1 Win=853 Len=121 TSval=365391 TSecr=118926000
 18 1.530636517 172.31.31.144 -> 172.31.24.227 TCP 187 6633 → 39480 [PSH, ACK] Seq=1090 Ack=1 Win=853 Len=121 TSval=365391 TSecr=118926000
 19 1.530642297 172.31.24.227 -> 172.31.31.144 TCP 66 39480 → 6633 [ACK] Seq=1 Ack=1211 Win=74 Len=0 TSval=118926001 TSecr=365391
 20 1.530721722 172.31.31.144 -> 172.31.24.227 TCP 187 6633 → 39480 [PSH, ACK] Seq=1211 Ack=1 Win=853 Len=121 TSval=365391 TSecr=118926000
 21 1.530748099 172.31.31.144 -> 172.31.24.227 TCP 187 6633 → 39480 [PSH, ACK] Seq=1332 Ack=1 Win=853 Len=121 TSval=365391 TSecr=118926000
 22 1.530861405 172.31.31.144 -> 172.31.24.227 TCP 187 6633 → 39456 [PSH, ACK] Seq=1 Ack=1 Win=853 Len=121 TSval=365391 TSecr=118925476
 23 1.530888262 172.31.31.144 -> 172.31.24.227 TCP 187 6633 → 39456 [PSH, ACK] Seq=122 Ack=1 Win=853 Len=121 TSval=365391 TSecr=118925476
 24 1.530952490 172.31.31.144 -> 172.31.24.227 TCP 187 6633 → 39456 [PSH, ACK] Seq=243 Ack=1 Win=853 Len=121 TSval=365391 TSecr=118925476
 25 1.530998395 172.31.31.144 -> 172.31.24.227 TCP 187 6633 → 39456 [PSH, ACK] Seq=364 Ack=1 Win=853 Len=121 TSval=365391 TSecr=118925476
 26 1.531063625 172.31.31.144 -> 172.31.24.227 TCP 187 6633 → 39456 [PSH, ACK] Seq=485 Ack=1 Win=853 Len=121 TSval=365391 TSecr=118925476
 27 1.531069998 172.31.24.227 -> 172.31.31.144 TCP 66 39456 → 6633 [ACK] Seq=1 Ack=606 Win=61 Len=0 TSval=118926001 TSecr=365391
 28 1.531168262 172.31.31.144 -> 172.31.24.227 TCP 187 6633 → 39456 [PSH, ACK] Seq=606 Ack=1 Win=853 Len=121 TSval=365391 TSecr=118925476
 29 1.531180051 172.31.31.144 -> 172.31.24.227 TCP 187 6633 → 39456 [PSH, ACK] Seq=727 Ack=1 Win=853 Len=121 TSval=365391 TSecr=118925476
 30 1.531239523 172.31.31.144 -> 172.31.24.227 TCP 187 6633 → 39456 [PSH, ACK] Seq=848 Ack=1 Win=853 Len=121 TSval=365391 TSecr=118925476
 31 1.531293583 172.31.31.144 -> 172.31.24.227 TCP 187 6633 → 39456 [PSH, ACK] Seq=969 Ack=1 Win=853 Len=121 TSval=365391 TSecr=118925476
 32 1.531370491 172.31.31.144 -> 172.31.24.227 TCP 187 6633 → 39456 [PSH, ACK] Seq=1090 Ack=1 Win=853 Len=121 TSval=365391 TSecr=118926001
 33 1.531376019 172.31.24.227 -> 172.31.31.144 TCP 66 39456 → 6633 [ACK] Seq=1 Ack=1211 Win=61 Len=0 TSval=118926001 TSecr=365391
 34 1.531430235 172.31.31.144 -> 172.31.24.227 TCP 187 6633 → 39456 [PSH, ACK] Seq=1211 Ack=1 Win=853 Len=121 TSval=365391 TSecr=118926001
 35 1.531467286 172.31.24.227 -> 172.31.31.144 TCP 66 39480 → 6633 [ACK] Seq=1 Ack=1453 Win=74 Len=0 TSval=118926001 TSecr=365391
 36 1.531513230 172.31.31.144 -> 172.31.24.227 TCP 187 6633 → 39456 [PSH, ACK] Seq=1332 Ack=1 Win=853 Len=121 TSval=365391 TSecr=118926001
 37 1.531559306 172.31.24.227 -> 172.31.31.144 OpenFlow 189 Type: OFPT_PACKET_IN
 38 1.531580461 172.31.24.227 -> 172.31.31.144 OpenFlow 435 Type: OFPT_PACKET_IN
 39 1.531615599 172.31.24.227 -> 172.31.31.144 OpenFlow 189 Type: OFPT_PACKET_IN
 40 1.531627094 172.31.31.144 -> 172.31.24.227 TCP 187 6633 → 39486 [PSH, ACK] Seq=1 Ack=1 Win=853 Len=121 TSval=365391 TSecr=118925451
 41 1.531635556 172.31.24.227 -> 172.31.31.144 OpenFlow 189 Type: OFPT_PACKET_IN
 42 1.531678996 172.31.31.144 -> 172.31.24.227 TCP 187 6633 → 39486 [PSH, ACK] Seq=122 Ack=1 Win=853 Len=121 TSval=365391 TSecr=118925451
 43 1.531698489 172.31.31.144 -> 172.31.24.227 TCP 187 6633 → 39486 [PSH, ACK] Seq=243 Ack=1 Win=853 Len=121 TSval=365391 TSecr=118925451
 44 1.531761284 172.31.31.144 -> 172.31.24.227 TCP 187 6633 → 39486 [PSH, ACK] Seq=364 Ack=1 Win=853 Len=121 TSval=365391 TSecr=118925451
 45 1.531779003 172.31.31.144 -> 172.31.24.227 TCP 187 6633 → 39486 [PSH, ACK] Seq=485 Ack=1 Win=853 Len=121 TSval=365391 TSecr=118925451
 46 1.531807431 172.31.31.144 -> 172.31.24.227 TCP 66 6633 → 39484 [ACK] Seq=1 Ack=493 Win=853 Len=0 TSval=365391 TSecr=118926001
 47 1.531819204 172.31.31.144 -> 172.31.24.227 TCP 66 6633 → 39492 [ACK] Seq=1 Ack=124 Win=853 Len=0 TSval=365391 TSecr=118926001
 48 1.531838822 172.31.31.144 -> 172.31.24.227 TCP 66 6633 → 39492 [ACK] Seq=1 Ack=247 Win=853 Len=0 TSval=365391 TSecr=118926001
 49 1.531859384 172.31.31.144 -> 172.31.24.227 TCP 187 6633 → 39486 [PSH, ACK] Seq=606 Ack=1 Win=853 Len=121 TSval=365391 TSecr=118925451
 50 1.531864507 172.31.24.227 -> 172.31.31.144 TCP 66 39486 → 6633 [ACK] Seq=1 Ack=727 Win=78 Len=0 TSval=118926001 TSecr=365391
 51 1.531908528 172.31.31.144 -> 172.31.24.227 TCP 187 6633 → 39486 [PSH, ACK] Seq=727 Ack=1 Win=853 Len=121 TSval=365391 TSecr=118925451
 52 1.531966715 172.31.31.144 -> 172.31.24.227 TCP 187 6633 → 39486 [PSH, ACK] Seq=848 Ack=1 Win=853 Len=121 TSval=365391 TSecr=118925451
 53 1.532083754 172.31.31.144 -> 172.31.24.227 TCP 187 6633 → 39468 [PSH, ACK] Seq=1 Ack=1 Win=853 Len=121 TSval=365391 TSecr=118925476
 54 1.532102887 172.31.31.144 -> 172.31.24.227 TCP 187 6633 → 39468 [PSH, ACK] Seq=122 Ack=1 Win=853 Len=121 TSval=365391 TSecr=118925476
 55 1.532133424 172.31.31.144 -> 172.31.24.227 TCP 187 6633 → 39468 [PSH, ACK] Seq=243 Ack=1 Win=853 Len=121 TSval=365391 TSecr=118925476
 56 1.532293675 172.31.31.144 -> 172.31.24.227 TCP 187 6633 → 39468 [PSH, ACK] Seq=364 Ack=1 Win=853 Len=121 TSval=365391 TSecr=118925476
 57 1.532348324 172.31.24.227 -> 172.31.31.144 TCP 66 39456 → 6633 [ACK] Seq=1 Ack=1453 Win=61 Len=0 TSval=118926001 TSecr=365391
 58 1.532378595 172.31.31.144 -> 172.31.24.227 TCP 187 6633 → 39468 [PSH, ACK] Seq=485 Ack=1 Win=853 Len=121 TSval=365391 TSecr=118925476
 59 1.532383118 172.31.24.227 -> 172.31.31.144 TCP 66 39468 → 6633 [ACK] Seq=1 Ack=606 Win=80 Len=0 TSval=118926001 TSecr=365391
 60 1.532424281 172.31.31.144 -> 172.31.24.227 TCP 187 6633 → 39468 [PSH, ACK] Seq=606 Ack=1 Win=853 Len=121 TSval=365391 TSecr=118925476
 61 1.532444000 172.31.24.227 -> 172.31.31.144 OpenFlow 189 Type: OFPT_PACKET_IN
 62 1.532463464 172.31.24.227 -> 172.31.31.144 OpenFlow 189 Type: OFPT_PACKET_IN
 63 1.532488932 172.31.31.144 -> 172.31.24.227 TCP 187 6633 → 39468 [PSH, ACK] Seq=727 Ack=1 Win=853 Len=121 TSval=365391 TSecr=118925476
 64 1.532494242 172.31.24.227 -> 172.31.31.144 OpenFlow 189 Type: OFPT_PACKET_IN
 65 1.532512447 172.31.24.227 -> 172.31.31.144 OpenFlow 681 Type: OFPT_PACKET_IN
 66 1.532563515 172.31.31.144 -> 172.31.24.227 TCP 187 6633 → 39468 [PSH, ACK] Seq=848 Ack=1 Win=853 Len=121 TSval=365391 TSecr=118925476
 67 1.532617207 172.31.31.144 -> 172.31.24.227 TCP 187 6633 → 39468 [PSH, ACK] Seq=969 Ack=1 Win=853 Len=121 TSval=365391 TSecr=118926001
 68 1.532631898 172.31.31.144 -> 172.31.24.227 TCP 66 6633 → 39458 [ACK] Seq=1 Ack=124 Win=853 Len=0 TSval=365391 TSecr=118926001
 69 1.532654075 172.31.31.144 -> 172.31.24.227 TCP 66 6633 → 39458 [ACK] Seq=1 Ack=247 Win=853 Len=0 TSval=365391 TSecr=118926001
 70 1.532675310 172.31.31.144 -> 172.31.24.227 TCP 187 6633 → 39468 [PSH, ACK] Seq=1090 Ack=1 Win=853 Len=121 TSval=365391 TSecr=118926001
 71 1.532679920 172.31.24.227 -> 172.31.31.144 TCP 66 39468 → 6633 [ACK] Seq=1 Ack=1211 Win=80 Len=0 TSval=118926001 TSecr=365391
 72 1.532721630 172.31.31.144 -> 172.31.24.227 TCP 187 6633 → 39468 [PSH, ACK] Seq=1211 Ack=1 Win=853 Len=121 TSval=365391 TSecr=118926001
 73 1.532744520 172.31.31.144 -> 172.31.24.227 TCP 66 6633 → 39464 [ACK] Seq=1 Ack=739 Win=853 Len=0 TSval=365391 TSecr=118926001
 74 1.532767721 172.31.31.144 -> 172.31.24.227 TCP 187 6633 → 39468 [PSH, ACK] Seq=1332 Ack=1 Win=853 Len=121 TSval=365391 TSecr=118926001
 75 1.532836989 172.31.31.144 -> 172.31.24.227 TCP 187 6633 → 39468 [PSH, ACK] Seq=1453 Ack=1 Win=853 Len=121 TSval=365391 TSecr=118926001
 76 1.532950448 172.31.31.144 -> 172.31.24.227 TCP 187 6633 → 39468 [PSH, ACK] Seq=1574 Ack=1 Win=853 Len=121 TSval=365391 TSecr=118926001
 77 1.533056325 172.31.31.144 -> 172.31.24.227 TCP 187 6633 → 39466 [PSH, ACK] Seq=1 Ack=1 Win=853 Len=121 TSval=365391 TSecr=118925476
 78 1.533106215 172.31.31.144 -> 172.31.24.227 TCP 187 6633 → 39466 [PSH, ACK] Seq=122 Ack=1 Win=853 Len=121 TSval=365391 TSecr=118925476
 79 1.533136969 172.31.24.227 -> 172.31.31.144 TCP 66 39468 → 6633 [ACK] Seq=1 Ack=1695 Win=80 Len=0 TSval=118926001 TSecr=365391
 80 1.533180677 172.31.31.144 -> 172.31.24.227 TCP 187 6633 → 39466 [PSH, ACK] Seq=243 Ack=1 Win=853 Len=121 TSval=365391 TSecr=118925476
 81 1.533212058 172.31.24.227 -> 172.31.31.144 OpenFlow 189 Type: OFPT_PACKET_IN
 82 1.533232249 172.31.24.227 -> 172.31.31.144 OpenFlow 189 Type: OFPT_PACKET_IN
 83 1.533277479 172.31.31.144 -> 172.31.24.227 TCP 187 6633 → 39466 [PSH, ACK] Seq=364 Ack=1 Win=853 Len=121 TSval=365391 TSecr=118925476
 84 1.533334840 172.31.31.144 -> 172.31.24.227 TCP 187 6633 → 39466 [PSH, ACK] Seq=485 Ack=1 Win=853 Len=121 TSval=365391 TSecr=118925476
 85 1.533377198 172.31.31.144 -> 172.31.24.227 TCP 187 6633 → 39466 [PSH, ACK] Seq=606 Ack=1 Win=853 Len=121 TSval=365391 TSecr=118925476
 86 1.533397150 172.31.31.144 -> 172.31.24.227 TCP 66 6633 → 39470 [ACK] Seq=1 Ack=124 Win=853 Len=0 TSval=365391 TSecr=118926001
 87 1.533415580 172.31.31.144 -> 172.31.24.227 TCP 66 6633 → 39470 [ACK] Seq=1 Ack=247 Win=853 Len=0 TSval=365391 TSecr=118926001
 88 1.533441671 172.31.31.144 -> 172.31.24.227 TCP 187 6633 → 39466 [PSH, ACK] Seq=727 Ack=1 Win=853 Len=121 TSval=365391 TSecr=118925476
 89 1.533527719 172.31.31.144 -> 172.31.24.227 TCP 187 6633 → 39466 [PSH, ACK] Seq=848 Ack=1 Win=853 Len=121 TSval=365391 TSecr=118925476
 90 1.533559118 172.31.24.227 -> 172.31.31.144 TCP 66 39486 → 6633 [ACK] Seq=1 Ack=969 Win=78 Len=0 TSval=118926001 TSecr=365391
 91 1.533568724 172.31.31.144 -> 172.31.24.227 TCP 187 6633 → 39466 [PSH, ACK] Seq=969 Ack=1 Win=853 Len=121 TSval=365391 TSecr=118925476
 92 1.533640137 172.31.24.227 -> 172.31.31.144 OpenFlow 189 Type: OFPT_PACKET_IN
 93 1.533659391 172.31.31.144 -> 172.31.24.227 TCP 187 6633 → 39466 [PSH, ACK] Seq=1090 Ack=1 Win=853 Len=121 TSval=365391 TSecr=118925476
 94 1.533665369 172.31.24.227 -> 172.31.31.144 OpenFlow 189 Type: OFPT_PACKET_IN
 95 1.533749008 172.31.24.227 -> 172.31.31.144 OpenFlow 189 Type: OFPT_PACKET_IN
 96 1.533778293 172.31.24.227 -> 172.31.31.144 OpenFlow 681 Type: OFPT_PACKET_IN
 97 1.533792590 172.31.24.227 -> 172.31.31.144 OpenFlow 189 Type: OFPT_PACKET_IN
 98 1.533805784 172.31.24.227 -> 172.31.31.144 OpenFlow 189 Type: OFPT_PACKET_IN
 99 1.533841883 172.31.24.227 -> 172.31.31.144 OpenFlow 189 Type: OFPT_PACKET_IN
100 1.533844321 172.31.24.227 -> 172.31.31.144 OpenFlow 189 Type: OFPT_PACKET_IN
101 1.533851846 172.31.31.144 -> 172.31.24.227 TCP 66 6633 → 39492 [ACK] Seq=1 Ack=370 Win=853 Len=0 TSval=365391 TSecr=118926001
102 1.533856090 172.31.31.144 -> 172.31.24.227 TCP 66 6633 → 39492 [ACK] Seq=1 Ack=493 Win=853 Len=0 TSval=365391 TSecr=118926001
103 1.533879836 172.31.24.227 -> 172.31.31.144 OpenFlow 189 Type: OFPT_PACKET_IN
104 1.533884927 172.31.24.227 -> 172.31.31.144 OpenFlow 681 Type: OFPT_PACKET_IN
105 1.533891099 172.31.24.227 -> 172.31.31.144 OpenFlow 189 Type: OFPT_PACKET_IN
106 1.533971060 172.31.24.227 -> 172.31.31.144 OpenFlow 189 Type: OFPT_PACKET_IN
107 1.534002753 172.31.31.144 -> 172.31.24.227 TCP 66 6633 → 39446 [ACK] Seq=1 Ack=124 Win=853 Len=0 TSval=365391 TSecr=118926001
108 1.534007907 172.31.31.144 -> 172.31.24.227 TCP 66 6633 → 39446 [ACK] Seq=1 Ack=739 Win=853 Len=0 TSval=365391 TSecr=118926001
109 1.534009853 172.31.31.144 -> 172.31.24.227 TCP 66 6633 → 39448 [ACK] Seq=1 Ack=124 Win=853 Len=0 TSval=365391 TSecr=118926001
110 1.534020910 172.31.31.144 -> 172.31.24.227 TCP 66 6633 → 39462 [ACK] Seq=1 Ack=124 Win=853 Len=0 TSval=365391 TSecr=118926001
111 1.534051994 172.31.31.144 -> 172.31.24.227 TCP 66 6633 → 39448 [ACK] Seq=1 Ack=247 Win=853 Len=0 TSval=365391 TSecr=118926001
112 1.534081357 172.31.31.144 -> 172.31.24.227 TCP 66 6633 → 39450 [ACK] Seq=1 Ack=247 Win=853 Len=0 TSval=365391 TSecr=118926001
113 1.534109548 172.31.31.144 -> 172.31.24.227 TCP 66 6633 → 39462 [ACK] Seq=1 Ack=739 Win=853 Len=0 TSval=365391 TSecr=118926001
114 1.534176273 172.31.31.144 -> 172.31.24.227 TCP 66 6633 → 39464 [ACK] Seq=1 Ack=985 Win=853 Len=0 TSval=365391 TSecr=118926001
115 1.534350962 172.31.24.227 -> 172.31.31.144 TCP 66 39466 → 6633 [ACK] Seq=1 Ack=1211 Win=369 Len=0 TSval=118926001 TSecr=365391
116 1.534419834 172.31.24.227 -> 172.31.31.144 OpenFlow 189 Type: OFPT_PACKET_IN
117 1.534440389 172.31.24.227 -> 172.31.31.144 OpenFlow 435 Type: OFPT_PACKET_IN
118 1.534452100 172.31.24.227 -> 172.31.31.144 OpenFlow 189 Type: OFPT_PACKET_IN
119 1.534471354 172.31.24.227 -> 172.31.31.144 OpenFlow 189 Type: OFPT_PACKET_IN
120 1.534487583 172.31.24.227 -> 172.31.31.144 OpenFlow 189 Type: OFPT_PACKET_IN
121 1.534489558 172.31.24.227 -> 172.31.31.144 OpenFlow 189 Type: OFPT_PACKET_IN
122 1.534528042 172.31.24.227 -> 172.31.31.144 OpenFlow 189 Type: OFPT_PACKET_IN
123 1.534536396 172.31.24.227 -> 172.31.31.144 OpenFlow 189 Type: OFPT_PACKET_IN
124 1.534538148 172.31.24.227 -> 172.31.31.144 OpenFlow 435 Type: OFPT_PACKET_IN
125 1.534581970 172.31.31.144 -> 172.31.24.227 TCP 187 6633 → 39490 [PSH, ACK] Seq=1 Ack=1 Win=853 Len=121 TSval=365392 TSecr=118925451
126 1.534587282 172.31.31.144 -> 172.31.24.227 TCP 1034 6633 → 39466 [PSH, ACK] Seq=1211 Ack=1 Win=853 Len=968 TSval=365392 TSecr=118926001
127 1.534605617 172.31.24.227 -> 172.31.31.144 OpenFlow 189 Type: OFPT_PACKET_IN
128 1.534653538 172.31.31.144 -> 172.31.24.227 TCP 187 6633 → 39490 [PSH, ACK] Seq=122 Ack=1 Win=853 Len=121 TSval=365392 TSecr=118925451
129 1.534657818 172.31.31.144 -> 172.31.24.227 TCP 66 6633 → 39470 [ACK] Seq=1 Ack=370 Win=853 Len=0 TSval=365392 TSecr=118926001
130 1.534660943 172.31.31.144 -> 172.31.24.227 TCP 66 6633 → 39470 [ACK] Seq=1 Ack=739 Win=853 Len=0 TSval=365392 TSecr=118926001
131 1.534676857 172.31.31.144 -> 172.31.24.227 TCP 66 6633 → 39472 [ACK] Seq=1 Ack=124 Win=853 Len=0 TSval=365392 TSecr=118926001
132 1.534689047 172.31.31.144 -> 172.31.24.227 TCP 187 6633 → 39490 [PSH, ACK] Seq=243 Ack=1 Win=853 Len=121 TSval=365392 TSecr=118925451
133 1.534706468 172.31.24.227 -> 172.31.31.144 OpenFlow 189 Type: OFPT_PACKET_IN
134 1.534720964 172.31.31.144 -> 172.31.24.227 TCP 66 6633 → 39472 [ACK] Seq=1 Ack=247 Win=853 Len=0 TSval=365392 TSecr=118926001
135 1.534725825 172.31.24.227 -> 172.31.31.144 OpenFlow 189 Type: OFPT_PACKET_IN
136 1.534753497 172.31.31.144 -> 172.31.24.227 TCP 66 6633 → 39492 [ACK] Seq=1 Ack=616 Win=853 Len=0 TSval=365392 TSecr=118926001
137 1.534777548 172.31.31.144 -> 172.31.24.227 TCP 187 6633 → 39490 [PSH, ACK] Seq=364 Ack=1 Win=853 Len=121 TSval=365392 TSecr=118925451
138 1.534797148 172.31.31.144 -> 172.31.24.227 TCP 187 6633 → 39490 [PSH, ACK] Seq=485 Ack=1 Win=853 Len=121 TSval=365392 TSecr=118925451
139 1.534801249 172.31.24.227 -> 172.31.31.144 TCP 66 39490 → 6633 [ACK] Seq=1 Ack=606 Win=57 Len=0 TSval=118926002 TSecr=365392
140 1.534824254 172.31.31.144 -> 172.31.24.227 TCP 66 6633 → 39492 [ACK] Seq=1 Ack=739 Win=853 Len=0 TSval=365392 TSecr=118926001
141 1.534910533 172.31.31.144 -> 172.31.24.227 TCP 187 6633 → 39490 [PSH, ACK] Seq=606 Ack=1 Win=853 Len=121 TSval=365392 TSecr=118925451
142 1.534935301 172.31.31.144 -> 172.31.24.227 TCP 66 6633 → 39450 [ACK] Seq=1 Ack=493 Win=853 Len=0 TSval=365392 TSecr=118926002
143 1.534946864 172.31.31.144 -> 172.31.24.227 TCP 66 6633 → 39476 [ACK] Seq=1 Ack=247 Win=853 Len=0 TSval=365392 TSecr=118926001
144 1.535136587 172.31.31.144 -> 172.31.24.227 TCP 66 6633 → 39478 [ACK] Seq=1 Ack=493 Win=853 Len=0 TSval=365392 TSecr=118926001
145 1.535412784 172.31.31.144 -> 172.31.24.227 TCP 187 6633 → 39490 [PSH, ACK] Seq=727 Ack=1 Win=853 Len=121 TSval=365392 TSecr=118926002
146 1.535443576 172.31.24.227 -> 172.31.31.144 TCP 66 39490 → 6633 [ACK] Seq=1 Ack=848 Win=57 Len=0 TSval=118926002 TSecr=365392
147 1.535538575 172.31.31.144 -> 172.31.24.227 TCP 187 6633 → 39490 [PSH, ACK] Seq=848 Ack=1 Win=853 Len=121 TSval=365392 TSecr=118926002
148 1.535558374 172.31.31.144 -> 172.31.24.227 TCP 187 6633 → 39490 [PSH, ACK] Seq=969 Ack=1 Win=853 Len=121 TSval=365392 TSecr=118926002
149 1.535607634 172.31.24.227 -> 172.31.31.144 OpenFlow 189 Type: OFPT_PACKET_IN
150 1.535628977 172.31.31.144 -> 172.31.24.227 TCP 187 6633 → 39490 [PSH, ACK] Seq=1090 Ack=1 Win=853 Len=121 TSval=365392 TSecr=118926002
151 1.535634634 172.31.24.227 -> 172.31.31.144 OpenFlow 189 Type: OFPT_PACKET_IN
152 1.535654925 172.31.24.227 -> 172.31.31.144 OpenFlow 189 Type: OFPT_PACKET_IN
153 1.535670958 172.31.24.227 -> 172.31.31.144 OpenFlow 189 Type: OFPT_PACKET_IN
154 1.535678112 172.31.24.227 -> 172.31.31.144 OpenFlow 189 Type: OFPT_PACKET_IN
155 1.535700722 172.31.24.227 -> 172.31.31.144 OpenFlow 189 Type: OFPT_PACKET_IN
156 1.535705901 172.31.24.227 -> 172.31.31.144 OpenFlow 312 Type: OFPT_PACKET_IN
157 1.535746019 172.31.24.227 -> 172.31.31.144 OpenFlow 927 Type: OFPT_PACKET_IN
158 1.535820981 172.31.31.144 -> 172.31.24.227 TCP 66 6633 → 39446 [ACK] Seq=1 Ack=862 Win=853 Len=0 TSval=365392 TSecr=118926002
159 1.535826502 172.31.31.144 -> 172.31.24.227 TCP 66 6633 → 39446 [ACK] Seq=1 Ack=985 Win=853 Len=0 TSval=365392 TSecr=118926002
160 1.535857314 172.31.31.144 -> 172.31.24.227 TCP 66 6633 → 39452 [ACK] Seq=1 Ack=124 Win=853 Len=0 TSval=365392 TSecr=118926002
161 1.535895826 172.31.31.144 -> 172.31.24.227 TCP 66 6633 → 39450 [ACK] Seq=1 Ack=739 Win=853 Len=0 TSval=365392 TSecr=118926002
162 1.535914510 172.31.31.144 -> 172.31.24.227 TCP 66 6633 → 39458 [ACK] Seq=1 Ack=370 Win=853 Len=0 TSval=365392 TSecr=118926002
163 1.535934538 172.31.31.144 -> 172.31.24.227 TCP 66 6633 → 39452 [ACK] Seq=1 Ack=370 Win=853 Len=0 TSval=365392 TSecr=118926002
164 1.535947684 172.31.24.227 -> 172.31.31.144 TCP 66 39490 → 6633 [ACK] Seq=1 Ack=1211 Win=57 Len=0 TSval=118926002 TSecr=365392
165 1.535955896 172.31.31.144 -> 172.31.24.227 TCP 66 6633 → 39458 [ACK] Seq=1 Ack=1231 Win=853 Len=0 TSval=365392 TSecr=118926002
166 1.536107031 172.31.24.227 -> 172.31.31.144 OpenFlow 189 Type: OFPT_PACKET_IN
167 1.536142603 172.31.24.227 -> 172.31.31.144 OpenFlow 312 Type: OFPT_PACKET_IN
168 1.536305849 172.31.31.144 -> 172.31.24.227 TCP 66 6633 → 39452 [ACK] Seq=1 Ack=493 Win=853 Len=0 TSval=365392 TSecr=118926002
169 1.536322798 172.31.31.144 -> 172.31.24.227 TCP 66 6633 → 39452 [ACK] Seq=1 Ack=739 Win=853 Len=0 TSval=365392 TSecr=118926002
170 1.570651696 172.31.24.227 -> 172.31.31.144 TCP 66 39466 → 6633 [ACK] Seq=1 Ack=2179 Win=374 Len=0 TSval=118926011 TSecr=365392
171 1.585770097 172.31.31.144 -> 172.31.24.227 TCP 90 6633 → 39486 [PSH, ACK] Seq=969 Ack=1 Win=853 Len=24 TSval=365404 TSecr=118926001
172 1.586073282 172.31.24.227 -> 172.31.31.144 OpenFlow 642 Type: OFPT_MULTIPART_REPLY, OFPMP_PORT_STATS
173 1.586346570 172.31.31.144 -> 172.31.24.227 TCP 66 6633 → 39486 [ACK] Seq=993 Ack=577 Win=853 Len=0 TSval=365405 TSecr=118926014
174 1.588884704 172.31.31.144 -> 172.31.24.227 OpenFlow 122 Type: OFPT_MULTIPART_REQUEST, OFPMP_FLOW
175 1.589111033 172.31.24.227 -> 172.31.31.144 OpenFlow 2010 Type: OFPT_MULTIPART_REPLY, OFPMP_FLOW
176 1.590047560 172.31.31.144 -> 172.31.24.227 OpenFlow 82 Type: OFPT_MULTIPART_REQUEST, OFPMP_TABLE
177 1.590348349 172.31.24.227 -> 172.31.31.144 OpenFlow 6178 Type: OFPT_MULTIPART_REPLY, OFPMP_TABLE
178 1.601205442 172.31.31.144 -> 172.31.24.227 TCP 90 6633 → 39490 [PSH, ACK] Seq=1211 Ack=1 Win=853 Len=24 TSval=365408 TSecr=118926002
179 1.601490661 172.31.24.227 -> 172.31.31.144 OpenFlow 754 Type: OFPT_MULTIPART_REPLY, OFPMP_PORT_STATS
180 1.601801016 172.31.31.144 -> 172.31.24.227 TCP 66 6633 → 39490 [ACK] Seq=1235 Ack=689 Win=853 Len=0 TSval=365408 TSecr=118926018
181 1.605364193 172.31.31.144 -> 172.31.24.227 OpenFlow 122 Type: OFPT_MULTIPART_REQUEST, OFPMP_FLOW
182 1.605542816 172.31.24.227 -> 172.31.31.144 OpenFlow 1178 Type: OFPT_MULTIPART_REPLY, OFPMP_FLOW
183 1.606460412 172.31.31.144 -> 172.31.24.227 OpenFlow 82 Type: OFPT_MULTIPART_REQUEST, OFPMP_TABLE
184 1.606764956 172.31.24.227 -> 172.31.31.144 OpenFlow 6178 Type: OFPT_MULTIPART_REPLY, OFPMP_TABLE
185 1.608684611 172.31.31.144 -> 172.31.24.227 OpenFlow 122 Type: OFPT_MULTIPART_REQUEST, OFPMP_FLOW
186 1.608715661 172.31.31.144 -> 172.31.24.227 OpenFlow 90 Type: OFPT_MULTIPART_REQUEST, OFPMP_PORT_STATS
187 1.608884281 172.31.24.227 -> 172.31.31.144 OpenFlow 1178 Type: OFPT_MULTIPART_REPLY, OFPMP_FLOW
188 1.609016639 172.31.24.227 -> 172.31.31.144 OpenFlow 754 Type: OFPT_MULTIPART_REPLY, OFPMP_PORT_STATS
189 1.609221451 172.31.31.144 -> 172.31.24.227 TCP 66 6633 → 39492 [ACK] Seq=81 Ack=2539 Win=853 Len=0 TSval=365410 TSecr=118926020
190 1.609828141 172.31.31.144 -> 172.31.24.227 OpenFlow 82 Type: OFPT_MULTIPART_REQUEST, OFPMP_TABLE
191 1.610094147 172.31.24.227 -> 172.31.31.144 OpenFlow 6178 Type: OFPT_MULTIPART_REPLY, OFPMP_TABLE
192 1.615030502 172.31.31.144 -> 172.31.24.227 OpenFlow 122 Type: OFPT_MULTIPART_REQUEST, OFPMP_FLOW
193 1.615038522 172.31.31.144 -> 172.31.24.227 OpenFlow 90 Type: OFPT_MULTIPART_REQUEST, OFPMP_PORT_STATS
194 1.615175112 172.31.24.227 -> 172.31.31.144 OpenFlow 2218 Type: OFPT_MULTIPART_REPLY, OFPMP_FLOW
195 1.615345563 172.31.24.227 -> 172.31.31.144 OpenFlow 1314 Type: OFPT_MULTIPART_REPLY, OFPMP_PORT_STATS
196 1.615517227 172.31.31.144 -> 172.31.24.227 TCP 66 6633 → 39458 [ACK] Seq=81 Ack=3383 Win=853 Len=0 TSval=365412 TSecr=118926022
197 1.615556173 172.31.31.144 -> 172.31.24.227 TCP 66 6633 → 39458 [ACK] Seq=81 Ack=4631 Win=853 Len=0 TSval=365412 TSecr=118926022
198 1.616107975 172.31.31.144 -> 172.31.24.227 OpenFlow 82 Type: OFPT_MULTIPART_REQUEST, OFPMP_TABLE
199 1.616291779 172.31.24.227 -> 172.31.31.144 OpenFlow 6178 Type: OFPT_MULTIPART_REPLY, OFPMP_TABLE
200 1.619285333 172.31.31.144 -> 172.31.24.227 OpenFlow 90 Type: OFPT_MULTIPART_REQUEST, OFPMP_PORT_STATS
201 1.619293448 172.31.31.144 -> 172.31.24.227 OpenFlow 122 Type: OFPT_MULTIPART_REQUEST, OFPMP_FLOW
202 1.619463580 172.31.24.227 -> 172.31.31.144 OpenFlow 530 Type: OFPT_MULTIPART_REPLY, OFPMP_PORT_STATS
203 1.619533320 172.31.24.227 -> 172.31.31.144 OpenFlow 2010 Type: OFPT_MULTIPART_REPLY, OFPMP_FLOW
204 1.619797483 172.31.31.144 -> 172.31.24.227 TCP 66 6633 → 39476 [ACK] Seq=81 Ack=2655 Win=853 Len=0 TSval=365413 TSecr=118926023
205 1.620407071 172.31.31.144 -> 172.31.24.227 OpenFlow 82 Type: OFPT_MULTIPART_REQUEST, OFPMP_TABLE
206 1.620645132 172.31.24.227 -> 172.31.31.144 OpenFlow 6178 Type: OFPT_MULTIPART_REPLY, OFPMP_TABLE
207 1.624624778 172.31.31.144 -> 172.31.24.227 OpenFlow 90 Type: OFPT_MULTIPART_REQUEST, OFPMP_PORT_STATS
208 1.624648033 172.31.31.144 -> 172.31.24.227 OpenFlow 122 Type: OFPT_MULTIPART_REQUEST, OFPMP_FLOW
209 1.624801457 172.31.24.227 -> 172.31.31.144 OpenFlow 866 Type: OFPT_MULTIPART_REPLY, OFPMP_PORT_STATS
210 1.624883543 172.31.24.227 -> 172.31.31.144 OpenFlow 2842 Type: OFPT_MULTIPART_REPLY, OFPMP_FLOW
211 1.625087608 172.31.31.144 -> 172.31.24.227 TCP 66 6633 → 39452 [ACK] Seq=81 Ack=1539 Win=853 Len=0 TSval=365414 TSecr=118926024
212 1.625126293 172.31.31.144 -> 172.31.24.227 TCP 66 6633 → 39452 [ACK] Seq=81 Ack=4315 Win=853 Len=0 TSval=365414 TSecr=118926024
213 1.625794926 172.31.31.144 -> 172.31.24.227 OpenFlow 82 Type: OFPT_MULTIPART_REQUEST, OFPMP_TABLE
214 1.625986804 172.31.24.227 -> 172.31.31.144 OpenFlow 6178 Type: OFPT_MULTIPART_REPLY, OFPMP_TABLE
215 1.628915622 172.31.31.144 -> 172.31.24.227 TCP 122 6633 → 39480 [PSH, ACK] Seq=1453 Ack=1 Win=853 Len=56 TSval=365415 TSecr=118926001
216 1.628923531 172.31.31.144 -> 172.31.24.227 TCP 90 6633 → 39480 [PSH, ACK] Seq=1509 Ack=1 Win=853 Len=24 TSval=365415 TSecr=118926001
217 1.629075567 172.31.24.227 -> 172.31.31.144 OpenFlow 1386 Type: OFPT_MULTIPART_REPLY, OFPMP_FLOW
218 1.629191848 172.31.24.227 -> 172.31.31.144 OpenFlow 866 Type: OFPT_MULTIPART_REPLY, OFPMP_PORT_STATS
219 1.629434203 172.31.31.144 -> 172.31.24.227 TCP 66 6633 → 39480 [ACK] Seq=1533 Ack=2121 Win=853 Len=0 TSval=365415 TSecr=118926025
220 1.630015417 172.31.31.144 -> 172.31.24.227 OpenFlow 187 Type: OFPT_PACKET_OUT
221 1.630022068 172.31.31.144 -> 172.31.24.227 OpenFlow 82 Type: OFPT_MULTIPART_REQUEST, OFPMP_TABLE
222 1.630074769 172.31.31.144 -> 172.31.24.227 OpenFlow 187 Type: OFPT_PACKET_OUT
223 1.630094208 172.31.31.144 -> 172.31.24.227 OpenFlow 187 Type: OFPT_PACKET_OUT
224 1.630176424 172.31.31.144 -> 172.31.24.227 OpenFlow 187 Type: OFPT_PACKET_OUT
225 1.630257496 172.31.31.144 -> 172.31.24.227 OpenFlow 187 Type: OFPT_PACKET_OUT
226 1.630264058 172.31.24.227 -> 172.31.31.144 TCP 66 39472 → 6633 [ACK] Seq=247 Ack=606 Win=63 Len=0 TSval=118926025 TSecr=365415
227 1.630344674 172.31.31.144 -> 172.31.24.227 TCP 66 6633 → 39486 [ACK] Seq=1065 Ack=8633 Win=853 Len=0 TSval=365416 TSecr=118926015
228 1.630363411 172.31.31.144 -> 172.31.24.227 OpenFlow 187 Type: OFPT_PACKET_OUT
229 1.630433893 172.31.31.144 -> 172.31.24.227 OpenFlow 187 Type: OFPT_PACKET_OUT
230 1.630458734 172.31.24.227 -> 172.31.31.144 TCP 66 39472 → 6633 [ACK] Seq=247 Ack=848 Win=63 Len=0 TSval=118926025 TSecr=365416
231 1.630502589 172.31.31.144 -> 172.31.24.227 OpenFlow 187 Type: OFPT_PACKET_OUT
232 1.630583249 172.31.31.144 -> 172.31.24.227 OpenFlow 187 Type: OFPT_PACKET_OUT
233 1.630596419 172.31.24.227 -> 172.31.31.144 OpenFlow 189 Type: OFPT_PACKET_IN
234 1.630626572 172.31.31.144 -> 172.31.24.227 OpenFlow 187 Type: OFPT_PACKET_OUT
235 1.630651155 172.31.31.144 -> 172.31.24.227 OpenFlow 187 Type: OFPT_PACKET_OUT
236 1.630660004 172.31.24.227 -> 172.31.31.144 OpenFlow 189 Type: OFPT_PACKET_IN
237 1.630680351 172.31.31.144 -> 172.31.24.227 OpenFlow 187 Type: OFPT_PACKET_OUT
238 1.630741190 172.31.31.144 -> 172.31.24.227 OpenFlow 187 Type: OFPT_PACKET_OUT
239 1.630745742 172.31.24.227 -> 172.31.31.144 TCP 66 39492 → 6633 [ACK] Seq=8651 Ack=702 Win=70 Len=0 TSval=118926026 TSecr=365416
240 1.630787663 172.31.31.144 -> 172.31.24.227 OpenFlow 187 Type: OFPT_PACKET_OUT
241 1.630840279 172.31.31.144 -> 172.31.24.227 OpenFlow 187 Type: OFPT_PACKET_OUT
242 1.630861531 172.31.31.144 -> 172.31.24.227 TCP 66 6633 → 39474 [ACK] Seq=1 Ack=247 Win=853 Len=0 TSval=365416 TSecr=118926025
243 1.630877381 172.31.24.227 -> 172.31.31.144 OpenFlow 6178 Type: OFPT_MULTIPART_REPLY, OFPMP_TABLE
244 1.630900628 172.31.31.144 -> 172.31.24.227 OpenFlow 187 Type: OFPT_PACKET_OUT
245 1.630916949 172.31.24.227 -> 172.31.31.144 OpenFlow 189 Type: OFPT_PACKET_IN
246 1.630938096 172.31.24.227 -> 172.31.31.144 OpenFlow 189 Type: OFPT_PACKET_IN
247 1.630983854 172.31.24.227 -> 172.31.31.144 OpenFlow 189 Type: OFPT_PACKET_IN
248 1.630992086 172.31.24.227 -> 172.31.31.144 OpenFlow 189 Type: OFPT_PACKET_IN
249 1.630994539 172.31.31.144 -> 172.31.24.227 OpenFlow 187 Type: OFPT_PACKET_OUT
250 1.631046739 172.31.31.144 -> 172.31.24.227 OpenFlow 187 Type: OFPT_PACKET_OUT
251 1.631052348 172.31.24.227 -> 172.31.31.144 TCP 66 39492 → 6633 [ACK] Seq=8651 Ack=1307 Win=70 Len=0 TSval=118926026 TSecr=365416
252 1.631145922 172.31.31.144 -> 172.31.24.227 TCP 66 6633 → 39482 [ACK] Seq=1 Ack=124 Win=853 Len=0 TSval=365416 TSecr=118926026
253 1.631170847 172.31.31.144 -> 172.31.24.227 TCP 187 6633 → 39460 [PSH, ACK] Seq=1 Ack=1 Win=853 Len=121 TSval=365416 TSecr=118925476
254 1.631184489 172.31.31.144 -> 172.31.24.227 TCP 66 6633 → 39486 [ACK] Seq=1065 Ack=8756 Win=853 Len=0 TSval=365416 TSecr=118926026
255 1.631205478 172.31.31.144 -> 172.31.24.227 TCP 187 6633 → 39460 [PSH, ACK] Seq=122 Ack=1 Win=853 Len=121 TSval=365416 TSecr=118925476
256 1.631226115 172.31.31.144 -> 172.31.24.227 TCP 66 6633 → 39482 [ACK] Seq=1 Ack=247 Win=853 Len=0 TSval=365416 TSecr=118926026
257 1.631246621 172.31.31.144 -> 172.31.24.227 TCP 187 6633 → 39460 [PSH, ACK] Seq=243 Ack=1 Win=853 Len=121 TSval=365416 TSecr=118925476
258 1.631267745 172.31.31.144 -> 172.31.24.227 TCP 187 6633 → 39460 [PSH, ACK] Seq=364 Ack=1 Win=853 Len=121 TSval=365416 TSecr=118925476
259 1.631288072 172.31.31.144 -> 172.31.24.227 TCP 66 6633 → 39486 [ACK] Seq=1065 Ack=8879 Win=853 Len=0 TSval=365416 TSecr=118926026
260 1.631308419 172.31.31.144 -> 172.31.24.227 TCP 187 6633 → 39460 [PSH, ACK] Seq=485 Ack=1 Win=853 Len=121 TSval=365416 TSecr=118925476
261 1.631374597 172.31.31.144 -> 172.31.24.227 TCP 187 6633 → 39460 [PSH, ACK] Seq=606 Ack=1 Win=853 Len=121 TSval=365416 TSecr=118925476
262 1.631380934 172.31.24.227 -> 172.31.31.144 TCP 66 39460 → 6633 [ACK] Seq=1 Ack=727 Win=73 Len=0 TSval=118926026 TSecr=365416
263 1.631424734 172.31.31.144 -> 172.31.24.227 TCP 187 6633 → 39460 [PSH, ACK] Seq=727 Ack=1 Win=853 Len=121 TSval=365416 TSecr=118925476
264 1.631497255 172.31.31.144 -> 172.31.24.227 TCP 187 6633 → 39460 [PSH, ACK] Seq=848 Ack=1 Win=853 Len=121 TSval=365416 TSecr=118925476
265 1.631586701 172.31.31.144 -> 172.31.24.227 TCP 187 6633 → 39488 [PSH, ACK] Seq=1 Ack=1 Win=853 Len=121 TSval=365416 TSecr=118925476
266 1.631631500 172.31.31.144 -> 172.31.24.227 TCP 187 6633 → 39488 [PSH, ACK] Seq=122 Ack=1 Win=853 Len=121 TSval=365416 TSecr=118925476
267 1.631660914 172.31.24.227 -> 172.31.31.144 OpenFlow 189 Type: OFPT_PACKET_IN
268 1.631683596 172.31.31.144 -> 172.31.24.227 TCP 187 6633 → 39488 [PSH, ACK] Seq=243 Ack=1 Win=853 Len=121 TSval=365416 TSecr=118925476
269 1.631688787 172.31.24.227 -> 172.31.31.144 OpenFlow 189 Type: OFPT_PACKET_IN
270 1.631773496 172.31.31.144 -> 172.31.24.227 TCP 187 6633 → 39488 [PSH, ACK] Seq=364 Ack=1 Win=853 Len=121 TSval=365416 TSecr=118925476
271 1.631812322 172.31.31.144 -> 172.31.24.227 TCP 187 6633 → 39488 [PSH, ACK] Seq=485 Ack=1 Win=853 Len=121 TSval=365416 TSecr=118925476
272 1.631817366 172.31.24.227 -> 172.31.31.144 TCP 66 39488 → 6633 [ACK] Seq=1 Ack=606 Win=59 Len=0 TSval=118926026 TSecr=365416
273 1.631889040 172.31.31.144 -> 172.31.24.227 TCP 187 6633 → 39488 [PSH, ACK] Seq=606 Ack=1 Win=853 Len=121 TSval=365416 TSecr=118925476
274 1.631902148 172.31.31.144 -> 172.31.24.227 TCP 66 6633 → 39450 [ACK] Seq=1 Ack=985 Win=853 Len=0 TSval=365416 TSecr=118926026
275 1.631924002 172.31.31.144 -> 172.31.24.227 TCP 187 6633 → 39488 [PSH, ACK] Seq=727 Ack=1 Win=853 Len=121 TSval=365416 TSecr=118925476
276 1.631970507 172.31.31.144 -> 172.31.24.227 TCP 187 6633 → 39488 [PSH, ACK] Seq=848 Ack=1 Win=853 Len=121 TSval=365416 TSecr=118925476
277 1.632029877 172.31.24.227 -> 172.31.31.144 TCP 66 39460 → 6633 [ACK] Seq=1 Ack=969 Win=73 Len=0 TSval=118926026 TSecr=365416
278 1.632072037 172.31.31.144 -> 172.31.24.227 OpenFlow 187 Type: OFPT_PACKET_OUT
279 1.632104504 172.31.24.227 -> 172.31.31.144 OpenFlow 189 Type: OFPT_PACKET_IN
280 1.632123993 172.31.24.227 -> 172.31.31.144 OpenFlow 189 Type: OFPT_PACKET_IN
281 1.632138853 172.31.24.227 -> 172.31.31.144 OpenFlow 189 Type: OFPT_PACKET_IN
282 1.632158138 172.31.24.227 -> 172.31.31.144 OpenFlow 189 Type: OFPT_PACKET_IN
283 1.632167753 172.31.31.144 -> 172.31.24.227 OpenFlow 187 Type: OFPT_PACKET_OUT
284 1.632193359 172.31.24.227 -> 172.31.31.144 OpenFlow 189 Type: OFPT_PACKET_IN
285 1.632198676 172.31.24.227 -> 172.31.31.144 OpenFlow 189 Type: OFPT_PACKET_IN
286 1.632220938 172.31.31.144 -> 172.31.24.227 OpenFlow 187 Type: OFPT_PACKET_OUT
287 1.632264022 172.31.31.144 -> 172.31.24.227 OpenFlow 187 Type: OFPT_PACKET_OUT
288 1.632268168 172.31.31.144 -> 172.31.24.227 OpenFlow 187 Type: OFPT_PACKET_OUT
289 1.632289074 172.31.31.144 -> 172.31.24.227 TCP 66 6633 → 39462 [ACK] Seq=1 Ack=862 Win=853 Len=0 TSval=365416 TSecr=118926026
290 1.632305393 172.31.31.144 -> 172.31.24.227 TCP 66 6633 → 39462 [ACK] Seq=1 Ack=985 Win=853 Len=0 TSval=365416 TSecr=118926026
291 1.632355945 172.31.31.144 -> 172.31.24.227 TCP 66 6633 → 39468 [ACK] Seq=1695 Ack=124 Win=853 Len=0 TSval=365416 TSecr=118926026
292 1.632377680 172.31.31.144 -> 172.31.24.227 TCP 66 6633 → 39466 [ACK] Seq=2179 Ack=247 Win=853 Len=0 TSval=365416 TSecr=118926026
293 1.632397802 172.31.31.144 -> 172.31.24.227 TCP 66 6633 → 39468 [ACK] Seq=1695 Ack=247 Win=853 Len=0 TSval=365416 TSecr=118926026
294 1.632434312 172.31.24.227 -> 172.31.31.144 TCP 66 39474 → 6633 [ACK] Seq=247 Ack=606 Win=203 Len=0 TSval=118926026 TSecr=365416
295 1.632454799 172.31.31.144 -> 172.31.24.227 OpenFlow 187 Type: OFPT_PACKET_OUT
296 1.632548873 172.31.31.144 -> 172.31.24.227 OpenFlow 187 Type: OFPT_PACKET_OUT
297 1.632563449 172.31.24.227 -> 172.31.31.144 OpenFlow 189 Type: OFPT_PACKET_IN
298 1.632593026 172.31.24.227 -> 172.31.31.144 OpenFlow 189 Type: OFPT_PACKET_IN
299 1.632619248 172.31.24.227 -> 172.31.31.144 OpenFlow 189 Type: OFPT_PACKET_IN
300 1.632639690 172.31.24.227 -> 172.31.31.144 OpenFlow 189 Type: OFPT_PACKET_IN
301 1.632719162 172.31.31.144 -> 172.31.24.227 OpenFlow 187 Type: OFPT_PACKET_OUT
302 1.632757531 172.31.31.144 -> 172.31.24.227 TCP 66 6633 → 39480 [ACK] Seq=1549 Ack=8356 Win=853 Len=0 TSval=365416 TSecr=118926026
303 1.632825962 172.31.31.144 -> 172.31.24.227 TCP 66 6633 → 39488 [ACK] Seq=969 Ack=124 Win=853 Len=0 TSval=365416 TSecr=118926026
304 1.632845806 172.31.31.144 -> 172.31.24.227 OpenFlow 187 Type: OFPT_PACKET_OUT
305 1.632878983 172.31.31.144 -> 172.31.24.227 TCP 66 6633 → 39488 [ACK] Seq=969 Ack=247 Win=853 Len=0 TSval=365416 TSecr=118926026
306 1.632889191 172.31.31.144 -> 172.31.24.227 OpenFlow 187 Type: OFPT_PACKET_OUT
307 1.632944610 172.31.31.144 -> 172.31.24.227 OpenFlow 187 Type: OFPT_PACKET_OUT
308 1.633000171 172.31.31.144 -> 172.31.24.227 OpenFlow 187 Type: OFPT_PACKET_OUT
309 1.633006593 172.31.24.227 -> 172.31.31.144 TCP 66 39474 → 6633 [ACK] Seq=247 Ack=1453 Win=203 Len=0 TSval=118926026 TSecr=365416
310 1.633048811 172.31.31.144 -> 172.31.24.227 OpenFlow 187 Type: OFPT_PACKET_OUT
311 1.633102303 172.31.24.227 -> 172.31.31.144 OpenFlow 189 Type: OFPT_PACKET_IN
312 1.633121049 172.31.24.227 -> 172.31.31.144 OpenFlow 435 Type: OFPT_PACKET_IN
313 1.633146502 172.31.31.144 -> 172.31.24.227 OpenFlow 187 Type: OFPT_PACKET_OUT
314 1.633154851 172.31.24.227 -> 172.31.31.144 OpenFlow 189 Type: OFPT_PACKET_IN
315 1.633169634 172.31.24.227 -> 172.31.31.144 OpenFlow 435 Type: OFPT_PACKET_IN
316 1.633193381 172.31.24.227 -> 172.31.31.144 OpenFlow 189 Type: OFPT_PACKET_IN
317 1.633216120 172.31.24.227 -> 172.31.31.144 OpenFlow 435 Type: OFPT_PACKET_IN
318 1.633247503 172.31.24.227 -> 172.31.31.144 OpenFlow 189 Type: OFPT_PACKET_IN
319 1.633260271 172.31.24.227 -> 172.31.31.144 OpenFlow 189 Type: OFPT_PACKET_IN
320 1.633270161 172.31.24.227 -> 172.31.31.144 OpenFlow 189 Type: OFPT_PACKET_IN
321 1.633308206 172.31.24.227 -> 172.31.31.144 OpenFlow 189 Type: OFPT_PACKET_IN
322 1.633331880 172.31.31.144 -> 172.31.24.227 TCP 66 6633 → 39446 [ACK] Seq=1 Ack=1108 Win=853 Len=0 TSval=365416 TSecr=118926026
323 1.633336918 172.31.31.144 -> 172.31.24.227 TCP 66 6633 → 39446 [ACK] Seq=1 Ack=1477 Win=853 Len=0 TSval=365416 TSecr=118926026
324 1.633355661 172.31.31.144 -> 172.31.24.227 TCP 66 6633 → 39452 [ACK] Seq=97 Ack=10550 Win=853 Len=0 TSval=365416 TSecr=118926024
325 1.633358950 172.31.31.144 -> 172.31.24.227 TCP 66 6633 → 39458 [ACK] Seq=97 Ack=10866 Win=853 Len=0 TSval=365416 TSecr=118926022
326 1.633508667 172.31.31.144 -> 172.31.24.227 TCP 66 6633 → 39472 [ACK] Seq=969 Ack=493 Win=853 Len=0 TSval=365416 TSecr=118926026
327 1.633686346 172.31.24.227 -> 172.31.31.144 OpenFlow 189 Type: OFPT_PACKET_IN
328 1.633707476 172.31.24.227 -> 172.31.31.144 OpenFlow 681 Type: OFPT_PACKET_IN
329 1.633818861 172.31.31.144 -> 172.31.24.227 TCP 66 6633 → 39474 [ACK] Seq=1695 Ack=493 Win=853 Len=0 TSval=365416 TSecr=118926026
330 1.633829036 172.31.24.227 -> 172.31.31.144 OpenFlow 189 Type: OFPT_PACKET_IN
331 1.633845723 172.31.24.227 -> 172.31.31.144 OpenFlow 189 Type: OFPT_PACKET_IN
332 1.633871091 172.31.31.144 -> 172.31.24.227 TCP 66 6633 → 39482 [ACK] Seq=1 Ack=370 Win=853 Len=0 TSval=365416 TSecr=118926026
333 1.633902422 172.31.31.144 -> 172.31.24.227 TCP 66 6633 → 39482 [ACK] Seq=1 Ack=985 Win=853 Len=0 TSval=365416 TSecr=118926026
334 1.634009668 172.31.31.144 -> 172.31.24.227 TCP 66 6633 → 39446 [ACK] Seq=1 Ack=1600 Win=853 Len=0 TSval=365416 TSecr=118926026
335 1.634028652 172.31.31.144 -> 172.31.24.227 TCP 66 6633 → 39446 [ACK] Seq=1 Ack=1723 Win=853 Len=0 TSval=365416 TSecr=118926026
336 1.638136662 172.31.31.144 -> 172.31.24.227 OpenFlow 90 Type: OFPT_MULTIPART_REQUEST, OFPMP_PORT_STATS
337 1.638154187 172.31.31.144 -> 172.31.24.227 OpenFlow 122 Type: OFPT_MULTIPART_REQUEST, OFPMP_FLOW
338 1.638340830 172.31.24.227 -> 172.31.31.144 OpenFlow 978 Type: OFPT_MULTIPART_REPLY, OFPMP_PORT_STATS
339 1.638413366 172.31.24.227 -> 172.31.31.144 OpenFlow 2218 Type: OFPT_MULTIPART_REPLY, OFPMP_FLOW
340 1.638662584 172.31.31.144 -> 172.31.24.227 TCP 66 6633 → 39464 [ACK] Seq=81 Ack=4049 Win=853 Len=0 TSval=365418 TSecr=118926027
341 1.639320382 172.31.31.144 -> 172.31.24.227 OpenFlow 82 Type: OFPT_MULTIPART_REQUEST, OFPMP_TABLE
342 1.639552546 172.31.24.227 -> 172.31.31.144 OpenFlow 6178 Type: OFPT_MULTIPART_REPLY, OFPMP_TABLE
343 1.642503375 172.31.31.144 -> 172.31.24.227 OpenFlow 122 Type: OFPT_MULTIPART_REQUEST, OFPMP_FLOW
344 1.642517484 172.31.31.144 -> 172.31.24.227 OpenFlow 106 Type: OFPT_MULTIPART_REQUEST, OFPMP_TABLE
345 1.642682899 172.31.24.227 -> 172.31.31.144 OpenFlow 762 Type: OFPT_MULTIPART_REPLY, OFPMP_FLOW
346 1.642817743 172.31.24.227 -> 172.31.31.144 OpenFlow 978 Type: OFPT_MULTIPART_REPLY, OFPMP_PORT_STATS
347 1.642976110 172.31.24.227 -> 172.31.31.144 OpenFlow 6178 Type: OFPT_MULTIPART_REPLY, OFPMP_TABLE
348 1.643073313 172.31.31.144 -> 172.31.24.227 TCP 66 6633 → 39482 [ACK] Seq=97 Ack=2593 Win=853 Len=0 TSval=365419 TSecr=118926029
349 1.645629207 172.31.31.144 -> 172.31.24.227 OpenFlow 122 Type: OFPT_MULTIPART_REQUEST, OFPMP_FLOW
350 1.645644827 172.31.31.144 -> 172.31.24.227 OpenFlow 90 Type: OFPT_MULTIPART_REQUEST, OFPMP_PORT_STATS
351 1.645717612 172.31.24.227 -> 172.31.31.144 OpenFlow 1594 Type: OFPT_MULTIPART_REPLY, OFPMP_FLOW
352 1.645865492 172.31.24.227 -> 172.31.31.144 OpenFlow 1090 Type: OFPT_MULTIPART_REPLY, OFPMP_PORT_STATS
353 1.646079425 172.31.31.144 -> 172.31.24.227 TCP 66 6633 → 39446 [ACK] Seq=81 Ack=4275 Win=853 Len=0 TSval=365419 TSecr=118926029
354 1.646372883 172.31.31.144 -> 172.31.24.227 TCP 66 6633 → 39490 [ACK] Seq=1307 Ack=7913 Win=853 Len=0 TSval=365420 TSecr=118926020
355 1.647784052 172.31.31.144 -> 172.31.24.227 OpenFlow 90 Type: OFPT_MULTIPART_REQUEST, OFPMP_PORT_STATS
