  1 0.000000000 172.31.31.144 -> 172.31.24.227 TCP 90 6633 → 50430 [PSH, ACK] Seq=1 Ack=1 Win=853 Len=24 TSval=1231330 TSecr=394296502
  2 0.000022027 172.31.31.144 -> 172.31.24.227 TCP 106 6633 → 50430 [PSH, ACK] Seq=25 Ack=1 Win=853 Len=40 TSval=1231330 TSecr=394296502
  3 0.000092432 172.31.31.144 -> 172.31.24.227 TCP 187 6633 → 50456 [PSH, ACK] Seq=1 Ack=1 Win=853 Len=121 TSval=1231330 TSecr=394296577
  4 0.000158361 172.31.31.144 -> 172.31.24.227 TCP 187 6633 → 50456 [PSH, ACK] Seq=122 Ack=1 Win=853 Len=121 TSval=1231330 TSecr=394296577
  5 0.000194094 172.31.31.144 -> 172.31.24.227 TCP 187 6633 → 50456 [PSH, ACK] Seq=243 Ack=1 Win=853 Len=121 TSval=1231330 TSecr=394296577
  6 0.000252990 172.31.24.227 -> 172.31.31.144 OpenFlow 82 Type: OFPT_MULTIPART_REPLY, OFPMP_GROUP
  7 0.000261346 172.31.31.144 -> 172.31.24.227 TCP 187 6633 → 50456 [PSH, ACK] Seq=364 Ack=1 Win=853 Len=121 TSval=1231330 TSecr=394296577
  8 0.000309126 172.31.24.227 -> 172.31.31.144 OpenFlow 98 Type: OFPT_MULTIPART_REPLY, OFPMP_METER
  9 0.000361827 172.31.31.144 -> 172.31.24.227 TCP 187 6633 → 50456 [PSH, ACK] Seq=485 Ack=1 Win=853 Len=121 TSval=1231330 TSecr=394296577
 10 0.000367014 172.31.31.144 -> 172.31.24.227 TCP 187 6633 → 50456 [PSH, ACK] Seq=606 Ack=1 Win=853 Len=121 TSval=1231330 TSecr=394296577
 11 0.000434471 172.31.31.144 -> 172.31.24.227 TCP 187 6633 → 50458 [PSH, ACK] Seq=1 Ack=1 Win=853 Len=121 TSval=1231330 TSecr=394296552
 12 0.000544979 172.31.31.144 -> 172.31.24.227 TCP 66 6633 → 50430 [ACK] Seq=65 Ack=17 Win=853 Len=0 TSval=1231330 TSecr=394296602
 13 0.000553876 172.31.31.144 -> 172.31.24.227 TCP 187 6633 → 50458 [PSH, ACK] Seq=122 Ack=1 Win=853 Len=121 TSval=1231330 TSecr=394296552
 14 0.000557029 172.31.31.144 -> 172.31.24.227 TCP 66 6633 → 50430 [ACK] Seq=65 Ack=49 Win=853 Len=0 TSval=1231330 TSecr=394296602
 15 0.000598374 172.31.31.144 -> 172.31.24.227 TCP 187 6633 → 50458 [PSH, ACK] Seq=243 Ack=1 Win=853 Len=121 TSval=1231330 TSecr=394296552
 16 0.000650758 172.31.31.144 -> 172.31.24.227 TCP 187 6633 → 50458 [PSH, ACK] Seq=364 Ack=1 Win=853 Len=121 TSval=1231330 TSecr=394296552
 17 0.000705074 172.31.31.144 -> 172.31.24.227 TCP 187 6633 → 50458 [PSH, ACK] Seq=485 Ack=1 Win=853 Len=121 TSval=1231330 TSecr=394296552
 18 0.000767106 172.31.31.144 -> 172.31.24.227 TCP 187 6633 → 50458 [PSH, ACK] Seq=606 Ack=1 Win=853 Len=121 TSval=1231330 TSecr=394296552
 19 0.000861166 172.31.24.227 -> 172.31.31.144 TCP 66 50456 → 6633 [ACK] Seq=1 Ack=727 Win=213 Len=0 TSval=394296602 TSecr=1231330
 20 0.000974700 172.31.24.227 -> 172.31.31.144 OpenFlow 189 Type: OFPT_PACKET_IN
 21 0.000996142 172.31.24.227 -> 172.31.31.144 OpenFlow 189 Type: OFPT_PACKET_IN
 22 0.001043326 172.31.24.227 -> 172.31.31.144 OpenFlow 189 Type: OFPT_PACKET_IN
 23 0.001065068 172.31.24.227 -> 172.31.31.144 OpenFlow 189 Type: OFPT_PACKET_IN
 24 0.001107939 172.31.24.227 -> 172.31.31.144 OpenFlow 189 Type: OFPT_PACKET_IN
 25 0.001128090 172.31.24.227 -> 172.31.31.144 OpenFlow 189 Type: OFPT_PACKET_IN
 26 0.001286241 172.31.31.144 -> 172.31.24.227 TCP 66 6633 → 50454 [ACK] Seq=1 Ack=124 Win=853 Len=0 TSval=1231330 TSecr=394296602
 27 0.001294182 172.31.31.144 -> 172.31.24.227 TCP 66 6633 → 50454 [ACK] Seq=1 Ack=247 Win=853 Len=0 TSval=1231330 TSecr=394296602
 28 0.001297011 172.31.31.144 -> 172.31.24.227 TCP 66 6633 → 50448 [ACK] Seq=1 Ack=247 Win=853 Len=0 TSval=1231330 TSecr=394296602
 29 0.001299813 172.31.31.144 -> 172.31.24.227 TCP 66 6633 → 50464 [ACK] Seq=1 Ack=124 Win=853 Len=0 TSval=1231330 TSecr=394296602
 30 0.001410035 172.31.31.144 -> 172.31.24.227 TCP 66 6633 → 50464 [ACK] Seq=1 Ack=247 Win=853 Len=0 TSval=1231330 TSecr=394296602
 31 0.001455297 172.31.24.227 -> 172.31.31.144 TCP 66 50458 → 6633 [ACK] Seq=1 Ack=727 Win=213 Len=0 TSval=394296602 TSecr=1231330
 32 0.001601072 172.31.24.227 -> 172.31.31.144 OpenFlow 189 Type: OFPT_PACKET_IN
 33 0.001621741 172.31.24.227 -> 172.31.31.144 OpenFlow 189 Type: OFPT_PACKET_IN
 34 0.001657196 172.31.24.227 -> 172.31.31.144 OpenFlow 189 Type: OFPT_PACKET_IN
 35 0.001679998 172.31.24.227 -> 172.31.31.144 OpenFlow 189 Type: OFPT_PACKET_IN
 36 0.001699900 172.31.24.227 -> 172.31.31.144 OpenFlow 189 Type: OFPT_PACKET_IN
 37 0.001735218 172.31.24.227 -> 172.31.31.144 OpenFlow 189 Type: OFPT_PACKET_IN
 38 0.001826190 172.31.31.144 -> 172.31.24.227 TCP 66 6633 → 50468 [ACK] Seq=1 Ack=124 Win=853 Len=0 TSval=1231330 TSecr=394296602
 39 0.001833110 172.31.31.144 -> 172.31.24.227 TCP 66 6633 → 50468 [ACK] Seq=1 Ack=247 Win=853 Len=0 TSval=1231330 TSecr=394296602
 40 0.001928021 172.31.31.144 -> 172.31.24.227 TCP 66 6633 → 50450 [ACK] Seq=1 Ack=247 Win=853 Len=0 TSval=1231330 TSecr=394296602
 41 0.001934684 172.31.31.144 -> 172.31.24.227 TCP 66 6633 → 50460 [ACK] Seq=1 Ack=124 Win=853 Len=0 TSval=1231330 TSecr=394296602
 42 0.001938013 172.31.31.144 -> 172.31.24.227 TCP 66 6633 → 50460 [ACK] Seq=1 Ack=247 Win=853 Len=0 TSval=1231330 TSecr=394296602
 43 0.101129850 172.31.31.144 -> 172.31.24.227 TCP 90 6633 → 50432 [PSH, ACK] Seq=1 Ack=1 Win=853 Len=24 TSval=1231355 TSecr=394296502
 44 0.101162383 172.31.31.144 -> 172.31.24.227 TCP 90 6633 → 50434 [PSH, ACK] Seq=1 Ack=1 Win=853 Len=24 TSval=1231355 TSecr=394296502
 45 0.101166722 172.31.31.144 -> 172.31.24.227 TCP 106 6633 → 50432 [PSH, ACK] Seq=25 Ack=1 Win=853 Len=40 TSval=1231355 TSecr=394296502
 46 0.101170745 172.31.31.144 -> 172.31.24.227 TCP 106 6633 → 50434 [PSH, ACK] Seq=25 Ack=1 Win=853 Len=40 TSval=1231355 TSecr=394296502
 47 0.101173356 172.31.31.144 -> 172.31.24.227 OpenFlow 187 Type: OFPT_PACKET_OUT
 48 0.101176559 172.31.31.144 -> 172.31.24.227 OpenFlow 1155 Type: OFPT_PACKET_OUT
 49 0.101179453 172.31.31.144 -> 172.31.24.227 TCP 187 6633 → 50462 [PSH, ACK] Seq=1 Ack=1 Win=853 Len=121 TSval=1231355 TSecr=394296577
 50 0.101182365 172.31.31.144 -> 172.31.24.227 TCP 1155 6633 → 50462 [PSH, ACK] Seq=122 Ack=1 Win=853 Len=1089 TSval=1231355 TSecr=394296577
 51 0.101406426 172.31.24.227 -> 172.31.31.144 OpenFlow 82 Type: OFPT_MULTIPART_REPLY, OFPMP_GROUP
 52 0.101433127 172.31.24.227 -> 172.31.31.144 OpenFlow 82 Type: OFPT_MULTIPART_REPLY, OFPMP_GROUP_DESC
 53 0.101471857 172.31.24.227 -> 172.31.31.144 OpenFlow 82 Type: OFPT_MULTIPART_REPLY, OFPMP_METER
 54 0.101666795 172.31.31.144 -> 172.31.24.227 TCP 66 6633 → 50434 [ACK] Seq=65 Ack=17 Win=853 Len=0 TSval=1231355 TSecr=394296627
 55 0.101675695 172.31.31.144 -> 172.31.24.227 TCP 66 6633 → 50434 [ACK] Seq=65 Ack=33 Win=853 Len=0 TSval=1231355 TSecr=394296627
 56 0.101678407 172.31.31.144 -> 172.31.24.227 TCP 66 6633 → 50434 [ACK] Seq=65 Ack=49 Win=853 Len=0 TSval=1231355 TSecr=394296627
 57 0.102030044 172.31.24.227 -> 172.31.31.144 TCP 66 50460 → 6633 [ACK] Seq=247 Ack=1211 Win=213 Len=0 TSval=394296627 TSecr=1231355
 58 0.102149563 172.31.24.227 -> 172.31.31.144 OpenFlow 82 Type: OFPT_MULTIPART_REPLY, OFPMP_GROUP
 59 0.102171885 172.31.24.227 -> 172.31.31.144 OpenFlow 82 Type: OFPT_MULTIPART_REPLY, OFPMP_GROUP_DESC
 60 0.102195637 172.31.24.227 -> 172.31.31.144 OpenFlow 189 Type: OFPT_PACKET_IN
 61 0.102252554 172.31.24.227 -> 172.31.31.144 OpenFlow 82 Type: OFPT_MULTIPART_REPLY, OFPMP_METER
 62 0.102259445 172.31.24.227 -> 172.31.31.144 OpenFlow 189 Type: OFPT_PACKET_IN
 63 0.102365534 172.31.31.144 -> 172.31.24.227 TCP 66 6633 → 50432 [ACK] Seq=65 Ack=17 Win=853 Len=0 TSval=1231355 TSecr=394296627
 64 0.102373385 172.31.31.144 -> 172.31.24.227 TCP 66 6633 → 50432 [ACK] Seq=65 Ack=33 Win=853 Len=0 TSval=1231355 TSecr=394296627
 65 0.102394426 172.31.31.144 -> 172.31.24.227 TCP 66 6633 → 50462 [ACK] Seq=1211 Ack=124 Win=853 Len=0 TSval=1231355 TSecr=394296627
 66 0.102464091 172.31.31.144 -> 172.31.24.227 TCP 66 6633 → 50432 [ACK] Seq=65 Ack=49 Win=853 Len=0 TSval=1231355 TSecr=394296628
 67 0.102470718 172.31.31.144 -> 172.31.24.227 TCP 66 6633 → 50462 [ACK] Seq=1211 Ack=247 Win=853 Len=0 TSval=1231355 TSecr=394296628
 68 0.102808840 172.31.24.227 -> 172.31.31.144 OpenFlow 189 Type: OFPT_PACKET_IN
 69 0.102833572 172.31.24.227 -> 172.31.31.144 OpenFlow 189 Type: OFPT_PACKET_IN
 70 0.102847287 172.31.24.227 -> 172.31.31.144 OpenFlow 189 Type: OFPT_PACKET_IN
 71 0.102875112 172.31.24.227 -> 172.31.31.144 OpenFlow 189 Type: OFPT_PACKET_IN
 72 0.102897048 172.31.24.227 -> 172.31.31.144 OpenFlow 189 Type: OFPT_PACKET_IN
 73 0.102900420 172.31.24.227 -> 172.31.31.144 OpenFlow 435 Type: OFPT_PACKET_IN
 74 0.102918386 172.31.24.227 -> 172.31.31.144 OpenFlow 189 Type: OFPT_PACKET_IN
 75 0.102976427 172.31.24.227 -> 172.31.31.144 OpenFlow 189 Type: OFPT_PACKET_IN
 76 0.102980068 172.31.24.227 -> 172.31.31.144 OpenFlow 189 Type: OFPT_PACKET_IN
 77 0.103036867 172.31.31.144 -> 172.31.24.227 TCP 66 6633 → 50474 [ACK] Seq=1 Ack=124 Win=853 Len=0 TSval=1231356 TSecr=394296628
 78 0.103043836 172.31.31.144 -> 172.31.24.227 TCP 66 6633 → 50474 [ACK] Seq=1 Ack=247 Win=853 Len=0 TSval=1231356 TSecr=394296628
 79 0.103074882 172.31.24.227 -> 172.31.31.144 OpenFlow 189 Type: OFPT_PACKET_IN
 80 0.103082607 172.31.24.227 -> 172.31.31.144 OpenFlow 189 Type: OFPT_PACKET_IN
 81 0.103119846 172.31.24.227 -> 172.31.31.144 OpenFlow 189 Type: OFPT_PACKET_IN
 82 0.103136858 172.31.24.227 -> 172.31.31.144 OpenFlow 189 Type: OFPT_PACKET_IN
 83 0.103195465 172.31.31.144 -> 172.31.24.227 TCP 66 6633 → 50472 [ACK] Seq=1 Ack=124 Win=853 Len=0 TSval=1231356 TSecr=394296628
 84 0.103201358 172.31.31.144 -> 172.31.24.227 TCP 66 6633 → 50464 [ACK] Seq=1 Ack=370 Win=853 Len=0 TSval=1231356 TSecr=394296628
 85 0.103204259 172.31.31.144 -> 172.31.24.227 TCP 66 6633 → 50470 [ACK] Seq=1 Ack=124 Win=853 Len=0 TSval=1231356 TSecr=394296628
 86 0.103206664 172.31.31.144 -> 172.31.24.227 TCP 66 6633 → 50472 [ACK] Seq=1 Ack=493 Win=853 Len=0 TSval=1231356 TSecr=394296628
 87 0.103313131 172.31.24.227 -> 172.31.31.144 OpenFlow 189 Type: OFPT_PACKET_IN
 88 0.103319808 172.31.24.227 -> 172.31.31.144 OpenFlow 189 Type: OFPT_PACKET_IN
 89 0.103360403 172.31.31.144 -> 172.31.24.227 TCP 66 6633 → 50458 [ACK] Seq=727 Ack=124 Win=853 Len=0 TSval=1231356 TSecr=394296628
 90 0.103365836 172.31.31.144 -> 172.31.24.227 TCP 66 6633 → 50470 [ACK] Seq=1 Ack=247 Win=853 Len=0 TSval=1231356 TSecr=394296628
 91 0.103368386 172.31.31.144 -> 172.31.24.227 TCP 66 6633 → 50464 [ACK] Seq=1 Ack=493 Win=853 Len=0 TSval=1231356 TSecr=394296628
 92 0.103373791 172.31.24.227 -> 172.31.31.144 OpenFlow 189 Type: OFPT_PACKET_IN
 93 0.103442311 172.31.31.144 -> 172.31.24.227 TCP 66 6633 → 50458 [ACK] Seq=727 Ack=247 Win=853 Len=0 TSval=1231356 TSecr=394296628
 94 0.103490307 172.31.31.144 -> 172.31.24.227 TCP 66 6633 → 50460 [ACK] Seq=1211 Ack=370 Win=853 Len=0 TSval=1231356 TSecr=394296628
 95 0.103595483 172.31.31.144 -> 172.31.24.227 TCP 66 6633 → 50460 [ACK] Seq=1211 Ack=493 Win=853 Len=0 TSval=1231356 TSecr=394296628
 96 0.103887436 172.31.31.144 -> 172.31.24.227 TCP 66 6633 → 50452 [ACK] Seq=1 Ack=247 Win=853 Len=0 TSval=1231356 TSecr=394296628
 97 0.104221801 172.31.31.144 -> 172.31.24.227 TCP 66 6633 → 50454 [ACK] Seq=1 Ack=493 Win=853 Len=0 TSval=1231356 TSecr=394296628
 98 0.200779661 172.31.31.144 -> 172.31.24.227 TCP 90 6633 → 50436 [PSH, ACK] Seq=1 Ack=1 Win=853 Len=24 TSval=1231380 TSecr=394296527
 99 0.200804365 172.31.31.144 -> 172.31.24.227 TCP 106 6633 → 50436 [PSH, ACK] Seq=25 Ack=1 Win=853 Len=40 TSval=1231380 TSecr=394296527
100 0.200808820 172.31.31.144 -> 172.31.24.227 TCP 90 6633 → 50438 [PSH, ACK] Seq=1 Ack=1 Win=853 Len=24 TSval=1231380 TSecr=394296502
101 0.200811940 172.31.31.144 -> 172.31.24.227 TCP 106 6633 → 50438 [PSH, ACK] Seq=25 Ack=1 Win=853 Len=40 TSval=1231380 TSecr=394296502
102 0.200814502 172.31.31.144 -> 172.31.24.227 OpenFlow 187 Type: OFPT_PACKET_OUT
103 0.200817685 172.31.31.144 -> 172.31.24.227 OpenFlow 671 Type: OFPT_PACKET_OUT
104 0.200914403 172.31.24.227 -> 172.31.31.144 OpenFlow 82 Type: OFPT_MULTIPART_REPLY, OFPMP_GROUP
105 0.200940180 172.31.24.227 -> 172.31.31.144 OpenFlow 82 Type: OFPT_MULTIPART_REPLY, OFPMP_GROUP_DESC
106 0.200982490 172.31.24.227 -> 172.31.31.144 OpenFlow 82 Type: OFPT_MULTIPART_REPLY, OFPMP_METER
107 0.201186318 172.31.31.144 -> 172.31.24.227 TCP 66 6633 → 50436 [ACK] Seq=65 Ack=17 Win=853 Len=0 TSval=1231380 TSecr=394296652
108 0.201195605 172.31.31.144 -> 172.31.24.227 TCP 66 6633 → 50436 [ACK] Seq=65 Ack=33 Win=853 Len=0 TSval=1231380 TSecr=394296652
109 0.201239452 172.31.31.144 -> 172.31.24.227 TCP 66 6633 → 50436 [ACK] Seq=65 Ack=49 Win=853 Len=0 TSval=1231380 TSecr=394296652
110 0.201421168 172.31.24.227 -> 172.31.31.144 TCP 66 50464 → 6633 [ACK] Seq=493 Ack=727 Win=213 Len=0 TSval=394296652 TSecr=1231380
111 0.201524352 172.31.24.227 -> 172.31.31.144 OpenFlow 82 Type: OFPT_MULTIPART_REPLY, OFPMP_GROUP
112 0.201545945 172.31.24.227 -> 172.31.31.144 OpenFlow 98 Type: OFPT_MULTIPART_REPLY, OFPMP_METER
113 0.201643986 172.31.24.227 -> 172.31.31.144 OpenFlow 189 Type: OFPT_PACKET_IN
114 0.201663171 172.31.24.227 -> 172.31.31.144 OpenFlow 189 Type: OFPT_PACKET_IN
115 0.201730633 172.31.31.144 -> 172.31.24.227 TCP 66 6633 → 50438 [ACK] Seq=65 Ack=17 Win=853 Len=0 TSval=1231380 TSecr=394296652
116 0.201738833 172.31.31.144 -> 172.31.24.227 TCP 66 6633 → 50438 [ACK] Seq=65 Ack=49 Win=853 Len=0 TSval=1231380 TSecr=394296652
117 0.201747898 172.31.24.227 -> 172.31.31.144 OpenFlow 189 Type: OFPT_PACKET_IN
118 0.201761271 172.31.24.227 -> 172.31.31.144 OpenFlow 189 Type: OFPT_PACKET_IN
119 0.201788384 172.31.24.227 -> 172.31.31.144 OpenFlow 189 Type: OFPT_PACKET_IN
120 0.201832553 172.31.31.144 -> 172.31.24.227 TCP 66 6633 → 50456 [ACK] Seq=727 Ack=124 Win=853 Len=0 TSval=1231380 TSecr=394296652
121 0.201843203 172.31.24.227 -> 172.31.31.144 OpenFlow 189 Type: OFPT_PACKET_IN
122 0.201971367 172.31.31.144 -> 172.31.24.227 TCP 66 6633 → 50456 [ACK] Seq=727 Ack=247 Win=853 Len=0 TSval=1231380 TSecr=394296652
123 0.201977893 172.31.31.144 -> 172.31.24.227 TCP 66 6633 → 50462 [ACK] Seq=1211 Ack=370 Win=853 Len=0 TSval=1231380 TSecr=394296652
124 0.201980732 172.31.31.144 -> 172.31.24.227 TCP 66 6633 → 50462 [ACK] Seq=1211 Ack=493 Win=853 Len=0 TSval=1231380 TSecr=394296652
125 0.202019069 172.31.31.144 -> 172.31.24.227 TCP 66 6633 → 50476 [ACK] Seq=1 Ack=124 Win=853 Len=0 TSval=1231380 TSecr=394296652
126 0.202064861 172.31.31.144 -> 172.31.24.227 TCP 66 6633 → 50476 [ACK] Seq=1 Ack=247 Win=853 Len=0 TSval=1231380 TSecr=394296652
127 0.300578581 172.31.31.144 -> 172.31.24.227 TCP 90 6633 → 50440 [PSH, ACK] Seq=1 Ack=1 Win=853 Len=24 TSval=1231405 TSecr=394296552
128 0.300609959 172.31.31.144 -> 172.31.24.227 TCP 106 6633 → 50440 [PSH, ACK] Seq=25 Ack=1 Win=853 Len=40 TSval=1231405 TSecr=394296552
129 0.300614704 172.31.31.144 -> 172.31.24.227 TCP 90 6633 → 50442 [PSH, ACK] Seq=1 Ack=1 Win=853 Len=24 TSval=1231405 TSecr=394296527
130 0.300618376 172.31.31.144 -> 172.31.24.227 TCP 187 6633 → 50466 [PSH, ACK] Seq=1 Ack=1 Win=853 Len=121 TSval=1231405 TSecr=394296552
131 0.300621322 172.31.31.144 -> 172.31.24.227 TCP 106 6633 → 50442 [PSH, ACK] Seq=25 Ack=1 Win=853 Len=40 TSval=1231405 TSecr=394296527
132 0.300623476 172.31.31.144 -> 172.31.24.227 OpenFlow 187 Type: OFPT_PACKET_OUT
133 0.300626333 172.31.31.144 -> 172.31.24.227 TCP 671 6633 → 50466 [PSH, ACK] Seq=122 Ack=1 Win=853 Len=605 TSval=1231405 TSecr=394296552
134 0.300628695 172.31.31.144 -> 172.31.24.227 OpenFlow 913 Type: OFPT_PACKET_OUT
135 0.301173477 172.31.24.227 -> 172.31.31.144 TCP 66 50468 → 6633 [ACK] Seq=247 Ack=969 Win=213 Len=0 TSval=394296677 TSecr=1231405
136 0.301304761 172.31.24.227 -> 172.31.31.144 OpenFlow 82 Type: OFPT_MULTIPART_REPLY, OFPMP_GROUP
137 0.301327024 172.31.24.227 -> 172.31.31.144 OpenFlow 82 Type: OFPT_MULTIPART_REPLY, OFPMP_GROUP_DESC
138 0.301360362 172.31.24.227 -> 172.31.31.144 OpenFlow 82 Type: OFPT_MULTIPART_REPLY, OFPMP_METER
139 0.301386873 172.31.24.227 -> 172.31.31.144 OpenFlow 189 Type: OFPT_PACKET_IN
140 0.301416784 172.31.24.227 -> 172.31.31.144 OpenFlow 189 Type: OFPT_PACKET_IN
141 0.301501460 172.31.31.144 -> 172.31.24.227 TCP 66 6633 → 50440 [ACK] Seq=65 Ack=17 Win=853 Len=0 TSval=1231405 TSecr=394296677
142 0.301510589 172.31.31.144 -> 172.31.24.227 TCP 66 6633 → 50440 [ACK] Seq=65 Ack=33 Win=853 Len=0 TSval=1231405 TSecr=394296677
143 0.301608929 172.31.31.144 -> 172.31.24.227 TCP 66 6633 → 50440 [ACK] Seq=65 Ack=49 Win=853 Len=0 TSval=1231405 TSecr=394296677
144 0.301615412 172.31.31.144 -> 172.31.24.227 TCP 66 6633 → 50466 [ACK] Seq=727 Ack=124 Win=853 Len=0 TSval=1231405 TSecr=394296677
145 0.301619326 172.31.31.144 -> 172.31.24.227 TCP 66 6633 → 50466 [ACK] Seq=727 Ack=247 Win=853 Len=0 TSval=1231405 TSecr=394296677
146 0.301742619 172.31.24.227 -> 172.31.31.144 OpenFlow 189 Type: OFPT_PACKET_IN
147 0.301765004 172.31.24.227 -> 172.31.31.144 OpenFlow 189 Type: OFPT_PACKET_IN
148 0.301785206 172.31.24.227 -> 172.31.31.144 OpenFlow 189 Type: OFPT_PACKET_IN
149 0.301805026 172.31.24.227 -> 172.31.31.144 OpenFlow 82 Type: OFPT_MULTIPART_REPLY, OFPMP_GROUP
150 0.301850071 172.31.24.227 -> 172.31.31.144 OpenFlow 189 Type: OFPT_PACKET_IN
151 0.301856024 172.31.24.227 -> 172.31.31.144 OpenFlow 98 Type: OFPT_MULTIPART_REPLY, OFPMP_METER
152 0.301935231 172.31.24.227 -> 172.31.31.144 OpenFlow 189 Type: OFPT_PACKET_IN
153 0.301973766 172.31.24.227 -> 172.31.31.144 OpenFlow 189 Type: OFPT_PACKET_IN
154 0.302046741 172.31.31.144 -> 172.31.24.227 TCP 66 6633 → 50470 [ACK] Seq=1 Ack=370 Win=853 Len=0 TSval=1231405 TSecr=394296677
155 0.302052810 172.31.31.144 -> 172.31.24.227 TCP 66 6633 → 50470 [ACK] Seq=1 Ack=493 Win=853 Len=0 TSval=1231405 TSecr=394296677
156 0.302074421 172.31.24.227 -> 172.31.31.144 OpenFlow 189 Type: OFPT_PACKET_IN
157 0.302080457 172.31.24.227 -> 172.31.31.144 OpenFlow 189 Type: OFPT_PACKET_IN
158 0.302104846 172.31.31.144 -> 172.31.24.227 TCP 66 6633 → 50458 [ACK] Seq=727 Ack=370 Win=853 Len=0 TSval=1231405 TSecr=394296677
159 0.302109574 172.31.31.144 -> 172.31.24.227 TCP 66 6633 → 50442 [ACK] Seq=65 Ack=17 Win=853 Len=0 TSval=1231405 TSecr=394296677
160 0.302112763 172.31.31.144 -> 172.31.24.227 TCP 66 6633 → 50458 [ACK] Seq=727 Ack=493 Win=853 Len=0 TSval=1231405 TSecr=394296677
161 0.302115254 172.31.31.144 -> 172.31.24.227 TCP 66 6633 → 50442 [ACK] Seq=65 Ack=49 Win=853 Len=0 TSval=1231405 TSecr=394296677
162 0.302274858 172.31.31.144 -> 172.31.24.227 TCP 66 6633 → 50468 [ACK] Seq=969 Ack=370 Win=853 Len=0 TSval=1231405 TSecr=394296677
163 0.302282597 172.31.31.144 -> 172.31.24.227 TCP 66 6633 → 50450 [ACK] Seq=1 Ack=370 Win=853 Len=0 TSval=1231405 TSecr=394296677
164 0.302289046 172.31.31.144 -> 172.31.24.227 TCP 66 6633 → 50468 [ACK] Seq=969 Ack=493 Win=853 Len=0 TSval=1231405 TSecr=394296677
165 0.302291799 172.31.31.144 -> 172.31.24.227 TCP 66 6633 → 50450 [ACK] Seq=1 Ack=493 Win=853 Len=0 TSval=1231405 TSecr=394296677
166 0.400212793 172.31.31.144 -> 172.31.24.227 TCP 90 6633 → 50444 [PSH, ACK] Seq=1 Ack=1 Win=853 Len=24 TSval=1231430 TSecr=394296552
167 0.400253123 172.31.31.144 -> 172.31.24.227 TCP 106 6633 → 50444 [PSH, ACK] Seq=25 Ack=1 Win=853 Len=40 TSval=1231430 TSecr=394296552
168 0.400257519 172.31.31.144 -> 172.31.24.227 TCP 90 6633 → 50446 [PSH, ACK] Seq=1 Ack=1 Win=853 Len=24 TSval=1231430 TSecr=394296577
169 0.400261227 172.31.31.144 -> 172.31.24.227 TCP 106 6633 → 50446 [PSH, ACK] Seq=25 Ack=1 Win=853 Len=40 TSval=1231430 TSecr=394296577
170 0.400263608 172.31.31.144 -> 172.31.24.227 OpenFlow 187 Type: OFPT_PACKET_OUT
171 0.400267245 172.31.31.144 -> 172.31.24.227 OpenFlow 913 Type: OFPT_PACKET_OUT
172 0.400514584 172.31.24.227 -> 172.31.31.144 OpenFlow 82 Type: OFPT_MULTIPART_REPLY, OFPMP_GROUP
173 0.400549489 172.31.24.227 -> 172.31.31.144 OpenFlow 82 Type: OFPT_MULTIPART_REPLY, OFPMP_GROUP
174 0.400596028 172.31.24.227 -> 172.31.31.144 OpenFlow 98 Type: OFPT_MULTIPART_REPLY, OFPMP_METER
175 0.400602112 172.31.24.227 -> 172.31.31.144 OpenFlow 98 Type: OFPT_MULTIPART_REPLY, OFPMP_METER
176 0.400747451 172.31.31.144 -> 172.31.24.227 TCP 66 6633 → 50446 [ACK] Seq=65 Ack=17 Win=853 Len=0 TSval=1231430 TSecr=394296702
177 0.400779106 172.31.31.144 -> 172.31.24.227 TCP 66 6633 → 50446 [ACK] Seq=65 Ack=49 Win=853 Len=0 TSval=1231430 TSecr=394296702
178 0.400868107 172.31.31.144 -> 172.31.24.227 TCP 66 6633 → 50444 [ACK] Seq=65 Ack=49 Win=853 Len=0 TSval=1231430 TSecr=394296702
179 0.401016337 172.31.24.227 -> 172.31.31.144 TCP 66 50470 → 6633 [ACK] Seq=493 Ack=969 Win=213 Len=0 TSval=394296702 TSecr=1231430
180 0.401183104 172.31.24.227 -> 172.31.31.144 OpenFlow 189 Type: OFPT_PACKET_IN
181 0.401203498 172.31.24.227 -> 172.31.31.144 OpenFlow 189 Type: OFPT_PACKET_IN
182 0.401253712 172.31.24.227 -> 172.31.31.144 OpenFlow 189 Type: OFPT_PACKET_IN
183 0.401272347 172.31.24.227 -> 172.31.31.144 OpenFlow 189 Type: OFPT_PACKET_IN
184 0.401346727 172.31.24.227 -> 172.31.31.144 OpenFlow 189 Type: OFPT_PACKET_IN
185 0.401375907 172.31.31.144 -> 172.31.24.227 TCP 66 6633 → 50468 [ACK] Seq=969 Ack=616 Win=853 Len=0 TSval=1231430 TSecr=394296702
186 0.401383990 172.31.31.144 -> 172.31.24.227 TCP 66 6633 → 50468 [ACK] Seq=969 Ack=739 Win=853 Len=0 TSval=1231430 TSecr=394296702
187 0.401389766 172.31.24.227 -> 172.31.31.144 OpenFlow 189 Type: OFPT_PACKET_IN
188 0.401463651 172.31.31.144 -> 172.31.24.227 TCP 66 6633 → 50460 [ACK] Seq=1211 Ack=616 Win=853 Len=0 TSval=1231430 TSecr=394296702
189 0.401469892 172.31.31.144 -> 172.31.24.227 TCP 66 6633 → 50460 [ACK] Seq=1211 Ack=739 Win=853 Len=0 TSval=1231430 TSecr=394296702
190 0.401563417 172.31.31.144 -> 172.31.24.227 TCP 66 6633 → 50472 [ACK] Seq=1 Ack=616 Win=853 Len=0 TSval=1231430 TSecr=394296702
191 0.401568552 172.31.31.144 -> 172.31.24.227 TCP 66 6633 → 50472 [ACK] Seq=1 Ack=739 Win=853 Len=0 TSval=1231430 TSecr=394296702
192 0.500334855 172.31.31.144 -> 172.31.24.227 OpenFlow 90 Type: OFPT_MULTIPART_REQUEST, OFPMP_GROUP
193 0.500354342 172.31.31.144 -> 172.31.24.227 OpenFlow 82 Type: OFPT_MULTIPART_REQUEST, OFPMP_GROUP_DESC
194 0.500358105 172.31.31.144 -> 172.31.24.227 OpenFlow 90 Type: OFPT_MULTIPART_REQUEST, OFPMP_METER
195 0.500360309 172.31.31.144 -> 172.31.24.227 OpenFlow 90 Type: OFPT_MULTIPART_REQUEST, OFPMP_GROUP
196 0.500362901 172.31.31.144 -> 172.31.24.227 OpenFlow 106 Type: OFPT_MULTIPART_REQUEST, OFPMP_METER
197 0.500387508 172.31.31.144 -> 172.31.24.227 OpenFlow 187 Type: OFPT_PACKET_OUT
198 0.500430567 172.31.31.144 -> 172.31.24.227 OpenFlow 187 Type: OFPT_PACKET_OUT
199 0.500466955 172.31.24.227 -> 172.31.31.144 OpenFlow 82 Type: OFPT_MULTIPART_REPLY, OFPMP_GROUP
200 0.500488335 172.31.31.144 -> 172.31.24.227 OpenFlow 187 Type: OFPT_PACKET_OUT
201 0.500495305 172.31.24.227 -> 172.31.31.144 OpenFlow 82 Type: OFPT_MULTIPART_REPLY, OFPMP_GROUP_DESC
202 0.500541277 172.31.24.227 -> 172.31.31.144 OpenFlow 82 Type: OFPT_MULTIPART_REPLY, OFPMP_METER
203 0.500572104 172.31.24.227 -> 172.31.31.144 OpenFlow 82 Type: OFPT_MULTIPART_REPLY, OFPMP_GROUP
204 0.500584289 172.31.31.144 -> 172.31.24.227 OpenFlow 187 Type: OFPT_PACKET_OUT
205 0.500588467 172.31.31.144 -> 172.31.24.227 OpenFlow 187 Type: OFPT_PACKET_OUT
206 0.500636737 172.31.24.227 -> 172.31.31.144 OpenFlow 98 Type: OFPT_MULTIPART_REPLY, OFPMP_METER
207 0.500679383 172.31.31.144 -> 172.31.24.227 OpenFlow 187 Type: OFPT_PACKET_OUT
208 0.500687275 172.31.31.144 -> 172.31.24.227 TCP 66 6633 → 50450 [ACK] Seq=65 Ack=509 Win=853 Len=0 TSval=1231455 TSecr=394296727
209 0.500727230 172.31.31.144 -> 172.31.24.227 TCP 66 6633 → 50450 [ACK] Seq=65 Ack=525 Win=853 Len=0 TSval=1231455 TSecr=394296727
210 0.500787001 172.31.31.144 -> 172.31.24.227 OpenFlow 187 Type: OFPT_PACKET_OUT
211 0.500794333 172.31.31.144 -> 172.31.24.227 TCP 66 6633 → 50450 [ACK] Seq=65 Ack=541 Win=853 Len=0 TSval=1231455 TSecr=394296727
212 0.500824581 172.31.31.144 -> 172.31.24.227 OpenFlow 187 Type: OFPT_PACKET_OUT
213 0.500904896 172.31.31.144 -> 172.31.24.227 OpenFlow 187 Type: OFPT_PACKET_OUT
214 0.500911202 172.31.31.144 -> 172.31.24.227 TCP 66 6633 → 50448 [ACK] Seq=65 Ack=295 Win=853 Len=0 TSval=1231455 TSecr=394296727
215 0.500915354 172.31.31.144 -> 172.31.24.227 OpenFlow 187 Type: OFPT_PACKET_OUT
216 0.501116425 172.31.24.227 -> 172.31.31.144 TCP 66 50472 → 6633 [ACK] Seq=739 Ack=969 Win=213 Len=0 TSval=394296727 TSecr=1231455
217 0.501138102 172.31.31.144 -> 172.31.24.227 OpenFlow 187 Type: OFPT_PACKET_OUT
218 0.501143341 172.31.31.144 -> 172.31.24.227 OpenFlow 671 Type: OFPT_PACKET_OUT
219 0.501232564 172.31.24.227 -> 172.31.31.144 OpenFlow 189 Type: OFPT_PACKET_IN
220 0.501253159 172.31.24.227 -> 172.31.31.144 OpenFlow 189 Type: OFPT_PACKET_IN
221 0.501391503 172.31.24.227 -> 172.31.31.144 OpenFlow 189 Type: OFPT_PACKET_IN
222 0.501451634 172.31.24.227 -> 172.31.31.144 OpenFlow 189 Type: OFPT_PACKET_IN
223 0.501464282 172.31.31.144 -> 172.31.24.227 TCP 66 6633 → 50470 [ACK] Seq=969 Ack=616 Win=853 Len=0 TSval=1231455 TSecr=394296727
224 0.501469907 172.31.31.144 -> 172.31.24.227 TCP 66 6633 → 50470 [ACK] Seq=969 Ack=739 Win=853 Len=0 TSval=1231455 TSecr=394296727
225 0.501491454 172.31.24.227 -> 172.31.31.144 OpenFlow 189 Type: OFPT_PACKET_IN
226 0.501497687 172.31.24.227 -> 172.31.31.144 OpenFlow 189 Type: OFPT_PACKET_IN
227 0.501508773 172.31.24.227 -> 172.31.31.144 OpenFlow 189 Type: OFPT_PACKET_IN
228 0.501569411 172.31.24.227 -> 172.31.31.144 OpenFlow 189 Type: OFPT_PACKET_IN
229 0.501753688 172.31.31.144 -> 172.31.24.227 TCP 66 6633 → 50460 [ACK] Seq=1211 Ack=862 Win=853 Len=0 TSval=1231455 TSecr=394296727
230 0.501761385 172.31.31.144 -> 172.31.24.227 TCP 66 6633 → 50462 [ACK] Seq=1211 Ack=616 Win=853 Len=0 TSval=1231455 TSecr=394296727
231 0.501764017 172.31.31.144 -> 172.31.24.227 TCP 66 6633 → 50460 [ACK] Seq=1211 Ack=985 Win=853 Len=0 TSval=1231455 TSecr=394296727
232 0.501766401 172.31.31.144 -> 172.31.24.227 TCP 66 6633 → 50462 [ACK] Seq=1211 Ack=739 Win=853 Len=0 TSval=1231455 TSecr=394296727
233 0.501768644 172.31.31.144 -> 172.31.24.227 TCP 66 6633 → 50474 [ACK] Seq=969 Ack=370 Win=853 Len=0 TSval=1231455 TSecr=394296727
234 0.501770921 172.31.31.144 -> 172.31.24.227 TCP 66 6633 → 50474 [ACK] Seq=969 Ack=493 Win=853 Len=0 TSval=1231455 TSecr=394296727
235 0.501904678 172.31.24.227 -> 172.31.31.144 OpenFlow 189 Type: OFPT_PACKET_IN
236 0.501925167 172.31.24.227 -> 172.31.31.144 OpenFlow 189 Type: OFPT_PACKET_IN
237 0.502107650 172.31.24.227 -> 172.31.31.144 OpenFlow 189 Type: OFPT_PACKET_IN
238 0.502124545 172.31.31.144 -> 172.31.24.227 TCP 66 6633 → 50472 [ACK] Seq=969 Ack=985 Win=853 Len=0 TSval=1231455 TSecr=394296727
239 0.502133322 172.31.24.227 -> 172.31.31.144 OpenFlow 189 Type: OFPT_PACKET_IN
240 0.502157743 172.31.24.227 -> 172.31.31.144 OpenFlow 189 Type: OFPT_PACKET_IN
241 0.502196719 172.31.24.227 -> 172.31.31.144 OpenFlow 189 Type: OFPT_PACKET_IN
242 0.502325999 172.31.31.144 -> 172.31.24.227 TCP 66 6633 → 50462 [ACK] Seq=1211 Ack=862 Win=853 Len=0 TSval=1231455 TSecr=394296727
243 0.502333531 172.31.31.144 -> 172.31.24.227 TCP 66 6633 → 50462 [ACK] Seq=1211 Ack=985 Win=853 Len=0 TSval=1231455 TSecr=394296727
244 0.502368952 172.31.31.144 -> 172.31.24.227 TCP 66 6633 → 50476 [ACK] Seq=1 Ack=370 Win=853 Len=0 TSval=1231455 TSecr=394296727
245 0.502425999 172.31.31.144 -> 172.31.24.227 TCP 66 6633 → 50476 [ACK] Seq=1 Ack=493 Win=853 Len=0 TSval=1231455 TSecr=394296727
246 0.600336410 172.31.31.144 -> 172.31.24.227 OpenFlow 90 Type: OFPT_MULTIPART_REQUEST, OFPMP_GROUP
247 0.600364322 172.31.31.144 -> 172.31.24.227 OpenFlow 82 Type: OFPT_MULTIPART_REQUEST, OFPMP_GROUP_DESC
248 0.600369346 172.31.31.144 -> 172.31.24.227 OpenFlow 90 Type: OFPT_MULTIPART_REQUEST, OFPMP_METER
249 0.600406922 172.31.31.144 -> 172.31.24.227 OpenFlow 90 Type: OFPT_MULTIPART_REQUEST, OFPMP_GROUP
250 0.600411453 172.31.31.144 -> 172.31.24.227 OpenFlow 82 Type: OFPT_MULTIPART_REQUEST, OFPMP_GROUP_DESC
251 0.600414229 172.31.31.144 -> 172.31.24.227 OpenFlow 90 Type: OFPT_MULTIPART_REQUEST, OFPMP_METER
252 0.600470929 172.31.31.144 -> 172.31.24.227 OpenFlow 187 Type: OFPT_PACKET_OUT
253 0.600510417 172.31.31.144 -> 172.31.24.227 OpenFlow 187 Type: OFPT_PACKET_OUT
254 0.600556884 172.31.31.144 -> 172.31.24.227 OpenFlow 187 Type: OFPT_PACKET_OUT
255 0.600585926 172.31.24.227 -> 172.31.31.144 OpenFlow 82 Type: OFPT_MULTIPART_REPLY, OFPMP_GROUP
256 0.600616239 172.31.31.144 -> 172.31.24.227 OpenFlow 187 Type: OFPT_PACKET_OUT
257 0.600627758 172.31.24.227 -> 172.31.31.144 OpenFlow 98 Type: OFPT_MULTIPART_REPLY, OFPMP_METER
258 0.600674938 172.31.31.144 -> 172.31.24.227 OpenFlow 187 Type: OFPT_PACKET_OUT
259 0.600686726 172.31.24.227 -> 172.31.31.144 OpenFlow 82 Type: OFPT_MULTIPART_REPLY, OFPMP_GROUP
260 0.600728689 172.31.24.227 -> 172.31.31.144 OpenFlow 98 Type: OFPT_MULTIPART_REPLY, OFPMP_METER
261 0.600757224 172.31.31.144 -> 172.31.24.227 OpenFlow 187 Type: OFPT_PACKET_OUT
262 0.600807001 172.31.31.144 -> 172.31.24.227 TCP 66 6633 → 50452 [ACK] Seq=65 Ack=263 Win=853 Len=0 TSval=1231480 TSecr=394296752
263 0.600932923 172.31.31.144 -> 172.31.24.227 TCP 66 6633 → 50452 [ACK] Seq=65 Ack=295 Win=853 Len=0 TSval=1231480 TSecr=394296752
264 0.600940422 172.31.31.144 -> 172.31.24.227 TCP 66 6633 → 50454 [ACK] Seq=65 Ack=509 Win=853 Len=0 TSval=1231480 TSecr=394296752
265 0.600943730 172.31.31.144 -> 172.31.24.227 TCP 66 6633 → 50454 [ACK] Seq=65 Ack=541 Win=853 Len=0 TSval=1231480 TSecr=394296752
266 0.601041946 172.31.24.227 -> 172.31.31.144 TCP 66 50476 → 6633 [ACK] Seq=493 Ack=727 Win=213 Len=0 TSval=394296752 TSecr=1231480
267 0.601128691 172.31.24.227 -> 172.31.31.144 OpenFlow 189 Type: OFPT_PACKET_IN
268 0.601150675 172.31.24.227 -> 172.31.31.144 OpenFlow 189 Type: OFPT_PACKET_IN
269 0.601193089 172.31.24.227 -> 172.31.31.144 OpenFlow 189 Type: OFPT_PACKET_IN
270 0.601212474 172.31.24.227 -> 172.31.31.144 OpenFlow 189 Type: OFPT_PACKET_IN
271 0.601375337 172.31.31.144 -> 172.31.24.227 TCP 66 6633 → 50474 [ACK] Seq=969 Ack=616 Win=853 Len=0 TSval=1231480 TSecr=394296752
272 0.601383297 172.31.31.144 -> 172.31.24.227 TCP 66 6633 → 50474 [ACK] Seq=969 Ack=739 Win=853 Len=0 TSval=1231480 TSecr=394296752
273 0.601386014 172.31.31.144 -> 172.31.24.227 TCP 66 6633 → 50464 [ACK] Seq=727 Ack=616 Win=853 Len=0 TSval=1231480 TSecr=394296752
274 0.601412779 172.31.31.144 -> 172.31.24.227 TCP 66 6633 → 50464 [ACK] Seq=727 Ack=739 Win=853 Len=0 TSval=1231480 TSecr=394296752
275 0.678261845 06:04:7b:d2:2c:8d -> 06:be:66:4e:57:f9 ARP 42 Who has 172.31.16.1? Tell 172.31.24.227
276 0.678466418 06:be:66:4e:57:f9 -> 06:04:7b:d2:2c:8d ARP 60 172.31.16.1 is at 06:be:66:4e:57:f9
277 0.700069718 172.31.31.144 -> 172.31.24.227 OpenFlow 90 Type: OFPT_MULTIPART_REQUEST, OFPMP_GROUP
278 0.700098197 172.31.31.144 -> 172.31.24.227 OpenFlow 90 Type: OFPT_MULTIPART_REQUEST, OFPMP_GROUP
279 0.700102337 172.31.31.144 -> 172.31.24.227 OpenFlow 106 Type: OFPT_MULTIPART_REQUEST, OFPMP_METER
280 0.700106032 172.31.31.144 -> 172.31.24.227 OpenFlow 106 Type: OFPT_MULTIPART_REQUEST, OFPMP_METER
281 0.700302142 172.31.24.227 -> 172.31.31.144 OpenFlow 82 Type: OFPT_MULTIPART_REPLY, OFPMP_GROUP
282 0.700405883 172.31.24.227 -> 172.31.31.144 OpenFlow 98 Type: OFPT_MULTIPART_REPLY, OFPMP_METER
283 0.700514030 172.31.24.227 -> 172.31.31.144 OpenFlow 82 Type: OFPT_MULTIPART_REPLY, OFPMP_GROUP
284 0.700533465 172.31.24.227 -> 172.31.31.144 OpenFlow 82 Type: OFPT_MULTIPART_REPLY, OFPMP_GROUP_DESC
285 0.700611795 172.31.31.144 -> 172.31.24.227 TCP 66 6633 → 50456 [ACK] Seq=791 Ack=263 Win=853 Len=0 TSval=1231505 TSecr=394296777
286 0.700620362 172.31.31.144 -> 172.31.24.227 TCP 66 6633 → 50456 [ACK] Seq=791 Ack=295 Win=853 Len=0 TSval=1231505 TSecr=394296777
287 0.700628155 172.31.24.227 -> 172.31.31.144 OpenFlow 82 Type: OFPT_MULTIPART_REPLY, OFPMP_METER
288 0.700731115 172.31.31.144 -> 172.31.24.227 TCP 66 6633 → 50458 [ACK] Seq=791 Ack=509 Win=853 Len=0 TSval=1231505 TSecr=394296777
289 0.700841250 172.31.31.144 -> 172.31.24.227 TCP 66 6633 → 50458 [ACK] Seq=791 Ack=525 Win=853 Len=0 TSval=1231505 TSecr=394296777
290 0.700875071 172.31.31.144 -> 172.31.24.227 TCP 66 6633 → 50458 [ACK] Seq=791 Ack=541 Win=853 Len=0 TSval=1231505 TSecr=394296777
291 0.726069717 172.31.24.227 -> 172.31.31.144 OpenFlow 146 Type: OFPT_PORT_STATUS
292 0.726153438 172.31.24.227 -> 172.31.31.144 OpenFlow 146 Type: OFPT_PORT_STATUS
293 0.726341825 172.31.31.144 -> 172.31.24.227 TCP 66 6633 → 50446 [ACK] Seq=65 Ack=129 Win=853 Len=0 TSval=1231511 TSecr=394296783
294 0.751147554 172.31.31.144 -> 172.31.24.227 OpenFlow 146 Type: OFPT_FLOW_MOD
295 0.751184210 172.31.31.144 -> 172.31.24.227 OpenFlow 146 Type: OFPT_FLOW_MOD
296 0.751189637 172.31.31.144 -> 172.31.24.227 OpenFlow 74 Type: OFPT_BARRIER_REQUEST
297 0.751192271 172.31.31.144 -> 172.31.24.227 OpenFlow 146 Type: OFPT_FLOW_MOD
298 0.751199234 172.31.31.144 -> 172.31.24.227 OpenFlow 154 Type: OFPT_BARRIER_REQUEST
299 0.751201908 172.31.31.144 -> 172.31.24.227 OpenFlow 146 Type: OFPT_FLOW_MOD
300 0.751205669 172.31.31.144 -> 172.31.24.227 OpenFlow 154 Type: OFPT_BARRIER_REQUEST
301 0.751229368 172.31.31.144 -> 172.31.24.227 OpenFlow 146 Type: OFPT_FLOW_MOD
302 0.751233664 172.31.31.144 -> 172.31.24.227 OpenFlow 154 Type: OFPT_BARRIER_REQUEST
303 0.751351138 172.31.31.144 -> 172.31.24.227 OpenFlow 146 Type: OFPT_FLOW_MOD
304 0.751357980 172.31.31.144 -> 172.31.24.227 OpenFlow 146 Type: OFPT_FLOW_MOD
305 0.751361084 172.31.31.144 -> 172.31.24.227 OpenFlow 74 Type: OFPT_BARRIER_REQUEST
306 0.751363325 172.31.31.144 -> 172.31.24.227 OpenFlow 146 Type: OFPT_FLOW_MOD
307 0.751365832 172.31.31.144 -> 172.31.24.227 OpenFlow 146 Type: OFPT_FLOW_MOD
308 0.751367730 172.31.31.144 -> 172.31.24.227 OpenFlow 74 Type: OFPT_BARRIER_REQUEST
309 0.751509525 172.31.24.227 -> 172.31.31.144 TCP 66 50456 → 6633 [ACK] Seq=295 Ack=959 Win=213 Len=0 TSval=394296790 TSecr=1231518
310 0.751518703 172.31.31.144 -> 172.31.24.227 OpenFlow 146 Type: OFPT_FLOW_MOD
311 0.751524249 172.31.31.144 -> 172.31.24.227 OpenFlow 146 Type: OFPT_FLOW_MOD
312 0.751526632 172.31.31.144 -> 172.31.24.227 OpenFlow 74 Type: OFPT_BARRIER_REQUEST
313 0.751542169 172.31.24.227 -> 172.31.31.144 OpenFlow 74 Type: OFPT_BARRIER_REPLY
314 0.751577849 172.31.31.144 -> 172.31.24.227 OpenFlow 146 Type: OFPT_FLOW_MOD
315 0.751583534 172.31.31.144 -> 172.31.24.227 OpenFlow 146 Type: OFPT_FLOW_MOD
316 0.751586361 172.31.31.144 -> 172.31.24.227 OpenFlow 74 Type: OFPT_BARRIER_REQUEST
317 0.751588400 172.31.31.144 -> 172.31.24.227 OpenFlow 146 Type: OFPT_FLOW_MOD
318 0.751591601 172.31.31.144 -> 172.31.24.227 OpenFlow 146 Type: OFPT_FLOW_MOD
319 0.751661141 172.31.24.227 -> 172.31.31.144 TCP 66 50454 → 6633 [ACK] Seq=541 Ack=233 Win=213 Len=0 TSval=394296790 TSecr=1231518
320 0.751673968 172.31.24.227 -> 172.31.31.144 OpenFlow 74 Type: OFPT_BARRIER_REPLY
321 0.751714032 172.31.24.227 -> 172.31.31.144 TCP 66 50446 → 6633 [ACK] Seq=129 Ack=233 Win=213 Len=0 TSval=394296790 TSecr=1231518
322 0.751720412 172.31.24.227 -> 172.31.31.144 OpenFlow 74 Type: OFPT_BARRIER_REPLY
323 0.751768196 172.31.24.227 -> 172.31.31.144 TCP 66 50462 → 6633 [ACK] Seq=985 Ack=1379 Win=213 Len=0 TSval=394296790 TSecr=1231518
324 0.751775850 172.31.24.227 -> 172.31.31.144 OpenFlow 74 Type: OFPT_BARRIER_REPLY
325 0.751815164 172.31.24.227 -> 172.31.31.144 OpenFlow 74 Type: OFPT_BARRIER_REPLY
326 0.751858309 172.31.24.227 -> 172.31.31.144 TCP 66 50476 → 6633 [ACK] Seq=493 Ack=895 Win=213 Len=0 TSval=394296790 TSecr=1231518
327 0.751864998 172.31.24.227 -> 172.31.31.144 OpenFlow 74 Type: OFPT_BARRIER_REPLY
328 0.751883360 172.31.31.144 -> 172.31.24.227 OpenFlow 74 Type: OFPT_BARRIER_REQUEST
329 0.751887797 172.31.31.144 -> 172.31.24.227 OpenFlow 146 Type: OFPT_FLOW_MOD
330 0.751890362 172.31.31.144 -> 172.31.24.227 OpenFlow 146 Type: OFPT_FLOW_MOD
331 0.751892468 172.31.31.144 -> 172.31.24.227 OpenFlow 74 Type: OFPT_BARRIER_REQUEST
332 0.751894514 172.31.31.144 -> 172.31.24.227 OpenFlow 146 Type: OFPT_FLOW_MOD
333 0.751898568 172.31.31.144 -> 172.31.24.227 OpenFlow 146 Type: OFPT_FLOW_MOD
334 0.751901140 172.31.31.144 -> 172.31.24.227 OpenFlow 74 Type: OFPT_BARRIER_REQUEST
335 0.751903349 172.31.31.144 -> 172.31.24.227 OpenFlow 146 Type: OFPT_FLOW_MOD
336 0.751906105 172.31.31.144 -> 172.31.24.227 OpenFlow 146 Type: OFPT_FLOW_MOD
337 0.751908088 172.31.31.144 -> 172.31.24.227 OpenFlow 74 Type: OFPT_BARRIER_REQUEST
338 0.751909980 172.31.31.144 -> 172.31.24.227 OpenFlow 146 Type: OFPT_FLOW_MOD
339 0.751911907 172.31.31.144 -> 172.31.24.227 OpenFlow 154 Type: OFPT_BARRIER_REQUEST
340 0.752001202 172.31.24.227 -> 172.31.31.144 TCP 66 50430 → 6633 [ACK] Seq=49 Ack=233 Win=213 Len=0 TSval=394296790 TSecr=1231518
341 0.752015386 172.31.24.227 -> 172.31.31.144 OpenFlow 74 Type: OFPT_BARRIER_REPLY
342 0.752060626 172.31.24.227 -> 172.31.31.144 TCP 66 50464 → 6633 [ACK] Seq=739 Ack=895 Win=213 Len=0 TSval=394296790 TSecr=1231518
343 0.752067860 172.31.24.227 -> 172.31.31.144 OpenFlow 74 Type: OFPT_BARRIER_REPLY
344 0.752243579 172.31.24.227 -> 172.31.31.144 OpenFlow 146 Type: OFPT_FLOW_REMOVED
345 0.752259178 172.31.24.227 -> 172.31.31.144 OpenFlow 146 Type: OFPT_FLOW_REMOVED
346 0.752268934 172.31.24.227 -> 172.31.31.144 OpenFlow 146 Type: OFPT_FLOW_REMOVED
347 0.752279485 172.31.24.227 -> 172.31.31.144 OpenFlow 146 Type: OFPT_FLOW_REMOVED
348 0.752565611 172.31.31.144 -> 172.31.24.227 TCP 66 6633 → 50456 [ACK] Seq=959 Ack=303 Win=853 Len=0 TSval=1231518 TSecr=394296790
349 0.752575288 172.31.24.227 -> 172.31.31.144 OpenFlow 146 Type: OFPT_FLOW_REMOVED
350 0.752578400 172.31.31.144 -> 172.31.24.227 OpenFlow 146 Type: OFPT_FLOW_MOD
351 0.752581194 172.31.31.144 -> 172.31.24.227 OpenFlow 154 Type: OFPT_BARRIER_REQUEST
352 0.752583664 172.31.31.144 -> 172.31.24.227 OpenFlow 146 Type: OFPT_FLOW_MOD
353 0.752585843 172.31.31.144 -> 172.31.24.227 OpenFlow 154 Type: OFPT_BARRIER_REQUEST
354 0.752588980 172.31.31.144 -> 172.31.24.227 OpenFlow 146 Type: OFPT_FLOW_MOD
355 0.752592833 172.31.24.227 -> 172.31.31.144 OpenFlow 146 Type: OFPT_FLOW_REMOVED
356 0.752594793 172.31.31.144 -> 172.31.24.227 OpenFlow 146 Type: OFPT_FLOW_MOD
357 0.752596728 172.31.31.144 -> 172.31.24.227 TCP 66 6633 → 50454 [ACK] Seq=233 Ack=549 Win=853 Len=0 TSval=1231518 TSecr=394296790
358 0.752600163 172.31.24.227 -> 172.31.31.144 OpenFlow 146 Type: OFPT_FLOW_REMOVED
359 0.752601807 172.31.31.144 -> 172.31.24.227 OpenFlow 74 Type: OFPT_BARRIER_REQUEST
360 0.752604727 172.31.31.144 -> 172.31.24.227 OpenFlow 146 Type: OFPT_FLOW_MOD
361 0.752608807 172.31.31.144 -> 172.31.24.227 OpenFlow 154 Type: OFPT_BARRIER_REQUEST
362 0.752611523 172.31.31.144 -> 172.31.24.227 OpenFlow 146 Type: OFPT_FLOW_MOD
363 0.752613957 172.31.31.144 -> 172.31.24.227 OpenFlow 154 Type: OFPT_BARRIER_REQUEST
364 0.752615781 172.31.31.144 -> 172.31.24.227 OpenFlow 146 Type: OFPT_FLOW_MOD
365 0.752617646 172.31.31.144 -> 172.31.24.227 OpenFlow 154 Type: OFPT_BARRIER_REQUEST
366 0.752619766 172.31.31.144 -> 172.31.24.227 OpenFlow 146 Type: OFPT_FLOW_MOD
367 0.752621655 172.31.31.144 -> 172.31.24.227 OpenFlow 146 Type: OFPT_FLOW_MOD
368 0.752624829 172.31.24.227 -> 172.31.31.144 OpenFlow 226 Type: OFPT_FLOW_REMOVED
369 0.752626620 172.31.31.144 -> 172.31.24.227 OpenFlow 74 Type: OFPT_BARRIER_REQUEST
370 0.752629001 172.31.31.144 -> 172.31.24.227 TCP 66 6633 → 50462 [ACK] Seq=1379 Ack=993 Win=853 Len=0 TSval=1231518 TSecr=394296790
371 0.752632368 172.31.24.227 -> 172.31.31.144 OpenFlow 146 Type: OFPT_FLOW_REMOVED
372 0.752634278 172.31.31.144 -> 172.31.24.227 OpenFlow 146 Type: OFPT_FLOW_MOD
373 0.752636909 172.31.31.144 -> 172.31.24.227 OpenFlow 146 Type: OFPT_FLOW_MOD
374 0.752639055 172.31.31.144 -> 172.31.24.227 OpenFlow 74 Type: OFPT_BARRIER_REQUEST
375 0.752661487 172.31.24.227 -> 172.31.31.144 OpenFlow 394 Type: OFPT_FLOW_REMOVED
376 0.753770225 172.31.24.227 -> 172.31.31.144 OpenFlow 226 Type: OFPT_FLOW_REMOVED
377 0.753778251 172.31.24.227 -> 172.31.31.144 OpenFlow 226 Type: OFPT_FLOW_REMOVED
378 0.754515882 172.31.31.144 -> 172.31.24.227 OpenFlow 146 Type: OFPT_FLOW_MOD
379 0.754531347 172.31.31.144 -> 172.31.24.227 OpenFlow 146 Type: OFPT_FLOW_MOD
380 0.754535403 172.31.31.144 -> 172.31.24.227 OpenFlow 74 Type: OFPT_BARRIER_REQUEST
381 0.754537727 172.31.31.144 -> 172.31.24.227 OpenFlow 146 Type: OFPT_FLOW_MOD
382 0.754540812 172.31.31.144 -> 172.31.24.227 OpenFlow 154 Type: OFPT_BARRIER_REQUEST
383 0.754543386 172.31.31.144 -> 172.31.24.227 TCP 66 6633 → 50476 [ACK] Seq=1231 Ack=501 Win=853 Len=0 TSval=1231518 TSecr=394296790
384 0.754546649 172.31.31.144 -> 172.31.24.227 OpenFlow 146 Type: OFPT_FLOW_MOD
385 0.754550389 172.31.31.144 -> 172.31.24.227 OpenFlow 154 Type: OFPT_BARRIER_REQUEST
386 0.754552978 172.31.31.144 -> 172.31.24.227 OpenFlow 146 Type: OFPT_FLOW_MOD
387 0.754555521 172.31.31.144 -> 172.31.24.227 OpenFlow 146 Type: OFPT_FLOW_MOD
388 0.754557470 172.31.31.144 -> 172.31.24.227 OpenFlow 74 Type: OFPT_BARRIER_REQUEST
389 0.754559571 172.31.31.144 -> 172.31.24.227 OpenFlow 146 Type: OFPT_FLOW_MOD
390 0.754564580 172.31.31.144 -> 172.31.24.227 OpenFlow 154 Type: OFPT_BARRIER_REQUEST
391 0.754567180 172.31.31.144 -> 172.31.24.227 OpenFlow 146 Type: OFPT_FLOW_MOD
392 0.754570561 172.31.31.144 -> 172.31.24.227 OpenFlow 146 Type: OFPT_FLOW_MOD
393 0.754581274 172.31.31.144 -> 172.31.24.227 OpenFlow 74 Type: OFPT_BARRIER_REQUEST
394 0.754583389 172.31.31.144 -> 172.31.24.227 OpenFlow 146 Type: OFPT_FLOW_MOD
395 0.754586161 172.31.31.144 -> 172.31.24.227 OpenFlow 146 Type: OFPT_FLOW_MOD
396 0.754588454 172.31.31.144 -> 172.31.24.227 OpenFlow 74 Type: OFPT_BARRIER_REQUEST
397 0.754590746 172.31.31.144 -> 172.31.24.227 OpenFlow 146 Type: OFPT_FLOW_MOD
398 0.754593349 172.31.31.144 -> 172.31.24.227 OpenFlow 146 Type: OFPT_FLOW_MOD
399 0.754594909 172.31.31.144 -> 172.31.24.227 OpenFlow 74 Type: OFPT_BARRIER_REQUEST
400 0.754596563 172.31.31.144 -> 172.31.24.227 OpenFlow 146 Type: OFPT_FLOW_MOD
401 0.754598525 172.31.31.144 -> 172.31.24.227 OpenFlow 146 Type: OFPT_FLOW_MOD
402 0.754600724 172.31.31.144 -> 172.31.24.227 OpenFlow 74 Type: OFPT_BARRIER_REQUEST
403 0.754603043 172.31.31.144 -> 172.31.24.227 OpenFlow 146 Type: OFPT_FLOW_MOD
404 0.754604991 172.31.31.144 -> 172.31.24.227 OpenFlow 146 Type: OFPT_FLOW_MOD
405 0.754610548 172.31.31.144 -> 172.31.24.227 OpenFlow 74 Type: OFPT_BARRIER_REQUEST
406 0.754612543 172.31.31.144 -> 172.31.24.227 OpenFlow 146 Type: OFPT_FLOW_MOD
407 0.754614322 172.31.31.144 -> 172.31.24.227 OpenFlow 146 Type: OFPT_FLOW_MOD
408 0.754616152 172.31.31.144 -> 172.31.24.227 OpenFlow 74 Type: OFPT_BARRIER_REQUEST
409 0.754618213 172.31.31.144 -> 172.31.24.227 OpenFlow 146 Type: OFPT_FLOW_MOD
410 0.754620443 172.31.31.144 -> 172.31.24.227 OpenFlow 146 Type: OFPT_FLOW_MOD
411 0.754622862 172.31.31.144 -> 172.31.24.227 OpenFlow 146 Type: OFPT_FLOW_MOD
412 0.754624905 172.31.31.144 -> 172.31.24.227 OpenFlow 146 Type: OFPT_FLOW_MOD
413 0.754626719 172.31.31.144 -> 172.31.24.227 OpenFlow 74 Type: OFPT_BARRIER_REQUEST
414 0.754628405 172.31.31.144 -> 172.31.24.227 TCP 66 6633 → 50430 [ACK] Seq=401 Ack=57 Win=853 Len=0 TSval=1231518 TSecr=394296790
415 0.754630932 172.31.31.144 -> 172.31.24.227 OpenFlow 146 Type: OFPT_FLOW_MOD
416 0.754633321 172.31.31.144 -> 172.31.24.227 OpenFlow 154 Type: OFPT_BARRIER_REQUEST
417 0.754635698 172.31.31.144 -> 172.31.24.227 OpenFlow 146 Type: OFPT_FLOW_MOD
418 0.754637652 172.31.31.144 -> 172.31.24.227 OpenFlow 146 Type: OFPT_FLOW_MOD
419 0.754639773 172.31.31.144 -> 172.31.24.227 OpenFlow 74 Type: OFPT_BARRIER_REQUEST
420 0.754641478 172.31.31.144 -> 172.31.24.227 OpenFlow 146 Type: OFPT_FLOW_MOD
421 0.754643535 172.31.31.144 -> 172.31.24.227 OpenFlow 154 Type: OFPT_BARRIER_REQUEST
422 0.754645547 172.31.31.144 -> 172.31.24.227 TCP 66 6633 → 50464 [ACK] Seq=1567 Ack=747 Win=853 Len=0 TSval=1231518 TSecr=394296790
423 0.754648098 172.31.31.144 -> 172.31.24.227 OpenFlow 146 Type: OFPT_FLOW_MOD
424 0.754650566 172.31.31.144 -> 172.31.24.227 TCP 66 6633 → 50454 [ACK] Seq=233 Ack=629 Win=853 Len=0 TSval=1231518 TSecr=394296790
425 0.754653255 172.31.31.144 -> 172.31.24.227 OpenFlow 146 Type: OFPT_FLOW_MOD
426 0.754655254 172.31.31.144 -> 172.31.24.227 OpenFlow 74 Type: OFPT_BARRIER_REQUEST
427 0.754656930 172.31.31.144 -> 172.31.24.227 OpenFlow 146 Type: OFPT_FLOW_MOD
428 0.754658830 172.31.31.144 -> 172.31.24.227 OpenFlow 234 Type: OFPT_BARRIER_REQUEST
429 0.754661564 172.31.31.144 -> 172.31.24.227 OpenFlow 154 Type: OFPT_BARRIER_REQUEST
430 0.754664188 172.31.31.144 -> 172.31.24.227 OpenFlow 234 Type: OFPT_BARRIER_REQUEST
431 0.754666677 172.31.31.144 -> 172.31.24.227 OpenFlow 146 Type: OFPT_FLOW_MOD
432 0.754669960 172.31.31.144 -> 172.31.24.227 OpenFlow 146 Type: OFPT_FLOW_MOD
433 0.754672967 172.31.31.144 -> 172.31.24.227 OpenFlow 154 Type: OFPT_BARRIER_REQUEST
434 0.754675408 172.31.31.144 -> 172.31.24.227 OpenFlow 146 Type: OFPT_FLOW_MOD
435 0.754678531 172.31.31.144 -> 172.31.24.227 OpenFlow 154 Type: OFPT_BARRIER_REQUEST
436 0.754683620 172.31.31.144 -> 172.31.24.227 OpenFlow 154 Type: OFPT_BARRIER_REQUEST
437 0.754685770 172.31.31.144 -> 172.31.24.227 OpenFlow 146 Type: OFPT_FLOW_MOD
438 0.754688747 172.31.31.144 -> 172.31.24.227 OpenFlow 234 Type: OFPT_BARRIER_REQUEST
439 0.754690929 172.31.31.144 -> 172.31.24.227 OpenFlow 146 Type: OFPT_FLOW_MOD
440 0.754693837 172.31.31.144 -> 172.31.24.227 OpenFlow 146 Type: OFPT_FLOW_MOD
441 0.754695798 172.31.31.144 -> 172.31.24.227 OpenFlow 322 Type: OFPT_BARRIER_REQUEST
442 0.754723421 172.31.31.144 -> 172.31.24.227 OpenFlow 154 Type: OFPT_BARRIER_REQUEST
443 0.754726806 172.31.31.144 -> 172.31.24.227 OpenFlow 154 Type: OFPT_BARRIER_REQUEST
444 0.754729504 172.31.31.144 -> 172.31.24.227 OpenFlow 146 Type: OFPT_FLOW_MOD
445 0.754731572 172.31.31.144 -> 172.31.24.227 TCP 66 6633 → 50456 [ACK] Seq=1623 Ack=463 Win=853 Len=0 TSval=1231518 TSecr=394296790
446 0.754734849 172.31.31.144 -> 172.31.24.227 OpenFlow 154 Type: OFPT_BARRIER_REQUEST
447 0.754736814 172.31.31.144 -> 172.31.24.227 TCP 66 6633 → 50430 [ACK] Seq=401 Ack=217 Win=853 Len=0 TSval=1231519 TSecr=394296790
448 0.754739157 172.31.31.144 -> 172.31.24.227 TCP 66 6633 → 50462 [ACK] Seq=1547 Ack=1153 Win=853 Len=0 TSval=1231519 TSecr=394296790
449 0.754775541 172.31.31.144 -> 172.31.24.227 TCP 66 6633 → 50464 [ACK] Seq=1567 Ack=907 Win=853 Len=0 TSval=1231519 TSecr=394296790
450 0.755163219 172.31.24.227 -> 172.31.31.144 OpenFlow 74 Type: OFPT_BARRIER_REPLY
451 0.755196031 172.31.24.227 -> 172.31.31.144 OpenFlow 74 Type: OFPT_BARRIER_REPLY
452 0.755222473 172.31.24.227 -> 172.31.31.144 OpenFlow 74 Type: OFPT_BARRIER_REPLY
453 0.755272764 172.31.24.227 -> 172.31.31.144 TCP 66 50436 → 6633 [ACK] Seq=49 Ack=233 Win=213 Len=0 TSval=394296791 TSecr=1231518
454 0.755284174 172.31.24.227 -> 172.31.31.144 OpenFlow 74 Type: OFPT_BARRIER_REPLY
455 0.755310876 172.31.24.227 -> 172.31.31.144 TCP 66 50450 → 6633 [ACK] Seq=541 Ack=233 Win=213 Len=0 TSval=394296791 TSecr=1231518
456 0.755321365 172.31.24.227 -> 172.31.31.144 OpenFlow 74 Type: OFPT_BARRIER_REPLY
457 0.755349905 172.31.24.227 -> 172.31.31.144 OpenFlow 74 Type: OFPT_BARRIER_REPLY
458 0.755371953 172.31.31.144 -> 172.31.24.227 OpenFlow 74 Type: OFPT_BARRIER_REQUEST
459 0.755446182 172.31.24.227 -> 172.31.31.144 OpenFlow 90 Type: OFPT_BARRIER_REPLY
460 0.755478428 172.31.24.227 -> 172.31.31.144 TCP 66 50434 → 6633 [ACK] Seq=49 Ack=233 Win=213 Len=0 TSval=394296791 TSecr=1231518
461 0.755484676 172.31.24.227 -> 172.31.31.144 OpenFlow 74 Type: OFPT_BARRIER_REPLY
462 0.755492247 172.31.31.144 -> 172.31.24.227 TCP 66 6633 → 50456 [ACK] Seq=1631 Ack=487 Win=853 Len=0 TSval=1231519 TSecr=394296791
463 0.755497318 172.31.31.144 -> 172.31.24.227 TCP 66 6633 → 50436 [ACK] Seq=233 Ack=57 Win=853 Len=0 TSval=1231519 TSecr=394296791
464 0.755535168 172.31.24.227 -> 172.31.31.144 TCP 66 50454 → 6633 [ACK] Seq=709 Ack=401 Win=213 Len=0 TSval=394296791 TSecr=1231518
465 0.755545187 172.31.24.227 -> 172.31.31.144 OpenFlow 74 Type: OFPT_BARRIER_REPLY
466 0.755572595 172.31.24.227 -> 172.31.31.144 TCP 66 50466 → 6633 [ACK] Seq=247 Ack=895 Win=213 Len=0 TSval=394296791 TSecr=1231518
467 0.755578344 172.31.24.227 -> 172.31.31.144 OpenFlow 74 Type: OFPT_BARRIER_REPLY
468 0.755603534 172.31.24.227 -> 172.31.31.144 OpenFlow 74 Type: OFPT_BARRIER_REPLY
469 0.755609786 172.31.31.144 -> 172.31.24.227 TCP 66 6633 → 50450 [ACK] Seq=233 Ack=549 Win=853 Len=0 TSval=1231519 TSecr=394296791
470 0.755614468 172.31.31.144 -> 172.31.24.227 TCP 66 6633 → 50440 [ACK] Seq=737 Ack=57 Win=853 Len=0 TSval=1231519 TSecr=394296791
471 0.755695902 172.31.24.227 -> 172.31.31.144 TCP 66 50444 → 6633 [ACK] Seq=49 Ack=233 Win=213 Len=0 TSval=394296791 TSecr=1231518
472 0.755711215 172.31.24.227 -> 172.31.31.144 OpenFlow 74 Type: OFPT_BARRIER_REPLY
473 0.755739321 172.31.24.227 -> 172.31.31.144 OpenFlow 74 Type: OFPT_BARRIER_REPLY
474 0.755778065 172.31.31.144 -> 172.31.24.227 TCP 66 6633 → 50440 [ACK] Seq=737 Ack=81 Win=853 Len=0 TSval=1231519 TSecr=394296791
475 0.755783747 172.31.31.144 -> 172.31.24.227 TCP 66 6633 → 50434 [ACK] Seq=233 Ack=57 Win=853 Len=0 TSval=1231519 TSecr=394296791
476 0.755789803 172.31.24.227 -> 172.31.31.144 OpenFlow 106 Type: OFPT_BARRIER_REPLY
477 0.755796605 172.31.24.227 -> 172.31.31.144 TCP 66 50462 → 6633 [ACK] Seq=1153 Ack=1547 Win=213 Len=0 TSval=394296791 TSecr=1231518
478 0.755803259 172.31.24.227 -> 172.31.31.144 OpenFlow 74 Type: OFPT_BARRIER_REPLY
479 0.755830795 172.31.24.227 -> 172.31.31.144 OpenFlow 74 Type: OFPT_BARRIER_REPLY
480 0.755898052 172.31.31.144 -> 172.31.24.227 TCP 66 6633 → 50454 [ACK] Seq=401 Ack=717 Win=853 Len=0 TSval=1231519 TSecr=394296790
481 0.755903952 172.31.31.144 -> 172.31.24.227 TCP 66 6633 → 50466 [ACK] Seq=895 Ack=255 Win=853 Len=0 TSval=1231519 TSecr=394296791
482 0.755909631 172.31.24.227 -> 172.31.31.144 OpenFlow 74 Type: OFPT_BARRIER_REPLY
483 0.755917940 172.31.24.227 -> 172.31.31.144 OpenFlow 74 Type: OFPT_BARRIER_REPLY
484 0.755977271 172.31.24.227 -> 172.31.31.144 OpenFlow 74 Type: OFPT_BARRIER_REPLY
485 0.756024869 172.31.24.227 -> 172.31.31.144 TCP 66 50430 → 6633 [ACK] Seq=217 Ack=401 Win=213 Len=0 TSval=394296791 TSecr=1231518
486 0.756028309 172.31.24.227 -> 172.31.31.144 OpenFlow 98 Type: OFPT_BARRIER_REPLY
487 0.756034064 172.31.24.227 -> 172.31.31.144 OpenFlow 74 Type: OFPT_BARRIER_REPLY
488 0.756064435 172.31.24.227 -> 172.31.31.144 OpenFlow 74 Type: OFPT_BARRIER_REPLY
489 0.756127811 172.31.24.227 -> 172.31.31.144 OpenFlow 74 Type: OFPT_BARRIER_REPLY
490 0.756131040 172.31.24.227 -> 172.31.31.144 OpenFlow 90 Type: OFPT_BARRIER_REPLY
491 0.756152151 172.31.31.144 -> 172.31.24.227 TCP 66 6633 → 50446 [ACK] Seq=1241 Ack=305 Win=853 Len=0 TSval=1231519 TSecr=394296790
492 0.756157848 172.31.31.144 -> 172.31.24.227 TCP 66 6633 → 50432 [ACK] Seq=401 Ack=57 Win=853 Len=0 TSval=1231519 TSecr=394296791
493 0.756160635 172.31.31.144 -> 172.31.24.227 OpenFlow 170 Type: OFPT_FLOW_MOD
494 0.756164989 172.31.31.144 -> 172.31.24.227 OpenFlow 170 Type: OFPT_FLOW_MOD
495 0.756167669 172.31.31.144 -> 172.31.24.227 OpenFlow 74 Type: OFPT_BARRIER_REQUEST
496 0.756355575 172.31.24.227 -> 172.31.31.144 OpenFlow 146 Type: OFPT_FLOW_REMOVED
497 0.756365764 172.31.24.227 -> 172.31.31.144 OpenFlow 74 Type: OFPT_BARRIER_REPLY
498 0.756394502 172.31.24.227 -> 172.31.31.144 OpenFlow 146 Type: OFPT_FLOW_REMOVED
499 0.756404302 172.31.24.227 -> 172.31.31.144 OpenFlow 146 Type: OFPT_FLOW_REMOVED
500 0.756415871 172.31.24.227 -> 172.31.31.144 OpenFlow 146 Type: OFPT_FLOW_REMOVED
501 0.756439637 172.31.24.227 -> 172.31.31.144 OpenFlow 146 Type: OFPT_FLOW_REMOVED
502 0.756449460 172.31.24.227 -> 172.31.31.144 OpenFlow 146 Type: OFPT_FLOW_REMOVED
503 0.756470826 172.31.24.227 -> 172.31.31.144 OpenFlow 146 Type: OFPT_FLOW_REMOVED
504 0.756480738 172.31.24.227 -> 172.31.31.144 OpenFlow 146 Type: OFPT_FLOW_REMOVED
505 0.756515168 172.31.24.227 -> 172.31.31.144 OpenFlow 146 Type: OFPT_FLOW_REMOVED
506 0.756517989 172.31.24.227 -> 172.31.31.144 OpenFlow 90 Type: OFPT_BARRIER_REPLY
507 0.756528262 172.31.24.227 -> 172.31.31.144 OpenFlow 146 Type: OFPT_FLOW_REMOVED
508 0.756530848 172.31.24.227 -> 172.31.31.144 OpenFlow 74 Type: OFPT_BARRIER_REPLY
509 0.756545645 172.31.24.227 -> 172.31.31.144 OpenFlow 146 Type: OFPT_FLOW_REMOVED
510 0.756555501 172.31.24.227 -> 172.31.31.144 OpenFlow 146 Type: OFPT_FLOW_REMOVED
511 0.756584407 172.31.24.227 -> 172.31.31.144 OpenFlow 146 Type: OFPT_FLOW_REMOVED
512 0.756617571 172.31.24.227 -> 172.31.31.144 OpenFlow 146 Type: OFPT_FLOW_REMOVED
513 0.756754081 172.31.31.144 -> 172.31.24.227 TCP 66 6633 → 50448 [ACK] Seq=1241 Ack=719 Win=853 Len=0 TSval=1231519 TSecr=394296790
514 0.756763516 172.31.24.227 -> 172.31.31.144 OpenFlow 786 Type: OFPT_FLOW_REMOVED
515 0.756769835 172.31.31.144 -> 172.31.24.227 TCP 66 6633 → 50432 [ACK] Seq=401 Ack=65 Win=853 Len=0 TSval=1231519 TSecr=394296791
516 0.756774042 172.31.24.227 -> 172.31.31.144 OpenFlow 306 Type: OFPT_FLOW_REMOVED
517 0.756775918 172.31.31.144 -> 172.31.24.227 TCP 66 6633 → 50476 [ACK] Seq=1567 Ack=669 Win=853 Len=0 TSval=1231519 TSecr=394296790
518 0.756779588 172.31.24.227 -> 172.31.31.144 OpenFlow 626 Type: OFPT_FLOW_REMOVED
519 0.756781604 172.31.31.144 -> 172.31.24.227 OpenFlow 170 Type: OFPT_FLOW_MOD
520 0.756786295 172.31.31.144 -> 172.31.24.227 TCP 66 6633 → 50474 [ACK] Seq=1305 Ack=747 Win=853 Len=0 TSval=1231519 TSecr=394296791
521 0.756789783 172.31.24.227 -> 172.31.31.144 OpenFlow 386 Type: OFPT_FLOW_REMOVED
522 0.756791722 172.31.31.144 -> 172.31.24.227 OpenFlow 170 Type: OFPT_FLOW_MOD
523 0.756794365 172.31.31.144 -> 172.31.24.227 OpenFlow 74 Type: OFPT_BARRIER_REQUEST
524 0.756796384 172.31.31.144 -> 172.31.24.227 OpenFlow 170 Type: OFPT_FLOW_MOD
525 0.756809667 172.31.31.144 -> 172.31.24.227 OpenFlow 170 Type: OFPT_FLOW_MOD
526 0.756811718 172.31.31.144 -> 172.31.24.227 OpenFlow 74 Type: OFPT_BARRIER_REQUEST
527 0.756813740 172.31.31.144 -> 172.31.24.227 OpenFlow 170 Type: OFPT_FLOW_MOD
528 0.756815620 172.31.31.144 -> 172.31.24.227 OpenFlow 170 Type: OFPT_FLOW_MOD
529 0.756817358 172.31.31.144 -> 172.31.24.227 OpenFlow 178 Type: OFPT_BARRIER_REQUEST
530 0.756819333 172.31.31.144 -> 172.31.24.227 OpenFlow 178 Type: OFPT_BARRIER_REQUEST
531 0.756820979 172.31.31.144 -> 172.31.24.227 OpenFlow 170 Type: OFPT_FLOW_MOD
532 0.756822770 172.31.31.144 -> 172.31.24.227 OpenFlow 170 Type: OFPT_FLOW_MOD
533 0.756824699 172.31.31.144 -> 172.31.24.227 TCP 66 6633 → 50430 [ACK] Seq=401 Ack=225 Win=853 Len=0 TSval=1231519 TSecr=394296791
534 0.756827932 172.31.24.227 -> 172.31.31.144 OpenFlow 146 Type: OFPT_FLOW_REMOVED
535 0.756829845 172.31.31.144 -> 172.31.24.227 OpenFlow 74 Type: OFPT_BARRIER_REQUEST
536 0.756833238 172.31.24.227 -> 172.31.31.144 OpenFlow 146 Type: OFPT_FLOW_REMOVED
537 0.756835020 172.31.31.144 -> 172.31.24.227 TCP 66 6633 → 50442 [ACK] Seq=401 Ack=57 Win=853 Len=0 TSval=1231519 TSecr=394296791
538 0.756838433 172.31.24.227 -> 172.31.31.144 OpenFlow 386 Type: OFPT_FLOW_REMOVED
539 0.757813339 172.31.24.227 -> 172.31.31.144 OpenFlow 626 Type: OFPT_FLOW_REMOVED
540 0.757817166 172.31.24.227 -> 172.31.31.144 OpenFlow 146 Type: OFPT_FLOW_REMOVED
541 0.757819564 172.31.24.227 -> 172.31.31.144 OpenFlow 626 Type: OFPT_FLOW_REMOVED
542 0.757821706 172.31.24.227 -> 172.31.31.144 OpenFlow 146 Type: OFPT_FLOW_REMOVED
543 0.757823659 172.31.24.227 -> 172.31.31.144 OpenFlow 146 Type: OFPT_FLOW_REMOVED
544 0.757825964 172.31.24.227 -> 172.31.31.144 OpenFlow 146 Type: OFPT_FLOW_REMOVED
545 0.757827764 172.31.24.227 -> 172.31.31.144 OpenFlow 946 Type: OFPT_FLOW_REMOVED
546 0.757829933 172.31.24.227 -> 172.31.31.144 OpenFlow 146 Type: OFPT_FLOW_REMOVED
547 0.757831891 172.31.24.227 -> 172.31.31.144 OpenFlow 706 Type: OFPT_FLOW_REMOVED
548 0.757834454 172.31.24.227 -> 172.31.31.144 OpenFlow 146 Type: OFPT_FLOW_REMOVED
549 0.758044535 172.31.31.144 -> 172.31.24.227 OpenFlow 170 Type: OFPT_FLOW_MOD
550 0.758051008 172.31.31.144 -> 172.31.24.227 OpenFlow 170 Type: OFPT_FLOW_MOD
551 0.758054686 172.31.31.144 -> 172.31.24.227 OpenFlow 170 Type: OFPT_FLOW_MOD
552 0.758056755 172.31.31.144 -> 172.31.24.227 OpenFlow 74 Type: OFPT_BARRIER_REQUEST
553 0.758058825 172.31.31.144 -> 172.31.24.227 OpenFlow 170 Type: OFPT_FLOW_MOD
554 0.758060818 172.31.31.144 -> 172.31.24.227 OpenFlow 74 Type: OFPT_BARRIER_REQUEST
555 0.758063136 172.31.31.144 -> 172.31.24.227 OpenFlow 170 Type: OFPT_FLOW_MOD
556 0.758066307 172.31.31.144 -> 172.31.24.227 OpenFlow 178 Type: OFPT_BARRIER_REQUEST
557 0.758068648 172.31.31.144 -> 172.31.24.227 OpenFlow 170 Type: OFPT_FLOW_MOD
558 0.758070606 172.31.31.144 -> 172.31.24.227 OpenFlow 178 Type: OFPT_BARRIER_REQUEST
559 0.758072240 172.31.31.144 -> 172.31.24.227 TCP 66 6633 → 50436 [ACK] Seq=233 Ack=137 Win=853 Len=0 TSval=1231519 TSecr=394296791
560 0.758075077 172.31.31.144 -> 172.31.24.227 OpenFlow 170 Type: OFPT_FLOW_MOD
561 0.758077691 172.31.31.144 -> 172.31.24.227 OpenFlow 178 Type: OFPT_BARRIER_REQUEST
562 0.758079658 172.31.31.144 -> 172.31.24.227 OpenFlow 170 Type: OFPT_FLOW_MOD
563 0.758083389 172.31.31.144 -> 172.31.24.227 OpenFlow 178 Type: OFPT_BARRIER_REQUEST
564 0.758085556 172.31.31.144 -> 172.31.24.227 TCP 66 6633 → 50464 [ACK] Seq=1567 Ack=915 Win=853 Len=0 TSval=1231519 TSecr=394296791
565 0.758088163 172.31.31.144 -> 172.31.24.227 OpenFlow 170 Type: OFPT_FLOW_MOD
566 0.758090105 172.31.31.144 -> 172.31.24.227 OpenFlow 178 Type: OFPT_BARRIER_REQUEST
567 0.758091886 172.31.31.144 -> 172.31.24.227 OpenFlow 170 Type: OFPT_FLOW_MOD
568 0.758094566 172.31.31.144 -> 172.31.24.227 OpenFlow 170 Type: OFPT_FLOW_MOD
569 0.758096879 172.31.31.144 -> 172.31.24.227 OpenFlow 74 Type: OFPT_BARRIER_REQUEST
570 0.758098841 172.31.31.144 -> 172.31.24.227 OpenFlow 170 Type: OFPT_FLOW_MOD
571 0.758101239 172.31.31.144 -> 172.31.24.227 OpenFlow 178 Type: OFPT_BARRIER_REQUEST
572 0.758102971 172.31.31.144 -> 172.31.24.227 TCP 66 6633 → 50434 [ACK] Seq=233 Ack=137 Win=853 Len=0 TSval=1231519 TSecr=394296791
573 0.758105765 172.31.31.144 -> 172.31.24.227 OpenFlow 170 Type: OFPT_FLOW_MOD
574 0.758107665 172.31.31.144 -> 172.31.24.227 OpenFlow 178 Type: OFPT_BARRIER_REQUEST
575 0.758109656 172.31.31.144 -> 172.31.24.227 OpenFlow 170 Type: OFPT_FLOW_MOD
576 0.758112327 172.31.31.144 -> 172.31.24.227 TCP 66 6633 → 50446 [ACK] Seq=1241 Ack=425 Win=853 Len=0 TSval=1231519 TSecr=394296791
577 0.758114875 172.31.31.144 -> 172.31.24.227 TCP 66 6633 → 50432 [ACK] Seq=401 Ack=145 Win=853 Len=0 TSval=1231519 TSecr=394296791
578 0.758117216 172.31.31.144 -> 172.31.24.227 TCP 66 6633 → 50442 [ACK] Seq=401 Ack=65 Win=853 Len=0 TSval=1231519 TSecr=394296791
579 0.758612673 172.31.31.144 -> 172.31.24.227 TCP 66 6633 → 50432 [ACK] Seq=401 Ack=385 Win=853 Len=0 TSval=1231519 TSecr=394296791
580 0.758620433 172.31.31.144 -> 172.31.24.227 TCP 66 6633 → 50430 [ACK] Seq=617 Ack=385 Win=853 Len=0 TSval=1231519 TSecr=394296791
581 0.758623514 172.31.31.144 -> 172.31.24.227 TCP 66 6633 → 50450 [ACK] Seq=449 Ack=709 Win=853 Len=0 TSval=1231519 TSecr=394296791
582 0.758626389 172.31.31.144 -> 172.31.24.227 TCP 66 6633 → 50442 [ACK] Seq=401 Ack=385 Win=853 Len=0 TSval=1231519 TSecr=394296791
583 0.758628965 172.31.31.144 -> 172.31.24.227 TCP 66 6633 → 50436 [ACK] Seq=233 Ack=217 Win=853 Len=0 TSval=1231519 TSecr=394296791
584 0.758631215 172.31.31.144 -> 172.31.24.227 TCP 66 6633 → 50434 [ACK] Seq=233 Ack=217 Win=853 Len=0 TSval=1231520 TSecr=394296791
585 0.758633616 172.31.31.144 -> 172.31.24.227 TCP 66 6633 → 50454 [ACK] Seq=401 Ack=877 Win=853 Len=0 TSval=1231520 TSecr=394296791
586 0.759024244 172.31.24.227 -> 172.31.31.144 TCP 66 50468 → 6633 [ACK] Seq=739 Ack=1185 Win=213 Len=0 TSval=394296792 TSecr=1231519
587 0.759038242 172.31.24.227 -> 172.31.31.144 OpenFlow 74 Type: OFPT_BARRIER_REPLY
588 0.759058440 172.31.24.227 -> 172.31.31.144 OpenFlow 74 Type: OFPT_BARRIER_REPLY
589 0.759101070 172.31.24.227 -> 172.31.31.144 OpenFlow 74 Type: OFPT_BARRIER_REPLY
590 0.759129556 172.31.24.227 -> 172.31.31.144 TCP 66 50440 → 6633 [ACK] Seq=721 Ack=953 Win=213 Len=0 TSval=394296792 TSecr=1231519
591 0.759141320 172.31.31.144 -> 172.31.24.227 OpenFlow 170 Type: OFPT_FLOW_MOD
592 0.759145864 172.31.31.144 -> 172.31.24.227 OpenFlow 178 Type: OFPT_BARRIER_REQUEST
593 0.759148877 172.31.31.144 -> 172.31.24.227 OpenFlow 170 Type: OFPT_FLOW_MOD
594 0.759152872 172.31.31.144 -> 172.31.24.227 OpenFlow 178 Type: OFPT_BARRIER_REQUEST
595 0.759155382 172.31.31.144 -> 172.31.24.227 OpenFlow 170 Type: OFPT_FLOW_MOD
596 0.759158208 172.31.31.144 -> 172.31.24.227 OpenFlow 170 Type: OFPT_FLOW_MOD
597 0.759160669 172.31.31.144 -> 172.31.24.227 OpenFlow 178 Type: OFPT_BARRIER_REQUEST
598 0.759162755 172.31.31.144 -> 172.31.24.227 OpenFlow 178 Type: OFPT_BARRIER_REQUEST
599 0.759164643 172.31.31.144 -> 172.31.24.227 OpenFlow 170 Type: OFPT_FLOW_MOD
600 0.759166594 172.31.31.144 -> 172.31.24.227 OpenFlow 178 Type: OFPT_BARRIER_REQUEST
601 0.759168286 172.31.31.144 -> 172.31.24.227 OpenFlow 170 Type: OFPT_FLOW_MOD
602 0.759169984 172.31.31.144 -> 172.31.24.227 OpenFlow 178 Type: OFPT_BARRIER_REQUEST
603 0.759171637 172.31.31.144 -> 172.31.24.227 OpenFlow 170 Type: OFPT_FLOW_MOD
604 0.759174507 172.31.31.144 -> 172.31.24.227 OpenFlow 170 Type: OFPT_FLOW_MOD
605 0.759177557 172.31.31.144 -> 172.31.24.227 OpenFlow 178 Type: OFPT_BARRIER_REQUEST
606 0.759180044 172.31.31.144 -> 172.31.24.227 OpenFlow 170 Type: OFPT_FLOW_MOD
607 0.759183201 172.31.31.144 -> 172.31.24.227 OpenFlow 178 Type: OFPT_BARRIER_REQUEST
608 0.759185438 172.31.31.144 -> 172.31.24.227 OpenFlow 178 Type: OFPT_BARRIER_REQUEST
609 0.759204995 172.31.24.227 -> 172.31.31.144 OpenFlow 74 Type: OFPT_BARRIER_REPLY
610 0.759269559 172.31.24.227 -> 172.31.31.144 OpenFlow 74 Type: OFPT_BARRIER_REPLY
611 0.759291150 172.31.24.227 -> 172.31.31.144 OpenFlow 74 Type: OFPT_BARRIER_REPLY
612 0.759344456 172.31.31.144 -> 172.31.24.227 TCP 66 6633 → 50468 [ACK] Seq=1185 Ack=747 Win=853 Len=0 TSval=1231520 TSecr=394296792
613 0.759356248 172.31.24.227 -> 172.31.31.144 OpenFlow 74 Type: OFPT_BARRIER_REPLY
614 0.759381636 172.31.24.227 -> 172.31.31.144 OpenFlow 74 Type: OFPT_BARRIER_REPLY
615 0.759433278 172.31.24.227 -> 172.31.31.144 TCP 66 50444 → 6633 [ACK] Seq=217 Ack=449 Win=213 Len=0 TSval=394296792 TSecr=1231520
616 0.759443897 172.31.24.227 -> 172.31.31.144 OpenFlow 74 Type: OFPT_BARRIER_REPLY
617 0.759472477 172.31.24.227 -> 172.31.31.144 TCP 66 50432 → 6633 [ACK] Seq=385 Ack=617 Win=213 Len=0 TSval=394296792 TSecr=1231520
618 0.759486935 172.31.24.227 -> 172.31.31.144 OpenFlow 74 Type: OFPT_BARRIER_REPLY
619 0.759518540 172.31.24.227 -> 172.31.31.144 OpenFlow 74 Type: OFPT_BARRIER_REPLY
620 0.759545121 172.31.31.144 -> 172.31.24.227 TCP 66 6633 → 50460 [ACK] Seq=1643 Ack=993 Win=853 Len=0 TSval=1231520 TSecr=394296792
621 0.759551031 172.31.31.144 -> 172.31.24.227 TCP 66 6633 → 50460 [ACK] Seq=1643 Ack=1001 Win=853 Len=0 TSval=1231520 TSecr=394296792
622 0.759589128 172.31.24.227 -> 172.31.31.144 TCP 66 50448 → 6633 [ACK] Seq=1551 Ack=1457 Win=213 Len=0 TSval=394296792 TSecr=1231520
623 0.759596900 172.31.24.227 -> 172.31.31.144 OpenFlow 74 Type: OFPT_BARRIER_REPLY
624 0.759603939 172.31.24.227 -> 172.31.31.144 OpenFlow 74 Type: OFPT_BARRIER_REPLY
625 0.759635057 172.31.24.227 -> 172.31.31.144 OpenFlow 74 Type: OFPT_BARRIER_REPLY
626 0.759691064 172.31.24.227 -> 172.31.31.144 OpenFlow 74 Type: OFPT_BARRIER_REPLY
627 0.759730029 172.31.24.227 -> 172.31.31.144 OpenFlow 74 Type: OFPT_BARRIER_REPLY
628 0.759736445 172.31.24.227 -> 172.31.31.144 OpenFlow 74 Type: OFPT_BARRIER_REPLY
629 0.759781571 172.31.24.227 -> 172.31.31.144 TCP 66 50472 → 6633 [ACK] Seq=985 Ack=1185 Win=213 Len=0 TSval=394296792 TSecr=1231519
630 0.759788188 172.31.24.227 -> 172.31.31.144 OpenFlow 74 Type: OFPT_BARRIER_REPLY
631 0.759795028 172.31.24.227 -> 172.31.31.144 OpenFlow 74 Type: OFPT_BARRIER_REPLY
632 0.759824666 172.31.24.227 -> 172.31.31.144 TCP 66 50430 → 6633 [ACK] Seq=385 Ack=617 Win=213 Len=0 TSval=394296792 TSecr=1231519
633 0.759835211 172.31.24.227 -> 172.31.31.144 OpenFlow 74 Type: OFPT_BARRIER_REPLY
634 0.759865917 172.31.24.227 -> 172.31.31.144 TCP 66 50470 → 6633 [ACK] Seq=739 Ack=1185 Win=213 Len=0 TSval=394296792 TSecr=1231519
635 0.759871986 172.31.24.227 -> 172.31.31.144 OpenFlow 74 Type: OFPT_BARRIER_REPLY
636 0.759899819 172.31.24.227 -> 172.31.31.144 TCP 66 50464 → 6633 [ACK] Seq=1579 Ack=1783 Win=213 Len=0 TSval=394296792 TSecr=1231520
637 0.759906247 172.31.24.227 -> 172.31.31.144 OpenFlow 74 Type: OFPT_BARRIER_REPLY
638 0.759936099 172.31.24.227 -> 172.31.31.144 OpenFlow 74 Type: OFPT_BARRIER_REPLY
639 0.760119906 172.31.31.144 -> 172.31.24.227 TCP 66 6633 → 50472 [ACK] Seq=1185 Ack=993 Win=853 Len=0 TSval=1231520 TSecr=394296792
640 0.760134336 172.31.24.227 -> 172.31.31.144 OpenFlow 74 Type: OFPT_BARRIER_REPLY
641 0.760199010 172.31.31.144 -> 172.31.24.227 TCP 66 6633 → 50470 [ACK] Seq=1185 Ack=747 Win=853 Len=0 TSval=1231520 TSecr=394296792
642 0.761067790 172.31.31.144 -> 172.31.24.227 OpenFlow 170 Type: OFPT_FLOW_MOD
643 0.761073861 172.31.31.144 -> 172.31.24.227 OpenFlow 282 Type: OFPT_FLOW_MOD
644 0.761076675 172.31.31.144 -> 172.31.24.227 OpenFlow 170 Type: OFPT_FLOW_MOD
645 0.761080076 172.31.31.144 -> 172.31.24.227 OpenFlow 170 Type: OFPT_FLOW_MOD
646 0.761082320 172.31.31.144 -> 172.31.24.227 OpenFlow 490 Type: OFPT_FLOW_MOD
647 0.761084459 172.31.31.144 -> 172.31.24.227 OpenFlow 386 Type: OFPT_FLOW_MOD
648 0.761086332 172.31.31.144 -> 172.31.24.227 OpenFlow 170 Type: OFPT_FLOW_MOD
649 0.761088181 172.31.31.144 -> 172.31.24.227 OpenFlow 282 Type: OFPT_FLOW_MOD
650 0.761090684 172.31.31.144 -> 172.31.24.227 OpenFlow 170 Type: OFPT_FLOW_MOD
651 0.761093507 172.31.31.144 -> 172.31.24.227 OpenFlow 178 Type: OFPT_BARRIER_REQUEST
652 0.761095643 172.31.31.144 -> 172.31.24.227 OpenFlow 170 Type: OFPT_FLOW_MOD
653 0.761098043 172.31.31.144 -> 172.31.24.227 OpenFlow 386 Type: OFPT_FLOW_MOD
654 0.761100218 172.31.31.144 -> 172.31.24.227 OpenFlow 170 Type: OFPT_FLOW_MOD
655 0.761102761 172.31.31.144 -> 172.31.24.227 OpenFlow 178 Type: OFPT_BARRIER_REQUEST
656 0.761105010 172.31.31.144 -> 172.31.24.227 OpenFlow 170 Type: OFPT_FLOW_MOD
657 0.761107620 172.31.31.144 -> 172.31.24.227 OpenFlow 170 Type: OFPT_FLOW_MOD
658 0.761109729 172.31.31.144 -> 172.31.24.227 OpenFlow 178 Type: OFPT_BARRIER_REQUEST
659 0.761111634 172.31.31.144 -> 172.31.24.227 OpenFlow 178 Type: OFPT_BARRIER_REQUEST
660 0.761113519 172.31.31.144 -> 172.31.24.227 OpenFlow 170 Type: OFPT_FLOW_MOD
661 0.761116316 172.31.31.144 -> 172.31.24.227 OpenFlow 170 Type: OFPT_FLOW_MOD
662 0.761118692 172.31.31.144 -> 172.31.24.227 OpenFlow 170 Type: OFPT_FLOW_MOD
663 0.761121313 172.31.31.144 -> 172.31.24.227 OpenFlow 282 Type: OFPT_FLOW_MOD
664 0.761123326 172.31.31.144 -> 172.31.24.227 OpenFlow 74 Type: OFPT_BARRIER_REQUEST
665 0.761125175 172.31.31.144 -> 172.31.24.227 OpenFlow 170 Type: OFPT_FLOW_MOD
666 0.761135486 172.31.31.144 -> 172.31.24.227 OpenFlow 170 Type: OFPT_FLOW_MOD
667 0.761185370 172.31.31.144 -> 172.31.24.227 OpenFlow 170 Type: OFPT_FLOW_MOD
668 0.761252421 172.31.31.144 -> 172.31.24.227 OpenFlow 170 Type: OFPT_FLOW_MOD
669 0.761305062 172.31.31.144 -> 172.31.24.227 OpenFlow 170 Type: OFPT_FLOW_MOD
670 0.761680274 172.31.24.227 -> 172.31.31.144 OpenFlow 74 Type: OFPT_BARRIER_REPLY
671 0.761715187 172.31.24.227 -> 172.31.31.144 OpenFlow 74 Type: OFPT_BARRIER_REPLY
672 0.761779341 172.31.24.227 -> 172.31.31.144 OpenFlow 74 Type: OFPT_BARRIER_REPLY
673 0.761811265 172.31.24.227 -> 172.31.31.144 OpenFlow 74 Type: OFPT_BARRIER_REPLY
674 0.761863444 172.31.24.227 -> 172.31.31.144 OpenFlow 74 Type: OFPT_BARRIER_REPLY
675 0.761925782 172.31.24.227 -> 172.31.31.144 TCP 66 50460 → 6633 [ACK] Seq=1001 Ack=1859 Win=213 Len=0 TSval=394296792 TSecr=1231520
676 0.761936706 172.31.24.227 -> 172.31.31.144 OpenFlow 74 Type: OFPT_BARRIER_REPLY
677 0.761988821 172.31.24.227 -> 172.31.31.144 OpenFlow 74 Type: OFPT_BARRIER_REPLY
678 0.762037276 172.31.24.227 -> 172.31.31.144 TCP 66 50432 → 6633 [ACK] Seq=393 Ack=833 Win=213 Len=0 TSval=394296792 TSecr=1231520
679 0.762048043 172.31.24.227 -> 172.31.31.144 OpenFlow 74 Type: OFPT_BARRIER_REPLY
680 0.762087973 172.31.24.227 -> 172.31.31.144 OpenFlow 74 Type: OFPT_BARRIER_REPLY
681 0.762141552 172.31.24.227 -> 172.31.31.144 OpenFlow 74 Type: OFPT_BARRIER_REPLY
682 0.762195845 172.31.24.227 -> 172.31.31.144 OpenFlow 74 Type: OFPT_BARRIER_REPLY
683 0.762309012 172.31.24.227 -> 172.31.31.144 TCP 66 50472 → 6633 [ACK] Seq=993 Ack=1401 Win=213 Len=0 TSval=394296793 TSecr=1231520
684 0.762321162 172.31.24.227 -> 172.31.31.144 OpenFlow 74 Type: OFPT_BARRIER_REPLY
685 0.762366790 172.31.24.227 -> 172.31.31.144 TCP 66 50464 → 6633 [ACK] Seq=1587 Ack=1999 Win=213 Len=0 TSval=394296793 TSecr=1231520
686 0.762377672 172.31.24.227 -> 172.31.31.144 OpenFlow 74 Type: OFPT_BARRIER_REPLY
687 0.769116462 172.31.31.144 -> 172.31.24.227 TCP 66 6633 → 50436 [ACK] Seq=769 Ack=233 Win=853 Len=0 TSval=1231522 TSecr=394296792
688 0.769156456 172.31.31.144 -> 172.31.24.227 TCP 66 6633 → 50476 [ACK] Seq=2951 Ack=1365 Win=853 Len=0 TSval=1231522 TSecr=394296792
689 0.769235703 172.31.31.144 -> 172.31.24.227 TCP 66 6633 → 50456 [ACK] Seq=2375 Ack=1151 Win=853 Len=0 TSval=1231522 TSecr=394296792
690 0.769735369 172.31.31.144 -> 172.31.24.227 OpenFlow 170 Type: OFPT_FLOW_MOD
691 0.769744298 172.31.31.144 -> 172.31.24.227 OpenFlow 378 Type: OFPT_FLOW_MOD
692 0.769747487 172.31.31.144 -> 172.31.24.227 OpenFlow 170 Type: OFPT_FLOW_MOD
693 0.769750570 172.31.31.144 -> 172.31.24.227 OpenFlow 378 Type: OFPT_FLOW_MOD
694 0.769835547 172.31.31.144 -> 172.31.24.227 TCP 66 6633 → 50462 [ACK] Seq=1979 Ack=1337 Win=853 Len=0 TSval=1231522 TSecr=394296791
695 0.769911521 172.31.24.227 -> 172.31.31.144 TCP 66 50432 → 6633 [ACK] Seq=401 Ack=1249 Win=213 Len=0 TSval=394296794 TSecr=1231522
696 0.770020820 172.31.24.227 -> 172.31.31.144 TCP 66 50464 → 6633 [ACK] Seq=1595 Ack=2415 Win=213 Len=0 TSval=394296794 TSecr=1231522
697 0.770180122 172.31.31.144 -> 172.31.24.227 OpenFlow 170 Type: OFPT_FLOW_MOD
698 0.770187385 172.31.31.144 -> 172.31.24.227 OpenFlow 170 Type: OFPT_FLOW_MOD
699 0.770192895 172.31.31.144 -> 172.31.24.227 OpenFlow 170 Type: OFPT_FLOW_MOD
700 0.770195504 172.31.31.144 -> 172.31.24.227 OpenFlow 594 Type: OFPT_BARRIER_REQUEST
701 0.770197903 172.31.31.144 -> 172.31.24.227 OpenFlow 178 Type: OFPT_BARRIER_REQUEST
702 0.770200091 172.31.31.144 -> 172.31.24.227 OpenFlow 170 Type: OFPT_FLOW_MOD
703 0.770202968 172.31.31.144 -> 172.31.24.227 TCP 66 6633 → 50466 [ACK] Seq=1215 Ack=423 Win=853 Len=0 TSval=1231522 TSecr=394296791
704 0.770205760 172.31.31.144 -> 172.31.24.227 OpenFlow 394 Type: OFPT_BARRIER_REQUEST
705 0.770208201 172.31.31.144 -> 172.31.24.227 OpenFlow 170 Type: OFPT_FLOW_MOD
706 0.770211383 172.31.31.144 -> 172.31.24.227 OpenFlow 178 Type: OFPT_BARRIER_REQUEST
707 0.770540832 172.31.31.144 -> 172.31.24.227 OpenFlow 170 Type: OFPT_FLOW_MOD
708 0.770558988 172.31.31.144 -> 172.31.24.227 OpenFlow 178 Type: OFPT_BARRIER_REQUEST
709 0.770561442 172.31.31.144 -> 172.31.24.227 OpenFlow 170 Type: OFPT_FLOW_MOD
710 0.770563934 172.31.31.144 -> 172.31.24.227 OpenFlow 178 Type: OFPT_BARRIER_REQUEST
711 0.770565982 172.31.31.144 -> 172.31.24.227 OpenFlow 170 Type: OFPT_FLOW_MOD
712 0.770570694 172.31.31.144 -> 172.31.24.227 OpenFlow 178 Type: OFPT_BARRIER_REQUEST
713 0.770572840 172.31.31.144 -> 172.31.24.227 OpenFlow 170 Type: OFPT_FLOW_MOD
714 0.770576135 172.31.31.144 -> 172.31.24.227 OpenFlow 178 Type: OFPT_BARRIER_REQUEST
715 0.770578557 172.31.31.144 -> 172.31.24.227 OpenFlow 170 Type: OFPT_FLOW_MOD
716 0.770758148 172.31.31.144 -> 172.31.24.227 OpenFlow 170 Type: OFPT_FLOW_MOD
717 0.770763344 172.31.31.144 -> 172.31.24.227 OpenFlow 74 Type: OFPT_BARRIER_REQUEST
718 0.770765453 172.31.31.144 -> 172.31.24.227 OpenFlow 170 Type: OFPT_FLOW_MOD
719 0.770768989 172.31.31.144 -> 172.31.24.227 OpenFlow 170 Type: OFPT_FLOW_MOD
720 0.770771075 172.31.31.144 -> 172.31.24.227 OpenFlow 74 Type: OFPT_BARRIER_REQUEST
721 0.770773315 172.31.31.144 -> 172.31.24.227 OpenFlow 170 Type: OFPT_FLOW_MOD
722 0.770775252 172.31.31.144 -> 172.31.24.227 OpenFlow 170 Type: OFPT_FLOW_MOD
723 0.770777270 172.31.31.144 -> 172.31.24.227 OpenFlow 178 Type: OFPT_BARRIER_REQUEST
724 0.770779194 172.31.31.144 -> 172.31.24.227 OpenFlow 178 Type: OFPT_BARRIER_REQUEST
725 0.771824253 172.31.24.227 -> 172.31.31.144 TCP 66 50452 → 6633 [ACK] Seq=295 Ack=281 Win=213 Len=0 TSval=394296795 TSecr=1231522
726 0.771842683 172.31.24.227 -> 172.31.31.144 OpenFlow 74 Type: OFPT_BARRIER_REPLY
727 0.771890142 172.31.24.227 -> 172.31.31.144 OpenFlow 74 Type: OFPT_BARRIER_REPLY
728 0.771921916 172.31.24.227 -> 172.31.31.144 OpenFlow 74 Type: OFPT_BARRIER_REPLY
729 0.771952300 172.31.24.227 -> 172.31.31.144 OpenFlow 74 Type: OFPT_BARRIER_REPLY
730 0.771990663 172.31.24.227 -> 172.31.31.144 TCP 66 50440 → 6633 [ACK] Seq=745 Ack=1913 Win=213 Len=0 TSval=394296795 TSecr=1231523
731 0.772000793 172.31.24.227 -> 172.31.31.144 OpenFlow 74 Type: OFPT_BARRIER_REPLY
732 0.772045554 172.31.24.227 -> 172.31.31.144 TCP 66 50434 → 6633 [ACK] Seq=217 Ack=449 Win=213 Len=0 TSval=394296795 TSecr=1231522
733 0.772056072 172.31.24.227 -> 172.31.31.144 OpenFlow 74 Type: OFPT_BARRIER_REPLY
734 0.772085448 172.31.24.227 -> 172.31.31.144 TCP 66 50460 → 6633 [ACK] Seq=1009 Ack=2075 Win=213 Len=0 TSval=394296795 TSecr=1231523
735 0.772092120 172.31.24.227 -> 172.31.31.144 OpenFlow 74 Type: OFPT_BARRIER_REPLY
736 0.772116741 172.31.31.144 -> 172.31.24.227 TCP 66 6633 → 50452 [ACK] Seq=281 Ack=303 Win=853 Len=0 TSval=1231523 TSecr=394296795
737 0.772122517 172.31.31.144 -> 172.31.24.227 TCP 66 6633 → 50450 [ACK] Seq=1097 Ack=733 Win=853 Len=0 TSval=1231523 TSecr=394296795
738 0.772173227 172.31.24.227 -> 172.31.31.144 TCP 66 50462 → 6633 [ACK] Seq=1337 Ack=2299 Win=213 Len=0 TSval=394296795 TSecr=1231522
739 0.772183659 172.31.24.227 -> 172.31.31.144 OpenFlow 74 Type: OFPT_BARRIER_REPLY
740 0.772229476 172.31.24.227 -> 172.31.31.144 TCP 66 50476 → 6633 [ACK] Seq=1365 Ack=3167 Win=213 Len=0 TSval=394296795 TSecr=1231522
741 0.772245674 172.31.24.227 -> 172.31.31.144 OpenFlow 74 Type: OFPT_BARRIER_REPLY
742 0.772309251 172.31.24.227 -> 172.31.31.144 OpenFlow 74 Type: OFPT_BARRIER_REPLY
743 0.772344069 172.31.24.227 -> 172.31.31.144 OpenFlow 74 Type: OFPT_BARRIER_REPLY
744 0.772388110 172.31.24.227 -> 172.31.31.144 TCP 66 50430 → 6633 [ACK] Seq=393 Ack=833 Win=213 Len=0 TSval=394296795 TSecr=1231522
745 0.772398074 172.31.24.227 -> 172.31.31.144 OpenFlow 74 Type: OFPT_BARRIER_REPLY
746 0.772443108 172.31.24.227 -> 172.31.31.144 TCP 66 50458 → 6633 [ACK] Seq=557 Ack=1439 Win=213 Len=0 TSval=394296795 TSecr=1231522
747 0.772453317 172.31.24.227 -> 172.31.31.144 OpenFlow 74 Type: OFPT_BARRIER_REPLY
748 0.772566413 172.31.31.144 -> 172.31.24.227 TCP 66 6633 → 50474 [ACK] Seq=2801 Ack=1115 Win=853 Len=0 TSval=1231523 TSecr=394296795
749 0.798714663 172.31.31.144 -> 172.31.24.227 TCP 66 6633 → 50448 [ACK] Seq=1881 Ack=1567 Win=853 Len=0 TSval=1231530 TSecr=394296792
750 0.798735075 172.31.31.144 -> 172.31.24.227 TCP 66 6633 → 50446 [ACK] Seq=1241 Ack=1305 Win=853 Len=0 TSval=1231530 TSecr=394296791
751 0.798739262 172.31.31.144 -> 172.31.24.227 TCP 66 6633 → 50444 [ACK] Seq=769 Ack=233 Win=853 Len=0 TSval=1231530 TSecr=394296792
752 0.800215163 172.31.31.144 -> 172.31.24.227 OpenFlow 90 Type: OFPT_MULTIPART_REQUEST, OFPMP_GROUP
753 0.800225170 172.31.31.144 -> 172.31.24.227 OpenFlow 90 Type: OFPT_MULTIPART_REQUEST, OFPMP_GROUP
754 0.800228660 172.31.31.144 -> 172.31.24.227 OpenFlow 106 Type: OFPT_MULTIPART_REQUEST, OFPMP_METER
755 0.800231801 172.31.31.144 -> 172.31.24.227 OpenFlow 82 Type: OFPT_MULTIPART_REQUEST, OFPMP_GROUP_DESC
756 0.800234210 172.31.31.144 -> 172.31.24.227 OpenFlow 90 Type: OFPT_MULTIPART_REQUEST, OFPMP_METER
757 0.800411542 172.31.24.227 -> 172.31.31.144 OpenFlow 82 Type: OFPT_MULTIPART_REPLY, OFPMP_GROUP
758 0.800436038 172.31.24.227 -> 172.31.31.144 OpenFlow 82 Type: OFPT_MULTIPART_REPLY, OFPMP_GROUP_DESC
759 0.800469860 172.31.24.227 -> 172.31.31.144 OpenFlow 82 Type: OFPT_MULTIPART_REPLY, OFPMP_METER
760 0.800508313 172.31.24.227 -> 172.31.31.144 OpenFlow 82 Type: OFPT_MULTIPART_REPLY, OFPMP_GROUP
761 0.800528418 172.31.24.227 -> 172.31.31.144 OpenFlow 98 Type: OFPT_MULTIPART_REPLY, OFPMP_METER
762 0.800643008 172.31.31.144 -> 172.31.24.227 TCP 66 6633 → 50460 [ACK] Seq=2139 Ack=1049 Win=853 Len=0 TSval=1231530 TSecr=394296802
763 0.800729534 172.31.31.144 -> 172.31.24.227 TCP 66 6633 → 50462 [ACK] Seq=2363 Ack=1393 Win=853 Len=0 TSval=1231530 TSecr=394296802
764 0.802533876 172.31.31.144 -> 172.31.24.227 TCP 66 6633 → 50472 [ACK] Seq=1401 Ack=1001 Win=853 Len=0 TSval=1231531 TSecr=394296793
765 0.810747572 172.31.31.144 -> 172.31.24.227 TCP 66 6633 → 50458 [ACK] Seq=1439 Ack=565 Win=853 Len=0 TSval=1231533 TSecr=394296795
766 0.810754732 172.31.31.144 -> 172.31.24.227 TCP 66 6633 → 50430 [ACK] Seq=833 Ack=401 Win=853 Len=0 TSval=1231533 TSecr=394296795
767 0.810757491 172.31.31.144 -> 172.31.24.227 TCP 66 6633 → 50476 [ACK] Seq=3167 Ack=1373 Win=853 Len=0 TSval=1231533 TSecr=394296795
768 0.810760954 172.31.31.144 -> 172.31.24.227 TCP 66 6633 → 50434 [ACK] Seq=449 Ack=225 Win=853 Len=0 TSval=1231533 TSecr=394296795
769 0.810763857 172.31.31.144 -> 172.31.24.227 TCP 66 6633 → 50450 [ACK] Seq=1097 Ack=741 Win=853 Len=0 TSval=1231533 TSecr=394296795
770 0.810766585 172.31.31.144 -> 172.31.24.227 TCP 66 6633 → 50440 [ACK] Seq=1913 Ack=753 Win=853 Len=0 TSval=1231533 TSecr=394296795
771 0.838662630 172.31.31.144 -> 172.31.24.227 TCP 66 6633 → 50460 [ACK] Seq=2139 Ack=1065 Win=853 Len=0 TSval=1231540 TSecr=394296802
772 0.900349432 172.31.31.144 -> 172.31.24.227 OpenFlow 90 Type: OFPT_MULTIPART_REQUEST, OFPMP_GROUP
773 0.900386764 172.31.31.144 -> 172.31.24.227 OpenFlow 106 Type: OFPT_MULTIPART_REQUEST, OFPMP_METER
774 0.900727412 172.31.24.227 -> 172.31.31.144 OpenFlow 82 Type: OFPT_MULTIPART_REPLY, OFPMP_GROUP
775 0.900755122 172.31.24.227 -> 172.31.31.144 OpenFlow 82 Type: OFPT_MULTIPART_REPLY, OFPMP_GROUP_DESC
776 0.900788878 172.31.24.227 -> 172.31.31.144 OpenFlow 82 Type: OFPT_MULTIPART_REPLY, OFPMP_METER
777 0.900992367 172.31.31.144 -> 172.31.24.227 TCP 66 6633 → 50464 [ACK] Seq=2479 Ack=1643 Win=853 Len=0 TSval=1231555 TSecr=394296827
778 0.999583546 172.31.31.144 -> 172.31.24.227 OpenFlow 90 Type: OFPT_MULTIPART_REQUEST, OFPMP_GROUP
779 0.999613620 172.31.31.144 -> 172.31.24.227 OpenFlow 106 Type: OFPT_MULTIPART_REQUEST, OFPMP_METER
780 0.999618572 172.31.31.144 -> 172.31.24.227 OpenFlow 90 Type: OFPT_MULTIPART_REQUEST, OFPMP_GROUP
781 0.999622182 172.31.31.144 -> 172.31.24.227 OpenFlow 106 Type: OFPT_MULTIPART_REQUEST, OFPMP_METER
782 0.999798889 172.31.24.227 -> 172.31.31.144 OpenFlow 82 Type: OFPT_MULTIPART_REPLY, OFPMP_GROUP
783 0.999829574 172.31.24.227 -> 172.31.31.144 OpenFlow 98 Type: OFPT_MULTIPART_REPLY, OFPMP_METER
784 0.999919018 172.31.24.227 -> 172.31.31.144 OpenFlow 82 Type: OFPT_MULTIPART_REPLY, OFPMP_GROUP
785 0.999944653 172.31.24.227 -> 172.31.31.144 OpenFlow 98 Type: OFPT_MULTIPART_REPLY, OFPMP_METER
786 1.000130986 172.31.31.144 -> 172.31.24.227 TCP 66 6633 → 50468 [ACK] Seq=1249 Ack=763 Win=853 Len=0 TSval=1231580 TSecr=394296852
787 1.000140147 172.31.31.144 -> 172.31.24.227 TCP 66 6633 → 50468 [ACK] Seq=1249 Ack=795 Win=853 Len=0 TSval=1231580 TSecr=394296852
788 1.000288706 172.31.31.144 -> 172.31.24.227 TCP 66 6633 → 50466 [ACK] Seq=1279 Ack=471 Win=853 Len=0 TSval=1231580 TSecr=394296852
789 1.099723587 172.31.31.144 -> 172.31.24.227 OpenFlow 90 Type: OFPT_MULTIPART_REQUEST, OFPMP_GROUP
790 1.099758353 172.31.31.144 -> 172.31.24.227 OpenFlow 106 Type: OFPT_MULTIPART_REQUEST, OFPMP_METER
791 1.100078758 172.31.24.227 -> 172.31.31.144 OpenFlow 82 Type: OFPT_MULTIPART_REPLY, OFPMP_GROUP
792 1.100110838 172.31.24.227 -> 172.31.31.144 OpenFlow 98 Type: OFPT_MULTIPART_REPLY, OFPMP_METER
793 1.100356523 172.31.31.144 -> 172.31.24.227 TCP 66 6633 → 50470 [ACK] Seq=1249 Ack=763 Win=853 Len=0 TSval=1231605 TSecr=394296877
794 1.100365574 172.31.31.144 -> 172.31.24.227 TCP 66 6633 → 50470 [ACK] Seq=1249 Ack=795 Win=853 Len=0 TSval=1231605 TSecr=394296877
795 1.199907879 172.31.31.144 -> 172.31.24.227 OpenFlow 90 Type: OFPT_MULTIPART_REQUEST, OFPMP_GROUP
796 1.199941919 172.31.31.144 -> 172.31.24.227 OpenFlow 106 Type: OFPT_MULTIPART_REQUEST, OFPMP_METER
797 1.199946704 172.31.31.144 -> 172.31.24.227 OpenFlow 90 Type: OFPT_MULTIPART_REQUEST, OFPMP_GROUP
798 1.199950899 172.31.31.144 -> 172.31.24.227 OpenFlow 106 Type: OFPT_MULTIPART_REQUEST, OFPMP_METER
799 1.200247145 172.31.24.227 -> 172.31.31.144 OpenFlow 82 Type: OFPT_MULTIPART_REPLY, OFPMP_GROUP
800 1.200289289 172.31.24.227 -> 172.31.31.144 OpenFlow 98 Type: OFPT_MULTIPART_REPLY, OFPMP_METER
801 1.200312234 172.31.24.227 -> 172.31.31.144 OpenFlow 82 Type: OFPT_MULTIPART_REPLY, OFPMP_GROUP
802 1.200351582 172.31.24.227 -> 172.31.31.144 OpenFlow 98 Type: OFPT_MULTIPART_REPLY, OFPMP_METER
803 1.200548652 172.31.31.144 -> 172.31.24.227 TCP 66 6633 → 50474 [ACK] Seq=2865 Ack=1163 Win=853 Len=0 TSval=1231630 TSecr=394296902
804 1.200557675 172.31.31.144 -> 172.31.24.227 TCP 66 6633 → 50472 [ACK] Seq=1465 Ack=1017 Win=853 Len=0 TSval=1231630 TSecr=394296902
805 1.200560884 172.31.31.144 -> 172.31.24.227 TCP 66 6633 → 50472 [ACK] Seq=1465 Ack=1049 Win=853 Len=0 TSval=1231630 TSecr=394296902
806 1.300025044 172.31.31.144 -> 172.31.24.227 OpenFlow 90 Type: OFPT_MULTIPART_REQUEST, OFPMP_GROUP
807 1.300063137 172.31.31.144 -> 172.31.24.227 OpenFlow 106 Type: OFPT_MULTIPART_REQUEST, OFPMP_METER
808 1.300362637 172.31.24.227 -> 172.31.31.144 OpenFlow 82 Type: OFPT_MULTIPART_REPLY, OFPMP_GROUP
809 1.300392759 172.31.24.227 -> 172.31.31.144 OpenFlow 82 Type: OFPT_MULTIPART_REPLY, OFPMP_GROUP_DESC
810 1.300434319 172.31.24.227 -> 172.31.31.144 OpenFlow 82 Type: OFPT_MULTIPART_REPLY, OFPMP_METER
811 1.300599998 172.31.31.144 -> 172.31.24.227 TCP 66 6633 → 50476 [ACK] Seq=3231 Ack=1389 Win=853 Len=0 TSval=1231655 TSecr=394296927
812 1.300653570 172.31.31.144 -> 172.31.24.227 TCP 66 6633 → 50476 [ACK] Seq=3231 Ack=1405 Win=853 Len=0 TSval=1231655 TSecr=394296927
813 1.300657883 172.31.31.144 -> 172.31.24.227 TCP 66 6633 → 50476 [ACK] Seq=3231 Ack=1421 Win=853 Len=0 TSval=1231655 TSecr=394296927
814 2.409627231 172.31.31.144 -> 172.31.24.227 OpenFlow 187 Type: OFPT_PACKET_OUT
815 2.409657350 172.31.31.144 -> 172.31.24.227 OpenFlow 187 Type: OFPT_PACKET_OUT
816 2.409662554 172.31.31.144 -> 172.31.24.227 OpenFlow 187 Type: OFPT_PACKET_OUT
817 2.409677191 172.31.31.144 -> 172.31.24.227 OpenFlow 187 Type: OFPT_PACKET_OUT
818 2.409708389 172.31.31.144 -> 172.31.24.227 OpenFlow 187 Type: OFPT_PACKET_OUT
819 2.409759737 172.31.31.144 -> 172.31.24.227 OpenFlow 187 Type: OFPT_PACKET_OUT
820 2.410334627 172.31.24.227 -> 172.31.31.144 TCP 66 50430 → 6633 [ACK] Seq=401 Ack=1559 Win=213 Len=0 TSval=394297205 TSecr=1231932
821 2.410578643 172.31.24.227 -> 172.31.31.144 OpenFlow 189 Type: OFPT_PACKET_IN
822 2.410600003 172.31.24.227 -> 172.31.31.144 OpenFlow 189 Type: OFPT_PACKET_IN
823 2.410653752 172.31.24.227 -> 172.31.31.144 OpenFlow 189 Type: OFPT_PACKET_IN
824 2.410671507 172.31.24.227 -> 172.31.31.144 OpenFlow 189 Type: OFPT_PACKET_IN
825 2.410806260 172.31.31.144 -> 172.31.24.227 TCP 66 6633 → 50440 [ACK] Seq=1913 Ack=876 Win=853 Len=0 TSval=1231933 TSecr=394297205
826 2.410815601 172.31.31.144 -> 172.31.24.227 TCP 66 6633 → 50440 [ACK] Seq=1913 Ack=999 Win=853 Len=0 TSval=1231933 TSecr=394297205
827 2.411132634 172.31.31.144 -> 172.31.24.227 TCP 66 6633 → 50432 [ACK] Seq=1249 Ack=647 Win=853 Len=0 TSval=1231933 TSecr=394297205
