  1 0.000000000 172.31.31.144 -> 172.31.24.227 TCP 187 6633 → 49350 [PSH, ACK] Seq=1 Ack=1 Win=853 Len=121 TSval=1084375 TSecr=119644269
  2 0.000027805 172.31.31.144 -> 172.31.24.227 TCP 187 6633 → 49350 [PSH, ACK] Seq=122 Ack=1 Win=853 Len=121 TSval=1084375 TSecr=119644269
  3 0.000032193 172.31.31.144 -> 172.31.24.227 TCP 187 6633 → 49350 [PSH, ACK] Seq=243 Ack=1 Win=853 Len=121 TSval=1084375 TSecr=119644269
  4 0.000053499 172.31.31.144 -> 172.31.24.227 TCP 187 6633 → 49350 [PSH, ACK] Seq=364 Ack=1 Win=853 Len=121 TSval=1084375 TSecr=119644269
  5 0.000104690 172.31.31.144 -> 172.31.24.227 TCP 187 6633 → 49350 [PSH, ACK] Seq=485 Ack=1 Win=853 Len=121 TSval=1084375 TSecr=119644269
  6 0.000114430 172.31.24.227 -> 172.31.31.144 TCP 66 49350 → 6633 [ACK] Seq=1 Ack=606 Win=70 Len=0 TSval=119644985 TSecr=1084375
  7 0.000171255 172.31.31.144 -> 172.31.24.227 TCP 187 6633 → 49350 [PSH, ACK] Seq=606 Ack=1 Win=853 Len=121 TSval=1084375 TSecr=119644269
  8 0.000215175 172.31.31.144 -> 172.31.24.227 TCP 187 6633 → 49350 [PSH, ACK] Seq=727 Ack=1 Win=853 Len=121 TSval=1084375 TSecr=119644269
  9 0.000301520 172.31.31.144 -> 172.31.24.227 TCP 187 6633 → 49350 [PSH, ACK] Seq=848 Ack=1 Win=853 Len=121 TSval=1084375 TSecr=119644269
 10 0.000353037 172.31.31.144 -> 172.31.24.227 TCP 187 6633 → 49350 [PSH, ACK] Seq=969 Ack=1 Win=853 Len=121 TSval=1084375 TSecr=119644269
 11 0.000420809 172.31.31.144 -> 172.31.24.227 TCP 187 6633 → 49350 [PSH, ACK] Seq=1090 Ack=1 Win=853 Len=121 TSval=1084375 TSecr=119644985
 12 0.000426470 172.31.24.227 -> 172.31.31.144 TCP 66 49350 → 6633 [ACK] Seq=1 Ack=1211 Win=70 Len=0 TSval=119644985 TSecr=1084375
 13 0.000936521 172.31.24.227 -> 172.31.31.144 OpenFlow 189 Type: OFPT_PACKET_IN
 14 0.000964373 172.31.24.227 -> 172.31.31.144 OpenFlow 189 Type: OFPT_PACKET_IN
 15 0.000970830 172.31.24.227 -> 172.31.31.144 OpenFlow 189 Type: OFPT_PACKET_IN
 16 0.001009686 172.31.24.227 -> 172.31.31.144 OpenFlow 189 Type: OFPT_PACKET_IN
 17 0.001065635 172.31.24.227 -> 172.31.31.144 OpenFlow 189 Type: OFPT_PACKET_IN
 18 0.001085693 172.31.24.227 -> 172.31.31.144 OpenFlow 189 Type: OFPT_PACKET_IN
 19 0.001091206 172.31.24.227 -> 172.31.31.144 OpenFlow 189 Type: OFPT_PACKET_IN
 20 0.001131442 172.31.24.227 -> 172.31.31.144 OpenFlow 435 Type: OFPT_PACKET_IN
 21 0.001200429 172.31.31.144 -> 172.31.24.227 TCP 66 6633 → 49356 [ACK] Seq=1 Ack=124 Win=853 Len=0 TSval=1084375 TSecr=119644985
 22 0.001235207 172.31.31.144 -> 172.31.24.227 TCP 66 6633 → 49356 [ACK] Seq=1 Ack=247 Win=853 Len=0 TSval=1084375 TSecr=119644985
 23 0.001266901 172.31.31.144 -> 172.31.24.227 TCP 66 6633 → 49384 [ACK] Seq=1 Ack=124 Win=853 Len=0 TSval=1084375 TSecr=119644985
 24 0.001294395 172.31.31.144 -> 172.31.24.227 TCP 66 6633 → 49384 [ACK] Seq=1 Ack=247 Win=853 Len=0 TSval=1084375 TSecr=119644985
 25 0.001321893 172.31.31.144 -> 172.31.24.227 TCP 66 6633 → 49358 [ACK] Seq=1 Ack=247 Win=853 Len=0 TSval=1084375 TSecr=119644985
 26 0.001349675 172.31.31.144 -> 172.31.24.227 TCP 66 6633 → 49386 [ACK] Seq=1 Ack=493 Win=853 Len=0 TSval=1084375 TSecr=119644985
 27 0.077742490 172.31.31.144 -> 172.31.24.227 TCP 122 6633 → 49350 [PSH, ACK] Seq=1211 Ack=1 Win=853 Len=56 TSval=1084394 TSecr=119644985
 28 0.077773812 172.31.31.144 -> 172.31.24.227 TCP 90 6633 → 49350 [PSH, ACK] Seq=1267 Ack=1 Win=853 Len=24 TSval=1084394 TSecr=119644985
 29 0.077947449 172.31.24.227 -> 172.31.31.144 OpenFlow 346 Type: OFPT_MULTIPART_REPLY, OFPMP_FLOW
 30 0.078077048 172.31.24.227 -> 172.31.31.144 OpenFlow 754 Type: OFPT_MULTIPART_REPLY, OFPMP_PORT_STATS
 31 0.078220086 172.31.31.144 -> 172.31.24.227 TCP 66 6633 → 49350 [ACK] Seq=1291 Ack=281 Win=853 Len=0 TSval=1084394 TSecr=119645004
 32 0.078290346 172.31.31.144 -> 172.31.24.227 TCP 66 6633 → 49350 [ACK] Seq=1291 Ack=969 Win=853 Len=0 TSval=1084394 TSecr=119645004
 33 0.079959889 172.31.31.144 -> 172.31.24.227 OpenFlow 82 Type: OFPT_MULTIPART_REQUEST, OFPMP_TABLE
 34 0.080430000 172.31.24.227 -> 172.31.31.144 OpenFlow 6178 Type: OFPT_MULTIPART_REPLY, OFPMP_TABLE
 35 0.081139973 172.31.31.144 -> 172.31.24.227 TCP 122 6633 → 49348 [PSH, ACK] Seq=1 Ack=1 Win=853 Len=56 TSval=1084395 TSecr=119644270
 36 0.081166364 172.31.31.144 -> 172.31.24.227 TCP 90 6633 → 49348 [PSH, ACK] Seq=57 Ack=1 Win=853 Len=24 TSval=1084395 TSecr=119644270
 37 0.081353989 172.31.24.227 -> 172.31.31.144 OpenFlow 1802 Type: OFPT_MULTIPART_REPLY, OFPMP_FLOW
 38 0.081565183 172.31.24.227 -> 172.31.31.144 OpenFlow 1090 Type: OFPT_MULTIPART_REPLY, OFPMP_PORT_STATS
 39 0.081862350 172.31.31.144 -> 172.31.24.227 TCP 66 6633 → 49348 [ACK] Seq=81 Ack=2761 Win=853 Len=0 TSval=1084395 TSecr=119645005
 40 0.083339262 172.31.31.144 -> 172.31.24.227 OpenFlow 82 Type: OFPT_MULTIPART_REQUEST, OFPMP_TABLE
 41 0.083537877 172.31.24.227 -> 172.31.31.144 OpenFlow 6178 Type: OFPT_MULTIPART_REPLY, OFPMP_TABLE
 42 0.099573907 172.31.31.144 -> 172.31.24.227 TCP 122 6633 → 49370 [PSH, ACK] Seq=1 Ack=1 Win=853 Len=56 TSval=1084400 TSecr=119644269
 43 0.099598052 172.31.31.144 -> 172.31.24.227 TCP 90 6633 → 49370 [PSH, ACK] Seq=57 Ack=1 Win=853 Len=24 TSval=1084400 TSecr=119644269
 44 0.099898052 172.31.31.144 -> 172.31.24.227 TCP 187 6633 → 49390 [PSH, ACK] Seq=1 Ack=1 Win=853 Len=121 TSval=1084400 TSecr=119644270
 45 0.099906672 172.31.31.144 -> 172.31.24.227 TCP 187 6633 → 49390 [PSH, ACK] Seq=122 Ack=1 Win=853 Len=121 TSval=1084400 TSecr=119644270
 46 0.099909202 172.31.31.144 -> 172.31.24.227 TCP 187 6633 → 49390 [PSH, ACK] Seq=243 Ack=1 Win=853 Len=121 TSval=1084400 TSecr=119644270
 47 0.100008643 172.31.31.144 -> 172.31.24.227 TCP 187 6633 → 49390 [PSH, ACK] Seq=364 Ack=1 Win=853 Len=121 TSval=1084400 TSecr=119644270
 48 0.100036415 172.31.31.144 -> 172.31.24.227 TCP 187 6633 → 49390 [PSH, ACK] Seq=485 Ack=1 Win=853 Len=121 TSval=1084400 TSecr=119644270
 49 0.100087935 172.31.31.144 -> 172.31.24.227 TCP 187 6633 → 49390 [PSH, ACK] Seq=606 Ack=1 Win=853 Len=121 TSval=1084400 TSecr=119644270
 50 0.100100092 172.31.24.227 -> 172.31.31.144 TCP 66 49390 → 6633 [ACK] Seq=1 Ack=727 Win=73 Len=0 TSval=119645010 TSecr=1084400
 51 0.100199238 172.31.31.144 -> 172.31.24.227 TCP 187 6633 → 49390 [PSH, ACK] Seq=727 Ack=1 Win=853 Len=121 TSval=1084400 TSecr=119644270
 52 0.100236236 172.31.31.144 -> 172.31.24.227 TCP 187 6633 → 49390 [PSH, ACK] Seq=848 Ack=1 Win=853 Len=121 TSval=1084400 TSecr=119644270
 53 0.100313973 172.31.31.144 -> 172.31.24.227 OpenFlow 187 Type: OFPT_PACKET_OUT
 54 0.100322438 172.31.24.227 -> 172.31.31.144 TCP 66 49356 → 6633 [ACK] Seq=247 Ack=122 Win=198 Len=0 TSval=119645010 TSecr=1084400
 55 0.100624255 172.31.31.144 -> 172.31.24.227 OpenFlow 187 Type: OFPT_PACKET_OUT
 56 0.100633369 172.31.24.227 -> 172.31.31.144 TCP 66 49356 → 6633 [ACK] Seq=247 Ack=243 Win=198 Len=0 TSval=119645010 TSecr=1084400
 57 0.100639498 172.31.31.144 -> 172.31.24.227 OpenFlow 187 Type: OFPT_PACKET_OUT
 58 0.100642714 172.31.24.227 -> 172.31.31.144 TCP 66 49356 → 6633 [ACK] Seq=247 Ack=364 Win=198 Len=0 TSval=119645010 TSecr=1084400
 59 0.100644273 172.31.31.144 -> 172.31.24.227 OpenFlow 187 Type: OFPT_PACKET_OUT
 60 0.100646455 172.31.24.227 -> 172.31.31.144 TCP 66 49356 → 6633 [ACK] Seq=247 Ack=485 Win=198 Len=0 TSval=119645010 TSecr=1084400
 61 0.100648017 172.31.31.144 -> 172.31.24.227 OpenFlow 187 Type: OFPT_PACKET_OUT
 62 0.100649741 172.31.24.227 -> 172.31.31.144 TCP 66 49356 → 6633 [ACK] Seq=247 Ack=606 Win=198 Len=0 TSval=119645010 TSecr=1084400
 63 0.100729211 172.31.31.144 -> 172.31.24.227 OpenFlow 187 Type: OFPT_PACKET_OUT
 64 0.100735119 172.31.24.227 -> 172.31.31.144 TCP 66 49356 → 6633 [ACK] Seq=247 Ack=727 Win=198 Len=0 TSval=119645010 TSecr=1084400
 65 0.100740800 172.31.31.144 -> 172.31.24.227 OpenFlow 187 Type: OFPT_PACKET_OUT
 66 0.100743579 172.31.24.227 -> 172.31.31.144 TCP 66 49356 → 6633 [ACK] Seq=247 Ack=848 Win=198 Len=0 TSval=119645010 TSecr=1084400
 67 0.100744951 172.31.31.144 -> 172.31.24.227 OpenFlow 187 Type: OFPT_PACKET_OUT
 68 0.100747142 172.31.24.227 -> 172.31.31.144 TCP 66 49356 → 6633 [ACK] Seq=247 Ack=969 Win=198 Len=0 TSval=119645010 TSecr=1084400
 69 0.100827425 172.31.31.144 -> 172.31.24.227 OpenFlow 187 Type: OFPT_PACKET_OUT
 70 0.100833156 172.31.24.227 -> 172.31.31.144 TCP 66 49356 → 6633 [ACK] Seq=247 Ack=1090 Win=198 Len=0 TSval=119645010 TSecr=1084400
 71 0.100902860 172.31.31.144 -> 172.31.24.227 OpenFlow 187 Type: OFPT_PACKET_OUT
 72 0.100907209 172.31.24.227 -> 172.31.31.144 TCP 66 49356 → 6633 [ACK] Seq=247 Ack=1211 Win=198 Len=0 TSval=119645010 TSecr=1084400
 73 0.100919553 172.31.31.144 -> 172.31.24.227 OpenFlow 187 Type: OFPT_PACKET_OUT
 74 0.100922153 172.31.24.227 -> 172.31.31.144 TCP 66 49356 → 6633 [ACK] Seq=247 Ack=1332 Win=198 Len=0 TSval=119645010 TSecr=1084400
 75 0.100982366 172.31.31.144 -> 172.31.24.227 OpenFlow 187 Type: OFPT_PACKET_OUT
 76 0.100986761 172.31.24.227 -> 172.31.31.144 TCP 66 49356 → 6633 [ACK] Seq=247 Ack=1453 Win=198 Len=0 TSval=119645010 TSecr=1084400
 77 0.101046811 172.31.31.144 -> 172.31.24.227 OpenFlow 187 Type: OFPT_PACKET_OUT
 78 0.101171111 172.31.31.144 -> 172.31.24.227 OpenFlow 187 Type: OFPT_PACKET_OUT
 79 0.101174217 172.31.31.144 -> 172.31.24.227 OpenFlow 187 Type: OFPT_PACKET_OUT
 80 0.101213960 172.31.31.144 -> 172.31.24.227 OpenFlow 187 Type: OFPT_PACKET_OUT
 81 0.101258004 172.31.31.144 -> 172.31.24.227 OpenFlow 187 Type: OFPT_PACKET_OUT
 82 0.101312881 172.31.31.144 -> 172.31.24.227 OpenFlow 187 Type: OFPT_PACKET_OUT
 83 0.101429397 172.31.31.144 -> 172.31.24.227 OpenFlow 187 Type: OFPT_PACKET_OUT
 84 0.101443264 172.31.31.144 -> 172.31.24.227 OpenFlow 187 Type: OFPT_PACKET_OUT
 85 0.101529755 172.31.31.144 -> 172.31.24.227 OpenFlow 187 Type: OFPT_PACKET_OUT
 86 0.101595922 172.31.31.144 -> 172.31.24.227 OpenFlow 187 Type: OFPT_PACKET_OUT
 87 0.105716208 172.31.31.144 -> 172.31.24.227 TCP 90 6633 → 49352 [PSH, ACK] Seq=1 Ack=1 Win=853 Len=24 TSval=1084401 TSecr=119644269
 88 0.105737631 172.31.31.144 -> 172.31.24.227 TCP 122 6633 → 49352 [PSH, ACK] Seq=25 Ack=1 Win=853 Len=56 TSval=1084401 TSecr=119644269
 89 0.105905042 172.31.24.227 -> 172.31.31.144 TCP 66 49348 → 6633 [ACK] Seq=8873 Ack=1307 Win=211 Len=0 TSval=119645011 TSecr=1084400
 90 0.106180460 172.31.31.144 -> 172.31.24.227 OpenFlow 792 Type: OFPT_PACKET_OUT
 91 0.106958746 172.31.31.144 -> 172.31.24.227 TCP 82 6633 → 49352 [PSH, ACK] Seq=81 Ack=1 Win=853 Len=16 TSval=1084402 TSecr=119644269
 92 0.107006983 172.31.31.144 -> 172.31.24.227 TCP 82 6633 → 49370 [PSH, ACK] Seq=81 Ack=1 Win=853 Len=16 TSval=1084402 TSecr=119644269
 93 0.107224381 172.31.24.227 -> 172.31.31.144 OpenFlow 1090 Type: OFPT_MULTIPART_REPLY, OFPMP_PORT_STATS
 94 0.107308621 172.31.24.227 -> 172.31.31.144 OpenFlow 2218 Type: OFPT_MULTIPART_REPLY, OFPMP_FLOW
 95 0.107483298 172.31.24.227 -> 172.31.31.144 OpenFlow 6178 Type: OFPT_MULTIPART_REPLY, OFPMP_TABLE
 96 0.107494343 172.31.31.144 -> 172.31.24.227 TCP 66 6633 → 49352 [ACK] Seq=97 Ack=1025 Win=853 Len=0 TSval=1084402 TSecr=119645012
 97 0.107537611 172.31.31.144 -> 172.31.24.227 TCP 66 6633 → 49352 [ACK] Seq=97 Ack=3177 Win=853 Len=0 TSval=1084402 TSecr=119645012
 98 0.107743693 172.31.31.144 -> 172.31.24.227 TCP 66 6633 → 49352 [ACK] Seq=97 Ack=9289 Win=853 Len=0 TSval=1084402 TSecr=119645012
 99 0.108001940 172.31.24.227 -> 172.31.31.144 OpenFlow 189 Type: OFPT_PACKET_IN
100 0.108027185 172.31.24.227 -> 172.31.31.144 OpenFlow 681 Type: OFPT_PACKET_IN
101 0.108139902 172.31.24.227 -> 172.31.31.144 OpenFlow 2634 Type: OFPT_MULTIPART_REPLY, OFPMP_FLOW
102 0.108274325 172.31.24.227 -> 172.31.31.144 OpenFlow 978 Type: OFPT_MULTIPART_REPLY, OFPMP_PORT_STATS
103 0.108318777 172.31.31.144 -> 172.31.24.227 TCP 66 6633 → 49358 [ACK] Seq=1 Ack=985 Win=853 Len=0 TSval=1084402 TSecr=119645012
104 0.108370095 172.31.31.144 -> 172.31.24.227 TCP 66 6633 → 49370 [ACK] Seq=97 Ack=2569 Win=853 Len=0 TSval=1084402 TSecr=119645012
105 0.108440901 172.31.24.227 -> 172.31.31.144 OpenFlow 6178 Type: OFPT_MULTIPART_REPLY, OFPMP_TABLE
106 0.108480428 172.31.24.227 -> 172.31.31.144 OpenFlow 189 Type: OFPT_PACKET_IN
107 0.108497671 172.31.31.144 -> 172.31.24.227 TCP 66 6633 → 49370 [ACK] Seq=97 Ack=3481 Win=853 Len=0 TSval=1084402 TSecr=119645012
108 0.108503336 172.31.24.227 -> 172.31.31.144 OpenFlow 435 Type: OFPT_PACKET_IN
109 0.108527831 172.31.24.227 -> 172.31.31.144 OpenFlow 189 Type: OFPT_PACKET_IN
110 0.108546990 172.31.24.227 -> 172.31.31.144 OpenFlow 435 Type: OFPT_PACKET_IN
111 0.108569965 172.31.24.227 -> 172.31.31.144 OpenFlow 189 Type: OFPT_PACKET_IN
112 0.108588049 172.31.24.227 -> 172.31.31.144 OpenFlow 189 Type: OFPT_PACKET_IN
113 0.108595407 172.31.24.227 -> 172.31.31.144 OpenFlow 189 Type: OFPT_PACKET_IN
114 0.108622047 172.31.24.227 -> 172.31.31.144 OpenFlow 189 Type: OFPT_PACKET_IN
115 0.108635322 172.31.24.227 -> 172.31.31.144 OpenFlow 681 Type: OFPT_PACKET_IN
116 0.108674150 172.31.24.227 -> 172.31.31.144 OpenFlow 189 Type: OFPT_PACKET_IN
117 0.108725591 172.31.31.144 -> 172.31.24.227 TCP 66 6633 → 49370 [ACK] Seq=97 Ack=9593 Win=853 Len=0 TSval=1084402 TSecr=119645012
118 0.108777769 172.31.31.144 -> 172.31.24.227 TCP 66 6633 → 49384 [ACK] Seq=1 Ack=370 Win=853 Len=0 TSval=1084402 TSecr=119645012
119 0.108811004 172.31.31.144 -> 172.31.24.227 TCP 66 6633 → 49380 [ACK] Seq=1 Ack=493 Win=853 Len=0 TSval=1084402 TSecr=119645012
120 0.108833013 172.31.31.144 -> 172.31.24.227 TCP 66 6633 → 49376 [ACK] Seq=1 Ack=493 Win=853 Len=0 TSval=1084402 TSecr=119645012
121 0.108861161 172.31.31.144 -> 172.31.24.227 TCP 66 6633 → 49384 [ACK] Seq=1 Ack=493 Win=853 Len=0 TSval=1084402 TSecr=119645012
122 0.108956172 172.31.31.144 -> 172.31.24.227 TCP 66 6633 → 49390 [ACK] Seq=969 Ack=124 Win=853 Len=0 TSval=1084402 TSecr=119645012
123 0.108982198 172.31.31.144 -> 172.31.24.227 TCP 66 6633 → 49390 [ACK] Seq=969 Ack=247 Win=853 Len=0 TSval=1084402 TSecr=119645012
124 0.109038390 172.31.24.227 -> 172.31.31.144 OpenFlow 189 Type: OFPT_PACKET_IN
125 0.109063642 172.31.24.227 -> 172.31.31.144 OpenFlow 189 Type: OFPT_PACKET_IN
126 0.109157822 172.31.31.144 -> 172.31.24.227 TCP 66 6633 → 49386 [ACK] Seq=1 Ack=1231 Win=853 Len=0 TSval=1084402 TSecr=119645012
127 0.109305160 172.31.31.144 -> 172.31.24.227 TCP 66 6633 → 49392 [ACK] Seq=1 Ack=247 Win=853 Len=0 TSval=1084402 TSecr=119645012
128 0.113170594 172.31.31.144 -> 172.31.24.227 OpenFlow 122 Type: OFPT_MULTIPART_REQUEST, OFPMP_FLOW
129 0.113180949 172.31.24.227 -> 172.31.31.144 TCP 66 49356 → 6633 [ACK] Seq=247 Ack=1509 Win=198 Len=0 TSval=119645013 TSecr=1084403
130 0.113226961 172.31.31.144 -> 172.31.24.227 OpenFlow 90 Type: OFPT_MULTIPART_REQUEST, OFPMP_PORT_STATS
131 0.113231530 172.31.24.227 -> 172.31.31.144 TCP 66 49356 → 6633 [ACK] Seq=247 Ack=1533 Win=198 Len=0 TSval=119645013 TSecr=1084403
132 0.115387784 172.31.31.144 -> 172.31.24.227 OpenFlow 82 Type: OFPT_MULTIPART_REQUEST, OFPMP_TABLE
133 0.115393487 172.31.24.227 -> 172.31.31.144 TCP 66 49356 → 6633 [ACK] Seq=247 Ack=1549 Win=198 Len=0 TSval=119645014 TSecr=1084404
134 0.116590312 172.31.31.144 -> 172.31.24.227 OpenFlow 90 Type: OFPT_MULTIPART_REQUEST, OFPMP_PORT_STATS
135 0.117773379 172.31.31.144 -> 172.31.24.227 OpenFlow 122 Type: OFPT_MULTIPART_REQUEST, OFPMP_FLOW
136 0.118898395 172.31.31.144 -> 172.31.24.227 TCP 66 6633 → 49350 [ACK] Seq=1307 Ack=7081 Win=853 Len=0 TSval=1084405 TSecr=119645005
137 0.118961525 172.31.31.144 -> 172.31.24.227 OpenFlow 82 Type: OFPT_MULTIPART_REQUEST, OFPMP_TABLE
138 0.122208631 172.31.31.144 -> 172.31.24.227 TCP 122 6633 → 49360 [PSH, ACK] Seq=1 Ack=1 Win=853 Len=56 TSval=1084405 TSecr=119644269
139 0.122254923 172.31.31.144 -> 172.31.24.227 TCP 90 6633 → 49360 [PSH, ACK] Seq=57 Ack=1 Win=853 Len=24 TSval=1084405 TSecr=119644269
140 0.122589787 172.31.24.227 -> 172.31.31.144 OpenFlow 189 Type: OFPT_PACKET_IN
141 0.122618418 172.31.24.227 -> 172.31.31.144 OpenFlow 189 Type: OFPT_PACKET_IN
142 0.122635853 172.31.24.227 -> 172.31.31.144 OpenFlow 189 Type: OFPT_PACKET_IN
143 0.122673612 172.31.24.227 -> 172.31.31.144 OpenFlow 189 Type: OFPT_PACKET_IN
144 0.122732996 172.31.24.227 -> 172.31.31.144 OpenFlow 146 Type: OFPT_PORT_STATUS
145 0.122763985 172.31.24.227 -> 172.31.31.144 OpenFlow 146 Type: OFPT_PORT_STATUS
146 0.122789650 172.31.24.227 -> 172.31.31.144 OpenFlow 146 Type: OFPT_PORT_STATUS
147 0.122813848 172.31.24.227 -> 172.31.31.144 OpenFlow 146 Type: OFPT_PORT_STATUS
148 0.122837310 172.31.24.227 -> 172.31.31.144 OpenFlow 146 Type: OFPT_PORT_STATUS
149 0.122860241 172.31.24.227 -> 172.31.31.144 OpenFlow 146 Type: OFPT_PORT_STATUS
150 0.122881152 172.31.31.144 -> 172.31.24.227 TCP 66 6633 → 49350 [ACK] Seq=1307 Ack=7204 Win=853 Len=0 TSval=1084406 TSecr=119645015
151 0.122895372 172.31.24.227 -> 172.31.31.144 OpenFlow 146 Type: OFPT_PORT_STATUS
152 0.122906365 172.31.31.144 -> 172.31.24.227 TCP 66 6633 → 49350 [ACK] Seq=1307 Ack=7327 Win=853 Len=0 TSval=1084406 TSecr=119645015
153 0.122931266 172.31.31.144 -> 172.31.24.227 TCP 66 6633 → 49348 [ACK] Seq=2033 Ack=9119 Win=853 Len=0 TSval=1084406 TSecr=119645015
154 0.122937415 172.31.24.227 -> 172.31.31.144 OpenFlow 146 Type: OFPT_PORT_STATUS
155 0.122967574 172.31.24.227 -> 172.31.31.144 OpenFlow 189 Type: OFPT_PACKET_IN
156 0.122983286 172.31.31.144 -> 172.31.24.227 TCP 66 6633 → 49352 [ACK] Seq=97 Ack=9369 Win=853 Len=0 TSval=1084406 TSecr=119645015
157 0.122989776 172.31.24.227 -> 172.31.31.144 OpenFlow 189 Type: OFPT_PACKET_IN
158 0.123009381 172.31.31.144 -> 172.31.24.227 TCP 66 6633 → 49352 [ACK] Seq=97 Ack=9449 Win=853 Len=0 TSval=1084406 TSecr=119645015
159 0.123033731 172.31.31.144 -> 172.31.24.227 TCP 66 6633 → 49352 [ACK] Seq=97 Ack=9529 Win=853 Len=0 TSval=1084406 TSecr=119645015
160 0.123054255 172.31.31.144 -> 172.31.24.227 TCP 66 6633 → 49352 [ACK] Seq=97 Ack=9609 Win=853 Len=0 TSval=1084406 TSecr=119645015
161 0.123068571 172.31.24.227 -> 172.31.31.144 OpenFlow 1178 Type: OFPT_MULTIPART_REPLY, OFPMP_FLOW
162 0.123084029 172.31.31.144 -> 172.31.24.227 TCP 66 6633 → 49352 [ACK] Seq=97 Ack=9689 Win=853 Len=0 TSval=1084406 TSecr=119645015
163 0.123150625 172.31.31.144 -> 172.31.24.227 TCP 66 6633 → 49354 [ACK] Seq=1 Ack=124 Win=853 Len=0 TSval=1084406 TSecr=119645015
164 0.123178721 172.31.31.144 -> 172.31.24.227 TCP 66 6633 → 49354 [ACK] Seq=1 Ack=247 Win=853 Len=0 TSval=1084406 TSecr=119645015
165 0.123236956 172.31.24.227 -> 172.31.31.144 OpenFlow 866 Type: OFPT_MULTIPART_REPLY, OFPMP_PORT_STATS
166 0.123318332 172.31.31.144 -> 172.31.24.227 TCP 66 6633 → 49356 [ACK] Seq=1549 Ack=1359 Win=853 Len=0 TSval=1084406 TSecr=119645015
167 0.123394618 172.31.31.144 -> 172.31.24.227 TCP 82 6633 → 49360 [PSH, ACK] Seq=81 Ack=1 Win=853 Len=16 TSval=1084406 TSecr=119644269
168 0.123420187 172.31.24.227 -> 172.31.31.144 OpenFlow 6178 Type: OFPT_MULTIPART_REPLY, OFPMP_TABLE
169 0.123460643 172.31.24.227 -> 172.31.31.144 OpenFlow 146 Type: OFPT_PORT_STATUS
170 0.123478034 172.31.31.144 -> 172.31.24.227 TCP 66 6633 → 49356 [ACK] Seq=1549 Ack=2159 Win=853 Len=0 TSval=1084406 TSecr=119645016
171 0.123513105 172.31.24.227 -> 172.31.31.144 OpenFlow 146 Type: OFPT_PORT_STATUS
172 0.123541174 172.31.24.227 -> 172.31.31.144 OpenFlow 146 Type: OFPT_PORT_STATUS
173 0.123569039 172.31.24.227 -> 172.31.31.144 OpenFlow 146 Type: OFPT_PORT_STATUS
174 0.123648387 172.31.24.227 -> 172.31.31.144 OpenFlow 2634 Type: OFPT_MULTIPART_REPLY, OFPMP_FLOW
175 0.123775412 172.31.31.144 -> 172.31.24.227 TCP 66 6633 → 49360 [ACK] Seq=97 Ack=241 Win=853 Len=0 TSval=1084406 TSecr=119645016
176 0.123804265 172.31.24.227 -> 172.31.31.144 OpenFlow 1314 Type: OFPT_MULTIPART_REPLY, OFPMP_PORT_STATS
177 0.123950376 172.31.24.227 -> 172.31.31.144 OpenFlow 6178 Type: OFPT_MULTIPART_REPLY, OFPMP_TABLE
178 0.124009913 172.31.24.227 -> 172.31.31.144 OpenFlow 146 Type: OFPT_PORT_STATUS
179 0.124038134 172.31.24.227 -> 172.31.31.144 OpenFlow 146 Type: OFPT_PORT_STATUS
180 0.124082395 172.31.24.227 -> 172.31.31.144 OpenFlow 189 Type: OFPT_PACKET_IN
181 0.124103398 172.31.24.227 -> 172.31.31.144 OpenFlow 189 Type: OFPT_PACKET_IN
182 0.124153570 172.31.24.227 -> 172.31.31.144 OpenFlow 146 Type: OFPT_PORT_STATUS
183 0.124197508 172.31.31.144 -> 172.31.24.227 TCP 66 6633 → 49360 [ACK] Seq=97 Ack=10169 Win=853 Len=0 TSval=1084406 TSecr=119645016
184 0.124240252 172.31.31.144 -> 172.31.24.227 TCP 66 6633 → 49368 [ACK] Seq=1 Ack=81 Win=853 Len=0 TSval=1084406 TSecr=119645016
185 0.124267322 172.31.31.144 -> 172.31.24.227 TCP 66 6633 → 49368 [ACK] Seq=1 Ack=161 Win=853 Len=0 TSval=1084406 TSecr=119645016
186 0.124281850 172.31.24.227 -> 172.31.31.144 OpenFlow 642 Type: OFPT_MULTIPART_REPLY, OFPMP_PORT_STATS
187 0.124298482 172.31.31.144 -> 172.31.24.227 TCP 66 6633 → 49376 [ACK] Seq=1 Ack=739 Win=853 Len=0 TSval=1084406 TSecr=119645016
188 0.124363689 172.31.24.227 -> 172.31.31.144 OpenFlow 2842 Type: OFPT_MULTIPART_REPLY, OFPMP_FLOW
189 0.124510375 172.31.24.227 -> 172.31.31.144 OpenFlow 6178 Type: OFPT_MULTIPART_REPLY, OFPMP_TABLE
190 0.124556670 172.31.24.227 -> 172.31.31.144 OpenFlow 146 Type: OFPT_PORT_STATUS
191 0.124616820 172.31.31.144 -> 172.31.24.227 TCP 66 6633 → 49390 [ACK] Seq=1065 Ack=3599 Win=853 Len=0 TSval=1084406 TSecr=119645016
192 0.126622241 172.31.31.144 -> 172.31.24.227 OpenFlow 90 Type: OFPT_MULTIPART_REQUEST, OFPMP_PORT_STATS
193 0.126657335 172.31.31.144 -> 172.31.24.227 OpenFlow 122 Type: OFPT_MULTIPART_REQUEST, OFPMP_FLOW
194 0.127078572 172.31.31.144 -> 172.31.24.227 TCP 66 6633 → 49352 [ACK] Seq=97 Ack=9929 Win=853 Len=0 TSval=1084407 TSecr=119645015
195 0.127784683 172.31.31.144 -> 172.31.24.227 OpenFlow 82 Type: OFPT_MULTIPART_REQUEST, OFPMP_TABLE
196 0.129848591 172.31.24.227 -> 172.31.31.144 OpenFlow 978 Type: OFPT_MULTIPART_REPLY, OFPMP_PORT_STATS
197 0.129891829 172.31.24.227 -> 172.31.31.144 OpenFlow 554 Type: OFPT_MULTIPART_REPLY, OFPMP_FLOW
198 0.130052380 172.31.24.227 -> 172.31.31.144 OpenFlow 6178 Type: OFPT_MULTIPART_REPLY, OFPMP_TABLE
199 0.130118134 172.31.31.144 -> 172.31.24.227 TCP 66 6633 → 49384 [ACK] Seq=97 Ack=1893 Win=853 Len=0 TSval=1084407 TSecr=119645017
200 0.131012802 172.31.31.144 -> 172.31.24.227 TCP 90 6633 → 49366 [PSH, ACK] Seq=1 Ack=1 Win=853 Len=24 TSval=1084408 TSecr=119644270
201 0.131040101 172.31.31.144 -> 172.31.24.227 TCP 138 6633 → 49366 [PSH, ACK] Seq=25 Ack=1 Win=853 Len=72 TSval=1084408 TSecr=119644270
202 0.134183572 172.31.31.144 -> 172.31.24.227 TCP 90 6633 → 49362 [PSH, ACK] Seq=1 Ack=1 Win=853 Len=24 TSval=1084408 TSecr=119644267
203 0.134221115 172.31.31.144 -> 172.31.24.227 TCP 122 6633 → 49362 [PSH, ACK] Seq=25 Ack=1 Win=853 Len=56 TSval=1084408 TSecr=119644267
204 0.135407508 172.31.31.144 -> 172.31.24.227 TCP 82 6633 → 49362 [PSH, ACK] Seq=81 Ack=1 Win=853 Len=16 TSval=1084409 TSecr=119644267
205 0.142909183 172.31.31.144 -> 172.31.24.227 TCP 138 [TCP Retransmission] 6633 → 49366 [PSH, ACK] Seq=25 Ack=1 Win=853 Len=72 TSval=1084411 TSecr=119644270
206 0.142920840 172.31.24.227 -> 172.31.31.144 TCP 78 49366 → 6633 [ACK] Seq=1 Ack=97 Win=62 Len=0 TSval=119645020 TSecr=1084408 SLE=25 SRE=97
207 0.145819988 172.31.24.227 -> 172.31.31.144 OpenFlow 642 Type: OFPT_MULTIPART_REPLY, OFPMP_PORT_STATS
208 0.145896263 172.31.24.227 -> 172.31.31.144 OpenFlow 2426 Type: OFPT_MULTIPART_REPLY, OFPMP_FLOW
209 0.146077884 172.31.24.227 -> 172.31.31.144 OpenFlow 6178 Type: OFPT_MULTIPART_REPLY, OFPMP_TABLE
210 0.146169034 172.31.31.144 -> 172.31.24.227 TCP 66 6633 → 49362 [ACK] Seq=97 Ack=577 Win=853 Len=0 TSval=1084411 TSecr=119645021
211 0.146209951 172.31.31.144 -> 172.31.24.227 TCP 66 6633 → 49362 [ACK] Seq=97 Ack=2937 Win=853 Len=0 TSval=1084411 TSecr=119645021
212 0.146239302 172.31.24.227 -> 172.31.31.144 OpenFlow 978 Type: OFPT_MULTIPART_REPLY, OFPMP_PORT_STATS
213 0.146303077 172.31.24.227 -> 172.31.31.144 OpenFlow 2010 Type: OFPT_MULTIPART_REPLY, OFPMP_FLOW
214 0.146401794 172.31.31.144 -> 172.31.24.227 TCP 66 6633 → 49362 [ACK] Seq=97 Ack=9049 Win=853 Len=0 TSval=1084411 TSecr=119645021
215 0.146450001 172.31.24.227 -> 172.31.31.144 OpenFlow 6178 Type: OFPT_MULTIPART_REPLY, OFPMP_TABLE
216 0.146682758 172.31.31.144 -> 172.31.24.227 TCP 66 6633 → 49366 [ACK] Seq=97 Ack=2857 Win=853 Len=0 TSval=1084411 TSecr=119645021
217 0.150656796 172.31.31.144 -> 172.31.24.227 OpenFlow 90 Type: OFPT_MULTIPART_REQUEST, OFPMP_PORT_STATS
218 0.150665303 172.31.31.144 -> 172.31.24.227 OpenFlow 122 Type: OFPT_MULTIPART_REQUEST, OFPMP_FLOW
219 0.150832028 172.31.24.227 -> 172.31.31.144 OpenFlow 866 Type: OFPT_MULTIPART_REPLY, OFPMP_PORT_STATS
220 0.150929580 172.31.24.227 -> 172.31.31.144 OpenFlow 2842 Type: OFPT_MULTIPART_REPLY, OFPMP_FLOW
221 0.151194593 172.31.31.144 -> 172.31.24.227 TCP 66 6633 → 49354 [ACK] Seq=81 Ack=3823 Win=853 Len=0 TSval=1084413 TSecr=119645022
222 0.151997693 172.31.31.144 -> 172.31.24.227 OpenFlow 82 Type: OFPT_MULTIPART_REQUEST, OFPMP_TABLE
223 0.152218003 172.31.24.227 -> 172.31.31.144 OpenFlow 6178 Type: OFPT_MULTIPART_REPLY, OFPMP_TABLE
224 0.152713154 172.31.31.144 -> 172.31.24.227 OpenFlow 146 Type: OFPT_FLOW_MOD
225 0.152724219 172.31.31.144 -> 172.31.24.227 OpenFlow 146 Type: OFPT_FLOW_MOD
226 0.152726796 172.31.31.144 -> 172.31.24.227 OpenFlow 74 Type: OFPT_BARRIER_REQUEST
227 0.152762551 172.31.31.144 -> 172.31.24.227 OpenFlow 146 Type: OFPT_FLOW_MOD
228 0.152796911 172.31.31.144 -> 172.31.24.227 OpenFlow 146 Type: OFPT_FLOW_MOD
229 0.152835665 172.31.31.144 -> 172.31.24.227 OpenFlow 74 Type: OFPT_BARRIER_REQUEST
230 0.152887824 172.31.24.227 -> 172.31.31.144 TCP 66 49384 → 6633 [ACK] Seq=8005 Ack=265 Win=59 Len=0 TSval=119645023 TSecr=1084413
231 0.152899066 172.31.24.227 -> 172.31.31.144 OpenFlow 74 Type: OFPT_BARRIER_REPLY
232 0.152934971 172.31.24.227 -> 172.31.31.144 TCP 66 49394 → 6633 [ACK] Seq=81 Ack=169 Win=150 Len=0 TSval=119645023 TSecr=1084413
233 0.152943215 172.31.24.227 -> 172.31.31.144 OpenFlow 74 Type: OFPT_BARRIER_REPLY
234 0.153026179 172.31.31.144 -> 172.31.24.227 TCP 146 6633 → 49364 [PSH, ACK] Seq=1 Ack=1 Win=853 Len=80 TSval=1084413 TSecr=119644269
235 0.153032974 172.31.31.144 -> 172.31.24.227 TCP 154 6633 → 49364 [PSH, ACK] Seq=81 Ack=1 Win=853 Len=88 TSval=1084413 TSecr=119644269
236 0.153094101 172.31.24.227 -> 172.31.31.144 OpenFlow 146 Type: OFPT_FLOW_REMOVED
237 0.153109778 172.31.24.227 -> 172.31.31.144 OpenFlow 146 Type: OFPT_FLOW_REMOVED
238 0.153117894 172.31.24.227 -> 172.31.31.144 OpenFlow 146 Type: OFPT_FLOW_REMOVED
239 0.153146558 172.31.31.144 -> 172.31.24.227 OpenFlow 146 Type: OFPT_FLOW_MOD
240 0.153173886 172.31.24.227 -> 172.31.31.144 OpenFlow 146 Type: OFPT_FLOW_REMOVED
241 0.153199621 172.31.31.144 -> 172.31.24.227 OpenFlow 146 Type: OFPT_FLOW_MOD
242 0.153202812 172.31.31.144 -> 172.31.24.227 OpenFlow 74 Type: OFPT_BARRIER_REQUEST
243 0.153224820 172.31.31.144 -> 172.31.24.227 OpenFlow 146 Type: OFPT_FLOW_MOD
244 0.153307603 172.31.31.144 -> 172.31.24.227 OpenFlow 146 Type: OFPT_FLOW_MOD
245 0.153324362 172.31.31.144 -> 172.31.24.227 TCP 66 6633 → 49394 [ACK] Seq=169 Ack=169 Win=853 Len=0 TSval=1084413 TSecr=119645023
246 0.153343179 172.31.31.144 -> 172.31.24.227 OpenFlow 74 Type: OFPT_BARRIER_REQUEST
247 0.153362460 172.31.31.144 -> 172.31.24.227 TCP 66 6633 → 49384 [ACK] Seq=265 Ack=8173 Win=853 Len=0 TSval=1084413 TSecr=119645023
248 0.153424960 172.31.31.144 -> 172.31.24.227 OpenFlow 146 Type: OFPT_FLOW_MOD
249 0.153477484 172.31.31.144 -> 172.31.24.227 OpenFlow 146 Type: OFPT_FLOW_MOD
250 0.153495955 172.31.31.144 -> 172.31.24.227 OpenFlow 74 Type: OFPT_BARRIER_REQUEST
251 0.153647250 172.31.31.144 -> 172.31.24.227 OpenFlow 146 Type: OFPT_FLOW_MOD
252 0.153692543 172.31.31.144 -> 172.31.24.227 OpenFlow 146 Type: OFPT_FLOW_MOD
253 0.153713854 172.31.31.144 -> 172.31.24.227 OpenFlow 74 Type: OFPT_BARRIER_REQUEST
254 0.153823912 172.31.31.144 -> 172.31.24.227 OpenFlow 146 Type: OFPT_FLOW_MOD
255 0.153839575 172.31.31.144 -> 172.31.24.227 OpenFlow 154 Type: OFPT_BARRIER_REQUEST
256 0.153966398 172.31.31.144 -> 172.31.24.227 OpenFlow 146 Type: OFPT_FLOW_MOD
257 0.153988702 172.31.31.144 -> 172.31.24.227 OpenFlow 154 Type: OFPT_BARRIER_REQUEST
258 0.154069611 172.31.31.144 -> 172.31.24.227 OpenFlow 146 Type: OFPT_FLOW_MOD
259 0.154084327 172.31.31.144 -> 172.31.24.227 OpenFlow 154 Type: OFPT_BARRIER_REQUEST
260 0.154136443 172.31.31.144 -> 172.31.24.227 OpenFlow 146 Type: OFPT_FLOW_MOD
261 0.154190087 172.31.31.144 -> 172.31.24.227 OpenFlow 146 Type: OFPT_FLOW_MOD
262 0.154220870 172.31.31.144 -> 172.31.24.227 OpenFlow 74 Type: OFPT_BARRIER_REQUEST
263 0.154365017 172.31.31.144 -> 172.31.24.227 TCP 146 6633 → 49374 [PSH, ACK] Seq=1 Ack=1 Win=853 Len=80 TSval=1084413 TSecr=119644270
264 0.154397924 172.31.31.144 -> 172.31.24.227 TCP 322 6633 → 49374 [PSH, ACK] Seq=81 Ack=1 Win=853 Len=256 TSval=1084413 TSecr=119644270
265 0.154428516 172.31.31.144 -> 172.31.24.227 OpenFlow 146 Type: OFPT_FLOW_MOD
266 0.154464679 172.31.31.144 -> 172.31.24.227 OpenFlow 154 Type: OFPT_BARRIER_REQUEST
267 0.154594552 172.31.31.144 -> 172.31.24.227 OpenFlow 146 Type: OFPT_FLOW_MOD
268 0.154653992 172.31.31.144 -> 172.31.24.227 OpenFlow 146 Type: OFPT_FLOW_MOD
269 0.154685793 172.31.31.144 -> 172.31.24.227 OpenFlow 74 Type: OFPT_BARRIER_REQUEST
270 0.154721692 172.31.31.144 -> 172.31.24.227 OpenFlow 146 Type: OFPT_FLOW_MOD
271 0.154751185 172.31.31.144 -> 172.31.24.227 TCP 146 6633 → 49372 [PSH, ACK] Seq=1 Ack=1 Win=853 Len=80 TSval=1084413 TSecr=119644269
272 0.154781510 172.31.31.144 -> 172.31.24.227 OpenFlow 154 Type: OFPT_BARRIER_REQUEST
273 0.154810842 172.31.31.144 -> 172.31.24.227 OpenFlow 146 Type: OFPT_FLOW_MOD
274 0.154845095 172.31.31.144 -> 172.31.24.227 TCP 146 6633 → 49372 [PSH, ACK] Seq=81 Ack=1 Win=853 Len=80 TSval=1084413 TSecr=119644269
275 0.154876906 172.31.31.144 -> 172.31.24.227 TCP 74 6633 → 49372 [PSH, ACK] Seq=161 Ack=1 Win=853 Len=8 TSval=1084414 TSecr=119644269
276 0.154917848 172.31.31.144 -> 172.31.24.227 OpenFlow 146 Type: OFPT_FLOW_MOD
277 0.154955154 172.31.31.144 -> 172.31.24.227 OpenFlow 146 Type: OFPT_FLOW_MOD
278 0.154984812 172.31.31.144 -> 172.31.24.227 OpenFlow 146 Type: OFPT_FLOW_MOD
279 0.155015189 172.31.31.144 -> 172.31.24.227 OpenFlow 146 Type: OFPT_FLOW_MOD
280 0.155056394 172.31.31.144 -> 172.31.24.227 OpenFlow 154 Type: OFPT_BARRIER_REQUEST
281 0.155087331 172.31.31.144 -> 172.31.24.227 OpenFlow 154 Type: OFPT_BARRIER_REQUEST
282 0.155127695 172.31.31.144 -> 172.31.24.227 OpenFlow 146 Type: OFPT_FLOW_MOD
283 0.155155326 172.31.31.144 -> 172.31.24.227 TCP 146 6633 → 49388 [PSH, ACK] Seq=1 Ack=1 Win=853 Len=80 TSval=1084414 TSecr=119644270
284 0.155194229 172.31.31.144 -> 172.31.24.227 TCP 146 6633 → 49364 [PSH, ACK] Seq=169 Ack=1 Win=853 Len=80 TSval=1084414 TSecr=119644269
285 0.155222174 172.31.31.144 -> 172.31.24.227 OpenFlow 74 Type: OFPT_BARRIER_REQUEST
286 0.155250595 172.31.31.144 -> 172.31.24.227 OpenFlow 146 Type: OFPT_FLOW_MOD
287 0.155280258 172.31.31.144 -> 172.31.24.227 OpenFlow 146 Type: OFPT_FLOW_MOD
288 0.155309593 172.31.31.144 -> 172.31.24.227 OpenFlow 146 Type: OFPT_FLOW_MOD
289 0.155337997 172.31.31.144 -> 172.31.24.227 TCP 146 6633 → 49364 [PSH, ACK] Seq=249 Ack=1 Win=853 Len=80 TSval=1084414 TSecr=119644269
290 0.155367763 172.31.31.144 -> 172.31.24.227 OpenFlow 74 Type: OFPT_BARRIER_REQUEST
291 0.155398643 172.31.31.144 -> 172.31.24.227 OpenFlow 146 Type: OFPT_FLOW_MOD
292 0.155431516 172.31.31.144 -> 172.31.24.227 TCP 146 6633 → 49388 [PSH, ACK] Seq=81 Ack=1 Win=853 Len=80 TSval=1084414 TSecr=119644270
293 0.155465900 172.31.31.144 -> 172.31.24.227 TCP 74 6633 → 49364 [PSH, ACK] Seq=329 Ack=1 Win=853 Len=8 TSval=1084414 TSecr=119644269
294 0.155496045 172.31.31.144 -> 172.31.24.227 TCP 74 6633 → 49388 [PSH, ACK] Seq=161 Ack=1 Win=853 Len=8 TSval=1084414 TSecr=119644270
295 0.155525675 172.31.31.144 -> 172.31.24.227 OpenFlow 146 Type: OFPT_FLOW_MOD
296 0.155553649 172.31.31.144 -> 172.31.24.227 OpenFlow 74 Type: OFPT_BARRIER_REQUEST
297 0.155584322 172.31.31.144 -> 172.31.24.227 OpenFlow 146 Type: OFPT_FLOW_MOD
298 0.155613976 172.31.31.144 -> 172.31.24.227 OpenFlow 146 Type: OFPT_FLOW_MOD
299 0.155655662 172.31.31.144 -> 172.31.24.227 OpenFlow 146 Type: OFPT_FLOW_MOD
300 0.155686572 172.31.31.144 -> 172.31.24.227 OpenFlow 74 Type: OFPT_BARRIER_REQUEST
301 0.155729948 172.31.31.144 -> 172.31.24.227 TCP 146 6633 → 49374 [PSH, ACK] Seq=337 Ack=1 Win=853 Len=80 TSval=1084414 TSecr=119644270
302 0.155759473 172.31.31.144 -> 172.31.24.227 OpenFlow 146 Type: OFPT_FLOW_MOD
303 0.155788811 172.31.31.144 -> 172.31.24.227 OpenFlow 74 Type: OFPT_BARRIER_REQUEST
304 0.155817365 172.31.31.144 -> 172.31.24.227 TCP 146 6633 → 49374 [PSH, ACK] Seq=417 Ack=1 Win=853 Len=80 TSval=1084414 TSecr=119644270
305 0.155846330 172.31.31.144 -> 172.31.24.227 OpenFlow 154 Type: OFPT_FLOW_MOD
306 0.155874584 172.31.31.144 -> 172.31.24.227 TCP 74 6633 → 49374 [PSH, ACK] Seq=497 Ack=1 Win=853 Len=8 TSval=1084414 TSecr=119644270
307 0.155903665 172.31.31.144 -> 172.31.24.227 OpenFlow 146 Type: OFPT_FLOW_MOD
308 0.155952818 172.31.31.144 -> 172.31.24.227 TCP 146 6633 → 49372 [PSH, ACK] Seq=169 Ack=1 Win=853 Len=80 TSval=1084414 TSecr=119644269
309 0.155990166 172.31.31.144 -> 172.31.24.227 OpenFlow 154 Type: OFPT_BARRIER_REQUEST
310 0.156021267 172.31.31.144 -> 172.31.24.227 OpenFlow 146 Type: OFPT_FLOW_MOD
311 0.156026399 172.31.24.227 -> 172.31.31.144 TCP 66 49352 → 6633 [ACK] Seq=9929 Ack=841 Win=88 Len=0 TSval=119645024 TSecr=1084413
312 0.156083646 172.31.31.144 -> 172.31.24.227 OpenFlow 146 Type: OFPT_FLOW_MOD
313 0.156086458 172.31.31.144 -> 172.31.24.227 OpenFlow 154 Type: OFPT_BARRIER_REQUEST
314 0.156111268 172.31.31.144 -> 172.31.24.227 OpenFlow 146 Type: OFPT_FLOW_MOD
315 0.156140004 172.31.31.144 -> 172.31.24.227 TCP 146 6633 → 49372 [PSH, ACK] Seq=249 Ack=1 Win=853 Len=80 TSval=1084414 TSecr=119644269
316 0.156169039 172.31.31.144 -> 172.31.24.227 OpenFlow 146 Type: OFPT_FLOW_MOD
317 0.156197753 172.31.31.144 -> 172.31.24.227 TCP 74 6633 → 49372 [PSH, ACK] Seq=329 Ack=1 Win=853 Len=8 TSval=1084414 TSecr=119644269
318 0.156227485 172.31.31.144 -> 172.31.24.227 OpenFlow 154 Type: OFPT_BARRIER_REQUEST
319 0.156268118 172.31.31.144 -> 172.31.24.227 OpenFlow 146 Type: OFPT_FLOW_MOD
320 0.156295072 172.31.31.144 -> 172.31.24.227 OpenFlow 146 Type: OFPT_FLOW_MOD
321 0.156321219 172.31.31.144 -> 172.31.24.227 TCP 146 6633 → 49388 [PSH, ACK] Seq=169 Ack=1 Win=853 Len=80 TSval=1084414 TSecr=119644270
322 0.156349450 172.31.31.144 -> 172.31.24.227 OpenFlow 74 Type: OFPT_BARRIER_REQUEST
323 0.156388235 172.31.31.144 -> 172.31.24.227 TCP 154 6633 → 49388 [PSH, ACK] Seq=249 Ack=1 Win=853 Len=88 TSval=1084414 TSecr=119644270
324 0.156416840 172.31.31.144 -> 172.31.24.227 OpenFlow 146 Type: OFPT_FLOW_MOD
325 0.156447359 172.31.31.144 -> 172.31.24.227 OpenFlow 146 Type: OFPT_FLOW_MOD
326 0.156476235 172.31.31.144 -> 172.31.24.227 OpenFlow 146 Type: OFPT_FLOW_MOD
327 0.156505406 172.31.31.144 -> 172.31.24.227 OpenFlow 146 Type: OFPT_FLOW_MOD
328 0.156534807 172.31.31.144 -> 172.31.24.227 OpenFlow 146 Type: OFPT_FLOW_MOD
329 0.156564097 172.31.31.144 -> 172.31.24.227 OpenFlow 154 Type: OFPT_BARRIER_REQUEST
330 0.156594633 172.31.31.144 -> 172.31.24.227 OpenFlow 74 Type: OFPT_BARRIER_REQUEST
331 0.156624263 172.31.31.144 -> 172.31.24.227 OpenFlow 146 Type: OFPT_FLOW_MOD
332 0.156653830 172.31.31.144 -> 172.31.24.227 OpenFlow 154 Type: OFPT_BARRIER_REQUEST
333 0.156697932 172.31.31.144 -> 172.31.24.227 OpenFlow 154 Type: OFPT_BARRIER_REQUEST
334 0.156725415 172.31.31.144 -> 172.31.24.227 TCP 146 6633 → 49388 [PSH, ACK] Seq=337 Ack=1 Win=853 Len=80 TSval=1084414 TSecr=119644270
335 0.156754400 172.31.31.144 -> 172.31.24.227 OpenFlow 146 Type: OFPT_FLOW_MOD
336 0.156782473 172.31.31.144 -> 172.31.24.227 OpenFlow 154 Type: OFPT_BARRIER_REQUEST
337 0.156813412 172.31.31.144 -> 172.31.24.227 OpenFlow 146 Type: OFPT_FLOW_MOD
338 0.156842211 172.31.31.144 -> 172.31.24.227 TCP 146 6633 → 49378 [PSH, ACK] Seq=1 Ack=1 Win=853 Len=80 TSval=1084414 TSecr=119644278
339 0.156848964 172.31.24.227 -> 172.31.31.144 TCP 66 49378 → 6633 [ACK] Seq=1 Ack=81 Win=61 Len=0 TSval=119645024 TSecr=1084414
340 0.156916232 172.31.31.144 -> 172.31.24.227 OpenFlow 146 Type: OFPT_FLOW_MOD
341 0.156919517 172.31.31.144 -> 172.31.24.227 TCP 154 6633 → 49378 [PSH, ACK] Seq=81 Ack=1 Win=853 Len=88 TSval=1084414 TSecr=119644278
342 0.156922539 172.31.24.227 -> 172.31.31.144 TCP 66 49378 → 6633 [ACK] Seq=1 Ack=169 Win=61 Len=0 TSval=119645024 TSecr=1084414
343 0.156939941 172.31.31.144 -> 172.31.24.227 OpenFlow 154 Type: OFPT_BARRIER_REQUEST
344 0.156968378 172.31.31.144 -> 172.31.24.227 TCP 146 6633 → 49388 [PSH, ACK] Seq=417 Ack=1 Win=853 Len=80 TSval=1084414 TSecr=119644270
345 0.156997265 172.31.31.144 -> 172.31.24.227 OpenFlow 146 Type: OFPT_FLOW_MOD
346 0.157023050 172.31.31.144 -> 172.31.24.227 TCP 74 6633 → 49388 [PSH, ACK] Seq=497 Ack=1 Win=853 Len=8 TSval=1084414 TSecr=119644270
347 0.157051709 172.31.31.144 -> 172.31.24.227 OpenFlow 74 Type: OFPT_BARRIER_REQUEST
348 0.157078178 172.31.31.144 -> 172.31.24.227 OpenFlow 146 Type: OFPT_FLOW_MOD
349 0.157091890 172.31.24.227 -> 172.31.31.144 OpenFlow 74 Type: OFPT_BARRIER_REPLY
350 0.157109001 172.31.31.144 -> 172.31.24.227 OpenFlow 490 Type: OFPT_BARRIER_REQUEST
351 0.157119163 172.31.24.227 -> 172.31.31.144 OpenFlow 74 Type: OFPT_BARRIER_REPLY
352 0.157144590 172.31.24.227 -> 172.31.31.144 OpenFlow 74 Type: OFPT_BARRIER_REPLY
353 0.157161764 172.31.31.144 -> 172.31.24.227 OpenFlow 146 Type: OFPT_FLOW_MOD
354 0.157167186 172.31.24.227 -> 172.31.31.144 OpenFlow 74 Type: OFPT_BARRIER_REPLY
355 0.157188236 172.31.31.144 -> 172.31.24.227 OpenFlow 154 Type: OFPT_BARRIER_REQUEST
356 0.157193059 172.31.24.227 -> 172.31.31.144 OpenFlow 74 Type: OFPT_BARRIER_REPLY
357 0.157215580 172.31.31.144 -> 172.31.24.227 OpenFlow 666 Type: OFPT_BARRIER_REQUEST
358 0.157236547 172.31.24.227 -> 172.31.31.144 OpenFlow 74 Type: OFPT_BARRIER_REPLY
359 0.157244461 172.31.31.144 -> 172.31.24.227 OpenFlow 146 Type: OFPT_FLOW_MOD
360 0.157265466 172.31.24.227 -> 172.31.31.144 OpenFlow 74 Type: OFPT_BARRIER_REPLY
361 0.157284704 172.31.31.144 -> 172.31.24.227 OpenFlow 402 Type: OFPT_FLOW_MOD
362 0.157308957 172.31.31.144 -> 172.31.24.227 OpenFlow 146 Type: OFPT_FLOW_MOD
363 0.157323721 172.31.24.227 -> 172.31.31.144 OpenFlow 74 Type: OFPT_BARRIER_REPLY
364 0.157336104 172.31.31.144 -> 172.31.24.227 OpenFlow 98 Type: OFPT_MULTIPART_REQUEST, OFPMP_PORT_STATS
365 0.157350661 172.31.24.227 -> 172.31.31.144 OpenFlow 74 Type: OFPT_BARRIER_REPLY
366 0.157363547 172.31.31.144 -> 172.31.24.227 OpenFlow 82 Type: OFPT_MULTIPART_REQUEST, OFPMP_TABLE
367 0.157366649 172.31.24.227 -> 172.31.31.144 TCP 66 49380 → 6633 [ACK] Seq=493 Ack=545 Win=66 Len=0 TSval=119645024 TSecr=1084414
368 0.157383340 172.31.24.227 -> 172.31.31.144 OpenFlow 74 Type: OFPT_BARRIER_REPLY
369 0.157414481 172.31.31.144 -> 172.31.24.227 OpenFlow 122 Type: OFPT_MULTIPART_REQUEST, OFPMP_FLOW
370 0.157419295 172.31.24.227 -> 172.31.31.144 OpenFlow 82 Type: OFPT_BARRIER_REPLY
371 0.157440652 172.31.31.144 -> 172.31.24.227 TCP 66 6633 → 49348 [ACK] Seq=2873 Ack=9151 Win=853 Len=0 TSval=1084414 TSecr=119645024
372 0.157446962 172.31.24.227 -> 172.31.31.144 OpenFlow 74 Type: OFPT_BARRIER_REPLY
373 0.157472885 172.31.24.227 -> 172.31.31.144 OpenFlow 74 Type: OFPT_BARRIER_REPLY
374 0.157490844 172.31.31.144 -> 172.31.24.227 TCP 66 6633 → 49352 [ACK] Seq=1441 Ack=9945 Win=853 Len=0 TSval=1084414 TSecr=119645024
375 0.157500705 172.31.24.227 -> 172.31.31.144 OpenFlow 74 Type: OFPT_BARRIER_REPLY
376 0.157516074 172.31.24.227 -> 172.31.31.144 OpenFlow 74 Type: OFPT_BARRIER_REPLY
377 0.157538539 172.31.24.227 -> 172.31.31.144 OpenFlow 74 Type: OFPT_BARRIER_REPLY
378 0.157572390 172.31.24.227 -> 172.31.31.144 OpenFlow 82 Type: OFPT_BARRIER_REPLY
379 0.157602508 172.31.31.144 -> 172.31.24.227 TCP 66 6633 → 49352 [ACK] Seq=1441 Ack=9961 Win=853 Len=0 TSval=1084414 TSecr=119645024
380 0.157617598 172.31.24.227 -> 172.31.31.144 OpenFlow 74 Type: OFPT_BARRIER_REPLY
381 0.157626323 172.31.31.144 -> 172.31.24.227 TCP 66 6633 → 49352 [ACK] Seq=1441 Ack=9993 Win=853 Len=0 TSval=1084414 TSecr=119645024
