  1 0.000000000 172.31.31.144 -> 172.31.23.72 TCP 90 6633 → 33652 [PSH, ACK] Seq=1 Ack=1 Win=853 Len=24 TSval=1266986 TSecr=26105738
  2 0.000029809 172.31.31.144 -> 172.31.23.72 TCP 90 6633 → 33650 [PSH, ACK] Seq=1 Ack=1 Win=853 Len=24 TSval=1266986 TSecr=26105765
  3 0.000033535 172.31.31.144 -> 172.31.23.72 TCP 106 6633 → 33652 [PSH, ACK] Seq=25 Ack=1 Win=853 Len=40 TSval=1266986 TSecr=26105738
  4 0.000036746 172.31.31.144 -> 172.31.23.72 TCP 106 6633 → 33650 [PSH, ACK] Seq=25 Ack=1 Win=853 Len=40 TSval=1266986 TSecr=26105765
  5 0.000302699 172.31.23.72 -> 172.31.31.144 OpenFlow 82 Type: OFPT_MULTIPART_REPLY, OFPMP_GROUP
  6 0.000341666 172.31.23.72 -> 172.31.31.144 OpenFlow 82 Type: OFPT_MULTIPART_REPLY, OFPMP_GROUP
  7 0.000410662 172.31.23.72 -> 172.31.31.144 OpenFlow 98 Type: OFPT_MULTIPART_REPLY, OFPMP_METER
  8 0.000415915 172.31.23.72 -> 172.31.31.144 OpenFlow 98 Type: OFPT_MULTIPART_REPLY, OFPMP_METER
  9 0.000652739 172.31.31.144 -> 172.31.23.72 TCP 66 6633 → 33652 [ACK] Seq=65 Ack=17 Win=853 Len=0 TSval=1266986 TSecr=26106087
 10 0.000670202 172.31.31.144 -> 172.31.23.72 TCP 66 6633 → 33650 [ACK] Seq=65 Ack=17 Win=853 Len=0 TSval=1266986 TSecr=26106087
 11 0.000688565 172.31.31.144 -> 172.31.23.72 TCP 66 6633 → 33652 [ACK] Seq=65 Ack=49 Win=853 Len=0 TSval=1266986 TSecr=26106087
 12 0.000707649 172.31.31.144 -> 172.31.23.72 TCP 66 6633 → 33650 [ACK] Seq=65 Ack=49 Win=853 Len=0 TSval=1266986 TSecr=26106087
 13 0.100194310 172.31.31.144 -> 172.31.23.72 TCP 90 6633 → 33654 [PSH, ACK] Seq=1 Ack=1 Win=853 Len=24 TSval=1267011 TSecr=26105765
 14 0.100218498 172.31.31.144 -> 172.31.23.72 TCP 90 6633 → 33656 [PSH, ACK] Seq=1 Ack=1 Win=853 Len=24 TSval=1267011 TSecr=26105765
 15 0.100221865 172.31.31.144 -> 172.31.23.72 TCP 106 6633 → 33656 [PSH, ACK] Seq=25 Ack=1 Win=853 Len=40 TSval=1267011 TSecr=26105765
 16 0.100225030 172.31.31.144 -> 172.31.23.72 TCP 106 6633 → 33654 [PSH, ACK] Seq=25 Ack=1 Win=853 Len=40 TSval=1267011 TSecr=26105765
 17 0.100396453 172.31.23.72 -> 172.31.31.144 OpenFlow 82 Type: OFPT_MULTIPART_REPLY, OFPMP_GROUP
 18 0.100435727 172.31.23.72 -> 172.31.31.144 OpenFlow 98 Type: OFPT_MULTIPART_REPLY, OFPMP_METER
 19 0.100483493 172.31.23.72 -> 172.31.31.144 OpenFlow 82 Type: OFPT_MULTIPART_REPLY, OFPMP_GROUP
 20 0.100539936 172.31.23.72 -> 172.31.31.144 OpenFlow 98 Type: OFPT_MULTIPART_REPLY, OFPMP_METER
 21 0.100720954 172.31.31.144 -> 172.31.23.72 TCP 66 6633 → 33656 [ACK] Seq=65 Ack=17 Win=853 Len=0 TSval=1267011 TSecr=26106112
 22 0.100737355 172.31.31.144 -> 172.31.23.72 TCP 66 6633 → 33656 [ACK] Seq=65 Ack=49 Win=853 Len=0 TSval=1267011 TSecr=26106112
 23 0.100882169 172.31.31.144 -> 172.31.23.72 TCP 66 6633 → 33654 [ACK] Seq=65 Ack=49 Win=853 Len=0 TSval=1267011 TSecr=26106112
 24 0.200290142 172.31.31.144 -> 172.31.23.72 TCP 90 6633 → 33658 [PSH, ACK] Seq=1 Ack=1 Win=853 Len=24 TSval=1267036 TSecr=26105764
 25 0.200315391 172.31.31.144 -> 172.31.23.72 TCP 90 6633 → 33660 [PSH, ACK] Seq=1 Ack=1 Win=853 Len=24 TSval=1267036 TSecr=26105765
 26 0.200318954 172.31.31.144 -> 172.31.23.72 TCP 106 6633 → 33658 [PSH, ACK] Seq=25 Ack=1 Win=853 Len=40 TSval=1267036 TSecr=26105764
 27 0.200336148 172.31.31.144 -> 172.31.23.72 TCP 106 6633 → 33660 [PSH, ACK] Seq=25 Ack=1 Win=853 Len=40 TSval=1267036 TSecr=26105765
 28 0.200543329 172.31.23.72 -> 172.31.31.144 OpenFlow 82 Type: OFPT_MULTIPART_REPLY, OFPMP_GROUP
 29 0.200569897 172.31.23.72 -> 172.31.31.144 OpenFlow 98 Type: OFPT_MULTIPART_REPLY, OFPMP_METER
 30 0.200664179 172.31.23.72 -> 172.31.31.144 OpenFlow 82 Type: OFPT_MULTIPART_REPLY, OFPMP_GROUP
 31 0.200685041 172.31.23.72 -> 172.31.31.144 OpenFlow 98 Type: OFPT_MULTIPART_REPLY, OFPMP_METER
 32 0.200832448 172.31.31.144 -> 172.31.23.72 TCP 66 6633 → 33660 [ACK] Seq=65 Ack=17 Win=853 Len=0 TSval=1267036 TSecr=26106137
 33 0.200840200 172.31.31.144 -> 172.31.23.72 TCP 66 6633 → 33660 [ACK] Seq=65 Ack=49 Win=853 Len=0 TSval=1267036 TSecr=26106137
 34 0.200861172 172.31.31.144 -> 172.31.23.72 TCP 66 6633 → 33658 [ACK] Seq=65 Ack=17 Win=853 Len=0 TSval=1267036 TSecr=26106137
 35 0.200906081 172.31.31.144 -> 172.31.23.72 TCP 66 6633 → 33658 [ACK] Seq=65 Ack=49 Win=853 Len=0 TSval=1267036 TSecr=26106137
 36 0.299459378 172.31.31.144 -> 172.31.23.72 TCP 90 6633 → 33664 [PSH, ACK] Seq=1 Ack=1 Win=853 Len=24 TSval=1267061 TSecr=26105764
 37 0.299481017 172.31.31.144 -> 172.31.23.72 TCP 90 6633 → 33662 [PSH, ACK] Seq=1 Ack=1 Win=853 Len=24 TSval=1267061 TSecr=26105765
 38 0.299484599 172.31.31.144 -> 172.31.23.72 TCP 106 6633 → 33664 [PSH, ACK] Seq=25 Ack=1 Win=853 Len=40 TSval=1267061 TSecr=26105764
 39 0.299517983 172.31.31.144 -> 172.31.23.72 TCP 106 6633 → 33662 [PSH, ACK] Seq=25 Ack=1 Win=853 Len=40 TSval=1267061 TSecr=26105765
 40 0.307672777 172.31.23.72 -> 172.31.31.144 OpenFlow 82 Type: OFPT_MULTIPART_REPLY, OFPMP_GROUP
 41 0.307708325 172.31.23.72 -> 172.31.31.144 OpenFlow 98 Type: OFPT_MULTIPART_REPLY, OFPMP_METER
 42 0.307751543 172.31.23.72 -> 172.31.31.144 OpenFlow 82 Type: OFPT_MULTIPART_REPLY, OFPMP_GROUP
 43 0.307792630 172.31.23.72 -> 172.31.31.144 OpenFlow 98 Type: OFPT_MULTIPART_REPLY, OFPMP_METER
 44 0.308001686 172.31.31.144 -> 172.31.23.72 TCP 66 6633 → 33662 [ACK] Seq=65 Ack=17 Win=853 Len=0 TSval=1267063 TSecr=26106164
 45 0.308013603 172.31.31.144 -> 172.31.23.72 TCP 66 6633 → 33662 [ACK] Seq=65 Ack=49 Win=853 Len=0 TSval=1267063 TSecr=26106164
 46 0.308032645 172.31.31.144 -> 172.31.23.72 TCP 66 6633 → 33664 [ACK] Seq=65 Ack=17 Win=853 Len=0 TSval=1267063 TSecr=26106164
 47 0.308052679 172.31.31.144 -> 172.31.23.72 TCP 66 6633 → 33664 [ACK] Seq=65 Ack=49 Win=853 Len=0 TSval=1267063 TSecr=26106164
 48 0.399729896 172.31.31.144 -> 172.31.23.72 TCP 90 6633 → 33666 [PSH, ACK] Seq=1 Ack=1 Win=853 Len=24 TSval=1267086 TSecr=26105738
 49 0.399756740 172.31.31.144 -> 172.31.23.72 TCP 90 6633 → 33668 [PSH, ACK] Seq=1 Ack=1 Win=853 Len=24 TSval=1267086 TSecr=26105765
 50 0.399760063 172.31.31.144 -> 172.31.23.72 TCP 106 6633 → 33666 [PSH, ACK] Seq=25 Ack=1 Win=853 Len=40 TSval=1267086 TSecr=26105738
 51 0.399763235 172.31.31.144 -> 172.31.23.72 TCP 106 6633 → 33668 [PSH, ACK] Seq=25 Ack=1 Win=853 Len=40 TSval=1267086 TSecr=26105765
 52 0.399927064 172.31.23.72 -> 172.31.31.144 OpenFlow 82 Type: OFPT_MULTIPART_REPLY, OFPMP_GROUP
 53 0.399955472 172.31.23.72 -> 172.31.31.144 OpenFlow 98 Type: OFPT_MULTIPART_REPLY, OFPMP_METER
 54 0.400029564 172.31.23.72 -> 172.31.31.144 OpenFlow 82 Type: OFPT_MULTIPART_REPLY, OFPMP_GROUP
 55 0.400049577 172.31.23.72 -> 172.31.31.144 OpenFlow 98 Type: OFPT_MULTIPART_REPLY, OFPMP_METER
 56 0.400217476 172.31.31.144 -> 172.31.23.72 TCP 66 6633 → 33668 [ACK] Seq=65 Ack=17 Win=853 Len=0 TSval=1267086 TSecr=26106187
 57 0.400224898 172.31.31.144 -> 172.31.23.72 TCP 66 6633 → 33668 [ACK] Seq=65 Ack=49 Win=853 Len=0 TSval=1267086 TSecr=26106187
 58 0.400260015 172.31.31.144 -> 172.31.23.72 TCP 66 6633 → 33666 [ACK] Seq=65 Ack=17 Win=853 Len=0 TSval=1267086 TSecr=26106187
 59 0.400278860 172.31.31.144 -> 172.31.23.72 TCP 66 6633 → 33666 [ACK] Seq=65 Ack=49 Win=853 Len=0 TSval=1267086 TSecr=26106187
 60 0.499781967 172.31.31.144 -> 172.31.23.72 TCP 90 6633 → 33670 [PSH, ACK] Seq=1 Ack=1 Win=853 Len=24 TSval=1267111 TSecr=26105764
 61 0.499816252 172.31.31.144 -> 172.31.23.72 TCP 106 6633 → 33670 [PSH, ACK] Seq=25 Ack=1 Win=853 Len=40 TSval=1267111 TSecr=26105764
 62 0.500080547 172.31.23.72 -> 172.31.31.144 OpenFlow 82 Type: OFPT_MULTIPART_REPLY, OFPMP_GROUP
 63 0.500107064 172.31.23.72 -> 172.31.31.144 OpenFlow 98 Type: OFPT_MULTIPART_REPLY, OFPMP_METER
 64 0.500356112 172.31.31.144 -> 172.31.23.72 TCP 66 6633 → 33670 [ACK] Seq=65 Ack=17 Win=853 Len=0 TSval=1267111 TSecr=26106212
 65 0.500369924 172.31.31.144 -> 172.31.23.72 TCP 66 6633 → 33670 [ACK] Seq=65 Ack=49 Win=853 Len=0 TSval=1267111 TSecr=26106212
 66 0.700065134 172.31.31.144 -> 172.31.23.72 TCP 90 6633 → 33672 [PSH, ACK] Seq=1 Ack=1 Win=853 Len=24 TSval=1267161 TSecr=26105765
 67 0.700089824 172.31.31.144 -> 172.31.23.72 TCP 90 6633 → 33674 [PSH, ACK] Seq=1 Ack=1 Win=853 Len=24 TSval=1267161 TSecr=26105765
 68 0.700109509 172.31.31.144 -> 172.31.23.72 TCP 106 6633 → 33672 [PSH, ACK] Seq=25 Ack=1 Win=853 Len=40 TSval=1267161 TSecr=26105765
 69 0.700113509 172.31.31.144 -> 172.31.23.72 TCP 106 6633 → 33674 [PSH, ACK] Seq=25 Ack=1 Win=853 Len=40 TSval=1267161 TSecr=26105765
 70 0.700116881 172.31.31.144 -> 172.31.23.72 TCP 90 6633 → 33676 [PSH, ACK] Seq=1 Ack=1 Win=853 Len=24 TSval=1267161 TSecr=26105765
 71 0.700158526 172.31.31.144 -> 172.31.23.72 TCP 106 6633 → 33676 [PSH, ACK] Seq=25 Ack=1 Win=853 Len=40 TSval=1267161 TSecr=26105765
 72 0.700419163 172.31.23.72 -> 172.31.31.144 OpenFlow 82 Type: OFPT_MULTIPART_REPLY, OFPMP_GROUP
 73 0.700444265 172.31.23.72 -> 172.31.31.144 OpenFlow 82 Type: OFPT_MULTIPART_REPLY, OFPMP_GROUP_DESC
 74 0.700469017 172.31.23.72 -> 172.31.31.144 OpenFlow 82 Type: OFPT_MULTIPART_REPLY, OFPMP_GROUP
 75 0.700476905 172.31.23.72 -> 172.31.31.144 OpenFlow 82 Type: OFPT_MULTIPART_REPLY, OFPMP_METER
 76 0.700500342 172.31.23.72 -> 172.31.31.144 OpenFlow 82 Type: OFPT_MULTIPART_REPLY, OFPMP_GROUP
 77 0.700505274 172.31.23.72 -> 172.31.31.144 OpenFlow 98 Type: OFPT_MULTIPART_REPLY, OFPMP_METER
 78 0.700550481 172.31.23.72 -> 172.31.31.144 OpenFlow 98 Type: OFPT_MULTIPART_REPLY, OFPMP_METER
 79 0.700703379 172.31.31.144 -> 172.31.23.72 TCP 66 6633 → 33674 [ACK] Seq=65 Ack=17 Win=853 Len=0 TSval=1267161 TSecr=26106262
 80 0.700711113 172.31.31.144 -> 172.31.23.72 TCP 66 6633 → 33676 [ACK] Seq=65 Ack=17 Win=853 Len=0 TSval=1267161 TSecr=26106262
 81 0.700715186 172.31.31.144 -> 172.31.23.72 TCP 66 6633 → 33676 [ACK] Seq=65 Ack=33 Win=853 Len=0 TSval=1267161 TSecr=26106262
 82 0.700736208 172.31.31.144 -> 172.31.23.72 TCP 66 6633 → 33676 [ACK] Seq=65 Ack=49 Win=853 Len=0 TSval=1267161 TSecr=26106262
 83 0.700771679 172.31.31.144 -> 172.31.23.72 TCP 66 6633 → 33672 [ACK] Seq=65 Ack=17 Win=853 Len=0 TSval=1267161 TSecr=26106262
 84 0.700804170 172.31.31.144 -> 172.31.23.72 TCP 66 6633 → 33674 [ACK] Seq=65 Ack=49 Win=853 Len=0 TSval=1267161 TSecr=26106262
 85 0.700816475 172.31.31.144 -> 172.31.23.72 TCP 66 6633 → 33672 [ACK] Seq=65 Ack=49 Win=853 Len=0 TSval=1267161 TSecr=26106262
 86 1.600297052 172.31.31.144 -> 172.31.23.72 OpenFlow 187 Type: OFPT_PACKET_OUT
 87 1.600324285 172.31.31.144 -> 172.31.23.72 OpenFlow 187 Type: OFPT_PACKET_OUT
 88 1.600345654 172.31.31.144 -> 172.31.23.72 OpenFlow 187 Type: OFPT_PACKET_OUT
 89 1.600367632 172.31.31.144 -> 172.31.23.72 OpenFlow 187 Type: OFPT_PACKET_OUT
 90 1.600424882 172.31.31.144 -> 172.31.23.72 OpenFlow 187 Type: OFPT_PACKET_OUT
 91 1.600486252 172.31.31.144 -> 172.31.23.72 OpenFlow 187 Type: OFPT_PACKET_OUT
 92 1.600538621 172.31.31.144 -> 172.31.23.72 OpenFlow 187 Type: OFPT_PACKET_OUT
 93 1.600589176 172.31.31.144 -> 172.31.23.72 OpenFlow 187 Type: OFPT_PACKET_OUT
 94 1.600849947 172.31.23.72 -> 172.31.31.144 TCP 66 33668 → 6633 [ACK] Seq=49 Ack=1033 Win=213 Len=0 TSval=26106487 TSecr=1267386
 95 1.600988625 172.31.23.72 -> 172.31.31.144 OpenFlow 189 Type: OFPT_PACKET_IN
 96 1.601014690 172.31.23.72 -> 172.31.31.144 OpenFlow 189 Type: OFPT_PACKET_IN
 97 1.601076356 172.31.23.72 -> 172.31.31.144 OpenFlow 189 Type: OFPT_PACKET_IN
 98 1.601098071 172.31.23.72 -> 172.31.31.144 OpenFlow 189 Type: OFPT_PACKET_IN
 99 1.601110112 172.31.23.72 -> 172.31.31.144 OpenFlow 189 Type: OFPT_PACKET_IN
100 1.601149335 172.31.23.72 -> 172.31.31.144 OpenFlow 189 Type: OFPT_PACKET_IN
101 1.601260221 172.31.31.144 -> 172.31.23.72 TCP 66 6633 → 33666 [ACK] Seq=65 Ack=172 Win=853 Len=0 TSval=1267386 TSecr=26106487
102 1.601272742 172.31.31.144 -> 172.31.23.72 TCP 66 6633 → 33666 [ACK] Seq=65 Ack=295 Win=853 Len=0 TSval=1267386 TSecr=26106487
103 1.601292397 172.31.31.144 -> 172.31.23.72 TCP 66 6633 → 33670 [ACK] Seq=65 Ack=172 Win=853 Len=0 TSval=1267386 TSecr=26106487
104 1.601312398 172.31.31.144 -> 172.31.23.72 TCP 66 6633 → 33670 [ACK] Seq=65 Ack=295 Win=853 Len=0 TSval=1267386 TSecr=26106487
105 1.601339486 172.31.31.144 -> 172.31.23.72 TCP 66 6633 → 33658 [ACK] Seq=65 Ack=172 Win=853 Len=0 TSval=1267386 TSecr=26106487
106 1.601359410 172.31.31.144 -> 172.31.23.72 TCP 66 6633 → 33658 [ACK] Seq=65 Ack=295 Win=853 Len=0 TSval=1267386 TSecr=26106487
107 1.699907101 172.31.31.144 -> 172.31.23.72 OpenFlow 187 Type: OFPT_PACKET_OUT
108 1.699933777 172.31.31.144 -> 172.31.23.72 OpenFlow 187 Type: OFPT_PACKET_OUT
109 1.699950616 172.31.31.144 -> 172.31.23.72 OpenFlow 187 Type: OFPT_PACKET_OUT
110 1.699990686 172.31.31.144 -> 172.31.23.72 OpenFlow 187 Type: OFPT_PACKET_OUT
111 1.700053706 172.31.31.144 -> 172.31.23.72 OpenFlow 187 Type: OFPT_PACKET_OUT
112 1.700108923 172.31.31.144 -> 172.31.23.72 OpenFlow 187 Type: OFPT_PACKET_OUT
113 1.700181494 172.31.31.144 -> 172.31.23.72 OpenFlow 187 Type: OFPT_PACKET_OUT
114 1.700225927 172.31.31.144 -> 172.31.23.72 OpenFlow 187 Type: OFPT_PACKET_OUT
115 1.700286742 172.31.31.144 -> 172.31.23.72 OpenFlow 187 Type: OFPT_PACKET_OUT
116 1.700363645 172.31.31.144 -> 172.31.23.72 OpenFlow 187 Type: OFPT_PACKET_OUT
117 1.700391981 172.31.31.144 -> 172.31.23.72 OpenFlow 187 Type: OFPT_PACKET_OUT
118 1.700450709 172.31.31.144 -> 172.31.23.72 OpenFlow 187 Type: OFPT_PACKET_OUT
119 1.700503076 172.31.23.72 -> 172.31.31.144 TCP 66 33656 → 6633 [ACK] Seq=49 Ack=791 Win=213 Len=0 TSval=26106512 TSecr=1267411
120 1.700511682 172.31.31.144 -> 172.31.23.72 OpenFlow 187 Type: OFPT_PACKET_OUT
121 1.700556727 172.31.31.144 -> 172.31.23.72 OpenFlow 187 Type: OFPT_PACKET_OUT
122 1.700643605 172.31.31.144 -> 172.31.23.72 TCP 187 6633 → 33636 [PSH, ACK] Seq=1 Ack=1 Win=853 Len=121 TSval=1267411 TSecr=26105987
123 1.700675749 172.31.31.144 -> 172.31.23.72 TCP 187 6633 → 33636 [PSH, ACK] Seq=122 Ack=1 Win=853 Len=121 TSval=1267411 TSecr=26105987
124 1.700741424 172.31.31.144 -> 172.31.23.72 TCP 187 6633 → 33636 [PSH, ACK] Seq=243 Ack=1 Win=853 Len=121 TSval=1267411 TSecr=26105987
125 1.700799205 172.31.31.144 -> 172.31.23.72 TCP 187 6633 → 33636 [PSH, ACK] Seq=364 Ack=1 Win=853 Len=121 TSval=1267411 TSecr=26105987
126 1.700853367 172.31.31.144 -> 172.31.23.72 TCP 187 6633 → 33636 [PSH, ACK] Seq=485 Ack=1 Win=853 Len=121 TSval=1267411 TSecr=26105987
127 1.700901413 172.31.31.144 -> 172.31.23.72 TCP 187 6633 → 33636 [PSH, ACK] Seq=606 Ack=1 Win=853 Len=121 TSval=1267411 TSecr=26105987
128 1.700958988 172.31.31.144 -> 172.31.23.72 TCP 187 6633 → 33636 [PSH, ACK] Seq=727 Ack=1 Win=853 Len=121 TSval=1267411 TSecr=26105987
129 1.700969435 172.31.23.72 -> 172.31.31.144 TCP 66 33652 → 6633 [ACK] Seq=49 Ack=1033 Win=213 Len=0 TSval=26106512 TSecr=1267411
130 1.701013899 172.31.31.144 -> 172.31.23.72 TCP 187 6633 → 33636 [PSH, ACK] Seq=848 Ack=1 Win=853 Len=121 TSval=1267411 TSecr=26105987
131 1.701117466 172.31.31.144 -> 172.31.23.72 OpenFlow 187 Type: OFPT_PACKET_OUT
132 1.701169734 172.31.31.144 -> 172.31.23.72 OpenFlow 187 Type: OFPT_PACKET_OUT
133 1.701249074 172.31.31.144 -> 172.31.23.72 OpenFlow 187 Type: OFPT_PACKET_OUT
134 1.701319644 172.31.23.72 -> 172.31.31.144 TCP 66 33636 → 6633 [ACK] Seq=1 Ack=969 Win=213 Len=0 TSval=26106512 TSecr=1267411
135 1.701348784 172.31.31.144 -> 172.31.23.72 OpenFlow 187 Type: OFPT_PACKET_OUT
136 1.701396497 172.31.31.144 -> 172.31.23.72 OpenFlow 187 Type: OFPT_PACKET_OUT
137 1.701414561 172.31.23.72 -> 172.31.31.144 OpenFlow 189 Type: OFPT_PACKET_IN
138 1.701435635 172.31.23.72 -> 172.31.31.144 OpenFlow 189 Type: OFPT_PACKET_IN
139 1.701481822 172.31.31.144 -> 172.31.23.72 OpenFlow 187 Type: OFPT_PACKET_OUT
140 1.701541244 172.31.31.144 -> 172.31.23.72 OpenFlow 187 Type: OFPT_PACKET_OUT
141 1.701634702 172.31.31.144 -> 172.31.23.72 OpenFlow 187 Type: OFPT_PACKET_OUT
142 1.701638969 172.31.31.144 -> 172.31.23.72 TCP 66 6633 → 33650 [ACK] Seq=1033 Ack=172 Win=853 Len=0 TSval=1267411 TSecr=26106512
143 1.701655814 172.31.31.144 -> 172.31.23.72 TCP 66 6633 → 33650 [ACK] Seq=1033 Ack=295 Win=853 Len=0 TSval=1267411 TSecr=26106512
144 1.701791813 172.31.23.72 -> 172.31.31.144 TCP 66 33650 → 6633 [ACK] Seq=295 Ack=1033 Win=213 Len=0 TSval=26106512 TSecr=1267411
145 1.701862911 172.31.31.144 -> 172.31.23.72 TCP 187 6633 → 33640 [PSH, ACK] Seq=1 Ack=1 Win=853 Len=121 TSval=1267411 TSecr=26106012
146 1.701872280 172.31.23.72 -> 172.31.31.144 OpenFlow 189 Type: OFPT_PACKET_IN
147 1.701918260 172.31.23.72 -> 172.31.31.144 OpenFlow 189 Type: OFPT_PACKET_IN
148 1.701939550 172.31.31.144 -> 172.31.23.72 OpenFlow 187 Type: OFPT_PACKET_OUT
149 1.701993238 172.31.31.144 -> 172.31.23.72 OpenFlow 187 Type: OFPT_PACKET_OUT
150 1.702026376 172.31.31.144 -> 172.31.23.72 OpenFlow 187 Type: OFPT_PACKET_OUT
151 1.702030099 172.31.31.144 -> 172.31.23.72 OpenFlow 187 Type: OFPT_PACKET_OUT
152 1.702046696 172.31.23.72 -> 172.31.31.144 OpenFlow 189 Type: OFPT_PACKET_IN
153 1.702072372 172.31.23.72 -> 172.31.31.144 OpenFlow 189 Type: OFPT_PACKET_IN
154 1.702091544 172.31.23.72 -> 172.31.31.144 OpenFlow 189 Type: OFPT_PACKET_IN
155 1.702121564 172.31.23.72 -> 172.31.31.144 OpenFlow 189 Type: OFPT_PACKET_IN
156 1.702135935 172.31.31.144 -> 172.31.23.72 OpenFlow 187 Type: OFPT_PACKET_OUT
157 1.702139826 172.31.31.144 -> 172.31.23.72 TCP 66 6633 → 33640 [ACK] Seq=485 Ack=124 Win=853 Len=0 TSval=1267411 TSecr=26106512
158 1.702142221 172.31.31.144 -> 172.31.23.72 TCP 66 6633 → 33640 [ACK] Seq=485 Ack=247 Win=853 Len=0 TSval=1267411 TSecr=26106512
159 1.702158378 172.31.23.72 -> 172.31.31.144 OpenFlow 189 Type: OFPT_PACKET_IN
160 1.702164906 172.31.23.72 -> 172.31.31.144 OpenFlow 189 Type: OFPT_PACKET_IN
161 1.702166886 172.31.23.72 -> 172.31.31.144 OpenFlow 189 Type: OFPT_PACKET_IN
162 1.702202070 172.31.23.72 -> 172.31.31.144 OpenFlow 189 Type: OFPT_PACKET_IN
163 1.702204602 172.31.23.72 -> 172.31.31.144 OpenFlow 435 Type: OFPT_PACKET_IN
164 1.702206368 172.31.23.72 -> 172.31.31.144 OpenFlow 435 Type: OFPT_PACKET_IN
165 1.702218234 172.31.31.144 -> 172.31.23.72 OpenFlow 187 Type: OFPT_PACKET_OUT
166 1.702274222 172.31.23.72 -> 172.31.31.144 OpenFlow 189 Type: OFPT_PACKET_IN
167 1.702280479 172.31.23.72 -> 172.31.31.144 OpenFlow 189 Type: OFPT_PACKET_IN
168 1.702299872 172.31.23.72 -> 172.31.31.144 OpenFlow 189 Type: OFPT_PACKET_IN
169 1.702302047 172.31.23.72 -> 172.31.31.144 OpenFlow 189 Type: OFPT_PACKET_IN
170 1.702325236 172.31.23.72 -> 172.31.31.144 OpenFlow 189 Type: OFPT_PACKET_IN
171 1.702343299 172.31.23.72 -> 172.31.31.144 OpenFlow 189 Type: OFPT_PACKET_IN
172 1.702368949 172.31.31.144 -> 172.31.23.72 TCP 66 6633 → 33634 [ACK] Seq=1 Ack=124 Win=853 Len=0 TSval=1267411 TSecr=26106512
173 1.702373692 172.31.31.144 -> 172.31.23.72 TCP 66 6633 → 33660 [ACK] Seq=65 Ack=172 Win=853 Len=0 TSval=1267411 TSecr=26106512
174 1.702434776 172.31.23.72 -> 172.31.31.144 OpenFlow 189 Type: OFPT_PACKET_IN
175 1.702441495 172.31.23.72 -> 172.31.31.144 OpenFlow 189 Type: OFPT_PACKET_IN
176 1.702493356 172.31.31.144 -> 172.31.23.72 TCP 66 6633 → 33646 [ACK] Seq=1 Ack=124 Win=853 Len=0 TSval=1267411 TSecr=26106512
177 1.702498378 172.31.31.144 -> 172.31.23.72 TCP 66 6633 → 33644 [ACK] Seq=1 Ack=124 Win=853 Len=0 TSval=1267411 TSecr=26106512
178 1.702503054 172.31.23.72 -> 172.31.31.144 OpenFlow 189 Type: OFPT_PACKET_IN
179 1.702508899 172.31.23.72 -> 172.31.31.144 OpenFlow 189 Type: OFPT_PACKET_IN
180 1.702530852 172.31.23.72 -> 172.31.31.144 OpenFlow 189 Type: OFPT_PACKET_IN
181 1.702540331 172.31.31.144 -> 172.31.23.72 TCP 66 6633 → 33634 [ACK] Seq=1 Ack=247 Win=853 Len=0 TSval=1267411 TSecr=26106512
182 1.702543569 172.31.31.144 -> 172.31.23.72 TCP 66 6633 → 33660 [ACK] Seq=65 Ack=295 Win=853 Len=0 TSval=1267411 TSecr=26106512
183 1.702545606 172.31.31.144 -> 172.31.23.72 OpenFlow 187 Type: OFPT_PACKET_OUT
184 1.702603766 172.31.23.72 -> 172.31.31.144 OpenFlow 189 Type: OFPT_PACKET_IN
185 1.702628724 172.31.31.144 -> 172.31.23.72 TCP 66 6633 → 33646 [ACK] Seq=1 Ack=493 Win=853 Len=0 TSval=1267411 TSecr=26106512
186 1.702637038 172.31.31.144 -> 172.31.23.72 OpenFlow 187 Type: OFPT_PACKET_OUT
187 1.702664629 172.31.23.72 -> 172.31.31.144 TCP 66 33650 → 6633 [ACK] Seq=295 Ack=1275 Win=213 Len=0 TSval=26106513 TSecr=1267411
188 1.702695834 172.31.31.144 -> 172.31.23.72 TCP 66 6633 → 33664 [ACK] Seq=65 Ack=172 Win=853 Len=0 TSval=1267411 TSecr=26106512
189 1.702705543 172.31.31.144 -> 172.31.23.72 OpenFlow 187 Type: OFPT_PACKET_OUT
190 1.702707744 172.31.31.144 -> 172.31.23.72 TCP 66 6633 → 33654 [ACK] Seq=65 Ack=541 Win=853 Len=0 TSval=1267412 TSecr=26106512
191 1.702710307 172.31.31.144 -> 172.31.23.72 OpenFlow 550 Type: OFPT_PACKET_OUT
192 1.702727966 172.31.31.144 -> 172.31.23.72 TCP 66 6633 → 33644 [ACK] Seq=1 Ack=247 Win=853 Len=0 TSval=1267412 TSecr=26106512
193 1.702730882 172.31.31.144 -> 172.31.23.72 TCP 66 6633 → 33658 [ACK] Seq=65 Ack=418 Win=853 Len=0 TSval=1267412 TSecr=26106512
194 1.702753284 172.31.31.144 -> 172.31.23.72 OpenFlow 308 Type: OFPT_PACKET_OUT
195 1.702771426 172.31.31.144 -> 172.31.23.72 TCP 66 6633 → 33638 [ACK] Seq=1 Ack=124 Win=853 Len=0 TSval=1267412 TSecr=26106512
196 1.702790916 172.31.31.144 -> 172.31.23.72 TCP 66 6633 → 33664 [ACK] Seq=65 Ack=295 Win=853 Len=0 TSval=1267412 TSecr=26106513
197 1.702814737 172.31.31.144 -> 172.31.23.72 TCP 66 6633 → 33658 [ACK] Seq=65 Ack=541 Win=853 Len=0 TSval=1267412 TSecr=26106513
198 1.702838701 172.31.31.144 -> 172.31.23.72 TCP 66 6633 → 33638 [ACK] Seq=1 Ack=247 Win=853 Len=0 TSval=1267412 TSecr=26106513
199 1.702857215 172.31.31.144 -> 172.31.23.72 OpenFlow 187 Type: OFPT_PACKET_OUT
200 1.702875923 172.31.31.144 -> 172.31.23.72 TCP 66 6633 → 33652 [ACK] Seq=1033 Ack=172 Win=853 Len=0 TSval=1267412 TSecr=26106513
201 1.702894379 172.31.31.144 -> 172.31.23.72 TCP 66 6633 → 33652 [ACK] Seq=1033 Ack=295 Win=853 Len=0 TSval=1267412 TSecr=26106513
202 1.702915148 172.31.31.144 -> 172.31.23.72 OpenFlow 308 Type: OFPT_PACKET_OUT
203 1.702943950 172.31.31.144 -> 172.31.23.72 TCP 66 6633 → 33648 [ACK] Seq=1 Ack=247 Win=853 Len=0 TSval=1267412 TSecr=26106512
204 1.702962994 172.31.31.144 -> 172.31.23.72 TCP 66 6633 → 33642 [ACK] Seq=1 Ack=247 Win=853 Len=0 TSval=1267412 TSecr=26106512
205 1.703037935 172.31.31.144 -> 172.31.23.72 OpenFlow 187 Type: OFPT_PACKET_OUT
206 1.703166665 172.31.23.72 -> 172.31.31.144 TCP 66 33640 → 6633 [ACK] Seq=247 Ack=1211 Win=213 Len=0 TSval=26106513 TSecr=1267411
207 1.703219434 172.31.31.144 -> 172.31.23.72 OpenFlow 187 Type: OFPT_PACKET_OUT
208 1.703340566 172.31.31.144 -> 172.31.23.72 OpenFlow 187 Type: OFPT_PACKET_OUT
209 1.703405276 172.31.31.144 -> 172.31.23.72 OpenFlow 187 Type: OFPT_PACKET_OUT
210 1.703448208 172.31.31.144 -> 172.31.23.72 OpenFlow 187 Type: OFPT_PACKET_OUT
211 1.703495522 172.31.31.144 -> 172.31.23.72 OpenFlow 187 Type: OFPT_PACKET_OUT
212 1.703550392 172.31.31.144 -> 172.31.23.72 OpenFlow 187 Type: OFPT_PACKET_OUT
213 1.703597833 172.31.23.72 -> 172.31.31.144 TCP 66 33634 → 6633 [ACK] Seq=247 Ack=1211 Win=213 Len=0 TSval=26106513 TSecr=1267411
214 1.703608188 172.31.31.144 -> 172.31.23.72 OpenFlow 187 Type: OFPT_PACKET_OUT
215 1.703660985 172.31.31.144 -> 172.31.23.72 OpenFlow 187 Type: OFPT_PACKET_OUT
216 1.703715781 172.31.31.144 -> 172.31.23.72 OpenFlow 187 Type: OFPT_PACKET_OUT
217 1.703770486 172.31.31.144 -> 172.31.23.72 OpenFlow 187 Type: OFPT_PACKET_OUT
218 1.703827963 172.31.31.144 -> 172.31.23.72 OpenFlow 187 Type: OFPT_PACKET_OUT
219 1.703883463 172.31.31.144 -> 172.31.23.72 OpenFlow 187 Type: OFPT_PACKET_OUT
220 1.704023961 172.31.31.144 -> 172.31.23.72 OpenFlow 187 Type: OFPT_PACKET_OUT
221 1.704034831 172.31.31.144 -> 172.31.23.72 OpenFlow 187 Type: OFPT_PACKET_OUT
222 1.704085597 172.31.31.144 -> 172.31.23.72 OpenFlow 187 Type: OFPT_PACKET_OUT
223 1.704121429 172.31.23.72 -> 172.31.31.144 TCP 66 33660 → 6633 [ACK] Seq=295 Ack=1275 Win=213 Len=0 TSval=26106513 TSecr=1267412
224 1.704134477 172.31.31.144 -> 172.31.23.72 OpenFlow 187 Type: OFPT_PACKET_OUT
225 1.704190287 172.31.31.144 -> 172.31.23.72 OpenFlow 187 Type: OFPT_PACKET_OUT
226 1.704256070 172.31.31.144 -> 172.31.23.72 OpenFlow 187 Type: OFPT_PACKET_OUT
227 1.704306424 172.31.31.144 -> 172.31.23.72 OpenFlow 187 Type: OFPT_PACKET_OUT
228 1.704353542 172.31.31.144 -> 172.31.23.72 OpenFlow 187 Type: OFPT_PACKET_OUT
229 1.704427399 172.31.31.144 -> 172.31.23.72 OpenFlow 187 Type: OFPT_PACKET_OUT
230 1.704441498 172.31.31.144 -> 172.31.23.72 OpenFlow 187 Type: OFPT_PACKET_OUT
231 1.704498355 172.31.31.144 -> 172.31.23.72 OpenFlow 187 Type: OFPT_PACKET_OUT
232 1.704552676 172.31.31.144 -> 172.31.23.72 OpenFlow 187 Type: OFPT_PACKET_OUT
233 1.704573912 172.31.23.72 -> 172.31.31.144 TCP 66 33654 → 6633 [ACK] Seq=541 Ack=1033 Win=213 Len=0 TSval=26106513 TSecr=1267412
234 1.704619205 172.31.31.144 -> 172.31.23.72 OpenFlow 187 Type: OFPT_PACKET_OUT
235 1.704653179 172.31.23.72 -> 172.31.31.144 OpenFlow 189 Type: OFPT_PACKET_IN
236 1.704682603 172.31.31.144 -> 172.31.23.72 OpenFlow 187 Type: OFPT_PACKET_OUT
237 1.704687643 172.31.23.72 -> 172.31.31.144 OpenFlow 189 Type: OFPT_PACKET_IN
238 1.704732430 172.31.31.144 -> 172.31.23.72 OpenFlow 187 Type: OFPT_PACKET_OUT
239 1.704796527 172.31.31.144 -> 172.31.23.72 OpenFlow 187 Type: OFPT_PACKET_OUT
240 1.704843425 172.31.31.144 -> 172.31.23.72 OpenFlow 187 Type: OFPT_PACKET_OUT
241 1.704904401 172.31.31.144 -> 172.31.23.72 TCP 66 6633 → 33666 [ACK] Seq=791 Ack=541 Win=853 Len=0 TSval=1267412 TSecr=26106513
242 1.704922265 172.31.31.144 -> 172.31.23.72 OpenFlow 187 Type: OFPT_PACKET_OUT
243 1.704941863 172.31.31.144 -> 172.31.23.72 OpenFlow 187 Type: OFPT_PACKET_OUT
244 1.704954938 172.31.23.72 -> 172.31.31.144 OpenFlow 189 Type: OFPT_PACKET_IN
245 1.704976475 172.31.23.72 -> 172.31.31.144 OpenFlow 189 Type: OFPT_PACKET_IN
246 1.705016304 172.31.31.144 -> 172.31.23.72 OpenFlow 187 Type: OFPT_PACKET_OUT
247 1.705049988 172.31.31.144 -> 172.31.23.72 OpenFlow 187 Type: OFPT_PACKET_OUT
248 1.705101675 172.31.31.144 -> 172.31.23.72 OpenFlow 187 Type: OFPT_PACKET_OUT
249 1.705163327 172.31.31.144 -> 172.31.23.72 OpenFlow 187 Type: OFPT_PACKET_OUT
250 1.705225444 172.31.31.144 -> 172.31.23.72 OpenFlow 187 Type: OFPT_PACKET_OUT
251 1.705300591 172.31.31.144 -> 172.31.23.72 OpenFlow 187 Type: OFPT_PACKET_OUT
252 1.705334017 172.31.31.144 -> 172.31.23.72 OpenFlow 187 Type: OFPT_PACKET_OUT
253 1.705391603 172.31.31.144 -> 172.31.23.72 OpenFlow 187 Type: OFPT_PACKET_OUT
254 1.705452042 172.31.23.72 -> 172.31.31.144 TCP 66 33646 → 6633 [ACK] Seq=739 Ack=1211 Win=213 Len=0 TSval=26106513 TSecr=1267412
255 1.705462871 172.31.31.144 -> 172.31.23.72 OpenFlow 187 Type: OFPT_PACKET_OUT
256 1.705517621 172.31.31.144 -> 172.31.23.72 OpenFlow 187 Type: OFPT_PACKET_OUT
257 1.705572561 172.31.31.144 -> 172.31.23.72 OpenFlow 187 Type: OFPT_PACKET_OUT
258 1.705746174 172.31.23.72 -> 172.31.31.144 TCP 66 33644 → 6633 [ACK] Seq=247 Ack=727 Win=213 Len=0 TSval=26106513 TSecr=1267412
259 1.705816586 172.31.23.72 -> 172.31.31.144 OpenFlow 189 Type: OFPT_PACKET_IN
260 1.705840292 172.31.23.72 -> 172.31.31.144 OpenFlow 435 Type: OFPT_PACKET_IN
261 1.705850165 172.31.23.72 -> 172.31.31.144 OpenFlow 189 Type: OFPT_PACKET_IN
262 1.705865478 172.31.23.72 -> 172.31.31.144 OpenFlow 189 Type: OFPT_PACKET_IN
263 1.705897056 172.31.23.72 -> 172.31.31.144 OpenFlow 189 Type: OFPT_PACKET_IN
264 1.705899273 172.31.23.72 -> 172.31.31.144 OpenFlow 435 Type: OFPT_PACKET_IN
265 1.705911885 172.31.23.72 -> 172.31.31.144 OpenFlow 189 Type: OFPT_PACKET_IN
266 1.705916959 172.31.23.72 -> 172.31.31.144 OpenFlow 681 Type: OFPT_PACKET_IN
267 1.705930105 172.31.23.72 -> 172.31.31.144 OpenFlow 189 Type: OFPT_PACKET_IN
268 1.705932091 172.31.23.72 -> 172.31.31.144 OpenFlow 189 Type: OFPT_PACKET_IN
269 1.705947568 172.31.23.72 -> 172.31.31.144 OpenFlow 189 Type: OFPT_PACKET_IN
270 1.705958921 172.31.23.72 -> 172.31.31.144 OpenFlow 189 Type: OFPT_PACKET_IN
271 1.705977289 172.31.23.72 -> 172.31.31.144 OpenFlow 189 Type: OFPT_PACKET_IN
272 1.706052517 172.31.23.72 -> 172.31.31.144 OpenFlow 189 Type: OFPT_PACKET_IN
273 1.706058789 172.31.23.72 -> 172.31.31.144 OpenFlow 189 Type: OFPT_PACKET_IN
274 1.706071740 172.31.23.72 -> 172.31.31.144 OpenFlow 189 Type: OFPT_PACKET_IN
275 1.706074075 172.31.23.72 -> 172.31.31.144 OpenFlow 189 Type: OFPT_PACKET_IN
276 1.706090879 172.31.23.72 -> 172.31.31.144 OpenFlow 189 Type: OFPT_PACKET_IN
277 1.706093076 172.31.23.72 -> 172.31.31.144 OpenFlow 681 Type: OFPT_PACKET_IN
278 1.706105600 172.31.23.72 -> 172.31.31.144 OpenFlow 189 Type: OFPT_PACKET_IN
279 1.706107796 172.31.23.72 -> 172.31.31.144 OpenFlow 189 Type: OFPT_PACKET_IN
280 1.706125633 172.31.23.72 -> 172.31.31.144 OpenFlow 189 Type: OFPT_PACKET_IN
281 1.706131944 172.31.31.144 -> 172.31.23.72 TCP 66 6633 → 33632 [ACK] Seq=1 Ack=124 Win=853 Len=0 TSval=1267412 TSecr=26106513
282 1.706136655 172.31.31.144 -> 172.31.23.72 TCP 66 6633 → 33632 [ACK] Seq=1 Ack=493 Win=853 Len=0 TSval=1267412 TSecr=26106513
283 1.706138915 172.31.31.144 -> 172.31.23.72 TCP 66 6633 → 33662 [ACK] Seq=65 Ack=172 Win=853 Len=0 TSval=1267412 TSecr=26106513
284 1.706161276 172.31.23.72 -> 172.31.31.144 OpenFlow 189 Type: OFPT_PACKET_IN
285 1.706185460 172.31.23.72 -> 172.31.31.144 OpenFlow 189 Type: OFPT_PACKET_IN
286 1.706187722 172.31.23.72 -> 172.31.31.144 OpenFlow 189 Type: OFPT_PACKET_IN
287 1.706274172 172.31.23.72 -> 172.31.31.144 OpenFlow 189 Type: OFPT_PACKET_IN
288 1.706276343 172.31.23.72 -> 172.31.31.144 OpenFlow 681 Type: OFPT_PACKET_IN
289 1.706321078 172.31.31.144 -> 172.31.23.72 TCP 66 6633 → 33672 [ACK] Seq=65 Ack=172 Win=853 Len=0 TSval=1267412 TSecr=26106513
290 1.706325732 172.31.31.144 -> 172.31.23.72 TCP 66 6633 → 33662 [ACK] Seq=65 Ack=541 Win=853 Len=0 TSval=1267412 TSecr=26106513
291 1.706327729 172.31.31.144 -> 172.31.23.72 TCP 66 6633 → 33630 [ACK] Seq=1 Ack=124 Win=853 Len=0 TSval=1267412 TSecr=26106513
292 1.706329598 172.31.31.144 -> 172.31.23.72 TCP 66 6633 → 33670 [ACK] Seq=65 Ack=418 Win=853 Len=0 TSval=1267412 TSecr=26106513
293 1.706331829 172.31.31.144 -> 172.31.23.72 TCP 66 6633 → 33672 [ACK] Seq=65 Ack=295 Win=853 Len=0 TSval=1267412 TSecr=26106513
294 1.706333464 172.31.31.144 -> 172.31.23.72 TCP 66 6633 → 33648 [ACK] Seq=1 Ack=985 Win=853 Len=0 TSval=1267412 TSecr=26106513
295 1.706335414 172.31.31.144 -> 172.31.23.72 TCP 66 6633 → 33658 [ACK] Seq=65 Ack=664 Win=853 Len=0 TSval=1267412 TSecr=26106513
296 1.706340949 172.31.23.72 -> 172.31.31.144 OpenFlow 435 Type: OFPT_PACKET_IN
297 1.706361101 172.31.23.72 -> 172.31.31.144 OpenFlow 681 Type: OFPT_PACKET_IN
298 1.706363535 172.31.23.72 -> 172.31.31.144 OpenFlow 189 Type: OFPT_PACKET_IN
299 1.706454951 172.31.31.144 -> 172.31.23.72 TCP 66 6633 → 33638 [ACK] Seq=1 Ack=370 Win=853 Len=0 TSval=1267412 TSecr=26106513
300 1.706458998 172.31.31.144 -> 172.31.23.72 TCP 66 6633 → 33630 [ACK] Seq=1 Ack=247 Win=853 Len=0 TSval=1267412 TSecr=26106513
301 1.706460896 172.31.31.144 -> 172.31.23.72 TCP 66 6633 → 33670 [ACK] Seq=65 Ack=541 Win=853 Len=0 TSval=1267412 TSecr=26106513
302 1.706462557 172.31.31.144 -> 172.31.23.72 TCP 66 6633 → 33668 [ACK] Seq=1033 Ack=172 Win=853 Len=0 TSval=1267412 TSecr=26106513
303 1.706531658 172.31.31.144 -> 172.31.23.72 TCP 66 6633 → 33658 [ACK] Seq=65 Ack=787 Win=853 Len=0 TSval=1267412 TSecr=26106513
304 1.706533897 172.31.31.144 -> 172.31.23.72 TCP 66 6633 → 33656 [ACK] Seq=791 Ack=172 Win=853 Len=0 TSval=1267412 TSecr=26106513
305 1.706535816 172.31.31.144 -> 172.31.23.72 TCP 66 6633 → 33652 [ACK] Seq=1033 Ack=418 Win=853 Len=0 TSval=1267412 TSecr=26106513
306 1.706537573 172.31.31.144 -> 172.31.23.72 TCP 66 6633 → 33642 [ACK] Seq=1 Ack=985 Win=853 Len=0 TSval=1267412 TSecr=26106513
307 1.706554235 172.31.31.144 -> 172.31.23.72 TCP 66 6633 → 33638 [ACK] Seq=1 Ack=493 Win=853 Len=0 TSval=1267412 TSecr=26106513
308 1.706595736 172.31.31.144 -> 172.31.23.72 TCP 66 6633 → 33636 [ACK] Seq=969 Ack=124 Win=853 Len=0 TSval=1267412 TSecr=26106513
309 1.706597981 172.31.31.144 -> 172.31.23.72 TCP 66 6633 → 33668 [ACK] Seq=1033 Ack=295 Win=853 Len=0 TSval=1267413 TSecr=26106513
310 1.706628067 172.31.31.144 -> 172.31.23.72 TCP 66 6633 → 33656 [ACK] Seq=791 Ack=295 Win=853 Len=0 TSval=1267413 TSecr=26106513
311 1.706680688 172.31.31.144 -> 172.31.23.72 TCP 66 6633 → 33652 [ACK] Seq=1033 Ack=1033 Win=853 Len=0 TSval=1267413 TSecr=26106513
312 1.706699651 172.31.31.144 -> 172.31.23.72 TCP 66 6633 → 33636 [ACK] Seq=969 Ack=493 Win=853 Len=0 TSval=1267413 TSecr=26106513
313 1.706867744 172.31.31.144 -> 172.31.23.72 TCP 66 6633 → 33650 [ACK] Seq=1275 Ack=1033 Win=853 Len=0 TSval=1267413 TSecr=26106513
314 1.706869950 172.31.31.144 -> 172.31.23.72 TCP 66 6633 → 33640 [ACK] Seq=1211 Ack=493 Win=853 Len=0 TSval=1267413 TSecr=26106513
315 1.799821041 172.31.31.144 -> 172.31.23.72 OpenFlow 187 Type: OFPT_PACKET_OUT
316 1.799862971 172.31.31.144 -> 172.31.23.72 OpenFlow 187 Type: OFPT_PACKET_OUT
317 1.799885558 172.31.31.144 -> 172.31.23.72 OpenFlow 187 Type: OFPT_PACKET_OUT
318 1.799936394 172.31.31.144 -> 172.31.23.72 OpenFlow 187 Type: OFPT_PACKET_OUT
319 1.799987785 172.31.31.144 -> 172.31.23.72 OpenFlow 187 Type: OFPT_PACKET_OUT
320 1.800046455 172.31.31.144 -> 172.31.23.72 OpenFlow 187 Type: OFPT_PACKET_OUT
321 1.800104906 172.31.31.144 -> 172.31.23.72 OpenFlow 187 Type: OFPT_PACKET_OUT
322 1.800148131 172.31.31.144 -> 172.31.23.72 OpenFlow 187 Type: OFPT_PACKET_OUT
323 1.800244821 172.31.31.144 -> 172.31.23.72 OpenFlow 187 Type: OFPT_PACKET_OUT
324 1.800270782 172.31.31.144 -> 172.31.23.72 OpenFlow 187 Type: OFPT_PACKET_OUT
325 1.800340201 172.31.31.144 -> 172.31.23.72 OpenFlow 187 Type: OFPT_PACKET_OUT
326 1.800384274 172.31.31.144 -> 172.31.23.72 OpenFlow 187 Type: OFPT_PACKET_OUT
327 1.800438402 172.31.31.144 -> 172.31.23.72 OpenFlow 187 Type: OFPT_PACKET_OUT
328 1.800492030 172.31.31.144 -> 172.31.23.72 OpenFlow 187 Type: OFPT_PACKET_OUT
329 1.800528710 172.31.23.72 -> 172.31.31.144 TCP 66 33632 → 6633 [ACK] Seq=493 Ack=969 Win=213 Len=0 TSval=26106537 TSecr=1267436
330 1.800553209 172.31.31.144 -> 172.31.23.72 OpenFlow 187 Type: OFPT_PACKET_OUT
331 1.800601925 172.31.31.144 -> 172.31.23.72 OpenFlow 187 Type: OFPT_PACKET_OUT
332 1.800657573 172.31.31.144 -> 172.31.23.72 OpenFlow 187 Type: OFPT_PACKET_OUT
333 1.800714709 172.31.31.144 -> 172.31.23.72 OpenFlow 187 Type: OFPT_PACKET_OUT
334 1.800788213 172.31.31.144 -> 172.31.23.72 OpenFlow 187 Type: OFPT_PACKET_OUT
335 1.800841719 172.31.31.144 -> 172.31.23.72 OpenFlow 187 Type: OFPT_PACKET_OUT
336 1.800899658 172.31.31.144 -> 172.31.23.72 OpenFlow 187 Type: OFPT_PACKET_OUT
337 1.800950942 172.31.31.144 -> 172.31.23.72 OpenFlow 187 Type: OFPT_PACKET_OUT
338 1.801007793 172.31.31.144 -> 172.31.23.72 OpenFlow 187 Type: OFPT_PACKET_OUT
339 1.801071099 172.31.31.144 -> 172.31.23.72 OpenFlow 187 Type: OFPT_PACKET_OUT
340 1.801091691 172.31.23.72 -> 172.31.31.144 TCP 66 33662 → 6633 [ACK] Seq=541 Ack=1275 Win=213 Len=0 TSval=26106537 TSecr=1267436
341 1.801121468 172.31.31.144 -> 172.31.23.72 OpenFlow 187 Type: OFPT_PACKET_OUT
342 1.801178017 172.31.31.144 -> 172.31.23.72 OpenFlow 187 Type: OFPT_PACKET_OUT
343 1.801245793 172.31.31.144 -> 172.31.23.72 OpenFlow 187 Type: OFPT_PACKET_OUT
344 1.801282071 172.31.31.144 -> 172.31.23.72 OpenFlow 187 Type: OFPT_PACKET_OUT
345 1.801335701 172.31.31.144 -> 172.31.23.72 OpenFlow 187 Type: OFPT_PACKET_OUT
346 1.801416218 172.31.31.144 -> 172.31.23.72 OpenFlow 187 Type: OFPT_PACKET_OUT
347 1.801448422 172.31.31.144 -> 172.31.23.72 OpenFlow 187 Type: OFPT_PACKET_OUT
348 1.801501095 172.31.31.144 -> 172.31.23.72 OpenFlow 187 Type: OFPT_PACKET_OUT
349 1.801536742 172.31.23.72 -> 172.31.31.144 TCP 66 33648 → 6633 [ACK] Seq=985 Ack=969 Win=213 Len=0 TSval=26106537 TSecr=1267436
350 1.801628578 172.31.31.144 -> 172.31.23.72 OpenFlow 187 Type: OFPT_PACKET_OUT
351 1.801655412 172.31.31.144 -> 172.31.23.72 OpenFlow 187 Type: OFPT_PACKET_OUT
352 1.801716435 172.31.31.144 -> 172.31.23.72 OpenFlow 187 Type: OFPT_PACKET_OUT
353 1.801765317 172.31.31.144 -> 172.31.23.72 OpenFlow 187 Type: OFPT_PACKET_OUT
354 1.801795408 172.31.23.72 -> 172.31.31.144 TCP 66 33676 → 6633 [ACK] Seq=49 Ack=791 Win=213 Len=0 TSval=26106537 TSecr=1267436
355 1.801828279 172.31.31.144 -> 172.31.23.72 OpenFlow 187 Type: OFPT_PACKET_OUT
356 1.801876521 172.31.23.72 -> 172.31.31.144 OpenFlow 189 Type: OFPT_PACKET_IN
357 1.801887078 172.31.31.144 -> 172.31.23.72 OpenFlow 187 Type: OFPT_PACKET_OUT
358 1.801901994 172.31.23.72 -> 172.31.31.144 OpenFlow 189 Type: OFPT_PACKET_IN
359 1.801924964 172.31.23.72 -> 172.31.31.144 OpenFlow 312 Type: OFPT_PACKET_IN
360 1.801953425 172.31.31.144 -> 172.31.23.72 OpenFlow 187 Type: OFPT_PACKET_OUT
361 1.801998670 172.31.31.144 -> 172.31.23.72 OpenFlow 187 Type: OFPT_PACKET_OUT
362 1.802028946 172.31.31.144 -> 172.31.23.72 OpenFlow 187 Type: OFPT_PACKET_OUT
363 1.802077061 172.31.31.144 -> 172.31.23.72 OpenFlow 187 Type: OFPT_PACKET_OUT
364 1.802120413 172.31.31.144 -> 172.31.23.72 TCP 66 6633 → 33674 [ACK] Seq=1033 Ack=172 Win=853 Len=0 TSval=1267436 TSecr=26106537
365 1.802152086 172.31.31.144 -> 172.31.23.72 TCP 66 6633 → 33674 [ACK] Seq=1033 Ack=295 Win=853 Len=0 TSval=1267436 TSecr=26106537
366 1.802155901 172.31.31.144 -> 172.31.23.72 OpenFlow 187 Type: OFPT_PACKET_OUT
367 1.802193148 172.31.31.144 -> 172.31.23.72 TCP 66 6633 → 33674 [ACK] Seq=1033 Ack=541 Win=853 Len=0 TSval=1267436 TSecr=26106537
368 1.802197007 172.31.31.144 -> 172.31.23.72 OpenFlow 187 Type: OFPT_PACKET_OUT
369 1.802241171 172.31.23.72 -> 172.31.31.144 TCP 66 33674 → 6633 [ACK] Seq=541 Ack=1033 Win=213 Len=0 TSval=26106537 TSecr=1267436
370 1.802269737 172.31.31.144 -> 172.31.23.72 OpenFlow 187 Type: OFPT_PACKET_OUT
371 1.802315320 172.31.31.144 -> 172.31.23.72 OpenFlow 187 Type: OFPT_PACKET_OUT
372 1.802326711 172.31.23.72 -> 172.31.31.144 OpenFlow 189 Type: OFPT_PACKET_IN
373 1.802362636 172.31.23.72 -> 172.31.31.144 OpenFlow 435 Type: OFPT_PACKET_IN
374 1.802370823 172.31.31.144 -> 172.31.23.72 OpenFlow 187 Type: OFPT_PACKET_OUT
375 1.802431042 172.31.31.144 -> 172.31.23.72 OpenFlow 187 Type: OFPT_PACKET_OUT
376 1.802513187 172.31.31.144 -> 172.31.23.72 OpenFlow 187 Type: OFPT_PACKET_OUT
377 1.802565867 172.31.31.144 -> 172.31.23.72 OpenFlow 187 Type: OFPT_PACKET_OUT
378 1.802590208 172.31.31.144 -> 172.31.23.72 TCP 66 6633 → 33672 [ACK] Seq=1033 Ack=418 Win=853 Len=0 TSval=1267436 TSecr=26106537
379 1.802631995 172.31.31.144 -> 172.31.23.72 OpenFlow 187 Type: OFPT_PACKET_OUT
380 1.802717670 172.31.31.144 -> 172.31.23.72 OpenFlow 187 Type: OFPT_PACKET_OUT
381 1.802730615 172.31.31.144 -> 172.31.23.72 TCP 66 6633 → 33672 [ACK] Seq=1033 Ack=787 Win=853 Len=0 TSval=1267437 TSecr=26106538
382 1.802749651 172.31.31.144 -> 172.31.23.72 OpenFlow 187 Type: OFPT_PACKET_OUT
383 1.802769426 172.31.23.72 -> 172.31.31.144 TCP 66 33672 → 6633 [ACK] Seq=787 Ack=1033 Win=213 Len=0 TSval=26106538 TSecr=1267436
384 1.802820382 172.31.31.144 -> 172.31.23.72 OpenFlow 187 Type: OFPT_PACKET_OUT
385 1.802850612 172.31.23.72 -> 172.31.31.144 OpenFlow 189 Type: OFPT_PACKET_IN
386 1.802872977 172.31.23.72 -> 172.31.31.144 OpenFlow 189 Type: OFPT_PACKET_IN
387 1.802901728 172.31.31.144 -> 172.31.23.72 OpenFlow 187 Type: OFPT_PACKET_OUT
388 1.802934697 172.31.31.144 -> 172.31.23.72 OpenFlow 187 Type: OFPT_PACKET_OUT
389 1.802973387 172.31.31.144 -> 172.31.23.72 OpenFlow 187 Type: OFPT_PACKET_OUT
390 1.803042531 172.31.31.144 -> 172.31.23.72 OpenFlow 187 Type: OFPT_PACKET_OUT
391 1.803083024 172.31.31.144 -> 172.31.23.72 OpenFlow 187 Type: OFPT_PACKET_OUT
392 1.803105113 172.31.31.144 -> 172.31.23.72 TCP 66 6633 → 33630 [ACK] Seq=727 Ack=493 Win=853 Len=0 TSval=1267437 TSecr=26106538
393 1.803152433 172.31.31.144 -> 172.31.23.72 OpenFlow 187 Type: OFPT_PACKET_OUT
394 1.803159048 172.31.23.72 -> 172.31.31.144 OpenFlow 189 Type: OFPT_PACKET_IN
395 1.803183229 172.31.31.144 -> 172.31.23.72 OpenFlow 187 Type: OFPT_PACKET_OUT
396 1.803187641 172.31.23.72 -> 172.31.31.144 OpenFlow 189 Type: OFPT_PACKET_IN
397 1.803245325 172.31.31.144 -> 172.31.23.72 OpenFlow 187 Type: OFPT_PACKET_OUT
398 1.803331273 172.31.31.144 -> 172.31.23.72 OpenFlow 187 Type: OFPT_PACKET_OUT
