  1 0.000000000 172.31.31.144 -> 172.31.23.72 TCP 82 6633 → 45446 [PSH, ACK] Seq=1 Ack=1 Win=853 Len=16 TSval=800183 TSecr=19369958
  2 0.000024080 172.31.31.144 -> 172.31.23.72 TCP 146 6633 → 45446 [PSH, ACK] Seq=17 Ack=1 Win=853 Len=80 TSval=800183 TSecr=19369958
  3 0.000430545 172.31.23.72 -> 172.31.31.144 OpenFlow 6178 Type: OFPT_MULTIPART_REPLY, OFPMP_TABLE
  4 0.000516327 172.31.23.72 -> 172.31.31.144 OpenFlow 2426 Type: OFPT_MULTIPART_REPLY, OFPMP_FLOW
  5 0.000631279 172.31.23.72 -> 172.31.31.144 OpenFlow 754 Type: OFPT_MULTIPART_REPLY, OFPMP_PORT_STATS
  6 0.000800013 172.31.31.144 -> 172.31.23.72 TCP 66 6633 → 45446 [ACK] Seq=97 Ack=6113 Win=853 Len=0 TSval=800183 TSecr=19370308
  7 0.000824644 172.31.31.144 -> 172.31.23.72 TCP 66 6633 → 45446 [ACK] Seq=97 Ack=8473 Win=853 Len=0 TSval=800183 TSecr=19370308
  8 0.000865904 172.31.31.144 -> 172.31.23.72 TCP 66 6633 → 45446 [ACK] Seq=97 Ack=9161 Win=853 Len=0 TSval=800183 TSecr=19370308
  9 0.052415887 172.31.31.144 -> 172.31.23.72 TCP 82 6633 → 45448 [PSH, ACK] Seq=1 Ack=1 Win=853 Len=16 TSval=800196 TSecr=19369957
 10 0.052453074 172.31.31.144 -> 172.31.23.72 TCP 146 6633 → 45448 [PSH, ACK] Seq=17 Ack=1 Win=853 Len=80 TSval=800196 TSecr=19369957
 11 0.052878349 172.31.23.72 -> 172.31.31.144 OpenFlow 6178 Type: OFPT_MULTIPART_REPLY, OFPMP_TABLE
 12 0.052963226 172.31.23.72 -> 172.31.31.144 OpenFlow 2218 Type: OFPT_MULTIPART_REPLY, OFPMP_FLOW
 13 0.053051541 172.31.23.72 -> 172.31.31.144 OpenFlow 530 Type: OFPT_MULTIPART_REPLY, OFPMP_PORT_STATS
 14 0.053180463 172.31.31.144 -> 172.31.23.72 TCP 66 6633 → 45448 [ACK] Seq=97 Ack=8265 Win=853 Len=0 TSval=800197 TSecr=19370321
 15 0.093202001 172.31.31.144 -> 172.31.23.72 TCP 66 6633 → 45448 [ACK] Seq=97 Ack=8729 Win=853 Len=0 TSval=800207 TSecr=19370321
 16 0.107605237 172.31.31.144 -> 172.31.23.72 TCP 122 6633 → 45450 [PSH, ACK] Seq=1 Ack=1 Win=853 Len=56 TSval=800210 TSecr=19369932
 17 0.107625833 172.31.31.144 -> 172.31.23.72 TCP 106 6633 → 45450 [PSH, ACK] Seq=57 Ack=1 Win=853 Len=40 TSval=800210 TSecr=19369932
 18 0.107807388 172.31.23.72 -> 172.31.31.144 OpenFlow 2634 Type: OFPT_MULTIPART_REPLY, OFPMP_FLOW
 19 0.107973885 172.31.23.72 -> 172.31.31.144 OpenFlow 6178 Type: OFPT_MULTIPART_REPLY, OFPMP_TABLE
 20 0.108045595 172.31.23.72 -> 172.31.31.144 OpenFlow 530 Type: OFPT_MULTIPART_REPLY, OFPMP_PORT_STATS
 21 0.108256610 172.31.31.144 -> 172.31.23.72 TCP 66 6633 → 45450 [ACK] Seq=97 Ack=8681 Win=853 Len=0 TSval=800210 TSecr=19370335
 22 0.145222048 172.31.31.144 -> 172.31.23.72 TCP 66 6633 → 45450 [ACK] Seq=97 Ack=9145 Win=853 Len=0 TSval=800220 TSecr=19370335
 23 0.167748666 172.31.31.144 -> 172.31.23.72 TCP 122 6633 → 45452 [PSH, ACK] Seq=1 Ack=1 Win=853 Len=56 TSval=800225 TSecr=19369957
 24 0.167771430 172.31.31.144 -> 172.31.23.72 TCP 106 6633 → 45452 [PSH, ACK] Seq=57 Ack=1 Win=853 Len=40 TSval=800225 TSecr=19369957
 25 0.167951790 172.31.23.72 -> 172.31.31.144 OpenFlow 2218 Type: OFPT_MULTIPART_REPLY, OFPMP_FLOW
 26 0.168123014 172.31.23.72 -> 172.31.31.144 OpenFlow 6178 Type: OFPT_MULTIPART_REPLY, OFPMP_TABLE
 27 0.168201226 172.31.31.144 -> 172.31.23.72 TCP 66 6633 → 45452 [ACK] Seq=97 Ack=2153 Win=853 Len=0 TSval=800225 TSecr=19370350
 28 0.168236771 172.31.23.72 -> 172.31.31.144 OpenFlow 642 Type: OFPT_MULTIPART_REPLY, OFPMP_PORT_STATS
 29 0.168324657 172.31.31.144 -> 172.31.23.72 TCP 66 6633 → 45452 [ACK] Seq=97 Ack=8265 Win=853 Len=0 TSval=800225 TSecr=19370350
 30 0.168411255 172.31.31.144 -> 172.31.23.72 TCP 66 6633 → 45452 [ACK] Seq=97 Ack=8841 Win=853 Len=0 TSval=800225 TSecr=19370350
 31 0.226998871 172.31.31.144 -> 172.31.23.72 TCP 90 6633 → 45454 [PSH, ACK] Seq=1 Ack=1 Win=853 Len=24 TSval=800240 TSecr=19369957
 32 0.227033316 172.31.23.72 -> 172.31.31.144 TCP 66 45454 → 6633 [ACK] Seq=1 Ack=25 Win=213 Len=0 TSval=19370365 TSecr=800240
 33 0.227040570 172.31.31.144 -> 172.31.23.72 TCP 138 6633 → 45454 [PSH, ACK] Seq=25 Ack=1 Win=853 Len=72 TSval=800240 TSecr=19369957
 34 0.227046291 172.31.23.72 -> 172.31.31.144 TCP 66 45454 → 6633 [ACK] Seq=1 Ack=97 Win=213 Len=0 TSval=19370365 TSecr=800240
 35 0.227413403 172.31.23.72 -> 172.31.31.144 OpenFlow 642 Type: OFPT_MULTIPART_REPLY, OFPMP_PORT_STATS
 36 0.227513686 172.31.23.72 -> 172.31.31.144 OpenFlow 2634 Type: OFPT_MULTIPART_REPLY, OFPMP_FLOW
 37 0.227678693 172.31.23.72 -> 172.31.31.144 OpenFlow 6178 Type: OFPT_MULTIPART_REPLY, OFPMP_TABLE
 38 0.227735967 172.31.31.144 -> 172.31.23.72 TCP 66 6633 → 45454 [ACK] Seq=97 Ack=3145 Win=853 Len=0 TSval=800240 TSecr=19370365
 39 0.265150984 172.31.31.144 -> 172.31.23.72 TCP 66 6633 → 45454 [ACK] Seq=97 Ack=9257 Win=853 Len=0 TSval=800250 TSecr=19370365
 40 0.293258346 172.31.31.144 -> 172.31.23.72 TCP 82 6633 → 45456 [PSH, ACK] Seq=1 Ack=1 Win=853 Len=16 TSval=800257 TSecr=19369958
 41 0.293292851 172.31.31.144 -> 172.31.23.72 TCP 146 6633 → 45456 [PSH, ACK] Seq=17 Ack=1 Win=853 Len=80 TSval=800257 TSecr=19369958
 42 0.293733170 172.31.23.72 -> 172.31.31.144 OpenFlow 6178 Type: OFPT_MULTIPART_REPLY, OFPMP_TABLE
 43 0.293791309 172.31.23.72 -> 172.31.31.144 OpenFlow 762 Type: OFPT_MULTIPART_REPLY, OFPMP_FLOW
 44 0.293890356 172.31.23.72 -> 172.31.31.144 OpenFlow 642 Type: OFPT_MULTIPART_REPLY, OFPMP_PORT_STATS
 45 0.294068128 172.31.31.144 -> 172.31.23.72 TCP 66 6633 → 45456 [ACK] Seq=97 Ack=6809 Win=853 Len=0 TSval=800257 TSecr=19370381
 46 0.333164663 172.31.31.144 -> 172.31.23.72 TCP 66 6633 → 45456 [ACK] Seq=97 Ack=7385 Win=853 Len=0 TSval=800267 TSecr=19370381
 47 0.342466450 172.31.31.144 -> 172.31.23.72 TCP 122 6633 → 45458 [PSH, ACK] Seq=1 Ack=1 Win=853 Len=56 TSval=800269 TSecr=19369958
 48 0.342502127 172.31.31.144 -> 172.31.23.72 TCP 106 6633 → 45458 [PSH, ACK] Seq=57 Ack=1 Win=853 Len=40 TSval=800269 TSecr=19369958
 49 0.342812156 172.31.23.72 -> 172.31.31.144 OpenFlow 2010 Type: OFPT_MULTIPART_REPLY, OFPMP_FLOW
 50 0.342924174 172.31.23.72 -> 172.31.31.144 OpenFlow 642 Type: OFPT_MULTIPART_REPLY, OFPMP_PORT_STATS
 51 0.343087063 172.31.23.72 -> 172.31.31.144 OpenFlow 6178 Type: OFPT_MULTIPART_REPLY, OFPMP_TABLE
 52 0.343167306 172.31.31.144 -> 172.31.23.72 TCP 66 6633 → 45458 [ACK] Seq=97 Ack=2521 Win=853 Len=0 TSval=800269 TSecr=19370394
 53 0.368700879 172.31.31.144 -> 172.31.23.72 TCP 122 6633 → 45460 [PSH, ACK] Seq=1 Ack=1 Win=853 Len=56 TSval=800275 TSecr=19369958
 54 0.368727490 172.31.31.144 -> 172.31.23.72 TCP 106 6633 → 45460 [PSH, ACK] Seq=57 Ack=1 Win=853 Len=40 TSval=800275 TSecr=19369958
 55 0.368995450 172.31.23.72 -> 172.31.31.144 OpenFlow 2218 Type: OFPT_MULTIPART_REPLY, OFPMP_FLOW
 56 0.369098788 172.31.23.72 -> 172.31.31.144 OpenFlow 530 Type: OFPT_MULTIPART_REPLY, OFPMP_PORT_STATS
 57 0.369260910 172.31.23.72 -> 172.31.31.144 OpenFlow 6178 Type: OFPT_MULTIPART_REPLY, OFPMP_TABLE
 58 0.369305571 172.31.31.144 -> 172.31.23.72 TCP 66 6633 → 45460 [ACK] Seq=97 Ack=2153 Win=853 Len=0 TSval=800276 TSecr=19370400
 59 0.369342216 172.31.31.144 -> 172.31.23.72 TCP 66 6633 → 45460 [ACK] Seq=97 Ack=2617 Win=853 Len=0 TSval=800276 TSecr=19370400
 60 0.369514249 172.31.31.144 -> 172.31.23.72 TCP 66 6633 → 45460 [ACK] Seq=97 Ack=8729 Win=853 Len=0 TSval=800276 TSecr=19370400
 61 0.381120212 172.31.31.144 -> 172.31.23.72 TCP 66 6633 → 45458 [ACK] Seq=97 Ack=8633 Win=853 Len=0 TSval=800279 TSecr=19370394
 62 0.740479647 172.31.23.72 -> 172.31.31.144 OpenFlow 146 Type: OFPT_PORT_STATUS
 63 0.740599933 172.31.23.72 -> 172.31.31.144 OpenFlow 146 Type: OFPT_PORT_STATUS
 64 0.740767089 172.31.31.144 -> 172.31.23.72 TCP 66 6633 → 45462 [ACK] Seq=1 Ack=81 Win=853 Len=0 TSval=800368 TSecr=19370493
 65 0.740829770 172.31.31.144 -> 172.31.23.72 TCP 66 6633 → 45432 [ACK] Seq=1 Ack=81 Win=853 Len=0 TSval=800368 TSecr=19370493
 66 0.765263738 172.31.31.144 -> 172.31.23.72 OpenFlow 146 Type: OFPT_FLOW_MOD
 67 0.765281074 172.31.31.144 -> 172.31.23.72 OpenFlow 146 Type: OFPT_FLOW_MOD
 68 0.765288671 172.31.31.144 -> 172.31.23.72 OpenFlow 146 Type: OFPT_FLOW_MOD
 69 0.765336968 172.31.31.144 -> 172.31.23.72 OpenFlow 146 Type: OFPT_FLOW_MOD
 70 0.765341040 172.31.31.144 -> 172.31.23.72 OpenFlow 146 Type: OFPT_FLOW_MOD
 71 0.765374594 172.31.31.144 -> 172.31.23.72 OpenFlow 146 Type: OFPT_FLOW_MOD
 72 0.765403727 172.31.31.144 -> 172.31.23.72 OpenFlow 146 Type: OFPT_FLOW_MOD
 73 0.765432147 172.31.31.144 -> 172.31.23.72 OpenFlow 74 Type: OFPT_BARRIER_REQUEST
 74 0.765463070 172.31.31.144 -> 172.31.23.72 OpenFlow 74 Type: OFPT_BARRIER_REQUEST
 75 0.765493673 172.31.31.144 -> 172.31.23.72 OpenFlow 146 Type: OFPT_FLOW_MOD
 76 0.765522685 172.31.31.144 -> 172.31.23.72 TCP 146 6633 → 45428 [PSH, ACK] Seq=1 Ack=1 Win=853 Len=80 TSval=800375 TSecr=19370207
 77 0.765550388 172.31.31.144 -> 172.31.23.72 OpenFlow 146 Type: OFPT_FLOW_MOD
 78 0.765577303 172.31.31.144 -> 172.31.23.72 TCP 146 6633 → 45420 [PSH, ACK] Seq=1 Ack=1 Win=853 Len=80 TSval=800375 TSecr=19370156
 79 0.765593531 172.31.23.72 -> 172.31.31.144 TCP 66 45432 → 6633 [ACK] Seq=81 Ack=161 Win=213 Len=0 TSval=19370499 TSecr=800375
 80 0.765604073 172.31.31.144 -> 172.31.23.72 TCP 154 6633 → 45428 [PSH, ACK] Seq=81 Ack=1 Win=853 Len=88 TSval=800375 TSecr=19370207
 81 0.765646626 172.31.31.144 -> 172.31.23.72 OpenFlow 74 Type: OFPT_BARRIER_REQUEST
 82 0.765660883 172.31.31.144 -> 172.31.23.72 OpenFlow 74 Type: OFPT_BARRIER_REQUEST
 83 0.765675016 172.31.23.72 -> 172.31.31.144 TCP 66 45460 → 6633 [ACK] Seq=8729 Ack=265 Win=213 Len=0 TSval=19370499 TSecr=800375
 84 0.765692607 172.31.31.144 -> 172.31.23.72 TCP 154 6633 → 45420 [PSH, ACK] Seq=81 Ack=1 Win=853 Len=88 TSval=800375 TSecr=19370156
 85 0.765696699 172.31.23.72 -> 172.31.31.144 OpenFlow 74 Type: OFPT_BARRIER_REPLY
 86 0.765720469 172.31.31.144 -> 172.31.23.72 OpenFlow 154 Type: OFPT_BARRIER_REQUEST
 87 0.765735466 172.31.23.72 -> 172.31.31.144 TCP 66 45458 → 6633 [ACK] Seq=8633 Ack=265 Win=213 Len=0 TSval=19370499 TSecr=800375
 88 0.765743560 172.31.23.72 -> 172.31.31.144 OpenFlow 74 Type: OFPT_BARRIER_REPLY
 89 0.765791194 172.31.23.72 -> 172.31.31.144 TCP 66 45448 → 6633 [ACK] Seq=8729 Ack=265 Win=213 Len=0 TSval=19370499 TSecr=800375
 90 0.765799064 172.31.23.72 -> 172.31.31.144 OpenFlow 74 Type: OFPT_BARRIER_REPLY
 91 0.765856847 172.31.31.144 -> 172.31.23.72 TCP 66 6633 → 45460 [ACK] Seq=265 Ack=8737 Win=853 Len=0 TSval=800375 TSecr=19370499
 92 0.765913501 172.31.31.144 -> 172.31.23.72 TCP 66 6633 → 45458 [ACK] Seq=265 Ack=8641 Win=853 Len=0 TSval=800375 TSecr=19370499
 93 0.765941814 172.31.31.144 -> 172.31.23.72 OpenFlow 146 Type: OFPT_FLOW_MOD
 94 0.765971377 172.31.31.144 -> 172.31.23.72 OpenFlow 146 Type: OFPT_FLOW_MOD
 95 0.765998585 172.31.31.144 -> 172.31.23.72 TCP 66 6633 → 45448 [ACK] Seq=265 Ack=8737 Win=853 Len=0 TSval=800375 TSecr=19370499
 96 0.766010926 172.31.23.72 -> 172.31.31.144 OpenFlow 146 Type: OFPT_FLOW_REMOVED
 97 0.766026091 172.31.23.72 -> 172.31.31.144 OpenFlow 146 Type: OFPT_FLOW_REMOVED
 98 0.766035749 172.31.31.144 -> 172.31.23.72 TCP 146 6633 → 45420 [PSH, ACK] Seq=169 Ack=1 Win=853 Len=80 TSval=800375 TSecr=19370156
 99 0.766040341 172.31.23.72 -> 172.31.31.144 OpenFlow 146 Type: OFPT_FLOW_REMOVED
100 0.766049147 172.31.23.72 -> 172.31.31.144 OpenFlow 146 Type: OFPT_FLOW_REMOVED
101 0.766056827 172.31.31.144 -> 172.31.23.72 OpenFlow 146 Type: OFPT_FLOW_MOD
102 0.766062762 172.31.23.72 -> 172.31.31.144 OpenFlow 146 Type: OFPT_FLOW_REMOVED
103 0.766068038 172.31.23.72 -> 172.31.31.144 OpenFlow 146 Type: OFPT_FLOW_REMOVED
104 0.766127904 172.31.31.144 -> 172.31.23.72 TCP 154 6633 → 45420 [PSH, ACK] Seq=249 Ack=1 Win=853 Len=88 TSval=800375 TSecr=19370156
105 0.766131448 172.31.31.144 -> 172.31.23.72 OpenFlow 74 Type: OFPT_BARRIER_REQUEST
106 0.766135561 172.31.23.72 -> 172.31.31.144 OpenFlow 146 Type: OFPT_FLOW_REMOVED
107 0.766141804 172.31.23.72 -> 172.31.31.144 OpenFlow 146 Type: OFPT_FLOW_REMOVED
108 0.766176629 172.31.31.144 -> 172.31.23.72 OpenFlow 146 Type: OFPT_FLOW_MOD
109 0.766178762 172.31.31.144 -> 172.31.23.72 OpenFlow 154 Type: OFPT_BARRIER_REQUEST
110 0.766225192 172.31.31.144 -> 172.31.23.72 OpenFlow 154 Type: OFPT_BARRIER_REQUEST
111 0.766228475 172.31.31.144 -> 172.31.23.72 OpenFlow 146 Type: OFPT_FLOW_MOD
112 0.766250526 172.31.31.144 -> 172.31.23.72 TCP 146 6633 → 45428 [PSH, ACK] Seq=169 Ack=1 Win=853 Len=80 TSval=800375 TSecr=19370207
113 0.766279041 172.31.31.144 -> 172.31.23.72 TCP 154 6633 → 45428 [PSH, ACK] Seq=249 Ack=1 Win=853 Len=88 TSval=800375 TSecr=19370207
114 0.766307971 172.31.31.144 -> 172.31.23.72 OpenFlow 146 Type: OFPT_FLOW_MOD
115 0.766337216 172.31.31.144 -> 172.31.23.72 OpenFlow 74 Type: OFPT_BARRIER_REQUEST
116 0.766366962 172.31.31.144 -> 172.31.23.72 OpenFlow 146 Type: OFPT_FLOW_MOD
117 0.766395815 172.31.31.144 -> 172.31.23.72 TCP 146 6633 → 45428 [PSH, ACK] Seq=337 Ack=1 Win=853 Len=80 TSval=800375 TSecr=19370207
118 0.766425148 172.31.31.144 -> 172.31.23.72 TCP 66 6633 → 45458 [ACK] Seq=265 Ack=8721 Win=853 Len=0 TSval=800375 TSecr=19370499
119 0.766452993 172.31.31.144 -> 172.31.23.72 TCP 154 6633 → 45428 [PSH, ACK] Seq=417 Ack=1 Win=853 Len=88 TSval=800375 TSecr=19370207
120 0.766481136 172.31.31.144 -> 172.31.23.72 OpenFlow 154 Type: OFPT_BARRIER_REQUEST
121 0.766510897 172.31.31.144 -> 172.31.23.72 TCP 146 6633 → 45418 [PSH, ACK] Seq=1 Ack=1 Win=853 Len=80 TSval=800375 TSecr=19370149
122 0.766539717 172.31.31.144 -> 172.31.23.72 OpenFlow 146 Type: OFPT_FLOW_MOD
123 0.766568708 172.31.31.144 -> 172.31.23.72 OpenFlow 146 Type: OFPT_FLOW_MOD
124 0.766597323 172.31.31.144 -> 172.31.23.72 TCP 66 6633 → 45458 [ACK] Seq=265 Ack=8801 Win=853 Len=0 TSval=800375 TSecr=19370499
125 0.766625350 172.31.31.144 -> 172.31.23.72 OpenFlow 146 Type: OFPT_FLOW_MOD
126 0.766654619 172.31.31.144 -> 172.31.23.72 OpenFlow 146 Type: OFPT_FLOW_MOD
127 0.766682530 172.31.31.144 -> 172.31.23.72 TCP 154 6633 → 45418 [PSH, ACK] Seq=81 Ack=1 Win=853 Len=88 TSval=800375 TSecr=19370149
128 0.766711362 172.31.31.144 -> 172.31.23.72 OpenFlow 154 Type: OFPT_FLOW_MOD
129 0.766739336 172.31.31.144 -> 172.31.23.72 OpenFlow 154 Type: OFPT_BARRIER_REQUEST
130 0.766768133 172.31.31.144 -> 172.31.23.72 OpenFlow 146 Type: OFPT_FLOW_MOD
131 0.766797681 172.31.31.144 -> 172.31.23.72 OpenFlow 154 Type: OFPT_BARRIER_REQUEST
132 0.766826841 172.31.31.144 -> 172.31.23.72 TCP 146 6633 → 45416 [PSH, ACK] Seq=1 Ack=1 Win=853 Len=80 TSval=800375 TSecr=19370141
133 0.766854890 172.31.31.144 -> 172.31.23.72 TCP 146 6633 → 45420 [PSH, ACK] Seq=337 Ack=1 Win=853 Len=80 TSval=800375 TSecr=19370156
134 0.766882181 172.31.31.144 -> 172.31.23.72 TCP 154 6633 → 45416 [PSH, ACK] Seq=81 Ack=1 Win=853 Len=88 TSval=800375 TSecr=19370141
135 0.766910628 172.31.31.144 -> 172.31.23.72 TCP 146 6633 → 45424 [PSH, ACK] Seq=1 Ack=1 Win=853 Len=80 TSval=800375 TSecr=19370176
136 0.766939231 172.31.31.144 -> 172.31.23.72 OpenFlow 146 Type: OFPT_FLOW_MOD
137 0.766968110 172.31.31.144 -> 172.31.23.72 OpenFlow 146 Type: OFPT_FLOW_MOD
138 0.766996002 172.31.31.144 -> 172.31.23.72 OpenFlow 146 Type: OFPT_FLOW_MOD
139 0.767025167 172.31.31.144 -> 172.31.23.72 TCP 154 6633 → 45420 [PSH, ACK] Seq=417 Ack=1 Win=853 Len=88 TSval=800375 TSecr=19370156
140 0.767054981 172.31.31.144 -> 172.31.23.72 OpenFlow 146 Type: OFPT_FLOW_MOD
141 0.767084231 172.31.31.144 -> 172.31.23.72 OpenFlow 154 Type: OFPT_BARRIER_REQUEST
142 0.767110988 172.31.31.144 -> 172.31.23.72 OpenFlow 74 Type: OFPT_BARRIER_REQUEST
143 0.767139627 172.31.31.144 -> 172.31.23.72 TCP 146 6633 → 45430 [PSH, ACK] Seq=1 Ack=1 Win=853 Len=80 TSval=800375 TSecr=19370220
144 0.767166321 172.31.31.144 -> 172.31.23.72 OpenFlow 74 Type: OFPT_BARRIER_REQUEST
145 0.767193521 172.31.31.144 -> 172.31.23.72 TCP 154 6633 → 45424 [PSH, ACK] Seq=81 Ack=1 Win=853 Len=88 TSval=800375 TSecr=19370176
146 0.767222888 172.31.31.144 -> 172.31.23.72 TCP 154 6633 → 45430 [PSH, ACK] Seq=81 Ack=1 Win=853 Len=88 TSval=800375 TSecr=19370220
147 0.767252224 172.31.31.144 -> 172.31.23.72 OpenFlow 146 Type: OFPT_FLOW_MOD
148 0.767283308 172.31.31.144 -> 172.31.23.72 OpenFlow 74 Type: OFPT_BARRIER_REQUEST
149 0.768654362 172.31.23.72 -> 172.31.31.144 OpenFlow 74 Type: OFPT_BARRIER_REPLY
150 0.768680587 172.31.23.72 -> 172.31.31.144 OpenFlow 74 Type: OFPT_BARRIER_REPLY
151 0.768702474 172.31.23.72 -> 172.31.31.144 OpenFlow 74 Type: OFPT_BARRIER_REPLY
152 0.768728126 172.31.23.72 -> 172.31.31.144 OpenFlow 74 Type: OFPT_BARRIER_REPLY
153 0.768755794 172.31.23.72 -> 172.31.31.144 OpenFlow 74 Type: OFPT_BARRIER_REPLY
154 0.768778131 172.31.23.72 -> 172.31.31.144 OpenFlow 74 Type: OFPT_BARRIER_REPLY
155 0.768802379 172.31.23.72 -> 172.31.31.144 OpenFlow 74 Type: OFPT_BARRIER_REPLY
156 0.768841574 172.31.23.72 -> 172.31.31.144 TCP 66 45424 → 6633 [ACK] Seq=1 Ack=169 Win=213 Len=0 TSval=19370500 TSecr=800375
157 0.768850788 172.31.23.72 -> 172.31.31.144 OpenFlow 74 Type: OFPT_BARRIER_REPLY
158 0.768873949 172.31.23.72 -> 172.31.31.144 TCP 66 45418 → 6633 [ACK] Seq=1 Ack=169 Win=213 Len=0 TSval=19370500 TSecr=800375
159 0.768882773 172.31.23.72 -> 172.31.31.144 OpenFlow 74 Type: OFPT_BARRIER_REPLY
160 0.768913659 172.31.23.72 -> 172.31.31.144 TCP 66 45430 → 6633 [ACK] Seq=1 Ack=169 Win=213 Len=0 TSval=19370500 TSecr=800375
161 0.768922359 172.31.23.72 -> 172.31.31.144 OpenFlow 74 Type: OFPT_BARRIER_REPLY
162 0.768941586 172.31.23.72 -> 172.31.31.144 OpenFlow 74 Type: OFPT_BARRIER_REPLY
163 0.768950386 172.31.31.144 -> 172.31.23.72 TCP 66 6633 → 45462 [ACK] Seq=673 Ack=113 Win=853 Len=0 TSval=800375 TSecr=19370500
164 0.768997019 172.31.23.72 -> 172.31.31.144 OpenFlow 82 Type: OFPT_BARRIER_REPLY
165 0.769003588 172.31.23.72 -> 172.31.31.144 TCP 66 45416 → 6633 [ACK] Seq=1 Ack=169 Win=213 Len=0 TSval=19370500 TSecr=800375
166 0.769007711 172.31.23.72 -> 172.31.31.144 OpenFlow 74 Type: OFPT_BARRIER_REPLY
167 0.769020964 172.31.31.144 -> 172.31.23.72 TCP 66 6633 → 45420 [ACK] Seq=505 Ack=9 Win=853 Len=0 TSval=800375 TSecr=19370500
168 0.769024894 172.31.31.144 -> 172.31.23.72 TCP 66 6633 → 45420 [ACK] Seq=505 Ack=17 Win=853 Len=0 TSval=800375 TSecr=19370500
169 0.769026757 172.31.31.144 -> 172.31.23.72 TCP 66 6633 → 45420 [ACK] Seq=505 Ack=25 Win=853 Len=0 TSval=800375 TSecr=19370500
170 0.769038350 172.31.23.72 -> 172.31.31.144 OpenFlow 74 Type: OFPT_BARRIER_REPLY
171 0.769090884 172.31.31.144 -> 172.31.23.72 TCP 66 6633 → 45424 [ACK] Seq=169 Ack=9 Win=853 Len=0 TSval=800375 TSecr=19370500
172 0.769097367 172.31.23.72 -> 172.31.31.144 OpenFlow 90 Type: OFPT_BARRIER_REPLY
173 0.769113728 172.31.23.72 -> 172.31.31.144 OpenFlow 74 Type: OFPT_BARRIER_REPLY
174 0.769137088 172.31.23.72 -> 172.31.31.144 OpenFlow 74 Type: OFPT_BARRIER_REPLY
175 0.769159085 172.31.23.72 -> 172.31.31.144 OpenFlow 74 Type: OFPT_BARRIER_REPLY
176 0.769192604 172.31.23.72 -> 172.31.31.144 OpenFlow 74 Type: OFPT_BARRIER_REPLY
177 0.769206332 172.31.31.144 -> 172.31.23.72 TCP 66 6633 → 45428 [ACK] Seq=505 Ack=25 Win=853 Len=0 TSval=800376 TSecr=19370500
178 0.769221919 172.31.23.72 -> 172.31.31.144 OpenFlow 74 Type: OFPT_BARRIER_REPLY
179 0.769238725 172.31.31.144 -> 172.31.23.72 TCP 66 6633 → 45416 [ACK] Seq=169 Ack=9 Win=853 Len=0 TSval=800376 TSecr=19370500
180 0.769246453 172.31.23.72 -> 172.31.31.144 OpenFlow 74 Type: OFPT_BARRIER_REPLY
181 0.769284714 172.31.31.144 -> 172.31.23.72 TCP 66 6633 → 45432 [ACK] Seq=673 Ack=273 Win=853 Len=0 TSval=800376 TSecr=19370500
182 0.769370743 172.31.31.144 -> 172.31.23.72 TCP 66 6633 → 45460 [ACK] Seq=769 Ack=8921 Win=853 Len=0 TSval=800376 TSecr=19370500
183 0.769397540 172.31.31.144 -> 172.31.23.72 TCP 66 6633 → 45448 [ACK] Seq=769 Ack=8921 Win=853 Len=0 TSval=800376 TSecr=19370500
184 0.769435814 172.31.23.72 -> 172.31.31.144 OpenFlow 146 Type: OFPT_FLOW_REMOVED
185 0.769457453 172.31.23.72 -> 172.31.31.144 OpenFlow 466 Type: OFPT_FLOW_REMOVED
186 0.769469823 172.31.23.72 -> 172.31.31.144 OpenFlow 146 Type: OFPT_FLOW_REMOVED
187 0.769484035 172.31.23.72 -> 172.31.31.144 OpenFlow 146 Type: OFPT_FLOW_REMOVED
188 0.769488526 172.31.23.72 -> 172.31.31.144 OpenFlow 226 Type: OFPT_FLOW_REMOVED
189 0.769497574 172.31.23.72 -> 172.31.31.144 OpenFlow 146 Type: OFPT_FLOW_REMOVED
190 0.769504442 172.31.23.72 -> 172.31.31.144 OpenFlow 146 Type: OFPT_FLOW_REMOVED
191 0.769506354 172.31.23.72 -> 172.31.31.144 OpenFlow 466 Type: OFPT_FLOW_REMOVED
192 0.769513804 172.31.23.72 -> 172.31.31.144 OpenFlow 146 Type: OFPT_FLOW_REMOVED
193 0.769528197 172.31.23.72 -> 172.31.31.144 OpenFlow 146 Type: OFPT_FLOW_REMOVED
194 0.769538576 172.31.23.72 -> 172.31.31.144 OpenFlow 146 Type: OFPT_FLOW_REMOVED
195 0.769540811 172.31.23.72 -> 172.31.31.144 OpenFlow 146 Type: OFPT_FLOW_REMOVED
196 0.769556586 172.31.23.72 -> 172.31.31.144 OpenFlow 146 Type: OFPT_FLOW_REMOVED
197 0.769571708 172.31.23.72 -> 172.31.31.144 OpenFlow 146 Type: OFPT_FLOW_REMOVED
198 0.769664880 172.31.31.144 -> 172.31.23.72 TCP 66 6633 → 45462 [ACK] Seq=673 Ack=593 Win=853 Len=0 TSval=800376 TSecr=19370500
199 0.769670295 172.31.31.144 -> 172.31.23.72 OpenFlow 170 Type: OFPT_FLOW_MOD
200 0.769675130 172.31.23.72 -> 172.31.31.144 OpenFlow 146 Type: OFPT_FLOW_REMOVED
201 0.769681507 172.31.23.72 -> 172.31.31.144 OpenFlow 146 Type: OFPT_FLOW_REMOVED
202 0.769683294 172.31.23.72 -> 172.31.31.144 OpenFlow 466 Type: OFPT_FLOW_REMOVED
203 0.769685346 172.31.23.72 -> 172.31.31.144 OpenFlow 146 Type: OFPT_FLOW_REMOVED
204 0.769779930 172.31.31.144 -> 172.31.23.72 TCP 66 6633 → 45420 [ACK] Seq=505 Ack=105 Win=853 Len=0 TSval=800376 TSecr=19370500
205 0.769783257 172.31.31.144 -> 172.31.23.72 OpenFlow 170 Type: OFPT_FLOW_MOD
206 0.769785275 172.31.31.144 -> 172.31.23.72 OpenFlow 74 Type: OFPT_BARRIER_REQUEST
207 0.769786753 172.31.31.144 -> 172.31.23.72 TCP 66 6633 → 45424 [ACK] Seq=169 Ack=89 Win=853 Len=0 TSval=800376 TSecr=19370500
208 0.769788802 172.31.31.144 -> 172.31.23.72 OpenFlow 170 Type: OFPT_FLOW_MOD
209 0.769794200 172.31.23.72 -> 172.31.31.144 OpenFlow 466 Type: OFPT_FLOW_REMOVED
210 0.769799823 172.31.23.72 -> 172.31.31.144 OpenFlow 466 Type: OFPT_FLOW_REMOVED
211 0.769801454 172.31.23.72 -> 172.31.31.144 OpenFlow 466 Type: OFPT_FLOW_REMOVED
212 0.769869101 172.31.31.144 -> 172.31.23.72 TCP 66 6633 → 45418 [ACK] Seq=169 Ack=89 Win=853 Len=0 TSval=800376 TSecr=19370500
213 0.769872494 172.31.31.144 -> 172.31.23.72 OpenFlow 170 Type: OFPT_FLOW_MOD
214 0.769876570 172.31.31.144 -> 172.31.23.72 OpenFlow 170 Type: OFPT_FLOW_MOD
215 0.769940395 172.31.31.144 -> 172.31.23.72 OpenFlow 170 Type: OFPT_FLOW_MOD
216 0.769943024 172.31.31.144 -> 172.31.23.72 OpenFlow 178 Type: OFPT_BARRIER_REQUEST
217 0.769944662 172.31.31.144 -> 172.31.23.72 OpenFlow 170 Type: OFPT_FLOW_MOD
218 0.769956413 172.31.31.144 -> 172.31.23.72 OpenFlow 178 Type: OFPT_BARRIER_REQUEST
219 0.769981729 172.31.31.144 -> 172.31.23.72 OpenFlow 170 Type: OFPT_FLOW_MOD
220 0.770010394 172.31.31.144 -> 172.31.23.72 OpenFlow 178 Type: OFPT_BARRIER_REQUEST
221 0.770036368 172.31.31.144 -> 172.31.23.72 TCP 66 6633 → 45416 [ACK] Seq=169 Ack=89 Win=853 Len=0 TSval=800376 TSecr=19370500
222 0.770064287 172.31.31.144 -> 172.31.23.72 OpenFlow 178 Type: OFPT_BARRIER_REQUEST
223 0.770090683 172.31.31.144 -> 172.31.23.72 OpenFlow 394 Type: OFPT_BARRIER_REQUEST
224 0.770117480 172.31.31.144 -> 172.31.23.72 TCP 66 6633 → 45424 [ACK] Seq=169 Ack=169 Win=853 Len=0 TSval=800376 TSecr=19370500
225 0.770144493 172.31.31.144 -> 172.31.23.72 OpenFlow 170 Type: OFPT_FLOW_MOD
226 0.770170571 172.31.31.144 -> 172.31.23.72 OpenFlow 170 Type: OFPT_FLOW_MOD
227 0.770197335 172.31.31.144 -> 172.31.23.72 OpenFlow 170 Type: OFPT_FLOW_MOD
228 0.770225051 172.31.31.144 -> 172.31.23.72 OpenFlow 170 Type: OFPT_FLOW_MOD
229 0.770249831 172.31.31.144 -> 172.31.23.72 OpenFlow 74 Type: OFPT_BARRIER_REQUEST
230 0.770276030 172.31.31.144 -> 172.31.23.72 OpenFlow 170 Type: OFPT_FLOW_MOD
231 0.770302268 172.31.31.144 -> 172.31.23.72 OpenFlow 170 Type: OFPT_FLOW_MOD
232 0.770329098 172.31.31.144 -> 172.31.23.72 OpenFlow 170 Type: OFPT_FLOW_MOD
233 0.770356371 172.31.31.144 -> 172.31.23.72 OpenFlow 170 Type: OFPT_FLOW_MOD
234 0.770385220 172.31.31.144 -> 172.31.23.72 OpenFlow 170 Type: OFPT_FLOW_MOD
235 0.770412027 172.31.31.144 -> 172.31.23.72 OpenFlow 290 Type: OFPT_BARRIER_REQUEST
236 0.770439393 172.31.31.144 -> 172.31.23.72 OpenFlow 74 Type: OFPT_BARRIER_REQUEST
237 0.770468229 172.31.31.144 -> 172.31.23.72 OpenFlow 178 Type: OFPT_BARRIER_REQUEST
238 0.770495078 172.31.31.144 -> 172.31.23.72 OpenFlow 74 Type: OFPT_BARRIER_REQUEST
239 0.770522687 172.31.31.144 -> 172.31.23.72 OpenFlow 282 Type: OFPT_BARRIER_REQUEST
240 0.770550727 172.31.31.144 -> 172.31.23.72 OpenFlow 170 Type: OFPT_FLOW_MOD
241 0.770579111 172.31.31.144 -> 172.31.23.72 TCP 170 6633 → 45426 [PSH, ACK] Seq=1 Ack=1 Win=853 Len=104 TSval=800376 TSecr=19370195
242 0.770605920 172.31.31.144 -> 172.31.23.72 OpenFlow 178 Type: OFPT_BARRIER_REQUEST
243 0.770632997 172.31.31.144 -> 172.31.23.72 OpenFlow 170 Type: OFPT_FLOW_MOD
244 0.770660136 172.31.31.144 -> 172.31.23.72 TCP 170 6633 → 45426 [PSH, ACK] Seq=105 Ack=1 Win=853 Len=104 TSval=800376 TSecr=19370195
245 0.770687241 172.31.31.144 -> 172.31.23.72 OpenFlow 170 Type: OFPT_FLOW_MOD
246 0.770714572 172.31.31.144 -> 172.31.23.72 OpenFlow 170 Type: OFPT_FLOW_MOD
247 0.770741027 172.31.31.144 -> 172.31.23.72 TCP 74 6633 → 45426 [PSH, ACK] Seq=209 Ack=1 Win=853 Len=8 TSval=800376 TSecr=19370195
248 0.770769613 172.31.31.144 -> 172.31.23.72 OpenFlow 274 Type: OFPT_FLOW_MOD
249 0.770797433 172.31.31.144 -> 172.31.23.72 OpenFlow 170 Type: OFPT_FLOW_MOD
250 0.770824617 172.31.31.144 -> 172.31.23.72 OpenFlow 178 Type: OFPT_BARRIER_REQUEST
251 0.770852858 172.31.31.144 -> 172.31.23.72 OpenFlow 170 Type: OFPT_FLOW_MOD
252 0.770880625 172.31.31.144 -> 172.31.23.72 OpenFlow 178 Type: OFPT_BARRIER_REQUEST
253 0.770907597 172.31.31.144 -> 172.31.23.72 OpenFlow 170 Type: OFPT_FLOW_MOD
254 0.770934836 172.31.31.144 -> 172.31.23.72 OpenFlow 170 Type: OFPT_FLOW_MOD
255 0.770962385 172.31.31.144 -> 172.31.23.72 OpenFlow 170 Type: OFPT_FLOW_MOD
256 0.770989367 172.31.31.144 -> 172.31.23.72 OpenFlow 170 Type: OFPT_FLOW_MOD
257 0.771016339 172.31.31.144 -> 172.31.23.72 OpenFlow 170 Type: OFPT_FLOW_MOD
258 0.771043321 172.31.31.144 -> 172.31.23.72 TCP 170 6633 → 45438 [PSH, ACK] Seq=1 Ack=1 Win=853 Len=104 TSval=800376 TSecr=19370259
259 0.771069733 172.31.31.144 -> 172.31.23.72 OpenFlow 74 Type: OFPT_BARRIER_REQUEST
260 0.771096634 172.31.31.144 -> 172.31.23.72 OpenFlow 170 Type: OFPT_FLOW_MOD
261 0.771122906 172.31.31.144 -> 172.31.23.72 OpenFlow 178 Type: OFPT_BARRIER_REQUEST
262 0.771149617 172.31.31.144 -> 172.31.23.72 OpenFlow 178 Type: OFPT_FLOW_MOD
263 0.771176280 172.31.31.144 -> 172.31.23.72 OpenFlow 170 Type: OFPT_FLOW_MOD
264 0.771204494 172.31.31.144 -> 172.31.23.72 TCP 826 6633 → 45438 [PSH, ACK] Seq=105 Ack=1 Win=853 Len=760 TSval=800376 TSecr=19370259
265 0.771230715 172.31.31.144 -> 172.31.23.72 OpenFlow 170 Type: OFPT_FLOW_MOD
266 0.771258160 172.31.31.144 -> 172.31.23.72 OpenFlow 170 Type: OFPT_FLOW_MOD
267 0.771284909 172.31.31.144 -> 172.31.23.72 OpenFlow 282 Type: OFPT_BARRIER_REQUEST
268 0.771311407 172.31.31.144 -> 172.31.23.72 OpenFlow 170 Type: OFPT_FLOW_MOD
269 0.771349482 172.31.31.144 -> 172.31.23.72 OpenFlow 170 Type: OFPT_FLOW_MOD
270 0.771375477 172.31.31.144 -> 172.31.23.72 OpenFlow 282 Type: OFPT_FLOW_MOD
271 0.771403043 172.31.31.144 -> 172.31.23.72 OpenFlow 170 Type: OFPT_FLOW_MOD
272 0.771429704 172.31.31.144 -> 172.31.23.72 OpenFlow 170 Type: OFPT_FLOW_MOD
273 0.771457173 172.31.31.144 -> 172.31.23.72 TCP 170 6633 → 45436 [PSH, ACK] Seq=1 Ack=1 Win=853 Len=104 TSval=800376 TSecr=19370250
274 0.771482422 172.31.31.144 -> 172.31.23.72 OpenFlow 170 Type: OFPT_FLOW_MOD
275 0.771509017 172.31.31.144 -> 172.31.23.72 OpenFlow 170 Type: OFPT_FLOW_MOD
276 0.771535715 172.31.31.144 -> 172.31.23.72 OpenFlow 170 Type: OFPT_FLOW_MOD
277 0.771562724 172.31.31.144 -> 172.31.23.72 TCP 394 6633 → 45436 [PSH, ACK] Seq=105 Ack=1 Win=853 Len=328 TSval=800376 TSecr=19370250
278 0.771590524 172.31.31.144 -> 172.31.23.72 OpenFlow 170 Type: OFPT_FLOW_MOD
279 0.771618038 172.31.31.144 -> 172.31.23.72 OpenFlow 170 Type: OFPT_FLOW_MOD
280 0.771703788 172.31.23.72 -> 172.31.31.144 OpenFlow 74 Type: OFPT_BARRIER_REPLY
281 0.771732561 172.31.23.72 -> 172.31.31.144 OpenFlow 74 Type: OFPT_BARRIER_REPLY
282 0.771766219 172.31.23.72 -> 172.31.31.144 OpenFlow 74 Type: OFPT_BARRIER_REPLY
283 0.771792783 172.31.23.72 -> 172.31.31.144 OpenFlow 74 Type: OFPT_BARRIER_REPLY
284 0.771839693 172.31.23.72 -> 172.31.31.144 OpenFlow 74 Type: OFPT_BARRIER_REPLY
285 0.771878839 172.31.23.72 -> 172.31.31.144 OpenFlow 74 Type: OFPT_BARRIER_REPLY
286 0.771886942 172.31.31.144 -> 172.31.23.72 TCP 66 6633 → 45436 [ACK] Seq=433 Ack=9 Win=853 Len=0 TSval=800376 TSecr=19370501
287 0.771901092 172.31.31.144 -> 172.31.23.72 TCP 66 6633 → 45436 [ACK] Seq=433 Ack=17 Win=853 Len=0 TSval=800376 TSecr=19370501
288 0.771938390 172.31.23.72 -> 172.31.31.144 OpenFlow 74 Type: OFPT_BARRIER_REPLY
289 0.771965417 172.31.23.72 -> 172.31.31.144 OpenFlow 74 Type: OFPT_BARRIER_REPLY
290 0.771984288 172.31.31.144 -> 172.31.23.72 OpenFlow 82 Type: OFPT_MULTIPART_REQUEST, OFPMP_TABLE
291 0.771992939 172.31.23.72 -> 172.31.31.144 OpenFlow 74 Type: OFPT_BARRIER_REPLY
292 0.772012992 172.31.31.144 -> 172.31.23.72 OpenFlow 90 Type: OFPT_MULTIPART_REQUEST, OFPMP_PORT_STATS
293 0.772019416 172.31.23.72 -> 172.31.31.144 OpenFlow 74 Type: OFPT_BARRIER_REPLY
294 0.772038250 172.31.31.144 -> 172.31.23.72 OpenFlow 122 Type: OFPT_MULTIPART_REQUEST, OFPMP_FLOW
295 0.772061133 172.31.31.144 -> 172.31.23.72 TCP 66 6633 → 45420 [ACK] Seq=1353 Ack=521 Win=853 Len=0 TSval=800376 TSecr=19370501
296 0.772075033 172.31.23.72 -> 172.31.31.144 OpenFlow 74 Type: OFPT_BARRIER_REPLY
297 0.772095477 172.31.31.144 -> 172.31.23.72 TCP 66 6633 → 45438 [ACK] Seq=865 Ack=9 Win=853 Len=0 TSval=800376 TSecr=19370501
298 0.772105152 172.31.23.72 -> 172.31.31.144 OpenFlow 74 Type: OFPT_BARRIER_REPLY
299 0.772122325 172.31.31.144 -> 172.31.23.72 TCP 66 6633 → 45438 [ACK] Seq=865 Ack=17 Win=853 Len=0 TSval=800376 TSecr=19370501
300 0.772149971 172.31.23.72 -> 172.31.31.144 OpenFlow 74 Type: OFPT_BARRIER_REPLY
301 0.772158688 172.31.31.144 -> 172.31.23.72 TCP 66 6633 → 45438 [ACK] Seq=865 Ack=25 Win=853 Len=0 TSval=800376 TSecr=19370501
302 0.772181208 172.31.23.72 -> 172.31.31.144 OpenFlow 74 Type: OFPT_BARRIER_REPLY
303 0.772207335 172.31.31.144 -> 172.31.23.72 TCP 66 6633 → 45438 [ACK] Seq=865 Ack=33 Win=853 Len=0 TSval=800376 TSecr=19370501
304 0.772237099 172.31.23.72 -> 172.31.31.144 OpenFlow 74 Type: OFPT_BARRIER_REPLY
305 0.772277834 172.31.23.72 -> 172.31.31.144 OpenFlow 74 Type: OFPT_BARRIER_REPLY
306 0.772295903 172.31.31.144 -> 172.31.23.72 TCP 66 6633 → 45430 [ACK] Seq=705 Ack=185 Win=853 Len=0 TSval=800376 TSecr=19370501
307 0.772314786 172.31.23.72 -> 172.31.31.144 OpenFlow 74 Type: OFPT_BARRIER_REPLY
308 0.772336362 172.31.23.72 -> 172.31.31.144 OpenFlow 74 Type: OFPT_BARRIER_REPLY
309 0.772367586 172.31.31.144 -> 172.31.23.72 TCP 66 6633 → 45428 [ACK] Seq=1353 Ack=521 Win=853 Len=0 TSval=800376 TSecr=19370501
310 0.772376635 172.31.23.72 -> 172.31.31.144 OpenFlow 74 Type: OFPT_BARRIER_REPLY
311 0.772403247 172.31.23.72 -> 172.31.31.144 OpenFlow 74 Type: OFPT_BARRIER_REPLY
312 0.772433158 172.31.23.72 -> 172.31.31.144 OpenFlow 74 Type: OFPT_BARRIER_REPLY
313 0.772485118 172.31.23.72 -> 172.31.31.144 OpenFlow 74 Type: OFPT_BARRIER_REPLY
314 0.772494783 172.31.31.144 -> 172.31.23.72 TCP 66 6633 → 45446 [ACK] Seq=961 Ack=9169 Win=853 Len=0 TSval=800376 TSecr=19370501
315 0.772519590 172.31.23.72 -> 172.31.31.144 OpenFlow 74 Type: OFPT_BARRIER_REPLY
316 0.772537634 172.31.31.144 -> 172.31.23.72 TCP 66 6633 → 45446 [ACK] Seq=961 Ack=9177 Win=853 Len=0 TSval=800376 TSecr=19370501
317 0.772548562 172.31.23.72 -> 172.31.31.144 OpenFlow 74 Type: OFPT_BARRIER_REPLY
318 0.772574105 172.31.31.144 -> 172.31.23.72 TCP 66 6633 → 45446 [ACK] Seq=961 Ack=9185 Win=853 Len=0 TSval=800376 TSecr=19370501
319 0.772577122 172.31.31.144 -> 172.31.23.72 TCP 66 6633 → 45446 [ACK] Seq=961 Ack=9193 Win=853 Len=0 TSval=800376 TSecr=19370501
320 0.772597042 172.31.31.144 -> 172.31.23.72 TCP 66 6633 → 45432 [ACK] Seq=1209 Ack=769 Win=853 Len=0 TSval=800376 TSecr=19370501
321 0.772620534 172.31.23.72 -> 172.31.31.144 OpenFlow 74 Type: OFPT_BARRIER_REPLY
322 0.772642949 172.31.23.72 -> 172.31.31.144 OpenFlow 74 Type: OFPT_BARRIER_REPLY
323 0.772666073 172.31.23.72 -> 172.31.31.144 OpenFlow 74 Type: OFPT_BARRIER_REPLY
324 0.772710151 172.31.31.144 -> 172.31.23.72 TCP 66 6633 → 45460 [ACK] Seq=1833 Ack=9425 Win=853 Len=0 TSval=800376 TSecr=19370501
325 0.772717006 172.31.23.72 -> 172.31.31.144 OpenFlow 74 Type: OFPT_BARRIER_REPLY
326 0.772831312 172.31.31.144 -> 172.31.23.72 TCP 66 6633 → 45458 [ACK] Seq=913 Ack=8825 Win=853 Len=0 TSval=800376 TSecr=19370501
327 0.773351718 172.31.23.72 -> 172.31.31.144 TCP 66 45426 → 6633 [ACK] Seq=1 Ack=217 Win=213 Len=0 TSval=19370501 TSecr=800376
328 0.773366471 172.31.23.72 -> 172.31.31.144 OpenFlow 74 Type: OFPT_BARRIER_REPLY
329 0.775134305 172.31.23.72 -> 172.31.31.144 OpenFlow 6178 Type: OFPT_MULTIPART_REPLY, OFPMP_TABLE
330 0.775221517 172.31.23.72 -> 172.31.31.144 OpenFlow 530 Type: OFPT_MULTIPART_REPLY, OFPMP_PORT_STATS
331 0.775263963 172.31.23.72 -> 172.31.31.144 OpenFlow 554 Type: OFPT_MULTIPART_REPLY, OFPMP_FLOW
332 0.775472852 172.31.31.144 -> 172.31.23.72 TCP 66 6633 → 45462 [ACK] Seq=769 Ack=7817 Win=853 Len=0 TSval=800377 TSecr=19370502
333 0.809153065 172.31.31.144 -> 172.31.23.72 TCP 66 6633 → 45424 [ACK] Seq=593 Ack=177 Win=853 Len=0 TSval=800386 TSecr=19370501
334 0.809174515 172.31.31.144 -> 172.31.23.72 TCP 66 6633 → 45418 [ACK] Seq=489 Ack=177 Win=853 Len=0 TSval=800386 TSecr=19370501
335 0.809181546 172.31.31.144 -> 172.31.23.72 TCP 66 6633 → 45416 [ACK] Seq=593 Ack=177 Win=853 Len=0 TSval=800386 TSecr=19370501
336 0.809196131 172.31.31.144 -> 172.31.23.72 TCP 66 6633 → 45448 [ACK] Seq=1089 Ack=9409 Win=853 Len=0 TSval=800386 TSecr=19370501
337 0.813156890 172.31.31.144 -> 172.31.23.72 TCP 66 6633 → 45426 [ACK] Seq=217 Ack=9 Win=853 Len=0 TSval=800387 TSecr=19370501
338 1.492916542 172.31.31.144 -> 172.31.23.72 OpenFlow 187 Type: OFPT_PACKET_OUT
339 1.492964883 172.31.31.144 -> 172.31.23.72 OpenFlow 187 Type: OFPT_PACKET_OUT
340 1.492989671 172.31.31.144 -> 172.31.23.72 OpenFlow 187 Type: OFPT_PACKET_OUT
341 1.493052365 172.31.31.144 -> 172.31.23.72 OpenFlow 187 Type: OFPT_PACKET_OUT
342 1.493176951 172.31.31.144 -> 172.31.23.72 OpenFlow 187 Type: OFPT_PACKET_OUT
343 1.493236717 172.31.31.144 -> 172.31.23.72 OpenFlow 187 Type: OFPT_PACKET_OUT
344 1.493318813 172.31.31.144 -> 172.31.23.72 OpenFlow 187 Type: OFPT_PACKET_OUT
345 1.493360346 172.31.31.144 -> 172.31.23.72 OpenFlow 187 Type: OFPT_PACKET_OUT
346 1.493470663 172.31.31.144 -> 172.31.23.72 OpenFlow 187 Type: OFPT_PACKET_OUT
347 1.493504983 172.31.23.72 -> 172.31.31.144 TCP 66 45452 → 6633 [ACK] Seq=8841 Ack=1065 Win=213 Len=0 TSval=19370681 TSecr=800556
348 1.493512981 172.31.31.144 -> 172.31.23.72 OpenFlow 187 Type: OFPT_PACKET_OUT
349 1.493572702 172.31.31.144 -> 172.31.23.72 OpenFlow 187 Type: OFPT_PACKET_OUT
350 1.493618004 172.31.31.144 -> 172.31.23.72 OpenFlow 187 Type: OFPT_PACKET_OUT
351 1.493699421 172.31.31.144 -> 172.31.23.72 OpenFlow 187 Type: OFPT_PACKET_OUT
352 1.493745037 172.31.23.72 -> 172.31.31.144 TCP 66 45462 → 6633 [ACK] Seq=7817 Ack=1253 Win=213 Len=0 TSval=19370681 TSecr=800557
353 1.493755830 172.31.31.144 -> 172.31.23.72 OpenFlow 187 Type: OFPT_PACKET_OUT
354 1.493808093 172.31.31.144 -> 172.31.23.72 OpenFlow 187 Type: OFPT_PACKET_OUT
355 1.493894576 172.31.31.144 -> 172.31.23.72 OpenFlow 187 Type: OFPT_PACKET_OUT
356 1.493944391 172.31.31.144 -> 172.31.23.72 OpenFlow 187 Type: OFPT_PACKET_OUT
357 1.493990819 172.31.31.144 -> 172.31.23.72 OpenFlow 187 Type: OFPT_PACKET_OUT
358 1.494046748 172.31.31.144 -> 172.31.23.72 OpenFlow 187 Type: OFPT_PACKET_OUT
359 1.494105776 172.31.31.144 -> 172.31.23.72 OpenFlow 187 Type: OFPT_PACKET_OUT
360 1.494193314 172.31.23.72 -> 172.31.31.144 TCP 66 45436 → 6633 [ACK] Seq=17 Ack=1401 Win=213 Len=0 TSval=19370681 TSecr=800557
361 1.494297670 172.31.23.72 -> 172.31.31.144 OpenFlow 189 Type: OFPT_PACKET_IN
362 1.494323350 172.31.23.72 -> 172.31.31.144 OpenFlow 189 Type: OFPT_PACKET_IN
363 1.494351322 172.31.23.72 -> 172.31.31.144 OpenFlow 189 Type: OFPT_PACKET_IN
364 1.494365464 172.31.23.72 -> 172.31.31.144 OpenFlow 189 Type: OFPT_PACKET_IN
365 1.494378142 172.31.23.72 -> 172.31.31.144 OpenFlow 189 Type: OFPT_PACKET_IN
366 1.494396699 172.31.23.72 -> 172.31.31.144 OpenFlow 189 Type: OFPT_PACKET_IN
367 1.494415847 172.31.23.72 -> 172.31.31.144 OpenFlow 189 Type: OFPT_PACKET_IN
368 1.494418039 172.31.23.72 -> 172.31.31.144 OpenFlow 435 Type: OFPT_PACKET_IN
369 1.494452386 172.31.23.72 -> 172.31.31.144 OpenFlow 189 Type: OFPT_PACKET_IN
370 1.494456751 172.31.23.72 -> 172.31.31.144 OpenFlow 189 Type: OFPT_PACKET_IN
371 1.494494104 172.31.31.144 -> 172.31.23.72 TCP 66 6633 → 45434 [ACK] Seq=1 Ack=124 Win=853 Len=0 TSval=800557 TSecr=19370682
372 1.494501006 172.31.31.144 -> 172.31.23.72 TCP 66 6633 → 45434 [ACK] Seq=1 Ack=247 Win=853 Len=0 TSval=800557 TSecr=19370682
373 1.494506187 172.31.23.72 -> 172.31.31.144 OpenFlow 189 Type: OFPT_PACKET_IN
374 1.494528035 172.31.23.72 -> 172.31.31.144 OpenFlow 189 Type: OFPT_PACKET_IN
375 1.494539809 172.31.31.144 -> 172.31.23.72 TCP 66 6633 → 45444 [ACK] Seq=1 Ack=124 Win=853 Len=0 TSval=800557 TSecr=19370682
376 1.494544025 172.31.31.144 -> 172.31.23.72 TCP 66 6633 → 45444 [ACK] Seq=1 Ack=247 Win=853 Len=0 TSval=800557 TSecr=19370682
377 1.494556028 172.31.23.72 -> 172.31.31.144 OpenFlow 189 Type: OFPT_PACKET_IN
378 1.494571308 172.31.23.72 -> 172.31.31.144 OpenFlow 189 Type: OFPT_PACKET_IN
379 1.494573737 172.31.23.72 -> 172.31.31.144 OpenFlow 189 Type: OFPT_PACKET_IN
380 1.494596308 172.31.31.144 -> 172.31.23.72 TCP 66 6633 → 45438 [ACK] Seq=865 Ack=156 Win=853 Len=0 TSval=800557 TSecr=19370682
381 1.494622038 172.31.23.72 -> 172.31.31.144 OpenFlow 189 Type: OFPT_PACKET_IN
382 1.494666571 172.31.31.144 -> 172.31.23.72 TCP 66 6633 → 45450 [ACK] Seq=97 Ack=9268 Win=853 Len=0 TSval=800557 TSecr=19370682
383 1.494671126 172.31.31.144 -> 172.31.23.72 TCP 66 6633 → 45438 [ACK] Seq=865 Ack=525 Win=853 Len=0 TSval=800557 TSecr=19370682
384 1.494673077 172.31.31.144 -> 172.31.23.72 TCP 66 6633 → 45450 [ACK] Seq=97 Ack=9391 Win=853 Len=0 TSval=800557 TSecr=19370682
385 1.494686106 172.31.31.144 -> 172.31.23.72 TCP 66 6633 → 45430 [ACK] Seq=705 Ack=431 Win=853 Len=0 TSval=800557 TSecr=19370682
386 1.494724668 172.31.31.144 -> 172.31.23.72 TCP 66 6633 → 45454 [ACK] Seq=97 Ack=9380 Win=853 Len=0 TSval=800557 TSecr=19370682
387 1.494751644 172.31.31.144 -> 172.31.23.72 TCP 66 6633 → 45448 [ACK] Seq=1089 Ack=9532 Win=853 Len=0 TSval=800557 TSecr=19370682
388 1.494781772 172.31.31.144 -> 172.31.23.72 TCP 66 6633 → 45442 [ACK] Seq=1 Ack=124 Win=853 Len=0 TSval=800557 TSecr=19370682
389 1.494811852 172.31.31.144 -> 172.31.23.72 TCP 66 6633 → 45454 [ACK] Seq=97 Ack=9503 Win=853 Len=0 TSval=800557 TSecr=19370682
390 1.494842360 172.31.31.144 -> 172.31.23.72 TCP 66 6633 → 45448 [ACK] Seq=1089 Ack=9655 Win=853 Len=0 TSval=800557 TSecr=19370682
391 1.494872649 172.31.31.144 -> 172.31.23.72 TCP 66 6633 → 45442 [ACK] Seq=1 Ack=247 Win=853 Len=0 TSval=800557 TSecr=19370682
392 1.592518041 172.31.31.144 -> 172.31.23.72 OpenFlow 187 Type: OFPT_PACKET_OUT
393 1.592554993 172.31.31.144 -> 172.31.23.72 OpenFlow 187 Type: OFPT_PACKET_OUT
394 1.592584439 172.31.31.144 -> 172.31.23.72 OpenFlow 187 Type: OFPT_PACKET_OUT
395 1.592645831 172.31.31.144 -> 172.31.23.72 OpenFlow 187 Type: OFPT_PACKET_OUT
396 1.592735927 172.31.31.144 -> 172.31.23.72 OpenFlow 187 Type: OFPT_PACKET_OUT
397 1.592807174 172.31.31.144 -> 172.31.23.72 OpenFlow 187 Type: OFPT_PACKET_OUT
398 1.592861999 172.31.31.144 -> 172.31.23.72 OpenFlow 187 Type: OFPT_PACKET_OUT
399 1.592934574 172.31.31.144 -> 172.31.23.72 OpenFlow 187 Type: OFPT_PACKET_OUT
400 1.593023035 172.31.31.144 -> 172.31.23.72 OpenFlow 187 Type: OFPT_PACKET_OUT
401 1.593057830 172.31.31.144 -> 172.31.23.72 OpenFlow 187 Type: OFPT_PACKET_OUT
402 1.593139543 172.31.23.72 -> 172.31.31.144 TCP 66 45420 → 6633 [ACK] Seq=521 Ack=2321 Win=213 Len=0 TSval=19370706 TSecr=800581
403 1.593237181 172.31.31.144 -> 172.31.23.72 OpenFlow 187 Type: OFPT_PACKET_OUT
404 1.593274151 172.31.31.144 -> 172.31.23.72 OpenFlow 187 Type: OFPT_PACKET_OUT
405 1.593317089 172.31.31.144 -> 172.31.23.72 OpenFlow 187 Type: OFPT_PACKET_OUT
406 1.593358290 172.31.31.144 -> 172.31.23.72 OpenFlow 187 Type: OFPT_PACKET_OUT
407 1.593420166 172.31.31.144 -> 172.31.23.72 OpenFlow 187 Type: OFPT_PACKET_OUT
408 1.593493079 172.31.31.144 -> 172.31.23.72 OpenFlow 187 Type: OFPT_PACKET_OUT
409 1.593556873 172.31.31.144 -> 172.31.23.72 OpenFlow 187 Type: OFPT_PACKET_OUT
410 1.593621978 172.31.31.144 -> 172.31.23.72 OpenFlow 187 Type: OFPT_PACKET_OUT
411 1.593687864 172.31.31.144 -> 172.31.23.72 OpenFlow 187 Type: OFPT_PACKET_OUT
412 1.593725126 172.31.23.72 -> 172.31.31.144 TCP 66 45424 → 6633 [ACK] Seq=177 Ack=1803 Win=213 Len=0 TSval=19370706 TSecr=800581
413 1.593742195 172.31.31.144 -> 172.31.23.72 OpenFlow 187 Type: OFPT_PACKET_OUT
414 1.593799353 172.31.31.144 -> 172.31.23.72 OpenFlow 187 Type: OFPT_PACKET_OUT
415 1.593818174 172.31.23.72 -> 172.31.31.144 OpenFlow 189 Type: OFPT_PACKET_IN
416 1.593841043 172.31.23.72 -> 172.31.31.144 OpenFlow 189 Type: OFPT_PACKET_IN
417 1.593865882 172.31.31.144 -> 172.31.23.72 OpenFlow 187 Type: OFPT_PACKET_OUT
418 1.593880935 172.31.23.72 -> 172.31.31.144 OpenFlow 189 Type: OFPT_PACKET_IN
419 1.593902177 172.31.23.72 -> 172.31.31.144 OpenFlow 189 Type: OFPT_PACKET_IN
420 1.593907957 172.31.23.72 -> 172.31.31.144 OpenFlow 189 Type: OFPT_PACKET_IN
421 1.593931331 172.31.23.72 -> 172.31.31.144 OpenFlow 189 Type: OFPT_PACKET_IN
422 1.593938518 172.31.31.144 -> 172.31.23.72 OpenFlow 187 Type: OFPT_PACKET_OUT
423 1.593975989 172.31.23.72 -> 172.31.31.144 OpenFlow 189 Type: OFPT_PACKET_IN
424 1.594001614 172.31.23.72 -> 172.31.31.144 OpenFlow 189 Type: OFPT_PACKET_IN
425 1.594004192 172.31.23.72 -> 172.31.31.144 OpenFlow 189 Type: OFPT_PACKET_IN
426 1.594018529 172.31.31.144 -> 172.31.23.72 TCP 66 6633 → 45418 [ACK] Seq=489 Ack=300 Win=853 Len=0 TSval=800582 TSecr=19370706
427 1.594023227 172.31.31.144 -> 172.31.23.72 OpenFlow 187 Type: OFPT_PACKET_OUT
428 1.594044559 172.31.23.72 -> 172.31.31.144 OpenFlow 189 Type: OFPT_PACKET_IN
429 1.594057423 172.31.23.72 -> 172.31.31.144 OpenFlow 189 Type: OFPT_PACKET_IN
430 1.594071686 172.31.23.72 -> 172.31.31.144 OpenFlow 189 Type: OFPT_PACKET_IN
431 1.594087296 172.31.31.144 -> 172.31.23.72 TCP 66 6633 → 45418 [ACK] Seq=489 Ack=423 Win=853 Len=0 TSval=800582 TSecr=19370706
432 1.594090921 172.31.31.144 -> 172.31.23.72 OpenFlow 187 Type: OFPT_PACKET_OUT
433 1.594112856 172.31.23.72 -> 172.31.31.144 OpenFlow 189 Type: OFPT_PACKET_IN
434 1.594171820 172.31.31.144 -> 172.31.23.72 OpenFlow 187 Type: OFPT_PACKET_OUT
435 1.594176941 172.31.23.72 -> 172.31.31.144 OpenFlow 189 Type: OFPT_PACKET_IN
436 1.594190410 172.31.31.144 -> 172.31.23.72 TCP 66 6633 → 45430 [ACK] Seq=705 Ack=677 Win=853 Len=0 TSval=800582 TSecr=19370706
437 1.594221053 172.31.31.144 -> 172.31.23.72 TCP 66 6633 → 45416 [ACK] Seq=593 Ack=300 Win=853 Len=0 TSval=800582 TSecr=19370706
438 1.594237957 172.31.31.144 -> 172.31.23.72 TCP 66 6633 → 45414 [ACK] Seq=1 Ack=124 Win=853 Len=0 TSval=800582 TSecr=19370706
439 1.594271084 172.31.31.144 -> 172.31.23.72 OpenFlow 187 Type: OFPT_PACKET_OUT
440 1.594285345 172.31.23.72 -> 172.31.31.144 OpenFlow 189 Type: OFPT_PACKET_IN
441 1.594295100 172.31.31.144 -> 172.31.23.72 TCP 66 6633 → 45416 [ACK] Seq=593 Ack=423 Win=853 Len=0 TSval=800582 TSecr=19370706
442 1.594306859 172.31.23.72 -> 172.31.31.144 OpenFlow 189 Type: OFPT_PACKET_IN
443 1.594331596 172.31.31.144 -> 172.31.23.72 TCP 66 6633 → 45414 [ACK] Seq=1 Ack=247 Win=853 Len=0 TSval=800582 TSecr=19370706
444 1.594354735 172.31.31.144 -> 172.31.23.72 TCP 66 6633 → 45426 [ACK] Seq=217 Ack=132 Win=853 Len=0 TSval=800582 TSecr=19370706
445 1.594382187 172.31.31.144 -> 172.31.23.72 OpenFlow 187 Type: OFPT_PACKET_OUT
446 1.594410861 172.31.31.144 -> 172.31.23.72 TCP 66 6633 → 45422 [ACK] Seq=1 Ack=124 Win=853 Len=0 TSval=800582 TSecr=19370706
447 1.594441145 172.31.31.144 -> 172.31.23.72 TCP 66 6633 → 45426 [ACK] Seq=217 Ack=255 Win=853 Len=0 TSval=800582 TSecr=19370706
448 1.594471606 172.31.31.144 -> 172.31.23.72 TCP 66 6633 → 45422 [ACK] Seq=1 Ack=247 Win=853 Len=0 TSval=800582 TSecr=19370706
449 1.594502568 172.31.31.144 -> 172.31.23.72 TCP 66 6633 → 45428 [ACK] Seq=1353 Ack=767 Win=853 Len=0 TSval=800582 TSecr=19370706
450 1.594542340 172.31.31.144 -> 172.31.23.72 TCP 66 6633 → 45434 [ACK] Seq=1211 Ack=493 Win=853 Len=0 TSval=800582 TSecr=19370707
451 1.594791786 172.31.31.144 -> 172.31.23.72 OpenFlow 187 Type: OFPT_PACKET_OUT
452 1.594825060 172.31.31.144 -> 172.31.23.72 OpenFlow 187 Type: OFPT_PACKET_OUT
453 1.594848818 172.31.31.144 -> 172.31.23.72 OpenFlow 187 Type: OFPT_PACKET_OUT
454 1.594879210 172.31.31.144 -> 172.31.23.72 OpenFlow 187 Type: OFPT_PACKET_OUT
455 1.594889570 172.31.23.72 -> 172.31.31.144 OpenFlow 189 Type: OFPT_PACKET_IN
456 1.594911594 172.31.31.144 -> 172.31.23.72 OpenFlow 187 Type: OFPT_PACKET_OUT
457 1.594916888 172.31.23.72 -> 172.31.31.144 OpenFlow 189 Type: OFPT_PACKET_IN
458 1.595018127 172.31.31.144 -> 172.31.23.72 OpenFlow 187 Type: OFPT_PACKET_OUT
459 1.595080271 172.31.31.144 -> 172.31.23.72 TCP 66 6633 → 45424 [ACK] Seq=1803 Ack=300 Win=853 Len=0 TSval=800582 TSecr=19370707
460 1.595113468 172.31.31.144 -> 172.31.23.72 TCP 66 6633 → 45424 [ACK] Seq=1803 Ack=423 Win=853 Len=0 TSval=800582 TSecr=19370707
461 1.595144762 172.31.31.144 -> 172.31.23.72 OpenFlow 187 Type: OFPT_PACKET_OUT
462 1.595174810 172.31.31.144 -> 172.31.23.72 OpenFlow 187 Type: OFPT_PACKET_OUT
463 1.595225958 172.31.23.72 -> 172.31.31.144 TCP 66 45418 → 6633 [ACK] Seq=423 Ack=1457 Win=213 Len=0 TSval=19370707 TSecr=800582
464 1.595282388 172.31.31.144 -> 172.31.23.72 OpenFlow 187 Type: OFPT_PACKET_OUT
465 1.595314990 172.31.31.144 -> 172.31.23.72 OpenFlow 187 Type: OFPT_PACKET_OUT
466 1.595356326 172.31.23.72 -> 172.31.31.144 TCP 66 45418 → 6633 [ACK] Seq=423 Ack=1699 Win=213 Len=0 TSval=19370707 TSecr=800582
467 1.595418640 172.31.31.144 -> 172.31.23.72 OpenFlow 187 Type: OFPT_PACKET_OUT
468 1.595452396 172.31.31.144 -> 172.31.23.72 OpenFlow 187 Type: OFPT_PACKET_OUT
469 1.595489443 172.31.31.144 -> 172.31.23.72 OpenFlow 187 Type: OFPT_PACKET_OUT
470 1.595494203 172.31.23.72 -> 172.31.31.144 TCP 66 45444 → 6633 [ACK] Seq=247 Ack=243 Win=213 Len=0 TSval=19370707 TSecr=800582
471 1.595563410 172.31.31.144 -> 172.31.23.72 OpenFlow 187 Type: OFPT_PACKET_OUT
472 1.595602639 172.31.31.144 -> 172.31.23.72 OpenFlow 187 Type: OFPT_PACKET_OUT
473 1.595665748 172.31.23.72 -> 172.31.31.144 TCP 66 45444 → 6633 [ACK] Seq=247 Ack=606 Win=213 Len=0 TSval=19370707 TSecr=800582
474 1.595672148 172.31.31.144 -> 172.31.23.72 OpenFlow 187 Type: OFPT_PACKET_OUT
475 1.595724412 172.31.31.144 -> 172.31.23.72 OpenFlow 187 Type: OFPT_PACKET_OUT
476 1.595774671 172.31.23.72 -> 172.31.31.144 TCP 66 45444 → 6633 [ACK] Seq=247 Ack=848 Win=213 Len=0 TSval=19370707 TSecr=800582
477 1.595801147 172.31.31.144 -> 172.31.23.72 OpenFlow 187 Type: OFPT_PACKET_OUT
478 1.595865869 172.31.31.144 -> 172.31.23.72 OpenFlow 187 Type: OFPT_PACKET_OUT
479 1.595884528 172.31.23.72 -> 172.31.31.144 TCP 66 45444 → 6633 [ACK] Seq=247 Ack=1090 Win=213 Len=0 TSval=19370707 TSecr=800582
480 1.595932943 172.31.31.144 -> 172.31.23.72 OpenFlow 187 Type: OFPT_PACKET_OUT
481 1.595998819 172.31.31.144 -> 172.31.23.72 OpenFlow 187 Type: OFPT_PACKET_OUT
482 1.596063816 172.31.23.72 -> 172.31.31.144 OpenFlow 189 Type: OFPT_PACKET_IN
483 1.596074525 172.31.31.144 -> 172.31.23.72 OpenFlow 187 Type: OFPT_PACKET_OUT
484 1.596086808 172.31.23.72 -> 172.31.31.144 OpenFlow 189 Type: OFPT_PACKET_IN
485 1.596102718 172.31.23.72 -> 172.31.31.144 OpenFlow 189 Type: OFPT_PACKET_IN
486 1.596118909 172.31.23.72 -> 172.31.31.144 OpenFlow 189 Type: OFPT_PACKET_IN
487 1.596147118 172.31.23.72 -> 172.31.31.144 OpenFlow 189 Type: OFPT_PACKET_IN
488 1.596152174 172.31.23.72 -> 172.31.31.144 OpenFlow 189 Type: OFPT_PACKET_IN
489 1.596157435 172.31.31.144 -> 172.31.23.72 OpenFlow 187 Type: OFPT_PACKET_OUT
490 1.596162181 172.31.23.72 -> 172.31.31.144 OpenFlow 189 Type: OFPT_PACKET_IN
491 1.596190840 172.31.23.72 -> 172.31.31.144 OpenFlow 189 Type: OFPT_PACKET_IN
492 1.596193160 172.31.23.72 -> 172.31.31.144 OpenFlow 189 Type: OFPT_PACKET_IN
493 1.596198351 172.31.31.144 -> 172.31.23.72 OpenFlow 187 Type: OFPT_PACKET_OUT
494 1.596219148 172.31.23.72 -> 172.31.31.144 OpenFlow 189 Type: OFPT_PACKET_IN
495 1.596240288 172.31.23.72 -> 172.31.31.144 OpenFlow 189 Type: OFPT_PACKET_IN
496 1.596242415 172.31.23.72 -> 172.31.31.144 OpenFlow 189 Type: OFPT_PACKET_IN
497 1.596258570 172.31.23.72 -> 172.31.31.144 OpenFlow 189 Type: OFPT_PACKET_IN
498 1.596271099 172.31.23.72 -> 172.31.31.144 OpenFlow 189 Type: OFPT_PACKET_IN
499 1.596289282 172.31.31.144 -> 172.31.23.72 TCP 66 6633 → 45450 [ACK] Seq=97 Ack=9514 Win=853 Len=0 TSval=800582 TSecr=19370707
500 1.596293599 172.31.31.144 -> 172.31.23.72 TCP 66 6633 → 45450 [ACK] Seq=97 Ack=9637 Win=853 Len=0 TSval=800582 TSecr=19370707
501 1.596295503 172.31.31.144 -> 172.31.23.72 OpenFlow 187 Type: OFPT_PACKET_OUT
502 1.596339080 172.31.23.72 -> 172.31.31.144 OpenFlow 189 Type: OFPT_PACKET_IN
503 1.596344896 172.31.23.72 -> 172.31.31.144 OpenFlow 435 Type: OFPT_PACKET_IN
504 1.596392460 172.31.23.72 -> 172.31.31.144 OpenFlow 189 Type: OFPT_PACKET_IN
505 1.596395567 172.31.23.72 -> 172.31.31.144 OpenFlow 189 Type: OFPT_PACKET_IN
506 1.596397469 172.31.23.72 -> 172.31.31.144 OpenFlow 189 Type: OFPT_PACKET_IN
507 1.596418408 172.31.31.144 -> 172.31.23.72 TCP 66 6633 → 45416 [ACK] Seq=593 Ack=546 Win=853 Len=0 TSval=800582 TSecr=19370707
508 1.596422577 172.31.31.144 -> 172.31.23.72 OpenFlow 187 Type: OFPT_PACKET_OUT
509 1.596424358 172.31.31.144 -> 172.31.23.72 TCP 66 6633 → 45446 [ACK] Seq=961 Ack=9316 Win=853 Len=0 TSval=800582 TSecr=19370707
510 1.596426398 172.31.31.144 -> 172.31.23.72 TCP 66 6633 → 45416 [ACK] Seq=593 Ack=669 Win=853 Len=0 TSval=800582 TSecr=19370707
511 1.596433353 172.31.23.72 -> 172.31.31.144 OpenFlow 189 Type: OFPT_PACKET_IN
512 1.596496501 172.31.23.72 -> 172.31.31.144 OpenFlow 558 Type: OFPT_PACKET_IN
513 1.596542557 172.31.31.144 -> 172.31.23.72 OpenFlow 187 Type: OFPT_PACKET_OUT
514 1.596547576 172.31.31.144 -> 172.31.23.72 TCP 66 6633 → 45456 [ACK] Seq=97 Ack=7508 Win=853 Len=0 TSval=800582 TSecr=19370707
515 1.596551359 172.31.31.144 -> 172.31.23.72 TCP 66 6633 → 45446 [ACK] Seq=961 Ack=9439 Win=853 Len=0 TSval=800582 TSecr=19370707
516 1.596553240 172.31.31.144 -> 172.31.23.72 TCP 66 6633 → 45454 [ACK] Seq=97 Ack=9626 Win=853 Len=0 TSval=800582 TSecr=19370707
517 1.596566349 172.31.23.72 -> 172.31.31.144 OpenFlow 189 Type: OFPT_PACKET_IN
518 1.596594300 172.31.31.144 -> 172.31.23.72 TCP 66 6633 → 45442 [ACK] Seq=1 Ack=370 Win=853 Len=0 TSval=800582 TSecr=19370707
519 1.596598096 172.31.31.144 -> 172.31.23.72 TCP 66 6633 → 45456 [ACK] Seq=97 Ack=7631 Win=853 Len=0 TSval=800582 TSecr=19370707
520 1.596612735 172.31.31.144 -> 172.31.23.72 TCP 66 6633 → 45426 [ACK] Seq=217 Ack=378 Win=853 Len=0 TSval=800582 TSecr=19370707
521 1.596631641 172.31.31.144 -> 172.31.23.72 OpenFlow 187 Type: OFPT_PACKET_OUT
522 1.596662206 172.31.31.144 -> 172.31.23.72 TCP 66 6633 → 45422 [ACK] Seq=1 Ack=370 Win=853 Len=0 TSval=800582 TSecr=19370707
523 1.596691291 172.31.31.144 -> 172.31.23.72 TCP 66 6633 → 45454 [ACK] Seq=97 Ack=9749 Win=853 Len=0 TSval=800582 TSecr=19370707
524 1.596721539 172.31.31.144 -> 172.31.23.72 TCP 66 6633 → 45442 [ACK] Seq=1 Ack=739 Win=853 Len=0 TSval=800582 TSecr=19370707
525 1.596751609 172.31.31.144 -> 172.31.23.72 TCP 66 6633 → 45436 [ACK] Seq=1401 Ack=140 Win=853 Len=0 TSval=800582 TSecr=19370707
526 1.596780923 172.31.31.144 -> 172.31.23.72 TCP 66 6633 → 45430 [ACK] Seq=705 Ack=923 Win=853 Len=0 TSval=800582 TSecr=19370707
527 1.596810805 172.31.31.144 -> 172.31.23.72 TCP 66 6633 → 45426 [ACK] Seq=217 Ack=501 Win=853 Len=0 TSval=800582 TSecr=19370707
528 1.596840404 172.31.31.144 -> 172.31.23.72 TCP 66 6633 → 45422 [ACK] Seq=1 Ack=493 Win=853 Len=0 TSval=800582 TSecr=19370707
529 1.596886220 172.31.31.144 -> 172.31.23.72 TCP 66 6633 → 45436 [ACK] Seq=1401 Ack=632 Win=853 Len=0 TSval=800582 TSecr=19370707
530 1.596895436 172.31.23.72 -> 172.31.31.144 TCP 66 45438 → 6633 [ACK] Seq=525 Ack=1833 Win=213 Len=0 TSval=19370707 TSecr=800582
531 1.596981831 172.31.23.72 -> 172.31.31.144 OpenFlow 189 Type: OFPT_PACKET_IN
532 1.597006175 172.31.23.72 -> 172.31.31.144 OpenFlow 189 Type: OFPT_PACKET_IN
533 1.597011385 172.31.31.144 -> 172.31.23.72 OpenFlow 187 Type: OFPT_PACKET_OUT
534 1.597017005 172.31.23.72 -> 172.31.31.144 OpenFlow 189 Type: OFPT_PACKET_IN
535 1.597059055 172.31.23.72 -> 172.31.31.144 OpenFlow 189 Type: OFPT_PACKET_IN
536 1.597155234 172.31.23.72 -> 172.31.31.144 OpenFlow 189 Type: OFPT_PACKET_IN
537 1.597165257 172.31.31.144 -> 172.31.23.72 TCP 66 6633 → 45446 [ACK] Seq=961 Ack=9562 Win=853 Len=0 TSval=800583 TSecr=19370707
538 1.597178883 172.31.23.72 -> 172.31.31.144 OpenFlow 189 Type: OFPT_PACKET_IN
539 1.597194375 172.31.23.72 -> 172.31.31.144 OpenFlow 189 Type: OFPT_PACKET_IN
540 1.597200714 172.31.31.144 -> 172.31.23.72 TCP 66 6633 → 45446 [ACK] Seq=961 Ack=9685 Win=853 Len=0 TSval=800583 TSecr=19370707
541 1.597265053 172.31.31.144 -> 172.31.23.72 TCP 66 6633 → 45420 [ACK] Seq=2321 Ack=767 Win=853 Len=0 TSval=800583 TSecr=19370707
542 1.597324886 172.31.31.144 -> 172.31.23.72 OpenFlow 187 Type: OFPT_PACKET_OUT
543 1.597352518 172.31.31.144 -> 172.31.23.72 TCP 66 6633 → 45436 [ACK] Seq=1401 Ack=755 Win=853 Len=0 TSval=800583 TSecr=19370707
544 1.597381081 172.31.31.144 -> 172.31.23.72 TCP 66 6633 → 45462 [ACK] Seq=1253 Ack=8063 Win=853 Len=0 TSval=800583 TSecr=19370707
545 1.597424379 172.31.31.144 -> 172.31.23.72 TCP 66 6633 → 45432 [ACK] Seq=1209 Ack=1015 Win=853 Len=0 TSval=800583 TSecr=19370707
546 1.597470770 172.31.23.72 -> 172.31.31.144 OpenFlow 189 Type: OFPT_PACKET_IN
547 1.597492407 172.31.31.144 -> 172.31.23.72 OpenFlow 187 Type: OFPT_PACKET_OUT
548 1.597600469 172.31.23.72 -> 172.31.31.144 TCP 66 45450 → 6633 [ACK] Seq=9637 Ack=460 Win=213 Len=0 TSval=19370707 TSecr=800582
549 1.597645801 172.31.31.144 -> 172.31.23.72 TCP 66 6633 → 45452 [ACK] Seq=1065 Ack=8964 Win=853 Len=0 TSval=800583 TSecr=19370707
550 1.597666139 172.31.31.144 -> 172.31.23.72 OpenFlow 187 Type: OFPT_PACKET_OUT
551 1.597785098 172.31.31.144 -> 172.31.23.72 OpenFlow 187 Type: OFPT_PACKET_OUT
552 1.597792368 172.31.23.72 -> 172.31.31.144 OpenFlow 189 Type: OFPT_PACKET_IN
553 1.597839106 172.31.31.144 -> 172.31.23.72 OpenFlow 187 Type: OFPT_PACKET_OUT
554 1.597918539 172.31.23.72 -> 172.31.31.144 TCP 66 45450 → 6633 [ACK] Seq=9637 Ack=823 Win=213 Len=0 TSval=19370707 TSecr=800583
555 1.597963865 172.31.31.144 -> 172.31.23.72 TCP 66 6633 → 45452 [ACK] Seq=1065 Ack=9087 Win=853 Len=0 TSval=800583 TSecr=19370707
556 1.597976789 172.31.31.144 -> 172.31.23.72 OpenFlow 187 Type: OFPT_PACKET_OUT
557 1.598007445 172.31.31.144 -> 172.31.23.72 OpenFlow 187 Type: OFPT_PACKET_OUT
558 1.598049622 172.31.31.144 -> 172.31.23.72 OpenFlow 187 Type: OFPT_PACKET_OUT
559 1.598113628 172.31.23.72 -> 172.31.31.144 TCP 66 45430 → 6633 [ACK] Seq=923 Ack=1068 Win=213 Len=0 TSval=19370707 TSecr=800583
560 1.598159125 172.31.31.144 -> 172.31.23.72 OpenFlow 187 Type: OFPT_PACKET_OUT
561 1.598256075 172.31.31.144 -> 172.31.23.72 OpenFlow 187 Type: OFPT_PACKET_OUT
562 1.598286036 172.31.23.72 -> 172.31.31.144 OpenFlow 189 Type: OFPT_PACKET_IN
563 1.598307764 172.31.23.72 -> 172.31.31.144 OpenFlow 189 Type: OFPT_PACKET_IN
564 1.598333298 172.31.31.144 -> 172.31.23.72 OpenFlow 187 Type: OFPT_PACKET_OUT
565 1.598392018 172.31.31.144 -> 172.31.23.72 OpenFlow 187 Type: OFPT_PACKET_OUT
566 1.598446790 172.31.23.72 -> 172.31.31.144 OpenFlow 189 Type: OFPT_PACKET_IN
567 1.598464615 172.31.31.144 -> 172.31.23.72 OpenFlow 187 Type: OFPT_PACKET_OUT
568 1.598470179 172.31.23.72 -> 172.31.31.144 OpenFlow 189 Type: OFPT_PACKET_IN
569 1.598481842 172.31.23.72 -> 172.31.31.144 OpenFlow 189 Type: OFPT_PACKET_IN
570 1.598489705 172.31.31.144 -> 172.31.23.72 TCP 66 6633 → 45432 [ACK] Seq=1209 Ack=1261 Win=853 Len=0 TSval=800583 TSecr=19370708
571 1.598523907 172.31.23.72 -> 172.31.31.144 OpenFlow 189 Type: OFPT_PACKET_IN
572 1.598553144 172.31.31.144 -> 172.31.23.72 OpenFlow 187 Type: OFPT_PACKET_OUT
573 1.598596184 172.31.31.144 -> 172.31.23.72 OpenFlow 187 Type: OFPT_PACKET_OUT
574 1.598637235 172.31.31.144 -> 172.31.23.72 TCP 66 6633 → 45434 [ACK] Seq=1211 Ack=739 Win=853 Len=0 TSval=800583 TSecr=19370708
575 1.598666755 172.31.31.144 -> 172.31.23.72 TCP 66 6633 → 45424 [ACK] Seq=1803 Ack=546 Win=853 Len=0 TSval=800583 TSecr=19370708
576 1.598694435 172.31.31.144 -> 172.31.23.72 TCP 66 6633 → 45424 [ACK] Seq=1803 Ack=669 Win=853 Len=0 TSval=800583 TSecr=19370708
577 1.598722884 172.31.31.144 -> 172.31.23.72 OpenFlow 187 Type: OFPT_PACKET_OUT
578 1.598751511 172.31.31.144 -> 172.31.23.72 OpenFlow 187 Type: OFPT_PACKET_OUT
579 1.598797785 172.31.31.144 -> 172.31.23.72 OpenFlow 187 Type: OFPT_PACKET_OUT
580 1.598831124 172.31.23.72 -> 172.31.31.144 TCP 66 45430 → 6633 [ACK] Seq=923 Ack=1915 Win=213 Len=0 TSval=19370708 TSecr=800583
581 1.598959195 172.31.31.144 -> 172.31.23.72 OpenFlow 187 Type: OFPT_PACKET_OUT
582 1.599022900 172.31.23.72 -> 172.31.31.144 TCP 66 45428 → 6633 [ACK] Seq=767 Ack=1837 Win=213 Len=0 TSval=19370708 TSecr=800583
583 1.599074730 172.31.31.144 -> 172.31.23.72 OpenFlow 187 Type: OFPT_PACKET_OUT
584 1.599134655 172.31.31.144 -> 172.31.23.72 OpenFlow 187 Type: OFPT_PACKET_OUT
585 1.599150726 172.31.23.72 -> 172.31.31.144 TCP 66 45428 → 6633 [ACK] Seq=767 Ack=2079 Win=213 Len=0 TSval=19370708 TSecr=800583
586 1.599206781 172.31.31.144 -> 172.31.23.72 OpenFlow 187 Type: OFPT_PACKET_OUT
587 1.599263672 172.31.31.144 -> 172.31.23.72 OpenFlow 187 Type: OFPT_PACKET_OUT
588 1.599281873 172.31.23.72 -> 172.31.31.144 TCP 66 45416 → 6633 [ACK] Seq=669 Ack=835 Win=213 Len=0 TSval=19370708 TSecr=800583
589 1.599340772 172.31.31.144 -> 172.31.23.72 OpenFlow 187 Type: OFPT_PACKET_OUT
590 1.599384948 172.31.31.144 -> 172.31.23.72 OpenFlow 187 Type: OFPT_PACKET_OUT
591 1.599412719 172.31.23.72 -> 172.31.31.144 TCP 66 45416 → 6633 [ACK] Seq=669 Ack=1077 Win=213 Len=0 TSval=19370708 TSecr=800583
592 1.599432959 172.31.31.144 -> 172.31.23.72 OpenFlow 187 Type: OFPT_PACKET_OUT
593 1.599501586 172.31.31.144 -> 172.31.23.72 OpenFlow 187 Type: OFPT_PACKET_OUT
594 1.599509766 172.31.23.72 -> 172.31.31.144 OpenFlow 189 Type: OFPT_PACKET_IN
595 1.599531163 172.31.23.72 -> 172.31.31.144 OpenFlow 189 Type: OFPT_PACKET_IN
596 1.599556901 172.31.31.144 -> 172.31.23.72 OpenFlow 187 Type: OFPT_PACKET_OUT
597 1.599561537 172.31.23.72 -> 172.31.31.144 OpenFlow 189 Type: OFPT_PACKET_IN
598 1.599591683 172.31.23.72 -> 172.31.31.144 OpenFlow 189 Type: OFPT_PACKET_IN
599 1.599617260 172.31.23.72 -> 172.31.31.144 OpenFlow 189 Type: OFPT_PACKET_IN
600 1.599634410 172.31.31.144 -> 172.31.23.72 OpenFlow 187 Type: OFPT_PACKET_OUT
601 1.599638567 172.31.23.72 -> 172.31.31.144 OpenFlow 435 Type: OFPT_PACKET_IN
602 1.599703519 172.31.31.144 -> 172.31.23.72 TCP 66 6633 → 45432 [ACK] Seq=1209 Ack=1507 Win=853 Len=0 TSval=800583 TSecr=19370708
603 1.599732293 172.31.31.144 -> 172.31.23.72 TCP 66 6633 → 45414 [ACK] Seq=1 Ack=370 Win=853 Len=0 TSval=800583 TSecr=19370708
604 1.599750879 172.31.23.72 -> 172.31.31.144 OpenFlow 189 Type: OFPT_PACKET_IN
605 1.599761588 172.31.31.144 -> 172.31.23.72 TCP 66 6633 → 45414 [ACK] Seq=1 Ack=493 Win=853 Len=0 TSval=800583 TSecr=19370708
606 1.599770131 172.31.23.72 -> 172.31.31.144 OpenFlow 189 Type: OFPT_PACKET_IN
607 1.599783923 172.31.23.72 -> 172.31.31.144 OpenFlow 189 Type: OFPT_PACKET_IN
608 1.599793768 172.31.31.144 -> 172.31.23.72 TCP 66 6633 → 45426 [ACK] Seq=217 Ack=624 Win=853 Len=0 TSval=800583 TSecr=19370708
609 1.599803256 172.31.23.72 -> 172.31.31.144 OpenFlow 189 Type: OFPT_PACKET_IN
610 1.599823369 172.31.23.72 -> 172.31.31.144 OpenFlow 189 Type: OFPT_PACKET_IN
611 1.599825727 172.31.23.72 -> 172.31.31.144 OpenFlow 189 Type: OFPT_PACKET_IN
612 1.599839401 172.31.31.144 -> 172.31.23.72 TCP 66 6633 → 45426 [ACK] Seq=217 Ack=993 Win=853 Len=0 TSval=800583 TSecr=19370708
613 1.599866474 172.31.23.72 -> 172.31.31.144 OpenFlow 189 Type: OFPT_PACKET_IN
614 1.599871383 172.31.23.72 -> 172.31.31.144 OpenFlow 189 Type: OFPT_PACKET_IN
615 1.599913026 172.31.31.144 -> 172.31.23.72 TCP 66 6633 → 45436 [ACK] Seq=1401 Ack=878 Win=853 Len=0 TSval=800583 TSecr=19370708
616 1.599951356 172.31.31.144 -> 172.31.23.72 TCP 66 6633 → 45436 [ACK] Seq=1401 Ack=1001 Win=853 Len=0 TSval=800583 TSecr=19370708
617 1.599969868 172.31.23.72 -> 172.31.31.144 TCP 66 45416 → 6633 [ACK] Seq=669 Ack=1561 Win=213 Len=0 TSval=19370708 TSecr=800583
618 1.600014902 172.31.31.144 -> 172.31.23.72 TCP 66 6633 → 45434 [ACK] Seq=1211 Ack=862 Win=853 Len=0 TSval=800583 TSecr=19370708
619 1.600171144 172.31.23.72 -> 172.31.31.144 OpenFlow 189 Type: OFPT_PACKET_IN
620 1.600200510 172.31.31.144 -> 172.31.23.72 TCP 66 6633 → 45420 [ACK] Seq=2321 Ack=1013 Win=853 Len=0 TSval=800583 TSecr=19370708
621 1.600207731 172.31.23.72 -> 172.31.31.144 OpenFlow 189 Type: OFPT_PACKET_IN
622 1.600232193 172.31.31.144 -> 172.31.23.72 TCP 66 6633 → 45434 [ACK] Seq=1211 Ack=985 Win=853 Len=0 TSval=800583 TSecr=19370708
623 1.600350295 172.31.31.144 -> 172.31.23.72 TCP 66 6633 → 45424 [ACK] Seq=1803 Ack=792 Win=853 Len=0 TSval=800583 TSecr=19370708
624 1.600376005 172.31.31.144 -> 172.31.23.72 TCP 66 6633 → 45424 [ACK] Seq=1803 Ack=915 Win=853 Len=0 TSval=800583 TSecr=19370708
625 1.600428348 172.31.31.144 -> 172.31.23.72 TCP 66 6633 → 45418 [ACK] Seq=1699 Ack=669 Win=853 Len=0 TSval=800583 TSecr=19370708
626 1.634247144 172.31.23.72 -> 172.31.31.144 TCP 66 45444 → 6633 [ACK] Seq=247 Ack=1211 Win=213 Len=0 TSval=19370717 TSecr=800582
627 1.692945354 172.31.31.144 -> 172.31.23.72 OpenFlow 187 Type: OFPT_PACKET_OUT
628 1.692983038 172.31.31.144 -> 172.31.23.72 OpenFlow 187 Type: OFPT_PACKET_OUT
629 1.693037933 172.31.31.144 -> 172.31.23.72 OpenFlow 187 Type: OFPT_PACKET_OUT
630 1.693167566 172.31.31.144 -> 172.31.23.72 OpenFlow 187 Type: OFPT_PACKET_OUT
631 1.693272941 172.31.31.144 -> 172.31.23.72 OpenFlow 187 Type: OFPT_PACKET_OUT
632 1.693476861 172.31.23.72 -> 172.31.31.144 TCP 66 45446 → 6633 [ACK] Seq=9685 Ack=1566 Win=213 Len=0 TSval=19370731 TSecr=800606
633 1.693591531 172.31.23.72 -> 172.31.31.144 OpenFlow 189 Type: OFPT_PACKET_IN
634 1.693621571 172.31.31.144 -> 172.31.23.72 OpenFlow 187 Type: OFPT_PACKET_OUT
635 1.693650786 172.31.23.72 -> 172.31.31.144 OpenFlow 189 Type: OFPT_PACKET_IN
636 1.693760491 172.31.23.72 -> 172.31.31.144 OpenFlow 189 Type: OFPT_PACKET_IN
637 1.693779365 172.31.23.72 -> 172.31.31.144 OpenFlow 189 Type: OFPT_PACKET_IN
638 1.693937370 172.31.23.72 -> 172.31.31.144 OpenFlow 189 Type: OFPT_PACKET_IN
639 1.694037654 172.31.31.144 -> 172.31.23.72 OpenFlow 187 Type: OFPT_PACKET_OUT
640 1.694053611 172.31.23.72 -> 172.31.31.144 OpenFlow 189 Type: OFPT_PACKET_IN
641 1.694083864 172.31.23.72 -> 172.31.31.144 TCP 66 45446 → 6633 [ACK] Seq=9685 Ack=1808 Win=213 Len=0 TSval=19370731 TSecr=800607
642 1.694169207 172.31.23.72 -> 172.31.31.144 OpenFlow 189 Type: OFPT_PACKET_IN
643 1.694234169 172.31.31.144 -> 172.31.23.72 OpenFlow 187 Type: OFPT_PACKET_OUT
644 1.694439593 172.31.23.72 -> 172.31.31.144 OpenFlow 189 Type: OFPT_PACKET_IN
645 1.694555364 172.31.31.144 -> 172.31.23.72 OpenFlow 187 Type: OFPT_PACKET_OUT
646 1.694561792 172.31.31.144 -> 172.31.23.72 OpenFlow 187 Type: OFPT_PACKET_OUT
647 1.694715904 172.31.23.72 -> 172.31.31.144 TCP 66 45446 → 6633 [ACK] Seq=9685 Ack=2171 Win=213 Len=0 TSval=19370732 TSecr=800607
648 1.694793984 172.31.23.72 -> 172.31.31.144 OpenFlow 189 Type: OFPT_PACKET_IN
649 1.694853053 172.31.31.144 -> 172.31.23.72 OpenFlow 187 Type: OFPT_PACKET_OUT
650 1.694858525 172.31.31.144 -> 172.31.23.72 OpenFlow 187 Type: OFPT_PACKET_OUT
651 1.694860856 172.31.31.144 -> 172.31.23.72 OpenFlow 187 Type: OFPT_PACKET_OUT
652 1.694862437 172.31.31.144 -> 172.31.23.72 OpenFlow 187 Type: OFPT_PACKET_OUT
653 1.694863942 172.31.31.144 -> 172.31.23.72 TCP 66 6633 → 45448 [ACK] Seq=1089 Ack=9778 Win=853 Len=0 TSval=800607 TSecr=19370731
654 1.694947295 172.31.23.72 -> 172.31.31.144 OpenFlow 189 Type: OFPT_PACKET_IN
655 1.695143318 172.31.23.72 -> 172.31.31.144 TCP 66 45432 → 6633 [ACK] Seq=1507 Ack=1693 Win=213 Len=0 TSval=19370732 TSecr=800607
656 1.695280717 172.31.31.144 -> 172.31.23.72 OpenFlow 187 Type: OFPT_PACKET_OUT
657 1.695286110 172.31.31.144 -> 172.31.23.72 TCP 66 6633 → 45448 [ACK] Seq=1089 Ack=9901 Win=853 Len=0 TSval=800607 TSecr=19370731
658 1.695289241 172.31.31.144 -> 172.31.23.72 OpenFlow 187 Type: OFPT_PACKET_OUT
659 1.695290855 172.31.31.144 -> 172.31.23.72 OpenFlow 187 Type: OFPT_PACKET_OUT
660 1.695293841 172.31.31.144 -> 172.31.23.72 OpenFlow 187 Type: OFPT_PACKET_OUT
661 1.695295451 172.31.31.144 -> 172.31.23.72 TCP 66 6633 → 45444 [ACK] Seq=1211 Ack=370 Win=853 Len=0 TSval=800607 TSecr=19370731
662 1.695297551 172.31.31.144 -> 172.31.23.72 OpenFlow 187 Type: OFPT_PACKET_OUT
663 1.695298895 172.31.31.144 -> 172.31.23.72 TCP 66 6633 → 45438 [ACK] Seq=1833 Ack=648 Win=853 Len=0 TSval=800607 TSecr=19370731
664 1.695300894 172.31.31.144 -> 172.31.23.72 OpenFlow 187 Type: OFPT_PACKET_OUT
665 1.695362767 172.31.23.72 -> 172.31.31.144 OpenFlow 189 Type: OFPT_PACKET_IN
666 1.695382695 172.31.23.72 -> 172.31.31.144 OpenFlow 189 Type: OFPT_PACKET_IN
667 1.695406132 172.31.31.144 -> 172.31.23.72 OpenFlow 187 Type: OFPT_PACKET_OUT
668 1.695409732 172.31.31.144 -> 172.31.23.72 TCP 66 6633 → 45444 [ACK] Seq=1211 Ack=493 Win=853 Len=0 TSval=800607 TSecr=19370731
669 1.695412331 172.31.31.144 -> 172.31.23.72 TCP 66 6633 → 45438 [ACK] Seq=1833 Ack=771 Win=853 Len=0 TSval=800607 TSecr=19370731
670 1.695414023 172.31.31.144 -> 172.31.23.72 TCP 66 6633 → 45456 [ACK] Seq=97 Ack=7754 Win=853 Len=0 TSval=800607 TSecr=19370731
671 1.695416065 172.31.31.144 -> 172.31.23.72 OpenFlow 187 Type: OFPT_PACKET_OUT
672 1.695475206 172.31.23.72 -> 172.31.31.144 TCP 66 45432 → 6633 [ACK] Seq=1507 Ack=1935 Win=213 Len=0 TSval=19370732 TSecr=800607
673 1.695482950 172.31.23.72 -> 172.31.31.144 OpenFlow 189 Type: OFPT_PACKET_IN
674 1.695679479 172.31.23.72 -> 172.31.31.144 TCP 66 45460 → 6633 [ACK] Seq=9425 Ack=2559 Win=213 Len=0 TSval=19370732 TSecr=800607
675 1.695682707 172.31.23.72 -> 172.31.31.144 OpenFlow 189 Type: OFPT_PACKET_IN
676 1.695737415 172.31.23.72 -> 172.31.31.144 OpenFlow 189 Type: OFPT_PACKET_IN
677 1.695764756 172.31.23.72 -> 172.31.31.144 OpenFlow 189 Type: OFPT_PACKET_IN
678 1.695885138 172.31.31.144 -> 172.31.23.72 OpenFlow 187 Type: OFPT_PACKET_OUT
679 1.695892377 172.31.23.72 -> 172.31.31.144 OpenFlow 189 Type: OFPT_PACKET_IN
680 1.695899086 172.31.31.144 -> 172.31.23.72 TCP 66 6633 → 45456 [ACK] Seq=97 Ack=7877 Win=853 Len=0 TSval=800607 TSecr=19370732
681 1.695902274 172.31.31.144 -> 172.31.23.72 OpenFlow 187 Type: OFPT_PACKET_OUT
682 1.695904897 172.31.31.144 -> 172.31.23.72 OpenFlow 187 Type: OFPT_PACKET_OUT
683 1.695906534 172.31.31.144 -> 172.31.23.72 OpenFlow 187 Type: OFPT_PACKET_OUT
684 1.695908382 172.31.31.144 -> 172.31.23.72 OpenFlow 187 Type: OFPT_PACKET_OUT
685 1.695910068 172.31.31.144 -> 172.31.23.72 OpenFlow 187 Type: OFPT_PACKET_OUT
686 1.695911243 172.31.31.144 -> 172.31.23.72 OpenFlow 187 Type: OFPT_PACKET_OUT
687 1.695913203 172.31.31.144 -> 172.31.23.72 OpenFlow 187 Type: OFPT_PACKET_OUT
688 1.695914543 172.31.31.144 -> 172.31.23.72 OpenFlow 187 Type: OFPT_PACKET_OUT
689 1.695915749 172.31.31.144 -> 172.31.23.72 OpenFlow 187 Type: OFPT_PACKET_OUT
690 1.695917564 172.31.31.144 -> 172.31.23.72 OpenFlow 187 Type: OFPT_PACKET_OUT
691 1.695919004 172.31.31.144 -> 172.31.23.72 OpenFlow 187 Type: OFPT_PACKET_OUT
692 1.695920627 172.31.31.144 -> 172.31.23.72 OpenFlow 187 Type: OFPT_PACKET_OUT
693 1.695922203 172.31.31.144 -> 172.31.23.72 OpenFlow 187 Type: OFPT_PACKET_OUT
694 1.695942505 172.31.23.72 -> 172.31.31.144 OpenFlow 189 Type: OFPT_PACKET_IN
695 1.695990839 172.31.23.72 -> 172.31.31.144 OpenFlow 189 Type: OFPT_PACKET_IN
696 1.696024769 172.31.31.144 -> 172.31.23.72 OpenFlow 187 Type: OFPT_PACKET_OUT
697 1.696029325 172.31.31.144 -> 172.31.23.72 OpenFlow 187 Type: OFPT_PACKET_OUT
698 1.696030958 172.31.31.144 -> 172.31.23.72 OpenFlow 187 Type: OFPT_PACKET_OUT
699 1.696033767 172.31.31.144 -> 172.31.23.72 OpenFlow 187 Type: OFPT_PACKET_OUT
700 1.696110887 172.31.23.72 -> 172.31.31.144 OpenFlow 189 Type: OFPT_PACKET_IN
701 1.696249347 172.31.23.72 -> 172.31.31.144 TCP 66 45458 → 6633 [ACK] Seq=9317 Ack=1881 Win=213 Len=0 TSval=19370732 TSecr=800607
702 1.696300696 172.31.23.72 -> 172.31.31.144 OpenFlow 189 Type: OFPT_PACKET_IN
703 1.696400863 172.31.31.144 -> 172.31.23.72 OpenFlow 187 Type: OFPT_PACKET_OUT
704 1.696405846 172.31.31.144 -> 172.31.23.72 OpenFlow 187 Type: OFPT_PACKET_OUT
705 1.696407636 172.31.31.144 -> 172.31.23.72 TCP 66 6633 → 45428 [ACK] Seq=2079 Ack=1013 Win=853 Len=0 TSval=800607 TSecr=19370732
706 1.696411287 172.31.31.144 -> 172.31.23.72 TCP 66 6633 → 45430 [ACK] Seq=1915 Ack=1169 Win=853 Len=0 TSval=800607 TSecr=19370732
707 1.696413378 172.31.31.144 -> 172.31.23.72 OpenFlow 187 Type: OFPT_PACKET_OUT
708 1.696414792 172.31.31.144 -> 172.31.23.72 TCP 66 6633 → 45458 [ACK] Seq=1881 Ack=9194 Win=853 Len=0 TSval=800607 TSecr=19370732
709 1.696416897 172.31.31.144 -> 172.31.23.72 TCP 66 6633 → 45448 [ACK] Seq=1089 Ack=10024 Win=853 Len=0 TSval=800607 TSecr=19370732
710 1.696421522 172.31.31.144 -> 172.31.23.72 OpenFlow 187 Type: OFPT_PACKET_OUT
711 1.696423281 172.31.31.144 -> 172.31.23.72 TCP 66 6633 → 45438 [ACK] Seq=1833 Ack=894 Win=853 Len=0 TSval=800607 TSecr=19370732
712 1.696425013 172.31.31.144 -> 172.31.23.72 TCP 66 6633 → 45448 [ACK] Seq=1089 Ack=10147 Win=853 Len=0 TSval=800607 TSecr=19370732
713 1.696426737 172.31.31.144 -> 172.31.23.72 OpenFlow 187 Type: OFPT_PACKET_OUT
714 1.696445463 172.31.23.72 -> 172.31.31.144 OpenFlow 189 Type: OFPT_PACKET_IN
715 1.696758912 172.31.31.144 -> 172.31.23.72 TCP 66 6633 → 45438 [ACK] Seq=1833 Ack=1017 Win=853 Len=0 TSval=800607 TSecr=19370732
716 1.696764840 172.31.31.144 -> 172.31.23.72 OpenFlow 187 Type: OFPT_PACKET_OUT
717 1.696855231 172.31.23.72 -> 172.31.31.144 TCP 66 45414 → 6633 [ACK] Seq=493 Ack=727 Win=213 Len=0 TSval=19370732 TSecr=800607
718 1.696916709 172.31.23.72 -> 172.31.31.144 OpenFlow 189 Type: OFPT_PACKET_IN
719 1.697017764 172.31.31.144 -> 172.31.23.72 OpenFlow 187 Type: OFPT_PACKET_OUT
720 1.697022581 172.31.31.144 -> 172.31.23.72 OpenFlow 187 Type: OFPT_PACKET_OUT
721 1.697042842 172.31.23.72 -> 172.31.31.144 OpenFlow 189 Type: OFPT_PACKET_IN
722 1.697125674 172.31.23.72 -> 172.31.31.144 OpenFlow 189 Type: OFPT_PACKET_IN
723 1.697162438 172.31.23.72 -> 172.31.31.144 OpenFlow 189 Type: OFPT_PACKET_IN
724 1.697189946 172.31.23.72 -> 172.31.31.144 OpenFlow 189 Type: OFPT_PACKET_IN
725 1.697230456 172.31.23.72 -> 172.31.31.144 OpenFlow 189 Type: OFPT_PACKET_IN
726 1.697241878 172.31.23.72 -> 172.31.31.144 OpenFlow 189 Type: OFPT_PACKET_IN
727 1.697260362 172.31.23.72 -> 172.31.31.144 OpenFlow 189 Type: OFPT_PACKET_IN
728 1.697271618 172.31.23.72 -> 172.31.31.144 OpenFlow 189 Type: OFPT_PACKET_IN
729 1.697400924 172.31.31.144 -> 172.31.23.72 OpenFlow 187 Type: OFPT_PACKET_OUT
730 1.697470724 172.31.23.72 -> 172.31.31.144 OpenFlow 189 Type: OFPT_PACKET_IN
731 1.697477790 172.31.23.72 -> 172.31.31.144 OpenFlow 189 Type: OFPT_PACKET_IN
732 1.697479539 172.31.23.72 -> 172.31.31.144 OpenFlow 189 Type: OFPT_PACKET_IN
733 1.697481206 172.31.23.72 -> 172.31.31.144 OpenFlow 189 Type: OFPT_PACKET_IN
734 1.697562779 172.31.31.144 -> 172.31.23.72 OpenFlow 187 Type: OFPT_PACKET_OUT
735 1.697569348 172.31.23.72 -> 172.31.31.144 OpenFlow 435 Type: OFPT_PACKET_IN
736 1.697575198 172.31.23.72 -> 172.31.31.144 OpenFlow 189 Type: OFPT_PACKET_IN
737 1.697576995 172.31.23.72 -> 172.31.31.144 OpenFlow 189 Type: OFPT_PACKET_IN
738 1.697589217 172.31.23.72 -> 172.31.31.144 OpenFlow 189 Type: OFPT_PACKET_IN
739 1.697632682 172.31.23.72 -> 172.31.31.144 TCP 66 45454 → 6633 [ACK] Seq=9995 Ack=823 Win=213 Len=0 TSval=19370732 TSecr=800607
740 1.698288513 172.31.31.144 -> 172.31.23.72 TCP 66 6633 → 45456 [ACK] Seq=1065 Ack=8123 Win=853 Len=0 TSval=800607 TSecr=19370732
741 1.698297404 172.31.23.72 -> 172.31.31.144 OpenFlow 189 Type: OFPT_PACKET_IN
742 1.698302631 172.31.31.144 -> 172.31.23.72 OpenFlow 187 Type: OFPT_PACKET_OUT
743 1.698306177 172.31.31.144 -> 172.31.23.72 OpenFlow 187 Type: OFPT_PACKET_OUT
744 1.698308101 172.31.31.144 -> 172.31.23.72 OpenFlow 187 Type: OFPT_PACKET_OUT
745 1.698337248 172.31.31.144 -> 172.31.23.72 OpenFlow 187 Type: OFPT_PACKET_OUT
746 1.698513573 172.31.23.72 -> 172.31.31.144 TCP 66 45454 → 6633 [ACK] Seq=9995 Ack=1065 Win=213 Len=0 TSval=19370733 TSecr=800607
747 1.698629250 172.31.23.72 -> 172.31.31.144 TCP 66 45448 → 6633 [ACK] Seq=10147 Ack=1331 Win=213 Len=0 TSval=19370733 TSecr=800608
748 1.698778155 172.31.23.72 -> 172.31.31.144 OpenFlow 189 Type: OFPT_PACKET_IN
749 1.698810915 172.31.23.72 -> 172.31.31.144 OpenFlow 189 Type: OFPT_PACKET_IN
750 1.698851626 172.31.31.144 -> 172.31.23.72 TCP 66 6633 → 45454 [ACK] Seq=1065 Ack=9872 Win=853 Len=0 TSval=800608 TSecr=19370732
751 1.698857436 172.31.31.144 -> 172.31.23.72 OpenFlow 187 Type: OFPT_PACKET_OUT
752 1.698859754 172.31.31.144 -> 172.31.23.72 OpenFlow 187 Type: OFPT_PACKET_OUT
753 1.698897138 172.31.23.72 -> 172.31.31.144 OpenFlow 189 Type: OFPT_PACKET_IN
754 1.699024341 172.31.23.72 -> 172.31.31.144 OpenFlow 189 Type: OFPT_PACKET_IN
755 1.699098258 172.31.23.72 -> 172.31.31.144 TCP 66 45448 → 6633 [ACK] Seq=10147 Ack=1573 Win=213 Len=0 TSval=19370733 TSecr=800608
756 1.699245814 172.31.23.72 -> 172.31.31.144 OpenFlow 189 Type: OFPT_PACKET_IN
757 1.699683183 172.31.31.144 -> 172.31.23.72 OpenFlow 187 Type: OFPT_PACKET_OUT
758 1.699689961 172.31.31.144 -> 172.31.23.72 OpenFlow 187 Type: OFPT_PACKET_OUT
759 1.699692085 172.31.31.144 -> 172.31.23.72 TCP 66 6633 → 45454 [ACK] Seq=1065 Ack=9995 Win=853 Len=0 TSval=800608 TSecr=19370732
760 1.699695037 172.31.31.144 -> 172.31.23.72 TCP 66 6633 → 45424 [ACK] Seq=1803 Ack=1038 Win=853 Len=0 TSval=800608 TSecr=19370732
761 1.699697287 172.31.31.144 -> 172.31.23.72 TCP 66 6633 → 45452 [ACK] Seq=1065 Ack=9210 Win=853 Len=0 TSval=800608 TSecr=19370732
762 1.699699450 172.31.31.144 -> 172.31.23.72 OpenFlow 187 Type: OFPT_PACKET_OUT
763 1.699701823 172.31.31.144 -> 172.31.23.72 TCP 66 6633 → 45444 [ACK] Seq=1211 Ack=616 Win=853 Len=0 TSval=800608 TSecr=19370732
764 1.699703738 172.31.31.144 -> 172.31.23.72 OpenFlow 187 Type: OFPT_PACKET_OUT
765 1.699705909 172.31.31.144 -> 172.31.23.72 TCP 66 6633 → 45446 [ACK] Seq=2171 Ack=9808 Win=853 Len=0 TSval=800608 TSecr=19370732
766 1.699707758 172.31.31.144 -> 172.31.23.72 OpenFlow 187 Type: OFPT_PACKET_OUT
767 1.699709241 172.31.31.144 -> 172.31.23.72 TCP 66 6633 → 45458 [ACK] Seq=1881 Ack=9440 Win=853 Len=0 TSval=800608 TSecr=19370732
768 1.699711240 172.31.31.144 -> 172.31.23.72 TCP 66 6633 → 45452 [ACK] Seq=1065 Ack=9333 Win=853 Len=0 TSval=800608 TSecr=19370732
769 1.699712886 172.31.31.144 -> 172.31.23.72 TCP 66 6633 → 45424 [ACK] Seq=1803 Ack=1161 Win=853 Len=0 TSval=800608 TSecr=19370732
770 1.699714416 172.31.31.144 -> 172.31.23.72 TCP 66 6633 → 45444 [ACK] Seq=1211 Ack=739 Win=853 Len=0 TSval=800608 TSecr=19370732
771 1.699719359 172.31.31.144 -> 172.31.23.72 OpenFlow 187 Type: OFPT_PACKET_OUT
772 1.699721124 172.31.31.144 -> 172.31.23.72 TCP 66 6633 → 45416 [ACK] Seq=1561 Ack=915 Win=853 Len=0 TSval=800608 TSecr=19370732
773 1.699723181 172.31.31.144 -> 172.31.23.72 OpenFlow 187 Type: OFPT_PACKET_OUT
774 1.699724763 172.31.31.144 -> 172.31.23.72 OpenFlow 187 Type: OFPT_PACKET_OUT
775 1.699726317 172.31.31.144 -> 172.31.23.72 TCP 66 6633 → 45446 [ACK] Seq=2171 Ack=10177 Win=853 Len=0 TSval=800608 TSecr=19370732
776 1.699728017 172.31.31.144 -> 172.31.23.72 TCP 66 6633 → 45460 [ACK] Seq=2559 Ack=9671 Win=853 Len=0 TSval=800608 TSecr=19370732
777 1.699741104 172.31.23.72 -> 172.31.31.144 OpenFlow 189 Type: OFPT_PACKET_IN
778 1.699750133 172.31.31.144 -> 172.31.23.72 TCP 66 6633 → 45456 [ACK] Seq=1065 Ack=8369 Win=853 Len=0 TSval=800608 TSecr=19370732
779 1.699763942 172.31.31.144 -> 172.31.23.72 TCP 66 6633 → 45446 [ACK] Seq=2171 Ack=10300 Win=853 Len=0 TSval=800608 TSecr=19370733
780 1.699950482 172.31.23.72 -> 172.31.31.144 TCP 66 45448 → 6633 [ACK] Seq=10147 Ack=1815 Win=213 Len=0 TSval=19370733 TSecr=800608
781 1.700168633 172.31.31.144 -> 172.31.23.72 TCP 66 6633 → 45444 [ACK] Seq=1211 Ack=862 Win=853 Len=0 TSval=800608 TSecr=19370733
782 1.700174602 172.31.31.144 -> 172.31.23.72 TCP 66 6633 → 45444 [ACK] Seq=1211 Ack=985 Win=853 Len=0 TSval=800608 TSecr=19370733
783 1.700176579 172.31.31.144 -> 172.31.23.72 TCP 66 6633 → 45446 [ACK] Seq=2171 Ack=10423 Win=853 Len=0 TSval=800608 TSecr=19370733
784 1.700178405 172.31.31.144 -> 172.31.23.72 TCP 66 6633 → 45462 [ACK] Seq=1253 Ack=8309 Win=853 Len=0 TSval=800608 TSecr=19370733
785 1.700231170 172.31.23.72 -> 172.31.31.144 TCP 66 45442 → 6633 [ACK] Seq=739 Ack=727 Win=213 Len=0 TSval=19370733 TSecr=800608
786 1.700358661 172.31.23.72 -> 172.31.31.144 OpenFlow 189 Type: OFPT_PACKET_IN
787 1.700386675 172.31.23.72 -> 172.31.31.144 OpenFlow 189 Type: OFPT_PACKET_IN
788 1.700405358 172.31.23.72 -> 172.31.31.144 OpenFlow 189 Type: OFPT_PACKET_IN
789 1.700444125 172.31.23.72 -> 172.31.31.144 OpenFlow 189 Type: OFPT_PACKET_IN
790 1.700775953 172.31.23.72 -> 172.31.31.144 OpenFlow 189 Type: OFPT_PACKET_IN
791 1.700781656 172.31.23.72 -> 172.31.31.144 OpenFlow 189 Type: OFPT_PACKET_IN
792 1.700870342 172.31.23.72 -> 172.31.31.144 OpenFlow 189 Type: OFPT_PACKET_IN
793 1.700874266 172.31.23.72 -> 172.31.31.144 OpenFlow 189 Type: OFPT_PACKET_IN
794 1.701064389 172.31.31.144 -> 172.31.23.72 TCP 66 6633 → 45452 [ACK] Seq=1065 Ack=9456 Win=853 Len=0 TSval=800608 TSecr=19370733
795 1.701363665 172.31.31.144 -> 172.31.23.72 TCP 66 6633 → 45434 [ACK] Seq=1211 Ack=1108 Win=853 Len=0 TSval=800608 TSecr=19370733
796 1.701366187 172.31.31.144 -> 172.31.23.72 TCP 66 6633 → 45444 [ACK] Seq=1211 Ack=1108 Win=853 Len=0 TSval=800608 TSecr=19370733
797 1.701367894 172.31.31.144 -> 172.31.23.72 TCP 66 6633 → 45452 [ACK] Seq=1065 Ack=9579 Win=853 Len=0 TSval=800608 TSecr=19370733
798 1.702745023 172.31.31.144 -> 172.31.23.72 TCP 66 6633 → 45460 [ACK] Seq=2559 Ack=9917 Win=853 Len=0 TSval=800609 TSecr=19370733
799 1.702749838 172.31.31.144 -> 172.31.23.72 TCP 66 6633 → 45444 [ACK] Seq=1211 Ack=1231 Win=853 Len=0 TSval=800609 TSecr=19370733
800 1.702751963 172.31.31.144 -> 172.31.23.72 TCP 66 6633 → 45434 [ACK] Seq=1211 Ack=1231 Win=853 Len=0 TSval=800609 TSecr=19370733
801 1.737193711 172.31.31.144 -> 172.31.23.72 TCP 66 6633 → 45458 [ACK] Seq=1881 Ack=9563 Win=853 Len=0 TSval=800618 TSecr=19370732
802 1.792598385 172.31.31.144 -> 172.31.23.72 OpenFlow 187 Type: OFPT_PACKET_OUT
803 1.792616862 172.31.31.144 -> 172.31.23.72 OpenFlow 187 Type: OFPT_PACKET_OUT
804 1.792625259 172.31.31.144 -> 172.31.23.72 OpenFlow 187 Type: OFPT_PACKET_OUT
805 1.792683889 172.31.31.144 -> 172.31.23.72 OpenFlow 187 Type: OFPT_PACKET_OUT
806 1.792761844 172.31.31.144 -> 172.31.23.72 OpenFlow 187 Type: OFPT_PACKET_OUT
807 1.792856015 172.31.31.144 -> 172.31.23.72 OpenFlow 187 Type: OFPT_PACKET_OUT
808 1.792892377 172.31.31.144 -> 172.31.23.72 OpenFlow 187 Type: OFPT_PACKET_OUT
809 1.792956616 172.31.31.144 -> 172.31.23.72 OpenFlow 187 Type: OFPT_PACKET_OUT
810 1.793013275 172.31.31.144 -> 172.31.23.72 OpenFlow 187 Type: OFPT_PACKET_OUT
811 1.793066080 172.31.31.144 -> 172.31.23.72 OpenFlow 187 Type: OFPT_PACKET_OUT
812 1.793213817 172.31.31.144 -> 172.31.23.72 OpenFlow 187 Type: OFPT_PACKET_OUT
813 1.793266219 172.31.31.144 -> 172.31.23.72 OpenFlow 187 Type: OFPT_PACKET_OUT
814 1.793296853 172.31.23.72 -> 172.31.31.144 TCP 66 45426 → 6633 [ACK] Seq=993 Ack=1427 Win=213 Len=0 TSval=19370756 TSecr=800631
815 1.793344891 172.31.31.144 -> 172.31.23.72 OpenFlow 187 Type: OFPT_PACKET_OUT
816 1.793394375 172.31.31.144 -> 172.31.23.72 OpenFlow 187 Type: OFPT_PACKET_OUT
817 1.793400163 172.31.23.72 -> 172.31.31.144 OpenFlow 189 Type: OFPT_PACKET_IN
818 1.793421125 172.31.23.72 -> 172.31.31.144 OpenFlow 189 Type: OFPT_PACKET_IN
819 1.793463795 172.31.31.144 -> 172.31.23.72 OpenFlow 187 Type: OFPT_PACKET_OUT
820 1.793524793 172.31.31.144 -> 172.31.23.72 OpenFlow 187 Type: OFPT_PACKET_OUT
821 1.793577360 172.31.31.144 -> 172.31.23.72 TCP 66 6633 → 45422 [ACK] Seq=727 Ack=739 Win=853 Len=0 TSval=800632 TSecr=19370756
822 1.793684985 172.31.23.72 -> 172.31.31.144 TCP 66 45422 → 6633 [ACK] Seq=739 Ack=727 Win=213 Len=0 TSval=19370756 TSecr=800632
823 1.793851355 172.31.23.72 -> 172.31.31.144 OpenFlow 189 Type: OFPT_PACKET_IN
824 1.793874315 172.31.23.72 -> 172.31.31.144 OpenFlow 189 Type: OFPT_PACKET_IN
825 1.793887045 172.31.23.72 -> 172.31.31.144 OpenFlow 189 Type: OFPT_PACKET_IN
826 1.793899957 172.31.23.72 -> 172.31.31.144 OpenFlow 189 Type: OFPT_PACKET_IN
827 1.793941961 172.31.23.72 -> 172.31.31.144 OpenFlow 189 Type: OFPT_PACKET_IN
828 1.793950468 172.31.23.72 -> 172.31.31.144 OpenFlow 189 Type: OFPT_PACKET_IN
829 1.793952320 172.31.23.72 -> 172.31.31.144 OpenFlow 435 Type: OFPT_PACKET_IN
830 1.793966546 172.31.23.72 -> 172.31.31.144 OpenFlow 189 Type: OFPT_PACKET_IN
831 1.793971886 172.31.23.72 -> 172.31.31.144 OpenFlow 189 Type: OFPT_PACKET_IN
832 1.794023057 172.31.23.72 -> 172.31.31.144 OpenFlow 189 Type: OFPT_PACKET_IN
833 1.794031741 172.31.23.72 -> 172.31.31.144 OpenFlow 189 Type: OFPT_PACKET_IN
834 1.794071791 172.31.31.144 -> 172.31.23.72 TCP 66 6633 → 45420 [ACK] Seq=2321 Ack=1259 Win=853 Len=0 TSval=800632 TSecr=19370756
835 1.794102598 172.31.23.72 -> 172.31.31.144 OpenFlow 189 Type: OFPT_PACKET_IN
836 1.794122883 172.31.31.144 -> 172.31.23.72 TCP 66 6633 → 45424 [ACK] Seq=1803 Ack=1284 Win=853 Len=0 TSval=800632 TSecr=19370756
837 1.794217603 172.31.31.144 -> 172.31.23.72 TCP 66 6633 → 45430 [ACK] Seq=1915 Ack=1415 Win=853 Len=0 TSval=800632 TSecr=19370756
838 1.794239454 172.31.31.144 -> 172.31.23.72 TCP 66 6633 → 45418 [ACK] Seq=1699 Ack=1161 Win=853 Len=0 TSval=800632 TSecr=19370756
839 1.794268537 172.31.31.144 -> 172.31.23.72 TCP 66 6633 → 45426 [ACK] Seq=1427 Ack=1116 Win=853 Len=0 TSval=800632 TSecr=19370756
840 1.794298086 172.31.31.144 -> 172.31.23.72 TCP 66 6633 → 45428 [ACK] Seq=2079 Ack=1259 Win=853 Len=0 TSval=800632 TSecr=19370756
841 1.794376466 172.31.31.144 -> 172.31.23.72 TCP 66 6633 → 45424 [ACK] Seq=1803 Ack=1407 Win=853 Len=0 TSval=800632 TSecr=19370756
842 1.794491285 172.31.31.144 -> 172.31.23.72 TCP 66 6633 → 45426 [ACK] Seq=1427 Ack=1239 Win=853 Len=0 TSval=800632 TSecr=19370756
