  1 0.000000000 41.177.127.217 -> 172.31.24.227 TCP 54 58416 → 22 [ACK] Seq=1 Ack=1 Win=32600 Len=0
  2 0.002171794 41.177.127.217 -> 172.31.24.227 TCP 54 58416 → 22 [ACK] Seq=1 Ack=297 Win=32452 Len=0
  3 0.077216491 41.177.127.217 -> 172.31.24.227 TCP 54 58416 → 22 [ACK] Seq=1 Ack=333 Win=32434 Len=0
  4 0.112190484 41.177.127.217 -> 172.31.24.227 TCP 54 58416 → 22 [ACK] Seq=1 Ack=429 Win=32386 Len=0
  5 0.130559669 172.31.31.144 -> 172.31.24.227 TCP 90 6633 → 39486 [PSH, ACK] Seq=1 Ack=1 Win=853 Len=24 TSval=379154 TSecr=118939227
  6 0.131107941 172.31.24.227 -> 172.31.31.144 OpenFlow 642 Type: OFPT_MULTIPART_REPLY, OFPMP_PORT_STATS
  7 0.131415914 172.31.31.144 -> 172.31.24.227 TCP 66 6633 → 39486 [ACK] Seq=25 Ack=577 Win=853 Len=0 TSval=379155 TSecr=118939765
  8 0.133774800 172.31.31.144 -> 172.31.24.227 OpenFlow 122 Type: OFPT_MULTIPART_REQUEST, OFPMP_FLOW
  9 0.133806329 172.31.31.144 -> 172.31.24.227 OpenFlow 82 Type: OFPT_MULTIPART_REQUEST, OFPMP_TABLE
 10 0.133986583 172.31.24.227 -> 172.31.31.144 OpenFlow 2010 Type: OFPT_MULTIPART_REPLY, OFPMP_FLOW
 11 0.134157086 172.31.24.227 -> 172.31.31.144 OpenFlow 6178 Type: OFPT_MULTIPART_REPLY, OFPMP_TABLE
 12 0.134422457 172.31.31.144 -> 172.31.24.227 TCP 66 6633 → 39486 [ACK] Seq=97 Ack=8633 Win=853 Len=0 TSval=379155 TSecr=118939765
 13 0.145012406 172.31.31.144 -> 172.31.24.227 TCP 90 6633 → 39490 [PSH, ACK] Seq=1 Ack=1 Win=853 Len=24 TSval=379158 TSecr=118939228
 14 0.145242971 172.31.24.227 -> 172.31.31.144 OpenFlow 754 Type: OFPT_MULTIPART_REPLY, OFPMP_PORT_STATS
 15 0.145560216 172.31.31.144 -> 172.31.24.227 TCP 66 6633 → 39490 [ACK] Seq=25 Ack=689 Win=853 Len=0 TSval=379158 TSecr=118939768
 16 0.149163582 172.31.31.144 -> 172.31.24.227 OpenFlow 122 Type: OFPT_MULTIPART_REQUEST, OFPMP_FLOW
 17 0.149341790 172.31.24.227 -> 172.31.31.144 OpenFlow 1386 Type: OFPT_MULTIPART_REPLY, OFPMP_FLOW
 18 0.150359989 172.31.31.144 -> 172.31.24.227 OpenFlow 82 Type: OFPT_MULTIPART_REQUEST, OFPMP_TABLE
 19 0.150645056 172.31.24.227 -> 172.31.31.144 OpenFlow 6178 Type: OFPT_MULTIPART_REPLY, OFPMP_TABLE
 20 0.153573381 172.31.31.144 -> 172.31.24.227 TCP 90 6633 → 39492 [PSH, ACK] Seq=1 Ack=1 Win=853 Len=24 TSval=379160 TSecr=118939228
 21 0.153589917 172.31.31.144 -> 172.31.24.227 TCP 122 6633 → 39492 [PSH, ACK] Seq=25 Ack=1 Win=853 Len=56 TSval=379160 TSecr=118939228
 22 0.153817366 172.31.24.227 -> 172.31.31.144 OpenFlow 754 Type: OFPT_MULTIPART_REPLY, OFPMP_PORT_STATS
 23 0.153873664 172.31.24.227 -> 172.31.31.144 OpenFlow 1386 Type: OFPT_MULTIPART_REPLY, OFPMP_FLOW
 24 0.154082929 172.31.31.144 -> 172.31.24.227 TCP 66 6633 → 39492 [ACK] Seq=81 Ack=689 Win=853 Len=0 TSval=379160 TSecr=118939770
 25 0.154098328 172.31.31.144 -> 172.31.24.227 TCP 66 6633 → 39492 [ACK] Seq=81 Ack=2009 Win=853 Len=0 TSval=379160 TSecr=118939770
 26 0.154729840 172.31.31.144 -> 172.31.24.227 OpenFlow 82 Type: OFPT_MULTIPART_REQUEST, OFPMP_TABLE
 27 0.155031318 172.31.24.227 -> 172.31.31.144 OpenFlow 6178 Type: OFPT_MULTIPART_REPLY, OFPMP_TABLE
 28 0.158943083 172.31.31.144 -> 172.31.24.227 TCP 90 6633 → 39458 [PSH, ACK] Seq=1 Ack=1 Win=853 Len=24 TSval=379162 TSecr=118939227
 29 0.158999031 172.31.31.144 -> 172.31.24.227 TCP 122 6633 → 39458 [PSH, ACK] Seq=25 Ack=1 Win=853 Len=56 TSval=379162 TSecr=118939227
 30 0.159192029 172.31.24.227 -> 172.31.31.144 OpenFlow 1314 Type: OFPT_MULTIPART_REPLY, OFPMP_PORT_STATS
 31 0.159278821 172.31.24.227 -> 172.31.31.144 OpenFlow 3258 Type: OFPT_MULTIPART_REPLY, OFPMP_FLOW
 32 0.159484094 172.31.31.144 -> 172.31.24.227 TCP 66 6633 → 39458 [ACK] Seq=81 Ack=1249 Win=853 Len=0 TSval=379162 TSecr=118939772
 33 0.159508316 172.31.31.144 -> 172.31.24.227 TCP 66 6633 → 39458 [ACK] Seq=81 Ack=4441 Win=853 Len=0 TSval=379162 TSecr=118939772
 34 0.160120292 172.31.31.144 -> 172.31.24.227 OpenFlow 82 Type: OFPT_MULTIPART_REQUEST, OFPMP_TABLE
 35 0.160332025 172.31.24.227 -> 172.31.31.144 OpenFlow 6178 Type: OFPT_MULTIPART_REPLY, OFPMP_TABLE
 36 0.163315663 172.31.31.144 -> 172.31.24.227 TCP 122 6633 → 39476 [PSH, ACK] Seq=1 Ack=1 Win=853 Len=56 TSval=379163 TSecr=118939226
 37 0.163364457 172.31.31.144 -> 172.31.24.227 TCP 90 6633 → 39476 [PSH, ACK] Seq=57 Ack=1 Win=853 Len=24 TSval=379163 TSecr=118939226
 38 0.163492069 172.31.24.227 -> 172.31.31.144 OpenFlow 2010 Type: OFPT_MULTIPART_REPLY, OFPMP_FLOW
 39 0.163573516 172.31.24.227 -> 172.31.31.144 OpenFlow 530 Type: OFPT_MULTIPART_REPLY, OFPMP_PORT_STATS
 40 0.163850611 172.31.31.144 -> 172.31.24.227 TCP 66 6633 → 39476 [ACK] Seq=81 Ack=2409 Win=853 Len=0 TSval=379163 TSecr=118939773
 41 0.164513519 172.31.31.144 -> 172.31.24.227 OpenFlow 82 Type: OFPT_MULTIPART_REQUEST, OFPMP_TABLE
 42 0.164755343 172.31.24.227 -> 172.31.31.144 OpenFlow 6178 Type: OFPT_MULTIPART_REPLY, OFPMP_TABLE
 43 0.169719978 172.31.31.144 -> 172.31.24.227 TCP 122 6633 → 39452 [PSH, ACK] Seq=1 Ack=1 Win=853 Len=56 TSval=379164 TSecr=118939228
 44 0.169782431 172.31.31.144 -> 172.31.24.227 TCP 90 6633 → 39452 [PSH, ACK] Seq=57 Ack=1 Win=853 Len=24 TSval=379164 TSecr=118939228
 45 0.169872073 172.31.24.227 -> 172.31.31.144 OpenFlow 3050 Type: OFPT_MULTIPART_REPLY, OFPMP_FLOW
 46 0.169989588 172.31.24.227 -> 172.31.31.144 OpenFlow 866 Type: OFPT_MULTIPART_REPLY, OFPMP_PORT_STATS
 47 0.170190585 172.31.31.144 -> 172.31.24.227 TCP 66 6633 → 39452 [ACK] Seq=81 Ack=2985 Win=853 Len=0 TSval=379164 TSecr=118939774
 48 0.170269028 172.31.31.144 -> 172.31.24.227 TCP 66 6633 → 39452 [ACK] Seq=81 Ack=3785 Win=853 Len=0 TSval=379164 TSecr=118939774
 49 0.170844129 172.31.31.144 -> 172.31.24.227 OpenFlow 82 Type: OFPT_MULTIPART_REQUEST, OFPMP_TABLE
 50 0.171075552 172.31.24.227 -> 172.31.31.144 OpenFlow 6178 Type: OFPT_MULTIPART_REPLY, OFPMP_TABLE
 51 0.173094336 172.31.31.144 -> 172.31.24.227 TCP 90 6633 → 39480 [PSH, ACK] Seq=1 Ack=1 Win=853 Len=24 TSval=379165 TSecr=118939229
 52 0.173148812 172.31.31.144 -> 172.31.24.227 TCP 122 6633 → 39480 [PSH, ACK] Seq=25 Ack=1 Win=853 Len=56 TSval=379165 TSecr=118939229
 53 0.173325965 172.31.24.227 -> 172.31.31.144 OpenFlow 866 Type: OFPT_MULTIPART_REPLY, OFPMP_PORT_STATS
 54 0.173377503 172.31.24.227 -> 172.31.31.144 OpenFlow 1178 Type: OFPT_MULTIPART_REPLY, OFPMP_FLOW
 55 0.173592233 172.31.31.144 -> 172.31.24.227 TCP 66 6633 → 39480 [ACK] Seq=81 Ack=801 Win=853 Len=0 TSval=379165 TSecr=118939775
 56 0.173616537 172.31.31.144 -> 172.31.24.227 TCP 66 6633 → 39480 [ACK] Seq=81 Ack=1913 Win=853 Len=0 TSval=379165 TSecr=118939775
 57 0.174332558 172.31.31.144 -> 172.31.24.227 OpenFlow 82 Type: OFPT_MULTIPART_REQUEST, OFPMP_TABLE
 58 0.174581444 172.31.24.227 -> 172.31.31.144 OpenFlow 6178 Type: OFPT_MULTIPART_REPLY, OFPMP_TABLE
 59 0.182558093 172.31.31.144 -> 172.31.24.227 TCP 122 6633 → 39464 [PSH, ACK] Seq=1 Ack=1 Win=853 Len=56 TSval=379167 TSecr=118939229
 60 0.182591147 172.31.31.144 -> 172.31.24.227 TCP 90 6633 → 39464 [PSH, ACK] Seq=57 Ack=1 Win=853 Len=24 TSval=379167 TSecr=118939229
 61 0.182714919 172.31.24.227 -> 172.31.31.144 OpenFlow 2010 Type: OFPT_MULTIPART_REPLY, OFPMP_FLOW
 62 0.182882246 172.31.24.227 -> 172.31.31.144 OpenFlow 978 Type: OFPT_MULTIPART_REPLY, OFPMP_PORT_STATS
 63 0.183174990 172.31.31.144 -> 172.31.24.227 TCP 66 6633 → 39464 [ACK] Seq=81 Ack=2857 Win=853 Len=0 TSval=379168 TSecr=118939777
 64 0.183682844 172.31.31.144 -> 172.31.24.227 OpenFlow 82 Type: OFPT_MULTIPART_REQUEST, OFPMP_TABLE
 65 0.183909647 172.31.24.227 -> 172.31.31.144 OpenFlow 6178 Type: OFPT_MULTIPART_REPLY, OFPMP_TABLE
 66 0.186888518 172.31.31.144 -> 172.31.24.227 TCP 90 6633 → 39482 [PSH, ACK] Seq=1 Ack=1 Win=853 Len=24 TSval=379169 TSecr=118939229
 67 0.186947057 172.31.31.144 -> 172.31.24.227 TCP 138 6633 → 39482 [PSH, ACK] Seq=25 Ack=1 Win=853 Len=72 TSval=379169 TSecr=118939229
 68 0.187127278 172.31.24.227 -> 172.31.31.144 OpenFlow 978 Type: OFPT_MULTIPART_REPLY, OFPMP_PORT_STATS
 69 0.187176102 172.31.24.227 -> 172.31.31.144 OpenFlow 970 Type: OFPT_MULTIPART_REPLY, OFPMP_FLOW
 70 0.187315414 172.31.24.227 -> 172.31.31.144 OpenFlow 6178 Type: OFPT_MULTIPART_REPLY, OFPMP_TABLE
 71 0.187510547 172.31.31.144 -> 172.31.24.227 TCP 66 6633 → 39482 [ACK] Seq=97 Ack=1817 Win=853 Len=0 TSval=379169 TSecr=118939779
 72 0.190120904 172.31.31.144 -> 172.31.24.227 TCP 90 6633 → 39446 [PSH, ACK] Seq=1 Ack=1 Win=853 Len=24 TSval=379169 TSecr=118939229
 73 0.190163178 172.31.31.144 -> 172.31.24.227 TCP 122 6633 → 39446 [PSH, ACK] Seq=25 Ack=1 Win=853 Len=56 TSval=379169 TSecr=118939229
 74 0.190328953 172.31.24.227 -> 172.31.31.144 OpenFlow 1090 Type: OFPT_MULTIPART_REPLY, OFPMP_PORT_STATS
 75 0.190391687 172.31.24.227 -> 172.31.31.144 OpenFlow 1178 Type: OFPT_MULTIPART_REPLY, OFPMP_FLOW
 76 0.190676251 172.31.31.144 -> 172.31.24.227 TCP 66 6633 → 39446 [ACK] Seq=81 Ack=1025 Win=853 Len=0 TSval=379170 TSecr=118939779
 77 0.190692996 172.31.31.144 -> 172.31.24.227 TCP 66 6633 → 39446 [ACK] Seq=81 Ack=2137 Win=853 Len=0 TSval=379170 TSecr=118939779
 78 0.190720732 172.31.31.144 -> 172.31.24.227 TCP 66 6633 → 39490 [ACK] Seq=97 Ack=8121 Win=853 Len=0 TSval=379170 TSecr=118939769
 79 0.192318033 172.31.31.144 -> 172.31.24.227 TCP 90 6633 → 39484 [PSH, ACK] Seq=1 Ack=1 Win=853 Len=24 TSval=379170 TSecr=118939389
 80 0.192333797 172.31.31.144 -> 172.31.24.227 OpenFlow 82 Type: OFPT_MULTIPART_REQUEST, OFPMP_TABLE
 81 0.192491839 172.31.24.227 -> 172.31.31.144 OpenFlow 6178 Type: OFPT_MULTIPART_REPLY, OFPMP_TABLE
 82 0.192714343 172.31.24.227 -> 172.31.31.144 OpenFlow 1090 Type: OFPT_MULTIPART_REPLY, OFPMP_PORT_STATS
 83 0.193452420 172.31.31.144 -> 172.31.24.227 OpenFlow 122 Type: OFPT_MULTIPART_REQUEST, OFPMP_FLOW
 84 0.193633707 172.31.24.227 -> 172.31.31.144 OpenFlow 1386 Type: OFPT_MULTIPART_REPLY, OFPMP_FLOW
 85 0.194628480 172.31.31.144 -> 172.31.24.227 OpenFlow 82 Type: OFPT_MULTIPART_REQUEST, OFPMP_TABLE
 86 0.194688382 172.31.31.144 -> 172.31.24.227 TCP 66 6633 → 39492 [ACK] Seq=97 Ack=8121 Win=853 Len=0 TSval=379171 TSecr=118939771
 87 0.194895960 172.31.24.227 -> 172.31.31.144 OpenFlow 6178 Type: OFPT_MULTIPART_REPLY, OFPMP_TABLE
 88 0.198682403 172.31.31.144 -> 172.31.24.227 TCP 66 6633 → 39458 [ACK] Seq=97 Ack=10553 Win=853 Len=0 TSval=379172 TSecr=118939772
 89 0.202717581 172.31.31.144 -> 172.31.24.227 TCP 66 6633 → 39476 [ACK] Seq=97 Ack=8521 Win=853 Len=0 TSval=379173 TSecr=118939773
 90 0.204872635 172.31.31.144 -> 172.31.24.227 TCP 122 6633 → 39462 [PSH, ACK] Seq=1 Ack=1 Win=853 Len=56 TSval=379173 TSecr=118939229
 91 0.204928264 172.31.31.144 -> 172.31.24.227 TCP 106 6633 → 39462 [PSH, ACK] Seq=57 Ack=1 Win=853 Len=40 TSval=379173 TSecr=118939229
 92 0.205010840 172.31.24.227 -> 172.31.31.144 OpenFlow 762 Type: OFPT_MULTIPART_REPLY, OFPMP_FLOW
 93 0.205142883 172.31.24.227 -> 172.31.31.144 OpenFlow 866 Type: OFPT_MULTIPART_REPLY, OFPMP_PORT_STATS
 94 0.205289420 172.31.24.227 -> 172.31.31.144 OpenFlow 6178 Type: OFPT_MULTIPART_REPLY, OFPMP_TABLE
 95 0.205366537 172.31.31.144 -> 172.31.24.227 TCP 66 6633 → 39462 [ACK] Seq=97 Ack=697 Win=853 Len=0 TSval=379173 TSecr=118939783
 96 0.205371554 172.31.31.144 -> 172.31.24.227 TCP 66 6633 → 39462 [ACK] Seq=97 Ack=1497 Win=853 Len=0 TSval=379173 TSecr=118939783
 97 0.205552658 172.31.31.144 -> 172.31.24.227 TCP 66 6633 → 39462 [ACK] Seq=97 Ack=7609 Win=853 Len=0 TSval=379173 TSecr=118939783
 98 0.206041221 172.31.31.144 -> 172.31.24.227 TCP 90 6633 → 39478 [PSH, ACK] Seq=1 Ack=1 Win=853 Len=24 TSval=379173 TSecr=118939229
 99 0.206254146 172.31.24.227 -> 172.31.31.144 ESP 754 ESP (SPI=0x041302b0)
100 0.207231829 172.31.31.144 -> 172.31.24.227 TCP 122 6633 → 39478 [PSH, ACK] Seq=25 Ack=689 Win=853 Len=56 TSval=379174 TSecr=118939783
101 0.207255558 172.31.31.144 -> 172.31.24.227 TCP 82 6633 → 39478 [PSH, ACK] Seq=81 Ack=689 Win=853 Len=16 TSval=379174 TSecr=118939783
102 0.207401518 172.31.24.227 -> 172.31.31.144 OpenFlow 1178 Type: OFPT_MULTIPART_REPLY, OFPMP_FLOW
103 0.207555984 172.31.24.227 -> 172.31.31.144 OpenFlow 6178 Type: OFPT_MULTIPART_REPLY, OFPMP_TABLE
104 0.207852043 172.31.31.144 -> 172.31.24.227 TCP 66 6633 → 39478 [ACK] Seq=97 Ack=7913 Win=853 Len=0 TSval=379174 TSecr=118939784
105 0.210467080 172.31.31.144 -> 172.31.24.227 TCP 90 6633 → 39450 [PSH, ACK] Seq=1 Ack=1 Win=853 Len=24 TSval=379174 TSecr=118939228
106 0.210648303 172.31.31.144 -> 172.31.24.227 TCP 66 6633 → 39452 [ACK] Seq=97 Ack=9897 Win=853 Len=0 TSval=379175 TSecr=118939775
107 0.210655107 172.31.24.227 -> 172.31.31.144 OpenFlow 1090 Type: OFPT_MULTIPART_REPLY, OFPMP_PORT_STATS
108 0.211650376 172.31.31.144 -> 172.31.24.227 TCP 122 6633 → 39448 [PSH, ACK] Seq=1 Ack=1 Win=853 Len=56 TSval=379175 TSecr=118939229
109 0.211672179 172.31.31.144 -> 172.31.24.227 OpenFlow 122 Type: OFPT_MULTIPART_REQUEST, OFPMP_FLOW
110 0.211703344 172.31.31.144 -> 172.31.24.227 TCP 90 6633 → 39448 [PSH, ACK] Seq=57 Ack=1 Win=853 Len=24 TSval=379175 TSecr=118939229
111 0.211746664 172.31.24.227 -> 172.31.31.144 OpenFlow 970 Type: OFPT_MULTIPART_REPLY, OFPMP_FLOW
112 0.211861978 172.31.24.227 -> 172.31.31.144 OpenFlow 754 Type: OFPT_MULTIPART_REPLY, OFPMP_PORT_STATS
113 0.211914275 172.31.24.227 -> 172.31.31.144 OpenFlow 762 Type: OFPT_MULTIPART_REPLY, OFPMP_FLOW
114 0.212033900 172.31.31.144 -> 172.31.24.227 TCP 66 6633 → 39448 [ACK] Seq=81 Ack=905 Win=853 Len=0 TSval=379175 TSecr=118939785
115 0.212137574 172.31.31.144 -> 172.31.24.227 TCP 66 6633 → 39448 [ACK] Seq=81 Ack=1593 Win=853 Len=0 TSval=379175 TSecr=118939785
116 0.212875021 172.31.31.144 -> 172.31.24.227 OpenFlow 82 Type: OFPT_MULTIPART_REQUEST, OFPMP_TABLE
117 0.213059345 172.31.24.227 -> 172.31.31.144 OpenFlow 6178 Type: OFPT_MULTIPART_REPLY, OFPMP_TABLE
118 0.214065880 172.31.31.144 -> 172.31.24.227 OpenFlow 82 Type: OFPT_MULTIPART_REQUEST, OFPMP_TABLE
119 0.214242718 172.31.24.227 -> 172.31.31.144 OpenFlow 6178 Type: OFPT_MULTIPART_REPLY, OFPMP_TABLE
120 0.214667338 172.31.31.144 -> 172.31.24.227 TCP 66 6633 → 39480 [ACK] Seq=97 Ack=8025 Win=853 Len=0 TSval=379176 TSecr=118939775
121 0.216285658 172.31.31.144 -> 172.31.24.227 TCP 90 6633 → 39454 [PSH, ACK] Seq=1 Ack=1 Win=853 Len=24 TSval=379176 TSecr=118939392
122 0.216452990 172.31.24.227 -> 172.31.31.144 OpenFlow 866 Type: OFPT_MULTIPART_REPLY, OFPMP_PORT_STATS
123 0.217461188 172.31.31.144 -> 172.31.24.227 OpenFlow 122 Type: OFPT_MULTIPART_REQUEST, OFPMP_FLOW
124 0.217485974 172.31.31.144 -> 172.31.24.227 OpenFlow 82 Type: OFPT_MULTIPART_REQUEST, OFPMP_TABLE
125 0.217565932 172.31.24.227 -> 172.31.31.144 OpenFlow 1178 Type: OFPT_MULTIPART_REPLY, OFPMP_FLOW
126 0.217711548 172.31.24.227 -> 172.31.31.144 OpenFlow 6178 Type: OFPT_MULTIPART_REPLY, OFPMP_TABLE
127 0.218005737 172.31.31.144 -> 172.31.24.227 TCP 66 6633 → 39454 [ACK] Seq=97 Ack=8025 Win=853 Len=0 TSval=379176 TSecr=118939786
128 0.220669390 172.31.31.144 -> 172.31.24.227 TCP 122 6633 → 39474 [PSH, ACK] Seq=1 Ack=1 Win=853 Len=56 TSval=379177 TSecr=118939229
129 0.220693691 172.31.31.144 -> 172.31.24.227 TCP 122 6633 → 39470 [PSH, ACK] Seq=1 Ack=1 Win=853 Len=56 TSval=379177 TSecr=118939227
130 0.220722777 172.31.31.144 -> 172.31.24.227 TCP 90 6633 → 39474 [PSH, ACK] Seq=57 Ack=1 Win=853 Len=24 TSval=379177 TSecr=118939229
131 0.220751617 172.31.31.144 -> 172.31.24.227 TCP 90 6633 → 39470 [PSH, ACK] Seq=57 Ack=1 Win=853 Len=24 TSval=379177 TSecr=118939227
132 0.220854380 172.31.24.227 -> 172.31.31.144 OpenFlow 2842 Type: OFPT_MULTIPART_REPLY, OFPMP_FLOW
133 0.220956365 172.31.24.227 -> 172.31.31.144 OpenFlow 754 Type: OFPT_MULTIPART_REPLY, OFPMP_PORT_STATS
134 0.221033282 172.31.24.227 -> 172.31.31.144 OpenFlow 2218 Type: OFPT_MULTIPART_REPLY, OFPMP_FLOW
135 0.221144638 172.31.31.144 -> 172.31.24.227 TCP 66 6633 → 39470 [ACK] Seq=81 Ack=2777 Win=853 Len=0 TSval=379177 TSecr=118939787
136 0.221161328 172.31.24.227 -> 172.31.31.144 OpenFlow 978 Type: OFPT_MULTIPART_REPLY, OFPMP_PORT_STATS
137 0.221171470 172.31.31.144 -> 172.31.24.227 TCP 66 6633 → 39470 [ACK] Seq=81 Ack=3465 Win=853 Len=0 TSval=379177 TSecr=118939787
138 0.221295358 172.31.31.144 -> 172.31.24.227 TCP 66 6633 → 39474 [ACK] Seq=81 Ack=2153 Win=853 Len=0 TSval=379177 TSecr=118939787
139 0.221400455 172.31.31.144 -> 172.31.24.227 TCP 66 6633 → 39474 [ACK] Seq=81 Ack=3065 Win=853 Len=0 TSval=379177 TSecr=118939787
140 0.221881913 172.31.31.144 -> 172.31.24.227 OpenFlow 82 Type: OFPT_MULTIPART_REQUEST, OFPMP_TABLE
141 0.221899767 172.31.31.144 -> 172.31.24.227 OpenFlow 82 Type: OFPT_MULTIPART_REQUEST, OFPMP_TABLE
142 0.222105035 172.31.24.227 -> 172.31.31.144 OpenFlow 6178 Type: OFPT_MULTIPART_REPLY, OFPMP_TABLE
143 0.222261081 172.31.24.227 -> 172.31.31.144 OpenFlow 6178 Type: OFPT_MULTIPART_REPLY, OFPMP_TABLE
144 0.222700284 172.31.31.144 -> 172.31.24.227 TCP 66 6633 → 39464 [ACK] Seq=97 Ack=8969 Win=853 Len=0 TSval=379178 TSecr=118939778
145 0.226695534 172.31.31.144 -> 172.31.24.227 TCP 66 6633 → 39482 [ACK] Seq=97 Ack=7929 Win=853 Len=0 TSval=379179 TSecr=118939779
146 0.230713129 172.31.31.144 -> 172.31.24.227 TCP 66 6633 → 39446 [ACK] Seq=97 Ack=8249 Win=853 Len=0 TSval=379180 TSecr=118939780
147 0.233119193 172.31.31.144 -> 172.31.24.227 TCP 122 6633 → 39488 [PSH, ACK] Seq=1 Ack=1 Win=853 Len=56 TSval=379180 TSecr=118939228
148 0.233133576 172.31.31.144 -> 172.31.24.227 TCP 90 6633 → 39468 [PSH, ACK] Seq=1 Ack=1 Win=853 Len=24 TSval=379180 TSecr=118939229
149 0.233175504 172.31.31.144 -> 172.31.24.227 TCP 90 6633 → 39488 [PSH, ACK] Seq=57 Ack=1 Win=853 Len=24 TSval=379180 TSecr=118939228
150 0.233365898 172.31.24.227 -> 172.31.31.144 OpenFlow 978 Type: OFPT_MULTIPART_REPLY, OFPMP_PORT_STATS
151 0.233497518 172.31.24.227 -> 172.31.31.144 OpenFlow 2842 Type: OFPT_MULTIPART_REPLY, OFPMP_FLOW
152 0.233577075 172.31.24.227 -> 172.31.31.144 OpenFlow 642 Type: OFPT_MULTIPART_REPLY, OFPMP_PORT_STATS
153 0.233701270 172.31.31.144 -> 172.31.24.227 TCP 66 6633 → 39468 [ACK] Seq=25 Ack=913 Win=853 Len=0 TSval=379180 TSecr=118939790
154 0.233856431 172.31.31.144 -> 172.31.24.227 TCP 66 6633 → 39488 [ACK] Seq=81 Ack=2777 Win=853 Len=0 TSval=379180 TSecr=118939790
155 0.233875735 172.31.31.144 -> 172.31.24.227 TCP 66 6633 → 39488 [ACK] Seq=81 Ack=3353 Win=853 Len=0 TSval=379180 TSecr=118939790
156 0.234282836 172.31.31.144 -> 172.31.24.227 OpenFlow 82 Type: OFPT_MULTIPART_REQUEST, OFPMP_TABLE
157 0.234509018 172.31.24.227 -> 172.31.31.144 OpenFlow 6178 Type: OFPT_MULTIPART_REPLY, OFPMP_TABLE
158 0.234727137 172.31.31.144 -> 172.31.24.227 TCP 66 6633 → 39484 [ACK] Seq=97 Ack=8457 Win=853 Len=0 TSval=379181 TSecr=118939781
159 0.236539674 172.31.31.144 -> 172.31.24.227 OpenFlow 122 Type: OFPT_MULTIPART_REQUEST, OFPMP_FLOW
160 0.236690656 172.31.24.227 -> 172.31.31.144 OpenFlow 2426 Type: OFPT_MULTIPART_REPLY, OFPMP_FLOW
161 0.240741548 172.31.31.144 -> 172.31.24.227 OpenFlow 82 Type: OFPT_MULTIPART_REQUEST, OFPMP_TABLE
162 0.240992410 172.31.24.227 -> 172.31.31.144 OpenFlow 6178 Type: OFPT_MULTIPART_REPLY, OFPMP_TABLE
163 0.243931142 172.31.31.144 -> 172.31.24.227 TCP 122 6633 → 39460 [PSH, ACK] Seq=1 Ack=1 Win=853 Len=56 TSval=379183 TSecr=118939228
164 0.243941743 172.31.31.144 -> 172.31.24.227 TCP 90 6633 → 39456 [PSH, ACK] Seq=1 Ack=1 Win=853 Len=24 TSval=379183 TSecr=118939228
165 0.243984480 172.31.31.144 -> 172.31.24.227 TCP 138 6633 → 39456 [PSH, ACK] Seq=25 Ack=1 Win=853 Len=72 TSval=379183 TSecr=118939228
166 0.243997750 172.31.31.144 -> 172.31.24.227 TCP 106 6633 → 39460 [PSH, ACK] Seq=57 Ack=1 Win=853 Len=40 TSval=379183 TSecr=118939228
167 0.244128569 172.31.24.227 -> 172.31.31.144 OpenFlow 866 Type: OFPT_MULTIPART_REPLY, OFPMP_PORT_STATS
168 0.244290462 172.31.24.227 -> 172.31.31.144 OpenFlow 6178 Type: OFPT_MULTIPART_REPLY, OFPMP_TABLE
169 0.244342083 172.31.24.227 -> 172.31.31.144 OpenFlow 1386 Type: OFPT_MULTIPART_REPLY, OFPMP_FLOW
170 0.244419107 172.31.24.227 -> 172.31.31.144 OpenFlow 2218 Type: OFPT_MULTIPART_REPLY, OFPMP_FLOW
171 0.244503507 172.31.31.144 -> 172.31.24.227 TCP 66 6633 → 39456 [ACK] Seq=97 Ack=801 Win=853 Len=0 TSval=379183 TSecr=118939793
172 0.244572510 172.31.24.227 -> 172.31.31.144 OpenFlow 6178 Type: OFPT_MULTIPART_REPLY, OFPMP_TABLE
173 0.244598332 172.31.31.144 -> 172.31.24.227 TCP 66 6633 → 39456 [ACK] Seq=97 Ack=6913 Win=853 Len=0 TSval=379183 TSecr=118939793
174 0.244665565 172.31.31.144 -> 172.31.24.227 TCP 66 6633 → 39456 [ACK] Seq=97 Ack=8233 Win=853 Len=0 TSval=379183 TSecr=118939793
175 0.244676678 172.31.24.227 -> 172.31.31.144 OpenFlow 642 Type: OFPT_MULTIPART_REPLY, OFPMP_PORT_STATS
176 0.244697970 172.31.31.144 -> 172.31.24.227 TCP 66 6633 → 39460 [ACK] Seq=97 Ack=2153 Win=853 Len=0 TSval=379183 TSecr=118939793
177 0.244861594 172.31.31.144 -> 172.31.24.227 TCP 66 6633 → 39460 [ACK] Seq=97 Ack=8265 Win=853 Len=0 TSval=379183 TSecr=118939793
178 0.244921325 172.31.31.144 -> 172.31.24.227 TCP 66 6633 → 39460 [ACK] Seq=97 Ack=8841 Win=853 Len=0 TSval=379183 TSecr=118939793
179 0.245104100 172.31.31.144 -> 172.31.24.227 TCP 90 6633 → 39472 [PSH, ACK] Seq=1 Ack=1 Win=853 Len=24 TSval=379183 TSecr=118939229
180 0.245189625 172.31.31.144 -> 172.31.24.227 TCP 138 6633 → 39472 [PSH, ACK] Seq=25 Ack=1 Win=853 Len=72 TSval=379183 TSecr=118939229
181 0.245285173 172.31.24.227 -> 172.31.31.144 OpenFlow 642 Type: OFPT_MULTIPART_REPLY, OFPMP_PORT_STATS
182 0.245359095 172.31.24.227 -> 172.31.31.144 OpenFlow 2634 Type: OFPT_MULTIPART_REPLY, OFPMP_FLOW
183 0.245502209 172.31.24.227 -> 172.31.31.144 OpenFlow 6178 Type: OFPT_MULTIPART_REPLY, OFPMP_TABLE
184 0.245525879 172.31.31.144 -> 172.31.24.227 TCP 66 6633 → 39472 [ACK] Seq=97 Ack=577 Win=853 Len=0 TSval=379183 TSecr=118939793
185 0.245580174 172.31.31.144 -> 172.31.24.227 TCP 66 6633 → 39472 [ACK] Seq=97 Ack=3145 Win=853 Len=0 TSval=379183 TSecr=118939793
186 0.245783190 172.31.31.144 -> 172.31.24.227 TCP 66 6633 → 39472 [ACK] Seq=97 Ack=9257 Win=853 Len=0 TSval=379183 TSecr=118939793
187 0.249288290 172.31.31.144 -> 172.31.24.227 TCP 90 6633 → 39466 [PSH, ACK] Seq=1 Ack=1 Win=853 Len=24 TSval=379184 TSecr=118939227
188 0.249516372 172.31.24.227 -> 172.31.31.144 OpenFlow 1202 Type: OFPT_MULTIPART_REPLY, OFPMP_PORT_STATS
189 0.249824801 172.31.31.144 -> 172.31.24.227 TCP 66 6633 → 39466 [ACK] Seq=25 Ack=1137 Win=853 Len=0 TSval=379184 TSecr=118939794
190 0.250426122 172.31.31.144 -> 172.31.24.227 OpenFlow 122 Type: OFPT_MULTIPART_REQUEST, OFPMP_FLOW
191 0.250452495 172.31.31.144 -> 172.31.24.227 OpenFlow 82 Type: OFPT_MULTIPART_REQUEST, OFPMP_TABLE
192 0.250589248 172.31.24.227 -> 172.31.31.144 OpenFlow 3466 Type: OFPT_MULTIPART_REPLY, OFPMP_FLOW
193 0.250608521 172.31.31.144 -> 172.31.24.227 TCP 66 6633 → 39448 [ACK] Seq=97 Ack=7705 Win=853 Len=0 TSval=379185 TSecr=118939785
194 0.250742227 172.31.24.227 -> 172.31.31.144 OpenFlow 6178 Type: OFPT_MULTIPART_REPLY, OFPMP_TABLE
195 0.251031903 172.31.31.144 -> 172.31.24.227 TCP 66 6633 → 39466 [ACK] Seq=97 Ack=10649 Win=853 Len=0 TSval=379185 TSecr=118939794
196 0.254752777 172.31.31.144 -> 172.31.24.227 TCP 66 6633 → 39450 [ACK] Seq=97 Ack=7833 Win=853 Len=0 TSval=379186 TSecr=118939785
197 0.258711843 172.31.31.144 -> 172.31.24.227 TCP 66 6633 → 39474 [ACK] Seq=97 Ack=9177 Win=853 Len=0 TSval=379187 TSecr=118939787
198 0.258719594 172.31.31.144 -> 172.31.24.227 TCP 66 6633 → 39470 [ACK] Seq=97 Ack=9577 Win=853 Len=0 TSval=379187 TSecr=118939787
199 0.274718289 172.31.31.144 -> 172.31.24.227 TCP 66 6633 → 39488 [ACK] Seq=97 Ack=9465 Win=853 Len=0 TSval=379191 TSecr=118939790
200 0.278760866 172.31.31.144 -> 172.31.24.227 TCP 66 6633 → 39468 [ACK] Seq=97 Ack=9385 Win=853 Len=0 TSval=379192 TSecr=118939792
201 0.426249232 172.31.24.227 -> 41.177.127.217 SSH 98 Server: Encrypted packet (len=44)
202 0.697410902 41.177.127.217 -> 172.31.24.227 TCP 54 58416 → 22 [ACK] Seq=1 Ack=473 Win=32364 Len=0
203 0.874923405 172.31.31.144 -> 172.31.24.227 OpenFlow 187 Type: OFPT_PACKET_OUT
204 0.874950861 172.31.31.144 -> 172.31.24.227 OpenFlow 187 Type: OFPT_PACKET_OUT
205 0.874971146 172.31.31.144 -> 172.31.24.227 OpenFlow 187 Type: OFPT_PACKET_OUT
206 0.875021821 172.31.31.144 -> 172.31.24.227 OpenFlow 187 Type: OFPT_PACKET_OUT
207 0.875125345 172.31.31.144 -> 172.31.24.227 OpenFlow 187 Type: OFPT_PACKET_OUT
208 0.875136128 172.31.24.227 -> 172.31.31.144 TCP 66 39480 → 6633 [ACK] Seq=8025 Ack=702 Win=78 Len=0 TSval=118939951 TSecr=379341
209 0.875192584 172.31.31.144 -> 172.31.24.227 OpenFlow 187 Type: OFPT_PACKET_OUT
210 0.875240083 172.31.31.144 -> 172.31.24.227 OpenFlow 187 Type: OFPT_PACKET_OUT
211 0.875313811 172.31.31.144 -> 172.31.24.227 OpenFlow 187 Type: OFPT_PACKET_OUT
212 0.875378726 172.31.31.144 -> 172.31.24.227 OpenFlow 187 Type: OFPT_PACKET_OUT
213 0.875442006 172.31.31.144 -> 172.31.24.227 OpenFlow 187 Type: OFPT_PACKET_OUT
214 0.875448184 172.31.24.227 -> 172.31.31.144 TCP 66 39480 → 6633 [ACK] Seq=8025 Ack=1307 Win=78 Len=0 TSval=118939951 TSecr=379341
215 0.875512119 172.31.31.144 -> 172.31.24.227 OpenFlow 187 Type: OFPT_PACKET_OUT
216 0.875585174 172.31.31.144 -> 172.31.24.227 OpenFlow 187 Type: OFPT_PACKET_OUT
217 0.875753293 172.31.31.144 -> 172.31.24.227 OpenFlow 187 Type: OFPT_PACKET_OUT
218 0.875773805 172.31.31.144 -> 172.31.24.227 OpenFlow 187 Type: OFPT_PACKET_OUT
219 0.875849992 172.31.31.144 -> 172.31.24.227 OpenFlow 187 Type: OFPT_PACKET_OUT
220 0.875909119 172.31.24.227 -> 172.31.31.144 TCP 66 39480 → 6633 [ACK] Seq=8025 Ack=1549 Win=78 Len=0 TSval=118939951 TSecr=379341
221 0.875953919 172.31.31.144 -> 172.31.24.227 OpenFlow 187 Type: OFPT_PACKET_OUT
222 0.875995146 172.31.31.144 -> 172.31.24.227 OpenFlow 187 Type: OFPT_PACKET_OUT
223 0.876000619 172.31.24.227 -> 172.31.31.144 TCP 66 39456 → 6633 [ACK] Seq=8233 Ack=702 Win=66 Len=0 TSval=118939951 TSecr=379341
224 0.876023848 172.31.24.227 -> 172.31.31.144 OpenFlow 189 Type: OFPT_PACKET_IN
225 0.876045353 172.31.24.227 -> 172.31.31.144 OpenFlow 435 Type: OFPT_PACKET_IN
226 0.876070267 172.31.31.144 -> 172.31.24.227 OpenFlow 187 Type: OFPT_PACKET_OUT
227 0.876098646 172.31.24.227 -> 172.31.31.144 OpenFlow 189 Type: OFPT_PACKET_IN
228 0.876117217 172.31.24.227 -> 172.31.31.144 OpenFlow 189 Type: OFPT_PACKET_IN
229 0.876142007 172.31.31.144 -> 172.31.24.227 OpenFlow 187 Type: OFPT_PACKET_OUT
230 0.876205192 172.31.31.144 -> 172.31.24.227 OpenFlow 187 Type: OFPT_PACKET_OUT
231 0.876264706 172.31.31.144 -> 172.31.24.227 OpenFlow 187 Type: OFPT_PACKET_OUT
232 0.876291411 172.31.31.144 -> 172.31.24.227 TCP 66 6633 → 39484 [ACK] Seq=97 Ack=8580 Win=853 Len=0 TSval=379341 TSecr=118939951
233 0.876321552 172.31.31.144 -> 172.31.24.227 TCP 66 6633 → 39484 [ACK] Seq=97 Ack=8949 Win=853 Len=0 TSval=379341 TSecr=118939951
234 0.876355286 172.31.31.144 -> 172.31.24.227 TCP 66 6633 → 39492 [ACK] Seq=97 Ack=8244 Win=853 Len=0 TSval=379341 TSecr=118939951
235 0.876380976 172.31.31.144 -> 172.31.24.227 TCP 66 6633 → 39492 [ACK] Seq=97 Ack=8367 Win=853 Len=0 TSval=379341 TSecr=118939951
236 0.876410413 172.31.31.144 -> 172.31.24.227 OpenFlow 187 Type: OFPT_PACKET_OUT
237 0.876415502 172.31.24.227 -> 172.31.31.144 TCP 66 39456 → 6633 [ACK] Seq=8233 Ack=1307 Win=66 Len=0 TSval=118939951 TSecr=379341
238 0.876436807 172.31.31.144 -> 172.31.24.227 OpenFlow 187 Type: OFPT_PACKET_OUT
239 0.876470142 172.31.31.144 -> 172.31.24.227 OpenFlow 187 Type: OFPT_PACKET_OUT
240 0.876752769 172.31.24.227 -> 172.31.31.144 TCP 66 39456 → 6633 [ACK] Seq=8233 Ack=1549 Win=66 Len=0 TSval=118939951 TSecr=379341
241 0.876780534 172.31.31.144 -> 172.31.24.227 OpenFlow 187 Type: OFPT_PACKET_OUT
242 0.876825478 172.31.24.227 -> 172.31.31.144 OpenFlow 189 Type: OFPT_PACKET_IN
243 0.876835599 172.31.31.144 -> 172.31.24.227 OpenFlow 187 Type: OFPT_PACKET_OUT
244 0.876847834 172.31.24.227 -> 172.31.31.144 OpenFlow 189 Type: OFPT_PACKET_IN
245 0.876875484 172.31.24.227 -> 172.31.31.144 OpenFlow 189 Type: OFPT_PACKET_IN
246 0.876892082 172.31.24.227 -> 172.31.31.144 OpenFlow 681 Type: OFPT_PACKET_IN
247 0.876994426 172.31.24.227 -> 172.31.31.144 TCP 66 39486 → 6633 [ACK] Seq=8633 Ack=339 Win=81 Len=0 TSval=118939951 TSecr=379341
248 0.877014144 172.31.31.144 -> 172.31.24.227 TCP 66 6633 → 39458 [ACK] Seq=97 Ack=10676 Win=853 Len=0 TSval=379341 TSecr=118939951
249 0.877037827 172.31.31.144 -> 172.31.24.227 TCP 66 6633 → 39458 [ACK] Seq=97 Ack=10799 Win=853 Len=0 TSval=379341 TSecr=118939951
250 0.877068920 172.31.31.144 -> 172.31.24.227 TCP 66 6633 → 39464 [ACK] Seq=97 Ack=9092 Win=853 Len=0 TSval=379341 TSecr=118939951
251 0.877099149 172.31.31.144 -> 172.31.24.227 TCP 66 6633 → 39464 [ACK] Seq=97 Ack=9707 Win=853 Len=0 TSval=379341 TSecr=118939951
252 0.877181655 172.31.24.227 -> 172.31.31.144 OpenFlow 189 Type: OFPT_PACKET_IN
253 0.877202118 172.31.24.227 -> 172.31.31.144 OpenFlow 558 Type: OFPT_PACKET_IN
254 0.877220706 172.31.24.227 -> 172.31.31.144 OpenFlow 189 Type: OFPT_PACKET_IN
255 0.877227930 172.31.24.227 -> 172.31.31.144 OpenFlow 189 Type: OFPT_PACKET_IN
256 0.877241855 172.31.24.227 -> 172.31.31.144 OpenFlow 189 Type: OFPT_PACKET_IN
257 0.877272583 172.31.24.227 -> 172.31.31.144 OpenFlow 189 Type: OFPT_PACKET_IN
258 0.877302252 172.31.24.227 -> 172.31.31.144 OpenFlow 189 Type: OFPT_PACKET_IN
259 0.877304753 172.31.24.227 -> 172.31.31.144 OpenFlow 189 Type: OFPT_PACKET_IN
260 0.877340037 172.31.24.227 -> 172.31.31.144 OpenFlow 189 Type: OFPT_PACKET_IN
261 0.877384409 172.31.31.144 -> 172.31.24.227 TCP 66 6633 → 39446 [ACK] Seq=97 Ack=8372 Win=853 Len=0 TSval=379341 TSecr=118939951
262 0.877407274 172.31.31.144 -> 172.31.24.227 TCP 66 6633 → 39446 [ACK] Seq=97 Ack=8864 Win=853 Len=0 TSval=379341 TSecr=118939951
263 0.877439678 172.31.31.144 -> 172.31.24.227 TCP 66 6633 → 39448 [ACK] Seq=97 Ack=7828 Win=853 Len=0 TSval=379341 TSecr=118939951
264 0.877463546 172.31.31.144 -> 172.31.24.227 TCP 66 6633 → 39446 [ACK] Seq=97 Ack=8987 Win=853 Len=0 TSval=379341 TSecr=118939951
265 0.877501293 172.31.31.144 -> 172.31.24.227 TCP 66 6633 → 39450 [ACK] Seq=97 Ack=7956 Win=853 Len=0 TSval=379341 TSecr=118939951
266 0.877528656 172.31.31.144 -> 172.31.24.227 TCP 66 6633 → 39448 [ACK] Seq=97 Ack=7951 Win=853 Len=0 TSval=379341 TSecr=118939951
267 0.877558032 172.31.31.144 -> 172.31.24.227 TCP 66 6633 → 39472 [ACK] Seq=97 Ack=9380 Win=853 Len=0 TSval=379341 TSecr=118939951
268 0.877587350 172.31.31.144 -> 172.31.24.227 TCP 66 6633 → 39450 [ACK] Seq=97 Ack=8079 Win=853 Len=0 TSval=379341 TSecr=118939951
269 0.877617100 172.31.31.144 -> 172.31.24.227 TCP 66 6633 → 39472 [ACK] Seq=97 Ack=9503 Win=853 Len=0 TSval=379341 TSecr=118939951
270 0.878916827 172.31.31.144 -> 172.31.24.227 OpenFlow 187 Type: OFPT_PACKET_OUT
271 0.879019458 172.31.31.144 -> 172.31.24.227 OpenFlow 187 Type: OFPT_PACKET_OUT
272 0.879084013 172.31.24.227 -> 172.31.31.144 TCP 66 39486 → 6633 [ACK] Seq=8633 Ack=581 Win=81 Len=0 TSval=118939952 TSecr=379342
273 0.879730449 172.31.31.144 -> 172.31.24.227 OpenFlow 187 Type: OFPT_PACKET_OUT
274 0.879821449 172.31.31.144 -> 172.31.24.227 OpenFlow 187 Type: OFPT_PACKET_OUT
275 0.879911727 172.31.31.144 -> 172.31.24.227 OpenFlow 187 Type: OFPT_PACKET_OUT
276 0.879996843 172.31.24.227 -> 172.31.31.144 TCP 66 39486 → 6633 [ACK] Seq=8633 Ack=944 Win=81 Len=0 TSval=118939952 TSecr=379342
277 0.880012410 172.31.31.144 -> 172.31.24.227 OpenFlow 187 Type: OFPT_PACKET_OUT
278 0.880214778 172.31.31.144 -> 172.31.24.227 OpenFlow 187 Type: OFPT_PACKET_OUT
279 0.880259129 172.31.31.144 -> 172.31.24.227 OpenFlow 187 Type: OFPT_PACKET_OUT
280 0.880322017 172.31.24.227 -> 172.31.31.144 TCP 66 39468 → 6633 [ACK] Seq=9385 Ack=339 Win=80 Len=0 TSval=118939952 TSecr=379342
281 0.880332493 172.31.31.144 -> 172.31.24.227 OpenFlow 187 Type: OFPT_PACKET_OUT
282 0.880401254 172.31.31.144 -> 172.31.24.227 OpenFlow 187 Type: OFPT_PACKET_OUT
283 0.880433602 172.31.24.227 -> 172.31.31.144 TCP 66 39468 → 6633 [ACK] Seq=9385 Ack=581 Win=80 Len=0 TSval=118939952 TSecr=379342
284 0.880485735 172.31.31.144 -> 172.31.24.227 OpenFlow 187 Type: OFPT_PACKET_OUT
285 0.880506075 172.31.24.227 -> 172.31.31.144 OpenFlow 189 Type: OFPT_PACKET_IN
286 0.880526630 172.31.24.227 -> 172.31.31.144 OpenFlow 189 Type: OFPT_PACKET_IN
287 0.880551246 172.31.31.144 -> 172.31.24.227 OpenFlow 187 Type: OFPT_PACKET_OUT
288 0.880558577 172.31.24.227 -> 172.31.31.144 OpenFlow 189 Type: OFPT_PACKET_IN
289 0.880576266 172.31.24.227 -> 172.31.31.144 OpenFlow 435 Type: OFPT_PACKET_IN
290 0.880601196 172.31.31.144 -> 172.31.24.227 OpenFlow 187 Type: OFPT_PACKET_OUT
291 0.880667272 172.31.31.144 -> 172.31.24.227 OpenFlow 187 Type: OFPT_PACKET_OUT
292 0.880703035 172.31.31.144 -> 172.31.24.227 TCP 66 6633 → 39470 [ACK] Seq=97 Ack=9700 Win=853 Len=0 TSval=379342 TSecr=118939952
293 0.880737659 172.31.31.144 -> 172.31.24.227 TCP 66 6633 → 39470 [ACK] Seq=97 Ack=9823 Win=853 Len=0 TSval=379342 TSecr=118939952
294 0.880764266 172.31.24.227 -> 172.31.31.144 OpenFlow 189 Type: OFPT_PACKET_IN
295 0.880779678 172.31.31.144 -> 172.31.24.227 OpenFlow 187 Type: OFPT_PACKET_OUT
296 0.880783137 172.31.24.227 -> 172.31.31.144 TCP 66 39468 → 6633 [ACK] Seq=9385 Ack=1186 Win=80 Len=0 TSval=118939952 TSecr=379342
297 0.880788191 172.31.24.227 -> 172.31.31.144 OpenFlow 189 Type: OFPT_PACKET_IN
298 0.880803892 172.31.31.144 -> 172.31.24.227 OpenFlow 187 Type: OFPT_PACKET_OUT
299 0.880867885 172.31.31.144 -> 172.31.24.227 TCP 66 6633 → 39478 [ACK] Seq=97 Ack=8405 Win=853 Len=0 TSval=379342 TSecr=118939952
300 0.880879257 172.31.31.144 -> 172.31.24.227 OpenFlow 187 Type: OFPT_PACKET_OUT
301 0.880955727 172.31.31.144 -> 172.31.24.227 TCP 66 6633 → 39464 [ACK] Seq=97 Ack=9830 Win=853 Len=0 TSval=379342 TSecr=118939952
302 0.880993129 172.31.31.144 -> 172.31.24.227 TCP 66 6633 → 39464 [ACK] Seq=97 Ack=9953 Win=853 Len=0 TSval=379342 TSecr=118939952
303 0.881052106 172.31.24.227 -> 172.31.31.144 TCP 66 39468 → 6633 [ACK] Seq=9385 Ack=1428 Win=80 Len=0 TSval=118939952 TSecr=379342
304 0.881181780 172.31.31.144 -> 172.31.24.227 OpenFlow 187 Type: OFPT_PACKET_OUT
305 0.881201007 172.31.31.144 -> 172.31.24.227 OpenFlow 187 Type: OFPT_PACKET_OUT
306 0.881280810 172.31.24.227 -> 172.31.31.144 OpenFlow 189 Type: OFPT_PACKET_IN
307 0.881302342 172.31.24.227 -> 172.31.31.144 OpenFlow 558 Type: OFPT_PACKET_IN
308 0.881350802 172.31.31.144 -> 172.31.24.227 OpenFlow 187 Type: OFPT_PACKET_OUT
309 0.881427776 172.31.24.227 -> 172.31.31.144 TCP 66 39468 → 6633 [ACK] Seq=9385 Ack=1791 Win=80 Len=0 TSval=118939952 TSecr=379342
310 0.881471253 172.31.31.144 -> 172.31.24.227 OpenFlow 187 Type: OFPT_PACKET_OUT
311 0.881499014 172.31.31.144 -> 172.31.24.227 TCP 66 6633 → 39462 [ACK] Seq=97 Ack=7732 Win=853 Len=0 TSval=379342 TSecr=118939952
312 0.881541749 172.31.31.144 -> 172.31.24.227 TCP 66 6633 → 39462 [ACK] Seq=97 Ack=8224 Win=853 Len=0 TSval=379342 TSecr=118939952
313 0.881577567 172.31.24.227 -> 172.31.31.144 OpenFlow 189 Type: OFPT_PACKET_IN
314 0.881596787 172.31.24.227 -> 172.31.31.144 OpenFlow 189 Type: OFPT_PACKET_IN
315 0.881699856 172.31.24.227 -> 172.31.31.144 OpenFlow 189 Type: OFPT_PACKET_IN
316 0.881730157 172.31.31.144 -> 172.31.24.227 OpenFlow 187 Type: OFPT_PACKET_OUT
317 0.881783517 172.31.31.144 -> 172.31.24.227 OpenFlow 187 Type: OFPT_PACKET_OUT
318 0.881787930 172.31.31.144 -> 172.31.24.227 TCP 66 6633 → 39492 [ACK] Seq=97 Ack=8490 Win=853 Len=0 TSval=379342 TSecr=118939952
319 0.881811202 172.31.31.144 -> 172.31.24.227 TCP 66 6633 → 39492 [ACK] Seq=97 Ack=8613 Win=853 Len=0 TSval=379342 TSecr=118939952
320 0.881841065 172.31.31.144 -> 172.31.24.227 OpenFlow 187 Type: OFPT_PACKET_OUT
321 0.881911191 172.31.31.144 -> 172.31.24.227 OpenFlow 187 Type: OFPT_PACKET_OUT
322 0.881938514 172.31.31.144 -> 172.31.24.227 TCP 66 6633 → 39462 [ACK] Seq=97 Ack=8347 Win=853 Len=0 TSval=379342 TSecr=118939952
323 0.881969072 172.31.24.227 -> 172.31.31.144 TCP 66 39466 → 6633 [ACK] Seq=10649 Ack=702 Win=385 Len=0 TSval=118939952 TSecr=379342
324 0.882049295 172.31.24.227 -> 172.31.31.144 OpenFlow 189 Type: OFPT_PACKET_IN
325 0.882077855 172.31.24.227 -> 172.31.31.144 OpenFlow 189 Type: OFPT_PACKET_IN
326 0.882093663 172.31.24.227 -> 172.31.31.144 OpenFlow 189 Type: OFPT_PACKET_IN
327 0.882132654 172.31.24.227 -> 172.31.31.144 OpenFlow 189 Type: OFPT_PACKET_IN
328 0.882151618 172.31.24.227 -> 172.31.31.144 OpenFlow 189 Type: OFPT_PACKET_IN
329 0.882176839 172.31.31.144 -> 172.31.24.227 OpenFlow 187 Type: OFPT_PACKET_OUT
330 0.882253915 172.31.31.144 -> 172.31.24.227 TCP 66 6633 → 39470 [ACK] Seq=97 Ack=9946 Win=853 Len=0 TSval=379342 TSecr=118939952
331 0.882280837 172.31.31.144 -> 172.31.24.227 TCP 66 6633 → 39476 [ACK] Seq=97 Ack=8644 Win=853 Len=0 TSval=379342 TSecr=118939952
332 0.882309703 172.31.31.144 -> 172.31.24.227 TCP 66 6633 → 39476 [ACK] Seq=97 Ack=8767 Win=853 Len=0 TSval=379342 TSecr=118939952
333 0.882337956 172.31.31.144 -> 172.31.24.227 OpenFlow 187 Type: OFPT_PACKET_OUT
334 0.882365353 172.31.31.144 -> 172.31.24.227 TCP 66 6633 → 39492 [ACK] Seq=97 Ack=8736 Win=853 Len=0 TSval=379342 TSecr=118939952
335 0.882373535 172.31.24.227 -> 172.31.31.144 TCP 66 39466 → 6633 [ACK] Seq=10649 Ack=944 Win=385 Len=0 TSval=118939952 TSecr=379342
336 0.882393372 172.31.31.144 -> 172.31.24.227 TCP 66 6633 → 39492 [ACK] Seq=97 Ack=8859 Win=853 Len=0 TSval=379342 TSecr=118939952
337 0.882452901 172.31.31.144 -> 172.31.24.227 OpenFlow 187 Type: OFPT_PACKET_OUT
338 0.882459047 172.31.24.227 -> 172.31.31.144 OpenFlow 189 Type: OFPT_PACKET_IN
339 0.882481558 172.31.31.144 -> 172.31.24.227 OpenFlow 187 Type: OFPT_PACKET_OUT
340 0.882487473 172.31.24.227 -> 172.31.31.144 OpenFlow 189 Type: OFPT_PACKET_IN
341 0.882665578 172.31.31.144 -> 172.31.24.227 TCP 66 6633 → 39470 [ACK] Seq=97 Ack=10069 Win=853 Len=0 TSval=379343 TSecr=118939952
342 0.882691926 172.31.31.144 -> 172.31.24.227 TCP 66 6633 → 39470 [ACK] Seq=97 Ack=10192 Win=853 Len=0 TSval=379343 TSecr=118939952
343 0.882711085 172.31.24.227 -> 172.31.31.144 TCP 66 39466 → 6633 [ACK] Seq=10649 Ack=1186 Win=385 Len=0 TSval=118939952 TSecr=379342
344 0.882774501 172.31.31.144 -> 172.31.24.227 OpenFlow 187 Type: OFPT_PACKET_OUT
345 0.882859271 172.31.31.144 -> 172.31.24.227 OpenFlow 187 Type: OFPT_PACKET_OUT
346 0.882872278 172.31.24.227 -> 172.31.31.144 OpenFlow 189 Type: OFPT_PACKET_IN
347 0.882975759 172.31.31.144 -> 172.31.24.227 OpenFlow 187 Type: OFPT_PACKET_OUT
348 0.883010282 172.31.24.227 -> 172.31.31.144 OpenFlow 189 Type: OFPT_PACKET_IN
349 0.883039692 172.31.24.227 -> 172.31.31.144 OpenFlow 189 Type: OFPT_PACKET_IN
350 0.883064310 172.31.31.144 -> 172.31.24.227 OpenFlow 187 Type: OFPT_PACKET_OUT
351 0.883088676 172.31.31.144 -> 172.31.24.227 TCP 66 6633 → 39470 [ACK] Seq=97 Ack=10315 Win=853 Len=0 TSval=379343 TSecr=118939953
352 0.883121781 172.31.31.144 -> 172.31.24.227 OpenFlow 187 Type: OFPT_PACKET_OUT
353 0.883190870 172.31.31.144 -> 172.31.24.227 OpenFlow 187 Type: OFPT_PACKET_OUT
354 0.883219409 172.31.31.144 -> 172.31.24.227 TCP 66 6633 → 39450 [ACK] Seq=97 Ack=8202 Win=853 Len=0 TSval=379343 TSecr=118939953
355 0.883248933 172.31.31.144 -> 172.31.24.227 TCP 66 6633 → 39450 [ACK] Seq=97 Ack=8325 Win=853 Len=0 TSval=379343 TSecr=118939953
356 0.883276765 172.31.31.144 -> 172.31.24.227 OpenFlow 187 Type: OFPT_PACKET_OUT
357 0.883326013 172.31.31.144 -> 172.31.24.227 OpenFlow 187 Type: OFPT_PACKET_OUT
358 0.883391185 172.31.31.144 -> 172.31.24.227 OpenFlow 187 Type: OFPT_PACKET_OUT
359 0.883443099 172.31.24.227 -> 172.31.31.144 TCP 66 39466 → 6633 [ACK] Seq=10649 Ack=2275 Win=385 Len=0 TSval=118939953 TSecr=379343
360 0.883618284 172.31.24.227 -> 172.31.31.144 OpenFlow 189 Type: OFPT_PACKET_IN
361 0.883640343 172.31.24.227 -> 172.31.31.144 OpenFlow 189 Type: OFPT_PACKET_IN
362 0.883663044 172.31.24.227 -> 172.31.31.144 OpenFlow 189 Type: OFPT_PACKET_IN
363 0.883688145 172.31.31.144 -> 172.31.24.227 OpenFlow 187 Type: OFPT_PACKET_OUT
364 0.883695565 172.31.24.227 -> 172.31.31.144 OpenFlow 681 Type: OFPT_PACKET_IN
365 0.883751434 172.31.31.144 -> 172.31.24.227 OpenFlow 187 Type: OFPT_PACKET_OUT
366 0.883815267 172.31.31.144 -> 172.31.24.227 TCP 66 6633 → 39450 [ACK] Seq=97 Ack=8448 Win=853 Len=0 TSval=379343 TSecr=118939953
367 0.883843084 172.31.31.144 -> 172.31.24.227 TCP 66 6633 → 39450 [ACK] Seq=97 Ack=8571 Win=853 Len=0 TSval=379343 TSecr=118939953
