  1 0.000000000 41.177.127.217 -> 172.31.24.227 TCP 54 58416 → 22 [ACK] Seq=1 Ack=1 Win=32404 Len=0
  2 0.092392247 172.31.31.144 -> 172.31.24.227 TCP 90 6633 → 39486 [PSH, ACK] Seq=1 Ack=1 Win=853 Len=24 TSval=377465 TSecr=118937677
  3 0.092429152 172.31.24.227 -> 172.31.31.144 TCP 66 39486 → 6633 [ACK] Seq=1 Ack=25 Win=81 Len=0 TSval=118938075 TSecr=377465
  4 0.092454774 172.31.31.144 -> 172.31.24.227 TCP 90 6633 → 39490 [PSH, ACK] Seq=1 Ack=1 Win=853 Len=24 TSval=377465 TSecr=118937678
  5 0.092467987 172.31.31.144 -> 172.31.24.227 TCP 106 6633 → 39486 [PSH, ACK] Seq=25 Ack=1 Win=853 Len=40 TSval=377465 TSecr=118937677
  6 0.092472528 172.31.24.227 -> 172.31.31.144 TCP 66 39486 → 6633 [ACK] Seq=1 Ack=65 Win=81 Len=0 TSval=118938075 TSecr=377465
  7 0.092547283 172.31.31.144 -> 172.31.24.227 TCP 90 6633 → 39492 [PSH, ACK] Seq=1 Ack=1 Win=853 Len=24 TSval=377465 TSecr=118937678
  8 0.092551146 172.31.31.144 -> 172.31.24.227 TCP 106 6633 → 39492 [PSH, ACK] Seq=25 Ack=1 Win=853 Len=40 TSval=377465 TSecr=118937678
  9 0.092552996 172.31.31.144 -> 172.31.24.227 TCP 106 6633 → 39490 [PSH, ACK] Seq=25 Ack=1 Win=853 Len=40 TSval=377465 TSecr=118937678
 10 0.092554817 172.31.31.144 -> 172.31.24.227 TCP 90 6633 → 39476 [PSH, ACK] Seq=1 Ack=1 Win=853 Len=24 TSval=377465 TSecr=118937676
 11 0.092583695 172.31.31.144 -> 172.31.24.227 TCP 90 6633 → 39452 [PSH, ACK] Seq=1 Ack=1 Win=853 Len=24 TSval=377465 TSecr=118937688
 12 0.092588025 172.31.24.227 -> 172.31.31.144 TCP 66 39452 → 6633 [ACK] Seq=1 Ack=25 Win=68 Len=0 TSval=118938075 TSecr=377465
 13 0.092592197 172.31.31.144 -> 172.31.24.227 TCP 106 6633 → 39476 [PSH, ACK] Seq=25 Ack=1 Win=853 Len=40 TSval=377465 TSecr=118937676
 14 0.092610045 172.31.31.144 -> 172.31.24.227 TCP 82 6633 → 39452 [PSH, ACK] Seq=25 Ack=1 Win=853 Len=16 TSval=377465 TSecr=118937688
 15 0.092613432 172.31.24.227 -> 172.31.31.144 TCP 66 39452 → 6633 [ACK] Seq=1 Ack=41 Win=68 Len=0 TSval=118938075 TSecr=377465
 16 0.092638344 172.31.31.144 -> 172.31.24.227 TCP 90 6633 → 39452 [PSH, ACK] Seq=41 Ack=1 Win=853 Len=24 TSval=377465 TSecr=118937688
 17 0.092641504 172.31.24.227 -> 172.31.31.144 TCP 66 39452 → 6633 [ACK] Seq=1 Ack=65 Win=68 Len=0 TSval=118938075 TSecr=377465
 18 0.092668374 172.31.31.144 -> 172.31.24.227 TCP 90 6633 → 39458 [PSH, ACK] Seq=1 Ack=1 Win=853 Len=24 TSval=377465 TSecr=118937677
 19 0.092671477 172.31.31.144 -> 172.31.24.227 TCP 82 6633 → 39458 [PSH, ACK] Seq=25 Ack=1 Win=853 Len=16 TSval=377465 TSecr=118937677
 20 0.092691778 172.31.31.144 -> 172.31.24.227 TCP 90 6633 → 39458 [PSH, ACK] Seq=41 Ack=1 Win=853 Len=24 TSval=377465 TSecr=118937677
 21 0.092815788 172.31.24.227 -> 172.31.31.144 OpenFlow 82 Type: OFPT_MULTIPART_REPLY, OFPMP_GROUP
 22 0.092842103 172.31.24.227 -> 172.31.31.144 OpenFlow 82 Type: OFPT_MULTIPART_REPLY, OFPMP_GROUP_DESC
 23 0.092861757 172.31.24.227 -> 172.31.31.144 OpenFlow 82 Type: OFPT_MULTIPART_REPLY, OFPMP_METER
 24 0.092885903 172.31.24.227 -> 172.31.31.144 OpenFlow 82 Type: OFPT_MULTIPART_REPLY, OFPMP_GROUP
 25 0.092951977 172.31.24.227 -> 172.31.31.144 OpenFlow 82 Type: OFPT_MULTIPART_REPLY, OFPMP_GROUP
 26 0.093002520 172.31.24.227 -> 172.31.31.144 OpenFlow 98 Type: OFPT_MULTIPART_REPLY, OFPMP_METER
 27 0.093007392 172.31.24.227 -> 172.31.31.144 OpenFlow 98 Type: OFPT_MULTIPART_REPLY, OFPMP_METER
 28 0.093016831 172.31.24.227 -> 172.31.31.144 OpenFlow 82 Type: OFPT_MULTIPART_REPLY, OFPMP_GROUP
 29 0.093024103 172.31.31.144 -> 172.31.24.227 TCP 66 6633 → 39452 [ACK] Seq=65 Ack=17 Win=853 Len=0 TSval=377466 TSecr=118938075
 30 0.093051990 172.31.24.227 -> 172.31.31.144 OpenFlow 82 Type: OFPT_MULTIPART_REPLY, OFPMP_GROUP
 31 0.093073245 172.31.24.227 -> 172.31.31.144 OpenFlow 82 Type: OFPT_MULTIPART_REPLY, OFPMP_GROUP
 32 0.093145553 172.31.31.144 -> 172.31.24.227 TCP 66 6633 → 39452 [ACK] Seq=65 Ack=33 Win=853 Len=0 TSval=377466 TSecr=118938076
 33 0.093150892 172.31.31.144 -> 172.31.24.227 TCP 66 6633 → 39452 [ACK] Seq=65 Ack=49 Win=853 Len=0 TSval=377466 TSecr=118938076
 34 0.093155871 172.31.24.227 -> 172.31.31.144 OpenFlow 98 Type: OFPT_MULTIPART_REPLY, OFPMP_METER
 35 0.093161664 172.31.24.227 -> 172.31.31.144 OpenFlow 98 Type: OFPT_MULTIPART_REPLY, OFPMP_METER
 36 0.093203018 172.31.31.144 -> 172.31.24.227 TCP 66 6633 → 39458 [ACK] Seq=65 Ack=17 Win=853 Len=0 TSval=377466 TSecr=118938076
 37 0.093206256 172.31.31.144 -> 172.31.24.227 TCP 66 6633 → 39458 [ACK] Seq=65 Ack=49 Win=853 Len=0 TSval=377466 TSecr=118938076
 38 0.093210226 172.31.24.227 -> 172.31.31.144 OpenFlow 98 Type: OFPT_MULTIPART_REPLY, OFPMP_METER
 39 0.093313984 172.31.31.144 -> 172.31.24.227 TCP 66 6633 → 39476 [ACK] Seq=65 Ack=49 Win=853 Len=0 TSval=377466 TSecr=118938076
 40 0.093316528 172.31.31.144 -> 172.31.24.227 TCP 66 6633 → 39486 [ACK] Seq=65 Ack=17 Win=853 Len=0 TSval=377466 TSecr=118938076
 41 0.093318465 172.31.31.144 -> 172.31.24.227 TCP 66 6633 → 39490 [ACK] Seq=65 Ack=17 Win=853 Len=0 TSval=377466 TSecr=118938076
 42 0.093379426 172.31.31.144 -> 172.31.24.227 TCP 66 6633 → 39492 [ACK] Seq=65 Ack=17 Win=853 Len=0 TSval=377466 TSecr=118938076
 43 0.093401423 172.31.31.144 -> 172.31.24.227 TCP 66 6633 → 39486 [ACK] Seq=65 Ack=49 Win=853 Len=0 TSval=377466 TSecr=118938076
 44 0.093423243 172.31.31.144 -> 172.31.24.227 TCP 66 6633 → 39490 [ACK] Seq=65 Ack=49 Win=853 Len=0 TSval=377466 TSecr=118938076
 45 0.093483822 172.31.31.144 -> 172.31.24.227 TCP 66 6633 → 39492 [ACK] Seq=65 Ack=49 Win=853 Len=0 TSval=377466 TSecr=118938076
 46 0.192753109 172.31.31.144 -> 172.31.24.227 TCP 90 6633 → 39480 [PSH, ACK] Seq=1 Ack=1 Win=853 Len=24 TSval=377491 TSecr=118937679
 47 0.192785287 172.31.24.227 -> 172.31.31.144 TCP 66 39480 → 6633 [ACK] Seq=1 Ack=25 Win=78 Len=0 TSval=118938100 TSecr=377491
 48 0.192791716 172.31.31.144 -> 172.31.24.227 TCP 90 6633 → 39464 [PSH, ACK] Seq=1 Ack=1 Win=853 Len=24 TSval=377491 TSecr=118937679
 49 0.192812028 172.31.31.144 -> 172.31.24.227 TCP 90 6633 → 39482 [PSH, ACK] Seq=1 Ack=1 Win=853 Len=24 TSval=377491 TSecr=118937689
 50 0.192816718 172.31.24.227 -> 172.31.31.144 TCP 66 39482 → 6633 [ACK] Seq=1 Ack=25 Win=208 Len=0 TSval=118938101 TSecr=377491
 51 0.192823860 172.31.31.144 -> 172.31.24.227 TCP 90 6633 → 39484 [PSH, ACK] Seq=1 Ack=1 Win=853 Len=24 TSval=377491 TSecr=118937678
 52 0.192826806 172.31.31.144 -> 172.31.24.227 TCP 106 6633 → 39464 [PSH, ACK] Seq=25 Ack=1 Win=853 Len=40 TSval=377491 TSecr=118937679
 53 0.192830091 172.31.31.144 -> 172.31.24.227 TCP 90 6633 → 39462 [PSH, ACK] Seq=1 Ack=1 Win=853 Len=24 TSval=377491 TSecr=118937679
 54 0.192832714 172.31.31.144 -> 172.31.24.227 TCP 82 6633 → 39484 [PSH, ACK] Seq=25 Ack=1 Win=853 Len=16 TSval=377491 TSecr=118937678
 55 0.192847471 172.31.31.144 -> 172.31.24.227 TCP 90 6633 → 39484 [PSH, ACK] Seq=41 Ack=1 Win=853 Len=24 TSval=377491 TSecr=118937678
 56 0.192849831 172.31.31.144 -> 172.31.24.227 TCP 106 6633 → 39480 [PSH, ACK] Seq=25 Ack=1 Win=853 Len=40 TSval=377491 TSecr=118937679
 57 0.192852535 172.31.24.227 -> 172.31.31.144 TCP 66 39480 → 6633 [ACK] Seq=1 Ack=65 Win=78 Len=0 TSval=118938101 TSecr=377491
 58 0.192856285 172.31.31.144 -> 172.31.24.227 TCP 82 6633 → 39462 [PSH, ACK] Seq=25 Ack=1 Win=853 Len=16 TSval=377491 TSecr=118937679
 59 0.192873672 172.31.31.144 -> 172.31.24.227 TCP 106 6633 → 39482 [PSH, ACK] Seq=25 Ack=1 Win=853 Len=40 TSval=377491 TSecr=118937689
 60 0.192876934 172.31.24.227 -> 172.31.31.144 TCP 66 39482 → 6633 [ACK] Seq=1 Ack=65 Win=208 Len=0 TSval=118938101 TSecr=377491
 61 0.192902959 172.31.31.144 -> 172.31.24.227 TCP 90 6633 → 39448 [PSH, ACK] Seq=1 Ack=1 Win=853 Len=24 TSval=377491 TSecr=118937679
 62 0.192905940 172.31.31.144 -> 172.31.24.227 TCP 90 6633 → 39446 [PSH, ACK] Seq=1 Ack=1 Win=853 Len=24 TSval=377491 TSecr=118937679
 63 0.192937453 172.31.31.144 -> 172.31.24.227 TCP 90 6633 → 39450 [PSH, ACK] Seq=1 Ack=1 Win=853 Len=24 TSval=377491 TSecr=118937678
 64 0.192955317 172.31.31.144 -> 172.31.24.227 TCP 106 6633 → 39448 [PSH, ACK] Seq=25 Ack=1 Win=853 Len=40 TSval=377491 TSecr=118937679
 65 0.192977971 172.31.31.144 -> 172.31.24.227 TCP 90 6633 → 39454 [PSH, ACK] Seq=1 Ack=1 Win=853 Len=24 TSval=377491 TSecr=118937677
 66 0.192980532 172.31.31.144 -> 172.31.24.227 TCP 90 6633 → 39460 [PSH, ACK] Seq=1 Ack=1 Win=853 Len=24 TSval=377491 TSecr=118937678
 67 0.192995749 172.31.31.144 -> 172.31.24.227 TCP 90 6633 → 39478 [PSH, ACK] Seq=1 Ack=1 Win=853 Len=24 TSval=377491 TSecr=118937679
 68 0.193022014 172.31.31.144 -> 172.31.24.227 TCP 90 6633 → 39462 [PSH, ACK] Seq=41 Ack=1 Win=853 Len=24 TSval=377491 TSecr=118937679
 69 0.193024648 172.31.31.144 -> 172.31.24.227 TCP 106 6633 → 39460 [PSH, ACK] Seq=25 Ack=1 Win=853 Len=40 TSval=377491 TSecr=118937678
 70 0.193037884 172.31.31.144 -> 172.31.24.227 TCP 90 6633 → 39470 [PSH, ACK] Seq=1 Ack=1 Win=853 Len=24 TSval=377491 TSecr=118937676
 71 0.193059805 172.31.31.144 -> 172.31.24.227 TCP 106 6633 → 39454 [PSH, ACK] Seq=25 Ack=1 Win=853 Len=40 TSval=377491 TSecr=118937677
 72 0.193071172 172.31.24.227 -> 172.31.31.144 OpenFlow 82 Type: OFPT_MULTIPART_REPLY, OFPMP_GROUP
 73 0.193081298 172.31.31.144 -> 172.31.24.227 TCP 106 6633 → 39450 [PSH, ACK] Seq=25 Ack=1 Win=853 Len=40 TSval=377491 TSecr=118937678
 74 0.193112309 172.31.24.227 -> 172.31.31.144 OpenFlow 82 Type: OFPT_MULTIPART_REPLY, OFPMP_GROUP
 75 0.193121026 172.31.31.144 -> 172.31.24.227 TCP 106 6633 → 39478 [PSH, ACK] Seq=25 Ack=1 Win=853 Len=40 TSval=377491 TSecr=118937679
 76 0.193123513 172.31.31.144 -> 172.31.24.227 TCP 90 6633 → 39468 [PSH, ACK] Seq=1 Ack=1 Win=853 Len=24 TSval=377491 TSecr=118937679
 77 0.193126352 172.31.24.227 -> 172.31.31.144 TCP 66 39468 → 6633 [ACK] Seq=1 Ack=25 Win=80 Len=0 TSval=118938101 TSecr=377491
 78 0.193151090 172.31.24.227 -> 172.31.31.144 OpenFlow 82 Type: OFPT_MULTIPART_REPLY, OFPMP_GROUP
 79 0.193159693 172.31.24.227 -> 172.31.31.144 OpenFlow 98 Type: OFPT_MULTIPART_REPLY, OFPMP_METER
 80 0.193185693 172.31.31.144 -> 172.31.24.227 TCP 82 6633 → 39470 [PSH, ACK] Seq=25 Ack=1 Win=853 Len=16 TSval=377491 TSecr=118937676
 81 0.193188776 172.31.31.144 -> 172.31.24.227 TCP 90 6633 → 39474 [PSH, ACK] Seq=1 Ack=1 Win=853 Len=24 TSval=377491 TSecr=118937679
 82 0.193192106 172.31.24.227 -> 172.31.31.144 TCP 66 39474 → 6633 [ACK] Seq=1 Ack=25 Win=213 Len=0 TSval=118938101 TSecr=377491
 83 0.193196516 172.31.31.144 -> 172.31.24.227 TCP 90 6633 → 39488 [PSH, ACK] Seq=1 Ack=1 Win=853 Len=24 TSval=377491 TSecr=118937678
 84 0.193201711 172.31.24.227 -> 172.31.31.144 OpenFlow 98 Type: OFPT_MULTIPART_REPLY, OFPMP_METER
 85 0.193206203 172.31.24.227 -> 172.31.31.144 OpenFlow 82 Type: OFPT_MULTIPART_REPLY, OFPMP_GROUP
 86 0.193239388 172.31.31.144 -> 172.31.24.227 TCP 90 6633 → 39456 [PSH, ACK] Seq=1 Ack=1 Win=853 Len=24 TSval=377491 TSecr=118937678
 87 0.193243081 172.31.24.227 -> 172.31.31.144 TCP 66 39456 → 6633 [ACK] Seq=1 Ack=25 Win=66 Len=0 TSval=118938101 TSecr=377491
 88 0.193247411 172.31.31.144 -> 172.31.24.227 TCP 82 6633 → 39488 [PSH, ACK] Seq=25 Ack=1 Win=853 Len=16 TSval=377491 TSecr=118937678
 89 0.193249224 172.31.31.144 -> 172.31.24.227 TCP 90 6633 → 39472 [PSH, ACK] Seq=1 Ack=1 Win=853 Len=24 TSval=377491 TSecr=118937679
 90 0.193253606 172.31.24.227 -> 172.31.31.144 OpenFlow 82 Type: OFPT_MULTIPART_REPLY, OFPMP_GROUP
 91 0.193272500 172.31.24.227 -> 172.31.31.144 OpenFlow 82 Type: OFPT_MULTIPART_REPLY, OFPMP_GROUP
 92 0.193290098 172.31.24.227 -> 172.31.31.144 OpenFlow 82 Type: OFPT_MULTIPART_REPLY, OFPMP_GROUP
 93 0.193292066 172.31.24.227 -> 172.31.31.144 OpenFlow 98 Type: OFPT_MULTIPART_REPLY, OFPMP_METER
 94 0.193315088 172.31.24.227 -> 172.31.31.144 OpenFlow 82 Type: OFPT_MULTIPART_REPLY, OFPMP_GROUP
 95 0.193321072 172.31.31.144 -> 172.31.24.227 OpenFlow 82 Type: OFPT_MULTIPART_REQUEST, OFPMP_GROUP_DESC
 96 0.193323311 172.31.31.144 -> 172.31.24.227 TCP 82 6633 → 39472 [PSH, ACK] Seq=25 Ack=1 Win=853 Len=16 TSval=377491 TSecr=118937679
 97 0.193324916 172.31.31.144 -> 172.31.24.227 TCP 106 6633 → 39474 [PSH, ACK] Seq=25 Ack=1 Win=853 Len=40 TSval=377491 TSecr=118937679
 98 0.193327112 172.31.24.227 -> 172.31.31.144 TCP 66 39474 → 6633 [ACK] Seq=1 Ack=65 Win=213 Len=0 TSval=118938101 TSecr=377491
 99 0.193331495 172.31.31.144 -> 172.31.24.227 OpenFlow 82 Type: OFPT_MULTIPART_REQUEST, OFPMP_GROUP_DESC
100 0.193351254 172.31.24.227 -> 172.31.31.144 OpenFlow 82 Type: OFPT_MULTIPART_REPLY, OFPMP_GROUP
101 0.193366066 172.31.24.227 -> 172.31.31.144 OpenFlow 82 Type: OFPT_MULTIPART_REPLY, OFPMP_GROUP
102 0.193368242 172.31.24.227 -> 172.31.31.144 OpenFlow 98 Type: OFPT_MULTIPART_REPLY, OFPMP_METER
103 0.193382835 172.31.24.227 -> 172.31.31.144 OpenFlow 82 Type: OFPT_MULTIPART_REPLY, OFPMP_GROUP
104 0.193384717 172.31.24.227 -> 172.31.31.144 OpenFlow 98 Type: OFPT_MULTIPART_REPLY, OFPMP_METER
105 0.193406671 172.31.24.227 -> 172.31.31.144 OpenFlow 82 Type: OFPT_MULTIPART_REPLY, OFPMP_GROUP
106 0.193408908 172.31.24.227 -> 172.31.31.144 OpenFlow 98 Type: OFPT_MULTIPART_REPLY, OFPMP_METER
107 0.193425770 172.31.24.227 -> 172.31.31.144 OpenFlow 82 Type: OFPT_MULTIPART_REPLY, OFPMP_GROUP
108 0.193442945 172.31.24.227 -> 172.31.31.144 OpenFlow 82 Type: OFPT_MULTIPART_REPLY, OFPMP_GROUP
109 0.193444944 172.31.24.227 -> 172.31.31.144 OpenFlow 82 Type: OFPT_MULTIPART_REPLY, OFPMP_GROUP_DESC
110 0.193462341 172.31.24.227 -> 172.31.31.144 OpenFlow 82 Type: OFPT_MULTIPART_REPLY, OFPMP_GROUP
111 0.193475239 172.31.31.144 -> 172.31.24.227 OpenFlow 90 Type: OFPT_MULTIPART_REQUEST, OFPMP_METER
112 0.193477462 172.31.31.144 -> 172.31.24.227 TCP 106 6633 → 39456 [PSH, ACK] Seq=25 Ack=1 Win=853 Len=40 TSval=377491 TSecr=118937678
113 0.193480103 172.31.24.227 -> 172.31.31.144 TCP 66 39456 → 6633 [ACK] Seq=1 Ack=65 Win=66 Len=0 TSval=118938101 TSecr=377491
114 0.193481585 172.31.31.144 -> 172.31.24.227 TCP 90 6633 → 39466 [PSH, ACK] Seq=1 Ack=1 Win=853 Len=24 TSval=377491 TSecr=118937677
115 0.193483602 172.31.31.144 -> 172.31.24.227 OpenFlow 90 Type: OFPT_MULTIPART_REQUEST, OFPMP_METER
116 0.193484930 172.31.31.144 -> 172.31.24.227 TCP 90 6633 → 39488 [PSH, ACK] Seq=41 Ack=1 Win=853 Len=24 TSval=377491 TSecr=118937678
117 0.193486606 172.31.31.144 -> 172.31.24.227 OpenFlow 90 Type: OFPT_MULTIPART_REQUEST, OFPMP_METER
118 0.193489132 172.31.31.144 -> 172.31.24.227 TCP 106 6633 → 39466 [PSH, ACK] Seq=25 Ack=1 Win=853 Len=40 TSval=377491 TSecr=118937677
119 0.193510809 172.31.24.227 -> 172.31.31.144 OpenFlow 82 Type: OFPT_MULTIPART_REPLY, OFPMP_GROUP
120 0.193630053 172.31.24.227 -> 172.31.31.144 OpenFlow 82 Type: OFPT_MULTIPART_REPLY, OFPMP_GROUP_DESC
121 0.193633950 172.31.24.227 -> 172.31.31.144 OpenFlow 82 Type: OFPT_MULTIPART_REPLY, OFPMP_GROUP_DESC
122 0.193636022 172.31.24.227 -> 172.31.31.144 OpenFlow 82 Type: OFPT_MULTIPART_REPLY, OFPMP_GROUP_DESC
123 0.193637779 172.31.24.227 -> 172.31.31.144 OpenFlow 98 Type: OFPT_MULTIPART_REPLY, OFPMP_METER
124 0.193639591 172.31.24.227 -> 172.31.31.144 OpenFlow 98 Type: OFPT_MULTIPART_REPLY, OFPMP_METER
125 0.193671668 172.31.24.227 -> 172.31.31.144 OpenFlow 82 Type: OFPT_MULTIPART_REPLY, OFPMP_GROUP
126 0.193704254 172.31.24.227 -> 172.31.31.144 OpenFlow 82 Type: OFPT_MULTIPART_REPLY, OFPMP_GROUP
127 0.193706445 172.31.24.227 -> 172.31.31.144 OpenFlow 98 Type: OFPT_MULTIPART_REPLY, OFPMP_METER
128 0.193874449 172.31.31.144 -> 172.31.24.227 OpenFlow 90 Type: OFPT_MULTIPART_REQUEST, OFPMP_METER
129 0.193881714 172.31.31.144 -> 172.31.24.227 TCP 66 6633 → 39446 [ACK] Seq=65 Ack=17 Win=853 Len=0 TSval=377491 TSecr=118938101
130 0.193886643 172.31.24.227 -> 172.31.31.144 OpenFlow 82 Type: OFPT_MULTIPART_REPLY, OFPMP_METER
131 0.193891654 172.31.31.144 -> 172.31.24.227 TCP 66 6633 → 39448 [ACK] Seq=65 Ack=49 Win=853 Len=0 TSval=377491 TSecr=118938101
132 0.193894599 172.31.31.144 -> 172.31.24.227 TCP 66 6633 → 39450 [ACK] Seq=65 Ack=49 Win=853 Len=0 TSval=377491 TSecr=118938101
133 0.193896562 172.31.31.144 -> 172.31.24.227 TCP 66 6633 → 39460 [ACK] Seq=65 Ack=17 Win=853 Len=0 TSval=377491 TSecr=118938101
134 0.193898362 172.31.31.144 -> 172.31.24.227 TCP 66 6633 → 39462 [ACK] Seq=65 Ack=17 Win=853 Len=0 TSval=377491 TSecr=118938101
135 0.193900061 172.31.31.144 -> 172.31.24.227 TCP 66 6633 → 39468 [ACK] Seq=65 Ack=17 Win=853 Len=0 TSval=377491 TSecr=118938101
136 0.193901689 172.31.31.144 -> 172.31.24.227 TCP 66 6633 → 39454 [ACK] Seq=65 Ack=49 Win=853 Len=0 TSval=377491 TSecr=118938101
137 0.193903655 172.31.31.144 -> 172.31.24.227 TCP 66 6633 → 39470 [ACK] Seq=65 Ack=17 Win=853 Len=0 TSval=377491 TSecr=118938101
138 0.193905985 172.31.24.227 -> 172.31.31.144 OpenFlow 82 Type: OFPT_MULTIPART_REPLY, OFPMP_METER
139 0.193907295 172.31.31.144 -> 172.31.24.227 TCP 66 6633 → 39472 [ACK] Seq=65 Ack=17 Win=853 Len=0 TSval=377491 TSecr=118938101
140 0.193909420 172.31.24.227 -> 172.31.31.144 OpenFlow 82 Type: OFPT_MULTIPART_REPLY, OFPMP_METER
141 0.193910598 172.31.31.144 -> 172.31.24.227 TCP 66 6633 → 39460 [ACK] Seq=65 Ack=49 Win=853 Len=0 TSval=377491 TSecr=118938101
142 0.193912160 172.31.31.144 -> 172.31.24.227 TCP 66 6633 → 39462 [ACK] Seq=65 Ack=49 Win=853 Len=0 TSval=377491 TSecr=118938101
143 0.193913801 172.31.31.144 -> 172.31.24.227 TCP 66 6633 → 39464 [ACK] Seq=65 Ack=49 Win=853 Len=0 TSval=377491 TSecr=118938101
144 0.193926004 172.31.24.227 -> 172.31.31.144 OpenFlow 98 Type: OFPT_MULTIPART_REPLY, OFPMP_METER
145 0.193928021 172.31.24.227 -> 172.31.31.144 OpenFlow 98 Type: OFPT_MULTIPART_REPLY, OFPMP_METER
146 0.193929507 172.31.24.227 -> 172.31.31.144 OpenFlow 98 Type: OFPT_MULTIPART_REPLY, OFPMP_METER
147 0.194018661 172.31.24.227 -> 172.31.31.144 OpenFlow 82 Type: OFPT_MULTIPART_REPLY, OFPMP_METER
148 0.194124935 172.31.31.144 -> 172.31.24.227 TCP 66 6633 → 39480 [ACK] Seq=65 Ack=17 Win=853 Len=0 TSval=377491 TSecr=118938101
149 0.194130155 172.31.31.144 -> 172.31.24.227 TCP 66 6633 → 39468 [ACK] Seq=65 Ack=33 Win=853 Len=0 TSval=377491 TSecr=118938101
150 0.194132039 172.31.31.144 -> 172.31.24.227 TCP 66 6633 → 39488 [ACK] Seq=65 Ack=17 Win=853 Len=0 TSval=377491 TSecr=118938101
151 0.194133735 172.31.31.144 -> 172.31.24.227 TCP 66 6633 → 39446 [ACK] Seq=65 Ack=33 Win=853 Len=0 TSval=377491 TSecr=118938101
152 0.194139135 172.31.24.227 -> 172.31.31.144 OpenFlow 98 Type: OFPT_MULTIPART_REPLY, OFPMP_METER
153 0.194145577 172.31.24.227 -> 172.31.31.144 OpenFlow 98 Type: OFPT_MULTIPART_REPLY, OFPMP_METER
154 0.194296562 172.31.31.144 -> 172.31.24.227 TCP 66 6633 → 39470 [ACK] Seq=65 Ack=33 Win=853 Len=0 TSval=377491 TSecr=118938101
155 0.194299731 172.31.31.144 -> 172.31.24.227 TCP 66 6633 → 39472 [ACK] Seq=65 Ack=33 Win=853 Len=0 TSval=377491 TSecr=118938101
156 0.194301431 172.31.31.144 -> 172.31.24.227 TCP 66 6633 → 39456 [ACK] Seq=65 Ack=17 Win=853 Len=0 TSval=377491 TSecr=118938101
157 0.194303239 172.31.31.144 -> 172.31.24.227 TCP 66 6633 → 39474 [ACK] Seq=65 Ack=49 Win=853 Len=0 TSval=377491 TSecr=118938101
158 0.194305450 172.31.31.144 -> 172.31.24.227 TCP 66 6633 → 39478 [ACK] Seq=65 Ack=49 Win=853 Len=0 TSval=377491 TSecr=118938101
159 0.194307516 172.31.31.144 -> 172.31.24.227 TCP 66 6633 → 39480 [ACK] Seq=65 Ack=49 Win=853 Len=0 TSval=377491 TSecr=118938101
160 0.194349196 172.31.31.144 -> 172.31.24.227 TCP 66 6633 → 39446 [ACK] Seq=65 Ack=49 Win=853 Len=0 TSval=377491 TSecr=118938101
161 0.194351362 172.31.31.144 -> 172.31.24.227 TCP 66 6633 → 39470 [ACK] Seq=65 Ack=49 Win=853 Len=0 TSval=377491 TSecr=118938101
162 0.194353622 172.31.31.144 -> 172.31.24.227 TCP 66 6633 → 39472 [ACK] Seq=65 Ack=49 Win=853 Len=0 TSval=377491 TSecr=118938101
163 0.194373899 172.31.31.144 -> 172.31.24.227 TCP 66 6633 → 39488 [ACK] Seq=65 Ack=49 Win=853 Len=0 TSval=377491 TSecr=118938101
164 0.194427062 172.31.31.144 -> 172.31.24.227 TCP 66 6633 → 39484 [ACK] Seq=65 Ack=49 Win=853 Len=0 TSval=377491 TSecr=118938101
165 0.194429398 172.31.31.144 -> 172.31.24.227 TCP 66 6633 → 39468 [ACK] Seq=65 Ack=49 Win=853 Len=0 TSval=377491 TSecr=118938101
166 0.194442495 172.31.31.144 -> 172.31.24.227 TCP 66 6633 → 39482 [ACK] Seq=65 Ack=49 Win=853 Len=0 TSval=377491 TSecr=118938101
167 0.194462445 172.31.31.144 -> 172.31.24.227 TCP 66 6633 → 39456 [ACK] Seq=65 Ack=49 Win=853 Len=0 TSval=377491 TSecr=118938101
168 0.194510348 172.31.31.144 -> 172.31.24.227 TCP 66 6633 → 39466 [ACK] Seq=65 Ack=49 Win=853 Len=0 TSval=377491 TSecr=118938101
169 0.505103388 172.31.24.227 -> 41.177.127.217 SSH 98 Server: Encrypted packet (len=44)
170 0.760973323 41.177.127.217 -> 172.31.24.227 TCP 54 58416 → 22 [ACK] Seq=1 Ack=45 Win=32382 Len=0
171 1.007631512 172.31.24.227 -> 41.177.127.217 SSH 98 Server: Encrypted packet (len=44)
172 1.259980852 41.177.127.217 -> 172.31.24.227 TCP 54 58416 → 22 [ACK] Seq=1 Ack=89 Win=32360 Len=0
173 1.392662002 172.31.31.144 -> 172.31.24.227 OpenFlow 187 Type: OFPT_PACKET_OUT
174 1.392706725 172.31.31.144 -> 172.31.24.227 OpenFlow 187 Type: OFPT_PACKET_OUT
175 1.392768227 172.31.31.144 -> 172.31.24.227 OpenFlow 187 Type: OFPT_PACKET_OUT
176 1.392848869 172.31.31.144 -> 172.31.24.227 OpenFlow 187 Type: OFPT_PACKET_OUT
177 1.392921450 172.31.31.144 -> 172.31.24.227 OpenFlow 187 Type: OFPT_PACKET_OUT
178 1.392932186 172.31.24.227 -> 172.31.31.144 TCP 66 39480 → 6633 [ACK] Seq=49 Ack=670 Win=78 Len=0 TSval=118938401 TSecr=377790
179 1.392999914 172.31.31.144 -> 172.31.24.227 OpenFlow 187 Type: OFPT_PACKET_OUT
180 1.393069733 172.31.31.144 -> 172.31.24.227 OpenFlow 187 Type: OFPT_PACKET_OUT
181 1.393167916 172.31.31.144 -> 172.31.24.227 OpenFlow 187 Type: OFPT_PACKET_OUT
182 1.393209956 172.31.31.144 -> 172.31.24.227 OpenFlow 187 Type: OFPT_PACKET_OUT
183 1.393277174 172.31.31.144 -> 172.31.24.227 OpenFlow 187 Type: OFPT_PACKET_OUT
184 1.393283725 172.31.24.227 -> 172.31.31.144 TCP 66 39480 → 6633 [ACK] Seq=49 Ack=1275 Win=78 Len=0 TSval=118938401 TSecr=377791
185 1.393352204 172.31.31.144 -> 172.31.24.227 OpenFlow 187 Type: OFPT_PACKET_OUT
186 1.393426743 172.31.31.144 -> 172.31.24.227 OpenFlow 187 Type: OFPT_PACKET_OUT
187 1.393569140 172.31.31.144 -> 172.31.24.227 OpenFlow 187 Type: OFPT_PACKET_OUT
188 1.393637747 172.31.24.227 -> 172.31.31.144 TCP 66 39480 → 6633 [ACK] Seq=49 Ack=1517 Win=78 Len=0 TSval=118938401 TSecr=377791
189 1.393684646 172.31.31.144 -> 172.31.24.227 OpenFlow 187 Type: OFPT_PACKET_OUT
190 1.393731801 172.31.24.227 -> 172.31.31.144 OpenFlow 189 Type: OFPT_PACKET_IN
191 1.393755077 172.31.24.227 -> 172.31.31.144 OpenFlow 435 Type: OFPT_PACKET_IN
192 1.393779697 172.31.31.144 -> 172.31.24.227 OpenFlow 187 Type: OFPT_PACKET_OUT
193 1.393796665 172.31.24.227 -> 172.31.31.144 OpenFlow 189 Type: OFPT_PACKET_IN
194 1.393817373 172.31.24.227 -> 172.31.31.144 OpenFlow 189 Type: OFPT_PACKET_IN
195 1.393896146 172.31.31.144 -> 172.31.24.227 OpenFlow 187 Type: OFPT_PACKET_OUT
196 1.393998027 172.31.31.144 -> 172.31.24.227 TCP 66 6633 → 39492 [ACK] Seq=65 Ack=172 Win=853 Len=0 TSval=377791 TSecr=118938401
197 1.394005975 172.31.31.144 -> 172.31.24.227 TCP 66 6633 → 39484 [ACK] Seq=65 Ack=541 Win=853 Len=0 TSval=377791 TSecr=118938401
198 1.394010944 172.31.31.144 -> 172.31.24.227 TCP 66 6633 → 39492 [ACK] Seq=65 Ack=295 Win=853 Len=0 TSval=377791 TSecr=118938401
199 1.394037266 172.31.31.144 -> 172.31.24.227 OpenFlow 187 Type: OFPT_PACKET_OUT
200 1.394041873 172.31.24.227 -> 172.31.31.144 TCP 66 39456 → 6633 [ACK] Seq=49 Ack=670 Win=66 Len=0 TSval=118938401 TSecr=377791
201 1.394112035 172.31.31.144 -> 172.31.24.227 OpenFlow 187 Type: OFPT_PACKET_OUT
202 1.394214863 172.31.31.144 -> 172.31.24.227 OpenFlow 187 Type: OFPT_PACKET_OUT
203 1.394262172 172.31.24.227 -> 172.31.31.144 TCP 66 39456 → 6633 [ACK] Seq=49 Ack=912 Win=66 Len=0 TSval=118938401 TSecr=377791
204 1.394329789 172.31.24.227 -> 172.31.31.144 OpenFlow 189 Type: OFPT_PACKET_IN
205 1.394350910 172.31.24.227 -> 172.31.31.144 OpenFlow 189 Type: OFPT_PACKET_IN
206 1.394368153 172.31.24.227 -> 172.31.31.144 OpenFlow 189 Type: OFPT_PACKET_IN
207 1.394397818 172.31.24.227 -> 172.31.31.144 OpenFlow 681 Type: OFPT_PACKET_IN
208 1.394524258 172.31.24.227 -> 172.31.31.144 OpenFlow 189 Type: OFPT_PACKET_IN
209 1.394534383 172.31.31.144 -> 172.31.24.227 OpenFlow 187 Type: OFPT_PACKET_OUT
210 1.394544242 172.31.31.144 -> 172.31.24.227 TCP 66 6633 → 39458 [ACK] Seq=65 Ack=172 Win=853 Len=0 TSval=377791 TSecr=118938401
211 1.394564410 172.31.24.227 -> 172.31.31.144 OpenFlow 189 Type: OFPT_PACKET_IN
212 1.394572385 172.31.31.144 -> 172.31.24.227 TCP 66 6633 → 39458 [ACK] Seq=65 Ack=295 Win=853 Len=0 TSval=377791 TSecr=118938401
213 1.394584144 172.31.24.227 -> 172.31.31.144 OpenFlow 189 Type: OFPT_PACKET_IN
214 1.394599057 172.31.24.227 -> 172.31.31.144 OpenFlow 189 Type: OFPT_PACKET_IN
215 1.394633294 172.31.24.227 -> 172.31.31.144 OpenFlow 189 Type: OFPT_PACKET_IN
216 1.394656181 172.31.31.144 -> 172.31.24.227 TCP 66 6633 → 39464 [ACK] Seq=65 Ack=787 Win=853 Len=0 TSval=377791 TSecr=118938401
217 1.394732274 172.31.31.144 -> 172.31.24.227 TCP 66 6633 → 39446 [ACK] Seq=65 Ack=172 Win=853 Len=0 TSval=377791 TSecr=118938401
218 1.394815468 172.31.31.144 -> 172.31.24.227 TCP 66 6633 → 39450 [ACK] Seq=65 Ack=295 Win=853 Len=0 TSval=377791 TSecr=118938401
219 1.394835071 172.31.31.144 -> 172.31.24.227 TCP 66 6633 → 39448 [ACK] Seq=65 Ack=295 Win=853 Len=0 TSval=377791 TSecr=118938401
220 1.394871879 172.31.24.227 -> 172.31.31.144 OpenFlow 189 Type: OFPT_PACKET_IN
221 1.394915744 172.31.31.144 -> 172.31.24.227 OpenFlow 187 Type: OFPT_PACKET_OUT
222 1.395070890 172.31.31.144 -> 172.31.24.227 TCP 66 6633 → 39446 [ACK] Seq=65 Ack=295 Win=853 Len=0 TSval=377791 TSecr=118938401
223 1.395088393 172.31.24.227 -> 172.31.31.144 TCP 66 39456 → 6633 [ACK] Seq=49 Ack=1154 Win=66 Len=0 TSval=118938401 TSecr=377791
224 1.395297803 172.31.31.144 -> 172.31.24.227 OpenFlow 187 Type: OFPT_PACKET_OUT
225 1.395311446 172.31.24.227 -> 172.31.31.144 OpenFlow 189 Type: OFPT_PACKET_IN
226 1.395495644 172.31.31.144 -> 172.31.24.227 TCP 66 6633 → 39446 [ACK] Seq=65 Ack=418 Win=853 Len=0 TSval=377791 TSecr=118938401
227 1.395512994 172.31.31.144 -> 172.31.24.227 OpenFlow 187 Type: OFPT_PACKET_OUT
228 1.395562049 172.31.24.227 -> 172.31.31.144 OpenFlow 189 Type: OFPT_PACKET_IN
229 1.395599826 172.31.24.227 -> 172.31.31.144 TCP 66 39456 → 6633 [ACK] Seq=49 Ack=1396 Win=66 Len=0 TSval=118938401 TSecr=377791
230 1.395619934 172.31.31.144 -> 172.31.24.227 OpenFlow 187 Type: OFPT_PACKET_OUT
231 1.395750606 172.31.31.144 -> 172.31.24.227 TCP 66 6633 → 39446 [ACK] Seq=65 Ack=541 Win=853 Len=0 TSval=377791 TSecr=118938401
232 1.395790755 172.31.31.144 -> 172.31.24.227 OpenFlow 187 Type: OFPT_PACKET_OUT
233 1.395813465 172.31.31.144 -> 172.31.24.227 OpenFlow 187 Type: OFPT_PACKET_OUT
234 1.395878709 172.31.24.227 -> 172.31.31.144 OpenFlow 189 Type: OFPT_PACKET_IN
235 1.395889122 172.31.31.144 -> 172.31.24.227 OpenFlow 187 Type: OFPT_PACKET_OUT
236 1.395900710 172.31.24.227 -> 172.31.31.144 OpenFlow 189 Type: OFPT_PACKET_IN
237 1.395974651 172.31.31.144 -> 172.31.24.227 OpenFlow 187 Type: OFPT_PACKET_OUT
238 1.396056348 172.31.31.144 -> 172.31.24.227 OpenFlow 187 Type: OFPT_PACKET_OUT
239 1.396090686 172.31.31.144 -> 172.31.24.227 TCP 66 6633 → 39446 [ACK] Seq=65 Ack=664 Win=853 Len=0 TSval=377791 TSecr=118938401
240 1.396118107 172.31.31.144 -> 172.31.24.227 TCP 66 6633 → 39446 [ACK] Seq=65 Ack=787 Win=853 Len=0 TSval=377791 TSecr=118938401
241 1.396140924 172.31.31.144 -> 172.31.24.227 OpenFlow 187 Type: OFPT_PACKET_OUT
242 1.396146420 172.31.24.227 -> 172.31.31.144 TCP 66 39486 → 6633 [ACK] Seq=49 Ack=791 Win=81 Len=0 TSval=118938401 TSecr=377791
243 1.396192557 172.31.31.144 -> 172.31.24.227 OpenFlow 187 Type: OFPT_PACKET_OUT
244 1.396283321 172.31.31.144 -> 172.31.24.227 OpenFlow 187 Type: OFPT_PACKET_OUT
245 1.396313659 172.31.24.227 -> 172.31.31.144 TCP 66 39486 → 6633 [ACK] Seq=49 Ack=1033 Win=81 Len=0 TSval=118938401 TSecr=377791
246 1.396384413 172.31.31.144 -> 172.31.24.227 OpenFlow 187 Type: OFPT_PACKET_OUT
247 1.396441157 172.31.31.144 -> 172.31.24.227 OpenFlow 187 Type: OFPT_PACKET_OUT
248 1.396518032 172.31.31.144 -> 172.31.24.227 OpenFlow 187 Type: OFPT_PACKET_OUT
249 1.396593826 172.31.31.144 -> 172.31.24.227 OpenFlow 187 Type: OFPT_PACKET_OUT
250 1.396673537 172.31.24.227 -> 172.31.31.144 TCP 66 39468 → 6633 [ACK] Seq=49 Ack=549 Win=80 Len=0 TSval=118938401 TSecr=377791
251 1.396718903 172.31.31.144 -> 172.31.24.227 OpenFlow 187 Type: OFPT_PACKET_OUT
252 1.396765486 172.31.24.227 -> 172.31.31.144 OpenFlow 189 Type: OFPT_PACKET_IN
253 1.396788280 172.31.31.144 -> 172.31.24.227 OpenFlow 187 Type: OFPT_PACKET_OUT
254 1.396794438 172.31.24.227 -> 172.31.31.144 OpenFlow 189 Type: OFPT_PACKET_IN
255 1.396815905 172.31.24.227 -> 172.31.31.144 OpenFlow 189 Type: OFPT_PACKET_IN
256 1.396836775 172.31.24.227 -> 172.31.31.144 OpenFlow 189 Type: OFPT_PACKET_IN
257 1.396860213 172.31.24.227 -> 172.31.31.144 OpenFlow 189 Type: OFPT_PACKET_IN
258 1.396885152 172.31.31.144 -> 172.31.24.227 OpenFlow 187 Type: OFPT_PACKET_OUT
259 1.396890882 172.31.24.227 -> 172.31.31.144 OpenFlow 435 Type: OFPT_PACKET_IN
260 1.396939204 172.31.31.144 -> 172.31.24.227 OpenFlow 187 Type: OFPT_PACKET_OUT
261 1.396971388 172.31.31.144 -> 172.31.24.227 TCP 66 6633 → 39470 [ACK] Seq=65 Ack=172 Win=853 Len=0 TSval=377792 TSecr=118938401
262 1.396991698 172.31.31.144 -> 172.31.24.227 TCP 66 6633 → 39470 [ACK] Seq=65 Ack=295 Win=853 Len=0 TSval=377792 TSecr=118938401
263 1.397013506 172.31.31.144 -> 172.31.24.227 TCP 66 6633 → 39472 [ACK] Seq=65 Ack=172 Win=853 Len=0 TSval=377792 TSecr=118938402
264 1.397033627 172.31.31.144 -> 172.31.24.227 OpenFlow 187 Type: OFPT_PACKET_OUT
265 1.397037379 172.31.24.227 -> 172.31.31.144 TCP 66 39468 → 6633 [ACK] Seq=49 Ack=1154 Win=80 Len=0 TSval=118938402 TSecr=377792
266 1.397057312 172.31.31.144 -> 172.31.24.227 TCP 66 6633 → 39472 [ACK] Seq=65 Ack=295 Win=853 Len=0 TSval=377792 TSecr=118938402
267 1.397083388 172.31.24.227 -> 172.31.31.144 OpenFlow 189 Type: OFPT_PACKET_IN
268 1.397088312 172.31.31.144 -> 172.31.24.227 OpenFlow 187 Type: OFPT_PACKET_OUT
269 1.397103976 172.31.24.227 -> 172.31.31.144 OpenFlow 189 Type: OFPT_PACKET_IN
270 1.397130044 172.31.31.144 -> 172.31.24.227 TCP 66 6633 → 39478 [ACK] Seq=65 Ack=541 Win=853 Len=0 TSval=377792 TSecr=118938402
271 1.397154567 172.31.31.144 -> 172.31.24.227 OpenFlow 187 Type: OFPT_PACKET_OUT
272 1.397213710 172.31.31.144 -> 172.31.24.227 OpenFlow 187 Type: OFPT_PACKET_OUT
273 1.397277691 172.31.31.144 -> 172.31.24.227 OpenFlow 187 Type: OFPT_PACKET_OUT
274 1.397328420 172.31.31.144 -> 172.31.24.227 TCP 66 6633 → 39464 [ACK] Seq=65 Ack=1033 Win=853 Len=0 TSval=377792 TSecr=118938402
275 1.397343010 172.31.31.144 -> 172.31.24.227 OpenFlow 187 Type: OFPT_PACKET_OUT
276 1.397347239 172.31.24.227 -> 172.31.31.144 TCP 66 39468 → 6633 [ACK] Seq=49 Ack=1759 Win=80 Len=0 TSval=118938402 TSecr=377792
277 1.397579335 172.31.24.227 -> 172.31.31.144 OpenFlow 189 Type: OFPT_PACKET_IN
278 1.397601425 172.31.24.227 -> 172.31.31.144 OpenFlow 189 Type: OFPT_PACKET_IN
279 1.397703976 172.31.24.227 -> 172.31.31.144 OpenFlow 189 Type: OFPT_PACKET_IN
280 1.397725095 172.31.24.227 -> 172.31.31.144 OpenFlow 681 Type: OFPT_PACKET_IN
281 1.397772893 172.31.31.144 -> 172.31.24.227 TCP 66 6633 → 39492 [ACK] Seq=65 Ack=418 Win=853 Len=0 TSval=377792 TSecr=118938402
282 1.397790364 172.31.31.144 -> 172.31.24.227 TCP 66 6633 → 39492 [ACK] Seq=65 Ack=541 Win=853 Len=0 TSval=377792 TSecr=118938402
283 1.397858083 172.31.31.144 -> 172.31.24.227 OpenFlow 187 Type: OFPT_PACKET_OUT
284 1.397877530 172.31.31.144 -> 172.31.24.227 OpenFlow 187 Type: OFPT_PACKET_OUT
285 1.397899826 172.31.31.144 -> 172.31.24.227 TCP 66 6633 → 39462 [ACK] Seq=65 Ack=172 Win=853 Len=0 TSval=377792 TSecr=118938402
286 1.397919863 172.31.31.144 -> 172.31.24.227 TCP 66 6633 → 39462 [ACK] Seq=65 Ack=787 Win=853 Len=0 TSval=377792 TSecr=118938402
287 1.397980349 172.31.31.144 -> 172.31.24.227 OpenFlow 187 Type: OFPT_PACKET_OUT
288 1.398066065 172.31.24.227 -> 172.31.31.144 TCP 66 39466 → 6633 [ACK] Seq=49 Ack=428 Win=385 Len=0 TSval=118938402 TSecr=377792
289 1.398150585 172.31.24.227 -> 172.31.31.144 OpenFlow 189 Type: OFPT_PACKET_IN
290 1.398199335 172.31.24.227 -> 172.31.31.144 OpenFlow 189 Type: OFPT_PACKET_IN
291 1.398220505 172.31.31.144 -> 172.31.24.227 OpenFlow 187 Type: OFPT_PACKET_OUT
292 1.398227588 172.31.24.227 -> 172.31.31.144 OpenFlow 189 Type: OFPT_PACKET_IN
293 1.398303734 172.31.31.144 -> 172.31.24.227 OpenFlow 187 Type: OFPT_PACKET_OUT
294 1.398374378 172.31.31.144 -> 172.31.24.227 OpenFlow 187 Type: OFPT_PACKET_OUT
295 1.398394076 172.31.31.144 -> 172.31.24.227 TCP 66 6633 → 39492 [ACK] Seq=65 Ack=664 Win=853 Len=0 TSval=377792 TSecr=118938402
296 1.398416479 172.31.31.144 -> 172.31.24.227 TCP 66 6633 → 39492 [ACK] Seq=65 Ack=787 Win=853 Len=0 TSval=377792 TSecr=118938402
297 1.398452653 172.31.31.144 -> 172.31.24.227 OpenFlow 187 Type: OFPT_PACKET_OUT
298 1.398523319 172.31.24.227 -> 172.31.31.144 TCP 66 39466 → 6633 [ACK] Seq=49 Ack=912 Win=385 Len=0 TSval=118938402 TSecr=377792
299 1.398533575 172.31.31.144 -> 172.31.24.227 OpenFlow 187 Type: OFPT_PACKET_OUT
300 1.398638873 172.31.24.227 -> 172.31.31.144 OpenFlow 189 Type: OFPT_PACKET_IN
301 1.398650538 172.31.31.144 -> 172.31.24.227 OpenFlow 187 Type: OFPT_PACKET_OUT
302 1.398660923 172.31.24.227 -> 172.31.31.144 OpenFlow 189 Type: OFPT_PACKET_IN
303 1.398685675 172.31.24.227 -> 172.31.31.144 OpenFlow 312 Type: OFPT_PACKET_IN
304 1.398697179 172.31.24.227 -> 172.31.31.144 OpenFlow 189 Type: OFPT_PACKET_IN
305 1.398797661 172.31.31.144 -> 172.31.24.227 OpenFlow 187 Type: OFPT_PACKET_OUT
306 1.398832635 172.31.31.144 -> 172.31.24.227 TCP 66 6633 → 39470 [ACK] Seq=65 Ack=418 Win=853 Len=0 TSval=377792 TSecr=118938402
307 1.398853321 172.31.31.144 -> 172.31.24.227 TCP 66 6633 → 39470 [ACK] Seq=65 Ack=541 Win=853 Len=0 TSval=377792 TSecr=118938402
308 1.398873543 172.31.31.144 -> 172.31.24.227 OpenFlow 187 Type: OFPT_PACKET_OUT
309 1.398907236 172.31.31.144 -> 172.31.24.227 TCP 66 6633 → 39470 [ACK] Seq=65 Ack=787 Win=853 Len=0 TSval=377792 TSecr=118938402
310 1.398933987 172.31.31.144 -> 172.31.24.227 OpenFlow 187 Type: OFPT_PACKET_OUT
311 1.398954570 172.31.31.144 -> 172.31.24.227 TCP 66 6633 → 39476 [ACK] Seq=65 Ack=295 Win=853 Len=0 TSval=377792 TSecr=118938402
312 1.399004757 172.31.31.144 -> 172.31.24.227 OpenFlow 187 Type: OFPT_PACKET_OUT
313 1.399059666 172.31.31.144 -> 172.31.24.227 OpenFlow 187 Type: OFPT_PACKET_OUT
314 1.399154271 172.31.24.227 -> 172.31.31.144 TCP 66 39466 → 6633 [ACK] Seq=49 Ack=1759 Win=385 Len=0 TSval=118938402 TSecr=377792
315 1.399164702 172.31.31.144 -> 172.31.24.227 OpenFlow 187 Type: OFPT_PACKET_OUT
316 1.399286324 172.31.31.144 -> 172.31.24.227 OpenFlow 187 Type: OFPT_PACKET_OUT
317 1.399381344 172.31.31.144 -> 172.31.24.227 OpenFlow 187 Type: OFPT_PACKET_OUT
318 1.399418460 172.31.24.227 -> 172.31.31.144 OpenFlow 189 Type: OFPT_PACKET_IN
319 1.399439491 172.31.31.144 -> 172.31.24.227 OpenFlow 187 Type: OFPT_PACKET_OUT
320 1.399444759 172.31.24.227 -> 172.31.31.144 OpenFlow 435 Type: OFPT_PACKET_IN
321 1.399470867 172.31.24.227 -> 172.31.31.144 OpenFlow 189 Type: OFPT_PACKET_IN
322 1.399489482 172.31.24.227 -> 172.31.31.144 OpenFlow 312 Type: OFPT_PACKET_IN
323 1.399548329 172.31.31.144 -> 172.31.24.227 OpenFlow 187 Type: OFPT_PACKET_OUT
324 1.399605376 172.31.31.144 -> 172.31.24.227 OpenFlow 187 Type: OFPT_PACKET_OUT
325 1.399633168 172.31.24.227 -> 172.31.31.144 TCP 66 39466 → 6633 [ACK] Seq=49 Ack=2243 Win=385 Len=0 TSval=118938402 TSecr=377792
326 1.399662712 172.31.31.144 -> 172.31.24.227 TCP 66 6633 → 39458 [ACK] Seq=65 Ack=418 Win=853 Len=0 TSval=377792 TSecr=118938402
327 1.399680183 172.31.31.144 -> 172.31.24.227 TCP 66 6633 → 39458 [ACK] Seq=65 Ack=664 Win=853 Len=0 TSval=377792 TSecr=118938402
328 1.399694730 172.31.31.144 -> 172.31.24.227 TCP 66 6633 → 39450 [ACK] Seq=65 Ack=787 Win=853 Len=0 TSval=377792 TSecr=118938402
329 1.399717834 172.31.31.144 -> 172.31.24.227 OpenFlow 187 Type: OFPT_PACKET_OUT
330 1.399746321 172.31.31.144 -> 172.31.24.227 OpenFlow 187 Type: OFPT_PACKET_OUT
331 1.399873334 172.31.31.144 -> 172.31.24.227 OpenFlow 187 Type: OFPT_PACKET_OUT
332 1.399879413 172.31.24.227 -> 172.31.31.144 TCP 66 39490 → 6633 [ACK] Seq=49 Ack=670 Win=57 Len=0 TSval=118938402 TSecr=377792
333 1.399940328 172.31.31.144 -> 172.31.24.227 OpenFlow 187 Type: OFPT_PACKET_OUT
334 1.400009758 172.31.31.144 -> 172.31.24.227 OpenFlow 187 Type: OFPT_PACKET_OUT
335 1.400063028 172.31.24.227 -> 172.31.31.144 TCP 66 39490 → 6633 [ACK] Seq=49 Ack=912 Win=57 Len=0 TSval=118938402 TSecr=377792
336 1.400081891 172.31.31.144 -> 172.31.24.227 OpenFlow 187 Type: OFPT_PACKET_OUT
337 1.400142238 172.31.31.144 -> 172.31.24.227 OpenFlow 187 Type: OFPT_PACKET_OUT
338 1.400167987 172.31.24.227 -> 172.31.31.144 TCP 66 39490 → 6633 [ACK] Seq=49 Ack=1154 Win=57 Len=0 TSval=118938402 TSecr=377792
339 1.400303343 172.31.24.227 -> 172.31.31.144 OpenFlow 189 Type: OFPT_PACKET_IN
340 1.400325894 172.31.24.227 -> 172.31.31.144 OpenFlow 189 Type: OFPT_PACKET_IN
341 1.400343877 172.31.24.227 -> 172.31.31.144 OpenFlow 189 Type: OFPT_PACKET_IN
342 1.400374886 172.31.31.144 -> 172.31.24.227 OpenFlow 187 Type: OFPT_PACKET_OUT
343 1.400381249 172.31.24.227 -> 172.31.31.144 OpenFlow 558 Type: OFPT_PACKET_IN
344 1.400393029 172.31.24.227 -> 172.31.31.144 OpenFlow 189 Type: OFPT_PACKET_IN
345 1.400424838 172.31.24.227 -> 172.31.31.144 OpenFlow 558 Type: OFPT_PACKET_IN
346 1.400499097 172.31.31.144 -> 172.31.24.227 TCP 66 6633 → 39446 [ACK] Seq=65 Ack=910 Win=853 Len=0 TSval=377792 TSecr=118938402
347 1.400518562 172.31.31.144 -> 172.31.24.227 TCP 66 6633 → 39446 [ACK] Seq=65 Ack=1033 Win=853 Len=0 TSval=377792 TSecr=118938402
348 1.400539505 172.31.31.144 -> 172.31.24.227 TCP 66 6633 → 39452 [ACK] Seq=65 Ack=172 Win=853 Len=0 TSval=377792 TSecr=118938402
349 1.400563307 172.31.31.144 -> 172.31.24.227 TCP 66 6633 → 39452 [ACK] Seq=65 Ack=664 Win=853 Len=0 TSval=377792 TSecr=118938402
350 1.400582031 172.31.31.144 -> 172.31.24.227 TCP 66 6633 → 39458 [ACK] Seq=65 Ack=787 Win=853 Len=0 TSval=377792 TSecr=118938402
351 1.400603012 172.31.31.144 -> 172.31.24.227 TCP 66 6633 → 39458 [ACK] Seq=65 Ack=1279 Win=853 Len=0 TSval=377792 TSecr=118938402
352 1.400687946 172.31.24.227 -> 172.31.31.144 OpenFlow 189 Type: OFPT_PACKET_IN
353 1.400880451 172.31.31.144 -> 172.31.24.227 TCP 66 6633 → 39452 [ACK] Seq=65 Ack=787 Win=853 Len=0 TSval=377793 TSecr=118938402
354 1.432843919 172.31.24.227 -> 172.31.31.144 TCP 66 39456 → 6633 [ACK] Seq=49 Ack=1517 Win=66 Len=0 TSval=118938411 TSecr=377791
355 1.436837352 172.31.24.227 -> 172.31.31.144 TCP 66 39490 → 6633 [ACK] Seq=49 Ack=1275 Win=57 Len=0 TSval=118938412 TSecr=377792
356 1.492853830 172.31.31.144 -> 172.31.24.227 OpenFlow 187 Type: OFPT_PACKET_OUT
357 1.492890514 172.31.31.144 -> 172.31.24.227 OpenFlow 187 Type: OFPT_PACKET_OUT
358 1.492897607 172.31.31.144 -> 172.31.24.227 OpenFlow 187 Type: OFPT_PACKET_OUT
359 1.492972689 172.31.31.144 -> 172.31.24.227 OpenFlow 187 Type: OFPT_PACKET_OUT
360 1.493040643 172.31.31.144 -> 172.31.24.227 OpenFlow 187 Type: OFPT_PACKET_OUT
361 1.493049523 172.31.24.227 -> 172.31.31.144 TCP 66 39472 → 6633 [ACK] Seq=295 Ack=670 Win=63 Len=0 TSval=118938426 TSecr=377816
362 1.493114520 172.31.31.144 -> 172.31.24.227 OpenFlow 187 Type: OFPT_PACKET_OUT
363 1.493168555 172.31.31.144 -> 172.31.24.227 OpenFlow 187 Type: OFPT_PACKET_OUT
364 1.493243002 172.31.31.144 -> 172.31.24.227 OpenFlow 187 Type: OFPT_PACKET_OUT
365 1.493366760 172.31.31.144 -> 172.31.24.227 OpenFlow 187 Type: OFPT_PACKET_OUT
366 1.493429204 172.31.31.144 -> 172.31.24.227 OpenFlow 187 Type: OFPT_PACKET_OUT
367 1.493488082 172.31.24.227 -> 172.31.31.144 TCP 66 39472 → 6633 [ACK] Seq=295 Ack=1033 Win=63 Len=0 TSval=118938426 TSecr=377816
368 1.493498451 172.31.31.144 -> 172.31.24.227 OpenFlow 187 Type: OFPT_PACKET_OUT
369 1.493562361 172.31.31.144 -> 172.31.24.227 OpenFlow 187 Type: OFPT_PACKET_OUT
370 1.493593670 172.31.24.227 -> 172.31.31.144 OpenFlow 189 Type: OFPT_PACKET_IN
371 1.493617314 172.31.24.227 -> 172.31.31.144 OpenFlow 189 Type: OFPT_PACKET_IN
