  1 0.000000000 172.31.31.144 -> 172.31.23.72 TCP 187 6633 → 45532 [PSH, ACK] Seq=1 Ack=1 Win=853 Len=121 TSval=1195162 TSecr=30016729
  2 0.000017841 172.31.31.144 -> 172.31.23.72 TCP 187 6633 → 45532 [PSH, ACK] Seq=122 Ack=1 Win=853 Len=121 TSval=1195162 TSecr=30016729
  3 0.000021709 172.31.31.144 -> 172.31.23.72 TCP 187 6633 → 45532 [PSH, ACK] Seq=243 Ack=1 Win=853 Len=121 TSval=1195162 TSecr=30016729
  4 0.000032252 172.31.31.144 -> 172.31.23.72 TCP 187 6633 → 45532 [PSH, ACK] Seq=364 Ack=1 Win=853 Len=121 TSval=1195162 TSecr=30016729
  5 0.000176749 172.31.31.144 -> 172.31.23.72 TCP 187 6633 → 45532 [PSH, ACK] Seq=485 Ack=1 Win=853 Len=121 TSval=1195162 TSecr=30016729
  6 0.000181793 172.31.31.144 -> 172.31.23.72 TCP 187 6633 → 45532 [PSH, ACK] Seq=606 Ack=1 Win=853 Len=121 TSval=1195162 TSecr=30016729
  7 0.000183762 172.31.31.144 -> 172.31.23.72 TCP 187 6633 → 45532 [PSH, ACK] Seq=727 Ack=1 Win=853 Len=121 TSval=1195162 TSecr=30016729
  8 0.000230712 172.31.31.144 -> 172.31.23.72 TCP 187 6633 → 45532 [PSH, ACK] Seq=848 Ack=1 Win=853 Len=121 TSval=1195162 TSecr=30016729
  9 0.000294113 172.31.31.144 -> 172.31.23.72 TCP 187 6633 → 45544 [PSH, ACK] Seq=1 Ack=1 Win=853 Len=121 TSval=1195162 TSecr=30016729
 10 0.000351230 172.31.31.144 -> 172.31.23.72 TCP 187 6633 → 45544 [PSH, ACK] Seq=122 Ack=1 Win=853 Len=121 TSval=1195162 TSecr=30016729
 11 0.000382013 172.31.31.144 -> 172.31.23.72 TCP 187 6633 → 45544 [PSH, ACK] Seq=243 Ack=1 Win=853 Len=121 TSval=1195162 TSecr=30016729
 12 0.000437028 172.31.31.144 -> 172.31.23.72 TCP 187 6633 → 45544 [PSH, ACK] Seq=364 Ack=1 Win=853 Len=121 TSval=1195162 TSecr=30016729
 13 0.000490567 172.31.31.144 -> 172.31.23.72 TCP 187 6633 → 45544 [PSH, ACK] Seq=485 Ack=1 Win=853 Len=121 TSval=1195162 TSecr=30016729
 14 0.000544211 172.31.31.144 -> 172.31.23.72 TCP 187 6633 → 45544 [PSH, ACK] Seq=606 Ack=1 Win=853 Len=121 TSval=1195162 TSecr=30016729
 15 0.000611860 172.31.31.144 -> 172.31.23.72 TCP 187 6633 → 45524 [PSH, ACK] Seq=1 Ack=1 Win=853 Len=121 TSval=1195162 TSecr=30016729
 16 0.000652915 172.31.31.144 -> 172.31.23.72 TCP 187 6633 → 45524 [PSH, ACK] Seq=122 Ack=1 Win=853 Len=121 TSval=1195162 TSecr=30016729
 17 0.000678319 172.31.23.72 -> 172.31.31.144 TCP 66 45532 → 6633 [ACK] Seq=1 Ack=969 Win=213 Len=0 TSval=30016753 TSecr=1195162
 18 0.000749862 172.31.31.144 -> 172.31.23.72 TCP 187 6633 → 45524 [PSH, ACK] Seq=243 Ack=1 Win=853 Len=121 TSval=1195162 TSecr=30016729
 19 0.000754445 172.31.31.144 -> 172.31.23.72 TCP 187 6633 → 45524 [PSH, ACK] Seq=364 Ack=1 Win=853 Len=121 TSval=1195162 TSecr=30016729
 20 0.000817952 172.31.31.144 -> 172.31.23.72 TCP 187 6633 → 45524 [PSH, ACK] Seq=485 Ack=1 Win=853 Len=121 TSval=1195162 TSecr=30016729
 21 0.000850214 172.31.31.144 -> 172.31.23.72 TCP 187 6633 → 45524 [PSH, ACK] Seq=606 Ack=1 Win=853 Len=121 TSval=1195162 TSecr=30016729
 22 0.000905973 172.31.31.144 -> 172.31.23.72 TCP 187 6633 → 45524 [PSH, ACK] Seq=727 Ack=1 Win=853 Len=121 TSval=1195162 TSecr=30016729
 23 0.000943733 172.31.23.72 -> 172.31.31.144 TCP 66 45544 → 6633 [ACK] Seq=1 Ack=727 Win=213 Len=0 TSval=30016753 TSecr=1195162
 24 0.000958895 172.31.31.144 -> 172.31.23.72 TCP 187 6633 → 45524 [PSH, ACK] Seq=848 Ack=1 Win=853 Len=121 TSval=1195162 TSecr=30016729
 25 0.001057357 172.31.31.144 -> 172.31.23.72 TCP 187 6633 → 45524 [PSH, ACK] Seq=969 Ack=1 Win=853 Len=121 TSval=1195162 TSecr=30016729
 26 0.001062384 172.31.31.144 -> 172.31.23.72 TCP 187 6633 → 45524 [PSH, ACK] Seq=1090 Ack=1 Win=853 Len=121 TSval=1195162 TSecr=30016729
 27 0.001133316 172.31.31.144 -> 172.31.23.72 TCP 187 6633 → 45522 [PSH, ACK] Seq=1 Ack=1 Win=853 Len=121 TSval=1195162 TSecr=30016729
 28 0.001165694 172.31.31.144 -> 172.31.23.72 TCP 187 6633 → 45522 [PSH, ACK] Seq=122 Ack=1 Win=853 Len=121 TSval=1195162 TSecr=30016729
 29 0.001221109 172.31.31.144 -> 172.31.23.72 TCP 187 6633 → 45522 [PSH, ACK] Seq=243 Ack=1 Win=853 Len=121 TSval=1195162 TSecr=30016729
 30 0.001272963 172.31.31.144 -> 172.31.23.72 TCP 187 6633 → 45522 [PSH, ACK] Seq=364 Ack=1 Win=853 Len=121 TSval=1195162 TSecr=30016729
 31 0.001322097 172.31.31.144 -> 172.31.23.72 TCP 187 6633 → 45522 [PSH, ACK] Seq=485 Ack=1 Win=853 Len=121 TSval=1195162 TSecr=30016729
 32 0.001370039 172.31.31.144 -> 172.31.23.72 TCP 187 6633 → 45522 [PSH, ACK] Seq=606 Ack=1 Win=853 Len=121 TSval=1195162 TSecr=30016729
 33 0.001429436 172.31.31.144 -> 172.31.23.72 TCP 187 6633 → 45510 [PSH, ACK] Seq=1 Ack=1 Win=853 Len=121 TSval=1195162 TSecr=30016729
 34 0.001481726 172.31.31.144 -> 172.31.23.72 TCP 187 6633 → 45510 [PSH, ACK] Seq=122 Ack=1 Win=853 Len=121 TSval=1195162 TSecr=30016729
 35 0.001491256 172.31.23.72 -> 172.31.31.144 TCP 66 45524 → 6633 [ACK] Seq=1 Ack=1211 Win=213 Len=0 TSval=30016753 TSecr=1195162
 36 0.001538147 172.31.31.144 -> 172.31.23.72 TCP 187 6633 → 45510 [PSH, ACK] Seq=243 Ack=1 Win=853 Len=121 TSval=1195162 TSecr=30016729
 37 0.001602325 172.31.31.144 -> 172.31.23.72 TCP 187 6633 → 45510 [PSH, ACK] Seq=364 Ack=1 Win=853 Len=121 TSval=1195162 TSecr=30016729
 38 0.001642031 172.31.31.144 -> 172.31.23.72 TCP 187 6633 → 45510 [PSH, ACK] Seq=485 Ack=1 Win=853 Len=121 TSval=1195162 TSecr=30016729
 39 0.001693000 172.31.31.144 -> 172.31.23.72 TCP 187 6633 → 45510 [PSH, ACK] Seq=606 Ack=1 Win=853 Len=121 TSval=1195162 TSecr=30016729
 40 0.001747488 172.31.31.144 -> 172.31.23.72 TCP 187 6633 → 45510 [PSH, ACK] Seq=727 Ack=1 Win=853 Len=121 TSval=1195162 TSecr=30016729
 41 0.001801479 172.31.31.144 -> 172.31.23.72 TCP 187 6633 → 45510 [PSH, ACK] Seq=848 Ack=1 Win=853 Len=121 TSval=1195162 TSecr=30016729
 42 0.001836750 172.31.23.72 -> 172.31.31.144 TCP 66 45522 → 6633 [ACK] Seq=1 Ack=727 Win=213 Len=0 TSval=30016753 TSecr=1195162
 43 0.001858491 172.31.31.144 -> 172.31.23.72 TCP 187 6633 → 45540 [PSH, ACK] Seq=1 Ack=1 Win=853 Len=121 TSval=1195162 TSecr=30016729
 44 0.001906945 172.31.31.144 -> 172.31.23.72 TCP 187 6633 → 45540 [PSH, ACK] Seq=122 Ack=1 Win=853 Len=121 TSval=1195162 TSecr=30016729
 45 0.001945053 172.31.31.144 -> 172.31.23.72 TCP 187 6633 → 45540 [PSH, ACK] Seq=243 Ack=1 Win=853 Len=121 TSval=1195162 TSecr=30016729
 46 0.001999566 172.31.31.144 -> 172.31.23.72 TCP 187 6633 → 45540 [PSH, ACK] Seq=364 Ack=1 Win=853 Len=121 TSval=1195162 TSecr=30016729
 47 0.002051663 172.31.31.144 -> 172.31.23.72 TCP 187 6633 → 45540 [PSH, ACK] Seq=485 Ack=1 Win=853 Len=121 TSval=1195162 TSecr=30016729
 48 0.002104123 172.31.31.144 -> 172.31.23.72 TCP 187 6633 → 45540 [PSH, ACK] Seq=606 Ack=1 Win=853 Len=121 TSval=1195162 TSecr=30016729
 49 0.002192646 172.31.23.72 -> 172.31.31.144 TCP 66 45510 → 6633 [ACK] Seq=1 Ack=969 Win=213 Len=0 TSval=30016753 TSecr=1195162
 50 0.002264106 172.31.23.72 -> 172.31.31.144 OpenFlow 189 Type: OFPT_PACKET_IN
 51 0.002308871 172.31.31.144 -> 172.31.23.72 OpenFlow 187 Type: OFPT_PACKET_OUT
 52 0.002316169 172.31.23.72 -> 172.31.31.144 OpenFlow 189 Type: OFPT_PACKET_IN
 53 0.002322393 172.31.31.144 -> 172.31.23.72 OpenFlow 187 Type: OFPT_PACKET_OUT
 54 0.002324576 172.31.31.144 -> 172.31.23.72 OpenFlow 187 Type: OFPT_PACKET_OUT
 55 0.002476344 172.31.31.144 -> 172.31.23.72 OpenFlow 187 Type: OFPT_PACKET_OUT
 56 0.002480997 172.31.31.144 -> 172.31.23.72 TCP 187 6633 → 45526 [PSH, ACK] Seq=1 Ack=1 Win=853 Len=121 TSval=1195162 TSecr=30016729
 57 0.002483981 172.31.31.144 -> 172.31.23.72 TCP 187 6633 → 45526 [PSH, ACK] Seq=122 Ack=1 Win=853 Len=121 TSval=1195162 TSecr=30016729
 58 0.002509298 172.31.31.144 -> 172.31.23.72 TCP 187 6633 → 45526 [PSH, ACK] Seq=243 Ack=1 Win=853 Len=121 TSval=1195162 TSecr=30016729
 59 0.002557950 172.31.31.144 -> 172.31.23.72 TCP 187 6633 → 45526 [PSH, ACK] Seq=364 Ack=1 Win=853 Len=121 TSval=1195162 TSecr=30016729
 60 0.002609204 172.31.31.144 -> 172.31.23.72 TCP 187 6633 → 45526 [PSH, ACK] Seq=485 Ack=1 Win=853 Len=121 TSval=1195162 TSecr=30016729
 61 0.002651433 172.31.31.144 -> 172.31.23.72 TCP 187 6633 → 45526 [PSH, ACK] Seq=606 Ack=1 Win=853 Len=121 TSval=1195162 TSecr=30016729
 62 0.002763546 172.31.23.72 -> 172.31.31.144 TCP 66 45540 → 6633 [ACK] Seq=247 Ack=1211 Win=213 Len=0 TSval=30016754 TSecr=1195162
 63 0.002785489 172.31.31.144 -> 172.31.23.72 TCP 187 6633 → 45526 [PSH, ACK] Seq=727 Ack=1 Win=853 Len=121 TSval=1195162 TSecr=30016729
 64 0.002789420 172.31.31.144 -> 172.31.23.72 TCP 66 6633 → 45540 [ACK] Seq=1211 Ack=247 Win=853 Len=0 TSval=1195162 TSecr=30016753
 65 0.002793272 172.31.31.144 -> 172.31.23.72 TCP 187 6633 → 45526 [PSH, ACK] Seq=848 Ack=1 Win=853 Len=121 TSval=1195162 TSecr=30016729
 66 0.002849482 172.31.23.72 -> 172.31.31.144 OpenFlow 189 Type: OFPT_PACKET_IN
 67 0.002883025 172.31.31.144 -> 172.31.23.72 TCP 187 6633 → 45554 [PSH, ACK] Seq=1 Ack=1 Win=853 Len=121 TSval=1195162 TSecr=30016552
 68 0.002888452 172.31.31.144 -> 172.31.23.72 TCP 187 6633 → 45554 [PSH, ACK] Seq=122 Ack=1 Win=853 Len=121 TSval=1195162 TSecr=30016552
 69 0.002893536 172.31.23.72 -> 172.31.31.144 OpenFlow 681 Type: OFPT_PACKET_IN
 70 0.002945001 172.31.31.144 -> 172.31.23.72 TCP 187 6633 → 45554 [PSH, ACK] Seq=243 Ack=1 Win=853 Len=121 TSval=1195162 TSecr=30016552
 71 0.003098403 172.31.31.144 -> 172.31.23.72 TCP 187 6633 → 45554 [PSH, ACK] Seq=364 Ack=1 Win=853 Len=121 TSval=1195162 TSecr=30016552
 72 0.003103268 172.31.31.144 -> 172.31.23.72 TCP 187 6633 → 45554 [PSH, ACK] Seq=485 Ack=1 Win=853 Len=121 TSval=1195162 TSecr=30016552
 73 0.003106677 172.31.31.144 -> 172.31.23.72 TCP 66 6633 → 45526 [ACK] Seq=969 Ack=124 Win=853 Len=0 TSval=1195162 TSecr=30016754
 74 0.003109670 172.31.31.144 -> 172.31.23.72 TCP 187 6633 → 45554 [PSH, ACK] Seq=606 Ack=1 Win=853 Len=121 TSval=1195162 TSecr=30016552
 75 0.003277227 172.31.31.144 -> 172.31.23.72 TCP 66 6633 → 45526 [ACK] Seq=969 Ack=739 Win=853 Len=0 TSval=1195162 TSecr=30016754
 76 0.003400316 172.31.23.72 -> 172.31.31.144 TCP 66 45554 → 6633 [ACK] Seq=1 Ack=727 Win=213 Len=0 TSval=30016754 TSecr=1195162
 77 0.003468143 172.31.23.72 -> 172.31.31.144 OpenFlow 189 Type: OFPT_PACKET_IN
 78 0.003491069 172.31.23.72 -> 172.31.31.144 OpenFlow 435 Type: OFPT_PACKET_IN
 79 0.003502254 172.31.23.72 -> 172.31.31.144 OpenFlow 189 Type: OFPT_PACKET_IN
 80 0.003515481 172.31.23.72 -> 172.31.31.144 OpenFlow 189 Type: OFPT_PACKET_IN
 81 0.003532700 172.31.23.72 -> 172.31.31.144 OpenFlow 189 Type: OFPT_PACKET_IN
 82 0.003558346 172.31.23.72 -> 172.31.31.144 OpenFlow 189 Type: OFPT_PACKET_IN
 83 0.003649494 172.31.23.72 -> 172.31.31.144 OpenFlow 189 Type: OFPT_PACKET_IN
 84 0.003653536 172.31.23.72 -> 172.31.31.144 OpenFlow 189 Type: OFPT_PACKET_IN
 85 0.003655543 172.31.23.72 -> 172.31.31.144 OpenFlow 189 Type: OFPT_PACKET_IN
 86 0.003671701 172.31.23.72 -> 172.31.31.144 OpenFlow 189 Type: OFPT_PACKET_IN
 87 0.003686778 172.31.23.72 -> 172.31.31.144 OpenFlow 189 Type: OFPT_PACKET_IN
 88 0.003693781 172.31.31.144 -> 172.31.23.72 TCP 66 6633 → 45552 [ACK] Seq=1 Ack=124 Win=853 Len=0 TSval=1195163 TSecr=30016754
 89 0.003717642 172.31.23.72 -> 172.31.31.144 OpenFlow 189 Type: OFPT_PACKET_IN
 90 0.003730076 172.31.23.72 -> 172.31.31.144 OpenFlow 189 Type: OFPT_PACKET_IN
 91 0.003745281 172.31.23.72 -> 172.31.31.144 OpenFlow 189 Type: OFPT_PACKET_IN
 92 0.003765768 172.31.23.72 -> 172.31.31.144 OpenFlow 189 Type: OFPT_PACKET_IN
 93 0.003777465 172.31.23.72 -> 172.31.31.144 OpenFlow 189 Type: OFPT_PACKET_IN
 94 0.003789004 172.31.23.72 -> 172.31.31.144 OpenFlow 189 Type: OFPT_PACKET_IN
 95 0.003791668 172.31.23.72 -> 172.31.31.144 OpenFlow 435 Type: OFPT_PACKET_IN
 96 0.003810392 172.31.23.72 -> 172.31.31.144 OpenFlow 189 Type: OFPT_PACKET_IN
 97 0.003813015 172.31.23.72 -> 172.31.31.144 OpenFlow 435 Type: OFPT_PACKET_IN
 98 0.003824358 172.31.23.72 -> 172.31.31.144 OpenFlow 189 Type: OFPT_PACKET_IN
 99 0.004317837 172.31.31.144 -> 172.31.23.72 TCP 66 6633 → 45552 [ACK] Seq=1 Ack=493 Win=853 Len=0 TSval=1195163 TSecr=30016754
100 0.004323846 172.31.31.144 -> 172.31.23.72 TCP 66 6633 → 45550 [ACK] Seq=1 Ack=124 Win=853 Len=0 TSval=1195163 TSecr=30016754
101 0.004326122 172.31.31.144 -> 172.31.23.72 TCP 66 6633 → 45508 [ACK] Seq=1 Ack=124 Win=853 Len=0 TSval=1195163 TSecr=30016754
102 0.004328179 172.31.31.144 -> 172.31.23.72 TCP 66 6633 → 45542 [ACK] Seq=1 Ack=124 Win=853 Len=0 TSval=1195163 TSecr=30016754
103 0.004330186 172.31.31.144 -> 172.31.23.72 TCP 66 6633 → 45520 [ACK] Seq=1 Ack=124 Win=853 Len=0 TSval=1195163 TSecr=30016754
104 0.004332067 172.31.31.144 -> 172.31.23.72 TCP 66 6633 → 45546 [ACK] Seq=1 Ack=124 Win=853 Len=0 TSval=1195163 TSecr=30016754
105 0.004336034 172.31.23.72 -> 172.31.31.144 OpenFlow 189 Type: OFPT_PACKET_IN
106 0.004341166 172.31.31.144 -> 172.31.23.72 TCP 66 6633 → 45550 [ACK] Seq=1 Ack=247 Win=853 Len=0 TSval=1195163 TSecr=30016754
107 0.004343020 172.31.31.144 -> 172.31.23.72 TCP 66 6633 → 45508 [ACK] Seq=1 Ack=247 Win=853 Len=0 TSval=1195163 TSecr=30016754
108 0.004344734 172.31.31.144 -> 172.31.23.72 TCP 66 6633 → 45534 [ACK] Seq=1 Ack=124 Win=853 Len=0 TSval=1195163 TSecr=30016754
109 0.004347097 172.31.23.72 -> 172.31.31.144 OpenFlow 435 Type: OFPT_PACKET_IN
110 0.004348425 172.31.31.144 -> 172.31.23.72 TCP 66 6633 → 45530 [ACK] Seq=1 Ack=124 Win=853 Len=0 TSval=1195163 TSecr=30016754
111 0.004350803 172.31.23.72 -> 172.31.31.144 OpenFlow 435 Type: OFPT_PACKET_IN
112 0.004357041 172.31.23.72 -> 172.31.31.144 OpenFlow 435 Type: OFPT_PACKET_IN
113 0.004359163 172.31.23.72 -> 172.31.31.144 OpenFlow 189 Type: OFPT_PACKET_IN
114 0.004361157 172.31.23.72 -> 172.31.31.144 OpenFlow 435 Type: OFPT_PACKET_IN
115 0.004363072 172.31.23.72 -> 172.31.31.144 OpenFlow 189 Type: OFPT_PACKET_IN
116 0.004717125 172.31.31.144 -> 172.31.23.72 TCP 66 6633 → 45514 [ACK] Seq=1 Ack=124 Win=853 Len=0 TSval=1195163 TSecr=30016754
117 0.004719397 172.31.31.144 -> 172.31.23.72 TCP 66 6633 → 45518 [ACK] Seq=1 Ack=124 Win=853 Len=0 TSval=1195163 TSecr=30016754
118 0.004721314 172.31.31.144 -> 172.31.23.72 TCP 66 6633 → 45512 [ACK] Seq=1 Ack=124 Win=853 Len=0 TSval=1195163 TSecr=30016754
119 0.004723042 172.31.31.144 -> 172.31.23.72 TCP 66 6633 → 45538 [ACK] Seq=1 Ack=124 Win=853 Len=0 TSval=1195163 TSecr=30016754
120 0.004725858 172.31.23.72 -> 172.31.31.144 OpenFlow 189 Type: OFPT_PACKET_IN
121 0.004729471 172.31.31.144 -> 172.31.23.72 TCP 66 6633 → 45542 [ACK] Seq=1 Ack=493 Win=853 Len=0 TSval=1195163 TSecr=30016754
122 0.004734403 172.31.23.72 -> 172.31.31.144 OpenFlow 435 Type: OFPT_PACKET_IN
123 0.004736365 172.31.23.72 -> 172.31.31.144 OpenFlow 189 Type: OFPT_PACKET_IN
124 0.004738077 172.31.23.72 -> 172.31.31.144 OpenFlow 189 Type: OFPT_PACKET_IN
125 0.005188383 172.31.31.144 -> 172.31.23.72 TCP 66 6633 → 45524 [ACK] Seq=1211 Ack=124 Win=853 Len=0 TSval=1195163 TSecr=30016754
126 0.005190541 172.31.31.144 -> 172.31.23.72 TCP 66 6633 → 45520 [ACK] Seq=1 Ack=493 Win=853 Len=0 TSval=1195163 TSecr=30016754
127 0.005192101 172.31.31.144 -> 172.31.23.72 TCP 66 6633 → 45522 [ACK] Seq=727 Ack=124 Win=853 Len=0 TSval=1195163 TSecr=30016754
128 0.005193771 172.31.31.144 -> 172.31.23.72 TCP 66 6633 → 45546 [ACK] Seq=1 Ack=247 Win=853 Len=0 TSval=1195163 TSecr=30016754
129 0.005195396 172.31.31.144 -> 172.31.23.72 TCP 66 6633 → 45534 [ACK] Seq=1 Ack=493 Win=853 Len=0 TSval=1195163 TSecr=30016754
130 0.005196930 172.31.31.144 -> 172.31.23.72 TCP 66 6633 → 45530 [ACK] Seq=1 Ack=493 Win=853 Len=0 TSval=1195163 TSecr=30016754
131 0.005198576 172.31.31.144 -> 172.31.23.72 TCP 66 6633 → 45518 [ACK] Seq=1 Ack=493 Win=853 Len=0 TSval=1195163 TSecr=30016754
132 0.005200037 172.31.31.144 -> 172.31.23.72 TCP 66 6633 → 45514 [ACK] Seq=1 Ack=247 Win=853 Len=0 TSval=1195163 TSecr=30016754
133 0.005442372 172.31.31.144 -> 172.31.23.72 TCP 66 6633 → 45528 [ACK] Seq=1 Ack=493 Win=853 Len=0 TSval=1195163 TSecr=30016754
134 0.005445300 172.31.31.144 -> 172.31.23.72 TCP 66 6633 → 45512 [ACK] Seq=1 Ack=247 Win=853 Len=0 TSval=1195163 TSecr=30016754
135 0.005446796 172.31.31.144 -> 172.31.23.72 TCP 66 6633 → 45538 [ACK] Seq=1 Ack=247 Win=853 Len=0 TSval=1195163 TSecr=30016754
136 0.005448416 172.31.31.144 -> 172.31.23.72 TCP 66 6633 → 45532 [ACK] Seq=969 Ack=493 Win=853 Len=0 TSval=1195163 TSecr=30016754
137 0.005554111 172.31.31.144 -> 172.31.23.72 TCP 66 6633 → 45524 [ACK] Seq=1211 Ack=247 Win=853 Len=0 TSval=1195163 TSecr=30016754
138 0.005559108 172.31.31.144 -> 172.31.23.72 TCP 66 6633 → 45522 [ACK] Seq=727 Ack=247 Win=853 Len=0 TSval=1195163 TSecr=30016754
139 0.099447740 172.31.31.144 -> 172.31.23.72 OpenFlow 187 Type: OFPT_PACKET_OUT
140 0.099470625 172.31.31.144 -> 172.31.23.72 OpenFlow 187 Type: OFPT_PACKET_OUT
141 0.099475081 172.31.31.144 -> 172.31.23.72 OpenFlow 187 Type: OFPT_PACKET_OUT
142 0.099492389 172.31.31.144 -> 172.31.23.72 OpenFlow 187 Type: OFPT_PACKET_OUT
143 0.099525839 172.31.31.144 -> 172.31.23.72 OpenFlow 187 Type: OFPT_PACKET_OUT
144 0.099564027 172.31.31.144 -> 172.31.23.72 OpenFlow 187 Type: OFPT_PACKET_OUT
145 0.099615473 172.31.31.144 -> 172.31.23.72 OpenFlow 187 Type: OFPT_PACKET_OUT
146 0.099679265 172.31.31.144 -> 172.31.23.72 OpenFlow 187 Type: OFPT_PACKET_OUT
147 0.099740968 172.31.31.144 -> 172.31.23.72 OpenFlow 187 Type: OFPT_PACKET_OUT
148 0.099785057 172.31.31.144 -> 172.31.23.72 OpenFlow 187 Type: OFPT_PACKET_OUT
149 0.099840123 172.31.31.144 -> 172.31.23.72 OpenFlow 187 Type: OFPT_PACKET_OUT
150 0.099883524 172.31.31.144 -> 172.31.23.72 OpenFlow 187 Type: OFPT_PACKET_OUT
151 0.099934684 172.31.31.144 -> 172.31.23.72 OpenFlow 187 Type: OFPT_PACKET_OUT
152 0.100017001 172.31.31.144 -> 172.31.23.72 OpenFlow 187 Type: OFPT_PACKET_OUT
153 0.100046984 172.31.31.144 -> 172.31.23.72 OpenFlow 187 Type: OFPT_PACKET_OUT
154 0.100097260 172.31.31.144 -> 172.31.23.72 OpenFlow 187 Type: OFPT_PACKET_OUT
155 0.100184619 172.31.23.72 -> 172.31.31.144 TCP 66 45552 → 6633 [ACK] Seq=493 Ack=969 Win=213 Len=0 TSval=30016778 TSecr=1195186
156 0.100198304 172.31.31.144 -> 172.31.23.72 OpenFlow 187 Type: OFPT_PACKET_OUT
157 0.100202686 172.31.31.144 -> 172.31.23.72 OpenFlow 187 Type: OFPT_PACKET_OUT
158 0.100261381 172.31.31.144 -> 172.31.23.72 OpenFlow 187 Type: OFPT_PACKET_OUT
159 0.100289111 172.31.23.72 -> 172.31.31.144 OpenFlow 189 Type: OFPT_PACKET_IN
160 0.100329980 172.31.31.144 -> 172.31.23.72 OpenFlow 187 Type: OFPT_PACKET_OUT
161 0.100339867 172.31.23.72 -> 172.31.31.144 OpenFlow 189 Type: OFPT_PACKET_IN
162 0.100387503 172.31.31.144 -> 172.31.23.72 OpenFlow 187 Type: OFPT_PACKET_OUT
163 0.100433343 172.31.31.144 -> 172.31.23.72 OpenFlow 187 Type: OFPT_PACKET_OUT
164 0.100551171 172.31.31.144 -> 172.31.23.72 TCP 187 6633 → 45548 [PSH, ACK] Seq=1 Ack=1 Win=853 Len=121 TSval=1195187 TSecr=30016729
165 0.100556495 172.31.31.144 -> 172.31.23.72 TCP 66 6633 → 45550 [ACK] Seq=969 Ack=370 Win=853 Len=0 TSval=1195187 TSecr=30016778
166 0.100560616 172.31.31.144 -> 172.31.23.72 TCP 187 6633 → 45548 [PSH, ACK] Seq=122 Ack=1 Win=853 Len=121 TSval=1195187 TSecr=30016729
167 0.100611536 172.31.31.144 -> 172.31.23.72 TCP 187 6633 → 45548 [PSH, ACK] Seq=243 Ack=1 Win=853 Len=121 TSval=1195187 TSecr=30016729
168 0.100645813 172.31.31.144 -> 172.31.23.72 TCP 187 6633 → 45548 [PSH, ACK] Seq=364 Ack=1 Win=853 Len=121 TSval=1195187 TSecr=30016729
169 0.100746532 172.31.31.144 -> 172.31.23.72 TCP 66 6633 → 45550 [ACK] Seq=969 Ack=493 Win=853 Len=0 TSval=1195187 TSecr=30016778
170 0.100752397 172.31.31.144 -> 172.31.23.72 TCP 187 6633 → 45548 [PSH, ACK] Seq=485 Ack=1 Win=853 Len=121 TSval=1195187 TSecr=30016729
171 0.100754738 172.31.31.144 -> 172.31.23.72 TCP 187 6633 → 45548 [PSH, ACK] Seq=606 Ack=1 Win=853 Len=121 TSval=1195187 TSecr=30016729
172 0.100800449 172.31.31.144 -> 172.31.23.72 TCP 187 6633 → 45548 [PSH, ACK] Seq=727 Ack=1 Win=853 Len=121 TSval=1195187 TSecr=30016729
173 0.100849159 172.31.31.144 -> 172.31.23.72 TCP 187 6633 → 45548 [PSH, ACK] Seq=848 Ack=1 Win=853 Len=121 TSval=1195187 TSecr=30016729
174 0.100920219 172.31.31.144 -> 172.31.23.72 OpenFlow 187 Type: OFPT_PACKET_OUT
175 0.100961696 172.31.23.72 -> 172.31.31.144 TCP 66 45508 → 6633 [ACK] Seq=247 Ack=727 Win=213 Len=0 TSval=30016778 TSecr=1195187
176 0.100968602 172.31.31.144 -> 172.31.23.72 OpenFlow 187 Type: OFPT_PACKET_OUT
177 0.101022207 172.31.31.144 -> 172.31.23.72 OpenFlow 187 Type: OFPT_PACKET_OUT
178 0.101045986 172.31.23.72 -> 172.31.31.144 OpenFlow 189 Type: OFPT_PACKET_IN
179 0.101075075 172.31.31.144 -> 172.31.23.72 OpenFlow 187 Type: OFPT_PACKET_OUT
180 0.101082057 172.31.23.72 -> 172.31.31.144 OpenFlow 189 Type: OFPT_PACKET_IN
181 0.101164975 172.31.31.144 -> 172.31.23.72 OpenFlow 187 Type: OFPT_PACKET_OUT
182 0.101169642 172.31.31.144 -> 172.31.23.72 OpenFlow 187 Type: OFPT_PACKET_OUT
183 0.101270488 172.31.31.144 -> 172.31.23.72 TCP 187 6633 → 45536 [PSH, ACK] Seq=1 Ack=1 Win=853 Len=121 TSval=1195187 TSecr=30016729
184 0.101275582 172.31.31.144 -> 172.31.23.72 TCP 66 6633 → 45548 [ACK] Seq=969 Ack=124 Win=853 Len=0 TSval=1195187 TSecr=30016778
185 0.101280092 172.31.31.144 -> 172.31.23.72 TCP 187 6633 → 45536 [PSH, ACK] Seq=122 Ack=1 Win=853 Len=121 TSval=1195187 TSecr=30016729
186 0.101334172 172.31.31.144 -> 172.31.23.72 TCP 187 6633 → 45536 [PSH, ACK] Seq=243 Ack=1 Win=853 Len=121 TSval=1195187 TSecr=30016729
187 0.101381208 172.31.31.144 -> 172.31.23.72 TCP 187 6633 → 45536 [PSH, ACK] Seq=364 Ack=1 Win=853 Len=121 TSval=1195187 TSecr=30016729
188 0.101416192 172.31.31.144 -> 172.31.23.72 TCP 66 6633 → 45548 [ACK] Seq=969 Ack=247 Win=853 Len=0 TSval=1195187 TSecr=30016778
189 0.101438496 172.31.31.144 -> 172.31.23.72 TCP 187 6633 → 45536 [PSH, ACK] Seq=485 Ack=1 Win=853 Len=121 TSval=1195187 TSecr=30016729
190 0.101482887 172.31.31.144 -> 172.31.23.72 TCP 187 6633 → 45536 [PSH, ACK] Seq=606 Ack=1 Win=853 Len=121 TSval=1195187 TSecr=30016729
191 0.101550653 172.31.31.144 -> 172.31.23.72 OpenFlow 187 Type: OFPT_PACKET_OUT
192 0.101596361 172.31.31.144 -> 172.31.23.72 OpenFlow 187 Type: OFPT_PACKET_OUT
193 0.101646052 172.31.31.144 -> 172.31.23.72 OpenFlow 187 Type: OFPT_PACKET_OUT
194 0.101696458 172.31.31.144 -> 172.31.23.72 OpenFlow 187 Type: OFPT_PACKET_OUT
195 0.101717060 172.31.23.72 -> 172.31.31.144 TCP 66 45542 → 6633 [ACK] Seq=493 Ack=727 Win=213 Len=0 TSval=30016778 TSecr=1195187
196 0.101754357 172.31.31.144 -> 172.31.23.72 OpenFlow 187 Type: OFPT_PACKET_OUT
197 0.101810293 172.31.31.144 -> 172.31.23.72 OpenFlow 187 Type: OFPT_PACKET_OUT
198 0.101854248 172.31.31.144 -> 172.31.23.72 OpenFlow 187 Type: OFPT_PACKET_OUT
199 0.101921418 172.31.31.144 -> 172.31.23.72 OpenFlow 187 Type: OFPT_PACKET_OUT
200 0.101971747 172.31.31.144 -> 172.31.23.72 OpenFlow 187 Type: OFPT_PACKET_OUT
201 0.102013566 172.31.31.144 -> 172.31.23.72 OpenFlow 187 Type: OFPT_PACKET_OUT
202 0.102082483 172.31.31.144 -> 172.31.23.72 TCP 187 6633 → 45516 [PSH, ACK] Seq=1 Ack=1 Win=853 Len=121 TSval=1195187 TSecr=30016729
203 0.102092942 172.31.23.72 -> 172.31.31.144 TCP 66 45536 → 6633 [ACK] Seq=1 Ack=727 Win=213 Len=0 TSval=30016778 TSecr=1195187
204 0.102130437 172.31.31.144 -> 172.31.23.72 TCP 187 6633 → 45516 [PSH, ACK] Seq=122 Ack=1 Win=853 Len=121 TSval=1195187 TSecr=30016729
205 0.102229776 172.31.31.144 -> 172.31.23.72 TCP 187 6633 → 45516 [PSH, ACK] Seq=243 Ack=1 Win=853 Len=121 TSval=1195187 TSecr=30016729
206 0.102234236 172.31.31.144 -> 172.31.23.72 TCP 187 6633 → 45516 [PSH, ACK] Seq=364 Ack=1 Win=853 Len=121 TSval=1195187 TSecr=30016729
207 0.102295527 172.31.31.144 -> 172.31.23.72 TCP 187 6633 → 45516 [PSH, ACK] Seq=485 Ack=1 Win=853 Len=121 TSval=1195187 TSecr=30016729
208 0.102317474 172.31.31.144 -> 172.31.23.72 TCP 187 6633 → 45516 [PSH, ACK] Seq=606 Ack=1 Win=853 Len=121 TSval=1195187 TSecr=30016729
209 0.102613741 172.31.23.72 -> 172.31.31.144 TCP 66 45520 → 6633 [ACK] Seq=493 Ack=1211 Win=213 Len=0 TSval=30016779 TSecr=1195187
210 0.102684041 172.31.23.72 -> 172.31.31.144 OpenFlow 189 Type: OFPT_PACKET_IN
211 0.102708095 172.31.23.72 -> 172.31.31.144 OpenFlow 189 Type: OFPT_PACKET_IN
212 0.102887815 172.31.31.144 -> 172.31.23.72 TCP 66 6633 → 45516 [ACK] Seq=727 Ack=247 Win=853 Len=0 TSval=1195187 TSecr=30016779
213 0.103044288 172.31.23.72 -> 172.31.31.144 OpenFlow 189 Type: OFPT_PACKET_IN
214 0.103071579 172.31.23.72 -> 172.31.31.144 OpenFlow 435 Type: OFPT_PACKET_IN
215 0.103082446 172.31.23.72 -> 172.31.31.144 OpenFlow 189 Type: OFPT_PACKET_IN
216 0.103099377 172.31.23.72 -> 172.31.31.144 OpenFlow 189 Type: OFPT_PACKET_IN
217 0.103126054 172.31.23.72 -> 172.31.31.144 OpenFlow 189 Type: OFPT_PACKET_IN
218 0.103138064 172.31.23.72 -> 172.31.31.144 OpenFlow 189 Type: OFPT_PACKET_IN
219 0.103140801 172.31.23.72 -> 172.31.31.144 OpenFlow 189 Type: OFPT_PACKET_IN
220 0.103156948 172.31.23.72 -> 172.31.31.144 OpenFlow 189 Type: OFPT_PACKET_IN
221 0.103172551 172.31.23.72 -> 172.31.31.144 OpenFlow 189 Type: OFPT_PACKET_IN
222 0.103177795 172.31.23.72 -> 172.31.31.144 OpenFlow 189 Type: OFPT_PACKET_IN
223 0.103205008 172.31.23.72 -> 172.31.31.144 OpenFlow 189 Type: OFPT_PACKET_IN
224 0.103207257 172.31.23.72 -> 172.31.31.144 OpenFlow 189 Type: OFPT_PACKET_IN
225 0.103219449 172.31.23.72 -> 172.31.31.144 OpenFlow 189 Type: OFPT_PACKET_IN
226 0.103231944 172.31.23.72 -> 172.31.31.144 OpenFlow 189 Type: OFPT_PACKET_IN
227 0.103234542 172.31.23.72 -> 172.31.31.144 OpenFlow 435 Type: OFPT_PACKET_IN
228 0.103247070 172.31.23.72 -> 172.31.31.144 OpenFlow 189 Type: OFPT_PACKET_IN
229 0.103269350 172.31.23.72 -> 172.31.31.144 OpenFlow 189 Type: OFPT_PACKET_IN
230 0.103283294 172.31.23.72 -> 172.31.31.144 OpenFlow 189 Type: OFPT_PACKET_IN
231 0.103294949 172.31.23.72 -> 172.31.31.144 OpenFlow 189 Type: OFPT_PACKET_IN
232 0.103322110 172.31.23.72 -> 172.31.31.144 OpenFlow 189 Type: OFPT_PACKET_IN
233 0.103398849 172.31.31.144 -> 172.31.23.72 TCP 66 6633 → 45546 [ACK] Seq=1 Ack=370 Win=853 Len=0 TSval=1195187 TSecr=30016779
234 0.103405162 172.31.31.144 -> 172.31.23.72 TCP 66 6633 → 45546 [ACK] Seq=1 Ack=739 Win=853 Len=0 TSval=1195187 TSecr=30016779
235 0.103407180 172.31.31.144 -> 172.31.23.72 TCP 66 6633 → 45534 [ACK] Seq=1 Ack=616 Win=853 Len=0 TSval=1195187 TSecr=30016779
236 0.103409210 172.31.31.144 -> 172.31.23.72 TCP 66 6633 → 45514 [ACK] Seq=1 Ack=370 Win=853 Len=0 TSval=1195187 TSecr=30016779
237 0.103410964 172.31.31.144 -> 172.31.23.72 TCP 66 6633 → 45518 [ACK] Seq=1 Ack=616 Win=853 Len=0 TSval=1195187 TSecr=30016779
238 0.103429255 172.31.23.72 -> 172.31.31.144 OpenFlow 435 Type: OFPT_PACKET_IN
239 0.103436126 172.31.23.72 -> 172.31.31.144 OpenFlow 681 Type: OFPT_PACKET_IN
240 0.103708605 172.31.23.72 -> 172.31.31.144 OpenFlow 189 Type: OFPT_PACKET_IN
241 0.103710535 172.31.23.72 -> 172.31.31.144 OpenFlow 189 Type: OFPT_PACKET_IN
242 0.103712331 172.31.23.72 -> 172.31.31.144 OpenFlow 189 Type: OFPT_PACKET_IN
243 0.103714011 172.31.23.72 -> 172.31.31.144 OpenFlow 681 Type: OFPT_PACKET_IN
244 0.103715507 172.31.23.72 -> 172.31.31.144 OpenFlow 435 Type: OFPT_PACKET_IN
245 0.103877175 172.31.31.144 -> 172.31.23.72 TCP 66 6633 → 45534 [ACK] Seq=1 Ack=739 Win=853 Len=0 TSval=1195188 TSecr=30016779
246 0.103879666 172.31.31.144 -> 172.31.23.72 TCP 66 6633 → 45512 [ACK] Seq=1 Ack=370 Win=853 Len=0 TSval=1195188 TSecr=30016779
247 0.103881736 172.31.31.144 -> 172.31.23.72 TCP 66 6633 → 45538 [ACK] Seq=1 Ack=370 Win=853 Len=0 TSval=1195188 TSecr=30016779
248 0.103883555 172.31.31.144 -> 172.31.23.72 TCP 66 6633 → 45514 [ACK] Seq=1 Ack=493 Win=853 Len=0 TSval=1195188 TSecr=30016779
249 0.103885302 172.31.31.144 -> 172.31.23.72 TCP 66 6633 → 45524 [ACK] Seq=1211 Ack=370 Win=853 Len=0 TSval=1195188 TSecr=30016779
250 0.103887058 172.31.31.144 -> 172.31.23.72 TCP 66 6633 → 45528 [ACK] Seq=1 Ack=739 Win=853 Len=0 TSval=1195188 TSecr=30016779
251 0.103889572 172.31.31.144 -> 172.31.23.72 TCP 66 6633 → 45522 [ACK] Seq=727 Ack=370 Win=853 Len=0 TSval=1195188 TSecr=30016779
252 0.103891393 172.31.31.144 -> 172.31.23.72 TCP 66 6633 → 45518 [ACK] Seq=1 Ack=985 Win=853 Len=0 TSval=1195188 TSecr=30016779
253 0.103892976 172.31.31.144 -> 172.31.23.72 TCP 66 6633 → 45554 [ACK] Seq=727 Ack=124 Win=853 Len=0 TSval=1195188 TSecr=30016779
254 0.103899344 172.31.23.72 -> 172.31.31.144 OpenFlow 189 Type: OFPT_PACKET_IN
255 0.103904224 172.31.23.72 -> 172.31.31.144 OpenFlow 189 Type: OFPT_PACKET_IN
256 0.103913522 172.31.23.72 -> 172.31.31.144 OpenFlow 189 Type: OFPT_PACKET_IN
257 0.104199019 172.31.31.144 -> 172.31.23.72 TCP 66 6633 → 45552 [ACK] Seq=969 Ack=616 Win=853 Len=0 TSval=1195188 TSecr=30016779
258 0.104201335 172.31.31.144 -> 172.31.23.72 TCP 66 6633 → 45550 [ACK] Seq=969 Ack=616 Win=853 Len=0 TSval=1195188 TSecr=30016779
259 0.104203053 172.31.31.144 -> 172.31.23.72 TCP 66 6633 → 45520 [ACK] Seq=1211 Ack=616 Win=853 Len=0 TSval=1195188 TSecr=30016779
260 0.104204640 172.31.31.144 -> 172.31.23.72 TCP 66 6633 → 45512 [ACK] Seq=1 Ack=739 Win=853 Len=0 TSval=1195188 TSecr=30016779
261 0.104206267 172.31.31.144 -> 172.31.23.72 TCP 66 6633 → 45538 [ACK] Seq=1 Ack=985 Win=853 Len=0 TSval=1195188 TSecr=30016779
262 0.104207765 172.31.31.144 -> 172.31.23.72 TCP 66 6633 → 45524 [ACK] Seq=1211 Ack=493 Win=853 Len=0 TSval=1195188 TSecr=30016779
263 0.104400349 172.31.31.144 -> 172.31.23.72 TCP 66 6633 → 45510 [ACK] Seq=969 Ack=247 Win=853 Len=0 TSval=1195188 TSecr=30016779
264 0.104402876 172.31.31.144 -> 172.31.23.72 TCP 66 6633 → 45522 [ACK] Seq=727 Ack=493 Win=853 Len=0 TSval=1195188 TSecr=30016779
265 0.104404605 172.31.31.144 -> 172.31.23.72 TCP 66 6633 → 45540 [ACK] Seq=1211 Ack=985 Win=853 Len=0 TSval=1195188 TSecr=30016779
266 0.104406660 172.31.31.144 -> 172.31.23.72 TCP 66 6633 → 45554 [ACK] Seq=727 Ack=493 Win=853 Len=0 TSval=1195188 TSecr=30016779
267 0.104408243 172.31.31.144 -> 172.31.23.72 TCP 66 6633 → 45552 [ACK] Seq=969 Ack=739 Win=853 Len=0 TSval=1195188 TSecr=30016779
268 0.104539988 172.31.31.144 -> 172.31.23.72 TCP 66 6633 → 45520 [ACK] Seq=1211 Ack=739 Win=853 Len=0 TSval=1195188 TSecr=30016779
269 0.104541874 172.31.31.144 -> 172.31.23.72 TCP 66 6633 → 45550 [ACK] Seq=969 Ack=739 Win=853 Len=0 TSval=1195188 TSecr=30016779
270 2.752328826 172.31.23.72 -> 172.31.31.144 OpenFlow 146 Type: OFPT_PORT_STATUS
271 2.752405753 172.31.23.72 -> 172.31.31.144 OpenFlow 146 Type: OFPT_PORT_STATUS
272 2.752619933 172.31.31.144 -> 172.31.23.72 TCP 66 6633 → 45544 [ACK] Seq=727 Ack=81 Win=853 Len=0 TSval=1195850 TSecr=30017441
273 2.777870930 172.31.31.144 -> 172.31.23.72 OpenFlow 146 Type: OFPT_FLOW_MOD
274 2.777890424 172.31.31.144 -> 172.31.23.72 OpenFlow 146 Type: OFPT_FLOW_MOD
275 2.777894315 172.31.31.144 -> 172.31.23.72 OpenFlow 146 Type: OFPT_FLOW_MOD
276 2.777897526 172.31.31.144 -> 172.31.23.72 OpenFlow 226 Type: OFPT_FLOW_MOD
277 2.777900410 172.31.31.144 -> 172.31.23.72 OpenFlow 146 Type: OFPT_FLOW_MOD
278 2.777903447 172.31.31.144 -> 172.31.23.72 OpenFlow 146 Type: OFPT_FLOW_MOD
279 2.777906193 172.31.31.144 -> 172.31.23.72 OpenFlow 146 Type: OFPT_FLOW_MOD
280 2.777908715 172.31.31.144 -> 172.31.23.72 OpenFlow 154 Type: OFPT_BARRIER_REQUEST
281 2.777910834 172.31.31.144 -> 172.31.23.72 OpenFlow 146 Type: OFPT_FLOW_MOD
282 2.777913763 172.31.31.144 -> 172.31.23.72 OpenFlow 162 Type: OFPT_BARRIER_REQUEST
283 2.777915650 172.31.31.144 -> 172.31.23.72 OpenFlow 146 Type: OFPT_FLOW_MOD
284 2.777917542 172.31.31.144 -> 172.31.23.72 OpenFlow 146 Type: OFPT_FLOW_MOD
285 2.777924038 172.31.31.144 -> 172.31.23.72 OpenFlow 154 Type: OFPT_BARRIER_REQUEST
286 2.777925764 172.31.31.144 -> 172.31.23.72 OpenFlow 154 Type: OFPT_BARRIER_REQUEST
287 2.777927399 172.31.31.144 -> 172.31.23.72 OpenFlow 74 Type: OFPT_BARRIER_REQUEST
288 2.777929095 172.31.31.144 -> 172.31.23.72 OpenFlow 154 Type: OFPT_BARRIER_REQUEST
289 2.777930961 172.31.31.144 -> 172.31.23.72 OpenFlow 154 Type: OFPT_BARRIER_REQUEST
290 2.777932691 172.31.31.144 -> 172.31.23.72 OpenFlow 234 Type: OFPT_BARRIER_REQUEST
291 2.777934141 172.31.31.144 -> 172.31.23.72 OpenFlow 402 Type: OFPT_FLOW_MOD
292 2.777935747 172.31.31.144 -> 172.31.23.72 OpenFlow 234 Type: OFPT_BARRIER_REQUEST
293 2.777936950 172.31.31.144 -> 172.31.23.72 OpenFlow 322 Type: OFPT_BARRIER_REQUEST
294 2.777938313 172.31.31.144 -> 172.31.23.72 OpenFlow 146 Type: OFPT_FLOW_MOD
295 2.777939539 172.31.31.144 -> 172.31.23.72 OpenFlow 146 Type: OFPT_FLOW_MOD
296 2.777941147 172.31.31.144 -> 172.31.23.72 OpenFlow 146 Type: OFPT_FLOW_MOD
297 2.777942348 172.31.31.144 -> 172.31.23.72 OpenFlow 402 Type: OFPT_BARRIER_REQUEST
298 2.777944072 172.31.31.144 -> 172.31.23.72 OpenFlow 146 Type: OFPT_FLOW_MOD
299 2.777945557 172.31.31.144 -> 172.31.23.72 OpenFlow 146 Type: OFPT_FLOW_MOD
300 2.777946893 172.31.31.144 -> 172.31.23.72 OpenFlow 146 Type: OFPT_FLOW_MOD
301 2.777949699 172.31.31.144 -> 172.31.23.72 OpenFlow 146 Type: OFPT_FLOW_MOD
302 2.777951601 172.31.31.144 -> 172.31.23.72 OpenFlow 242 Type: OFPT_BARRIER_REQUEST
303 2.777953441 172.31.31.144 -> 172.31.23.72 OpenFlow 154 Type: OFPT_BARRIER_REQUEST
304 2.777955165 172.31.31.144 -> 172.31.23.72 OpenFlow 146 Type: OFPT_FLOW_MOD
305 2.777965973 172.31.31.144 -> 172.31.23.72 OpenFlow 242 Type: OFPT_BARRIER_REQUEST
306 2.777967328 172.31.31.144 -> 172.31.23.72 OpenFlow 146 Type: OFPT_FLOW_MOD
307 2.777969849 172.31.31.144 -> 172.31.23.72 OpenFlow 234 Type: OFPT_FLOW_MOD
308 2.777971485 172.31.31.144 -> 172.31.23.72 OpenFlow 146 Type: OFPT_FLOW_MOD
309 2.777973181 172.31.31.144 -> 172.31.23.72 OpenFlow 146 Type: OFPT_FLOW_MOD
310 2.777975153 172.31.31.144 -> 172.31.23.72 OpenFlow 154 Type: OFPT_BARRIER_REQUEST
311 2.777976453 172.31.31.144 -> 172.31.23.72 OpenFlow 146 Type: OFPT_FLOW_MOD
312 2.777977831 172.31.31.144 -> 172.31.23.72 OpenFlow 154 Type: OFPT_BARRIER_REQUEST
313 2.777979545 172.31.31.144 -> 172.31.23.72 OpenFlow 234 Type: OFPT_FLOW_MOD
314 2.777981044 172.31.31.144 -> 172.31.23.72 OpenFlow 146 Type: OFPT_FLOW_MOD
315 2.777983099 172.31.31.144 -> 172.31.23.72 OpenFlow 154 Type: OFPT_BARRIER_REQUEST
316 2.777984486 172.31.31.144 -> 172.31.23.72 OpenFlow 154 Type: OFPT_BARRIER_REQUEST
317 2.777985988 172.31.31.144 -> 172.31.23.72 OpenFlow 146 Type: OFPT_FLOW_MOD
318 2.777987449 172.31.31.144 -> 172.31.23.72 OpenFlow 146 Type: OFPT_FLOW_MOD
319 2.777991674 172.31.31.144 -> 172.31.23.72 OpenFlow 154 Type: OFPT_BARRIER_REQUEST
320 2.777993262 172.31.31.144 -> 172.31.23.72 OpenFlow 154 Type: OFPT_BARRIER_REQUEST
321 2.777994874 172.31.31.144 -> 172.31.23.72 OpenFlow 234 Type: OFPT_FLOW_MOD
322 2.777996788 172.31.31.144 -> 172.31.23.72 OpenFlow 146 Type: OFPT_FLOW_MOD
323 2.777998535 172.31.31.144 -> 172.31.23.72 OpenFlow 146 Type: OFPT_FLOW_MOD
324 2.777999722 172.31.31.144 -> 172.31.23.72 OpenFlow 146 Type: OFPT_FLOW_MOD
325 2.778000957 172.31.31.144 -> 172.31.23.72 OpenFlow 146 Type: OFPT_FLOW_MOD
326 2.778002093 172.31.31.144 -> 172.31.23.72 OpenFlow 146 Type: OFPT_FLOW_MOD
327 2.778003438 172.31.31.144 -> 172.31.23.72 OpenFlow 146 Type: OFPT_FLOW_MOD
328 2.778004822 172.31.31.144 -> 172.31.23.72 OpenFlow 322 Type: OFPT_BARRIER_REQUEST
329 2.778006490 172.31.31.144 -> 172.31.23.72 OpenFlow 226 Type: OFPT_FLOW_MOD
330 2.778008134 172.31.31.144 -> 172.31.23.72 OpenFlow 154 Type: OFPT_FLOW_MOD
331 2.778009874 172.31.31.144 -> 172.31.23.72 OpenFlow 146 Type: OFPT_FLOW_MOD
332 2.778011148 172.31.31.144 -> 172.31.23.72 OpenFlow 146 Type: OFPT_FLOW_MOD
333 2.778012181 172.31.31.144 -> 172.31.23.72 OpenFlow 578 Type: OFPT_BARRIER_REQUEST
334 2.778013990 172.31.31.144 -> 172.31.23.72 OpenFlow 74 Type: OFPT_BARRIER_REQUEST
335 2.778015632 172.31.31.144 -> 172.31.23.72 OpenFlow 74 Type: OFPT_BARRIER_REQUEST
336 2.778016933 172.31.31.144 -> 172.31.23.72 OpenFlow 330 Type: OFPT_BARRIER_REQUEST
337 2.778169197 172.31.23.72 -> 172.31.31.144 OpenFlow 74 Type: OFPT_BARRIER_REPLY
338 2.778196349 172.31.23.72 -> 172.31.31.144 OpenFlow 74 Type: OFPT_BARRIER_REPLY
339 2.778223720 172.31.23.72 -> 172.31.31.144 OpenFlow 82 Type: OFPT_BARRIER_REPLY
340 2.778252813 172.31.23.72 -> 172.31.31.144 OpenFlow 74 Type: OFPT_BARRIER_REPLY
341 2.778286373 172.31.23.72 -> 172.31.31.144 OpenFlow 74 Type: OFPT_BARRIER_REPLY
342 2.778306081 172.31.23.72 -> 172.31.31.144 OpenFlow 74 Type: OFPT_BARRIER_REPLY
343 2.778362670 172.31.23.72 -> 172.31.31.144 OpenFlow 74 Type: OFPT_BARRIER_REPLY
344 2.778437811 172.31.23.72 -> 172.31.31.144 OpenFlow 74 Type: OFPT_BARRIER_REPLY
345 2.778467822 172.31.31.144 -> 172.31.23.72 TCP 66 6633 → 45546 [ACK] Seq=841 Ack=747 Win=853 Len=0 TSval=1195856 TSecr=30017447
346 2.778473142 172.31.31.144 -> 172.31.23.72 TCP 66 6633 → 45546 [ACK] Seq=841 Ack=755 Win=853 Len=0 TSval=1195856 TSecr=30017447
347 2.778475299 172.31.31.144 -> 172.31.23.72 TCP 66 6633 → 45546 [ACK] Seq=841 Ack=771 Win=853 Len=0 TSval=1195856 TSecr=30017447
348 2.778476951 172.31.31.144 -> 172.31.23.72 TCP 66 6633 → 45546 [ACK] Seq=841 Ack=779 Win=853 Len=0 TSval=1195856 TSecr=30017447
349 2.778478958 172.31.31.144 -> 172.31.23.72 TCP 66 6633 → 45514 [ACK] Seq=337 Ack=501 Win=853 Len=0 TSval=1195856 TSecr=30017447
350 2.778490256 172.31.23.72 -> 172.31.31.144 OpenFlow 114 Type: OFPT_BARRIER_REPLY
351 2.778496102 172.31.23.72 -> 172.31.31.144 OpenFlow 82 Type: OFPT_BARRIER_REPLY
352 2.778514385 172.31.31.144 -> 172.31.23.72 TCP 66 6633 → 45514 [ACK] Seq=337 Ack=509 Win=853 Len=0 TSval=1195856 TSecr=30017447
353 2.778547296 172.31.23.72 -> 172.31.31.144 OpenFlow 82 Type: OFPT_BARRIER_REPLY
354 2.778578023 172.31.23.72 -> 172.31.31.144 OpenFlow 74 Type: OFPT_BARRIER_REPLY
355 2.778613486 172.31.23.72 -> 172.31.31.144 OpenFlow 74 Type: OFPT_BARRIER_REPLY
356 2.778626571 172.31.23.72 -> 172.31.31.144 TCP 66 45544 → 6633 [ACK] Seq=81 Ack=2239 Win=211 Len=0 TSval=30017448 TSecr=1195856
357 2.778642967 172.31.23.72 -> 172.31.31.144 OpenFlow 74 Type: OFPT_BARRIER_REPLY
358 2.778688880 172.31.31.144 -> 172.31.23.72 OpenFlow 322 Type: OFPT_BARRIER_REQUEST
359 2.778693919 172.31.31.144 -> 172.31.23.72 OpenFlow 578 Type: OFPT_BARRIER_REQUEST
360 2.778751345 172.31.23.72 -> 172.31.31.144 OpenFlow 74 Type: OFPT_BARRIER_REPLY
361 2.778807322 172.31.31.144 -> 172.31.23.72 TCP 66 6633 → 45518 [ACK] Seq=1513 Ack=1025 Win=853 Len=0 TSval=1195856 TSecr=30017447
362 2.778814015 172.31.31.144 -> 172.31.23.72 TCP 66 6633 → 45512 [ACK] Seq=337 Ack=747 Win=853 Len=0 TSval=1195856 TSecr=30017448
363 2.778818483 172.31.23.72 -> 172.31.31.144 OpenFlow 90 Type: OFPT_BARRIER_REPLY
364 2.778823701 172.31.23.72 -> 172.31.31.144 OpenFlow 130 Type: OFPT_BARRIER_REPLY
365 2.778848448 172.31.23.72 -> 172.31.31.144 OpenFlow 74 Type: OFPT_BARRIER_REPLY
366 2.778857355 172.31.31.144 -> 172.31.23.72 TCP 66 6633 → 45512 [ACK] Seq=337 Ack=755 Win=853 Len=0 TSval=1195856 TSecr=30017448
367 2.778898288 172.31.23.72 -> 172.31.31.144 TCP 66 45548 → 6633 [ACK] Seq=247 Ack=1137 Win=213 Len=0 TSval=30017448 TSecr=1195856
368 2.778906567 172.31.23.72 -> 172.31.31.144 OpenFlow 74 Type: OFPT_BARRIER_REPLY
369 2.778908779 172.31.23.72 -> 172.31.31.144 OpenFlow 82 Type: OFPT_BARRIER_REPLY
370 2.778942433 172.31.23.72 -> 172.31.31.144 OpenFlow 74 Type: OFPT_BARRIER_REPLY
371 2.778969297 172.31.23.72 -> 172.31.31.144 OpenFlow 74 Type: OFPT_BARRIER_REPLY
372 2.779083854 172.31.23.72 -> 172.31.31.144 OpenFlow 74 Type: OFPT_BARRIER_REPLY
373 2.779104800 172.31.31.144 -> 172.31.23.72 TCP 66 6633 → 45510 [ACK] Seq=1641 Ack=279 Win=853 Len=0 TSval=1195856 TSecr=30017448
374 2.779110080 172.31.31.144 -> 172.31.23.72 TCP 66 6633 → 45544 [ACK] Seq=2239 Ack=153 Win=853 Len=0 TSval=1195856 TSecr=30017448
375 2.779112173 172.31.31.144 -> 172.31.23.72 TCP 66 6633 → 45508 [ACK] Seq=1231 Ack=255 Win=853 Len=0 TSval=1195856 TSecr=30017448
376 2.779163985 172.31.23.72 -> 172.31.31.144 OpenFlow 74 Type: OFPT_BARRIER_REPLY
377 2.779181057 172.31.23.72 -> 172.31.31.144 OpenFlow 146 Type: OFPT_FLOW_REMOVED
378 2.779188625 172.31.31.144 -> 172.31.23.72 TCP 66 6633 → 45548 [ACK] Seq=1137 Ack=255 Win=853 Len=0 TSval=1195856 TSecr=30017448
379 2.779191847 172.31.31.144 -> 172.31.23.72 TCP 66 6633 → 45508 [ACK] Seq=1231 Ack=271 Win=853 Len=0 TSval=1195856 TSecr=30017448
380 2.779216543 172.31.23.72 -> 172.31.31.144 OpenFlow 146 Type: OFPT_FLOW_REMOVED
381 2.779231202 172.31.23.72 -> 172.31.31.144 OpenFlow 146 Type: OFPT_FLOW_REMOVED
382 2.779233262 172.31.23.72 -> 172.31.31.144 OpenFlow 786 Type: OFPT_FLOW_REMOVED
