<<<<<<< HEAD
  1 0.000000000 41.177.127.217 -> 172.31.24.227 TCP 54 58416 → 22 [ACK] Seq=1 Ack=1 Win=32632 Len=0
  2 0.002636457 41.177.127.217 -> 172.31.24.227 TCP 54 58416 → 22 [ACK] Seq=1 Ack=297 Win=32484 Len=0
  3 0.078265337 41.177.127.217 -> 172.31.24.227 TCP 54 58416 → 22 [ACK] Seq=1 Ack=333 Win=32466 Len=0
  4 0.151746006 41.177.127.217 -> 172.31.24.227 TCP 54 58416 → 22 [ACK] Seq=1 Ack=429 Win=32418 Len=0
  5 0.445789820 172.31.24.227 -> 41.177.127.217 SSH 90 Server: Encrypted packet (len=36)
  6 0.707675777 41.177.127.217 -> 172.31.24.227 TCP 54 58416 → 22 [ACK] Seq=1 Ack=465 Win=32400 Len=0
  7 0.947958677 172.31.24.227 -> 41.177.127.217 SSH 98 Server: Encrypted packet (len=44)
  8 1.039219325 172.31.31.144 -> 172.31.24.227 TCP 90 6633 → 39486 [PSH, ACK] Seq=1 Ack=1 Win=853 Len=24 TSval=382905 TSecr=118943126
  9 1.039622484 172.31.24.227 -> 172.31.31.144 OpenFlow 642 Type: OFPT_MULTIPART_REPLY, OFPMP_PORT_STATS
 10 1.039913292 172.31.31.144 -> 172.31.24.227 TCP 66 6633 → 39486 [ACK] Seq=25 Ack=577 Win=853 Len=0 TSval=382905 TSecr=118943515
 11 1.041380004 172.31.31.144 -> 172.31.24.227 OpenFlow 122 Type: OFPT_MULTIPART_REQUEST, OFPMP_FLOW
 12 1.041583252 172.31.24.227 -> 172.31.31.144 OpenFlow 2010 Type: OFPT_MULTIPART_REPLY, OFPMP_FLOW
 13 1.042594870 172.31.31.144 -> 172.31.24.227 OpenFlow 82 Type: OFPT_MULTIPART_REQUEST, OFPMP_TABLE
 14 1.042912968 172.31.24.227 -> 172.31.31.144 OpenFlow 6178 Type: OFPT_MULTIPART_REPLY, OFPMP_TABLE
 15 1.053771307 172.31.31.144 -> 172.31.24.227 TCP 90 6633 → 39490 [PSH, ACK] Seq=1 Ack=1 Win=853 Len=24 TSval=382908 TSecr=118943126
 16 1.054011152 172.31.24.227 -> 172.31.31.144 OpenFlow 754 Type: OFPT_MULTIPART_REPLY, OFPMP_PORT_STATS
 17 1.054307850 172.31.31.144 -> 172.31.24.227 TCP 66 6633 → 39490 [ACK] Seq=25 Ack=689 Win=853 Len=0 TSval=382908 TSecr=118943518
 18 1.057971223 172.31.31.144 -> 172.31.24.227 OpenFlow 122 Type: OFPT_MULTIPART_REQUEST, OFPMP_FLOW
 19 1.058156733 172.31.24.227 -> 172.31.31.144 OpenFlow 1386 Type: OFPT_MULTIPART_REPLY, OFPMP_FLOW
 20 1.059166427 172.31.31.144 -> 172.31.24.227 OpenFlow 82 Type: OFPT_MULTIPART_REQUEST, OFPMP_TABLE
 21 1.059458300 172.31.24.227 -> 172.31.31.144 OpenFlow 6178 Type: OFPT_MULTIPART_REPLY, OFPMP_TABLE
 22 1.061431172 172.31.31.144 -> 172.31.24.227 TCP 122 6633 → 39492 [PSH, ACK] Seq=1 Ack=1 Win=853 Len=56 TSval=382910 TSecr=118943126
 23 1.061448044 172.31.31.144 -> 172.31.24.227 TCP 90 6633 → 39492 [PSH, ACK] Seq=57 Ack=1 Win=853 Len=24 TSval=382910 TSecr=118943126
 24 1.061646902 172.31.24.227 -> 172.31.31.144 OpenFlow 1178 Type: OFPT_MULTIPART_REPLY, OFPMP_FLOW
 25 1.061791546 172.31.24.227 -> 172.31.31.144 OpenFlow 754 Type: OFPT_MULTIPART_REPLY, OFPMP_PORT_STATS
 26 1.061984089 172.31.31.144 -> 172.31.24.227 TCP 66 6633 → 39492 [ACK] Seq=81 Ack=1113 Win=853 Len=0 TSval=382910 TSecr=118943520
 27 1.062002071 172.31.31.144 -> 172.31.24.227 TCP 66 6633 → 39492 [ACK] Seq=81 Ack=1801 Win=853 Len=0 TSval=382910 TSecr=118943520
 28 1.062607003 172.31.31.144 -> 172.31.24.227 OpenFlow 82 Type: OFPT_MULTIPART_REQUEST, OFPMP_TABLE
 29 1.062883690 172.31.24.227 -> 172.31.31.144 OpenFlow 6178 Type: OFPT_MULTIPART_REPLY, OFPMP_TABLE
 30 1.067819766 172.31.31.144 -> 172.31.24.227 TCP 122 6633 → 39458 [PSH, ACK] Seq=1 Ack=1 Win=853 Len=56 TSval=382912 TSecr=118943126
 31 1.067849422 172.31.31.144 -> 172.31.24.227 TCP 90 6633 → 39458 [PSH, ACK] Seq=57 Ack=1 Win=853 Len=24 TSval=382912 TSecr=118943126
 32 1.068074478 172.31.24.227 -> 172.31.31.144 OpenFlow 3258 Type: OFPT_MULTIPART_REPLY, OFPMP_FLOW
 33 1.068258190 172.31.24.227 -> 172.31.31.144 OpenFlow 1314 Type: OFPT_MULTIPART_REPLY, OFPMP_PORT_STATS
 34 1.068410190 172.31.31.144 -> 172.31.24.227 TCP 66 6633 → 39458 [ACK] Seq=81 Ack=3193 Win=853 Len=0 TSval=382912 TSecr=118943522
 35 1.068454768 172.31.31.144 -> 172.31.24.227 TCP 66 6633 → 39458 [ACK] Seq=81 Ack=4441 Win=853 Len=0 TSval=382912 TSecr=118943522
 36 1.069024922 172.31.31.144 -> 172.31.24.227 OpenFlow 82 Type: OFPT_MULTIPART_REQUEST, OFPMP_TABLE
 37 1.069243408 172.31.24.227 -> 172.31.31.144 OpenFlow 6178 Type: OFPT_MULTIPART_REPLY, OFPMP_TABLE
 38 1.072262519 172.31.31.144 -> 172.31.24.227 TCP 90 6633 → 39476 [PSH, ACK] Seq=1 Ack=1 Win=853 Len=24 TSval=382913 TSecr=118943126
 39 1.072282977 172.31.31.144 -> 172.31.24.227 TCP 122 6633 → 39476 [PSH, ACK] Seq=25 Ack=1 Win=853 Len=56 TSval=382913 TSecr=118943126
 40 1.072299218 172.31.31.144 -> 172.31.24.227 TCP 82 6633 → 39476 [PSH, ACK] Seq=81 Ack=1 Win=853 Len=16 TSval=382913 TSecr=118943126
 41 1.072621996 172.31.24.227 -> 172.31.31.144 OpenFlow 530 Type: OFPT_MULTIPART_REPLY, OFPMP_PORT_STATS
 42 1.072711568 172.31.24.227 -> 172.31.31.144 OpenFlow 2010 Type: OFPT_MULTIPART_REPLY, OFPMP_FLOW
 43 1.072864989 172.31.24.227 -> 172.31.31.144 OpenFlow 6178 Type: OFPT_MULTIPART_REPLY, OFPMP_TABLE
 44 1.073034962 172.31.31.144 -> 172.31.24.227 TCP 66 6633 → 39476 [ACK] Seq=97 Ack=2409 Win=853 Len=0 TSval=382913 TSecr=118943523
 45 1.077496270 172.31.31.144 -> 172.31.24.227 TCP 90 6633 → 39452 [PSH, ACK] Seq=1 Ack=1 Win=853 Len=24 TSval=382914 TSecr=118943126
 46 1.077509917 172.31.31.144 -> 172.31.24.227 TCP 122 6633 → 39452 [PSH, ACK] Seq=25 Ack=1 Win=853 Len=56 TSval=382914 TSecr=118943126
 47 1.077706087 172.31.24.227 -> 172.31.31.144 OpenFlow 866 Type: OFPT_MULTIPART_REPLY, OFPMP_PORT_STATS
 48 1.077808124 172.31.24.227 -> 172.31.31.144 OpenFlow 3050 Type: OFPT_MULTIPART_REPLY, OFPMP_FLOW
 49 1.078040583 172.31.31.144 -> 172.31.24.227 TCP 66 6633 → 39452 [ACK] Seq=81 Ack=801 Win=853 Len=0 TSval=382914 TSecr=118943524
 50 1.078101741 172.31.31.144 -> 172.31.24.227 TCP 66 6633 → 39452 [ACK] Seq=81 Ack=3785 Win=853 Len=0 TSval=382914 TSecr=118943524
 51 1.078601296 172.31.31.144 -> 172.31.24.227 OpenFlow 82 Type: OFPT_MULTIPART_REQUEST, OFPMP_TABLE
 52 1.078803128 172.31.24.227 -> 172.31.31.144 OpenFlow 6178 Type: OFPT_MULTIPART_REPLY, OFPMP_TABLE
 53 1.081812926 172.31.31.144 -> 172.31.24.227 TCP 122 6633 → 39480 [PSH, ACK] Seq=1 Ack=1 Win=853 Len=56 TSval=382915 TSecr=118943158
 54 1.081851245 172.31.31.144 -> 172.31.24.227 TCP 90 6633 → 39480 [PSH, ACK] Seq=57 Ack=1 Win=853 Len=24 TSval=382915 TSecr=118943158
 55 1.081984283 172.31.24.227 -> 172.31.31.144 OpenFlow 1178 Type: OFPT_MULTIPART_REPLY, OFPMP_FLOW
 56 1.082111118 172.31.24.227 -> 172.31.31.144 OpenFlow 866 Type: OFPT_MULTIPART_REPLY, OFPMP_PORT_STATS
 57 1.082236640 172.31.31.144 -> 172.31.24.227 TCP 66 6633 → 39480 [ACK] Seq=81 Ack=1113 Win=853 Len=0 TSval=382915 TSecr=118943525
 58 1.082294390 172.31.31.144 -> 172.31.24.227 TCP 66 6633 → 39480 [ACK] Seq=81 Ack=1913 Win=853 Len=0 TSval=382915 TSecr=118943525
 59 1.082995155 172.31.31.144 -> 172.31.24.227 OpenFlow 82 Type: OFPT_MULTIPART_REQUEST, OFPMP_TABLE
 60 1.083081934 172.31.31.144 -> 172.31.24.227 TCP 66 6633 → 39486 [ACK] Seq=97 Ack=8633 Win=853 Len=0 TSval=382916 TSecr=118943515
 61 1.083284313 172.31.24.227 -> 172.31.31.144 OpenFlow 6178 Type: OFPT_MULTIPART_REPLY, OFPMP_TABLE
 62 1.091217527 172.31.31.144 -> 172.31.24.227 TCP 90 6633 → 39464 [PSH, ACK] Seq=1 Ack=1 Win=853 Len=24 TSval=382918 TSecr=118943158
 63 1.091247943 172.31.31.144 -> 172.31.24.227 TCP 138 6633 → 39464 [PSH, ACK] Seq=25 Ack=1 Win=853 Len=72 TSval=382918 TSecr=118943158
 64 1.091425743 172.31.24.227 -> 172.31.31.144 OpenFlow 978 Type: OFPT_MULTIPART_REPLY, OFPMP_PORT_STATS
 65 1.091500942 172.31.24.227 -> 172.31.31.144 OpenFlow 2218 Type: OFPT_MULTIPART_REPLY, OFPMP_FLOW
 66 1.091640831 172.31.24.227 -> 172.31.31.144 OpenFlow 6178 Type: OFPT_MULTIPART_REPLY, OFPMP_TABLE
 67 1.091815087 172.31.31.144 -> 172.31.24.227 TCP 66 6633 → 39464 [ACK] Seq=97 Ack=3065 Win=853 Len=0 TSval=382918 TSecr=118943528
 68 1.094467927 172.31.31.144 -> 172.31.24.227 TCP 122 6633 → 39482 [PSH, ACK] Seq=1 Ack=1 Win=853 Len=56 TSval=382918 TSecr=118943158
 69 1.094499344 172.31.31.144 -> 172.31.24.227 TCP 90 6633 → 39482 [PSH, ACK] Seq=57 Ack=1 Win=853 Len=24 TSval=382918 TSecr=118943158
 70 1.094728124 172.31.24.227 -> 172.31.31.144 OpenFlow 970 Type: OFPT_MULTIPART_REPLY, OFPMP_FLOW
 71 1.094854483 172.31.24.227 -> 172.31.31.144 OpenFlow 978 Type: OFPT_MULTIPART_REPLY, OFPMP_PORT_STATS
 72 1.095074111 172.31.31.144 -> 172.31.24.227 TCP 66 6633 → 39482 [ACK] Seq=81 Ack=1817 Win=853 Len=0 TSval=382919 TSecr=118943528
 73 1.095677123 172.31.31.144 -> 172.31.24.227 OpenFlow 82 Type: OFPT_MULTIPART_REQUEST, OFPMP_TABLE
 74 1.095999824 172.31.24.227 -> 172.31.31.144 OpenFlow 6178 Type: OFPT_MULTIPART_REPLY, OFPMP_TABLE
 75 1.098854014 172.31.31.144 -> 172.31.24.227 TCP 122 6633 → 39446 [PSH, ACK] Seq=1 Ack=1 Win=853 Len=56 TSval=382919 TSecr=118943158
 76 1.098864477 172.31.31.144 -> 172.31.24.227 TCP 90 6633 → 39446 [PSH, ACK] Seq=57 Ack=1 Win=853 Len=24 TSval=382919 TSecr=118943158
 77 1.098940892 172.31.24.227 -> 172.31.31.144 OpenFlow 1178 Type: OFPT_MULTIPART_REPLY, OFPMP_FLOW
 78 1.099069430 172.31.31.144 -> 172.31.24.227 TCP 66 6633 → 39490 [ACK] Seq=97 Ack=8121 Win=853 Len=0 TSval=382920 TSecr=118943520
 79 1.099095287 172.31.24.227 -> 172.31.31.144 OpenFlow 1090 Type: OFPT_MULTIPART_REPLY, OFPMP_PORT_STATS
 80 1.099205145 172.31.31.144 -> 172.31.24.227 TCP 66 6633 → 39446 [ACK] Seq=81 Ack=1113 Win=853 Len=0 TSval=382920 TSecr=118943529
 81 1.099333574 172.31.31.144 -> 172.31.24.227 TCP 66 6633 → 39446 [ACK] Seq=81 Ack=2137 Win=853 Len=0 TSval=382920 TSecr=118943529
 82 1.101193647 172.31.31.144 -> 172.31.24.227 OpenFlow 82 Type: OFPT_MULTIPART_REQUEST, OFPMP_TABLE
 83 1.101204345 172.31.31.144 -> 172.31.24.227 TCP 90 6633 → 39484 [PSH, ACK] Seq=1 Ack=1 Win=853 Len=24 TSval=382920 TSecr=118943158
 84 1.101456276 172.31.24.227 -> 172.31.31.144 OpenFlow 6178 Type: OFPT_MULTIPART_REPLY, OFPMP_TABLE
 85 1.101675862 172.31.24.227 -> 172.31.31.144 OpenFlow 1090 Type: OFPT_MULTIPART_REPLY, OFPMP_PORT_STATS
 86 1.102252089 172.31.31.144 -> 172.31.24.227 OpenFlow 122 Type: OFPT_MULTIPART_REQUEST, OFPMP_FLOW
 87 1.102269058 172.31.31.144 -> 172.31.24.227 OpenFlow 82 Type: OFPT_MULTIPART_REQUEST, OFPMP_TABLE
 88 1.102546289 172.31.24.227 -> 172.31.31.144 OpenFlow 1386 Type: OFPT_MULTIPART_REPLY, OFPMP_FLOW
 89 1.102697695 172.31.24.227 -> 172.31.31.144 OpenFlow 6178 Type: OFPT_MULTIPART_REPLY, OFPMP_TABLE
 90 1.102956467 172.31.31.144 -> 172.31.24.227 TCP 66 6633 → 39484 [ACK] Seq=97 Ack=8457 Win=853 Len=0 TSval=382920 TSecr=118943530
 91 1.103061726 172.31.31.144 -> 172.31.24.227 TCP 66 6633 → 39492 [ACK] Seq=97 Ack=7913 Win=853 Len=0 TSval=382921 TSecr=118943520
 92 1.107159018 172.31.31.144 -> 172.31.24.227 TCP 66 6633 → 39458 [ACK] Seq=97 Ack=10553 Win=853 Len=0 TSval=382922 TSecr=118943522
 93 1.111158224 172.31.31.144 -> 172.31.24.227 TCP 66 6633 → 39476 [ACK] Seq=97 Ack=8521 Win=853 Len=0 TSval=382923 TSecr=118943523
 94 1.112537856 172.31.31.144 -> 172.31.24.227 TCP 122 6633 → 39462 [PSH, ACK] Seq=1 Ack=1 Win=853 Len=56 TSval=382923 TSecr=118943158
 95 1.112547361 172.31.31.144 -> 172.31.24.227 TCP 90 6633 → 39462 [PSH, ACK] Seq=57 Ack=1 Win=853 Len=24 TSval=382923 TSecr=118943158
 96 1.112662942 172.31.24.227 -> 172.31.31.144 OpenFlow 762 Type: OFPT_MULTIPART_REPLY, OFPMP_FLOW
 97 1.112776834 172.31.24.227 -> 172.31.31.144 OpenFlow 866 Type: OFPT_MULTIPART_REPLY, OFPMP_PORT_STATS
 98 1.112953032 172.31.31.144 -> 172.31.24.227 TCP 66 6633 → 39462 [ACK] Seq=81 Ack=697 Win=853 Len=0 TSval=382923 TSecr=118943533
 99 1.112970314 172.31.31.144 -> 172.31.24.227 TCP 66 6633 → 39462 [ACK] Seq=81 Ack=1497 Win=853 Len=0 TSval=382923 TSecr=118943533
100 1.113701254 172.31.31.144 -> 172.31.24.227 OpenFlow 82 Type: OFPT_MULTIPART_REQUEST, OFPMP_TABLE
101 1.113988539 172.31.24.227 -> 172.31.31.144 OpenFlow 6178 Type: OFPT_MULTIPART_REPLY, OFPMP_TABLE
102 1.114862497 172.31.31.144 -> 172.31.24.227 TCP 90 6633 → 39478 [PSH, ACK] Seq=1 Ack=1 Win=853 Len=24 TSval=382923 TSecr=118943158
103 1.115050952 172.31.24.227 -> 172.31.31.144 ESP 754 ESP (SPI=0x041302b0)
104 1.116107322 172.31.31.144 -> 172.31.24.227 TCP 82 6633 → 39478 [PSH, ACK] Seq=25 Ack=689 Win=853 Len=16 TSval=382924 TSecr=118943533
105 1.116114126 172.31.31.144 -> 172.31.24.227 TCP 122 6633 → 39478 [PSH, ACK] Seq=41 Ack=689 Win=853 Len=56 TSval=382924 TSecr=118943533
106 1.116343463 172.31.24.227 -> 172.31.31.144 OpenFlow 6178 Type: OFPT_MULTIPART_REPLY, OFPMP_TABLE
107 1.116416918 172.31.24.227 -> 172.31.31.144 OpenFlow 1178 Type: OFPT_MULTIPART_REPLY, OFPMP_FLOW
108 1.116705502 172.31.31.144 -> 172.31.24.227 TCP 66 6633 → 39478 [ACK] Seq=97 Ack=7913 Win=853 Len=0 TSval=382924 TSecr=118943534
109 1.118303684 172.31.31.144 -> 172.31.24.227 TCP 90 6633 → 39450 [PSH, ACK] Seq=1 Ack=1 Win=853 Len=24 TSval=382924 TSecr=118943158
110 1.118632673 172.31.24.227 -> 172.31.31.144 OpenFlow 1090 Type: OFPT_MULTIPART_REPLY, OFPMP_PORT_STATS
111 1.119089704 172.31.31.144 -> 172.31.24.227 TCP 66 6633 → 39452 [ACK] Seq=97 Ack=9897 Win=853 Len=0 TSval=382925 TSecr=118943524
112 1.119521255 172.31.31.144 -> 172.31.24.227 TCP 90 6633 → 39448 [PSH, ACK] Seq=1 Ack=1 Win=853 Len=24 TSval=382925 TSecr=118943158
113 1.119532053 172.31.31.144 -> 172.31.24.227 OpenFlow 122 Type: OFPT_MULTIPART_REQUEST, OFPMP_FLOW
114 1.119542751 172.31.31.144 -> 172.31.24.227 TCP 122 6633 → 39448 [PSH, ACK] Seq=25 Ack=1 Win=853 Len=56 TSval=382925 TSecr=118943158
115 1.119779244 172.31.24.227 -> 172.31.31.144 OpenFlow 754 Type: OFPT_MULTIPART_REPLY, OFPMP_PORT_STATS
116 1.119827116 172.31.24.227 -> 172.31.31.144 OpenFlow 970 Type: OFPT_MULTIPART_REPLY, OFPMP_FLOW
117 1.119873544 172.31.24.227 -> 172.31.31.144 OpenFlow 762 Type: OFPT_MULTIPART_REPLY, OFPMP_FLOW
118 1.120142718 172.31.31.144 -> 172.31.24.227 TCP 66 6633 → 39448 [ACK] Seq=81 Ack=1593 Win=853 Len=0 TSval=382925 TSecr=118943535
119 1.120739344 172.31.31.144 -> 172.31.24.227 OpenFlow 82 Type: OFPT_MULTIPART_REQUEST, OFPMP_TABLE
120 1.121088049 172.31.24.227 -> 172.31.31.144 OpenFlow 6178 Type: OFPT_MULTIPART_REPLY, OFPMP_TABLE
121 1.122967359 172.31.31.144 -> 172.31.24.227 OpenFlow 82 Type: OFPT_MULTIPART_REQUEST, OFPMP_TABLE
122 1.123092009 172.31.31.144 -> 172.31.24.227 TCP 66 6633 → 39480 [ACK] Seq=97 Ack=8025 Win=853 Len=0 TSval=382926 TSecr=118943526
123 1.123199572 172.31.24.227 -> 172.31.31.144 OpenFlow 6178 Type: OFPT_MULTIPART_REPLY, OFPMP_TABLE
124 1.125198926 172.31.31.144 -> 172.31.24.227 TCP 90 6633 → 39454 [PSH, ACK] Seq=1 Ack=1 Win=853 Len=24 TSval=382926 TSecr=118943158
125 1.125217719 172.31.31.144 -> 172.31.24.227 TCP 82 6633 → 39454 [PSH, ACK] Seq=25 Ack=1 Win=853 Len=16 TSval=382926 TSecr=118943158
126 1.125266699 172.31.31.144 -> 172.31.24.227 TCP 122 6633 → 39454 [PSH, ACK] Seq=41 Ack=1 Win=853 Len=56 TSval=382926 TSecr=118943158
127 1.125464834 172.31.24.227 -> 172.31.31.144 OpenFlow 866 Type: OFPT_MULTIPART_REPLY, OFPMP_PORT_STATS
128 1.125633418 172.31.24.227 -> 172.31.31.144 OpenFlow 6178 Type: OFPT_MULTIPART_REPLY, OFPMP_TABLE
129 1.125679839 172.31.24.227 -> 172.31.31.144 OpenFlow 1178 Type: OFPT_MULTIPART_REPLY, OFPMP_FLOW
130 1.125906768 172.31.31.144 -> 172.31.24.227 TCP 66 6633 → 39454 [ACK] Seq=97 Ack=6913 Win=853 Len=0 TSval=382926 TSecr=118943536
131 1.128391277 172.31.31.144 -> 172.31.24.227 TCP 90 6633 → 39474 [PSH, ACK] Seq=1 Ack=1 Win=853 Len=24 TSval=382927 TSecr=118943158
132 1.128427544 172.31.31.144 -> 172.31.24.227 TCP 122 6633 → 39470 [PSH, ACK] Seq=1 Ack=1 Win=853 Len=56 TSval=382927 TSecr=118943158
133 1.128461200 172.31.31.144 -> 172.31.24.227 TCP 90 6633 → 39470 [PSH, ACK] Seq=57 Ack=1 Win=853 Len=24 TSval=382927 TSecr=118943158
134 1.128481177 172.31.31.144 -> 172.31.24.227 TCP 122 6633 → 39474 [PSH, ACK] Seq=25 Ack=1 Win=853 Len=56 TSval=382927 TSecr=118943158
135 1.128587191 172.31.24.227 -> 172.31.31.144 OpenFlow 2842 Type: OFPT_MULTIPART_REPLY, OFPMP_FLOW
136 1.128691142 172.31.24.227 -> 172.31.31.144 OpenFlow 754 Type: OFPT_MULTIPART_REPLY, OFPMP_PORT_STATS
137 1.128825489 172.31.24.227 -> 172.31.31.144 OpenFlow 978 Type: OFPT_MULTIPART_REPLY, OFPMP_PORT_STATS
138 1.128887848 172.31.31.144 -> 172.31.24.227 TCP 66 6633 → 39470 [ACK] Seq=81 Ack=2777 Win=853 Len=0 TSval=382927 TSecr=118943537
139 1.128900628 172.31.24.227 -> 172.31.31.144 OpenFlow 2218 Type: OFPT_MULTIPART_REPLY, OFPMP_FLOW
140 1.128908358 172.31.31.144 -> 172.31.24.227 TCP 66 6633 → 39470 [ACK] Seq=81 Ack=3465 Win=853 Len=0 TSval=382927 TSecr=118943537
141 1.129175427 172.31.31.144 -> 172.31.24.227 TCP 66 6633 → 39474 [ACK] Seq=81 Ack=3065 Win=853 Len=0 TSval=382927 TSecr=118943537
142 1.129551668 172.31.31.144 -> 172.31.24.227 OpenFlow 82 Type: OFPT_MULTIPART_REQUEST, OFPMP_TABLE
143 1.129771550 172.31.24.227 -> 172.31.31.144 OpenFlow 6178 Type: OFPT_MULTIPART_REPLY, OFPMP_TABLE
144 1.130776177 172.31.31.144 -> 172.31.24.227 OpenFlow 82 Type: OFPT_MULTIPART_REQUEST, OFPMP_TABLE
145 1.131009646 172.31.24.227 -> 172.31.31.144 OpenFlow 6178 Type: OFPT_MULTIPART_REPLY, OFPMP_TABLE
146 1.131042385 172.31.31.144 -> 172.31.24.227 TCP 66 6633 → 39464 [ACK] Seq=97 Ack=9177 Win=853 Len=0 TSval=382928 TSecr=118943528
147 1.135088208 172.31.31.144 -> 172.31.24.227 TCP 66 6633 → 39482 [ACK] Seq=97 Ack=7929 Win=853 Len=0 TSval=382929 TSecr=118943529
148 1.139189971 172.31.31.144 -> 172.31.24.227 TCP 66 6633 → 39446 [ACK] Seq=97 Ack=8249 Win=853 Len=0 TSval=382930 TSecr=118943530
149 1.142078891 172.31.31.144 -> 172.31.24.227 TCP 90 6633 → 39468 [PSH, ACK] Seq=1 Ack=1 Win=853 Len=24 TSval=382930 TSecr=118943158
150 1.142095346 172.31.31.144 -> 172.31.24.227 TCP 90 6633 → 39488 [PSH, ACK] Seq=1 Ack=1 Win=853 Len=24 TSval=382930 TSecr=118943158
151 1.142118977 172.31.31.144 -> 172.31.24.227 TCP 122 6633 → 39488 [PSH, ACK] Seq=25 Ack=1 Win=853 Len=56 TSval=382930 TSecr=118943158
152 1.142389029 172.31.24.227 -> 172.31.31.144 OpenFlow 978 Type: OFPT_MULTIPART_REPLY, OFPMP_PORT_STATS
153 1.142518722 172.31.24.227 -> 172.31.31.144 OpenFlow 642 Type: OFPT_MULTIPART_REPLY, OFPMP_PORT_STATS
154 1.142603651 172.31.24.227 -> 172.31.31.144 OpenFlow 2842 Type: OFPT_MULTIPART_REPLY, OFPMP_FLOW
155 1.142768748 172.31.31.144 -> 172.31.24.227 TCP 66 6633 → 39468 [ACK] Seq=25 Ack=913 Win=853 Len=0 TSval=382930 TSecr=118943540
156 1.142827351 172.31.31.144 -> 172.31.24.227 TCP 66 6633 → 39488 [ACK] Seq=81 Ack=577 Win=853 Len=0 TSval=382930 TSecr=118943540
157 1.142846137 172.31.31.144 -> 172.31.24.227 TCP 66 6633 → 39488 [ACK] Seq=81 Ack=3353 Win=853 Len=0 TSval=382930 TSecr=118943540
158 1.143193580 172.31.31.144 -> 172.31.24.227 OpenFlow 82 Type: OFPT_MULTIPART_REQUEST, OFPMP_TABLE
159 1.143649506 172.31.24.227 -> 172.31.31.144 OpenFlow 6178 Type: OFPT_MULTIPART_REPLY, OFPMP_TABLE
160 1.144468216 172.31.31.144 -> 172.31.24.227 OpenFlow 122 Type: OFPT_MULTIPART_REQUEST, OFPMP_FLOW
161 1.144747661 172.31.24.227 -> 172.31.31.144 OpenFlow 2426 Type: OFPT_MULTIPART_REPLY, OFPMP_FLOW
162 1.148688454 172.31.31.144 -> 172.31.24.227 OpenFlow 82 Type: OFPT_MULTIPART_REQUEST, OFPMP_TABLE
163 1.148949131 172.31.24.227 -> 172.31.31.144 OpenFlow 6178 Type: OFPT_MULTIPART_REPLY, OFPMP_TABLE
164 1.151117337 172.31.31.144 -> 172.31.24.227 TCP 66 6633 → 39462 [ACK] Seq=97 Ack=7609 Win=853 Len=0 TSval=382933 TSecr=118943533
165 1.152867066 172.31.31.144 -> 172.31.24.227 TCP 90 6633 → 39460 [PSH, ACK] Seq=1 Ack=1 Win=853 Len=24 TSval=382933 TSecr=118943158
166 1.152878910 172.31.31.144 -> 172.31.24.227 TCP 82 6633 → 39456 [PSH, ACK] Seq=1 Ack=1 Win=853 Len=16 TSval=382933 TSecr=118943158
167 1.152894866 172.31.31.144 -> 172.31.24.227 TCP 146 6633 → 39456 [PSH, ACK] Seq=17 Ack=1 Win=853 Len=80 TSval=382933 TSecr=118943158
168 1.152913149 172.31.31.144 -> 172.31.24.227 TCP 138 6633 → 39460 [PSH, ACK] Seq=25 Ack=1 Win=853 Len=72 TSval=382933 TSecr=118943158
169 1.153278136 172.31.24.227 -> 172.31.31.144 OpenFlow 6178 Type: OFPT_MULTIPART_REPLY, OFPMP_TABLE
170 1.153331829 172.31.24.227 -> 172.31.31.144 OpenFlow 1386 Type: OFPT_MULTIPART_REPLY, OFPMP_FLOW
171 1.153454949 172.31.24.227 -> 172.31.31.144 OpenFlow 866 Type: OFPT_MULTIPART_REPLY, OFPMP_PORT_STATS
172 1.153548443 172.31.24.227 -> 172.31.31.144 OpenFlow 642 Type: OFPT_MULTIPART_REPLY, OFPMP_PORT_STATS
173 1.153593429 172.31.31.144 -> 172.31.24.227 TCP 66 6633 → 39456 [ACK] Seq=97 Ack=6113 Win=853 Len=0 TSval=382933 TSecr=118943543
174 1.153598637 172.31.31.144 -> 172.31.24.227 TCP 66 6633 → 39456 [ACK] Seq=97 Ack=7433 Win=853 Len=0 TSval=382933 TSecr=118943543
175 1.153694233 172.31.31.144 -> 172.31.24.227 TCP 66 6633 → 39456 [ACK] Seq=97 Ack=8233 Win=853 Len=0 TSval=382933 TSecr=118943543
176 1.153713793 172.31.24.227 -> 172.31.31.144 OpenFlow 6178 Type: OFPT_MULTIPART_REPLY, OFPMP_TABLE
177 1.153777348 172.31.24.227 -> 172.31.31.144 OpenFlow 2218 Type: OFPT_MULTIPART_REPLY, OFPMP_FLOW
178 1.153985607 172.31.31.144 -> 172.31.24.227 TCP 66 6633 → 39460 [ACK] Seq=97 Ack=6689 Win=853 Len=0 TSval=382933 TSecr=118943543
179 1.154023698 172.31.31.144 -> 172.31.24.227 TCP 82 6633 → 39472 [PSH, ACK] Seq=1 Ack=1 Win=853 Len=16 TSval=382933 TSecr=118943159
180 1.154064077 172.31.31.144 -> 172.31.24.227 TCP 122 6633 → 39472 [PSH, ACK] Seq=17 Ack=1 Win=853 Len=56 TSval=382933 TSecr=118943159
181 1.154104354 172.31.31.144 -> 172.31.24.227 TCP 90 6633 → 39472 [PSH, ACK] Seq=73 Ack=1 Win=853 Len=24 TSval=382933 TSecr=118943159
182 1.154269361 172.31.24.227 -> 172.31.31.144 OpenFlow 6178 Type: OFPT_MULTIPART_REPLY, OFPMP_TABLE
183 1.154340889 172.31.24.227 -> 172.31.31.144 OpenFlow 2634 Type: OFPT_MULTIPART_REPLY, OFPMP_FLOW
184 1.154425266 172.31.24.227 -> 172.31.31.144 OpenFlow 642 Type: OFPT_MULTIPART_REPLY, OFPMP_PORT_STATS
185 1.154550164 172.31.31.144 -> 172.31.24.227 TCP 66 6633 → 39472 [ACK] Seq=97 Ack=6113 Win=853 Len=0 TSval=382933 TSecr=118943543
186 1.154567563 172.31.31.144 -> 172.31.24.227 TCP 66 6633 → 39472 [ACK] Seq=97 Ack=8681 Win=853 Len=0 TSval=382933 TSecr=118943543
187 1.154645350 172.31.31.144 -> 172.31.24.227 TCP 66 6633 → 39472 [ACK] Seq=97 Ack=9257 Win=853 Len=0 TSval=382933 TSecr=118943543
188 1.158276465 172.31.31.144 -> 172.31.24.227 TCP 90 6633 → 39466 [PSH, ACK] Seq=1 Ack=1 Win=853 Len=24 TSval=382934 TSecr=118943158
189 1.158341338 172.31.31.144 -> 172.31.24.227 TCP 138 6633 → 39466 [PSH, ACK] Seq=25 Ack=1 Win=853 Len=72 TSval=382934 TSecr=118943158
190 1.158530315 172.31.24.227 -> 172.31.31.144 OpenFlow 1202 Type: OFPT_MULTIPART_REPLY, OFPMP_PORT_STATS
191 1.158679308 172.31.24.227 -> 172.31.31.144 OpenFlow 6178 Type: OFPT_MULTIPART_REPLY, OFPMP_TABLE
192 1.158762337 172.31.24.227 -> 172.31.31.144 OpenFlow 3466 Type: OFPT_MULTIPART_REPLY, OFPMP_FLOW
193 1.158945986 172.31.31.144 -> 172.31.24.227 TCP 66 6633 → 39466 [ACK] Seq=97 Ack=7249 Win=853 Len=0 TSval=382934 TSecr=118943544
194 1.163108344 172.31.31.144 -> 172.31.24.227 TCP 66 6633 → 39454 [ACK] Seq=97 Ack=8025 Win=853 Len=0 TSval=382936 TSecr=118943536
195 1.163123386 172.31.31.144 -> 172.31.24.227 TCP 66 6633 → 39448 [ACK] Seq=97 Ack=7705 Win=853 Len=0 TSval=382936 TSecr=118943535
196 1.163144011 172.31.31.144 -> 172.31.24.227 TCP 66 6633 → 39450 [ACK] Seq=97 Ack=7833 Win=853 Len=0 TSval=382936 TSecr=118943536
197 1.167108859 172.31.31.144 -> 172.31.24.227 TCP 66 6633 → 39470 [ACK] Seq=97 Ack=9577 Win=853 Len=0 TSval=382937 TSecr=118943537
198 1.171130522 172.31.31.144 -> 172.31.24.227 TCP 66 6633 → 39474 [ACK] Seq=97 Ack=9177 Win=853 Len=0 TSval=382938 TSecr=118943537
199 1.183167693 172.31.31.144 -> 172.31.24.227 TCP 66 6633 → 39488 [ACK] Seq=97 Ack=9465 Win=853 Len=0 TSval=382941 TSecr=118943541
200 1.187159800 172.31.31.144 -> 172.31.24.227 TCP 66 6633 → 39468 [ACK] Seq=97 Ack=9385 Win=853 Len=0 TSval=382942 TSecr=118943542
201 1.191153559 172.31.31.144 -> 172.31.24.227 TCP 66 6633 → 39460 [ACK] Seq=97 Ack=8841 Win=853 Len=0 TSval=382943 TSecr=118943543
202 1.191790576 41.177.127.217 -> 172.31.24.227 TCP 54 58416 → 22 [ACK] Seq=1 Ack=509 Win=32378 Len=0
203 1.195183744 172.31.31.144 -> 172.31.24.227 TCP 66 6633 → 39466 [ACK] Seq=97 Ack=10649 Win=853 Len=0 TSval=382944 TSecr=118943544
204 1.456622090 172.31.24.227 -> 41.177.127.217 SSH 98 Server: Encrypted packet (len=44)
205 1.720655950 41.177.127.217 -> 172.31.24.227 TCP 54 58416 → 22 [ACK] Seq=1 Ack=553 Win=32356 Len=0
206 1.957705290 172.31.24.227 -> 41.177.127.217 SSH 98 Server: Encrypted packet (len=44)
207 2.221628930 41.177.127.217 -> 172.31.24.227 TCP 54 58416 → 22 [ACK] Seq=1 Ack=597 Win=32334 Len=0
208 2.282760484 172.31.31.144 -> 172.31.24.227 OpenFlow 187 Type: OFPT_PACKET_OUT
209 2.282779868 172.31.31.144 -> 172.31.24.227 OpenFlow 187 Type: OFPT_PACKET_OUT
210 2.282819484 172.31.31.144 -> 172.31.24.227 OpenFlow 187 Type: OFPT_PACKET_OUT
211 2.282902764 172.31.31.144 -> 172.31.24.227 OpenFlow 187 Type: OFPT_PACKET_OUT
212 2.282984472 172.31.31.144 -> 172.31.24.227 OpenFlow 187 Type: OFPT_PACKET_OUT
213 2.282994688 172.31.24.227 -> 172.31.31.144 TCP 66 39480 → 6633 [ACK] Seq=8025 Ack=702 Win=78 Len=0 TSval=118943825 TSecr=383215
214 2.283103303 172.31.31.144 -> 172.31.24.227 OpenFlow 187 Type: OFPT_PACKET_OUT
215 2.283187119 172.31.31.144 -> 172.31.24.227 OpenFlow 187 Type: OFPT_PACKET_OUT
216 2.283291277 172.31.31.144 -> 172.31.24.227 OpenFlow 187 Type: OFPT_PACKET_OUT
217 2.283327865 172.31.31.144 -> 172.31.24.227 OpenFlow 187 Type: OFPT_PACKET_OUT
218 2.283414049 172.31.31.144 -> 172.31.24.227 OpenFlow 187 Type: OFPT_PACKET_OUT
219 2.283420745 172.31.24.227 -> 172.31.31.144 TCP 66 39480 → 6633 [ACK] Seq=8025 Ack=1307 Win=78 Len=0 TSval=118943826 TSecr=383216
220 2.283482798 172.31.31.144 -> 172.31.24.227 OpenFlow 187 Type: OFPT_PACKET_OUT
221 2.283563910 172.31.31.144 -> 172.31.24.227 OpenFlow 187 Type: OFPT_PACKET_OUT
222 2.283697361 172.31.24.227 -> 172.31.31.144 TCP 66 39480 → 6633 [ACK] Seq=8025 Ack=1549 Win=78 Len=0 TSval=118943826 TSecr=383216
223 2.283707697 172.31.31.144 -> 172.31.24.227 OpenFlow 187 Type: OFPT_PACKET_OUT
224 2.283744038 172.31.31.144 -> 172.31.24.227 OpenFlow 187 Type: OFPT_PACKET_OUT
225 2.283795844 172.31.24.227 -> 172.31.31.144 OpenFlow 189 Type: OFPT_PACKET_IN
226 2.283805920 172.31.31.144 -> 172.31.24.227 OpenFlow 187 Type: OFPT_PACKET_OUT
227 2.283818977 172.31.24.227 -> 172.31.31.144 OpenFlow 189 Type: OFPT_PACKET_IN
228 2.283854581 172.31.24.227 -> 172.31.31.144 OpenFlow 312 Type: OFPT_PACKET_IN
229 2.283878997 172.31.31.144 -> 172.31.24.227 OpenFlow 187 Type: OFPT_PACKET_OUT
230 2.283887147 172.31.24.227 -> 172.31.31.144 OpenFlow 189 Type: OFPT_PACKET_IN
231 2.283903750 172.31.24.227 -> 172.31.31.144 OpenFlow 189 Type: OFPT_PACKET_IN
232 2.283948256 172.31.31.144 -> 172.31.24.227 OpenFlow 187 Type: OFPT_PACKET_OUT
233 2.283952984 172.31.24.227 -> 172.31.31.144 TCP 66 39456 → 6633 [ACK] Seq=8233 Ack=702 Win=66 Len=0 TSval=118943826 TSecr=383216
234 2.284037038 172.31.31.144 -> 172.31.24.227 OpenFlow 187 Type: OFPT_PACKET_OUT
235 2.284112200 172.31.31.144 -> 172.31.24.227 TCP 66 6633 → 39492 [ACK] Seq=97 Ack=8036 Win=853 Len=0 TSval=383216 TSecr=118943826
236 2.284143388 172.31.31.144 -> 172.31.24.227 TCP 66 6633 → 39492 [ACK] Seq=97 Ack=8159 Win=853 Len=0 TSval=383216 TSecr=118943826
237 2.284173674 172.31.31.144 -> 172.31.24.227 TCP 66 6633 → 39484 [ACK] Seq=97 Ack=8949 Win=853 Len=0 TSval=383216 TSecr=118943826
238 2.284205186 172.31.31.144 -> 172.31.24.227 OpenFlow 187 Type: OFPT_PACKET_OUT
239 2.284252655 172.31.31.144 -> 172.31.24.227 OpenFlow 187 Type: OFPT_PACKET_OUT
240 2.284285976 172.31.31.144 -> 172.31.24.227 OpenFlow 187 Type: OFPT_PACKET_OUT
241 2.284408974 172.31.31.144 -> 172.31.24.227 OpenFlow 187 Type: OFPT_PACKET_OUT
242 2.284414668 172.31.24.227 -> 172.31.31.144 TCP 66 39456 → 6633 [ACK] Seq=8233 Ack=1307 Win=66 Len=0 TSval=118943826 TSecr=383216
243 2.284567151 172.31.24.227 -> 172.31.31.144 OpenFlow 189 Type: OFPT_PACKET_IN
244 2.284591618 172.31.24.227 -> 172.31.31.144 OpenFlow 189 Type: OFPT_PACKET_IN
245 2.284610025 172.31.24.227 -> 172.31.31.144 OpenFlow 189 Type: OFPT_PACKET_IN
246 2.284619840 172.31.31.144 -> 172.31.24.227 OpenFlow 187 Type: OFPT_PACKET_OUT
247 2.284641371 172.31.24.227 -> 172.31.31.144 OpenFlow 681 Type: OFPT_PACKET_IN
248 2.284734777 172.31.31.144 -> 172.31.24.227 OpenFlow 187 Type: OFPT_PACKET_OUT
249 2.284783977 172.31.31.144 -> 172.31.24.227 TCP 66 6633 → 39458 [ACK] Seq=97 Ack=10676 Win=853 Len=0 TSval=383216 TSecr=118943826
250 2.284796763 172.31.24.227 -> 172.31.31.144 OpenFlow 189 Type: OFPT_PACKET_IN
251 2.284815597 172.31.24.227 -> 172.31.31.144 OpenFlow 435 Type: OFPT_PACKET_IN
252 2.284829319 172.31.24.227 -> 172.31.31.144 OpenFlow 189 Type: OFPT_PACKET_IN
253 2.284839612 172.31.31.144 -> 172.31.24.227 TCP 66 6633 → 39458 [ACK] Seq=97 Ack=10799 Win=853 Len=0 TSval=383216 TSecr=118943826
254 2.284850999 172.31.24.227 -> 172.31.31.144 OpenFlow 189 Type: OFPT_PACKET_IN
255 2.284903689 172.31.31.144 -> 172.31.24.227 TCP 66 6633 → 39464 [ACK] Seq=97 Ack=9300 Win=853 Len=0 TSval=383216 TSecr=118943826
256 2.284908898 172.31.31.144 -> 172.31.24.227 TCP 66 6633 → 39464 [ACK] Seq=97 Ack=9915 Win=853 Len=0 TSval=383216 TSecr=118943826
257 2.284913643 172.31.24.227 -> 172.31.31.144 OpenFlow 189 Type: OFPT_PACKET_IN
258 2.284921542 172.31.24.227 -> 172.31.31.144 OpenFlow 189 Type: OFPT_PACKET_IN
259 2.284923324 172.31.31.144 -> 172.31.24.227 OpenFlow 187 Type: OFPT_PACKET_OUT
260 2.284970204 172.31.24.227 -> 172.31.31.144 TCP 66 39456 → 6633 [ACK] Seq=8233 Ack=1549 Win=66 Len=0 TSval=118943826 TSecr=383216
261 2.285039478 172.31.31.144 -> 172.31.24.227 TCP 66 6633 → 39446 [ACK] Seq=97 Ack=8372 Win=853 Len=0 TSval=383216 TSecr=118943826
262 2.285067577 172.31.31.144 -> 172.31.24.227 TCP 66 6633 → 39446 [ACK] Seq=97 Ack=8741 Win=853 Len=0 TSval=383216 TSecr=118943826
263 2.285114783 172.31.31.144 -> 172.31.24.227 OpenFlow 187 Type: OFPT_PACKET_OUT
264 2.285159400 172.31.31.144 -> 172.31.24.227 TCP 66 6633 → 39448 [ACK] Seq=97 Ack=7828 Win=853 Len=0 TSval=383216 TSecr=118943826
265 2.285179087 172.31.24.227 -> 172.31.31.144 TCP 66 39486 → 6633 [ACK] Seq=8633 Ack=339 Win=81 Len=0 TSval=118943826 TSecr=383216
266 2.285189629 172.31.31.144 -> 172.31.24.227 TCP 66 6633 → 39450 [ACK] Seq=97 Ack=7956 Win=853 Len=0 TSval=383216 TSecr=118943826
267 2.285223928 172.31.31.144 -> 172.31.24.227 TCP 66 6633 → 39448 [ACK] Seq=97 Ack=7951 Win=853 Len=0 TSval=383216 TSecr=118943826
268 2.285255396 172.31.31.144 -> 172.31.24.227 TCP 66 6633 → 39450 [ACK] Seq=97 Ack=8079 Win=853 Len=0 TSval=383216 TSecr=118943826
269 2.285341463 172.31.24.227 -> 172.31.31.144 OpenFlow 189 Type: OFPT_PACKET_IN
270 2.285364112 172.31.31.144 -> 172.31.24.227 OpenFlow 187 Type: OFPT_PACKET_OUT
271 2.285369801 172.31.24.227 -> 172.31.31.144 OpenFlow 189 Type: OFPT_PACKET_IN
272 2.285431426 172.31.24.227 -> 172.31.31.144 OpenFlow 189 Type: OFPT_PACKET_IN
273 2.285457056 172.31.24.227 -> 172.31.31.144 OpenFlow 189 Type: OFPT_PACKET_IN
274 2.285562101 172.31.31.144 -> 172.31.24.227 TCP 66 6633 → 39446 [ACK] Seq=97 Ack=8864 Win=853 Len=0 TSval=383216 TSecr=118943826
275 2.285593925 172.31.31.144 -> 172.31.24.227 TCP 66 6633 → 39446 [ACK] Seq=97 Ack=8987 Win=853 Len=0 TSval=383216 TSecr=118943826
276 2.285657609 172.31.31.144 -> 172.31.24.227 TCP 66 6633 → 39472 [ACK] Seq=97 Ack=9380 Win=853 Len=0 TSval=383216 TSecr=118943826
277 2.285687036 172.31.31.144 -> 172.31.24.227 TCP 66 6633 → 39472 [ACK] Seq=97 Ack=9503 Win=853 Len=0 TSval=383216 TSecr=118943826
278 2.285737169 172.31.31.144 -> 172.31.24.227 OpenFlow 187 Type: OFPT_PACKET_OUT
279 2.285826882 172.31.31.144 -> 172.31.24.227 OpenFlow 187 Type: OFPT_PACKET_OUT
280 2.285887448 172.31.24.227 -> 172.31.31.144 TCP 66 39486 → 6633 [ACK] Seq=8633 Ack=702 Win=81 Len=0 TSval=118943826 TSecr=383216
281 2.285988272 172.31.31.144 -> 172.31.24.227 OpenFlow 187 Type: OFPT_PACKET_OUT
282 2.286107250 172.31.31.144 -> 172.31.24.227 OpenFlow 187 Type: OFPT_PACKET_OUT
283 2.286114885 172.31.24.227 -> 172.31.31.144 OpenFlow 189 Type: OFPT_PACKET_IN
284 2.286187120 172.31.31.144 -> 172.31.24.227 OpenFlow 187 Type: OFPT_PACKET_OUT
285 2.286255776 172.31.24.227 -> 172.31.31.144 TCP 66 39486 → 6633 [ACK] Seq=8633 Ack=1065 Win=81 Len=0 TSval=118943826 TSecr=383216
286 2.286344194 172.31.31.144 -> 172.31.24.227 OpenFlow 187 Type: OFPT_PACKET_OUT
287 2.286466683 172.31.31.144 -> 172.31.24.227 OpenFlow 187 Type: OFPT_PACKET_OUT
288 2.286508344 172.31.24.227 -> 172.31.31.144 TCP 66 39468 → 6633 [ACK] Seq=9385 Ack=339 Win=80 Len=0 TSval=118943826 TSecr=383216
289 2.286556333 172.31.31.144 -> 172.31.24.227 OpenFlow 187 Type: OFPT_PACKET_OUT
290 2.286624927 172.31.24.227 -> 172.31.31.144 OpenFlow 189 Type: OFPT_PACKET_IN
291 2.286656387 172.31.24.227 -> 172.31.31.144 OpenFlow 189 Type: OFPT_PACKET_IN
292 2.286696470 172.31.31.144 -> 172.31.24.227 OpenFlow 187 Type: OFPT_PACKET_OUT
293 2.286738071 172.31.24.227 -> 172.31.31.144 OpenFlow 189 Type: OFPT_PACKET_IN
294 2.286744208 172.31.24.227 -> 172.31.31.144 OpenFlow 312 Type: OFPT_PACKET_IN
295 2.286777062 172.31.31.144 -> 172.31.24.227 OpenFlow 187 Type: OFPT_PACKET_OUT
296 2.286781529 172.31.31.144 -> 172.31.24.227 OpenFlow 187 Type: OFPT_PACKET_OUT
297 2.286835737 172.31.24.227 -> 172.31.31.144 OpenFlow 189 Type: OFPT_PACKET_IN
298 2.286849624 172.31.31.144 -> 172.31.24.227 OpenFlow 187 Type: OFPT_PACKET_OUT
299 2.286853532 172.31.24.227 -> 172.31.31.144 TCP 66 39468 → 6633 [ACK] Seq=9385 Ack=944 Win=80 Len=0 TSval=118943826 TSecr=383216
300 2.286922707 172.31.31.144 -> 172.31.24.227 TCP 66 6633 → 39470 [ACK] Seq=97 Ack=9700 Win=853 Len=0 TSval=383216 TSecr=118943826
301 2.286953192 172.31.31.144 -> 172.31.24.227 OpenFlow 187 Type: OFPT_PACKET_OUT
302 2.286992450 172.31.31.144 -> 172.31.24.227 TCP 66 6633 → 39470 [ACK] Seq=97 Ack=9823 Win=853 Len=0 TSval=383216 TSecr=118943826
303 2.287026912 172.31.31.144 -> 172.31.24.227 OpenFlow 187 Type: OFPT_PACKET_OUT
304 2.287061085 172.31.31.144 -> 172.31.24.227 TCP 66 6633 → 39464 [ACK] Seq=97 Ack=10038 Win=853 Len=0 TSval=383216 TSecr=118943826
305 2.287085273 172.31.24.227 -> 172.31.31.144 TCP 66 39468 → 6633 [ACK] Seq=9385 Ack=1186 Win=80 Len=0 TSval=118943826 TSecr=383216
306 2.287093964 172.31.31.144 -> 172.31.24.227 OpenFlow 187 Type: OFPT_PACKET_OUT
307 2.287154702 172.31.31.144 -> 172.31.24.227 TCP 66 6633 → 39478 [ACK] Seq=97 Ack=8405 Win=853 Len=0 TSval=383217 TSecr=118943826
308 2.287220238 172.31.31.144 -> 172.31.24.227 OpenFlow 187 Type: OFPT_PACKET_OUT
309 2.287359814 172.31.31.144 -> 172.31.24.227 OpenFlow 187 Type: OFPT_PACKET_OUT
310 2.287381834 172.31.24.227 -> 172.31.31.144 OpenFlow 189 Type: OFPT_PACKET_IN
311 2.287402600 172.31.24.227 -> 172.31.31.144 OpenFlow 189 Type: OFPT_PACKET_IN
312 2.287410412 172.31.24.227 -> 172.31.31.144 OpenFlow 435 Type: OFPT_PACKET_IN
313 2.287451639 172.31.31.144 -> 172.31.24.227 OpenFlow 187 Type: OFPT_PACKET_OUT
314 2.287529019 172.31.24.227 -> 172.31.31.144 TCP 66 39468 → 6633 [ACK] Seq=9385 Ack=1670 Win=80 Len=0 TSval=118943827 TSecr=383217
315 2.287583723 172.31.31.144 -> 172.31.24.227 OpenFlow 187 Type: OFPT_PACKET_OUT
316 2.287616782 172.31.31.144 -> 172.31.24.227 TCP 66 6633 → 39462 [ACK] Seq=97 Ack=7732 Win=853 Len=0 TSval=383217 TSecr=118943827
317 2.287654422 172.31.31.144 -> 172.31.24.227 TCP 66 6633 → 39464 [ACK] Seq=97 Ack=10161 Win=853 Len=0 TSval=383217 TSecr=118943827
318 2.287706682 172.31.31.144 -> 172.31.24.227 TCP 66 6633 → 39462 [ACK] Seq=97 Ack=8101 Win=853 Len=0 TSval=383217 TSecr=118943827
319 2.287722241 172.31.24.227 -> 172.31.31.144 OpenFlow 189 Type: OFPT_PACKET_IN
320 2.287746425 172.31.24.227 -> 172.31.31.144 OpenFlow 189 Type: OFPT_PACKET_IN
321 2.287781734 172.31.31.144 -> 172.31.24.227 OpenFlow 187 Type: OFPT_PACKET_OUT
322 2.287851015 172.31.31.144 -> 172.31.24.227 OpenFlow 187 Type: OFPT_PACKET_OUT
323 2.287855287 172.31.31.144 -> 172.31.24.227 OpenFlow 187 Type: OFPT_PACKET_OUT
324 2.287867440 172.31.24.227 -> 172.31.31.144 OpenFlow 189 Type: OFPT_PACKET_IN
325 2.287890882 172.31.24.227 -> 172.31.31.144 OpenFlow 189 Type: OFPT_PACKET_IN
326 2.287946649 172.31.31.144 -> 172.31.24.227 TCP 66 6633 → 39492 [ACK] Seq=97 Ack=8282 Win=853 Len=0 TSval=383217 TSecr=118943827
327 2.287952234 172.31.31.144 -> 172.31.24.227 TCP 66 6633 → 39492 [ACK] Seq=97 Ack=8405 Win=853 Len=0 TSval=383217 TSecr=118943827
328 2.288013796 172.31.24.227 -> 172.31.31.144 TCP 66 39466 → 6633 [ACK] Seq=10649 Ack=460 Win=385 Len=0 TSval=118943827 TSecr=383217
329 2.288070581 172.31.31.144 -> 172.31.24.227 TCP 66 6633 → 39462 [ACK] Seq=97 Ack=8224 Win=853 Len=0 TSval=383217 TSecr=118943827
330 2.288109103 172.31.31.144 -> 172.31.24.227 TCP 66 6633 → 39462 [ACK] Seq=97 Ack=8347 Win=853 Len=0 TSval=383217 TSecr=118943827
331 2.288113111 172.31.24.227 -> 172.31.31.144 OpenFlow 189 Type: OFPT_PACKET_IN
332 2.288158164 172.31.31.144 -> 172.31.24.227 OpenFlow 187 Type: OFPT_PACKET_OUT
333 2.288167186 172.31.24.227 -> 172.31.31.144 OpenFlow 189 Type: OFPT_PACKET_IN
334 2.288180162 172.31.31.144 -> 172.31.24.227 OpenFlow 187 Type: OFPT_PACKET_OUT
335 2.288183775 172.31.24.227 -> 172.31.31.144 OpenFlow 189 Type: OFPT_PACKET_IN
336 2.288282372 172.31.31.144 -> 172.31.24.227 OpenFlow 187 Type: OFPT_PACKET_OUT
337 2.288323598 172.31.31.144 -> 172.31.24.227 TCP 66 6633 → 39476 [ACK] Seq=97 Ack=8644 Win=853 Len=0 TSval=383217 TSecr=118943827
338 2.288361762 172.31.31.144 -> 172.31.24.227 OpenFlow 187 Type: OFPT_PACKET_OUT
339 2.288392616 172.31.31.144 -> 172.31.24.227 TCP 66 6633 → 39492 [ACK] Seq=97 Ack=8528 Win=853 Len=0 TSval=383217 TSecr=118943827
340 2.288432737 172.31.31.144 -> 172.31.24.227 TCP 66 6633 → 39492 [ACK] Seq=97 Ack=8651 Win=853 Len=0 TSval=383217 TSecr=118943827
341 2.288467287 172.31.31.144 -> 172.31.24.227 OpenFlow 187 Type: OFPT_PACKET_OUT
342 2.288502870 172.31.31.144 -> 172.31.24.227 OpenFlow 187 Type: OFPT_PACKET_OUT
343 2.288582196 172.31.31.144 -> 172.31.24.227 OpenFlow 187 Type: OFPT_PACKET_OUT
344 2.288586692 172.31.24.227 -> 172.31.31.144 TCP 66 39466 → 6633 [ACK] Seq=10649 Ack=1186 Win=385 Len=0 TSval=118943827 TSecr=383217
345 2.288644032 172.31.31.144 -> 172.31.24.227 OpenFlow 187 Type: OFPT_PACKET_OUT
346 2.288691166 172.31.24.227 -> 172.31.31.144 TCP 66 39466 → 6633 [ACK] Seq=10649 Ack=1428 Win=385 Len=0 TSval=118943827 TSecr=383217
347 2.288759306 172.31.24.227 -> 172.31.31.144 OpenFlow 189 Type: OFPT_PACKET_IN
348 2.288779774 172.31.24.227 -> 172.31.31.144 OpenFlow 435 Type: OFPT_PACKET_IN
349 2.288798168 172.31.24.227 -> 172.31.31.144 OpenFlow 189 Type: OFPT_PACKET_IN
350 2.288828588 172.31.31.144 -> 172.31.24.227 OpenFlow 187 Type: OFPT_PACKET_OUT
351 2.288904831 172.31.31.144 -> 172.31.24.227 OpenFlow 187 Type: OFPT_PACKET_OUT
352 2.288934572 172.31.24.227 -> 172.31.31.144 OpenFlow 189 Type: OFPT_PACKET_IN
353 2.288955644 172.31.24.227 -> 172.31.31.144 OpenFlow 312 Type: OFPT_PACKET_IN
354 2.289003136 172.31.31.144 -> 172.31.24.227 OpenFlow 187 Type: OFPT_PACKET_OUT
355 2.289023857 172.31.31.144 -> 172.31.24.227 TCP 66 6633 → 39470 [ACK] Seq=97 Ack=9946 Win=853 Len=0 TSval=383217 TSecr=118943827
356 2.289049658 172.31.31.144 -> 172.31.24.227 TCP 66 6633 → 39470 [ACK] Seq=97 Ack=10315 Win=853 Len=0 TSval=383217 TSecr=118943827
357 2.289084515 172.31.31.144 -> 172.31.24.227 TCP 66 6633 → 39476 [ACK] Seq=97 Ack=8767 Win=853 Len=0 TSval=383217 TSecr=118943827
358 2.289119985 172.31.31.144 -> 172.31.24.227 OpenFlow 187 Type: OFPT_PACKET_OUT
359 2.289151550 172.31.31.144 -> 172.31.24.227 TCP 66 6633 → 39450 [ACK] Seq=97 Ack=8202 Win=853 Len=0 TSval=383217 TSecr=118943827
360 2.289181166 172.31.24.227 -> 172.31.31.144 TCP 66 39466 → 6633 [ACK] Seq=10649 Ack=1912 Win=385 Len=0 TSval=118943827 TSecr=383217
361 2.289190162 172.31.31.144 -> 172.31.24.227 OpenFlow 187 Type: OFPT_PACKET_OUT
362 2.289226501 172.31.31.144 -> 172.31.24.227 TCP 66 6633 → 39450 [ACK] Seq=97 Ack=8448 Win=853 Len=0 TSval=383217 TSecr=118943827
363 2.289268486 172.31.31.144 -> 172.31.24.227 OpenFlow 187 Type: OFPT_PACKET_OUT
364 2.289292833 172.31.31.144 -> 172.31.24.227 OpenFlow 187 Type: OFPT_PACKET_OUT
365 2.289344412 172.31.24.227 -> 172.31.31.144 TCP 66 39466 → 6633 [ACK] Seq=10649 Ack=2275 Win=385 Len=0 TSval=118943827 TSecr=383217
366 2.289387199 172.31.31.144 -> 172.31.24.227 OpenFlow 187 Type: OFPT_PACKET_OUT
