  1 0.000000000 172.31.31.144 -> 172.31.23.72 TCP 66 6633 → 40146 [ACK] Seq=1 Ack=1 Win=853 Len=0 TSval=693680 TSecr=786509
  2 0.000009348 172.31.31.144 -> 172.31.23.72 TCP 66 6633 → 40144 [ACK] Seq=1 Ack=1 Win=853 Len=0 TSval=693680 TSecr=786509
  3 0.007095478 172.31.31.144 -> 172.31.23.72 TCP 82 6633 → 40152 [PSH, ACK] Seq=1 Ack=1 Win=853 Len=16 TSval=693681 TSecr=786440
  4 0.007112334 172.31.31.144 -> 172.31.23.72 TCP 82 6633 → 40148 [PSH, ACK] Seq=1 Ack=1 Win=853 Len=16 TSval=693681 TSecr=786441
  5 0.007131001 172.31.31.144 -> 172.31.23.72 TCP 146 6633 → 40152 [PSH, ACK] Seq=17 Ack=1 Win=853 Len=80 TSval=693681 TSecr=786440
  6 0.007150720 172.31.31.144 -> 172.31.23.72 TCP 90 6633 → 40142 [PSH, ACK] Seq=1 Ack=1 Win=853 Len=24 TSval=693681 TSecr=786389
  7 0.007169662 172.31.31.144 -> 172.31.23.72 TCP 122 6633 → 40156 [PSH, ACK] Seq=1 Ack=1 Win=853 Len=56 TSval=693681 TSecr=786440
  8 0.007190587 172.31.31.144 -> 172.31.23.72 TCP 146 6633 → 40148 [PSH, ACK] Seq=17 Ack=1 Win=853 Len=80 TSval=693681 TSecr=786441
  9 0.007210948 172.31.31.144 -> 172.31.23.72 TCP 122 6633 → 40142 [PSH, ACK] Seq=25 Ack=1 Win=853 Len=56 TSval=693681 TSecr=786389
 10 0.007229604 172.31.31.144 -> 172.31.23.72 TCP 82 6633 → 40142 [PSH, ACK] Seq=81 Ack=1 Win=853 Len=16 TSval=693681 TSecr=786389
 11 0.007248380 172.31.31.144 -> 172.31.23.72 TCP 106 6633 → 40156 [PSH, ACK] Seq=57 Ack=1 Win=853 Len=40 TSval=693681 TSecr=786440
 12 0.007267830 172.31.31.144 -> 172.31.23.72 TCP 122 6633 → 40140 [PSH, ACK] Seq=1 Ack=1 Win=853 Len=56 TSval=693681 TSecr=786440
 13 0.007287672 172.31.31.144 -> 172.31.23.72 TCP 106 6633 → 40140 [PSH, ACK] Seq=57 Ack=1 Win=853 Len=40 TSval=693681 TSecr=786440
 14 0.007335597 172.31.23.72 -> 172.31.31.144 OpenFlow 642 Type: OFPT_MULTIPART_REPLY, OFPMP_PORT_STATS
 15 0.007402298 172.31.23.72 -> 172.31.31.144 OpenFlow 1802 Type: OFPT_MULTIPART_REPLY, OFPMP_FLOW
 16 0.007549099 172.31.23.72 -> 172.31.31.144 OpenFlow 6178 Type: OFPT_MULTIPART_REPLY, OFPMP_TABLE
 17 0.007623356 172.31.31.144 -> 172.31.23.72 TCP 66 6633 → 40142 [ACK] Seq=97 Ack=2313 Win=853 Len=0 TSval=693681 TSecr=786520
 18 0.007719115 172.31.23.72 -> 172.31.31.144 OpenFlow 6178 Type: OFPT_MULTIPART_REPLY, OFPMP_TABLE
 19 0.007799944 172.31.23.72 -> 172.31.31.144 OpenFlow 754 Type: OFPT_MULTIPART_REPLY, OFPMP_PORT_STATS
 20 0.007874766 172.31.23.72 -> 172.31.31.144 OpenFlow 3466 Type: OFPT_MULTIPART_REPLY, OFPMP_FLOW
 21 0.007943853 172.31.31.144 -> 172.31.23.72 TCP 66 6633 → 40148 [ACK] Seq=97 Ack=6113 Win=853 Len=0 TSval=693682 TSecr=786520
 22 0.007962227 172.31.31.144 -> 172.31.23.72 TCP 66 6633 → 40148 [ACK] Seq=97 Ack=6801 Win=853 Len=0 TSval=693682 TSecr=786520
 23 0.008045371 172.31.23.72 -> 172.31.31.144 OpenFlow 6178 Type: OFPT_MULTIPART_REPLY, OFPMP_TABLE
 24 0.008072509 172.31.31.144 -> 172.31.23.72 TCP 66 6633 → 40148 [ACK] Seq=97 Ack=10201 Win=853 Len=0 TSval=693682 TSecr=786520
 25 0.008133781 172.31.23.72 -> 172.31.31.144 OpenFlow 754 Type: OFPT_MULTIPART_REPLY, OFPMP_PORT_STATS
 26 0.008213564 172.31.23.72 -> 172.31.31.144 OpenFlow 3882 Type: OFPT_MULTIPART_REPLY, OFPMP_FLOW
 27 0.008262293 172.31.31.144 -> 172.31.23.72 TCP 66 6633 → 40152 [ACK] Seq=97 Ack=6113 Win=853 Len=0 TSval=693682 TSecr=786520
 28 0.008276057 172.31.23.72 -> 172.31.31.144 OpenFlow 1178 Type: OFPT_MULTIPART_REPLY, OFPMP_FLOW
 29 0.008283442 172.31.31.144 -> 172.31.23.72 TCP 66 6633 → 40152 [ACK] Seq=97 Ack=6801 Win=853 Len=0 TSval=693682 TSecr=786520
 30 0.008348776 172.31.23.72 -> 172.31.31.144 OpenFlow 642 Type: OFPT_MULTIPART_REPLY, OFPMP_PORT_STATS
 31 0.008423237 172.31.31.144 -> 172.31.23.72 TCP 66 6633 → 40152 [ACK] Seq=97 Ack=10617 Win=853 Len=0 TSval=693682 TSecr=786520
 32 0.008496120 172.31.23.72 -> 172.31.31.144 OpenFlow 6178 Type: OFPT_MULTIPART_REPLY, OFPMP_TABLE
 33 0.008550532 172.31.31.144 -> 172.31.23.72 TCP 66 6633 → 40156 [ACK] Seq=97 Ack=1689 Win=853 Len=0 TSval=693682 TSecr=786520
 34 0.008730024 172.31.23.72 -> 172.31.31.144 OpenFlow 2426 Type: OFPT_MULTIPART_REPLY, OFPMP_FLOW
 35 0.008872181 172.31.23.72 -> 172.31.31.144 OpenFlow 6178 Type: OFPT_MULTIPART_REPLY, OFPMP_TABLE
 36 0.008928048 172.31.31.144 -> 172.31.23.72 TCP 66 6633 → 40140 [ACK] Seq=97 Ack=2361 Win=853 Len=0 TSval=693682 TSecr=786521
 37 0.008956494 172.31.23.72 -> 172.31.31.144 OpenFlow 642 Type: OFPT_MULTIPART_REPLY, OFPMP_PORT_STATS
 38 0.009094425 172.31.31.144 -> 172.31.23.72 TCP 66 6633 → 40140 [ACK] Seq=97 Ack=8473 Win=853 Len=0 TSval=693682 TSecr=786521
 39 0.009153163 172.31.31.144 -> 172.31.23.72 TCP 66 6633 → 40140 [ACK] Seq=97 Ack=9049 Win=853 Len=0 TSval=693682 TSecr=786521
 40 0.016003374 172.31.31.144 -> 172.31.23.72 TCP 66 6633 → 40154 [ACK] Seq=1 Ack=1 Win=853 Len=0 TSval=693684 TSecr=786513
 41 0.043996430 172.31.31.144 -> 172.31.23.72 TCP 66 6633 → 40142 [ACK] Seq=97 Ack=8425 Win=853 Len=0 TSval=693691 TSecr=786520
 42 0.047994943 172.31.31.144 -> 172.31.23.72 TCP 66 6633 → 40156 [ACK] Seq=97 Ack=7801 Win=853 Len=0 TSval=693692 TSecr=786520
 43 0.073341454 137.158.125.247 -> 172.31.23.72 TCP 54 52508 → 22 [ACK] Seq=1 Ack=1 Win=32716 Len=0
 44 0.073357070 137.158.125.247 -> 172.31.23.72 TCP 54 52508 → 22 [ACK] Seq=1 Ack=333 Win=32550 Len=0
 45 0.186738579 137.158.125.247 -> 172.31.23.72 TCP 54 52508 → 22 [ACK] Seq=1 Ack=393 Win=32520 Len=0
 46 0.734399646 172.31.23.72 -> 137.158.125.247 SSH 98 Server: Encrypted packet (len=44)
 47 0.759100469 172.31.23.72 -> 172.31.31.144 OpenFlow 146 Type: OFPT_PORT_STATUS
 48 0.759175959 172.31.23.72 -> 172.31.31.144 OpenFlow 146 Type: OFPT_PORT_STATUS
 49 0.759373210 172.31.31.144 -> 172.31.23.72 TCP 66 6633 → 40142 [ACK] Seq=97 Ack=8505 Win=853 Len=0 TSval=693869 TSecr=786708
 50 0.759388040 172.31.31.144 -> 172.31.23.72 TCP 66 6633 → 40152 [ACK] Seq=97 Ack=10697 Win=853 Len=0 TSval=693869 TSecr=786708
 51 0.783188734 172.31.31.144 -> 172.31.23.72 OpenFlow 146 Type: OFPT_FLOW_MOD
 52 0.783200198 172.31.31.144 -> 172.31.23.72 TCP 146 6633 → 40206 [PSH, ACK] Seq=1 Ack=1 Win=853 Len=80 TSval=693875 TSecr=786441
 53 0.783214245 172.31.31.144 -> 172.31.23.72 OpenFlow 146 Type: OFPT_FLOW_MOD
 54 0.783229008 172.31.31.144 -> 172.31.23.72 OpenFlow 146 Type: OFPT_FLOW_MOD
 55 0.783261272 172.31.31.144 -> 172.31.23.72 TCP 146 6633 → 40154 [PSH, ACK] Seq=1 Ack=1 Win=853 Len=80 TSval=693875 TSecr=786513
 56 0.783301488 172.31.31.144 -> 172.31.23.72 OpenFlow 154 Type: OFPT_BARRIER_REQUEST
 57 0.783306614 172.31.31.144 -> 172.31.23.72 OpenFlow 154 Type: OFPT_BARRIER_REQUEST
 58 0.783318644 172.31.31.144 -> 172.31.23.72 TCP 154 6633 → 40154 [PSH, ACK] Seq=81 Ack=1 Win=853 Len=88 TSval=693875 TSecr=786513
 59 0.783359164 172.31.31.144 -> 172.31.23.72 TCP 154 6633 → 40206 [PSH, ACK] Seq=81 Ack=1 Win=853 Len=88 TSval=693875 TSecr=786441
 60 0.783388587 172.31.23.72 -> 172.31.31.144 TCP 66 40142 → 6633 [ACK] Seq=8505 Ack=265 Win=385 Len=0 TSval=786714 TSecr=693875
 61 0.783395472 172.31.31.144 -> 172.31.23.72 OpenFlow 154 Type: OFPT_BARRIER_REQUEST
 62 0.783405627 172.31.23.72 -> 172.31.31.144 OpenFlow 74 Type: OFPT_BARRIER_REPLY
 63 0.783411733 172.31.31.144 -> 172.31.23.72 TCP 146 6633 → 40204 [PSH, ACK] Seq=1 Ack=1 Win=853 Len=80 TSval=693875 TSecr=786440
 64 0.783466576 172.31.23.72 -> 172.31.31.144 TCP 66 40148 → 6633 [ACK] Seq=10201 Ack=265 Win=612 Len=0 TSval=786714 TSecr=693875
 65 0.783474943 172.31.31.144 -> 172.31.23.72 TCP 146 6633 → 40202 [PSH, ACK] Seq=1 Ack=1 Win=853 Len=80 TSval=693875 TSecr=786440
 66 0.783478897 172.31.31.144 -> 172.31.23.72 TCP 154 6633 → 40204 [PSH, ACK] Seq=81 Ack=1 Win=853 Len=88 TSval=693875 TSecr=786440
 67 0.783480717 172.31.31.144 -> 172.31.23.72 TCP 146 6633 → 40154 [PSH, ACK] Seq=169 Ack=1 Win=853 Len=80 TSval=693875 TSecr=786513
 68 0.783491555 172.31.23.72 -> 172.31.31.144 OpenFlow 74 Type: OFPT_BARRIER_REPLY
 69 0.783514931 172.31.31.144 -> 172.31.23.72 TCP 146 6633 → 40192 [PSH, ACK] Seq=1 Ack=1 Win=853 Len=80 TSval=693875 TSecr=786441
 70 0.783533015 172.31.23.72 -> 172.31.31.144 TCP 66 40152 → 6633 [ACK] Seq=10697 Ack=265 Win=385 Len=0 TSval=786714 TSecr=693875
 71 0.783541445 172.31.31.144 -> 172.31.23.72 TCP 154 6633 → 40154 [PSH, ACK] Seq=249 Ack=1 Win=853 Len=88 TSval=693875 TSecr=786513
 72 0.783543939 172.31.31.144 -> 172.31.23.72 TCP 154 6633 → 40192 [PSH, ACK] Seq=81 Ack=1 Win=853 Len=88 TSval=693875 TSecr=786441
 73 0.783549980 172.31.23.72 -> 172.31.31.144 OpenFlow 74 Type: OFPT_BARRIER_REPLY
 74 0.783582595 172.31.31.144 -> 172.31.23.72 TCP 146 6633 → 40202 [PSH, ACK] Seq=81 Ack=1 Win=853 Len=80 TSval=693875 TSecr=786440
 75 0.783586256 172.31.31.144 -> 172.31.23.72 OpenFlow 146 Type: OFPT_FLOW_MOD
 76 0.783591604 172.31.23.72 -> 172.31.31.144 OpenFlow 74 Type: OFPT_BARRIER_REPLY
 77 0.783607774 172.31.31.144 -> 172.31.23.72 OpenFlow 146 Type: OFPT_FLOW_MOD
 78 0.783617960 172.31.23.72 -> 172.31.31.144 OpenFlow 74 Type: OFPT_BARRIER_REPLY
 79 0.783662984 172.31.23.72 -> 172.31.31.144 TCP 66 40192 → 6633 [ACK] Seq=1 Ack=169 Win=383 Len=0 TSval=786714 TSecr=693875
 80 0.783673106 172.31.23.72 -> 172.31.31.144 OpenFlow 74 Type: OFPT_BARRIER_REPLY
 81 0.783688564 172.31.31.144 -> 172.31.23.72 OpenFlow 154 Type: OFPT_BARRIER_REQUEST
 82 0.783692698 172.31.31.144 -> 172.31.23.72 OpenFlow 146 Type: OFPT_FLOW_MOD
 83 0.783694304 172.31.31.144 -> 172.31.23.72 TCP 74 6633 → 40202 [PSH, ACK] Seq=161 Ack=1 Win=853 Len=8 TSval=693875 TSecr=786440
 84 0.783695906 172.31.31.144 -> 172.31.23.72 OpenFlow 146 Type: OFPT_FLOW_MOD
 85 0.783737349 172.31.23.72 -> 172.31.31.144 TCP 66 40202 → 6633 [ACK] Seq=1 Ack=169 Win=213 Len=0 TSval=786714 TSecr=693875
 86 0.783745273 172.31.23.72 -> 172.31.31.144 OpenFlow 74 Type: OFPT_BARRIER_REPLY
 87 0.783764611 172.31.31.144 -> 172.31.23.72 OpenFlow 146 Type: OFPT_FLOW_MOD
 88 0.783767756 172.31.31.144 -> 172.31.23.72 OpenFlow 74 Type: OFPT_BARRIER_REQUEST
 89 0.783769386 172.31.31.144 -> 172.31.23.72 OpenFlow 146 Type: OFPT_FLOW_MOD
 90 0.783770957 172.31.31.144 -> 172.31.23.72 OpenFlow 154 Type: OFPT_BARRIER_REQUEST
 91 0.783806698 172.31.23.72 -> 172.31.31.144 TCP 66 40204 → 6633 [ACK] Seq=1 Ack=169 Win=311 Len=0 TSval=786714 TSecr=693875
 92 0.783816762 172.31.23.72 -> 172.31.31.144 OpenFlow 74 Type: OFPT_BARRIER_REPLY
 93 0.783845228 172.31.31.144 -> 172.31.23.72 OpenFlow 234 Type: OFPT_BARRIER_REQUEST
 94 0.783848987 172.31.31.144 -> 172.31.23.72 OpenFlow 146 Type: OFPT_FLOW_MOD
 95 0.783850758 172.31.31.144 -> 172.31.23.72 OpenFlow 154 Type: OFPT_BARRIER_REQUEST
 96 0.783853345 172.31.31.144 -> 172.31.23.72 OpenFlow 146 Type: OFPT_FLOW_MOD
 97 0.783857091 172.31.23.72 -> 172.31.31.144 TCP 66 40206 → 6633 [ACK] Seq=1 Ack=169 Win=402 Len=0 TSval=786714 TSecr=693875
 98 0.783866359 172.31.23.72 -> 172.31.31.144 OpenFlow 74 Type: OFPT_BARRIER_REPLY
 99 0.783893575 172.31.31.144 -> 172.31.23.72 OpenFlow 154 Type: OFPT_BARRIER_REQUEST
100 0.783897084 172.31.31.144 -> 172.31.23.72 OpenFlow 154 Type: OFPT_BARRIER_REQUEST
101 0.783972404 172.31.31.144 -> 172.31.23.72 TCP 146 6633 → 40208 [PSH, ACK] Seq=1 Ack=1 Win=853 Len=80 TSval=693875 TSecr=786440
102 0.783978660 172.31.31.144 -> 172.31.23.72 OpenFlow 146 Type: OFPT_FLOW_MOD
103 0.783981048 172.31.31.144 -> 172.31.23.72 TCP 322 6633 → 40208 [PSH, ACK] Seq=81 Ack=1 Win=853 Len=256 TSval=693875 TSecr=786440
104 0.783982791 172.31.31.144 -> 172.31.23.72 OpenFlow 74 Type: OFPT_BARRIER_REQUEST
105 0.783984059 172.31.31.144 -> 172.31.23.72 TCP 66 6633 → 40148 [ACK] Seq=601 Ack=10209 Win=853 Len=0 TSval=693875 TSecr=786714
106 0.784001621 172.31.31.144 -> 172.31.23.72 TCP 146 6633 → 40150 [PSH, ACK] Seq=1 Ack=1 Win=853 Len=80 TSval=693875 TSecr=786513
107 0.784030412 172.31.31.144 -> 172.31.23.72 TCP 154 6633 → 40150 [PSH, ACK] Seq=81 Ack=1 Win=853 Len=88 TSval=693875 TSecr=786513
108 0.784067559 172.31.23.72 -> 172.31.31.144 OpenFlow 146 Type: OFPT_FLOW_REMOVED
109 0.784077051 172.31.31.144 -> 172.31.23.72 TCP 66 6633 → 40154 [ACK] Seq=505 Ack=9 Win=853 Len=0 TSval=693875 TSecr=786714
110 0.784081033 172.31.31.144 -> 172.31.23.72 TCP 66 6633 → 40154 [ACK] Seq=505 Ack=17 Win=853 Len=0 TSval=693875 TSecr=786714
111 0.784092881 172.31.23.72 -> 172.31.31.144 OpenFlow 146 Type: OFPT_FLOW_REMOVED
112 0.784100155 172.31.23.72 -> 172.31.31.144 OpenFlow 146 Type: OFPT_FLOW_REMOVED
113 0.784107126 172.31.23.72 -> 172.31.31.144 OpenFlow 146 Type: OFPT_FLOW_REMOVED
114 0.784110967 172.31.31.144 -> 172.31.23.72 TCP 66 6633 → 40192 [ACK] Seq=337 Ack=9 Win=853 Len=0 TSval=693875 TSecr=786714
115 0.784120734 172.31.23.72 -> 172.31.31.144 OpenFlow 146 Type: OFPT_FLOW_REMOVED
116 0.784134258 172.31.23.72 -> 172.31.31.144 OpenFlow 146 Type: OFPT_FLOW_REMOVED
117 0.784136951 172.31.23.72 -> 172.31.31.144 OpenFlow 146 Type: OFPT_FLOW_REMOVED
118 0.784144227 172.31.23.72 -> 172.31.31.144 OpenFlow 146 Type: OFPT_FLOW_REMOVED
119 0.784151494 172.31.23.72 -> 172.31.31.144 OpenFlow 146 Type: OFPT_FLOW_REMOVED
120 0.784160245 172.31.23.72 -> 172.31.31.144 OpenFlow 146 Type: OFPT_FLOW_REMOVED
121 0.784162401 172.31.23.72 -> 172.31.31.144 OpenFlow 146 Type: OFPT_FLOW_REMOVED
122 0.784258184 172.31.23.72 -> 172.31.31.144 OpenFlow 306 Type: OFPT_FLOW_REMOVED
123 0.784263669 172.31.23.72 -> 172.31.31.144 OpenFlow 146 Type: OFPT_FLOW_REMOVED
124 0.784265395 172.31.23.72 -> 172.31.31.144 OpenFlow 146 Type: OFPT_FLOW_REMOVED
125 0.784348581 172.31.31.144 -> 172.31.23.72 TCP 66 6633 → 40142 [ACK] Seq=601 Ack=8673 Win=853 Len=0 TSval=693876 TSecr=786714
126 0.784353386 172.31.31.144 -> 172.31.23.72 TCP 66 6633 → 40148 [ACK] Seq=601 Ack=10289 Win=853 Len=0 TSval=693876 TSecr=786714
127 0.784355445 172.31.31.144 -> 172.31.23.72 TCP 66 6633 → 40152 [ACK] Seq=601 Ack=10785 Win=853 Len=0 TSval=693876 TSecr=786714
128 0.784357235 172.31.31.144 -> 172.31.23.72 TCP 66 6633 → 40154 [ACK] Seq=505 Ack=97 Win=853 Len=0 TSval=693876 TSecr=786714
129 0.784361314 172.31.23.72 -> 172.31.31.144 OpenFlow 146 Type: OFPT_FLOW_REMOVED
130 0.784366164 172.31.23.72 -> 172.31.31.144 OpenFlow 146 Type: OFPT_FLOW_REMOVED
131 0.784416656 172.31.31.144 -> 172.31.23.72 TCP 66 6633 → 40192 [ACK] Seq=337 Ack=89 Win=853 Len=0 TSval=693876 TSecr=786714
132 0.784419561 172.31.31.144 -> 172.31.23.72 TCP 66 6633 → 40148 [ACK] Seq=601 Ack=10369 Win=853 Len=0 TSval=693876 TSecr=786714
133 0.784508225 172.31.31.144 -> 172.31.23.72 TCP 66 6633 → 40206 [ACK] Seq=169 Ack=89 Win=853 Len=0 TSval=693876 TSecr=786714
134 0.784511492 172.31.31.144 -> 172.31.23.72 TCP 66 6633 → 40204 [ACK] Seq=169 Ack=89 Win=853 Len=0 TSval=693876 TSecr=786714
135 0.784513477 172.31.31.144 -> 172.31.23.72 TCP 66 6633 → 40202 [ACK] Seq=169 Ack=89 Win=853 Len=0 TSval=693876 TSecr=786714
136 0.784515278 172.31.31.144 -> 172.31.23.72 TCP 66 6633 → 40154 [ACK] Seq=505 Ack=337 Win=853 Len=0 TSval=693876 TSecr=786714
137 0.784517138 172.31.31.144 -> 172.31.23.72 TCP 66 6633 → 40192 [ACK] Seq=337 Ack=169 Win=853 Len=0 TSval=693876 TSecr=786714
138 0.786302591 172.31.23.72 -> 172.31.31.144 OpenFlow 74 Type: OFPT_BARRIER_REPLY
139 0.786343338 172.31.23.72 -> 172.31.31.144 OpenFlow 74 Type: OFPT_BARRIER_REPLY
140 0.786368622 172.31.23.72 -> 172.31.31.144 OpenFlow 74 Type: OFPT_BARRIER_REPLY
141 0.786389871 172.31.23.72 -> 172.31.31.144 OpenFlow 74 Type: OFPT_BARRIER_REPLY
142 0.786420407 172.31.23.72 -> 172.31.31.144 TCP 66 40150 → 6633 [ACK] Seq=1 Ack=169 Win=386 Len=0 TSval=786715 TSecr=693875
143 0.786431382 172.31.23.72 -> 172.31.31.144 OpenFlow 74 Type: OFPT_BARRIER_REPLY
144 0.786452624 172.31.23.72 -> 172.31.31.144 OpenFlow 74 Type: OFPT_BARRIER_REPLY
145 0.786496458 172.31.23.72 -> 172.31.31.144 OpenFlow 74 Type: OFPT_BARRIER_REPLY
146 0.786517091 172.31.23.72 -> 172.31.31.144 OpenFlow 74 Type: OFPT_BARRIER_REPLY
147 0.786522036 172.31.31.144 -> 172.31.23.72 TCP 66 6633 → 40142 [ACK] Seq=601 Ack=8689 Win=853 Len=0 TSval=693876 TSecr=786715
148 0.786566429 172.31.31.144 -> 172.31.23.72 TCP 66 6633 → 40148 [ACK] Seq=601 Ack=10377 Win=853 Len=0 TSval=693876 TSecr=786715
149 0.786577108 172.31.31.144 -> 172.31.23.72 TCP 66 6633 → 40148 [ACK] Seq=601 Ack=10385 Win=853 Len=0 TSval=693876 TSecr=786715
150 0.786584340 172.31.23.72 -> 172.31.31.144 OpenFlow 74 Type: OFPT_BARRIER_REPLY
151 0.786601143 172.31.31.144 -> 172.31.23.72 TCP 66 6633 → 40150 [ACK] Seq=169 Ack=9 Win=853 Len=0 TSval=693876 TSecr=786715
152 0.786673750 172.31.23.72 -> 172.31.31.144 OpenFlow 74 Type: OFPT_BARRIER_REPLY
153 0.786713576 172.31.31.144 -> 172.31.23.72 TCP 66 6633 → 40152 [ACK] Seq=601 Ack=10881 Win=853 Len=0 TSval=693876 TSecr=786714
154 0.786720180 172.31.31.144 -> 172.31.23.72 TCP 66 6633 → 40154 [ACK] Seq=505 Ack=345 Win=853 Len=0 TSval=693876 TSecr=786715
155 0.786724597 172.31.23.72 -> 172.31.31.144 OpenFlow 74 Type: OFPT_BARRIER_REPLY
156 0.786748769 172.31.31.144 -> 172.31.23.72 TCP 66 6633 → 40192 [ACK] Seq=337 Ack=177 Win=853 Len=0 TSval=693876 TSecr=786715
157 0.786870992 172.31.23.72 -> 172.31.31.144 OpenFlow 146 Type: OFPT_FLOW_REMOVED
158 0.786888732 172.31.23.72 -> 172.31.31.144 OpenFlow 146 Type: OFPT_FLOW_REMOVED
159 0.786901056 172.31.31.144 -> 172.31.23.72 TCP 66 6633 → 40208 [ACK] Seq=337 Ack=17 Win=853 Len=0 TSval=693876 TSecr=786715
160 0.786911198 172.31.23.72 -> 172.31.31.144 OpenFlow 146 Type: OFPT_FLOW_REMOVED
161 0.786916191 172.31.23.72 -> 172.31.31.144 OpenFlow 306 Type: OFPT_FLOW_REMOVED
162 0.786923312 172.31.23.72 -> 172.31.31.144 OpenFlow 146 Type: OFPT_FLOW_REMOVED
163 0.786933551 172.31.23.72 -> 172.31.31.144 OpenFlow 146 Type: OFPT_FLOW_REMOVED
164 0.786942010 172.31.23.72 -> 172.31.31.144 OpenFlow 146 Type: OFPT_FLOW_REMOVED
165 0.786943990 172.31.23.72 -> 172.31.31.144 OpenFlow 306 Type: OFPT_FLOW_REMOVED
166 0.786950954 172.31.23.72 -> 172.31.31.144 OpenFlow 146 Type: OFPT_FLOW_REMOVED
167 0.787135833 172.31.23.72 -> 172.31.31.144 OpenFlow 146 Type: OFPT_FLOW_REMOVED
168 0.787141283 172.31.23.72 -> 172.31.31.144 OpenFlow 306 Type: OFPT_FLOW_REMOVED
169 0.787143034 172.31.23.72 -> 172.31.31.144 OpenFlow 146 Type: OFPT_FLOW_REMOVED
170 0.787295118 172.31.31.144 -> 172.31.23.72 TCP 66 6633 → 40148 [ACK] Seq=601 Ack=10465 Win=853 Len=0 TSval=693876 TSecr=786715
171 0.787299348 172.31.31.144 -> 172.31.23.72 TCP 66 6633 → 40150 [ACK] Seq=169 Ack=89 Win=853 Len=0 TSval=693876 TSecr=786715
172 0.787301376 172.31.31.144 -> 172.31.23.72 TCP 66 6633 → 40142 [ACK] Seq=601 Ack=9009 Win=853 Len=0 TSval=693876 TSecr=786715
173 0.787303581 172.31.31.144 -> 172.31.23.72 TCP 170 6633 → 40196 [PSH, ACK] Seq=1 Ack=1 Win=853 Len=104 TSval=693876 TSecr=786440
174 0.787307732 172.31.31.144 -> 172.31.23.72 TCP 178 6633 → 40196 [PSH, ACK] Seq=105 Ack=1 Win=853 Len=112 TSval=693876 TSecr=786440
175 0.787309900 172.31.31.144 -> 172.31.23.72 TCP 66 6633 → 40154 [ACK] Seq=505 Ack=425 Win=853 Len=0 TSval=693876 TSecr=786715
176 0.787316352 172.31.23.72 -> 172.31.31.144 OpenFlow 146 Type: OFPT_FLOW_REMOVED
177 0.787321744 172.31.23.72 -> 172.31.31.144 OpenFlow 306 Type: OFPT_FLOW_REMOVED
178 0.787410295 172.31.31.144 -> 172.31.23.72 OpenFlow 170 Type: OFPT_FLOW_MOD
179 0.787413136 172.31.31.144 -> 172.31.23.72 OpenFlow 178 Type: OFPT_BARRIER_REQUEST
180 0.787415796 172.31.31.144 -> 172.31.23.72 TCP 66 6633 → 40148 [ACK] Seq=601 Ack=10705 Win=853 Len=0 TSval=693876 TSecr=786715
181 0.787536794 172.31.31.144 -> 172.31.23.72 OpenFlow 170 Type: OFPT_FLOW_MOD
182 0.787539437 172.31.31.144 -> 172.31.23.72 OpenFlow 170 Type: OFPT_FLOW_MOD
183 0.787542660 172.31.31.144 -> 172.31.23.72 OpenFlow 170 Type: OFPT_FLOW_MOD
184 0.787544528 172.31.31.144 -> 172.31.23.72 OpenFlow 170 Type: OFPT_FLOW_MOD
185 0.787546149 172.31.31.144 -> 172.31.23.72 TCP 66 6633 → 40150 [ACK] Seq=169 Ack=169 Win=853 Len=0 TSval=693876 TSecr=786715
186 0.787548057 172.31.31.144 -> 172.31.23.72 OpenFlow 74 Type: OFPT_BARRIER_REQUEST
187 0.787583024 172.31.31.144 -> 172.31.23.72 OpenFlow 170 Type: OFPT_FLOW_MOD
188 0.787586136 172.31.31.144 -> 172.31.23.72 TCP 66 6633 → 40154 [ACK] Seq=505 Ack=505 Win=853 Len=0 TSval=693876 TSecr=786715
189 0.787588150 172.31.31.144 -> 172.31.23.72 OpenFlow 178 Type: OFPT_BARRIER_REQUEST
190 0.787590071 172.31.31.144 -> 172.31.23.72 OpenFlow 170 Type: OFPT_FLOW_MOD
191 0.787611451 172.31.31.144 -> 172.31.23.72 OpenFlow 74 Type: OFPT_BARRIER_REQUEST
192 0.787628594 172.31.31.144 -> 172.31.23.72 TCP 170 6633 → 40212 [PSH, ACK] Seq=1 Ack=1 Win=853 Len=104 TSval=693876 TSecr=786439
193 0.787647706 172.31.31.144 -> 172.31.23.72 OpenFlow 170 Type: OFPT_FLOW_MOD
194 0.787669742 172.31.31.144 -> 172.31.23.72 OpenFlow 74 Type: OFPT_BARRIER_REQUEST
195 0.787686456 172.31.31.144 -> 172.31.23.72 TCP 178 6633 → 40212 [PSH, ACK] Seq=105 Ack=1 Win=853 Len=112 TSval=693876 TSecr=786439
196 0.787703997 172.31.31.144 -> 172.31.23.72 TCP 66 6633 → 40208 [ACK] Seq=337 Ack=337 Win=853 Len=0 TSval=693876 TSecr=786715
197 0.787724384 172.31.31.144 -> 172.31.23.72 OpenFlow 170 Type: OFPT_FLOW_MOD
198 0.787743875 172.31.31.144 -> 172.31.23.72 OpenFlow 170 Type: OFPT_FLOW_MOD
199 0.787762646 172.31.31.144 -> 172.31.23.72 OpenFlow 170 Type: OFPT_FLOW_MOD
200 0.787781187 172.31.31.144 -> 172.31.23.72 OpenFlow 170 Type: OFPT_FLOW_MOD
201 0.787846476 172.31.31.144 -> 172.31.23.72 OpenFlow 178 Type: OFPT_BARRIER_REQUEST
202 0.787848598 172.31.31.144 -> 172.31.23.72 OpenFlow 74 Type: OFPT_BARRIER_REQUEST
203 0.787850287 172.31.31.144 -> 172.31.23.72 OpenFlow 170 Type: OFPT_FLOW_MOD
204 0.787853773 172.31.31.144 -> 172.31.23.72 OpenFlow 170 Type: OFPT_FLOW_MOD
205 0.787892568 172.31.31.144 -> 172.31.23.72 OpenFlow 74 Type: OFPT_BARRIER_REQUEST
206 0.787926332 172.31.31.144 -> 172.31.23.72 TCP 170 6633 → 40216 [PSH, ACK] Seq=1 Ack=1 Win=853 Len=104 TSval=693877 TSecr=786441
207 0.787945057 172.31.31.144 -> 172.31.23.72 TCP 178 6633 → 40216 [PSH, ACK] Seq=105 Ack=1 Win=853 Len=112 TSval=693877 TSecr=786441
208 0.787973674 172.31.31.144 -> 172.31.23.72 OpenFlow 170 Type: OFPT_FLOW_MOD
209 0.788015691 172.31.31.144 -> 172.31.23.72 OpenFlow 170 Type: OFPT_FLOW_MOD
210 0.788040734 172.31.31.144 -> 172.31.23.72 OpenFlow 178 Type: OFPT_BARRIER_REQUEST
211 0.788054747 172.31.31.144 -> 172.31.23.72 OpenFlow 170 Type: OFPT_FLOW_MOD
212 0.788117234 172.31.31.144 -> 172.31.23.72 TCP 170 6633 → 40188 [PSH, ACK] Seq=1 Ack=1 Win=853 Len=104 TSval=693877 TSecr=786441
213 0.788120645 172.31.31.144 -> 172.31.23.72 OpenFlow 170 Type: OFPT_FLOW_MOD
214 0.788122752 172.31.31.144 -> 172.31.23.72 TCP 394 6633 → 40188 [PSH, ACK] Seq=105 Ack=1 Win=853 Len=328 TSval=693877 TSecr=786441
215 0.788134619 172.31.31.144 -> 172.31.23.72 OpenFlow 170 Type: OFPT_FLOW_MOD
216 0.788154035 172.31.31.144 -> 172.31.23.72 OpenFlow 170 Type: OFPT_FLOW_MOD
217 0.788172402 172.31.31.144 -> 172.31.23.72 OpenFlow 170 Type: OFPT_FLOW_MOD
218 0.788191960 172.31.31.144 -> 172.31.23.72 OpenFlow 74 Type: OFPT_BARRIER_REQUEST
219 0.788210004 172.31.31.144 -> 172.31.23.72 OpenFlow 178 Type: OFPT_BARRIER_REQUEST
220 0.788278268 172.31.31.144 -> 172.31.23.72 OpenFlow 170 Type: OFPT_FLOW_MOD
221 0.788280470 172.31.31.144 -> 172.31.23.72 OpenFlow 74 Type: OFPT_BARRIER_REQUEST
222 0.788282158 172.31.31.144 -> 172.31.23.72 OpenFlow 170 Type: OFPT_FLOW_MOD
223 0.788285546 172.31.31.144 -> 172.31.23.72 OpenFlow 178 Type: OFPT_BARRIER_REQUEST
224 0.788308714 172.31.31.144 -> 172.31.23.72 OpenFlow 170 Type: OFPT_FLOW_MOD
225 0.788336035 172.31.31.144 -> 172.31.23.72 OpenFlow 74 Type: OFPT_BARRIER_REQUEST
226 0.788824639 172.31.23.72 -> 172.31.31.144 OpenFlow 74 Type: OFPT_BARRIER_REPLY
227 0.788855491 172.31.23.72 -> 172.31.31.144 OpenFlow 74 Type: OFPT_BARRIER_REPLY
228 0.788888174 172.31.23.72 -> 172.31.31.144 OpenFlow 74 Type: OFPT_BARRIER_REPLY
229 0.788930785 172.31.23.72 -> 172.31.31.144 OpenFlow 74 Type: OFPT_BARRIER_REPLY
230 0.788943257 172.31.23.72 -> 172.31.31.144 TCP 66 40150 → 6633 [ACK] Seq=169 Ack=385 Win=386 Len=0 TSval=786716 TSecr=693877
231 0.788947582 172.31.23.72 -> 172.31.31.144 OpenFlow 74 Type: OFPT_BARRIER_REPLY
232 0.788968455 172.31.23.72 -> 172.31.31.144 TCP 66 40152 → 6633 [ACK] Seq=11201 Ack=817 Win=385 Len=0 TSval=786716 TSecr=693876
233 0.788972427 172.31.23.72 -> 172.31.31.144 OpenFlow 74 Type: OFPT_BARRIER_REPLY
234 0.788992541 172.31.23.72 -> 172.31.31.144 OpenFlow 74 Type: OFPT_BARRIER_REPLY
235 0.789024624 172.31.23.72 -> 172.31.31.144 TCP 66 40156 → 6633 [ACK] Seq=7801 Ack=313 Win=213 Len=0 TSval=786716 TSecr=693876
236 0.789033215 172.31.23.72 -> 172.31.31.144 OpenFlow 74 Type: OFPT_BARRIER_REPLY
237 0.789057663 172.31.23.72 -> 172.31.31.144 OpenFlow 74 Type: OFPT_BARRIER_REPLY
238 0.789093396 172.31.23.72 -> 172.31.31.144 TCP 66 40192 → 6633 [ACK] Seq=337 Ack=553 Win=383 Len=0 TSval=786716 TSecr=693876
239 0.789097482 172.31.23.72 -> 172.31.31.144 OpenFlow 74 Type: OFPT_BARRIER_REPLY
240 0.789121311 172.31.23.72 -> 172.31.31.144 TCP 66 40196 → 6633 [ACK] Seq=1 Ack=217 Win=213 Len=0 TSval=786716 TSecr=693876
241 0.789125222 172.31.23.72 -> 172.31.31.144 OpenFlow 74 Type: OFPT_BARRIER_REPLY
242 0.789153976 172.31.23.72 -> 172.31.31.144 TCP 66 40202 → 6633 [ACK] Seq=169 Ack=385 Win=213 Len=0 TSval=786716 TSecr=693876
243 0.789157864 172.31.23.72 -> 172.31.31.144 OpenFlow 74 Type: OFPT_BARRIER_REPLY
244 0.789180961 172.31.23.72 -> 172.31.31.144 TCP 66 40206 → 6633 [ACK] Seq=169 Ack=385 Win=402 Len=0 TSval=786716 TSecr=693877
245 0.789184399 172.31.23.72 -> 172.31.31.144 OpenFlow 74 Type: OFPT_BARRIER_REPLY
246 0.789203940 172.31.23.72 -> 172.31.31.144 OpenFlow 74 Type: OFPT_BARRIER_REPLY
247 0.789206421 172.31.23.72 -> 172.31.31.144 OpenFlow 74 Type: OFPT_BARRIER_REPLY
248 0.789236030 172.31.31.144 -> 172.31.23.72 TCP 66 6633 → 40142 [ACK] Seq=1033 Ack=9025 Win=853 Len=0 TSval=693877 TSecr=786716
249 0.789244154 172.31.31.144 -> 172.31.23.72 TCP 66 6633 → 40148 [ACK] Seq=1137 Ack=10721 Win=853 Len=0 TSval=693877 TSecr=786716
250 0.789295159 172.31.23.72 -> 172.31.31.144 TCP 66 40212 → 6633 [ACK] Seq=1 Ack=217 Win=385 Len=0 TSval=786716 TSecr=693876
251 0.789304760 172.31.23.72 -> 172.31.31.144 OpenFlow 74 Type: OFPT_BARRIER_REPLY
252 0.789331712 172.31.23.72 -> 172.31.31.144 TCP 66 40216 → 6633 [ACK] Seq=1 Ack=217 Win=213 Len=0 TSval=786716 TSecr=693877
253 0.789335691 172.31.23.72 -> 172.31.31.144 OpenFlow 74 Type: OFPT_BARRIER_REPLY
254 0.789609136 172.31.23.72 -> 172.31.31.144 OpenFlow 74 Type: OFPT_BARRIER_REPLY
255 0.789771314 172.31.31.144 -> 172.31.23.72 TCP 66 6633 → 40156 [ACK] Seq=313 Ack=7809 Win=853 Len=0 TSval=693877 TSecr=786716
256 0.789776744 172.31.31.144 -> 172.31.23.72 TCP 66 6633 → 40192 [ACK] Seq=553 Ack=345 Win=853 Len=0 TSval=693877 TSecr=786715
257 0.789781257 172.31.23.72 -> 172.31.31.144 OpenFlow 74 Type: OFPT_BARRIER_REPLY
258 0.789931495 172.31.31.144 -> 172.31.23.72 TCP 66 6633 → 40154 [ACK] Seq=937 Ack=521 Win=853 Len=0 TSval=693877 TSecr=786716
259 0.789970531 172.31.31.144 -> 172.31.23.72 TCP 66 6633 → 40212 [ACK] Seq=217 Ack=9 Win=853 Len=0 TSval=693877 TSecr=786716
260 0.790055076 172.31.31.144 -> 172.31.23.72 TCP 66 6633 → 40188 [ACK] Seq=433 Ack=17 Win=853 Len=0 TSval=693877 TSecr=786716
261 0.790102574 172.31.31.144 -> 172.31.23.72 TCP 66 6633 → 40208 [ACK] Seq=873 Ack=353 Win=853 Len=0 TSval=693877 TSecr=786716
262 0.824003726 172.31.31.144 -> 172.31.23.72 TCP 66 6633 → 40204 [ACK] Seq=169 Ack=169 Win=853 Len=0 TSval=693886 TSecr=786714
263 0.827981725 172.31.31.144 -> 172.31.23.72 TCP 66 6633 → 40216 [ACK] Seq=217 Ack=9 Win=853 Len=0 TSval=693887 TSecr=786716
264 0.827986023 172.31.31.144 -> 172.31.23.72 TCP 66 6633 → 40196 [ACK] Seq=217 Ack=9 Win=853 Len=0 TSval=693887 TSecr=786716
265 0.827999882 172.31.31.144 -> 172.31.23.72 TCP 66 6633 → 40202 [ACK] Seq=385 Ack=177 Win=853 Len=0 TSval=693887 TSecr=786716
266 0.828018974 172.31.31.144 -> 172.31.23.72 TCP 66 6633 → 40150 [ACK] Seq=385 Ack=177 Win=853 Len=0 TSval=693887 TSecr=786716
267 0.828067419 172.31.31.144 -> 172.31.23.72 TCP 66 6633 → 40152 [ACK] Seq=817 Ack=11209 Win=853 Len=0 TSval=693887 TSecr=786716
268 0.828069646 172.31.31.144 -> 172.31.23.72 TCP 66 6633 → 40206 [ACK] Seq=385 Ack=177 Win=853 Len=0 TSval=693887 TSecr=786716
269 0.942547930 137.158.125.247 -> 172.31.23.72 TCP 54 52508 → 22 [ACK] Seq=1 Ack=437 Win=32498 Len=0
270 0.958933145 172.31.31.144 -> 172.31.23.72 OpenFlow 122 Type: OFPT_MULTIPART_REQUEST, OFPMP_FLOW
271 0.958976315 172.31.31.144 -> 172.31.23.72 OpenFlow 106 Type: OFPT_MULTIPART_REQUEST, OFPMP_TABLE
272 0.959277112 172.31.23.72 -> 172.31.31.144 OpenFlow 1594 Type: OFPT_MULTIPART_REPLY, OFPMP_FLOW
273 0.959419648 172.31.23.72 -> 172.31.31.144 OpenFlow 754 Type: OFPT_MULTIPART_REPLY, OFPMP_PORT_STATS
274 0.959612678 172.31.23.72 -> 172.31.31.144 OpenFlow 6178 Type: OFPT_MULTIPART_REPLY, OFPMP_TABLE
275 0.959718801 172.31.31.144 -> 172.31.23.72 TCP 66 6633 → 40188 [ACK] Seq=529 Ack=2233 Win=853 Len=0 TSval=693919 TSecr=786758
276 0.960168455 172.31.31.144 -> 172.31.23.72 OpenFlow 90 Type: OFPT_MULTIPART_REQUEST, OFPMP_PORT_STATS
277 0.960199266 172.31.31.144 -> 172.31.23.72 OpenFlow 138 Type: OFPT_MULTIPART_REQUEST, OFPMP_FLOW
278 0.960484697 172.31.23.72 -> 172.31.31.144 OpenFlow 642 Type: OFPT_MULTIPART_REPLY, OFPMP_PORT_STATS
279 0.960645060 172.31.23.72 -> 172.31.31.144 OpenFlow 6178 Type: OFPT_MULTIPART_REPLY, OFPMP_TABLE
280 0.960716133 172.31.23.72 -> 172.31.31.144 OpenFlow 2842 Type: OFPT_MULTIPART_REPLY, OFPMP_FLOW
281 0.960896613 172.31.31.144 -> 172.31.23.72 TCP 66 6633 → 40192 [ACK] Seq=649 Ack=9809 Win=853 Len=0 TSval=693920 TSecr=786758
282 0.961301816 172.31.31.144 -> 172.31.23.72 OpenFlow 90 Type: OFPT_MULTIPART_REQUEST, OFPMP_PORT_STATS
283 0.961603326 172.31.23.72 -> 172.31.31.144 OpenFlow 642 Type: OFPT_MULTIPART_REPLY, OFPMP_PORT_STATS
284 0.961790045 172.31.31.144 -> 172.31.23.72 TCP 66 6633 → 40204 [ACK] Seq=193 Ack=745 Win=853 Len=0 TSval=693920 TSecr=786759
285 0.962415189 172.31.31.144 -> 172.31.23.72 OpenFlow 82 Type: OFPT_MULTIPART_REQUEST, OFPMP_TABLE
286 0.962442693 172.31.31.144 -> 172.31.23.72 OpenFlow 122 Type: OFPT_MULTIPART_REQUEST, OFPMP_FLOW
287 0.962705262 172.31.23.72 -> 172.31.31.144 OpenFlow 6178 Type: OFPT_MULTIPART_REPLY, OFPMP_TABLE
288 0.962749701 172.31.23.72 -> 172.31.31.144 OpenFlow 970 Type: OFPT_MULTIPART_REPLY, OFPMP_FLOW
289 0.963095561 172.31.31.144 -> 172.31.23.72 TCP 66 6633 → 40204 [ACK] Seq=265 Ack=7761 Win=853 Len=0 TSval=693920 TSecr=786759
290 0.968608734 172.31.31.144 -> 172.31.23.72 TCP 90 6633 → 40194 [PSH, ACK] Seq=1 Ack=1 Win=853 Len=24 TSval=693922 TSecr=786441
291 0.968625892 172.31.31.144 -> 172.31.23.72 TCP 82 6633 → 40190 [PSH, ACK] Seq=1 Ack=1 Win=853 Len=16 TSval=693922 TSecr=786439
292 0.968644019 172.31.31.144 -> 172.31.23.72 TCP 146 6633 → 40190 [PSH, ACK] Seq=17 Ack=1 Win=853 Len=80 TSval=693922 TSecr=786439
293 0.968664010 172.31.31.144 -> 172.31.23.72 TCP 138 6633 → 40194 [PSH, ACK] Seq=25 Ack=1 Win=853 Len=72 TSval=693922 TSecr=786441
294 0.968884854 172.31.23.72 -> 172.31.31.144 OpenFlow 6178 Type: OFPT_MULTIPART_REPLY, OFPMP_TABLE
295 0.968948584 172.31.23.72 -> 172.31.31.144 OpenFlow 2010 Type: OFPT_MULTIPART_REPLY, OFPMP_FLOW
296 0.969023808 172.31.23.72 -> 172.31.31.144 OpenFlow 530 Type: OFPT_MULTIPART_REPLY, OFPMP_PORT_STATS
297 0.969094437 172.31.31.144 -> 172.31.23.72 TCP 66 6633 → 40190 [ACK] Seq=97 Ack=6113 Win=853 Len=0 TSval=693922 TSecr=786761
298 0.969111573 172.31.31.144 -> 172.31.23.72 TCP 66 6633 → 40190 [ACK] Seq=97 Ack=8057 Win=853 Len=0 TSval=693922 TSecr=786761
299 0.969135982 172.31.23.72 -> 172.31.31.144 OpenFlow 530 Type: OFPT_MULTIPART_REPLY, OFPMP_PORT_STATS
300 0.969186962 172.31.31.144 -> 172.31.23.72 TCP 66 6633 → 40190 [ACK] Seq=97 Ack=8521 Win=853 Len=0 TSval=693922 TSecr=786761
301 0.969289819 172.31.23.72 -> 172.31.31.144 OpenFlow 6178 Type: OFPT_MULTIPART_REPLY, OFPMP_TABLE
302 0.969333244 172.31.23.72 -> 172.31.31.144 OpenFlow 1178 Type: OFPT_MULTIPART_REPLY, OFPMP_FLOW
303 0.969524198 172.31.31.144 -> 172.31.23.72 TCP 66 6633 → 40194 [ACK] Seq=97 Ack=7689 Win=853 Len=0 TSval=693922 TSecr=786761
304 0.969796871 172.31.31.144 -> 172.31.23.72 TCP 90 6633 → 40214 [PSH, ACK] Seq=1 Ack=1 Win=853 Len=24 TSval=693922 TSecr=786441
305 0.969809544 172.31.31.144 -> 172.31.23.72 TCP 122 6633 → 40214 [PSH, ACK] Seq=25 Ack=1 Win=853 Len=56 TSval=693922 TSecr=786441
306 0.969991591 172.31.23.72 -> 172.31.31.144 OpenFlow 530 Type: OFPT_MULTIPART_REPLY, OFPMP_PORT_STATS
307 0.970030115 172.31.23.72 -> 172.31.31.144 OpenFlow 346 Type: OFPT_MULTIPART_REPLY, OFPMP_FLOW
308 0.970208615 172.31.31.144 -> 172.31.23.72 TCP 66 6633 → 40214 [ACK] Seq=81 Ack=465 Win=853 Len=0 TSval=693922 TSecr=786761
309 0.970216096 172.31.31.144 -> 172.31.23.72 TCP 66 6633 → 40214 [ACK] Seq=81 Ack=745 Win=853 Len=0 TSval=693922 TSecr=786761
310 0.970925867 172.31.31.144 -> 172.31.23.72 OpenFlow 82 Type: OFPT_MULTIPART_REQUEST, OFPMP_TABLE
311 0.970939927 172.31.31.144 -> 172.31.23.72 OpenFlow 90 Type: OFPT_MULTIPART_REQUEST, OFPMP_PORT_STATS
312 0.970959619 172.31.31.144 -> 172.31.23.72 OpenFlow 82 Type: OFPT_MULTIPART_REQUEST, OFPMP_TABLE
313 0.971032358 172.31.31.144 -> 172.31.23.72 OpenFlow 122 Type: OFPT_MULTIPART_REQUEST, OFPMP_FLOW
314 0.971130252 172.31.23.72 -> 172.31.31.144 OpenFlow 530 Type: OFPT_MULTIPART_REPLY, OFPMP_PORT_STATS
315 0.971278937 172.31.23.72 -> 172.31.31.144 OpenFlow 6178 Type: OFPT_MULTIPART_REPLY, OFPMP_TABLE
316 0.971291915 172.31.31.144 -> 172.31.23.72 TCP 66 6633 → 40212 [ACK] Seq=313 Ack=473 Win=853 Len=0 TSval=693922 TSecr=786761
317 0.971361113 172.31.23.72 -> 172.31.31.144 OpenFlow 3050 Type: OFPT_MULTIPART_REPLY, OFPMP_FLOW
318 0.971472131 172.31.31.144 -> 172.31.23.72 TCP 66 6633 → 40212 [ACK] Seq=313 Ack=6585 Win=853 Len=0 TSval=693922 TSecr=786761
319 0.971523805 172.31.23.72 -> 172.31.31.144 OpenFlow 6178 Type: OFPT_MULTIPART_REPLY, OFPMP_TABLE
320 0.971580505 172.31.31.144 -> 172.31.23.72 TCP 66 6633 → 40212 [ACK] Seq=313 Ack=9569 Win=853 Len=0 TSval=693922 TSecr=786761
321 0.973136270 172.31.31.144 -> 172.31.23.72 TCP 90 6633 → 40198 [PSH, ACK] Seq=1 Ack=1 Win=853 Len=24 TSval=693923 TSecr=786440
322 0.973150511 172.31.31.144 -> 172.31.23.72 TCP 90 6633 → 40210 [PSH, ACK] Seq=1 Ack=1 Win=853 Len=24 TSval=693923 TSecr=786440
323 0.973324203 172.31.23.72 -> 172.31.31.144 OpenFlow 642 Type: OFPT_MULTIPART_REPLY, OFPMP_PORT_STATS
324 0.973420233 172.31.23.72 -> 172.31.31.144 OpenFlow 530 Type: OFPT_MULTIPART_REPLY, OFPMP_PORT_STATS
325 0.975299530 172.31.31.144 -> 172.31.23.72 OpenFlow 122 Type: OFPT_MULTIPART_REQUEST, OFPMP_FLOW
326 0.975426111 172.31.23.72 -> 172.31.31.144 OpenFlow 762 Type: OFPT_MULTIPART_REPLY, OFPMP_FLOW
327 0.976459518 172.31.31.144 -> 172.31.23.72 OpenFlow 82 Type: OFPT_MULTIPART_REQUEST, OFPMP_TABLE
328 0.976520043 172.31.31.144 -> 172.31.23.72 OpenFlow 122 Type: OFPT_MULTIPART_REQUEST, OFPMP_FLOW
329 0.976766039 172.31.23.72 -> 172.31.31.144 OpenFlow 6178 Type: OFPT_MULTIPART_REPLY, OFPMP_TABLE
330 0.976816855 172.31.23.72 -> 172.31.31.144 OpenFlow 1386 Type: OFPT_MULTIPART_REPLY, OFPMP_FLOW
331 0.977218457 172.31.31.144 -> 172.31.23.72 TCP 66 6633 → 40210 [ACK] Seq=97 Ack=7897 Win=853 Len=0 TSval=693924 TSecr=786763
332 0.983695207 172.31.31.144 -> 172.31.23.72 OpenFlow 82 Type: OFPT_MULTIPART_REQUEST, OFPMP_TABLE
333 0.983935466 172.31.23.72 -> 172.31.31.144 OpenFlow 6178 Type: OFPT_MULTIPART_REPLY, OFPMP_TABLE
334 0.995977913 172.31.31.144 -> 172.31.23.72 TCP 66 6633 → 40188 [ACK] Seq=529 Ack=8345 Win=853 Len=0 TSval=693929 TSecr=786758
335 1.001895704 172.31.31.144 -> 172.31.23.72 OpenFlow 82 Type: OFPT_MULTIPART_REQUEST, OFPMP_TABLE
336 1.001920208 172.31.31.144 -> 172.31.23.72 OpenFlow 146 Type: OFPT_MULTIPART_REQUEST, OFPMP_PORT_STATS
337 1.002271978 172.31.23.72 -> 172.31.31.144 OpenFlow 6178 Type: OFPT_MULTIPART_REPLY, OFPMP_TABLE
338 1.002337883 172.31.23.72 -> 172.31.31.144 OpenFlow 1594 Type: OFPT_MULTIPART_REPLY, OFPMP_FLOW
339 1.002453326 172.31.23.72 -> 172.31.31.144 OpenFlow 754 Type: OFPT_MULTIPART_REPLY, OFPMP_PORT_STATS
340 1.002562443 172.31.31.144 -> 172.31.23.72 TCP 66 6633 → 40216 [ACK] Seq=313 Ack=6121 Win=853 Len=0 TSval=693930 TSecr=786769
341 1.002569571 172.31.31.144 -> 172.31.23.72 TCP 66 6633 → 40216 [ACK] Seq=313 Ack=7649 Win=853 Len=0 TSval=693930 TSecr=786769
342 1.002630999 172.31.31.144 -> 172.31.23.72 TCP 66 6633 → 40216 [ACK] Seq=313 Ack=8337 Win=853 Len=0 TSval=693930 TSecr=786769
343 1.007993870 172.31.31.144 -> 172.31.23.72 TCP 66 6633 → 40214 [ACK] Seq=97 Ack=6857 Win=853 Len=0 TSval=693932 TSecr=786761
344 1.015295286 172.31.31.144 -> 172.31.23.72 TCP 122 6633 → 40200 [PSH, ACK] Seq=1 Ack=1 Win=853 Len=56 TSval=693933 TSecr=786440
345 1.015340278 172.31.31.144 -> 172.31.23.72 TCP 106 6633 → 40200 [PSH, ACK] Seq=57 Ack=1 Win=853 Len=40 TSval=693933 TSecr=786440
346 1.015484555 172.31.23.72 -> 172.31.31.144 OpenFlow 2010 Type: OFPT_MULTIPART_REPLY, OFPMP_FLOW
347 1.015635136 172.31.23.72 -> 172.31.31.144 OpenFlow 6178 Type: OFPT_MULTIPART_REPLY, OFPMP_TABLE
348 1.015713730 172.31.23.72 -> 172.31.31.144 OpenFlow 530 Type: OFPT_MULTIPART_REPLY, OFPMP_PORT_STATS
349 1.015858940 172.31.31.144 -> 172.31.23.72 TCP 66 6633 → 40200 [ACK] Seq=97 Ack=8057 Win=853 Len=0 TSval=693933 TSecr=786772
350 1.028019621 172.31.31.144 -> 172.31.23.72 TCP 66 6633 → 40198 [ACK] Seq=97 Ack=7385 Win=853 Len=0 TSval=693937 TSecr=786764
351 1.041525455 172.31.31.144 -> 172.31.23.72 OpenFlow 90 Type: OFPT_MULTIPART_REQUEST, OFPMP_PORT_STATS
352 1.041540645 172.31.31.144 -> 172.31.23.72 OpenFlow 82 Type: OFPT_MULTIPART_REQUEST, OFPMP_TABLE
353 1.041549052 172.31.31.144 -> 172.31.23.72 OpenFlow 90 Type: OFPT_MULTIPART_REQUEST, OFPMP_PORT_STATS
354 1.041566956 172.31.31.144 -> 172.31.23.72 OpenFlow 138 Type: OFPT_MULTIPART_REQUEST, OFPMP_TABLE
355 1.041612659 172.31.31.144 -> 172.31.23.72 OpenFlow 122 Type: OFPT_MULTIPART_REQUEST, OFPMP_FLOW
356 1.041616940 172.31.31.144 -> 172.31.23.72 OpenFlow 122 Type: OFPT_MULTIPART_REQUEST, OFPMP_FLOW
357 1.041628805 172.31.31.144 -> 172.31.23.72 OpenFlow 106 Type: OFPT_MULTIPART_REQUEST, OFPMP_TABLE
358 1.041848548 172.31.23.72 -> 172.31.31.144 OpenFlow 6178 Type: OFPT_MULTIPART_REPLY, OFPMP_TABLE
359 1.041960204 172.31.23.72 -> 172.31.31.144 OpenFlow 754 Type: OFPT_MULTIPART_REPLY, OFPMP_PORT_STATS
360 1.042032819 172.31.23.72 -> 172.31.31.144 OpenFlow 2634 Type: OFPT_MULTIPART_REPLY, OFPMP_FLOW
361 1.042096958 172.31.31.144 -> 172.31.23.72 TCP 66 6633 → 40196 [ACK] Seq=313 Ack=6121 Win=853 Len=0 TSval=693940 TSecr=786779
362 1.042130811 172.31.31.144 -> 172.31.23.72 TCP 66 6633 → 40196 [ACK] Seq=313 Ack=6809 Win=853 Len=0 TSval=693940 TSecr=786779
363 1.042146390 172.31.23.72 -> 172.31.31.144 OpenFlow 2634 Type: OFPT_MULTIPART_REPLY, OFPMP_FLOW
364 1.042226638 172.31.23.72 -> 172.31.31.144 OpenFlow 642 Type: OFPT_MULTIPART_REPLY, OFPMP_PORT_STATS
365 1.042243966 172.31.31.144 -> 172.31.23.72 TCP 66 6633 → 40196 [ACK] Seq=313 Ack=9377 Win=853 Len=0 TSval=693940 TSecr=786779
366 1.042370497 172.31.23.72 -> 172.31.31.144 OpenFlow 6178 Type: OFPT_MULTIPART_REPLY, OFPMP_TABLE
367 1.042379265 172.31.31.144 -> 172.31.23.72 TCP 66 6633 → 40202 [ACK] Seq=481 Ack=2745 Win=853 Len=0 TSval=693940 TSecr=786779
368 1.042381205 172.31.31.144 -> 172.31.23.72 TCP 66 6633 → 40202 [ACK] Seq=481 Ack=3321 Win=853 Len=0 TSval=693940 TSecr=786779
369 1.042461797 172.31.23.72 -> 172.31.31.144 OpenFlow 530 Type: OFPT_MULTIPART_REPLY, OFPMP_PORT_STATS
370 1.042520731 172.31.23.72 -> 172.31.31.144 OpenFlow 2010 Type: OFPT_MULTIPART_REPLY, OFPMP_FLOW
371 1.042592756 172.31.31.144 -> 172.31.23.72 TCP 66 6633 → 40202 [ACK] Seq=481 Ack=9433 Win=853 Len=0 TSval=693940 TSecr=786779
372 1.042620072 172.31.31.144 -> 172.31.23.72 TCP 66 6633 → 40206 [ACK] Seq=481 Ack=641 Win=853 Len=0 TSval=693940 TSecr=786779
373 1.042672240 172.31.23.72 -> 172.31.31.144 OpenFlow 6178 Type: OFPT_MULTIPART_REPLY, OFPMP_TABLE
374 1.042755005 172.31.31.144 -> 172.31.23.72 TCP 66 6633 → 40206 [ACK] Seq=481 Ack=2585 Win=853 Len=0 TSval=693940 TSecr=786779
375 1.042873755 172.31.31.144 -> 172.31.23.72 TCP 66 6633 → 40206 [ACK] Seq=481 Ack=8697 Win=853 Len=0 TSval=693940 TSecr=786779
376 1.043733923 172.31.31.144 -> 172.31.23.72 OpenFlow 122 Type: OFPT_MULTIPART_REQUEST, OFPMP_FLOW
377 1.043752797 172.31.31.144 -> 172.31.23.72 OpenFlow 90 Type: OFPT_MULTIPART_REQUEST, OFPMP_PORT_STATS
378 1.043915207 172.31.23.72 -> 172.31.31.144 OpenFlow 2426 Type: OFPT_MULTIPART_REPLY, OFPMP_FLOW
379 1.044003223 172.31.23.72 -> 172.31.31.144 OpenFlow 642 Type: OFPT_MULTIPART_REPLY, OFPMP_PORT_STATS
380 1.044159668 172.31.31.144 -> 172.31.23.72 TCP 66 6633 → 40208 [ACK] Seq=953 Ack=3289 Win=853 Len=0 TSval=693941 TSecr=786779
381 1.044884853 172.31.31.144 -> 172.31.23.72 OpenFlow 82 Type: OFPT_MULTIPART_REQUEST, OFPMP_TABLE
382 1.045147121 172.31.23.72 -> 172.31.31.144 OpenFlow 6178 Type: OFPT_MULTIPART_REPLY, OFPMP_TABLE
383 1.055994044 172.31.31.144 -> 172.31.23.72 TCP 66 6633 → 40200 [ACK] Seq=97 Ack=8521 Win=853 Len=0 TSval=693944 TSecr=786772
384 1.084044919 172.31.31.144 -> 172.31.23.72 TCP 66 6633 → 40208 [ACK] Seq=969 Ack=9401 Win=853 Len=0 TSval=693951 TSecr=786780
385 1.242078731 172.31.23.72 -> 137.158.125.247 SSH 98 Server: Encrypted packet (len=44)
386 1.450030109 137.158.125.247 -> 172.31.23.72 TCP 54 52508 → 22 [ACK] Seq=1 Ack=481 Win=32476 Len=0
387 1.680466848 172.31.31.144 -> 172.31.23.72 TCP 187 6633 → 40146 [PSH, ACK] Seq=1 Ack=1 Win=853 Len=121 TSval=694100 TSecr=786509
388 1.680506712 172.31.31.144 -> 172.31.23.72 TCP 187 6633 → 40146 [PSH, ACK] Seq=122 Ack=1 Win=853 Len=121 TSval=694100 TSecr=786509
389 1.680533713 172.31.31.144 -> 172.31.23.72 TCP 187 6633 → 40146 [PSH, ACK] Seq=243 Ack=1 Win=853 Len=121 TSval=694100 TSecr=786509
390 1.680591369 172.31.31.144 -> 172.31.23.72 TCP 187 6633 → 40146 [PSH, ACK] Seq=364 Ack=1 Win=853 Len=121 TSval=694100 TSecr=786509
391 1.680647923 172.31.31.144 -> 172.31.23.72 TCP 187 6633 → 40146 [PSH, ACK] Seq=485 Ack=1 Win=853 Len=121 TSval=694100 TSecr=786509
392 1.680714693 172.31.31.144 -> 172.31.23.72 TCP 187 6633 → 40146 [PSH, ACK] Seq=606 Ack=1 Win=853 Len=121 TSval=694100 TSecr=786509
393 1.680791687 172.31.31.144 -> 172.31.23.72 TCP 308 6633 → 40146 [PSH, ACK] Seq=727 Ack=1 Win=853 Len=242 TSval=694100 TSecr=786509
394 1.681099459 172.31.23.72 -> 172.31.31.144 TCP 66 40146 → 6633 [ACK] Seq=1 Ack=969 Win=384 Len=0 TSval=786939 TSecr=694100
395 1.681187724 172.31.23.72 -> 172.31.31.144 OpenFlow 189 Type: OFPT_PACKET_IN
396 1.681212605 172.31.23.72 -> 172.31.31.144 OpenFlow 189 Type: OFPT_PACKET_IN
397 1.681258900 172.31.23.72 -> 172.31.31.144 OpenFlow 189 Type: OFPT_PACKET_IN
398 1.681279957 172.31.23.72 -> 172.31.31.144 OpenFlow 189 Type: OFPT_PACKET_IN
399 1.681375305 172.31.23.72 -> 172.31.31.144 OpenFlow 189 Type: OFPT_PACKET_IN
400 1.681383932 172.31.31.144 -> 172.31.23.72 TCP 66 6633 → 40150 [ACK] Seq=385 Ack=300 Win=853 Len=0 TSval=694100 TSecr=786939
401 1.681399459 172.31.23.72 -> 172.31.31.144 OpenFlow 189 Type: OFPT_PACKET_IN
402 1.681421234 172.31.31.144 -> 172.31.23.72 TCP 66 6633 → 40150 [ACK] Seq=385 Ack=423 Win=853 Len=0 TSval=694100 TSecr=786939
403 1.681540869 172.31.31.144 -> 172.31.23.72 TCP 66 6633 → 40214 [ACK] Seq=97 Ack=6980 Win=853 Len=0 TSval=694100 TSecr=786939
404 1.681578116 172.31.31.144 -> 172.31.23.72 TCP 66 6633 → 40214 [ACK] Seq=97 Ack=7103 Win=853 Len=0 TSval=694100 TSecr=786939
405 1.681740107 172.31.31.144 -> 172.31.23.72 TCP 66 6633 → 40194 [ACK] Seq=97 Ack=7935 Win=853 Len=0 TSval=694100 TSecr=786939
406 1.743761178 172.31.23.72 -> 137.158.125.247 SSH 98 Server: Encrypted packet (len=44)
407 1.781269727 172.31.31.144 -> 172.31.23.72 TCP 187 6633 → 40144 [PSH, ACK] Seq=1 Ack=1 Win=853 Len=121 TSval=694125 TSecr=786509
408 1.781320067 172.31.31.144 -> 172.31.23.72 TCP 187 6633 → 40144 [PSH, ACK] Seq=122 Ack=1 Win=853 Len=121 TSval=694125 TSecr=786509
409 1.781326850 172.31.31.144 -> 172.31.23.72 TCP 187 6633 → 40144 [PSH, ACK] Seq=243 Ack=1 Win=853 Len=121 TSval=694125 TSecr=786509
410 1.781350809 172.31.31.144 -> 172.31.23.72 TCP 187 6633 → 40144 [PSH, ACK] Seq=364 Ack=1 Win=853 Len=121 TSval=694125 TSecr=786509
411 1.781405415 172.31.31.144 -> 172.31.23.72 TCP 187 6633 → 40144 [PSH, ACK] Seq=485 Ack=1 Win=853 Len=121 TSval=694125 TSecr=786509
412 1.781426041 172.31.31.144 -> 172.31.23.72 TCP 187 6633 → 40144 [PSH, ACK] Seq=606 Ack=1 Win=853 Len=121 TSval=694125 TSecr=786509
413 1.781522583 172.31.31.144 -> 172.31.23.72 OpenFlow 187 Type: OFPT_PACKET_OUT
414 1.781561926 172.31.31.144 -> 172.31.23.72 OpenFlow 187 Type: OFPT_PACKET_OUT
415 1.781601160 172.31.31.144 -> 172.31.23.72 OpenFlow 187 Type: OFPT_PACKET_OUT
416 1.781649962 172.31.31.144 -> 172.31.23.72 OpenFlow 187 Type: OFPT_PACKET_OUT
417 1.781723837 172.31.31.144 -> 172.31.23.72 OpenFlow 187 Type: OFPT_PACKET_OUT
418 1.781765917 172.31.31.144 -> 172.31.23.72 OpenFlow 187 Type: OFPT_PACKET_OUT
419 1.781852168 172.31.31.144 -> 172.31.23.72 OpenFlow 187 Type: OFPT_PACKET_OUT
420 1.781882604 172.31.23.72 -> 172.31.31.144 TCP 66 40144 → 6633 [ACK] Seq=1 Ack=727 Win=379 Len=0 TSval=786964 TSecr=694125
421 1.781900292 172.31.31.144 -> 172.31.23.72 OpenFlow 187 Type: OFPT_PACKET_OUT
422 1.781964533 172.31.31.144 -> 172.31.23.72 OpenFlow 187 Type: OFPT_PACKET_OUT
423 1.782007646 172.31.31.144 -> 172.31.23.72 OpenFlow 187 Type: OFPT_PACKET_OUT
424 1.782068824 172.31.31.144 -> 172.31.23.72 OpenFlow 187 Type: OFPT_PACKET_OUT
425 1.782110678 172.31.31.144 -> 172.31.23.72 OpenFlow 187 Type: OFPT_PACKET_OUT
426 1.782164683 172.31.31.144 -> 172.31.23.72 OpenFlow 187 Type: OFPT_PACKET_OUT
427 1.782227792 172.31.31.144 -> 172.31.23.72 OpenFlow 187 Type: OFPT_PACKET_OUT
428 1.782280725 172.31.31.144 -> 172.31.23.72 OpenFlow 187 Type: OFPT_PACKET_OUT
429 1.782347077 172.31.31.144 -> 172.31.23.72 OpenFlow 187 Type: OFPT_PACKET_OUT
430 1.782379094 172.31.23.72 -> 172.31.31.144 TCP 66 40152 → 6633 [ACK] Seq=11209 Ack=1785 Win=385 Len=0 TSval=786964 TSecr=694125
431 1.782392905 172.31.31.144 -> 172.31.23.72 OpenFlow 187 Type: OFPT_PACKET_OUT
432 1.782446901 172.31.31.144 -> 172.31.23.72 OpenFlow 187 Type: OFPT_PACKET_OUT
433 1.782470817 172.31.23.72 -> 172.31.31.144 OpenFlow 189 Type: OFPT_PACKET_IN
434 1.782493126 172.31.23.72 -> 172.31.31.144 OpenFlow 189 Type: OFPT_PACKET_IN
435 1.782499430 172.31.23.72 -> 172.31.31.144 OpenFlow 189 Type: OFPT_PACKET_IN
436 1.782513310 172.31.23.72 -> 172.31.31.144 OpenFlow 189 Type: OFPT_PACKET_IN
437 1.782541623 172.31.23.72 -> 172.31.31.144 OpenFlow 189 Type: OFPT_PACKET_IN
438 1.782572378 172.31.23.72 -> 172.31.31.144 OpenFlow 189 Type: OFPT_PACKET_IN
439 1.782574310 172.31.23.72 -> 172.31.31.144 OpenFlow 189 Type: OFPT_PACKET_IN
440 1.782590963 172.31.23.72 -> 172.31.31.144 OpenFlow 189 Type: OFPT_PACKET_IN
441 1.782603808 172.31.23.72 -> 172.31.31.144 OpenFlow 189 Type: OFPT_PACKET_IN
442 1.782628883 172.31.31.144 -> 172.31.23.72 OpenFlow 187 Type: OFPT_PACKET_OUT
443 1.782634539 172.31.31.144 -> 172.31.23.72 OpenFlow 187 Type: OFPT_PACKET_OUT
444 1.782679183 172.31.23.72 -> 172.31.31.144 OpenFlow 189 Type: OFPT_PACKET_IN
445 1.782721083 172.31.23.72 -> 172.31.31.144 OpenFlow 189 Type: OFPT_PACKET_IN
446 1.782723112 172.31.23.72 -> 172.31.31.144 OpenFlow 189 Type: OFPT_PACKET_IN
447 1.782748692 172.31.31.144 -> 172.31.23.72 TCP 66 6633 → 40156 [ACK] Seq=313 Ack=7932 Win=853 Len=0 TSval=694125 TSecr=786964
448 1.782754331 172.31.31.144 -> 172.31.23.72 OpenFlow 187 Type: OFPT_PACKET_OUT
449 1.782756433 172.31.31.144 -> 172.31.23.72 TCP 66 6633 → 40156 [ACK] Seq=313 Ack=8055 Win=853 Len=0 TSval=694125 TSecr=786964
450 1.782758652 172.31.31.144 -> 172.31.23.72 TCP 66 6633 → 40188 [ACK] Seq=529 Ack=8468 Win=853 Len=0 TSval=694125 TSecr=786964
451 1.782793809 172.31.23.72 -> 172.31.31.144 OpenFlow 189 Type: OFPT_PACKET_IN
452 1.782836724 172.31.31.144 -> 172.31.23.72 OpenFlow 187 Type: OFPT_PACKET_OUT
453 1.782841249 172.31.31.144 -> 172.31.23.72 TCP 66 6633 → 40190 [ACK] Seq=97 Ack=8644 Win=853 Len=0 TSval=694125 TSecr=786964
454 1.782844329 172.31.31.144 -> 172.31.23.72 OpenFlow 187 Type: OFPT_PACKET_OUT
455 1.782845664 172.31.31.144 -> 172.31.23.72 TCP 66 6633 → 40198 [ACK] Seq=97 Ack=7508 Win=853 Len=0 TSval=694125 TSecr=786964
456 1.782847731 172.31.31.144 -> 172.31.23.72 TCP 66 6633 → 40190 [ACK] Seq=97 Ack=8767 Win=853 Len=0 TSval=694125 TSecr=786964
457 1.782852153 172.31.31.144 -> 172.31.23.72 TCP 66 6633 → 40188 [ACK] Seq=529 Ack=8591 Win=853 Len=0 TSval=694125 TSecr=786964
458 1.782860000 172.31.23.72 -> 172.31.31.144 OpenFlow 189 Type: OFPT_PACKET_IN
459 1.782865502 172.31.31.144 -> 172.31.23.72 OpenFlow 187 Type: OFPT_PACKET_OUT
460 1.782881883 172.31.31.144 -> 172.31.23.72 TCP 66 6633 → 40212 [ACK] Seq=313 Ack=9692 Win=853 Len=0 TSval=694125 TSecr=786964
461 1.782906666 172.31.31.144 -> 172.31.23.72 TCP 66 6633 → 40198 [ACK] Seq=97 Ack=7631 Win=853 Len=0 TSval=694125 TSecr=786964
462 1.782917596 172.31.31.144 -> 172.31.23.72 OpenFlow 187 Type: OFPT_PACKET_OUT
463 1.782946308 172.31.31.144 -> 172.31.23.72 TCP 66 6633 → 40210 [ACK] Seq=97 Ack=8143 Win=853 Len=0 TSval=694125 TSecr=786964
464 1.783000316 172.31.31.144 -> 172.31.23.72 TCP 66 6633 → 40212 [ACK] Seq=313 Ack=9815 Win=853 Len=0 TSval=694125 TSecr=786964
465 1.783005109 172.31.31.144 -> 172.31.23.72 OpenFlow 187 Type: OFPT_PACKET_OUT
466 1.783094410 172.31.31.144 -> 172.31.23.72 OpenFlow 187 Type: OFPT_PACKET_OUT
467 1.783165174 172.31.31.144 -> 172.31.23.72 OpenFlow 187 Type: OFPT_PACKET_OUT
468 1.783238411 172.31.31.144 -> 172.31.23.72 TCP 66 6633 → 40148 [ACK] Seq=2347 Ack=10967 Win=853 Len=0 TSval=694125 TSecr=786964
469 1.783429515 172.31.23.72 -> 172.31.31.144 OpenFlow 189 Type: OFPT_PACKET_IN
470 1.783441162 172.31.31.144 -> 172.31.23.72 OpenFlow 187 Type: OFPT_PACKET_OUT
471 1.783455031 172.31.23.72 -> 172.31.31.144 OpenFlow 189 Type: OFPT_PACKET_IN
472 1.783470313 172.31.23.72 -> 172.31.31.144 TCP 66 40154 → 6633 [ACK] Seq=521 Ack=2147 Win=383 Len=0 TSval=786964 TSecr=694125
473 1.783526771 172.31.31.144 -> 172.31.23.72 OpenFlow 187 Type: OFPT_PACKET_OUT
474 1.783588092 172.31.31.144 -> 172.31.23.72 TCP 66 6633 → 40152 [ACK] Seq=1785 Ack=11332 Win=853 Len=0 TSval=694125 TSecr=786964
475 1.783604809 172.31.31.144 -> 172.31.23.72 OpenFlow 187 Type: OFPT_PACKET_OUT
476 1.783637250 172.31.31.144 -> 172.31.23.72 TCP 66 6633 → 40152 [ACK] Seq=1785 Ack=11455 Win=853 Len=0 TSval=694125 TSecr=786964
477 1.783653956 172.31.31.144 -> 172.31.23.72 OpenFlow 187 Type: OFPT_PACKET_OUT
478 1.783702822 172.31.31.144 -> 172.31.23.72 OpenFlow 187 Type: OFPT_PACKET_OUT
479 1.783794707 172.31.31.144 -> 172.31.23.72 OpenFlow 187 Type: OFPT_PACKET_OUT
480 1.783866862 172.31.31.144 -> 172.31.23.72 OpenFlow 187 Type: OFPT_PACKET_OUT
481 1.783936352 172.31.31.144 -> 172.31.23.72 OpenFlow 187 Type: OFPT_PACKET_OUT
482 1.783995126 172.31.23.72 -> 172.31.31.144 OpenFlow 189 Type: OFPT_PACKET_IN
483 1.784018091 172.31.23.72 -> 172.31.31.144 OpenFlow 189 Type: OFPT_PACKET_IN
484 1.784027982 172.31.23.72 -> 172.31.31.144 OpenFlow 189 Type: OFPT_PACKET_IN
485 1.784043446 172.31.23.72 -> 172.31.31.144 OpenFlow 189 Type: OFPT_PACKET_IN
486 1.784069454 172.31.23.72 -> 172.31.31.144 OpenFlow 189 Type: OFPT_PACKET_IN
487 1.784071443 172.31.23.72 -> 172.31.31.144 OpenFlow 189 Type: OFPT_PACKET_IN
488 1.784083035 172.31.31.144 -> 172.31.23.72 OpenFlow 187 Type: OFPT_PACKET_OUT
489 1.784094284 172.31.23.72 -> 172.31.31.144 OpenFlow 189 Type: OFPT_PACKET_IN
490 1.784109985 172.31.23.72 -> 172.31.31.144 OpenFlow 189 Type: OFPT_PACKET_IN
491 1.784112354 172.31.23.72 -> 172.31.31.144 OpenFlow 189 Type: OFPT_PACKET_IN
492 1.784139270 172.31.23.72 -> 172.31.31.144 OpenFlow 189 Type: OFPT_PACKET_IN
493 1.784141676 172.31.23.72 -> 172.31.31.144 OpenFlow 189 Type: OFPT_PACKET_IN
494 1.784156991 172.31.23.72 -> 172.31.31.144 OpenFlow 189 Type: OFPT_PACKET_IN
495 1.784186724 172.31.31.144 -> 172.31.23.72 OpenFlow 187 Type: OFPT_PACKET_OUT
496 1.784190366 172.31.31.144 -> 172.31.23.72 TCP 66 6633 → 40188 [ACK] Seq=529 Ack=8714 Win=853 Len=0 TSval=694126 TSecr=786964
497 1.784193682 172.31.31.144 -> 172.31.23.72 TCP 66 6633 → 40188 [ACK] Seq=529 Ack=8837 Win=853 Len=0 TSval=694126 TSecr=786964
498 1.784261292 172.31.23.72 -> 172.31.31.144 OpenFlow 189 Type: OFPT_PACKET_IN
499 1.784267741 172.31.23.72 -> 172.31.31.144 OpenFlow 189 Type: OFPT_PACKET_IN
500 1.784269402 172.31.23.72 -> 172.31.31.144 OpenFlow 189 Type: OFPT_PACKET_IN
501 1.784291345 172.31.23.72 -> 172.31.31.144 OpenFlow 189 Type: OFPT_PACKET_IN
502 1.784293915 172.31.23.72 -> 172.31.31.144 OpenFlow 189 Type: OFPT_PACKET_IN
503 1.784321503 172.31.31.144 -> 172.31.23.72 TCP 66 6633 → 40196 [ACK] Seq=313 Ack=9500 Win=853 Len=0 TSval=694126 TSecr=786964
504 1.784326482 172.31.31.144 -> 172.31.23.72 OpenFlow 187 Type: OFPT_PACKET_OUT
505 1.784330247 172.31.23.72 -> 172.31.31.144 OpenFlow 189 Type: OFPT_PACKET_IN
506 1.784335394 172.31.31.144 -> 172.31.23.72 TCP 66 6633 → 40206 [ACK] Seq=481 Ack=8820 Win=853 Len=0 TSval=694126 TSecr=786964
507 1.784357783 172.31.23.72 -> 172.31.31.144 TCP 66 40150 → 6633 [ACK] Seq=423 Ack=1595 Win=384 Len=0 TSval=786964 TSecr=694125
508 1.784463773 172.31.31.144 -> 172.31.23.72 TCP 66 6633 → 40208 [ACK] Seq=969 Ack=9524 Win=853 Len=0 TSval=694126 TSecr=786964
509 1.784469715 172.31.31.144 -> 172.31.23.72 OpenFlow 187 Type: OFPT_PACKET_OUT
510 1.784472492 172.31.31.144 -> 172.31.23.72 TCP 66 6633 → 40196 [ACK] Seq=313 Ack=9623 Win=853 Len=0 TSval=694126 TSecr=786964
511 1.784474536 172.31.31.144 -> 172.31.23.72 OpenFlow 187 Type: OFPT_PACKET_OUT
512 1.784475987 172.31.31.144 -> 172.31.23.72 TCP 66 6633 → 40212 [ACK] Seq=313 Ack=9938 Win=853 Len=0 TSval=694126 TSecr=786964
513 1.784477706 172.31.31.144 -> 172.31.23.72 TCP 66 6633 → 40192 [ACK] Seq=649 Ack=10055 Win=853 Len=0 TSval=694126 TSecr=786964
514 1.784537590 172.31.31.144 -> 172.31.23.72 TCP 66 6633 → 40216 [ACK] Seq=313 Ack=8460 Win=853 Len=0 TSval=694126 TSecr=786964
515 1.784542730 172.31.31.144 -> 172.31.23.72 TCP 66 6633 → 40206 [ACK] Seq=481 Ack=8943 Win=853 Len=0 TSval=694126 TSecr=786964
516 1.784544903 172.31.31.144 -> 172.31.23.72 OpenFlow 187 Type: OFPT_PACKET_OUT
517 1.784547258 172.31.31.144 -> 172.31.23.72 TCP 66 6633 → 40208 [ACK] Seq=969 Ack=9647 Win=853 Len=0 TSval=694126 TSecr=786964
518 1.784548889 172.31.31.144 -> 172.31.23.72 TCP 66 6633 → 40212 [ACK] Seq=313 Ack=10061 Win=853 Len=0 TSval=694126 TSecr=786964
519 1.784558093 172.31.31.144 -> 172.31.23.72 TCP 66 6633 → 40216 [ACK] Seq=313 Ack=8583 Win=853 Len=0 TSval=694126 TSecr=786964
520 1.784576320 172.31.31.144 -> 172.31.23.72 OpenFlow 187 Type: OFPT_PACKET_OUT
521 1.784622756 172.31.31.144 -> 172.31.23.72 TCP 66 6633 → 40204 [ACK] Seq=265 Ack=8007 Win=853 Len=0 TSval=694126 TSecr=786964
522 1.784716397 172.31.31.144 -> 172.31.23.72 OpenFlow 187 Type: OFPT_PACKET_OUT
523 1.784917048 172.31.31.144 -> 172.31.23.72 OpenFlow 187 Type: OFPT_PACKET_OUT
524 1.784929473 172.31.23.72 -> 172.31.31.144 OpenFlow 189 Type: OFPT_PACKET_IN
525 1.784950281 172.31.23.72 -> 172.31.31.144 OpenFlow 189 Type: OFPT_PACKET_IN
526 1.785026523 172.31.23.72 -> 172.31.31.144 OpenFlow 189 Type: OFPT_PACKET_IN
527 1.785046520 172.31.23.72 -> 172.31.31.144 OpenFlow 189 Type: OFPT_PACKET_IN
528 1.785051057 172.31.23.72 -> 172.31.31.144 OpenFlow 189 Type: OFPT_PACKET_IN
529 1.785091607 172.31.23.72 -> 172.31.31.144 OpenFlow 189 Type: OFPT_PACKET_IN
530 1.785148627 172.31.23.72 -> 172.31.31.144 OpenFlow 189 Type: OFPT_PACKET_IN
531 1.785192163 172.31.31.144 -> 172.31.23.72 TCP 66 6633 → 40214 [ACK] Seq=97 Ack=7226 Win=853 Len=0 TSval=694126 TSecr=786965
532 1.785222278 172.31.31.144 -> 172.31.23.72 TCP 66 6633 → 40214 [ACK] Seq=97 Ack=7349 Win=853 Len=0 TSval=694126 TSecr=786965
533 1.785281304 172.31.31.144 -> 172.31.23.72 TCP 66 6633 → 40216 [ACK] Seq=313 Ack=8706 Win=853 Len=0 TSval=694126 TSecr=786965
534 1.785286293 172.31.31.144 -> 172.31.23.72 OpenFlow 187 Type: OFPT_PACKET_OUT
535 1.785295044 172.31.31.144 -> 172.31.23.72 TCP 66 6633 → 40216 [ACK] Seq=313 Ack=8829 Win=853 Len=0 TSval=694126 TSecr=786965
536 1.785314542 172.31.31.144 -> 172.31.23.72 OpenFlow 187 Type: OFPT_PACKET_OUT
537 1.785342516 172.31.31.144 -> 172.31.23.72 TCP 66 6633 → 40192 [ACK] Seq=649 Ack=10301 Win=853 Len=0 TSval=694126 TSecr=786965
538 1.785362678 172.31.31.144 -> 172.31.23.72 OpenFlow 187 Type: OFPT_PACKET_OUT
539 1.785440792 172.31.31.144 -> 172.31.23.72 OpenFlow 187 Type: OFPT_PACKET_OUT
540 1.785551653 172.31.31.144 -> 172.31.23.72 OpenFlow 187 Type: OFPT_PACKET_OUT
541 1.785575181 172.31.23.72 -> 172.31.31.144 OpenFlow 189 Type: OFPT_PACKET_IN
542 1.785610434 172.31.23.72 -> 172.31.31.144 OpenFlow 189 Type: OFPT_PACKET_IN
543 1.785621772 172.31.23.72 -> 172.31.31.144 OpenFlow 189 Type: OFPT_PACKET_IN
544 1.785644671 172.31.31.144 -> 172.31.23.72 OpenFlow 187 Type: OFPT_PACKET_OUT
545 1.785650015 172.31.23.72 -> 172.31.31.144 OpenFlow 189 Type: OFPT_PACKET_IN
546 1.785657851 172.31.23.72 -> 172.31.31.144 OpenFlow 189 Type: OFPT_PACKET_IN
547 1.785745166 172.31.31.144 -> 172.31.23.72 OpenFlow 187 Type: OFPT_PACKET_OUT
548 1.785753416 172.31.23.72 -> 172.31.31.144 OpenFlow 189 Type: OFPT_PACKET_IN
549 1.785791382 172.31.31.144 -> 172.31.23.72 OpenFlow 187 Type: OFPT_PACKET_OUT
550 1.785797342 172.31.31.144 -> 172.31.23.72 TCP 66 6633 → 40146 [ACK] Seq=969 Ack=124 Win=853 Len=0 TSval=694126 TSecr=786965
551 1.785854322 172.31.31.144 -> 172.31.23.72 OpenFlow 187 Type: OFPT_PACKET_OUT
552 1.785871162 172.31.31.144 -> 172.31.23.72 OpenFlow 187 Type: OFPT_PACKET_OUT
553 1.785889003 172.31.31.144 -> 172.31.23.72 TCP 66 6633 → 40156 [ACK] Seq=1281 Ack=8301 Win=853 Len=0 TSval=694126 TSecr=786965
554 1.785908356 172.31.31.144 -> 172.31.23.72 TCP 66 6633 → 40146 [ACK] Seq=969 Ack=247 Win=853 Len=0 TSval=694126 TSecr=786965
555 1.785926615 172.31.31.144 -> 172.31.23.72 OpenFlow 187 Type: OFPT_PACKET_OUT
556 1.786008623 172.31.31.144 -> 172.31.23.72 OpenFlow 187 Type: OFPT_PACKET_OUT
557 1.786070209 172.31.23.72 -> 172.31.31.144 OpenFlow 189 Type: OFPT_PACKET_IN
558 1.786104535 172.31.23.72 -> 172.31.31.144 OpenFlow 189 Type: OFPT_PACKET_IN
559 1.786139688 172.31.23.72 -> 172.31.31.144 OpenFlow 189 Type: OFPT_PACKET_IN
560 1.786154625 172.31.31.144 -> 172.31.23.72 OpenFlow 187 Type: OFPT_PACKET_OUT
561 1.786165749 172.31.23.72 -> 172.31.31.144 OpenFlow 189 Type: OFPT_PACKET_IN
562 1.786202962 172.31.23.72 -> 172.31.31.144 OpenFlow 189 Type: OFPT_PACKET_IN
563 1.786207682 172.31.23.72 -> 172.31.31.144 OpenFlow 189 Type: OFPT_PACKET_IN
564 1.786223054 172.31.31.144 -> 172.31.23.72 OpenFlow 187 Type: OFPT_PACKET_OUT
565 1.786271769 172.31.31.144 -> 172.31.23.72 TCP 66 6633 → 40154 [ACK] Seq=2147 Ack=767 Win=853 Len=0 TSval=694126 TSecr=786965
566 1.786276129 172.31.31.144 -> 172.31.23.72 TCP 66 6633 → 40188 [ACK] Seq=529 Ack=8960 Win=853 Len=0 TSval=694126 TSecr=786965
567 1.786277991 172.31.31.144 -> 172.31.23.72 TCP 66 6633 → 40188 [ACK] Seq=529 Ack=9083 Win=853 Len=0 TSval=694126 TSecr=786965
568 1.786287852 172.31.31.144 -> 172.31.23.72 OpenFlow 187 Type: OFPT_PACKET_OUT
569 1.786316496 172.31.31.144 -> 172.31.23.72 TCP 66 6633 → 40198 [ACK] Seq=97 Ack=7754 Win=853 Len=0 TSval=694126 TSecr=786965
570 1.786334596 172.31.31.144 -> 172.31.23.72 TCP 66 6633 → 40196 [ACK] Seq=313 Ack=9746 Win=853 Len=0 TSval=694126 TSecr=786965
571 1.786354226 172.31.31.144 -> 172.31.23.72 TCP 66 6633 → 40196 [ACK] Seq=313 Ack=9869 Win=853 Len=0 TSval=694126 TSecr=786965
572 1.786402212 172.31.31.144 -> 172.31.23.72 TCP 66 6633 → 40198 [ACK] Seq=97 Ack=7877 Win=853 Len=0 TSval=694126 TSecr=786965
573 1.786618808 172.31.23.72 -> 172.31.31.144 TCP 66 40140 → 6633 [ACK] Seq=9049 Ack=1065 Win=385 Len=0 TSval=786965 TSecr=694126
574 1.786690616 172.31.23.72 -> 172.31.31.144 OpenFlow 189 Type: OFPT_PACKET_IN
575 1.786712893 172.31.23.72 -> 172.31.31.144 OpenFlow 189 Type: OFPT_PACKET_IN
576 1.786739079 172.31.23.72 -> 172.31.31.144 OpenFlow 189 Type: OFPT_PACKET_IN
577 1.786766892 172.31.23.72 -> 172.31.31.144 OpenFlow 189 Type: OFPT_PACKET_IN
578 1.786811265 172.31.23.72 -> 172.31.31.144 OpenFlow 189 Type: OFPT_PACKET_IN
579 1.786817523 172.31.23.72 -> 172.31.31.144 OpenFlow 189 Type: OFPT_PACKET_IN
580 1.786833117 172.31.23.72 -> 172.31.31.144 OpenFlow 189 Type: OFPT_PACKET_IN
581 1.786876613 172.31.23.72 -> 172.31.31.144 OpenFlow 189 Type: OFPT_PACKET_IN
582 1.786881480 172.31.23.72 -> 172.31.31.144 OpenFlow 189 Type: OFPT_PACKET_IN
583 1.786898486 172.31.31.144 -> 172.31.23.72 TCP 66 6633 → 40142 [ACK] Seq=1759 Ack=9517 Win=853 Len=0 TSval=694126 TSecr=786965
584 1.786903554 172.31.31.144 -> 172.31.23.72 TCP 66 6633 → 40144 [ACK] Seq=727 Ack=124 Win=853 Len=0 TSval=694126 TSecr=786965
585 1.786948711 172.31.31.144 -> 172.31.23.72 TCP 66 6633 → 40144 [ACK] Seq=727 Ack=247 Win=853 Len=0 TSval=694126 TSecr=786965
586 1.786951933 172.31.31.144 -> 172.31.23.72 TCP 66 6633 → 40190 [ACK] Seq=97 Ack=8890 Win=853 Len=0 TSval=694126 TSecr=786965
587 1.786954434 172.31.31.144 -> 172.31.23.72 TCP 66 6633 → 40190 [ACK] Seq=97 Ack=9013 Win=853 Len=0 TSval=694126 TSecr=786965
588 1.786975127 172.31.31.144 -> 172.31.23.72 TCP 66 6633 → 40208 [ACK] Seq=969 Ack=9770 Win=853 Len=0 TSval=694126 TSecr=786965
589 1.786992548 172.31.31.144 -> 172.31.23.72 TCP 66 6633 → 40212 [ACK] Seq=313 Ack=10184 Win=853 Len=0 TSval=694126 TSecr=786965
590 1.787030127 172.31.31.144 -> 172.31.23.72 TCP 66 6633 → 40208 [ACK] Seq=969 Ack=9893 Win=853 Len=0 TSval=694126 TSecr=786965
591 1.787087728 172.31.31.144 -> 172.31.23.72 TCP 66 6633 → 40212 [ACK] Seq=313 Ack=10307 Win=853 Len=0 TSval=694126 TSecr=786965
592 1.824647218 172.31.23.72 -> 172.31.31.144 TCP 66 40156 → 6633 [ACK] Seq=8301 Ack=1281 Win=213 Len=0 TSval=786975 TSecr=694126
593 1.953019248 137.158.125.247 -> 172.31.23.72 TCP 54 52508 → 22 [ACK] Seq=1 Ack=525 Win=32454 Len=0
594 2.249195486 172.31.23.72 -> 137.158.125.247 SSH 98 Server: Encrypted packet (len=44)
595 2.456470215 137.158.125.247 -> 172.31.23.72 TCP 54 52508 → 22 [ACK] Seq=1 Ack=569 Win=32432 Len=0
596 2.480650343 172.31.31.144 -> 172.31.23.72 OpenFlow 90 Type: OFPT_MULTIPART_REQUEST, OFPMP_GROUP
597 2.480666272 172.31.31.144 -> 172.31.23.72 OpenFlow 90 Type: OFPT_MULTIPART_REQUEST, OFPMP_GROUP
598 2.480682932 172.31.31.144 -> 172.31.23.72 OpenFlow 90 Type: OFPT_MULTIPART_REQUEST, OFPMP_GROUP
599 2.480686234 172.31.31.144 -> 172.31.23.72 OpenFlow 106 Type: OFPT_MULTIPART_REQUEST, OFPMP_METER
600 2.480705944 172.31.31.144 -> 172.31.23.72 OpenFlow 106 Type: OFPT_MULTIPART_REQUEST, OFPMP_METER
601 2.480724431 172.31.31.144 -> 172.31.23.72 OpenFlow 82 Type: OFPT_MULTIPART_REQUEST, OFPMP_GROUP_DESC
602 2.480743750 172.31.31.144 -> 172.31.23.72 OpenFlow 90 Type: OFPT_MULTIPART_REQUEST, OFPMP_METER
603 2.480875034 172.31.23.72 -> 172.31.31.144 OpenFlow 82 Type: OFPT_MULTIPART_REPLY, OFPMP_GROUP
604 2.480905809 172.31.23.72 -> 172.31.31.144 OpenFlow 98 Type: OFPT_MULTIPART_REPLY, OFPMP_METER
605 2.480917623 172.31.23.72 -> 172.31.31.144 OpenFlow 82 Type: OFPT_MULTIPART_REPLY, OFPMP_GROUP
606 2.480943996 172.31.23.72 -> 172.31.31.144 OpenFlow 82 Type: OFPT_MULTIPART_REPLY, OFPMP_GROUP
607 2.480975370 172.31.23.72 -> 172.31.31.144 OpenFlow 98 Type: OFPT_MULTIPART_REPLY, OFPMP_METER
608 2.480979805 172.31.23.72 -> 172.31.31.144 OpenFlow 98 Type: OFPT_MULTIPART_REPLY, OFPMP_METER
609 2.481105056 172.31.31.144 -> 172.31.23.72 TCP 66 6633 → 40144 [ACK] Seq=791 Ack=263 Win=853 Len=0 TSval=694300 TSecr=787139
610 2.481122033 172.31.31.144 -> 172.31.23.72 TCP 66 6633 → 40144 [ACK] Seq=791 Ack=295 Win=853 Len=0 TSval=694300 TSecr=787139
611 2.481140581 172.31.31.144 -> 172.31.23.72 TCP 66 6633 → 40146 [ACK] Seq=1033 Ack=263 Win=853 Len=0 TSval=694300 TSecr=787139
612 2.481159337 172.31.31.144 -> 172.31.23.72 TCP 66 6633 → 40146 [ACK] Seq=1033 Ack=295 Win=853 Len=0 TSval=694300 TSecr=787139
613 2.481184445 172.31.31.144 -> 172.31.23.72 TCP 66 6633 → 40150 [ACK] Seq=1659 Ack=439 Win=853 Len=0 TSval=694300 TSecr=787139
614 2.481199492 172.31.31.144 -> 172.31.23.72 TCP 66 6633 → 40150 [ACK] Seq=1659 Ack=471 Win=853 Len=0 TSval=694300 TSecr=787139
615 2.580888236 172.31.31.144 -> 172.31.23.72 OpenFlow 90 Type: OFPT_MULTIPART_REQUEST, OFPMP_GROUP
616 2.580913604 172.31.31.144 -> 172.31.23.72 OpenFlow 90 Type: OFPT_MULTIPART_REQUEST, OFPMP_GROUP
617 2.580932137 172.31.31.144 -> 172.31.23.72 OpenFlow 90 Type: OFPT_MULTIPART_REQUEST, OFPMP_GROUP
618 2.580936098 172.31.31.144 -> 172.31.23.72 OpenFlow 90 Type: OFPT_MULTIPART_REQUEST, OFPMP_GROUP
619 2.580961630 172.31.31.144 -> 172.31.23.72 OpenFlow 90 Type: OFPT_MULTIPART_REQUEST, OFPMP_GROUP
620 2.580972491 172.31.23.72 -> 172.31.31.144 TCP 66 40156 → 6633 [ACK] Seq=8301 Ack=1305 Win=213 Len=0 TSval=787164 TSecr=694325
621 2.580979194 172.31.31.144 -> 172.31.23.72 OpenFlow 106 Type: OFPT_MULTIPART_REQUEST, OFPMP_METER
622 2.580992311 172.31.31.144 -> 172.31.23.72 OpenFlow 106 Type: OFPT_MULTIPART_REQUEST, OFPMP_METER
623 2.581023782 172.31.31.144 -> 172.31.23.72 OpenFlow 106 Type: OFPT_MULTIPART_REQUEST, OFPMP_METER
624 2.581027098 172.31.31.144 -> 172.31.23.72 OpenFlow 90 Type: OFPT_MULTIPART_REQUEST, OFPMP_GROUP
625 2.581051199 172.31.31.144 -> 172.31.23.72 OpenFlow 106 Type: OFPT_MULTIPART_REQUEST, OFPMP_METER
626 2.581070305 172.31.31.144 -> 172.31.23.72 OpenFlow 106 Type: OFPT_MULTIPART_REQUEST, OFPMP_METER
627 2.581073818 172.31.23.72 -> 172.31.31.144 TCP 66 40156 → 6633 [ACK] Seq=8301 Ack=1345 Win=213 Len=0 TSval=787164 TSecr=694325
628 2.581093013 172.31.31.144 -> 172.31.23.72 OpenFlow 106 Type: OFPT_MULTIPART_REQUEST, OFPMP_METER
629 2.581161373 172.31.31.144 -> 172.31.23.72 OpenFlow 187 Type: OFPT_PACKET_OUT
630 2.581165901 172.31.31.144 -> 172.31.23.72 OpenFlow 187 Type: OFPT_PACKET_OUT
631 2.581169613 172.31.23.72 -> 172.31.31.144 OpenFlow 82 Type: OFPT_MULTIPART_REPLY, OFPMP_GROUP
632 2.581191036 172.31.23.72 -> 172.31.31.144 OpenFlow 82 Type: OFPT_MULTIPART_REPLY, OFPMP_GROUP_DESC
633 2.581222690 172.31.23.72 -> 172.31.31.144 OpenFlow 82 Type: OFPT_MULTIPART_REPLY, OFPMP_GROUP
634 2.581256085 172.31.23.72 -> 172.31.31.144 OpenFlow 82 Type: OFPT_MULTIPART_REPLY, OFPMP_GROUP
635 2.581258798 172.31.23.72 -> 172.31.31.144 OpenFlow 82 Type: OFPT_MULTIPART_REPLY, OFPMP_METER
636 2.581268724 172.31.31.144 -> 172.31.23.72 OpenFlow 187 Type: OFPT_PACKET_OUT
637 2.581296609 172.31.23.72 -> 172.31.31.144 OpenFlow 98 Type: OFPT_MULTIPART_REPLY, OFPMP_METER
638 2.581304304 172.31.23.72 -> 172.31.31.144 OpenFlow 98 Type: OFPT_MULTIPART_REPLY, OFPMP_METER
639 2.581308529 172.31.23.72 -> 172.31.31.144 OpenFlow 82 Type: OFPT_MULTIPART_REPLY, OFPMP_GROUP
640 2.581327598 172.31.23.72 -> 172.31.31.144 OpenFlow 82 Type: OFPT_MULTIPART_REPLY, OFPMP_GROUP
641 2.581346226 172.31.23.72 -> 172.31.31.144 OpenFlow 82 Type: OFPT_MULTIPART_REPLY, OFPMP_GROUP
642 2.581368492 172.31.31.144 -> 172.31.23.72 OpenFlow 187 Type: OFPT_PACKET_OUT
643 2.581371776 172.31.31.144 -> 172.31.23.72 TCP 66 6633 → 40140 [ACK] Seq=1129 Ack=9065 Win=853 Len=0 TSval=694325 TSecr=787164
644 2.581376389 172.31.31.144 -> 172.31.23.72 OpenFlow 187 Type: OFPT_PACKET_OUT
645 2.581418927 172.31.23.72 -> 172.31.31.144 OpenFlow 98 Type: OFPT_MULTIPART_REPLY, OFPMP_METER
646 2.581463330 172.31.23.72 -> 172.31.31.144 OpenFlow 98 Type: OFPT_MULTIPART_REPLY, OFPMP_METER
647 2.581465888 172.31.23.72 -> 172.31.31.144 OpenFlow 98 Type: OFPT_MULTIPART_REPLY, OFPMP_METER
648 2.581489058 172.31.31.144 -> 172.31.23.72 TCP 66 6633 → 40140 [ACK] Seq=1129 Ack=9081 Win=853 Len=0 TSval=694325 TSecr=787164
649 2.581494005 172.31.31.144 -> 172.31.23.72 OpenFlow 187 Type: OFPT_PACKET_OUT
650 2.581496453 172.31.31.144 -> 172.31.23.72 TCP 66 6633 → 40140 [ACK] Seq=1129 Ack=9097 Win=853 Len=0 TSval=694325 TSecr=787164
651 2.581498415 172.31.31.144 -> 172.31.23.72 OpenFlow 187 Type: OFPT_PACKET_OUT
652 2.581583800 172.31.31.144 -> 172.31.23.72 TCP 66 6633 → 40142 [ACK] Seq=1823 Ack=9565 Win=853 Len=0 TSval=694325 TSecr=787164
653 2.581590043 172.31.31.144 -> 172.31.23.72 TCP 66 6633 → 40152 [ACK] Seq=1849 Ack=11471 Win=853 Len=0 TSval=694325 TSecr=787164
654 2.581594347 172.31.31.144 -> 172.31.23.72 OpenFlow 187 Type: OFPT_PACKET_OUT
655 2.581616903 172.31.31.144 -> 172.31.23.72 TCP 66 6633 → 40148 [ACK] Seq=2411 Ack=11015 Win=853 Len=0 TSval=694325 TSecr=787164
656 2.581635008 172.31.31.144 -> 172.31.23.72 OpenFlow 187 Type: OFPT_PACKET_OUT
657 2.581658391 172.31.31.144 -> 172.31.23.72 TCP 66 6633 → 40152 [ACK] Seq=1849 Ack=11503 Win=853 Len=0 TSval=694325 TSecr=787164
658 2.581723302 172.31.31.144 -> 172.31.23.72 OpenFlow 187 Type: OFPT_PACKET_OUT
659 2.581727681 172.31.31.144 -> 172.31.23.72 TCP 66 6633 → 40154 [ACK] Seq=2211 Ack=815 Win=853 Len=0 TSval=694325 TSecr=787164
660 2.581732840 172.31.31.144 -> 172.31.23.72 TCP 66 6633 → 40156 [ACK] Seq=1345 Ack=8349 Win=853 Len=0 TSval=694325 TSecr=787164
661 2.581954554 172.31.23.72 -> 172.31.31.144 TCP 66 40188 → 6633 [ACK] Seq=9083 Ack=1739 Win=213 Len=0 TSval=787164 TSecr=694325
662 2.582054281 172.31.23.72 -> 172.31.31.144 OpenFlow 189 Type: OFPT_PACKET_IN
663 2.582101201 172.31.23.72 -> 172.31.31.144 OpenFlow 189 Type: OFPT_PACKET_IN
664 2.582137572 172.31.23.72 -> 172.31.31.144 OpenFlow 189 Type: OFPT_PACKET_IN
665 2.582158460 172.31.23.72 -> 172.31.31.144 OpenFlow 189 Type: OFPT_PACKET_IN
666 2.582245747 172.31.31.144 -> 172.31.23.72 TCP 66 6633 → 40198 [ACK] Seq=97 Ack=8000 Win=853 Len=0 TSval=694325 TSecr=787164
667 2.582264698 172.31.23.72 -> 172.31.31.144 OpenFlow 189 Type: OFPT_PACKET_IN
668 2.582293004 172.31.31.144 -> 172.31.23.72 TCP 66 6633 → 40198 [ACK] Seq=97 Ack=8123 Win=853 Len=0 TSval=694325 TSecr=787164
669 2.582296369 172.31.31.144 -> 172.31.23.72 TCP 66 6633 → 40216 [ACK] Seq=313 Ack=8952 Win=853 Len=0 TSval=694325 TSecr=787164
670 2.582301443 172.31.23.72 -> 172.31.31.144 OpenFlow 189 Type: OFPT_PACKET_IN
671 2.582318922 172.31.31.144 -> 172.31.23.72 TCP 66 6633 → 40216 [ACK] Seq=313 Ack=9075 Win=853 Len=0 TSval=694325 TSecr=787164
672 2.582323398 172.31.23.72 -> 172.31.31.144 OpenFlow 189 Type: OFPT_PACKET_IN
673 2.582343432 172.31.23.72 -> 172.31.31.144 OpenFlow 189 Type: OFPT_PACKET_IN
674 2.582354769 172.31.23.72 -> 172.31.31.144 OpenFlow 189 Type: OFPT_PACKET_IN
675 2.582386988 172.31.23.72 -> 172.31.31.144 OpenFlow 189 Type: OFPT_PACKET_IN
676 2.582475907 172.31.31.144 -> 172.31.23.72 TCP 66 6633 → 40142 [ACK] Seq=1823 Ack=9811 Win=853 Len=0 TSval=694325 TSecr=787164
677 2.582520248 172.31.31.144 -> 172.31.23.72 TCP 66 6633 → 40148 [ACK] Seq=2411 Ack=11261 Win=853 Len=0 TSval=694325 TSecr=787164
678 2.582548836 172.31.31.144 -> 172.31.23.72 TCP 66 6633 → 40152 [ACK] Seq=1849 Ack=11626 Win=853 Len=0 TSval=694325 TSecr=787164
679 2.582589024 172.31.31.144 -> 172.31.23.72 TCP 66 6633 → 40152 [ACK] Seq=1849 Ack=11749 Win=853 Len=0 TSval=694325 TSecr=787164
680 2.751529032 172.31.23.72 -> 137.158.125.247 SSH 98 Server: Encrypted packet (len=44)
