  1 0.000000000 172.31.31.144 -> 172.31.23.72 TCP 187 6633 → 51158 [PSH, ACK] Seq=1 Ack=1 Win=853 Len=121 TSval=5385710 TSecr=23955782
  2 0.000043425 172.31.31.144 -> 172.31.23.72 TCP 187 6633 → 51158 [PSH, ACK] Seq=122 Ack=1 Win=853 Len=121 TSval=5385710 TSecr=23955782
  3 0.000048750 172.31.31.144 -> 172.31.23.72 TCP 187 6633 → 51158 [PSH, ACK] Seq=243 Ack=1 Win=853 Len=121 TSval=5385710 TSecr=23955782
  4 0.000070934 172.31.31.144 -> 172.31.23.72 TCP 187 6633 → 51158 [PSH, ACK] Seq=364 Ack=1 Win=853 Len=121 TSval=5385710 TSecr=23955782
  5 0.000125851 172.31.31.144 -> 172.31.23.72 TCP 187 6633 → 51158 [PSH, ACK] Seq=485 Ack=1 Win=853 Len=121 TSval=5385710 TSecr=23955782
  6 0.000185799 172.31.31.144 -> 172.31.23.72 TCP 187 6633 → 51158 [PSH, ACK] Seq=606 Ack=1 Win=853 Len=121 TSval=5385710 TSecr=23955782
  7 0.000246120 172.31.31.144 -> 172.31.23.72 TCP 187 6633 → 51158 [PSH, ACK] Seq=727 Ack=1 Win=853 Len=121 TSval=5385710 TSecr=23955782
  8 0.000294898 172.31.31.144 -> 172.31.23.72 TCP 187 6633 → 51158 [PSH, ACK] Seq=848 Ack=1 Win=853 Len=121 TSval=5385710 TSecr=23955782
  9 0.000358100 172.31.31.144 -> 172.31.23.72 TCP 187 6633 → 51158 [PSH, ACK] Seq=969 Ack=1 Win=853 Len=121 TSval=5385710 TSecr=23955782
 10 0.000397952 172.31.31.144 -> 172.31.23.72 TCP 187 6633 → 51158 [PSH, ACK] Seq=1090 Ack=1 Win=853 Len=121 TSval=5385710 TSecr=23955782
 11 0.000513197 172.31.31.144 -> 172.31.23.72 TCP 187 6633 → 51160 [PSH, ACK] Seq=1 Ack=1 Win=853 Len=121 TSval=5385711 TSecr=23955735
 12 0.000530324 172.31.31.144 -> 172.31.23.72 TCP 187 6633 → 51160 [PSH, ACK] Seq=122 Ack=1 Win=853 Len=121 TSval=5385711 TSecr=23955735
 13 0.000635795 172.31.31.144 -> 172.31.23.72 TCP 187 6633 → 51160 [PSH, ACK] Seq=243 Ack=1 Win=853 Len=121 TSval=5385711 TSecr=23955735
 14 0.000640379 172.31.31.144 -> 172.31.23.72 TCP 187 6633 → 51160 [PSH, ACK] Seq=364 Ack=1 Win=853 Len=121 TSval=5385711 TSecr=23955735
 15 0.000697260 172.31.31.144 -> 172.31.23.72 TCP 187 6633 → 51160 [PSH, ACK] Seq=485 Ack=1 Win=853 Len=121 TSval=5385711 TSecr=23955735
 16 0.000757431 172.31.31.144 -> 172.31.23.72 TCP 187 6633 → 51160 [PSH, ACK] Seq=606 Ack=1 Win=853 Len=121 TSval=5385711 TSecr=23955735
 17 0.000859795 172.31.23.72 -> 172.31.31.144 TCP 66 51158 → 6633 [ACK] Seq=1 Ack=1211 Win=213 Len=0 TSval=23955836 TSecr=5385710
 18 0.000872490 172.31.31.144 -> 172.31.23.72 TCP 187 6633 → 51162 [PSH, ACK] Seq=1 Ack=1 Win=853 Len=121 TSval=5385711 TSecr=23955734
 19 0.000890252 172.31.31.144 -> 172.31.23.72 TCP 187 6633 → 51162 [PSH, ACK] Seq=122 Ack=1 Win=853 Len=121 TSval=5385711 TSecr=23955734
 20 0.000935362 172.31.31.144 -> 172.31.23.72 TCP 187 6633 → 51162 [PSH, ACK] Seq=243 Ack=1 Win=853 Len=121 TSval=5385711 TSecr=23955734
 21 0.000968260 172.31.31.144 -> 172.31.23.72 TCP 187 6633 → 51162 [PSH, ACK] Seq=364 Ack=1 Win=853 Len=121 TSval=5385711 TSecr=23955734
 22 0.000986835 172.31.23.72 -> 172.31.31.144 OpenFlow 189 Type: OFPT_PACKET_IN
 23 0.001013133 172.31.23.72 -> 172.31.31.144 OpenFlow 189 Type: OFPT_PACKET_IN
 24 0.001022139 172.31.23.72 -> 172.31.31.144 OpenFlow 189 Type: OFPT_PACKET_IN
 25 0.001049397 172.31.31.144 -> 172.31.23.72 TCP 187 6633 → 51162 [PSH, ACK] Seq=485 Ack=1 Win=853 Len=121 TSval=5385711 TSecr=23955734
 26 0.001058454 172.31.23.72 -> 172.31.31.144 OpenFlow 189 Type: OFPT_PACKET_IN
 27 0.001119559 172.31.31.144 -> 172.31.23.72 TCP 187 6633 → 51162 [PSH, ACK] Seq=606 Ack=1 Win=853 Len=121 TSval=5385711 TSecr=23955734
 28 0.001129860 172.31.23.72 -> 172.31.31.144 OpenFlow 189 Type: OFPT_PACKET_IN
 29 0.001136120 172.31.23.72 -> 172.31.31.144 OpenFlow 189 Type: OFPT_PACKET_IN
 30 0.001227644 172.31.31.144 -> 172.31.23.72 TCP 66 6633 → 51170 [ACK] Seq=1 Ack=124 Win=853 Len=0 TSval=5385711 TSecr=23955836
 31 0.001234594 172.31.31.144 -> 172.31.23.72 TCP 66 6633 → 51170 [ACK] Seq=1 Ack=247 Win=853 Len=0 TSval=5385711 TSecr=23955836
 32 0.001237115 172.31.31.144 -> 172.31.23.72 TCP 187 6633 → 51164 [PSH, ACK] Seq=1 Ack=1 Win=853 Len=121 TSval=5385711 TSecr=23955782
 33 0.001299419 172.31.31.144 -> 172.31.23.72 TCP 66 6633 → 51168 [ACK] Seq=1 Ack=124 Win=853 Len=0 TSval=5385711 TSecr=23955836
 34 0.001305148 172.31.31.144 -> 172.31.23.72 TCP 187 6633 → 51164 [PSH, ACK] Seq=122 Ack=1 Win=853 Len=121 TSval=5385711 TSecr=23955782
 35 0.001307351 172.31.31.144 -> 172.31.23.72 TCP 66 6633 → 51160 [ACK] Seq=727 Ack=124 Win=853 Len=0 TSval=5385711 TSecr=23955836
 36 0.001316259 172.31.31.144 -> 172.31.23.72 TCP 308 6633 → 51164 [PSH, ACK] Seq=243 Ack=1 Win=853 Len=242 TSval=5385711 TSecr=23955782
 37 0.001336040 172.31.31.144 -> 172.31.23.72 TCP 187 6633 → 51164 [PSH, ACK] Seq=485 Ack=1 Win=853 Len=121 TSval=5385711 TSecr=23955782
 38 0.001355910 172.31.31.144 -> 172.31.23.72 TCP 66 6633 → 51160 [ACK] Seq=727 Ack=247 Win=853 Len=0 TSval=5385711 TSecr=23955836
 39 0.001405230 172.31.31.144 -> 172.31.23.72 TCP 66 6633 → 51168 [ACK] Seq=1 Ack=247 Win=853 Len=0 TSval=5385711 TSecr=23955836
 40 0.001437520 172.31.31.144 -> 172.31.23.72 TCP 187 6633 → 51164 [PSH, ACK] Seq=606 Ack=1 Win=853 Len=121 TSval=5385711 TSecr=23955782
 41 0.001456147 172.31.31.144 -> 172.31.23.72 TCP 187 6633 → 51164 [PSH, ACK] Seq=727 Ack=1 Win=853 Len=121 TSval=5385711 TSecr=23955782
 42 0.001517041 172.31.31.144 -> 172.31.23.72 TCP 187 6633 → 51164 [PSH, ACK] Seq=848 Ack=1 Win=853 Len=121 TSval=5385711 TSecr=23955782
 43 0.001777957 172.31.23.72 -> 172.31.31.144 TCP 66 51164 → 6633 [ACK] Seq=1 Ack=969 Win=213 Len=0 TSval=23955836 TSecr=5385711
 44 0.001854323 172.31.23.72 -> 172.31.31.144 OpenFlow 189 Type: OFPT_PACKET_IN
 45 0.001880480 172.31.23.72 -> 172.31.31.144 OpenFlow 189 Type: OFPT_PACKET_IN
 46 0.001906972 172.31.23.72 -> 172.31.31.144 OpenFlow 189 Type: OFPT_PACKET_IN
 47 0.001927663 172.31.23.72 -> 172.31.31.144 OpenFlow 189 Type: OFPT_PACKET_IN
 48 0.001940345 172.31.23.72 -> 172.31.31.144 OpenFlow 189 Type: OFPT_PACKET_IN
 49 0.001946612 172.31.23.72 -> 172.31.31.144 OpenFlow 189 Type: OFPT_PACKET_IN
 50 0.002024419 172.31.23.72 -> 172.31.31.144 OpenFlow 189 Type: OFPT_PACKET_IN
 51 0.002030411 172.31.23.72 -> 172.31.31.144 OpenFlow 189 Type: OFPT_PACKET_IN
 52 0.002074770 172.31.31.144 -> 172.31.23.72 TCP 66 6633 → 51152 [ACK] Seq=1 Ack=247 Win=853 Len=0 TSval=5385711 TSecr=23955836
 53 0.002144191 172.31.31.144 -> 172.31.23.72 TCP 66 6633 → 51156 [ACK] Seq=1 Ack=124 Win=853 Len=0 TSval=5385711 TSecr=23955836
 54 0.002149821 172.31.31.144 -> 172.31.23.72 TCP 66 6633 → 51162 [ACK] Seq=727 Ack=124 Win=853 Len=0 TSval=5385711 TSecr=23955836
 55 0.002167711 172.31.31.144 -> 172.31.23.72 TCP 66 6633 → 51156 [ACK] Seq=1 Ack=247 Win=853 Len=0 TSval=5385711 TSecr=23955836
 56 0.002234387 172.31.31.144 -> 172.31.23.72 TCP 66 6633 → 51162 [ACK] Seq=727 Ack=247 Win=853 Len=0 TSval=5385711 TSecr=23955837
 57 0.002263524 172.31.23.72 -> 172.31.31.144 OpenFlow 189 Type: OFPT_PACKET_IN
 58 0.002287223 172.31.23.72 -> 172.31.31.144 OpenFlow 189 Type: OFPT_PACKET_IN
 59 0.002297235 172.31.23.72 -> 172.31.31.144 OpenFlow 189 Type: OFPT_PACKET_IN
 60 0.002321972 172.31.23.72 -> 172.31.31.144 OpenFlow 189 Type: OFPT_PACKET_IN
 61 0.002343398 172.31.23.72 -> 172.31.31.144 OpenFlow 189 Type: OFPT_PACKET_IN
 62 0.002386403 172.31.31.144 -> 172.31.23.72 TCP 66 6633 → 51150 [ACK] Seq=1 Ack=247 Win=853 Len=0 TSval=5385711 TSecr=23955836
 63 0.002394034 172.31.23.72 -> 172.31.31.144 OpenFlow 189 Type: OFPT_PACKET_IN
 64 0.002400001 172.31.23.72 -> 172.31.31.144 OpenFlow 189 Type: OFPT_PACKET_IN
 65 0.002455748 172.31.31.144 -> 172.31.23.72 TCP 66 6633 → 51158 [ACK] Seq=1211 Ack=124 Win=853 Len=0 TSval=5385711 TSecr=23955837
 66 0.002459697 172.31.31.144 -> 172.31.23.72 TCP 66 6633 → 51158 [ACK] Seq=1211 Ack=247 Win=853 Len=0 TSval=5385711 TSecr=23955837
 67 0.002463913 172.31.23.72 -> 172.31.31.144 OpenFlow 189 Type: OFPT_PACKET_IN
 68 0.002469266 172.31.23.72 -> 172.31.31.144 OpenFlow 189 Type: OFPT_PACKET_IN
 69 0.002498466 172.31.23.72 -> 172.31.31.144 OpenFlow 189 Type: OFPT_PACKET_IN
 70 0.002518860 172.31.31.144 -> 172.31.23.72 TCP 66 6633 → 51172 [ACK] Seq=1 Ack=124 Win=853 Len=0 TSval=5385711 TSecr=23955837
 71 0.002557102 172.31.23.72 -> 172.31.31.144 OpenFlow 189 Type: OFPT_PACKET_IN
 72 0.002620209 172.31.31.144 -> 172.31.23.72 TCP 66 6633 → 51166 [ACK] Seq=1 Ack=124 Win=853 Len=0 TSval=5385711 TSecr=23955837
 73 0.002624439 172.31.31.144 -> 172.31.23.72 TCP 66 6633 → 51172 [ACK] Seq=1 Ack=247 Win=853 Len=0 TSval=5385711 TSecr=23955837
 74 0.002628767 172.31.23.72 -> 172.31.31.144 OpenFlow 189 Type: OFPT_PACKET_IN
 75 0.002653607 172.31.31.144 -> 172.31.23.72 TCP 66 6633 → 51166 [ACK] Seq=1 Ack=247 Win=853 Len=0 TSval=5385711 TSecr=23955837
 76 0.002696550 172.31.31.144 -> 172.31.23.72 TCP 66 6633 → 51164 [ACK] Seq=969 Ack=124 Win=853 Len=0 TSval=5385711 TSecr=23955837
 77 0.002759692 172.31.31.144 -> 172.31.23.72 TCP 66 6633 → 51164 [ACK] Seq=969 Ack=247 Win=853 Len=0 TSval=5385711 TSecr=23955837
 78 0.003049818 172.31.31.144 -> 172.31.23.72 TCP 66 6633 → 51154 [ACK] Seq=1 Ack=247 Win=853 Len=0 TSval=5385711 TSecr=23955837
 79 0.003154890 172.31.31.144 -> 172.31.23.72 TCP 66 6633 → 51146 [ACK] Seq=1 Ack=247 Win=853 Len=0 TSval=5385711 TSecr=23955837
 80 0.083987989 172.31.31.144 -> 172.31.23.72 OpenFlow 187 Type: OFPT_PACKET_OUT
 81 0.084013036 172.31.31.144 -> 172.31.23.72 OpenFlow 187 Type: OFPT_PACKET_OUT
 82 0.084018342 172.31.31.144 -> 172.31.23.72 OpenFlow 187 Type: OFPT_PACKET_OUT
 83 0.084069145 172.31.31.144 -> 172.31.23.72 OpenFlow 187 Type: OFPT_PACKET_OUT
 84 0.084117109 172.31.31.144 -> 172.31.23.72 OpenFlow 187 Type: OFPT_PACKET_OUT
 85 0.084172016 172.31.31.144 -> 172.31.23.72 OpenFlow 187 Type: OFPT_PACKET_OUT
 86 0.084226071 172.31.31.144 -> 172.31.23.72 OpenFlow 187 Type: OFPT_PACKET_OUT
 87 0.084277918 172.31.31.144 -> 172.31.23.72 OpenFlow 187 Type: OFPT_PACKET_OUT
 88 0.084483962 172.31.23.72 -> 172.31.31.144 TCP 66 51166 → 6633 [ACK] Seq=247 Ack=969 Win=213 Len=0 TSval=23955857 TSecr=5385731
 89 0.084639076 172.31.23.72 -> 172.31.31.144 OpenFlow 189 Type: OFPT_PACKET_IN
 90 0.084665577 172.31.23.72 -> 172.31.31.144 OpenFlow 189 Type: OFPT_PACKET_IN
 91 0.084705349 172.31.23.72 -> 172.31.31.144 OpenFlow 189 Type: OFPT_PACKET_IN
 92 0.084726420 172.31.23.72 -> 172.31.31.144 OpenFlow 189 Type: OFPT_PACKET_IN
 93 0.084770061 172.31.23.72 -> 172.31.31.144 OpenFlow 189 Type: OFPT_PACKET_IN
 94 0.084790289 172.31.23.72 -> 172.31.31.144 OpenFlow 189 Type: OFPT_PACKET_IN
 95 0.084821786 172.31.31.144 -> 172.31.23.72 TCP 66 6633 → 51164 [ACK] Seq=969 Ack=370 Win=853 Len=0 TSval=5385732 TSecr=23955857
 96 0.084828346 172.31.31.144 -> 172.31.23.72 TCP 66 6633 → 51164 [ACK] Seq=969 Ack=493 Win=853 Len=0 TSval=5385732 TSecr=23955857
 97 0.084844065 172.31.31.144 -> 172.31.23.72 TCP 66 6633 → 51156 [ACK] Seq=1 Ack=370 Win=853 Len=0 TSval=5385732 TSecr=23955857
 98 0.084856223 172.31.31.144 -> 172.31.23.72 TCP 66 6633 → 51156 [ACK] Seq=1 Ack=493 Win=853 Len=0 TSval=5385732 TSecr=23955857
 99 0.084916072 172.31.31.144 -> 172.31.23.72 TCP 66 6633 → 51168 [ACK] Seq=1 Ack=370 Win=853 Len=0 TSval=5385732 TSecr=23955857
100 0.084932640 172.31.31.144 -> 172.31.23.72 TCP 66 6633 → 51168 [ACK] Seq=1 Ack=493 Win=853 Len=0 TSval=5385732 TSecr=23955857
101 0.184801701 172.31.31.144 -> 172.31.23.72 OpenFlow 187 Type: OFPT_PACKET_OUT
102 0.184839655 172.31.31.144 -> 172.31.23.72 OpenFlow 187 Type: OFPT_PACKET_OUT
103 0.184880579 172.31.31.144 -> 172.31.23.72 OpenFlow 187 Type: OFPT_PACKET_OUT
104 0.184957062 172.31.31.144 -> 172.31.23.72 OpenFlow 187 Type: OFPT_PACKET_OUT
105 0.185046943 172.31.31.144 -> 172.31.23.72 OpenFlow 187 Type: OFPT_PACKET_OUT
106 0.185112184 172.31.31.144 -> 172.31.23.72 OpenFlow 187 Type: OFPT_PACKET_OUT
107 0.185165801 172.31.31.144 -> 172.31.23.72 OpenFlow 187 Type: OFPT_PACKET_OUT
108 0.185234800 172.31.31.144 -> 172.31.23.72 OpenFlow 187 Type: OFPT_PACKET_OUT
109 0.185367934 172.31.31.144 -> 172.31.23.72 OpenFlow 187 Type: OFPT_PACKET_OUT
110 0.185393339 172.31.23.72 -> 172.31.31.144 TCP 66 51168 → 6633 [ACK] Seq=493 Ack=969 Win=311 Len=0 TSval=23955882 TSecr=5385757
111 0.185412678 172.31.31.144 -> 172.31.23.72 OpenFlow 187 Type: OFPT_PACKET_OUT
112 0.185462310 172.31.31.144 -> 172.31.23.72 OpenFlow 187 Type: OFPT_PACKET_OUT
113 0.185492849 172.31.23.72 -> 172.31.31.144 OpenFlow 189 Type: OFPT_PACKET_IN
114 0.185518275 172.31.31.144 -> 172.31.23.72 OpenFlow 187 Type: OFPT_PACKET_OUT
115 0.185526862 172.31.23.72 -> 172.31.31.144 OpenFlow 189 Type: OFPT_PACKET_IN
116 0.185563166 172.31.31.144 -> 172.31.23.72 OpenFlow 187 Type: OFPT_PACKET_OUT
117 0.185630457 172.31.31.144 -> 172.31.23.72 OpenFlow 187 Type: OFPT_PACKET_OUT
118 0.185670091 172.31.23.72 -> 172.31.31.144 OpenFlow 189 Type: OFPT_PACKET_IN
119 0.185679883 172.31.31.144 -> 172.31.23.72 OpenFlow 187 Type: OFPT_PACKET_OUT
120 0.185697439 172.31.23.72 -> 172.31.31.144 OpenFlow 189 Type: OFPT_PACKET_IN
121 0.185738243 172.31.23.72 -> 172.31.31.144 OpenFlow 189 Type: OFPT_PACKET_IN
122 0.185745054 172.31.31.144 -> 172.31.23.72 OpenFlow 187 Type: OFPT_PACKET_OUT
123 0.185767723 172.31.23.72 -> 172.31.31.144 OpenFlow 189 Type: OFPT_PACKET_IN
124 0.185831639 172.31.31.144 -> 172.31.23.72 TCP 66 6633 → 51166 [ACK] Seq=969 Ack=493 Win=853 Len=0 TSval=5385757 TSecr=23955882
125 0.185839023 172.31.31.144 -> 172.31.23.72 OpenFlow 187 Type: OFPT_PACKET_OUT
126 0.185845256 172.31.23.72 -> 172.31.31.144 OpenFlow 189 Type: OFPT_PACKET_IN
127 0.185851650 172.31.23.72 -> 172.31.31.144 OpenFlow 189 Type: OFPT_PACKET_IN
128 0.185869442 172.31.31.144 -> 172.31.23.72 TCP 66 6633 → 51156 [ACK] Seq=1 Ack=616 Win=853 Len=0 TSval=5385757 TSecr=23955882
129 0.185873153 172.31.31.144 -> 172.31.23.72 OpenFlow 187 Type: OFPT_PACKET_OUT
130 0.185944756 172.31.31.144 -> 172.31.23.72 TCP 66 6633 → 51156 [ACK] Seq=1 Ack=739 Win=853 Len=0 TSval=5385757 TSecr=23955882
131 0.185950544 172.31.31.144 -> 172.31.23.72 OpenFlow 187 Type: OFPT_PACKET_OUT
132 0.185952687 172.31.31.144 -> 172.31.23.72 TCP 66 6633 → 51158 [ACK] Seq=1211 Ack=370 Win=853 Len=0 TSval=5385757 TSecr=23955882
133 0.186008175 172.31.31.144 -> 172.31.23.72 TCP 66 6633 → 51158 [ACK] Seq=1211 Ack=493 Win=853 Len=0 TSval=5385757 TSecr=23955882
134 0.186054293 172.31.31.144 -> 172.31.23.72 TCP 66 6633 → 51170 [ACK] Seq=969 Ack=370 Win=853 Len=0 TSval=5385757 TSecr=23955882
135 0.186083650 172.31.31.144 -> 172.31.23.72 TCP 66 6633 → 51170 [ACK] Seq=969 Ack=493 Win=853 Len=0 TSval=5385757 TSecr=23955882
136 0.186200637 172.31.23.72 -> 172.31.31.144 OpenFlow 189 Type: OFPT_PACKET_IN
137 0.186228815 172.31.23.72 -> 172.31.31.144 OpenFlow 189 Type: OFPT_PACKET_IN
138 0.186265841 172.31.31.144 -> 172.31.23.72 OpenFlow 187 Type: OFPT_PACKET_OUT
139 0.186360498 172.31.31.144 -> 172.31.23.72 OpenFlow 187 Type: OFPT_PACKET_OUT
140 0.186399983 172.31.23.72 -> 172.31.31.144 OpenFlow 189 Type: OFPT_PACKET_IN
141 0.186417329 172.31.31.144 -> 172.31.23.72 TCP 66 6633 → 51168 [ACK] Seq=969 Ack=739 Win=853 Len=0 TSval=5385757 TSecr=23955883
142 0.186425962 172.31.23.72 -> 172.31.31.144 OpenFlow 189 Type: OFPT_PACKET_IN
143 0.186441530 172.31.23.72 -> 172.31.31.144 OpenFlow 189 Type: OFPT_PACKET_IN
144 0.186491746 172.31.23.72 -> 172.31.31.144 OpenFlow 189 Type: OFPT_PACKET_IN
145 0.186523019 172.31.31.144 -> 172.31.23.72 OpenFlow 187 Type: OFPT_PACKET_OUT
146 0.186572338 172.31.31.144 -> 172.31.23.72 TCP 66 6633 → 51158 [ACK] Seq=1211 Ack=616 Win=853 Len=0 TSval=5385757 TSecr=23955883
147 0.186589624 172.31.31.144 -> 172.31.23.72 TCP 66 6633 → 51158 [ACK] Seq=1211 Ack=739 Win=853 Len=0 TSval=5385757 TSecr=23955883
148 0.186675303 172.31.31.144 -> 172.31.23.72 TCP 66 6633 → 51172 [ACK] Seq=727 Ack=493 Win=853 Len=0 TSval=5385757 TSecr=23955883
149 0.186721881 172.31.23.72 -> 172.31.31.144 OpenFlow 189 Type: OFPT_PACKET_IN
150 0.186748552 172.31.23.72 -> 172.31.31.144 OpenFlow 189 Type: OFPT_PACKET_IN
151 0.186765819 172.31.23.72 -> 172.31.31.144 OpenFlow 189 Type: OFPT_PACKET_IN
152 0.186816219 172.31.23.72 -> 172.31.31.144 OpenFlow 189 Type: OFPT_PACKET_IN
153 0.186935738 172.31.31.144 -> 172.31.23.72 TCP 66 6633 → 51170 [ACK] Seq=969 Ack=739 Win=853 Len=0 TSval=5385757 TSecr=23955883
154 0.186953176 172.31.31.144 -> 172.31.23.72 TCP 66 6633 → 51160 [ACK] Seq=727 Ack=370 Win=853 Len=0 TSval=5385757 TSecr=23955883
155 0.186971551 172.31.31.144 -> 172.31.23.72 TCP 66 6633 → 51160 [ACK] Seq=727 Ack=493 Win=853 Len=0 TSval=5385757 TSecr=23955883
156 0.226032291 172.31.23.72 -> 172.31.31.144 TCP 66 51172 → 6633 [ACK] Seq=493 Ack=727 Win=213 Len=0 TSval=23955893 TSecr=5385757
157 0.769450597 172.31.31.144 -> 172.31.23.72 TCP 90 6633 → 51126 [PSH, ACK] Seq=1 Ack=1 Win=853 Len=24 TSval=5385903 TSecr=23955733
158 0.769488903 172.31.31.144 -> 172.31.23.72 TCP 138 6633 → 51126 [PSH, ACK] Seq=25 Ack=1 Win=853 Len=72 TSval=5385903 TSecr=23955733
159 0.769695107 172.31.23.72 -> 172.31.31.144 OpenFlow 530 Type: OFPT_MULTIPART_REPLY, OFPMP_PORT_STATS
160 0.769779612 172.31.23.72 -> 172.31.31.144 OpenFlow 2010 Type: OFPT_MULTIPART_REPLY, OFPMP_FLOW
161 0.769949324 172.31.31.144 -> 172.31.23.72 TCP 66 6633 → 51126 [ACK] Seq=97 Ack=465 Win=853 Len=0 TSval=5385903 TSecr=23956028
162 0.769962341 172.31.23.72 -> 172.31.31.144 OpenFlow 6178 Type: OFPT_MULTIPART_REPLY, OFPMP_TABLE
163 0.769971543 172.31.31.144 -> 172.31.23.72 TCP 66 6633 → 51126 [ACK] Seq=97 Ack=2409 Win=853 Len=0 TSval=5385903 TSecr=23956028
164 0.770201093 172.31.31.144 -> 172.31.23.72 TCP 66 6633 → 51126 [ACK] Seq=97 Ack=8521 Win=853 Len=0 TSval=5385903 TSecr=23956028
165 0.803668823 172.31.31.144 -> 172.31.23.72 TCP 82 6633 → 51128 [PSH, ACK] Seq=1 Ack=1 Win=853 Len=16 TSval=5385911 TSecr=23955733
166 0.803700351 172.31.31.144 -> 172.31.23.72 TCP 146 6633 → 51128 [PSH, ACK] Seq=17 Ack=1 Win=853 Len=80 TSval=5385911 TSecr=23955733
167 0.804086856 172.31.23.72 -> 172.31.31.144 OpenFlow 6178 Type: OFPT_MULTIPART_REPLY, OFPMP_TABLE
168 0.804171551 172.31.23.72 -> 172.31.31.144 OpenFlow 3050 Type: OFPT_MULTIPART_REPLY, OFPMP_FLOW
169 0.804271503 172.31.23.72 -> 172.31.31.144 OpenFlow 642 Type: OFPT_MULTIPART_REPLY, OFPMP_PORT_STATS
170 0.804405195 172.31.31.144 -> 172.31.23.72 TCP 66 6633 → 51128 [ACK] Seq=97 Ack=6113 Win=853 Len=0 TSval=5385911 TSecr=23956037
171 0.804441046 172.31.31.144 -> 172.31.23.72 TCP 66 6633 → 51128 [ACK] Seq=97 Ack=9097 Win=853 Len=0 TSval=5385911 TSecr=23956037
172 0.804444038 172.31.31.144 -> 172.31.23.72 TCP 66 6633 → 51128 [ACK] Seq=97 Ack=9673 Win=853 Len=0 TSval=5385911 TSecr=23956037
173 0.839953169 172.31.31.144 -> 172.31.23.72 TCP 90 6633 → 51130 [PSH, ACK] Seq=1 Ack=1 Win=853 Len=24 TSval=5385920 TSecr=23955733
174 0.839983656 172.31.23.72 -> 172.31.31.144 TCP 66 51130 → 6633 [ACK] Seq=1 Ack=25 Win=213 Len=0 TSval=23956046 TSecr=5385920
175 0.840387160 172.31.23.72 -> 172.31.31.144 OpenFlow 754 Type: OFPT_MULTIPART_REPLY, OFPMP_PORT_STATS
176 0.841011348 172.31.31.144 -> 172.31.23.72 OpenFlow 82 Type: OFPT_MULTIPART_REQUEST, OFPMP_TABLE
177 0.841020808 172.31.31.144 -> 172.31.23.72 OpenFlow 122 Type: OFPT_MULTIPART_REQUEST, OFPMP_FLOW
178 0.841245924 172.31.23.72 -> 172.31.31.144 OpenFlow 6178 Type: OFPT_MULTIPART_REPLY, OFPMP_TABLE
179 0.841331824 172.31.23.72 -> 172.31.31.144 OpenFlow 2426 Type: OFPT_MULTIPART_REPLY, OFPMP_FLOW
180 0.841549515 172.31.31.144 -> 172.31.23.72 TCP 66 6633 → 51130 [ACK] Seq=97 Ack=9161 Win=853 Len=0 TSval=5385921 TSecr=23956046
181 0.889424602 172.31.31.144 -> 172.31.23.72 TCP 122 6633 → 51132 [PSH, ACK] Seq=1 Ack=1 Win=853 Len=56 TSval=5385933 TSecr=23955733
182 0.889466190 172.31.31.144 -> 172.31.23.72 TCP 106 6633 → 51132 [PSH, ACK] Seq=57 Ack=1 Win=853 Len=40 TSval=5385933 TSecr=23955733
183 0.889612459 172.31.23.72 -> 172.31.31.144 OpenFlow 2218 Type: OFPT_MULTIPART_REPLY, OFPMP_FLOW
184 0.889719542 172.31.23.72 -> 172.31.31.144 OpenFlow 642 Type: OFPT_MULTIPART_REPLY, OFPMP_PORT_STATS
185 0.889907576 172.31.23.72 -> 172.31.31.144 OpenFlow 6178 Type: OFPT_MULTIPART_REPLY, OFPMP_TABLE
186 0.889933405 172.31.31.144 -> 172.31.23.72 TCP 66 6633 → 51132 [ACK] Seq=97 Ack=2729 Win=853 Len=0 TSval=5385933 TSecr=23956058
187 0.928672978 172.31.31.144 -> 172.31.23.72 TCP 66 6633 → 51132 [ACK] Seq=97 Ack=8841 Win=853 Len=0 TSval=5385943 TSecr=23956058
188 0.930658483 172.31.31.144 -> 172.31.23.72 TCP 90 6633 → 51134 [PSH, ACK] Seq=1 Ack=1 Win=853 Len=24 TSval=5385943 TSecr=23955733
189 0.930666180 172.31.31.144 -> 172.31.23.72 TCP 138 6633 → 51134 [PSH, ACK] Seq=25 Ack=1 Win=853 Len=72 TSval=5385943 TSecr=23955733
190 0.930879246 172.31.23.72 -> 172.31.31.144 OpenFlow 530 Type: OFPT_MULTIPART_REPLY, OFPMP_PORT_STATS
191 0.931075187 172.31.23.72 -> 172.31.31.144 OpenFlow 6178 Type: OFPT_MULTIPART_REPLY, OFPMP_TABLE
192 0.931122196 172.31.23.72 -> 172.31.31.144 OpenFlow 762 Type: OFPT_MULTIPART_REPLY, OFPMP_FLOW
193 0.931290741 172.31.31.144 -> 172.31.23.72 TCP 66 6633 → 51134 [ACK] Seq=97 Ack=7273 Win=853 Len=0 TSval=5385943 TSecr=23956069
194 1.013843239 172.31.31.144 -> 172.31.23.72 TCP 90 6633 → 51136 [PSH, ACK] Seq=1 Ack=1 Win=853 Len=24 TSval=5385964 TSecr=23955734
195 1.013880868 172.31.31.144 -> 172.31.23.72 TCP 138 6633 → 51136 [PSH, ACK] Seq=25 Ack=1 Win=853 Len=72 TSval=5385964 TSecr=23955734
196 1.014204010 172.31.23.72 -> 172.31.31.144 OpenFlow 754 Type: OFPT_MULTIPART_REPLY, OFPMP_PORT_STATS
197 1.014324907 172.31.23.72 -> 172.31.31.144 OpenFlow 3466 Type: OFPT_MULTIPART_REPLY, OFPMP_FLOW
198 1.014451422 172.31.31.144 -> 172.31.23.72 TCP 66 6633 → 51136 [ACK] Seq=97 Ack=689 Win=853 Len=0 TSval=5385964 TSecr=23956090
199 1.014500850 172.31.23.72 -> 172.31.31.144 OpenFlow 6178 Type: OFPT_MULTIPART_REPLY, OFPMP_TABLE
200 1.014510137 172.31.31.144 -> 172.31.23.72 TCP 66 6633 → 51136 [ACK] Seq=97 Ack=4089 Win=853 Len=0 TSval=5385964 TSecr=23956090
201 1.014721662 172.31.31.144 -> 172.31.23.72 TCP 66 6633 → 51136 [ACK] Seq=97 Ack=10201 Win=853 Len=0 TSval=5385964 TSecr=23956090
202 1.056053304 172.31.31.144 -> 172.31.23.72 TCP 122 6633 → 51138 [PSH, ACK] Seq=1 Ack=1 Win=853 Len=56 TSval=5385974 TSecr=23955733
203 1.056088059 172.31.31.144 -> 172.31.23.72 TCP 106 6633 → 51138 [PSH, ACK] Seq=57 Ack=1 Win=853 Len=40 TSval=5385974 TSecr=23955733
204 1.056343220 172.31.23.72 -> 172.31.31.144 OpenFlow 1178 Type: OFPT_MULTIPART_REPLY, OFPMP_FLOW
205 1.056482230 172.31.23.72 -> 172.31.31.144 OpenFlow 754 Type: OFPT_MULTIPART_REPLY, OFPMP_PORT_STATS
206 1.056649999 172.31.23.72 -> 172.31.31.144 OpenFlow 6178 Type: OFPT_MULTIPART_REPLY, OFPMP_TABLE
207 1.056723717 172.31.31.144 -> 172.31.23.72 TCP 66 6633 → 51138 [ACK] Seq=97 Ack=1801 Win=853 Len=0 TSval=5385975 TSecr=23956100
208 1.069245616 172.31.31.144 -> 172.31.23.72 TCP 82 6633 → 51140 [PSH, ACK] Seq=1 Ack=1 Win=853 Len=16 TSval=5385978 TSecr=23955735
209 1.069274722 172.31.31.144 -> 172.31.23.72 TCP 146 6633 → 51140 [PSH, ACK] Seq=17 Ack=1 Win=853 Len=80 TSval=5385978 TSecr=23955735
210 1.069506585 172.31.23.72 -> 172.31.31.144 OpenFlow 6178 Type: OFPT_MULTIPART_REPLY, OFPMP_TABLE
211 1.069586965 172.31.23.72 -> 172.31.31.144 OpenFlow 530 Type: OFPT_MULTIPART_REPLY, OFPMP_PORT_STATS
212 1.069635214 172.31.23.72 -> 172.31.31.144 OpenFlow 1178 Type: OFPT_MULTIPART_REPLY, OFPMP_FLOW
213 1.069812572 172.31.31.144 -> 172.31.23.72 TCP 66 6633 → 51140 [ACK] Seq=97 Ack=6113 Win=853 Len=0 TSval=5385978 TSecr=23956103
214 1.069840945 172.31.31.144 -> 172.31.23.72 TCP 66 6633 → 51140 [ACK] Seq=97 Ack=6577 Win=853 Len=0 TSval=5385978 TSecr=23956103
215 1.069878234 172.31.31.144 -> 172.31.23.72 TCP 66 6633 → 51140 [ACK] Seq=97 Ack=7689 Win=853 Len=0 TSval=5385978 TSecr=23956103
216 1.096621178 172.31.31.144 -> 172.31.23.72 TCP 66 6633 → 51138 [ACK] Seq=97 Ack=7913 Win=853 Len=0 TSval=5385985 TSecr=23956100
217 1.147644125 172.31.31.144 -> 172.31.23.72 TCP 90 6633 → 51142 [PSH, ACK] Seq=1 Ack=1 Win=853 Len=24 TSval=5385997 TSecr=23955735
218 1.147678984 172.31.31.144 -> 172.31.23.72 TCP 138 6633 → 51142 [PSH, ACK] Seq=25 Ack=1 Win=853 Len=72 TSval=5385997 TSecr=23955735
219 1.148010235 172.31.23.72 -> 172.31.31.144 OpenFlow 754 Type: OFPT_MULTIPART_REPLY, OFPMP_PORT_STATS
220 1.148075077 172.31.23.72 -> 172.31.31.144 OpenFlow 970 Type: OFPT_MULTIPART_REPLY, OFPMP_FLOW
221 1.148248409 172.31.31.144 -> 172.31.23.72 TCP 66 6633 → 51142 [ACK] Seq=97 Ack=689 Win=853 Len=0 TSval=5385997 TSecr=23956123
222 1.148256206 172.31.23.72 -> 172.31.31.144 OpenFlow 6178 Type: OFPT_MULTIPART_REPLY, OFPMP_TABLE
223 1.148265352 172.31.31.144 -> 172.31.23.72 TCP 66 6633 → 51142 [ACK] Seq=97 Ack=1593 Win=853 Len=0 TSval=5385997 TSecr=23956123
224 1.148497692 172.31.31.144 -> 172.31.23.72 TCP 66 6633 → 51142 [ACK] Seq=97 Ack=7705 Win=853 Len=0 TSval=5385998 TSecr=23956123
225 1.175892778 172.31.31.144 -> 172.31.23.72 TCP 122 6633 → 51144 [PSH, ACK] Seq=1 Ack=1 Win=853 Len=56 TSval=5386004 TSecr=23955735
226 1.175920503 172.31.31.144 -> 172.31.23.72 TCP 90 6633 → 51144 [PSH, ACK] Seq=57 Ack=1 Win=853 Len=24 TSval=5386004 TSecr=23955735
227 1.176229721 172.31.23.72 -> 172.31.31.144 OpenFlow 1178 Type: OFPT_MULTIPART_REPLY, OFPMP_FLOW
228 1.176351225 172.31.23.72 -> 172.31.31.144 OpenFlow 642 Type: OFPT_MULTIPART_REPLY, OFPMP_PORT_STATS
229 1.176559204 172.31.31.144 -> 172.31.23.72 TCP 66 6633 → 51144 [ACK] Seq=81 Ack=1689 Win=853 Len=0 TSval=5386005 TSecr=23956130
230 1.177067609 172.31.31.144 -> 172.31.23.72 OpenFlow 82 Type: OFPT_MULTIPART_REQUEST, OFPMP_TABLE
231 1.177332829 172.31.23.72 -> 172.31.31.144 OpenFlow 6178 Type: OFPT_MULTIPART_REPLY, OFPMP_TABLE
232 1.215359678 172.31.31.144 -> 172.31.23.72 OpenFlow 90 Type: OFPT_MULTIPART_REQUEST, OFPMP_PORT_STATS
233 1.215393657 172.31.31.144 -> 172.31.23.72 OpenFlow 138 Type: OFPT_MULTIPART_REQUEST, OFPMP_TABLE
234 1.215698482 172.31.23.72 -> 172.31.31.144 OpenFlow 754 Type: OFPT_MULTIPART_REPLY, OFPMP_PORT_STATS
235 1.215847838 172.31.23.72 -> 172.31.31.144 OpenFlow 3674 Type: OFPT_MULTIPART_REPLY, OFPMP_FLOW
236 1.216009527 172.31.23.72 -> 172.31.31.144 OpenFlow 6178 Type: OFPT_MULTIPART_REPLY, OFPMP_TABLE
237 1.216101540 172.31.31.144 -> 172.31.23.72 TCP 66 6633 → 51146 [ACK] Seq=97 Ack=4543 Win=853 Len=0 TSval=5386014 TSecr=23956140
238 1.216560223 172.31.31.144 -> 172.31.23.72 TCP 66 6633 → 51144 [ACK] Seq=97 Ack=7801 Win=853 Len=0 TSval=5386015 TSecr=23956130
239 1.252646800 172.31.31.144 -> 172.31.23.72 TCP 66 6633 → 51146 [ACK] Seq=97 Ack=10655 Win=853 Len=0 TSval=5386024 TSecr=23956140
240 1.262512692 172.31.31.144 -> 172.31.23.72 TCP 82 6633 → 51148 [PSH, ACK] Seq=1 Ack=1 Win=853 Len=16 TSval=5386026 TSecr=23955783
241 1.262546480 172.31.31.144 -> 172.31.23.72 TCP 146 6633 → 51148 [PSH, ACK] Seq=17 Ack=1 Win=853 Len=80 TSval=5386026 TSecr=23955783
242 1.262788370 172.31.23.72 -> 172.31.31.144 OpenFlow 6178 Type: OFPT_MULTIPART_REPLY, OFPMP_TABLE
243 1.262894508 172.31.23.72 -> 172.31.31.144 OpenFlow 642 Type: OFPT_MULTIPART_REPLY, OFPMP_PORT_STATS
244 1.262958079 172.31.23.72 -> 172.31.31.144 OpenFlow 1802 Type: OFPT_MULTIPART_REPLY, OFPMP_FLOW
245 1.263158872 172.31.31.144 -> 172.31.23.72 TCP 66 6633 → 51148 [ACK] Seq=97 Ack=6689 Win=853 Len=0 TSval=5386026 TSecr=23956152
246 1.300627765 172.31.31.144 -> 172.31.23.72 TCP 66 6633 → 51148 [ACK] Seq=97 Ack=8425 Win=853 Len=0 TSval=5386036 TSecr=23956152
247 1.311767661 172.31.31.144 -> 172.31.23.72 OpenFlow 122 Type: OFPT_MULTIPART_REQUEST, OFPMP_FLOW
248 1.311799997 172.31.31.144 -> 172.31.23.72 OpenFlow 106 Type: OFPT_MULTIPART_REQUEST, OFPMP_PORT_STATS
249 1.312033640 172.31.23.72 -> 172.31.31.144 OpenFlow 1178 Type: OFPT_MULTIPART_REPLY, OFPMP_FLOW
250 1.312233415 172.31.23.72 -> 172.31.31.144 OpenFlow 6178 Type: OFPT_MULTIPART_REPLY, OFPMP_TABLE
251 1.312335101 172.31.23.72 -> 172.31.31.144 OpenFlow 642 Type: OFPT_MULTIPART_REPLY, OFPMP_PORT_STATS
252 1.312486580 172.31.31.144 -> 172.31.23.72 TCP 66 6633 → 51150 [ACK] Seq=97 Ack=7471 Win=853 Len=0 TSval=5386038 TSecr=23956164
253 1.348647757 172.31.31.144 -> 172.31.23.72 TCP 66 6633 → 51150 [ACK] Seq=97 Ack=8047 Win=853 Len=0 TSval=5386048 TSecr=23956164
254 1.362019928 172.31.31.144 -> 172.31.23.72 OpenFlow 122 Type: OFPT_MULTIPART_REQUEST, OFPMP_FLOW
255 1.362041535 172.31.31.144 -> 172.31.23.72 OpenFlow 106 Type: OFPT_MULTIPART_REQUEST, OFPMP_TABLE
256 1.362224531 172.31.23.72 -> 172.31.31.144 OpenFlow 346 Type: OFPT_MULTIPART_REPLY, OFPMP_FLOW
257 1.362315356 172.31.23.72 -> 172.31.31.144 OpenFlow 530 Type: OFPT_MULTIPART_REPLY, OFPMP_PORT_STATS
258 1.362493045 172.31.23.72 -> 172.31.31.144 OpenFlow 6178 Type: OFPT_MULTIPART_REPLY, OFPMP_TABLE
259 1.362568077 172.31.31.144 -> 172.31.23.72 TCP 66 6633 → 51152 [ACK] Seq=97 Ack=991 Win=853 Len=0 TSval=5386051 TSecr=23956177
260 1.400666229 172.31.31.144 -> 172.31.23.72 TCP 66 6633 → 51152 [ACK] Seq=97 Ack=7103 Win=853 Len=0 TSval=5386061 TSecr=23956177
261 1.419359341 172.31.31.144 -> 172.31.23.72 OpenFlow 90 Type: OFPT_MULTIPART_REQUEST, OFPMP_PORT_STATS
262 1.419618144 172.31.23.72 -> 172.31.31.144 OpenFlow 530 Type: OFPT_MULTIPART_REPLY, OFPMP_PORT_STATS
263 1.420514583 172.31.31.144 -> 172.31.23.72 OpenFlow 122 Type: OFPT_MULTIPART_REQUEST, OFPMP_FLOW
264 1.420523114 172.31.31.144 -> 172.31.23.72 OpenFlow 82 Type: OFPT_MULTIPART_REQUEST, OFPMP_TABLE
265 1.420718319 172.31.23.72 -> 172.31.31.144 OpenFlow 2010 Type: OFPT_MULTIPART_REPLY, OFPMP_FLOW
266 1.420879243 172.31.23.72 -> 172.31.31.144 OpenFlow 6178 Type: OFPT_MULTIPART_REPLY, OFPMP_TABLE
267 1.421083884 172.31.31.144 -> 172.31.23.72 TCP 66 6633 → 51154 [ACK] Seq=97 Ack=8767 Win=853 Len=0 TSval=5386066 TSecr=23956191
268 1.480764805 172.31.31.144 -> 172.31.23.72 OpenFlow 90 Type: OFPT_MULTIPART_REQUEST, OFPMP_PORT_STATS
269 1.480789724 172.31.23.72 -> 172.31.31.144 TCP 66 51156 → 6633 [ACK] Seq=739 Ack=25 Win=213 Len=0 TSval=23956206 TSecr=5386081
270 1.480806914 172.31.31.144 -> 172.31.23.72 OpenFlow 138 Type: OFPT_MULTIPART_REQUEST, OFPMP_TABLE
271 1.480815414 172.31.23.72 -> 172.31.31.144 TCP 66 51156 → 6633 [ACK] Seq=739 Ack=97 Win=213 Len=0 TSval=23956206 TSecr=5386081
272 1.481121093 172.31.23.72 -> 172.31.31.144 OpenFlow 754 Type: OFPT_MULTIPART_REPLY, OFPMP_PORT_STATS
273 1.481253154 172.31.23.72 -> 172.31.31.144 OpenFlow 3466 Type: OFPT_MULTIPART_REPLY, OFPMP_FLOW
274 1.481325804 172.31.31.144 -> 172.31.23.72 TCP 66 6633 → 51156 [ACK] Seq=97 Ack=1427 Win=853 Len=0 TSval=5386081 TSecr=23956206
275 1.481427609 172.31.23.72 -> 172.31.31.144 OpenFlow 6178 Type: OFPT_MULTIPART_REPLY, OFPMP_TABLE
276 1.481439275 172.31.31.144 -> 172.31.23.72 TCP 66 6633 → 51156 [ACK] Seq=97 Ack=4827 Win=853 Len=0 TSval=5386081 TSecr=23956206
277 1.481627785 172.31.31.144 -> 172.31.23.72 TCP 66 6633 → 51156 [ACK] Seq=97 Ack=10939 Win=853 Len=0 TSval=5386081 TSecr=23956206
278 1.529014528 172.31.31.144 -> 172.31.23.72 OpenFlow 90 Type: OFPT_MULTIPART_REQUEST, OFPMP_PORT_STATS
279 1.529057190 172.31.31.144 -> 172.31.23.72 OpenFlow 138 Type: OFPT_MULTIPART_REQUEST, OFPMP_FLOW
280 1.529363151 172.31.23.72 -> 172.31.31.144 OpenFlow 754 Type: OFPT_MULTIPART_REPLY, OFPMP_PORT_STATS
281 1.529538577 172.31.23.72 -> 172.31.31.144 OpenFlow 6178 Type: OFPT_MULTIPART_REPLY, OFPMP_TABLE
282 1.529628866 172.31.31.144 -> 172.31.23.72 TCP 66 6633 → 51158 [ACK] Seq=1307 Ack=1427 Win=853 Len=0 TSval=5386093 TSecr=23956218
283 1.529638498 172.31.23.72 -> 172.31.31.144 OpenFlow 3050 Type: OFPT_MULTIPART_REPLY, OFPMP_FLOW
284 1.529777606 172.31.31.144 -> 172.31.23.72 TCP 66 6633 → 51158 [ACK] Seq=1307 Ack=7539 Win=853 Len=0 TSval=5386093 TSecr=23956218
285 1.529881525 172.31.31.144 -> 172.31.23.72 TCP 66 6633 → 51158 [ACK] Seq=1307 Ack=10523 Win=853 Len=0 TSval=5386093 TSecr=23956218
286 1.634361420 172.31.31.144 -> 172.31.23.72 OpenFlow 82 Type: OFPT_MULTIPART_REQUEST, OFPMP_TABLE
287 1.634401914 172.31.31.144 -> 172.31.23.72 OpenFlow 146 Type: OFPT_MULTIPART_REQUEST, OFPMP_FLOW
288 1.634867489 172.31.23.72 -> 172.31.31.144 OpenFlow 6178 Type: OFPT_MULTIPART_REPLY, OFPMP_TABLE
289 1.634968619 172.31.23.72 -> 172.31.31.144 OpenFlow 530 Type: OFPT_MULTIPART_REPLY, OFPMP_PORT_STATS
290 1.635036630 172.31.23.72 -> 172.31.31.144 OpenFlow 1802 Type: OFPT_MULTIPART_REPLY, OFPMP_FLOW
291 1.635215050 172.31.31.144 -> 172.31.23.72 TCP 66 6633 → 51160 [ACK] Seq=823 Ack=6605 Win=853 Len=0 TSval=5386119 TSecr=23956245
292 1.635222848 172.31.31.144 -> 172.31.23.72 TCP 66 6633 → 51160 [ACK] Seq=823 Ack=7069 Win=853 Len=0 TSval=5386119 TSecr=23956245
293 1.635224869 172.31.31.144 -> 172.31.23.72 TCP 66 6633 → 51160 [ACK] Seq=823 Ack=8805 Win=853 Len=0 TSval=5386119 TSecr=23956245
294 1.723608059 172.31.31.144 -> 172.31.23.72 OpenFlow 122 Type: OFPT_MULTIPART_REQUEST, OFPMP_FLOW
295 1.723651118 172.31.31.144 -> 172.31.23.72 OpenFlow 106 Type: OFPT_MULTIPART_REQUEST, OFPMP_PORT_STATS
296 1.723989854 172.31.23.72 -> 172.31.31.144 OpenFlow 2426 Type: OFPT_MULTIPART_REPLY, OFPMP_FLOW
297 1.724174454 172.31.23.72 -> 172.31.31.144 OpenFlow 6178 Type: OFPT_MULTIPART_REPLY, OFPMP_TABLE
298 1.724272358 172.31.23.72 -> 172.31.31.144 OpenFlow 530 Type: OFPT_MULTIPART_REPLY, OFPMP_PORT_STATS
299 1.724281469 172.31.31.144 -> 172.31.23.72 TCP 66 6633 → 51162 [ACK] Seq=823 Ack=2607 Win=853 Len=0 TSval=5386141 TSecr=23956267
300 1.724395599 172.31.31.144 -> 172.31.23.72 TCP 66 6633 → 51162 [ACK] Seq=823 Ack=8719 Win=853 Len=0 TSval=5386141 TSecr=23956267
301 1.724448349 172.31.31.144 -> 172.31.23.72 TCP 66 6633 → 51162 [ACK] Seq=823 Ack=9183 Win=853 Len=0 TSval=5386141 TSecr=23956267
302 1.751822920 172.31.31.144 -> 172.31.23.72 OpenFlow 122 Type: OFPT_MULTIPART_REQUEST, OFPMP_FLOW
303 1.751843599 172.31.31.144 -> 172.31.23.72 OpenFlow 106 Type: OFPT_MULTIPART_REQUEST, OFPMP_TABLE
304 1.751981064 172.31.23.72 -> 172.31.31.144 OpenFlow 2426 Type: OFPT_MULTIPART_REPLY, OFPMP_FLOW
305 1.752102490 172.31.23.72 -> 172.31.31.144 OpenFlow 642 Type: OFPT_MULTIPART_REPLY, OFPMP_PORT_STATS
306 1.752254472 172.31.23.72 -> 172.31.31.144 OpenFlow 6178 Type: OFPT_MULTIPART_REPLY, OFPMP_TABLE
307 1.752271222 172.31.31.144 -> 172.31.23.72 TCP 66 6633 → 51164 [ACK] Seq=1065 Ack=2853 Win=853 Len=0 TSval=5386148 TSecr=23956274
308 1.752354205 172.31.31.144 -> 172.31.23.72 TCP 66 6633 → 51164 [ACK] Seq=1065 Ack=3429 Win=853 Len=0 TSval=5386148 TSecr=23956274
309 1.752501956 172.31.31.144 -> 172.31.23.72 TCP 66 6633 → 51164 [ACK] Seq=1065 Ack=9541 Win=853 Len=0 TSval=5386148 TSecr=23956274
310 1.821033101 172.31.31.144 -> 172.31.23.72 OpenFlow 82 Type: OFPT_MULTIPART_REQUEST, OFPMP_TABLE
311 1.821068643 172.31.31.144 -> 172.31.23.72 OpenFlow 146 Type: OFPT_MULTIPART_REQUEST, OFPMP_PORT_STATS
312 1.821459910 172.31.23.72 -> 172.31.31.144 OpenFlow 6178 Type: OFPT_MULTIPART_REPLY, OFPMP_TABLE
313 1.821543686 172.31.23.72 -> 172.31.31.144 OpenFlow 2426 Type: OFPT_MULTIPART_REPLY, OFPMP_FLOW
314 1.821644764 172.31.23.72 -> 172.31.31.144 OpenFlow 642 Type: OFPT_MULTIPART_REPLY, OFPMP_PORT_STATS
315 1.821742926 172.31.31.144 -> 172.31.23.72 TCP 66 6633 → 51166 [ACK] Seq=1065 Ack=6605 Win=853 Len=0 TSval=5386166 TSecr=23956291
316 1.821774312 172.31.31.144 -> 172.31.23.72 TCP 66 6633 → 51166 [ACK] Seq=1065 Ack=8965 Win=853 Len=0 TSval=5386166 TSecr=23956291
317 1.821859214 172.31.31.144 -> 172.31.23.72 TCP 66 6633 → 51166 [ACK] Seq=1065 Ack=9541 Win=853 Len=0 TSval=5386166 TSecr=23956291
318 1.881437842 172.31.31.144 -> 172.31.23.72 OpenFlow 122 Type: OFPT_MULTIPART_REQUEST, OFPMP_FLOW
319 1.881477917 172.31.31.144 -> 172.31.23.72 OpenFlow 106 Type: OFPT_MULTIPART_REQUEST, OFPMP_TABLE
320 1.881777394 172.31.23.72 -> 172.31.31.144 OpenFlow 970 Type: OFPT_MULTIPART_REPLY, OFPMP_FLOW
321 1.881887677 172.31.23.72 -> 172.31.31.144 OpenFlow 642 Type: OFPT_MULTIPART_REPLY, OFPMP_PORT_STATS
322 1.882046171 172.31.31.144 -> 172.31.23.72 TCP 66 6633 → 51168 [ACK] Seq=1065 Ack=1643 Win=853 Len=0 TSval=5386181 TSecr=23956306
323 1.882063805 172.31.31.144 -> 172.31.23.72 TCP 66 6633 → 51168 [ACK] Seq=1065 Ack=2219 Win=853 Len=0 TSval=5386181 TSecr=23956306
324 1.882437008 172.31.23.72 -> 172.31.31.144 OpenFlow 6178 Type: OFPT_MULTIPART_REPLY, OFPMP_TABLE
325 1.882719449 172.31.31.144 -> 172.31.23.72 TCP 66 6633 → 51168 [ACK] Seq=1065 Ack=8331 Win=853 Len=0 TSval=5386181 TSecr=23956307
326 1.895651638 172.31.31.144 -> 172.31.23.72 OpenFlow 82 Type: OFPT_MULTIPART_REQUEST, OFPMP_TABLE
327 1.895688521 172.31.31.144 -> 172.31.23.72 OpenFlow 146 Type: OFPT_MULTIPART_REQUEST, OFPMP_PORT_STATS
328 1.895939266 172.31.23.72 -> 172.31.31.144 OpenFlow 6178 Type: OFPT_MULTIPART_REPLY, OFPMP_TABLE
329 1.896011752 172.31.23.72 -> 172.31.31.144 OpenFlow 2218 Type: OFPT_MULTIPART_REPLY, OFPMP_FLOW
330 1.896104661 172.31.23.72 -> 172.31.31.144 OpenFlow 642 Type: OFPT_MULTIPART_REPLY, OFPMP_PORT_STATS
331 1.896272000 172.31.31.144 -> 172.31.23.72 TCP 66 6633 → 51170 [ACK] Seq=1065 Ack=6851 Win=853 Len=0 TSval=5386184 TSecr=23956310
332 1.896279982 172.31.31.144 -> 172.31.23.72 TCP 66 6633 → 51170 [ACK] Seq=1065 Ack=9003 Win=853 Len=0 TSval=5386184 TSecr=23956310
333 1.896330063 172.31.31.144 -> 172.31.23.72 TCP 66 6633 → 51170 [ACK] Seq=1065 Ack=9579 Win=853 Len=0 TSval=5386184 TSecr=23956310
334 1.923895994 172.31.31.144 -> 172.31.23.72 OpenFlow 90 Type: OFPT_MULTIPART_REQUEST, OFPMP_PORT_STATS
335 1.923918690 172.31.23.72 -> 172.31.31.144 TCP 66 51172 → 6633 [ACK] Seq=493 Ack=751 Win=213 Len=0 TSval=23956317 TSecr=5386191
336 1.923948817 172.31.31.144 -> 172.31.23.72 OpenFlow 122 Type: OFPT_MULTIPART_REQUEST, OFPMP_FLOW
337 1.923956327 172.31.23.72 -> 172.31.31.144 TCP 66 51172 → 6633 [ACK] Seq=493 Ack=807 Win=213 Len=0 TSval=23956317 TSecr=5386191
338 1.923963778 172.31.31.144 -> 172.31.23.72 OpenFlow 82 Type: OFPT_MULTIPART_REQUEST, OFPMP_TABLE
339 1.923967840 172.31.23.72 -> 172.31.31.144 TCP 66 51172 → 6633 [ACK] Seq=493 Ack=823 Win=213 Len=0 TSval=23956317 TSecr=5386191
340 1.924206749 172.31.23.72 -> 172.31.31.144 OpenFlow 530 Type: OFPT_MULTIPART_REPLY, OFPMP_PORT_STATS
341 1.924275817 172.31.23.72 -> 172.31.31.144 OpenFlow 2010 Type: OFPT_MULTIPART_REPLY, OFPMP_FLOW
342 1.924396132 172.31.31.144 -> 172.31.23.72 TCP 66 6633 → 51172 [ACK] Seq=823 Ack=957 Win=853 Len=0 TSval=5386191 TSecr=23956317
343 1.924453595 172.31.31.144 -> 172.31.23.72 TCP 66 6633 → 51172 [ACK] Seq=823 Ack=2901 Win=853 Len=0 TSval=5386191 TSecr=23956317
344 1.924465224 172.31.23.72 -> 172.31.31.144 OpenFlow 6178 Type: OFPT_MULTIPART_REPLY, OFPMP_TABLE
345 1.924689660 172.31.31.144 -> 172.31.23.72 TCP 66 6633 → 51172 [ACK] Seq=823 Ack=9013 Win=853 Len=0 TSval=5386192 TSecr=23956317
346 2.284605008 172.31.31.144 -> 172.31.23.72 OpenFlow 187 Type: OFPT_PACKET_OUT
347 2.284650763 172.31.31.144 -> 172.31.23.72 OpenFlow 187 Type: OFPT_PACKET_OUT
348 2.284709069 172.31.31.144 -> 172.31.23.72 OpenFlow 187 Type: OFPT_PACKET_OUT
349 2.284788273 172.31.31.144 -> 172.31.23.72 OpenFlow 187 Type: OFPT_PACKET_OUT
350 2.284893789 172.31.31.144 -> 172.31.23.72 OpenFlow 187 Type: OFPT_PACKET_OUT
351 2.284995619 172.31.31.144 -> 172.31.23.72 OpenFlow 187 Type: OFPT_PACKET_OUT
352 2.285137650 172.31.31.144 -> 172.31.23.72 OpenFlow 187 Type: OFPT_PACKET_OUT
353 2.285154466 172.31.31.144 -> 172.31.23.72 OpenFlow 187 Type: OFPT_PACKET_OUT
354 2.285242605 172.31.31.144 -> 172.31.23.72 OpenFlow 187 Type: OFPT_PACKET_OUT
355 2.285253031 172.31.23.72 -> 172.31.31.144 TCP 66 51126 → 6633 [ACK] Seq=8521 Ack=823 Win=387 Len=0 TSval=23956407 TSecr=5386281
356 2.285332890 172.31.31.144 -> 172.31.23.72 OpenFlow 187 Type: OFPT_PACKET_OUT
357 2.285358882 172.31.31.144 -> 172.31.23.72 OpenFlow 187 Type: OFPT_PACKET_OUT
358 2.285433085 172.31.31.144 -> 172.31.23.72 OpenFlow 187 Type: OFPT_PACKET_OUT
359 2.285488401 172.31.23.72 -> 172.31.31.144 OpenFlow 189 Type: OFPT_PACKET_IN
360 2.285514652 172.31.31.144 -> 172.31.23.72 OpenFlow 187 Type: OFPT_PACKET_OUT
361 2.285521626 172.31.23.72 -> 172.31.31.144 OpenFlow 189 Type: OFPT_PACKET_IN
362 2.285585232 172.31.23.72 -> 172.31.31.144 OpenFlow 189 Type: OFPT_PACKET_IN
363 2.285597027 172.31.31.144 -> 172.31.23.72 OpenFlow 187 Type: OFPT_PACKET_OUT
364 2.285603925 172.31.23.72 -> 172.31.31.144 OpenFlow 189 Type: OFPT_PACKET_IN
