<<<<<<< HEAD
  1 0.000000000 41.177.127.217 -> 172.31.24.227 TCP 54 58416 → 22 [ACK] Seq=1 Ack=1 Win=32698 Len=0
  2 0.002044813 41.177.127.217 -> 172.31.24.227 TCP 54 58416 → 22 [ACK] Seq=1 Ack=297 Win=32550 Len=0
  3 0.102081472 41.177.127.217 -> 172.31.24.227 TCP 54 58416 → 22 [ACK] Seq=1 Ack=333 Win=32532 Len=0
  4 0.139487275 41.177.127.217 -> 172.31.24.227 TCP 54 58416 → 22 [ACK] Seq=1 Ack=429 Win=32484 Len=0
  5 0.424846785 172.31.24.227 -> 41.177.127.217 SSH 90 Server: Encrypted packet (len=36)
  6 0.696091516 41.177.127.217 -> 172.31.24.227 TCP 54 58416 → 22 [ACK] Seq=1 Ack=465 Win=32466 Len=0
  7 0.765715820 172.31.31.144 -> 172.31.24.227 TCP 90 6633 → 39486 [PSH, ACK] Seq=1 Ack=1 Win=853 Len=24 TSval=391654 TSecr=118951627
  8 0.766225483 172.31.24.227 -> 172.31.31.144 OpenFlow 642 Type: OFPT_MULTIPART_REPLY, OFPMP_PORT_STATS
  9 0.766529383 172.31.31.144 -> 172.31.24.227 TCP 66 6633 → 39486 [ACK] Seq=25 Ack=577 Win=853 Len=0 TSval=391655 TSecr=118952265
 10 0.769004712 172.31.31.144 -> 172.31.24.227 OpenFlow 122 Type: OFPT_MULTIPART_REQUEST, OFPMP_FLOW
 11 0.769211814 172.31.24.227 -> 172.31.31.144 OpenFlow 2010 Type: OFPT_MULTIPART_REPLY, OFPMP_FLOW
 12 0.770216253 172.31.31.144 -> 172.31.24.227 OpenFlow 82 Type: OFPT_MULTIPART_REQUEST, OFPMP_TABLE
 13 0.770606376 172.31.24.227 -> 172.31.31.144 OpenFlow 6178 Type: OFPT_MULTIPART_REPLY, OFPMP_TABLE
 14 0.780446020 172.31.31.144 -> 172.31.24.227 TCP 90 6633 → 39490 [PSH, ACK] Seq=1 Ack=1 Win=853 Len=24 TSval=391658 TSecr=118951628
 15 0.780801834 172.31.24.227 -> 172.31.31.144 OpenFlow 754 Type: OFPT_MULTIPART_REPLY, OFPMP_PORT_STATS
 16 0.784852584 172.31.31.144 -> 172.31.24.227 OpenFlow 122 Type: OFPT_MULTIPART_REQUEST, OFPMP_FLOW
 17 0.785038770 172.31.24.227 -> 172.31.31.144 OpenFlow 1178 Type: OFPT_MULTIPART_REPLY, OFPMP_FLOW
 18 0.786031450 172.31.31.144 -> 172.31.24.227 OpenFlow 82 Type: OFPT_MULTIPART_REQUEST, OFPMP_TABLE
 19 0.786303596 172.31.24.227 -> 172.31.31.144 OpenFlow 6178 Type: OFPT_MULTIPART_REPLY, OFPMP_TABLE
 20 0.789248257 172.31.31.144 -> 172.31.24.227 TCP 90 6633 → 39492 [PSH, ACK] Seq=1 Ack=1 Win=853 Len=24 TSval=391660 TSecr=118951628
 21 0.789304608 172.31.31.144 -> 172.31.24.227 TCP 138 6633 → 39492 [PSH, ACK] Seq=25 Ack=1 Win=853 Len=72 TSval=391660 TSecr=118951628
 22 0.789494989 172.31.24.227 -> 172.31.31.144 OpenFlow 754 Type: OFPT_MULTIPART_REPLY, OFPMP_PORT_STATS
 23 0.789543637 172.31.24.227 -> 172.31.31.144 OpenFlow 970 Type: OFPT_MULTIPART_REPLY, OFPMP_FLOW
 24 0.789687364 172.31.24.227 -> 172.31.31.144 OpenFlow 6178 Type: OFPT_MULTIPART_REPLY, OFPMP_TABLE
 25 0.789759455 172.31.31.144 -> 172.31.24.227 TCP 66 6633 → 39492 [ACK] Seq=97 Ack=689 Win=853 Len=0 TSval=391660 TSecr=118952270
 26 0.789778411 172.31.31.144 -> 172.31.24.227 TCP 66 6633 → 39492 [ACK] Seq=97 Ack=1593 Win=853 Len=0 TSval=391660 TSecr=118952270
 27 0.789924108 172.31.31.144 -> 172.31.24.227 TCP 66 6633 → 39492 [ACK] Seq=97 Ack=7705 Win=853 Len=0 TSval=391660 TSecr=118952270
 28 0.794465826 172.31.31.144 -> 172.31.24.227 TCP 90 6633 → 39458 [PSH, ACK] Seq=1 Ack=1 Win=853 Len=24 TSval=391662 TSecr=118951627
 29 0.794505699 172.31.31.144 -> 172.31.24.227 TCP 122 6633 → 39458 [PSH, ACK] Seq=25 Ack=1 Win=853 Len=56 TSval=391662 TSecr=118951627
 30 0.794752191 172.31.24.227 -> 172.31.31.144 OpenFlow 1314 Type: OFPT_MULTIPART_REPLY, OFPMP_PORT_STATS
 31 0.794822246 172.31.24.227 -> 172.31.31.144 OpenFlow 2218 Type: OFPT_MULTIPART_REPLY, OFPMP_FLOW
 32 0.795038893 172.31.31.144 -> 172.31.24.227 TCP 66 6633 → 39458 [ACK] Seq=81 Ack=1249 Win=853 Len=0 TSval=391662 TSecr=118952272
 33 0.795048814 172.31.31.144 -> 172.31.24.227 TCP 66 6633 → 39458 [ACK] Seq=81 Ack=3401 Win=853 Len=0 TSval=391662 TSecr=118952272
 34 0.795592097 172.31.31.144 -> 172.31.24.227 OpenFlow 82 Type: OFPT_MULTIPART_REQUEST, OFPMP_TABLE
 35 0.795933325 172.31.24.227 -> 172.31.31.144 OpenFlow 6178 Type: OFPT_MULTIPART_REPLY, OFPMP_TABLE
 36 0.798850279 172.31.31.144 -> 172.31.24.227 TCP 122 6633 → 39476 [PSH, ACK] Seq=1 Ack=1 Win=853 Len=56 TSval=391663 TSecr=118951636
 37 0.798871074 172.31.24.227 -> 172.31.31.144 TCP 66 39476 → 6633 [ACK] Seq=1 Ack=57 Win=84 Len=0 TSval=118952273 TSecr=391663
 38 0.798951771 172.31.31.144 -> 172.31.24.227 TCP 90 6633 → 39476 [PSH, ACK] Seq=57 Ack=1 Win=853 Len=24 TSval=391663 TSecr=118951636
 39 0.798961921 172.31.24.227 -> 172.31.31.144 TCP 66 39476 → 6633 [ACK] Seq=1 Ack=81 Win=84 Len=0 TSval=118952273 TSecr=391663
 40 0.799226428 172.31.24.227 -> 172.31.31.144 OpenFlow 2010 Type: OFPT_MULTIPART_REPLY, OFPMP_FLOW
 41 0.799358476 172.31.24.227 -> 172.31.31.144 OpenFlow 530 Type: OFPT_MULTIPART_REPLY, OFPMP_PORT_STATS
 42 0.799632551 172.31.31.144 -> 172.31.24.227 TCP 66 6633 → 39476 [ACK] Seq=81 Ack=2409 Win=853 Len=0 TSval=391663 TSecr=118952273
 43 0.800027487 172.31.31.144 -> 172.31.24.227 OpenFlow 82 Type: OFPT_MULTIPART_REQUEST, OFPMP_TABLE
 44 0.800498349 172.31.24.227 -> 172.31.31.144 OpenFlow 6178 Type: OFPT_MULTIPART_REPLY, OFPMP_TABLE
 45 0.805309188 172.31.31.144 -> 172.31.24.227 TCP 122 6633 → 39452 [PSH, ACK] Seq=1 Ack=1 Win=853 Len=56 TSval=391664 TSecr=118951628
 46 0.805339665 172.31.31.144 -> 172.31.24.227 TCP 106 6633 → 39452 [PSH, ACK] Seq=57 Ack=1 Win=853 Len=40 TSval=391664 TSecr=118951628
 47 0.805439745 172.31.24.227 -> 172.31.31.144 OpenFlow 2634 Type: OFPT_MULTIPART_REPLY, OFPMP_FLOW
 48 0.805559989 172.31.24.227 -> 172.31.31.144 OpenFlow 866 Type: OFPT_MULTIPART_REPLY, OFPMP_PORT_STATS
 49 0.805698255 172.31.24.227 -> 172.31.31.144 OpenFlow 6178 Type: OFPT_MULTIPART_REPLY, OFPMP_TABLE
 50 0.805719380 172.31.31.144 -> 172.31.24.227 TCP 66 6633 → 39452 [ACK] Seq=97 Ack=2569 Win=853 Len=0 TSval=391664 TSecr=118952274
 51 0.805754409 172.31.31.144 -> 172.31.24.227 TCP 66 6633 → 39452 [ACK] Seq=97 Ack=3369 Win=853 Len=0 TSval=391664 TSecr=118952274
 52 0.805950341 172.31.31.144 -> 172.31.24.227 TCP 66 6633 → 39452 [ACK] Seq=97 Ack=9481 Win=853 Len=0 TSval=391665 TSecr=118952274
 53 0.808528661 172.31.31.144 -> 172.31.24.227 TCP 90 6633 → 39480 [PSH, ACK] Seq=1 Ack=1 Win=853 Len=24 TSval=391665 TSecr=118951629
 54 0.808572801 172.31.31.144 -> 172.31.24.227 TCP 122 6633 → 39480 [PSH, ACK] Seq=25 Ack=1 Win=853 Len=56 TSval=391665 TSecr=118951629
 55 0.808751070 172.31.24.227 -> 172.31.31.144 OpenFlow 866 Type: OFPT_MULTIPART_REPLY, OFPMP_PORT_STATS
 56 0.808817781 172.31.24.227 -> 172.31.31.144 OpenFlow 1386 Type: OFPT_MULTIPART_REPLY, OFPMP_FLOW
 57 0.809020195 172.31.31.144 -> 172.31.24.227 TCP 66 6633 → 39480 [ACK] Seq=81 Ack=801 Win=853 Len=0 TSval=391665 TSecr=118952275
 58 0.809038467 172.31.31.144 -> 172.31.24.227 TCP 66 6633 → 39480 [ACK] Seq=81 Ack=2121 Win=853 Len=0 TSval=391665 TSecr=118952275
 59 0.809727443 172.31.31.144 -> 172.31.24.227 OpenFlow 82 Type: OFPT_MULTIPART_REQUEST, OFPMP_TABLE
 60 0.809971743 172.31.24.227 -> 172.31.31.144 OpenFlow 6178 Type: OFPT_MULTIPART_REPLY, OFPMP_TABLE
 61 0.810051132 172.31.31.144 -> 172.31.24.227 TCP 66 6633 → 39486 [ACK] Seq=97 Ack=8633 Win=853 Len=0 TSval=391666 TSecr=118952266
 62 0.818029711 172.31.31.144 -> 172.31.24.227 TCP 122 6633 → 39464 [PSH, ACK] Seq=1 Ack=1 Win=853 Len=56 TSval=391667 TSecr=118951629
 63 0.818046878 172.31.31.144 -> 172.31.24.227 TCP 90 6633 → 39464 [PSH, ACK] Seq=57 Ack=1 Win=853 Len=24 TSval=391668 TSecr=118951629
 64 0.818319877 172.31.24.227 -> 172.31.31.144 OpenFlow 2218 Type: OFPT_MULTIPART_REPLY, OFPMP_FLOW
 65 0.818453777 172.31.24.227 -> 172.31.31.144 OpenFlow 978 Type: OFPT_MULTIPART_REPLY, OFPMP_PORT_STATS
 66 0.818711145 172.31.31.144 -> 172.31.24.227 TCP 66 6633 → 39464 [ACK] Seq=81 Ack=3065 Win=853 Len=0 TSval=391668 TSecr=118952278
 67 0.819178138 172.31.31.144 -> 172.31.24.227 OpenFlow 82 Type: OFPT_MULTIPART_REQUEST, OFPMP_TABLE
 68 0.819380563 172.31.24.227 -> 172.31.31.144 OpenFlow 6178 Type: OFPT_MULTIPART_REPLY, OFPMP_TABLE
 69 0.821411536 172.31.31.144 -> 172.31.24.227 TCP 122 6633 → 39482 [PSH, ACK] Seq=1 Ack=1 Win=853 Len=56 TSval=391668 TSecr=118951628
 70 0.821477156 172.31.31.144 -> 172.31.24.227 TCP 90 6633 → 39482 [PSH, ACK] Seq=57 Ack=1 Win=853 Len=24 TSval=391668 TSecr=118951628
 71 0.821569016 172.31.24.227 -> 172.31.31.144 OpenFlow 970 Type: OFPT_MULTIPART_REPLY, OFPMP_FLOW
 72 0.821703649 172.31.24.227 -> 172.31.31.144 OpenFlow 978 Type: OFPT_MULTIPART_REPLY, OFPMP_PORT_STATS
 73 0.821913019 172.31.31.144 -> 172.31.24.227 TCP 66 6633 → 39482 [ACK] Seq=81 Ack=1817 Win=853 Len=0 TSval=391668 TSecr=118952278
 74 0.822530352 172.31.31.144 -> 172.31.24.227 OpenFlow 82 Type: OFPT_MULTIPART_REQUEST, OFPMP_TABLE
 75 0.822788236 172.31.24.227 -> 172.31.31.144 OpenFlow 6178 Type: OFPT_MULTIPART_REPLY, OFPMP_TABLE
 76 0.825805752 172.31.31.144 -> 172.31.24.227 TCP 122 6633 → 39446 [PSH, ACK] Seq=1 Ack=1 Win=853 Len=56 TSval=391669 TSecr=118951628
 77 0.825832612 172.31.31.144 -> 172.31.24.227 TCP 90 6633 → 39446 [PSH, ACK] Seq=57 Ack=1 Win=853 Len=24 TSval=391669 TSecr=118951628
 78 0.825897432 172.31.24.227 -> 172.31.31.144 OpenFlow 1594 Type: OFPT_MULTIPART_REPLY, OFPMP_FLOW
 79 0.826065310 172.31.31.144 -> 172.31.24.227 TCP 66 6633 → 39490 [ACK] Seq=97 Ack=7913 Win=853 Len=0 TSval=391670 TSecr=118952270
 80 0.826079474 172.31.24.227 -> 172.31.31.144 OpenFlow 1090 Type: OFPT_MULTIPART_REPLY, OFPMP_PORT_STATS
 81 0.826139486 172.31.31.144 -> 172.31.24.227 TCP 66 6633 → 39446 [ACK] Seq=81 Ack=1529 Win=853 Len=0 TSval=391670 TSecr=118952279
 82 0.826284449 172.31.31.144 -> 172.31.24.227 TCP 66 6633 → 39446 [ACK] Seq=81 Ack=2553 Win=853 Len=0 TSval=391670 TSecr=118952280
 83 0.827985811 172.31.31.144 -> 172.31.24.227 OpenFlow 82 Type: OFPT_MULTIPART_REQUEST, OFPMP_TABLE
 84 0.827999272 172.31.31.144 -> 172.31.24.227 TCP 90 6633 → 39484 [PSH, ACK] Seq=1 Ack=1 Win=853 Len=24 TSval=391670 TSecr=118951628
 85 0.828266713 172.31.24.227 -> 172.31.31.144 OpenFlow 6178 Type: OFPT_MULTIPART_REPLY, OFPMP_TABLE
 86 0.828494539 172.31.24.227 -> 172.31.31.144 OpenFlow 1090 Type: OFPT_MULTIPART_REPLY, OFPMP_PORT_STATS
 87 0.829230128 172.31.31.144 -> 172.31.24.227 OpenFlow 122 Type: OFPT_MULTIPART_REQUEST, OFPMP_FLOW
 88 0.829267430 172.31.31.144 -> 172.31.24.227 OpenFlow 82 Type: OFPT_MULTIPART_REQUEST, OFPMP_TABLE
 89 0.829456308 172.31.24.227 -> 172.31.31.144 OpenFlow 1802 Type: OFPT_MULTIPART_REPLY, OFPMP_FLOW
 90 0.829608685 172.31.24.227 -> 172.31.31.144 OpenFlow 6178 Type: OFPT_MULTIPART_REPLY, OFPMP_TABLE
 91 0.829886990 172.31.31.144 -> 172.31.24.227 TCP 66 6633 → 39484 [ACK] Seq=97 Ack=8873 Win=853 Len=0 TSval=391670 TSecr=118952280
 92 0.834115336 172.31.31.144 -> 172.31.24.227 TCP 66 6633 → 39458 [ACK] Seq=97 Ack=9513 Win=853 Len=0 TSval=391672 TSecr=118952272
 93 0.838095377 172.31.31.144 -> 172.31.24.227 TCP 66 6633 → 39476 [ACK] Seq=97 Ack=8521 Win=853 Len=0 TSval=391673 TSecr=118952273
 94 0.839433305 172.31.31.144 -> 172.31.24.227 TCP 90 6633 → 39462 [PSH, ACK] Seq=1 Ack=1 Win=853 Len=24 TSval=391673 TSecr=118951629
 95 0.839458353 172.31.31.144 -> 172.31.24.227 TCP 122 6633 → 39462 [PSH, ACK] Seq=25 Ack=1 Win=853 Len=56 TSval=391673 TSecr=118951629
 96 0.839623503 172.31.24.227 -> 172.31.31.144 OpenFlow 866 Type: OFPT_MULTIPART_REPLY, OFPMP_PORT_STATS
 97 0.839692205 172.31.24.227 -> 172.31.31.144 OpenFlow 554 Type: OFPT_MULTIPART_REPLY, OFPMP_FLOW
 98 0.839919088 172.31.31.144 -> 172.31.24.227 TCP 66 6633 → 39462 [ACK] Seq=81 Ack=801 Win=853 Len=0 TSval=391673 TSecr=118952283
 99 0.839936163 172.31.31.144 -> 172.31.24.227 TCP 66 6633 → 39462 [ACK] Seq=81 Ack=1289 Win=853 Len=0 TSval=391673 TSecr=118952283
100 0.840594177 172.31.31.144 -> 172.31.24.227 OpenFlow 82 Type: OFPT_MULTIPART_REQUEST, OFPMP_TABLE
101 0.840797308 172.31.24.227 -> 172.31.31.144 OpenFlow 6178 Type: OFPT_MULTIPART_REPLY, OFPMP_TABLE
102 0.841811219 172.31.31.144 -> 172.31.24.227 TCP 90 6633 → 39478 [PSH, ACK] Seq=1 Ack=1 Win=853 Len=24 TSval=391673 TSecr=118951629
103 0.842043384 172.31.24.227 -> 172.31.31.144 OpenFlow 754 Type: OFPT_MULTIPART_REPLY, OFPMP_PORT_STATS
104 0.843047513 172.31.31.144 -> 172.31.24.227 OpenFlow 82 Type: OFPT_MULTIPART_REQUEST, OFPMP_TABLE
105 0.843067943 172.31.31.144 -> 172.31.24.227 OpenFlow 122 Type: OFPT_MULTIPART_REQUEST, OFPMP_FLOW
106 0.843338902 172.31.24.227 -> 172.31.31.144 OpenFlow 6178 Type: OFPT_MULTIPART_REPLY, OFPMP_TABLE
107 0.843401985 172.31.24.227 -> 172.31.31.144 OpenFlow 1178 Type: OFPT_MULTIPART_REPLY, OFPMP_FLOW
108 0.843704903 172.31.31.144 -> 172.31.24.227 TCP 66 6633 → 39478 [ACK] Seq=97 Ack=7913 Win=853 Len=0 TSval=391674 TSecr=118952284
109 0.846195238 172.31.31.144 -> 172.31.24.227 TCP 90 6633 → 39450 [PSH, ACK] Seq=1 Ack=1 Win=853 Len=24 TSval=391675 TSecr=118951628
110 0.846210614 172.31.31.144 -> 172.31.24.227 TCP 122 6633 → 39448 [PSH, ACK] Seq=1 Ack=1 Win=853 Len=56 TSval=391675 TSecr=118951742
111 0.846292551 172.31.31.144 -> 172.31.24.227 TCP 122 6633 → 39450 [PSH, ACK] Seq=25 Ack=1 Win=853 Len=56 TSval=391675 TSecr=118951628
112 0.846304875 172.31.24.227 -> 172.31.31.144 OpenFlow 762 Type: OFPT_MULTIPART_REPLY, OFPMP_FLOW
113 0.846313258 172.31.31.144 -> 172.31.24.227 OpenFlow 90 Type: OFPT_MULTIPART_REQUEST, OFPMP_PORT_STATS
114 0.846407037 172.31.24.227 -> 172.31.31.144 OpenFlow 754 Type: OFPT_MULTIPART_REPLY, OFPMP_PORT_STATS
115 0.846553564 172.31.24.227 -> 172.31.31.144 OpenFlow 1090 Type: OFPT_MULTIPART_REPLY, OFPMP_PORT_STATS
116 0.846613958 172.31.24.227 -> 172.31.31.144 OpenFlow 2010 Type: OFPT_MULTIPART_REPLY, OFPMP_FLOW
117 0.846681911 172.31.31.144 -> 172.31.24.227 TCP 66 6633 → 39448 [ACK] Seq=81 Ack=1385 Win=853 Len=0 TSval=391675 TSecr=118952285
118 0.846847505 172.31.31.144 -> 172.31.24.227 TCP 66 6633 → 39450 [ACK] Seq=81 Ack=2969 Win=853 Len=0 TSval=391675 TSecr=118952285
119 0.847357646 172.31.31.144 -> 172.31.24.227 OpenFlow 82 Type: OFPT_MULTIPART_REQUEST, OFPMP_TABLE
120 0.847549639 172.31.24.227 -> 172.31.31.144 OpenFlow 6178 Type: OFPT_MULTIPART_REPLY, OFPMP_TABLE
121 0.849560867 172.31.31.144 -> 172.31.24.227 OpenFlow 82 Type: OFPT_MULTIPART_REQUEST, OFPMP_TABLE
122 0.849848364 172.31.24.227 -> 172.31.31.144 OpenFlow 6178 Type: OFPT_MULTIPART_REPLY, OFPMP_TABLE
123 0.850021523 172.31.31.144 -> 172.31.24.227 TCP 66 6633 → 39480 [ACK] Seq=97 Ack=8233 Win=853 Len=0 TSval=391676 TSecr=118952275
124 0.851780088 172.31.31.144 -> 172.31.24.227 TCP 90 6633 → 39454 [PSH, ACK] Seq=1 Ack=1 Win=853 Len=24 TSval=391676 TSecr=118951628
125 0.851958654 172.31.24.227 -> 172.31.31.144 OpenFlow 866 Type: OFPT_MULTIPART_REPLY, OFPMP_PORT_STATS
126 0.853027601 172.31.31.144 -> 172.31.24.227 OpenFlow 82 Type: OFPT_MULTIPART_REQUEST, OFPMP_TABLE
127 0.853055330 172.31.31.144 -> 172.31.24.227 OpenFlow 122 Type: OFPT_MULTIPART_REQUEST, OFPMP_FLOW
128 0.853235935 172.31.24.227 -> 172.31.31.144 OpenFlow 6178 Type: OFPT_MULTIPART_REPLY, OFPMP_TABLE
129 0.853341191 172.31.24.227 -> 172.31.31.144 OpenFlow 1178 Type: OFPT_MULTIPART_REPLY, OFPMP_FLOW
130 0.853644454 172.31.31.144 -> 172.31.24.227 TCP 66 6633 → 39454 [ACK] Seq=97 Ack=8025 Win=853 Len=0 TSval=391676 TSecr=118952286
131 0.856213108 172.31.31.144 -> 172.31.24.227 TCP 122 6633 → 39474 [PSH, ACK] Seq=1 Ack=1 Win=853 Len=56 TSval=391677 TSecr=118951629
132 0.856221571 172.31.31.144 -> 172.31.24.227 TCP 122 6633 → 39470 [PSH, ACK] Seq=1 Ack=1 Win=853 Len=56 TSval=391677 TSecr=118951627
133 0.856259027 172.31.31.144 -> 172.31.24.227 TCP 90 6633 → 39474 [PSH, ACK] Seq=57 Ack=1 Win=853 Len=24 TSval=391677 TSecr=118951629
134 0.856283943 172.31.31.144 -> 172.31.24.227 TCP 106 6633 → 39470 [PSH, ACK] Seq=57 Ack=1 Win=853 Len=40 TSval=391677 TSecr=118951627
135 0.856405308 172.31.24.227 -> 172.31.31.144 OpenFlow 2842 Type: OFPT_MULTIPART_REPLY, OFPMP_FLOW
136 0.856518851 172.31.24.227 -> 172.31.31.144 OpenFlow 754 Type: OFPT_MULTIPART_REPLY, OFPMP_PORT_STATS
137 0.856660986 172.31.24.227 -> 172.31.31.144 OpenFlow 6178 Type: OFPT_MULTIPART_REPLY, OFPMP_TABLE
138 0.856736847 172.31.31.144 -> 172.31.24.227 TCP 66 6633 → 39470 [ACK] Seq=97 Ack=2777 Win=853 Len=0 TSval=391677 TSecr=118952287
139 0.856751440 172.31.24.227 -> 172.31.31.144 OpenFlow 2218 Type: OFPT_MULTIPART_REPLY, OFPMP_FLOW
140 0.856760028 172.31.31.144 -> 172.31.24.227 TCP 66 6633 → 39470 [ACK] Seq=97 Ack=3465 Win=853 Len=0 TSval=391677 TSecr=118952287
141 0.856873431 172.31.24.227 -> 172.31.31.144 OpenFlow 978 Type: OFPT_MULTIPART_REPLY, OFPMP_PORT_STATS
142 0.856918029 172.31.31.144 -> 172.31.24.227 TCP 66 6633 → 39470 [ACK] Seq=97 Ack=9577 Win=853 Len=0 TSval=391677 TSecr=118952287
143 0.857176698 172.31.31.144 -> 172.31.24.227 TCP 66 6633 → 39474 [ACK] Seq=81 Ack=3065 Win=853 Len=0 TSval=391677 TSecr=118952287
144 0.857351059 172.31.31.144 -> 172.31.24.227 OpenFlow 82 Type: OFPT_MULTIPART_REQUEST, OFPMP_TABLE
145 0.857583593 172.31.24.227 -> 172.31.31.144 OpenFlow 6178 Type: OFPT_MULTIPART_REPLY, OFPMP_TABLE
146 0.858030518 172.31.31.144 -> 172.31.24.227 TCP 66 6633 → 39464 [ACK] Seq=97 Ack=9177 Win=853 Len=0 TSval=391678 TSecr=118952278
147 0.862048279 172.31.31.144 -> 172.31.24.227 TCP 66 6633 → 39482 [ACK] Seq=97 Ack=7929 Win=853 Len=0 TSval=391679 TSecr=118952279
148 0.866065659 172.31.31.144 -> 172.31.24.227 TCP 66 6633 → 39446 [ACK] Seq=97 Ack=8665 Win=853 Len=0 TSval=391680 TSecr=118952280
149 0.868654581 172.31.31.144 -> 172.31.24.227 TCP 122 6633 → 39488 [PSH, ACK] Seq=1 Ack=1 Win=853 Len=56 TSval=391680 TSecr=118951628
150 0.868661854 172.31.31.144 -> 172.31.24.227 TCP 90 6633 → 39468 [PSH, ACK] Seq=1 Ack=1 Win=853 Len=24 TSval=391680 TSecr=118951629
151 0.868664210 172.31.31.144 -> 172.31.24.227 TCP 90 6633 → 39488 [PSH, ACK] Seq=57 Ack=1 Win=853 Len=24 TSval=391680 TSecr=118951628
152 0.868874695 172.31.24.227 -> 172.31.31.144 OpenFlow 978 Type: OFPT_MULTIPART_REPLY, OFPMP_PORT_STATS
153 0.869003193 172.31.24.227 -> 172.31.31.144 OpenFlow 2842 Type: OFPT_MULTIPART_REPLY, OFPMP_FLOW
154 0.869084230 172.31.24.227 -> 172.31.31.144 OpenFlow 642 Type: OFPT_MULTIPART_REPLY, OFPMP_PORT_STATS
155 0.869141776 172.31.31.144 -> 172.31.24.227 TCP 66 6633 → 39468 [ACK] Seq=25 Ack=913 Win=853 Len=0 TSval=391680 TSecr=118952290
156 0.869303151 172.31.31.144 -> 172.31.24.227 TCP 66 6633 → 39488 [ACK] Seq=81 Ack=2777 Win=853 Len=0 TSval=391680 TSecr=118952290
157 0.869320994 172.31.31.144 -> 172.31.24.227 TCP 66 6633 → 39488 [ACK] Seq=81 Ack=3353 Win=853 Len=0 TSval=391680 TSecr=118952290
158 0.869842645 172.31.31.144 -> 172.31.24.227 OpenFlow 82 Type: OFPT_MULTIPART_REQUEST, OFPMP_TABLE
159 0.870117790 172.31.24.227 -> 172.31.31.144 OpenFlow 6178 Type: OFPT_MULTIPART_REPLY, OFPMP_TABLE
160 0.872104581 172.31.31.144 -> 172.31.24.227 OpenFlow 122 Type: OFPT_MULTIPART_REQUEST, OFPMP_FLOW
161 0.872289940 172.31.24.227 -> 172.31.31.144 OpenFlow 2426 Type: OFPT_MULTIPART_REPLY, OFPMP_FLOW
162 0.876332233 172.31.31.144 -> 172.31.24.227 OpenFlow 82 Type: OFPT_MULTIPART_REQUEST, OFPMP_TABLE
163 0.876573832 172.31.24.227 -> 172.31.31.144 OpenFlow 6178 Type: OFPT_MULTIPART_REPLY, OFPMP_TABLE
164 0.878058808 172.31.31.144 -> 172.31.24.227 TCP 66 6633 → 39462 [ACK] Seq=97 Ack=7401 Win=853 Len=0 TSval=391683 TSecr=118952283
165 0.879527330 172.31.31.144 -> 172.31.24.227 TCP 122 6633 → 39460 [PSH, ACK] Seq=1 Ack=1 Win=853 Len=56 TSval=391683 TSecr=118951628
166 0.879551067 172.31.31.144 -> 172.31.24.227 TCP 90 6633 → 39456 [PSH, ACK] Seq=1 Ack=1 Win=853 Len=24 TSval=391683 TSecr=118951738
167 0.879592566 172.31.31.144 -> 172.31.24.227 TCP 138 6633 → 39456 [PSH, ACK] Seq=25 Ack=1 Win=853 Len=72 TSval=391683 TSecr=118951738
168 0.879632629 172.31.31.144 -> 172.31.24.227 TCP 106 6633 → 39460 [PSH, ACK] Seq=57 Ack=1 Win=853 Len=40 TSval=391683 TSecr=118951628
169 0.879741231 172.31.24.227 -> 172.31.31.144 OpenFlow 866 Type: OFPT_MULTIPART_REPLY, OFPMP_PORT_STATS
170 0.879802748 172.31.24.227 -> 172.31.31.144 OpenFlow 1594 Type: OFPT_MULTIPART_REPLY, OFPMP_FLOW
171 0.879950924 172.31.24.227 -> 172.31.31.144 OpenFlow 6178 Type: OFPT_MULTIPART_REPLY, OFPMP_TABLE
172 0.880030361 172.31.24.227 -> 172.31.31.144 OpenFlow 2010 Type: OFPT_MULTIPART_REPLY, OFPMP_FLOW
173 0.880078291 172.31.31.144 -> 172.31.24.227 TCP 66 6633 → 39456 [ACK] Seq=97 Ack=2329 Win=853 Len=0 TSval=391683 TSecr=118952293
174 0.880182368 172.31.24.227 -> 172.31.31.144 OpenFlow 6178 Type: OFPT_MULTIPART_REPLY, OFPMP_TABLE
175 0.880260336 172.31.31.144 -> 172.31.24.227 TCP 66 6633 → 39460 [ACK] Seq=97 Ack=1945 Win=853 Len=0 TSval=391683 TSecr=118952293
176 0.880287479 172.31.24.227 -> 172.31.31.144 OpenFlow 642 Type: OFPT_MULTIPART_REPLY, OFPMP_PORT_STATS
177 0.880419545 172.31.31.144 -> 172.31.24.227 TCP 66 6633 → 39460 [ACK] Seq=97 Ack=8057 Win=853 Len=0 TSval=391683 TSecr=118952293
178 0.880485455 172.31.31.144 -> 172.31.24.227 TCP 66 6633 → 39460 [ACK] Seq=97 Ack=8633 Win=853 Len=0 TSval=391683 TSecr=118952293
179 0.880680056 172.31.31.144 -> 172.31.24.227 TCP 90 6633 → 39472 [PSH, ACK] Seq=1 Ack=1 Win=853 Len=24 TSval=391683 TSecr=118951629
180 0.880745114 172.31.31.144 -> 172.31.24.227 TCP 138 6633 → 39472 [PSH, ACK] Seq=25 Ack=1 Win=853 Len=72 TSval=391683 TSecr=118951629
181 0.880864373 172.31.24.227 -> 172.31.31.144 OpenFlow 642 Type: OFPT_MULTIPART_REPLY, OFPMP_PORT_STATS
182 0.880940106 172.31.24.227 -> 172.31.31.144 OpenFlow 2634 Type: OFPT_MULTIPART_REPLY, OFPMP_FLOW
183 0.881089200 172.31.24.227 -> 172.31.31.144 OpenFlow 6178 Type: OFPT_MULTIPART_REPLY, OFPMP_TABLE
184 0.881144840 172.31.31.144 -> 172.31.24.227 TCP 66 6633 → 39472 [ACK] Seq=97 Ack=577 Win=853 Len=0 TSval=391683 TSecr=118952293
185 0.881149625 172.31.31.144 -> 172.31.24.227 TCP 66 6633 → 39472 [ACK] Seq=97 Ack=3145 Win=853 Len=0 TSval=391683 TSecr=118952293
186 0.881331249 172.31.31.144 -> 172.31.24.227 TCP 66 6633 → 39472 [ACK] Seq=97 Ack=9257 Win=853 Len=0 TSval=391683 TSecr=118952293
187 0.884911733 172.31.31.144 -> 172.31.24.227 TCP 90 6633 → 39466 [PSH, ACK] Seq=1 Ack=1 Win=853 Len=24 TSval=391684 TSecr=118951627
188 0.885150088 172.31.24.227 -> 172.31.31.144 OpenFlow 1202 Type: OFPT_MULTIPART_REPLY, OFPMP_PORT_STATS
189 0.886060973 172.31.31.144 -> 172.31.24.227 TCP 66 6633 → 39448 [ACK] Seq=97 Ack=7497 Win=853 Len=0 TSval=391685 TSecr=118952285
190 0.886108703 172.31.31.144 -> 172.31.24.227 OpenFlow 122 Type: OFPT_MULTIPART_REQUEST, OFPMP_FLOW
191 0.886128875 172.31.31.144 -> 172.31.24.227 OpenFlow 82 Type: OFPT_MULTIPART_REQUEST, OFPMP_TABLE
192 0.886273655 172.31.24.227 -> 172.31.31.144 OpenFlow 3050 Type: OFPT_MULTIPART_REPLY, OFPMP_FLOW
193 0.886427285 172.31.24.227 -> 172.31.31.144 OpenFlow 6178 Type: OFPT_MULTIPART_REPLY, OFPMP_TABLE
194 0.886667323 172.31.31.144 -> 172.31.24.227 TCP 66 6633 → 39466 [ACK] Seq=97 Ack=10233 Win=853 Len=0 TSval=391685 TSecr=118952295
195 0.890049386 172.31.31.144 -> 172.31.24.227 TCP 66 6633 → 39450 [ACK] Seq=97 Ack=9081 Win=853 Len=0 TSval=391686 TSecr=118952285
196 0.894081352 172.31.31.144 -> 172.31.24.227 TCP 66 6633 → 39474 [ACK] Seq=97 Ack=9177 Win=853 Len=0 TSval=391687 TSecr=118952287
197 0.910123271 172.31.31.144 -> 172.31.24.227 TCP 66 6633 → 39488 [ACK] Seq=97 Ack=9465 Win=853 Len=0 TSval=391691 TSecr=118952291
198 0.914097590 172.31.31.144 -> 172.31.24.227 TCP 66 6633 → 39468 [ACK] Seq=97 Ack=9385 Win=853 Len=0 TSval=391692 TSecr=118952292
199 0.918091331 172.31.31.144 -> 172.31.24.227 TCP 66 6633 → 39456 [ACK] Seq=97 Ack=8441 Win=853 Len=0 TSval=391693 TSecr=118952293
200 0.926965843 172.31.24.227 -> 41.177.127.217 SSH 98 Server: Encrypted packet (len=44)
201 1.109493597 172.31.31.144 -> 172.31.24.227 OpenFlow 187 Type: OFPT_PACKET_OUT
202 1.109517972 172.31.31.144 -> 172.31.24.227 OpenFlow 187 Type: OFPT_PACKET_OUT
203 1.109534489 172.31.31.144 -> 172.31.24.227 OpenFlow 187 Type: OFPT_PACKET_OUT
204 1.109583831 172.31.31.144 -> 172.31.24.227 OpenFlow 187 Type: OFPT_PACKET_OUT
205 1.109660965 172.31.31.144 -> 172.31.24.227 OpenFlow 187 Type: OFPT_PACKET_OUT
206 1.109671094 172.31.24.227 -> 172.31.31.144 TCP 66 39480 → 6633 [ACK] Seq=8233 Ack=702 Win=80 Len=0 TSval=118952350 TSecr=391740
207 1.109729592 172.31.31.144 -> 172.31.24.227 OpenFlow 187 Type: OFPT_PACKET_OUT
208 1.109829488 172.31.31.144 -> 172.31.24.227 OpenFlow 187 Type: OFPT_PACKET_OUT
209 1.109916209 172.31.31.144 -> 172.31.24.227 OpenFlow 187 Type: OFPT_PACKET_OUT
210 1.110000604 172.31.31.144 -> 172.31.24.227 OpenFlow 187 Type: OFPT_PACKET_OUT
211 1.110104769 172.31.31.144 -> 172.31.24.227 OpenFlow 187 Type: OFPT_PACKET_OUT
212 1.110111728 172.31.24.227 -> 172.31.31.144 TCP 66 39480 → 6633 [ACK] Seq=8233 Ack=1307 Win=80 Len=0 TSval=118952351 TSecr=391740
213 1.110183474 172.31.31.144 -> 172.31.24.227 OpenFlow 187 Type: OFPT_PACKET_OUT
214 1.110286416 172.31.31.144 -> 172.31.24.227 OpenFlow 187 Type: OFPT_PACKET_OUT
215 1.110422781 172.31.31.144 -> 172.31.24.227 OpenFlow 187 Type: OFPT_PACKET_OUT
216 1.110444267 172.31.31.144 -> 172.31.24.227 OpenFlow 187 Type: OFPT_PACKET_OUT
217 1.110455283 172.31.24.227 -> 172.31.31.144 TCP 66 39480 → 6633 [ACK] Seq=8233 Ack=1549 Win=80 Len=0 TSval=118952351 TSecr=391741
218 1.110499175 172.31.31.144 -> 172.31.24.227 OpenFlow 187 Type: OFPT_PACKET_OUT
219 1.110548124 172.31.24.227 -> 172.31.31.144 OpenFlow 189 Type: OFPT_PACKET_IN
220 1.110558612 172.31.31.144 -> 172.31.24.227 OpenFlow 187 Type: OFPT_PACKET_OUT
221 1.110572637 172.31.24.227 -> 172.31.31.144 OpenFlow 189 Type: OFPT_PACKET_IN
222 1.110592377 172.31.24.227 -> 172.31.31.144 OpenFlow 312 Type: OFPT_PACKET_IN
223 1.110625114 172.31.24.227 -> 172.31.31.144 OpenFlow 189 Type: OFPT_PACKET_IN
224 1.110642359 172.31.31.144 -> 172.31.24.227 OpenFlow 187 Type: OFPT_PACKET_OUT
225 1.110646890 172.31.24.227 -> 172.31.31.144 TCP 66 39456 → 6633 [ACK] Seq=8441 Ack=702 Win=70 Len=0 TSval=118952351 TSecr=391741
226 1.110652685 172.31.24.227 -> 172.31.31.144 OpenFlow 189 Type: OFPT_PACKET_IN
227 1.110711301 172.31.31.144 -> 172.31.24.227 OpenFlow 187 Type: OFPT_PACKET_OUT
228 1.110795407 172.31.31.144 -> 172.31.24.227 OpenFlow 187 Type: OFPT_PACKET_OUT
229 1.110821827 172.31.31.144 -> 172.31.24.227 TCP 66 6633 → 39492 [ACK] Seq=97 Ack=7828 Win=853 Len=0 TSval=391741 TSecr=118952351
230 1.110832016 172.31.31.144 -> 172.31.24.227 TCP 66 6633 → 39484 [ACK] Seq=97 Ack=9365 Win=853 Len=0 TSval=391741 TSecr=118952351
231 1.110842869 172.31.31.144 -> 172.31.24.227 OpenFlow 187 Type: OFPT_PACKET_OUT
232 1.110865283 172.31.31.144 -> 172.31.24.227 TCP 66 6633 → 39492 [ACK] Seq=97 Ack=7951 Win=853 Len=0 TSval=391741 TSecr=118952351
233 1.110884367 172.31.31.144 -> 172.31.24.227 OpenFlow 187 Type: OFPT_PACKET_OUT
234 1.110963887 172.31.31.144 -> 172.31.24.227 OpenFlow 187 Type: OFPT_PACKET_OUT
235 1.110970023 172.31.24.227 -> 172.31.31.144 TCP 66 39456 → 6633 [ACK] Seq=8441 Ack=1307 Win=70 Len=0 TSval=118952351 TSecr=391741
236 1.111041203 172.31.31.144 -> 172.31.24.227 OpenFlow 187 Type: OFPT_PACKET_OUT
237 1.111126618 172.31.31.144 -> 172.31.24.227 OpenFlow 187 Type: OFPT_PACKET_OUT
238 1.111224961 172.31.31.144 -> 172.31.24.227 OpenFlow 187 Type: OFPT_PACKET_OUT
239 1.111284100 172.31.31.144 -> 172.31.24.227 OpenFlow 187 Type: OFPT_PACKET_OUT
240 1.111343396 172.31.24.227 -> 172.31.31.144 TCP 66 39456 → 6633 [ACK] Seq=8441 Ack=1549 Win=70 Len=0 TSval=118952351 TSecr=391741
241 1.111353594 172.31.31.144 -> 172.31.24.227 OpenFlow 187 Type: OFPT_PACKET_OUT
242 1.111418412 172.31.24.227 -> 172.31.31.144 OpenFlow 189 Type: OFPT_PACKET_IN
243 1.111439948 172.31.24.227 -> 172.31.31.144 OpenFlow 189 Type: OFPT_PACKET_IN
244 1.111458056 172.31.24.227 -> 172.31.31.144 OpenFlow 189 Type: OFPT_PACKET_IN
245 1.111486577 172.31.24.227 -> 172.31.31.144 OpenFlow 681 Type: OFPT_PACKET_IN
246 1.111607939 172.31.31.144 -> 172.31.24.227 TCP 66 6633 → 39458 [ACK] Seq=97 Ack=9636 Win=853 Len=0 TSval=391741 TSecr=118952351
247 1.111626406 172.31.31.144 -> 172.31.24.227 TCP 66 6633 → 39458 [ACK] Seq=97 Ack=9759 Win=853 Len=0 TSval=391741 TSecr=118952351
248 1.111643746 172.31.31.144 -> 172.31.24.227 TCP 66 6633 → 39464 [ACK] Seq=97 Ack=9300 Win=853 Len=0 TSval=391741 TSecr=118952351
249 1.111648863 172.31.24.227 -> 172.31.31.144 TCP 66 39486 → 6633 [ACK] Seq=8633 Ack=460 Win=81 Len=0 TSval=118952351 TSecr=391741
250 1.111665219 172.31.31.144 -> 172.31.24.227 TCP 66 6633 → 39464 [ACK] Seq=97 Ack=9915 Win=853 Len=0 TSval=391741 TSecr=118952351
251 1.111770681 172.31.24.227 -> 172.31.31.144 OpenFlow 189 Type: OFPT_PACKET_IN
252 1.111791669 172.31.24.227 -> 172.31.31.144 OpenFlow 681 Type: OFPT_PACKET_IN
253 1.111808919 172.31.24.227 -> 172.31.31.144 OpenFlow 189 Type: OFPT_PACKET_IN
254 1.111827934 172.31.24.227 -> 172.31.31.144 OpenFlow 189 Type: OFPT_PACKET_IN
255 1.111861927 172.31.24.227 -> 172.31.31.144 OpenFlow 189 Type: OFPT_PACKET_IN
256 1.111866568 172.31.24.227 -> 172.31.31.144 OpenFlow 189 Type: OFPT_PACKET_IN
257 1.111890774 172.31.24.227 -> 172.31.31.144 OpenFlow 189 Type: OFPT_PACKET_IN
258 1.111929556 172.31.24.227 -> 172.31.31.144 OpenFlow 189 Type: OFPT_PACKET_IN
259 1.111981993 172.31.31.144 -> 172.31.24.227 TCP 66 6633 → 39446 [ACK] Seq=97 Ack=8788 Win=853 Len=0 TSval=391741 TSecr=118952351
260 1.111999037 172.31.31.144 -> 172.31.24.227 TCP 66 6633 → 39446 [ACK] Seq=97 Ack=9403 Win=853 Len=0 TSval=391741 TSecr=118952351
261 1.112031037 172.31.31.144 -> 172.31.24.227 TCP 66 6633 → 39448 [ACK] Seq=97 Ack=7620 Win=853 Len=0 TSval=391741 TSecr=118952351
262 1.112051406 172.31.31.144 -> 172.31.24.227 TCP 66 6633 → 39450 [ACK] Seq=97 Ack=9204 Win=853 Len=0 TSval=391741 TSecr=118952351
263 1.112071128 172.31.31.144 -> 172.31.24.227 TCP 66 6633 → 39450 [ACK] Seq=97 Ack=9327 Win=853 Len=0 TSval=391741 TSecr=118952351
264 1.112091318 172.31.31.144 -> 172.31.24.227 TCP 66 6633 → 39448 [ACK] Seq=97 Ack=7743 Win=853 Len=0 TSval=391741 TSecr=118952351
265 1.112111141 172.31.31.144 -> 172.31.24.227 TCP 66 6633 → 39472 [ACK] Seq=97 Ack=9380 Win=853 Len=0 TSval=391741 TSecr=118952351
266 1.112131846 172.31.31.144 -> 172.31.24.227 TCP 66 6633 → 39472 [ACK] Seq=97 Ack=9503 Win=853 Len=0 TSval=391741 TSecr=118952351
267 1.113304552 172.31.31.144 -> 172.31.24.227 OpenFlow 187 Type: OFPT_PACKET_OUT
268 1.113428481 172.31.31.144 -> 172.31.24.227 OpenFlow 187 Type: OFPT_PACKET_OUT
269 1.113454645 172.31.24.227 -> 172.31.31.144 TCP 66 39486 → 6633 [ACK] Seq=8633 Ack=702 Win=81 Len=0 TSval=118952351 TSecr=391741
270 1.113531100 172.31.31.144 -> 172.31.24.227 OpenFlow 187 Type: OFPT_PACKET_OUT
271 1.113637628 172.31.31.144 -> 172.31.24.227 OpenFlow 187 Type: OFPT_PACKET_OUT
272 1.113688862 172.31.24.227 -> 172.31.31.144 OpenFlow 189 Type: OFPT_PACKET_IN
273 1.113755638 172.31.31.144 -> 172.31.24.227 OpenFlow 187 Type: OFPT_PACKET_OUT
274 1.113830831 172.31.24.227 -> 172.31.31.144 TCP 66 39486 → 6633 [ACK] Seq=8633 Ack=1065 Win=81 Len=0 TSval=118952351 TSecr=391741
275 1.114010542 172.31.31.144 -> 172.31.24.227 OpenFlow 187 Type: OFPT_PACKET_OUT
276 1.114087362 172.31.31.144 -> 172.31.24.227 OpenFlow 187 Type: OFPT_PACKET_OUT
277 1.114110090 172.31.24.227 -> 172.31.31.144 TCP 66 39468 → 6633 [ACK] Seq=9385 Ack=339 Win=82 Len=0 TSval=118952352 TSecr=391742
278 1.114178596 172.31.24.227 -> 172.31.31.144 OpenFlow 189 Type: OFPT_PACKET_IN
279 1.114200665 172.31.24.227 -> 172.31.31.144 OpenFlow 189 Type: OFPT_PACKET_IN
280 1.114224814 172.31.24.227 -> 172.31.31.144 OpenFlow 189 Type: OFPT_PACKET_IN
281 1.114253065 172.31.24.227 -> 172.31.31.144 OpenFlow 312 Type: OFPT_PACKET_IN
282 1.114368644 172.31.31.144 -> 172.31.24.227 TCP 66 6633 → 39470 [ACK] Seq=97 Ack=9700 Win=853 Len=0 TSval=391742 TSecr=118952352
283 1.114383885 172.31.31.144 -> 172.31.24.227 TCP 66 6633 → 39470 [ACK] Seq=97 Ack=9823 Win=853 Len=0 TSval=391742 TSecr=118952352
284 1.114465431 172.31.31.144 -> 172.31.24.227 TCP 66 6633 → 39478 [ACK] Seq=97 Ack=8405 Win=853 Len=0 TSval=391742 TSecr=118952351
285 1.114522318 172.31.31.144 -> 172.31.24.227 OpenFlow 187 Type: OFPT_PACKET_OUT
286 1.114578456 172.31.31.144 -> 172.31.24.227 OpenFlow 187 Type: OFPT_PACKET_OUT
287 1.114668672 172.31.31.144 -> 172.31.24.227 OpenFlow 187 Type: OFPT_PACKET_OUT
288 1.114727246 172.31.24.227 -> 172.31.31.144 TCP 66 39468 → 6633 [ACK] Seq=9385 Ack=702 Win=82 Len=0 TSval=118952352 TSecr=391742
289 1.114907158 172.31.24.227 -> 172.31.31.144 OpenFlow 189 Type: OFPT_PACKET_IN
290 1.114927845 172.31.24.227 -> 172.31.31.144 OpenFlow 189 Type: OFPT_PACKET_IN
291 1.114974554 172.31.31.144 -> 172.31.24.227 OpenFlow 187 Type: OFPT_PACKET_OUT
292 1.115044520 172.31.31.144 -> 172.31.24.227 OpenFlow 187 Type: OFPT_PACKET_OUT
293 1.115095329 172.31.31.144 -> 172.31.24.227 TCP 66 6633 → 39464 [ACK] Seq=97 Ack=10038 Win=853 Len=0 TSval=391742 TSecr=118952352
294 1.115115206 172.31.31.144 -> 172.31.24.227 TCP 66 6633 → 39464 [ACK] Seq=97 Ack=10161 Win=853 Len=0 TSval=391742 TSecr=118952352
295 1.115136188 172.31.31.144 -> 172.31.24.227 OpenFlow 187 Type: OFPT_PACKET_OUT
296 1.115199735 172.31.31.144 -> 172.31.24.227 OpenFlow 187 Type: OFPT_PACKET_OUT
297 1.115258295 172.31.24.227 -> 172.31.31.144 TCP 66 39468 → 6633 [ACK] Seq=9385 Ack=1186 Win=82 Len=0 TSval=118952352 TSecr=391742
298 1.115273995 172.31.31.144 -> 172.31.24.227 OpenFlow 187 Type: OFPT_PACKET_OUT
299 1.115338036 172.31.31.144 -> 172.31.24.227 OpenFlow 187 Type: OFPT_PACKET_OUT
300 1.115371933 172.31.24.227 -> 172.31.31.144 TCP 66 39468 → 6633 [ACK] Seq=9385 Ack=1428 Win=82 Len=0 TSval=118952352 TSecr=391742
301 1.115415072 172.31.31.144 -> 172.31.24.227 OpenFlow 187 Type: OFPT_PACKET_OUT
302 1.115477493 172.31.31.144 -> 172.31.24.227 OpenFlow 187 Type: OFPT_PACKET_OUT
303 1.115553941 172.31.31.144 -> 172.31.24.227 OpenFlow 187 Type: OFPT_PACKET_OUT
304 1.115652334 172.31.24.227 -> 172.31.31.144 OpenFlow 189 Type: OFPT_PACKET_IN
305 1.115662612 172.31.31.144 -> 172.31.24.227 OpenFlow 187 Type: OFPT_PACKET_OUT
306 1.115676327 172.31.24.227 -> 172.31.31.144 OpenFlow 189 Type: OFPT_PACKET_IN
307 1.115701820 172.31.31.144 -> 172.31.24.227 OpenFlow 187 Type: OFPT_PACKET_OUT
308 1.115707173 172.31.24.227 -> 172.31.31.144 OpenFlow 558 Type: OFPT_PACKET_IN
309 1.115778536 172.31.31.144 -> 172.31.24.227 OpenFlow 187 Type: OFPT_PACKET_OUT
310 1.115831033 172.31.24.227 -> 172.31.31.144 TCP 66 39466 → 6633 [ACK] Seq=10233 Ack=460 Win=385 Len=0 TSval=118952352 TSecr=391742
311 1.115842053 172.31.31.144 -> 172.31.24.227 OpenFlow 187 Type: OFPT_PACKET_OUT
312 1.115894165 172.31.31.144 -> 172.31.24.227 TCP 66 6633 → 39462 [ACK] Seq=97 Ack=7524 Win=853 Len=0 TSval=391742 TSecr=118952352
313 1.115899336 172.31.31.144 -> 172.31.24.227 TCP 66 6633 → 39462 [ACK] Seq=97 Ack=7647 Win=853 Len=0 TSval=391742 TSecr=118952352
314 1.115918279 172.31.31.144 -> 172.31.24.227 TCP 66 6633 → 39462 [ACK] Seq=97 Ack=8139 Win=853 Len=0 TSval=391742 TSecr=118952352
315 1.115939537 172.31.31.144 -> 172.31.24.227 OpenFlow 187 Type: OFPT_PACKET_OUT
316 1.115971967 172.31.24.227 -> 172.31.31.144 TCP 66 39466 → 6633 [ACK] Seq=10233 Ack=702 Win=385 Len=0 TSval=118952352 TSecr=391742
317 1.115992441 172.31.31.144 -> 172.31.24.227 OpenFlow 187 Type: OFPT_PACKET_OUT
318 1.116051960 172.31.31.144 -> 172.31.24.227 OpenFlow 187 Type: OFPT_PACKET_OUT
319 1.116080937 172.31.24.227 -> 172.31.31.144 TCP 66 39466 → 6633 [ACK] Seq=10233 Ack=944 Win=385 Len=0 TSval=118952352 TSecr=391742
320 1.116124302 172.31.31.144 -> 172.31.24.227 OpenFlow 187 Type: OFPT_PACKET_OUT
321 1.116180523 172.31.31.144 -> 172.31.24.227 OpenFlow 187 Type: OFPT_PACKET_OUT
322 1.116190827 172.31.24.227 -> 172.31.31.144 TCP 66 39466 → 6633 [ACK] Seq=10233 Ack=1186 Win=385 Len=0 TSval=118952352 TSecr=391742
323 1.116233928 172.31.31.144 -> 172.31.24.227 OpenFlow 187 Type: OFPT_PACKET_OUT
324 1.116339814 172.31.24.227 -> 172.31.31.144 TCP 66 39468 → 6633 [ACK] Seq=9385 Ack=1791 Win=82 Len=0 TSval=118952352 TSecr=391742
325 1.116383278 172.31.31.144 -> 172.31.24.227 OpenFlow 187 Type: OFPT_PACKET_OUT
326 1.116416117 172.31.24.227 -> 172.31.31.144 OpenFlow 189 Type: OFPT_PACKET_IN
327 1.116436233 172.31.31.144 -> 172.31.24.227 OpenFlow 187 Type: OFPT_PACKET_OUT
328 1.116441803 172.31.24.227 -> 172.31.31.144 OpenFlow 435 Type: OFPT_PACKET_IN
329 1.116466946 172.31.24.227 -> 172.31.31.144 OpenFlow 189 Type: OFPT_PACKET_IN
330 1.116486419 172.31.24.227 -> 172.31.31.144 OpenFlow 189 Type: OFPT_PACKET_IN
331 1.116510155 172.31.31.144 -> 172.31.24.227 OpenFlow 187 Type: OFPT_PACKET_OUT
332 1.116530303 172.31.24.227 -> 172.31.31.144 OpenFlow 189 Type: OFPT_PACKET_IN
333 1.116548642 172.31.24.227 -> 172.31.31.144 OpenFlow 435 Type: OFPT_PACKET_IN
334 1.116574385 172.31.31.144 -> 172.31.24.227 OpenFlow 187 Type: OFPT_PACKET_OUT
335 1.116598210 172.31.31.144 -> 172.31.24.227 TCP 66 6633 → 39470 [ACK] Seq=97 Ack=9946 Win=853 Len=0 TSval=391742 TSecr=118952352
336 1.116632359 172.31.31.144 -> 172.31.24.227 OpenFlow 187 Type: OFPT_PACKET_OUT
337 1.116650344 172.31.31.144 -> 172.31.24.227 TCP 66 6633 → 39470 [ACK] Seq=97 Ack=10315 Win=853 Len=0 TSval=391742 TSecr=118952352
338 1.116669345 172.31.31.144 -> 172.31.24.227 TCP 66 6633 → 39476 [ACK] Seq=97 Ack=8644 Win=853 Len=0 TSval=391742 TSecr=118952352
339 1.116675577 172.31.24.227 -> 172.31.31.144 OpenFlow 189 Type: OFPT_PACKET_IN
340 1.116691795 172.31.31.144 -> 172.31.24.227 TCP 66 6633 → 39476 [ACK] Seq=97 Ack=8767 Win=853 Len=0 TSval=391742 TSecr=118952352
341 1.116696007 172.31.24.227 -> 172.31.31.144 OpenFlow 189 Type: OFPT_PACKET_IN
342 1.116720213 172.31.31.144 -> 172.31.24.227 OpenFlow 187 Type: OFPT_PACKET_OUT
343 1.116747330 172.31.31.144 -> 172.31.24.227 TCP 66 6633 → 39492 [ACK] Seq=97 Ack=8074 Win=853 Len=0 TSval=391742 TSecr=118952352
344 1.116750209 172.31.31.144 -> 172.31.24.227 TCP 66 6633 → 39492 [ACK] Seq=97 Ack=8443 Win=853 Len=0 TSval=391742 TSecr=118952352
345 1.116815261 172.31.31.144 -> 172.31.24.227 OpenFlow 187 Type: OFPT_PACKET_OUT
346 1.116845814 172.31.31.144 -> 172.31.24.227 TCP 66 6633 → 39450 [ACK] Seq=97 Ack=9450 Win=853 Len=0 TSval=391742 TSecr=118952352
347 1.116865057 172.31.31.144 -> 172.31.24.227 TCP 66 6633 → 39450 [ACK] Seq=97 Ack=9573 Win=853 Len=0 TSval=391742 TSecr=118952352
348 1.117019491 172.31.31.144 -> 172.31.24.227 OpenFlow 187 Type: OFPT_PACKET_OUT
349 1.117039284 172.31.31.144 -> 172.31.24.227 OpenFlow 187 Type: OFPT_PACKET_OUT
350 1.117085694 172.31.24.227 -> 172.31.31.144 TCP 66 39466 → 6633 [ACK] Seq=10233 Ack=2275 Win=385 Len=0 TSval=118952352 TSecr=391742
351 1.117288342 172.31.31.144 -> 172.31.24.227 OpenFlow 187 Type: OFPT_PACKET_OUT
352 1.117310899 172.31.24.227 -> 172.31.31.144 OpenFlow 189 Type: OFPT_PACKET_IN
353 1.117339117 172.31.24.227 -> 172.31.31.144 OpenFlow 189 Type: OFPT_PACKET_IN
354 1.117355566 172.31.24.227 -> 172.31.31.144 OpenFlow 189 Type: OFPT_PACKET_IN
355 1.117374719 172.31.24.227 -> 172.31.31.144 OpenFlow 189 Type: OFPT_PACKET_IN
356 1.117383755 172.31.31.144 -> 172.31.24.227 OpenFlow 187 Type: OFPT_PACKET_OUT
357 1.117404852 172.31.24.227 -> 172.31.31.144 OpenFlow 681 Type: OFPT_PACKET_IN
358 1.117429549 172.31.31.144 -> 172.31.24.227 OpenFlow 187 Type: OFPT_PACKET_OUT
359 1.117508287 172.31.31.144 -> 172.31.24.227 TCP 66 6633 → 39446 [ACK] Seq=97 Ack=9526 Win=853 Len=0 TSval=391742 TSecr=118952352
360 1.117518824 172.31.31.144 -> 172.31.24.227 OpenFlow 187 Type: OFPT_PACKET_OUT
361 1.117522527 172.31.24.227 -> 172.31.31.144 TCP 66 39490 → 6633 [ACK] Seq=7913 Ack=702 Win=57 Len=0 TSval=118952352 TSecr=391742
362 1.117539055 172.31.31.144 -> 172.31.24.227 TCP 66 6633 → 39450 [ACK] Seq=97 Ack=9696 Win=853 Len=0 TSval=391742 TSecr=118952352
363 1.117565093 172.31.31.144 -> 172.31.24.227 TCP 66 6633 → 39450 [ACK] Seq=97 Ack=9819 Win=853 Len=0 TSval=391742 TSecr=118952352
364 1.117577406 172.31.31.144 -> 172.31.24.227 TCP 66 6633 → 39458 [ACK] Seq=97 Ack=9882 Win=853 Len=0 TSval=391742 TSecr=118952352
365 1.117597621 172.31.31.144 -> 172.31.24.227 TCP 66 6633 → 39458 [ACK] Seq=97 Ack=10497 Win=853 Len=0 TSval=391742 TSecr=118952352
366 1.117618216 172.31.31.144 -> 172.31.24.227 OpenFlow 187 Type: OFPT_PACKET_OUT
367 1.117703066 172.31.31.144 -> 172.31.24.227 OpenFlow 187 Type: OFPT_PACKET_OUT
368 1.117772202 172.31.24.227 -> 172.31.31.144 TCP 66 39490 → 6633 [ACK] Seq=7913 Ack=944 Win=57 Len=0 TSval=118952352 TSecr=391742
