  1 0.000000000 137.158.125.247 -> 172.31.24.227 TCP 54 63468 → 22 [ACK] Seq=1 Ack=1 Win=32564 Len=0
  2 0.000284678 137.158.125.247 -> 172.31.24.227 TCP 54 63468 → 22 [ACK] Seq=1 Ack=297 Win=32416 Len=0
  3 0.013673021 172.31.31.144 -> 172.31.24.227 TCP 187 6633 → 59646 [PSH, ACK] Seq=1 Ack=1 Win=853 Len=121 TSval=2833085 TSecr=391736936
  4 0.013685309 172.31.31.144 -> 172.31.24.227 TCP 187 6633 → 59646 [PSH, ACK] Seq=122 Ack=1 Win=853 Len=121 TSval=2833085 TSecr=391736936
  5 0.013690326 172.31.31.144 -> 172.31.24.227 TCP 187 6633 → 59646 [PSH, ACK] Seq=243 Ack=1 Win=853 Len=121 TSval=2833085 TSecr=391736936
  6 0.013713827 172.31.31.144 -> 172.31.24.227 TCP 187 6633 → 59646 [PSH, ACK] Seq=364 Ack=1 Win=853 Len=121 TSval=2833085 TSecr=391736936
  7 0.013771524 172.31.31.144 -> 172.31.24.227 TCP 187 6633 → 59646 [PSH, ACK] Seq=485 Ack=1 Win=853 Len=121 TSval=2833085 TSecr=391736936
  8 0.013827197 172.31.31.144 -> 172.31.24.227 TCP 187 6633 → 59646 [PSH, ACK] Seq=606 Ack=1 Win=853 Len=121 TSval=2833085 TSecr=391736936
  9 0.013893578 172.31.31.144 -> 172.31.24.227 TCP 187 6633 → 59648 [PSH, ACK] Seq=1 Ack=1 Win=853 Len=121 TSval=2833085 TSecr=391736935
 10 0.013941094 172.31.31.144 -> 172.31.24.227 TCP 187 6633 → 59648 [PSH, ACK] Seq=122 Ack=1 Win=853 Len=121 TSval=2833085 TSecr=391736935
 11 0.013994285 172.31.31.144 -> 172.31.24.227 TCP 187 6633 → 59648 [PSH, ACK] Seq=243 Ack=1 Win=853 Len=121 TSval=2833085 TSecr=391736935
 12 0.014075373 172.31.31.144 -> 172.31.24.227 TCP 187 6633 → 59648 [PSH, ACK] Seq=364 Ack=1 Win=853 Len=121 TSval=2833085 TSecr=391736935
 13 0.014103675 172.31.31.144 -> 172.31.24.227 TCP 187 6633 → 59648 [PSH, ACK] Seq=485 Ack=1 Win=853 Len=121 TSval=2833085 TSecr=391736935
 14 0.014166186 172.31.31.144 -> 172.31.24.227 TCP 187 6633 → 59648 [PSH, ACK] Seq=606 Ack=1 Win=853 Len=121 TSval=2833085 TSecr=391736935
 15 0.014228852 172.31.31.144 -> 172.31.24.227 TCP 187 6633 → 59648 [PSH, ACK] Seq=727 Ack=1 Win=853 Len=121 TSval=2833085 TSecr=391736935
 16 0.014297423 172.31.31.144 -> 172.31.24.227 TCP 187 6633 → 59648 [PSH, ACK] Seq=848 Ack=1 Win=853 Len=121 TSval=2833085 TSecr=391736935
 17 0.014389951 172.31.31.144 -> 172.31.24.227 TCP 187 6633 → 59648 [PSH, ACK] Seq=969 Ack=1 Win=853 Len=121 TSval=2833085 TSecr=391736935
 18 0.014396011 172.31.31.144 -> 172.31.24.227 TCP 187 6633 → 59648 [PSH, ACK] Seq=1090 Ack=1 Win=853 Len=121 TSval=2833085 TSecr=391736935
 19 0.014486057 172.31.24.227 -> 172.31.31.144 TCP 66 59646 → 6633 [ACK] Seq=1 Ack=727 Win=213 Len=0 TSval=391736960 TSecr=2833085
 20 0.014666221 172.31.24.227 -> 172.31.31.144 OpenFlow 189 Type: OFPT_PACKET_IN
 21 0.014689486 172.31.24.227 -> 172.31.31.144 OpenFlow 189 Type: OFPT_PACKET_IN
 22 0.014966450 172.31.31.144 -> 172.31.24.227 TCP 66 6633 → 59644 [ACK] Seq=1 Ack=124 Win=853 Len=0 TSval=2833085 TSecr=391736960
 23 0.014973987 172.31.31.144 -> 172.31.24.227 TCP 66 6633 → 59644 [ACK] Seq=1 Ack=247 Win=853 Len=0 TSval=2833085 TSecr=391736960
 24 0.015174255 172.31.24.227 -> 172.31.31.144 TCP 66 59648 → 6633 [ACK] Seq=1 Ack=1211 Win=213 Len=0 TSval=391736960 TSecr=2833085
 25 0.015248858 172.31.24.227 -> 172.31.31.144 OpenFlow 189 Type: OFPT_PACKET_IN
 26 0.015269423 172.31.24.227 -> 172.31.31.144 OpenFlow 189 Type: OFPT_PACKET_IN
 27 0.015308565 172.31.24.227 -> 172.31.31.144 OpenFlow 189 Type: OFPT_PACKET_IN
 28 0.015328754 172.31.24.227 -> 172.31.31.144 OpenFlow 189 Type: OFPT_PACKET_IN
 29 0.015348207 172.31.24.227 -> 172.31.31.144 OpenFlow 189 Type: OFPT_PACKET_IN
 30 0.015384401 172.31.24.227 -> 172.31.31.144 OpenFlow 189 Type: OFPT_PACKET_IN
 31 0.015402045 172.31.24.227 -> 172.31.31.144 OpenFlow 189 Type: OFPT_PACKET_IN
 32 0.015436232 172.31.24.227 -> 172.31.31.144 OpenFlow 189 Type: OFPT_PACKET_IN
 33 0.015453481 172.31.24.227 -> 172.31.31.144 OpenFlow 189 Type: OFPT_PACKET_IN
 34 0.015533592 172.31.31.144 -> 172.31.24.227 TCP 66 6633 → 59642 [ACK] Seq=1 Ack=124 Win=853 Len=0 TSval=2833086 TSecr=391736960
 35 0.015540721 172.31.31.144 -> 172.31.24.227 TCP 66 6633 → 59642 [ACK] Seq=1 Ack=247 Win=853 Len=0 TSval=2833086 TSecr=391736960
 36 0.015543225 172.31.31.144 -> 172.31.24.227 TCP 66 6633 → 59654 [ACK] Seq=1 Ack=124 Win=853 Len=0 TSval=2833086 TSecr=391736960
 37 0.015559639 172.31.24.227 -> 172.31.31.144 OpenFlow 435 Type: OFPT_PACKET_IN
 38 0.015614832 172.31.24.227 -> 172.31.31.144 OpenFlow 189 Type: OFPT_PACKET_IN
 39 0.015661171 172.31.31.144 -> 172.31.24.227 TCP 66 6633 → 59654 [ACK] Seq=1 Ack=247 Win=853 Len=0 TSval=2833086 TSecr=391736960
 40 0.015666626 172.31.31.144 -> 172.31.24.227 TCP 66 6633 → 59640 [ACK] Seq=1 Ack=124 Win=853 Len=0 TSval=2833086 TSecr=391736960
 41 0.015669310 172.31.31.144 -> 172.31.24.227 TCP 66 6633 → 59640 [ACK] Seq=1 Ack=247 Win=853 Len=0 TSval=2833086 TSecr=391736960
 42 0.015671505 172.31.31.144 -> 172.31.24.227 TCP 66 6633 → 59638 [ACK] Seq=1 Ack=124 Win=853 Len=0 TSval=2833086 TSecr=391736960
 43 0.015686722 172.31.24.227 -> 172.31.31.144 OpenFlow 189 Type: OFPT_PACKET_IN
 44 0.015777898 172.31.31.144 -> 172.31.24.227 TCP 66 6633 → 59638 [ACK] Seq=1 Ack=247 Win=853 Len=0 TSval=2833086 TSecr=391736960
 45 0.015783769 172.31.31.144 -> 172.31.24.227 TCP 66 6633 → 59650 [ACK] Seq=1 Ack=124 Win=853 Len=0 TSval=2833086 TSecr=391736960
 46 0.015919198 172.31.31.144 -> 172.31.24.227 TCP 66 6633 → 59650 [ACK] Seq=1 Ack=493 Win=853 Len=0 TSval=2833086 TSecr=391736960
 47 0.015925821 172.31.31.144 -> 172.31.24.227 TCP 66 6633 → 59658 [ACK] Seq=1 Ack=247 Win=853 Len=0 TSval=2833086 TSecr=391736960
 48 0.092618111 137.158.125.247 -> 172.31.24.227 TCP 54 63468 → 22 [ACK] Seq=1 Ack=393 Win=32368 Len=0
 49 0.113736449 172.31.31.144 -> 172.31.24.227 OpenFlow 187 Type: OFPT_PACKET_OUT
 50 0.113763027 172.31.31.144 -> 172.31.24.227 OpenFlow 187 Type: OFPT_PACKET_OUT
 51 0.113782596 172.31.31.144 -> 172.31.24.227 OpenFlow 187 Type: OFPT_PACKET_OUT
 52 0.113811832 172.31.31.144 -> 172.31.24.227 OpenFlow 187 Type: OFPT_PACKET_OUT
 53 0.113867698 172.31.31.144 -> 172.31.24.227 OpenFlow 187 Type: OFPT_PACKET_OUT
 54 0.113923860 172.31.31.144 -> 172.31.24.227 OpenFlow 187 Type: OFPT_PACKET_OUT
 55 0.113977477 172.31.31.144 -> 172.31.24.227 OpenFlow 187 Type: OFPT_PACKET_OUT
 56 0.114030475 172.31.31.144 -> 172.31.24.227 OpenFlow 187 Type: OFPT_PACKET_OUT
 57 0.114083934 172.31.31.144 -> 172.31.24.227 OpenFlow 187 Type: OFPT_PACKET_OUT
 58 0.114140920 172.31.31.144 -> 172.31.24.227 OpenFlow 187 Type: OFPT_PACKET_OUT
 59 0.114207206 172.31.31.144 -> 172.31.24.227 TCP 187 6633 → 59652 [PSH, ACK] Seq=1 Ack=1 Win=853 Len=121 TSval=2833110 TSecr=391736936
 60 0.114259558 172.31.31.144 -> 172.31.24.227 TCP 187 6633 → 59652 [PSH, ACK] Seq=122 Ack=1 Win=853 Len=121 TSval=2833110 TSecr=391736936
 61 0.114313401 172.31.31.144 -> 172.31.24.227 TCP 187 6633 → 59652 [PSH, ACK] Seq=243 Ack=1 Win=853 Len=121 TSval=2833110 TSecr=391736936
 62 0.114366948 172.31.31.144 -> 172.31.24.227 TCP 187 6633 → 59652 [PSH, ACK] Seq=364 Ack=1 Win=853 Len=121 TSval=2833110 TSecr=391736936
 63 0.114419516 172.31.31.144 -> 172.31.24.227 TCP 187 6633 → 59652 [PSH, ACK] Seq=485 Ack=1 Win=853 Len=121 TSval=2833110 TSecr=391736936
 64 0.114474000 172.31.31.144 -> 172.31.24.227 TCP 187 6633 → 59652 [PSH, ACK] Seq=606 Ack=1 Win=853 Len=121 TSval=2833110 TSecr=391736936
 65 0.114788048 172.31.24.227 -> 172.31.31.144 TCP 66 59650 → 6633 [ACK] Seq=493 Ack=1211 Win=213 Len=0 TSval=391736985 TSecr=2833110
 66 0.114877926 172.31.24.227 -> 172.31.31.144 OpenFlow 189 Type: OFPT_PACKET_IN
 67 0.114907215 172.31.24.227 -> 172.31.31.144 OpenFlow 189 Type: OFPT_PACKET_IN
 68 0.115040462 172.31.24.227 -> 172.31.31.144 OpenFlow 189 Type: OFPT_PACKET_IN
 69 0.115061199 172.31.24.227 -> 172.31.31.144 OpenFlow 189 Type: OFPT_PACKET_IN
 70 0.115078835 172.31.24.227 -> 172.31.31.144 OpenFlow 189 Type: OFPT_PACKET_IN
 71 0.115111657 172.31.24.227 -> 172.31.31.144 OpenFlow 189 Type: OFPT_PACKET_IN
 72 0.115134172 172.31.24.227 -> 172.31.31.144 OpenFlow 189 Type: OFPT_PACKET_IN
 73 0.115175920 172.31.31.144 -> 172.31.24.227 TCP 66 6633 → 59646 [ACK] Seq=727 Ack=247 Win=853 Len=0 TSval=2833111 TSecr=391736985
 74 0.115187059 172.31.24.227 -> 172.31.31.144 OpenFlow 189 Type: OFPT_PACKET_IN
 75 0.115194771 172.31.24.227 -> 172.31.31.144 OpenFlow 189 Type: OFPT_PACKET_IN
 76 0.115197874 172.31.24.227 -> 172.31.31.144 OpenFlow 189 Type: OFPT_PACKET_IN
 77 0.115330796 172.31.31.144 -> 172.31.24.227 TCP 66 6633 → 59648 [ACK] Seq=1211 Ack=124 Win=853 Len=0 TSval=2833111 TSecr=391736985
 78 0.115430637 172.31.31.144 -> 172.31.24.227 TCP 66 6633 → 59642 [ACK] Seq=1 Ack=370 Win=853 Len=0 TSval=2833111 TSecr=391736985
 79 0.115437627 172.31.31.144 -> 172.31.24.227 TCP 66 6633 → 59654 [ACK] Seq=1 Ack=370 Win=853 Len=0 TSval=2833111 TSecr=391736985
 80 0.115440369 172.31.31.144 -> 172.31.24.227 TCP 66 6633 → 59648 [ACK] Seq=1211 Ack=247 Win=853 Len=0 TSval=2833111 TSecr=391736985
 81 0.115443103 172.31.31.144 -> 172.31.24.227 TCP 66 6633 → 59652 [ACK] Seq=727 Ack=124 Win=853 Len=0 TSval=2833111 TSecr=391736985
 82 0.115542629 172.31.31.144 -> 172.31.24.227 TCP 66 6633 → 59642 [ACK] Seq=1 Ack=493 Win=853 Len=0 TSval=2833111 TSecr=391736985
 83 0.115549305 172.31.31.144 -> 172.31.24.227 TCP 66 6633 → 59654 [ACK] Seq=1 Ack=493 Win=853 Len=0 TSval=2833111 TSecr=391736985
 84 0.115610404 172.31.24.227 -> 172.31.31.144 OpenFlow 189 Type: OFPT_PACKET_IN
 85 0.115673725 172.31.31.144 -> 172.31.24.227 TCP 66 6633 → 59652 [ACK] Seq=727 Ack=247 Win=853 Len=0 TSval=2833111 TSecr=391736985
 86 0.115690361 172.31.24.227 -> 172.31.31.144 OpenFlow 189 Type: OFPT_PACKET_IN
 87 0.115759251 172.31.24.227 -> 172.31.31.144 OpenFlow 189 Type: OFPT_PACKET_IN
 88 0.115779070 172.31.24.227 -> 172.31.31.144 OpenFlow 189 Type: OFPT_PACKET_IN
 89 0.115830696 172.31.31.144 -> 172.31.24.227 TCP 66 6633 → 59656 [ACK] Seq=1 Ack=124 Win=853 Len=0 TSval=2833111 TSecr=391736985
 90 0.115939701 172.31.31.144 -> 172.31.24.227 TCP 66 6633 → 59656 [ACK] Seq=1 Ack=247 Win=853 Len=0 TSval=2833111 TSecr=391736985
 91 0.115968980 172.31.31.144 -> 172.31.24.227 TCP 66 6633 → 59650 [ACK] Seq=1211 Ack=616 Win=853 Len=0 TSval=2833111 TSecr=391736985
 92 0.115979764 172.31.24.227 -> 172.31.31.144 OpenFlow 189 Type: OFPT_PACKET_IN
 93 0.115998914 172.31.24.227 -> 172.31.31.144 OpenFlow 189 Type: OFPT_PACKET_IN
 94 0.116139962 172.31.31.144 -> 172.31.24.227 TCP 66 6633 → 59650 [ACK] Seq=1211 Ack=739 Win=853 Len=0 TSval=2833111 TSecr=391736985
 95 0.116217234 172.31.31.144 -> 172.31.24.227 TCP 66 6633 → 59644 [ACK] Seq=1 Ack=370 Win=853 Len=0 TSval=2833111 TSecr=391736986
 96 0.116223701 172.31.31.144 -> 172.31.24.227 TCP 66 6633 → 59644 [ACK] Seq=1 Ack=493 Win=853 Len=0 TSval=2833111 TSecr=391736986
 97 0.213777672 172.31.31.144 -> 172.31.24.227 OpenFlow 187 Type: OFPT_PACKET_OUT
 98 0.213801997 172.31.31.144 -> 172.31.24.227 OpenFlow 187 Type: OFPT_PACKET_OUT
 99 0.213832318 172.31.31.144 -> 172.31.24.227 OpenFlow 187 Type: OFPT_PACKET_OUT
100 0.213859063 172.31.31.144 -> 172.31.24.227 OpenFlow 187 Type: OFPT_PACKET_OUT
101 0.213908189 172.31.31.144 -> 172.31.24.227 OpenFlow 187 Type: OFPT_PACKET_OUT
102 0.213965392 172.31.31.144 -> 172.31.24.227 OpenFlow 187 Type: OFPT_PACKET_OUT
103 0.214037198 172.31.31.144 -> 172.31.24.227 OpenFlow 187 Type: OFPT_PACKET_OUT
104 0.214085597 172.31.31.144 -> 172.31.24.227 OpenFlow 187 Type: OFPT_PACKET_OUT
105 0.214130039 172.31.31.144 -> 172.31.24.227 OpenFlow 187 Type: OFPT_PACKET_OUT
106 0.214187707 172.31.31.144 -> 172.31.24.227 OpenFlow 187 Type: OFPT_PACKET_OUT
107 0.214243140 172.31.31.144 -> 172.31.24.227 OpenFlow 187 Type: OFPT_PACKET_OUT
108 0.214254621 172.31.24.227 -> 172.31.31.144 TCP 66 59656 → 6633 [ACK] Seq=247 Ack=122 Win=213 Len=0 TSval=391737010 TSecr=2833135
109 0.214288725 172.31.31.144 -> 172.31.24.227 OpenFlow 187 Type: OFPT_PACKET_OUT
110 0.214296221 172.31.24.227 -> 172.31.31.144 TCP 66 59656 → 6633 [ACK] Seq=247 Ack=243 Win=213 Len=0 TSval=391737010 TSecr=2833135
111 0.214382028 172.31.31.144 -> 172.31.24.227 OpenFlow 187 Type: OFPT_PACKET_OUT
112 0.214389699 172.31.24.227 -> 172.31.31.144 TCP 66 59656 → 6633 [ACK] Seq=247 Ack=364 Win=213 Len=0 TSval=391737010 TSecr=2833135
113 0.214395498 172.31.31.144 -> 172.31.24.227 OpenFlow 187 Type: OFPT_PACKET_OUT
114 0.214399965 172.31.24.227 -> 172.31.31.144 TCP 66 59656 → 6633 [ACK] Seq=247 Ack=485 Win=213 Len=0 TSval=391737010 TSecr=2833135
115 0.214483491 172.31.31.144 -> 172.31.24.227 OpenFlow 187 Type: OFPT_PACKET_OUT
116 0.214491170 172.31.24.227 -> 172.31.31.144 TCP 66 59656 → 6633 [ACK] Seq=247 Ack=606 Win=213 Len=0 TSval=391737010 TSecr=2833135
117 0.214557683 172.31.31.144 -> 172.31.24.227 OpenFlow 187 Type: OFPT_PACKET_OUT
118 0.214565612 172.31.24.227 -> 172.31.31.144 TCP 66 59656 → 6633 [ACK] Seq=247 Ack=727 Win=213 Len=0 TSval=391737010 TSecr=2833135
119 0.214608970 172.31.31.144 -> 172.31.24.227 OpenFlow 187 Type: OFPT_PACKET_OUT
120 0.214616829 172.31.24.227 -> 172.31.31.144 TCP 66 59656 → 6633 [ACK] Seq=247 Ack=848 Win=213 Len=0 TSval=391737010 TSecr=2833135
121 0.214658185 172.31.31.144 -> 172.31.24.227 OpenFlow 187 Type: OFPT_PACKET_OUT
122 0.214667479 172.31.24.227 -> 172.31.31.144 TCP 66 59656 → 6633 [ACK] Seq=247 Ack=969 Win=213 Len=0 TSval=391737010 TSecr=2833135
123 0.214898435 172.31.24.227 -> 172.31.31.144 TCP 66 59654 → 6633 [ACK] Seq=493 Ack=1211 Win=213 Len=0 TSval=391737010 TSecr=2833135
124 0.215012443 172.31.24.227 -> 172.31.31.144 OpenFlow 189 Type: OFPT_PACKET_IN
125 0.215033564 172.31.24.227 -> 172.31.31.144 OpenFlow 189 Type: OFPT_PACKET_IN
126 0.215217178 172.31.31.144 -> 172.31.24.227 TCP 66 6633 → 59656 [ACK] Seq=969 Ack=370 Win=853 Len=0 TSval=2833136 TSecr=391737010
127 0.215370903 172.31.31.144 -> 172.31.24.227 TCP 66 6633 → 59656 [ACK] Seq=969 Ack=493 Win=853 Len=0 TSval=2833136 TSecr=391737010
128 0.215663343 172.31.24.227 -> 172.31.31.144 OpenFlow 189 Type: OFPT_PACKET_IN
129 0.215685999 172.31.24.227 -> 172.31.31.144 OpenFlow 189 Type: OFPT_PACKET_IN
130 0.215859958 172.31.24.227 -> 172.31.31.144 OpenFlow 189 Type: OFPT_PACKET_IN
131 0.215872405 172.31.31.144 -> 172.31.24.227 TCP 66 6633 → 59650 [ACK] Seq=1211 Ack=862 Win=853 Len=0 TSval=2833136 TSecr=391737010
132 0.215891937 172.31.24.227 -> 172.31.31.144 OpenFlow 189 Type: OFPT_PACKET_IN
133 0.215918380 172.31.24.227 -> 172.31.31.144 OpenFlow 189 Type: OFPT_PACKET_IN
134 0.215942031 172.31.24.227 -> 172.31.31.144 OpenFlow 189 Type: OFPT_PACKET_IN
135 0.215960565 172.31.24.227 -> 172.31.31.144 OpenFlow 189 Type: OFPT_PACKET_IN
136 0.215978180 172.31.24.227 -> 172.31.31.144 OpenFlow 189 Type: OFPT_PACKET_IN
137 0.216010912 172.31.24.227 -> 172.31.31.144 OpenFlow 189 Type: OFPT_PACKET_IN
138 0.216034230 172.31.24.227 -> 172.31.31.144 OpenFlow 189 Type: OFPT_PACKET_IN
139 0.216037460 172.31.24.227 -> 172.31.31.144 OpenFlow 189 Type: OFPT_PACKET_IN
140 0.216043733 172.31.31.144 -> 172.31.24.227 TCP 66 6633 → 59650 [ACK] Seq=1211 Ack=985 Win=853 Len=0 TSval=2833136 TSecr=391737010
141 0.216069254 172.31.24.227 -> 172.31.31.144 OpenFlow 189 Type: OFPT_PACKET_IN
142 0.216076264 172.31.24.227 -> 172.31.31.144 OpenFlow 189 Type: OFPT_PACKET_IN
143 0.216187808 172.31.24.227 -> 172.31.31.144 OpenFlow 189 Type: OFPT_PACKET_IN
144 0.216191730 172.31.24.227 -> 172.31.31.144 OpenFlow 189 Type: OFPT_PACKET_IN
145 0.216240925 172.31.31.144 -> 172.31.24.227 TCP 66 6633 → 59664 [ACK] Seq=1 Ack=124 Win=853 Len=0 TSval=2833136 TSecr=391737011
146 0.216250324 172.31.31.144 -> 172.31.24.227 TCP 66 6633 → 59664 [ACK] Seq=1 Ack=247 Win=853 Len=0 TSval=2833136 TSecr=391737011
147 0.216253282 172.31.31.144 -> 172.31.24.227 TCP 66 6633 → 59660 [ACK] Seq=1 Ack=124 Win=853 Len=0 TSval=2833136 TSecr=391737011
148 0.216256481 172.31.31.144 -> 172.31.24.227 TCP 66 6633 → 59660 [ACK] Seq=1 Ack=247 Win=853 Len=0 TSval=2833136 TSecr=391737011
149 0.216316991 172.31.24.227 -> 172.31.31.144 OpenFlow 189 Type: OFPT_PACKET_IN
150 0.216408618 172.31.31.144 -> 172.31.24.227 TCP 66 6633 → 59648 [ACK] Seq=1211 Ack=370 Win=853 Len=0 TSval=2833136 TSecr=391737011
151 0.216412876 172.31.31.144 -> 172.31.24.227 TCP 66 6633 → 59662 [ACK] Seq=1 Ack=124 Win=853 Len=0 TSval=2833136 TSecr=391737011
152 0.216416099 172.31.31.144 -> 172.31.24.227 TCP 66 6633 → 59654 [ACK] Seq=1211 Ack=616 Win=853 Len=0 TSval=2833136 TSecr=391737011
153 0.216458178 172.31.31.144 -> 172.31.24.227 TCP 66 6633 → 59658 [ACK] Seq=1 Ack=493 Win=853 Len=0 TSval=2833136 TSecr=391737011
154 0.216569635 172.31.31.144 -> 172.31.24.227 TCP 66 6633 → 59652 [ACK] Seq=727 Ack=370 Win=853 Len=0 TSval=2833136 TSecr=391737011
155 0.216573446 172.31.31.144 -> 172.31.24.227 TCP 66 6633 → 59662 [ACK] Seq=1 Ack=247 Win=853 Len=0 TSval=2833136 TSecr=391737011
156 0.216576006 172.31.31.144 -> 172.31.24.227 TCP 66 6633 → 59648 [ACK] Seq=1211 Ack=493 Win=853 Len=0 TSval=2833136 TSecr=391737011
157 0.216578334 172.31.31.144 -> 172.31.24.227 TCP 66 6633 → 59654 [ACK] Seq=1211 Ack=739 Win=853 Len=0 TSval=2833136 TSecr=391737011
158 0.216659207 172.31.31.144 -> 172.31.24.227 TCP 66 6633 → 59652 [ACK] Seq=727 Ack=493 Win=853 Len=0 TSval=2833136 TSecr=391737011
159 0.288500040 172.31.31.144 -> 172.31.24.227 OpenFlow 122 Type: OFPT_MULTIPART_REQUEST, OFPMP_FLOW
160 0.288511515 172.31.31.144 -> 172.31.24.227 OpenFlow 106 Type: OFPT_MULTIPART_REQUEST, OFPMP_PORT_STATS
161 0.288756569 172.31.24.227 -> 172.31.31.144 OpenFlow 2186 Type: OFPT_MULTIPART_REPLY, OFPMP_FLOW
162 0.288916737 172.31.24.227 -> 172.31.31.144 OpenFlow 6178 Type: OFPT_MULTIPART_REPLY, OFPMP_TABLE
163 0.289015295 172.31.31.144 -> 172.31.24.227 TCP 66 6633 → 59638 [ACK] Seq=97 Ack=2367 Win=853 Len=0 TSval=2833154 TSecr=391737029
164 0.289043121 172.31.24.227 -> 172.31.31.144 OpenFlow 530 Type: OFPT_MULTIPART_REPLY, OFPMP_PORT_STATS
165 0.289198979 172.31.31.144 -> 172.31.24.227 TCP 66 6633 → 59638 [ACK] Seq=97 Ack=8479 Win=853 Len=0 TSval=2833154 TSecr=391737029
166 0.289320062 172.31.31.144 -> 172.31.24.227 TCP 66 6633 → 59638 [ACK] Seq=97 Ack=8943 Win=853 Len=0 TSval=2833154 TSecr=391737029
167 0.305675269 172.31.31.144 -> 172.31.24.227 OpenFlow 82 Type: OFPT_MULTIPART_REQUEST, OFPMP_TABLE
168 0.305684105 172.31.31.144 -> 172.31.24.227 OpenFlow 146 Type: OFPT_MULTIPART_REQUEST, OFPMP_PORT_STATS
169 0.305907716 172.31.24.227 -> 172.31.31.144 OpenFlow 6178 Type: OFPT_MULTIPART_REPLY, OFPMP_TABLE
170 0.306008683 172.31.24.227 -> 172.31.31.144 OpenFlow 2602 Type: OFPT_MULTIPART_REPLY, OFPMP_FLOW
171 0.306097828 172.31.24.227 -> 172.31.31.144 OpenFlow 642 Type: OFPT_MULTIPART_REPLY, OFPMP_PORT_STATS
172 0.306239141 172.31.31.144 -> 172.31.24.227 TCP 66 6633 → 59640 [ACK] Seq=97 Ack=6359 Win=853 Len=0 TSval=2833158 TSecr=391737033
173 0.306246305 172.31.31.144 -> 172.31.24.227 TCP 66 6633 → 59640 [ACK] Seq=97 Ack=8895 Win=853 Len=0 TSval=2833158 TSecr=391737033
174 0.306374702 172.31.31.144 -> 172.31.24.227 TCP 66 6633 → 59640 [ACK] Seq=97 Ack=9471 Win=853 Len=0 TSval=2833158 TSecr=391737033
175 0.313951782 172.31.31.144 -> 172.31.24.227 OpenFlow 187 Type: OFPT_PACKET_OUT
176 0.313960007 172.31.31.144 -> 172.31.24.227 OpenFlow 187 Type: OFPT_PACKET_OUT
177 0.313994882 172.31.31.144 -> 172.31.24.227 OpenFlow 187 Type: OFPT_PACKET_OUT
178 0.314063296 172.31.31.144 -> 172.31.24.227 OpenFlow 187 Type: OFPT_PACKET_OUT
179 0.314106692 172.31.31.144 -> 172.31.24.227 OpenFlow 187 Type: OFPT_PACKET_OUT
180 0.314169444 172.31.31.144 -> 172.31.24.227 OpenFlow 187 Type: OFPT_PACKET_OUT
181 0.314209848 172.31.31.144 -> 172.31.24.227 OpenFlow 187 Type: OFPT_PACKET_OUT
182 0.314264115 172.31.31.144 -> 172.31.24.227 OpenFlow 187 Type: OFPT_PACKET_OUT
183 0.314319613 172.31.31.144 -> 172.31.24.227 OpenFlow 187 Type: OFPT_PACKET_OUT
184 0.314384900 172.31.31.144 -> 172.31.24.227 OpenFlow 187 Type: OFPT_PACKET_OUT
185 0.314448882 172.31.31.144 -> 172.31.24.227 OpenFlow 187 Type: OFPT_PACKET_OUT
186 0.314495144 172.31.31.144 -> 172.31.24.227 OpenFlow 187 Type: OFPT_PACKET_OUT
187 0.314556832 172.31.31.144 -> 172.31.24.227 OpenFlow 187 Type: OFPT_PACKET_OUT
188 0.314609422 172.31.31.144 -> 172.31.24.227 OpenFlow 187 Type: OFPT_PACKET_OUT
189 0.314663713 172.31.31.144 -> 172.31.24.227 OpenFlow 187 Type: OFPT_PACKET_OUT
190 0.314716728 172.31.24.227 -> 172.31.31.144 TCP 66 59658 → 6633 [ACK] Seq=493 Ack=1211 Win=213 Len=0 TSval=391737035 TSecr=2833160
191 0.314735501 172.31.31.144 -> 172.31.24.227 OpenFlow 187 Type: OFPT_PACKET_OUT
192 0.314783403 172.31.31.144 -> 172.31.24.227 OpenFlow 187 Type: OFPT_PACKET_OUT
193 0.314816623 172.31.24.227 -> 172.31.31.144 OpenFlow 189 Type: OFPT_PACKET_IN
194 0.314855554 172.31.24.227 -> 172.31.31.144 OpenFlow 189 Type: OFPT_PACKET_IN
195 0.314865298 172.31.24.227 -> 172.31.31.144 OpenFlow 189 Type: OFPT_PACKET_IN
196 0.314886675 172.31.31.144 -> 172.31.24.227 OpenFlow 187 Type: OFPT_PACKET_OUT
197 0.314893453 172.31.24.227 -> 172.31.31.144 OpenFlow 189 Type: OFPT_PACKET_IN
198 0.314899333 172.31.24.227 -> 172.31.31.144 OpenFlow 189 Type: OFPT_PACKET_IN
199 0.314943792 172.31.24.227 -> 172.31.31.144 OpenFlow 189 Type: OFPT_PACKET_IN
200 0.314979588 172.31.24.227 -> 172.31.31.144 OpenFlow 189 Type: OFPT_PACKET_IN
201 0.315051669 172.31.24.227 -> 172.31.31.144 OpenFlow 189 Type: OFPT_PACKET_IN
202 0.315072741 172.31.31.144 -> 172.31.24.227 TCP 66 6633 → 59648 [ACK] Seq=1211 Ack=616 Win=853 Len=0 TSval=2833161 TSecr=391737035
203 0.315124608 172.31.24.227 -> 172.31.31.144 OpenFlow 189 Type: OFPT_PACKET_IN
204 0.315143397 172.31.24.227 -> 172.31.31.144 OpenFlow 189 Type: OFPT_PACKET_IN
205 0.315242715 172.31.31.144 -> 172.31.24.227 TCP 66 6633 → 59674 [ACK] Seq=1 Ack=247 Win=853 Len=0 TSval=2833161 TSecr=391737035
206 0.315249941 172.31.31.144 -> 172.31.24.227 TCP 66 6633 → 59654 [ACK] Seq=1211 Ack=985 Win=853 Len=0 TSval=2833161 TSecr=391737035
207 0.315252810 172.31.31.144 -> 172.31.24.227 TCP 66 6633 → 59648 [ACK] Seq=1211 Ack=739 Win=853 Len=0 TSval=2833161 TSecr=391737035
208 0.315305596 172.31.31.144 -> 172.31.24.227 TCP 66 6633 → 59666 [ACK] Seq=1 Ack=124 Win=853 Len=0 TSval=2833161 TSecr=391737035
209 0.315312022 172.31.31.144 -> 172.31.24.227 TCP 66 6633 → 59666 [ACK] Seq=1 Ack=247 Win=853 Len=0 TSval=2833161 TSecr=391737035
210 0.315429281 172.31.31.144 -> 172.31.24.227 TCP 66 6633 → 59660 [ACK] Seq=969 Ack=493 Win=853 Len=0 TSval=2833161 TSecr=391737035
211 0.315652949 172.31.24.227 -> 172.31.31.144 OpenFlow 189 Type: OFPT_PACKET_IN
212 0.315673408 172.31.24.227 -> 172.31.31.144 OpenFlow 189 Type: OFPT_PACKET_IN
213 0.315702561 172.31.24.227 -> 172.31.31.144 OpenFlow 189 Type: OFPT_PACKET_IN
214 0.315722808 172.31.24.227 -> 172.31.31.144 OpenFlow 189 Type: OFPT_PACKET_IN
215 0.315731425 172.31.24.227 -> 172.31.31.144 OpenFlow 189 Type: OFPT_PACKET_IN
216 0.315752958 172.31.24.227 -> 172.31.31.144 OpenFlow 189 Type: OFPT_PACKET_IN
217 0.315758850 172.31.24.227 -> 172.31.31.144 OpenFlow 189 Type: OFPT_PACKET_IN
218 0.315811933 172.31.24.227 -> 172.31.31.144 OpenFlow 189 Type: OFPT_PACKET_IN
219 0.316039034 172.31.31.144 -> 172.31.24.227 TCP 66 6633 → 59668 [ACK] Seq=1 Ack=124 Win=853 Len=0 TSval=2833161 TSecr=391737035
220 0.316045835 172.31.31.144 -> 172.31.24.227 TCP 66 6633 → 59662 [ACK] Seq=1 Ack=370 Win=853 Len=0 TSval=2833161 TSecr=391737035
221 0.316048342 172.31.31.144 -> 172.31.24.227 TCP 66 6633 → 59668 [ACK] Seq=1 Ack=247 Win=853 Len=0 TSval=2833161 TSecr=391737035
222 0.316050545 172.31.31.144 -> 172.31.24.227 TCP 66 6633 → 59654 [ACK] Seq=1211 Ack=1108 Win=853 Len=0 TSval=2833161 TSecr=391737035
223 0.316052642 172.31.31.144 -> 172.31.24.227 TCP 66 6633 → 59658 [ACK] Seq=1211 Ack=739 Win=853 Len=0 TSval=2833161 TSecr=391737035
224 0.316095258 172.31.31.144 -> 172.31.24.227 TCP 66 6633 → 59662 [ACK] Seq=1 Ack=493 Win=853 Len=0 TSval=2833161 TSecr=391737035
225 0.316235589 172.31.31.144 -> 172.31.24.227 TCP 66 6633 → 59654 [ACK] Seq=1211 Ack=1231 Win=853 Len=0 TSval=2833161 TSecr=391737036
226 0.345815082 172.31.31.144 -> 172.31.24.227 OpenFlow 122 Type: OFPT_MULTIPART_REQUEST, OFPMP_FLOW
227 0.345824455 172.31.31.144 -> 172.31.24.227 OpenFlow 106 Type: OFPT_MULTIPART_REQUEST, OFPMP_PORT_STATS
228 0.345971976 172.31.24.227 -> 172.31.31.144 OpenFlow 2810 Type: OFPT_MULTIPART_REPLY, OFPMP_FLOW
229 0.346133728 172.31.24.227 -> 172.31.31.144 OpenFlow 6178 Type: OFPT_MULTIPART_REPLY, OFPMP_TABLE
230 0.346208762 172.31.31.144 -> 172.31.24.227 TCP 66 6633 → 59642 [ACK] Seq=97 Ack=3237 Win=853 Len=0 TSval=2833168 TSecr=391737043
231 0.346265164 172.31.24.227 -> 172.31.31.144 OpenFlow 754 Type: OFPT_MULTIPART_REPLY, OFPMP_PORT_STATS
232 0.346386537 172.31.31.144 -> 172.31.24.227 TCP 66 6633 → 59642 [ACK] Seq=97 Ack=9349 Win=853 Len=0 TSval=2833168 TSecr=391737043
233 0.346498972 172.31.31.144 -> 172.31.24.227 TCP 66 6633 → 59642 [ACK] Seq=97 Ack=10037 Win=853 Len=0 TSval=2833168 TSecr=391737043
234 0.381936493 172.31.31.144 -> 172.31.24.227 OpenFlow 90 Type: OFPT_MULTIPART_REQUEST, OFPMP_PORT_STATS
235 0.381946203 172.31.31.144 -> 172.31.24.227 OpenFlow 138 Type: OFPT_MULTIPART_REQUEST, OFPMP_TABLE
236 0.382098814 172.31.24.227 -> 172.31.31.144 OpenFlow 642 Type: OFPT_MULTIPART_REPLY, OFPMP_PORT_STATS
237 0.382190017 172.31.24.227 -> 172.31.31.144 OpenFlow 2186 Type: OFPT_MULTIPART_REPLY, OFPMP_FLOW
238 0.382322070 172.31.24.227 -> 172.31.31.144 OpenFlow 6178 Type: OFPT_MULTIPART_REPLY, OFPMP_TABLE
239 0.382396332 172.31.31.144 -> 172.31.24.227 TCP 66 6633 → 59644 [ACK] Seq=97 Ack=1069 Win=853 Len=0 TSval=2833177 TSecr=391737052
240 0.382462184 172.31.31.144 -> 172.31.24.227 TCP 66 6633 → 59644 [ACK] Seq=97 Ack=3189 Win=853 Len=0 TSval=2833177 TSecr=391737052
241 0.382638330 172.31.31.144 -> 172.31.24.227 TCP 66 6633 → 59644 [ACK] Seq=97 Ack=9301 Win=853 Len=0 TSval=2833177 TSecr=391737052
242 0.413101505 172.31.31.144 -> 172.31.24.227 OpenFlow 187 Type: OFPT_PACKET_OUT
243 0.413205947 172.31.31.144 -> 172.31.24.227 OpenFlow 187 Type: OFPT_PACKET_OUT
244 0.413211716 172.31.31.144 -> 172.31.24.227 OpenFlow 187 Type: OFPT_PACKET_OUT
245 0.413214706 172.31.31.144 -> 172.31.24.227 OpenFlow 187 Type: OFPT_PACKET_OUT
246 0.413389189 172.31.31.144 -> 172.31.24.227 OpenFlow 187 Type: OFPT_PACKET_OUT
247 0.413395533 172.31.31.144 -> 172.31.24.227 OpenFlow 187 Type: OFPT_PACKET_OUT
248 0.413397984 172.31.31.144 -> 172.31.24.227 OpenFlow 187 Type: OFPT_PACKET_OUT
249 0.413454513 172.31.31.144 -> 172.31.24.227 OpenFlow 187 Type: OFPT_PACKET_OUT
250 0.413610117 172.31.24.227 -> 172.31.31.144 TCP 66 59662 → 6633 [ACK] Seq=493 Ack=969 Win=213 Len=0 TSval=391737060 TSecr=2833185
251 0.413704021 172.31.24.227 -> 172.31.31.144 OpenFlow 189 Type: OFPT_PACKET_IN
252 0.413724858 172.31.24.227 -> 172.31.31.144 OpenFlow 189 Type: OFPT_PACKET_IN
253 0.413740027 172.31.24.227 -> 172.31.31.144 OpenFlow 189 Type: OFPT_PACKET_IN
254 0.413780476 172.31.24.227 -> 172.31.31.144 OpenFlow 189 Type: OFPT_PACKET_IN
255 0.413908924 172.31.24.227 -> 172.31.31.144 OpenFlow 189 Type: OFPT_PACKET_IN
256 0.413931173 172.31.24.227 -> 172.31.31.144 OpenFlow 189 Type: OFPT_PACKET_IN
257 0.413989584 172.31.31.144 -> 172.31.24.227 TCP 66 6633 → 59670 [ACK] Seq=1 Ack=124 Win=853 Len=0 TSval=2833185 TSecr=391737060
258 0.413995955 172.31.31.144 -> 172.31.24.227 TCP 66 6633 → 59670 [ACK] Seq=1 Ack=247 Win=853 Len=0 TSval=2833185 TSecr=391737060
259 0.413998531 172.31.31.144 -> 172.31.24.227 TCP 66 6633 → 59656 [ACK] Seq=969 Ack=616 Win=853 Len=0 TSval=2833185 TSecr=391737060
260 0.414019252 172.31.24.227 -> 172.31.31.144 OpenFlow 189 Type: OFPT_PACKET_IN
261 0.414025563 172.31.24.227 -> 172.31.31.144 OpenFlow 189 Type: OFPT_PACKET_IN
262 0.414114717 172.31.31.144 -> 172.31.24.227 TCP 66 6633 → 59656 [ACK] Seq=969 Ack=739 Win=853 Len=0 TSval=2833185 TSecr=391737060
263 0.414196007 172.31.31.144 -> 172.31.24.227 TCP 66 6633 → 59664 [ACK] Seq=1 Ack=370 Win=853 Len=0 TSval=2833185 TSecr=391737060
264 0.414237117 172.31.31.144 -> 172.31.24.227 TCP 66 6633 → 59660 [ACK] Seq=969 Ack=616 Win=853 Len=0 TSval=2833185 TSecr=391737060
265 0.414319144 172.31.31.144 -> 172.31.24.227 TCP 66 6633 → 59664 [ACK] Seq=1 Ack=493 Win=853 Len=0 TSval=2833185 TSecr=391737060
266 0.414406265 172.31.31.144 -> 172.31.24.227 TCP 66 6633 → 59660 [ACK] Seq=969 Ack=739 Win=853 Len=0 TSval=2833185 TSecr=391737060
267 0.417022237 172.31.31.144 -> 172.31.24.227 OpenFlow 90 Type: OFPT_MULTIPART_REQUEST, OFPMP_PORT_STATS
268 0.417028861 172.31.31.144 -> 172.31.24.227 OpenFlow 138 Type: OFPT_MULTIPART_REQUEST, OFPMP_FLOW
269 0.417240342 172.31.24.227 -> 172.31.31.144 OpenFlow 530 Type: OFPT_MULTIPART_REPLY, OFPMP_PORT_STATS
270 0.417371772 172.31.24.227 -> 172.31.31.144 OpenFlow 6178 Type: OFPT_MULTIPART_REPLY, OFPMP_TABLE
271 0.417411730 172.31.24.227 -> 172.31.31.144 OpenFlow 522 Type: OFPT_MULTIPART_REPLY, OFPMP_FLOW
272 0.417448257 172.31.31.144 -> 172.31.24.227 TCP 66 6633 → 59646 [ACK] Seq=823 Ack=711 Win=853 Len=0 TSval=2833186 TSecr=391737061
273 0.417638491 172.31.31.144 -> 172.31.24.227 TCP 66 6633 → 59646 [ACK] Seq=823 Ack=6823 Win=853 Len=0 TSval=2833186 TSecr=391737061
274 0.417644708 172.31.31.144 -> 172.31.24.227 TCP 66 6633 → 59646 [ACK] Seq=823 Ack=7279 Win=853 Len=0 TSval=2833186 TSecr=391737061
275 0.443696116 172.31.24.227 -> 137.158.125.247 SSH 98 Server: Encrypted packet (len=44)
276 0.475244177 172.31.31.144 -> 172.31.24.227 OpenFlow 90 Type: OFPT_MULTIPART_REQUEST, OFPMP_PORT_STATS
277 0.475253103 172.31.31.144 -> 172.31.24.227 OpenFlow 138 Type: OFPT_MULTIPART_REQUEST, OFPMP_TABLE
278 0.475424017 172.31.24.227 -> 172.31.31.144 OpenFlow 754 Type: OFPT_MULTIPART_REPLY, OFPMP_PORT_STATS
279 0.475498011 172.31.24.227 -> 172.31.31.144 OpenFlow 2602 Type: OFPT_MULTIPART_REPLY, OFPMP_FLOW
280 0.475645302 172.31.31.144 -> 172.31.24.227 TCP 66 6633 → 59648 [ACK] Seq=1307 Ack=1427 Win=853 Len=0 TSval=2833201 TSecr=391737075
281 0.475653357 172.31.24.227 -> 172.31.31.144 OpenFlow 6178 Type: OFPT_MULTIPART_REPLY, OFPMP_TABLE
282 0.475797135 172.31.31.144 -> 172.31.24.227 TCP 66 6633 → 59648 [ACK] Seq=1307 Ack=3963 Win=853 Len=0 TSval=2833201 TSecr=391737075
283 0.513743905 172.31.31.144 -> 172.31.24.227 OpenFlow 187 Type: OFPT_PACKET_OUT
284 0.513758729 172.31.31.144 -> 172.31.24.227 OpenFlow 187 Type: OFPT_PACKET_OUT
285 0.513827549 172.31.31.144 -> 172.31.24.227 OpenFlow 187 Type: OFPT_PACKET_OUT
286 0.513832794 172.31.31.144 -> 172.31.24.227 OpenFlow 187 Type: OFPT_PACKET_OUT
287 0.513869385 172.31.31.144 -> 172.31.24.227 OpenFlow 187 Type: OFPT_PACKET_OUT
288 0.513944873 172.31.31.144 -> 172.31.24.227 OpenFlow 187 Type: OFPT_PACKET_OUT
289 0.514000684 172.31.31.144 -> 172.31.24.227 OpenFlow 187 Type: OFPT_PACKET_OUT
290 0.514091212 172.31.31.144 -> 172.31.24.227 OpenFlow 187 Type: OFPT_PACKET_OUT
291 0.514097974 172.31.31.144 -> 172.31.24.227 OpenFlow 187 Type: OFPT_PACKET_OUT
292 0.514158012 172.31.31.144 -> 172.31.24.227 OpenFlow 187 Type: OFPT_PACKET_OUT
293 0.514217541 172.31.31.144 -> 172.31.24.227 OpenFlow 187 Type: OFPT_PACKET_OUT
294 0.514299468 172.31.31.144 -> 172.31.24.227 OpenFlow 187 Type: OFPT_PACKET_OUT
295 0.514316651 172.31.24.227 -> 172.31.31.144 TCP 66 59664 → 6633 [ACK] Seq=493 Ack=727 Win=213 Len=0 TSval=391737085 TSecr=2833210
296 0.514451236 172.31.24.227 -> 172.31.31.144 OpenFlow 189 Type: OFPT_PACKET_IN
297 0.514478215 172.31.24.227 -> 172.31.31.144 OpenFlow 189 Type: OFPT_PACKET_IN
298 0.514520693 172.31.24.227 -> 172.31.31.144 OpenFlow 189 Type: OFPT_PACKET_IN
299 0.514573538 172.31.24.227 -> 172.31.31.144 OpenFlow 189 Type: OFPT_PACKET_IN
300 0.514586084 172.31.24.227 -> 172.31.31.144 OpenFlow 189 Type: OFPT_PACKET_IN
301 0.514641779 172.31.24.227 -> 172.31.31.144 OpenFlow 189 Type: OFPT_PACKET_IN
302 0.514688328 172.31.31.144 -> 172.31.24.227 TCP 66 6633 → 59662 [ACK] Seq=969 Ack=616 Win=853 Len=0 TSval=2833210 TSecr=391737085
303 0.514886932 172.31.31.144 -> 172.31.24.227 TCP 66 6633 → 59672 [ACK] Seq=1 Ack=124 Win=853 Len=0 TSval=2833210 TSecr=391737085
304 0.514894030 172.31.31.144 -> 172.31.24.227 TCP 66 6633 → 59656 [ACK] Seq=969 Ack=985 Win=853 Len=0 TSval=2833210 TSecr=391737085
305 0.514897482 172.31.31.144 -> 172.31.24.227 TCP 66 6633 → 59662 [ACK] Seq=969 Ack=739 Win=853 Len=0 TSval=2833210 TSecr=391737085
306 0.514917840 172.31.24.227 -> 172.31.31.144 TCP 66 59666 → 6633 [ACK] Seq=247 Ack=727 Win=213 Len=0 TSval=391737085 TSecr=2833210
307 0.514950745 172.31.31.144 -> 172.31.24.227 TCP 66 6633 → 59672 [ACK] Seq=1 Ack=247 Win=853 Len=0 TSval=2833210 TSecr=391737085
308 0.515075942 172.31.31.144 -> 172.31.24.227 TCP 66 6633 → 59648 [ACK] Seq=1307 Ack=10075 Win=853 Len=0 TSval=2833211 TSecr=391737075
309 0.515108096 172.31.24.227 -> 172.31.31.144 OpenFlow 189 Type: OFPT_PACKET_IN
310 0.515133809 172.31.24.227 -> 172.31.31.144 OpenFlow 189 Type: OFPT_PACKET_IN
311 0.515165899 172.31.24.227 -> 172.31.31.144 OpenFlow 189 Type: OFPT_PACKET_IN
312 0.515202423 172.31.24.227 -> 172.31.31.144 OpenFlow 189 Type: OFPT_PACKET_IN
313 0.515262356 172.31.24.227 -> 172.31.31.144 OpenFlow 189 Type: OFPT_PACKET_IN
314 0.515268714 172.31.24.227 -> 172.31.31.144 OpenFlow 189 Type: OFPT_PACKET_IN
315 0.515419708 172.31.31.144 -> 172.31.24.227 TCP 66 6633 → 59676 [ACK] Seq=1 Ack=124 Win=853 Len=0 TSval=2833211 TSecr=391737085
316 0.515515034 172.31.31.144 -> 172.31.24.227 TCP 66 6633 → 59676 [ACK] Seq=1 Ack=247 Win=853 Len=0 TSval=2833211 TSecr=391737085
317 0.515518774 172.31.31.144 -> 172.31.24.227 TCP 66 6633 → 59668 [ACK] Seq=1 Ack=370 Win=853 Len=0 TSval=2833211 TSecr=391737085
318 0.515630060 172.31.31.144 -> 172.31.24.227 TCP 66 6633 → 59668 [ACK] Seq=1 Ack=493 Win=853 Len=0 TSval=2833211 TSecr=391737085
319 0.515633478 172.31.31.144 -> 172.31.24.227 TCP 66 6633 → 59658 [ACK] Seq=1211 Ack=985 Win=853 Len=0 TSval=2833211 TSecr=391737085
320 0.558509152 172.31.31.144 -> 172.31.24.227 OpenFlow 122 Type: OFPT_MULTIPART_REQUEST, OFPMP_FLOW
321 0.558528779 172.31.31.144 -> 172.31.24.227 OpenFlow 106 Type: OFPT_MULTIPART_REQUEST, OFPMP_PORT_STATS
322 0.558820151 172.31.24.227 -> 172.31.31.144 OpenFlow 1978 Type: OFPT_MULTIPART_REPLY, OFPMP_FLOW
323 0.558969563 172.31.24.227 -> 172.31.31.144 OpenFlow 6178 Type: OFPT_MULTIPART_REPLY, OFPMP_TABLE
324 0.559060152 172.31.31.144 -> 172.31.24.227 TCP 66 6633 → 59650 [ACK] Seq=1307 Ack=2897 Win=853 Len=0 TSval=2833222 TSecr=391737096
325 0.559126602 172.31.24.227 -> 172.31.31.144 OpenFlow 754 Type: OFPT_MULTIPART_REPLY, OFPMP_PORT_STATS
326 0.559195222 172.31.31.144 -> 172.31.24.227 TCP 66 6633 → 59650 [ACK] Seq=1307 Ack=9009 Win=853 Len=0 TSval=2833222 TSecr=391737096
327 0.559336764 172.31.31.144 -> 172.31.24.227 TCP 66 6633 → 59650 [ACK] Seq=1307 Ack=9697 Win=853 Len=0 TSval=2833222 TSecr=391737096
328 0.596700217 172.31.31.144 -> 172.31.24.227 OpenFlow 122 Type: OFPT_MULTIPART_REQUEST, OFPMP_FLOW
329 0.596709595 172.31.31.144 -> 172.31.24.227 OpenFlow 90 Type: OFPT_MULTIPART_REQUEST, OFPMP_PORT_STATS
330 0.596856735 172.31.24.227 -> 172.31.31.144 OpenFlow 1354 Type: OFPT_MULTIPART_REPLY, OFPMP_FLOW
331 0.596936349 172.31.24.227 -> 172.31.31.144 OpenFlow 530 Type: OFPT_MULTIPART_REPLY, OFPMP_PORT_STATS
332 0.597092839 172.31.31.144 -> 172.31.24.227 TCP 66 6633 → 59652 [ACK] Seq=807 Ack=1781 Win=853 Len=0 TSval=2833231 TSecr=391737106
333 0.597192126 172.31.31.144 -> 172.31.24.227 TCP 66 6633 → 59652 [ACK] Seq=807 Ack=2245 Win=853 Len=0 TSval=2833231 TSecr=391737106
334 0.597700309 172.31.31.144 -> 172.31.24.227 OpenFlow 82 Type: OFPT_MULTIPART_REQUEST, OFPMP_TABLE
335 0.597978315 172.31.24.227 -> 172.31.31.144 OpenFlow 6178 Type: OFPT_MULTIPART_REPLY, OFPMP_TABLE
336 0.613589752 172.31.31.144 -> 172.31.24.227 OpenFlow 187 Type: OFPT_PACKET_OUT
337 0.613599265 172.31.31.144 -> 172.31.24.227 OpenFlow 187 Type: OFPT_PACKET_OUT
338 0.613668714 172.31.31.144 -> 172.31.24.227 OpenFlow 187 Type: OFPT_PACKET_OUT
339 0.613674224 172.31.31.144 -> 172.31.24.227 OpenFlow 187 Type: OFPT_PACKET_OUT
340 0.613708362 172.31.31.144 -> 172.31.24.227 OpenFlow 187 Type: OFPT_PACKET_OUT
341 0.613780570 172.31.31.144 -> 172.31.24.227 OpenFlow 187 Type: OFPT_PACKET_OUT
342 0.613847883 172.31.31.144 -> 172.31.24.227 OpenFlow 187 Type: OFPT_PACKET_OUT
343 0.613932168 172.31.31.144 -> 172.31.24.227 OpenFlow 187 Type: OFPT_PACKET_OUT
344 0.613937922 172.31.31.144 -> 172.31.24.227 OpenFlow 187 Type: OFPT_PACKET_OUT
345 0.613985093 172.31.31.144 -> 172.31.24.227 OpenFlow 187 Type: OFPT_PACKET_OUT
346 0.614322985 172.31.24.227 -> 172.31.31.144 TCP 66 59668 → 6633 [ACK] Seq=493 Ack=1211 Win=213 Len=0 TSval=391737110 TSecr=2833235
347 0.614446354 172.31.24.227 -> 172.31.31.144 OpenFlow 189 Type: OFPT_PACKET_IN
348 0.614468196 172.31.24.227 -> 172.31.31.144 OpenFlow 189 Type: OFPT_PACKET_IN
349 0.614503696 172.31.24.227 -> 172.31.31.144 OpenFlow 189 Type: OFPT_PACKET_IN
350 0.614528272 172.31.24.227 -> 172.31.31.144 OpenFlow 189 Type: OFPT_PACKET_IN
351 0.614543288 172.31.24.227 -> 172.31.31.144 OpenFlow 189 Type: OFPT_PACKET_IN
352 0.614564804 172.31.24.227 -> 172.31.31.144 OpenFlow 189 Type: OFPT_PACKET_IN
353 0.614605101 172.31.24.227 -> 172.31.31.144 OpenFlow 189 Type: OFPT_PACKET_IN
354 0.614611206 172.31.24.227 -> 172.31.31.144 OpenFlow 189 Type: OFPT_PACKET_IN
355 0.614670586 172.31.31.144 -> 172.31.24.227 TCP 66 6633 → 59670 [ACK] Seq=1 Ack=370 Win=853 Len=0 TSval=2833235 TSecr=391737110
356 0.614677391 172.31.31.144 -> 172.31.24.227 TCP 66 6633 → 59670 [ACK] Seq=1 Ack=493 Win=853 Len=0 TSval=2833235 TSecr=391737110
357 0.614719030 172.31.24.227 -> 172.31.31.144 OpenFlow 189 Type: OFPT_PACKET_IN
358 0.614735020 172.31.24.227 -> 172.31.31.144 OpenFlow 189 Type: OFPT_PACKET_IN
359 0.614836595 172.31.31.144 -> 172.31.24.227 TCP 66 6633 → 59680 [ACK] Seq=1 Ack=124 Win=853 Len=0 TSval=2833235 TSecr=391737110
360 0.614843019 172.31.31.144 -> 172.31.24.227 TCP 66 6633 → 59680 [ACK] Seq=1 Ack=247 Win=853 Len=0 TSval=2833235 TSecr=391737110
361 0.614845699 172.31.31.144 -> 172.31.24.227 TCP 66 6633 → 59678 [ACK] Seq=1 Ack=124 Win=853 Len=0 TSval=2833235 TSecr=391737110
362 0.614848444 172.31.31.144 -> 172.31.24.227 TCP 66 6633 → 59666 [ACK] Seq=727 Ack=370 Win=853 Len=0 TSval=2833235 TSecr=391737110
363 0.614978228 172.31.31.144 -> 172.31.24.227 TCP 66 6633 → 59678 [ACK] Seq=1 Ack=247 Win=853 Len=0 TSval=2833235 TSecr=391737110
364 0.614984555 172.31.31.144 -> 172.31.24.227 TCP 66 6633 → 59666 [ACK] Seq=727 Ack=493 Win=853 Len=0 TSval=2833235 TSecr=391737110
365 0.614996300 172.31.31.144 -> 172.31.24.227 TCP 66 6633 → 59660 [ACK] Seq=969 Ack=862 Win=853 Len=0 TSval=2833235 TSecr=391737110
366 0.615215114 172.31.31.144 -> 172.31.24.227 TCP 66 6633 → 59660 [ACK] Seq=969 Ack=985 Win=853 Len=0 TSval=2833236 TSecr=391737110
367 0.635079410 172.31.31.144 -> 172.31.24.227 TCP 66 6633 → 59652 [ACK] Seq=823 Ack=8357 Win=853 Len=0 TSval=2833241 TSecr=391737106
368 0.653048839 137.158.125.247 -> 172.31.24.227 TCP 54 63468 → 22 [ACK] Seq=1 Ack=437 Win=32346 Len=0
369 0.655886445 172.31.31.144 -> 172.31.24.227 OpenFlow 122 Type: OFPT_MULTIPART_REQUEST, OFPMP_FLOW
370 0.655895179 172.31.31.144 -> 172.31.24.227 OpenFlow 106 Type: OFPT_MULTIPART_REQUEST, OFPMP_PORT_STATS
371 0.656062840 172.31.24.227 -> 172.31.31.144 OpenFlow 3018 Type: OFPT_MULTIPART_REPLY, OFPMP_FLOW
372 0.656201843 172.31.24.227 -> 172.31.31.144 OpenFlow 6178 Type: OFPT_MULTIPART_REPLY, OFPMP_TABLE
373 0.656292841 172.31.31.144 -> 172.31.24.227 TCP 66 6633 → 59654 [ACK] Seq=1307 Ack=4183 Win=853 Len=0 TSval=2833246 TSecr=391737121
374 0.656344305 172.31.24.227 -> 172.31.31.144 OpenFlow 754 Type: OFPT_MULTIPART_REPLY, OFPMP_PORT_STATS
375 0.656461499 172.31.31.144 -> 172.31.24.227 TCP 66 6633 → 59654 [ACK] Seq=1307 Ack=10295 Win=853 Len=0 TSval=2833246 TSecr=391737121
376 0.656544012 172.31.31.144 -> 172.31.24.227 TCP 66 6633 → 59654 [ACK] Seq=1307 Ack=10983 Win=853 Len=0 TSval=2833246 TSecr=391737121
377 0.708093917 172.31.31.144 -> 172.31.24.227 OpenFlow 90 Type: OFPT_MULTIPART_REQUEST, OFPMP_PORT_STATS
378 0.708104554 172.31.31.144 -> 172.31.24.227 OpenFlow 138 Type: OFPT_MULTIPART_REQUEST, OFPMP_FLOW
379 0.708332168 172.31.24.227 -> 172.31.31.144 OpenFlow 642 Type: OFPT_MULTIPART_REPLY, OFPMP_PORT_STATS
