  1 0.000000000 172.31.31.144 -> 172.31.24.227 TCP 187 6633 → 50430 [PSH, ACK] Seq=1 Ack=1 Win=853 Len=121 TSval=1240455 TSecr=394305027
  2 0.000034737 172.31.31.144 -> 172.31.24.227 TCP 187 6633 → 50430 [PSH, ACK] Seq=122 Ack=1 Win=853 Len=121 TSval=1240455 TSecr=394305027
  3 0.000039972 172.31.31.144 -> 172.31.24.227 TCP 429 6633 → 50430 [PSH, ACK] Seq=243 Ack=1 Win=853 Len=363 TSval=1240455 TSecr=394305027
  4 0.000042987 172.31.31.144 -> 172.31.24.227 TCP 187 6633 → 50430 [PSH, ACK] Seq=606 Ack=1 Win=853 Len=121 TSval=1240455 TSecr=394305027
  5 0.000688842 172.31.24.227 -> 172.31.31.144 TCP 66 50430 → 6633 [ACK] Seq=1 Ack=727 Win=213 Len=0 TSval=394305727 TSecr=1240455
  6 0.000931307 172.31.24.227 -> 172.31.31.144 OpenFlow 189 Type: OFPT_PACKET_IN
  7 0.000954387 172.31.24.227 -> 172.31.31.144 OpenFlow 189 Type: OFPT_PACKET_IN
  8 0.001005891 172.31.24.227 -> 172.31.31.144 OpenFlow 189 Type: OFPT_PACKET_IN
  9 0.001023366 172.31.24.227 -> 172.31.31.144 OpenFlow 189 Type: OFPT_PACKET_IN
 10 0.001191682 172.31.31.144 -> 172.31.24.227 TCP 66 6633 → 50440 [ACK] Seq=1 Ack=124 Win=853 Len=0 TSval=1240455 TSecr=394305727
 11 0.001201954 172.31.31.144 -> 172.31.24.227 TCP 66 6633 → 50440 [ACK] Seq=1 Ack=247 Win=853 Len=0 TSval=1240455 TSecr=394305727
 12 0.001204903 172.31.31.144 -> 172.31.24.227 TCP 66 6633 → 50432 [ACK] Seq=1 Ack=124 Win=853 Len=0 TSval=1240455 TSecr=394305727
 13 0.001238647 172.31.31.144 -> 172.31.24.227 TCP 66 6633 → 50432 [ACK] Seq=1 Ack=247 Win=853 Len=0 TSval=1240455 TSecr=394305727
 14 0.101013087 172.31.31.144 -> 172.31.24.227 OpenFlow 187 Type: OFPT_PACKET_OUT
 15 0.101031705 172.31.31.144 -> 172.31.24.227 OpenFlow 187 Type: OFPT_PACKET_OUT
 16 0.101038456 172.31.31.144 -> 172.31.24.227 OpenFlow 429 Type: OFPT_PACKET_OUT
 17 0.101041460 172.31.31.144 -> 172.31.24.227 OpenFlow 429 Type: OFPT_PACKET_OUT
 18 0.101043999 172.31.31.144 -> 172.31.24.227 TCP 187 6633 → 50434 [PSH, ACK] Seq=1 Ack=1 Win=853 Len=121 TSval=1240480 TSecr=394305027
 19 0.101049309 172.31.31.144 -> 172.31.24.227 TCP 429 6633 → 50434 [PSH, ACK] Seq=122 Ack=1 Win=853 Len=363 TSval=1240480 TSecr=394305027
 20 0.101051401 172.31.31.144 -> 172.31.24.227 TCP 792 6633 → 50434 [PSH, ACK] Seq=485 Ack=1 Win=853 Len=726 TSval=1240480 TSecr=394305027
 21 0.101653204 172.31.24.227 -> 172.31.31.144 TCP 66 50434 → 6633 [ACK] Seq=1 Ack=1211 Win=213 Len=0 TSval=394305752 TSecr=1240480
 22 0.101812501 172.31.24.227 -> 172.31.31.144 OpenFlow 189 Type: OFPT_PACKET_IN
 23 0.101841839 172.31.24.227 -> 172.31.31.144 OpenFlow 189 Type: OFPT_PACKET_IN
 24 0.102064801 172.31.31.144 -> 172.31.24.227 TCP 66 6633 → 50432 [ACK] Seq=969 Ack=370 Win=853 Len=0 TSval=1240480 TSecr=394305752
 25 0.102073218 172.31.31.144 -> 172.31.24.227 TCP 66 6633 → 50432 [ACK] Seq=969 Ack=493 Win=853 Len=0 TSval=1240480 TSecr=394305752
 26 0.102312179 172.31.24.227 -> 172.31.31.144 OpenFlow 189 Type: OFPT_PACKET_IN
 27 0.102343445 172.31.24.227 -> 172.31.31.144 OpenFlow 189 Type: OFPT_PACKET_IN
 28 0.102384805 172.31.24.227 -> 172.31.31.144 OpenFlow 189 Type: OFPT_PACKET_IN
 29 0.102403169 172.31.24.227 -> 172.31.31.144 OpenFlow 189 Type: OFPT_PACKET_IN
 30 0.102418721 172.31.24.227 -> 172.31.31.144 OpenFlow 189 Type: OFPT_PACKET_IN
 31 0.102457361 172.31.24.227 -> 172.31.31.144 OpenFlow 189 Type: OFPT_PACKET_IN
 32 0.102552800 172.31.24.227 -> 172.31.31.144 OpenFlow 189 Type: OFPT_PACKET_IN
 33 0.102589073 172.31.24.227 -> 172.31.31.144 OpenFlow 189 Type: OFPT_PACKET_IN
 34 0.102619426 172.31.24.227 -> 172.31.31.144 OpenFlow 189 Type: OFPT_PACKET_IN
 35 0.102661433 172.31.31.144 -> 172.31.24.227 TCP 66 6633 → 50430 [ACK] Seq=727 Ack=124 Win=853 Len=0 TSval=1240481 TSecr=394305753
 36 0.102670655 172.31.31.144 -> 172.31.24.227 TCP 66 6633 → 50430 [ACK] Seq=727 Ack=247 Win=853 Len=0 TSval=1240481 TSecr=394305753
 37 0.102673681 172.31.31.144 -> 172.31.24.227 TCP 66 6633 → 50442 [ACK] Seq=1 Ack=124 Win=853 Len=0 TSval=1240481 TSecr=394305753
 38 0.102677189 172.31.31.144 -> 172.31.24.227 TCP 66 6633 → 50442 [ACK] Seq=1 Ack=247 Win=853 Len=0 TSval=1240481 TSecr=394305753
 39 0.102691407 172.31.24.227 -> 172.31.31.144 OpenFlow 189 Type: OFPT_PACKET_IN
 40 0.102697674 172.31.24.227 -> 172.31.31.144 OpenFlow 189 Type: OFPT_PACKET_IN
 41 0.102738069 172.31.31.144 -> 172.31.24.227 TCP 66 6633 → 50438 [ACK] Seq=1 Ack=124 Win=853 Len=0 TSval=1240481 TSecr=394305753
 42 0.102743229 172.31.31.144 -> 172.31.24.227 TCP 66 6633 → 50438 [ACK] Seq=1 Ack=247 Win=853 Len=0 TSval=1240481 TSecr=394305753
 43 0.102748583 172.31.24.227 -> 172.31.31.144 OpenFlow 189 Type: OFPT_PACKET_IN
 44 0.102870858 172.31.31.144 -> 172.31.24.227 TCP 66 6633 → 50436 [ACK] Seq=1 Ack=124 Win=853 Len=0 TSval=1240481 TSecr=394305753
 45 0.102878240 172.31.31.144 -> 172.31.24.227 TCP 66 6633 → 50440 [ACK] Seq=1 Ack=370 Win=853 Len=0 TSval=1240481 TSecr=394305753
 46 0.102881067 172.31.31.144 -> 172.31.24.227 TCP 66 6633 → 50434 [ACK] Seq=1211 Ack=124 Win=853 Len=0 TSval=1240481 TSecr=394305753
 47 0.102925973 172.31.31.144 -> 172.31.24.227 TCP 66 6633 → 50436 [ACK] Seq=1 Ack=247 Win=853 Len=0 TSval=1240481 TSecr=394305753
 48 0.102929624 172.31.31.144 -> 172.31.24.227 TCP 66 6633 → 50440 [ACK] Seq=1 Ack=493 Win=853 Len=0 TSval=1240481 TSecr=394305753
 49 0.102970769 172.31.31.144 -> 172.31.24.227 TCP 66 6633 → 50434 [ACK] Seq=1211 Ack=247 Win=853 Len=0 TSval=1240481 TSecr=394305753
 50 0.200273260 172.31.31.144 -> 172.31.24.227 OpenFlow 187 Type: OFPT_PACKET_OUT
 51 0.200286289 172.31.31.144 -> 172.31.24.227 OpenFlow 187 Type: OFPT_PACKET_OUT
 52 0.200290207 172.31.31.144 -> 172.31.24.227 OpenFlow 187 Type: OFPT_PACKET_OUT
 53 0.200313969 172.31.31.144 -> 172.31.24.227 OpenFlow 187 Type: OFPT_PACKET_OUT
 54 0.200364624 172.31.31.144 -> 172.31.24.227 OpenFlow 187 Type: OFPT_PACKET_OUT
 55 0.200418654 172.31.31.144 -> 172.31.24.227 OpenFlow 187 Type: OFPT_PACKET_OUT
 56 0.200470847 172.31.31.144 -> 172.31.24.227 OpenFlow 187 Type: OFPT_PACKET_OUT
 57 0.200531308 172.31.31.144 -> 172.31.24.227 OpenFlow 187 Type: OFPT_PACKET_OUT
 58 0.200596183 172.31.31.144 -> 172.31.24.227 OpenFlow 187 Type: OFPT_PACKET_OUT
 59 0.200625530 172.31.31.144 -> 172.31.24.227 OpenFlow 187 Type: OFPT_PACKET_OUT
 60 0.200680570 172.31.31.144 -> 172.31.24.227 OpenFlow 187 Type: OFPT_PACKET_OUT
 61 0.200735539 172.31.31.144 -> 172.31.24.227 OpenFlow 187 Type: OFPT_PACKET_OUT
 62 0.200792986 172.31.31.144 -> 172.31.24.227 OpenFlow 187 Type: OFPT_PACKET_OUT
 63 0.200836190 172.31.31.144 -> 172.31.24.227 OpenFlow 187 Type: OFPT_PACKET_OUT
 64 0.200847722 172.31.24.227 -> 172.31.31.144 TCP 66 50436 → 6633 [ACK] Seq=247 Ack=969 Win=213 Len=0 TSval=394305777 TSecr=1240505
 65 0.200936366 172.31.24.227 -> 172.31.31.144 OpenFlow 189 Type: OFPT_PACKET_IN
 66 0.200957458 172.31.24.227 -> 172.31.31.144 OpenFlow 189 Type: OFPT_PACKET_IN
 67 0.201012665 172.31.24.227 -> 172.31.31.144 OpenFlow 189 Type: OFPT_PACKET_IN
 68 0.201035349 172.31.24.227 -> 172.31.31.144 OpenFlow 189 Type: OFPT_PACKET_IN
 69 0.201110199 172.31.31.144 -> 172.31.24.227 TCP 66 6633 → 50434 [ACK] Seq=1211 Ack=370 Win=853 Len=0 TSval=1240505 TSecr=394305777
 70 0.201120097 172.31.24.227 -> 172.31.31.144 OpenFlow 189 Type: OFPT_PACKET_IN
 71 0.201164664 172.31.31.144 -> 172.31.24.227 TCP 66 6633 → 50434 [ACK] Seq=1211 Ack=493 Win=853 Len=0 TSval=1240505 TSecr=394305777
 72 0.201177171 172.31.24.227 -> 172.31.31.144 OpenFlow 189 Type: OFPT_PACKET_IN
 73 0.201238802 172.31.31.144 -> 172.31.24.227 TCP 66 6633 → 50444 [ACK] Seq=1 Ack=124 Win=853 Len=0 TSval=1240505 TSecr=394305777
 74 0.201247399 172.31.31.144 -> 172.31.24.227 TCP 66 6633 → 50444 [ACK] Seq=1 Ack=247 Win=853 Len=0 TSval=1240505 TSecr=394305777
 75 0.201481008 172.31.31.144 -> 172.31.24.227 TCP 66 6633 → 50438 [ACK] Seq=727 Ack=493 Win=853 Len=0 TSval=1240505 TSecr=394305777
 76 0.201604479 172.31.24.227 -> 172.31.31.144 OpenFlow 189 Type: OFPT_PACKET_IN
 77 0.201624761 172.31.24.227 -> 172.31.31.144 OpenFlow 189 Type: OFPT_PACKET_IN
 78 0.201656475 172.31.24.227 -> 172.31.31.144 OpenFlow 189 Type: OFPT_PACKET_IN
 79 0.201686268 172.31.24.227 -> 172.31.31.144 OpenFlow 189 Type: OFPT_PACKET_IN
 80 0.201767914 172.31.24.227 -> 172.31.31.144 OpenFlow 189 Type: OFPT_PACKET_IN
 81 0.201786189 172.31.24.227 -> 172.31.31.144 OpenFlow 189 Type: OFPT_PACKET_IN
 82 0.201882607 172.31.31.144 -> 172.31.24.227 TCP 66 6633 → 50436 [ACK] Seq=969 Ack=493 Win=853 Len=0 TSval=1240505 TSecr=394305777
 83 0.201890393 172.31.31.144 -> 172.31.24.227 TCP 66 6633 → 50434 [ACK] Seq=1211 Ack=616 Win=853 Len=0 TSval=1240505 TSecr=394305777
 84 0.201893228 172.31.31.144 -> 172.31.24.227 TCP 66 6633 → 50434 [ACK] Seq=1211 Ack=739 Win=853 Len=0 TSval=1240505 TSecr=394305777
 85 0.201960964 172.31.31.144 -> 172.31.24.227 TCP 66 6633 → 50442 [ACK] Seq=1 Ack=370 Win=853 Len=0 TSval=1240505 TSecr=394305777
 86 0.202047160 172.31.31.144 -> 172.31.24.227 TCP 66 6633 → 50442 [ACK] Seq=1 Ack=493 Win=853 Len=0 TSval=1240505 TSecr=394305777
 87 0.300370708 172.31.31.144 -> 172.31.24.227 OpenFlow 187 Type: OFPT_PACKET_OUT
 88 0.300390430 172.31.31.144 -> 172.31.24.227 OpenFlow 187 Type: OFPT_PACKET_OUT
 89 0.300479279 172.31.31.144 -> 172.31.24.227 OpenFlow 187 Type: OFPT_PACKET_OUT
 90 0.300525201 172.31.31.144 -> 172.31.24.227 OpenFlow 187 Type: OFPT_PACKET_OUT
 91 0.300596085 172.31.31.144 -> 172.31.24.227 OpenFlow 187 Type: OFPT_PACKET_OUT
 92 0.300631528 172.31.31.144 -> 172.31.24.227 OpenFlow 187 Type: OFPT_PACKET_OUT
 93 0.300691922 172.31.31.144 -> 172.31.24.227 OpenFlow 187 Type: OFPT_PACKET_OUT
 94 0.300738933 172.31.31.144 -> 172.31.24.227 OpenFlow 187 Type: OFPT_PACKET_OUT
 95 0.300797356 172.31.31.144 -> 172.31.24.227 OpenFlow 187 Type: OFPT_PACKET_OUT
 96 0.300838367 172.31.31.144 -> 172.31.24.227 OpenFlow 187 Type: OFPT_PACKET_OUT
 97 0.300903602 172.31.31.144 -> 172.31.24.227 OpenFlow 187 Type: OFPT_PACKET_OUT
 98 0.300947585 172.31.31.144 -> 172.31.24.227 OpenFlow 187 Type: OFPT_PACKET_OUT
 99 0.300997766 172.31.31.144 -> 172.31.24.227 OpenFlow 187 Type: OFPT_PACKET_OUT
100 0.301047214 172.31.31.144 -> 172.31.24.227 OpenFlow 187 Type: OFPT_PACKET_OUT
101 0.301111224 172.31.31.144 -> 172.31.24.227 OpenFlow 187 Type: OFPT_PACKET_OUT
102 0.301168975 172.31.31.144 -> 172.31.24.227 OpenFlow 187 Type: OFPT_PACKET_OUT
103 0.301201627 172.31.24.227 -> 172.31.31.144 TCP 66 50440 → 6633 [ACK] Seq=493 Ack=1211 Win=213 Len=0 TSval=394305802 TSecr=1240530
104 0.301217252 172.31.31.144 -> 172.31.24.227 OpenFlow 187 Type: OFPT_PACKET_OUT
105 0.301307044 172.31.31.144 -> 172.31.24.227 OpenFlow 187 Type: OFPT_PACKET_OUT
106 0.301313887 172.31.31.144 -> 172.31.24.227 OpenFlow 187 Type: OFPT_PACKET_OUT
107 0.301354190 172.31.24.227 -> 172.31.31.144 OpenFlow 189 Type: OFPT_PACKET_IN
108 0.301371111 172.31.31.144 -> 172.31.24.227 OpenFlow 187 Type: OFPT_PACKET_OUT
109 0.301378479 172.31.24.227 -> 172.31.31.144 OpenFlow 189 Type: OFPT_PACKET_IN
110 0.301410202 172.31.24.227 -> 172.31.31.144 OpenFlow 189 Type: OFPT_PACKET_IN
111 0.301432918 172.31.24.227 -> 172.31.31.144 OpenFlow 189 Type: OFPT_PACKET_IN
112 0.301475710 172.31.24.227 -> 172.31.31.144 OpenFlow 189 Type: OFPT_PACKET_IN
113 0.301489981 172.31.24.227 -> 172.31.31.144 OpenFlow 189 Type: OFPT_PACKET_IN
114 0.301524015 172.31.24.227 -> 172.31.31.144 OpenFlow 189 Type: OFPT_PACKET_IN
115 0.301535906 172.31.31.144 -> 172.31.24.227 TCP 66 6633 → 50446 [ACK] Seq=1 Ack=124 Win=853 Len=0 TSval=1240530 TSecr=394305802
116 0.301619918 172.31.24.227 -> 172.31.31.144 OpenFlow 189 Type: OFPT_PACKET_IN
117 0.301668493 172.31.31.144 -> 172.31.24.227 TCP 66 6633 → 50446 [ACK] Seq=1 Ack=247 Win=853 Len=0 TSval=1240530 TSecr=394305802
118 0.301674938 172.31.31.144 -> 172.31.24.227 TCP 66 6633 → 50432 [ACK] Seq=969 Ack=616 Win=853 Len=0 TSval=1240530 TSecr=394305802
119 0.301677706 172.31.31.144 -> 172.31.24.227 TCP 66 6633 → 50430 [ACK] Seq=727 Ack=370 Win=853 Len=0 TSval=1240530 TSecr=394305802
120 0.301713618 172.31.31.144 -> 172.31.24.227 TCP 66 6633 → 50430 [ACK] Seq=727 Ack=493 Win=853 Len=0 TSval=1240530 TSecr=394305802
121 0.301766345 172.31.31.144 -> 172.31.24.227 TCP 66 6633 → 50432 [ACK] Seq=969 Ack=739 Win=853 Len=0 TSval=1240530 TSecr=394305802
122 0.302034532 172.31.31.144 -> 172.31.24.227 TCP 66 6633 → 50442 [ACK] Seq=1211 Ack=739 Win=853 Len=0 TSval=1240530 TSecr=394305802
123 0.302218705 172.31.24.227 -> 172.31.31.144 OpenFlow 189 Type: OFPT_PACKET_IN
124 0.302240214 172.31.24.227 -> 172.31.31.144 OpenFlow 189 Type: OFPT_PACKET_IN
125 0.302464481 172.31.31.144 -> 172.31.24.227 TCP 66 6633 → 50438 [ACK] Seq=727 Ack=739 Win=853 Len=0 TSval=1240531 TSecr=394305803
126 0.307739867 172.31.24.227 -> 172.31.31.144 OpenFlow 189 Type: OFPT_PACKET_IN
127 0.307766459 172.31.24.227 -> 172.31.31.144 OpenFlow 189 Type: OFPT_PACKET_IN
128 0.307782623 172.31.24.227 -> 172.31.31.144 OpenFlow 189 Type: OFPT_PACKET_IN
129 0.307801392 172.31.24.227 -> 172.31.31.144 OpenFlow 189 Type: OFPT_PACKET_IN
130 0.307873709 172.31.24.227 -> 172.31.31.144 OpenFlow 189 Type: OFPT_PACKET_IN
131 0.307881040 172.31.24.227 -> 172.31.31.144 OpenFlow 189 Type: OFPT_PACKET_IN
132 0.307942353 172.31.24.227 -> 172.31.31.144 OpenFlow 189 Type: OFPT_PACKET_IN
133 0.307972597 172.31.24.227 -> 172.31.31.144 OpenFlow 189 Type: OFPT_PACKET_IN
134 0.307996249 172.31.31.144 -> 172.31.24.227 TCP 66 6633 → 50450 [ACK] Seq=1 Ack=124 Win=853 Len=0 TSval=1240532 TSecr=394305804
135 0.308004196 172.31.31.144 -> 172.31.24.227 TCP 66 6633 → 50450 [ACK] Seq=1 Ack=247 Win=853 Len=0 TSval=1240532 TSecr=394305804
136 0.308065327 172.31.24.227 -> 172.31.31.144 OpenFlow 189 Type: OFPT_PACKET_IN
137 0.308072203 172.31.24.227 -> 172.31.31.144 OpenFlow 189 Type: OFPT_PACKET_IN
138 0.308098673 172.31.31.144 -> 172.31.24.227 TCP 66 6633 → 50434 [ACK] Seq=1211 Ack=862 Win=853 Len=0 TSval=1240532 TSecr=394305804
139 0.308103500 172.31.31.144 -> 172.31.24.227 TCP 66 6633 → 50440 [ACK] Seq=1211 Ack=616 Win=853 Len=0 TSval=1240532 TSecr=394305804
140 0.308205144 172.31.31.144 -> 172.31.24.227 TCP 66 6633 → 50434 [ACK] Seq=1211 Ack=985 Win=853 Len=0 TSval=1240532 TSecr=394305804
141 0.308210929 172.31.31.144 -> 172.31.24.227 TCP 66 6633 → 50446 [ACK] Seq=1 Ack=370 Win=853 Len=0 TSval=1240532 TSecr=394305804
142 0.308242000 172.31.31.144 -> 172.31.24.227 TCP 66 6633 → 50444 [ACK] Seq=1 Ack=370 Win=853 Len=0 TSval=1240532 TSecr=394305804
143 0.308308819 172.31.31.144 -> 172.31.24.227 TCP 66 6633 → 50446 [ACK] Seq=1 Ack=493 Win=853 Len=0 TSval=1240532 TSecr=394305804
144 0.308312883 172.31.31.144 -> 172.31.24.227 TCP 66 6633 → 50440 [ACK] Seq=1211 Ack=739 Win=853 Len=0 TSval=1240532 TSecr=394305804
145 0.308342450 172.31.31.144 -> 172.31.24.227 TCP 66 6633 → 50444 [ACK] Seq=1 Ack=493 Win=853 Len=0 TSval=1240532 TSecr=394305804
146 0.399777055 172.31.31.144 -> 172.31.24.227 OpenFlow 187 Type: OFPT_PACKET_OUT
147 0.399853336 172.31.31.144 -> 172.31.24.227 OpenFlow 187 Type: OFPT_PACKET_OUT
148 0.399871281 172.31.31.144 -> 172.31.24.227 OpenFlow 187 Type: OFPT_PACKET_OUT
149 0.399923157 172.31.31.144 -> 172.31.24.227 OpenFlow 187 Type: OFPT_PACKET_OUT
150 0.399961394 172.31.31.144 -> 172.31.24.227 OpenFlow 187 Type: OFPT_PACKET_OUT
151 0.400024758 172.31.31.144 -> 172.31.24.227 OpenFlow 187 Type: OFPT_PACKET_OUT
152 0.400145333 172.31.31.144 -> 172.31.24.227 OpenFlow 187 Type: OFPT_PACKET_OUT
153 0.400151172 172.31.31.144 -> 172.31.24.227 OpenFlow 187 Type: OFPT_PACKET_OUT
154 0.400239205 172.31.31.144 -> 172.31.24.227 OpenFlow 187 Type: OFPT_PACKET_OUT
155 0.400245236 172.31.31.144 -> 172.31.24.227 OpenFlow 187 Type: OFPT_PACKET_OUT
156 0.400296321 172.31.31.144 -> 172.31.24.227 OpenFlow 187 Type: OFPT_PACKET_OUT
157 0.400338094 172.31.31.144 -> 172.31.24.227 OpenFlow 187 Type: OFPT_PACKET_OUT
158 0.400393302 172.31.31.144 -> 172.31.24.227 OpenFlow 187 Type: OFPT_PACKET_OUT
159 0.400453962 172.31.31.144 -> 172.31.24.227 OpenFlow 187 Type: OFPT_PACKET_OUT
160 0.400508880 172.31.31.144 -> 172.31.24.227 OpenFlow 187 Type: OFPT_PACKET_OUT
161 0.400564532 172.31.31.144 -> 172.31.24.227 OpenFlow 187 Type: OFPT_PACKET_OUT
162 0.400611988 172.31.24.227 -> 172.31.31.144 TCP 66 50444 → 6633 [ACK] Seq=493 Ack=727 Win=213 Len=0 TSval=394305827 TSecr=1240555
163 0.400714004 172.31.24.227 -> 172.31.31.144 OpenFlow 189 Type: OFPT_PACKET_IN
164 0.400735429 172.31.24.227 -> 172.31.31.144 OpenFlow 189 Type: OFPT_PACKET_IN
165 0.400797583 172.31.24.227 -> 172.31.31.144 OpenFlow 189 Type: OFPT_PACKET_IN
166 0.400816799 172.31.24.227 -> 172.31.31.144 OpenFlow 189 Type: OFPT_PACKET_IN
167 0.400928132 172.31.31.144 -> 172.31.24.227 TCP 66 6633 → 50448 [ACK] Seq=1 Ack=124 Win=853 Len=0 TSval=1240555 TSecr=394305827
168 0.400938784 172.31.31.144 -> 172.31.24.227 TCP 66 6633 → 50448 [ACK] Seq=1 Ack=247 Win=853 Len=0 TSval=1240555 TSecr=394305827
169 0.400953685 172.31.24.227 -> 172.31.31.144 OpenFlow 189 Type: OFPT_PACKET_IN
170 0.400998463 172.31.24.227 -> 172.31.31.144 OpenFlow 189 Type: OFPT_PACKET_IN
171 0.401023288 172.31.31.144 -> 172.31.24.227 TCP 66 6633 → 50442 [ACK] Seq=1211 Ack=862 Win=853 Len=0 TSval=1240555 TSecr=394305827
172 0.401132355 172.31.31.144 -> 172.31.24.227 TCP 66 6633 → 50442 [ACK] Seq=1211 Ack=985 Win=853 Len=0 TSval=1240555 TSecr=394305827
173 0.401222983 172.31.31.144 -> 172.31.24.227 TCP 66 6633 → 50436 [ACK] Seq=969 Ack=739 Win=853 Len=0 TSval=1240555 TSecr=394305827
174 0.401502964 172.31.24.227 -> 172.31.31.144 TCP 66 50446 → 6633 [ACK] Seq=493 Ack=1211 Win=213 Len=0 TSval=394305827 TSecr=1240555
175 0.401609410 172.31.24.227 -> 172.31.31.144 OpenFlow 189 Type: OFPT_PACKET_IN
176 0.401631012 172.31.24.227 -> 172.31.31.144 OpenFlow 189 Type: OFPT_PACKET_IN
177 0.401685350 172.31.24.227 -> 172.31.31.144 OpenFlow 189 Type: OFPT_PACKET_IN
178 0.401701928 172.31.24.227 -> 172.31.31.144 OpenFlow 189 Type: OFPT_PACKET_IN
179 0.401804348 172.31.24.227 -> 172.31.31.144 OpenFlow 189 Type: OFPT_PACKET_IN
180 0.401817538 172.31.31.144 -> 172.31.24.227 TCP 66 6633 → 50448 [ACK] Seq=1 Ack=370 Win=853 Len=0 TSval=1240555 TSecr=394305827
181 0.401823074 172.31.31.144 -> 172.31.24.227 TCP 66 6633 → 50448 [ACK] Seq=1 Ack=493 Win=853 Len=0 TSval=1240555 TSecr=394305827
182 0.401834704 172.31.24.227 -> 172.31.31.144 OpenFlow 189 Type: OFPT_PACKET_IN
183 0.401873229 172.31.24.227 -> 172.31.31.144 OpenFlow 189 Type: OFPT_PACKET_IN
184 0.401887715 172.31.31.144 -> 172.31.24.227 TCP 66 6633 → 50442 [ACK] Seq=1211 Ack=1108 Win=853 Len=0 TSval=1240555 TSecr=394305827
185 0.401901907 172.31.24.227 -> 172.31.31.144 OpenFlow 189 Type: OFPT_PACKET_IN
186 0.401943019 172.31.24.227 -> 172.31.31.144 OpenFlow 189 Type: OFPT_PACKET_IN
187 0.401948873 172.31.24.227 -> 172.31.31.144 OpenFlow 189 Type: OFPT_PACKET_IN
188 0.402128991 172.31.31.144 -> 172.31.24.227 TCP 66 6633 → 50442 [ACK] Seq=1211 Ack=1231 Win=853 Len=0 TSval=1240555 TSecr=394305827
189 0.402136342 172.31.31.144 -> 172.31.24.227 TCP 66 6633 → 50450 [ACK] Seq=1 Ack=370 Win=853 Len=0 TSval=1240555 TSecr=394305827
190 0.402139224 172.31.31.144 -> 172.31.24.227 TCP 66 6633 → 50452 [ACK] Seq=1 Ack=247 Win=853 Len=0 TSval=1240555 TSecr=394305827
191 0.402141776 172.31.31.144 -> 172.31.24.227 TCP 66 6633 → 50450 [ACK] Seq=1 Ack=493 Win=853 Len=0 TSval=1240555 TSecr=394305827
192 0.402200334 172.31.31.144 -> 172.31.24.227 TCP 66 6633 → 50440 [ACK] Seq=1211 Ack=985 Win=853 Len=0 TSval=1240555 TSecr=394305827
193 0.499997161 172.31.31.144 -> 172.31.24.227 OpenFlow 187 Type: OFPT_PACKET_OUT
194 0.500012335 172.31.31.144 -> 172.31.24.227 OpenFlow 187 Type: OFPT_PACKET_OUT
195 0.500017015 172.31.31.144 -> 172.31.24.227 OpenFlow 187 Type: OFPT_PACKET_OUT
196 0.500030165 172.31.31.144 -> 172.31.24.227 OpenFlow 187 Type: OFPT_PACKET_OUT
197 0.500084570 172.31.31.144 -> 172.31.24.227 OpenFlow 187 Type: OFPT_PACKET_OUT
198 0.500134031 172.31.31.144 -> 172.31.24.227 OpenFlow 187 Type: OFPT_PACKET_OUT
199 0.500191569 172.31.31.144 -> 172.31.24.227 OpenFlow 187 Type: OFPT_PACKET_OUT
200 0.500252558 172.31.31.144 -> 172.31.24.227 OpenFlow 187 Type: OFPT_PACKET_OUT
201 0.500310166 172.31.31.144 -> 172.31.24.227 OpenFlow 187 Type: OFPT_PACKET_OUT
202 0.500359416 172.31.31.144 -> 172.31.24.227 OpenFlow 187 Type: OFPT_PACKET_OUT
203 0.500412491 172.31.31.144 -> 172.31.24.227 OpenFlow 187 Type: OFPT_PACKET_OUT
204 0.500476059 172.31.31.144 -> 172.31.24.227 OpenFlow 187 Type: OFPT_PACKET_OUT
205 0.500515444 172.31.31.144 -> 172.31.24.227 OpenFlow 187 Type: OFPT_PACKET_OUT
206 0.500567584 172.31.31.144 -> 172.31.24.227 OpenFlow 187 Type: OFPT_PACKET_OUT
207 0.500622654 172.31.31.144 -> 172.31.24.227 OpenFlow 187 Type: OFPT_PACKET_OUT
208 0.500676783 172.31.31.144 -> 172.31.24.227 OpenFlow 187 Type: OFPT_PACKET_OUT
209 0.500728090 172.31.31.144 -> 172.31.24.227 OpenFlow 187 Type: OFPT_PACKET_OUT
210 0.500783219 172.31.24.227 -> 172.31.31.144 TCP 66 50448 → 6633 [ACK] Seq=493 Ack=969 Win=213 Len=0 TSval=394305852 TSecr=1240580
211 0.500791182 172.31.31.144 -> 172.31.24.227 OpenFlow 187 Type: OFPT_PACKET_OUT
212 0.500989629 172.31.24.227 -> 172.31.31.144 OpenFlow 189 Type: OFPT_PACKET_IN
213 0.501011295 172.31.24.227 -> 172.31.31.144 OpenFlow 189 Type: OFPT_PACKET_IN
214 0.501206115 172.31.31.144 -> 172.31.24.227 TCP 66 6633 → 50456 [ACK] Seq=1 Ack=124 Win=853 Len=0 TSval=1240580 TSecr=394305852
215 0.501214774 172.31.31.144 -> 172.31.24.227 TCP 66 6633 → 50456 [ACK] Seq=1 Ack=247 Win=853 Len=0 TSval=1240580 TSecr=394305852
216 0.501485176 172.31.24.227 -> 172.31.31.144 TCP 66 50450 → 6633 [ACK] Seq=493 Ack=1211 Win=213 Len=0 TSval=394305852 TSecr=1240580
217 0.501557124 172.31.24.227 -> 172.31.31.144 OpenFlow 189 Type: OFPT_PACKET_IN
218 0.501584767 172.31.24.227 -> 172.31.31.144 OpenFlow 189 Type: OFPT_PACKET_IN
219 0.501628986 172.31.24.227 -> 172.31.31.144 OpenFlow 189 Type: OFPT_PACKET_IN
220 0.501672493 172.31.24.227 -> 172.31.31.144 OpenFlow 189 Type: OFPT_PACKET_IN
221 0.501682385 172.31.24.227 -> 172.31.31.144 OpenFlow 189 Type: OFPT_PACKET_IN
222 0.501702782 172.31.24.227 -> 172.31.31.144 OpenFlow 189 Type: OFPT_PACKET_IN
223 0.501709202 172.31.24.227 -> 172.31.31.144 OpenFlow 189 Type: OFPT_PACKET_IN
224 0.501730681 172.31.24.227 -> 172.31.31.144 OpenFlow 189 Type: OFPT_PACKET_IN
225 0.501779988 172.31.31.144 -> 172.31.24.227 TCP 66 6633 → 50440 [ACK] Seq=1211 Ack=1108 Win=853 Len=0 TSval=1240580 TSecr=394305852
226 0.501812767 172.31.24.227 -> 172.31.31.144 OpenFlow 435 Type: OFPT_PACKET_IN
227 0.501832426 172.31.24.227 -> 172.31.31.144 OpenFlow 189 Type: OFPT_PACKET_IN
228 0.501938293 172.31.31.144 -> 172.31.24.227 TCP 66 6633 → 50466 [ACK] Seq=1 Ack=124 Win=853 Len=0 TSval=1240580 TSecr=394305852
229 0.501961914 172.31.31.144 -> 172.31.24.227 TCP 66 6633 → 50440 [ACK] Seq=1211 Ack=1231 Win=853 Len=0 TSval=1240580 TSecr=394305852
230 0.501965130 172.31.31.144 -> 172.31.24.227 TCP 66 6633 → 50454 [ACK] Seq=1 Ack=247 Win=853 Len=0 TSval=1240580 TSecr=394305852
231 0.501972357 172.31.24.227 -> 172.31.31.144 OpenFlow 189 Type: OFPT_PACKET_IN
232 0.501996636 172.31.24.227 -> 172.31.31.144 OpenFlow 189 Type: OFPT_PACKET_IN
233 0.502051444 172.31.31.144 -> 172.31.24.227 TCP 66 6633 → 50466 [ACK] Seq=1 Ack=247 Win=853 Len=0 TSval=1240580 TSecr=394305852
234 0.502059288 172.31.24.227 -> 172.31.31.144 OpenFlow 189 Type: OFPT_PACKET_IN
235 0.502109371 172.31.24.227 -> 172.31.31.144 OpenFlow 189 Type: OFPT_PACKET_IN
236 0.502282431 172.31.31.144 -> 172.31.24.227 TCP 66 6633 → 50444 [ACK] Seq=727 Ack=616 Win=853 Len=0 TSval=1240580 TSecr=394305852
237 0.502290340 172.31.31.144 -> 172.31.24.227 TCP 66 6633 → 50458 [ACK] Seq=1 Ack=124 Win=853 Len=0 TSval=1240580 TSecr=394305852
238 0.502294347 172.31.31.144 -> 172.31.24.227 TCP 66 6633 → 50446 [ACK] Seq=1211 Ack=985 Win=853 Len=0 TSval=1240580 TSecr=394305852
239 0.502300137 172.31.31.144 -> 172.31.24.227 TCP 66 6633 → 50444 [ACK] Seq=727 Ack=739 Win=853 Len=0 TSval=1240580 TSecr=394305852
240 0.502302848 172.31.31.144 -> 172.31.24.227 TCP 66 6633 → 50458 [ACK] Seq=1 Ack=247 Win=853 Len=0 TSval=1240580 TSecr=394305852
241 0.502499104 172.31.31.144 -> 172.31.24.227 TCP 66 6633 → 50452 [ACK] Seq=1 Ack=493 Win=853 Len=0 TSval=1240581 TSecr=394305852
242 0.571020648 172.31.24.227 -> 172.31.31.144 OpenFlow 146 Type: OFPT_PORT_STATUS
243 0.571133621 172.31.24.227 -> 172.31.31.144 OpenFlow 146 Type: OFPT_PORT_STATUS
244 0.571355886 172.31.31.144 -> 172.31.24.227 TCP 66 6633 → 50460 [ACK] Seq=1 Ack=81 Win=853 Len=0 TSval=1240598 TSecr=394305870
245 0.595577307 172.31.31.144 -> 172.31.24.227 OpenFlow 146 Type: OFPT_FLOW_MOD
246 0.595589819 172.31.31.144 -> 172.31.24.227 OpenFlow 154 Type: OFPT_BARRIER_REQUEST
247 0.595594823 172.31.31.144 -> 172.31.24.227 OpenFlow 146 Type: OFPT_FLOW_MOD
248 0.595598138 172.31.31.144 -> 172.31.24.227 OpenFlow 154 Type: OFPT_BARRIER_REQUEST
249 0.595600646 172.31.31.144 -> 172.31.24.227 OpenFlow 146 Type: OFPT_FLOW_MOD
250 0.595603959 172.31.31.144 -> 172.31.24.227 OpenFlow 154 Type: OFPT_BARRIER_REQUEST
251 0.595606486 172.31.31.144 -> 172.31.24.227 TCP 146 6633 → 50472 [PSH, ACK] Seq=1 Ack=1 Win=853 Len=80 TSval=1240604 TSecr=394305252
252 0.595609867 172.31.31.144 -> 172.31.24.227 TCP 154 6633 → 50472 [PSH, ACK] Seq=81 Ack=1 Win=853 Len=88 TSval=1240604 TSecr=394305252
253 0.595713594 172.31.24.227 -> 172.31.31.144 TCP 66 50452 → 6633 [ACK] Seq=573 Ack=169 Win=213 Len=0 TSval=394305876 TSecr=1240604
254 0.595727194 172.31.24.227 -> 172.31.31.144 OpenFlow 74 Type: OFPT_BARRIER_REPLY
255 0.595761329 172.31.31.144 -> 172.31.24.227 TCP 146 6633 → 50474 [PSH, ACK] Seq=1 Ack=1 Win=853 Len=80 TSval=1240604 TSecr=394305277
256 0.595768228 172.31.31.144 -> 172.31.24.227 TCP 154 6633 → 50474 [PSH, ACK] Seq=81 Ack=1 Win=853 Len=88 TSval=1240604 TSecr=394305277
257 0.595770981 172.31.31.144 -> 172.31.24.227 OpenFlow 146 Type: OFPT_FLOW_MOD
258 0.595774096 172.31.31.144 -> 172.31.24.227 OpenFlow 146 Type: OFPT_FLOW_MOD
259 0.595776282 172.31.31.144 -> 172.31.24.227 OpenFlow 74 Type: OFPT_BARRIER_REQUEST
260 0.595822818 172.31.24.227 -> 172.31.31.144 TCP 66 50440 → 6633 [ACK] Seq=1231 Ack=1379 Win=213 Len=0 TSval=394305876 TSecr=1240604
261 0.595834013 172.31.24.227 -> 172.31.31.144 OpenFlow 74 Type: OFPT_BARRIER_REPLY
262 0.595863147 172.31.24.227 -> 172.31.31.144 TCP 66 50460 → 6633 [ACK] Seq=81 Ack=169 Win=213 Len=0 TSval=394305876 TSecr=1240604
263 0.595869444 172.31.24.227 -> 172.31.31.144 OpenFlow 74 Type: OFPT_BARRIER_REPLY
264 0.595909044 172.31.31.144 -> 172.31.24.227 OpenFlow 146 Type: OFPT_FLOW_MOD
265 0.595914931 172.31.31.144 -> 172.31.24.227 OpenFlow 154 Type: OFPT_BARRIER_REQUEST
266 0.595917915 172.31.31.144 -> 172.31.24.227 OpenFlow 146 Type: OFPT_FLOW_MOD
267 0.595920147 172.31.31.144 -> 172.31.24.227 OpenFlow 154 Type: OFPT_BARRIER_REQUEST
268 0.595951136 172.31.24.227 -> 172.31.31.144 TCP 66 50474 → 6633 [ACK] Seq=1 Ack=169 Win=213 Len=0 TSval=394305876 TSecr=1240604
269 0.595965880 172.31.24.227 -> 172.31.31.144 OpenFlow 74 Type: OFPT_BARRIER_REPLY
270 0.595990048 172.31.24.227 -> 172.31.31.144 TCP 66 50472 → 6633 [ACK] Seq=1 Ack=169 Win=213 Len=0 TSval=394305876 TSecr=1240604
271 0.595995761 172.31.24.227 -> 172.31.31.144 OpenFlow 74 Type: OFPT_BARRIER_REPLY
272 0.596042292 172.31.24.227 -> 172.31.31.144 TCP 66 50442 → 6633 [ACK] Seq=1231 Ack=1379 Win=213 Len=0 TSval=394305876 TSecr=1240604
273 0.596048626 172.31.24.227 -> 172.31.31.144 OpenFlow 74 Type: OFPT_BARRIER_REPLY
274 0.596064321 172.31.31.144 -> 172.31.24.227 OpenFlow 146 Type: OFPT_FLOW_MOD
275 0.596068391 172.31.31.144 -> 172.31.24.227 OpenFlow 146 Type: OFPT_FLOW_MOD
276 0.596070678 172.31.31.144 -> 172.31.24.227 OpenFlow 74 Type: OFPT_BARRIER_REQUEST
277 0.596219485 172.31.24.227 -> 172.31.31.144 OpenFlow 146 Type: OFPT_FLOW_REMOVED
278 0.596236854 172.31.24.227 -> 172.31.31.144 OpenFlow 146 Type: OFPT_FLOW_REMOVED
279 0.596246393 172.31.24.227 -> 172.31.31.144 OpenFlow 146 Type: OFPT_FLOW_REMOVED
280 0.596255722 172.31.24.227 -> 172.31.31.144 OpenFlow 146 Type: OFPT_FLOW_REMOVED
281 0.596266640 172.31.24.227 -> 172.31.31.144 OpenFlow 146 Type: OFPT_FLOW_REMOVED
282 0.596275647 172.31.24.227 -> 172.31.31.144 OpenFlow 146 Type: OFPT_FLOW_REMOVED
283 0.596311869 172.31.31.144 -> 172.31.24.227 TCP 146 6633 → 50476 [PSH, ACK] Seq=1 Ack=1 Win=853 Len=80 TSval=1240604 TSecr=394305277
284 0.596318593 172.31.31.144 -> 172.31.24.227 TCP 146 6633 → 50476 [PSH, ACK] Seq=81 Ack=1 Win=853 Len=80 TSval=1240604 TSecr=394305277
285 0.596321322 172.31.31.144 -> 172.31.24.227 TCP 66 6633 → 50474 [ACK] Seq=169 Ack=9 Win=853 Len=0 TSval=1240604 TSecr=394305876
286 0.596326209 172.31.24.227 -> 172.31.31.144 OpenFlow 146 Type: OFPT_FLOW_REMOVED
287 0.596332110 172.31.31.144 -> 172.31.24.227 TCP 74 6633 → 50476 [PSH, ACK] Seq=161 Ack=1 Win=853 Len=8 TSval=1240604 TSecr=394305277
288 0.596334388 172.31.31.144 -> 172.31.24.227 TCP 66 6633 → 50472 [ACK] Seq=169 Ack=9 Win=853 Len=0 TSval=1240604 TSecr=394305876
289 0.596337851 172.31.24.227 -> 172.31.31.144 OpenFlow 146 Type: OFPT_FLOW_REMOVED
290 0.596343344 172.31.24.227 -> 172.31.31.144 OpenFlow 146 Type: OFPT_FLOW_REMOVED
291 0.596346118 172.31.24.227 -> 172.31.31.144 OpenFlow 146 Type: OFPT_FLOW_REMOVED
292 0.596576119 172.31.31.144 -> 172.31.24.227 TCP 66 6633 → 50442 [ACK] Seq=1379 Ack=1239 Win=853 Len=0 TSval=1240604 TSecr=394305876
293 0.596582789 172.31.24.227 -> 172.31.31.144 OpenFlow 146 Type: OFPT_FLOW_REMOVED
294 0.596588038 172.31.31.144 -> 172.31.24.227 OpenFlow 146 Type: OFPT_FLOW_MOD
295 0.596590521 172.31.31.144 -> 172.31.24.227 OpenFlow 154 Type: OFPT_BARRIER_REQUEST
296 0.596592592 172.31.31.144 -> 172.31.24.227 TCP 66 6633 → 50452 [ACK] Seq=337 Ack=661 Win=853 Len=0 TSval=1240604 TSecr=394305876
297 0.596598562 172.31.24.227 -> 172.31.31.144 OpenFlow 146 Type: OFPT_FLOW_REMOVED
298 0.596766956 172.31.31.144 -> 172.31.24.227 TCP 66 6633 → 50474 [ACK] Seq=169 Ack=89 Win=853 Len=0 TSval=1240604 TSecr=394305876
299 0.596772819 172.31.31.144 -> 172.31.24.227 TCP 66 6633 → 50460 [ACK] Seq=337 Ack=169 Win=853 Len=0 TSval=1240604 TSecr=394305876
300 0.596775962 172.31.31.144 -> 172.31.24.227 OpenFlow 146 Type: OFPT_FLOW_MOD
301 0.596778129 172.31.31.144 -> 172.31.24.227 TCP 66 6633 → 50472 [ACK] Seq=169 Ack=89 Win=853 Len=0 TSval=1240604 TSecr=394305876
302 0.596780697 172.31.31.144 -> 172.31.24.227 OpenFlow 154 Type: OFPT_BARRIER_REQUEST
303 0.596782934 172.31.31.144 -> 172.31.24.227 OpenFlow 146 Type: OFPT_FLOW_MOD
304 0.596785423 172.31.31.144 -> 172.31.24.227 OpenFlow 154 Type: OFPT_BARRIER_REQUEST
305 0.596854464 172.31.31.144 -> 172.31.24.227 TCP 66 6633 → 50472 [ACK] Seq=169 Ack=169 Win=853 Len=0 TSval=1240604 TSecr=394305876
306 0.596859494 172.31.31.144 -> 172.31.24.227 OpenFlow 146 Type: OFPT_FLOW_MOD
307 0.596909038 172.31.31.144 -> 172.31.24.227 OpenFlow 146 Type: OFPT_FLOW_MOD
308 0.596912938 172.31.31.144 -> 172.31.24.227 OpenFlow 74 Type: OFPT_BARRIER_REQUEST
309 0.596980240 172.31.31.144 -> 172.31.24.227 TCP 66 6633 → 50442 [ACK] Seq=1547 Ack=1399 Win=853 Len=0 TSval=1240604 TSecr=394305876
310 0.596985199 172.31.31.144 -> 172.31.24.227 OpenFlow 146 Type: OFPT_FLOW_MOD
311 0.597073651 172.31.31.144 -> 172.31.24.227 OpenFlow 146 Type: OFPT_FLOW_MOD
312 0.597078893 172.31.31.144 -> 172.31.24.227 OpenFlow 74 Type: OFPT_BARRIER_REQUEST
313 0.597197854 172.31.31.144 -> 172.31.24.227 OpenFlow 146 Type: OFPT_FLOW_MOD
314 0.597205001 172.31.31.144 -> 172.31.24.227 OpenFlow 146 Type: OFPT_FLOW_MOD
315 0.597207165 172.31.31.144 -> 172.31.24.227 OpenFlow 74 Type: OFPT_BARRIER_REQUEST
316 0.597286540 172.31.31.144 -> 172.31.24.227 OpenFlow 146 Type: OFPT_FLOW_MOD
317 0.597291005 172.31.31.144 -> 172.31.24.227 OpenFlow 146 Type: OFPT_FLOW_MOD
318 0.597293040 172.31.31.144 -> 172.31.24.227 OpenFlow 74 Type: OFPT_BARRIER_REQUEST
319 0.597346862 172.31.31.144 -> 172.31.24.227 OpenFlow 146 Type: OFPT_FLOW_MOD
320 0.597430906 172.31.31.144 -> 172.31.24.227 OpenFlow 154 Type: OFPT_BARRIER_REQUEST
321 0.597435685 172.31.31.144 -> 172.31.24.227 OpenFlow 146 Type: OFPT_FLOW_MOD
322 0.597437841 172.31.31.144 -> 172.31.24.227 OpenFlow 154 Type: OFPT_BARRIER_REQUEST
323 0.597742853 172.31.31.144 -> 172.31.24.227 OpenFlow 146 Type: OFPT_FLOW_MOD
324 0.597749366 172.31.31.144 -> 172.31.24.227 OpenFlow 154 Type: OFPT_BARRIER_REQUEST
325 0.597824151 172.31.31.144 -> 172.31.24.227 OpenFlow 146 Type: OFPT_FLOW_MOD
326 0.597829046 172.31.31.144 -> 172.31.24.227 OpenFlow 154 Type: OFPT_BARRIER_REQUEST
327 0.597941450 172.31.31.144 -> 172.31.24.227 OpenFlow 146 Type: OFPT_FLOW_MOD
328 0.597947346 172.31.31.144 -> 172.31.24.227 OpenFlow 154 Type: OFPT_BARRIER_REQUEST
329 0.598107948 172.31.31.144 -> 172.31.24.227 OpenFlow 146 Type: OFPT_FLOW_MOD
330 0.598125526 172.31.31.144 -> 172.31.24.227 OpenFlow 154 Type: OFPT_BARRIER_REQUEST
331 0.598564367 172.31.24.227 -> 172.31.31.144 OpenFlow 74 Type: OFPT_BARRIER_REPLY
332 0.598597167 172.31.24.227 -> 172.31.31.144 OpenFlow 74 Type: OFPT_BARRIER_REPLY
333 0.598620224 172.31.24.227 -> 172.31.31.144 OpenFlow 74 Type: OFPT_BARRIER_REPLY
334 0.598642605 172.31.24.227 -> 172.31.31.144 OpenFlow 74 Type: OFPT_BARRIER_REPLY
335 0.598674672 172.31.24.227 -> 172.31.31.144 TCP 66 50436 → 6633 [ACK] Seq=739 Ack=1137 Win=213 Len=0 TSval=394305877 TSecr=1240604
336 0.598683761 172.31.24.227 -> 172.31.31.144 OpenFlow 74 Type: OFPT_BARRIER_REPLY
337 0.598736885 172.31.24.227 -> 172.31.31.144 OpenFlow 74 Type: OFPT_BARRIER_REPLY
338 0.598778876 172.31.31.144 -> 172.31.24.227 TCP 66 6633 → 50452 [ACK] Seq=841 Ack=757 Win=853 Len=0 TSval=1240605 TSecr=394305877
339 0.598790681 172.31.24.227 -> 172.31.31.144 OpenFlow 74 Type: OFPT_BARRIER_REPLY
340 0.598815044 172.31.24.227 -> 172.31.31.144 OpenFlow 74 Type: OFPT_BARRIER_REPLY
341 0.598845310 172.31.24.227 -> 172.31.31.144 OpenFlow 74 Type: OFPT_BARRIER_REPLY
342 0.598909522 172.31.24.227 -> 172.31.31.144 TCP 66 50444 → 6633 [ACK] Seq=739 Ack=895 Win=213 Len=0 TSval=394305877 TSecr=1240604
343 0.598914889 172.31.24.227 -> 172.31.31.144 OpenFlow 74 Type: OFPT_BARRIER_REPLY
344 0.598949778 172.31.24.227 -> 172.31.31.144 TCP 66 50476 → 6633 [ACK] Seq=1 Ack=169 Win=213 Len=0 TSval=394305877 TSecr=1240604
345 0.598955035 172.31.24.227 -> 172.31.31.144 OpenFlow 74 Type: OFPT_BARRIER_REPLY
346 0.598975551 172.31.24.227 -> 172.31.31.144 TCP 66 50474 → 6633 [ACK] Seq=169 Ack=337 Win=213 Len=0 TSval=394305877 TSecr=1240604
347 0.598980145 172.31.24.227 -> 172.31.31.144 OpenFlow 74 Type: OFPT_BARRIER_REPLY
348 0.599024213 172.31.24.227 -> 172.31.31.144 OpenFlow 74 Type: OFPT_BARRIER_REPLY
349 0.599155367 172.31.31.144 -> 172.31.24.227 TCP 66 6633 → 50452 [ACK] Seq=841 Ack=773 Win=853 Len=0 TSval=1240605 TSecr=394305877
350 0.599162861 172.31.31.144 -> 172.31.24.227 OpenFlow 146 Type: OFPT_FLOW_MOD
351 0.599167144 172.31.31.144 -> 172.31.24.227 OpenFlow 146 Type: OFPT_FLOW_MOD
352 0.599182442 172.31.24.227 -> 172.31.31.144 OpenFlow 146 Type: OFPT_FLOW_REMOVED
353 0.599198501 172.31.24.227 -> 172.31.31.144 OpenFlow 90 Type: OFPT_BARRIER_REPLY
354 0.599222053 172.31.24.227 -> 172.31.31.144 OpenFlow 146 Type: OFPT_FLOW_REMOVED
355 0.599246275 172.31.24.227 -> 172.31.31.144 OpenFlow 146 Type: OFPT_FLOW_REMOVED
356 0.599438453 172.31.24.227 -> 172.31.31.144 OpenFlow 226 Type: OFPT_FLOW_REMOVED
357 0.599442308 172.31.24.227 -> 172.31.31.144 OpenFlow 226 Type: OFPT_FLOW_REMOVED
358 0.599444600 172.31.24.227 -> 172.31.31.144 OpenFlow 226 Type: OFPT_FLOW_REMOVED
359 0.599446602 172.31.24.227 -> 172.31.31.144 OpenFlow 394 Type: OFPT_FLOW_REMOVED
360 0.599515541 172.31.31.144 -> 172.31.24.227 OpenFlow 154 Type: OFPT_BARRIER_REQUEST
361 0.599521205 172.31.31.144 -> 172.31.24.227 OpenFlow 482 Type: OFPT_FLOW_MOD
362 0.599524648 172.31.31.144 -> 172.31.24.227 OpenFlow 234 Type: OFPT_FLOW_MOD
363 0.599526884 172.31.31.144 -> 172.31.24.227 TCP 66 6633 → 50436 [ACK] Seq=1137 Ack=747 Win=853 Len=0 TSval=1240605 TSecr=394305877
364 0.599531724 172.31.24.227 -> 172.31.31.144 OpenFlow 146 Type: OFPT_FLOW_REMOVED
365 0.599537768 172.31.31.144 -> 172.31.24.227 OpenFlow 242 Type: OFPT_BARRIER_REQUEST
366 0.599553632 172.31.31.144 -> 172.31.24.227 TCP 66 6633 → 50434 [ACK] Seq=1715 Ack=993 Win=853 Len=0 TSval=1240605 TSecr=394305877
367 0.599557588 172.31.24.227 -> 172.31.31.144 OpenFlow 466 Type: OFPT_FLOW_REMOVED
368 0.599559258 172.31.31.144 -> 172.31.24.227 TCP 66 6633 → 50434 [ACK] Seq=1715 Ack=1001 Win=853 Len=0 TSval=1240605 TSecr=394305877
369 0.599561926 172.31.31.144 -> 172.31.24.227 TCP 146 6633 → 50470 [PSH, ACK] Seq=1 Ack=1 Win=853 Len=80 TSval=1240605 TSecr=394305252
370 0.599566147 172.31.31.144 -> 172.31.24.227 TCP 154 6633 → 50470 [PSH, ACK] Seq=81 Ack=1 Win=853 Len=88 TSval=1240605 TSecr=394305252
371 0.599568632 172.31.31.144 -> 172.31.24.227 OpenFlow 146 Type: OFPT_FLOW_MOD
372 0.599570754 172.31.31.144 -> 172.31.24.227 TCP 402 6633 → 50470 [PSH, ACK] Seq=169 Ack=1 Win=853 Len=336 TSval=1240605 TSecr=394305252
373 0.599573036 172.31.31.144 -> 172.31.24.227 OpenFlow 146 Type: OFPT_FLOW_MOD
374 0.599575095 172.31.31.144 -> 172.31.24.227 OpenFlow 146 Type: OFPT_FLOW_MOD
375 0.599581568 172.31.31.144 -> 172.31.24.227 OpenFlow 154 Type: OFPT_BARRIER_REQUEST
376 0.599583216 172.31.31.144 -> 172.31.24.227 OpenFlow 74 Type: OFPT_BARRIER_REQUEST
377 0.599584796 172.31.31.144 -> 172.31.24.227 TCP 66 6633 → 50440 [ACK] Seq=1379 Ack=1399 Win=853 Len=0 TSval=1240605 TSecr=394305876
378 0.599587621 172.31.31.144 -> 172.31.24.227 TCP 66 6633 → 50434 [ACK] Seq=1715 Ack=1009 Win=853 Len=0 TSval=1240605 TSecr=394305877
379 0.599590174 172.31.31.144 -> 172.31.24.227 TCP 66 6633 → 50444 [ACK] Seq=895 Ack=747 Win=853 Len=0 TSval=1240605 TSecr=394305877
380 0.599592494 172.31.31.144 -> 172.31.24.227 TCP 66 6633 → 50476 [ACK] Seq=169 Ack=9 Win=853 Len=0 TSval=1240605 TSecr=394305877
381 0.599603070 172.31.24.227 -> 172.31.31.144 OpenFlow 626 Type: OFPT_FLOW_REMOVED
382 0.599606135 172.31.24.227 -> 172.31.31.144 OpenFlow 706 Type: OFPT_FLOW_REMOVED
383 0.599884126 172.31.31.144 -> 172.31.24.227 TCP 66 6633 → 50474 [ACK] Seq=337 Ack=177 Win=853 Len=0 TSval=1240605 TSecr=394305876
384 0.599890614 172.31.31.144 -> 172.31.24.227 TCP 66 6633 → 50460 [ACK] Seq=841 Ack=281 Win=853 Len=0 TSval=1240605 TSecr=394305877
385 0.599893315 172.31.31.144 -> 172.31.24.227 TCP 66 6633 → 50436 [ACK] Seq=1137 Ack=827 Win=853 Len=0 TSval=1240605 TSecr=394305877
386 0.599895694 172.31.31.144 -> 172.31.24.227 TCP 66 6633 → 50434 [ACK] Seq=1715 Ack=1089 Win=853 Len=0 TSval=1240605 TSecr=394305877
387 0.599898220 172.31.31.144 -> 172.31.24.227 TCP 66 6633 → 50444 [ACK] Seq=895 Ack=907 Win=853 Len=0 TSval=1240605 TSecr=394305877
388 0.599900669 172.31.31.144 -> 172.31.24.227 TCP 66 6633 → 50476 [ACK] Seq=169 Ack=169 Win=853 Len=0 TSval=1240605 TSecr=394305877
389 0.600019744 172.31.31.144 -> 172.31.24.227 TCP 66 6633 → 50442 [ACK] Seq=1715 Ack=1735 Win=853 Len=0 TSval=1240605 TSecr=394305877
390 0.600141362 172.31.31.144 -> 172.31.24.227 TCP 66 6633 → 50436 [ACK] Seq=1137 Ack=907 Win=853 Len=0 TSval=1240605 TSecr=394305877
391 0.600146896 172.31.31.144 -> 172.31.24.227 TCP 66 6633 → 50434 [ACK] Seq=1715 Ack=1489 Win=853 Len=0 TSval=1240605 TSecr=394305877
392 0.600149263 172.31.31.144 -> 172.31.24.227 TCP 66 6633 → 50452 [ACK] Seq=841 Ack=1413 Win=853 Len=0 TSval=1240605 TSecr=394305877
393 0.600979754 172.31.24.227 -> 172.31.31.144 OpenFlow 74 Type: OFPT_BARRIER_REPLY
394 0.601007955 172.31.24.227 -> 172.31.31.144 OpenFlow 74 Type: OFPT_BARRIER_REPLY
395 0.601029497 172.31.24.227 -> 172.31.31.144 OpenFlow 74 Type: OFPT_BARRIER_REPLY
396 0.601053832 172.31.24.227 -> 172.31.31.144 OpenFlow 74 Type: OFPT_BARRIER_REPLY
397 0.601081439 172.31.24.227 -> 172.31.31.144 OpenFlow 74 Type: OFPT_BARRIER_REPLY
398 0.601118617 172.31.24.227 -> 172.31.31.144 TCP 66 50448 → 6633 [ACK] Seq=493 Ack=1137 Win=213 Len=0 TSval=394305877 TSecr=1240605
399 0.601127502 172.31.24.227 -> 172.31.31.144 OpenFlow 74 Type: OFPT_BARRIER_REPLY
400 0.601163823 172.31.24.227 -> 172.31.31.144 TCP 66 50472 → 6633 [ACK] Seq=169 Ack=337 Win=213 Len=0 TSval=394305877 TSecr=1240605
401 0.601169084 172.31.24.227 -> 172.31.31.144 OpenFlow 74 Type: OFPT_BARRIER_REPLY
402 0.601208661 172.31.24.227 -> 172.31.31.144 TCP 66 50430 → 6633 [ACK] Seq=493 Ack=895 Win=213 Len=0 TSval=394305877 TSecr=1240605
403 0.601218198 172.31.31.144 -> 172.31.24.227 TCP 66 6633 → 50446 [ACK] Seq=2051 Ack=993 Win=853 Len=0 TSval=1240605 TSecr=394305877
404 0.601223361 172.31.31.144 -> 172.31.24.227 TCP 66 6633 → 50446 [ACK] Seq=2051 Ack=1001 Win=853 Len=0 TSval=1240605 TSecr=394305877
405 0.601225896 172.31.31.144 -> 172.31.24.227 TCP 66 6633 → 50446 [ACK] Seq=2051 Ack=1009 Win=853 Len=0 TSval=1240605 TSecr=394305877
406 0.601231806 172.31.24.227 -> 172.31.31.144 OpenFlow 74 Type: OFPT_BARRIER_REPLY
407 0.601264168 172.31.24.227 -> 172.31.31.144 OpenFlow 74 Type: OFPT_BARRIER_REPLY
408 0.601332341 172.31.31.144 -> 172.31.24.227 TCP 66 6633 → 50446 [ACK] Seq=2051 Ack=1025 Win=853 Len=0 TSval=1240605 TSecr=394305877
409 0.601361589 172.31.24.227 -> 172.31.31.144 OpenFlow 82 Type: OFPT_BARRIER_REPLY
410 0.601400451 172.31.31.144 -> 172.31.24.227 TCP 66 6633 → 50448 [ACK] Seq=1137 Ack=501 Win=853 Len=0 TSval=1240605 TSecr=394305877
411 0.601458091 172.31.24.227 -> 172.31.31.144 OpenFlow 146 Type: OFPT_FLOW_REMOVED
412 0.601491344 172.31.24.227 -> 172.31.31.144 OpenFlow 146 Type: OFPT_FLOW_REMOVED
413 0.601500670 172.31.24.227 -> 172.31.31.144 OpenFlow 146 Type: OFPT_FLOW_REMOVED
414 0.601512969 172.31.31.144 -> 172.31.24.227 TCP 66 6633 → 50430 [ACK] Seq=895 Ack=501 Win=853 Len=0 TSval=1240605 TSecr=394305877
415 0.601515692 172.31.31.144 -> 172.31.24.227 TCP 66 6633 → 50470 [ACK] Seq=505 Ack=9 Win=853 Len=0 TSval=1240605 TSecr=394305877
416 0.601520340 172.31.24.227 -> 172.31.31.144 OpenFlow 146 Type: OFPT_FLOW_REMOVED
417 0.601526137 172.31.24.227 -> 172.31.31.144 OpenFlow 786 Type: OFPT_FLOW_REMOVED
418 0.601539585 172.31.24.227 -> 172.31.31.144 OpenFlow 146 Type: OFPT_FLOW_REMOVED
419 0.601607272 172.31.31.144 -> 172.31.24.227 TCP 66 6633 → 50470 [ACK] Seq=505 Ack=25 Win=853 Len=0 TSval=1240605 TSecr=394305877
420 0.601614646 172.31.24.227 -> 172.31.31.144 OpenFlow 466 Type: OFPT_FLOW_REMOVED
421 0.601621904 172.31.24.227 -> 172.31.31.144 OpenFlow 146 Type: OFPT_FLOW_REMOVED
422 0.601624259 172.31.24.227 -> 172.31.31.144 OpenFlow 146 Type: OFPT_FLOW_REMOVED
423 0.601626162 172.31.24.227 -> 172.31.31.144 OpenFlow 146 Type: OFPT_FLOW_REMOVED
424 0.601699091 172.31.31.144 -> 172.31.24.227 TCP 66 6633 → 50446 [ACK] Seq=2051 Ack=1105 Win=853 Len=0 TSval=1240605 TSecr=394305877
425 0.601914025 172.31.31.144 -> 172.31.24.227 TCP 66 6633 → 50448 [ACK] Seq=1137 Ack=581 Win=853 Len=0 TSval=1240605 TSecr=394305877
426 0.601919046 172.31.31.144 -> 172.31.24.227 TCP 66 6633 → 50472 [ACK] Seq=337 Ack=257 Win=853 Len=0 TSval=1240605 TSecr=394305877
427 0.601921485 172.31.31.144 -> 172.31.24.227 TCP 66 6633 → 50430 [ACK] Seq=895 Ack=581 Win=853 Len=0 TSval=1240605 TSecr=394305877
428 0.601923830 172.31.31.144 -> 172.31.24.227 TCP 66 6633 → 50470 [ACK] Seq=505 Ack=105 Win=853 Len=0 TSval=1240605 TSecr=394305877
429 0.601926031 172.31.31.144 -> 172.31.24.227 TCP 66 6633 → 50446 [ACK] Seq=2051 Ack=1825 Win=853 Len=0 TSval=1240605 TSecr=394305877
430 0.601928356 172.31.31.144 -> 172.31.24.227 TCP 66 6633 → 50470 [ACK] Seq=505 Ack=505 Win=853 Len=0 TSval=1240605 TSecr=394305877
431 0.601987051 172.31.31.144 -> 172.31.24.227 TCP 66 6633 → 50430 [ACK] Seq=895 Ack=661 Win=853 Len=0 TSval=1240605 TSecr=394305877
432 0.602024656 172.31.31.144 -> 172.31.24.227 TCP 66 6633 → 50448 [ACK] Seq=1137 Ack=661 Win=853 Len=0 TSval=1240605 TSecr=394305877
433 0.602896318 172.31.31.144 -> 172.31.24.227 OpenFlow 170 Type: OFPT_FLOW_MOD
434 0.602903336 172.31.31.144 -> 172.31.24.227 OpenFlow 178 Type: OFPT_BARRIER_REQUEST
435 0.602988381 172.31.31.144 -> 172.31.24.227 OpenFlow 170 Type: OFPT_FLOW_MOD
436 0.603001550 172.31.31.144 -> 172.31.24.227 OpenFlow 178 Type: OFPT_BARRIER_REQUEST
437 0.603079813 172.31.31.144 -> 172.31.24.227 TCP 170 6633 → 50462 [PSH, ACK] Seq=1 Ack=1 Win=853 Len=104 TSval=1240606 TSecr=394305252
438 0.603086340 172.31.31.144 -> 172.31.24.227 TCP 178 6633 → 50462 [PSH, ACK] Seq=105 Ack=1 Win=853 Len=112 TSval=1240606 TSecr=394305252
439 0.603190604 172.31.31.144 -> 172.31.24.227 OpenFlow 170 Type: OFPT_FLOW_MOD
440 0.603195930 172.31.31.144 -> 172.31.24.227 OpenFlow 170 Type: OFPT_FLOW_MOD
441 0.603198151 172.31.31.144 -> 172.31.24.227 OpenFlow 74 Type: OFPT_BARRIER_REQUEST
442 0.603294811 172.31.31.144 -> 172.31.24.227 OpenFlow 170 Type: OFPT_FLOW_MOD
443 0.603299909 172.31.31.144 -> 172.31.24.227 OpenFlow 178 Type: OFPT_BARRIER_REQUEST
444 0.603368548 172.31.31.144 -> 172.31.24.227 OpenFlow 170 Type: OFPT_FLOW_MOD
445 0.603373963 172.31.31.144 -> 172.31.24.227 OpenFlow 178 Type: OFPT_BARRIER_REQUEST
446 0.603460389 172.31.31.144 -> 172.31.24.227 OpenFlow 170 Type: OFPT_FLOW_MOD
447 0.603464870 172.31.31.144 -> 172.31.24.227 OpenFlow 178 Type: OFPT_BARRIER_REQUEST
448 0.603544065 172.31.31.144 -> 172.31.24.227 OpenFlow 170 Type: OFPT_FLOW_MOD
449 0.603599706 172.31.31.144 -> 172.31.24.227 OpenFlow 170 Type: OFPT_FLOW_MOD
450 0.603603964 172.31.31.144 -> 172.31.24.227 OpenFlow 74 Type: OFPT_BARRIER_REQUEST
451 0.603672196 172.31.31.144 -> 172.31.24.227 OpenFlow 170 Type: OFPT_FLOW_MOD
452 0.603677647 172.31.31.144 -> 172.31.24.227 OpenFlow 178 Type: OFPT_BARRIER_REQUEST
453 0.603719609 172.31.24.227 -> 172.31.31.144 TCP 66 50452 → 6633 [ACK] Seq=1413 Ack=1057 Win=213 Len=0 TSval=394305878 TSecr=1240606
454 0.603731367 172.31.24.227 -> 172.31.31.144 OpenFlow 74 Type: OFPT_BARRIER_REPLY
455 0.603743870 172.31.31.144 -> 172.31.24.227 OpenFlow 170 Type: OFPT_FLOW_MOD
456 0.603747961 172.31.31.144 -> 172.31.24.227 OpenFlow 178 Type: OFPT_BARRIER_REQUEST
457 0.603792349 172.31.24.227 -> 172.31.31.144 TCP 66 50434 → 6633 [ACK] Seq=1489 Ack=1931 Win=213 Len=0 TSval=394305878 TSecr=1240606
458 0.603802449 172.31.24.227 -> 172.31.31.144 OpenFlow 74 Type: OFPT_BARRIER_REPLY
459 0.603832825 172.31.31.144 -> 172.31.24.227 OpenFlow 170 Type: OFPT_FLOW_MOD
460 0.603838868 172.31.31.144 -> 172.31.24.227 OpenFlow 178 Type: OFPT_BARRIER_REQUEST
461 0.603851243 172.31.24.227 -> 172.31.31.144 TCP 66 50454 → 6633 [ACK] Seq=247 Ack=217 Win=213 Len=0 TSval=394305878 TSecr=1240606
462 0.603861309 172.31.24.227 -> 172.31.31.144 OpenFlow 74 Type: OFPT_BARRIER_REPLY
463 0.603893846 172.31.24.227 -> 172.31.31.144 TCP 66 50446 → 6633 [ACK] Seq=1825 Ack=2267 Win=213 Len=0 TSval=394305878 TSecr=1240606
464 0.603901830 172.31.31.144 -> 172.31.24.227 OpenFlow 170 Type: OFPT_FLOW_MOD
465 0.603908630 172.31.24.227 -> 172.31.31.144 OpenFlow 74 Type: OFPT_BARRIER_REPLY
466 0.603947524 172.31.24.227 -> 172.31.31.144 TCP 66 50444 → 6633 [ACK] Seq=907 Ack=1111 Win=213 Len=0 TSval=394305878 TSecr=1240606
467 0.603953277 172.31.24.227 -> 172.31.31.144 OpenFlow 74 Type: OFPT_BARRIER_REPLY
468 0.603983814 172.31.24.227 -> 172.31.31.144 TCP 66 50462 → 6633 [ACK] Seq=1 Ack=217 Win=213 Len=0 TSval=394305878 TSecr=1240606
469 0.603990191 172.31.24.227 -> 172.31.31.144 OpenFlow 74 Type: OFPT_BARRIER_REPLY
470 0.604013079 172.31.31.144 -> 172.31.24.227 OpenFlow 170 Type: OFPT_FLOW_MOD
471 0.604017759 172.31.31.144 -> 172.31.24.227 OpenFlow 74 Type: OFPT_BARRIER_REQUEST
472 0.604029174 172.31.24.227 -> 172.31.31.144 TCP 66 50448 → 6633 [ACK] Seq=661 Ack=1353 Win=213 Len=0 TSval=394305878 TSecr=1240606
473 0.604039067 172.31.24.227 -> 172.31.31.144 OpenFlow 74 Type: OFPT_BARRIER_REPLY
474 0.604066304 172.31.24.227 -> 172.31.31.144 TCP 66 50476 → 6633 [ACK] Seq=169 Ack=385 Win=213 Len=0 TSval=394305878 TSecr=1240606
475 0.604072341 172.31.24.227 -> 172.31.31.144 OpenFlow 74 Type: OFPT_BARRIER_REPLY
476 0.604096590 172.31.24.227 -> 172.31.31.144 TCP 66 50474 → 6633 [ACK] Seq=337 Ack=553 Win=213 Len=0 TSval=394305878 TSecr=1240606
477 0.604102127 172.31.24.227 -> 172.31.31.144 OpenFlow 74 Type: OFPT_BARRIER_REPLY
478 0.604154474 172.31.24.227 -> 172.31.31.144 TCP 66 50442 → 6633 [ACK] Seq=1735 Ack=1931 Win=213 Len=0 TSval=394305878 TSecr=1240606
479 0.604161302 172.31.24.227 -> 172.31.31.144 OpenFlow 74 Type: OFPT_BARRIER_REPLY
480 0.604207002 172.31.31.144 -> 172.31.24.227 OpenFlow 170 Type: OFPT_FLOW_MOD
481 0.604212417 172.31.31.144 -> 172.31.24.227 OpenFlow 170 Type: OFPT_FLOW_MOD
482 0.604214567 172.31.31.144 -> 172.31.24.227 OpenFlow 74 Type: OFPT_BARRIER_REQUEST
483 0.604216391 172.31.31.144 -> 172.31.24.227 TCP 170 6633 → 50464 [PSH, ACK] Seq=1 Ack=1 Win=853 Len=104 TSval=1240606 TSecr=394305277
484 0.604670357 172.31.31.144 -> 172.31.24.227 TCP 170 6633 → 50464 [PSH, ACK] Seq=105 Ack=1 Win=853 Len=104 TSval=1240606 TSecr=394305277
485 0.604677497 172.31.31.144 -> 172.31.24.227 TCP 74 6633 → 50464 [PSH, ACK] Seq=209 Ack=1 Win=853 Len=8 TSval=1240606 TSecr=394305277
486 0.604679646 172.31.31.144 -> 172.31.24.227 TCP 66 6633 → 50462 [ACK] Seq=217 Ack=9 Win=853 Len=0 TSval=1240606 TSecr=394305878
487 0.604683049 172.31.31.144 -> 172.31.24.227 OpenFlow 170 Type: OFPT_FLOW_MOD
488 0.604686903 172.31.31.144 -> 172.31.24.227 OpenFlow 170 Type: OFPT_FLOW_MOD
489 0.604689257 172.31.31.144 -> 172.31.24.227 OpenFlow 74 Type: OFPT_BARRIER_REQUEST
490 0.604691070 172.31.31.144 -> 172.31.24.227 TCP 170 6633 → 50468 [PSH, ACK] Seq=1 Ack=1 Win=853 Len=104 TSval=1240606 TSecr=394305227
491 0.604694041 172.31.31.144 -> 172.31.24.227 TCP 178 6633 → 50468 [PSH, ACK] Seq=105 Ack=1 Win=853 Len=112 TSval=1240606 TSecr=394305227
492 0.604696134 172.31.31.144 -> 172.31.24.227 OpenFlow 170 Type: OFPT_FLOW_MOD
493 0.604699001 172.31.31.144 -> 172.31.24.227 OpenFlow 170 Type: OFPT_FLOW_MOD
494 0.604701255 172.31.31.144 -> 172.31.24.227 OpenFlow 74 Type: OFPT_BARRIER_REQUEST
495 0.604735984 172.31.31.144 -> 172.31.24.227 OpenFlow 170 Type: OFPT_FLOW_MOD
496 0.604803504 172.31.31.144 -> 172.31.24.227 OpenFlow 170 Type: OFPT_FLOW_MOD
497 0.604808190 172.31.31.144 -> 172.31.24.227 OpenFlow 74 Type: OFPT_BARRIER_REQUEST
498 0.604871345 172.31.31.144 -> 172.31.24.227 OpenFlow 170 Type: OFPT_FLOW_MOD
499 0.604875577 172.31.31.144 -> 172.31.24.227 OpenFlow 178 Type: OFPT_BARRIER_REQUEST
500 0.604936444 172.31.31.144 -> 172.31.24.227 OpenFlow 170 Type: OFPT_FLOW_MOD
501 0.604987776 172.31.31.144 -> 172.31.24.227 OpenFlow 170 Type: OFPT_FLOW_MOD
502 0.604991682 172.31.31.144 -> 172.31.24.227 OpenFlow 74 Type: OFPT_BARRIER_REQUEST
503 0.605061331 172.31.31.144 -> 172.31.24.227 OpenFlow 170 Type: OFPT_FLOW_MOD
504 0.605065991 172.31.31.144 -> 172.31.24.227 OpenFlow 178 Type: OFPT_BARRIER_REQUEST
505 0.605160731 172.31.31.144 -> 172.31.24.227 OpenFlow 170 Type: OFPT_FLOW_MOD
506 0.605166200 172.31.31.144 -> 172.31.24.227 OpenFlow 178 Type: OFPT_BARRIER_REQUEST
507 0.605255798 172.31.31.144 -> 172.31.24.227 OpenFlow 170 Type: OFPT_FLOW_MOD
508 0.605261401 172.31.31.144 -> 172.31.24.227 OpenFlow 178 Type: OFPT_BARRIER_REQUEST
509 0.605327292 172.31.31.144 -> 172.31.24.227 TCP 170 6633 → 50468 [PSH, ACK] Seq=217 Ack=1 Win=853 Len=104 TSval=1240606 TSecr=394305227
510 0.605331468 172.31.31.144 -> 172.31.24.227 TCP 178 6633 → 50468 [PSH, ACK] Seq=321 Ack=1 Win=853 Len=112 TSval=1240606 TSecr=394305227
511 0.605427713 172.31.31.144 -> 172.31.24.227 OpenFlow 170 Type: OFPT_FLOW_MOD
512 0.605432949 172.31.31.144 -> 172.31.24.227 OpenFlow 178 Type: OFPT_BARRIER_REQUEST
513 0.605512462 172.31.31.144 -> 172.31.24.227 OpenFlow 170 Type: OFPT_FLOW_MOD
514 0.605517147 172.31.31.144 -> 172.31.24.227 OpenFlow 178 Type: OFPT_BARRIER_REQUEST
515 0.605603682 172.31.31.144 -> 172.31.24.227 OpenFlow 170 Type: OFPT_FLOW_MOD
516 0.605608954 172.31.31.144 -> 172.31.24.227 OpenFlow 178 Type: OFPT_BARRIER_REQUEST
517 0.605692787 172.31.31.144 -> 172.31.24.227 OpenFlow 170 Type: OFPT_FLOW_MOD
518 0.605698127 172.31.31.144 -> 172.31.24.227 OpenFlow 178 Type: OFPT_BARRIER_REQUEST
519 0.605782688 172.31.31.144 -> 172.31.24.227 OpenFlow 170 Type: OFPT_FLOW_MOD
520 0.605787383 172.31.31.144 -> 172.31.24.227 OpenFlow 170 Type: OFPT_FLOW_MOD
521 0.605789568 172.31.31.144 -> 172.31.24.227 OpenFlow 74 Type: OFPT_BARRIER_REQUEST
522 0.605870054 172.31.31.144 -> 172.31.24.227 OpenFlow 170 Type: OFPT_FLOW_MOD
523 0.605875289 172.31.31.144 -> 172.31.24.227 OpenFlow 178 Type: OFPT_BARRIER_REQUEST
524 0.605959935 172.31.31.144 -> 172.31.24.227 OpenFlow 170 Type: OFPT_FLOW_MOD
525 0.605964220 172.31.31.144 -> 172.31.24.227 OpenFlow 178 Type: OFPT_BARRIER_REQUEST
526 0.606020340 172.31.31.144 -> 172.31.24.227 OpenFlow 170 Type: OFPT_FLOW_MOD
527 0.606060875 172.31.24.227 -> 172.31.31.144 OpenFlow 74 Type: OFPT_BARRIER_REPLY
528 0.606082503 172.31.31.144 -> 172.31.24.227 OpenFlow 170 Type: OFPT_FLOW_MOD
529 0.606087102 172.31.31.144 -> 172.31.24.227 OpenFlow 74 Type: OFPT_BARRIER_REQUEST
530 0.606104905 172.31.24.227 -> 172.31.31.144 OpenFlow 74 Type: OFPT_BARRIER_REPLY
531 0.606147703 172.31.31.144 -> 172.31.24.227 OpenFlow 170 Type: OFPT_FLOW_MOD
532 0.606155059 172.31.31.144 -> 172.31.24.227 OpenFlow 178 Type: OFPT_BARRIER_REQUEST
533 0.606192350 172.31.24.227 -> 172.31.31.144 TCP 66 50456 → 6633 [ACK] Seq=247 Ack=217 Win=213 Len=0 TSval=394305879 TSecr=1240606
534 0.606202699 172.31.24.227 -> 172.31.31.144 OpenFlow 74 Type: OFPT_BARRIER_REPLY
535 0.606234543 172.31.24.227 -> 172.31.31.144 TCP 66 50436 → 6633 [ACK] Seq=907 Ack=1353 Win=213 Len=0 TSval=394305879 TSecr=1240606
536 0.606239774 172.31.24.227 -> 172.31.31.144 OpenFlow 74 Type: OFPT_BARRIER_REPLY
537 0.606249301 172.31.31.144 -> 172.31.24.227 OpenFlow 170 Type: OFPT_FLOW_MOD
538 0.606253106 172.31.31.144 -> 172.31.24.227 OpenFlow 178 Type: OFPT_BARRIER_REQUEST
539 0.606255181 172.31.31.144 -> 172.31.24.227 TCP 66 6633 → 50468 [ACK] Seq=433 Ack=9 Win=853 Len=0 TSval=1240606 TSecr=394305878
540 0.606286582 172.31.24.227 -> 172.31.31.144 OpenFlow 74 Type: OFPT_BARRIER_REPLY
541 0.606333371 172.31.24.227 -> 172.31.31.144 OpenFlow 74 Type: OFPT_BARRIER_REPLY
542 0.606363419 172.31.31.144 -> 172.31.24.227 TCP 66 6633 → 50468 [ACK] Seq=433 Ack=17 Win=853 Len=0 TSval=1240606 TSecr=394305878
543 0.606392762 172.31.24.227 -> 172.31.31.144 OpenFlow 74 Type: OFPT_BARRIER_REPLY
544 0.606399114 172.31.24.227 -> 172.31.31.144 OpenFlow 74 Type: OFPT_BARRIER_REPLY
545 0.606409058 172.31.24.227 -> 172.31.31.144 OpenFlow 74 Type: OFPT_BARRIER_REPLY
546 0.606433632 172.31.31.144 -> 172.31.24.227 TCP 66 6633 → 50456 [ACK] Seq=217 Ack=255 Win=853 Len=0 TSval=1240607 TSecr=394305879
547 0.606473321 172.31.24.227 -> 172.31.31.144 TCP 66 50454 → 6633 [ACK] Seq=255 Ack=433 Win=213 Len=0 TSval=394305879 TSecr=1240606
548 0.606483041 172.31.24.227 -> 172.31.31.144 OpenFlow 74 Type: OFPT_BARRIER_REPLY
549 0.606485565 172.31.24.227 -> 172.31.31.144 OpenFlow 74 Type: OFPT_BARRIER_REPLY
550 0.606520737 172.31.24.227 -> 172.31.31.144 TCP 66 50444 → 6633 [ACK] Seq=915 Ack=1327 Win=213 Len=0 TSval=394305879 TSecr=1240606
551 0.606528014 172.31.31.144 -> 172.31.24.227 TCP 66 6633 → 50450 [ACK] Seq=1643 Ack=501 Win=853 Len=0 TSval=1240607 TSecr=394305879
552 0.606536066 172.31.24.227 -> 172.31.31.144 OpenFlow 74 Type: OFPT_BARRIER_REPLY
553 0.606572577 172.31.24.227 -> 172.31.31.144 TCP 66 50462 → 6633 [ACK] Seq=9 Ack=433 Win=213 Len=0 TSval=394305879 TSecr=1240606
554 0.606578742 172.31.24.227 -> 172.31.31.144 OpenFlow 74 Type: OFPT_BARRIER_REPLY
555 0.606603045 172.31.24.227 -> 172.31.31.144 TCP 66 50448 → 6633 [ACK] Seq=669 Ack=1569 Win=213 Len=0 TSval=394305879 TSecr=1240606
556 0.606608986 172.31.24.227 -> 172.31.31.144 OpenFlow 74 Type: OFPT_BARRIER_REPLY
557 0.606642011 172.31.24.227 -> 172.31.31.144 TCP 66 50472 → 6633 [ACK] Seq=337 Ack=553 Win=213 Len=0 TSval=394305879 TSecr=1240606
558 0.606647975 172.31.24.227 -> 172.31.31.144 OpenFlow 74 Type: OFPT_BARRIER_REPLY
559 0.606659533 172.31.31.144 -> 172.31.24.227 TCP 66 6633 → 50450 [ACK] Seq=1643 Ack=509 Win=853 Len=0 TSval=1240607 TSecr=394305879
560 0.606664118 172.31.31.144 -> 172.31.24.227 TCP 66 6633 → 50440 [ACK] Seq=1811 Ack=1415 Win=853 Len=0 TSval=1240607 TSecr=394305879
561 0.606687428 172.31.24.227 -> 172.31.31.144 TCP 66 50430 → 6633 [ACK] Seq=661 Ack=1111 Win=213 Len=0 TSval=394305879 TSecr=1240606
562 0.606697797 172.31.24.227 -> 172.31.31.144 OpenFlow 74 Type: OFPT_BARRIER_REPLY
563 0.606726426 172.31.24.227 -> 172.31.31.144 OpenFlow 74 Type: OFPT_BARRIER_REPLY
564 0.606779155 172.31.24.227 -> 172.31.31.144 TCP 66 50464 → 6633 [ACK] Seq=1 Ack=217 Win=213 Len=0 TSval=394305879 TSecr=1240606
565 0.606785534 172.31.24.227 -> 172.31.31.144 OpenFlow 74 Type: OFPT_BARRIER_REPLY
566 0.606812924 172.31.24.227 -> 172.31.31.144 OpenFlow 74 Type: OFPT_BARRIER_REPLY
567 0.606840796 172.31.31.144 -> 172.31.24.227 TCP 66 6633 → 50434 [ACK] Seq=2363 Ack=1513 Win=853 Len=0 TSval=1240607 TSecr=394305879
568 0.606867749 172.31.24.227 -> 172.31.31.144 TCP 66 50442 → 6633 [ACK] Seq=1743 Ack=2147 Win=213 Len=0 TSval=394305879 TSecr=1240606
569 0.606878145 172.31.24.227 -> 172.31.31.144 OpenFlow 74 Type: OFPT_BARRIER_REPLY
570 0.606980836 172.31.24.227 -> 172.31.31.144 OpenFlow 82 Type: OFPT_BARRIER_REPLY
571 0.606984672 172.31.24.227 -> 172.31.31.144 OpenFlow 74 Type: OFPT_BARRIER_REPLY
572 0.607000168 172.31.31.144 -> 172.31.24.227 OpenFlow 187 Type: OFPT_PACKET_OUT
573 0.607148165 172.31.31.144 -> 172.31.24.227 OpenFlow 187 Type: OFPT_PACKET_OUT
574 0.607154231 172.31.31.144 -> 172.31.24.227 TCP 66 6633 → 50464 [ACK] Seq=217 Ack=9 Win=853 Len=0 TSval=1240607 TSecr=394305879
575 0.607198772 172.31.31.144 -> 172.31.24.227 TCP 66 6633 → 50458 [ACK] Seq=433 Ack=255 Win=853 Len=0 TSval=1240607 TSecr=394305879
576 0.607222672 172.31.31.144 -> 172.31.24.227 TCP 66 6633 → 50470 [ACK] Seq=1153 Ack=529 Win=853 Len=0 TSval=1240607 TSecr=394305879
577 0.607309953 172.31.31.144 -> 172.31.24.227 TCP 66 6633 → 50458 [ACK] Seq=433 Ack=263 Win=853 Len=0 TSval=1240607 TSecr=394305879
578 0.607315509 172.31.31.144 -> 172.31.24.227 OpenFlow 187 Type: OFPT_PACKET_OUT
579 0.607404224 172.31.31.144 -> 172.31.24.227 OpenFlow 187 Type: OFPT_PACKET_OUT
580 0.607474480 172.31.31.144 -> 172.31.24.227 OpenFlow 187 Type: OFPT_PACKET_OUT
581 0.607533990 172.31.31.144 -> 172.31.24.227 OpenFlow 187 Type: OFPT_PACKET_OUT
582 0.607593882 172.31.31.144 -> 172.31.24.227 OpenFlow 187 Type: OFPT_PACKET_OUT
583 0.607631741 172.31.31.144 -> 172.31.24.227 OpenFlow 187 Type: OFPT_PACKET_OUT
584 0.607693474 172.31.31.144 -> 172.31.24.227 OpenFlow 187 Type: OFPT_PACKET_OUT
585 0.607751121 172.31.31.144 -> 172.31.24.227 OpenFlow 187 Type: OFPT_PACKET_OUT
586 0.607795704 172.31.31.144 -> 172.31.24.227 OpenFlow 187 Type: OFPT_PACKET_OUT
587 0.607856253 172.31.31.144 -> 172.31.24.227 OpenFlow 187 Type: OFPT_PACKET_OUT
588 0.607902979 172.31.31.144 -> 172.31.24.227 OpenFlow 187 Type: OFPT_PACKET_OUT
589 0.607951858 172.31.31.144 -> 172.31.24.227 OpenFlow 187 Type: OFPT_PACKET_OUT
590 0.609442584 172.31.24.227 -> 172.31.31.144 TCP 66 50452 → 6633 [ACK] Seq=1421 Ack=1783 Win=213 Len=0 TSval=394305879 TSecr=1240607
591 0.609539838 172.31.24.227 -> 172.31.31.144 TCP 66 50436 → 6633 [ACK] Seq=915 Ack=1569 Win=213 Len=0 TSval=394305879 TSecr=1240606
592 0.609551709 172.31.24.227 -> 172.31.31.144 OpenFlow 74 Type: OFPT_BARRIER_REPLY
593 0.609580616 172.31.24.227 -> 172.31.31.144 OpenFlow 189 Type: OFPT_PACKET_IN
594 0.609616544 172.31.24.227 -> 172.31.31.144 OpenFlow 189 Type: OFPT_PACKET_IN
595 0.609682203 172.31.24.227 -> 172.31.31.144 OpenFlow 189 Type: OFPT_PACKET_IN
596 0.609689725 172.31.24.227 -> 172.31.31.144 OpenFlow 189 Type: OFPT_PACKET_IN
597 0.609779941 172.31.31.144 -> 172.31.24.227 TCP 66 6633 → 50436 [ACK] Seq=1569 Ack=923 Win=853 Len=0 TSval=1240607 TSecr=394305879
598 0.609816581 172.31.31.144 -> 172.31.24.227 TCP 66 6633 → 50450 [ACK] Seq=1643 Ack=632 Win=853 Len=0 TSval=1240607 TSecr=394305879
599 0.609868312 172.31.31.144 -> 172.31.24.227 TCP 66 6633 → 50450 [ACK] Seq=1643 Ack=755 Win=853 Len=0 TSval=1240607 TSecr=394305879
600 0.610086106 172.31.31.144 -> 172.31.24.227 TCP 66 6633 → 50454 [ACK] Seq=1401 Ack=509 Win=853 Len=0 TSval=1240607 TSecr=394305879
601 0.610166330 172.31.24.227 -> 172.31.31.144 OpenFlow 189 Type: OFPT_PACKET_IN
602 0.610199068 172.31.24.227 -> 172.31.31.144 OpenFlow 189 Type: OFPT_PACKET_IN
603 0.610228941 172.31.24.227 -> 172.31.31.144 OpenFlow 189 Type: OFPT_PACKET_IN
604 0.610248841 172.31.24.227 -> 172.31.31.144 OpenFlow 189 Type: OFPT_PACKET_IN
605 0.610257988 172.31.24.227 -> 172.31.31.144 OpenFlow 189 Type: OFPT_PACKET_IN
606 0.610311969 172.31.24.227 -> 172.31.31.144 OpenFlow 189 Type: OFPT_PACKET_IN
607 0.610383232 172.31.31.144 -> 172.31.24.227 TCP 66 6633 → 50446 [ACK] Seq=2267 Ack=1956 Win=853 Len=0 TSval=1240608 TSecr=394305878
608 0.610480359 172.31.31.144 -> 172.31.24.227 TCP 66 6633 → 50448 [ACK] Seq=1569 Ack=800 Win=853 Len=0 TSval=1240608 TSecr=394305879
609 0.610578550 172.31.31.144 -> 172.31.24.227 TCP 66 6633 → 50462 [ACK] Seq=433 Ack=263 Win=853 Len=0 TSval=1240608 TSecr=394305879
610 0.611806087 172.31.24.227 -> 172.31.31.144 OpenFlow 189 Type: OFPT_PACKET_IN
611 0.611827128 172.31.24.227 -> 172.31.31.144 OpenFlow 189 Type: OFPT_PACKET_IN
612 0.611842178 172.31.24.227 -> 172.31.31.144 OpenFlow 189 Type: OFPT_PACKET_IN
613 0.611882302 172.31.24.227 -> 172.31.31.144 OpenFlow 189 Type: OFPT_PACKET_IN
614 0.611989767 172.31.31.144 -> 172.31.24.227 TCP 66 6633 → 50456 [ACK] Seq=217 Ack=378 Win=853 Len=0 TSval=1240608 TSecr=394305880
615 0.612045909 172.31.31.144 -> 172.31.24.227 TCP 66 6633 → 50456 [ACK] Seq=217 Ack=501 Win=853 Len=0 TSval=1240608 TSecr=394305880
616 0.612085786 172.31.31.144 -> 172.31.24.227 TCP 66 6633 → 50452 [ACK] Seq=1783 Ack=1667 Win=853 Len=0 TSval=1240608 TSecr=394305880
617 0.638503299 172.31.31.144 -> 172.31.24.227 TCP 66 6633 → 50460 [ACK] Seq=841 Ack=921 Win=853 Len=0 TSval=1240615 TSecr=394305877
618 0.642515164 172.31.31.144 -> 172.31.24.227 TCP 66 6633 → 50474 [ACK] Seq=553 Ack=345 Win=853 Len=0 TSval=1240616 TSecr=394305878
619 0.642521945 172.31.31.144 -> 172.31.24.227 TCP 66 6633 → 50476 [ACK] Seq=385 Ack=177 Win=853 Len=0 TSval=1240616 TSecr=394305878
620 0.646574830 172.31.31.144 -> 172.31.24.227 TCP 66 6633 → 50430 [ACK] Seq=1111 Ack=669 Win=853 Len=0 TSval=1240617 TSecr=394305879
621 0.646581840 172.31.31.144 -> 172.31.24.227 TCP 66 6633 → 50444 [ACK] Seq=1327 Ack=923 Win=853 Len=0 TSval=1240617 TSecr=394305879
622 0.646584452 172.31.31.144 -> 172.31.24.227 TCP 66 6633 → 50472 [ACK] Seq=553 Ack=345 Win=853 Len=0 TSval=1240617 TSecr=394305879
623 0.646587362 172.31.31.144 -> 172.31.24.227 TCP 66 6633 → 50442 [ACK] Seq=2147 Ack=1751 Win=853 Len=0 TSval=1240617 TSecr=394305879
624 0.650534233 172.31.31.144 -> 172.31.24.227 TCP 66 6633 → 50448 [ACK] Seq=1569 Ack=923 Win=853 Len=0 TSval=1240618 TSecr=394305880
625 0.650540193 172.31.31.144 -> 172.31.24.227 TCP 66 6633 → 50446 [ACK] Seq=2267 Ack=2079 Win=853 Len=0 TSval=1240618 TSecr=394305880
626 0.700459328 172.31.31.144 -> 172.31.24.227 OpenFlow 187 Type: OFPT_PACKET_OUT
627 0.700484803 172.31.31.144 -> 172.31.24.227 OpenFlow 187 Type: OFPT_PACKET_OUT
628 0.700488539 172.31.31.144 -> 172.31.24.227 OpenFlow 187 Type: OFPT_PACKET_OUT
629 0.700492199 172.31.31.144 -> 172.31.24.227 OpenFlow 187 Type: OFPT_PACKET_OUT
630 0.700508277 172.31.31.144 -> 172.31.24.227 OpenFlow 187 Type: OFPT_PACKET_OUT
631 0.700512280 172.31.31.144 -> 172.31.24.227 OpenFlow 187 Type: OFPT_PACKET_OUT
632 0.700558753 172.31.31.144 -> 172.31.24.227 OpenFlow 187 Type: OFPT_PACKET_OUT
633 0.700610753 172.31.31.144 -> 172.31.24.227 OpenFlow 187 Type: OFPT_PACKET_OUT
634 0.700710819 172.31.31.144 -> 172.31.24.227 OpenFlow 187 Type: OFPT_PACKET_OUT
635 0.700716671 172.31.31.144 -> 172.31.24.227 OpenFlow 187 Type: OFPT_PACKET_OUT
636 0.700770531 172.31.31.144 -> 172.31.24.227 OpenFlow 187 Type: OFPT_PACKET_OUT
637 0.700800656 172.31.31.144 -> 172.31.24.227 OpenFlow 187 Type: OFPT_PACKET_OUT
638 0.701067964 172.31.24.227 -> 172.31.31.144 TCP 66 50456 → 6633 [ACK] Seq=501 Ack=943 Win=213 Len=0 TSval=394305902 TSecr=1240630
639 0.701209619 172.31.24.227 -> 172.31.31.144 OpenFlow 189 Type: OFPT_PACKET_IN
640 0.701232391 172.31.24.227 -> 172.31.31.144 OpenFlow 189 Type: OFPT_PACKET_IN
641 0.701280850 172.31.24.227 -> 172.31.31.144 OpenFlow 189 Type: OFPT_PACKET_IN
642 0.701303558 172.31.24.227 -> 172.31.31.144 OpenFlow 189 Type: OFPT_PACKET_IN
643 0.701363139 172.31.24.227 -> 172.31.31.144 OpenFlow 189 Type: OFPT_PACKET_IN
644 0.701385464 172.31.24.227 -> 172.31.31.144 OpenFlow 189 Type: OFPT_PACKET_IN
645 0.701496068 172.31.31.144 -> 172.31.24.227 TCP 66 6633 → 50454 [ACK] Seq=1401 Ack=755 Win=853 Len=0 TSval=1240630 TSecr=394305902
646 0.701507301 172.31.31.144 -> 172.31.24.227 TCP 66 6633 → 50448 [ACK] Seq=1569 Ack=1046 Win=853 Len=0 TSval=1240630 TSecr=394305902
647 0.701548941 172.31.31.144 -> 172.31.24.227 TCP 66 6633 → 50464 [ACK] Seq=217 Ack=132 Win=853 Len=0 TSval=1240630 TSecr=394305902
648 0.701674966 172.31.31.144 -> 172.31.24.227 TCP 66 6633 → 50448 [ACK] Seq=1569 Ack=1169 Win=853 Len=0 TSval=1240630 TSecr=394305902
649 0.701690478 172.31.31.144 -> 172.31.24.227 TCP 66 6633 → 50464 [ACK] Seq=217 Ack=255 Win=853 Len=0 TSval=1240630 TSecr=394305902
650 0.701762267 172.31.24.227 -> 172.31.31.144 TCP 66 50458 → 6633 [ACK] Seq=263 Ack=1159 Win=213 Len=0 TSval=394305902 TSecr=1240630
651 0.701935071 172.31.24.227 -> 172.31.31.144 OpenFlow 189 Type: OFPT_PACKET_IN
652 0.701957814 172.31.24.227 -> 172.31.31.144 OpenFlow 189 Type: OFPT_PACKET_IN
653 0.701999268 172.31.24.227 -> 172.31.31.144 OpenFlow 189 Type: OFPT_PACKET_IN
654 0.702037019 172.31.24.227 -> 172.31.31.144 OpenFlow 189 Type: OFPT_PACKET_IN
655 0.702055052 172.31.24.227 -> 172.31.31.144 OpenFlow 189 Type: OFPT_PACKET_IN
656 0.702100033 172.31.24.227 -> 172.31.31.144 OpenFlow 189 Type: OFPT_PACKET_IN
657 0.702159191 172.31.31.144 -> 172.31.24.227 TCP 66 6633 → 50468 [ACK] Seq=433 Ack=140 Win=853 Len=0 TSval=1240630 TSecr=394305902
658 0.702165443 172.31.31.144 -> 172.31.24.227 TCP 66 6633 → 50468 [ACK] Seq=433 Ack=263 Win=853 Len=0 TSval=1240630 TSecr=394305902
659 0.702226222 172.31.31.144 -> 172.31.24.227 TCP 66 6633 → 50450 [ACK] Seq=1643 Ack=878 Win=853 Len=0 TSval=1240630 TSecr=394305902
660 0.702231945 172.31.31.144 -> 172.31.24.227 TCP 66 6633 → 50450 [ACK] Seq=1643 Ack=1001 Win=853 Len=0 TSval=1240630 TSecr=394305902
661 0.702395116 172.31.31.144 -> 172.31.24.227 TCP 66 6633 → 50460 [ACK] Seq=841 Ack=1167 Win=853 Len=0 TSval=1240630 TSecr=394305902
662 0.800191445 172.31.31.144 -> 172.31.24.227 OpenFlow 187 Type: OFPT_PACKET_OUT
663 0.800218816 172.31.31.144 -> 172.31.24.227 OpenFlow 187 Type: OFPT_PACKET_OUT
664 0.800237257 172.31.31.144 -> 172.31.24.227 OpenFlow 187 Type: OFPT_PACKET_OUT
665 0.800259063 172.31.31.144 -> 172.31.24.227 OpenFlow 187 Type: OFPT_PACKET_OUT
666 0.800314476 172.31.31.144 -> 172.31.24.227 OpenFlow 187 Type: OFPT_PACKET_OUT
667 0.800385080 172.31.31.144 -> 172.31.24.227 OpenFlow 187 Type: OFPT_PACKET_OUT
668 0.800431544 172.31.31.144 -> 172.31.24.227 OpenFlow 187 Type: OFPT_PACKET_OUT
669 0.800480781 172.31.31.144 -> 172.31.24.227 OpenFlow 187 Type: OFPT_PACKET_OUT
670 0.800557356 172.31.31.144 -> 172.31.24.227 OpenFlow 187 Type: OFPT_PACKET_OUT
671 0.800594884 172.31.31.144 -> 172.31.24.227 OpenFlow 187 Type: OFPT_PACKET_OUT
672 0.800660050 172.31.31.144 -> 172.31.24.227 OpenFlow 187 Type: OFPT_PACKET_OUT
673 0.800718494 172.31.31.144 -> 172.31.24.227 OpenFlow 187 Type: OFPT_PACKET_OUT
674 0.800769293 172.31.31.144 -> 172.31.24.227 OpenFlow 187 Type: OFPT_PACKET_OUT
675 0.800826107 172.31.31.144 -> 172.31.24.227 OpenFlow 187 Type: OFPT_PACKET_OUT
676 0.800870680 172.31.31.144 -> 172.31.24.227 OpenFlow 187 Type: OFPT_PACKET_OUT
677 0.800921599 172.31.31.144 -> 172.31.24.227 OpenFlow 187 Type: OFPT_PACKET_OUT
678 0.800993059 172.31.31.144 -> 172.31.24.227 OpenFlow 187 Type: OFPT_PACKET_OUT
679 0.801039307 172.31.31.144 -> 172.31.24.227 OpenFlow 187 Type: OFPT_PACKET_OUT
680 0.801087299 172.31.24.227 -> 172.31.31.144 TCP 66 50460 → 6633 [ACK] Seq=1167 Ack=1809 Win=213 Len=0 TSval=394305927 TSecr=1240655
681 0.801206538 172.31.24.227 -> 172.31.31.144 OpenFlow 189 Type: OFPT_PACKET_IN
682 0.801227762 172.31.24.227 -> 172.31.31.144 OpenFlow 189 Type: OFPT_PACKET_IN
683 0.801557156 172.31.31.144 -> 172.31.24.227 TCP 66 6633 → 50462 [ACK] Seq=1643 Ack=509 Win=853 Len=0 TSval=1240655 TSecr=394305927
684 0.801742430 172.31.24.227 -> 172.31.31.144 OpenFlow 189 Type: OFPT_PACKET_IN
685 0.801761974 172.31.24.227 -> 172.31.31.144 OpenFlow 189 Type: OFPT_PACKET_IN
686 0.801779397 172.31.24.227 -> 172.31.31.144 OpenFlow 189 Type: OFPT_PACKET_IN
687 0.801807957 172.31.24.227 -> 172.31.31.144 OpenFlow 189 Type: OFPT_PACKET_IN
688 0.801817720 172.31.24.227 -> 172.31.31.144 OpenFlow 435 Type: OFPT_PACKET_IN
689 0.801836342 172.31.24.227 -> 172.31.31.144 OpenFlow 189 Type: OFPT_PACKET_IN
690 0.801842530 172.31.24.227 -> 172.31.31.144 OpenFlow 189 Type: OFPT_PACKET_IN
691 0.801860663 172.31.24.227 -> 172.31.31.144 OpenFlow 189 Type: OFPT_PACKET_IN
692 0.801920484 172.31.24.227 -> 172.31.31.144 OpenFlow 189 Type: OFPT_PACKET_IN
693 0.802003047 172.31.31.144 -> 172.31.24.227 TCP 66 6633 → 50474 [ACK] Seq=553 Ack=591 Win=853 Len=0 TSval=1240655 TSecr=394305927
694 0.802012342 172.31.31.144 -> 172.31.24.227 TCP 66 6633 → 50472 [ACK] Seq=553 Ack=468 Win=853 Len=0 TSval=1240655 TSecr=394305927
695 0.802018697 172.31.24.227 -> 172.31.31.144 OpenFlow 189 Type: OFPT_PACKET_IN
696 0.802042647 172.31.24.227 -> 172.31.31.144 OpenFlow 189 Type: OFPT_PACKET_IN
697 0.802050717 172.31.31.144 -> 172.31.24.227 TCP 66 6633 → 50464 [ACK] Seq=217 Ack=378 Win=853 Len=0 TSval=1240655 TSecr=394305927
698 0.802069478 172.31.24.227 -> 172.31.31.144 OpenFlow 189 Type: OFPT_PACKET_IN
699 0.802105919 172.31.24.227 -> 172.31.31.144 OpenFlow 189 Type: OFPT_PACKET_IN
700 0.802111607 172.31.24.227 -> 172.31.31.144 OpenFlow 189 Type: OFPT_PACKET_IN
701 0.802237502 172.31.31.144 -> 172.31.24.227 TCP 66 6633 → 50464 [ACK] Seq=217 Ack=501 Win=853 Len=0 TSval=1240655 TSecr=394305927
702 0.802244142 172.31.31.144 -> 172.31.24.227 TCP 66 6633 → 50458 [ACK] Seq=1159 Ack=386 Win=853 Len=0 TSval=1240655 TSecr=394305927
703 0.802247026 172.31.31.144 -> 172.31.24.227 TCP 66 6633 → 50472 [ACK] Seq=553 Ack=837 Win=853 Len=0 TSval=1240655 TSecr=394305927
704 0.802343984 172.31.31.144 -> 172.31.24.227 TCP 66 6633 → 50458 [ACK] Seq=1159 Ack=509 Win=853 Len=0 TSval=1240655 TSecr=394305927
705 0.802531347 172.31.31.144 -> 172.31.24.227 TCP 66 6633 → 50460 [ACK] Seq=1809 Ack=1413 Win=853 Len=0 TSval=1240656 TSecr=394305927
706 0.802535783 172.31.31.144 -> 172.31.24.227 TCP 66 6633 → 50454 [ACK] Seq=1401 Ack=1001 Win=853 Len=0 TSval=1240656 TSecr=394305927
707 0.802752508 172.31.31.144 -> 172.31.24.227 TCP 66 6633 → 50470 [ACK] Seq=1153 Ack=775 Win=853 Len=0 TSval=1240656 TSecr=394305927
708 0.900417812 172.31.31.144 -> 172.31.24.227 OpenFlow 187 Type: OFPT_PACKET_OUT
709 0.900431263 172.31.31.144 -> 172.31.24.227 OpenFlow 187 Type: OFPT_PACKET_OUT
710 0.900445706 172.31.31.144 -> 172.31.24.227 OpenFlow 187 Type: OFPT_PACKET_OUT
711 0.900488579 172.31.31.144 -> 172.31.24.227 OpenFlow 187 Type: OFPT_PACKET_OUT
712 0.900539543 172.31.31.144 -> 172.31.24.227 OpenFlow 187 Type: OFPT_PACKET_OUT
713 0.900590292 172.31.31.144 -> 172.31.24.227 OpenFlow 187 Type: OFPT_PACKET_OUT
714 0.900925928 172.31.24.227 -> 172.31.31.144 TCP 66 50464 → 6633 [ACK] Seq=501 Ack=943 Win=213 Len=0 TSval=394305952 TSecr=1240680
715 0.901108746 172.31.24.227 -> 172.31.31.144 OpenFlow 189 Type: OFPT_PACKET_IN
716 0.901130231 172.31.24.227 -> 172.31.31.144 OpenFlow 189 Type: OFPT_PACKET_IN
717 0.901197950 172.31.24.227 -> 172.31.31.144 OpenFlow 189 Type: OFPT_PACKET_IN
718 0.901217104 172.31.24.227 -> 172.31.31.144 OpenFlow 189 Type: OFPT_PACKET_IN
719 0.901236484 172.31.24.227 -> 172.31.31.144 OpenFlow 189 Type: OFPT_PACKET_IN
720 0.901311610 172.31.24.227 -> 172.31.31.144 OpenFlow 189 Type: OFPT_PACKET_IN
721 0.901336228 172.31.31.144 -> 172.31.24.227 TCP 66 6633 → 50456 [ACK] Seq=943 Ack=624 Win=853 Len=0 TSval=1240680 TSecr=394305952
722 0.901345342 172.31.31.144 -> 172.31.24.227 TCP 66 6633 → 50456 [ACK] Seq=943 Ack=747 Win=853 Len=0 TSval=1240680 TSecr=394305952
723 0.901423179 172.31.31.144 -> 172.31.24.227 TCP 66 6633 → 50462 [ACK] Seq=1643 Ack=755 Win=853 Len=0 TSval=1240680 TSecr=394305952
724 0.901477707 172.31.31.144 -> 172.31.24.227 TCP 66 6633 → 50476 [ACK] Seq=385 Ack=300 Win=853 Len=0 TSval=1240680 TSecr=394305952
725 0.901516869 172.31.31.144 -> 172.31.24.227 TCP 66 6633 → 50476 [ACK] Seq=385 Ack=423 Win=853 Len=0 TSval=1240680 TSecr=394305952
726 1.000003327 172.31.31.144 -> 172.31.24.227 OpenFlow 187 Type: OFPT_PACKET_OUT
727 1.000038771 172.31.31.144 -> 172.31.24.227 OpenFlow 187 Type: OFPT_PACKET_OUT
728 1.000064414 172.31.31.144 -> 172.31.24.227 OpenFlow 187 Type: OFPT_PACKET_OUT
729 1.000068418 172.31.31.144 -> 172.31.24.227 OpenFlow 187 Type: OFPT_PACKET_OUT
730 1.000132697 172.31.31.144 -> 172.31.24.227 OpenFlow 187 Type: OFPT_PACKET_OUT
731 1.000177736 172.31.31.144 -> 172.31.24.227 OpenFlow 187 Type: OFPT_PACKET_OUT
732 1.000242917 172.31.31.144 -> 172.31.24.227 OpenFlow 187 Type: OFPT_PACKET_OUT
733 1.000304042 172.31.31.144 -> 172.31.24.227 OpenFlow 187 Type: OFPT_PACKET_OUT
734 1.000340690 172.31.31.144 -> 172.31.24.227 OpenFlow 187 Type: OFPT_PACKET_OUT
735 1.000394745 172.31.31.144 -> 172.31.24.227 OpenFlow 187 Type: OFPT_PACKET_OUT
736 1.000446356 172.31.31.144 -> 172.31.24.227 OpenFlow 187 Type: OFPT_PACKET_OUT
737 1.000499355 172.31.31.144 -> 172.31.24.227 OpenFlow 187 Type: OFPT_PACKET_OUT
738 1.000557256 172.31.31.144 -> 172.31.24.227 OpenFlow 187 Type: OFPT_PACKET_OUT
739 1.000606249 172.31.31.144 -> 172.31.24.227 OpenFlow 187 Type: OFPT_PACKET_OUT
740 1.000698779 172.31.24.227 -> 172.31.31.144 TCP 66 50466 → 6633 [ACK] Seq=247 Ack=727 Win=213 Len=0 TSval=394305977 TSecr=1240705
741 1.000973277 172.31.24.227 -> 172.31.31.144 OpenFlow 189 Type: OFPT_PACKET_IN
742 1.000994963 172.31.24.227 -> 172.31.31.144 OpenFlow 189 Type: OFPT_PACKET_IN
743 1.001193217 172.31.31.144 -> 172.31.24.227 TCP 66 6633 → 50468 [ACK] Seq=1401 Ack=386 Win=853 Len=0 TSval=1240705 TSecr=394305977
744 1.001201965 172.31.31.144 -> 172.31.24.227 TCP 66 6633 → 50468 [ACK] Seq=1401 Ack=509 Win=853 Len=0 TSval=1240705 TSecr=394305977
745 1.001387869 172.31.24.227 -> 172.31.31.144 OpenFlow 189 Type: OFPT_PACKET_IN
746 1.001408168 172.31.24.227 -> 172.31.31.144 OpenFlow 189 Type: OFPT_PACKET_IN
747 1.001448725 172.31.24.227 -> 172.31.31.144 OpenFlow 189 Type: OFPT_PACKET_IN
748 1.001464875 172.31.24.227 -> 172.31.31.144 OpenFlow 189 Type: OFPT_PACKET_IN
749 1.001526005 172.31.24.227 -> 172.31.31.144 OpenFlow 189 Type: OFPT_PACKET_IN
750 1.001543799 172.31.24.227 -> 172.31.31.144 OpenFlow 189 Type: OFPT_PACKET_IN
751 1.001563574 172.31.24.227 -> 172.31.31.144 OpenFlow 189 Type: OFPT_PACKET_IN
752 1.001652811 172.31.31.144 -> 172.31.24.227 TCP 66 6633 → 50450 [ACK] Seq=1643 Ack=1124 Win=853 Len=0 TSval=1240705 TSecr=394305977
753 1.001659822 172.31.31.144 -> 172.31.24.227 TCP 66 6633 → 50450 [ACK] Seq=1643 Ack=1247 Win=853 Len=0 TSval=1240705 TSecr=394305977
754 1.001662486 172.31.31.144 -> 172.31.24.227 TCP 66 6633 → 50466 [ACK] Seq=727 Ack=370 Win=853 Len=0 TSval=1240705 TSecr=394305977
755 1.001664942 172.31.31.144 -> 172.31.24.227 TCP 66 6633 → 50466 [ACK] Seq=727 Ack=493 Win=853 Len=0 TSval=1240705 TSecr=394305977
756 1.001679004 172.31.24.227 -> 172.31.31.144 OpenFlow 189 Type: OFPT_PACKET_IN
757 1.001865091 172.31.31.144 -> 172.31.24.227 TCP 66 6633 → 50470 [ACK] Seq=1153 Ack=1021 Win=853 Len=0 TSval=1240705 TSecr=394305977
758 1.002056170 172.31.31.144 -> 172.31.24.227 TCP 66 6633 → 50458 [ACK] Seq=1159 Ack=755 Win=853 Len=0 TSval=1240705 TSecr=394305977
759 1.100029217 172.31.31.144 -> 172.31.24.227 OpenFlow 187 Type: OFPT_PACKET_OUT
760 1.100043531 172.31.31.144 -> 172.31.24.227 OpenFlow 187 Type: OFPT_PACKET_OUT
761 1.100047678 172.31.31.144 -> 172.31.24.227 OpenFlow 187 Type: OFPT_PACKET_OUT
762 1.100050192 172.31.31.144 -> 172.31.24.227 OpenFlow 187 Type: OFPT_PACKET_OUT
763 1.100063199 172.31.31.144 -> 172.31.24.227 OpenFlow 187 Type: OFPT_PACKET_OUT
764 1.100113005 172.31.31.144 -> 172.31.24.227 OpenFlow 187 Type: OFPT_PACKET_OUT
765 1.100164637 172.31.31.144 -> 172.31.24.227 OpenFlow 187 Type: OFPT_PACKET_OUT
766 1.100215185 172.31.31.144 -> 172.31.24.227 OpenFlow 187 Type: OFPT_PACKET_OUT
767 1.100564835 172.31.24.227 -> 172.31.31.144 TCP 66 50470 → 6633 [ACK] Seq=1021 Ack=2121 Win=213 Len=0 TSval=394306002 TSecr=1240730
768 1.100745240 172.31.24.227 -> 172.31.31.144 OpenFlow 189 Type: OFPT_PACKET_IN
769 1.100765990 172.31.24.227 -> 172.31.31.144 OpenFlow 189 Type: OFPT_PACKET_IN
770 1.100814310 172.31.24.227 -> 172.31.31.144 OpenFlow 189 Type: OFPT_PACKET_IN
771 1.100833891 172.31.24.227 -> 172.31.31.144 OpenFlow 189 Type: OFPT_PACKET_IN
772 1.100910593 172.31.24.227 -> 172.31.31.144 OpenFlow 189 Type: OFPT_PACKET_IN
773 1.100965828 172.31.31.144 -> 172.31.24.227 TCP 66 6633 → 50468 [ACK] Seq=1401 Ack=632 Win=853 Len=0 TSval=1240730 TSecr=394306002
774 1.100972730 172.31.31.144 -> 172.31.24.227 TCP 66 6633 → 50468 [ACK] Seq=1401 Ack=755 Win=853 Len=0 TSval=1240730 TSecr=394306002
775 1.100979330 172.31.24.227 -> 172.31.31.144 OpenFlow 189 Type: OFPT_PACKET_IN
776 1.101035333 172.31.31.144 -> 172.31.24.227 TCP 66 6633 → 50460 [ACK] Seq=1809 Ack=1536 Win=853 Len=0 TSval=1240730 TSecr=394306002
777 1.101043825 172.31.31.144 -> 172.31.24.227 TCP 66 6633 → 50460 [ACK] Seq=1809 Ack=1659 Win=853 Len=0 TSval=1240730 TSecr=394306002
778 1.101139869 172.31.31.144 -> 172.31.24.227 TCP 66 6633 → 50472 [ACK] Seq=553 Ack=960 Win=853 Len=0 TSval=1240730 TSecr=394306002
779 1.101216459 172.31.31.144 -> 172.31.24.227 TCP 66 6633 → 50472 [ACK] Seq=553 Ack=1083 Win=853 Len=0 TSval=1240730 TSecr=394306002
780 1.199639096 172.31.31.144 -> 172.31.24.227 OpenFlow 187 Type: OFPT_PACKET_OUT
781 1.199652412 172.31.31.144 -> 172.31.24.227 OpenFlow 187 Type: OFPT_PACKET_OUT
782 1.199656438 172.31.31.144 -> 172.31.24.227 OpenFlow 187 Type: OFPT_PACKET_OUT
783 1.199670283 172.31.31.144 -> 172.31.24.227 OpenFlow 187 Type: OFPT_PACKET_OUT
784 1.199707961 172.31.31.144 -> 172.31.24.227 OpenFlow 187 Type: OFPT_PACKET_OUT
785 1.199757472 172.31.31.144 -> 172.31.24.227 OpenFlow 187 Type: OFPT_PACKET_OUT
786 1.199814279 172.31.31.144 -> 172.31.24.227 OpenFlow 187 Type: OFPT_PACKET_OUT
787 1.199847255 172.31.31.144 -> 172.31.24.227 OpenFlow 187 Type: OFPT_PACKET_OUT
788 1.199912441 172.31.31.144 -> 172.31.24.227 OpenFlow 187 Type: OFPT_PACKET_OUT
789 1.199951316 172.31.31.144 -> 172.31.24.227 OpenFlow 187 Type: OFPT_PACKET_OUT
790 1.199996830 172.31.31.144 -> 172.31.24.227 OpenFlow 187 Type: OFPT_PACKET_OUT
791 1.200103416 172.31.31.144 -> 172.31.24.227 OpenFlow 187 Type: OFPT_PACKET_OUT
792 1.200110352 172.31.31.144 -> 172.31.24.227 OpenFlow 187 Type: OFPT_PACKET_OUT
793 1.200183638 172.31.31.144 -> 172.31.24.227 OpenFlow 187 Type: OFPT_PACKET_OUT
794 1.200190625 172.31.31.144 -> 172.31.24.227 OpenFlow 187 Type: OFPT_PACKET_OUT
795 1.200232057 172.31.31.144 -> 172.31.24.227 OpenFlow 187 Type: OFPT_PACKET_OUT
796 1.200357135 172.31.24.227 -> 172.31.31.144 TCP 66 50472 → 6633 [ACK] Seq=1083 Ack=1521 Win=213 Len=0 TSval=394306027 TSecr=1240755
797 1.200460243 172.31.24.227 -> 172.31.31.144 OpenFlow 189 Type: OFPT_PACKET_IN
798 1.200493589 172.31.24.227 -> 172.31.31.144 OpenFlow 189 Type: OFPT_PACKET_IN
799 1.200652262 172.31.24.227 -> 172.31.31.144 OpenFlow 189 Type: OFPT_PACKET_IN
800 1.200672225 172.31.24.227 -> 172.31.31.144 OpenFlow 189 Type: OFPT_PACKET_IN
801 1.200715972 172.31.24.227 -> 172.31.31.144 OpenFlow 189 Type: OFPT_PACKET_IN
802 1.200732100 172.31.24.227 -> 172.31.31.144 OpenFlow 189 Type: OFPT_PACKET_IN
803 1.200761721 172.31.24.227 -> 172.31.31.144 OpenFlow 189 Type: OFPT_PACKET_IN
804 1.200791310 172.31.24.227 -> 172.31.31.144 OpenFlow 189 Type: OFPT_PACKET_IN
805 1.200892189 172.31.31.144 -> 172.31.24.227 TCP 66 6633 → 50470 [ACK] Seq=2121 Ack=1267 Win=853 Len=0 TSval=1240755 TSecr=394306027
806 1.200899841 172.31.31.144 -> 172.31.24.227 TCP 66 6633 → 50460 [ACK] Seq=1809 Ack=1782 Win=853 Len=0 TSval=1240755 TSecr=394306027
807 1.200902831 172.31.31.144 -> 172.31.24.227 TCP 66 6633 → 50460 [ACK] Seq=1809 Ack=1905 Win=853 Len=0 TSval=1240755 TSecr=394306027
808 1.200967880 172.31.31.144 -> 172.31.24.227 TCP 66 6633 → 50474 [ACK] Seq=1521 Ack=714 Win=853 Len=0 TSval=1240755 TSecr=394306027
809 1.201018104 172.31.31.144 -> 172.31.24.227 TCP 66 6633 → 50462 [ACK] Seq=1643 Ack=1001 Win=853 Len=0 TSval=1240755 TSecr=394306027
810 1.201053719 172.31.31.144 -> 172.31.24.227 TCP 66 6633 → 50474 [ACK] Seq=1521 Ack=837 Win=853 Len=0 TSval=1240755 TSecr=394306027
811 1.201202182 172.31.24.227 -> 172.31.31.144 OpenFlow 189 Type: OFPT_PACKET_IN
812 1.201221491 172.31.24.227 -> 172.31.31.144 OpenFlow 189 Type: OFPT_PACKET_IN
813 1.201396136 172.31.24.227 -> 172.31.31.144 OpenFlow 189 Type: OFPT_PACKET_IN
814 1.201426359 172.31.31.144 -> 172.31.24.227 TCP 66 6633 → 50472 [ACK] Seq=1521 Ack=1206 Win=853 Len=0 TSval=1240755 TSecr=394306027
815 1.201432150 172.31.31.144 -> 172.31.24.227 TCP 66 6633 → 50472 [ACK] Seq=1521 Ack=1329 Win=853 Len=0 TSval=1240755 TSecr=394306027
816 1.201437957 172.31.24.227 -> 172.31.31.144 OpenFlow 189 Type: OFPT_PACKET_IN
817 1.201461709 172.31.24.227 -> 172.31.31.144 OpenFlow 189 Type: OFPT_PACKET_IN
818 1.201485491 172.31.24.227 -> 172.31.31.144 OpenFlow 189 Type: OFPT_PACKET_IN
819 1.201712888 172.31.31.144 -> 172.31.24.227 TCP 66 6633 → 50476 [ACK] Seq=385 Ack=546 Win=853 Len=0 TSval=1240755 TSecr=394306027
820 1.201719791 172.31.31.144 -> 172.31.24.227 TCP 66 6633 → 50476 [ACK] Seq=385 Ack=669 Win=853 Len=0 TSval=1240755 TSecr=394306027
821 1.201722346 172.31.31.144 -> 172.31.24.227 TCP 66 6633 → 50462 [ACK] Seq=1643 Ack=1247 Win=853 Len=0 TSval=1240755 TSecr=394306027
822 1.299701500 172.31.31.144 -> 172.31.24.227 OpenFlow 187 Type: OFPT_PACKET_OUT
823 1.299718336 172.31.31.144 -> 172.31.24.227 OpenFlow 187 Type: OFPT_PACKET_OUT
824 1.299723247 172.31.31.144 -> 172.31.24.227 OpenFlow 187 Type: OFPT_PACKET_OUT
825 1.299725567 172.31.31.144 -> 172.31.24.227 OpenFlow 187 Type: OFPT_PACKET_OUT
826 1.299736070 172.31.31.144 -> 172.31.24.227 OpenFlow 187 Type: OFPT_PACKET_OUT
827 1.299779580 172.31.31.144 -> 172.31.24.227 OpenFlow 187 Type: OFPT_PACKET_OUT
828 1.300112466 172.31.24.227 -> 172.31.31.144 TCP 66 50476 → 6633 [ACK] Seq=669 Ack=1111 Win=213 Len=0 TSval=394306052 TSecr=1240780
829 1.300207598 172.31.24.227 -> 172.31.31.144 OpenFlow 189 Type: OFPT_PACKET_IN
830 1.300227567 172.31.24.227 -> 172.31.31.144 OpenFlow 189 Type: OFPT_PACKET_IN
831 1.300263463 172.31.24.227 -> 172.31.31.144 OpenFlow 189 Type: OFPT_PACKET_IN
832 1.300283052 172.31.24.227 -> 172.31.31.144 OpenFlow 189 Type: OFPT_PACKET_IN
833 1.300455517 172.31.31.144 -> 172.31.24.227 TCP 66 6633 → 50474 [ACK] Seq=1521 Ack=960 Win=853 Len=0 TSval=1240780 TSecr=394306052
834 1.300463726 172.31.31.144 -> 172.31.24.227 TCP 66 6633 → 50474 [ACK] Seq=1521 Ack=1083 Win=853 Len=0 TSval=1240780 TSecr=394306052
835 1.300466620 172.31.31.144 -> 172.31.24.227 TCP 66 6633 → 50464 [ACK] Seq=943 Ack=624 Win=853 Len=0 TSval=1240780 TSecr=394306052
836 1.300469269 172.31.31.144 -> 172.31.24.227 TCP 66 6633 → 50464 [ACK] Seq=943 Ack=747 Win=853 Len=0 TSval=1240780 TSecr=394306052
837 1.796395694 172.31.31.144 -> 172.31.24.227 OpenFlow 122 Type: OFPT_MULTIPART_REQUEST, OFPMP_FLOW
838 1.796423523 172.31.31.144 -> 172.31.24.227 OpenFlow 90 Type: OFPT_MULTIPART_REQUEST, OFPMP_PORT_STATS
839 1.796428038 172.31.31.144 -> 172.31.24.227 OpenFlow 82 Type: OFPT_MULTIPART_REQUEST, OFPMP_TABLE
840 1.796696436 172.31.24.227 -> 172.31.31.144 OpenFlow 2010 Type: OFPT_MULTIPART_REPLY, OFPMP_FLOW
841 1.796820675 172.31.24.227 -> 172.31.31.144 OpenFlow 530 Type: OFPT_MULTIPART_REPLY, OFPMP_PORT_STATS
842 1.797012321 172.31.24.227 -> 172.31.31.144 OpenFlow 6178 Type: OFPT_MULTIPART_REPLY, OFPMP_TABLE
843 1.797024696 172.31.31.144 -> 172.31.24.227 TCP 66 6633 → 50430 [ACK] Seq=1207 Ack=2613 Win=853 Len=0 TSval=1240904 TSecr=394306176
844 1.797028241 172.31.31.144 -> 172.31.24.227 TCP 66 6633 → 50430 [ACK] Seq=1207 Ack=3077 Win=853 Len=0 TSval=1240904 TSecr=394306176
845 1.797273026 172.31.31.144 -> 172.31.24.227 TCP 66 6633 → 50430 [ACK] Seq=1207 Ack=9189 Win=853 Len=0 TSval=1240904 TSecr=394306176
846 1.845591921 172.31.31.144 -> 172.31.24.227 OpenFlow 122 Type: OFPT_MULTIPART_REQUEST, OFPMP_FLOW
847 1.845622956 172.31.31.144 -> 172.31.24.227 OpenFlow 106 Type: OFPT_MULTIPART_REQUEST, OFPMP_TABLE
848 1.845987027 172.31.24.227 -> 172.31.31.144 OpenFlow 2634 Type: OFPT_MULTIPART_REPLY, OFPMP_FLOW
849 1.846156173 172.31.24.227 -> 172.31.31.144 OpenFlow 642 Type: OFPT_MULTIPART_REPLY, OFPMP_PORT_STATS
850 1.846240049 172.31.31.144 -> 172.31.24.227 TCP 66 6633 → 50432 [ACK] Seq=1065 Ack=3307 Win=853 Len=0 TSval=1240916 TSecr=394306188
851 1.846329741 172.31.24.227 -> 172.31.31.144 OpenFlow 6178 Type: OFPT_MULTIPART_REPLY, OFPMP_TABLE
852 1.846347586 172.31.31.144 -> 172.31.24.227 TCP 66 6633 → 50432 [ACK] Seq=1065 Ack=3883 Win=853 Len=0 TSval=1240916 TSecr=394306189
853 1.846579084 172.31.31.144 -> 172.31.24.227 TCP 66 6633 → 50432 [ACK] Seq=1065 Ack=9995 Win=853 Len=0 TSval=1240917 TSecr=394306189
854 1.890751843 172.31.31.144 -> 172.31.24.227 OpenFlow 82 Type: OFPT_MULTIPART_REQUEST, OFPMP_TABLE
855 1.890770094 172.31.31.144 -> 172.31.24.227 OpenFlow 146 Type: OFPT_MULTIPART_REQUEST, OFPMP_FLOW
856 1.891083405 172.31.24.227 -> 172.31.31.144 OpenFlow 6178 Type: OFPT_MULTIPART_REPLY, OFPMP_TABLE
857 1.891225190 172.31.24.227 -> 172.31.31.144 OpenFlow 754 Type: OFPT_MULTIPART_REPLY, OFPMP_PORT_STATS
858 1.891304735 172.31.24.227 -> 172.31.31.144 OpenFlow 2634 Type: OFPT_MULTIPART_REPLY, OFPMP_FLOW
859 1.891423041 172.31.31.144 -> 172.31.24.227 TCP 66 6633 → 50434 [ACK] Seq=2459 Ack=8313 Win=853 Len=0 TSval=1240928 TSecr=394306200
860 1.930563270 172.31.31.144 -> 172.31.24.227 TCP 66 6633 → 50434 [ACK] Seq=2459 Ack=10881 Win=853 Len=0 TSval=1240938 TSecr=394306200
861 1.943904876 172.31.31.144 -> 172.31.24.227 OpenFlow 82 Type: OFPT_MULTIPART_REQUEST, OFPMP_TABLE
862 1.943923394 172.31.31.144 -> 172.31.24.227 OpenFlow 146 Type: OFPT_MULTIPART_REQUEST, OFPMP_PORT_STATS
863 1.944288269 172.31.24.227 -> 172.31.31.144 OpenFlow 6178 Type: OFPT_MULTIPART_REPLY, OFPMP_TABLE
864 1.944378010 172.31.24.227 -> 172.31.31.144 OpenFlow 2218 Type: OFPT_MULTIPART_REPLY, OFPMP_FLOW
865 1.944504503 172.31.24.227 -> 172.31.31.144 OpenFlow 642 Type: OFPT_MULTIPART_REPLY, OFPMP_PORT_STATS
866 1.944590046 172.31.31.144 -> 172.31.24.227 TCP 66 6633 → 50436 [ACK] Seq=1665 Ack=9187 Win=853 Len=0 TSval=1240941 TSecr=394306213
867 1.982510941 172.31.31.144 -> 172.31.24.227 TCP 66 6633 → 50436 [ACK] Seq=1665 Ack=9763 Win=853 Len=0 TSval=1240951 TSecr=394306213
868 1.991020475 172.31.31.144 -> 172.31.24.227 OpenFlow 122 Type: OFPT_MULTIPART_REQUEST, OFPMP_FLOW
869 1.991040574 172.31.31.144 -> 172.31.24.227 OpenFlow 106 Type: OFPT_MULTIPART_REQUEST, OFPMP_PORT_STATS
870 1.991407574 172.31.24.227 -> 172.31.31.144 OpenFlow 554 Type: OFPT_MULTIPART_REPLY, OFPMP_FLOW
871 1.991588647 172.31.24.227 -> 172.31.31.144 OpenFlow 6178 Type: OFPT_MULTIPART_REPLY, OFPMP_TABLE
872 1.991668249 172.31.31.144 -> 172.31.24.227 TCP 66 6633 → 50438 [ACK] Seq=823 Ack=1227 Win=853 Len=0 TSval=1240953 TSecr=394306225
873 1.991709768 172.31.24.227 -> 172.31.31.144 OpenFlow 530 Type: OFPT_MULTIPART_REPLY, OFPMP_PORT_STATS
874 1.991855486 172.31.31.144 -> 172.31.24.227 TCP 66 6633 → 50438 [ACK] Seq=823 Ack=7339 Win=853 Len=0 TSval=1240953 TSecr=394306225
875 1.991971008 172.31.31.144 -> 172.31.24.227 TCP 66 6633 → 50438 [ACK] Seq=823 Ack=7803 Win=853 Len=0 TSval=1240953 TSecr=394306225
876 2.022254115 172.31.31.144 -> 172.31.24.227 OpenFlow 82 Type: OFPT_MULTIPART_REQUEST, OFPMP_TABLE
877 2.022272663 172.31.31.144 -> 172.31.24.227 OpenFlow 146 Type: OFPT_MULTIPART_REQUEST, OFPMP_FLOW
878 2.022524172 172.31.24.227 -> 172.31.31.144 OpenFlow 6178 Type: OFPT_MULTIPART_REPLY, OFPMP_TABLE
879 2.022690640 172.31.24.227 -> 172.31.31.144 OpenFlow 754 Type: OFPT_MULTIPART_REPLY, OFPMP_PORT_STATS
880 2.022792925 172.31.24.227 -> 172.31.31.144 OpenFlow 3258 Type: OFPT_MULTIPART_REPLY, OFPMP_FLOW
881 2.022916391 172.31.31.144 -> 172.31.24.227 TCP 66 6633 → 50440 [ACK] Seq=1907 Ack=8215 Win=853 Len=0 TSval=1240961 TSecr=394306233
882 2.062486247 172.31.31.144 -> 172.31.24.227 TCP 66 6633 → 50440 [ACK] Seq=1907 Ack=11407 Win=853 Len=0 TSval=1240971 TSecr=394306233
883 2.064358153 172.31.31.144 -> 172.31.24.227 OpenFlow 122 Type: OFPT_MULTIPART_REQUEST, OFPMP_FLOW
884 2.064368681 172.31.31.144 -> 172.31.24.227 OpenFlow 106 Type: OFPT_MULTIPART_REQUEST, OFPMP_PORT_STATS
885 2.064635598 172.31.24.227 -> 172.31.31.144 OpenFlow 1386 Type: OFPT_MULTIPART_REPLY, OFPMP_FLOW
886 2.064807742 172.31.24.227 -> 172.31.31.144 OpenFlow 6178 Type: OFPT_MULTIPART_REPLY, OFPMP_TABLE
887 2.064904691 172.31.31.144 -> 172.31.24.227 TCP 66 6633 → 50442 [ACK] Seq=2243 Ack=3071 Win=853 Len=0 TSval=1240971 TSecr=394306243
888 2.064967766 172.31.24.227 -> 172.31.31.144 OpenFlow 754 Type: OFPT_MULTIPART_REPLY, OFPMP_PORT_STATS
889 2.065075608 172.31.31.144 -> 172.31.24.227 TCP 66 6633 → 50442 [ACK] Seq=2243 Ack=9183 Win=853 Len=0 TSval=1240971 TSecr=394306243
890 2.065185278 172.31.31.144 -> 172.31.24.227 TCP 66 6633 → 50442 [ACK] Seq=2243 Ack=9871 Win=853 Len=0 TSval=1240971 TSecr=394306243
891 2.103465764 172.31.31.144 -> 172.31.24.227 OpenFlow 82 Type: OFPT_MULTIPART_REQUEST, OFPMP_TABLE
892 2.103478596 172.31.31.144 -> 172.31.24.227 OpenFlow 146 Type: OFPT_MULTIPART_REQUEST, OFPMP_FLOW
893 2.103763483 172.31.24.227 -> 172.31.31.144 OpenFlow 6178 Type: OFPT_MULTIPART_REPLY, OFPMP_TABLE
894 2.103880703 172.31.24.227 -> 172.31.31.144 OpenFlow 530 Type: OFPT_MULTIPART_REPLY, OFPMP_PORT_STATS
895 2.103934900 172.31.24.227 -> 172.31.31.144 OpenFlow 1178 Type: OFPT_MULTIPART_REPLY, OFPMP_FLOW
896 2.104146801 172.31.31.144 -> 172.31.24.227 TCP 66 6633 → 50444 [ACK] Seq=1423 Ack=7035 Win=853 Len=0 TSval=1240981 TSecr=394306253
897 2.104154445 172.31.31.144 -> 172.31.24.227 TCP 66 6633 → 50444 [ACK] Seq=1423 Ack=7499 Win=853 Len=0 TSval=1240981 TSecr=394306253
898 2.104157167 172.31.31.144 -> 172.31.24.227 TCP 66 6633 → 50444 [ACK] Seq=1423 Ack=8611 Win=853 Len=0 TSval=1240981 TSecr=394306253
899 2.154686633 172.31.31.144 -> 172.31.24.227 OpenFlow 82 Type: OFPT_MULTIPART_REQUEST, OFPMP_TABLE
900 2.154698490 172.31.31.144 -> 172.31.24.227 OpenFlow 146 Type: OFPT_MULTIPART_REQUEST, OFPMP_FLOW
901 2.154955643 172.31.24.227 -> 172.31.31.144 OpenFlow 6178 Type: OFPT_MULTIPART_REPLY, OFPMP_TABLE
902 2.155099332 172.31.24.227 -> 172.31.31.144 OpenFlow 754 Type: OFPT_MULTIPART_REPLY, OFPMP_PORT_STATS
903 2.155152394 172.31.24.227 -> 172.31.31.144 OpenFlow 1386 Type: OFPT_MULTIPART_REPLY, OFPMP_FLOW
904 2.155242697 172.31.31.144 -> 172.31.24.227 TCP 66 6633 → 50446 [ACK] Seq=2363 Ack=8191 Win=853 Len=0 TSval=1240994 TSecr=394306266
905 2.155303455 172.31.31.144 -> 172.31.24.227 TCP 66 6633 → 50446 [ACK] Seq=2363 Ack=8879 Win=853 Len=0 TSval=1240994 TSecr=394306266
906 2.155363568 172.31.31.144 -> 172.31.24.227 TCP 66 6633 → 50446 [ACK] Seq=2363 Ack=10199 Win=853 Len=0 TSval=1240994 TSecr=394306266
907 2.206873450 172.31.31.144 -> 172.31.24.227 OpenFlow 82 Type: OFPT_MULTIPART_REQUEST, OFPMP_TABLE
908 2.206890165 172.31.31.144 -> 172.31.24.227 OpenFlow 146 Type: OFPT_MULTIPART_REQUEST, OFPMP_FLOW
909 2.207242617 172.31.24.227 -> 172.31.31.144 OpenFlow 6178 Type: OFPT_MULTIPART_REPLY, OFPMP_TABLE
910 2.207356236 172.31.24.227 -> 172.31.31.144 OpenFlow 642 Type: OFPT_MULTIPART_REPLY, OFPMP_PORT_STATS
911 2.207437146 172.31.24.227 -> 172.31.31.144 OpenFlow 1802 Type: OFPT_MULTIPART_REPLY, OFPMP_FLOW
912 2.207597368 172.31.31.144 -> 172.31.24.227 TCP 66 6633 → 50448 [ACK] Seq=1665 Ack=7281 Win=853 Len=0 TSval=1241007 TSecr=394306279
913 2.207605036 172.31.31.144 -> 172.31.24.227 TCP 66 6633 → 50448 [ACK] Seq=1665 Ack=7857 Win=853 Len=0 TSval=1241007 TSecr=394306279
914 2.207635488 172.31.31.144 -> 172.31.24.227 TCP 66 6633 → 50448 [ACK] Seq=1665 Ack=9593 Win=853 Len=0 TSval=1241007 TSecr=394306279
915 2.258990010 172.31.31.144 -> 172.31.24.227 OpenFlow 82 Type: OFPT_MULTIPART_REQUEST, OFPMP_TABLE
916 2.259001030 172.31.31.144 -> 172.31.24.227 OpenFlow 90 Type: OFPT_MULTIPART_REQUEST, OFPMP_PORT_STATS
917 2.259004687 172.31.31.144 -> 172.31.24.227 OpenFlow 122 Type: OFPT_MULTIPART_REQUEST, OFPMP_FLOW
918 2.259255634 172.31.24.227 -> 172.31.31.144 OpenFlow 6178 Type: OFPT_MULTIPART_REPLY, OFPMP_TABLE
919 2.259390491 172.31.24.227 -> 172.31.31.144 OpenFlow 754 Type: OFPT_MULTIPART_REPLY, OFPMP_PORT_STATS
920 2.259467036 172.31.24.227 -> 172.31.31.144 OpenFlow 2842 Type: OFPT_MULTIPART_REPLY, OFPMP_FLOW
921 2.259589270 172.31.31.144 -> 172.31.24.227 TCP 66 6633 → 50450 [ACK] Seq=1739 Ack=7359 Win=853 Len=0 TSval=1241020 TSecr=394306292
922 2.259596086 172.31.31.144 -> 172.31.24.227 TCP 66 6633 → 50450 [ACK] Seq=1739 Ack=8047 Win=853 Len=0 TSval=1241020 TSecr=394306292
923 2.259682981 172.31.31.144 -> 172.31.24.227 TCP 66 6633 → 50450 [ACK] Seq=1739 Ack=10823 Win=853 Len=0 TSval=1241020 TSecr=394306292
924 2.301138617 172.31.31.144 -> 172.31.24.227 OpenFlow 90 Type: OFPT_MULTIPART_REQUEST, OFPMP_PORT_STATS
925 2.301152647 172.31.31.144 -> 172.31.24.227 OpenFlow 82 Type: OFPT_MULTIPART_REQUEST, OFPMP_TABLE
926 2.301156433 172.31.31.144 -> 172.31.24.227 OpenFlow 122 Type: OFPT_MULTIPART_REQUEST, OFPMP_FLOW
927 2.301336374 172.31.24.227 -> 172.31.31.144 OpenFlow 642 Type: OFPT_MULTIPART_REPLY, OFPMP_PORT_STATS
928 2.301490042 172.31.24.227 -> 172.31.31.144 OpenFlow 6178 Type: OFPT_MULTIPART_REPLY, OFPMP_TABLE
929 2.301537009 172.31.24.227 -> 172.31.31.144 OpenFlow 554 Type: OFPT_MULTIPART_REPLY, OFPMP_FLOW
930 2.301804979 172.31.31.144 -> 172.31.24.227 TCP 66 6633 → 50452 [ACK] Seq=1879 Ack=8355 Win=853 Len=0 TSval=1241030 TSecr=394306302
