  1 0.000000000 172.31.31.144 -> 172.31.23.72 TCP 90 6633 → 45414 [PSH, ACK] Seq=1 Ack=1 Win=853 Len=24 TSval=804331 TSecr=19373879
  2 0.000032449 172.31.31.144 -> 172.31.23.72 TCP 106 6633 → 45414 [PSH, ACK] Seq=25 Ack=1 Win=853 Len=40 TSval=804331 TSecr=19373879
  3 0.000306256 172.31.23.72 -> 172.31.31.144 OpenFlow 82 Type: OFPT_MULTIPART_REPLY, OFPMP_GROUP
  4 0.000361791 172.31.23.72 -> 172.31.31.144 OpenFlow 98 Type: OFPT_MULTIPART_REPLY, OFPMP_METER
  5 0.001338029 172.31.31.144 -> 172.31.23.72 TCP 66 6633 → 45414 [ACK] Seq=65 Ack=17 Win=853 Len=0 TSval=804332 TSecr=19374457
  6 0.001365503 172.31.31.144 -> 172.31.23.72 TCP 66 6633 → 45414 [ACK] Seq=65 Ack=49 Win=853 Len=0 TSval=804332 TSecr=19374457
  7 0.098510316 172.31.31.144 -> 172.31.23.72 TCP 90 6633 → 45416 [PSH, ACK] Seq=1 Ack=1 Win=853 Len=24 TSval=804356 TSecr=19373891
  8 0.098536912 172.31.31.144 -> 172.31.23.72 TCP 90 6633 → 45418 [PSH, ACK] Seq=1 Ack=1 Win=853 Len=24 TSval=804356 TSecr=19373900
  9 0.098540177 172.31.31.144 -> 172.31.23.72 TCP 90 6633 → 45420 [PSH, ACK] Seq=1 Ack=1 Win=853 Len=24 TSval=804356 TSecr=19373916
 10 0.098543283 172.31.31.144 -> 172.31.23.72 TCP 106 6633 → 45418 [PSH, ACK] Seq=25 Ack=1 Win=853 Len=40 TSval=804356 TSecr=19373900
 11 0.098546362 172.31.31.144 -> 172.31.23.72 TCP 106 6633 → 45416 [PSH, ACK] Seq=25 Ack=1 Win=853 Len=40 TSval=804356 TSecr=19373891
 12 0.098548082 172.31.31.144 -> 172.31.23.72 TCP 106 6633 → 45420 [PSH, ACK] Seq=25 Ack=1 Win=853 Len=40 TSval=804356 TSecr=19373916
 13 0.098744090 172.31.23.72 -> 172.31.31.144 OpenFlow 82 Type: OFPT_MULTIPART_REPLY, OFPMP_GROUP
 14 0.098784273 172.31.23.72 -> 172.31.31.144 OpenFlow 82 Type: OFPT_MULTIPART_REPLY, OFPMP_GROUP
 15 0.098841614 172.31.23.72 -> 172.31.31.144 OpenFlow 82 Type: OFPT_MULTIPART_REPLY, OFPMP_GROUP
 16 0.098880592 172.31.23.72 -> 172.31.31.144 OpenFlow 98 Type: OFPT_MULTIPART_REPLY, OFPMP_METER
 17 0.098885896 172.31.23.72 -> 172.31.31.144 OpenFlow 98 Type: OFPT_MULTIPART_REPLY, OFPMP_METER
 18 0.098976348 172.31.23.72 -> 172.31.31.144 OpenFlow 98 Type: OFPT_MULTIPART_REPLY, OFPMP_METER
 19 0.100539282 172.31.31.144 -> 172.31.23.72 TCP 66 6633 → 45420 [ACK] Seq=65 Ack=17 Win=853 Len=0 TSval=804357 TSecr=19374481
 20 0.100547523 172.31.31.144 -> 172.31.23.72 TCP 66 6633 → 45418 [ACK] Seq=65 Ack=17 Win=853 Len=0 TSval=804357 TSecr=19374481
 21 0.100550519 172.31.31.144 -> 172.31.23.72 TCP 66 6633 → 45420 [ACK] Seq=65 Ack=49 Win=853 Len=0 TSval=804357 TSecr=19374481
 22 0.100552893 172.31.31.144 -> 172.31.23.72 TCP 66 6633 → 45416 [ACK] Seq=65 Ack=17 Win=853 Len=0 TSval=804357 TSecr=19374481
 23 0.100555065 172.31.31.144 -> 172.31.23.72 TCP 66 6633 → 45418 [ACK] Seq=65 Ack=49 Win=853 Len=0 TSval=804357 TSecr=19374481
 24 0.100714930 172.31.31.144 -> 172.31.23.72 TCP 66 6633 → 45416 [ACK] Seq=65 Ack=49 Win=853 Len=0 TSval=804357 TSecr=19374481
 25 0.198945051 172.31.31.144 -> 172.31.23.72 TCP 90 6633 → 45422 [PSH, ACK] Seq=1 Ack=1 Win=853 Len=24 TSval=804381 TSecr=19373917
 26 0.198974092 172.31.31.144 -> 172.31.23.72 TCP 106 6633 → 45422 [PSH, ACK] Seq=25 Ack=1 Win=853 Len=40 TSval=804381 TSecr=19373917
 27 0.198978448 172.31.31.144 -> 172.31.23.72 TCP 90 6633 → 45424 [PSH, ACK] Seq=1 Ack=1 Win=853 Len=24 TSval=804381 TSecr=19373926
 28 0.198981651 172.31.31.144 -> 172.31.23.72 TCP 106 6633 → 45424 [PSH, ACK] Seq=25 Ack=1 Win=853 Len=40 TSval=804382 TSecr=19373926
 29 0.199187416 172.31.23.72 -> 172.31.31.144 OpenFlow 82 Type: OFPT_MULTIPART_REPLY, OFPMP_GROUP
 30 0.199325960 172.31.23.72 -> 172.31.31.144 OpenFlow 82 Type: OFPT_MULTIPART_REPLY, OFPMP_GROUP
 31 0.199578884 172.31.23.72 -> 172.31.31.144 OpenFlow 98 Type: OFPT_MULTIPART_REPLY, OFPMP_METER
 32 0.199585221 172.31.23.72 -> 172.31.31.144 OpenFlow 98 Type: OFPT_MULTIPART_REPLY, OFPMP_METER
 33 0.199941680 172.31.31.144 -> 172.31.23.72 TCP 66 6633 → 45424 [ACK] Seq=65 Ack=17 Win=853 Len=0 TSval=804382 TSecr=19374506
 34 0.199949388 172.31.31.144 -> 172.31.23.72 TCP 66 6633 → 45422 [ACK] Seq=65 Ack=17 Win=853 Len=0 TSval=804382 TSecr=19374506
 35 0.200140983 172.31.31.144 -> 172.31.23.72 TCP 66 6633 → 45424 [ACK] Seq=65 Ack=49 Win=853 Len=0 TSval=804382 TSecr=19374507
 36 0.200166392 172.31.31.144 -> 172.31.23.72 TCP 66 6633 → 45422 [ACK] Seq=65 Ack=49 Win=853 Len=0 TSval=804382 TSecr=19374507
 37 0.285694779 172.31.23.72 -> 172.31.31.144 OpenFlow 146 Type: OFPT_PORT_STATUS
 38 0.285769103 172.31.23.72 -> 172.31.31.144 OpenFlow 146 Type: OFPT_PORT_STATUS
 39 0.287339194 172.31.31.144 -> 172.31.23.72 TCP 66 6633 → 45436 [ACK] Seq=1 Ack=81 Win=853 Len=0 TSval=804404 TSecr=19374528
 40 0.287353904 172.31.31.144 -> 172.31.23.72 TCP 66 6633 → 45438 [ACK] Seq=1 Ack=81 Win=853 Len=0 TSval=804404 TSecr=19374528
 41 0.297523423 172.31.31.144 -> 172.31.23.72 TCP 90 6633 → 45426 [PSH, ACK] Seq=1 Ack=1 Win=853 Len=24 TSval=804406 TSecr=19373946
 42 0.297535304 172.31.31.144 -> 172.31.23.72 TCP 106 6633 → 45426 [PSH, ACK] Seq=25 Ack=1 Win=853 Len=40 TSval=804406 TSecr=19373946
 43 0.297701832 172.31.23.72 -> 172.31.31.144 OpenFlow 82 Type: OFPT_MULTIPART_REPLY, OFPMP_GROUP
 44 0.297730196 172.31.23.72 -> 172.31.31.144 OpenFlow 98 Type: OFPT_MULTIPART_REPLY, OFPMP_METER
 45 0.297998482 172.31.31.144 -> 172.31.23.72 TCP 66 6633 → 45426 [ACK] Seq=65 Ack=49 Win=853 Len=0 TSval=804406 TSecr=19374531
 46 0.422555013 172.31.31.144 -> 172.31.23.72 TCP 90 6633 → 45428 [PSH, ACK] Seq=1 Ack=1 Win=853 Len=24 TSval=804437 TSecr=19373958
 47 0.422580640 172.31.31.144 -> 172.31.23.72 TCP 90 6633 → 45430 [PSH, ACK] Seq=1 Ack=1 Win=853 Len=24 TSval=804437 TSecr=19373970
 48 0.422584659 172.31.31.144 -> 172.31.23.72 TCP 90 6633 → 45432 [PSH, ACK] Seq=1 Ack=1 Win=853 Len=24 TSval=804437 TSecr=19373979
 49 0.422587787 172.31.31.144 -> 172.31.23.72 TCP 106 6633 → 45430 [PSH, ACK] Seq=25 Ack=1 Win=853 Len=40 TSval=804437 TSecr=19373970
 50 0.422592476 172.31.31.144 -> 172.31.23.72 TCP 106 6633 → 45428 [PSH, ACK] Seq=25 Ack=1 Win=853 Len=40 TSval=804437 TSecr=19373958
 51 0.422594267 172.31.31.144 -> 172.31.23.72 TCP 106 6633 → 45432 [PSH, ACK] Seq=25 Ack=1 Win=853 Len=40 TSval=804437 TSecr=19373979
 52 0.422596251 172.31.31.144 -> 172.31.23.72 TCP 187 6633 → 45452 [PSH, ACK] Seq=1 Ack=1 Win=853 Len=121 TSval=804437 TSecr=19374100
 53 0.422599947 172.31.31.144 -> 172.31.23.72 TCP 187 6633 → 45452 [PSH, ACK] Seq=122 Ack=1 Win=853 Len=121 TSval=804437 TSecr=19374100
 54 0.422601806 172.31.31.144 -> 172.31.23.72 TCP 187 6633 → 45452 [PSH, ACK] Seq=243 Ack=1 Win=853 Len=121 TSval=804437 TSecr=19374100
 55 0.422603864 172.31.31.144 -> 172.31.23.72 TCP 187 6633 → 45452 [PSH, ACK] Seq=364 Ack=1 Win=853 Len=121 TSval=804437 TSecr=19374100
 56 0.422605586 172.31.31.144 -> 172.31.23.72 TCP 187 6633 → 45452 [PSH, ACK] Seq=485 Ack=1 Win=853 Len=121 TSval=804437 TSecr=19374100
 57 0.422606976 172.31.31.144 -> 172.31.23.72 TCP 187 6633 → 45452 [PSH, ACK] Seq=606 Ack=1 Win=853 Len=121 TSval=804437 TSecr=19374100
 58 0.422608599 172.31.31.144 -> 172.31.23.72 TCP 187 6633 → 45452 [PSH, ACK] Seq=727 Ack=1 Win=853 Len=121 TSval=804437 TSecr=19374100
 59 0.422610258 172.31.31.144 -> 172.31.23.72 TCP 187 6633 → 45452 [PSH, ACK] Seq=848 Ack=1 Win=853 Len=121 TSval=804437 TSecr=19374100
 60 0.422611463 172.31.31.144 -> 172.31.23.72 TCP 187 6633 → 45462 [PSH, ACK] Seq=1 Ack=1 Win=853 Len=121 TSval=804437 TSecr=19374251
 61 0.422614641 172.31.31.144 -> 172.31.23.72 TCP 187 6633 → 45462 [PSH, ACK] Seq=122 Ack=1 Win=853 Len=121 TSval=804437 TSecr=19374251
 62 0.422616154 172.31.31.144 -> 172.31.23.72 TCP 187 6633 → 45462 [PSH, ACK] Seq=243 Ack=1 Win=853 Len=121 TSval=804437 TSecr=19374251
 63 0.422617439 172.31.31.144 -> 172.31.23.72 TCP 187 6633 → 45462 [PSH, ACK] Seq=364 Ack=1 Win=853 Len=121 TSval=804437 TSecr=19374251
 64 0.422618682 172.31.31.144 -> 172.31.23.72 TCP 187 6633 → 45462 [PSH, ACK] Seq=485 Ack=1 Win=853 Len=121 TSval=804437 TSecr=19374251
 65 0.422620308 172.31.31.144 -> 172.31.23.72 TCP 187 6633 → 45462 [PSH, ACK] Seq=606 Ack=1 Win=853 Len=121 TSval=804437 TSecr=19374251
 66 0.422622125 172.31.31.144 -> 172.31.23.72 OpenFlow 187 Type: OFPT_PACKET_OUT
 67 0.422625540 172.31.31.144 -> 172.31.23.72 OpenFlow 187 Type: OFPT_PACKET_OUT
 68 0.422631332 172.31.31.144 -> 172.31.23.72 OpenFlow 187 Type: OFPT_PACKET_OUT
 69 0.422632700 172.31.31.144 -> 172.31.23.72 OpenFlow 187 Type: OFPT_PACKET_OUT
 70 0.422634493 172.31.31.144 -> 172.31.23.72 OpenFlow 187 Type: OFPT_PACKET_OUT
 71 0.422636109 172.31.31.144 -> 172.31.23.72 OpenFlow 187 Type: OFPT_PACKET_OUT
 72 0.423090138 172.31.23.72 -> 172.31.31.144 TCP 66 45452 → 6633 [ACK] Seq=1 Ack=969 Win=213 Len=0 TSval=19374562 TSecr=804437
 73 0.423377021 172.31.23.72 -> 172.31.31.144 TCP 66 45462 → 6633 [ACK] Seq=1 Ack=727 Win=213 Len=0 TSval=19374562 TSecr=804437
 74 0.423651913 172.31.23.72 -> 172.31.31.144 TCP 66 45436 → 6633 [ACK] Seq=81 Ack=727 Win=213 Len=0 TSval=19374563 TSecr=804437
 75 0.423727152 172.31.23.72 -> 172.31.31.144 OpenFlow 189 Type: OFPT_PACKET_IN
 76 0.423766502 172.31.23.72 -> 172.31.31.144 OpenFlow 189 Type: OFPT_PACKET_IN
 77 0.423783615 172.31.23.72 -> 172.31.31.144 OpenFlow 189 Type: OFPT_PACKET_IN
 78 0.423801940 172.31.23.72 -> 172.31.31.144 OpenFlow 189 Type: OFPT_PACKET_IN
 79 0.423818939 172.31.23.72 -> 172.31.31.144 OpenFlow 189 Type: OFPT_PACKET_IN
 80 0.423853600 172.31.23.72 -> 172.31.31.144 OpenFlow 82 Type: OFPT_MULTIPART_REPLY, OFPMP_GROUP
 81 0.423886711 172.31.23.72 -> 172.31.31.144 OpenFlow 189 Type: OFPT_PACKET_IN
 82 0.423946038 172.31.23.72 -> 172.31.31.144 OpenFlow 189 Type: OFPT_PACKET_IN
 83 0.423963598 172.31.23.72 -> 172.31.31.144 OpenFlow 189 Type: OFPT_PACKET_IN
 84 0.423981009 172.31.23.72 -> 172.31.31.144 OpenFlow 189 Type: OFPT_PACKET_IN
 85 0.426518903 172.31.23.72 -> 172.31.31.144 OpenFlow 189 Type: OFPT_PACKET_IN
 86 0.426526121 172.31.23.72 -> 172.31.31.144 OpenFlow 189 Type: OFPT_PACKET_IN
 87 0.426527920 172.31.23.72 -> 172.31.31.144 OpenFlow 189 Type: OFPT_PACKET_IN
 88 0.426529739 172.31.23.72 -> 172.31.31.144 OpenFlow 189 Type: OFPT_PACKET_IN
 89 0.426531740 172.31.23.72 -> 172.31.31.144 OpenFlow 237 Type: OFPT_MULTIPART_REPLY, OFPMP_METER
 90 0.426862668 172.31.23.72 -> 172.31.31.144 OpenFlow 98 Type: OFPT_MULTIPART_REPLY, OFPMP_METER
 91 0.426867683 172.31.23.72 -> 172.31.31.144 OpenFlow 237 Type: OFPT_MULTIPART_REPLY, OFPMP_METER
 92 0.426869561 172.31.23.72 -> 172.31.31.144 OpenFlow 189 Type: OFPT_PACKET_IN
 93 0.426871441 172.31.23.72 -> 172.31.31.144 OpenFlow 189 Type: OFPT_PACKET_IN
 94 0.426873047 172.31.23.72 -> 172.31.31.144 OpenFlow 189 Type: OFPT_PACKET_IN
 95 0.427325536 172.31.31.144 -> 172.31.23.72 TCP 66 6633 → 45444 [ACK] Seq=1 Ack=124 Win=853 Len=0 TSval=804439 TSecr=19374563
 96 0.427333532 172.31.31.144 -> 172.31.23.72 TCP 66 6633 → 45438 [ACK] Seq=1 Ack=204 Win=853 Len=0 TSval=804439 TSecr=19374563
 97 0.427335772 172.31.31.144 -> 172.31.23.72 TCP 66 6633 → 45430 [ACK] Seq=65 Ack=124 Win=853 Len=0 TSval=804439 TSecr=19374563
 98 0.429144815 172.31.31.144 -> 172.31.23.72 TCP 66 6633 → 45428 [ACK] Seq=65 Ack=17 Win=853 Len=0 TSval=804439 TSecr=19374563
 99 0.429151232 172.31.31.144 -> 172.31.23.72 TCP 66 6633 → 45432 [ACK] Seq=65 Ack=124 Win=853 Len=0 TSval=804439 TSecr=19374563
100 0.429153430 172.31.31.144 -> 172.31.23.72 TCP 66 6633 → 45454 [ACK] Seq=1 Ack=124 Win=853 Len=0 TSval=804439 TSecr=19374563
101 0.429156227 172.31.31.144 -> 172.31.23.72 TCP 66 6633 → 45442 [ACK] Seq=1 Ack=124 Win=853 Len=0 TSval=804439 TSecr=19374563
102 0.429158325 172.31.31.144 -> 172.31.23.72 TCP 66 6633 → 45444 [ACK] Seq=1 Ack=247 Win=853 Len=0 TSval=804439 TSecr=19374563
103 0.429161038 172.31.31.144 -> 172.31.23.72 TCP 66 6633 → 45438 [ACK] Seq=1 Ack=327 Win=853 Len=0 TSval=804439 TSecr=19374563
104 0.429163036 172.31.31.144 -> 172.31.23.72 TCP 66 6633 → 45430 [ACK] Seq=65 Ack=295 Win=853 Len=0 TSval=804439 TSecr=19374563
105 0.435516214 172.31.23.72 -> 172.31.31.144 TCP 189 [TCP Retransmission] 45450 → 6633 [PSH, ACK] Seq=124 Ack=1 Win=213 Len=123 TSval=19374566 TSecr=803960
106 0.437547361 172.31.31.144 -> 172.31.23.72 TCP 66 6633 → 45428 [ACK] Seq=65 Ack=49 Win=853 Len=0 TSval=804439 TSecr=19374563
107 0.437555867 172.31.31.144 -> 172.31.23.72 TCP 66 6633 → 45432 [ACK] Seq=65 Ack=295 Win=853 Len=0 TSval=804439 TSecr=19374563
108 0.437559559 172.31.31.144 -> 172.31.23.72 TCP 66 6633 → 45454 [ACK] Seq=1 Ack=247 Win=853 Len=0 TSval=804439 TSecr=19374563
109 0.437563161 172.31.31.144 -> 172.31.23.72 TCP 66 6633 → 45442 [ACK] Seq=1 Ack=247 Win=853 Len=0 TSval=804439 TSecr=19374563
110 0.437566536 172.31.31.144 -> 172.31.23.72 TCP 66 6633 → 45434 [ACK] Seq=1 Ack=247 Win=853 Len=0 TSval=804439 TSecr=19374563
111 0.437571952 172.31.31.144 -> 172.31.23.72 TCP 66 6633 → 45450 [ACK] Seq=1 Ack=247 Win=853 Len=0 TSval=804439 TSecr=19374563
112 0.437576525 172.31.31.144 -> 172.31.23.72 TCP 66 6633 → 45448 [ACK] Seq=1 Ack=247 Win=853 Len=0 TSval=804439 TSecr=19374563
113 0.440606635 172.31.31.144 -> 172.31.23.72 TCP 78 [TCP Dup ACK 111#1] 6633 → 45450 [ACK] Seq=1 Ack=247 Win=853 Len=0 TSval=804441 TSecr=19374566 SLE=124 SRE=247
114 0.472974293 172.31.31.144 -> 172.31.23.72 TCP 146 6633 → 45458 [PSH, ACK] Seq=1 Ack=1 Win=853 Len=80 TSval=804450 TSecr=19374144
115 0.472994591 172.31.31.144 -> 172.31.23.72 OpenFlow 146 Type: OFPT_FLOW_MOD
116 0.473010949 172.31.31.144 -> 172.31.23.72 OpenFlow 146 Type: OFPT_FLOW_MOD
117 0.473014653 172.31.31.144 -> 172.31.23.72 TCP 146 6633 → 45446 [PSH, ACK] Seq=1 Ack=1 Win=853 Len=80 TSval=804450 TSecr=19374058
118 0.473030108 172.31.31.144 -> 172.31.23.72 OpenFlow 146 Type: OFPT_FLOW_MOD
119 0.473057215 172.31.31.144 -> 172.31.23.72 OpenFlow 154 Type: OFPT_BARRIER_REQUEST
120 0.473076373 172.31.31.144 -> 172.31.23.72 TCP 146 6633 → 45458 [PSH, ACK] Seq=81 Ack=1 Win=853 Len=80 TSval=804450 TSecr=19374144
121 0.473094849 172.31.31.144 -> 172.31.23.72 TCP 154 6633 → 45446 [PSH, ACK] Seq=81 Ack=1 Win=853 Len=88 TSval=804450 TSecr=19374058
122 0.473113672 172.31.31.144 -> 172.31.23.72 OpenFlow 154 Type: OFPT_BARRIER_REQUEST
123 0.473147374 172.31.31.144 -> 172.31.23.72 TCP 146 6633 → 45460 [PSH, ACK] Seq=1 Ack=1 Win=853 Len=80 TSval=804450 TSecr=19374151
124 0.473150601 172.31.31.144 -> 172.31.23.72 TCP 74 6633 → 45458 [PSH, ACK] Seq=161 Ack=1 Win=853 Len=8 TSval=804450 TSecr=19374144
125 0.473167910 172.31.31.144 -> 172.31.23.72 OpenFlow 146 Type: OFPT_FLOW_MOD
126 0.473194293 172.31.31.144 -> 172.31.23.72 TCP 234 6633 → 45460 [PSH, ACK] Seq=81 Ack=1 Win=853 Len=168 TSval=804450 TSecr=19374151
127 0.473217105 172.31.31.144 -> 172.31.23.72 OpenFlow 154 Type: OFPT_BARRIER_REQUEST
128 0.473236883 172.31.31.144 -> 172.31.23.72 TCP 146 6633 → 45446 [PSH, ACK] Seq=169 Ack=1 Win=853 Len=80 TSval=804450 TSecr=19374058
129 0.473255435 172.31.31.144 -> 172.31.23.72 OpenFlow 146 Type: OFPT_FLOW_MOD
130 0.473276017 172.31.31.144 -> 172.31.23.72 OpenFlow 146 Type: OFPT_FLOW_MOD
131 0.473299884 172.31.31.144 -> 172.31.23.72 TCP 154 6633 → 45446 [PSH, ACK] Seq=249 Ack=1 Win=853 Len=88 TSval=804450 TSecr=19374058
132 0.473318836 172.31.31.144 -> 172.31.23.72 OpenFlow 146 Type: OFPT_FLOW_MOD
133 0.473338391 172.31.31.144 -> 172.31.23.72 OpenFlow 154 Type: OFPT_BARRIER_REQUEST
134 0.473356907 172.31.31.144 -> 172.31.23.72 OpenFlow 146 Type: OFPT_FLOW_MOD
135 0.473363904 172.31.23.72 -> 172.31.31.144 TCP 66 45418 → 6633 [ACK] Seq=49 Ack=233 Win=213 Len=0 TSval=19374575 TSecr=804450
136 0.473375747 172.31.31.144 -> 172.31.23.72 TCP 146 6633 → 45460 [PSH, ACK] Seq=249 Ack=1 Win=853 Len=80 TSval=804450 TSecr=19374151
137 0.473384202 172.31.23.72 -> 172.31.31.144 OpenFlow 74 Type: OFPT_BARRIER_REPLY
138 0.473419767 172.31.23.72 -> 172.31.31.144 TCP 66 45438 → 6633 [ACK] Seq=327 Ack=169 Win=213 Len=0 TSval=19374575 TSecr=804450
139 0.473429928 172.31.31.144 -> 172.31.23.72 OpenFlow 146 Type: OFPT_FLOW_MOD
140 0.473432573 172.31.31.144 -> 172.31.23.72 OpenFlow 146 Type: OFPT_FLOW_MOD
141 0.473440532 172.31.23.72 -> 172.31.31.144 OpenFlow 74 Type: OFPT_BARRIER_REPLY
142 0.473451576 172.31.31.144 -> 172.31.23.72 OpenFlow 154 Type: OFPT_BARRIER_REQUEST
143 0.473454227 172.31.31.144 -> 172.31.23.72 OpenFlow 146 Type: OFPT_FLOW_MOD
144 0.473488578 172.31.23.72 -> 172.31.31.144 OpenFlow 74 Type: OFPT_BARRIER_REPLY
145 0.473511814 172.31.31.144 -> 172.31.23.72 OpenFlow 242 Type: OFPT_BARRIER_REQUEST
146 0.473514626 172.31.31.144 -> 172.31.23.72 OpenFlow 154 Type: OFPT_BARRIER_REQUEST
147 0.473515972 172.31.31.144 -> 172.31.23.72 OpenFlow 322 Type: OFPT_BARRIER_REQUEST
148 0.473531147 172.31.31.144 -> 172.31.23.72 OpenFlow 146 Type: OFPT_FLOW_MOD
149 0.473537288 172.31.23.72 -> 172.31.31.144 OpenFlow 74 Type: OFPT_BARRIER_REPLY
150 0.473545502 172.31.31.144 -> 172.31.23.72 TCP 146 6633 → 45446 [PSH, ACK] Seq=337 Ack=1 Win=853 Len=80 TSval=804450 TSecr=19374058
151 0.473558919 172.31.23.72 -> 172.31.31.144 OpenFlow 74 Type: OFPT_BARRIER_REPLY
152 0.473582324 172.31.31.144 -> 172.31.23.72 OpenFlow 146 Type: OFPT_FLOW_MOD
153 0.473585535 172.31.31.144 -> 172.31.23.72 OpenFlow 146 Type: OFPT_FLOW_MOD
154 0.473599235 172.31.23.72 -> 172.31.31.144 TCP 66 45416 → 6633 [ACK] Seq=49 Ack=233 Win=213 Len=0 TSval=19374575 TSecr=804450
155 0.473606935 172.31.31.144 -> 172.31.23.72 OpenFlow 154 Type: OFPT_BARRIER_REQUEST
156 0.473613875 172.31.23.72 -> 172.31.31.144 OpenFlow 74 Type: OFPT_BARRIER_REPLY
157 0.473618285 172.31.31.144 -> 172.31.23.72 TCP 74 6633 → 45460 [PSH, ACK] Seq=329 Ack=1 Win=853 Len=8 TSval=804450 TSecr=19374151
158 0.473678705 172.31.31.144 -> 172.31.23.72 OpenFlow 146 Type: OFPT_FLOW_MOD
159 0.473683422 172.31.31.144 -> 172.31.23.72 OpenFlow 154 Type: OFPT_BARRIER_REQUEST
160 0.473685561 172.31.31.144 -> 172.31.23.72 OpenFlow 74 Type: OFPT_BARRIER_REQUEST
161 0.473694547 172.31.31.144 -> 172.31.23.72 TCP 146 6633 → 45458 [PSH, ACK] Seq=169 Ack=1 Win=853 Len=80 TSval=804450 TSecr=19374144
162 0.473714055 172.31.31.144 -> 172.31.23.72 OpenFlow 146 Type: OFPT_FLOW_MOD
163 0.473725509 172.31.23.72 -> 172.31.31.144 OpenFlow 74 Type: OFPT_BARRIER_REPLY
164 0.473733715 172.31.31.144 -> 172.31.23.72 OpenFlow 154 Type: OFPT_BARRIER_REQUEST
165 0.473748321 172.31.31.144 -> 172.31.23.72 OpenFlow 146 Type: OFPT_FLOW_MOD
166 0.473761218 172.31.23.72 -> 172.31.31.144 OpenFlow 74 Type: OFPT_BARRIER_REPLY
167 0.473772338 172.31.31.144 -> 172.31.23.72 TCP 154 6633 → 45458 [PSH, ACK] Seq=249 Ack=1 Win=853 Len=88 TSval=804450 TSecr=19374144
168 0.473785829 172.31.23.72 -> 172.31.31.144 OpenFlow 74 Type: OFPT_BARRIER_REPLY
169 0.473793946 172.31.31.144 -> 172.31.23.72 OpenFlow 74 Type: OFPT_BARRIER_REQUEST
170 0.473796221 172.31.31.144 -> 172.31.23.72 OpenFlow 242 Type: OFPT_BARRIER_REQUEST
171 0.473827496 172.31.31.144 -> 172.31.23.72 TCP 66 6633 → 45418 [ACK] Seq=401 Ack=57 Win=853 Len=0 TSval=804450 TSecr=19374575
172 0.473831510 172.31.31.144 -> 172.31.23.72 TCP 66 6633 → 45430 [ACK] Seq=569 Ack=303 Win=853 Len=0 TSval=804450 TSecr=19374575
173 0.473844919 172.31.23.72 -> 172.31.31.144 OpenFlow 74 Type: OFPT_BARRIER_REPLY
174 0.473852795 172.31.31.144 -> 172.31.23.72 TCP 66 6633 → 45438 [ACK] Seq=505 Ack=335 Win=853 Len=0 TSval=804450 TSecr=19374575
175 0.473867455 172.31.31.144 -> 172.31.23.72 TCP 66 6633 → 45430 [ACK] Seq=569 Ack=311 Win=853 Len=0 TSval=804450 TSecr=19374575
176 0.473873587 172.31.23.72 -> 172.31.31.144 OpenFlow 74 Type: OFPT_BARRIER_REPLY
177 0.473890750 172.31.31.144 -> 172.31.23.72 TCP 66 6633 → 45430 [ACK] Seq=569 Ack=319 Win=853 Len=0 TSval=804450 TSecr=19374575
178 0.473908141 172.31.23.72 -> 172.31.31.144 OpenFlow 74 Type: OFPT_BARRIER_REPLY
179 0.473915831 172.31.31.144 -> 172.31.23.72 TCP 66 6633 → 45416 [ACK] Seq=233 Ack=57 Win=853 Len=0 TSval=804450 TSecr=19374575
180 0.473918450 172.31.31.144 -> 172.31.23.72 TCP 66 6633 → 45446 [ACK] Seq=505 Ack=9 Win=853 Len=0 TSval=804450 TSecr=19374575
181 0.473936234 172.31.23.72 -> 172.31.31.144 OpenFlow 74 Type: OFPT_BARRIER_REPLY
182 0.473953200 172.31.31.144 -> 172.31.23.72 TCP 66 6633 → 45446 [ACK] Seq=505 Ack=17 Win=853 Len=0 TSval=804450 TSecr=19374575
183 0.473956413 172.31.31.144 -> 172.31.23.72 TCP 66 6633 → 45446 [ACK] Seq=505 Ack=25 Win=853 Len=0 TSval=804450 TSecr=19374575
184 0.473986810 172.31.23.72 -> 172.31.31.144 TCP 66 45448 → 6633 [ACK] Seq=247 Ack=169 Win=213 Len=0 TSval=19374575 TSecr=804450
185 0.473994110 172.31.23.72 -> 172.31.31.144 OpenFlow 74 Type: OFPT_BARRIER_REPLY
186 0.474003413 172.31.31.144 -> 172.31.23.72 TCP 66 6633 → 45460 [ACK] Seq=337 Ack=9 Win=853 Len=0 TSval=804450 TSecr=19374575
187 0.474031672 172.31.23.72 -> 172.31.31.144 OpenFlow 74 Type: OFPT_BARRIER_REPLY
188 0.474047935 172.31.31.144 -> 172.31.23.72 TCP 66 6633 → 45460 [ACK] Seq=337 Ack=17 Win=853 Len=0 TSval=804450 TSecr=19374575
189 0.474056404 172.31.23.72 -> 172.31.31.144 OpenFlow 74 Type: OFPT_BARRIER_REPLY
190 0.474081941 172.31.31.144 -> 172.31.23.72 TCP 66 6633 → 45458 [ACK] Seq=337 Ack=9 Win=853 Len=0 TSval=804450 TSecr=19374575
191 0.474104936 172.31.31.144 -> 172.31.23.72 TCP 66 6633 → 45458 [ACK] Seq=337 Ack=17 Win=853 Len=0 TSval=804450 TSecr=19374575
192 0.474206298 172.31.31.144 -> 172.31.23.72 TCP 66 6633 → 45426 [ACK] Seq=401 Ack=65 Win=853 Len=0 TSval=804450 TSecr=19374575
193 0.474240056 172.31.23.72 -> 172.31.31.144 OpenFlow 146 Type: OFPT_FLOW_REMOVED
194 0.474251855 172.31.23.72 -> 172.31.31.144 OpenFlow 146 Type: OFPT_FLOW_REMOVED
195 0.474256406 172.31.23.72 -> 172.31.31.144 OpenFlow 146 Type: OFPT_FLOW_REMOVED
196 0.474266919 172.31.23.72 -> 172.31.31.144 OpenFlow 146 Type: OFPT_FLOW_REMOVED
197 0.474275551 172.31.23.72 -> 172.31.31.144 OpenFlow 146 Type: OFPT_FLOW_REMOVED
198 0.474290107 172.31.23.72 -> 172.31.31.144 OpenFlow 146 Type: OFPT_FLOW_REMOVED
199 0.474297311 172.31.23.72 -> 172.31.31.144 OpenFlow 146 Type: OFPT_FLOW_REMOVED
200 0.474313135 172.31.23.72 -> 172.31.31.144 OpenFlow 146 Type: OFPT_FLOW_REMOVED
201 0.474318266 172.31.23.72 -> 172.31.31.144 OpenFlow 146 Type: OFPT_FLOW_REMOVED
202 0.474329576 172.31.23.72 -> 172.31.31.144 OpenFlow 146 Type: OFPT_FLOW_REMOVED
203 0.474331460 172.31.23.72 -> 172.31.31.144 OpenFlow 226 Type: OFPT_FLOW_REMOVED
204 0.474342022 172.31.23.72 -> 172.31.31.144 OpenFlow 146 Type: OFPT_FLOW_REMOVED
205 0.474349641 172.31.23.72 -> 172.31.31.144 OpenFlow 146 Type: OFPT_FLOW_REMOVED
206 0.474351409 172.31.23.72 -> 172.31.31.144 OpenFlow 466 Type: OFPT_FLOW_REMOVED
207 0.474470900 172.31.23.72 -> 172.31.31.144 OpenFlow 146 Type: OFPT_FLOW_REMOVED
208 0.474476210 172.31.23.72 -> 172.31.31.144 OpenFlow 466 Type: OFPT_FLOW_REMOVED
209 0.474477821 172.31.23.72 -> 172.31.31.144 OpenFlow 306 Type: OFPT_FLOW_REMOVED
210 0.474479608 172.31.23.72 -> 172.31.31.144 OpenFlow 306 Type: OFPT_FLOW_REMOVED
211 0.474615891 172.31.31.144 -> 172.31.23.72 TCP 66 6633 → 45424 [ACK] Seq=233 Ack=129 Win=853 Len=0 TSval=804451 TSecr=19374575
212 0.474620661 172.31.31.144 -> 172.31.23.72 TCP 66 6633 → 45436 [ACK] Seq=1231 Ack=161 Win=853 Len=0 TSval=804451 TSecr=19374575
213 0.474622615 172.31.31.144 -> 172.31.23.72 TCP 66 6633 → 45418 [ACK] Seq=401 Ack=137 Win=853 Len=0 TSval=804451 TSecr=19374575
214 0.474624588 172.31.31.144 -> 172.31.23.72 TCP 66 6633 → 45416 [ACK] Seq=233 Ack=137 Win=853 Len=0 TSval=804451 TSecr=19374575
215 0.474626493 172.31.31.144 -> 172.31.23.72 TCP 66 6633 → 45446 [ACK] Seq=505 Ack=105 Win=853 Len=0 TSval=804451 TSecr=19374575
216 0.474628354 172.31.31.144 -> 172.31.23.72 TCP 66 6633 → 45438 [ACK] Seq=505 Ack=415 Win=853 Len=0 TSval=804451 TSecr=19374575
217 0.474630206 172.31.31.144 -> 172.31.23.72 TCP 66 6633 → 45430 [ACK] Seq=569 Ack=399 Win=853 Len=0 TSval=804451 TSecr=19374575
218 0.474631797 172.31.31.144 -> 172.31.23.72 TCP 66 6633 → 45460 [ACK] Seq=337 Ack=97 Win=853 Len=0 TSval=804451 TSecr=19374575
219 0.474633700 172.31.31.144 -> 172.31.23.72 TCP 66 6633 → 45418 [ACK] Seq=401 Ack=217 Win=853 Len=0 TSval=804451 TSecr=19374575
220 0.474640720 172.31.23.72 -> 172.31.31.144 OpenFlow 146 Type: OFPT_FLOW_REMOVED
221 0.474646171 172.31.23.72 -> 172.31.31.144 OpenFlow 306 Type: OFPT_FLOW_REMOVED
222 0.474697762 172.31.31.144 -> 172.31.23.72 TCP 66 6633 → 45458 [ACK] Seq=337 Ack=97 Win=853 Len=0 TSval=804451 TSecr=19374575
223 0.474700847 172.31.31.144 -> 172.31.23.72 TCP 66 6633 → 45438 [ACK] Seq=505 Ack=575 Win=853 Len=0 TSval=804451 TSecr=19374575
224 0.474702684 172.31.31.144 -> 172.31.23.72 TCP 66 6633 → 45448 [ACK] Seq=169 Ack=335 Win=853 Len=0 TSval=804451 TSecr=19374575
225 0.474742375 172.31.31.144 -> 172.31.23.72 TCP 66 6633 → 45430 [ACK] Seq=569 Ack=799 Win=853 Len=0 TSval=804451 TSecr=19374575
226 0.474745156 172.31.31.144 -> 172.31.23.72 TCP 66 6633 → 45416 [ACK] Seq=233 Ack=217 Win=853 Len=0 TSval=804451 TSecr=19374575
227 0.474759936 172.31.31.144 -> 172.31.23.72 TCP 66 6633 → 45460 [ACK] Seq=337 Ack=337 Win=853 Len=0 TSval=804451 TSecr=19374575
228 0.474778257 172.31.31.144 -> 172.31.23.72 TCP 66 6633 → 45446 [ACK] Seq=505 Ack=505 Win=853 Len=0 TSval=804451 TSecr=19374575
229 0.474808973 172.31.31.144 -> 172.31.23.72 TCP 66 6633 → 45458 [ACK] Seq=337 Ack=337 Win=853 Len=0 TSval=804451 TSecr=19374575
230 0.475088889 172.31.31.144 -> 172.31.23.72 TCP 66 6633 → 45426 [ACK] Seq=401 Ack=385 Win=853 Len=0 TSval=804451 TSecr=19374575
231 0.476859415 172.31.23.72 -> 172.31.31.144 OpenFlow 74 Type: OFPT_BARRIER_REPLY
232 0.476885126 172.31.23.72 -> 172.31.31.144 OpenFlow 74 Type: OFPT_BARRIER_REPLY
233 0.476922873 172.31.23.72 -> 172.31.31.144 OpenFlow 74 Type: OFPT_BARRIER_REPLY
234 0.476931180 172.31.23.72 -> 172.31.31.144 OpenFlow 74 Type: OFPT_BARRIER_REPLY
235 0.476952169 172.31.23.72 -> 172.31.31.144 OpenFlow 74 Type: OFPT_BARRIER_REPLY
236 0.476970769 172.31.23.72 -> 172.31.31.144 OpenFlow 74 Type: OFPT_BARRIER_REPLY
237 0.477100724 172.31.23.72 -> 172.31.31.144 OpenFlow 74 Type: OFPT_BARRIER_REPLY
238 0.477172768 172.31.31.144 -> 172.31.23.72 TCP 66 6633 → 45436 [ACK] Seq=1231 Ack=169 Win=853 Len=0 TSval=804451 TSecr=19374576
239 0.477217722 172.31.23.72 -> 172.31.31.144 OpenFlow 146 Type: OFPT_FLOW_REMOVED
240 0.477236037 172.31.23.72 -> 172.31.31.144 OpenFlow 146 Type: OFPT_FLOW_REMOVED
241 0.477240575 172.31.23.72 -> 172.31.31.144 OpenFlow 146 Type: OFPT_FLOW_REMOVED
242 0.477248511 172.31.23.72 -> 172.31.31.144 OpenFlow 146 Type: OFPT_FLOW_REMOVED
243 0.477335499 172.31.31.144 -> 172.31.23.72 TCP 66 6633 → 45436 [ACK] Seq=1231 Ack=177 Win=853 Len=0 TSval=804451 TSecr=19374576
244 0.477341435 172.31.23.72 -> 172.31.31.144 OpenFlow 386 Type: OFPT_FLOW_REMOVED
245 0.477531050 172.31.23.72 -> 172.31.31.144 OpenFlow 146 Type: OFPT_FLOW_REMOVED
246 0.477680925 172.31.31.144 -> 172.31.23.72 TCP 66 6633 → 45424 [ACK] Seq=233 Ack=137 Win=853 Len=0 TSval=804451 TSecr=19374576
247 0.477684257 172.31.31.144 -> 172.31.23.72 TCP 66 6633 → 45418 [ACK] Seq=401 Ack=225 Win=853 Len=0 TSval=804451 TSecr=19374576
248 0.477686322 172.31.31.144 -> 172.31.23.72 TCP 66 6633 → 45436 [ACK] Seq=1231 Ack=185 Win=853 Len=0 TSval=804451 TSecr=19374576
249 0.477688145 172.31.31.144 -> 172.31.23.72 TCP 66 6633 → 45438 [ACK] Seq=505 Ack=583 Win=853 Len=0 TSval=804451 TSecr=19374576
250 0.477690634 172.31.23.72 -> 172.31.31.144 OpenFlow 226 Type: OFPT_FLOW_REMOVED
251 0.477835641 172.31.31.144 -> 172.31.23.72 OpenFlow 170 Type: OFPT_FLOW_MOD
252 0.477839693 172.31.31.144 -> 172.31.23.72 OpenFlow 178 Type: OFPT_BARRIER_REQUEST
253 0.477841874 172.31.31.144 -> 172.31.23.72 TCP 66 6633 → 45438 [ACK] Seq=505 Ack=591 Win=853 Len=0 TSval=804451 TSecr=19374576
254 0.478320094 172.31.31.144 -> 172.31.23.72 OpenFlow 170 Type: OFPT_FLOW_MOD
255 0.478323188 172.31.31.144 -> 172.31.23.72 OpenFlow 170 Type: OFPT_FLOW_MOD
256 0.478325167 172.31.31.144 -> 172.31.23.72 OpenFlow 170 Type: OFPT_FLOW_MOD
257 0.478326875 172.31.31.144 -> 172.31.23.72 OpenFlow 170 Type: OFPT_FLOW_MOD
258 0.478328311 172.31.31.144 -> 172.31.23.72 OpenFlow 170 Type: OFPT_FLOW_MOD
259 0.478329885 172.31.31.144 -> 172.31.23.72 OpenFlow 178 Type: OFPT_BARRIER_REQUEST
260 0.478331368 172.31.31.144 -> 172.31.23.72 OpenFlow 74 Type: OFPT_BARRIER_REQUEST
261 0.478333122 172.31.31.144 -> 172.31.23.72 OpenFlow 170 Type: OFPT_FLOW_MOD
262 0.478338504 172.31.31.144 -> 172.31.23.72 OpenFlow 170 Type: OFPT_FLOW_MOD
263 0.478751289 172.31.31.144 -> 172.31.23.72 OpenFlow 74 Type: OFPT_BARRIER_REQUEST
264 0.478753667 172.31.31.144 -> 172.31.23.72 TCP 66 6633 → 45436 [ACK] Seq=1231 Ack=265 Win=853 Len=0 TSval=804451 TSecr=19374576
265 0.478755797 172.31.31.144 -> 172.31.23.72 OpenFlow 170 Type: OFPT_FLOW_MOD
266 0.478757441 172.31.31.144 -> 172.31.23.72 OpenFlow 178 Type: OFPT_BARRIER_REQUEST
267 0.478759047 172.31.31.144 -> 172.31.23.72 OpenFlow 170 Type: OFPT_FLOW_MOD
268 0.478760703 172.31.31.144 -> 172.31.23.72 OpenFlow 74 Type: OFPT_BARRIER_REQUEST
269 0.478763087 172.31.31.144 -> 172.31.23.72 TCP 66 6633 → 45424 [ACK] Seq=233 Ack=217 Win=853 Len=0 TSval=804451 TSecr=19374576
270 0.478765399 172.31.31.144 -> 172.31.23.72 OpenFlow 170 Type: OFPT_FLOW_MOD
271 0.478767038 172.31.31.144 -> 172.31.23.72 OpenFlow 170 Type: OFPT_FLOW_MOD
272 0.478768609 172.31.31.144 -> 172.31.23.72 OpenFlow 170 Type: OFPT_FLOW_MOD
273 0.478770306 172.31.31.144 -> 172.31.23.72 OpenFlow 170 Type: OFPT_FLOW_MOD
274 0.478777594 172.31.31.144 -> 172.31.23.72 OpenFlow 170 Type: OFPT_FLOW_MOD
275 0.478959071 172.31.23.72 -> 172.31.31.144 TCP 66 45418 → 6633 [ACK] Seq=385 Ack=617 Win=213 Len=0 TSval=19374576 TSecr=804451
276 0.478970439 172.31.23.72 -> 172.31.31.144 OpenFlow 74 Type: OFPT_BARRIER_REPLY
277 0.479027936 172.31.23.72 -> 172.31.31.144 TCP 66 45428 → 6633 [ACK] Seq=49 Ack=281 Win=213 Len=0 TSval=19374576 TSecr=804451
278 0.479032294 172.31.23.72 -> 172.31.31.144 OpenFlow 74 Type: OFPT_BARRIER_REPLY
279 0.479048143 172.31.23.72 -> 172.31.31.144 TCP 66 45416 → 6633 [ACK] Seq=217 Ack=441 Win=213 Len=0 TSval=19374576 TSecr=804451
280 0.479071076 172.31.31.144 -> 172.31.23.72 OpenFlow 170 Type: OFPT_FLOW_MOD
281 0.479075320 172.31.31.144 -> 172.31.23.72 TCP 170 6633 → 45462 [PSH, ACK] Seq=727 Ack=1 Win=853 Len=104 TSval=804451 TSecr=19374562
282 0.479078120 172.31.31.144 -> 172.31.23.72 OpenFlow 74 Type: OFPT_BARRIER_REQUEST
283 0.479079704 172.31.31.144 -> 172.31.23.72 OpenFlow 178 Type: OFPT_BARRIER_REQUEST
284 0.479081309 172.31.31.144 -> 172.31.23.72 OpenFlow 170 Type: OFPT_FLOW_MOD
285 0.479082930 172.31.31.144 -> 172.31.23.72 OpenFlow 170 Type: OFPT_FLOW_MOD
286 0.479085524 172.31.31.144 -> 172.31.23.72 OpenFlow 74 Type: OFPT_BARRIER_REQUEST
287 0.479087395 172.31.31.144 -> 172.31.23.72 OpenFlow 170 Type: OFPT_FLOW_MOD
288 0.479088846 172.31.31.144 -> 172.31.23.72 OpenFlow 170 Type: OFPT_FLOW_MOD
289 0.479090362 172.31.31.144 -> 172.31.23.72 OpenFlow 170 Type: OFPT_FLOW_MOD
290 0.479091973 172.31.31.144 -> 172.31.23.72 OpenFlow 178 Type: OFPT_BARRIER_REQUEST
291 0.479093518 172.31.31.144 -> 172.31.23.72 OpenFlow 170 Type: OFPT_FLOW_MOD
292 0.479095080 172.31.31.144 -> 172.31.23.72 OpenFlow 74 Type: OFPT_BARRIER_REQUEST
293 0.479096602 172.31.31.144 -> 172.31.23.72 OpenFlow 178 Type: OFPT_BARRIER_REQUEST
294 0.479127784 172.31.23.72 -> 172.31.31.144 OpenFlow 74 Type: OFPT_BARRIER_REPLY
295 0.479173117 172.31.23.72 -> 172.31.31.144 OpenFlow 74 Type: OFPT_BARRIER_REPLY
296 0.479186453 172.31.31.144 -> 172.31.23.72 OpenFlow 170 Type: OFPT_FLOW_MOD
297 0.479190017 172.31.31.144 -> 172.31.23.72 OpenFlow 170 Type: OFPT_FLOW_MOD
298 0.479191432 172.31.31.144 -> 172.31.23.72 TCP 66 6633 → 45438 [ACK] Seq=505 Ack=671 Win=853 Len=0 TSval=804451 TSecr=19374576
299 0.479193715 172.31.31.144 -> 172.31.23.72 TCP 394 6633 → 45462 [PSH, ACK] Seq=831 Ack=1 Win=853 Len=328 TSval=804451 TSecr=19374562
300 0.479195959 172.31.31.144 -> 172.31.23.72 OpenFlow 170 Type: OFPT_FLOW_MOD
301 0.479197378 172.31.31.144 -> 172.31.23.72 OpenFlow 170 Type: OFPT_FLOW_MOD
302 0.479198731 172.31.31.144 -> 172.31.23.72 OpenFlow 394 Type: OFPT_BARRIER_REQUEST
303 0.479208060 172.31.23.72 -> 172.31.31.144 OpenFlow 74 Type: OFPT_BARRIER_REPLY
304 0.479218043 172.31.23.72 -> 172.31.31.144 OpenFlow 74 Type: OFPT_BARRIER_REPLY
305 0.479234102 172.31.31.144 -> 172.31.23.72 OpenFlow 178 Type: OFPT_BARRIER_REQUEST
306 0.479237075 172.31.31.144 -> 172.31.23.72 OpenFlow 74 Type: OFPT_BARRIER_REQUEST
307 0.479238758 172.31.31.144 -> 172.31.23.72 OpenFlow 170 Type: OFPT_FLOW_MOD
308 0.479282563 172.31.31.144 -> 172.31.23.72 OpenFlow 74 Type: OFPT_BARRIER_REQUEST
309 0.479286416 172.31.31.144 -> 172.31.23.72 OpenFlow 178 Type: OFPT_BARRIER_REQUEST
310 0.479288090 172.31.31.144 -> 172.31.23.72 OpenFlow 74 Type: OFPT_BARRIER_REQUEST
311 0.479295582 172.31.23.72 -> 172.31.31.144 OpenFlow 74 Type: OFPT_BARRIER_REPLY
312 0.479340827 172.31.23.72 -> 172.31.31.144 TCP 66 45426 → 6633 [ACK] Seq=385 Ack=617 Win=213 Len=0 TSval=19374576 TSecr=804451
313 0.479348810 172.31.23.72 -> 172.31.31.144 OpenFlow 74 Type: OFPT_BARRIER_REPLY
314 0.479397112 172.31.31.144 -> 172.31.23.72 TCP 66 6633 → 45436 [ACK] Seq=1231 Ack=585 Win=853 Len=0 TSval=804451 TSecr=19374576
315 0.479404377 172.31.23.72 -> 172.31.31.144 OpenFlow 74 Type: OFPT_BARRIER_REPLY
316 0.479576113 172.31.31.144 -> 172.31.23.72 OpenFlow 170 Type: OFPT_FLOW_MOD
317 0.479673643 172.31.31.144 -> 172.31.23.72 OpenFlow 170 Type: OFPT_FLOW_MOD
318 0.479825081 172.31.31.144 -> 172.31.23.72 OpenFlow 170 Type: OFPT_FLOW_MOD
319 0.479921213 172.31.31.144 -> 172.31.23.72 OpenFlow 170 Type: OFPT_FLOW_MOD
320 0.481499266 172.31.23.72 -> 172.31.31.144 OpenFlow 74 Type: OFPT_BARRIER_REPLY
321 0.481545664 172.31.23.72 -> 172.31.31.144 TCP 66 45420 → 6633 [ACK] Seq=49 Ack=281 Win=213 Len=0 TSval=19374577 TSecr=804451
322 0.481550274 172.31.23.72 -> 172.31.31.144 OpenFlow 74 Type: OFPT_BARRIER_REPLY
323 0.481572138 172.31.23.72 -> 172.31.31.144 OpenFlow 74 Type: OFPT_BARRIER_REPLY
324 0.481598389 172.31.23.72 -> 172.31.31.144 OpenFlow 74 Type: OFPT_BARRIER_REPLY
325 0.481631592 172.31.23.72 -> 172.31.31.144 OpenFlow 74 Type: OFPT_BARRIER_REPLY
326 0.481664904 172.31.23.72 -> 172.31.31.144 OpenFlow 74 Type: OFPT_BARRIER_REPLY
327 0.481688782 172.31.23.72 -> 172.31.31.144 OpenFlow 74 Type: OFPT_BARRIER_REPLY
328 0.481707814 172.31.23.72 -> 172.31.31.144 TCP 66 45446 → 6633 [ACK] Seq=505 Ack=721 Win=213 Len=0 TSval=19374577 TSecr=804451
329 0.481711339 172.31.23.72 -> 172.31.31.144 OpenFlow 74 Type: OFPT_BARRIER_REPLY
330 0.481731474 172.31.23.72 -> 172.31.31.144 OpenFlow 74 Type: OFPT_BARRIER_REPLY
331 0.481751080 172.31.23.72 -> 172.31.31.144 TCP 66 45458 → 6633 [ACK] Seq=337 Ack=553 Win=213 Len=0 TSval=19374577 TSecr=804451
332 0.481754497 172.31.23.72 -> 172.31.31.144 OpenFlow 74 Type: OFPT_BARRIER_REPLY
333 0.481967825 172.31.31.144 -> 172.31.23.72 TCP 66 6633 → 45428 [ACK] Seq=281 Ack=57 Win=853 Len=0 TSval=804452 TSecr=19374576
334 0.481974443 172.31.31.144 -> 172.31.23.72 TCP 66 6633 → 45460 [ACK] Seq=769 Ack=353 Win=853 Len=0 TSval=804452 TSecr=19374576
335 0.481976485 172.31.31.144 -> 172.31.23.72 TCP 66 6633 → 45432 [ACK] Seq=713 Ack=311 Win=853 Len=0 TSval=804452 TSecr=19374576
336 0.482271490 172.31.23.72 -> 172.31.31.144 OpenFlow 74 Type: OFPT_BARRIER_REPLY
337 0.482278087 172.31.23.72 -> 172.31.31.144 OpenFlow 74 Type: OFPT_BARRIER_REPLY
338 0.482929627 172.31.31.144 -> 172.31.23.72 TCP 66 6633 → 45448 [ACK] Seq=601 Ack=431 Win=853 Len=0 TSval=804452 TSecr=19374576
339 0.483092983 172.31.31.144 -> 172.31.23.72 TCP 66 6633 → 45420 [ACK] Seq=281 Ack=57 Win=853 Len=0 TSval=804452 TSecr=19374577
340 0.483096120 172.31.31.144 -> 172.31.23.72 TCP 66 6633 → 45418 [ACK] Seq=1041 Ack=401 Win=853 Len=0 TSval=804453 TSecr=19374576
341 0.484213528 172.31.31.144 -> 172.31.23.72 TCP 66 6633 → 45432 [ACK] Seq=713 Ack=319 Win=853 Len=0 TSval=804453 TSecr=19374577
342 0.484220279 172.31.31.144 -> 172.31.23.72 TCP 66 6633 → 45462 [ACK] Seq=1159 Ack=17 Win=853 Len=0 TSval=804453 TSecr=19374577
343 0.484222587 172.31.31.144 -> 172.31.23.72 TCP 66 6633 → 45430 [ACK] Seq=1001 Ack=815 Win=853 Len=0 TSval=804453 TSecr=19374577
344 0.497763707 172.31.31.144 -> 172.31.23.72 OpenFlow 90 Type: OFPT_MULTIPART_REQUEST, OFPMP_GROUP
345 0.497781390 172.31.31.144 -> 172.31.23.72 OpenFlow 90 Type: OFPT_MULTIPART_REQUEST, OFPMP_GROUP
346 0.497801006 172.31.31.144 -> 172.31.23.72 OpenFlow 106 Type: OFPT_MULTIPART_REQUEST, OFPMP_METER
347 0.497815560 172.31.31.144 -> 172.31.23.72 OpenFlow 106 Type: OFPT_MULTIPART_REQUEST, OFPMP_METER
348 0.497892223 172.31.23.72 -> 172.31.31.144 OpenFlow 82 Type: OFPT_MULTIPART_REPLY, OFPMP_GROUP
349 0.497933269 172.31.31.144 -> 172.31.23.72 OpenFlow 187 Type: OFPT_PACKET_OUT
350 0.497942455 172.31.23.72 -> 172.31.31.144 OpenFlow 98 Type: OFPT_MULTIPART_REPLY, OFPMP_METER
351 0.497947749 172.31.23.72 -> 172.31.31.144 OpenFlow 82 Type: OFPT_MULTIPART_REPLY, OFPMP_GROUP
352 0.497986956 172.31.31.144 -> 172.31.23.72 OpenFlow 187 Type: OFPT_PACKET_OUT
353 0.498073192 172.31.23.72 -> 172.31.31.144 OpenFlow 98 Type: OFPT_MULTIPART_REPLY, OFPMP_METER
354 0.498236696 172.31.23.72 -> 172.31.31.144 TCP 66 45420 → 6633 [ACK] Seq=57 Ack=523 Win=213 Len=0 TSval=19374581 TSecr=804456
355 0.498318837 172.31.23.72 -> 172.31.31.144 OpenFlow 189 Type: OFPT_PACKET_IN
356 0.498655617 172.31.31.144 -> 172.31.23.72 OpenFlow 187 Type: OFPT_PACKET_OUT
357 0.498662671 172.31.31.144 -> 172.31.23.72 OpenFlow 187 Type: OFPT_PACKET_OUT
358 0.498664799 172.31.31.144 -> 172.31.23.72 TCP 66 6633 → 45436 [ACK] Seq=1295 Ack=633 Win=853 Len=0 TSval=804456 TSecr=19374581
359 0.498741472 172.31.23.72 -> 172.31.31.144 OpenFlow 189 Type: OFPT_PACKET_IN
360 0.498756966 172.31.23.72 -> 172.31.31.144 TCP 66 45420 → 6633 [ACK] Seq=57 Ack=765 Win=213 Len=0 TSval=19374581 TSecr=804456
361 0.500033895 172.31.31.144 -> 172.31.23.72 OpenFlow 187 Type: OFPT_PACKET_OUT
362 0.500040896 172.31.31.144 -> 172.31.23.72 TCP 66 6633 → 45434 [ACK] Seq=65 Ack=295 Win=853 Len=0 TSval=804457 TSecr=19374581
363 0.500044913 172.31.31.144 -> 172.31.23.72 OpenFlow 187 Type: OFPT_PACKET_OUT
364 0.500046904 172.31.31.144 -> 172.31.23.72 OpenFlow 187 Type: OFPT_PACKET_OUT
365 0.500048490 172.31.31.144 -> 172.31.23.72 OpenFlow 187 Type: OFPT_PACKET_OUT
366 0.500050796 172.31.31.144 -> 172.31.23.72 OpenFlow 187 Type: OFPT_PACKET_OUT
367 0.500053998 172.31.31.144 -> 172.31.23.72 OpenFlow 187 Type: OFPT_PACKET_OUT
368 0.500254261 172.31.23.72 -> 172.31.31.144 TCP 66 45420 → 6633 [ACK] Seq=57 Ack=1249 Win=213 Len=0 TSval=19374582 TSecr=804457
369 0.500364384 172.31.23.72 -> 172.31.31.144 TCP 66 45424 → 6633 [ACK] Seq=225 Ack=795 Win=213 Len=0 TSval=19374582 TSecr=804457
370 0.500441349 172.31.23.72 -> 172.31.31.144 OpenFlow 189 Type: OFPT_PACKET_IN
371 0.500494768 172.31.23.72 -> 172.31.31.144 OpenFlow 189 Type: OFPT_PACKET_IN
372 0.500509698 172.31.23.72 -> 172.31.31.144 OpenFlow 189 Type: OFPT_PACKET_IN
373 0.501496702 172.31.31.144 -> 172.31.23.72 OpenFlow 187 Type: OFPT_PACKET_OUT
374 0.501503731 172.31.31.144 -> 172.31.23.72 OpenFlow 187 Type: OFPT_PACKET_OUT
375 0.501505932 172.31.31.144 -> 172.31.23.72 OpenFlow 187 Type: OFPT_PACKET_OUT
376 0.501507626 172.31.31.144 -> 172.31.23.72 OpenFlow 187 Type: OFPT_PACKET_OUT
377 0.501509886 172.31.31.144 -> 172.31.23.72 OpenFlow 187 Type: OFPT_PACKET_OUT
378 0.501511376 172.31.31.144 -> 172.31.23.72 OpenFlow 187 Type: OFPT_PACKET_OUT
379 0.501512729 172.31.31.144 -> 172.31.23.72 TCP 66 6633 → 45418 [ACK] Seq=1041 Ack=647 Win=853 Len=0 TSval=804457 TSecr=19374581
380 0.501576093 172.31.23.72 -> 172.31.31.144 OpenFlow 189 Type: OFPT_PACKET_IN
381 0.501648230 172.31.23.72 -> 172.31.31.144 OpenFlow 189 Type: OFPT_PACKET_IN
382 0.501651383 172.31.23.72 -> 172.31.31.144 OpenFlow 189 Type: OFPT_PACKET_IN
383 0.501710509 172.31.31.144 -> 172.31.23.72 OpenFlow 187 Type: OFPT_PACKET_OUT
384 0.501715694 172.31.31.144 -> 172.31.23.72 OpenFlow 187 Type: OFPT_PACKET_OUT
385 0.501910788 172.31.23.72 -> 172.31.31.144 TCP 66 45424 → 6633 [ACK] Seq=225 Ack=1763 Win=213 Len=0 TSval=19374582 TSecr=804457
386 0.501989217 172.31.23.72 -> 172.31.31.144 OpenFlow 189 Type: OFPT_PACKET_IN
387 0.502007917 172.31.23.72 -> 172.31.31.144 OpenFlow 189 Type: OFPT_PACKET_IN
388 0.502040998 172.31.23.72 -> 172.31.31.144 OpenFlow 189 Type: OFPT_PACKET_IN
389 0.502151610 172.31.23.72 -> 172.31.31.144 OpenFlow 189 Type: OFPT_PACKET_IN
390 0.503686169 172.31.31.144 -> 172.31.23.72 OpenFlow 187 Type: OFPT_PACKET_OUT
391 0.503693984 172.31.31.144 -> 172.31.23.72 OpenFlow 187 Type: OFPT_PACKET_OUT
392 0.503696074 172.31.31.144 -> 172.31.23.72 OpenFlow 187 Type: OFPT_PACKET_OUT
393 0.503700320 172.31.23.72 -> 172.31.31.144 OpenFlow 189 Type: OFPT_PACKET_IN
394 0.503705789 172.31.31.144 -> 172.31.23.72 OpenFlow 187 Type: OFPT_PACKET_OUT
395 0.503707630 172.31.31.144 -> 172.31.23.72 OpenFlow 187 Type: OFPT_PACKET_OUT
396 0.503709712 172.31.31.144 -> 172.31.23.72 OpenFlow 187 Type: OFPT_PACKET_OUT
397 0.503711500 172.31.31.144 -> 172.31.23.72 OpenFlow 187 Type: OFPT_PACKET_OUT
398 0.503713201 172.31.31.144 -> 172.31.23.72 OpenFlow 187 Type: OFPT_PACKET_OUT
399 0.503714954 172.31.31.144 -> 172.31.23.72 OpenFlow 187 Type: OFPT_PACKET_OUT
400 0.503716443 172.31.31.144 -> 172.31.23.72 OpenFlow 187 Type: OFPT_PACKET_OUT
401 0.503718052 172.31.31.144 -> 172.31.23.72 OpenFlow 187 Type: OFPT_PACKET_OUT
402 0.503720008 172.31.31.144 -> 172.31.23.72 OpenFlow 187 Type: OFPT_PACKET_OUT
403 0.503721307 172.31.31.144 -> 172.31.23.72 OpenFlow 187 Type: OFPT_PACKET_OUT
404 0.503722688 172.31.31.144 -> 172.31.23.72 OpenFlow 187 Type: OFPT_PACKET_OUT
405 0.503723941 172.31.31.144 -> 172.31.23.72 OpenFlow 187 Type: OFPT_PACKET_OUT
406 0.503725532 172.31.31.144 -> 172.31.23.72 OpenFlow 187 Type: OFPT_PACKET_OUT
407 0.503727255 172.31.31.144 -> 172.31.23.72 OpenFlow 187 Type: OFPT_PACKET_OUT
408 0.503728753 172.31.31.144 -> 172.31.23.72 OpenFlow 187 Type: OFPT_PACKET_OUT
409 0.503730047 172.31.31.144 -> 172.31.23.72 OpenFlow 187 Type: OFPT_PACKET_OUT
410 0.503731162 172.31.31.144 -> 172.31.23.72 OpenFlow 187 Type: OFPT_PACKET_OUT
411 0.503732524 172.31.31.144 -> 172.31.23.72 OpenFlow 187 Type: OFPT_PACKET_OUT
412 0.503735076 172.31.31.144 -> 172.31.23.72 OpenFlow 187 Type: OFPT_PACKET_OUT
413 0.503736916 172.31.31.144 -> 172.31.23.72 OpenFlow 187 Type: OFPT_PACKET_OUT
414 0.503738269 172.31.31.144 -> 172.31.23.72 OpenFlow 187 Type: OFPT_PACKET_OUT
415 0.503739384 172.31.31.144 -> 172.31.23.72 OpenFlow 187 Type: OFPT_PACKET_OUT
416 0.503740507 172.31.31.144 -> 172.31.23.72 OpenFlow 187 Type: OFPT_PACKET_OUT
417 0.503741697 172.31.31.144 -> 172.31.23.72 OpenFlow 187 Type: OFPT_PACKET_OUT
418 0.503743018 172.31.31.144 -> 172.31.23.72 OpenFlow 187 Type: OFPT_PACKET_OUT
419 0.503744340 172.31.31.144 -> 172.31.23.72 OpenFlow 187 Type: OFPT_PACKET_OUT
420 0.503745670 172.31.31.144 -> 172.31.23.72 OpenFlow 187 Type: OFPT_PACKET_OUT
421 0.503746862 172.31.31.144 -> 172.31.23.72 OpenFlow 187 Type: OFPT_PACKET_OUT
422 0.503749878 172.31.31.144 -> 172.31.23.72 OpenFlow 187 Type: OFPT_PACKET_OUT
423 0.503751675 172.31.31.144 -> 172.31.23.72 OpenFlow 187 Type: OFPT_PACKET_OUT
424 0.503753153 172.31.31.144 -> 172.31.23.72 TCP 66 6633 → 45428 [ACK] Seq=281 Ack=180 Win=853 Len=0 TSval=804457 TSecr=19374582
425 0.503755388 172.31.31.144 -> 172.31.23.72 TCP 66 6633 → 45426 [ACK] Seq=617 Ack=516 Win=853 Len=0 TSval=804457 TSecr=19374576
426 0.503758373 172.31.31.144 -> 172.31.23.72 TCP 66 6633 → 45422 [ACK] Seq=65 Ack=172 Win=853 Len=0 TSval=804457 TSecr=19374582
427 0.503761832 172.31.31.144 -> 172.31.23.72 OpenFlow 187 Type: OFPT_PACKET_OUT
428 0.503763641 172.31.31.144 -> 172.31.23.72 OpenFlow 187 Type: OFPT_PACKET_OUT
429 0.503765098 172.31.31.144 -> 172.31.23.72 OpenFlow 187 Type: OFPT_PACKET_OUT
430 0.503766926 172.31.31.144 -> 172.31.23.72 TCP 66 6633 → 45428 [ACK] Seq=281 Ack=303 Win=853 Len=0 TSval=804457 TSecr=19374582
431 0.503768752 172.31.31.144 -> 172.31.23.72 OpenFlow 187 Type: OFPT_PACKET_OUT
432 0.503770942 172.31.31.144 -> 172.31.23.72 OpenFlow 187 Type: OFPT_PACKET_OUT
433 0.503772437 172.31.31.144 -> 172.31.23.72 TCP 66 6633 → 45422 [ACK] Seq=65 Ack=295 Win=853 Len=0 TSval=804457 TSecr=19374582
434 0.503774071 172.31.31.144 -> 172.31.23.72 OpenFlow 187 Type: OFPT_PACKET_OUT
435 0.503775482 172.31.31.144 -> 172.31.23.72 OpenFlow 187 Type: OFPT_PACKET_OUT
436 0.503777104 172.31.31.144 -> 172.31.23.72 OpenFlow 187 Type: OFPT_PACKET_OUT
437 0.503778547 172.31.31.144 -> 172.31.23.72 OpenFlow 187 Type: OFPT_PACKET_OUT
438 0.503780133 172.31.31.144 -> 172.31.23.72 OpenFlow 187 Type: OFPT_PACKET_OUT
439 0.503806334 172.31.23.72 -> 172.31.31.144 OpenFlow 189 Type: OFPT_PACKET_IN
440 0.503808509 172.31.23.72 -> 172.31.31.144 OpenFlow 189 Type: OFPT_PACKET_IN
441 0.503810024 172.31.23.72 -> 172.31.31.144 OpenFlow 189 Type: OFPT_PACKET_IN
442 0.503901000 172.31.31.144 -> 172.31.23.72 OpenFlow 187 Type: OFPT_PACKET_OUT
443 0.503907119 172.31.31.144 -> 172.31.23.72 OpenFlow 187 Type: OFPT_PACKET_OUT
444 0.503908817 172.31.31.144 -> 172.31.23.72 OpenFlow 187 Type: OFPT_PACKET_OUT
445 0.503910572 172.31.31.144 -> 172.31.23.72 OpenFlow 187 Type: OFPT_PACKET_OUT
446 0.503912386 172.31.31.144 -> 172.31.23.72 OpenFlow 187 Type: OFPT_PACKET_OUT
447 0.503913616 172.31.31.144 -> 172.31.23.72 OpenFlow 187 Type: OFPT_PACKET_OUT
448 0.503915233 172.31.31.144 -> 172.31.23.72 OpenFlow 187 Type: OFPT_PACKET_OUT
449 0.503916474 172.31.31.144 -> 172.31.23.72 OpenFlow 187 Type: OFPT_PACKET_OUT
450 0.503917964 172.31.31.144 -> 172.31.23.72 OpenFlow 187 Type: OFPT_PACKET_OUT
451 0.503919192 172.31.31.144 -> 172.31.23.72 OpenFlow 187 Type: OFPT_PACKET_OUT
452 0.503920931 172.31.31.144 -> 172.31.23.72 OpenFlow 187 Type: OFPT_PACKET_OUT
453 0.503922688 172.31.31.144 -> 172.31.23.72 OpenFlow 187 Type: OFPT_PACKET_OUT
454 0.503924188 172.31.31.144 -> 172.31.23.72 OpenFlow 187 Type: OFPT_PACKET_OUT
455 0.504275486 172.31.23.72 -> 172.31.31.144 TCP 66 45434 → 6633 [ACK] Seq=541 Ack=1275 Win=213 Len=0 TSval=19374583 TSecr=804457
456 0.504338336 172.31.23.72 -> 172.31.31.144 OpenFlow 189 Type: OFPT_PACKET_IN
457 0.504628284 172.31.23.72 -> 172.31.31.144 TCP 66 45418 → 6633 [ACK] Seq=647 Ack=2251 Win=213 Len=0 TSval=19374583 TSecr=804457
458 0.505002021 172.31.23.72 -> 172.31.31.144 TCP 66 45444 → 6633 [ACK] Seq=247 Ack=1211 Win=213 Len=0 TSval=19374583 TSecr=804457
459 0.505238451 172.31.23.72 -> 172.31.31.144 TCP 66 45438 → 6633 [ACK] Seq=839 Ack=1551 Win=213 Len=0 TSval=19374583 TSecr=804457
460 0.505290509 172.31.23.72 -> 172.31.31.144 OpenFlow 189 Type: OFPT_PACKET_IN
461 0.505475840 172.31.23.72 -> 172.31.31.144 OpenFlow 189 Type: OFPT_PACKET_IN
462 0.505735701 172.31.31.144 -> 172.31.23.72 OpenFlow 187 Type: OFPT_PACKET_OUT
463 0.505741443 172.31.31.144 -> 172.31.23.72 OpenFlow 187 Type: OFPT_PACKET_OUT
464 0.505743444 172.31.31.144 -> 172.31.23.72 OpenFlow 187 Type: OFPT_PACKET_OUT
465 0.505747262 172.31.31.144 -> 172.31.23.72 OpenFlow 187 Type: OFPT_PACKET_OUT
466 0.505748826 172.31.31.144 -> 172.31.23.72 OpenFlow 187 Type: OFPT_PACKET_OUT
467 0.505750694 172.31.31.144 -> 172.31.23.72 TCP 66 6633 → 45414 [ACK] Seq=65 Ack=172 Win=853 Len=0 TSval=804458 TSecr=19374582
468 0.505754484 172.31.31.144 -> 172.31.23.72 OpenFlow 187 Type: OFPT_PACKET_OUT
469 0.505756554 172.31.31.144 -> 172.31.23.72 OpenFlow 187 Type: OFPT_PACKET_OUT
470 0.505758230 172.31.31.144 -> 172.31.23.72 TCP 66 6633 → 45434 [ACK] Seq=1275 Ack=541 Win=853 Len=0 TSval=804458 TSecr=19374582
471 0.505760625 172.31.31.144 -> 172.31.23.72 OpenFlow 187 Type: OFPT_PACKET_OUT
472 0.505761948 172.31.31.144 -> 172.31.23.72 OpenFlow 308 Type: OFPT_PACKET_OUT
473 0.505764026 172.31.31.144 -> 172.31.23.72 TCP 66 6633 → 45430 [ACK] Seq=2211 Ack=1061 Win=853 Len=0 TSval=804458 TSecr=19374582
474 0.505767635 172.31.23.72 -> 172.31.31.144 OpenFlow 189 Type: OFPT_PACKET_IN
475 0.505774277 172.31.31.144 -> 172.31.23.72 TCP 66 6633 → 45414 [ACK] Seq=65 Ack=295 Win=853 Len=0 TSval=804458 TSecr=19374583
476 0.505899623 172.31.23.72 -> 172.31.31.144 OpenFlow 189 Type: OFPT_PACKET_IN
477 0.506125812 172.31.23.72 -> 172.31.31.144 TCP 66 45428 → 6633 [ACK] Seq=303 Ack=1007 Win=213 Len=0 TSval=19374583 TSecr=804458
478 0.506133660 172.31.23.72 -> 172.31.31.144 OpenFlow 189 Type: OFPT_PACKET_IN
479 0.506190447 172.31.23.72 -> 172.31.31.144 OpenFlow 189 Type: OFPT_PACKET_IN
480 0.506457769 172.31.23.72 -> 172.31.31.144 OpenFlow 189 Type: OFPT_PACKET_IN
481 0.506484482 172.31.23.72 -> 172.31.31.144 OpenFlow 189 Type: OFPT_PACKET_IN
482 0.506510493 172.31.23.72 -> 172.31.31.144 OpenFlow 189 Type: OFPT_PACKET_IN
483 0.506522765 172.31.23.72 -> 172.31.31.144 OpenFlow 189 Type: OFPT_PACKET_IN
484 0.506535026 172.31.23.72 -> 172.31.31.144 OpenFlow 189 Type: OFPT_PACKET_IN
485 0.506550531 172.31.23.72 -> 172.31.31.144 OpenFlow 189 Type: OFPT_PACKET_IN
486 0.506565847 172.31.23.72 -> 172.31.31.144 OpenFlow 189 Type: OFPT_PACKET_IN
487 0.506583634 172.31.23.72 -> 172.31.31.144 OpenFlow 189 Type: OFPT_PACKET_IN
488 0.506659424 172.31.23.72 -> 172.31.31.144 OpenFlow 189 Type: OFPT_PACKET_IN
489 0.506675695 172.31.23.72 -> 172.31.31.144 OpenFlow 189 Type: OFPT_PACKET_IN
490 0.506686900 172.31.23.72 -> 172.31.31.144 OpenFlow 189 Type: OFPT_PACKET_IN
491 0.506704604 172.31.23.72 -> 172.31.31.144 OpenFlow 189 Type: OFPT_PACKET_IN
492 0.506719630 172.31.23.72 -> 172.31.31.144 OpenFlow 189 Type: OFPT_PACKET_IN
493 0.506733646 172.31.23.72 -> 172.31.31.144 OpenFlow 189 Type: OFPT_PACKET_IN
494 0.506749575 172.31.23.72 -> 172.31.31.144 OpenFlow 189 Type: OFPT_PACKET_IN
495 0.509385962 172.31.31.144 -> 172.31.23.72 TCP 66 6633 → 45450 [ACK] Seq=727 Ack=370 Win=853 Len=0 TSval=804458 TSecr=19374583
496 0.509393122 172.31.31.144 -> 172.31.23.72 TCP 66 6633 → 45430 [ACK] Seq=2211 Ack=1307 Win=853 Len=0 TSval=804459 TSecr=19374583
497 0.509395882 172.31.31.144 -> 172.31.23.72 TCP 66 6633 → 45424 [ACK] Seq=1763 Ack=471 Win=853 Len=0 TSval=804459 TSecr=19374583
498 0.509399639 172.31.23.72 -> 172.31.31.144 OpenFlow 435 Type: OFPT_PACKET_IN
499 0.509404809 172.31.31.144 -> 172.31.23.72 TCP 66 6633 → 45450 [ACK] Seq=727 Ack=493 Win=853 Len=0 TSval=804459 TSecr=19374583
500 0.509409938 172.31.23.72 -> 172.31.31.144 OpenFlow 189 Type: OFPT_PACKET_IN
501 0.509712389 172.31.23.72 -> 172.31.31.144 OpenFlow 435 Type: OFPT_PACKET_IN
502 0.509714687 172.31.23.72 -> 172.31.31.144 OpenFlow 681 Type: OFPT_PACKET_IN
503 0.509716403 172.31.23.72 -> 172.31.31.144 OpenFlow 189 Type: OFPT_PACKET_IN
504 0.509718094 172.31.23.72 -> 172.31.31.144 OpenFlow 189 Type: OFPT_PACKET_IN
505 0.509719710 172.31.23.72 -> 172.31.31.144 OpenFlow 189 Type: OFPT_PACKET_IN
506 0.509721281 172.31.23.72 -> 172.31.31.144 OpenFlow 435 Type: OFPT_PACKET_IN
507 0.509722842 172.31.23.72 -> 172.31.31.144 OpenFlow 681 Type: OFPT_PACKET_IN
508 0.509724498 172.31.23.72 -> 172.31.31.144 OpenFlow 189 Type: OFPT_PACKET_IN
509 0.509726155 172.31.23.72 -> 172.31.31.144 OpenFlow 189 Type: OFPT_PACKET_IN
510 0.510011814 172.31.31.144 -> 172.31.23.72 TCP 66 6633 → 45416 [ACK] Seq=1417 Ack=594 Win=853 Len=0 TSval=804459 TSecr=19374583
511 0.510015927 172.31.31.144 -> 172.31.23.72 TCP 66 6633 → 45456 [ACK] Seq=1 Ack=124 Win=853 Len=0 TSval=804459 TSecr=19374583
512 0.510019008 172.31.31.144 -> 172.31.23.72 TCP 66 6633 → 45432 [ACK] Seq=713 Ack=442 Win=853 Len=0 TSval=804459 TSecr=19374583
513 0.510021236 172.31.31.144 -> 172.31.23.72 TCP 66 6633 → 45414 [ACK] Seq=65 Ack=418 Win=853 Len=0 TSval=804459 TSecr=19374583
514 0.510023136 172.31.31.144 -> 172.31.23.72 TCP 66 6633 → 45454 [ACK] Seq=1 Ack=370 Win=853 Len=0 TSval=804459 TSecr=19374583
515 0.510024899 172.31.31.144 -> 172.31.23.72 TCP 66 6633 → 45446 [ACK] Seq=721 Ack=636 Win=853 Len=0 TSval=804459 TSecr=19374577
516 0.510027091 172.31.31.144 -> 172.31.23.72 TCP 66 6633 → 45442 [ACK] Seq=1 Ack=370 Win=853 Len=0 TSval=804459 TSecr=19374583
517 0.510028999 172.31.31.144 -> 172.31.23.72 TCP 66 6633 → 45422 [ACK] Seq=65 Ack=418 Win=853 Len=0 TSval=804459 TSecr=19374583
518 0.510030969 172.31.31.144 -> 172.31.23.72 TCP 66 6633 → 45426 [ACK] Seq=617 Ack=762 Win=853 Len=0 TSval=804459 TSecr=19374582
519 0.510036552 172.31.23.72 -> 172.31.31.144 OpenFlow 189 Type: OFPT_PACKET_IN
520 0.510041203 172.31.23.72 -> 172.31.31.144 OpenFlow 681 Type: OFPT_PACKET_IN
521 0.510042957 172.31.23.72 -> 172.31.31.144 OpenFlow 435 Type: OFPT_PACKET_IN
522 0.510044688 172.31.23.72 -> 172.31.31.144 OpenFlow 435 Type: OFPT_PACKET_IN
523 0.510046513 172.31.23.72 -> 172.31.31.144 OpenFlow 189 Type: OFPT_PACKET_IN
524 0.512949060 172.31.31.144 -> 172.31.23.72 TCP 66 6633 → 45424 [ACK] Seq=1763 Ack=963 Win=853 Len=0 TSval=804460 TSecr=19374583
525 0.512960570 172.31.31.144 -> 172.31.23.72 TCP 66 6633 → 45432 [ACK] Seq=713 Ack=1057 Win=853 Len=0 TSval=804460 TSecr=19374584
526 0.512963142 172.31.31.144 -> 172.31.23.72 TCP 66 6633 → 45456 [ACK] Seq=1 Ack=247 Win=853 Len=0 TSval=804460 TSecr=19374584
527 0.512965155 172.31.31.144 -> 172.31.23.72 TCP 66 6633 → 45414 [ACK] Seq=65 Ack=541 Win=853 Len=0 TSval=804460 TSecr=19374584
528 0.512967079 172.31.31.144 -> 172.31.23.72 TCP 66 6633 → 45454 [ACK] Seq=1 Ack=493 Win=853 Len=0 TSval=804460 TSecr=19374584
529 0.512969114 172.31.31.144 -> 172.31.23.72 TCP 66 6633 → 45442 [ACK] Seq=1 Ack=739 Win=853 Len=0 TSval=804460 TSecr=19374584
530 0.512970973 172.31.31.144 -> 172.31.23.72 TCP 66 6633 → 45422 [ACK] Seq=65 Ack=541 Win=853 Len=0 TSval=804460 TSecr=19374584
531 0.512972910 172.31.31.144 -> 172.31.23.72 TCP 66 6633 → 45452 [ACK] Seq=969 Ack=247 Win=853 Len=0 TSval=804460 TSecr=19374583
532 0.512975298 172.31.31.144 -> 172.31.23.72 TCP 66 6633 → 45462 [ACK] Seq=1159 Ack=263 Win=853 Len=0 TSval=804460 TSecr=19374583
533 0.512977614 172.31.31.144 -> 172.31.23.72 TCP 66 6633 → 45436 [ACK] Seq=1295 Ack=1371 Win=853 Len=0 TSval=804460 TSecr=19374583
534 0.512979818 172.31.31.144 -> 172.31.23.72 TCP 66 6633 → 45420 [ACK] Seq=1249 Ack=549 Win=853 Len=0 TSval=804460 TSecr=19374583
535 0.512982000 172.31.31.144 -> 172.31.23.72 TCP 66 6633 → 45434 [ACK] Seq=1275 Ack=1033 Win=853 Len=0 TSval=804460 TSecr=19374583
536 0.512984210 172.31.31.144 -> 172.31.23.72 TCP 66 6633 → 45418 [ACK] Seq=2251 Ack=893 Win=853 Len=0 TSval=804460 TSecr=19374583
537 0.522385743 172.31.31.144 -> 172.31.23.72 TCP 66 6633 → 45458 [ACK] Seq=553 Ack=345 Win=853 Len=0 TSval=804463 TSecr=19374577
538 0.551905845 172.31.31.144 -> 172.31.23.72 TCP 66 6633 → 45426 [ACK] Seq=617 Ack=1377 Win=853 Len=0 TSval=804470 TSecr=19374584
539 0.551921177 172.31.31.144 -> 172.31.23.72 TCP 66 6633 → 45446 [ACK] Seq=721 Ack=1005 Win=853 Len=0 TSval=804470 TSecr=19374584
540 0.551924543 172.31.31.144 -> 172.31.23.72 TCP 66 6633 → 45416 [ACK] Seq=1417 Ack=717 Win=853 Len=0 TSval=804470 TSecr=19374584
541 0.600418173 172.31.31.144 -> 172.31.23.72 OpenFlow 90 Type: OFPT_MULTIPART_REQUEST, OFPMP_GROUP
542 0.600444273 172.31.31.144 -> 172.31.23.72 OpenFlow 106 Type: OFPT_MULTIPART_REQUEST, OFPMP_METER
543 0.600447957 172.31.31.144 -> 172.31.23.72 OpenFlow 187 Type: OFPT_PACKET_OUT
544 0.600451389 172.31.31.144 -> 172.31.23.72 OpenFlow 187 Type: OFPT_PACKET_OUT
545 0.600453120 172.31.31.144 -> 172.31.23.72 OpenFlow 187 Type: OFPT_PACKET_OUT
546 0.600455707 172.31.31.144 -> 172.31.23.72 OpenFlow 187 Type: OFPT_PACKET_OUT
547 0.600457215 172.31.31.144 -> 172.31.23.72 OpenFlow 187 Type: OFPT_PACKET_OUT
548 0.600680419 172.31.23.72 -> 172.31.31.144 OpenFlow 82 Type: OFPT_MULTIPART_REPLY, OFPMP_GROUP
549 0.601001000 172.31.23.72 -> 172.31.31.144 TCP 66 45446 → 6633 [ACK] Seq=1005 Ack=1326 Win=213 Len=0 TSval=19374607 TSecr=804482
550 0.601105868 172.31.23.72 -> 172.31.31.144 OpenFlow 189 Type: OFPT_PACKET_IN
551 0.601241473 172.31.23.72 -> 172.31.31.144 OpenFlow 189 Type: OFPT_PACKET_IN
552 0.602099411 172.31.31.144 -> 172.31.23.72 OpenFlow 187 Type: OFPT_PACKET_OUT
553 0.602107959 172.31.31.144 -> 172.31.23.72 OpenFlow 187 Type: OFPT_PACKET_OUT
554 0.602110575 172.31.31.144 -> 172.31.23.72 OpenFlow 187 Type: OFPT_PACKET_OUT
555 0.602112182 172.31.31.144 -> 172.31.23.72 OpenFlow 187 Type: OFPT_PACKET_OUT
556 0.602113857 172.31.31.144 -> 172.31.23.72 OpenFlow 187 Type: OFPT_PACKET_OUT
557 0.602115425 172.31.31.144 -> 172.31.23.72 OpenFlow 187 Type: OFPT_PACKET_OUT
558 0.602118618 172.31.31.144 -> 172.31.23.72 OpenFlow 187 Type: OFPT_PACKET_OUT
559 0.602120166 172.31.31.144 -> 172.31.23.72 OpenFlow 187 Type: OFPT_PACKET_OUT
560 0.602121996 172.31.31.144 -> 172.31.23.72 OpenFlow 187 Type: OFPT_PACKET_OUT
561 0.602123446 172.31.31.144 -> 172.31.23.72 OpenFlow 187 Type: OFPT_PACKET_OUT
562 0.602125068 172.31.31.144 -> 172.31.23.72 OpenFlow 187 Type: OFPT_PACKET_OUT
563 0.602126430 172.31.31.144 -> 172.31.23.72 OpenFlow 187 Type: OFPT_PACKET_OUT
564 0.602128075 172.31.31.144 -> 172.31.23.72 OpenFlow 187 Type: OFPT_PACKET_OUT
565 0.602129540 172.31.31.144 -> 172.31.23.72 OpenFlow 187 Type: OFPT_PACKET_OUT
566 0.602132013 172.31.31.144 -> 172.31.23.72 OpenFlow 187 Type: OFPT_PACKET_OUT
567 0.602133464 172.31.31.144 -> 172.31.23.72 OpenFlow 187 Type: OFPT_PACKET_OUT
568 0.602134741 172.31.31.144 -> 172.31.23.72 OpenFlow 187 Type: OFPT_PACKET_OUT
569 0.602136118 172.31.31.144 -> 172.31.23.72 OpenFlow 187 Type: OFPT_PACKET_OUT
570 0.602137753 172.31.31.144 -> 172.31.23.72 OpenFlow 187 Type: OFPT_PACKET_OUT
571 0.602139408 172.31.31.144 -> 172.31.23.72 OpenFlow 187 Type: OFPT_PACKET_OUT
572 0.602142135 172.31.31.144 -> 172.31.23.72 OpenFlow 187 Type: OFPT_PACKET_OUT
573 0.602143461 172.31.31.144 -> 172.31.23.72 OpenFlow 187 Type: OFPT_PACKET_OUT
574 0.602144779 172.31.31.144 -> 172.31.23.72 OpenFlow 187 Type: OFPT_PACKET_OUT
575 0.602146086 172.31.31.144 -> 172.31.23.72 OpenFlow 187 Type: OFPT_PACKET_OUT
576 0.602150582 172.31.31.144 -> 172.31.23.72 OpenFlow 187 Type: OFPT_PACKET_OUT
577 0.602152308 172.31.31.144 -> 172.31.23.72 OpenFlow 187 Type: OFPT_PACKET_OUT
578 0.602153674 172.31.31.144 -> 172.31.23.72 OpenFlow 187 Type: OFPT_PACKET_OUT
579 0.602155343 172.31.31.144 -> 172.31.23.72 OpenFlow 187 Type: OFPT_PACKET_OUT
580 0.602157800 172.31.31.144 -> 172.31.23.72 OpenFlow 187 Type: OFPT_PACKET_OUT
581 0.602159599 172.31.31.144 -> 172.31.23.72 OpenFlow 187 Type: OFPT_PACKET_OUT
582 0.602160971 172.31.31.144 -> 172.31.23.72 OpenFlow 187 Type: OFPT_PACKET_OUT
583 0.602162364 172.31.31.144 -> 172.31.23.72 OpenFlow 187 Type: OFPT_PACKET_OUT
584 0.602163860 172.31.31.144 -> 172.31.23.72 OpenFlow 187 Type: OFPT_PACKET_OUT
585 0.602165667 172.31.31.144 -> 172.31.23.72 OpenFlow 187 Type: OFPT_PACKET_OUT
586 0.602167250 172.31.31.144 -> 172.31.23.72 OpenFlow 187 Type: OFPT_PACKET_OUT
587 0.602191140 172.31.23.72 -> 172.31.31.144 OpenFlow 189 Type: OFPT_PACKET_IN
588 0.602197708 172.31.23.72 -> 172.31.31.144 OpenFlow 189 Type: OFPT_PACKET_IN
589 0.602199687 172.31.23.72 -> 172.31.31.144 OpenFlow 221 Type: OFPT_PACKET_IN
590 0.602324249 172.31.31.144 -> 172.31.23.72 OpenFlow 187 Type: OFPT_PACKET_OUT
591 0.602330142 172.31.31.144 -> 172.31.23.72 OpenFlow 187 Type: OFPT_PACKET_OUT
592 0.602332721 172.31.31.144 -> 172.31.23.72 OpenFlow 187 Type: OFPT_PACKET_OUT
593 0.602334444 172.31.31.144 -> 172.31.23.72 OpenFlow 187 Type: OFPT_PACKET_OUT
594 0.602500309 172.31.23.72 -> 172.31.31.144 TCP 66 45446 → 6633 [ACK] Seq=1005 Ack=1931 Win=213 Len=0 TSval=19374607 TSecr=804482
595 0.602849480 172.31.23.72 -> 172.31.31.144 TCP 66 45432 → 6633 [ACK] Seq=1057 Ack=1681 Win=213 Len=0 TSval=19374607 TSecr=804482
596 0.603044172 172.31.23.72 -> 172.31.31.144 TCP 66 45460 → 6633 [ACK] Seq=353 Ack=1495 Win=213 Len=0 TSval=19374607 TSecr=804482
597 0.603097075 172.31.23.72 -> 172.31.31.144 OpenFlow 189 Type: OFPT_PACKET_IN
598 0.603351140 172.31.23.72 -> 172.31.31.144 OpenFlow 189 Type: OFPT_PACKET_IN
599 0.603795403 172.31.23.72 -> 172.31.31.144 TCP 66 45414 → 6633 [ACK] Seq=541 Ack=549 Win=213 Len=0 TSval=19374608 TSecr=804482
600 0.603819787 172.31.23.72 -> 172.31.31.144 OpenFlow 189 Type: OFPT_PACKET_IN
601 0.603834801 172.31.23.72 -> 172.31.31.144 OpenFlow 189 Type: OFPT_PACKET_IN
602 0.603932869 172.31.23.72 -> 172.31.31.144 OpenFlow 189 Type: OFPT_PACKET_IN
603 0.603965070 172.31.23.72 -> 172.31.31.144 OpenFlow 189 Type: OFPT_PACKET_IN
604 0.603976326 172.31.23.72 -> 172.31.31.144 OpenFlow 189 Type: OFPT_PACKET_IN
605 0.603995203 172.31.23.72 -> 172.31.31.144 OpenFlow 189 Type: OFPT_PACKET_IN
606 0.604006619 172.31.23.72 -> 172.31.31.144 OpenFlow 189 Type: OFPT_PACKET_IN
607 0.604017977 172.31.23.72 -> 172.31.31.144 OpenFlow 189 Type: OFPT_PACKET_IN
608 0.604029356 172.31.23.72 -> 172.31.31.144 OpenFlow 189 Type: OFPT_PACKET_IN
609 0.604047941 172.31.23.72 -> 172.31.31.144 OpenFlow 189 Type: OFPT_PACKET_IN
610 0.605546514 172.31.31.144 -> 172.31.23.72 OpenFlow 187 Type: OFPT_PACKET_OUT
611 0.605555108 172.31.31.144 -> 172.31.23.72 OpenFlow 187 Type: OFPT_PACKET_OUT
612 0.605557197 172.31.31.144 -> 172.31.23.72 OpenFlow 187 Type: OFPT_PACKET_OUT
613 0.605562113 172.31.23.72 -> 172.31.31.144 OpenFlow 189 Type: OFPT_PACKET_IN
614 0.605568396 172.31.31.144 -> 172.31.23.72 OpenFlow 187 Type: OFPT_PACKET_OUT
615 0.605571106 172.31.31.144 -> 172.31.23.72 OpenFlow 187 Type: OFPT_PACKET_OUT
616 0.605572931 172.31.31.144 -> 172.31.23.72 OpenFlow 187 Type: OFPT_PACKET_OUT
617 0.605574863 172.31.31.144 -> 172.31.23.72 OpenFlow 187 Type: OFPT_PACKET_OUT
618 0.605576702 172.31.31.144 -> 172.31.23.72 OpenFlow 187 Type: OFPT_PACKET_OUT
619 0.605577972 172.31.31.144 -> 172.31.23.72 OpenFlow 187 Type: OFPT_PACKET_OUT
620 0.605579562 172.31.31.144 -> 172.31.23.72 OpenFlow 187 Type: OFPT_PACKET_OUT
621 0.605580945 172.31.31.144 -> 172.31.23.72 TCP 66 6633 → 45444 [ACK] Seq=1211 Ack=370 Win=853 Len=0 TSval=804483 TSecr=19374607
622 0.605585029 172.31.23.72 -> 172.31.31.144 OpenFlow 189 Type: OFPT_PACKET_IN
623 0.605586706 172.31.31.144 -> 172.31.23.72 OpenFlow 187 Type: OFPT_PACKET_OUT
624 0.605589682 172.31.23.72 -> 172.31.31.144 OpenFlow 189 Type: OFPT_PACKET_IN
625 0.605590786 172.31.31.144 -> 172.31.23.72 OpenFlow 308 Type: OFPT_PACKET_OUT
626 0.605593022 172.31.31.144 -> 172.31.23.72 OpenFlow 187 Type: OFPT_PACKET_OUT
627 0.605595063 172.31.31.144 -> 172.31.23.72 OpenFlow 187 Type: OFPT_PACKET_OUT
628 0.605597478 172.31.31.144 -> 172.31.23.72 TCP 66 6633 → 45444 [ACK] Seq=1211 Ack=493 Win=853 Len=0 TSval=804483 TSecr=19374607
629 0.605599207 172.31.31.144 -> 172.31.23.72 TCP 66 6633 → 45438 [ACK] Seq=1615 Ack=1010 Win=853 Len=0 TSval=804483 TSecr=19374607
630 0.605601447 172.31.23.72 -> 172.31.31.144 OpenFlow 312 Type: OFPT_PACKET_IN
631 0.605603011 172.31.31.144 -> 172.31.23.72 OpenFlow 187 Type: OFPT_PACKET_OUT
632 0.605605599 172.31.31.144 -> 172.31.23.72 OpenFlow 187 Type: OFPT_PACKET_OUT
633 0.605607641 172.31.31.144 -> 172.31.23.72 OpenFlow 187 Type: OFPT_PACKET_OUT
634 0.605609064 172.31.31.144 -> 172.31.23.72 OpenFlow 187 Type: OFPT_PACKET_OUT
635 0.605610268 172.31.31.144 -> 172.31.23.72 OpenFlow 187 Type: OFPT_PACKET_OUT
636 0.605611772 172.31.31.144 -> 172.31.23.72 OpenFlow 187 Type: OFPT_PACKET_OUT
637 0.605613323 172.31.31.144 -> 172.31.23.72 OpenFlow 187 Type: OFPT_PACKET_OUT
638 0.605812182 172.31.23.72 -> 172.31.31.144 TCP 66 45414 → 6633 [ACK] Seq=541 Ack=791 Win=213 Len=0 TSval=19374608 TSecr=804482
639 0.605817615 172.31.23.72 -> 172.31.31.144 OpenFlow 681 Type: OFPT_PACKET_IN
640 0.605819681 172.31.23.72 -> 172.31.31.144 OpenFlow 435 Type: OFPT_PACKET_IN
641 0.605833274 172.31.23.72 -> 172.31.31.144 OpenFlow 189 Type: OFPT_PACKET_IN
642 0.606091299 172.31.23.72 -> 172.31.31.144 TCP 66 45454 → 6633 [ACK] Seq=739 Ack=969 Win=213 Len=0 TSval=19374608 TSecr=804482
643 0.606101216 172.31.31.144 -> 172.31.23.72 TCP 66 6633 → 45456 [ACK] Seq=969 Ack=370 Win=853 Len=0 TSval=804483 TSecr=19374607
644 0.606106064 172.31.31.144 -> 172.31.23.72 TCP 66 6633 → 45458 [ACK] Seq=1521 Ack=468 Win=853 Len=0 TSval=804483 TSecr=19374607
645 0.606108062 172.31.31.144 -> 172.31.23.72 TCP 66 6633 → 45454 [ACK] Seq=969 Ack=616 Win=853 Len=0 TSval=804483 TSecr=19374608
646 0.606109290 172.31.31.144 -> 172.31.23.72 TCP 66 6633 → 45444 [ACK] Seq=1211 Ack=616 Win=853 Len=0 TSval=804483 TSecr=19374608
647 0.606115028 172.31.23.72 -> 172.31.31.144 OpenFlow 189 Type: OFPT_PACKET_IN
648 0.606121720 172.31.23.72 -> 172.31.31.144 OpenFlow 189 Type: OFPT_PACKET_IN
649 0.606123494 172.31.23.72 -> 172.31.31.144 OpenFlow 189 Type: OFPT_PACKET_IN
650 0.606125200 172.31.23.72 -> 172.31.31.144 OpenFlow 435 Type: OFPT_PACKET_IN
651 0.606126789 172.31.23.72 -> 172.31.31.144 OpenFlow 189 Type: OFPT_PACKET_IN
652 0.606370798 172.31.23.72 -> 172.31.31.144 TCP 66 45448 → 6633 [ACK] Seq=923 Ack=1327 Win=213 Len=0 TSval=19374608 TSecr=804483
653 0.606615132 172.31.23.72 -> 172.31.31.144 TCP 66 45442 → 6633 [ACK] Seq=739 Ack=727 Win=213 Len=0 TSval=19374608 TSecr=804483
654 0.606742075 172.31.23.72 -> 172.31.31.144 OpenFlow 189 Type: OFPT_PACKET_IN
655 0.606763091 172.31.23.72 -> 172.31.31.144 OpenFlow 189 Type: OFPT_PACKET_IN
656 0.606783338 172.31.23.72 -> 172.31.31.144 OpenFlow 189 Type: OFPT_PACKET_IN
657 0.606801386 172.31.23.72 -> 172.31.31.144 OpenFlow 189 Type: OFPT_PACKET_IN
658 0.606817376 172.31.23.72 -> 172.31.31.144 OpenFlow 189 Type: OFPT_PACKET_IN
659 0.606873308 172.31.23.72 -> 172.31.31.144 OpenFlow 189 Type: OFPT_PACKET_IN
660 0.609120826 172.31.31.144 -> 172.31.23.72 TCP 66 6633 → 45416 [ACK] Seq=1417 Ack=840 Win=853 Len=0 TSval=804483 TSecr=19374608
661 0.609127872 172.31.31.144 -> 172.31.23.72 TCP 66 6633 → 45446 [ACK] Seq=1931 Ack=1128 Win=853 Len=0 TSval=804483 TSecr=19374608
662 0.609131532 172.31.23.72 -> 172.31.31.144 OpenFlow 312 Type: OFPT_PACKET_IN
663 0.609136455 172.31.31.144 -> 172.31.23.72 TCP 66 6633 → 45454 [ACK] Seq=969 Ack=739 Win=853 Len=0 TSval=804484 TSecr=19374608
664 0.609139254 172.31.31.144 -> 172.31.23.72 TCP 66 6633 → 45444 [ACK] Seq=1211 Ack=739 Win=853 Len=0 TSval=804484 TSecr=19374608
665 0.609141702 172.31.23.72 -> 172.31.31.144 OpenFlow 435 Type: OFPT_PACKET_IN
666 0.609143359 172.31.31.144 -> 172.31.23.72 TCP 66 6633 → 45448 [ACK] Seq=1327 Ack=923 Win=853 Len=0 TSval=804484 TSecr=19374608
667 0.609145463 172.31.31.144 -> 172.31.23.72 TCP 66 6633 → 45438 [ACK] Seq=1615 Ack=1379 Win=853 Len=0 TSval=804484 TSecr=19374608
668 0.609147207 172.31.31.144 -> 172.31.23.72 TCP 66 6633 → 45458 [ACK] Seq=1521 Ack=1083 Win=853 Len=0 TSval=804484 TSecr=19374608
669 0.609149240 172.31.31.144 -> 172.31.23.72 TCP 66 6633 → 45456 [ACK] Seq=969 Ack=739 Win=853 Len=0 TSval=804484 TSecr=19374608
670 0.609151365 172.31.23.72 -> 172.31.31.144 OpenFlow 189 Type: OFPT_PACKET_IN
671 0.609152725 172.31.31.144 -> 172.31.23.72 TCP 66 6633 → 45462 [ACK] Seq=1159 Ack=509 Win=853 Len=0 TSval=804484 TSecr=19374608
672 0.609155447 172.31.23.72 -> 172.31.31.144 OpenFlow 189 Type: OFPT_PACKET_IN
673 0.609156991 172.31.31.144 -> 172.31.23.72 TCP 66 6633 → 45430 [ACK] Seq=2211 Ack=1553 Win=853 Len=0 TSval=804484 TSecr=19374608
674 0.609158982 172.31.31.144 -> 172.31.23.72 TCP 66 6633 → 45428 [ACK] Seq=1007 Ack=549 Win=853 Len=0 TSval=804484 TSecr=19374608
675 0.609160949 172.31.31.144 -> 172.31.23.72 TCP 66 6633 → 45416 [ACK] Seq=1417 Ack=963 Win=853 Len=0 TSval=804484 TSecr=19374608
676 0.609162877 172.31.31.144 -> 172.31.23.72 TCP 66 6633 → 45446 [ACK] Seq=1931 Ack=1497 Win=853 Len=0 TSval=804484 TSecr=19374608
677 0.609164667 172.31.31.144 -> 172.31.23.72 TCP 66 6633 → 45460 [ACK] Seq=1495 Ack=599 Win=853 Len=0 TSval=804484 TSecr=19374608
678 0.609167139 172.31.23.72 -> 172.31.31.144 OpenFlow 312 Type: OFPT_PACKET_IN
679 0.609328767 172.31.23.72 -> 172.31.31.144 OpenFlow 435 Type: OFPT_PACKET_IN
680 0.609342203 172.31.23.72 -> 172.31.31.144 OpenFlow 189 Type: OFPT_PACKET_IN
681 0.609343892 172.31.23.72 -> 172.31.31.144 OpenFlow 189 Type: OFPT_PACKET_IN
682 0.609652686 172.31.31.144 -> 172.31.23.72 TCP 66 6633 → 45444 [ACK] Seq=1211 Ack=862 Win=853 Len=0 TSval=804484 TSecr=19374608
683 0.609654833 172.31.31.144 -> 172.31.23.72 TCP 66 6633 → 45456 [ACK] Seq=969 Ack=862 Win=853 Len=0 TSval=804484 TSecr=19374608
684 0.609656968 172.31.31.144 -> 172.31.23.72 TCP 66 6633 → 45446 [ACK] Seq=1931 Ack=1743 Win=853 Len=0 TSval=804484 TSecr=19374609
685 0.609658589 172.31.31.144 -> 172.31.23.72 TCP 66 6633 → 45456 [ACK] Seq=969 Ack=985 Win=853 Len=0 TSval=804484 TSecr=19374609
686 0.609708569 172.31.31.144 -> 172.31.23.72 TCP 66 6633 → 45462 [ACK] Seq=1159 Ack=755 Win=853 Len=0 TSval=804484 TSecr=19374608
687 0.609731048 172.31.31.144 -> 172.31.23.72 TCP 66 6633 → 45444 [ACK] Seq=1211 Ack=1231 Win=853 Len=0 TSval=804484 TSecr=19374609
688 0.609753015 172.31.31.144 -> 172.31.23.72 TCP 66 6633 → 45434 [ACK] Seq=1275 Ack=1279 Win=853 Len=0 TSval=804484 TSecr=19374608
689 0.609772867 172.31.31.144 -> 172.31.23.72 TCP 66 6633 → 45424 [ACK] Seq=1763 Ack=1209 Win=853 Len=0 TSval=804484 TSecr=19374608
690 0.609944775 172.31.31.144 -> 172.31.23.72 TCP 66 6633 → 45452 [ACK] Seq=969 Ack=739 Win=853 Len=0 TSval=804484 TSecr=19374608
691 0.648664291 172.31.31.144 -> 172.31.23.72 TCP 66 6633 → 45460 [ACK] Seq=1495 Ack=845 Win=853 Len=0 TSval=804494 TSecr=19374609
692 0.699030364 172.31.31.144 -> 172.31.23.72 OpenFlow 90 Type: OFPT_MULTIPART_REQUEST, OFPMP_GROUP
693 0.699054207 172.31.31.144 -> 172.31.23.72 OpenFlow 90 Type: OFPT_MULTIPART_REQUEST, OFPMP_GROUP
694 0.699057491 172.31.31.144 -> 172.31.23.72 OpenFlow 82 Type: OFPT_MULTIPART_REQUEST, OFPMP_GROUP_DESC
695 0.699060061 172.31.31.144 -> 172.31.23.72 OpenFlow 106 Type: OFPT_MULTIPART_REQUEST, OFPMP_METER
696 0.699061459 172.31.31.144 -> 172.31.23.72 OpenFlow 90 Type: OFPT_MULTIPART_REQUEST, OFPMP_METER
697 0.699062910 172.31.31.144 -> 172.31.23.72 OpenFlow 187 Type: OFPT_PACKET_OUT
698 0.699065992 172.31.31.144 -> 172.31.23.72 OpenFlow 187 Type: OFPT_PACKET_OUT
699 0.699068099 172.31.31.144 -> 172.31.23.72 OpenFlow 187 Type: OFPT_PACKET_OUT
700 0.699069886 172.31.31.144 -> 172.31.23.72 OpenFlow 187 Type: OFPT_PACKET_OUT
701 0.699071317 172.31.31.144 -> 172.31.23.72 OpenFlow 187 Type: OFPT_PACKET_OUT
702 0.699072902 172.31.31.144 -> 172.31.23.72 OpenFlow 187 Type: OFPT_PACKET_OUT
703 0.699074600 172.31.31.144 -> 172.31.23.72 OpenFlow 187 Type: OFPT_PACKET_OUT
704 0.699076301 172.31.31.144 -> 172.31.23.72 OpenFlow 187 Type: OFPT_PACKET_OUT
705 0.699077539 172.31.31.144 -> 172.31.23.72 OpenFlow 187 Type: OFPT_PACKET_OUT
706 0.699078863 172.31.31.144 -> 172.31.23.72 OpenFlow 187 Type: OFPT_PACKET_OUT
707 0.699079987 172.31.31.144 -> 172.31.23.72 OpenFlow 187 Type: OFPT_PACKET_OUT
708 0.699082435 172.31.31.144 -> 172.31.23.72 OpenFlow 187 Type: OFPT_PACKET_OUT
709 0.699084279 172.31.31.144 -> 172.31.23.72 OpenFlow 187 Type: OFPT_PACKET_OUT
710 0.699085841 172.31.31.144 -> 172.31.23.72 OpenFlow 187 Type: OFPT_PACKET_OUT
711 0.699087267 172.31.31.144 -> 172.31.23.72 OpenFlow 187 Type: OFPT_PACKET_OUT
712 0.699088490 172.31.31.144 -> 172.31.23.72 OpenFlow 187 Type: OFPT_PACKET_OUT
713 0.699302759 172.31.23.72 -> 172.31.31.144 OpenFlow 82 Type: OFPT_MULTIPART_REPLY, OFPMP_GROUP
714 0.699402055 172.31.23.72 -> 172.31.31.144 OpenFlow 82 Type: OFPT_MULTIPART_REPLY, OFPMP_GROUP
715 0.699916046 172.31.23.72 -> 172.31.31.144 TCP 66 45426 → 6633 [ACK] Seq=1377 Ack=1827 Win=213 Len=0 TSval=19374632 TSecr=804506
716 0.699973764 172.31.23.72 -> 172.31.31.144 OpenFlow 189 Type: OFPT_PACKET_IN
717 0.700296100 172.31.23.72 -> 172.31.31.144 OpenFlow 189 Type: OFPT_PACKET_IN
718 0.700315121 172.31.23.72 -> 172.31.31.144 OpenFlow 189 Type: OFPT_PACKET_IN
719 0.700327960 172.31.23.72 -> 172.31.31.144 OpenFlow 189 Type: OFPT_PACKET_IN
720 0.700353362 172.31.23.72 -> 172.31.31.144 OpenFlow 189 Type: OFPT_PACKET_IN
721 0.700365496 172.31.23.72 -> 172.31.31.144 OpenFlow 189 Type: OFPT_PACKET_IN
722 0.700412659 172.31.23.72 -> 172.31.31.144 OpenFlow 189 Type: OFPT_PACKET_IN
723 0.700770789 172.31.23.72 -> 172.31.31.144 OpenFlow 98 Type: OFPT_MULTIPART_REPLY, OFPMP_METER
724 0.700777369 172.31.23.72 -> 172.31.31.144 OpenFlow 98 Type: OFPT_MULTIPART_REPLY, OFPMP_METER
725 0.700778986 172.31.23.72 -> 172.31.31.144 OpenFlow 189 Type: OFPT_PACKET_IN
726 0.700780605 172.31.23.72 -> 172.31.31.144 OpenFlow 189 Type: OFPT_PACKET_IN
727 0.700782129 172.31.23.72 -> 172.31.31.144 OpenFlow 189 Type: OFPT_PACKET_IN
728 0.700783949 172.31.23.72 -> 172.31.31.144 OpenFlow 435 Type: OFPT_PACKET_IN
729 0.701004937 172.31.31.144 -> 172.31.23.72 TCP 66 6633 → 45444 [ACK] Seq=1275 Ack=1247 Win=853 Len=0 TSval=804507 TSecr=19374631
730 0.701010943 172.31.31.144 -> 172.31.23.72 TCP 66 6633 → 45422 [ACK] Seq=791 Ack=664 Win=853 Len=0 TSval=804507 TSecr=19374632
731 0.701013711 172.31.31.144 -> 172.31.23.72 TCP 66 6633 → 45442 [ACK] Seq=791 Ack=755 Win=853 Len=0 TSval=804507 TSecr=19374631
732 0.701019244 172.31.23.72 -> 172.31.31.144 OpenFlow 189 Type: OFPT_PACKET_IN
733 0.701024188 172.31.23.72 -> 172.31.31.144 OpenFlow 189 Type: OFPT_PACKET_IN
734 0.701026288 172.31.23.72 -> 172.31.31.144 OpenFlow 189 Type: OFPT_PACKET_IN
735 0.704419064 172.31.31.144 -> 172.31.23.72 TCP 66 6633 → 45426 [ACK] Seq=1827 Ack=1500 Win=853 Len=0 TSval=804507 TSecr=19374632
736 0.704424398 172.31.31.144 -> 172.31.23.72 TCP 66 6633 → 45444 [ACK] Seq=1275 Ack=1279 Win=853 Len=0 TSval=804507 TSecr=19374632
737 0.704426643 172.31.31.144 -> 172.31.23.72 TCP 66 6633 → 45442 [ACK] Seq=791 Ack=787 Win=853 Len=0 TSval=804507 TSecr=19374632
738 0.704428646 172.31.31.144 -> 172.31.23.72 TCP 66 6633 → 45422 [ACK] Seq=791 Ack=787 Win=853 Len=0 TSval=804507 TSecr=19374632
739 0.704430303 172.31.31.144 -> 172.31.23.72 TCP 66 6633 → 45420 [ACK] Seq=1249 Ack=795 Win=853 Len=0 TSval=804507 TSecr=19374632
740 0.704432847 172.31.31.144 -> 172.31.23.72 TCP 66 6633 → 45424 [ACK] Seq=1763 Ack=1455 Win=853 Len=0 TSval=804507 TSecr=19374632
741 0.704435184 172.31.31.144 -> 172.31.23.72 TCP 66 6633 → 45418 [ACK] Seq=2251 Ack=1385 Win=853 Len=0 TSval=804507 TSecr=19374632
742 0.704437605 172.31.31.144 -> 172.31.23.72 TCP 66 6633 → 45430 [ACK] Seq=2211 Ack=1799 Win=853 Len=0 TSval=804508 TSecr=19374632
743 0.704439733 172.31.31.144 -> 172.31.23.72 TCP 66 6633 → 45428 [ACK] Seq=1007 Ack=795 Win=853 Len=0 TSval=804508 TSecr=19374632
744 0.704441829 172.31.31.144 -> 172.31.23.72 TCP 66 6633 → 45426 [ACK] Seq=1827 Ack=1623 Win=853 Len=0 TSval=804508 TSecr=19374632
745 0.998365608 172.31.31.144 -> 172.31.23.72 OpenFlow 90 Type: OFPT_MULTIPART_REQUEST, OFPMP_GROUP
746 0.998392712 172.31.31.144 -> 172.31.23.72 OpenFlow 90 Type: OFPT_MULTIPART_REQUEST, OFPMP_GROUP
747 0.998401988 172.31.31.144 -> 172.31.23.72 OpenFlow 90 Type: OFPT_MULTIPART_REQUEST, OFPMP_GROUP
748 0.998430167 172.31.31.144 -> 172.31.23.72 OpenFlow 90 Type: OFPT_MULTIPART_REQUEST, OFPMP_GROUP
749 0.998460515 172.31.31.144 -> 172.31.23.72 OpenFlow 106 Type: OFPT_MULTIPART_REQUEST, OFPMP_METER
750 0.998488589 172.31.31.144 -> 172.31.23.72 OpenFlow 106 Type: OFPT_MULTIPART_REQUEST, OFPMP_METER
751 0.998494768 172.31.23.72 -> 172.31.31.144 OpenFlow 82 Type: OFPT_MULTIPART_REPLY, OFPMP_GROUP
752 0.998519145 172.31.31.144 -> 172.31.23.72 OpenFlow 106 Type: OFPT_MULTIPART_REQUEST, OFPMP_METER
753 0.998546473 172.31.31.144 -> 172.31.23.72 OpenFlow 106 Type: OFPT_MULTIPART_REQUEST, OFPMP_METER
754 0.998575056 172.31.31.144 -> 172.31.23.72 OpenFlow 90 Type: OFPT_MULTIPART_REQUEST, OFPMP_GROUP
755 0.998581000 172.31.23.72 -> 172.31.31.144 OpenFlow 82 Type: OFPT_MULTIPART_REPLY, OFPMP_GROUP
756 0.998601456 172.31.31.144 -> 172.31.23.72 OpenFlow 106 Type: OFPT_MULTIPART_REQUEST, OFPMP_METER
757 0.998606021 172.31.23.72 -> 172.31.31.144 OpenFlow 98 Type: OFPT_MULTIPART_REPLY, OFPMP_METER
758 0.998637449 172.31.23.72 -> 172.31.31.144 OpenFlow 82 Type: OFPT_MULTIPART_REPLY, OFPMP_GROUP
759 0.998660444 172.31.23.72 -> 172.31.31.144 OpenFlow 98 Type: OFPT_MULTIPART_REPLY, OFPMP_METER
760 0.998690940 172.31.23.72 -> 172.31.31.144 OpenFlow 82 Type: OFPT_MULTIPART_REPLY, OFPMP_GROUP
761 0.998704839 172.31.23.72 -> 172.31.31.144 OpenFlow 82 Type: OFPT_MULTIPART_REPLY, OFPMP_GROUP_DESC
762 0.998720063 172.31.23.72 -> 172.31.31.144 OpenFlow 82 Type: OFPT_MULTIPART_REPLY, OFPMP_GROUP
763 0.998727971 172.31.23.72 -> 172.31.31.144 OpenFlow 82 Type: OFPT_MULTIPART_REPLY, OFPMP_METER
764 0.998770969 172.31.23.72 -> 172.31.31.144 OpenFlow 98 Type: OFPT_MULTIPART_REPLY, OFPMP_METER
765 0.998795780 172.31.31.144 -> 172.31.23.72 TCP 66 6633 → 45450 [ACK] Seq=791 Ack=509 Win=853 Len=0 TSval=804582 TSecr=19374706
766 0.998801219 172.31.31.144 -> 172.31.23.72 TCP 66 6633 → 45450 [ACK] Seq=791 Ack=541 Win=853 Len=0 TSval=804582 TSecr=19374706
767 0.998817653 172.31.31.144 -> 172.31.23.72 TCP 66 6633 → 45446 [ACK] Seq=1995 Ack=1759 Win=853 Len=0 TSval=804582 TSecr=19374706
768 0.998846841 172.31.31.144 -> 172.31.23.72 TCP 66 6633 → 45446 [ACK] Seq=1995 Ack=1791 Win=853 Len=0 TSval=804582 TSecr=19374706
769 0.998874873 172.31.31.144 -> 172.31.23.72 TCP 66 6633 → 45454 [ACK] Seq=1033 Ack=755 Win=853 Len=0 TSval=804582 TSecr=19374706
770 0.998885893 172.31.23.72 -> 172.31.31.144 OpenFlow 82 Type: OFPT_MULTIPART_REPLY, OFPMP_GROUP_DESC
771 0.998906877 172.31.31.144 -> 172.31.23.72 TCP 66 6633 → 45454 [ACK] Seq=1033 Ack=771 Win=853 Len=0 TSval=804582 TSecr=19374706
772 0.998912113 172.31.23.72 -> 172.31.31.144 OpenFlow 82 Type: OFPT_MULTIPART_REPLY, OFPMP_METER
773 0.998933003 172.31.31.144 -> 172.31.23.72 TCP 66 6633 → 45454 [ACK] Seq=1033 Ack=787 Win=853 Len=0 TSval=804582 TSecr=19374706
774 0.998955796 172.31.31.144 -> 172.31.23.72 TCP 66 6633 → 45448 [ACK] Seq=1391 Ack=971 Win=853 Len=0 TSval=804582 TSecr=19374706
775 0.999064930 172.31.31.144 -> 172.31.23.72 TCP 66 6633 → 45452 [ACK] Seq=1033 Ack=787 Win=853 Len=0 TSval=804582 TSecr=19374706
776 1.097560982 172.31.31.144 -> 172.31.23.72 OpenFlow 90 Type: OFPT_MULTIPART_REQUEST, OFPMP_GROUP
777 1.097589691 172.31.31.144 -> 172.31.23.72 OpenFlow 106 Type: OFPT_MULTIPART_REQUEST, OFPMP_METER
778 1.097610131 172.31.31.144 -> 172.31.23.72 OpenFlow 90 Type: OFPT_MULTIPART_REQUEST, OFPMP_GROUP
779 1.097614379 172.31.31.144 -> 172.31.23.72 OpenFlow 90 Type: OFPT_MULTIPART_REQUEST, OFPMP_GROUP
780 1.097637790 172.31.31.144 -> 172.31.23.72 OpenFlow 106 Type: OFPT_MULTIPART_REQUEST, OFPMP_METER
781 1.097667516 172.31.31.144 -> 172.31.23.72 OpenFlow 106 Type: OFPT_MULTIPART_REQUEST, OFPMP_METER
782 1.097881115 172.31.23.72 -> 172.31.31.144 OpenFlow 82 Type: OFPT_MULTIPART_REPLY, OFPMP_GROUP
783 1.097907676 172.31.23.72 -> 172.31.31.144 OpenFlow 98 Type: OFPT_MULTIPART_REPLY, OFPMP_METER
784 1.097926247 172.31.23.72 -> 172.31.31.144 OpenFlow 82 Type: OFPT_MULTIPART_REPLY, OFPMP_GROUP
785 1.097954580 172.31.23.72 -> 172.31.31.144 OpenFlow 98 Type: OFPT_MULTIPART_REPLY, OFPMP_METER
786 1.097962990 172.31.23.72 -> 172.31.31.144 OpenFlow 82 Type: OFPT_MULTIPART_REPLY, OFPMP_GROUP
787 1.097996988 172.31.23.72 -> 172.31.31.144 OpenFlow 98 Type: OFPT_MULTIPART_REPLY, OFPMP_METER
788 1.098104527 172.31.31.144 -> 172.31.23.72 TCP 66 6633 → 45460 [ACK] Seq=1559 Ack=861 Win=853 Len=0 TSval=804606 TSecr=19374731
789 1.098128448 172.31.31.144 -> 172.31.23.72 TCP 66 6633 → 45460 [ACK] Seq=1559 Ack=893 Win=853 Len=0 TSval=804606 TSecr=19374731
790 1.098156803 172.31.31.144 -> 172.31.23.72 TCP 66 6633 → 45458 [ACK] Seq=1585 Ack=1099 Win=853 Len=0 TSval=804606 TSecr=19374731
791 1.098184574 172.31.31.144 -> 172.31.23.72 TCP 66 6633 → 45458 [ACK] Seq=1585 Ack=1131 Win=853 Len=0 TSval=804606 TSecr=19374731
792 1.098212468 172.31.31.144 -> 172.31.23.72 TCP 66 6633 → 45456 [ACK] Seq=1033 Ack=1001 Win=853 Len=0 TSval=804606 TSecr=19374731
793 1.098241034 172.31.31.144 -> 172.31.23.72 TCP 66 6633 → 45456 [ACK] Seq=1033 Ack=1033 Win=853 Len=0 TSval=804606 TSecr=19374731
794 1.498288751 172.31.31.144 -> 172.31.23.72 OpenFlow 90 Type: OFPT_MULTIPART_REQUEST, OFPMP_GROUP
795 1.498311638 172.31.31.144 -> 172.31.23.72 OpenFlow 106 Type: OFPT_MULTIPART_REQUEST, OFPMP_METER
796 1.498414733 172.31.23.72 -> 172.31.31.144 OpenFlow 82 Type: OFPT_MULTIPART_REPLY, OFPMP_GROUP
797 1.498453331 172.31.23.72 -> 172.31.31.144 OpenFlow 98 Type: OFPT_MULTIPART_REPLY, OFPMP_METER
798 1.498677697 172.31.31.144 -> 172.31.23.72 TCP 66 6633 → 45462 [ACK] Seq=1223 Ack=803 Win=853 Len=0 TSval=804707 TSecr=19374831
799 2.280604881 172.31.23.72 -> 172.31.0.2   DNS 102 Standard query 0x5f05 A ip-172-31-23-72.eu-west-1.compute.internal
800 2.280617989 172.31.23.72 -> 172.31.0.2   DNS 102 Standard query 0x60d2 AAAA ip-172-31-23-72.eu-west-1.compute.internal
801 2.281059480   172.31.0.2 -> 172.31.23.72 DNS 163 Standard query response 0x60d2 AAAA ip-172-31-23-72.eu-west-1.compute.internal SOA ns0.eu-west-1.compute.internal
802 2.281653010   172.31.0.2 -> 172.31.23.72 DNS 118 Standard query response 0x5f05 A ip-172-31-23-72.eu-west-1.compute.internal A 172.31.23.72
