  1 0.000000000 137.158.125.247 -> 172.31.24.227 TCP 54 63468 → 22 [ACK] Seq=1 Ack=1 Win=32104 Len=0
  2 0.088088597 137.158.125.247 -> 172.31.24.227 TCP 54 63468 → 22 [ACK] Seq=1 Ack=97 Win=32056 Len=0
  3 0.687252908 172.31.24.227 -> 137.158.125.247 SSH 98 Server: Encrypted packet (len=44)
  4 0.895879248 137.158.125.247 -> 172.31.24.227 TCP 54 63468 → 22 [ACK] Seq=1 Ack=141 Win=32768 Len=0
  5 1.191920168 172.31.24.227 -> 137.158.125.247 SSH 98 Server: Encrypted packet (len=44)
  6 1.403531232 137.158.125.247 -> 172.31.24.227 TCP 54 63468 → 22 [ACK] Seq=1 Ack=185 Win=32746 Len=0
  7 1.508491014 172.31.31.144 -> 172.31.24.227 TCP 187 6633 → 53158 [PSH, ACK] Seq=1 Ack=1 Win=853 Len=121 TSval=1797392 TSecr=388689773
  8 1.508514103 172.31.31.144 -> 172.31.24.227 TCP 187 6633 → 53158 [PSH, ACK] Seq=122 Ack=1 Win=853 Len=121 TSval=1797392 TSecr=388689773
  9 1.508518936 172.31.31.144 -> 172.31.24.227 TCP 187 6633 → 53158 [PSH, ACK] Seq=243 Ack=1 Win=853 Len=121 TSval=1797392 TSecr=388689773
 10 1.508533585 172.31.31.144 -> 172.31.24.227 TCP 187 6633 → 53158 [PSH, ACK] Seq=364 Ack=1 Win=853 Len=121 TSval=1797392 TSecr=388689773
 11 1.508594446 172.31.31.144 -> 172.31.24.227 TCP 187 6633 → 53158 [PSH, ACK] Seq=485 Ack=1 Win=853 Len=121 TSval=1797392 TSecr=388689773
 12 1.508632624 172.31.31.144 -> 172.31.24.227 TCP 187 6633 → 53158 [PSH, ACK] Seq=606 Ack=1 Win=853 Len=121 TSval=1797392 TSecr=388689773
 13 1.508688596 172.31.31.144 -> 172.31.24.227 TCP 187 6633 → 53158 [PSH, ACK] Seq=727 Ack=1 Win=853 Len=121 TSval=1797392 TSecr=388689773
 14 1.508739402 172.31.31.144 -> 172.31.24.227 TCP 187 6633 → 53158 [PSH, ACK] Seq=848 Ack=1 Win=853 Len=121 TSval=1797392 TSecr=388689773
 15 1.508942599 172.31.31.144 -> 172.31.24.227 TCP 187 6633 → 53156 [PSH, ACK] Seq=1 Ack=1 Win=853 Len=121 TSval=1797392 TSecr=388689792
 16 1.508949633 172.31.31.144 -> 172.31.24.227 TCP 187 6633 → 53156 [PSH, ACK] Seq=122 Ack=1 Win=853 Len=121 TSval=1797392 TSecr=388689792
 17 1.509069059 172.31.24.227 -> 172.31.31.144 TCP 66 53158 → 6633 [ACK] Seq=1 Ack=969 Win=213 Len=0 TSval=388690247 TSecr=1797392
 18 1.509095704 172.31.31.144 -> 172.31.24.227 TCP 187 6633 → 53156 [PSH, ACK] Seq=243 Ack=1 Win=853 Len=121 TSval=1797392 TSecr=388689792
 19 1.509100145 172.31.31.144 -> 172.31.24.227 TCP 187 6633 → 53156 [PSH, ACK] Seq=364 Ack=1 Win=853 Len=121 TSval=1797392 TSecr=388689792
 20 1.509102796 172.31.31.144 -> 172.31.24.227 TCP 187 6633 → 53156 [PSH, ACK] Seq=485 Ack=1 Win=853 Len=121 TSval=1797392 TSecr=388689792
 21 1.509139088 172.31.31.144 -> 172.31.24.227 TCP 187 6633 → 53156 [PSH, ACK] Seq=606 Ack=1 Win=853 Len=121 TSval=1797392 TSecr=388689792
 22 1.509221536 172.31.31.144 -> 172.31.24.227 TCP 187 6633 → 53156 [PSH, ACK] Seq=727 Ack=1 Win=853 Len=121 TSval=1797392 TSecr=388689792
 23 1.509228976 172.31.24.227 -> 172.31.31.144 OpenFlow 189 Type: OFPT_PACKET_IN
 24 1.509294280 172.31.31.144 -> 172.31.24.227 TCP 187 6633 → 53156 [PSH, ACK] Seq=848 Ack=1 Win=853 Len=121 TSval=1797392 TSecr=388689792
 25 1.509299791 172.31.31.144 -> 172.31.24.227 TCP 187 6633 → 53154 [PSH, ACK] Seq=1 Ack=1 Win=853 Len=121 TSval=1797392 TSecr=388689772
 26 1.509308373 172.31.24.227 -> 172.31.31.144 OpenFlow 189 Type: OFPT_PACKET_IN
 27 1.509326742 172.31.24.227 -> 172.31.31.144 OpenFlow 189 Type: OFPT_PACKET_IN
 28 1.509340178 172.31.31.144 -> 172.31.24.227 TCP 187 6633 → 53154 [PSH, ACK] Seq=122 Ack=1 Win=853 Len=121 TSval=1797392 TSecr=388689772
 29 1.509404627 172.31.24.227 -> 172.31.31.144 OpenFlow 189 Type: OFPT_PACKET_IN
 30 1.509444607 172.31.24.227 -> 172.31.31.144 OpenFlow 189 Type: OFPT_PACKET_IN
 31 1.509452688 172.31.31.144 -> 172.31.24.227 TCP 187 6633 → 53154 [PSH, ACK] Seq=243 Ack=1 Win=853 Len=121 TSval=1797392 TSecr=388689772
 32 1.509456677 172.31.31.144 -> 172.31.24.227 TCP 187 6633 → 53154 [PSH, ACK] Seq=364 Ack=1 Win=853 Len=121 TSval=1797392 TSecr=388689772
 33 1.509481055 172.31.24.227 -> 172.31.31.144 OpenFlow 189 Type: OFPT_PACKET_IN
 34 1.509663959 172.31.31.144 -> 172.31.24.227 TCP 66 6633 → 53198 [ACK] Seq=1 Ack=124 Win=853 Len=0 TSval=1797392 TSecr=388690248
 35 1.509672561 172.31.31.144 -> 172.31.24.227 TCP 66 6633 → 53198 [ACK] Seq=1 Ack=247 Win=853 Len=0 TSval=1797392 TSecr=388690248
 36 1.509755876 172.31.24.227 -> 172.31.31.144 TCP 66 53154 → 6633 [ACK] Seq=1 Ack=485 Win=213 Len=0 TSval=388690248 TSecr=1797392
 37 1.509881094 172.31.31.144 -> 172.31.24.227 TCP 66 6633 → 53164 [ACK] Seq=1 Ack=247 Win=853 Len=0 TSval=1797392 TSecr=388690247
 38 1.510159358 172.31.24.227 -> 172.31.31.144 TCP 66 53156 → 6633 [ACK] Seq=1 Ack=969 Win=213 Len=0 TSval=388690248 TSecr=1797392
 39 1.510240182 172.31.24.227 -> 172.31.31.144 OpenFlow 189 Type: OFPT_PACKET_IN
 40 1.510263877 172.31.31.144 -> 172.31.24.227 TCP 66 6633 → 53174 [ACK] Seq=1 Ack=247 Win=853 Len=0 TSval=1797392 TSecr=388690248
 41 1.510273428 172.31.24.227 -> 172.31.31.144 OpenFlow 189 Type: OFPT_PACKET_IN
 42 1.510302746 172.31.24.227 -> 172.31.31.144 OpenFlow 189 Type: OFPT_PACKET_IN
 43 1.510320487 172.31.24.227 -> 172.31.31.144 OpenFlow 189 Type: OFPT_PACKET_IN
 44 1.510334809 172.31.24.227 -> 172.31.31.144 OpenFlow 189 Type: OFPT_PACKET_IN
 45 1.510359985 172.31.24.227 -> 172.31.31.144 OpenFlow 189 Type: OFPT_PACKET_IN
 46 1.510397578 172.31.24.227 -> 172.31.31.144 OpenFlow 435 Type: OFPT_PACKET_IN
 47 1.510403913 172.31.24.227 -> 172.31.31.144 OpenFlow 189 Type: OFPT_PACKET_IN
 48 1.510408153 172.31.24.227 -> 172.31.31.144 OpenFlow 189 Type: OFPT_PACKET_IN
 49 1.510458792 172.31.31.144 -> 172.31.24.227 TCP 66 6633 → 53160 [ACK] Seq=1 Ack=124 Win=853 Len=0 TSval=1797392 TSecr=388690248
 50 1.510464781 172.31.31.144 -> 172.31.24.227 TCP 66 6633 → 53160 [ACK] Seq=1 Ack=247 Win=853 Len=0 TSval=1797392 TSecr=388690248
 51 1.510529124 172.31.24.227 -> 172.31.31.144 OpenFlow 189 Type: OFPT_PACKET_IN
 52 1.510628692 172.31.31.144 -> 172.31.24.227 TCP 66 6633 → 53172 [ACK] Seq=1 Ack=124 Win=853 Len=0 TSval=1797392 TSecr=388690248
 53 1.510635585 172.31.31.144 -> 172.31.24.227 TCP 187 6633 → 53152 [PSH, ACK] Seq=1 Ack=1 Win=853 Len=121 TSval=1797392 TSecr=388689773
 54 1.510641274 172.31.31.144 -> 172.31.24.227 TCP 913 6633 → 53152 [PSH, ACK] Seq=122 Ack=1 Win=853 Len=847 TSval=1797392 TSecr=388689773
 55 1.510675147 172.31.31.144 -> 172.31.24.227 TCP 66 6633 → 53172 [ACK] Seq=1 Ack=247 Win=853 Len=0 TSval=1797392 TSecr=388690248
 56 1.510799574 172.31.31.144 -> 172.31.24.227 TCP 66 6633 → 53180 [ACK] Seq=1 Ack=124 Win=853 Len=0 TSval=1797392 TSecr=388690248
 57 1.510809680 172.31.31.144 -> 172.31.24.227 TCP 187 6633 → 53190 [PSH, ACK] Seq=1 Ack=1 Win=853 Len=121 TSval=1797392 TSecr=388689773
 58 1.510813980 172.31.31.144 -> 172.31.24.227 TCP 429 6633 → 53190 [PSH, ACK] Seq=122 Ack=1 Win=853 Len=363 TSval=1797392 TSecr=388689773
 59 1.510816979 172.31.31.144 -> 172.31.24.227 TCP 66 6633 → 53166 [ACK] Seq=1 Ack=247 Win=853 Len=0 TSval=1797392 TSecr=388690248
 60 1.510820222 172.31.31.144 -> 172.31.24.227 TCP 429 6633 → 53190 [PSH, ACK] Seq=485 Ack=1 Win=853 Len=363 TSval=1797392 TSecr=388689773
 61 1.510822742 172.31.31.144 -> 172.31.24.227 TCP 66 6633 → 53180 [ACK] Seq=1 Ack=247 Win=853 Len=0 TSval=1797392 TSecr=388690248
 62 1.510955577 172.31.31.144 -> 172.31.24.227 TCP 66 6633 → 53168 [ACK] Seq=1 Ack=493 Win=853 Len=0 TSval=1797392 TSecr=388690248
 63 1.511045521 172.31.24.227 -> 172.31.31.144 TCP 66 53152 → 6633 [ACK] Seq=1 Ack=969 Win=213 Len=0 TSval=388690248 TSecr=1797392
 64 1.511159099 172.31.24.227 -> 172.31.31.144 OpenFlow 189 Type: OFPT_PACKET_IN
 65 1.511170639 172.31.31.144 -> 172.31.24.227 TCP 187 6633 → 53154 [PSH, ACK] Seq=485 Ack=1 Win=853 Len=121 TSval=1797392 TSecr=388690248
 66 1.511177011 172.31.31.144 -> 172.31.24.227 TCP 187 6633 → 53154 [PSH, ACK] Seq=606 Ack=1 Win=853 Len=121 TSval=1797392 TSecr=388690248
 67 1.511179752 172.31.31.144 -> 172.31.24.227 OpenFlow 187 Type: OFPT_PACKET_OUT
 68 1.511182497 172.31.31.144 -> 172.31.24.227 OpenFlow 671 Type: OFPT_PACKET_OUT
 69 1.511197070 172.31.24.227 -> 172.31.31.144 OpenFlow 189 Type: OFPT_PACKET_IN
 70 1.511470409 172.31.31.144 -> 172.31.24.227 TCP 66 6633 → 53170 [ACK] Seq=727 Ack=247 Win=853 Len=0 TSval=1797392 TSecr=388690248
 71 1.511488337 172.31.24.227 -> 172.31.31.144 OpenFlow 189 Type: OFPT_PACKET_IN
 72 1.511508318 172.31.24.227 -> 172.31.31.144 OpenFlow 189 Type: OFPT_PACKET_IN
 73 1.511631382 172.31.31.144 -> 172.31.24.227 OpenFlow 187 Type: OFPT_PACKET_OUT
 74 1.511755886 172.31.31.144 -> 172.31.24.227 TCP 66 6633 → 53190 [ACK] Seq=969 Ack=124 Win=853 Len=0 TSval=1797392 TSecr=388690248
 75 1.511762470 172.31.31.144 -> 172.31.24.227 TCP 66 6633 → 53190 [ACK] Seq=969 Ack=247 Win=853 Len=0 TSval=1797392 TSecr=388690248
 76 1.511765105 172.31.31.144 -> 172.31.24.227 TCP 187 6633 → 53162 [PSH, ACK] Seq=1 Ack=1 Win=853 Len=121 TSval=1797393 TSecr=388689772
 77 1.511769310 172.31.31.144 -> 172.31.24.227 TCP 187 6633 → 53162 [PSH, ACK] Seq=122 Ack=1 Win=853 Len=121 TSval=1797393 TSecr=388689772
 78 1.511859963 172.31.31.144 -> 172.31.24.227 TCP 187 6633 → 53162 [PSH, ACK] Seq=243 Ack=1 Win=853 Len=121 TSval=1797393 TSecr=388689772
 79 1.511956113 172.31.24.227 -> 172.31.31.144 OpenFlow 189 Type: OFPT_PACKET_IN
 80 1.511969842 172.31.31.144 -> 172.31.24.227 TCP 187 6633 → 53162 [PSH, ACK] Seq=364 Ack=1 Win=853 Len=121 TSval=1797393 TSecr=388689772
 81 1.511983188 172.31.24.227 -> 172.31.31.144 OpenFlow 189 Type: OFPT_PACKET_IN
 82 1.512043675 172.31.31.144 -> 172.31.24.227 TCP 187 6633 → 53162 [PSH, ACK] Seq=485 Ack=1 Win=853 Len=121 TSval=1797393 TSecr=388689772
 83 1.512096461 172.31.24.227 -> 172.31.31.144 OpenFlow 189 Type: OFPT_PACKET_IN
 84 1.512112702 172.31.31.144 -> 172.31.24.227 TCP 187 6633 → 53162 [PSH, ACK] Seq=606 Ack=1 Win=853 Len=121 TSval=1797393 TSecr=388689772
 85 1.512175033 172.31.24.227 -> 172.31.31.144 OpenFlow 435 Type: OFPT_PACKET_IN
 86 1.512214904 172.31.31.144 -> 172.31.24.227 TCP 66 6633 → 53194 [ACK] Seq=1 Ack=124 Win=853 Len=0 TSval=1797393 TSecr=388690248
 87 1.512223480 172.31.31.144 -> 172.31.24.227 TCP 66 6633 → 53194 [ACK] Seq=1 Ack=247 Win=853 Len=0 TSval=1797393 TSecr=388690248
 88 1.512226409 172.31.31.144 -> 172.31.24.227 TCP 187 6633 → 53162 [PSH, ACK] Seq=727 Ack=1 Win=853 Len=121 TSval=1797393 TSecr=388689772
 89 1.512263256 172.31.24.227 -> 172.31.31.144 TCP 66 53154 → 6633 [ACK] Seq=1 Ack=727 Win=213 Len=0 TSval=388690248 TSecr=1797392
 90 1.512375006 172.31.24.227 -> 172.31.31.144 OpenFlow 189 Type: OFPT_PACKET_IN
 91 1.512394608 172.31.31.144 -> 172.31.24.227 TCP 66 6633 → 53152 [ACK] Seq=969 Ack=124 Win=853 Len=0 TSval=1797393 TSecr=388690248
 92 1.512400201 172.31.31.144 -> 172.31.24.227 TCP 66 6633 → 53152 [ACK] Seq=969 Ack=493 Win=853 Len=0 TSval=1797393 TSecr=388690248
 93 1.512406444 172.31.24.227 -> 172.31.31.144 OpenFlow 189 Type: OFPT_PACKET_IN
 94 1.512514856 172.31.31.144 -> 172.31.24.227 TCP 187 6633 → 53162 [PSH, ACK] Seq=848 Ack=1 Win=853 Len=121 TSval=1797393 TSecr=388689772
 95 1.512520782 172.31.31.144 -> 172.31.24.227 TCP 308 6633 → 53162 [PSH, ACK] Seq=969 Ack=1 Win=853 Len=242 TSval=1797393 TSecr=388689772
 96 1.512536402 172.31.31.144 -> 172.31.24.227 OpenFlow 187 Type: OFPT_PACKET_OUT
 97 1.512806649 172.31.31.144 -> 172.31.24.227 TCP 66 6633 → 53160 [ACK] Seq=122 Ack=493 Win=853 Len=0 TSval=1797393 TSecr=388690248
 98 1.512974115 172.31.24.227 -> 172.31.31.144 TCP 66 53162 → 6633 [ACK] Seq=1 Ack=1211 Win=213 Len=0 TSval=388690248 TSecr=1797393
 99 1.513051744 172.31.31.144 -> 172.31.24.227 OpenFlow 187 Type: OFPT_PACKET_OUT
100 1.513057411 172.31.31.144 -> 172.31.24.227 OpenFlow 187 Type: OFPT_PACKET_OUT
101 1.513081380 172.31.24.227 -> 172.31.31.144 OpenFlow 189 Type: OFPT_PACKET_IN
102 1.513101152 172.31.31.144 -> 172.31.24.227 OpenFlow 187 Type: OFPT_PACKET_OUT
103 1.513110143 172.31.24.227 -> 172.31.31.144 OpenFlow 189 Type: OFPT_PACKET_IN
104 1.513137104 172.31.24.227 -> 172.31.31.144 OpenFlow 189 Type: OFPT_PACKET_IN
105 1.513160963 172.31.24.227 -> 172.31.31.144 OpenFlow 189 Type: OFPT_PACKET_IN
106 1.513174895 172.31.31.144 -> 172.31.24.227 OpenFlow 187 Type: OFPT_PACKET_OUT
107 1.513203734 172.31.24.227 -> 172.31.31.144 OpenFlow 189 Type: OFPT_PACKET_IN
108 1.513209469 172.31.24.227 -> 172.31.31.144 OpenFlow 189 Type: OFPT_PACKET_IN
109 1.513221114 172.31.24.227 -> 172.31.31.144 OpenFlow 189 Type: OFPT_PACKET_IN
110 1.513244532 172.31.24.227 -> 172.31.31.144 OpenFlow 189 Type: OFPT_PACKET_IN
111 1.513264450 172.31.31.144 -> 172.31.24.227 OpenFlow 187 Type: OFPT_PACKET_OUT
112 1.513269209 172.31.31.144 -> 172.31.24.227 OpenFlow 187 Type: OFPT_PACKET_OUT
113 1.513302495 172.31.24.227 -> 172.31.31.144 OpenFlow 189 Type: OFPT_PACKET_IN
114 1.513336931 172.31.24.227 -> 172.31.31.144 OpenFlow 189 Type: OFPT_PACKET_IN
115 1.513441930 172.31.24.227 -> 172.31.31.144 OpenFlow 189 Type: OFPT_PACKET_IN
116 1.513453477 172.31.31.144 -> 172.31.24.227 TCP 66 6633 → 53172 [ACK] Seq=1 Ack=370 Win=853 Len=0 TSval=1797393 TSecr=388690248
117 1.513458644 172.31.31.144 -> 172.31.24.227 TCP 66 6633 → 53176 [ACK] Seq=1 Ack=124 Win=853 Len=0 TSval=1797393 TSecr=388690248
118 1.513461186 172.31.31.144 -> 172.31.24.227 TCP 66 6633 → 53172 [ACK] Seq=1 Ack=493 Win=853 Len=0 TSval=1797393 TSecr=388690248
119 1.513466451 172.31.24.227 -> 172.31.31.144 OpenFlow 189 Type: OFPT_PACKET_IN
120 1.513469098 172.31.24.227 -> 172.31.31.144 OpenFlow 189 Type: OFPT_PACKET_IN
121 1.513471254 172.31.24.227 -> 172.31.31.144 OpenFlow 189 Type: OFPT_PACKET_IN
122 1.513473604 172.31.24.227 -> 172.31.31.144 OpenFlow 189 Type: OFPT_PACKET_IN
123 1.513514824 172.31.31.144 -> 172.31.24.227 TCP 66 6633 → 53176 [ACK] Seq=1 Ack=247 Win=853 Len=0 TSval=1797393 TSecr=388690248
124 1.513520614 172.31.31.144 -> 172.31.24.227 TCP 66 6633 → 53186 [ACK] Seq=1 Ack=124 Win=853 Len=0 TSval=1797393 TSecr=388690248
125 1.513618088 172.31.24.227 -> 172.31.31.144 OpenFlow 189 Type: OFPT_PACKET_IN
126 1.513690033 172.31.31.144 -> 172.31.24.227 TCP 66 6633 → 53166 [ACK] Seq=1 Ack=493 Win=853 Len=0 TSval=1797393 TSecr=388690248
127 1.513696531 172.31.31.144 -> 172.31.24.227 TCP 66 6633 → 53192 [ACK] Seq=1 Ack=124 Win=853 Len=0 TSval=1797393 TSecr=388690249
128 1.513808189 172.31.31.144 -> 172.31.24.227 TCP 66 6633 → 53186 [ACK] Seq=1 Ack=247 Win=853 Len=0 TSval=1797393 TSecr=388690249
129 1.513814318 172.31.31.144 -> 172.31.24.227 TCP 66 6633 → 53192 [ACK] Seq=1 Ack=247 Win=853 Len=0 TSval=1797393 TSecr=388690249
130 1.513934070 172.31.24.227 -> 172.31.31.144 OpenFlow 189 Type: OFPT_PACKET_IN
131 1.513954553 172.31.24.227 -> 172.31.31.144 OpenFlow 189 Type: OFPT_PACKET_IN
132 1.513993808 172.31.24.227 -> 172.31.31.144 OpenFlow 189 Type: OFPT_PACKET_IN
133 1.514016041 172.31.24.227 -> 172.31.31.144 OpenFlow 189 Type: OFPT_PACKET_IN
134 1.514094213 172.31.24.227 -> 172.31.31.144 OpenFlow 189 Type: OFPT_PACKET_IN
135 1.514206353 172.31.24.227 -> 172.31.31.144 OpenFlow 189 Type: OFPT_PACKET_IN
136 1.514218839 172.31.31.144 -> 172.31.24.227 OpenFlow 187 Type: OFPT_PACKET_OUT
137 1.514223073 172.31.31.144 -> 172.31.24.227 TCP 66 6633 → 53162 [ACK] Seq=1211 Ack=124 Win=853 Len=0 TSval=1797393 TSecr=388690249
138 1.514226030 172.31.31.144 -> 172.31.24.227 TCP 66 6633 → 53162 [ACK] Seq=1211 Ack=247 Win=853 Len=0 TSval=1797393 TSecr=388690249
139 1.514228343 172.31.31.144 -> 172.31.24.227 TCP 66 6633 → 53172 [ACK] Seq=1 Ack=616 Win=853 Len=0 TSval=1797393 TSecr=388690249
140 1.514230527 172.31.31.144 -> 172.31.24.227 OpenFlow 187 Type: OFPT_PACKET_OUT
141 1.514232985 172.31.31.144 -> 172.31.24.227 TCP 66 6633 → 53172 [ACK] Seq=1 Ack=739 Win=853 Len=0 TSval=1797393 TSecr=388690249
142 1.514284824 172.31.24.227 -> 172.31.31.144 OpenFlow 189 Type: OFPT_PACKET_IN
143 1.514316926 172.31.31.144 -> 172.31.24.227 TCP 66 6633 → 53196 [ACK] Seq=1 Ack=247 Win=853 Len=0 TSval=1797393 TSecr=388690249
144 1.514323607 172.31.31.144 -> 172.31.24.227 OpenFlow 187 Type: OFPT_PACKET_OUT
145 1.514431646 172.31.24.227 -> 172.31.31.144 TCP 66 53166 → 6633 [ACK] Seq=493 Ack=364 Win=213 Len=0 TSval=388690249 TSecr=1797393
146 1.514446218 172.31.31.144 -> 172.31.24.227 OpenFlow 187 Type: OFPT_PACKET_OUT
147 1.514451806 172.31.31.144 -> 172.31.24.227 OpenFlow 308 Type: OFPT_PACKET_OUT
148 1.514454449 172.31.31.144 -> 172.31.24.227 TCP 66 6633 → 53194 [ACK] Seq=1 Ack=370 Win=853 Len=0 TSval=1797393 TSecr=388690249
149 1.514456868 172.31.31.144 -> 172.31.24.227 OpenFlow 187 Type: OFPT_PACKET_OUT
150 1.514536465 172.31.31.144 -> 172.31.24.227 OpenFlow 187 Type: OFPT_PACKET_OUT
151 1.514576323 172.31.24.227 -> 172.31.31.144 TCP 66 53166 → 6633 [ACK] Seq=493 Ack=606 Win=213 Len=0 TSval=388690249 TSecr=1797393
152 1.514634408 172.31.31.144 -> 172.31.24.227 OpenFlow 187 Type: OFPT_PACKET_OUT
153 1.514712989 172.31.31.144 -> 172.31.24.227 OpenFlow 187 Type: OFPT_PACKET_OUT
154 1.514762758 172.31.24.227 -> 172.31.31.144 TCP 66 53166 → 6633 [ACK] Seq=493 Ack=848 Win=213 Len=0 TSval=388690249 TSecr=1797393
155 1.514808167 172.31.31.144 -> 172.31.24.227 OpenFlow 187 Type: OFPT_PACKET_OUT
156 1.514896817 172.31.31.144 -> 172.31.24.227 OpenFlow 187 Type: OFPT_PACKET_OUT
157 1.514939937 172.31.24.227 -> 172.31.31.144 OpenFlow 189 Type: OFPT_PACKET_IN
158 1.514959228 172.31.24.227 -> 172.31.31.144 OpenFlow 189 Type: OFPT_PACKET_IN
159 1.515001966 172.31.24.227 -> 172.31.31.144 OpenFlow 189 Type: OFPT_PACKET_IN
160 1.515009361 172.31.31.144 -> 172.31.24.227 OpenFlow 187 Type: OFPT_PACKET_OUT
161 1.515039287 172.31.24.227 -> 172.31.31.144 OpenFlow 189 Type: OFPT_PACKET_IN
162 1.515045601 172.31.24.227 -> 172.31.31.144 OpenFlow 189 Type: OFPT_PACKET_IN
163 1.515111429 172.31.24.227 -> 172.31.31.144 OpenFlow 189 Type: OFPT_PACKET_IN
164 1.515198981 172.31.24.227 -> 172.31.31.144 OpenFlow 189 Type: OFPT_PACKET_IN
165 1.515255268 172.31.31.144 -> 172.31.24.227 TCP 66 6633 → 53190 [ACK] Seq=969 Ack=370 Win=853 Len=0 TSval=1797393 TSecr=388690249
166 1.515299535 172.31.24.227 -> 172.31.31.144 OpenFlow 189 Type: OFPT_PACKET_IN
167 1.515333229 172.31.31.144 -> 172.31.24.227 TCP 66 6633 → 53194 [ACK] Seq=1 Ack=493 Win=853 Len=0 TSval=1797393 TSecr=388690249
168 1.515338779 172.31.31.144 -> 172.31.24.227 TCP 66 6633 → 53190 [ACK] Seq=969 Ack=493 Win=853 Len=0 TSval=1797393 TSecr=388690249
169 1.515341275 172.31.31.144 -> 172.31.24.227 TCP 66 6633 → 53194 [ACK] Seq=1 Ack=616 Win=853 Len=0 TSval=1797393 TSecr=388690249
170 1.515387137 172.31.24.227 -> 172.31.31.144 TCP 66 53160 → 6633 [ACK] Seq=739 Ack=1211 Win=213 Len=0 TSval=388690249 TSecr=1797393
171 1.515513039 172.31.31.144 -> 172.31.24.227 OpenFlow 187 Type: OFPT_PACKET_OUT
172 1.515518816 172.31.31.144 -> 172.31.24.227 OpenFlow 429 Type: OFPT_PACKET_OUT
173 1.515521729 172.31.31.144 -> 172.31.24.227 OpenFlow 550 Type: OFPT_PACKET_OUT
174 1.515523943 172.31.31.144 -> 172.31.24.227 OpenFlow 308 Type: OFPT_PACKET_OUT
175 1.515526077 172.31.31.144 -> 172.31.24.227 OpenFlow 187 Type: OFPT_PACKET_OUT
176 1.515532749 172.31.31.144 -> 172.31.24.227 OpenFlow 550 Type: OFPT_PACKET_OUT
177 1.515538241 172.31.24.227 -> 172.31.31.144 TCP 66 53166 → 6633 [ACK] Seq=493 Ack=1211 Win=213 Len=0 TSval=388690249 TSecr=1797393
178 1.515618823 172.31.24.227 -> 172.31.31.144 OpenFlow 189 Type: OFPT_PACKET_IN
179 1.515637513 172.31.24.227 -> 172.31.31.144 OpenFlow 189 Type: OFPT_PACKET_IN
180 1.515688590 172.31.24.227 -> 172.31.31.144 OpenFlow 189 Type: OFPT_PACKET_IN
181 1.515705266 172.31.24.227 -> 172.31.31.144 OpenFlow 189 Type: OFPT_PACKET_IN
182 1.515753509 172.31.31.144 -> 172.31.24.227 TCP 66 6633 → 53156 [ACK] Seq=969 Ack=493 Win=853 Len=0 TSval=1797393 TSecr=388690249
183 1.515865043 172.31.24.227 -> 172.31.31.144 TCP 66 53188 → 6633 [ACK] Seq=247 Ack=606 Win=213 Len=0 TSval=388690249 TSecr=1797393
184 1.515871574 172.31.31.144 -> 172.31.24.227 TCP 66 6633 → 53186 [ACK] Seq=1 Ack=370 Win=853 Len=0 TSval=1797394 TSecr=388690249
185 1.515927756 172.31.31.144 -> 172.31.24.227 TCP 66 6633 → 53186 [ACK] Seq=1 Ack=493 Win=853 Len=0 TSval=1797394 TSecr=388690249
186 1.515966478 172.31.24.227 -> 172.31.31.144 OpenFlow 189 Type: OFPT_PACKET_IN
187 1.516081342 172.31.24.227 -> 172.31.31.144 OpenFlow 189 Type: OFPT_PACKET_IN
188 1.516146945 172.31.31.144 -> 172.31.24.227 TCP 66 6633 → 53194 [ACK] Seq=1 Ack=739 Win=853 Len=0 TSval=1797394 TSecr=388690249
189 1.516261154 172.31.31.144 -> 172.31.24.227 TCP 66 6633 → 53162 [ACK] Seq=1211 Ack=370 Win=853 Len=0 TSval=1797394 TSecr=388690249
190 1.516498044 172.31.24.227 -> 172.31.31.144 TCP 66 53164 → 6633 [ACK] Seq=247 Ack=1211 Win=213 Len=0 TSval=388690249 TSecr=1797393
191 1.516597183 172.31.24.227 -> 172.31.31.144 OpenFlow 189 Type: OFPT_PACKET_IN
192 1.516636667 172.31.31.144 -> 172.31.24.227 OpenFlow 187 Type: OFPT_PACKET_OUT
193 1.516644453 172.31.24.227 -> 172.31.31.144 OpenFlow 435 Type: OFPT_PACKET_IN
194 1.516753769 172.31.24.227 -> 172.31.31.144 OpenFlow 189 Type: OFPT_PACKET_IN
195 1.516794415 172.31.24.227 -> 172.31.31.144 OpenFlow 189 Type: OFPT_PACKET_IN
196 1.516800752 172.31.24.227 -> 172.31.31.144 OpenFlow 189 Type: OFPT_PACKET_IN
197 1.516854184 172.31.31.144 -> 172.31.24.227 TCP 66 6633 → 53176 [ACK] Seq=1 Ack=370 Win=853 Len=0 TSval=1797394 TSecr=388690249
198 1.516860467 172.31.31.144 -> 172.31.24.227 TCP 66 6633 → 53176 [ACK] Seq=1 Ack=739 Win=853 Len=0 TSval=1797394 TSecr=388690249
199 1.516881657 172.31.24.227 -> 172.31.31.144 OpenFlow 189 Type: OFPT_PACKET_IN
200 1.516925483 172.31.24.227 -> 172.31.31.144 OpenFlow 189 Type: OFPT_PACKET_IN
201 1.516946004 172.31.24.227 -> 172.31.31.144 OpenFlow 189 Type: OFPT_PACKET_IN
202 1.516962996 172.31.24.227 -> 172.31.31.144 OpenFlow 189 Type: OFPT_PACKET_IN
203 1.517038153 172.31.31.144 -> 172.31.24.227 TCP 66 6633 → 53198 [ACK] Seq=1 Ack=370 Win=853 Len=0 TSval=1797394 TSecr=388690249
204 1.517069938 172.31.31.144 -> 172.31.24.227 TCP 66 6633 → 53198 [ACK] Seq=1 Ack=493 Win=853 Len=0 TSval=1797394 TSecr=388690249
205 1.517093615 172.31.31.144 -> 172.31.24.227 TCP 66 6633 → 53158 [ACK] Seq=969 Ack=124 Win=853 Len=0 TSval=1797394 TSecr=388690249
206 1.517198698 172.31.31.144 -> 172.31.24.227 TCP 66 6633 → 53158 [ACK] Seq=969 Ack=247 Win=853 Len=0 TSval=1797394 TSecr=388690249
207 1.517204443 172.31.31.144 -> 172.31.24.227 OpenFlow 187 Type: OFPT_PACKET_OUT
208 1.517210419 172.31.31.144 -> 172.31.24.227 TCP 66 6633 → 53162 [ACK] Seq=1211 Ack=493 Win=853 Len=0 TSval=1797394 TSecr=388690249
209 1.517212863 172.31.31.144 -> 172.31.24.227 OpenFlow 671 Type: OFPT_PACKET_OUT
210 1.517215536 172.31.31.144 -> 172.31.24.227 TCP 66 6633 → 53170 [ACK] Seq=727 Ack=493 Win=853 Len=0 TSval=1797394 TSecr=388690249
211 1.517586177 172.31.31.144 -> 172.31.24.227 TCP 66 6633 → 53196 [ACK] Seq=1 Ack=493 Win=853 Len=0 TSval=1797394 TSecr=388690249
212 1.517611198 172.31.24.227 -> 172.31.31.144 TCP 66 53178 → 6633 [ACK] Seq=247 Ack=727 Win=213 Len=0 TSval=388690250 TSecr=1797394
213 1.517723533 172.31.24.227 -> 172.31.31.144 OpenFlow 189 Type: OFPT_PACKET_IN
214 1.517743021 172.31.24.227 -> 172.31.31.144 OpenFlow 189 Type: OFPT_PACKET_IN
215 1.517868787 172.31.24.227 -> 172.31.31.144 OpenFlow 189 Type: OFPT_PACKET_IN
216 1.517890791 172.31.24.227 -> 172.31.31.144 OpenFlow 189 Type: OFPT_PACKET_IN
217 1.517927213 172.31.31.144 -> 172.31.24.227 TCP 66 6633 → 53192 [ACK] Seq=1 Ack=370 Win=853 Len=0 TSval=1797394 TSecr=388690250
218 1.517932698 172.31.31.144 -> 172.31.24.227 TCP 66 6633 → 53192 [ACK] Seq=1 Ack=493 Win=853 Len=0 TSval=1797394 TSecr=388690250
219 1.517954241 172.31.24.227 -> 172.31.31.144 OpenFlow 189 Type: OFPT_PACKET_IN
220 1.517960241 172.31.24.227 -> 172.31.31.144 OpenFlow 189 Type: OFPT_PACKET_IN
221 1.518256288 172.31.31.144 -> 172.31.24.227 TCP 66 6633 → 53166 [ACK] Seq=1211 Ack=739 Win=853 Len=0 TSval=1797394 TSecr=388690250
222 1.518423846 172.31.31.144 -> 172.31.24.227 OpenFlow 187 Type: OFPT_PACKET_OUT
223 1.518566409 172.31.31.144 -> 172.31.24.227 TCP 66 6633 → 53168 [ACK] Seq=1 Ack=739 Win=853 Len=0 TSval=1797394 TSecr=388690250
224 1.518573461 172.31.31.144 -> 172.31.24.227 OpenFlow 187 Type: OFPT_PACKET_OUT
225 1.518631527 172.31.24.227 -> 172.31.31.144 TCP 66 53178 → 6633 [ACK] Seq=247 Ack=969 Win=213 Len=0 TSval=388690250 TSecr=1797394
226 1.518652336 172.31.31.144 -> 172.31.24.227 OpenFlow 187 Type: OFPT_PACKET_OUT
227 1.518741682 172.31.31.144 -> 172.31.24.227 OpenFlow 187 Type: OFPT_PACKET_OUT
228 1.518771714 172.31.24.227 -> 172.31.31.144 TCP 66 53178 → 6633 [ACK] Seq=247 Ack=1211 Win=213 Len=0 TSval=388690250 TSecr=1797394
229 1.518842091 172.31.31.144 -> 172.31.24.227 TCP 187 6633 → 53182 [PSH, ACK] Seq=1 Ack=1 Win=853 Len=121 TSval=1797394 TSecr=388689773
230 1.518937484 172.31.24.227 -> 172.31.31.144 OpenFlow 189 Type: OFPT_PACKET_IN
231 1.518948918 172.31.31.144 -> 172.31.24.227 TCP 187 6633 → 53182 [PSH, ACK] Seq=122 Ack=1 Win=853 Len=121 TSval=1797394 TSecr=388689773
232 1.518964667 172.31.24.227 -> 172.31.31.144 OpenFlow 189 Type: OFPT_PACKET_IN
233 1.519005374 172.31.24.227 -> 172.31.31.144 OpenFlow 189 Type: OFPT_PACKET_IN
234 1.519063661 172.31.31.144 -> 172.31.24.227 TCP 187 6633 → 53182 [PSH, ACK] Seq=243 Ack=1 Win=853 Len=121 TSval=1797394 TSecr=388689773
235 1.519071432 172.31.24.227 -> 172.31.31.144 OpenFlow 189 Type: OFPT_PACKET_IN
236 1.519077315 172.31.24.227 -> 172.31.31.144 OpenFlow 189 Type: OFPT_PACKET_IN
237 1.519184535 172.31.31.144 -> 172.31.24.227 TCP 187 6633 → 53182 [PSH, ACK] Seq=364 Ack=1 Win=853 Len=121 TSval=1797394 TSecr=388689773
238 1.519189956 172.31.31.144 -> 172.31.24.227 TCP 187 6633 → 53182 [PSH, ACK] Seq=485 Ack=1 Win=853 Len=121 TSval=1797394 TSecr=388689773
239 1.519251971 172.31.31.144 -> 172.31.24.227 TCP 66 6633 → 53186 [ACK] Seq=1 Ack=616 Win=853 Len=0 TSval=1797394 TSecr=388690250
240 1.519337641 172.31.31.144 -> 172.31.24.227 TCP 66 6633 → 53186 [ACK] Seq=1 Ack=739 Win=853 Len=0 TSval=1797394 TSecr=388690250
241 1.519376057 172.31.31.144 -> 172.31.24.227 TCP 66 6633 → 53184 [ACK] Seq=1 Ack=370 Win=853 Len=0 TSval=1797394 TSecr=388690250
242 1.519397028 172.31.24.227 -> 172.31.31.144 TCP 66 53182 → 6633 [ACK] Seq=1 Ack=606 Win=213 Len=0 TSval=388690250 TSecr=1797394
243 1.519474833 172.31.24.227 -> 172.31.31.144 OpenFlow 189 Type: OFPT_PACKET_IN
244 1.519516626 172.31.24.227 -> 172.31.31.144 OpenFlow 189 Type: OFPT_PACKET_IN
245 1.519587179 172.31.31.144 -> 172.31.24.227 TCP 187 6633 → 53182 [PSH, ACK] Seq=606 Ack=1 Win=853 Len=121 TSval=1797394 TSecr=388689773
246 1.519593344 172.31.31.144 -> 172.31.24.227 OpenFlow 187 Type: OFPT_PACKET_OUT
247 1.519595905 172.31.31.144 -> 172.31.24.227 OpenFlow 187 Type: OFPT_PACKET_OUT
248 1.519769725 172.31.31.144 -> 172.31.24.227 TCP 66 6633 → 53192 [ACK] Seq=1 Ack=616 Win=853 Len=0 TSval=1797395 TSecr=388690250
249 1.519793500 172.31.24.227 -> 172.31.31.144 TCP 66 53174 → 6633 [ACK] Seq=247 Ack=243 Win=213 Len=0 TSval=388690250 TSecr=1797394
250 1.519955178 172.31.31.144 -> 172.31.24.227 OpenFlow 187 Type: OFPT_PACKET_OUT
251 1.519961152 172.31.31.144 -> 172.31.24.227 OpenFlow 429 Type: OFPT_PACKET_OUT
252 1.519971555 172.31.24.227 -> 172.31.31.144 OpenFlow 189 Type: OFPT_PACKET_IN
253 1.520001816 172.31.24.227 -> 172.31.31.144 OpenFlow 189 Type: OFPT_PACKET_IN
254 1.520017268 172.31.24.227 -> 172.31.31.144 OpenFlow 189 Type: OFPT_PACKET_IN
255 1.520152549 172.31.31.144 -> 172.31.24.227 TCP 66 6633 → 53192 [ACK] Seq=1 Ack=739 Win=853 Len=0 TSval=1797395 TSecr=388690250
256 1.520210362 172.31.31.144 -> 172.31.24.227 TCP 66 6633 → 53196 [ACK] Seq=1 Ack=739 Win=853 Len=0 TSval=1797395 TSecr=388690250
257 1.520337663 172.31.24.227 -> 172.31.31.144 TCP 66 53174 → 6633 [ACK] Seq=247 Ack=727 Win=213 Len=0 TSval=388690250 TSecr=1797395
258 1.520420655 172.31.24.227 -> 172.31.31.144 OpenFlow 189 Type: OFPT_PACKET_IN
259 1.520489467 172.31.24.227 -> 172.31.31.144 OpenFlow 189 Type: OFPT_PACKET_IN
260 1.520629877 172.31.31.144 -> 172.31.24.227 TCP 66 6633 → 53180 [ACK] Seq=1 Ack=370 Win=853 Len=0 TSval=1797395 TSecr=388690250
261 1.520672089 172.31.31.144 -> 172.31.24.227 TCP 66 6633 → 53180 [ACK] Seq=1 Ack=493 Win=853 Len=0 TSval=1797395 TSecr=388690250
262 1.520697721 172.31.24.227 -> 172.31.31.144 OpenFlow 189 Type: OFPT_PACKET_IN
263 1.520716457 172.31.24.227 -> 172.31.31.144 OpenFlow 189 Type: OFPT_PACKET_IN
264 1.520909860 172.31.31.144 -> 172.31.24.227 TCP 66 6633 → 53158 [ACK] Seq=969 Ack=370 Win=853 Len=0 TSval=1797395 TSecr=388690250
265 1.520930381 172.31.31.144 -> 172.31.24.227 TCP 66 6633 → 53158 [ACK] Seq=969 Ack=493 Win=853 Len=0 TSval=1797395 TSecr=388690250
266 1.553296716 172.31.24.227 -> 172.31.31.144 TCP 66 53188 → 6633 [ACK] Seq=247 Ack=727 Win=213 Len=0 TSval=388690259 TSecr=1797394
267 1.555814802 172.31.31.144 -> 172.31.24.227 TCP 66 6633 → 53184 [ACK] Seq=1 Ack=493 Win=853 Len=0 TSval=1797404 TSecr=388690250
268 1.557288031 172.31.24.227 -> 172.31.31.144 TCP 66 53182 → 6633 [ACK] Seq=1 Ack=727 Win=213 Len=0 TSval=388690260 TSecr=1797394
269 1.609283164 172.31.31.144 -> 172.31.24.227 OpenFlow 187 Type: OFPT_PACKET_OUT
270 1.609298194 172.31.31.144 -> 172.31.24.227 OpenFlow 187 Type: OFPT_PACKET_OUT
271 1.609303011 172.31.31.144 -> 172.31.24.227 OpenFlow 187 Type: OFPT_PACKET_OUT
272 1.609321120 172.31.31.144 -> 172.31.24.227 OpenFlow 187 Type: OFPT_PACKET_OUT
273 1.609395970 172.31.31.144 -> 172.31.24.227 OpenFlow 187 Type: OFPT_PACKET_OUT
274 1.609434187 172.31.31.144 -> 172.31.24.227 OpenFlow 187 Type: OFPT_PACKET_OUT
275 1.609442246 172.31.24.227 -> 172.31.31.144 TCP 66 53198 → 6633 [ACK] Seq=493 Ack=727 Win=113 Len=0 TSval=388690273 TSecr=1797417
276 1.609561461 172.31.31.144 -> 172.31.24.227 OpenFlow 187 Type: OFPT_PACKET_OUT
277 1.609567608 172.31.31.144 -> 172.31.24.227 OpenFlow 187 Type: OFPT_PACKET_OUT
278 1.609616407 172.31.31.144 -> 172.31.24.227 OpenFlow 187 Type: OFPT_PACKET_OUT
279 1.609715371 172.31.31.144 -> 172.31.24.227 OpenFlow 187 Type: OFPT_PACKET_OUT
280 1.609721413 172.31.31.144 -> 172.31.24.227 OpenFlow 187 Type: OFPT_PACKET_OUT
281 1.609832220 172.31.31.144 -> 172.31.24.227 OpenFlow 187 Type: OFPT_PACKET_OUT
282 1.609839588 172.31.31.144 -> 172.31.24.227 OpenFlow 187 Type: OFPT_PACKET_OUT
283 1.609886755 172.31.31.144 -> 172.31.24.227 OpenFlow 187 Type: OFPT_PACKET_OUT
284 1.609949784 172.31.31.144 -> 172.31.24.227 OpenFlow 187 Type: OFPT_PACKET_OUT
285 1.609989696 172.31.31.144 -> 172.31.24.227 OpenFlow 187 Type: OFPT_PACKET_OUT
286 1.610044253 172.31.31.144 -> 172.31.24.227 OpenFlow 187 Type: OFPT_PACKET_OUT
287 1.610097229 172.31.31.144 -> 172.31.24.227 OpenFlow 187 Type: OFPT_PACKET_OUT
288 1.610156272 172.31.31.144 -> 172.31.24.227 OpenFlow 187 Type: OFPT_PACKET_OUT
289 1.610198602 172.31.31.144 -> 172.31.24.227 OpenFlow 187 Type: OFPT_PACKET_OUT
290 1.610205777 172.31.24.227 -> 172.31.31.144 TCP 66 53180 → 6633 [ACK] Seq=493 Ack=969 Win=213 Len=0 TSval=388690273 TSecr=1797417
291 1.610270243 172.31.31.144 -> 172.31.24.227 OpenFlow 187 Type: OFPT_PACKET_OUT
292 1.610300193 172.31.31.144 -> 172.31.24.227 OpenFlow 187 Type: OFPT_PACKET_OUT
293 1.610368184 172.31.31.144 -> 172.31.24.227 OpenFlow 187 Type: OFPT_PACKET_OUT
294 1.610441190 172.31.31.144 -> 172.31.24.227 OpenFlow 187 Type: OFPT_PACKET_OUT
295 1.610491375 172.31.31.144 -> 172.31.24.227 OpenFlow 187 Type: OFPT_PACKET_OUT
296 1.610530362 172.31.31.144 -> 172.31.24.227 OpenFlow 187 Type: OFPT_PACKET_OUT
297 1.610586772 172.31.31.144 -> 172.31.24.227 OpenFlow 187 Type: OFPT_PACKET_OUT
298 1.610640354 172.31.31.144 -> 172.31.24.227 OpenFlow 187 Type: OFPT_PACKET_OUT
299 1.610703646 172.31.31.144 -> 172.31.24.227 OpenFlow 187 Type: OFPT_PACKET_OUT
300 1.610755384 172.31.31.144 -> 172.31.24.227 OpenFlow 187 Type: OFPT_PACKET_OUT
301 1.610793405 172.31.31.144 -> 172.31.24.227 OpenFlow 187 Type: OFPT_PACKET_OUT
302 1.610871939 172.31.31.144 -> 172.31.24.227 OpenFlow 187 Type: OFPT_PACKET_OUT
303 1.610936342 172.31.31.144 -> 172.31.24.227 OpenFlow 187 Type: OFPT_PACKET_OUT
304 1.610978036 172.31.24.227 -> 172.31.31.144 TCP 66 53196 → 6633 [ACK] Seq=739 Ack=1211 Win=213 Len=0 TSval=388690273 TSecr=1797417
305 1.610997847 172.31.31.144 -> 172.31.24.227 OpenFlow 187 Type: OFPT_PACKET_OUT
306 1.611067378 172.31.24.227 -> 172.31.31.144 OpenFlow 189 Type: OFPT_PACKET_IN
307 1.611082047 172.31.31.144 -> 172.31.24.227 OpenFlow 187 Type: OFPT_PACKET_OUT
308 1.611086196 172.31.31.144 -> 172.31.24.227 OpenFlow 187 Type: OFPT_PACKET_OUT
309 1.611095884 172.31.24.227 -> 172.31.31.144 OpenFlow 189 Type: OFPT_PACKET_IN
310 1.611134364 172.31.31.144 -> 172.31.24.227 OpenFlow 187 Type: OFPT_PACKET_OUT
311 1.611178190 172.31.31.144 -> 172.31.24.227 OpenFlow 187 Type: OFPT_PACKET_OUT
312 1.611237539 172.31.31.144 -> 172.31.24.227 OpenFlow 187 Type: OFPT_PACKET_OUT
313 1.611275153 172.31.31.144 -> 172.31.24.227 OpenFlow 187 Type: OFPT_PACKET_OUT
314 1.611313690 172.31.31.144 -> 172.31.24.227 TCP 66 6633 → 53198 [ACK] Seq=727 Ack=739 Win=853 Len=0 TSval=1797417 TSecr=388690273
315 1.611434079 172.31.31.144 -> 172.31.24.227 OpenFlow 187 Type: OFPT_PACKET_OUT
316 1.611489378 172.31.31.144 -> 172.31.24.227 OpenFlow 187 Type: OFPT_PACKET_OUT
317 1.611495176 172.31.31.144 -> 172.31.24.227 OpenFlow 187 Type: OFPT_PACKET_OUT
318 1.611587790 172.31.24.227 -> 172.31.31.144 OpenFlow 189 Type: OFPT_PACKET_IN
319 1.611606484 172.31.24.227 -> 172.31.31.144 OpenFlow 189 Type: OFPT_PACKET_IN
320 1.611628121 172.31.24.227 -> 172.31.31.144 OpenFlow 189 Type: OFPT_PACKET_IN
321 1.611661278 172.31.24.227 -> 172.31.31.144 OpenFlow 189 Type: OFPT_PACKET_IN
322 1.611666568 172.31.24.227 -> 172.31.31.144 OpenFlow 189 Type: OFPT_PACKET_IN
323 1.611683034 172.31.24.227 -> 172.31.31.144 OpenFlow 189 Type: OFPT_PACKET_IN
324 1.611711152 172.31.24.227 -> 172.31.31.144 OpenFlow 189 Type: OFPT_PACKET_IN
325 1.611896006 172.31.31.144 -> 172.31.24.227 OpenFlow 187 Type: OFPT_PACKET_OUT
326 1.611902189 172.31.31.144 -> 172.31.24.227 TCP 66 6633 → 53154 [ACK] Seq=727 Ack=124 Win=853 Len=0 TSval=1797418 TSecr=388690273
327 1.611906210 172.31.31.144 -> 172.31.24.227 OpenFlow 187 Type: OFPT_PACKET_OUT
328 1.611908542 172.31.31.144 -> 172.31.24.227 TCP 66 6633 → 53154 [ACK] Seq=727 Ack=247 Win=853 Len=0 TSval=1797418 TSecr=388690273
329 1.611914283 172.31.31.144 -> 172.31.24.227 OpenFlow 187 Type: OFPT_PACKET_OUT
330 1.611916351 172.31.31.144 -> 172.31.24.227 TCP 66 6633 → 53158 [ACK] Seq=969 Ack=616 Win=853 Len=0 TSval=1797418 TSecr=388690273
331 1.611918970 172.31.31.144 -> 172.31.24.227 TCP 66 6633 → 53158 [ACK] Seq=969 Ack=739 Win=853 Len=0 TSval=1797418 TSecr=388690273
332 1.611926012 172.31.24.227 -> 172.31.31.144 OpenFlow 189 Type: OFPT_PACKET_IN
333 1.611932534 172.31.24.227 -> 172.31.31.144 OpenFlow 189 Type: OFPT_PACKET_IN
334 1.611934906 172.31.24.227 -> 172.31.31.144 OpenFlow 435 Type: OFPT_PACKET_IN
335 1.611939970 172.31.31.144 -> 172.31.24.227 TCP 66 6633 → 53162 [ACK] Seq=1211 Ack=616 Win=853 Len=0 TSval=1797418 TSecr=388690273
336 1.612143484 172.31.31.144 -> 172.31.24.227 TCP 66 6633 → 53162 [ACK] Seq=1211 Ack=739 Win=853 Len=0 TSval=1797418 TSecr=388690273
337 1.612202813 172.31.24.227 -> 172.31.31.144 OpenFlow 189 Type: OFPT_PACKET_IN
338 1.612222139 172.31.24.227 -> 172.31.31.144 OpenFlow 312 Type: OFPT_PACKET_IN
339 1.612242466 172.31.24.227 -> 172.31.31.144 OpenFlow 189 Type: OFPT_PACKET_IN
340 1.612251228 172.31.24.227 -> 172.31.31.144 OpenFlow 189 Type: OFPT_PACKET_IN
341 1.612277320 172.31.24.227 -> 172.31.31.144 OpenFlow 189 Type: OFPT_PACKET_IN
342 1.612283594 172.31.24.227 -> 172.31.31.144 OpenFlow 435 Type: OFPT_PACKET_IN
343 1.612300113 172.31.24.227 -> 172.31.31.144 OpenFlow 189 Type: OFPT_PACKET_IN
344 1.612328166 172.31.24.227 -> 172.31.31.144 TCP 66 53186 → 6633 [ACK] Seq=739 Ack=969 Win=212 Len=0 TSval=388690273 TSecr=1797417
345 1.612334038 172.31.24.227 -> 172.31.31.144 OpenFlow 189 Type: OFPT_PACKET_IN
346 1.612435214 172.31.31.144 -> 172.31.24.227 TCP 66 6633 → 53172 [ACK] Seq=1 Ack=862 Win=853 Len=0 TSval=1797418 TSecr=388690273
347 1.612442084 172.31.31.144 -> 172.31.24.227 TCP 66 6633 → 53172 [ACK] Seq=1 Ack=1108 Win=853 Len=0 TSval=1797418 TSecr=388690273
348 1.612447794 172.31.24.227 -> 172.31.31.144 OpenFlow 189 Type: OFPT_PACKET_IN
349 1.612547823 172.31.31.144 -> 172.31.24.227 OpenFlow 187 Type: OFPT_PACKET_OUT
350 1.612554383 172.31.31.144 -> 172.31.24.227 OpenFlow 550 Type: OFPT_PACKET_OUT
351 1.612610006 172.31.31.144 -> 172.31.24.227 OpenFlow 671 Type: OFPT_PACKET_OUT
352 1.612617405 172.31.24.227 -> 172.31.31.144 TCP 66 53172 → 6633 [ACK] Seq=1231 Ack=1211 Win=213 Len=0 TSval=388690273 TSecr=1797418
353 1.612623246 172.31.31.144 -> 172.31.24.227 TCP 66 6633 → 53164 [ACK] Seq=1211 Ack=739 Win=853 Len=0 TSval=1797418 TSecr=388690273
354 1.612818891 172.31.24.227 -> 172.31.31.144 OpenFlow 189 Type: OFPT_PACKET_IN
355 1.612837657 172.31.24.227 -> 172.31.31.144 OpenFlow 189 Type: OFPT_PACKET_IN
356 1.612857007 172.31.24.227 -> 172.31.31.144 TCP 66 53194 → 6633 [ACK] Seq=739 Ack=727 Win=212 Len=0 TSval=388690273 TSecr=1797417
357 1.613033214 172.31.31.144 -> 172.31.24.227 TCP 66 6633 → 53190 [ACK] Seq=969 Ack=616 Win=853 Len=0 TSval=1797418 TSecr=388690273
358 1.613040057 172.31.31.144 -> 172.31.24.227 TCP 66 6633 → 53190 [ACK] Seq=969 Ack=739 Win=853 Len=0 TSval=1797418 TSecr=388690273
359 1.613192714 172.31.24.227 -> 172.31.31.144 OpenFlow 189 Type: OFPT_PACKET_IN
360 1.613260894 172.31.24.227 -> 172.31.31.144 OpenFlow 189 Type: OFPT_PACKET_IN
361 1.613318712 172.31.31.144 -> 172.31.24.227 TCP 66 6633 → 53174 [ACK] Seq=727 Ack=739 Win=853 Len=0 TSval=1797418 TSecr=388690273
362 1.613448086 172.31.24.227 -> 172.31.31.144 OpenFlow 189 Type: OFPT_PACKET_IN
363 1.613467764 172.31.24.227 -> 172.31.31.144 OpenFlow 189 Type: OFPT_PACKET_IN
364 1.613486323 172.31.24.227 -> 172.31.31.144 OpenFlow 189 Type: OFPT_PACKET_IN
365 1.613502064 172.31.24.227 -> 172.31.31.144 OpenFlow 189 Type: OFPT_PACKET_IN
366 1.613527223 172.31.24.227 -> 172.31.31.144 OpenFlow 189 Type: OFPT_PACKET_IN
367 1.613530193 172.31.24.227 -> 172.31.31.144 OpenFlow 189 Type: OFPT_PACKET_IN
368 1.613561205 172.31.24.227 -> 172.31.31.144 OpenFlow 189 Type: OFPT_PACKET_IN
369 1.613835750 172.31.31.144 -> 172.31.24.227 OpenFlow 187 Type: OFPT_PACKET_OUT
370 1.613843459 172.31.31.144 -> 172.31.24.227 OpenFlow 187 Type: OFPT_PACKET_OUT
371 1.613846595 172.31.31.144 -> 172.31.24.227 OpenFlow 671 Type: OFPT_PACKET_OUT
372 1.613852208 172.31.24.227 -> 172.31.31.144 TCP 66 53192 → 6633 [ACK] Seq=739 Ack=727 Win=213 Len=0 TSval=388690274 TSecr=1797418
373 1.613858310 172.31.31.144 -> 172.31.24.227 OpenFlow 187 Type: OFPT_PACKET_OUT
374 1.613861355 172.31.31.144 -> 172.31.24.227 TCP 66 6633 → 53168 [ACK] Seq=969 Ack=985 Win=853 Len=0 TSval=1797418 TSecr=388690273
375 1.613865362 172.31.31.144 -> 172.31.24.227 OpenFlow 913 Type: OFPT_PACKET_OUT
376 1.613869236 172.31.24.227 -> 172.31.31.144 TCP 66 53184 → 6633 [ACK] Seq=493 Ack=969 Win=213 Len=0 TSval=388690274 TSecr=1797418
377 1.613870771 172.31.31.144 -> 172.31.24.227 OpenFlow 308 Type: OFPT_PACKET_OUT
378 1.613873216 172.31.31.144 -> 172.31.24.227 TCP 66 6633 → 53152 [ACK] Seq=969 Ack=616 Win=853 Len=0 TSval=1797418 TSecr=388690274
379 1.613876139 172.31.31.144 -> 172.31.24.227 TCP 66 6633 → 53152 [ACK] Seq=969 Ack=739 Win=853 Len=0 TSval=1797418 TSecr=388690274
380 1.613878430 172.31.31.144 -> 172.31.24.227 TCP 66 6633 → 53180 [ACK] Seq=969 Ack=739 Win=853 Len=0 TSval=1797418 TSecr=388690273
381 1.613881144 172.31.31.144 -> 172.31.24.227 TCP 66 6633 → 53154 [ACK] Seq=727 Ack=370 Win=853 Len=0 TSval=1797418 TSecr=388690274
382 1.613883322 172.31.31.144 -> 172.31.24.227 TCP 66 6633 → 53178 [ACK] Seq=1211 Ack=493 Win=853 Len=0 TSval=1797418 TSecr=388690273
383 1.613892717 172.31.24.227 -> 172.31.31.144 OpenFlow 189 Type: OFPT_PACKET_IN
384 1.613896041 172.31.24.227 -> 172.31.31.144 OpenFlow 189 Type: OFPT_PACKET_IN
385 1.613989357 172.31.24.227 -> 172.31.31.144 OpenFlow 435 Type: OFPT_PACKET_IN
386 1.614077772 172.31.31.144 -> 172.31.24.227 TCP 66 6633 → 53154 [ACK] Seq=727 Ack=493 Win=853 Len=0 TSval=1797418 TSecr=388690274
