  1 0.000000000 172.31.31.144 -> 172.31.23.72 TCP 122 6633 → 51136 [PSH, ACK] Seq=1 Ack=1 Win=853 Len=56 TSval=5390964 TSecr=23961058
  2 0.000019533 172.31.31.144 -> 172.31.23.72 TCP 106 6633 → 51136 [PSH, ACK] Seq=57 Ack=1 Win=853 Len=40 TSval=5390964 TSecr=23961058
  3 0.000258980 172.31.23.72 -> 172.31.31.144 OpenFlow 2634 Type: OFPT_MULTIPART_REPLY, OFPMP_FLOW
  4 0.000419260 172.31.23.72 -> 172.31.31.144 OpenFlow 6178 Type: OFPT_MULTIPART_REPLY, OFPMP_TABLE
  5 0.000502019 172.31.31.144 -> 172.31.23.72 TCP 66 6633 → 51136 [ACK] Seq=97 Ack=2569 Win=853 Len=0 TSval=5390964 TSecr=23961090
  6 0.000527506 172.31.23.72 -> 172.31.31.144 OpenFlow 754 Type: OFPT_MULTIPART_REPLY, OFPMP_PORT_STATS
  7 0.000648335 172.31.31.144 -> 172.31.23.72 TCP 66 6633 → 51136 [ACK] Seq=97 Ack=8681 Win=853 Len=0 TSval=5390964 TSecr=23961090
  8 0.000695537 172.31.31.144 -> 172.31.23.72 TCP 66 6633 → 51136 [ACK] Seq=97 Ack=9369 Win=853 Len=0 TSval=5390964 TSecr=23961090
  9 0.042142921 172.31.31.144 -> 172.31.23.72 TCP 122 6633 → 51138 [PSH, ACK] Seq=1 Ack=1 Win=853 Len=56 TSval=5390974 TSecr=23961058
 10 0.042178427 172.31.31.144 -> 172.31.23.72 TCP 106 6633 → 51138 [PSH, ACK] Seq=57 Ack=1 Win=853 Len=40 TSval=5390974 TSecr=23961058
 11 0.042521911 172.31.23.72 -> 172.31.31.144 OpenFlow 1802 Type: OFPT_MULTIPART_REPLY, OFPMP_FLOW
 12 0.042645150 172.31.23.72 -> 172.31.31.144 OpenFlow 754 Type: OFPT_MULTIPART_REPLY, OFPMP_PORT_STATS
 13 0.042810972 172.31.23.72 -> 172.31.31.144 OpenFlow 6178 Type: OFPT_MULTIPART_REPLY, OFPMP_TABLE
 14 0.042884301 172.31.31.144 -> 172.31.23.72 TCP 66 6633 → 51138 [ACK] Seq=97 Ack=2425 Win=853 Len=0 TSval=5390975 TSecr=23961100
 15 0.055367652 172.31.31.144 -> 172.31.23.72 TCP 90 6633 → 51140 [PSH, ACK] Seq=1 Ack=1 Win=853 Len=24 TSval=5390978 TSecr=23960407
 16 0.055384850 172.31.31.144 -> 172.31.23.72 TCP 138 6633 → 51140 [PSH, ACK] Seq=25 Ack=1 Win=853 Len=72 TSval=5390978 TSecr=23960407
 17 0.055636553 172.31.23.72 -> 172.31.31.144 OpenFlow 530 Type: OFPT_MULTIPART_REPLY, OFPMP_PORT_STATS
 18 0.055815986 172.31.23.72 -> 172.31.31.144 OpenFlow 6178 Type: OFPT_MULTIPART_REPLY, OFPMP_TABLE
 19 0.055869442 172.31.23.72 -> 172.31.31.144 OpenFlow 970 Type: OFPT_MULTIPART_REPLY, OFPMP_FLOW
 20 0.056039378 172.31.31.144 -> 172.31.23.72 TCP 66 6633 → 51140 [ACK] Seq=97 Ack=7481 Win=853 Len=0 TSval=5390978 TSecr=23961103
 21 0.082616797 172.31.31.144 -> 172.31.23.72 TCP 66 6633 → 51138 [ACK] Seq=97 Ack=8537 Win=853 Len=0 TSval=5390985 TSecr=23961100
 22 0.133577338 172.31.31.144 -> 172.31.23.72 TCP 82 6633 → 51142 [PSH, ACK] Seq=1 Ack=1 Win=853 Len=16 TSval=5390997 TSecr=23960482
 23 0.133615620 172.31.31.144 -> 172.31.23.72 TCP 146 6633 → 51142 [PSH, ACK] Seq=17 Ack=1 Win=853 Len=80 TSval=5390997 TSecr=23960482
 24 0.133991771 172.31.23.72 -> 172.31.31.144 OpenFlow 6178 Type: OFPT_MULTIPART_REPLY, OFPMP_TABLE
 25 0.134071269 172.31.23.72 -> 172.31.31.144 OpenFlow 2218 Type: OFPT_MULTIPART_REPLY, OFPMP_FLOW
 26 0.134199533 172.31.23.72 -> 172.31.31.144 OpenFlow 754 Type: OFPT_MULTIPART_REPLY, OFPMP_PORT_STATS
 27 0.134309228 172.31.31.144 -> 172.31.23.72 TCP 66 6633 → 51142 [ACK] Seq=97 Ack=8265 Win=853 Len=0 TSval=5390997 TSecr=23961123
 28 0.162813073 172.31.31.144 -> 172.31.23.72 TCP 122 6633 → 51144 [PSH, ACK] Seq=1 Ack=1 Win=853 Len=56 TSval=5391005 TSecr=23960482
 29 0.162825093 172.31.31.144 -> 172.31.23.72 TCP 106 6633 → 51144 [PSH, ACK] Seq=57 Ack=1 Win=853 Len=40 TSval=5391005 TSecr=23960482
 30 0.162982295 172.31.23.72 -> 172.31.31.144 OpenFlow 1386 Type: OFPT_MULTIPART_REPLY, OFPMP_FLOW
 31 0.163060771 172.31.23.72 -> 172.31.31.144 OpenFlow 642 Type: OFPT_MULTIPART_REPLY, OFPMP_PORT_STATS
 32 0.163209424 172.31.23.72 -> 172.31.31.144 OpenFlow 6178 Type: OFPT_MULTIPART_REPLY, OFPMP_TABLE
 33 0.163306958 172.31.31.144 -> 172.31.23.72 TCP 66 6633 → 51144 [ACK] Seq=97 Ack=1897 Win=853 Len=0 TSval=5391005 TSecr=23961130
 34 0.170659629 172.31.31.144 -> 172.31.23.72 TCP 66 6633 → 51142 [ACK] Seq=97 Ack=8953 Win=853 Len=0 TSval=5391007 TSecr=23961123
 35 0.200979907 172.31.31.144 -> 172.31.23.72 TCP 90 6633 → 51146 [PSH, ACK] Seq=1 Ack=1 Win=853 Len=24 TSval=5391014 TSecr=23960783
 36 0.201010997 172.31.31.144 -> 172.31.23.72 TCP 138 6633 → 51146 [PSH, ACK] Seq=25 Ack=1 Win=853 Len=72 TSval=5391014 TSecr=23960783
 37 0.201152841 172.31.23.72 -> 172.31.31.144 OpenFlow 754 Type: OFPT_MULTIPART_REPLY, OFPMP_PORT_STATS
 38 0.201227414 172.31.23.72 -> 172.31.31.144 OpenFlow 2634 Type: OFPT_MULTIPART_REPLY, OFPMP_FLOW
 39 0.201385538 172.31.23.72 -> 172.31.31.144 OpenFlow 6178 Type: OFPT_MULTIPART_REPLY, OFPMP_TABLE
 40 0.201448537 172.31.31.144 -> 172.31.23.72 TCP 66 6633 → 51146 [ACK] Seq=97 Ack=3257 Win=853 Len=0 TSval=5391014 TSecr=23961140
 41 0.202610384 172.31.31.144 -> 172.31.23.72 TCP 66 6633 → 51144 [ACK] Seq=97 Ack=8009 Win=853 Len=0 TSval=5391015 TSecr=23961130
 42 0.238642547 172.31.31.144 -> 172.31.23.72 TCP 66 6633 → 51146 [ACK] Seq=97 Ack=9369 Win=853 Len=0 TSval=5391024 TSecr=23961140
 43 0.248237029 172.31.31.144 -> 172.31.23.72 TCP 82 6633 → 51148 [PSH, ACK] Seq=1 Ack=1 Win=853 Len=16 TSval=5391026 TSecr=23960482
 44 0.248251169 172.31.31.144 -> 172.31.23.72 TCP 146 6633 → 51148 [PSH, ACK] Seq=17 Ack=1 Win=853 Len=80 TSval=5391026 TSecr=23960482
 45 0.248542017 172.31.23.72 -> 172.31.31.144 OpenFlow 6178 Type: OFPT_MULTIPART_REPLY, OFPMP_TABLE
 46 0.248647987 172.31.23.72 -> 172.31.31.144 OpenFlow 642 Type: OFPT_MULTIPART_REPLY, OFPMP_PORT_STATS
 47 0.248711629 172.31.23.72 -> 172.31.31.144 OpenFlow 1802 Type: OFPT_MULTIPART_REPLY, OFPMP_FLOW
 48 0.248885486 172.31.31.144 -> 172.31.23.72 TCP 66 6633 → 51148 [ACK] Seq=97 Ack=8425 Win=853 Len=0 TSval=5391026 TSecr=23961152
 49 0.270458514 172.31.31.144 -> 172.31.23.72 TCP 187 6633 → 51132 [PSH, ACK] Seq=1 Ack=1 Win=853 Len=121 TSval=5391031 TSecr=23961058
 50 0.270474331 172.31.31.144 -> 172.31.23.72 TCP 187 6633 → 51132 [PSH, ACK] Seq=122 Ack=1 Win=853 Len=121 TSval=5391031 TSecr=23961058
 51 0.270521663 172.31.31.144 -> 172.31.23.72 TCP 187 6633 → 51132 [PSH, ACK] Seq=243 Ack=1 Win=853 Len=121 TSval=5391031 TSecr=23961058
 52 0.270615244 172.31.31.144 -> 172.31.23.72 TCP 187 6633 → 51132 [PSH, ACK] Seq=364 Ack=1 Win=853 Len=121 TSval=5391032 TSecr=23961058
 53 0.270704117 172.31.31.144 -> 172.31.23.72 TCP 187 6633 → 51132 [PSH, ACK] Seq=485 Ack=1 Win=853 Len=121 TSval=5391032 TSecr=23961058
 54 0.270773744 172.31.31.144 -> 172.31.23.72 TCP 187 6633 → 51132 [PSH, ACK] Seq=606 Ack=1 Win=853 Len=121 TSval=5391032 TSecr=23961058
 55 0.270841534 172.31.31.144 -> 172.31.23.72 TCP 187 6633 → 51132 [PSH, ACK] Seq=727 Ack=1 Win=853 Len=121 TSval=5391032 TSecr=23961058
 56 0.270911735 172.31.31.144 -> 172.31.23.72 TCP 187 6633 → 51132 [PSH, ACK] Seq=848 Ack=1 Win=853 Len=121 TSval=5391032 TSecr=23961058
 57 0.271010358 172.31.31.144 -> 172.31.23.72 TCP 187 6633 → 51134 [PSH, ACK] Seq=1 Ack=1 Win=853 Len=121 TSval=5391032 TSecr=23961071
 58 0.271023495 172.31.23.72 -> 172.31.31.144 TCP 66 51132 → 6633 [ACK] Seq=1 Ack=969 Win=213 Len=0 TSval=23961157 TSecr=5391031
 59 0.271078961 172.31.31.144 -> 172.31.23.72 TCP 187 6633 → 51134 [PSH, ACK] Seq=122 Ack=1 Win=853 Len=121 TSval=5391032 TSecr=23961071
 60 0.271127146 172.31.23.72 -> 172.31.31.144 OpenFlow 189 Type: OFPT_PACKET_IN
 61 0.271144453 172.31.31.144 -> 172.31.23.72 TCP 187 6633 → 51134 [PSH, ACK] Seq=243 Ack=1 Win=853 Len=121 TSval=5391032 TSecr=23961071
 62 0.271150278 172.31.23.72 -> 172.31.31.144 OpenFlow 189 Type: OFPT_PACKET_IN
 63 0.271190525 172.31.23.72 -> 172.31.31.144 OpenFlow 189 Type: OFPT_PACKET_IN
 64 0.271214744 172.31.23.72 -> 172.31.31.144 OpenFlow 189 Type: OFPT_PACKET_IN
 65 0.271241839 172.31.31.144 -> 172.31.23.72 TCP 187 6633 → 51134 [PSH, ACK] Seq=364 Ack=1 Win=853 Len=121 TSval=5391032 TSecr=23961071
 66 0.271289130 172.31.31.144 -> 172.31.23.72 TCP 187 6633 → 51134 [PSH, ACK] Seq=485 Ack=1 Win=853 Len=121 TSval=5391032 TSecr=23961071
 67 0.271295330 172.31.23.72 -> 172.31.31.144 OpenFlow 189 Type: OFPT_PACKET_IN
 68 0.271314023 172.31.23.72 -> 172.31.31.144 OpenFlow 189 Type: OFPT_PACKET_IN
 69 0.271366722 172.31.31.144 -> 172.31.23.72 OpenFlow 187 Type: OFPT_PACKET_OUT
 70 0.271410385 172.31.31.144 -> 172.31.23.72 TCP 66 6633 → 51140 [ACK] Seq=97 Ack=7727 Win=853 Len=0 TSval=5391032 TSecr=23961157
 71 0.271426480 172.31.31.144 -> 172.31.23.72 TCP 66 6633 → 51130 [ACK] Seq=1 Ack=247 Win=853 Len=0 TSval=5391032 TSecr=23961157
 72 0.271446318 172.31.31.144 -> 172.31.23.72 TCP 66 6633 → 51134 [ACK] Seq=727 Ack=124 Win=853 Len=0 TSval=5391032 TSecr=23961157
 73 0.271465055 172.31.31.144 -> 172.31.23.72 TCP 66 6633 → 51134 [ACK] Seq=727 Ack=247 Win=853 Len=0 TSval=5391032 TSecr=23961157
 74 0.271491694 172.31.31.144 -> 172.31.23.72 OpenFlow 187 Type: OFPT_PACKET_OUT
 75 0.271509578 172.31.31.144 -> 172.31.23.72 OpenFlow 187 Type: OFPT_PACKET_OUT
 76 0.271569131 172.31.31.144 -> 172.31.23.72 OpenFlow 187 Type: OFPT_PACKET_OUT
 77 0.271764833 172.31.23.72 -> 172.31.31.144 OpenFlow 189 Type: OFPT_PACKET_IN
 78 0.271790583 172.31.23.72 -> 172.31.31.144 OpenFlow 189 Type: OFPT_PACKET_IN
 79 0.271837552 172.31.31.144 -> 172.31.23.72 OpenFlow 187 Type: OFPT_PACKET_OUT
 80 0.271909480 172.31.31.144 -> 172.31.23.72 TCP 66 6633 → 51132 [ACK] Seq=969 Ack=124 Win=853 Len=0 TSval=5391032 TSecr=23961157
 81 0.271955211 172.31.31.144 -> 172.31.23.72 TCP 66 6633 → 51132 [ACK] Seq=969 Ack=247 Win=853 Len=0 TSval=5391032 TSecr=23961157
 82 0.271973391 172.31.31.144 -> 172.31.23.72 OpenFlow 187 Type: OFPT_PACKET_OUT
 83 0.272032151 172.31.31.144 -> 172.31.23.72 OpenFlow 187 Type: OFPT_PACKET_OUT
 84 0.272117790 172.31.23.72 -> 172.31.31.144 TCP 66 51136 → 6633 [ACK] Seq=9369 Ack=823 Win=213 Len=0 TSval=23961158 TSecr=5391032
 85 0.272149917 172.31.31.144 -> 172.31.23.72 OpenFlow 187 Type: OFPT_PACKET_OUT
 86 0.272203878 172.31.31.144 -> 172.31.23.72 OpenFlow 187 Type: OFPT_PACKET_OUT
 87 0.272241065 172.31.23.72 -> 172.31.31.144 TCP 66 51136 → 6633 [ACK] Seq=9369 Ack=1065 Win=213 Len=0 TSval=23961158 TSecr=5391032
 88 0.272289228 172.31.31.144 -> 172.31.23.72 OpenFlow 187 Type: OFPT_PACKET_OUT
 89 0.272339796 172.31.31.144 -> 172.31.23.72 OpenFlow 187 Type: OFPT_PACKET_OUT
 90 0.272364528 172.31.23.72 -> 172.31.31.144 TCP 66 51136 → 6633 [ACK] Seq=9369 Ack=1307 Win=213 Len=0 TSval=23961158 TSecr=5391032
 91 0.272432147 172.31.23.72 -> 172.31.31.144 OpenFlow 189 Type: OFPT_PACKET_IN
 92 0.272442680 172.31.31.144 -> 172.31.23.72 OpenFlow 187 Type: OFPT_PACKET_OUT
 93 0.272456831 172.31.23.72 -> 172.31.31.144 OpenFlow 189 Type: OFPT_PACKET_IN
 94 0.272490272 172.31.23.72 -> 172.31.31.144 OpenFlow 189 Type: OFPT_PACKET_IN
 95 0.272508550 172.31.31.144 -> 172.31.23.72 OpenFlow 187 Type: OFPT_PACKET_OUT
 96 0.272514868 172.31.23.72 -> 172.31.31.144 OpenFlow 189 Type: OFPT_PACKET_IN
 97 0.272534030 172.31.23.72 -> 172.31.31.144 OpenFlow 189 Type: OFPT_PACKET_IN
 98 0.272554770 172.31.23.72 -> 172.31.31.144 OpenFlow 189 Type: OFPT_PACKET_IN
 99 0.272584702 172.31.23.72 -> 172.31.31.144 OpenFlow 189 Type: OFPT_PACKET_IN
100 0.272590775 172.31.31.144 -> 172.31.23.72 OpenFlow 187 Type: OFPT_PACKET_OUT
101 0.272614906 172.31.23.72 -> 172.31.31.144 OpenFlow 189 Type: OFPT_PACKET_IN
102 0.272631117 172.31.23.72 -> 172.31.31.144 OpenFlow 189 Type: OFPT_PACKET_IN
103 0.272637627 172.31.31.144 -> 172.31.23.72 OpenFlow 187 Type: OFPT_PACKET_OUT
104 0.272640749 172.31.31.144 -> 172.31.23.72 TCP 66 6633 → 51142 [ACK] Seq=97 Ack=9076 Win=853 Len=0 TSval=5391032 TSecr=23961158
105 0.272662577 172.31.23.72 -> 172.31.31.144 OpenFlow 435 Type: OFPT_PACKET_IN
106 0.272691241 172.31.31.144 -> 172.31.23.72 TCP 66 6633 → 51142 [ACK] Seq=97 Ack=9199 Win=853 Len=0 TSval=5391032 TSecr=23961158
107 0.272695761 172.31.31.144 -> 172.31.23.72 TCP 66 6633 → 51130 [ACK] Seq=1 Ack=493 Win=853 Len=0 TSval=5391032 TSecr=23961158
108 0.272710470 172.31.31.144 -> 172.31.23.72 OpenFlow 187 Type: OFPT_PACKET_OUT
109 0.272763944 172.31.31.144 -> 172.31.23.72 TCP 66 6633 → 51126 [ACK] Seq=1 Ack=124 Win=853 Len=0 TSval=5391032 TSecr=23961158
110 0.272779252 172.31.31.144 -> 172.31.23.72 TCP 66 6633 → 51126 [ACK] Seq=1 Ack=247 Win=853 Len=0 TSval=5391032 TSecr=23961158
111 0.272798220 172.31.31.144 -> 172.31.23.72 TCP 66 6633 → 51128 [ACK] Seq=1 Ack=247 Win=853 Len=0 TSval=5391032 TSecr=23961158
112 0.272817506 172.31.31.144 -> 172.31.23.72 TCP 66 6633 → 51138 [ACK] Seq=702 Ack=8660 Win=853 Len=0 TSval=5391032 TSecr=23961158
113 0.272843313 172.31.31.144 -> 172.31.23.72 TCP 66 6633 → 51138 [ACK] Seq=702 Ack=9029 Win=853 Len=0 TSval=5391032 TSecr=23961158
114 0.272861349 172.31.31.144 -> 172.31.23.72 OpenFlow 187 Type: OFPT_PACKET_OUT
115 0.272963001 172.31.23.72 -> 172.31.31.144 TCP 66 51138 → 6633 [ACK] Seq=9029 Ack=823 Win=213 Len=0 TSval=23961158 TSecr=5391032
116 0.273119706 172.31.23.72 -> 172.31.31.144 OpenFlow 189 Type: OFPT_PACKET_IN
117 0.273144093 172.31.23.72 -> 172.31.31.144 OpenFlow 189 Type: OFPT_PACKET_IN
118 0.273151620 172.31.23.72 -> 172.31.31.144 OpenFlow 189 Type: OFPT_PACKET_IN
119 0.273165407 172.31.23.72 -> 172.31.31.144 OpenFlow 189 Type: OFPT_PACKET_IN
120 0.273196863 172.31.23.72 -> 172.31.31.144 OpenFlow 189 Type: OFPT_PACKET_IN
121 0.273199285 172.31.23.72 -> 172.31.31.144 OpenFlow 189 Type: OFPT_PACKET_IN
122 0.273233219 172.31.23.72 -> 172.31.31.144 OpenFlow 189 Type: OFPT_PACKET_IN
123 0.273238060 172.31.23.72 -> 172.31.31.144 OpenFlow 189 Type: OFPT_PACKET_IN
124 0.273272816 172.31.31.144 -> 172.31.23.72 TCP 66 6633 → 51146 [ACK] Seq=97 Ack=9492 Win=853 Len=0 TSval=5391032 TSecr=23961158
125 0.273318607 172.31.31.144 -> 172.31.23.72 TCP 66 6633 → 51146 [ACK] Seq=97 Ack=9615 Win=853 Len=0 TSval=5391032 TSecr=23961158
126 0.273322135 172.31.31.144 -> 172.31.23.72 TCP 66 6633 → 51136 [ACK] Seq=1307 Ack=9492 Win=853 Len=0 TSval=5391032 TSecr=23961158
127 0.273361866 172.31.31.144 -> 172.31.23.72 OpenFlow 187 Type: OFPT_PACKET_OUT
128 0.273375310 172.31.31.144 -> 172.31.23.72 TCP 66 6633 → 51136 [ACK] Seq=1307 Ack=9615 Win=853 Len=0 TSval=5391032 TSecr=23961158
129 0.273563505 172.31.23.72 -> 172.31.31.144 OpenFlow 189 Type: OFPT_PACKET_IN
130 0.273611813 172.31.31.144 -> 172.31.23.72 TCP 66 6633 → 51130 [ACK] Seq=1 Ack=739 Win=853 Len=0 TSval=5391032 TSecr=23961158
131 0.273684087 172.31.31.144 -> 172.31.23.72 OpenFlow 187 Type: OFPT_PACKET_OUT
132 0.273725830 172.31.31.144 -> 172.31.23.72 OpenFlow 308 Type: OFPT_PACKET_OUT
133 0.273743870 172.31.31.144 -> 172.31.23.72 OpenFlow 187 Type: OFPT_PACKET_OUT
134 0.273763346 172.31.31.144 -> 172.31.23.72 OpenFlow 429 Type: OFPT_PACKET_OUT
135 0.273875673 172.31.31.144 -> 172.31.23.72 OpenFlow 187 Type: OFPT_PACKET_OUT
136 0.273891178 172.31.31.144 -> 172.31.23.72 OpenFlow 187 Type: OFPT_PACKET_OUT
137 0.273956361 172.31.31.144 -> 172.31.23.72 OpenFlow 187 Type: OFPT_PACKET_OUT
138 0.274019259 172.31.31.144 -> 172.31.23.72 OpenFlow 187 Type: OFPT_PACKET_OUT
139 0.274028804 172.31.23.72 -> 172.31.31.144 TCP 66 51140 → 6633 [ACK] Seq=7973 Ack=823 Win=213 Len=0 TSval=23961158 TSecr=5391032
140 0.274091800 172.31.31.144 -> 172.31.23.72 OpenFlow 187 Type: OFPT_PACKET_OUT
141 0.274118631 172.31.23.72 -> 172.31.31.144 OpenFlow 189 Type: OFPT_PACKET_IN
142 0.274139152 172.31.23.72 -> 172.31.31.144 OpenFlow 189 Type: OFPT_PACKET_IN
143 0.274165826 172.31.31.144 -> 172.31.23.72 OpenFlow 187 Type: OFPT_PACKET_OUT
144 0.274187569 172.31.23.72 -> 172.31.31.144 OpenFlow 189 Type: OFPT_PACKET_IN
145 0.274235575 172.31.31.144 -> 172.31.23.72 OpenFlow 187 Type: OFPT_PACKET_OUT
146 0.274240076 172.31.31.144 -> 172.31.23.72 TCP 66 6633 → 51144 [ACK] Seq=97 Ack=8132 Win=853 Len=0 TSval=5391032 TSecr=23961158
147 0.274284115 172.31.31.144 -> 172.31.23.72 OpenFlow 187 Type: OFPT_PACKET_OUT
148 0.274301675 172.31.31.144 -> 172.31.23.72 TCP 66 6633 → 51144 [ACK] Seq=97 Ack=8255 Win=853 Len=0 TSval=5391032 TSecr=23961158
149 0.274348636 172.31.31.144 -> 172.31.23.72 OpenFlow 187 Type: OFPT_PACKET_OUT
150 0.274411936 172.31.31.144 -> 172.31.23.72 OpenFlow 187 Type: OFPT_PACKET_OUT
151 0.274448028 172.31.23.72 -> 172.31.31.144 OpenFlow 189 Type: OFPT_PACKET_IN
152 0.274470068 172.31.23.72 -> 172.31.31.144 OpenFlow 189 Type: OFPT_PACKET_IN
153 0.274498659 172.31.31.144 -> 172.31.23.72 OpenFlow 187 Type: OFPT_PACKET_OUT
154 0.274575288 172.31.23.72 -> 172.31.31.144 OpenFlow 189 Type: OFPT_PACKET_IN
155 0.274598946 172.31.23.72 -> 172.31.31.144 OpenFlow 189 Type: OFPT_PACKET_IN
156 0.274627472 172.31.31.144 -> 172.31.23.72 TCP 66 6633 → 51134 [ACK] Seq=727 Ack=370 Win=853 Len=0 TSval=5391033 TSecr=23961158
157 0.274632373 172.31.31.144 -> 172.31.23.72 TCP 66 6633 → 51134 [ACK] Seq=727 Ack=493 Win=853 Len=0 TSval=5391033 TSecr=23961158
158 0.274644734 172.31.23.72 -> 172.31.31.144 OpenFlow 189 Type: OFPT_PACKET_IN
159 0.274666173 172.31.23.72 -> 172.31.31.144 OpenFlow 189 Type: OFPT_PACKET_IN
160 0.274722103 172.31.31.144 -> 172.31.23.72 TCP 66 6633 → 51132 [ACK] Seq=969 Ack=370 Win=853 Len=0 TSval=5391033 TSecr=23961158
161 0.274738426 172.31.31.144 -> 172.31.23.72 TCP 66 6633 → 51132 [ACK] Seq=969 Ack=493 Win=853 Len=0 TSval=5391033 TSecr=23961158
162 0.274767171 172.31.31.144 -> 172.31.23.72 OpenFlow 187 Type: OFPT_PACKET_OUT
163 0.274834851 172.31.31.144 -> 172.31.23.72 OpenFlow 187 Type: OFPT_PACKET_OUT
164 0.274874287 172.31.31.144 -> 172.31.23.72 TCP 66 6633 → 51142 [ACK] Seq=1307 Ack=9445 Win=853 Len=0 TSval=5391033 TSecr=23961158
165 0.274914349 172.31.31.144 -> 172.31.23.72 OpenFlow 187 Type: OFPT_PACKET_OUT
166 0.275020144 172.31.31.144 -> 172.31.23.72 OpenFlow 187 Type: OFPT_PACKET_OUT
167 0.275083682 172.31.31.144 -> 172.31.23.72 OpenFlow 187 Type: OFPT_PACKET_OUT
168 0.275164826 172.31.31.144 -> 172.31.23.72 OpenFlow 187 Type: OFPT_PACKET_OUT
169 0.275236037 172.31.31.144 -> 172.31.23.72 OpenFlow 187 Type: OFPT_PACKET_OUT
170 0.275240509 172.31.23.72 -> 172.31.31.144 OpenFlow 189 Type: OFPT_PACKET_IN
171 0.275273420 172.31.23.72 -> 172.31.31.144 OpenFlow 189 Type: OFPT_PACKET_IN
172 0.275383282 172.31.31.144 -> 172.31.23.72 OpenFlow 187 Type: OFPT_PACKET_OUT
173 0.275431631 172.31.31.144 -> 172.31.23.72 OpenFlow 187 Type: OFPT_PACKET_OUT
174 0.275550580 172.31.31.144 -> 172.31.23.72 OpenFlow 187 Type: OFPT_PACKET_OUT
175 0.275600920 172.31.23.72 -> 172.31.31.144 TCP 66 51144 → 6633 [ACK] Seq=8501 Ack=1065 Win=213 Len=0 TSval=23961158 TSecr=5391033
176 0.275631528 172.31.31.144 -> 172.31.23.72 OpenFlow 187 Type: OFPT_PACKET_OUT
177 0.275685415 172.31.31.144 -> 172.31.23.72 OpenFlow 187 Type: OFPT_PACKET_OUT
178 0.275739896 172.31.23.72 -> 172.31.31.144 OpenFlow 189 Type: OFPT_PACKET_IN
179 0.275750080 172.31.31.144 -> 172.31.23.72 OpenFlow 187 Type: OFPT_PACKET_OUT
180 0.275762375 172.31.23.72 -> 172.31.31.144 OpenFlow 189 Type: OFPT_PACKET_IN
181 0.275817268 172.31.31.144 -> 172.31.23.72 OpenFlow 187 Type: OFPT_PACKET_OUT
182 0.275885966 172.31.23.72 -> 172.31.31.144 OpenFlow 189 Type: OFPT_PACKET_IN
183 0.275906906 172.31.31.144 -> 172.31.23.72 OpenFlow 187 Type: OFPT_PACKET_OUT
184 0.275919775 172.31.23.72 -> 172.31.31.144 OpenFlow 189 Type: OFPT_PACKET_IN
185 0.275944402 172.31.31.144 -> 172.31.23.72 OpenFlow 187 Type: OFPT_PACKET_OUT
186 0.275948895 172.31.23.72 -> 172.31.31.144 OpenFlow 189 Type: OFPT_PACKET_IN
187 0.275954880 172.31.23.72 -> 172.31.31.144 OpenFlow 189 Type: OFPT_PACKET_IN
188 0.276020611 172.31.31.144 -> 172.31.23.72 TCP 66 6633 → 51138 [ACK] Seq=1307 Ack=9521 Win=853 Len=0 TSval=5391033 TSecr=23961158
189 0.276026861 172.31.31.144 -> 172.31.23.72 OpenFlow 187 Type: OFPT_PACKET_OUT
190 0.276031032 172.31.23.72 -> 172.31.31.144 OpenFlow 189 Type: OFPT_PACKET_IN
191 0.276039798 172.31.23.72 -> 172.31.31.144 OpenFlow 189 Type: OFPT_PACKET_IN
192 0.276082757 172.31.31.144 -> 172.31.23.72 OpenFlow 187 Type: OFPT_PACKET_OUT
193 0.276171808 172.31.31.144 -> 172.31.23.72 OpenFlow 187 Type: OFPT_PACKET_OUT
194 0.276342883 172.31.31.144 -> 172.31.23.72 OpenFlow 187 Type: OFPT_PACKET_OUT
195 0.276377871 172.31.31.144 -> 172.31.23.72 OpenFlow 187 Type: OFPT_PACKET_OUT
196 0.276453920 172.31.23.72 -> 172.31.31.144 TCP 66 51146 → 6633 [ACK] Seq=9861 Ack=1307 Win=213 Len=0 TSval=23961159 TSecr=5391033
197 0.276525971 172.31.31.144 -> 172.31.23.72 TCP 66 6633 → 51152 [ACK] Seq=1 Ack=247 Win=853 Len=0 TSval=5391033 TSecr=23961158
198 0.276547281 172.31.23.72 -> 172.31.31.144 OpenFlow 189 Type: OFPT_PACKET_IN
199 0.276576690 172.31.23.72 -> 172.31.31.144 OpenFlow 435 Type: OFPT_PACKET_IN
200 0.276610840 172.31.31.144 -> 172.31.23.72 OpenFlow 187 Type: OFPT_PACKET_OUT
201 0.276620790 172.31.23.72 -> 172.31.31.144 OpenFlow 189 Type: OFPT_PACKET_IN
202 0.276647312 172.31.23.72 -> 172.31.31.144 OpenFlow 189 Type: OFPT_PACKET_IN
203 0.276656479 172.31.23.72 -> 172.31.31.144 OpenFlow 189 Type: OFPT_PACKET_IN
204 0.276672042 172.31.23.72 -> 172.31.31.144 OpenFlow 189 Type: OFPT_PACKET_IN
205 0.276694968 172.31.23.72 -> 172.31.31.144 OpenFlow 189 Type: OFPT_PACKET_IN
206 0.276739265 172.31.31.144 -> 172.31.23.72 TCP 66 6633 → 51136 [ACK] Seq=1307 Ack=9738 Win=853 Len=0 TSval=5391033 TSecr=23961159
207 0.276743329 172.31.31.144 -> 172.31.23.72 OpenFlow 187 Type: OFPT_PACKET_OUT
208 0.276748220 172.31.23.72 -> 172.31.31.144 OpenFlow 189 Type: OFPT_PACKET_IN
209 0.276754057 172.31.23.72 -> 172.31.31.144 OpenFlow 435 Type: OFPT_PACKET_IN
210 0.276766293 172.31.23.72 -> 172.31.31.144 OpenFlow 189 Type: OFPT_PACKET_IN
211 0.276806522 172.31.31.144 -> 172.31.23.72 TCP 66 6633 → 51136 [ACK] Seq=1307 Ack=10107 Win=853 Len=0 TSval=5391033 TSecr=23961159
212 0.276810865 172.31.31.144 -> 172.31.23.72 TCP 66 6633 → 51150 [ACK] Seq=1 Ack=247 Win=853 Len=0 TSval=5391033 TSecr=23961159
213 0.276816449 172.31.23.72 -> 172.31.31.144 OpenFlow 189 Type: OFPT_PACKET_IN
214 0.276877804 172.31.23.72 -> 172.31.31.144 OpenFlow 189 Type: OFPT_PACKET_IN
215 0.276916725 172.31.31.144 -> 172.31.23.72 OpenFlow 187 Type: OFPT_PACKET_OUT
216 0.276920252 172.31.31.144 -> 172.31.23.72 OpenFlow 187 Type: OFPT_PACKET_OUT
217 0.276932362 172.31.23.72 -> 172.31.31.144 OpenFlow 189 Type: OFPT_PACKET_IN
218 0.276981973 172.31.23.72 -> 172.31.31.144 OpenFlow 189 Type: OFPT_PACKET_IN
219 0.277094456 172.31.31.144 -> 172.31.23.72 OpenFlow 187 Type: OFPT_PACKET_OUT
220 0.277109973 172.31.31.144 -> 172.31.23.72 OpenFlow 187 Type: OFPT_PACKET_OUT
221 0.277129026 172.31.31.144 -> 172.31.23.72 TCP 66 6633 → 51162 [ACK] Seq=1 Ack=247 Win=853 Len=0 TSval=5391033 TSecr=23961159
222 0.277180180 172.31.31.144 -> 172.31.23.72 TCP 66 6633 → 51140 [ACK] Seq=823 Ack=8219 Win=853 Len=0 TSval=5391033 TSecr=23961159
223 0.277227556 172.31.31.144 -> 172.31.23.72 OpenFlow 187 Type: OFPT_PACKET_OUT
224 0.277280710 172.31.31.144 -> 172.31.23.72 TCP 66 6633 → 51142 [ACK] Seq=1307 Ack=9937 Win=853 Len=0 TSval=5391033 TSecr=23961159
225 0.277344773 172.31.23.72 -> 172.31.31.144 TCP 66 51148 → 6633 [ACK] Seq=8917 Ack=1065 Win=213 Len=0 TSval=23961159 TSecr=5391033
226 0.277404248 172.31.31.144 -> 172.31.23.72 TCP 66 6633 → 51154 [ACK] Seq=1 Ack=247 Win=853 Len=0 TSval=5391033 TSecr=23961159
227 0.277417844 172.31.31.144 -> 172.31.23.72 OpenFlow 187 Type: OFPT_PACKET_OUT
228 0.277449800 172.31.23.72 -> 172.31.31.144 OpenFlow 189 Type: OFPT_PACKET_IN
229 0.277473416 172.31.23.72 -> 172.31.31.144 OpenFlow 189 Type: OFPT_PACKET_IN
230 0.277496466 172.31.23.72 -> 172.31.31.144 OpenFlow 189 Type: OFPT_PACKET_IN
231 0.277507752 172.31.23.72 -> 172.31.31.144 OpenFlow 189 Type: OFPT_PACKET_IN
232 0.277520305 172.31.31.144 -> 172.31.23.72 OpenFlow 187 Type: OFPT_PACKET_OUT
233 0.277525127 172.31.23.72 -> 172.31.31.144 OpenFlow 189 Type: OFPT_PACKET_IN
234 0.277589083 172.31.23.72 -> 172.31.31.144 OpenFlow 189 Type: OFPT_PACKET_IN
235 0.277617594 172.31.31.144 -> 172.31.23.72 OpenFlow 187 Type: OFPT_PACKET_OUT
236 0.277685666 172.31.31.144 -> 172.31.23.72 OpenFlow 187 Type: OFPT_PACKET_OUT
237 0.277691211 172.31.31.144 -> 172.31.23.72 TCP 66 6633 → 51156 [ACK] Seq=1 Ack=124 Win=853 Len=0 TSval=5391033 TSecr=23961159
238 0.277702087 172.31.31.144 -> 172.31.23.72 TCP 66 6633 → 51146 [ACK] Seq=1307 Ack=10107 Win=853 Len=0 TSval=5391033 TSecr=23961158
239 0.277722330 172.31.31.144 -> 172.31.23.72 OpenFlow 187 Type: OFPT_PACKET_OUT
240 0.277787376 172.31.31.144 -> 172.31.23.72 TCP 66 6633 → 51156 [ACK] Seq=1 Ack=247 Win=853 Len=0 TSval=5391033 TSecr=23961159
241 0.277804419 172.31.31.144 -> 172.31.23.72 OpenFlow 187 Type: OFPT_PACKET_OUT
242 0.277864214 172.31.23.72 -> 172.31.31.144 TCP 66 51150 → 6633 [ACK] Seq=493 Ack=848 Win=213 Len=0 TSval=23961159 TSecr=5391033
243 0.277940219 172.31.23.72 -> 172.31.31.144 OpenFlow 189 Type: OFPT_PACKET_IN
244 0.277964941 172.31.23.72 -> 172.31.31.144 OpenFlow 189 Type: OFPT_PACKET_IN
245 0.277979592 172.31.23.72 -> 172.31.31.144 OpenFlow 189 Type: OFPT_PACKET_IN
246 0.277989115 172.31.23.72 -> 172.31.31.144 OpenFlow 189 Type: OFPT_PACKET_IN
247 0.277999793 172.31.31.144 -> 172.31.23.72 OpenFlow 187 Type: OFPT_PACKET_OUT
248 0.278003654 172.31.31.144 -> 172.31.23.72 OpenFlow 187 Type: OFPT_PACKET_OUT
249 0.278063666 172.31.23.72 -> 172.31.31.144 OpenFlow 189 Type: OFPT_PACKET_IN
250 0.278092356 172.31.31.144 -> 172.31.23.72 OpenFlow 187 Type: OFPT_PACKET_OUT
251 0.278126889 172.31.31.144 -> 172.31.23.72 OpenFlow 187 Type: OFPT_PACKET_OUT
252 0.278151854 172.31.23.72 -> 172.31.31.144 OpenFlow 189 Type: OFPT_PACKET_IN
253 0.278176188 172.31.31.144 -> 172.31.23.72 TCP 66 6633 → 51158 [ACK] Seq=1 Ack=124 Win=853 Len=0 TSval=5391033 TSecr=23961159
254 0.278183770 172.31.23.72 -> 172.31.31.144 OpenFlow 189 Type: OFPT_PACKET_IN
255 0.278211061 172.31.31.144 -> 172.31.23.72 OpenFlow 187 Type: OFPT_PACKET_OUT
256 0.278262431 172.31.31.144 -> 172.31.23.72 TCP 66 6633 → 51144 [ACK] Seq=1065 Ack=8747 Win=853 Len=0 TSval=5391033 TSecr=23961159
257 0.278281913 172.31.31.144 -> 172.31.23.72 OpenFlow 187 Type: OFPT_PACKET_OUT
258 0.278334671 172.31.31.144 -> 172.31.23.72 OpenFlow 187 Type: OFPT_PACKET_OUT
259 0.278409079 172.31.31.144 -> 172.31.23.72 TCP 66 6633 → 51142 [ACK] Seq=1307 Ack=10183 Win=853 Len=0 TSval=5391033 TSecr=23961159
260 0.278476778 172.31.23.72 -> 172.31.31.144 TCP 66 51152 → 6633 [ACK] Seq=493 Ack=727 Win=213 Len=0 TSval=23961159 TSecr=5391033
261 0.278546615 172.31.23.72 -> 172.31.31.144 OpenFlow 189 Type: OFPT_PACKET_IN
262 0.278574015 172.31.23.72 -> 172.31.31.144 OpenFlow 189 Type: OFPT_PACKET_IN
263 0.278598048 172.31.23.72 -> 172.31.31.144 OpenFlow 189 Type: OFPT_PACKET_IN
264 0.278640569 172.31.23.72 -> 172.31.31.144 OpenFlow 189 Type: OFPT_PACKET_IN
265 0.278701715 172.31.23.72 -> 172.31.31.144 OpenFlow 189 Type: OFPT_PACKET_IN
266 0.278717754 172.31.23.72 -> 172.31.31.144 OpenFlow 189 Type: OFPT_PACKET_IN
267 0.278758918 172.31.31.144 -> 172.31.23.72 TCP 66 6633 → 51148 [ACK] Seq=1065 Ack=9040 Win=853 Len=0 TSval=5391034 TSecr=23961159
268 0.278766384 172.31.23.72 -> 172.31.31.144 OpenFlow 189 Type: OFPT_PACKET_IN
269 0.278776545 172.31.23.72 -> 172.31.31.144 OpenFlow 189 Type: OFPT_PACKET_IN
270 0.278822230 172.31.23.72 -> 172.31.31.144 OpenFlow 189 Type: OFPT_PACKET_IN
271 0.278859113 172.31.31.144 -> 172.31.23.72 TCP 66 6633 → 51158 [ACK] Seq=1 Ack=247 Win=853 Len=0 TSval=5391034 TSecr=23961159
272 0.279006904 172.31.31.144 -> 172.31.23.72 TCP 66 6633 → 51160 [ACK] Seq=1 Ack=124 Win=853 Len=0 TSval=5391034 TSecr=23961159
273 0.279010994 172.31.31.144 -> 172.31.23.72 TCP 66 6633 → 51160 [ACK] Seq=1 Ack=247 Win=853 Len=0 TSval=5391034 TSecr=23961159
274 0.279012783 172.31.31.144 -> 172.31.23.72 TCP 66 6633 → 51150 [ACK] Seq=969 Ack=739 Win=853 Len=0 TSval=5391034 TSecr=23961159
275 0.279105904 172.31.31.144 -> 172.31.23.72 TCP 66 6633 → 51144 [ACK] Seq=1065 Ack=8993 Win=853 Len=0 TSval=5391034 TSecr=23961159
276 0.297422022 172.31.31.144 -> 172.31.23.72 OpenFlow 122 Type: OFPT_MULTIPART_REQUEST, OFPMP_FLOW
277 0.297458922 172.31.31.144 -> 172.31.23.72 OpenFlow 106 Type: OFPT_MULTIPART_REQUEST, OFPMP_PORT_STATS
278 0.297683002 172.31.23.72 -> 172.31.31.144 OpenFlow 1178 Type: OFPT_MULTIPART_REPLY, OFPMP_FLOW
279 0.297860041 172.31.23.72 -> 172.31.31.144 OpenFlow 6178 Type: OFPT_MULTIPART_REPLY, OFPMP_TABLE
280 0.297964276 172.31.23.72 -> 172.31.31.144 OpenFlow 642 Type: OFPT_MULTIPART_REPLY, OFPMP_PORT_STATS
281 0.298105532 172.31.31.144 -> 172.31.23.72 TCP 66 6633 → 51150 [ACK] Seq=1065 Ack=7963 Win=853 Len=0 TSval=5391038 TSecr=23961164
282 0.318690244 172.31.31.144 -> 172.31.23.72 TCP 66 6633 → 51148 [ACK] Seq=1065 Ack=9163 Win=853 Len=0 TSval=5391044 TSecr=23961159
283 0.334709833 172.31.31.144 -> 172.31.23.72 TCP 66 6633 → 51150 [ACK] Seq=1065 Ack=8539 Win=853 Len=0 TSval=5391048 TSecr=23961164
284 0.348687335 172.31.31.144 -> 172.31.23.72 OpenFlow 122 Type: OFPT_MULTIPART_REQUEST, OFPMP_FLOW
285 0.348702967 172.31.31.144 -> 172.31.23.72 OpenFlow 106 Type: OFPT_MULTIPART_REQUEST, OFPMP_TABLE
286 0.348927015 172.31.23.72 -> 172.31.31.144 OpenFlow 554 Type: OFPT_MULTIPART_REPLY, OFPMP_FLOW
287 0.349028069 172.31.23.72 -> 172.31.31.144 OpenFlow 530 Type: OFPT_MULTIPART_REPLY, OFPMP_PORT_STATS
288 0.349195704 172.31.23.72 -> 172.31.31.144 OpenFlow 6178 Type: OFPT_MULTIPART_REPLY, OFPMP_TABLE
289 0.349283654 172.31.31.144 -> 172.31.23.72 TCP 66 6633 → 51152 [ACK] Seq=823 Ack=1445 Win=853 Len=0 TSval=5391051 TSecr=23961177
290 0.386681466 172.31.31.144 -> 172.31.23.72 TCP 66 6633 → 51152 [ACK] Seq=823 Ack=7557 Win=853 Len=0 TSval=5391061 TSecr=23961177
291 0.405017952 172.31.31.144 -> 172.31.23.72 OpenFlow 90 Type: OFPT_MULTIPART_REQUEST, OFPMP_PORT_STATS
292 0.405313365 172.31.23.72 -> 172.31.31.144 OpenFlow 530 Type: OFPT_MULTIPART_REPLY, OFPMP_PORT_STATS
293 0.406151028 172.31.31.144 -> 172.31.23.72 OpenFlow 82 Type: OFPT_MULTIPART_REQUEST, OFPMP_TABLE
294 0.406159725 172.31.31.144 -> 172.31.23.72 OpenFlow 122 Type: OFPT_MULTIPART_REQUEST, OFPMP_FLOW
295 0.406449275 172.31.23.72 -> 172.31.31.144 OpenFlow 6178 Type: OFPT_MULTIPART_REPLY, OFPMP_TABLE
296 0.406530538 172.31.23.72 -> 172.31.31.144 OpenFlow 2634 Type: OFPT_MULTIPART_REPLY, OFPMP_FLOW
297 0.406727332 172.31.31.144 -> 172.31.23.72 TCP 66 6633 → 51154 [ACK] Seq=97 Ack=9391 Win=853 Len=0 TSval=5391066 TSecr=23961191
298 0.466380574 172.31.31.144 -> 172.31.23.72 OpenFlow 90 Type: OFPT_MULTIPART_REQUEST, OFPMP_PORT_STATS
299 0.466424503 172.31.31.144 -> 172.31.23.72 OpenFlow 138 Type: OFPT_MULTIPART_REQUEST, OFPMP_TABLE
300 0.466789219 172.31.23.72 -> 172.31.31.144 OpenFlow 754 Type: OFPT_MULTIPART_REPLY, OFPMP_PORT_STATS
301 0.466931889 172.31.23.72 -> 172.31.31.144 OpenFlow 3050 Type: OFPT_MULTIPART_REPLY, OFPMP_FLOW
302 0.467020319 172.31.31.144 -> 172.31.23.72 TCP 66 6633 → 51156 [ACK] Seq=97 Ack=935 Win=853 Len=0 TSval=5391081 TSecr=23961206
303 0.467121230 172.31.23.72 -> 172.31.31.144 OpenFlow 6178 Type: OFPT_MULTIPART_REPLY, OFPMP_TABLE
304 0.467181372 172.31.31.144 -> 172.31.23.72 TCP 66 6633 → 51156 [ACK] Seq=97 Ack=3919 Win=853 Len=0 TSval=5391081 TSecr=23961206
305 0.467338518 172.31.31.144 -> 172.31.23.72 TCP 66 6633 → 51156 [ACK] Seq=97 Ack=10031 Win=853 Len=0 TSval=5391081 TSecr=23961206
306 0.470919308 172.31.31.144 -> 172.31.23.72 OpenFlow 187 Type: OFPT_PACKET_OUT
307 0.470929717 172.31.31.144 -> 172.31.23.72 OpenFlow 187 Type: OFPT_PACKET_OUT
308 0.471053411 172.31.31.144 -> 172.31.23.72 OpenFlow 187 Type: OFPT_PACKET_OUT
309 0.471070049 172.31.31.144 -> 172.31.23.72 OpenFlow 187 Type: OFPT_PACKET_OUT
310 0.471151937 172.31.31.144 -> 172.31.23.72 OpenFlow 187 Type: OFPT_PACKET_OUT
311 0.471249594 172.31.31.144 -> 172.31.23.72 OpenFlow 187 Type: OFPT_PACKET_OUT
312 0.471357742 172.31.31.144 -> 172.31.23.72 OpenFlow 187 Type: OFPT_PACKET_OUT
313 0.471398639 172.31.23.72 -> 172.31.31.144 TCP 66 51154 → 6633 [ACK] Seq=9391 Ack=823 Win=213 Len=0 TSval=23961207 TSecr=5391082
314 0.471450998 172.31.31.144 -> 172.31.23.72 OpenFlow 187 Type: OFPT_PACKET_OUT
315 0.471471378 172.31.31.144 -> 172.31.23.72 OpenFlow 187 Type: OFPT_PACKET_OUT
316 0.471554883 172.31.31.144 -> 172.31.23.72 OpenFlow 187 Type: OFPT_PACKET_OUT
317 0.471573270 172.31.31.144 -> 172.31.23.72 OpenFlow 187 Type: OFPT_PACKET_OUT
318 0.471583687 172.31.23.72 -> 172.31.31.144 OpenFlow 189 Type: OFPT_PACKET_IN
319 0.471604408 172.31.23.72 -> 172.31.31.144 OpenFlow 189 Type: OFPT_PACKET_IN
320 0.471634200 172.31.23.72 -> 172.31.31.144 OpenFlow 189 Type: OFPT_PACKET_IN
321 0.471654233 172.31.23.72 -> 172.31.31.144 OpenFlow 189 Type: OFPT_PACKET_IN
322 0.471668840 172.31.23.72 -> 172.31.31.144 OpenFlow 189 Type: OFPT_PACKET_IN
323 0.471676044 172.31.31.144 -> 172.31.23.72 OpenFlow 187 Type: OFPT_PACKET_OUT
324 0.471681418 172.31.23.72 -> 172.31.31.144 OpenFlow 189 Type: OFPT_PACKET_IN
325 0.471760128 172.31.31.144 -> 172.31.23.72 OpenFlow 187 Type: OFPT_PACKET_OUT
326 0.471808385 172.31.31.144 -> 172.31.23.72 OpenFlow 187 Type: OFPT_PACKET_OUT
327 0.471825557 172.31.31.144 -> 172.31.23.72 TCP 66 6633 → 51146 [ACK] Seq=1307 Ack=10353 Win=853 Len=0 TSval=5391082 TSecr=23961207
328 0.471857876 172.31.31.144 -> 172.31.23.72 TCP 66 6633 → 51164 [ACK] Seq=1 Ack=247 Win=853 Len=0 TSval=5391082 TSecr=23961207
329 0.471915910 172.31.31.144 -> 172.31.23.72 OpenFlow 187 Type: OFPT_PACKET_OUT
330 0.471944587 172.31.31.144 -> 172.31.23.72 OpenFlow 187 Type: OFPT_PACKET_OUT
331 0.472204658 172.31.23.72 -> 172.31.31.144 TCP 66 51156 → 6633 [ACK] Seq=10277 Ack=1307 Win=213 Len=0 TSval=23961208 TSecr=5391082
332 0.472297253 172.31.23.72 -> 172.31.31.144 OpenFlow 189 Type: OFPT_PACKET_IN
333 0.472322554 172.31.23.72 -> 172.31.31.144 OpenFlow 189 Type: OFPT_PACKET_IN
334 0.472343568 172.31.23.72 -> 172.31.31.144 OpenFlow 189 Type: OFPT_PACKET_IN
335 0.472370910 172.31.23.72 -> 172.31.31.144 OpenFlow 189 Type: OFPT_PACKET_IN
336 0.472375404 172.31.23.72 -> 172.31.31.144 OpenFlow 189 Type: OFPT_PACKET_IN
337 0.472392966 172.31.23.72 -> 172.31.31.144 OpenFlow 189 Type: OFPT_PACKET_IN
338 0.472436728 172.31.23.72 -> 172.31.31.144 OpenFlow 189 Type: OFPT_PACKET_IN
339 0.472442132 172.31.23.72 -> 172.31.31.144 OpenFlow 189 Type: OFPT_PACKET_IN
340 0.472456724 172.31.31.144 -> 172.31.23.72 TCP 66 6633 → 51158 [ACK] Seq=1 Ack=370 Win=853 Len=0 TSval=5391082 TSecr=23961208
341 0.472520874 172.31.31.144 -> 172.31.23.72 TCP 66 6633 → 51158 [ACK] Seq=1 Ack=493 Win=853 Len=0 TSval=5391082 TSecr=23961208
342 0.472525037 172.31.31.144 -> 172.31.23.72 TCP 66 6633 → 51168 [ACK] Seq=1 Ack=124 Win=853 Len=0 TSval=5391082 TSecr=23961208
343 0.472527855 172.31.31.144 -> 172.31.23.72 TCP 66 6633 → 51168 [ACK] Seq=1 Ack=247 Win=853 Len=0 TSval=5391082 TSecr=23961208
344 0.472534438 172.31.31.144 -> 172.31.23.72 TCP 66 6633 → 51166 [ACK] Seq=1 Ack=124 Win=853 Len=0 TSval=5391082 TSecr=23961208
345 0.472556502 172.31.23.72 -> 172.31.31.144 OpenFlow 189 Type: OFPT_PACKET_IN
346 0.472578651 172.31.23.72 -> 172.31.31.144 OpenFlow 189 Type: OFPT_PACKET_IN
347 0.472606202 172.31.31.144 -> 172.31.23.72 TCP 66 6633 → 51166 [ACK] Seq=1 Ack=247 Win=853 Len=0 TSval=5391082 TSecr=23961208
348 0.472682935 172.31.31.144 -> 172.31.23.72 TCP 66 6633 → 51154 [ACK] Seq=823 Ack=9637 Win=853 Len=0 TSval=5391082 TSecr=23961208
349 0.472766309 172.31.31.144 -> 172.31.23.72 TCP 66 6633 → 51148 [ACK] Seq=1065 Ack=9409 Win=853 Len=0 TSval=5391082 TSecr=23961208
350 0.515639672 172.31.31.144 -> 172.31.23.72 OpenFlow 82 Type: OFPT_MULTIPART_REQUEST, OFPMP_TABLE
351 0.515660336 172.31.31.144 -> 172.31.23.72 OpenFlow 146 Type: OFPT_MULTIPART_REQUEST, OFPMP_FLOW
352 0.515977731 172.31.23.72 -> 172.31.31.144 OpenFlow 6178 Type: OFPT_MULTIPART_REPLY, OFPMP_TABLE
353 0.516136968 172.31.23.72 -> 172.31.31.144 OpenFlow 754 Type: OFPT_MULTIPART_REPLY, OFPMP_PORT_STATS
354 0.516218056 172.31.23.72 -> 172.31.31.144 OpenFlow 2842 Type: OFPT_MULTIPART_REPLY, OFPMP_FLOW
355 0.516356576 172.31.31.144 -> 172.31.23.72 TCP 66 6633 → 51158 [ACK] Seq=97 Ack=6605 Win=853 Len=0 TSval=5391093 TSecr=23961218
356 0.516533190 172.31.31.144 -> 172.31.23.72 TCP 66 6633 → 51158 [ACK] Seq=97 Ack=10069 Win=853 Len=0 TSval=5391093 TSecr=23961219
357 0.620840517 172.31.31.144 -> 172.31.23.72 OpenFlow 82 Type: OFPT_MULTIPART_REQUEST, OFPMP_TABLE
358 0.620881195 172.31.31.144 -> 172.31.23.72 OpenFlow 146 Type: OFPT_MULTIPART_REQUEST, OFPMP_FLOW
359 0.621293903 172.31.23.72 -> 172.31.31.144 OpenFlow 6178 Type: OFPT_MULTIPART_REPLY, OFPMP_TABLE
360 0.621399078 172.31.23.72 -> 172.31.31.144 OpenFlow 530 Type: OFPT_MULTIPART_REPLY, OFPMP_PORT_STATS
361 0.621477750 172.31.23.72 -> 172.31.31.144 OpenFlow 1802 Type: OFPT_MULTIPART_REPLY, OFPMP_FLOW
362 0.621565315 172.31.31.144 -> 172.31.23.72 TCP 66 6633 → 51160 [ACK] Seq=97 Ack=6359 Win=853 Len=0 TSval=5391119 TSecr=23961245
363 0.621582520 172.31.31.144 -> 172.31.23.72 TCP 66 6633 → 51160 [ACK] Seq=97 Ack=6823 Win=853 Len=0 TSval=5391119 TSecr=23961245
364 0.621666756 172.31.31.144 -> 172.31.23.72 TCP 66 6633 → 51160 [ACK] Seq=97 Ack=8559 Win=853 Len=0 TSval=5391119 TSecr=23961245
365 0.671897637 172.31.31.144 -> 172.31.23.72 OpenFlow 187 Type: OFPT_PACKET_OUT
366 0.671910580 172.31.31.144 -> 172.31.23.72 OpenFlow 187 Type: OFPT_PACKET_OUT
367 0.671913137 172.31.31.144 -> 172.31.23.72 OpenFlow 187 Type: OFPT_PACKET_OUT
368 0.671915461 172.31.31.144 -> 172.31.23.72 OpenFlow 187 Type: OFPT_PACKET_OUT
369 0.671917273 172.31.31.144 -> 172.31.23.72 OpenFlow 187 Type: OFPT_PACKET_OUT
370 0.671918761 172.31.31.144 -> 172.31.23.72 OpenFlow 187 Type: OFPT_PACKET_OUT
371 0.671920315 172.31.31.144 -> 172.31.23.72 OpenFlow 187 Type: OFPT_PACKET_OUT
372 0.671921640 172.31.31.144 -> 172.31.23.72 OpenFlow 187 Type: OFPT_PACKET_OUT
373 0.671923187 172.31.31.144 -> 172.31.23.72 OpenFlow 187 Type: OFPT_PACKET_OUT
374 0.671924897 172.31.31.144 -> 172.31.23.72 OpenFlow 187 Type: OFPT_PACKET_OUT
375 0.671926479 172.31.31.144 -> 172.31.23.72 OpenFlow 187 Type: OFPT_PACKET_OUT
376 0.671928724 172.31.31.144 -> 172.31.23.72 OpenFlow 187 Type: OFPT_PACKET_OUT
377 0.671930325 172.31.31.144 -> 172.31.23.72 OpenFlow 187 Type: OFPT_PACKET_OUT
378 0.671931669 172.31.31.144 -> 172.31.23.72 OpenFlow 187 Type: OFPT_PACKET_OUT
379 0.671933280 172.31.31.144 -> 172.31.23.72 OpenFlow 187 Type: OFPT_PACKET_OUT
380 0.671934910 172.31.31.144 -> 172.31.23.72 OpenFlow 187 Type: OFPT_PACKET_OUT
381 0.671936540 172.31.31.144 -> 172.31.23.72 OpenFlow 187 Type: OFPT_PACKET_OUT
382 0.671939562 172.31.31.144 -> 172.31.23.72 OpenFlow 187 Type: OFPT_PACKET_OUT
383 0.671969584 172.31.31.144 -> 172.31.23.72 OpenFlow 187 Type: OFPT_PACKET_OUT
384 0.672091471 172.31.31.144 -> 172.31.23.72 OpenFlow 187 Type: OFPT_PACKET_OUT
385 0.672096242 172.31.31.144 -> 172.31.23.72 OpenFlow 187 Type: OFPT_PACKET_OUT
386 0.672160306 172.31.31.144 -> 172.31.23.72 OpenFlow 187 Type: OFPT_PACKET_OUT
387 0.672252257 172.31.31.144 -> 172.31.23.72 OpenFlow 187 Type: OFPT_PACKET_OUT
388 0.672297678 172.31.31.144 -> 172.31.23.72 OpenFlow 187 Type: OFPT_PACKET_OUT
389 0.672371343 172.31.23.72 -> 172.31.31.144 TCP 66 51162 → 6633 [ACK] Seq=247 Ack=727 Win=213 Len=0 TSval=23961258 TSecr=5391132
390 0.672429437 172.31.31.144 -> 172.31.23.72 OpenFlow 187 Type: OFPT_PACKET_OUT
391 0.672464136 172.31.31.144 -> 172.31.23.72 OpenFlow 187 Type: OFPT_PACKET_OUT
392 0.672532438 172.31.31.144 -> 172.31.23.72 OpenFlow 187 Type: OFPT_PACKET_OUT
393 0.672603989 172.31.31.144 -> 172.31.23.72 OpenFlow 187 Type: OFPT_PACKET_OUT
394 0.672859843 172.31.23.72 -> 172.31.31.144 TCP 66 51158 → 6633 [ACK] Seq=10069 Ack=1307 Win=213 Len=0 TSval=23961258 TSecr=5391131
395 0.672940570 172.31.23.72 -> 172.31.31.144 OpenFlow 189 Type: OFPT_PACKET_IN
396 0.672953855 172.31.31.144 -> 172.31.23.72 OpenFlow 187 Type: OFPT_PACKET_OUT
397 0.672958423 172.31.31.144 -> 172.31.23.72 OpenFlow 187 Type: OFPT_PACKET_OUT
398 0.672973218 172.31.23.72 -> 172.31.31.144 OpenFlow 189 Type: OFPT_PACKET_IN
399 0.672984105 172.31.23.72 -> 172.31.31.144 OpenFlow 189 Type: OFPT_PACKET_IN
400 0.673009873 172.31.23.72 -> 172.31.31.144 OpenFlow 189 Type: OFPT_PACKET_IN
401 0.673015608 172.31.23.72 -> 172.31.31.144 OpenFlow 189 Type: OFPT_PACKET_IN
402 0.673051945 172.31.23.72 -> 172.31.31.144 OpenFlow 189 Type: OFPT_PACKET_IN
