  1 0.000000000 172.31.23.72 -> 172.31.31.144 OpenFlow 146 Type: OFPT_PORT_STATUS
  2 0.000081263 172.31.23.72 -> 172.31.31.144 OpenFlow 146 Type: OFPT_PORT_STATUS
  3 0.000291043 172.31.31.144 -> 172.31.23.72 TCP 66 6633 → 45446 [ACK] Seq=1 Ack=81 Win=853 Len=0 TSval=807430 TSecr=19377555
  4 0.023140015 172.31.31.144 -> 172.31.23.72 TCP 146 6633 → 45432 [PSH, ACK] Seq=1 Ack=1 Win=853 Len=80 TSval=807436 TSecr=19377081
  5 0.023164860 172.31.31.144 -> 172.31.23.72 TCP 146 6633 → 45428 [PSH, ACK] Seq=1 Ack=1 Win=853 Len=80 TSval=807436 TSecr=19377081
  6 0.023168781 172.31.31.144 -> 172.31.23.72 OpenFlow 146 Type: OFPT_FLOW_MOD
  7 0.023181390 172.31.31.144 -> 172.31.23.72 TCP 154 6633 → 45428 [PSH, ACK] Seq=81 Ack=1 Win=853 Len=88 TSval=807436 TSecr=19377081
  8 0.023184648 172.31.31.144 -> 172.31.23.72 TCP 154 6633 → 45432 [PSH, ACK] Seq=81 Ack=1 Win=853 Len=88 TSval=807436 TSecr=19377081
  9 0.023186885 172.31.31.144 -> 172.31.23.72 TCP 146 6633 → 45458 [PSH, ACK] Seq=1 Ack=1 Win=853 Len=80 TSval=807436 TSecr=19377263
 10 0.023190344 172.31.31.144 -> 172.31.23.72 OpenFlow 154 Type: OFPT_BARRIER_REQUEST
 11 0.023192027 172.31.31.144 -> 172.31.23.72 TCP 146 6633 → 45428 [PSH, ACK] Seq=169 Ack=1 Win=853 Len=80 TSval=807436 TSecr=19377081
 12 0.023194082 172.31.31.144 -> 172.31.23.72 TCP 146 6633 → 45432 [PSH, ACK] Seq=169 Ack=1 Win=853 Len=80 TSval=807436 TSecr=19377081
 13 0.023199134 172.31.31.144 -> 172.31.23.72 TCP 154 6633 → 45428 [PSH, ACK] Seq=249 Ack=1 Win=853 Len=88 TSval=807436 TSecr=19377081
 14 0.023200865 172.31.31.144 -> 172.31.23.72 TCP 146 6633 → 45432 [PSH, ACK] Seq=249 Ack=1 Win=853 Len=80 TSval=807436 TSecr=19377081
 15 0.023221478 172.31.31.144 -> 172.31.23.72 OpenFlow 146 Type: OFPT_FLOW_MOD
 16 0.023223490 172.31.31.144 -> 172.31.23.72 TCP 322 6633 → 45458 [PSH, ACK] Seq=81 Ack=1 Win=853 Len=256 TSval=807436 TSecr=19377263
 17 0.023260313 172.31.31.144 -> 172.31.23.72 TCP 74 6633 → 45432 [PSH, ACK] Seq=329 Ack=1 Win=853 Len=8 TSval=807436 TSecr=19377081
 18 0.023262510 172.31.31.144 -> 172.31.23.72 OpenFlow 146 Type: OFPT_FLOW_MOD
 19 0.023285376 172.31.31.144 -> 172.31.23.72 TCP 146 6633 → 45458 [PSH, ACK] Seq=337 Ack=1 Win=853 Len=80 TSval=807436 TSecr=19377263
 20 0.023287488 172.31.31.144 -> 172.31.23.72 TCP 146 6633 → 45416 [PSH, ACK] Seq=1 Ack=1 Win=853 Len=80 TSval=807436 TSecr=19377006
 21 0.023334174 172.31.31.144 -> 172.31.23.72 TCP 146 6633 → 45436 [PSH, ACK] Seq=1 Ack=1 Win=853 Len=80 TSval=807436 TSecr=19377106
 22 0.023338116 172.31.31.144 -> 172.31.23.72 OpenFlow 74 Type: OFPT_BARRIER_REQUEST
 23 0.023339990 172.31.31.144 -> 172.31.23.72 TCP 146 6633 → 45424 [PSH, ACK] Seq=1 Ack=1 Win=853 Len=80 TSval=807436 TSecr=19377031
 24 0.023362236 172.31.31.144 -> 172.31.23.72 TCP 154 6633 → 45436 [PSH, ACK] Seq=81 Ack=1 Win=853 Len=88 TSval=807436 TSecr=19377106
 25 0.023365091 172.31.31.144 -> 172.31.23.72 TCP 154 6633 → 45416 [PSH, ACK] Seq=81 Ack=1 Win=853 Len=88 TSval=807436 TSecr=19377006
 26 0.023367135 172.31.31.144 -> 172.31.23.72 TCP 154 6633 → 45424 [PSH, ACK] Seq=81 Ack=1 Win=853 Len=88 TSval=807436 TSecr=19377031
 27 0.023387297 172.31.31.144 -> 172.31.23.72 TCP 154 6633 → 45458 [PSH, ACK] Seq=417 Ack=1 Win=853 Len=88 TSval=807436 TSecr=19377263
 28 0.023390957 172.31.31.144 -> 172.31.23.72 OpenFlow 146 Type: OFPT_FLOW_MOD
 29 0.023393617 172.31.31.144 -> 172.31.23.72 TCP 146 6633 → 45426 [PSH, ACK] Seq=1 Ack=1 Win=853 Len=80 TSval=807436 TSecr=19377057
 30 0.023413942 172.31.31.144 -> 172.31.23.72 TCP 146 6633 → 45430 [PSH, ACK] Seq=1 Ack=1 Win=853 Len=80 TSval=807436 TSecr=19377081
 31 0.023431915 172.31.31.144 -> 172.31.23.72 TCP 146 6633 → 45426 [PSH, ACK] Seq=81 Ack=1 Win=853 Len=80 TSval=807436 TSecr=19377057
 32 0.023434453 172.31.31.144 -> 172.31.23.72 TCP 146 6633 → 45432 [PSH, ACK] Seq=337 Ack=1 Win=853 Len=80 TSval=807436 TSecr=19377081
 33 0.023435949 172.31.31.144 -> 172.31.23.72 OpenFlow 322 Type: OFPT_BARRIER_REQUEST
 34 0.023458100 172.31.31.144 -> 172.31.23.72 TCP 154 6633 → 45430 [PSH, ACK] Seq=81 Ack=1 Win=853 Len=88 TSval=807436 TSecr=19377081
 35 0.023460181 172.31.31.144 -> 172.31.23.72 TCP 74 6633 → 45426 [PSH, ACK] Seq=161 Ack=1 Win=853 Len=8 TSval=807436 TSecr=19377057
 36 0.023485511 172.31.23.72 -> 172.31.31.144 TCP 66 45436 → 6633 [ACK] Seq=1 Ack=169 Win=213 Len=0 TSval=19377561 TSecr=807436
 37 0.023492267 172.31.31.144 -> 172.31.23.72 TCP 146 6633 → 45458 [PSH, ACK] Seq=505 Ack=1 Win=853 Len=80 TSval=807436 TSecr=19377263
 38 0.023504074 172.31.31.144 -> 172.31.23.72 OpenFlow 146 Type: OFPT_FLOW_MOD
 39 0.023511692 172.31.23.72 -> 172.31.31.144 OpenFlow 74 Type: OFPT_BARRIER_REPLY
 40 0.023523692 172.31.31.144 -> 172.31.23.72 OpenFlow 154 Type: OFPT_BARRIER_REQUEST
 41 0.023544932 172.31.31.144 -> 172.31.23.72 TCP 154 6633 → 45458 [PSH, ACK] Seq=585 Ack=1 Win=853 Len=88 TSval=807436 TSecr=19377263
 42 0.023561650 172.31.23.72 -> 172.31.31.144 TCP 66 45424 → 6633 [ACK] Seq=1 Ack=169 Win=213 Len=0 TSval=19377561 TSecr=807436
 43 0.023567228 172.31.31.144 -> 172.31.23.72 TCP 154 6633 → 45432 [PSH, ACK] Seq=417 Ack=1 Win=853 Len=88 TSval=807436 TSecr=19377081
 44 0.023573515 172.31.23.72 -> 172.31.31.144 OpenFlow 74 Type: OFPT_BARRIER_REPLY
 45 0.023588462 172.31.31.144 -> 172.31.23.72 TCP 146 6633 → 45430 [PSH, ACK] Seq=169 Ack=1 Win=853 Len=80 TSval=807436 TSecr=19377081
 46 0.023607551 172.31.31.144 -> 172.31.23.72 TCP 146 6633 → 45418 [PSH, ACK] Seq=1 Ack=1 Win=853 Len=80 TSval=807436 TSecr=19377007
 47 0.023625111 172.31.23.72 -> 172.31.31.144 OpenFlow 74 Type: OFPT_BARRIER_REPLY
 48 0.023676886 172.31.23.72 -> 172.31.31.144 OpenFlow 74 Type: OFPT_BARRIER_REPLY
 49 0.023690082 172.31.31.144 -> 172.31.23.72 OpenFlow 154 Type: OFPT_BARRIER_REQUEST
 50 0.023692746 172.31.31.144 -> 172.31.23.72 TCP 146 6633 → 45420 [PSH, ACK] Seq=1 Ack=1 Win=853 Len=80 TSval=807436 TSecr=19377007
 51 0.023695559 172.31.31.144 -> 172.31.23.72 TCP 146 6633 → 45434 [PSH, ACK] Seq=1 Ack=1 Win=853 Len=80 TSval=807436 TSecr=19377106
 52 0.023697920 172.31.31.144 -> 172.31.23.72 OpenFlow 570 Type: OFPT_BARRIER_REQUEST
 53 0.023700086 172.31.31.144 -> 172.31.23.72 TCP 154 6633 → 45434 [PSH, ACK] Seq=81 Ack=1 Win=853 Len=88 TSval=807436 TSecr=19377106
 54 0.023701897 172.31.31.144 -> 172.31.23.72 TCP 154 6633 → 45418 [PSH, ACK] Seq=81 Ack=1 Win=853 Len=88 TSval=807436 TSecr=19377007
 55 0.023712042 172.31.31.144 -> 172.31.23.72 TCP 146 6633 → 45428 [PSH, ACK] Seq=337 Ack=1 Win=853 Len=80 TSval=807436 TSecr=19377081
 56 0.023714094 172.31.31.144 -> 172.31.23.72 TCP 322 6633 → 45420 [PSH, ACK] Seq=81 Ack=1 Win=853 Len=256 TSval=807436 TSecr=19377007
 57 0.023748447 172.31.31.144 -> 172.31.23.72 TCP 154 6633 → 45428 [PSH, ACK] Seq=417 Ack=1 Win=853 Len=88 TSval=807436 TSecr=19377081
 58 0.023762005 172.31.31.144 -> 172.31.23.72 TCP 146 6633 → 45420 [PSH, ACK] Seq=337 Ack=1 Win=853 Len=80 TSval=807436 TSecr=19377007
 59 0.023779595 172.31.31.144 -> 172.31.23.72 TCP 146 6633 → 45444 [PSH, ACK] Seq=1 Ack=1 Win=853 Len=80 TSval=807436 TSecr=19377156
 60 0.023797227 172.31.23.72 -> 172.31.31.144 OpenFlow 74 Type: OFPT_BARRIER_REPLY
 61 0.023803174 172.31.31.144 -> 172.31.23.72 TCP 154 6633 → 45420 [PSH, ACK] Seq=417 Ack=1 Win=853 Len=88 TSval=807436 TSecr=19377007
 62 0.023806173 172.31.31.144 -> 172.31.23.72 OpenFlow 146 Type: OFPT_FLOW_MOD
 63 0.023809154 172.31.31.144 -> 172.31.23.72 TCP 146 6633 → 45454 [PSH, ACK] Seq=1 Ack=1 Win=853 Len=80 TSval=807436 TSecr=19377231
 64 0.023849335 172.31.31.144 -> 172.31.23.72 TCP 146 6633 → 45432 [PSH, ACK] Seq=505 Ack=1 Win=853 Len=80 TSval=807436 TSecr=19377081
 65 0.023852322 172.31.31.144 -> 172.31.23.72 OpenFlow 154 Type: OFPT_BARRIER_REQUEST
 66 0.023855963 172.31.31.144 -> 172.31.23.72 TCP 154 6633 → 45454 [PSH, ACK] Seq=81 Ack=1 Win=853 Len=88 TSval=807436 TSecr=19377231
 67 0.023857937 172.31.31.144 -> 172.31.23.72 TCP 146 6633 → 45414 [PSH, ACK] Seq=1 Ack=1 Win=853 Len=80 TSval=807436 TSecr=19376981
 68 0.023874992 172.31.23.72 -> 172.31.31.144 TCP 66 45416 → 6633 [ACK] Seq=1 Ack=169 Win=213 Len=0 TSval=19377561 TSecr=807436
 69 0.023879558 172.31.23.72 -> 172.31.31.144 OpenFlow 74 Type: OFPT_BARRIER_REPLY
 70 0.023900994 172.31.23.72 -> 172.31.31.144 OpenFlow 74 Type: OFPT_BARRIER_REPLY
 71 0.023945994 172.31.23.72 -> 172.31.31.144 OpenFlow 74 Type: OFPT_BARRIER_REPLY
 72 0.023975545 172.31.31.144 -> 172.31.23.72 OpenFlow 146 Type: OFPT_FLOW_MOD
 73 0.023978736 172.31.31.144 -> 172.31.23.72 OpenFlow 154 Type: OFPT_BARRIER_REQUEST
 74 0.023980453 172.31.31.144 -> 172.31.23.72 OpenFlow 146 Type: OFPT_FLOW_MOD
 75 0.023982021 172.31.31.144 -> 172.31.23.72 OpenFlow 146 Type: OFPT_FLOW_MOD
 76 0.023983745 172.31.31.144 -> 172.31.23.72 TCP 154 6633 → 45414 [PSH, ACK] Seq=81 Ack=1 Win=853 Len=88 TSval=807436 TSecr=19376981
 77 0.023988283 172.31.31.144 -> 172.31.23.72 TCP 146 6633 → 45458 [PSH, ACK] Seq=673 Ack=1 Win=853 Len=80 TSval=807436 TSecr=19377263
 78 0.023989930 172.31.31.144 -> 172.31.23.72 OpenFlow 154 Type: OFPT_BARRIER_REQUEST
 79 0.024017548 172.31.31.144 -> 172.31.23.72 TCP 154 6633 → 45444 [PSH, ACK] Seq=81 Ack=1 Win=853 Len=88 TSval=807436 TSecr=19377156
 80 0.024021432 172.31.23.72 -> 172.31.31.144 OpenFlow 74 Type: OFPT_BARRIER_REPLY
 81 0.024052197 172.31.31.144 -> 172.31.23.72 OpenFlow 146 Type: OFPT_FLOW_MOD
 82 0.024088824 172.31.31.144 -> 172.31.23.72 OpenFlow 154 Type: OFPT_BARRIER_REQUEST
 83 0.024094041 172.31.23.72 -> 172.31.31.144 TCP 66 45414 → 6633 [ACK] Seq=1 Ack=169 Win=213 Len=0 TSval=19377561 TSecr=807436
 84 0.024098497 172.31.23.72 -> 172.31.31.144 OpenFlow 74 Type: OFPT_BARRIER_REPLY
 85 0.024115292 172.31.31.144 -> 172.31.23.72 OpenFlow 314 Type: OFPT_FLOW_MOD
 86 0.024126696 172.31.23.72 -> 172.31.31.144 TCP 66 45454 → 6633 [ACK] Seq=1 Ack=169 Win=213 Len=0 TSval=19377561 TSecr=807436
 87 0.024130821 172.31.23.72 -> 172.31.31.144 OpenFlow 74 Type: OFPT_BARRIER_REPLY
 88 0.024149137 172.31.31.144 -> 172.31.23.72 OpenFlow 146 Type: OFPT_FLOW_MOD
 89 0.024169260 172.31.23.72 -> 172.31.31.144 TCP 66 45426 → 6633 [ACK] Seq=1 Ack=169 Win=213 Len=0 TSval=19377561 TSecr=807436
 90 0.024173366 172.31.23.72 -> 172.31.31.144 OpenFlow 74 Type: OFPT_BARRIER_REPLY
 91 0.024185556 172.31.31.144 -> 172.31.23.72 OpenFlow 74 Type: OFPT_BARRIER_REQUEST
 92 0.024189833 172.31.23.72 -> 172.31.31.144 OpenFlow 90 Type: OFPT_BARRIER_REPLY
 93 0.024230519 172.31.31.144 -> 172.31.23.72 OpenFlow 74 Type: OFPT_BARRIER_REQUEST
 94 0.024896229 172.31.23.72 -> 172.31.31.144 OpenFlow 226 Type: OFPT_FLOW_REMOVED
 95 0.024903768 172.31.23.72 -> 172.31.31.144 OpenFlow 226 Type: OFPT_FLOW_REMOVED
 96 0.024905565 172.31.23.72 -> 172.31.31.144 OpenFlow 730 Type: OFPT_FLOW_REMOVED
 97 0.024907821 172.31.23.72 -> 172.31.31.144 OpenFlow 306 Type: OFPT_FLOW_REMOVED
 98 0.024909526 172.31.23.72 -> 172.31.31.144 OpenFlow 562 Type: OFPT_FLOW_REMOVED
 99 0.024911151 172.31.23.72 -> 172.31.31.144 OpenFlow 226 Type: OFPT_FLOW_REMOVED
100 0.024912537 172.31.23.72 -> 172.31.31.144 OpenFlow 706 Type: OFPT_FLOW_REMOVED
101 0.024914629 172.31.23.72 -> 172.31.31.144 OpenFlow 642 Type: OFPT_FLOW_REMOVED
102 0.025156779 172.31.31.144 -> 172.31.23.72 TCP 146 6633 → 45460 [PSH, ACK] Seq=1 Ack=1 Win=853 Len=80 TSval=807436 TSecr=19377263
103 0.025162692 172.31.31.144 -> 172.31.23.72 TCP 154 6633 → 45460 [PSH, ACK] Seq=81 Ack=1 Win=853 Len=88 TSval=807436 TSecr=19377263
104 0.025165126 172.31.31.144 -> 172.31.23.72 TCP 66 6633 → 45436 [ACK] Seq=337 Ack=9 Win=853 Len=0 TSval=807437 TSecr=19377561
105 0.025167970 172.31.31.144 -> 172.31.23.72 TCP 66 6633 → 45430 [ACK] Seq=337 Ack=9 Win=853 Len=0 TSval=807437 TSecr=19377561
106 0.025170203 172.31.31.144 -> 172.31.23.72 OpenFlow 154 Type: OFPT_BARRIER_REQUEST
107 0.025172911 172.31.31.144 -> 172.31.23.72 TCP 66 6633 → 45428 [ACK] Seq=505 Ack=9 Win=853 Len=0 TSval=807437 TSecr=19377561
108 0.025174798 172.31.31.144 -> 172.31.23.72 TCP 66 6633 → 45424 [ACK] Seq=337 Ack=9 Win=853 Len=0 TSval=807437 TSecr=19377561
109 0.025176605 172.31.31.144 -> 172.31.23.72 TCP 66 6633 → 45416 [ACK] Seq=169 Ack=9 Win=853 Len=0 TSval=807437 TSecr=19377561
110 0.025178355 172.31.31.144 -> 172.31.23.72 TCP 66 6633 → 45432 [ACK] Seq=673 Ack=9 Win=853 Len=0 TSval=807437 TSecr=19377561
111 0.025180170 172.31.31.144 -> 172.31.23.72 TCP 66 6633 → 45458 [ACK] Seq=841 Ack=9 Win=853 Len=0 TSval=807437 TSecr=19377561
112 0.025183277 172.31.23.72 -> 172.31.31.144 OpenFlow 810 Type: OFPT_FLOW_REMOVED
113 0.025194030 172.31.23.72 -> 172.31.31.144 OpenFlow 226 Type: OFPT_FLOW_REMOVED
114 0.025196022 172.31.23.72 -> 172.31.31.144 OpenFlow 226 Type: OFPT_FLOW_REMOVED
115 0.025197676 172.31.23.72 -> 172.31.31.144 OpenFlow 226 Type: OFPT_FLOW_REMOVED
116 0.025328009 172.31.31.144 -> 172.31.23.72 TCP 66 6633 → 45454 [ACK] Seq=169 Ack=9 Win=853 Len=0 TSval=807437 TSecr=19377561
117 0.025331026 172.31.31.144 -> 172.31.23.72 TCP 66 6633 → 45426 [ACK] Seq=169 Ack=9 Win=853 Len=0 TSval=807437 TSecr=19377561
118 0.025332833 172.31.31.144 -> 172.31.23.72 TCP 66 6633 → 45446 [ACK] Seq=1009 Ack=113 Win=853 Len=0 TSval=807437 TSecr=19377561
119 0.025334797 172.31.31.144 -> 172.31.23.72 TCP 66 6633 → 45436 [ACK] Seq=337 Ack=169 Win=853 Len=0 TSval=807437 TSecr=19377561
120 0.025336845 172.31.31.144 -> 172.31.23.72 TCP 66 6633 → 45424 [ACK] Seq=337 Ack=169 Win=853 Len=0 TSval=807437 TSecr=19377561
121 0.025453597 172.31.31.144 -> 172.31.23.72 TCP 66 6633 → 45430 [ACK] Seq=337 Ack=249 Win=853 Len=0 TSval=807437 TSecr=19377561
122 0.025456595 172.31.31.144 -> 172.31.23.72 TCP 66 6633 → 45428 [ACK] Seq=505 Ack=505 Win=853 Len=0 TSval=807437 TSecr=19377561
123 0.025458299 172.31.31.144 -> 172.31.23.72 TCP 66 6633 → 45416 [ACK] Seq=169 Ack=169 Win=853 Len=0 TSval=807437 TSecr=19377561
124 0.025460039 172.31.31.144 -> 172.31.23.72 TCP 66 6633 → 45432 [ACK] Seq=673 Ack=585 Win=853 Len=0 TSval=807437 TSecr=19377561
125 0.025503338 172.31.31.144 -> 172.31.23.72 TCP 66 6633 → 45458 [ACK] Seq=841 Ack=753 Win=853 Len=0 TSval=807437 TSecr=19377561
126 0.025505939 172.31.31.144 -> 172.31.23.72 TCP 66 6633 → 45454 [ACK] Seq=169 Ack=169 Win=853 Len=0 TSval=807437 TSecr=19377561
127 0.025534608 172.31.31.144 -> 172.31.23.72 TCP 66 6633 → 45426 [ACK] Seq=169 Ack=169 Win=853 Len=0 TSval=807437 TSecr=19377561
128 0.025561931 172.31.31.144 -> 172.31.23.72 TCP 66 6633 → 45414 [ACK] Seq=169 Ack=169 Win=853 Len=0 TSval=807437 TSecr=19377561
129 0.025770313 172.31.31.144 -> 172.31.23.72 TCP 170 6633 → 45434 [PSH, ACK] Seq=169 Ack=1 Win=853 Len=104 TSval=807437 TSecr=19377106
130 0.025773663 172.31.31.144 -> 172.31.23.72 TCP 178 6633 → 45434 [PSH, ACK] Seq=273 Ack=1 Win=853 Len=112 TSval=807437 TSecr=19377106
131 0.025785066 172.31.31.144 -> 172.31.23.72 OpenFlow 170 Type: OFPT_FLOW_MOD
132 0.025798581 172.31.31.144 -> 172.31.23.72 OpenFlow 170 Type: OFPT_FLOW_MOD
133 0.025811967 172.31.31.144 -> 172.31.23.72 OpenFlow 170 Type: OFPT_FLOW_MOD
134 0.025843279 172.31.31.144 -> 172.31.23.72 OpenFlow 170 Type: OFPT_FLOW_MOD
135 0.025845338 172.31.31.144 -> 172.31.23.72 OpenFlow 170 Type: OFPT_FLOW_MOD
136 0.025871735 172.31.31.144 -> 172.31.23.72 OpenFlow 170 Type: OFPT_FLOW_MOD
137 0.025873536 172.31.31.144 -> 172.31.23.72 OpenFlow 74 Type: OFPT_BARRIER_REQUEST
138 0.025874895 172.31.31.144 -> 172.31.23.72 TCP 170 6633 → 45442 [PSH, ACK] Seq=1 Ack=1 Win=853 Len=104 TSval=807437 TSecr=19377156
139 0.025895413 172.31.31.144 -> 172.31.23.72 OpenFlow 74 Type: OFPT_BARRIER_REQUEST
140 0.025912301 172.31.31.144 -> 172.31.23.72 TCP 170 6633 → 45442 [PSH, ACK] Seq=105 Ack=1 Win=853 Len=104 TSval=807437 TSecr=19377156
141 0.025927061 172.31.31.144 -> 172.31.23.72 OpenFlow 74 Type: OFPT_BARRIER_REQUEST
142 0.025928719 172.31.31.144 -> 172.31.23.72 OpenFlow 170 Type: OFPT_FLOW_MOD
143 0.025962971 172.31.31.144 -> 172.31.23.72 TCP 74 6633 → 45442 [PSH, ACK] Seq=209 Ack=1 Win=853 Len=8 TSval=807437 TSecr=19377156
144 0.025964855 172.31.31.144 -> 172.31.23.72 TCP 170 6633 → 45444 [PSH, ACK] Seq=169 Ack=1 Win=853 Len=104 TSval=807437 TSecr=19377156
145 0.025980997 172.31.31.144 -> 172.31.23.72 OpenFlow 170 Type: OFPT_FLOW_MOD
146 0.026008139 172.31.31.144 -> 172.31.23.72 OpenFlow 170 Type: OFPT_FLOW_MOD
147 0.026026437 172.31.31.144 -> 172.31.23.72 OpenFlow 178 Type: OFPT_BARRIER_REQUEST
148 0.026062034 172.31.31.144 -> 172.31.23.72 TCP 178 6633 → 45444 [PSH, ACK] Seq=273 Ack=1 Win=853 Len=112 TSval=807437 TSecr=19377156
149 0.026089368 172.31.31.144 -> 172.31.23.72 OpenFlow 170 Type: OFPT_FLOW_MOD
150 0.026193788 172.31.31.144 -> 172.31.23.72 OpenFlow 170 Type: OFPT_FLOW_MOD
151 0.026227332 172.31.31.144 -> 172.31.23.72 OpenFlow 170 Type: OFPT_FLOW_MOD
152 0.027094720 172.31.23.72 -> 172.31.31.144 OpenFlow 74 Type: OFPT_BARRIER_REPLY
153 0.027125788 172.31.23.72 -> 172.31.31.144 OpenFlow 74 Type: OFPT_BARRIER_REPLY
154 0.027161412 172.31.23.72 -> 172.31.31.144 OpenFlow 74 Type: OFPT_BARRIER_REPLY
155 0.027207840 172.31.23.72 -> 172.31.31.144 OpenFlow 74 Type: OFPT_BARRIER_REPLY
156 0.027210566 172.31.23.72 -> 172.31.31.144 OpenFlow 82 Type: OFPT_BARRIER_REPLY
157 0.027243409 172.31.23.72 -> 172.31.31.144 TCP 66 45418 → 6633 [ACK] Seq=1 Ack=169 Win=213 Len=0 TSval=19377562 TSecr=807436
158 0.027249231 172.31.23.72 -> 172.31.31.144 OpenFlow 74 Type: OFPT_BARRIER_REPLY
159 0.027253948 172.31.23.72 -> 172.31.31.144 OpenFlow 74 Type: OFPT_BARRIER_REPLY
160 0.027296766 172.31.23.72 -> 172.31.31.144 OpenFlow 74 Type: OFPT_BARRIER_REPLY
161 0.027299497 172.31.23.72 -> 172.31.31.144 OpenFlow 74 Type: OFPT_BARRIER_REPLY
162 0.027335755 172.31.23.72 -> 172.31.31.144 OpenFlow 74 Type: OFPT_BARRIER_REPLY
163 0.027362849 172.31.23.72 -> 172.31.31.144 OpenFlow 74 Type: OFPT_BARRIER_REPLY
164 0.027386349 172.31.23.72 -> 172.31.31.144 OpenFlow 74 Type: OFPT_BARRIER_REPLY
165 0.027412954 172.31.31.144 -> 172.31.23.72 TCP 66 6633 → 45436 [ACK] Seq=337 Ack=177 Win=853 Len=0 TSval=807437 TSecr=19377562
166 0.027418584 172.31.31.144 -> 172.31.23.72 TCP 66 6633 → 45420 [ACK] Seq=505 Ack=9 Win=853 Len=0 TSval=807437 TSecr=19377562
167 0.027420938 172.31.31.144 -> 172.31.23.72 TCP 66 6633 → 45434 [ACK] Seq=385 Ack=9 Win=853 Len=0 TSval=807437 TSecr=19377562
168 0.027433975 172.31.23.72 -> 172.31.31.144 OpenFlow 74 Type: OFPT_BARRIER_REPLY
169 0.027481618 172.31.23.72 -> 172.31.31.144 OpenFlow 74 Type: OFPT_BARRIER_REPLY
170 0.027500761 172.31.23.72 -> 172.31.31.144 TCP 66 45460 → 6633 [ACK] Seq=1 Ack=169 Win=213 Len=0 TSval=19377562 TSecr=807436
171 0.027504645 172.31.23.72 -> 172.31.31.144 OpenFlow 74 Type: OFPT_BARRIER_REPLY
172 0.027519576 172.31.23.72 -> 172.31.31.144 OpenFlow 74 Type: OFPT_BARRIER_REPLY
173 0.027521896 172.31.23.72 -> 172.31.31.144 OpenFlow 74 Type: OFPT_BARRIER_REPLY
174 0.027586512 172.31.23.72 -> 172.31.31.144 TCP 66 45442 → 6633 [ACK] Seq=1 Ack=217 Win=213 Len=0 TSval=19377562 TSecr=807437
175 0.027591481 172.31.23.72 -> 172.31.31.144 OpenFlow 74 Type: OFPT_BARRIER_REPLY
176 0.027705924 172.31.31.144 -> 172.31.23.72 TCP 66 6633 → 45420 [ACK] Seq=505 Ack=25 Win=853 Len=0 TSval=807437 TSecr=19377562
177 0.027712105 172.31.31.144 -> 172.31.23.72 TCP 66 6633 → 45418 [ACK] Seq=169 Ack=9 Win=853 Len=0 TSval=807437 TSecr=19377562
178 0.027714107 172.31.31.144 -> 172.31.23.72 TCP 66 6633 → 45434 [ACK] Seq=385 Ack=17 Win=853 Len=0 TSval=807437 TSecr=19377562
179 0.027719462 172.31.23.72 -> 172.31.31.144 OpenFlow 74 Type: OFPT_BARRIER_REPLY
180 0.027726296 172.31.23.72 -> 172.31.31.144 OpenFlow 82 Type: OFPT_BARRIER_REPLY
181 0.027761811 172.31.23.72 -> 172.31.31.144 OpenFlow 146 Type: OFPT_FLOW_REMOVED
182 0.027774757 172.31.23.72 -> 172.31.31.144 OpenFlow 146 Type: OFPT_FLOW_REMOVED
183 0.027790603 172.31.23.72 -> 172.31.31.144 OpenFlow 146 Type: OFPT_FLOW_REMOVED
184 0.027797180 172.31.23.72 -> 172.31.31.144 OpenFlow 146 Type: OFPT_FLOW_REMOVED
185 0.027804693 172.31.23.72 -> 172.31.31.144 OpenFlow 146 Type: OFPT_FLOW_REMOVED
186 0.027826653 172.31.23.72 -> 172.31.31.144 OpenFlow 146 Type: OFPT_FLOW_REMOVED
187 0.027828808 172.31.23.72 -> 172.31.31.144 OpenFlow 74 Type: OFPT_BARRIER_REPLY
188 0.027843263 172.31.23.72 -> 172.31.31.144 OpenFlow 146 Type: OFPT_FLOW_REMOVED
189 0.027847962 172.31.23.72 -> 172.31.31.144 OpenFlow 146 Type: OFPT_FLOW_REMOVED
190 0.028100832 172.31.31.144 -> 172.31.23.72 TCP 66 6633 → 45424 [ACK] Seq=553 Ack=185 Win=853 Len=0 TSval=807437 TSecr=19377562
191 0.028107115 172.31.23.72 -> 172.31.31.144 OpenFlow 146 Type: OFPT_FLOW_REMOVED
192 0.028113273 172.31.31.144 -> 172.31.23.72 TCP 66 6633 → 45430 [ACK] Seq=337 Ack=257 Win=853 Len=0 TSval=807437 TSecr=19377562
193 0.028116059 172.31.31.144 -> 172.31.23.72 OpenFlow 170 Type: OFPT_FLOW_MOD
194 0.028118380 172.31.31.144 -> 172.31.23.72 OpenFlow 170 Type: OFPT_FLOW_MOD
195 0.028120245 172.31.31.144 -> 172.31.23.72 OpenFlow 178 Type: OFPT_BARRIER_REQUEST
196 0.028122212 172.31.31.144 -> 172.31.23.72 OpenFlow 178 Type: OFPT_BARRIER_REQUEST
197 0.028123533 172.31.31.144 -> 172.31.23.72 TCP 66 6633 → 45438 [ACK] Seq=1009 Ack=761 Win=853 Len=0 TSval=807437 TSecr=19377561
198 0.028126106 172.31.23.72 -> 172.31.31.144 OpenFlow 386 Type: OFPT_FLOW_REMOVED
199 0.028127767 172.31.31.144 -> 172.31.23.72 OpenFlow 170 Type: OFPT_FLOW_MOD
200 0.028129384 172.31.31.144 -> 172.31.23.72 OpenFlow 170 Type: OFPT_FLOW_MOD
201 0.028130990 172.31.31.144 -> 172.31.23.72 OpenFlow 170 Type: OFPT_FLOW_MOD
202 0.028135941 172.31.31.144 -> 172.31.23.72 TCP 66 6633 → 45460 [ACK] Seq=273 Ack=9 Win=853 Len=0 TSval=807437 TSecr=19377562
203 0.028138110 172.31.23.72 -> 172.31.31.144 OpenFlow 146 Type: OFPT_FLOW_REMOVED
204 0.028139615 172.31.31.144 -> 172.31.23.72 OpenFlow 178 Type: OFPT_BARRIER_REQUEST
205 0.028141207 172.31.31.144 -> 172.31.23.72 TCP 170 6633 → 45462 [PSH, ACK] Seq=1 Ack=1 Win=853 Len=104 TSval=807437 TSecr=19377356
206 0.028144629 172.31.31.144 -> 172.31.23.72 OpenFlow 178 Type: OFPT_BARRIER_REQUEST
207 0.028146011 172.31.31.144 -> 172.31.23.72 OpenFlow 178 Type: OFPT_BARRIER_REQUEST
208 0.028147547 172.31.31.144 -> 172.31.23.72 TCP 170 6633 → 45462 [PSH, ACK] Seq=105 Ack=1 Win=853 Len=104 TSval=807437 TSecr=19377356
209 0.028149359 172.31.31.144 -> 172.31.23.72 TCP 66 6633 → 45444 [ACK] Seq=385 Ack=17 Win=853 Len=0 TSval=807437 TSecr=19377562
210 0.028151940 172.31.23.72 -> 172.31.31.144 OpenFlow 226 Type: OFPT_FLOW_REMOVED
211 0.028161002 172.31.31.144 -> 172.31.23.72 TCP 170 6633 → 45448 [PSH, ACK] Seq=1 Ack=1 Win=853 Len=104 TSval=807437 TSecr=19377231
212 0.028163362 172.31.31.144 -> 172.31.23.72 TCP 74 6633 → 45462 [PSH, ACK] Seq=209 Ack=1 Win=853 Len=8 TSval=807437 TSecr=19377356
213 0.028164861 172.31.31.144 -> 172.31.23.72 TCP 170 6633 → 45448 [PSH, ACK] Seq=105 Ack=1 Win=853 Len=104 TSval=807437 TSecr=19377231
214 0.028173693 172.31.23.72 -> 172.31.31.144 OpenFlow 386 Type: OFPT_FLOW_REMOVED
215 0.028473160 172.31.23.72 -> 172.31.31.144 OpenFlow 146 Type: OFPT_FLOW_REMOVED
216 0.028475340 172.31.23.72 -> 172.31.31.144 OpenFlow 466 Type: OFPT_FLOW_REMOVED
217 0.028476874 172.31.23.72 -> 172.31.31.144 OpenFlow 146 Type: OFPT_FLOW_REMOVED
218 0.028478506 172.31.23.72 -> 172.31.31.144 OpenFlow 146 Type: OFPT_FLOW_REMOVED
219 0.028480142 172.31.23.72 -> 172.31.31.144 OpenFlow 146 Type: OFPT_FLOW_REMOVED
220 0.028627443 172.31.31.144 -> 172.31.23.72 TCP 66 6633 → 45442 [ACK] Seq=217 Ack=9 Win=853 Len=0 TSval=807437 TSecr=19377562
221 0.028630993 172.31.31.144 -> 172.31.23.72 OpenFlow 170 Type: OFPT_FLOW_MOD
222 0.028633522 172.31.31.144 -> 172.31.23.72 OpenFlow 170 Type: OFPT_FLOW_MOD
223 0.028635175 172.31.31.144 -> 172.31.23.72 OpenFlow 170 Type: OFPT_FLOW_MOD
224 0.028636889 172.31.31.144 -> 172.31.23.72 OpenFlow 178 Type: OFPT_BARRIER_REQUEST
225 0.028638403 172.31.31.144 -> 172.31.23.72 OpenFlow 178 Type: OFPT_BARRIER_REQUEST
226 0.028639763 172.31.31.144 -> 172.31.23.72 TCP 74 6633 → 45448 [PSH, ACK] Seq=209 Ack=1 Win=853 Len=8 TSval=807437 TSecr=19377231
227 0.028641159 172.31.31.144 -> 172.31.23.72 OpenFlow 170 Type: OFPT_FLOW_MOD
228 0.028642480 172.31.31.144 -> 172.31.23.72 OpenFlow 178 Type: OFPT_BARRIER_REQUEST
229 0.028644078 172.31.31.144 -> 172.31.23.72 OpenFlow 170 Type: OFPT_FLOW_MOD
230 0.028645812 172.31.31.144 -> 172.31.23.72 OpenFlow 170 Type: OFPT_FLOW_MOD
231 0.028647389 172.31.31.144 -> 172.31.23.72 OpenFlow 178 Type: OFPT_BARRIER_REQUEST
232 0.028648937 172.31.31.144 -> 172.31.23.72 OpenFlow 178 Type: OFPT_BARRIER_REQUEST
233 0.028650431 172.31.31.144 -> 172.31.23.72 OpenFlow 170 Type: OFPT_FLOW_MOD
234 0.028652554 172.31.31.144 -> 172.31.23.72 TCP 170 6633 → 45462 [PSH, ACK] Seq=217 Ack=1 Win=853 Len=104 TSval=807437 TSecr=19377356
235 0.028654229 172.31.31.144 -> 172.31.23.72 OpenFlow 170 Type: OFPT_FLOW_MOD
236 0.028655841 172.31.31.144 -> 172.31.23.72 OpenFlow 178 Type: OFPT_BARRIER_REQUEST
237 0.028657119 172.31.31.144 -> 172.31.23.72 TCP 178 6633 → 45462 [PSH, ACK] Seq=321 Ack=1 Win=853 Len=112 TSval=807437 TSecr=19377356
238 0.028658645 172.31.31.144 -> 172.31.23.72 OpenFlow 178 Type: OFPT_BARRIER_REQUEST
239 0.028660422 172.31.31.144 -> 172.31.23.72 OpenFlow 178 Type: OFPT_BARRIER_REQUEST
240 0.028661781 172.31.31.144 -> 172.31.23.72 OpenFlow 170 Type: OFPT_FLOW_MOD
241 0.028663736 172.31.31.144 -> 172.31.23.72 OpenFlow 170 Type: OFPT_FLOW_MOD
242 0.028665388 172.31.31.144 -> 172.31.23.72 OpenFlow 170 Type: OFPT_FLOW_MOD
243 0.028666838 172.31.31.144 -> 172.31.23.72 OpenFlow 170 Type: OFPT_FLOW_MOD
244 0.028669029 172.31.31.144 -> 172.31.23.72 TCP 170 6633 → 45448 [PSH, ACK] Seq=217 Ack=1 Win=853 Len=104 TSval=807437 TSecr=19377231
245 0.028670417 172.31.31.144 -> 172.31.23.72 OpenFlow 178 Type: OFPT_BARRIER_REQUEST
246 0.028671667 172.31.31.144 -> 172.31.23.72 OpenFlow 74 Type: OFPT_BARRIER_REQUEST
247 0.028673568 172.31.31.144 -> 172.31.23.72 OpenFlow 178 Type: OFPT_BARRIER_REQUEST
248 0.028675362 172.31.31.144 -> 172.31.23.72 TCP 178 6633 → 45448 [PSH, ACK] Seq=321 Ack=1 Win=853 Len=112 TSval=807437 TSecr=19377231
249 0.028676859 172.31.31.144 -> 172.31.23.72 TCP 170 6633 → 45422 [PSH, ACK] Seq=1 Ack=1 Win=853 Len=104 TSval=807437 TSecr=19377031
250 0.028679508 172.31.31.144 -> 172.31.23.72 OpenFlow 170 Type: OFPT_FLOW_MOD
251 0.028681030 172.31.31.144 -> 172.31.23.72 OpenFlow 170 Type: OFPT_FLOW_MOD
252 0.028682540 172.31.31.144 -> 172.31.23.72 OpenFlow 170 Type: OFPT_FLOW_MOD
253 0.028684540 172.31.31.144 -> 172.31.23.72 TCP 66 6633 → 45434 [ACK] Seq=385 Ack=97 Win=853 Len=0 TSval=807437 TSecr=19377562
254 0.028686644 172.31.31.144 -> 172.31.23.72 OpenFlow 178 Type: OFPT_BARRIER_REQUEST
255 0.028688552 172.31.31.144 -> 172.31.23.72 OpenFlow 170 Type: OFPT_FLOW_MOD
256 0.028689887 172.31.31.144 -> 172.31.23.72 TCP 178 6633 → 45422 [PSH, ACK] Seq=105 Ack=1 Win=853 Len=112 TSval=807437 TSecr=19377031
257 0.028691202 172.31.31.144 -> 172.31.23.72 OpenFlow 170 Type: OFPT_FLOW_MOD
258 0.028692846 172.31.31.144 -> 172.31.23.72 OpenFlow 170 Type: OFPT_FLOW_MOD
259 0.028694312 172.31.31.144 -> 172.31.23.72 OpenFlow 74 Type: OFPT_BARRIER_REQUEST
260 0.028695584 172.31.31.144 -> 172.31.23.72 OpenFlow 170 Type: OFPT_FLOW_MOD
261 0.028699786 172.31.31.144 -> 172.31.23.72 OpenFlow 178 Type: OFPT_BARRIER_REQUEST
262 0.028701308 172.31.31.144 -> 172.31.23.72 OpenFlow 178 Type: OFPT_BARRIER_REQUEST
263 0.029112750 172.31.31.144 -> 172.31.23.72 OpenFlow 170 Type: OFPT_FLOW_MOD
264 0.029115411 172.31.31.144 -> 172.31.23.72 OpenFlow 170 Type: OFPT_FLOW_MOD
265 0.029117305 172.31.31.144 -> 172.31.23.72 OpenFlow 178 Type: OFPT_BARRIER_REQUEST
266 0.029119022 172.31.31.144 -> 172.31.23.72 OpenFlow 178 Type: OFPT_BARRIER_REQUEST
267 0.029120382 172.31.31.144 -> 172.31.23.72 OpenFlow 170 Type: OFPT_FLOW_MOD
268 0.029121869 172.31.31.144 -> 172.31.23.72 OpenFlow 74 Type: OFPT_BARRIER_REQUEST
269 0.029123733 172.31.31.144 -> 172.31.23.72 OpenFlow 178 Type: OFPT_BARRIER_REQUEST
270 0.029125616 172.31.31.144 -> 172.31.23.72 OpenFlow 170 Type: OFPT_FLOW_MOD
271 0.029127092 172.31.31.144 -> 172.31.23.72 OpenFlow 170 Type: OFPT_FLOW_MOD
272 0.029129140 172.31.31.144 -> 172.31.23.72 OpenFlow 170 Type: OFPT_FLOW_MOD
273 0.029130746 172.31.31.144 -> 172.31.23.72 OpenFlow 170 Type: OFPT_FLOW_MOD
274 0.029132954 172.31.31.144 -> 172.31.23.72 OpenFlow 178 Type: OFPT_BARRIER_REQUEST
275 0.029134535 172.31.31.144 -> 172.31.23.72 OpenFlow 170 Type: OFPT_FLOW_MOD
276 0.029136297 172.31.31.144 -> 172.31.23.72 OpenFlow 170 Type: OFPT_FLOW_MOD
277 0.029137713 172.31.31.144 -> 172.31.23.72 OpenFlow 178 Type: OFPT_BARRIER_REQUEST
278 0.029139267 172.31.31.144 -> 172.31.23.72 OpenFlow 178 Type: OFPT_BARRIER_REQUEST
279 0.029140998 172.31.31.144 -> 172.31.23.72 OpenFlow 170 Type: OFPT_FLOW_MOD
280 0.029143196 172.31.31.144 -> 172.31.23.72 OpenFlow 74 Type: OFPT_BARRIER_REQUEST
281 0.029144611 172.31.31.144 -> 172.31.23.72 OpenFlow 170 Type: OFPT_FLOW_MOD
282 0.029146776 172.31.31.144 -> 172.31.23.72 OpenFlow 178 Type: OFPT_BARRIER_REQUEST
283 0.029148226 172.31.31.144 -> 172.31.23.72 OpenFlow 170 Type: OFPT_FLOW_MOD
284 0.029149883 172.31.31.144 -> 172.31.23.72 OpenFlow 170 Type: OFPT_FLOW_MOD
285 0.029154060 172.31.31.144 -> 172.31.23.72 TCP 66 6633 → 45438 [ACK] Seq=1009 Ack=1089 Win=853 Len=0 TSval=807438 TSecr=19377562
286 0.029156352 172.31.31.144 -> 172.31.23.72 OpenFlow 170 Type: OFPT_FLOW_MOD
287 0.029157987 172.31.31.144 -> 172.31.23.72 TCP 66 6633 → 45460 [ACK] Seq=601 Ack=169 Win=853 Len=0 TSval=807438 TSecr=19377562
288 0.029160254 172.31.31.144 -> 172.31.23.72 OpenFlow 170 Type: OFPT_FLOW_MOD
289 0.029169842 172.31.31.144 -> 172.31.23.72 OpenFlow 170 Type: OFPT_FLOW_MOD
290 0.029171510 172.31.31.144 -> 172.31.23.72 OpenFlow 170 Type: OFPT_FLOW_MOD
291 0.029173478 172.31.31.144 -> 172.31.23.72 OpenFlow 170 Type: OFPT_FLOW_MOD
292 0.029189287 172.31.31.144 -> 172.31.23.72 OpenFlow 170 Type: OFPT_FLOW_MOD
293 0.029191676 172.31.31.144 -> 172.31.23.72 OpenFlow 170 Type: OFPT_FLOW_MOD
294 0.029193559 172.31.31.144 -> 172.31.23.72 OpenFlow 170 Type: OFPT_FLOW_MOD
295 0.029204542 172.31.31.144 -> 172.31.23.72 OpenFlow 170 Type: OFPT_FLOW_MOD
296 0.029245797 172.31.31.144 -> 172.31.23.72 OpenFlow 170 Type: OFPT_FLOW_MOD
297 0.029259958 172.31.31.144 -> 172.31.23.72 OpenFlow 170 Type: OFPT_FLOW_MOD
298 0.029280147 172.31.31.144 -> 172.31.23.72 OpenFlow 170 Type: OFPT_FLOW_MOD
299 0.029355948 172.31.31.144 -> 172.31.23.72 OpenFlow 170 Type: OFPT_FLOW_MOD
300 0.029661238 172.31.23.72 -> 172.31.31.144 OpenFlow 74 Type: OFPT_BARRIER_REPLY
301 0.029694027 172.31.23.72 -> 172.31.31.144 OpenFlow 74 Type: OFPT_BARRIER_REPLY
302 0.029722011 172.31.23.72 -> 172.31.31.144 OpenFlow 74 Type: OFPT_BARRIER_REPLY
303 0.029767649 172.31.23.72 -> 172.31.31.144 OpenFlow 74 Type: OFPT_BARRIER_REPLY
304 0.029823419 172.31.23.72 -> 172.31.31.144 OpenFlow 82 Type: OFPT_BARRIER_REPLY
305 0.029842586 172.31.23.72 -> 172.31.31.144 OpenFlow 74 Type: OFPT_BARRIER_REPLY
306 0.029870282 172.31.23.72 -> 172.31.31.144 OpenFlow 74 Type: OFPT_BARRIER_REPLY
307 0.029899024 172.31.23.72 -> 172.31.31.144 OpenFlow 74 Type: OFPT_BARRIER_REPLY
308 0.029932045 172.31.23.72 -> 172.31.31.144 OpenFlow 74 Type: OFPT_BARRIER_REPLY
309 0.030007000 172.31.23.72 -> 172.31.31.144 OpenFlow 74 Type: OFPT_BARRIER_REPLY
310 0.030010335 172.31.23.72 -> 172.31.31.144 OpenFlow 82 Type: OFPT_BARRIER_REPLY
311 0.030068410 172.31.23.72 -> 172.31.31.144 OpenFlow 74 Type: OFPT_BARRIER_REPLY
312 0.030105415 172.31.23.72 -> 172.31.31.144 OpenFlow 74 Type: OFPT_BARRIER_REPLY
313 0.030115677 172.31.31.144 -> 172.31.23.72 TCP 66 6633 → 45462 [ACK] Seq=433 Ack=17 Win=853 Len=0 TSval=807438 TSecr=19377562
314 0.030159318 172.31.23.72 -> 172.31.31.144 OpenFlow 74 Type: OFPT_BARRIER_REPLY
315 0.030196955 172.31.23.72 -> 172.31.31.144 OpenFlow 74 Type: OFPT_BARRIER_REPLY
316 0.030231636 172.31.23.72 -> 172.31.31.144 OpenFlow 74 Type: OFPT_BARRIER_REPLY
317 0.030280711 172.31.23.72 -> 172.31.31.144 TCP 66 45414 → 6633 [ACK] Seq=169 Ack=385 Win=213 Len=0 TSval=19377563 TSecr=807437
318 0.030283109 172.31.23.72 -> 172.31.31.144 OpenFlow 82 Type: OFPT_BARRIER_REPLY
319 0.030287331 172.31.23.72 -> 172.31.31.144 OpenFlow 74 Type: OFPT_BARRIER_REPLY
320 0.030306939 172.31.23.72 -> 172.31.31.144 TCP 66 45454 → 6633 [ACK] Seq=169 Ack=385 Win=213 Len=0 TSval=19377563 TSecr=807437
321 0.030317513 172.31.23.72 -> 172.31.31.144 OpenFlow 74 Type: OFPT_BARRIER_REPLY
322 0.030340281 172.31.23.72 -> 172.31.31.144 OpenFlow 74 Type: OFPT_BARRIER_REPLY
323 0.030376620 172.31.23.72 -> 172.31.31.144 OpenFlow 74 Type: OFPT_BARRIER_REPLY
324 0.030378813 172.31.23.72 -> 172.31.31.144 OpenFlow 74 Type: OFPT_BARRIER_REPLY
325 0.030415534 172.31.23.72 -> 172.31.31.144 TCP 66 45422 → 6633 [ACK] Seq=1 Ack=217 Win=213 Len=0 TSval=19377563 TSecr=807437
326 0.030420356 172.31.23.72 -> 172.31.31.144 OpenFlow 74 Type: OFPT_BARRIER_REPLY
327 0.031069337 172.31.31.144 -> 172.31.23.72 TCP 66 6633 → 45436 [ACK] Seq=1089 Ack=361 Win=853 Len=0 TSval=807438 TSecr=19377562
328 0.031079225 172.31.23.72 -> 172.31.31.144 OpenFlow 74 Type: OFPT_BARRIER_REPLY
329 0.031085570 172.31.23.72 -> 172.31.31.144 OpenFlow 74 Type: OFPT_BARRIER_REPLY
330 0.031335691 172.31.23.72 -> 172.31.31.144 OpenFlow 74 Type: OFPT_BARRIER_REPLY
331 0.031337596 172.31.23.72 -> 172.31.31.144 OpenFlow 74 Type: OFPT_BARRIER_REPLY
332 0.031339122 172.31.23.72 -> 172.31.31.144 OpenFlow 82 Type: OFPT_BARRIER_REPLY
333 0.031856684 172.31.23.72 -> 172.31.31.144 OpenFlow 74 Type: OFPT_BARRIER_REPLY
334 0.031863065 172.31.23.72 -> 172.31.31.144 OpenFlow 74 Type: OFPT_BARRIER_REPLY
335 0.033556166 172.31.31.144 -> 172.31.23.72 TCP 66 6633 → 45422 [ACK] Seq=217 Ack=9 Win=853 Len=0 TSval=807438 TSecr=19377563
336 0.033563461 172.31.31.144 -> 172.31.23.72 TCP 66 6633 → 45420 [ACK] Seq=1673 Ack=529 Win=853 Len=0 TSval=807438 TSecr=19377562
337 0.033565968 172.31.31.144 -> 172.31.23.72 TCP 66 6633 → 45428 [ACK] Seq=937 Ack=521 Win=853 Len=0 TSval=807438 TSecr=19377563
338 0.033568211 172.31.31.144 -> 172.31.23.72 TCP 66 6633 → 45460 [ACK] Seq=705 Ack=185 Win=853 Len=0 TSval=807438 TSecr=19377563
339 0.033570209 172.31.31.144 -> 172.31.23.72 TCP 66 6633 → 45432 [ACK] Seq=1105 Ack=681 Win=853 Len=0 TSval=807438 TSecr=19377562
340 0.033572544 172.31.31.144 -> 172.31.23.72 TCP 66 6633 → 45444 [ACK] Seq=1137 Ack=201 Win=853 Len=0 TSval=807438 TSecr=19377562
341 0.033574456 172.31.31.144 -> 172.31.23.72 TCP 66 6633 → 45448 [ACK] Seq=433 Ack=9 Win=853 Len=0 TSval=807438 TSecr=19377563
342 0.033579274 172.31.31.144 -> 172.31.23.72 TCP 66 6633 → 45430 [ACK] Seq=873 Ack=353 Win=853 Len=0 TSval=807438 TSecr=19377563
343 0.033581262 172.31.31.144 -> 172.31.23.72 TCP 66 6633 → 45446 [ACK] Seq=1865 Ack=1113 Win=853 Len=0 TSval=807438 TSecr=19377563
344 0.033583141 172.31.31.144 -> 172.31.23.72 TCP 66 6633 → 45458 [ACK] Seq=2017 Ack=873 Win=853 Len=0 TSval=807438 TSecr=19377563
345 0.034196883 172.31.31.144 -> 172.31.23.72 TCP 66 6633 → 45448 [ACK] Seq=433 Ack=17 Win=853 Len=0 TSval=807439 TSecr=19377563
346 0.034202860 172.31.31.144 -> 172.31.23.72 TCP 66 6633 → 45426 [ACK] Seq=601 Ack=185 Win=853 Len=0 TSval=807439 TSecr=19377563
347 0.064850943 172.31.31.144 -> 172.31.23.72 TCP 66 6633 → 45416 [ACK] Seq=593 Ack=177 Win=853 Len=0 TSval=807447 TSecr=19377562
348 0.068820876 172.31.31.144 -> 172.31.23.72 TCP 66 6633 → 45454 [ACK] Seq=385 Ack=177 Win=853 Len=0 TSval=807448 TSecr=19377563
349 0.068831589 172.31.31.144 -> 172.31.23.72 TCP 66 6633 → 45424 [ACK] Seq=977 Ack=353 Win=853 Len=0 TSval=807448 TSecr=19377562
350 0.068836813 172.31.31.144 -> 172.31.23.72 TCP 66 6633 → 45418 [ACK] Seq=593 Ack=177 Win=853 Len=0 TSval=807448 TSecr=19377562
351 0.068850455 172.31.31.144 -> 172.31.23.72 TCP 66 6633 → 45414 [ACK] Seq=385 Ack=177 Win=853 Len=0 TSval=807448 TSecr=19377563
352 0.068854004 172.31.31.144 -> 172.31.23.72 TCP 66 6633 → 45432 [ACK] Seq=1105 Ack=689 Win=853 Len=0 TSval=807448 TSecr=19377563
353 0.068876028 172.31.31.144 -> 172.31.23.72 TCP 66 6633 → 45434 [ACK] Seq=809 Ack=185 Win=853 Len=0 TSval=807448 TSecr=19377562
354 0.294014188 172.31.31.144 -> 172.31.23.72 OpenFlow 90 Type: OFPT_MULTIPART_REQUEST, OFPMP_PORT_STATS
355 0.294041634 172.31.31.144 -> 172.31.23.72 OpenFlow 138 Type: OFPT_MULTIPART_REQUEST, OFPMP_FLOW
356 0.294424654 172.31.23.72 -> 172.31.31.144 OpenFlow 530 Type: OFPT_MULTIPART_REPLY, OFPMP_PORT_STATS
357 0.294608615 172.31.23.72 -> 172.31.31.144 OpenFlow 6178 Type: OFPT_MULTIPART_REPLY, OFPMP_TABLE
358 0.294696305 172.31.31.144 -> 172.31.23.72 TCP 66 6633 → 45414 [ACK] Seq=481 Ack=641 Win=853 Len=0 TSval=807504 TSecr=19377629
359 0.294717274 172.31.23.72 -> 172.31.31.144 OpenFlow 2010 Type: OFPT_MULTIPART_REPLY, OFPMP_FLOW
360 0.294847996 172.31.31.144 -> 172.31.23.72 TCP 66 6633 → 45414 [ACK] Seq=481 Ack=6753 Win=853 Len=0 TSval=807504 TSecr=19377629
361 0.294890336 172.31.31.144 -> 172.31.23.72 TCP 66 6633 → 45414 [ACK] Seq=481 Ack=8697 Win=853 Len=0 TSval=807504 TSecr=19377629
362 0.343169742 172.31.31.144 -> 172.31.23.72 OpenFlow 82 Type: OFPT_MULTIPART_REQUEST, OFPMP_TABLE
363 0.343219644 172.31.31.144 -> 172.31.23.72 OpenFlow 146 Type: OFPT_MULTIPART_REQUEST, OFPMP_PORT_STATS
364 0.343622651 172.31.23.72 -> 172.31.31.144 OpenFlow 6178 Type: OFPT_MULTIPART_REPLY, OFPMP_TABLE
365 0.343713133 172.31.23.72 -> 172.31.31.144 OpenFlow 2634 Type: OFPT_MULTIPART_REPLY, OFPMP_FLOW
366 0.343831279 172.31.23.72 -> 172.31.31.144 OpenFlow 642 Type: OFPT_MULTIPART_REPLY, OFPMP_PORT_STATS
367 0.343854471 172.31.31.144 -> 172.31.23.72 TCP 66 6633 → 45416 [ACK] Seq=689 Ack=6289 Win=853 Len=0 TSval=807516 TSecr=19377641
368 0.343907446 172.31.31.144 -> 172.31.23.72 TCP 66 6633 → 45416 [ACK] Seq=689 Ack=8857 Win=853 Len=0 TSval=807516 TSecr=19377641
369 0.344031372 172.31.31.144 -> 172.31.23.72 TCP 66 6633 → 45416 [ACK] Seq=689 Ack=9433 Win=853 Len=0 TSval=807516 TSecr=19377641
370 0.376358856 172.31.31.144 -> 172.31.23.72 OpenFlow 90 Type: OFPT_MULTIPART_REQUEST, OFPMP_PORT_STATS
371 0.376397416 172.31.31.144 -> 172.31.23.72 OpenFlow 138 Type: OFPT_MULTIPART_REQUEST, OFPMP_FLOW
372 0.376709774 172.31.23.72 -> 172.31.31.144 OpenFlow 754 Type: OFPT_MULTIPART_REPLY, OFPMP_PORT_STATS
373 0.376895201 172.31.23.72 -> 172.31.31.144 OpenFlow 6178 Type: OFPT_MULTIPART_REPLY, OFPMP_TABLE
374 0.376947398 172.31.31.144 -> 172.31.23.72 TCP 66 6633 → 45418 [ACK] Seq=689 Ack=865 Win=853 Len=0 TSval=807525 TSecr=19377649
375 0.376993542 172.31.23.72 -> 172.31.31.144 OpenFlow 2426 Type: OFPT_MULTIPART_REPLY, OFPMP_FLOW
376 0.377163734 172.31.31.144 -> 172.31.23.72 TCP 66 6633 → 45418 [ACK] Seq=689 Ack=6977 Win=853 Len=0 TSval=807525 TSecr=19377649
377 0.377168864 172.31.31.144 -> 172.31.23.72 TCP 66 6633 → 45418 [ACK] Seq=689 Ack=9337 Win=853 Len=0 TSval=807525 TSecr=19377649
378 0.402528687 172.31.31.144 -> 172.31.23.72 OpenFlow 90 Type: OFPT_MULTIPART_REQUEST, OFPMP_PORT_STATS
379 0.402572284 172.31.31.144 -> 172.31.23.72 OpenFlow 138 Type: OFPT_MULTIPART_REQUEST, OFPMP_TABLE
380 0.402714210 172.31.23.72 -> 172.31.31.144 OpenFlow 642 Type: OFPT_MULTIPART_REPLY, OFPMP_PORT_STATS
381 0.402801377 172.31.23.72 -> 172.31.31.144 OpenFlow 2218 Type: OFPT_MULTIPART_REPLY, OFPMP_FLOW
382 0.402964395 172.31.23.72 -> 172.31.31.144 OpenFlow 6178 Type: OFPT_MULTIPART_REPLY, OFPMP_TABLE
383 0.403043119 172.31.31.144 -> 172.31.23.72 TCP 66 6633 → 45420 [ACK] Seq=1769 Ack=3257 Win=853 Len=0 TSval=807531 TSecr=19377656
384 0.404290429 172.31.31.144 -> 172.31.23.72 TCP 187 6633 → 45452 [PSH, ACK] Seq=1 Ack=1 Win=853 Len=121 TSval=807531 TSecr=19377231
385 0.404324101 172.31.31.144 -> 172.31.23.72 TCP 187 6633 → 45452 [PSH, ACK] Seq=122 Ack=1 Win=853 Len=121 TSval=807531 TSecr=19377231
386 0.404384655 172.31.31.144 -> 172.31.23.72 TCP 187 6633 → 45452 [PSH, ACK] Seq=243 Ack=1 Win=853 Len=121 TSval=807531 TSecr=19377231
387 0.404454660 172.31.31.144 -> 172.31.23.72 TCP 187 6633 → 45452 [PSH, ACK] Seq=364 Ack=1 Win=853 Len=121 TSval=807531 TSecr=19377231
388 0.404539096 172.31.31.144 -> 172.31.23.72 TCP 187 6633 → 45452 [PSH, ACK] Seq=485 Ack=1 Win=853 Len=121 TSval=807531 TSecr=19377231
389 0.404580377 172.31.31.144 -> 172.31.23.72 TCP 187 6633 → 45452 [PSH, ACK] Seq=606 Ack=1 Win=853 Len=121 TSval=807531 TSecr=19377231
