  1 0.000000000 172.31.31.144 -> 172.31.23.72 TCP 90 6633 → 45510 [PSH, ACK] Seq=1 Ack=1 Win=853 Len=24 TSval=1202204 TSecr=30023754
  2 0.000340726 172.31.23.72 -> 172.31.31.144 OpenFlow 642 Type: OFPT_MULTIPART_REPLY, OFPMP_PORT_STATS
  3 0.000578011 172.31.31.144 -> 172.31.23.72 TCP 66 6633 → 45510 [ACK] Seq=25 Ack=577 Win=853 Len=0 TSval=1202204 TSecr=30023795
  4 0.001160697 172.31.31.144 -> 172.31.23.72 OpenFlow 122 Type: OFPT_MULTIPART_REQUEST, OFPMP_FLOW
  5 0.001166843 172.31.31.144 -> 172.31.23.72 OpenFlow 82 Type: OFPT_MULTIPART_REQUEST, OFPMP_TABLE
  6 0.001343598 172.31.23.72 -> 172.31.31.144 OpenFlow 2634 Type: OFPT_MULTIPART_REPLY, OFPMP_FLOW
  7 0.001510448 172.31.23.72 -> 172.31.31.144 OpenFlow 6178 Type: OFPT_MULTIPART_REPLY, OFPMP_TABLE
  8 0.001745592 172.31.31.144 -> 172.31.23.72 TCP 66 6633 → 45510 [ACK] Seq=97 Ack=9257 Win=853 Len=0 TSval=1202205 TSecr=30023796
  9 0.007300252 172.31.31.144 -> 172.31.23.72 TCP 90 6633 → 45512 [PSH, ACK] Seq=1 Ack=1 Win=853 Len=24 TSval=1202206 TSecr=30023754
 10 0.007308019 172.31.31.144 -> 172.31.23.72 TCP 138 6633 → 45512 [PSH, ACK] Seq=25 Ack=1 Win=853 Len=72 TSval=1202206 TSecr=30023754
 11 0.007477148 172.31.23.72 -> 172.31.31.144 OpenFlow 754 Type: OFPT_MULTIPART_REPLY, OFPMP_PORT_STATS
 12 0.007553407 172.31.23.72 -> 172.31.31.144 OpenFlow 2634 Type: OFPT_MULTIPART_REPLY, OFPMP_FLOW
 13 0.007699267 172.31.23.72 -> 172.31.31.144 OpenFlow 6178 Type: OFPT_MULTIPART_REPLY, OFPMP_TABLE
 14 0.007785108 172.31.31.144 -> 172.31.23.72 TCP 66 6633 → 45512 [ACK] Seq=97 Ack=3257 Win=853 Len=0 TSval=1202206 TSecr=30023797
 15 0.041443444 172.31.31.144 -> 172.31.23.72 TCP 122 6633 → 45514 [PSH, ACK] Seq=1 Ack=1 Win=853 Len=56 TSval=1202214 TSecr=30023754
 16 0.041460394 172.31.31.144 -> 172.31.23.72 TCP 106 6633 → 45514 [PSH, ACK] Seq=57 Ack=1 Win=853 Len=40 TSval=1202214 TSecr=30023754
 17 0.041643456 172.31.23.72 -> 172.31.31.144 OpenFlow 2218 Type: OFPT_MULTIPART_REPLY, OFPMP_FLOW
 18 0.041757800 172.31.23.72 -> 172.31.31.144 OpenFlow 642 Type: OFPT_MULTIPART_REPLY, OFPMP_PORT_STATS
 19 0.041866738 172.31.31.144 -> 172.31.23.72 TCP 66 6633 → 45514 [ACK] Seq=97 Ack=2153 Win=853 Len=0 TSval=1202215 TSecr=30023806
 20 0.041923441 172.31.23.72 -> 172.31.31.144 OpenFlow 6178 Type: OFPT_MULTIPART_REPLY, OFPMP_TABLE
 21 0.041933158 172.31.31.144 -> 172.31.23.72 TCP 66 6633 → 45514 [ACK] Seq=97 Ack=2729 Win=853 Len=0 TSval=1202215 TSecr=30023806
 22 0.042159426 172.31.31.144 -> 172.31.23.72 TCP 66 6633 → 45514 [ACK] Seq=97 Ack=8841 Win=853 Len=0 TSval=1202215 TSecr=30023806
 23 0.045777135 172.31.31.144 -> 172.31.23.72 TCP 66 6633 → 45512 [ACK] Seq=97 Ack=9369 Win=853 Len=0 TSval=1202216 TSecr=30023797
 24 0.080606821 172.31.31.144 -> 172.31.23.72 TCP 82 6633 → 45516 [PSH, ACK] Seq=1 Ack=1 Win=853 Len=16 TSval=1202224 TSecr=30023754
 25 0.080620024 172.31.31.144 -> 172.31.23.72 TCP 146 6633 → 45516 [PSH, ACK] Seq=17 Ack=1 Win=853 Len=80 TSval=1202224 TSecr=30023754
 26 0.081011406 172.31.23.72 -> 172.31.31.144 OpenFlow 6178 Type: OFPT_MULTIPART_REPLY, OFPMP_TABLE
 27 0.081080399 172.31.23.72 -> 172.31.31.144 OpenFlow 346 Type: OFPT_MULTIPART_REPLY, OFPMP_FLOW
 28 0.081153450 172.31.23.72 -> 172.31.31.144 OpenFlow 530 Type: OFPT_MULTIPART_REPLY, OFPMP_PORT_STATS
 29 0.081346812 172.31.31.144 -> 172.31.23.72 TCP 66 6633 → 45516 [ACK] Seq=97 Ack=6113 Win=853 Len=0 TSval=1202224 TSecr=30023816
 30 0.081353781 172.31.31.144 -> 172.31.23.72 TCP 66 6633 → 45516 [ACK] Seq=97 Ack=6393 Win=853 Len=0 TSval=1202224 TSecr=30023816
 31 0.081356104 172.31.31.144 -> 172.31.23.72 TCP 66 6633 → 45516 [ACK] Seq=97 Ack=6857 Win=853 Len=0 TSval=1202224 TSecr=30023816
 32 0.123719013 172.31.31.144 -> 172.31.23.72 TCP 82 6633 → 45518 [PSH, ACK] Seq=1 Ack=1 Win=853 Len=16 TSval=1202235 TSecr=30023754
 33 0.123747093 172.31.23.72 -> 172.31.31.144 TCP 66 45518 → 6633 [ACK] Seq=1 Ack=17 Win=213 Len=0 TSval=30023826 TSecr=1202235
 34 0.123754427 172.31.31.144 -> 172.31.23.72 TCP 146 6633 → 45518 [PSH, ACK] Seq=17 Ack=1 Win=853 Len=80 TSval=1202235 TSecr=30023754
 35 0.123759836 172.31.23.72 -> 172.31.31.144 TCP 66 45518 → 6633 [ACK] Seq=1 Ack=97 Win=213 Len=0 TSval=30023826 TSecr=1202235
 36 0.124108807 172.31.23.72 -> 172.31.31.144 OpenFlow 6178 Type: OFPT_MULTIPART_REPLY, OFPMP_TABLE
 37 0.124233855 172.31.23.72 -> 172.31.31.144 OpenFlow 754 Type: OFPT_MULTIPART_REPLY, OFPMP_PORT_STATS
 38 0.124314075 172.31.23.72 -> 172.31.31.144 OpenFlow 2842 Type: OFPT_MULTIPART_REPLY, OFPMP_FLOW
 39 0.124443228 172.31.31.144 -> 172.31.23.72 TCP 66 6633 → 45518 [ACK] Seq=97 Ack=6801 Win=853 Len=0 TSval=1202235 TSecr=30023826
 40 0.161812942 172.31.31.144 -> 172.31.23.72 TCP 66 6633 → 45518 [ACK] Seq=97 Ack=9577 Win=853 Len=0 TSval=1202245 TSecr=30023826
 41 0.167176932 172.31.31.144 -> 172.31.23.72 TCP 122 6633 → 45520 [PSH, ACK] Seq=1 Ack=1 Win=853 Len=56 TSval=1202246 TSecr=30023754
 42 0.167197429 172.31.31.144 -> 172.31.23.72 TCP 106 6633 → 45520 [PSH, ACK] Seq=57 Ack=1 Win=853 Len=40 TSval=1202246 TSecr=30023754
 43 0.167555385 172.31.23.72 -> 172.31.31.144 OpenFlow 1386 Type: OFPT_MULTIPART_REPLY, OFPMP_FLOW
 44 0.167690169 172.31.23.72 -> 172.31.31.144 OpenFlow 754 Type: OFPT_MULTIPART_REPLY, OFPMP_PORT_STATS
 45 0.167793936 172.31.31.144 -> 172.31.23.72 TCP 66 6633 → 45520 [ACK] Seq=97 Ack=1321 Win=853 Len=0 TSval=1202246 TSecr=30023837
 46 0.167864752 172.31.31.144 -> 172.31.23.72 TCP 66 6633 → 45520 [ACK] Seq=97 Ack=2009 Win=853 Len=0 TSval=1202246 TSecr=30023837
 47 0.167882220 172.31.23.72 -> 172.31.31.144 OpenFlow 6178 Type: OFPT_MULTIPART_REPLY, OFPMP_TABLE
 48 0.168114108 172.31.31.144 -> 172.31.23.72 TCP 66 6633 → 45520 [ACK] Seq=97 Ack=8121 Win=853 Len=0 TSval=1202246 TSecr=30023837
 49 0.204342999 172.31.31.144 -> 172.31.23.72 TCP 82 6633 → 45522 [PSH, ACK] Seq=1 Ack=1 Win=853 Len=16 TSval=1202255 TSecr=30023754
 50 0.204370025 172.31.31.144 -> 172.31.23.72 TCP 146 6633 → 45522 [PSH, ACK] Seq=17 Ack=1 Win=853 Len=80 TSval=1202255 TSecr=30023754
 51 0.204793567 172.31.23.72 -> 172.31.31.144 OpenFlow 6178 Type: OFPT_MULTIPART_REPLY, OFPMP_TABLE
 52 0.204904187 172.31.23.72 -> 172.31.31.144 OpenFlow 530 Type: OFPT_MULTIPART_REPLY, OFPMP_PORT_STATS
 53 0.204968363 172.31.23.72 -> 172.31.31.144 OpenFlow 1386 Type: OFPT_MULTIPART_REPLY, OFPMP_FLOW
 54 0.205111921 172.31.31.144 -> 172.31.23.72 TCP 66 6633 → 45522 [ACK] Seq=97 Ack=6113 Win=853 Len=0 TSval=1202255 TSecr=30023847
 55 0.205118990 172.31.31.144 -> 172.31.23.72 TCP 66 6633 → 45522 [ACK] Seq=97 Ack=6577 Win=853 Len=0 TSval=1202255 TSecr=30023847
 56 0.205141642 172.31.31.144 -> 172.31.23.72 TCP 66 6633 → 45522 [ACK] Seq=97 Ack=7897 Win=853 Len=0 TSval=1202255 TSecr=30023847
 57 0.248441155 172.31.31.144 -> 172.31.23.72 TCP 90 6633 → 45524 [PSH, ACK] Seq=1 Ack=1 Win=853 Len=24 TSval=1202266 TSecr=30023754
 58 0.248457986 172.31.31.144 -> 172.31.23.72 TCP 138 6633 → 45524 [PSH, ACK] Seq=25 Ack=1 Win=853 Len=72 TSval=1202266 TSecr=30023754
 59 0.248747250 172.31.23.72 -> 172.31.31.144 OpenFlow 754 Type: OFPT_MULTIPART_REPLY, OFPMP_PORT_STATS
 60 0.248838568 172.31.23.72 -> 172.31.31.144 OpenFlow 1802 Type: OFPT_MULTIPART_REPLY, OFPMP_FLOW
 61 0.248971306 172.31.31.144 -> 172.31.23.72 TCP 66 6633 → 45524 [ACK] Seq=97 Ack=689 Win=853 Len=0 TSval=1202266 TSecr=30023857
 62 0.249019089 172.31.23.72 -> 172.31.31.144 OpenFlow 6178 Type: OFPT_MULTIPART_REPLY, OFPMP_TABLE
 63 0.249056237 172.31.31.144 -> 172.31.23.72 TCP 66 6633 → 45524 [ACK] Seq=97 Ack=2425 Win=853 Len=0 TSval=1202266 TSecr=30023858
 64 0.249280998 172.31.31.144 -> 172.31.23.72 TCP 66 6633 → 45524 [ACK] Seq=97 Ack=8537 Win=853 Len=0 TSval=1202266 TSecr=30023858
 65 0.290554163 172.31.31.144 -> 172.31.23.72 TCP 82 6633 → 45526 [PSH, ACK] Seq=1 Ack=1 Win=853 Len=16 TSval=1202277 TSecr=30023729
 66 0.290573841 172.31.31.144 -> 172.31.23.72 TCP 146 6633 → 45526 [PSH, ACK] Seq=17 Ack=1 Win=853 Len=80 TSval=1202277 TSecr=30023729
 67 0.290985335 172.31.23.72 -> 172.31.31.144 OpenFlow 6178 Type: OFPT_MULTIPART_REPLY, OFPMP_TABLE
 68 0.291098401 172.31.23.72 -> 172.31.31.144 OpenFlow 642 Type: OFPT_MULTIPART_REPLY, OFPMP_PORT_STATS
 69 0.291168471 172.31.23.72 -> 172.31.31.144 OpenFlow 2010 Type: OFPT_MULTIPART_REPLY, OFPMP_FLOW
 70 0.291319986 172.31.31.144 -> 172.31.23.72 TCP 66 6633 → 45526 [ACK] Seq=97 Ack=6113 Win=853 Len=0 TSval=1202277 TSecr=30023868
 71 0.291327145 172.31.31.144 -> 172.31.23.72 TCP 66 6633 → 45526 [ACK] Seq=97 Ack=6689 Win=853 Len=0 TSval=1202277 TSecr=30023868
 72 0.291399523 172.31.31.144 -> 172.31.23.72 TCP 66 6633 → 45526 [ACK] Seq=97 Ack=8633 Win=853 Len=0 TSval=1202277 TSecr=30023868
 73 0.352720960 172.31.31.144 -> 172.31.23.72 TCP 82 6633 → 45528 [PSH, ACK] Seq=1 Ack=1 Win=853 Len=16 TSval=1202292 TSecr=30023754
 74 0.352741243 172.31.31.144 -> 172.31.23.72 TCP 146 6633 → 45528 [PSH, ACK] Seq=17 Ack=1 Win=853 Len=80 TSval=1202292 TSecr=30023754
 75 0.353011370 172.31.23.72 -> 172.31.31.144 OpenFlow 6178 Type: OFPT_MULTIPART_REPLY, OFPMP_TABLE
 76 0.353108442 172.31.23.72 -> 172.31.31.144 OpenFlow 2842 Type: OFPT_MULTIPART_REPLY, OFPMP_FLOW
 77 0.353211862 172.31.23.72 -> 172.31.31.144 OpenFlow 754 Type: OFPT_MULTIPART_REPLY, OFPMP_PORT_STATS
 78 0.353314567 172.31.31.144 -> 172.31.23.72 TCP 66 6633 → 45528 [ACK] Seq=97 Ack=8889 Win=853 Len=0 TSval=1202292 TSecr=30023884
 79 0.388833397 172.31.31.144 -> 172.31.23.72 TCP 122 6633 → 45530 [PSH, ACK] Seq=1 Ack=1 Win=853 Len=56 TSval=1202301 TSecr=30023730
 80 0.388844143 172.31.31.144 -> 172.31.23.72 TCP 106 6633 → 45530 [PSH, ACK] Seq=57 Ack=1 Win=853 Len=40 TSval=1202301 TSecr=30023730
 81 0.388978565 172.31.23.72 -> 172.31.31.144 OpenFlow 346 Type: OFPT_MULTIPART_REPLY, OFPMP_FLOW
 82 0.389070568 172.31.23.72 -> 172.31.31.144 OpenFlow 642 Type: OFPT_MULTIPART_REPLY, OFPMP_PORT_STATS
 83 0.389220374 172.31.23.72 -> 172.31.31.144 OpenFlow 6178 Type: OFPT_MULTIPART_REPLY, OFPMP_TABLE
 84 0.389277010 172.31.31.144 -> 172.31.23.72 TCP 66 6633 → 45530 [ACK] Seq=97 Ack=857 Win=853 Len=0 TSval=1202301 TSecr=30023893
 85 0.389778393 172.31.31.144 -> 172.31.23.72 TCP 66 6633 → 45528 [ACK] Seq=97 Ack=9577 Win=853 Len=0 TSval=1202302 TSecr=30023884
 86 0.425845305 172.31.31.144 -> 172.31.23.72 TCP 66 6633 → 45530 [ACK] Seq=97 Ack=6969 Win=853 Len=0 TSval=1202311 TSecr=30023893
 87 0.463137841 172.31.31.144 -> 172.31.23.72 TCP 90 6633 → 45532 [PSH, ACK] Seq=1 Ack=1 Win=853 Len=24 TSval=1202320 TSecr=30023730
 88 0.463486841 172.31.23.72 -> 172.31.31.144 OpenFlow 642 Type: OFPT_MULTIPART_REPLY, OFPMP_PORT_STATS
 89 0.464240291 172.31.31.144 -> 172.31.23.72 OpenFlow 122 Type: OFPT_MULTIPART_REQUEST, OFPMP_FLOW
 90 0.464249509 172.31.31.144 -> 172.31.23.72 OpenFlow 82 Type: OFPT_MULTIPART_REQUEST, OFPMP_TABLE
 91 0.464383233 172.31.23.72 -> 172.31.31.144 OpenFlow 1594 Type: OFPT_MULTIPART_REPLY, OFPMP_FLOW
 92 0.464546639 172.31.23.72 -> 172.31.31.144 OpenFlow 6178 Type: OFPT_MULTIPART_REPLY, OFPMP_TABLE
 93 0.464783246 172.31.31.144 -> 172.31.23.72 TCP 66 6633 → 45532 [ACK] Seq=97 Ack=8217 Win=853 Len=0 TSval=1202320 TSecr=30023911
 94 0.508413845 172.31.31.144 -> 172.31.23.72 TCP 122 6633 → 45534 [PSH, ACK] Seq=1 Ack=1 Win=853 Len=56 TSval=1202331 TSecr=30023754
 95 0.508442263 172.31.23.72 -> 172.31.31.144 TCP 66 45534 → 6633 [ACK] Seq=1 Ack=57 Win=213 Len=0 TSval=30023922 TSecr=1202331
 96 0.508448618 172.31.31.144 -> 172.31.23.72 TCP 90 6633 → 45534 [PSH, ACK] Seq=57 Ack=1 Win=853 Len=24 TSval=1202331 TSecr=30023754
 97 0.508452196 172.31.23.72 -> 172.31.31.144 TCP 66 45534 → 6633 [ACK] Seq=1 Ack=81 Win=213 Len=0 TSval=30023922 TSecr=1202331
 98 0.508609653 172.31.23.72 -> 172.31.31.144 OpenFlow 762 Type: OFPT_MULTIPART_REPLY, OFPMP_FLOW
 99 0.508715881 172.31.23.72 -> 172.31.31.144 OpenFlow 530 Type: OFPT_MULTIPART_REPLY, OFPMP_PORT_STATS
100 0.508913850 172.31.31.144 -> 172.31.23.72 TCP 66 6633 → 45534 [ACK] Seq=81 Ack=1161 Win=853 Len=0 TSval=1202331 TSecr=30023922
101 0.509428220 172.31.31.144 -> 172.31.23.72 OpenFlow 82 Type: OFPT_MULTIPART_REQUEST, OFPMP_TABLE
102 0.509635490 172.31.23.72 -> 172.31.31.144 OpenFlow 6178 Type: OFPT_MULTIPART_REPLY, OFPMP_TABLE
103 0.549840399 172.31.31.144 -> 172.31.23.72 TCP 66 6633 → 45534 [ACK] Seq=97 Ack=7273 Win=853 Len=0 TSval=1202342 TSecr=30023923
104 0.560633835 172.31.31.144 -> 172.31.23.72 TCP 82 6633 → 45536 [PSH, ACK] Seq=1 Ack=1 Win=853 Len=16 TSval=1202344 TSecr=30023754
105 0.560645836 172.31.31.144 -> 172.31.23.72 TCP 146 6633 → 45536 [PSH, ACK] Seq=17 Ack=1 Win=853 Len=80 TSval=1202344 TSecr=30023754
106 0.561082313 172.31.23.72 -> 172.31.31.144 OpenFlow 6178 Type: OFPT_MULTIPART_REPLY, OFPMP_TABLE
107 0.561170749 172.31.23.72 -> 172.31.31.144 OpenFlow 3050 Type: OFPT_MULTIPART_REPLY, OFPMP_FLOW
108 0.561258046 172.31.23.72 -> 172.31.31.144 OpenFlow 530 Type: OFPT_MULTIPART_REPLY, OFPMP_PORT_STATS
109 0.561409091 172.31.31.144 -> 172.31.23.72 TCP 66 6633 → 45536 [ACK] Seq=97 Ack=6113 Win=853 Len=0 TSval=1202344 TSecr=30023936
110 0.561415949 172.31.31.144 -> 172.31.23.72 TCP 66 6633 → 45536 [ACK] Seq=97 Ack=9097 Win=853 Len=0 TSval=1202344 TSecr=30023936
111 0.561439599 172.31.31.144 -> 172.31.23.72 TCP 66 6633 → 45536 [ACK] Seq=97 Ack=9561 Win=853 Len=0 TSval=1202344 TSecr=30023936
112 0.607735076 172.31.31.144 -> 172.31.23.72 TCP 122 6633 → 45538 [PSH, ACK] Seq=1 Ack=1 Win=853 Len=56 TSval=1202356 TSecr=30023754
113 0.607748733 172.31.31.144 -> 172.31.23.72 TCP 106 6633 → 45538 [PSH, ACK] Seq=57 Ack=1 Win=853 Len=40 TSval=1202356 TSecr=30023754
114 0.607897726 172.31.23.72 -> 172.31.31.144 OpenFlow 2218 Type: OFPT_MULTIPART_REPLY, OFPMP_FLOW
115 0.607989483 172.31.23.72 -> 172.31.31.144 OpenFlow 754 Type: OFPT_MULTIPART_REPLY, OFPMP_PORT_STATS
116 0.608141839 172.31.23.72 -> 172.31.31.144 OpenFlow 6178 Type: OFPT_MULTIPART_REPLY, OFPMP_TABLE
117 0.608221106 172.31.31.144 -> 172.31.23.72 TCP 66 6633 → 45538 [ACK] Seq=97 Ack=2841 Win=853 Len=0 TSval=1202356 TSecr=30023947
118 0.645832932 172.31.31.144 -> 172.31.23.72 TCP 66 6633 → 45538 [ACK] Seq=97 Ack=8953 Win=853 Len=0 TSval=1202366 TSecr=30023947
119 0.656968205 172.31.31.144 -> 172.31.23.72 TCP 90 6633 → 45540 [PSH, ACK] Seq=1 Ack=1 Win=853 Len=24 TSval=1202368 TSecr=30023754
120 0.657215481 172.31.23.72 -> 172.31.31.144 OpenFlow 754 Type: OFPT_MULTIPART_REPLY, OFPMP_PORT_STATS
121 0.657446631 172.31.31.144 -> 172.31.23.72 TCP 66 6633 → 45540 [ACK] Seq=25 Ack=689 Win=853 Len=0 TSval=1202368 TSecr=30023960
122 0.658122987 172.31.31.144 -> 172.31.23.72 OpenFlow 82 Type: OFPT_MULTIPART_REQUEST, OFPMP_TABLE
123 0.658128854 172.31.31.144 -> 172.31.23.72 OpenFlow 122 Type: OFPT_MULTIPART_REQUEST, OFPMP_FLOW
124 0.658379325 172.31.23.72 -> 172.31.31.144 OpenFlow 6178 Type: OFPT_MULTIPART_REPLY, OFPMP_TABLE
125 0.658462094 172.31.23.72 -> 172.31.31.144 OpenFlow 3050 Type: OFPT_MULTIPART_REPLY, OFPMP_FLOW
126 0.658673103 172.31.31.144 -> 172.31.23.72 TCP 66 6633 → 45540 [ACK] Seq=97 Ack=9785 Win=853 Len=0 TSval=1202369 TSecr=30023960
127 0.708253517 172.31.31.144 -> 172.31.23.72 TCP 90 6633 → 45542 [PSH, ACK] Seq=1 Ack=1 Win=853 Len=24 TSval=1202381 TSecr=30023753
128 0.708268561 172.31.31.144 -> 172.31.23.72 TCP 138 6633 → 45542 [PSH, ACK] Seq=25 Ack=1 Win=853 Len=72 TSval=1202381 TSecr=30023753
129 0.708561160 172.31.23.72 -> 172.31.31.144 OpenFlow 530 Type: OFPT_MULTIPART_REPLY, OFPMP_PORT_STATS
130 0.708718777 172.31.23.72 -> 172.31.31.144 OpenFlow 6178 Type: OFPT_MULTIPART_REPLY, OFPMP_TABLE
131 0.708759985 172.31.31.144 -> 172.31.23.72 TCP 66 6633 → 45542 [ACK] Seq=97 Ack=465 Win=853 Len=0 TSval=1202381 TSecr=30023972
132 0.708806419 172.31.23.72 -> 172.31.31.144 OpenFlow 1594 Type: OFPT_MULTIPART_REPLY, OFPMP_FLOW
133 0.708991538 172.31.31.144 -> 172.31.23.72 TCP 66 6633 → 45542 [ACK] Seq=97 Ack=6577 Win=853 Len=0 TSval=1202381 TSecr=30023972
134 0.708996855 172.31.31.144 -> 172.31.23.72 TCP 66 6633 → 45542 [ACK] Seq=97 Ack=8105 Win=853 Len=0 TSval=1202381 TSecr=30023973
135 0.770384392 172.31.31.144 -> 172.31.23.72 TCP 90 6633 → 45544 [PSH, ACK] Seq=1 Ack=1 Win=853 Len=24 TSval=1202397 TSecr=30023728
136 0.770408910 172.31.31.144 -> 172.31.23.72 TCP 138 6633 → 45544 [PSH, ACK] Seq=25 Ack=1 Win=853 Len=72 TSval=1202397 TSecr=30023728
137 0.770737487 172.31.23.72 -> 172.31.31.144 OpenFlow 530 Type: OFPT_MULTIPART_REPLY, OFPMP_PORT_STATS
138 0.770913804 172.31.23.72 -> 172.31.31.144 OpenFlow 6178 Type: OFPT_MULTIPART_REPLY, OFPMP_TABLE
139 0.770943355 172.31.31.144 -> 172.31.23.72 TCP 66 6633 → 45544 [ACK] Seq=97 Ack=465 Win=853 Len=0 TSval=1202397 TSecr=30023988
140 0.771000081 172.31.23.72 -> 172.31.31.144 OpenFlow 2218 Type: OFPT_MULTIPART_REPLY, OFPMP_FLOW
141 0.771204402 172.31.31.144 -> 172.31.23.72 TCP 66 6633 → 45544 [ACK] Seq=97 Ack=6577 Win=853 Len=0 TSval=1202397 TSecr=30023988
142 0.771210069 172.31.31.144 -> 172.31.23.72 TCP 66 6633 → 45544 [ACK] Seq=97 Ack=8729 Win=853 Len=0 TSval=1202397 TSecr=30023988
143 0.830558429 172.31.31.144 -> 172.31.23.72 TCP 82 6633 → 45546 [PSH, ACK] Seq=1 Ack=1 Win=853 Len=16 TSval=1202412 TSecr=30023754
144 0.830582221 172.31.31.144 -> 172.31.23.72 TCP 146 6633 → 45546 [PSH, ACK] Seq=17 Ack=1 Win=853 Len=80 TSval=1202412 TSecr=30023754
145 0.830888545 172.31.23.72 -> 172.31.31.144 OpenFlow 6178 Type: OFPT_MULTIPART_REPLY, OFPMP_TABLE
146 0.831002793 172.31.23.72 -> 172.31.31.144 OpenFlow 642 Type: OFPT_MULTIPART_REPLY, OFPMP_PORT_STATS
147 0.831121216 172.31.23.72 -> 172.31.31.144 OpenFlow 3882 Type: OFPT_MULTIPART_REPLY, OFPMP_FLOW
148 0.831193816 172.31.31.144 -> 172.31.23.72 TCP 66 6633 → 45546 [ACK] Seq=97 Ack=6113 Win=853 Len=0 TSval=1202412 TSecr=30024003
149 0.831212722 172.31.31.144 -> 172.31.23.72 TCP 66 6633 → 45546 [ACK] Seq=97 Ack=6689 Win=853 Len=0 TSval=1202412 TSecr=30024003
150 0.831350393 172.31.31.144 -> 172.31.23.72 TCP 66 6633 → 45546 [ACK] Seq=97 Ack=10505 Win=853 Len=0 TSval=1202412 TSecr=30024003
151 0.895658312 172.31.31.144 -> 172.31.23.72 TCP 90 6633 → 45548 [PSH, ACK] Seq=1 Ack=1 Win=853 Len=24 TSval=1202428 TSecr=30023753
152 0.895672765 172.31.31.144 -> 172.31.23.72 TCP 122 6633 → 45548 [PSH, ACK] Seq=25 Ack=1 Win=853 Len=56 TSval=1202428 TSecr=30023753
153 0.895964032 172.31.23.72 -> 172.31.31.144 OpenFlow 642 Type: OFPT_MULTIPART_REPLY, OFPMP_PORT_STATS
154 0.896062206 172.31.23.72 -> 172.31.31.144 OpenFlow 2634 Type: OFPT_MULTIPART_REPLY, OFPMP_FLOW
155 0.896281060 172.31.31.144 -> 172.31.23.72 TCP 66 6633 → 45548 [ACK] Seq=81 Ack=3145 Win=853 Len=0 TSval=1202428 TSecr=30024019
156 0.896750748 172.31.31.144 -> 172.31.23.72 OpenFlow 82 Type: OFPT_MULTIPART_REQUEST, OFPMP_TABLE
157 0.897037341 172.31.23.72 -> 172.31.31.144 OpenFlow 6178 Type: OFPT_MULTIPART_REPLY, OFPMP_TABLE
158 0.933784861 172.31.31.144 -> 172.31.23.72 TCP 66 6633 → 45548 [ACK] Seq=97 Ack=9257 Win=853 Len=0 TSval=1202438 TSecr=30024020
159 0.958943941 172.31.31.144 -> 172.31.23.72 TCP 122 6633 → 45550 [PSH, ACK] Seq=1 Ack=1 Win=853 Len=56 TSval=1202444 TSecr=30023754
160 0.958956533 172.31.31.144 -> 172.31.23.72 TCP 106 6633 → 45550 [PSH, ACK] Seq=57 Ack=1 Win=853 Len=40 TSval=1202444 TSecr=30023754
161 0.959225427 172.31.23.72 -> 172.31.31.144 OpenFlow 554 Type: OFPT_MULTIPART_REPLY, OFPMP_FLOW
162 0.959396490 172.31.23.72 -> 172.31.31.144 OpenFlow 6178 Type: OFPT_MULTIPART_REPLY, OFPMP_TABLE
163 0.959503254 172.31.23.72 -> 172.31.31.144 OpenFlow 642 Type: OFPT_MULTIPART_REPLY, OFPMP_PORT_STATS
164 0.959657215 172.31.31.144 -> 172.31.23.72 TCP 66 6633 → 45550 [ACK] Seq=97 Ack=6601 Win=853 Len=0 TSval=1202444 TSecr=30024035
165 0.997808554 172.31.31.144 -> 172.31.23.72 TCP 66 6633 → 45550 [ACK] Seq=97 Ack=7177 Win=853 Len=0 TSval=1202454 TSecr=30024035
166 0.998037215 172.31.31.144 -> 172.31.23.72 TCP 90 6633 → 45552 [PSH, ACK] Seq=1 Ack=1 Win=853 Len=24 TSval=1202454 TSecr=30023754
167 0.998045630 172.31.31.144 -> 172.31.23.72 TCP 138 6633 → 45552 [PSH, ACK] Seq=25 Ack=1 Win=853 Len=72 TSval=1202454 TSecr=30023754
168 0.998380815 172.31.23.72 -> 172.31.31.144 OpenFlow 642 Type: OFPT_MULTIPART_REPLY, OFPMP_PORT_STATS
169 0.998467617 172.31.23.72 -> 172.31.31.144 OpenFlow 2426 Type: OFPT_MULTIPART_REPLY, OFPMP_FLOW
170 0.998630590 172.31.23.72 -> 172.31.31.144 OpenFlow 6178 Type: OFPT_MULTIPART_REPLY, OFPMP_TABLE
171 0.998720747 172.31.31.144 -> 172.31.23.72 TCP 66 6633 → 45552 [ACK] Seq=97 Ack=2937 Win=853 Len=0 TSval=1202454 TSecr=30024045
172 1.027239940 172.31.31.144 -> 172.31.23.72 TCP 122 6633 → 45554 [PSH, ACK] Seq=1 Ack=1 Win=853 Len=56 TSval=1202461 TSecr=30023754
173 1.027263049 172.31.31.144 -> 172.31.23.72 TCP 106 6633 → 45554 [PSH, ACK] Seq=57 Ack=1 Win=853 Len=40 TSval=1202461 TSecr=30023754
174 1.027577883 172.31.23.72 -> 172.31.31.144 OpenFlow 2010 Type: OFPT_MULTIPART_REPLY, OFPMP_FLOW
175 1.027750897 172.31.23.72 -> 172.31.31.144 OpenFlow 6178 Type: OFPT_MULTIPART_REPLY, OFPMP_TABLE
176 1.027829863 172.31.31.144 -> 172.31.23.72 TCP 66 6633 → 45554 [ACK] Seq=97 Ack=1945 Win=853 Len=0 TSval=1202461 TSecr=30024052
177 1.027858122 172.31.23.72 -> 172.31.31.144 OpenFlow 530 Type: OFPT_MULTIPART_REPLY, OFPMP_PORT_STATS
178 1.027978763 172.31.31.144 -> 172.31.23.72 TCP 66 6633 → 45554 [ACK] Seq=97 Ack=8057 Win=853 Len=0 TSval=1202461 TSecr=30024052
179 1.028032656 172.31.31.144 -> 172.31.23.72 TCP 66 6633 → 45554 [ACK] Seq=97 Ack=8521 Win=853 Len=0 TSval=1202461 TSecr=30024052
180 1.037806912 172.31.31.144 -> 172.31.23.72 TCP 66 6633 → 45552 [ACK] Seq=97 Ack=9049 Win=853 Len=0 TSval=1202464 TSecr=30024045
181 2.730104044 172.31.31.144 -> 172.31.23.72 OpenFlow 187 Type: OFPT_PACKET_OUT
182 2.730131965 172.31.31.144 -> 172.31.23.72 OpenFlow 187 Type: OFPT_PACKET_OUT
183 2.730163421 172.31.31.144 -> 172.31.23.72 OpenFlow 187 Type: OFPT_PACKET_OUT
184 2.730226181 172.31.31.144 -> 172.31.23.72 OpenFlow 187 Type: OFPT_PACKET_OUT
185 2.730293915 172.31.31.144 -> 172.31.23.72 OpenFlow 187 Type: OFPT_PACKET_OUT
186 2.730321704 172.31.31.144 -> 172.31.23.72 OpenFlow 187 Type: OFPT_PACKET_OUT
187 2.730400208 172.31.31.144 -> 172.31.23.72 OpenFlow 187 Type: OFPT_PACKET_OUT
188 2.730422680 172.31.31.144 -> 172.31.23.72 OpenFlow 187 Type: OFPT_PACKET_OUT
189 2.730485998 172.31.31.144 -> 172.31.23.72 OpenFlow 187 Type: OFPT_PACKET_OUT
190 2.730533566 172.31.31.144 -> 172.31.23.72 OpenFlow 187 Type: OFPT_PACKET_OUT
191 2.730591974 172.31.31.144 -> 172.31.23.72 OpenFlow 187 Type: OFPT_PACKET_OUT
192 2.730647237 172.31.31.144 -> 172.31.23.72 OpenFlow 187 Type: OFPT_PACKET_OUT
193 2.730692935 172.31.31.144 -> 172.31.23.72 OpenFlow 187 Type: OFPT_PACKET_OUT
194 2.730738272 172.31.31.144 -> 172.31.23.72 OpenFlow 187 Type: OFPT_PACKET_OUT
195 2.730821643 172.31.31.144 -> 172.31.23.72 OpenFlow 187 Type: OFPT_PACKET_OUT
196 2.730863476 172.31.31.144 -> 172.31.23.72 OpenFlow 187 Type: OFPT_PACKET_OUT
197 2.730913367 172.31.31.144 -> 172.31.23.72 OpenFlow 187 Type: OFPT_PACKET_OUT
198 2.730986643 172.31.31.144 -> 172.31.23.72 OpenFlow 187 Type: OFPT_PACKET_OUT
199 2.731064710 172.31.31.144 -> 172.31.23.72 OpenFlow 187 Type: OFPT_PACKET_OUT
200 2.731138904 172.31.31.144 -> 172.31.23.72 OpenFlow 308 Type: OFPT_PACKET_OUT
201 2.731219279 172.31.31.144 -> 172.31.23.72 OpenFlow 187 Type: OFPT_PACKET_OUT
202 2.731252662 172.31.31.144 -> 172.31.23.72 OpenFlow 187 Type: OFPT_PACKET_OUT
203 2.731313535 172.31.31.144 -> 172.31.23.72 OpenFlow 187 Type: OFPT_PACKET_OUT
204 2.731362726 172.31.31.144 -> 172.31.23.72 OpenFlow 187 Type: OFPT_PACKET_OUT
205 2.731410637 172.31.31.144 -> 172.31.23.72 OpenFlow 187 Type: OFPT_PACKET_OUT
206 2.731457173 172.31.31.144 -> 172.31.23.72 OpenFlow 187 Type: OFPT_PACKET_OUT
207 2.731502958 172.31.31.144 -> 172.31.23.72 OpenFlow 187 Type: OFPT_PACKET_OUT
208 2.731562406 172.31.31.144 -> 172.31.23.72 OpenFlow 187 Type: OFPT_PACKET_OUT
209 2.731609053 172.31.31.144 -> 172.31.23.72 OpenFlow 187 Type: OFPT_PACKET_OUT
210 2.731672579 172.31.31.144 -> 172.31.23.72 OpenFlow 187 Type: OFPT_PACKET_OUT
211 2.731719837 172.31.31.144 -> 172.31.23.72 OpenFlow 187 Type: OFPT_PACKET_OUT
212 2.731766618 172.31.31.144 -> 172.31.23.72 OpenFlow 187 Type: OFPT_PACKET_OUT
213 2.731817336 172.31.31.144 -> 172.31.23.72 OpenFlow 187 Type: OFPT_PACKET_OUT
214 2.731867877 172.31.31.144 -> 172.31.23.72 OpenFlow 187 Type: OFPT_PACKET_OUT
215 2.731930635 172.31.31.144 -> 172.31.23.72 OpenFlow 187 Type: OFPT_PACKET_OUT
216 2.731976413 172.31.31.144 -> 172.31.23.72 OpenFlow 187 Type: OFPT_PACKET_OUT
217 2.732088496 172.31.31.144 -> 172.31.23.72 OpenFlow 187 Type: OFPT_PACKET_OUT
218 2.732096639 172.31.31.144 -> 172.31.23.72 OpenFlow 187 Type: OFPT_PACKET_OUT
219 2.732124087 172.31.31.144 -> 172.31.23.72 OpenFlow 187 Type: OFPT_PACKET_OUT
220 2.732205031 172.31.31.144 -> 172.31.23.72 OpenFlow 187 Type: OFPT_PACKET_OUT
221 2.732244059 172.31.31.144 -> 172.31.23.72 OpenFlow 187 Type: OFPT_PACKET_OUT
222 2.732341635 172.31.31.144 -> 172.31.23.72 OpenFlow 187 Type: OFPT_PACKET_OUT
223 2.732347196 172.31.31.144 -> 172.31.23.72 OpenFlow 187 Type: OFPT_PACKET_OUT
224 2.732395286 172.31.31.144 -> 172.31.23.72 OpenFlow 187 Type: OFPT_PACKET_OUT
225 2.732618744 172.31.31.144 -> 172.31.23.72 OpenFlow 187 Type: OFPT_PACKET_OUT
226 2.732625103 172.31.31.144 -> 172.31.23.72 OpenFlow 187 Type: OFPT_PACKET_OUT
227 2.732627117 172.31.31.144 -> 172.31.23.72 OpenFlow 187 Type: OFPT_PACKET_OUT
228 2.732629185 172.31.31.144 -> 172.31.23.72 OpenFlow 187 Type: OFPT_PACKET_OUT
229 2.732758915 172.31.31.144 -> 172.31.23.72 OpenFlow 187 Type: OFPT_PACKET_OUT
230 2.732762338 172.31.31.144 -> 172.31.23.72 OpenFlow 187 Type: OFPT_PACKET_OUT
231 2.732782445 172.31.31.144 -> 172.31.23.72 OpenFlow 187 Type: OFPT_PACKET_OUT
232 2.732825258 172.31.31.144 -> 172.31.23.72 OpenFlow 187 Type: OFPT_PACKET_OUT
233 2.732893742 172.31.31.144 -> 172.31.23.72 OpenFlow 187 Type: OFPT_PACKET_OUT
234 2.732976833 172.31.31.144 -> 172.31.23.72 OpenFlow 187 Type: OFPT_PACKET_OUT
235 2.733052466 172.31.31.144 -> 172.31.23.72 OpenFlow 308 Type: OFPT_PACKET_OUT
236 2.733131326 172.31.31.144 -> 172.31.23.72 OpenFlow 187 Type: OFPT_PACKET_OUT
237 2.733212494 172.31.31.144 -> 172.31.23.72 OpenFlow 308 Type: OFPT_PACKET_OUT
238 2.733254105 172.31.31.144 -> 172.31.23.72 OpenFlow 187 Type: OFPT_PACKET_OUT
239 2.733304024 172.31.31.144 -> 172.31.23.72 OpenFlow 187 Type: OFPT_PACKET_OUT
240 2.733573479 172.31.31.144 -> 172.31.23.72 OpenFlow 187 Type: OFPT_PACKET_OUT
241 2.733583053 172.31.31.144 -> 172.31.23.72 OpenFlow 187 Type: OFPT_PACKET_OUT
242 2.733585318 172.31.31.144 -> 172.31.23.72 OpenFlow 187 Type: OFPT_PACKET_OUT
243 2.733586742 172.31.31.144 -> 172.31.23.72 OpenFlow 187 Type: OFPT_PACKET_OUT
244 2.733588581 172.31.31.144 -> 172.31.23.72 OpenFlow 187 Type: OFPT_PACKET_OUT
245 2.733603276 172.31.23.72 -> 172.31.31.144 TCP 66 45546 → 6633 [ACK] Seq=10505 Ack=1065 Win=213 Len=0 TSval=30024479 TSecr=1202887
246 2.733675199 172.31.31.144 -> 172.31.23.72 OpenFlow 187 Type: OFPT_PACKET_OUT
247 2.733679892 172.31.31.144 -> 172.31.23.72 OpenFlow 187 Type: OFPT_PACKET_OUT
248 2.733822583 172.31.31.144 -> 172.31.23.72 OpenFlow 187 Type: OFPT_PACKET_OUT
249 2.733931176 172.31.23.72 -> 172.31.31.144 TCP 66 45534 → 6633 [ACK] Seq=7273 Ack=823 Win=213 Len=0 TSval=30024479 TSecr=1202887
250 2.734279081 172.31.23.72 -> 172.31.31.144 TCP 66 45530 → 6633 [ACK] Seq=6969 Ack=1065 Win=213 Len=0 TSval=30024479 TSecr=1202887
251 2.734563223 172.31.23.72 -> 172.31.31.144 TCP 66 45514 → 6633 [ACK] Seq=8841 Ack=1065 Win=213 Len=0 TSval=30024479 TSecr=1202887
252 2.734641629 172.31.23.72 -> 172.31.31.144 OpenFlow 189 Type: OFPT_PACKET_IN
253 2.734666375 172.31.23.72 -> 172.31.31.144 OpenFlow 189 Type: OFPT_PACKET_IN
254 2.734846262 172.31.31.144 -> 172.31.23.72 TCP 66 6633 → 45528 [ACK] Seq=1307 Ack=9700 Win=853 Len=0 TSval=1202888 TSecr=30024479
255 2.734855027 172.31.31.144 -> 172.31.23.72 TCP 66 6633 → 45528 [ACK] Seq=1307 Ack=9823 Win=853 Len=0 TSval=1202888 TSecr=30024479
256 2.735103737 172.31.23.72 -> 172.31.31.144 OpenFlow 189 Type: OFPT_PACKET_IN
257 2.735128511 172.31.23.72 -> 172.31.31.144 OpenFlow 189 Type: OFPT_PACKET_IN
258 2.735313989 172.31.31.144 -> 172.31.23.72 TCP 66 6633 → 45518 [ACK] Seq=1307 Ack=9700 Win=853 Len=0 TSval=1202888 TSecr=30024479
259 2.735320937 172.31.31.144 -> 172.31.23.72 TCP 66 6633 → 45518 [ACK] Seq=1307 Ack=9823 Win=853 Len=0 TSval=1202888 TSecr=30024479
260 2.735562207 172.31.23.72 -> 172.31.31.144 OpenFlow 189 Type: OFPT_PACKET_IN
261 2.735587293 172.31.23.72 -> 172.31.31.144 OpenFlow 189 Type: OFPT_PACKET_IN
262 2.735767259 172.31.31.144 -> 172.31.23.72 TCP 66 6633 → 45512 [ACK] Seq=1307 Ack=9492 Win=853 Len=0 TSval=1202888 TSecr=30024479
263 2.735773511 172.31.31.144 -> 172.31.23.72 TCP 66 6633 → 45512 [ACK] Seq=1307 Ack=9615 Win=853 Len=0 TSval=1202888 TSecr=30024479
264 2.735953189 172.31.23.72 -> 172.31.31.144 OpenFlow 189 Type: OFPT_PACKET_IN
265 2.735977766 172.31.23.72 -> 172.31.31.144 OpenFlow 189 Type: OFPT_PACKET_IN
266 2.736162255 172.31.31.144 -> 172.31.23.72 TCP 66 6633 → 45538 [ACK] Seq=1307 Ack=9076 Win=853 Len=0 TSval=1202888 TSecr=30024479
267 2.736168369 172.31.31.144 -> 172.31.23.72 TCP 66 6633 → 45538 [ACK] Seq=1307 Ack=9199 Win=853 Len=0 TSval=1202888 TSecr=30024479
268 2.736409709 172.31.23.72 -> 172.31.31.144 OpenFlow 189 Type: OFPT_PACKET_IN
269 2.736434667 172.31.23.72 -> 172.31.31.144 OpenFlow 435 Type: OFPT_PACKET_IN
270 2.736451900 172.31.23.72 -> 172.31.31.144 OpenFlow 189 Type: OFPT_PACKET_IN
271 2.736475279 172.31.23.72 -> 172.31.31.144 OpenFlow 189 Type: OFPT_PACKET_IN
272 2.736505954 172.31.23.72 -> 172.31.31.144 OpenFlow 189 Type: OFPT_PACKET_IN
273 2.736508441 172.31.23.72 -> 172.31.31.144 OpenFlow 435 Type: OFPT_PACKET_IN
274 2.736532135 172.31.23.72 -> 172.31.31.144 OpenFlow 189 Type: OFPT_PACKET_IN
275 2.736534769 172.31.23.72 -> 172.31.31.144 OpenFlow 681 Type: OFPT_PACKET_IN
276 2.736556454 172.31.23.72 -> 172.31.31.144 OpenFlow 189 Type: OFPT_PACKET_IN
277 2.736558737 172.31.23.72 -> 172.31.31.144 OpenFlow 189 Type: OFPT_PACKET_IN
278 2.736577016 172.31.23.72 -> 172.31.31.144 OpenFlow 189 Type: OFPT_PACKET_IN
279 2.736620934 172.31.23.72 -> 172.31.31.144 OpenFlow 189 Type: OFPT_PACKET_IN
280 2.736638935 172.31.23.72 -> 172.31.31.144 OpenFlow 189 Type: OFPT_PACKET_IN
281 2.736641665 172.31.23.72 -> 172.31.31.144 OpenFlow 435 Type: OFPT_PACKET_IN
282 2.736660187 172.31.23.72 -> 172.31.31.144 OpenFlow 189 Type: OFPT_PACKET_IN
283 2.736681029 172.31.23.72 -> 172.31.31.144 OpenFlow 189 Type: OFPT_PACKET_IN
284 2.736699866 172.31.23.72 -> 172.31.31.144 OpenFlow 189 Type: OFPT_PACKET_IN
285 2.736725002 172.31.23.72 -> 172.31.31.144 OpenFlow 189 Type: OFPT_PACKET_IN
286 2.736744689 172.31.23.72 -> 172.31.31.144 OpenFlow 189 Type: OFPT_PACKET_IN
287 2.736747373 172.31.23.72 -> 172.31.31.144 OpenFlow 189 Type: OFPT_PACKET_IN
288 2.736790092 172.31.31.144 -> 172.31.23.72 TCP 66 6633 → 45532 [ACK] Seq=97 Ack=8709 Win=853 Len=0 TSval=1202888 TSecr=30024479
289 2.736796928 172.31.31.144 -> 172.31.23.72 TCP 66 6633 → 45544 [ACK] Seq=97 Ack=8852 Win=853 Len=0 TSval=1202888 TSecr=30024479
290 2.736799544 172.31.31.144 -> 172.31.23.72 TCP 66 6633 → 45524 [ACK] Seq=97 Ack=8660 Win=853 Len=0 TSval=1202888 TSecr=30024479
291 2.736801796 172.31.31.144 -> 172.31.23.72 TCP 66 6633 → 45522 [ACK] Seq=97 Ack=8020 Win=853 Len=0 TSval=1202888 TSecr=30024479
292 2.736804020 172.31.31.144 -> 172.31.23.72 TCP 66 6633 → 45544 [ACK] Seq=97 Ack=9221 Win=853 Len=0 TSval=1202888 TSecr=30024479
293 2.736958013 172.31.23.72 -> 172.31.31.144 OpenFlow 189 Type: OFPT_PACKET_IN
294 2.736964364 172.31.23.72 -> 172.31.31.144 OpenFlow 189 Type: OFPT_PACKET_IN
295 2.736966400 172.31.23.72 -> 172.31.31.144 OpenFlow 189 Type: OFPT_PACKET_IN
296 2.736968247 172.31.23.72 -> 172.31.31.144 OpenFlow 435 Type: OFPT_PACKET_IN
297 2.736969966 172.31.23.72 -> 172.31.31.144 OpenFlow 189 Type: OFPT_PACKET_IN
298 2.737208244 172.31.31.144 -> 172.31.23.72 TCP 66 6633 → 45524 [ACK] Seq=97 Ack=9275 Win=853 Len=0 TSval=1202888 TSecr=30024479
299 2.737213336 172.31.31.144 -> 172.31.23.72 TCP 66 6633 → 45522 [ACK] Seq=97 Ack=8143 Win=853 Len=0 TSval=1202888 TSecr=30024479
300 2.737215450 172.31.31.144 -> 172.31.23.72 TCP 66 6633 → 45526 [ACK] Seq=97 Ack=8756 Win=853 Len=0 TSval=1202888 TSecr=30024479
301 2.737218485 172.31.31.144 -> 172.31.23.72 TCP 66 6633 → 45550 [ACK] Seq=97 Ack=7300 Win=853 Len=0 TSval=1202888 TSecr=30024479
302 2.737220708 172.31.31.144 -> 172.31.23.72 TCP 66 6633 → 45508 [ACK] Seq=1 Ack=124 Win=853 Len=0 TSval=1202888 TSecr=30024479
303 2.737222809 172.31.31.144 -> 172.31.23.72 TCP 66 6633 → 45510 [ACK] Seq=97 Ack=9749 Win=853 Len=0 TSval=1202888 TSecr=30024479
304 2.737225114 172.31.31.144 -> 172.31.23.72 TCP 66 6633 → 45548 [ACK] Seq=97 Ack=9380 Win=853 Len=0 TSval=1202888 TSecr=30024479
305 2.737229711 172.31.31.144 -> 172.31.23.72 TCP 66 6633 → 45542 [ACK] Seq=97 Ack=8228 Win=853 Len=0 TSval=1202888 TSecr=30024479
306 2.737232268 172.31.31.144 -> 172.31.23.72 TCP 66 6633 → 45536 [ACK] Seq=97 Ack=9684 Win=853 Len=0 TSval=1202888 TSecr=30024479
307 2.737235825 172.31.23.72 -> 172.31.31.144 OpenFlow 681 Type: OFPT_PACKET_IN
308 2.737246058 172.31.23.72 -> 172.31.31.144 OpenFlow 435 Type: OFPT_PACKET_IN
309 2.737248060 172.31.23.72 -> 172.31.31.144 OpenFlow 435 Type: OFPT_PACKET_IN
310 2.737426884 172.31.31.144 -> 172.31.23.72 TCP 66 6633 → 45520 [ACK] Seq=97 Ack=8244 Win=853 Len=0 TSval=1202888 TSecr=30024479
311 2.737431144 172.31.31.144 -> 172.31.23.72 TCP 66 6633 → 45516 [ACK] Seq=97 Ack=6980 Win=853 Len=0 TSval=1202888 TSecr=30024479
312 2.737433390 172.31.31.144 -> 172.31.23.72 TCP 66 6633 → 45540 [ACK] Seq=97 Ack=10031 Win=853 Len=0 TSval=1202888 TSecr=30024479
313 2.737435865 172.31.31.144 -> 172.31.23.72 TCP 66 6633 → 45526 [ACK] Seq=97 Ack=8879 Win=853 Len=0 TSval=1202888 TSecr=30024480
314 2.737437927 172.31.31.144 -> 172.31.23.72 TCP 66 6633 → 45550 [ACK] Seq=97 Ack=7423 Win=853 Len=0 TSval=1202888 TSecr=30024480
315 2.737555728 172.31.31.144 -> 172.31.23.72 TCP 66 6633 → 45508 [ACK] Seq=1 Ack=247 Win=853 Len=0 TSval=1202888 TSecr=30024480
316 2.737559107 172.31.31.144 -> 172.31.23.72 TCP 66 6633 → 45548 [ACK] Seq=97 Ack=9749 Win=853 Len=0 TSval=1202888 TSecr=30024480
317 2.737560951 172.31.31.144 -> 172.31.23.72 TCP 66 6633 → 45542 [ACK] Seq=97 Ack=8351 Win=853 Len=0 TSval=1202888 TSecr=30024480
318 2.737667155 172.31.31.144 -> 172.31.23.72 TCP 66 6633 → 45520 [ACK] Seq=97 Ack=8613 Win=853 Len=0 TSval=1202888 TSecr=30024480
319 2.737670232 172.31.31.144 -> 172.31.23.72 TCP 66 6633 → 45536 [ACK] Seq=97 Ack=10299 Win=853 Len=0 TSval=1202888 TSecr=30024480
320 2.737672091 172.31.31.144 -> 172.31.23.72 TCP 66 6633 → 45516 [ACK] Seq=97 Ack=7349 Win=853 Len=0 TSval=1202888 TSecr=30024480
321 2.741107757 172.31.23.72 -> 172.31.31.144 OpenFlow 189 Type: OFPT_PACKET_IN
322 2.741137299 172.31.23.72 -> 172.31.31.144 OpenFlow 435 Type: OFPT_PACKET_IN
323 2.741146468 172.31.23.72 -> 172.31.31.144 OpenFlow 189 Type: OFPT_PACKET_IN
324 2.741159867 172.31.23.72 -> 172.31.31.144 OpenFlow 189 Type: OFPT_PACKET_IN
325 2.741220037 172.31.23.72 -> 172.31.31.144 OpenFlow 189 Type: OFPT_PACKET_IN
326 2.741224930 172.31.23.72 -> 172.31.31.144 OpenFlow 189 Type: OFPT_PACKET_IN
327 2.741440717 172.31.31.144 -> 172.31.23.72 TCP 66 6633 → 45530 [ACK] Seq=1065 Ack=7092 Win=853 Len=0 TSval=1202889 TSecr=30024481
328 2.741448206 172.31.31.144 -> 172.31.23.72 TCP 66 6633 → 45530 [ACK] Seq=1065 Ack=7461 Win=853 Len=0 TSval=1202889 TSecr=30024481
329 2.741450509 172.31.31.144 -> 172.31.23.72 TCP 66 6633 → 45514 [ACK] Seq=1065 Ack=8964 Win=853 Len=0 TSval=1202889 TSecr=30024481
330 2.741452608 172.31.31.144 -> 172.31.23.72 TCP 66 6633 → 45528 [ACK] Seq=1307 Ack=9946 Win=853 Len=0 TSval=1202889 TSecr=30024481
331 2.741454382 172.31.31.144 -> 172.31.23.72 TCP 66 6633 → 45514 [ACK] Seq=1065 Ack=9087 Win=853 Len=0 TSval=1202889 TSecr=30024481
332 2.741510110 172.31.31.144 -> 172.31.23.72 TCP 66 6633 → 45528 [ACK] Seq=1307 Ack=10069 Win=853 Len=0 TSval=1202889 TSecr=30024481
333 2.746074506 172.31.23.72 -> 172.31.31.144 OpenFlow 146 Type: OFPT_PORT_STATUS
334 2.746144606 172.31.23.72 -> 172.31.31.144 OpenFlow 146 Type: OFPT_PORT_STATUS
335 2.770714129 172.31.31.144 -> 172.31.23.72 OpenFlow 146 Type: OFPT_FLOW_MOD
336 2.770731314 172.31.31.144 -> 172.31.23.72 OpenFlow 154 Type: OFPT_BARRIER_REQUEST
337 2.770735401 172.31.31.144 -> 172.31.23.72 OpenFlow 146 Type: OFPT_FLOW_MOD
338 2.770738062 172.31.31.144 -> 172.31.23.72 OpenFlow 154 Type: OFPT_BARRIER_REQUEST
339 2.770740009 172.31.31.144 -> 172.31.23.72 OpenFlow 146 Type: OFPT_FLOW_MOD
340 2.770744075 172.31.31.144 -> 172.31.23.72 OpenFlow 146 Type: OFPT_FLOW_MOD
341 2.770747043 172.31.31.144 -> 172.31.23.72 OpenFlow 146 Type: OFPT_FLOW_MOD
342 2.770752033 172.31.31.144 -> 172.31.23.72 OpenFlow 146 Type: OFPT_FLOW_MOD
343 2.770753904 172.31.31.144 -> 172.31.23.72 OpenFlow 154 Type: OFPT_BARRIER_REQUEST
344 2.770755845 172.31.31.144 -> 172.31.23.72 OpenFlow 146 Type: OFPT_FLOW_MOD
345 2.770758227 172.31.31.144 -> 172.31.23.72 OpenFlow 74 Type: OFPT_BARRIER_REQUEST
346 2.770759542 172.31.31.144 -> 172.31.23.72 OpenFlow 154 Type: OFPT_BARRIER_REQUEST
347 2.770760825 172.31.31.144 -> 172.31.23.72 OpenFlow 146 Type: OFPT_FLOW_MOD
348 2.770762318 172.31.31.144 -> 172.31.23.72 OpenFlow 154 Type: OFPT_BARRIER_REQUEST
349 2.770763924 172.31.31.144 -> 172.31.23.72 OpenFlow 146 Type: OFPT_FLOW_MOD
350 2.770765467 172.31.31.144 -> 172.31.23.72 OpenFlow 146 Type: OFPT_FLOW_MOD
351 2.770767017 172.31.31.144 -> 172.31.23.72 OpenFlow 154 Type: OFPT_BARRIER_REQUEST
352 2.770768445 172.31.31.144 -> 172.31.23.72 OpenFlow 146 Type: OFPT_FLOW_MOD
353 2.770769720 172.31.31.144 -> 172.31.23.72 OpenFlow 154 Type: OFPT_BARRIER_REQUEST
354 2.770770773 172.31.31.144 -> 172.31.23.72 OpenFlow 154 Type: OFPT_BARRIER_REQUEST
355 2.770772334 172.31.31.144 -> 172.31.23.72 OpenFlow 146 Type: OFPT_FLOW_MOD
356 2.770774717 172.31.31.144 -> 172.31.23.72 OpenFlow 146 Type: OFPT_FLOW_MOD
357 2.770776310 172.31.31.144 -> 172.31.23.72 OpenFlow 146 Type: OFPT_FLOW_MOD
358 2.770777954 172.31.31.144 -> 172.31.23.72 OpenFlow 146 Type: OFPT_FLOW_MOD
359 2.770779525 172.31.31.144 -> 172.31.23.72 OpenFlow 154 Type: OFPT_BARRIER_REQUEST
360 2.770780695 172.31.31.144 -> 172.31.23.72 OpenFlow 154 Type: OFPT_BARRIER_REQUEST
361 2.770782290 172.31.31.144 -> 172.31.23.72 OpenFlow 146 Type: OFPT_FLOW_MOD
362 2.770783668 172.31.31.144 -> 172.31.23.72 OpenFlow 146 Type: OFPT_FLOW_MOD
363 2.770785695 172.31.31.144 -> 172.31.23.72 OpenFlow 154 Type: OFPT_BARRIER_REQUEST
364 2.770787096 172.31.31.144 -> 172.31.23.72 OpenFlow 146 Type: OFPT_FLOW_MOD
365 2.770788359 172.31.31.144 -> 172.31.23.72 OpenFlow 74 Type: OFPT_BARRIER_REQUEST
366 2.770789624 172.31.31.144 -> 172.31.23.72 OpenFlow 234 Type: OFPT_FLOW_MOD
367 2.770791217 172.31.31.144 -> 172.31.23.72 OpenFlow 154 Type: OFPT_BARRIER_REQUEST
368 2.770792977 172.31.31.144 -> 172.31.23.72 OpenFlow 146 Type: OFPT_FLOW_MOD
369 2.770795212 172.31.31.144 -> 172.31.23.72 OpenFlow 234 Type: OFPT_BARRIER_REQUEST
370 2.770796830 172.31.31.144 -> 172.31.23.72 OpenFlow 146 Type: OFPT_FLOW_MOD
371 2.770798035 172.31.31.144 -> 172.31.23.72 OpenFlow 146 Type: OFPT_FLOW_MOD
372 2.770799321 172.31.31.144 -> 172.31.23.72 OpenFlow 146 Type: OFPT_FLOW_MOD
373 2.770801070 172.31.31.144 -> 172.31.23.72 OpenFlow 146 Type: OFPT_FLOW_MOD
374 2.770803467 172.31.31.144 -> 172.31.23.72 OpenFlow 146 Type: OFPT_FLOW_MOD
375 2.770805748 172.31.31.144 -> 172.31.23.72 OpenFlow 146 Type: OFPT_FLOW_MOD
376 2.770807274 172.31.31.144 -> 172.31.23.72 OpenFlow 74 Type: OFPT_BARRIER_REQUEST
377 2.770808737 172.31.31.144 -> 172.31.23.72 OpenFlow 146 Type: OFPT_FLOW_MOD
378 2.770810249 172.31.31.144 -> 172.31.23.72 OpenFlow 74 Type: OFPT_BARRIER_REQUEST
379 2.770811486 172.31.31.144 -> 172.31.23.72 OpenFlow 154 Type: OFPT_BARRIER_REQUEST
380 2.770812883 172.31.31.144 -> 172.31.23.72 OpenFlow 146 Type: OFPT_FLOW_MOD
381 2.770815021 172.31.31.144 -> 172.31.23.72 OpenFlow 154 Type: OFPT_BARRIER_REQUEST
382 2.770820027 172.31.31.144 -> 172.31.23.72 OpenFlow 74 Type: OFPT_BARRIER_REQUEST
