  1 0.000000000 172.31.31.144 -> 172.31.23.72 TCP 90 6633 → 33630 [PSH, ACK] Seq=1 Ack=1 Win=853 Len=24 TSval=1281305 TSecr=26119713
  2 0.000026675 172.31.31.144 -> 172.31.23.72 TCP 138 6633 → 33630 [PSH, ACK] Seq=25 Ack=1 Win=853 Len=72 TSval=1281305 TSecr=26119713
  3 0.000421707 172.31.23.72 -> 172.31.31.144 OpenFlow 530 Type: OFPT_MULTIPART_REPLY, OFPMP_PORT_STATS
  4 0.000606233 172.31.23.72 -> 172.31.31.144 OpenFlow 6178 Type: OFPT_MULTIPART_REPLY, OFPMP_TABLE
  5 0.000708597 172.31.23.72 -> 172.31.31.144 OpenFlow 2010 Type: OFPT_MULTIPART_REPLY, OFPMP_FLOW
  6 0.000790190 172.31.31.144 -> 172.31.23.72 TCP 66 6633 → 33630 [ACK] Seq=97 Ack=465 Win=853 Len=0 TSval=1281306 TSecr=26120407
  7 0.000916080 172.31.31.144 -> 172.31.23.72 TCP 66 6633 → 33630 [ACK] Seq=97 Ack=6577 Win=853 Len=0 TSval=1281306 TSecr=26120407
  8 0.000980303 172.31.31.144 -> 172.31.23.72 TCP 66 6633 → 33630 [ACK] Seq=97 Ack=8521 Win=853 Len=0 TSval=1281306 TSecr=26120407
  9 0.045033554 172.31.31.144 -> 172.31.23.72 TCP 90 6633 → 33632 [PSH, ACK] Seq=1 Ack=1 Win=853 Len=24 TSval=1281317 TSecr=26119713
 10 0.045052179 172.31.31.144 -> 172.31.23.72 TCP 138 6633 → 33632 [PSH, ACK] Seq=25 Ack=1 Win=853 Len=72 TSval=1281317 TSecr=26119713
 11 0.045352875 172.31.23.72 -> 172.31.31.144 OpenFlow 642 Type: OFPT_MULTIPART_REPLY, OFPMP_PORT_STATS
 12 0.045540053 172.31.23.72 -> 172.31.31.144 OpenFlow 6178 Type: OFPT_MULTIPART_REPLY, OFPMP_TABLE
 13 0.045615559 172.31.31.144 -> 172.31.23.72 TCP 66 6633 → 33632 [ACK] Seq=97 Ack=577 Win=853 Len=0 TSval=1281317 TSecr=26120418
 14 0.045634421 172.31.23.72 -> 172.31.31.144 OpenFlow 2634 Type: OFPT_MULTIPART_REPLY, OFPMP_FLOW
 15 0.045832924 172.31.31.144 -> 172.31.23.72 TCP 66 6633 → 33632 [ACK] Seq=97 Ack=6689 Win=853 Len=0 TSval=1281317 TSecr=26120418
 16 0.045875405 172.31.31.144 -> 172.31.23.72 TCP 66 6633 → 33632 [ACK] Seq=97 Ack=9257 Win=853 Len=0 TSval=1281317 TSecr=26120418
 17 0.076136213 172.31.31.144 -> 172.31.23.72 TCP 90 6633 → 33634 [PSH, ACK] Seq=1 Ack=1 Win=853 Len=24 TSval=1281324 TSecr=26119713
 18 0.076161799 172.31.31.144 -> 172.31.23.72 TCP 138 6633 → 33634 [PSH, ACK] Seq=25 Ack=1 Win=853 Len=72 TSval=1281324 TSecr=26119713
 19 0.076456443 172.31.23.72 -> 172.31.31.144 OpenFlow 754 Type: OFPT_MULTIPART_REPLY, OFPMP_PORT_STATS
 20 0.076631292 172.31.23.72 -> 172.31.31.144 OpenFlow 6178 Type: OFPT_MULTIPART_REPLY, OFPMP_TABLE
 21 0.076709773 172.31.31.144 -> 172.31.23.72 TCP 66 6633 → 33634 [ACK] Seq=97 Ack=689 Win=853 Len=0 TSval=1281325 TSecr=26120426
 22 0.076730072 172.31.23.72 -> 172.31.31.144 OpenFlow 2634 Type: OFPT_MULTIPART_REPLY, OFPMP_FLOW
 23 0.076921892 172.31.31.144 -> 172.31.23.72 TCP 66 6633 → 33634 [ACK] Seq=97 Ack=6801 Win=853 Len=0 TSval=1281325 TSecr=26120426
 24 0.076983319 172.31.31.144 -> 172.31.23.72 TCP 66 6633 → 33634 [ACK] Seq=97 Ack=9369 Win=853 Len=0 TSval=1281325 TSecr=26120426
 25 0.119278066 172.31.31.144 -> 172.31.23.72 TCP 90 6633 → 33636 [PSH, ACK] Seq=1 Ack=1 Win=853 Len=24 TSval=1281335 TSecr=26119713
 26 0.119298703 172.31.31.144 -> 172.31.23.72 TCP 138 6633 → 33636 [PSH, ACK] Seq=25 Ack=1 Win=853 Len=72 TSval=1281335 TSecr=26119713
 27 0.119549850 172.31.23.72 -> 172.31.31.144 OpenFlow 642 Type: OFPT_MULTIPART_REPLY, OFPMP_PORT_STATS
 28 0.119741592 172.31.23.72 -> 172.31.31.144 OpenFlow 6178 Type: OFPT_MULTIPART_REPLY, OFPMP_TABLE
 29 0.119816828 172.31.31.144 -> 172.31.23.72 TCP 66 6633 → 33636 [ACK] Seq=97 Ack=577 Win=853 Len=0 TSval=1281335 TSecr=26120436
 30 0.119826738 172.31.23.72 -> 172.31.31.144 OpenFlow 2010 Type: OFPT_MULTIPART_REPLY, OFPMP_FLOW
 31 0.120022828 172.31.31.144 -> 172.31.23.72 TCP 66 6633 → 33636 [ACK] Seq=97 Ack=6689 Win=853 Len=0 TSval=1281335 TSecr=26120436
 32 0.120063299 172.31.31.144 -> 172.31.23.72 TCP 66 6633 → 33636 [ACK] Seq=97 Ack=8633 Win=853 Len=0 TSval=1281335 TSecr=26120436
 33 0.121919199 172.31.31.144 -> 172.31.23.72 TCP 187 6633 → 33668 [PSH, ACK] Seq=1 Ack=1 Win=853 Len=121 TSval=1281336 TSecr=26119713
 34 0.121944045 172.31.31.144 -> 172.31.23.72 TCP 187 6633 → 33668 [PSH, ACK] Seq=122 Ack=1 Win=853 Len=121 TSval=1281336 TSecr=26119713
 35 0.122005206 172.31.31.144 -> 172.31.23.72 TCP 187 6633 → 33668 [PSH, ACK] Seq=243 Ack=1 Win=853 Len=121 TSval=1281336 TSecr=26119713
 36 0.122061156 172.31.31.144 -> 172.31.23.72 TCP 187 6633 → 33668 [PSH, ACK] Seq=364 Ack=1 Win=853 Len=121 TSval=1281336 TSecr=26119713
 37 0.122115235 172.31.31.144 -> 172.31.23.72 TCP 187 6633 → 33668 [PSH, ACK] Seq=485 Ack=1 Win=853 Len=121 TSval=1281336 TSecr=26119713
 38 0.122175040 172.31.31.144 -> 172.31.23.72 TCP 187 6633 → 33668 [PSH, ACK] Seq=606 Ack=1 Win=853 Len=121 TSval=1281336 TSecr=26119713
 39 0.122238397 172.31.31.144 -> 172.31.23.72 TCP 187 6633 → 33668 [PSH, ACK] Seq=727 Ack=1 Win=853 Len=121 TSval=1281336 TSecr=26119713
 40 0.122307263 172.31.31.144 -> 172.31.23.72 TCP 187 6633 → 33668 [PSH, ACK] Seq=848 Ack=1 Win=853 Len=121 TSval=1281336 TSecr=26119713
 41 0.122371428 172.31.23.72 -> 172.31.31.144 TCP 66 33668 → 6633 [ACK] Seq=1 Ack=969 Win=213 Len=0 TSval=26120437 TSecr=1281336
 42 0.122484593 172.31.23.72 -> 172.31.31.144 OpenFlow 189 Type: OFPT_PACKET_IN
 43 0.122510463 172.31.23.72 -> 172.31.31.144 OpenFlow 189 Type: OFPT_PACKET_IN
 44 0.122557619 172.31.23.72 -> 172.31.31.144 OpenFlow 189 Type: OFPT_PACKET_IN
 45 0.122579650 172.31.23.72 -> 172.31.31.144 OpenFlow 189 Type: OFPT_PACKET_IN
 46 0.122588237 172.31.23.72 -> 172.31.31.144 OpenFlow 189 Type: OFPT_PACKET_IN
 47 0.122626466 172.31.23.72 -> 172.31.31.144 OpenFlow 189 Type: OFPT_PACKET_IN
 48 0.122729433 172.31.31.144 -> 172.31.23.72 TCP 66 6633 → 33666 [ACK] Seq=1 Ack=124 Win=853 Len=0 TSval=1281336 TSecr=26120437
 49 0.122783722 172.31.31.144 -> 172.31.23.72 TCP 66 6633 → 33666 [ACK] Seq=1 Ack=247 Win=853 Len=0 TSval=1281336 TSecr=26120437
 50 0.122811330 172.31.31.144 -> 172.31.23.72 TCP 66 6633 → 33670 [ACK] Seq=1 Ack=124 Win=853 Len=0 TSval=1281336 TSecr=26120437
 51 0.122839115 172.31.31.144 -> 172.31.23.72 TCP 66 6633 → 33670 [ACK] Seq=1 Ack=247 Win=853 Len=0 TSval=1281336 TSecr=26120437
 52 0.122903453 172.31.31.144 -> 172.31.23.72 TCP 66 6633 → 33658 [ACK] Seq=1 Ack=124 Win=853 Len=0 TSval=1281336 TSecr=26120437
 53 0.122930730 172.31.31.144 -> 172.31.23.72 TCP 66 6633 → 33658 [ACK] Seq=1 Ack=247 Win=853 Len=0 TSval=1281336 TSecr=26120437
 54 0.152436875 172.31.31.144 -> 172.31.23.72 TCP 90 6633 → 33638 [PSH, ACK] Seq=1 Ack=1 Win=853 Len=24 TSval=1281344 TSecr=26119723
 55 0.152450943 172.31.23.72 -> 172.31.31.144 TCP 66 33638 → 6633 [ACK] Seq=1 Ack=25 Win=213 Len=0 TSval=26120445 TSecr=1281344
 56 0.152473162 172.31.31.144 -> 172.31.23.72 TCP 138 6633 → 33638 [PSH, ACK] Seq=25 Ack=1 Win=853 Len=72 TSval=1281344 TSecr=26119723
 57 0.152480650 172.31.23.72 -> 172.31.31.144 TCP 66 33638 → 6633 [ACK] Seq=1 Ack=97 Win=213 Len=0 TSval=26120445 TSecr=1281344
 58 0.152731673 172.31.23.72 -> 172.31.31.144 OpenFlow 530 Type: OFPT_MULTIPART_REPLY, OFPMP_PORT_STATS
 59 0.152888329 172.31.23.72 -> 172.31.31.144 OpenFlow 6178 Type: OFPT_MULTIPART_REPLY, OFPMP_TABLE
 60 0.152930998 172.31.23.72 -> 172.31.31.144 OpenFlow 554 Type: OFPT_MULTIPART_REPLY, OFPMP_FLOW
 61 0.152997745 172.31.31.144 -> 172.31.23.72 TCP 66 6633 → 33638 [ACK] Seq=97 Ack=465 Win=853 Len=0 TSval=1281344 TSecr=26120445
 62 0.153194675 172.31.31.144 -> 172.31.23.72 TCP 66 6633 → 33638 [ACK] Seq=97 Ack=6577 Win=853 Len=0 TSval=1281344 TSecr=26120445
 63 0.153220426 172.31.31.144 -> 172.31.23.72 TCP 66 6633 → 33638 [ACK] Seq=97 Ack=7065 Win=853 Len=0 TSval=1281344 TSecr=26120445
 64 0.193511078 172.31.31.144 -> 172.31.23.72 TCP 82 6633 → 33640 [PSH, ACK] Seq=1 Ack=1 Win=853 Len=16 TSval=1281354 TSecr=26119713
 65 0.193525107 172.31.31.144 -> 172.31.23.72 TCP 146 6633 → 33640 [PSH, ACK] Seq=17 Ack=1 Win=853 Len=80 TSval=1281354 TSecr=26119713
 66 0.193788678 172.31.23.72 -> 172.31.31.144 OpenFlow 6178 Type: OFPT_MULTIPART_REPLY, OFPMP_TABLE
 67 0.193886430 172.31.23.72 -> 172.31.31.144 OpenFlow 2634 Type: OFPT_MULTIPART_REPLY, OFPMP_FLOW
 68 0.194001804 172.31.23.72 -> 172.31.31.144 OpenFlow 754 Type: OFPT_MULTIPART_REPLY, OFPMP_PORT_STATS
 69 0.194138522 172.31.31.144 -> 172.31.23.72 TCP 66 6633 → 33640 [ACK] Seq=97 Ack=6113 Win=853 Len=0 TSval=1281354 TSecr=26120455
 70 0.194153800 172.31.31.144 -> 172.31.23.72 TCP 66 6633 → 33640 [ACK] Seq=97 Ack=8681 Win=853 Len=0 TSval=1281354 TSecr=26120455
 71 0.194262464 172.31.31.144 -> 172.31.23.72 TCP 66 6633 → 33640 [ACK] Seq=97 Ack=9369 Win=853 Len=0 TSval=1281354 TSecr=26120455
 72 0.221569937 172.31.31.144 -> 172.31.23.72 TCP 187 6633 → 33656 [PSH, ACK] Seq=1 Ack=1 Win=853 Len=121 TSval=1281361 TSecr=26119713
 73 0.221582673 172.31.31.144 -> 172.31.23.72 TCP 187 6633 → 33656 [PSH, ACK] Seq=122 Ack=1 Win=853 Len=121 TSval=1281361 TSecr=26119713
 74 0.221600108 172.31.31.144 -> 172.31.23.72 TCP 187 6633 → 33656 [PSH, ACK] Seq=243 Ack=1 Win=853 Len=121 TSval=1281361 TSecr=26119713
 75 0.221657438 172.31.31.144 -> 172.31.23.72 TCP 187 6633 → 33656 [PSH, ACK] Seq=364 Ack=1 Win=853 Len=121 TSval=1281361 TSecr=26119713
 76 0.221707118 172.31.31.144 -> 172.31.23.72 TCP 187 6633 → 33656 [PSH, ACK] Seq=485 Ack=1 Win=853 Len=121 TSval=1281361 TSecr=26119713
 77 0.221758522 172.31.31.144 -> 172.31.23.72 TCP 187 6633 → 33656 [PSH, ACK] Seq=606 Ack=1 Win=853 Len=121 TSval=1281361 TSecr=26119713
 78 0.221835651 172.31.31.144 -> 172.31.23.72 TCP 187 6633 → 33652 [PSH, ACK] Seq=1 Ack=1 Win=853 Len=121 TSval=1281361 TSecr=26119688
 79 0.221882918 172.31.31.144 -> 172.31.23.72 TCP 187 6633 → 33652 [PSH, ACK] Seq=122 Ack=1 Win=853 Len=121 TSval=1281361 TSecr=26119688
 80 0.221932564 172.31.31.144 -> 172.31.23.72 TCP 187 6633 → 33652 [PSH, ACK] Seq=243 Ack=1 Win=853 Len=121 TSval=1281361 TSecr=26119688
 81 0.222000872 172.31.31.144 -> 172.31.23.72 TCP 187 6633 → 33652 [PSH, ACK] Seq=364 Ack=1 Win=853 Len=121 TSval=1281361 TSecr=26119688
 82 0.222045214 172.31.31.144 -> 172.31.23.72 TCP 187 6633 → 33652 [PSH, ACK] Seq=485 Ack=1 Win=853 Len=121 TSval=1281361 TSecr=26119688
 83 0.222077879 172.31.23.72 -> 172.31.31.144 TCP 66 33656 → 6633 [ACK] Seq=1 Ack=727 Win=213 Len=0 TSval=26120462 TSecr=1281361
 84 0.222102541 172.31.31.144 -> 172.31.23.72 TCP 187 6633 → 33652 [PSH, ACK] Seq=606 Ack=1 Win=853 Len=121 TSval=1281361 TSecr=26119688
 85 0.222166111 172.31.31.144 -> 172.31.23.72 TCP 187 6633 → 33652 [PSH, ACK] Seq=727 Ack=1 Win=853 Len=121 TSval=1281361 TSecr=26119688
 86 0.222222700 172.31.31.144 -> 172.31.23.72 TCP 187 6633 → 33652 [PSH, ACK] Seq=848 Ack=1 Win=853 Len=121 TSval=1281361 TSecr=26119688
 87 0.222300053 172.31.31.144 -> 172.31.23.72 OpenFlow 187 Type: OFPT_PACKET_OUT
 88 0.222326757 172.31.31.144 -> 172.31.23.72 OpenFlow 187 Type: OFPT_PACKET_OUT
 89 0.222436101 172.31.31.144 -> 172.31.23.72 OpenFlow 187 Type: OFPT_PACKET_OUT
 90 0.222459156 172.31.31.144 -> 172.31.23.72 OpenFlow 187 Type: OFPT_PACKET_OUT
 91 0.222486481 172.31.31.144 -> 172.31.23.72 OpenFlow 187 Type: OFPT_PACKET_OUT
 92 0.222552053 172.31.23.72 -> 172.31.31.144 TCP 66 33652 → 6633 [ACK] Seq=1 Ack=969 Win=213 Len=0 TSval=26120462 TSecr=1281361
 93 0.222612340 172.31.31.144 -> 172.31.23.72 OpenFlow 187 Type: OFPT_PACKET_OUT
 94 0.222627856 172.31.31.144 -> 172.31.23.72 OpenFlow 187 Type: OFPT_PACKET_OUT
 95 0.222655230 172.31.31.144 -> 172.31.23.72 OpenFlow 187 Type: OFPT_PACKET_OUT
 96 0.222748194 172.31.31.144 -> 172.31.23.72 TCP 187 6633 → 33650 [PSH, ACK] Seq=1 Ack=1 Win=853 Len=121 TSval=1281361 TSecr=26119713
 97 0.222775957 172.31.31.144 -> 172.31.23.72 TCP 187 6633 → 33650 [PSH, ACK] Seq=122 Ack=1 Win=853 Len=121 TSval=1281361 TSecr=26119713
 98 0.222852192 172.31.31.144 -> 172.31.23.72 TCP 187 6633 → 33650 [PSH, ACK] Seq=243 Ack=1 Win=853 Len=121 TSval=1281361 TSecr=26119713
 99 0.222893868 172.31.31.144 -> 172.31.23.72 TCP 187 6633 → 33650 [PSH, ACK] Seq=364 Ack=1 Win=853 Len=121 TSval=1281361 TSecr=26119713
100 0.222941291 172.31.31.144 -> 172.31.23.72 TCP 187 6633 → 33650 [PSH, ACK] Seq=485 Ack=1 Win=853 Len=121 TSval=1281361 TSecr=26119713
101 0.222949500 172.31.23.72 -> 172.31.31.144 TCP 66 33636 → 6633 [ACK] Seq=8633 Ack=1065 Win=213 Len=0 TSval=26120462 TSecr=1281361
102 0.222994273 172.31.31.144 -> 172.31.23.72 TCP 187 6633 → 33650 [PSH, ACK] Seq=606 Ack=1 Win=853 Len=121 TSval=1281361 TSecr=26119713
103 0.223034684 172.31.23.72 -> 172.31.31.144 OpenFlow 189 Type: OFPT_PACKET_IN
104 0.223055900 172.31.31.144 -> 172.31.23.72 OpenFlow 187 Type: OFPT_PACKET_OUT
105 0.223061223 172.31.23.72 -> 172.31.31.144 OpenFlow 189 Type: OFPT_PACKET_IN
106 0.223100667 172.31.31.144 -> 172.31.23.72 OpenFlow 187 Type: OFPT_PACKET_OUT
107 0.223158343 172.31.31.144 -> 172.31.23.72 OpenFlow 187 Type: OFPT_PACKET_OUT
108 0.223255372 172.31.31.144 -> 172.31.23.72 OpenFlow 187 Type: OFPT_PACKET_OUT
109 0.223292729 172.31.31.144 -> 172.31.23.72 TCP 66 6633 → 33650 [ACK] Seq=1211 Ack=124 Win=853 Len=0 TSval=1281361 TSecr=26120462
110 0.223314745 172.31.31.144 -> 172.31.23.72 TCP 66 6633 → 33650 [ACK] Seq=1211 Ack=247 Win=853 Len=0 TSval=1281361 TSecr=26120462
111 0.223346743 172.31.31.144 -> 172.31.23.72 OpenFlow 187 Type: OFPT_PACKET_OUT
112 0.223371034 172.31.31.144 -> 172.31.23.72 OpenFlow 187 Type: OFPT_PACKET_OUT
113 0.223394828 172.31.31.144 -> 172.31.23.72 OpenFlow 187 Type: OFPT_PACKET_OUT
114 0.223433944 172.31.31.144 -> 172.31.23.72 OpenFlow 187 Type: OFPT_PACKET_OUT
115 0.223482937 172.31.31.144 -> 172.31.23.72 OpenFlow 187 Type: OFPT_PACKET_OUT
116 0.223546812 172.31.31.144 -> 172.31.23.72 OpenFlow 187 Type: OFPT_PACKET_OUT
117 0.223590319 172.31.23.72 -> 172.31.31.144 TCP 66 33650 → 6633 [ACK] Seq=247 Ack=1211 Win=213 Len=0 TSval=26120462 TSecr=1281361
118 0.223615996 172.31.31.144 -> 172.31.23.72 OpenFlow 187 Type: OFPT_PACKET_OUT
119 0.223651365 172.31.31.144 -> 172.31.23.72 OpenFlow 187 Type: OFPT_PACKET_OUT
120 0.223692473 172.31.31.144 -> 172.31.23.72 OpenFlow 187 Type: OFPT_PACKET_OUT
121 0.223706710 172.31.23.72 -> 172.31.31.144 OpenFlow 189 Type: OFPT_PACKET_IN
122 0.223728594 172.31.23.72 -> 172.31.31.144 OpenFlow 189 Type: OFPT_PACKET_IN
123 0.223772740 172.31.31.144 -> 172.31.23.72 OpenFlow 187 Type: OFPT_PACKET_OUT
124 0.223830225 172.31.31.144 -> 172.31.23.72 OpenFlow 187 Type: OFPT_PACKET_OUT
125 0.223855620 172.31.31.144 -> 172.31.23.72 OpenFlow 187 Type: OFPT_PACKET_OUT
126 0.223917227 172.31.31.144 -> 172.31.23.72 OpenFlow 187 Type: OFPT_PACKET_OUT
127 0.223990727 172.31.31.144 -> 172.31.23.72 OpenFlow 187 Type: OFPT_PACKET_OUT
128 0.224027594 172.31.31.144 -> 172.31.23.72 OpenFlow 187 Type: OFPT_PACKET_OUT
129 0.224085514 172.31.31.144 -> 172.31.23.72 TCP 66 6633 → 33640 [ACK] Seq=1307 Ack=9615 Win=853 Len=0 TSval=1281361 TSecr=26120462
130 0.224098970 172.31.31.144 -> 172.31.23.72 OpenFlow 187 Type: OFPT_PACKET_OUT
131 0.224128509 172.31.31.144 -> 172.31.23.72 OpenFlow 187 Type: OFPT_PACKET_OUT
132 0.224223752 172.31.31.144 -> 172.31.23.72 OpenFlow 187 Type: OFPT_PACKET_OUT
133 0.224287031 172.31.31.144 -> 172.31.23.72 OpenFlow 187 Type: OFPT_PACKET_OUT
134 0.224337245 172.31.23.72 -> 172.31.31.144 OpenFlow 189 Type: OFPT_PACKET_IN
135 0.224348463 172.31.31.144 -> 172.31.23.72 OpenFlow 187 Type: OFPT_PACKET_OUT
136 0.224362619 172.31.23.72 -> 172.31.31.144 OpenFlow 189 Type: OFPT_PACKET_IN
137 0.224416667 172.31.31.144 -> 172.31.23.72 TCP 187 6633 → 33660 [PSH, ACK] Seq=1 Ack=1 Win=853 Len=121 TSval=1281362 TSecr=26119713
138 0.224461132 172.31.31.144 -> 172.31.23.72 TCP 187 6633 → 33660 [PSH, ACK] Seq=122 Ack=1 Win=853 Len=121 TSval=1281362 TSecr=26119713
139 0.224526357 172.31.31.144 -> 172.31.23.72 TCP 187 6633 → 33660 [PSH, ACK] Seq=243 Ack=1 Win=853 Len=121 TSval=1281362 TSecr=26119713
140 0.224575459 172.31.31.144 -> 172.31.23.72 TCP 187 6633 → 33660 [PSH, ACK] Seq=364 Ack=1 Win=853 Len=121 TSval=1281362 TSecr=26119713
141 0.224602245 172.31.31.144 -> 172.31.23.72 TCP 66 6633 → 33634 [ACK] Seq=1307 Ack=9492 Win=853 Len=0 TSval=1281362 TSecr=26120463
142 0.224631054 172.31.31.144 -> 172.31.23.72 TCP 187 6633 → 33660 [PSH, ACK] Seq=485 Ack=1 Win=853 Len=121 TSval=1281362 TSecr=26119713
143 0.224701735 172.31.31.144 -> 172.31.23.72 TCP 187 6633 → 33660 [PSH, ACK] Seq=606 Ack=1 Win=853 Len=121 TSval=1281362 TSecr=26119713
144 0.224741529 172.31.31.144 -> 172.31.23.72 TCP 66 6633 → 33634 [ACK] Seq=1307 Ack=9615 Win=853 Len=0 TSval=1281362 TSecr=26120463
145 0.224772909 172.31.31.144 -> 172.31.23.72 TCP 187 6633 → 33660 [PSH, ACK] Seq=727 Ack=1 Win=853 Len=121 TSval=1281362 TSecr=26119713
146 0.224794179 172.31.31.144 -> 172.31.23.72 TCP 187 6633 → 33660 [PSH, ACK] Seq=848 Ack=1 Win=853 Len=121 TSval=1281362 TSecr=26119713
147 0.224867533 172.31.31.144 -> 172.31.23.72 TCP 187 6633 → 33660 [PSH, ACK] Seq=969 Ack=1 Win=853 Len=121 TSval=1281362 TSecr=26119713
148 0.224878922 172.31.23.72 -> 172.31.31.144 OpenFlow 189 Type: OFPT_PACKET_IN
149 0.224898353 172.31.23.72 -> 172.31.31.144 OpenFlow 189 Type: OFPT_PACKET_IN
150 0.224942055 172.31.31.144 -> 172.31.23.72 OpenFlow 187 Type: OFPT_PACKET_OUT
151 0.225003632 172.31.31.144 -> 172.31.23.72 TCP 187 6633 → 33654 [PSH, ACK] Seq=1 Ack=1 Win=853 Len=121 TSval=1281362 TSecr=26119840
152 0.225039080 172.31.31.144 -> 172.31.23.72 TCP 187 6633 → 33654 [PSH, ACK] Seq=122 Ack=1 Win=853 Len=121 TSval=1281362 TSecr=26119840
153 0.225098069 172.31.31.144 -> 172.31.23.72 TCP 66 6633 → 33660 [ACK] Seq=1211 Ack=124 Win=853 Len=0 TSval=1281362 TSecr=26120463
154 0.225124190 172.31.31.144 -> 172.31.23.72 TCP 66 6633 → 33660 [ACK] Seq=1211 Ack=247 Win=853 Len=0 TSval=1281362 TSecr=26120463
155 0.225152642 172.31.31.144 -> 172.31.23.72 TCP 187 6633 → 33654 [PSH, ACK] Seq=243 Ack=1 Win=853 Len=121 TSval=1281362 TSecr=26119840
156 0.225178503 172.31.31.144 -> 172.31.23.72 TCP 187 6633 → 33654 [PSH, ACK] Seq=364 Ack=1 Win=853 Len=121 TSval=1281362 TSecr=26119840
157 0.225205452 172.31.31.144 -> 172.31.23.72 TCP 187 6633 → 33654 [PSH, ACK] Seq=485 Ack=1 Win=853 Len=121 TSval=1281362 TSecr=26119840
158 0.225263631 172.31.31.144 -> 172.31.23.72 TCP 187 6633 → 33654 [PSH, ACK] Seq=606 Ack=1 Win=853 Len=121 TSval=1281362 TSecr=26119840
159 0.225327293 172.31.31.144 -> 172.31.23.72 TCP 187 6633 → 33654 [PSH, ACK] Seq=727 Ack=1 Win=853 Len=121 TSval=1281362 TSecr=26119840
160 0.225366092 172.31.31.144 -> 172.31.23.72 TCP 187 6633 → 33654 [PSH, ACK] Seq=848 Ack=1 Win=853 Len=121 TSval=1281362 TSecr=26119840
161 0.225432688 172.31.31.144 -> 172.31.23.72 OpenFlow 187 Type: OFPT_PACKET_OUT
162 0.225480754 172.31.31.144 -> 172.31.23.72 OpenFlow 187 Type: OFPT_PACKET_OUT
163 0.225488510 172.31.23.72 -> 172.31.31.144 OpenFlow 189 Type: OFPT_PACKET_IN
164 0.225508119 172.31.23.72 -> 172.31.31.144 OpenFlow 435 Type: OFPT_PACKET_IN
165 0.225552706 172.31.31.144 -> 172.31.23.72 OpenFlow 187 Type: OFPT_PACKET_OUT
166 0.225597484 172.31.31.144 -> 172.31.23.72 OpenFlow 187 Type: OFPT_PACKET_OUT
167 0.225648729 172.31.31.144 -> 172.31.23.72 OpenFlow 187 Type: OFPT_PACKET_OUT
168 0.225690784 172.31.31.144 -> 172.31.23.72 OpenFlow 187 Type: OFPT_PACKET_OUT
169 0.225798146 172.31.31.144 -> 172.31.23.72 TCP 187 6633 → 33646 [PSH, ACK] Seq=1 Ack=1 Win=853 Len=121 TSval=1281362 TSecr=26119713
170 0.225843044 172.31.31.144 -> 172.31.23.72 TCP 187 6633 → 33646 [PSH, ACK] Seq=122 Ack=1 Win=853 Len=121 TSval=1281362 TSecr=26119713
171 0.225899204 172.31.31.144 -> 172.31.23.72 TCP 66 6633 → 33654 [ACK] Seq=969 Ack=493 Win=853 Len=0 TSval=1281362 TSecr=26120463
172 0.225927366 172.31.31.144 -> 172.31.23.72 TCP 187 6633 → 33646 [PSH, ACK] Seq=243 Ack=1 Win=853 Len=121 TSval=1281362 TSecr=26119713
173 0.225954808 172.31.31.144 -> 172.31.23.72 TCP 187 6633 → 33646 [PSH, ACK] Seq=364 Ack=1 Win=853 Len=121 TSval=1281362 TSecr=26119713
174 0.225985340 172.31.23.72 -> 172.31.31.144 OpenFlow 189 Type: OFPT_PACKET_IN
175 0.226006173 172.31.23.72 -> 172.31.31.144 OpenFlow 189 Type: OFPT_PACKET_IN
176 0.226032279 172.31.31.144 -> 172.31.23.72 TCP 187 6633 → 33646 [PSH, ACK] Seq=485 Ack=1 Win=853 Len=121 TSval=1281362 TSecr=26119713
177 0.226067251 172.31.31.144 -> 172.31.23.72 TCP 187 6633 → 33646 [PSH, ACK] Seq=606 Ack=1 Win=853 Len=121 TSval=1281362 TSecr=26119713
178 0.226136723 172.31.31.144 -> 172.31.23.72 TCP 187 6633 → 33646 [PSH, ACK] Seq=727 Ack=1 Win=853 Len=121 TSval=1281362 TSecr=26119713
179 0.226176056 172.31.31.144 -> 172.31.23.72 TCP 187 6633 → 33646 [PSH, ACK] Seq=848 Ack=1 Win=853 Len=121 TSval=1281362 TSecr=26119713
180 0.226254227 172.31.23.72 -> 172.31.31.144 OpenFlow 189 Type: OFPT_PACKET_IN
181 0.226264851 172.31.31.144 -> 172.31.23.72 OpenFlow 187 Type: OFPT_PACKET_OUT
182 0.226278821 172.31.23.72 -> 172.31.31.144 OpenFlow 189 Type: OFPT_PACKET_IN
183 0.226307328 172.31.31.144 -> 172.31.23.72 TCP 66 6633 → 33666 [ACK] Seq=727 Ack=493 Win=853 Len=0 TSval=1281362 TSecr=26120463
184 0.226312402 172.31.23.72 -> 172.31.31.144 OpenFlow 558 Type: OFPT_PACKET_IN
185 0.226351168 172.31.31.144 -> 172.31.23.72 OpenFlow 187 Type: OFPT_PACKET_OUT
186 0.226365144 172.31.31.144 -> 172.31.23.72 TCP 187 6633 → 33644 [PSH, ACK] Seq=1 Ack=1 Win=853 Len=121 TSval=1281362 TSecr=26119713
187 0.226394280 172.31.31.144 -> 172.31.23.72 TCP 187 6633 → 33644 [PSH, ACK] Seq=122 Ack=1 Win=853 Len=121 TSval=1281362 TSecr=26119713
188 0.226426359 172.31.31.144 -> 172.31.23.72 TCP 187 6633 → 33644 [PSH, ACK] Seq=243 Ack=1 Win=853 Len=121 TSval=1281362 TSecr=26119713
189 0.226483143 172.31.31.144 -> 172.31.23.72 TCP 187 6633 → 33644 [PSH, ACK] Seq=364 Ack=1 Win=853 Len=121 TSval=1281362 TSecr=26119713
190 0.226512945 172.31.31.144 -> 172.31.23.72 TCP 66 6633 → 33646 [ACK] Seq=1211 Ack=124 Win=853 Len=0 TSval=1281362 TSecr=26120463
191 0.226544668 172.31.31.144 -> 172.31.23.72 TCP 66 6633 → 33646 [ACK] Seq=1211 Ack=247 Win=853 Len=0 TSval=1281362 TSecr=26120463
192 0.226815517 172.31.23.72 -> 172.31.31.144 OpenFlow 189 Type: OFPT_PACKET_IN
193 0.226859528 172.31.23.72 -> 172.31.31.144 OpenFlow 189 Type: OFPT_PACKET_IN
194 0.227021417 172.31.23.72 -> 172.31.31.144 OpenFlow 189 Type: OFPT_PACKET_IN
195 0.227046233 172.31.23.72 -> 172.31.31.144 OpenFlow 435 Type: OFPT_PACKET_IN
196 0.227056737 172.31.23.72 -> 172.31.31.144 OpenFlow 189 Type: OFPT_PACKET_IN
197 0.227075107 172.31.23.72 -> 172.31.31.144 OpenFlow 189 Type: OFPT_PACKET_IN
198 0.227113568 172.31.23.72 -> 172.31.31.144 OpenFlow 435 Type: OFPT_PACKET_IN
199 0.227117973 172.31.23.72 -> 172.31.31.144 OpenFlow 681 Type: OFPT_PACKET_IN
200 0.227119612 172.31.23.72 -> 172.31.31.144 OpenFlow 189 Type: OFPT_PACKET_IN
201 0.227133855 172.31.23.72 -> 172.31.31.144 OpenFlow 189 Type: OFPT_PACKET_IN
202 0.227158538 172.31.23.72 -> 172.31.31.144 OpenFlow 189 Type: OFPT_PACKET_IN
203 0.227170717 172.31.23.72 -> 172.31.31.144 OpenFlow 189 Type: OFPT_PACKET_IN
204 0.227183858 172.31.23.72 -> 172.31.31.144 OpenFlow 189 Type: OFPT_PACKET_IN
205 0.227199632 172.31.23.72 -> 172.31.31.144 OpenFlow 189 Type: OFPT_PACKET_IN
206 0.227201950 172.31.23.72 -> 172.31.31.144 OpenFlow 189 Type: OFPT_PACKET_IN
207 0.227234632 172.31.31.144 -> 172.31.23.72 OpenFlow 187 Type: OFPT_PACKET_OUT
208 0.227238199 172.31.31.144 -> 172.31.23.72 TCP 66 6633 → 33646 [ACK] Seq=1211 Ack=739 Win=853 Len=0 TSval=1281362 TSecr=26120463
209 0.227243153 172.31.23.72 -> 172.31.31.144 OpenFlow 189 Type: OFPT_PACKET_IN
210 0.227248439 172.31.23.72 -> 172.31.31.144 OpenFlow 189 Type: OFPT_PACKET_IN
211 0.227327951 172.31.23.72 -> 172.31.31.144 OpenFlow 189 Type: OFPT_PACKET_IN
212 0.227331071 172.31.23.72 -> 172.31.31.144 OpenFlow 189 Type: OFPT_PACKET_IN
213 0.227332695 172.31.23.72 -> 172.31.31.144 OpenFlow 435 Type: OFPT_PACKET_IN
214 0.227334303 172.31.23.72 -> 172.31.31.144 OpenFlow 927 Type: OFPT_PACKET_IN
215 0.227354964 172.31.23.72 -> 172.31.31.144 OpenFlow 189 Type: OFPT_PACKET_IN
216 0.227373568 172.31.31.144 -> 172.31.23.72 OpenFlow 187 Type: OFPT_PACKET_OUT
217 0.227377556 172.31.31.144 -> 172.31.23.72 TCP 66 6633 → 33644 [ACK] Seq=727 Ack=124 Win=853 Len=0 TSval=1281362 TSecr=26120463
218 0.227380385 172.31.31.144 -> 172.31.23.72 TCP 66 6633 → 33644 [ACK] Seq=727 Ack=247 Win=853 Len=0 TSval=1281362 TSecr=26120463
219 0.227382194 172.31.31.144 -> 172.31.23.72 TCP 66 6633 → 33632 [ACK] Seq=97 Ack=9380 Win=853 Len=0 TSval=1281362 TSecr=26120463
220 0.227384184 172.31.31.144 -> 172.31.23.72 TCP 66 6633 → 33632 [ACK] Seq=97 Ack=9749 Win=853 Len=0 TSval=1281362 TSecr=26120463
221 0.227391611 172.31.23.72 -> 172.31.31.144 OpenFlow 189 Type: OFPT_PACKET_IN
222 0.227397667 172.31.23.72 -> 172.31.31.144 OpenFlow 435 Type: OFPT_PACKET_IN
223 0.227412780 172.31.23.72 -> 172.31.31.144 OpenFlow 189 Type: OFPT_PACKET_IN
224 0.227436308 172.31.23.72 -> 172.31.31.144 OpenFlow 189 Type: OFPT_PACKET_IN
225 0.227459601 172.31.23.72 -> 172.31.31.144 OpenFlow 189 Type: OFPT_PACKET_IN
226 0.227484472 172.31.23.72 -> 172.31.31.144 OpenFlow 189 Type: OFPT_PACKET_IN
227 0.227584236 172.31.31.144 -> 172.31.23.72 TCP 66 6633 → 33648 [ACK] Seq=1 Ack=124 Win=853 Len=0 TSval=1281362 TSecr=26120463
228 0.227591275 172.31.31.144 -> 172.31.23.72 TCP 66 6633 → 33672 [ACK] Seq=1 Ack=124 Win=853 Len=0 TSval=1281362 TSecr=26120463
229 0.227593743 172.31.31.144 -> 172.31.23.72 TCP 66 6633 → 33648 [ACK] Seq=1 Ack=739 Win=853 Len=0 TSval=1281362 TSecr=26120463
230 0.227595717 172.31.31.144 -> 172.31.23.72 TCP 66 6633 → 33630 [ACK] Seq=97 Ack=8644 Win=853 Len=0 TSval=1281362 TSecr=26120463
231 0.227597714 172.31.31.144 -> 172.31.23.72 TCP 66 6633 → 33670 [ACK] Seq=1 Ack=370 Win=853 Len=0 TSval=1281362 TSecr=26120463
232 0.227599690 172.31.31.144 -> 172.31.23.72 TCP 66 6633 → 33662 [ACK] Seq=1 Ack=493 Win=853 Len=0 TSval=1281362 TSecr=26120463
233 0.227606332 172.31.23.72 -> 172.31.31.144 OpenFlow 189 Type: OFPT_PACKET_IN
234 0.227619768 172.31.23.72 -> 172.31.31.144 OpenFlow 189 Type: OFPT_PACKET_IN
235 0.227627513 172.31.23.72 -> 172.31.31.144 TCP 66 33644 → 6633 [ACK] Seq=247 Ack=727 Win=213 Len=0 TSval=26120463 TSecr=1281362
236 0.227698556 172.31.23.72 -> 172.31.31.144 OpenFlow 927 Type: OFPT_PACKET_IN
237 0.227701905 172.31.23.72 -> 172.31.31.144 OpenFlow 435 Type: OFPT_PACKET_IN
238 0.227703562 172.31.23.72 -> 172.31.31.144 OpenFlow 681 Type: OFPT_PACKET_IN
239 0.227705251 172.31.23.72 -> 172.31.31.144 OpenFlow 189 Type: OFPT_PACKET_IN
240 0.227718880 172.31.23.72 -> 172.31.31.144 OpenFlow 189 Type: OFPT_PACKET_IN
241 0.227725282 172.31.31.144 -> 172.31.23.72 TCP 66 6633 → 33664 [ACK] Seq=1 Ack=124 Win=853 Len=0 TSval=1281362 TSecr=26120463
242 0.227730272 172.31.31.144 -> 172.31.23.72 TCP 66 6633 → 33658 [ACK] Seq=1 Ack=370 Win=853 Len=0 TSval=1281362 TSecr=26120463
243 0.227732204 172.31.31.144 -> 172.31.23.72 TCP 66 6633 → 33672 [ACK] Seq=1 Ack=247 Win=853 Len=0 TSval=1281362 TSecr=26120463
244 0.227734040 172.31.31.144 -> 172.31.23.72 TCP 66 6633 → 33638 [ACK] Seq=97 Ack=7188 Win=853 Len=0 TSval=1281362 TSecr=26120463
245 0.227736022 172.31.31.144 -> 172.31.23.72 TCP 66 6633 → 33630 [ACK] Seq=97 Ack=8767 Win=853 Len=0 TSval=1281362 TSecr=26120463
246 0.227738079 172.31.31.144 -> 172.31.23.72 TCP 66 6633 → 33670 [ACK] Seq=1 Ack=493 Win=853 Len=0 TSval=1281362 TSecr=26120463
247 0.227883544 172.31.23.72 -> 172.31.31.144 OpenFlow 189 Type: OFPT_PACKET_IN
248 0.227942241 172.31.31.144 -> 172.31.23.72 TCP 66 6633 → 33664 [ACK] Seq=1 Ack=247 Win=853 Len=0 TSval=1281362 TSecr=26120463
249 0.227950671 172.31.31.144 -> 172.31.23.72 TCP 66 6633 → 33658 [ACK] Seq=1 Ack=739 Win=853 Len=0 TSval=1281362 TSecr=26120463
250 0.227952728 172.31.31.144 -> 172.31.23.72 TCP 66 6633 → 33642 [ACK] Seq=1 Ack=985 Win=853 Len=0 TSval=1281362 TSecr=26120463
251 0.227956073 172.31.31.144 -> 172.31.23.72 TCP 66 6633 → 33668 [ACK] Seq=969 Ack=124 Win=853 Len=0 TSval=1281362 TSecr=26120463
252 0.227957843 172.31.31.144 -> 172.31.23.72 TCP 66 6633 → 33656 [ACK] Seq=727 Ack=124 Win=853 Len=0 TSval=1281362 TSecr=26120463
253 0.227959591 172.31.31.144 -> 172.31.23.72 TCP 66 6633 → 33638 [ACK] Seq=97 Ack=7557 Win=853 Len=0 TSval=1281362 TSecr=26120463
254 0.227961385 172.31.31.144 -> 172.31.23.72 TCP 66 6633 → 33652 [ACK] Seq=969 Ack=124 Win=853 Len=0 TSval=1281362 TSecr=26120463
255 0.227989095 172.31.31.144 -> 172.31.23.72 TCP 66 6633 → 33636 [ACK] Seq=1065 Ack=8756 Win=853 Len=0 TSval=1281362 TSecr=26120463
256 0.227991437 172.31.31.144 -> 172.31.23.72 TCP 66 6633 → 33650 [ACK] Seq=1211 Ack=370 Win=853 Len=0 TSval=1281362 TSecr=26120463
257 0.228008565 172.31.31.144 -> 172.31.23.72 TCP 66 6633 → 33668 [ACK] Seq=969 Ack=247 Win=853 Len=0 TSval=1281362 TSecr=26120463
258 0.228036088 172.31.31.144 -> 172.31.23.72 TCP 66 6633 → 33656 [ACK] Seq=727 Ack=247 Win=853 Len=0 TSval=1281362 TSecr=26120463
259 0.228063561 172.31.31.144 -> 172.31.23.72 TCP 66 6633 → 33652 [ACK] Seq=969 Ack=985 Win=853 Len=0 TSval=1281362 TSecr=26120463
260 0.228090391 172.31.31.144 -> 172.31.23.72 TCP 66 6633 → 33650 [ACK] Seq=1211 Ack=985 Win=853 Len=0 TSval=1281362 TSecr=26120463
261 0.228118374 172.31.31.144 -> 172.31.23.72 TCP 66 6633 → 33648 [ACK] Seq=1 Ack=862 Win=853 Len=0 TSval=1281362 TSecr=26120463
262 0.228194934 172.31.31.144 -> 172.31.23.72 TCP 66 6633 → 33648 [ACK] Seq=1 Ack=985 Win=853 Len=0 TSval=1281362 TSecr=26120463
263 0.228659772 172.31.31.144 -> 172.31.23.72 TCP 66 6633 → 33640 [ACK] Seq=1307 Ack=9861 Win=853 Len=0 TSval=1281363 TSecr=26120463
264 0.228686018 172.31.31.144 -> 172.31.23.72 TCP 66 6633 → 33636 [ACK] Seq=1065 Ack=9125 Win=853 Len=0 TSval=1281363 TSecr=26120463
265 0.233817563 172.31.31.144 -> 172.31.23.72 OpenFlow 90 Type: OFPT_MULTIPART_REQUEST, OFPMP_PORT_STATS
266 0.234101369 172.31.23.72 -> 172.31.31.144 OpenFlow 754 Type: OFPT_MULTIPART_REPLY, OFPMP_PORT_STATS
267 0.234965523 172.31.31.144 -> 172.31.23.72 OpenFlow 122 Type: OFPT_MULTIPART_REQUEST, OFPMP_FLOW
268 0.234995272 172.31.31.144 -> 172.31.23.72 OpenFlow 82 Type: OFPT_MULTIPART_REQUEST, OFPMP_TABLE
269 0.235296692 172.31.23.72 -> 172.31.31.144 OpenFlow 1594 Type: OFPT_MULTIPART_REPLY, OFPMP_FLOW
270 0.235460150 172.31.23.72 -> 172.31.31.144 OpenFlow 6178 Type: OFPT_MULTIPART_REPLY, OFPMP_TABLE
271 0.235752450 172.31.31.144 -> 172.31.23.72 TCP 66 6633 → 33642 [ACK] Seq=97 Ack=9313 Win=853 Len=0 TSval=1281364 TSecr=26120465
272 0.264303832 172.31.23.72 -> 172.31.31.144 TCP 66 33646 → 6633 [ACK] Seq=739 Ack=1211 Win=213 Len=0 TSval=26120473 TSecr=1281362
273 0.264311210 172.31.23.72 -> 172.31.31.144 TCP 66 33660 → 6633 [ACK] Seq=247 Ack=1211 Win=213 Len=0 TSval=26120473 TSecr=1281362
274 0.277064991 172.31.31.144 -> 172.31.23.72 OpenFlow 82 Type: OFPT_MULTIPART_REQUEST, OFPMP_TABLE
275 0.277084421 172.31.31.144 -> 172.31.23.72 OpenFlow 146 Type: OFPT_MULTIPART_REQUEST, OFPMP_FLOW
276 0.277456192 172.31.23.72 -> 172.31.31.144 OpenFlow 6178 Type: OFPT_MULTIPART_REPLY, OFPMP_TABLE
277 0.277554791 172.31.23.72 -> 172.31.31.144 OpenFlow 530 Type: OFPT_MULTIPART_REPLY, OFPMP_PORT_STATS
278 0.277619619 172.31.23.72 -> 172.31.31.144 OpenFlow 1178 Type: OFPT_MULTIPART_REPLY, OFPMP_FLOW
279 0.277754575 172.31.31.144 -> 172.31.23.72 TCP 66 6633 → 33644 [ACK] Seq=823 Ack=6359 Win=853 Len=0 TSval=1281375 TSecr=26120476
280 0.277806388 172.31.31.144 -> 172.31.23.72 TCP 66 6633 → 33644 [ACK] Seq=823 Ack=6823 Win=853 Len=0 TSval=1281375 TSecr=26120476
281 0.277845825 172.31.31.144 -> 172.31.23.72 TCP 66 6633 → 33644 [ACK] Seq=823 Ack=7935 Win=853 Len=0 TSval=1281375 TSecr=26120476
282 0.321889121 172.31.31.144 -> 172.31.23.72 OpenFlow 187 Type: OFPT_PACKET_OUT
283 0.321914772 172.31.31.144 -> 172.31.23.72 OpenFlow 187 Type: OFPT_PACKET_OUT
284 0.321933342 172.31.31.144 -> 172.31.23.72 OpenFlow 187 Type: OFPT_PACKET_OUT
285 0.321968769 172.31.31.144 -> 172.31.23.72 OpenFlow 187 Type: OFPT_PACKET_OUT
286 0.322015639 172.31.31.144 -> 172.31.23.72 OpenFlow 187 Type: OFPT_PACKET_OUT
287 0.322072807 172.31.31.144 -> 172.31.23.72 OpenFlow 187 Type: OFPT_PACKET_OUT
288 0.322124896 172.31.31.144 -> 172.31.23.72 OpenFlow 187 Type: OFPT_PACKET_OUT
289 0.322180505 172.31.31.144 -> 172.31.23.72 OpenFlow 187 Type: OFPT_PACKET_OUT
290 0.322254904 172.31.31.144 -> 172.31.23.72 OpenFlow 187 Type: OFPT_PACKET_OUT
291 0.322301258 172.31.31.144 -> 172.31.23.72 OpenFlow 187 Type: OFPT_PACKET_OUT
292 0.322360979 172.31.31.144 -> 172.31.23.72 OpenFlow 187 Type: OFPT_PACKET_OUT
293 0.322404632 172.31.31.144 -> 172.31.23.72 OpenFlow 187 Type: OFPT_PACKET_OUT
294 0.322465757 172.31.31.144 -> 172.31.23.72 OpenFlow 187 Type: OFPT_PACKET_OUT
295 0.322527782 172.31.31.144 -> 172.31.23.72 OpenFlow 187 Type: OFPT_PACKET_OUT
296 0.322588424 172.31.31.144 -> 172.31.23.72 OpenFlow 187 Type: OFPT_PACKET_OUT
297 0.322599432 172.31.23.72 -> 172.31.31.144 TCP 66 33632 → 6633 [ACK] Seq=9749 Ack=1065 Win=213 Len=0 TSval=26120487 TSecr=1281386
298 0.322663069 172.31.31.144 -> 172.31.23.72 OpenFlow 187 Type: OFPT_PACKET_OUT
299 0.322686880 172.31.31.144 -> 172.31.23.72 OpenFlow 187 Type: OFPT_PACKET_OUT
300 0.322748748 172.31.31.144 -> 172.31.23.72 OpenFlow 187 Type: OFPT_PACKET_OUT
301 0.322851806 172.31.31.144 -> 172.31.23.72 OpenFlow 187 Type: OFPT_PACKET_OUT
302 0.322858415 172.31.31.144 -> 172.31.23.72 OpenFlow 187 Type: OFPT_PACKET_OUT
303 0.322932199 172.31.31.144 -> 172.31.23.72 OpenFlow 187 Type: OFPT_PACKET_OUT
304 0.322989948 172.31.31.144 -> 172.31.23.72 OpenFlow 187 Type: OFPT_PACKET_OUT
305 0.323044583 172.31.31.144 -> 172.31.23.72 OpenFlow 187 Type: OFPT_PACKET_OUT
306 0.323094550 172.31.31.144 -> 172.31.23.72 OpenFlow 187 Type: OFPT_PACKET_OUT
307 0.323151110 172.31.23.72 -> 172.31.31.144 TCP 66 33662 → 6633 [ACK] Seq=493 Ack=1211 Win=213 Len=0 TSval=26120487 TSecr=1281386
308 0.323167052 172.31.31.144 -> 172.31.23.72 OpenFlow 187 Type: OFPT_PACKET_OUT
309 0.323208239 172.31.31.144 -> 172.31.23.72 OpenFlow 187 Type: OFPT_PACKET_OUT
310 0.323243802 172.31.31.144 -> 172.31.23.72 TCP 187 6633 → 33676 [PSH, ACK] Seq=1 Ack=1 Win=853 Len=121 TSval=1281386 TSecr=26119713
311 0.323292389 172.31.31.144 -> 172.31.23.72 TCP 187 6633 → 33676 [PSH, ACK] Seq=122 Ack=1 Win=853 Len=121 TSval=1281386 TSecr=26119713
312 0.323346708 172.31.31.144 -> 172.31.23.72 TCP 187 6633 → 33676 [PSH, ACK] Seq=243 Ack=1 Win=853 Len=121 TSval=1281386 TSecr=26119713
313 0.323400230 172.31.31.144 -> 172.31.23.72 TCP 187 6633 → 33676 [PSH, ACK] Seq=364 Ack=1 Win=853 Len=121 TSval=1281386 TSecr=26119713
314 0.323448572 172.31.31.144 -> 172.31.23.72 TCP 187 6633 → 33676 [PSH, ACK] Seq=485 Ack=1 Win=853 Len=121 TSval=1281386 TSecr=26119713
315 0.323505697 172.31.31.144 -> 172.31.23.72 TCP 187 6633 → 33676 [PSH, ACK] Seq=606 Ack=1 Win=853 Len=121 TSval=1281386 TSecr=26119713
316 0.323595020 172.31.31.144 -> 172.31.23.72 TCP 187 6633 → 33674 [PSH, ACK] Seq=1 Ack=1 Win=853 Len=121 TSval=1281386 TSecr=26119713
317 0.323635204 172.31.23.72 -> 172.31.31.144 TCP 66 33648 → 6633 [ACK] Seq=985 Ack=969 Win=213 Len=0 TSval=26120487 TSecr=1281386
318 0.323645675 172.31.31.144 -> 172.31.23.72 TCP 187 6633 → 33674 [PSH, ACK] Seq=122 Ack=1 Win=853 Len=121 TSval=1281386 TSecr=26119713
319 0.323706607 172.31.31.144 -> 172.31.23.72 TCP 187 6633 → 33674 [PSH, ACK] Seq=243 Ack=1 Win=853 Len=121 TSval=1281386 TSecr=26119713
320 0.323749304 172.31.31.144 -> 172.31.23.72 TCP 187 6633 → 33674 [PSH, ACK] Seq=364 Ack=1 Win=853 Len=121 TSval=1281386 TSecr=26119713
321 0.323798125 172.31.31.144 -> 172.31.23.72 TCP 187 6633 → 33674 [PSH, ACK] Seq=485 Ack=1 Win=853 Len=121 TSval=1281386 TSecr=26119713
322 0.323854179 172.31.31.144 -> 172.31.23.72 TCP 187 6633 → 33674 [PSH, ACK] Seq=606 Ack=1 Win=853 Len=121 TSval=1281386 TSecr=26119713
323 0.323913447 172.31.31.144 -> 172.31.23.72 TCP 187 6633 → 33674 [PSH, ACK] Seq=727 Ack=1 Win=853 Len=121 TSval=1281386 TSecr=26119713
324 0.323923278 172.31.23.72 -> 172.31.31.144 TCP 66 33676 → 6633 [ACK] Seq=1 Ack=727 Win=213 Len=0 TSval=26120487 TSecr=1281386
325 0.323991613 172.31.31.144 -> 172.31.23.72 TCP 187 6633 → 33674 [PSH, ACK] Seq=848 Ack=1 Win=853 Len=121 TSval=1281386 TSecr=26119713
326 0.324025336 172.31.23.72 -> 172.31.31.144 OpenFlow 189 Type: OFPT_PACKET_IN
327 0.324035565 172.31.31.144 -> 172.31.23.72 OpenFlow 187 Type: OFPT_PACKET_OUT
328 0.324049146 172.31.23.72 -> 172.31.31.144 OpenFlow 189 Type: OFPT_PACKET_IN
329 0.324075978 172.31.31.144 -> 172.31.23.72 OpenFlow 187 Type: OFPT_PACKET_OUT
330 0.324082385 172.31.23.72 -> 172.31.31.144 OpenFlow 312 Type: OFPT_PACKET_IN
331 0.324138550 172.31.31.144 -> 172.31.23.72 OpenFlow 187 Type: OFPT_PACKET_OUT
332 0.324182885 172.31.31.144 -> 172.31.23.72 OpenFlow 187 Type: OFPT_PACKET_OUT
333 0.324229032 172.31.31.144 -> 172.31.23.72 OpenFlow 187 Type: OFPT_PACKET_OUT
334 0.324246312 172.31.31.144 -> 172.31.23.72 TCP 66 6633 → 33674 [ACK] Seq=969 Ack=124 Win=853 Len=0 TSval=1281387 TSecr=26120487
335 0.324274232 172.31.31.144 -> 172.31.23.72 TCP 66 6633 → 33674 [ACK] Seq=969 Ack=247 Win=853 Len=0 TSval=1281387 TSecr=26120487
336 0.324294952 172.31.31.144 -> 172.31.23.72 OpenFlow 187 Type: OFPT_PACKET_OUT
337 0.324313928 172.31.31.144 -> 172.31.23.72 TCP 66 6633 → 33674 [ACK] Seq=969 Ack=493 Win=853 Len=0 TSval=1281387 TSecr=26120487
338 0.324363993 172.31.31.144 -> 172.31.23.72 OpenFlow 187 Type: OFPT_PACKET_OUT
339 0.324456495 172.31.31.144 -> 172.31.23.72 OpenFlow 187 Type: OFPT_PACKET_OUT
340 0.324494254 172.31.23.72 -> 172.31.31.144 OpenFlow 189 Type: OFPT_PACKET_IN
341 0.324512400 172.31.31.144 -> 172.31.23.72 OpenFlow 187 Type: OFPT_PACKET_OUT
342 0.324519504 172.31.23.72 -> 172.31.31.144 OpenFlow 189 Type: OFPT_PACKET_IN
343 0.324557924 172.31.23.72 -> 172.31.31.144 OpenFlow 312 Type: OFPT_PACKET_IN
344 0.324593109 172.31.31.144 -> 172.31.23.72 OpenFlow 187 Type: OFPT_PACKET_OUT
345 0.324628245 172.31.31.144 -> 172.31.23.72 OpenFlow 187 Type: OFPT_PACKET_OUT
346 0.324669788 172.31.31.144 -> 172.31.23.72 OpenFlow 187 Type: OFPT_PACKET_OUT
347 0.324729361 172.31.31.144 -> 172.31.23.72 OpenFlow 187 Type: OFPT_PACKET_OUT
348 0.324745631 172.31.31.144 -> 172.31.23.72 TCP 66 6633 → 33672 [ACK] Seq=969 Ack=370 Win=853 Len=0 TSval=1281387 TSecr=26120488
349 0.324798052 172.31.31.144 -> 172.31.23.72 OpenFlow 187 Type: OFPT_PACKET_OUT
350 0.324968624 172.31.31.144 -> 172.31.23.72 OpenFlow 187 Type: OFPT_PACKET_OUT
351 0.324974039 172.31.31.144 -> 172.31.23.72 TCP 66 6633 → 33672 [ACK] Seq=969 Ack=739 Win=853 Len=0 TSval=1281387 TSecr=26120488
352 0.324976999 172.31.31.144 -> 172.31.23.72 OpenFlow 187 Type: OFPT_PACKET_OUT
353 0.324990174 172.31.31.144 -> 172.31.23.72 OpenFlow 187 Type: OFPT_PACKET_OUT
354 0.325000210 172.31.23.72 -> 172.31.31.144 OpenFlow 189 Type: OFPT_PACKET_IN
355 0.325011358 172.31.31.144 -> 172.31.23.72 OpenFlow 187 Type: OFPT_PACKET_OUT
356 0.325018730 172.31.23.72 -> 172.31.31.144 OpenFlow 189 Type: OFPT_PACKET_IN
357 0.325102487 172.31.31.144 -> 172.31.23.72 OpenFlow 187 Type: OFPT_PACKET_OUT
358 0.325135338 172.31.31.144 -> 172.31.23.72 OpenFlow 187 Type: OFPT_PACKET_OUT
359 0.325224189 172.31.31.144 -> 172.31.23.72 OpenFlow 187 Type: OFPT_PACKET_OUT
360 0.325237541 172.31.31.144 -> 172.31.23.72 TCP 66 6633 → 33630 [ACK] Seq=823 Ack=8890 Win=853 Len=0 TSval=1281387 TSecr=26120488
361 0.325258823 172.31.31.144 -> 172.31.23.72 OpenFlow 187 Type: OFPT_PACKET_OUT
362 0.325286659 172.31.23.72 -> 172.31.31.144 OpenFlow 189 Type: OFPT_PACKET_IN
363 0.325313637 172.31.23.72 -> 172.31.31.144 OpenFlow 189 Type: OFPT_PACKET_IN
364 0.325350606 172.31.31.144 -> 172.31.23.72 OpenFlow 187 Type: OFPT_PACKET_OUT
365 0.325382713 172.31.31.144 -> 172.31.23.72 TCP 66 6633 → 33630 [ACK] Seq=823 Ack=9013 Win=853 Len=0 TSval=1281387 TSecr=26120488
366 0.325406614 172.31.31.144 -> 172.31.23.72 OpenFlow 187 Type: OFPT_PACKET_OUT
367 0.325461393 172.31.31.144 -> 172.31.23.72 OpenFlow 187 Type: OFPT_PACKET_OUT
368 0.325518230 172.31.31.144 -> 172.31.23.72 OpenFlow 187 Type: OFPT_PACKET_OUT
369 0.325534314 172.31.31.144 -> 172.31.23.72 TCP 66 6633 → 33670 [ACK] Seq=969 Ack=616 Win=853 Len=0 TSval=1281387 TSecr=26120488
370 0.325571452 172.31.31.144 -> 172.31.23.72 OpenFlow 187 Type: OFPT_PACKET_OUT
371 0.325641691 172.31.31.144 -> 172.31.23.72 OpenFlow 187 Type: OFPT_PACKET_OUT
