  1 0.000000000 172.31.31.144 -> 172.31.23.72 TCP 187 6633 → 48358 [PSH, ACK] Seq=1 Ack=1 Win=853 Len=121 TSval=3421181 TSecr=21991062
  2 0.000046831 172.31.31.144 -> 172.31.23.72 TCP 187 6633 → 48358 [PSH, ACK] Seq=122 Ack=1 Win=853 Len=121 TSval=3421182 TSecr=21991062
  3 0.000051846 172.31.31.144 -> 172.31.23.72 TCP 187 6633 → 48358 [PSH, ACK] Seq=243 Ack=1 Win=853 Len=121 TSval=3421182 TSecr=21991062
  4 0.000099620 172.31.31.144 -> 172.31.23.72 TCP 187 6633 → 48358 [PSH, ACK] Seq=364 Ack=1 Win=853 Len=121 TSval=3421182 TSecr=21991062
  5 0.000152428 172.31.31.144 -> 172.31.23.72 TCP 187 6633 → 48358 [PSH, ACK] Seq=485 Ack=1 Win=853 Len=121 TSval=3421182 TSecr=21991062
  6 0.000210841 172.31.31.144 -> 172.31.23.72 TCP 187 6633 → 48358 [PSH, ACK] Seq=606 Ack=1 Win=853 Len=121 TSval=3421182 TSecr=21991062
  7 0.000286722 172.31.31.144 -> 172.31.23.72 TCP 187 6633 → 48358 [PSH, ACK] Seq=727 Ack=1 Win=853 Len=121 TSval=3421182 TSecr=21991062
  8 0.000382280 172.31.31.144 -> 172.31.23.72 TCP 187 6633 → 48358 [PSH, ACK] Seq=848 Ack=1 Win=853 Len=121 TSval=3421182 TSecr=21991062
  9 0.000454728 172.31.31.144 -> 172.31.23.72 TCP 187 6633 → 48346 [PSH, ACK] Seq=1 Ack=1 Win=853 Len=121 TSval=3421182 TSecr=21990980
 10 0.000487570 172.31.31.144 -> 172.31.23.72 TCP 187 6633 → 48346 [PSH, ACK] Seq=122 Ack=1 Win=853 Len=121 TSval=3421182 TSecr=21990980
 11 0.000552849 172.31.31.144 -> 172.31.23.72 TCP 187 6633 → 48346 [PSH, ACK] Seq=243 Ack=1 Win=853 Len=121 TSval=3421182 TSecr=21990980
 12 0.000623882 172.31.31.144 -> 172.31.23.72 TCP 187 6633 → 48346 [PSH, ACK] Seq=364 Ack=1 Win=853 Len=121 TSval=3421182 TSecr=21990980
 13 0.000670513 172.31.31.144 -> 172.31.23.72 TCP 187 6633 → 48346 [PSH, ACK] Seq=485 Ack=1 Win=853 Len=121 TSval=3421182 TSecr=21990980
 14 0.000701045 172.31.23.72 -> 172.31.31.144 TCP 66 48358 → 6633 [ACK] Seq=1 Ack=969 Win=213 Len=0 TSval=21991307 TSecr=3421181
 15 0.000733700 172.31.31.144 -> 172.31.23.72 TCP 187 6633 → 48346 [PSH, ACK] Seq=606 Ack=1 Win=853 Len=121 TSval=3421182 TSecr=21990980
 16 0.000856607 172.31.31.144 -> 172.31.23.72 TCP 187 6633 → 48342 [PSH, ACK] Seq=1 Ack=1 Win=853 Len=121 TSval=3421182 TSecr=21990963
 17 0.000869449 172.31.31.144 -> 172.31.23.72 TCP 187 6633 → 48342 [PSH, ACK] Seq=122 Ack=1 Win=853 Len=121 TSval=3421182 TSecr=21990963
 18 0.000918194 172.31.31.144 -> 172.31.23.72 TCP 187 6633 → 48342 [PSH, ACK] Seq=243 Ack=1 Win=853 Len=121 TSval=3421182 TSecr=21990963
 19 0.000993449 172.31.31.144 -> 172.31.23.72 TCP 187 6633 → 48342 [PSH, ACK] Seq=364 Ack=1 Win=853 Len=121 TSval=3421182 TSecr=21990963
 20 0.001049377 172.31.31.144 -> 172.31.23.72 TCP 187 6633 → 48342 [PSH, ACK] Seq=485 Ack=1 Win=853 Len=121 TSval=3421182 TSecr=21990963
 21 0.001078900 172.31.23.72 -> 172.31.31.144 TCP 66 48346 → 6633 [ACK] Seq=1 Ack=727 Win=213 Len=0 TSval=21991308 TSecr=3421182
 22 0.001119560 172.31.31.144 -> 172.31.23.72 TCP 187 6633 → 48342 [PSH, ACK] Seq=606 Ack=1 Win=853 Len=121 TSval=3421182 TSecr=21990963
 23 0.001190142 172.31.31.144 -> 172.31.23.72 TCP 187 6633 → 48342 [PSH, ACK] Seq=727 Ack=1 Win=853 Len=121 TSval=3421182 TSecr=21990963
 24 0.001232782 172.31.31.144 -> 172.31.23.72 TCP 187 6633 → 48342 [PSH, ACK] Seq=848 Ack=1 Win=853 Len=121 TSval=3421182 TSecr=21990963
 25 0.001337248 172.31.31.144 -> 172.31.23.72 TCP 187 6633 → 48326 [PSH, ACK] Seq=1 Ack=1 Win=853 Len=121 TSval=3421182 TSecr=21990865
 26 0.001366459 172.31.31.144 -> 172.31.23.72 TCP 187 6633 → 48326 [PSH, ACK] Seq=122 Ack=1 Win=853 Len=121 TSval=3421182 TSecr=21990865
 27 0.001443491 172.31.31.144 -> 172.31.23.72 TCP 187 6633 → 48326 [PSH, ACK] Seq=243 Ack=1 Win=853 Len=121 TSval=3421182 TSecr=21990865
 28 0.001503515 172.31.31.144 -> 172.31.23.72 TCP 187 6633 → 48326 [PSH, ACK] Seq=364 Ack=1 Win=853 Len=121 TSval=3421182 TSecr=21990865
 29 0.001511817 172.31.23.72 -> 172.31.31.144 TCP 66 48342 → 6633 [ACK] Seq=1 Ack=969 Win=213 Len=0 TSval=21991308 TSecr=3421182
 30 0.001578294 172.31.31.144 -> 172.31.23.72 TCP 187 6633 → 48326 [PSH, ACK] Seq=485 Ack=1 Win=853 Len=121 TSval=3421182 TSecr=21990865
 31 0.001629870 172.31.31.144 -> 172.31.23.72 TCP 187 6633 → 48326 [PSH, ACK] Seq=606 Ack=1 Win=853 Len=121 TSval=3421182 TSecr=21990865
 32 0.001690793 172.31.31.144 -> 172.31.23.72 TCP 187 6633 → 48326 [PSH, ACK] Seq=727 Ack=1 Win=853 Len=121 TSval=3421182 TSecr=21990865
 33 0.001748366 172.31.31.144 -> 172.31.23.72 TCP 187 6633 → 48326 [PSH, ACK] Seq=848 Ack=1 Win=853 Len=121 TSval=3421182 TSecr=21990865
 34 0.001838886 172.31.31.144 -> 172.31.23.72 TCP 187 6633 → 48340 [PSH, ACK] Seq=1 Ack=1 Win=853 Len=121 TSval=3421182 TSecr=21990953
 35 0.001864280 172.31.23.72 -> 172.31.31.144 TCP 66 48326 → 6633 [ACK] Seq=1 Ack=969 Win=213 Len=0 TSval=21991308 TSecr=3421182
 36 0.001906114 172.31.31.144 -> 172.31.23.72 TCP 187 6633 → 48340 [PSH, ACK] Seq=122 Ack=1 Win=853 Len=121 TSval=3421182 TSecr=21990953
 37 0.001931452 172.31.31.144 -> 172.31.23.72 TCP 187 6633 → 48340 [PSH, ACK] Seq=243 Ack=1 Win=853 Len=121 TSval=3421182 TSecr=21990953
 38 0.001966017 172.31.23.72 -> 172.31.31.144 OpenFlow 189 Type: OFPT_PACKET_IN
 39 0.001989457 172.31.23.72 -> 172.31.31.144 OpenFlow 189 Type: OFPT_PACKET_IN
 40 0.002017138 172.31.31.144 -> 172.31.23.72 OpenFlow 187 Type: OFPT_PACKET_OUT
 41 0.002064707 172.31.31.144 -> 172.31.23.72 OpenFlow 187 Type: OFPT_PACKET_OUT
 42 0.002126581 172.31.31.144 -> 172.31.23.72 TCP 66 6633 → 48340 [ACK] Seq=606 Ack=124 Win=853 Len=0 TSval=3421182 TSecr=21991308
 43 0.002140699 172.31.31.144 -> 172.31.23.72 OpenFlow 187 Type: OFPT_PACKET_OUT
 44 0.002245277 172.31.23.72 -> 172.31.31.144 TCP 66 48340 → 6633 [ACK] Seq=247 Ack=727 Win=213 Len=0 TSval=21991308 TSecr=3421182
 45 0.002311815 172.31.23.72 -> 172.31.31.144 OpenFlow 189 Type: OFPT_PACKET_IN
 46 0.002334381 172.31.23.72 -> 172.31.31.144 OpenFlow 189 Type: OFPT_PACKET_IN
 47 0.002344101 172.31.23.72 -> 172.31.31.144 OpenFlow 189 Type: OFPT_PACKET_IN
 48 0.002360307 172.31.23.72 -> 172.31.31.144 OpenFlow 189 Type: OFPT_PACKET_IN
 49 0.002378343 172.31.23.72 -> 172.31.31.144 OpenFlow 189 Type: OFPT_PACKET_IN
 50 0.002380756 172.31.23.72 -> 172.31.31.144 OpenFlow 189 Type: OFPT_PACKET_IN
 51 0.002398324 172.31.23.72 -> 172.31.31.144 OpenFlow 189 Type: OFPT_PACKET_IN
 52 0.002403394 172.31.23.72 -> 172.31.31.144 OpenFlow 189 Type: OFPT_PACKET_IN
 53 0.002417965 172.31.23.72 -> 172.31.31.144 OpenFlow 189 Type: OFPT_PACKET_IN
 54 0.002432709 172.31.23.72 -> 172.31.31.144 OpenFlow 435 Type: OFPT_PACKET_IN
 55 0.002449116 172.31.23.72 -> 172.31.31.144 OpenFlow 189 Type: OFPT_PACKET_IN
 56 0.002461084 172.31.31.144 -> 172.31.23.72 TCP 66 6633 → 48330 [ACK] Seq=1 Ack=124 Win=853 Len=0 TSval=3421182 TSecr=21991308
 57 0.002484168 172.31.23.72 -> 172.31.31.144 OpenFlow 189 Type: OFPT_PACKET_IN
 58 0.002489737 172.31.23.72 -> 172.31.31.144 OpenFlow 189 Type: OFPT_PACKET_IN
 59 0.002524674 172.31.23.72 -> 172.31.31.144 OpenFlow 189 Type: OFPT_PACKET_IN
 60 0.002526860 172.31.23.72 -> 172.31.31.144 OpenFlow 435 Type: OFPT_PACKET_IN
 61 0.002540551 172.31.23.72 -> 172.31.31.144 OpenFlow 189 Type: OFPT_PACKET_IN
 62 0.002565013 172.31.23.72 -> 172.31.31.144 OpenFlow 189 Type: OFPT_PACKET_IN
 63 0.002566927 172.31.23.72 -> 172.31.31.144 OpenFlow 189 Type: OFPT_PACKET_IN
 64 0.002586279 172.31.31.144 -> 172.31.23.72 TCP 66 6633 → 48330 [ACK] Seq=1 Ack=247 Win=853 Len=0 TSval=3421182 TSecr=21991308
 65 0.002589855 172.31.31.144 -> 172.31.23.72 OpenFlow 187 Type: OFPT_PACKET_OUT
 66 0.002591987 172.31.31.144 -> 172.31.23.72 TCP 66 6633 → 48324 [ACK] Seq=1 Ack=124 Win=853 Len=0 TSval=3421182 TSecr=21991308
 67 0.002594180 172.31.31.144 -> 172.31.23.72 TCP 66 6633 → 48350 [ACK] Seq=1 Ack=124 Win=853 Len=0 TSval=3421182 TSecr=21991308
 68 0.002596110 172.31.31.144 -> 172.31.23.72 OpenFlow 187 Type: OFPT_PACKET_OUT
 69 0.002598107 172.31.31.144 -> 172.31.23.72 TCP 66 6633 → 48344 [ACK] Seq=1 Ack=124 Win=853 Len=0 TSval=3421182 TSecr=21991308
 70 0.002609868 172.31.23.72 -> 172.31.31.144 OpenFlow 189 Type: OFPT_PACKET_IN
 71 0.002616255 172.31.23.72 -> 172.31.31.144 OpenFlow 189 Type: OFPT_PACKET_IN
 72 0.002710945 172.31.23.72 -> 172.31.31.144 OpenFlow 189 Type: OFPT_PACKET_IN
 73 0.002713732 172.31.23.72 -> 172.31.31.144 OpenFlow 189 Type: OFPT_PACKET_IN
 74 0.002715376 172.31.23.72 -> 172.31.31.144 OpenFlow 189 Type: OFPT_PACKET_IN
 75 0.002739339 172.31.23.72 -> 172.31.31.144 OpenFlow 189 Type: OFPT_PACKET_IN
 76 0.002762228 172.31.31.144 -> 172.31.23.72 TCP 66 6633 → 48324 [ACK] Seq=1 Ack=247 Win=853 Len=0 TSval=3421182 TSecr=21991308
 77 0.002766729 172.31.31.144 -> 172.31.23.72 OpenFlow 187 Type: OFPT_PACKET_OUT
 78 0.002769011 172.31.31.144 -> 172.31.23.72 OpenFlow 429 Type: OFPT_PACKET_OUT
 79 0.002771021 172.31.31.144 -> 172.31.23.72 TCP 66 6633 → 48356 [ACK] Seq=1 Ack=124 Win=853 Len=0 TSval=3421182 TSecr=21991308
 80 0.002773412 172.31.31.144 -> 172.31.23.72 TCP 66 6633 → 48350 [ACK] Seq=1 Ack=247 Win=853 Len=0 TSval=3421182 TSecr=21991308
 81 0.002775202 172.31.31.144 -> 172.31.23.72 TCP 66 6633 → 48336 [ACK] Seq=1 Ack=124 Win=853 Len=0 TSval=3421182 TSecr=21991308
 82 0.002777229 172.31.31.144 -> 172.31.23.72 TCP 66 6633 → 48344 [ACK] Seq=1 Ack=493 Win=853 Len=0 TSval=3421182 TSecr=21991308
 83 0.002779151 172.31.31.144 -> 172.31.23.72 TCP 66 6633 → 48334 [ACK] Seq=1 Ack=124 Win=853 Len=0 TSval=3421182 TSecr=21991308
 84 0.002781336 172.31.31.144 -> 172.31.23.72 TCP 66 6633 → 48356 [ACK] Seq=1 Ack=247 Win=853 Len=0 TSval=3421182 TSecr=21991308
 85 0.002833007 172.31.23.72 -> 172.31.31.144 OpenFlow 189 Type: OFPT_PACKET_IN
 86 0.002873180 172.31.23.72 -> 172.31.31.144 OpenFlow 189 Type: OFPT_PACKET_IN
 87 0.002881109 172.31.23.72 -> 172.31.31.144 TCP 66 48330 → 6633 [ACK] Seq=247 Ack=243 Win=213 Len=0 TSval=21991308 TSecr=3421182
 88 0.002906768 172.31.31.144 -> 172.31.23.72 TCP 66 6633 → 48360 [ACK] Seq=1 Ack=124 Win=853 Len=0 TSval=3421182 TSecr=21991308
 89 0.002911772 172.31.31.144 -> 172.31.23.72 TCP 66 6633 → 48336 [ACK] Seq=1 Ack=493 Win=853 Len=0 TSval=3421182 TSecr=21991308
 90 0.002913877 172.31.31.144 -> 172.31.23.72 TCP 66 6633 → 48354 [ACK] Seq=1 Ack=124 Win=853 Len=0 TSval=3421182 TSecr=21991308
 91 0.002915993 172.31.31.144 -> 172.31.23.72 TCP 66 6633 → 48348 [ACK] Seq=1 Ack=124 Win=853 Len=0 TSval=3421182 TSecr=21991308
 92 0.002918587 172.31.31.144 -> 172.31.23.72 TCP 66 6633 → 48334 [ACK] Seq=1 Ack=247 Win=853 Len=0 TSval=3421182 TSecr=21991308
 93 0.002971069 172.31.31.144 -> 172.31.23.72 TCP 66 6633 → 48360 [ACK] Seq=1 Ack=247 Win=853 Len=0 TSval=3421182 TSecr=21991308
 94 0.002975574 172.31.31.144 -> 172.31.23.72 TCP 66 6633 → 48338 [ACK] Seq=1 Ack=247 Win=853 Len=0 TSval=3421182 TSecr=21991308
 95 0.002978009 172.31.31.144 -> 172.31.23.72 TCP 66 6633 → 48354 [ACK] Seq=1 Ack=247 Win=853 Len=0 TSval=3421182 TSecr=21991308
 96 0.002979811 172.31.31.144 -> 172.31.23.72 TCP 66 6633 → 48348 [ACK] Seq=1 Ack=247 Win=853 Len=0 TSval=3421182 TSecr=21991308
 97 0.003004075 172.31.31.144 -> 172.31.23.72 TCP 66 6633 → 48342 [ACK] Seq=969 Ack=124 Win=853 Len=0 TSval=3421182 TSecr=21991308
 98 0.003043920 172.31.31.144 -> 172.31.23.72 TCP 66 6633 → 48342 [ACK] Seq=969 Ack=247 Win=853 Len=0 TSval=3421182 TSecr=21991308
 99 0.003063370 172.31.31.144 -> 172.31.23.72 OpenFlow 187 Type: OFPT_PACKET_OUT
100 0.003106166 172.31.23.72 -> 172.31.31.144 OpenFlow 189 Type: OFPT_PACKET_IN
101 0.003146537 172.31.23.72 -> 172.31.31.144 OpenFlow 189 Type: OFPT_PACKET_IN
102 0.003165946 172.31.31.144 -> 172.31.23.72 OpenFlow 792 Type: OFPT_PACKET_OUT
103 0.003281131 172.31.31.144 -> 172.31.23.72 TCP 66 6633 → 48332 [ACK] Seq=1 Ack=124 Win=853 Len=0 TSval=3421182 TSecr=21991308
104 0.003288628 172.31.31.144 -> 172.31.23.72 TCP 66 6633 → 48332 [ACK] Seq=1 Ack=247 Win=853 Len=0 TSval=3421182 TSecr=21991308
105 0.003330151 172.31.31.144 -> 172.31.23.72 OpenFlow 187 Type: OFPT_PACKET_OUT
106 0.003442450 172.31.23.72 -> 172.31.31.144 TCP 66 48340 → 6633 [ACK] Seq=247 Ack=1211 Win=213 Len=0 TSval=21991308 TSecr=3421182
107 0.003636541 172.31.31.144 -> 172.31.23.72 TCP 66 6633 → 48328 [ACK] Seq=1 Ack=247 Win=853 Len=0 TSval=3421182 TSecr=21991308
108 0.003756072 172.31.23.72 -> 172.31.31.144 TCP 66 48330 → 6633 [ACK] Seq=247 Ack=1211 Win=213 Len=0 TSval=21991308 TSecr=3421182
109 0.003830691 172.31.23.72 -> 172.31.31.144 OpenFlow 189 Type: OFPT_PACKET_IN
110 0.003851848 172.31.23.72 -> 172.31.31.144 OpenFlow 189 Type: OFPT_PACKET_IN
111 0.003856494 172.31.23.72 -> 172.31.31.144 OpenFlow 189 Type: OFPT_PACKET_IN
112 0.003873029 172.31.23.72 -> 172.31.31.144 OpenFlow 189 Type: OFPT_PACKET_IN
113 0.003877717 172.31.23.72 -> 172.31.31.144 OpenFlow 189 Type: OFPT_PACKET_IN
114 0.003908503 172.31.23.72 -> 172.31.31.144 OpenFlow 189 Type: OFPT_PACKET_IN
115 0.003917352 172.31.31.144 -> 172.31.23.72 OpenFlow 187 Type: OFPT_PACKET_OUT
116 0.003937082 172.31.23.72 -> 172.31.31.144 OpenFlow 189 Type: OFPT_PACKET_IN
117 0.003945109 172.31.23.72 -> 172.31.31.144 OpenFlow 189 Type: OFPT_PACKET_IN
118 0.003984530 172.31.31.144 -> 172.31.23.72 TCP 66 6633 → 48356 [ACK] Seq=1 Ack=370 Win=853 Len=0 TSval=3421183 TSecr=21991308
119 0.003990869 172.31.23.72 -> 172.31.31.144 OpenFlow 189 Type: OFPT_PACKET_IN
120 0.003996540 172.31.23.72 -> 172.31.31.144 OpenFlow 189 Type: OFPT_PACKET_IN
121 0.004032862 172.31.31.144 -> 172.31.23.72 TCP 66 6633 → 48336 [ACK] Seq=1 Ack=616 Win=853 Len=0 TSval=3421183 TSecr=21991308
122 0.004038728 172.31.31.144 -> 172.31.23.72 OpenFlow 187 Type: OFPT_PACKET_OUT
123 0.004041066 172.31.31.144 -> 172.31.23.72 TCP 66 6633 → 48356 [ACK] Seq=1 Ack=493 Win=853 Len=0 TSval=3421183 TSecr=21991308
124 0.004078370 172.31.31.144 -> 172.31.23.72 TCP 66 6633 → 48336 [ACK] Seq=1 Ack=739 Win=853 Len=0 TSval=3421183 TSecr=21991308
125 0.004088825 172.31.23.72 -> 172.31.31.144 OpenFlow 189 Type: OFPT_PACKET_IN
126 0.004109391 172.31.23.72 -> 172.31.31.144 OpenFlow 189 Type: OFPT_PACKET_IN
127 0.004143936 172.31.31.144 -> 172.31.23.72 TCP 66 6633 → 48348 [ACK] Seq=1 Ack=370 Win=853 Len=0 TSval=3421183 TSecr=21991308
128 0.004148943 172.31.31.144 -> 172.31.23.72 OpenFlow 187 Type: OFPT_PACKET_OUT
129 0.004159048 172.31.31.144 -> 172.31.23.72 TCP 66 6633 → 48322 [ACK] Seq=1 Ack=247 Win=853 Len=0 TSval=3421183 TSecr=21991308
130 0.004161842 172.31.31.144 -> 172.31.23.72 TCP 66 6633 → 48348 [ACK] Seq=1 Ack=493 Win=853 Len=0 TSval=3421183 TSecr=21991308
131 0.004191907 172.31.31.144 -> 172.31.23.72 OpenFlow 187 Type: OFPT_PACKET_OUT
132 0.004267985 172.31.31.144 -> 172.31.23.72 TCP 66 6633 → 48340 [ACK] Seq=1211 Ack=493 Win=853 Len=0 TSval=3421183 TSecr=21991308
133 0.004285093 172.31.31.144 -> 172.31.23.72 OpenFlow 187 Type: OFPT_PACKET_OUT
134 0.004303787 172.31.31.144 -> 172.31.23.72 TCP 66 6633 → 48320 [ACK] Seq=1 Ack=247 Win=853 Len=0 TSval=3421183 TSecr=21991308
135 0.004360524 172.31.31.144 -> 172.31.23.72 OpenFlow 187 Type: OFPT_PACKET_OUT
136 0.004392541 172.31.23.72 -> 172.31.31.144 TCP 66 48324 → 6633 [ACK] Seq=247 Ack=727 Win=213 Len=0 TSval=21991308 TSecr=3421182
137 0.004418281 172.31.31.144 -> 172.31.23.72 OpenFlow 187 Type: OFPT_PACKET_OUT
138 0.004514883 172.31.31.144 -> 172.31.23.72 OpenFlow 187 Type: OFPT_PACKET_OUT
139 0.004522945 172.31.23.72 -> 172.31.31.144 OpenFlow 189 Type: OFPT_PACKET_IN
140 0.004542568 172.31.23.72 -> 172.31.31.144 OpenFlow 189 Type: OFPT_PACKET_IN
141 0.004594569 172.31.23.72 -> 172.31.31.144 OpenFlow 189 Type: OFPT_PACKET_IN
142 0.004701898 172.31.23.72 -> 172.31.31.144 OpenFlow 189 Type: OFPT_PACKET_IN
143 0.004728322 172.31.23.72 -> 172.31.31.144 TCP 66 48324 → 6633 [ACK] Seq=247 Ack=969 Win=213 Len=0 TSval=21991308 TSecr=3421183
144 0.004772956 172.31.31.144 -> 172.31.23.72 TCP 66 6633 → 48322 [ACK] Seq=1 Ack=493 Win=853 Len=0 TSval=3421183 TSecr=21991308
145 0.004778777 172.31.31.144 -> 172.31.23.72 OpenFlow 187 Type: OFPT_PACKET_OUT
146 0.004804822 172.31.23.72 -> 172.31.31.144 OpenFlow 189 Type: OFPT_PACKET_IN
147 0.004825724 172.31.31.144 -> 172.31.23.72 OpenFlow 187 Type: OFPT_PACKET_OUT
148 0.004874372 172.31.23.72 -> 172.31.31.144 TCP 66 48324 → 6633 [ACK] Seq=247 Ack=1211 Win=213 Len=0 TSval=21991308 TSecr=3421183
149 0.004904058 172.31.31.144 -> 172.31.23.72 TCP 66 6633 → 48326 [ACK] Seq=969 Ack=124 Win=853 Len=0 TSval=3421183 TSecr=21991308
150 0.004923601 172.31.31.144 -> 172.31.23.72 TCP 66 6633 → 48326 [ACK] Seq=969 Ack=247 Win=853 Len=0 TSval=3421183 TSecr=21991308
151 0.005037640 172.31.23.72 -> 172.31.31.144 OpenFlow 189 Type: OFPT_PACKET_IN
152 0.005056082 172.31.23.72 -> 172.31.31.144 OpenFlow 189 Type: OFPT_PACKET_IN
153 0.005064667 172.31.23.72 -> 172.31.31.144 OpenFlow 189 Type: OFPT_PACKET_IN
154 0.005206160 172.31.31.144 -> 172.31.23.72 TCP 66 6633 → 48332 [ACK] Seq=1 Ack=370 Win=853 Len=0 TSval=3421183 TSecr=21991309
155 0.005266092 172.31.31.144 -> 172.31.23.72 TCP 66 6633 → 48332 [ACK] Seq=1 Ack=493 Win=853 Len=0 TSval=3421183 TSecr=21991309
156 0.005282311 172.31.31.144 -> 172.31.23.72 TCP 66 6633 → 48328 [ACK] Seq=1 Ack=493 Win=853 Len=0 TSval=3421183 TSecr=21991308
157 0.087652775 172.31.23.72 -> 172.31.31.144 OpenFlow 146 Type: OFPT_PORT_STATUS
158 0.087807002 172.31.23.72 -> 172.31.31.144 OpenFlow 146 Type: OFPT_PORT_STATUS
159 0.088014848 172.31.31.144 -> 172.31.23.72 TCP 66 6633 → 48354 [ACK] Seq=1 Ack=327 Win=853 Len=0 TSval=3421204 TSecr=21991329
160 0.112717871 172.31.31.144 -> 172.31.23.72 TCP 146 6633 → 48364 [PSH, ACK] Seq=1 Ack=1 Win=853 Len=80 TSval=3421210 TSecr=21991104
161 0.112764736 172.31.31.144 -> 172.31.23.72 TCP 146 6633 → 48352 [PSH, ACK] Seq=1 Ack=1 Win=853 Len=80 TSval=3421210 TSecr=21991019
162 0.112771442 172.31.31.144 -> 172.31.23.72 TCP 154 6633 → 48364 [PSH, ACK] Seq=81 Ack=1 Win=853 Len=88 TSval=3421210 TSecr=21991104
163 0.112779583 172.31.31.144 -> 172.31.23.72 TCP 146 6633 → 48352 [PSH, ACK] Seq=81 Ack=1 Win=853 Len=80 TSval=3421210 TSecr=21991019
164 0.112801818 172.31.31.144 -> 172.31.23.72 OpenFlow 146 Type: OFPT_FLOW_MOD
165 0.112851109 172.31.31.144 -> 172.31.23.72 TCP 74 6633 → 48352 [PSH, ACK] Seq=161 Ack=1 Win=853 Len=8 TSval=3421210 TSecr=21991019
166 0.112863247 172.31.31.144 -> 172.31.23.72 OpenFlow 154 Type: OFPT_BARRIER_REQUEST
167 0.112884266 172.31.31.144 -> 172.31.23.72 OpenFlow 146 Type: OFPT_FLOW_MOD
168 0.112903466 172.31.31.144 -> 172.31.23.72 OpenFlow 154 Type: OFPT_BARRIER_REQUEST
169 0.112932363 172.31.31.144 -> 172.31.23.72 TCP 146 6633 → 48366 [PSH, ACK] Seq=1 Ack=1 Win=853 Len=80 TSval=3421210 TSecr=21991122
170 0.112952558 172.31.31.144 -> 172.31.23.72 OpenFlow 146 Type: OFPT_FLOW_MOD
171 0.112970736 172.31.31.144 -> 172.31.23.72 OpenFlow 234 Type: OFPT_BARRIER_REQUEST
172 0.112996127 172.31.31.144 -> 172.31.23.72 TCP 154 6633 → 48366 [PSH, ACK] Seq=81 Ack=1 Win=853 Len=88 TSval=3421210 TSecr=21991122
173 0.113027671 172.31.31.144 -> 172.31.23.72 OpenFlow 146 Type: OFPT_FLOW_MOD
174 0.113047056 172.31.31.144 -> 172.31.23.72 OpenFlow 146 Type: OFPT_FLOW_MOD
175 0.113066716 172.31.31.144 -> 172.31.23.72 OpenFlow 154 Type: OFPT_BARRIER_REQUEST
176 0.113086988 172.31.31.144 -> 172.31.23.72 TCP 146 6633 → 48366 [PSH, ACK] Seq=169 Ack=1 Win=853 Len=80 TSval=3421210 TSecr=21991122
177 0.113107482 172.31.31.144 -> 172.31.23.72 OpenFlow 146 Type: OFPT_FLOW_MOD
178 0.113113929 172.31.23.72 -> 172.31.31.144 OpenFlow 74 Type: OFPT_BARRIER_REPLY
179 0.113125955 172.31.31.144 -> 172.31.23.72 OpenFlow 74 Type: OFPT_BARRIER_REQUEST
180 0.113144901 172.31.23.72 -> 172.31.31.144 TCP 66 48346 → 6633 [ACK] Seq=89 Ack=1063 Win=213 Len=0 TSval=21991336 TSecr=3421210
181 0.113152591 172.31.23.72 -> 172.31.31.144 OpenFlow 74 Type: OFPT_BARRIER_REPLY
182 0.113170562 172.31.31.144 -> 172.31.23.72 TCP 234 6633 → 48366 [PSH, ACK] Seq=249 Ack=1 Win=853 Len=168 TSval=3421210 TSecr=21991122
183 0.113173567 172.31.31.144 -> 172.31.23.72 OpenFlow 146 Type: OFPT_FLOW_MOD
184 0.113200146 172.31.23.72 -> 172.31.31.144 TCP 66 48326 → 6633 [ACK] Seq=247 Ack=1217 Win=213 Len=0 TSval=21991336 TSecr=3421210
185 0.113208300 172.31.23.72 -> 172.31.31.144 OpenFlow 74 Type: OFPT_BARRIER_REPLY
186 0.113222583 172.31.31.144 -> 172.31.23.72 TCP 146 6633 → 48366 [PSH, ACK] Seq=417 Ack=1 Win=853 Len=80 TSval=3421210 TSecr=21991122
187 0.113233493 172.31.31.144 -> 172.31.23.72 OpenFlow 146 Type: OFPT_FLOW_MOD
188 0.113235172 172.31.31.144 -> 172.31.23.72 TCP 74 6633 → 48366 [PSH, ACK] Seq=497 Ack=1 Win=853 Len=8 TSval=3421210 TSecr=21991122
189 0.113298611 172.31.31.144 -> 172.31.23.72 OpenFlow 154 Type: OFPT_BARRIER_REQUEST
190 0.113301627 172.31.31.144 -> 172.31.23.72 OpenFlow 74 Type: OFPT_BARRIER_REQUEST
191 0.113303360 172.31.31.144 -> 172.31.23.72 OpenFlow 146 Type: OFPT_FLOW_MOD
192 0.113306513 172.31.31.144 -> 172.31.23.72 OpenFlow 146 Type: OFPT_FLOW_MOD
193 0.113317432 172.31.23.72 -> 172.31.31.144 TCP 66 48352 → 6633 [ACK] Seq=1 Ack=169 Win=213 Len=0 TSval=21991336 TSecr=3421210
194 0.113326817 172.31.31.144 -> 172.31.23.72 OpenFlow 154 Type: OFPT_BARRIER_REQUEST
195 0.113332657 172.31.23.72 -> 172.31.31.144 OpenFlow 74 Type: OFPT_BARRIER_REPLY
196 0.113375273 172.31.31.144 -> 172.31.23.72 OpenFlow 146 Type: OFPT_FLOW_MOD
197 0.113397689 172.31.31.144 -> 172.31.23.72 OpenFlow 154 Type: OFPT_BARRIER_REQUEST
198 0.113407007 172.31.31.144 -> 172.31.23.72 OpenFlow 146 Type: OFPT_FLOW_MOD
199 0.113416692 172.31.23.72 -> 172.31.31.144 OpenFlow 74 Type: OFPT_BARRIER_REPLY
200 0.113426468 172.31.31.144 -> 172.31.23.72 OpenFlow 146 Type: OFPT_FLOW_MOD
201 0.113443721 172.31.23.72 -> 172.31.31.144 OpenFlow 74 Type: OFPT_BARRIER_REPLY
202 0.113462599 172.31.31.144 -> 172.31.23.72 OpenFlow 74 Type: OFPT_BARRIER_REQUEST
203 0.113465013 172.31.31.144 -> 172.31.23.72 OpenFlow 154 Type: OFPT_BARRIER_REQUEST
204 0.113468972 172.31.23.72 -> 172.31.31.144 OpenFlow 74 Type: OFPT_BARRIER_REPLY
205 0.113488030 172.31.31.144 -> 172.31.23.72 OpenFlow 146 Type: OFPT_FLOW_MOD
206 0.113516432 172.31.31.144 -> 172.31.23.72 TCP 66 6633 → 48352 [ACK] Seq=169 Ack=9 Win=853 Len=0 TSval=3421210 TSecr=21991336
207 0.113520510 172.31.31.144 -> 172.31.23.72 OpenFlow 146 Type: OFPT_FLOW_MOD
208 0.113530723 172.31.31.144 -> 172.31.23.72 OpenFlow 146 Type: OFPT_FLOW_MOD
209 0.113560886 172.31.31.144 -> 172.31.23.72 OpenFlow 314 Type: OFPT_FLOW_MOD
210 0.113567360 172.31.23.72 -> 172.31.31.144 TCP 66 48364 → 6633 [ACK] Seq=1 Ack=169 Win=213 Len=0 TSval=21991336 TSecr=3421210
211 0.113579389 172.31.23.72 -> 172.31.31.144 OpenFlow 74 Type: OFPT_BARRIER_REPLY
212 0.113585870 172.31.31.144 -> 172.31.23.72 OpenFlow 146 Type: OFPT_FLOW_MOD
213 0.113608593 172.31.31.144 -> 172.31.23.72 OpenFlow 146 Type: OFPT_FLOW_MOD
214 0.113633664 172.31.31.144 -> 172.31.23.72 OpenFlow 234 Type: OFPT_FLOW_MOD
215 0.113636275 172.31.31.144 -> 172.31.23.72 OpenFlow 154 Type: OFPT_BARRIER_REQUEST
216 0.113646343 172.31.23.72 -> 172.31.31.144 OpenFlow 74 Type: OFPT_BARRIER_REPLY
217 0.113654029 172.31.31.144 -> 172.31.23.72 OpenFlow 490 Type: OFPT_BARRIER_REQUEST
218 0.113668779 172.31.31.144 -> 172.31.23.72 OpenFlow 234 Type: OFPT_BARRIER_REQUEST
219 0.113680417 172.31.23.72 -> 172.31.31.144 OpenFlow 74 Type: OFPT_BARRIER_REPLY
220 0.113694970 172.31.31.144 -> 172.31.23.72 OpenFlow 154 Type: OFPT_BARRIER_REQUEST
221 0.113708144 172.31.23.72 -> 172.31.31.144 OpenFlow 74 Type: OFPT_BARRIER_REPLY
222 0.113719714 172.31.31.144 -> 172.31.23.72 OpenFlow 242 Type: OFPT_BARRIER_REQUEST
223 0.113744586 172.31.31.144 -> 172.31.23.72 OpenFlow 146 Type: OFPT_FLOW_MOD
224 0.113747036 172.31.31.144 -> 172.31.23.72 OpenFlow 74 Type: OFPT_BARRIER_REQUEST
225 0.113760935 172.31.31.144 -> 172.31.23.72 OpenFlow 146 Type: OFPT_FLOW_MOD
226 0.113764056 172.31.23.72 -> 172.31.31.144 TCP 66 48332 → 6633 [ACK] Seq=493 Ack=169 Win=213 Len=0 TSval=21991336 TSecr=3421210
227 0.113772387 172.31.23.72 -> 172.31.31.144 OpenFlow 74 Type: OFPT_BARRIER_REPLY
228 0.113780170 172.31.31.144 -> 172.31.23.72 OpenFlow 154 Type: OFPT_BARRIER_REQUEST
229 0.113841824 172.31.31.144 -> 172.31.23.72 TCP 66 6633 → 48346 [ACK] Seq=1399 Ack=97 Win=853 Len=0 TSval=3421210 TSecr=21991336
230 0.113846016 172.31.31.144 -> 172.31.23.72 TCP 66 6633 → 48326 [ACK] Seq=1305 Ack=255 Win=853 Len=0 TSval=3421210 TSecr=21991336
231 0.113847774 172.31.31.144 -> 172.31.23.72 TCP 66 6633 → 48366 [ACK] Seq=673 Ack=9 Win=853 Len=0 TSval=3421210 TSecr=21991336
232 0.113863764 172.31.31.144 -> 172.31.23.72 TCP 66 6633 → 48366 [ACK] Seq=673 Ack=17 Win=853 Len=0 TSval=3421210 TSecr=21991336
233 0.113881868 172.31.31.144 -> 172.31.23.72 TCP 66 6633 → 48366 [ACK] Seq=673 Ack=25 Win=853 Len=0 TSval=3421210 TSecr=21991336
234 0.113900556 172.31.31.144 -> 172.31.23.72 OpenFlow 146 Type: OFPT_FLOW_MOD
235 0.113917716 172.31.31.144 -> 172.31.23.72 OpenFlow 154 Type: OFPT_BARRIER_REQUEST
236 0.113945772 172.31.31.144 -> 172.31.23.72 OpenFlow 146 Type: OFPT_FLOW_MOD
237 0.113977448 172.31.31.144 -> 172.31.23.72 OpenFlow 154 Type: OFPT_BARRIER_REQUEST
238 0.113996820 172.31.31.144 -> 172.31.23.72 OpenFlow 146 Type: OFPT_FLOW_MOD
239 0.114015767 172.31.31.144 -> 172.31.23.72 OpenFlow 146 Type: OFPT_FLOW_MOD
240 0.114021144 172.31.23.72 -> 172.31.31.144 OpenFlow 146 Type: OFPT_FLOW_REMOVED
241 0.114039045 172.31.31.144 -> 172.31.23.72 OpenFlow 146 Type: OFPT_FLOW_MOD
242 0.114044645 172.31.23.72 -> 172.31.31.144 OpenFlow 226 Type: OFPT_FLOW_REMOVED
243 0.114055635 172.31.23.72 -> 172.31.31.144 OpenFlow 146 Type: OFPT_FLOW_REMOVED
244 0.114063868 172.31.31.144 -> 172.31.23.72 TCP 66 6633 → 48364 [ACK] Seq=169 Ack=9 Win=853 Len=0 TSval=3421210 TSecr=21991336
245 0.114072529 172.31.23.72 -> 172.31.31.144 OpenFlow 146 Type: OFPT_FLOW_REMOVED
246 0.114077430 172.31.23.72 -> 172.31.31.144 OpenFlow 146 Type: OFPT_FLOW_REMOVED
247 0.114085669 172.31.23.72 -> 172.31.31.144 OpenFlow 146 Type: OFPT_FLOW_REMOVED
248 0.114087816 172.31.23.72 -> 172.31.31.144 OpenFlow 226 Type: OFPT_FLOW_REMOVED
249 0.114104334 172.31.23.72 -> 172.31.31.144 OpenFlow 146 Type: OFPT_FLOW_REMOVED
250 0.114115282 172.31.31.144 -> 172.31.23.72 OpenFlow 146 Type: OFPT_FLOW_MOD
251 0.114118028 172.31.31.144 -> 172.31.23.72 OpenFlow 154 Type: OFPT_BARRIER_REQUEST
252 0.114119577 172.31.31.144 -> 172.31.23.72 OpenFlow 74 Type: OFPT_BARRIER_REQUEST
253 0.114124347 172.31.23.72 -> 172.31.31.144 OpenFlow 146 Type: OFPT_FLOW_REMOVED
254 0.114129523 172.31.23.72 -> 172.31.31.144 OpenFlow 146 Type: OFPT_FLOW_REMOVED
255 0.114148639 172.31.23.72 -> 172.31.31.144 OpenFlow 146 Type: OFPT_FLOW_REMOVED
256 0.114227910 172.31.31.144 -> 172.31.23.72 OpenFlow 154 Type: OFPT_BARRIER_REQUEST
257 0.114231429 172.31.31.144 -> 172.31.23.72 OpenFlow 146 Type: OFPT_FLOW_MOD
258 0.114233233 172.31.31.144 -> 172.31.23.72 OpenFlow 154 Type: OFPT_BARRIER_REQUEST
259 0.114234664 172.31.31.144 -> 172.31.23.72 TCP 66 6633 → 48354 [ACK] Seq=841 Ack=351 Win=853 Len=0 TSval=3421210 TSecr=21991336
260 0.114238628 172.31.23.72 -> 172.31.31.144 OpenFlow 546 Type: OFPT_FLOW_REMOVED
261 0.114243980 172.31.31.144 -> 172.31.23.72 TCP 66 6633 → 48332 [ACK] Seq=169 Ack=501 Win=853 Len=0 TSval=3421210 TSecr=21991336
262 0.114246531 172.31.23.72 -> 172.31.31.144 OpenFlow 146 Type: OFPT_FLOW_REMOVED
263 0.114251757 172.31.23.72 -> 172.31.31.144 OpenFlow 466 Type: OFPT_FLOW_REMOVED
264 0.114253622 172.31.23.72 -> 172.31.31.144 OpenFlow 146 Type: OFPT_FLOW_REMOVED
265 0.114308146 172.31.31.144 -> 172.31.23.72 TCP 66 6633 → 48326 [ACK] Seq=1305 Ack=335 Win=853 Len=0 TSval=3421210 TSecr=21991336
266 0.114310689 172.31.31.144 -> 172.31.23.72 TCP 66 6633 → 48346 [ACK] Seq=1567 Ack=337 Win=853 Len=0 TSval=3421210 TSecr=21991336
267 0.114312654 172.31.31.144 -> 172.31.23.72 TCP 66 6633 → 48366 [ACK] Seq=673 Ack=105 Win=853 Len=0 TSval=3421210 TSecr=21991336
268 0.114314480 172.31.31.144 -> 172.31.23.72 TCP 66 6633 → 48352 [ACK] Seq=169 Ack=89 Win=853 Len=0 TSval=3421210 TSecr=21991336
269 0.114400897 172.31.31.144 -> 172.31.23.72 TCP 66 6633 → 48364 [ACK] Seq=169 Ack=89 Win=853 Len=0 TSval=3421210 TSecr=21991336
270 0.114403970 172.31.31.144 -> 172.31.23.72 TCP 66 6633 → 48326 [ACK] Seq=1305 Ack=495 Win=853 Len=0 TSval=3421210 TSecr=21991336
271 0.114406438 172.31.31.144 -> 172.31.23.72 TCP 66 6633 → 48352 [ACK] Seq=169 Ack=169 Win=853 Len=0 TSval=3421210 TSecr=21991336
272 0.114433312 172.31.31.144 -> 172.31.23.72 TCP 66 6633 → 48332 [ACK] Seq=169 Ack=581 Win=853 Len=0 TSval=3421210 TSecr=21991336
273 0.114451623 172.31.31.144 -> 172.31.23.72 TCP 66 6633 → 48332 [ACK] Seq=169 Ack=661 Win=853 Len=0 TSval=3421210 TSecr=21991336
274 0.114469819 172.31.31.144 -> 172.31.23.72 TCP 66 6633 → 48366 [ACK] Seq=673 Ack=505 Win=853 Len=0 TSval=3421210 TSecr=21991336
275 0.114488768 172.31.31.144 -> 172.31.23.72 TCP 66 6633 → 48364 [ACK] Seq=169 Ack=169 Win=853 Len=0 TSval=3421210 TSecr=21991336
276 0.114508334 172.31.31.144 -> 172.31.23.72 TCP 66 6633 → 48354 [ACK] Seq=841 Ack=911 Win=853 Len=0 TSval=3421210 TSecr=21991336
277 0.116464353 172.31.23.72 -> 172.31.31.144 OpenFlow 74 Type: OFPT_BARRIER_REPLY
278 0.116493295 172.31.23.72 -> 172.31.31.144 OpenFlow 74 Type: OFPT_BARRIER_REPLY
279 0.116520159 172.31.23.72 -> 172.31.31.144 OpenFlow 74 Type: OFPT_BARRIER_REPLY
280 0.116528151 172.31.23.72 -> 172.31.31.144 OpenFlow 74 Type: OFPT_BARRIER_REPLY
281 0.116551681 172.31.23.72 -> 172.31.31.144 OpenFlow 74 Type: OFPT_BARRIER_REPLY
282 0.116584495 172.31.23.72 -> 172.31.31.144 OpenFlow 74 Type: OFPT_BARRIER_REPLY
283 0.116607299 172.31.23.72 -> 172.31.31.144 TCP 66 48324 → 6633 [ACK] Seq=247 Ack=1379 Win=213 Len=0 TSval=21991336 TSecr=3421210
284 0.116614586 172.31.23.72 -> 172.31.31.144 OpenFlow 74 Type: OFPT_BARRIER_REPLY
285 0.116649866 172.31.23.72 -> 172.31.31.144 OpenFlow 74 Type: OFPT_BARRIER_REPLY
286 0.116689242 172.31.23.72 -> 172.31.31.144 OpenFlow 74 Type: OFPT_BARRIER_REPLY
287 0.116715566 172.31.31.144 -> 172.31.23.72 TCP 66 6633 → 48346 [ACK] Seq=1567 Ack=441 Win=853 Len=0 TSval=3421211 TSecr=21991336
288 0.116731728 172.31.23.72 -> 172.31.31.144 OpenFlow 74 Type: OFPT_BARRIER_REPLY
289 0.116739921 172.31.31.144 -> 172.31.23.72 TCP 66 6633 → 48326 [ACK] Seq=1305 Ack=503 Win=853 Len=0 TSval=3421211 TSecr=21991336
290 0.116761131 172.31.23.72 -> 172.31.31.144 OpenFlow 74 Type: OFPT_BARRIER_REPLY
291 0.116781200 172.31.23.72 -> 172.31.31.144 OpenFlow 74 Type: OFPT_BARRIER_REPLY
292 0.116806220 172.31.31.144 -> 172.31.23.72 TCP 66 6633 → 48330 [ACK] Seq=1547 Ack=263 Win=853 Len=0 TSval=3421211 TSecr=21991336
293 0.116812096 172.31.23.72 -> 172.31.31.144 TCP 66 48322 → 6633 [ACK] Seq=493 Ack=169 Win=213 Len=0 TSval=21991336 TSecr=3421210
294 0.116819757 172.31.23.72 -> 172.31.31.144 OpenFlow 74 Type: OFPT_BARRIER_REPLY
295 0.116829054 172.31.31.144 -> 172.31.23.72 TCP 66 6633 → 48336 [ACK] Seq=337 Ack=747 Win=853 Len=0 TSval=3421211 TSecr=21991336
296 0.116856470 172.31.23.72 -> 172.31.31.144 OpenFlow 74 Type: OFPT_BARRIER_REPLY
297 0.116876765 172.31.31.144 -> 172.31.23.72 TCP 66 6633 → 48336 [ACK] Seq=337 Ack=755 Win=853 Len=0 TSval=3421211 TSecr=21991336
298 0.116881665 172.31.23.72 -> 172.31.31.144 OpenFlow 74 Type: OFPT_BARRIER_REPLY
299 0.116911622 172.31.23.72 -> 172.31.31.144 OpenFlow 74 Type: OFPT_BARRIER_REPLY
300 0.116933261 172.31.31.144 -> 172.31.23.72 TCP 66 6633 → 48334 [ACK] Seq=505 Ack=255 Win=853 Len=0 TSval=3421211 TSecr=21991336
301 0.116937538 172.31.23.72 -> 172.31.31.144 OpenFlow 74 Type: OFPT_BARRIER_REPLY
302 0.116959793 172.31.31.144 -> 172.31.23.72 TCP 66 6633 → 48334 [ACK] Seq=505 Ack=263 Win=853 Len=0 TSval=3421211 TSecr=21991336
303 0.116963001 172.31.31.144 -> 172.31.23.72 TCP 66 6633 → 48334 [ACK] Seq=505 Ack=271 Win=853 Len=0 TSval=3421211 TSecr=21991336
304 0.116966676 172.31.23.72 -> 172.31.31.144 OpenFlow 74 Type: OFPT_BARRIER_REPLY
305 0.116998925 172.31.23.72 -> 172.31.31.144 OpenFlow 74 Type: OFPT_BARRIER_REPLY
306 0.117035934 172.31.23.72 -> 172.31.31.144 TCP 66 48320 → 6633 [ACK] Seq=247 Ack=169 Win=213 Len=0 TSval=21991337 TSecr=3421210
307 0.117042992 172.31.23.72 -> 172.31.31.144 OpenFlow 74 Type: OFPT_BARRIER_REPLY
308 0.117061067 172.31.23.72 -> 172.31.31.144 OpenFlow 74 Type: OFPT_BARRIER_REPLY
309 0.117102781 172.31.31.144 -> 172.31.23.72 TCP 66 6633 → 48338 [ACK] Seq=841 Ack=263 Win=853 Len=0 TSval=3421211 TSecr=21991336
310 0.117107183 172.31.31.144 -> 172.31.23.72 TCP 66 6633 → 48338 [ACK] Seq=841 Ack=279 Win=853 Len=0 TSval=3421211 TSecr=21991336
311 0.117111705 172.31.23.72 -> 172.31.31.144 OpenFlow 74 Type: OFPT_BARRIER_REPLY
312 0.117147003 172.31.31.144 -> 172.31.23.72 TCP 66 6633 → 48366 [ACK] Seq=673 Ack=513 Win=853 Len=0 TSval=3421211 TSecr=21991337
313 0.117241748 172.31.23.72 -> 172.31.31.144 OpenFlow 146 Type: OFPT_FLOW_REMOVED
314 0.117252055 172.31.31.144 -> 172.31.23.72 TCP 66 6633 → 48354 [ACK] Seq=841 Ack=927 Win=853 Len=0 TSval=3421211 TSecr=21991337
315 0.117265343 172.31.23.72 -> 172.31.31.144 OpenFlow 146 Type: OFPT_FLOW_REMOVED
316 0.117281294 172.31.23.72 -> 172.31.31.144 OpenFlow 146 Type: OFPT_FLOW_REMOVED
317 0.117288354 172.31.23.72 -> 172.31.31.144 OpenFlow 386 Type: OFPT_FLOW_REMOVED
318 0.117293473 172.31.23.72 -> 172.31.31.144 OpenFlow 146 Type: OFPT_FLOW_REMOVED
319 0.117303104 172.31.23.72 -> 172.31.31.144 OpenFlow 146 Type: OFPT_FLOW_REMOVED
320 0.117311794 172.31.23.72 -> 172.31.31.144 OpenFlow 146 Type: OFPT_FLOW_REMOVED
321 0.117324698 172.31.23.72 -> 172.31.31.144 OpenFlow 146 Type: OFPT_FLOW_REMOVED
322 0.117337511 172.31.23.72 -> 172.31.31.144 OpenFlow 146 Type: OFPT_FLOW_REMOVED
323 0.117343507 172.31.23.72 -> 172.31.31.144 OpenFlow 146 Type: OFPT_FLOW_REMOVED
324 0.117365479 172.31.23.72 -> 172.31.31.144 OpenFlow 146 Type: OFPT_FLOW_REMOVED
325 0.117367252 172.31.23.72 -> 172.31.31.144 OpenFlow 306 Type: OFPT_FLOW_REMOVED
326 0.117369162 172.31.23.72 -> 172.31.31.144 OpenFlow 146 Type: OFPT_FLOW_REMOVED
327 0.117375852 172.31.23.72 -> 172.31.31.144 OpenFlow 146 Type: OFPT_FLOW_REMOVED
328 0.117383181 172.31.23.72 -> 172.31.31.144 OpenFlow 146 Type: OFPT_FLOW_REMOVED
329 0.117395047 172.31.31.144 -> 172.31.23.72 OpenFlow 170 Type: OFPT_FLOW_MOD
330 0.117397675 172.31.31.144 -> 172.31.23.72 OpenFlow 170 Type: OFPT_FLOW_MOD
331 0.117400738 172.31.23.72 -> 172.31.31.144 OpenFlow 786 Type: OFPT_FLOW_REMOVED
332 0.117517586 172.31.23.72 -> 172.31.31.144 OpenFlow 306 Type: OFPT_FLOW_REMOVED
333 0.117519985 172.31.23.72 -> 172.31.31.144 OpenFlow 466 Type: OFPT_FLOW_REMOVED
334 0.117521725 172.31.23.72 -> 172.31.31.144 OpenFlow 146 Type: OFPT_FLOW_REMOVED
335 0.117523534 172.31.23.72 -> 172.31.31.144 OpenFlow 146 Type: OFPT_FLOW_REMOVED
336 0.117617156 172.31.31.144 -> 172.31.23.72 OpenFlow 170 Type: OFPT_FLOW_MOD
337 0.117620380 172.31.31.144 -> 172.31.23.72 TCP 66 6633 → 48346 [ACK] Seq=1567 Ack=601 Win=853 Len=0 TSval=3421211 TSecr=21991337
338 0.117622984 172.31.31.144 -> 172.31.23.72 OpenFlow 170 Type: OFPT_FLOW_MOD
339 0.117624940 172.31.31.144 -> 172.31.23.72 OpenFlow 178 Type: OFPT_BARRIER_REQUEST
340 0.117626732 172.31.31.144 -> 172.31.23.72 OpenFlow 170 Type: OFPT_FLOW_MOD
341 0.117628280 172.31.31.144 -> 172.31.23.72 OpenFlow 170 Type: OFPT_FLOW_MOD
342 0.117629876 172.31.31.144 -> 172.31.23.72 OpenFlow 74 Type: OFPT_BARRIER_REQUEST
343 0.117631164 172.31.31.144 -> 172.31.23.72 OpenFlow 74 Type: OFPT_BARRIER_REQUEST
344 0.117634247 172.31.31.144 -> 172.31.23.72 OpenFlow 170 Type: OFPT_FLOW_MOD
345 0.117637373 172.31.31.144 -> 172.31.23.72 OpenFlow 170 Type: OFPT_FLOW_MOD
346 0.117644433 172.31.23.72 -> 172.31.31.144 OpenFlow 146 Type: OFPT_FLOW_REMOVED
347 0.117653814 172.31.23.72 -> 172.31.31.144 OpenFlow 226 Type: OFPT_FLOW_REMOVED
348 0.117737423 172.31.31.144 -> 172.31.23.72 OpenFlow 178 Type: OFPT_BARRIER_REQUEST
349 0.117740081 172.31.31.144 -> 172.31.23.72 OpenFlow 178 Type: OFPT_BARRIER_REQUEST
350 0.117741765 172.31.31.144 -> 172.31.23.72 OpenFlow 178 Type: OFPT_BARRIER_REQUEST
351 0.117744309 172.31.31.144 -> 172.31.23.72 OpenFlow 170 Type: OFPT_FLOW_MOD
352 0.117746053 172.31.31.144 -> 172.31.23.72 OpenFlow 170 Type: OFPT_FLOW_MOD
353 0.117748511 172.31.31.144 -> 172.31.23.72 OpenFlow 178 Type: OFPT_BARRIER_REQUEST
354 0.117749985 172.31.31.144 -> 172.31.23.72 OpenFlow 170 Type: OFPT_FLOW_MOD
355 0.117751487 172.31.31.144 -> 172.31.23.72 OpenFlow 170 Type: OFPT_FLOW_MOD
356 0.117795908 172.31.31.144 -> 172.31.23.72 TCP 66 6633 → 48336 [ACK] Seq=337 Ack=835 Win=853 Len=0 TSval=3421211 TSecr=21991337
357 0.117799024 172.31.31.144 -> 172.31.23.72 OpenFlow 178 Type: OFPT_BARRIER_REQUEST
358 0.117800519 172.31.31.144 -> 172.31.23.72 OpenFlow 170 Type: OFPT_FLOW_MOD
359 0.117802088 172.31.31.144 -> 172.31.23.72 OpenFlow 170 Type: OFPT_FLOW_MOD
360 0.117835349 172.31.31.144 -> 172.31.23.72 OpenFlow 74 Type: OFPT_BARRIER_REQUEST
361 0.117837319 172.31.31.144 -> 172.31.23.72 OpenFlow 170 Type: OFPT_FLOW_MOD
362 0.117857571 172.31.31.144 -> 172.31.23.72 TCP 66 6633 → 48322 [ACK] Seq=169 Ack=581 Win=853 Len=0 TSval=3421211 TSecr=21991336
363 0.117876399 172.31.31.144 -> 172.31.23.72 OpenFlow 170 Type: OFPT_FLOW_MOD
364 0.117893660 172.31.31.144 -> 172.31.23.72 OpenFlow 74 Type: OFPT_BARRIER_REQUEST
365 0.117911242 172.31.31.144 -> 172.31.23.72 OpenFlow 170 Type: OFPT_FLOW_MOD
366 0.117933083 172.31.31.144 -> 172.31.23.72 OpenFlow 170 Type: OFPT_FLOW_MOD
367 0.117955492 172.31.31.144 -> 172.31.23.72 OpenFlow 170 Type: OFPT_FLOW_MOD
368 0.117957542 172.31.31.144 -> 172.31.23.72 OpenFlow 178 Type: OFPT_BARRIER_REQUEST
369 0.117976532 172.31.31.144 -> 172.31.23.72 TCP 66 6633 → 48330 [ACK] Seq=1547 Ack=583 Win=853 Len=0 TSval=3421211 TSecr=21991337
370 0.117995919 172.31.31.144 -> 172.31.23.72 OpenFlow 170 Type: OFPT_FLOW_MOD
371 0.118026664 172.31.31.144 -> 172.31.23.72 OpenFlow 170 Type: OFPT_FLOW_MOD
372 0.118040602 172.31.31.144 -> 172.31.23.72 OpenFlow 170 Type: OFPT_FLOW_MOD
373 0.118065168 172.31.31.144 -> 172.31.23.72 OpenFlow 170 Type: OFPT_FLOW_MOD
374 0.118087605 172.31.31.144 -> 172.31.23.72 OpenFlow 74 Type: OFPT_BARRIER_REQUEST
375 0.118106494 172.31.31.144 -> 172.31.23.72 OpenFlow 74 Type: OFPT_BARRIER_REQUEST
376 0.118126038 172.31.31.144 -> 172.31.23.72 OpenFlow 170 Type: OFPT_FLOW_MOD
377 0.118144460 172.31.31.144 -> 172.31.23.72 OpenFlow 170 Type: OFPT_FLOW_MOD
378 0.118163150 172.31.31.144 -> 172.31.23.72 TCP 66 6633 → 48320 [ACK] Seq=169 Ack=335 Win=853 Len=0 TSval=3421211 TSecr=21991337
379 0.118182797 172.31.31.144 -> 172.31.23.72 OpenFlow 170 Type: OFPT_FLOW_MOD
380 0.118201612 172.31.31.144 -> 172.31.23.72 OpenFlow 170 Type: OFPT_FLOW_MOD
381 0.118220837 172.31.31.144 -> 172.31.23.72 OpenFlow 74 Type: OFPT_BARRIER_REQUEST
382 0.118240018 172.31.31.144 -> 172.31.23.72 TCP 170 6633 → 48362 [PSH, ACK] Seq=1 Ack=1 Win=853 Len=104 TSval=3421211 TSecr=21991093
383 0.118259426 172.31.31.144 -> 172.31.23.72 OpenFlow 74 Type: OFPT_BARRIER_REQUEST
384 0.118278604 172.31.31.144 -> 172.31.23.72 OpenFlow 170 Type: OFPT_FLOW_MOD
385 0.118297794 172.31.31.144 -> 172.31.23.72 OpenFlow 178 Type: OFPT_BARRIER_REQUEST
386 0.118327966 172.31.31.144 -> 172.31.23.72 OpenFlow 170 Type: OFPT_FLOW_MOD
387 0.118347161 172.31.31.144 -> 172.31.23.72 OpenFlow 170 Type: OFPT_FLOW_MOD
388 0.118365600 172.31.31.144 -> 172.31.23.72 TCP 178 6633 → 48362 [PSH, ACK] Seq=105 Ack=1 Win=853 Len=112 TSval=3421211 TSecr=21991093
389 0.118384068 172.31.31.144 -> 172.31.23.72 OpenFlow 74 Type: OFPT_BARRIER_REQUEST
390 0.118403143 172.31.31.144 -> 172.31.23.72 OpenFlow 178 Type: OFPT_BARRIER_REQUEST
391 0.118421783 172.31.31.144 -> 172.31.23.72 OpenFlow 170 Type: OFPT_FLOW_MOD
392 0.118440832 172.31.31.144 -> 172.31.23.72 OpenFlow 170 Type: OFPT_FLOW_MOD
393 0.118459661 172.31.31.144 -> 172.31.23.72 OpenFlow 178 Type: OFPT_BARRIER_REQUEST
394 0.118478499 172.31.31.144 -> 172.31.23.72 OpenFlow 178 Type: OFPT_BARRIER_REQUEST
395 0.118497373 172.31.31.144 -> 172.31.23.72 OpenFlow 170 Type: OFPT_FLOW_MOD
396 0.118515693 172.31.31.144 -> 172.31.23.72 OpenFlow 170 Type: OFPT_FLOW_MOD
397 0.118534609 172.31.31.144 -> 172.31.23.72 OpenFlow 170 Type: OFPT_FLOW_MOD
398 0.118565318 172.31.31.144 -> 172.31.23.72 OpenFlow 170 Type: OFPT_FLOW_MOD
399 0.118584063 172.31.31.144 -> 172.31.23.72 OpenFlow 170 Type: OFPT_FLOW_MOD
400 0.118603353 172.31.31.144 -> 172.31.23.72 OpenFlow 178 Type: OFPT_BARRIER_REQUEST
401 0.118622172 172.31.31.144 -> 172.31.23.72 OpenFlow 74 Type: OFPT_BARRIER_REQUEST
402 0.118640817 172.31.31.144 -> 172.31.23.72 OpenFlow 170 Type: OFPT_FLOW_MOD
403 0.118659906 172.31.31.144 -> 172.31.23.72 OpenFlow 170 Type: OFPT_FLOW_MOD
404 0.118679025 172.31.31.144 -> 172.31.23.72 OpenFlow 74 Type: OFPT_BARRIER_REQUEST
405 0.118698771 172.31.31.144 -> 172.31.23.72 OpenFlow 170 Type: OFPT_FLOW_MOD
406 0.118717484 172.31.31.144 -> 172.31.23.72 OpenFlow 170 Type: OFPT_FLOW_MOD
407 0.118737827 172.31.31.144 -> 172.31.23.72 OpenFlow 170 Type: OFPT_FLOW_MOD
408 0.118756458 172.31.31.144 -> 172.31.23.72 OpenFlow 170 Type: OFPT_FLOW_MOD
409 0.118776066 172.31.31.144 -> 172.31.23.72 OpenFlow 386 Type: OFPT_BARRIER_REQUEST
410 0.118795512 172.31.31.144 -> 172.31.23.72 OpenFlow 178 Type: OFPT_BARRIER_REQUEST
411 0.118816363 172.31.31.144 -> 172.31.23.72 OpenFlow 610 Type: OFPT_BARRIER_REQUEST
412 0.118845626 172.31.31.144 -> 172.31.23.72 OpenFlow 170 Type: OFPT_FLOW_MOD
413 0.118863687 172.31.31.144 -> 172.31.23.72 OpenFlow 170 Type: OFPT_FLOW_MOD
414 0.118882573 172.31.31.144 -> 172.31.23.72 OpenFlow 170 Type: OFPT_FLOW_MOD
415 0.118903645 172.31.31.144 -> 172.31.23.72 OpenFlow 290 Type: OFPT_BARRIER_REQUEST
416 0.118922769 172.31.31.144 -> 172.31.23.72 OpenFlow 282 Type: OFPT_FLOW_MOD
417 0.118941498 172.31.31.144 -> 172.31.23.72 OpenFlow 394 Type: OFPT_BARRIER_REQUEST
418 0.118960392 172.31.31.144 -> 172.31.23.72 OpenFlow 170 Type: OFPT_FLOW_MOD
419 0.118979333 172.31.31.144 -> 172.31.23.72 OpenFlow 74 Type: OFPT_BARRIER_REQUEST
420 0.118997941 172.31.31.144 -> 172.31.23.72 OpenFlow 170 Type: OFPT_FLOW_MOD
421 0.119016412 172.31.31.144 -> 172.31.23.72 OpenFlow 170 Type: OFPT_FLOW_MOD
422 0.119035217 172.31.31.144 -> 172.31.23.72 OpenFlow 170 Type: OFPT_FLOW_MOD
423 0.119054313 172.31.31.144 -> 172.31.23.72 OpenFlow 274 Type: OFPT_FLOW_MOD
424 0.119073979 172.31.31.144 -> 172.31.23.72 OpenFlow 170 Type: OFPT_FLOW_MOD
425 0.119092916 172.31.31.144 -> 172.31.23.72 OpenFlow 170 Type: OFPT_FLOW_MOD
426 0.119110878 172.31.31.144 -> 172.31.23.72 OpenFlow 178 Type: OFPT_BARRIER_REQUEST
427 0.119129843 172.31.31.144 -> 172.31.23.72 OpenFlow 170 Type: OFPT_FLOW_MOD
428 0.119149278 172.31.31.144 -> 172.31.23.72 OpenFlow 170 Type: OFPT_FLOW_MOD
429 0.119168660 172.31.31.144 -> 172.31.23.72 OpenFlow 170 Type: OFPT_FLOW_MOD
430 0.119188692 172.31.31.144 -> 172.31.23.72 OpenFlow 170 Type: OFPT_FLOW_MOD
431 0.119208728 172.31.31.144 -> 172.31.23.72 OpenFlow 170 Type: OFPT_FLOW_MOD
432 0.119555111 172.31.23.72 -> 172.31.31.144 OpenFlow 74 Type: OFPT_BARRIER_REPLY
433 0.119582104 172.31.23.72 -> 172.31.31.144 OpenFlow 74 Type: OFPT_BARRIER_REPLY
434 0.119603478 172.31.23.72 -> 172.31.31.144 OpenFlow 74 Type: OFPT_BARRIER_REPLY
435 0.119635425 172.31.23.72 -> 172.31.31.144 OpenFlow 74 Type: OFPT_BARRIER_REPLY
436 0.119657267 172.31.23.72 -> 172.31.31.144 OpenFlow 74 Type: OFPT_BARRIER_REPLY
437 0.119690018 172.31.23.72 -> 172.31.31.144 TCP 66 48340 → 6633 [ACK] Seq=493 Ack=1427 Win=213 Len=0 TSval=21991337 TSecr=3421211
438 0.119697854 172.31.23.72 -> 172.31.31.144 OpenFlow 74 Type: OFPT_BARRIER_REPLY
439 0.119719306 172.31.23.72 -> 172.31.31.144 OpenFlow 74 Type: OFPT_BARRIER_REPLY
440 0.119756501 172.31.31.144 -> 172.31.23.72 TCP 66 6633 → 48342 [ACK] Seq=1617 Ack=255 Win=853 Len=0 TSval=3421211 TSecr=21991337
441 0.119761775 172.31.31.144 -> 172.31.23.72 TCP 66 6633 → 48342 [ACK] Seq=1617 Ack=263 Win=853 Len=0 TSval=3421211 TSecr=21991337
442 0.119766177 172.31.23.72 -> 172.31.31.144 OpenFlow 74 Type: OFPT_BARRIER_REPLY
443 0.119781434 172.31.31.144 -> 172.31.23.72 TCP 66 6633 → 48342 [ACK] Seq=1617 Ack=271 Win=853 Len=0 TSval=3421211 TSecr=21991337
444 0.119800048 172.31.23.72 -> 172.31.31.144 OpenFlow 74 Type: OFPT_BARRIER_REPLY
445 0.119838682 172.31.23.72 -> 172.31.31.144 OpenFlow 74 Type: OFPT_BARRIER_REPLY
446 0.119847137 172.31.31.144 -> 172.31.23.72 TCP 66 6633 → 48326 [ACK] Seq=1841 Ack=599 Win=853 Len=0 TSval=3421211 TSecr=21991337
447 0.119870049 172.31.23.72 -> 172.31.31.144 OpenFlow 74 Type: OFPT_BARRIER_REPLY
448 0.119903891 172.31.23.72 -> 172.31.31.144 OpenFlow 74 Type: OFPT_BARRIER_REPLY
449 0.119925237 172.31.23.72 -> 172.31.31.144 OpenFlow 74 Type: OFPT_BARRIER_REPLY
450 0.119960125 172.31.31.144 -> 172.31.23.72 TCP 66 6633 → 48330 [ACK] Seq=2187 Ack=599 Win=853 Len=0 TSval=3421211 TSecr=21991337
451 0.119966616 172.31.23.72 -> 172.31.31.144 OpenFlow 74 Type: OFPT_BARRIER_REPLY
452 0.120002103 172.31.23.72 -> 172.31.31.144 OpenFlow 74 Type: OFPT_BARRIER_REPLY
453 0.120010121 172.31.31.144 -> 172.31.23.72 TCP 66 6633 → 48350 [ACK] Seq=433 Ack=255 Win=853 Len=0 TSval=3421211 TSecr=21991337
454 0.120022745 172.31.31.144 -> 172.31.23.72 TCP 66 6633 → 48350 [ACK] Seq=433 Ack=263 Win=853 Len=0 TSval=3421212 TSecr=21991337
455 0.120038484 172.31.23.72 -> 172.31.31.144 OpenFlow 74 Type: OFPT_BARRIER_REPLY
456 0.120075803 172.31.23.72 -> 172.31.31.144 OpenFlow 74 Type: OFPT_BARRIER_REPLY
457 0.120097486 172.31.23.72 -> 172.31.31.144 OpenFlow 74 Type: OFPT_BARRIER_REPLY
458 0.120123192 172.31.31.144 -> 172.31.23.72 TCP 66 6633 → 48344 [ACK] Seq=649 Ack=517 Win=853 Len=0 TSval=3421212 TSecr=21991337
459 0.120152688 172.31.23.72 -> 172.31.31.144 OpenFlow 74 Type: OFPT_BARRIER_REPLY
460 0.120186678 172.31.23.72 -> 172.31.31.144 OpenFlow 74 Type: OFPT_BARRIER_REPLY
461 0.120196633 172.31.31.144 -> 172.31.23.72 TCP 66 6633 → 48336 [ACK] Seq=873 Ack=1091 Win=853 Len=0 TSval=3421212 TSecr=21991337
462 0.120216968 172.31.23.72 -> 172.31.31.144 OpenFlow 74 Type: OFPT_BARRIER_REPLY
463 0.120238010 172.31.23.72 -> 172.31.31.144 OpenFlow 74 Type: OFPT_BARRIER_REPLY
464 0.120276081 172.31.23.72 -> 172.31.31.144 OpenFlow 74 Type: OFPT_BARRIER_REPLY
465 0.120284799 172.31.31.144 -> 172.31.23.72 TCP 66 6633 → 48334 [ACK] Seq=1353 Ack=767 Win=853 Len=0 TSval=3421212 TSecr=21991337
466 0.120307458 172.31.23.72 -> 172.31.31.144 OpenFlow 74 Type: OFPT_BARRIER_REPLY
467 0.120350425 172.31.31.144 -> 172.31.23.72 OpenFlow 74 Type: OFPT_BARRIER_REQUEST
468 0.120368177 172.31.23.72 -> 172.31.31.144 TCP 66 48366 → 6633 [ACK] Seq=673 Ack=1641 Win=212 Len=0 TSval=21991337 TSecr=3421211
469 0.120393733 172.31.23.72 -> 172.31.31.144 OpenFlow 74 Type: OFPT_BARRIER_REPLY
470 0.120414240 172.31.31.144 -> 172.31.23.72 TCP 66 6633 → 48352 [ACK] Seq=1033 Ack=193 Win=853 Len=0 TSval=3421212 TSecr=21991337
471 0.120424762 172.31.23.72 -> 172.31.31.144 OpenFlow 74 Type: OFPT_BARRIER_REPLY
472 0.120446451 172.31.23.72 -> 172.31.31.144 OpenFlow 74 Type: OFPT_BARRIER_REPLY
473 0.120468161 172.31.31.144 -> 172.31.23.72 TCP 66 6633 → 48338 [ACK] Seq=1481 Ack=1103 Win=853 Len=0 TSval=3421212 TSecr=21991337
474 0.120473791 172.31.23.72 -> 172.31.31.144 OpenFlow 74 Type: OFPT_BARRIER_REPLY
475 0.120509205 172.31.23.72 -> 172.31.31.144 OpenFlow 74 Type: OFPT_BARRIER_REPLY
476 0.120529988 172.31.23.72 -> 172.31.31.144 OpenFlow 74 Type: OFPT_BARRIER_REPLY
477 0.120553345 172.31.23.72 -> 172.31.31.144 OpenFlow 74 Type: OFPT_BARRIER_REPLY
478 0.120576874 172.31.31.144 -> 172.31.23.72 TCP 66 6633 → 48366 [ACK] Seq=1641 Ack=689 Win=853 Len=0 TSval=3421212 TSecr=21991337
479 0.120583251 172.31.23.72 -> 172.31.31.144 OpenFlow 74 Type: OFPT_BARRIER_REPLY
480 0.120622076 172.31.31.144 -> 172.31.23.72 TCP 66 6633 → 48366 [ACK] Seq=1641 Ack=705 Win=853 Len=0 TSval=3421212 TSecr=21991337
481 0.120697736 172.31.31.144 -> 172.31.23.72 TCP 66 6633 → 48364 [ACK] Seq=1033 Ack=193 Win=853 Len=0 TSval=3421212 TSecr=21991337
482 0.121213854 172.31.23.72 -> 172.31.31.144 TCP 66 48362 → 6633 [ACK] Seq=1 Ack=217 Win=213 Len=0 TSval=21991338 TSecr=3421211
483 0.121226171 172.31.23.72 -> 172.31.31.144 OpenFlow 74 Type: OFPT_BARRIER_REPLY
484 0.121251640 172.31.23.72 -> 172.31.31.144 OpenFlow 74 Type: OFPT_BARRIER_REPLY
485 0.121301536 172.31.23.72 -> 172.31.31.144 TCP 66 48354 → 6633 [ACK] Seq=1167 Ack=1057 Win=213 Len=0 TSval=21991338 TSecr=3421211
486 0.121309677 172.31.23.72 -> 172.31.31.144 OpenFlow 74 Type: OFPT_BARRIER_REPLY
487 0.121336468 172.31.23.72 -> 172.31.31.144 TCP 66 48332 → 6633 [ACK] Seq=661 Ack=385 Win=213 Len=0 TSval=21991338 TSecr=3421211
488 0.121360524 172.31.23.72 -> 172.31.31.144 OpenFlow 74 Type: OFPT_BARRIER_REPLY
489 0.121390906 172.31.31.144 -> 172.31.23.72 TCP 66 6633 → 48362 [ACK] Seq=217 Ack=9 Win=853 Len=0 TSval=3421212 TSecr=21991338
490 0.121484345 172.31.31.144 -> 172.31.23.72 TCP 66 6633 → 48354 [ACK] Seq=1057 Ack=1175 Win=853 Len=0 TSval=3421212 TSecr=21991337
491 0.122993745 172.31.23.72 -> 172.31.31.144 OpenFlow 74 Type: OFPT_BARRIER_REPLY
492 0.156115666 172.31.31.144 -> 172.31.23.72 TCP 66 6633 → 48340 [ACK] Seq=1427 Ack=501 Win=853 Len=0 TSval=3421221 TSecr=21991337
493 0.156123835 172.31.31.144 -> 172.31.23.72 TCP 66 6633 → 48346 [ACK] Seq=1567 Ack=921 Win=853 Len=0 TSval=3421221 TSecr=21991337
494 0.156142339 172.31.31.144 -> 172.31.23.72 TCP 66 6633 → 48324 [ACK] Seq=1803 Ack=423 Win=853 Len=0 TSval=3421221 TSecr=21991337
495 0.160095699 172.31.31.144 -> 172.31.23.72 TCP 66 6633 → 48364 [ACK] Seq=1033 Ack=201 Win=853 Len=0 TSval=3421222 TSecr=21991337
496 0.160109865 172.31.31.144 -> 172.31.23.72 TCP 66 6633 → 48332 [ACK] Seq=385 Ack=669 Win=853 Len=0 TSval=3421222 TSecr=21991338
497 0.160111934 172.31.31.144 -> 172.31.23.72 TCP 66 6633 → 48352 [ACK] Seq=1033 Ack=201 Win=853 Len=0 TSval=3421222 TSecr=21991338
498 0.160128708 172.31.31.144 -> 172.31.23.72 TCP 66 6633 → 48322 [ACK] Seq=489 Ack=669 Win=853 Len=0 TSval=3421222 TSecr=21991337
499 0.160147168 172.31.31.144 -> 172.31.23.72 TCP 66 6633 → 48320 [ACK] Seq=593 Ack=423 Win=853 Len=0 TSval=3421222 TSecr=21991338
500 0.199436997 172.31.31.144 -> 172.31.23.72 OpenFlow 187 Type: OFPT_PACKET_OUT
501 0.199468183 172.31.31.144 -> 172.31.23.72 OpenFlow 187 Type: OFPT_PACKET_OUT
502 0.199499943 172.31.31.144 -> 172.31.23.72 OpenFlow 187 Type: OFPT_PACKET_OUT
503 0.199526032 172.31.31.144 -> 172.31.23.72 OpenFlow 187 Type: OFPT_PACKET_OUT
504 0.199592544 172.31.31.144 -> 172.31.23.72 OpenFlow 187 Type: OFPT_PACKET_OUT
505 0.199649946 172.31.31.144 -> 172.31.23.72 OpenFlow 187 Type: OFPT_PACKET_OUT
506 0.199710486 172.31.31.144 -> 172.31.23.72 OpenFlow 187 Type: OFPT_PACKET_OUT
507 0.199773647 172.31.31.144 -> 172.31.23.72 OpenFlow 187 Type: OFPT_PACKET_OUT
508 0.199791362 172.31.31.144 -> 172.31.23.72 OpenFlow 187 Type: OFPT_PACKET_OUT
509 0.199876690 172.31.31.144 -> 172.31.23.72 OpenFlow 187 Type: OFPT_PACKET_OUT
510 0.200005412 172.31.31.144 -> 172.31.23.72 OpenFlow 187 Type: OFPT_PACKET_OUT
511 0.200069162 172.31.31.144 -> 172.31.23.72 OpenFlow 187 Type: OFPT_PACKET_OUT
512 0.200135190 172.31.31.144 -> 172.31.23.72 OpenFlow 187 Type: OFPT_PACKET_OUT
513 0.200171171 172.31.23.72 -> 172.31.31.144 TCP 66 48350 → 6633 [ACK] Seq=263 Ack=1643 Win=213 Len=0 TSval=21991357 TSecr=3421231
514 0.200207688 172.31.31.144 -> 172.31.23.72 OpenFlow 187 Type: OFPT_PACKET_OUT
515 0.200267814 172.31.31.144 -> 172.31.23.72 OpenFlow 187 Type: OFPT_PACKET_OUT
516 0.200325276 172.31.31.144 -> 172.31.23.72 OpenFlow 187 Type: OFPT_PACKET_OUT
517 0.200406161 172.31.31.144 -> 172.31.23.72 OpenFlow 187 Type: OFPT_PACKET_OUT
518 0.200464577 172.31.31.144 -> 172.31.23.72 OpenFlow 187 Type: OFPT_PACKET_OUT
519 0.200542507 172.31.31.144 -> 172.31.23.72 OpenFlow 187 Type: OFPT_PACKET_OUT
520 0.200555891 172.31.23.72 -> 172.31.31.144 TCP 66 48344 → 6633 [ACK] Seq=517 Ack=1617 Win=213 Len=0 TSval=21991357 TSecr=3421231
521 0.200626531 172.31.31.144 -> 172.31.23.72 OpenFlow 187 Type: OFPT_PACKET_OUT
522 0.200675717 172.31.31.144 -> 172.31.23.72 OpenFlow 187 Type: OFPT_PACKET_OUT
523 0.200730370 172.31.31.144 -> 172.31.23.72 OpenFlow 187 Type: OFPT_PACKET_OUT
524 0.200760219 172.31.23.72 -> 172.31.31.144 TCP 66 48356 → 6633 [ACK] Seq=493 Ack=485 Win=213 Len=0 TSval=21991357 TSecr=3421232
525 0.200783338 172.31.31.144 -> 172.31.23.72 OpenFlow 187 Type: OFPT_PACKET_OUT
526 0.200816154 172.31.23.72 -> 172.31.31.144 OpenFlow 189 Type: OFPT_PACKET_IN
527 0.200839781 172.31.31.144 -> 172.31.23.72 OpenFlow 187 Type: OFPT_PACKET_OUT
528 0.200845096 172.31.23.72 -> 172.31.31.144 OpenFlow 435 Type: OFPT_PACKET_IN
529 0.200856946 172.31.23.72 -> 172.31.31.144 OpenFlow 189 Type: OFPT_PACKET_IN
530 0.200878168 172.31.23.72 -> 172.31.31.144 OpenFlow 189 Type: OFPT_PACKET_IN
531 0.200886198 172.31.23.72 -> 172.31.31.144 OpenFlow 189 Type: OFPT_PACKET_IN
532 0.200905461 172.31.23.72 -> 172.31.31.144 OpenFlow 189 Type: OFPT_PACKET_IN
533 0.200910677 172.31.23.72 -> 172.31.31.144 OpenFlow 189 Type: OFPT_PACKET_IN
534 0.200927953 172.31.23.72 -> 172.31.31.144 OpenFlow 189 Type: OFPT_PACKET_IN
535 0.201001352 172.31.23.72 -> 172.31.31.144 OpenFlow 189 Type: OFPT_PACKET_IN
536 0.201007383 172.31.23.72 -> 172.31.31.144 OpenFlow 189 Type: OFPT_PACKET_IN
537 0.201027155 172.31.31.144 -> 172.31.23.72 OpenFlow 187 Type: OFPT_PACKET_OUT
538 0.201031448 172.31.31.144 -> 172.31.23.72 OpenFlow 187 Type: OFPT_PACKET_OUT
539 0.201033521 172.31.31.144 -> 172.31.23.72 OpenFlow 187 Type: OFPT_PACKET_OUT
540 0.201079572 172.31.31.144 -> 172.31.23.72 TCP 66 6633 → 48362 [ACK] Seq=217 Ack=132 Win=853 Len=0 TSval=3421232 TSecr=21991357
541 0.201083726 172.31.31.144 -> 172.31.23.72 TCP 66 6633 → 48352 [ACK] Seq=1033 Ack=693 Win=853 Len=0 TSval=3421232 TSecr=21991357
542 0.201085999 172.31.31.144 -> 172.31.23.72 OpenFlow 187 Type: OFPT_PACKET_OUT
543 0.201105569 172.31.31.144 -> 172.31.23.72 TCP 66 6633 → 48360 [ACK] Seq=1 Ack=370 Win=853 Len=0 TSval=3421232 TSecr=21991357
544 0.201113866 172.31.23.72 -> 172.31.31.144 OpenFlow 189 Type: OFPT_PACKET_IN
545 0.201123465 172.31.31.144 -> 172.31.23.72 TCP 66 6633 → 48338 [ACK] Seq=1481 Ack=1349 Win=853 Len=0 TSval=3421232 TSecr=21991357
546 0.201132880 172.31.23.72 -> 172.31.31.144 OpenFlow 189 Type: OFPT_PACKET_IN
547 0.201151106 172.31.23.72 -> 172.31.31.144 OpenFlow 189 Type: OFPT_PACKET_IN
548 0.201158309 172.31.31.144 -> 172.31.23.72 TCP 66 6633 → 48362 [ACK] Seq=217 Ack=255 Win=853 Len=0 TSval=3421232 TSecr=21991357
549 0.201161165 172.31.31.144 -> 172.31.23.72 TCP 66 6633 → 48348 [ACK] Seq=1 Ack=616 Win=853 Len=0 TSval=3421232 TSecr=21991357
550 0.201174701 172.31.23.72 -> 172.31.31.144 OpenFlow 189 Type: OFPT_PACKET_IN
551 0.201183118 172.31.23.72 -> 172.31.31.144 OpenFlow 189 Type: OFPT_PACKET_IN
552 0.201207129 172.31.31.144 -> 172.31.23.72 OpenFlow 187 Type: OFPT_PACKET_OUT
553 0.201210129 172.31.31.144 -> 172.31.23.72 TCP 66 6633 → 48360 [ACK] Seq=1 Ack=493 Win=853 Len=0 TSval=3421232 TSecr=21991358
554 0.201232711 172.31.23.72 -> 172.31.31.144 OpenFlow 435 Type: OFPT_PACKET_IN
555 0.201269179 172.31.31.144 -> 172.31.23.72 TCP 66 6633 → 48348 [ACK] Seq=1 Ack=739 Win=853 Len=0 TSval=3421232 TSecr=21991358
556 0.201273419 172.31.31.144 -> 172.31.23.72 OpenFlow 187 Type: OFPT_PACKET_OUT
557 0.201275536 172.31.31.144 -> 172.31.23.72 OpenFlow 187 Type: OFPT_PACKET_OUT
558 0.201283092 172.31.31.144 -> 172.31.23.72 TCP 66 6633 → 48358 [ACK] Seq=969 Ack=124 Win=853 Len=0 TSval=3421232 TSecr=21991358
559 0.201287059 172.31.31.144 -> 172.31.23.72 TCP 66 6633 → 48358 [ACK] Seq=969 Ack=247 Win=853 Len=0 TSval=3421232 TSecr=21991358
560 0.201323044 172.31.31.144 -> 172.31.23.72 OpenFlow 187 Type: OFPT_PACKET_OUT
561 0.201348333 172.31.31.144 -> 172.31.23.72 TCP 66 6633 → 48346 [ACK] Seq=1567 Ack=1044 Win=853 Len=0 TSval=3421232 TSecr=21991358
562 0.201354722 172.31.23.72 -> 172.31.31.144 TCP 66 48356 → 6633 [ACK] Seq=493 Ack=727 Win=213 Len=0 TSval=21991358 TSecr=3421232
563 0.201369705 172.31.31.144 -> 172.31.23.72 TCP 66 6633 → 48342 [ACK] Seq=1617 Ack=394 Win=853 Len=0 TSval=3421232 TSecr=21991358
564 0.201514852 172.31.31.144 -> 172.31.23.72 OpenFlow 187 Type: OFPT_PACKET_OUT
565 0.201674341 172.31.31.144 -> 172.31.23.72 TCP 66 6633 → 48346 [ACK] Seq=1567 Ack=1167 Win=853 Len=0 TSval=3421232 TSecr=21991358
566 0.201730734 172.31.23.72 -> 172.31.31.144 TCP 66 48336 → 6633 [ACK] Seq=1091 Ack=1962 Win=213 Len=0 TSval=21991358 TSecr=3421232
567 0.201806633 172.31.23.72 -> 172.31.31.144 OpenFlow 189 Type: OFPT_PACKET_IN
568 0.201842105 172.31.23.72 -> 172.31.31.144 OpenFlow 189 Type: OFPT_PACKET_IN
569 0.201875137 172.31.31.144 -> 172.31.23.72 OpenFlow 187 Type: OFPT_PACKET_OUT
570 0.201897849 172.31.31.144 -> 172.31.23.72 TCP 66 6633 → 48342 [ACK] Seq=1617 Ack=763 Win=853 Len=0 TSval=3421232 TSecr=21991358
571 0.201906444 172.31.23.72 -> 172.31.31.144 OpenFlow 189 Type: OFPT_PACKET_IN
572 0.201927319 172.31.23.72 -> 172.31.31.144 OpenFlow 189 Type: OFPT_PACKET_IN
573 0.201999714 172.31.31.144 -> 172.31.23.72 OpenFlow 187 Type: OFPT_PACKET_OUT
574 0.202016825 172.31.31.144 -> 172.31.23.72 TCP 66 6633 → 48338 [ACK] Seq=1481 Ack=1595 Win=853 Len=0 TSval=3421232 TSecr=21991358
575 0.202034697 172.31.23.72 -> 172.31.31.144 OpenFlow 189 Type: OFPT_PACKET_IN
576 0.202057821 172.31.23.72 -> 172.31.31.144 OpenFlow 189 Type: OFPT_PACKET_IN
577 0.202076263 172.31.23.72 -> 172.31.31.144 OpenFlow 189 Type: OFPT_PACKET_IN
578 0.202081130 172.31.31.144 -> 172.31.23.72 TCP 66 6633 → 48332 [ACK] Seq=385 Ack=915 Win=853 Len=0 TSval=3421232 TSecr=21991358
579 0.202084510 172.31.31.144 -> 172.31.23.72 OpenFlow 187 Type: OFPT_PACKET_OUT
580 0.202106758 172.31.23.72 -> 172.31.31.144 OpenFlow 435 Type: OFPT_PACKET_IN
581 0.202111731 172.31.23.72 -> 172.31.31.144 OpenFlow 189 Type: OFPT_PACKET_IN
582 0.202201092 172.31.31.144 -> 172.31.23.72 OpenFlow 187 Type: OFPT_PACKET_OUT
583 0.202295150 172.31.23.72 -> 172.31.31.144 TCP 66 48334 → 6633 [ACK] Seq=767 Ack=1716 Win=213 Len=0 TSval=21991358 TSecr=3421232
584 0.202306542 172.31.31.144 -> 172.31.23.72 TCP 66 6633 → 48330 [ACK] Seq=2187 Ack=845 Win=853 Len=0 TSval=3421232 TSecr=21991358
585 0.202310683 172.31.31.144 -> 172.31.23.72 TCP 66 6633 → 48340 [ACK] Seq=1427 Ack=993 Win=853 Len=0 TSval=3421232 TSecr=21991358
586 0.202314302 172.31.31.144 -> 172.31.23.72 OpenFlow 187 Type: OFPT_PACKET_OUT
587 0.202422615 172.31.31.144 -> 172.31.23.72 TCP 66 6633 → 48342 [ACK] Seq=1617 Ack=886 Win=853 Len=0 TSval=3421232 TSecr=21991358
588 0.202465776 172.31.23.72 -> 172.31.31.144 OpenFlow 189 Type: OFPT_PACKET_IN
589 0.202475233 172.31.31.144 -> 172.31.23.72 OpenFlow 187 Type: OFPT_PACKET_OUT
590 0.202486561 172.31.23.72 -> 172.31.31.144 OpenFlow 189 Type: OFPT_PACKET_IN
591 0.202579753 172.31.23.72 -> 172.31.31.144 OpenFlow 189 Type: OFPT_PACKET_IN
592 0.202623848 172.31.23.72 -> 172.31.31.144 OpenFlow 189 Type: OFPT_PACKET_IN
593 0.202643979 172.31.23.72 -> 172.31.31.144 OpenFlow 189 Type: OFPT_PACKET_IN
594 0.202668781 172.31.31.144 -> 172.31.23.72 OpenFlow 187 Type: OFPT_PACKET_OUT
595 0.202691975 172.31.31.144 -> 172.31.23.72 TCP 66 6633 → 48332 [ACK] Seq=385 Ack=1161 Win=853 Len=0 TSval=3421232 TSecr=21991358
596 0.202750378 172.31.31.144 -> 172.31.23.72 OpenFlow 187 Type: OFPT_PACKET_OUT
597 0.202761275 172.31.23.72 -> 172.31.31.144 TCP 66 48334 → 6633 [ACK] Seq=767 Ack=2079 Win=213 Len=0 TSval=21991358 TSecr=3421232
598 0.202769895 172.31.31.144 -> 172.31.23.72 TCP 66 6633 → 48342 [ACK] Seq=1617 Ack=1009 Win=853 Len=0 TSval=3421232 TSecr=21991358
599 0.202818488 172.31.31.144 -> 172.31.23.72 TCP 66 6633 → 48326 [ACK] Seq=1841 Ack=845 Win=853 Len=0 TSval=3421232 TSecr=21991358
600 0.202836669 172.31.31.144 -> 172.31.23.72 OpenFlow 187 Type: OFPT_PACKET_OUT
601 0.202896833 172.31.23.72 -> 172.31.31.144 TCP 66 48322 → 6633 [ACK] Seq=669 Ack=731 Win=213 Len=0 TSval=21991358 TSecr=3421232
602 0.202969975 172.31.23.72 -> 172.31.31.144 OpenFlow 189 Type: OFPT_PACKET_IN
603 0.202993918 172.31.23.72 -> 172.31.31.144 OpenFlow 189 Type: OFPT_PACKET_IN
604 0.203017660 172.31.31.144 -> 172.31.23.72 OpenFlow 187 Type: OFPT_PACKET_OUT
605 0.203023329 172.31.23.72 -> 172.31.31.144 OpenFlow 189 Type: OFPT_PACKET_IN
606 0.203042049 172.31.23.72 -> 172.31.31.144 OpenFlow 189 Type: OFPT_PACKET_IN
607 0.203138199 172.31.31.144 -> 172.31.23.72 OpenFlow 187 Type: OFPT_PACKET_OUT
608 0.203155136 172.31.31.144 -> 172.31.23.72 TCP 66 6633 → 48338 [ACK] Seq=1481 Ack=1841 Win=853 Len=0 TSval=3421232 TSecr=21991358
609 0.203222893 172.31.31.144 -> 172.31.23.72 OpenFlow 187 Type: OFPT_PACKET_OUT
610 0.203242708 172.31.31.144 -> 172.31.23.72 TCP 66 6633 → 48320 [ACK] Seq=593 Ack=669 Win=853 Len=0 TSval=3421232 TSecr=21991358
611 0.203334533 172.31.23.72 -> 172.31.31.144 TCP 66 48322 → 6633 [ACK] Seq=669 Ack=1094 Win=213 Len=0 TSval=21991358 TSecr=3421232
612 0.203366152 172.31.31.144 -> 172.31.23.72 OpenFlow 187 Type: OFPT_PACKET_OUT
613 0.203500159 172.31.31.144 -> 172.31.23.72 OpenFlow 187 Type: OFPT_PACKET_OUT
614 0.203517005 172.31.31.144 -> 172.31.23.72 OpenFlow 187 Type: OFPT_PACKET_OUT
615 0.203560273 172.31.23.72 -> 172.31.31.144 OpenFlow 189 Type: OFPT_PACKET_IN
616 0.203581529 172.31.23.72 -> 172.31.31.144 OpenFlow 189 Type: OFPT_PACKET_IN
617 0.203636116 172.31.31.144 -> 172.31.23.72 OpenFlow 187 Type: OFPT_PACKET_OUT
618 0.203680459 172.31.23.72 -> 172.31.31.144 TCP 66 48322 → 6633 [ACK] Seq=669 Ack=1457 Win=213 Len=0 TSval=21991358 TSecr=3421232
619 0.203699400 172.31.31.144 -> 172.31.23.72 OpenFlow 187 Type: OFPT_PACKET_OUT
620 0.203749183 172.31.31.144 -> 172.31.23.72 OpenFlow 187 Type: OFPT_PACKET_OUT
621 0.203789272 172.31.31.144 -> 172.31.23.72 TCP 66 6633 → 48324 [ACK] Seq=1803 Ack=669 Win=853 Len=0 TSval=3421232 TSecr=21991358
622 0.203811646 172.31.31.144 -> 172.31.23.72 OpenFlow 187 Type: OFPT_PACKET_OUT
623 0.203878360 172.31.31.144 -> 172.31.23.72 OpenFlow 187 Type: OFPT_PACKET_OUT
624 0.203937480 172.31.31.144 -> 172.31.23.72 OpenFlow 187 Type: OFPT_PACKET_OUT
625 0.204014679 172.31.23.72 -> 172.31.31.144 TCP 66 48352 → 6633 [ACK] Seq=693 Ack=1759 Win=213 Len=0 TSval=21991358 TSecr=3421232
626 0.204072332 172.31.31.144 -> 172.31.23.72 OpenFlow 187 Type: OFPT_PACKET_OUT
627 0.204114310 172.31.23.72 -> 172.31.31.144 OpenFlow 189 Type: OFPT_PACKET_IN
628 0.204136388 172.31.31.144 -> 172.31.23.72 OpenFlow 187 Type: OFPT_PACKET_OUT
629 0.204141613 172.31.23.72 -> 172.31.31.144 OpenFlow 189 Type: OFPT_PACKET_IN
630 0.204244275 172.31.23.72 -> 172.31.31.144 OpenFlow 189 Type: OFPT_PACKET_IN
631 0.204269458 172.31.23.72 -> 172.31.31.144 OpenFlow 189 Type: OFPT_PACKET_IN
632 0.204274705 172.31.23.72 -> 172.31.31.144 OpenFlow 189 Type: OFPT_PACKET_IN
633 0.204287283 172.31.23.72 -> 172.31.31.144 OpenFlow 189 Type: OFPT_PACKET_IN
634 0.204292775 172.31.31.144 -> 172.31.23.72 OpenFlow 187 Type: OFPT_PACKET_OUT
635 0.204320724 172.31.23.72 -> 172.31.31.144 OpenFlow 189 Type: OFPT_PACKET_IN
636 0.204363670 172.31.31.144 -> 172.31.23.72 OpenFlow 187 Type: OFPT_PACKET_OUT
637 0.204367480 172.31.31.144 -> 172.31.23.72 TCP 66 6633 → 48354 [ACK] Seq=1057 Ack=1421 Win=853 Len=0 TSval=3421233 TSecr=21991358
638 0.204373124 172.31.23.72 -> 172.31.31.144 OpenFlow 189 Type: OFPT_PACKET_IN
639 0.204437238 172.31.31.144 -> 172.31.23.72 OpenFlow 187 Type: OFPT_PACKET_OUT
640 0.204454246 172.31.31.144 -> 172.31.23.72 TCP 66 6633 → 48330 [ACK] Seq=2187 Ack=1091 Win=853 Len=0 TSval=3421233 TSecr=21991358
641 0.204482123 172.31.31.144 -> 172.31.23.72 OpenFlow 187 Type: OFPT_PACKET_OUT
642 0.204506522 172.31.31.144 -> 172.31.23.72 TCP 66 6633 → 48350 [ACK] Seq=1643 Ack=509 Win=853 Len=0 TSval=3421233 TSecr=21991358
643 0.204518488 172.31.31.144 -> 172.31.23.72 OpenFlow 187 Type: OFPT_PACKET_OUT
644 0.204537213 172.31.31.144 -> 172.31.23.72 TCP 66 6633 → 48344 [ACK] Seq=1617 Ack=763 Win=853 Len=0 TSval=3421233 TSecr=21991358
645 0.204555662 172.31.23.72 -> 172.31.31.144 TCP 66 48352 → 6633 [ACK] Seq=693 Ack=2243 Win=213 Len=0 TSval=21991358 TSecr=3421233
646 0.204598644 172.31.31.144 -> 172.31.23.72 OpenFlow 187 Type: OFPT_PACKET_OUT
647 0.204741372 172.31.23.72 -> 172.31.31.144 TCP 66 48338 → 6633 [ACK] Seq=1841 Ack=1965 Win=213 Len=0 TSval=21991358 TSecr=3421233
648 0.204811296 172.31.23.72 -> 172.31.31.144 OpenFlow 189 Type: OFPT_PACKET_IN
649 0.204831939 172.31.31.144 -> 172.31.23.72 OpenFlow 187 Type: OFPT_PACKET_OUT
650 0.204837889 172.31.23.72 -> 172.31.31.144 OpenFlow 189 Type: OFPT_PACKET_IN
651 0.204849203 172.31.23.72 -> 172.31.31.144 OpenFlow 189 Type: OFPT_PACKET_IN
652 0.204879180 172.31.23.72 -> 172.31.31.144 OpenFlow 189 Type: OFPT_PACKET_IN
653 0.204922170 172.31.31.144 -> 172.31.23.72 OpenFlow 187 Type: OFPT_PACKET_OUT
654 0.205005397 172.31.31.144 -> 172.31.23.72 TCP 66 6633 → 48362 [ACK] Seq=217 Ack=378 Win=853 Len=0 TSval=3421233 TSecr=21991358
655 0.205022719 172.31.31.144 -> 172.31.23.72 OpenFlow 187 Type: OFPT_PACKET_OUT
656 0.205040712 172.31.31.144 -> 172.31.23.72 TCP 66 6633 → 48364 [ACK] Seq=1033 Ack=447 Win=853 Len=0 TSval=3421233 TSecr=21991358
657 0.205051621 172.31.23.72 -> 172.31.31.144 OpenFlow 189 Type: OFPT_PACKET_IN
658 0.205060132 172.31.31.144 -> 172.31.23.72 TCP 66 6633 → 48362 [ACK] Seq=217 Ack=501 Win=853 Len=0 TSval=3421233 TSecr=21991358
659 0.205072398 172.31.23.72 -> 172.31.31.144 OpenFlow 189 Type: OFPT_PACKET_IN
660 0.205086297 172.31.23.72 -> 172.31.31.144 OpenFlow 189 Type: OFPT_PACKET_IN
661 0.205096223 172.31.31.144 -> 172.31.23.72 OpenFlow 187 Type: OFPT_PACKET_OUT
662 0.205122280 172.31.23.72 -> 172.31.31.144 OpenFlow 189 Type: OFPT_PACKET_IN
663 0.205179154 172.31.31.144 -> 172.31.23.72 OpenFlow 187 Type: OFPT_PACKET_OUT
664 0.205272572 172.31.23.72 -> 172.31.31.144 TCP 66 48338 → 6633 [ACK] Seq=1841 Ack=2449 Win=213 Len=0 TSval=21991359 TSecr=3421233
665 0.205283082 172.31.31.144 -> 172.31.23.72 TCP 66 6633 → 48336 [ACK] Seq=2083 Ack=1337 Win=853 Len=0 TSval=3421233 TSecr=21991359
666 0.205370251 172.31.31.144 -> 172.31.23.72 OpenFlow 187 Type: OFPT_PACKET_OUT
667 0.205397782 172.31.23.72 -> 172.31.31.144 TCP 66 48366 → 6633 [ACK] Seq=705 Ack=1883 Win=213 Len=0 TSval=21991359 TSecr=3421233
668 0.205445529 172.31.31.144 -> 172.31.23.72 OpenFlow 187 Type: OFPT_PACKET_OUT
669 0.205487865 172.31.23.72 -> 172.31.31.144 OpenFlow 189 Type: OFPT_PACKET_IN
670 0.205497956 172.31.31.144 -> 172.31.23.72 TCP 66 6633 → 48334 [ACK] Seq=2079 Ack=1013 Win=853 Len=0 TSval=3421233 TSecr=21991359
671 0.205511036 172.31.23.72 -> 172.31.31.144 OpenFlow 189 Type: OFPT_PACKET_IN
672 0.205556470 172.31.31.144 -> 172.31.23.72 OpenFlow 187 Type: OFPT_PACKET_OUT
673 0.205626599 172.31.31.144 -> 172.31.23.72 OpenFlow 187 Type: OFPT_PACKET_OUT
674 0.205649580 172.31.23.72 -> 172.31.31.144 OpenFlow 189 Type: OFPT_PACKET_IN
675 0.205671143 172.31.23.72 -> 172.31.31.144 OpenFlow 189 Type: OFPT_PACKET_IN
676 0.205696277 172.31.31.144 -> 172.31.23.72 TCP 66 6633 → 48364 [ACK] Seq=1033 Ack=693 Win=853 Len=0 TSval=3421233 TSecr=21991359
677 0.205715096 172.31.23.72 -> 172.31.31.144 OpenFlow 189 Type: OFPT_PACKET_IN
678 0.205722867 172.31.31.144 -> 172.31.23.72 OpenFlow 187 Type: OFPT_PACKET_OUT
679 0.205736739 172.31.23.72 -> 172.31.31.144 OpenFlow 189 Type: OFPT_PACKET_IN
680 0.205838672 172.31.31.144 -> 172.31.23.72 TCP 66 6633 → 48346 [ACK] Seq=1567 Ack=1413 Win=853 Len=0 TSval=3421233 TSecr=21991359
681 0.205852736 172.31.23.72 -> 172.31.31.144 TCP 66 48366 → 6633 [ACK] Seq=705 Ack=2367 Win=213 Len=0 TSval=21991359 TSecr=3421233
682 0.205917598 172.31.31.144 -> 172.31.23.72 TCP 66 6633 → 48344 [ACK] Seq=1617 Ack=1009 Win=853 Len=0 TSval=3421233 TSecr=21991359
683 0.205949711 172.31.23.72 -> 172.31.31.144 OpenFlow 189 Type: OFPT_PACKET_IN
684 0.205972351 172.31.23.72 -> 172.31.31.144 OpenFlow 189 Type: OFPT_PACKET_IN
685 0.206127958 172.31.31.144 -> 172.31.23.72 OpenFlow 187 Type: OFPT_PACKET_OUT
686 0.206147969 172.31.31.144 -> 172.31.23.72 TCP 66 6633 → 48354 [ACK] Seq=1057 Ack=1667 Win=853 Len=0 TSval=3421233 TSecr=21991359
687 0.206181995 172.31.31.144 -> 172.31.23.72 OpenFlow 429 Type: OFPT_PACKET_OUT
688 0.206217251 172.31.31.144 -> 172.31.23.72 OpenFlow 187 Type: OFPT_PACKET_OUT
689 0.206243169 172.31.31.144 -> 172.31.23.72 OpenFlow 187 Type: OFPT_PACKET_OUT
690 0.206337746 172.31.31.144 -> 172.31.23.72 OpenFlow 187 Type: OFPT_PACKET_OUT
691 0.206389769 172.31.31.144 -> 172.31.23.72 OpenFlow 187 Type: OFPT_PACKET_OUT
692 0.206513497 172.31.23.72 -> 172.31.31.144 TCP 66 48364 → 6633 [ACK] Seq=693 Ack=2001 Win=213 Len=0 TSval=21991359 TSecr=3421233
693 0.206573295 172.31.31.144 -> 172.31.23.72 OpenFlow 187 Type: OFPT_PACKET_OUT
694 0.206601816 172.31.23.72 -> 172.31.31.144 OpenFlow 189 Type: OFPT_PACKET_IN
695 0.206626486 172.31.23.72 -> 172.31.31.144 OpenFlow 189 Type: OFPT_PACKET_IN
696 0.206651430 172.31.31.144 -> 172.31.23.72 OpenFlow 187 Type: OFPT_PACKET_OUT
697 0.206708673 172.31.31.144 -> 172.31.23.72 OpenFlow 187 Type: OFPT_PACKET_OUT
698 0.206735984 172.31.23.72 -> 172.31.31.144 TCP 66 48362 → 6633 [ACK] Seq=747 Ack=580 Win=213 Len=0 TSval=21991359 TSecr=3421233
699 0.206815255 172.31.31.144 -> 172.31.23.72 OpenFlow 187 Type: OFPT_PACKET_OUT
700 0.206835088 172.31.23.72 -> 172.31.31.144 OpenFlow 189 Type: OFPT_PACKET_IN
701 0.206857145 172.31.23.72 -> 172.31.31.144 OpenFlow 189 Type: OFPT_PACKET_IN
702 0.206985879 172.31.31.144 -> 172.31.23.72 TCP 66 6633 → 48360 [ACK] Seq=1 Ack=616 Win=853 Len=0 TSval=3421233 TSecr=21991359
703 0.207002931 172.31.31.144 -> 172.31.23.72 TCP 66 6633 → 48360 [ACK] Seq=1 Ack=739 Win=853 Len=0 TSval=3421233 TSecr=21991359
704 0.207007229 172.31.23.72 -> 172.31.31.144 OpenFlow 189 Type: OFPT_PACKET_IN
705 0.207029154 172.31.23.72 -> 172.31.31.144 OpenFlow 189 Type: OFPT_PACKET_IN
706 0.207040752 172.31.23.72 -> 172.31.31.144 OpenFlow 189 Type: OFPT_PACKET_IN
707 0.207053007 172.31.23.72 -> 172.31.31.144 OpenFlow 189 Type: OFPT_PACKET_IN
708 0.207123823 172.31.23.72 -> 172.31.31.144 OpenFlow 189 Type: OFPT_PACKET_IN
709 0.207159623 172.31.31.144 -> 172.31.23.72 OpenFlow 187 Type: OFPT_PACKET_OUT
710 0.207194823 172.31.31.144 -> 172.31.23.72 OpenFlow 187 Type: OFPT_PACKET_OUT
711 0.207198040 172.31.31.144 -> 172.31.23.72 TCP 66 6633 → 48352 [ACK] Seq=2243 Ack=939 Win=853 Len=0 TSval=3421233 TSecr=21991359
712 0.207241448 172.31.23.72 -> 172.31.31.144 TCP 66 48320 → 6633 [ACK] Seq=669 Ack=835 Win=213 Len=0 TSval=21991359 TSecr=3421233
713 0.207251409 172.31.31.144 -> 172.31.23.72 OpenFlow 187 Type: OFPT_PACKET_OUT
714 0.207306477 172.31.31.144 -> 172.31.23.72 OpenFlow 187 Type: OFPT_PACKET_OUT
715 0.207330534 172.31.23.72 -> 172.31.31.144 TCP 66 48320 → 6633 [ACK] Seq=669 Ack=1077 Win=213 Len=0 TSval=21991359 TSecr=3421233
716 0.207353643 172.31.31.144 -> 172.31.23.72 OpenFlow 187 Type: OFPT_PACKET_OUT
717 0.207377703 172.31.31.144 -> 172.31.23.72 OpenFlow 187 Type: OFPT_PACKET_OUT
718 0.207391875 172.31.31.144 -> 172.31.23.72 OpenFlow 429 Type: OFPT_PACKET_OUT
719 0.207505825 172.31.23.72 -> 172.31.31.144 OpenFlow 189 Type: OFPT_PACKET_IN
720 0.207528725 172.31.23.72 -> 172.31.31.144 OpenFlow 189 Type: OFPT_PACKET_IN
721 0.207547088 172.31.23.72 -> 172.31.31.144 OpenFlow 189 Type: OFPT_PACKET_IN
722 0.207553007 172.31.31.144 -> 172.31.23.72 OpenFlow 187 Type: OFPT_PACKET_OUT
723 0.207644721 172.31.31.144 -> 172.31.23.72 TCP 66 6633 → 48366 [ACK] Seq=2367 Ack=951 Win=853 Len=0 TSval=3421233 TSecr=21991359
724 0.207699040 172.31.31.144 -> 172.31.23.72 TCP 66 6633 → 48322 [ACK] Seq=1457 Ack=915 Win=853 Len=0 TSval=3421233 TSecr=21991359
725 0.207711834 172.31.31.144 -> 172.31.23.72 OpenFlow 187 Type: OFPT_PACKET_OUT
726 0.207730703 172.31.31.144 -> 172.31.23.72 TCP 66 6633 → 48364 [ACK] Seq=2001 Ack=939 Win=853 Len=0 TSval=3421233 TSecr=21991359
727 0.207752648 172.31.23.72 -> 172.31.31.144 TCP 66 48362 → 6633 [ACK] Seq=747 Ack=1185 Win=213 Len=0 TSval=21991359 TSecr=3421233
728 0.207798103 172.31.31.144 -> 172.31.23.72 OpenFlow 187 Type: OFPT_PACKET_OUT
729 0.207867073 172.31.31.144 -> 172.31.23.72 OpenFlow 187 Type: OFPT_PACKET_OUT
730 0.207884029 172.31.23.72 -> 172.31.31.144 TCP 66 48320 → 6633 [ACK] Seq=669 Ack=1319 Win=213 Len=0 TSval=21991359 TSecr=3421233
731 0.207946250 172.31.31.144 -> 172.31.23.72 OpenFlow 187 Type: OFPT_PACKET_OUT
732 0.208008168 172.31.31.144 -> 172.31.23.72 OpenFlow 187 Type: OFPT_PACKET_OUT
733 0.208124237 172.31.23.72 -> 172.31.31.144 TCP 66 48360 → 6633 [ACK] Seq=739 Ack=606 Win=213 Len=0 TSval=21991359 TSecr=3421233
734 0.208143993 172.31.31.144 -> 172.31.23.72 OpenFlow 187 Type: OFPT_PACKET_OUT
735 0.208229573 172.31.31.144 -> 172.31.23.72 OpenFlow 187 Type: OFPT_PACKET_OUT
736 0.208264062 172.31.23.72 -> 172.31.31.144 OpenFlow 189 Type: OFPT_PACKET_IN
737 0.208286465 172.31.23.72 -> 172.31.31.144 OpenFlow 189 Type: OFPT_PACKET_IN
738 0.208316113 172.31.23.72 -> 172.31.31.144 OpenFlow 189 Type: OFPT_PACKET_IN
739 0.208334193 172.31.31.144 -> 172.31.23.72 OpenFlow 187 Type: OFPT_PACKET_OUT
740 0.208339490 172.31.23.72 -> 172.31.31.144 OpenFlow 189 Type: OFPT_PACKET_IN
741 0.208357574 172.31.23.72 -> 172.31.31.144 OpenFlow 189 Type: OFPT_PACKET_IN
742 0.208379976 172.31.23.72 -> 172.31.31.144 OpenFlow 189 Type: OFPT_PACKET_IN
743 0.208404600 172.31.23.72 -> 172.31.31.144 OpenFlow 189 Type: OFPT_PACKET_IN
744 0.208425330 172.31.23.72 -> 172.31.31.144 OpenFlow 189 Type: OFPT_PACKET_IN
745 0.208439865 172.31.23.72 -> 172.31.31.144 OpenFlow 189 Type: OFPT_PACKET_IN
746 0.208448612 172.31.31.144 -> 172.31.23.72 TCP 66 6633 → 48358 [ACK] Seq=969 Ack=370 Win=853 Len=0 TSval=3421234 TSecr=21991359
747 0.208452252 172.31.31.144 -> 172.31.23.72 OpenFlow 187 Type: OFPT_PACKET_OUT
748 0.208474320 172.31.23.72 -> 172.31.31.144 OpenFlow 189 Type: OFPT_PACKET_IN
749 0.208503577 172.31.31.144 -> 172.31.23.72 TCP 66 6633 → 48358 [ACK] Seq=969 Ack=493 Win=853 Len=0 TSval=3421234 TSecr=21991359
750 0.208519499 172.31.31.144 -> 172.31.23.72 TCP 66 6633 → 48330 [ACK] Seq=2187 Ack=1337 Win=853 Len=0 TSval=3421234 TSecr=21991359
751 0.208522310 172.31.31.144 -> 172.31.23.72 TCP 66 6633 → 48350 [ACK] Seq=1643 Ack=755 Win=853 Len=0 TSval=3421234 TSecr=21991359
752 0.208547458 172.31.31.144 -> 172.31.23.72 OpenFlow 187 Type: OFPT_PACKET_OUT
753 0.208565081 172.31.23.72 -> 172.31.31.144 TCP 66 48360 → 6633 [ACK] Seq=739 Ack=969 Win=213 Len=0 TSval=21991359 TSecr=3421234
754 0.208631513 172.31.31.144 -> 172.31.23.72 TCP 66 6633 → 48362 [ACK] Seq=1185 Ack=993 Win=853 Len=0 TSval=3421234 TSecr=21991359
755 0.208647884 172.31.31.144 -> 172.31.23.72 OpenFlow 187 Type: OFPT_PACKET_OUT
756 0.208732301 172.31.23.72 -> 172.31.31.144 TCP 66 48354 → 6633 [ACK] Seq=1667 Ack=1420 Win=213 Len=0 TSval=21991359 TSecr=3421234
757 0.208795464 172.31.31.144 -> 172.31.23.72 OpenFlow 187 Type: OFPT_PACKET_OUT
758 0.208888066 172.31.31.144 -> 172.31.23.72 TCP 66 6633 → 48352 [ACK] Seq=2243 Ack=1185 Win=853 Len=0 TSval=3421234 TSecr=21991359
759 0.208916865 172.31.23.72 -> 172.31.31.144 OpenFlow 189 Type: OFPT_PACKET_IN
760 0.208939182 172.31.23.72 -> 172.31.31.144 OpenFlow 189 Type: OFPT_PACKET_IN
761 0.208966385 172.31.23.72 -> 172.31.31.144 OpenFlow 189 Type: OFPT_PACKET_IN
762 0.208993525 172.31.31.144 -> 172.31.23.72 OpenFlow 187 Type: OFPT_PACKET_OUT
763 0.209005878 172.31.23.72 -> 172.31.31.144 OpenFlow 189 Type: OFPT_PACKET_IN
764 0.209049932 172.31.31.144 -> 172.31.23.72 OpenFlow 187 Type: OFPT_PACKET_OUT
765 0.209069315 172.31.23.72 -> 172.31.31.144 OpenFlow 189 Type: OFPT_PACKET_IN
766 0.209116785 172.31.31.144 -> 172.31.23.72 TCP 66 6633 → 48350 [ACK] Seq=1643 Ack=1001 Win=853 Len=0 TSval=3421234 TSecr=21991359
767 0.209121608 172.31.31.144 -> 172.31.23.72 OpenFlow 187 Type: OFPT_PACKET_OUT
768 0.209229687 172.31.31.144 -> 172.31.23.72 OpenFlow 187 Type: OFPT_PACKET_OUT
769 0.209257753 172.31.31.144 -> 172.31.23.72 TCP 66 6633 → 48352 [ACK] Seq=2243 Ack=1431 Win=853 Len=0 TSval=3421234 TSecr=21991359
770 0.209320298 172.31.31.144 -> 172.31.23.72 OpenFlow 187 Type: OFPT_PACKET_OUT
771 0.209376227 172.31.23.72 -> 172.31.31.144 TCP 66 48348 → 6633 [ACK] Seq=739 Ack=606 Win=213 Len=0 TSval=21991360 TSecr=3421234
772 0.209437832 172.31.31.144 -> 172.31.23.72 OpenFlow 187 Type: OFPT_PACKET_OUT
773 0.209519967 172.31.23.72 -> 172.31.31.144 OpenFlow 189 Type: OFPT_PACKET_IN
774 0.209530589 172.31.31.144 -> 172.31.23.72 OpenFlow 187 Type: OFPT_PACKET_OUT
775 0.209563663 172.31.23.72 -> 172.31.31.144 OpenFlow 189 Type: OFPT_PACKET_IN
776 0.209586469 172.31.23.72 -> 172.31.31.144 OpenFlow 189 Type: OFPT_PACKET_IN
777 0.209600350 172.31.23.72 -> 172.31.31.144 OpenFlow 189 Type: OFPT_PACKET_IN
778 0.209608926 172.31.31.144 -> 172.31.23.72 OpenFlow 187 Type: OFPT_PACKET_OUT
779 0.209634090 172.31.23.72 -> 172.31.31.144 OpenFlow 189 Type: OFPT_PACKET_IN
780 0.209659718 172.31.23.72 -> 172.31.31.144 OpenFlow 189 Type: OFPT_PACKET_IN
781 0.209677582 172.31.31.144 -> 172.31.23.72 TCP 66 6633 → 48358 [ACK] Seq=969 Ack=616 Win=853 Len=0 TSval=3421234 TSecr=21991360
782 0.209702592 172.31.31.144 -> 172.31.23.72 OpenFlow 187 Type: OFPT_PACKET_OUT
783 0.209764606 172.31.31.144 -> 172.31.23.72 OpenFlow 187 Type: OFPT_PACKET_OUT
784 0.209781351 172.31.31.144 -> 172.31.23.72 TCP 66 6633 → 48340 [ACK] Seq=1427 Ack=1239 Win=853 Len=0 TSval=3421234 TSecr=21991360
785 0.209800569 172.31.31.144 -> 172.31.23.72 TCP 66 6633 → 48350 [ACK] Seq=1643 Ack=1247 Win=853 Len=0 TSval=3421234 TSecr=21991360
786 0.209820866 172.31.31.144 -> 172.31.23.72 TCP 66 6633 → 48366 [ACK] Seq=2367 Ack=1197 Win=853 Len=0 TSval=3421234 TSecr=21991360
787 0.209870908 172.31.31.144 -> 172.31.23.72 OpenFlow 187 Type: OFPT_PACKET_OUT
788 0.209977237 172.31.23.72 -> 172.31.31.144 TCP 66 48332 → 6633 [ACK] Seq=1161 Ack=990 Win=213 Len=0 TSval=21991360 TSecr=3421234
789 0.210058400 172.31.31.144 -> 172.31.23.72 OpenFlow 187 Type: OFPT_PACKET_OUT
790 0.210116804 172.31.23.72 -> 172.31.31.144 OpenFlow 189 Type: OFPT_PACKET_IN
791 0.210155279 172.31.23.72 -> 172.31.31.144 OpenFlow 189 Type: OFPT_PACKET_IN
792 0.210170168 172.31.23.72 -> 172.31.31.144 OpenFlow 189 Type: OFPT_PACKET_IN
793 0.210178236 172.31.31.144 -> 172.31.23.72 OpenFlow 187 Type: OFPT_PACKET_OUT
794 0.210204200 172.31.23.72 -> 172.31.31.144 OpenFlow 189 Type: OFPT_PACKET_IN
795 0.210218144 172.31.23.72 -> 172.31.31.144 OpenFlow 189 Type: OFPT_PACKET_IN
796 0.210248333 172.31.23.72 -> 172.31.31.144 OpenFlow 189 Type: OFPT_PACKET_IN
797 0.210273263 172.31.31.144 -> 172.31.23.72 OpenFlow 187 Type: OFPT_PACKET_OUT
798 0.210276000 172.31.31.144 -> 172.31.23.72 TCP 66 6633 → 48358 [ACK] Seq=969 Ack=739 Win=853 Len=0 TSval=3421234 TSecr=21991360
799 0.210318378 172.31.31.144 -> 172.31.23.72 OpenFlow 187 Type: OFPT_PACKET_OUT
800 0.210364390 172.31.31.144 -> 172.31.23.72 TCP 66 6633 → 48324 [ACK] Seq=1803 Ack=792 Win=853 Len=0 TSval=3421234 TSecr=21991360
801 0.210383476 172.31.31.144 -> 172.31.23.72 OpenFlow 187 Type: OFPT_PACKET_OUT
802 0.210478231 172.31.31.144 -> 172.31.23.72 OpenFlow 187 Type: OFPT_PACKET_OUT
803 0.210504898 172.31.23.72 -> 172.31.31.144 TCP 66 48332 → 6633 [ACK] Seq=1161 Ack=1595 Win=213 Len=0 TSval=21991360 TSecr=3421234
804 0.210520674 172.31.31.144 -> 172.31.23.72 TCP 66 6633 → 48330 [ACK] Seq=2187 Ack=1583 Win=853 Len=0 TSval=3421234 TSecr=21991360
805 0.210578485 172.31.23.72 -> 172.31.31.144 OpenFlow 189 Type: OFPT_PACKET_IN
806 0.210597256 172.31.31.144 -> 172.31.23.72 TCP 66 6633 → 48334 [ACK] Seq=2079 Ack=1259 Win=853 Len=0 TSval=3421234 TSecr=21991360
807 0.210604632 172.31.23.72 -> 172.31.31.144 OpenFlow 189 Type: OFPT_PACKET_IN
808 0.210747964 172.31.31.144 -> 172.31.23.72 TCP 66 6633 → 48328 [ACK] Seq=122 Ack=739 Win=853 Len=0 TSval=3421234 TSecr=21991360
809 0.210765780 172.31.23.72 -> 172.31.31.144 OpenFlow 189 Type: OFPT_PACKET_IN
810 0.210788079 172.31.23.72 -> 172.31.31.144 OpenFlow 189 Type: OFPT_PACKET_IN
811 0.210806337 172.31.23.72 -> 172.31.31.144 OpenFlow 189 Type: OFPT_PACKET_IN
812 0.210833764 172.31.23.72 -> 172.31.31.144 OpenFlow 189 Type: OFPT_PACKET_IN
813 0.210971191 172.31.31.144 -> 172.31.23.72 TCP 66 6633 → 48324 [ACK] Seq=1803 Ack=1038 Win=853 Len=0 TSval=3421234 TSecr=21991360
814 0.210987285 172.31.31.144 -> 172.31.23.72 TCP 66 6633 → 48336 [ACK] Seq=2083 Ack=1583 Win=853 Len=0 TSval=3421234 TSecr=21991360
815 0.211126572 172.31.31.144 -> 172.31.23.72 OpenFlow 187 Type: OFPT_PACKET_OUT
816 0.211168108 172.31.31.144 -> 172.31.23.72 OpenFlow 550 Type: OFPT_PACKET_OUT
817 0.211420292 172.31.23.72 -> 172.31.31.144 TCP 66 48328 → 6633 [ACK] Seq=739 Ack=727 Win=213 Len=0 TSval=21991360 TSecr=3421234
818 0.211557371 172.31.23.72 -> 172.31.31.144 OpenFlow 189 Type: OFPT_PACKET_IN
819 0.211582306 172.31.23.72 -> 172.31.31.144 OpenFlow 189 Type: OFPT_PACKET_IN
820 0.211596359 172.31.23.72 -> 172.31.31.144 OpenFlow 189 Type: OFPT_PACKET_IN
821 0.211662054 172.31.23.72 -> 172.31.31.144 OpenFlow 189 Type: OFPT_PACKET_IN
822 0.211683691 172.31.23.72 -> 172.31.31.144 OpenFlow 189 Type: OFPT_PACKET_IN
823 0.211816284 172.31.31.144 -> 172.31.23.72 TCP 66 6633 → 48324 [ACK] Seq=1803 Ack=1161 Win=853 Len=0 TSval=3421234 TSecr=21991360
824 0.211840046 172.31.31.144 -> 172.31.23.72 TCP 66 6633 → 48326 [ACK] Seq=1841 Ack=1091 Win=853 Len=0 TSval=3421234 TSecr=21991360
825 0.211858630 172.31.31.144 -> 172.31.23.72 TCP 66 6633 → 48332 [ACK] Seq=1595 Ack=1407 Win=853 Len=0 TSval=3421234 TSecr=21991360
826 0.245015696 172.31.23.72 -> 172.31.31.144 TCP 66 48354 → 6633 [ACK] Seq=1667 Ack=1541 Win=213 Len=0 TSval=21991369 TSecr=3421234
827 0.249027909 172.31.23.72 -> 172.31.31.144 TCP 66 48348 → 6633 [ACK] Seq=739 Ack=727 Win=213 Len=0 TSval=21991370 TSecr=3421234
