  1 0.000000000 172.31.31.144 -> 172.31.23.72 TCP 187 6633 → 45452 [PSH, ACK] Seq=1 Ack=1 Win=853 Len=121 TSval=808307 TSecr=19377850
  2 0.000462910 172.31.23.72 -> 172.31.31.144 OpenFlow 189 Type: OFPT_PACKET_IN
  3 0.001885626 172.31.31.144 -> 172.31.23.72 TCP 187 6633 → 45452 [PSH, ACK] Seq=122 Ack=1 Win=853 Len=121 TSval=808307 TSecr=19377850
  4 0.001893842 172.31.31.144 -> 172.31.23.72 TCP 187 6633 → 45452 [PSH, ACK] Seq=243 Ack=1 Win=853 Len=121 TSval=808307 TSecr=19377850
  5 0.001897480 172.31.31.144 -> 172.31.23.72 TCP 187 6633 → 45452 [PSH, ACK] Seq=364 Ack=1 Win=853 Len=121 TSval=808307 TSecr=19377850
  6 0.001899281 172.31.31.144 -> 172.31.23.72 TCP 187 6633 → 45452 [PSH, ACK] Seq=485 Ack=1 Win=853 Len=121 TSval=808307 TSecr=19377850
  7 0.001900913 172.31.31.144 -> 172.31.23.72 TCP 187 6633 → 45452 [PSH, ACK] Seq=606 Ack=1 Win=853 Len=121 TSval=808307 TSecr=19377850
  8 0.001902314 172.31.31.144 -> 172.31.23.72 TCP 187 6633 → 45452 [PSH, ACK] Seq=727 Ack=1 Win=853 Len=121 TSval=808307 TSecr=19377850
  9 0.001903682 172.31.31.144 -> 172.31.23.72 TCP 187 6633 → 45452 [PSH, ACK] Seq=848 Ack=1 Win=853 Len=121 TSval=808307 TSecr=19377850
 10 0.001904961 172.31.31.144 -> 172.31.23.72 TCP 187 6633 → 45462 [PSH, ACK] Seq=1 Ack=1 Win=853 Len=121 TSval=808307 TSecr=19378001
 11 0.001908509 172.31.31.144 -> 172.31.23.72 TCP 187 6633 → 45462 [PSH, ACK] Seq=122 Ack=1 Win=853 Len=121 TSval=808307 TSecr=19378001
 12 0.001910175 172.31.31.144 -> 172.31.23.72 TCP 187 6633 → 45462 [PSH, ACK] Seq=243 Ack=1 Win=853 Len=121 TSval=808307 TSecr=19378001
 13 0.001911971 172.31.31.144 -> 172.31.23.72 TCP 187 6633 → 45462 [PSH, ACK] Seq=364 Ack=1 Win=853 Len=121 TSval=808307 TSecr=19378001
 14 0.001913764 172.31.31.144 -> 172.31.23.72 TCP 187 6633 → 45462 [PSH, ACK] Seq=485 Ack=1 Win=853 Len=121 TSval=808307 TSecr=19378001
 15 0.001915118 172.31.31.144 -> 172.31.23.72 TCP 187 6633 → 45462 [PSH, ACK] Seq=606 Ack=1 Win=853 Len=121 TSval=808307 TSecr=19378001
 16 0.001916351 172.31.31.144 -> 172.31.23.72 TCP 187 6633 → 45436 [PSH, ACK] Seq=1 Ack=1 Win=853 Len=121 TSval=808307 TSecr=19377750
 17 0.001919088 172.31.31.144 -> 172.31.23.72 TCP 187 6633 → 45436 [PSH, ACK] Seq=122 Ack=1 Win=853 Len=121 TSval=808307 TSecr=19377750
 18 0.001920790 172.31.31.144 -> 172.31.23.72 TCP 187 6633 → 45436 [PSH, ACK] Seq=243 Ack=1 Win=853 Len=121 TSval=808307 TSecr=19377750
 19 0.001922665 172.31.31.144 -> 172.31.23.72 TCP 187 6633 → 45436 [PSH, ACK] Seq=364 Ack=1 Win=853 Len=121 TSval=808307 TSecr=19377750
 20 0.001924160 172.31.31.144 -> 172.31.23.72 TCP 187 6633 → 45436 [PSH, ACK] Seq=485 Ack=1 Win=853 Len=121 TSval=808307 TSecr=19377750
 21 0.001925575 172.31.31.144 -> 172.31.23.72 TCP 187 6633 → 45436 [PSH, ACK] Seq=606 Ack=1 Win=853 Len=121 TSval=808307 TSecr=19377750
 22 0.001927116 172.31.31.144 -> 172.31.23.72 TCP 187 6633 → 45436 [PSH, ACK] Seq=727 Ack=1 Win=853 Len=121 TSval=808307 TSecr=19377750
 23 0.001929078 172.31.31.144 -> 172.31.23.72 TCP 187 6633 → 45436 [PSH, ACK] Seq=848 Ack=1 Win=853 Len=121 TSval=808307 TSecr=19377750
 24 0.002178218 172.31.23.72 -> 172.31.31.144 TCP 66 45452 → 6633 [ACK] Seq=1 Ack=969 Win=213 Len=0 TSval=19378432 TSecr=808307
 25 0.002433798 172.31.23.72 -> 172.31.31.144 TCP 66 45462 → 6633 [ACK] Seq=1 Ack=727 Win=213 Len=0 TSval=19378432 TSecr=808307
 26 0.002764363 172.31.23.72 -> 172.31.31.144 TCP 66 45436 → 6633 [ACK] Seq=1 Ack=969 Win=213 Len=0 TSval=19378432 TSecr=808307
 27 0.002827699 172.31.23.72 -> 172.31.31.144 OpenFlow 189 Type: OFPT_PACKET_IN
 28 0.002852470 172.31.23.72 -> 172.31.31.144 OpenFlow 189 Type: OFPT_PACKET_IN
 29 0.002865587 172.31.23.72 -> 172.31.31.144 OpenFlow 189 Type: OFPT_PACKET_IN
 30 0.002881829 172.31.23.72 -> 172.31.31.144 OpenFlow 189 Type: OFPT_PACKET_IN
 31 0.002893266 172.31.23.72 -> 172.31.31.144 OpenFlow 189 Type: OFPT_PACKET_IN
 32 0.002930130 172.31.23.72 -> 172.31.31.144 OpenFlow 189 Type: OFPT_PACKET_IN
 33 0.002957336 172.31.23.72 -> 172.31.31.144 OpenFlow 189 Type: OFPT_PACKET_IN
 34 0.002970210 172.31.23.72 -> 172.31.31.144 OpenFlow 189 Type: OFPT_PACKET_IN
 35 0.002983218 172.31.23.72 -> 172.31.31.144 OpenFlow 189 Type: OFPT_PACKET_IN
 36 0.003483674 172.31.31.144 -> 172.31.23.72 TCP 66 6633 → 45450 [ACK] Seq=1 Ack=124 Win=853 Len=0 TSval=808307 TSecr=19378432
 37 0.003663670 172.31.23.72 -> 172.31.31.144 OpenFlow 189 Type: OFPT_PACKET_IN
 38 0.003677712 172.31.23.72 -> 172.31.31.144 OpenFlow 189 Type: OFPT_PACKET_IN
 39 0.003679778 172.31.23.72 -> 172.31.31.144 OpenFlow 435 Type: OFPT_PACKET_IN
 40 0.003813351 172.31.23.72 -> 172.31.31.144 OpenFlow 189 Type: OFPT_PACKET_IN
 41 0.003815287 172.31.23.72 -> 172.31.31.144 OpenFlow 189 Type: OFPT_PACKET_IN
 42 0.003816881 172.31.23.72 -> 172.31.31.144 OpenFlow 189 Type: OFPT_PACKET_IN
 43 0.003818565 172.31.23.72 -> 172.31.31.144 OpenFlow 189 Type: OFPT_PACKET_IN
 44 0.003820417 172.31.23.72 -> 172.31.31.144 OpenFlow 189 Type: OFPT_PACKET_IN
 45 0.003897005 172.31.31.144 -> 172.31.23.72 TCP 66 6633 → 45434 [ACK] Seq=1 Ack=124 Win=853 Len=0 TSval=808308 TSecr=19378432
 46 0.003900303 172.31.31.144 -> 172.31.23.72 TCP 66 6633 → 45444 [ACK] Seq=1 Ack=124 Win=853 Len=0 TSval=808308 TSecr=19378432
 47 0.003902469 172.31.31.144 -> 172.31.23.72 TCP 66 6633 → 45450 [ACK] Seq=1 Ack=247 Win=853 Len=0 TSval=808308 TSecr=19378432
 48 0.006342836 172.31.31.144 -> 172.31.23.72 TCP 66 6633 → 45432 [ACK] Seq=1 Ack=124 Win=853 Len=0 TSval=808308 TSecr=19378432
 49 0.006360069 172.31.31.144 -> 172.31.23.72 TCP 66 6633 → 45454 [ACK] Seq=1 Ack=124 Win=853 Len=0 TSval=808308 TSecr=19378432
 50 0.006362249 172.31.31.144 -> 172.31.23.72 TCP 66 6633 → 45442 [ACK] Seq=1 Ack=124 Win=853 Len=0 TSval=808308 TSecr=19378432
 51 0.006364339 172.31.31.144 -> 172.31.23.72 TCP 66 6633 → 45434 [ACK] Seq=1 Ack=247 Win=853 Len=0 TSval=808308 TSecr=19378432
 52 0.006366429 172.31.31.144 -> 172.31.23.72 TCP 66 6633 → 45444 [ACK] Seq=1 Ack=247 Win=853 Len=0 TSval=808308 TSecr=19378432
 53 0.006368604 172.31.31.144 -> 172.31.23.72 TCP 66 6633 → 45438 [ACK] Seq=1 Ack=493 Win=853 Len=0 TSval=808308 TSecr=19378432
 54 0.006370873 172.31.31.144 -> 172.31.23.72 TCP 66 6633 → 45430 [ACK] Seq=1 Ack=247 Win=853 Len=0 TSval=808308 TSecr=19378432
 55 0.006373194 172.31.31.144 -> 172.31.23.72 TCP 66 6633 → 45432 [ACK] Seq=1 Ack=247 Win=853 Len=0 TSval=808308 TSecr=19378432
 56 0.006374855 172.31.31.144 -> 172.31.23.72 TCP 66 6633 → 45454 [ACK] Seq=1 Ack=247 Win=853 Len=0 TSval=808308 TSecr=19378432
 57 0.006376995 172.31.31.144 -> 172.31.23.72 TCP 66 6633 → 45448 [ACK] Seq=1 Ack=247 Win=853 Len=0 TSval=808308 TSecr=19378432
 58 0.006379263 172.31.31.144 -> 172.31.23.72 TCP 66 6633 → 45442 [ACK] Seq=1 Ack=247 Win=853 Len=0 TSval=808308 TSecr=19378432
 59 0.098990039 172.31.31.144 -> 172.31.23.72 TCP 187 6633 → 45420 [PSH, ACK] Seq=1 Ack=1 Win=853 Len=121 TSval=808331 TSecr=19377731
 60 0.099037578 172.31.31.144 -> 172.31.23.72 TCP 187 6633 → 45420 [PSH, ACK] Seq=122 Ack=1 Win=853 Len=121 TSval=808332 TSecr=19377731
 61 0.099091947 172.31.31.144 -> 172.31.23.72 TCP 187 6633 → 45420 [PSH, ACK] Seq=243 Ack=1 Win=853 Len=121 TSval=808332 TSecr=19377731
 62 0.099136633 172.31.31.144 -> 172.31.23.72 TCP 187 6633 → 45420 [PSH, ACK] Seq=364 Ack=1 Win=853 Len=121 TSval=808332 TSecr=19377731
 63 0.099196100 172.31.31.144 -> 172.31.23.72 TCP 187 6633 → 45420 [PSH, ACK] Seq=485 Ack=1 Win=853 Len=121 TSval=808332 TSecr=19377731
 64 0.099257787 172.31.31.144 -> 172.31.23.72 TCP 187 6633 → 45420 [PSH, ACK] Seq=606 Ack=1 Win=853 Len=121 TSval=808332 TSecr=19377731
 65 0.099344205 172.31.31.144 -> 172.31.23.72 TCP 187 6633 → 45420 [PSH, ACK] Seq=727 Ack=1 Win=853 Len=121 TSval=808332 TSecr=19377731
 66 0.099425192 172.31.31.144 -> 172.31.23.72 TCP 187 6633 → 45420 [PSH, ACK] Seq=848 Ack=1 Win=853 Len=121 TSval=808332 TSecr=19377731
 67 0.099534092 172.31.31.144 -> 172.31.23.72 TCP 187 6633 → 45424 [PSH, ACK] Seq=1 Ack=1 Win=853 Len=121 TSval=808332 TSecr=19377731
 68 0.099560771 172.31.31.144 -> 172.31.23.72 TCP 187 6633 → 45424 [PSH, ACK] Seq=122 Ack=1 Win=853 Len=121 TSval=808332 TSecr=19377731
 69 0.099607317 172.31.31.144 -> 172.31.23.72 TCP 187 6633 → 45424 [PSH, ACK] Seq=243 Ack=1 Win=853 Len=121 TSval=808332 TSecr=19377731
 70 0.099668242 172.31.31.144 -> 172.31.23.72 TCP 187 6633 → 45424 [PSH, ACK] Seq=364 Ack=1 Win=853 Len=121 TSval=808332 TSecr=19377731
 71 0.099680535 172.31.23.72 -> 172.31.31.144 TCP 66 45420 → 6633 [ACK] Seq=1 Ack=969 Win=213 Len=0 TSval=19378456 TSecr=808331
 72 0.099790730 172.31.31.144 -> 172.31.23.72 TCP 187 6633 → 45424 [PSH, ACK] Seq=485 Ack=1 Win=853 Len=121 TSval=808332 TSecr=19377731
 73 0.099795426 172.31.31.144 -> 172.31.23.72 TCP 187 6633 → 45424 [PSH, ACK] Seq=606 Ack=1 Win=853 Len=121 TSval=808332 TSecr=19377731
 74 0.099842056 172.31.31.144 -> 172.31.23.72 TCP 187 6633 → 45424 [PSH, ACK] Seq=727 Ack=1 Win=853 Len=121 TSval=808332 TSecr=19377731
 75 0.099903114 172.31.31.144 -> 172.31.23.72 TCP 187 6633 → 45424 [PSH, ACK] Seq=848 Ack=1 Win=853 Len=121 TSval=808332 TSecr=19377731
 76 0.099977901 172.31.31.144 -> 172.31.23.72 TCP 187 6633 → 45424 [PSH, ACK] Seq=969 Ack=1 Win=853 Len=121 TSval=808332 TSecr=19377731
 77 0.100023531 172.31.31.144 -> 172.31.23.72 TCP 187 6633 → 45424 [PSH, ACK] Seq=1090 Ack=1 Win=853 Len=121 TSval=808332 TSecr=19377731
 78 0.100093589 172.31.31.144 -> 172.31.23.72 OpenFlow 187 Type: OFPT_PACKET_OUT
 79 0.100151619 172.31.31.144 -> 172.31.23.72 OpenFlow 187 Type: OFPT_PACKET_OUT
 80 0.100208511 172.31.31.144 -> 172.31.23.72 OpenFlow 187 Type: OFPT_PACKET_OUT
 81 0.100252373 172.31.23.72 -> 172.31.31.144 TCP 66 45424 → 6633 [ACK] Seq=1 Ack=1211 Win=213 Len=0 TSval=19378457 TSecr=808332
 82 0.100289549 172.31.31.144 -> 172.31.23.72 OpenFlow 187 Type: OFPT_PACKET_OUT
 83 0.100332397 172.31.31.144 -> 172.31.23.72 OpenFlow 187 Type: OFPT_PACKET_OUT
 84 0.100350690 172.31.23.72 -> 172.31.31.144 OpenFlow 189 Type: OFPT_PACKET_IN
 85 0.100379647 172.31.23.72 -> 172.31.31.144 OpenFlow 189 Type: OFPT_PACKET_IN
 86 0.100415284 172.31.23.72 -> 172.31.31.144 OpenFlow 189 Type: OFPT_PACKET_IN
 87 0.100422844 172.31.31.144 -> 172.31.23.72 OpenFlow 187 Type: OFPT_PACKET_OUT
 88 0.100442076 172.31.23.72 -> 172.31.31.144 OpenFlow 189 Type: OFPT_PACKET_IN
 89 0.100463830 172.31.23.72 -> 172.31.31.144 OpenFlow 189 Type: OFPT_PACKET_IN
 90 0.100466185 172.31.23.72 -> 172.31.31.144 OpenFlow 189 Type: OFPT_PACKET_IN
 91 0.100496673 172.31.31.144 -> 172.31.23.72 OpenFlow 187 Type: OFPT_PACKET_OUT
 92 0.100500216 172.31.31.144 -> 172.31.23.72 OpenFlow 187 Type: OFPT_PACKET_OUT
 93 0.100521793 172.31.23.72 -> 172.31.31.144 OpenFlow 189 Type: OFPT_PACKET_IN
 94 0.100527890 172.31.23.72 -> 172.31.31.144 OpenFlow 189 Type: OFPT_PACKET_IN
 95 0.100561057 172.31.23.72 -> 172.31.31.144 OpenFlow 189 Type: OFPT_PACKET_IN
 96 0.100563667 172.31.23.72 -> 172.31.31.144 OpenFlow 189 Type: OFPT_PACKET_IN
 97 0.100578409 172.31.23.72 -> 172.31.31.144 OpenFlow 189 Type: OFPT_PACKET_IN
 98 0.100597079 172.31.31.144 -> 172.31.23.72 OpenFlow 187 Type: OFPT_PACKET_OUT
 99 0.100670620 172.31.23.72 -> 172.31.31.144 OpenFlow 189 Type: OFPT_PACKET_IN
100 0.100677439 172.31.23.72 -> 172.31.31.144 OpenFlow 189 Type: OFPT_PACKET_IN
101 0.100725670 172.31.23.72 -> 172.31.31.144 OpenFlow 189 Type: OFPT_PACKET_IN
102 0.100774320 172.31.31.144 -> 172.31.23.72 TCP 66 6633 → 45418 [ACK] Seq=1 Ack=247 Win=853 Len=0 TSval=808332 TSecr=19378457
103 0.100782263 172.31.31.144 -> 172.31.23.72 OpenFlow 187 Type: OFPT_PACKET_OUT
104 0.100786448 172.31.23.72 -> 172.31.31.144 OpenFlow 189 Type: OFPT_PACKET_IN
105 0.100792592 172.31.31.144 -> 172.31.23.72 TCP 66 6633 → 45430 [ACK] Seq=1 Ack=493 Win=853 Len=0 TSval=808332 TSecr=19378457
106 0.100795117 172.31.31.144 -> 172.31.23.72 TCP 66 6633 → 45414 [ACK] Seq=1 Ack=124 Win=853 Len=0 TSval=808332 TSecr=19378457
107 0.100800681 172.31.23.72 -> 172.31.31.144 OpenFlow 189 Type: OFPT_PACKET_IN
108 0.100939452 172.31.31.144 -> 172.31.23.72 TCP 66 6633 → 45422 [ACK] Seq=1 Ack=124 Win=853 Len=0 TSval=808332 TSecr=19378457
109 0.100950110 172.31.31.144 -> 172.31.23.72 TCP 66 6633 → 45414 [ACK] Seq=1 Ack=247 Win=853 Len=0 TSval=808332 TSecr=19378457
110 0.101058426 172.31.31.144 -> 172.31.23.72 TCP 66 6633 → 45416 [ACK] Seq=1 Ack=247 Win=853 Len=0 TSval=808332 TSecr=19378457
111 0.101064365 172.31.31.144 -> 172.31.23.72 TCP 66 6633 → 45422 [ACK] Seq=1 Ack=247 Win=853 Len=0 TSval=808332 TSecr=19378457
112 0.101066244 172.31.31.144 -> 172.31.23.72 TCP 66 6633 → 45434 [ACK] Seq=1211 Ack=493 Win=853 Len=0 TSval=808332 TSecr=19378457
113 0.101125025 172.31.31.144 -> 172.31.23.72 TCP 66 6633 → 45428 [ACK] Seq=1 Ack=247 Win=853 Len=0 TSval=808332 TSecr=19378457
114 0.101207276 172.31.31.144 -> 172.31.23.72 TCP 66 6633 → 45426 [ACK] Seq=1 Ack=247 Win=853 Len=0 TSval=808332 TSecr=19378457
115 0.101311036 172.31.23.72 -> 172.31.31.144 OpenFlow 189 Type: OFPT_PACKET_IN
116 0.101343986 172.31.31.144 -> 172.31.23.72 OpenFlow 187 Type: OFPT_PACKET_OUT
117 0.101351275 172.31.23.72 -> 172.31.31.144 OpenFlow 189 Type: OFPT_PACKET_IN
118 0.101379091 172.31.23.72 -> 172.31.31.144 OpenFlow 189 Type: OFPT_PACKET_IN
119 0.101384350 172.31.31.144 -> 172.31.23.72 OpenFlow 671 Type: OFPT_PACKET_OUT
120 0.101408973 172.31.23.72 -> 172.31.31.144 OpenFlow 189 Type: OFPT_PACKET_IN
121 0.101471596 172.31.23.72 -> 172.31.31.144 OpenFlow 189 Type: OFPT_PACKET_IN
122 0.101476128 172.31.23.72 -> 172.31.31.144 OpenFlow 189 Type: OFPT_PACKET_IN
123 0.101504885 172.31.31.144 -> 172.31.23.72 OpenFlow 187 Type: OFPT_PACKET_OUT
124 0.101520790 172.31.23.72 -> 172.31.31.144 OpenFlow 189 Type: OFPT_PACKET_IN
125 0.101578415 172.31.31.144 -> 172.31.23.72 TCP 66 6633 → 45450 [ACK] Seq=1 Ack=370 Win=853 Len=0 TSval=808332 TSecr=19378457
126 0.101583410 172.31.31.144 -> 172.31.23.72 OpenFlow 187 Type: OFPT_PACKET_OUT
127 0.101588721 172.31.23.72 -> 172.31.31.144 OpenFlow 189 Type: OFPT_PACKET_IN
128 0.101612143 172.31.31.144 -> 172.31.23.72 TCP 66 6633 → 45424 [ACK] Seq=1211 Ack=247 Win=853 Len=0 TSval=808332 TSecr=19378457
129 0.101656100 172.31.31.144 -> 172.31.23.72 OpenFlow 187 Type: OFPT_PACKET_OUT
130 0.101659675 172.31.31.144 -> 172.31.23.72 TCP 66 6633 → 45450 [ACK] Seq=1 Ack=493 Win=853 Len=0 TSval=808332 TSecr=19378457
131 0.101662231 172.31.31.144 -> 172.31.23.72 OpenFlow 187 Type: OFPT_PACKET_OUT
132 0.101681514 172.31.23.72 -> 172.31.31.144 OpenFlow 189 Type: OFPT_PACKET_IN
133 0.101706552 172.31.23.72 -> 172.31.31.144 OpenFlow 189 Type: OFPT_PACKET_IN
134 0.101750483 172.31.31.144 -> 172.31.23.72 TCP 66 6633 → 45442 [ACK] Seq=1 Ack=370 Win=853 Len=0 TSval=808332 TSecr=19378457
135 0.101755990 172.31.31.144 -> 172.31.23.72 OpenFlow 187 Type: OFPT_PACKET_OUT
136 0.101784648 172.31.31.144 -> 172.31.23.72 TCP 66 6633 → 45442 [ACK] Seq=1 Ack=493 Win=853 Len=0 TSval=808332 TSecr=19378457
137 0.101788457 172.31.31.144 -> 172.31.23.72 TCP 66 6633 → 45430 [ACK] Seq=1 Ack=739 Win=853 Len=0 TSval=808332 TSecr=19378457
138 0.101812553 172.31.31.144 -> 172.31.23.72 OpenFlow 187 Type: OFPT_PACKET_OUT
139 0.101860531 172.31.31.144 -> 172.31.23.72 TCP 66 6633 → 45436 [ACK] Seq=969 Ack=124 Win=853 Len=0 TSval=808332 TSecr=19378457
140 0.101888097 172.31.31.144 -> 172.31.23.72 OpenFlow 187 Type: OFPT_PACKET_OUT
141 0.101917241 172.31.31.144 -> 172.31.23.72 TCP 66 6633 → 45436 [ACK] Seq=969 Ack=247 Win=853 Len=0 TSval=808332 TSecr=19378457
142 0.101987383 172.31.31.144 -> 172.31.23.72 OpenFlow 187 Type: OFPT_PACKET_OUT
143 0.102012082 172.31.31.144 -> 172.31.23.72 OpenFlow 187 Type: OFPT_PACKET_OUT
144 0.102044579 172.31.31.144 -> 172.31.23.72 OpenFlow 187 Type: OFPT_PACKET_OUT
145 0.102136184 172.31.31.144 -> 172.31.23.72 OpenFlow 187 Type: OFPT_PACKET_OUT
146 0.102179295 172.31.23.72 -> 172.31.31.144 TCP 66 45418 → 6633 [ACK] Seq=247 Ack=1211 Win=213 Len=0 TSval=19378457 TSecr=808332
147 0.102364874 172.31.31.144 -> 172.31.23.72 OpenFlow 187 Type: OFPT_PACKET_OUT
148 0.102424379 172.31.31.144 -> 172.31.23.72 OpenFlow 187 Type: OFPT_PACKET_OUT
149 0.102486013 172.31.31.144 -> 172.31.23.72 OpenFlow 187 Type: OFPT_PACKET_OUT
150 0.102591168 172.31.31.144 -> 172.31.23.72 OpenFlow 187 Type: OFPT_PACKET_OUT
151 0.102630424 172.31.31.144 -> 172.31.23.72 OpenFlow 187 Type: OFPT_PACKET_OUT
152 0.102694138 172.31.31.144 -> 172.31.23.72 OpenFlow 187 Type: OFPT_PACKET_OUT
153 0.102713985 172.31.23.72 -> 172.31.31.144 TCP 66 45444 → 6633 [ACK] Seq=247 Ack=1211 Win=213 Len=0 TSval=19378457 TSecr=808332
154 0.102745748 172.31.31.144 -> 172.31.23.72 OpenFlow 187 Type: OFPT_PACKET_OUT
155 0.102806799 172.31.31.144 -> 172.31.23.72 OpenFlow 187 Type: OFPT_PACKET_OUT
156 0.102857865 172.31.31.144 -> 172.31.23.72 OpenFlow 187 Type: OFPT_PACKET_OUT
157 0.102927552 172.31.31.144 -> 172.31.23.72 OpenFlow 187 Type: OFPT_PACKET_OUT
158 0.102992510 172.31.31.144 -> 172.31.23.72 OpenFlow 187 Type: OFPT_PACKET_OUT
159 0.103122994 172.31.31.144 -> 172.31.23.72 OpenFlow 187 Type: OFPT_PACKET_OUT
160 0.103158757 172.31.23.72 -> 172.31.31.144 TCP 66 45438 → 6633 [ACK] Seq=493 Ack=969 Win=213 Len=0 TSval=19378457 TSecr=808332
161 0.103171832 172.31.31.144 -> 172.31.23.72 OpenFlow 187 Type: OFPT_PACKET_OUT
162 0.103250975 172.31.31.144 -> 172.31.23.72 OpenFlow 187 Type: OFPT_PACKET_OUT
163 0.103299531 172.31.31.144 -> 172.31.23.72 OpenFlow 187 Type: OFPT_PACKET_OUT
164 0.103369976 172.31.31.144 -> 172.31.23.72 OpenFlow 187 Type: OFPT_PACKET_OUT
165 0.103392459 172.31.23.72 -> 172.31.31.144 TCP 66 45450 → 6633 [ACK] Seq=493 Ack=606 Win=213 Len=0 TSval=19378457 TSecr=808333
166 0.103455047 172.31.31.144 -> 172.31.23.72 OpenFlow 187 Type: OFPT_PACKET_OUT
167 0.103477581 172.31.23.72 -> 172.31.31.144 OpenFlow 189 Type: OFPT_PACKET_IN
168 0.103496740 172.31.23.72 -> 172.31.31.144 OpenFlow 189 Type: OFPT_PACKET_IN
169 0.103505118 172.31.23.72 -> 172.31.31.144 OpenFlow 189 Type: OFPT_PACKET_IN
170 0.103536141 172.31.23.72 -> 172.31.31.144 OpenFlow 189 Type: OFPT_PACKET_IN
171 0.103553589 172.31.23.72 -> 172.31.31.144 OpenFlow 435 Type: OFPT_PACKET_IN
172 0.103575697 172.31.23.72 -> 172.31.31.144 OpenFlow 189 Type: OFPT_PACKET_IN
173 0.103591924 172.31.23.72 -> 172.31.31.144 OpenFlow 189 Type: OFPT_PACKET_IN
174 0.103606940 172.31.31.144 -> 172.31.23.72 OpenFlow 187 Type: OFPT_PACKET_OUT
175 0.103616170 172.31.23.72 -> 172.31.31.144 OpenFlow 189 Type: OFPT_PACKET_IN
176 0.103621670 172.31.23.72 -> 172.31.31.144 OpenFlow 189 Type: OFPT_PACKET_IN
177 0.103635058 172.31.23.72 -> 172.31.31.144 OpenFlow 189 Type: OFPT_PACKET_IN
178 0.103645849 172.31.23.72 -> 172.31.31.144 OpenFlow 189 Type: OFPT_PACKET_IN
179 0.103729599 172.31.23.72 -> 172.31.31.144 OpenFlow 189 Type: OFPT_PACKET_IN
180 0.103732839 172.31.23.72 -> 172.31.31.144 OpenFlow 189 Type: OFPT_PACKET_IN
181 0.103734912 172.31.23.72 -> 172.31.31.144 OpenFlow 189 Type: OFPT_PACKET_IN
182 0.103750375 172.31.23.72 -> 172.31.31.144 OpenFlow 189 Type: OFPT_PACKET_IN
183 0.103757508 172.31.31.144 -> 172.31.23.72 OpenFlow 187 Type: OFPT_PACKET_OUT
184 0.103761535 172.31.31.144 -> 172.31.23.72 OpenFlow 187 Type: OFPT_PACKET_OUT
185 0.103762946 172.31.31.144 -> 172.31.23.72 OpenFlow 187 Type: OFPT_PACKET_OUT
186 0.103779705 172.31.23.72 -> 172.31.31.144 OpenFlow 189 Type: OFPT_PACKET_IN
187 0.103786107 172.31.23.72 -> 172.31.31.144 OpenFlow 189 Type: OFPT_PACKET_IN
188 0.103802270 172.31.23.72 -> 172.31.31.144 OpenFlow 189 Type: OFPT_PACKET_IN
189 0.103814022 172.31.23.72 -> 172.31.31.144 OpenFlow 189 Type: OFPT_PACKET_IN
190 0.103976680 172.31.23.72 -> 172.31.31.144 OpenFlow 189 Type: OFPT_PACKET_IN
191 0.103979758 172.31.23.72 -> 172.31.31.144 OpenFlow 189 Type: OFPT_PACKET_IN
192 0.103981489 172.31.23.72 -> 172.31.31.144 OpenFlow 189 Type: OFPT_PACKET_IN
193 0.103983023 172.31.23.72 -> 172.31.31.144 OpenFlow 189 Type: OFPT_PACKET_IN
194 0.104034889 172.31.31.144 -> 172.31.23.72 TCP 66 6633 → 45432 [ACK] Seq=1 Ack=370 Win=853 Len=0 TSval=808333 TSecr=19378457
195 0.104041190 172.31.31.144 -> 172.31.23.72 OpenFlow 187 Type: OFPT_PACKET_OUT
196 0.104043084 172.31.31.144 -> 172.31.23.72 OpenFlow 187 Type: OFPT_PACKET_OUT
197 0.104045032 172.31.31.144 -> 172.31.23.72 TCP 66 6633 → 45454 [ACK] Seq=1 Ack=370 Win=853 Len=0 TSval=808333 TSecr=19378457
198 0.104047163 172.31.31.144 -> 172.31.23.72 OpenFlow 187 Type: OFPT_PACKET_OUT
199 0.104048720 172.31.31.144 -> 172.31.23.72 TCP 66 6633 → 45442 [ACK] Seq=1 Ack=616 Win=853 Len=0 TSval=808333 TSecr=19378457
200 0.104050576 172.31.31.144 -> 172.31.23.72 TCP 66 6633 → 45432 [ACK] Seq=1 Ack=493 Win=853 Len=0 TSval=808333 TSecr=19378457
201 0.104052528 172.31.31.144 -> 172.31.23.72 OpenFlow 187 Type: OFPT_PACKET_OUT
202 0.104053896 172.31.31.144 -> 172.31.23.72 TCP 66 6633 → 45422 [ACK] Seq=1 Ack=370 Win=853 Len=0 TSval=808333 TSecr=19378457
203 0.104055749 172.31.31.144 -> 172.31.23.72 TCP 66 6633 → 45416 [ACK] Seq=1 Ack=493 Win=853 Len=0 TSval=808333 TSecr=19378457
204 0.104167880 172.31.23.72 -> 172.31.31.144 OpenFlow 435 Type: OFPT_PACKET_IN
205 0.104175000 172.31.23.72 -> 172.31.31.144 OpenFlow 189 Type: OFPT_PACKET_IN
206 0.104333513 172.31.31.144 -> 172.31.23.72 TCP 66 6633 → 45452 [ACK] Seq=969 Ack=124 Win=853 Len=0 TSval=808333 TSecr=19378457
207 0.104339446 172.31.31.144 -> 172.31.23.72 TCP 66 6633 → 45454 [ACK] Seq=1 Ack=493 Win=853 Len=0 TSval=808333 TSecr=19378457
208 0.104341584 172.31.31.144 -> 172.31.23.72 TCP 66 6633 → 45456 [ACK] Seq=1 Ack=247 Win=853 Len=0 TSval=808333 TSecr=19378457
209 0.104344814 172.31.31.144 -> 172.31.23.72 TCP 66 6633 → 45446 [ACK] Seq=1 Ack=493 Win=853 Len=0 TSval=808333 TSecr=19378457
210 0.104346821 172.31.31.144 -> 172.31.23.72 TCP 66 6633 → 45436 [ACK] Seq=969 Ack=370 Win=853 Len=0 TSval=808333 TSecr=19378457
211 0.104348727 172.31.31.144 -> 172.31.23.72 OpenFlow 187 Type: OFPT_PACKET_OUT
212 0.104350730 172.31.31.144 -> 172.31.23.72 TCP 66 6633 → 45442 [ACK] Seq=1 Ack=739 Win=853 Len=0 TSval=808333 TSecr=19378457
213 0.104352683 172.31.31.144 -> 172.31.23.72 TCP 66 6633 → 45420 [ACK] Seq=969 Ack=124 Win=853 Len=0 TSval=808333 TSecr=19378457
214 0.104414957 172.31.31.144 -> 172.31.23.72 TCP 66 6633 → 45422 [ACK] Seq=1 Ack=493 Win=853 Len=0 TSval=808333 TSecr=19378457
215 0.104420193 172.31.31.144 -> 172.31.23.72 OpenFlow 187 Type: OFPT_PACKET_OUT
216 0.104422090 172.31.31.144 -> 172.31.23.72 TCP 66 6633 → 45434 [ACK] Seq=1211 Ack=616 Win=853 Len=0 TSval=808333 TSecr=19378457
217 0.104423984 172.31.31.144 -> 172.31.23.72 TCP 66 6633 → 45452 [ACK] Seq=969 Ack=247 Win=853 Len=0 TSval=808333 TSecr=19378457
218 0.104425999 172.31.31.144 -> 172.31.23.72 OpenFlow 187 Type: OFPT_PACKET_OUT
219 0.104427917 172.31.31.144 -> 172.31.23.72 TCP 66 6633 → 45426 [ACK] Seq=1 Ack=493 Win=853 Len=0 TSval=808333 TSecr=19378457
220 0.104483958 172.31.31.144 -> 172.31.23.72 TCP 66 6633 → 45462 [ACK] Seq=727 Ack=247 Win=853 Len=0 TSval=808333 TSecr=19378457
221 0.104488198 172.31.31.144 -> 172.31.23.72 TCP 66 6633 → 45436 [ACK] Seq=969 Ack=739 Win=853 Len=0 TSval=808333 TSecr=19378457
222 0.104491718 172.31.23.72 -> 172.31.31.144 TCP 66 45430 → 6633 [ACK] Seq=739 Ack=1211 Win=213 Len=0 TSval=19378458 TSecr=808333
223 0.104520077 172.31.31.144 -> 172.31.23.72 TCP 66 6633 → 45420 [ACK] Seq=969 Ack=247 Win=853 Len=0 TSval=808333 TSecr=19378457
224 0.104627995 172.31.23.72 -> 172.31.31.144 OpenFlow 189 Type: OFPT_PACKET_IN
225 0.104657492 172.31.23.72 -> 172.31.31.144 OpenFlow 189 Type: OFPT_PACKET_IN
226 0.104685353 172.31.23.72 -> 172.31.31.144 OpenFlow 189 Type: OFPT_PACKET_IN
227 0.104746137 172.31.23.72 -> 172.31.31.144 OpenFlow 312 Type: OFPT_PACKET_IN
228 0.104808386 172.31.23.72 -> 172.31.31.144 OpenFlow 189 Type: OFPT_PACKET_IN
229 0.104823761 172.31.31.144 -> 172.31.23.72 TCP 66 6633 → 45432 [ACK] Seq=1 Ack=616 Win=853 Len=0 TSval=808333 TSecr=19378458
230 0.104831076 172.31.23.72 -> 172.31.31.144 OpenFlow 189 Type: OFPT_PACKET_IN
231 0.104850363 172.31.23.72 -> 172.31.31.144 OpenFlow 189 Type: OFPT_PACKET_IN
232 0.104858088 172.31.31.144 -> 172.31.23.72 TCP 66 6633 → 45432 [ACK] Seq=1 Ack=739 Win=853 Len=0 TSval=808333 TSecr=19378458
233 0.104871859 172.31.23.72 -> 172.31.31.144 OpenFlow 189 Type: OFPT_PACKET_IN
234 0.104926326 172.31.23.72 -> 172.31.31.144 OpenFlow 312 Type: OFPT_PACKET_IN
235 0.104931155 172.31.23.72 -> 172.31.31.144 OpenFlow 189 Type: OFPT_PACKET_IN
236 0.104961223 172.31.31.144 -> 172.31.23.72 TCP 66 6633 → 45426 [ACK] Seq=1 Ack=862 Win=853 Len=0 TSval=808333 TSecr=19378458
237 0.104964761 172.31.31.144 -> 172.31.23.72 OpenFlow 187 Type: OFPT_PACKET_OUT
238 0.105048659 172.31.31.144 -> 172.31.23.72 TCP 66 6633 → 45436 [ACK] Seq=969 Ack=862 Win=853 Len=0 TSval=808333 TSecr=19378458
239 0.105052978 172.31.31.144 -> 172.31.23.72 TCP 66 6633 → 45436 [ACK] Seq=969 Ack=985 Win=853 Len=0 TSval=808333 TSecr=19378458
240 0.105055225 172.31.31.144 -> 172.31.23.72 TCP 66 6633 → 45434 [ACK] Seq=1211 Ack=739 Win=853 Len=0 TSval=808333 TSecr=19378458
241 0.105121508 172.31.31.144 -> 172.31.23.72 OpenFlow 187 Type: OFPT_PACKET_OUT
242 0.105178294 172.31.31.144 -> 172.31.23.72 OpenFlow 187 Type: OFPT_PACKET_OUT
243 0.105240277 172.31.31.144 -> 172.31.23.72 OpenFlow 187 Type: OFPT_PACKET_OUT
244 0.105274579 172.31.31.144 -> 172.31.23.72 TCP 66 6633 → 45434 [ACK] Seq=1211 Ack=985 Win=853 Len=0 TSval=808333 TSecr=19378458
245 0.105312234 172.31.31.144 -> 172.31.23.72 TCP 66 6633 → 45424 [ACK] Seq=1211 Ack=493 Win=853 Len=0 TSval=808333 TSecr=19378458
246 0.105337577 172.31.23.72 -> 172.31.31.144 TCP 66 45428 → 6633 [ACK] Seq=247 Ack=606 Win=213 Len=0 TSval=19378458 TSecr=808333
247 0.105369742 172.31.31.144 -> 172.31.23.72 OpenFlow 187 Type: OFPT_PACKET_OUT
248 0.105464633 172.31.23.72 -> 172.31.31.144 OpenFlow 189 Type: OFPT_PACKET_IN
249 0.105487805 172.31.31.144 -> 172.31.23.72 OpenFlow 187 Type: OFPT_PACKET_OUT
250 0.105494348 172.31.23.72 -> 172.31.31.144 OpenFlow 189 Type: OFPT_PACKET_IN
251 0.105536638 172.31.23.72 -> 172.31.31.144 OpenFlow 189 Type: OFPT_PACKET_IN
252 0.105563818 172.31.31.144 -> 172.31.23.72 OpenFlow 187 Type: OFPT_PACKET_OUT
253 0.105598335 172.31.31.144 -> 172.31.23.72 OpenFlow 187 Type: OFPT_PACKET_OUT
254 0.105635434 172.31.31.144 -> 172.31.23.72 TCP 66 6633 → 45432 [ACK] Seq=1 Ack=862 Win=853 Len=0 TSval=808333 TSecr=19378458
255 0.105663232 172.31.23.72 -> 172.31.31.144 OpenFlow 189 Type: OFPT_PACKET_IN
256 0.105683823 172.31.31.144 -> 172.31.23.72 OpenFlow 187 Type: OFPT_PACKET_OUT
257 0.105707097 172.31.23.72 -> 172.31.31.144 OpenFlow 189 Type: OFPT_PACKET_IN
258 0.105744080 172.31.31.144 -> 172.31.23.72 OpenFlow 187 Type: OFPT_PACKET_OUT
259 0.105790390 172.31.31.144 -> 172.31.23.72 OpenFlow 187 Type: OFPT_PACKET_OUT
260 0.105819794 172.31.31.144 -> 172.31.23.72 OpenFlow 187 Type: OFPT_PACKET_OUT
261 0.105835334 172.31.31.144 -> 172.31.23.72 TCP 66 6633 → 45432 [ACK] Seq=1 Ack=985 Win=853 Len=0 TSval=808333 TSecr=19378458
262 0.105855857 172.31.31.144 -> 172.31.23.72 TCP 66 6633 → 45420 [ACK] Seq=969 Ack=370 Win=853 Len=0 TSval=808333 TSecr=19378458
263 0.105883678 172.31.31.144 -> 172.31.23.72 TCP 66 6633 → 45420 [ACK] Seq=969 Ack=493 Win=853 Len=0 TSval=808333 TSecr=19378458
264 0.105904753 172.31.31.144 -> 172.31.23.72 OpenFlow 187 Type: OFPT_PACKET_OUT
265 0.106069448 172.31.23.72 -> 172.31.31.144 TCP 66 45416 → 6633 [ACK] Seq=493 Ack=969 Win=213 Len=0 TSval=19378458 TSecr=808333
266 0.106157641 172.31.23.72 -> 172.31.31.144 OpenFlow 189 Type: OFPT_PACKET_IN
267 0.106187914 172.31.23.72 -> 172.31.31.144 OpenFlow 189 Type: OFPT_PACKET_IN
268 0.106294548 172.31.23.72 -> 172.31.31.144 OpenFlow 189 Type: OFPT_PACKET_IN
269 0.106312004 172.31.23.72 -> 172.31.31.144 OpenFlow 189 Type: OFPT_PACKET_IN
270 0.106333606 172.31.23.72 -> 172.31.31.144 OpenFlow 189 Type: OFPT_PACKET_IN
271 0.106363855 172.31.31.144 -> 172.31.23.72 TCP 66 6633 → 45414 [ACK] Seq=1 Ack=370 Win=853 Len=0 TSval=808333 TSecr=19378458
272 0.106412190 172.31.23.72 -> 172.31.31.144 OpenFlow 189 Type: OFPT_PACKET_IN
273 0.106449316 172.31.31.144 -> 172.31.23.72 TCP 66 6633 → 45414 [ACK] Seq=1 Ack=493 Win=853 Len=0 TSval=808333 TSecr=19378458
274 0.106698572 172.31.31.144 -> 172.31.23.72 TCP 66 6633 → 45424 [ACK] Seq=1211 Ack=739 Win=853 Len=0 TSval=808333 TSecr=19378458
275 0.106837878 172.31.31.144 -> 172.31.23.72 TCP 66 6633 → 45418 [ACK] Seq=1211 Ack=493 Win=853 Len=0 TSval=808333 TSecr=19378458
276 0.140229275 172.31.23.72 -> 172.31.31.144 TCP 66 45450 → 6633 [ACK] Seq=493 Ack=727 Win=213 Len=0 TSval=19378467 TSecr=808333
277 0.143088255 172.31.31.144 -> 172.31.23.72 TCP 66 6633 → 45426 [ACK] Seq=1 Ack=985 Win=853 Len=0 TSval=808343 TSecr=19378458
278 0.144247039 172.31.23.72 -> 172.31.31.144 TCP 66 45428 → 6633 [ACK] Seq=247 Ack=727 Win=213 Len=0 TSval=19378468 TSecr=808333
279 0.199315499 172.31.31.144 -> 172.31.23.72 OpenFlow 187 Type: OFPT_PACKET_OUT
280 0.199360519 172.31.31.144 -> 172.31.23.72 OpenFlow 187 Type: OFPT_PACKET_OUT
281 0.199388049 172.31.31.144 -> 172.31.23.72 OpenFlow 187 Type: OFPT_PACKET_OUT
282 0.199445511 172.31.31.144 -> 172.31.23.72 OpenFlow 187 Type: OFPT_PACKET_OUT
283 0.199505476 172.31.31.144 -> 172.31.23.72 OpenFlow 187 Type: OFPT_PACKET_OUT
284 0.199558146 172.31.31.144 -> 172.31.23.72 OpenFlow 187 Type: OFPT_PACKET_OUT
285 0.199618011 172.31.31.144 -> 172.31.23.72 OpenFlow 187 Type: OFPT_PACKET_OUT
286 0.199693496 172.31.31.144 -> 172.31.23.72 OpenFlow 187 Type: OFPT_PACKET_OUT
287 0.199733285 172.31.31.144 -> 172.31.23.72 OpenFlow 187 Type: OFPT_PACKET_OUT
288 0.199790603 172.31.31.144 -> 172.31.23.72 OpenFlow 187 Type: OFPT_PACKET_OUT
289 0.199999000 172.31.31.144 -> 172.31.23.72 OpenFlow 187 Type: OFPT_PACKET_OUT
290 0.200065568 172.31.31.144 -> 172.31.23.72 OpenFlow 308 Type: OFPT_PACKET_OUT
291 0.200096026 172.31.31.144 -> 172.31.23.72 OpenFlow 187 Type: OFPT_PACKET_OUT
292 0.200119036 172.31.31.144 -> 172.31.23.72 OpenFlow 187 Type: OFPT_PACKET_OUT
293 0.200177257 172.31.23.72 -> 172.31.31.144 TCP 66 45446 → 6633 [ACK] Seq=493 Ack=1211 Win=213 Len=0 TSval=19378481 TSecr=808357
294 0.200206663 172.31.31.144 -> 172.31.23.72 OpenFlow 187 Type: OFPT_PACKET_OUT
295 0.200261367 172.31.31.144 -> 172.31.23.72 OpenFlow 187 Type: OFPT_PACKET_OUT
296 0.200277900 172.31.31.144 -> 172.31.23.72 OpenFlow 187 Type: OFPT_PACKET_OUT
297 0.200457791 172.31.31.144 -> 172.31.23.72 TCP 187 6633 → 45460 [PSH, ACK] Seq=1 Ack=1 Win=853 Len=121 TSval=808357 TSecr=19377901
298 0.200474771 172.31.31.144 -> 172.31.23.72 TCP 187 6633 → 45460 [PSH, ACK] Seq=122 Ack=1 Win=853 Len=121 TSval=808357 TSecr=19377901
299 0.200496082 172.31.31.144 -> 172.31.23.72 TCP 187 6633 → 45460 [PSH, ACK] Seq=243 Ack=1 Win=853 Len=121 TSval=808357 TSecr=19377901
300 0.200593735 172.31.31.144 -> 172.31.23.72 TCP 187 6633 → 45460 [PSH, ACK] Seq=364 Ack=1 Win=853 Len=121 TSval=808357 TSecr=19377901
301 0.200611458 172.31.31.144 -> 172.31.23.72 TCP 187 6633 → 45460 [PSH, ACK] Seq=485 Ack=1 Win=853 Len=121 TSval=808357 TSecr=19377901
302 0.200636360 172.31.23.72 -> 172.31.31.144 TCP 66 45432 → 6633 [ACK] Seq=985 Ack=969 Win=213 Len=0 TSval=19378482 TSecr=808357
303 0.200722638 172.31.31.144 -> 172.31.23.72 TCP 187 6633 → 45460 [PSH, ACK] Seq=606 Ack=1 Win=853 Len=121 TSval=808357 TSecr=19377901
304 0.200844804 172.31.31.144 -> 172.31.23.72 TCP 187 6633 → 45458 [PSH, ACK] Seq=1 Ack=1 Win=853 Len=121 TSval=808357 TSecr=19377894
305 0.200851384 172.31.31.144 -> 172.31.23.72 TCP 187 6633 → 45458 [PSH, ACK] Seq=122 Ack=1 Win=853 Len=121 TSval=808357 TSecr=19377894
306 0.200866127 172.31.31.144 -> 172.31.23.72 TCP 187 6633 → 45458 [PSH, ACK] Seq=243 Ack=1 Win=853 Len=121 TSval=808357 TSecr=19377894
307 0.200897488 172.31.23.72 -> 172.31.31.144 TCP 66 45460 → 6633 [ACK] Seq=1 Ack=727 Win=213 Len=0 TSval=19378482 TSecr=808357
308 0.200963991 172.31.31.144 -> 172.31.23.72 TCP 187 6633 → 45458 [PSH, ACK] Seq=364 Ack=1 Win=853 Len=121 TSval=808357 TSecr=19377894
309 0.200969114 172.31.31.144 -> 172.31.23.72 TCP 187 6633 → 45458 [PSH, ACK] Seq=485 Ack=1 Win=853 Len=121 TSval=808357 TSecr=19377894
310 0.200990997 172.31.23.72 -> 172.31.31.144 OpenFlow 189 Type: OFPT_PACKET_IN
311 0.201018042 172.31.31.144 -> 172.31.23.72 OpenFlow 187 Type: OFPT_PACKET_OUT
312 0.201023657 172.31.23.72 -> 172.31.31.144 OpenFlow 435 Type: OFPT_PACKET_IN
313 0.201087595 172.31.31.144 -> 172.31.23.72 OpenFlow 187 Type: OFPT_PACKET_OUT
314 0.201122920 172.31.31.144 -> 172.31.23.72 OpenFlow 187 Type: OFPT_PACKET_OUT
315 0.201213421 172.31.31.144 -> 172.31.23.72 TCP 66 6633 → 45458 [ACK] Seq=969 Ack=493 Win=853 Len=0 TSval=808357 TSecr=19378482
316 0.201251387 172.31.31.144 -> 172.31.23.72 OpenFlow 187 Type: OFPT_PACKET_OUT
317 0.201270157 172.31.31.144 -> 172.31.23.72 OpenFlow 187 Type: OFPT_PACKET_OUT
318 0.201323779 172.31.31.144 -> 172.31.23.72 OpenFlow 187 Type: OFPT_PACKET_OUT
319 0.201340455 172.31.23.72 -> 172.31.31.144 TCP 66 45458 → 6633 [ACK] Seq=493 Ack=969 Win=213 Len=0 TSval=19378482 TSecr=808357
320 0.201371228 172.31.31.144 -> 172.31.23.72 OpenFlow 187 Type: OFPT_PACKET_OUT
321 0.201420522 172.31.23.72 -> 172.31.31.144 OpenFlow 189 Type: OFPT_PACKET_IN
322 0.201431370 172.31.31.144 -> 172.31.23.72 OpenFlow 187 Type: OFPT_PACKET_OUT
323 0.201449755 172.31.23.72 -> 172.31.31.144 OpenFlow 435 Type: OFPT_PACKET_IN
324 0.201487019 172.31.31.144 -> 172.31.23.72 OpenFlow 187 Type: OFPT_PACKET_OUT
325 0.201545102 172.31.31.144 -> 172.31.23.72 OpenFlow 187 Type: OFPT_PACKET_OUT
326 0.201599313 172.31.31.144 -> 172.31.23.72 OpenFlow 187 Type: OFPT_PACKET_OUT
327 0.201749137 172.31.31.144 -> 172.31.23.72 OpenFlow 187 Type: OFPT_PACKET_OUT
328 0.201776476 172.31.31.144 -> 172.31.23.72 OpenFlow 187 Type: OFPT_PACKET_OUT
329 0.201813211 172.31.23.72 -> 172.31.31.144 TCP 66 45456 → 6633 [ACK] Seq=739 Ack=969 Win=213 Len=0 TSval=19378482 TSecr=808357
330 0.201843324 172.31.31.144 -> 172.31.23.72 OpenFlow 187 Type: OFPT_PACKET_OUT
331 0.201898047 172.31.31.144 -> 172.31.23.72 OpenFlow 187 Type: OFPT_PACKET_OUT
332 0.201969847 172.31.31.144 -> 172.31.23.72 OpenFlow 187 Type: OFPT_PACKET_OUT
333 0.202006533 172.31.31.144 -> 172.31.23.72 OpenFlow 187 Type: OFPT_PACKET_OUT
334 0.202082253 172.31.31.144 -> 172.31.23.72 OpenFlow 187 Type: OFPT_PACKET_OUT
335 0.202098673 172.31.23.72 -> 172.31.31.144 TCP 66 45414 → 6633 [ACK] Seq=493 Ack=727 Win=213 Len=0 TSval=19378482 TSecr=808357
336 0.202159347 172.31.31.144 -> 172.31.23.72 OpenFlow 187 Type: OFPT_PACKET_OUT
337 0.202173875 172.31.23.72 -> 172.31.31.144 OpenFlow 189 Type: OFPT_PACKET_IN
338 0.202210975 172.31.23.72 -> 172.31.31.144 OpenFlow 189 Type: OFPT_PACKET_IN
339 0.202320448 172.31.31.144 -> 172.31.23.72 OpenFlow 187 Type: OFPT_PACKET_OUT
340 0.202337493 172.31.23.72 -> 172.31.31.144 OpenFlow 189 Type: OFPT_PACKET_IN
341 0.202355865 172.31.31.144 -> 172.31.23.72 TCP 66 6633 → 45454 [ACK] Seq=364 Ack=616 Win=853 Len=0 TSval=808357 TSecr=19378482
342 0.202363914 172.31.23.72 -> 172.31.31.144 OpenFlow 435 Type: OFPT_PACKET_IN
343 0.202399275 172.31.31.144 -> 172.31.23.72 OpenFlow 187 Type: OFPT_PACKET_OUT
344 0.202485966 172.31.23.72 -> 172.31.31.144 OpenFlow 189 Type: OFPT_PACKET_IN
345 0.202515273 172.31.23.72 -> 172.31.31.144 OpenFlow 189 Type: OFPT_PACKET_IN
346 0.202521606 172.31.23.72 -> 172.31.31.144 OpenFlow 189 Type: OFPT_PACKET_IN
347 0.202548620 172.31.23.72 -> 172.31.31.144 OpenFlow 189 Type: OFPT_PACKET_IN
348 0.202570143 172.31.23.72 -> 172.31.31.144 OpenFlow 189 Type: OFPT_PACKET_IN
349 0.202586175 172.31.23.72 -> 172.31.31.144 OpenFlow 189 Type: OFPT_PACKET_IN
350 0.202588399 172.31.23.72 -> 172.31.31.144 OpenFlow 189 Type: OFPT_PACKET_IN
351 0.202608329 172.31.23.72 -> 172.31.31.144 OpenFlow 189 Type: OFPT_PACKET_IN
352 0.202614057 172.31.31.144 -> 172.31.23.72 TCP 66 6633 → 45448 [ACK] Seq=1 Ack=739 Win=853 Len=0 TSval=808357 TSecr=19378482
353 0.202636439 172.31.23.72 -> 172.31.31.144 OpenFlow 189 Type: OFPT_PACKET_IN
354 0.202642427 172.31.23.72 -> 172.31.31.144 OpenFlow 189 Type: OFPT_PACKET_IN
355 0.202657528 172.31.23.72 -> 172.31.31.144 OpenFlow 189 Type: OFPT_PACKET_IN
356 0.202660169 172.31.23.72 -> 172.31.31.144 OpenFlow 435 Type: OFPT_PACKET_IN
357 0.202672843 172.31.23.72 -> 172.31.31.144 OpenFlow 189 Type: OFPT_PACKET_IN
358 0.202691419 172.31.23.72 -> 172.31.31.144 OpenFlow 189 Type: OFPT_PACKET_IN
359 0.202693719 172.31.23.72 -> 172.31.31.144 OpenFlow 435 Type: OFPT_PACKET_IN
360 0.202706055 172.31.23.72 -> 172.31.31.144 OpenFlow 189 Type: OFPT_PACKET_IN
361 0.202776919 172.31.31.144 -> 172.31.23.72 TCP 66 6633 → 45452 [ACK] Seq=969 Ack=370 Win=853 Len=0 TSval=808357 TSecr=19378482
362 0.202783048 172.31.31.144 -> 172.31.23.72 TCP 66 6633 → 45452 [ACK] Seq=969 Ack=493 Win=853 Len=0 TSval=808357 TSecr=19378482
363 0.202788102 172.31.23.72 -> 172.31.31.144 OpenFlow 189 Type: OFPT_PACKET_IN
364 0.202794916 172.31.23.72 -> 172.31.31.144 OpenFlow 189 Type: OFPT_PACKET_IN
365 0.202815593 172.31.23.72 -> 172.31.31.144 TCP 66 45454 → 6633 [ACK] Seq=739 Ack=485 Win=213 Len=0 TSval=19378482 TSecr=808357
366 0.202979500 172.31.23.72 -> 172.31.31.144 OpenFlow 189 Type: OFPT_PACKET_IN
367 0.202982880 172.31.23.72 -> 172.31.31.144 OpenFlow 435 Type: OFPT_PACKET_IN
368 0.202984629 172.31.23.72 -> 172.31.31.144 OpenFlow 189 Type: OFPT_PACKET_IN
369 0.203032831 172.31.31.144 -> 172.31.23.72 TCP 66 6633 → 45444 [ACK] Seq=1211 Ack=370 Win=853 Len=0 TSval=808357 TSecr=19378482
370 0.203039950 172.31.23.72 -> 172.31.31.144 OpenFlow 189 Type: OFPT_PACKET_IN
371 0.203061703 172.31.23.72 -> 172.31.31.144 OpenFlow 189 Type: OFPT_PACKET_IN
372 0.203268053 172.31.31.144 -> 172.31.23.72 TCP 66 6633 → 45460 [ACK] Seq=727 Ack=124 Win=853 Len=0 TSval=808358 TSecr=19378482
373 0.203273814 172.31.31.144 -> 172.31.23.72 OpenFlow 187 Type: OFPT_PACKET_OUT
374 0.203278003 172.31.31.144 -> 172.31.23.72 OpenFlow 187 Type: OFPT_PACKET_OUT
375 0.203279949 172.31.31.144 -> 172.31.23.72 TCP 66 6633 → 45444 [ACK] Seq=1211 Ack=739 Win=853 Len=0 TSval=808358 TSecr=19378482
376 0.203282093 172.31.31.144 -> 172.31.23.72 OpenFlow 308 Type: OFPT_PACKET_OUT
377 0.203284081 172.31.31.144 -> 172.31.23.72 TCP 66 6633 → 45424 [ACK] Seq=1211 Ack=985 Win=853 Len=0 TSval=808358 TSecr=19378482
378 0.203286362 172.31.31.144 -> 172.31.23.72 TCP 66 6633 → 45462 [ACK] Seq=727 Ack=493 Win=853 Len=0 TSval=808358 TSecr=19378482
379 0.203298553 172.31.23.72 -> 172.31.31.144 OpenFlow 189 Type: OFPT_PACKET_IN
380 0.203359642 172.31.31.144 -> 172.31.23.72 TCP 66 6633 → 45460 [ACK] Seq=727 Ack=247 Win=853 Len=0 TSval=808358 TSecr=19378482
381 0.203377354 172.31.31.144 -> 172.31.23.72 TCP 66 6633 → 45430 [ACK] Seq=1211 Ack=985 Win=853 Len=0 TSval=808358 TSecr=19378482
382 0.203439237 172.31.31.144 -> 172.31.23.72 TCP 66 6633 → 45456 [ACK] Seq=969 Ack=862 Win=853 Len=0 TSval=808358 TSecr=19378482
383 0.203480143 172.31.31.144 -> 172.31.23.72 TCP 66 6633 → 45458 [ACK] Seq=969 Ack=739 Win=853 Len=0 TSval=808358 TSecr=19378482
384 0.203535017 172.31.23.72 -> 172.31.31.144 TCP 66 45454 → 6633 [ACK] Seq=739 Ack=969 Win=213 Len=0 TSval=19378482 TSecr=808358
385 0.203643346 172.31.31.144 -> 172.31.23.72 TCP 66 6633 → 45438 [ACK] Seq=969 Ack=985 Win=853 Len=0 TSval=808358 TSecr=19378482
386 0.203732140 172.31.31.144 -> 172.31.23.72 TCP 66 6633 → 45446 [ACK] Seq=1211 Ack=985 Win=853 Len=0 TSval=808358 TSecr=19378482
387 0.203755961 172.31.23.72 -> 172.31.31.144 OpenFlow 189 Type: OFPT_PACKET_IN
388 0.203781730 172.31.23.72 -> 172.31.31.144 OpenFlow 189 Type: OFPT_PACKET_IN
389 0.203903308 172.31.31.144 -> 172.31.23.72 TCP 66 6633 → 45416 [ACK] Seq=969 Ack=739 Win=853 Len=0 TSval=808358 TSecr=19378482
390 0.203908810 172.31.31.144 -> 172.31.23.72 OpenFlow 187 Type: OFPT_PACKET_OUT
391 0.203919021 172.31.31.144 -> 172.31.23.72 OpenFlow 187 Type: OFPT_PACKET_OUT
392 0.204062151 172.31.31.144 -> 172.31.23.72 TCP 66 6633 → 45428 [ACK] Seq=727 Ack=493 Win=853 Len=0 TSval=808358 TSecr=19378482
393 0.204118781 172.31.23.72 -> 172.31.31.144 TCP 66 45442 → 6633 [ACK] Seq=739 Ack=243 Win=213 Len=0 TSval=19378482 TSecr=808358
394 0.204316061 172.31.23.72 -> 172.31.31.144 OpenFlow 189 Type: OFPT_PACKET_IN
395 0.204346421 172.31.23.72 -> 172.31.31.144 OpenFlow 189 Type: OFPT_PACKET_IN
396 0.204385236 172.31.31.144 -> 172.31.23.72 OpenFlow 187 Type: OFPT_PACKET_OUT
397 0.204479283 172.31.31.144 -> 172.31.23.72 OpenFlow 187 Type: OFPT_PACKET_OUT
398 0.204578391 172.31.31.144 -> 172.31.23.72 TCP 66 6633 → 45444 [ACK] Seq=1211 Ack=1231 Win=853 Len=0 TSval=808358 TSecr=19378482
399 0.204593442 172.31.23.72 -> 172.31.31.144 OpenFlow 189 Type: OFPT_PACKET_IN
400 0.204605996 172.31.31.144 -> 172.31.23.72 OpenFlow 187 Type: OFPT_PACKET_OUT
401 0.204669639 172.31.31.144 -> 172.31.23.72 OpenFlow 187 Type: OFPT_PACKET_OUT
402 0.204672428 172.31.31.144 -> 172.31.23.72 OpenFlow 187 Type: OFPT_PACKET_OUT
403 0.204674305 172.31.31.144 -> 172.31.23.72 OpenFlow 671 Type: OFPT_PACKET_OUT
404 0.204812849 172.31.31.144 -> 172.31.23.72 TCP 66 6633 → 45434 [ACK] Seq=1211 Ack=1108 Win=853 Len=0 TSval=808358 TSecr=19378483
405 0.204926077 172.31.23.72 -> 172.31.31.144 TCP 66 45448 → 6633 [ACK] Seq=739 Ack=727 Win=213 Len=0 TSval=19378483 TSecr=808358
406 0.205071211 172.31.23.72 -> 172.31.31.144 TCP 66 45442 → 6633 [ACK] Seq=739 Ack=727 Win=213 Len=0 TSval=19378483 TSecr=808358
407 0.205210749 172.31.23.72 -> 172.31.31.144 OpenFlow 189 Type: OFPT_PACKET_IN
408 0.205237297 172.31.23.72 -> 172.31.31.144 OpenFlow 189 Type: OFPT_PACKET_IN
409 0.205242175 172.31.23.72 -> 172.31.31.144 OpenFlow 189 Type: OFPT_PACKET_IN
410 0.205264544 172.31.23.72 -> 172.31.31.144 OpenFlow 189 Type: OFPT_PACKET_IN
411 0.205306920 172.31.23.72 -> 172.31.31.144 OpenFlow 189 Type: OFPT_PACKET_IN
412 0.205315338 172.31.23.72 -> 172.31.31.144 OpenFlow 189 Type: OFPT_PACKET_IN
413 0.205331935 172.31.23.72 -> 172.31.31.144 OpenFlow 189 Type: OFPT_PACKET_IN
414 0.205402710 172.31.23.72 -> 172.31.31.144 OpenFlow 189 Type: OFPT_PACKET_IN
415 0.205468376 172.31.31.144 -> 172.31.23.72 TCP 66 6633 → 45452 [ACK] Seq=969 Ack=616 Win=853 Len=0 TSval=808358 TSecr=19378483
416 0.205474180 172.31.31.144 -> 172.31.23.72 TCP 66 6633 → 45452 [ACK] Seq=969 Ack=739 Win=853 Len=0 TSval=808358 TSecr=19378483
417 0.205478348 172.31.23.72 -> 172.31.31.144 OpenFlow 189 Type: OFPT_PACKET_IN
418 0.205502109 172.31.31.144 -> 172.31.23.72 TCP 66 6633 → 45434 [ACK] Seq=1211 Ack=1231 Win=853 Len=0 TSval=808358 TSecr=19378483
419 0.205562641 172.31.31.144 -> 172.31.23.72 TCP 66 6633 → 45460 [ACK] Seq=727 Ack=370 Win=853 Len=0 TSval=808358 TSecr=19378483
420 0.205613559 172.31.31.144 -> 172.31.23.72 TCP 66 6633 → 45446 [ACK] Seq=1211 Ack=1231 Win=853 Len=0 TSval=808358 TSecr=19378483
421 0.205634073 172.31.31.144 -> 172.31.23.72 TCP 66 6633 → 45460 [ACK] Seq=727 Ack=493 Win=853 Len=0 TSval=808358 TSecr=19378483
422 0.205771519 172.31.31.144 -> 172.31.23.72 TCP 66 6633 → 45462 [ACK] Seq=727 Ack=739 Win=853 Len=0 TSval=808358 TSecr=19378483
423 0.243079359 172.31.31.144 -> 172.31.23.72 TCP 66 6633 → 45456 [ACK] Seq=969 Ack=985 Win=853 Len=0 TSval=808368 TSecr=19378482
424 0.299150535 172.31.31.144 -> 172.31.23.72 OpenFlow 187 Type: OFPT_PACKET_OUT
425 0.299165324 172.31.31.144 -> 172.31.23.72 OpenFlow 187 Type: OFPT_PACKET_OUT
426 0.299177803 172.31.31.144 -> 172.31.23.72 OpenFlow 187 Type: OFPT_PACKET_OUT
427 0.299204948 172.31.31.144 -> 172.31.23.72 OpenFlow 187 Type: OFPT_PACKET_OUT
428 0.299269021 172.31.31.144 -> 172.31.23.72 OpenFlow 187 Type: OFPT_PACKET_OUT
429 0.299327735 172.31.31.144 -> 172.31.23.72 OpenFlow 187 Type: OFPT_PACKET_OUT
430 0.299345862 172.31.31.144 -> 172.31.23.72 OpenFlow 187 Type: OFPT_PACKET_OUT
431 0.299432048 172.31.31.144 -> 172.31.23.72 OpenFlow 187 Type: OFPT_PACKET_OUT
432 0.299474740 172.31.31.144 -> 172.31.23.72 OpenFlow 187 Type: OFPT_PACKET_OUT
433 0.299508187 172.31.31.144 -> 172.31.23.72 OpenFlow 187 Type: OFPT_PACKET_OUT
434 0.299695721 172.31.31.144 -> 172.31.23.72 OpenFlow 187 Type: OFPT_PACKET_OUT
435 0.299732796 172.31.31.144 -> 172.31.23.72 OpenFlow 308 Type: OFPT_PACKET_OUT
436 0.299757162 172.31.31.144 -> 172.31.23.72 OpenFlow 187 Type: OFPT_PACKET_OUT
437 0.299789876 172.31.31.144 -> 172.31.23.72 OpenFlow 187 Type: OFPT_PACKET_OUT
438 0.299844184 172.31.31.144 -> 172.31.23.72 OpenFlow 187 Type: OFPT_PACKET_OUT
439 0.299932423 172.31.23.72 -> 172.31.31.144 TCP 66 45426 → 6633 [ACK] Seq=985 Ack=1211 Win=213 Len=0 TSval=19378506 TSecr=808382
440 0.300004194 172.31.23.72 -> 172.31.31.144 OpenFlow 189 Type: OFPT_PACKET_IN
441 0.300045201 172.31.23.72 -> 172.31.31.144 OpenFlow 189 Type: OFPT_PACKET_IN
442 0.300242152 172.31.31.144 -> 172.31.23.72 TCP 66 6633 → 45422 [ACK] Seq=727 Ack=739 Win=853 Len=0 TSval=808382 TSecr=19378506
443 0.300414241 172.31.23.72 -> 172.31.31.144 OpenFlow 189 Type: OFPT_PACKET_IN
444 0.300452107 172.31.23.72 -> 172.31.31.144 OpenFlow 189 Type: OFPT_PACKET_IN
445 0.300459167 172.31.23.72 -> 172.31.31.144 OpenFlow 189 Type: OFPT_PACKET_IN
446 0.300474011 172.31.23.72 -> 172.31.31.144 OpenFlow 189 Type: OFPT_PACKET_IN
447 0.300507009 172.31.23.72 -> 172.31.31.144 OpenFlow 189 Type: OFPT_PACKET_IN
448 0.300509277 172.31.23.72 -> 172.31.31.144 OpenFlow 189 Type: OFPT_PACKET_IN
449 0.300521921 172.31.23.72 -> 172.31.31.144 OpenFlow 189 Type: OFPT_PACKET_IN
450 0.300527401 172.31.23.72 -> 172.31.31.144 OpenFlow 435 Type: OFPT_PACKET_IN
451 0.300584547 172.31.23.72 -> 172.31.31.144 OpenFlow 189 Type: OFPT_PACKET_IN
452 0.300589640 172.31.23.72 -> 172.31.31.144 OpenFlow 189 Type: OFPT_PACKET_IN
453 0.300591324 172.31.23.72 -> 172.31.31.144 OpenFlow 189 Type: OFPT_PACKET_IN
454 0.300627928 172.31.31.144 -> 172.31.23.72 TCP 66 6633 → 45420 [ACK] Seq=969 Ack=616 Win=853 Len=0 TSval=808382 TSecr=19378507
455 0.300634283 172.31.31.144 -> 172.31.23.72 TCP 66 6633 → 45420 [ACK] Seq=969 Ack=739 Win=853 Len=0 TSval=808382 TSecr=19378507
456 0.300672896 172.31.23.72 -> 172.31.31.144 OpenFlow 189 Type: OFPT_PACKET_IN
457 0.300806912 172.31.31.144 -> 172.31.23.72 TCP 66 6633 → 45418 [ACK] Seq=1211 Ack=985 Win=853 Len=0 TSval=808382 TSecr=19378507
458 0.300835679 172.31.31.144 -> 172.31.23.72 TCP 66 6633 → 45426 [ACK] Seq=1211 Ack=1108 Win=853 Len=0 TSval=808382 TSecr=19378507
459 0.300869337 172.31.31.144 -> 172.31.23.72 TCP 66 6633 → 45426 [ACK] Seq=1211 Ack=1231 Win=853 Len=0 TSval=808382 TSecr=19378507
460 0.300915449 172.31.31.144 -> 172.31.23.72 TCP 66 6633 → 45430 [ACK] Seq=1211 Ack=1231 Win=853 Len=0 TSval=808382 TSecr=19378507
461 0.300962290 172.31.31.144 -> 172.31.23.72 TCP 66 6633 → 45424 [ACK] Seq=1211 Ack=1231 Win=853 Len=0 TSval=808382 TSecr=19378507
462 0.300985663 172.31.31.144 -> 172.31.23.72 TCP 66 6633 → 45428 [ACK] Seq=727 Ack=739 Win=853 Len=0 TSval=808382 TSecr=19378507
463 0.529574692 172.31.23.72 -> 172.31.31.144 OpenFlow 146 Type: OFPT_PORT_STATUS
464 0.529720835 172.31.23.72 -> 172.31.31.144 OpenFlow 146 Type: OFPT_PORT_STATUS
465 0.555850759 172.31.31.144 -> 172.31.23.72 OpenFlow 146 Type: OFPT_FLOW_MOD
466 0.555867413 172.31.31.144 -> 172.31.23.72 OpenFlow 146 Type: OFPT_FLOW_MOD
467 0.555874123 172.31.23.72 -> 172.31.31.144 TCP 66 45428 → 6633 [ACK] Seq=739 Ack=807 Win=213 Len=0 TSval=19378570 TSecr=808445
468 0.555879954 172.31.31.144 -> 172.31.23.72 OpenFlow 146 Type: OFPT_FLOW_MOD
469 0.555883184 172.31.31.144 -> 172.31.23.72 OpenFlow 154 Type: OFPT_BARRIER_REQUEST
470 0.555886496 172.31.23.72 -> 172.31.31.144 TCP 66 45428 → 6633 [ACK] Seq=739 Ack=895 Win=213 Len=0 TSval=19378570 TSecr=808445
471 0.555890088 172.31.31.144 -> 172.31.23.72 OpenFlow 154 Type: OFPT_BARRIER_REQUEST
472 0.555892309 172.31.31.144 -> 172.31.23.72 OpenFlow 146 Type: OFPT_FLOW_MOD
473 0.555894390 172.31.23.72 -> 172.31.31.144 TCP 66 45428 → 6633 [ACK] Seq=739 Ack=975 Win=213 Len=0 TSval=19378570 TSecr=808445
474 0.555896230 172.31.31.144 -> 172.31.23.72 OpenFlow 154 Type: OFPT_BARRIER_REQUEST
475 0.555897736 172.31.31.144 -> 172.31.23.72 OpenFlow 146 Type: OFPT_FLOW_MOD
476 0.555902189 172.31.31.144 -> 172.31.23.72 OpenFlow 146 Type: OFPT_FLOW_MOD
477 0.555904840 172.31.31.144 -> 172.31.23.72 OpenFlow 146 Type: OFPT_FLOW_MOD
478 0.555906245 172.31.31.144 -> 172.31.23.72 OpenFlow 146 Type: OFPT_FLOW_MOD
479 0.555907799 172.31.31.144 -> 172.31.23.72 OpenFlow 154 Type: OFPT_BARRIER_REQUEST
480 0.555909404 172.31.31.144 -> 172.31.23.72 OpenFlow 74 Type: OFPT_BARRIER_REQUEST
481 0.555910928 172.31.31.144 -> 172.31.23.72 OpenFlow 154 Type: OFPT_BARRIER_REQUEST
482 0.555912238 172.31.31.144 -> 172.31.23.72 OpenFlow 146 Type: OFPT_FLOW_MOD
483 0.555913504 172.31.31.144 -> 172.31.23.72 OpenFlow 146 Type: OFPT_FLOW_MOD
484 0.555914910 172.31.31.144 -> 172.31.23.72 OpenFlow 146 Type: OFPT_FLOW_MOD
485 0.555916849 172.31.23.72 -> 172.31.31.144 TCP 66 45428 → 6633 [ACK] Seq=739 Ack=1055 Win=213 Len=0 TSval=19378570 TSecr=808445
486 0.555918356 172.31.31.144 -> 172.31.23.72 OpenFlow 154 Type: OFPT_BARRIER_REQUEST
487 0.555922412 172.31.31.144 -> 172.31.23.72 OpenFlow 74 Type: OFPT_BARRIER_REQUEST
488 0.555924269 172.31.23.72 -> 172.31.31.144 TCP 66 45428 → 6633 [ACK] Seq=739 Ack=1063 Win=213 Len=0 TSval=19378570 TSecr=808445
489 0.555925748 172.31.31.144 -> 172.31.23.72 OpenFlow 146 Type: OFPT_FLOW_MOD
490 0.555928364 172.31.31.144 -> 172.31.23.72 OpenFlow 154 Type: OFPT_BARRIER_REQUEST
491 0.555929960 172.31.31.144 -> 172.31.23.72 OpenFlow 146 Type: OFPT_FLOW_MOD
492 0.555931439 172.31.31.144 -> 172.31.23.72 OpenFlow 146 Type: OFPT_FLOW_MOD
493 0.555932889 172.31.31.144 -> 172.31.23.72 OpenFlow 74 Type: OFPT_BARRIER_REQUEST
494 0.555934550 172.31.31.144 -> 172.31.23.72 OpenFlow 154 Type: OFPT_BARRIER_REQUEST
495 0.555948312 172.31.31.144 -> 172.31.23.72 OpenFlow 146 Type: OFPT_FLOW_MOD
496 0.555951000 172.31.31.144 -> 172.31.23.72 OpenFlow 154 Type: OFPT_BARRIER_REQUEST
497 0.555952361 172.31.31.144 -> 172.31.23.72 OpenFlow 234 Type: OFPT_BARRIER_REQUEST
498 0.555953547 172.31.31.144 -> 172.31.23.72 OpenFlow 146 Type: OFPT_FLOW_MOD
499 0.555955402 172.31.31.144 -> 172.31.23.72 OpenFlow 146 Type: OFPT_FLOW_MOD
500 0.555957174 172.31.23.72 -> 172.31.31.144 TCP 66 45428 → 6633 [ACK] Seq=739 Ack=1143 Win=213 Len=0 TSval=19378570 TSecr=808445
501 0.555958686 172.31.31.144 -> 172.31.23.72 OpenFlow 146 Type: OFPT_FLOW_MOD
502 0.555960523 172.31.23.72 -> 172.31.31.144 TCP 66 45428 → 6633 [ACK] Seq=739 Ack=1223 Win=213 Len=0 TSval=19378570 TSecr=808445
503 0.555962075 172.31.31.144 -> 172.31.23.72 OpenFlow 146 Type: OFPT_FLOW_MOD
504 0.555963638 172.31.31.144 -> 172.31.23.72 OpenFlow 74 Type: OFPT_BARRIER_REQUEST
505 0.555965741 172.31.23.72 -> 172.31.31.144 TCP 66 45428 → 6633 [ACK] Seq=739 Ack=1231 Win=213 Len=0 TSval=19378570 TSecr=808445
506 0.555967110 172.31.31.144 -> 172.31.23.72 OpenFlow 74 Type: OFPT_BARRIER_REQUEST
507 0.555968506 172.31.31.144 -> 172.31.23.72 OpenFlow 146 Type: OFPT_FLOW_MOD
508 0.555970273 172.31.31.144 -> 172.31.23.72 OpenFlow 146 Type: OFPT_FLOW_MOD
509 0.555971987 172.31.31.144 -> 172.31.23.72 OpenFlow 146 Type: OFPT_FLOW_MOD
510 0.555973523 172.31.31.144 -> 172.31.23.72 OpenFlow 146 Type: OFPT_FLOW_MOD
511 0.555975096 172.31.31.144 -> 172.31.23.72 OpenFlow 154 Type: OFPT_BARRIER_REQUEST
512 0.555976580 172.31.31.144 -> 172.31.23.72 OpenFlow 154 Type: OFPT_BARRIER_REQUEST
513 0.555977795 172.31.31.144 -> 172.31.23.72 OpenFlow 146 Type: OFPT_FLOW_MOD
514 0.555979065 172.31.31.144 -> 172.31.23.72 OpenFlow 74 Type: OFPT_BARRIER_REQUEST
515 0.555980290 172.31.31.144 -> 172.31.23.72 OpenFlow 154 Type: OFPT_BARRIER_REQUEST
516 0.555981336 172.31.31.144 -> 172.31.23.72 OpenFlow 146 Type: OFPT_FLOW_MOD
517 0.555983853 172.31.31.144 -> 172.31.23.72 OpenFlow 154 Type: OFPT_BARRIER_REQUEST
518 0.555985912 172.31.31.144 -> 172.31.23.72 OpenFlow 146 Type: OFPT_FLOW_MOD
519 0.555987601 172.31.31.144 -> 172.31.23.72 OpenFlow 146 Type: OFPT_FLOW_MOD
520 0.555989127 172.31.31.144 -> 172.31.23.72 OpenFlow 146 Type: OFPT_FLOW_MOD
521 0.555991915 172.31.31.144 -> 172.31.23.72 OpenFlow 154 Type: OFPT_BARRIER_REQUEST
522 0.555996616 172.31.31.144 -> 172.31.23.72 OpenFlow 154 Type: OFPT_BARRIER_REQUEST
523 0.555998258 172.31.31.144 -> 172.31.23.72 OpenFlow 154 Type: OFPT_BARRIER_REQUEST
524 0.555999989 172.31.31.144 -> 172.31.23.72 OpenFlow 146 Type: OFPT_FLOW_MOD
525 0.556003096 172.31.31.144 -> 172.31.23.72 OpenFlow 154 Type: OFPT_BARRIER_REQUEST
526 0.556004429 172.31.31.144 -> 172.31.23.72 OpenFlow 146 Type: OFPT_FLOW_MOD
527 0.556005537 172.31.31.144 -> 172.31.23.72 OpenFlow 146 Type: OFPT_FLOW_MOD
528 0.556007344 172.31.31.144 -> 172.31.23.72 OpenFlow 154 Type: OFPT_BARRIER_REQUEST
529 0.556008842 172.31.31.144 -> 172.31.23.72 OpenFlow 146 Type: OFPT_FLOW_MOD
530 0.556011879 172.31.31.144 -> 172.31.23.72 OpenFlow 146 Type: OFPT_FLOW_MOD
531 0.556013580 172.31.31.144 -> 172.31.23.72 OpenFlow 154 Type: OFPT_BARRIER_REQUEST
532 0.556014885 172.31.31.144 -> 172.31.23.72 OpenFlow 74 Type: OFPT_BARRIER_REQUEST
533 0.556016089 172.31.31.144 -> 172.31.23.72 OpenFlow 146 Type: OFPT_FLOW_MOD
534 0.556017833 172.31.31.144 -> 172.31.23.72 OpenFlow 234 Type: OFPT_BARRIER_REQUEST
535 0.556019540 172.31.31.144 -> 172.31.23.72 OpenFlow 146 Type: OFPT_FLOW_MOD
536 0.556021184 172.31.31.144 -> 172.31.23.72 OpenFlow 146 Type: OFPT_FLOW_MOD
537 0.556046941 172.31.31.144 -> 172.31.23.72 OpenFlow 154 Type: OFPT_BARRIER_REQUEST
538 0.556049160 172.31.31.144 -> 172.31.23.72 OpenFlow 146 Type: OFPT_FLOW_MOD
539 0.556052273 172.31.31.144 -> 172.31.23.72 OpenFlow 146 Type: OFPT_FLOW_MOD
540 0.556054209 172.31.31.144 -> 172.31.23.72 OpenFlow 154 Type: OFPT_BARRIER_REQUEST
541 0.556055586 172.31.31.144 -> 172.31.23.72 OpenFlow 146 Type: OFPT_FLOW_MOD
542 0.556056906 172.31.31.144 -> 172.31.23.72 OpenFlow 74 Type: OFPT_BARRIER_REQUEST
543 0.556163396 172.31.23.72 -> 172.31.31.144 OpenFlow 74 Type: OFPT_BARRIER_REPLY
544 0.556239464 172.31.23.72 -> 172.31.31.144 OpenFlow 74 Type: OFPT_BARRIER_REPLY
545 0.556328575 172.31.23.72 -> 172.31.31.144 OpenFlow 74 Type: OFPT_BARRIER_REPLY
546 0.556356297 172.31.23.72 -> 172.31.31.144 TCP 66 45418 → 6633 [ACK] Seq=985 Ack=1379 Win=213 Len=0 TSval=19378571 TSecr=808445
547 0.556360523 172.31.23.72 -> 172.31.31.144 OpenFlow 74 Type: OFPT_BARRIER_REPLY
548 0.556397428 172.31.23.72 -> 172.31.31.144 OpenFlow 74 Type: OFPT_BARRIER_REPLY
549 0.556437268 172.31.23.72 -> 172.31.31.144 OpenFlow 74 Type: OFPT_BARRIER_REPLY
550 0.556470896 172.31.23.72 -> 172.31.31.144 TCP 66 45416 → 6633 [ACK] Seq=739 Ack=1137 Win=213 Len=0 TSval=19378571 TSecr=808446
551 0.556474745 172.31.23.72 -> 172.31.31.144 OpenFlow 74 Type: OFPT_BARRIER_REPLY
552 0.556501098 172.31.23.72 -> 172.31.31.144 OpenFlow 74 Type: OFPT_BARRIER_REPLY
553 0.556549956 172.31.23.72 -> 172.31.31.144 OpenFlow 74 Type: OFPT_BARRIER_REPLY
554 0.556595266 172.31.23.72 -> 172.31.31.144 TCP 66 45458 → 6633 [ACK] Seq=739 Ack=1137 Win=213 Len=0 TSval=19378571 TSecr=808445
555 0.556599443 172.31.23.72 -> 172.31.31.144 OpenFlow 74 Type: OFPT_BARRIER_REPLY
556 0.556624515 172.31.23.72 -> 172.31.31.144 TCP 66 45414 → 6633 [ACK] Seq=493 Ack=895 Win=213 Len=0 TSval=19378571 TSecr=808446
557 0.556628479 172.31.23.72 -> 172.31.31.144 OpenFlow 74 Type: OFPT_BARRIER_REPLY
558 0.556653866 172.31.23.72 -> 172.31.31.144 OpenFlow 74 Type: OFPT_BARRIER_REPLY
559 0.557952960 172.31.23.72 -> 172.31.31.144 OpenFlow 730 Type: OFPT_FLOW_REMOVED
560 0.557961139 172.31.23.72 -> 172.31.31.144 OpenFlow 562 Type: OFPT_FLOW_REMOVED
561 0.557962951 172.31.23.72 -> 172.31.31.144 OpenFlow 394 Type: OFPT_FLOW_REMOVED
562 0.557964828 172.31.23.72 -> 172.31.31.144 OpenFlow 226 Type: OFPT_FLOW_REMOVED
563 0.558437712 172.31.23.72 -> 172.31.31.144 OpenFlow 394 Type: OFPT_FLOW_REMOVED
564 0.558440029 172.31.23.72 -> 172.31.31.144 OpenFlow 562 Type: OFPT_FLOW_REMOVED
565 0.558441588 172.31.23.72 -> 172.31.31.144 OpenFlow 226 Type: OFPT_FLOW_REMOVED
566 0.558443476 172.31.23.72 -> 172.31.31.144 OpenFlow 810 Type: OFPT_FLOW_REMOVED
567 0.558445184 172.31.23.72 -> 172.31.31.144 OpenFlow 810 Type: OFPT_FLOW_REMOVED
568 0.558446831 172.31.23.72 -> 172.31.31.144 OpenFlow 226 Type: OFPT_FLOW_REMOVED
569 0.559512363 172.31.31.144 -> 172.31.23.72 OpenFlow 234 Type: OFPT_BARRIER_REQUEST
570 0.559522706 172.31.31.144 -> 172.31.23.72 TCP 66 6633 → 45414 [ACK] Seq=895 Ack=501 Win=853 Len=0 TSval=808446 TSecr=19378571
571 0.559527756 172.31.23.72 -> 172.31.31.144 OpenFlow 226 Type: OFPT_FLOW_REMOVED
572 0.559533973 172.31.31.144 -> 172.31.23.72 TCP 66 6633 → 45420 [ACK] Seq=1473 Ack=747 Win=853 Len=0 TSval=808446 TSecr=19378571
573 0.559536643 172.31.31.144 -> 172.31.23.72 OpenFlow 154 Type: OFPT_BARRIER_REQUEST
574 0.559539205 172.31.31.144 -> 172.31.23.72 OpenFlow 154 Type: OFPT_BARRIER_REQUEST
575 0.559541529 172.31.31.144 -> 172.31.23.72 OpenFlow 170 Type: OFPT_FLOW_MOD
576 0.559543369 172.31.31.144 -> 172.31.23.72 OpenFlow 170 Type: OFPT_FLOW_MOD
577 0.559545429 172.31.31.144 -> 172.31.23.72 OpenFlow 170 Type: OFPT_FLOW_MOD
578 0.559549194 172.31.31.144 -> 172.31.23.72 OpenFlow 178 Type: OFPT_BARRIER_REQUEST
579 0.559550869 172.31.31.144 -> 172.31.23.72 OpenFlow 170 Type: OFPT_FLOW_MOD
580 0.559553134 172.31.31.144 -> 172.31.23.72 OpenFlow 178 Type: OFPT_BARRIER_REQUEST
581 0.559555116 172.31.31.144 -> 172.31.23.72 OpenFlow 170 Type: OFPT_FLOW_MOD
582 0.559557740 172.31.31.144 -> 172.31.23.72 OpenFlow 178 Type: OFPT_BARRIER_REQUEST
583 0.559559428 172.31.31.144 -> 172.31.23.72 OpenFlow 170 Type: OFPT_FLOW_MOD
584 0.559561048 172.31.31.144 -> 172.31.23.72 OpenFlow 178 Type: OFPT_BARRIER_REQUEST
585 0.559562536 172.31.31.144 -> 172.31.23.72 OpenFlow 74 Type: OFPT_BARRIER_REQUEST
586 0.559563799 172.31.31.144 -> 172.31.23.72 OpenFlow 170 Type: OFPT_FLOW_MOD
587 0.559565046 172.31.31.144 -> 172.31.23.72 OpenFlow 178 Type: OFPT_BARRIER_REQUEST
588 0.559566344 172.31.31.144 -> 172.31.23.72 OpenFlow 170 Type: OFPT_FLOW_MOD
589 0.559567883 172.31.31.144 -> 172.31.23.72 OpenFlow 178 Type: OFPT_BARRIER_REQUEST
590 0.559580805 172.31.23.72 -> 172.31.31.144 OpenFlow 898 Type: OFPT_FLOW_REMOVED
591 0.559674802 172.31.23.72 -> 172.31.31.144 OpenFlow 74 Type: OFPT_BARRIER_REPLY
592 0.559709968 172.31.23.72 -> 172.31.31.144 TCP 66 45420 → 6633 [ACK] Seq=1243 Ack=1689 Win=213 Len=0 TSval=19378571 TSecr=808447
593 0.559714997 172.31.23.72 -> 172.31.31.144 OpenFlow 74 Type: OFPT_BARRIER_REPLY
594 0.559756206 172.31.23.72 -> 172.31.31.144 TCP 66 45438 → 6633 [ACK] Seq=985 Ack=1185 Win=213 Len=0 TSval=19378571 TSecr=808447
595 0.559761337 172.31.23.72 -> 172.31.31.144 OpenFlow 74 Type: OFPT_BARRIER_REPLY
596 0.559788806 172.31.23.72 -> 172.31.31.144 TCP 66 45428 → 6633 [ACK] Seq=1243 Ack=1447 Win=213 Len=0 TSval=19378571 TSecr=808447
597 0.559793227 172.31.23.72 -> 172.31.31.144 OpenFlow 74 Type: OFPT_BARRIER_REPLY
598 0.559817513 172.31.23.72 -> 172.31.31.144 TCP 66 45446 → 6633 [ACK] Seq=1231 Ack=1427 Win=213 Len=0 TSval=19378571 TSecr=808447
599 0.559821622 172.31.23.72 -> 172.31.31.144 OpenFlow 74 Type: OFPT_BARRIER_REPLY
600 0.559836394 172.31.23.72 -> 172.31.31.144 OpenFlow 74 Type: OFPT_BARRIER_REPLY
601 0.559861909 172.31.23.72 -> 172.31.31.144 OpenFlow 74 Type: OFPT_BARRIER_REPLY
602 0.559891272 172.31.23.72 -> 172.31.31.144 TCP 66 45458 → 6633 [ACK] Seq=907 Ack=1353 Win=213 Len=0 TSval=19378571 TSecr=808447
603 0.559895528 172.31.23.72 -> 172.31.31.144 OpenFlow 74 Type: OFPT_BARRIER_REPLY
604 0.560702147 172.31.23.72 -> 172.31.31.144 OpenFlow 226 Type: OFPT_FLOW_REMOVED
605 0.560994751 172.31.23.72 -> 172.31.31.144 OpenFlow 154 Type: OFPT_FLOW_REMOVED
606 0.560996915 172.31.23.72 -> 172.31.31.144 OpenFlow 154 Type: OFPT_FLOW_REMOVED
607 0.563757614 172.31.31.144 -> 172.31.23.72 TCP 66 6633 → 45424 [ACK] Seq=1547 Ack=1567 Win=853 Len=0 TSval=808447 TSecr=19378571
608 0.563765675 172.31.31.144 -> 172.31.23.72 TCP 66 6633 → 45416 [ACK] Seq=1137 Ack=907 Win=853 Len=0 TSval=808447 TSecr=19378571
609 0.563767870 172.31.31.144 -> 172.31.23.72 TCP 66 6633 → 45418 [ACK] Seq=1379 Ack=1153 Win=853 Len=0 TSval=808447 TSecr=19378571
610 0.563769805 172.31.31.144 -> 172.31.23.72 TCP 66 6633 → 45430 [ACK] Seq=1547 Ack=1567 Win=853 Len=0 TSval=808447 TSecr=19378571
611 0.563771957 172.31.31.144 -> 172.31.23.72 OpenFlow 170 Type: OFPT_FLOW_MOD
612 0.563776417 172.31.31.144 -> 172.31.23.72 TCP 66 6633 → 45414 [ACK] Seq=895 Ack=661 Win=853 Len=0 TSval=808447 TSecr=19378571
613 0.563778661 172.31.31.144 -> 172.31.23.72 OpenFlow 170 Type: OFPT_FLOW_MOD
614 0.563780396 172.31.31.144 -> 172.31.23.72 TCP 66 6633 → 45448 [ACK] Seq=1567 Ack=1659 Win=853 Len=0 TSval=808447 TSecr=19378571
615 0.563782583 172.31.31.144 -> 172.31.23.72 TCP 66 6633 → 45462 [ACK] Seq=1567 Ack=1499 Win=853 Len=0 TSval=808447 TSecr=19378571
616 0.563784833 172.31.31.144 -> 172.31.23.72 OpenFlow 170 Type: OFPT_FLOW_MOD
617 0.563790694 172.31.31.144 -> 172.31.23.72 OpenFlow 170 Type: OFPT_FLOW_MOD
618 0.563792618 172.31.31.144 -> 172.31.23.72 OpenFlow 170 Type: OFPT_FLOW_MOD
619 0.563794771 172.31.31.144 -> 172.31.23.72 OpenFlow 178 Type: OFPT_BARRIER_REQUEST
620 0.563796266 172.31.31.144 -> 172.31.23.72 OpenFlow 170 Type: OFPT_FLOW_MOD
621 0.563798570 172.31.31.144 -> 172.31.23.72 OpenFlow 170 Type: OFPT_FLOW_MOD
622 0.563799949 172.31.31.144 -> 172.31.23.72 OpenFlow 170 Type: OFPT_FLOW_MOD
623 0.563801536 172.31.31.144 -> 172.31.23.72 OpenFlow 170 Type: OFPT_FLOW_MOD
624 0.563803411 172.31.31.144 -> 172.31.23.72 OpenFlow 394 Type: OFPT_BARRIER_REQUEST
625 0.563806073 172.31.31.144 -> 172.31.23.72 OpenFlow 170 Type: OFPT_FLOW_MOD
626 0.563807448 172.31.31.144 -> 172.31.23.72 OpenFlow 170 Type: OFPT_FLOW_MOD
627 0.563808923 172.31.31.144 -> 172.31.23.72 OpenFlow 170 Type: OFPT_FLOW_MOD
628 0.563812765 172.31.31.144 -> 172.31.23.72 OpenFlow 170 Type: OFPT_FLOW_MOD
629 0.563814452 172.31.31.144 -> 172.31.23.72 OpenFlow 170 Type: OFPT_FLOW_MOD
630 0.563815859 172.31.31.144 -> 172.31.23.72 OpenFlow 282 Type: OFPT_FLOW_MOD
631 0.563817671 172.31.31.144 -> 172.31.23.72 OpenFlow 178 Type: OFPT_BARRIER_REQUEST
632 0.563822592 172.31.31.144 -> 172.31.23.72 OpenFlow 170 Type: OFPT_FLOW_MOD
633 0.563824775 172.31.31.144 -> 172.31.23.72 OpenFlow 274 Type: OFPT_FLOW_MOD
634 0.563826288 172.31.31.144 -> 172.31.23.72 OpenFlow 178 Type: OFPT_BARRIER_REQUEST
635 0.563828118 172.31.31.144 -> 172.31.23.72 OpenFlow 282 Type: OFPT_FLOW_MOD
636 0.563830403 172.31.31.144 -> 172.31.23.72 OpenFlow 178 Type: OFPT_FLOW_MOD
637 0.563832330 172.31.31.144 -> 172.31.23.72 OpenFlow 170 Type: OFPT_FLOW_MOD
638 0.563833823 172.31.31.144 -> 172.31.23.72 OpenFlow 170 Type: OFPT_FLOW_MOD
639 0.563836174 172.31.31.144 -> 172.31.23.72 OpenFlow 170 Type: OFPT_FLOW_MOD
640 0.563837420 172.31.31.144 -> 172.31.23.72 OpenFlow 170 Type: OFPT_FLOW_MOD
641 0.563838928 172.31.31.144 -> 172.31.23.72 OpenFlow 178 Type: OFPT_BARRIER_REQUEST
642 0.563840572 172.31.31.144 -> 172.31.23.72 OpenFlow 170 Type: OFPT_FLOW_MOD
643 0.563843022 172.31.31.144 -> 172.31.23.72 OpenFlow 170 Type: OFPT_FLOW_MOD
644 0.563844761 172.31.31.144 -> 172.31.23.72 OpenFlow 170 Type: OFPT_FLOW_MOD
645 0.563847142 172.31.31.144 -> 172.31.23.72 OpenFlow 74 Type: OFPT_BARRIER_REQUEST
646 0.563848541 172.31.31.144 -> 172.31.23.72 OpenFlow 170 Type: OFPT_FLOW_MOD
647 0.563851119 172.31.31.144 -> 172.31.23.72 OpenFlow 170 Type: OFPT_FLOW_MOD
648 0.563852695 172.31.31.144 -> 172.31.23.72 OpenFlow 74 Type: OFPT_BARRIER_REQUEST
649 0.563854319 172.31.31.144 -> 172.31.23.72 OpenFlow 178 Type: OFPT_BARRIER_REQUEST
650 0.563855877 172.31.31.144 -> 172.31.23.72 OpenFlow 178 Type: OFPT_BARRIER_REQUEST
651 0.563857336 172.31.31.144 -> 172.31.23.72 OpenFlow 178 Type: OFPT_BARRIER_REQUEST
652 0.563858888 172.31.31.144 -> 172.31.23.72 OpenFlow 170 Type: OFPT_FLOW_MOD
653 0.563860894 172.31.31.144 -> 172.31.23.72 OpenFlow 170 Type: OFPT_FLOW_MOD
654 0.563862486 172.31.31.144 -> 172.31.23.72 OpenFlow 386 Type: OFPT_FLOW_MOD
655 0.563864336 172.31.31.144 -> 172.31.23.72 OpenFlow 170 Type: OFPT_FLOW_MOD
656 0.563866020 172.31.31.144 -> 172.31.23.72 OpenFlow 178 Type: OFPT_BARRIER_REQUEST
657 0.563867501 172.31.31.144 -> 172.31.23.72 OpenFlow 170 Type: OFPT_FLOW_MOD
658 0.563868875 172.31.31.144 -> 172.31.23.72 OpenFlow 178 Type: OFPT_BARRIER_REQUEST
659 0.563870005 172.31.31.144 -> 172.31.23.72 OpenFlow 290 Type: OFPT_BARRIER_REQUEST
660 0.563871288 172.31.31.144 -> 172.31.23.72 OpenFlow 170 Type: OFPT_FLOW_MOD
661 0.563872560 172.31.31.144 -> 172.31.23.72 OpenFlow 170 Type: OFPT_FLOW_MOD
662 0.563873771 172.31.31.144 -> 172.31.23.72 OpenFlow 74 Type: OFPT_BARRIER_REQUEST
663 0.563875206 172.31.31.144 -> 172.31.23.72 OpenFlow 170 Type: OFPT_FLOW_MOD
664 0.563877033 172.31.31.144 -> 172.31.23.72 OpenFlow 74 Type: OFPT_BARRIER_REQUEST
665 0.563878301 172.31.31.144 -> 172.31.23.72 OpenFlow 170 Type: OFPT_FLOW_MOD
666 0.563880103 172.31.31.144 -> 172.31.23.72 OpenFlow 178 Type: OFPT_BARRIER_REQUEST
667 0.563881364 172.31.31.144 -> 172.31.23.72 OpenFlow 170 Type: OFPT_FLOW_MOD
668 0.563883821 172.31.31.144 -> 172.31.23.72 OpenFlow 178 Type: OFPT_BARRIER_REQUEST
669 0.563885140 172.31.31.144 -> 172.31.23.72 OpenFlow 170 Type: OFPT_FLOW_MOD
670 0.563886813 172.31.31.144 -> 172.31.23.72 OpenFlow 170 Type: OFPT_FLOW_MOD
671 0.563910067 172.31.31.144 -> 172.31.23.72 OpenFlow 170 Type: OFPT_FLOW_MOD
672 0.563912044 172.31.31.144 -> 172.31.23.72 OpenFlow 170 Type: OFPT_FLOW_MOD
673 0.563913498 172.31.31.144 -> 172.31.23.72 OpenFlow 170 Type: OFPT_FLOW_MOD
674 0.563915103 172.31.31.144 -> 172.31.23.72 OpenFlow 74 Type: OFPT_BARRIER_REQUEST
675 0.563916533 172.31.31.144 -> 172.31.23.72 OpenFlow 74 Type: OFPT_BARRIER_REQUEST
676 0.563918046 172.31.31.144 -> 172.31.23.72 OpenFlow 170 Type: OFPT_FLOW_MOD
677 0.563919466 172.31.31.144 -> 172.31.23.72 OpenFlow 170 Type: OFPT_FLOW_MOD
678 0.563920955 172.31.31.144 -> 172.31.23.72 OpenFlow 178 Type: OFPT_BARRIER_REQUEST
679 0.563921987 172.31.31.144 -> 172.31.23.72 OpenFlow 170 Type: OFPT_FLOW_MOD
680 0.563923446 172.31.31.144 -> 172.31.23.72 OpenFlow 170 Type: OFPT_FLOW_MOD
681 0.563924886 172.31.31.144 -> 172.31.23.72 OpenFlow 170 Type: OFPT_FLOW_MOD
682 0.563926151 172.31.31.144 -> 172.31.23.72 OpenFlow 74 Type: OFPT_BARRIER_REQUEST
683 0.563927437 172.31.31.144 -> 172.31.23.72 OpenFlow 74 Type: OFPT_BARRIER_REQUEST
684 0.563928871 172.31.31.144 -> 172.31.23.72 OpenFlow 170 Type: OFPT_FLOW_MOD
685 0.563930498 172.31.31.144 -> 172.31.23.72 OpenFlow 178 Type: OFPT_BARRIER_REQUEST
686 0.563931655 172.31.31.144 -> 172.31.23.72 OpenFlow 170 Type: OFPT_FLOW_MOD
687 0.564493479 172.31.23.72 -> 172.31.31.144 OpenFlow 74 Type: OFPT_BARRIER_REPLY
688 0.564547318 172.31.23.72 -> 172.31.31.144 TCP 66 45420 → 6633 [ACK] Seq=1251 Ack=2113 Win=213 Len=0 TSval=19378573 TSecr=808447
689 0.564551935 172.31.23.72 -> 172.31.31.144 OpenFlow 74 Type: OFPT_BARRIER_REPLY
690 0.564573013 172.31.23.72 -> 172.31.31.144 TCP 66 45434 → 6633 [ACK] Seq=1231 Ack=1427 Win=213 Len=0 TSval=19378573 TSecr=808447
691 0.564577228 172.31.23.72 -> 172.31.31.144 OpenFlow 74 Type: OFPT_BARRIER_REPLY
692 0.564598113 172.31.23.72 -> 172.31.31.144 OpenFlow 74 Type: OFPT_BARRIER_REPLY
693 0.564627436 172.31.23.72 -> 172.31.31.144 TCP 66 45418 → 6633 [ACK] Seq=1153 Ack=1595 Win=213 Len=0 TSval=19378573 TSecr=808447
694 0.564631363 172.31.23.72 -> 172.31.31.144 OpenFlow 74 Type: OFPT_BARRIER_REPLY
695 0.564650831 172.31.23.72 -> 172.31.31.144 TCP 66 45444 → 6633 [ACK] Seq=1231 Ack=1427 Win=213 Len=0 TSval=19378573 TSecr=808447
696 0.564654684 172.31.23.72 -> 172.31.31.144 OpenFlow 74 Type: OFPT_BARRIER_REPLY
697 0.564674794 172.31.23.72 -> 172.31.31.144 OpenFlow 74 Type: OFPT_BARRIER_REPLY
698 0.564718241 172.31.23.72 -> 172.31.31.144 OpenFlow 74 Type: OFPT_BARRIER_REPLY
699 0.564757337 172.31.23.72 -> 172.31.31.144 OpenFlow 74 Type: OFPT_BARRIER_REPLY
700 0.564780267 172.31.23.72 -> 172.31.31.144 TCP 66 45416 → 6633 [ACK] Seq=907 Ack=1353 Win=213 Len=0 TSval=19378573 TSecr=808447
701 0.564784306 172.31.23.72 -> 172.31.31.144 OpenFlow 74 Type: OFPT_BARRIER_REPLY
702 0.564807785 172.31.23.72 -> 172.31.31.144 OpenFlow 74 Type: OFPT_BARRIER_REPLY
703 0.564851291 172.31.23.72 -> 172.31.31.144 OpenFlow 74 Type: OFPT_BARRIER_REPLY
704 0.564888999 172.31.23.72 -> 172.31.31.144 OpenFlow 74 Type: OFPT_BARRIER_REPLY
705 0.564938268 172.31.23.72 -> 172.31.31.144 OpenFlow 74 Type: OFPT_BARRIER_REPLY
706 0.564990651 172.31.23.72 -> 172.31.31.144 OpenFlow 74 Type: OFPT_BARRIER_REPLY
707 0.565019575 172.31.23.72 -> 172.31.31.144 TCP 66 45448 → 6633 [ACK] Seq=1659 Ack=1783 Win=213 Len=0 TSval=19378573 TSecr=808447
708 0.565023522 172.31.23.72 -> 172.31.31.144 OpenFlow 74 Type: OFPT_BARRIER_REPLY
709 0.565043949 172.31.23.72 -> 172.31.31.144 TCP 66 45442 → 6633 [ACK] Seq=739 Ack=943 Win=213 Len=0 TSval=19378573 TSecr=808447
710 0.565047864 172.31.23.72 -> 172.31.31.144 OpenFlow 74 Type: OFPT_BARRIER_REPLY
711 0.565068595 172.31.23.72 -> 172.31.31.144 TCP 66 45426 → 6633 [ACK] Seq=1231 Ack=1427 Win=213 Len=0 TSval=19378573 TSecr=808447
712 0.565072738 172.31.23.72 -> 172.31.31.144 OpenFlow 74 Type: OFPT_BARRIER_REPLY
713 0.565668573 172.31.31.144 -> 172.31.23.72 OpenFlow 170 Type: OFPT_FLOW_MOD
714 0.565678063 172.31.23.72 -> 172.31.31.144 OpenFlow 82 Type: OFPT_BARRIER_REPLY
715 0.566273759 172.31.23.72 -> 172.31.31.144 OpenFlow 74 Type: OFPT_BARRIER_REPLY
716 0.566280846 172.31.23.72 -> 172.31.31.144 OpenFlow 74 Type: OFPT_BARRIER_REPLY
717 0.566282472 172.31.23.72 -> 172.31.31.144 OpenFlow 82 Type: OFPT_BARRIER_REPLY
718 0.566283980 172.31.23.72 -> 172.31.31.144 OpenFlow 74 Type: OFPT_BARRIER_REPLY
719 0.566565353 172.31.23.72 -> 172.31.31.144 OpenFlow 82 Type: OFPT_BARRIER_REPLY
720 0.566567478 172.31.23.72 -> 172.31.31.144 OpenFlow 82 Type: OFPT_BARRIER_REPLY
721 0.567974116 172.31.31.144 -> 172.31.23.72 TCP 66 6633 → 45436 [ACK] Seq=1401 Ack=993 Win=853 Len=0 TSval=808448 TSecr=19378573
722 0.567980907 172.31.31.144 -> 172.31.23.72 TCP 66 6633 → 45434 [ACK] Seq=1427 Ack=1239 Win=853 Len=0 TSval=808448 TSecr=19378573
723 0.567983355 172.31.31.144 -> 172.31.23.72 TCP 66 6633 → 45444 [ACK] Seq=1427 Ack=1239 Win=853 Len=0 TSval=808448 TSecr=19378573
724 0.567985104 172.31.31.144 -> 172.31.23.72 OpenFlow 74 Type: OFPT_BARRIER_REQUEST
725 0.567987298 172.31.31.144 -> 172.31.23.72 TCP 66 6633 → 45432 [ACK] Seq=2449 Ack=1841 Win=853 Len=0 TSval=808448 TSecr=19378572
726 0.567989430 172.31.31.144 -> 172.31.23.72 TCP 66 6633 → 45442 [ACK] Seq=943 Ack=747 Win=853 Len=0 TSval=808448 TSecr=19378573
727 0.567991238 172.31.31.144 -> 172.31.23.72 TCP 66 6633 → 45426 [ACK] Seq=1427 Ack=1239 Win=853 Len=0 TSval=808448 TSecr=19378573
728 0.567992975 172.31.31.144 -> 172.31.23.72 TCP 66 6633 → 45460 [ACK] Seq=2847 Ack=1365 Win=853 Len=0 TSval=808448 TSecr=19378573
729 0.568261102 172.31.31.144 -> 172.31.23.72 TCP 66 6633 → 45436 [ACK] Seq=1401 Ack=1001 Win=853 Len=0 TSval=808449 TSecr=19378573
730 0.568265608 172.31.31.144 -> 172.31.23.72 TCP 66 6633 → 45424 [ACK] Seq=1979 Ack=1583 Win=853 Len=0 TSval=808449 TSecr=19378573
731 0.568359801 172.31.23.72 -> 172.31.31.144 OpenFlow 74 Type: OFPT_BARRIER_REPLY
732 0.571356628 172.31.31.144 -> 172.31.23.72 TCP 66 6633 → 45438 [ACK] Seq=1833 Ack=1017 Win=853 Len=0 TSval=808449 TSecr=19378573
733 0.571364369 172.31.31.144 -> 172.31.23.72 TCP 66 6633 → 45430 [ACK] Seq=1979 Ack=1583 Win=853 Len=0 TSval=808449 TSecr=19378573
734 0.571366700 172.31.31.144 -> 172.31.23.72 TCP 66 6633 → 45458 [ACK] Seq=2105 Ack=939 Win=853 Len=0 TSval=808449 TSecr=19378573
735 0.572857335 172.31.31.144 -> 172.31.23.72 TCP 66 6633 → 45446 [ACK] Seq=2291 Ack=1271 Win=853 Len=0 TSval=808450 TSecr=19378573
736 0.603076336 172.31.31.144 -> 172.31.23.72 TCP 66 6633 → 45448 [ACK] Seq=1783 Ack=1667 Win=853 Len=0 TSval=808458 TSecr=19378573
737 0.603088578 172.31.31.144 -> 172.31.23.72 TCP 66 6633 → 45462 [ACK] Seq=1567 Ack=1659 Win=853 Len=0 TSval=808458 TSecr=19378572
738 0.603095142 172.31.31.144 -> 172.31.23.72 TCP 66 6633 → 45420 [ACK] Seq=2113 Ack=1259 Win=853 Len=0 TSval=808458 TSecr=19378573
739 0.603097612 172.31.31.144 -> 172.31.23.72 TCP 66 6633 → 45414 [ACK] Seq=1319 Ack=669 Win=853 Len=0 TSval=808458 TSecr=19378573
740 0.603100466 172.31.31.144 -> 172.31.23.72 TCP 66 6633 → 45416 [ACK] Seq=1353 Ack=915 Win=853 Len=0 TSval=808458 TSecr=19378573
741 0.603105042 172.31.31.144 -> 172.31.23.72 TCP 66 6633 → 45428 [ACK] Seq=1975 Ack=1259 Win=853 Len=0 TSval=808458 TSecr=19378573
742 0.603123510 172.31.31.144 -> 172.31.23.72 TCP 66 6633 → 45418 [ACK] Seq=1595 Ack=1161 Win=853 Len=0 TSval=808458 TSecr=19378573
743 1.787654972 172.31.31.144 -> 172.31.23.72 OpenFlow 90 Type: OFPT_MULTIPART_REQUEST, OFPMP_PORT_STATS
744 1.788032329 172.31.23.72 -> 172.31.31.144 OpenFlow 530 Type: OFPT_MULTIPART_REPLY, OFPMP_PORT_STATS
745 1.788338955 172.31.31.144 -> 172.31.23.72 TCP 66 6633 → 45414 [ACK] Seq=1343 Ack=1133 Win=853 Len=0 TSval=808754 TSecr=19378878
746 1.788819743 172.31.31.144 -> 172.31.23.72 OpenFlow 122 Type: OFPT_MULTIPART_REQUEST, OFPMP_FLOW
747 1.788825440 172.31.31.144 -> 172.31.23.72 OpenFlow 82 Type: OFPT_MULTIPART_REQUEST, OFPMP_TABLE
748 1.789023421 172.31.23.72 -> 172.31.31.144 OpenFlow 2010 Type: OFPT_MULTIPART_REPLY, OFPMP_FLOW
749 1.789196486 172.31.23.72 -> 172.31.31.144 OpenFlow 6178 Type: OFPT_MULTIPART_REPLY, OFPMP_TABLE
750 1.789502746 172.31.31.144 -> 172.31.23.72 TCP 66 6633 → 45414 [ACK] Seq=1415 Ack=9189 Win=853 Len=0 TSval=808754 TSecr=19378879
751 1.837970211 172.31.31.144 -> 172.31.23.72 OpenFlow 82 Type: OFPT_MULTIPART_REQUEST, OFPMP_TABLE
752 1.838015664 172.31.31.144 -> 172.31.23.72 OpenFlow 146 Type: OFPT_MULTIPART_REQUEST, OFPMP_FLOW
753 1.838421504 172.31.23.72 -> 172.31.31.144 OpenFlow 6178 Type: OFPT_MULTIPART_REPLY, OFPMP_TABLE
754 1.838541853 172.31.23.72 -> 172.31.31.144 OpenFlow 642 Type: OFPT_MULTIPART_REPLY, OFPMP_PORT_STATS
755 1.838624569 172.31.23.72 -> 172.31.31.144 OpenFlow 2634 Type: OFPT_MULTIPART_REPLY, OFPMP_FLOW
756 1.838730808 172.31.31.144 -> 172.31.23.72 TCP 66 6633 → 45416 [ACK] Seq=1449 Ack=7027 Win=853 Len=0 TSval=808766 TSecr=19378891
757 1.838757815 172.31.31.144 -> 172.31.23.72 TCP 66 6633 → 45416 [ACK] Seq=1449 Ack=7603 Win=853 Len=0 TSval=808766 TSecr=19378891
758 1.838824066 172.31.31.144 -> 172.31.23.72 TCP 66 6633 → 45416 [ACK] Seq=1449 Ack=10171 Win=853 Len=0 TSval=808766 TSecr=19378891
759 1.871211364 172.31.31.144 -> 172.31.23.72 OpenFlow 122 Type: OFPT_MULTIPART_REQUEST, OFPMP_FLOW
760 1.871237917 172.31.31.144 -> 172.31.23.72 OpenFlow 106 Type: OFPT_MULTIPART_REQUEST, OFPMP_TABLE
761 1.871525340 172.31.23.72 -> 172.31.31.144 OpenFlow 2426 Type: OFPT_MULTIPART_REPLY, OFPMP_FLOW
762 1.871649141 172.31.23.72 -> 172.31.31.144 OpenFlow 754 Type: OFPT_MULTIPART_REPLY, OFPMP_PORT_STATS
763 1.871741710 172.31.31.144 -> 172.31.23.72 TCP 66 6633 → 45418 [ACK] Seq=1691 Ack=3521 Win=853 Len=0 TSval=808775 TSecr=19378899
764 1.871802940 172.31.31.144 -> 172.31.23.72 TCP 66 6633 → 45418 [ACK] Seq=1691 Ack=4209 Win=853 Len=0 TSval=808775 TSecr=19378899
765 1.871838602 172.31.23.72 -> 172.31.31.144 OpenFlow 6178 Type: OFPT_MULTIPART_REPLY, OFPMP_TABLE
766 1.872044561 172.31.31.144 -> 172.31.23.72 TCP 66 6633 → 45418 [ACK] Seq=1691 Ack=10321 Win=853 Len=0 TSval=808775 TSecr=19378899
767 1.896384674 172.31.31.144 -> 172.31.23.72 OpenFlow 82 Type: OFPT_MULTIPART_REQUEST, OFPMP_TABLE
768 1.896424065 172.31.31.144 -> 172.31.23.72 OpenFlow 146 Type: OFPT_MULTIPART_REQUEST, OFPMP_PORT_STATS
769 1.896762060 172.31.23.72 -> 172.31.31.144 OpenFlow 6178 Type: OFPT_MULTIPART_REPLY, OFPMP_TABLE
770 1.896841532 172.31.23.72 -> 172.31.31.144 OpenFlow 2010 Type: OFPT_MULTIPART_REPLY, OFPMP_FLOW
771 1.896946188 172.31.23.72 -> 172.31.31.144 OpenFlow 642 Type: OFPT_MULTIPART_REPLY, OFPMP_PORT_STATS
772 1.897029158 172.31.31.144 -> 172.31.23.72 TCP 66 6633 → 45420 [ACK] Seq=2209 Ack=7371 Win=853 Len=0 TSval=808781 TSecr=19378906
773 1.897056015 172.31.31.144 -> 172.31.23.72 TCP 66 6633 → 45420 [ACK] Seq=2209 Ack=9315 Win=853 Len=0 TSval=808781 TSecr=19378906
774 1.897143603 172.31.31.144 -> 172.31.23.72 TCP 66 6633 → 45420 [ACK] Seq=2209 Ack=9891 Win=853 Len=0 TSval=808781 TSecr=19378906
775 1.936644023 172.31.31.144 -> 172.31.23.72 OpenFlow 122 Type: OFPT_MULTIPART_REQUEST, OFPMP_FLOW
776 1.936663741 172.31.31.144 -> 172.31.23.72 OpenFlow 82 Type: OFPT_MULTIPART_REQUEST, OFPMP_TABLE
777 1.936678493 172.31.31.144 -> 172.31.23.72 OpenFlow 90 Type: OFPT_MULTIPART_REQUEST, OFPMP_PORT_STATS
778 1.936926978 172.31.23.72 -> 172.31.31.144 OpenFlow 554 Type: OFPT_MULTIPART_REPLY, OFPMP_FLOW
779 1.937098624 172.31.23.72 -> 172.31.31.144 OpenFlow 6178 Type: OFPT_MULTIPART_REPLY, OFPMP_TABLE
780 1.937164827 172.31.31.144 -> 172.31.23.72 TCP 66 6633 → 45422 [ACK] Seq=823 Ack=1227 Win=853 Len=0 TSval=808791 TSecr=19378916
781 1.937203418 172.31.23.72 -> 172.31.31.144 OpenFlow 530 Type: OFPT_MULTIPART_REPLY, OFPMP_PORT_STATS
782 1.937311793 172.31.31.144 -> 172.31.23.72 TCP 66 6633 → 45422 [ACK] Seq=823 Ack=7339 Win=853 Len=0 TSval=808791 TSecr=19378916
783 1.937355967 172.31.31.144 -> 172.31.23.72 TCP 66 6633 → 45422 [ACK] Seq=823 Ack=7803 Win=853 Len=0 TSval=808791 TSecr=19378916
784 1.979276587 172.31.31.144 -> 172.31.23.72 OpenFlow 82 Type: OFPT_MULTIPART_REQUEST, OFPMP_TABLE
785 1.979297823 172.31.31.144 -> 172.31.23.72 OpenFlow 146 Type: OFPT_MULTIPART_REQUEST, OFPMP_FLOW
786 1.979636133 172.31.23.72 -> 172.31.31.144 OpenFlow 6178 Type: OFPT_MULTIPART_REPLY, OFPMP_TABLE
787 1.980852281 172.31.23.72 -> 172.31.31.144 OpenFlow 4154 Type: OFPT_MULTIPART_REPLY, OFPMP_FLOW
788 1.982486686 172.31.31.144 -> 172.31.23.72 TCP 66 6633 → 45424 [ACK] Seq=2075 Ack=11783 Win=853 Len=0 TSval=808802 TSecr=19378926
789 2.053208052 172.31.31.144 -> 172.31.23.72 OpenFlow 122 Type: OFPT_MULTIPART_REQUEST, OFPMP_FLOW
790 2.053243088 172.31.31.144 -> 172.31.23.72 OpenFlow 106 Type: OFPT_MULTIPART_REQUEST, OFPMP_TABLE
791 2.053582438 172.31.23.72 -> 172.31.31.144 OpenFlow 1802 Type: OFPT_MULTIPART_REPLY, OFPMP_FLOW
792 2.053710094 172.31.23.72 -> 172.31.31.144 OpenFlow 754 Type: OFPT_MULTIPART_REPLY, OFPMP_PORT_STATS
793 2.053882798 172.31.23.72 -> 172.31.31.144 OpenFlow 6178 Type: OFPT_MULTIPART_REPLY, OFPMP_TABLE
794 2.054117665 172.31.31.144 -> 172.31.23.72 TCP 66 6633 → 45426 [ACK] Seq=1523 Ack=2975 Win=853 Len=0 TSval=808820 TSecr=19378945
795 2.054125658 172.31.31.144 -> 172.31.23.72 TCP 66 6633 → 45426 [ACK] Seq=1523 Ack=3663 Win=853 Len=0 TSval=808820 TSecr=19378945
796 2.054525520 172.31.31.144 -> 172.31.23.72 TCP 66 6633 → 45426 [ACK] Seq=1523 Ack=9775 Win=853 Len=0 TSval=808820 TSecr=19378945
797 2.100435205 172.31.31.144 -> 172.31.23.72 OpenFlow 90 Type: OFPT_MULTIPART_REQUEST, OFPMP_PORT_STATS
798 2.100459524 172.31.31.144 -> 172.31.23.72 OpenFlow 138 Type: OFPT_MULTIPART_REQUEST, OFPMP_TABLE
799 2.100776690 172.31.23.72 -> 172.31.31.144 OpenFlow 530 Type: OFPT_MULTIPART_REPLY, OFPMP_PORT_STATS
800 2.100844485 172.31.23.72 -> 172.31.31.144 OpenFlow 1178 Type: OFPT_MULTIPART_REPLY, OFPMP_FLOW
801 2.101014901 172.31.31.144 -> 172.31.23.72 TCP 66 6633 → 45428 [ACK] Seq=2071 Ack=1723 Win=853 Len=0 TSval=808832 TSecr=19378957
802 2.101031738 172.31.23.72 -> 172.31.31.144 OpenFlow 6178 Type: OFPT_MULTIPART_REPLY, OFPMP_TABLE
803 2.101041480 172.31.31.144 -> 172.31.23.72 TCP 66 6633 → 45428 [ACK] Seq=2071 Ack=2835 Win=853 Len=0 TSval=808832 TSecr=19378957
804 2.101229542 172.31.31.144 -> 172.31.23.72 TCP 66 6633 → 45428 [ACK] Seq=2071 Ack=8947 Win=853 Len=0 TSval=808832 TSecr=19378957
805 2.152600671 172.31.31.144 -> 172.31.23.72 OpenFlow 90 Type: OFPT_MULTIPART_REQUEST, OFPMP_PORT_STATS
806 2.152627856 172.31.31.144 -> 172.31.23.72 OpenFlow 138 Type: OFPT_MULTIPART_REQUEST, OFPMP_TABLE
807 2.152963534 172.31.23.72 -> 172.31.31.144 OpenFlow 754 Type: OFPT_MULTIPART_REPLY, OFPMP_PORT_STATS
808 2.153029983 172.31.23.72 -> 172.31.31.144 OpenFlow 1178 Type: OFPT_MULTIPART_REPLY, OFPMP_FLOW
809 2.153201820 172.31.23.72 -> 172.31.31.144 OpenFlow 6178 Type: OFPT_MULTIPART_REPLY, OFPMP_TABLE
810 2.153212355 172.31.31.144 -> 172.31.23.72 TCP 66 6633 → 45430 [ACK] Seq=2075 Ack=3383 Win=853 Len=0 TSval=808845 TSecr=19378970
811 2.190768019 172.31.31.144 -> 172.31.23.72 OpenFlow 90 Type: OFPT_MULTIPART_REQUEST, OFPMP_PORT_STATS
812 2.190800291 172.31.31.144 -> 172.31.23.72 OpenFlow 138 Type: OFPT_MULTIPART_REQUEST, OFPMP_FLOW
813 2.191075833 172.31.23.72 -> 172.31.31.144 OpenFlow 642 Type: OFPT_MULTIPART_REPLY, OFPMP_PORT_STATS
814 2.191250581 172.31.23.72 -> 172.31.31.144 OpenFlow 6178 Type: OFPT_MULTIPART_REPLY, OFPMP_TABLE
815 2.191343151 172.31.23.72 -> 172.31.31.144 OpenFlow 762 Type: OFPT_MULTIPART_REPLY, OFPMP_FLOW
816 2.192538020 172.31.31.144 -> 172.31.23.72 TCP 66 6633 → 45430 [ACK] Seq=2075 Ack=9495 Win=853 Len=0 TSval=808855 TSecr=19378970
817 2.192660072 172.31.31.144 -> 172.31.23.72 TCP 66 6633 → 45432 [ACK] Seq=2545 Ack=8529 Win=853 Len=0 TSval=808855 TSecr=19378979
818 2.233206586 172.31.31.144 -> 172.31.23.72 TCP 66 6633 → 45432 [ACK] Seq=2545 Ack=9225 Win=853 Len=0 TSval=808865 TSecr=19378979
819 2.236726293 172.31.31.144 -> 172.31.23.72 OpenFlow 90 Type: OFPT_MULTIPART_REQUEST, OFPMP_PORT_STATS
820 2.236739630 172.31.31.144 -> 172.31.23.72 OpenFlow 122 Type: OFPT_MULTIPART_REQUEST, OFPMP_FLOW
821 2.237019743 172.31.23.72 -> 172.31.31.144 OpenFlow 754 Type: OFPT_MULTIPART_REPLY, OFPMP_PORT_STATS
822 2.237123679 172.31.23.72 -> 172.31.31.144 OpenFlow 3258 Type: OFPT_MULTIPART_REPLY, OFPMP_FLOW
823 2.237935851 172.31.31.144 -> 172.31.23.72 OpenFlow 82 Type: OFPT_MULTIPART_REQUEST, OFPMP_TABLE
824 2.237946651 172.31.31.144 -> 172.31.23.72 TCP 66 6633 → 45434 [ACK] Seq=1523 Ack=1927 Win=853 Len=0 TSval=808866 TSecr=19378991
825 2.237950674 172.31.31.144 -> 172.31.23.72 TCP 66 6633 → 45434 [ACK] Seq=1523 Ack=5119 Win=853 Len=0 TSval=808866 TSecr=19378991
826 2.238201039 172.31.23.72 -> 172.31.31.144 OpenFlow 6178 Type: OFPT_MULTIPART_REPLY, OFPMP_TABLE
827 2.239001441 172.31.31.144 -> 172.31.23.72 TCP 66 6633 → 45434 [ACK] Seq=1523 Ack=11231 Win=853 Len=0 TSval=808866 TSecr=19378991
828 2.276417923 172.31.31.144 -> 172.31.23.72 OpenFlow 90 Type: OFPT_MULTIPART_REQUEST, OFPMP_PORT_STATS
829 2.276436656 172.31.31.144 -> 172.31.23.72 OpenFlow 138 Type: OFPT_MULTIPART_REQUEST, OFPMP_TABLE
830 2.276680924 172.31.23.72 -> 172.31.31.144 OpenFlow 642 Type: OFPT_MULTIPART_REPLY, OFPMP_PORT_STATS
831 2.276905767 172.31.23.72 -> 172.31.31.144 OpenFlow 7498 Type: OFPT_MULTIPART_REPLY, OFPMP_TABLE
832 2.277795238 172.31.31.144 -> 172.31.23.72 TCP 66 6633 → 45436 [ACK] Seq=1497 Ack=1577 Win=853 Len=0 TSval=808876 TSecr=19379001
833 2.277803219 172.31.31.144 -> 172.31.23.72 TCP 66 6633 → 45436 [ACK] Seq=1497 Ack=9009 Win=853 Len=0 TSval=808876 TSecr=19379001
834 2.307831338 172.31.31.144 -> 172.31.23.72 OpenFlow 90 Type: OFPT_MULTIPART_REQUEST, OFPMP_PORT_STATS
835 2.307851178 172.31.31.144 -> 172.31.23.72 OpenFlow 122 Type: OFPT_MULTIPART_REQUEST, OFPMP_FLOW
836 2.308134988 172.31.23.72 -> 172.31.31.144 OpenFlow 642 Type: OFPT_MULTIPART_REPLY, OFPMP_PORT_STATS
837 2.308246770 172.31.23.72 -> 172.31.31.144 OpenFlow 1178 Type: OFPT_MULTIPART_REPLY, OFPMP_FLOW
838 2.308510520 172.31.31.144 -> 172.31.23.72 TCP 66 6633 → 45438 [ACK] Seq=1913 Ack=2705 Win=853 Len=0 TSval=808884 TSecr=19379008
839 2.309026108 172.31.31.144 -> 172.31.23.72 OpenFlow 82 Type: OFPT_MULTIPART_REQUEST, OFPMP_TABLE
840 2.309274345 172.31.23.72 -> 172.31.31.144 OpenFlow 6178 Type: OFPT_MULTIPART_REPLY, OFPMP_TABLE
841 2.351212957 172.31.31.144 -> 172.31.23.72 TCP 66 6633 → 45438 [ACK] Seq=1929 Ack=8817 Win=853 Len=0 TSval=808894 TSecr=19379009
842 2.406257534 172.31.31.144 -> 172.31.23.72 OpenFlow 82 Type: OFPT_MULTIPART_REQUEST, OFPMP_TABLE
843 2.406302677 172.31.31.144 -> 172.31.23.72 OpenFlow 146 Type: OFPT_MULTIPART_REQUEST, OFPMP_FLOW
844 2.406754273 172.31.23.72 -> 172.31.31.144 OpenFlow 6178 Type: OFPT_MULTIPART_REPLY, OFPMP_TABLE
845 2.406854665 172.31.23.72 -> 172.31.31.144 OpenFlow 530 Type: OFPT_MULTIPART_REPLY, OFPMP_PORT_STATS
846 2.406945350 172.31.23.72 -> 172.31.31.144 OpenFlow 3258 Type: OFPT_MULTIPART_REPLY, OFPMP_FLOW
847 2.407001605 172.31.31.144 -> 172.31.23.72 TCP 66 6633 → 45442 [ACK] Seq=1039 Ack=6859 Win=853 Len=0 TSval=808909 TSecr=19379033
848 2.407043256 172.31.31.144 -> 172.31.23.72 TCP 66 6633 → 45442 [ACK] Seq=1039 Ack=7323 Win=853 Len=0 TSval=808909 TSecr=19379033
849 2.407129960 172.31.31.144 -> 172.31.23.72 TCP 66 6633 → 45442 [ACK] Seq=1039 Ack=10515 Win=853 Len=0 TSval=808909 TSecr=19379033
850 2.466456069 172.31.31.144 -> 172.31.23.72 OpenFlow 90 Type: OFPT_MULTIPART_REQUEST, OFPMP_PORT_STATS
851 2.466509619 172.31.31.144 -> 172.31.23.72 OpenFlow 138 Type: OFPT_MULTIPART_REQUEST, OFPMP_FLOW
852 2.466807629 172.31.23.72 -> 172.31.31.144 OpenFlow 754 Type: OFPT_MULTIPART_REPLY, OFPMP_PORT_STATS
853 2.466992216 172.31.23.72 -> 172.31.31.144 OpenFlow 6178 Type: OFPT_MULTIPART_REPLY, OFPMP_TABLE
854 2.467057228 172.31.31.144 -> 172.31.23.72 TCP 66 6633 → 45444 [ACK] Seq=1523 Ack=1927 Win=853 Len=0 TSval=808924 TSecr=19379048
855 2.467092934 172.31.23.72 -> 172.31.31.144 OpenFlow 2842 Type: OFPT_MULTIPART_REPLY, OFPMP_FLOW
856 2.467230930 172.31.31.144 -> 172.31.23.72 TCP 66 6633 → 45444 [ACK] Seq=1523 Ack=8039 Win=853 Len=0 TSval=808924 TSecr=19379048
857 2.467338258 172.31.31.144 -> 172.31.23.72 TCP 66 6633 → 45444 [ACK] Seq=1523 Ack=10815 Win=853 Len=0 TSval=808924 TSecr=19379048
858 2.505662393 172.31.31.144 -> 172.31.23.72 OpenFlow 90 Type: OFPT_MULTIPART_REQUEST, OFPMP_PORT_STATS
859 2.505693399 172.31.31.144 -> 172.31.23.72 OpenFlow 138 Type: OFPT_MULTIPART_REQUEST, OFPMP_FLOW
860 2.506018219 172.31.23.72 -> 172.31.31.144 OpenFlow 754 Type: OFPT_MULTIPART_REPLY, OFPMP_PORT_STATS
861 2.506197303 172.31.23.72 -> 172.31.31.144 OpenFlow 6178 Type: OFPT_MULTIPART_REPLY, OFPMP_TABLE
862 2.506296241 172.31.23.72 -> 172.31.31.144 OpenFlow 3258 Type: OFPT_MULTIPART_REPLY, OFPMP_FLOW
863 2.506445102 172.31.31.144 -> 172.31.23.72 TCP 66 6633 → 45446 [ACK] Seq=2387 Ack=8071 Win=853 Len=0 TSval=808933 TSecr=19379058
