  1 0.000000000 172.31.31.144 -> 172.31.23.72 TCP 187 6633 → 45546 [PSH, ACK] Seq=1 Ack=1 Win=853 Len=121 TSval=1207537 TSecr=30029003
  2 0.000049659 172.31.31.144 -> 172.31.23.72 TCP 187 6633 → 45546 [PSH, ACK] Seq=122 Ack=1 Win=853 Len=121 TSval=1207537 TSecr=30029003
  3 0.000084211 172.31.31.144 -> 172.31.23.72 TCP 187 6633 → 45546 [PSH, ACK] Seq=243 Ack=1 Win=853 Len=121 TSval=1207537 TSecr=30029003
  4 0.000136502 172.31.31.144 -> 172.31.23.72 TCP 187 6633 → 45546 [PSH, ACK] Seq=364 Ack=1 Win=853 Len=121 TSval=1207537 TSecr=30029003
  5 0.000195523 172.31.31.144 -> 172.31.23.72 TCP 187 6633 → 45546 [PSH, ACK] Seq=485 Ack=1 Win=853 Len=121 TSval=1207537 TSecr=30029003
  6 0.000258767 172.31.31.144 -> 172.31.23.72 TCP 187 6633 → 45546 [PSH, ACK] Seq=606 Ack=1 Win=853 Len=121 TSval=1207537 TSecr=30029003
  7 0.000304309 172.31.31.144 -> 172.31.23.72 TCP 187 6633 → 45546 [PSH, ACK] Seq=727 Ack=1 Win=853 Len=121 TSval=1207537 TSecr=30029003
  8 0.000350938 172.31.31.144 -> 172.31.23.72 TCP 187 6633 → 45546 [PSH, ACK] Seq=848 Ack=1 Win=853 Len=121 TSval=1207537 TSecr=30029003
  9 0.000423500 172.31.31.144 -> 172.31.23.72 TCP 187 6633 → 45534 [PSH, ACK] Seq=1 Ack=1 Win=853 Len=121 TSval=1207537 TSecr=30028923
 10 0.000466731 172.31.31.144 -> 172.31.23.72 TCP 187 6633 → 45534 [PSH, ACK] Seq=122 Ack=1 Win=853 Len=121 TSval=1207537 TSecr=30028923
 11 0.000523432 172.31.31.144 -> 172.31.23.72 TCP 187 6633 → 45534 [PSH, ACK] Seq=243 Ack=1 Win=853 Len=121 TSval=1207537 TSecr=30028923
 12 0.000575658 172.31.31.144 -> 172.31.23.72 TCP 187 6633 → 45534 [PSH, ACK] Seq=364 Ack=1 Win=853 Len=121 TSval=1207537 TSecr=30028923
 13 0.000636560 172.31.31.144 -> 172.31.23.72 TCP 187 6633 → 45534 [PSH, ACK] Seq=485 Ack=1 Win=853 Len=121 TSval=1207537 TSecr=30028923
 14 0.000650080 172.31.23.72 -> 172.31.31.144 TCP 66 45546 → 6633 [ACK] Seq=1 Ack=969 Win=213 Len=0 TSval=30029128 TSecr=1207537
 15 0.000688190 172.31.31.144 -> 172.31.23.72 TCP 187 6633 → 45534 [PSH, ACK] Seq=606 Ack=1 Win=853 Len=121 TSval=1207537 TSecr=30028923
 16 0.000763171 172.31.31.144 -> 172.31.23.72 TCP 187 6633 → 45530 [PSH, ACK] Seq=1 Ack=1 Win=853 Len=121 TSval=1207537 TSecr=30028894
 17 0.000793005 172.31.31.144 -> 172.31.23.72 TCP 187 6633 → 45530 [PSH, ACK] Seq=122 Ack=1 Win=853 Len=121 TSval=1207537 TSecr=30028894
 18 0.000847306 172.31.31.144 -> 172.31.23.72 TCP 187 6633 → 45530 [PSH, ACK] Seq=243 Ack=1 Win=853 Len=121 TSval=1207537 TSecr=30028894
 19 0.000935277 172.31.31.144 -> 172.31.23.72 TCP 187 6633 → 45530 [PSH, ACK] Seq=364 Ack=1 Win=853 Len=121 TSval=1207537 TSecr=30028894
 20 0.000993466 172.31.31.144 -> 172.31.23.72 TCP 187 6633 → 45530 [PSH, ACK] Seq=485 Ack=1 Win=853 Len=121 TSval=1207537 TSecr=30028894
 21 0.001029482 172.31.23.72 -> 172.31.31.144 TCP 66 45534 → 6633 [ACK] Seq=1 Ack=727 Win=213 Len=0 TSval=30029128 TSecr=1207537
 22 0.001066186 172.31.31.144 -> 172.31.23.72 TCP 187 6633 → 45530 [PSH, ACK] Seq=606 Ack=1 Win=853 Len=121 TSval=1207537 TSecr=30028894
 23 0.001136831 172.31.31.144 -> 172.31.23.72 TCP 308 6633 → 45530 [PSH, ACK] Seq=727 Ack=1 Win=853 Len=242 TSval=1207537 TSecr=30028894
 24 0.001193657 172.31.31.144 -> 172.31.23.72 TCP 187 6633 → 45514 [PSH, ACK] Seq=1 Ack=1 Win=853 Len=121 TSval=1207537 TSecr=30028806
 25 0.001242236 172.31.31.144 -> 172.31.23.72 TCP 187 6633 → 45514 [PSH, ACK] Seq=122 Ack=1 Win=853 Len=121 TSval=1207537 TSecr=30028806
 26 0.001287236 172.31.31.144 -> 172.31.23.72 TCP 187 6633 → 45514 [PSH, ACK] Seq=243 Ack=1 Win=853 Len=121 TSval=1207537 TSecr=30028806
 27 0.001337683 172.31.31.144 -> 172.31.23.72 TCP 187 6633 → 45514 [PSH, ACK] Seq=364 Ack=1 Win=853 Len=121 TSval=1207537 TSecr=30028806
 28 0.001391212 172.31.31.144 -> 172.31.23.72 TCP 187 6633 → 45514 [PSH, ACK] Seq=485 Ack=1 Win=853 Len=121 TSval=1207537 TSecr=30028806
 29 0.001443829 172.31.31.144 -> 172.31.23.72 TCP 187 6633 → 45514 [PSH, ACK] Seq=606 Ack=1 Win=853 Len=121 TSval=1207537 TSecr=30028806
 30 0.001495234 172.31.23.72 -> 172.31.31.144 TCP 66 45530 → 6633 [ACK] Seq=1 Ack=969 Win=213 Len=0 TSval=30029128 TSecr=1207537
 31 0.001502125 172.31.31.144 -> 172.31.23.72 TCP 187 6633 → 45514 [PSH, ACK] Seq=727 Ack=1 Win=853 Len=121 TSval=1207537 TSecr=30028806
 32 0.001562708 172.31.31.144 -> 172.31.23.72 TCP 187 6633 → 45514 [PSH, ACK] Seq=848 Ack=1 Win=853 Len=121 TSval=1207537 TSecr=30028806
 33 0.001620275 172.31.31.144 -> 172.31.23.72 TCP 187 6633 → 45528 [PSH, ACK] Seq=1 Ack=1 Win=853 Len=121 TSval=1207537 TSecr=30028884
 34 0.001665713 172.31.31.144 -> 172.31.23.72 TCP 187 6633 → 45528 [PSH, ACK] Seq=122 Ack=1 Win=853 Len=121 TSval=1207537 TSecr=30028884
 35 0.001740038 172.31.31.144 -> 172.31.23.72 TCP 187 6633 → 45528 [PSH, ACK] Seq=243 Ack=1 Win=853 Len=121 TSval=1207537 TSecr=30028884
 36 0.001772503 172.31.31.144 -> 172.31.23.72 TCP 187 6633 → 45528 [PSH, ACK] Seq=364 Ack=1 Win=853 Len=121 TSval=1207537 TSecr=30028884
 37 0.001816770 172.31.31.144 -> 172.31.23.72 TCP 187 6633 → 45528 [PSH, ACK] Seq=485 Ack=1 Win=853 Len=121 TSval=1207537 TSecr=30028884
 38 0.001867964 172.31.31.144 -> 172.31.23.72 TCP 187 6633 → 45528 [PSH, ACK] Seq=606 Ack=1 Win=853 Len=121 TSval=1207537 TSecr=30028884
 39 0.001878023 172.31.23.72 -> 172.31.31.144 TCP 66 45514 → 6633 [ACK] Seq=1 Ack=969 Win=213 Len=0 TSval=30029128 TSecr=1207537
 40 0.001922813 172.31.31.144 -> 172.31.23.72 TCP 187 6633 → 45528 [PSH, ACK] Seq=727 Ack=1 Win=853 Len=121 TSval=1207537 TSecr=30028884
 41 0.001973182 172.31.23.72 -> 172.31.31.144 OpenFlow 189 Type: OFPT_PACKET_IN
 42 0.001983581 172.31.31.144 -> 172.31.23.72 OpenFlow 187 Type: OFPT_PACKET_OUT
 43 0.001997213 172.31.23.72 -> 172.31.31.144 OpenFlow 189 Type: OFPT_PACKET_IN
 44 0.002050768 172.31.31.144 -> 172.31.23.72 OpenFlow 187 Type: OFPT_PACKET_OUT
 45 0.002210661 172.31.31.144 -> 172.31.23.72 OpenFlow 187 Type: OFPT_PACKET_OUT
 46 0.002214992 172.31.31.144 -> 172.31.23.72 TCP 187 6633 → 45518 [PSH, ACK] Seq=1 Ack=1 Win=853 Len=121 TSval=1207537 TSecr=30028827
 47 0.002218294 172.31.31.144 -> 172.31.23.72 TCP 187 6633 → 45518 [PSH, ACK] Seq=122 Ack=1 Win=853 Len=121 TSval=1207537 TSecr=30028827
 48 0.002302235 172.31.31.144 -> 172.31.23.72 TCP 187 6633 → 45518 [PSH, ACK] Seq=243 Ack=1 Win=853 Len=121 TSval=1207537 TSecr=30028827
 49 0.002306625 172.31.31.144 -> 172.31.23.72 TCP 187 6633 → 45518 [PSH, ACK] Seq=364 Ack=1 Win=853 Len=121 TSval=1207537 TSecr=30028827
 50 0.002359201 172.31.31.144 -> 172.31.23.72 TCP 187 6633 → 45518 [PSH, ACK] Seq=485 Ack=1 Win=853 Len=121 TSval=1207537 TSecr=30028827
 51 0.002443510 172.31.31.144 -> 172.31.23.72 TCP 187 6633 → 45518 [PSH, ACK] Seq=606 Ack=1 Win=853 Len=121 TSval=1207537 TSecr=30028827
 52 0.002449308 172.31.31.144 -> 172.31.23.72 TCP 66 6633 → 45528 [ACK] Seq=1211 Ack=247 Win=853 Len=0 TSval=1207537 TSecr=30029128
 53 0.002465250 172.31.31.144 -> 172.31.23.72 TCP 187 6633 → 45518 [PSH, ACK] Seq=727 Ack=1 Win=853 Len=121 TSval=1207537 TSecr=30028827
 54 0.002497535 172.31.31.144 -> 172.31.23.72 TCP 187 6633 → 45518 [PSH, ACK] Seq=848 Ack=1 Win=853 Len=121 TSval=1207537 TSecr=30028827
 55 0.002501847 172.31.23.72 -> 172.31.31.144 TCP 66 45528 → 6633 [ACK] Seq=247 Ack=1211 Win=213 Len=0 TSval=30029129 TSecr=1207537
 56 0.002575098 172.31.23.72 -> 172.31.31.144 OpenFlow 189 Type: OFPT_PACKET_IN
 57 0.002634182 172.31.31.144 -> 172.31.23.72 OpenFlow 187 Type: OFPT_PACKET_OUT
 58 0.002641332 172.31.23.72 -> 172.31.31.144 OpenFlow 189 Type: OFPT_PACKET_IN
 59 0.002647864 172.31.31.144 -> 172.31.23.72 OpenFlow 187 Type: OFPT_PACKET_OUT
 60 0.002688563 172.31.31.144 -> 172.31.23.72 TCP 187 6633 → 45512 [PSH, ACK] Seq=1 Ack=1 Win=853 Len=121 TSval=1207537 TSecr=30028797
 61 0.002731262 172.31.31.144 -> 172.31.23.72 TCP 187 6633 → 45512 [PSH, ACK] Seq=122 Ack=1 Win=853 Len=121 TSval=1207537 TSecr=30028797
 62 0.002821446 172.31.31.144 -> 172.31.23.72 TCP 187 6633 → 45512 [PSH, ACK] Seq=243 Ack=1 Win=853 Len=121 TSval=1207537 TSecr=30028797
 63 0.002826057 172.31.31.144 -> 172.31.23.72 TCP 66 6633 → 45518 [ACK] Seq=1211 Ack=124 Win=853 Len=0 TSval=1207537 TSecr=30029129
 64 0.002830691 172.31.31.144 -> 172.31.23.72 TCP 187 6633 → 45512 [PSH, ACK] Seq=364 Ack=1 Win=853 Len=121 TSval=1207537 TSecr=30028797
 65 0.002891127 172.31.31.144 -> 172.31.23.72 TCP 66 6633 → 45518 [ACK] Seq=1211 Ack=247 Win=853 Len=0 TSval=1207537 TSecr=30029129
 66 0.002896051 172.31.31.144 -> 172.31.23.72 TCP 187 6633 → 45512 [PSH, ACK] Seq=485 Ack=1 Win=853 Len=121 TSval=1207537 TSecr=30028797
 67 0.002938326 172.31.31.144 -> 172.31.23.72 TCP 187 6633 → 45512 [PSH, ACK] Seq=606 Ack=1 Win=853 Len=121 TSval=1207537 TSecr=30028797
 68 0.002992507 172.31.31.144 -> 172.31.23.72 TCP 187 6633 → 45512 [PSH, ACK] Seq=727 Ack=1 Win=853 Len=121 TSval=1207537 TSecr=30028797
 69 0.003063114 172.31.31.144 -> 172.31.23.72 TCP 187 6633 → 45512 [PSH, ACK] Seq=848 Ack=1 Win=853 Len=121 TSval=1207537 TSecr=30028797
 70 0.003109483 172.31.31.144 -> 172.31.23.72 TCP 187 6633 → 45512 [PSH, ACK] Seq=969 Ack=1 Win=853 Len=121 TSval=1207537 TSecr=30028797
 71 0.003151797 172.31.31.144 -> 172.31.23.72 TCP 187 6633 → 45512 [PSH, ACK] Seq=1090 Ack=1 Win=853 Len=121 TSval=1207537 TSecr=30028797
 72 0.003174332 172.31.23.72 -> 172.31.31.144 OpenFlow 189 Type: OFPT_PACKET_IN
 73 0.003222182 172.31.31.144 -> 172.31.23.72 TCP 187 6633 → 45538 [PSH, ACK] Seq=1 Ack=1 Win=853 Len=121 TSval=1207537 TSecr=30028947
 74 0.003230430 172.31.23.72 -> 172.31.31.144 OpenFlow 189 Type: OFPT_PACKET_IN
 75 0.003272932 172.31.31.144 -> 172.31.23.72 TCP 187 6633 → 45538 [PSH, ACK] Seq=122 Ack=1 Win=853 Len=121 TSval=1207537 TSecr=30028947
 76 0.003337882 172.31.31.144 -> 172.31.23.72 TCP 187 6633 → 45538 [PSH, ACK] Seq=243 Ack=1 Win=853 Len=121 TSval=1207537 TSecr=30028947
 77 0.003391024 172.31.31.144 -> 172.31.23.72 TCP 187 6633 → 45538 [PSH, ACK] Seq=364 Ack=1 Win=853 Len=121 TSval=1207537 TSecr=30028947
 78 0.003395292 172.31.31.144 -> 172.31.23.72 TCP 66 6633 → 45512 [ACK] Seq=1211 Ack=124 Win=853 Len=0 TSval=1207537 TSecr=30029129
 79 0.003478595 172.31.31.144 -> 172.31.23.72 TCP 187 6633 → 45538 [PSH, ACK] Seq=485 Ack=1 Win=853 Len=121 TSval=1207538 TSecr=30028947
 80 0.003482658 172.31.31.144 -> 172.31.23.72 TCP 66 6633 → 45512 [ACK] Seq=1211 Ack=247 Win=853 Len=0 TSval=1207538 TSecr=30029129
 81 0.003485507 172.31.31.144 -> 172.31.23.72 TCP 187 6633 → 45538 [PSH, ACK] Seq=606 Ack=1 Win=853 Len=121 TSval=1207538 TSecr=30028947
 82 0.003538544 172.31.31.144 -> 172.31.23.72 TCP 187 6633 → 45538 [PSH, ACK] Seq=727 Ack=1 Win=853 Len=121 TSval=1207538 TSecr=30028947
 83 0.003591681 172.31.31.144 -> 172.31.23.72 TCP 187 6633 → 45538 [PSH, ACK] Seq=848 Ack=1 Win=853 Len=121 TSval=1207538 TSecr=30028947
 84 0.003644616 172.31.31.144 -> 172.31.23.72 TCP 187 6633 → 45538 [PSH, ACK] Seq=969 Ack=1 Win=853 Len=121 TSval=1207538 TSecr=30028947
 85 0.003686762 172.31.23.72 -> 172.31.31.144 OpenFlow 189 Type: OFPT_PACKET_IN
 86 0.003706543 172.31.31.144 -> 172.31.23.72 OpenFlow 187 Type: OFPT_PACKET_OUT
 87 0.003711599 172.31.23.72 -> 172.31.31.144 OpenFlow 189 Type: OFPT_PACKET_IN
 88 0.003897642 172.31.31.144 -> 172.31.23.72 TCP 66 6633 → 45538 [ACK] Seq=1211 Ack=124 Win=853 Len=0 TSval=1207538 TSecr=30029129
 89 0.003903702 172.31.31.144 -> 172.31.23.72 TCP 66 6633 → 45538 [ACK] Seq=1211 Ack=247 Win=853 Len=0 TSval=1207538 TSecr=30029129
 90 0.004179715 172.31.23.72 -> 172.31.31.144 OpenFlow 189 Type: OFPT_PACKET_IN
 91 0.004206373 172.31.23.72 -> 172.31.31.144 OpenFlow 435 Type: OFPT_PACKET_IN
 92 0.004218048 172.31.23.72 -> 172.31.31.144 OpenFlow 189 Type: OFPT_PACKET_IN
 93 0.004237563 172.31.23.72 -> 172.31.31.144 OpenFlow 189 Type: OFPT_PACKET_IN
 94 0.004263969 172.31.23.72 -> 172.31.31.144 OpenFlow 189 Type: OFPT_PACKET_IN
 95 0.004266229 172.31.23.72 -> 172.31.31.144 OpenFlow 435 Type: OFPT_PACKET_IN
 96 0.004280863 172.31.23.72 -> 172.31.31.144 OpenFlow 189 Type: OFPT_PACKET_IN
 97 0.004302161 172.31.23.72 -> 172.31.31.144 OpenFlow 189 Type: OFPT_PACKET_IN
 98 0.004304588 172.31.23.72 -> 172.31.31.144 OpenFlow 681 Type: OFPT_PACKET_IN
 99 0.004318967 172.31.23.72 -> 172.31.31.144 OpenFlow 189 Type: OFPT_PACKET_IN
100 0.004321309 172.31.23.72 -> 172.31.31.144 OpenFlow 189 Type: OFPT_PACKET_IN
101 0.004346896 172.31.23.72 -> 172.31.31.144 OpenFlow 189 Type: OFPT_PACKET_IN
102 0.004360918 172.31.23.72 -> 172.31.31.144 OpenFlow 189 Type: OFPT_PACKET_IN
103 0.004374227 172.31.23.72 -> 172.31.31.144 OpenFlow 189 Type: OFPT_PACKET_IN
104 0.004391954 172.31.23.72 -> 172.31.31.144 OpenFlow 189 Type: OFPT_PACKET_IN
105 0.004405499 172.31.23.72 -> 172.31.31.144 OpenFlow 189 Type: OFPT_PACKET_IN
106 0.004424799 172.31.23.72 -> 172.31.31.144 OpenFlow 189 Type: OFPT_PACKET_IN
107 0.004437999 172.31.31.144 -> 172.31.23.72 TCP 66 6633 → 45532 [ACK] Seq=1 Ack=124 Win=853 Len=0 TSval=1207538 TSecr=30029129
108 0.004442713 172.31.31.144 -> 172.31.23.72 TCP 66 6633 → 45532 [ACK] Seq=1 Ack=493 Win=853 Len=0 TSval=1207538 TSecr=30029129
109 0.004444616 172.31.31.144 -> 172.31.23.72 TCP 66 6633 → 45544 [ACK] Seq=1 Ack=124 Win=853 Len=0 TSval=1207538 TSecr=30029129
110 0.004458707 172.31.23.72 -> 172.31.31.144 OpenFlow 189 Type: OFPT_PACKET_IN
111 0.004464817 172.31.23.72 -> 172.31.31.144 OpenFlow 435 Type: OFPT_PACKET_IN
112 0.004569237 172.31.23.72 -> 172.31.31.144 OpenFlow 189 Type: OFPT_PACKET_IN
113 0.004573147 172.31.23.72 -> 172.31.31.144 OpenFlow 189 Type: OFPT_PACKET_IN
114 0.004575273 172.31.23.72 -> 172.31.31.144 OpenFlow 189 Type: OFPT_PACKET_IN
115 0.004591359 172.31.23.72 -> 172.31.31.144 OpenFlow 189 Type: OFPT_PACKET_IN
116 0.004603361 172.31.23.72 -> 172.31.31.144 OpenFlow 189 Type: OFPT_PACKET_IN
117 0.004906681 172.31.31.144 -> 172.31.23.72 TCP 66 6633 → 45524 [ACK] Seq=1 Ack=124 Win=853 Len=0 TSval=1207538 TSecr=30029129
118 0.004912860 172.31.31.144 -> 172.31.23.72 TCP 66 6633 → 45544 [ACK] Seq=1 Ack=493 Win=853 Len=0 TSval=1207538 TSecr=30029129
119 0.004915354 172.31.31.144 -> 172.31.23.72 TCP 66 6633 → 45510 [ACK] Seq=1 Ack=124 Win=853 Len=0 TSval=1207538 TSecr=30029129
120 0.004917404 172.31.31.144 -> 172.31.23.72 TCP 66 6633 → 45540 [ACK] Seq=1 Ack=124 Win=853 Len=0 TSval=1207538 TSecr=30029129
121 0.004919523 172.31.31.144 -> 172.31.23.72 TCP 66 6633 → 45524 [ACK] Seq=1 Ack=739 Win=853 Len=0 TSval=1207538 TSecr=30029129
122 0.004921201 172.31.31.144 -> 172.31.23.72 TCP 66 6633 → 45526 [ACK] Seq=1 Ack=124 Win=853 Len=0 TSval=1207538 TSecr=30029129
123 0.004923146 172.31.31.144 -> 172.31.23.72 TCP 66 6633 → 45522 [ACK] Seq=1 Ack=247 Win=853 Len=0 TSval=1207538 TSecr=30029129
124 0.004925777 172.31.31.144 -> 172.31.23.72 TCP 66 6633 → 45550 [ACK] Seq=1 Ack=124 Win=853 Len=0 TSval=1207538 TSecr=30029129
125 0.004929358 172.31.23.72 -> 172.31.31.144 OpenFlow 189 Type: OFPT_PACKET_IN
126 0.004934998 172.31.31.144 -> 172.31.23.72 TCP 66 6633 → 45508 [ACK] Seq=1 Ack=124 Win=853 Len=0 TSval=1207538 TSecr=30029129
127 0.004938479 172.31.23.72 -> 172.31.31.144 OpenFlow 189 Type: OFPT_PACKET_IN
128 0.004945013 172.31.23.72 -> 172.31.31.144 OpenFlow 435 Type: OFPT_PACKET_IN
129 0.004947079 172.31.23.72 -> 172.31.31.144 OpenFlow 435 Type: OFPT_PACKET_IN
130 0.004948761 172.31.23.72 -> 172.31.31.144 OpenFlow 189 Type: OFPT_PACKET_IN
131 0.004950482 172.31.23.72 -> 172.31.31.144 OpenFlow 681 Type: OFPT_PACKET_IN
132 0.004952008 172.31.23.72 -> 172.31.31.144 OpenFlow 435 Type: OFPT_PACKET_IN
133 0.005195943 172.31.31.144 -> 172.31.23.72 TCP 66 6633 → 45548 [ACK] Seq=1 Ack=124 Win=853 Len=0 TSval=1207538 TSecr=30029129
134 0.005198671 172.31.31.144 -> 172.31.23.72 TCP 66 6633 → 45542 [ACK] Seq=1 Ack=124 Win=853 Len=0 TSval=1207538 TSecr=30029129
135 0.005200703 172.31.31.144 -> 172.31.23.72 TCP 66 6633 → 45520 [ACK] Seq=1 Ack=124 Win=853 Len=0 TSval=1207538 TSecr=30029129
136 0.005202475 172.31.31.144 -> 172.31.23.72 TCP 66 6633 → 45516 [ACK] Seq=1 Ack=124 Win=853 Len=0 TSval=1207538 TSecr=30029129
137 0.005204351 172.31.31.144 -> 172.31.23.72 TCP 66 6633 → 45510 [ACK] Seq=1 Ack=493 Win=853 Len=0 TSval=1207538 TSecr=30029129
138 0.005206037 172.31.31.144 -> 172.31.23.72 TCP 66 6633 → 45530 [ACK] Seq=969 Ack=124 Win=853 Len=0 TSval=1207538 TSecr=30029129
139 0.005208540 172.31.23.72 -> 172.31.31.144 OpenFlow 435 Type: OFPT_PACKET_IN
140 0.005213270 172.31.31.144 -> 172.31.23.72 TCP 66 6633 → 45540 [ACK] Seq=1 Ack=247 Win=853 Len=0 TSval=1207538 TSecr=30029129
141 0.005215025 172.31.31.144 -> 172.31.23.72 TCP 66 6633 → 45526 [ACK] Seq=1 Ack=247 Win=853 Len=0 TSval=1207538 TSecr=30029129
142 0.005221538 172.31.23.72 -> 172.31.31.144 OpenFlow 189 Type: OFPT_PACKET_IN
143 0.005223475 172.31.23.72 -> 172.31.31.144 OpenFlow 189 Type: OFPT_PACKET_IN
144 0.005479413 172.31.31.144 -> 172.31.23.72 TCP 66 6633 → 45514 [ACK] Seq=969 Ack=124 Win=853 Len=0 TSval=1207538 TSecr=30029129
145 0.005481756 172.31.31.144 -> 172.31.23.72 TCP 66 6633 → 45550 [ACK] Seq=1 Ack=247 Win=853 Len=0 TSval=1207538 TSecr=30029129
146 0.005483520 172.31.31.144 -> 172.31.23.72 TCP 66 6633 → 45508 [ACK] Seq=1 Ack=247 Win=853 Len=0 TSval=1207538 TSecr=30029129
147 0.005484962 172.31.31.144 -> 172.31.23.72 TCP 66 6633 → 45516 [ACK] Seq=1 Ack=493 Win=853 Len=0 TSval=1207538 TSecr=30029129
148 0.005486646 172.31.31.144 -> 172.31.23.72 TCP 66 6633 → 45548 [ACK] Seq=1 Ack=493 Win=853 Len=0 TSval=1207538 TSecr=30029129
149 0.005488067 172.31.31.144 -> 172.31.23.72 TCP 66 6633 → 45542 [ACK] Seq=1 Ack=247 Win=853 Len=0 TSval=1207538 TSecr=30029129
150 0.005599124 172.31.31.144 -> 172.31.23.72 TCP 66 6633 → 45536 [ACK] Seq=1 Ack=739 Win=853 Len=0 TSval=1207538 TSecr=30029129
151 0.005601493 172.31.31.144 -> 172.31.23.72 TCP 66 6633 → 45520 [ACK] Seq=1 Ack=493 Win=853 Len=0 TSval=1207538 TSecr=30029129
152 0.005667635 172.31.31.144 -> 172.31.23.72 TCP 66 6633 → 45530 [ACK] Seq=969 Ack=493 Win=853 Len=0 TSval=1207538 TSecr=30029129
153 0.005669549 172.31.31.144 -> 172.31.23.72 TCP 66 6633 → 45514 [ACK] Seq=969 Ack=247 Win=853 Len=0 TSval=1207538 TSecr=30029129
154 0.005741472 172.31.31.144 -> 172.31.23.72 TCP 66 6633 → 45528 [ACK] Seq=1211 Ack=493 Win=853 Len=0 TSval=1207538 TSecr=30029129
155 0.042496970 172.31.23.72 -> 172.31.31.144 TCP 66 45518 → 6633 [ACK] Seq=247 Ack=1211 Win=213 Len=0 TSval=30029139 TSecr=1207537
156 0.100465188 172.31.31.144 -> 172.31.23.72 OpenFlow 187 Type: OFPT_PACKET_OUT
157 0.100488130 172.31.31.144 -> 172.31.23.72 OpenFlow 187 Type: OFPT_PACKET_OUT
158 0.100493448 172.31.31.144 -> 172.31.23.72 OpenFlow 187 Type: OFPT_PACKET_OUT
159 0.100495384 172.31.31.144 -> 172.31.23.72 OpenFlow 187 Type: OFPT_PACKET_OUT
160 0.100497032 172.31.31.144 -> 172.31.23.72 OpenFlow 187 Type: OFPT_PACKET_OUT
161 0.100498628 172.31.31.144 -> 172.31.23.72 OpenFlow 187 Type: OFPT_PACKET_OUT
162 0.100500370 172.31.31.144 -> 172.31.23.72 OpenFlow 187 Type: OFPT_PACKET_OUT
163 0.100502038 172.31.31.144 -> 172.31.23.72 OpenFlow 187 Type: OFPT_PACKET_OUT
164 0.101136515 172.31.23.72 -> 172.31.31.144 TCP 66 45532 → 6633 [ACK] Seq=493 Ack=969 Win=213 Len=0 TSval=30029153 TSecr=1207562
165 0.101234927 172.31.23.72 -> 172.31.31.144 OpenFlow 189 Type: OFPT_PACKET_IN
166 0.101253673 172.31.23.72 -> 172.31.31.144 OpenFlow 189 Type: OFPT_PACKET_IN
167 0.101398501 172.31.23.72 -> 172.31.31.144 OpenFlow 189 Type: OFPT_PACKET_IN
168 0.101412957 172.31.23.72 -> 172.31.31.144 OpenFlow 189 Type: OFPT_PACKET_IN
169 0.103334017 172.31.31.144 -> 172.31.23.72 OpenFlow 187 Type: OFPT_PACKET_OUT
170 0.103342641 172.31.31.144 -> 172.31.23.72 OpenFlow 187 Type: OFPT_PACKET_OUT
171 0.103345385 172.31.31.144 -> 172.31.23.72 OpenFlow 187 Type: OFPT_PACKET_OUT
172 0.103347180 172.31.31.144 -> 172.31.23.72 OpenFlow 187 Type: OFPT_PACKET_OUT
173 0.103348896 172.31.31.144 -> 172.31.23.72 OpenFlow 187 Type: OFPT_PACKET_OUT
174 0.103350241 172.31.31.144 -> 172.31.23.72 OpenFlow 187 Type: OFPT_PACKET_OUT
175 0.103352940 172.31.31.144 -> 172.31.23.72 OpenFlow 187 Type: OFPT_PACKET_OUT
176 0.103354523 172.31.31.144 -> 172.31.23.72 OpenFlow 187 Type: OFPT_PACKET_OUT
177 0.103356270 172.31.31.144 -> 172.31.23.72 OpenFlow 187 Type: OFPT_PACKET_OUT
178 0.103357773 172.31.31.144 -> 172.31.23.72 OpenFlow 187 Type: OFPT_PACKET_OUT
179 0.103359206 172.31.31.144 -> 172.31.23.72 OpenFlow 187 Type: OFPT_PACKET_OUT
180 0.103360675 172.31.31.144 -> 172.31.23.72 OpenFlow 187 Type: OFPT_PACKET_OUT
181 0.103362169 172.31.31.144 -> 172.31.23.72 OpenFlow 187 Type: OFPT_PACKET_OUT
182 0.103363662 172.31.31.144 -> 172.31.23.72 OpenFlow 187 Type: OFPT_PACKET_OUT
183 0.103365053 172.31.31.144 -> 172.31.23.72 OpenFlow 187 Type: OFPT_PACKET_OUT
184 0.103366469 172.31.31.144 -> 172.31.23.72 OpenFlow 187 Type: OFPT_PACKET_OUT
185 0.103367744 172.31.31.144 -> 172.31.23.72 OpenFlow 187 Type: OFPT_PACKET_OUT
186 0.103370182 172.31.31.144 -> 172.31.23.72 OpenFlow 187 Type: OFPT_PACKET_OUT
187 0.103371781 172.31.31.144 -> 172.31.23.72 OpenFlow 187 Type: OFPT_PACKET_OUT
188 0.103373240 172.31.31.144 -> 172.31.23.72 OpenFlow 187 Type: OFPT_PACKET_OUT
189 0.103375359 172.31.31.144 -> 172.31.23.72 OpenFlow 187 Type: OFPT_PACKET_OUT
190 0.103376876 172.31.31.144 -> 172.31.23.72 OpenFlow 187 Type: OFPT_PACKET_OUT
191 0.103378506 172.31.31.144 -> 172.31.23.72 OpenFlow 187 Type: OFPT_PACKET_OUT
192 0.103380619 172.31.31.144 -> 172.31.23.72 OpenFlow 187 Type: OFPT_PACKET_OUT
193 0.103382208 172.31.31.144 -> 172.31.23.72 OpenFlow 187 Type: OFPT_PACKET_OUT
194 0.103383941 172.31.31.144 -> 172.31.23.72 OpenFlow 187 Type: OFPT_PACKET_OUT
195 0.103385547 172.31.31.144 -> 172.31.23.72 OpenFlow 187 Type: OFPT_PACKET_OUT
196 0.103387002 172.31.31.144 -> 172.31.23.72 OpenFlow 187 Type: OFPT_PACKET_OUT
197 0.103388421 172.31.31.144 -> 172.31.23.72 OpenFlow 187 Type: OFPT_PACKET_OUT
198 0.103389885 172.31.31.144 -> 172.31.23.72 OpenFlow 187 Type: OFPT_PACKET_OUT
199 0.103391115 172.31.31.144 -> 172.31.23.72 OpenFlow 187 Type: OFPT_PACKET_OUT
200 0.103396118 172.31.23.72 -> 172.31.31.144 OpenFlow 189 Type: OFPT_PACKET_IN
201 0.103401497 172.31.31.144 -> 172.31.23.72 OpenFlow 187 Type: OFPT_PACKET_OUT
202 0.103404072 172.31.31.144 -> 172.31.23.72 OpenFlow 187 Type: OFPT_PACKET_OUT
203 0.103405649 172.31.31.144 -> 172.31.23.72 OpenFlow 187 Type: OFPT_PACKET_OUT
204 0.103407634 172.31.31.144 -> 172.31.23.72 OpenFlow 187 Type: OFPT_PACKET_OUT
205 0.103409275 172.31.31.144 -> 172.31.23.72 OpenFlow 187 Type: OFPT_PACKET_OUT
206 0.103410589 172.31.31.144 -> 172.31.23.72 OpenFlow 187 Type: OFPT_PACKET_OUT
207 0.103412052 172.31.31.144 -> 172.31.23.72 OpenFlow 187 Type: OFPT_PACKET_OUT
208 0.103413304 172.31.31.144 -> 172.31.23.72 OpenFlow 187 Type: OFPT_PACKET_OUT
209 0.103414881 172.31.31.144 -> 172.31.23.72 OpenFlow 187 Type: OFPT_PACKET_OUT
210 0.103416129 172.31.31.144 -> 172.31.23.72 OpenFlow 187 Type: OFPT_PACKET_OUT
211 0.103418459 172.31.23.72 -> 172.31.31.144 OpenFlow 189 Type: OFPT_PACKET_IN
212 0.103420493 172.31.31.144 -> 172.31.23.72 OpenFlow 187 Type: OFPT_PACKET_OUT
213 0.103422625 172.31.31.144 -> 172.31.23.72 OpenFlow 187 Type: OFPT_PACKET_OUT
214 0.103424197 172.31.31.144 -> 172.31.23.72 OpenFlow 187 Type: OFPT_PACKET_OUT
215 0.103425997 172.31.31.144 -> 172.31.23.72 OpenFlow 187 Type: OFPT_PACKET_OUT
216 0.103427526 172.31.31.144 -> 172.31.23.72 OpenFlow 187 Type: OFPT_PACKET_OUT
217 0.103428939 172.31.31.144 -> 172.31.23.72 OpenFlow 187 Type: OFPT_PACKET_OUT
218 0.103430687 172.31.31.144 -> 172.31.23.72 OpenFlow 187 Type: OFPT_PACKET_OUT
219 0.103432162 172.31.31.144 -> 172.31.23.72 TCP 187 6633 → 45554 [PSH, ACK] Seq=1 Ack=1 Win=853 Len=121 TSval=1207562 TSecr=30029052
220 0.103434499 172.31.31.144 -> 172.31.23.72 TCP 187 6633 → 45554 [PSH, ACK] Seq=122 Ack=1 Win=853 Len=121 TSval=1207562 TSecr=30029052
221 0.103435905 172.31.31.144 -> 172.31.23.72 TCP 187 6633 → 45554 [PSH, ACK] Seq=243 Ack=1 Win=853 Len=121 TSval=1207562 TSecr=30029052
222 0.103437059 172.31.31.144 -> 172.31.23.72 TCP 187 6633 → 45554 [PSH, ACK] Seq=364 Ack=1 Win=853 Len=121 TSval=1207562 TSecr=30029052
223 0.103438440 172.31.31.144 -> 172.31.23.72 TCP 187 6633 → 45554 [PSH, ACK] Seq=485 Ack=1 Win=853 Len=121 TSval=1207562 TSecr=30029052
224 0.103439977 172.31.31.144 -> 172.31.23.72 TCP 187 6633 → 45554 [PSH, ACK] Seq=606 Ack=1 Win=853 Len=121 TSval=1207562 TSecr=30029052
225 0.103608376 172.31.23.72 -> 172.31.31.144 OpenFlow 189 Type: OFPT_PACKET_IN
226 0.103611917 172.31.23.72 -> 172.31.31.144 OpenFlow 189 Type: OFPT_PACKET_IN
227 0.103728496 172.31.23.72 -> 172.31.31.144 TCP 66 45544 → 6633 [ACK] Seq=493 Ack=727 Win=213 Len=0 TSval=30029154 TSecr=1207562
228 0.104089429 172.31.31.144 -> 172.31.23.72 TCP 66 6633 → 45540 [ACK] Seq=1211 Ack=370 Win=853 Len=0 TSval=1207563 TSecr=30029153
229 0.104096600 172.31.31.144 -> 172.31.23.72 TCP 66 6633 → 45526 [ACK] Seq=969 Ack=370 Win=853 Len=0 TSval=1207563 TSecr=30029153
230 0.104098717 172.31.31.144 -> 172.31.23.72 TCP 66 6633 → 45534 [ACK] Seq=727 Ack=124 Win=853 Len=0 TSval=1207563 TSecr=30029153
231 0.104100987 172.31.31.144 -> 172.31.23.72 TCP 66 6633 → 45530 [ACK] Seq=969 Ack=616 Win=853 Len=0 TSval=1207563 TSecr=30029153
232 0.104146943 172.31.23.72 -> 172.31.31.144 TCP 66 45524 → 6633 [ACK] Seq=739 Ack=1211 Win=213 Len=0 TSval=30029154 TSecr=1207562
233 0.104399176 172.31.23.72 -> 172.31.31.144 TCP 66 45522 → 6633 [ACK] Seq=247 Ack=727 Win=213 Len=0 TSval=30029154 TSecr=1207562
234 0.104665797 172.31.23.72 -> 172.31.31.144 TCP 66 45510 → 6633 [ACK] Seq=493 Ack=969 Win=213 Len=0 TSval=30029154 TSecr=1207562
235 0.105055056 172.31.23.72 -> 172.31.31.144 TCP 66 45540 → 6633 [ACK] Seq=493 Ack=1211 Win=213 Len=0 TSval=30029154 TSecr=1207562
236 0.105109444 172.31.23.72 -> 172.31.31.144 OpenFlow 189 Type: OFPT_PACKET_IN
237 0.105563609 172.31.23.72 -> 172.31.31.144 TCP 66 45554 → 6633 [ACK] Seq=1 Ack=727 Win=213 Len=0 TSval=30029154 TSecr=1207562
238 0.105618865 172.31.23.72 -> 172.31.31.144 OpenFlow 189 Type: OFPT_PACKET_IN
239 0.105637610 172.31.23.72 -> 172.31.31.144 OpenFlow 189 Type: OFPT_PACKET_IN
240 0.105650220 172.31.23.72 -> 172.31.31.144 OpenFlow 189 Type: OFPT_PACKET_IN
241 0.105666337 172.31.23.72 -> 172.31.31.144 OpenFlow 189 Type: OFPT_PACKET_IN
242 0.105685439 172.31.23.72 -> 172.31.31.144 OpenFlow 189 Type: OFPT_PACKET_IN
243 0.105783142 172.31.23.72 -> 172.31.31.144 OpenFlow 189 Type: OFPT_PACKET_IN
244 0.105799792 172.31.23.72 -> 172.31.31.144 OpenFlow 189 Type: OFPT_PACKET_IN
245 0.105811808 172.31.23.72 -> 172.31.31.144 OpenFlow 189 Type: OFPT_PACKET_IN
246 0.105824147 172.31.23.72 -> 172.31.31.144 OpenFlow 189 Type: OFPT_PACKET_IN
247 0.105835786 172.31.23.72 -> 172.31.31.144 OpenFlow 189 Type: OFPT_PACKET_IN
248 0.105849784 172.31.23.72 -> 172.31.31.144 OpenFlow 189 Type: OFPT_PACKET_IN
249 0.105865476 172.31.23.72 -> 172.31.31.144 OpenFlow 189 Type: OFPT_PACKET_IN
250 0.105878150 172.31.23.72 -> 172.31.31.144 OpenFlow 189 Type: OFPT_PACKET_IN
251 0.105889565 172.31.23.72 -> 172.31.31.144 OpenFlow 189 Type: OFPT_PACKET_IN
252 0.105908805 172.31.23.72 -> 172.31.31.144 OpenFlow 189 Type: OFPT_PACKET_IN
253 0.105920055 172.31.23.72 -> 172.31.31.144 OpenFlow 189 Type: OFPT_PACKET_IN
254 0.106693993 172.31.31.144 -> 172.31.23.72 TCP 66 6633 → 45540 [ACK] Seq=1211 Ack=493 Win=853 Len=0 TSval=1207563 TSecr=30029154
255 0.106701368 172.31.31.144 -> 172.31.23.72 TCP 66 6633 → 45534 [ACK] Seq=727 Ack=247 Win=853 Len=0 TSval=1207563 TSecr=30029154
256 0.106705870 172.31.23.72 -> 172.31.31.144 OpenFlow 189 Type: OFPT_PACKET_IN
257 0.106711840 172.31.31.144 -> 172.31.23.72 TCP 66 6633 → 45526 [ACK] Seq=969 Ack=493 Win=853 Len=0 TSval=1207563 TSecr=30029154
258 0.106714511 172.31.23.72 -> 172.31.31.144 OpenFlow 435 Type: OFPT_PACKET_IN
259 0.106716379 172.31.31.144 -> 172.31.23.72 TCP 66 6633 → 45530 [ACK] Seq=969 Ack=739 Win=853 Len=0 TSval=1207563 TSecr=30029154
260 0.106718848 172.31.23.72 -> 172.31.31.144 OpenFlow 189 Type: OFPT_PACKET_IN
261 0.107138135 172.31.23.72 -> 172.31.31.144 OpenFlow 435 Type: OFPT_PACKET_IN
262 0.107140896 172.31.23.72 -> 172.31.31.144 OpenFlow 189 Type: OFPT_PACKET_IN
263 0.107142603 172.31.23.72 -> 172.31.31.144 OpenFlow 189 Type: OFPT_PACKET_IN
264 0.107144515 172.31.23.72 -> 172.31.31.144 OpenFlow 435 Type: OFPT_PACKET_IN
265 0.107146167 172.31.23.72 -> 172.31.31.144 OpenFlow 435 Type: OFPT_PACKET_IN
266 0.107147858 172.31.23.72 -> 172.31.31.144 OpenFlow 189 Type: OFPT_PACKET_IN
267 0.107149889 172.31.23.72 -> 172.31.31.144 OpenFlow 189 Type: OFPT_PACKET_IN
268 0.107585188 172.31.31.144 -> 172.31.23.72 TCP 66 6633 → 45526 [ACK] Seq=969 Ack=616 Win=853 Len=0 TSval=1207563 TSecr=30029154
269 0.107589750 172.31.31.144 -> 172.31.23.72 TCP 66 6633 → 45552 [ACK] Seq=1 Ack=124 Win=853 Len=0 TSval=1207563 TSecr=30029154
270 0.107591827 172.31.31.144 -> 172.31.23.72 TCP 66 6633 → 45550 [ACK] Seq=1 Ack=370 Win=853 Len=0 TSval=1207563 TSecr=30029154
271 0.107593506 172.31.31.144 -> 172.31.23.72 TCP 66 6633 → 45508 [ACK] Seq=1 Ack=370 Win=853 Len=0 TSval=1207563 TSecr=30029154
272 0.107595435 172.31.31.144 -> 172.31.23.72 TCP 66 6633 → 45542 [ACK] Seq=1 Ack=370 Win=853 Len=0 TSval=1207563 TSecr=30029154
273 0.107597262 172.31.31.144 -> 172.31.23.72 TCP 66 6633 → 45520 [ACK] Seq=1 Ack=616 Win=853 Len=0 TSval=1207563 TSecr=30029154
274 0.107599427 172.31.31.144 -> 172.31.23.72 TCP 66 6633 → 45534 [ACK] Seq=727 Ack=370 Win=853 Len=0 TSval=1207563 TSecr=30029154
275 0.107601333 172.31.31.144 -> 172.31.23.72 TCP 66 6633 → 45530 [ACK] Seq=969 Ack=862 Win=853 Len=0 TSval=1207563 TSecr=30029154
276 0.107603000 172.31.31.144 -> 172.31.23.72 TCP 66 6633 → 45514 [ACK] Seq=969 Ack=370 Win=853 Len=0 TSval=1207563 TSecr=30029154
277 0.107605350 172.31.31.144 -> 172.31.23.72 TCP 66 6633 → 45518 [ACK] Seq=1211 Ack=370 Win=853 Len=0 TSval=1207563 TSecr=30029154
278 0.107608555 172.31.23.72 -> 172.31.31.144 OpenFlow 435 Type: OFPT_PACKET_IN
279 0.107612968 172.31.31.144 -> 172.31.23.72 TCP 66 6633 → 45512 [ACK] Seq=1211 Ack=370 Win=853 Len=0 TSval=1207563 TSecr=30029154
280 0.107615597 172.31.23.72 -> 172.31.31.144 OpenFlow 189 Type: OFPT_PACKET_IN
281 0.107617063 172.31.31.144 -> 172.31.23.72 TCP 66 6633 → 45538 [ACK] Seq=1211 Ack=370 Win=853 Len=0 TSval=1207563 TSecr=30029154
282 0.107619542 172.31.23.72 -> 172.31.31.144 OpenFlow 189 Type: OFPT_PACKET_IN
283 0.107628572 172.31.23.72 -> 172.31.31.144 OpenFlow 435 Type: OFPT_PACKET_IN
284 0.107630641 172.31.23.72 -> 172.31.31.144 OpenFlow 435 Type: OFPT_PACKET_IN
285 0.107632241 172.31.23.72 -> 172.31.31.144 OpenFlow 189 Type: OFPT_PACKET_IN
286 0.107633984 172.31.23.72 -> 172.31.31.144 OpenFlow 189 Type: OFPT_PACKET_IN
287 0.109979726 172.31.31.144 -> 172.31.23.72 TCP 66 6633 → 45532 [ACK] Seq=969 Ack=616 Win=853 Len=0 TSval=1207564 TSecr=30029154
288 0.109983463 172.31.31.144 -> 172.31.23.72 TCP 66 6633 → 45524 [ACK] Seq=1211 Ack=862 Win=853 Len=0 TSval=1207564 TSecr=30029154
289 0.109985303 172.31.31.144 -> 172.31.23.72 TCP 66 6633 → 45534 [ACK] Seq=727 Ack=493 Win=853 Len=0 TSval=1207564 TSecr=30029155
290 0.109987116 172.31.31.144 -> 172.31.23.72 TCP 66 6633 → 45526 [ACK] Seq=969 Ack=985 Win=853 Len=0 TSval=1207564 TSecr=30029155
291 0.109989036 172.31.31.144 -> 172.31.23.72 TCP 66 6633 → 45530 [ACK] Seq=969 Ack=985 Win=853 Len=0 TSval=1207564 TSecr=30029155
292 0.109990740 172.31.31.144 -> 172.31.23.72 TCP 66 6633 → 45552 [ACK] Seq=1 Ack=493 Win=853 Len=0 TSval=1207564 TSecr=30029155
293 0.109992390 172.31.31.144 -> 172.31.23.72 TCP 66 6633 → 45550 [ACK] Seq=1 Ack=493 Win=853 Len=0 TSval=1207564 TSecr=30029155
294 0.109994202 172.31.31.144 -> 172.31.23.72 TCP 66 6633 → 45508 [ACK] Seq=1 Ack=493 Win=853 Len=0 TSval=1207564 TSecr=30029155
295 0.109996016 172.31.31.144 -> 172.31.23.72 TCP 66 6633 → 45542 [ACK] Seq=1 Ack=739 Win=853 Len=0 TSval=1207564 TSecr=30029155
296 0.109997798 172.31.31.144 -> 172.31.23.72 TCP 66 6633 → 45520 [ACK] Seq=1 Ack=985 Win=853 Len=0 TSval=1207564 TSecr=30029155
297 0.109999574 172.31.31.144 -> 172.31.23.72 TCP 66 6633 → 45546 [ACK] Seq=969 Ack=247 Win=853 Len=0 TSval=1207564 TSecr=30029154
298 0.110001629 172.31.31.144 -> 172.31.23.72 TCP 66 6633 → 45514 [ACK] Seq=969 Ack=493 Win=853 Len=0 TSval=1207564 TSecr=30029155
299 0.110131454 172.31.31.144 -> 172.31.23.72 TCP 66 6633 → 45518 [ACK] Seq=1211 Ack=739 Win=853 Len=0 TSval=1207564 TSecr=30029155
300 0.110133833 172.31.31.144 -> 172.31.23.72 TCP 66 6633 → 45512 [ACK] Seq=1211 Ack=493 Win=853 Len=0 TSval=1207564 TSecr=30029155
301 0.110135659 172.31.31.144 -> 172.31.23.72 TCP 66 6633 → 45538 [ACK] Seq=1211 Ack=493 Win=853 Len=0 TSval=1207564 TSecr=30029155
302 0.110239850 172.31.31.144 -> 172.31.23.72 TCP 66 6633 → 45528 [ACK] Seq=1211 Ack=985 Win=853 Len=0 TSval=1207564 TSecr=30029154
303 0.110242522 172.31.31.144 -> 172.31.23.72 TCP 66 6633 → 45532 [ACK] Seq=969 Ack=985 Win=853 Len=0 TSval=1207564 TSecr=30029155
304 0.110244211 172.31.31.144 -> 172.31.23.72 TCP 66 6633 → 45524 [ACK] Seq=1211 Ack=985 Win=853 Len=0 TSval=1207564 TSecr=30029155
305 0.110245802 172.31.31.144 -> 172.31.23.72 TCP 66 6633 → 45522 [ACK] Seq=727 Ack=493 Win=853 Len=0 TSval=1207564 TSecr=30029154
306 0.200133009 172.31.31.144 -> 172.31.23.72 OpenFlow 187 Type: OFPT_PACKET_OUT
307 0.200158225 172.31.31.144 -> 172.31.23.72 OpenFlow 187 Type: OFPT_PACKET_OUT
308 0.200162796 172.31.31.144 -> 172.31.23.72 OpenFlow 187 Type: OFPT_PACKET_OUT
309 0.200164771 172.31.31.144 -> 172.31.23.72 OpenFlow 187 Type: OFPT_PACKET_OUT
310 0.200166410 172.31.31.144 -> 172.31.23.72 OpenFlow 187 Type: OFPT_PACKET_OUT
311 0.200167937 172.31.31.144 -> 172.31.23.72 OpenFlow 187 Type: OFPT_PACKET_OUT
312 0.200169517 172.31.31.144 -> 172.31.23.72 OpenFlow 187 Type: OFPT_PACKET_OUT
313 0.200171156 172.31.31.144 -> 172.31.23.72 OpenFlow 187 Type: OFPT_PACKET_OUT
314 0.200172745 172.31.31.144 -> 172.31.23.72 OpenFlow 187 Type: OFPT_PACKET_OUT
315 0.200175734 172.31.31.144 -> 172.31.23.72 OpenFlow 187 Type: OFPT_PACKET_OUT
316 0.200177421 172.31.31.144 -> 172.31.23.72 OpenFlow 187 Type: OFPT_PACKET_OUT
317 0.200179172 172.31.31.144 -> 172.31.23.72 OpenFlow 187 Type: OFPT_PACKET_OUT
318 0.200181139 172.31.31.144 -> 172.31.23.72 OpenFlow 187 Type: OFPT_PACKET_OUT
319 0.200203872 172.31.31.144 -> 172.31.23.72 OpenFlow 187 Type: OFPT_PACKET_OUT
320 0.200206057 172.31.31.144 -> 172.31.23.72 OpenFlow 187 Type: OFPT_PACKET_OUT
321 0.200207848 172.31.31.144 -> 172.31.23.72 OpenFlow 187 Type: OFPT_PACKET_OUT
322 0.200789137 172.31.23.72 -> 172.31.31.144 TCP 66 45552 → 6633 [ACK] Seq=493 Ack=969 Win=213 Len=0 TSval=30029178 TSecr=1207586
323 0.200859443 172.31.23.72 -> 172.31.31.144 OpenFlow 189 Type: OFPT_PACKET_IN
324 0.201197981 172.31.23.72 -> 172.31.31.144 OpenFlow 189 Type: OFPT_PACKET_IN
325 0.201333571 172.31.23.72 -> 172.31.31.144 OpenFlow 189 Type: OFPT_PACKET_IN
326 0.201366582 172.31.23.72 -> 172.31.31.144 OpenFlow 189 Type: OFPT_PACKET_IN
327 0.201400321 172.31.23.72 -> 172.31.31.144 OpenFlow 189 Type: OFPT_PACKET_IN
328 0.201413604 172.31.23.72 -> 172.31.31.144 OpenFlow 189 Type: OFPT_PACKET_IN
329 0.203267764 172.31.31.144 -> 172.31.23.72 OpenFlow 187 Type: OFPT_PACKET_OUT
330 0.203276618 172.31.31.144 -> 172.31.23.72 OpenFlow 187 Type: OFPT_PACKET_OUT
331 0.203279466 172.31.31.144 -> 172.31.23.72 OpenFlow 187 Type: OFPT_PACKET_OUT
332 0.203281246 172.31.31.144 -> 172.31.23.72 OpenFlow 187 Type: OFPT_PACKET_OUT
333 0.203282606 172.31.31.144 -> 172.31.23.72 OpenFlow 187 Type: OFPT_PACKET_OUT
334 0.203284014 172.31.31.144 -> 172.31.23.72 OpenFlow 187 Type: OFPT_PACKET_OUT
335 0.203285445 172.31.31.144 -> 172.31.23.72 OpenFlow 187 Type: OFPT_PACKET_OUT
336 0.203290163 172.31.23.72 -> 172.31.31.144 OpenFlow 189 Type: OFPT_PACKET_IN
337 0.203295568 172.31.31.144 -> 172.31.23.72 OpenFlow 187 Type: OFPT_PACKET_OUT
338 0.203298134 172.31.31.144 -> 172.31.23.72 OpenFlow 187 Type: OFPT_PACKET_OUT
339 0.203299778 172.31.31.144 -> 172.31.23.72 OpenFlow 187 Type: OFPT_PACKET_OUT
340 0.203301782 172.31.31.144 -> 172.31.23.72 OpenFlow 187 Type: OFPT_PACKET_OUT
341 0.203303289 172.31.31.144 -> 172.31.23.72 OpenFlow 187 Type: OFPT_PACKET_OUT
342 0.203304439 172.31.31.144 -> 172.31.23.72 OpenFlow 187 Type: OFPT_PACKET_OUT
343 0.203310074 172.31.31.144 -> 172.31.23.72 OpenFlow 187 Type: OFPT_PACKET_OUT
344 0.203311726 172.31.31.144 -> 172.31.23.72 OpenFlow 187 Type: OFPT_PACKET_OUT
345 0.203314324 172.31.31.144 -> 172.31.23.72 OpenFlow 187 Type: OFPT_PACKET_OUT
346 0.203316278 172.31.31.144 -> 172.31.23.72 OpenFlow 187 Type: OFPT_PACKET_OUT
347 0.203317740 172.31.31.144 -> 172.31.23.72 OpenFlow 187 Type: OFPT_PACKET_OUT
348 0.203319451 172.31.31.144 -> 172.31.23.72 OpenFlow 187 Type: OFPT_PACKET_OUT
349 0.203321122 172.31.31.144 -> 172.31.23.72 OpenFlow 187 Type: OFPT_PACKET_OUT
350 0.203322959 172.31.31.144 -> 172.31.23.72 OpenFlow 187 Type: OFPT_PACKET_OUT
351 0.203325156 172.31.31.144 -> 172.31.23.72 OpenFlow 187 Type: OFPT_PACKET_OUT
352 0.203326747 172.31.31.144 -> 172.31.23.72 OpenFlow 187 Type: OFPT_PACKET_OUT
353 0.203328164 172.31.31.144 -> 172.31.23.72 OpenFlow 187 Type: OFPT_PACKET_OUT
354 0.203329303 172.31.31.144 -> 172.31.23.72 OpenFlow 187 Type: OFPT_PACKET_OUT
355 0.203330567 172.31.31.144 -> 172.31.23.72 OpenFlow 187 Type: OFPT_PACKET_OUT
356 0.203332233 172.31.31.144 -> 172.31.23.72 OpenFlow 187 Type: OFPT_PACKET_OUT
357 0.203334684 172.31.31.144 -> 172.31.23.72 OpenFlow 187 Type: OFPT_PACKET_OUT
358 0.203336302 172.31.31.144 -> 172.31.23.72 OpenFlow 187 Type: OFPT_PACKET_OUT
359 0.203337891 172.31.31.144 -> 172.31.23.72 OpenFlow 187 Type: OFPT_PACKET_OUT
360 0.203339232 172.31.31.144 -> 172.31.23.72 OpenFlow 187 Type: OFPT_PACKET_OUT
361 0.203340713 172.31.31.144 -> 172.31.23.72 OpenFlow 187 Type: OFPT_PACKET_OUT
362 0.203342247 172.31.31.144 -> 172.31.23.72 OpenFlow 187 Type: OFPT_PACKET_OUT
363 0.203343885 172.31.31.144 -> 172.31.23.72 OpenFlow 187 Type: OFPT_PACKET_OUT
364 0.203345281 172.31.31.144 -> 172.31.23.72 OpenFlow 187 Type: OFPT_PACKET_OUT
365 0.203346566 172.31.31.144 -> 172.31.23.72 OpenFlow 187 Type: OFPT_PACKET_OUT
366 0.203347696 172.31.31.144 -> 172.31.23.72 OpenFlow 187 Type: OFPT_PACKET_OUT
367 0.203349553 172.31.31.144 -> 172.31.23.72 OpenFlow 187 Type: OFPT_PACKET_OUT
368 0.203350778 172.31.31.144 -> 172.31.23.72 OpenFlow 187 Type: OFPT_PACKET_OUT
369 0.203352101 172.31.31.144 -> 172.31.23.72 OpenFlow 187 Type: OFPT_PACKET_OUT
370 0.203353379 172.31.31.144 -> 172.31.23.72 OpenFlow 187 Type: OFPT_PACKET_OUT
371 0.203355253 172.31.31.144 -> 172.31.23.72 OpenFlow 187 Type: OFPT_PACKET_OUT
372 0.203375969 172.31.23.72 -> 172.31.31.144 OpenFlow 189 Type: OFPT_PACKET_IN
373 0.203379083 172.31.23.72 -> 172.31.31.144 OpenFlow 189 Type: OFPT_PACKET_IN
374 0.203605670 172.31.31.144 -> 172.31.23.72 TCP 66 6633 → 45550 [ACK] Seq=969 Ack=616 Win=853 Len=0 TSval=1207587 TSecr=30029178
375 0.203613183 172.31.31.144 -> 172.31.23.72 TCP 66 6633 → 45548 [ACK] Seq=969 Ack=616 Win=853 Len=0 TSval=1207588 TSecr=30029178
376 0.203618575 172.31.23.72 -> 172.31.31.144 OpenFlow 435 Type: OFPT_PACKET_IN
377 0.203620939 172.31.23.72 -> 172.31.31.144 OpenFlow 189 Type: OFPT_PACKET_IN
378 0.203623093 172.31.23.72 -> 172.31.31.144 OpenFlow 189 Type: OFPT_PACKET_IN
379 0.203708423 172.31.23.72 -> 172.31.31.144 TCP 66 45508 → 6633 [ACK] Seq=493 Ack=727 Win=213 Len=0 TSval=30029179 TSecr=1207587
380 0.203991997 172.31.23.72 -> 172.31.31.144 TCP 66 45548 → 6633 [ACK] Seq=739 Ack=969 Win=213 Len=0 TSval=30029179 TSecr=1207587
381 0.204231914 172.31.23.72 -> 172.31.31.144 TCP 66 45542 → 6633 [ACK] Seq=739 Ack=727 Win=213 Len=0 TSval=30029179 TSecr=1207587
382 0.204497700 172.31.23.72 -> 172.31.31.144 TCP 66 45536 → 6633 [ACK] Seq=739 Ack=727 Win=213 Len=0 TSval=30029179 TSecr=1207587
383 0.204908270 172.31.23.72 -> 172.31.31.144 TCP 66 45520 → 6633 [ACK] Seq=985 Ack=1211 Win=213 Len=0 TSval=30029179 TSecr=1207587
384 0.204962269 172.31.23.72 -> 172.31.31.144 OpenFlow 189 Type: OFPT_PACKET_IN
385 0.205290484 172.31.23.72 -> 172.31.31.144 OpenFlow 189 Type: OFPT_PACKET_IN
386 0.205313098 172.31.23.72 -> 172.31.31.144 OpenFlow 189 Type: OFPT_PACKET_IN
387 0.205329356 172.31.23.72 -> 172.31.31.144 OpenFlow 189 Type: OFPT_PACKET_IN
