  1 0.000000000 41.177.127.217 -> 172.31.24.227 TCP 54 58416 → 22 [ACK] Seq=1 Ack=1 Win=32550 Len=0
  2 0.062776373 41.177.127.217 -> 172.31.24.227 TCP 54 58416 → 22 [ACK] Seq=1 Ack=37 Win=32532 Len=0
  3 0.146467803 41.177.127.217 -> 172.31.24.227 TCP 54 58416 → 22 [ACK] Seq=1 Ack=133 Win=32484 Len=0
  4 0.456189129 172.31.31.144 -> 172.31.24.227 TCP 187 6633 → 39480 [PSH, ACK] Seq=1 Ack=1 Win=853 Len=121 TSval=405690 TSecr=118966026
  5 0.456212998 172.31.31.144 -> 172.31.24.227 TCP 187 6633 → 39480 [PSH, ACK] Seq=122 Ack=1 Win=853 Len=121 TSval=405690 TSecr=118966026
  6 0.456224946 172.31.31.144 -> 172.31.24.227 TCP 187 6633 → 39480 [PSH, ACK] Seq=243 Ack=1 Win=853 Len=121 TSval=405690 TSecr=118966026
  7 0.456298071 172.31.31.144 -> 172.31.24.227 TCP 187 6633 → 39480 [PSH, ACK] Seq=364 Ack=1 Win=853 Len=121 TSval=405690 TSecr=118966026
  8 0.456346033 172.31.31.144 -> 172.31.24.227 TCP 187 6633 → 39480 [PSH, ACK] Seq=485 Ack=1 Win=853 Len=121 TSval=405690 TSecr=118966026
  9 0.456356656 172.31.24.227 -> 172.31.31.144 TCP 66 39480 → 6633 [ACK] Seq=1 Ack=606 Win=87 Len=0 TSval=118966300 TSecr=405690
 10 0.456417763 172.31.31.144 -> 172.31.24.227 TCP 187 6633 → 39480 [PSH, ACK] Seq=606 Ack=1 Win=853 Len=121 TSval=405690 TSecr=118966026
 11 0.456486839 172.31.31.144 -> 172.31.24.227 TCP 187 6633 → 39480 [PSH, ACK] Seq=727 Ack=1 Win=853 Len=121 TSval=405690 TSecr=118966026
 12 0.456587901 172.31.31.144 -> 172.31.24.227 TCP 187 6633 → 39480 [PSH, ACK] Seq=848 Ack=1 Win=853 Len=121 TSval=405691 TSecr=118966300
 13 0.456672427 172.31.31.144 -> 172.31.24.227 TCP 187 6633 → 39480 [PSH, ACK] Seq=969 Ack=1 Win=853 Len=121 TSval=405691 TSecr=118966300
 14 0.456743644 172.31.31.144 -> 172.31.24.227 TCP 187 6633 → 39480 [PSH, ACK] Seq=1090 Ack=1 Win=853 Len=121 TSval=405691 TSecr=118966300
 15 0.456747935 172.31.24.227 -> 172.31.31.144 TCP 66 39480 → 6633 [ACK] Seq=1 Ack=1211 Win=87 Len=0 TSval=118966301 TSecr=405690
 16 0.456809535 172.31.31.144 -> 172.31.24.227 TCP 187 6633 → 39480 [PSH, ACK] Seq=1211 Ack=1 Win=853 Len=121 TSval=405691 TSecr=118966300
 17 0.456877199 172.31.31.144 -> 172.31.24.227 TCP 187 6633 → 39480 [PSH, ACK] Seq=1332 Ack=1 Win=853 Len=121 TSval=405691 TSecr=118966300
 18 0.457024425 172.31.31.144 -> 172.31.24.227 TCP 187 6633 → 39456 [PSH, ACK] Seq=1 Ack=1 Win=853 Len=121 TSval=405691 TSecr=118966043
 19 0.457041590 172.31.31.144 -> 172.31.24.227 TCP 187 6633 → 39456 [PSH, ACK] Seq=122 Ack=1 Win=853 Len=121 TSval=405691 TSecr=118966043
 20 0.457131858 172.31.31.144 -> 172.31.24.227 TCP 187 6633 → 39456 [PSH, ACK] Seq=243 Ack=1 Win=853 Len=121 TSval=405691 TSecr=118966043
 21 0.457189955 172.31.31.144 -> 172.31.24.227 TCP 187 6633 → 39456 [PSH, ACK] Seq=364 Ack=1 Win=853 Len=121 TSval=405691 TSecr=118966043
 22 0.457257786 172.31.31.144 -> 172.31.24.227 TCP 187 6633 → 39456 [PSH, ACK] Seq=485 Ack=1 Win=853 Len=121 TSval=405691 TSecr=118966043
 23 0.457264497 172.31.24.227 -> 172.31.31.144 TCP 66 39456 → 6633 [ACK] Seq=1 Ack=606 Win=74 Len=0 TSval=118966301 TSecr=405691
 24 0.457330179 172.31.31.144 -> 172.31.24.227 TCP 187 6633 → 39456 [PSH, ACK] Seq=606 Ack=1 Win=853 Len=121 TSval=405691 TSecr=118966043
 25 0.457395921 172.31.31.144 -> 172.31.24.227 TCP 187 6633 → 39456 [PSH, ACK] Seq=727 Ack=1 Win=853 Len=121 TSval=405691 TSecr=118966043
 26 0.457519236 172.31.31.144 -> 172.31.24.227 TCP 187 6633 → 39456 [PSH, ACK] Seq=848 Ack=1 Win=853 Len=121 TSval=405691 TSecr=118966301
 27 0.457535451 172.31.31.144 -> 172.31.24.227 TCP 187 6633 → 39456 [PSH, ACK] Seq=969 Ack=1 Win=853 Len=121 TSval=405691 TSecr=118966301
 28 0.457602522 172.31.31.144 -> 172.31.24.227 TCP 187 6633 → 39456 [PSH, ACK] Seq=1090 Ack=1 Win=853 Len=121 TSval=405691 TSecr=118966301
 29 0.457607998 172.31.24.227 -> 172.31.31.144 TCP 66 39456 → 6633 [ACK] Seq=1 Ack=1211 Win=74 Len=0 TSval=118966301 TSecr=405691
 30 0.457681925 172.31.31.144 -> 172.31.24.227 TCP 187 6633 → 39456 [PSH, ACK] Seq=1211 Ack=1 Win=853 Len=121 TSval=405691 TSecr=118966301
 31 0.457710256 172.31.24.227 -> 172.31.31.144 TCP 66 39480 → 6633 [ACK] Seq=1 Ack=1453 Win=87 Len=0 TSval=118966301 TSecr=405691
 32 0.457760259 172.31.31.144 -> 172.31.24.227 TCP 187 6633 → 39456 [PSH, ACK] Seq=1332 Ack=1 Win=853 Len=121 TSval=405691 TSecr=118966301
 33 0.457795098 172.31.24.227 -> 172.31.31.144 OpenFlow 189 Type: OFPT_PACKET_IN
 34 0.457816562 172.31.24.227 -> 172.31.31.144 OpenFlow 435 Type: OFPT_PACKET_IN
 35 0.457851388 172.31.24.227 -> 172.31.31.144 OpenFlow 189 Type: OFPT_PACKET_IN
 36 0.457874525 172.31.31.144 -> 172.31.24.227 TCP 187 6633 → 39486 [PSH, ACK] Seq=1 Ack=1 Win=853 Len=121 TSval=405691 TSecr=118966015
 37 0.457881553 172.31.24.227 -> 172.31.31.144 OpenFlow 189 Type: OFPT_PACKET_IN
 38 0.457921080 172.31.31.144 -> 172.31.24.227 TCP 187 6633 → 39486 [PSH, ACK] Seq=122 Ack=1 Win=853 Len=121 TSval=405691 TSecr=118966015
 39 0.457992960 172.31.31.144 -> 172.31.24.227 TCP 66 6633 → 39484 [ACK] Seq=1 Ack=124 Win=853 Len=0 TSval=405691 TSecr=118966301
 40 0.458010625 172.31.31.144 -> 172.31.24.227 TCP 66 6633 → 39484 [ACK] Seq=1 Ack=493 Win=853 Len=0 TSval=405691 TSecr=118966301
 41 0.458043017 172.31.31.144 -> 172.31.24.227 TCP 187 6633 → 39486 [PSH, ACK] Seq=243 Ack=1 Win=853 Len=121 TSval=405691 TSecr=118966015
 42 0.458061136 172.31.31.144 -> 172.31.24.227 TCP 187 6633 → 39486 [PSH, ACK] Seq=364 Ack=1 Win=853 Len=121 TSval=405691 TSecr=118966015
 43 0.458078980 172.31.31.144 -> 172.31.24.227 TCP 66 6633 → 39492 [ACK] Seq=1 Ack=124 Win=853 Len=0 TSval=405691 TSecr=118966301
 44 0.458098503 172.31.31.144 -> 172.31.24.227 TCP 66 6633 → 39492 [ACK] Seq=1 Ack=247 Win=853 Len=0 TSval=405691 TSecr=118966301
 45 0.458118208 172.31.31.144 -> 172.31.24.227 TCP 187 6633 → 39486 [PSH, ACK] Seq=485 Ack=1 Win=853 Len=121 TSval=405691 TSecr=118966015
 46 0.458190840 172.31.31.144 -> 172.31.24.227 TCP 187 6633 → 39486 [PSH, ACK] Seq=606 Ack=1 Win=853 Len=121 TSval=405691 TSecr=118966015
 47 0.458197315 172.31.24.227 -> 172.31.31.144 TCP 66 39486 → 6633 [ACK] Seq=1 Ack=727 Win=94 Len=0 TSval=118966301 TSecr=405691
 48 0.458283332 172.31.31.144 -> 172.31.24.227 TCP 187 6633 → 39486 [PSH, ACK] Seq=727 Ack=1 Win=853 Len=121 TSval=405691 TSecr=118966015
 49 0.458522027 172.31.24.227 -> 172.31.31.144 TCP 66 39456 → 6633 [ACK] Seq=1 Ack=1453 Win=74 Len=0 TSval=118966301 TSecr=405691
 50 0.458549682 172.31.31.144 -> 172.31.24.227 TCP 187 6633 → 39486 [PSH, ACK] Seq=848 Ack=1 Win=853 Len=121 TSval=405691 TSecr=118966301
 51 0.458596214 172.31.24.227 -> 172.31.31.144 OpenFlow 189 Type: OFPT_PACKET_IN
 52 0.458617711 172.31.24.227 -> 172.31.31.144 OpenFlow 189 Type: OFPT_PACKET_IN
 53 0.458634946 172.31.24.227 -> 172.31.31.144 OpenFlow 189 Type: OFPT_PACKET_IN
 54 0.458669518 172.31.24.227 -> 172.31.31.144 OpenFlow 681 Type: OFPT_PACKET_IN
 55 0.458782692 172.31.31.144 -> 172.31.24.227 TCP 66 6633 → 39458 [ACK] Seq=1 Ack=124 Win=853 Len=0 TSval=405691 TSecr=118966301
 56 0.458798245 172.31.31.144 -> 172.31.24.227 TCP 66 6633 → 39458 [ACK] Seq=1 Ack=247 Win=853 Len=0 TSval=405691 TSecr=118966301
 57 0.458818792 172.31.31.144 -> 172.31.24.227 TCP 66 6633 → 39464 [ACK] Seq=1 Ack=124 Win=853 Len=0 TSval=405691 TSecr=118966301
 58 0.458863506 172.31.31.144 -> 172.31.24.227 TCP 66 6633 → 39464 [ACK] Seq=1 Ack=739 Win=853 Len=0 TSval=405691 TSecr=118966301
 59 0.458966026 172.31.24.227 -> 172.31.31.144 TCP 66 39486 → 6633 [ACK] Seq=1 Ack=969 Win=94 Len=0 TSval=118966301 TSecr=405691
 60 0.459103607 172.31.24.227 -> 172.31.31.144 OpenFlow 189 Type: OFPT_PACKET_IN
 61 0.459137503 172.31.24.227 -> 172.31.31.144 OpenFlow 681 Type: OFPT_PACKET_IN
 62 0.459152685 172.31.24.227 -> 172.31.31.144 OpenFlow 189 Type: OFPT_PACKET_IN
 63 0.459165067 172.31.24.227 -> 172.31.31.144 OpenFlow 189 Type: OFPT_PACKET_IN
 64 0.459227605 172.31.24.227 -> 172.31.31.144 OpenFlow 189 Type: OFPT_PACKET_IN
 65 0.459232608 172.31.24.227 -> 172.31.31.144 OpenFlow 189 Type: OFPT_PACKET_IN
 66 0.459244167 172.31.24.227 -> 172.31.31.144 OpenFlow 189 Type: OFPT_PACKET_IN
 67 0.459268045 172.31.24.227 -> 172.31.31.144 OpenFlow 189 Type: OFPT_PACKET_IN
 68 0.459312774 172.31.31.144 -> 172.31.24.227 TCP 66 6633 → 39446 [ACK] Seq=1 Ack=124 Win=853 Len=0 TSval=405691 TSecr=118966301
 69 0.459349114 172.31.24.227 -> 172.31.31.144 OpenFlow 189 Type: OFPT_PACKET_IN
 70 0.459354020 172.31.24.227 -> 172.31.31.144 OpenFlow 435 Type: OFPT_PACKET_IN
 71 0.459373655 172.31.31.144 -> 172.31.24.227 TCP 66 6633 → 39446 [ACK] Seq=1 Ack=739 Win=853 Len=0 TSval=405691 TSecr=118966301
 72 0.459377128 172.31.31.144 -> 172.31.24.227 TCP 66 6633 → 39448 [ACK] Seq=1 Ack=124 Win=853 Len=0 TSval=405691 TSecr=118966301
 73 0.459428593 172.31.31.144 -> 172.31.24.227 TCP 66 6633 → 39450 [ACK] Seq=1 Ack=124 Win=853 Len=0 TSval=405691 TSecr=118966301
 74 0.459431842 172.31.31.144 -> 172.31.24.227 TCP 66 6633 → 39448 [ACK] Seq=1 Ack=247 Win=853 Len=0 TSval=405691 TSecr=118966301
 75 0.459433479 172.31.31.144 -> 172.31.24.227 TCP 66 6633 → 39450 [ACK] Seq=1 Ack=247 Win=853 Len=0 TSval=405691 TSecr=118966301
 76 0.459486432 172.31.31.144 -> 172.31.24.227 TCP 66 6633 → 39472 [ACK] Seq=1 Ack=124 Win=853 Len=0 TSval=405691 TSecr=118966301
 77 0.459534882 172.31.31.144 -> 172.31.24.227 TCP 66 6633 → 39472 [ACK] Seq=1 Ack=247 Win=853 Len=0 TSval=405691 TSecr=118966301
 78 0.459983237 172.31.31.144 -> 172.31.24.227 TCP 66 6633 → 39478 [ACK] Seq=1 Ack=493 Win=853 Len=0 TSval=405691 TSecr=118966301
 79 0.461783576 172.31.31.144 -> 172.31.24.227 TCP 187 6633 → 39468 [PSH, ACK] Seq=1 Ack=1 Win=853 Len=121 TSval=405691 TSecr=118966042
 80 0.461797891 172.31.31.144 -> 172.31.24.227 TCP 187 6633 → 39468 [PSH, ACK] Seq=122 Ack=1 Win=853 Len=121 TSval=405692 TSecr=118966042
 81 0.461817735 172.31.31.144 -> 172.31.24.227 TCP 187 6633 → 39468 [PSH, ACK] Seq=243 Ack=1 Win=853 Len=121 TSval=405692 TSecr=118966042
 82 0.461845542 172.31.31.144 -> 172.31.24.227 TCP 187 6633 → 39468 [PSH, ACK] Seq=364 Ack=1 Win=853 Len=121 TSval=405692 TSecr=118966042
 83 0.461868031 172.31.31.144 -> 172.31.24.227 TCP 187 6633 → 39468 [PSH, ACK] Seq=485 Ack=1 Win=853 Len=121 TSval=405692 TSecr=118966042
 84 0.461872425 172.31.24.227 -> 172.31.31.144 TCP 66 39468 → 6633 [ACK] Seq=1 Ack=606 Win=82 Len=0 TSval=118966302 TSecr=405691
 85 0.461890068 172.31.31.144 -> 172.31.24.227 TCP 187 6633 → 39468 [PSH, ACK] Seq=606 Ack=1 Win=853 Len=121 TSval=405692 TSecr=118966042
 86 0.461932178 172.31.31.144 -> 172.31.24.227 TCP 187 6633 → 39468 [PSH, ACK] Seq=727 Ack=1 Win=853 Len=121 TSval=405692 TSecr=118966042
 87 0.461935788 172.31.31.144 -> 172.31.24.227 TCP 187 6633 → 39468 [PSH, ACK] Seq=848 Ack=1 Win=853 Len=121 TSval=405692 TSecr=118966042
 88 0.461966743 172.31.31.144 -> 172.31.24.227 TCP 187 6633 → 39468 [PSH, ACK] Seq=969 Ack=1 Win=853 Len=121 TSval=405692 TSecr=118966042
 89 0.461969123 172.31.31.144 -> 172.31.24.227 TCP 187 6633 → 39468 [PSH, ACK] Seq=1090 Ack=1 Win=853 Len=121 TSval=405692 TSecr=118966042
 90 0.461971998 172.31.24.227 -> 172.31.31.144 TCP 66 39468 → 6633 [ACK] Seq=1 Ack=1211 Win=82 Len=0 TSval=118966302 TSecr=405692
 91 0.462113473 172.31.31.144 -> 172.31.24.227 TCP 429 6633 → 39468 [PSH, ACK] Seq=1211 Ack=1 Win=853 Len=363 TSval=405692 TSecr=118966302
 92 0.462170192 172.31.31.144 -> 172.31.24.227 TCP 187 6633 → 39468 [PSH, ACK] Seq=1574 Ack=1 Win=853 Len=121 TSval=405692 TSecr=118966302
 93 0.462269773 172.31.31.144 -> 172.31.24.227 TCP 187 6633 → 39466 [PSH, ACK] Seq=1 Ack=1 Win=853 Len=121 TSval=405692 TSecr=118966045
 94 0.462304591 172.31.31.144 -> 172.31.24.227 TCP 187 6633 → 39466 [PSH, ACK] Seq=122 Ack=1 Win=853 Len=121 TSval=405692 TSecr=118966045
 95 0.462405197 172.31.31.144 -> 172.31.24.227 TCP 187 6633 → 39466 [PSH, ACK] Seq=243 Ack=1 Win=853 Len=121 TSval=405692 TSecr=118966045
 96 0.462457232 172.31.31.144 -> 172.31.24.227 TCP 187 6633 → 39466 [PSH, ACK] Seq=364 Ack=1 Win=853 Len=121 TSval=405692 TSecr=118966045
 97 0.462467222 172.31.24.227 -> 172.31.31.144 TCP 66 39468 → 6633 [ACK] Seq=1 Ack=1695 Win=84 Len=0 TSval=118966302 TSecr=405692
 98 0.462517988 172.31.31.144 -> 172.31.24.227 TCP 187 6633 → 39466 [PSH, ACK] Seq=485 Ack=1 Win=853 Len=121 TSval=405692 TSecr=118966045
 99 0.462545719 172.31.24.227 -> 172.31.31.144 OpenFlow 189 Type: OFPT_PACKET_IN
100 0.462566861 172.31.24.227 -> 172.31.31.144 OpenFlow 189 Type: OFPT_PACKET_IN
101 0.462597378 172.31.31.144 -> 172.31.24.227 TCP 187 6633 → 39466 [PSH, ACK] Seq=606 Ack=1 Win=853 Len=121 TSval=405692 TSecr=118966045
102 0.462632954 172.31.31.144 -> 172.31.24.227 TCP 187 6633 → 39466 [PSH, ACK] Seq=727 Ack=1 Win=853 Len=121 TSval=405692 TSecr=118966045
103 0.462643623 172.31.24.227 -> 172.31.31.144 OpenFlow 189 Type: OFPT_PACKET_IN
104 0.462664271 172.31.24.227 -> 172.31.31.144 OpenFlow 189 Type: OFPT_PACKET_IN
105 0.462726338 172.31.31.144 -> 172.31.24.227 TCP 187 6633 → 39466 [PSH, ACK] Seq=848 Ack=1 Win=853 Len=121 TSval=405692 TSecr=118966045
106 0.462746148 172.31.31.144 -> 172.31.24.227 TCP 66 6633 → 39470 [ACK] Seq=1 Ack=124 Win=853 Len=0 TSval=405692 TSecr=118966302
107 0.462774396 172.31.31.144 -> 172.31.24.227 TCP 66 6633 → 39470 [ACK] Seq=1 Ack=247 Win=853 Len=0 TSval=405692 TSecr=118966302
108 0.462807366 172.31.24.227 -> 172.31.31.144 OpenFlow 189 Type: OFPT_PACKET_IN
109 0.462820207 172.31.31.144 -> 172.31.24.227 TCP 187 6633 → 39466 [PSH, ACK] Seq=969 Ack=1 Win=853 Len=121 TSval=405692 TSecr=118966045
110 0.462825735 172.31.24.227 -> 172.31.31.144 OpenFlow 189 Type: OFPT_PACKET_IN
111 0.462850933 172.31.24.227 -> 172.31.31.144 OpenFlow 189 Type: OFPT_PACKET_IN
112 0.462856086 172.31.31.144 -> 172.31.24.227 TCP 66 6633 → 39492 [ACK] Seq=1 Ack=370 Win=853 Len=0 TSval=405692 TSecr=118966302
113 0.462860430 172.31.24.227 -> 172.31.31.144 OpenFlow 558 Type: OFPT_PACKET_IN
114 0.462875811 172.31.31.144 -> 172.31.24.227 TCP 187 6633 → 39466 [PSH, ACK] Seq=1090 Ack=1 Win=853 Len=121 TSval=405692 TSecr=118966045
115 0.462910313 172.31.24.227 -> 172.31.31.144 OpenFlow 189 Type: OFPT_PACKET_IN
116 0.462926935 172.31.31.144 -> 172.31.24.227 TCP 66 6633 → 39492 [ACK] Seq=1 Ack=493 Win=853 Len=0 TSval=405692 TSecr=118966302
117 0.463031798 172.31.31.144 -> 172.31.24.227 TCP 66 6633 → 39462 [ACK] Seq=1 Ack=124 Win=853 Len=0 TSval=405692 TSecr=118966302
118 0.463037200 172.31.31.144 -> 172.31.24.227 TCP 66 6633 → 39462 [ACK] Seq=1 Ack=247 Win=853 Len=0 TSval=405692 TSecr=118966302
119 0.463050689 172.31.31.144 -> 172.31.24.227 TCP 66 6633 → 39464 [ACK] Seq=1 Ack=862 Win=853 Len=0 TSval=405692 TSecr=118966302
120 0.463070790 172.31.31.144 -> 172.31.24.227 TCP 66 6633 → 39462 [ACK] Seq=1 Ack=739 Win=853 Len=0 TSval=405692 TSecr=118966302
121 0.463093230 172.31.31.144 -> 172.31.24.227 TCP 66 6633 → 39464 [ACK] Seq=1 Ack=985 Win=853 Len=0 TSval=405692 TSecr=118966302
122 0.463290324 172.31.24.227 -> 172.31.31.144 TCP 66 39466 → 6633 [ACK] Seq=1 Ack=1211 Win=385 Len=0 TSval=118966302 TSecr=405692
123 0.463350088 172.31.24.227 -> 172.31.31.144 OpenFlow 189 Type: OFPT_PACKET_IN
124 0.463372698 172.31.24.227 -> 172.31.31.144 OpenFlow 189 Type: OFPT_PACKET_IN
125 0.463421936 172.31.24.227 -> 172.31.31.144 OpenFlow 189 Type: OFPT_PACKET_IN
126 0.463504162 172.31.24.227 -> 172.31.31.144 OpenFlow 189 Type: OFPT_PACKET_IN
127 0.464132583 172.31.24.227 -> 172.31.31.144 OpenFlow 435 Type: OFPT_PACKET_IN
128 0.464137937 172.31.24.227 -> 172.31.31.144 OpenFlow 189 Type: OFPT_PACKET_IN
129 0.464201247 172.31.31.144 -> 172.31.24.227 TCP 187 6633 → 39490 [PSH, ACK] Seq=1 Ack=1 Win=853 Len=121 TSval=405692 TSecr=118966020
130 0.464208065 172.31.31.144 -> 172.31.24.227 TCP 187 6633 → 39490 [PSH, ACK] Seq=122 Ack=1 Win=853 Len=121 TSval=405692 TSecr=118966020
131 0.464210390 172.31.31.144 -> 172.31.24.227 TCP 187 6633 → 39490 [PSH, ACK] Seq=243 Ack=1 Win=853 Len=121 TSval=405692 TSecr=118966020
132 0.464212089 172.31.31.144 -> 172.31.24.227 TCP 187 6633 → 39490 [PSH, ACK] Seq=364 Ack=1 Win=853 Len=121 TSval=405692 TSecr=118966020
133 0.464218804 172.31.24.227 -> 172.31.31.144 OpenFlow 189 Type: OFPT_PACKET_IN
134 0.464225357 172.31.24.227 -> 172.31.31.144 OpenFlow 189 Type: OFPT_PACKET_IN
135 0.464293273 172.31.31.144 -> 172.31.24.227 TCP 187 6633 → 39490 [PSH, ACK] Seq=485 Ack=1 Win=853 Len=121 TSval=405692 TSecr=118966020
136 0.464298447 172.31.24.227 -> 172.31.31.144 TCP 66 39490 → 6633 [ACK] Seq=1 Ack=606 Win=57 Len=0 TSval=118966302 TSecr=405692
137 0.464303118 172.31.31.144 -> 172.31.24.227 TCP 1034 6633 → 39466 [PSH, ACK] Seq=1211 Ack=1 Win=853 Len=968 TSval=405692 TSecr=118966302
138 0.464305333 172.31.31.144 -> 172.31.24.227 TCP 66 6633 → 39470 [ACK] Seq=1 Ack=370 Win=853 Len=0 TSval=405692 TSecr=118966302
139 0.464318381 172.31.31.144 -> 172.31.24.227 TCP 66 6633 → 39476 [ACK] Seq=1 Ack=124 Win=853 Len=0 TSval=405692 TSecr=118966302
140 0.464347271 172.31.31.144 -> 172.31.24.227 TCP 66 6633 → 39492 [ACK] Seq=1 Ack=616 Win=853 Len=0 TSval=405692 TSecr=118966302
141 0.464362874 172.31.31.144 -> 172.31.24.227 TCP 66 6633 → 39450 [ACK] Seq=1 Ack=370 Win=853 Len=0 TSval=405692 TSecr=118966302
142 0.464383739 172.31.31.144 -> 172.31.24.227 TCP 66 6633 → 39470 [ACK] Seq=1 Ack=739 Win=853 Len=0 TSval=405692 TSecr=118966302
143 0.464398650 172.31.31.144 -> 172.31.24.227 TCP 66 6633 → 39476 [ACK] Seq=1 Ack=247 Win=853 Len=0 TSval=405692 TSecr=118966302
144 0.464417583 172.31.31.144 -> 172.31.24.227 TCP 66 6633 → 39492 [ACK] Seq=1 Ack=739 Win=853 Len=0 TSval=405692 TSecr=118966302
145 0.464435501 172.31.31.144 -> 172.31.24.227 TCP 66 6633 → 39450 [ACK] Seq=1 Ack=493 Win=853 Len=0 TSval=405692 TSecr=118966302
146 0.464455070 172.31.31.144 -> 172.31.24.227 TCP 187 6633 → 39490 [PSH, ACK] Seq=606 Ack=1 Win=853 Len=121 TSval=405692 TSecr=118966020
147 0.464473785 172.31.31.144 -> 172.31.24.227 TCP 187 6633 → 39490 [PSH, ACK] Seq=727 Ack=1 Win=853 Len=121 TSval=405692 TSecr=118966020
148 0.464541365 172.31.31.144 -> 172.31.24.227 TCP 187 6633 → 39490 [PSH, ACK] Seq=848 Ack=1 Win=853 Len=121 TSval=405692 TSecr=118966302
149 0.464655351 172.31.31.144 -> 172.31.24.227 TCP 187 6633 → 39490 [PSH, ACK] Seq=969 Ack=1 Win=853 Len=121 TSval=405693 TSecr=118966302
150 0.464755543 172.31.31.144 -> 172.31.24.227 TCP 187 6633 → 39490 [PSH, ACK] Seq=1090 Ack=1 Win=853 Len=121 TSval=405693 TSecr=118966302
151 0.464760835 172.31.24.227 -> 172.31.31.144 TCP 66 39490 → 6633 [ACK] Seq=1 Ack=1211 Win=57 Len=0 TSval=118966303 TSecr=405692
152 0.465272410 172.31.24.227 -> 172.31.31.144 OpenFlow 189 Type: OFPT_PACKET_IN
153 0.465296627 172.31.24.227 -> 172.31.31.144 OpenFlow 189 Type: OFPT_PACKET_IN
154 0.465307786 172.31.24.227 -> 172.31.31.144 OpenFlow 189 Type: OFPT_PACKET_IN
155 0.465312934 172.31.24.227 -> 172.31.31.144 OpenFlow 189 Type: OFPT_PACKET_IN
156 0.465337912 172.31.24.227 -> 172.31.31.144 OpenFlow 189 Type: OFPT_PACKET_IN
157 0.465340003 172.31.24.227 -> 172.31.31.144 OpenFlow 189 Type: OFPT_PACKET_IN
158 0.465424463 172.31.24.227 -> 172.31.31.144 OpenFlow 681 Type: OFPT_PACKET_IN
159 0.465428807 172.31.24.227 -> 172.31.31.144 OpenFlow 927 Type: OFPT_PACKET_IN
160 0.465515806 172.31.31.144 -> 172.31.24.227 TCP 66 6633 → 39446 [ACK] Seq=1 Ack=862 Win=853 Len=0 TSval=405693 TSecr=118966303
161 0.465553861 172.31.31.144 -> 172.31.24.227 TCP 66 6633 → 39450 [ACK] Seq=1 Ack=616 Win=853 Len=0 TSval=405693 TSecr=118966303
162 0.465585752 172.31.31.144 -> 172.31.24.227 TCP 66 6633 → 39452 [ACK] Seq=1 Ack=124 Win=853 Len=0 TSval=405693 TSecr=118966303
163 0.465603661 172.31.31.144 -> 172.31.24.227 TCP 66 6633 → 39446 [ACK] Seq=1 Ack=985 Win=853 Len=0 TSval=405693 TSecr=118966303
164 0.465624806 172.31.31.144 -> 172.31.24.227 TCP 66 6633 → 39458 [ACK] Seq=1 Ack=370 Win=853 Len=0 TSval=405693 TSecr=118966303
165 0.465656771 172.31.31.144 -> 172.31.24.227 TCP 66 6633 → 39450 [ACK] Seq=1 Ack=739 Win=853 Len=0 TSval=405693 TSecr=118966303
166 0.465675795 172.31.31.144 -> 172.31.24.227 TCP 66 6633 → 39452 [ACK] Seq=1 Ack=739 Win=853 Len=0 TSval=405693 TSecr=118966303
167 0.465695534 172.31.31.144 -> 172.31.24.227 TCP 66 6633 → 39458 [ACK] Seq=1 Ack=1231 Win=853 Len=0 TSval=405693 TSecr=118966303
168 0.500502159 172.31.24.227 -> 172.31.31.144 TCP 66 39466 → 6633 [ACK] Seq=1 Ack=2179 Win=385 Len=0 TSval=118966312 TSecr=405692
169 0.556240660 172.31.31.144 -> 172.31.24.227 OpenFlow 187 Type: OFPT_PACKET_OUT
170 0.556290123 172.31.31.144 -> 172.31.24.227 OpenFlow 187 Type: OFPT_PACKET_OUT
171 0.556331065 172.31.31.144 -> 172.31.24.227 OpenFlow 187 Type: OFPT_PACKET_OUT
172 0.556392522 172.31.31.144 -> 172.31.24.227 OpenFlow 187 Type: OFPT_PACKET_OUT
173 0.556480872 172.31.31.144 -> 172.31.24.227 OpenFlow 187 Type: OFPT_PACKET_OUT
174 0.556488645 172.31.24.227 -> 172.31.31.144 TCP 66 39472 → 6633 [ACK] Seq=247 Ack=606 Win=70 Len=0 TSval=118966326 TSecr=405715
175 0.556557836 172.31.31.144 -> 172.31.24.227 OpenFlow 187 Type: OFPT_PACKET_OUT
176 0.556623994 172.31.31.144 -> 172.31.24.227 OpenFlow 187 Type: OFPT_PACKET_OUT
177 0.556745235 172.31.31.144 -> 172.31.24.227 OpenFlow 187 Type: OFPT_PACKET_OUT
178 0.556870514 172.31.24.227 -> 172.31.31.144 TCP 66 39472 → 6633 [ACK] Seq=247 Ack=969 Win=70 Len=0 TSval=118966326 TSecr=405715
179 0.556901452 172.31.31.144 -> 172.31.24.227 OpenFlow 187 Type: OFPT_PACKET_OUT
180 0.556932433 172.31.31.144 -> 172.31.24.227 OpenFlow 187 Type: OFPT_PACKET_OUT
181 0.556965553 172.31.24.227 -> 172.31.31.144 OpenFlow 189 Type: OFPT_PACKET_IN
182 0.556979797 172.31.31.144 -> 172.31.24.227 OpenFlow 187 Type: OFPT_PACKET_OUT
183 0.556987271 172.31.24.227 -> 172.31.31.144 OpenFlow 189 Type: OFPT_PACKET_IN
184 0.557027035 172.31.24.227 -> 172.31.31.144 OpenFlow 189 Type: OFPT_PACKET_IN
185 0.557055306 172.31.24.227 -> 172.31.31.144 OpenFlow 189 Type: OFPT_PACKET_IN
186 0.557062459 172.31.31.144 -> 172.31.24.227 OpenFlow 187 Type: OFPT_PACKET_OUT
187 0.557067017 172.31.24.227 -> 172.31.31.144 OpenFlow 189 Type: OFPT_PACKET_IN
188 0.557130233 172.31.24.227 -> 172.31.31.144 OpenFlow 189 Type: OFPT_PACKET_IN
189 0.557163797 172.31.31.144 -> 172.31.24.227 OpenFlow 187 Type: OFPT_PACKET_OUT
190 0.557169105 172.31.24.227 -> 172.31.31.144 TCP 66 39492 → 6633 [ACK] Seq=739 Ack=606 Win=72 Len=0 TSval=118966326 TSecr=405716
191 0.557208807 172.31.31.144 -> 172.31.24.227 TCP 66 6633 → 39474 [ACK] Seq=1 Ack=124 Win=853 Len=0 TSval=405716 TSecr=118966326
192 0.557244858 172.31.31.144 -> 172.31.24.227 TCP 66 6633 → 39474 [ACK] Seq=1 Ack=247 Win=853 Len=0 TSval=405716 TSecr=118966326
193 0.557248749 172.31.31.144 -> 172.31.24.227 OpenFlow 187 Type: OFPT_PACKET_OUT
194 0.557278532 172.31.31.144 -> 172.31.24.227 TCP 66 6633 → 39482 [ACK] Seq=1 Ack=124 Win=853 Len=0 TSval=405716 TSecr=118966326
195 0.557310126 172.31.31.144 -> 172.31.24.227 OpenFlow 187 Type: OFPT_PACKET_OUT
196 0.557342394 172.31.31.144 -> 172.31.24.227 TCP 66 6633 → 39482 [ACK] Seq=1 Ack=247 Win=853 Len=0 TSval=405716 TSecr=118966326
197 0.557372562 172.31.31.144 -> 172.31.24.227 OpenFlow 187 Type: OFPT_PACKET_OUT
198 0.557408191 172.31.31.144 -> 172.31.24.227 TCP 66 6633 → 39486 [ACK] Seq=969 Ack=124 Win=853 Len=0 TSval=405716 TSecr=118966326
199 0.557447132 172.31.31.144 -> 172.31.24.227 TCP 66 6633 → 39486 [ACK] Seq=969 Ack=247 Win=853 Len=0 TSval=405716 TSecr=118966326
200 0.557475057 172.31.31.144 -> 172.31.24.227 OpenFlow 187 Type: OFPT_PACKET_OUT
201 0.557507732 172.31.31.144 -> 172.31.24.227 OpenFlow 187 Type: OFPT_PACKET_OUT
202 0.557512465 172.31.24.227 -> 172.31.31.144 TCP 66 39492 → 6633 [ACK] Seq=739 Ack=1211 Win=72 Len=0 TSval=118966326 TSecr=405716
203 0.557536080 172.31.31.144 -> 172.31.24.227 TCP 187 6633 → 39460 [PSH, ACK] Seq=1 Ack=1 Win=853 Len=121 TSval=405716 TSecr=118966043
204 0.557759173 172.31.24.227 -> 172.31.31.144 OpenFlow 189 Type: OFPT_PACKET_IN
205 0.557799903 172.31.24.227 -> 172.31.31.144 OpenFlow 189 Type: OFPT_PACKET_IN
206 0.557837521 172.31.31.144 -> 172.31.24.227 TCP 187 6633 → 39460 [PSH, ACK] Seq=122 Ack=1 Win=853 Len=121 TSval=405716 TSecr=118966043
207 0.557876233 172.31.31.144 -> 172.31.24.227 TCP 187 6633 → 39460 [PSH, ACK] Seq=243 Ack=1 Win=853 Len=121 TSval=405716 TSecr=118966043
208 0.557882157 172.31.24.227 -> 172.31.31.144 TCP 66 39460 → 6633 [ACK] Seq=1 Ack=243 Win=82 Len=0 TSval=118966326 TSecr=405716
209 0.557959735 172.31.24.227 -> 172.31.31.144 OpenFlow 189 Type: OFPT_PACKET_IN
210 0.557970951 172.31.31.144 -> 172.31.24.227 TCP 187 6633 → 39460 [PSH, ACK] Seq=364 Ack=1 Win=853 Len=121 TSval=405716 TSecr=118966043
211 0.557988771 172.31.24.227 -> 172.31.31.144 OpenFlow 189 Type: OFPT_PACKET_IN
212 0.558002621 172.31.24.227 -> 172.31.31.144 OpenFlow 189 Type: OFPT_PACKET_IN
213 0.558014488 172.31.24.227 -> 172.31.31.144 OpenFlow 189 Type: OFPT_PACKET_IN
214 0.558029757 172.31.31.144 -> 172.31.24.227 TCP 66 6633 → 39450 [ACK] Seq=1 Ack=862 Win=853 Len=0 TSval=405716 TSecr=118966326
215 0.558056200 172.31.24.227 -> 172.31.31.144 OpenFlow 189 Type: OFPT_PACKET_IN
216 0.558109721 172.31.24.227 -> 172.31.31.144 OpenFlow 189 Type: OFPT_PACKET_IN
217 0.558112309 172.31.24.227 -> 172.31.31.144 OpenFlow 189 Type: OFPT_PACKET_IN
218 0.558156733 172.31.31.144 -> 172.31.24.227 TCP 66 6633 → 39450 [ACK] Seq=1 Ack=985 Win=853 Len=0 TSval=405716 TSecr=118966326
219 0.558161022 172.31.31.144 -> 172.31.24.227 TCP 187 6633 → 39460 [PSH, ACK] Seq=485 Ack=1 Win=853 Len=121 TSval=405716 TSecr=118966043
220 0.558163367 172.31.31.144 -> 172.31.24.227 TCP 187 6633 → 39460 [PSH, ACK] Seq=606 Ack=1 Win=853 Len=121 TSval=405716 TSecr=118966326
221 0.558200022 172.31.24.227 -> 172.31.31.144 OpenFlow 189 Type: OFPT_PACKET_IN
222 0.558209377 172.31.24.227 -> 172.31.31.144 OpenFlow 189 Type: OFPT_PACKET_IN
223 0.558284165 172.31.31.144 -> 172.31.24.227 TCP 187 6633 → 39460 [PSH, ACK] Seq=727 Ack=1 Win=853 Len=121 TSval=405716 TSecr=118966326
224 0.558289304 172.31.31.144 -> 172.31.24.227 TCP 66 6633 → 39462 [ACK] Seq=1 Ack=862 Win=853 Len=0 TSval=405716 TSecr=118966326
225 0.558292336 172.31.31.144 -> 172.31.24.227 TCP 66 6633 → 39462 [ACK] Seq=1 Ack=985 Win=853 Len=0 TSval=405716 TSecr=118966326
226 0.558331425 172.31.24.227 -> 172.31.31.144 OpenFlow 189 Type: OFPT_PACKET_IN
227 0.558370658 172.31.31.144 -> 172.31.24.227 TCP 66 6633 → 39468 [ACK] Seq=1695 Ack=124 Win=853 Len=0 TSval=405716 TSecr=118966326
228 0.558375686 172.31.31.144 -> 172.31.24.227 TCP 66 6633 → 39480 [ACK] Seq=1453 Ack=124 Win=853 Len=0 TSval=405716 TSecr=118966326
229 0.558392005 172.31.24.227 -> 172.31.31.144 TCP 66 39460 → 6633 [ACK] Seq=1 Ack=848 Win=82 Len=0 TSval=118966326 TSecr=405716
230 0.558420145 172.31.31.144 -> 172.31.24.227 TCP 187 6633 → 39460 [PSH, ACK] Seq=848 Ack=1 Win=853 Len=121 TSval=405716 TSecr=118966326
231 0.558453880 172.31.31.144 -> 172.31.24.227 TCP 66 6633 → 39468 [ACK] Seq=1695 Ack=247 Win=853 Len=0 TSval=405716 TSecr=118966326
232 0.558533290 172.31.31.144 -> 172.31.24.227 TCP 66 6633 → 39452 [ACK] Seq=1 Ack=862 Win=853 Len=0 TSval=405716 TSecr=118966326
233 0.558538840 172.31.31.144 -> 172.31.24.227 TCP 66 6633 → 39480 [ACK] Seq=1453 Ack=247 Win=853 Len=0 TSval=405716 TSecr=118966326
234 0.558575533 172.31.31.144 -> 172.31.24.227 TCP 187 6633 → 39488 [PSH, ACK] Seq=1 Ack=1 Win=853 Len=121 TSval=405716 TSecr=118966041
235 0.558617851 172.31.31.144 -> 172.31.24.227 TCP 66 6633 → 39452 [ACK] Seq=1 Ack=985 Win=853 Len=0 TSval=405716 TSecr=118966326
236 0.558702176 172.31.31.144 -> 172.31.24.227 TCP 66 6633 → 39466 [ACK] Seq=2179 Ack=247 Win=853 Len=0 TSval=405716 TSecr=118966326
237 0.558764223 172.31.24.227 -> 172.31.31.144 OpenFlow 189 Type: OFPT_PACKET_IN
238 0.558770458 172.31.31.144 -> 172.31.24.227 TCP 187 6633 → 39488 [PSH, ACK] Seq=122 Ack=1 Win=853 Len=121 TSval=405716 TSecr=118966041
239 0.558798824 172.31.24.227 -> 172.31.31.144 OpenFlow 189 Type: OFPT_PACKET_IN
240 0.558824408 172.31.24.227 -> 172.31.31.144 OpenFlow 435 Type: OFPT_PACKET_IN
241 0.558871759 172.31.31.144 -> 172.31.24.227 TCP 187 6633 → 39488 [PSH, ACK] Seq=243 Ack=1 Win=853 Len=121 TSval=405716 TSecr=118966041
242 0.558941367 172.31.24.227 -> 172.31.31.144 TCP 66 39488 → 6633 [ACK] Seq=1 Ack=364 Win=61 Len=0 TSval=118966326 TSecr=405716
243 0.558951298 172.31.31.144 -> 172.31.24.227 TCP 187 6633 → 39488 [PSH, ACK] Seq=364 Ack=1 Win=853 Len=121 TSval=405716 TSecr=118966041
244 0.559057058 172.31.31.144 -> 172.31.24.227 TCP 66 6633 → 39452 [ACK] Seq=1 Ack=1108 Win=853 Len=0 TSval=405716 TSecr=118966326
245 0.559095930 172.31.31.144 -> 172.31.24.227 TCP 66 6633 → 39458 [ACK] Seq=1 Ack=1354 Win=853 Len=0 TSval=405716 TSecr=118966326
246 0.559113086 172.31.31.144 -> 172.31.24.227 TCP 66 6633 → 39458 [ACK] Seq=1 Ack=1723 Win=853 Len=0 TSval=405716 TSecr=118966326
247 0.559160561 172.31.24.227 -> 172.31.31.144 OpenFlow 189 Type: OFPT_PACKET_IN
248 0.559205389 172.31.31.144 -> 172.31.24.227 TCP 187 6633 → 39488 [PSH, ACK] Seq=485 Ack=1 Win=853 Len=121 TSval=405716 TSecr=118966326
249 0.559225787 172.31.24.227 -> 172.31.31.144 OpenFlow 189 Type: OFPT_PACKET_IN
250 0.559248003 172.31.24.227 -> 172.31.31.144 OpenFlow 189 Type: OFPT_PACKET_IN
251 0.559272423 172.31.24.227 -> 172.31.31.144 TCP 66 39488 → 6633 [ACK] Seq=1 Ack=606 Win=61 Len=0 TSval=118966326 TSecr=405716
252 0.559304410 172.31.31.144 -> 172.31.24.227 TCP 187 6633 → 39488 [PSH, ACK] Seq=606 Ack=1 Win=853 Len=121 TSval=405716 TSecr=118966326
253 0.559378272 172.31.31.144 -> 172.31.24.227 TCP 187 6633 → 39488 [PSH, ACK] Seq=727 Ack=1 Win=853 Len=121 TSval=405716 TSecr=118966326
254 0.559382117 172.31.31.144 -> 172.31.24.227 TCP 187 6633 → 39488 [PSH, ACK] Seq=848 Ack=1 Win=853 Len=121 TSval=405716 TSecr=118966326
255 0.559428191 172.31.31.144 -> 172.31.24.227 TCP 66 6633 → 39452 [ACK] Seq=1 Ack=1231 Win=853 Len=0 TSval=405716 TSecr=118966326
256 0.559466230 172.31.31.144 -> 172.31.24.227 TCP 66 6633 → 39474 [ACK] Seq=1 Ack=370 Win=853 Len=0 TSval=405716 TSecr=118966326
257 0.559496163 172.31.31.144 -> 172.31.24.227 TCP 66 6633 → 39474 [ACK] Seq=1 Ack=493 Win=853 Len=0 TSval=405716 TSecr=118966326
258 0.559530515 172.31.31.144 -> 172.31.24.227 OpenFlow 187 Type: OFPT_PACKET_OUT
259 0.559562056 172.31.31.144 -> 172.31.24.227 OpenFlow 187 Type: OFPT_PACKET_OUT
260 0.559588316 172.31.24.227 -> 172.31.31.144 TCP 66 39488 → 6633 [ACK] Seq=1 Ack=969 Win=61 Len=0 TSval=118966326 TSecr=405716
261 0.559719987 172.31.24.227 -> 172.31.31.144 OpenFlow 189 Type: OFPT_PACKET_IN
262 0.559743328 172.31.24.227 -> 172.31.31.144 OpenFlow 189 Type: OFPT_PACKET_IN
263 0.559855671 172.31.24.227 -> 172.31.31.144 TCP 66 39474 → 6633 [ACK] Seq=493 Ack=243 Win=213 Len=0 TSval=118966326 TSecr=405716
264 0.559933636 172.31.31.144 -> 172.31.24.227 OpenFlow 187 Type: OFPT_PACKET_OUT
265 0.559960313 172.31.31.144 -> 172.31.24.227 TCP 66 6633 → 39446 [ACK] Seq=1 Ack=1108 Win=853 Len=0 TSval=405716 TSecr=118966326
266 0.559969161 172.31.24.227 -> 172.31.31.144 OpenFlow 189 Type: OFPT_PACKET_IN
267 0.559988978 172.31.24.227 -> 172.31.31.144 OpenFlow 189 Type: OFPT_PACKET_IN
268 0.560014923 172.31.31.144 -> 172.31.24.227 OpenFlow 187 Type: OFPT_PACKET_OUT
269 0.560038472 172.31.31.144 -> 172.31.24.227 TCP 66 6633 → 39446 [ACK] Seq=1 Ack=1231 Win=853 Len=0 TSval=405716 TSecr=118966326
270 0.560052044 172.31.31.144 -> 172.31.24.227 OpenFlow 187 Type: OFPT_PACKET_OUT
271 0.560141841 172.31.31.144 -> 172.31.24.227 OpenFlow 429 Type: OFPT_PACKET_OUT
272 0.560172513 172.31.31.144 -> 172.31.24.227 OpenFlow 187 Type: OFPT_PACKET_OUT
273 0.560199974 172.31.31.144 -> 172.31.24.227 TCP 66 6633 → 39488 [ACK] Seq=969 Ack=124 Win=853 Len=0 TSval=405716 TSecr=118966326
274 0.560229564 172.31.31.144 -> 172.31.24.227 TCP 66 6633 → 39488 [ACK] Seq=969 Ack=247 Win=853 Len=0 TSval=405716 TSecr=118966326
275 0.560237719 172.31.24.227 -> 172.31.31.144 TCP 66 39474 → 6633 [ACK] Seq=493 Ack=1090 Win=212 Len=0 TSval=118966326 TSecr=405716
276 0.560281354 172.31.31.144 -> 172.31.24.227 OpenFlow 187 Type: OFPT_PACKET_OUT
277 0.560347691 172.31.31.144 -> 172.31.24.227 OpenFlow 187 Type: OFPT_PACKET_OUT
278 0.560516983 172.31.31.144 -> 172.31.24.227 OpenFlow 187 Type: OFPT_PACKET_OUT
279 0.560598788 172.31.24.227 -> 172.31.31.144 TCP 66 39474 → 6633 [ACK] Seq=493 Ack=1453 Win=213 Len=0 TSval=118966327 TSecr=405716
280 0.560619859 172.31.31.144 -> 172.31.24.227 OpenFlow 187 Type: OFPT_PACKET_OUT
281 0.560720067 172.31.24.227 -> 172.31.31.144 OpenFlow 189 Type: OFPT_PACKET_IN
282 0.560733302 172.31.31.144 -> 172.31.24.227 OpenFlow 187 Type: OFPT_PACKET_OUT
283 0.560741772 172.31.24.227 -> 172.31.31.144 OpenFlow 189 Type: OFPT_PACKET_IN
284 0.560759831 172.31.24.227 -> 172.31.31.144 OpenFlow 435 Type: OFPT_PACKET_IN
285 0.560854576 172.31.24.227 -> 172.31.31.144 OpenFlow 189 Type: OFPT_PACKET_IN
286 0.560874746 172.31.24.227 -> 172.31.31.144 OpenFlow 435 Type: OFPT_PACKET_IN
287 0.560922207 172.31.31.144 -> 172.31.24.227 TCP 66 6633 → 39482 [ACK] Seq=1 Ack=370 Win=853 Len=0 TSval=405717 TSecr=118966327
288 0.560940900 172.31.31.144 -> 172.31.24.227 TCP 66 6633 → 39482 [ACK] Seq=1 Ack=493 Win=853 Len=0 TSval=405717 TSecr=118966327
289 0.560952032 172.31.24.227 -> 172.31.31.144 OpenFlow 189 Type: OFPT_PACKET_IN
290 0.560971717 172.31.31.144 -> 172.31.24.227 TCP 66 6633 → 39482 [ACK] Seq=1 Ack=862 Win=853 Len=0 TSval=405717 TSecr=118966327
291 0.560976180 172.31.24.227 -> 172.31.31.144 OpenFlow 189 Type: OFPT_PACKET_IN
292 0.560980358 172.31.24.227 -> 172.31.31.144 TCP 66 39474 → 6633 [ACK] Seq=493 Ack=1695 Win=213 Len=0 TSval=118966327 TSecr=405717
293 0.561063775 172.31.24.227 -> 172.31.31.144 OpenFlow 189 Type: OFPT_PACKET_IN
294 0.561076517 172.31.31.144 -> 172.31.24.227 TCP 66 6633 → 39446 [ACK] Seq=1 Ack=1354 Win=853 Len=0 TSval=405717 TSecr=118966327
295 0.561109964 172.31.31.144 -> 172.31.24.227 TCP 66 6633 → 39446 [ACK] Seq=1 Ack=1723 Win=853 Len=0 TSval=405717 TSecr=118966327
296 0.561166781 172.31.31.144 -> 172.31.24.227 TCP 66 6633 → 39472 [ACK] Seq=969 Ack=493 Win=853 Len=0 TSval=405717 TSecr=118966327
297 0.561255710 172.31.31.144 -> 172.31.24.227 TCP 66 6633 → 39482 [ACK] Seq=1 Ack=985 Win=853 Len=0 TSval=405717 TSecr=118966327
298 0.596484248 172.31.24.227 -> 172.31.31.144 TCP 66 39460 → 6633 [ACK] Seq=1 Ack=969 Win=82 Len=0 TSval=118966336 TSecr=405716
299 0.656220922 172.31.31.144 -> 172.31.24.227 OpenFlow 187 Type: OFPT_PACKET_OUT
300 0.656246590 172.31.31.144 -> 172.31.24.227 OpenFlow 187 Type: OFPT_PACKET_OUT
301 0.656268989 172.31.31.144 -> 172.31.24.227 OpenFlow 187 Type: OFPT_PACKET_OUT
302 0.656317282 172.31.31.144 -> 172.31.24.227 OpenFlow 187 Type: OFPT_PACKET_OUT
303 0.656373993 172.31.31.144 -> 172.31.24.227 OpenFlow 187 Type: OFPT_PACKET_OUT
304 0.656439889 172.31.31.144 -> 172.31.24.227 OpenFlow 187 Type: OFPT_PACKET_OUT
305 0.656500370 172.31.31.144 -> 172.31.24.227 OpenFlow 187 Type: OFPT_PACKET_OUT
306 0.656509916 172.31.24.227 -> 172.31.31.144 TCP 66 39470 → 6633 [ACK] Seq=739 Ack=848 Win=103 Len=0 TSval=118966351 TSecr=405740
307 0.656575682 172.31.31.144 -> 172.31.24.227 OpenFlow 187 Type: OFPT_PACKET_OUT
308 0.656619914 172.31.31.144 -> 172.31.24.227 OpenFlow 187 Type: OFPT_PACKET_OUT
309 0.656729939 172.31.31.144 -> 172.31.24.227 OpenFlow 187 Type: OFPT_PACKET_OUT
310 0.656882660 172.31.31.144 -> 172.31.24.227 OpenFlow 187 Type: OFPT_PACKET_OUT
311 0.656910096 172.31.31.144 -> 172.31.24.227 OpenFlow 187 Type: OFPT_PACKET_OUT
312 0.656940674 172.31.31.144 -> 172.31.24.227 OpenFlow 187 Type: OFPT_PACKET_OUT
313 0.656963676 172.31.24.227 -> 172.31.31.144 TCP 66 39470 → 6633 [ACK] Seq=739 Ack=1211 Win=103 Len=0 TSval=118966351 TSecr=405740
314 0.657024958 172.31.31.144 -> 172.31.24.227 OpenFlow 187 Type: OFPT_PACKET_OUT
315 0.657059192 172.31.24.227 -> 172.31.31.144 OpenFlow 189 Type: OFPT_PACKET_IN
316 0.657080727 172.31.24.227 -> 172.31.31.144 OpenFlow 189 Type: OFPT_PACKET_IN
317 0.657104201 172.31.31.144 -> 172.31.24.227 OpenFlow 187 Type: OFPT_PACKET_OUT
318 0.657163626 172.31.31.144 -> 172.31.24.227 OpenFlow 187 Type: OFPT_PACKET_OUT
319 0.657203110 172.31.31.144 -> 172.31.24.227 OpenFlow 187 Type: OFPT_PACKET_OUT
320 0.657259663 172.31.31.144 -> 172.31.24.227 TCP 66 6633 → 39476 [ACK] Seq=1 Ack=370 Win=853 Len=0 TSval=405741 TSecr=118966351
321 0.657287060 172.31.31.144 -> 172.31.24.227 TCP 66 6633 → 39476 [ACK] Seq=1 Ack=493 Win=853 Len=0 TSval=405741 TSecr=118966351
322 0.657314075 172.31.31.144 -> 172.31.24.227 OpenFlow 187 Type: OFPT_PACKET_OUT
323 0.657340937 172.31.31.144 -> 172.31.24.227 OpenFlow 187 Type: OFPT_PACKET_OUT
324 0.657407448 172.31.31.144 -> 172.31.24.227 OpenFlow 187 Type: OFPT_PACKET_OUT
325 0.657653283 172.31.24.227 -> 172.31.31.144 TCP 66 39458 → 6633 [ACK] Seq=1723 Ack=1211 Win=98 Len=0 TSval=118966351 TSecr=405741
326 0.657741845 172.31.24.227 -> 172.31.31.144 OpenFlow 189 Type: OFPT_PACKET_IN
327 0.657773933 172.31.24.227 -> 172.31.31.144 OpenFlow 1173 Type: OFPT_PACKET_IN
328 0.657789735 172.31.24.227 -> 172.31.31.144 OpenFlow 189 Type: OFPT_PACKET_IN
329 0.657822761 172.31.24.227 -> 172.31.31.144 OpenFlow 189 Type: OFPT_PACKET_IN
330 0.657888155 172.31.31.144 -> 172.31.24.227 OpenFlow 671 Type: OFPT_PACKET_OUT
331 0.657914867 172.31.31.144 -> 172.31.24.227 OpenFlow 187 Type: OFPT_PACKET_OUT
332 0.657944210 172.31.31.144 -> 172.31.24.227 OpenFlow 187 Type: OFPT_PACKET_OUT
333 0.658005262 172.31.31.144 -> 172.31.24.227 TCP 66 6633 → 39466 [ACK] Seq=2179 Ack=1477 Win=853 Len=0 TSval=405741 TSecr=118966351
334 0.658025380 172.31.24.227 -> 172.31.31.144 OpenFlow 189 Type: OFPT_PACKET_IN
335 0.658033672 172.31.31.144 -> 172.31.24.227 OpenFlow 187 Type: OFPT_PACKET_OUT
336 0.658045835 172.31.24.227 -> 172.31.31.144 OpenFlow 189 Type: OFPT_PACKET_IN
337 0.658072620 172.31.31.144 -> 172.31.24.227 TCP 66 6633 → 39468 [ACK] Seq=1695 Ack=370 Win=853 Len=0 TSval=405741 TSecr=118966351
338 0.658094801 172.31.24.227 -> 172.31.31.144 OpenFlow 189 Type: OFPT_PACKET_IN
339 0.658105612 172.31.31.144 -> 172.31.24.227 TCP 66 6633 → 39468 [ACK] Seq=1695 Ack=493 Win=853 Len=0 TSval=405741 TSecr=118966351
340 0.658111418 172.31.24.227 -> 172.31.31.144 OpenFlow 189 Type: OFPT_PACKET_IN
341 0.658158762 172.31.31.144 -> 172.31.24.227 OpenFlow 187 Type: OFPT_PACKET_OUT
342 0.658163654 172.31.31.144 -> 172.31.24.227 OpenFlow 187 Type: OFPT_PACKET_OUT
343 0.658275773 172.31.31.144 -> 172.31.24.227 TCP 66 6633 → 39450 [ACK] Seq=1 Ack=1231 Win=853 Len=0 TSval=405741 TSecr=118966351
344 0.658304066 172.31.31.144 -> 172.31.24.227 TCP 66 6633 → 39456 [ACK] Seq=1453 Ack=124 Win=853 Len=0 TSval=405741 TSecr=118966351
345 0.658327941 172.31.31.144 -> 172.31.24.227 TCP 187 6633 → 39454 [PSH, ACK] Seq=1 Ack=1 Win=853 Len=121 TSval=405741 TSecr=118966036
346 0.658354360 172.31.31.144 -> 172.31.24.227 TCP 66 6633 → 39456 [ACK] Seq=1453 Ack=247 Win=853 Len=0 TSval=405741 TSecr=118966351
347 0.658396593 172.31.31.144 -> 172.31.24.227 TCP 187 6633 → 39454 [PSH, ACK] Seq=122 Ack=1 Win=853 Len=121 TSval=405741 TSecr=118966036
348 0.658479044 172.31.31.144 -> 172.31.24.227 TCP 187 6633 → 39454 [PSH, ACK] Seq=243 Ack=1 Win=853 Len=121 TSval=405741 TSecr=118966036
349 0.658562999 172.31.24.227 -> 172.31.31.144 TCP 66 39458 → 6633 [ACK] Seq=1723 Ack=2421 Win=103 Len=0 TSval=118966351 TSecr=405741
350 0.658626706 172.31.24.227 -> 172.31.31.144 OpenFlow 189 Type: OFPT_PACKET_IN
351 0.658650662 172.31.24.227 -> 172.31.31.144 OpenFlow 435 Type: OFPT_PACKET_IN
352 0.658726249 172.31.24.227 -> 172.31.31.144 OpenFlow 189 Type: OFPT_PACKET_IN
353 0.658746253 172.31.24.227 -> 172.31.31.144 OpenFlow 189 Type: OFPT_PACKET_IN
354 0.658771892 172.31.31.144 -> 172.31.24.227 TCP 187 6633 → 39454 [PSH, ACK] Seq=364 Ack=1 Win=853 Len=121 TSval=405741 TSecr=118966036
355 0.658843092 172.31.24.227 -> 172.31.31.144 OpenFlow 189 Type: OFPT_PACKET_IN
356 0.658864650 172.31.31.144 -> 172.31.24.227 TCP 66 6633 → 39460 [ACK] Seq=969 Ack=124 Win=853 Len=0 TSval=405741 TSecr=118966351
357 0.658871358 172.31.24.227 -> 172.31.31.144 OpenFlow 435 Type: OFPT_PACKET_IN
358 0.658891200 172.31.31.144 -> 172.31.24.227 TCP 66 6633 → 39460 [ACK] Seq=969 Ack=493 Win=853 Len=0 TSval=405741 TSecr=118966351
359 0.658921173 172.31.31.144 -> 172.31.24.227 TCP 66 6633 → 39490 [ACK] Seq=1211 Ack=124 Win=853 Len=0 TSval=405741 TSecr=118966351
