  1 0.000000000 172.31.31.144 -> 172.31.23.72 TCP 122 6633 → 33670 [PSH, ACK] Seq=1 Ack=1 Win=853 Len=56 TSval=1282805 TSecr=26121362
  2 0.000020312 172.31.31.144 -> 172.31.23.72 TCP 106 6633 → 33670 [PSH, ACK] Seq=57 Ack=1 Win=853 Len=40 TSval=1282805 TSecr=26121362
  3 0.000264636 172.31.23.72 -> 172.31.31.144 OpenFlow 2426 Type: OFPT_MULTIPART_REPLY, OFPMP_FLOW
  4 0.000425607 172.31.23.72 -> 172.31.31.144 OpenFlow 6178 Type: OFPT_MULTIPART_REPLY, OFPMP_TABLE
  5 0.000516585 172.31.23.72 -> 172.31.31.144 OpenFlow 642 Type: OFPT_MULTIPART_REPLY, OFPMP_PORT_STATS
  6 0.000741646 172.31.31.144 -> 172.31.23.72 TCP 66 6633 → 33670 [ACK] Seq=97 Ack=8473 Win=853 Len=0 TSval=1282805 TSecr=26121906
  7 0.038195981 172.31.31.144 -> 172.31.23.72 TCP 66 6633 → 33670 [ACK] Seq=97 Ack=9049 Win=853 Len=0 TSval=1282815 TSecr=26121906
  8 0.061176496 172.31.31.144 -> 172.31.23.72 TCP 122 6633 → 33672 [PSH, ACK] Seq=1 Ack=1 Win=853 Len=56 TSval=1282820 TSecr=26121412
  9 0.061192404 172.31.31.144 -> 172.31.23.72 TCP 106 6633 → 33672 [PSH, ACK] Seq=57 Ack=1 Win=853 Len=40 TSval=1282820 TSecr=26121412
 10 0.061417058 172.31.23.72 -> 172.31.31.144 OpenFlow 1178 Type: OFPT_MULTIPART_REPLY, OFPMP_FLOW
 11 0.061586450 172.31.23.72 -> 172.31.31.144 OpenFlow 6178 Type: OFPT_MULTIPART_REPLY, OFPMP_TABLE
 12 0.061687401 172.31.23.72 -> 172.31.31.144 OpenFlow 642 Type: OFPT_MULTIPART_REPLY, OFPMP_PORT_STATS
 13 0.061904486 172.31.31.144 -> 172.31.23.72 TCP 66 6633 → 33672 [ACK] Seq=97 Ack=7225 Win=853 Len=0 TSval=1282820 TSecr=26121921
 14 0.064311872 172.31.31.144 -> 172.31.23.72 TCP 122 6633 → 33674 [PSH, ACK] Seq=1 Ack=1 Win=853 Len=56 TSval=1282821 TSecr=26121412
 15 0.064322336 172.31.31.144 -> 172.31.23.72 TCP 106 6633 → 33674 [PSH, ACK] Seq=57 Ack=1 Win=853 Len=40 TSval=1282821 TSecr=26121412
 16 0.064516294 172.31.23.72 -> 172.31.31.144 OpenFlow 2842 Type: OFPT_MULTIPART_REPLY, OFPMP_FLOW
 17 0.064617435 172.31.23.72 -> 172.31.31.144 OpenFlow 642 Type: OFPT_MULTIPART_REPLY, OFPMP_PORT_STATS
 18 0.064755944 172.31.23.72 -> 172.31.31.144 OpenFlow 6178 Type: OFPT_MULTIPART_REPLY, OFPMP_TABLE
 19 0.064937356 172.31.31.144 -> 172.31.23.72 TCP 66 6633 → 33674 [ACK] Seq=97 Ack=3353 Win=853 Len=0 TSval=1282821 TSecr=26121922
 20 0.082485998 172.31.31.144 -> 172.31.23.72 TCP 82 6633 → 33676 [PSH, ACK] Seq=1 Ack=1 Win=853 Len=16 TSval=1282826 TSecr=26121412
 21 0.082497511 172.31.31.144 -> 172.31.23.72 TCP 146 6633 → 33676 [PSH, ACK] Seq=17 Ack=1 Win=853 Len=80 TSval=1282826 TSecr=26121412
 22 0.082742952 172.31.23.72 -> 172.31.31.144 OpenFlow 6178 Type: OFPT_MULTIPART_REPLY, OFPMP_TABLE
 23 0.082819962 172.31.23.72 -> 172.31.31.144 OpenFlow 530 Type: OFPT_MULTIPART_REPLY, OFPMP_PORT_STATS
 24 0.082879690 172.31.23.72 -> 172.31.31.144 OpenFlow 2010 Type: OFPT_MULTIPART_REPLY, OFPMP_FLOW
 25 0.083107073 172.31.31.144 -> 172.31.23.72 TCP 66 6633 → 33676 [ACK] Seq=97 Ack=6577 Win=853 Len=0 TSval=1282826 TSecr=26121927
 26 0.098218918 172.31.31.144 -> 172.31.23.72 TCP 66 6633 → 33672 [ACK] Seq=97 Ack=7801 Win=853 Len=0 TSval=1282830 TSecr=26121921
 27 0.102220717 172.31.31.144 -> 172.31.23.72 TCP 66 6633 → 33674 [ACK] Seq=97 Ack=9465 Win=853 Len=0 TSval=1282831 TSecr=26121922
 28 0.122238700 172.31.31.144 -> 172.31.23.72 TCP 66 6633 → 33676 [ACK] Seq=97 Ack=8521 Win=853 Len=0 TSval=1282836 TSecr=26121927
 29 0.323567198 172.31.31.144 -> 172.31.23.72 TCP 187 6633 → 33668 [PSH, ACK] Seq=1 Ack=1 Win=853 Len=121 TSval=1282886 TSecr=26121881
 30 0.323595901 172.31.31.144 -> 172.31.23.72 TCP 187 6633 → 33668 [PSH, ACK] Seq=122 Ack=1 Win=853 Len=121 TSval=1282886 TSecr=26121881
 31 0.323618288 172.31.31.144 -> 172.31.23.72 TCP 308 6633 → 33668 [PSH, ACK] Seq=243 Ack=1 Win=853 Len=242 TSval=1282886 TSecr=26121881
 32 0.323621539 172.31.31.144 -> 172.31.23.72 TCP 187 6633 → 33668 [PSH, ACK] Seq=485 Ack=1 Win=853 Len=121 TSval=1282886 TSecr=26121881
 33 0.323623487 172.31.31.144 -> 172.31.23.72 TCP 187 6633 → 33668 [PSH, ACK] Seq=606 Ack=1 Win=853 Len=121 TSval=1282886 TSecr=26121881
 34 0.323681553 172.31.31.144 -> 172.31.23.72 TCP 187 6633 → 33668 [PSH, ACK] Seq=727 Ack=1 Win=853 Len=121 TSval=1282886 TSecr=26121881
 35 0.323732495 172.31.31.144 -> 172.31.23.72 TCP 187 6633 → 33668 [PSH, ACK] Seq=848 Ack=1 Win=853 Len=121 TSval=1282886 TSecr=26121881
 36 0.324087680 172.31.23.72 -> 172.31.31.144 TCP 66 33668 → 6633 [ACK] Seq=1 Ack=969 Win=213 Len=0 TSval=26121987 TSecr=1282886
 37 0.324221542 172.31.23.72 -> 172.31.31.144 OpenFlow 189 Type: OFPT_PACKET_IN
 38 0.324249281 172.31.23.72 -> 172.31.31.144 OpenFlow 189 Type: OFPT_PACKET_IN
 39 0.324309846 172.31.23.72 -> 172.31.31.144 OpenFlow 189 Type: OFPT_PACKET_IN
 40 0.324333639 172.31.23.72 -> 172.31.31.144 OpenFlow 189 Type: OFPT_PACKET_IN
 41 0.324342361 172.31.23.72 -> 172.31.31.144 OpenFlow 189 Type: OFPT_PACKET_IN
 42 0.324385369 172.31.23.72 -> 172.31.31.144 OpenFlow 189 Type: OFPT_PACKET_IN
 43 0.324474027 172.31.31.144 -> 172.31.23.72 TCP 66 6633 → 33666 [ACK] Seq=1 Ack=124 Win=853 Len=0 TSval=1282886 TSecr=26121987
 44 0.324492508 172.31.31.144 -> 172.31.23.72 TCP 66 6633 → 33666 [ACK] Seq=1 Ack=247 Win=853 Len=0 TSval=1282886 TSecr=26121987
 45 0.324546631 172.31.31.144 -> 172.31.23.72 TCP 66 6633 → 33670 [ACK] Seq=97 Ack=9172 Win=853 Len=0 TSval=1282886 TSecr=26121987
 46 0.324569189 172.31.31.144 -> 172.31.23.72 TCP 66 6633 → 33670 [ACK] Seq=97 Ack=9295 Win=853 Len=0 TSval=1282886 TSecr=26121987
 47 0.324599435 172.31.31.144 -> 172.31.23.72 TCP 66 6633 → 33658 [ACK] Seq=1 Ack=124 Win=853 Len=0 TSval=1282886 TSecr=26121987
 48 0.324621098 172.31.31.144 -> 172.31.23.72 TCP 66 6633 → 33658 [ACK] Seq=1 Ack=247 Win=853 Len=0 TSval=1282886 TSecr=26121987
 49 0.423134800 172.31.31.144 -> 172.31.23.72 TCP 187 6633 → 33656 [PSH, ACK] Seq=1 Ack=1 Win=853 Len=121 TSval=1282911 TSecr=26121800
 50 0.423165607 172.31.31.144 -> 172.31.23.72 TCP 187 6633 → 33656 [PSH, ACK] Seq=122 Ack=1 Win=853 Len=121 TSval=1282911 TSecr=26121800
 51 0.423169889 172.31.31.144 -> 172.31.23.72 TCP 187 6633 → 33656 [PSH, ACK] Seq=243 Ack=1 Win=853 Len=121 TSval=1282911 TSecr=26121800
 52 0.423179115 172.31.31.144 -> 172.31.23.72 TCP 187 6633 → 33656 [PSH, ACK] Seq=364 Ack=1 Win=853 Len=121 TSval=1282911 TSecr=26121800
 53 0.423194208 172.31.31.144 -> 172.31.23.72 TCP 187 6633 → 33656 [PSH, ACK] Seq=485 Ack=1 Win=853 Len=121 TSval=1282911 TSecr=26121800
 54 0.423245853 172.31.31.144 -> 172.31.23.72 TCP 187 6633 → 33656 [PSH, ACK] Seq=606 Ack=1 Win=853 Len=121 TSval=1282911 TSecr=26121800
 55 0.423317340 172.31.31.144 -> 172.31.23.72 TCP 187 6633 → 33652 [PSH, ACK] Seq=1 Ack=1 Win=853 Len=121 TSval=1282911 TSecr=26121778
 56 0.423392671 172.31.31.144 -> 172.31.23.72 TCP 187 6633 → 33652 [PSH, ACK] Seq=122 Ack=1 Win=853 Len=121 TSval=1282911 TSecr=26121778
 57 0.423421947 172.31.31.144 -> 172.31.23.72 TCP 187 6633 → 33652 [PSH, ACK] Seq=243 Ack=1 Win=853 Len=121 TSval=1282911 TSecr=26121778
 58 0.423483105 172.31.31.144 -> 172.31.23.72 TCP 187 6633 → 33652 [PSH, ACK] Seq=364 Ack=1 Win=853 Len=121 TSval=1282911 TSecr=26121778
 59 0.423530318 172.31.31.144 -> 172.31.23.72 TCP 187 6633 → 33652 [PSH, ACK] Seq=485 Ack=1 Win=853 Len=121 TSval=1282911 TSecr=26121778
 60 0.423587599 172.31.31.144 -> 172.31.23.72 TCP 187 6633 → 33652 [PSH, ACK] Seq=606 Ack=1 Win=853 Len=121 TSval=1282911 TSecr=26121778
 61 0.423637767 172.31.31.144 -> 172.31.23.72 TCP 187 6633 → 33652 [PSH, ACK] Seq=727 Ack=1 Win=853 Len=121 TSval=1282911 TSecr=26121778
 62 0.423704818 172.31.31.144 -> 172.31.23.72 TCP 187 6633 → 33652 [PSH, ACK] Seq=848 Ack=1 Win=853 Len=121 TSval=1282911 TSecr=26121778
 63 0.423724765 172.31.23.72 -> 172.31.31.144 TCP 66 33656 → 6633 [ACK] Seq=1 Ack=727 Win=213 Len=0 TSval=26122012 TSecr=1282911
 64 0.423792012 172.31.31.144 -> 172.31.23.72 TCP 187 6633 → 33636 [PSH, ACK] Seq=1 Ack=1 Win=853 Len=121 TSval=1282911 TSecr=26121686
 65 0.423815990 172.31.31.144 -> 172.31.23.72 TCP 187 6633 → 33636 [PSH, ACK] Seq=122 Ack=1 Win=853 Len=121 TSval=1282911 TSecr=26121686
 66 0.423875004 172.31.31.144 -> 172.31.23.72 TCP 187 6633 → 33636 [PSH, ACK] Seq=243 Ack=1 Win=853 Len=121 TSval=1282911 TSecr=26121686
 67 0.423930045 172.31.31.144 -> 172.31.23.72 TCP 187 6633 → 33636 [PSH, ACK] Seq=364 Ack=1 Win=853 Len=121 TSval=1282911 TSecr=26121686
 68 0.424000228 172.31.31.144 -> 172.31.23.72 TCP 187 6633 → 33636 [PSH, ACK] Seq=485 Ack=1 Win=853 Len=121 TSval=1282911 TSecr=26121686
 69 0.424054013 172.31.31.144 -> 172.31.23.72 TCP 187 6633 → 33636 [PSH, ACK] Seq=606 Ack=1 Win=853 Len=121 TSval=1282911 TSecr=26121686
 70 0.424109653 172.31.31.144 -> 172.31.23.72 TCP 187 6633 → 33636 [PSH, ACK] Seq=727 Ack=1 Win=853 Len=121 TSval=1282911 TSecr=26121686
 71 0.424167232 172.31.31.144 -> 172.31.23.72 TCP 187 6633 → 33636 [PSH, ACK] Seq=848 Ack=1 Win=853 Len=121 TSval=1282911 TSecr=26121686
 72 0.424183424 172.31.23.72 -> 172.31.31.144 TCP 66 33652 → 6633 [ACK] Seq=1 Ack=969 Win=213 Len=0 TSval=26122012 TSecr=1282911
 73 0.424236787 172.31.31.144 -> 172.31.23.72 TCP 187 6633 → 33650 [PSH, ACK] Seq=1 Ack=1 Win=853 Len=121 TSval=1282911 TSecr=26121767
 74 0.424288794 172.31.31.144 -> 172.31.23.72 TCP 187 6633 → 33650 [PSH, ACK] Seq=122 Ack=1 Win=853 Len=121 TSval=1282911 TSecr=26121767
 75 0.424344985 172.31.31.144 -> 172.31.23.72 TCP 187 6633 → 33650 [PSH, ACK] Seq=243 Ack=1 Win=853 Len=121 TSval=1282911 TSecr=26121767
 76 0.424393700 172.31.31.144 -> 172.31.23.72 TCP 187 6633 → 33650 [PSH, ACK] Seq=364 Ack=1 Win=853 Len=121 TSval=1282911 TSecr=26121767
 77 0.424454782 172.31.31.144 -> 172.31.23.72 TCP 187 6633 → 33650 [PSH, ACK] Seq=485 Ack=1 Win=853 Len=121 TSval=1282911 TSecr=26121767
 78 0.424505440 172.31.31.144 -> 172.31.23.72 TCP 187 6633 → 33650 [PSH, ACK] Seq=606 Ack=1 Win=853 Len=121 TSval=1282911 TSecr=26121767
 79 0.424562788 172.31.31.144 -> 172.31.23.72 TCP 187 6633 → 33650 [PSH, ACK] Seq=727 Ack=1 Win=853 Len=121 TSval=1282911 TSecr=26121767
 80 0.424571012 172.31.23.72 -> 172.31.31.144 TCP 66 33636 → 6633 [ACK] Seq=1 Ack=969 Win=213 Len=0 TSval=26122012 TSecr=1282911
 81 0.424630326 172.31.31.144 -> 172.31.23.72 TCP 187 6633 → 33650 [PSH, ACK] Seq=848 Ack=1 Win=853 Len=121 TSval=1282911 TSecr=26121767
 82 0.424662922 172.31.23.72 -> 172.31.31.144 OpenFlow 189 Type: OFPT_PACKET_IN
 83 0.424681863 172.31.31.144 -> 172.31.23.72 OpenFlow 187 Type: OFPT_PACKET_OUT
 84 0.424687329 172.31.23.72 -> 172.31.31.144 OpenFlow 189 Type: OFPT_PACKET_IN
 85 0.424769545 172.31.31.144 -> 172.31.23.72 OpenFlow 187 Type: OFPT_PACKET_OUT
 86 0.424819489 172.31.31.144 -> 172.31.23.72 TCP 187 6633 → 33640 [PSH, ACK] Seq=1 Ack=1 Win=853 Len=121 TSval=1282911 TSecr=26121705
 87 0.424845151 172.31.31.144 -> 172.31.23.72 TCP 187 6633 → 33640 [PSH, ACK] Seq=122 Ack=1 Win=853 Len=121 TSval=1282911 TSecr=26121705
 88 0.424883399 172.31.31.144 -> 172.31.23.72 TCP 66 6633 → 33650 [ACK] Seq=1211 Ack=124 Win=853 Len=0 TSval=1282911 TSecr=26122012
 89 0.424914649 172.31.31.144 -> 172.31.23.72 TCP 66 6633 → 33650 [ACK] Seq=1211 Ack=247 Win=853 Len=0 TSval=1282911 TSecr=26122012
 90 0.424918447 172.31.31.144 -> 172.31.23.72 TCP 187 6633 → 33640 [PSH, ACK] Seq=243 Ack=1 Win=853 Len=121 TSval=1282911 TSecr=26121705
 91 0.424979536 172.31.31.144 -> 172.31.23.72 TCP 187 6633 → 33640 [PSH, ACK] Seq=364 Ack=1 Win=853 Len=121 TSval=1282911 TSecr=26121705
 92 0.425039440 172.31.31.144 -> 172.31.23.72 TCP 187 6633 → 33640 [PSH, ACK] Seq=485 Ack=1 Win=853 Len=121 TSval=1282911 TSecr=26121705
 93 0.425083788 172.31.31.144 -> 172.31.23.72 TCP 187 6633 → 33640 [PSH, ACK] Seq=606 Ack=1 Win=853 Len=121 TSval=1282911 TSecr=26121705
 94 0.425144002 172.31.31.144 -> 172.31.23.72 TCP 187 6633 → 33640 [PSH, ACK] Seq=727 Ack=1 Win=853 Len=121 TSval=1282911 TSecr=26121705
 95 0.425200177 172.31.31.144 -> 172.31.23.72 TCP 187 6633 → 33640 [PSH, ACK] Seq=848 Ack=1 Win=853 Len=121 TSval=1282911 TSecr=26121705
 96 0.425246687 172.31.23.72 -> 172.31.31.144 OpenFlow 189 Type: OFPT_PACKET_IN
 97 0.425257758 172.31.31.144 -> 172.31.23.72 OpenFlow 187 Type: OFPT_PACKET_OUT
 98 0.425269750 172.31.23.72 -> 172.31.31.144 OpenFlow 189 Type: OFPT_PACKET_IN
 99 0.425313869 172.31.31.144 -> 172.31.23.72 OpenFlow 187 Type: OFPT_PACKET_OUT
100 0.425403823 172.31.31.144 -> 172.31.23.72 TCP 187 6633 → 33634 [PSH, ACK] Seq=1 Ack=1 Win=853 Len=121 TSval=1282911 TSecr=26121676
101 0.425429903 172.31.31.144 -> 172.31.23.72 TCP 187 6633 → 33634 [PSH, ACK] Seq=122 Ack=1 Win=853 Len=121 TSval=1282911 TSecr=26121676
102 0.425483341 172.31.31.144 -> 172.31.23.72 TCP 66 6633 → 33640 [ACK] Seq=1211 Ack=124 Win=853 Len=0 TSval=1282911 TSecr=26122012
103 0.425488559 172.31.31.144 -> 172.31.23.72 TCP 66 6633 → 33640 [ACK] Seq=1211 Ack=247 Win=853 Len=0 TSval=1282911 TSecr=26122012
104 0.425511807 172.31.31.144 -> 172.31.23.72 TCP 187 6633 → 33634 [PSH, ACK] Seq=243 Ack=1 Win=853 Len=121 TSval=1282911 TSecr=26121676
105 0.425560691 172.31.31.144 -> 172.31.23.72 TCP 187 6633 → 33634 [PSH, ACK] Seq=364 Ack=1 Win=853 Len=121 TSval=1282911 TSecr=26121676
106 0.425611204 172.31.31.144 -> 172.31.23.72 TCP 187 6633 → 33634 [PSH, ACK] Seq=485 Ack=1 Win=853 Len=121 TSval=1282911 TSecr=26121676
107 0.425672281 172.31.31.144 -> 172.31.23.72 TCP 187 6633 → 33634 [PSH, ACK] Seq=606 Ack=1 Win=853 Len=121 TSval=1282911 TSecr=26121676
108 0.425736704 172.31.31.144 -> 172.31.23.72 TCP 187 6633 → 33634 [PSH, ACK] Seq=727 Ack=1 Win=853 Len=121 TSval=1282911 TSecr=26121676
109 0.425811618 172.31.31.144 -> 172.31.23.72 TCP 187 6633 → 33634 [PSH, ACK] Seq=848 Ack=1 Win=853 Len=121 TSval=1282911 TSecr=26121676
110 0.425816079 172.31.23.72 -> 172.31.31.144 OpenFlow 189 Type: OFPT_PACKET_IN
111 0.425839628 172.31.23.72 -> 172.31.31.144 OpenFlow 189 Type: OFPT_PACKET_IN
112 0.425879578 172.31.31.144 -> 172.31.23.72 OpenFlow 187 Type: OFPT_PACKET_OUT
113 0.425906838 172.31.31.144 -> 172.31.23.72 OpenFlow 187 Type: OFPT_PACKET_OUT
114 0.425979713 172.31.31.144 -> 172.31.23.72 TCP 187 6633 → 33660 [PSH, ACK] Seq=1 Ack=1 Win=853 Len=121 TSval=1282911 TSecr=26121827
115 0.426028330 172.31.31.144 -> 172.31.23.72 TCP 187 6633 → 33660 [PSH, ACK] Seq=122 Ack=1 Win=853 Len=121 TSval=1282911 TSecr=26121827
116 0.426058676 172.31.31.144 -> 172.31.23.72 TCP 66 6633 → 33634 [ACK] Seq=1211 Ack=124 Win=853 Len=0 TSval=1282911 TSecr=26122012
117 0.426077846 172.31.31.144 -> 172.31.23.72 TCP 66 6633 → 33634 [ACK] Seq=1211 Ack=247 Win=853 Len=0 TSval=1282911 TSecr=26122012
118 0.426097183 172.31.31.144 -> 172.31.23.72 TCP 187 6633 → 33660 [PSH, ACK] Seq=243 Ack=1 Win=853 Len=121 TSval=1282911 TSecr=26121827
119 0.426163100 172.31.31.144 -> 172.31.23.72 TCP 187 6633 → 33660 [PSH, ACK] Seq=364 Ack=1 Win=853 Len=121 TSval=1282912 TSecr=26121827
120 0.426257889 172.31.23.72 -> 172.31.31.144 TCP 66 33634 → 6633 [ACK] Seq=247 Ack=1211 Win=213 Len=0 TSval=26122013 TSecr=1282911
121 0.426325426 172.31.31.144 -> 172.31.23.72 TCP 187 6633 → 33660 [PSH, ACK] Seq=485 Ack=1 Win=853 Len=121 TSval=1282912 TSecr=26121827
122 0.426338273 172.31.23.72 -> 172.31.31.144 OpenFlow 189 Type: OFPT_PACKET_IN
123 0.426357384 172.31.23.72 -> 172.31.31.144 OpenFlow 189 Type: OFPT_PACKET_IN
124 0.426388493 172.31.31.144 -> 172.31.23.72 OpenFlow 187 Type: OFPT_PACKET_OUT
125 0.426430486 172.31.31.144 -> 172.31.23.72 OpenFlow 187 Type: OFPT_PACKET_OUT
126 0.426485663 172.31.31.144 -> 172.31.23.72 OpenFlow 187 Type: OFPT_PACKET_OUT
127 0.426553187 172.31.31.144 -> 172.31.23.72 OpenFlow 187 Type: OFPT_PACKET_OUT
128 0.426569856 172.31.31.144 -> 172.31.23.72 TCP 66 6633 → 33660 [ACK] Seq=1090 Ack=124 Win=853 Len=0 TSval=1282912 TSecr=26122013
129 0.426589045 172.31.31.144 -> 172.31.23.72 TCP 66 6633 → 33660 [ACK] Seq=1090 Ack=247 Win=853 Len=0 TSval=1282912 TSecr=26122013
130 0.426678671 172.31.31.144 -> 172.31.23.72 TCP 187 6633 → 33654 [PSH, ACK] Seq=1 Ack=1 Win=853 Len=121 TSval=1282912 TSecr=26121789
131 0.426726330 172.31.31.144 -> 172.31.23.72 TCP 187 6633 → 33654 [PSH, ACK] Seq=122 Ack=1 Win=853 Len=121 TSval=1282912 TSecr=26121789
132 0.426782470 172.31.31.144 -> 172.31.23.72 TCP 187 6633 → 33654 [PSH, ACK] Seq=243 Ack=1 Win=853 Len=121 TSval=1282912 TSecr=26121789
133 0.426793756 172.31.23.72 -> 172.31.31.144 TCP 66 33660 → 6633 [ACK] Seq=247 Ack=1090 Win=213 Len=0 TSval=26122013 TSecr=1282912
134 0.426835387 172.31.31.144 -> 172.31.23.72 OpenFlow 187 Type: OFPT_PACKET_OUT
135 0.426847932 172.31.31.144 -> 172.31.23.72 TCP 187 6633 → 33654 [PSH, ACK] Seq=364 Ack=1 Win=853 Len=121 TSval=1282912 TSecr=26121789
136 0.426897061 172.31.31.144 -> 172.31.23.72 TCP 187 6633 → 33654 [PSH, ACK] Seq=485 Ack=1 Win=853 Len=121 TSval=1282912 TSecr=26121789
137 0.426928572 172.31.23.72 -> 172.31.31.144 OpenFlow 189 Type: OFPT_PACKET_IN
138 0.426948060 172.31.23.72 -> 172.31.31.144 OpenFlow 435 Type: OFPT_PACKET_IN
139 0.426979277 172.31.31.144 -> 172.31.23.72 OpenFlow 187 Type: OFPT_PACKET_OUT
140 0.427033908 172.31.31.144 -> 172.31.23.72 OpenFlow 187 Type: OFPT_PACKET_OUT
141 0.427063577 172.31.31.144 -> 172.31.23.72 OpenFlow 187 Type: OFPT_PACKET_OUT
142 0.427148229 172.31.31.144 -> 172.31.23.72 TCP 66 6633 → 33654 [ACK] Seq=969 Ack=124 Win=853 Len=0 TSval=1282912 TSecr=26122013
143 0.427166247 172.31.31.144 -> 172.31.23.72 TCP 66 6633 → 33654 [ACK] Seq=969 Ack=493 Win=853 Len=0 TSval=1282912 TSecr=26122013
144 0.427185822 172.31.31.144 -> 172.31.23.72 OpenFlow 187 Type: OFPT_PACKET_OUT
145 0.427204616 172.31.31.144 -> 172.31.23.72 OpenFlow 187 Type: OFPT_PACKET_OUT
146 0.427253039 172.31.31.144 -> 172.31.23.72 OpenFlow 187 Type: OFPT_PACKET_OUT
147 0.427307287 172.31.31.144 -> 172.31.23.72 OpenFlow 187 Type: OFPT_PACKET_OUT
148 0.427337683 172.31.23.72 -> 172.31.31.144 TCP 66 33654 → 6633 [ACK] Seq=493 Ack=969 Win=213 Len=0 TSval=26122013 TSecr=1282912
149 0.427378663 172.31.31.144 -> 172.31.23.72 OpenFlow 187 Type: OFPT_PACKET_OUT
150 0.427413025 172.31.31.144 -> 172.31.23.72 OpenFlow 187 Type: OFPT_PACKET_OUT
151 0.427422119 172.31.23.72 -> 172.31.31.144 OpenFlow 189 Type: OFPT_PACKET_IN
152 0.427442194 172.31.23.72 -> 172.31.31.144 OpenFlow 189 Type: OFPT_PACKET_IN
153 0.427484941 172.31.31.144 -> 172.31.23.72 TCP 187 6633 → 33646 [PSH, ACK] Seq=1 Ack=1 Win=853 Len=121 TSval=1282912 TSecr=26121747
154 0.427540866 172.31.31.144 -> 172.31.23.72 TCP 187 6633 → 33646 [PSH, ACK] Seq=122 Ack=1 Win=853 Len=121 TSval=1282912 TSecr=26121747
155 0.427595638 172.31.31.144 -> 172.31.23.72 TCP 187 6633 → 33646 [PSH, ACK] Seq=243 Ack=1 Win=853 Len=121 TSval=1282912 TSecr=26121747
156 0.427655430 172.31.31.144 -> 172.31.23.72 TCP 66 6633 → 33666 [ACK] Seq=727 Ack=493 Win=853 Len=0 TSval=1282912 TSecr=26122013
157 0.427673808 172.31.31.144 -> 172.31.23.72 TCP 187 6633 → 33646 [PSH, ACK] Seq=364 Ack=1 Win=853 Len=121 TSval=1282912 TSecr=26121747
158 0.427702973 172.31.31.144 -> 172.31.23.72 TCP 187 6633 → 33646 [PSH, ACK] Seq=485 Ack=1 Win=853 Len=121 TSval=1282912 TSecr=26121747
159 0.427706910 172.31.23.72 -> 172.31.31.144 OpenFlow 189 Type: OFPT_PACKET_IN
160 0.427727147 172.31.23.72 -> 172.31.31.144 OpenFlow 558 Type: OFPT_PACKET_IN
161 0.427750953 172.31.23.72 -> 172.31.31.144 OpenFlow 189 Type: OFPT_PACKET_IN
162 0.427809146 172.31.31.144 -> 172.31.23.72 OpenFlow 187 Type: OFPT_PACKET_OUT
163 0.427856683 172.31.31.144 -> 172.31.23.72 OpenFlow 187 Type: OFPT_PACKET_OUT
164 0.427905699 172.31.31.144 -> 172.31.23.72 TCP 66 6633 → 33646 [ACK] Seq=848 Ack=124 Win=853 Len=0 TSval=1282912 TSecr=26122013
165 0.427923963 172.31.31.144 -> 172.31.23.72 OpenFlow 187 Type: OFPT_PACKET_OUT
166 0.428076120 172.31.31.144 -> 172.31.23.72 OpenFlow 187 Type: OFPT_PACKET_OUT
167 0.428094563 172.31.31.144 -> 172.31.23.72 TCP 187 6633 → 33644 [PSH, ACK] Seq=1 Ack=1 Win=853 Len=121 TSval=1282912 TSecr=26121726
168 0.428114581 172.31.31.144 -> 172.31.23.72 OpenFlow 187 Type: OFPT_PACKET_OUT
169 0.428133686 172.31.31.144 -> 172.31.23.72 TCP 187 6633 → 33644 [PSH, ACK] Seq=122 Ack=1 Win=853 Len=121 TSval=1282912 TSecr=26121726
170 0.428192062 172.31.31.144 -> 172.31.23.72 TCP 187 6633 → 33644 [PSH, ACK] Seq=243 Ack=1 Win=853 Len=121 TSval=1282912 TSecr=26121726
171 0.428201988 172.31.23.72 -> 172.31.31.144 TCP 66 33646 → 6633 [ACK] Seq=739 Ack=1211 Win=213 Len=0 TSval=26122013 TSecr=1282912
172 0.428255599 172.31.31.144 -> 172.31.23.72 TCP 187 6633 → 33644 [PSH, ACK] Seq=364 Ack=1 Win=853 Len=121 TSval=1282912 TSecr=26121726
173 0.428278385 172.31.23.72 -> 172.31.31.144 OpenFlow 189 Type: OFPT_PACKET_IN
174 0.428297422 172.31.23.72 -> 172.31.31.144 OpenFlow 189 Type: OFPT_PACKET_IN
175 0.428323709 172.31.31.144 -> 172.31.23.72 OpenFlow 187 Type: OFPT_PACKET_OUT
176 0.428366965 172.31.31.144 -> 172.31.23.72 OpenFlow 187 Type: OFPT_PACKET_OUT
177 0.428477190 172.31.31.144 -> 172.31.23.72 TCP 66 6633 → 33644 [ACK] Seq=727 Ack=124 Win=853 Len=0 TSval=1282912 TSecr=26122013
178 0.428494916 172.31.31.144 -> 172.31.23.72 TCP 66 6633 → 33644 [ACK] Seq=727 Ack=247 Win=853 Len=0 TSval=1282912 TSecr=26122013
179 0.428542600 172.31.23.72 -> 172.31.31.144 TCP 66 33644 → 6633 [ACK] Seq=247 Ack=727 Win=213 Len=0 TSval=26122013 TSecr=1282912
180 0.428608044 172.31.23.72 -> 172.31.31.144 OpenFlow 189 Type: OFPT_PACKET_IN
181 0.428630464 172.31.23.72 -> 172.31.31.144 OpenFlow 435 Type: OFPT_PACKET_IN
182 0.428643187 172.31.23.72 -> 172.31.31.144 OpenFlow 189 Type: OFPT_PACKET_IN
183 0.428660697 172.31.23.72 -> 172.31.31.144 OpenFlow 189 Type: OFPT_PACKET_IN
184 0.428691518 172.31.23.72 -> 172.31.31.144 OpenFlow 435 Type: OFPT_PACKET_IN
185 0.428695970 172.31.23.72 -> 172.31.31.144 OpenFlow 927 Type: OFPT_PACKET_IN
186 0.428712113 172.31.23.72 -> 172.31.31.144 OpenFlow 189 Type: OFPT_PACKET_IN
187 0.428729488 172.31.23.72 -> 172.31.31.144 OpenFlow 189 Type: OFPT_PACKET_IN
188 0.428743837 172.31.23.72 -> 172.31.31.144 OpenFlow 189 Type: OFPT_PACKET_IN
189 0.428757671 172.31.23.72 -> 172.31.31.144 OpenFlow 189 Type: OFPT_PACKET_IN
190 0.428762542 172.31.23.72 -> 172.31.31.144 OpenFlow 189 Type: OFPT_PACKET_IN
191 0.428776885 172.31.23.72 -> 172.31.31.144 OpenFlow 189 Type: OFPT_PACKET_IN
192 0.428778917 172.31.23.72 -> 172.31.31.144 OpenFlow 189 Type: OFPT_PACKET_IN
193 0.428796024 172.31.23.72 -> 172.31.31.144 OpenFlow 189 Type: OFPT_PACKET_IN
194 0.428798024 172.31.23.72 -> 172.31.31.144 OpenFlow 189 Type: OFPT_PACKET_IN
195 0.428820182 172.31.23.72 -> 172.31.31.144 OpenFlow 189 Type: OFPT_PACKET_IN
196 0.428825038 172.31.23.72 -> 172.31.31.144 OpenFlow 189 Type: OFPT_PACKET_IN
197 0.428892424 172.31.23.72 -> 172.31.31.144 OpenFlow 435 Type: OFPT_PACKET_IN
198 0.428895074 172.31.23.72 -> 172.31.31.144 OpenFlow 927 Type: OFPT_PACKET_IN
199 0.428926318 172.31.23.72 -> 172.31.31.144 OpenFlow 189 Type: OFPT_PACKET_IN
200 0.428935784 172.31.31.144 -> 172.31.23.72 TCP 66 6633 → 33632 [ACK] Seq=1 Ack=124 Win=853 Len=0 TSval=1282912 TSecr=26122013
201 0.428940937 172.31.31.144 -> 172.31.23.72 TCP 66 6633 → 33632 [ACK] Seq=1 Ack=493 Win=853 Len=0 TSval=1282912 TSecr=26122013
202 0.428942899 172.31.31.144 -> 172.31.23.72 TCP 66 6633 → 33662 [ACK] Seq=1 Ack=124 Win=853 Len=0 TSval=1282912 TSecr=26122013
203 0.428944953 172.31.31.144 -> 172.31.23.72 TCP 66 6633 → 33662 [ACK] Seq=1 Ack=493 Win=853 Len=0 TSval=1282912 TSecr=26122013
204 0.428946511 172.31.31.144 -> 172.31.23.72 TCP 66 6633 → 33648 [ACK] Seq=1 Ack=985 Win=853 Len=0 TSval=1282912 TSecr=26122013
205 0.428965647 172.31.23.72 -> 172.31.31.144 OpenFlow 189 Type: OFPT_PACKET_IN
206 0.428972142 172.31.23.72 -> 172.31.31.144 OpenFlow 435 Type: OFPT_PACKET_IN
207 0.428985322 172.31.23.72 -> 172.31.31.144 OpenFlow 189 Type: OFPT_PACKET_IN
208 0.429006686 172.31.23.72 -> 172.31.31.144 OpenFlow 189 Type: OFPT_PACKET_IN
209 0.429023734 172.31.23.72 -> 172.31.31.144 OpenFlow 189 Type: OFPT_PACKET_IN
210 0.429040867 172.31.23.72 -> 172.31.31.144 OpenFlow 189 Type: OFPT_PACKET_IN
211 0.429083504 172.31.31.144 -> 172.31.23.72 TCP 66 6633 → 33672 [ACK] Seq=97 Ack=7924 Win=853 Len=0 TSval=1282912 TSecr=26122013
212 0.429087393 172.31.31.144 -> 172.31.23.72 TCP 66 6633 → 33670 [ACK] Seq=97 Ack=9418 Win=853 Len=0 TSval=1282912 TSecr=26122013
213 0.429089456 172.31.31.144 -> 172.31.23.72 TCP 66 6633 → 33664 [ACK] Seq=1 Ack=124 Win=853 Len=0 TSval=1282912 TSecr=26122013
214 0.429093745 172.31.23.72 -> 172.31.31.144 OpenFlow 189 Type: OFPT_PACKET_IN
215 0.429099272 172.31.23.72 -> 172.31.31.144 OpenFlow 189 Type: OFPT_PACKET_IN
216 0.429168632 172.31.23.72 -> 172.31.31.144 OpenFlow 927 Type: OFPT_PACKET_IN
217 0.429171064 172.31.23.72 -> 172.31.31.144 OpenFlow 435 Type: OFPT_PACKET_IN
218 0.429172687 172.31.23.72 -> 172.31.31.144 OpenFlow 681 Type: OFPT_PACKET_IN
219 0.429214128 172.31.31.144 -> 172.31.23.72 TCP 66 6633 → 33672 [ACK] Seq=97 Ack=8047 Win=853 Len=0 TSval=1282912 TSecr=26122013
220 0.429218694 172.31.31.144 -> 172.31.23.72 TCP 66 6633 → 33658 [ACK] Seq=1 Ack=370 Win=853 Len=0 TSval=1282912 TSecr=26122013
221 0.429220801 172.31.31.144 -> 172.31.23.72 TCP 66 6633 → 33670 [ACK] Seq=97 Ack=9541 Win=853 Len=0 TSval=1282912 TSecr=26122013
222 0.429222520 172.31.31.144 -> 172.31.23.72 TCP 66 6633 → 33638 [ACK] Seq=1 Ack=124 Win=853 Len=0 TSval=1282912 TSecr=26122013
223 0.429224454 172.31.31.144 -> 172.31.23.72 TCP 66 6633 → 33664 [ACK] Seq=1 Ack=247 Win=853 Len=0 TSval=1282912 TSecr=26122013
224 0.429229156 172.31.23.72 -> 172.31.31.144 OpenFlow 189 Type: OFPT_PACKET_IN
225 0.429316187 172.31.31.144 -> 172.31.23.72 TCP 66 6633 → 33658 [ACK] Seq=1 Ack=739 Win=853 Len=0 TSval=1282912 TSecr=26122013
226 0.429318653 172.31.31.144 -> 172.31.23.72 TCP 66 6633 → 33668 [ACK] Seq=969 Ack=124 Win=853 Len=0 TSval=1282912 TSecr=26122013
227 0.429351671 172.31.31.144 -> 172.31.23.72 TCP 66 6633 → 33656 [ACK] Seq=727 Ack=124 Win=853 Len=0 TSval=1282912 TSecr=26122013
228 0.429371166 172.31.31.144 -> 172.31.23.72 TCP 66 6633 → 33638 [ACK] Seq=1 Ack=493 Win=853 Len=0 TSval=1282912 TSecr=26122013
229 0.429388887 172.31.31.144 -> 172.31.23.72 TCP 66 6633 → 33652 [ACK] Seq=969 Ack=124 Win=853 Len=0 TSval=1282912 TSecr=26122013
230 0.429408550 172.31.31.144 -> 172.31.23.72 TCP 66 6633 → 33636 [ACK] Seq=969 Ack=124 Win=853 Len=0 TSval=1282912 TSecr=26122013
231 0.429427243 172.31.31.144 -> 172.31.23.72 TCP 66 6633 → 33650 [ACK] Seq=1211 Ack=370 Win=853 Len=0 TSval=1282912 TSecr=26122013
232 0.429445044 172.31.31.144 -> 172.31.23.72 TCP 66 6633 → 33630 [ACK] Seq=1 Ack=247 Win=853 Len=0 TSval=1282912 TSecr=26122013
233 0.429463986 172.31.31.144 -> 172.31.23.72 TCP 66 6633 → 33640 [ACK] Seq=1211 Ack=370 Win=853 Len=0 TSval=1282912 TSecr=26122013
234 0.429482869 172.31.31.144 -> 172.31.23.72 TCP 66 6633 → 33668 [ACK] Seq=969 Ack=247 Win=853 Len=0 TSval=1282912 TSecr=26122013
235 0.429512879 172.31.31.144 -> 172.31.23.72 TCP 66 6633 → 33656 [ACK] Seq=727 Ack=247 Win=853 Len=0 TSval=1282912 TSecr=26122013
236 0.429514868 172.31.31.144 -> 172.31.23.72 TCP 66 6633 → 33652 [ACK] Seq=969 Ack=985 Win=853 Len=0 TSval=1282912 TSecr=26122013
237 0.429537809 172.31.31.144 -> 172.31.23.72 TCP 66 6633 → 33636 [ACK] Seq=969 Ack=493 Win=853 Len=0 TSval=1282912 TSecr=26122013
238 0.429557019 172.31.31.144 -> 172.31.23.72 TCP 66 6633 → 33650 [ACK] Seq=1211 Ack=985 Win=853 Len=0 TSval=1282912 TSecr=26122013
239 0.429575932 172.31.31.144 -> 172.31.23.72 TCP 66 6633 → 33640 [ACK] Seq=1211 Ack=493 Win=853 Len=0 TSval=1282912 TSecr=26122013
240 0.429708427 172.31.31.144 -> 172.31.23.72 TCP 66 6633 → 33642 [ACK] Seq=1 Ack=985 Win=853 Len=0 TSval=1282912 TSecr=26122013
241 0.466176418 172.31.23.72 -> 172.31.31.144 TCP 66 33660 → 6633 [ACK] Seq=247 Ack=1211 Win=213 Len=0 TSval=26122023 TSecr=1282912
242 0.523665120 172.31.31.144 -> 172.31.23.72 OpenFlow 187 Type: OFPT_PACKET_OUT
243 0.523691404 172.31.31.144 -> 172.31.23.72 OpenFlow 187 Type: OFPT_PACKET_OUT
244 0.523711754 172.31.31.144 -> 172.31.23.72 OpenFlow 187 Type: OFPT_PACKET_OUT
245 0.523746689 172.31.31.144 -> 172.31.23.72 OpenFlow 187 Type: OFPT_PACKET_OUT
246 0.523802880 172.31.31.144 -> 172.31.23.72 OpenFlow 187 Type: OFPT_PACKET_OUT
247 0.523857231 172.31.31.144 -> 172.31.23.72 OpenFlow 187 Type: OFPT_PACKET_OUT
248 0.523922428 172.31.31.144 -> 172.31.23.72 OpenFlow 187 Type: OFPT_PACKET_OUT
249 0.523978684 172.31.31.144 -> 172.31.23.72 OpenFlow 187 Type: OFPT_PACKET_OUT
250 0.524062745 172.31.31.144 -> 172.31.23.72 OpenFlow 187 Type: OFPT_PACKET_OUT
251 0.524110835 172.31.31.144 -> 172.31.23.72 OpenFlow 187 Type: OFPT_PACKET_OUT
252 0.524173176 172.31.31.144 -> 172.31.23.72 OpenFlow 187 Type: OFPT_PACKET_OUT
253 0.524213509 172.31.31.144 -> 172.31.23.72 OpenFlow 187 Type: OFPT_PACKET_OUT
254 0.524261040 172.31.31.144 -> 172.31.23.72 OpenFlow 187 Type: OFPT_PACKET_OUT
255 0.524318249 172.31.31.144 -> 172.31.23.72 OpenFlow 187 Type: OFPT_PACKET_OUT
256 0.524360188 172.31.23.72 -> 172.31.31.144 TCP 66 33632 → 6633 [ACK] Seq=493 Ack=969 Win=213 Len=0 TSval=26122037 TSecr=1282936
257 0.524377283 172.31.31.144 -> 172.31.23.72 OpenFlow 187 Type: OFPT_PACKET_OUT
258 0.524462126 172.31.31.144 -> 172.31.23.72 OpenFlow 187 Type: OFPT_PACKET_OUT
259 0.524497553 172.31.31.144 -> 172.31.23.72 OpenFlow 187 Type: OFPT_PACKET_OUT
260 0.524543632 172.31.31.144 -> 172.31.23.72 OpenFlow 187 Type: OFPT_PACKET_OUT
261 0.524632856 172.31.31.144 -> 172.31.23.72 OpenFlow 187 Type: OFPT_PACKET_OUT
262 0.524694174 172.31.31.144 -> 172.31.23.72 OpenFlow 187 Type: OFPT_PACKET_OUT
263 0.524749055 172.31.31.144 -> 172.31.23.72 OpenFlow 187 Type: OFPT_PACKET_OUT
264 0.524804192 172.31.31.144 -> 172.31.23.72 OpenFlow 187 Type: OFPT_PACKET_OUT
265 0.524864897 172.31.31.144 -> 172.31.23.72 OpenFlow 187 Type: OFPT_PACKET_OUT
266 0.524904256 172.31.23.72 -> 172.31.31.144 TCP 66 33662 → 6633 [ACK] Seq=493 Ack=1211 Win=213 Len=0 TSval=26122037 TSecr=1282936
267 0.524923262 172.31.31.144 -> 172.31.23.72 OpenFlow 187 Type: OFPT_PACKET_OUT
268 0.524974308 172.31.31.144 -> 172.31.23.72 OpenFlow 187 Type: OFPT_PACKET_OUT
269 0.525031059 172.31.31.144 -> 172.31.23.72 OpenFlow 187 Type: OFPT_PACKET_OUT
270 0.525071974 172.31.31.144 -> 172.31.23.72 OpenFlow 187 Type: OFPT_PACKET_OUT
271 0.525124033 172.31.31.144 -> 172.31.23.72 OpenFlow 187 Type: OFPT_PACKET_OUT
272 0.525174429 172.31.31.144 -> 172.31.23.72 OpenFlow 187 Type: OFPT_PACKET_OUT
273 0.525233431 172.31.31.144 -> 172.31.23.72 OpenFlow 187 Type: OFPT_PACKET_OUT
274 0.525277614 172.31.31.144 -> 172.31.23.72 OpenFlow 187 Type: OFPT_PACKET_OUT
275 0.525332335 172.31.31.144 -> 172.31.23.72 OpenFlow 187 Type: OFPT_PACKET_OUT
276 0.525380291 172.31.23.72 -> 172.31.31.144 TCP 66 33648 → 6633 [ACK] Seq=985 Ack=969 Win=213 Len=0 TSval=26122037 TSecr=1282936
277 0.525422851 172.31.31.144 -> 172.31.23.72 OpenFlow 187 Type: OFPT_PACKET_OUT
278 0.525457747 172.31.31.144 -> 172.31.23.72 OpenFlow 187 Type: OFPT_PACKET_OUT
279 0.525512286 172.31.31.144 -> 172.31.23.72 OpenFlow 187 Type: OFPT_PACKET_OUT
280 0.525568857 172.31.31.144 -> 172.31.23.72 OpenFlow 187 Type: OFPT_PACKET_OUT
281 0.525633547 172.31.31.144 -> 172.31.23.72 OpenFlow 187 Type: OFPT_PACKET_OUT
282 0.525645276 172.31.23.72 -> 172.31.31.144 TCP 66 33676 → 6633 [ACK] Seq=8521 Ack=823 Win=213 Len=0 TSval=26122037 TSecr=1282936
283 0.525687250 172.31.31.144 -> 172.31.23.72 OpenFlow 187 Type: OFPT_PACKET_OUT
284 0.525729318 172.31.23.72 -> 172.31.31.144 OpenFlow 189 Type: OFPT_PACKET_IN
285 0.525760625 172.31.23.72 -> 172.31.31.144 OpenFlow 435 Type: OFPT_PACKET_IN
286 0.525786691 172.31.31.144 -> 172.31.23.72 OpenFlow 187 Type: OFPT_PACKET_OUT
287 0.525808935 172.31.31.144 -> 172.31.23.72 OpenFlow 187 Type: OFPT_PACKET_OUT
288 0.525907663 172.31.31.144 -> 172.31.23.72 OpenFlow 187 Type: OFPT_PACKET_OUT
289 0.525965437 172.31.31.144 -> 172.31.23.72 OpenFlow 187 Type: OFPT_PACKET_OUT
290 0.525989687 172.31.31.144 -> 172.31.23.72 TCP 66 6633 → 33674 [ACK] Seq=1065 Ack=9588 Win=853 Len=0 TSval=1282936 TSecr=26122037
291 0.526038918 172.31.23.72 -> 172.31.31.144 TCP 66 33674 → 6633 [ACK] Seq=9957 Ack=1065 Win=213 Len=0 TSval=26122037 TSecr=1282936
292 0.526048804 172.31.31.144 -> 172.31.23.72 OpenFlow 187 Type: OFPT_PACKET_OUT
293 0.526088999 172.31.31.144 -> 172.31.23.72 TCP 66 6633 → 33674 [ACK] Seq=1065 Ack=9957 Win=853 Len=0 TSval=1282936 TSecr=26122037
294 0.526094044 172.31.31.144 -> 172.31.23.72 OpenFlow 187 Type: OFPT_PACKET_OUT
295 0.526134315 172.31.23.72 -> 172.31.31.144 OpenFlow 189 Type: OFPT_PACKET_IN
296 0.526144335 172.31.31.144 -> 172.31.23.72 OpenFlow 187 Type: OFPT_PACKET_OUT
297 0.526175266 172.31.23.72 -> 172.31.31.144 OpenFlow 189 Type: OFPT_PACKET_IN
298 0.526194870 172.31.23.72 -> 172.31.31.144 OpenFlow 312 Type: OFPT_PACKET_IN
299 0.526222717 172.31.31.144 -> 172.31.23.72 OpenFlow 187 Type: OFPT_PACKET_OUT
300 0.526268915 172.31.31.144 -> 172.31.23.72 OpenFlow 187 Type: OFPT_PACKET_OUT
301 0.526315406 172.31.31.144 -> 172.31.23.72 OpenFlow 187 Type: OFPT_PACKET_OUT
302 0.526373720 172.31.31.144 -> 172.31.23.72 OpenFlow 187 Type: OFPT_PACKET_OUT
303 0.526405834 172.31.31.144 -> 172.31.23.72 TCP 66 6633 → 33672 [ACK] Seq=1065 Ack=8170 Win=853 Len=0 TSval=1282937 TSecr=26122037
304 0.526449856 172.31.31.144 -> 172.31.23.72 OpenFlow 187 Type: OFPT_PACKET_OUT
305 0.526538817 172.31.31.144 -> 172.31.23.72 OpenFlow 187 Type: OFPT_PACKET_OUT
306 0.526577488 172.31.23.72 -> 172.31.31.144 TCP 66 33672 → 6633 [ACK] Seq=8539 Ack=1065 Win=213 Len=0 TSval=26122038 TSecr=1282937
307 0.526615360 172.31.31.144 -> 172.31.23.72 OpenFlow 187 Type: OFPT_PACKET_OUT
308 0.526628131 172.31.31.144 -> 172.31.23.72 TCP 66 6633 → 33672 [ACK] Seq=1065 Ack=8539 Win=853 Len=0 TSval=1282937 TSecr=26122038
309 0.526664439 172.31.23.72 -> 172.31.31.144 OpenFlow 189 Type: OFPT_PACKET_IN
310 0.526685705 172.31.23.72 -> 172.31.31.144 OpenFlow 189 Type: OFPT_PACKET_IN
311 0.526712338 172.31.31.144 -> 172.31.23.72 OpenFlow 187 Type: OFPT_PACKET_OUT
312 0.526789026 172.31.31.144 -> 172.31.23.72 OpenFlow 187 Type: OFPT_PACKET_OUT
313 0.526856862 172.31.23.72 -> 172.31.31.144 TCP 66 33630 → 6633 [ACK] Seq=493 Ack=727 Win=213 Len=0 TSval=26122038 TSecr=1282937
314 0.526866715 172.31.31.144 -> 172.31.23.72 OpenFlow 187 Type: OFPT_PACKET_OUT
315 0.526924371 172.31.31.144 -> 172.31.23.72 OpenFlow 187 Type: OFPT_PACKET_OUT
316 0.526941356 172.31.31.144 -> 172.31.23.72 TCP 66 6633 → 33630 [ACK] Seq=727 Ack=493 Win=853 Len=0 TSval=1282937 TSecr=26122038
317 0.526950133 172.31.23.72 -> 172.31.31.144 OpenFlow 189 Type: OFPT_PACKET_IN
318 0.526969540 172.31.23.72 -> 172.31.31.144 OpenFlow 189 Type: OFPT_PACKET_IN
319 0.527012419 172.31.31.144 -> 172.31.23.72 OpenFlow 187 Type: OFPT_PACKET_OUT
320 0.527066157 172.31.31.144 -> 172.31.23.72 OpenFlow 187 Type: OFPT_PACKET_OUT
321 0.527133043 172.31.31.144 -> 172.31.23.72 OpenFlow 187 Type: OFPT_PACKET_OUT
322 0.527139673 172.31.23.72 -> 172.31.31.144 TCP 66 33670 → 6633 [ACK] Seq=9787 Ack=581 Win=213 Len=0 TSval=26122038 TSecr=1282937
323 0.527195636 172.31.31.144 -> 172.31.23.72 TCP 66 6633 → 33670 [ACK] Seq=702 Ack=9787 Win=853 Len=0 TSval=1282937 TSecr=26122038
324 0.527231726 172.31.23.72 -> 172.31.31.144 OpenFlow 189 Type: OFPT_PACKET_IN
325 0.527251884 172.31.23.72 -> 172.31.31.144 OpenFlow 435 Type: OFPT_PACKET_IN
326 0.527360325 172.31.23.72 -> 172.31.31.144 OpenFlow 189 Type: OFPT_PACKET_IN
327 0.527382035 172.31.23.72 -> 172.31.31.144 OpenFlow 189 Type: OFPT_PACKET_IN
328 0.527391773 172.31.23.72 -> 172.31.31.144 OpenFlow 189 Type: OFPT_PACKET_IN
329 0.527402413 172.31.31.144 -> 172.31.23.72 OpenFlow 187 Type: OFPT_PACKET_OUT
330 0.527425922 172.31.23.72 -> 172.31.31.144 OpenFlow 189 Type: OFPT_PACKET_IN
331 0.527437077 172.31.23.72 -> 172.31.31.144 OpenFlow 189 Type: OFPT_PACKET_IN
332 0.527445818 172.31.31.144 -> 172.31.23.72 TCP 66 6633 → 33664 [ACK] Seq=122 Ack=370 Win=853 Len=0 TSval=1282937 TSecr=26122038
333 0.527461590 172.31.23.72 -> 172.31.31.144 OpenFlow 189 Type: OFPT_PACKET_IN
334 0.527478460 172.31.23.72 -> 172.31.31.144 OpenFlow 189 Type: OFPT_PACKET_IN
335 0.527494916 172.31.23.72 -> 172.31.31.144 OpenFlow 189 Type: OFPT_PACKET_IN
336 0.527513532 172.31.23.72 -> 172.31.31.144 OpenFlow 189 Type: OFPT_PACKET_IN
337 0.527515738 172.31.23.72 -> 172.31.31.144 OpenFlow 435 Type: OFPT_PACKET_IN
338 0.527527928 172.31.23.72 -> 172.31.31.144 OpenFlow 189 Type: OFPT_PACKET_IN
339 0.527534536 172.31.31.144 -> 172.31.23.72 OpenFlow 187 Type: OFPT_PACKET_OUT
340 0.527537251 172.31.31.144 -> 172.31.23.72 OpenFlow 187 Type: OFPT_PACKET_OUT
341 0.527539194 172.31.31.144 -> 172.31.23.72 OpenFlow 308 Type: OFPT_PACKET_OUT
342 0.527553502 172.31.23.72 -> 172.31.31.144 OpenFlow 189 Type: OFPT_PACKET_IN
343 0.527559196 172.31.23.72 -> 172.31.31.144 OpenFlow 189 Type: OFPT_PACKET_IN
344 0.527561132 172.31.23.72 -> 172.31.31.144 OpenFlow 435 Type: OFPT_PACKET_IN
345 0.527573898 172.31.23.72 -> 172.31.31.144 OpenFlow 189 Type: OFPT_PACKET_IN
346 0.527592548 172.31.23.72 -> 172.31.31.144 OpenFlow 189 Type: OFPT_PACKET_IN
347 0.527594955 172.31.23.72 -> 172.31.31.144 OpenFlow 435 Type: OFPT_PACKET_IN
348 0.527596589 172.31.23.72 -> 172.31.31.144 OpenFlow 189 Type: OFPT_PACKET_IN
349 0.527609143 172.31.23.72 -> 172.31.31.144 OpenFlow 189 Type: OFPT_PACKET_IN
350 0.527620494 172.31.23.72 -> 172.31.31.144 OpenFlow 189 Type: OFPT_PACKET_IN
351 0.527658091 172.31.31.144 -> 172.31.23.72 TCP 66 6633 → 33668 [ACK] Seq=969 Ack=370 Win=853 Len=0 TSval=1282937 TSecr=26122038
352 0.527663266 172.31.31.144 -> 172.31.23.72 TCP 66 6633 → 33668 [ACK] Seq=969 Ack=493 Win=853 Len=0 TSval=1282937 TSecr=26122038
353 0.527665591 172.31.31.144 -> 172.31.23.72 OpenFlow 187 Type: OFPT_PACKET_OUT
354 0.527668097 172.31.31.144 -> 172.31.23.72 TCP 66 6633 → 33656 [ACK] Seq=727 Ack=370 Win=853 Len=0 TSval=1282937 TSecr=26122038
355 0.527673617 172.31.23.72 -> 172.31.31.144 OpenFlow 189 Type: OFPT_PACKET_IN
356 0.527679445 172.31.23.72 -> 172.31.31.144 OpenFlow 189 Type: OFPT_PACKET_IN
357 0.527744829 172.31.23.72 -> 172.31.31.144 TCP 66 33670 → 6633 [ACK] Seq=9787 Ack=1065 Win=213 Len=0 TSval=26122038 TSecr=1282937
358 0.527748525 172.31.23.72 -> 172.31.31.144 OpenFlow 435 Type: OFPT_PACKET_IN
359 0.527836705 172.31.23.72 -> 172.31.31.144 OpenFlow 189 Type: OFPT_PACKET_IN
360 0.527839668 172.31.23.72 -> 172.31.31.144 OpenFlow 189 Type: OFPT_PACKET_IN
361 0.527841455 172.31.23.72 -> 172.31.31.144 OpenFlow 189 Type: OFPT_PACKET_IN
362 0.527862324 172.31.31.144 -> 172.31.23.72 OpenFlow 308 Type: OFPT_PACKET_OUT
363 0.527866394 172.31.31.144 -> 172.31.23.72 TCP 66 6633 → 33656 [ACK] Seq=727 Ack=493 Win=853 Len=0 TSval=1282937 TSecr=26122038
364 0.527869320 172.31.31.144 -> 172.31.23.72 TCP 66 6633 → 33640 [ACK] Seq=1211 Ack=616 Win=853 Len=0 TSval=1282937 TSecr=26122038
365 0.527871523 172.31.31.144 -> 172.31.23.72 TCP 66 6633 → 33634 [ACK] Seq=1211 Ack=370 Win=853 Len=0 TSval=1282937 TSecr=26122038
366 0.527873562 172.31.31.144 -> 172.31.23.72 TCP 66 6633 → 33654 [ACK] Seq=969 Ack=616 Win=853 Len=0 TSval=1282937 TSecr=26122038
367 0.527875757 172.31.31.144 -> 172.31.23.72 OpenFlow 187 Type: OFPT_PACKET_OUT
368 0.528029535 172.31.31.144 -> 172.31.23.72 TCP 66 6633 → 33640 [ACK] Seq=1211 Ack=985 Win=853 Len=0 TSval=1282937 TSecr=26122038
369 0.528035065 172.31.31.144 -> 172.31.23.72 TCP 66 6633 → 33644 [ACK] Seq=727 Ack=370 Win=853 Len=0 TSval=1282937 TSecr=26122038
370 0.528037530 172.31.31.144 -> 172.31.23.72 OpenFlow 187 Type: OFPT_PACKET_OUT
371 0.528039846 172.31.31.144 -> 172.31.23.72 TCP 66 6633 → 33634 [ACK] Seq=1211 Ack=493 Win=853 Len=0 TSval=1282937 TSecr=26122038
372 0.528041695 172.31.31.144 -> 172.31.23.72 TCP 66 6633 → 33676 [ACK] Seq=823 Ack=8644 Win=853 Len=0 TSval=1282937 TSecr=26122038
373 0.528043562 172.31.31.144 -> 172.31.23.72 TCP 66 6633 → 33660 [ACK] Seq=1211 Ack=739 Win=853 Len=0 TSval=1282937 TSecr=26122038
374 0.528048690 172.31.31.144 -> 172.31.23.72 TCP 66 6633 → 33662 [ACK] Seq=1211 Ack=616 Win=853 Len=0 TSval=1282937 TSecr=26122038
375 0.528057211 172.31.23.72 -> 172.31.31.144 TCP 66 33664 → 6633 [ACK] Seq=739 Ack=606 Win=213 Len=0 TSval=26122038 TSecr=1282937
376 0.528072368 172.31.31.144 -> 172.31.23.72 TCP 66 6633 → 33654 [ACK] Seq=969 Ack=985 Win=853 Len=0 TSval=1282937 TSecr=26122038
