  1 0.000000000 137.158.125.247 -> 172.31.24.227 TCP 54 63468 → 22 [ACK] Seq=1 Ack=1 Win=32416 Len=0
  2 0.038023996 172.31.31.144 -> 172.31.24.227 TCP 90 6633 → 59638 [PSH, ACK] Seq=1 Ack=1 Win=853 Len=24 TSval=2848154 TSecr=391751685
  3 0.038035631 172.31.31.144 -> 172.31.24.227 TCP 138 6633 → 59638 [PSH, ACK] Seq=25 Ack=1 Win=853 Len=72 TSval=2848154 TSecr=391751685
  4 0.038294599 172.31.24.227 -> 172.31.31.144 OpenFlow 530 Type: OFPT_MULTIPART_REPLY, OFPMP_PORT_STATS
  5 0.038388194 172.31.24.227 -> 172.31.31.144 OpenFlow 2186 Type: OFPT_MULTIPART_REPLY, OFPMP_FLOW
  6 0.038537620 172.31.31.144 -> 172.31.24.227 TCP 66 6633 → 59638 [ACK] Seq=97 Ack=465 Win=853 Len=0 TSval=2848154 TSecr=391752029
  7 0.038563938 172.31.24.227 -> 172.31.31.144 OpenFlow 6178 Type: OFPT_MULTIPART_REPLY, OFPMP_TABLE
  8 0.038607942 172.31.31.144 -> 172.31.24.227 TCP 66 6633 → 59638 [ACK] Seq=97 Ack=2585 Win=853 Len=0 TSval=2848154 TSecr=391752029
  9 0.038856209 172.31.31.144 -> 172.31.24.227 TCP 66 6633 → 59638 [ACK] Seq=97 Ack=8697 Win=853 Len=0 TSval=2848154 TSecr=391752029
 10 0.056119677 172.31.31.144 -> 172.31.24.227 TCP 90 6633 → 59640 [PSH, ACK] Seq=1 Ack=1 Win=853 Len=24 TSval=2848158 TSecr=391751685
 11 0.056129611 172.31.31.144 -> 172.31.24.227 TCP 138 6633 → 59640 [PSH, ACK] Seq=25 Ack=1 Win=853 Len=72 TSval=2848158 TSecr=391751685
 12 0.056317025 172.31.24.227 -> 172.31.31.144 OpenFlow 642 Type: OFPT_MULTIPART_REPLY, OFPMP_PORT_STATS
 13 0.056391910 172.31.24.227 -> 172.31.31.144 OpenFlow 2602 Type: OFPT_MULTIPART_REPLY, OFPMP_FLOW
 14 0.056523283 172.31.31.144 -> 172.31.24.227 TCP 66 6633 → 59640 [ACK] Seq=97 Ack=577 Win=853 Len=0 TSval=2848158 TSecr=391752033
 15 0.056536866 172.31.24.227 -> 172.31.31.144 OpenFlow 6178 Type: OFPT_MULTIPART_REPLY, OFPMP_TABLE
 16 0.056639061 172.31.31.144 -> 172.31.24.227 TCP 66 6633 → 59640 [ACK] Seq=97 Ack=3113 Win=853 Len=0 TSval=2848158 TSecr=391752033
 17 0.056822815 172.31.31.144 -> 172.31.24.227 TCP 66 6633 → 59640 [ACK] Seq=97 Ack=9225 Win=853 Len=0 TSval=2848158 TSecr=391752033
 18 0.088045557 137.158.125.247 -> 172.31.24.227 TCP 54 63468 → 22 [ACK] Seq=1 Ack=97 Win=32368 Len=0
 19 0.096352813 172.31.31.144 -> 172.31.24.227 TCP 90 6633 → 59642 [PSH, ACK] Seq=1 Ack=1 Win=853 Len=24 TSval=2848168 TSecr=391751710
 20 0.096368018 172.31.31.144 -> 172.31.24.227 TCP 138 6633 → 59642 [PSH, ACK] Seq=25 Ack=1 Win=853 Len=72 TSval=2848168 TSecr=391751710
 21 0.096710575 172.31.24.227 -> 172.31.31.144 OpenFlow 754 Type: OFPT_MULTIPART_REPLY, OFPMP_PORT_STATS
 22 0.096835266 172.31.24.227 -> 172.31.31.144 OpenFlow 2810 Type: OFPT_MULTIPART_REPLY, OFPMP_FLOW
 23 0.096987666 172.31.31.144 -> 172.31.24.227 TCP 66 6633 → 59642 [ACK] Seq=97 Ack=689 Win=853 Len=0 TSval=2848169 TSecr=391752043
 24 0.097002582 172.31.24.227 -> 172.31.31.144 OpenFlow 6178 Type: OFPT_MULTIPART_REPLY, OFPMP_TABLE
 25 0.097048113 172.31.31.144 -> 172.31.24.227 TCP 66 6633 → 59642 [ACK] Seq=97 Ack=3433 Win=853 Len=0 TSval=2848169 TSecr=391752043
 26 0.098200698 172.31.31.144 -> 172.31.24.227 TCP 66 6633 → 59642 [ACK] Seq=97 Ack=9545 Win=853 Len=0 TSval=2848169 TSecr=391752043
 27 0.131605427 172.31.31.144 -> 172.31.24.227 TCP 90 6633 → 59644 [PSH, ACK] Seq=1 Ack=1 Win=853 Len=24 TSval=2848177 TSecr=391751710
 28 0.131615390 172.31.31.144 -> 172.31.24.227 TCP 138 6633 → 59644 [PSH, ACK] Seq=25 Ack=1 Win=853 Len=72 TSval=2848177 TSecr=391751710
 29 0.131767801 172.31.24.227 -> 172.31.31.144 OpenFlow 642 Type: OFPT_MULTIPART_REPLY, OFPMP_PORT_STATS
 30 0.131902443 172.31.24.227 -> 172.31.31.144 OpenFlow 6178 Type: OFPT_MULTIPART_REPLY, OFPMP_TABLE
 31 0.131966810 172.31.24.227 -> 172.31.31.144 OpenFlow 2186 Type: OFPT_MULTIPART_REPLY, OFPMP_FLOW
 32 0.131982809 172.31.31.144 -> 172.31.24.227 TCP 66 6633 → 59644 [ACK] Seq=97 Ack=577 Win=853 Len=0 TSval=2848177 TSecr=391752052
 33 0.132167912 172.31.31.144 -> 172.31.24.227 TCP 66 6633 → 59644 [ACK] Seq=97 Ack=6689 Win=853 Len=0 TSval=2848177 TSecr=391752052
 34 0.132174793 172.31.31.144 -> 172.31.24.227 TCP 66 6633 → 59644 [ACK] Seq=97 Ack=8809 Win=853 Len=0 TSval=2848177 TSecr=391752052
 35 0.166719354 172.31.31.144 -> 172.31.24.227 TCP 122 6633 → 59646 [PSH, ACK] Seq=1 Ack=1 Win=853 Len=56 TSval=2848186 TSecr=391751710
 36 0.166729267 172.31.31.144 -> 172.31.24.227 TCP 106 6633 → 59646 [PSH, ACK] Seq=57 Ack=1 Win=853 Len=40 TSval=2848186 TSecr=391751710
 37 0.166919617 172.31.24.227 -> 172.31.31.144 OpenFlow 522 Type: OFPT_MULTIPART_REPLY, OFPMP_FLOW
 38 0.167068831 172.31.24.227 -> 172.31.31.144 OpenFlow 6178 Type: OFPT_MULTIPART_REPLY, OFPMP_TABLE
 39 0.167144941 172.31.31.144 -> 172.31.24.227 TCP 66 6633 → 59646 [ACK] Seq=97 Ack=457 Win=853 Len=0 TSval=2848186 TSecr=391752061
 40 0.167163666 172.31.24.227 -> 172.31.31.144 OpenFlow 530 Type: OFPT_MULTIPART_REPLY, OFPMP_PORT_STATS
 41 0.167298936 172.31.31.144 -> 172.31.24.227 TCP 66 6633 → 59646 [ACK] Seq=97 Ack=6569 Win=853 Len=0 TSval=2848186 TSecr=391752061
 42 0.167351320 172.31.31.144 -> 172.31.24.227 TCP 66 6633 → 59646 [ACK] Seq=97 Ack=7033 Win=853 Len=0 TSval=2848186 TSecr=391752061
 43 0.224928530 172.31.31.144 -> 172.31.24.227 TCP 122 6633 → 59648 [PSH, ACK] Seq=1 Ack=1 Win=853 Len=56 TSval=2848200 TSecr=391751760
 44 0.224938810 172.31.31.144 -> 172.31.24.227 TCP 106 6633 → 59648 [PSH, ACK] Seq=57 Ack=1 Win=853 Len=40 TSval=2848200 TSecr=391751760
 45 0.225116682 172.31.24.227 -> 172.31.31.144 OpenFlow 2810 Type: OFPT_MULTIPART_REPLY, OFPMP_FLOW
 46 0.225266831 172.31.24.227 -> 172.31.31.144 OpenFlow 6178 Type: OFPT_MULTIPART_REPLY, OFPMP_TABLE
 47 0.225390300 172.31.24.227 -> 172.31.31.144 OpenFlow 754 Type: OFPT_MULTIPART_REPLY, OFPMP_PORT_STATS
 48 0.225421314 172.31.31.144 -> 172.31.24.227 TCP 66 6633 → 59648 [ACK] Seq=97 Ack=2745 Win=853 Len=0 TSval=2848201 TSecr=391752075
 49 0.225537763 172.31.31.144 -> 172.31.24.227 TCP 66 6633 → 59648 [ACK] Seq=97 Ack=8857 Win=853 Len=0 TSval=2848201 TSecr=391752075
 50 0.225596628 172.31.31.144 -> 172.31.24.227 TCP 66 6633 → 59648 [ACK] Seq=97 Ack=9545 Win=853 Len=0 TSval=2848201 TSecr=391752075
 51 0.309003347 172.31.31.144 -> 172.31.24.227 TCP 90 6633 → 59650 [PSH, ACK] Seq=1 Ack=1 Win=853 Len=24 TSval=2848221 TSecr=391751735
 52 0.309021653 172.31.31.144 -> 172.31.24.227 TCP 138 6633 → 59650 [PSH, ACK] Seq=25 Ack=1 Win=853 Len=72 TSval=2848222 TSecr=391751735
 53 0.309387947 172.31.24.227 -> 172.31.31.144 OpenFlow 754 Type: OFPT_MULTIPART_REPLY, OFPMP_PORT_STATS
 54 0.309565765 172.31.24.227 -> 172.31.31.144 OpenFlow 6178 Type: OFPT_MULTIPART_REPLY, OFPMP_TABLE
 55 0.309648779 172.31.24.227 -> 172.31.31.144 OpenFlow 1978 Type: OFPT_MULTIPART_REPLY, OFPMP_FLOW
 56 0.309658357 172.31.31.144 -> 172.31.24.227 TCP 66 6633 → 59650 [ACK] Seq=97 Ack=689 Win=853 Len=0 TSval=2848222 TSecr=391752096
 57 0.309824277 172.31.31.144 -> 172.31.24.227 TCP 66 6633 → 59650 [ACK] Seq=97 Ack=6801 Win=853 Len=0 TSval=2848222 TSecr=391752096
 58 0.309861191 172.31.31.144 -> 172.31.24.227 TCP 66 6633 → 59650 [ACK] Seq=97 Ack=8713 Win=853 Len=0 TSval=2848222 TSecr=391752096
 59 0.347102791 172.31.31.144 -> 172.31.24.227 TCP 122 6633 → 59652 [PSH, ACK] Seq=1 Ack=1 Win=853 Len=56 TSval=2848231 TSecr=391751735
 60 0.347122237 172.31.31.144 -> 172.31.24.227 TCP 90 6633 → 59652 [PSH, ACK] Seq=57 Ack=1 Win=853 Len=24 TSval=2848231 TSecr=391751735
 61 0.347276020 172.31.24.227 -> 172.31.31.144 OpenFlow 1354 Type: OFPT_MULTIPART_REPLY, OFPMP_FLOW
 62 0.347376428 172.31.24.227 -> 172.31.31.144 OpenFlow 530 Type: OFPT_MULTIPART_REPLY, OFPMP_PORT_STATS
 63 0.347495360 172.31.31.144 -> 172.31.24.227 TCP 66 6633 → 59652 [ACK] Seq=81 Ack=1289 Win=853 Len=0 TSval=2848231 TSecr=391752106
 64 0.347605476 172.31.31.144 -> 172.31.24.227 TCP 66 6633 → 59652 [ACK] Seq=81 Ack=1753 Win=853 Len=0 TSval=2848231 TSecr=391752106
 65 0.348168107 172.31.31.144 -> 172.31.24.227 OpenFlow 82 Type: OFPT_MULTIPART_REQUEST, OFPMP_TABLE
 66 0.348407982 172.31.24.227 -> 172.31.31.144 OpenFlow 6178 Type: OFPT_MULTIPART_REPLY, OFPMP_TABLE
 67 0.385081245 172.31.31.144 -> 172.31.24.227 TCP 66 6633 → 59652 [ACK] Seq=97 Ack=7865 Win=853 Len=0 TSval=2848241 TSecr=391752106
 68 0.405468806 172.31.31.144 -> 172.31.24.227 TCP 122 6633 → 59654 [PSH, ACK] Seq=1 Ack=1 Win=853 Len=56 TSval=2848246 TSecr=391751760
 69 0.405478638 172.31.31.144 -> 172.31.24.227 TCP 106 6633 → 59654 [PSH, ACK] Seq=57 Ack=1 Win=853 Len=40 TSval=2848246 TSecr=391751760
 70 0.405658317 172.31.24.227 -> 172.31.31.144 OpenFlow 2602 Type: OFPT_MULTIPART_REPLY, OFPMP_FLOW
 71 0.405805513 172.31.24.227 -> 172.31.31.144 OpenFlow 754 Type: OFPT_MULTIPART_REPLY, OFPMP_PORT_STATS
 72 0.405888721 172.31.31.144 -> 172.31.24.227 TCP 66 6633 → 59654 [ACK] Seq=97 Ack=2537 Win=853 Len=0 TSval=2848246 TSecr=391752120
 73 0.405958278 172.31.24.227 -> 172.31.31.144 OpenFlow 6178 Type: OFPT_MULTIPART_REPLY, OFPMP_TABLE
 74 0.406008478 172.31.31.144 -> 172.31.24.227 TCP 66 6633 → 59654 [ACK] Seq=97 Ack=3225 Win=853 Len=0 TSval=2848246 TSecr=391752121
 75 0.406279265 172.31.31.144 -> 172.31.24.227 TCP 66 6633 → 59654 [ACK] Seq=97 Ack=9337 Win=853 Len=0 TSval=2848246 TSecr=391752121
 76 0.457663738 172.31.31.144 -> 172.31.24.227 TCP 90 6633 → 59656 [PSH, ACK] Seq=1 Ack=1 Win=853 Len=24 TSval=2848259 TSecr=391751810
 77 0.457672813 172.31.31.144 -> 172.31.24.227 TCP 138 6633 → 59656 [PSH, ACK] Seq=25 Ack=1 Win=853 Len=72 TSval=2848259 TSecr=391751810
 78 0.457881076 172.31.24.227 -> 172.31.31.144 OpenFlow 642 Type: OFPT_MULTIPART_REPLY, OFPMP_PORT_STATS
 79 0.458032664 172.31.24.227 -> 172.31.31.144 OpenFlow 6178 Type: OFPT_MULTIPART_REPLY, OFPMP_TABLE
 80 0.458084465 172.31.24.227 -> 172.31.31.144 OpenFlow 1146 Type: OFPT_MULTIPART_REPLY, OFPMP_FLOW
 81 0.458115217 172.31.31.144 -> 172.31.24.227 TCP 66 6633 → 59656 [ACK] Seq=97 Ack=577 Win=853 Len=0 TSval=2848259 TSecr=391752134
 82 0.458313373 172.31.31.144 -> 172.31.24.227 TCP 66 6633 → 59656 [ACK] Seq=97 Ack=6689 Win=853 Len=0 TSval=2848259 TSecr=391752134
 83 0.458319592 172.31.31.144 -> 172.31.24.227 TCP 66 6633 → 59656 [ACK] Seq=97 Ack=7769 Win=853 Len=0 TSval=2848259 TSecr=391752134
 84 0.507750679 172.31.31.144 -> 172.31.24.227 TCP 90 6633 → 59658 [PSH, ACK] Seq=1 Ack=1 Win=853 Len=24 TSval=2848271 TSecr=391751910
 85 0.507759780 172.31.31.144 -> 172.31.24.227 TCP 138 6633 → 59658 [PSH, ACK] Seq=25 Ack=1 Win=853 Len=72 TSval=2848271 TSecr=391751910
 86 0.507945252 172.31.24.227 -> 172.31.31.144 OpenFlow 754 Type: OFPT_MULTIPART_REPLY, OFPMP_PORT_STATS
 87 0.508030801 172.31.24.227 -> 172.31.31.144 OpenFlow 3018 Type: OFPT_MULTIPART_REPLY, OFPMP_FLOW
 88 0.508149961 172.31.31.144 -> 172.31.24.227 TCP 66 6633 → 59658 [ACK] Seq=97 Ack=689 Win=853 Len=0 TSval=2848271 TSecr=391752146
 89 0.508191592 172.31.24.227 -> 172.31.31.144 OpenFlow 6178 Type: OFPT_MULTIPART_REPLY, OFPMP_TABLE
 90 0.508233960 172.31.31.144 -> 172.31.24.227 TCP 66 6633 → 59658 [ACK] Seq=97 Ack=3641 Win=853 Len=0 TSval=2848271 TSecr=391752146
 91 0.508443005 172.31.31.144 -> 172.31.24.227 TCP 66 6633 → 59658 [ACK] Seq=97 Ack=9753 Win=853 Len=0 TSval=2848271 TSecr=391752146
 92 0.559876590 172.31.31.144 -> 172.31.24.227 TCP 82 6633 → 59660 [PSH, ACK] Seq=1 Ack=1 Win=853 Len=16 TSval=2848284 TSecr=391751835
 93 0.559885987 172.31.31.144 -> 172.31.24.227 TCP 146 6633 → 59660 [PSH, ACK] Seq=17 Ack=1 Win=853 Len=80 TSval=2848284 TSecr=391751835
 94 0.560097130 172.31.24.227 -> 172.31.31.144 OpenFlow 6178 Type: OFPT_MULTIPART_REPLY, OFPMP_TABLE
 95 0.560200825 172.31.24.227 -> 172.31.31.144 OpenFlow 642 Type: OFPT_MULTIPART_REPLY, OFPMP_PORT_STATS
 96 0.560266124 172.31.24.227 -> 172.31.31.144 OpenFlow 1978 Type: OFPT_MULTIPART_REPLY, OFPMP_FLOW
 97 0.560352449 172.31.31.144 -> 172.31.24.227 TCP 66 6633 → 59660 [ACK] Seq=97 Ack=6113 Win=853 Len=0 TSval=2848284 TSecr=391752159
 98 0.560418707 172.31.31.144 -> 172.31.24.227 TCP 66 6633 → 59660 [ACK] Seq=97 Ack=6689 Win=853 Len=0 TSval=2848284 TSecr=391752159
 99 0.560479464 172.31.31.144 -> 172.31.24.227 TCP 66 6633 → 59660 [ACK] Seq=97 Ack=8601 Win=853 Len=0 TSval=2848284 TSecr=391752159
100 0.617153263 172.31.31.144 -> 172.31.24.227 TCP 90 6633 → 59662 [PSH, ACK] Seq=1 Ack=1 Win=853 Len=24 TSval=2848299 TSecr=391751860
101 0.617165250 172.31.31.144 -> 172.31.24.227 TCP 138 6633 → 59662 [PSH, ACK] Seq=25 Ack=1 Win=853 Len=72 TSval=2848299 TSecr=391751860
102 0.617396531 172.31.24.227 -> 172.31.31.144 OpenFlow 642 Type: OFPT_MULTIPART_REPLY, OFPMP_PORT_STATS
103 0.617560518 172.31.24.227 -> 172.31.31.144 OpenFlow 6178 Type: OFPT_MULTIPART_REPLY, OFPMP_TABLE
104 0.617615369 172.31.24.227 -> 172.31.31.144 OpenFlow 1146 Type: OFPT_MULTIPART_REPLY, OFPMP_FLOW
105 0.617664477 172.31.31.144 -> 172.31.24.227 TCP 66 6633 → 59662 [ACK] Seq=97 Ack=577 Win=853 Len=0 TSval=2848299 TSecr=391752173
106 0.617847589 172.31.31.144 -> 172.31.24.227 TCP 66 6633 → 59662 [ACK] Seq=97 Ack=6689 Win=853 Len=0 TSval=2848299 TSecr=391752173
107 0.617854826 172.31.31.144 -> 172.31.24.227 TCP 66 6633 → 59662 [ACK] Seq=97 Ack=7769 Win=853 Len=0 TSval=2848299 TSecr=391752173
108 0.676267887 172.31.31.144 -> 172.31.24.227 TCP 90 6633 → 59664 [PSH, ACK] Seq=1 Ack=1 Win=853 Len=24 TSval=2848313 TSecr=391751860
109 0.676279476 172.31.31.144 -> 172.31.24.227 TCP 138 6633 → 59664 [PSH, ACK] Seq=25 Ack=1 Win=853 Len=72 TSval=2848313 TSecr=391751860
110 0.676459434 172.31.24.227 -> 172.31.31.144 OpenFlow 530 Type: OFPT_MULTIPART_REPLY, OFPMP_PORT_STATS
111 0.676507781 172.31.24.227 -> 172.31.31.144 OpenFlow 522 Type: OFPT_MULTIPART_REPLY, OFPMP_FLOW
112 0.676669901 172.31.24.227 -> 172.31.31.144 OpenFlow 6178 Type: OFPT_MULTIPART_REPLY, OFPMP_TABLE
113 0.676776088 172.31.31.144 -> 172.31.24.227 TCP 66 6633 → 59664 [ACK] Seq=97 Ack=921 Win=853 Len=0 TSval=2848313 TSecr=391752188
114 0.689955109 172.31.24.227 -> 137.158.125.247 SSH 98 Server: Encrypted packet (len=44)
115 0.717050639 172.31.31.144 -> 172.31.24.227 TCP 66 6633 → 59664 [ACK] Seq=97 Ack=7033 Win=853 Len=0 TSval=2848324 TSecr=391752188
116 0.739352150 172.31.31.144 -> 172.31.24.227 TCP 82 6633 → 59666 [PSH, ACK] Seq=1 Ack=1 Win=853 Len=16 TSval=2848329 TSecr=391751910
117 0.739362724 172.31.31.144 -> 172.31.24.227 TCP 146 6633 → 59666 [PSH, ACK] Seq=17 Ack=1 Win=853 Len=80 TSval=2848329 TSecr=391751910
118 0.739801936 172.31.24.227 -> 172.31.31.144 OpenFlow 6178 Type: OFPT_MULTIPART_REPLY, OFPMP_TABLE
119 0.739909068 172.31.24.227 -> 172.31.31.144 OpenFlow 3226 Type: OFPT_MULTIPART_REPLY, OFPMP_FLOW
120 0.740024141 172.31.24.227 -> 172.31.31.144 OpenFlow 530 Type: OFPT_MULTIPART_REPLY, OFPMP_PORT_STATS
121 0.740064834 172.31.31.144 -> 172.31.24.227 TCP 66 6633 → 59666 [ACK] Seq=97 Ack=6113 Win=853 Len=0 TSval=2848329 TSecr=391752204
122 0.740125922 172.31.31.144 -> 172.31.24.227 TCP 66 6633 → 59666 [ACK] Seq=97 Ack=9273 Win=853 Len=0 TSval=2848329 TSecr=391752204
123 0.740274849 172.31.31.144 -> 172.31.24.227 TCP 66 6633 → 59666 [ACK] Seq=97 Ack=9737 Win=853 Len=0 TSval=2848329 TSecr=391752204
124 0.800500128 172.31.31.144 -> 172.31.24.227 TCP 90 6633 → 59668 [PSH, ACK] Seq=1 Ack=1 Win=853 Len=24 TSval=2848344 TSecr=391751960
125 0.800513446 172.31.31.144 -> 172.31.24.227 TCP 138 6633 → 59668 [PSH, ACK] Seq=25 Ack=1 Win=853 Len=72 TSval=2848344 TSecr=391751960
126 0.800758319 172.31.24.227 -> 172.31.31.144 OpenFlow 754 Type: OFPT_MULTIPART_REPLY, OFPMP_PORT_STATS
127 0.800941556 172.31.24.227 -> 172.31.31.144 OpenFlow 6178 Type: OFPT_MULTIPART_REPLY, OFPMP_TABLE
128 0.801021169 172.31.31.144 -> 172.31.24.227 TCP 66 6633 → 59668 [ACK] Seq=97 Ack=689 Win=853 Len=0 TSval=2848345 TSecr=391752219
129 0.801037064 172.31.24.227 -> 172.31.31.144 OpenFlow 2602 Type: OFPT_MULTIPART_REPLY, OFPMP_FLOW
130 0.801199604 172.31.31.144 -> 172.31.24.227 TCP 66 6633 → 59668 [ACK] Seq=97 Ack=6801 Win=853 Len=0 TSval=2848345 TSecr=391752219
131 0.801261517 172.31.31.144 -> 172.31.24.227 TCP 66 6633 → 59668 [ACK] Seq=97 Ack=9337 Win=853 Len=0 TSval=2848345 TSecr=391752219
132 0.864839523 172.31.31.144 -> 172.31.24.227 TCP 122 6633 → 59670 [PSH, ACK] Seq=1 Ack=1 Win=853 Len=56 TSval=2848360 TSecr=391751961
133 0.864856607 172.31.31.144 -> 172.31.24.227 TCP 106 6633 → 59670 [PSH, ACK] Seq=57 Ack=1 Win=853 Len=40 TSval=2848360 TSecr=391751961
134 0.865097502 172.31.24.227 -> 172.31.31.144 OpenFlow 2186 Type: OFPT_MULTIPART_REPLY, OFPMP_FLOW
135 0.865257977 172.31.24.227 -> 172.31.31.144 OpenFlow 754 Type: OFPT_MULTIPART_REPLY, OFPMP_PORT_STATS
136 0.865382374 172.31.31.144 -> 172.31.24.227 TCP 66 6633 → 59670 [ACK] Seq=97 Ack=2121 Win=853 Len=0 TSval=2848361 TSecr=391752235
137 0.865415244 172.31.24.227 -> 172.31.31.144 OpenFlow 6178 Type: OFPT_MULTIPART_REPLY, OFPMP_TABLE
138 0.865450223 172.31.31.144 -> 172.31.24.227 TCP 66 6633 → 59670 [ACK] Seq=97 Ack=2809 Win=853 Len=0 TSval=2848361 TSecr=391752235
139 0.866579619 172.31.31.144 -> 172.31.24.227 TCP 66 6633 → 59670 [ACK] Seq=97 Ack=8921 Win=853 Len=0 TSval=2848361 TSecr=391752235
140 0.898820649 137.158.125.247 -> 172.31.24.227 TCP 54 63468 → 22 [ACK] Seq=1 Ack=141 Win=32346 Len=0
141 0.927955964 172.31.31.144 -> 172.31.24.227 TCP 122 6633 → 59672 [PSH, ACK] Seq=1 Ack=1 Win=853 Len=56 TSval=2848376 TSecr=391751961
142 0.927965287 172.31.31.144 -> 172.31.24.227 TCP 106 6633 → 59672 [PSH, ACK] Seq=57 Ack=1 Win=853 Len=40 TSval=2848376 TSecr=391751961
143 0.928171094 172.31.24.227 -> 172.31.31.144 OpenFlow 1354 Type: OFPT_MULTIPART_REPLY, OFPMP_FLOW
144 0.928252578 172.31.24.227 -> 172.31.31.144 OpenFlow 530 Type: OFPT_MULTIPART_REPLY, OFPMP_PORT_STATS
145 0.928386317 172.31.24.227 -> 172.31.31.144 OpenFlow 6178 Type: OFPT_MULTIPART_REPLY, OFPMP_TABLE
146 0.928461191 172.31.31.144 -> 172.31.24.227 TCP 66 6633 → 59672 [ACK] Seq=97 Ack=1753 Win=853 Len=0 TSval=2848376 TSecr=391752251
147 0.965081966 172.31.31.144 -> 172.31.24.227 TCP 66 6633 → 59672 [ACK] Seq=97 Ack=7865 Win=853 Len=0 TSval=2848386 TSecr=391752251
148 0.997104670 172.31.31.144 -> 172.31.24.227 TCP 82 6633 → 59674 [PSH, ACK] Seq=1 Ack=1 Win=853 Len=16 TSval=2848394 TSecr=391751910
149 0.997115050 172.31.31.144 -> 172.31.24.227 TCP 146 6633 → 59674 [PSH, ACK] Seq=17 Ack=1 Win=853 Len=80 TSval=2848394 TSecr=391751910
150 0.997416460 172.31.24.227 -> 172.31.31.144 OpenFlow 6178 Type: OFPT_MULTIPART_REPLY, OFPMP_TABLE
151 0.997492418 172.31.24.227 -> 172.31.31.144 OpenFlow 2186 Type: OFPT_MULTIPART_REPLY, OFPMP_FLOW
152 0.997586939 172.31.24.227 -> 172.31.31.144 OpenFlow 530 Type: OFPT_MULTIPART_REPLY, OFPMP_PORT_STATS
153 0.997713475 172.31.31.144 -> 172.31.24.227 TCP 66 6633 → 59674 [ACK] Seq=97 Ack=6113 Win=853 Len=0 TSval=2848394 TSecr=391752268
154 0.997720505 172.31.31.144 -> 172.31.24.227 TCP 66 6633 → 59674 [ACK] Seq=97 Ack=8233 Win=853 Len=0 TSval=2848394 TSecr=391752268
155 0.997820312 172.31.31.144 -> 172.31.24.227 TCP 66 6633 → 59674 [ACK] Seq=97 Ack=8697 Win=853 Len=0 TSval=2848394 TSecr=391752268
156 1.077206301 172.31.31.144 -> 172.31.24.227 TCP 82 6633 → 59676 [PSH, ACK] Seq=1 Ack=1 Win=853 Len=16 TSval=2848414 TSecr=391751910
157 1.077224698 172.31.31.144 -> 172.31.24.227 TCP 146 6633 → 59676 [PSH, ACK] Seq=17 Ack=1 Win=853 Len=80 TSval=2848414 TSecr=391751910
158 1.077501042 172.31.24.227 -> 172.31.31.144 OpenFlow 6178 Type: OFPT_MULTIPART_REPLY, OFPMP_TABLE
159 1.077624534 172.31.24.227 -> 172.31.31.144 OpenFlow 642 Type: OFPT_MULTIPART_REPLY, OFPMP_PORT_STATS
160 1.077746897 172.31.31.144 -> 172.31.24.227 TCP 66 6633 → 59676 [ACK] Seq=97 Ack=6113 Win=853 Len=0 TSval=2848414 TSecr=391752288
161 1.077762014 172.31.24.227 -> 172.31.31.144 OpenFlow 4058 Type: OFPT_MULTIPART_REPLY, OFPMP_FLOW
162 1.077830689 172.31.31.144 -> 172.31.24.227 TCP 66 6633 → 59676 [ACK] Seq=97 Ack=6689 Win=853 Len=0 TSval=2848414 TSecr=391752288
163 1.077975320 172.31.31.144 -> 172.31.24.227 TCP 66 6633 → 59676 [ACK] Seq=97 Ack=10681 Win=853 Len=0 TSval=2848414 TSecr=391752289
164 1.150480505 172.31.31.144 -> 172.31.24.227 TCP 90 6633 → 59678 [PSH, ACK] Seq=1 Ack=1 Win=853 Len=24 TSval=2848432 TSecr=391751960
165 1.150511966 172.31.31.144 -> 172.31.24.227 TCP 138 6633 → 59678 [PSH, ACK] Seq=25 Ack=1 Win=853 Len=72 TSval=2848432 TSecr=391751960
166 1.151044203 172.31.24.227 -> 172.31.31.144 OpenFlow 642 Type: OFPT_MULTIPART_REPLY, OFPMP_PORT_STATS
167 1.151141723 172.31.24.227 -> 172.31.31.144 OpenFlow 2810 Type: OFPT_MULTIPART_REPLY, OFPMP_FLOW
168 1.151293520 172.31.31.144 -> 172.31.24.227 TCP 66 6633 → 59678 [ACK] Seq=97 Ack=577 Win=853 Len=0 TSval=2848432 TSecr=391752307
169 1.151300919 172.31.24.227 -> 172.31.31.144 OpenFlow 6178 Type: OFPT_MULTIPART_REPLY, OFPMP_TABLE
170 1.151346276 172.31.31.144 -> 172.31.24.227 TCP 66 6633 → 59678 [ACK] Seq=97 Ack=3321 Win=853 Len=0 TSval=2848432 TSecr=391752307
171 1.151571706 172.31.31.144 -> 172.31.24.227 TCP 66 6633 → 59678 [ACK] Seq=97 Ack=9433 Win=853 Len=0 TSval=2848432 TSecr=391752307
172 1.193672082 172.31.24.227 -> 137.158.125.247 SSH 98 Server: Encrypted packet (len=44)
173 1.229646623 172.31.31.144 -> 172.31.24.227 TCP 122 6633 → 59680 [PSH, ACK] Seq=1 Ack=1 Win=853 Len=56 TSval=2848452 TSecr=391751960
174 1.229660281 172.31.31.144 -> 172.31.24.227 TCP 106 6633 → 59680 [PSH, ACK] Seq=57 Ack=1 Win=853 Len=40 TSval=2848452 TSecr=391751960
175 1.229972432 172.31.24.227 -> 172.31.31.144 OpenFlow 2394 Type: OFPT_MULTIPART_REPLY, OFPMP_FLOW
176 1.230098892 172.31.24.227 -> 172.31.31.144 OpenFlow 642 Type: OFPT_MULTIPART_REPLY, OFPMP_PORT_STATS
177 1.230208019 172.31.31.144 -> 172.31.24.227 TCP 66 6633 → 59680 [ACK] Seq=97 Ack=2329 Win=853 Len=0 TSval=2848452 TSecr=391752327
178 1.230277351 172.31.24.227 -> 172.31.31.144 OpenFlow 6178 Type: OFPT_MULTIPART_REPLY, OFPMP_TABLE
179 1.230309421 172.31.31.144 -> 172.31.24.227 TCP 66 6633 → 59680 [ACK] Seq=97 Ack=2905 Win=853 Len=0 TSval=2848452 TSecr=391752327
180 1.231552742 172.31.31.144 -> 172.31.24.227 TCP 66 6633 → 59680 [ACK] Seq=97 Ack=9017 Win=853 Len=0 TSval=2848452 TSecr=391752327
181 1.275754281 172.31.31.144 -> 172.31.24.227 TCP 82 6633 → 59682 [PSH, ACK] Seq=1 Ack=1 Win=853 Len=16 TSval=2848463 TSecr=391751960
182 1.275763951 172.31.31.144 -> 172.31.24.227 TCP 146 6633 → 59682 [PSH, ACK] Seq=17 Ack=1 Win=853 Len=80 TSval=2848463 TSecr=391751960
183 1.276025123 172.31.24.227 -> 172.31.31.144 OpenFlow 6178 Type: OFPT_MULTIPART_REPLY, OFPMP_TABLE
184 1.276108225 172.31.24.227 -> 172.31.31.144 OpenFlow 3018 Type: OFPT_MULTIPART_REPLY, OFPMP_FLOW
185 1.276207388 172.31.24.227 -> 172.31.31.144 OpenFlow 642 Type: OFPT_MULTIPART_REPLY, OFPMP_PORT_STATS
186 1.276273686 172.31.31.144 -> 172.31.24.227 TCP 66 6633 → 59682 [ACK] Seq=97 Ack=6113 Win=853 Len=0 TSval=2848463 TSecr=391752338
187 1.276353171 172.31.31.144 -> 172.31.24.227 TCP 66 6633 → 59682 [ACK] Seq=97 Ack=9065 Win=853 Len=0 TSval=2848463 TSecr=391752338
188 1.276406446 172.31.31.144 -> 172.31.24.227 TCP 66 6633 → 59682 [ACK] Seq=97 Ack=9641 Win=853 Len=0 TSval=2848463 TSecr=391752338
189 1.320881186 172.31.31.144 -> 172.31.24.227 TCP 122 6633 → 59684 [PSH, ACK] Seq=1 Ack=1 Win=853 Len=56 TSval=2848474 TSecr=391751961
190 1.320894618 172.31.31.144 -> 172.31.24.227 TCP 106 6633 → 59684 [PSH, ACK] Seq=57 Ack=1 Win=853 Len=40 TSval=2848474 TSecr=391751961
191 1.321117969 172.31.24.227 -> 172.31.31.144 OpenFlow 2186 Type: OFPT_MULTIPART_REPLY, OFPMP_FLOW
192 1.321237657 172.31.24.227 -> 172.31.31.144 OpenFlow 530 Type: OFPT_MULTIPART_REPLY, OFPMP_PORT_STATS
193 1.321385590 172.31.24.227 -> 172.31.31.144 OpenFlow 6178 Type: OFPT_MULTIPART_REPLY, OFPMP_TABLE
194 1.321485171 172.31.31.144 -> 172.31.24.227 TCP 66 6633 → 59684 [ACK] Seq=97 Ack=2121 Win=853 Len=0 TSval=2848475 TSecr=391752349
195 1.321494843 172.31.31.144 -> 172.31.24.227 TCP 66 6633 → 59684 [ACK] Seq=97 Ack=2585 Win=853 Len=0 TSval=2848475 TSecr=391752349
196 1.321721848 172.31.31.144 -> 172.31.24.227 TCP 66 6633 → 59684 [ACK] Seq=97 Ack=8697 Win=853 Len=0 TSval=2848475 TSecr=391752349
197 1.401898995 137.158.125.247 -> 172.31.24.227 TCP 54 63468 → 22 [ACK] Seq=1 Ack=185 Win=32324 Len=0
198 1.663271241 172.31.31.144 -> 172.31.24.227 OpenFlow 187 Type: OFPT_PACKET_OUT
199 1.663303627 172.31.31.144 -> 172.31.24.227 OpenFlow 187 Type: OFPT_PACKET_OUT
200 1.663308511 172.31.31.144 -> 172.31.24.227 OpenFlow 187 Type: OFPT_PACKET_OUT
201 1.663341726 172.31.31.144 -> 172.31.24.227 OpenFlow 187 Type: OFPT_PACKET_OUT
202 1.663345426 172.31.31.144 -> 172.31.24.227 OpenFlow 187 Type: OFPT_PACKET_OUT
203 1.663414930 172.31.31.144 -> 172.31.24.227 OpenFlow 187 Type: OFPT_PACKET_OUT
204 1.663461963 172.31.31.144 -> 172.31.24.227 OpenFlow 187 Type: OFPT_PACKET_OUT
205 1.663516254 172.31.31.144 -> 172.31.24.227 OpenFlow 187 Type: OFPT_PACKET_OUT
206 1.663585311 172.31.31.144 -> 172.31.24.227 OpenFlow 187 Type: OFPT_PACKET_OUT
207 1.663639809 172.31.31.144 -> 172.31.24.227 OpenFlow 187 Type: OFPT_PACKET_OUT
208 1.663700109 172.31.31.144 -> 172.31.24.227 OpenFlow 187 Type: OFPT_PACKET_OUT
209 1.663749477 172.31.31.144 -> 172.31.24.227 OpenFlow 187 Type: OFPT_PACKET_OUT
210 1.663812638 172.31.31.144 -> 172.31.24.227 OpenFlow 187 Type: OFPT_PACKET_OUT
211 1.663856849 172.31.31.144 -> 172.31.24.227 OpenFlow 187 Type: OFPT_PACKET_OUT
212 1.663924897 172.31.31.144 -> 172.31.24.227 OpenFlow 187 Type: OFPT_PACKET_OUT
213 1.663993244 172.31.31.144 -> 172.31.24.227 OpenFlow 187 Type: OFPT_PACKET_OUT
214 1.664034956 172.31.31.144 -> 172.31.24.227 OpenFlow 187 Type: OFPT_PACKET_OUT
215 1.664091224 172.31.31.144 -> 172.31.24.227 OpenFlow 187 Type: OFPT_PACKET_OUT
216 1.664151296 172.31.31.144 -> 172.31.24.227 OpenFlow 187 Type: OFPT_PACKET_OUT
217 1.664214734 172.31.31.144 -> 172.31.24.227 OpenFlow 187 Type: OFPT_PACKET_OUT
218 1.664226198 172.31.24.227 -> 172.31.31.144 TCP 66 59640 → 6633 [ACK] Seq=9225 Ack=1065 Win=213 Len=0 TSval=391752435 TSecr=2848560
219 1.664277776 172.31.31.144 -> 172.31.24.227 OpenFlow 187 Type: OFPT_PACKET_OUT
220 1.664321889 172.31.31.144 -> 172.31.24.227 OpenFlow 187 Type: OFPT_PACKET_OUT
221 1.664361250 172.31.31.144 -> 172.31.24.227 OpenFlow 187 Type: OFPT_PACKET_OUT
222 1.664396079 172.31.24.227 -> 172.31.31.144 OpenFlow 189 Type: OFPT_PACKET_IN
223 1.664420843 172.31.31.144 -> 172.31.24.227 OpenFlow 187 Type: OFPT_PACKET_OUT
224 1.664428753 172.31.24.227 -> 172.31.31.144 OpenFlow 189 Type: OFPT_PACKET_IN
225 1.664495338 172.31.31.144 -> 172.31.24.227 OpenFlow 187 Type: OFPT_PACKET_OUT
226 1.664552326 172.31.31.144 -> 172.31.24.227 OpenFlow 187 Type: OFPT_PACKET_OUT
227 1.664664353 172.31.31.144 -> 172.31.24.227 TCP 66 6633 → 59638 [ACK] Seq=823 Ack=8820 Win=853 Len=0 TSval=2848560 TSecr=391752435
228 1.664672288 172.31.31.144 -> 172.31.24.227 TCP 66 6633 → 59638 [ACK] Seq=823 Ack=8943 Win=853 Len=0 TSval=2848560 TSecr=391752435
229 1.664675226 172.31.31.144 -> 172.31.24.227 OpenFlow 187 Type: OFPT_PACKET_OUT
230 1.664678184 172.31.31.144 -> 172.31.24.227 OpenFlow 187 Type: OFPT_PACKET_OUT
231 1.664706496 172.31.31.144 -> 172.31.24.227 OpenFlow 187 Type: OFPT_PACKET_OUT
232 1.664763893 172.31.31.144 -> 172.31.24.227 OpenFlow 187 Type: OFPT_PACKET_OUT
233 1.664826547 172.31.31.144 -> 172.31.24.227 OpenFlow 187 Type: OFPT_PACKET_OUT
234 1.664883777 172.31.31.144 -> 172.31.24.227 OpenFlow 187 Type: OFPT_PACKET_OUT
235 1.665163026 172.31.24.227 -> 172.31.31.144 TCP 66 59644 → 6633 [ACK] Seq=8809 Ack=1065 Win=213 Len=0 TSval=391752435 TSecr=2848560
236 1.665243982 172.31.24.227 -> 172.31.31.144 OpenFlow 189 Type: OFPT_PACKET_IN
237 1.665264789 172.31.24.227 -> 172.31.31.144 OpenFlow 435 Type: OFPT_PACKET_IN
238 1.665283191 172.31.24.227 -> 172.31.31.144 OpenFlow 189 Type: OFPT_PACKET_IN
239 1.665325602 172.31.24.227 -> 172.31.31.144 OpenFlow 435 Type: OFPT_PACKET_IN
240 1.665429754 172.31.31.144 -> 172.31.24.227 TCP 66 6633 → 59648 [ACK] Seq=97 Ack=9668 Win=853 Len=0 TSval=2848561 TSecr=391752435
241 1.665523545 172.31.31.144 -> 172.31.24.227 TCP 66 6633 → 59648 [ACK] Seq=97 Ack=10037 Win=853 Len=0 TSval=2848561 TSecr=391752435
242 1.665531635 172.31.31.144 -> 172.31.24.227 TCP 66 6633 → 59642 [ACK] Seq=1307 Ack=9668 Win=853 Len=0 TSval=2848561 TSecr=391752435
243 1.665534661 172.31.31.144 -> 172.31.24.227 TCP 66 6633 → 59642 [ACK] Seq=1307 Ack=10037 Win=853 Len=0 TSval=2848561 TSecr=391752435
244 1.665853370 172.31.24.227 -> 172.31.31.144 OpenFlow 189 Type: OFPT_PACKET_IN
245 1.665874661 172.31.24.227 -> 172.31.31.144 OpenFlow 189 Type: OFPT_PACKET_IN
246 1.665889545 172.31.24.227 -> 172.31.31.144 OpenFlow 189 Type: OFPT_PACKET_IN
247 1.665930385 172.31.24.227 -> 172.31.31.144 OpenFlow 435 Type: OFPT_PACKET_IN
248 1.665985906 172.31.24.227 -> 172.31.31.144 OpenFlow 189 Type: OFPT_PACKET_IN
249 1.666002531 172.31.24.227 -> 172.31.31.144 OpenFlow 189 Type: OFPT_PACKET_IN
250 1.666016851 172.31.24.227 -> 172.31.31.144 OpenFlow 189 Type: OFPT_PACKET_IN
251 1.666069293 172.31.31.144 -> 172.31.24.227 TCP 66 6633 → 59652 [ACK] Seq=97 Ack=7988 Win=853 Len=0 TSval=2848561 TSecr=391752436
252 1.666075976 172.31.31.144 -> 172.31.24.227 TCP 66 6633 → 59652 [ACK] Seq=97 Ack=8111 Win=853 Len=0 TSval=2848561 TSecr=391752436
253 1.666119853 172.31.24.227 -> 172.31.31.144 OpenFlow 435 Type: OFPT_PACKET_IN
254 1.666157458 172.31.24.227 -> 172.31.31.144 OpenFlow 189 Type: OFPT_PACKET_IN
255 1.666191948 172.31.31.144 -> 172.31.24.227 TCP 66 6633 → 59640 [ACK] Seq=1065 Ack=9348 Win=853 Len=0 TSval=2848561 TSecr=391752436
256 1.666197190 172.31.31.144 -> 172.31.24.227 TCP 66 6633 → 59640 [ACK] Seq=1065 Ack=9717 Win=853 Len=0 TSval=2848561 TSecr=391752436
257 1.666199620 172.31.31.144 -> 172.31.24.227 TCP 66 6633 → 59650 [ACK] Seq=97 Ack=8836 Win=853 Len=0 TSval=2848561 TSecr=391752436
258 1.666254514 172.31.24.227 -> 172.31.31.144 OpenFlow 189 Type: OFPT_PACKET_IN
259 1.666300100 172.31.31.144 -> 172.31.24.227 TCP 66 6633 → 59650 [ACK] Seq=97 Ack=8959 Win=853 Len=0 TSval=2848561 TSecr=391752436
260 1.666304470 172.31.31.144 -> 172.31.24.227 TCP 66 6633 → 59646 [ACK] Seq=97 Ack=7156 Win=853 Len=0 TSval=2848561 TSecr=391752436
261 1.666381243 172.31.31.144 -> 172.31.24.227 TCP 66 6633 → 59646 [ACK] Seq=97 Ack=7525 Win=853 Len=0 TSval=2848561 TSecr=391752436
262 1.666435222 172.31.31.144 -> 172.31.24.227 TCP 66 6633 → 59644 [ACK] Seq=1065 Ack=8932 Win=853 Len=0 TSval=2848561 TSecr=391752436
263 1.666489787 172.31.31.144 -> 172.31.24.227 TCP 66 6633 → 59644 [ACK] Seq=1065 Ack=9055 Win=853 Len=0 TSval=2848561 TSecr=391752436
264 1.697411775 172.31.24.227 -> 137.158.125.247 SSH 98 Server: Encrypted packet (len=44)
265 1.763218034 172.31.31.144 -> 172.31.24.227 OpenFlow 187 Type: OFPT_PACKET_OUT
266 1.763842311 172.31.24.227 -> 172.31.31.144 OpenFlow 189 Type: OFPT_PACKET_IN
267 1.764020560 172.31.31.144 -> 172.31.24.227 OpenFlow 187 Type: OFPT_PACKET_OUT
268 1.764087538 172.31.31.144 -> 172.31.24.227 TCP 66 6633 → 59642 [ACK] Seq=1307 Ack=10160 Win=853 Len=0 TSval=2848585 TSecr=391752460
269 1.764133964 172.31.31.144 -> 172.31.24.227 OpenFlow 187 Type: OFPT_PACKET_OUT
270 1.764185597 172.31.31.144 -> 172.31.24.227 OpenFlow 187 Type: OFPT_PACKET_OUT
271 1.764250807 172.31.31.144 -> 172.31.24.227 OpenFlow 187 Type: OFPT_PACKET_OUT
272 1.764298002 172.31.31.144 -> 172.31.24.227 OpenFlow 187 Type: OFPT_PACKET_OUT
273 1.764379710 172.31.31.144 -> 172.31.24.227 OpenFlow 187 Type: OFPT_PACKET_OUT
274 1.764421661 172.31.31.144 -> 172.31.24.227 OpenFlow 187 Type: OFPT_PACKET_OUT
275 1.764485471 172.31.31.144 -> 172.31.24.227 OpenFlow 187 Type: OFPT_PACKET_OUT
276 1.764511747 172.31.24.227 -> 172.31.31.144 TCP 66 59646 → 6633 [ACK] Seq=7525 Ack=823 Win=213 Len=0 TSval=391752460 TSecr=2848585
277 1.764547522 172.31.31.144 -> 172.31.24.227 OpenFlow 187 Type: OFPT_PACKET_OUT
278 1.764595921 172.31.31.144 -> 172.31.24.227 OpenFlow 187 Type: OFPT_PACKET_OUT
279 1.764661334 172.31.31.144 -> 172.31.24.227 OpenFlow 187 Type: OFPT_PACKET_OUT
280 1.764702979 172.31.24.227 -> 172.31.31.144 OpenFlow 189 Type: OFPT_PACKET_IN
281 1.764723760 172.31.31.144 -> 172.31.24.227 OpenFlow 187 Type: OFPT_PACKET_OUT
282 1.764731895 172.31.24.227 -> 172.31.31.144 OpenFlow 189 Type: OFPT_PACKET_IN
283 1.764774639 172.31.31.144 -> 172.31.24.227 OpenFlow 187 Type: OFPT_PACKET_OUT
284 1.764824343 172.31.31.144 -> 172.31.24.227 OpenFlow 187 Type: OFPT_PACKET_OUT
285 1.764930705 172.31.31.144 -> 172.31.24.227 OpenFlow 187 Type: OFPT_PACKET_OUT
286 1.764936026 172.31.31.144 -> 172.31.24.227 TCP 66 6633 → 59644 [ACK] Seq=1065 Ack=9178 Win=853 Len=0 TSval=2848586 TSecr=391752460
287 1.764939715 172.31.31.144 -> 172.31.24.227 TCP 66 6633 → 59644 [ACK] Seq=1065 Ack=9301 Win=853 Len=0 TSval=2848586 TSecr=391752460
288 1.765268080 172.31.24.227 -> 172.31.31.144 TCP 66 59648 → 6633 [ACK] Seq=10037 Ack=1307 Win=213 Len=0 TSval=391752460 TSecr=2848585
289 1.765343980 172.31.24.227 -> 172.31.31.144 OpenFlow 189 Type: OFPT_PACKET_IN
290 1.765386200 172.31.24.227 -> 172.31.31.144 OpenFlow 189 Type: OFPT_PACKET_IN
291 1.765407505 172.31.24.227 -> 172.31.31.144 OpenFlow 189 Type: OFPT_PACKET_IN
292 1.765427693 172.31.24.227 -> 172.31.31.144 OpenFlow 189 Type: OFPT_PACKET_IN
293 1.765465652 172.31.24.227 -> 172.31.31.144 OpenFlow 189 Type: OFPT_PACKET_IN
294 1.765494583 172.31.24.227 -> 172.31.31.144 OpenFlow 189 Type: OFPT_PACKET_IN
295 1.765529802 172.31.24.227 -> 172.31.31.144 OpenFlow 189 Type: OFPT_PACKET_IN
296 1.765564155 172.31.31.144 -> 172.31.24.227 TCP 66 6633 → 59642 [ACK] Seq=1307 Ack=10283 Win=853 Len=0 TSval=2848586 TSecr=391752460
297 1.765570308 172.31.31.144 -> 172.31.24.227 TCP 66 6633 → 59654 [ACK] Seq=97 Ack=9460 Win=853 Len=0 TSval=2848586 TSecr=391752460
298 1.765632641 172.31.24.227 -> 172.31.31.144 OpenFlow 189 Type: OFPT_PACKET_IN
299 1.765639716 172.31.24.227 -> 172.31.31.144 OpenFlow 435 Type: OFPT_PACKET_IN
300 1.765695993 172.31.31.144 -> 172.31.24.227 TCP 66 6633 → 59654 [ACK] Seq=97 Ack=9583 Win=853 Len=0 TSval=2848586 TSecr=391752460
301 1.765701762 172.31.31.144 -> 172.31.24.227 TCP 66 6633 → 59640 [ACK] Seq=1065 Ack=9840 Win=853 Len=0 TSval=2848586 TSecr=391752460
302 1.765704443 172.31.31.144 -> 172.31.24.227 TCP 66 6633 → 59640 [ACK] Seq=1065 Ack=9963 Win=853 Len=0 TSval=2848586 TSecr=391752460
303 1.765710279 172.31.24.227 -> 172.31.31.144 OpenFlow 189 Type: OFPT_PACKET_IN
304 1.765770028 172.31.31.144 -> 172.31.24.227 TCP 66 6633 → 59638 [ACK] Seq=823 Ack=9066 Win=853 Len=0 TSval=2848586 TSecr=391752460
305 1.765796474 172.31.24.227 -> 172.31.31.144 OpenFlow 189 Type: OFPT_PACKET_IN
306 1.765819600 172.31.31.144 -> 172.31.24.227 TCP 66 6633 → 59650 [ACK] Seq=97 Ack=9082 Win=853 Len=0 TSval=2848586 TSecr=391752460
307 1.765883116 172.31.31.144 -> 172.31.24.227 TCP 66 6633 → 59638 [ACK] Seq=823 Ack=9189 Win=853 Len=0 TSval=2848586 TSecr=391752460
308 1.765949051 172.31.31.144 -> 172.31.24.227 TCP 66 6633 → 59650 [ACK] Seq=97 Ack=9451 Win=853 Len=0 TSval=2848586 TSecr=391752460
309 1.766032613 172.31.31.144 -> 172.31.24.227 TCP 66 6633 → 59658 [ACK] Seq=97 Ack=9876 Win=853 Len=0 TSval=2848586 TSecr=391752460
310 1.766037467 172.31.31.144 -> 172.31.24.227 TCP 66 6633 → 59658 [ACK] Seq=97 Ack=9999 Win=853 Len=0 TSval=2848586 TSecr=391752461
311 1.863232626 172.31.31.144 -> 172.31.24.227 OpenFlow 187 Type: OFPT_PACKET_OUT
312 1.863259904 172.31.31.144 -> 172.31.24.227 OpenFlow 187 Type: OFPT_PACKET_OUT
313 1.863297036 172.31.31.144 -> 172.31.24.227 OpenFlow 187 Type: OFPT_PACKET_OUT
314 1.863301731 172.31.31.144 -> 172.31.24.227 OpenFlow 187 Type: OFPT_PACKET_OUT
315 1.863357638 172.31.31.144 -> 172.31.24.227 OpenFlow 187 Type: OFPT_PACKET_OUT
316 1.863398831 172.31.31.144 -> 172.31.24.227 OpenFlow 187 Type: OFPT_PACKET_OUT
317 1.863452673 172.31.31.144 -> 172.31.24.227 OpenFlow 187 Type: OFPT_PACKET_OUT
318 1.863507057 172.31.31.144 -> 172.31.24.227 OpenFlow 187 Type: OFPT_PACKET_OUT
319 1.863560252 172.31.31.144 -> 172.31.24.227 OpenFlow 187 Type: OFPT_PACKET_OUT
320 1.863622004 172.31.31.144 -> 172.31.24.227 OpenFlow 187 Type: OFPT_PACKET_OUT
321 1.863688089 172.31.31.144 -> 172.31.24.227 OpenFlow 187 Type: OFPT_PACKET_OUT
322 1.863730840 172.31.31.144 -> 172.31.24.227 OpenFlow 187 Type: OFPT_PACKET_OUT
323 1.863784115 172.31.31.144 -> 172.31.24.227 OpenFlow 187 Type: OFPT_PACKET_OUT
324 1.863837156 172.31.31.144 -> 172.31.24.227 OpenFlow 187 Type: OFPT_PACKET_OUT
325 1.863904772 172.31.31.144 -> 172.31.24.227 OpenFlow 187 Type: OFPT_PACKET_OUT
326 1.863969406 172.31.31.144 -> 172.31.24.227 OpenFlow 187 Type: OFPT_PACKET_OUT
327 1.864320855 172.31.24.227 -> 172.31.31.144 TCP 66 59650 → 6633 [ACK] Seq=9451 Ack=1307 Win=213 Len=0 TSval=391752485 TSecr=2848610
328 1.864418589 172.31.24.227 -> 172.31.31.144 OpenFlow 189 Type: OFPT_PACKET_IN
329 1.864438918 172.31.24.227 -> 172.31.31.144 OpenFlow 189 Type: OFPT_PACKET_IN
330 1.864571923 172.31.24.227 -> 172.31.31.144 OpenFlow 189 Type: OFPT_PACKET_IN
331 1.864590447 172.31.24.227 -> 172.31.31.144 OpenFlow 189 Type: OFPT_PACKET_IN
332 1.864606767 172.31.24.227 -> 172.31.31.144 OpenFlow 189 Type: OFPT_PACKET_IN
333 1.864636828 172.31.31.144 -> 172.31.24.227 TCP 66 6633 → 59646 [ACK] Seq=823 Ack=7771 Win=853 Len=0 TSval=2848610 TSecr=391752485
334 1.864648060 172.31.24.227 -> 172.31.31.144 OpenFlow 189 Type: OFPT_PACKET_IN
335 1.864670406 172.31.24.227 -> 172.31.31.144 OpenFlow 189 Type: OFPT_PACKET_IN
336 1.864673680 172.31.24.227 -> 172.31.31.144 OpenFlow 189 Type: OFPT_PACKET_IN
337 1.864720315 172.31.24.227 -> 172.31.31.144 OpenFlow 189 Type: OFPT_PACKET_IN
338 1.864727055 172.31.24.227 -> 172.31.31.144 OpenFlow 189 Type: OFPT_PACKET_IN
339 1.864782331 172.31.31.144 -> 172.31.24.227 TCP 66 6633 → 59648 [ACK] Seq=1307 Ack=10160 Win=853 Len=0 TSval=2848610 TSecr=391752485
340 1.864872042 172.31.31.144 -> 172.31.24.227 TCP 66 6633 → 59642 [ACK] Seq=1307 Ack=10406 Win=853 Len=0 TSval=2848610 TSecr=391752485
341 1.864878517 172.31.31.144 -> 172.31.24.227 TCP 66 6633 → 59654 [ACK] Seq=97 Ack=9706 Win=853 Len=0 TSval=2848610 TSecr=391752485
342 1.864962668 172.31.31.144 -> 172.31.24.227 TCP 66 6633 → 59642 [ACK] Seq=1307 Ack=10529 Win=853 Len=0 TSval=2848610 TSecr=391752485
343 1.864968607 172.31.31.144 -> 172.31.24.227 TCP 66 6633 → 59648 [ACK] Seq=1307 Ack=10283 Win=853 Len=0 TSval=2848610 TSecr=391752485
344 1.864970985 172.31.31.144 -> 172.31.24.227 TCP 66 6633 → 59652 [ACK] Seq=823 Ack=8234 Win=853 Len=0 TSval=2848610 TSecr=391752485
345 1.865001210 172.31.31.144 -> 172.31.24.227 TCP 66 6633 → 59654 [ACK] Seq=97 Ack=9829 Win=853 Len=0 TSval=2848611 TSecr=391752485
346 1.865093013 172.31.24.227 -> 172.31.31.144 OpenFlow 189 Type: OFPT_PACKET_IN
347 1.865134744 172.31.31.144 -> 172.31.24.227 TCP 66 6633 → 59652 [ACK] Seq=823 Ack=8357 Win=853 Len=0 TSval=2848611 TSecr=391752485
348 1.865142797 172.31.24.227 -> 172.31.31.144 OpenFlow 189 Type: OFPT_PACKET_IN
349 1.865175479 172.31.24.227 -> 172.31.31.144 OpenFlow 189 Type: OFPT_PACKET_IN
350 1.865190753 172.31.24.227 -> 172.31.31.144 OpenFlow 189 Type: OFPT_PACKET_IN
351 1.865292316 172.31.24.227 -> 172.31.31.144 OpenFlow 189 Type: OFPT_PACKET_IN
352 1.865339601 172.31.31.144 -> 172.31.24.227 TCP 66 6633 → 59656 [ACK] Seq=97 Ack=7892 Win=853 Len=0 TSval=2848611 TSecr=391752485
353 1.865344998 172.31.31.144 -> 172.31.24.227 TCP 66 6633 → 59656 [ACK] Seq=97 Ack=8015 Win=853 Len=0 TSval=2848611 TSecr=391752485
354 1.865350564 172.31.24.227 -> 172.31.31.144 OpenFlow 189 Type: OFPT_PACKET_IN
355 1.865384510 172.31.31.144 -> 172.31.24.227 TCP 66 6633 → 59650 [ACK] Seq=1307 Ack=9697 Win=853 Len=0 TSval=2848611 TSecr=391752485
356 1.865547409 172.31.31.144 -> 172.31.24.227 TCP 66 6633 → 59644 [ACK] Seq=1065 Ack=9424 Win=853 Len=0 TSval=2848611 TSecr=391752485
357 1.865558245 172.31.31.144 -> 172.31.24.227 TCP 66 6633 → 59644 [ACK] Seq=1065 Ack=9547 Win=853 Len=0 TSval=2848611 TSecr=391752485
358 1.905411718 137.158.125.247 -> 172.31.24.227 TCP 54 63468 → 22 [ACK] Seq=1 Ack=229 Win=32302 Len=0
359 1.963283904 172.31.31.144 -> 172.31.24.227 OpenFlow 187 Type: OFPT_PACKET_OUT
360 1.963293943 172.31.31.144 -> 172.31.24.227 OpenFlow 187 Type: OFPT_PACKET_OUT
361 1.963297851 172.31.31.144 -> 172.31.24.227 OpenFlow 187 Type: OFPT_PACKET_OUT
362 1.963313073 172.31.31.144 -> 172.31.24.227 OpenFlow 187 Type: OFPT_PACKET_OUT
