  1 0.000000000 172.31.31.144 -> 172.31.23.72 TCP 90 6633 → 45414 [PSH, ACK] Seq=1 Ack=1 Win=853 Len=24 TSval=809381 TSecr=19379257
  2 0.000029583 172.31.31.144 -> 172.31.23.72 TCP 106 6633 → 45414 [PSH, ACK] Seq=25 Ack=1 Win=853 Len=40 TSval=809381 TSecr=19379257
  3 0.000167185 172.31.23.72 -> 172.31.31.144 OpenFlow 82 Type: OFPT_MULTIPART_REPLY, OFPMP_GROUP
  4 0.000198338 172.31.23.72 -> 172.31.31.144 OpenFlow 98 Type: OFPT_MULTIPART_REPLY, OFPMP_METER
  5 0.000478169 172.31.31.144 -> 172.31.23.72 TCP 66 6633 → 45414 [ACK] Seq=65 Ack=49 Win=853 Len=0 TSval=809382 TSecr=19379506
  6 0.100162344 172.31.31.144 -> 172.31.23.72 TCP 90 6633 → 45416 [PSH, ACK] Seq=1 Ack=1 Win=853 Len=24 TSval=809407 TSecr=19379257
  7 0.100212748 172.31.31.144 -> 172.31.23.72 TCP 90 6633 → 45420 [PSH, ACK] Seq=1 Ack=1 Win=853 Len=24 TSval=809407 TSecr=19379282
  8 0.100217077 172.31.31.144 -> 172.31.23.72 TCP 90 6633 → 45418 [PSH, ACK] Seq=1 Ack=1 Win=853 Len=24 TSval=809407 TSecr=19379282
  9 0.100220001 172.31.31.144 -> 172.31.23.72 TCP 106 6633 → 45420 [PSH, ACK] Seq=25 Ack=1 Win=853 Len=40 TSval=809407 TSecr=19379282
 10 0.100234198 172.31.31.144 -> 172.31.23.72 TCP 106 6633 → 45418 [PSH, ACK] Seq=25 Ack=1 Win=853 Len=40 TSval=809407 TSecr=19379282
 11 0.100254476 172.31.31.144 -> 172.31.23.72 TCP 82 6633 → 45416 [PSH, ACK] Seq=25 Ack=1 Win=853 Len=16 TSval=809407 TSecr=19379257
 12 0.100275330 172.31.31.144 -> 172.31.23.72 TCP 90 6633 → 45416 [PSH, ACK] Seq=41 Ack=1 Win=853 Len=24 TSval=809407 TSecr=19379257
 13 0.100402755 172.31.23.72 -> 172.31.31.144 OpenFlow 82 Type: OFPT_MULTIPART_REPLY, OFPMP_GROUP
 14 0.100433240 172.31.23.72 -> 172.31.31.144 OpenFlow 98 Type: OFPT_MULTIPART_REPLY, OFPMP_METER
 15 0.100458497 172.31.23.72 -> 172.31.31.144 OpenFlow 82 Type: OFPT_MULTIPART_REPLY, OFPMP_GROUP
 16 0.100499614 172.31.23.72 -> 172.31.31.144 OpenFlow 98 Type: OFPT_MULTIPART_REPLY, OFPMP_METER
 17 0.100516639 172.31.23.72 -> 172.31.31.144 OpenFlow 82 Type: OFPT_MULTIPART_REPLY, OFPMP_GROUP
 18 0.100558053 172.31.23.72 -> 172.31.31.144 OpenFlow 98 Type: OFPT_MULTIPART_REPLY, OFPMP_METER
 19 0.100621516 172.31.31.144 -> 172.31.23.72 TCP 66 6633 → 45420 [ACK] Seq=65 Ack=17 Win=853 Len=0 TSval=809407 TSecr=19379531
 20 0.100627666 172.31.31.144 -> 172.31.23.72 TCP 66 6633 → 45420 [ACK] Seq=65 Ack=49 Win=853 Len=0 TSval=809407 TSecr=19379531
 21 0.100743062 172.31.31.144 -> 172.31.23.72 TCP 66 6633 → 45418 [ACK] Seq=65 Ack=49 Win=853 Len=0 TSval=809407 TSecr=19379531
 22 0.100758137 172.31.31.144 -> 172.31.23.72 TCP 66 6633 → 45416 [ACK] Seq=65 Ack=49 Win=853 Len=0 TSval=809407 TSecr=19379531
 23 0.199419825 172.31.31.144 -> 172.31.23.72 TCP 90 6633 → 45422 [PSH, ACK] Seq=1 Ack=1 Win=853 Len=24 TSval=809431 TSecr=19379282
 24 0.199448022 172.31.31.144 -> 172.31.23.72 TCP 106 6633 → 45422 [PSH, ACK] Seq=25 Ack=1 Win=853 Len=40 TSval=809431 TSecr=19379282
 25 0.199768329 172.31.23.72 -> 172.31.31.144 OpenFlow 82 Type: OFPT_MULTIPART_REPLY, OFPMP_GROUP
 26 0.199811748 172.31.23.72 -> 172.31.31.144 OpenFlow 98 Type: OFPT_MULTIPART_REPLY, OFPMP_METER
 27 0.199971815 172.31.31.144 -> 172.31.23.72 TCP 66 6633 → 45422 [ACK] Seq=65 Ack=17 Win=853 Len=0 TSval=809431 TSecr=19379556
 28 0.199992372 172.31.31.144 -> 172.31.23.72 TCP 66 6633 → 45422 [ACK] Seq=65 Ack=49 Win=853 Len=0 TSval=809431 TSecr=19379556
 29 0.200679317 172.31.31.144 -> 172.31.23.72 TCP 90 6633 → 45424 [PSH, ACK] Seq=1 Ack=1 Win=853 Len=24 TSval=809431 TSecr=19379282
 30 0.200704310 172.31.31.144 -> 172.31.23.72 TCP 106 6633 → 45424 [PSH, ACK] Seq=25 Ack=1 Win=853 Len=40 TSval=809431 TSecr=19379282
 31 0.200760101 172.31.23.72 -> 172.31.31.144 OpenFlow 82 Type: OFPT_MULTIPART_REPLY, OFPMP_GROUP
 32 0.200789950 172.31.23.72 -> 172.31.31.144 OpenFlow 98 Type: OFPT_MULTIPART_REPLY, OFPMP_METER
 33 0.200982422 172.31.31.144 -> 172.31.23.72 TCP 66 6633 → 45424 [ACK] Seq=65 Ack=49 Win=853 Len=0 TSval=809432 TSecr=19379556
 34 0.266520399 172.31.23.72 -> 172.31.31.144 OpenFlow 146 Type: OFPT_PORT_STATUS
 35 0.266638475 172.31.23.72 -> 172.31.31.144 OpenFlow 146 Type: OFPT_PORT_STATUS
 36 0.266730680 172.31.31.144 -> 172.31.23.72 TCP 66 6633 → 45444 [ACK] Seq=1 Ack=81 Win=853 Len=0 TSval=809448 TSecr=19379573
 37 0.266857516 172.31.31.144 -> 172.31.23.72 TCP 66 6633 → 45442 [ACK] Seq=1 Ack=81 Win=853 Len=0 TSval=809448 TSecr=19379573
 38 0.290712232 172.31.31.144 -> 172.31.23.72 TCP 146 6633 → 45452 [PSH, ACK] Seq=1 Ack=1 Win=853 Len=80 TSval=809454 TSecr=19379257
 39 0.290729520 172.31.31.144 -> 172.31.23.72 OpenFlow 146 Type: OFPT_FLOW_MOD
 40 0.290732780 172.31.31.144 -> 172.31.23.72 TCP 154 6633 → 45452 [PSH, ACK] Seq=81 Ack=1 Win=853 Len=88 TSval=809454 TSecr=19379257
 41 0.290735941 172.31.31.144 -> 172.31.23.72 OpenFlow 146 Type: OFPT_FLOW_MOD
 42 0.290744885 172.31.31.144 -> 172.31.23.72 TCP 146 6633 → 45454 [PSH, ACK] Seq=1 Ack=1 Win=853 Len=80 TSval=809454 TSecr=19379257
 43 0.290780490 172.31.31.144 -> 172.31.23.72 TCP 146 6633 → 45454 [PSH, ACK] Seq=81 Ack=1 Win=853 Len=80 TSval=809454 TSecr=19379257
 44 0.290806741 172.31.31.144 -> 172.31.23.72 OpenFlow 154 Type: OFPT_BARRIER_REQUEST
 45 0.290841041 172.31.31.144 -> 172.31.23.72 OpenFlow 154 Type: OFPT_BARRIER_REQUEST
 46 0.290868659 172.31.31.144 -> 172.31.23.72 TCP 74 6633 → 45454 [PSH, ACK] Seq=161 Ack=1 Win=853 Len=8 TSval=809454 TSecr=19379257
 47 0.290913093 172.31.31.144 -> 172.31.23.72 OpenFlow 146 Type: OFPT_FLOW_MOD
 48 0.290936387 172.31.23.72 -> 172.31.31.144 TCP 66 45452 → 6633 [ACK] Seq=1 Ack=169 Win=213 Len=0 TSval=19379579 TSecr=809454
 49 0.290955814 172.31.31.144 -> 172.31.23.72 OpenFlow 154 Type: OFPT_BARRIER_REQUEST
 50 0.290967087 172.31.23.72 -> 172.31.31.144 OpenFlow 74 Type: OFPT_BARRIER_REPLY
 51 0.290972748 172.31.31.144 -> 172.31.23.72 OpenFlow 146 Type: OFPT_FLOW_MOD
 52 0.291066788 172.31.23.72 -> 172.31.31.144 TCP 66 45444 → 6633 [ACK] Seq=81 Ack=169 Win=213 Len=0 TSval=19379579 TSecr=809454
 53 0.291076588 172.31.31.144 -> 172.31.23.72 OpenFlow 146 Type: OFPT_FLOW_MOD
 54 0.291079868 172.31.31.144 -> 172.31.23.72 OpenFlow 154 Type: OFPT_BARRIER_REQUEST
 55 0.291081702 172.31.31.144 -> 172.31.23.72 TCP 146 6633 → 45434 [PSH, ACK] Seq=1 Ack=1 Win=853 Len=80 TSval=809454 TSecr=19379257
 56 0.291090173 172.31.23.72 -> 172.31.31.144 OpenFlow 74 Type: OFPT_BARRIER_REPLY
 57 0.291095572 172.31.31.144 -> 172.31.23.72 OpenFlow 154 Type: OFPT_BARRIER_REQUEST
 58 0.291156388 172.31.23.72 -> 172.31.31.144 TCP 66 45416 → 6633 [ACK] Seq=49 Ack=233 Win=213 Len=0 TSval=19379579 TSecr=809454
 59 0.291165478 172.31.23.72 -> 172.31.31.144 OpenFlow 74 Type: OFPT_BARRIER_REPLY
 60 0.291173688 172.31.31.144 -> 172.31.23.72 OpenFlow 146 Type: OFPT_FLOW_MOD
 61 0.291176578 172.31.31.144 -> 172.31.23.72 TCP 154 6633 → 45434 [PSH, ACK] Seq=81 Ack=1 Win=853 Len=88 TSval=809454 TSecr=19379257
 62 0.291178709 172.31.31.144 -> 172.31.23.72 TCP 66 6633 → 45452 [ACK] Seq=169 Ack=9 Win=853 Len=0 TSval=809454 TSecr=19379579
 63 0.291182256 172.31.31.144 -> 172.31.23.72 TCP 146 6633 → 45454 [PSH, ACK] Seq=169 Ack=1 Win=853 Len=80 TSval=809454 TSecr=19379257
 64 0.291242638 172.31.31.144 -> 172.31.23.72 OpenFlow 146 Type: OFPT_FLOW_MOD
 65 0.291246508 172.31.31.144 -> 172.31.23.72 TCP 154 6633 → 45454 [PSH, ACK] Seq=249 Ack=1 Win=853 Len=88 TSval=809454 TSecr=19379257
 66 0.291255966 172.31.31.144 -> 172.31.23.72 OpenFlow 154 Type: OFPT_BARRIER_REQUEST
 67 0.291273581 172.31.23.72 -> 172.31.31.144 OpenFlow 74 Type: OFPT_BARRIER_REPLY
 68 0.291290185 172.31.31.144 -> 172.31.23.72 OpenFlow 146 Type: OFPT_FLOW_MOD
 69 0.291301967 172.31.23.72 -> 172.31.31.144 OpenFlow 74 Type: OFPT_BARRIER_REPLY
 70 0.291326906 172.31.31.144 -> 172.31.23.72 TCP 146 6633 → 45434 [PSH, ACK] Seq=169 Ack=1 Win=853 Len=80 TSval=809454 TSecr=19379257
 71 0.291350125 172.31.23.72 -> 172.31.31.144 OpenFlow 74 Type: OFPT_BARRIER_REPLY
 72 0.291368817 172.31.31.144 -> 172.31.23.72 OpenFlow 74 Type: OFPT_BARRIER_REQUEST
 73 0.291371671 172.31.31.144 -> 172.31.23.72 TCP 154 6633 → 45434 [PSH, ACK] Seq=249 Ack=1 Win=853 Len=88 TSval=809454 TSecr=19379257
 74 0.291378789 172.31.23.72 -> 172.31.31.144 OpenFlow 74 Type: OFPT_BARRIER_REPLY
 75 0.291404825 172.31.31.144 -> 172.31.23.72 OpenFlow 146 Type: OFPT_FLOW_MOD
 76 0.291442118 172.31.31.144 -> 172.31.23.72 OpenFlow 146 Type: OFPT_FLOW_MOD
 77 0.291445663 172.31.31.144 -> 172.31.23.72 OpenFlow 74 Type: OFPT_BARRIER_REQUEST
 78 0.291479485 172.31.31.144 -> 172.31.23.72 OpenFlow 146 Type: OFPT_FLOW_MOD
 79 0.291482026 172.31.31.144 -> 172.31.23.72 OpenFlow 146 Type: OFPT_FLOW_MOD
 80 0.291505114 172.31.31.144 -> 172.31.23.72 OpenFlow 146 Type: OFPT_FLOW_MOD
 81 0.291529262 172.31.31.144 -> 172.31.23.72 OpenFlow 146 Type: OFPT_FLOW_MOD
 82 0.291532726 172.31.31.144 -> 172.31.23.72 OpenFlow 146 Type: OFPT_FLOW_MOD
 83 0.291569104 172.31.31.144 -> 172.31.23.72 OpenFlow 74 Type: OFPT_BARRIER_REQUEST
 84 0.291572361 172.31.31.144 -> 172.31.23.72 OpenFlow 154 Type: OFPT_BARRIER_REQUEST
 85 0.291591358 172.31.31.144 -> 172.31.23.72 OpenFlow 154 Type: OFPT_BARRIER_REQUEST
 86 0.291620837 172.31.31.144 -> 172.31.23.72 OpenFlow 146 Type: OFPT_FLOW_MOD
 87 0.291626134 172.31.23.72 -> 172.31.31.144 OpenFlow 146 Type: OFPT_FLOW_REMOVED
 88 0.291642976 172.31.23.72 -> 172.31.31.144 OpenFlow 146 Type: OFPT_FLOW_REMOVED
 89 0.291648942 172.31.31.144 -> 172.31.23.72 OpenFlow 146 Type: OFPT_FLOW_MOD
 90 0.291654835 172.31.23.72 -> 172.31.31.144 OpenFlow 146 Type: OFPT_FLOW_REMOVED
 91 0.291660576 172.31.23.72 -> 172.31.31.144 OpenFlow 146 Type: OFPT_FLOW_REMOVED
 92 0.291669475 172.31.23.72 -> 172.31.31.144 OpenFlow 146 Type: OFPT_FLOW_REMOVED
 93 0.291677874 172.31.23.72 -> 172.31.31.144 OpenFlow 146 Type: OFPT_FLOW_REMOVED
 94 0.291690652 172.31.23.72 -> 172.31.31.144 OpenFlow 146 Type: OFPT_FLOW_REMOVED
 95 0.291736199 172.31.31.144 -> 172.31.23.72 OpenFlow 154 Type: OFPT_BARRIER_REQUEST
 96 0.291739922 172.31.31.144 -> 172.31.23.72 OpenFlow 74 Type: OFPT_BARRIER_REQUEST
 97 0.291741621 172.31.31.144 -> 172.31.23.72 TCP 146 6633 → 45458 [PSH, ACK] Seq=1 Ack=1 Win=853 Len=80 TSval=809454 TSecr=19379257
 98 0.291825420 172.31.23.72 -> 172.31.31.144 OpenFlow 146 Type: OFPT_FLOW_REMOVED
 99 0.291831229 172.31.23.72 -> 172.31.31.144 OpenFlow 146 Type: OFPT_FLOW_REMOVED
100 0.291932970 172.31.31.144 -> 172.31.23.72 TCP 146 6633 → 45460 [PSH, ACK] Seq=1 Ack=1 Win=853 Len=80 TSval=809454 TSecr=19379257
101 0.291937248 172.31.31.144 -> 172.31.23.72 TCP 146 6633 → 45434 [PSH, ACK] Seq=337 Ack=1 Win=853 Len=80 TSval=809454 TSecr=19379257
102 0.291939197 172.31.31.144 -> 172.31.23.72 TCP 66 6633 → 45452 [ACK] Seq=169 Ack=89 Win=853 Len=0 TSval=809454 TSecr=19379579
103 0.291942398 172.31.31.144 -> 172.31.23.72 TCP 154 6633 → 45458 [PSH, ACK] Seq=81 Ack=1 Win=853 Len=88 TSval=809454 TSecr=19379257
104 0.291944185 172.31.31.144 -> 172.31.23.72 TCP 154 6633 → 45434 [PSH, ACK] Seq=417 Ack=1 Win=853 Len=88 TSval=809454 TSecr=19379257
105 0.291945823 172.31.31.144 -> 172.31.23.72 TCP 154 6633 → 45460 [PSH, ACK] Seq=81 Ack=1 Win=853 Len=88 TSval=809454 TSecr=19379257
106 0.291947502 172.31.31.144 -> 172.31.23.72 OpenFlow 146 Type: OFPT_FLOW_MOD
107 0.291949430 172.31.31.144 -> 172.31.23.72 TCP 146 6633 → 45446 [PSH, ACK] Seq=1 Ack=1 Win=853 Len=80 TSval=809454 TSecr=19379257
108 0.291956639 172.31.23.72 -> 172.31.31.144 OpenFlow 306 Type: OFPT_FLOW_REMOVED
109 0.291962356 172.31.23.72 -> 172.31.31.144 OpenFlow 306 Type: OFPT_FLOW_REMOVED
110 0.292008128 172.31.31.144 -> 172.31.23.72 OpenFlow 146 Type: OFPT_FLOW_MOD
111 0.292011258 172.31.31.144 -> 172.31.23.72 TCP 66 6633 → 45452 [ACK] Seq=169 Ack=169 Win=853 Len=0 TSval=809454 TSecr=19379579
112 0.292013470 172.31.31.144 -> 172.31.23.72 OpenFlow 74 Type: OFPT_BARRIER_REQUEST
113 0.292015098 172.31.31.144 -> 172.31.23.72 OpenFlow 146 Type: OFPT_FLOW_MOD
114 0.292016966 172.31.31.144 -> 172.31.23.72 TCP 66 6633 → 45454 [ACK] Seq=505 Ack=17 Win=853 Len=0 TSval=809454 TSecr=19379579
115 0.292097807 172.31.31.144 -> 172.31.23.72 OpenFlow 154 Type: OFPT_BARRIER_REQUEST
116 0.292100518 172.31.31.144 -> 172.31.23.72 TCP 146 6633 → 45446 [PSH, ACK] Seq=81 Ack=1 Win=853 Len=80 TSval=809454 TSecr=19379257
117 0.292102433 172.31.31.144 -> 172.31.23.72 OpenFlow 146 Type: OFPT_FLOW_MOD
118 0.292105191 172.31.31.144 -> 172.31.23.72 OpenFlow 154 Type: OFPT_BARRIER_REQUEST
119 0.292109296 172.31.31.144 -> 172.31.23.72 TCP 66 6633 → 45442 [ACK] Seq=673 Ack=97 Win=853 Len=0 TSval=809454 TSecr=19379579
120 0.292138393 172.31.31.144 -> 172.31.23.72 TCP 74 6633 → 45446 [PSH, ACK] Seq=161 Ack=1 Win=853 Len=8 TSval=809454 TSecr=19379257
121 0.292153360 172.31.31.144 -> 172.31.23.72 OpenFlow 170 Type: OFPT_FLOW_MOD
122 0.292156371 172.31.31.144 -> 172.31.23.72 TCP 146 6633 → 45458 [PSH, ACK] Seq=169 Ack=1 Win=853 Len=80 TSval=809454 TSecr=19379257
123 0.292188593 172.31.31.144 -> 172.31.23.72 TCP 146 6633 → 45434 [PSH, ACK] Seq=505 Ack=1 Win=853 Len=80 TSval=809454 TSecr=19379257
124 0.292223899 172.31.31.144 -> 172.31.23.72 OpenFlow 146 Type: OFPT_FLOW_MOD
125 0.292253394 172.31.31.144 -> 172.31.23.72 TCP 154 6633 → 45458 [PSH, ACK] Seq=249 Ack=1 Win=853 Len=88 TSval=809454 TSecr=19379257
126 0.292255773 172.31.31.144 -> 172.31.23.72 OpenFlow 170 Type: OFPT_FLOW_MOD
127 0.292274102 172.31.31.144 -> 172.31.23.72 OpenFlow 74 Type: OFPT_BARRIER_REQUEST
128 0.292275958 172.31.31.144 -> 172.31.23.72 OpenFlow 146 Type: OFPT_FLOW_MOD
129 0.292304645 172.31.31.144 -> 172.31.23.72 OpenFlow 74 Type: OFPT_BARRIER_REQUEST
130 0.292331408 172.31.31.144 -> 172.31.23.72 TCP 146 6633 → 45434 [PSH, ACK] Seq=585 Ack=1 Win=853 Len=80 TSval=809454 TSecr=19379257
131 0.292345056 172.31.31.144 -> 172.31.23.72 OpenFlow 170 Type: OFPT_FLOW_MOD
132 0.292358768 172.31.31.144 -> 172.31.23.72 TCP 74 6633 → 45434 [PSH, ACK] Seq=665 Ack=1 Win=853 Len=8 TSval=809454 TSecr=19379257
133 0.292389840 172.31.31.144 -> 172.31.23.72 OpenFlow 146 Type: OFPT_FLOW_MOD
134 0.292418388 172.31.31.144 -> 172.31.23.72 OpenFlow 154 Type: OFPT_BARRIER_REQUEST
135 0.292449105 172.31.31.144 -> 172.31.23.72 TCP 146 6633 → 45446 [PSH, ACK] Seq=169 Ack=1 Win=853 Len=80 TSval=809454 TSecr=19379257
136 0.292478014 172.31.31.144 -> 172.31.23.72 TCP 154 6633 → 45446 [PSH, ACK] Seq=249 Ack=1 Win=853 Len=88 TSval=809454 TSecr=19379257
137 0.292508655 172.31.31.144 -> 172.31.23.72 OpenFlow 146 Type: OFPT_FLOW_MOD
138 0.292536724 172.31.31.144 -> 172.31.23.72 OpenFlow 146 Type: OFPT_FLOW_MOD
139 0.292572717 172.31.31.144 -> 172.31.23.72 OpenFlow 154 Type: OFPT_BARRIER_REQUEST
140 0.292611848 172.31.31.144 -> 172.31.23.72 OpenFlow 154 Type: OFPT_BARRIER_REQUEST
141 0.292656880 172.31.31.144 -> 172.31.23.72 OpenFlow 146 Type: OFPT_FLOW_MOD
142 0.292691631 172.31.31.144 -> 172.31.23.72 OpenFlow 146 Type: OFPT_FLOW_MOD
143 0.292726384 172.31.31.144 -> 172.31.23.72 TCP 146 6633 → 45434 [PSH, ACK] Seq=673 Ack=1 Win=853 Len=80 TSval=809454 TSecr=19379257
144 0.292779429 172.31.31.144 -> 172.31.23.72 OpenFlow 146 Type: OFPT_FLOW_MOD
145 0.292814142 172.31.31.144 -> 172.31.23.72 OpenFlow 154 Type: OFPT_BARRIER_REQUEST
146 0.292842450 172.31.31.144 -> 172.31.23.72 OpenFlow 146 Type: OFPT_FLOW_MOD
147 0.292867953 172.31.31.144 -> 172.31.23.72 OpenFlow 154 Type: OFPT_BARRIER_REQUEST
148 0.292895420 172.31.31.144 -> 172.31.23.72 OpenFlow 146 Type: OFPT_FLOW_MOD
149 0.292922462 172.31.31.144 -> 172.31.23.72 TCP 66 6633 → 45416 [ACK] Seq=569 Ack=217 Win=853 Len=0 TSval=809455 TSecr=19379579
150 0.292950297 172.31.31.144 -> 172.31.23.72 OpenFlow 146 Type: OFPT_FLOW_MOD
151 0.292978448 172.31.31.144 -> 172.31.23.72 OpenFlow 74 Type: OFPT_BARRIER_REQUEST
152 0.293005677 172.31.31.144 -> 172.31.23.72 TCP 66 6633 → 45442 [ACK] Seq=1009 Ack=417 Win=853 Len=0 TSval=809455 TSecr=19379579
153 0.293035804 172.31.31.144 -> 172.31.23.72 OpenFlow 282 Type: OFPT_BARRIER_REQUEST
154 0.293074244 172.31.31.144 -> 172.31.23.72 OpenFlow 170 Type: OFPT_FLOW_MOD
155 0.294347852 172.31.23.72 -> 172.31.31.144 OpenFlow 74 Type: OFPT_BARRIER_REPLY
156 0.294410566 172.31.23.72 -> 172.31.31.144 OpenFlow 74 Type: OFPT_BARRIER_REPLY
157 0.294434073 172.31.23.72 -> 172.31.31.144 OpenFlow 74 Type: OFPT_BARRIER_REPLY
158 0.294458682 172.31.23.72 -> 172.31.31.144 OpenFlow 82 Type: OFPT_BARRIER_REPLY
159 0.294487063 172.31.23.72 -> 172.31.31.144 OpenFlow 74 Type: OFPT_BARRIER_REPLY
160 0.294505292 172.31.23.72 -> 172.31.31.144 OpenFlow 74 Type: OFPT_BARRIER_REPLY
161 0.294544037 172.31.23.72 -> 172.31.31.144 OpenFlow 74 Type: OFPT_BARRIER_REPLY
162 0.294578614 172.31.23.72 -> 172.31.31.144 OpenFlow 74 Type: OFPT_BARRIER_REPLY
163 0.294604376 172.31.23.72 -> 172.31.31.144 OpenFlow 74 Type: OFPT_BARRIER_REPLY
164 0.294625058 172.31.31.144 -> 172.31.23.72 OpenFlow 154 Type: OFPT_BARRIER_REQUEST
165 0.294633524 172.31.23.72 -> 172.31.31.144 OpenFlow 74 Type: OFPT_BARRIER_REPLY
166 0.294649603 172.31.31.144 -> 172.31.23.72 OpenFlow 242 Type: OFPT_BARRIER_REQUEST
167 0.294661655 172.31.23.72 -> 172.31.31.144 OpenFlow 74 Type: OFPT_BARRIER_REPLY
168 0.294672427 172.31.31.144 -> 172.31.23.72 TCP 66 6633 → 45434 [ACK] Seq=841 Ack=33 Win=853 Len=0 TSval=809455 TSecr=19379580
169 0.294691470 172.31.23.72 -> 172.31.31.144 OpenFlow 74 Type: OFPT_BARRIER_REPLY
170 0.294714716 172.31.23.72 -> 172.31.31.144 OpenFlow 74 Type: OFPT_BARRIER_REPLY
171 0.294736617 172.31.31.144 -> 172.31.23.72 TCP 66 6633 → 45424 [ACK] Seq=905 Ack=73 Win=853 Len=0 TSval=809455 TSecr=19379580
172 0.294767556 172.31.23.72 -> 172.31.31.144 OpenFlow 74 Type: OFPT_BARRIER_REPLY
173 0.294789727 172.31.23.72 -> 172.31.31.144 OpenFlow 74 Type: OFPT_BARRIER_REPLY
174 0.294818234 172.31.23.72 -> 172.31.31.144 OpenFlow 74 Type: OFPT_BARRIER_REPLY
175 0.294838007 172.31.31.144 -> 172.31.23.72 TCP 66 6633 → 45444 [ACK] Seq=1009 Ack=265 Win=853 Len=0 TSval=809455 TSecr=19379579
176 0.294844176 172.31.23.72 -> 172.31.31.144 OpenFlow 74 Type: OFPT_BARRIER_REPLY
177 0.294863669 172.31.31.144 -> 172.31.23.72 TCP 66 6633 → 45418 [ACK] Seq=233 Ack=137 Win=853 Len=0 TSval=809455 TSecr=19379579
178 0.294886534 172.31.23.72 -> 172.31.31.144 TCP 66 45460 → 6633 [ACK] Seq=1 Ack=169 Win=213 Len=0 TSval=19379580 TSecr=809454
179 0.294891345 172.31.31.144 -> 172.31.23.72 TCP 66 6633 → 45444 [ACK] Seq=1009 Ack=289 Win=853 Len=0 TSval=809455 TSecr=19379580
180 0.294902452 172.31.23.72 -> 172.31.31.144 OpenFlow 74 Type: OFPT_BARRIER_REPLY
181 0.294936890 172.31.23.72 -> 172.31.31.144 OpenFlow 74 Type: OFPT_BARRIER_REPLY
182 0.294955325 172.31.23.72 -> 172.31.31.144 OpenFlow 74 Type: OFPT_BARRIER_REPLY
183 0.294976865 172.31.31.144 -> 172.31.23.72 TCP 66 6633 → 45416 [ACK] Seq=569 Ack=233 Win=853 Len=0 TSval=809455 TSecr=19379580
184 0.294994794 172.31.23.72 -> 172.31.31.144 OpenFlow 74 Type: OFPT_BARRIER_REPLY
185 0.295002565 172.31.31.144 -> 172.31.23.72 TCP 66 6633 → 45446 [ACK] Seq=337 Ack=9 Win=853 Len=0 TSval=809455 TSecr=19379580
186 0.295022317 172.31.23.72 -> 172.31.31.144 OpenFlow 74 Type: OFPT_BARRIER_REPLY
187 0.295040439 172.31.31.144 -> 172.31.23.72 TCP 66 6633 → 45446 [ACK] Seq=337 Ack=17 Win=853 Len=0 TSval=809455 TSecr=19379580
188 0.295057195 172.31.23.72 -> 172.31.31.144 OpenFlow 74 Type: OFPT_BARRIER_REPLY
189 0.295078701 172.31.23.72 -> 172.31.31.144 OpenFlow 74 Type: OFPT_BARRIER_REPLY
190 0.295101404 172.31.23.72 -> 172.31.31.144 OpenFlow 74 Type: OFPT_BARRIER_REPLY
191 0.295137322 172.31.23.72 -> 172.31.31.144 OpenFlow 74 Type: OFPT_BARRIER_REPLY
192 0.295157866 172.31.23.72 -> 172.31.31.144 OpenFlow 74 Type: OFPT_BARRIER_REPLY
193 0.295182920 172.31.31.144 -> 172.31.23.72 TCP 66 6633 → 45458 [ACK] Seq=337 Ack=17 Win=853 Len=0 TSval=809455 TSecr=19379580
194 0.295188818 172.31.23.72 -> 172.31.31.144 OpenFlow 82 Type: OFPT_BARRIER_REPLY
195 0.295206571 172.31.31.144 -> 172.31.23.72 TCP 66 6633 → 45414 [ACK] Seq=401 Ack=65 Win=853 Len=0 TSval=809455 TSecr=19379580
196 0.295230214 172.31.31.144 -> 172.31.23.72 TCP 66 6633 → 45454 [ACK] Seq=993 Ack=353 Win=853 Len=0 TSval=809455 TSecr=19379580
197 0.295258093 172.31.31.144 -> 172.31.23.72 TCP 170 6633 → 45426 [PSH, ACK] Seq=1 Ack=1 Win=853 Len=104 TSval=809455 TSecr=19379282
198 0.295288669 172.31.31.144 -> 172.31.23.72 TCP 170 6633 → 45430 [PSH, ACK] Seq=1 Ack=1 Win=853 Len=104 TSval=809455 TSecr=19379282
199 0.295314452 172.31.31.144 -> 172.31.23.72 OpenFlow 170 Type: OFPT_FLOW_MOD
200 0.295342653 172.31.31.144 -> 172.31.23.72 TCP 170 6633 → 45436 [PSH, ACK] Seq=1 Ack=1 Win=853 Len=104 TSval=809455 TSecr=19379233
201 0.295371057 172.31.31.144 -> 172.31.23.72 TCP 178 6633 → 45426 [PSH, ACK] Seq=105 Ack=1 Win=853 Len=112 TSval=809455 TSecr=19379282
202 0.295399590 172.31.31.144 -> 172.31.23.72 OpenFlow 178 Type: OFPT_BARRIER_REQUEST
203 0.295409052 172.31.23.72 -> 172.31.31.144 OpenFlow 146 Type: OFPT_FLOW_REMOVED
204 0.295430112 172.31.31.144 -> 172.31.23.72 TCP 178 6633 → 45430 [PSH, ACK] Seq=105 Ack=1 Win=853 Len=112 TSval=809455 TSecr=19379282
205 0.295434161 172.31.23.72 -> 172.31.31.144 OpenFlow 386 Type: OFPT_FLOW_REMOVED
206 0.295456592 172.31.31.144 -> 172.31.23.72 OpenFlow 170 Type: OFPT_FLOW_MOD
207 0.295460504 172.31.23.72 -> 172.31.31.144 OpenFlow 386 Type: OFPT_FLOW_REMOVED
208 0.295465194 172.31.23.72 -> 172.31.31.144 OpenFlow 146 Type: OFPT_FLOW_REMOVED
209 0.295479728 172.31.31.144 -> 172.31.23.72 TCP 178 6633 → 45436 [PSH, ACK] Seq=105 Ack=1 Win=853 Len=112 TSval=809455 TSecr=19379233
210 0.295492356 172.31.23.72 -> 172.31.31.144 OpenFlow 146 Type: OFPT_FLOW_REMOVED
211 0.295500499 172.31.23.72 -> 172.31.31.144 OpenFlow 146 Type: OFPT_FLOW_REMOVED
212 0.295502541 172.31.23.72 -> 172.31.31.144 OpenFlow 626 Type: OFPT_FLOW_REMOVED
213 0.295524650 172.31.31.144 -> 172.31.23.72 OpenFlow 178 Type: OFPT_BARRIER_REQUEST
214 0.295531586 172.31.23.72 -> 172.31.31.144 OpenFlow 146 Type: OFPT_FLOW_REMOVED
215 0.295546083 172.31.23.72 -> 172.31.31.144 OpenFlow 146 Type: OFPT_FLOW_REMOVED
216 0.295548005 172.31.23.72 -> 172.31.31.144 OpenFlow 786 Type: OFPT_FLOW_REMOVED
217 0.295559215 172.31.23.72 -> 172.31.31.144 OpenFlow 146 Type: OFPT_FLOW_REMOVED
218 0.295566655 172.31.23.72 -> 172.31.31.144 OpenFlow 146 Type: OFPT_FLOW_REMOVED
219 0.295578228 172.31.23.72 -> 172.31.31.144 OpenFlow 146 Type: OFPT_FLOW_REMOVED
220 0.295589137 172.31.23.72 -> 172.31.31.144 OpenFlow 146 Type: OFPT_FLOW_REMOVED
221 0.295594882 172.31.31.144 -> 172.31.23.72 TCP 66 6633 → 45442 [ACK] Seq=1009 Ack=449 Win=853 Len=0 TSval=809455 TSecr=19379580
222 0.295598274 172.31.31.144 -> 172.31.23.72 OpenFlow 170 Type: OFPT_FLOW_MOD
223 0.295600522 172.31.31.144 -> 172.31.23.72 OpenFlow 178 Type: OFPT_BARRIER_REQUEST
224 0.295613357 172.31.23.72 -> 172.31.31.144 OpenFlow 146 Type: OFPT_FLOW_REMOVED
225 0.295618489 172.31.23.72 -> 172.31.31.144 OpenFlow 306 Type: OFPT_FLOW_REMOVED
226 0.295705891 172.31.23.72 -> 172.31.31.144 OpenFlow 306 Type: OFPT_FLOW_REMOVED
227 0.295708437 172.31.23.72 -> 172.31.31.144 OpenFlow 146 Type: OFPT_FLOW_REMOVED
228 0.295710325 172.31.23.72 -> 172.31.31.144 OpenFlow 306 Type: OFPT_FLOW_REMOVED
229 0.295712083 172.31.23.72 -> 172.31.31.144 OpenFlow 306 Type: OFPT_FLOW_REMOVED
230 0.295750016 172.31.31.144 -> 172.31.23.72 TCP 66 6633 → 45434 [ACK] Seq=841 Ack=433 Win=853 Len=0 TSval=809455 TSecr=19379580
231 0.295754167 172.31.31.144 -> 172.31.23.72 OpenFlow 170 Type: OFPT_FLOW_MOD
232 0.295756751 172.31.31.144 -> 172.31.23.72 OpenFlow 170 Type: OFPT_FLOW_MOD
233 0.295758590 172.31.31.144 -> 172.31.23.72 OpenFlow 170 Type: OFPT_FLOW_MOD
234 0.295762990 172.31.23.72 -> 172.31.31.144 OpenFlow 306 Type: OFPT_FLOW_REMOVED
235 0.295769355 172.31.23.72 -> 172.31.31.144 OpenFlow 626 Type: OFPT_FLOW_REMOVED
236 0.295884802 172.31.31.144 -> 172.31.23.72 TCP 66 6633 → 45424 [ACK] Seq=905 Ack=713 Win=853 Len=0 TSval=809455 TSecr=19379580
237 0.295888343 172.31.31.144 -> 172.31.23.72 OpenFlow 170 Type: OFPT_FLOW_MOD
238 0.295890379 172.31.31.144 -> 172.31.23.72 OpenFlow 170 Type: OFPT_FLOW_MOD
239 0.295892799 172.31.31.144 -> 172.31.23.72 OpenFlow 170 Type: OFPT_FLOW_MOD
240 0.295894189 172.31.31.144 -> 172.31.23.72 OpenFlow 74 Type: OFPT_BARRIER_REQUEST
241 0.295934047 172.31.31.144 -> 172.31.23.72 TCP 66 6633 → 45446 [ACK] Seq=337 Ack=97 Win=853 Len=0 TSval=809455 TSecr=19379580
242 0.295936943 172.31.31.144 -> 172.31.23.72 OpenFlow 74 Type: OFPT_BARRIER_REQUEST
243 0.295951677 172.31.31.144 -> 172.31.23.72 OpenFlow 170 Type: OFPT_FLOW_MOD
244 0.295981843 172.31.31.144 -> 172.31.23.72 OpenFlow 170 Type: OFPT_FLOW_MOD
245 0.295985160 172.31.31.144 -> 172.31.23.72 OpenFlow 170 Type: OFPT_FLOW_MOD
246 0.296014314 172.31.31.144 -> 172.31.23.72 OpenFlow 74 Type: OFPT_BARRIER_REQUEST
247 0.296049970 172.31.31.144 -> 172.31.23.72 OpenFlow 74 Type: OFPT_BARRIER_REQUEST
248 0.296080189 172.31.31.144 -> 172.31.23.72 TCP 170 6633 → 45432 [PSH, ACK] Seq=1 Ack=1 Win=853 Len=104 TSval=809455 TSecr=19379256
249 0.296097874 172.31.31.144 -> 172.31.23.72 OpenFlow 170 Type: OFPT_FLOW_MOD
250 0.296109179 172.31.31.144 -> 172.31.23.72 TCP 66 6633 → 45460 [ACK] Seq=169 Ack=89 Win=853 Len=0 TSval=809455 TSecr=19379580
251 0.296127676 172.31.31.144 -> 172.31.23.72 OpenFlow 74 Type: OFPT_BARRIER_REQUEST
252 0.296138334 172.31.31.144 -> 172.31.23.72 TCP 178 6633 → 45432 [PSH, ACK] Seq=105 Ack=1 Win=853 Len=112 TSval=809455 TSecr=19379256
253 0.296166426 172.31.31.144 -> 172.31.23.72 TCP 170 6633 → 45430 [PSH, ACK] Seq=217 Ack=1 Win=853 Len=104 TSval=809455 TSecr=19379282
254 0.296194497 172.31.31.144 -> 172.31.23.72 OpenFlow 170 Type: OFPT_FLOW_MOD
255 0.296221520 172.31.31.144 -> 172.31.23.72 TCP 170 6633 → 45462 [PSH, ACK] Seq=1 Ack=1 Win=853 Len=104 TSval=809455 TSecr=19379257
256 0.296252973 172.31.31.144 -> 172.31.23.72 TCP 66 6633 → 45446 [ACK] Seq=337 Ack=337 Win=853 Len=0 TSval=809455 TSecr=19379580
257 0.296283153 172.31.31.144 -> 172.31.23.72 TCP 178 6633 → 45462 [PSH, ACK] Seq=105 Ack=1 Win=853 Len=112 TSval=809455 TSecr=19379257
258 0.296311434 172.31.31.144 -> 172.31.23.72 TCP 170 6633 → 45448 [PSH, ACK] Seq=1 Ack=1 Win=853 Len=104 TSval=809455 TSecr=19379257
259 0.296339341 172.31.31.144 -> 172.31.23.72 OpenFlow 170 Type: OFPT_FLOW_MOD
260 0.296367257 172.31.31.144 -> 172.31.23.72 TCP 170 6633 → 45430 [PSH, ACK] Seq=321 Ack=1 Win=853 Len=104 TSval=809455 TSecr=19379282
261 0.296396110 172.31.31.144 -> 172.31.23.72 OpenFlow 170 Type: OFPT_FLOW_MOD
262 0.296424195 172.31.31.144 -> 172.31.23.72 OpenFlow 170 Type: OFPT_FLOW_MOD
263 0.296452046 172.31.31.144 -> 172.31.23.72 OpenFlow 74 Type: OFPT_BARRIER_REQUEST
264 0.296481735 172.31.31.144 -> 172.31.23.72 TCP 74 6633 → 45430 [PSH, ACK] Seq=425 Ack=1 Win=853 Len=8 TSval=809455 TSecr=19379282
265 0.296509572 172.31.31.144 -> 172.31.23.72 TCP 66 6633 → 45454 [ACK] Seq=1425 Ack=681 Win=853 Len=0 TSval=809455 TSecr=19379580
266 0.296538128 172.31.31.144 -> 172.31.23.72 TCP 178 6633 → 45448 [PSH, ACK] Seq=105 Ack=1 Win=853 Len=112 TSval=809455 TSecr=19379257
267 0.296567477 172.31.31.144 -> 172.31.23.72 TCP 66 6633 → 45458 [ACK] Seq=337 Ack=337 Win=853 Len=0 TSval=809455 TSecr=19379580
268 0.296579862 172.31.31.144 -> 172.31.23.72 OpenFlow 170 Type: OFPT_FLOW_MOD
269 0.296596151 172.31.31.144 -> 172.31.23.72 TCP 66 6633 → 45442 [ACK] Seq=1009 Ack=1089 Win=853 Len=0 TSval=809455 TSecr=19379580
270 0.296608984 172.31.31.144 -> 172.31.23.72 OpenFlow 170 Type: OFPT_FLOW_MOD
271 0.296625965 172.31.31.144 -> 172.31.23.72 OpenFlow 170 Type: OFPT_FLOW_MOD
272 0.296655510 172.31.31.144 -> 172.31.23.72 OpenFlow 170 Type: OFPT_FLOW_MOD
273 0.296686302 172.31.31.144 -> 172.31.23.72 OpenFlow 274 Type: OFPT_FLOW_MOD
274 0.296713823 172.31.31.144 -> 172.31.23.72 OpenFlow 170 Type: OFPT_FLOW_MOD
275 0.296741768 172.31.31.144 -> 172.31.23.72 OpenFlow 178 Type: OFPT_FLOW_MOD
276 0.296776717 172.31.31.144 -> 172.31.23.72 OpenFlow 170 Type: OFPT_FLOW_MOD
277 0.296808081 172.31.31.144 -> 172.31.23.72 TCP 170 6633 → 45436 [PSH, ACK] Seq=217 Ack=1 Win=853 Len=104 TSval=809456 TSecr=19379233
278 0.296836055 172.31.31.144 -> 172.31.23.72 OpenFlow 170 Type: OFPT_FLOW_MOD
279 0.296865245 172.31.31.144 -> 172.31.23.72 TCP 178 6633 → 45436 [PSH, ACK] Seq=321 Ack=1 Win=853 Len=112 TSval=809456 TSecr=19379233
280 0.296893094 172.31.31.144 -> 172.31.23.72 OpenFlow 170 Type: OFPT_FLOW_MOD
281 0.296920813 172.31.31.144 -> 172.31.23.72 OpenFlow 170 Type: OFPT_FLOW_MOD
282 0.296949283 172.31.31.144 -> 172.31.23.72 OpenFlow 170 Type: OFPT_FLOW_MOD
283 0.296977035 172.31.31.144 -> 172.31.23.72 OpenFlow 170 Type: OFPT_FLOW_MOD
284 0.297004437 172.31.31.144 -> 172.31.23.72 OpenFlow 170 Type: OFPT_FLOW_MOD
285 0.297032778 172.31.31.144 -> 172.31.23.72 OpenFlow 178 Type: OFPT_FLOW_MOD
286 0.297563054 172.31.23.72 -> 172.31.31.144 TCP 66 45462 → 6633 [ACK] Seq=1 Ack=217 Win=213 Len=0 TSval=19379581 TSecr=809455
287 0.297574901 172.31.23.72 -> 172.31.31.144 OpenFlow 74 Type: OFPT_BARRIER_REPLY
288 0.297601516 172.31.23.72 -> 172.31.31.144 OpenFlow 74 Type: OFPT_BARRIER_REPLY
289 0.297634464 172.31.23.72 -> 172.31.31.144 OpenFlow 74 Type: OFPT_BARRIER_REPLY
290 0.297660491 172.31.23.72 -> 172.31.31.144 OpenFlow 74 Type: OFPT_BARRIER_REPLY
291 0.297682399 172.31.23.72 -> 172.31.31.144 OpenFlow 74 Type: OFPT_BARRIER_REPLY
292 0.297706902 172.31.23.72 -> 172.31.31.144 OpenFlow 74 Type: OFPT_BARRIER_REPLY
293 0.297726020 172.31.23.72 -> 172.31.31.144 OpenFlow 74 Type: OFPT_BARRIER_REPLY
294 0.297746159 172.31.23.72 -> 172.31.31.144 OpenFlow 74 Type: OFPT_BARRIER_REPLY
295 0.297773668 172.31.23.72 -> 172.31.31.144 OpenFlow 74 Type: OFPT_BARRIER_REPLY
296 0.297790743 172.31.31.144 -> 172.31.23.72 TCP 66 6633 → 45436 [ACK] Seq=433 Ack=9 Win=853 Len=0 TSval=809456 TSecr=19379581
297 0.297813632 172.31.31.144 -> 172.31.23.72 TCP 66 6633 → 45436 [ACK] Seq=433 Ack=17 Win=853 Len=0 TSval=809456 TSecr=19379581
298 0.297829628 172.31.23.72 -> 172.31.31.144 OpenFlow 74 Type: OFPT_BARRIER_REPLY
299 0.297865224 172.31.23.72 -> 172.31.31.144 OpenFlow 74 Type: OFPT_BARRIER_REPLY
300 0.297885975 172.31.23.72 -> 172.31.31.144 OpenFlow 74 Type: OFPT_BARRIER_REPLY
301 0.297909545 172.31.31.144 -> 172.31.23.72 TCP 66 6633 → 45424 [ACK] Seq=1649 Ack=729 Win=853 Len=0 TSval=809456 TSecr=19379581
302 0.297932265 172.31.31.144 -> 172.31.23.72 TCP 66 6633 → 45434 [ACK] Seq=1161 Ack=769 Win=853 Len=0 TSval=809456 TSecr=19379581
303 0.297947443 172.31.31.144 -> 172.31.23.72 TCP 66 6633 → 45424 [ACK] Seq=1649 Ack=745 Win=853 Len=0 TSval=809456 TSecr=19379581
304 0.297959349 172.31.23.72 -> 172.31.31.144 OpenFlow 74 Type: OFPT_BARRIER_REPLY
305 0.297981877 172.31.23.72 -> 172.31.31.144 OpenFlow 74 Type: OFPT_BARRIER_REPLY
306 0.298015938 172.31.23.72 -> 172.31.31.144 OpenFlow 74 Type: OFPT_BARRIER_REPLY
307 0.298057560 172.31.23.72 -> 172.31.31.144 TCP 66 45432 → 6633 [ACK] Seq=1 Ack=217 Win=213 Len=0 TSval=19379581 TSecr=809455
308 0.298065566 172.31.23.72 -> 172.31.31.144 OpenFlow 74 Type: OFPT_BARRIER_REPLY
309 0.298087656 172.31.23.72 -> 172.31.31.144 OpenFlow 74 Type: OFPT_BARRIER_REPLY
310 0.298130982 172.31.23.72 -> 172.31.31.144 OpenFlow 74 Type: OFPT_BARRIER_REPLY
311 0.298194812 172.31.23.72 -> 172.31.31.144 OpenFlow 74 Type: OFPT_BARRIER_REPLY
312 0.298219001 172.31.31.144 -> 172.31.23.72 TCP 66 6633 → 45432 [ACK] Seq=217 Ack=9 Win=853 Len=0 TSval=809456 TSecr=19379581
313 0.298226698 172.31.23.72 -> 172.31.31.144 OpenFlow 74 Type: OFPT_BARRIER_REPLY
314 0.298268585 172.31.23.72 -> 172.31.31.144 TCP 66 45448 → 6633 [ACK] Seq=1 Ack=217 Win=213 Len=0 TSval=19379581 TSecr=809455
315 0.298277286 172.31.23.72 -> 172.31.31.144 OpenFlow 74 Type: OFPT_BARRIER_REPLY
316 0.298304171 172.31.23.72 -> 172.31.31.144 TCP 66 45426 → 6633 [ACK] Seq=1 Ack=217 Win=213 Len=0 TSval=19379581 TSecr=809455
317 0.298316574 172.31.23.72 -> 172.31.31.144 OpenFlow 74 Type: OFPT_BARRIER_REPLY
318 0.298439561 172.31.23.72 -> 172.31.31.144 OpenFlow 146 Type: OFPT_FLOW_REMOVED
319 0.298451956 172.31.23.72 -> 172.31.31.144 OpenFlow 146 Type: OFPT_FLOW_REMOVED
320 0.298486549 172.31.23.72 -> 172.31.31.144 OpenFlow 146 Type: OFPT_FLOW_REMOVED
321 0.298508362 172.31.31.144 -> 172.31.23.72 TCP 66 6633 → 45426 [ACK] Seq=217 Ack=9 Win=853 Len=0 TSval=809456 TSecr=19379581
322 0.309393419 172.31.23.72 -> 172.31.31.144 TCP 146 [TCP Retransmission] 45424 → 6633 [PSH, ACK] Seq=825 Ack=1649 Win=213 Len=80 TSval=19379584 TSecr=809456
323 0.309402749 172.31.23.72 -> 172.31.31.144 TCP 74 [TCP Retransmission] 45454 → 6633 [PSH, ACK] Seq=689 Ack=1633 Win=213 Len=8 TSval=19379584 TSecr=809455
324 0.309405431 172.31.23.72 -> 172.31.31.144 TCP 74 [TCP Retransmission] 45430 → 6633 [PSH, ACK] Seq=9 Ack=433 Win=213 Len=8 TSval=19379584 TSecr=809455
325 0.309407515 172.31.23.72 -> 172.31.31.144 TCP 74 [TCP Retransmission] 45444 → 6633 [PSH, ACK] Seq=1097 Ack=1649 Win=213 Len=8 TSval=19379584 TSecr=809455
326 0.310569104 172.31.31.144 -> 172.31.23.72 TCP 78 6633 → 45424 [ACK] Seq=1649 Ack=905 Win=853 Len=0 TSval=809459 TSecr=19379581 SLE=825 SRE=905
327 0.310580850 172.31.31.144 -> 172.31.23.72 TCP 78 6633 → 45454 [ACK] Seq=1633 Ack=697 Win=853 Len=0 TSval=809459 TSecr=19379581 SLE=689 SRE=697
328 0.310611662 172.31.31.144 -> 172.31.23.72 TCP 78 6633 → 45430 [ACK] Seq=433 Ack=17 Win=853 Len=0 TSval=809459 TSecr=19379581 SLE=9 SRE=17
329 0.310643252 172.31.31.144 -> 172.31.23.72 TCP 78 6633 → 45444 [ACK] Seq=1649 Ack=1105 Win=853 Len=0 TSval=809459 TSecr=19379581 SLE=1097 SRE=1105
330 0.324189462 172.31.31.144 -> 172.31.23.72 OpenFlow 90 Type: OFPT_MULTIPART_REQUEST, OFPMP_GROUP
331 0.324211245 172.31.31.144 -> 172.31.23.72 OpenFlow 106 Type: OFPT_MULTIPART_REQUEST, OFPMP_METER
332 0.324421004 172.31.23.72 -> 172.31.31.144 OpenFlow 82 Type: OFPT_MULTIPART_REPLY, OFPMP_GROUP
333 0.324428155 172.31.31.144 -> 172.31.23.72 OpenFlow 170 Type: OFPT_FLOW_MOD
334 0.324459008 172.31.31.144 -> 172.31.23.72 OpenFlow 170 Type: OFPT_FLOW_MOD
335 0.324467464 172.31.23.72 -> 172.31.31.144 OpenFlow 98 Type: OFPT_MULTIPART_REPLY, OFPMP_METER
336 0.324506555 172.31.31.144 -> 172.31.23.72 OpenFlow 170 Type: OFPT_FLOW_MOD
337 0.324543705 172.31.31.144 -> 172.31.23.72 OpenFlow 178 Type: OFPT_BARRIER_REQUEST
338 0.324546781 172.31.31.144 -> 172.31.23.72 OpenFlow 170 Type: OFPT_FLOW_MOD
339 0.324550379 172.31.31.144 -> 172.31.23.72 OpenFlow 178 Type: OFPT_BARRIER_REQUEST
340 0.324562623 172.31.31.144 -> 172.31.23.72 OpenFlow 170 Type: OFPT_FLOW_MOD
341 0.324581366 172.31.31.144 -> 172.31.23.72 OpenFlow 178 Type: OFPT_BARRIER_REQUEST
342 0.324584589 172.31.31.144 -> 172.31.23.72 OpenFlow 178 Type: OFPT_BARRIER_REQUEST
343 0.324621431 172.31.31.144 -> 172.31.23.72 OpenFlow 178 Type: OFPT_BARRIER_REQUEST
344 0.324625280 172.31.31.144 -> 172.31.23.72 OpenFlow 170 Type: OFPT_FLOW_MOD
345 0.324648420 172.31.31.144 -> 172.31.23.72 OpenFlow 170 Type: OFPT_FLOW_MOD
346 0.324653876 172.31.23.72 -> 172.31.31.144 TCP 66 45452 → 6633 [ACK] Seq=177 Ack=705 Win=213 Len=0 TSval=19379587 TSecr=809463
347 0.324664949 172.31.23.72 -> 172.31.31.144 OpenFlow 74 Type: OFPT_BARRIER_REPLY
348 0.324680623 172.31.31.144 -> 172.31.23.72 OpenFlow 178 Type: OFPT_BARRIER_REQUEST
349 0.324683752 172.31.31.144 -> 172.31.23.72 OpenFlow 170 Type: OFPT_FLOW_MOD
350 0.324727907 172.31.23.72 -> 172.31.31.144 TCP 66 45434 → 6633 [ACK] Seq=849 Ack=1377 Win=213 Len=0 TSval=19379587 TSecr=809463
351 0.324736405 172.31.23.72 -> 172.31.31.144 OpenFlow 74 Type: OFPT_BARRIER_REPLY
352 0.324754809 172.31.31.144 -> 172.31.23.72 OpenFlow 170 Type: OFPT_FLOW_MOD
353 0.324757907 172.31.31.144 -> 172.31.23.72 OpenFlow 74 Type: OFPT_BARRIER_REQUEST
354 0.324760638 172.31.31.144 -> 172.31.23.72 OpenFlow 170 Type: OFPT_FLOW_MOD
355 0.324774334 172.31.23.72 -> 172.31.31.144 TCP 66 45424 → 6633 [ACK] Seq=905 Ack=1865 Win=213 Len=0 TSval=19379587 TSecr=809463
356 0.324783653 172.31.23.72 -> 172.31.31.144 OpenFlow 74 Type: OFPT_BARRIER_REPLY
357 0.324820444 172.31.31.144 -> 172.31.23.72 OpenFlow 170 Type: OFPT_FLOW_MOD
358 0.324823790 172.31.31.144 -> 172.31.23.72 OpenFlow 178 Type: OFPT_BARRIER_REQUEST
359 0.324857251 172.31.23.72 -> 172.31.31.144 TCP 66 45416 → 6633 [ACK] Seq=561 Ack=1209 Win=213 Len=0 TSval=19379587 TSecr=809463
360 0.324865971 172.31.23.72 -> 172.31.31.144 OpenFlow 74 Type: OFPT_BARRIER_REPLY
361 0.324892046 172.31.31.144 -> 172.31.23.72 OpenFlow 170 Type: OFPT_FLOW_MOD
362 0.324895873 172.31.31.144 -> 172.31.23.72 OpenFlow 170 Type: OFPT_FLOW_MOD
363 0.324897637 172.31.31.144 -> 172.31.23.72 OpenFlow 170 Type: OFPT_FLOW_MOD
364 0.324902648 172.31.23.72 -> 172.31.31.144 TCP 66 45446 → 6633 [ACK] Seq=337 Ack=553 Win=213 Len=0 TSval=19379587 TSecr=809463
365 0.324912014 172.31.23.72 -> 172.31.31.144 OpenFlow 74 Type: OFPT_BARRIER_REPLY
366 0.324944265 172.31.23.72 -> 172.31.31.144 TCP 66 45458 → 6633 [ACK] Seq=337 Ack=553 Win=213 Len=0 TSval=19379587 TSecr=809463
367 0.324949279 172.31.23.72 -> 172.31.31.144 OpenFlow 74 Type: OFPT_BARRIER_REPLY
368 0.324962624 172.31.31.144 -> 172.31.23.72 OpenFlow 170 Type: OFPT_FLOW_MOD
369 0.324965299 172.31.31.144 -> 172.31.23.72 TCP 66 6633 → 45426 [ACK] Seq=281 Ack=57 Win=853 Len=0 TSval=809463 TSecr=19379587
370 0.324968504 172.31.31.144 -> 172.31.23.72 OpenFlow 170 Type: OFPT_FLOW_MOD
371 0.324991885 172.31.23.72 -> 172.31.31.144 TCP 66 45414 → 6633 [ACK] Seq=393 Ack=1041 Win=213 Len=0 TSval=19379587 TSecr=809463
372 0.325002071 172.31.23.72 -> 172.31.31.144 OpenFlow 74 Type: OFPT_BARRIER_REPLY
373 0.325035923 172.31.23.72 -> 172.31.31.144 TCP 66 45442 → 6633 [ACK] Seq=1089 Ack=1217 Win=213 Len=0 TSval=19379587 TSecr=809463
374 0.325101479 172.31.31.144 -> 172.31.23.72 OpenFlow 74 Type: OFPT_BARRIER_REQUEST
375 0.325105581 172.31.31.144 -> 172.31.23.72 OpenFlow 178 Type: OFPT_BARRIER_REQUEST
376 0.325107202 172.31.31.144 -> 172.31.23.72 OpenFlow 74 Type: OFPT_BARRIER_REQUEST
377 0.325109068 172.31.31.144 -> 172.31.23.72 OpenFlow 170 Type: OFPT_FLOW_MOD
378 0.325110734 172.31.31.144 -> 172.31.23.72 OpenFlow 178 Type: OFPT_BARRIER_REQUEST
379 0.325194473 172.31.31.144 -> 172.31.23.72 OpenFlow 74 Type: OFPT_BARRIER_REQUEST
380 0.327268152 172.31.23.72 -> 172.31.31.144 TCP 66 45436 → 6633 [ACK] Seq=17 Ack=649 Win=213 Len=0 TSval=19379588 TSecr=809463
381 0.327281736 172.31.23.72 -> 172.31.31.144 OpenFlow 74 Type: OFPT_BARRIER_REPLY
382 0.327311451 172.31.23.72 -> 172.31.31.144 TCP 66 45434 → 6633 [ACK] Seq=857 Ack=1593 Win=213 Len=0 TSval=19379588 TSecr=809463
383 0.327320271 172.31.23.72 -> 172.31.31.144 OpenFlow 74 Type: OFPT_BARRIER_REPLY
384 0.327341897 172.31.23.72 -> 172.31.31.144 TCP 66 45424 → 6633 [ACK] Seq=913 Ack=2081 Win=213 Len=0 TSval=19379588 TSecr=809463
385 0.327346668 172.31.23.72 -> 172.31.31.144 OpenFlow 74 Type: OFPT_BARRIER_REPLY
386 0.327366933 172.31.23.72 -> 172.31.31.144 TCP 66 45444 → 6633 [ACK] Seq=1105 Ack=1865 Win=213 Len=0 TSval=19379588 TSecr=809463
387 0.327375577 172.31.23.72 -> 172.31.31.144 OpenFlow 74 Type: OFPT_BARRIER_REPLY
388 0.327438295 172.31.23.72 -> 172.31.31.144 TCP 66 45454 → 6633 [ACK] Seq=697 Ack=1849 Win=213 Len=0 TSval=19379588 TSecr=809463
389 0.327443814 172.31.23.72 -> 172.31.31.144 OpenFlow 74 Type: OFPT_BARRIER_REPLY
390 0.327459242 172.31.23.72 -> 172.31.31.144 OpenFlow 74 Type: OFPT_BARRIER_REPLY
391 0.327638257 172.31.31.144 -> 172.31.23.72 TCP 66 6633 → 45424 [ACK] Seq=2081 Ack=921 Win=853 Len=0 TSval=809463 TSecr=19379587
392 0.327675188 172.31.31.144 -> 172.31.23.72 TCP 66 6633 → 45434 [ACK] Seq=1593 Ack=865 Win=853 Len=0 TSval=809463 TSecr=19379587
393 0.336248750 172.31.31.144 -> 172.31.23.72 TCP 66 6633 → 45462 [ACK] Seq=217 Ack=9 Win=853 Len=0 TSval=809466 TSecr=19379581
394 0.336269522 172.31.31.144 -> 172.31.23.72 TCP 66 6633 → 45448 [ACK] Seq=217 Ack=9 Win=853 Len=0 TSval=809466 TSecr=19379581
395 0.336303162 172.31.31.144 -> 172.31.23.72 TCP 66 6633 → 45460 [ACK] Seq=489 Ack=177 Win=853 Len=0 TSval=809466 TSecr=19379581
396 0.336331551 172.31.31.144 -> 172.31.23.72 TCP 66 6633 → 45418 [ACK] Seq=553 Ack=225 Win=853 Len=0 TSval=809466 TSecr=19379581
397 0.364201944 172.31.31.144 -> 172.31.23.72 TCP 66 6633 → 45436 [ACK] Seq=649 Ack=25 Win=853 Len=0 TSval=809473 TSecr=19379588
398 0.364213840 172.31.31.144 -> 172.31.23.72 TCP 66 6633 → 45414 [ACK] Seq=1041 Ack=401 Win=853 Len=0 TSval=809473 TSecr=19379587
399 0.364219515 172.31.31.144 -> 172.31.23.72 TCP 66 6633 → 45458 [ACK] Seq=553 Ack=345 Win=853 Len=0 TSval=809473 TSecr=19379587
400 0.364221865 172.31.31.144 -> 172.31.23.72 TCP 66 6633 → 45452 [ACK] Seq=705 Ack=185 Win=853 Len=0 TSval=809473 TSecr=19379587
401 0.364226080 172.31.31.144 -> 172.31.23.72 TCP 66 6633 → 45446 [ACK] Seq=553 Ack=345 Win=853 Len=0 TSval=809473 TSecr=19379587
402 0.364245903 172.31.31.144 -> 172.31.23.72 TCP 66 6633 → 45416 [ACK] Seq=1209 Ack=569 Win=853 Len=0 TSval=809473 TSecr=19379587
403 0.364268367 172.31.31.144 -> 172.31.23.72 TCP 66 6633 → 45442 [ACK] Seq=1225 Ack=1097 Win=853 Len=0 TSval=809473 TSecr=19379588
404 0.364297456 172.31.31.144 -> 172.31.23.72 TCP 66 6633 → 45454 [ACK] Seq=1849 Ack=705 Win=853 Len=0 TSval=809473 TSecr=19379588
405 0.364319604 172.31.31.144 -> 172.31.23.72 TCP 66 6633 → 45444 [ACK] Seq=1865 Ack=1113 Win=853 Len=0 TSval=809473 TSecr=19379588
406 0.399347017 172.31.31.144 -> 172.31.23.72 TCP 90 6633 → 45428 [PSH, ACK] Seq=1 Ack=1 Win=853 Len=24 TSval=809481 TSecr=19379282
407 0.399377840 172.31.31.144 -> 172.31.23.72 OpenFlow 90 Type: OFPT_MULTIPART_REQUEST, OFPMP_GROUP
408 0.399401658 172.31.31.144 -> 172.31.23.72 OpenFlow 90 Type: OFPT_MULTIPART_REQUEST, OFPMP_GROUP
409 0.399405626 172.31.31.144 -> 172.31.23.72 OpenFlow 106 Type: OFPT_MULTIPART_REQUEST, OFPMP_METER
410 0.399424357 172.31.31.144 -> 172.31.23.72 OpenFlow 106 Type: OFPT_MULTIPART_REQUEST, OFPMP_METER
411 0.399465962 172.31.31.144 -> 172.31.23.72 TCP 82 6633 → 45428 [PSH, ACK] Seq=25 Ack=1 Win=853 Len=16 TSval=809481 TSecr=19379282
412 0.399505014 172.31.31.144 -> 172.31.23.72 TCP 90 6633 → 45428 [PSH, ACK] Seq=41 Ack=1 Win=853 Len=24 TSval=809481 TSecr=19379282
413 0.399684224 172.31.23.72 -> 172.31.31.144 OpenFlow 82 Type: OFPT_MULTIPART_REPLY, OFPMP_GROUP
414 0.399717098 172.31.23.72 -> 172.31.31.144 OpenFlow 98 Type: OFPT_MULTIPART_REPLY, OFPMP_METER
415 0.399730179 172.31.23.72 -> 172.31.31.144 OpenFlow 82 Type: OFPT_MULTIPART_REPLY, OFPMP_GROUP
416 0.399761309 172.31.23.72 -> 172.31.31.144 OpenFlow 82 Type: OFPT_MULTIPART_REPLY, OFPMP_GROUP
417 0.399794003 172.31.23.72 -> 172.31.31.144 OpenFlow 98 Type: OFPT_MULTIPART_REPLY, OFPMP_METER
418 0.399798732 172.31.23.72 -> 172.31.31.144 OpenFlow 98 Type: OFPT_MULTIPART_REPLY, OFPMP_METER
419 0.399924175 172.31.31.144 -> 172.31.23.72 TCP 66 6633 → 45430 [ACK] Seq=497 Ack=33 Win=853 Len=0 TSval=809481 TSecr=19379606
420 0.399950227 172.31.31.144 -> 172.31.23.72 TCP 66 6633 → 45430 [ACK] Seq=497 Ack=65 Win=853 Len=0 TSval=809481 TSecr=19379606
421 0.399977062 172.31.31.144 -> 172.31.23.72 TCP 66 6633 → 45432 [ACK] Seq=281 Ack=25 Win=853 Len=0 TSval=809481 TSecr=19379606
422 0.400002125 172.31.31.144 -> 172.31.23.72 TCP 66 6633 → 45432 [ACK] Seq=281 Ack=57 Win=853 Len=0 TSval=809481 TSecr=19379606
423 0.400029040 172.31.31.144 -> 172.31.23.72 TCP 66 6633 → 45428 [ACK] Seq=65 Ack=49 Win=853 Len=0 TSval=809481 TSecr=19379606
424 0.499588741 172.31.31.144 -> 172.31.23.72 OpenFlow 90 Type: OFPT_MULTIPART_REQUEST, OFPMP_GROUP
425 0.499611429 172.31.31.144 -> 172.31.23.72 OpenFlow 90 Type: OFPT_MULTIPART_REQUEST, OFPMP_GROUP
426 0.499625964 172.31.31.144 -> 172.31.23.72 OpenFlow 106 Type: OFPT_MULTIPART_REQUEST, OFPMP_METER
427 0.499633642 172.31.31.144 -> 172.31.23.72 OpenFlow 82 Type: OFPT_MULTIPART_REQUEST, OFPMP_GROUP_DESC
428 0.499659106 172.31.31.144 -> 172.31.23.72 OpenFlow 90 Type: OFPT_MULTIPART_REQUEST, OFPMP_METER
429 0.499811688 172.31.23.72 -> 172.31.31.144 OpenFlow 82 Type: OFPT_MULTIPART_REPLY, OFPMP_GROUP
430 0.499841725 172.31.23.72 -> 172.31.31.144 OpenFlow 98 Type: OFPT_MULTIPART_REPLY, OFPMP_METER
431 0.499861084 172.31.23.72 -> 172.31.31.144 OpenFlow 82 Type: OFPT_MULTIPART_REPLY, OFPMP_GROUP
432 0.499913231 172.31.23.72 -> 172.31.31.144 OpenFlow 98 Type: OFPT_MULTIPART_REPLY, OFPMP_METER
433 0.500113049 172.31.31.144 -> 172.31.23.72 TCP 66 6633 → 45436 [ACK] Seq=713 Ack=73 Win=853 Len=0 TSval=809506 TSecr=19379631
434 0.500165726 172.31.31.144 -> 172.31.23.72 TCP 66 6633 → 45434 [ACK] Seq=1657 Ack=913 Win=853 Len=0 TSval=809507 TSecr=19379631
435 0.599766501 172.31.31.144 -> 172.31.23.72 TCP 90 6633 → 45438 [PSH, ACK] Seq=1 Ack=1 Win=853 Len=24 TSval=809531 TSecr=19379257
436 0.599789517 172.31.31.144 -> 172.31.23.72 TCP 82 6633 → 45438 [PSH, ACK] Seq=25 Ack=1 Win=853 Len=16 TSval=809531 TSecr=19379257
437 0.599805560 172.31.31.144 -> 172.31.23.72 TCP 90 6633 → 45438 [PSH, ACK] Seq=41 Ack=1 Win=853 Len=24 TSval=809531 TSecr=19379257
438 0.599986756 172.31.23.72 -> 172.31.31.144 OpenFlow 82 Type: OFPT_MULTIPART_REPLY, OFPMP_GROUP
439 0.600011519 172.31.23.72 -> 172.31.31.144 OpenFlow 98 Type: OFPT_MULTIPART_REPLY, OFPMP_METER
440 0.600184304 172.31.31.144 -> 172.31.23.72 TCP 66 6633 → 45438 [ACK] Seq=65 Ack=17 Win=853 Len=0 TSval=809532 TSecr=19379656
441 0.600212146 172.31.31.144 -> 172.31.23.72 TCP 66 6633 → 45438 [ACK] Seq=65 Ack=49 Win=853 Len=0 TSval=809532 TSecr=19379656
442 0.700016966 172.31.31.144 -> 172.31.23.72 OpenFlow 90 Type: OFPT_MULTIPART_REQUEST, OFPMP_GROUP
443 0.700044962 172.31.31.144 -> 172.31.23.72 OpenFlow 90 Type: OFPT_MULTIPART_REQUEST, OFPMP_GROUP
444 0.700048431 172.31.31.144 -> 172.31.23.72 OpenFlow 106 Type: OFPT_MULTIPART_REQUEST, OFPMP_METER
445 0.700072034 172.31.31.144 -> 172.31.23.72 OpenFlow 106 Type: OFPT_MULTIPART_REQUEST, OFPMP_METER
446 0.700294989 172.31.23.72 -> 172.31.31.144 OpenFlow 82 Type: OFPT_MULTIPART_REPLY, OFPMP_GROUP
447 0.700326450 172.31.23.72 -> 172.31.31.144 OpenFlow 98 Type: OFPT_MULTIPART_REPLY, OFPMP_METER
448 0.700426220 172.31.23.72 -> 172.31.31.144 OpenFlow 82 Type: OFPT_MULTIPART_REPLY, OFPMP_GROUP
449 0.700449710 172.31.23.72 -> 172.31.31.144 OpenFlow 98 Type: OFPT_MULTIPART_REPLY, OFPMP_METER
450 0.700489061 172.31.31.144 -> 172.31.23.72 TCP 66 6633 → 45444 [ACK] Seq=1929 Ack=1129 Win=853 Len=0 TSval=809557 TSecr=19379681
451 0.700520642 172.31.31.144 -> 172.31.23.72 TCP 66 6633 → 45444 [ACK] Seq=1929 Ack=1161 Win=853 Len=0 TSval=809557 TSecr=19379681
452 0.700638503 172.31.31.144 -> 172.31.23.72 TCP 66 6633 → 45442 [ACK] Seq=1289 Ack=1113 Win=853 Len=0 TSval=809557 TSecr=19379681
453 0.700653506 172.31.31.144 -> 172.31.23.72 TCP 66 6633 → 45442 [ACK] Seq=1289 Ack=1145 Win=853 Len=0 TSval=809557 TSecr=19379681
454 0.999495627 172.31.31.144 -> 172.31.23.72 OpenFlow 90 Type: OFPT_MULTIPART_REQUEST, OFPMP_GROUP
455 0.999523190 172.31.31.144 -> 172.31.23.72 OpenFlow 90 Type: OFPT_MULTIPART_REQUEST, OFPMP_GROUP
456 0.999527301 172.31.31.144 -> 172.31.23.72 TCP 90 6633 → 45450 [PSH, ACK] Seq=1 Ack=1 Win=853 Len=24 TSval=809631 TSecr=19379232
457 0.999532417 172.31.31.144 -> 172.31.23.72 OpenFlow 90 Type: OFPT_MULTIPART_REQUEST, OFPMP_GROUP
458 0.999544175 172.31.31.144 -> 172.31.23.72 OpenFlow 90 Type: OFPT_MULTIPART_REQUEST, OFPMP_GROUP
459 0.999547580 172.31.31.144 -> 172.31.23.72 OpenFlow 106 Type: OFPT_MULTIPART_REQUEST, OFPMP_METER
460 0.999575961 172.31.31.144 -> 172.31.23.72 OpenFlow 106 Type: OFPT_MULTIPART_REQUEST, OFPMP_METER
461 0.999580246 172.31.31.144 -> 172.31.23.72 TCP 106 6633 → 45450 [PSH, ACK] Seq=25 Ack=1 Win=853 Len=40 TSval=809631 TSecr=19379232
462 0.999602297 172.31.31.144 -> 172.31.23.72 OpenFlow 106 Type: OFPT_MULTIPART_REQUEST, OFPMP_METER
463 0.999650878 172.31.31.144 -> 172.31.23.72 OpenFlow 106 Type: OFPT_MULTIPART_REQUEST, OFPMP_METER
464 0.999994674 172.31.23.72 -> 172.31.31.144 OpenFlow 82 Type: OFPT_MULTIPART_REPLY, OFPMP_GROUP
465 1.000032955 172.31.23.72 -> 172.31.31.144 OpenFlow 98 Type: OFPT_MULTIPART_REPLY, OFPMP_METER
466 1.000112636 172.31.23.72 -> 172.31.31.144 OpenFlow 82 Type: OFPT_MULTIPART_REPLY, OFPMP_GROUP
467 1.000131197 172.31.23.72 -> 172.31.31.144 OpenFlow 98 Type: OFPT_MULTIPART_REPLY, OFPMP_METER
468 1.000165644 172.31.23.72 -> 172.31.31.144 OpenFlow 82 Type: OFPT_MULTIPART_REPLY, OFPMP_GROUP
469 1.000180144 172.31.23.72 -> 172.31.31.144 OpenFlow 98 Type: OFPT_MULTIPART_REPLY, OFPMP_METER
470 1.000205654 172.31.31.144 -> 172.31.23.72 TCP 66 6633 → 45452 [ACK] Seq=769 Ack=201 Win=853 Len=0 TSval=809632 TSecr=19379756
471 1.000228643 172.31.31.144 -> 172.31.23.72 TCP 66 6633 → 45452 [ACK] Seq=769 Ack=233 Win=853 Len=0 TSval=809632 TSecr=19379756
472 1.000247231 172.31.23.72 -> 172.31.31.144 OpenFlow 82 Type: OFPT_MULTIPART_REPLY, OFPMP_GROUP
473 1.000264367 172.31.23.72 -> 172.31.31.144 OpenFlow 98 Type: OFPT_MULTIPART_REPLY, OFPMP_METER
474 1.000277340 172.31.23.72 -> 172.31.31.144 OpenFlow 82 Type: OFPT_MULTIPART_REPLY, OFPMP_GROUP
475 1.000323280 172.31.23.72 -> 172.31.31.144 OpenFlow 98 Type: OFPT_MULTIPART_REPLY, OFPMP_METER
476 1.000356007 172.31.31.144 -> 172.31.23.72 TCP 66 6633 → 45446 [ACK] Seq=617 Ack=361 Win=853 Len=0 TSval=809632 TSecr=19379756
477 1.000359988 172.31.31.144 -> 172.31.23.72 TCP 66 6633 → 45450 [ACK] Seq=65 Ack=49 Win=853 Len=0 TSval=809632 TSecr=19379756
478 1.000378208 172.31.31.144 -> 172.31.23.72 TCP 66 6633 → 45446 [ACK] Seq=617 Ack=393 Win=853 Len=0 TSval=809632 TSecr=19379756
479 1.000389715 172.31.31.144 -> 172.31.23.72 TCP 66 6633 → 45454 [ACK] Seq=1913 Ack=721 Win=853 Len=0 TSval=809632 TSecr=19379756
480 1.000409530 172.31.31.144 -> 172.31.23.72 TCP 66 6633 → 45454 [ACK] Seq=1913 Ack=753 Win=853 Len=0 TSval=809632 TSecr=19379756
481 1.000427637 172.31.31.144 -> 172.31.23.72 TCP 66 6633 → 45448 [ACK] Seq=281 Ack=25 Win=853 Len=0 TSval=809632 TSecr=19379756
482 1.000456494 172.31.31.144 -> 172.31.23.72 TCP 66 6633 → 45448 [ACK] Seq=281 Ack=57 Win=853 Len=0 TSval=809632 TSecr=19379756
483 1.099784415 172.31.31.144 -> 172.31.23.72 TCP 90 6633 → 45456 [PSH, ACK] Seq=1 Ack=1 Win=853 Len=24 TSval=809656 TSecr=19379257
484 1.099811765 172.31.31.144 -> 172.31.23.72 OpenFlow 90 Type: OFPT_MULTIPART_REQUEST, OFPMP_GROUP
485 1.099831704 172.31.31.144 -> 172.31.23.72 OpenFlow 90 Type: OFPT_MULTIPART_REQUEST, OFPMP_GROUP
486 1.099835228 172.31.31.144 -> 172.31.23.72 OpenFlow 106 Type: OFPT_MULTIPART_REQUEST, OFPMP_METER
487 1.099838541 172.31.31.144 -> 172.31.23.72 OpenFlow 106 Type: OFPT_MULTIPART_REQUEST, OFPMP_METER
488 1.099849884 172.31.31.144 -> 172.31.23.72 TCP 106 6633 → 45456 [PSH, ACK] Seq=25 Ack=1 Win=853 Len=40 TSval=809656 TSecr=19379257
489 1.100087846 172.31.23.72 -> 172.31.31.144 OpenFlow 82 Type: OFPT_MULTIPART_REPLY, OFPMP_GROUP
490 1.100118903 172.31.23.72 -> 172.31.31.144 OpenFlow 98 Type: OFPT_MULTIPART_REPLY, OFPMP_METER
491 1.100129192 172.31.23.72 -> 172.31.31.144 OpenFlow 82 Type: OFPT_MULTIPART_REPLY, OFPMP_GROUP
492 1.100149983 172.31.23.72 -> 172.31.31.144 OpenFlow 82 Type: OFPT_MULTIPART_REPLY, OFPMP_GROUP
493 1.100196795 172.31.23.72 -> 172.31.31.144 OpenFlow 98 Type: OFPT_MULTIPART_REPLY, OFPMP_METER
494 1.100255026 172.31.23.72 -> 172.31.31.144 OpenFlow 98 Type: OFPT_MULTIPART_REPLY, OFPMP_METER
495 1.100319908 172.31.31.144 -> 172.31.23.72 TCP 66 6633 → 45460 [ACK] Seq=553 Ack=193 Win=853 Len=0 TSval=809657 TSecr=19379781
496 1.100326194 172.31.31.144 -> 172.31.23.72 TCP 66 6633 → 45460 [ACK] Seq=553 Ack=225 Win=853 Len=0 TSval=809657 TSecr=19379781
497 1.100375625 172.31.31.144 -> 172.31.23.72 TCP 66 6633 → 45458 [ACK] Seq=617 Ack=361 Win=853 Len=0 TSval=809657 TSecr=19379781
498 1.100393198 172.31.31.144 -> 172.31.23.72 TCP 66 6633 → 45458 [ACK] Seq=617 Ack=393 Win=853 Len=0 TSval=809657 TSecr=19379781
499 1.100421528 172.31.31.144 -> 172.31.23.72 TCP 66 6633 → 45456 [ACK] Seq=65 Ack=49 Win=853 Len=0 TSval=809657 TSecr=19379781
500 1.499932072 172.31.31.144 -> 172.31.23.72 OpenFlow 90 Type: OFPT_MULTIPART_REQUEST, OFPMP_GROUP
501 1.499955880 172.31.31.144 -> 172.31.23.72 OpenFlow 82 Type: OFPT_MULTIPART_REQUEST, OFPMP_GROUP_DESC
502 1.499959870 172.31.31.144 -> 172.31.23.72 OpenFlow 90 Type: OFPT_MULTIPART_REQUEST, OFPMP_METER
503 1.500679252 172.31.23.72 -> 172.31.31.144 OpenFlow 82 Type: OFPT_MULTIPART_REPLY, OFPMP_GROUP
504 1.501405800 172.31.23.72 -> 172.31.31.144 OpenFlow 98 Type: OFPT_MULTIPART_REPLY, OFPMP_METER
505 1.501645378 172.31.31.144 -> 172.31.23.72 TCP 66 6633 → 45462 [ACK] Seq=281 Ack=25 Win=853 Len=0 TSval=809757 TSecr=19379881
506 1.501788291 172.31.31.144 -> 172.31.23.72 TCP 66 6633 → 45462 [ACK] Seq=281 Ack=57 Win=853 Len=0 TSval=809757 TSecr=19379882
507 1.900456955 172.31.31.144 -> 172.31.23.72 OpenFlow 187 Type: OFPT_PACKET_OUT
508 1.900483663 172.31.31.144 -> 172.31.23.72 OpenFlow 187 Type: OFPT_PACKET_OUT
509 1.900503061 172.31.31.144 -> 172.31.23.72 OpenFlow 187 Type: OFPT_PACKET_OUT
510 1.900540021 172.31.31.144 -> 172.31.23.72 OpenFlow 187 Type: OFPT_PACKET_OUT
511 1.900622854 172.31.31.144 -> 172.31.23.72 OpenFlow 187 Type: OFPT_PACKET_OUT
512 1.900690243 172.31.31.144 -> 172.31.23.72 OpenFlow 187 Type: OFPT_PACKET_OUT
513 1.900751475 172.31.31.144 -> 172.31.23.72 OpenFlow 187 Type: OFPT_PACKET_OUT
514 1.900812499 172.31.31.144 -> 172.31.23.72 OpenFlow 187 Type: OFPT_PACKET_OUT
515 1.900898645 172.31.31.144 -> 172.31.23.72 OpenFlow 187 Type: OFPT_PACKET_OUT
516 1.900942603 172.31.31.144 -> 172.31.23.72 OpenFlow 187 Type: OFPT_PACKET_OUT
517 1.901003073 172.31.31.144 -> 172.31.23.72 OpenFlow 187 Type: OFPT_PACKET_OUT
518 1.901063807 172.31.31.144 -> 172.31.23.72 OpenFlow 187 Type: OFPT_PACKET_OUT
519 1.901117474 172.31.23.72 -> 172.31.31.144 TCP 66 45452 → 6633 [ACK] Seq=233 Ack=1737 Win=213 Len=0 TSval=19379981 TSecr=809857
520 1.901133597 172.31.31.144 -> 172.31.23.72 OpenFlow 187 Type: OFPT_PACKET_OUT
521 1.901177931 172.31.31.144 -> 172.31.23.72 OpenFlow 187 Type: OFPT_PACKET_OUT
522 1.901323047 172.31.31.144 -> 172.31.23.72 OpenFlow 187 Type: OFPT_PACKET_OUT
523 1.901349819 172.31.31.144 -> 172.31.23.72 OpenFlow 187 Type: OFPT_PACKET_OUT
524 1.901392870 172.31.31.144 -> 172.31.23.72 OpenFlow 187 Type: OFPT_PACKET_OUT
525 1.901438390 172.31.31.144 -> 172.31.23.72 OpenFlow 187 Type: OFPT_PACKET_OUT
526 1.901504452 172.31.31.144 -> 172.31.23.72 OpenFlow 187 Type: OFPT_PACKET_OUT
527 1.901542820 172.31.23.72 -> 172.31.31.144 TCP 66 45462 → 6633 [ACK] Seq=57 Ack=1007 Win=213 Len=0 TSval=19379982 TSecr=809857
528 1.901552763 172.31.31.144 -> 172.31.23.72 OpenFlow 187 Type: OFPT_PACKET_OUT
529 1.901621880 172.31.31.144 -> 172.31.23.72 OpenFlow 187 Type: OFPT_PACKET_OUT
530 1.901706323 172.31.31.144 -> 172.31.23.72 OpenFlow 187 Type: OFPT_PACKET_OUT
531 1.901958179 172.31.23.72 -> 172.31.31.144 TCP 66 45436 → 6633 [ACK] Seq=73 Ack=1681 Win=213 Len=0 TSval=19379982 TSecr=809857
532 1.902043433 172.31.23.72 -> 172.31.31.144 OpenFlow 189 Type: OFPT_PACKET_IN
533 1.902065343 172.31.23.72 -> 172.31.31.144 OpenFlow 189 Type: OFPT_PACKET_IN
534 1.902093342 172.31.23.72 -> 172.31.31.144 OpenFlow 189 Type: OFPT_PACKET_IN
535 1.902110116 172.31.23.72 -> 172.31.31.144 OpenFlow 189 Type: OFPT_PACKET_IN
536 1.902120247 172.31.23.72 -> 172.31.31.144 OpenFlow 189 Type: OFPT_PACKET_IN
537 1.902138925 172.31.23.72 -> 172.31.31.144 OpenFlow 189 Type: OFPT_PACKET_IN
538 1.902157501 172.31.23.72 -> 172.31.31.144 OpenFlow 189 Type: OFPT_PACKET_IN
539 1.902159817 172.31.23.72 -> 172.31.31.144 OpenFlow 435 Type: OFPT_PACKET_IN
540 1.902191409 172.31.23.72 -> 172.31.31.144 OpenFlow 189 Type: OFPT_PACKET_IN
541 1.902199456 172.31.23.72 -> 172.31.31.144 OpenFlow 189 Type: OFPT_PACKET_IN
542 1.902201099 172.31.23.72 -> 172.31.31.144 OpenFlow 189 Type: OFPT_PACKET_IN
543 1.902243561 172.31.23.72 -> 172.31.31.144 OpenFlow 189 Type: OFPT_PACKET_IN
544 1.902248916 172.31.31.144 -> 172.31.23.72 TCP 66 6633 → 45444 [ACK] Seq=1929 Ack=1284 Win=853 Len=0 TSval=809857 TSecr=19379982
545 1.902272682 172.31.23.72 -> 172.31.31.144 OpenFlow 189 Type: OFPT_PACKET_IN
546 1.902275597 172.31.23.72 -> 172.31.31.144 OpenFlow 189 Type: OFPT_PACKET_IN
547 1.902294914 172.31.23.72 -> 172.31.31.144 OpenFlow 189 Type: OFPT_PACKET_IN
548 1.902315521 172.31.31.144 -> 172.31.23.72 TCP 66 6633 → 45444 [ACK] Seq=1929 Ack=1407 Win=853 Len=0 TSval=809857 TSecr=19379982
549 1.902319425 172.31.31.144 -> 172.31.23.72 TCP 66 6633 → 45438 [ACK] Seq=65 Ack=172 Win=853 Len=0 TSval=809857 TSecr=19379982
550 1.902363253 172.31.23.72 -> 172.31.31.144 OpenFlow 189 Type: OFPT_PACKET_IN
551 1.902368942 172.31.23.72 -> 172.31.31.144 OpenFlow 189 Type: OFPT_PACKET_IN
552 1.902406933 172.31.31.144 -> 172.31.23.72 TCP 66 6633 → 45434 [ACK] Seq=1657 Ack=1159 Win=853 Len=0 TSval=809857 TSecr=19379982
553 1.902411591 172.31.31.144 -> 172.31.23.72 TCP 66 6633 → 45430 [ACK] Seq=497 Ack=188 Win=853 Len=0 TSval=809857 TSecr=19379982
554 1.902413713 172.31.31.144 -> 172.31.23.72 TCP 66 6633 → 45438 [ACK] Seq=65 Ack=541 Win=853 Len=0 TSval=809857 TSecr=19379982
555 1.902415418 172.31.31.144 -> 172.31.23.72 TCP 66 6633 → 45432 [ACK] Seq=281 Ack=180 Win=853 Len=0 TSval=809857 TSecr=19379982
556 1.902419978 172.31.23.72 -> 172.31.31.144 OpenFlow 189 Type: OFPT_PACKET_IN
557 1.902495486 172.31.31.144 -> 172.31.23.72 TCP 66 6633 → 45430 [ACK] Seq=497 Ack=311 Win=853 Len=0 TSval=809857 TSecr=19379982
558 1.902498716 172.31.31.144 -> 172.31.23.72 TCP 66 6633 → 45454 [ACK] Seq=1913 Ack=876 Win=853 Len=0 TSval=809857 TSecr=19379982
559 1.902500908 172.31.31.144 -> 172.31.23.72 TCP 66 6633 → 45448 [ACK] Seq=281 Ack=180 Win=853 Len=0 TSval=809857 TSecr=19379982
560 1.902521245 172.31.31.144 -> 172.31.23.72 TCP 66 6633 → 45432 [ACK] Seq=281 Ack=303 Win=853 Len=0 TSval=809857 TSecr=19379982
561 1.902538818 172.31.31.144 -> 172.31.23.72 TCP 66 6633 → 45442 [ACK] Seq=1289 Ack=1268 Win=853 Len=0 TSval=809857 TSecr=19379982
562 1.902564116 172.31.31.144 -> 172.31.23.72 TCP 66 6633 → 45454 [ACK] Seq=1913 Ack=999 Win=853 Len=0 TSval=809857 TSecr=19379982
563 1.902597353 172.31.31.144 -> 172.31.23.72 TCP 66 6633 → 45448 [ACK] Seq=281 Ack=303 Win=853 Len=0 TSval=809857 TSecr=19379982
564 1.902648672 172.31.31.144 -> 172.31.23.72 TCP 66 6633 → 45442 [ACK] Seq=1289 Ack=1391 Win=853 Len=0 TSval=809857 TSecr=19379982
565 1.904272597 172.31.31.144 -> 172.31.23.72 TCP 66 6633 → 45450 [ACK] Seq=65 Ack=295 Win=853 Len=0 TSval=809858 TSecr=19379982
566 1.992641444 06:be:66:4e:57:f9 -> 06:a7:bc:8b:a8:cd ARP 56 Who has 172.31.23.72? Tell 172.31.16.1
567 1.992655280 06:a7:bc:8b:a8:cd -> 06:be:66:4e:57:f9 ARP 42 172.31.23.72 is at 06:a7:bc:8b:a8:cd
568 2.000161419 172.31.31.144 -> 172.31.23.72 OpenFlow 187 Type: OFPT_PACKET_OUT
569 2.000195327 172.31.31.144 -> 172.31.23.72 OpenFlow 187 Type: OFPT_PACKET_OUT
570 2.000321867 172.31.31.144 -> 172.31.23.72 OpenFlow 187 Type: OFPT_PACKET_OUT
571 2.000409139 172.31.31.144 -> 172.31.23.72 OpenFlow 187 Type: OFPT_PACKET_OUT
572 2.000497885 172.31.31.144 -> 172.31.23.72 OpenFlow 187 Type: OFPT_PACKET_OUT
573 2.000576718 172.31.31.144 -> 172.31.23.72 OpenFlow 187 Type: OFPT_PACKET_OUT
574 2.000651954 172.31.23.72 -> 172.31.31.144 TCP 66 45420 → 6633 [ACK] Seq=49 Ack=791 Win=213 Len=0 TSval=19380006 TSecr=809881
575 2.000664711 172.31.31.144 -> 172.31.23.72 OpenFlow 187 Type: OFPT_PACKET_OUT
576 2.000741243 172.31.31.144 -> 172.31.23.72 OpenFlow 187 Type: OFPT_PACKET_OUT
577 2.000770798 172.31.23.72 -> 172.31.31.144 TCP 66 45420 → 6633 [ACK] Seq=49 Ack=1033 Win=213 Len=0 TSval=19380006 TSecr=809882
578 2.000862758 172.31.31.144 -> 172.31.23.72 OpenFlow 187 Type: OFPT_PACKET_OUT
579 2.000878530 172.31.23.72 -> 172.31.31.144 OpenFlow 189 Type: OFPT_PACKET_IN
580 2.000901208 172.31.23.72 -> 172.31.31.144 OpenFlow 189 Type: OFPT_PACKET_IN
581 2.000925539 172.31.31.144 -> 172.31.23.72 OpenFlow 187 Type: OFPT_PACKET_OUT
582 2.000946793 172.31.23.72 -> 172.31.31.144 OpenFlow 189 Type: OFPT_PACKET_IN
583 2.000967736 172.31.23.72 -> 172.31.31.144 OpenFlow 189 Type: OFPT_PACKET_IN
584 2.000992072 172.31.31.144 -> 172.31.23.72 OpenFlow 187 Type: OFPT_PACKET_OUT
585 2.001044416 172.31.31.144 -> 172.31.23.72 TCP 66 6633 → 45418 [ACK] Seq=553 Ack=348 Win=853 Len=0 TSval=809882 TSecr=19380006
586 2.001063175 172.31.23.72 -> 172.31.31.144 OpenFlow 189 Type: OFPT_PACKET_IN
587 2.001071764 172.31.31.144 -> 172.31.23.72 TCP 66 6633 → 45418 [ACK] Seq=553 Ack=471 Win=853 Len=0 TSval=809882 TSecr=19380006
588 2.001083431 172.31.23.72 -> 172.31.31.144 OpenFlow 189 Type: OFPT_PACKET_IN
589 2.001179408 172.31.31.144 -> 172.31.23.72 TCP 66 6633 → 45428 [ACK] Seq=65 Ack=295 Win=853 Len=0 TSval=809882 TSecr=19380006
590 2.001202962 172.31.31.144 -> 172.31.23.72 OpenFlow 187 Type: OFPT_PACKET_OUT
591 2.001265675 172.31.31.144 -> 172.31.23.72 TCP 66 6633 → 45422 [ACK] Seq=65 Ack=172 Win=853 Len=0 TSval=809882 TSecr=19380006
592 2.001273488 172.31.31.144 -> 172.31.23.72 OpenFlow 187 Type: OFPT_PACKET_OUT
593 2.001294787 172.31.31.144 -> 172.31.23.72 TCP 66 6633 → 45422 [ACK] Seq=65 Ack=295 Win=853 Len=0 TSval=809882 TSecr=19380006
594 2.001372192 172.31.31.144 -> 172.31.23.72 OpenFlow 187 Type: OFPT_PACKET_OUT
595 2.001451790 172.31.31.144 -> 172.31.23.72 OpenFlow 187 Type: OFPT_PACKET_OUT
596 2.001539598 172.31.31.144 -> 172.31.23.72 OpenFlow 187 Type: OFPT_PACKET_OUT
597 2.001613530 172.31.23.72 -> 172.31.31.144 TCP 66 45424 → 6633 [ACK] Seq=921 Ack=3049 Win=213 Len=0 TSval=19380007 TSecr=809882
598 2.001644663 172.31.31.144 -> 172.31.23.72 OpenFlow 187 Type: OFPT_PACKET_OUT
599 2.001751233 172.31.23.72 -> 172.31.31.144 OpenFlow 189 Type: OFPT_PACKET_IN
600 2.001776546 172.31.23.72 -> 172.31.31.144 OpenFlow 189 Type: OFPT_PACKET_IN
601 2.001787306 172.31.23.72 -> 172.31.31.144 OpenFlow 189 Type: OFPT_PACKET_IN
602 2.001819277 172.31.23.72 -> 172.31.31.144 OpenFlow 189 Type: OFPT_PACKET_IN
603 2.001828667 172.31.23.72 -> 172.31.31.144 OpenFlow 189 Type: OFPT_PACKET_IN
604 2.001854753 172.31.23.72 -> 172.31.31.144 OpenFlow 189 Type: OFPT_PACKET_IN
605 2.001863198 172.31.23.72 -> 172.31.31.144 OpenFlow 189 Type: OFPT_PACKET_IN
606 2.001885075 172.31.31.144 -> 172.31.23.72 OpenFlow 187 Type: OFPT_PACKET_OUT
607 2.001911455 172.31.23.72 -> 172.31.31.144 OpenFlow 189 Type: OFPT_PACKET_IN
608 2.001933142 172.31.31.144 -> 172.31.23.72 TCP 66 6633 → 45430 [ACK] Seq=497 Ack=434 Win=853 Len=0 TSval=809882 TSecr=19380007
609 2.001956306 172.31.31.144 -> 172.31.23.72 TCP 66 6633 → 45430 [ACK] Seq=497 Ack=557 Win=853 Len=0 TSval=809882 TSecr=19380007
610 2.001970423 172.31.31.144 -> 172.31.23.72 OpenFlow 187 Type: OFPT_PACKET_OUT
611 2.001998901 172.31.31.144 -> 172.31.23.72 TCP 66 6633 → 45416 [ACK] Seq=1209 Ack=692 Win=853 Len=0 TSval=809882 TSecr=19380007
612 2.002031730 172.31.31.144 -> 172.31.23.72 TCP 66 6633 → 45414 [ACK] Seq=1041 Ack=524 Win=853 Len=0 TSval=809882 TSecr=19380007
613 2.002035100 172.31.31.144 -> 172.31.23.72 TCP 66 6633 → 45416 [ACK] Seq=1209 Ack=815 Win=853 Len=0 TSval=809882 TSecr=19380007
614 2.002039127 172.31.23.72 -> 172.31.31.144 OpenFlow 189 Type: OFPT_PACKET_IN
615 2.002048400 172.31.31.144 -> 172.31.23.72 TCP 66 6633 → 45414 [ACK] Seq=1041 Ack=647 Win=853 Len=0 TSval=809882 TSecr=19380007
616 2.002060653 172.31.31.144 -> 172.31.23.72 OpenFlow 187 Type: OFPT_PACKET_OUT
617 2.002095307 172.31.31.144 -> 172.31.23.72 OpenFlow 187 Type: OFPT_PACKET_OUT
618 2.002121887 172.31.31.144 -> 172.31.23.72 TCP 66 6633 → 45426 [ACK] Seq=281 Ack=303 Win=853 Len=0 TSval=809882 TSecr=19380007
619 2.002187994 172.31.23.72 -> 172.31.31.144 TCP 66 45434 → 6633 [ACK] Seq=1282 Ack=2020 Win=213 Len=0 TSval=19380007 TSecr=809882
620 2.002237923 172.31.31.144 -> 172.31.23.72 OpenFlow 187 Type: OFPT_PACKET_OUT
621 2.002317788 172.31.23.72 -> 172.31.31.144 OpenFlow 189 Type: OFPT_PACKET_IN
622 2.002341772 172.31.23.72 -> 172.31.31.144 OpenFlow 189 Type: OFPT_PACKET_IN
623 2.002543799 172.31.31.144 -> 172.31.23.72 TCP 66 6633 → 45424 [ACK] Seq=3291 Ack=1167 Win=853 Len=0 TSval=809882 TSecr=19380007
624 2.002557022 172.31.23.72 -> 172.31.31.144 OpenFlow 189 Type: OFPT_PACKET_IN
625 2.002578937 172.31.23.72 -> 172.31.31.144 OpenFlow 189 Type: OFPT_PACKET_IN
626 2.002590211 172.31.23.72 -> 172.31.31.144 OpenFlow 189 Type: OFPT_PACKET_IN
627 2.002601082 172.31.31.144 -> 172.31.23.72 OpenFlow 187 Type: OFPT_PACKET_OUT
628 2.002647957 172.31.31.144 -> 172.31.23.72 OpenFlow 308 Type: OFPT_PACKET_OUT
629 2.002683151 172.31.31.144 -> 172.31.23.72 OpenFlow 187 Type: OFPT_PACKET_OUT
630 2.002709359 172.31.31.144 -> 172.31.23.72 TCP 66 6633 → 45436 [ACK] Seq=1681 Ack=196 Win=853 Len=0 TSval=809882 TSecr=19380007
631 2.002736638 172.31.31.144 -> 172.31.23.72 TCP 66 6633 → 45436 [ACK] Seq=1681 Ack=319 Win=853 Len=0 TSval=809882 TSecr=19380007
632 2.002795665 172.31.31.144 -> 172.31.23.72 OpenFlow 187 Type: OFPT_PACKET_OUT
633 2.002928010 172.31.31.144 -> 172.31.23.72 OpenFlow 187 Type: OFPT_PACKET_OUT
634 2.002997601 172.31.31.144 -> 172.31.23.72 OpenFlow 187 Type: OFPT_PACKET_OUT
635 2.003042795 172.31.23.72 -> 172.31.31.144 TCP 66 45434 → 6633 [ACK] Seq=1405 Ack=2746 Win=213 Len=0 TSval=19380007 TSecr=809882
636 2.003059782 172.31.31.144 -> 172.31.23.72 OpenFlow 187 Type: OFPT_PACKET_OUT
637 2.003084770 172.31.31.144 -> 172.31.23.72 OpenFlow 187 Type: OFPT_PACKET_OUT
638 2.003115356 172.31.31.144 -> 172.31.23.72 OpenFlow 187 Type: OFPT_PACKET_OUT
639 2.003178720 172.31.31.144 -> 172.31.23.72 OpenFlow 187 Type: OFPT_PACKET_OUT
640 2.003258851 172.31.31.144 -> 172.31.23.72 OpenFlow 187 Type: OFPT_PACKET_OUT
641 2.003313112 172.31.31.144 -> 172.31.23.72 OpenFlow 187 Type: OFPT_PACKET_OUT
642 2.003369260 172.31.31.144 -> 172.31.23.72 OpenFlow 187 Type: OFPT_PACKET_OUT
643 2.003441099 172.31.31.144 -> 172.31.23.72 OpenFlow 187 Type: OFPT_PACKET_OUT
644 2.003498971 172.31.31.144 -> 172.31.23.72 OpenFlow 187 Type: OFPT_PACKET_OUT
645 2.003553177 172.31.23.72 -> 172.31.31.144 TCP 66 45418 → 6633 [ACK] Seq=471 Ack=1763 Win=213 Len=0 TSval=19380007 TSecr=809882
646 2.003609496 172.31.31.144 -> 172.31.23.72 OpenFlow 187 Type: OFPT_PACKET_OUT
647 2.003656530 172.31.31.144 -> 172.31.23.72 OpenFlow 187 Type: OFPT_PACKET_OUT
648 2.003703159 172.31.31.144 -> 172.31.23.72 OpenFlow 187 Type: OFPT_PACKET_OUT
649 2.003708910 172.31.23.72 -> 172.31.31.144 TCP 66 45444 → 6633 [ACK] Seq=1407 Ack=2171 Win=213 Len=0 TSval=19380007 TSecr=809882
650 2.003756794 172.31.31.144 -> 172.31.23.72 OpenFlow 187 Type: OFPT_PACKET_OUT
651 2.003832659 172.31.31.144 -> 172.31.23.72 OpenFlow 187 Type: OFPT_PACKET_OUT
652 2.003911785 172.31.31.144 -> 172.31.23.72 OpenFlow 187 Type: OFPT_PACKET_OUT
653 2.003974547 172.31.31.144 -> 172.31.23.72 OpenFlow 187 Type: OFPT_PACKET_OUT
654 2.004029463 172.31.31.144 -> 172.31.23.72 OpenFlow 187 Type: OFPT_PACKET_OUT
655 2.004183556 172.31.31.144 -> 172.31.23.72 OpenFlow 187 Type: OFPT_PACKET_OUT
656 2.004206890 172.31.31.144 -> 172.31.23.72 OpenFlow 187 Type: OFPT_PACKET_OUT
657 2.004266939 172.31.31.144 -> 172.31.23.72 OpenFlow 187 Type: OFPT_PACKET_OUT
658 2.004287456 172.31.23.72 -> 172.31.31.144 TCP 66 45444 → 6633 [ACK] Seq=1407 Ack=2897 Win=213 Len=0 TSval=19380007 TSecr=809882
659 2.004333568 172.31.31.144 -> 172.31.23.72 OpenFlow 187 Type: OFPT_PACKET_OUT
660 2.004391625 172.31.31.144 -> 172.31.23.72 OpenFlow 187 Type: OFPT_PACKET_OUT
661 2.004449554 172.31.31.144 -> 172.31.23.72 OpenFlow 187 Type: OFPT_PACKET_OUT
662 2.004516082 172.31.31.144 -> 172.31.23.72 OpenFlow 187 Type: OFPT_PACKET_OUT
663 2.004591832 172.31.31.144 -> 172.31.23.72 OpenFlow 187 Type: OFPT_PACKET_OUT
664 2.004701820 172.31.23.72 -> 172.31.31.144 TCP 66 45438 → 6633 [ACK] Seq=541 Ack=1033 Win=213 Len=0 TSval=19380007 TSecr=809883
665 2.004731844 172.31.31.144 -> 172.31.23.72 OpenFlow 187 Type: OFPT_PACKET_OUT
666 2.004772926 172.31.31.144 -> 172.31.23.72 OpenFlow 187 Type: OFPT_PACKET_OUT
667 2.004790951 172.31.31.144 -> 172.31.23.72 OpenFlow 187 Type: OFPT_PACKET_OUT
668 2.004795482 172.31.23.72 -> 172.31.31.144 OpenFlow 189 Type: OFPT_PACKET_IN
669 2.004817164 172.31.23.72 -> 172.31.31.144 OpenFlow 189 Type: OFPT_PACKET_IN
670 2.004849033 172.31.31.144 -> 172.31.23.72 OpenFlow 187 Type: OFPT_PACKET_OUT
671 2.004906047 172.31.31.144 -> 172.31.23.72 OpenFlow 187 Type: OFPT_PACKET_OUT
672 2.004961216 172.31.23.72 -> 172.31.31.144 TCP 66 45450 → 6633 [ACK] Seq=541 Ack=670 Win=213 Len=0 TSval=19380007 TSecr=809883
673 2.005042636 172.31.23.72 -> 172.31.31.144 OpenFlow 189 Type: OFPT_PACKET_IN
674 2.005049197 172.31.31.144 -> 172.31.23.72 OpenFlow 187 Type: OFPT_PACKET_OUT
675 2.005055203 172.31.31.144 -> 172.31.23.72 OpenFlow 187 Type: OFPT_PACKET_OUT
676 2.005066498 172.31.23.72 -> 172.31.31.144 OpenFlow 189 Type: OFPT_PACKET_IN
677 2.005089685 172.31.31.144 -> 172.31.23.72 OpenFlow 187 Type: OFPT_PACKET_OUT
678 2.005146463 172.31.31.144 -> 172.31.23.72 OpenFlow 187 Type: OFPT_PACKET_OUT
679 2.005187862 172.31.23.72 -> 172.31.31.144 TCP 66 45430 → 6633 [ACK] Seq=803 Ack=860 Win=213 Len=0 TSval=19380007 TSecr=809883
680 2.005234176 172.31.31.144 -> 172.31.23.72 OpenFlow 187 Type: OFPT_PACKET_OUT
681 2.005313848 172.31.23.72 -> 172.31.31.144 OpenFlow 189 Type: OFPT_PACKET_IN
682 2.005336993 172.31.23.72 -> 172.31.31.144 OpenFlow 189 Type: OFPT_PACKET_IN
683 2.005342671 172.31.23.72 -> 172.31.31.144 OpenFlow 189 Type: OFPT_PACKET_IN
684 2.005380680 172.31.23.72 -> 172.31.31.144 OpenFlow 435 Type: OFPT_PACKET_IN
685 2.005463136 172.31.31.144 -> 172.31.23.72 TCP 66 6633 → 45416 [ACK] Seq=1209 Ack=938 Win=853 Len=0 TSval=809883 TSecr=19380007
686 2.005488409 172.31.31.144 -> 172.31.23.72 TCP 66 6633 → 45416 [ACK] Seq=1209 Ack=1061 Win=853 Len=0 TSval=809883 TSecr=19380007
687 2.005515291 172.31.31.144 -> 172.31.23.72 TCP 66 6633 → 45446 [ACK] Seq=617 Ack=516 Win=853 Len=0 TSval=809883 TSecr=19380007
688 2.005541785 172.31.31.144 -> 172.31.23.72 TCP 66 6633 → 45446 [ACK] Seq=617 Ack=885 Win=853 Len=0 TSval=809883 TSecr=19380008
689 2.005603638 172.31.31.144 -> 172.31.23.72 OpenFlow 187 Type: OFPT_PACKET_OUT
690 2.005618594 172.31.23.72 -> 172.31.31.144 OpenFlow 189 Type: OFPT_PACKET_IN
691 2.005634361 172.31.31.144 -> 172.31.23.72 OpenFlow 550 Type: OFPT_PACKET_OUT
692 2.005638649 172.31.23.72 -> 172.31.31.144 OpenFlow 189 Type: OFPT_PACKET_IN
693 2.005661439 172.31.31.144 -> 172.31.23.72 OpenFlow 187 Type: OFPT_PACKET_OUT
694 2.005666786 172.31.23.72 -> 172.31.31.144 OpenFlow 312 Type: OFPT_PACKET_IN
695 2.005691581 172.31.23.72 -> 172.31.31.144 OpenFlow 189 Type: OFPT_PACKET_IN
696 2.005707771 172.31.23.72 -> 172.31.31.144 OpenFlow 189 Type: OFPT_PACKET_IN
697 2.005721572 172.31.23.72 -> 172.31.31.144 OpenFlow 189 Type: OFPT_PACKET_IN
698 2.005738300 172.31.23.72 -> 172.31.31.144 OpenFlow 189 Type: OFPT_PACKET_IN
699 2.005755574 172.31.23.72 -> 172.31.31.144 OpenFlow 189 Type: OFPT_PACKET_IN
700 2.005757823 172.31.23.72 -> 172.31.31.144 OpenFlow 189 Type: OFPT_PACKET_IN
701 2.005770368 172.31.23.72 -> 172.31.31.144 OpenFlow 189 Type: OFPT_PACKET_IN
702 2.005775718 172.31.23.72 -> 172.31.31.144 OpenFlow 189 Type: OFPT_PACKET_IN
703 2.005838310 172.31.31.144 -> 172.31.23.72 TCP 66 6633 → 45432 [ACK] Seq=281 Ack=426 Win=853 Len=0 TSval=809883 TSecr=19380008
704 2.005843700 172.31.31.144 -> 172.31.23.72 TCP 66 6633 → 45432 [ACK] Seq=281 Ack=549 Win=853 Len=0 TSval=809883 TSecr=19380008
705 2.005848356 172.31.23.72 -> 172.31.31.144 OpenFlow 189 Type: OFPT_PACKET_IN
706 2.005854526 172.31.23.72 -> 172.31.31.144 OpenFlow 189 Type: OFPT_PACKET_IN
707 2.005885167 172.31.31.144 -> 172.31.23.72 TCP 66 6633 → 45432 [ACK] Seq=281 Ack=795 Win=853 Len=0 TSval=809883 TSecr=19380008
708 2.005888973 172.31.31.144 -> 172.31.23.72 OpenFlow 187 Type: OFPT_PACKET_OUT
709 2.005896733 172.31.23.72 -> 172.31.31.144 OpenFlow 189 Type: OFPT_PACKET_IN
710 2.005918429 172.31.23.72 -> 172.31.31.144 OpenFlow 189 Type: OFPT_PACKET_IN
711 2.005930474 172.31.23.72 -> 172.31.31.144 OpenFlow 189 Type: OFPT_PACKET_IN
712 2.005943514 172.31.31.144 -> 172.31.23.72 OpenFlow 187 Type: OFPT_PACKET_OUT
713 2.005946496 172.31.31.144 -> 172.31.23.72 TCP 66 6633 → 45454 [ACK] Seq=1913 Ack=1122 Win=853 Len=0 TSval=809883 TSecr=19380008
714 2.005957910 172.31.23.72 -> 172.31.31.144 OpenFlow 189 Type: OFPT_PACKET_IN
715 2.005963652 172.31.23.72 -> 172.31.31.144 OpenFlow 189 Type: OFPT_PACKET_IN
716 2.005977255 172.31.23.72 -> 172.31.31.144 OpenFlow 189 Type: OFPT_PACKET_IN
717 2.005979825 172.31.23.72 -> 172.31.31.144 OpenFlow 189 Type: OFPT_PACKET_IN
718 2.005990231 172.31.23.72 -> 172.31.31.144 OpenFlow 189 Type: OFPT_PACKET_IN
719 2.005992678 172.31.23.72 -> 172.31.31.144 OpenFlow 435 Type: OFPT_PACKET_IN
720 2.006022944 172.31.31.144 -> 172.31.23.72 TCP 66 6633 → 45456 [ACK] Seq=65 Ack=295 Win=853 Len=0 TSval=809883 TSecr=19380008
721 2.006027026 172.31.31.144 -> 172.31.23.72 TCP 66 6633 → 45422 [ACK] Seq=65 Ack=418 Win=853 Len=0 TSval=809883 TSecr=19380008
722 2.006029460 172.31.31.144 -> 172.31.23.72 TCP 66 6633 → 45442 [ACK] Seq=1289 Ack=1514 Win=853 Len=0 TSval=809883 TSecr=19380008
723 2.006031358 172.31.31.144 -> 172.31.23.72 TCP 66 6633 → 45454 [ACK] Seq=1913 Ack=1245 Win=853 Len=0 TSval=809883 TSecr=19380008
724 2.006097136 172.31.23.72 -> 172.31.31.144 OpenFlow 189 Type: OFPT_PACKET_IN
725 2.006133375 172.31.23.72 -> 172.31.31.144 OpenFlow 189 Type: OFPT_PACKET_IN
726 2.006159460 172.31.31.144 -> 172.31.23.72 TCP 66 6633 → 45442 [ACK] Seq=1289 Ack=1637 Win=853 Len=0 TSval=809883 TSecr=19380008
727 2.006164206 172.31.31.144 -> 172.31.23.72 TCP 66 6633 → 45422 [ACK] Seq=65 Ack=541 Win=853 Len=0 TSval=809883 TSecr=19380008
728 2.006166069 172.31.31.144 -> 172.31.23.72 TCP 66 6633 → 45452 [ACK] Seq=1737 Ack=356 Win=853 Len=0 TSval=809883 TSecr=19380008
729 2.006168354 172.31.31.144 -> 172.31.23.72 OpenFlow 187 Type: OFPT_PACKET_OUT
730 2.006209691 172.31.31.144 -> 172.31.23.72 TCP 66 6633 → 45462 [ACK] Seq=1007 Ack=180 Win=853 Len=0 TSval=809883 TSecr=19380008
731 2.006214370 172.31.31.144 -> 172.31.23.72 TCP 66 6633 → 45452 [ACK] Seq=1737 Ack=479 Win=853 Len=0 TSval=809883 TSecr=19380008
732 2.006216430 172.31.31.144 -> 172.31.23.72 TCP 66 6633 → 45436 [ACK] Seq=1681 Ack=442 Win=853 Len=0 TSval=809883 TSecr=19380008
733 2.006220587 172.31.31.144 -> 172.31.23.72 OpenFlow 187 Type: OFPT_PACKET_OUT
734 2.006243852 172.31.31.144 -> 172.31.23.72 TCP 66 6633 → 45420 [ACK] Seq=1033 Ack=172 Win=853 Len=0 TSval=809883 TSecr=19380008
735 2.006282457 172.31.31.144 -> 172.31.23.72 TCP 66 6633 → 45462 [ACK] Seq=1007 Ack=303 Win=853 Len=0 TSval=809883 TSecr=19380008
736 2.006320365 172.31.31.144 -> 172.31.23.72 TCP 66 6633 → 45436 [ACK] Seq=1681 Ack=811 Win=853 Len=0 TSval=809883 TSecr=19380008
737 2.006333207 172.31.31.144 -> 172.31.23.72 TCP 66 6633 → 45420 [ACK] Seq=1033 Ack=295 Win=853 Len=0 TSval=809883 TSecr=19380008
738 2.006428251 172.31.23.72 -> 172.31.31.144 TCP 66 45430 → 6633 [ACK] Seq=803 Ack=1707 Win=213 Len=0 TSval=19380008 TSecr=809883
739 2.006505733 172.31.31.144 -> 172.31.23.72 TCP 66 6633 → 45426 [ACK] Seq=281 Ack=549 Win=853 Len=0 TSval=809883 TSecr=19380008
740 2.006595198 172.31.31.144 -> 172.31.23.72 TCP 66 6633 → 45424 [ACK] Seq=3291 Ack=1413 Win=853 Len=0 TSval=809883 TSecr=19380008
741 2.006645222 172.31.23.72 -> 172.31.31.144 TCP 66 45428 → 6633 [ACK] Seq=295 Ack=549 Win=213 Len=0 TSval=19380008 TSecr=809883
742 2.006754479 172.31.23.72 -> 172.31.31.144 OpenFlow 189 Type: OFPT_PACKET_IN
743 2.006779795 172.31.23.72 -> 172.31.31.144 OpenFlow 435 Type: OFPT_PACKET_IN
744 2.006872746 172.31.23.72 -> 172.31.31.144 OpenFlow 189 Type: OFPT_PACKET_IN
745 2.006888668 172.31.31.144 -> 172.31.23.72 OpenFlow 187 Type: OFPT_PACKET_OUT
746 2.006894525 172.31.23.72 -> 172.31.31.144 OpenFlow 189 Type: OFPT_PACKET_IN
747 2.006914296 172.31.23.72 -> 172.31.31.144 OpenFlow 189 Type: OFPT_PACKET_IN
748 2.006929724 172.31.23.72 -> 172.31.31.144 OpenFlow 189 Type: OFPT_PACKET_IN
749 2.006936915 172.31.23.72 -> 172.31.31.144 OpenFlow 189 Type: OFPT_PACKET_IN
750 2.006991074 172.31.23.72 -> 172.31.31.144 OpenFlow 312 Type: OFPT_PACKET_IN
751 2.007013127 172.31.31.144 -> 172.31.23.72 OpenFlow 187 Type: OFPT_PACKET_OUT
752 2.007062105 172.31.31.144 -> 172.31.23.72 TCP 66 6633 → 45436 [ACK] Seq=1681 Ack=934 Win=853 Len=0 TSval=809883 TSecr=19380008
753 2.007067185 172.31.31.144 -> 172.31.23.72 TCP 66 6633 → 45436 [ACK] Seq=1681 Ack=1057 Win=853 Len=0 TSval=809883 TSecr=19380008
754 2.007074823 172.31.23.72 -> 172.31.31.144 TCP 66 45428 → 6633 [ACK] Seq=295 Ack=791 Win=213 Len=0 TSval=19380008 TSecr=809883
755 2.007099562 172.31.31.144 -> 172.31.23.72 TCP 66 6633 → 45420 [ACK] Seq=1033 Ack=418 Win=853 Len=0 TSval=809883 TSecr=19380008
756 2.007123728 172.31.31.144 -> 172.31.23.72 OpenFlow 187 Type: OFPT_PACKET_OUT
757 2.007148347 172.31.31.144 -> 172.31.23.72 TCP 66 6633 → 45420 [ACK] Seq=1033 Ack=541 Win=853 Len=0 TSval=809883 TSecr=19380008
758 2.007176593 172.31.31.144 -> 172.31.23.72 TCP 66 6633 → 45434 [ACK] Seq=2867 Ack=1651 Win=853 Len=0 TSval=809883 TSecr=19380008
759 2.007219928 172.31.31.144 -> 172.31.23.72 TCP 66 6633 → 45426 [ACK] Seq=281 Ack=1041 Win=853 Len=0 TSval=809883 TSecr=19380008
760 2.007253937 172.31.23.72 -> 172.31.31.144 OpenFlow 189 Type: OFPT_PACKET_IN
761 2.007277571 172.31.23.72 -> 172.31.31.144 OpenFlow 189 Type: OFPT_PACKET_IN
762 2.007293829 172.31.23.72 -> 172.31.31.144 OpenFlow 189 Type: OFPT_PACKET_IN
763 2.007365337 172.31.31.144 -> 172.31.23.72 OpenFlow 187 Type: OFPT_PACKET_OUT
764 2.007401234 172.31.31.144 -> 172.31.23.72 TCP 66 6633 → 45432 [ACK] Seq=281 Ack=918 Win=853 Len=0 TSval=809883 TSecr=19380008
765 2.007430033 172.31.31.144 -> 172.31.23.72 TCP 66 6633 → 45432 [ACK] Seq=281 Ack=1041 Win=853 Len=0 TSval=809883 TSecr=19380008
766 2.007449680 172.31.31.144 -> 172.31.23.72 TCP 66 6633 → 45414 [ACK] Seq=1041 Ack=770 Win=853 Len=0 TSval=809883 TSecr=19380008
767 2.007452713 172.31.31.144 -> 172.31.23.72 OpenFlow 187 Type: OFPT_PACKET_OUT
768 2.007550074 172.31.23.72 -> 172.31.31.144 TCP 66 45416 → 6633 [ACK] Seq=1061 Ack=1572 Win=213 Len=0 TSval=19380008 TSecr=809883
769 2.007560664 172.31.31.144 -> 172.31.23.72 OpenFlow 187 Type: OFPT_PACKET_OUT
770 2.007688595 172.31.23.72 -> 172.31.31.144 OpenFlow 189 Type: OFPT_PACKET_IN
771 2.007803040 172.31.31.144 -> 172.31.23.72 OpenFlow 187 Type: OFPT_PACKET_OUT
772 2.007827243 172.31.23.72 -> 172.31.31.144 OpenFlow 189 Type: OFPT_PACKET_IN
773 2.007850847 172.31.31.144 -> 172.31.23.72 TCP 66 6633 → 45414 [ACK] Seq=1041 Ack=893 Win=853 Len=0 TSval=809883 TSecr=19380008
774 2.007856954 172.31.23.72 -> 172.31.31.144 OpenFlow 189 Type: OFPT_PACKET_IN
775 2.007876428 172.31.31.144 -> 172.31.23.72 OpenFlow 187 Type: OFPT_PACKET_OUT
776 2.007915451 172.31.23.72 -> 172.31.31.144 TCP 66 45416 → 6633 [ACK] Seq=1061 Ack=1935 Win=213 Len=0 TSval=19380008 TSecr=809883
777 2.007938505 172.31.31.144 -> 172.31.23.72 OpenFlow 187 Type: OFPT_PACKET_OUT
778 2.008021465 172.31.31.144 -> 172.31.23.72 TCP 66 6633 → 45418 [ACK] Seq=1763 Ack=717 Win=853 Len=0 TSval=809883 TSecr=19380008
779 2.008082119 172.31.31.144 -> 172.31.23.72 OpenFlow 187 Type: OFPT_PACKET_OUT
780 2.008187002 172.31.23.72 -> 172.31.31.144 TCP 66 45416 → 6633 [ACK] Seq=1061 Ack=2177 Win=213 Len=0 TSval=19380008 TSecr=809883
781 2.008376528 172.31.23.72 -> 172.31.31.144 OpenFlow 189 Type: OFPT_PACKET_IN
782 2.008400573 172.31.23.72 -> 172.31.31.144 OpenFlow 189 Type: OFPT_PACKET_IN
783 2.008588939 172.31.31.144 -> 172.31.23.72 TCP 66 6633 → 45424 [ACK] Seq=3291 Ack=1659 Win=853 Len=0 TSval=809884 TSecr=19380008
784 2.041417878 172.31.23.72 -> 172.31.31.144 TCP 66 45450 → 6633 [ACK] Seq=541 Ack=791 Win=213 Len=0 TSval=19380017 TSecr=809883
785 2.044201108 172.31.31.144 -> 172.31.23.72 TCP 66 6633 → 45450 [ACK] Seq=791 Ack=541 Win=853 Len=0 TSval=809893 TSecr=19380007
786 2.044214450 172.31.31.144 -> 172.31.23.72 TCP 66 6633 → 45434 [ACK] Seq=2867 Ack=1897 Win=853 Len=0 TSval=809893 TSecr=19380008
787 2.116756296 172.31.31.144 -> 172.31.23.72 OpenFlow 187 Type: OFPT_PACKET_OUT
788 2.116818573 172.31.31.144 -> 172.31.23.72 OpenFlow 187 Type: OFPT_PACKET_OUT
789 2.116875167 172.31.31.144 -> 172.31.23.72 OpenFlow 187 Type: OFPT_PACKET_OUT
790 2.116926397 172.31.31.144 -> 172.31.23.72 OpenFlow 187 Type: OFPT_PACKET_OUT
791 2.117006094 172.31.31.144 -> 172.31.23.72 OpenFlow 187 Type: OFPT_PACKET_OUT
792 2.117050479 172.31.31.144 -> 172.31.23.72 OpenFlow 187 Type: OFPT_PACKET_OUT
793 2.117130788 172.31.31.144 -> 172.31.23.72 OpenFlow 187 Type: OFPT_PACKET_OUT
794 2.117186346 172.31.31.144 -> 172.31.23.72 OpenFlow 187 Type: OFPT_PACKET_OUT
795 2.117265687 172.31.31.144 -> 172.31.23.72 OpenFlow 187 Type: OFPT_PACKET_OUT
796 2.117333888 172.31.31.144 -> 172.31.23.72 OpenFlow 187 Type: OFPT_PACKET_OUT
797 2.117388485 172.31.31.144 -> 172.31.23.72 OpenFlow 187 Type: OFPT_PACKET_OUT
798 2.117465203 172.31.31.144 -> 172.31.23.72 OpenFlow 187 Type: OFPT_PACKET_OUT
799 2.117492364 172.31.31.144 -> 172.31.23.72 OpenFlow 187 Type: OFPT_PACKET_OUT
800 2.117565958 172.31.31.144 -> 172.31.23.72 OpenFlow 187 Type: OFPT_PACKET_OUT
801 2.117593332 172.31.31.144 -> 172.31.23.72 OpenFlow 187 Type: OFPT_PACKET_OUT
802 2.117651549 172.31.23.72 -> 172.31.31.144 TCP 66 45446 → 6633 [ACK] Seq=885 Ack=1827 Win=213 Len=0 TSval=19380036 TSecr=809911
803 2.117663377 172.31.31.144 -> 172.31.23.72 OpenFlow 187 Type: OFPT_PACKET_OUT
804 2.117718651 172.31.31.144 -> 172.31.23.72 OpenFlow 187 Type: OFPT_PACKET_OUT
805 2.117843397 172.31.31.144 -> 172.31.23.72 OpenFlow 187 Type: OFPT_PACKET_OUT
806 2.117947150 172.31.31.144 -> 172.31.23.72 OpenFlow 187 Type: OFPT_PACKET_OUT
807 2.117974484 172.31.31.144 -> 172.31.23.72 OpenFlow 187 Type: OFPT_PACKET_OUT
808 2.117996454 172.31.31.144 -> 172.31.23.72 OpenFlow 187 Type: OFPT_PACKET_OUT
809 2.118035235 172.31.31.144 -> 172.31.23.72 OpenFlow 187 Type: OFPT_PACKET_OUT
810 2.118079347 172.31.23.72 -> 172.31.31.144 TCP 66 45432 → 6633 [ACK] Seq=1041 Ack=1249 Win=213 Len=0 TSval=19380036 TSecr=809911
811 2.118092751 172.31.31.144 -> 172.31.23.72 OpenFlow 187 Type: OFPT_PACKET_OUT
812 2.118166054 172.31.31.144 -> 172.31.23.72 OpenFlow 187 Type: OFPT_PACKET_OUT
813 2.118274442 172.31.31.144 -> 172.31.23.72 OpenFlow 187 Type: OFPT_PACKET_OUT
814 2.118299397 172.31.31.144 -> 172.31.23.72 OpenFlow 187 Type: OFPT_PACKET_OUT
815 2.118334232 172.31.23.72 -> 172.31.31.144 TCP 66 45460 → 6633 [ACK] Seq=225 Ack=1279 Win=213 Len=0 TSval=19380036 TSecr=809911
816 2.118386409 172.31.31.144 -> 172.31.23.72 OpenFlow 187 Type: OFPT_PACKET_OUT
817 2.118429828 172.31.23.72 -> 172.31.31.144 OpenFlow 189 Type: OFPT_PACKET_IN
818 2.118476169 172.31.23.72 -> 172.31.31.144 OpenFlow 435 Type: OFPT_PACKET_IN
819 2.118507822 172.31.31.144 -> 172.31.23.72 OpenFlow 187 Type: OFPT_PACKET_OUT
820 2.118513718 172.31.31.144 -> 172.31.23.72 OpenFlow 187 Type: OFPT_PACKET_OUT
821 2.118532562 172.31.31.144 -> 172.31.23.72 OpenFlow 187 Type: OFPT_PACKET_OUT
822 2.118654230 172.31.31.144 -> 172.31.23.72 OpenFlow 187 Type: OFPT_PACKET_OUT
823 2.118664342 172.31.31.144 -> 172.31.23.72 TCP 66 6633 → 45458 [ACK] Seq=1464 Ack=516 Win=853 Len=0 TSval=809911 TSecr=19380036
824 2.118699001 172.31.31.144 -> 172.31.23.72 TCP 66 6633 → 45458 [ACK] Seq=1464 Ack=885 Win=853 Len=0 TSval=809911 TSecr=19380036
825 2.118708466 172.31.23.72 -> 172.31.31.144 TCP 66 45458 → 6633 [ACK] Seq=885 Ack=1464 Win=213 Len=0 TSval=19380036 TSecr=809911
826 2.118746808 172.31.31.144 -> 172.31.23.72 OpenFlow 187 Type: OFPT_PACKET_OUT
827 2.118804511 172.31.31.144 -> 172.31.23.72 OpenFlow 187 Type: OFPT_PACKET_OUT
828 2.118809523 172.31.31.144 -> 172.31.23.72 OpenFlow 187 Type: OFPT_PACKET_OUT
829 2.118849213 172.31.23.72 -> 172.31.31.144 OpenFlow 189 Type: OFPT_PACKET_IN
830 2.118864816 172.31.31.144 -> 172.31.23.72 OpenFlow 187 Type: OFPT_PACKET_OUT
831 2.118869303 172.31.23.72 -> 172.31.31.144 OpenFlow 189 Type: OFPT_PACKET_IN
832 2.118890169 172.31.31.144 -> 172.31.23.72 OpenFlow 187 Type: OFPT_PACKET_OUT
833 2.118893715 172.31.23.72 -> 172.31.31.144 OpenFlow 312 Type: OFPT_PACKET_IN
834 2.118982798 172.31.31.144 -> 172.31.23.72 OpenFlow 187 Type: OFPT_PACKET_OUT
835 2.119025828 172.31.31.144 -> 172.31.23.72 OpenFlow 187 Type: OFPT_PACKET_OUT
836 2.119132467 172.31.23.72 -> 172.31.31.144 TCP 66 45456 → 6633 [ACK] Seq=787 Ack=791 Win=213 Len=0 TSval=19380036 TSecr=809911
837 2.119205298 172.31.23.72 -> 172.31.31.144 OpenFlow 189 Type: OFPT_PACKET_IN
838 2.119222596 172.31.31.144 -> 172.31.23.72 OpenFlow 187 Type: OFPT_PACKET_OUT
839 2.119229190 172.31.23.72 -> 172.31.31.144 OpenFlow 189 Type: OFPT_PACKET_IN
840 2.119248311 172.31.23.72 -> 172.31.31.144 OpenFlow 189 Type: OFPT_PACKET_IN
841 2.119304549 172.31.31.144 -> 172.31.23.72 OpenFlow 187 Type: OFPT_PACKET_OUT
842 2.119316684 172.31.23.72 -> 172.31.31.144 OpenFlow 435 Type: OFPT_PACKET_IN
843 2.119355700 172.31.31.144 -> 172.31.23.72 OpenFlow 187 Type: OFPT_PACKET_OUT
844 2.119360600 172.31.31.144 -> 172.31.23.72 TCP 66 6633 → 45454 [ACK] Seq=1913 Ack=1368 Win=853 Len=0 TSval=809911 TSecr=19380036
845 2.119387605 172.31.31.144 -> 172.31.23.72 TCP 66 6633 → 45454 [ACK] Seq=1913 Ack=1491 Win=853 Len=0 TSval=809911 TSecr=19380036
846 2.119418256 172.31.31.144 -> 172.31.23.72 OpenFlow 187 Type: OFPT_PACKET_OUT
847 2.119427328 172.31.23.72 -> 172.31.31.144 OpenFlow 189 Type: OFPT_PACKET_IN
848 2.119445836 172.31.23.72 -> 172.31.31.144 OpenFlow 189 Type: OFPT_PACKET_IN
849 2.119473139 172.31.31.144 -> 172.31.23.72 TCP 66 6633 → 45448 [ACK] Seq=281 Ack=426 Win=853 Len=0 TSval=809911 TSecr=19380036
850 2.119477084 172.31.31.144 -> 172.31.23.72 OpenFlow 187 Type: OFPT_PACKET_OUT
851 2.119490158 172.31.23.72 -> 172.31.31.144 OpenFlow 189 Type: OFPT_PACKET_IN
852 2.119497809 172.31.31.144 -> 172.31.23.72 TCP 66 6633 → 45448 [ACK] Seq=281 Ack=795 Win=853 Len=0 TSval=809911 TSecr=19380036
853 2.119508517 172.31.23.72 -> 172.31.31.144 OpenFlow 189 Type: OFPT_PACKET_IN
854 2.119533657 172.31.23.72 -> 172.31.31.144 OpenFlow 189 Type: OFPT_PACKET_IN
855 2.119538090 172.31.31.144 -> 172.31.23.72 OpenFlow 187 Type: OFPT_PACKET_OUT
856 2.119542021 172.31.23.72 -> 172.31.31.144 OpenFlow 312 Type: OFPT_PACKET_IN
857 2.119565779 172.31.23.72 -> 172.31.31.144 OpenFlow 189 Type: OFPT_PACKET_IN
858 2.119571560 172.31.23.72 -> 172.31.31.144 OpenFlow 435 Type: OFPT_PACKET_IN
859 2.119585383 172.31.23.72 -> 172.31.31.144 OpenFlow 189 Type: OFPT_PACKET_IN
860 2.119600739 172.31.31.144 -> 172.31.23.72 TCP 66 6633 → 45462 [ACK] Seq=1007 Ack=426 Win=853 Len=0 TSval=809911 TSecr=19380036
861 2.119612140 172.31.23.72 -> 172.31.31.144 OpenFlow 189 Type: OFPT_PACKET_IN
862 2.119617227 172.31.23.72 -> 172.31.31.144 OpenFlow 189 Type: OFPT_PACKET_IN
863 2.119637505 172.31.23.72 -> 172.31.31.144 OpenFlow 189 Type: OFPT_PACKET_IN
864 2.119648935 172.31.23.72 -> 172.31.31.144 OpenFlow 189 Type: OFPT_PACKET_IN
865 2.119651552 172.31.23.72 -> 172.31.31.144 OpenFlow 189 Type: OFPT_PACKET_IN
866 2.119670985 172.31.31.144 -> 172.31.23.72 TCP 66 6633 → 45462 [ACK] Seq=1007 Ack=549 Win=853 Len=0 TSval=809911 TSecr=19380036
867 2.119674382 172.31.31.144 -> 172.31.23.72 TCP 66 6633 → 45444 [ACK] Seq=2897 Ack=1530 Win=853 Len=0 TSval=809911 TSecr=19380036
868 2.119676599 172.31.31.144 -> 172.31.23.72 TCP 66 6633 → 45444 [ACK] Seq=2897 Ack=1653 Win=853 Len=0 TSval=809911 TSecr=19380036
869 2.119736083 172.31.23.72 -> 172.31.31.144 OpenFlow 189 Type: OFPT_PACKET_IN
870 2.119742868 172.31.23.72 -> 172.31.31.144 OpenFlow 189 Type: OFPT_PACKET_IN
871 2.119809374 172.31.31.144 -> 172.31.23.72 TCP 66 6633 → 45438 [ACK] Seq=1033 Ack=664 Win=853 Len=0 TSval=809911 TSecr=19380036
872 2.119815036 172.31.31.144 -> 172.31.23.72 TCP 66 6633 → 45444 [ACK] Seq=2897 Ack=1899 Win=853 Len=0 TSval=809911 TSecr=19380036
873 2.119817080 172.31.31.144 -> 172.31.23.72 TCP 66 6633 → 45438 [ACK] Seq=1033 Ack=1033 Win=853 Len=0 TSval=809911 TSecr=19380036
874 2.119822017 172.31.23.72 -> 172.31.31.144 OpenFlow 189 Type: OFPT_PACKET_IN
875 2.119856222 172.31.31.144 -> 172.31.23.72 OpenFlow 187 Type: OFPT_PACKET_OUT
876 2.119860096 172.31.31.144 -> 172.31.23.72 OpenFlow 308 Type: OFPT_PACKET_OUT
877 2.119879545 172.31.31.144 -> 172.31.23.72 TCP 66 6633 → 45446 [ACK] Seq=1827 Ack=1008 Win=853 Len=0 TSval=809911 TSecr=19380036
878 2.119901525 172.31.31.144 -> 172.31.23.72 TCP 66 6633 → 45460 [ACK] Seq=1279 Ack=348 Win=853 Len=0 TSval=809911 TSecr=19380036
879 2.119923677 172.31.23.72 -> 172.31.31.144 TCP 66 45414 → 6633 [ACK] Seq=893 Ack=1767 Win=213 Len=0 TSval=19380036 TSecr=809911
880 2.119932202 172.31.31.144 -> 172.31.23.72 OpenFlow 187 Type: OFPT_PACKET_OUT
881 2.119965707 172.31.31.144 -> 172.31.23.72 OpenFlow 187 Type: OFPT_PACKET_OUT
882 2.119981790 172.31.31.144 -> 172.31.23.72 OpenFlow 187 Type: OFPT_PACKET_OUT
883 2.120008260 172.31.31.144 -> 172.31.23.72 TCP 66 6633 → 45460 [ACK] Seq=1279 Ack=471 Win=853 Len=0 TSval=809911 TSecr=19380036
884 2.120050714 172.31.31.144 -> 172.31.23.72 OpenFlow 187 Type: OFPT_PACKET_OUT
885 2.120109956 172.31.31.144 -> 172.31.23.72 OpenFlow 187 Type: OFPT_PACKET_OUT
886 2.120140949 172.31.31.144 -> 172.31.23.72 TCP 66 6633 → 45428 [ACK] Seq=791 Ack=541 Win=853 Len=0 TSval=809912 TSecr=19380036
887 2.120167638 172.31.31.144 -> 172.31.23.72 TCP 66 6633 → 45458 [ACK] Seq=1585 Ack=1131 Win=853 Len=0 TSval=809912 TSecr=19380036
888 2.120230443 172.31.31.144 -> 172.31.23.72 OpenFlow 187 Type: OFPT_PACKET_OUT
889 2.120260135 172.31.23.72 -> 172.31.31.144 TCP 66 45454 → 6633 [ACK] Seq=1491 Ack=2760 Win=213 Len=0 TSval=19380036 TSecr=809911
890 2.120384325 172.31.31.144 -> 172.31.23.72 TCP 66 6633 → 45446 [ACK] Seq=1827 Ack=1131 Win=853 Len=0 TSval=809912 TSecr=19380036
891 2.120417554 172.31.23.72 -> 172.31.31.144 OpenFlow 189 Type: OFPT_PACKET_IN
892 2.120438331 172.31.23.72 -> 172.31.31.144 OpenFlow 189 Type: OFPT_PACKET_IN
893 2.120470798 172.31.23.72 -> 172.31.31.144 OpenFlow 189 Type: OFPT_PACKET_IN
894 2.120489034 172.31.23.72 -> 172.31.31.144 OpenFlow 189 Type: OFPT_PACKET_IN
895 2.120500422 172.31.23.72 -> 172.31.31.144 OpenFlow 189 Type: OFPT_PACKET_IN
896 2.120526204 172.31.23.72 -> 172.31.31.144 OpenFlow 189 Type: OFPT_PACKET_IN
897 2.120554107 172.31.23.72 -> 172.31.31.144 OpenFlow 189 Type: OFPT_PACKET_IN
898 2.120569528 172.31.23.72 -> 172.31.31.144 OpenFlow 189 Type: OFPT_PACKET_IN
899 2.120605576 172.31.23.72 -> 172.31.31.144 OpenFlow 189 Type: OFPT_PACKET_IN
900 2.120625989 172.31.31.144 -> 172.31.23.72 TCP 66 6633 → 45452 [ACK] Seq=1737 Ack=602 Win=853 Len=0 TSval=809912 TSecr=19380036
901 2.120630611 172.31.31.144 -> 172.31.23.72 TCP 66 6633 → 45452 [ACK] Seq=1737 Ack=725 Win=853 Len=0 TSval=809912 TSecr=19380036
902 2.120673376 172.31.31.144 -> 172.31.23.72 TCP 66 6633 → 45430 [ACK] Seq=1707 Ack=1049 Win=853 Len=0 TSval=809912 TSecr=19380036
903 2.120699288 172.31.31.144 -> 172.31.23.72 TCP 66 6633 → 45444 [ACK] Seq=2897 Ack=2022 Win=853 Len=0 TSval=809912 TSecr=19380036
904 2.120723178 172.31.31.144 -> 172.31.23.72 TCP 66 6633 → 45424 [ACK] Seq=3291 Ack=1905 Win=853 Len=0 TSval=809912 TSecr=19380036
905 2.120762899 172.31.31.144 -> 172.31.23.72 TCP 66 6633 → 45416 [ACK] Seq=2177 Ack=1307 Win=853 Len=0 TSval=809912 TSecr=19380036
906 2.120796230 172.31.31.144 -> 172.31.23.72 TCP 66 6633 → 45456 [ACK] Seq=1033 Ack=1033 Win=853 Len=0 TSval=809912 TSecr=19380036
907 2.120856120 172.31.31.144 -> 172.31.23.72 OpenFlow 187 Type: OFPT_PACKET_OUT
908 2.120923729 172.31.23.72 -> 172.31.31.144 OpenFlow 189 Type: OFPT_PACKET_IN
909 2.120944141 172.31.23.72 -> 172.31.31.144 OpenFlow 189 Type: OFPT_PACKET_IN
910 2.121117418 172.31.31.144 -> 172.31.23.72 TCP 66 6633 → 45446 [ACK] Seq=1827 Ack=1377 Win=853 Len=0 TSval=809912 TSecr=19380036
911 2.121143856 172.31.31.144 -> 172.31.23.72 OpenFlow 187 Type: OFPT_PACKET_OUT
912 2.121167591 172.31.31.144 -> 172.31.23.72 OpenFlow 187 Type: OFPT_PACKET_OUT
913 2.121179177 172.31.23.72 -> 172.31.31.144 OpenFlow 189 Type: OFPT_PACKET_IN
914 2.121234211 172.31.31.144 -> 172.31.23.72 OpenFlow 187 Type: OFPT_PACKET_OUT
915 2.121288511 172.31.31.144 -> 172.31.23.72 OpenFlow 187 Type: OFPT_PACKET_OUT
916 2.121327268 172.31.31.144 -> 172.31.23.72 TCP 66 6633 → 45444 [ACK] Seq=2897 Ack=2145 Win=853 Len=0 TSval=809912 TSecr=19380036
917 2.121370315 172.31.31.144 -> 172.31.23.72 OpenFlow 187 Type: OFPT_PACKET_OUT
918 2.121440126 172.31.31.144 -> 172.31.23.72 OpenFlow 187 Type: OFPT_PACKET_OUT
919 2.121526647 172.31.31.144 -> 172.31.23.72 OpenFlow 187 Type: OFPT_PACKET_OUT
920 2.121565406 172.31.31.144 -> 172.31.23.72 OpenFlow 187 Type: OFPT_PACKET_OUT
921 2.121579999 172.31.23.72 -> 172.31.31.144 TCP 66 45448 → 6633 [ACK] Seq=795 Ack=1007 Win=213 Len=0 TSval=19380037 TSecr=809912
922 2.121621706 172.31.31.144 -> 172.31.23.72 OpenFlow 187 Type: OFPT_PACKET_OUT
923 2.121677921 172.31.31.144 -> 172.31.23.72 OpenFlow 187 Type: OFPT_PACKET_OUT
924 2.121784356 172.31.23.72 -> 172.31.31.144 TCP 66 45442 → 6633 [ACK] Seq=1637 Ack=1773 Win=213 Len=0 TSval=19380037 TSecr=809912
925 2.121918849 172.31.23.72 -> 172.31.31.144 OpenFlow 189 Type: OFPT_PACKET_IN
926 2.121940659 172.31.23.72 -> 172.31.31.144 OpenFlow 189 Type: OFPT_PACKET_IN
927 2.121951314 172.31.23.72 -> 172.31.31.144 OpenFlow 189 Type: OFPT_PACKET_IN
928 2.121972117 172.31.23.72 -> 172.31.31.144 OpenFlow 189 Type: OFPT_PACKET_IN
929 2.122005253 172.31.23.72 -> 172.31.31.144 OpenFlow 189 Type: OFPT_PACKET_IN
930 2.122009713 172.31.23.72 -> 172.31.31.144 OpenFlow 189 Type: OFPT_PACKET_IN
931 2.122037906 172.31.23.72 -> 172.31.31.144 OpenFlow 189 Type: OFPT_PACKET_IN
932 2.122068196 172.31.23.72 -> 172.31.31.144 OpenFlow 189 Type: OFPT_PACKET_IN
933 2.122122001 172.31.23.72 -> 172.31.31.144 OpenFlow 189 Type: OFPT_PACKET_IN
934 2.122126694 172.31.23.72 -> 172.31.31.144 OpenFlow 189 Type: OFPT_PACKET_IN
935 2.122145517 172.31.31.144 -> 172.31.23.72 TCP 66 6633 → 45452 [ACK] Seq=1737 Ack=848 Win=853 Len=0 TSval=809912 TSecr=19380037
936 2.122150299 172.31.31.144 -> 172.31.23.72 TCP 66 6633 → 45462 [ACK] Seq=1007 Ack=672 Win=853 Len=0 TSval=809912 TSecr=19380037
937 2.122152379 172.31.31.144 -> 172.31.23.72 TCP 66 6633 → 45452 [ACK] Seq=1737 Ack=971 Win=853 Len=0 TSval=809912 TSecr=19380037
938 2.122192717 172.31.31.144 -> 172.31.23.72 TCP 66 6633 → 45462 [ACK] Seq=1007 Ack=795 Win=853 Len=0 TSval=809912 TSecr=19380037
939 2.122237522 172.31.31.144 -> 172.31.23.72 TCP 66 6633 → 45434 [ACK] Seq=2867 Ack=2143 Win=853 Len=0 TSval=809912 TSecr=19380037
940 2.122262293 172.31.31.144 -> 172.31.23.72 TCP 66 6633 → 45460 [ACK] Seq=1279 Ack=594 Win=853 Len=0 TSval=809912 TSecr=19380037
941 2.122288064 172.31.31.144 -> 172.31.23.72 TCP 66 6633 → 45460 [ACK] Seq=1279 Ack=717 Win=853 Len=0 TSval=809912 TSecr=19380037
942 2.122346718 172.31.31.144 -> 172.31.23.72 TCP 66 6633 → 45446 [ACK] Seq=1827 Ack=1623 Win=853 Len=0 TSval=809912 TSecr=19380037
943 2.157405116 172.31.23.72 -> 172.31.31.144 TCP 66 45454 → 6633 [ACK] Seq=1491 Ack=2881 Win=213 Len=0 TSval=19380046 TSecr=809912
944 2.200157181 172.31.31.144 -> 172.31.23.72 OpenFlow 187 Type: OFPT_PACKET_OUT
945 2.200182898 172.31.31.144 -> 172.31.23.72 OpenFlow 187 Type: OFPT_PACKET_OUT
946 2.200214630 172.31.31.144 -> 172.31.23.72 OpenFlow 187 Type: OFPT_PACKET_OUT
947 2.200274413 172.31.31.144 -> 172.31.23.72 OpenFlow 187 Type: OFPT_PACKET_OUT
948 2.200332460 172.31.31.144 -> 172.31.23.72 OpenFlow 187 Type: OFPT_PACKET_OUT
949 2.200400830 172.31.31.144 -> 172.31.23.72 OpenFlow 187 Type: OFPT_PACKET_OUT
950 2.200428526 172.31.31.144 -> 172.31.23.72 OpenFlow 187 Type: OFPT_PACKET_OUT
951 2.200499293 172.31.31.144 -> 172.31.23.72 OpenFlow 187 Type: OFPT_PACKET_OUT
952 2.200544531 172.31.31.144 -> 172.31.23.72 OpenFlow 187 Type: OFPT_PACKET_OUT
953 2.200624084 172.31.31.144 -> 172.31.23.72 OpenFlow 187 Type: OFPT_PACKET_OUT
954 2.200749746 172.31.31.144 -> 172.31.23.72 OpenFlow 187 Type: OFPT_PACKET_OUT
955 2.200779095 172.31.31.144 -> 172.31.23.72 OpenFlow 187 Type: OFPT_PACKET_OUT
956 2.200813571 172.31.31.144 -> 172.31.23.72 OpenFlow 187 Type: OFPT_PACKET_OUT
957 2.200846592 172.31.31.144 -> 172.31.23.72 OpenFlow 187 Type: OFPT_PACKET_OUT
958 2.200935650 172.31.31.144 -> 172.31.23.72 OpenFlow 187 Type: OFPT_PACKET_OUT
959 2.200973083 172.31.31.144 -> 172.31.23.72 OpenFlow 187 Type: OFPT_PACKET_OUT
960 2.201097308 172.31.23.72 -> 172.31.31.144 TCP 66 45426 → 6633 [ACK] Seq=1041 Ack=1491 Win=213 Len=0 TSval=19380056 TSecr=809931
961 2.201176741 172.31.23.72 -> 172.31.31.144 OpenFlow 189 Type: OFPT_PACKET_IN
962 2.201220483 172.31.23.72 -> 172.31.31.144 OpenFlow 189 Type: OFPT_PACKET_IN
963 2.201417800 172.31.31.144 -> 172.31.23.72 TCP 66 6633 → 45422 [ACK] Seq=791 Ack=787 Win=853 Len=0 TSval=809932 TSecr=19380056
964 2.201601824 172.31.23.72 -> 172.31.31.144 OpenFlow 189 Type: OFPT_PACKET_IN
965 2.201627720 172.31.23.72 -> 172.31.31.144 OpenFlow 189 Type: OFPT_PACKET_IN
966 2.201639621 172.31.23.72 -> 172.31.31.144 OpenFlow 189 Type: OFPT_PACKET_IN
967 2.201653252 172.31.23.72 -> 172.31.31.144 OpenFlow 189 Type: OFPT_PACKET_IN
968 2.201694294 172.31.23.72 -> 172.31.31.144 OpenFlow 189 Type: OFPT_PACKET_IN
969 2.201696647 172.31.23.72 -> 172.31.31.144 OpenFlow 189 Type: OFPT_PACKET_IN
970 2.201710742 172.31.23.72 -> 172.31.31.144 OpenFlow 189 Type: OFPT_PACKET_IN
971 2.201716127 172.31.23.72 -> 172.31.31.144 OpenFlow 435 Type: OFPT_PACKET_IN
972 2.201771370 172.31.23.72 -> 172.31.31.144 OpenFlow 189 Type: OFPT_PACKET_IN
973 2.201780093 172.31.23.72 -> 172.31.31.144 OpenFlow 189 Type: OFPT_PACKET_IN
974 2.201781772 172.31.23.72 -> 172.31.31.144 OpenFlow 189 Type: OFPT_PACKET_IN
975 2.201817577 172.31.31.144 -> 172.31.23.72 TCP 66 6633 → 45420 [ACK] Seq=1033 Ack=664 Win=853 Len=0 TSval=809932 TSecr=19380057
976 2.201844718 172.31.23.72 -> 172.31.31.144 OpenFlow 189 Type: OFPT_PACKET_IN
977 2.201886749 172.31.31.144 -> 172.31.23.72 TCP 66 6633 → 45420 [ACK] Seq=1033 Ack=787 Win=853 Len=0 TSval=809932 TSecr=19380057
978 2.201971906 172.31.31.144 -> 172.31.23.72 TCP 66 6633 → 45418 [ACK] Seq=1763 Ack=1209 Win=853 Len=0 TSval=809932 TSecr=19380057
979 2.202149369 172.31.31.144 -> 172.31.23.72 TCP 66 6633 → 45424 [ACK] Seq=3291 Ack=2151 Win=853 Len=0 TSval=809932 TSecr=19380057
980 2.202207662 172.31.31.144 -> 172.31.23.72 TCP 66 6633 → 45426 [ACK] Seq=1491 Ack=1287 Win=853 Len=0 TSval=809932 TSecr=19380057
981 2.202235255 172.31.31.144 -> 172.31.23.72 TCP 66 6633 → 45430 [ACK] Seq=1707 Ack=1295 Win=853 Len=0 TSval=809932 TSecr=19380057
982 2.202385282 172.31.31.144 -> 172.31.23.72 TCP 66 6633 → 45428 [ACK] Seq=791 Ack=787 Win=853 Len=0 TSval=809932 TSecr=19380057
