  1 0.000000000 172.31.31.144 -> 172.31.23.72 TCP 122 6633 → 51146 [PSH, ACK] Seq=1 Ack=1 Win=853 Len=56 TSval=5399764 TSecr=23969783
  2 0.000024129 172.31.31.144 -> 172.31.23.72 TCP 106 6633 → 51146 [PSH, ACK] Seq=57 Ack=1 Win=853 Len=40 TSval=5399764 TSecr=23969783
  3 0.000212607 172.31.23.72 -> 172.31.31.144 OpenFlow 3258 Type: OFPT_MULTIPART_REPLY, OFPMP_FLOW
  4 0.000406638 172.31.23.72 -> 172.31.31.144 OpenFlow 6178 Type: OFPT_MULTIPART_REPLY, OFPMP_TABLE
  5 0.000503107 172.31.23.72 -> 172.31.31.144 OpenFlow 754 Type: OFPT_MULTIPART_REPLY, OFPMP_PORT_STATS
  6 0.000599262 172.31.31.144 -> 172.31.23.72 TCP 66 6633 → 51146 [ACK] Seq=97 Ack=9305 Win=853 Len=0 TSval=5399764 TSecr=23969890
  7 0.001725468 172.31.31.144 -> 172.31.23.72 TCP 66 6633 → 51144 [ACK] Seq=1 Ack=1 Win=853 Len=0 TSval=5399765 TSecr=23969880
  8 0.037812845 172.31.31.144 -> 172.31.23.72 TCP 66 6633 → 51146 [ACK] Seq=97 Ack=9993 Win=853 Len=0 TSval=5399774 TSecr=23969890
  9 0.047196777 172.31.31.144 -> 172.31.23.72 TCP 122 6633 → 51148 [PSH, ACK] Seq=1 Ack=1 Win=853 Len=56 TSval=5399776 TSecr=23969732
 10 0.047224193 172.31.31.144 -> 172.31.23.72 TCP 106 6633 → 51148 [PSH, ACK] Seq=57 Ack=1 Win=853 Len=40 TSval=5399776 TSecr=23969732
 11 0.047335044 172.31.23.72 -> 172.31.31.144 OpenFlow 970 Type: OFPT_MULTIPART_REPLY, OFPMP_FLOW
 12 0.047501556 172.31.23.72 -> 172.31.31.144 OpenFlow 6178 Type: OFPT_MULTIPART_REPLY, OFPMP_TABLE
 13 0.047591586 172.31.23.72 -> 172.31.31.144 OpenFlow 642 Type: OFPT_MULTIPART_REPLY, OFPMP_PORT_STATS
 14 0.047747383 172.31.31.144 -> 172.31.23.72 TCP 66 6633 → 51148 [ACK] Seq=97 Ack=7593 Win=853 Len=0 TSval=5399776 TSecr=23969902
 15 0.096447877 172.31.31.144 -> 172.31.23.72 TCP 82 6633 → 51150 [PSH, ACK] Seq=1 Ack=1 Win=853 Len=16 TSval=5399788 TSecr=23969783
 16 0.096478676 172.31.31.144 -> 172.31.23.72 TCP 146 6633 → 51150 [PSH, ACK] Seq=17 Ack=1 Win=853 Len=80 TSval=5399788 TSecr=23969783
 17 0.096820002 172.31.23.72 -> 172.31.31.144 OpenFlow 6178 Type: OFPT_MULTIPART_REPLY, OFPMP_TABLE
 18 0.096931413 172.31.23.72 -> 172.31.31.144 OpenFlow 642 Type: OFPT_MULTIPART_REPLY, OFPMP_PORT_STATS
 19 0.096990480 172.31.23.72 -> 172.31.31.144 OpenFlow 1386 Type: OFPT_MULTIPART_REPLY, OFPMP_FLOW
 20 0.097142665 172.31.31.144 -> 172.31.23.72 TCP 66 6633 → 51150 [ACK] Seq=97 Ack=8009 Win=853 Len=0 TSval=5399788 TSecr=23969914
 21 0.147689148 172.31.31.144 -> 172.31.23.72 TCP 82 6633 → 51152 [PSH, ACK] Seq=1 Ack=1 Win=853 Len=16 TSval=5399801 TSecr=23969782
 22 0.147719129 172.31.31.144 -> 172.31.23.72 TCP 146 6633 → 51152 [PSH, ACK] Seq=17 Ack=1 Win=853 Len=80 TSval=5399801 TSecr=23969782
 23 0.148086595 172.31.23.72 -> 172.31.31.144 OpenFlow 6178 Type: OFPT_MULTIPART_REPLY, OFPMP_TABLE
 24 0.148192083 172.31.23.72 -> 172.31.31.144 OpenFlow 530 Type: OFPT_MULTIPART_REPLY, OFPMP_PORT_STATS
 25 0.148240258 172.31.23.72 -> 172.31.31.144 OpenFlow 346 Type: OFPT_MULTIPART_REPLY, OFPMP_FLOW
 26 0.148447828 172.31.31.144 -> 172.31.23.72 TCP 66 6633 → 51152 [ACK] Seq=97 Ack=6857 Win=853 Len=0 TSval=5399801 TSecr=23969927
 27 0.204853245 172.31.31.144 -> 172.31.23.72 TCP 90 6633 → 51154 [PSH, ACK] Seq=1 Ack=1 Win=853 Len=24 TSval=5399815 TSecr=23969783
 28 0.204888043 172.31.31.144 -> 172.31.23.72 TCP 138 6633 → 51154 [PSH, ACK] Seq=25 Ack=1 Win=853 Len=72 TSval=5399815 TSecr=23969783
 29 0.205233360 172.31.23.72 -> 172.31.31.144 OpenFlow 530 Type: OFPT_MULTIPART_REPLY, OFPMP_PORT_STATS
 30 0.205336246 172.31.23.72 -> 172.31.31.144 OpenFlow 3258 Type: OFPT_MULTIPART_REPLY, OFPMP_FLOW
 31 0.205441987 172.31.31.144 -> 172.31.23.72 TCP 66 6633 → 51154 [ACK] Seq=97 Ack=465 Win=853 Len=0 TSval=5399815 TSecr=23969941
 32 0.205513032 172.31.31.144 -> 172.31.23.72 TCP 66 6633 → 51154 [ACK] Seq=97 Ack=3657 Win=853 Len=0 TSval=5399815 TSecr=23969941
 33 0.205535414 172.31.23.72 -> 172.31.31.144 OpenFlow 6178 Type: OFPT_MULTIPART_REPLY, OFPMP_TABLE
 34 0.205737423 172.31.31.144 -> 172.31.23.72 TCP 66 6633 → 51154 [ACK] Seq=97 Ack=9769 Win=853 Len=0 TSval=5399816 TSecr=23969941
 35 0.265071000 172.31.31.144 -> 172.31.23.72 TCP 122 6633 → 51156 [PSH, ACK] Seq=1 Ack=1 Win=853 Len=56 TSval=5399830 TSecr=23969832
 36 0.265091669 172.31.23.72 -> 172.31.31.144 TCP 66 51156 → 6633 [ACK] Seq=1 Ack=57 Win=213 Len=0 TSval=23969956 TSecr=5399830
 37 0.265107883 172.31.31.144 -> 172.31.23.72 TCP 106 6633 → 51156 [PSH, ACK] Seq=57 Ack=1 Win=853 Len=40 TSval=5399830 TSecr=23969832
 38 0.265113047 172.31.23.72 -> 172.31.31.144 TCP 66 51156 → 6633 [ACK] Seq=1 Ack=97 Win=213 Len=0 TSval=23969956 TSecr=5399830
 39 0.265361680 172.31.23.72 -> 172.31.31.144 OpenFlow 2842 Type: OFPT_MULTIPART_REPLY, OFPMP_FLOW
 40 0.265524577 172.31.31.144 -> 172.31.23.72 TCP 66 6633 → 51156 [ACK] Seq=97 Ack=2777 Win=853 Len=0 TSval=5399830 TSecr=23969956
 41 0.265536756 172.31.23.72 -> 172.31.31.144 OpenFlow 6178 Type: OFPT_MULTIPART_REPLY, OFPMP_TABLE
 42 0.265652192 172.31.23.72 -> 172.31.31.144 OpenFlow 754 Type: OFPT_MULTIPART_REPLY, OFPMP_PORT_STATS
 43 0.265726310 172.31.31.144 -> 172.31.23.72 TCP 66 6633 → 51156 [ACK] Seq=97 Ack=8889 Win=853 Len=0 TSval=5399831 TSecr=23969956
 44 0.265817018 172.31.31.144 -> 172.31.23.72 TCP 66 6633 → 51156 [ACK] Seq=97 Ack=9577 Win=853 Len=0 TSval=5399831 TSecr=23969956
 45 0.314478859 172.31.31.144 -> 172.31.23.72 TCP 122 6633 → 51158 [PSH, ACK] Seq=1 Ack=1 Win=853 Len=56 TSval=5399843 TSecr=23969832
 46 0.314515025 172.31.31.144 -> 172.31.23.72 TCP 106 6633 → 51158 [PSH, ACK] Seq=57 Ack=1 Win=853 Len=40 TSval=5399843 TSecr=23969832
 47 0.314726061 172.31.23.72 -> 172.31.31.144 OpenFlow 3050 Type: OFPT_MULTIPART_REPLY, OFPMP_FLOW
 48 0.314890613 172.31.23.72 -> 172.31.31.144 OpenFlow 6178 Type: OFPT_MULTIPART_REPLY, OFPMP_TABLE
 49 0.314995743 172.31.23.72 -> 172.31.31.144 OpenFlow 754 Type: OFPT_MULTIPART_REPLY, OFPMP_PORT_STATS
 50 0.315113277 172.31.31.144 -> 172.31.23.72 TCP 66 6633 → 51158 [ACK] Seq=97 Ack=9097 Win=853 Len=0 TSval=5399843 TSecr=23969968
 51 0.353831738 172.31.31.144 -> 172.31.23.72 TCP 66 6633 → 51158 [ACK] Seq=97 Ack=9785 Win=853 Len=0 TSval=5399853 TSecr=23969968
 52 0.419767764 172.31.31.144 -> 172.31.23.72 TCP 90 6633 → 51160 [PSH, ACK] Seq=1 Ack=1 Win=853 Len=24 TSval=5399869 TSecr=23969832
 53 0.419806866 172.31.31.144 -> 172.31.23.72 TCP 138 6633 → 51160 [PSH, ACK] Seq=25 Ack=1 Win=853 Len=72 TSval=5399869 TSecr=23969832
 54 0.420214007 172.31.23.72 -> 172.31.31.144 OpenFlow 530 Type: OFPT_MULTIPART_REPLY, OFPMP_PORT_STATS
 55 0.420292570 172.31.23.72 -> 172.31.31.144 OpenFlow 1802 Type: OFPT_MULTIPART_REPLY, OFPMP_FLOW
 56 0.420463585 172.31.23.72 -> 172.31.31.144 OpenFlow 6178 Type: OFPT_MULTIPART_REPLY, OFPMP_TABLE
 57 0.420584970 172.31.31.144 -> 172.31.23.72 TCP 66 6633 → 51160 [ACK] Seq=97 Ack=2201 Win=853 Len=0 TSval=5399869 TSecr=23969995
 58 0.457880833 172.31.31.144 -> 172.31.23.72 TCP 66 6633 → 51160 [ACK] Seq=97 Ack=8313 Win=853 Len=0 TSval=5399879 TSecr=23969995
 59 0.508911526 172.31.31.144 -> 172.31.23.72 TCP 122 6633 → 51162 [PSH, ACK] Seq=1 Ack=1 Win=853 Len=56 TSval=5399891 TSecr=23969783
 60 0.508940030 172.31.31.144 -> 172.31.23.72 TCP 106 6633 → 51162 [PSH, ACK] Seq=57 Ack=1 Win=853 Len=40 TSval=5399891 TSecr=23969783
 61 0.509142216 172.31.23.72 -> 172.31.31.144 OpenFlow 2426 Type: OFPT_MULTIPART_REPLY, OFPMP_FLOW
 62 0.509245448 172.31.23.72 -> 172.31.31.144 OpenFlow 530 Type: OFPT_MULTIPART_REPLY, OFPMP_PORT_STATS
 63 0.509412858 172.31.31.144 -> 172.31.23.72 TCP 66 6633 → 51162 [ACK] Seq=97 Ack=2361 Win=853 Len=0 TSval=5399891 TSecr=23970017
 64 0.509426615 172.31.31.144 -> 172.31.23.72 TCP 66 6633 → 51162 [ACK] Seq=97 Ack=2825 Win=853 Len=0 TSval=5399891 TSecr=23970017
 65 0.509439743 172.31.23.72 -> 172.31.31.144 OpenFlow 6178 Type: OFPT_MULTIPART_REPLY, OFPMP_TABLE
 66 0.509676309 172.31.31.144 -> 172.31.23.72 TCP 66 6633 → 51162 [ACK] Seq=97 Ack=8937 Win=853 Len=0 TSval=5399891 TSecr=23970017
 67 0.536171852 172.31.31.144 -> 172.31.23.72 TCP 82 6633 → 51164 [PSH, ACK] Seq=1 Ack=1 Win=853 Len=16 TSval=5399898 TSecr=23969807
 68 0.536180788 172.31.31.144 -> 172.31.23.72 TCP 146 6633 → 51164 [PSH, ACK] Seq=17 Ack=1 Win=853 Len=80 TSval=5399898 TSecr=23969807
 69 0.536376849 172.31.23.72 -> 172.31.31.144 OpenFlow 6178 Type: OFPT_MULTIPART_REPLY, OFPMP_TABLE
 70 0.536481318 172.31.23.72 -> 172.31.31.144 OpenFlow 642 Type: OFPT_MULTIPART_REPLY, OFPMP_PORT_STATS
 71 0.536583183 172.31.23.72 -> 172.31.31.144 OpenFlow 3882 Type: OFPT_MULTIPART_REPLY, OFPMP_FLOW
 72 0.536707096 172.31.31.144 -> 172.31.23.72 TCP 66 6633 → 51164 [ACK] Seq=97 Ack=6113 Win=853 Len=0 TSval=5399898 TSecr=23970024
 73 0.536722011 172.31.31.144 -> 172.31.23.72 TCP 66 6633 → 51164 [ACK] Seq=97 Ack=6689 Win=853 Len=0 TSval=5399898 TSecr=23970024
 74 0.536802303 172.31.31.144 -> 172.31.23.72 TCP 66 6633 → 51164 [ACK] Seq=97 Ack=10505 Win=853 Len=0 TSval=5399898 TSecr=23970024
 75 0.606559227 172.31.31.144 -> 172.31.23.72 TCP 90 6633 → 51166 [PSH, ACK] Seq=1 Ack=1 Win=853 Len=24 TSval=5399916 TSecr=23969832
 76 0.606588173 172.31.31.144 -> 172.31.23.72 TCP 138 6633 → 51166 [PSH, ACK] Seq=25 Ack=1 Win=853 Len=72 TSval=5399916 TSecr=23969832
 77 0.606832023 172.31.23.72 -> 172.31.31.144 OpenFlow 642 Type: OFPT_MULTIPART_REPLY, OFPMP_PORT_STATS
 78 0.606927518 172.31.23.72 -> 172.31.31.144 OpenFlow 2426 Type: OFPT_MULTIPART_REPLY, OFPMP_FLOW
 79 0.607078750 172.31.31.144 -> 172.31.23.72 TCP 66 6633 → 51166 [ACK] Seq=97 Ack=577 Win=853 Len=0 TSval=5399916 TSecr=23970041
 80 0.607097166 172.31.31.144 -> 172.31.23.72 TCP 66 6633 → 51166 [ACK] Seq=97 Ack=2937 Win=853 Len=0 TSval=5399916 TSecr=23970041
 81 0.607104185 172.31.23.72 -> 172.31.31.144 OpenFlow 6178 Type: OFPT_MULTIPART_REPLY, OFPMP_TABLE
 82 0.607305106 172.31.31.144 -> 172.31.23.72 TCP 66 6633 → 51166 [ACK] Seq=97 Ack=9049 Win=853 Len=0 TSval=5399916 TSecr=23970041
 83 0.666715114 172.31.31.144 -> 172.31.23.72 TCP 82 6633 → 51168 [PSH, ACK] Seq=1 Ack=1 Win=853 Len=16 TSval=5399931 TSecr=23969832
 84 0.666752445 172.31.31.144 -> 172.31.23.72 TCP 146 6633 → 51168 [PSH, ACK] Seq=17 Ack=1 Win=853 Len=80 TSval=5399931 TSecr=23969832
 85 0.667175738 172.31.23.72 -> 172.31.31.144 OpenFlow 6178 Type: OFPT_MULTIPART_REPLY, OFPMP_TABLE
 86 0.667333298 172.31.23.72 -> 172.31.31.144 OpenFlow 642 Type: OFPT_MULTIPART_REPLY, OFPMP_PORT_STATS
 87 0.667385684 172.31.23.72 -> 172.31.31.144 OpenFlow 970 Type: OFPT_MULTIPART_REPLY, OFPMP_FLOW
 88 0.667504725 172.31.31.144 -> 172.31.23.72 TCP 66 6633 → 51168 [ACK] Seq=97 Ack=6113 Win=853 Len=0 TSval=5399931 TSecr=23970056
 89 0.667521976 172.31.31.144 -> 172.31.23.72 TCP 66 6633 → 51168 [ACK] Seq=97 Ack=6689 Win=853 Len=0 TSval=5399931 TSecr=23970057
 90 0.667611449 172.31.31.144 -> 172.31.23.72 TCP 66 6633 → 51168 [ACK] Seq=97 Ack=7593 Win=853 Len=0 TSval=5399931 TSecr=23970057
 91 0.680990686 172.31.31.144 -> 172.31.23.72 TCP 90 6633 → 51170 [PSH, ACK] Seq=1 Ack=1 Win=853 Len=24 TSval=5399934 TSecr=23969832
 92 0.681001034 172.31.31.144 -> 172.31.23.72 TCP 138 6633 → 51170 [PSH, ACK] Seq=25 Ack=1 Win=853 Len=72 TSval=5399934 TSecr=23969832
 93 0.681210513 172.31.23.72 -> 172.31.31.144 OpenFlow 642 Type: OFPT_MULTIPART_REPLY, OFPMP_PORT_STATS
 94 0.681286422 172.31.23.72 -> 172.31.31.144 OpenFlow 2218 Type: OFPT_MULTIPART_REPLY, OFPMP_FLOW
 95 0.681433544 172.31.23.72 -> 172.31.31.144 OpenFlow 6178 Type: OFPT_MULTIPART_REPLY, OFPMP_TABLE
 96 0.681519691 172.31.31.144 -> 172.31.23.72 TCP 66 6633 → 51170 [ACK] Seq=97 Ack=2729 Win=853 Len=0 TSval=5399934 TSecr=23970060
 97 0.709192416 172.31.31.144 -> 172.31.23.72 TCP 90 6633 → 51172 [PSH, ACK] Seq=1 Ack=1 Win=853 Len=24 TSval=5399941 TSecr=23969832
 98 0.709202953 172.31.31.144 -> 172.31.23.72 TCP 122 6633 → 51172 [PSH, ACK] Seq=25 Ack=1 Win=853 Len=56 TSval=5399941 TSecr=23969832
 99 0.709228582 172.31.31.144 -> 172.31.23.72 TCP 82 6633 → 51172 [PSH, ACK] Seq=81 Ack=1 Win=853 Len=16 TSval=5399941 TSecr=23969832
100 0.709420660 172.31.23.72 -> 172.31.31.144 OpenFlow 530 Type: OFPT_MULTIPART_REPLY, OFPMP_PORT_STATS
101 0.709503951 172.31.23.72 -> 172.31.31.144 OpenFlow 2010 Type: OFPT_MULTIPART_REPLY, OFPMP_FLOW
102 0.709678676 172.31.23.72 -> 172.31.31.144 OpenFlow 6178 Type: OFPT_MULTIPART_REPLY, OFPMP_TABLE
103 0.709699006 172.31.31.144 -> 172.31.23.72 TCP 66 6633 → 51172 [ACK] Seq=97 Ack=2409 Win=853 Len=0 TSval=5399942 TSecr=23970067
104 0.717805172 172.31.31.144 -> 172.31.23.72 TCP 66 6633 → 51170 [ACK] Seq=97 Ack=8841 Win=853 Len=0 TSval=5399944 TSecr=23970060
105 0.749832500 172.31.31.144 -> 172.31.23.72 TCP 66 6633 → 51172 [ACK] Seq=97 Ack=8521 Win=853 Len=0 TSval=5399952 TSecr=23970067
106 1.869640913 172.31.31.144 -> 172.31.23.72 TCP 187 6633 → 51126 [PSH, ACK] Seq=1 Ack=1 Win=853 Len=121 TSval=5400231 TSecr=23969779
107 1.869689017 172.31.31.144 -> 172.31.23.72 TCP 187 6633 → 51126 [PSH, ACK] Seq=122 Ack=1 Win=853 Len=121 TSval=5400231 TSecr=23969779
108 1.869694181 172.31.31.144 -> 172.31.23.72 TCP 187 6633 → 51126 [PSH, ACK] Seq=243 Ack=1 Win=853 Len=121 TSval=5400232 TSecr=23969779
109 1.869819595 172.31.31.144 -> 172.31.23.72 TCP 187 6633 → 51126 [PSH, ACK] Seq=364 Ack=1 Win=853 Len=121 TSval=5400232 TSecr=23969779
110 1.869876250 172.31.31.144 -> 172.31.23.72 TCP 187 6633 → 51126 [PSH, ACK] Seq=485 Ack=1 Win=853 Len=121 TSval=5400232 TSecr=23969779
111 1.869947054 172.31.31.144 -> 172.31.23.72 TCP 187 6633 → 51126 [PSH, ACK] Seq=606 Ack=1 Win=853 Len=121 TSval=5400232 TSecr=23969779
112 1.870057337 172.31.31.144 -> 172.31.23.72 TCP 187 6633 → 51128 [PSH, ACK] Seq=1 Ack=1 Win=853 Len=121 TSval=5400232 TSecr=23969787
113 1.870126351 172.31.31.144 -> 172.31.23.72 TCP 187 6633 → 51128 [PSH, ACK] Seq=122 Ack=1 Win=853 Len=121 TSval=5400232 TSecr=23969787
114 1.870189089 172.31.31.144 -> 172.31.23.72 TCP 187 6633 → 51128 [PSH, ACK] Seq=243 Ack=1 Win=853 Len=121 TSval=5400232 TSecr=23969787
115 1.870246684 172.31.31.144 -> 172.31.23.72 TCP 187 6633 → 51128 [PSH, ACK] Seq=364 Ack=1 Win=853 Len=121 TSval=5400232 TSecr=23969787
116 1.870271642 172.31.23.72 -> 172.31.31.144 TCP 66 51126 → 6633 [ACK] Seq=1 Ack=727 Win=387 Len=0 TSval=23970357 TSecr=5400231
117 1.870329294 172.31.31.144 -> 172.31.23.72 TCP 187 6633 → 51128 [PSH, ACK] Seq=485 Ack=1 Win=853 Len=121 TSval=5400232 TSecr=23969787
118 1.870387195 172.31.31.144 -> 172.31.23.72 TCP 187 6633 → 51128 [PSH, ACK] Seq=606 Ack=1 Win=853 Len=121 TSval=5400232 TSecr=23969787
119 1.870479153 172.31.31.144 -> 172.31.23.72 TCP 187 6633 → 51128 [PSH, ACK] Seq=727 Ack=1 Win=853 Len=121 TSval=5400232 TSecr=23969787
120 1.870528248 172.31.23.72 -> 172.31.31.144 OpenFlow 189 Type: OFPT_PACKET_IN
121 1.870540602 172.31.31.144 -> 172.31.23.72 TCP 187 6633 → 51128 [PSH, ACK] Seq=848 Ack=1 Win=853 Len=121 TSval=5400232 TSecr=23969787
122 1.870559938 172.31.23.72 -> 172.31.31.144 OpenFlow 189 Type: OFPT_PACKET_IN
123 1.870595502 172.31.23.72 -> 172.31.31.144 OpenFlow 189 Type: OFPT_PACKET_IN
124 1.870616635 172.31.23.72 -> 172.31.31.144 OpenFlow 189 Type: OFPT_PACKET_IN
125 1.870661843 172.31.31.144 -> 172.31.23.72 TCP 187 6633 → 51130 [PSH, ACK] Seq=1 Ack=1 Win=853 Len=121 TSval=5400232 TSecr=23969796
126 1.870700461 172.31.31.144 -> 172.31.23.72 TCP 66 6633 → 51136 [ACK] Seq=1 Ack=124 Win=853 Len=0 TSval=5400232 TSecr=23970357
127 1.870717611 172.31.31.144 -> 172.31.23.72 TCP 66 6633 → 51136 [ACK] Seq=1 Ack=247 Win=853 Len=0 TSval=5400232 TSecr=23970357
128 1.870748706 172.31.31.144 -> 172.31.23.72 TCP 187 6633 → 51130 [PSH, ACK] Seq=122 Ack=1 Win=853 Len=121 TSval=5400232 TSecr=23969796
129 1.870803624 172.31.31.144 -> 172.31.23.72 TCP 66 6633 → 51128 [ACK] Seq=969 Ack=124 Win=853 Len=0 TSval=5400232 TSecr=23970357
130 1.870822067 172.31.31.144 -> 172.31.23.72 TCP 187 6633 → 51130 [PSH, ACK] Seq=243 Ack=1 Win=853 Len=121 TSval=5400232 TSecr=23969796
131 1.870841159 172.31.31.144 -> 172.31.23.72 TCP 66 6633 → 51128 [ACK] Seq=969 Ack=247 Win=853 Len=0 TSval=5400232 TSecr=23970357
132 1.870861349 172.31.31.144 -> 172.31.23.72 TCP 187 6633 → 51130 [PSH, ACK] Seq=364 Ack=1 Win=853 Len=121 TSval=5400232 TSecr=23969796
133 1.870953859 172.31.31.144 -> 172.31.23.72 TCP 187 6633 → 51130 [PSH, ACK] Seq=485 Ack=1 Win=853 Len=121 TSval=5400232 TSecr=23969796
134 1.871023684 172.31.31.144 -> 172.31.23.72 TCP 187 6633 → 51130 [PSH, ACK] Seq=606 Ack=1 Win=853 Len=121 TSval=5400232 TSecr=23969796
135 1.871070159 172.31.23.72 -> 172.31.31.144 OpenFlow 189 Type: OFPT_PACKET_IN
136 1.871091892 172.31.23.72 -> 172.31.31.144 OpenFlow 189 Type: OFPT_PACKET_IN
137 1.871116206 172.31.31.144 -> 172.31.23.72 TCP 187 6633 → 51130 [PSH, ACK] Seq=727 Ack=1 Win=853 Len=121 TSval=5400232 TSecr=23969796
138 1.871196286 172.31.31.144 -> 172.31.23.72 TCP 187 6633 → 51130 [PSH, ACK] Seq=848 Ack=1 Win=853 Len=121 TSval=5400232 TSecr=23969796
139 1.871225807 172.31.31.144 -> 172.31.23.72 TCP 66 6633 → 51126 [ACK] Seq=727 Ack=124 Win=853 Len=0 TSval=5400232 TSecr=23970357
140 1.871245966 172.31.31.144 -> 172.31.23.72 TCP 66 6633 → 51126 [ACK] Seq=727 Ack=247 Win=853 Len=0 TSval=5400232 TSecr=23970357
141 1.871283460 172.31.23.72 -> 172.31.31.144 OpenFlow 189 Type: OFPT_PACKET_IN
142 1.871304012 172.31.23.72 -> 172.31.31.144 OpenFlow 189 Type: OFPT_PACKET_IN
143 1.871322845 172.31.23.72 -> 172.31.31.144 OpenFlow 189 Type: OFPT_PACKET_IN
144 1.871360666 172.31.23.72 -> 172.31.31.144 OpenFlow 189 Type: OFPT_PACKET_IN
145 1.871379505 172.31.31.144 -> 172.31.23.72 OpenFlow 187 Type: OFPT_PACKET_OUT
146 1.871384348 172.31.31.144 -> 172.31.23.72 OpenFlow 187 Type: OFPT_PACKET_OUT
147 1.871443234 172.31.31.144 -> 172.31.23.72 TCP 66 6633 → 51136 [ACK] Seq=1 Ack=370 Win=853 Len=0 TSval=5400232 TSecr=23970358
148 1.871464593 172.31.31.144 -> 172.31.23.72 TCP 66 6633 → 51136 [ACK] Seq=1 Ack=493 Win=853 Len=0 TSval=5400232 TSecr=23970358
149 1.871493511 172.31.31.144 -> 172.31.23.72 TCP 66 6633 → 51130 [ACK] Seq=1211 Ack=124 Win=853 Len=0 TSval=5400232 TSecr=23970358
150 1.871510237 172.31.31.144 -> 172.31.23.72 TCP 66 6633 → 51130 [ACK] Seq=1211 Ack=247 Win=853 Len=0 TSval=5400232 TSecr=23970358
151 1.871724508 172.31.23.72 -> 172.31.31.144 TCP 66 51130 → 6633 [ACK] Seq=247 Ack=1211 Win=213 Len=0 TSval=23970358 TSecr=5400232
152 1.871826588 172.31.23.72 -> 172.31.31.144 OpenFlow 189 Type: OFPT_PACKET_IN
153 1.871850371 172.31.23.72 -> 172.31.31.144 OpenFlow 189 Type: OFPT_PACKET_IN
154 1.871898479 172.31.23.72 -> 172.31.31.144 OpenFlow 189 Type: OFPT_PACKET_IN
155 1.871919013 172.31.23.72 -> 172.31.31.144 OpenFlow 189 Type: OFPT_PACKET_IN
156 1.871923498 172.31.23.72 -> 172.31.31.144 OpenFlow 189 Type: OFPT_PACKET_IN
157 1.871965264 172.31.23.72 -> 172.31.31.144 OpenFlow 189 Type: OFPT_PACKET_IN
158 1.871989866 172.31.31.144 -> 172.31.23.72 TCP 66 6633 → 51128 [ACK] Seq=969 Ack=370 Win=853 Len=0 TSval=5400232 TSecr=23970358
159 1.871994569 172.31.31.144 -> 172.31.23.72 TCP 66 6633 → 51128 [ACK] Seq=969 Ack=493 Win=853 Len=0 TSval=5400232 TSecr=23970358
160 1.872049433 172.31.23.72 -> 172.31.31.144 OpenFlow 189 Type: OFPT_PACKET_IN
161 1.872070284 172.31.31.144 -> 172.31.23.72 TCP 66 6633 → 51138 [ACK] Seq=1 Ack=124 Win=853 Len=0 TSval=5400232 TSecr=23970358
162 1.872077662 172.31.23.72 -> 172.31.31.144 OpenFlow 189 Type: OFPT_PACKET_IN
163 1.872094505 172.31.31.144 -> 172.31.23.72 TCP 66 6633 → 51138 [ACK] Seq=1 Ack=247 Win=853 Len=0 TSval=5400232 TSecr=23970358
164 1.872153191 172.31.31.144 -> 172.31.23.72 TCP 66 6633 → 51134 [ACK] Seq=1 Ack=247 Win=853 Len=0 TSval=5400232 TSecr=23970358
165 1.872204823 172.31.31.144 -> 172.31.23.72 TCP 66 6633 → 51132 [ACK] Seq=1 Ack=124 Win=853 Len=0 TSval=5400232 TSecr=23970358
166 1.872223002 172.31.31.144 -> 172.31.23.72 TCP 66 6633 → 51132 [ACK] Seq=1 Ack=247 Win=853 Len=0 TSval=5400232 TSecr=23970358
167 2.169045283 172.31.31.144 -> 172.31.23.72 OpenFlow 90 Type: OFPT_MULTIPART_REQUEST, OFPMP_GROUP
168 2.169088049 172.31.31.144 -> 172.31.23.72 OpenFlow 106 Type: OFPT_MULTIPART_REQUEST, OFPMP_METER
169 2.169380844 172.31.23.72 -> 172.31.31.144 OpenFlow 82 Type: OFPT_MULTIPART_REPLY, OFPMP_GROUP
170 2.169446366 172.31.23.72 -> 172.31.31.144 OpenFlow 98 Type: OFPT_MULTIPART_REPLY, OFPMP_METER
171 2.169614369 172.31.31.144 -> 172.31.23.72 TCP 66 6633 → 51126 [ACK] Seq=791 Ack=263 Win=853 Len=0 TSval=5400306 TSecr=23970432
172 2.169631891 172.31.31.144 -> 172.31.23.72 TCP 66 6633 → 51126 [ACK] Seq=791 Ack=295 Win=853 Len=0 TSval=5400306 TSecr=23970432
173 2.269456152 172.31.31.144 -> 172.31.23.72 OpenFlow 187 Type: OFPT_PACKET_OUT
174 2.269489139 172.31.31.144 -> 172.31.23.72 OpenFlow 187 Type: OFPT_PACKET_OUT
175 2.269509852 172.31.31.144 -> 172.31.23.72 OpenFlow 187 Type: OFPT_PACKET_OUT
176 2.269607379 172.31.31.144 -> 172.31.23.72 OpenFlow 187 Type: OFPT_PACKET_OUT
177 2.269664617 172.31.31.144 -> 172.31.23.72 OpenFlow 187 Type: OFPT_PACKET_OUT
178 2.269730444 172.31.31.144 -> 172.31.23.72 OpenFlow 187 Type: OFPT_PACKET_OUT
179 2.269856518 172.31.31.144 -> 172.31.23.72 OpenFlow 187 Type: OFPT_PACKET_OUT
180 2.269925739 172.31.31.144 -> 172.31.23.72 OpenFlow 187 Type: OFPT_PACKET_OUT
181 2.270041361 172.31.23.72 -> 172.31.31.144 TCP 66 51132 → 6633 [ACK] Seq=247 Ack=969 Win=213 Len=0 TSval=23970457 TSecr=5400331
182 2.270078873 172.31.31.144 -> 172.31.23.72 OpenFlow 187 Type: OFPT_PACKET_OUT
183 2.270087034 172.31.31.144 -> 172.31.23.72 OpenFlow 187 Type: OFPT_PACKET_OUT
184 2.270147650 172.31.31.144 -> 172.31.23.72 OpenFlow 187 Type: OFPT_PACKET_OUT
185 2.270172329 172.31.23.72 -> 172.31.31.144 OpenFlow 189 Type: OFPT_PACKET_IN
186 2.270207796 172.31.23.72 -> 172.31.31.144 OpenFlow 189 Type: OFPT_PACKET_IN
187 2.270232230 172.31.31.144 -> 172.31.23.72 OpenFlow 187 Type: OFPT_PACKET_OUT
188 2.270247850 172.31.23.72 -> 172.31.31.144 OpenFlow 189 Type: OFPT_PACKET_IN
189 2.270270834 172.31.23.72 -> 172.31.31.144 OpenFlow 189 Type: OFPT_PACKET_IN
190 2.270311967 172.31.31.144 -> 172.31.23.72 OpenFlow 187 Type: OFPT_PACKET_OUT
191 2.270360228 172.31.23.72 -> 172.31.31.144 OpenFlow 189 Type: OFPT_PACKET_IN
192 2.270412345 172.31.31.144 -> 172.31.23.72 OpenFlow 187 Type: OFPT_PACKET_OUT
193 2.270419288 172.31.23.72 -> 172.31.31.144 OpenFlow 189 Type: OFPT_PACKET_IN
194 2.270425000 172.31.31.144 -> 172.31.23.72 TCP 66 6633 → 51130 [ACK] Seq=1211 Ack=370 Win=853 Len=0 TSval=5400332 TSecr=23970457
195 2.270430004 172.31.31.144 -> 172.31.23.72 TCP 66 6633 → 51130 [ACK] Seq=1211 Ack=493 Win=853 Len=0 TSval=5400332 TSecr=23970457
196 2.270514225 172.31.31.144 -> 172.31.23.72 TCP 66 6633 → 51140 [ACK] Seq=1 Ack=247 Win=853 Len=0 TSval=5400332 TSecr=23970457
197 2.270533213 172.31.31.144 -> 172.31.23.72 OpenFlow 187 Type: OFPT_PACKET_OUT
198 2.270561487 172.31.31.144 -> 172.31.23.72 OpenFlow 187 Type: OFPT_PACKET_OUT
199 2.270602604 172.31.31.144 -> 172.31.23.72 TCP 66 6633 → 51134 [ACK] Seq=727 Ack=493 Win=853 Len=0 TSval=5400332 TSecr=23970457
200 2.270622460 172.31.31.144 -> 172.31.23.72 OpenFlow 187 Type: OFPT_PACKET_OUT
201 2.270859342 172.31.23.72 -> 172.31.31.144 OpenFlow 189 Type: OFPT_PACKET_IN
202 2.270884118 172.31.23.72 -> 172.31.31.144 OpenFlow 189 Type: OFPT_PACKET_IN
203 2.270955906 172.31.31.144 -> 172.31.23.72 OpenFlow 187 Type: OFPT_PACKET_OUT
204 2.271016722 172.31.31.144 -> 172.31.23.72 TCP 66 6633 → 51132 [ACK] Seq=969 Ack=370 Win=853 Len=0 TSval=5400332 TSecr=23970457
205 2.271035989 172.31.31.144 -> 172.31.23.72 OpenFlow 187 Type: OFPT_PACKET_OUT
206 2.271057414 172.31.31.144 -> 172.31.23.72 TCP 66 6633 → 51132 [ACK] Seq=969 Ack=493 Win=853 Len=0 TSval=5400332 TSecr=23970457
207 2.271104369 172.31.31.144 -> 172.31.23.72 OpenFlow 187 Type: OFPT_PACKET_OUT
208 2.271198888 172.31.31.144 -> 172.31.23.72 OpenFlow 187 Type: OFPT_PACKET_OUT
209 2.271262711 172.31.31.144 -> 172.31.23.72 OpenFlow 187 Type: OFPT_PACKET_OUT
210 2.271333918 172.31.23.72 -> 172.31.31.144 TCP 66 51136 → 6633 [ACK] Seq=493 Ack=969 Win=213 Len=0 TSval=23970458 TSecr=5400332
211 2.271392554 172.31.31.144 -> 172.31.23.72 OpenFlow 187 Type: OFPT_PACKET_OUT
212 2.271449319 172.31.31.144 -> 172.31.23.72 OpenFlow 187 Type: OFPT_PACKET_OUT
213 2.271461385 172.31.23.72 -> 172.31.31.144 TCP 66 51136 → 6633 [ACK] Seq=493 Ack=1211 Win=213 Len=0 TSval=23970458 TSecr=5400332
214 2.271530975 172.31.23.72 -> 172.31.31.144 OpenFlow 189 Type: OFPT_PACKET_IN
215 2.271554986 172.31.23.72 -> 172.31.31.144 OpenFlow 189 Type: OFPT_PACKET_IN
216 2.271577805 172.31.31.144 -> 172.31.23.72 OpenFlow 187 Type: OFPT_PACKET_OUT
217 2.271590458 172.31.23.72 -> 172.31.31.144 OpenFlow 189 Type: OFPT_PACKET_IN
218 2.271617954 172.31.23.72 -> 172.31.31.144 OpenFlow 189 Type: OFPT_PACKET_IN
219 2.271626270 172.31.23.72 -> 172.31.31.144 OpenFlow 189 Type: OFPT_PACKET_IN
220 2.271645729 172.31.31.144 -> 172.31.23.72 OpenFlow 187 Type: OFPT_PACKET_OUT
221 2.271671403 172.31.23.72 -> 172.31.31.144 OpenFlow 189 Type: OFPT_PACKET_IN
222 2.271685819 172.31.23.72 -> 172.31.31.144 OpenFlow 189 Type: OFPT_PACKET_IN
223 2.271691790 172.31.31.144 -> 172.31.23.72 TCP 66 6633 → 51130 [ACK] Seq=1211 Ack=616 Win=853 Len=0 TSval=5400332 TSecr=23970458
224 2.271716930 172.31.23.72 -> 172.31.31.144 OpenFlow 189 Type: OFPT_PACKET_IN
225 2.271731335 172.31.23.72 -> 172.31.31.144 OpenFlow 189 Type: OFPT_PACKET_IN
226 2.271737295 172.31.31.144 -> 172.31.23.72 TCP 66 6633 → 51130 [ACK] Seq=1211 Ack=739 Win=853 Len=0 TSval=5400332 TSecr=23970458
227 2.271764298 172.31.23.72 -> 172.31.31.144 OpenFlow 435 Type: OFPT_PACKET_IN
228 2.271802618 172.31.31.144 -> 172.31.23.72 TCP 66 6633 → 51142 [ACK] Seq=1 Ack=124 Win=853 Len=0 TSval=5400332 TSecr=23970458
229 2.271807277 172.31.31.144 -> 172.31.23.72 OpenFlow 187 Type: OFPT_PACKET_OUT
230 2.271810066 172.31.31.144 -> 172.31.23.72 TCP 66 6633 → 51128 [ACK] Seq=969 Ack=616 Win=853 Len=0 TSval=5400332 TSecr=23970458
231 2.271823450 172.31.31.144 -> 172.31.23.72 TCP 66 6633 → 51128 [ACK] Seq=969 Ack=739 Win=853 Len=0 TSval=5400332 TSecr=23970458
232 2.271836969 172.31.31.144 -> 172.31.23.72 TCP 66 6633 → 51142 [ACK] Seq=1 Ack=247 Win=853 Len=0 TSval=5400332 TSecr=23970458
233 2.271858559 172.31.31.144 -> 172.31.23.72 OpenFlow 187 Type: OFPT_PACKET_OUT
234 2.271885737 172.31.31.144 -> 172.31.23.72 TCP 66 6633 → 51126 [ACK] Seq=791 Ack=418 Win=853 Len=0 TSval=5400332 TSecr=23970458
235 2.271898149 172.31.31.144 -> 172.31.23.72 TCP 66 6633 → 51126 [ACK] Seq=791 Ack=541 Win=853 Len=0 TSval=5400332 TSecr=23970458
236 2.271918788 172.31.31.144 -> 172.31.23.72 TCP 66 6633 → 51138 [ACK] Seq=485 Ack=370 Win=853 Len=0 TSval=5400332 TSecr=23970458
237 2.271938264 172.31.31.144 -> 172.31.23.72 OpenFlow 187 Type: OFPT_PACKET_OUT
238 2.272028510 172.31.23.72 -> 172.31.31.144 TCP 66 51138 → 6633 [ACK] Seq=739 Ack=606 Win=213 Len=0 TSval=23970458 TSecr=5400332
239 2.272187143 172.31.23.72 -> 172.31.31.144 OpenFlow 189 Type: OFPT_PACKET_IN
240 2.272210436 172.31.23.72 -> 172.31.31.144 OpenFlow 189 Type: OFPT_PACKET_IN
241 2.272218304 172.31.23.72 -> 172.31.31.144 OpenFlow 189 Type: OFPT_PACKET_IN
242 2.272231200 172.31.23.72 -> 172.31.31.144 OpenFlow 189 Type: OFPT_PACKET_IN
243 2.272261483 172.31.23.72 -> 172.31.31.144 OpenFlow 189 Type: OFPT_PACKET_IN
244 2.272263866 172.31.23.72 -> 172.31.31.144 OpenFlow 189 Type: OFPT_PACKET_IN
245 2.272305094 172.31.23.72 -> 172.31.31.144 OpenFlow 189 Type: OFPT_PACKET_IN
246 2.272377501 172.31.31.144 -> 172.31.23.72 TCP 66 6633 → 51146 [ACK] Seq=97 Ack=10116 Win=853 Len=0 TSval=5400332 TSecr=23970458
247 2.272383329 172.31.31.144 -> 172.31.23.72 TCP 66 6633 → 51146 [ACK] Seq=97 Ack=10239 Win=853 Len=0 TSval=5400332 TSecr=23970458
248 2.272401972 172.31.31.144 -> 172.31.23.72 TCP 66 6633 → 51136 [ACK] Seq=1211 Ack=616 Win=853 Len=0 TSval=5400332 TSecr=23970458
249 2.272422072 172.31.31.144 -> 172.31.23.72 TCP 66 6633 → 51130 [ACK] Seq=1211 Ack=862 Win=853 Len=0 TSval=5400332 TSecr=23970458
250 2.272443846 172.31.31.144 -> 172.31.23.72 TCP 66 6633 → 51136 [ACK] Seq=1211 Ack=739 Win=853 Len=0 TSval=5400332 TSecr=23970458
251 2.272508150 172.31.31.144 -> 172.31.23.72 TCP 66 6633 → 51140 [ACK] Seq=1 Ack=493 Win=853 Len=0 TSval=5400332 TSecr=23970458
252 2.273104875 172.31.31.144 -> 172.31.23.72 OpenFlow 187 Type: OFPT_PACKET_OUT
253 2.273166816 172.31.31.144 -> 172.31.23.72 OpenFlow 308 Type: OFPT_PACKET_OUT
254 2.273240362 172.31.31.144 -> 172.31.23.72 OpenFlow 187 Type: OFPT_PACKET_OUT
255 2.273321456 172.31.31.144 -> 172.31.23.72 OpenFlow 187 Type: OFPT_PACKET_OUT
256 2.273392183 172.31.31.144 -> 172.31.23.72 OpenFlow 187 Type: OFPT_PACKET_OUT
257 2.273466377 172.31.23.72 -> 172.31.31.144 TCP 66 51140 → 6633 [ACK] Seq=493 Ack=727 Win=213 Len=0 TSval=23970458 TSecr=5400332
258 2.273546694 172.31.23.72 -> 172.31.31.144 OpenFlow 189 Type: OFPT_PACKET_IN
259 2.273558450 172.31.31.144 -> 172.31.23.72 OpenFlow 187 Type: OFPT_PACKET_OUT
260 2.273572660 172.31.23.72 -> 172.31.31.144 OpenFlow 189 Type: OFPT_PACKET_IN
261 2.273593178 172.31.31.144 -> 172.31.23.72 OpenFlow 187 Type: OFPT_PACKET_OUT
262 2.273616361 172.31.31.144 -> 172.31.23.72 OpenFlow 187 Type: OFPT_PACKET_OUT
263 2.273635938 172.31.23.72 -> 172.31.31.144 OpenFlow 189 Type: OFPT_PACKET_IN
264 2.273654781 172.31.31.144 -> 172.31.23.72 OpenFlow 550 Type: OFPT_PACKET_OUT
265 2.273662353 172.31.23.72 -> 172.31.31.144 OpenFlow 189 Type: OFPT_PACKET_IN
266 2.273699275 172.31.31.144 -> 172.31.23.72 OpenFlow 187 Type: OFPT_PACKET_OUT
267 2.273727669 172.31.31.144 -> 172.31.23.72 TCP 66 6633 → 51144 [ACK] Seq=1 Ack=124 Win=853 Len=0 TSval=5400333 TSecr=23970458
268 2.273732237 172.31.31.144 -> 172.31.23.72 TCP 66 6633 → 51144 [ACK] Seq=1 Ack=247 Win=853 Len=0 TSval=5400333 TSecr=23970458
269 2.273805132 172.31.31.144 -> 172.31.23.72 OpenFlow 187 Type: OFPT_PACKET_OUT
270 2.273842687 172.31.31.144 -> 172.31.23.72 TCP 66 6633 → 51138 [ACK] Seq=1211 Ack=985 Win=853 Len=0 TSval=5400333 TSecr=23970458
271 2.273889039 172.31.31.144 -> 172.31.23.72 OpenFlow 187 Type: OFPT_PACKET_OUT
272 2.273947105 172.31.31.144 -> 172.31.23.72 OpenFlow 187 Type: OFPT_PACKET_OUT
273 2.273964945 172.31.23.72 -> 172.31.31.144 OpenFlow 189 Type: OFPT_PACKET_IN
274 2.273985836 172.31.23.72 -> 172.31.31.144 OpenFlow 189 Type: OFPT_PACKET_IN
275 2.274076102 172.31.31.144 -> 172.31.23.72 OpenFlow 187 Type: OFPT_PACKET_OUT
276 2.274091855 172.31.23.72 -> 172.31.31.144 OpenFlow 189 Type: OFPT_PACKET_IN
277 2.274112652 172.31.23.72 -> 172.31.31.144 OpenFlow 189 Type: OFPT_PACKET_IN
278 2.274128378 172.31.23.72 -> 172.31.31.144 OpenFlow 189 Type: OFPT_PACKET_IN
279 2.274134162 172.31.31.144 -> 172.31.23.72 OpenFlow 187 Type: OFPT_PACKET_OUT
280 2.274162341 172.31.23.72 -> 172.31.31.144 OpenFlow 189 Type: OFPT_PACKET_IN
281 2.274183322 172.31.31.144 -> 172.31.23.72 TCP 66 6633 → 51134 [ACK] Seq=727 Ack=739 Win=853 Len=0 TSval=5400333 TSecr=23970458
282 2.274189923 172.31.23.72 -> 172.31.31.144 OpenFlow 189 Type: OFPT_PACKET_IN
283 2.274227690 172.31.31.144 -> 172.31.23.72 OpenFlow 187 Type: OFPT_PACKET_OUT
284 2.274232755 172.31.31.144 -> 172.31.23.72 TCP 66 6633 → 51132 [ACK] Seq=969 Ack=616 Win=853 Len=0 TSval=5400333 TSecr=23970458
285 2.274262489 172.31.31.144 -> 172.31.23.72 TCP 66 6633 → 51132 [ACK] Seq=969 Ack=739 Win=853 Len=0 TSval=5400333 TSecr=23970458
286 2.274344854 172.31.31.144 -> 172.31.23.72 TCP 66 6633 → 51130 [ACK] Seq=1211 Ack=985 Win=853 Len=0 TSval=5400333 TSecr=23970458
287 2.274350131 172.31.31.144 -> 172.31.23.72 OpenFlow 187 Type: OFPT_PACKET_OUT
288 2.274397269 172.31.31.144 -> 172.31.23.72 TCP 66 6633 → 51142 [ACK] Seq=1211 Ack=493 Win=853 Len=0 TSval=5400333 TSecr=23970458
289 2.274580709 172.31.31.144 -> 172.31.23.72 OpenFlow 187 Type: OFPT_PACKET_OUT
290 2.274634751 172.31.31.144 -> 172.31.23.72 OpenFlow 187 Type: OFPT_PACKET_OUT
291 2.274657181 172.31.31.144 -> 172.31.23.72 OpenFlow 187 Type: OFPT_PACKET_OUT
292 2.274689048 172.31.23.72 -> 172.31.31.144 TCP 66 51142 → 6633 [ACK] Seq=493 Ack=1211 Win=213 Len=0 TSval=23970458 TSecr=5400333
293 2.274774101 172.31.23.72 -> 172.31.31.144 OpenFlow 189 Type: OFPT_PACKET_IN
294 2.274797314 172.31.23.72 -> 172.31.31.144 OpenFlow 189 Type: OFPT_PACKET_IN
295 2.274960081 172.31.31.144 -> 172.31.23.72 OpenFlow 187 Type: OFPT_PACKET_OUT
296 2.274991775 172.31.23.72 -> 172.31.31.144 OpenFlow 189 Type: OFPT_PACKET_IN
297 2.275023065 172.31.23.72 -> 172.31.31.144 OpenFlow 189 Type: OFPT_PACKET_IN
298 2.275116671 172.31.23.72 -> 172.31.31.144 OpenFlow 189 Type: OFPT_PACKET_IN
299 2.275140496 172.31.23.72 -> 172.31.31.144 OpenFlow 189 Type: OFPT_PACKET_IN
300 2.275147829 172.31.23.72 -> 172.31.31.144 OpenFlow 189 Type: OFPT_PACKET_IN
301 2.275160262 172.31.23.72 -> 172.31.31.144 OpenFlow 189 Type: OFPT_PACKET_IN
302 2.275192699 172.31.23.72 -> 172.31.31.144 OpenFlow 189 Type: OFPT_PACKET_IN
303 2.275195006 172.31.23.72 -> 172.31.31.144 OpenFlow 189 Type: OFPT_PACKET_IN
304 2.275207659 172.31.23.72 -> 172.31.31.144 OpenFlow 189 Type: OFPT_PACKET_IN
305 2.275225706 172.31.23.72 -> 172.31.31.144 OpenFlow 189 Type: OFPT_PACKET_IN
306 2.275230856 172.31.23.72 -> 172.31.31.144 OpenFlow 189 Type: OFPT_PACKET_IN
307 2.275269871 172.31.31.144 -> 172.31.23.72 TCP 66 6633 → 51138 [ACK] Seq=1211 Ack=1231 Win=853 Len=0 TSval=5400333 TSecr=23970458
308 2.275339523 172.31.31.144 -> 172.31.23.72 TCP 66 6633 → 51146 [ACK] Seq=97 Ack=10362 Win=853 Len=0 TSval=5400333 TSecr=23970458
309 2.275345472 172.31.31.144 -> 172.31.23.72 TCP 66 6633 → 51136 [ACK] Seq=1211 Ack=862 Win=853 Len=0 TSval=5400333 TSecr=23970458
310 2.275365627 172.31.31.144 -> 172.31.23.72 TCP 66 6633 → 51146 [ACK] Seq=97 Ack=10485 Win=853 Len=0 TSval=5400333 TSecr=23970458
311 2.275384618 172.31.31.144 -> 172.31.23.72 TCP 66 6633 → 51148 [ACK] Seq=97 Ack=7839 Win=853 Len=0 TSval=5400333 TSecr=23970458
312 2.275412708 172.31.31.144 -> 172.31.23.72 TCP 66 6633 → 51136 [ACK] Seq=1211 Ack=985 Win=853 Len=0 TSval=5400333 TSecr=23970459
313 2.275475041 172.31.31.144 -> 172.31.23.72 OpenFlow 187 Type: OFPT_PACKET_OUT
314 2.275494916 172.31.31.144 -> 172.31.23.72 OpenFlow 429 Type: OFPT_PACKET_OUT
315 2.275548167 172.31.23.72 -> 172.31.31.144 OpenFlow 189 Type: OFPT_PACKET_IN
316 2.275722712 172.31.23.72 -> 172.31.31.144 TCP 66 51144 → 6633 [ACK] Seq=493 Ack=969 Win=213 Len=0 TSval=23970459 TSecr=5400333
317 2.275737397 172.31.31.144 -> 172.31.23.72 TCP 66 6633 → 51142 [ACK] Seq=1211 Ack=739 Win=853 Len=0 TSval=5400333 TSecr=23970458
318 2.275770814 172.31.31.144 -> 172.31.23.72 TCP 66 6633 → 51140 [ACK] Seq=727 Ack=739 Win=853 Len=0 TSval=5400333 TSecr=23970458
319 2.275910562 172.31.23.72 -> 172.31.31.144 OpenFlow 189 Type: OFPT_PACKET_IN
320 2.275933218 172.31.31.144 -> 172.31.23.72 OpenFlow 187 Type: OFPT_PACKET_OUT
321 2.275939767 172.31.23.72 -> 172.31.31.144 OpenFlow 189 Type: OFPT_PACKET_IN
322 2.275978552 172.31.31.144 -> 172.31.23.72 OpenFlow 429 Type: OFPT_PACKET_OUT
323 2.276037290 172.31.31.144 -> 172.31.23.72 OpenFlow 187 Type: OFPT_PACKET_OUT
324 2.276093663 172.31.31.144 -> 172.31.23.72 OpenFlow 187 Type: OFPT_PACKET_OUT
325 2.276179061 172.31.31.144 -> 172.31.23.72 OpenFlow 187 Type: OFPT_PACKET_OUT
326 2.276209769 172.31.31.144 -> 172.31.23.72 TCP 66 6633 → 51152 [ACK] Seq=97 Ack=7103 Win=853 Len=0 TSval=5400333 TSecr=23970459
327 2.276260236 172.31.31.144 -> 172.31.23.72 OpenFlow 187 Type: OFPT_PACKET_OUT
328 2.276336548 172.31.23.72 -> 172.31.31.144 TCP 66 51146 → 6633 [ACK] Seq=10485 Ack=1065 Win=213 Len=0 TSval=23970459 TSecr=5400333
329 2.276348036 172.31.31.144 -> 172.31.23.72 OpenFlow 187 Type: OFPT_PACKET_OUT
330 2.276422203 172.31.31.144 -> 172.31.23.72 OpenFlow 187 Type: OFPT_PACKET_OUT
331 2.276458915 172.31.23.72 -> 172.31.31.144 TCP 66 51146 → 6633 [ACK] Seq=10485 Ack=1307 Win=213 Len=0 TSval=23970459 TSecr=5400333
332 2.276526858 172.31.23.72 -> 172.31.31.144 OpenFlow 189 Type: OFPT_PACKET_IN
333 2.276550244 172.31.23.72 -> 172.31.31.144 OpenFlow 189 Type: OFPT_PACKET_IN
334 2.276572192 172.31.23.72 -> 172.31.31.144 OpenFlow 189 Type: OFPT_PACKET_IN
335 2.276577189 172.31.31.144 -> 172.31.23.72 OpenFlow 187 Type: OFPT_PACKET_OUT
336 2.276602001 172.31.23.72 -> 172.31.31.144 OpenFlow 189 Type: OFPT_PACKET_IN
337 2.276610900 172.31.23.72 -> 172.31.31.144 OpenFlow 189 Type: OFPT_PACKET_IN
338 2.276624081 172.31.23.72 -> 172.31.31.144 OpenFlow 189 Type: OFPT_PACKET_IN
339 2.276629262 172.31.31.144 -> 172.31.23.72 OpenFlow 187 Type: OFPT_PACKET_OUT
340 2.276667030 172.31.23.72 -> 172.31.31.144 OpenFlow 189 Type: OFPT_PACKET_IN
341 2.276700615 172.31.23.72 -> 172.31.31.144 OpenFlow 189 Type: OFPT_PACKET_IN
342 2.276702830 172.31.23.72 -> 172.31.31.144 OpenFlow 189 Type: OFPT_PACKET_IN
343 2.276709956 172.31.31.144 -> 172.31.23.72 TCP 66 6633 → 51136 [ACK] Seq=1211 Ack=1108 Win=853 Len=0 TSval=5400333 TSecr=23970459
344 2.276713697 172.31.31.144 -> 172.31.23.72 OpenFlow 187 Type: OFPT_PACKET_OUT
345 2.276715761 172.31.31.144 -> 172.31.23.72 TCP 66 6633 → 51136 [ACK] Seq=1211 Ack=1231 Win=853 Len=0 TSval=5400333 TSecr=23970459
346 2.276735823 172.31.23.72 -> 172.31.31.144 OpenFlow 189 Type: OFPT_PACKET_IN
347 2.276779112 172.31.31.144 -> 172.31.23.72 OpenFlow 187 Type: OFPT_PACKET_OUT
348 2.276782957 172.31.31.144 -> 172.31.23.72 TCP 66 6633 → 51162 [ACK] Seq=97 Ack=9060 Win=853 Len=0 TSval=5400333 TSecr=23970459
349 2.276819026 172.31.31.144 -> 172.31.23.72 OpenFlow 187 Type: OFPT_PACKET_OUT
350 2.276849692 172.31.31.144 -> 172.31.23.72 TCP 66 6633 → 51162 [ACK] Seq=97 Ack=9183 Win=853 Len=0 TSval=5400333 TSecr=23970459
351 2.276855097 172.31.23.72 -> 172.31.31.144 OpenFlow 189 Type: OFPT_PACKET_IN
352 2.276871449 172.31.31.144 -> 172.31.23.72 TCP 66 6633 → 51154 [ACK] Seq=97 Ack=9892 Win=853 Len=0 TSval=5400333 TSecr=23970459
353 2.276876779 172.31.23.72 -> 172.31.31.144 OpenFlow 189 Type: OFPT_PACKET_IN
354 2.276898398 172.31.31.144 -> 172.31.23.72 TCP 66 6633 → 51154 [ACK] Seq=97 Ack=10015 Win=853 Len=0 TSval=5400333 TSecr=23970459
355 2.276935228 172.31.31.144 -> 172.31.23.72 TCP 66 6633 → 51150 [ACK] Seq=97 Ack=8255 Win=853 Len=0 TSval=5400333 TSecr=23970459
356 2.276971980 172.31.31.144 -> 172.31.23.72 OpenFlow 187 Type: OFPT_PACKET_OUT
357 2.277085341 172.31.31.144 -> 172.31.23.72 OpenFlow 187 Type: OFPT_PACKET_OUT
358 2.277141839 172.31.31.144 -> 172.31.23.72 TCP 66 6633 → 51142 [ACK] Seq=1211 Ack=985 Win=853 Len=0 TSval=5400333 TSecr=23970459
359 2.277217950 172.31.23.72 -> 172.31.31.144 TCP 66 51148 → 6633 [ACK] Seq=8085 Ack=944 Win=213 Len=0 TSval=23970459 TSecr=5400333
360 2.277296669 172.31.23.72 -> 172.31.31.144 OpenFlow 189 Type: OFPT_PACKET_IN
361 2.277318754 172.31.23.72 -> 172.31.31.144 OpenFlow 189 Type: OFPT_PACKET_IN
362 2.277339451 172.31.23.72 -> 172.31.31.144 OpenFlow 189 Type: OFPT_PACKET_IN
363 2.277353599 172.31.23.72 -> 172.31.31.144 OpenFlow 189 Type: OFPT_PACKET_IN
364 2.277378758 172.31.23.72 -> 172.31.31.144 OpenFlow 189 Type: OFPT_PACKET_IN
365 2.277383063 172.31.23.72 -> 172.31.31.144 OpenFlow 189 Type: OFPT_PACKET_IN
366 2.277420052 172.31.23.72 -> 172.31.31.144 OpenFlow 189 Type: OFPT_PACKET_IN
367 2.277496179 172.31.31.144 -> 172.31.23.72 TCP 66 6633 → 51156 [ACK] Seq=97 Ack=9700 Win=853 Len=0 TSval=5400333 TSecr=23970459
368 2.277523680 172.31.31.144 -> 172.31.23.72 TCP 66 6633 → 51146 [ACK] Seq=1307 Ack=10731 Win=853 Len=0 TSval=5400333 TSecr=23970459
369 2.277699535 172.31.31.144 -> 172.31.23.72 OpenFlow 187 Type: OFPT_PACKET_OUT
370 2.277715527 172.31.31.144 -> 172.31.23.72 OpenFlow 187 Type: OFPT_PACKET_OUT
371 2.277806809 172.31.31.144 -> 172.31.23.72 TCP 66 6633 → 51142 [ACK] Seq=1211 Ack=1231 Win=853 Len=0 TSval=5400334 TSecr=23970459
372 2.277850745 172.31.23.72 -> 172.31.31.144 OpenFlow 189 Type: OFPT_PACKET_IN
373 2.278010765 172.31.31.144 -> 172.31.23.72 TCP 66 6633 → 51156 [ACK] Seq=97 Ack=9823 Win=853 Len=0 TSval=5400334 TSecr=23970459
374 2.278081602 172.31.23.72 -> 172.31.31.144 OpenFlow 189 Type: OFPT_PACKET_IN
375 2.278186212 172.31.31.144 -> 172.31.23.72 OpenFlow 187 Type: OFPT_PACKET_OUT
376 2.278243384 172.31.31.144 -> 172.31.23.72 OpenFlow 187 Type: OFPT_PACKET_OUT
377 2.278270735 172.31.31.144 -> 172.31.23.72 OpenFlow 429 Type: OFPT_PACKET_OUT
378 2.278300492 172.31.31.144 -> 172.31.23.72 OpenFlow 187 Type: OFPT_PACKET_OUT
