  1 0.000000000 172.31.31.144 -> 172.31.24.227 TCP 90 6633 → 49350 [PSH, ACK] Seq=1 Ack=1 Win=853 Len=24 TSval=1097325 TSecr=119657505
  2 0.000024458 172.31.31.144 -> 172.31.24.227 TCP 82 6633 → 49350 [PSH, ACK] Seq=25 Ack=1 Win=853 Len=16 TSval=1097325 TSecr=119657505
  3 0.000040757 172.31.31.144 -> 172.31.24.227 TCP 90 6633 → 49350 [PSH, ACK] Seq=41 Ack=1 Win=853 Len=24 TSval=1097325 TSecr=119657505
  4 0.000072329 172.31.31.144 -> 172.31.24.227 TCP 90 6633 → 49348 [PSH, ACK] Seq=1 Ack=1 Win=853 Len=24 TSval=1097325 TSecr=119657506
  5 0.000092162 172.31.31.144 -> 172.31.24.227 TCP 106 6633 → 49348 [PSH, ACK] Seq=25 Ack=1 Win=853 Len=40 TSval=1097325 TSecr=119657506
  6 0.000308158 172.31.24.227 -> 172.31.31.144 OpenFlow 82 Type: OFPT_MULTIPART_REPLY, OFPMP_GROUP
  7 0.000343418 172.31.24.227 -> 172.31.31.144 OpenFlow 98 Type: OFPT_MULTIPART_REPLY, OFPMP_METER
  8 0.000369337 172.31.24.227 -> 172.31.31.144 OpenFlow 82 Type: OFPT_MULTIPART_REPLY, OFPMP_GROUP
  9 0.000410534 172.31.24.227 -> 172.31.31.144 OpenFlow 98 Type: OFPT_MULTIPART_REPLY, OFPMP_METER
 10 0.000561040 172.31.31.144 -> 172.31.24.227 TCP 66 6633 → 49348 [ACK] Seq=65 Ack=17 Win=853 Len=0 TSval=1097325 TSecr=119657935
 11 0.000578563 172.31.31.144 -> 172.31.24.227 TCP 66 6633 → 49348 [ACK] Seq=65 Ack=49 Win=853 Len=0 TSval=1097325 TSecr=119657935
 12 0.000603448 172.31.31.144 -> 172.31.24.227 TCP 66 6633 → 49350 [ACK] Seq=65 Ack=17 Win=853 Len=0 TSval=1097325 TSecr=119657935
 13 0.000634219 172.31.31.144 -> 172.31.24.227 TCP 66 6633 → 49350 [ACK] Seq=65 Ack=49 Win=853 Len=0 TSval=1097325 TSecr=119657935
 14 0.100286347 172.31.31.144 -> 172.31.24.227 TCP 90 6633 → 49352 [PSH, ACK] Seq=1 Ack=1 Win=853 Len=24 TSval=1097350 TSecr=119657511
 15 0.100356856 172.31.31.144 -> 172.31.24.227 TCP 90 6633 → 49370 [PSH, ACK] Seq=1 Ack=1 Win=853 Len=24 TSval=1097350 TSecr=119657512
 16 0.100360910 172.31.31.144 -> 172.31.24.227 TCP 90 6633 → 49356 [PSH, ACK] Seq=1 Ack=1 Win=853 Len=24 TSval=1097350 TSecr=119657514
 17 0.100363298 172.31.31.144 -> 172.31.24.227 TCP 106 6633 → 49352 [PSH, ACK] Seq=25 Ack=1 Win=853 Len=40 TSval=1097350 TSecr=119657511
 18 0.100366392 172.31.31.144 -> 172.31.24.227 TCP 90 6633 → 49390 [PSH, ACK] Seq=1 Ack=1 Win=853 Len=24 TSval=1097350 TSecr=119657514
 19 0.100388209 172.31.31.144 -> 172.31.24.227 TCP 106 6633 → 49356 [PSH, ACK] Seq=25 Ack=1 Win=853 Len=40 TSval=1097350 TSecr=119657514
 20 0.100406108 172.31.31.144 -> 172.31.24.227 TCP 106 6633 → 49370 [PSH, ACK] Seq=25 Ack=1 Win=853 Len=40 TSval=1097350 TSecr=119657512
 21 0.100428756 172.31.31.144 -> 172.31.24.227 TCP 90 6633 → 49384 [PSH, ACK] Seq=1 Ack=1 Win=853 Len=24 TSval=1097350 TSecr=119657517
 22 0.100455566 172.31.31.144 -> 172.31.24.227 TCP 90 6633 → 49362 [PSH, ACK] Seq=1 Ack=1 Win=853 Len=24 TSval=1097350 TSecr=119657519
 23 0.100473564 172.31.31.144 -> 172.31.24.227 TCP 90 6633 → 49366 [PSH, ACK] Seq=1 Ack=1 Win=853 Len=24 TSval=1097350 TSecr=119657518
 24 0.100500954 172.31.31.144 -> 172.31.24.227 TCP 106 6633 → 49366 [PSH, ACK] Seq=25 Ack=1 Win=853 Len=40 TSval=1097350 TSecr=119657518
 25 0.100525300 172.31.31.144 -> 172.31.24.227 TCP 90 6633 → 49360 [PSH, ACK] Seq=1 Ack=1 Win=853 Len=24 TSval=1097350 TSecr=119657516
 26 0.100535900 172.31.24.227 -> 172.31.31.144 OpenFlow 82 Type: OFPT_MULTIPART_REPLY, OFPMP_GROUP
 27 0.100544465 172.31.31.144 -> 172.31.24.227 TCP 82 6633 → 49360 [PSH, ACK] Seq=25 Ack=1 Win=853 Len=16 TSval=1097350 TSecr=119657516
 28 0.100558755 172.31.24.227 -> 172.31.31.144 OpenFlow 82 Type: OFPT_MULTIPART_REPLY, OFPMP_GROUP_DESC
 29 0.100586663 172.31.24.227 -> 172.31.31.144 OpenFlow 82 Type: OFPT_MULTIPART_REPLY, OFPMP_GROUP
 30 0.100594268 172.31.31.144 -> 172.31.24.227 TCP 106 6633 → 49390 [PSH, ACK] Seq=25 Ack=1 Win=853 Len=40 TSval=1097350 TSecr=119657514
 31 0.100597395 172.31.31.144 -> 172.31.24.227 TCP 90 6633 → 49360 [PSH, ACK] Seq=41 Ack=1 Win=853 Len=24 TSval=1097350 TSecr=119657516
 32 0.100624090 172.31.24.227 -> 172.31.31.144 OpenFlow 82 Type: OFPT_MULTIPART_REPLY, OFPMP_METER
 33 0.100629039 172.31.24.227 -> 172.31.31.144 OpenFlow 98 Type: OFPT_MULTIPART_REPLY, OFPMP_METER
 34 0.100634294 172.31.24.227 -> 172.31.31.144 OpenFlow 82 Type: OFPT_MULTIPART_REPLY, OFPMP_GROUP
 35 0.100649685 172.31.31.144 -> 172.31.24.227 TCP 82 6633 → 49362 [PSH, ACK] Seq=25 Ack=1 Win=853 Len=16 TSval=1097350 TSecr=119657519
 36 0.100652543 172.31.31.144 -> 172.31.24.227 TCP 106 6633 → 49384 [PSH, ACK] Seq=25 Ack=1 Win=853 Len=40 TSval=1097350 TSecr=119657517
 37 0.100654202 172.31.31.144 -> 172.31.24.227 TCP 90 6633 → 49362 [PSH, ACK] Seq=41 Ack=1 Win=853 Len=24 TSval=1097350 TSecr=119657519
 38 0.100663686 172.31.24.227 -> 172.31.31.144 OpenFlow 82 Type: OFPT_MULTIPART_REPLY, OFPMP_GROUP
 39 0.100691379 172.31.24.227 -> 172.31.31.144 OpenFlow 82 Type: OFPT_MULTIPART_REPLY, OFPMP_GROUP
 40 0.100714404 172.31.24.227 -> 172.31.31.144 OpenFlow 82 Type: OFPT_MULTIPART_REPLY, OFPMP_GROUP
 41 0.100716373 172.31.24.227 -> 172.31.31.144 OpenFlow 98 Type: OFPT_MULTIPART_REPLY, OFPMP_METER
 42 0.100724926 172.31.31.144 -> 172.31.24.227 TCP 90 6633 → 49354 [PSH, ACK] Seq=1 Ack=1 Win=853 Len=24 TSval=1097350 TSecr=119657523
 43 0.100728363 172.31.31.144 -> 172.31.24.227 TCP 90 6633 → 49380 [PSH, ACK] Seq=1 Ack=1 Win=853 Len=24 TSval=1097350 TSecr=119657524
 44 0.100730360 172.31.31.144 -> 172.31.24.227 TCP 90 6633 → 49386 [PSH, ACK] Seq=1 Ack=1 Win=853 Len=24 TSval=1097350 TSecr=119657526
 45 0.100780456 172.31.24.227 -> 172.31.31.144 OpenFlow 98 Type: OFPT_MULTIPART_REPLY, OFPMP_METER
 46 0.100785353 172.31.24.227 -> 172.31.31.144 OpenFlow 98 Type: OFPT_MULTIPART_REPLY, OFPMP_METER
 47 0.100786970 172.31.24.227 -> 172.31.31.144 OpenFlow 98 Type: OFPT_MULTIPART_REPLY, OFPMP_METER
 48 0.100793738 172.31.24.227 -> 172.31.31.144 OpenFlow 82 Type: OFPT_MULTIPART_REPLY, OFPMP_GROUP
 49 0.100812052 172.31.24.227 -> 172.31.31.144 OpenFlow 82 Type: OFPT_MULTIPART_REPLY, OFPMP_GROUP
 50 0.100831557 172.31.31.144 -> 172.31.24.227 OpenFlow 106 Type: OFPT_MULTIPART_REQUEST, OFPMP_METER
 51 0.100834161 172.31.31.144 -> 172.31.24.227 TCP 106 6633 → 49354 [PSH, ACK] Seq=25 Ack=1 Win=853 Len=40 TSval=1097350 TSecr=119657523
 52 0.100836310 172.31.31.144 -> 172.31.24.227 TCP 90 6633 → 49392 [PSH, ACK] Seq=1 Ack=1 Win=853 Len=24 TSval=1097350 TSecr=119657528
 53 0.100838607 172.31.31.144 -> 172.31.24.227 TCP 106 6633 → 49386 [PSH, ACK] Seq=25 Ack=1 Win=853 Len=40 TSval=1097350 TSecr=119657526
 54 0.100840136 172.31.31.144 -> 172.31.24.227 TCP 90 6633 → 49378 [PSH, ACK] Seq=1 Ack=1 Win=853 Len=24 TSval=1097350 TSecr=119657527
 55 0.100849322 172.31.24.227 -> 172.31.31.144 OpenFlow 82 Type: OFPT_MULTIPART_REPLY, OFPMP_GROUP
 56 0.100876687 172.31.24.227 -> 172.31.31.144 OpenFlow 82 Type: OFPT_MULTIPART_REPLY, OFPMP_GROUP
 57 0.100894537 172.31.24.227 -> 172.31.31.144 OpenFlow 82 Type: OFPT_MULTIPART_REPLY, OFPMP_GROUP
 58 0.100958907 172.31.31.144 -> 172.31.24.227 TCP 90 6633 → 49368 [PSH, ACK] Seq=1 Ack=1 Win=853 Len=24 TSval=1097350 TSecr=119657529
 59 0.100963496 172.31.31.144 -> 172.31.24.227 TCP 106 6633 → 49378 [PSH, ACK] Seq=25 Ack=1 Win=853 Len=40 TSval=1097350 TSecr=119657527
 60 0.100965338 172.31.31.144 -> 172.31.24.227 TCP 90 6633 → 49394 [PSH, ACK] Seq=1 Ack=1 Win=853 Len=24 TSval=1097350 TSecr=119657531
 61 0.100967648 172.31.31.144 -> 172.31.24.227 TCP 90 6633 → 49374 [PSH, ACK] Seq=1 Ack=1 Win=853 Len=24 TSval=1097350 TSecr=119657530
 62 0.100970151 172.31.31.144 -> 172.31.24.227 OpenFlow 106 Type: OFPT_MULTIPART_REQUEST, OFPMP_METER
 63 0.100971675 172.31.31.144 -> 172.31.24.227 TCP 106 6633 → 49368 [PSH, ACK] Seq=25 Ack=1 Win=853 Len=40 TSval=1097350 TSecr=119657529
 64 0.100973273 172.31.31.144 -> 172.31.24.227 TCP 106 6633 → 49394 [PSH, ACK] Seq=25 Ack=1 Win=853 Len=40 TSval=1097350 TSecr=119657531
 65 0.100978816 172.31.24.227 -> 172.31.31.144 OpenFlow 98 Type: OFPT_MULTIPART_REPLY, OFPMP_METER
 66 0.100987271 172.31.24.227 -> 172.31.31.144 OpenFlow 98 Type: OFPT_MULTIPART_REPLY, OFPMP_METER
 67 0.100988925 172.31.24.227 -> 172.31.31.144 OpenFlow 98 Type: OFPT_MULTIPART_REPLY, OFPMP_METER
 68 0.101034740 172.31.31.144 -> 172.31.24.227 TCP 90 6633 → 49364 [PSH, ACK] Seq=1 Ack=1 Win=853 Len=24 TSval=1097350 TSecr=119657532
 69 0.101039259 172.31.31.144 -> 172.31.24.227 TCP 106 6633 → 49374 [PSH, ACK] Seq=25 Ack=1 Win=853 Len=40 TSval=1097350 TSecr=119657530
 70 0.101041163 172.31.31.144 -> 172.31.24.227 TCP 106 6633 → 49364 [PSH, ACK] Seq=25 Ack=1 Win=853 Len=40 TSval=1097350 TSecr=119657532
 71 0.101042640 172.31.31.144 -> 172.31.24.227 TCP 66 6633 → 49352 [ACK] Seq=65 Ack=17 Win=853 Len=0 TSval=1097350 TSecr=119657960
 72 0.101068462 172.31.24.227 -> 172.31.31.144 OpenFlow 82 Type: OFPT_MULTIPART_REPLY, OFPMP_GROUP
 73 0.101112552 172.31.24.227 -> 172.31.31.144 OpenFlow 82 Type: OFPT_MULTIPART_REPLY, OFPMP_GROUP
 74 0.101117880 172.31.31.144 -> 172.31.24.227 TCP 66 6633 → 49352 [ACK] Seq=65 Ack=33 Win=853 Len=0 TSval=1097350 TSecr=119657960
 75 0.101120931 172.31.31.144 -> 172.31.24.227 TCP 66 6633 → 49356 [ACK] Seq=65 Ack=17 Win=853 Len=0 TSval=1097350 TSecr=119657960
 76 0.101122777 172.31.31.144 -> 172.31.24.227 TCP 66 6633 → 49352 [ACK] Seq=65 Ack=49 Win=853 Len=0 TSval=1097350 TSecr=119657960
 77 0.101124702 172.31.31.144 -> 172.31.24.227 TCP 66 6633 → 49356 [ACK] Seq=65 Ack=49 Win=853 Len=0 TSval=1097350 TSecr=119657960
 78 0.101128841 172.31.24.227 -> 172.31.31.144 OpenFlow 98 Type: OFPT_MULTIPART_REPLY, OFPMP_METER
 79 0.101138512 172.31.31.144 -> 172.31.24.227 TCP 66 6633 → 49360 [ACK] Seq=65 Ack=17 Win=853 Len=0 TSval=1097350 TSecr=119657960
 80 0.101141151 172.31.31.144 -> 172.31.24.227 TCP 66 6633 → 49362 [ACK] Seq=65 Ack=17 Win=853 Len=0 TSval=1097350 TSecr=119657960
 81 0.101165170 172.31.24.227 -> 172.31.31.144 OpenFlow 98 Type: OFPT_MULTIPART_REPLY, OFPMP_METER
 82 0.101169608 172.31.24.227 -> 172.31.31.144 OpenFlow 82 Type: OFPT_MULTIPART_REPLY, OFPMP_GROUP
 83 0.101192557 172.31.31.144 -> 172.31.24.227 TCP 66 6633 → 49366 [ACK] Seq=65 Ack=17 Win=853 Len=0 TSval=1097350 TSecr=119657960
 84 0.101195716 172.31.31.144 -> 172.31.24.227 TCP 66 6633 → 49370 [ACK] Seq=65 Ack=17 Win=853 Len=0 TSval=1097350 TSecr=119657960
 85 0.101197511 172.31.31.144 -> 172.31.24.227 TCP 66 6633 → 49360 [ACK] Seq=65 Ack=49 Win=853 Len=0 TSval=1097350 TSecr=119657960
 86 0.101205408 172.31.24.227 -> 172.31.31.144 OpenFlow 82 Type: OFPT_MULTIPART_REPLY, OFPMP_GROUP
 87 0.101229419 172.31.24.227 -> 172.31.31.144 OpenFlow 82 Type: OFPT_MULTIPART_REPLY, OFPMP_GROUP
 88 0.101231366 172.31.24.227 -> 172.31.31.144 OpenFlow 98 Type: OFPT_MULTIPART_REPLY, OFPMP_METER
 89 0.101244530 172.31.31.144 -> 172.31.24.227 TCP 66 6633 → 49362 [ACK] Seq=65 Ack=49 Win=853 Len=0 TSval=1097350 TSecr=119657960
 90 0.101247454 172.31.31.144 -> 172.31.24.227 TCP 66 6633 → 49366 [ACK] Seq=65 Ack=49 Win=853 Len=0 TSval=1097350 TSecr=119657960
 91 0.101249502 172.31.31.144 -> 172.31.24.227 TCP 66 6633 → 49370 [ACK] Seq=65 Ack=49 Win=853 Len=0 TSval=1097350 TSecr=119657960
 92 0.101260793 172.31.24.227 -> 172.31.31.144 OpenFlow 82 Type: OFPT_MULTIPART_REPLY, OFPMP_GROUP_DESC
 93 0.101265540 172.31.24.227 -> 172.31.31.144 OpenFlow 98 Type: OFPT_MULTIPART_REPLY, OFPMP_METER
 94 0.101267626 172.31.24.227 -> 172.31.31.144 OpenFlow 98 Type: OFPT_MULTIPART_REPLY, OFPMP_METER
 95 0.101299623 172.31.24.227 -> 172.31.31.144 OpenFlow 82 Type: OFPT_MULTIPART_REPLY, OFPMP_GROUP_DESC
 96 0.101312710 172.31.24.227 -> 172.31.31.144 OpenFlow 82 Type: OFPT_MULTIPART_REPLY, OFPMP_GROUP
 97 0.101320625 172.31.31.144 -> 172.31.24.227 TCP 66 6633 → 49380 [ACK] Seq=65 Ack=17 Win=853 Len=0 TSval=1097350 TSecr=119657960
 98 0.101323933 172.31.24.227 -> 172.31.31.144 OpenFlow 82 Type: OFPT_MULTIPART_REPLY, OFPMP_METER
 99 0.101328345 172.31.31.144 -> 172.31.24.227 TCP 66 6633 → 49384 [ACK] Seq=65 Ack=17 Win=853 Len=0 TSval=1097350 TSecr=119657960
100 0.101330451 172.31.31.144 -> 172.31.24.227 TCP 66 6633 → 49386 [ACK] Seq=65 Ack=17 Win=853 Len=0 TSval=1097350 TSecr=119657960
101 0.101332152 172.31.31.144 -> 172.31.24.227 TCP 66 6633 → 49390 [ACK] Seq=65 Ack=17 Win=853 Len=0 TSval=1097350 TSecr=119657960
102 0.101392958 172.31.24.227 -> 172.31.31.144 OpenFlow 82 Type: OFPT_MULTIPART_REPLY, OFPMP_METER
103 0.101444471 172.31.31.144 -> 172.31.24.227 TCP 66 6633 → 49392 [ACK] Seq=65 Ack=17 Win=853 Len=0 TSval=1097350 TSecr=119657960
104 0.101448903 172.31.31.144 -> 172.31.24.227 TCP 66 6633 → 49384 [ACK] Seq=65 Ack=49 Win=853 Len=0 TSval=1097350 TSecr=119657960
105 0.101450967 172.31.31.144 -> 172.31.24.227 TCP 66 6633 → 49386 [ACK] Seq=65 Ack=49 Win=853 Len=0 TSval=1097350 TSecr=119657960
106 0.101452863 172.31.31.144 -> 172.31.24.227 TCP 66 6633 → 49390 [ACK] Seq=65 Ack=49 Win=853 Len=0 TSval=1097350 TSecr=119657960
107 0.101454423 172.31.31.144 -> 172.31.24.227 TCP 66 6633 → 49354 [ACK] Seq=65 Ack=17 Win=853 Len=0 TSval=1097350 TSecr=119657960
108 0.101459633 172.31.24.227 -> 172.31.31.144 OpenFlow 98 Type: OFPT_MULTIPART_REPLY, OFPMP_METER
109 0.101525044 172.31.31.144 -> 172.31.24.227 TCP 66 6633 → 49364 [ACK] Seq=65 Ack=17 Win=853 Len=0 TSval=1097350 TSecr=119657960
110 0.101527350 172.31.31.144 -> 172.31.24.227 TCP 66 6633 → 49354 [ACK] Seq=65 Ack=49 Win=853 Len=0 TSval=1097350 TSecr=119657960
111 0.101529079 172.31.31.144 -> 172.31.24.227 TCP 66 6633 → 49364 [ACK] Seq=65 Ack=49 Win=853 Len=0 TSval=1097350 TSecr=119657960
112 0.101553102 172.31.31.144 -> 172.31.24.227 TCP 66 6633 → 49368 [ACK] Seq=65 Ack=17 Win=853 Len=0 TSval=1097350 TSecr=119657960
113 0.101555191 172.31.31.144 -> 172.31.24.227 TCP 66 6633 → 49374 [ACK] Seq=65 Ack=17 Win=853 Len=0 TSval=1097350 TSecr=119657960
114 0.101567465 172.31.31.144 -> 172.31.24.227 TCP 66 6633 → 49378 [ACK] Seq=65 Ack=17 Win=853 Len=0 TSval=1097350 TSecr=119657960
115 0.101608169 172.31.31.144 -> 172.31.24.227 TCP 66 6633 → 49368 [ACK] Seq=65 Ack=49 Win=853 Len=0 TSval=1097350 TSecr=119657960
116 0.101627538 172.31.31.144 -> 172.31.24.227 TCP 66 6633 → 49380 [ACK] Seq=65 Ack=33 Win=853 Len=0 TSval=1097350 TSecr=119657960
117 0.101647413 172.31.31.144 -> 172.31.24.227 TCP 66 6633 → 49374 [ACK] Seq=65 Ack=49 Win=853 Len=0 TSval=1097350 TSecr=119657960
118 0.101666998 172.31.31.144 -> 172.31.24.227 TCP 66 6633 → 49378 [ACK] Seq=65 Ack=49 Win=853 Len=0 TSval=1097350 TSecr=119657960
119 0.101700280 172.31.31.144 -> 172.31.24.227 TCP 66 6633 → 49392 [ACK] Seq=65 Ack=33 Win=853 Len=0 TSval=1097350 TSecr=119657960
120 0.101721672 172.31.31.144 -> 172.31.24.227 TCP 66 6633 → 49394 [ACK] Seq=65 Ack=17 Win=853 Len=0 TSval=1097350 TSecr=119657960
121 0.101740604 172.31.31.144 -> 172.31.24.227 TCP 66 6633 → 49380 [ACK] Seq=65 Ack=49 Win=853 Len=0 TSval=1097350 TSecr=119657960
122 0.101760361 172.31.31.144 -> 172.31.24.227 TCP 66 6633 → 49392 [ACK] Seq=65 Ack=49 Win=853 Len=0 TSval=1097350 TSecr=119657960
123 0.101792607 172.31.31.144 -> 172.31.24.227 TCP 66 6633 → 49394 [ACK] Seq=65 Ack=49 Win=853 Len=0 TSval=1097350 TSecr=119657960
124 0.200866432 172.31.31.144 -> 172.31.24.227 TCP 90 6633 → 49388 [PSH, ACK] Seq=1 Ack=1 Win=853 Len=24 TSval=1097375 TSecr=119657534
125 0.200889020 172.31.31.144 -> 172.31.24.227 TCP 90 6633 → 49372 [PSH, ACK] Seq=1 Ack=1 Win=853 Len=24 TSval=1097375 TSecr=119657539
126 0.200892585 172.31.31.144 -> 172.31.24.227 TCP 90 6633 → 49358 [PSH, ACK] Seq=1 Ack=1 Win=853 Len=24 TSval=1097375 TSecr=119657539
127 0.200908294 172.31.31.144 -> 172.31.24.227 TCP 90 6633 → 49376 [PSH, ACK] Seq=1 Ack=1 Win=853 Len=24 TSval=1097375 TSecr=119657539
128 0.200911614 172.31.31.144 -> 172.31.24.227 TCP 90 6633 → 49382 [PSH, ACK] Seq=1 Ack=1 Win=853 Len=24 TSval=1097375 TSecr=119657541
129 0.200926621 172.31.31.144 -> 172.31.24.227 TCP 106 6633 → 49358 [PSH, ACK] Seq=25 Ack=1 Win=853 Len=40 TSval=1097375 TSecr=119657539
130 0.200945900 172.31.31.144 -> 172.31.24.227 TCP 106 6633 → 49376 [PSH, ACK] Seq=25 Ack=1 Win=853 Len=40 TSval=1097375 TSecr=119657539
131 0.200964872 172.31.31.144 -> 172.31.24.227 TCP 106 6633 → 49382 [PSH, ACK] Seq=25 Ack=1 Win=853 Len=40 TSval=1097375 TSecr=119657541
132 0.200983648 172.31.31.144 -> 172.31.24.227 TCP 106 6633 → 49372 [PSH, ACK] Seq=25 Ack=1 Win=853 Len=40 TSval=1097375 TSecr=119657539
133 0.201002753 172.31.31.144 -> 172.31.24.227 TCP 106 6633 → 49388 [PSH, ACK] Seq=25 Ack=1 Win=853 Len=40 TSval=1097375 TSecr=119657534
134 0.201124106 172.31.24.227 -> 172.31.31.144 OpenFlow 82 Type: OFPT_MULTIPART_REPLY, OFPMP_GROUP
135 0.201152329 172.31.24.227 -> 172.31.31.144 OpenFlow 98 Type: OFPT_MULTIPART_REPLY, OFPMP_METER
136 0.201201679 172.31.24.227 -> 172.31.31.144 OpenFlow 82 Type: OFPT_MULTIPART_REPLY, OFPMP_GROUP
137 0.201228706 172.31.24.227 -> 172.31.31.144 OpenFlow 82 Type: OFPT_MULTIPART_REPLY, OFPMP_GROUP
138 0.201236139 172.31.24.227 -> 172.31.31.144 OpenFlow 98 Type: OFPT_MULTIPART_REPLY, OFPMP_METER
139 0.201265631 172.31.24.227 -> 172.31.31.144 OpenFlow 82 Type: OFPT_MULTIPART_REPLY, OFPMP_GROUP
140 0.201271217 172.31.24.227 -> 172.31.31.144 OpenFlow 98 Type: OFPT_MULTIPART_REPLY, OFPMP_METER
141 0.201308209 172.31.24.227 -> 172.31.31.144 OpenFlow 82 Type: OFPT_MULTIPART_REPLY, OFPMP_GROUP
142 0.201368877 172.31.24.227 -> 172.31.31.144 OpenFlow 98 Type: OFPT_MULTIPART_REPLY, OFPMP_METER
143 0.201434232 172.31.31.144 -> 172.31.24.227 TCP 66 6633 → 49358 [ACK] Seq=65 Ack=17 Win=853 Len=0 TSval=1097375 TSecr=119657985
144 0.201441194 172.31.31.144 -> 172.31.24.227 TCP 66 6633 → 49358 [ACK] Seq=65 Ack=49 Win=853 Len=0 TSval=1097375 TSecr=119657985
145 0.201446738 172.31.24.227 -> 172.31.31.144 OpenFlow 98 Type: OFPT_MULTIPART_REPLY, OFPMP_METER
146 0.201496782 172.31.31.144 -> 172.31.24.227 TCP 66 6633 → 49372 [ACK] Seq=65 Ack=17 Win=853 Len=0 TSval=1097375 TSecr=119657985
147 0.201499305 172.31.31.144 -> 172.31.24.227 TCP 66 6633 → 49376 [ACK] Seq=65 Ack=17 Win=853 Len=0 TSval=1097375 TSecr=119657985
148 0.201535867 172.31.31.144 -> 172.31.24.227 TCP 66 6633 → 49372 [ACK] Seq=65 Ack=49 Win=853 Len=0 TSval=1097375 TSecr=119657985
149 0.201537950 172.31.31.144 -> 172.31.24.227 TCP 66 6633 → 49376 [ACK] Seq=65 Ack=49 Win=853 Len=0 TSval=1097375 TSecr=119657985
150 0.201560873 172.31.31.144 -> 172.31.24.227 TCP 66 6633 → 49388 [ACK] Seq=65 Ack=17 Win=853 Len=0 TSval=1097375 TSecr=119657985
151 0.201696910 172.31.31.144 -> 172.31.24.227 TCP 66 6633 → 49382 [ACK] Seq=65 Ack=49 Win=853 Len=0 TSval=1097375 TSecr=119657985
152 0.201699231 172.31.31.144 -> 172.31.24.227 TCP 66 6633 → 49388 [ACK] Seq=65 Ack=49 Win=853 Len=0 TSval=1097375 TSecr=119657985
153 0.901113284 172.31.31.144 -> 172.31.24.227 OpenFlow 187 Type: OFPT_PACKET_OUT
154 0.901135614 172.31.31.144 -> 172.31.24.227 OpenFlow 187 Type: OFPT_PACKET_OUT
155 0.901139247 172.31.31.144 -> 172.31.24.227 OpenFlow 187 Type: OFPT_PACKET_OUT
156 0.901390535 172.31.24.227 -> 172.31.31.144 TCP 66 49350 → 6633 [ACK] Seq=49 Ack=428 Win=72 Len=0 TSval=119658160 TSecr=1097550
157 0.901399289 172.31.31.144 -> 172.31.24.227 OpenFlow 187 Type: OFPT_PACKET_OUT
158 0.901402537 172.31.31.144 -> 172.31.24.227 OpenFlow 187 Type: OFPT_PACKET_OUT
159 0.901403941 172.31.31.144 -> 172.31.24.227 OpenFlow 187 Type: OFPT_PACKET_OUT
160 0.901405799 172.31.31.144 -> 172.31.24.227 OpenFlow 187 Type: OFPT_PACKET_OUT
161 0.901407132 172.31.31.144 -> 172.31.24.227 OpenFlow 187 Type: OFPT_PACKET_OUT
162 0.901415866 172.31.24.227 -> 172.31.31.144 TCP 66 49350 → 6633 [ACK] Seq=49 Ack=1033 Win=72 Len=0 TSval=119658160 TSecr=1097550
163 0.901563171 172.31.31.144 -> 172.31.24.227 OpenFlow 187 Type: OFPT_PACKET_OUT
164 0.901568708 172.31.31.144 -> 172.31.24.227 OpenFlow 187 Type: OFPT_PACKET_OUT
165 0.901714487 172.31.24.227 -> 172.31.31.144 TCP 66 49350 → 6633 [ACK] Seq=49 Ack=1275 Win=72 Len=0 TSval=119658160 TSecr=1097550
166 0.901795212 172.31.24.227 -> 172.31.31.144 OpenFlow 189 Type: OFPT_PACKET_IN
167 0.901820456 172.31.24.227 -> 172.31.31.144 OpenFlow 189 Type: OFPT_PACKET_IN
168 0.901829398 172.31.24.227 -> 172.31.31.144 OpenFlow 189 Type: OFPT_PACKET_IN
169 0.901891553 172.31.24.227 -> 172.31.31.144 OpenFlow 189 Type: OFPT_PACKET_IN
170 0.901910910 172.31.24.227 -> 172.31.31.144 OpenFlow 189 Type: OFPT_PACKET_IN
171 0.901924344 172.31.24.227 -> 172.31.31.144 OpenFlow 189 Type: OFPT_PACKET_IN
172 0.901986765 172.31.24.227 -> 172.31.31.144 OpenFlow 189 Type: OFPT_PACKET_IN
173 0.901992080 172.31.24.227 -> 172.31.31.144 OpenFlow 435 Type: OFPT_PACKET_IN
174 0.902088950 172.31.31.144 -> 172.31.24.227 TCP 66 6633 → 49356 [ACK] Seq=65 Ack=172 Win=853 Len=0 TSval=1097550 TSecr=119658160
175 0.902095901 172.31.31.144 -> 172.31.24.227 TCP 66 6633 → 49358 [ACK] Seq=65 Ack=172 Win=853 Len=0 TSval=1097550 TSecr=119658160
176 0.902098189 172.31.31.144 -> 172.31.24.227 TCP 66 6633 → 49356 [ACK] Seq=65 Ack=295 Win=853 Len=0 TSval=1097550 TSecr=119658160
177 0.902100101 172.31.31.144 -> 172.31.24.227 TCP 66 6633 → 49358 [ACK] Seq=65 Ack=295 Win=853 Len=0 TSval=1097550 TSecr=119658160
178 0.902164628 172.31.31.144 -> 172.31.24.227 TCP 66 6633 → 49384 [ACK] Seq=65 Ack=172 Win=853 Len=0 TSval=1097550 TSecr=119658160
179 0.902183923 172.31.31.144 -> 172.31.24.227 TCP 66 6633 → 49386 [ACK] Seq=65 Ack=172 Win=853 Len=0 TSval=1097550 TSecr=119658160
180 0.902205103 172.31.31.144 -> 172.31.24.227 TCP 66 6633 → 49384 [ACK] Seq=65 Ack=295 Win=853 Len=0 TSval=1097550 TSecr=119658160
181 0.902230169 172.31.31.144 -> 172.31.24.227 TCP 66 6633 → 49386 [ACK] Seq=65 Ack=541 Win=853 Len=0 TSval=1097550 TSecr=119658160
182 1.000917396 172.31.31.144 -> 172.31.24.227 OpenFlow 187 Type: OFPT_PACKET_OUT
183 1.000963684 172.31.31.144 -> 172.31.24.227 OpenFlow 187 Type: OFPT_PACKET_OUT
184 1.000987850 172.31.31.144 -> 172.31.24.227 OpenFlow 187 Type: OFPT_PACKET_OUT
185 1.001061433 172.31.31.144 -> 172.31.24.227 OpenFlow 187 Type: OFPT_PACKET_OUT
186 1.001119204 172.31.31.144 -> 172.31.24.227 OpenFlow 187 Type: OFPT_PACKET_OUT
187 1.001180703 172.31.31.144 -> 172.31.24.227 OpenFlow 187 Type: OFPT_PACKET_OUT
188 1.001189816 172.31.24.227 -> 172.31.31.144 TCP 66 49390 → 6633 [ACK] Seq=49 Ack=791 Win=83 Len=0 TSval=119658185 TSecr=1097575
189 1.001258038 172.31.31.144 -> 172.31.24.227 OpenFlow 187 Type: OFPT_PACKET_OUT
190 1.001293696 172.31.31.144 -> 172.31.24.227 OpenFlow 187 Type: OFPT_PACKET_OUT
191 1.001400741 172.31.31.144 -> 172.31.24.227 OpenFlow 187 Type: OFPT_PACKET_OUT
192 1.001446079 172.31.31.144 -> 172.31.24.227 OpenFlow 187 Type: OFPT_PACKET_OUT
193 1.001522280 172.31.31.144 -> 172.31.24.227 OpenFlow 187 Type: OFPT_PACKET_OUT
194 1.001576987 172.31.31.144 -> 172.31.24.227 OpenFlow 187 Type: OFPT_PACKET_OUT
195 1.001615433 172.31.31.144 -> 172.31.24.227 OpenFlow 187 Type: OFPT_PACKET_OUT
196 1.001644492 172.31.24.227 -> 172.31.31.144 TCP 66 49390 → 6633 [ACK] Seq=49 Ack=1033 Win=83 Len=0 TSval=119658185 TSecr=1097575
197 1.001713293 172.31.31.144 -> 172.31.24.227 OpenFlow 187 Type: OFPT_PACKET_OUT
198 1.001727610 172.31.31.144 -> 172.31.24.227 OpenFlow 187 Type: OFPT_PACKET_OUT
199 1.001797033 172.31.31.144 -> 172.31.24.227 OpenFlow 187 Type: OFPT_PACKET_OUT
200 1.001837904 172.31.24.227 -> 172.31.31.144 OpenFlow 189 Type: OFPT_PACKET_IN
201 1.001862025 172.31.24.227 -> 172.31.31.144 OpenFlow 189 Type: OFPT_PACKET_IN
202 1.001881215 172.31.24.227 -> 172.31.31.144 OpenFlow 189 Type: OFPT_PACKET_IN
203 1.001890100 172.31.31.144 -> 172.31.24.227 OpenFlow 187 Type: OFPT_PACKET_OUT
204 1.001918030 172.31.24.227 -> 172.31.31.144 OpenFlow 189 Type: OFPT_PACKET_IN
205 1.001941542 172.31.31.144 -> 172.31.24.227 OpenFlow 187 Type: OFPT_PACKET_OUT
206 1.001980587 172.31.24.227 -> 172.31.31.144 TCP 66 49356 → 6633 [ACK] Seq=295 Ack=1275 Win=211 Len=0 TSval=119658185 TSecr=1097575
207 1.002035348 172.31.31.144 -> 172.31.24.227 TCP 66 6633 → 49348 [ACK] Seq=65 Ack=172 Win=853 Len=0 TSval=1097575 TSecr=119658185
208 1.002053290 172.31.31.144 -> 172.31.24.227 TCP 66 6633 → 49348 [ACK] Seq=65 Ack=295 Win=853 Len=0 TSval=1097575 TSecr=119658185
209 1.002108113 172.31.31.144 -> 172.31.24.227 TCP 66 6633 → 49354 [ACK] Seq=65 Ack=172 Win=853 Len=0 TSval=1097575 TSecr=119658185
210 1.002125738 172.31.31.144 -> 172.31.24.227 TCP 66 6633 → 49354 [ACK] Seq=65 Ack=295 Win=853 Len=0 TSval=1097575 TSecr=119658185
211 1.002177367 172.31.31.144 -> 172.31.24.227 OpenFlow 308 Type: OFPT_PACKET_OUT
212 1.002490557 172.31.24.227 -> 172.31.31.144 OpenFlow 189 Type: OFPT_PACKET_IN
213 1.002513947 172.31.24.227 -> 172.31.31.144 OpenFlow 189 Type: OFPT_PACKET_IN
214 1.002539101 172.31.24.227 -> 172.31.31.144 OpenFlow 189 Type: OFPT_PACKET_IN
215 1.002547802 172.31.24.227 -> 172.31.31.144 OpenFlow 189 Type: OFPT_PACKET_IN
216 1.002549843 172.31.24.227 -> 172.31.31.144 OpenFlow 435 Type: OFPT_PACKET_IN
217 1.002596131 172.31.24.227 -> 172.31.31.144 OpenFlow 681 Type: OFPT_PACKET_IN
218 1.002671054 172.31.24.227 -> 172.31.31.144 OpenFlow 189 Type: OFPT_PACKET_IN
219 1.002692013 172.31.24.227 -> 172.31.31.144 OpenFlow 189 Type: OFPT_PACKET_IN
220 1.002717186 172.31.31.144 -> 172.31.24.227 TCP 66 6633 → 49376 [ACK] Seq=65 Ack=172 Win=853 Len=0 TSval=1097575 TSecr=119658185
221 1.002741708 172.31.31.144 -> 172.31.24.227 TCP 66 6633 → 49380 [ACK] Seq=65 Ack=172 Win=853 Len=0 TSval=1097575 TSecr=119658185
222 1.002744686 172.31.31.144 -> 172.31.24.227 TCP 66 6633 → 49386 [ACK] Seq=65 Ack=664 Win=853 Len=0 TSval=1097575 TSecr=119658185
223 1.002766322 172.31.31.144 -> 172.31.24.227 OpenFlow 187 Type: OFPT_PACKET_OUT
224 1.002799582 172.31.31.144 -> 172.31.24.227 TCP 66 6633 → 49376 [ACK] Seq=65 Ack=295 Win=853 Len=0 TSval=1097575 TSecr=119658185
225 1.002819808 172.31.31.144 -> 172.31.24.227 TCP 66 6633 → 49380 [ACK] Seq=65 Ack=541 Win=853 Len=0 TSval=1097575 TSecr=119658185
226 1.002839414 172.31.31.144 -> 172.31.24.227 OpenFlow 308 Type: OFPT_PACKET_OUT
227 1.002860603 172.31.31.144 -> 172.31.24.227 TCP 66 6633 → 49386 [ACK] Seq=65 Ack=1279 Win=853 Len=0 TSval=1097575 TSecr=119658185
228 1.002879490 172.31.31.144 -> 172.31.24.227 OpenFlow 671 Type: OFPT_PACKET_OUT
229 1.002897813 172.31.31.144 -> 172.31.24.227 TCP 66 6633 → 49350 [ACK] Seq=1275 Ack=172 Win=853 Len=0 TSval=1097575 TSecr=119658185
230 1.002919637 172.31.31.144 -> 172.31.24.227 TCP 66 6633 → 49350 [ACK] Seq=1275 Ack=295 Win=853 Len=0 TSval=1097575 TSecr=119658185
231 1.002938808 172.31.31.144 -> 172.31.24.227 OpenFlow 187 Type: OFPT_PACKET_OUT
232 1.003097380 172.31.31.144 -> 172.31.24.227 OpenFlow 187 Type: OFPT_PACKET_OUT
233 1.003166807 172.31.31.144 -> 172.31.24.227 OpenFlow 187 Type: OFPT_PACKET_OUT
234 1.003260284 172.31.31.144 -> 172.31.24.227 OpenFlow 187 Type: OFPT_PACKET_OUT
235 1.003325097 172.31.31.144 -> 172.31.24.227 OpenFlow 187 Type: OFPT_PACKET_OUT
236 1.003425755 172.31.24.227 -> 172.31.31.144 TCP 66 49348 → 6633 [ACK] Seq=295 Ack=1638 Win=213 Len=0 TSval=119658185 TSecr=1097575
237 1.003509085 172.31.24.227 -> 172.31.31.144 OpenFlow 189 Type: OFPT_PACKET_IN
238 1.003530570 172.31.24.227 -> 172.31.31.144 OpenFlow 681 Type: OFPT_PACKET_IN
239 1.003577656 172.31.24.227 -> 172.31.31.144 OpenFlow 189 Type: OFPT_PACKET_IN
240 1.003607030 172.31.24.227 -> 172.31.31.144 OpenFlow 189 Type: OFPT_PACKET_IN
241 1.003622158 172.31.31.144 -> 172.31.24.227 OpenFlow 187 Type: OFPT_PACKET_OUT
242 1.003628010 172.31.24.227 -> 172.31.31.144 OpenFlow 189 Type: OFPT_PACKET_IN
243 1.003651218 172.31.24.227 -> 172.31.31.144 OpenFlow 189 Type: OFPT_PACKET_IN
244 1.003666100 172.31.24.227 -> 172.31.31.144 OpenFlow 189 Type: OFPT_PACKET_IN
245 1.003672702 172.31.24.227 -> 172.31.31.144 OpenFlow 189 Type: OFPT_PACKET_IN
246 1.003693175 172.31.31.144 -> 172.31.24.227 TCP 66 6633 → 49358 [ACK] Seq=65 Ack=418 Win=853 Len=0 TSval=1097576 TSecr=119658185
247 1.003720182 172.31.24.227 -> 172.31.31.144 OpenFlow 189 Type: OFPT_PACKET_IN
248 1.003747894 172.31.31.144 -> 172.31.24.227 TCP 66 6633 → 49358 [ACK] Seq=65 Ack=1033 Win=853 Len=0 TSval=1097576 TSecr=119658185
249 1.003751023 172.31.31.144 -> 172.31.24.227 OpenFlow 187 Type: OFPT_PACKET_OUT
250 1.003753033 172.31.31.144 -> 172.31.24.227 TCP 66 6633 → 49376 [ACK] Seq=65 Ack=418 Win=853 Len=0 TSval=1097576 TSecr=119658185
251 1.003807314 172.31.31.144 -> 172.31.24.227 TCP 66 6633 → 49384 [ACK] Seq=65 Ack=418 Win=853 Len=0 TSval=1097576 TSecr=119658185
252 1.003830052 172.31.31.144 -> 172.31.24.227 TCP 66 6633 → 49384 [ACK] Seq=65 Ack=541 Win=853 Len=0 TSval=1097576 TSecr=119658185
253 1.003844856 172.31.31.144 -> 172.31.24.227 OpenFlow 187 Type: OFPT_PACKET_OUT
254 1.003865123 172.31.31.144 -> 172.31.24.227 TCP 66 6633 → 49390 [ACK] Seq=1033 Ack=172 Win=853 Len=0 TSval=1097576 TSecr=119658185
255 1.003886359 172.31.31.144 -> 172.31.24.227 TCP 66 6633 → 49392 [ACK] Seq=65 Ack=172 Win=853 Len=0 TSval=1097576 TSecr=119658185
256 1.003909691 172.31.31.144 -> 172.31.24.227 TCP 66 6633 → 49390 [ACK] Seq=1033 Ack=295 Win=853 Len=0 TSval=1097576 TSecr=119658185
257 1.003926488 172.31.31.144 -> 172.31.24.227 TCP 66 6633 → 49392 [ACK] Seq=65 Ack=295 Win=853 Len=0 TSval=1097576 TSecr=119658185
258 1.003973193 172.31.24.227 -> 172.31.31.144 TCP 66 49348 → 6633 [ACK] Seq=295 Ack=2001 Win=213 Len=0 TSval=119658186 TSecr=1097576
259 1.004089966 172.31.24.227 -> 172.31.31.144 OpenFlow 189 Type: OFPT_PACKET_IN
260 1.004111531 172.31.24.227 -> 172.31.31.144 OpenFlow 312 Type: OFPT_PACKET_IN
261 1.004270883 172.31.31.144 -> 172.31.24.227 TCP 66 6633 → 49376 [ACK] Seq=65 Ack=541 Win=853 Len=0 TSval=1097576 TSecr=119658186
262 1.004286925 172.31.31.144 -> 172.31.24.227 TCP 66 6633 → 49376 [ACK] Seq=65 Ack=787 Win=853 Len=0 TSval=1097576 TSecr=119658186
263 1.039984695 172.31.24.227 -> 172.31.31.144 TCP 66 49356 → 6633 [ACK] Seq=295 Ack=1517 Win=213 Len=0 TSval=119658195 TSecr=1097575
264 1.100261389 172.31.31.144 -> 172.31.24.227 OpenFlow 187 Type: OFPT_PACKET_OUT
265 1.100283556 172.31.31.144 -> 172.31.24.227 OpenFlow 187 Type: OFPT_PACKET_OUT
266 1.100298651 172.31.31.144 -> 172.31.24.227 OpenFlow 187 Type: OFPT_PACKET_OUT
267 1.100329974 172.31.31.144 -> 172.31.24.227 OpenFlow 187 Type: OFPT_PACKET_OUT
268 1.100390694 172.31.31.144 -> 172.31.24.227 OpenFlow 187 Type: OFPT_PACKET_OUT
269 1.100448923 172.31.31.144 -> 172.31.24.227 OpenFlow 187 Type: OFPT_PACKET_OUT
270 1.100545344 172.31.31.144 -> 172.31.24.227 OpenFlow 187 Type: OFPT_PACKET_OUT
271 1.100555694 172.31.24.227 -> 172.31.31.144 TCP 66 49370 → 6633 [ACK] Seq=49 Ack=912 Win=99 Len=0 TSval=119658210 TSecr=1097600
272 1.100611610 172.31.31.144 -> 172.31.24.227 OpenFlow 187 Type: OFPT_PACKET_OUT
273 1.100651021 172.31.31.144 -> 172.31.24.227 OpenFlow 187 Type: OFPT_PACKET_OUT
274 1.100702175 172.31.31.144 -> 172.31.24.227 OpenFlow 187 Type: OFPT_PACKET_OUT
275 1.100769156 172.31.31.144 -> 172.31.24.227 OpenFlow 187 Type: OFPT_PACKET_OUT
276 1.100834059 172.31.31.144 -> 172.31.24.227 OpenFlow 187 Type: OFPT_PACKET_OUT
277 1.100888360 172.31.31.144 -> 172.31.24.227 OpenFlow 187 Type: OFPT_PACKET_OUT
278 1.100948796 172.31.31.144 -> 172.31.24.227 OpenFlow 187 Type: OFPT_PACKET_OUT
279 1.100954678 172.31.24.227 -> 172.31.31.144 TCP 66 49370 → 6633 [ACK] Seq=49 Ack=1759 Win=99 Len=0 TSval=119658210 TSecr=1097600
280 1.101067379 172.31.31.144 -> 172.31.24.227 OpenFlow 187 Type: OFPT_PACKET_OUT
281 1.101199428 172.31.31.144 -> 172.31.24.227 OpenFlow 187 Type: OFPT_PACKET_OUT
282 1.101259943 172.31.31.144 -> 172.31.24.227 OpenFlow 187 Type: OFPT_PACKET_OUT
283 1.101299719 172.31.24.227 -> 172.31.31.144 OpenFlow 189 Type: OFPT_PACKET_IN
284 1.101317365 172.31.31.144 -> 172.31.24.227 OpenFlow 187 Type: OFPT_PACKET_OUT
285 1.101323313 172.31.24.227 -> 172.31.31.144 OpenFlow 189 Type: OFPT_PACKET_IN
286 1.101373935 172.31.31.144 -> 172.31.24.227 OpenFlow 187 Type: OFPT_PACKET_OUT
287 1.101406124 172.31.24.227 -> 172.31.31.144 OpenFlow 189 Type: OFPT_PACKET_IN
288 1.101434081 172.31.24.227 -> 172.31.31.144 OpenFlow 189 Type: OFPT_PACKET_IN
289 1.101474447 172.31.31.144 -> 172.31.24.227 OpenFlow 187 Type: OFPT_PACKET_OUT
290 1.101502472 172.31.31.144 -> 172.31.24.227 OpenFlow 187 Type: OFPT_PACKET_OUT
291 1.101544254 172.31.31.144 -> 172.31.24.227 TCP 66 6633 → 49372 [ACK] Seq=65 Ack=172 Win=853 Len=0 TSval=1097600 TSecr=119658210
292 1.101570969 172.31.31.144 -> 172.31.24.227 TCP 66 6633 → 49372 [ACK] Seq=65 Ack=295 Win=853 Len=0 TSval=1097600 TSecr=119658210
293 1.101592323 172.31.31.144 -> 172.31.24.227 OpenFlow 187 Type: OFPT_PACKET_OUT
294 1.101615741 172.31.31.144 -> 172.31.24.227 OpenFlow 187 Type: OFPT_PACKET_OUT
295 1.101642491 172.31.31.144 -> 172.31.24.227 TCP 66 6633 → 49394 [ACK] Seq=65 Ack=172 Win=853 Len=0 TSval=1097600 TSecr=119658210
296 1.101662796 172.31.31.144 -> 172.31.24.227 TCP 66 6633 → 49394 [ACK] Seq=65 Ack=295 Win=853 Len=0 TSval=1097600 TSecr=119658210
297 1.101686459 172.31.31.144 -> 172.31.24.227 OpenFlow 187 Type: OFPT_PACKET_OUT
298 1.101950778 172.31.24.227 -> 172.31.31.144 TCP 66 49352 → 6633 [ACK] Seq=49 Ack=1275 Win=200 Len=0 TSval=119658210 TSecr=1097600
299 1.102027168 172.31.24.227 -> 172.31.31.144 OpenFlow 189 Type: OFPT_PACKET_IN
300 1.102049747 172.31.24.227 -> 172.31.31.144 OpenFlow 189 Type: OFPT_PACKET_IN
301 1.102058028 172.31.24.227 -> 172.31.31.144 OpenFlow 189 Type: OFPT_PACKET_IN
302 1.102075879 172.31.24.227 -> 172.31.31.144 OpenFlow 189 Type: OFPT_PACKET_IN
303 1.102091998 172.31.24.227 -> 172.31.31.144 OpenFlow 189 Type: OFPT_PACKET_IN
304 1.102143099 172.31.24.227 -> 172.31.31.144 OpenFlow 189 Type: OFPT_PACKET_IN
305 1.102145399 172.31.24.227 -> 172.31.31.144 OpenFlow 681 Type: OFPT_PACKET_IN
306 1.102172533 172.31.31.144 -> 172.31.24.227 OpenFlow 187 Type: OFPT_PACKET_OUT
307 1.102178028 172.31.24.227 -> 172.31.31.144 OpenFlow 435 Type: OFPT_PACKET_IN
308 1.102182661 172.31.31.144 -> 172.31.24.227 OpenFlow 187 Type: OFPT_PACKET_OUT
309 1.102187377 172.31.24.227 -> 172.31.31.144 OpenFlow 189 Type: OFPT_PACKET_IN
310 1.102190015 172.31.24.227 -> 172.31.31.144 OpenFlow 189 Type: OFPT_PACKET_IN
311 1.102267607 172.31.31.144 -> 172.31.24.227 OpenFlow 792 Type: OFPT_PACKET_OUT
312 1.102272012 172.31.31.144 -> 172.31.24.227 TCP 66 6633 → 49360 [ACK] Seq=65 Ack=172 Win=853 Len=0 TSval=1097600 TSecr=119658210
313 1.102277957 172.31.24.227 -> 172.31.31.144 OpenFlow 189 Type: OFPT_PACKET_IN
314 1.102315410 172.31.24.227 -> 172.31.31.144 OpenFlow 189 Type: OFPT_PACKET_IN
315 1.102359817 172.31.31.144 -> 172.31.24.227 TCP 66 6633 → 49360 [ACK] Seq=65 Ack=295 Win=853 Len=0 TSval=1097600 TSecr=119658210
316 1.102364920 172.31.31.144 -> 172.31.24.227 OpenFlow 187 Type: OFPT_PACKET_OUT
317 1.102367037 172.31.31.144 -> 172.31.24.227 TCP 66 6633 → 49364 [ACK] Seq=65 Ack=172 Win=853 Len=0 TSval=1097600 TSecr=119658210
318 1.102369191 172.31.31.144 -> 172.31.24.227 OpenFlow 187 Type: OFPT_PACKET_OUT
319 1.102371622 172.31.31.144 -> 172.31.24.227 OpenFlow 187 Type: OFPT_PACKET_OUT
320 1.102405053 172.31.31.144 -> 172.31.24.227 TCP 66 6633 → 49366 [ACK] Seq=65 Ack=172 Win=853 Len=0 TSval=1097600 TSecr=119658210
321 1.102409046 172.31.31.144 -> 172.31.24.227 TCP 66 6633 → 49368 [ACK] Seq=670 Ack=172 Win=853 Len=0 TSval=1097600 TSecr=119658210
322 1.102411023 172.31.31.144 -> 172.31.24.227 TCP 66 6633 → 49386 [ACK] Seq=65 Ack=1402 Win=853 Len=0 TSval=1097600 TSecr=119658210
323 1.102444307 172.31.31.144 -> 172.31.24.227 TCP 66 6633 → 49364 [ACK] Seq=65 Ack=787 Win=853 Len=0 TSval=1097600 TSecr=119658210
324 1.102463193 172.31.31.144 -> 172.31.24.227 TCP 66 6633 → 49368 [ACK] Seq=670 Ack=541 Win=853 Len=0 TSval=1097600 TSecr=119658210
325 1.102482966 172.31.31.144 -> 172.31.24.227 TCP 66 6633 → 49366 [ACK] Seq=65 Ack=295 Win=853 Len=0 TSval=1097600 TSecr=119658210
326 1.102524618 172.31.31.144 -> 172.31.24.227 TCP 66 6633 → 49394 [ACK] Seq=65 Ack=418 Win=853 Len=0 TSval=1097600 TSecr=119658210
327 1.102547222 172.31.31.144 -> 172.31.24.227 TCP 66 6633 → 49386 [ACK] Seq=65 Ack=1525 Win=853 Len=0 TSval=1097600 TSecr=119658210
328 1.102567745 172.31.31.144 -> 172.31.24.227 TCP 66 6633 → 49394 [ACK] Seq=65 Ack=541 Win=853 Len=0 TSval=1097600 TSecr=119658210
329 1.102703606 172.31.24.227 -> 172.31.31.144 OpenFlow 189 Type: OFPT_PACKET_IN
330 1.102725596 172.31.24.227 -> 172.31.31.144 OpenFlow 189 Type: OFPT_PACKET_IN
331 1.102730340 172.31.24.227 -> 172.31.31.144 OpenFlow 189 Type: OFPT_PACKET_IN
332 1.102780999 172.31.24.227 -> 172.31.31.144 OpenFlow 435 Type: OFPT_PACKET_IN
333 1.102819450 172.31.31.144 -> 172.31.24.227 OpenFlow 187 Type: OFPT_PACKET_OUT
334 1.102833589 172.31.31.144 -> 172.31.24.227 OpenFlow 187 Type: OFPT_PACKET_OUT
335 1.102854209 172.31.31.144 -> 172.31.24.227 OpenFlow 187 Type: OFPT_PACKET_OUT
336 1.102889688 172.31.31.144 -> 172.31.24.227 TCP 66 6633 → 49358 [ACK] Seq=65 Ack=1156 Win=853 Len=0 TSval=1097600 TSecr=119658210
337 1.102914112 172.31.31.144 -> 172.31.24.227 TCP 66 6633 → 49358 [ACK] Seq=65 Ack=1279 Win=853 Len=0 TSval=1097600 TSecr=119658210
338 1.102932087 172.31.31.144 -> 172.31.24.227 TCP 66 6633 → 49360 [ACK] Seq=65 Ack=418 Win=853 Len=0 TSval=1097600 TSecr=119658210
339 1.102952648 172.31.31.144 -> 172.31.24.227 TCP 66 6633 → 49360 [ACK] Seq=65 Ack=787 Win=853 Len=0 TSval=1097600 TSecr=119658210
340 1.103102048 172.31.24.227 -> 172.31.31.144 TCP 66 49368 → 6633 [ACK] Seq=541 Ack=1033 Win=213 Len=0 TSval=119658210 TSecr=1097600
341 1.103181111 172.31.24.227 -> 172.31.31.144 OpenFlow 189 Type: OFPT_PACKET_IN
342 1.103202437 172.31.24.227 -> 172.31.31.144 OpenFlow 435 Type: OFPT_PACKET_IN
343 1.103219516 172.31.24.227 -> 172.31.31.144 OpenFlow 189 Type: OFPT_PACKET_IN
344 1.103261541 172.31.24.227 -> 172.31.31.144 OpenFlow 189 Type: OFPT_PACKET_IN
345 1.103288632 172.31.24.227 -> 172.31.31.144 OpenFlow 189 Type: OFPT_PACKET_IN
346 1.103308340 172.31.24.227 -> 172.31.31.144 OpenFlow 189 Type: OFPT_PACKET_IN
347 1.103405475 172.31.31.144 -> 172.31.24.227 TCP 66 6633 → 49372 [ACK] Seq=65 Ack=418 Win=853 Len=0 TSval=1097600 TSecr=119658210
348 1.103434084 172.31.31.144 -> 172.31.24.227 TCP 66 6633 → 49372 [ACK] Seq=65 Ack=787 Win=853 Len=0 TSval=1097600 TSecr=119658210
349 1.103454320 172.31.31.144 -> 172.31.24.227 TCP 66 6633 → 49378 [ACK] Seq=65 Ack=172 Win=853 Len=0 TSval=1097600 TSecr=119658210
350 1.103474281 172.31.31.144 -> 172.31.24.227 TCP 66 6633 → 49378 [ACK] Seq=65 Ack=295 Win=853 Len=0 TSval=1097600 TSecr=119658210
351 1.103494429 172.31.31.144 -> 172.31.24.227 TCP 66 6633 → 49394 [ACK] Seq=65 Ack=664 Win=853 Len=0 TSval=1097600 TSecr=119658210
352 1.103537326 172.31.31.144 -> 172.31.24.227 TCP 66 6633 → 49394 [ACK] Seq=65 Ack=787 Win=853 Len=0 TSval=1097600 TSecr=119658210
353 1.104172530 172.31.31.144 -> 172.31.24.227 OpenFlow 187 Type: OFPT_PACKET_OUT
354 1.104189409 172.31.31.144 -> 172.31.24.227 OpenFlow 187 Type: OFPT_PACKET_OUT
355 1.104209034 172.31.31.144 -> 172.31.24.227 OpenFlow 308 Type: OFPT_PACKET_OUT
356 1.104228837 172.31.31.144 -> 172.31.24.227 OpenFlow 429 Type: OFPT_PACKET_OUT
357 1.104248972 172.31.31.144 -> 172.31.24.227 OpenFlow 187 Type: OFPT_PACKET_OUT
358 1.104323493 172.31.31.144 -> 172.31.24.227 OpenFlow 187 Type: OFPT_PACKET_OUT
359 1.104370596 172.31.31.144 -> 172.31.24.227 OpenFlow 187 Type: OFPT_PACKET_OUT
360 1.104400413 172.31.24.227 -> 172.31.31.144 TCP 66 49368 → 6633 [ACK] Seq=541 Ack=2243 Win=211 Len=0 TSval=119658211 TSecr=1097601
361 1.104468954 172.31.31.144 -> 172.31.24.227 OpenFlow 187 Type: OFPT_PACKET_OUT
362 1.104510149 172.31.31.144 -> 172.31.24.227 OpenFlow 187 Type: OFPT_PACKET_OUT
363 1.104582459 172.31.31.144 -> 172.31.24.227 OpenFlow 187 Type: OFPT_PACKET_OUT
364 1.104677612 172.31.31.144 -> 172.31.24.227 OpenFlow 187 Type: OFPT_PACKET_OUT
365 1.104714018 172.31.31.144 -> 172.31.24.227 OpenFlow 187 Type: OFPT_PACKET_OUT
366 1.104719028 172.31.24.227 -> 172.31.31.144 TCP 66 49354 → 6633 [ACK] Seq=295 Ack=670 Win=74 Len=0 TSval=119658211 TSecr=1097601
367 1.104774481 172.31.31.144 -> 172.31.24.227 OpenFlow 187 Type: OFPT_PACKET_OUT
368 1.104830684 172.31.31.144 -> 172.31.24.227 OpenFlow 187 Type: OFPT_PACKET_OUT
369 1.104887061 172.31.31.144 -> 172.31.24.227 OpenFlow 187 Type: OFPT_PACKET_OUT
370 1.104923616 172.31.24.227 -> 172.31.31.144 OpenFlow 189 Type: OFPT_PACKET_IN
