  1 0.000000000 172.31.31.144 -> 172.31.24.227 TCP 82 6633 → 59678 [PSH, ACK] Seq=1 Ack=1 Win=853 Len=16 TSval=2857182 TSecr=391760485
  2 0.000022685 172.31.31.144 -> 172.31.24.227 TCP 146 6633 → 59678 [PSH, ACK] Seq=17 Ack=1 Win=853 Len=80 TSval=2857182 TSecr=391760485
  3 0.000406978 172.31.24.227 -> 172.31.31.144 OpenFlow 6178 Type: OFPT_MULTIPART_REPLY, OFPMP_TABLE
  4 0.000514573 172.31.24.227 -> 172.31.31.144 OpenFlow 3018 Type: OFPT_MULTIPART_REPLY, OFPMP_FLOW
  5 0.000617411 172.31.24.227 -> 172.31.31.144 OpenFlow 642 Type: OFPT_MULTIPART_REPLY, OFPMP_PORT_STATS
  6 0.000713220 172.31.31.144 -> 172.31.24.227 TCP 66 6633 → 59678 [ACK] Seq=97 Ack=6113 Win=853 Len=0 TSval=2857182 TSecr=391761057
  7 0.000721916 172.31.31.144 -> 172.31.24.227 TCP 66 6633 → 59678 [ACK] Seq=97 Ack=9065 Win=853 Len=0 TSval=2857182 TSecr=391761057
  8 0.000817263 172.31.31.144 -> 172.31.24.227 TCP 66 6633 → 59678 [ACK] Seq=97 Ack=9641 Win=853 Len=0 TSval=2857182 TSecr=391761057
  9 0.002107024 137.158.125.247 -> 172.31.24.227 TCP 54 63468 → 22 [ACK] Seq=1 Ack=1 Win=32464 Len=0
 10 0.013093387 172.31.31.144 -> 172.31.24.227 TCP 187 6633 → 59658 [PSH, ACK] Seq=1 Ack=1 Win=853 Len=121 TSval=2857185 TSecr=391761035
 11 0.013102370 172.31.31.144 -> 172.31.24.227 TCP 187 6633 → 59658 [PSH, ACK] Seq=122 Ack=1 Win=853 Len=121 TSval=2857185 TSecr=391761035
 12 0.013106087 172.31.31.144 -> 172.31.24.227 TCP 187 6633 → 59658 [PSH, ACK] Seq=243 Ack=1 Win=853 Len=121 TSval=2857185 TSecr=391761035
 13 0.013108651 172.31.31.144 -> 172.31.24.227 TCP 187 6633 → 59658 [PSH, ACK] Seq=364 Ack=1 Win=853 Len=121 TSval=2857185 TSecr=391761035
 14 0.013110826 172.31.31.144 -> 172.31.24.227 TCP 187 6633 → 59658 [PSH, ACK] Seq=485 Ack=1 Win=853 Len=121 TSval=2857185 TSecr=391761035
 15 0.013161120 172.31.31.144 -> 172.31.24.227 TCP 187 6633 → 59658 [PSH, ACK] Seq=606 Ack=1 Win=853 Len=121 TSval=2857185 TSecr=391761035
 16 0.013166502 172.31.31.144 -> 172.31.24.227 TCP 187 6633 → 59658 [PSH, ACK] Seq=727 Ack=1 Win=853 Len=121 TSval=2857185 TSecr=391761035
 17 0.013232923 172.31.31.144 -> 172.31.24.227 TCP 187 6633 → 59658 [PSH, ACK] Seq=848 Ack=1 Win=853 Len=121 TSval=2857185 TSecr=391761035
 18 0.013279783 172.31.31.144 -> 172.31.24.227 TCP 187 6633 → 59658 [PSH, ACK] Seq=969 Ack=1 Win=853 Len=121 TSval=2857185 TSecr=391761035
 19 0.013334092 172.31.31.144 -> 172.31.24.227 TCP 187 6633 → 59658 [PSH, ACK] Seq=1090 Ack=1 Win=853 Len=121 TSval=2857185 TSecr=391761035
 20 0.013379792 172.31.31.144 -> 172.31.24.227 TCP 187 6633 → 59660 [PSH, ACK] Seq=1 Ack=1 Win=853 Len=121 TSval=2857185 TSecr=391761035
 21 0.013443091 172.31.31.144 -> 172.31.24.227 TCP 187 6633 → 59660 [PSH, ACK] Seq=122 Ack=1 Win=853 Len=121 TSval=2857185 TSecr=391761035
 22 0.013489626 172.31.31.144 -> 172.31.24.227 TCP 187 6633 → 59660 [PSH, ACK] Seq=243 Ack=1 Win=853 Len=121 TSval=2857185 TSecr=391761035
 23 0.013556394 172.31.31.144 -> 172.31.24.227 TCP 187 6633 → 59660 [PSH, ACK] Seq=364 Ack=1 Win=853 Len=121 TSval=2857185 TSecr=391761035
 24 0.013605598 172.31.31.144 -> 172.31.24.227 TCP 187 6633 → 59660 [PSH, ACK] Seq=485 Ack=1 Win=853 Len=121 TSval=2857185 TSecr=391761035
 25 0.013664210 172.31.31.144 -> 172.31.24.227 TCP 187 6633 → 59660 [PSH, ACK] Seq=606 Ack=1 Win=853 Len=121 TSval=2857185 TSecr=391761035
 26 0.013725701 172.31.31.144 -> 172.31.24.227 TCP 187 6633 → 59660 [PSH, ACK] Seq=727 Ack=1 Win=853 Len=121 TSval=2857185 TSecr=391761035
 27 0.013791423 172.31.31.144 -> 172.31.24.227 TCP 187 6633 → 59660 [PSH, ACK] Seq=848 Ack=1 Win=853 Len=121 TSval=2857185 TSecr=391761035
 28 0.013873306 172.31.24.227 -> 172.31.31.144 TCP 66 59658 → 6633 [ACK] Seq=1 Ack=1211 Win=213 Len=0 TSval=391761060 TSecr=2857185
 29 0.013953590 172.31.24.227 -> 172.31.31.144 OpenFlow 189 Type: OFPT_PACKET_IN
 30 0.013976871 172.31.24.227 -> 172.31.31.144 OpenFlow 189 Type: OFPT_PACKET_IN
 31 0.014011097 172.31.24.227 -> 172.31.31.144 OpenFlow 189 Type: OFPT_PACKET_IN
 32 0.014035674 172.31.24.227 -> 172.31.31.144 OpenFlow 189 Type: OFPT_PACKET_IN
 33 0.014041236 172.31.24.227 -> 172.31.31.144 OpenFlow 189 Type: OFPT_PACKET_IN
 34 0.014089783 172.31.24.227 -> 172.31.31.144 OpenFlow 189 Type: OFPT_PACKET_IN
 35 0.014121968 172.31.24.227 -> 172.31.31.144 OpenFlow 189 Type: OFPT_PACKET_IN
 36 0.014162721 172.31.31.144 -> 172.31.24.227 TCP 66 6633 → 59648 [ACK] Seq=1 Ack=124 Win=853 Len=0 TSval=2857186 TSecr=391761060
 37 0.014191631 172.31.24.227 -> 172.31.31.144 OpenFlow 189 Type: OFPT_PACKET_IN
 38 0.014218379 172.31.31.144 -> 172.31.24.227 TCP 66 6633 → 59674 [ACK] Seq=1 Ack=124 Win=853 Len=0 TSval=2857186 TSecr=391761060
 39 0.014274143 172.31.24.227 -> 172.31.31.144 OpenFlow 189 Type: OFPT_PACKET_IN
 40 0.014293586 172.31.31.144 -> 172.31.24.227 TCP 66 6633 → 59674 [ACK] Seq=1 Ack=247 Win=853 Len=0 TSval=2857186 TSecr=391761060
 41 0.014298520 172.31.31.144 -> 172.31.24.227 TCP 66 6633 → 59654 [ACK] Seq=1 Ack=247 Win=853 Len=0 TSval=2857186 TSecr=391761060
 42 0.014313808 172.31.24.227 -> 172.31.31.144 OpenFlow 189 Type: OFPT_PACKET_IN
 43 0.014415076 172.31.31.144 -> 172.31.24.227 TCP 66 6633 → 59666 [ACK] Seq=1 Ack=124 Win=853 Len=0 TSval=2857186 TSecr=391761060
 44 0.014421843 172.31.31.144 -> 172.31.24.227 TCP 66 6633 → 59648 [ACK] Seq=1 Ack=247 Win=853 Len=0 TSval=2857186 TSecr=391761060
 45 0.014424502 172.31.31.144 -> 172.31.24.227 TCP 66 6633 → 59666 [ACK] Seq=1 Ack=247 Win=853 Len=0 TSval=2857186 TSecr=391761060
 46 0.014526067 172.31.31.144 -> 172.31.24.227 TCP 66 6633 → 59660 [ACK] Seq=969 Ack=124 Win=853 Len=0 TSval=2857186 TSecr=391761060
 47 0.014696115 172.31.31.144 -> 172.31.24.227 TCP 66 6633 → 59660 [ACK] Seq=969 Ack=247 Win=853 Len=0 TSval=2857186 TSecr=391761060
 48 0.014805633 172.31.24.227 -> 172.31.31.144 OpenFlow 189 Type: OFPT_PACKET_IN
 49 0.014826982 172.31.24.227 -> 172.31.31.144 OpenFlow 189 Type: OFPT_PACKET_IN
 50 0.014856355 172.31.24.227 -> 172.31.31.144 OpenFlow 189 Type: OFPT_PACKET_IN
 51 0.014878608 172.31.24.227 -> 172.31.31.144 OpenFlow 189 Type: OFPT_PACKET_IN
 52 0.014916750 172.31.24.227 -> 172.31.31.144 OpenFlow 189 Type: OFPT_PACKET_IN
 53 0.014923326 172.31.24.227 -> 172.31.31.144 OpenFlow 189 Type: OFPT_PACKET_IN
 54 0.014940184 172.31.24.227 -> 172.31.31.144 OpenFlow 189 Type: OFPT_PACKET_IN
 55 0.015052963 172.31.31.144 -> 172.31.24.227 TCP 66 6633 → 59658 [ACK] Seq=1211 Ack=124 Win=853 Len=0 TSval=2857186 TSecr=391761060
 56 0.015059990 172.31.31.144 -> 172.31.24.227 TCP 66 6633 → 59668 [ACK] Seq=1 Ack=124 Win=853 Len=0 TSval=2857186 TSecr=391761060
 57 0.015065777 172.31.24.227 -> 172.31.31.144 OpenFlow 189 Type: OFPT_PACKET_IN
 58 0.015160899 172.31.31.144 -> 172.31.24.227 TCP 66 6633 → 59662 [ACK] Seq=1 Ack=124 Win=853 Len=0 TSval=2857186 TSecr=391761060
 59 0.015167466 172.31.31.144 -> 172.31.24.227 TCP 66 6633 → 59668 [ACK] Seq=1 Ack=247 Win=853 Len=0 TSval=2857186 TSecr=391761061
 60 0.015170079 172.31.31.144 -> 172.31.24.227 TCP 66 6633 → 59662 [ACK] Seq=1 Ack=247 Win=853 Len=0 TSval=2857186 TSecr=391761061
 61 0.015263658 172.31.31.144 -> 172.31.24.227 TCP 66 6633 → 59658 [ACK] Seq=1211 Ack=247 Win=853 Len=0 TSval=2857186 TSecr=391761060
 62 0.015267391 172.31.31.144 -> 172.31.24.227 TCP 66 6633 → 59654 [ACK] Seq=1 Ack=370 Win=853 Len=0 TSval=2857186 TSecr=391761061
 63 0.015401813 172.31.31.144 -> 172.31.24.227 TCP 66 6633 → 59654 [ACK] Seq=1 Ack=493 Win=853 Len=0 TSval=2857186 TSecr=391761061
 64 0.079117644 172.31.31.144 -> 172.31.24.227 TCP 82 6633 → 59680 [PSH, ACK] Seq=1 Ack=1 Win=853 Len=16 TSval=2857202 TSecr=391760485
 65 0.079141215 172.31.31.144 -> 172.31.24.227 TCP 146 6633 → 59680 [PSH, ACK] Seq=17 Ack=1 Win=853 Len=80 TSval=2857202 TSecr=391760485
 66 0.079512113 172.31.24.227 -> 172.31.31.144 OpenFlow 6178 Type: OFPT_MULTIPART_REPLY, OFPMP_TABLE
 67 0.079639301 172.31.24.227 -> 172.31.31.144 OpenFlow 642 Type: OFPT_MULTIPART_REPLY, OFPMP_PORT_STATS
 68 0.079734736 172.31.24.227 -> 172.31.31.144 OpenFlow 2810 Type: OFPT_MULTIPART_REPLY, OFPMP_FLOW
 69 0.079766103 172.31.31.144 -> 172.31.24.227 TCP 66 6633 → 59680 [ACK] Seq=97 Ack=6113 Win=853 Len=0 TSval=2857202 TSecr=391761077
 70 0.079840177 172.31.31.144 -> 172.31.24.227 TCP 66 6633 → 59680 [ACK] Seq=97 Ack=6689 Win=853 Len=0 TSval=2857202 TSecr=391761077
 71 0.079972950 172.31.31.144 -> 172.31.24.227 TCP 66 6633 → 59680 [ACK] Seq=97 Ack=9433 Win=853 Len=0 TSval=2857202 TSecr=391761077
 72 0.097727913 137.158.125.247 -> 172.31.24.227 TCP 54 63468 → 22 [ACK] Seq=1 Ack=97 Win=32416 Len=0
 73 0.113026846 172.31.31.144 -> 172.31.24.227 OpenFlow 187 Type: OFPT_PACKET_OUT
 74 0.113036152 172.31.31.144 -> 172.31.24.227 OpenFlow 187 Type: OFPT_PACKET_OUT
 75 0.113082162 172.31.31.144 -> 172.31.24.227 OpenFlow 187 Type: OFPT_PACKET_OUT
 76 0.113146554 172.31.31.144 -> 172.31.24.227 OpenFlow 187 Type: OFPT_PACKET_OUT
 77 0.113185941 172.31.31.144 -> 172.31.24.227 OpenFlow 187 Type: OFPT_PACKET_OUT
 78 0.113240554 172.31.31.144 -> 172.31.24.227 OpenFlow 187 Type: OFPT_PACKET_OUT
 79 0.113294427 172.31.31.144 -> 172.31.24.227 OpenFlow 187 Type: OFPT_PACKET_OUT
 80 0.113354028 172.31.31.144 -> 172.31.24.227 OpenFlow 187 Type: OFPT_PACKET_OUT
 81 0.113595027 172.31.24.227 -> 172.31.31.144 TCP 66 59662 → 6633 [ACK] Seq=247 Ack=969 Win=213 Len=0 TSval=391761085 TSecr=2857210
 82 0.113712120 172.31.24.227 -> 172.31.31.144 OpenFlow 189 Type: OFPT_PACKET_IN
 83 0.113729685 172.31.24.227 -> 172.31.31.144 OpenFlow 189 Type: OFPT_PACKET_IN
 84 0.113805849 172.31.24.227 -> 172.31.31.144 OpenFlow 189 Type: OFPT_PACKET_IN
 85 0.113852469 172.31.24.227 -> 172.31.31.144 OpenFlow 189 Type: OFPT_PACKET_IN
 86 0.113905768 172.31.24.227 -> 172.31.31.144 OpenFlow 189 Type: OFPT_PACKET_IN
 87 0.113928319 172.31.24.227 -> 172.31.31.144 OpenFlow 189 Type: OFPT_PACKET_IN
 88 0.113937767 172.31.24.227 -> 172.31.31.144 OpenFlow 189 Type: OFPT_PACKET_IN
 89 0.114041395 172.31.24.227 -> 172.31.31.144 OpenFlow 189 Type: OFPT_PACKET_IN
 90 0.114070646 172.31.31.144 -> 172.31.24.227 TCP 66 6633 → 59670 [ACK] Seq=1 Ack=124 Win=853 Len=0 TSval=2857210 TSecr=391761085
 91 0.114077127 172.31.31.144 -> 172.31.24.227 TCP 66 6633 → 59670 [ACK] Seq=1 Ack=247 Win=853 Len=0 TSval=2857210 TSecr=391761085
 92 0.114079727 172.31.31.144 -> 172.31.24.227 TCP 66 6633 → 59656 [ACK] Seq=1 Ack=124 Win=853 Len=0 TSval=2857210 TSecr=391761085
 93 0.114116752 172.31.31.144 -> 172.31.24.227 TCP 66 6633 → 59664 [ACK] Seq=1 Ack=124 Win=853 Len=0 TSval=2857210 TSecr=391761085
 94 0.114185679 172.31.31.144 -> 172.31.24.227 TCP 66 6633 → 59656 [ACK] Seq=1 Ack=247 Win=853 Len=0 TSval=2857211 TSecr=391761085
 95 0.114190426 172.31.31.144 -> 172.31.24.227 TCP 66 6633 → 59664 [ACK] Seq=1 Ack=247 Win=853 Len=0 TSval=2857211 TSecr=391761085
 96 0.114238090 172.31.31.144 -> 172.31.24.227 TCP 66 6633 → 59660 [ACK] Seq=969 Ack=370 Win=853 Len=0 TSval=2857211 TSecr=391761085
 97 0.114433463 172.31.31.144 -> 172.31.24.227 TCP 66 6633 → 59660 [ACK] Seq=969 Ack=493 Win=853 Len=0 TSval=2857211 TSecr=391761085
 98 0.125238971 172.31.31.144 -> 172.31.24.227 TCP 90 6633 → 59682 [PSH, ACK] Seq=1 Ack=1 Win=853 Len=24 TSval=2857213 TSecr=391760485
 99 0.125248651 172.31.31.144 -> 172.31.24.227 TCP 138 6633 → 59682 [PSH, ACK] Seq=25 Ack=1 Win=853 Len=72 TSval=2857213 TSecr=391760485
100 0.125458209 172.31.24.227 -> 172.31.31.144 OpenFlow 642 Type: OFPT_MULTIPART_REPLY, OFPMP_PORT_STATS
101 0.125551898 172.31.24.227 -> 172.31.31.144 OpenFlow 3434 Type: OFPT_MULTIPART_REPLY, OFPMP_FLOW
102 0.125662566 172.31.31.144 -> 172.31.24.227 TCP 66 6633 → 59682 [ACK] Seq=97 Ack=577 Win=853 Len=0 TSval=2857213 TSecr=391761088
103 0.125706828 172.31.24.227 -> 172.31.31.144 OpenFlow 6178 Type: OFPT_MULTIPART_REPLY, OFPMP_TABLE
104 0.125781553 172.31.31.144 -> 172.31.24.227 TCP 66 6633 → 59682 [ACK] Seq=97 Ack=3945 Win=853 Len=0 TSval=2857213 TSecr=391761088
105 0.125981015 172.31.31.144 -> 172.31.24.227 TCP 66 6633 → 59682 [ACK] Seq=97 Ack=10057 Win=853 Len=0 TSval=2857213 TSecr=391761088
106 0.170429770 172.31.31.144 -> 172.31.24.227 TCP 90 6633 → 59684 [PSH, ACK] Seq=1 Ack=1 Win=853 Len=24 TSval=2857225 TSecr=391760486
107 0.170439878 172.31.31.144 -> 172.31.24.227 TCP 138 6633 → 59684 [PSH, ACK] Seq=25 Ack=1 Win=853 Len=72 TSval=2857225 TSecr=391760486
108 0.170643030 172.31.24.227 -> 172.31.31.144 OpenFlow 530 Type: OFPT_MULTIPART_REPLY, OFPMP_PORT_STATS
109 0.170810444 172.31.24.227 -> 172.31.31.144 OpenFlow 6178 Type: OFPT_MULTIPART_REPLY, OFPMP_TABLE
110 0.170854112 172.31.31.144 -> 172.31.24.227 TCP 66 6633 → 59684 [ACK] Seq=97 Ack=465 Win=853 Len=0 TSval=2857225 TSecr=391761099
111 0.170909780 172.31.24.227 -> 172.31.31.144 OpenFlow 2186 Type: OFPT_MULTIPART_REPLY, OFPMP_FLOW
112 0.171066144 172.31.31.144 -> 172.31.24.227 TCP 66 6633 → 59684 [ACK] Seq=97 Ack=6577 Win=853 Len=0 TSval=2857225 TSecr=391761099
113 0.171116630 172.31.31.144 -> 172.31.24.227 TCP 66 6633 → 59684 [ACK] Seq=97 Ack=8697 Win=853 Len=0 TSval=2857225 TSecr=391761100
114 0.212639164 172.31.31.144 -> 172.31.24.227 TCP 90 6633 → 59638 [PSH, ACK] Seq=1 Ack=1 Win=853 Len=24 TSval=2857235 TSecr=391760985
115 0.212650041 172.31.31.144 -> 172.31.24.227 TCP 90 6633 → 59640 [PSH, ACK] Seq=1 Ack=1 Win=853 Len=24 TSval=2857235 TSecr=391760985
116 0.212653200 172.31.31.144 -> 172.31.24.227 TCP 106 6633 → 59638 [PSH, ACK] Seq=25 Ack=1 Win=853 Len=40 TSval=2857235 TSecr=391760985
117 0.212656327 172.31.31.144 -> 172.31.24.227 TCP 106 6633 → 59640 [PSH, ACK] Seq=25 Ack=1 Win=853 Len=40 TSval=2857235 TSecr=391760985
118 0.212658616 172.31.31.144 -> 172.31.24.227 OpenFlow 187 Type: OFPT_PACKET_OUT
119 0.212679836 172.31.31.144 -> 172.31.24.227 OpenFlow 187 Type: OFPT_PACKET_OUT
120 0.212721478 172.31.31.144 -> 172.31.24.227 OpenFlow 187 Type: OFPT_PACKET_OUT
121 0.212783319 172.31.31.144 -> 172.31.24.227 OpenFlow 187 Type: OFPT_PACKET_OUT
122 0.212830995 172.31.31.144 -> 172.31.24.227 OpenFlow 187 Type: OFPT_PACKET_OUT
123 0.212881027 172.31.31.144 -> 172.31.24.227 OpenFlow 187 Type: OFPT_PACKET_OUT
124 0.212947117 172.31.31.144 -> 172.31.24.227 OpenFlow 187 Type: OFPT_PACKET_OUT
125 0.213000367 172.31.31.144 -> 172.31.24.227 OpenFlow 187 Type: OFPT_PACKET_OUT
126 0.213059773 172.31.31.144 -> 172.31.24.227 OpenFlow 187 Type: OFPT_PACKET_OUT
127 0.213107185 172.31.31.144 -> 172.31.24.227 OpenFlow 187 Type: OFPT_PACKET_OUT
128 0.213133230 172.31.24.227 -> 172.31.31.144 TCP 66 59664 → 6633 [ACK] Seq=247 Ack=727 Win=213 Len=0 TSval=391761110 TSecr=2857235
129 0.213169019 172.31.31.144 -> 172.31.24.227 OpenFlow 187 Type: OFPT_PACKET_OUT
130 0.213218643 172.31.31.144 -> 172.31.24.227 OpenFlow 187 Type: OFPT_PACKET_OUT
131 0.213263087 172.31.24.227 -> 172.31.31.144 OpenFlow 189 Type: OFPT_PACKET_IN
132 0.213283364 172.31.24.227 -> 172.31.31.144 OpenFlow 189 Type: OFPT_PACKET_IN
133 0.213326222 172.31.24.227 -> 172.31.31.144 OpenFlow 82 Type: OFPT_MULTIPART_REPLY, OFPMP_GROUP
134 0.213350208 172.31.24.227 -> 172.31.31.144 OpenFlow 98 Type: OFPT_MULTIPART_REPLY, OFPMP_METER
135 0.213369246 172.31.24.227 -> 172.31.31.144 OpenFlow 189 Type: OFPT_PACKET_IN
136 0.213405394 172.31.24.227 -> 172.31.31.144 OpenFlow 189 Type: OFPT_PACKET_IN
137 0.213410931 172.31.24.227 -> 172.31.31.144 OpenFlow 82 Type: OFPT_MULTIPART_REPLY, OFPMP_GROUP
138 0.213437791 172.31.24.227 -> 172.31.31.144 OpenFlow 189 Type: OFPT_PACKET_IN
139 0.213563717 172.31.31.144 -> 172.31.24.227 TCP 66 6633 → 59662 [ACK] Seq=969 Ack=370 Win=853 Len=0 TSval=2857235 TSecr=391761110
140 0.213571163 172.31.31.144 -> 172.31.24.227 TCP 66 6633 → 59640 [ACK] Seq=65 Ack=17 Win=853 Len=0 TSval=2857235 TSecr=391761110
141 0.213573836 172.31.31.144 -> 172.31.24.227 TCP 66 6633 → 59640 [ACK] Seq=65 Ack=49 Win=853 Len=0 TSval=2857235 TSecr=391761110
142 0.213580554 172.31.24.227 -> 172.31.31.144 OpenFlow 98 Type: OFPT_MULTIPART_REPLY, OFPMP_METER
143 0.213587382 172.31.24.227 -> 172.31.31.144 OpenFlow 189 Type: OFPT_PACKET_IN
144 0.213638410 172.31.31.144 -> 172.31.24.227 TCP 66 6633 → 59656 [ACK] Seq=1 Ack=370 Win=853 Len=0 TSval=2857235 TSecr=391761110
145 0.213796014 172.31.31.144 -> 172.31.24.227 TCP 66 6633 → 59638 [ACK] Seq=65 Ack=17 Win=853 Len=0 TSval=2857235 TSecr=391761110
146 0.213810643 172.31.31.144 -> 172.31.24.227 TCP 66 6633 → 59662 [ACK] Seq=969 Ack=493 Win=853 Len=0 TSval=2857235 TSecr=391761110
147 0.213813375 172.31.31.144 -> 172.31.24.227 TCP 66 6633 → 59656 [ACK] Seq=1 Ack=493 Win=853 Len=0 TSval=2857235 TSecr=391761110
148 0.213816302 172.31.31.144 -> 172.31.24.227 TCP 66 6633 → 59672 [ACK] Seq=1 Ack=124 Win=853 Len=0 TSval=2857235 TSecr=391761110
149 0.213825737 172.31.24.227 -> 172.31.31.144 TCP 66 59666 → 6633 [ACK] Seq=247 Ack=727 Win=213 Len=0 TSval=391761110 TSecr=2857235
150 0.213896858 172.31.31.144 -> 172.31.24.227 TCP 66 6633 → 59638 [ACK] Seq=65 Ack=49 Win=853 Len=0 TSval=2857235 TSecr=391761110
151 0.213950049 172.31.31.144 -> 172.31.24.227 TCP 66 6633 → 59672 [ACK] Seq=1 Ack=247 Win=853 Len=0 TSval=2857235 TSecr=391761110
152 0.214019715 172.31.24.227 -> 172.31.31.144 OpenFlow 189 Type: OFPT_PACKET_IN
153 0.214041019 172.31.24.227 -> 172.31.31.144 OpenFlow 189 Type: OFPT_PACKET_IN
154 0.214078741 172.31.24.227 -> 172.31.31.144 OpenFlow 189 Type: OFPT_PACKET_IN
155 0.214103048 172.31.24.227 -> 172.31.31.144 OpenFlow 189 Type: OFPT_PACKET_IN
156 0.214123895 172.31.24.227 -> 172.31.31.144 OpenFlow 189 Type: OFPT_PACKET_IN
157 0.214162698 172.31.24.227 -> 172.31.31.144 OpenFlow 189 Type: OFPT_PACKET_IN
158 0.214210609 172.31.31.144 -> 172.31.24.227 TCP 66 6633 → 59676 [ACK] Seq=1 Ack=124 Win=853 Len=0 TSval=2857236 TSecr=391761110
159 0.214318291 172.31.31.144 -> 172.31.24.227 TCP 66 6633 → 59676 [ACK] Seq=1 Ack=247 Win=853 Len=0 TSval=2857236 TSecr=391761110
160 0.214324566 172.31.31.144 -> 172.31.24.227 TCP 66 6633 → 59658 [ACK] Seq=1211 Ack=370 Win=853 Len=0 TSval=2857236 TSecr=391761110
161 0.214327361 172.31.31.144 -> 172.31.24.227 TCP 66 6633 → 59668 [ACK] Seq=1 Ack=370 Win=853 Len=0 TSval=2857236 TSecr=391761110
162 0.214442832 172.31.31.144 -> 172.31.24.227 TCP 66 6633 → 59668 [ACK] Seq=1 Ack=493 Win=853 Len=0 TSval=2857236 TSecr=391761110
163 0.214446774 172.31.31.144 -> 172.31.24.227 TCP 66 6633 → 59658 [ACK] Seq=1211 Ack=493 Win=853 Len=0 TSval=2857236 TSecr=391761110
164 0.312564716 172.31.31.144 -> 172.31.24.227 TCP 90 6633 → 59642 [PSH, ACK] Seq=1 Ack=1 Win=853 Len=24 TSval=2857260 TSecr=391761010
165 0.312589459 172.31.31.144 -> 172.31.24.227 TCP 90 6633 → 59644 [PSH, ACK] Seq=1 Ack=1 Win=853 Len=24 TSval=2857260 TSecr=391761010
166 0.312593141 172.31.31.144 -> 172.31.24.227 TCP 106 6633 → 59642 [PSH, ACK] Seq=25 Ack=1 Win=853 Len=40 TSval=2857260 TSecr=391761010
167 0.312596787 172.31.31.144 -> 172.31.24.227 TCP 106 6633 → 59644 [PSH, ACK] Seq=25 Ack=1 Win=853 Len=40 TSval=2857260 TSecr=391761010
168 0.312599137 172.31.31.144 -> 172.31.24.227 OpenFlow 187 Type: OFPT_PACKET_OUT
169 0.312602314 172.31.31.144 -> 172.31.24.227 OpenFlow 187 Type: OFPT_PACKET_OUT
170 0.312620043 172.31.31.144 -> 172.31.24.227 OpenFlow 187 Type: OFPT_PACKET_OUT
171 0.312637484 172.31.31.144 -> 172.31.24.227 OpenFlow 187 Type: OFPT_PACKET_OUT
172 0.312708646 172.31.31.144 -> 172.31.24.227 OpenFlow 187 Type: OFPT_PACKET_OUT
173 0.312760234 172.31.31.144 -> 172.31.24.227 OpenFlow 187 Type: OFPT_PACKET_OUT
174 0.312799795 172.31.31.144 -> 172.31.24.227 OpenFlow 187 Type: OFPT_PACKET_OUT
175 0.312826734 172.31.24.227 -> 172.31.31.144 OpenFlow 82 Type: OFPT_MULTIPART_REPLY, OFPMP_GROUP
176 0.312858670 172.31.31.144 -> 172.31.24.227 OpenFlow 187 Type: OFPT_PACKET_OUT
177 0.312867924 172.31.24.227 -> 172.31.31.144 OpenFlow 98 Type: OFPT_MULTIPART_REPLY, OFPMP_METER
178 0.312894320 172.31.24.227 -> 172.31.31.144 OpenFlow 82 Type: OFPT_MULTIPART_REPLY, OFPMP_GROUP
179 0.312910805 172.31.31.144 -> 172.31.24.227 OpenFlow 187 Type: OFPT_PACKET_OUT
180 0.312980739 172.31.24.227 -> 172.31.31.144 OpenFlow 98 Type: OFPT_MULTIPART_REPLY, OFPMP_METER
181 0.312990702 172.31.31.144 -> 172.31.24.227 OpenFlow 187 Type: OFPT_PACKET_OUT
182 0.313077491 172.31.31.144 -> 172.31.24.227 TCP 66 6633 → 59644 [ACK] Seq=65 Ack=17 Win=853 Len=0 TSval=2857260 TSecr=391761135
183 0.313084686 172.31.31.144 -> 172.31.24.227 TCP 66 6633 → 59644 [ACK] Seq=65 Ack=49 Win=853 Len=0 TSval=2857260 TSecr=391761135
184 0.313189669 172.31.31.144 -> 172.31.24.227 TCP 66 6633 → 59642 [ACK] Seq=65 Ack=17 Win=853 Len=0 TSval=2857260 TSecr=391761135
185 0.313195915 172.31.31.144 -> 172.31.24.227 TCP 66 6633 → 59642 [ACK] Seq=65 Ack=49 Win=853 Len=0 TSval=2857260 TSecr=391761135
186 0.313460553 172.31.24.227 -> 172.31.31.144 TCP 66 59668 → 6633 [ACK] Seq=493 Ack=1211 Win=213 Len=0 TSval=391761135 TSecr=2857260
187 0.313565164 172.31.24.227 -> 172.31.31.144 OpenFlow 189 Type: OFPT_PACKET_IN
188 0.313586723 172.31.24.227 -> 172.31.31.144 OpenFlow 189 Type: OFPT_PACKET_IN
189 0.313622668 172.31.24.227 -> 172.31.31.144 OpenFlow 189 Type: OFPT_PACKET_IN
190 0.313659525 172.31.24.227 -> 172.31.31.144 OpenFlow 189 Type: OFPT_PACKET_IN
191 0.313676663 172.31.24.227 -> 172.31.31.144 OpenFlow 189 Type: OFPT_PACKET_IN
192 0.313698781 172.31.24.227 -> 172.31.31.144 OpenFlow 189 Type: OFPT_PACKET_IN
193 0.313756417 172.31.31.144 -> 172.31.24.227 TCP 66 6633 → 59670 [ACK] Seq=1 Ack=370 Win=853 Len=0 TSval=2857260 TSecr=391761135
194 0.313769137 172.31.24.227 -> 172.31.31.144 OpenFlow 189 Type: OFPT_PACKET_IN
195 0.313775491 172.31.24.227 -> 172.31.31.144 OpenFlow 189 Type: OFPT_PACKET_IN
196 0.313806694 172.31.31.144 -> 172.31.24.227 TCP 66 6633 → 59670 [ACK] Seq=1 Ack=493 Win=853 Len=0 TSval=2857260 TSecr=391761135
197 0.313855992 172.31.24.227 -> 172.31.31.144 OpenFlow 189 Type: OFPT_PACKET_IN
198 0.313920356 172.31.31.144 -> 172.31.24.227 TCP 66 6633 → 59680 [ACK] Seq=97 Ack=9556 Win=853 Len=0 TSval=2857260 TSecr=391761135
199 0.313925664 172.31.31.144 -> 172.31.24.227 TCP 66 6633 → 59680 [ACK] Seq=97 Ack=9679 Win=853 Len=0 TSval=2857260 TSecr=391761135
200 0.313928081 172.31.31.144 -> 172.31.24.227 TCP 66 6633 → 59678 [ACK] Seq=97 Ack=9764 Win=853 Len=0 TSval=2857260 TSecr=391761135
201 0.313947045 172.31.24.227 -> 172.31.31.144 OpenFlow 189 Type: OFPT_PACKET_IN
202 0.313982736 172.31.31.144 -> 172.31.24.227 TCP 66 6633 → 59666 [ACK] Seq=727 Ack=370 Win=853 Len=0 TSval=2857260 TSecr=391761135
203 0.314109725 172.31.31.144 -> 172.31.24.227 TCP 66 6633 → 59666 [ACK] Seq=727 Ack=493 Win=853 Len=0 TSval=2857260 TSecr=391761135
204 0.314115867 172.31.31.144 -> 172.31.24.227 TCP 66 6633 → 59678 [ACK] Seq=97 Ack=9887 Win=853 Len=0 TSval=2857260 TSecr=391761135
205 0.314148885 172.31.31.144 -> 172.31.24.227 TCP 66 6633 → 59660 [ACK] Seq=969 Ack=616 Win=853 Len=0 TSval=2857261 TSecr=391761135
206 0.314271456 172.31.31.144 -> 172.31.24.227 TCP 66 6633 → 59660 [ACK] Seq=969 Ack=739 Win=853 Len=0 TSval=2857261 TSecr=391761135
207 0.412278242 172.31.31.144 -> 172.31.24.227 TCP 90 6633 → 59646 [PSH, ACK] Seq=1 Ack=1 Win=853 Len=24 TSval=2857285 TSecr=391761010
208 0.412297488 172.31.31.144 -> 172.31.24.227 OpenFlow 90 Type: OFPT_MULTIPART_REQUEST, OFPMP_GROUP
209 0.412301362 172.31.31.144 -> 172.31.24.227 TCP 106 6633 → 59646 [PSH, ACK] Seq=25 Ack=1 Win=853 Len=40 TSval=2857285 TSecr=391761010
210 0.412305141 172.31.31.144 -> 172.31.24.227 OpenFlow 106 Type: OFPT_MULTIPART_REQUEST, OFPMP_METER
211 0.412307537 172.31.31.144 -> 172.31.24.227 OpenFlow 187 Type: OFPT_PACKET_OUT
212 0.412310633 172.31.31.144 -> 172.31.24.227 OpenFlow 187 Type: OFPT_PACKET_OUT
213 0.412329261 172.31.31.144 -> 172.31.24.227 OpenFlow 187 Type: OFPT_PACKET_OUT
214 0.412332699 172.31.31.144 -> 172.31.24.227 OpenFlow 187 Type: OFPT_PACKET_OUT
215 0.412387567 172.31.31.144 -> 172.31.24.227 OpenFlow 187 Type: OFPT_PACKET_OUT
216 0.412448689 172.31.31.144 -> 172.31.24.227 OpenFlow 187 Type: OFPT_PACKET_OUT
217 0.412501478 172.31.31.144 -> 172.31.24.227 OpenFlow 187 Type: OFPT_PACKET_OUT
218 0.412510442 172.31.24.227 -> 172.31.31.144 OpenFlow 82 Type: OFPT_MULTIPART_REPLY, OFPMP_GROUP
219 0.412556953 172.31.31.144 -> 172.31.24.227 OpenFlow 187 Type: OFPT_PACKET_OUT
220 0.412565210 172.31.24.227 -> 172.31.31.144 OpenFlow 98 Type: OFPT_MULTIPART_REPLY, OFPMP_METER
221 0.412610481 172.31.31.144 -> 172.31.24.227 OpenFlow 187 Type: OFPT_PACKET_OUT
222 0.412675583 172.31.31.144 -> 172.31.24.227 OpenFlow 187 Type: OFPT_PACKET_OUT
223 0.412830986 172.31.31.144 -> 172.31.24.227 OpenFlow 187 Type: OFPT_PACKET_OUT
224 0.412837691 172.31.31.144 -> 172.31.24.227 TCP 66 6633 → 59648 [ACK] Seq=65 Ack=263 Win=853 Len=0 TSval=2857285 TSecr=391761160
225 0.412842647 172.31.31.144 -> 172.31.24.227 TCP 66 6633 → 59648 [ACK] Seq=65 Ack=295 Win=853 Len=0 TSval=2857285 TSecr=391761160
226 0.412845635 172.31.31.144 -> 172.31.24.227 OpenFlow 187 Type: OFPT_PACKET_OUT
227 0.412892789 172.31.31.144 -> 172.31.24.227 OpenFlow 187 Type: OFPT_PACKET_OUT
228 0.412898335 172.31.31.144 -> 172.31.24.227 OpenFlow 187 Type: OFPT_PACKET_OUT
229 0.412972220 172.31.31.144 -> 172.31.24.227 OpenFlow 187 Type: OFPT_PACKET_OUT
230 0.413029579 172.31.31.144 -> 172.31.24.227 OpenFlow 187 Type: OFPT_PACKET_OUT
231 0.413231972 172.31.24.227 -> 172.31.31.144 TCP 66 59670 → 6633 [ACK] Seq=493 Ack=1211 Win=213 Len=0 TSval=391761160 TSecr=2857285
232 0.413329578 172.31.24.227 -> 172.31.31.144 OpenFlow 189 Type: OFPT_PACKET_IN
233 0.413352354 172.31.24.227 -> 172.31.31.144 OpenFlow 189 Type: OFPT_PACKET_IN
234 0.413369576 172.31.24.227 -> 172.31.31.144 OpenFlow 189 Type: OFPT_PACKET_IN
235 0.413399408 172.31.24.227 -> 172.31.31.144 OpenFlow 189 Type: OFPT_PACKET_IN
236 0.413446511 172.31.24.227 -> 172.31.31.144 OpenFlow 189 Type: OFPT_PACKET_IN
237 0.413453718 172.31.24.227 -> 172.31.31.144 OpenFlow 189 Type: OFPT_PACKET_IN
238 0.413583566 172.31.31.144 -> 172.31.24.227 TCP 66 6633 → 59682 [ACK] Seq=97 Ack=10180 Win=853 Len=0 TSval=2857285 TSecr=391761160
239 0.413591067 172.31.31.144 -> 172.31.24.227 TCP 66 6633 → 59682 [ACK] Seq=97 Ack=10303 Win=853 Len=0 TSval=2857285 TSecr=391761160
240 0.413594088 172.31.31.144 -> 172.31.24.227 TCP 66 6633 → 59680 [ACK] Seq=97 Ack=9802 Win=853 Len=0 TSval=2857285 TSecr=391761160
241 0.413660190 172.31.31.144 -> 172.31.24.227 TCP 66 6633 → 59680 [ACK] Seq=97 Ack=9925 Win=853 Len=0 TSval=2857285 TSecr=391761160
242 0.413666578 172.31.31.144 -> 172.31.24.227 TCP 66 6633 → 59672 [ACK] Seq=727 Ack=370 Win=853 Len=0 TSval=2857285 TSecr=391761160
243 0.413821699 172.31.24.227 -> 172.31.31.144 OpenFlow 82 Type: OFPT_MULTIPART_REPLY, OFPMP_GROUP
244 0.413833666 172.31.31.144 -> 172.31.24.227 TCP 66 6633 → 59672 [ACK] Seq=727 Ack=493 Win=853 Len=0 TSval=2857285 TSecr=391761160
245 0.413851857 172.31.24.227 -> 172.31.31.144 OpenFlow 82 Type: OFPT_MULTIPART_REPLY, OFPMP_GROUP_DESC
246 0.413872641 172.31.24.227 -> 172.31.31.144 OpenFlow 82 Type: OFPT_MULTIPART_REPLY, OFPMP_METER
247 0.413974111 172.31.24.227 -> 172.31.31.144 OpenFlow 189 Type: OFPT_PACKET_IN
248 0.414023221 172.31.24.227 -> 172.31.31.144 OpenFlow 189 Type: OFPT_PACKET_IN
249 0.414037820 172.31.24.227 -> 172.31.31.144 OpenFlow 189 Type: OFPT_PACKET_IN
250 0.414054700 172.31.24.227 -> 172.31.31.144 OpenFlow 189 Type: OFPT_PACKET_IN
251 0.414092525 172.31.31.144 -> 172.31.24.227 TCP 66 6633 → 59646 [ACK] Seq=65 Ack=17 Win=853 Len=0 TSval=2857285 TSecr=391761160
252 0.414098829 172.31.31.144 -> 172.31.24.227 TCP 66 6633 → 59646 [ACK] Seq=65 Ack=33 Win=853 Len=0 TSval=2857286 TSecr=391761160
253 0.414106820 172.31.24.227 -> 172.31.31.144 OpenFlow 189 Type: OFPT_PACKET_IN
254 0.414136693 172.31.24.227 -> 172.31.31.144 OpenFlow 189 Type: OFPT_PACKET_IN
255 0.414140032 172.31.24.227 -> 172.31.31.144 OpenFlow 189 Type: OFPT_PACKET_IN
256 0.414193570 172.31.31.144 -> 172.31.24.227 TCP 66 6633 → 59646 [ACK] Seq=65 Ack=49 Win=853 Len=0 TSval=2857286 TSecr=391761160
257 0.414198920 172.31.31.144 -> 172.31.24.227 TCP 66 6633 → 59664 [ACK] Seq=727 Ack=370 Win=853 Len=0 TSval=2857286 TSecr=391761160
258 0.414204795 172.31.24.227 -> 172.31.31.144 OpenFlow 189 Type: OFPT_PACKET_IN
259 0.414211371 172.31.24.227 -> 172.31.31.144 OpenFlow 189 Type: OFPT_PACKET_IN
260 0.414297585 172.31.31.144 -> 172.31.24.227 TCP 66 6633 → 59664 [ACK] Seq=727 Ack=493 Win=853 Len=0 TSval=2857286 TSecr=391761160
261 0.414307553 172.31.24.227 -> 172.31.31.144 OpenFlow 189 Type: OFPT_PACKET_IN
262 0.414430365 172.31.31.144 -> 172.31.24.227 TCP 66 6633 → 59668 [ACK] Seq=1211 Ack=616 Win=853 Len=0 TSval=2857286 TSecr=391761160
263 0.414434518 172.31.31.144 -> 172.31.24.227 TCP 66 6633 → 59662 [ACK] Seq=969 Ack=616 Win=853 Len=0 TSval=2857286 TSecr=391761160
264 0.414437556 172.31.31.144 -> 172.31.24.227 TCP 66 6633 → 59670 [ACK] Seq=1211 Ack=616 Win=853 Len=0 TSval=2857286 TSecr=391761160
265 0.414440323 172.31.31.144 -> 172.31.24.227 TCP 66 6633 → 59684 [ACK] Seq=97 Ack=8820 Win=853 Len=0 TSval=2857286 TSecr=391761160
266 0.414539681 172.31.31.144 -> 172.31.24.227 TCP 66 6633 → 59668 [ACK] Seq=1211 Ack=739 Win=853 Len=0 TSval=2857286 TSecr=391761160
267 0.414545791 172.31.31.144 -> 172.31.24.227 TCP 66 6633 → 59662 [ACK] Seq=969 Ack=739 Win=853 Len=0 TSval=2857286 TSecr=391761160
268 0.414607405 172.31.31.144 -> 172.31.24.227 TCP 66 6633 → 59670 [ACK] Seq=1211 Ack=739 Win=853 Len=0 TSval=2857286 TSecr=391761160
269 0.414610925 172.31.31.144 -> 172.31.24.227 TCP 66 6633 → 59684 [ACK] Seq=97 Ack=8943 Win=853 Len=0 TSval=2857286 TSecr=391761160
270 0.452278439 172.31.24.227 -> 137.158.125.247 SSH 98 Server: Encrypted packet (len=44)
271 0.512284609 172.31.31.144 -> 172.31.24.227 TCP 90 6633 → 59650 [PSH, ACK] Seq=1 Ack=1 Win=853 Len=24 TSval=2857310 TSecr=391761035
272 0.512311198 172.31.31.144 -> 172.31.24.227 TCP 90 6633 → 59652 [PSH, ACK] Seq=1 Ack=1 Win=853 Len=24 TSval=2857310 TSecr=391761036
273 0.512315074 172.31.31.144 -> 172.31.24.227 TCP 106 6633 → 59650 [PSH, ACK] Seq=25 Ack=1 Win=853 Len=40 TSval=2857310 TSecr=391761035
274 0.512319443 172.31.31.144 -> 172.31.24.227 TCP 106 6633 → 59652 [PSH, ACK] Seq=25 Ack=1 Win=853 Len=40 TSval=2857310 TSecr=391761036
275 0.512564138 172.31.24.227 -> 172.31.31.144 OpenFlow 82 Type: OFPT_MULTIPART_REPLY, OFPMP_GROUP
276 0.512620590 172.31.24.227 -> 172.31.31.144 OpenFlow 98 Type: OFPT_MULTIPART_REPLY, OFPMP_METER
277 0.512705924 172.31.24.227 -> 172.31.31.144 OpenFlow 82 Type: OFPT_MULTIPART_REPLY, OFPMP_GROUP
278 0.512738522 172.31.24.227 -> 172.31.31.144 OpenFlow 82 Type: OFPT_MULTIPART_REPLY, OFPMP_GROUP_DESC
279 0.512770885 172.31.24.227 -> 172.31.31.144 OpenFlow 82 Type: OFPT_MULTIPART_REPLY, OFPMP_METER
280 0.512839711 172.31.31.144 -> 172.31.24.227 TCP 66 6633 → 59652 [ACK] Seq=65 Ack=17 Win=853 Len=0 TSval=2857310 TSecr=391761185
281 0.512848166 172.31.31.144 -> 172.31.24.227 TCP 66 6633 → 59652 [ACK] Seq=65 Ack=49 Win=853 Len=0 TSval=2857310 TSecr=391761185
282 0.512924586 172.31.31.144 -> 172.31.24.227 TCP 66 6633 → 59650 [ACK] Seq=65 Ack=17 Win=853 Len=0 TSval=2857310 TSecr=391761185
283 0.512966771 172.31.31.144 -> 172.31.24.227 TCP 66 6633 → 59650 [ACK] Seq=65 Ack=33 Win=853 Len=0 TSval=2857310 TSecr=391761185
284 0.513043515 172.31.31.144 -> 172.31.24.227 TCP 66 6633 → 59650 [ACK] Seq=65 Ack=49 Win=853 Len=0 TSval=2857310 TSecr=391761185
285 0.612498678 172.31.31.144 -> 172.31.24.227 OpenFlow 90 Type: OFPT_MULTIPART_REQUEST, OFPMP_GROUP
286 0.612527571 172.31.31.144 -> 172.31.24.227 OpenFlow 90 Type: OFPT_MULTIPART_REQUEST, OFPMP_GROUP
287 0.612531288 172.31.31.144 -> 172.31.24.227 OpenFlow 106 Type: OFPT_MULTIPART_REQUEST, OFPMP_METER
288 0.612535263 172.31.31.144 -> 172.31.24.227 OpenFlow 106 Type: OFPT_MULTIPART_REQUEST, OFPMP_METER
289 0.612537580 172.31.31.144 -> 172.31.24.227 OpenFlow 187 Type: OFPT_PACKET_OUT
290 0.612540970 172.31.31.144 -> 172.31.24.227 OpenFlow 187 Type: OFPT_PACKET_OUT
291 0.612560583 172.31.31.144 -> 172.31.24.227 OpenFlow 187 Type: OFPT_PACKET_OUT
292 0.612583859 172.31.31.144 -> 172.31.24.227 OpenFlow 187 Type: OFPT_PACKET_OUT
293 0.612652806 172.31.31.144 -> 172.31.24.227 OpenFlow 187 Type: OFPT_PACKET_OUT
294 0.612687459 172.31.31.144 -> 172.31.24.227 OpenFlow 187 Type: OFPT_PACKET_OUT
295 0.612759773 172.31.31.144 -> 172.31.24.227 OpenFlow 187 Type: OFPT_PACKET_OUT
296 0.612803097 172.31.31.144 -> 172.31.24.227 OpenFlow 187 Type: OFPT_PACKET_OUT
297 0.612869268 172.31.31.144 -> 172.31.24.227 OpenFlow 187 Type: OFPT_PACKET_OUT
298 0.612916016 172.31.31.144 -> 172.31.24.227 OpenFlow 187 Type: OFPT_PACKET_OUT
299 0.612967255 172.31.31.144 -> 172.31.24.227 OpenFlow 187 Type: OFPT_PACKET_OUT
300 0.613023297 172.31.31.144 -> 172.31.24.227 OpenFlow 187 Type: OFPT_PACKET_OUT
301 0.613077957 172.31.31.144 -> 172.31.24.227 OpenFlow 187 Type: OFPT_PACKET_OUT
302 0.613144345 172.31.31.144 -> 172.31.24.227 OpenFlow 187 Type: OFPT_PACKET_OUT
303 0.613202491 172.31.31.144 -> 172.31.24.227 OpenFlow 187 Type: OFPT_PACKET_OUT
304 0.613249645 172.31.24.227 -> 172.31.31.144 TCP 66 59674 → 6633 [ACK] Seq=247 Ack=727 Win=213 Len=0 TSval=391761210 TSecr=2857335
305 0.613261750 172.31.31.144 -> 172.31.24.227 OpenFlow 187 Type: OFPT_PACKET_OUT
306 0.613328554 172.31.31.144 -> 172.31.24.227 OpenFlow 187 Type: OFPT_PACKET_OUT
307 0.613364546 172.31.31.144 -> 172.31.24.227 OpenFlow 187 Type: OFPT_PACKET_OUT
308 0.613372883 172.31.24.227 -> 172.31.31.144 OpenFlow 82 Type: OFPT_MULTIPART_REPLY, OFPMP_GROUP
309 0.613419470 172.31.24.227 -> 172.31.31.144 OpenFlow 98 Type: OFPT_MULTIPART_REPLY, OFPMP_METER
310 0.613443393 172.31.31.144 -> 172.31.24.227 OpenFlow 187 Type: OFPT_PACKET_OUT
311 0.613450706 172.31.24.227 -> 172.31.31.144 OpenFlow 82 Type: OFPT_MULTIPART_REPLY, OFPMP_GROUP
312 0.613494559 172.31.24.227 -> 172.31.31.144 OpenFlow 98 Type: OFPT_MULTIPART_REPLY, OFPMP_METER
313 0.613540137 172.31.31.144 -> 172.31.24.227 OpenFlow 187 Type: OFPT_PACKET_OUT
314 0.613548749 172.31.31.144 -> 172.31.24.227 OpenFlow 187 Type: OFPT_PACKET_OUT
315 0.613630408 172.31.31.144 -> 172.31.24.227 TCP 66 6633 → 59654 [ACK] Seq=65 Ack=509 Win=853 Len=0 TSval=2857335 TSecr=391761210
316 0.613638893 172.31.31.144 -> 172.31.24.227 OpenFlow 187 Type: OFPT_PACKET_OUT
317 0.613641665 172.31.31.144 -> 172.31.24.227 TCP 66 6633 → 59654 [ACK] Seq=65 Ack=541 Win=853 Len=0 TSval=2857335 TSecr=391761210
318 0.613691073 172.31.31.144 -> 172.31.24.227 TCP 66 6633 → 59656 [ACK] Seq=65 Ack=509 Win=853 Len=0 TSval=2857335 TSecr=391761210
319 0.613771350 172.31.31.144 -> 172.31.24.227 TCP 66 6633 → 59656 [ACK] Seq=65 Ack=541 Win=853 Len=0 TSval=2857335 TSecr=391761210
320 0.613865093 172.31.24.227 -> 172.31.31.144 TCP 66 59678 → 6633 [ACK] Seq=9887 Ack=1065 Win=213 Len=0 TSval=391761210 TSecr=2857335
321 0.614054613 172.31.24.227 -> 172.31.31.144 OpenFlow 189 Type: OFPT_PACKET_IN
322 0.614076632 172.31.24.227 -> 172.31.31.144 OpenFlow 435 Type: OFPT_PACKET_IN
323 0.614254628 172.31.31.144 -> 172.31.24.227 TCP 66 6633 → 59676 [ACK] Seq=969 Ack=370 Win=853 Len=0 TSval=2857336 TSecr=391761210
324 0.614293333 172.31.31.144 -> 172.31.24.227 TCP 66 6633 → 59676 [ACK] Seq=969 Ack=739 Win=853 Len=0 TSval=2857336 TSecr=391761210
325 0.614473868 172.31.24.227 -> 172.31.31.144 OpenFlow 189 Type: OFPT_PACKET_IN
326 0.614495296 172.31.24.227 -> 172.31.31.144 OpenFlow 189 Type: OFPT_PACKET_IN
327 0.614539674 172.31.24.227 -> 172.31.31.144 OpenFlow 189 Type: OFPT_PACKET_IN
328 0.614571140 172.31.24.227 -> 172.31.31.144 OpenFlow 189 Type: OFPT_PACKET_IN
329 0.614577840 172.31.24.227 -> 172.31.31.144 OpenFlow 189 Type: OFPT_PACKET_IN
330 0.614629171 172.31.24.227 -> 172.31.31.144 OpenFlow 189 Type: OFPT_PACKET_IN
331 0.614645670 172.31.24.227 -> 172.31.31.144 OpenFlow 189 Type: OFPT_PACKET_IN
332 0.614667285 172.31.24.227 -> 172.31.31.144 OpenFlow 189 Type: OFPT_PACKET_IN
333 0.614674954 172.31.31.144 -> 172.31.24.227 TCP 66 6633 → 59658 [ACK] Seq=1211 Ack=616 Win=853 Len=0 TSval=2857336 TSecr=391761210
334 0.614702595 172.31.24.227 -> 172.31.31.144 OpenFlow 189 Type: OFPT_PACKET_IN
335 0.614794972 172.31.24.227 -> 172.31.31.144 OpenFlow 189 Type: OFPT_PACKET_IN
336 0.614798993 172.31.24.227 -> 172.31.31.144 OpenFlow 189 Type: OFPT_PACKET_IN
337 0.614822787 172.31.31.144 -> 172.31.24.227 TCP 66 6633 → 59658 [ACK] Seq=1211 Ack=739 Win=853 Len=0 TSval=2857336 TSecr=391761210
338 0.614828500 172.31.31.144 -> 172.31.24.227 TCP 66 6633 → 59668 [ACK] Seq=1211 Ack=862 Win=853 Len=0 TSval=2857336 TSecr=391761210
339 0.614831211 172.31.31.144 -> 172.31.24.227 TCP 66 6633 → 59674 [ACK] Seq=727 Ack=370 Win=853 Len=0 TSval=2857336 TSecr=391761210
340 0.614927055 172.31.24.227 -> 172.31.31.144 OpenFlow 189 Type: OFPT_PACKET_IN
341 0.615000355 172.31.31.144 -> 172.31.24.227 TCP 66 6633 → 59674 [ACK] Seq=727 Ack=493 Win=853 Len=0 TSval=2857336 TSecr=391761210
342 0.615005091 172.31.31.144 -> 172.31.24.227 TCP 66 6633 → 59668 [ACK] Seq=1211 Ack=985 Win=853 Len=0 TSval=2857336 TSecr=391761210
343 0.615007520 172.31.31.144 -> 172.31.24.227 TCP 66 6633 → 59680 [ACK] Seq=97 Ack=10048 Win=853 Len=0 TSval=2857336 TSecr=391761210
344 0.615010176 172.31.31.144 -> 172.31.24.227 TCP 66 6633 → 59678 [ACK] Seq=1065 Ack=10010 Win=853 Len=0 TSval=2857336 TSecr=391761210
345 0.615047261 172.31.31.144 -> 172.31.24.227 TCP 66 6633 → 59666 [ACK] Seq=727 Ack=616 Win=853 Len=0 TSval=2857336 TSecr=391761210
346 0.615140382 172.31.31.144 -> 172.31.24.227 TCP 66 6633 → 59680 [ACK] Seq=97 Ack=10171 Win=853 Len=0 TSval=2857336 TSecr=391761210
347 0.615164863 172.31.31.144 -> 172.31.24.227 TCP 66 6633 → 59678 [ACK] Seq=1065 Ack=10133 Win=853 Len=0 TSval=2857336 TSecr=391761210
348 0.615212993 172.31.31.144 -> 172.31.24.227 TCP 66 6633 → 59666 [ACK] Seq=727 Ack=739 Win=853 Len=0 TSval=2857336 TSecr=391761211
349 0.661450975 137.158.125.247 -> 172.31.24.227 TCP 54 63468 → 22 [ACK] Seq=1 Ack=141 Win=32394 Len=0
350 0.712854320 172.31.31.144 -> 172.31.24.227 OpenFlow 90 Type: OFPT_MULTIPART_REQUEST, OFPMP_GROUP
351 0.712866047 172.31.31.144 -> 172.31.24.227 OpenFlow 90 Type: OFPT_MULTIPART_REQUEST, OFPMP_GROUP
352 0.712870375 172.31.31.144 -> 172.31.24.227 OpenFlow 106 Type: OFPT_MULTIPART_REQUEST, OFPMP_METER
353 0.712873939 172.31.31.144 -> 172.31.24.227 OpenFlow 106 Type: OFPT_MULTIPART_REQUEST, OFPMP_METER
354 0.713067564 172.31.24.227 -> 172.31.31.144 OpenFlow 82 Type: OFPT_MULTIPART_REPLY, OFPMP_GROUP
355 0.713091449 172.31.24.227 -> 172.31.31.144 OpenFlow 82 Type: OFPT_MULTIPART_REPLY, OFPMP_GROUP_DESC
356 0.713124443 172.31.24.227 -> 172.31.31.144 OpenFlow 82 Type: OFPT_MULTIPART_REPLY, OFPMP_METER
357 0.713135630 172.31.24.227 -> 172.31.31.144 OpenFlow 82 Type: OFPT_MULTIPART_REPLY, OFPMP_GROUP
358 0.713180455 172.31.24.227 -> 172.31.31.144 OpenFlow 98 Type: OFPT_MULTIPART_REPLY, OFPMP_METER
359 0.713380858 172.31.31.144 -> 172.31.24.227 TCP 66 6633 → 59660 [ACK] Seq=1033 Ack=755 Win=853 Len=0 TSval=2857360 TSecr=391761235
360 0.713388226 172.31.31.144 -> 172.31.24.227 TCP 66 6633 → 59660 [ACK] Seq=1033 Ack=771 Win=853 Len=0 TSval=2857360 TSecr=391761235
361 0.713390793 172.31.31.144 -> 172.31.24.227 TCP 66 6633 → 59660 [ACK] Seq=1033 Ack=787 Win=853 Len=0 TSval=2857360 TSecr=391761235
362 0.713393153 172.31.31.144 -> 172.31.24.227 TCP 66 6633 → 59658 [ACK] Seq=1275 Ack=755 Win=853 Len=0 TSval=2857360 TSecr=391761235
363 0.713395413 172.31.31.144 -> 172.31.24.227 TCP 66 6633 → 59658 [ACK] Seq=1275 Ack=787 Win=853 Len=0 TSval=2857360 TSecr=391761235
364 0.813038578 172.31.31.144 -> 172.31.24.227 OpenFlow 187 Type: OFPT_PACKET_OUT
365 0.813051829 172.31.31.144 -> 172.31.24.227 OpenFlow 187 Type: OFPT_PACKET_OUT
366 0.813083600 172.31.31.144 -> 172.31.24.227 OpenFlow 187 Type: OFPT_PACKET_OUT
367 0.813135821 172.31.31.144 -> 172.31.24.227 OpenFlow 187 Type: OFPT_PACKET_OUT
368 0.813197219 172.31.31.144 -> 172.31.24.227 OpenFlow 187 Type: OFPT_PACKET_OUT
369 0.813253652 172.31.31.144 -> 172.31.24.227 OpenFlow 187 Type: OFPT_PACKET_OUT
370 0.813314897 172.31.31.144 -> 172.31.24.227 OpenFlow 187 Type: OFPT_PACKET_OUT
371 0.813357025 172.31.31.144 -> 172.31.24.227 OpenFlow 187 Type: OFPT_PACKET_OUT
372 0.813426953 172.31.31.144 -> 172.31.24.227 OpenFlow 187 Type: OFPT_PACKET_OUT
373 0.813477056 172.31.31.144 -> 172.31.24.227 OpenFlow 187 Type: OFPT_PACKET_OUT
