  1 0.000000000 137.158.125.247 -> 172.31.24.227 TCP 54 63468 → 22 [ACK] Seq=1 Ack=1 Win=32464 Len=0
  2 0.071270549 137.158.125.247 -> 172.31.24.227 TCP 54 63468 → 22 [ACK] Seq=1 Ack=97 Win=32416 Len=0
  3 0.423610417 172.31.24.227 -> 137.158.125.247 SSH 98 Server: Encrypted packet (len=44)
  4 0.632527480 137.158.125.247 -> 172.31.24.227 TCP 54 63468 → 22 [ACK] Seq=1 Ack=141 Win=32394 Len=0
  5 0.753014217 137.158.125.247 -> 172.31.24.227 SSH 98 Client: Encrypted packet (len=44)
  6 0.755422806 172.31.24.227 -> 137.158.125.247 SSH 2138 Server: Encrypted packet (len=2084)
  7 0.755463407 172.31.24.227 -> 137.158.125.247 SSH 618 Server: Encrypted packet (len=564)
  8 0.914469168 137.158.125.247 -> 172.31.24.227 TCP 54 57083 → 22 [ACK] Seq=45 Ack=2085 Win=32768 Len=0
  9 0.927506110 172.31.24.227 -> 137.158.125.247 SSH 98 Server: Encrypted packet (len=44)
 10 0.964524738 137.158.125.247 -> 172.31.24.227 TCP 54 57083 → 22 [ACK] Seq=45 Ack=2649 Win=32486 Len=0
 11 1.137150851 137.158.125.247 -> 172.31.24.227 TCP 54 63468 → 22 [ACK] Seq=1 Ack=185 Win=32372 Len=0
 12 1.431518358 172.31.24.227 -> 137.158.125.247 SSH 98 Server: Encrypted packet (len=44)
 13 1.583166235 172.31.31.144 -> 172.31.24.227 TCP 90 6633 → 53158 [PSH, ACK] Seq=1 Ack=1 Win=853 Len=24 TSval=1815150 TSecr=388707448
 14 1.583195249 172.31.31.144 -> 172.31.24.227 TCP 90 6633 → 53154 [PSH, ACK] Seq=1 Ack=1 Win=853 Len=24 TSval=1815150 TSecr=388707448
 15 1.583199890 172.31.31.144 -> 172.31.24.227 TCP 138 6633 → 53154 [PSH, ACK] Seq=25 Ack=1 Win=853 Len=72 TSval=1815150 TSecr=388707448
 16 1.583214923 172.31.31.144 -> 172.31.24.227 TCP 138 6633 → 53158 [PSH, ACK] Seq=25 Ack=1 Win=853 Len=72 TSval=1815150 TSecr=388707448
 17 1.583517664 172.31.24.227 -> 172.31.31.144 OpenFlow 530 Type: OFPT_MULTIPART_REPLY, OFPMP_PORT_STATS
 18 1.583594731 172.31.24.227 -> 172.31.31.144 OpenFlow 554 Type: OFPT_MULTIPART_REPLY, OFPMP_FLOW
 19 1.583763395 172.31.24.227 -> 172.31.31.144 OpenFlow 6178 Type: OFPT_MULTIPART_REPLY, OFPMP_TABLE
 20 1.583796059 172.31.31.144 -> 172.31.24.227 TCP 66 6633 → 53154 [ACK] Seq=97 Ack=465 Win=853 Len=0 TSval=1815151 TSecr=388708006
 21 1.583806153 172.31.31.144 -> 172.31.24.227 TCP 66 6633 → 53154 [ACK] Seq=97 Ack=953 Win=853 Len=0 TSval=1815151 TSecr=388708006
 22 1.583899482 172.31.24.227 -> 172.31.31.144 OpenFlow 642 Type: OFPT_MULTIPART_REPLY, OFPMP_PORT_STATS
 23 1.583969167 172.31.24.227 -> 172.31.31.144 OpenFlow 2010 Type: OFPT_MULTIPART_REPLY, OFPMP_FLOW
 24 1.584041600 172.31.31.144 -> 172.31.24.227 TCP 66 6633 → 53154 [ACK] Seq=97 Ack=7065 Win=853 Len=0 TSval=1815151 TSecr=388708006
 25 1.584108559 172.31.31.144 -> 172.31.24.227 TCP 66 6633 → 53158 [ACK] Seq=97 Ack=577 Win=853 Len=0 TSval=1815151 TSecr=388708006
 26 1.584131945 172.31.24.227 -> 172.31.31.144 OpenFlow 6178 Type: OFPT_MULTIPART_REPLY, OFPMP_TABLE
 27 1.584177213 172.31.31.144 -> 172.31.24.227 TCP 66 6633 → 53158 [ACK] Seq=97 Ack=2521 Win=853 Len=0 TSval=1815151 TSecr=388708006
 28 1.584410380 172.31.31.144 -> 172.31.24.227 TCP 66 6633 → 53158 [ACK] Seq=97 Ack=8633 Win=853 Len=0 TSval=1815151 TSecr=388708006
 29 1.586141254 172.31.31.144 -> 172.31.24.227 TCP 90 6633 → 53170 [PSH, ACK] Seq=1 Ack=1 Win=853 Len=24 TSval=1815151 TSecr=388707447
 30 1.586154948 172.31.31.144 -> 172.31.24.227 TCP 90 6633 → 53156 [PSH, ACK] Seq=1 Ack=1 Win=853 Len=24 TSval=1815151 TSecr=388707448
 31 1.586158568 172.31.31.144 -> 172.31.24.227 TCP 122 6633 → 53156 [PSH, ACK] Seq=25 Ack=1 Win=853 Len=56 TSval=1815151 TSecr=388707448
 32 1.586332392 172.31.24.227 -> 172.31.31.144 OpenFlow 642 Type: OFPT_MULTIPART_REPLY, OFPMP_PORT_STATS
 33 1.586412136 172.31.24.227 -> 172.31.31.144 OpenFlow 2218 Type: OFPT_MULTIPART_REPLY, OFPMP_FLOW
 34 1.586537129 172.31.24.227 -> 172.31.31.144 OpenFlow 530 Type: OFPT_MULTIPART_REPLY, OFPMP_PORT_STATS
 35 1.586553956 172.31.31.144 -> 172.31.24.227 TCP 66 6633 → 53156 [ACK] Seq=81 Ack=577 Win=853 Len=0 TSval=1815151 TSecr=388708007
 36 1.586618727 172.31.31.144 -> 172.31.24.227 TCP 66 6633 → 53156 [ACK] Seq=81 Ack=2729 Win=853 Len=0 TSval=1815151 TSecr=388708007
 37 1.587383320 172.31.31.144 -> 172.31.24.227 TCP 122 6633 → 53152 [PSH, ACK] Seq=1 Ack=1 Win=853 Len=56 TSval=1815151 TSecr=388707448
 38 1.587393217 172.31.31.144 -> 172.31.24.227 TCP 106 6633 → 53152 [PSH, ACK] Seq=57 Ack=1 Win=853 Len=40 TSval=1815151 TSecr=388707448
 39 1.587396417 172.31.31.144 -> 172.31.24.227 TCP 122 6633 → 53190 [PSH, ACK] Seq=1 Ack=1 Win=853 Len=56 TSval=1815151 TSecr=388707448
 40 1.587399970 172.31.31.144 -> 172.31.24.227 TCP 106 6633 → 53190 [PSH, ACK] Seq=57 Ack=1 Win=853 Len=40 TSval=1815151 TSecr=388707448
 41 1.587402199 172.31.31.144 -> 172.31.24.227 OpenFlow 122 Type: OFPT_MULTIPART_REQUEST, OFPMP_FLOW
 42 1.587405398 172.31.31.144 -> 172.31.24.227 OpenFlow 82 Type: OFPT_MULTIPART_REQUEST, OFPMP_TABLE
 43 1.587407398 172.31.31.144 -> 172.31.24.227 OpenFlow 82 Type: OFPT_MULTIPART_REQUEST, OFPMP_TABLE
 44 1.587544630 172.31.24.227 -> 172.31.31.144 OpenFlow 2634 Type: OFPT_MULTIPART_REPLY, OFPMP_FLOW
 45 1.587690654 172.31.24.227 -> 172.31.31.144 OpenFlow 6178 Type: OFPT_MULTIPART_REPLY, OFPMP_TABLE
 46 1.587768101 172.31.31.144 -> 172.31.24.227 TCP 66 6633 → 53152 [ACK] Seq=97 Ack=2569 Win=853 Len=0 TSval=1815152 TSecr=388708007
 47 1.587805010 172.31.24.227 -> 172.31.31.144 OpenFlow 642 Type: OFPT_MULTIPART_REPLY, OFPMP_PORT_STATS
 48 1.587956156 172.31.31.144 -> 172.31.24.227 TCP 66 6633 → 53152 [ACK] Seq=97 Ack=8681 Win=853 Len=0 TSval=1815152 TSecr=388708007
 49 1.587975695 172.31.24.227 -> 172.31.31.144 OpenFlow 6178 Type: OFPT_MULTIPART_REPLY, OFPMP_TABLE
 50 1.588019200 172.31.31.144 -> 172.31.24.227 TCP 66 6633 → 53152 [ACK] Seq=97 Ack=9257 Win=853 Len=0 TSval=1815152 TSecr=388708007
 51 1.588107241 172.31.24.227 -> 172.31.31.144 OpenFlow 2842 Type: OFPT_MULTIPART_REPLY, OFPMP_FLOW
 52 1.588246752 172.31.24.227 -> 172.31.31.144 OpenFlow 6178 Type: OFPT_MULTIPART_REPLY, OFPMP_TABLE
 53 1.588388171 172.31.24.227 -> 172.31.31.144 OpenFlow 2842 Type: OFPT_MULTIPART_REPLY, OFPMP_FLOW
 54 1.588527552 172.31.24.227 -> 172.31.31.144 OpenFlow 6178 Type: OFPT_MULTIPART_REPLY, OFPMP_TABLE
 55 1.588548427 172.31.31.144 -> 172.31.24.227 TCP 66 6633 → 53170 [ACK] Seq=97 Ack=9353 Win=853 Len=0 TSval=1815152 TSecr=388708007
 56 1.588624409 172.31.31.144 -> 172.31.24.227 TCP 66 6633 → 53190 [ACK] Seq=97 Ack=2777 Win=853 Len=0 TSval=1815152 TSecr=388708007
 57 1.588666811 172.31.24.227 -> 172.31.31.144 OpenFlow 642 Type: OFPT_MULTIPART_REPLY, OFPMP_PORT_STATS
 58 1.588866203 172.31.31.144 -> 172.31.24.227 TCP 66 6633 → 53190 [ACK] Seq=97 Ack=8889 Win=853 Len=0 TSval=1815152 TSecr=388708007
 59 1.588943336 172.31.31.144 -> 172.31.24.227 TCP 66 6633 → 53190 [ACK] Seq=97 Ack=9465 Win=853 Len=0 TSval=1815152 TSecr=388708007
 60 1.599452100 172.31.31.144 -> 172.31.24.227 TCP 82 6633 → 53164 [PSH, ACK] Seq=1 Ack=1 Win=853 Len=16 TSval=1815154 TSecr=388707448
 61 1.599462431 172.31.31.144 -> 172.31.24.227 TCP 146 6633 → 53164 [PSH, ACK] Seq=17 Ack=1 Win=853 Len=80 TSval=1815154 TSecr=388707448
 62 1.599699872 172.31.24.227 -> 172.31.31.144 OpenFlow 6178 Type: OFPT_MULTIPART_REPLY, OFPMP_TABLE
 63 1.599805072 172.31.24.227 -> 172.31.31.144 OpenFlow 2842 Type: OFPT_MULTIPART_REPLY, OFPMP_FLOW
 64 1.599918953 172.31.24.227 -> 172.31.31.144 OpenFlow 754 Type: OFPT_MULTIPART_REPLY, OFPMP_PORT_STATS
 65 1.600087177 172.31.31.144 -> 172.31.24.227 TCP 66 6633 → 53164 [ACK] Seq=97 Ack=8889 Win=853 Len=0 TSval=1815155 TSecr=388708010
 66 1.600578647 172.31.31.144 -> 172.31.24.227 TCP 122 6633 → 53162 [PSH, ACK] Seq=1 Ack=1 Win=853 Len=56 TSval=1815155 TSecr=388707448
 67 1.600585559 172.31.31.144 -> 172.31.24.227 TCP 106 6633 → 53162 [PSH, ACK] Seq=57 Ack=1 Win=853 Len=40 TSval=1815155 TSecr=388707448
 68 1.600725998 172.31.24.227 -> 172.31.31.144 OpenFlow 2842 Type: OFPT_MULTIPART_REPLY, OFPMP_FLOW
 69 1.600867308 172.31.24.227 -> 172.31.31.144 OpenFlow 6178 Type: OFPT_MULTIPART_REPLY, OFPMP_TABLE
 70 1.600954509 172.31.31.144 -> 172.31.24.227 TCP 66 6633 → 53162 [ACK] Seq=97 Ack=2777 Win=853 Len=0 TSval=1815155 TSecr=388708010
 71 1.601037157 172.31.24.227 -> 172.31.31.144 OpenFlow 754 Type: OFPT_MULTIPART_REPLY, OFPMP_PORT_STATS
 72 1.601119269 172.31.31.144 -> 172.31.24.227 TCP 66 6633 → 53162 [ACK] Seq=97 Ack=8889 Win=853 Len=0 TSval=1815155 TSecr=388708010
 73 1.601232044 172.31.31.144 -> 172.31.24.227 TCP 66 6633 → 53162 [ACK] Seq=97 Ack=9577 Win=853 Len=0 TSval=1815155 TSecr=388708011
 74 1.602722895 172.31.31.144 -> 172.31.24.227 TCP 90 6633 → 53166 [PSH, ACK] Seq=1 Ack=1 Win=853 Len=24 TSval=1815155 TSecr=388707529
 75 1.602728823 172.31.31.144 -> 172.31.24.227 TCP 138 6633 → 53166 [PSH, ACK] Seq=25 Ack=1 Win=853 Len=72 TSval=1815155 TSecr=388707529
 76 1.602913607 172.31.24.227 -> 172.31.31.144 OpenFlow 754 Type: OFPT_MULTIPART_REPLY, OFPMP_PORT_STATS
 77 1.603059066 172.31.24.227 -> 172.31.31.144 OpenFlow 6178 Type: OFPT_MULTIPART_REPLY, OFPMP_TABLE
 78 1.603134704 172.31.24.227 -> 172.31.31.144 OpenFlow 1802 Type: OFPT_MULTIPART_REPLY, OFPMP_FLOW
 79 1.603313796 172.31.31.144 -> 172.31.24.227 TCP 66 6633 → 53166 [ACK] Seq=97 Ack=6801 Win=853 Len=0 TSval=1815155 TSecr=388708011
 80 1.615951848 172.31.31.144 -> 172.31.24.227 TCP 122 6633 → 53160 [PSH, ACK] Seq=1 Ack=1 Win=853 Len=56 TSval=1815159 TSecr=388707448
 81 1.615962488 172.31.31.144 -> 172.31.24.227 TCP 90 6633 → 53160 [PSH, ACK] Seq=57 Ack=1 Win=853 Len=24 TSval=1815159 TSecr=388707448
 82 1.616105308 172.31.24.227 -> 172.31.31.144 OpenFlow 2634 Type: OFPT_MULTIPART_REPLY, OFPMP_FLOW
 83 1.616214959 172.31.24.227 -> 172.31.31.144 OpenFlow 754 Type: OFPT_MULTIPART_REPLY, OFPMP_PORT_STATS
 84 1.616423030 172.31.31.144 -> 172.31.24.227 TCP 66 6633 → 53160 [ACK] Seq=81 Ack=3257 Win=853 Len=0 TSval=1815159 TSecr=388708014
 85 1.617074442 172.31.31.144 -> 172.31.24.227 TCP 82 6633 → 53182 [PSH, ACK] Seq=1 Ack=1 Win=853 Len=16 TSval=1815159 TSecr=388707448
 86 1.617082981 172.31.31.144 -> 172.31.24.227 TCP 90 6633 → 53188 [PSH, ACK] Seq=1 Ack=1 Win=853 Len=24 TSval=1815159 TSecr=388707448
 87 1.617086336 172.31.31.144 -> 172.31.24.227 TCP 146 6633 → 53182 [PSH, ACK] Seq=17 Ack=1 Win=853 Len=80 TSval=1815159 TSecr=388707448
 88 1.617089159 172.31.31.144 -> 172.31.24.227 TCP 122 6633 → 53188 [PSH, ACK] Seq=25 Ack=1 Win=853 Len=56 TSval=1815159 TSecr=388707448
 89 1.617091281 172.31.31.144 -> 172.31.24.227 TCP 122 6633 → 53178 [PSH, ACK] Seq=1 Ack=1 Win=853 Len=56 TSval=1815159 TSecr=388707526
 90 1.617157398 172.31.31.144 -> 172.31.24.227 TCP 90 6633 → 53178 [PSH, ACK] Seq=57 Ack=1 Win=853 Len=24 TSval=1815159 TSecr=388707526
 91 1.617279532 172.31.24.227 -> 172.31.31.144 OpenFlow 1178 Type: OFPT_MULTIPART_REPLY, OFPMP_FLOW
 92 1.617388819 172.31.24.227 -> 172.31.31.144 OpenFlow 754 Type: OFPT_MULTIPART_REPLY, OFPMP_PORT_STATS
 93 1.617549535 172.31.24.227 -> 172.31.31.144 OpenFlow 6178 Type: OFPT_MULTIPART_REPLY, OFPMP_TABLE
 94 1.617643801 172.31.24.227 -> 172.31.31.144 OpenFlow 530 Type: OFPT_MULTIPART_REPLY, OFPMP_PORT_STATS
 95 1.617705048 172.31.24.227 -> 172.31.31.144 OpenFlow 2010 Type: OFPT_MULTIPART_REPLY, OFPMP_FLOW
 96 1.617800888 172.31.24.227 -> 172.31.31.144 OpenFlow 530 Type: OFPT_MULTIPART_REPLY, OFPMP_PORT_STATS
 97 1.617874418 172.31.31.144 -> 172.31.24.227 TCP 66 6633 → 53182 [ACK] Seq=97 Ack=6113 Win=853 Len=0 TSval=1815159 TSecr=388708015
 98 1.617880775 172.31.31.144 -> 172.31.24.227 TCP 66 6633 → 53182 [ACK] Seq=97 Ack=6577 Win=853 Len=0 TSval=1815159 TSecr=388708015
 99 1.617894545 172.31.24.227 -> 172.31.31.144 OpenFlow 2010 Type: OFPT_MULTIPART_REPLY, OFPMP_FLOW
100 1.617963246 172.31.31.144 -> 172.31.24.227 TCP 66 6633 → 53182 [ACK] Seq=97 Ack=8521 Win=853 Len=0 TSval=1815159 TSecr=388708015
101 1.618175774 172.31.31.144 -> 172.31.24.227 TCP 66 6633 → 53178 [ACK] Seq=81 Ack=1801 Win=853 Len=0 TSval=1815159 TSecr=388708015
102 1.618182420 172.31.31.144 -> 172.31.24.227 TCP 66 6633 → 53188 [ACK] Seq=81 Ack=2409 Win=853 Len=0 TSval=1815159 TSecr=388708015
103 1.619744456 172.31.31.144 -> 172.31.24.227 TCP 90 6633 → 53174 [PSH, ACK] Seq=1 Ack=1 Win=853 Len=24 TSval=1815160 TSecr=388707448
104 1.619751363 172.31.31.144 -> 172.31.24.227 TCP 138 6633 → 53174 [PSH, ACK] Seq=25 Ack=1 Win=853 Len=72 TSval=1815160 TSecr=388707448
105 1.619922902 172.31.24.227 -> 172.31.31.144 OpenFlow 530 Type: OFPT_MULTIPART_REPLY, OFPMP_PORT_STATS
106 1.620063061 172.31.24.227 -> 172.31.31.144 OpenFlow 6178 Type: OFPT_MULTIPART_REPLY, OFPMP_TABLE
107 1.620110087 172.31.24.227 -> 172.31.31.144 OpenFlow 970 Type: OFPT_MULTIPART_REPLY, OFPMP_FLOW
108 1.620307756 172.31.31.144 -> 172.31.24.227 TCP 66 6633 → 53174 [ACK] Seq=97 Ack=6577 Win=853 Len=0 TSval=1815160 TSecr=388708015
109 1.622347744 172.31.31.144 -> 172.31.24.227 OpenFlow 82 Type: OFPT_MULTIPART_REQUEST, OFPMP_TABLE
110 1.622353859 172.31.31.144 -> 172.31.24.227 OpenFlow 82 Type: OFPT_MULTIPART_REQUEST, OFPMP_TABLE
111 1.622356133 172.31.31.144 -> 172.31.24.227 OpenFlow 82 Type: OFPT_MULTIPART_REQUEST, OFPMP_TABLE
112 1.622546074 172.31.24.227 -> 172.31.31.144 OpenFlow 6178 Type: OFPT_MULTIPART_REPLY, OFPMP_TABLE
113 1.622728177 172.31.24.227 -> 172.31.31.144 OpenFlow 6178 Type: OFPT_MULTIPART_REPLY, OFPMP_TABLE
114 1.622889913 172.31.24.227 -> 172.31.31.144 OpenFlow 6178 Type: OFPT_MULTIPART_REPLY, OFPMP_TABLE
115 1.627493081 172.31.31.144 -> 172.31.24.227 TCP 66 6633 → 53156 [ACK] Seq=97 Ack=8841 Win=853 Len=0 TSval=1815162 TSecr=388708007
116 1.630455894 172.31.31.144 -> 172.31.24.227 TCP 82 6633 → 53198 [PSH, ACK] Seq=1 Ack=1 Win=853 Len=16 TSval=1815162 TSecr=388707448
117 1.630465796 172.31.31.144 -> 172.31.24.227 TCP 146 6633 → 53198 [PSH, ACK] Seq=17 Ack=1 Win=853 Len=80 TSval=1815162 TSecr=388707448
118 1.630763392 172.31.24.227 -> 172.31.31.144 OpenFlow 6178 Type: OFPT_MULTIPART_REPLY, OFPMP_TABLE
119 1.630806387 172.31.24.227 -> 172.31.31.144 OpenFlow 346 Type: OFPT_MULTIPART_REPLY, OFPMP_FLOW
120 1.630886035 172.31.24.227 -> 172.31.31.144 OpenFlow 530 Type: OFPT_MULTIPART_REPLY, OFPMP_PORT_STATS
121 1.631099364 172.31.31.144 -> 172.31.24.227 TCP 66 6633 → 53198 [ACK] Seq=97 Ack=6113 Win=853 Len=0 TSval=1815162 TSecr=388708018
122 1.631107229 172.31.31.144 -> 172.31.24.227 TCP 66 6633 → 53198 [ACK] Seq=97 Ack=6393 Win=853 Len=0 TSval=1815162 TSecr=388708018
123 1.631109821 172.31.31.144 -> 172.31.24.227 TCP 66 6633 → 53198 [ACK] Seq=97 Ack=6857 Win=853 Len=0 TSval=1815162 TSecr=388708018
124 1.632586897 172.31.31.144 -> 172.31.24.227 TCP 90 6633 → 53180 [PSH, ACK] Seq=1 Ack=1 Win=853 Len=24 TSval=1815163 TSecr=388707448
125 1.632593961 172.31.31.144 -> 172.31.24.227 TCP 138 6633 → 53180 [PSH, ACK] Seq=25 Ack=1 Win=853 Len=72 TSval=1815163 TSecr=388707448
126 1.632785587 172.31.24.227 -> 172.31.31.144 OpenFlow 642 Type: OFPT_MULTIPART_REPLY, OFPMP_PORT_STATS
127 1.632840670 172.31.24.227 -> 172.31.31.144 OpenFlow 1178 Type: OFPT_MULTIPART_REPLY, OFPMP_FLOW
128 1.632995049 172.31.31.144 -> 172.31.24.227 TCP 66 6633 → 53180 [ACK] Seq=97 Ack=577 Win=853 Len=0 TSval=1815163 TSecr=388708018
129 1.633023075 172.31.24.227 -> 172.31.31.144 OpenFlow 6178 Type: OFPT_MULTIPART_REPLY, OFPMP_TABLE
130 1.633065058 172.31.31.144 -> 172.31.24.227 TCP 66 6633 → 53180 [ACK] Seq=97 Ack=1689 Win=853 Len=0 TSval=1815163 TSecr=388708018
131 1.633304775 172.31.31.144 -> 172.31.24.227 TCP 66 6633 → 53180 [ACK] Seq=97 Ack=7801 Win=853 Len=0 TSval=1815163 TSecr=388708019
132 1.634734617 172.31.31.144 -> 172.31.24.227 TCP 122 6633 → 53196 [PSH, ACK] Seq=1 Ack=1 Win=853 Len=56 TSval=1815163 TSecr=388707448
133 1.634740929 172.31.31.144 -> 172.31.24.227 TCP 106 6633 → 53196 [PSH, ACK] Seq=57 Ack=1 Win=853 Len=40 TSval=1815163 TSecr=388707448
134 1.634931344 172.31.24.227 -> 172.31.31.144 OpenFlow 1594 Type: OFPT_MULTIPART_REPLY, OFPMP_FLOW
135 1.635071867 172.31.24.227 -> 172.31.31.144 OpenFlow 6178 Type: OFPT_MULTIPART_REPLY, OFPMP_TABLE
136 1.635180002 172.31.24.227 -> 172.31.31.144 OpenFlow 754 Type: OFPT_MULTIPART_REPLY, OFPMP_PORT_STATS
137 1.635332992 172.31.31.144 -> 172.31.24.227 TCP 66 6633 → 53196 [ACK] Seq=97 Ack=7641 Win=853 Len=0 TSval=1815163 TSecr=388708019
138 1.635922204 172.31.31.144 -> 172.31.24.227 TCP 82 6633 → 53168 [PSH, ACK] Seq=1 Ack=1 Win=853 Len=16 TSval=1815164 TSecr=388707448
139 1.635928874 172.31.31.144 -> 172.31.24.227 TCP 146 6633 → 53168 [PSH, ACK] Seq=17 Ack=1 Win=853 Len=80 TSval=1815164 TSecr=388707448
140 1.636139836 172.31.24.227 -> 172.31.31.144 OpenFlow 6178 Type: OFPT_MULTIPART_REPLY, OFPMP_TABLE
141 1.636194714 172.31.24.227 -> 172.31.31.144 OpenFlow 1386 Type: OFPT_MULTIPART_REPLY, OFPMP_FLOW
142 1.636286870 172.31.24.227 -> 172.31.31.144 OpenFlow 642 Type: OFPT_MULTIPART_REPLY, OFPMP_PORT_STATS
143 1.636387350 172.31.31.144 -> 172.31.24.227 TCP 66 6633 → 53168 [ACK] Seq=97 Ack=7433 Win=853 Len=0 TSval=1815164 TSecr=388708019
144 1.637060070 172.31.31.144 -> 172.31.24.227 TCP 82 6633 → 53186 [PSH, ACK] Seq=1 Ack=1 Win=853 Len=16 TSval=1815164 TSecr=388707448
145 1.637068790 172.31.31.144 -> 172.31.24.227 TCP 146 6633 → 53186 [PSH, ACK] Seq=17 Ack=1 Win=853 Len=80 TSval=1815164 TSecr=388707448
146 1.637071895 172.31.31.144 -> 172.31.24.227 TCP 82 6633 → 53194 [PSH, ACK] Seq=1 Ack=1 Win=853 Len=16 TSval=1815164 TSecr=388707448
147 1.637075326 172.31.31.144 -> 172.31.24.227 TCP 146 6633 → 53194 [PSH, ACK] Seq=17 Ack=1 Win=853 Len=80 TSval=1815164 TSecr=388707448
148 1.637348017 172.31.24.227 -> 172.31.31.144 OpenFlow 6178 Type: OFPT_MULTIPART_REPLY, OFPMP_TABLE
149 1.637419425 172.31.24.227 -> 172.31.31.144 OpenFlow 2218 Type: OFPT_MULTIPART_REPLY, OFPMP_FLOW
150 1.637513108 172.31.24.227 -> 172.31.31.144 OpenFlow 642 Type: OFPT_MULTIPART_REPLY, OFPMP_PORT_STATS
151 1.637588995 172.31.31.144 -> 172.31.24.227 TCP 66 6633 → 53186 [ACK] Seq=97 Ack=6113 Win=853 Len=0 TSval=1815164 TSecr=388708020
152 1.637661428 172.31.31.144 -> 172.31.24.227 TCP 66 6633 → 53186 [ACK] Seq=97 Ack=8265 Win=853 Len=0 TSval=1815164 TSecr=388708020
153 1.637710266 172.31.24.227 -> 172.31.31.144 OpenFlow 6178 Type: OFPT_MULTIPART_REPLY, OFPMP_TABLE
154 1.637735576 172.31.31.144 -> 172.31.24.227 TCP 66 6633 → 53186 [ACK] Seq=97 Ack=8841 Win=853 Len=0 TSval=1815164 TSecr=388708020
155 1.637799403 172.31.24.227 -> 172.31.31.144 OpenFlow 530 Type: OFPT_MULTIPART_REPLY, OFPMP_PORT_STATS
156 1.637837964 172.31.24.227 -> 172.31.31.144 OpenFlow 346 Type: OFPT_MULTIPART_REPLY, OFPMP_FLOW
157 1.638055053 172.31.31.144 -> 172.31.24.227 TCP 66 6633 → 53194 [ACK] Seq=97 Ack=6113 Win=853 Len=0 TSval=1815164 TSecr=388708020
158 1.638062625 172.31.31.144 -> 172.31.24.227 TCP 66 6633 → 53194 [ACK] Seq=97 Ack=6577 Win=853 Len=0 TSval=1815164 TSecr=388708020
159 1.638065113 172.31.31.144 -> 172.31.24.227 TCP 66 6633 → 53194 [ACK] Seq=97 Ack=6857 Win=853 Len=0 TSval=1815164 TSecr=388708020
160 1.639152852 172.31.31.144 -> 172.31.24.227 TCP 82 6633 → 53192 [PSH, ACK] Seq=1 Ack=1 Win=853 Len=16 TSval=1815164 TSecr=388707448
161 1.639159343 172.31.31.144 -> 172.31.24.227 TCP 146 6633 → 53192 [PSH, ACK] Seq=17 Ack=1 Win=853 Len=80 TSval=1815164 TSecr=388707448
162 1.639445268 172.31.24.227 -> 172.31.31.144 OpenFlow 6178 Type: OFPT_MULTIPART_REPLY, OFPMP_TABLE
163 1.639480570 172.31.31.144 -> 172.31.24.227 TCP 66 6633 → 53166 [ACK] Seq=97 Ack=8537 Win=853 Len=0 TSval=1815165 TSecr=388708011
164 1.639486625 172.31.31.144 -> 172.31.24.227 TCP 66 6633 → 53164 [ACK] Seq=97 Ack=9577 Win=853 Len=0 TSval=1815165 TSecr=388708010
165 1.639506920 172.31.24.227 -> 172.31.31.144 OpenFlow 762 Type: OFPT_MULTIPART_REPLY, OFPMP_FLOW
166 1.639584020 172.31.24.227 -> 172.31.31.144 OpenFlow 530 Type: OFPT_MULTIPART_REPLY, OFPMP_PORT_STATS
167 1.639731065 172.31.31.144 -> 172.31.24.227 TCP 66 6633 → 53192 [ACK] Seq=97 Ack=6113 Win=853 Len=0 TSval=1815165 TSecr=388708020
168 1.639738473 172.31.31.144 -> 172.31.24.227 TCP 66 6633 → 53192 [ACK] Seq=97 Ack=6809 Win=853 Len=0 TSval=1815165 TSecr=388708020
169 1.639779502 172.31.31.144 -> 172.31.24.227 TCP 66 6633 → 53192 [ACK] Seq=97 Ack=7273 Win=853 Len=0 TSval=1815165 TSecr=388708020
170 1.641300865 172.31.31.144 -> 172.31.24.227 TCP 82 6633 → 53172 [PSH, ACK] Seq=1 Ack=1 Win=853 Len=16 TSval=1815165 TSecr=388707448
171 1.641309615 172.31.31.144 -> 172.31.24.227 TCP 146 6633 → 53172 [PSH, ACK] Seq=17 Ack=1 Win=853 Len=80 TSval=1815165 TSecr=388707448
172 1.641553051 172.31.24.227 -> 172.31.31.144 OpenFlow 6178 Type: OFPT_MULTIPART_REPLY, OFPMP_TABLE
173 1.641617404 172.31.24.227 -> 172.31.31.144 OpenFlow 2010 Type: OFPT_MULTIPART_REPLY, OFPMP_FLOW
174 1.641719663 172.31.24.227 -> 172.31.31.144 OpenFlow 754 Type: OFPT_MULTIPART_REPLY, OFPMP_PORT_STATS
175 1.641857411 172.31.31.144 -> 172.31.24.227 TCP 66 6633 → 53172 [ACK] Seq=97 Ack=8057 Win=853 Len=0 TSval=1815165 TSecr=388708021
176 1.642437066 172.31.31.144 -> 172.31.24.227 TCP 122 6633 → 53184 [PSH, ACK] Seq=1 Ack=1 Win=853 Len=56 TSval=1815165 TSecr=388707448
177 1.642443555 172.31.31.144 -> 172.31.24.227 TCP 90 6633 → 53184 [PSH, ACK] Seq=57 Ack=1 Win=853 Len=24 TSval=1815165 TSecr=388707448
178 1.642625206 172.31.24.227 -> 172.31.31.144 OpenFlow 3050 Type: OFPT_MULTIPART_REPLY, OFPMP_FLOW
179 1.642717206 172.31.24.227 -> 172.31.31.144 OpenFlow 642 Type: OFPT_MULTIPART_REPLY, OFPMP_PORT_STATS
180 1.642865434 172.31.31.144 -> 172.31.24.227 TCP 66 6633 → 53184 [ACK] Seq=81 Ack=2985 Win=853 Len=0 TSval=1815165 TSecr=388708021
181 1.642946974 172.31.31.144 -> 172.31.24.227 TCP 66 6633 → 53184 [ACK] Seq=81 Ack=3561 Win=853 Len=0 TSval=1815165 TSecr=388708021
182 1.642950421 137.158.125.247 -> 172.31.24.227 TCP 54 63468 → 22 [ACK] Seq=1 Ack=229 Win=32350 Len=0
183 1.643555004 172.31.31.144 -> 172.31.24.227 OpenFlow 82 Type: OFPT_MULTIPART_REQUEST, OFPMP_TABLE
184 1.643811107 172.31.24.227 -> 172.31.31.144 OpenFlow 6178 Type: OFPT_MULTIPART_REPLY, OFPMP_TABLE
185 1.649735479 172.31.31.144 -> 172.31.24.227 TCP 82 6633 → 53176 [PSH, ACK] Seq=1 Ack=1 Win=853 Len=16 TSval=1815167 TSecr=388707473
186 1.649745969 172.31.31.144 -> 172.31.24.227 TCP 146 6633 → 53176 [PSH, ACK] Seq=17 Ack=1 Win=853 Len=80 TSval=1815167 TSecr=388707473
187 1.650015560 172.31.24.227 -> 172.31.31.144 OpenFlow 6178 Type: OFPT_MULTIPART_REPLY, OFPMP_TABLE
188 1.650118769 172.31.24.227 -> 172.31.31.144 OpenFlow 642 Type: OFPT_MULTIPART_REPLY, OFPMP_PORT_STATS
189 1.650196736 172.31.24.227 -> 172.31.31.144 OpenFlow 2634 Type: OFPT_MULTIPART_REPLY, OFPMP_FLOW
190 1.650294145 172.31.31.144 -> 172.31.24.227 TCP 66 6633 → 53176 [ACK] Seq=97 Ack=6113 Win=853 Len=0 TSval=1815167 TSecr=388708023
191 1.650301104 172.31.31.144 -> 172.31.24.227 TCP 66 6633 → 53176 [ACK] Seq=97 Ack=6689 Win=853 Len=0 TSval=1815167 TSecr=388708023
192 1.650419095 172.31.31.144 -> 172.31.24.227 TCP 66 6633 → 53176 [ACK] Seq=97 Ack=9257 Win=853 Len=0 TSval=1815167 TSecr=388708023
193 1.659609670 172.31.31.144 -> 172.31.24.227 TCP 66 6633 → 53160 [ACK] Seq=97 Ack=9369 Win=853 Len=0 TSval=1815170 TSecr=388708016
194 1.659616859 172.31.31.144 -> 172.31.24.227 TCP 66 6633 → 53188 [ACK] Seq=97 Ack=8521 Win=853 Len=0 TSval=1815170 TSecr=388708016
195 1.659619705 172.31.31.144 -> 172.31.24.227 TCP 66 6633 → 53174 [ACK] Seq=97 Ack=7481 Win=853 Len=0 TSval=1815170 TSecr=388708015
196 1.659622229 172.31.31.144 -> 172.31.24.227 TCP 66 6633 → 53178 [ACK] Seq=97 Ack=7913 Win=853 Len=0 TSval=1815170 TSecr=388708016
197 1.671477287 172.31.31.144 -> 172.31.24.227 TCP 66 6633 → 53196 [ACK] Seq=97 Ack=8329 Win=853 Len=0 TSval=1815173 TSecr=388708019
198 1.675542067 172.31.31.144 -> 172.31.24.227 TCP 66 6633 → 53168 [ACK] Seq=97 Ack=8009 Win=853 Len=0 TSval=1815174 TSecr=388708019
199 1.679567933 172.31.31.144 -> 172.31.24.227 TCP 66 6633 → 53172 [ACK] Seq=97 Ack=8745 Win=853 Len=0 TSval=1815175 TSecr=388708021
200 1.683469516 172.31.31.144 -> 172.31.24.227 TCP 66 6633 → 53184 [ACK] Seq=97 Ack=9673 Win=853 Len=0 TSval=1815176 TSecr=388708021
201 1.848232748 172.31.31.144 -> 172.31.24.227 OpenFlow 187 Type: OFPT_PACKET_OUT
202 1.848286298 172.31.31.144 -> 172.31.24.227 OpenFlow 187 Type: OFPT_PACKET_OUT
203 1.848353801 172.31.31.144 -> 172.31.24.227 OpenFlow 187 Type: OFPT_PACKET_OUT
204 1.848392909 172.31.31.144 -> 172.31.24.227 OpenFlow 187 Type: OFPT_PACKET_OUT
205 1.848462288 172.31.31.144 -> 172.31.24.227 OpenFlow 187 Type: OFPT_PACKET_OUT
206 1.848518345 172.31.31.144 -> 172.31.24.227 OpenFlow 187 Type: OFPT_PACKET_OUT
207 1.848577152 172.31.31.144 -> 172.31.24.227 OpenFlow 187 Type: OFPT_PACKET_OUT
208 1.848631381 172.31.31.144 -> 172.31.24.227 OpenFlow 187 Type: OFPT_PACKET_OUT
209 1.848727414 172.31.31.144 -> 172.31.24.227 OpenFlow 187 Type: OFPT_PACKET_OUT
210 1.848804183 172.31.31.144 -> 172.31.24.227 OpenFlow 187 Type: OFPT_PACKET_OUT
211 1.848872016 172.31.31.144 -> 172.31.24.227 OpenFlow 187 Type: OFPT_PACKET_OUT
212 1.848918609 172.31.31.144 -> 172.31.24.227 OpenFlow 187 Type: OFPT_PACKET_OUT
213 1.848979292 172.31.31.144 -> 172.31.24.227 OpenFlow 187 Type: OFPT_PACKET_OUT
214 1.849004417 172.31.24.227 -> 172.31.31.144 TCP 66 53158 → 6633 [ACK] Seq=8633 Ack=1065 Win=213 Len=0 TSval=388708073 TSecr=1815217
215 1.849038974 172.31.31.144 -> 172.31.24.227 OpenFlow 187 Type: OFPT_PACKET_OUT
216 1.849085108 172.31.31.144 -> 172.31.24.227 OpenFlow 187 Type: OFPT_PACKET_OUT
217 1.849126381 172.31.24.227 -> 172.31.31.144 OpenFlow 189 Type: OFPT_PACKET_IN
218 1.849163189 172.31.31.144 -> 172.31.24.227 OpenFlow 187 Type: OFPT_PACKET_OUT
219 1.849171156 172.31.24.227 -> 172.31.31.144 OpenFlow 189 Type: OFPT_PACKET_IN
220 1.849208753 172.31.24.227 -> 172.31.31.144 OpenFlow 189 Type: OFPT_PACKET_IN
221 1.849228411 172.31.24.227 -> 172.31.31.144 OpenFlow 189 Type: OFPT_PACKET_IN
222 1.849296005 172.31.31.144 -> 172.31.24.227 OpenFlow 187 Type: OFPT_PACKET_OUT
223 1.849300955 172.31.31.144 -> 172.31.24.227 OpenFlow 187 Type: OFPT_PACKET_OUT
224 1.849325106 172.31.24.227 -> 172.31.31.144 OpenFlow 189 Type: OFPT_PACKET_IN
225 1.849363315 172.31.31.144 -> 172.31.24.227 TCP 66 6633 → 53164 [ACK] Seq=97 Ack=9700 Win=853 Len=0 TSval=1815217 TSecr=388708073
226 1.849370525 172.31.31.144 -> 172.31.24.227 TCP 66 6633 → 53164 [ACK] Seq=97 Ack=9823 Win=853 Len=0 TSval=1815217 TSecr=388708073
227 1.849376461 172.31.24.227 -> 172.31.31.144 OpenFlow 189 Type: OFPT_PACKET_IN
228 1.849526649 172.31.31.144 -> 172.31.24.227 TCP 66 6633 → 53174 [ACK] Seq=97 Ack=7604 Win=853 Len=0 TSval=1815217 TSecr=388708073
229 1.849534016 172.31.31.144 -> 172.31.24.227 TCP 66 6633 → 53174 [ACK] Seq=97 Ack=7727 Win=853 Len=0 TSval=1815217 TSecr=388708073
230 1.849536750 172.31.31.144 -> 172.31.24.227 TCP 66 6633 → 53198 [ACK] Seq=97 Ack=6980 Win=853 Len=0 TSval=1815217 TSecr=388708073
231 1.849570998 172.31.31.144 -> 172.31.24.227 TCP 66 6633 → 53198 [ACK] Seq=97 Ack=7103 Win=853 Len=0 TSval=1815217 TSecr=388708073
232 1.849592436 172.31.24.227 -> 172.31.31.144 TCP 66 53154 → 6633 [ACK] Seq=7065 Ack=339 Win=213 Len=0 TSval=388708073 TSecr=1815217
233 1.850052130 172.31.24.227 -> 172.31.31.144 TCP 66 53156 → 6633 [ACK] Seq=8841 Ack=1065 Win=213 Len=0 TSval=388708073 TSecr=1815217
234 1.850140482 172.31.24.227 -> 172.31.31.144 OpenFlow 189 Type: OFPT_PACKET_IN
235 1.850165379 172.31.24.227 -> 172.31.31.144 OpenFlow 189 Type: OFPT_PACKET_IN
236 1.850191877 172.31.24.227 -> 172.31.31.144 OpenFlow 189 Type: OFPT_PACKET_IN
237 1.850209533 172.31.24.227 -> 172.31.31.144 OpenFlow 189 Type: OFPT_PACKET_IN
238 1.850249709 172.31.24.227 -> 172.31.31.144 OpenFlow 189 Type: OFPT_PACKET_IN
239 1.850379299 172.31.24.227 -> 172.31.31.144 OpenFlow 189 Type: OFPT_PACKET_IN
240 1.850383296 172.31.24.227 -> 172.31.31.144 OpenFlow 435 Type: OFPT_PACKET_IN
241 1.850574021 172.31.31.144 -> 172.31.24.227 TCP 66 6633 → 53160 [ACK] Seq=97 Ack=9492 Win=853 Len=0 TSval=1815217 TSecr=388708073
242 1.850581587 172.31.31.144 -> 172.31.24.227 OpenFlow 187 Type: OFPT_PACKET_OUT
243 1.850599314 172.31.31.144 -> 172.31.24.227 TCP 66 6633 → 53160 [ACK] Seq=97 Ack=9615 Win=853 Len=0 TSval=1815217 TSecr=388708073
244 1.850602317 172.31.31.144 -> 172.31.24.227 OpenFlow 187 Type: OFPT_PACKET_OUT
245 1.850604912 172.31.31.144 -> 172.31.24.227 TCP 66 6633 → 53166 [ACK] Seq=97 Ack=8660 Win=853 Len=0 TSval=1815217 TSecr=388708073
246 1.850607273 172.31.31.144 -> 172.31.24.227 TCP 66 6633 → 53168 [ACK] Seq=97 Ack=8132 Win=853 Len=0 TSval=1815217 TSecr=388708073
247 1.850689189 172.31.24.227 -> 172.31.31.144 OpenFlow 189 Type: OFPT_PACKET_IN
248 1.850832321 172.31.31.144 -> 172.31.24.227 OpenFlow 187 Type: OFPT_PACKET_OUT
249 1.850837007 172.31.31.144 -> 172.31.24.227 OpenFlow 187 Type: OFPT_PACKET_OUT
250 1.850838985 172.31.31.144 -> 172.31.24.227 OpenFlow 187 Type: OFPT_PACKET_OUT
251 1.850840388 172.31.31.144 -> 172.31.24.227 TCP 66 6633 → 53172 [ACK] Seq=97 Ack=8868 Win=853 Len=0 TSval=1815217 TSecr=388708073
252 1.850848075 172.31.24.227 -> 172.31.31.144 TCP 66 53190 → 6633 [ACK] Seq=9465 Ack=339 Win=213 Len=0 TSval=388708073 TSecr=1815217
253 1.851007197 172.31.24.227 -> 172.31.31.144 TCP 66 53190 → 6633 [ACK] Seq=9465 Ack=702 Win=213 Len=0 TSval=388708073 TSecr=1815217
254 1.851028015 172.31.31.144 -> 172.31.24.227 TCP 66 6633 → 53166 [ACK] Seq=97 Ack=8783 Win=853 Len=0 TSval=1815217 TSecr=388708073
255 1.851033817 172.31.31.144 -> 172.31.24.227 OpenFlow 187 Type: OFPT_PACKET_OUT
256 1.851036463 172.31.31.144 -> 172.31.24.227 OpenFlow 308 Type: OFPT_PACKET_OUT
257 1.851038696 172.31.31.144 -> 172.31.24.227 TCP 66 6633 → 53168 [ACK] Seq=97 Ack=8501 Win=853 Len=0 TSval=1815217 TSecr=388708073
258 1.851041148 172.31.31.144 -> 172.31.24.227 TCP 66 6633 → 53172 [ACK] Seq=97 Ack=8991 Win=853 Len=0 TSval=1815217 TSecr=388708073
259 1.851124198 172.31.24.227 -> 172.31.31.144 TCP 66 53190 → 6633 [ACK] Seq=9465 Ack=1065 Win=213 Len=0 TSval=388708073 TSecr=1815217
260 1.851283025 172.31.24.227 -> 172.31.31.144 OpenFlow 189 Type: OFPT_PACKET_IN
261 1.851309403 172.31.24.227 -> 172.31.31.144 OpenFlow 189 Type: OFPT_PACKET_IN
262 1.851357603 172.31.24.227 -> 172.31.31.144 OpenFlow 189 Type: OFPT_PACKET_IN
263 1.851399919 172.31.24.227 -> 172.31.31.144 OpenFlow 189 Type: OFPT_PACKET_IN
264 1.851433747 172.31.24.227 -> 172.31.31.144 OpenFlow 189 Type: OFPT_PACKET_IN
265 1.851579321 172.31.24.227 -> 172.31.31.144 OpenFlow 189 Type: OFPT_PACKET_IN
266 1.851885430 172.31.31.144 -> 172.31.24.227 TCP 66 6633 → 53152 [ACK] Seq=97 Ack=9380 Win=853 Len=0 TSval=1815218 TSecr=388708073
267 1.851891422 172.31.31.144 -> 172.31.24.227 TCP 66 6633 → 53152 [ACK] Seq=97 Ack=9503 Win=853 Len=0 TSval=1815218 TSecr=388708073
268 1.851893895 172.31.31.144 -> 172.31.24.227 TCP 66 6633 → 53166 [ACK] Seq=97 Ack=8906 Win=853 Len=0 TSval=1815218 TSecr=388708073
269 1.851896346 172.31.31.144 -> 172.31.24.227 TCP 66 6633 → 53166 [ACK] Seq=97 Ack=9029 Win=853 Len=0 TSval=1815218 TSecr=388708073
270 1.852165619 172.31.31.144 -> 172.31.24.227 OpenFlow 187 Type: OFPT_PACKET_OUT
271 1.852171013 172.31.31.144 -> 172.31.24.227 OpenFlow 429 Type: OFPT_PACKET_OUT
272 1.852174135 172.31.31.144 -> 172.31.24.227 OpenFlow 187 Type: OFPT_PACKET_OUT
273 1.852177501 172.31.31.144 -> 172.31.24.227 OpenFlow 671 Type: OFPT_PACKET_OUT
274 1.852180166 172.31.31.144 -> 172.31.24.227 OpenFlow 187 Type: OFPT_PACKET_OUT
275 1.852183009 172.31.31.144 -> 172.31.24.227 OpenFlow 187 Type: OFPT_PACKET_OUT
276 1.852185096 172.31.31.144 -> 172.31.24.227 TCP 66 6633 → 53186 [ACK] Seq=97 Ack=8964 Win=853 Len=0 TSval=1815218 TSecr=388708073
277 1.852187790 172.31.31.144 -> 172.31.24.227 OpenFlow 1034 Type: OFPT_PACKET_OUT
278 1.852190006 172.31.31.144 -> 172.31.24.227 OpenFlow 187 Type: OFPT_PACKET_OUT
279 1.852192289 172.31.31.144 -> 172.31.24.227 OpenFlow 429 Type: OFPT_PACKET_OUT
280 1.852194942 172.31.31.144 -> 172.31.24.227 OpenFlow 550 Type: OFPT_PACKET_OUT
281 1.852197362 172.31.31.144 -> 172.31.24.227 OpenFlow 187 Type: OFPT_PACKET_OUT
282 1.852199410 172.31.31.144 -> 172.31.24.227 OpenFlow 187 Type: OFPT_PACKET_OUT
283 1.852201210 172.31.31.144 -> 172.31.24.227 OpenFlow 671 Type: OFPT_PACKET_OUT
284 1.852203044 172.31.31.144 -> 172.31.24.227 TCP 66 6633 → 53186 [ACK] Seq=97 Ack=9087 Win=853 Len=0 TSval=1815218 TSecr=388708073
285 1.852347117 172.31.31.144 -> 172.31.24.227 OpenFlow 187 Type: OFPT_PACKET_OUT
286 1.852464757 172.31.31.144 -> 172.31.24.227 OpenFlow 187 Type: OFPT_PACKET_OUT
287 1.852553686 172.31.31.144 -> 172.31.24.227 OpenFlow 187 Type: OFPT_PACKET_OUT
288 1.852592352 172.31.24.227 -> 172.31.31.144 TCP 66 53152 → 6633 [ACK] Seq=9503 Ack=1065 Win=213 Len=0 TSval=388708073 TSecr=1815218
289 1.852656841 172.31.31.144 -> 172.31.24.227 OpenFlow 187 Type: OFPT_PACKET_OUT
290 1.852751784 172.31.31.144 -> 172.31.24.227 OpenFlow 187 Type: OFPT_PACKET_OUT
291 1.852839815 172.31.24.227 -> 172.31.31.144 TCP 66 53154 → 6633 [ACK] Seq=7065 Ack=823 Win=213 Len=0 TSval=388708073 TSecr=1815218
292 1.853008692 172.31.31.144 -> 172.31.24.227 OpenFlow 187 Type: OFPT_PACKET_OUT
293 1.853094933 172.31.31.144 -> 172.31.24.227 OpenFlow 187 Type: OFPT_PACKET_OUT
294 1.853101450 172.31.31.144 -> 172.31.24.227 OpenFlow 187 Type: OFPT_PACKET_OUT
295 1.853103889 172.31.31.144 -> 172.31.24.227 OpenFlow 308 Type: OFPT_PACKET_OUT
296 1.853106203 172.31.31.144 -> 172.31.24.227 OpenFlow 187 Type: OFPT_PACKET_OUT
297 1.853193857 172.31.31.144 -> 172.31.24.227 OpenFlow 187 Type: OFPT_PACKET_OUT
298 1.853297046 172.31.31.144 -> 172.31.24.227 OpenFlow 187 Type: OFPT_PACKET_OUT
299 1.853303074 172.31.31.144 -> 172.31.24.227 OpenFlow 187 Type: OFPT_PACKET_OUT
300 1.853468371 172.31.31.144 -> 172.31.24.227 OpenFlow 187 Type: OFPT_PACKET_OUT
301 1.853474766 172.31.31.144 -> 172.31.24.227 OpenFlow 187 Type: OFPT_PACKET_OUT
302 1.853477096 172.31.31.144 -> 172.31.24.227 OpenFlow 187 Type: OFPT_PACKET_OUT
303 1.853518666 172.31.24.227 -> 172.31.31.144 TCP 66 53160 → 6633 [ACK] Seq=9615 Ack=1307 Win=213 Len=0 TSval=388708074 TSecr=1815218
304 1.853605224 172.31.24.227 -> 172.31.31.144 OpenFlow 189 Type: OFPT_PACKET_IN
305 1.853717036 172.31.31.144 -> 172.31.24.227 OpenFlow 187 Type: OFPT_PACKET_OUT
306 1.853723226 172.31.31.144 -> 172.31.24.227 OpenFlow 187 Type: OFPT_PACKET_OUT
307 1.853726031 172.31.31.144 -> 172.31.24.227 OpenFlow 187 Type: OFPT_PACKET_OUT
308 1.853728163 172.31.31.144 -> 172.31.24.227 OpenFlow 187 Type: OFPT_PACKET_OUT
309 1.853791672 172.31.24.227 -> 172.31.31.144 OpenFlow 189 Type: OFPT_PACKET_IN
310 1.853898290 172.31.31.144 -> 172.31.24.227 OpenFlow 187 Type: OFPT_PACKET_OUT
311 1.853904738 172.31.31.144 -> 172.31.24.227 OpenFlow 187 Type: OFPT_PACKET_OUT
312 1.853907023 172.31.31.144 -> 172.31.24.227 OpenFlow 187 Type: OFPT_PACKET_OUT
313 1.853910218 172.31.31.144 -> 172.31.24.227 OpenFlow 187 Type: OFPT_PACKET_OUT
314 1.854025171 172.31.31.144 -> 172.31.24.227 OpenFlow 187 Type: OFPT_PACKET_OUT
315 1.854031349 172.31.31.144 -> 172.31.24.227 TCP 66 6633 → 53162 [ACK] Seq=1307 Ack=9700 Win=853 Len=0 TSval=1815218 TSecr=388708074
316 1.854109183 172.31.31.144 -> 172.31.24.227 TCP 66 6633 → 53162 [ACK] Seq=1307 Ack=9823 Win=853 Len=0 TSval=1815218 TSecr=388708074
317 1.854168952 172.31.31.144 -> 172.31.24.227 OpenFlow 187 Type: OFPT_PACKET_OUT
318 1.854403680 172.31.31.144 -> 172.31.24.227 OpenFlow 187 Type: OFPT_PACKET_OUT
319 1.854410188 172.31.31.144 -> 172.31.24.227 OpenFlow 308 Type: OFPT_PACKET_OUT
320 1.854412657 172.31.31.144 -> 172.31.24.227 OpenFlow 187 Type: OFPT_PACKET_OUT
321 1.854414789 172.31.31.144 -> 172.31.24.227 OpenFlow 308 Type: OFPT_PACKET_OUT
322 1.854448832 172.31.31.144 -> 172.31.24.227 OpenFlow 187 Type: OFPT_PACKET_OUT
323 1.854504460 172.31.31.144 -> 172.31.24.227 OpenFlow 187 Type: OFPT_PACKET_OUT
324 1.854559305 172.31.31.144 -> 172.31.24.227 OpenFlow 187 Type: OFPT_PACKET_OUT
325 1.854615876 172.31.31.144 -> 172.31.24.227 OpenFlow 187 Type: OFPT_PACKET_OUT
326 1.854665540 172.31.31.144 -> 172.31.24.227 OpenFlow 187 Type: OFPT_PACKET_OUT
327 1.854722541 172.31.31.144 -> 172.31.24.227 OpenFlow 187 Type: OFPT_PACKET_OUT
328 1.854758900 172.31.24.227 -> 172.31.31.144 TCP 66 53164 → 6633 [ACK] Seq=9823 Ack=1307 Win=213 Len=0 TSval=388708074 TSecr=1815218
329 1.854835233 172.31.31.144 -> 172.31.24.227 OpenFlow 187 Type: OFPT_PACKET_OUT
330 1.854842255 172.31.31.144 -> 172.31.24.227 OpenFlow 187 Type: OFPT_PACKET_OUT
331 1.854935911 172.31.31.144 -> 172.31.24.227 OpenFlow 187 Type: OFPT_PACKET_OUT
332 1.854941453 172.31.31.144 -> 172.31.24.227 OpenFlow 187 Type: OFPT_PACKET_OUT
333 1.855042747 172.31.31.144 -> 172.31.24.227 OpenFlow 187 Type: OFPT_PACKET_OUT
334 1.855048726 172.31.31.144 -> 172.31.24.227 OpenFlow 187 Type: OFPT_PACKET_OUT
335 1.855169232 172.31.31.144 -> 172.31.24.227 OpenFlow 187 Type: OFPT_PACKET_OUT
336 1.855175303 172.31.31.144 -> 172.31.24.227 OpenFlow 187 Type: OFPT_PACKET_OUT
337 1.855265806 172.31.31.144 -> 172.31.24.227 OpenFlow 187 Type: OFPT_PACKET_OUT
338 1.855284010 172.31.31.144 -> 172.31.24.227 OpenFlow 187 Type: OFPT_PACKET_OUT
339 1.855364046 172.31.24.227 -> 172.31.31.144 TCP 66 53166 → 6633 [ACK] Seq=9029 Ack=1307 Win=213 Len=0 TSval=388708074 TSecr=1815218
340 1.855382815 172.31.31.144 -> 172.31.24.227 OpenFlow 187 Type: OFPT_PACKET_OUT
341 1.855389563 172.31.31.144 -> 172.31.24.227 OpenFlow 187 Type: OFPT_PACKET_OUT
342 1.855473558 172.31.24.227 -> 172.31.31.144 OpenFlow 189 Type: OFPT_PACKET_IN
343 1.855509330 172.31.24.227 -> 172.31.31.144 OpenFlow 435 Type: OFPT_PACKET_IN
344 1.855764468 172.31.24.227 -> 172.31.31.144 OpenFlow 189 Type: OFPT_PACKET_IN
345 1.855848947 172.31.31.144 -> 172.31.24.227 TCP 66 6633 → 53170 [ACK] Seq=823 Ack=9845 Win=853 Len=0 TSval=1815219 TSecr=388708074
346 1.855859542 172.31.24.227 -> 172.31.31.144 OpenFlow 435 Type: OFPT_PACKET_IN
347 1.856042454 172.31.31.144 -> 172.31.24.227 TCP 66 6633 → 53172 [ACK] Seq=97 Ack=9114 Win=853 Len=0 TSval=1815219 TSecr=388708074
348 1.856096131 172.31.31.144 -> 172.31.24.227 TCP 66 6633 → 53172 [ACK] Seq=97 Ack=9483 Win=853 Len=0 TSval=1815219 TSecr=388708074
349 1.856138282 172.31.24.227 -> 172.31.31.144 TCP 66 53174 → 6633 [ACK] Seq=7727 Ack=823 Win=213 Len=0 TSval=388708074 TSecr=1815218
350 1.856217631 172.31.24.227 -> 172.31.31.144 OpenFlow 189 Type: OFPT_PACKET_IN
351 1.856241753 172.31.24.227 -> 172.31.31.144 OpenFlow 435 Type: OFPT_PACKET_IN
352 1.856256892 172.31.24.227 -> 172.31.31.144 OpenFlow 189 Type: OFPT_PACKET_IN
353 1.856329068 172.31.24.227 -> 172.31.31.144 OpenFlow 189 Type: OFPT_PACKET_IN
354 1.856479936 172.31.31.144 -> 172.31.24.227 TCP 66 6633 → 53176 [ACK] Seq=97 Ack=9380 Win=853 Len=0 TSval=1815219 TSecr=388708074
355 1.856486798 172.31.31.144 -> 172.31.24.227 TCP 66 6633 → 53176 [ACK] Seq=97 Ack=9749 Win=853 Len=0 TSval=1815219 TSecr=388708074
356 1.856570487 172.31.31.144 -> 172.31.24.227 TCP 66 6633 → 53178 [ACK] Seq=1307 Ack=8036 Win=853 Len=0 TSval=1815219 TSecr=388708074
357 1.856576804 172.31.31.144 -> 172.31.24.227 TCP 66 6633 → 53178 [ACK] Seq=1307 Ack=8159 Win=853 Len=0 TSval=1815219 TSecr=388708074
358 1.856813045 172.31.24.227 -> 172.31.31.144 OpenFlow 189 Type: OFPT_PACKET_IN
359 1.856839764 172.31.24.227 -> 172.31.31.144 OpenFlow 435 Type: OFPT_PACKET_IN
360 1.857072907 172.31.24.227 -> 172.31.31.144 TCP 66 53182 → 6633 [ACK] Seq=8521 Ack=823 Win=213 Len=0 TSval=388708075 TSecr=1815218
361 1.857084073 172.31.31.144 -> 172.31.24.227 TCP 66 6633 → 53180 [ACK] Seq=97 Ack=7924 Win=853 Len=0 TSval=1815219 TSecr=388708074
362 1.857089234 172.31.31.144 -> 172.31.24.227 TCP 66 6633 → 53180 [ACK] Seq=97 Ack=8293 Win=853 Len=0 TSval=1815219 TSecr=388708074
363 1.857177420 172.31.24.227 -> 172.31.31.144 OpenFlow 189 Type: OFPT_PACKET_IN
364 1.857203292 172.31.24.227 -> 172.31.31.144 OpenFlow 435 Type: OFPT_PACKET_IN
365 1.857219831 172.31.24.227 -> 172.31.31.144 OpenFlow 189 Type: OFPT_PACKET_IN
366 1.857240894 172.31.24.227 -> 172.31.31.144 OpenFlow 189 Type: OFPT_PACKET_IN
367 1.857295186 172.31.24.227 -> 172.31.31.144 OpenFlow 435 Type: OFPT_PACKET_IN
368 1.857482106 172.31.24.227 -> 172.31.31.144 OpenFlow 189 Type: OFPT_PACKET_IN
369 1.857532942 172.31.24.227 -> 172.31.31.144 OpenFlow 189 Type: OFPT_PACKET_IN
370 1.857555460 172.31.24.227 -> 172.31.31.144 OpenFlow 189 Type: OFPT_PACKET_IN
