  1 0.000000000 137.158.125.247 -> 172.31.23.72 TCP 54 52508 → 22 [ACK] Seq=1 Ack=1 Win=32434 Len=0
  2 0.115338198 137.158.125.247 -> 172.31.23.72 TCP 54 52508 → 22 [ACK] Seq=1 Ack=61 Win=32404 Len=0
  3 0.467349180 172.31.31.144 -> 172.31.23.72 TCP 82 6633 → 40146 [PSH, ACK] Seq=1 Ack=1 Win=853 Len=16 TSval=704920 TSecr=797290
  4 0.467375749 172.31.31.144 -> 172.31.23.72 TCP 146 6633 → 40146 [PSH, ACK] Seq=17 Ack=1 Win=853 Len=80 TSval=704920 TSecr=797290
  5 0.467737625 172.31.23.72 -> 172.31.31.144 OpenFlow 6178 Type: OFPT_MULTIPART_REPLY, OFPMP_TABLE
  6 0.467852611 172.31.23.72 -> 172.31.31.144 OpenFlow 2010 Type: OFPT_MULTIPART_REPLY, OFPMP_FLOW
  7 0.467970692 172.31.23.72 -> 172.31.31.144 OpenFlow 642 Type: OFPT_MULTIPART_REPLY, OFPMP_PORT_STATS
  8 0.468046380 172.31.31.144 -> 172.31.23.72 TCP 66 6633 → 40146 [ACK] Seq=97 Ack=6113 Win=853 Len=0 TSval=704920 TSecr=797759
  9 0.468069357 172.31.31.144 -> 172.31.23.72 TCP 66 6633 → 40146 [ACK] Seq=97 Ack=8057 Win=853 Len=0 TSval=704920 TSecr=797759
 10 0.468128613 172.31.31.144 -> 172.31.23.72 TCP 66 6633 → 40146 [ACK] Seq=97 Ack=8633 Win=853 Len=0 TSval=704920 TSecr=797759
 11 0.469522023 172.31.31.144 -> 172.31.23.72 TCP 122 6633 → 40144 [PSH, ACK] Seq=1 Ack=1 Win=853 Len=56 TSval=704920 TSecr=797290
 12 0.469539371 172.31.31.144 -> 172.31.23.72 TCP 106 6633 → 40144 [PSH, ACK] Seq=57 Ack=1 Win=853 Len=40 TSval=704920 TSecr=797290
 13 0.469627815 172.31.23.72 -> 172.31.31.144 OpenFlow 970 Type: OFPT_MULTIPART_REPLY, OFPMP_FLOW
 14 0.469705763 172.31.23.72 -> 172.31.31.144 OpenFlow 530 Type: OFPT_MULTIPART_REPLY, OFPMP_PORT_STATS
 15 0.469863924 172.31.31.144 -> 172.31.23.72 TCP 66 6633 → 40144 [ACK] Seq=97 Ack=905 Win=853 Len=0 TSval=704920 TSecr=797759
 16 0.469869377 172.31.31.144 -> 172.31.23.72 TCP 66 6633 → 40144 [ACK] Seq=97 Ack=1369 Win=853 Len=0 TSval=704920 TSecr=797759
 17 0.469877353 172.31.23.72 -> 172.31.31.144 OpenFlow 6178 Type: OFPT_MULTIPART_REPLY, OFPMP_TABLE
 18 0.470076996 172.31.31.144 -> 172.31.23.72 TCP 66 6633 → 40144 [ACK] Seq=97 Ack=7481 Win=853 Len=0 TSval=704920 TSecr=797759
 19 0.483739264 172.31.31.144 -> 172.31.23.72 TCP 122 6633 → 40150 [PSH, ACK] Seq=1 Ack=1 Win=853 Len=56 TSval=704924 TSecr=797290
 20 0.483771034 172.31.31.144 -> 172.31.23.72 TCP 122 6633 → 40154 [PSH, ACK] Seq=1 Ack=1 Win=853 Len=56 TSval=704924 TSecr=797318
 21 0.483785144 172.31.31.144 -> 172.31.23.72 TCP 106 6633 → 40150 [PSH, ACK] Seq=57 Ack=1 Win=853 Len=40 TSval=704924 TSecr=797290
 22 0.483854255 172.31.31.144 -> 172.31.23.72 TCP 90 6633 → 40154 [PSH, ACK] Seq=57 Ack=1 Win=853 Len=24 TSval=704924 TSecr=797318
 23 0.484058843 172.31.23.72 -> 172.31.31.144 OpenFlow 2634 Type: OFPT_MULTIPART_REPLY, OFPMP_FLOW
 24 0.484198988 172.31.23.72 -> 172.31.31.144 OpenFlow 754 Type: OFPT_MULTIPART_REPLY, OFPMP_PORT_STATS
 25 0.484345106 172.31.23.72 -> 172.31.31.144 OpenFlow 6178 Type: OFPT_MULTIPART_REPLY, OFPMP_TABLE
 26 0.484399385 172.31.31.144 -> 172.31.23.72 TCP 66 6633 → 40150 [ACK] Seq=97 Ack=3257 Win=853 Len=0 TSval=704924 TSecr=797763
 27 0.484423664 172.31.23.72 -> 172.31.31.144 OpenFlow 1594 Type: OFPT_MULTIPART_REPLY, OFPMP_FLOW
 28 0.484517105 172.31.23.72 -> 172.31.31.144 OpenFlow 754 Type: OFPT_MULTIPART_REPLY, OFPMP_PORT_STATS
 29 0.484823133 172.31.31.144 -> 172.31.23.72 OpenFlow 82 Type: OFPT_MULTIPART_REQUEST, OFPMP_TABLE
 30 0.485033439 172.31.23.72 -> 172.31.31.144 OpenFlow 6178 Type: OFPT_MULTIPART_REPLY, OFPMP_TABLE
 31 0.494092839 172.31.31.144 -> 172.31.23.72 TCP 122 6633 → 40152 [PSH, ACK] Seq=1 Ack=1 Win=853 Len=56 TSval=704926 TSecr=797290
 32 0.494125281 172.31.31.144 -> 172.31.23.72 TCP 106 6633 → 40152 [PSH, ACK] Seq=57 Ack=1 Win=853 Len=40 TSval=704926 TSecr=797290
 33 0.494244074 172.31.23.72 -> 172.31.31.144 OpenFlow 2634 Type: OFPT_MULTIPART_REPLY, OFPMP_FLOW
 34 0.494359535 172.31.23.72 -> 172.31.31.144 OpenFlow 754 Type: OFPT_MULTIPART_REPLY, OFPMP_PORT_STATS
 35 0.494473558 172.31.31.144 -> 172.31.23.72 TCP 66 6633 → 40152 [ACK] Seq=97 Ack=2569 Win=853 Len=0 TSval=704926 TSecr=797765
 36 0.494526121 172.31.23.72 -> 172.31.31.144 OpenFlow 6178 Type: OFPT_MULTIPART_REPLY, OFPMP_TABLE
 37 0.494532751 172.31.31.144 -> 172.31.23.72 TCP 66 6633 → 40152 [ACK] Seq=97 Ack=3257 Win=853 Len=0 TSval=704927 TSecr=797765
 38 0.494714824 172.31.31.144 -> 172.31.23.72 TCP 66 6633 → 40152 [ACK] Seq=97 Ack=9369 Win=853 Len=0 TSval=704927 TSecr=797765
 39 0.498264595 172.31.31.144 -> 172.31.23.72 TCP 82 6633 → 40148 [PSH, ACK] Seq=1 Ack=1 Win=853 Len=16 TSval=704927 TSecr=797290
 40 0.498325892 172.31.31.144 -> 172.31.23.72 TCP 146 6633 → 40148 [PSH, ACK] Seq=17 Ack=1 Win=853 Len=80 TSval=704927 TSecr=797290
 41 0.498477617 172.31.23.72 -> 172.31.31.144 OpenFlow 6178 Type: OFPT_MULTIPART_REPLY, OFPMP_TABLE
 42 0.498599616 172.31.23.72 -> 172.31.31.144 OpenFlow 754 Type: OFPT_MULTIPART_REPLY, OFPMP_PORT_STATS
 43 0.498676130 172.31.23.72 -> 172.31.31.144 OpenFlow 2634 Type: OFPT_MULTIPART_REPLY, OFPMP_FLOW
 44 0.498734287 172.31.31.144 -> 172.31.23.72 TCP 66 6633 → 40148 [ACK] Seq=97 Ack=6113 Win=853 Len=0 TSval=704928 TSecr=797766
 45 0.498752781 172.31.31.144 -> 172.31.23.72 TCP 66 6633 → 40148 [ACK] Seq=97 Ack=6801 Win=853 Len=0 TSval=704928 TSecr=797766
 46 0.498840547 172.31.31.144 -> 172.31.23.72 TCP 66 6633 → 40148 [ACK] Seq=97 Ack=9369 Win=853 Len=0 TSval=704928 TSecr=797766
 47 0.499366844 172.31.31.144 -> 172.31.23.72 TCP 90 6633 → 40142 [PSH, ACK] Seq=1 Ack=1 Win=853 Len=24 TSval=704928 TSecr=797264
 48 0.499483669 172.31.23.72 -> 172.31.31.144 OpenFlow 642 Type: OFPT_MULTIPART_REPLY, OFPMP_PORT_STATS
 49 0.500517719 172.31.31.144 -> 172.31.23.72 TCP 82 6633 → 40156 [PSH, ACK] Seq=1 Ack=1 Win=853 Len=16 TSval=704928 TSecr=797290
 50 0.500535374 172.31.31.144 -> 172.31.23.72 TCP 146 6633 → 40156 [PSH, ACK] Seq=17 Ack=1 Win=853 Len=80 TSval=704928 TSecr=797290
 51 0.500553980 172.31.31.144 -> 172.31.23.72 OpenFlow 122 Type: OFPT_MULTIPART_REQUEST, OFPMP_FLOW
 52 0.500643742 172.31.31.144 -> 172.31.23.72 OpenFlow 82 Type: OFPT_MULTIPART_REQUEST, OFPMP_TABLE
 53 0.500663238 172.31.23.72 -> 172.31.31.144 OpenFlow 1594 Type: OFPT_MULTIPART_REPLY, OFPMP_FLOW
 54 0.500810695 172.31.23.72 -> 172.31.31.144 OpenFlow 6178 Type: OFPT_MULTIPART_REPLY, OFPMP_TABLE
 55 0.500991795 172.31.23.72 -> 172.31.31.144 OpenFlow 6178 Type: OFPT_MULTIPART_REPLY, OFPMP_TABLE
 56 0.501029340 172.31.23.72 -> 172.31.31.144 OpenFlow 762 Type: OFPT_MULTIPART_REPLY, OFPMP_FLOW
 57 0.501051832 172.31.31.144 -> 172.31.23.72 TCP 66 6633 → 40142 [ACK] Seq=97 Ack=8217 Win=853 Len=0 TSval=704928 TSecr=797767
 58 0.501121070 172.31.23.72 -> 172.31.31.144 OpenFlow 642 Type: OFPT_MULTIPART_REPLY, OFPMP_PORT_STATS
 59 0.501243562 172.31.31.144 -> 172.31.23.72 TCP 66 6633 → 40156 [ACK] Seq=97 Ack=6809 Win=853 Len=0 TSval=704928 TSecr=797767
 60 0.505693676 172.31.31.144 -> 172.31.23.72 TCP 90 6633 → 40140 [PSH, ACK] Seq=1 Ack=1 Win=853 Len=24 TSval=704929 TSecr=797290
 61 0.505718483 172.31.31.144 -> 172.31.23.72 TCP 138 6633 → 40140 [PSH, ACK] Seq=25 Ack=1 Win=853 Len=72 TSval=704929 TSecr=797290
 62 0.505848237 172.31.23.72 -> 172.31.31.144 OpenFlow 642 Type: OFPT_MULTIPART_REPLY, OFPMP_PORT_STATS
 63 0.506025869 172.31.23.72 -> 172.31.31.144 OpenFlow 6178 Type: OFPT_MULTIPART_REPLY, OFPMP_TABLE
 64 0.506039913 172.31.31.144 -> 172.31.23.72 TCP 66 6633 → 40140 [ACK] Seq=97 Ack=577 Win=853 Len=0 TSval=704929 TSecr=797768
 65 0.506109434 172.31.23.72 -> 172.31.31.144 OpenFlow 2842 Type: OFPT_MULTIPART_REPLY, OFPMP_FLOW
 66 0.506240620 172.31.31.144 -> 172.31.23.72 TCP 66 6633 → 40140 [ACK] Seq=97 Ack=6689 Win=853 Len=0 TSval=704929 TSecr=797768
 67 0.506268242 172.31.31.144 -> 172.31.23.72 TCP 66 6633 → 40140 [ACK] Seq=97 Ack=9465 Win=853 Len=0 TSval=704929 TSecr=797768
 68 0.522573643 172.31.31.144 -> 172.31.23.72 TCP 66 6633 → 40154 [ACK] Seq=97 Ack=8329 Win=853 Len=0 TSval=704934 TSecr=797763
 69 0.522588595 172.31.31.144 -> 172.31.23.72 TCP 66 6633 → 40150 [ACK] Seq=97 Ack=9369 Win=853 Len=0 TSval=704934 TSecr=797763
 70 0.538614499 172.31.31.144 -> 172.31.23.72 TCP 66 6633 → 40156 [ACK] Seq=97 Ack=7385 Win=853 Len=0 TSval=704938 TSecr=797767
 71 0.586992394 172.31.31.144 -> 172.31.23.72 OpenFlow 187 Type: OFPT_PACKET_OUT
 72 0.587006793 172.31.31.144 -> 172.31.23.72 OpenFlow 187 Type: OFPT_PACKET_OUT
 73 0.587137853 172.31.31.144 -> 172.31.23.72 OpenFlow 187 Type: OFPT_PACKET_OUT
 74 0.587160576 172.31.31.144 -> 172.31.23.72 OpenFlow 187 Type: OFPT_PACKET_OUT
 75 0.587226859 172.31.31.144 -> 172.31.23.72 OpenFlow 187 Type: OFPT_PACKET_OUT
 76 0.587247682 172.31.31.144 -> 172.31.23.72 OpenFlow 187 Type: OFPT_PACKET_OUT
 77 0.587357274 172.31.31.144 -> 172.31.23.72 OpenFlow 187 Type: OFPT_PACKET_OUT
 78 0.587425926 172.31.31.144 -> 172.31.23.72 OpenFlow 187 Type: OFPT_PACKET_OUT
 79 0.587543920 172.31.23.72 -> 172.31.31.144 TCP 66 40146 → 6633 [ACK] Seq=8633 Ack=1065 Win=384 Len=0 TSval=797789 TSecr=704950
 80 0.587634585 172.31.23.72 -> 172.31.31.144 OpenFlow 189 Type: OFPT_PACKET_IN
 81 0.587658461 172.31.23.72 -> 172.31.31.144 OpenFlow 189 Type: OFPT_PACKET_IN
 82 0.587704167 172.31.23.72 -> 172.31.31.144 OpenFlow 189 Type: OFPT_PACKET_IN
 83 0.587725457 172.31.23.72 -> 172.31.31.144 OpenFlow 189 Type: OFPT_PACKET_IN
 84 0.587784799 172.31.23.72 -> 172.31.31.144 OpenFlow 189 Type: OFPT_PACKET_IN
 85 0.587806004 172.31.23.72 -> 172.31.31.144 OpenFlow 189 Type: OFPT_PACKET_IN
 86 0.587832432 172.31.31.144 -> 172.31.23.72 TCP 66 6633 → 40150 [ACK] Seq=97 Ack=9492 Win=853 Len=0 TSval=704950 TSecr=797789
 87 0.587856919 172.31.31.144 -> 172.31.23.72 TCP 66 6633 → 40150 [ACK] Seq=97 Ack=9615 Win=853 Len=0 TSval=704950 TSecr=797789
 88 0.587859800 172.31.31.144 -> 172.31.23.72 TCP 66 6633 → 40194 [ACK] Seq=1 Ack=124 Win=853 Len=0 TSval=704950 TSecr=797789
 89 0.587873015 172.31.31.144 -> 172.31.23.72 TCP 66 6633 → 40194 [ACK] Seq=1 Ack=247 Win=853 Len=0 TSval=704950 TSecr=797789
 90 0.587957491 172.31.31.144 -> 172.31.23.72 TCP 66 6633 → 40214 [ACK] Seq=1 Ack=124 Win=853 Len=0 TSval=704950 TSecr=797789
 91 0.587961552 172.31.31.144 -> 172.31.23.72 TCP 66 6633 → 40214 [ACK] Seq=1 Ack=247 Win=853 Len=0 TSval=704950 TSecr=797789
 92 0.659832619 172.31.23.72 -> 137.158.125.247 SSH 90 Server: Encrypted packet (len=36)
 93 0.687267968 172.31.23.72 -> 172.31.31.144 OpenFlow 146 Type: OFPT_PORT_STATUS
 94 0.687379334 172.31.23.72 -> 172.31.31.144 OpenFlow 146 Type: OFPT_PORT_STATUS
 95 0.687502165 172.31.31.144 -> 172.31.23.72 TCP 66 6633 → 40154 [ACK] Seq=97 Ack=8409 Win=853 Len=0 TSval=704975 TSecr=797814
 96 0.687801794 172.31.31.144 -> 172.31.23.72 OpenFlow 187 Type: OFPT_PACKET_OUT
 97 0.687841173 172.31.31.144 -> 172.31.23.72 OpenFlow 187 Type: OFPT_PACKET_OUT
 98 0.687898934 172.31.31.144 -> 172.31.23.72 OpenFlow 187 Type: OFPT_PACKET_OUT
 99 0.688076756 172.31.31.144 -> 172.31.23.72 OpenFlow 187 Type: OFPT_PACKET_OUT
100 0.688181714 172.31.31.144 -> 172.31.23.72 OpenFlow 187 Type: OFPT_PACKET_OUT
101 0.688260109 172.31.31.144 -> 172.31.23.72 OpenFlow 187 Type: OFPT_PACKET_OUT
102 0.688359483 172.31.31.144 -> 172.31.23.72 OpenFlow 187 Type: OFPT_PACKET_OUT
103 0.688402904 172.31.31.144 -> 172.31.23.72 OpenFlow 187 Type: OFPT_PACKET_OUT
104 0.688462916 172.31.31.144 -> 172.31.23.72 OpenFlow 187 Type: OFPT_PACKET_OUT
105 0.688521652 172.31.31.144 -> 172.31.23.72 OpenFlow 187 Type: OFPT_PACKET_OUT
106 0.688590202 172.31.31.144 -> 172.31.23.72 OpenFlow 187 Type: OFPT_PACKET_OUT
107 0.688642427 172.31.31.144 -> 172.31.23.72 OpenFlow 187 Type: OFPT_PACKET_OUT
108 0.688711396 172.31.31.144 -> 172.31.23.72 OpenFlow 187 Type: OFPT_PACKET_OUT
109 0.688763899 172.31.31.144 -> 172.31.23.72 OpenFlow 187 Type: OFPT_PACKET_OUT
110 0.688847331 172.31.31.144 -> 172.31.23.72 OpenFlow 187 Type: OFPT_PACKET_OUT
111 0.688877736 172.31.31.144 -> 172.31.23.72 OpenFlow 187 Type: OFPT_PACKET_OUT
112 0.688948227 172.31.31.144 -> 172.31.23.72 OpenFlow 187 Type: OFPT_PACKET_OUT
113 0.689000942 172.31.31.144 -> 172.31.23.72 OpenFlow 187 Type: OFPT_PACKET_OUT
114 0.689057592 172.31.31.144 -> 172.31.23.72 OpenFlow 187 Type: OFPT_PACKET_OUT
115 0.689122138 172.31.31.144 -> 172.31.23.72 OpenFlow 187 Type: OFPT_PACKET_OUT
116 0.689188030 172.31.31.144 -> 172.31.23.72 OpenFlow 187 Type: OFPT_PACKET_OUT
117 0.689241238 172.31.31.144 -> 172.31.23.72 OpenFlow 187 Type: OFPT_PACKET_OUT
118 0.689277179 172.31.31.144 -> 172.31.23.72 OpenFlow 187 Type: OFPT_PACKET_OUT
119 0.689375778 172.31.31.144 -> 172.31.23.72 OpenFlow 187 Type: OFPT_PACKET_OUT
120 0.689392249 172.31.31.144 -> 172.31.23.72 OpenFlow 187 Type: OFPT_PACKET_OUT
121 0.689460578 172.31.31.144 -> 172.31.23.72 OpenFlow 187 Type: OFPT_PACKET_OUT
122 0.689539822 172.31.31.144 -> 172.31.23.72 OpenFlow 187 Type: OFPT_PACKET_OUT
123 0.689584350 172.31.31.144 -> 172.31.23.72 OpenFlow 187 Type: OFPT_PACKET_OUT
124 0.689643124 172.31.31.144 -> 172.31.23.72 OpenFlow 187 Type: OFPT_PACKET_OUT
125 0.689691760 172.31.31.144 -> 172.31.23.72 OpenFlow 187 Type: OFPT_PACKET_OUT
126 0.689760239 172.31.31.144 -> 172.31.23.72 OpenFlow 187 Type: OFPT_PACKET_OUT
127 0.689837371 172.31.31.144 -> 172.31.23.72 OpenFlow 187 Type: OFPT_PACKET_OUT
128 0.689875865 172.31.31.144 -> 172.31.23.72 OpenFlow 187 Type: OFPT_PACKET_OUT
129 0.689929694 172.31.31.144 -> 172.31.23.72 OpenFlow 187 Type: OFPT_PACKET_OUT
130 0.690000088 172.31.31.144 -> 172.31.23.72 OpenFlow 187 Type: OFPT_PACKET_OUT
131 0.690062770 172.31.31.144 -> 172.31.23.72 OpenFlow 187 Type: OFPT_PACKET_OUT
132 0.690116421 172.31.31.144 -> 172.31.23.72 OpenFlow 187 Type: OFPT_PACKET_OUT
133 0.690161161 172.31.31.144 -> 172.31.23.72 OpenFlow 187 Type: OFPT_PACKET_OUT
134 0.690221467 172.31.31.144 -> 172.31.23.72 OpenFlow 187 Type: OFPT_PACKET_OUT
135 0.690287027 172.31.31.144 -> 172.31.23.72 OpenFlow 187 Type: OFPT_PACKET_OUT
136 0.690346317 172.31.31.144 -> 172.31.23.72 OpenFlow 187 Type: OFPT_PACKET_OUT
137 0.690388236 172.31.31.144 -> 172.31.23.72 OpenFlow 187 Type: OFPT_PACKET_OUT
138 0.690457460 172.31.31.144 -> 172.31.23.72 OpenFlow 187 Type: OFPT_PACKET_OUT
139 0.690507167 172.31.31.144 -> 172.31.23.72 OpenFlow 187 Type: OFPT_PACKET_OUT
140 0.690636982 172.31.31.144 -> 172.31.23.72 OpenFlow 187 Type: OFPT_PACKET_OUT
141 0.690683258 172.31.31.144 -> 172.31.23.72 OpenFlow 187 Type: OFPT_PACKET_OUT
142 0.690755934 172.31.31.144 -> 172.31.23.72 OpenFlow 187 Type: OFPT_PACKET_OUT
143 0.690791320 172.31.31.144 -> 172.31.23.72 OpenFlow 187 Type: OFPT_PACKET_OUT
144 0.690844591 172.31.31.144 -> 172.31.23.72 OpenFlow 187 Type: OFPT_PACKET_OUT
145 0.690902376 172.31.31.144 -> 172.31.23.72 OpenFlow 187 Type: OFPT_PACKET_OUT
146 0.690964685 172.31.23.72 -> 172.31.31.144 TCP 66 40144 → 6633 [ACK] Seq=7481 Ack=823 Win=379 Len=0 TSval=797815 TSecr=704975
147 0.690987600 172.31.31.144 -> 172.31.23.72 OpenFlow 187 Type: OFPT_PACKET_OUT
148 0.691036617 172.31.31.144 -> 172.31.23.72 OpenFlow 187 Type: OFPT_PACKET_OUT
149 0.691153920 172.31.31.144 -> 172.31.23.72 OpenFlow 187 Type: OFPT_PACKET_OUT
150 0.691175161 172.31.31.144 -> 172.31.23.72 OpenFlow 187 Type: OFPT_PACKET_OUT
151 0.691232384 172.31.31.144 -> 172.31.23.72 OpenFlow 187 Type: OFPT_PACKET_OUT
152 0.691294864 172.31.31.144 -> 172.31.23.72 OpenFlow 187 Type: OFPT_PACKET_OUT
153 0.691372252 172.31.31.144 -> 172.31.23.72 OpenFlow 187 Type: OFPT_PACKET_OUT
154 0.691411597 172.31.31.144 -> 172.31.23.72 OpenFlow 187 Type: OFPT_PACKET_OUT
155 0.691473732 172.31.31.144 -> 172.31.23.72 OpenFlow 187 Type: OFPT_PACKET_OUT
156 0.691510637 172.31.23.72 -> 172.31.31.144 TCP 66 40148 → 6633 [ACK] Seq=9369 Ack=1307 Win=612 Len=0 TSval=797815 TSecr=704975
157 0.691533183 172.31.31.144 -> 172.31.23.72 OpenFlow 187 Type: OFPT_PACKET_OUT
158 0.691587654 172.31.23.72 -> 172.31.31.144 TCP 66 40150 → 6633 [ACK] Seq=9615 Ack=1307 Win=384 Len=0 TSval=797815 TSecr=704975
159 0.691609671 172.31.31.144 -> 172.31.23.72 OpenFlow 187 Type: OFPT_PACKET_OUT
160 0.691660478 172.31.31.144 -> 172.31.23.72 OpenFlow 187 Type: OFPT_PACKET_OUT
161 0.691764793 172.31.31.144 -> 172.31.23.72 OpenFlow 187 Type: OFPT_PACKET_OUT
162 0.691793908 172.31.31.144 -> 172.31.23.72 OpenFlow 187 Type: OFPT_PACKET_OUT
163 0.691873679 172.31.31.144 -> 172.31.23.72 OpenFlow 187 Type: OFPT_PACKET_OUT
164 0.691898409 172.31.31.144 -> 172.31.23.72 OpenFlow 187 Type: OFPT_PACKET_OUT
165 0.691956771 172.31.31.144 -> 172.31.23.72 OpenFlow 187 Type: OFPT_PACKET_OUT
166 0.692018517 172.31.31.144 -> 172.31.23.72 OpenFlow 187 Type: OFPT_PACKET_OUT
167 0.692042390 172.31.23.72 -> 172.31.31.144 OpenFlow 189 Type: OFPT_PACKET_IN
168 0.692069747 172.31.23.72 -> 172.31.31.144 OpenFlow 189 Type: OFPT_PACKET_IN
169 0.692244217 172.31.31.144 -> 172.31.23.72 TCP 66 6633 → 40152 [ACK] Seq=1307 Ack=9492 Win=853 Len=0 TSval=704976 TSecr=797815
170 0.692489824 172.31.23.72 -> 172.31.31.144 TCP 66 40154 → 6633 [ACK] Seq=8409 Ack=1065 Win=384 Len=0 TSval=797815 TSecr=704975
171 0.692559068 172.31.31.144 -> 172.31.23.72 TCP 66 6633 → 40152 [ACK] Seq=1307 Ack=9615 Win=853 Len=0 TSval=704976 TSecr=797815
172 0.692827959 172.31.23.72 -> 172.31.31.144 OpenFlow 189 Type: OFPT_PACKET_IN
173 0.692899072 172.31.23.72 -> 172.31.31.144 OpenFlow 189 Type: OFPT_PACKET_IN
174 0.693076957 172.31.31.144 -> 172.31.23.72 TCP 66 6633 → 40156 [ACK] Seq=1065 Ack=7631 Win=853 Len=0 TSval=704976 TSecr=797815
175 0.693199282 172.31.23.72 -> 172.31.31.144 OpenFlow 189 Type: OFPT_PACKET_IN
176 0.693223671 172.31.23.72 -> 172.31.31.144 OpenFlow 189 Type: OFPT_PACKET_IN
177 0.693237212 172.31.23.72 -> 172.31.31.144 OpenFlow 189 Type: OFPT_PACKET_IN
178 0.693256505 172.31.23.72 -> 172.31.31.144 OpenFlow 189 Type: OFPT_PACKET_IN
179 0.693272000 172.31.23.72 -> 172.31.31.144 OpenFlow 189 Type: OFPT_PACKET_IN
180 0.693278092 172.31.23.72 -> 172.31.31.144 OpenFlow 435 Type: OFPT_PACKET_IN
181 0.693303612 172.31.23.72 -> 172.31.31.144 OpenFlow 189 Type: OFPT_PACKET_IN
182 0.693316477 172.31.23.72 -> 172.31.31.144 OpenFlow 189 Type: OFPT_PACKET_IN
183 0.693318734 172.31.23.72 -> 172.31.31.144 OpenFlow 189 Type: OFPT_PACKET_IN
184 0.693335432 172.31.23.72 -> 172.31.31.144 OpenFlow 189 Type: OFPT_PACKET_IN
185 0.693347955 172.31.23.72 -> 172.31.31.144 OpenFlow 189 Type: OFPT_PACKET_IN
186 0.693350160 172.31.23.72 -> 172.31.31.144 OpenFlow 435 Type: OFPT_PACKET_IN
187 0.693365341 172.31.23.72 -> 172.31.31.144 OpenFlow 189 Type: OFPT_PACKET_IN
188 0.693377979 172.31.23.72 -> 172.31.31.144 OpenFlow 189 Type: OFPT_PACKET_IN
189 0.693380222 172.31.23.72 -> 172.31.31.144 OpenFlow 435 Type: OFPT_PACKET_IN
190 0.693606908 172.31.23.72 -> 172.31.31.144 OpenFlow 435 Type: OFPT_PACKET_IN
191 0.693614004 172.31.23.72 -> 172.31.31.144 OpenFlow 189 Type: OFPT_PACKET_IN
192 0.693615816 172.31.23.72 -> 172.31.31.144 OpenFlow 189 Type: OFPT_PACKET_IN
193 0.693617512 172.31.23.72 -> 172.31.31.144 OpenFlow 189 Type: OFPT_PACKET_IN
194 0.693721384 172.31.23.72 -> 172.31.31.144 TCP 66 40140 → 6633 [ACK] Seq=9465 Ack=1065 Win=385 Len=0 TSval=797815 TSecr=704976
195 0.693725073 172.31.23.72 -> 172.31.31.144 OpenFlow 435 Type: OFPT_PACKET_IN
196 0.693727484 172.31.23.72 -> 172.31.31.144 OpenFlow 189 Type: OFPT_PACKET_IN
197 0.693782807 172.31.23.72 -> 172.31.31.144 OpenFlow 189 Type: OFPT_PACKET_IN
198 0.693786137 172.31.23.72 -> 172.31.31.144 OpenFlow 435 Type: OFPT_PACKET_IN
199 0.693830072 172.31.31.144 -> 172.31.23.72 TCP 66 6633 → 40190 [ACK] Seq=1 Ack=124 Win=853 Len=0 TSval=704976 TSecr=797815
200 0.693839879 172.31.31.144 -> 172.31.23.72 TCP 66 6633 → 40198 [ACK] Seq=1 Ack=124 Win=853 Len=0 TSval=704976 TSecr=797815
201 0.693842403 172.31.31.144 -> 172.31.23.72 TCP 66 6633 → 40188 [ACK] Seq=1 Ack=493 Win=853 Len=0 TSval=704976 TSecr=797815
202 0.693845066 172.31.31.144 -> 172.31.23.72 TCP 66 6633 → 40190 [ACK] Seq=1 Ack=247 Win=853 Len=0 TSval=704976 TSecr=797815
203 0.694089761 172.31.23.72 -> 172.31.31.144 OpenFlow 681 Type: OFPT_PACKET_IN
204 0.694162395 172.31.31.144 -> 172.31.23.72 TCP 66 6633 → 40214 [ACK] Seq=1 Ack=370 Win=853 Len=0 TSval=704976 TSecr=797815
205 0.694168896 172.31.31.144 -> 172.31.23.72 TCP 66 6633 → 40192 [ACK] Seq=1 Ack=493 Win=853 Len=0 TSval=704976 TSecr=797815
206 0.694171477 172.31.31.144 -> 172.31.23.72 TCP 66 6633 → 40198 [ACK] Seq=1 Ack=493 Win=853 Len=0 TSval=704976 TSecr=797815
207 0.694173827 172.31.31.144 -> 172.31.23.72 TCP 66 6633 → 40204 [ACK] Seq=1 Ack=247 Win=853 Len=0 TSval=704976 TSecr=797815
208 0.694176197 172.31.31.144 -> 172.31.23.72 TCP 66 6633 → 40210 [ACK] Seq=1 Ack=247 Win=853 Len=0 TSval=704976 TSecr=797815
209 0.694178240 172.31.31.144 -> 172.31.23.72 TCP 66 6633 → 40196 [ACK] Seq=1 Ack=493 Win=853 Len=0 TSval=704976 TSecr=797815
210 0.694180556 172.31.31.144 -> 172.31.23.72 TCP 66 6633 → 40212 [ACK] Seq=1 Ack=493 Win=853 Len=0 TSval=704976 TSecr=797815
211 0.694197925 172.31.31.144 -> 172.31.23.72 TCP 66 6633 → 40206 [ACK] Seq=1 Ack=247 Win=853 Len=0 TSval=704976 TSecr=797815
212 0.694201289 172.31.31.144 -> 172.31.23.72 TCP 66 6633 → 40214 [ACK] Seq=1 Ack=493 Win=853 Len=0 TSval=704976 TSecr=797815
213 0.694220891 172.31.23.72 -> 172.31.31.144 OpenFlow 189 Type: OFPT_PACKET_IN
214 0.694241642 172.31.23.72 -> 172.31.31.144 OpenFlow 189 Type: OFPT_PACKET_IN
215 0.694249959 172.31.23.72 -> 172.31.31.144 OpenFlow 189 Type: OFPT_PACKET_IN
216 0.694264433 172.31.23.72 -> 172.31.31.144 OpenFlow 189 Type: OFPT_PACKET_IN
217 0.694279322 172.31.23.72 -> 172.31.31.144 OpenFlow 189 Type: OFPT_PACKET_IN
218 0.694286330 172.31.31.144 -> 172.31.23.72 TCP 66 6633 → 40216 [ACK] Seq=1 Ack=493 Win=853 Len=0 TSval=704976 TSecr=797815
219 0.694301897 172.31.23.72 -> 172.31.31.144 OpenFlow 189 Type: OFPT_PACKET_IN
220 0.694307505 172.31.23.72 -> 172.31.31.144 OpenFlow 189 Type: OFPT_PACKET_IN
221 0.694320553 172.31.23.72 -> 172.31.31.144 OpenFlow 189 Type: OFPT_PACKET_IN
222 0.694332438 172.31.23.72 -> 172.31.31.144 OpenFlow 189 Type: OFPT_PACKET_IN
223 0.694343093 172.31.23.72 -> 172.31.31.144 OpenFlow 189 Type: OFPT_PACKET_IN
224 0.694384982 172.31.23.72 -> 172.31.31.144 OpenFlow 189 Type: OFPT_PACKET_IN
225 0.694387410 172.31.23.72 -> 172.31.31.144 OpenFlow 189 Type: OFPT_PACKET_IN
226 0.694389174 172.31.23.72 -> 172.31.31.144 OpenFlow 189 Type: OFPT_PACKET_IN
227 0.694405843 172.31.23.72 -> 172.31.31.144 OpenFlow 189 Type: OFPT_PACKET_IN
228 0.694461323 172.31.31.144 -> 172.31.23.72 TCP 66 6633 → 40142 [ACK] Seq=1065 Ack=8955 Win=853 Len=0 TSval=704976 TSecr=797815
229 0.694466454 172.31.31.144 -> 172.31.23.72 TCP 66 6633 → 40144 [ACK] Seq=823 Ack=7604 Win=853 Len=0 TSval=704976 TSecr=797815
230 0.694468514 172.31.31.144 -> 172.31.23.72 TCP 66 6633 → 40146 [ACK] Seq=1065 Ack=8756 Win=853 Len=0 TSval=704976 TSecr=797815
231 0.694471014 172.31.31.144 -> 172.31.23.72 TCP 66 6633 → 40144 [ACK] Seq=823 Ack=7727 Win=853 Len=0 TSval=704976 TSecr=797815
232 0.694615197 172.31.23.72 -> 172.31.31.144 OpenFlow 189 Type: OFPT_PACKET_IN
233 0.694620220 172.31.23.72 -> 172.31.31.144 OpenFlow 189 Type: OFPT_PACKET_IN
234 0.694621913 172.31.23.72 -> 172.31.31.144 OpenFlow 189 Type: OFPT_PACKET_IN
235 0.694623550 172.31.23.72 -> 172.31.31.144 OpenFlow 189 Type: OFPT_PACKET_IN
236 0.694824836 172.31.31.144 -> 172.31.23.72 TCP 66 6633 → 40148 [ACK] Seq=1307 Ack=9492 Win=853 Len=0 TSval=704977 TSecr=797815
237 0.694829983 172.31.31.144 -> 172.31.23.72 TCP 66 6633 → 40152 [ACK] Seq=1307 Ack=9738 Win=853 Len=0 TSval=704977 TSecr=797815
238 0.694831853 172.31.31.144 -> 172.31.23.72 TCP 66 6633 → 40146 [ACK] Seq=1065 Ack=8879 Win=853 Len=0 TSval=704977 TSecr=797815
239 0.694833710 172.31.31.144 -> 172.31.23.72 TCP 66 6633 → 40156 [ACK] Seq=1065 Ack=7754 Win=853 Len=0 TSval=704977 TSecr=797815
240 0.694835636 172.31.31.144 -> 172.31.23.72 TCP 66 6633 → 40190 [ACK] Seq=1 Ack=370 Win=853 Len=0 TSval=704977 TSecr=797815
241 0.694837479 172.31.31.144 -> 172.31.23.72 TCP 66 6633 → 40208 [ACK] Seq=1 Ack=204 Win=853 Len=0 TSval=704977 TSecr=797814
242 0.694842195 172.31.23.72 -> 172.31.31.144 OpenFlow 189 Type: OFPT_PACKET_IN
243 0.694850663 172.31.23.72 -> 172.31.31.144 OpenFlow 189 Type: OFPT_PACKET_IN
244 0.694955793 172.31.31.144 -> 172.31.23.72 TCP 66 6633 → 40152 [ACK] Seq=1307 Ack=9861 Win=853 Len=0 TSval=704977 TSecr=797815
245 0.695051423 172.31.31.144 -> 172.31.23.72 TCP 66 6633 → 40190 [ACK] Seq=1 Ack=493 Win=853 Len=0 TSval=704977 TSecr=797815
246 0.695281002 172.31.31.144 -> 172.31.23.72 TCP 66 6633 → 40148 [ACK] Seq=1307 Ack=9615 Win=853 Len=0 TSval=704977 TSecr=797815
247 0.695297827 172.31.31.144 -> 172.31.23.72 TCP 66 6633 → 40212 [ACK] Seq=1 Ack=739 Win=853 Len=0 TSval=704977 TSecr=797815
248 0.695678374 172.31.31.144 -> 172.31.23.72 TCP 66 6633 → 40188 [ACK] Seq=1 Ack=739 Win=853 Len=0 TSval=704977 TSecr=797815
249 0.695694088 172.31.31.144 -> 172.31.23.72 TCP 66 6633 → 40156 [ACK] Seq=1065 Ack=7877 Win=853 Len=0 TSval=704977 TSecr=797815
250 0.695768939 172.31.31.144 -> 172.31.23.72 TCP 66 6633 → 40154 [ACK] Seq=1065 Ack=8655 Win=853 Len=0 TSval=704977 TSecr=797815
251 0.734624586 172.31.31.144 -> 172.31.23.72 TCP 66 6633 → 40208 [ACK] Seq=1 Ack=327 Win=853 Len=0 TSval=704987 TSecr=797816
252 0.870906664 137.158.125.247 -> 172.31.23.72 TCP 54 52508 → 22 [ACK] Seq=1 Ack=97 Win=32386 Len=0
253 0.872523100 172.31.31.144 -> 172.31.23.72 OpenFlow 146 Type: OFPT_FLOW_MOD
254 0.872534021 172.31.31.144 -> 172.31.23.72 OpenFlow 154 Type: OFPT_BARRIER_REQUEST
255 0.872546090 172.31.31.144 -> 172.31.23.72 OpenFlow 146 Type: OFPT_FLOW_MOD
256 0.872560338 172.31.31.144 -> 172.31.23.72 OpenFlow 154 Type: OFPT_BARRIER_REQUEST
257 0.872578884 172.31.31.144 -> 172.31.23.72 OpenFlow 146 Type: OFPT_FLOW_MOD
258 0.872598877 172.31.31.144 -> 172.31.23.72 OpenFlow 146 Type: OFPT_FLOW_MOD
259 0.872617308 172.31.31.144 -> 172.31.23.72 OpenFlow 234 Type: OFPT_FLOW_MOD
260 0.872636275 172.31.31.144 -> 172.31.23.72 OpenFlow 146 Type: OFPT_FLOW_MOD
261 0.872655629 172.31.31.144 -> 172.31.23.72 OpenFlow 146 Type: OFPT_FLOW_MOD
262 0.872675305 172.31.31.144 -> 172.31.23.72 OpenFlow 154 Type: OFPT_BARRIER_REQUEST
263 0.872694685 172.31.31.144 -> 172.31.23.72 OpenFlow 146 Type: OFPT_FLOW_MOD
264 0.872713339 172.31.31.144 -> 172.31.23.72 OpenFlow 154 Type: OFPT_BARRIER_REQUEST
265 0.872734774 172.31.31.144 -> 172.31.23.72 OpenFlow 154 Type: OFPT_BARRIER_REQUEST
266 0.872755419 172.31.31.144 -> 172.31.23.72 OpenFlow 146 Type: OFPT_FLOW_MOD
267 0.872819424 172.31.23.72 -> 172.31.31.144 OpenFlow 74 Type: OFPT_BARRIER_REPLY
268 0.872828128 172.31.31.144 -> 172.31.23.72 OpenFlow 146 Type: OFPT_FLOW_MOD
269 0.872831071 172.31.31.144 -> 172.31.23.72 OpenFlow 146 Type: OFPT_FLOW_MOD
270 0.872833705 172.31.31.144 -> 172.31.23.72 OpenFlow 146 Type: OFPT_FLOW_MOD
271 0.872835401 172.31.31.144 -> 172.31.23.72 OpenFlow 146 Type: OFPT_FLOW_MOD
272 0.872837373 172.31.31.144 -> 172.31.23.72 OpenFlow 234 Type: OFPT_BARRIER_REQUEST
273 0.872845049 172.31.31.144 -> 172.31.23.72 OpenFlow 74 Type: OFPT_BARRIER_REQUEST
274 0.872846722 172.31.31.144 -> 172.31.23.72 OpenFlow 146 Type: OFPT_FLOW_MOD
275 0.872870505 172.31.31.144 -> 172.31.23.72 OpenFlow 146 Type: OFPT_FLOW_MOD
276 0.872901269 172.31.31.144 -> 172.31.23.72 OpenFlow 146 Type: OFPT_FLOW_MOD
277 0.872914315 172.31.23.72 -> 172.31.31.144 TCP 66 40146 → 6633 [ACK] Seq=8879 Ack=1233 Win=384 Len=0 TSval=797860 TSecr=705021
278 0.872924343 172.31.31.144 -> 172.31.23.72 OpenFlow 154 Type: OFPT_BARRIER_REQUEST
279 0.872932314 172.31.23.72 -> 172.31.31.144 OpenFlow 74 Type: OFPT_BARRIER_REPLY
280 0.872966872 172.31.31.144 -> 172.31.23.72 OpenFlow 242 Type: OFPT_BARRIER_REQUEST
281 0.872970215 172.31.31.144 -> 172.31.23.72 OpenFlow 146 Type: OFPT_FLOW_MOD
282 0.872994254 172.31.31.144 -> 172.31.23.72 OpenFlow 146 Type: OFPT_FLOW_MOD
283 0.873005945 172.31.31.144 -> 172.31.23.72 OpenFlow 146 Type: OFPT_FLOW_MOD
284 0.873015359 172.31.23.72 -> 172.31.31.144 OpenFlow 74 Type: OFPT_BARRIER_REPLY
285 0.873025762 172.31.31.144 -> 172.31.23.72 OpenFlow 146 Type: OFPT_FLOW_MOD
286 0.873067431 172.31.23.72 -> 172.31.31.144 TCP 66 40152 → 6633 [ACK] Seq=9861 Ack=1475 Win=385 Len=0 TSval=797860 TSecr=705021
287 0.873075160 172.31.23.72 -> 172.31.31.144 OpenFlow 74 Type: OFPT_BARRIER_REPLY
288 0.873079633 172.31.31.144 -> 172.31.23.72 OpenFlow 74 Type: OFPT_BARRIER_REQUEST
289 0.873081949 172.31.31.144 -> 172.31.23.72 OpenFlow 242 Type: OFPT_BARRIER_REQUEST
290 0.873109977 172.31.23.72 -> 172.31.31.144 OpenFlow 74 Type: OFPT_BARRIER_REPLY
291 0.873194753 172.31.31.144 -> 172.31.23.72 OpenFlow 146 Type: OFPT_FLOW_MOD
292 0.873202211 172.31.31.144 -> 172.31.23.72 TCP 66 6633 → 40146 [ACK] Seq=1233 Ack=8887 Win=853 Len=0 TSval=705021 TSecr=797860
293 0.873205406 172.31.31.144 -> 172.31.23.72 OpenFlow 74 Type: OFPT_BARRIER_REQUEST
294 0.873206750 172.31.31.144 -> 172.31.23.72 OpenFlow 322 Type: OFPT_BARRIER_REQUEST
295 0.873209011 172.31.31.144 -> 172.31.23.72 OpenFlow 74 Type: OFPT_BARRIER_REQUEST
296 0.873215126 172.31.23.72 -> 172.31.31.144 OpenFlow 82 Type: OFPT_BARRIER_REPLY
297 0.873224071 172.31.31.144 -> 172.31.23.72 OpenFlow 146 Type: OFPT_FLOW_MOD
298 0.873225871 172.31.31.144 -> 172.31.23.72 OpenFlow 74 Type: OFPT_BARRIER_REQUEST
299 0.873270238 172.31.23.72 -> 172.31.31.144 OpenFlow 74 Type: OFPT_BARRIER_REPLY
300 0.873278328 172.31.31.144 -> 172.31.23.72 TCP 66 6633 → 40150 [ACK] Seq=1643 Ack=9623 Win=853 Len=0 TSval=705021 TSecr=797860
301 0.873299780 172.31.23.72 -> 172.31.31.144 OpenFlow 74 Type: OFPT_BARRIER_REPLY
302 0.873336829 172.31.31.144 -> 172.31.23.72 TCP 66 6633 → 40152 [ACK] Seq=1475 Ack=9869 Win=853 Len=0 TSval=705021 TSecr=797860
303 0.873386974 172.31.31.144 -> 172.31.23.72 TCP 66 6633 → 40154 [ACK] Seq=1569 Ack=8679 Win=853 Len=0 TSval=705021 TSecr=797860
304 0.873415638 172.31.23.72 -> 172.31.31.144 TCP 66 40206 → 6633 [ACK] Seq=247 Ack=169 Win=402 Len=0 TSval=797860 TSecr=705021
305 0.873423508 172.31.23.72 -> 172.31.31.144 OpenFlow 74 Type: OFPT_BARRIER_REPLY
306 0.873447724 172.31.23.72 -> 172.31.31.144 OpenFlow 74 Type: OFPT_BARRIER_REPLY
307 0.873480224 172.31.31.144 -> 172.31.23.72 TCP 66 6633 → 40188 [ACK] Seq=337 Ack=755 Win=853 Len=0 TSval=705021 TSecr=797860
308 0.873485814 172.31.23.72 -> 172.31.31.144 OpenFlow 82 Type: OFPT_BARRIER_REPLY
309 0.873542103 172.31.23.72 -> 172.31.31.144 OpenFlow 74 Type: OFPT_BARRIER_REPLY
310 0.873565399 172.31.23.72 -> 172.31.31.144 OpenFlow 74 Type: OFPT_BARRIER_REPLY
311 0.873643214 172.31.31.144 -> 172.31.23.72 TCP 66 6633 → 40208 [ACK] Seq=505 Ack=335 Win=853 Len=0 TSval=705021 TSecr=797860
312 0.873660051 172.31.31.144 -> 172.31.23.72 TCP 66 6633 → 40208 [ACK] Seq=505 Ack=351 Win=853 Len=0 TSval=705021 TSecr=797860
313 0.873739686 172.31.23.72 -> 172.31.31.144 OpenFlow 146 Type: OFPT_FLOW_REMOVED
314 0.873750296 172.31.31.144 -> 172.31.23.72 TCP 66 6633 → 40216 [ACK] Seq=337 Ack=509 Win=853 Len=0 TSval=705021 TSecr=797860
315 0.873765255 172.31.23.72 -> 172.31.31.144 OpenFlow 146 Type: OFPT_FLOW_REMOVED
316 0.873785007 172.31.23.72 -> 172.31.31.144 OpenFlow 146 Type: OFPT_FLOW_REMOVED
317 0.873792584 172.31.23.72 -> 172.31.31.144 OpenFlow 146 Type: OFPT_FLOW_REMOVED
318 0.873797420 172.31.23.72 -> 172.31.31.144 OpenFlow 146 Type: OFPT_FLOW_REMOVED
319 0.873813176 172.31.23.72 -> 172.31.31.144 OpenFlow 146 Type: OFPT_FLOW_REMOVED
320 0.873817947 172.31.23.72 -> 172.31.31.144 OpenFlow 226 Type: OFPT_FLOW_REMOVED
321 0.873826067 172.31.23.72 -> 172.31.31.144 OpenFlow 146 Type: OFPT_FLOW_REMOVED
322 0.873842365 172.31.23.72 -> 172.31.31.144 OpenFlow 146 Type: OFPT_FLOW_REMOVED
323 0.873844323 172.31.23.72 -> 172.31.31.144 OpenFlow 146 Type: OFPT_FLOW_REMOVED
324 0.873855864 172.31.23.72 -> 172.31.31.144 OpenFlow 146 Type: OFPT_FLOW_REMOVED
325 0.873863481 172.31.23.72 -> 172.31.31.144 OpenFlow 146 Type: OFPT_FLOW_REMOVED
326 0.873881754 172.31.23.72 -> 172.31.31.144 OpenFlow 146 Type: OFPT_FLOW_REMOVED
327 0.873951093 172.31.31.144 -> 172.31.23.72 TCP 66 6633 → 40142 [ACK] Seq=1569 Ack=9123 Win=853 Len=0 TSval=705021 TSecr=797860
328 0.873958003 172.31.23.72 -> 172.31.31.144 OpenFlow 306 Type: OFPT_FLOW_REMOVED
329 0.874050274 172.31.23.72 -> 172.31.31.144 OpenFlow 146 Type: OFPT_FLOW_REMOVED
330 0.874052425 172.31.23.72 -> 172.31.31.144 OpenFlow 466 Type: OFPT_FLOW_REMOVED
331 0.874054041 172.31.23.72 -> 172.31.31.144 OpenFlow 306 Type: OFPT_FLOW_REMOVED
332 0.874130968 172.31.31.144 -> 172.31.23.72 TCP 66 6633 → 40146 [ACK] Seq=1233 Ack=8967 Win=853 Len=0 TSval=705021 TSecr=797860
333 0.874134363 172.31.31.144 -> 172.31.23.72 TCP 66 6633 → 40150 [ACK] Seq=1643 Ack=9703 Win=853 Len=0 TSval=705021 TSecr=797860
334 0.874136107 172.31.31.144 -> 172.31.23.72 TCP 66 6633 → 40148 [ACK] Seq=1475 Ack=9695 Win=853 Len=0 TSval=705021 TSecr=797860
335 0.874140723 172.31.23.72 -> 172.31.31.144 OpenFlow 146 Type: OFPT_FLOW_REMOVED
336 0.874154889 172.31.23.72 -> 172.31.31.144 OpenFlow 466 Type: OFPT_FLOW_REMOVED
337 0.874156690 172.31.23.72 -> 172.31.31.144 OpenFlow 306 Type: OFPT_FLOW_REMOVED
338 0.874239803 172.31.31.144 -> 172.31.23.72 TCP 66 6633 → 40152 [ACK] Seq=1475 Ack=9949 Win=853 Len=0 TSval=705021 TSecr=797860
339 0.874242801 172.31.31.144 -> 172.31.23.72 TCP 66 6633 → 40146 [ACK] Seq=1233 Ack=9047 Win=853 Len=0 TSval=705021 TSecr=797860
340 0.874334680 172.31.31.144 -> 172.31.23.72 TCP 66 6633 → 40206 [ACK] Seq=169 Ack=335 Win=853 Len=0 TSval=705021 TSecr=797860
341 0.874337788 172.31.31.144 -> 172.31.23.72 TCP 66 6633 → 40208 [ACK] Seq=505 Ack=431 Win=853 Len=0 TSval=705021 TSecr=797860
342 0.874339775 172.31.31.144 -> 172.31.23.72 TCP 66 6633 → 40150 [ACK] Seq=1643 Ack=9943 Win=853 Len=0 TSval=705021 TSecr=797860
343 0.874341694 172.31.31.144 -> 172.31.23.72 TCP 66 6633 → 40152 [ACK] Seq=1475 Ack=10029 Win=853 Len=0 TSval=705021 TSecr=797860
344 0.874345920 172.31.31.144 -> 172.31.23.72 TCP 66 6633 → 40154 [ACK] Seq=1569 Ack=9159 Win=853 Len=0 TSval=705021 TSecr=797860
345 0.874414514 172.31.31.144 -> 172.31.23.72 TCP 66 6633 → 40188 [ACK] Seq=337 Ack=1075 Win=853 Len=0 TSval=705021 TSecr=797860
346 0.874432635 172.31.31.144 -> 172.31.23.72 TCP 66 6633 → 40208 [ACK] Seq=505 Ack=831 Win=853 Len=0 TSval=705021 TSecr=797860
347 0.874451011 172.31.31.144 -> 172.31.23.72 TCP 66 6633 → 40216 [ACK] Seq=337 Ack=829 Win=853 Len=0 TSval=705021 TSecr=797860
348 0.876292567 172.31.23.72 -> 172.31.31.144 OpenFlow 74 Type: OFPT_BARRIER_REPLY
349 0.876317925 172.31.23.72 -> 172.31.31.144 OpenFlow 74 Type: OFPT_BARRIER_REPLY
350 0.876350960 172.31.23.72 -> 172.31.31.144 OpenFlow 74 Type: OFPT_BARRIER_REPLY
351 0.876366087 172.31.23.72 -> 172.31.31.144 OpenFlow 74 Type: OFPT_BARRIER_REPLY
352 0.876483834 172.31.31.144 -> 172.31.23.72 TCP 66 6633 → 40142 [ACK] Seq=1569 Ack=9299 Win=853 Len=0 TSval=705022 TSecr=797860
353 0.876564503 172.31.31.144 -> 172.31.23.72 TCP 66 6633 → 40150 [ACK] Seq=1643 Ack=9951 Win=853 Len=0 TSval=705022 TSecr=797861
354 0.876605371 172.31.23.72 -> 172.31.31.144 OpenFlow 146 Type: OFPT_FLOW_REMOVED
355 0.876618996 172.31.23.72 -> 172.31.31.144 OpenFlow 146 Type: OFPT_FLOW_REMOVED
356 0.876624605 172.31.31.144 -> 172.31.23.72 TCP 66 6633 → 40148 [ACK] Seq=1475 Ack=9703 Win=853 Len=0 TSval=705022 TSecr=797861
357 0.876649856 172.31.23.72 -> 172.31.31.144 OpenFlow 146 Type: OFPT_FLOW_REMOVED
358 0.876786101 172.31.31.144 -> 172.31.23.72 TCP 66 6633 → 40142 [ACK] Seq=1569 Ack=9459 Win=853 Len=0 TSval=705022 TSecr=797861
359 0.876803182 172.31.31.144 -> 172.31.23.72 TCP 66 6633 → 40148 [ACK] Seq=1475 Ack=9783 Win=853 Len=0 TSval=705022 TSecr=797861
360 0.876842043 172.31.31.144 -> 172.31.23.72 OpenFlow 170 Type: OFPT_FLOW_MOD
361 0.876871637 172.31.31.144 -> 172.31.23.72 OpenFlow 178 Type: OFPT_BARRIER_REQUEST
362 0.876962022 172.31.31.144 -> 172.31.23.72 OpenFlow 170 Type: OFPT_FLOW_MOD
363 0.876979008 172.31.31.144 -> 172.31.23.72 OpenFlow 178 Type: OFPT_BARRIER_REQUEST
364 0.877025990 172.31.31.144 -> 172.31.23.72 OpenFlow 170 Type: OFPT_FLOW_MOD
365 0.877065037 172.31.31.144 -> 172.31.23.72 OpenFlow 170 Type: OFPT_FLOW_MOD
366 0.877083014 172.31.31.144 -> 172.31.23.72 OpenFlow 170 Type: OFPT_FLOW_MOD
367 0.877101858 172.31.31.144 -> 172.31.23.72 OpenFlow 170 Type: OFPT_FLOW_MOD
368 0.877120196 172.31.31.144 -> 172.31.23.72 OpenFlow 74 Type: OFPT_BARRIER_REQUEST
369 0.877138546 172.31.31.144 -> 172.31.23.72 OpenFlow 170 Type: OFPT_FLOW_MOD
370 0.877156322 172.31.31.144 -> 172.31.23.72 OpenFlow 170 Type: OFPT_FLOW_MOD
371 0.877176687 172.31.31.144 -> 172.31.23.72 OpenFlow 282 Type: OFPT_FLOW_MOD
372 0.877196924 172.31.31.144 -> 172.31.23.72 OpenFlow 178 Type: OFPT_BARRIER_REQUEST
373 0.877198877 172.31.31.144 -> 172.31.23.72 OpenFlow 170 Type: OFPT_FLOW_MOD
374 0.877215092 172.31.31.144 -> 172.31.23.72 OpenFlow 170 Type: OFPT_FLOW_MOD
375 0.877233372 172.31.31.144 -> 172.31.23.72 OpenFlow 170 Type: OFPT_FLOW_MOD
376 0.877266759 172.31.31.144 -> 172.31.23.72 OpenFlow 170 Type: OFPT_FLOW_MOD
377 0.877328294 172.31.31.144 -> 172.31.23.72 OpenFlow 74 Type: OFPT_BARRIER_REQUEST
378 0.877330565 172.31.31.144 -> 172.31.23.72 OpenFlow 170 Type: OFPT_FLOW_MOD
379 0.877332279 172.31.31.144 -> 172.31.23.72 OpenFlow 178 Type: OFPT_BARRIER_REQUEST
380 0.877333873 172.31.31.144 -> 172.31.23.72 OpenFlow 74 Type: OFPT_BARRIER_REQUEST
381 0.877335148 172.31.31.144 -> 172.31.23.72 OpenFlow 170 Type: OFPT_FLOW_MOD
382 0.877345426 172.31.31.144 -> 172.31.23.72 OpenFlow 170 Type: OFPT_FLOW_MOD
383 0.877364874 172.31.31.144 -> 172.31.23.72 OpenFlow 282 Type: OFPT_BARRIER_REQUEST
384 0.877384156 172.31.31.144 -> 172.31.23.72 OpenFlow 170 Type: OFPT_FLOW_MOD
385 0.877402544 172.31.31.144 -> 172.31.23.72 OpenFlow 74 Type: OFPT_BARRIER_REQUEST
386 0.877421428 172.31.31.144 -> 172.31.23.72 OpenFlow 170 Type: OFPT_FLOW_MOD
387 0.877440876 172.31.31.144 -> 172.31.23.72 OpenFlow 170 Type: OFPT_FLOW_MOD
388 0.877460765 172.31.31.144 -> 172.31.23.72 OpenFlow 170 Type: OFPT_FLOW_MOD
389 0.877479553 172.31.31.144 -> 172.31.23.72 OpenFlow 178 Type: OFPT_BARRIER_REQUEST
390 0.877498327 172.31.31.144 -> 172.31.23.72 OpenFlow 178 Type: OFPT_BARRIER_REQUEST
391 0.877517021 172.31.31.144 -> 172.31.23.72 OpenFlow 170 Type: OFPT_FLOW_MOD
392 0.877535101 172.31.31.144 -> 172.31.23.72 OpenFlow 74 Type: OFPT_BARRIER_REQUEST
393 0.877554178 172.31.31.144 -> 172.31.23.72 OpenFlow 170 Type: OFPT_FLOW_MOD
394 0.877572938 172.31.31.144 -> 172.31.23.72 OpenFlow 170 Type: OFPT_FLOW_MOD
395 0.877602902 172.31.31.144 -> 172.31.23.72 OpenFlow 74 Type: OFPT_BARRIER_REQUEST
396 0.877621573 172.31.31.144 -> 172.31.23.72 OpenFlow 170 Type: OFPT_FLOW_MOD
397 0.877640452 172.31.31.144 -> 172.31.23.72 OpenFlow 170 Type: OFPT_FLOW_MOD
398 0.877688203 172.31.31.144 -> 172.31.23.72 OpenFlow 74 Type: OFPT_BARRIER_REQUEST
399 0.877690220 172.31.31.144 -> 172.31.23.72 OpenFlow 394 Type: OFPT_BARRIER_REQUEST
400 0.877699621 172.31.31.144 -> 172.31.23.72 OpenFlow 74 Type: OFPT_BARRIER_REQUEST
401 0.877721695 172.31.31.144 -> 172.31.23.72 OpenFlow 170 Type: OFPT_FLOW_MOD
402 0.877740303 172.31.31.144 -> 172.31.23.72 OpenFlow 178 Type: OFPT_BARRIER_REQUEST
403 0.877759070 172.31.31.144 -> 172.31.23.72 OpenFlow 178 Type: OFPT_BARRIER_REQUEST
404 0.878423372 172.31.23.72 -> 172.31.31.144 OpenFlow 74 Type: OFPT_BARRIER_REPLY
405 0.878447825 172.31.23.72 -> 172.31.31.144 OpenFlow 74 Type: OFPT_BARRIER_REPLY
406 0.878488392 172.31.23.72 -> 172.31.31.144 TCP 66 40146 → 6633 [ACK] Seq=9047 Ack=1449 Win=384 Len=0 TSval=797861 TSecr=705022
407 0.878496108 172.31.23.72 -> 172.31.31.144 OpenFlow 74 Type: OFPT_BARRIER_REPLY
408 0.878532907 172.31.23.72 -> 172.31.31.144 TCP 66 40148 → 6633 [ACK] Seq=9783 Ack=1691 Win=612 Len=0 TSval=797861 TSecr=705022
409 0.878539988 172.31.23.72 -> 172.31.31.144 OpenFlow 74 Type: OFPT_BARRIER_REPLY
410 0.878560040 172.31.23.72 -> 172.31.31.144 TCP 66 40150 → 6633 [ACK] Seq=9951 Ack=1859 Win=386 Len=0 TSval=797861 TSecr=705022
411 0.878567594 172.31.23.72 -> 172.31.31.144 OpenFlow 74 Type: OFPT_BARRIER_REPLY
412 0.878592463 172.31.31.144 -> 172.31.23.72 TCP 66 6633 → 40140 [ACK] Seq=1497 Ack=9473 Win=853 Len=0 TSval=705023 TSecr=797861
413 0.878598957 172.31.23.72 -> 172.31.31.144 OpenFlow 74 Type: OFPT_BARRIER_REPLY
414 0.878642686 172.31.31.144 -> 172.31.23.72 TCP 66 6633 → 40140 [ACK] Seq=1497 Ack=9481 Win=853 Len=0 TSval=705023 TSecr=797861
415 0.878648904 172.31.23.72 -> 172.31.31.144 OpenFlow 74 Type: OFPT_BARRIER_REPLY
416 0.878678612 172.31.23.72 -> 172.31.31.144 TCP 66 40156 → 6633 [ACK] Seq=7877 Ack=1281 Win=213 Len=0 TSval=797861 TSecr=705022
417 0.878686531 172.31.23.72 -> 172.31.31.144 OpenFlow 74 Type: OFPT_BARRIER_REPLY
418 0.878707924 172.31.23.72 -> 172.31.31.144 TCP 66 40188 → 6633 [ACK] Seq=1075 Ack=553 Win=213 Len=0 TSval=797861 TSecr=705022
419 0.878715761 172.31.23.72 -> 172.31.31.144 OpenFlow 74 Type: OFPT_BARRIER_REPLY
420 0.878765980 172.31.23.72 -> 172.31.31.144 TCP 66 40190 → 6633 [ACK] Seq=493 Ack=217 Win=385 Len=0 TSval=797862 TSecr=705022
421 0.878774491 172.31.23.72 -> 172.31.31.144 OpenFlow 74 Type: OFPT_BARRIER_REPLY
422 0.878802694 172.31.23.72 -> 172.31.31.144 TCP 66 40194 → 6633 [ACK] Seq=247 Ack=217 Win=385 Len=0 TSval=797862 TSecr=705022
423 0.878811008 172.31.23.72 -> 172.31.31.144 OpenFlow 74 Type: OFPT_BARRIER_REPLY
424 0.878832815 172.31.23.72 -> 172.31.31.144 TCP 66 40196 → 6633 [ACK] Seq=493 Ack=217 Win=213 Len=0 TSval=797862 TSecr=705022
425 0.878837466 172.31.23.72 -> 172.31.31.144 OpenFlow 74 Type: OFPT_BARRIER_REPLY
426 0.878850825 172.31.31.144 -> 172.31.23.72 TCP 66 6633 → 40152 [ACK] Seq=1907 Ack=10045 Win=853 Len=0 TSval=705023 TSecr=797861
427 0.878869611 172.31.23.72 -> 172.31.31.144 TCP 66 40198 → 6633 [ACK] Seq=493 Ack=217 Win=385 Len=0 TSval=797862 TSecr=705022
428 0.878878554 172.31.23.72 -> 172.31.31.144 OpenFlow 74 Type: OFPT_BARRIER_REPLY
429 0.878908760 172.31.23.72 -> 172.31.31.144 TCP 66 40204 → 6633 [ACK] Seq=247 Ack=217 Win=311 Len=0 TSval=797862 TSecr=705022
430 0.878925342 172.31.23.72 -> 172.31.31.144 OpenFlow 74 Type: OFPT_BARRIER_REPLY
431 0.878933745 172.31.31.144 -> 172.31.23.72 TCP 66 6633 → 40156 [ACK] Seq=1281 Ack=7885 Win=853 Len=0 TSval=705023 TSecr=797861
432 0.878956342 172.31.23.72 -> 172.31.31.144 TCP 66 40206 → 6633 [ACK] Seq=415 Ack=385 Win=402 Len=0 TSval=797862 TSecr=705022
433 0.878964878 172.31.23.72 -> 172.31.31.144 OpenFlow 74 Type: OFPT_BARRIER_REPLY
434 0.878986500 172.31.23.72 -> 172.31.31.144 OpenFlow 74 Type: OFPT_BARRIER_REPLY
435 0.879015447 172.31.31.144 -> 172.31.23.72 TCP 66 6633 → 40190 [ACK] Seq=217 Ack=501 Win=853 Len=0 TSval=705023 TSecr=797862
436 0.879019336 172.31.31.144 -> 172.31.23.72 TCP 66 6633 → 40194 [ACK] Seq=217 Ack=255 Win=853 Len=0 TSval=705023 TSecr=797862
437 0.879057114 172.31.23.72 -> 172.31.31.144 OpenFlow 82 Type: OFPT_BARRIER_REPLY
438 0.879079538 172.31.31.144 -> 172.31.23.72 TCP 66 6633 → 40198 [ACK] Seq=217 Ack=501 Win=853 Len=0 TSval=705023 TSecr=797862
439 0.879093849 172.31.23.72 -> 172.31.31.144 TCP 66 40212 → 6633 [ACK] Seq=739 Ack=217 Win=385 Len=0 TSval=797862 TSecr=705022
440 0.879101835 172.31.23.72 -> 172.31.31.144 OpenFlow 74 Type: OFPT_BARRIER_REPLY
441 0.879129220 172.31.23.72 -> 172.31.31.144 TCP 66 40216 → 6633 [ACK] Seq=829 Ack=553 Win=213 Len=0 TSval=797862 TSecr=705022
442 0.879140934 172.31.23.72 -> 172.31.31.144 OpenFlow 74 Type: OFPT_BARRIER_REPLY
443 0.879221156 172.31.31.144 -> 172.31.23.72 TCP 66 6633 → 40208 [ACK] Seq=1153 Ack=855 Win=853 Len=0 TSval=705023 TSecr=797862
444 0.918608494 172.31.31.144 -> 172.31.23.72 TCP 66 6633 → 40146 [ACK] Seq=1449 Ack=9055 Win=853 Len=0 TSval=705033 TSecr=797861
445 0.918626091 172.31.31.144 -> 172.31.23.72 TCP 66 6633 → 40212 [ACK] Seq=217 Ack=747 Win=853 Len=0 TSval=705033 TSecr=797862
446 0.918688800 172.31.31.144 -> 172.31.23.72 TCP 66 6633 → 40196 [ACK] Seq=217 Ack=501 Win=853 Len=0 TSval=705033 TSecr=797862
447 0.918767035 172.31.31.144 -> 172.31.23.72 TCP 66 6633 → 40204 [ACK] Seq=217 Ack=255 Win=853 Len=0 TSval=705033 TSecr=797862
448 0.918793089 172.31.31.144 -> 172.31.23.72 TCP 66 6633 → 40216 [ACK] Seq=553 Ack=837 Win=853 Len=0 TSval=705033 TSecr=797862
449 0.918838314 172.31.31.144 -> 172.31.23.72 TCP 66 6633 → 40206 [ACK] Seq=385 Ack=423 Win=853 Len=0 TSval=705033 TSecr=797862
450 0.918901514 172.31.31.144 -> 172.31.23.72 TCP 66 6633 → 40148 [ACK] Seq=1691 Ack=9791 Win=853 Len=0 TSval=705033 TSecr=797861
451 0.918972078 172.31.31.144 -> 172.31.23.72 TCP 66 6633 → 40188 [ACK] Seq=553 Ack=1083 Win=853 Len=0 TSval=705033 TSecr=797861
452 0.919028450 172.31.31.144 -> 172.31.23.72 TCP 66 6633 → 40150 [ACK] Seq=1859 Ack=9959 Win=853 Len=0 TSval=705033 TSecr=797861
453 1.169420545 172.31.23.72 -> 137.158.125.247 SSH 98 Server: Encrypted packet (len=44)
454 1.377706688 137.158.125.247 -> 172.31.23.72 TCP 54 52508 → 22 [ACK] Seq=1 Ack=141 Win=32364 Len=0
455 1.465645743 172.31.31.144 -> 172.31.23.72 OpenFlow 82 Type: OFPT_MULTIPART_REQUEST, OFPMP_TABLE
456 1.465671214 172.31.31.144 -> 172.31.23.72 OpenFlow 122 Type: OFPT_MULTIPART_REQUEST, OFPMP_FLOW
457 1.465713883 172.31.31.144 -> 172.31.23.72 OpenFlow 106 Type: OFPT_MULTIPART_REQUEST, OFPMP_PORT_STATS
458 1.465718554 172.31.31.144 -> 172.31.23.72 OpenFlow 146 Type: OFPT_MULTIPART_REQUEST, OFPMP_FLOW
459 1.466052580 172.31.23.72 -> 172.31.31.144 OpenFlow 6178 Type: OFPT_MULTIPART_REPLY, OFPMP_TABLE
460 1.466185636 172.31.23.72 -> 172.31.31.144 OpenFlow 754 Type: OFPT_MULTIPART_REPLY, OFPMP_PORT_STATS
461 1.466255338 172.31.23.72 -> 172.31.31.144 OpenFlow 2010 Type: OFPT_MULTIPART_REPLY, OFPMP_FLOW
462 1.466340574 172.31.23.72 -> 172.31.31.144 OpenFlow 2634 Type: OFPT_MULTIPART_REPLY, OFPMP_FLOW
463 1.466406694 172.31.31.144 -> 172.31.23.72 TCP 66 6633 → 40188 [ACK] Seq=649 Ack=7195 Win=853 Len=0 TSval=705169 TSecr=798008
464 1.466446398 172.31.31.144 -> 172.31.23.72 TCP 66 6633 → 40188 [ACK] Seq=649 Ack=7883 Win=853 Len=0 TSval=705169 TSecr=798008
465 1.466448747 172.31.31.144 -> 172.31.23.72 TCP 66 6633 → 40188 [ACK] Seq=649 Ack=9827 Win=853 Len=0 TSval=705169 TSecr=798008
466 1.466509626 172.31.23.72 -> 172.31.31.144 OpenFlow 6178 Type: OFPT_MULTIPART_REPLY, OFPMP_TABLE
467 1.466596848 172.31.23.72 -> 172.31.31.144 OpenFlow 642 Type: OFPT_MULTIPART_REPLY, OFPMP_PORT_STATS
468 1.466716434 172.31.31.144 -> 172.31.23.72 TCP 66 6633 → 40192 [ACK] Seq=97 Ack=9173 Win=853 Len=0 TSval=705170 TSecr=798008
469 1.467797057 172.31.31.144 -> 172.31.23.72 OpenFlow 90 Type: OFPT_MULTIPART_REQUEST, OFPMP_PORT_STATS
470 1.467992281 172.31.23.72 -> 172.31.31.144 OpenFlow 642 Type: OFPT_MULTIPART_REPLY, OFPMP_PORT_STATS
471 1.468236855 172.31.31.144 -> 172.31.23.72 TCP 66 6633 → 40204 [ACK] Seq=241 Ack=831 Win=853 Len=0 TSval=705170 TSecr=798009
472 1.468948100 172.31.31.144 -> 172.31.23.72 OpenFlow 122 Type: OFPT_MULTIPART_REQUEST, OFPMP_FLOW
473 1.468954042 172.31.31.144 -> 172.31.23.72 OpenFlow 82 Type: OFPT_MULTIPART_REQUEST, OFPMP_TABLE
474 1.469132480 172.31.23.72 -> 172.31.31.144 OpenFlow 2426 Type: OFPT_MULTIPART_REPLY, OFPMP_FLOW
475 1.469285762 172.31.23.72 -> 172.31.31.144 OpenFlow 6178 Type: OFPT_MULTIPART_REPLY, OFPMP_TABLE
476 1.469540529 172.31.31.144 -> 172.31.23.72 TCP 66 6633 → 40204 [ACK] Seq=313 Ack=9303 Win=853 Len=0 TSval=705170 TSecr=798009
477 1.475115168 172.31.31.144 -> 172.31.23.72 OpenFlow 90 Type: OFPT_MULTIPART_REQUEST, OFPMP_PORT_STATS
478 1.475121813 172.31.31.144 -> 172.31.23.72 OpenFlow 82 Type: OFPT_MULTIPART_REQUEST, OFPMP_TABLE
479 1.475189608 172.31.31.144 -> 172.31.23.72 OpenFlow 146 Type: OFPT_MULTIPART_REQUEST, OFPMP_PORT_STATS
480 1.475194300 172.31.31.144 -> 172.31.23.72 OpenFlow 138 Type: OFPT_MULTIPART_REQUEST, OFPMP_TABLE
481 1.475360943 172.31.23.72 -> 172.31.31.144 OpenFlow 6178 Type: OFPT_MULTIPART_REPLY, OFPMP_TABLE
482 1.475449775 172.31.23.72 -> 172.31.31.144 OpenFlow 3258 Type: OFPT_MULTIPART_REPLY, OFPMP_FLOW
483 1.475522694 172.31.23.72 -> 172.31.31.144 OpenFlow 530 Type: OFPT_MULTIPART_REPLY, OFPMP_PORT_STATS
484 1.475605053 172.31.23.72 -> 172.31.31.144 OpenFlow 530 Type: OFPT_MULTIPART_REPLY, OFPMP_PORT_STATS
485 1.475630659 172.31.31.144 -> 172.31.23.72 TCP 66 6633 → 40190 [ACK] Seq=313 Ack=6613 Win=853 Len=0 TSval=705172 TSecr=798011
486 1.475654248 172.31.31.144 -> 172.31.23.72 TCP 66 6633 → 40190 [ACK] Seq=313 Ack=9805 Win=853 Len=0 TSval=705172 TSecr=798011
487 1.475667054 172.31.31.144 -> 172.31.23.72 TCP 66 6633 → 40190 [ACK] Seq=313 Ack=10269 Win=853 Len=0 TSval=705172 TSecr=798011
488 1.475676379 172.31.23.72 -> 172.31.31.144 OpenFlow 1386 Type: OFPT_MULTIPART_REPLY, OFPMP_FLOW
489 1.475759132 172.31.31.144 -> 172.31.23.72 TCP 66 6633 → 40194 [ACK] Seq=313 Ack=719 Win=853 Len=0 TSval=705172 TSecr=798011
490 1.475822588 172.31.31.144 -> 172.31.23.72 TCP 66 6633 → 40194 [ACK] Seq=313 Ack=2039 Win=853 Len=0 TSval=705172 TSecr=798011
491 1.475838263 172.31.23.72 -> 172.31.31.144 OpenFlow 6178 Type: OFPT_MULTIPART_REPLY, OFPMP_TABLE
492 1.476048567 172.31.31.144 -> 172.31.23.72 TCP 66 6633 → 40194 [ACK] Seq=313 Ack=8151 Win=853 Len=0 TSval=705172 TSecr=798011
493 1.476309555 172.31.31.144 -> 172.31.23.72 OpenFlow 122 Type: OFPT_MULTIPART_REQUEST, OFPMP_FLOW
494 1.476314644 172.31.31.144 -> 172.31.23.72 OpenFlow 90 Type: OFPT_MULTIPART_REQUEST, OFPMP_PORT_STATS
495 1.476468242 172.31.23.72 -> 172.31.31.144 OpenFlow 554 Type: OFPT_MULTIPART_REPLY, OFPMP_FLOW
496 1.476541984 172.31.23.72 -> 172.31.31.144 OpenFlow 530 Type: OFPT_MULTIPART_REPLY, OFPMP_PORT_STATS
497 1.476701500 172.31.31.144 -> 172.31.23.72 TCP 66 6633 → 40214 [ACK] Seq=81 Ack=981 Win=853 Len=0 TSval=705172 TSecr=798011
498 1.476725337 172.31.31.144 -> 172.31.23.72 TCP 66 6633 → 40214 [ACK] Seq=81 Ack=1445 Win=853 Len=0 TSval=705172 TSecr=798011
499 1.477446120 172.31.31.144 -> 172.31.23.72 OpenFlow 82 Type: OFPT_MULTIPART_REQUEST, OFPMP_TABLE
500 1.477466446 172.31.31.144 -> 172.31.23.72 OpenFlow 122 Type: OFPT_MULTIPART_REQUEST, OFPMP_FLOW
501 1.477510432 172.31.31.144 -> 172.31.23.72 OpenFlow 106 Type: OFPT_MULTIPART_REQUEST, OFPMP_PORT_STATS
502 1.477624541 172.31.23.72 -> 172.31.31.144 OpenFlow 554 Type: OFPT_MULTIPART_REPLY, OFPMP_FLOW
503 1.477772120 172.31.23.72 -> 172.31.31.144 OpenFlow 6178 Type: OFPT_MULTIPART_REPLY, OFPMP_TABLE
504 1.477786535 172.31.31.144 -> 172.31.23.72 TCP 66 6633 → 40212 [ACK] Seq=313 Ack=1235 Win=853 Len=0 TSval=705172 TSecr=798011
505 1.477851501 172.31.23.72 -> 172.31.31.144 OpenFlow 530 Type: OFPT_MULTIPART_REPLY, OFPMP_PORT_STATS
506 1.477994946 172.31.31.144 -> 172.31.23.72 TCP 66 6633 → 40212 [ACK] Seq=313 Ack=7347 Win=853 Len=0 TSval=705172 TSecr=798011
507 1.478013148 172.31.31.144 -> 172.31.23.72 TCP 66 6633 → 40212 [ACK] Seq=313 Ack=7811 Win=853 Len=0 TSval=705172 TSecr=798011
508 1.478018511 172.31.23.72 -> 172.31.31.144 OpenFlow 6178 Type: OFPT_MULTIPART_REPLY, OFPMP_TABLE
509 1.479623005 172.31.31.144 -> 172.31.23.72 OpenFlow 90 Type: OFPT_MULTIPART_REQUEST, OFPMP_PORT_STATS
510 1.479638340 172.31.31.144 -> 172.31.23.72 OpenFlow 90 Type: OFPT_MULTIPART_REQUEST, OFPMP_PORT_STATS
511 1.479807880 172.31.23.72 -> 172.31.31.144 OpenFlow 642 Type: OFPT_MULTIPART_REPLY, OFPMP_PORT_STATS
512 1.479901774 172.31.23.72 -> 172.31.31.144 OpenFlow 530 Type: OFPT_MULTIPART_REPLY, OFPMP_PORT_STATS
513 1.480036422 172.31.31.144 -> 172.31.23.72 TCP 66 6633 → 40198 [ACK] Seq=241 Ack=1077 Win=853 Len=0 TSval=705173 TSecr=798012
514 1.481774802 172.31.31.144 -> 172.31.23.72 OpenFlow 122 Type: OFPT_MULTIPART_REQUEST, OFPMP_FLOW
515 1.481914920 172.31.23.72 -> 172.31.31.144 OpenFlow 1802 Type: OFPT_MULTIPART_REPLY, OFPMP_FLOW
516 1.482946504 172.31.31.144 -> 172.31.23.72 OpenFlow 122 Type: OFPT_MULTIPART_REQUEST, OFPMP_FLOW
517 1.483002102 172.31.31.144 -> 172.31.23.72 OpenFlow 82 Type: OFPT_MULTIPART_REQUEST, OFPMP_TABLE
518 1.483132748 172.31.23.72 -> 172.31.31.144 OpenFlow 1386 Type: OFPT_MULTIPART_REPLY, OFPMP_FLOW
519 1.483281179 172.31.23.72 -> 172.31.31.144 OpenFlow 6178 Type: OFPT_MULTIPART_REPLY, OFPMP_TABLE
520 1.483558401 172.31.31.144 -> 172.31.23.72 TCP 66 6633 → 40210 [ACK] Seq=97 Ack=8143 Win=853 Len=0 TSval=705174 TSecr=798013
521 1.487749030 172.31.31.144 -> 172.31.23.72 OpenFlow 187 Type: OFPT_PACKET_OUT
522 1.487763950 172.31.31.144 -> 172.31.23.72 OpenFlow 187 Type: OFPT_PACKET_OUT
523 1.487853486 172.31.31.144 -> 172.31.23.72 OpenFlow 187 Type: OFPT_PACKET_OUT
524 1.487872392 172.31.31.144 -> 172.31.23.72 OpenFlow 187 Type: OFPT_PACKET_OUT
525 1.487976211 172.31.31.144 -> 172.31.23.72 OpenFlow 187 Type: OFPT_PACKET_OUT
526 1.488038026 172.31.31.144 -> 172.31.23.72 OpenFlow 187 Type: OFPT_PACKET_OUT
527 1.488100108 172.31.31.144 -> 172.31.23.72 OpenFlow 187 Type: OFPT_PACKET_OUT
528 1.488174987 172.31.31.144 -> 172.31.23.72 OpenFlow 187 Type: OFPT_PACKET_OUT
529 1.488190701 172.31.31.144 -> 172.31.23.72 OpenFlow 187 Type: OFPT_PACKET_OUT
530 1.488253447 172.31.31.144 -> 172.31.23.72 OpenFlow 187 Type: OFPT_PACKET_OUT
531 1.488366221 172.31.23.72 -> 172.31.31.144 TCP 66 40188 → 6633 [ACK] Seq=9827 Ack=1859 Win=213 Len=0 TSval=798014 TSecr=705175
532 1.488456488 172.31.23.72 -> 172.31.31.144 OpenFlow 189 Type: OFPT_PACKET_IN
533 1.488481193 172.31.23.72 -> 172.31.31.144 OpenFlow 189 Type: OFPT_PACKET_IN
534 1.488522650 172.31.23.72 -> 172.31.31.144 OpenFlow 189 Type: OFPT_PACKET_IN
535 1.488542057 172.31.23.72 -> 172.31.31.144 OpenFlow 189 Type: OFPT_PACKET_IN
536 1.488620215 172.31.23.72 -> 172.31.31.144 OpenFlow 189 Type: OFPT_PACKET_IN
537 1.488643469 172.31.23.72 -> 172.31.31.144 OpenFlow 189 Type: OFPT_PACKET_IN
538 1.488657783 172.31.23.72 -> 172.31.31.144 OpenFlow 189 Type: OFPT_PACKET_IN
539 1.488669783 172.31.31.144 -> 172.31.23.72 TCP 66 6633 → 40198 [ACK] Seq=297 Ack=3059 Win=853 Len=0 TSval=705175 TSecr=798012
540 1.488686914 172.31.23.72 -> 172.31.31.144 OpenFlow 189 Type: OFPT_PACKET_IN
541 1.488695555 172.31.23.72 -> 172.31.31.144 OpenFlow 189 Type: OFPT_PACKET_IN
542 1.488718244 172.31.31.144 -> 172.31.23.72 TCP 66 6633 → 40216 [ACK] Seq=553 Ack=960 Win=853 Len=0 TSval=705175 TSecr=798014
543 1.488721891 172.31.31.144 -> 172.31.23.72 TCP 66 6633 → 40216 [ACK] Seq=553 Ack=1083 Win=853 Len=0 TSval=705175 TSecr=798014
544 1.488742713 172.31.23.72 -> 172.31.31.144 OpenFlow 189 Type: OFPT_PACKET_IN
545 1.488835275 172.31.31.144 -> 172.31.23.72 TCP 66 6633 → 40142 [ACK] Seq=1569 Ack=9705 Win=853 Len=0 TSval=705175 TSecr=798014
546 1.488848483 172.31.31.144 -> 172.31.23.72 TCP 66 6633 → 40148 [ACK] Seq=1691 Ack=9914 Win=853 Len=0 TSval=705175 TSecr=798014
547 1.488874145 172.31.31.144 -> 172.31.23.72 TCP 66 6633 → 40148 [ACK] Seq=1691 Ack=10037 Win=853 Len=0 TSval=705175 TSecr=798014
548 1.488916758 172.31.31.144 -> 172.31.23.72 TCP 66 6633 → 40152 [ACK] Seq=1907 Ack=10291 Win=853 Len=0 TSval=705175 TSecr=798014
549 1.490110007 172.31.31.144 -> 172.31.23.72 OpenFlow 82 Type: OFPT_MULTIPART_REQUEST, OFPMP_TABLE
550 1.490342064 172.31.23.72 -> 172.31.31.144 OpenFlow 6178 Type: OFPT_MULTIPART_REPLY, OFPMP_TABLE
551 1.506724067 172.31.31.144 -> 172.31.23.72 TCP 66 6633 → 40192 [ACK] Seq=97 Ack=9749 Win=853 Len=0 TSval=705180 TSecr=798008
552 1.508348717 172.31.31.144 -> 172.31.23.72 OpenFlow 90 Type: OFPT_MULTIPART_REQUEST, OFPMP_PORT_STATS
553 1.508374167 172.31.31.144 -> 172.31.23.72 OpenFlow 138 Type: OFPT_MULTIPART_REQUEST, OFPMP_TABLE
554 1.508586359 172.31.23.72 -> 172.31.31.144 OpenFlow 754 Type: OFPT_MULTIPART_REPLY, OFPMP_PORT_STATS
555 1.508647660 172.31.23.72 -> 172.31.31.144 OpenFlow 1386 Type: OFPT_MULTIPART_REPLY, OFPMP_FLOW
556 1.508797461 172.31.23.72 -> 172.31.31.144 OpenFlow 6178 Type: OFPT_MULTIPART_REPLY, OFPMP_TABLE
557 1.508895749 172.31.31.144 -> 172.31.23.72 TCP 66 6633 → 40216 [ACK] Seq=649 Ack=3091 Win=853 Len=0 TSval=705180 TSecr=798019
558 1.514676681 172.31.31.144 -> 172.31.23.72 TCP 66 6633 → 40214 [ACK] Seq=97 Ack=7557 Win=853 Len=0 TSval=705182 TSecr=798011
559 1.522507725 172.31.31.144 -> 172.31.23.72 TCP 90 6633 → 40200 [PSH, ACK] Seq=1 Ack=1 Win=853 Len=24 TSval=705183 TSecr=797514
560 1.522530669 172.31.31.144 -> 172.31.23.72 TCP 138 6633 → 40200 [PSH, ACK] Seq=25 Ack=1 Win=853 Len=72 TSval=705184 TSecr=797514
561 1.522712554 172.31.23.72 -> 172.31.31.144 OpenFlow 530 Type: OFPT_MULTIPART_REPLY, OFPMP_PORT_STATS
562 1.522882319 172.31.23.72 -> 172.31.31.144 OpenFlow 6178 Type: OFPT_MULTIPART_REPLY, OFPMP_TABLE
563 1.522943238 172.31.23.72 -> 172.31.31.144 OpenFlow 2010 Type: OFPT_MULTIPART_REPLY, OFPMP_FLOW
564 1.523114083 172.31.31.144 -> 172.31.23.72 TCP 66 6633 → 40200 [ACK] Seq=97 Ack=8521 Win=853 Len=0 TSval=705184 TSecr=798022
565 1.528653268 172.31.31.144 -> 172.31.23.72 OpenFlow 122 Type: OFPT_MULTIPART_REQUEST, OFPMP_FLOW
566 1.528690848 172.31.31.144 -> 172.31.23.72 OpenFlow 106 Type: OFPT_MULTIPART_REQUEST, OFPMP_TABLE
567 1.528848814 172.31.23.72 -> 172.31.31.144 OpenFlow 1386 Type: OFPT_MULTIPART_REPLY, OFPMP_FLOW
568 1.528963277 172.31.23.72 -> 172.31.31.144 OpenFlow 754 Type: OFPT_MULTIPART_REPLY, OFPMP_PORT_STATS
569 1.529117887 172.31.31.144 -> 172.31.23.72 TCP 66 6633 → 40196 [ACK] Seq=313 Ack=1821 Win=853 Len=0 TSval=705185 TSecr=798024
570 1.529124940 172.31.23.72 -> 172.31.31.144 OpenFlow 6178 Type: OFPT_MULTIPART_REPLY, OFPMP_TABLE
571 1.529135928 172.31.31.144 -> 172.31.23.72 TCP 66 6633 → 40196 [ACK] Seq=313 Ack=2509 Win=853 Len=0 TSval=705185 TSecr=798024
572 1.529325481 172.31.31.144 -> 172.31.23.72 TCP 66 6633 → 40196 [ACK] Seq=313 Ack=8621 Win=853 Len=0 TSval=705185 TSecr=798024
573 1.530623758 172.31.31.144 -> 172.31.23.72 TCP 66 6633 → 40198 [ACK] Seq=313 Ack=9171 Win=853 Len=0 TSval=705186 TSecr=798014
574 1.536841893 172.31.31.144 -> 172.31.23.72 OpenFlow 82 Type: OFPT_MULTIPART_REQUEST, OFPMP_TABLE
575 1.536884166 172.31.31.144 -> 172.31.23.72 TCP 82 6633 → 40202 [PSH, ACK] Seq=1 Ack=1 Win=853 Len=16 TSval=705187 TSecr=797514
576 1.536894853 172.31.31.144 -> 172.31.23.72 OpenFlow 146 Type: OFPT_MULTIPART_REQUEST, OFPMP_PORT_STATS
577 1.536914541 172.31.31.144 -> 172.31.23.72 TCP 146 6633 → 40202 [PSH, ACK] Seq=17 Ack=1 Win=853 Len=80 TSval=705187 TSecr=797514
578 1.537164297 172.31.23.72 -> 172.31.31.144 OpenFlow 6178 Type: OFPT_MULTIPART_REPLY, OFPMP_TABLE
579 1.537255728 172.31.23.72 -> 172.31.31.144 OpenFlow 642 Type: OFPT_MULTIPART_REPLY, OFPMP_PORT_STATS
580 1.537325705 172.31.23.72 -> 172.31.31.144 OpenFlow 2634 Type: OFPT_MULTIPART_REPLY, OFPMP_FLOW
581 1.537487885 172.31.31.144 -> 172.31.23.72 TCP 66 6633 → 40202 [ACK] Seq=97 Ack=6689 Win=853 Len=0 TSval=705187 TSecr=798026
582 1.537495734 172.31.23.72 -> 172.31.31.144 OpenFlow 6178 Type: OFPT_MULTIPART_REPLY, OFPMP_TABLE
583 1.537553086 172.31.23.72 -> 172.31.31.144 OpenFlow 2010 Type: OFPT_MULTIPART_REPLY, OFPMP_FLOW
584 1.537622229 172.31.23.72 -> 172.31.31.144 OpenFlow 530 Type: OFPT_MULTIPART_REPLY, OFPMP_PORT_STATS
585 1.537793309 172.31.31.144 -> 172.31.23.72 TCP 66 6633 → 40206 [ACK] Seq=481 Ack=6535 Win=853 Len=0 TSval=705187 TSecr=798026
586 1.537799373 172.31.31.144 -> 172.31.23.72 TCP 66 6633 → 40206 [ACK] Seq=481 Ack=8479 Win=853 Len=0 TSval=705187 TSecr=798026
587 1.537802810 172.31.31.144 -> 172.31.23.72 TCP 66 6633 → 40206 [ACK] Seq=481 Ack=8943 Win=853 Len=0 TSval=705187 TSecr=798026
588 1.546620861 172.31.31.144 -> 172.31.23.72 TCP 66 6633 → 40216 [ACK] Seq=649 Ack=9203 Win=853 Len=0 TSval=705190 TSecr=798019
589 1.550179862 172.31.31.144 -> 172.31.23.72 OpenFlow 90 Type: OFPT_MULTIPART_REQUEST, OFPMP_PORT_STATS
590 1.550213623 172.31.31.144 -> 172.31.23.72 OpenFlow 122 Type: OFPT_MULTIPART_REQUEST, OFPMP_FLOW
591 1.550402341 172.31.23.72 -> 172.31.31.144 OpenFlow 642 Type: OFPT_MULTIPART_REPLY, OFPMP_PORT_STATS
592 1.550481595 172.31.23.72 -> 172.31.31.144 OpenFlow 2842 Type: OFPT_MULTIPART_REPLY, OFPMP_FLOW
593 1.550739307 172.31.31.144 -> 172.31.23.72 TCP 66 6633 → 40208 [ACK] Seq=1233 Ack=4207 Win=853 Len=0 TSval=705191 TSecr=798029
594 1.551374545 172.31.31.144 -> 172.31.23.72 OpenFlow 82 Type: OFPT_MULTIPART_REQUEST, OFPMP_TABLE
595 1.551760471 172.31.23.72 -> 172.31.31.144 OpenFlow 6178 Type: OFPT_MULTIPART_REPLY, OFPMP_TABLE
596 1.574586679 172.31.31.144 -> 172.31.23.72 TCP 66 6633 → 40202 [ACK] Seq=97 Ack=9257 Win=853 Len=0 TSval=705197 TSecr=798026
597 1.590606563 172.31.31.144 -> 172.31.23.72 TCP 66 6633 → 40208 [ACK] Seq=1249 Ack=10319 Win=853 Len=0 TSval=705201 TSecr=798030
598 1.669379250 172.31.23.72 -> 137.158.125.247 SSH 98 Server: Encrypted packet (len=44)
599 1.746920069 172.31.31.144 -> 172.31.23.72 OpenFlow 187 Type: OFPT_PACKET_OUT
600 1.746962168 172.31.31.144 -> 172.31.23.72 OpenFlow 187 Type: OFPT_PACKET_OUT
601 1.746968470 172.31.31.144 -> 172.31.23.72 OpenFlow 187 Type: OFPT_PACKET_OUT
602 1.747042605 172.31.31.144 -> 172.31.23.72 OpenFlow 187 Type: OFPT_PACKET_OUT
603 1.747108734 172.31.31.144 -> 172.31.23.72 OpenFlow 187 Type: OFPT_PACKET_OUT
604 1.747171301 172.31.31.144 -> 172.31.23.72 OpenFlow 187 Type: OFPT_PACKET_OUT
605 1.747266715 172.31.31.144 -> 172.31.23.72 OpenFlow 187 Type: OFPT_PACKET_OUT
606 1.747309143 172.31.31.144 -> 172.31.23.72 OpenFlow 187 Type: OFPT_PACKET_OUT
607 1.747372518 172.31.31.144 -> 172.31.23.72 OpenFlow 187 Type: OFPT_PACKET_OUT
608 1.747431391 172.31.31.144 -> 172.31.23.72 OpenFlow 187 Type: OFPT_PACKET_OUT
609 1.747563507 172.31.31.144 -> 172.31.23.72 OpenFlow 187 Type: OFPT_PACKET_OUT
610 1.747574352 172.31.31.144 -> 172.31.23.72 OpenFlow 187 Type: OFPT_PACKET_OUT
611 1.747631596 172.31.31.144 -> 172.31.23.72 OpenFlow 187 Type: OFPT_PACKET_OUT
612 1.747656869 172.31.23.72 -> 172.31.31.144 TCP 66 40214 → 6633 [ACK] Seq=7557 Ack=823 Win=203 Len=0 TSval=798079 TSecr=705240
613 1.747709340 172.31.31.144 -> 172.31.23.72 OpenFlow 187 Type: OFPT_PACKET_OUT
614 1.747715964 172.31.23.72 -> 172.31.31.144 TCP 66 40204 → 6633 [ACK] Seq=9303 Ack=1281 Win=311 Len=0 TSval=798079 TSecr=705240
615 1.747768657 172.31.23.72 -> 172.31.31.144 OpenFlow 189 Type: OFPT_PACKET_IN
616 1.747778868 172.31.31.144 -> 172.31.23.72 OpenFlow 187 Type: OFPT_PACKET_OUT
617 1.747805246 172.31.23.72 -> 172.31.31.144 OpenFlow 189 Type: OFPT_PACKET_IN
618 1.747842482 172.31.31.144 -> 172.31.23.72 OpenFlow 187 Type: OFPT_PACKET_OUT
619 1.747924333 172.31.23.72 -> 172.31.31.144 OpenFlow 189 Type: OFPT_PACKET_IN
620 1.747934873 172.31.31.144 -> 172.31.23.72 TCP 66 6633 → 40216 [ACK] Seq=649 Ack=9326 Win=853 Len=0 TSval=705240 TSecr=798079
621 1.747949444 172.31.23.72 -> 172.31.31.144 OpenFlow 189 Type: OFPT_PACKET_IN
622 1.747973546 172.31.31.144 -> 172.31.23.72 TCP 66 6633 → 40216 [ACK] Seq=649 Ack=9449 Win=853 Len=0 TSval=705240 TSecr=798079
623 1.747977188 172.31.31.144 -> 172.31.23.72 OpenFlow 187 Type: OFPT_PACKET_OUT
624 1.747981555 172.31.23.72 -> 172.31.31.144 OpenFlow 189 Type: OFPT_PACKET_IN
625 1.747997595 172.31.31.144 -> 172.31.23.72 OpenFlow 187 Type: OFPT_PACKET_OUT
626 1.748002380 172.31.23.72 -> 172.31.31.144 OpenFlow 189 Type: OFPT_PACKET_IN
627 1.748061895 172.31.31.144 -> 172.31.23.72 OpenFlow 187 Type: OFPT_PACKET_OUT
628 1.748094863 172.31.31.144 -> 172.31.23.72 TCP 66 6633 → 40146 [ACK] Seq=1449 Ack=9178 Win=853 Len=0 TSval=705240 TSecr=798079
629 1.748120336 172.31.31.144 -> 172.31.23.72 TCP 66 6633 → 40146 [ACK] Seq=1449 Ack=9301 Win=853 Len=0 TSval=705240 TSecr=798079
630 1.748136227 172.31.31.144 -> 172.31.23.72 OpenFlow 187 Type: OFPT_PACKET_OUT
631 1.748170507 172.31.31.144 -> 172.31.23.72 TCP 66 6633 → 40150 [ACK] Seq=1859 Ack=10082 Win=853 Len=0 TSval=705240 TSecr=798079
632 1.748189040 172.31.31.144 -> 172.31.23.72 TCP 66 6633 → 40150 [ACK] Seq=1859 Ack=10205 Win=853 Len=0 TSval=705240 TSecr=798079
633 1.748220931 172.31.31.144 -> 172.31.23.72 OpenFlow 187 Type: OFPT_PACKET_OUT
634 1.748252647 172.31.31.144 -> 172.31.23.72 OpenFlow 187 Type: OFPT_PACKET_OUT
635 1.748343471 172.31.31.144 -> 172.31.23.72 OpenFlow 187 Type: OFPT_PACKET_OUT
636 1.748387348 172.31.31.144 -> 172.31.23.72 OpenFlow 187 Type: OFPT_PACKET_OUT
637 1.748460229 172.31.31.144 -> 172.31.23.72 OpenFlow 187 Type: OFPT_PACKET_OUT
638 1.748502119 172.31.31.144 -> 172.31.23.72 OpenFlow 187 Type: OFPT_PACKET_OUT
639 1.748563596 172.31.31.144 -> 172.31.23.72 OpenFlow 187 Type: OFPT_PACKET_OUT
640 1.748572148 172.31.23.72 -> 172.31.31.144 OpenFlow 189 Type: OFPT_PACKET_IN
641 1.748609949 172.31.23.72 -> 172.31.31.144 OpenFlow 189 Type: OFPT_PACKET_IN
642 1.748635163 172.31.31.144 -> 172.31.23.72 OpenFlow 187 Type: OFPT_PACKET_OUT
643 1.748729653 172.31.31.144 -> 172.31.23.72 OpenFlow 187 Type: OFPT_PACKET_OUT
644 1.748734955 172.31.31.144 -> 172.31.23.72 TCP 66 6633 → 40208 [ACK] Seq=1249 Ack=10442 Win=853 Len=0 TSval=705240 TSecr=798079
645 1.748761587 172.31.31.144 -> 172.31.23.72 TCP 66 6633 → 40208 [ACK] Seq=1249 Ack=10565 Win=853 Len=0 TSval=705240 TSecr=798079
646 1.748780789 172.31.31.144 -> 172.31.23.72 OpenFlow 187 Type: OFPT_PACKET_OUT
647 1.748840892 172.31.31.144 -> 172.31.23.72 OpenFlow 187 Type: OFPT_PACKET_OUT
648 1.748885528 172.31.23.72 -> 172.31.31.144 TCP 66 40212 → 6633 [ACK] Seq=7811 Ack=1039 Win=385 Len=0 TSval=798079 TSecr=705240
649 1.748932452 172.31.31.144 -> 172.31.23.72 OpenFlow 187 Type: OFPT_PACKET_OUT
650 1.748966116 172.31.31.144 -> 172.31.23.72 OpenFlow 187 Type: OFPT_PACKET_OUT
651 1.749037874 172.31.31.144 -> 172.31.23.72 OpenFlow 187 Type: OFPT_PACKET_OUT
652 1.749059920 172.31.23.72 -> 172.31.31.144 OpenFlow 189 Type: OFPT_PACKET_IN
653 1.749080652 172.31.23.72 -> 172.31.31.144 OpenFlow 189 Type: OFPT_PACKET_IN
654 1.749105561 172.31.31.144 -> 172.31.23.72 OpenFlow 187 Type: OFPT_PACKET_OUT
655 1.749128133 172.31.23.72 -> 172.31.31.144 OpenFlow 189 Type: OFPT_PACKET_IN
656 1.749149686 172.31.23.72 -> 172.31.31.144 OpenFlow 189 Type: OFPT_PACKET_IN
657 1.749154093 172.31.23.72 -> 172.31.31.144 OpenFlow 189 Type: OFPT_PACKET_IN
658 1.749185485 172.31.31.144 -> 172.31.23.72 OpenFlow 187 Type: OFPT_PACKET_OUT
659 1.749219603 172.31.23.72 -> 172.31.31.144 OpenFlow 435 Type: OFPT_PACKET_IN
660 1.749241581 172.31.31.144 -> 172.31.23.72 TCP 66 6633 → 40140 [ACK] Seq=1497 Ack=9604 Win=853 Len=0 TSval=705240 TSecr=798079
661 1.749270283 172.31.31.144 -> 172.31.23.72 TCP 66 6633 → 40140 [ACK] Seq=1497 Ack=9727 Win=853 Len=0 TSval=705240 TSecr=798079
662 1.749274112 172.31.31.144 -> 172.31.23.72 OpenFlow 187 Type: OFPT_PACKET_OUT
663 1.749296619 172.31.31.144 -> 172.31.23.72 OpenFlow 187 Type: OFPT_PACKET_OUT
664 1.749338627 172.31.31.144 -> 172.31.23.72 TCP 66 6633 → 40152 [ACK] Seq=1907 Ack=10537 Win=853 Len=0 TSval=705240 TSecr=798079
665 1.749377337 172.31.31.144 -> 172.31.23.72 OpenFlow 187 Type: OFPT_PACKET_OUT
666 1.749389607 172.31.31.144 -> 172.31.23.72 TCP 66 6633 → 40154 [ACK] Seq=1569 Ack=9651 Win=853 Len=0 TSval=705240 TSecr=798079
667 1.749449257 172.31.31.144 -> 172.31.23.72 OpenFlow 187 Type: OFPT_PACKET_OUT
668 1.749506864 172.31.31.144 -> 172.31.23.72 OpenFlow 187 Type: OFPT_PACKET_OUT
669 1.749542879 172.31.23.72 -> 172.31.31.144 TCP 66 40192 → 6633 [ACK] Seq=9749 Ack=1065 Win=383 Len=0 TSval=798079 TSecr=705240
670 1.749593334 172.31.31.144 -> 172.31.23.72 OpenFlow 187 Type: OFPT_PACKET_OUT
671 1.749632083 172.31.23.72 -> 172.31.31.144 OpenFlow 189 Type: OFPT_PACKET_IN
672 1.749650609 172.31.23.72 -> 172.31.31.144 TCP 66 40198 → 6633 [ACK] Seq=9171 Ack=1281 Win=384 Len=0 TSval=798079 TSecr=705240
673 1.749659301 172.31.23.72 -> 172.31.31.144 OpenFlow 189 Type: OFPT_PACKET_IN
674 1.749678475 172.31.31.144 -> 172.31.23.72 OpenFlow 187 Type: OFPT_PACKET_OUT
675 1.749727324 172.31.31.144 -> 172.31.23.72 OpenFlow 187 Type: OFPT_PACKET_OUT
676 1.749804506 172.31.31.144 -> 172.31.23.72 TCP 66 6633 → 40196 [ACK] Seq=313 Ack=8744 Win=853 Len=0 TSval=705240 TSecr=798079
677 1.749810050 172.31.31.144 -> 172.31.23.72 OpenFlow 187 Type: OFPT_PACKET_OUT
678 1.749836863 172.31.31.144 -> 172.31.23.72 TCP 66 6633 → 40196 [ACK] Seq=313 Ack=8867 Win=853 Len=0 TSval=705240 TSecr=798079
679 1.749855717 172.31.31.144 -> 172.31.23.72 OpenFlow 187 Type: OFPT_PACKET_OUT
680 1.749909966 172.31.31.144 -> 172.31.23.72 OpenFlow 187 Type: OFPT_PACKET_OUT
681 1.750013668 172.31.31.144 -> 172.31.23.72 OpenFlow 187 Type: OFPT_PACKET_OUT
682 1.750099528 172.31.23.72 -> 172.31.31.144 OpenFlow 189 Type: OFPT_PACKET_IN
683 1.750117994 172.31.31.144 -> 172.31.23.72 OpenFlow 187 Type: OFPT_PACKET_OUT
684 1.750124540 172.31.23.72 -> 172.31.31.144 OpenFlow 189 Type: OFPT_PACKET_IN
685 1.750144673 172.31.23.72 -> 172.31.31.144 OpenFlow 189 Type: OFPT_PACKET_IN
686 1.750160538 172.31.23.72 -> 172.31.31.144 TCP 66 40210 → 6633 [ACK] Seq=8143 Ack=823 Win=383 Len=0 TSval=798079 TSecr=705240
687 1.750172368 172.31.31.144 -> 172.31.23.72 OpenFlow 187 Type: OFPT_PACKET_OUT
688 1.750198383 172.31.23.72 -> 172.31.31.144 OpenFlow 189 Type: OFPT_PACKET_IN
689 1.750264574 172.31.31.144 -> 172.31.23.72 OpenFlow 187 Type: OFPT_PACKET_OUT
690 1.750293517 172.31.31.144 -> 172.31.23.72 TCP 66 6633 → 40202 [ACK] Seq=97 Ack=9380 Win=853 Len=0 TSval=705240 TSecr=798079
691 1.750297991 172.31.31.144 -> 172.31.23.72 OpenFlow 187 Type: OFPT_PACKET_OUT
692 1.750321957 172.31.31.144 -> 172.31.23.72 TCP 66 6633 → 40202 [ACK] Seq=97 Ack=9503 Win=853 Len=0 TSval=705240 TSecr=798079
693 1.750334978 172.31.31.144 -> 172.31.23.72 TCP 66 6633 → 40206 [ACK] Seq=481 Ack=9066 Win=853 Len=0 TSval=705240 TSecr=798079
694 1.750355433 172.31.31.144 -> 172.31.23.72 OpenFlow 187 Type: OFPT_PACKET_OUT
695 1.750375244 172.31.31.144 -> 172.31.23.72 TCP 66 6633 → 40206 [ACK] Seq=481 Ack=9189 Win=853 Len=0 TSval=705240 TSecr=798079
696 1.750462431 172.31.31.144 -> 172.31.23.72 OpenFlow 187 Type: OFPT_PACKET_OUT
697 1.750587417 172.31.31.144 -> 172.31.23.72 OpenFlow 187 Type: OFPT_PACKET_OUT
698 1.750631551 172.31.23.72 -> 172.31.31.144 OpenFlow 189 Type: OFPT_PACKET_IN
699 1.750654024 172.31.23.72 -> 172.31.31.144 OpenFlow 435 Type: OFPT_PACKET_IN
700 1.750677087 172.31.23.72 -> 172.31.31.144 OpenFlow 189 Type: OFPT_PACKET_IN
701 1.750688409 172.31.23.72 -> 172.31.31.144 OpenFlow 189 Type: OFPT_PACKET_IN
702 1.750712574 172.31.23.72 -> 172.31.31.144 OpenFlow 189 Type: OFPT_PACKET_IN
703 1.750714757 172.31.23.72 -> 172.31.31.144 OpenFlow 189 Type: OFPT_PACKET_IN
704 1.750730880 172.31.31.144 -> 172.31.23.72 OpenFlow 187 Type: OFPT_PACKET_OUT
705 1.750754240 172.31.23.72 -> 172.31.31.144 OpenFlow 189 Type: OFPT_PACKET_IN
706 1.750759304 172.31.23.72 -> 172.31.31.144 OpenFlow 189 Type: OFPT_PACKET_IN
707 1.750772389 172.31.23.72 -> 172.31.31.144 OpenFlow 189 Type: OFPT_PACKET_IN
708 1.750800737 172.31.31.144 -> 172.31.23.72 TCP 66 6633 → 40144 [ACK] Seq=823 Ack=7850 Win=853 Len=0 TSval=705241 TSecr=798079
709 1.750862347 172.31.23.72 -> 172.31.31.144 OpenFlow 189 Type: OFPT_PACKET_IN
710 1.750903293 172.31.31.144 -> 172.31.23.72 TCP 66 6633 → 40144 [ACK] Seq=823 Ack=8219 Win=853 Len=0 TSval=705241 TSecr=798079
711 1.750908447 172.31.31.144 -> 172.31.23.72 OpenFlow 187 Type: OFPT_PACKET_OUT
712 1.750910606 172.31.31.144 -> 172.31.23.72 TCP 66 6633 → 40148 [ACK] Seq=1691 Ack=10160 Win=853 Len=0 TSval=705241 TSecr=798079
713 1.750912939 172.31.31.144 -> 172.31.23.72 TCP 66 6633 → 40150 [ACK] Seq=1859 Ack=10328 Win=853 Len=0 TSval=705241 TSecr=798079
714 1.750914802 172.31.31.144 -> 172.31.23.72 OpenFlow 187 Type: OFPT_PACKET_OUT
715 1.750972034 172.31.31.144 -> 172.31.23.72 TCP 66 6633 → 40156 [ACK] Seq=1281 Ack=8008 Win=853 Len=0 TSval=705241 TSecr=798079
716 1.750977392 172.31.31.144 -> 172.31.23.72 TCP 66 6633 → 40148 [ACK] Seq=1691 Ack=10283 Win=853 Len=0 TSval=705241 TSecr=798079
717 1.750979540 172.31.31.144 -> 172.31.23.72 OpenFlow 187 Type: OFPT_PACKET_OUT
718 1.750981326 172.31.31.144 -> 172.31.23.72 TCP 66 6633 → 40150 [ACK] Seq=1859 Ack=10451 Win=853 Len=0 TSval=705241 TSecr=798080
719 1.751018456 172.31.31.144 -> 172.31.23.72 TCP 66 6633 → 40156 [ACK] Seq=1281 Ack=8131 Win=853 Len=0 TSval=705241 TSecr=798080
720 1.751058637 172.31.31.144 -> 172.31.23.72 OpenFlow 187 Type: OFPT_PACKET_OUT
721 1.751065672 172.31.23.72 -> 172.31.31.144 TCP 66 40190 → 6633 [ACK] Seq=10269 Ack=1039 Win=385 Len=0 TSval=798080 TSecr=705240
722 1.751134843 172.31.31.144 -> 172.31.23.72 OpenFlow 187 Type: OFPT_PACKET_OUT
723 1.751154569 172.31.23.72 -> 172.31.31.144 OpenFlow 189 Type: OFPT_PACKET_IN
724 1.751237253 172.31.31.144 -> 172.31.23.72 TCP 66 6633 → 40188 [ACK] Seq=1859 Ack=10073 Win=853 Len=0 TSval=705241 TSecr=798080
725 1.751245892 172.31.23.72 -> 172.31.31.144 OpenFlow 189 Type: OFPT_PACKET_IN
726 1.751343237 172.31.31.144 -> 172.31.23.72 OpenFlow 187 Type: OFPT_PACKET_OUT
727 1.751348071 172.31.31.144 -> 172.31.23.72 OpenFlow 187 Type: OFPT_PACKET_OUT
728 1.751387218 172.31.31.144 -> 172.31.23.72 TCP 66 6633 → 40194 [ACK] Seq=1039 Ack=8274 Win=853 Len=0 TSval=705241 TSecr=798080
729 1.751408818 172.31.31.144 -> 172.31.23.72 OpenFlow 187 Type: OFPT_PACKET_OUT
730 1.751427241 172.31.31.144 -> 172.31.23.72 TCP 66 6633 → 40194 [ACK] Seq=1039 Ack=8397 Win=853 Len=0 TSval=705241 TSecr=798080
731 1.751442011 172.31.31.144 -> 172.31.23.72 OpenFlow 187 Type: OFPT_PACKET_OUT
732 1.751496195 172.31.31.144 -> 172.31.23.72 OpenFlow 187 Type: OFPT_PACKET_OUT
733 1.751523077 172.31.23.72 -> 172.31.31.144 OpenFlow 189 Type: OFPT_PACKET_IN
734 1.751546035 172.31.23.72 -> 172.31.31.144 OpenFlow 189 Type: OFPT_PACKET_IN
735 1.751551467 172.31.23.72 -> 172.31.31.144 OpenFlow 189 Type: OFPT_PACKET_IN
736 1.751564412 172.31.23.72 -> 172.31.31.144 OpenFlow 189 Type: OFPT_PACKET_IN
737 1.751625571 172.31.23.72 -> 172.31.31.144 OpenFlow 189 Type: OFPT_PACKET_IN
738 1.751708831 172.31.31.144 -> 172.31.23.72 OpenFlow 187 Type: OFPT_PACKET_OUT
739 1.751713950 172.31.31.144 -> 172.31.23.72 OpenFlow 187 Type: OFPT_PACKET_OUT
740 1.751716332 172.31.31.144 -> 172.31.23.72 TCP 66 6633 → 40196 [ACK] Seq=313 Ack=8990 Win=853 Len=0 TSval=705241 TSecr=798080
741 1.751719195 172.31.31.144 -> 172.31.23.72 OpenFlow 187 Type: OFPT_PACKET_OUT
742 1.751724444 172.31.23.72 -> 172.31.31.144 OpenFlow 189 Type: OFPT_PACKET_IN
743 1.751733029 172.31.31.144 -> 172.31.23.72 TCP 66 6633 → 40196 [ACK] Seq=313 Ack=9113 Win=853 Len=0 TSval=705241 TSecr=798080
744 1.751768543 172.31.31.144 -> 172.31.23.72 OpenFlow 187 Type: OFPT_PACKET_OUT
745 1.751784391 172.31.31.144 -> 172.31.23.72 TCP 66 6633 → 40198 [ACK] Seq=1281 Ack=9294 Win=853 Len=0 TSval=705241 TSecr=798080
746 1.751813628 172.31.31.144 -> 172.31.23.72 OpenFlow 187 Type: OFPT_PACKET_OUT
747 1.751832220 172.31.31.144 -> 172.31.23.72 TCP 66 6633 → 40198 [ACK] Seq=1281 Ack=9417 Win=853 Len=0 TSval=705241 TSecr=798080
748 1.751859299 172.31.31.144 -> 172.31.23.72 OpenFlow 187 Type: OFPT_PACKET_OUT
749 1.751890237 172.31.23.72 -> 172.31.31.144 OpenFlow 189 Type: OFPT_PACKET_IN
750 1.751912444 172.31.23.72 -> 172.31.31.144 OpenFlow 189 Type: OFPT_PACKET_IN
751 1.751969782 172.31.31.144 -> 172.31.23.72 OpenFlow 187 Type: OFPT_PACKET_OUT
752 1.752040699 172.31.31.144 -> 172.31.23.72 OpenFlow 187 Type: OFPT_PACKET_OUT
753 1.752123793 172.31.31.144 -> 172.31.23.72 TCP 66 6633 → 40200 [ACK] Seq=823 Ack=8767 Win=853 Len=0 TSval=705241 TSecr=798080
754 1.752151001 172.31.31.144 -> 172.31.23.72 OpenFlow 187 Type: OFPT_PACKET_OUT
755 1.752178113 172.31.31.144 -> 172.31.23.72 OpenFlow 187 Type: OFPT_PACKET_OUT
756 1.752206927 172.31.23.72 -> 172.31.31.144 TCP 66 40202 → 6633 [ACK] Seq=9749 Ack=1065 Win=213 Len=0 TSval=798080 TSecr=705241
757 1.752275842 172.31.23.72 -> 172.31.31.144 OpenFlow 189 Type: OFPT_PACKET_IN
758 1.752296039 172.31.31.144 -> 172.31.23.72 OpenFlow 187 Type: OFPT_PACKET_OUT
759 1.752308498 172.31.23.72 -> 172.31.31.144 OpenFlow 189 Type: OFPT_PACKET_IN
760 1.752331577 172.31.31.144 -> 172.31.23.72 OpenFlow 187 Type: OFPT_PACKET_OUT
761 1.752394942 172.31.31.144 -> 172.31.23.72 OpenFlow 187 Type: OFPT_PACKET_OUT
762 1.752473308 172.31.31.144 -> 172.31.23.72 TCP 66 6633 → 40204 [ACK] Seq=1281 Ack=9549 Win=853 Len=0 TSval=705241 TSecr=798080
763 1.752492887 172.31.31.144 -> 172.31.23.72 OpenFlow 187 Type: OFPT_PACKET_OUT
764 1.752511479 172.31.31.144 -> 172.31.23.72 OpenFlow 187 Type: OFPT_PACKET_OUT
765 1.752567015 172.31.23.72 -> 172.31.31.144 TCP 66 40208 → 6633 [ACK] Seq=10565 Ack=1975 Win=384 Len=0 TSval=798080 TSecr=705241
766 1.752578536 172.31.31.144 -> 172.31.23.72 OpenFlow 187 Type: OFPT_PACKET_OUT
767 1.752611171 172.31.23.72 -> 172.31.31.144 OpenFlow 189 Type: OFPT_PACKET_IN
768 1.752629732 172.31.31.144 -> 172.31.23.72 OpenFlow 187 Type: OFPT_PACKET_OUT
769 1.752642385 172.31.23.72 -> 172.31.31.144 OpenFlow 189 Type: OFPT_PACKET_IN
770 1.752676921 172.31.23.72 -> 172.31.31.144 OpenFlow 189 Type: OFPT_PACKET_IN
771 1.752684245 172.31.31.144 -> 172.31.23.72 OpenFlow 187 Type: OFPT_PACKET_OUT
772 1.752708975 172.31.23.72 -> 172.31.31.144 OpenFlow 189 Type: OFPT_PACKET_IN
773 1.752779937 172.31.23.72 -> 172.31.31.144 OpenFlow 189 Type: OFPT_PACKET_IN
774 1.752803280 172.31.23.72 -> 172.31.31.144 OpenFlow 435 Type: OFPT_PACKET_IN
775 1.752826505 172.31.31.144 -> 172.31.23.72 TCP 66 6633 → 40216 [ACK] Seq=649 Ack=9572 Win=853 Len=0 TSval=705241 TSecr=798080
776 1.752833905 172.31.23.72 -> 172.31.31.144 OpenFlow 189 Type: OFPT_PACKET_IN
777 1.752858738 172.31.23.72 -> 172.31.31.144 OpenFlow 189 Type: OFPT_PACKET_IN
778 1.752875167 172.31.31.144 -> 172.31.23.72 TCP 66 6633 → 40216 [ACK] Seq=649 Ack=9695 Win=853 Len=0 TSval=705241 TSecr=798080
779 1.752878226 172.31.31.144 -> 172.31.23.72 TCP 66 6633 → 40210 [ACK] Seq=823 Ack=8389 Win=853 Len=0 TSval=705241 TSecr=798080
780 1.752898368 172.31.23.72 -> 172.31.31.144 OpenFlow 189 Type: OFPT_PACKET_IN
781 1.752902624 172.31.23.72 -> 172.31.31.144 OpenFlow 189 Type: OFPT_PACKET_IN
782 1.752916157 172.31.23.72 -> 172.31.31.144 OpenFlow 189 Type: OFPT_PACKET_IN
783 1.752968789 172.31.31.144 -> 172.31.23.72 TCP 66 6633 → 40140 [ACK] Seq=1497 Ack=9850 Win=853 Len=0 TSval=705241 TSecr=798080
784 1.752974347 172.31.31.144 -> 172.31.23.72 TCP 66 6633 → 40140 [ACK] Seq=1497 Ack=10219 Win=853 Len=0 TSval=705241 TSecr=798080
785 1.752979146 172.31.23.72 -> 172.31.31.144 OpenFlow 189 Type: OFPT_PACKET_IN
786 1.753022461 172.31.31.144 -> 172.31.23.72 TCP 66 6633 → 40146 [ACK] Seq=1449 Ack=9424 Win=853 Len=0 TSval=705241 TSecr=798080
787 1.753027077 172.31.31.144 -> 172.31.23.72 TCP 66 6633 → 40146 [ACK] Seq=1449 Ack=9547 Win=853 Len=0 TSval=705241 TSecr=798080
788 1.753078992 172.31.31.144 -> 172.31.23.72 TCP 66 6633 → 40152 [ACK] Seq=1907 Ack=10783 Win=853 Len=0 TSval=705241 TSecr=798080
789 1.753302749 172.31.31.144 -> 172.31.23.72 OpenFlow 187 Type: OFPT_PACKET_OUT
790 1.753320413 172.31.31.144 -> 172.31.23.72 OpenFlow 187 Type: OFPT_PACKET_OUT
791 1.753339605 172.31.31.144 -> 172.31.23.72 OpenFlow 308 Type: OFPT_PACKET_OUT
792 1.753356151 172.31.31.144 -> 172.31.23.72 OpenFlow 308 Type: OFPT_PACKET_OUT
793 1.753375650 172.31.31.144 -> 172.31.23.72 TCP 66 6633 → 40196 [ACK] Seq=1523 Ack=9359 Win=853 Len=0 TSval=705241 TSecr=798080
794 1.753462573 172.31.23.72 -> 172.31.31.144 OpenFlow 189 Type: OFPT_PACKET_IN
795 1.753486220 172.31.23.72 -> 172.31.31.144 OpenFlow 189 Type: OFPT_PACKET_IN
796 1.753491270 172.31.23.72 -> 172.31.31.144 OpenFlow 189 Type: OFPT_PACKET_IN
797 1.753506997 172.31.23.72 -> 172.31.31.144 OpenFlow 189 Type: OFPT_PACKET_IN
798 1.753528002 172.31.23.72 -> 172.31.31.144 OpenFlow 189 Type: OFPT_PACKET_IN
799 1.753591888 172.31.23.72 -> 172.31.31.144 OpenFlow 189 Type: OFPT_PACKET_IN
800 1.753595046 172.31.23.72 -> 172.31.31.144 OpenFlow 435 Type: OFPT_PACKET_IN
801 1.753635103 172.31.23.72 -> 172.31.31.144 OpenFlow 189 Type: OFPT_PACKET_IN
802 1.753695136 172.31.31.144 -> 172.31.23.72 TCP 66 6633 → 40200 [ACK] Seq=823 Ack=9013 Win=853 Len=0 TSval=705241 TSecr=798080
803 1.753702139 172.31.31.144 -> 172.31.23.72 TCP 66 6633 → 40202 [ACK] Seq=1065 Ack=9872 Win=853 Len=0 TSval=705241 TSecr=798080
804 1.753780799 172.31.31.144 -> 172.31.23.72 TCP 66 6633 → 40210 [ACK] Seq=823 Ack=8635 Win=853 Len=0 TSval=705241 TSecr=798080
805 1.753829908 172.31.23.72 -> 172.31.31.144 TCP 66 40216 → 6633 [ACK] Seq=9695 Ack=1375 Win=213 Len=0 TSval=798080 TSecr=705241
806 1.753840237 172.31.31.144 -> 172.31.23.72 OpenFlow 187 Type: OFPT_PACKET_OUT
807 1.753854687 172.31.31.144 -> 172.31.23.72 OpenFlow 187 Type: OFPT_PACKET_OUT
808 1.753931347 172.31.31.144 -> 172.31.23.72 OpenFlow 308 Type: OFPT_PACKET_OUT
809 1.753975998 172.31.31.144 -> 172.31.23.72 TCP 66 6633 → 40204 [ACK] Seq=1281 Ack=10041 Win=853 Len=0 TSval=705241 TSecr=798080
810 1.753981067 172.31.31.144 -> 172.31.23.72 OpenFlow 187 Type: OFPT_PACKET_OUT
811 1.753989513 172.31.31.144 -> 172.31.23.72 OpenFlow 187 Type: OFPT_PACKET_OUT
812 1.754053320 172.31.23.72 -> 172.31.31.144 TCP 66 40216 → 6633 [ACK] Seq=9695 Ack=1859 Win=213 Len=0 TSval=798080 TSecr=705241
813 1.754071540 172.31.31.144 -> 172.31.23.72 OpenFlow 187 Type: OFPT_PACKET_OUT
814 1.754115563 172.31.31.144 -> 172.31.23.72 OpenFlow 187 Type: OFPT_PACKET_OUT
815 1.754175145 172.31.31.144 -> 172.31.23.72 OpenFlow 187 Type: OFPT_PACKET_OUT
816 1.754235902 172.31.23.72 -> 172.31.31.144 OpenFlow 189 Type: OFPT_PACKET_IN
817 1.754246345 172.31.31.144 -> 172.31.23.72 OpenFlow 187 Type: OFPT_PACKET_OUT
818 1.754258504 172.31.23.72 -> 172.31.31.144 OpenFlow 189 Type: OFPT_PACKET_IN
819 1.754273906 172.31.23.72 -> 172.31.31.144 OpenFlow 189 Type: OFPT_PACKET_IN
820 1.754296717 172.31.23.72 -> 172.31.31.144 OpenFlow 189 Type: OFPT_PACKET_IN
821 1.754304324 172.31.23.72 -> 172.31.31.144 OpenFlow 189 Type: OFPT_PACKET_IN
822 1.754317653 172.31.23.72 -> 172.31.31.144 OpenFlow 189 Type: OFPT_PACKET_IN
823 1.754329149 172.31.23.72 -> 172.31.31.144 OpenFlow 189 Type: OFPT_PACKET_IN
824 1.754348232 172.31.23.72 -> 172.31.31.144 OpenFlow 189 Type: OFPT_PACKET_IN
825 1.754353650 172.31.23.72 -> 172.31.31.144 OpenFlow 189 Type: OFPT_PACKET_IN
826 1.754417655 172.31.23.72 -> 172.31.31.144 OpenFlow 189 Type: OFPT_PACKET_IN
827 1.754420522 172.31.23.72 -> 172.31.31.144 OpenFlow 189 Type: OFPT_PACKET_IN
828 1.754438662 172.31.31.144 -> 172.31.23.72 TCP 66 6633 → 40148 [ACK] Seq=1691 Ack=10406 Win=853 Len=0 TSval=705241 TSecr=798080
829 1.754443320 172.31.31.144 -> 172.31.23.72 TCP 66 6633 → 40148 [ACK] Seq=1691 Ack=10529 Win=853 Len=0 TSval=705241 TSecr=798080
830 1.754445187 172.31.31.144 -> 172.31.23.72 TCP 66 6633 → 40150 [ACK] Seq=1859 Ack=10574 Win=853 Len=0 TSval=705241 TSecr=798080
831 1.754508205 172.31.23.72 -> 172.31.31.144 OpenFlow 189 Type: OFPT_PACKET_IN
832 1.754547615 172.31.31.144 -> 172.31.23.72 TCP 66 6633 → 40150 [ACK] Seq=1859 Ack=10697 Win=853 Len=0 TSval=705242 TSecr=798080
833 1.754552675 172.31.31.144 -> 172.31.23.72 TCP 66 6633 → 40156 [ACK] Seq=1281 Ack=8254 Win=853 Len=0 TSval=705242 TSecr=798080
834 1.754588788 172.31.31.144 -> 172.31.23.72 TCP 66 6633 → 40194 [ACK] Seq=1039 Ack=8520 Win=853 Len=0 TSval=705242 TSecr=798080
835 1.754612552 172.31.31.144 -> 172.31.23.72 TCP 66 6633 → 40156 [ACK] Seq=1281 Ack=8377 Win=853 Len=0 TSval=705242 TSecr=798080
836 1.754637752 172.31.23.72 -> 172.31.31.144 TCP 66 40206 → 6633 [ACK] Seq=9189 Ack=1207 Win=402 Len=0 TSval=798080 TSecr=705241
837 1.754667501 172.31.31.144 -> 172.31.23.72 TCP 66 6633 → 40194 [ACK] Seq=1039 Ack=8643 Win=853 Len=0 TSval=705242 TSecr=798080
838 1.754759123 172.31.23.72 -> 172.31.31.144 OpenFlow 189 Type: OFPT_PACKET_IN
839 1.754772683 172.31.31.144 -> 172.31.23.72 TCP 66 6633 → 40154 [ACK] Seq=1569 Ack=9897 Win=853 Len=0 TSval=705242 TSecr=798080
840 1.754779706 172.31.23.72 -> 172.31.31.144 OpenFlow 189 Type: OFPT_PACKET_IN
841 1.754894911 172.31.23.72 -> 172.31.31.144 OpenFlow 189 Type: OFPT_PACKET_IN
842 1.754904967 172.31.31.144 -> 172.31.23.72 TCP 66 6633 → 40214 [ACK] Seq=823 Ack=7680 Win=853 Len=0 TSval=705242 TSecr=798081
843 1.754922901 172.31.31.144 -> 172.31.23.72 TCP 66 6633 → 40214 [ACK] Seq=823 Ack=7803 Win=853 Len=0 TSval=705242 TSecr=798081
844 1.754928467 172.31.23.72 -> 172.31.31.144 OpenFlow 189 Type: OFPT_PACKET_IN
845 1.754948503 172.31.31.144 -> 172.31.23.72 TCP 66 6633 → 40188 [ACK] Seq=1859 Ack=10319 Win=853 Len=0 TSval=705242 TSecr=798080
846 1.754976624 172.31.23.72 -> 172.31.31.144 OpenFlow 189 Type: OFPT_PACKET_IN
847 1.754997771 172.31.23.72 -> 172.31.31.144 OpenFlow 189 Type: OFPT_PACKET_IN
848 1.755039353 172.31.31.144 -> 172.31.23.72 TCP 66 6633 → 40148 [ACK] Seq=1691 Ack=10652 Win=853 Len=0 TSval=705242 TSecr=798081
849 1.755099875 172.31.31.144 -> 172.31.23.72 TCP 66 6633 → 40148 [ACK] Seq=1691 Ack=10775 Win=853 Len=0 TSval=705242 TSecr=798081
850 1.755117335 172.31.31.144 -> 172.31.23.72 TCP 66 6633 → 40192 [ACK] Seq=1065 Ack=9872 Win=853 Len=0 TSval=705242 TSecr=798081
851 1.755139941 172.31.31.144 -> 172.31.23.72 TCP 66 6633 → 40192 [ACK] Seq=1065 Ack=9995 Win=853 Len=0 TSval=705242 TSecr=798081
852 1.790592819 172.31.31.144 -> 172.31.23.72 TCP 66 6633 → 40202 [ACK] Seq=1065 Ack=9995 Win=853 Len=0 TSval=705251 TSecr=798080
853 1.878116249 137.158.125.247 -> 172.31.23.72 TCP 54 52508 → 22 [ACK] Seq=1 Ack=185 Win=32342 Len=0
854 2.177193345 172.31.23.72 -> 137.158.125.247 SSH 98 Server: Encrypted packet (len=44)
855 2.386516806 137.158.125.247 -> 172.31.23.72 TCP 54 52508 → 22 [ACK] Seq=1 Ack=229 Win=32320 Len=0
856 2.677332067 172.31.23.72 -> 137.158.125.247 SSH 98 Server: Encrypted packet (len=44)
