  1 0.000000000 172.31.31.144 -> 172.31.24.227 TCP 187 6633 → 59638 [PSH, ACK] Seq=1 Ack=1 Win=853 Len=121 TSval=2860185 TSecr=391763635
  2 0.000025124 172.31.31.144 -> 172.31.24.227 TCP 187 6633 → 59638 [PSH, ACK] Seq=122 Ack=1 Win=853 Len=121 TSval=2860185 TSecr=391763635
  3 0.000029890 172.31.31.144 -> 172.31.24.227 TCP 187 6633 → 59638 [PSH, ACK] Seq=243 Ack=1 Win=853 Len=121 TSval=2860185 TSecr=391763635
  4 0.000037799 172.31.31.144 -> 172.31.24.227 TCP 187 6633 → 59638 [PSH, ACK] Seq=364 Ack=1 Win=853 Len=121 TSval=2860185 TSecr=391763635
  5 0.000077844 172.31.31.144 -> 172.31.24.227 TCP 187 6633 → 59638 [PSH, ACK] Seq=485 Ack=1 Win=853 Len=121 TSval=2860185 TSecr=391763635
  6 0.000146623 172.31.31.144 -> 172.31.24.227 TCP 187 6633 → 59638 [PSH, ACK] Seq=606 Ack=1 Win=853 Len=121 TSval=2860185 TSecr=391763635
  7 0.000199489 172.31.31.144 -> 172.31.24.227 TCP 187 6633 → 59640 [PSH, ACK] Seq=1 Ack=1 Win=853 Len=121 TSval=2860185 TSecr=391763635
  8 0.000244522 172.31.31.144 -> 172.31.24.227 TCP 187 6633 → 59640 [PSH, ACK] Seq=122 Ack=1 Win=853 Len=121 TSval=2860185 TSecr=391763635
  9 0.000305760 172.31.31.144 -> 172.31.24.227 TCP 187 6633 → 59640 [PSH, ACK] Seq=243 Ack=1 Win=853 Len=121 TSval=2860185 TSecr=391763635
 10 0.000390736 172.31.31.144 -> 172.31.24.227 TCP 187 6633 → 59640 [PSH, ACK] Seq=364 Ack=1 Win=853 Len=121 TSval=2860185 TSecr=391763635
 11 0.000443462 172.31.31.144 -> 172.31.24.227 TCP 187 6633 → 59640 [PSH, ACK] Seq=485 Ack=1 Win=853 Len=121 TSval=2860185 TSecr=391763635
 12 0.000483272 172.31.31.144 -> 172.31.24.227 TCP 187 6633 → 59640 [PSH, ACK] Seq=606 Ack=1 Win=853 Len=121 TSval=2860185 TSecr=391763635
 13 0.000543475 172.31.31.144 -> 172.31.24.227 TCP 187 6633 → 59640 [PSH, ACK] Seq=727 Ack=1 Win=853 Len=121 TSval=2860185 TSecr=391763635
 14 0.000598261 172.31.31.144 -> 172.31.24.227 TCP 187 6633 → 59640 [PSH, ACK] Seq=848 Ack=1 Win=853 Len=121 TSval=2860185 TSecr=391763635
 15 0.000717897 172.31.31.144 -> 172.31.24.227 TCP 187 6633 → 59642 [PSH, ACK] Seq=1 Ack=1 Win=853 Len=121 TSval=2860185 TSecr=391763660
 16 0.000724750 172.31.31.144 -> 172.31.24.227 TCP 187 6633 → 59642 [PSH, ACK] Seq=122 Ack=1 Win=853 Len=121 TSval=2860185 TSecr=391763660
 17 0.000774147 172.31.31.144 -> 172.31.24.227 TCP 187 6633 → 59642 [PSH, ACK] Seq=243 Ack=1 Win=853 Len=121 TSval=2860185 TSecr=391763660
 18 0.000814520 172.31.24.227 -> 172.31.31.144 TCP 66 59640 → 6633 [ACK] Seq=1 Ack=969 Win=213 Len=0 TSval=391764060 TSecr=2860185
 19 0.000833346 172.31.31.144 -> 172.31.24.227 TCP 187 6633 → 59642 [PSH, ACK] Seq=364 Ack=1 Win=853 Len=121 TSval=2860185 TSecr=391763660
 20 0.000947485 172.31.24.227 -> 172.31.31.144 OpenFlow 189 Type: OFPT_PACKET_IN
 21 0.000997470 172.31.31.144 -> 172.31.24.227 TCP 187 6633 → 59642 [PSH, ACK] Seq=485 Ack=1 Win=853 Len=121 TSval=2860185 TSecr=391763660
 22 0.001005467 172.31.31.144 -> 172.31.24.227 TCP 187 6633 → 59642 [PSH, ACK] Seq=606 Ack=1 Win=853 Len=121 TSval=2860185 TSecr=391763660
 23 0.001012267 172.31.24.227 -> 172.31.31.144 OpenFlow 189 Type: OFPT_PACKET_IN
 24 0.001119821 172.31.31.144 -> 172.31.24.227 TCP 187 6633 → 59642 [PSH, ACK] Seq=727 Ack=1 Win=853 Len=121 TSval=2860185 TSecr=391763660
 25 0.001125930 172.31.31.144 -> 172.31.24.227 TCP 187 6633 → 59642 [PSH, ACK] Seq=848 Ack=1 Win=853 Len=121 TSval=2860185 TSecr=391763660
 26 0.001128333 172.31.31.144 -> 172.31.24.227 TCP 187 6633 → 59642 [PSH, ACK] Seq=969 Ack=1 Win=853 Len=121 TSval=2860185 TSecr=391763660
 27 0.001193568 172.31.31.144 -> 172.31.24.227 TCP 187 6633 → 59642 [PSH, ACK] Seq=1090 Ack=1 Win=853 Len=121 TSval=2860185 TSecr=391763660
 28 0.001304452 172.31.31.144 -> 172.31.24.227 TCP 187 6633 → 59644 [PSH, ACK] Seq=1 Ack=1 Win=853 Len=121 TSval=2860185 TSecr=391763660
 29 0.001311287 172.31.31.144 -> 172.31.24.227 TCP 187 6633 → 59644 [PSH, ACK] Seq=122 Ack=1 Win=853 Len=121 TSval=2860185 TSecr=391763660
 30 0.001398964 172.31.31.144 -> 172.31.24.227 TCP 187 6633 → 59644 [PSH, ACK] Seq=243 Ack=1 Win=853 Len=121 TSval=2860185 TSecr=391763660
 31 0.001543019 172.31.31.144 -> 172.31.24.227 TCP 187 6633 → 59644 [PSH, ACK] Seq=364 Ack=1 Win=853 Len=121 TSval=2860185 TSecr=391763660
 32 0.001549198 172.31.31.144 -> 172.31.24.227 TCP 66 6633 → 59638 [ACK] Seq=727 Ack=247 Win=853 Len=0 TSval=2860185 TSecr=391764060
 33 0.001554441 172.31.31.144 -> 172.31.24.227 TCP 187 6633 → 59644 [PSH, ACK] Seq=485 Ack=1 Win=853 Len=121 TSval=2860185 TSecr=391763660
 34 0.001556845 172.31.31.144 -> 172.31.24.227 TCP 187 6633 → 59644 [PSH, ACK] Seq=606 Ack=1 Win=853 Len=121 TSval=2860185 TSecr=391763660
 35 0.001674781 172.31.31.144 -> 172.31.24.227 TCP 187 6633 → 59644 [PSH, ACK] Seq=727 Ack=1 Win=853 Len=121 TSval=2860185 TSecr=391763660
 36 0.001679887 172.31.31.144 -> 172.31.24.227 TCP 187 6633 → 59644 [PSH, ACK] Seq=848 Ack=1 Win=853 Len=121 TSval=2860185 TSecr=391763660
 37 0.001685431 172.31.24.227 -> 172.31.31.144 TCP 66 59644 → 6633 [ACK] Seq=1 Ack=727 Win=213 Len=0 TSval=391764060 TSecr=2860185
 38 0.001805247 172.31.24.227 -> 172.31.31.144 TCP 66 59644 → 6633 [ACK] Seq=1 Ack=969 Win=213 Len=0 TSval=391764060 TSecr=2860185
 39 0.001892296 172.31.24.227 -> 172.31.31.144 OpenFlow 189 Type: OFPT_PACKET_IN
 40 0.001917153 172.31.24.227 -> 172.31.31.144 OpenFlow 435 Type: OFPT_PACKET_IN
 41 0.001933087 172.31.24.227 -> 172.31.31.144 OpenFlow 189 Type: OFPT_PACKET_IN
 42 0.002008512 172.31.24.227 -> 172.31.31.144 OpenFlow 435 Type: OFPT_PACKET_IN
 43 0.002248030 172.31.31.144 -> 172.31.24.227 TCP 66 6633 → 59648 [ACK] Seq=1 Ack=124 Win=853 Len=0 TSval=2860186 TSecr=391764060
 44 0.002255025 172.31.31.144 -> 172.31.24.227 TCP 66 6633 → 59648 [ACK] Seq=1 Ack=493 Win=853 Len=0 TSval=2860186 TSecr=391764060
 45 0.002257711 172.31.31.144 -> 172.31.24.227 TCP 66 6633 → 59642 [ACK] Seq=1211 Ack=124 Win=853 Len=0 TSval=2860186 TSecr=391764060
 46 0.002324784 172.31.31.144 -> 172.31.24.227 TCP 66 6633 → 59642 [ACK] Seq=1211 Ack=493 Win=853 Len=0 TSval=2860186 TSecr=391764060
 47 0.002586322 172.31.24.227 -> 172.31.31.144 OpenFlow 189 Type: OFPT_PACKET_IN
 48 0.002614413 172.31.24.227 -> 172.31.31.144 OpenFlow 189 Type: OFPT_PACKET_IN
 49 0.002620275 172.31.24.227 -> 172.31.31.144 OpenFlow 189 Type: OFPT_PACKET_IN
 50 0.002708063 172.31.24.227 -> 172.31.31.144 OpenFlow 189 Type: OFPT_PACKET_IN
 51 0.002732177 172.31.24.227 -> 172.31.31.144 OpenFlow 189 Type: OFPT_PACKET_IN
 52 0.002735331 172.31.24.227 -> 172.31.31.144 OpenFlow 435 Type: OFPT_PACKET_IN
 53 0.002903892 172.31.24.227 -> 172.31.31.144 OpenFlow 189 Type: OFPT_PACKET_IN
 54 0.002919150 172.31.24.227 -> 172.31.31.144 OpenFlow 435 Type: OFPT_PACKET_IN
 55 0.003055414 172.31.31.144 -> 172.31.24.227 TCP 66 6633 → 59652 [ACK] Seq=1 Ack=124 Win=853 Len=0 TSval=2860186 TSecr=391764061
 56 0.003062314 172.31.31.144 -> 172.31.24.227 TCP 66 6633 → 59652 [ACK] Seq=1 Ack=247 Win=853 Len=0 TSval=2860186 TSecr=391764061
 57 0.003064939 172.31.31.144 -> 172.31.24.227 TCP 66 6633 → 59650 [ACK] Seq=1 Ack=124 Win=853 Len=0 TSval=2860186 TSecr=391764061
 58 0.003213095 172.31.31.144 -> 172.31.24.227 TCP 66 6633 → 59646 [ACK] Seq=1 Ack=124 Win=853 Len=0 TSval=2860186 TSecr=391764061
 59 0.003218805 172.31.31.144 -> 172.31.24.227 TCP 66 6633 → 59640 [ACK] Seq=969 Ack=493 Win=853 Len=0 TSval=2860186 TSecr=391764061
 60 0.003291878 172.31.31.144 -> 172.31.24.227 TCP 66 6633 → 59650 [ACK] Seq=1 Ack=247 Win=853 Len=0 TSval=2860186 TSecr=391764061
 61 0.003342933 172.31.31.144 -> 172.31.24.227 TCP 66 6633 → 59646 [ACK] Seq=1 Ack=493 Win=853 Len=0 TSval=2860186 TSecr=391764061
 62 0.014458364 172.31.24.227 -> 172.31.31.144 OpenFlow 189 Type: OFPT_PACKET_IN
 63 0.014510814 172.31.24.227 -> 172.31.31.144 OpenFlow 189 Type: OFPT_PACKET_IN
 64 0.014792982 172.31.31.144 -> 172.31.24.227 TCP 66 6633 → 59644 [ACK] Seq=969 Ack=124 Win=853 Len=0 TSval=2860189 TSecr=391764063
 65 0.014802287 172.31.31.144 -> 172.31.24.227 TCP 66 6633 → 59644 [ACK] Seq=969 Ack=247 Win=853 Len=0 TSval=2860189 TSecr=391764064
 66 0.044419824 137.158.125.247 -> 172.31.24.227 TCP 54 63468 → 22 [ACK] Seq=1 Ack=1 Win=32132 Len=0
 67 0.044827968 137.158.125.247 -> 172.31.24.227 TCP 54 63468 → 22 [ACK] Seq=1 Ack=333 Win=32768 Len=0
 68 0.100031542 172.31.31.144 -> 172.31.24.227 OpenFlow 187 Type: OFPT_PACKET_OUT
 69 0.100065007 172.31.31.144 -> 172.31.24.227 OpenFlow 187 Type: OFPT_PACKET_OUT
 70 0.100072169 172.31.31.144 -> 172.31.24.227 OpenFlow 187 Type: OFPT_PACKET_OUT
 71 0.100094745 172.31.31.144 -> 172.31.24.227 OpenFlow 187 Type: OFPT_PACKET_OUT
 72 0.100100952 172.31.31.144 -> 172.31.24.227 OpenFlow 187 Type: OFPT_PACKET_OUT
 73 0.100163096 172.31.31.144 -> 172.31.24.227 OpenFlow 187 Type: OFPT_PACKET_OUT
 74 0.100254093 172.31.31.144 -> 172.31.24.227 OpenFlow 187 Type: OFPT_PACKET_OUT
 75 0.100261508 172.31.31.144 -> 172.31.24.227 OpenFlow 187 Type: OFPT_PACKET_OUT
 76 0.100317002 172.31.31.144 -> 172.31.24.227 OpenFlow 187 Type: OFPT_PACKET_OUT
 77 0.100370812 172.31.31.144 -> 172.31.24.227 OpenFlow 187 Type: OFPT_PACKET_OUT
 78 0.100439784 172.31.31.144 -> 172.31.24.227 OpenFlow 187 Type: OFPT_PACKET_OUT
 79 0.100487919 172.31.31.144 -> 172.31.24.227 OpenFlow 187 Type: OFPT_PACKET_OUT
 80 0.100537581 172.31.31.144 -> 172.31.24.227 OpenFlow 187 Type: OFPT_PACKET_OUT
 81 0.100598605 172.31.31.144 -> 172.31.24.227 OpenFlow 187 Type: OFPT_PACKET_OUT
 82 0.100648906 172.31.31.144 -> 172.31.24.227 OpenFlow 187 Type: OFPT_PACKET_OUT
 83 0.100711601 172.31.31.144 -> 172.31.24.227 OpenFlow 187 Type: OFPT_PACKET_OUT
 84 0.101062996 172.31.24.227 -> 172.31.31.144 TCP 66 59648 → 6633 [ACK] Seq=493 Ack=1211 Win=213 Len=0 TSval=391764085 TSecr=2860210
 85 0.101190589 172.31.24.227 -> 172.31.31.144 OpenFlow 189 Type: OFPT_PACKET_IN
 86 0.101218474 172.31.24.227 -> 172.31.31.144 OpenFlow 189 Type: OFPT_PACKET_IN
 87 0.101239839 172.31.24.227 -> 172.31.31.144 OpenFlow 189 Type: OFPT_PACKET_IN
 88 0.101286578 172.31.24.227 -> 172.31.31.144 OpenFlow 189 Type: OFPT_PACKET_IN
 89 0.101326566 172.31.24.227 -> 172.31.31.144 OpenFlow 189 Type: OFPT_PACKET_IN
 90 0.101329761 172.31.24.227 -> 172.31.31.144 OpenFlow 189 Type: OFPT_PACKET_IN
 91 0.101472080 172.31.24.227 -> 172.31.31.144 OpenFlow 189 Type: OFPT_PACKET_IN
 92 0.101479829 172.31.24.227 -> 172.31.31.144 OpenFlow 189 Type: OFPT_PACKET_IN
 93 0.101550363 172.31.31.144 -> 172.31.24.227 TCP 66 6633 → 59654 [ACK] Seq=1 Ack=124 Win=853 Len=0 TSval=2860210 TSecr=391764085
 94 0.101559133 172.31.31.144 -> 172.31.24.227 TCP 66 6633 → 59654 [ACK] Seq=1 Ack=247 Win=853 Len=0 TSval=2860210 TSecr=391764085
 95 0.101636967 172.31.24.227 -> 172.31.31.144 TCP 66 59646 → 6633 [ACK] Seq=493 Ack=727 Win=213 Len=0 TSval=391764085 TSecr=2860210
 96 0.101734127 172.31.31.144 -> 172.31.24.227 TCP 66 6633 → 59650 [ACK] Seq=1 Ack=370 Win=853 Len=0 TSval=2860210 TSecr=391764085
 97 0.101741355 172.31.31.144 -> 172.31.24.227 TCP 66 6633 → 59640 [ACK] Seq=969 Ack=739 Win=853 Len=0 TSval=2860211 TSecr=391764085
 98 0.101836443 172.31.24.227 -> 172.31.31.144 OpenFlow 189 Type: OFPT_PACKET_IN
 99 0.101847561 172.31.31.144 -> 172.31.24.227 TCP 66 6633 → 59650 [ACK] Seq=1 Ack=493 Win=853 Len=0 TSval=2860211 TSecr=391764085
100 0.101852674 172.31.31.144 -> 172.31.24.227 TCP 66 6633 → 59638 [ACK] Seq=727 Ack=493 Win=853 Len=0 TSval=2860211 TSecr=391764085
101 0.101867342 172.31.24.227 -> 172.31.31.144 OpenFlow 189 Type: OFPT_PACKET_IN
102 0.101887459 172.31.24.227 -> 172.31.31.144 OpenFlow 189 Type: OFPT_PACKET_IN
103 0.101908816 172.31.24.227 -> 172.31.31.144 OpenFlow 189 Type: OFPT_PACKET_IN
104 0.102013133 172.31.24.227 -> 172.31.31.144 OpenFlow 189 Type: OFPT_PACKET_IN
105 0.102019548 172.31.24.227 -> 172.31.31.144 OpenFlow 189 Type: OFPT_PACKET_IN
106 0.102032206 172.31.24.227 -> 172.31.31.144 OpenFlow 189 Type: OFPT_PACKET_IN
107 0.102160232 172.31.31.144 -> 172.31.24.227 TCP 66 6633 → 59644 [ACK] Seq=969 Ack=370 Win=853 Len=0 TSval=2860211 TSecr=391764085
108 0.102167283 172.31.31.144 -> 172.31.24.227 TCP 66 6633 → 59644 [ACK] Seq=969 Ack=493 Win=853 Len=0 TSval=2860211 TSecr=391764085
109 0.102169998 172.31.31.144 -> 172.31.24.227 TCP 66 6633 → 59658 [ACK] Seq=1 Ack=124 Win=853 Len=0 TSval=2860211 TSecr=391764085
110 0.102278809 172.31.24.227 -> 172.31.31.144 OpenFlow 189 Type: OFPT_PACKET_IN
111 0.102327696 172.31.31.144 -> 172.31.24.227 TCP 66 6633 → 59642 [ACK] Seq=1211 Ack=616 Win=853 Len=0 TSval=2860211 TSecr=391764085
112 0.102489160 172.31.31.144 -> 172.31.24.227 TCP 66 6633 → 59658 [ACK] Seq=1 Ack=247 Win=853 Len=0 TSval=2860211 TSecr=391764085
113 0.102493122 172.31.31.144 -> 172.31.24.227 TCP 66 6633 → 59642 [ACK] Seq=1211 Ack=739 Win=853 Len=0 TSval=2860211 TSecr=391764085
114 0.102495461 172.31.31.144 -> 172.31.24.227 TCP 66 6633 → 59650 [ACK] Seq=1 Ack=616 Win=853 Len=0 TSval=2860211 TSecr=391764085
115 0.102539114 172.31.31.144 -> 172.31.24.227 TCP 66 6633 → 59650 [ACK] Seq=1 Ack=739 Win=853 Len=0 TSval=2860211 TSecr=391764085
116 0.138358244 137.158.125.247 -> 172.31.24.227 TCP 54 63468 → 22 [ACK] Seq=1 Ack=429 Win=32720 Len=0
117 0.200094138 172.31.31.144 -> 172.31.24.227 OpenFlow 187 Type: OFPT_PACKET_OUT
118 0.200127126 172.31.31.144 -> 172.31.24.227 OpenFlow 187 Type: OFPT_PACKET_OUT
119 0.200133746 172.31.31.144 -> 172.31.24.227 OpenFlow 187 Type: OFPT_PACKET_OUT
120 0.200157727 172.31.31.144 -> 172.31.24.227 OpenFlow 187 Type: OFPT_PACKET_OUT
121 0.200161459 172.31.31.144 -> 172.31.24.227 OpenFlow 187 Type: OFPT_PACKET_OUT
122 0.200196117 172.31.31.144 -> 172.31.24.227 OpenFlow 187 Type: OFPT_PACKET_OUT
123 0.200256866 172.31.31.144 -> 172.31.24.227 OpenFlow 187 Type: OFPT_PACKET_OUT
124 0.200324423 172.31.31.144 -> 172.31.24.227 OpenFlow 187 Type: OFPT_PACKET_OUT
125 0.200362431 172.31.31.144 -> 172.31.24.227 OpenFlow 187 Type: OFPT_PACKET_OUT
126 0.200416286 172.31.31.144 -> 172.31.24.227 OpenFlow 187 Type: OFPT_PACKET_OUT
127 0.200461084 172.31.31.144 -> 172.31.24.227 OpenFlow 187 Type: OFPT_PACKET_OUT
128 0.200505016 172.31.31.144 -> 172.31.24.227 OpenFlow 187 Type: OFPT_PACKET_OUT
129 0.200560523 172.31.31.144 -> 172.31.24.227 OpenFlow 187 Type: OFPT_PACKET_OUT
130 0.200626953 172.31.31.144 -> 172.31.24.227 OpenFlow 187 Type: OFPT_PACKET_OUT
131 0.200667966 172.31.31.144 -> 172.31.24.227 OpenFlow 187 Type: OFPT_PACKET_OUT
132 0.200739120 172.31.31.144 -> 172.31.24.227 OpenFlow 187 Type: OFPT_PACKET_OUT
133 0.201108439 172.31.24.227 -> 172.31.31.144 TCP 66 59650 → 6633 [ACK] Seq=739 Ack=1211 Win=213 Len=0 TSval=391764110 TSecr=2860235
134 0.201192797 172.31.24.227 -> 172.31.31.144 OpenFlow 189 Type: OFPT_PACKET_IN
135 0.201212902 172.31.24.227 -> 172.31.31.144 OpenFlow 189 Type: OFPT_PACKET_IN
136 0.201338424 172.31.24.227 -> 172.31.31.144 OpenFlow 189 Type: OFPT_PACKET_IN
137 0.201360305 172.31.24.227 -> 172.31.31.144 OpenFlow 189 Type: OFPT_PACKET_IN
138 0.201389832 172.31.24.227 -> 172.31.31.144 OpenFlow 189 Type: OFPT_PACKET_IN
139 0.201396298 172.31.24.227 -> 172.31.31.144 OpenFlow 189 Type: OFPT_PACKET_IN
140 0.201413234 172.31.24.227 -> 172.31.31.144 OpenFlow 189 Type: OFPT_PACKET_IN
141 0.201416305 172.31.24.227 -> 172.31.31.144 OpenFlow 189 Type: OFPT_PACKET_IN
142 0.201440076 172.31.31.144 -> 172.31.24.227 TCP 66 6633 → 59646 [ACK] Seq=727 Ack=616 Win=853 Len=0 TSval=2860235 TSecr=391764110
143 0.201512687 172.31.24.227 -> 172.31.31.144 OpenFlow 189 Type: OFPT_PACKET_IN
144 0.201519884 172.31.24.227 -> 172.31.31.144 OpenFlow 189 Type: OFPT_PACKET_IN
145 0.201616647 172.31.31.144 -> 172.31.24.227 TCP 66 6633 → 59646 [ACK] Seq=727 Ack=739 Win=853 Len=0 TSval=2860235 TSecr=391764110
146 0.201622983 172.31.31.144 -> 172.31.24.227 TCP 66 6633 → 59642 [ACK] Seq=1211 Ack=862 Win=853 Len=0 TSval=2860235 TSecr=391764110
147 0.201625840 172.31.31.144 -> 172.31.24.227 TCP 66 6633 → 59648 [ACK] Seq=1211 Ack=616 Win=853 Len=0 TSval=2860235 TSecr=391764110
148 0.201628358 172.31.31.144 -> 172.31.24.227 TCP 66 6633 → 59654 [ACK] Seq=1 Ack=370 Win=853 Len=0 TSval=2860235 TSecr=391764110
149 0.201796244 172.31.31.144 -> 172.31.24.227 TCP 66 6633 → 59652 [ACK] Seq=727 Ack=370 Win=853 Len=0 TSval=2860236 TSecr=391764110
150 0.201802876 172.31.31.144 -> 172.31.24.227 TCP 66 6633 → 59642 [ACK] Seq=1211 Ack=985 Win=853 Len=0 TSval=2860236 TSecr=391764110
151 0.201807437 172.31.31.144 -> 172.31.24.227 TCP 66 6633 → 59648 [ACK] Seq=1211 Ack=739 Win=853 Len=0 TSval=2860236 TSecr=391764110
152 0.201809935 172.31.31.144 -> 172.31.24.227 TCP 66 6633 → 59654 [ACK] Seq=1 Ack=493 Win=853 Len=0 TSval=2860236 TSecr=391764110
153 0.201836497 172.31.24.227 -> 172.31.31.144 OpenFlow 189 Type: OFPT_PACKET_IN
154 0.201853049 172.31.31.144 -> 172.31.24.227 TCP 66 6633 → 59652 [ACK] Seq=727 Ack=493 Win=853 Len=0 TSval=2860236 TSecr=391764110
155 0.201860027 172.31.24.227 -> 172.31.31.144 OpenFlow 189 Type: OFPT_PACKET_IN
156 0.201916386 172.31.24.227 -> 172.31.31.144 OpenFlow 189 Type: OFPT_PACKET_IN
157 0.201935330 172.31.24.227 -> 172.31.31.144 OpenFlow 189 Type: OFPT_PACKET_IN
158 0.202043856 172.31.24.227 -> 172.31.31.144 OpenFlow 189 Type: OFPT_PACKET_IN
159 0.202056869 172.31.31.144 -> 172.31.24.227 TCP 66 6633 → 59656 [ACK] Seq=1 Ack=124 Win=853 Len=0 TSval=2860236 TSecr=391764110
160 0.202061906 172.31.31.144 -> 172.31.24.227 TCP 66 6633 → 59656 [ACK] Seq=1 Ack=247 Win=853 Len=0 TSval=2860236 TSecr=391764110
161 0.202085538 172.31.24.227 -> 172.31.31.144 OpenFlow 189 Type: OFPT_PACKET_IN
162 0.202143962 172.31.31.144 -> 172.31.24.227 TCP 66 6633 → 59650 [ACK] Seq=1211 Ack=985 Win=853 Len=0 TSval=2860236 TSecr=391764110
163 0.202284426 172.31.31.144 -> 172.31.24.227 TCP 66 6633 → 59644 [ACK] Seq=969 Ack=616 Win=853 Len=0 TSval=2860236 TSecr=391764110
164 0.202291107 172.31.31.144 -> 172.31.24.227 TCP 66 6633 → 59644 [ACK] Seq=969 Ack=739 Win=853 Len=0 TSval=2860236 TSecr=391764110
165 0.300194071 172.31.31.144 -> 172.31.24.227 OpenFlow 187 Type: OFPT_PACKET_OUT
166 0.300224724 172.31.31.144 -> 172.31.24.227 OpenFlow 187 Type: OFPT_PACKET_OUT
167 0.300231107 172.31.31.144 -> 172.31.24.227 OpenFlow 187 Type: OFPT_PACKET_OUT
168 0.300233709 172.31.31.144 -> 172.31.24.227 OpenFlow 187 Type: OFPT_PACKET_OUT
169 0.300257093 172.31.31.144 -> 172.31.24.227 OpenFlow 187 Type: OFPT_PACKET_OUT
170 0.300260356 172.31.31.144 -> 172.31.24.227 OpenFlow 187 Type: OFPT_PACKET_OUT
171 0.300279358 172.31.31.144 -> 172.31.24.227 OpenFlow 187 Type: OFPT_PACKET_OUT
172 0.300332780 172.31.31.144 -> 172.31.24.227 OpenFlow 187 Type: OFPT_PACKET_OUT
173 0.300394288 172.31.31.144 -> 172.31.24.227 OpenFlow 187 Type: OFPT_PACKET_OUT
174 0.300461156 172.31.31.144 -> 172.31.24.227 OpenFlow 187 Type: OFPT_PACKET_OUT
175 0.300500806 172.31.31.144 -> 172.31.24.227 OpenFlow 187 Type: OFPT_PACKET_OUT
176 0.300547974 172.31.31.144 -> 172.31.24.227 OpenFlow 187 Type: OFPT_PACKET_OUT
177 0.300602987 172.31.31.144 -> 172.31.24.227 OpenFlow 187 Type: OFPT_PACKET_OUT
178 0.300659387 172.31.31.144 -> 172.31.24.227 OpenFlow 187 Type: OFPT_PACKET_OUT
179 0.300715616 172.31.31.144 -> 172.31.24.227 OpenFlow 187 Type: OFPT_PACKET_OUT
180 0.300772916 172.31.31.144 -> 172.31.24.227 OpenFlow 187 Type: OFPT_PACKET_OUT
181 0.300834988 172.31.31.144 -> 172.31.24.227 OpenFlow 187 Type: OFPT_PACKET_OUT
182 0.300880082 172.31.31.144 -> 172.31.24.227 OpenFlow 187 Type: OFPT_PACKET_OUT
183 0.301202645 172.31.24.227 -> 172.31.31.144 TCP 66 59654 → 6633 [ACK] Seq=493 Ack=1211 Win=213 Len=0 TSval=391764135 TSecr=2860260
184 0.301325354 172.31.24.227 -> 172.31.31.144 OpenFlow 189 Type: OFPT_PACKET_IN
185 0.301348708 172.31.24.227 -> 172.31.31.144 OpenFlow 189 Type: OFPT_PACKET_IN
186 0.301579840 172.31.31.144 -> 172.31.24.227 TCP 66 6633 → 59656 [ACK] Seq=969 Ack=493 Win=853 Len=0 TSval=2860260 TSecr=391764135
187 0.301840921 172.31.24.227 -> 172.31.31.144 OpenFlow 189 Type: OFPT_PACKET_IN
188 0.301864941 172.31.24.227 -> 172.31.31.144 OpenFlow 189 Type: OFPT_PACKET_IN
189 0.301987833 172.31.24.227 -> 172.31.31.144 OpenFlow 189 Type: OFPT_PACKET_IN
190 0.302024224 172.31.24.227 -> 172.31.31.144 OpenFlow 189 Type: OFPT_PACKET_IN
191 0.302040273 172.31.24.227 -> 172.31.31.144 OpenFlow 189 Type: OFPT_PACKET_IN
192 0.302063373 172.31.24.227 -> 172.31.31.144 OpenFlow 189 Type: OFPT_PACKET_IN
193 0.302080344 172.31.24.227 -> 172.31.31.144 OpenFlow 189 Type: OFPT_PACKET_IN
194 0.302101563 172.31.31.144 -> 172.31.24.227 TCP 66 6633 → 59650 [ACK] Seq=1211 Ack=1108 Win=853 Len=0 TSval=2860261 TSecr=391764135
195 0.302107777 172.31.31.144 -> 172.31.24.227 TCP 66 6633 → 59650 [ACK] Seq=1211 Ack=1231 Win=853 Len=0 TSval=2860261 TSecr=391764135
196 0.302126267 172.31.24.227 -> 172.31.31.144 OpenFlow 189 Type: OFPT_PACKET_IN
197 0.302153522 172.31.24.227 -> 172.31.31.144 OpenFlow 189 Type: OFPT_PACKET_IN
198 0.302157208 172.31.24.227 -> 172.31.31.144 OpenFlow 189 Type: OFPT_PACKET_IN
199 0.302174373 172.31.24.227 -> 172.31.31.144 OpenFlow 189 Type: OFPT_PACKET_IN
200 0.302250817 172.31.31.144 -> 172.31.24.227 TCP 66 6633 → 59664 [ACK] Seq=1 Ack=124 Win=853 Len=0 TSval=2860261 TSecr=391764135
201 0.302259975 172.31.24.227 -> 172.31.31.144 OpenFlow 189 Type: OFPT_PACKET_IN
202 0.302266485 172.31.24.227 -> 172.31.31.144 OpenFlow 189 Type: OFPT_PACKET_IN
203 0.302269167 172.31.24.227 -> 172.31.31.144 OpenFlow 189 Type: OFPT_PACKET_IN
204 0.302493492 172.31.31.144 -> 172.31.24.227 TCP 66 6633 → 59664 [ACK] Seq=1 Ack=247 Win=853 Len=0 TSval=2860261 TSecr=391764135
205 0.302499901 172.31.31.144 -> 172.31.24.227 TCP 66 6633 → 59660 [ACK] Seq=1 Ack=124 Win=853 Len=0 TSval=2860261 TSecr=391764135
206 0.302502624 172.31.31.144 -> 172.31.24.227 TCP 66 6633 → 59658 [ACK] Seq=1 Ack=370 Win=853 Len=0 TSval=2860261 TSecr=391764135
207 0.302504948 172.31.31.144 -> 172.31.24.227 TCP 66 6633 → 59648 [ACK] Seq=1211 Ack=862 Win=853 Len=0 TSval=2860261 TSecr=391764135
208 0.302507368 172.31.31.144 -> 172.31.24.227 TCP 66 6633 → 59662 [ACK] Seq=1 Ack=124 Win=853 Len=0 TSval=2860261 TSecr=391764135
209 0.302522015 172.31.24.227 -> 172.31.31.144 OpenFlow 189 Type: OFPT_PACKET_IN
210 0.302528820 172.31.24.227 -> 172.31.31.144 OpenFlow 189 Type: OFPT_PACKET_IN
211 0.302596960 172.31.31.144 -> 172.31.24.227 TCP 66 6633 → 59654 [ACK] Seq=1211 Ack=616 Win=853 Len=0 TSval=2860261 TSecr=391764135
212 0.302601380 172.31.31.144 -> 172.31.24.227 TCP 66 6633 → 59660 [ACK] Seq=1 Ack=247 Win=853 Len=0 TSval=2860261 TSecr=391764135
213 0.302743038 172.31.31.144 -> 172.31.24.227 TCP 66 6633 → 59652 [ACK] Seq=727 Ack=616 Win=853 Len=0 TSval=2860261 TSecr=391764135
214 0.302746812 172.31.31.144 -> 172.31.24.227 TCP 66 6633 → 59658 [ACK] Seq=1 Ack=493 Win=853 Len=0 TSval=2860261 TSecr=391764135
215 0.302749579 172.31.31.144 -> 172.31.24.227 TCP 66 6633 → 59648 [ACK] Seq=1211 Ack=985 Win=853 Len=0 TSval=2860261 TSecr=391764135
216 0.302752106 172.31.31.144 -> 172.31.24.227 TCP 66 6633 → 59662 [ACK] Seq=1 Ack=247 Win=853 Len=0 TSval=2860261 TSecr=391764135
217 0.302910796 172.31.31.144 -> 172.31.24.227 TCP 66 6633 → 59654 [ACK] Seq=1211 Ack=739 Win=853 Len=0 TSval=2860261 TSecr=391764136
218 0.302914921 172.31.31.144 -> 172.31.24.227 TCP 66 6633 → 59652 [ACK] Seq=727 Ack=739 Win=853 Len=0 TSval=2860261 TSecr=391764136
219 0.400149307 172.31.31.144 -> 172.31.24.227 OpenFlow 187 Type: OFPT_PACKET_OUT
220 0.400177488 172.31.31.144 -> 172.31.24.227 OpenFlow 187 Type: OFPT_PACKET_OUT
221 0.400198412 172.31.31.144 -> 172.31.24.227 OpenFlow 187 Type: OFPT_PACKET_OUT
222 0.400217417 172.31.31.144 -> 172.31.24.227 OpenFlow 187 Type: OFPT_PACKET_OUT
223 0.400270236 172.31.31.144 -> 172.31.24.227 OpenFlow 187 Type: OFPT_PACKET_OUT
224 0.400324312 172.31.31.144 -> 172.31.24.227 OpenFlow 187 Type: OFPT_PACKET_OUT
225 0.400377426 172.31.31.144 -> 172.31.24.227 OpenFlow 187 Type: OFPT_PACKET_OUT
226 0.400445675 172.31.31.144 -> 172.31.24.227 OpenFlow 187 Type: OFPT_PACKET_OUT
227 0.400505706 172.31.31.144 -> 172.31.24.227 OpenFlow 187 Type: OFPT_PACKET_OUT
228 0.400544291 172.31.31.144 -> 172.31.24.227 OpenFlow 187 Type: OFPT_PACKET_OUT
229 0.400610818 172.31.31.144 -> 172.31.24.227 OpenFlow 187 Type: OFPT_PACKET_OUT
230 0.400660922 172.31.31.144 -> 172.31.24.227 OpenFlow 187 Type: OFPT_PACKET_OUT
231 0.400735610 172.31.31.144 -> 172.31.24.227 OpenFlow 187 Type: OFPT_PACKET_OUT
232 0.400785975 172.31.31.144 -> 172.31.24.227 OpenFlow 187 Type: OFPT_PACKET_OUT
233 0.400833552 172.31.31.144 -> 172.31.24.227 OpenFlow 187 Type: OFPT_PACKET_OUT
234 0.400901541 172.31.31.144 -> 172.31.24.227 OpenFlow 187 Type: OFPT_PACKET_OUT
235 0.400947734 172.31.31.144 -> 172.31.24.227 OpenFlow 187 Type: OFPT_PACKET_OUT
236 0.401000479 172.31.31.144 -> 172.31.24.227 OpenFlow 187 Type: OFPT_PACKET_OUT
237 0.401202520 172.31.24.227 -> 172.31.31.144 TCP 66 59658 → 6633 [ACK] Seq=493 Ack=1211 Win=213 Len=0 TSval=391764160 TSecr=2860285
238 0.401292282 172.31.24.227 -> 172.31.31.144 OpenFlow 189 Type: OFPT_PACKET_IN
239 0.401312927 172.31.24.227 -> 172.31.31.144 OpenFlow 189 Type: OFPT_PACKET_IN
240 0.401356404 172.31.24.227 -> 172.31.31.144 OpenFlow 189 Type: OFPT_PACKET_IN
241 0.401371808 172.31.24.227 -> 172.31.31.144 OpenFlow 189 Type: OFPT_PACKET_IN
242 0.401389239 172.31.24.227 -> 172.31.31.144 OpenFlow 189 Type: OFPT_PACKET_IN
243 0.401439957 172.31.24.227 -> 172.31.31.144 OpenFlow 189 Type: OFPT_PACKET_IN
244 0.401492571 172.31.24.227 -> 172.31.31.144 OpenFlow 189 Type: OFPT_PACKET_IN
245 0.401503068 172.31.31.144 -> 172.31.24.227 TCP 66 6633 → 59648 [ACK] Seq=1211 Ack=1108 Win=853 Len=0 TSval=2860285 TSecr=391764160
246 0.401510305 172.31.31.144 -> 172.31.24.227 TCP 66 6633 → 59648 [ACK] Seq=1211 Ack=1231 Win=853 Len=0 TSval=2860285 TSecr=391764160
247 0.401530478 172.31.24.227 -> 172.31.31.144 OpenFlow 189 Type: OFPT_PACKET_IN
248 0.401595052 172.31.31.144 -> 172.31.24.227 TCP 66 6633 → 59674 [ACK] Seq=1 Ack=124 Win=853 Len=0 TSval=2860285 TSecr=391764160
249 0.401601118 172.31.31.144 -> 172.31.24.227 TCP 66 6633 → 59674 [ACK] Seq=1 Ack=247 Win=853 Len=0 TSval=2860285 TSecr=391764160
250 0.401638506 172.31.31.144 -> 172.31.24.227 TCP 66 6633 → 59654 [ACK] Seq=1211 Ack=862 Win=853 Len=0 TSval=2860285 TSecr=391764160
251 0.401671769 172.31.24.227 -> 172.31.31.144 OpenFlow 189 Type: OFPT_PACKET_IN
252 0.401689667 172.31.24.227 -> 172.31.31.144 OpenFlow 189 Type: OFPT_PACKET_IN
253 0.401736769 172.31.31.144 -> 172.31.24.227 TCP 66 6633 → 59666 [ACK] Seq=1 Ack=124 Win=853 Len=0 TSval=2860286 TSecr=391764160
254 0.401804063 172.31.31.144 -> 172.31.24.227 TCP 66 6633 → 59666 [ACK] Seq=1 Ack=247 Win=853 Len=0 TSval=2860286 TSecr=391764160
255 0.401810399 172.31.31.144 -> 172.31.24.227 TCP 66 6633 → 59654 [ACK] Seq=1211 Ack=985 Win=853 Len=0 TSval=2860286 TSecr=391764160
256 0.401894784 172.31.31.144 -> 172.31.24.227 TCP 66 6633 → 59660 [ACK] Seq=969 Ack=370 Win=853 Len=0 TSval=2860286 TSecr=391764160
257 0.402021169 172.31.31.144 -> 172.31.24.227 TCP 66 6633 → 59660 [ACK] Seq=969 Ack=493 Win=853 Len=0 TSval=2860286 TSecr=391764160
258 0.402175615 172.31.24.227 -> 172.31.31.144 OpenFlow 189 Type: OFPT_PACKET_IN
259 0.402193908 172.31.24.227 -> 172.31.31.144 OpenFlow 189 Type: OFPT_PACKET_IN
260 0.402224523 172.31.24.227 -> 172.31.31.144 OpenFlow 189 Type: OFPT_PACKET_IN
261 0.402247640 172.31.24.227 -> 172.31.31.144 OpenFlow 189 Type: OFPT_PACKET_IN
262 0.402252480 172.31.24.227 -> 172.31.31.144 OpenFlow 189 Type: OFPT_PACKET_IN
263 0.402272907 172.31.24.227 -> 172.31.31.144 OpenFlow 189 Type: OFPT_PACKET_IN
264 0.402324296 172.31.24.227 -> 172.31.31.144 OpenFlow 189 Type: OFPT_PACKET_IN
265 0.402329931 172.31.24.227 -> 172.31.31.144 OpenFlow 189 Type: OFPT_PACKET_IN
266 0.402383672 172.31.31.144 -> 172.31.24.227 TCP 66 6633 → 59658 [ACK] Seq=1211 Ack=616 Win=853 Len=0 TSval=2860286 TSecr=391764160
267 0.402389705 172.31.31.144 -> 172.31.24.227 TCP 66 6633 → 59658 [ACK] Seq=1211 Ack=739 Win=853 Len=0 TSval=2860286 TSecr=391764160
268 0.402496241 172.31.31.144 -> 172.31.24.227 TCP 66 6633 → 59668 [ACK] Seq=1 Ack=247 Win=853 Len=0 TSval=2860286 TSecr=391764160
269 0.402502817 172.31.31.144 -> 172.31.24.227 TCP 66 6633 → 59662 [ACK] Seq=1 Ack=370 Win=853 Len=0 TSval=2860286 TSecr=391764160
270 0.402575009 172.31.31.144 -> 172.31.24.227 TCP 66 6633 → 59654 [ACK] Seq=1211 Ack=1108 Win=853 Len=0 TSval=2860286 TSecr=391764160
271 0.402579246 172.31.31.144 -> 172.31.24.227 TCP 66 6633 → 59662 [ACK] Seq=1 Ack=493 Win=853 Len=0 TSval=2860286 TSecr=391764160
272 0.402686612 172.31.31.144 -> 172.31.24.227 TCP 66 6633 → 59654 [ACK] Seq=1211 Ack=1231 Win=853 Len=0 TSval=2860286 TSecr=391764160
273 0.491557545 172.31.24.227 -> 137.158.125.247 SSH 98 Server: Encrypted packet (len=44)
274 0.500261086 172.31.31.144 -> 172.31.24.227 OpenFlow 187 Type: OFPT_PACKET_OUT
275 0.500279742 172.31.31.144 -> 172.31.24.227 OpenFlow 187 Type: OFPT_PACKET_OUT
276 0.500340657 172.31.31.144 -> 172.31.24.227 OpenFlow 187 Type: OFPT_PACKET_OUT
277 0.500380877 172.31.31.144 -> 172.31.24.227 OpenFlow 187 Type: OFPT_PACKET_OUT
278 0.500448650 172.31.31.144 -> 172.31.24.227 OpenFlow 187 Type: OFPT_PACKET_OUT
279 0.500489603 172.31.31.144 -> 172.31.24.227 OpenFlow 187 Type: OFPT_PACKET_OUT
280 0.500548310 172.31.31.144 -> 172.31.24.227 OpenFlow 187 Type: OFPT_PACKET_OUT
281 0.500608806 172.31.31.144 -> 172.31.24.227 OpenFlow 187 Type: OFPT_PACKET_OUT
282 0.500924273 172.31.24.227 -> 172.31.31.144 TCP 66 59662 → 6633 [ACK] Seq=493 Ack=969 Win=213 Len=0 TSval=391764185 TSecr=2860310
283 0.501053388 172.31.24.227 -> 172.31.31.144 OpenFlow 189 Type: OFPT_PACKET_IN
284 0.501075449 172.31.24.227 -> 172.31.31.144 OpenFlow 189 Type: OFPT_PACKET_IN
285 0.501092406 172.31.24.227 -> 172.31.31.144 OpenFlow 189 Type: OFPT_PACKET_IN
286 0.501132916 172.31.24.227 -> 172.31.31.144 OpenFlow 189 Type: OFPT_PACKET_IN
287 0.501244485 172.31.31.144 -> 172.31.24.227 TCP 66 6633 → 59670 [ACK] Seq=1 Ack=124 Win=853 Len=0 TSval=2860310 TSecr=391764185
288 0.501257435 172.31.24.227 -> 172.31.31.144 OpenFlow 189 Type: OFPT_PACKET_IN
289 0.501281065 172.31.24.227 -> 172.31.31.144 OpenFlow 189 Type: OFPT_PACKET_IN
290 0.501339523 172.31.31.144 -> 172.31.24.227 TCP 66 6633 → 59670 [ACK] Seq=1 Ack=247 Win=853 Len=0 TSval=2860310 TSecr=391764185
291 0.501345222 172.31.31.144 -> 172.31.24.227 TCP 66 6633 → 59656 [ACK] Seq=969 Ack=616 Win=853 Len=0 TSval=2860310 TSecr=391764185
292 0.501348167 172.31.31.144 -> 172.31.24.227 TCP 66 6633 → 59656 [ACK] Seq=969 Ack=739 Win=853 Len=0 TSval=2860310 TSecr=391764185
293 0.501380542 172.31.24.227 -> 172.31.31.144 OpenFlow 189 Type: OFPT_PACKET_IN
294 0.501386613 172.31.24.227 -> 172.31.31.144 OpenFlow 189 Type: OFPT_PACKET_IN
295 0.501527033 172.31.31.144 -> 172.31.24.227 TCP 66 6633 → 59664 [ACK] Seq=1 Ack=370 Win=853 Len=0 TSval=2860310 TSecr=391764185
296 0.501599988 172.31.31.144 -> 172.31.24.227 TCP 66 6633 → 59660 [ACK] Seq=969 Ack=616 Win=853 Len=0 TSval=2860310 TSecr=391764185
297 0.501603618 172.31.31.144 -> 172.31.24.227 TCP 66 6633 → 59664 [ACK] Seq=1 Ack=493 Win=853 Len=0 TSval=2860310 TSecr=391764185
298 0.501703577 172.31.31.144 -> 172.31.24.227 TCP 66 6633 → 59660 [ACK] Seq=969 Ack=739 Win=853 Len=0 TSval=2860311 TSecr=391764185
299 0.600112940 172.31.31.144 -> 172.31.24.227 OpenFlow 187 Type: OFPT_PACKET_OUT
300 0.600155894 172.31.31.144 -> 172.31.24.227 OpenFlow 187 Type: OFPT_PACKET_OUT
301 0.600162807 172.31.31.144 -> 172.31.24.227 OpenFlow 187 Type: OFPT_PACKET_OUT
302 0.600165778 172.31.31.144 -> 172.31.24.227 OpenFlow 187 Type: OFPT_PACKET_OUT
303 0.600168289 172.31.31.144 -> 172.31.24.227 OpenFlow 187 Type: OFPT_PACKET_OUT
304 0.600188412 172.31.31.144 -> 172.31.24.227 OpenFlow 187 Type: OFPT_PACKET_OUT
305 0.600213969 172.31.31.144 -> 172.31.24.227 OpenFlow 187 Type: OFPT_PACKET_OUT
306 0.600218234 172.31.31.144 -> 172.31.24.227 OpenFlow 187 Type: OFPT_PACKET_OUT
307 0.600257222 172.31.31.144 -> 172.31.24.227 OpenFlow 187 Type: OFPT_PACKET_OUT
308 0.600308978 172.31.31.144 -> 172.31.24.227 OpenFlow 187 Type: OFPT_PACKET_OUT
309 0.600363833 172.31.31.144 -> 172.31.24.227 OpenFlow 187 Type: OFPT_PACKET_OUT
310 0.600432120 172.31.31.144 -> 172.31.24.227 OpenFlow 187 Type: OFPT_PACKET_OUT
311 0.600772963 172.31.24.227 -> 172.31.31.144 TCP 66 59664 → 6633 [ACK] Seq=493 Ack=727 Win=213 Len=0 TSval=391764210 TSecr=2860335
312 0.600926790 172.31.24.227 -> 172.31.31.144 OpenFlow 189 Type: OFPT_PACKET_IN
313 0.600947857 172.31.24.227 -> 172.31.31.144 OpenFlow 189 Type: OFPT_PACKET_IN
314 0.601000163 172.31.24.227 -> 172.31.31.144 OpenFlow 189 Type: OFPT_PACKET_IN
315 0.601017389 172.31.24.227 -> 172.31.31.144 OpenFlow 189 Type: OFPT_PACKET_IN
316 0.601066782 172.31.24.227 -> 172.31.31.144 OpenFlow 189 Type: OFPT_PACKET_IN
317 0.601086486 172.31.24.227 -> 172.31.31.144 OpenFlow 189 Type: OFPT_PACKET_IN
318 0.601153218 172.31.31.144 -> 172.31.24.227 TCP 66 6633 → 59662 [ACK] Seq=969 Ack=616 Win=853 Len=0 TSval=2860335 TSecr=391764210
319 0.601164242 172.31.31.144 -> 172.31.24.227 TCP 66 6633 → 59662 [ACK] Seq=969 Ack=739 Win=853 Len=0 TSval=2860335 TSecr=391764210
320 0.601203769 172.31.31.144 -> 172.31.24.227 TCP 66 6633 → 59656 [ACK] Seq=969 Ack=862 Win=853 Len=0 TSval=2860335 TSecr=391764210
321 0.601264744 172.31.31.144 -> 172.31.24.227 TCP 66 6633 → 59672 [ACK] Seq=1 Ack=124 Win=853 Len=0 TSval=2860335 TSecr=391764210
322 0.601350150 172.31.31.144 -> 172.31.24.227 TCP 66 6633 → 59656 [ACK] Seq=969 Ack=985 Win=853 Len=0 TSval=2860335 TSecr=391764210
323 0.601356486 172.31.31.144 -> 172.31.24.227 TCP 66 6633 → 59672 [ACK] Seq=1 Ack=247 Win=853 Len=0 TSval=2860335 TSecr=391764210
324 0.601437698 172.31.24.227 -> 172.31.31.144 TCP 66 59666 → 6633 [ACK] Seq=247 Ack=727 Win=213 Len=0 TSval=391764210 TSecr=2860335
325 0.601616352 172.31.24.227 -> 172.31.31.144 OpenFlow 189 Type: OFPT_PACKET_IN
326 0.601650788 172.31.24.227 -> 172.31.31.144 OpenFlow 189 Type: OFPT_PACKET_IN
327 0.601687630 172.31.24.227 -> 172.31.31.144 OpenFlow 189 Type: OFPT_PACKET_IN
328 0.601709802 172.31.24.227 -> 172.31.31.144 OpenFlow 189 Type: OFPT_PACKET_IN
329 0.601730521 172.31.24.227 -> 172.31.31.144 OpenFlow 189 Type: OFPT_PACKET_IN
330 0.601767034 172.31.24.227 -> 172.31.31.144 OpenFlow 189 Type: OFPT_PACKET_IN
331 0.601831229 172.31.31.144 -> 172.31.24.227 TCP 66 6633 → 59676 [ACK] Seq=1 Ack=124 Win=853 Len=0 TSval=2860336 TSecr=391764210
332 0.601839228 172.31.31.144 -> 172.31.24.227 TCP 66 6633 → 59676 [ACK] Seq=1 Ack=247 Win=853 Len=0 TSval=2860336 TSecr=391764210
333 0.601888280 172.31.31.144 -> 172.31.24.227 TCP 66 6633 → 59658 [ACK] Seq=1211 Ack=862 Win=853 Len=0 TSval=2860336 TSecr=391764210
334 0.602039301 172.31.31.144 -> 172.31.24.227 TCP 66 6633 → 59658 [ACK] Seq=1211 Ack=985 Win=853 Len=0 TSval=2860336 TSecr=391764210
335 0.602132197 172.31.31.144 -> 172.31.24.227 TCP 66 6633 → 59668 [ACK] Seq=1 Ack=493 Win=853 Len=0 TSval=2860336 TSecr=391764210
336 0.699248871 137.158.125.247 -> 172.31.24.227 TCP 54 63468 → 22 [ACK] Seq=1 Ack=473 Win=32698 Len=0
337 0.699806894 172.31.31.144 -> 172.31.24.227 OpenFlow 187 Type: OFPT_PACKET_OUT
338 0.699816287 172.31.31.144 -> 172.31.24.227 OpenFlow 187 Type: OFPT_PACKET_OUT
339 0.699820228 172.31.31.144 -> 172.31.24.227 OpenFlow 187 Type: OFPT_PACKET_OUT
340 0.699837062 172.31.31.144 -> 172.31.24.227 OpenFlow 187 Type: OFPT_PACKET_OUT
341 0.699877890 172.31.31.144 -> 172.31.24.227 OpenFlow 187 Type: OFPT_PACKET_OUT
342 0.699934651 172.31.31.144 -> 172.31.24.227 OpenFlow 187 Type: OFPT_PACKET_OUT
343 0.699997149 172.31.31.144 -> 172.31.24.227 OpenFlow 187 Type: OFPT_PACKET_OUT
344 0.700036885 172.31.31.144 -> 172.31.24.227 OpenFlow 187 Type: OFPT_PACKET_OUT
345 0.700099426 172.31.31.144 -> 172.31.24.227 OpenFlow 187 Type: OFPT_PACKET_OUT
346 0.700149223 172.31.31.144 -> 172.31.24.227 OpenFlow 187 Type: OFPT_PACKET_OUT
347 0.700548280 172.31.24.227 -> 172.31.31.144 TCP 66 59668 → 6633 [ACK] Seq=493 Ack=1211 Win=213 Len=0 TSval=391764235 TSecr=2860360
348 0.700671888 172.31.24.227 -> 172.31.31.144 OpenFlow 189 Type: OFPT_PACKET_IN
349 0.700693039 172.31.24.227 -> 172.31.31.144 OpenFlow 189 Type: OFPT_PACKET_IN
350 0.700731018 172.31.24.227 -> 172.31.31.144 OpenFlow 189 Type: OFPT_PACKET_IN
351 0.700753208 172.31.24.227 -> 172.31.31.144 OpenFlow 189 Type: OFPT_PACKET_IN
352 0.700783551 172.31.24.227 -> 172.31.31.144 OpenFlow 189 Type: OFPT_PACKET_IN
353 0.700805819 172.31.24.227 -> 172.31.31.144 OpenFlow 189 Type: OFPT_PACKET_IN
354 0.700905742 172.31.31.144 -> 172.31.24.227 TCP 66 6633 → 59670 [ACK] Seq=1 Ack=370 Win=853 Len=0 TSval=2860360 TSecr=391764235
355 0.700913253 172.31.31.144 -> 172.31.24.227 TCP 66 6633 → 59670 [ACK] Seq=1 Ack=493 Win=853 Len=0 TSval=2860360 TSecr=391764235
356 0.700919585 172.31.24.227 -> 172.31.31.144 OpenFlow 189 Type: OFPT_PACKET_IN
357 0.700925827 172.31.24.227 -> 172.31.31.144 OpenFlow 189 Type: OFPT_PACKET_IN
358 0.700981636 172.31.24.227 -> 172.31.31.144 OpenFlow 189 Type: OFPT_PACKET_IN
359 0.701031735 172.31.31.144 -> 172.31.24.227 TCP 66 6633 → 59678 [ACK] Seq=1 Ack=124 Win=853 Len=0 TSval=2860360 TSecr=391764235
360 0.701042830 172.31.24.227 -> 172.31.31.144 OpenFlow 189 Type: OFPT_PACKET_IN
361 0.701147573 172.31.31.144 -> 172.31.24.227 TCP 66 6633 → 59666 [ACK] Seq=727 Ack=370 Win=853 Len=0 TSval=2860360 TSecr=391764235
362 0.701152796 172.31.31.144 -> 172.31.24.227 TCP 66 6633 → 59680 [ACK] Seq=1 Ack=247 Win=853 Len=0 TSval=2860360 TSecr=391764235
363 0.701155729 172.31.31.144 -> 172.31.24.227 TCP 66 6633 → 59666 [ACK] Seq=727 Ack=493 Win=853 Len=0 TSval=2860360 TSecr=391764235
364 0.701158202 172.31.31.144 -> 172.31.24.227 TCP 66 6633 → 59678 [ACK] Seq=1 Ack=247 Win=853 Len=0 TSval=2860360 TSecr=391764235
365 0.701230236 172.31.31.144 -> 172.31.24.227 TCP 66 6633 → 59660 [ACK] Seq=969 Ack=862 Win=853 Len=0 TSval=2860360 TSecr=391764235
366 0.701363717 172.31.31.144 -> 172.31.24.227 TCP 66 6633 → 59660 [ACK] Seq=969 Ack=985 Win=853 Len=0 TSval=2860360 TSecr=391764235
367 0.800407232 172.31.31.144 -> 172.31.24.227 OpenFlow 187 Type: OFPT_PACKET_OUT
368 0.800418624 172.31.31.144 -> 172.31.24.227 OpenFlow 187 Type: OFPT_PACKET_OUT
369 0.800436733 172.31.31.144 -> 172.31.24.227 OpenFlow 187 Type: OFPT_PACKET_OUT
370 0.800496246 172.31.31.144 -> 172.31.24.227 OpenFlow 187 Type: OFPT_PACKET_OUT
371 0.800554788 172.31.31.144 -> 172.31.24.227 OpenFlow 187 Type: OFPT_PACKET_OUT
372 0.800600326 172.31.31.144 -> 172.31.24.227 OpenFlow 187 Type: OFPT_PACKET_OUT
373 0.800656956 172.31.31.144 -> 172.31.24.227 OpenFlow 187 Type: OFPT_PACKET_OUT
374 0.800710165 172.31.31.144 -> 172.31.24.227 OpenFlow 187 Type: OFPT_PACKET_OUT
375 0.800763903 172.31.31.144 -> 172.31.24.227 OpenFlow 187 Type: OFPT_PACKET_OUT
376 0.800821315 172.31.31.144 -> 172.31.24.227 OpenFlow 187 Type: OFPT_PACKET_OUT
377 0.800900995 172.31.31.144 -> 172.31.24.227 OpenFlow 187 Type: OFPT_PACKET_OUT
378 0.800947625 172.31.31.144 -> 172.31.24.227 OpenFlow 187 Type: OFPT_PACKET_OUT
379 0.801012215 172.31.31.144 -> 172.31.24.227 OpenFlow 187 Type: OFPT_PACKET_OUT
380 0.801059038 172.31.31.144 -> 172.31.24.227 OpenFlow 187 Type: OFPT_PACKET_OUT
381 0.801112736 172.31.31.144 -> 172.31.24.227 OpenFlow 187 Type: OFPT_PACKET_OUT
382 0.801179274 172.31.31.144 -> 172.31.24.227 OpenFlow 187 Type: OFPT_PACKET_OUT
383 0.801281660 172.31.24.227 -> 172.31.31.144 TCP 66 59670 → 6633 [ACK] Seq=493 Ack=1211 Win=213 Len=0 TSval=391764260 TSecr=2860385
384 0.801374646 172.31.24.227 -> 172.31.31.144 OpenFlow 189 Type: OFPT_PACKET_IN
385 0.801395581 172.31.24.227 -> 172.31.31.144 OpenFlow 189 Type: OFPT_PACKET_IN
386 0.801411318 172.31.24.227 -> 172.31.31.144 OpenFlow 189 Type: OFPT_PACKET_IN
387 0.801450368 172.31.24.227 -> 172.31.31.144 OpenFlow 189 Type: OFPT_PACKET_IN
388 0.801533015 172.31.24.227 -> 172.31.31.144 OpenFlow 189 Type: OFPT_PACKET_IN
389 0.801541424 172.31.24.227 -> 172.31.31.144 OpenFlow 189 Type: OFPT_PACKET_IN
390 0.801555110 172.31.31.144 -> 172.31.24.227 TCP 66 6633 → 59682 [ACK] Seq=1 Ack=124 Win=853 Len=0 TSval=2860385 TSecr=391764260
391 0.801644011 172.31.31.144 -> 172.31.24.227 TCP 66 6633 → 59682 [ACK] Seq=1 Ack=247 Win=853 Len=0 TSval=2860385 TSecr=391764260
