  1 0.000000000 172.31.31.144 -> 172.31.23.72 TCP 187 6633 → 48358 [PSH, ACK] Seq=1 Ack=1 Win=853 Len=121 TSval=3425057 TSecr=21994812
  2 0.000033590 172.31.31.144 -> 172.31.23.72 TCP 187 6633 → 48358 [PSH, ACK] Seq=122 Ack=1 Win=853 Len=121 TSval=3425057 TSecr=21994812
  3 0.000089267 172.31.31.144 -> 172.31.23.72 TCP 187 6633 → 48358 [PSH, ACK] Seq=243 Ack=1 Win=853 Len=121 TSval=3425057 TSecr=21994812
  4 0.000218890 172.31.31.144 -> 172.31.23.72 TCP 187 6633 → 48358 [PSH, ACK] Seq=364 Ack=1 Win=853 Len=121 TSval=3425057 TSecr=21994812
  5 0.000225039 172.31.31.144 -> 172.31.23.72 TCP 187 6633 → 48358 [PSH, ACK] Seq=485 Ack=1 Win=853 Len=121 TSval=3425057 TSecr=21994812
  6 0.000271491 172.31.31.144 -> 172.31.23.72 TCP 187 6633 → 48358 [PSH, ACK] Seq=606 Ack=1 Win=853 Len=121 TSval=3425057 TSecr=21994812
  7 0.000328271 172.31.31.144 -> 172.31.23.72 TCP 187 6633 → 48358 [PSH, ACK] Seq=727 Ack=1 Win=853 Len=121 TSval=3425057 TSecr=21994812
  8 0.000387865 172.31.31.144 -> 172.31.23.72 TCP 187 6633 → 48358 [PSH, ACK] Seq=848 Ack=1 Win=853 Len=121 TSval=3425057 TSecr=21994812
  9 0.000476946 172.31.31.144 -> 172.31.23.72 TCP 187 6633 → 48346 [PSH, ACK] Seq=1 Ack=1 Win=853 Len=121 TSval=3425057 TSecr=21994730
 10 0.000529888 172.31.31.144 -> 172.31.23.72 TCP 187 6633 → 48346 [PSH, ACK] Seq=122 Ack=1 Win=853 Len=121 TSval=3425057 TSecr=21994730
 11 0.000553885 172.31.23.72 -> 172.31.31.144 TCP 66 48358 → 6633 [ACK] Seq=1 Ack=969 Win=213 Len=0 TSval=21995182 TSecr=3425057
 12 0.000629365 172.31.31.144 -> 172.31.23.72 TCP 187 6633 → 48346 [PSH, ACK] Seq=243 Ack=1 Win=853 Len=121 TSval=3425057 TSecr=21994730
 13 0.000682879 172.31.31.144 -> 172.31.23.72 TCP 187 6633 → 48346 [PSH, ACK] Seq=364 Ack=1 Win=853 Len=121 TSval=3425057 TSecr=21994730
 14 0.000730317 172.31.31.144 -> 172.31.23.72 TCP 187 6633 → 48346 [PSH, ACK] Seq=485 Ack=1 Win=853 Len=121 TSval=3425057 TSecr=21994730
 15 0.000800455 172.31.31.144 -> 172.31.23.72 TCP 187 6633 → 48346 [PSH, ACK] Seq=606 Ack=1 Win=853 Len=121 TSval=3425057 TSecr=21994730
 16 0.000888728 172.31.31.144 -> 172.31.23.72 TCP 187 6633 → 48342 [PSH, ACK] Seq=1 Ack=1 Win=853 Len=121 TSval=3425057 TSecr=21994713
 17 0.000924836 172.31.31.144 -> 172.31.23.72 TCP 187 6633 → 48342 [PSH, ACK] Seq=122 Ack=1 Win=853 Len=121 TSval=3425057 TSecr=21994713
 18 0.000935280 172.31.23.72 -> 172.31.31.144 TCP 66 48346 → 6633 [ACK] Seq=1 Ack=727 Win=213 Len=0 TSval=21995183 TSecr=3425057
 19 0.000999838 172.31.31.144 -> 172.31.23.72 TCP 187 6633 → 48342 [PSH, ACK] Seq=243 Ack=1 Win=853 Len=121 TSval=3425057 TSecr=21994713
 20 0.001050530 172.31.31.144 -> 172.31.23.72 TCP 187 6633 → 48342 [PSH, ACK] Seq=364 Ack=1 Win=853 Len=121 TSval=3425057 TSecr=21994713
 21 0.001109944 172.31.31.144 -> 172.31.23.72 TCP 187 6633 → 48342 [PSH, ACK] Seq=485 Ack=1 Win=853 Len=121 TSval=3425057 TSecr=21994713
 22 0.001179547 172.31.31.144 -> 172.31.23.72 TCP 187 6633 → 48342 [PSH, ACK] Seq=606 Ack=1 Win=853 Len=121 TSval=3425057 TSecr=21994713
 23 0.001228741 172.31.31.144 -> 172.31.23.72 TCP 187 6633 → 48342 [PSH, ACK] Seq=727 Ack=1 Win=853 Len=121 TSval=3425057 TSecr=21994713
 24 0.001295552 172.31.31.144 -> 172.31.23.72 TCP 187 6633 → 48342 [PSH, ACK] Seq=848 Ack=1 Win=853 Len=121 TSval=3425057 TSecr=21994713
 25 0.001372494 172.31.23.72 -> 172.31.31.144 TCP 66 48342 → 6633 [ACK] Seq=1 Ack=969 Win=213 Len=0 TSval=21995183 TSecr=3425057
 26 0.001383462 172.31.31.144 -> 172.31.23.72 TCP 187 6633 → 48326 [PSH, ACK] Seq=1 Ack=1 Win=853 Len=121 TSval=3425057 TSecr=21994615
 27 0.001450513 172.31.31.144 -> 172.31.23.72 TCP 187 6633 → 48326 [PSH, ACK] Seq=122 Ack=1 Win=853 Len=121 TSval=3425057 TSecr=21994615
 28 0.001499766 172.31.31.144 -> 172.31.23.72 TCP 187 6633 → 48326 [PSH, ACK] Seq=243 Ack=1 Win=853 Len=121 TSval=3425057 TSecr=21994615
 29 0.001540836 172.31.31.144 -> 172.31.23.72 TCP 187 6633 → 48326 [PSH, ACK] Seq=364 Ack=1 Win=853 Len=121 TSval=3425057 TSecr=21994615
 30 0.001598197 172.31.31.144 -> 172.31.23.72 TCP 187 6633 → 48326 [PSH, ACK] Seq=485 Ack=1 Win=853 Len=121 TSval=3425057 TSecr=21994615
 31 0.001620392 172.31.23.72 -> 172.31.31.144 TCP 66 48326 → 6633 [ACK] Seq=1 Ack=606 Win=213 Len=0 TSval=21995183 TSecr=3425057
 32 0.001687752 172.31.31.144 -> 172.31.23.72 TCP 187 6633 → 48326 [PSH, ACK] Seq=606 Ack=1 Win=853 Len=121 TSval=3425057 TSecr=21994615
 33 0.001704456 172.31.23.72 -> 172.31.31.144 OpenFlow 189 Type: OFPT_PACKET_IN
 34 0.001715046 172.31.31.144 -> 172.31.23.72 TCP 187 6633 → 48326 [PSH, ACK] Seq=727 Ack=1 Win=853 Len=121 TSval=3425057 TSecr=21994615
 35 0.001726011 172.31.23.72 -> 172.31.31.144 OpenFlow 189 Type: OFPT_PACKET_IN
 36 0.001750215 172.31.23.72 -> 172.31.31.144 OpenFlow 189 Type: OFPT_PACKET_IN
 37 0.001765678 172.31.23.72 -> 172.31.31.144 OpenFlow 189 Type: OFPT_PACKET_IN
 38 0.001784239 172.31.23.72 -> 172.31.31.144 OpenFlow 189 Type: OFPT_PACKET_IN
 39 0.001800444 172.31.23.72 -> 172.31.31.144 OpenFlow 189 Type: OFPT_PACKET_IN
 40 0.001803430 172.31.23.72 -> 172.31.31.144 OpenFlow 189 Type: OFPT_PACKET_IN
 41 0.001816999 172.31.23.72 -> 172.31.31.144 OpenFlow 189 Type: OFPT_PACKET_IN
 42 0.001834404 172.31.31.144 -> 172.31.23.72 TCP 187 6633 → 48326 [PSH, ACK] Seq=848 Ack=1 Win=853 Len=121 TSval=3425057 TSecr=21994615
 43 0.001852507 172.31.23.72 -> 172.31.31.144 OpenFlow 189 Type: OFPT_PACKET_IN
 44 0.001858218 172.31.23.72 -> 172.31.31.144 OpenFlow 189 Type: OFPT_PACKET_IN
 45 0.001889430 172.31.23.72 -> 172.31.31.144 OpenFlow 189 Type: OFPT_PACKET_IN
 46 0.001891935 172.31.23.72 -> 172.31.31.144 OpenFlow 435 Type: OFPT_PACKET_IN
 47 0.001905707 172.31.23.72 -> 172.31.31.144 OpenFlow 189 Type: OFPT_PACKET_IN
 48 0.001907927 172.31.23.72 -> 172.31.31.144 OpenFlow 189 Type: OFPT_PACKET_IN
 49 0.001921147 172.31.23.72 -> 172.31.31.144 OpenFlow 189 Type: OFPT_PACKET_IN
 50 0.001937997 172.31.23.72 -> 172.31.31.144 OpenFlow 189 Type: OFPT_PACKET_IN
 51 0.001990342 172.31.31.144 -> 172.31.23.72 OpenFlow 187 Type: OFPT_PACKET_OUT
 52 0.001998146 172.31.31.144 -> 172.31.23.72 OpenFlow 187 Type: OFPT_PACKET_OUT
 53 0.002000775 172.31.31.144 -> 172.31.23.72 TCP 66 6633 → 48324 [ACK] Seq=1 Ack=124 Win=853 Len=0 TSval=3425057 TSecr=21995183
 54 0.002006461 172.31.23.72 -> 172.31.31.144 OpenFlow 189 Type: OFPT_PACKET_IN
 55 0.002013140 172.31.23.72 -> 172.31.31.144 OpenFlow 189 Type: OFPT_PACKET_IN
 56 0.002157831 172.31.23.72 -> 172.31.31.144 OpenFlow 189 Type: OFPT_PACKET_IN
 57 0.002161192 172.31.23.72 -> 172.31.31.144 OpenFlow 189 Type: OFPT_PACKET_IN
 58 0.002194981 172.31.23.72 -> 172.31.31.144 TCP 66 48326 → 6633 [ACK] Seq=1 Ack=969 Win=213 Len=0 TSval=21995183 TSecr=3425057
 59 0.002197847 172.31.23.72 -> 172.31.31.144 OpenFlow 189 Type: OFPT_PACKET_IN
 60 0.002247272 172.31.31.144 -> 172.31.23.72 TCP 66 6633 → 48344 [ACK] Seq=1 Ack=124 Win=853 Len=0 TSval=3425057 TSecr=21995183
 61 0.002253963 172.31.31.144 -> 172.31.23.72 TCP 66 6633 → 48356 [ACK] Seq=1 Ack=124 Win=853 Len=0 TSval=3425057 TSecr=21995183
 62 0.002256135 172.31.31.144 -> 172.31.23.72 TCP 66 6633 → 48324 [ACK] Seq=1 Ack=247 Win=853 Len=0 TSval=3425057 TSecr=21995183
 63 0.002258466 172.31.31.144 -> 172.31.23.72 TCP 66 6633 → 48336 [ACK] Seq=1 Ack=124 Win=853 Len=0 TSval=3425057 TSecr=21995183
 64 0.002260463 172.31.31.144 -> 172.31.23.72 TCP 66 6633 → 48338 [ACK] Seq=1 Ack=124 Win=853 Len=0 TSval=3425057 TSecr=21995183
 65 0.002262550 172.31.31.144 -> 172.31.23.72 TCP 66 6633 → 48344 [ACK] Seq=1 Ack=493 Win=853 Len=0 TSval=3425057 TSecr=21995183
 66 0.002328690 172.31.23.72 -> 172.31.31.144 TCP 66 48340 → 6633 [ACK] Seq=247 Ack=243 Win=213 Len=0 TSval=21995183 TSecr=3425057
 67 0.002440275 172.31.31.144 -> 172.31.23.72 TCP 66 6633 → 48356 [ACK] Seq=1 Ack=247 Win=853 Len=0 TSval=3425057 TSecr=21995183
 68 0.002446169 172.31.31.144 -> 172.31.23.72 TCP 66 6633 → 48348 [ACK] Seq=1 Ack=124 Win=853 Len=0 TSval=3425057 TSecr=21995183
 69 0.002448808 172.31.31.144 -> 172.31.23.72 TCP 66 6633 → 48328 [ACK] Seq=1 Ack=124 Win=853 Len=0 TSval=3425057 TSecr=21995183
 70 0.002450902 172.31.31.144 -> 172.31.23.72 TCP 66 6633 → 48336 [ACK] Seq=1 Ack=247 Win=853 Len=0 TSval=3425057 TSecr=21995183
 71 0.002452696 172.31.31.144 -> 172.31.23.72 TCP 66 6633 → 48338 [ACK] Seq=1 Ack=247 Win=853 Len=0 TSval=3425057 TSecr=21995183
 72 0.002459199 172.31.23.72 -> 172.31.31.144 OpenFlow 189 Type: OFPT_PACKET_IN
 73 0.002483873 172.31.23.72 -> 172.31.31.144 OpenFlow 189 Type: OFPT_PACKET_IN
 74 0.002542039 172.31.31.144 -> 172.31.23.72 TCP 66 6633 → 48348 [ACK] Seq=1 Ack=247 Win=853 Len=0 TSval=3425057 TSecr=21995183
 75 0.002547802 172.31.23.72 -> 172.31.31.144 OpenFlow 189 Type: OFPT_PACKET_IN
 76 0.002599000 172.31.31.144 -> 172.31.23.72 TCP 66 6633 → 48350 [ACK] Seq=1 Ack=247 Win=853 Len=0 TSval=3425057 TSecr=21995183
 77 0.002622084 172.31.31.144 -> 172.31.23.72 TCP 66 6633 → 48334 [ACK] Seq=1 Ack=124 Win=853 Len=0 TSval=3425057 TSecr=21995183
 78 0.002637498 172.31.31.144 -> 172.31.23.72 TCP 66 6633 → 48360 [ACK] Seq=1 Ack=247 Win=853 Len=0 TSval=3425057 TSecr=21995183
 79 0.002658598 172.31.31.144 -> 172.31.23.72 TCP 66 6633 → 48334 [ACK] Seq=1 Ack=247 Win=853 Len=0 TSval=3425057 TSecr=21995183
 80 0.002678312 172.31.23.72 -> 172.31.31.144 OpenFlow 189 Type: OFPT_PACKET_IN
 81 0.002701637 172.31.31.144 -> 172.31.23.72 TCP 66 6633 → 48328 [ACK] Seq=1 Ack=247 Win=853 Len=0 TSval=3425057 TSecr=21995183
 82 0.002706857 172.31.23.72 -> 172.31.31.144 OpenFlow 189 Type: OFPT_PACKET_IN
 83 0.002851356 172.31.31.144 -> 172.31.23.72 TCP 66 6633 → 48342 [ACK] Seq=969 Ack=124 Win=853 Len=0 TSval=3425057 TSecr=21995183
 84 0.002865174 172.31.31.144 -> 172.31.23.72 TCP 66 6633 → 48342 [ACK] Seq=969 Ack=247 Win=853 Len=0 TSval=3425057 TSecr=21995183
 85 0.003190205 172.31.31.144 -> 172.31.23.72 TCP 66 6633 → 48354 [ACK] Seq=1 Ack=247 Win=853 Len=0 TSval=3425057 TSecr=21995183
 86 0.003266552 172.31.31.144 -> 172.31.23.72 OpenFlow 187 Type: OFPT_PACKET_OUT
 87 0.003307415 172.31.31.144 -> 172.31.23.72 OpenFlow 792 Type: OFPT_PACKET_OUT
 88 0.003587678 172.31.23.72 -> 172.31.31.144 TCP 66 48340 → 6633 [ACK] Seq=247 Ack=1090 Win=213 Len=0 TSval=21995183 TSecr=3425057
 89 0.003603441 172.31.31.144 -> 172.31.23.72 OpenFlow 187 Type: OFPT_PACKET_OUT
 90 0.003698761 172.31.31.144 -> 172.31.23.72 TCP 187 6633 → 48330 [PSH, ACK] Seq=1 Ack=1 Win=853 Len=121 TSval=3425057 TSecr=21994635
 91 0.003716311 172.31.23.72 -> 172.31.31.144 OpenFlow 189 Type: OFPT_PACKET_IN
 92 0.003739122 172.31.23.72 -> 172.31.31.144 OpenFlow 189 Type: OFPT_PACKET_IN
 93 0.003773576 172.31.31.144 -> 172.31.23.72 OpenFlow 187 Type: OFPT_PACKET_OUT
 94 0.003869688 172.31.23.72 -> 172.31.31.144 OpenFlow 189 Type: OFPT_PACKET_IN
 95 0.003892770 172.31.23.72 -> 172.31.31.144 OpenFlow 189 Type: OFPT_PACKET_IN
 96 0.003897779 172.31.23.72 -> 172.31.31.144 OpenFlow 189 Type: OFPT_PACKET_IN
 97 0.003952924 172.31.23.72 -> 172.31.31.144 OpenFlow 189 Type: OFPT_PACKET_IN
 98 0.003961345 172.31.23.72 -> 172.31.31.144 OpenFlow 189 Type: OFPT_PACKET_IN
 99 0.003974952 172.31.23.72 -> 172.31.31.144 OpenFlow 189 Type: OFPT_PACKET_IN
100 0.003981314 172.31.31.144 -> 172.31.23.72 TCP 66 6633 → 48330 [ACK] Seq=243 Ack=247 Win=853 Len=0 TSval=3425058 TSecr=21995183
101 0.004022749 172.31.23.72 -> 172.31.31.144 OpenFlow 189 Type: OFPT_PACKET_IN
102 0.004081873 172.31.31.144 -> 172.31.23.72 TCP 66 6633 → 48356 [ACK] Seq=1 Ack=370 Win=853 Len=0 TSval=3425058 TSecr=21995183
103 0.004086613 172.31.31.144 -> 172.31.23.72 TCP 66 6633 → 48336 [ACK] Seq=1 Ack=370 Win=853 Len=0 TSval=3425058 TSecr=21995183
104 0.004088484 172.31.31.144 -> 172.31.23.72 TCP 66 6633 → 48356 [ACK] Seq=1 Ack=493 Win=853 Len=0 TSval=3425058 TSecr=21995183
105 0.004092486 172.31.23.72 -> 172.31.31.144 OpenFlow 189 Type: OFPT_PACKET_IN
106 0.004117429 172.31.31.144 -> 172.31.23.72 TCP 66 6633 → 48336 [ACK] Seq=1 Ack=493 Win=853 Len=0 TSval=3425058 TSecr=21995183
107 0.004158203 172.31.31.144 -> 172.31.23.72 TCP 66 6633 → 48348 [ACK] Seq=1 Ack=370 Win=853 Len=0 TSval=3425058 TSecr=21995183
108 0.004175560 172.31.31.144 -> 172.31.23.72 TCP 66 6633 → 48332 [ACK] Seq=1 Ack=124 Win=853 Len=0 TSval=3425058 TSecr=21995183
109 0.004214474 172.31.31.144 -> 172.31.23.72 TCP 66 6633 → 48348 [ACK] Seq=1 Ack=493 Win=853 Len=0 TSval=3425058 TSecr=21995183
110 0.004256867 172.31.31.144 -> 172.31.23.72 TCP 66 6633 → 48332 [ACK] Seq=1 Ack=247 Win=853 Len=0 TSval=3425058 TSecr=21995183
111 0.004635852 172.31.31.144 -> 172.31.23.72 OpenFlow 187 Type: OFPT_PACKET_OUT
112 0.004669853 172.31.31.144 -> 172.31.23.72 OpenFlow 792 Type: OFPT_PACKET_OUT
113 0.004785243 172.31.31.144 -> 172.31.23.72 OpenFlow 187 Type: OFPT_PACKET_OUT
114 0.004857997 172.31.31.144 -> 172.31.23.72 OpenFlow 187 Type: OFPT_PACKET_OUT
115 0.004922261 172.31.31.144 -> 172.31.23.72 OpenFlow 187 Type: OFPT_PACKET_OUT
116 0.004994361 172.31.31.144 -> 172.31.23.72 OpenFlow 187 Type: OFPT_PACKET_OUT
117 0.005048031 172.31.31.144 -> 172.31.23.72 OpenFlow 187 Type: OFPT_PACKET_OUT
118 0.005109460 172.31.31.144 -> 172.31.23.72 OpenFlow 187 Type: OFPT_PACKET_OUT
119 0.005142637 172.31.23.72 -> 172.31.31.144 TCP 66 48330 → 6633 [ACK] Seq=247 Ack=1211 Win=213 Len=0 TSval=21995184 TSecr=3425057
120 0.005158368 172.31.31.144 -> 172.31.23.72 OpenFlow 187 Type: OFPT_PACKET_OUT
121 0.005235031 172.31.31.144 -> 172.31.23.72 OpenFlow 187 Type: OFPT_PACKET_OUT
122 0.005298127 172.31.31.144 -> 172.31.23.72 OpenFlow 187 Type: OFPT_PACKET_OUT
123 0.005350438 172.31.31.144 -> 172.31.23.72 OpenFlow 187 Type: OFPT_PACKET_OUT
124 0.005414795 172.31.31.144 -> 172.31.23.72 OpenFlow 187 Type: OFPT_PACKET_OUT
125 0.005584036 172.31.23.72 -> 172.31.31.144 TCP 66 48324 → 6633 [ACK] Seq=247 Ack=1211 Win=213 Len=0 TSval=21995184 TSecr=3425058
126 0.005665018 172.31.23.72 -> 172.31.31.144 OpenFlow 189 Type: OFPT_PACKET_IN
127 0.005703046 172.31.23.72 -> 172.31.31.144 OpenFlow 189 Type: OFPT_PACKET_IN
128 0.005711711 172.31.23.72 -> 172.31.31.144 OpenFlow 189 Type: OFPT_PACKET_IN
129 0.005746250 172.31.23.72 -> 172.31.31.144 OpenFlow 189 Type: OFPT_PACKET_IN
130 0.005771985 172.31.23.72 -> 172.31.31.144 OpenFlow 189 Type: OFPT_PACKET_IN
131 0.005774209 172.31.23.72 -> 172.31.31.144 OpenFlow 435 Type: OFPT_PACKET_IN
132 0.005791866 172.31.23.72 -> 172.31.31.144 OpenFlow 189 Type: OFPT_PACKET_IN
133 0.005879837 172.31.23.72 -> 172.31.31.144 OpenFlow 189 Type: OFPT_PACKET_IN
134 0.005885670 172.31.23.72 -> 172.31.31.144 OpenFlow 189 Type: OFPT_PACKET_IN
135 0.005894178 172.31.23.72 -> 172.31.31.144 OpenFlow 189 Type: OFPT_PACKET_IN
136 0.005905266 172.31.23.72 -> 172.31.31.144 OpenFlow 189 Type: OFPT_PACKET_IN
137 0.005907410 172.31.23.72 -> 172.31.31.144 OpenFlow 189 Type: OFPT_PACKET_IN
138 0.005942213 172.31.31.144 -> 172.31.23.72 TCP 66 6633 → 48336 [ACK] Seq=1 Ack=616 Win=853 Len=0 TSval=3425058 TSecr=21995184
139 0.005947202 172.31.31.144 -> 172.31.23.72 TCP 66 6633 → 48336 [ACK] Seq=1 Ack=739 Win=853 Len=0 TSval=3425058 TSecr=21995184
140 0.006003939 172.31.23.72 -> 172.31.31.144 OpenFlow 189 Type: OFPT_PACKET_IN
141 0.006055195 172.31.23.72 -> 172.31.31.144 OpenFlow 189 Type: OFPT_PACKET_IN
142 0.006105014 172.31.31.144 -> 172.31.23.72 TCP 66 6633 → 48320 [ACK] Seq=1 Ack=124 Win=853 Len=0 TSval=3425058 TSecr=21995184
143 0.006110748 172.31.31.144 -> 172.31.23.72 TCP 66 6633 → 48332 [ACK] Seq=1 Ack=370 Win=853 Len=0 TSval=3425058 TSecr=21995184
144 0.006112748 172.31.31.144 -> 172.31.23.72 TCP 66 6633 → 48328 [ACK] Seq=1 Ack=370 Win=853 Len=0 TSval=3425058 TSecr=21995184
145 0.006114357 172.31.31.144 -> 172.31.23.72 TCP 66 6633 → 48320 [ACK] Seq=1 Ack=247 Win=853 Len=0 TSval=3425058 TSecr=21995184
146 0.006168738 172.31.31.144 -> 172.31.23.72 TCP 66 6633 → 48332 [ACK] Seq=1 Ack=493 Win=853 Len=0 TSval=3425058 TSecr=21995184
147 0.006170644 172.31.31.144 -> 172.31.23.72 TCP 66 6633 → 48326 [ACK] Seq=969 Ack=124 Win=853 Len=0 TSval=3425058 TSecr=21995184
148 0.006210469 172.31.31.144 -> 172.31.23.72 TCP 66 6633 → 48328 [ACK] Seq=1 Ack=493 Win=853 Len=0 TSval=3425058 TSecr=21995184
149 0.006227180 172.31.31.144 -> 172.31.23.72 TCP 66 6633 → 48326 [ACK] Seq=969 Ack=247 Win=853 Len=0 TSval=3425058 TSecr=21995184
150 0.006432908 172.31.31.144 -> 172.31.23.72 TCP 66 6633 → 48322 [ACK] Seq=1 Ack=493 Win=853 Len=0 TSval=3425058 TSecr=21995184
151 0.006455524 172.31.31.144 -> 172.31.23.72 TCP 66 6633 → 48340 [ACK] Seq=1211 Ack=493 Win=853 Len=0 TSval=3425058 TSecr=21995184
152 0.200105708 172.31.31.144 -> 172.31.23.72 OpenFlow 187 Type: OFPT_PACKET_OUT
153 0.200128494 172.31.31.144 -> 172.31.23.72 OpenFlow 187 Type: OFPT_PACKET_OUT
154 0.200160145 172.31.31.144 -> 172.31.23.72 OpenFlow 187 Type: OFPT_PACKET_OUT
155 0.200198266 172.31.31.144 -> 172.31.23.72 OpenFlow 187 Type: OFPT_PACKET_OUT
156 0.200253971 172.31.31.144 -> 172.31.23.72 OpenFlow 187 Type: OFPT_PACKET_OUT
157 0.200310650 172.31.31.144 -> 172.31.23.72 OpenFlow 187 Type: OFPT_PACKET_OUT
158 0.200399837 172.31.31.144 -> 172.31.23.72 OpenFlow 187 Type: OFPT_PACKET_OUT
159 0.200458778 172.31.31.144 -> 172.31.23.72 OpenFlow 187 Type: OFPT_PACKET_OUT
160 0.200496518 172.31.31.144 -> 172.31.23.72 OpenFlow 187 Type: OFPT_PACKET_OUT
161 0.200573121 172.31.31.144 -> 172.31.23.72 OpenFlow 187 Type: OFPT_PACKET_OUT
162 0.200710079 172.31.31.144 -> 172.31.23.72 OpenFlow 187 Type: OFPT_PACKET_OUT
163 0.200748964 172.31.31.144 -> 172.31.23.72 OpenFlow 187 Type: OFPT_PACKET_OUT
164 0.200774798 172.31.31.144 -> 172.31.23.72 OpenFlow 187 Type: OFPT_PACKET_OUT
165 0.200834046 172.31.31.144 -> 172.31.23.72 OpenFlow 187 Type: OFPT_PACKET_OUT
166 0.200912607 172.31.31.144 -> 172.31.23.72 OpenFlow 187 Type: OFPT_PACKET_OUT
167 0.200973932 172.31.31.144 -> 172.31.23.72 OpenFlow 187 Type: OFPT_PACKET_OUT
168 0.200989194 172.31.23.72 -> 172.31.31.144 TCP 66 48350 → 6633 [ACK] Seq=247 Ack=1211 Win=213 Len=0 TSval=21995233 TSecr=3425107
169 0.201038323 172.31.31.144 -> 172.31.23.72 OpenFlow 187 Type: OFPT_PACKET_OUT
170 0.201093334 172.31.31.144 -> 172.31.23.72 OpenFlow 187 Type: OFPT_PACKET_OUT
171 0.201195885 172.31.31.144 -> 172.31.23.72 OpenFlow 187 Type: OFPT_PACKET_OUT
172 0.201243104 172.31.31.144 -> 172.31.23.72 OpenFlow 187 Type: OFPT_PACKET_OUT
173 0.201303128 172.31.31.144 -> 172.31.23.72 OpenFlow 187 Type: OFPT_PACKET_OUT
174 0.201363440 172.31.31.144 -> 172.31.23.72 OpenFlow 187 Type: OFPT_PACKET_OUT
175 0.201422263 172.31.31.144 -> 172.31.23.72 OpenFlow 187 Type: OFPT_PACKET_OUT
176 0.201437233 172.31.23.72 -> 172.31.31.144 TCP 66 48344 → 6633 [ACK] Seq=493 Ack=969 Win=213 Len=0 TSval=21995233 TSecr=3425107
177 0.201480193 172.31.31.144 -> 172.31.23.72 OpenFlow 187 Type: OFPT_PACKET_OUT
178 0.201565895 172.31.31.144 -> 172.31.23.72 OpenFlow 187 Type: OFPT_PACKET_OUT
179 0.201654413 172.31.31.144 -> 172.31.23.72 OpenFlow 187 Type: OFPT_PACKET_OUT
180 0.201671782 172.31.31.144 -> 172.31.23.72 OpenFlow 187 Type: OFPT_PACKET_OUT
181 0.201694112 172.31.23.72 -> 172.31.31.144 TCP 66 48356 → 6633 [ACK] Seq=493 Ack=727 Win=213 Len=0 TSval=21995233 TSecr=3425107
182 0.201767379 172.31.31.144 -> 172.31.23.72 OpenFlow 187 Type: OFPT_PACKET_OUT
183 0.201812643 172.31.31.144 -> 172.31.23.72 OpenFlow 187 Type: OFPT_PACKET_OUT
184 0.201883672 172.31.31.144 -> 172.31.23.72 OpenFlow 187 Type: OFPT_PACKET_OUT
185 0.201951190 172.31.31.144 -> 172.31.23.72 OpenFlow 187 Type: OFPT_PACKET_OUT
186 0.202011047 172.31.31.144 -> 172.31.23.72 OpenFlow 187 Type: OFPT_PACKET_OUT
187 0.202066591 172.31.31.144 -> 172.31.23.72 OpenFlow 187 Type: OFPT_PACKET_OUT
188 0.202139580 172.31.31.144 -> 172.31.23.72 OpenFlow 187 Type: OFPT_PACKET_OUT
189 0.202227518 172.31.23.72 -> 172.31.31.144 TCP 66 48336 → 6633 [ACK] Seq=739 Ack=1211 Win=213 Len=0 TSval=21995233 TSecr=3425107
190 0.202246276 172.31.31.144 -> 172.31.23.72 OpenFlow 187 Type: OFPT_PACKET_OUT
191 0.202303602 172.31.31.144 -> 172.31.23.72 OpenFlow 187 Type: OFPT_PACKET_OUT
192 0.202354813 172.31.31.144 -> 172.31.23.72 OpenFlow 187 Type: OFPT_PACKET_OUT
193 0.202407779 172.31.31.144 -> 172.31.23.72 OpenFlow 187 Type: OFPT_PACKET_OUT
194 0.202468613 172.31.31.144 -> 172.31.23.72 OpenFlow 187 Type: OFPT_PACKET_OUT
195 0.202531267 172.31.23.72 -> 172.31.31.144 TCP 66 48334 → 6633 [ACK] Seq=247 Ack=606 Win=213 Len=0 TSval=21995233 TSecr=3425107
196 0.202541722 172.31.31.144 -> 172.31.23.72 OpenFlow 187 Type: OFPT_PACKET_OUT
197 0.202618735 172.31.31.144 -> 172.31.23.72 OpenFlow 187 Type: OFPT_PACKET_OUT
198 0.202660154 172.31.31.144 -> 172.31.23.72 OpenFlow 187 Type: OFPT_PACKET_OUT
199 0.202728762 172.31.23.72 -> 172.31.31.144 TCP 66 48322 → 6633 [ACK] Seq=493 Ack=243 Win=213 Len=0 TSval=21995233 TSecr=3425107
200 0.202735275 172.31.31.144 -> 172.31.23.72 OpenFlow 187 Type: OFPT_PACKET_OUT
201 0.202789605 172.31.31.144 -> 172.31.23.72 OpenFlow 187 Type: OFPT_PACKET_OUT
202 0.202847141 172.31.23.72 -> 172.31.31.144 TCP 66 48322 → 6633 [ACK] Seq=493 Ack=485 Win=213 Len=0 TSval=21995233 TSecr=3425107
203 0.202870708 172.31.31.144 -> 172.31.23.72 OpenFlow 187 Type: OFPT_PACKET_OUT
204 0.202930142 172.31.31.144 -> 172.31.23.72 OpenFlow 187 Type: OFPT_PACKET_OUT
205 0.202954261 172.31.23.72 -> 172.31.31.144 OpenFlow 189 Type: OFPT_PACKET_IN
206 0.202981296 172.31.23.72 -> 172.31.31.144 OpenFlow 435 Type: OFPT_PACKET_IN
207 0.202992013 172.31.23.72 -> 172.31.31.144 OpenFlow 189 Type: OFPT_PACKET_IN
208 0.203014821 172.31.31.144 -> 172.31.23.72 OpenFlow 187 Type: OFPT_PACKET_OUT
209 0.203038077 172.31.23.72 -> 172.31.31.144 OpenFlow 189 Type: OFPT_PACKET_IN
210 0.203059359 172.31.23.72 -> 172.31.31.144 OpenFlow 189 Type: OFPT_PACKET_IN
211 0.203061800 172.31.23.72 -> 172.31.31.144 OpenFlow 681 Type: OFPT_PACKET_IN
212 0.203078812 172.31.31.144 -> 172.31.23.72 OpenFlow 187 Type: OFPT_PACKET_OUT
213 0.203084414 172.31.23.72 -> 172.31.31.144 OpenFlow 189 Type: OFPT_PACKET_IN
214 0.203089852 172.31.23.72 -> 172.31.31.144 OpenFlow 189 Type: OFPT_PACKET_IN
215 0.203113031 172.31.23.72 -> 172.31.31.144 OpenFlow 189 Type: OFPT_PACKET_IN
216 0.203115611 172.31.23.72 -> 172.31.31.144 OpenFlow 189 Type: OFPT_PACKET_IN
217 0.203130048 172.31.23.72 -> 172.31.31.144 OpenFlow 189 Type: OFPT_PACKET_IN
218 0.203173603 172.31.31.144 -> 172.31.23.72 OpenFlow 187 Type: OFPT_PACKET_OUT
219 0.203254912 172.31.23.72 -> 172.31.31.144 OpenFlow 189 Type: OFPT_PACKET_IN
220 0.203261476 172.31.23.72 -> 172.31.31.144 OpenFlow 189 Type: OFPT_PACKET_IN
221 0.203270512 172.31.23.72 -> 172.31.31.144 OpenFlow 189 Type: OFPT_PACKET_IN
222 0.203287168 172.31.23.72 -> 172.31.31.144 OpenFlow 189 Type: OFPT_PACKET_IN
223 0.203300814 172.31.23.72 -> 172.31.31.144 OpenFlow 189 Type: OFPT_PACKET_IN
224 0.203319961 172.31.23.72 -> 172.31.31.144 OpenFlow 189 Type: OFPT_PACKET_IN
225 0.203322379 172.31.23.72 -> 172.31.31.144 OpenFlow 435 Type: OFPT_PACKET_IN
226 0.203338505 172.31.23.72 -> 172.31.31.144 OpenFlow 189 Type: OFPT_PACKET_IN
227 0.203350297 172.31.31.144 -> 172.31.23.72 TCP 66 6633 → 48338 [ACK] Seq=1 Ack=370 Win=853 Len=0 TSval=3425107 TSecr=21995233
228 0.203354747 172.31.31.144 -> 172.31.23.72 TCP 66 6633 → 48362 [ACK] Seq=1 Ack=124 Win=853 Len=0 TSval=3425107 TSecr=21995233
229 0.203358328 172.31.31.144 -> 172.31.23.72 TCP 66 6633 → 48320 [ACK] Seq=1 Ack=370 Win=853 Len=0 TSval=3425107 TSecr=21995233
230 0.203360417 172.31.31.144 -> 172.31.23.72 TCP 66 6633 → 48338 [ACK] Seq=1 Ack=985 Win=853 Len=0 TSval=3425107 TSecr=21995233
231 0.203362444 172.31.31.144 -> 172.31.23.72 TCP 66 6633 → 48362 [ACK] Seq=1 Ack=247 Win=853 Len=0 TSval=3425107 TSecr=21995233
232 0.203379775 172.31.23.72 -> 172.31.31.144 OpenFlow 189 Type: OFPT_PACKET_IN
233 0.203397179 172.31.23.72 -> 172.31.31.144 OpenFlow 189 Type: OFPT_PACKET_IN
234 0.203500456 172.31.23.72 -> 172.31.31.144 TCP 66 48322 → 6633 [ACK] Seq=493 Ack=969 Win=213 Len=0 TSval=21995233 TSecr=3425107
235 0.203504513 172.31.23.72 -> 172.31.31.144 OpenFlow 189 Type: OFPT_PACKET_IN
236 0.203506428 172.31.23.72 -> 172.31.31.144 OpenFlow 189 Type: OFPT_PACKET_IN
237 0.203508195 172.31.23.72 -> 172.31.31.144 OpenFlow 681 Type: OFPT_PACKET_IN
238 0.203509843 172.31.23.72 -> 172.31.31.144 OpenFlow 189 Type: OFPT_PACKET_IN
239 0.203617107 172.31.31.144 -> 172.31.23.72 TCP 66 6633 → 48348 [ACK] Seq=1 Ack=616 Win=853 Len=0 TSval=3425107 TSecr=21995233
240 0.203623519 172.31.31.144 -> 172.31.23.72 TCP 66 6633 → 48320 [ACK] Seq=1 Ack=493 Win=853 Len=0 TSval=3425107 TSecr=21995233
241 0.203625658 172.31.31.144 -> 172.31.23.72 TCP 66 6633 → 48332 [ACK] Seq=1 Ack=616 Win=853 Len=0 TSval=3425107 TSecr=21995233
242 0.203627497 172.31.31.144 -> 172.31.23.72 TCP 66 6633 → 48348 [ACK] Seq=1 Ack=739 Win=853 Len=0 TSval=3425107 TSecr=21995233
243 0.203629087 172.31.31.144 -> 172.31.23.72 TCP 66 6633 → 48358 [ACK] Seq=969 Ack=124 Win=853 Len=0 TSval=3425107 TSecr=21995233
244 0.203631189 172.31.31.144 -> 172.31.23.72 TCP 66 6633 → 48346 [ACK] Seq=727 Ack=124 Win=853 Len=0 TSval=3425107 TSecr=21995233
245 0.203633163 172.31.31.144 -> 172.31.23.72 TCP 66 6633 → 48342 [ACK] Seq=969 Ack=370 Win=853 Len=0 TSval=3425107 TSecr=21995233
246 0.203639873 172.31.23.72 -> 172.31.31.144 OpenFlow 435 Type: OFPT_PACKET_IN
247 0.203646743 172.31.23.72 -> 172.31.31.144 OpenFlow 189 Type: OFPT_PACKET_IN
248 0.203767708 172.31.23.72 -> 172.31.31.144 OpenFlow 189 Type: OFPT_PACKET_IN
249 0.203816985 172.31.23.72 -> 172.31.31.144 OpenFlow 189 Type: OFPT_PACKET_IN
250 0.203826131 172.31.31.144 -> 172.31.23.72 TCP 66 6633 → 48326 [ACK] Seq=969 Ack=370 Win=853 Len=0 TSval=3425107 TSecr=21995233
251 0.203830342 172.31.31.144 -> 172.31.23.72 TCP 66 6633 → 48332 [ACK] Seq=1 Ack=985 Win=853 Len=0 TSval=3425107 TSecr=21995233
252 0.203893967 172.31.23.72 -> 172.31.31.144 OpenFlow 312 Type: OFPT_PACKET_IN
253 0.203967890 172.31.31.144 -> 172.31.23.72 TCP 66 6633 → 48358 [ACK] Seq=969 Ack=247 Win=853 Len=0 TSval=3425108 TSecr=21995233
254 0.203972926 172.31.31.144 -> 172.31.23.72 TCP 66 6633 → 48342 [ACK] Seq=969 Ack=985 Win=853 Len=0 TSval=3425108 TSecr=21995233
255 0.203974738 172.31.31.144 -> 172.31.23.72 TCP 66 6633 → 48346 [ACK] Seq=727 Ack=247 Win=853 Len=0 TSval=3425108 TSecr=21995233
256 0.203976479 172.31.31.144 -> 172.31.23.72 TCP 66 6633 → 48326 [ACK] Seq=969 Ack=493 Win=853 Len=0 TSval=3425108 TSecr=21995233
257 0.204028320 172.31.31.144 -> 172.31.23.72 TCP 66 6633 → 48340 [ACK] Seq=1211 Ack=985 Win=853 Len=0 TSval=3425108 TSecr=21995233
258 0.204089171 172.31.31.144 -> 172.31.23.72 TCP 66 6633 → 48330 [ACK] Seq=1211 Ack=493 Win=853 Len=0 TSval=3425108 TSecr=21995233
259 0.204129411 172.31.31.144 -> 172.31.23.72 TCP 66 6633 → 48324 [ACK] Seq=1211 Ack=493 Win=853 Len=0 TSval=3425108 TSecr=21995233
260 0.204189747 172.31.31.144 -> 172.31.23.72 TCP 66 6633 → 48360 [ACK] Seq=1 Ack=493 Win=853 Len=0 TSval=3425108 TSecr=21995233
261 0.204779608 172.31.31.144 -> 172.31.23.72 OpenFlow 187 Type: OFPT_PACKET_OUT
262 0.204794905 172.31.31.144 -> 172.31.23.72 OpenFlow 671 Type: OFPT_PACKET_OUT
263 0.205158280 172.31.31.144 -> 172.31.23.72 OpenFlow 187 Type: OFPT_PACKET_OUT
264 0.205274197 172.31.31.144 -> 172.31.23.72 OpenFlow 187 Type: OFPT_PACKET_OUT
265 0.205359658 172.31.31.144 -> 172.31.23.72 OpenFlow 187 Type: OFPT_PACKET_OUT
266 0.205565512 172.31.23.72 -> 172.31.31.144 TCP 66 48352 → 6633 [ACK] Seq=493 Ack=1211 Win=213 Len=0 TSval=21995234 TSecr=3425107
267 0.205645830 172.31.31.144 -> 172.31.23.72 OpenFlow 187 Type: OFPT_PACKET_OUT
268 0.205662796 172.31.23.72 -> 172.31.31.144 OpenFlow 189 Type: OFPT_PACKET_IN
269 0.205672652 172.31.31.144 -> 172.31.23.72 OpenFlow 308 Type: OFPT_PACKET_OUT
270 0.205685364 172.31.23.72 -> 172.31.31.144 OpenFlow 189 Type: OFPT_PACKET_IN
271 0.205702095 172.31.23.72 -> 172.31.31.144 OpenFlow 189 Type: OFPT_PACKET_IN
272 0.205719969 172.31.31.144 -> 172.31.23.72 OpenFlow 187 Type: OFPT_PACKET_OUT
273 0.205732383 172.31.23.72 -> 172.31.31.144 OpenFlow 189 Type: OFPT_PACKET_IN
274 0.205796922 172.31.31.144 -> 172.31.23.72 OpenFlow 187 Type: OFPT_PACKET_OUT
275 0.205804147 172.31.23.72 -> 172.31.31.144 OpenFlow 189 Type: OFPT_PACKET_IN
276 0.205809667 172.31.23.72 -> 172.31.31.144 OpenFlow 189 Type: OFPT_PACKET_IN
277 0.205831031 172.31.31.144 -> 172.31.23.72 OpenFlow 187 Type: OFPT_PACKET_OUT
278 0.205833291 172.31.31.144 -> 172.31.23.72 TCP 66 6633 → 48364 [ACK] Seq=1 Ack=124 Win=853 Len=0 TSval=3425108 TSecr=21995234
279 0.205909525 172.31.23.72 -> 172.31.31.144 OpenFlow 189 Type: OFPT_PACKET_IN
280 0.205928539 172.31.31.144 -> 172.31.23.72 TCP 66 6633 → 48364 [ACK] Seq=1 Ack=247 Win=853 Len=0 TSval=3425108 TSecr=21995234
281 0.205932556 172.31.31.144 -> 172.31.23.72 OpenFlow 187 Type: OFPT_PACKET_OUT
282 0.205934783 172.31.31.144 -> 172.31.23.72 TCP 66 6633 → 48362 [ACK] Seq=1 Ack=370 Win=853 Len=0 TSval=3425108 TSecr=21995234
283 0.205944868 172.31.23.72 -> 172.31.31.144 OpenFlow 189 Type: OFPT_PACKET_IN
284 0.205966452 172.31.31.144 -> 172.31.23.72 OpenFlow 187 Type: OFPT_PACKET_OUT
285 0.205971355 172.31.23.72 -> 172.31.31.144 OpenFlow 189 Type: OFPT_PACKET_IN
286 0.206001981 172.31.31.144 -> 172.31.23.72 TCP 66 6633 → 48362 [ACK] Seq=1 Ack=493 Win=853 Len=0 TSval=3425108 TSecr=21995234
287 0.206058532 172.31.31.144 -> 172.31.23.72 TCP 187 6633 → 48366 [PSH, ACK] Seq=1 Ack=1 Win=853 Len=121 TSval=3425108 TSecr=21994872
288 0.206072181 172.31.31.144 -> 172.31.23.72 TCP 187 6633 → 48366 [PSH, ACK] Seq=122 Ack=1 Win=853 Len=121 TSval=3425108 TSecr=21994872
289 0.206132400 172.31.31.144 -> 172.31.23.72 TCP 66 6633 → 48350 [ACK] Seq=1211 Ack=493 Win=853 Len=0 TSval=3425108 TSecr=21995233
290 0.206165286 172.31.31.144 -> 172.31.23.72 TCP 187 6633 → 48366 [PSH, ACK] Seq=243 Ack=1 Win=853 Len=121 TSval=3425108 TSecr=21994872
291 0.206182983 172.31.31.144 -> 172.31.23.72 TCP 66 6633 → 48344 [ACK] Seq=969 Ack=739 Win=853 Len=0 TSval=3425108 TSecr=21995234
292 0.206268819 172.31.31.144 -> 172.31.23.72 TCP 66 6633 → 48354 [ACK] Seq=1 Ack=493 Win=853 Len=0 TSval=3425108 TSecr=21995234
293 0.206382294 172.31.23.72 -> 172.31.31.144 TCP 66 48338 → 6633 [ACK] Seq=985 Ack=969 Win=213 Len=0 TSval=21995234 TSecr=3425108
294 0.206450684 172.31.31.144 -> 172.31.23.72 TCP 187 6633 → 48366 [PSH, ACK] Seq=364 Ack=1 Win=853 Len=121 TSval=3425108 TSecr=21994872
295 0.206483235 172.31.31.144 -> 172.31.23.72 TCP 187 6633 → 48366 [PSH, ACK] Seq=485 Ack=1 Win=853 Len=121 TSval=3425108 TSecr=21994872
296 0.206559561 172.31.31.144 -> 172.31.23.72 TCP 187 6633 → 48366 [PSH, ACK] Seq=606 Ack=1 Win=853 Len=121 TSval=3425108 TSecr=21994872
297 0.206626080 172.31.23.72 -> 172.31.31.144 TCP 66 48366 → 6633 [ACK] Seq=1 Ack=727 Win=213 Len=0 TSval=21995234 TSecr=3425108
298 0.206641788 172.31.31.144 -> 172.31.23.72 OpenFlow 187 Type: OFPT_PACKET_OUT
299 0.206687287 172.31.31.144 -> 172.31.23.72 OpenFlow 187 Type: OFPT_PACKET_OUT
300 0.206713597 172.31.23.72 -> 172.31.31.144 OpenFlow 189 Type: OFPT_PACKET_IN
301 0.206739747 172.31.23.72 -> 172.31.31.144 OpenFlow 189 Type: OFPT_PACKET_IN
302 0.206784919 172.31.31.144 -> 172.31.23.72 OpenFlow 187 Type: OFPT_PACKET_OUT
303 0.206829237 172.31.31.144 -> 172.31.23.72 OpenFlow 187 Type: OFPT_PACKET_OUT
304 0.206858742 172.31.31.144 -> 172.31.23.72 OpenFlow 187 Type: OFPT_PACKET_OUT
305 0.206949652 172.31.23.72 -> 172.31.31.144 TCP 66 48364 → 6633 [ACK] Seq=493 Ack=606 Win=213 Len=0 TSval=21995234 TSecr=3425108
306 0.206960190 172.31.31.144 -> 172.31.23.72 OpenFlow 187 Type: OFPT_PACKET_OUT
307 0.207006767 172.31.23.72 -> 172.31.31.144 OpenFlow 189 Type: OFPT_PACKET_IN
308 0.207016445 172.31.31.144 -> 172.31.23.72 OpenFlow 187 Type: OFPT_PACKET_OUT
309 0.207034387 172.31.23.72 -> 172.31.31.144 OpenFlow 189 Type: OFPT_PACKET_IN
310 0.207057157 172.31.23.72 -> 172.31.31.144 OpenFlow 189 Type: OFPT_PACKET_IN
311 0.207102736 172.31.23.72 -> 172.31.31.144 OpenFlow 189 Type: OFPT_PACKET_IN
312 0.207171543 172.31.23.72 -> 172.31.31.144 OpenFlow 189 Type: OFPT_PACKET_IN
313 0.207194704 172.31.31.144 -> 172.31.23.72 TCP 66 6633 → 48362 [ACK] Seq=1 Ack=616 Win=853 Len=0 TSval=3425108 TSecr=21995234
314 0.207202061 172.31.23.72 -> 172.31.31.144 OpenFlow 189 Type: OFPT_PACKET_IN
315 0.207232418 172.31.31.144 -> 172.31.23.72 TCP 66 6633 → 48362 [ACK] Seq=1 Ack=739 Win=853 Len=0 TSval=3425108 TSecr=21995234
316 0.207247379 172.31.23.72 -> 172.31.31.144 OpenFlow 189 Type: OFPT_PACKET_IN
317 0.207267471 172.31.23.72 -> 172.31.31.144 OpenFlow 189 Type: OFPT_PACKET_IN
318 0.207286159 172.31.31.144 -> 172.31.23.72 OpenFlow 187 Type: OFPT_PACKET_OUT
319 0.207289206 172.31.31.144 -> 172.31.23.72 OpenFlow 187 Type: OFPT_PACKET_OUT
320 0.207293586 172.31.23.72 -> 172.31.31.144 OpenFlow 189 Type: OFPT_PACKET_IN
321 0.207299042 172.31.23.72 -> 172.31.31.144 OpenFlow 189 Type: OFPT_PACKET_IN
322 0.207326376 172.31.23.72 -> 172.31.31.144 OpenFlow 189 Type: OFPT_PACKET_IN
323 0.207328850 172.31.23.72 -> 172.31.31.144 OpenFlow 189 Type: OFPT_PACKET_IN
324 0.207340599 172.31.23.72 -> 172.31.31.144 TCP 66 48364 → 6633 [ACK] Seq=493 Ack=848 Win=213 Len=0 TSval=21995234 TSecr=3425108
325 0.207372087 172.31.31.144 -> 172.31.23.72 TCP 66 6633 → 48354 [ACK] Seq=1 Ack=739 Win=853 Len=0 TSval=3425108 TSecr=21995234
326 0.207377522 172.31.31.144 -> 172.31.23.72 TCP 66 6633 → 48346 [ACK] Seq=727 Ack=370 Win=853 Len=0 TSval=3425108 TSecr=21995234
327 0.207459387 172.31.23.72 -> 172.31.31.144 OpenFlow 189 Type: OFPT_PACKET_IN
328 0.207467164 172.31.23.72 -> 172.31.31.144 OpenFlow 189 Type: OFPT_PACKET_IN
329 0.207502007 172.31.23.72 -> 172.31.31.144 TCP 66 48362 → 6633 [ACK] Seq=739 Ack=243 Win=213 Len=0 TSval=21995234 TSecr=3425108
330 0.207549096 172.31.31.144 -> 172.31.23.72 TCP 66 6633 → 48346 [ACK] Seq=727 Ack=493 Win=853 Len=0 TSval=3425108 TSecr=21995234
331 0.207554531 172.31.31.144 -> 172.31.23.72 TCP 66 6633 → 48336 [ACK] Seq=1211 Ack=862 Win=853 Len=0 TSval=3425108 TSecr=21995234
332 0.207556614 172.31.31.144 -> 172.31.23.72 TCP 66 6633 → 48344 [ACK] Seq=969 Ack=862 Win=853 Len=0 TSval=3425108 TSecr=21995234
333 0.207558506 172.31.31.144 -> 172.31.23.72 TCP 66 6633 → 48334 [ACK] Seq=727 Ack=370 Win=853 Len=0 TSval=3425108 TSecr=21995234
334 0.207584915 172.31.23.72 -> 172.31.31.144 OpenFlow 189 Type: OFPT_PACKET_IN
335 0.207675185 172.31.31.144 -> 172.31.23.72 TCP 66 6633 → 48366 [ACK] Seq=727 Ack=124 Win=853 Len=0 TSval=3425108 TSecr=21995234
336 0.207683047 172.31.23.72 -> 172.31.31.144 OpenFlow 189 Type: OFPT_PACKET_IN
337 0.207751822 172.31.31.144 -> 172.31.23.72 TCP 66 6633 → 48366 [ACK] Seq=727 Ack=247 Win=853 Len=0 TSval=3425108 TSecr=21995234
338 0.207780619 172.31.23.72 -> 172.31.31.144 OpenFlow 189 Type: OFPT_PACKET_IN
339 0.207789630 172.31.31.144 -> 172.31.23.72 OpenFlow 187 Type: OFPT_PACKET_OUT
340 0.207863940 172.31.31.144 -> 172.31.23.72 TCP 66 6633 → 48360 [ACK] Seq=1 Ack=739 Win=853 Len=0 TSval=3425109 TSecr=21995234
341 0.207906002 172.31.31.144 -> 172.31.23.72 TCP 66 6633 → 48334 [ACK] Seq=727 Ack=493 Win=853 Len=0 TSval=3425109 TSecr=21995234
342 0.207939085 172.31.31.144 -> 172.31.23.72 TCP 66 6633 → 48336 [ACK] Seq=1211 Ack=985 Win=853 Len=0 TSval=3425109 TSecr=21995234
343 0.208052846 172.31.23.72 -> 172.31.31.144 OpenFlow 189 Type: OFPT_PACKET_IN
344 0.208075907 172.31.31.144 -> 172.31.23.72 TCP 66 6633 → 48344 [ACK] Seq=969 Ack=985 Win=853 Len=0 TSval=3425109 TSecr=21995234
345 0.208150364 172.31.31.144 -> 172.31.23.72 OpenFlow 187 Type: OFPT_PACKET_OUT
346 0.208159910 172.31.31.144 -> 172.31.23.72 OpenFlow 187 Type: OFPT_PACKET_OUT
347 0.208189312 172.31.31.144 -> 172.31.23.72 OpenFlow 671 Type: OFPT_PACKET_OUT
348 0.208285267 172.31.31.144 -> 172.31.23.72 TCP 66 6633 → 48352 [ACK] Seq=1211 Ack=739 Win=853 Len=0 TSval=3425109 TSecr=21995234
349 0.208412132 172.31.31.144 -> 172.31.23.72 OpenFlow 187 Type: OFPT_PACKET_OUT
350 0.208484324 172.31.31.144 -> 172.31.23.72 OpenFlow 187 Type: OFPT_PACKET_OUT
351 0.208534811 172.31.23.72 -> 172.31.31.144 TCP 66 48362 → 6633 [ACK] Seq=739 Ack=969 Win=213 Len=0 TSval=21995234 TSecr=3425109
352 0.208541646 172.31.31.144 -> 172.31.23.72 OpenFlow 187 Type: OFPT_PACKET_OUT
353 0.208595053 172.31.31.144 -> 172.31.23.72 OpenFlow 187 Type: OFPT_PACKET_OUT
354 0.208669903 172.31.31.144 -> 172.31.23.72 OpenFlow 187 Type: OFPT_PACKET_OUT
355 0.208770457 172.31.31.144 -> 172.31.23.72 OpenFlow 187 Type: OFPT_PACKET_OUT
356 0.208802009 172.31.31.144 -> 172.31.23.72 OpenFlow 187 Type: OFPT_PACKET_OUT
357 0.208862882 172.31.31.144 -> 172.31.23.72 OpenFlow 187 Type: OFPT_PACKET_OUT
358 0.208883584 172.31.23.72 -> 172.31.31.144 TCP 66 48320 → 6633 [ACK] Seq=493 Ack=727 Win=213 Len=0 TSval=21995235 TSecr=3425109
359 0.208927184 172.31.31.144 -> 172.31.23.72 OpenFlow 187 Type: OFPT_PACKET_OUT
360 0.208988387 172.31.31.144 -> 172.31.23.72 OpenFlow 187 Type: OFPT_PACKET_OUT
361 0.209055210 172.31.31.144 -> 172.31.23.72 OpenFlow 187 Type: OFPT_PACKET_OUT
362 0.209137106 172.31.31.144 -> 172.31.23.72 OpenFlow 187 Type: OFPT_PACKET_OUT
363 0.209188429 172.31.23.72 -> 172.31.31.144 TCP 66 48360 → 6633 [ACK] Seq=739 Ack=848 Win=213 Len=0 TSval=21995235 TSecr=3425109
364 0.209199358 172.31.31.144 -> 172.31.23.72 OpenFlow 187 Type: OFPT_PACKET_OUT
365 0.209270306 172.31.31.144 -> 172.31.23.72 OpenFlow 187 Type: OFPT_PACKET_OUT
366 0.209333643 172.31.31.144 -> 172.31.23.72 OpenFlow 187 Type: OFPT_PACKET_OUT
367 0.209370444 172.31.23.72 -> 172.31.31.144 TCP 66 48354 → 6633 [ACK] Seq=739 Ack=243 Win=213 Len=0 TSval=21995235 TSecr=3425109
368 0.209390290 172.31.31.144 -> 172.31.23.72 OpenFlow 187 Type: OFPT_PACKET_OUT
369 0.209452618 172.31.31.144 -> 172.31.23.72 OpenFlow 187 Type: OFPT_PACKET_OUT
370 0.209487179 172.31.23.72 -> 172.31.31.144 TCP 66 48354 → 6633 [ACK] Seq=739 Ack=485 Win=213 Len=0 TSval=21995235 TSecr=3425109
371 0.209501967 172.31.31.144 -> 172.31.23.72 OpenFlow 187 Type: OFPT_PACKET_OUT
372 0.209609564 172.31.31.144 -> 172.31.23.72 OpenFlow 187 Type: OFPT_PACKET_OUT
373 0.209694901 172.31.31.144 -> 172.31.23.72 OpenFlow 187 Type: OFPT_PACKET_OUT
374 0.209710678 172.31.31.144 -> 172.31.23.72 OpenFlow 187 Type: OFPT_PACKET_OUT
375 0.209764465 172.31.31.144 -> 172.31.23.72 OpenFlow 187 Type: OFPT_PACKET_OUT
376 0.209811468 172.31.31.144 -> 172.31.23.72 OpenFlow 187 Type: OFPT_PACKET_OUT
377 0.209941654 172.31.31.144 -> 172.31.23.72 OpenFlow 187 Type: OFPT_PACKET_OUT
378 0.209944666 172.31.31.144 -> 172.31.23.72 OpenFlow 187 Type: OFPT_PACKET_OUT
379 0.210020690 172.31.31.144 -> 172.31.23.72 OpenFlow 187 Type: OFPT_PACKET_OUT
380 0.210065892 172.31.31.144 -> 172.31.23.72 OpenFlow 187 Type: OFPT_PACKET_OUT
381 0.210125395 172.31.31.144 -> 172.31.23.72 OpenFlow 187 Type: OFPT_PACKET_OUT
382 0.210179038 172.31.31.144 -> 172.31.23.72 OpenFlow 187 Type: OFPT_PACKET_OUT
383 0.210250000 172.31.31.144 -> 172.31.23.72 OpenFlow 187 Type: OFPT_PACKET_OUT
384 0.210298649 172.31.31.144 -> 172.31.23.72 OpenFlow 187 Type: OFPT_PACKET_OUT
385 0.210371170 172.31.31.144 -> 172.31.23.72 OpenFlow 187 Type: OFPT_PACKET_OUT
386 0.210429612 172.31.31.144 -> 172.31.23.72 OpenFlow 187 Type: OFPT_PACKET_OUT
387 0.210492173 172.31.31.144 -> 172.31.23.72 OpenFlow 187 Type: OFPT_PACKET_OUT
388 0.210549136 172.31.31.144 -> 172.31.23.72 OpenFlow 187 Type: OFPT_PACKET_OUT
389 0.210641129 172.31.31.144 -> 172.31.23.72 OpenFlow 187 Type: OFPT_PACKET_OUT
390 0.210682660 172.31.31.144 -> 172.31.23.72 OpenFlow 187 Type: OFPT_PACKET_OUT
391 0.210740306 172.31.31.144 -> 172.31.23.72 OpenFlow 187 Type: OFPT_PACKET_OUT
392 0.210804926 172.31.31.144 -> 172.31.23.72 OpenFlow 187 Type: OFPT_PACKET_OUT
393 0.210865368 172.31.31.144 -> 172.31.23.72 OpenFlow 187 Type: OFPT_PACKET_OUT
394 0.210913944 172.31.31.144 -> 172.31.23.72 OpenFlow 187 Type: OFPT_PACKET_OUT
395 0.213880440 172.31.23.72 -> 172.31.31.144 OpenFlow 189 Type: OFPT_PACKET_IN
396 0.213908348 172.31.23.72 -> 172.31.31.144 OpenFlow 189 Type: OFPT_PACKET_IN
397 0.213922831 172.31.23.72 -> 172.31.31.144 OpenFlow 189 Type: OFPT_PACKET_IN
398 0.213955636 172.31.23.72 -> 172.31.31.144 OpenFlow 189 Type: OFPT_PACKET_IN
399 0.213962844 172.31.23.72 -> 172.31.31.144 OpenFlow 189 Type: OFPT_PACKET_IN
400 0.213983173 172.31.23.72 -> 172.31.31.144 OpenFlow 189 Type: OFPT_PACKET_IN
401 0.214016728 172.31.23.72 -> 172.31.31.144 OpenFlow 189 Type: OFPT_PACKET_IN
402 0.214021406 172.31.23.72 -> 172.31.31.144 OpenFlow 435 Type: OFPT_PACKET_IN
403 0.214036816 172.31.23.72 -> 172.31.31.144 OpenFlow 189 Type: OFPT_PACKET_IN
404 0.214054242 172.31.23.72 -> 172.31.31.144 OpenFlow 189 Type: OFPT_PACKET_IN
405 0.214081737 172.31.31.144 -> 172.31.23.72 TCP 66 6633 → 48358 [ACK] Seq=969 Ack=370 Win=853 Len=0 TSval=3425110 TSecr=21995236
406 0.214087580 172.31.31.144 -> 172.31.23.72 TCP 66 6633 → 48358 [ACK] Seq=969 Ack=493 Win=853 Len=0 TSval=3425110 TSecr=21995236
407 0.214104979 172.31.23.72 -> 172.31.31.144 OpenFlow 189 Type: OFPT_PACKET_IN
408 0.214110266 172.31.23.72 -> 172.31.31.144 OpenFlow 435 Type: OFPT_PACKET_IN
409 0.214138847 172.31.31.144 -> 172.31.23.72 TCP 66 6633 → 48346 [ACK] Seq=727 Ack=616 Win=853 Len=0 TSval=3425110 TSecr=21995236
410 0.214141970 172.31.31.144 -> 172.31.23.72 TCP 66 6633 → 48346 [ACK] Seq=727 Ack=739 Win=853 Len=0 TSval=3425110 TSecr=21995236
411 0.214194067 172.31.31.144 -> 172.31.23.72 TCP 66 6633 → 48350 [ACK] Seq=1211 Ack=985 Win=853 Len=0 TSval=3425110 TSecr=21995236
412 0.214203715 172.31.23.72 -> 172.31.31.144 OpenFlow 189 Type: OFPT_PACKET_IN
413 0.214224328 172.31.31.144 -> 172.31.23.72 TCP 66 6633 → 48330 [ACK] Seq=1211 Ack=985 Win=853 Len=0 TSval=3425110 TSecr=21995233
414 0.214233835 172.31.23.72 -> 172.31.31.144 OpenFlow 189 Type: OFPT_PACKET_IN
415 0.214248423 172.31.23.72 -> 172.31.31.144 OpenFlow 189 Type: OFPT_PACKET_IN
416 0.214261088 172.31.23.72 -> 172.31.31.144 OpenFlow 189 Type: OFPT_PACKET_IN
417 0.214286281 172.31.23.72 -> 172.31.31.144 TCP 66 48354 → 6633 [ACK] Seq=739 Ack=727 Win=213 Len=0 TSval=21995236 TSecr=3425109
418 0.214294089 172.31.23.72 -> 172.31.31.144 OpenFlow 189 Type: OFPT_PACKET_IN
419 0.214364111 172.31.31.144 -> 172.31.23.72 TCP 66 6633 → 48366 [ACK] Seq=727 Ack=370 Win=853 Len=0 TSval=3425110 TSecr=21995236
420 0.214396015 172.31.31.144 -> 172.31.23.72 TCP 66 6633 → 48364 [ACK] Seq=969 Ack=739 Win=853 Len=0 TSval=3425110 TSecr=21995236
421 0.214516830 172.31.31.144 -> 172.31.23.72 TCP 66 6633 → 48352 [ACK] Seq=1211 Ack=1231 Win=853 Len=0 TSval=3425110 TSecr=21995236
422 0.214562550 172.31.31.144 -> 172.31.23.72 TCP 66 6633 → 48322 [ACK] Seq=969 Ack=739 Win=853 Len=0 TSval=3425110 TSecr=21995236
423 0.214638592 172.31.23.72 -> 172.31.31.144 TCP 66 48348 → 6633 [ACK] Seq=739 Ack=727 Win=213 Len=0 TSval=21995236 TSecr=3425109
424 0.214776186 172.31.31.144 -> 172.31.23.72 TCP 66 6633 → 48362 [ACK] Seq=969 Ack=985 Win=853 Len=0 TSval=3425110 TSecr=21995236
425 0.215061636 172.31.23.72 -> 172.31.31.144 TCP 66 48332 → 6633 [ACK] Seq=985 Ack=1211 Win=213 Len=0 TSval=21995236 TSecr=3425109
426 0.215130225 172.31.23.72 -> 172.31.31.144 OpenFlow 189 Type: OFPT_PACKET_IN
427 0.215152539 172.31.23.72 -> 172.31.31.144 OpenFlow 189 Type: OFPT_PACKET_IN
428 0.215344079 172.31.31.144 -> 172.31.23.72 TCP 66 6633 → 48328 [ACK] Seq=727 Ack=616 Win=853 Len=0 TSval=3425110 TSecr=21995236
429 0.215362119 172.31.31.144 -> 172.31.23.72 TCP 66 6633 → 48328 [ACK] Seq=727 Ack=739 Win=853 Len=0 TSval=3425110 TSecr=21995236
430 0.215695377 172.31.23.72 -> 172.31.31.144 OpenFlow 189 Type: OFPT_PACKET_IN
431 0.215721825 172.31.23.72 -> 172.31.31.144 OpenFlow 189 Type: OFPT_PACKET_IN
432 0.215740139 172.31.23.72 -> 172.31.31.144 OpenFlow 189 Type: OFPT_PACKET_IN
433 0.215752070 172.31.23.72 -> 172.31.31.144 OpenFlow 189 Type: OFPT_PACKET_IN
434 0.215768133 172.31.23.72 -> 172.31.31.144 OpenFlow 189 Type: OFPT_PACKET_IN
435 0.215770172 172.31.23.72 -> 172.31.31.144 OpenFlow 189 Type: OFPT_PACKET_IN
436 0.215781446 172.31.23.72 -> 172.31.31.144 OpenFlow 189 Type: OFPT_PACKET_IN
437 0.215803348 172.31.23.72 -> 172.31.31.144 OpenFlow 189 Type: OFPT_PACKET_IN
438 0.215808099 172.31.23.72 -> 172.31.31.144 OpenFlow 189 Type: OFPT_PACKET_IN
439 0.215827354 172.31.23.72 -> 172.31.31.144 OpenFlow 189 Type: OFPT_PACKET_IN
440 0.215829432 172.31.23.72 -> 172.31.31.144 OpenFlow 189 Type: OFPT_PACKET_IN
441 0.215840770 172.31.23.72 -> 172.31.31.144 OpenFlow 189 Type: OFPT_PACKET_IN
442 0.215863282 172.31.23.72 -> 172.31.31.144 OpenFlow 189 Type: OFPT_PACKET_IN
443 0.215865365 172.31.23.72 -> 172.31.31.144 OpenFlow 435 Type: OFPT_PACKET_IN
444 0.215886539 172.31.31.144 -> 172.31.23.72 TCP 66 6633 → 48358 [ACK] Seq=969 Ack=616 Win=853 Len=0 TSval=3425111 TSecr=21995236
445 0.215891946 172.31.31.144 -> 172.31.23.72 TCP 66 6633 → 48358 [ACK] Seq=969 Ack=739 Win=853 Len=0 TSval=3425111 TSecr=21995236
446 0.215893975 172.31.31.144 -> 172.31.23.72 TCP 66 6633 → 48326 [ACK] Seq=969 Ack=616 Win=853 Len=0 TSval=3425111 TSecr=21995236
447 0.215916771 172.31.23.72 -> 172.31.31.144 OpenFlow 189 Type: OFPT_PACKET_IN
448 0.215923101 172.31.23.72 -> 172.31.31.144 OpenFlow 189 Type: OFPT_PACKET_IN
449 0.216004432 172.31.23.72 -> 172.31.31.144 OpenFlow 189 Type: OFPT_PACKET_IN
450 0.216007278 172.31.23.72 -> 172.31.31.144 OpenFlow 189 Type: OFPT_PACKET_IN
451 0.216044477 172.31.31.144 -> 172.31.23.72 TCP 66 6633 → 48326 [ACK] Seq=969 Ack=739 Win=853 Len=0 TSval=3425111 TSecr=21995236
452 0.216089185 172.31.23.72 -> 172.31.31.144 OpenFlow 189 Type: OFPT_PACKET_IN
453 0.216129499 172.31.31.144 -> 172.31.23.72 TCP 66 6633 → 48366 [ACK] Seq=727 Ack=493 Win=853 Len=0 TSval=3425111 TSecr=21995236
454 0.216155157 172.31.31.144 -> 172.31.23.72 TCP 66 6633 → 48336 [ACK] Seq=1211 Ack=1108 Win=853 Len=0 TSval=3425111 TSecr=21995236
455 0.216157417 172.31.31.144 -> 172.31.23.72 TCP 66 6633 → 48334 [ACK] Seq=727 Ack=616 Win=853 Len=0 TSval=3425111 TSecr=21995236
456 0.216259461 172.31.31.144 -> 172.31.23.72 TCP 66 6633 → 48330 [ACK] Seq=1211 Ack=1231 Win=853 Len=0 TSval=3425111 TSecr=21995236
457 0.216332467 172.31.31.144 -> 172.31.23.72 TCP 66 6633 → 48332 [ACK] Seq=1211 Ack=1231 Win=853 Len=0 TSval=3425111 TSecr=21995236
458 0.216424337 172.31.31.144 -> 172.31.23.72 TCP 66 6633 → 48334 [ACK] Seq=727 Ack=739 Win=853 Len=0 TSval=3425111 TSecr=21995236
459 0.216554380 172.31.31.144 -> 172.31.23.72 TCP 66 6633 → 48350 [ACK] Seq=1211 Ack=1231 Win=853 Len=0 TSval=3425111 TSecr=21995236
460 0.216620657 172.31.31.144 -> 172.31.23.72 TCP 66 6633 → 48340 [ACK] Seq=1211 Ack=1231 Win=853 Len=0 TSval=3425111 TSecr=21995236
461 0.216695744 172.31.31.144 -> 172.31.23.72 TCP 66 6633 → 48324 [ACK] Seq=1211 Ack=985 Win=853 Len=0 TSval=3425111 TSecr=21995236
462 0.216843566 172.31.31.144 -> 172.31.23.72 TCP 66 6633 → 48336 [ACK] Seq=1211 Ack=1231 Win=853 Len=0 TSval=3425111 TSecr=21995236
463 0.248799045 172.31.23.72 -> 172.31.31.144 TCP 66 48360 → 6633 [ACK] Seq=739 Ack=969 Win=213 Len=0 TSval=21995245 TSecr=3425109
464 0.731601530 172.31.23.72 -> 172.31.31.144 OpenFlow 146 Type: OFPT_PORT_STATUS
465 0.731711925 172.31.23.72 -> 172.31.31.144 OpenFlow 146 Type: OFPT_PORT_STATUS
466 0.756253182 172.31.31.144 -> 172.31.23.72 OpenFlow 146 Type: OFPT_FLOW_MOD
467 0.756272868 172.31.31.144 -> 172.31.23.72 OpenFlow 146 Type: OFPT_FLOW_MOD
468 0.756288088 172.31.31.144 -> 172.31.23.72 OpenFlow 146 Type: OFPT_FLOW_MOD
469 0.756291701 172.31.31.144 -> 172.31.23.72 OpenFlow 154 Type: OFPT_BARRIER_REQUEST
470 0.756320384 172.31.31.144 -> 172.31.23.72 OpenFlow 154 Type: OFPT_BARRIER_REQUEST
471 0.756323462 172.31.31.144 -> 172.31.23.72 OpenFlow 154 Type: OFPT_BARRIER_REQUEST
472 0.756326898 172.31.31.144 -> 172.31.23.72 OpenFlow 146 Type: OFPT_FLOW_MOD
473 0.756350646 172.31.31.144 -> 172.31.23.72 OpenFlow 146 Type: OFPT_FLOW_MOD
474 0.756358178 172.31.23.72 -> 172.31.31.144 TCP 66 48360 → 6633 [ACK] Seq=819 Ack=1049 Win=213 Len=0 TSval=21995371 TSecr=3425246
475 0.756387824 172.31.31.144 -> 172.31.23.72 OpenFlow 154 Type: OFPT_BARRIER_REQUEST
476 0.756392073 172.31.23.72 -> 172.31.31.144 TCP 66 48360 → 6633 [ACK] Seq=819 Ack=1137 Win=213 Len=0 TSval=21995371 TSecr=3425246
477 0.756395825 172.31.31.144 -> 172.31.23.72 OpenFlow 154 Type: OFPT_BARRIER_REQUEST
478 0.756424719 172.31.31.144 -> 172.31.23.72 OpenFlow 146 Type: OFPT_FLOW_MOD
479 0.756429014 172.31.31.144 -> 172.31.23.72 OpenFlow 146 Type: OFPT_FLOW_MOD
480 0.756447550 172.31.31.144 -> 172.31.23.72 OpenFlow 154 Type: OFPT_BARRIER_REQUEST
481 0.756459780 172.31.31.144 -> 172.31.23.72 OpenFlow 154 Type: OFPT_BARRIER_REQUEST
482 0.756495480 172.31.31.144 -> 172.31.23.72 OpenFlow 146 Type: OFPT_FLOW_MOD
483 0.756499065 172.31.31.144 -> 172.31.23.72 OpenFlow 146 Type: OFPT_FLOW_MOD
484 0.756528261 172.31.31.144 -> 172.31.23.72 OpenFlow 154 Type: OFPT_BARRIER_REQUEST
485 0.756530565 172.31.31.144 -> 172.31.23.72 OpenFlow 154 Type: OFPT_BARRIER_REQUEST
486 0.756555925 172.31.23.72 -> 172.31.31.144 OpenFlow 74 Type: OFPT_BARRIER_REPLY
487 0.756564821 172.31.31.144 -> 172.31.23.72 OpenFlow 146 Type: OFPT_FLOW_MOD
488 0.756569106 172.31.31.144 -> 172.31.23.72 OpenFlow 146 Type: OFPT_FLOW_MOD
489 0.756589424 172.31.23.72 -> 172.31.31.144 OpenFlow 74 Type: OFPT_BARRIER_REPLY
490 0.756604963 172.31.31.144 -> 172.31.23.72 OpenFlow 146 Type: OFPT_FLOW_MOD
491 0.756630099 172.31.31.144 -> 172.31.23.72 OpenFlow 154 Type: OFPT_BARRIER_REQUEST
492 0.756632617 172.31.31.144 -> 172.31.23.72 OpenFlow 146 Type: OFPT_FLOW_MOD
493 0.756653686 172.31.23.72 -> 172.31.31.144 TCP 66 48330 → 6633 [ACK] Seq=1231 Ack=1379 Win=213 Len=0 TSval=21995371 TSecr=3425246
494 0.756661970 172.31.23.72 -> 172.31.31.144 OpenFlow 74 Type: OFPT_BARRIER_REPLY
495 0.756670743 172.31.31.144 -> 172.31.23.72 OpenFlow 146 Type: OFPT_FLOW_MOD
496 0.756673158 172.31.31.144 -> 172.31.23.72 OpenFlow 146 Type: OFPT_FLOW_MOD
497 0.756694829 172.31.31.144 -> 172.31.23.72 OpenFlow 146 Type: OFPT_FLOW_MOD
498 0.756711121 172.31.23.72 -> 172.31.31.144 OpenFlow 74 Type: OFPT_BARRIER_REPLY
499 0.756719699 172.31.31.144 -> 172.31.23.72 OpenFlow 74 Type: OFPT_BARRIER_REQUEST
500 0.756722270 172.31.31.144 -> 172.31.23.72 OpenFlow 146 Type: OFPT_FLOW_MOD
501 0.756731937 172.31.31.144 -> 172.31.23.72 OpenFlow 74 Type: OFPT_BARRIER_REQUEST
502 0.756743480 172.31.23.72 -> 172.31.31.144 TCP 66 48324 → 6633 [ACK] Seq=993 Ack=1547 Win=213 Len=0 TSval=21995371 TSecr=3425246
503 0.756749812 172.31.23.72 -> 172.31.31.144 OpenFlow 74 Type: OFPT_BARRIER_REPLY
504 0.756769005 172.31.31.144 -> 172.31.23.72 OpenFlow 154 Type: OFPT_BARRIER_REQUEST
505 0.756811356 172.31.31.144 -> 172.31.23.72 OpenFlow 146 Type: OFPT_FLOW_MOD
506 0.756814944 172.31.31.144 -> 172.31.23.72 OpenFlow 74 Type: OFPT_BARRIER_REQUEST
507 0.756816933 172.31.31.144 -> 172.31.23.72 OpenFlow 146 Type: OFPT_FLOW_MOD
508 0.756820482 172.31.23.72 -> 172.31.31.144 TCP 66 48360 → 6633 [ACK] Seq=819 Ack=1217 Win=213 Len=0 TSval=21995372 TSecr=3425246
509 0.756827315 172.31.23.72 -> 172.31.31.144 OpenFlow 74 Type: OFPT_BARRIER_REPLY
510 0.756850624 172.31.31.144 -> 172.31.23.72 OpenFlow 146 Type: OFPT_FLOW_MOD
511 0.756855132 172.31.31.144 -> 172.31.23.72 OpenFlow 154 Type: OFPT_BARRIER_REQUEST
512 0.756880250 172.31.23.72 -> 172.31.31.144 OpenFlow 74 Type: OFPT_BARRIER_REPLY
513 0.756906993 172.31.31.144 -> 172.31.23.72 OpenFlow 146 Type: OFPT_FLOW_MOD
514 0.756910986 172.31.23.72 -> 172.31.31.144 TCP 66 48360 → 6633 [ACK] Seq=819 Ack=1297 Win=213 Len=0 TSval=21995372 TSecr=3425246
515 0.756915120 172.31.31.144 -> 172.31.23.72 OpenFlow 146 Type: OFPT_FLOW_MOD
516 0.756917040 172.31.31.144 -> 172.31.23.72 OpenFlow 154 Type: OFPT_BARRIER_REQUEST
517 0.756932702 172.31.31.144 -> 172.31.23.72 OpenFlow 154 Type: OFPT_BARRIER_REQUEST
518 0.756935520 172.31.31.144 -> 172.31.23.72 OpenFlow 74 Type: OFPT_BARRIER_REQUEST
519 0.756937999 172.31.23.72 -> 172.31.31.144 TCP 66 48360 → 6633 [ACK] Seq=819 Ack=1305 Win=213 Len=0 TSval=21995372 TSecr=3425246
520 0.756958240 172.31.31.144 -> 172.31.23.72 TCP 66 6633 → 48342 [ACK] Seq=1473 Ack=993 Win=853 Len=0 TSval=3425246 TSecr=21995371
521 0.756980825 172.31.23.72 -> 172.31.31.144 OpenFlow 74 Type: OFPT_BARRIER_REPLY
522 0.756985899 172.31.31.144 -> 172.31.23.72 TCP 66 6633 → 48342 [ACK] Seq=1473 Ack=1001 Win=853 Len=0 TSval=3425246 TSecr=21995371
523 0.756989164 172.31.31.144 -> 172.31.23.72 OpenFlow 146 Type: OFPT_FLOW_MOD
524 0.756991718 172.31.23.72 -> 172.31.31.144 TCP 66 48360 → 6633 [ACK] Seq=819 Ack=1385 Win=213 Len=0 TSval=21995372 TSecr=3425246
525 0.757020897 172.31.31.144 -> 172.31.23.72 OpenFlow 154 Type: OFPT_BARRIER_REQUEST
526 0.757024679 172.31.23.72 -> 172.31.31.144 TCP 66 48360 → 6633 [ACK] Seq=819 Ack=1473 Win=213 Len=0 TSval=21995372 TSecr=3425246
527 0.757028807 172.31.31.144 -> 172.31.23.72 TCP 66 6633 → 48324 [ACK] Seq=1547 Ack=1001 Win=853 Len=0 TSval=3425246 TSecr=21995371
528 0.757033567 172.31.23.72 -> 172.31.31.144 OpenFlow 82 Type: OFPT_BARRIER_REPLY
529 0.757110549 172.31.31.144 -> 172.31.23.72 TCP 66 6633 → 48350 [ACK] Seq=1715 Ack=1327 Win=853 Len=0 TSval=3425246 TSecr=21995372
530 0.757129235 172.31.23.72 -> 172.31.31.144 TCP 66 48320 → 6633 [ACK] Seq=493 Ack=895 Win=213 Len=0 TSval=21995372 TSecr=3425246
531 0.757137863 172.31.23.72 -> 172.31.31.144 OpenFlow 74 Type: OFPT_BARRIER_REPLY
532 0.757161651 172.31.23.72 -> 172.31.31.144 OpenFlow 74 Type: OFPT_BARRIER_REPLY
533 0.757196862 172.31.31.144 -> 172.31.23.72 TCP 66 6633 → 48336 [ACK] Seq=1715 Ack=1239 Win=853 Len=0 TSval=3425246 TSecr=21995372
534 0.757202733 172.31.23.72 -> 172.31.31.144 OpenFlow 82 Type: OFPT_BARRIER_REPLY
535 0.757221808 172.31.31.144 -> 172.31.23.72 TCP 66 6633 → 48336 [ACK] Seq=1715 Ack=1255 Win=853 Len=0 TSval=3425246 TSecr=21995372
536 0.757249520 172.31.23.72 -> 172.31.31.144 OpenFlow 74 Type: OFPT_BARRIER_REPLY
537 0.757280078 172.31.23.72 -> 172.31.31.144 OpenFlow 74 Type: OFPT_BARRIER_REPLY
538 0.757359759 172.31.31.144 -> 172.31.23.72 TCP 66 6633 → 48360 [ACK] Seq=1473 Ack=843 Win=853 Len=0 TSval=3425246 TSecr=21995372
539 0.757439696 172.31.23.72 -> 172.31.31.144 OpenFlow 146 Type: OFPT_FLOW_REMOVED
540 0.757461253 172.31.31.144 -> 172.31.23.72 TCP 66 6633 → 48332 [ACK] Seq=1547 Ack=1247 Win=853 Len=0 TSval=3425246 TSecr=21995372
541 0.757467417 172.31.23.72 -> 172.31.31.144 OpenFlow 306 Type: OFPT_FLOW_REMOVED
542 0.757475027 172.31.23.72 -> 172.31.31.144 OpenFlow 146 Type: OFPT_FLOW_REMOVED
543 0.757482093 172.31.23.72 -> 172.31.31.144 OpenFlow 146 Type: OFPT_FLOW_REMOVED
544 0.757493764 172.31.23.72 -> 172.31.31.144 OpenFlow 146 Type: OFPT_FLOW_REMOVED
545 0.757509224 172.31.23.72 -> 172.31.31.144 OpenFlow 146 Type: OFPT_FLOW_REMOVED
546 0.757511040 172.31.23.72 -> 172.31.31.144 OpenFlow 146 Type: OFPT_FLOW_REMOVED
547 0.757528595 172.31.23.72 -> 172.31.31.144 OpenFlow 146 Type: OFPT_FLOW_REMOVED
548 0.757530824 172.31.23.72 -> 172.31.31.144 OpenFlow 306 Type: OFPT_FLOW_REMOVED
549 0.757537914 172.31.23.72 -> 172.31.31.144 OpenFlow 146 Type: OFPT_FLOW_REMOVED
550 0.757553209 172.31.23.72 -> 172.31.31.144 OpenFlow 146 Type: OFPT_FLOW_REMOVED
551 0.757557406 172.31.23.72 -> 172.31.31.144 OpenFlow 306 Type: OFPT_FLOW_REMOVED
552 0.757635582 172.31.23.72 -> 172.31.31.144 OpenFlow 466 Type: OFPT_FLOW_REMOVED
553 0.757638101 172.31.23.72 -> 172.31.31.144 OpenFlow 146 Type: OFPT_FLOW_REMOVED
554 0.757677156 172.31.31.144 -> 172.31.23.72 TCP 66 6633 → 48342 [ACK] Seq=1473 Ack=1081 Win=853 Len=0 TSval=3425246 TSecr=21995372
555 0.757681105 172.31.31.144 -> 172.31.23.72 TCP 66 6633 → 48342 [ACK] Seq=1473 Ack=1321 Win=853 Len=0 TSval=3425246 TSecr=21995372
556 0.757682926 172.31.31.144 -> 172.31.23.72 TCP 66 6633 → 48330 [ACK] Seq=1379 Ack=1319 Win=853 Len=0 TSval=3425246 TSecr=21995371
557 0.757687707 172.31.23.72 -> 172.31.31.144 OpenFlow 466 Type: OFPT_FLOW_REMOVED
558 0.757693182 172.31.23.72 -> 172.31.31.144 OpenFlow 306 Type: OFPT_FLOW_REMOVED
559 0.757761107 172.31.31.144 -> 172.31.23.72 TCP 66 6633 → 48336 [ACK] Seq=1715 Ack=1335 Win=853 Len=0 TSval=3425246 TSecr=21995372
560 0.757808682 172.31.31.144 -> 172.31.23.72 OpenFlow 170 Type: OFPT_FLOW_MOD
561 0.757813330 172.31.31.144 -> 172.31.23.72 OpenFlow 178 Type: OFPT_BARRIER_REQUEST
562 0.757839646 172.31.31.144 -> 172.31.23.72 TCP 66 6633 → 48320 [ACK] Seq=895 Ack=581 Win=853 Len=0 TSval=3425246 TSecr=21995372
563 0.757875437 172.31.31.144 -> 172.31.23.72 TCP 66 6633 → 48336 [ACK] Seq=1715 Ack=1735 Win=853 Len=0 TSval=3425246 TSecr=21995372
564 0.757877972 172.31.31.144 -> 172.31.23.72 TCP 66 6633 → 48350 [ACK] Seq=1715 Ack=1647 Win=853 Len=0 TSval=3425246 TSecr=21995372
565 0.757908678 172.31.31.144 -> 172.31.23.72 TCP 66 6633 → 48324 [ACK] Seq=1547 Ack=1321 Win=853 Len=0 TSval=3425246 TSecr=21995372
566 0.757911537 172.31.31.144 -> 172.31.23.72 TCP 66 6633 → 48360 [ACK] Seq=1473 Ack=1323 Win=853 Len=0 TSval=3425246 TSecr=21995372
567 0.757947942 172.31.31.144 -> 172.31.23.72 OpenFlow 170 Type: OFPT_FLOW_MOD
568 0.757950892 172.31.31.144 -> 172.31.23.72 TCP 66 6633 → 48332 [ACK] Seq=1547 Ack=1567 Win=853 Len=0 TSval=3425246 TSecr=21995372
569 0.757980056 172.31.31.144 -> 172.31.23.72 OpenFlow 170 Type: OFPT_FLOW_MOD
570 0.757984256 172.31.31.144 -> 172.31.23.72 OpenFlow 170 Type: OFPT_FLOW_MOD
571 0.758011226 172.31.31.144 -> 172.31.23.72 OpenFlow 178 Type: OFPT_BARRIER_REQUEST
572 0.758013420 172.31.31.144 -> 172.31.23.72 OpenFlow 74 Type: OFPT_BARRIER_REQUEST
573 0.758092213 172.31.31.144 -> 172.31.23.72 OpenFlow 170 Type: OFPT_FLOW_MOD
574 0.758124046 172.31.31.144 -> 172.31.23.72 OpenFlow 170 Type: OFPT_FLOW_MOD
575 0.758134701 172.31.31.144 -> 172.31.23.72 OpenFlow 282 Type: OFPT_FLOW_MOD
576 0.758163487 172.31.31.144 -> 172.31.23.72 OpenFlow 170 Type: OFPT_FLOW_MOD
577 0.758172210 172.31.31.144 -> 172.31.23.72 OpenFlow 178 Type: OFPT_BARRIER_REQUEST
578 0.758207922 172.31.31.144 -> 172.31.23.72 OpenFlow 170 Type: OFPT_FLOW_MOD
579 0.758211494 172.31.31.144 -> 172.31.23.72 OpenFlow 178 Type: OFPT_BARRIER_REQUEST
580 0.758285387 172.31.31.144 -> 172.31.23.72 OpenFlow 170 Type: OFPT_FLOW_MOD
581 0.758316386 172.31.31.144 -> 172.31.23.72 OpenFlow 170 Type: OFPT_FLOW_MOD
582 0.758371029 172.31.31.144 -> 172.31.23.72 OpenFlow 170 Type: OFPT_FLOW_MOD
583 0.758403237 172.31.31.144 -> 172.31.23.72 OpenFlow 178 Type: OFPT_FLOW_MOD
584 0.758405338 172.31.31.144 -> 172.31.23.72 OpenFlow 170 Type: OFPT_FLOW_MOD
585 0.758434532 172.31.31.144 -> 172.31.23.72 OpenFlow 170 Type: OFPT_FLOW_MOD
586 0.758445294 172.31.31.144 -> 172.31.23.72 OpenFlow 178 Type: OFPT_BARRIER_REQUEST
587 0.758474718 172.31.31.144 -> 172.31.23.72 OpenFlow 170 Type: OFPT_FLOW_MOD
588 0.758476626 172.31.31.144 -> 172.31.23.72 OpenFlow 178 Type: OFPT_BARRIER_REQUEST
589 0.758519210 172.31.31.144 -> 172.31.23.72 OpenFlow 170 Type: OFPT_FLOW_MOD
590 0.758521703 172.31.31.144 -> 172.31.23.72 OpenFlow 178 Type: OFPT_BARRIER_REQUEST
591 0.758551444 172.31.31.144 -> 172.31.23.72 OpenFlow 170 Type: OFPT_FLOW_MOD
592 0.758553680 172.31.31.144 -> 172.31.23.72 OpenFlow 178 Type: OFPT_BARRIER_REQUEST
593 0.758632242 172.31.31.144 -> 172.31.23.72 OpenFlow 170 Type: OFPT_FLOW_MOD
594 0.758704935 172.31.31.144 -> 172.31.23.72 OpenFlow 170 Type: OFPT_FLOW_MOD
595 0.758737407 172.31.31.144 -> 172.31.23.72 OpenFlow 74 Type: OFPT_BARRIER_REQUEST
596 0.758883572 172.31.31.144 -> 172.31.23.72 OpenFlow 170 Type: OFPT_FLOW_MOD
597 0.758940266 172.31.31.144 -> 172.31.23.72 OpenFlow 170 Type: OFPT_FLOW_MOD
598 0.758942399 172.31.31.144 -> 172.31.23.72 OpenFlow 74 Type: OFPT_BARRIER_REQUEST
599 0.759994348 172.31.23.72 -> 172.31.31.144 OpenFlow 74 Type: OFPT_BARRIER_REPLY
600 0.760040411 172.31.23.72 -> 172.31.31.144 OpenFlow 74 Type: OFPT_BARRIER_REPLY
601 0.760074683 172.31.23.72 -> 172.31.31.144 OpenFlow 74 Type: OFPT_BARRIER_REPLY
602 0.760101475 172.31.23.72 -> 172.31.31.144 TCP 66 48326 → 6633 [ACK] Seq=739 Ack=1137 Win=213 Len=0 TSval=21995372 TSecr=3425246
603 0.760108770 172.31.23.72 -> 172.31.31.144 OpenFlow 74 Type: OFPT_BARRIER_REPLY
604 0.760133185 172.31.23.72 -> 172.31.31.144 OpenFlow 74 Type: OFPT_BARRIER_REPLY
605 0.760160763 172.31.23.72 -> 172.31.31.144 OpenFlow 74 Type: OFPT_BARRIER_REPLY
606 0.760187975 172.31.23.72 -> 172.31.31.144 OpenFlow 74 Type: OFPT_BARRIER_REPLY
607 0.760209471 172.31.31.144 -> 172.31.23.72 TCP 66 6633 → 48358 [ACK] Seq=1401 Ack=747 Win=853 Len=0 TSval=3425247 TSecr=21995372
608 0.760214971 172.31.31.144 -> 172.31.23.72 TCP 66 6633 → 48358 [ACK] Seq=1401 Ack=755 Win=853 Len=0 TSval=3425247 TSecr=21995372
609 0.760230928 172.31.31.144 -> 172.31.23.72 TCP 66 6633 → 48342 [ACK] Seq=1473 Ack=1329 Win=853 Len=0 TSval=3425247 TSecr=21995372
610 0.760235749 172.31.23.72 -> 172.31.31.144 OpenFlow 74 Type: OFPT_BARRIER_REPLY
611 0.760267100 172.31.31.144 -> 172.31.23.72 TCP 66 6633 → 48326 [ACK] Seq=1137 Ack=747 Win=853 Len=0 TSval=3425247 TSecr=21995372
612 0.760276132 172.31.23.72 -> 172.31.31.144 OpenFlow 74 Type: OFPT_BARRIER_REPLY
613 0.760328427 172.31.23.72 -> 172.31.31.144 OpenFlow 74 Type: OFPT_BARRIER_REPLY
614 0.760351151 172.31.31.144 -> 172.31.23.72 TCP 66 6633 → 48340 [ACK] Seq=1643 Ack=1247 Win=853 Len=0 TSval=3425247 TSecr=21995372
615 0.760409055 172.31.31.144 -> 172.31.23.72 TCP 66 6633 → 48330 [ACK] Seq=1915 Ack=1415 Win=853 Len=0 TSval=3425247 TSecr=21995372
616 0.760421230 172.31.23.72 -> 172.31.31.144 OpenFlow 74 Type: OFPT_BARRIER_REPLY
617 0.760461940 172.31.23.72 -> 172.31.31.144 OpenFlow 74 Type: OFPT_BARRIER_REPLY
618 0.760501168 172.31.23.72 -> 172.31.31.144 OpenFlow 74 Type: OFPT_BARRIER_REPLY
619 0.760519437 172.31.23.72 -> 172.31.31.144 OpenFlow 74 Type: OFPT_BARRIER_REPLY
620 0.760548261 172.31.23.72 -> 172.31.31.144 OpenFlow 74 Type: OFPT_BARRIER_REPLY
621 0.760579411 172.31.23.72 -> 172.31.31.144 TCP 66 48332 → 6633 [ACK] Seq=1567 Ack=1867 Win=213 Len=0 TSval=21995372 TSecr=3425246
622 0.760589941 172.31.23.72 -> 172.31.31.144 OpenFlow 74 Type: OFPT_BARRIER_REPLY
623 0.760648426 172.31.31.144 -> 172.31.23.72 TCP 66 6633 → 48360 [ACK] Seq=1905 Ack=1339 Win=853 Len=0 TSval=3425247 TSecr=21995372
624 0.760711814 172.31.31.144 -> 172.31.23.72 TCP 66 6633 → 48348 [ACK] Seq=1159 Ack=755 Win=853 Len=0 TSval=3425247 TSecr=21995372
625 0.760747075 172.31.23.72 -> 172.31.31.144 OpenFlow 146 Type: OFPT_FLOW_REMOVED
626 0.760777500 172.31.23.72 -> 172.31.31.144 OpenFlow 146 Type: OFPT_FLOW_REMOVED
627 0.760786575 172.31.23.72 -> 172.31.31.144 OpenFlow 146 Type: OFPT_FLOW_REMOVED
628 0.760792148 172.31.23.72 -> 172.31.31.144 OpenFlow 146 Type: OFPT_FLOW_REMOVED
629 0.760837245 172.31.31.144 -> 172.31.23.72 OpenFlow 170 Type: OFPT_FLOW_MOD
630 0.760845441 172.31.23.72 -> 172.31.31.144 OpenFlow 146 Type: OFPT_FLOW_REMOVED
631 0.760851746 172.31.23.72 -> 172.31.31.144 OpenFlow 146 Type: OFPT_FLOW_REMOVED
632 0.760882770 172.31.31.144 -> 172.31.23.72 OpenFlow 170 Type: OFPT_FLOW_MOD
633 0.760886336 172.31.31.144 -> 172.31.23.72 OpenFlow 178 Type: OFPT_BARRIER_REQUEST
634 0.760930682 172.31.31.144 -> 172.31.23.72 OpenFlow 178 Type: OFPT_BARRIER_REQUEST
635 0.760933510 172.31.31.144 -> 172.31.23.72 OpenFlow 170 Type: OFPT_FLOW_MOD
636 0.760936353 172.31.31.144 -> 172.31.23.72 OpenFlow 170 Type: OFPT_FLOW_MOD
637 0.760945604 172.31.31.144 -> 172.31.23.72 TCP 66 6633 → 48342 [ACK] Seq=1473 Ack=1409 Win=853 Len=0 TSval=3425247 TSecr=21995372
638 0.760974227 172.31.31.144 -> 172.31.23.72 OpenFlow 170 Type: OFPT_FLOW_MOD
639 0.760977116 172.31.31.144 -> 172.31.23.72 OpenFlow 74 Type: OFPT_BARRIER_REQUEST
640 0.761009564 172.31.31.144 -> 172.31.23.72 TCP 66 6633 → 48326 [ACK] Seq=1137 Ack=827 Win=853 Len=0 TSval=3425247 TSecr=21995373
641 0.761012803 172.31.31.144 -> 172.31.23.72 OpenFlow 170 Type: OFPT_FLOW_MOD
642 0.761046807 172.31.31.144 -> 172.31.23.72 OpenFlow 170 Type: OFPT_FLOW_MOD
643 0.761049040 172.31.31.144 -> 172.31.23.72 OpenFlow 170 Type: OFPT_FLOW_MOD
644 0.761081601 172.31.31.144 -> 172.31.23.72 TCP 66 6633 → 48342 [ACK] Seq=1473 Ack=1489 Win=853 Len=0 TSval=3425247 TSecr=21995373
645 0.761091708 172.31.31.144 -> 172.31.23.72 OpenFlow 170 Type: OFPT_FLOW_MOD
646 0.761119286 172.31.31.144 -> 172.31.23.72 OpenFlow 74 Type: OFPT_BARRIER_REQUEST
647 0.761129659 172.31.31.144 -> 172.31.23.72 TCP 66 6633 → 48350 [ACK] Seq=1715 Ack=1735 Win=853 Len=0 TSval=3425247 TSecr=21995372
648 0.761159348 172.31.31.144 -> 172.31.23.72 TCP 66 6633 → 48326 [ACK] Seq=1137 Ack=907 Win=853 Len=0 TSval=3425247 TSecr=21995373
649 0.761162002 172.31.31.144 -> 172.31.23.72 OpenFlow 170 Type: OFPT_FLOW_MOD
650 0.761194716 172.31.31.144 -> 172.31.23.72 OpenFlow 74 Type: OFPT_BARRIER_REQUEST
651 0.761204458 172.31.31.144 -> 172.31.23.72 OpenFlow 74 Type: OFPT_BARRIER_REQUEST
652 0.761238511 172.31.31.144 -> 172.31.23.72 OpenFlow 170 Type: OFPT_FLOW_MOD
653 0.761241095 172.31.31.144 -> 172.31.23.72 OpenFlow 170 Type: OFPT_FLOW_MOD
654 0.761268398 172.31.31.144 -> 172.31.23.72 OpenFlow 74 Type: OFPT_BARRIER_REQUEST
655 0.761298029 172.31.31.144 -> 172.31.23.72 OpenFlow 170 Type: OFPT_FLOW_MOD
656 0.762468691 172.31.23.72 -> 172.31.31.144 OpenFlow 74 Type: OFPT_BARRIER_REPLY
657 0.762525891 172.31.23.72 -> 172.31.31.144 TCP 66 48344 → 6633 [ACK] Seq=985 Ack=1185 Win=213 Len=0 TSval=21995373 TSecr=3425247
658 0.762534989 172.31.23.72 -> 172.31.31.144 OpenFlow 74 Type: OFPT_BARRIER_REPLY
659 0.762565728 172.31.23.72 -> 172.31.31.144 TCP 66 48334 → 6633 [ACK] Seq=739 Ack=943 Win=213 Len=0 TSval=21995373 TSecr=3425247
660 0.762577675 172.31.23.72 -> 172.31.31.144 OpenFlow 74 Type: OFPT_BARRIER_REPLY
661 0.762605030 172.31.23.72 -> 172.31.31.144 TCP 66 48352 → 6633 [ACK] Seq=1231 Ack=1427 Win=213 Len=0 TSval=21995373 TSecr=3425247
662 0.762613267 172.31.23.72 -> 172.31.31.144 OpenFlow 74 Type: OFPT_BARRIER_REPLY
663 0.762636643 172.31.23.72 -> 172.31.31.144 TCP 66 48338 → 6633 [ACK] Seq=985 Ack=1185 Win=213 Len=0 TSval=21995373 TSecr=3425247
664 0.762645131 172.31.23.72 -> 172.31.31.144 OpenFlow 74 Type: OFPT_BARRIER_REPLY
665 0.762680331 172.31.23.72 -> 172.31.31.144 TCP 66 48362 → 6633 [ACK] Seq=985 Ack=1185 Win=213 Len=0 TSval=21995373 TSecr=3425247
666 0.762688503 172.31.23.72 -> 172.31.31.144 OpenFlow 74 Type: OFPT_BARRIER_REPLY
667 0.762714297 172.31.23.72 -> 172.31.31.144 TCP 66 48360 → 6633 [ACK] Seq=1339 Ack=2121 Win=213 Len=0 TSval=21995373 TSecr=3425247
668 0.762722708 172.31.31.144 -> 172.31.23.72 TCP 66 6633 → 48344 [ACK] Seq=1185 Ack=993 Win=853 Len=0 TSval=3425247 TSecr=21995373
669 0.762727476 172.31.31.144 -> 172.31.23.72 TCP 66 6633 → 48334 [ACK] Seq=943 Ack=747 Win=853 Len=0 TSval=3425247 TSecr=21995373
670 0.762731666 172.31.23.72 -> 172.31.31.144 OpenFlow 74 Type: OFPT_BARRIER_REPLY
671 0.799929819 172.31.31.144 -> 172.31.23.72 TCP 66 6633 → 48338 [ACK] Seq=1185 Ack=993 Win=853 Len=0 TSval=3425257 TSecr=21995373
672 0.799943460 172.31.31.144 -> 172.31.23.72 TCP 66 6633 → 48352 [ACK] Seq=1427 Ack=1239 Win=853 Len=0 TSval=3425257 TSecr=21995373
673 0.799948394 172.31.31.144 -> 172.31.23.72 TCP 66 6633 → 48332 [ACK] Seq=1867 Ack=1575 Win=853 Len=0 TSval=3425257 TSecr=21995372
674 0.799968239 172.31.31.144 -> 172.31.23.72 TCP 66 6633 → 48350 [ACK] Seq=1715 Ack=1815 Win=853 Len=0 TSval=3425257 TSecr=21995373
675 0.799993256 172.31.31.144 -> 172.31.23.72 TCP 66 6633 → 48324 [ACK] Seq=1867 Ack=1329 Win=853 Len=0 TSval=3425257 TSecr=21995372
676 0.800019197 172.31.31.144 -> 172.31.23.72 TCP 66 6633 → 48362 [ACK] Seq=1185 Ack=993 Win=853 Len=0 TSval=3425257 TSecr=21995373
677 0.800046144 172.31.31.144 -> 172.31.23.72 TCP 66 6633 → 48326 [ACK] Seq=1457 Ack=915 Win=853 Len=0 TSval=3425257 TSecr=21995373
678 0.800083924 172.31.31.144 -> 172.31.23.72 TCP 66 6633 → 48360 [ACK] Seq=2121 Ack=1347 Win=853 Len=0 TSval=3425257 TSecr=21995373
679 0.800108057 172.31.31.144 -> 172.31.23.72 TCP 66 6633 → 48320 [ACK] Seq=1319 Ack=669 Win=853 Len=0 TSval=3425257 TSecr=21995372
680 2.623710498 172.31.31.144 -> 172.31.23.72 OpenFlow 90 Type: OFPT_MULTIPART_REQUEST, OFPMP_PORT_STATS
681 2.623739279 172.31.31.144 -> 172.31.23.72 OpenFlow 122 Type: OFPT_MULTIPART_REQUEST, OFPMP_FLOW
682 2.623743918 172.31.31.144 -> 172.31.23.72 OpenFlow 82 Type: OFPT_MULTIPART_REQUEST, OFPMP_TABLE
683 2.624119621 172.31.23.72 -> 172.31.31.144 OpenFlow 530 Type: OFPT_MULTIPART_REPLY, OFPMP_PORT_STATS
684 2.624220536 172.31.23.72 -> 172.31.31.144 OpenFlow 2010 Type: OFPT_MULTIPART_REPLY, OFPMP_FLOW
685 2.624389090 172.31.31.144 -> 172.31.23.72 TCP 66 6633 → 48320 [ACK] Seq=1415 Ack=1133 Win=853 Len=0 TSval=3425713 TSecr=21995838
686 2.624406795 172.31.31.144 -> 172.31.23.72 TCP 66 6633 → 48320 [ACK] Seq=1415 Ack=3077 Win=853 Len=0 TSval=3425713 TSecr=21995838
687 2.624419893 172.31.23.72 -> 172.31.31.144 OpenFlow 6178 Type: OFPT_MULTIPART_REPLY, OFPMP_TABLE
688 2.624642397 172.31.31.144 -> 172.31.23.72 TCP 66 6633 → 48320 [ACK] Seq=1415 Ack=9189 Win=853 Len=0 TSval=3425713 TSecr=21995838
689 2.685065147 172.31.31.144 -> 172.31.23.72 OpenFlow 90 Type: OFPT_MULTIPART_REQUEST, OFPMP_PORT_STATS
690 2.685107338 172.31.31.144 -> 172.31.23.72 OpenFlow 138 Type: OFPT_MULTIPART_REQUEST, OFPMP_FLOW
691 2.685474569 172.31.23.72 -> 172.31.31.144 OpenFlow 642 Type: OFPT_MULTIPART_REPLY, OFPMP_PORT_STATS
692 2.685651317 172.31.23.72 -> 172.31.31.144 OpenFlow 6178 Type: OFPT_MULTIPART_REPLY, OFPMP_TABLE
693 2.685736023 172.31.23.72 -> 172.31.31.144 OpenFlow 2842 Type: OFPT_MULTIPART_REPLY, OFPMP_FLOW
694 2.685852399 172.31.31.144 -> 172.31.23.72 TCP 66 6633 → 48322 [ACK] Seq=1065 Ack=7427 Win=853 Len=0 TSval=3425728 TSecr=21995854
695 2.702270438 172.31.31.144 -> 172.31.23.72 OpenFlow 82 Type: OFPT_MULTIPART_REQUEST, OFPMP_TABLE
696 2.702280672 172.31.31.144 -> 172.31.23.72 OpenFlow 146 Type: OFPT_MULTIPART_REQUEST, OFPMP_FLOW
697 2.702526287 172.31.23.72 -> 172.31.31.144 OpenFlow 6178 Type: OFPT_MULTIPART_REPLY, OFPMP_TABLE
698 2.702639351 172.31.23.72 -> 172.31.31.144 OpenFlow 754 Type: OFPT_MULTIPART_REPLY, OFPMP_PORT_STATS
699 2.702720265 172.31.23.72 -> 172.31.31.144 OpenFlow 2426 Type: OFPT_MULTIPART_REPLY, OFPMP_FLOW
700 2.702807790 172.31.31.144 -> 172.31.23.72 TCP 66 6633 → 48324 [ACK] Seq=1963 Ack=7441 Win=853 Len=0 TSval=3425732 TSecr=21995858
701 2.702840445 172.31.31.144 -> 172.31.23.72 TCP 66 6633 → 48324 [ACK] Seq=1963 Ack=8129 Win=853 Len=0 TSval=3425732 TSecr=21995858
702 2.702885816 172.31.31.144 -> 172.31.23.72 TCP 66 6633 → 48324 [ACK] Seq=1963 Ack=10489 Win=853 Len=0 TSval=3425732 TSecr=21995858
703 2.723872734 172.31.31.144 -> 172.31.23.72 TCP 66 6633 → 48322 [ACK] Seq=1065 Ack=10203 Win=853 Len=0 TSval=3425738 TSecr=21995854
