  1 0.000000000 172.31.31.144 -> 172.31.24.227 TCP 187 6633 → 50430 [PSH, ACK] Seq=1 Ack=1 Win=853 Len=121 TSval=1250530 TSecr=394315102
  2 0.000036383 172.31.31.144 -> 172.31.24.227 TCP 187 6633 → 50430 [PSH, ACK] Seq=122 Ack=1 Win=853 Len=121 TSval=1250530 TSecr=394315102
  3 0.000041759 172.31.31.144 -> 172.31.24.227 TCP 429 6633 → 50430 [PSH, ACK] Seq=243 Ack=1 Win=853 Len=363 TSval=1250530 TSecr=394315102
  4 0.000044877 172.31.31.144 -> 172.31.24.227 TCP 187 6633 → 50430 [PSH, ACK] Seq=606 Ack=1 Win=853 Len=121 TSval=1250530 TSecr=394315102
  5 0.000678096 172.31.24.227 -> 172.31.31.144 TCP 66 50430 → 6633 [ACK] Seq=1 Ack=727 Win=213 Len=0 TSval=394315802 TSecr=1250530
  6 0.000897270 172.31.24.227 -> 172.31.31.144 OpenFlow 189 Type: OFPT_PACKET_IN
  7 0.000923373 172.31.24.227 -> 172.31.31.144 OpenFlow 189 Type: OFPT_PACKET_IN
  8 0.000973695 172.31.24.227 -> 172.31.31.144 OpenFlow 189 Type: OFPT_PACKET_IN
  9 0.000992870 172.31.24.227 -> 172.31.31.144 OpenFlow 189 Type: OFPT_PACKET_IN
 10 0.001199873 172.31.31.144 -> 172.31.24.227 TCP 66 6633 → 50440 [ACK] Seq=1 Ack=124 Win=853 Len=0 TSval=1250530 TSecr=394315802
 11 0.001210225 172.31.31.144 -> 172.31.24.227 TCP 66 6633 → 50440 [ACK] Seq=1 Ack=247 Win=853 Len=0 TSval=1250530 TSecr=394315802
 12 0.001213327 172.31.31.144 -> 172.31.24.227 TCP 66 6633 → 50432 [ACK] Seq=1 Ack=124 Win=853 Len=0 TSval=1250530 TSecr=394315802
 13 0.001251006 172.31.31.144 -> 172.31.24.227 TCP 66 6633 → 50432 [ACK] Seq=1 Ack=247 Win=853 Len=0 TSval=1250530 TSecr=394315802
 14 0.100134492 172.31.31.144 -> 172.31.24.227 OpenFlow 187 Type: OFPT_PACKET_OUT
 15 0.100159933 172.31.31.144 -> 172.31.24.227 OpenFlow 187 Type: OFPT_PACKET_OUT
 16 0.100165970 172.31.31.144 -> 172.31.24.227 OpenFlow 550 Type: OFPT_PACKET_OUT
 17 0.100168871 172.31.31.144 -> 172.31.24.227 OpenFlow 308 Type: OFPT_PACKET_OUT
 18 0.100171416 172.31.31.144 -> 172.31.24.227 TCP 187 6633 → 50434 [PSH, ACK] Seq=1 Ack=1 Win=853 Len=121 TSval=1250555 TSecr=394315103
 19 0.100177800 172.31.31.144 -> 172.31.24.227 TCP 550 6633 → 50434 [PSH, ACK] Seq=122 Ack=1 Win=853 Len=484 TSval=1250555 TSecr=394315103
 20 0.100180639 172.31.31.144 -> 172.31.24.227 TCP 671 6633 → 50434 [PSH, ACK] Seq=606 Ack=1 Win=853 Len=605 TSval=1250555 TSecr=394315103
 21 0.100780294 172.31.24.227 -> 172.31.31.144 TCP 66 50434 → 6633 [ACK] Seq=1 Ack=1211 Win=213 Len=0 TSval=394315827 TSecr=1250555
 22 0.100910989 172.31.24.227 -> 172.31.31.144 OpenFlow 189 Type: OFPT_PACKET_IN
 23 0.100953595 172.31.24.227 -> 172.31.31.144 OpenFlow 189 Type: OFPT_PACKET_IN
 24 0.101173176 172.31.31.144 -> 172.31.24.227 TCP 66 6633 → 50432 [ACK] Seq=969 Ack=370 Win=853 Len=0 TSval=1250555 TSecr=394315827
 25 0.101182409 172.31.31.144 -> 172.31.24.227 TCP 66 6633 → 50432 [ACK] Seq=969 Ack=493 Win=853 Len=0 TSval=1250555 TSecr=394315827
 26 0.101352409 172.31.24.227 -> 172.31.31.144 OpenFlow 189 Type: OFPT_PACKET_IN
 27 0.101372702 172.31.24.227 -> 172.31.31.144 OpenFlow 189 Type: OFPT_PACKET_IN
 28 0.101415184 172.31.24.227 -> 172.31.31.144 OpenFlow 189 Type: OFPT_PACKET_IN
 29 0.101432949 172.31.24.227 -> 172.31.31.144 OpenFlow 189 Type: OFPT_PACKET_IN
 30 0.101449885 172.31.24.227 -> 172.31.31.144 OpenFlow 189 Type: OFPT_PACKET_IN
 31 0.101490222 172.31.24.227 -> 172.31.31.144 OpenFlow 189 Type: OFPT_PACKET_IN
 32 0.101533370 172.31.31.144 -> 172.31.24.227 TCP 66 6633 → 50430 [ACK] Seq=727 Ack=124 Win=853 Len=0 TSval=1250555 TSecr=394315827
 33 0.101596308 172.31.24.227 -> 172.31.31.144 OpenFlow 189 Type: OFPT_PACKET_IN
 34 0.101625224 172.31.24.227 -> 172.31.31.144 OpenFlow 189 Type: OFPT_PACKET_IN
 35 0.101642314 172.31.24.227 -> 172.31.31.144 OpenFlow 189 Type: OFPT_PACKET_IN
 36 0.101649195 172.31.31.144 -> 172.31.24.227 TCP 66 6633 → 50430 [ACK] Seq=727 Ack=247 Win=853 Len=0 TSval=1250555 TSecr=394315827
 37 0.101654000 172.31.31.144 -> 172.31.24.227 TCP 66 6633 → 50442 [ACK] Seq=1 Ack=124 Win=853 Len=0 TSval=1250555 TSecr=394315827
 38 0.101657622 172.31.31.144 -> 172.31.24.227 TCP 66 6633 → 50442 [ACK] Seq=1 Ack=247 Win=853 Len=0 TSval=1250555 TSecr=394315827
 39 0.101679560 172.31.24.227 -> 172.31.31.144 OpenFlow 189 Type: OFPT_PACKET_IN
 40 0.101686021 172.31.24.227 -> 172.31.31.144 OpenFlow 189 Type: OFPT_PACKET_IN
 41 0.101783017 172.31.31.144 -> 172.31.24.227 TCP 66 6633 → 50438 [ACK] Seq=1 Ack=124 Win=853 Len=0 TSval=1250555 TSecr=394315827
 42 0.101790010 172.31.31.144 -> 172.31.24.227 TCP 66 6633 → 50438 [ACK] Seq=1 Ack=247 Win=853 Len=0 TSval=1250555 TSecr=394315827
 43 0.101796769 172.31.24.227 -> 172.31.31.144 OpenFlow 189 Type: OFPT_PACKET_IN
 44 0.101873460 172.31.31.144 -> 172.31.24.227 TCP 66 6633 → 50440 [ACK] Seq=1 Ack=370 Win=853 Len=0 TSval=1250555 TSecr=394315827
 45 0.101928264 172.31.31.144 -> 172.31.24.227 TCP 66 6633 → 50434 [ACK] Seq=1211 Ack=124 Win=853 Len=0 TSval=1250555 TSecr=394315827
 46 0.102006376 172.31.31.144 -> 172.31.24.227 TCP 66 6633 → 50440 [ACK] Seq=1 Ack=493 Win=853 Len=0 TSval=1250555 TSecr=394315827
 47 0.102018637 172.31.31.144 -> 172.31.24.227 TCP 66 6633 → 50436 [ACK] Seq=1 Ack=124 Win=853 Len=0 TSval=1250555 TSecr=394315827
 48 0.102058420 172.31.31.144 -> 172.31.24.227 TCP 66 6633 → 50434 [ACK] Seq=1211 Ack=247 Win=853 Len=0 TSval=1250556 TSecr=394315828
 49 0.102132160 172.31.31.144 -> 172.31.24.227 TCP 66 6633 → 50436 [ACK] Seq=1 Ack=247 Win=853 Len=0 TSval=1250555 TSecr=394315827
 50 0.200003836 172.31.31.144 -> 172.31.24.227 OpenFlow 187 Type: OFPT_PACKET_OUT
 51 0.200032669 172.31.31.144 -> 172.31.24.227 OpenFlow 187 Type: OFPT_PACKET_OUT
 52 0.200038694 172.31.31.144 -> 172.31.24.227 OpenFlow 308 Type: OFPT_PACKET_OUT
 53 0.200041402 172.31.31.144 -> 172.31.24.227 OpenFlow 550 Type: OFPT_PACKET_OUT
 54 0.200044148 172.31.31.144 -> 172.31.24.227 OpenFlow 187 Type: OFPT_PACKET_OUT
 55 0.200048040 172.31.31.144 -> 172.31.24.227 OpenFlow 550 Type: OFPT_PACKET_OUT
 56 0.200050593 172.31.31.144 -> 172.31.24.227 OpenFlow 187 Type: OFPT_PACKET_OUT
 57 0.200667598 172.31.24.227 -> 172.31.31.144 TCP 66 50436 → 6633 [ACK] Seq=247 Ack=969 Win=213 Len=0 TSval=394315852 TSecr=1250580
 58 0.200785797 172.31.24.227 -> 172.31.31.144 OpenFlow 189 Type: OFPT_PACKET_IN
 59 0.200811688 172.31.24.227 -> 172.31.31.144 OpenFlow 189 Type: OFPT_PACKET_IN
 60 0.200867226 172.31.24.227 -> 172.31.31.144 OpenFlow 189 Type: OFPT_PACKET_IN
 61 0.200892170 172.31.24.227 -> 172.31.31.144 OpenFlow 189 Type: OFPT_PACKET_IN
 62 0.200979213 172.31.24.227 -> 172.31.31.144 OpenFlow 189 Type: OFPT_PACKET_IN
 63 0.201025329 172.31.31.144 -> 172.31.24.227 TCP 66 6633 → 50434 [ACK] Seq=1211 Ack=370 Win=853 Len=0 TSval=1250580 TSecr=394315852
 64 0.201034706 172.31.31.144 -> 172.31.24.227 TCP 66 6633 → 50434 [ACK] Seq=1211 Ack=493 Win=853 Len=0 TSval=1250580 TSecr=394315852
 65 0.201045348 172.31.24.227 -> 172.31.31.144 OpenFlow 189 Type: OFPT_PACKET_IN
 66 0.201122044 172.31.31.144 -> 172.31.24.227 TCP 66 6633 → 50444 [ACK] Seq=1 Ack=124 Win=853 Len=0 TSval=1250580 TSecr=394315852
 67 0.201131185 172.31.31.144 -> 172.31.24.227 TCP 66 6633 → 50444 [ACK] Seq=1 Ack=247 Win=853 Len=0 TSval=1250580 TSecr=394315852
 68 0.201189409 172.31.31.144 -> 172.31.24.227 TCP 66 6633 → 50438 [ACK] Seq=727 Ack=370 Win=853 Len=0 TSval=1250580 TSecr=394315852
 69 0.201292961 172.31.31.144 -> 172.31.24.227 TCP 66 6633 → 50438 [ACK] Seq=727 Ack=493 Win=853 Len=0 TSval=1250580 TSecr=394315852
 70 0.201505139 172.31.24.227 -> 172.31.31.144 OpenFlow 189 Type: OFPT_PACKET_IN
 71 0.201527409 172.31.24.227 -> 172.31.31.144 OpenFlow 189 Type: OFPT_PACKET_IN
 72 0.201556357 172.31.24.227 -> 172.31.31.144 OpenFlow 189 Type: OFPT_PACKET_IN
 73 0.201585819 172.31.24.227 -> 172.31.31.144 OpenFlow 189 Type: OFPT_PACKET_IN
 74 0.201664826 172.31.24.227 -> 172.31.31.144 OpenFlow 189 Type: OFPT_PACKET_IN
 75 0.201811938 172.31.31.144 -> 172.31.24.227 TCP 66 6633 → 50436 [ACK] Seq=969 Ack=370 Win=853 Len=0 TSval=1250580 TSecr=394315852
 76 0.201819530 172.31.31.144 -> 172.31.24.227 TCP 66 6633 → 50436 [ACK] Seq=969 Ack=493 Win=853 Len=0 TSval=1250580 TSecr=394315852
 77 0.201822480 172.31.31.144 -> 172.31.24.227 TCP 66 6633 → 50434 [ACK] Seq=1211 Ack=616 Win=853 Len=0 TSval=1250580 TSecr=394315852
 78 0.201825045 172.31.31.144 -> 172.31.24.227 TCP 66 6633 → 50434 [ACK] Seq=1211 Ack=739 Win=853 Len=0 TSval=1250580 TSecr=394315852
 79 0.201831524 172.31.24.227 -> 172.31.31.144 OpenFlow 189 Type: OFPT_PACKET_IN
 80 0.201983003 172.31.31.144 -> 172.31.24.227 TCP 66 6633 → 50442 [ACK] Seq=1 Ack=370 Win=853 Len=0 TSval=1250580 TSecr=394315852
 81 0.202031276 172.31.31.144 -> 172.31.24.227 TCP 66 6633 → 50442 [ACK] Seq=1 Ack=493 Win=853 Len=0 TSval=1250581 TSecr=394315853
 82 0.299173138 172.31.31.144 -> 172.31.24.227 OpenFlow 187 Type: OFPT_PACKET_OUT
 83 0.299202459 172.31.31.144 -> 172.31.24.227 OpenFlow 187 Type: OFPT_PACKET_OUT
 84 0.299208830 172.31.31.144 -> 172.31.24.227 OpenFlow 187 Type: OFPT_PACKET_OUT
 85 0.299230747 172.31.31.144 -> 172.31.24.227 OpenFlow 187 Type: OFPT_PACKET_OUT
 86 0.299247757 172.31.31.144 -> 172.31.24.227 OpenFlow 187 Type: OFPT_PACKET_OUT
 87 0.299290174 172.31.31.144 -> 172.31.24.227 OpenFlow 187 Type: OFPT_PACKET_OUT
 88 0.299343151 172.31.31.144 -> 172.31.24.227 OpenFlow 187 Type: OFPT_PACKET_OUT
 89 0.299393649 172.31.31.144 -> 172.31.24.227 OpenFlow 187 Type: OFPT_PACKET_OUT
 90 0.299445724 172.31.31.144 -> 172.31.24.227 OpenFlow 187 Type: OFPT_PACKET_OUT
 91 0.299526204 172.31.31.144 -> 172.31.24.227 OpenFlow 187 Type: OFPT_PACKET_OUT
 92 0.299575955 172.31.31.144 -> 172.31.24.227 OpenFlow 187 Type: OFPT_PACKET_OUT
 93 0.299614665 172.31.31.144 -> 172.31.24.227 OpenFlow 187 Type: OFPT_PACKET_OUT
 94 0.299668990 172.31.31.144 -> 172.31.24.227 OpenFlow 187 Type: OFPT_PACKET_OUT
 95 0.299727243 172.31.31.144 -> 172.31.24.227 OpenFlow 187 Type: OFPT_PACKET_OUT
 96 0.299787540 172.31.31.144 -> 172.31.24.227 OpenFlow 187 Type: OFPT_PACKET_OUT
 97 0.299835382 172.31.31.144 -> 172.31.24.227 OpenFlow 187 Type: OFPT_PACKET_OUT
 98 0.299890534 172.31.31.144 -> 172.31.24.227 OpenFlow 187 Type: OFPT_PACKET_OUT
 99 0.299942264 172.31.31.144 -> 172.31.24.227 OpenFlow 187 Type: OFPT_PACKET_OUT
100 0.299995946 172.31.31.144 -> 172.31.24.227 OpenFlow 187 Type: OFPT_PACKET_OUT
101 0.300045791 172.31.31.144 -> 172.31.24.227 OpenFlow 187 Type: OFPT_PACKET_OUT
102 0.300139513 172.31.24.227 -> 172.31.31.144 TCP 66 50440 → 6633 [ACK] Seq=493 Ack=1211 Win=213 Len=0 TSval=394315877 TSecr=1250605
103 0.300267642 172.31.24.227 -> 172.31.31.144 OpenFlow 189 Type: OFPT_PACKET_IN
104 0.300288716 172.31.24.227 -> 172.31.31.144 OpenFlow 189 Type: OFPT_PACKET_IN
105 0.300316888 172.31.24.227 -> 172.31.31.144 OpenFlow 189 Type: OFPT_PACKET_IN
106 0.300348737 172.31.24.227 -> 172.31.31.144 OpenFlow 189 Type: OFPT_PACKET_IN
107 0.300384723 172.31.24.227 -> 172.31.31.144 OpenFlow 189 Type: OFPT_PACKET_IN
108 0.300419124 172.31.24.227 -> 172.31.31.144 OpenFlow 189 Type: OFPT_PACKET_IN
109 0.300451380 172.31.24.227 -> 172.31.31.144 OpenFlow 189 Type: OFPT_PACKET_IN
110 0.300492441 172.31.31.144 -> 172.31.24.227 TCP 66 6633 → 50446 [ACK] Seq=1 Ack=124 Win=853 Len=0 TSval=1250605 TSecr=394315877
111 0.300503168 172.31.31.144 -> 172.31.24.227 TCP 66 6633 → 50446 [ACK] Seq=1 Ack=247 Win=853 Len=0 TSval=1250605 TSecr=394315877
112 0.300557675 172.31.24.227 -> 172.31.31.144 OpenFlow 189 Type: OFPT_PACKET_IN
113 0.300601077 172.31.31.144 -> 172.31.24.227 TCP 66 6633 → 50432 [ACK] Seq=969 Ack=616 Win=853 Len=0 TSval=1250605 TSecr=394315877
114 0.300610483 172.31.31.144 -> 172.31.24.227 TCP 66 6633 → 50430 [ACK] Seq=727 Ack=370 Win=853 Len=0 TSval=1250605 TSecr=394315877
115 0.300690994 172.31.31.144 -> 172.31.24.227 TCP 66 6633 → 50430 [ACK] Seq=727 Ack=493 Win=853 Len=0 TSval=1250605 TSecr=394315877
116 0.300697661 172.31.31.144 -> 172.31.24.227 TCP 66 6633 → 50432 [ACK] Seq=969 Ack=739 Win=853 Len=0 TSval=1250605 TSecr=394315877
117 0.300938008 172.31.31.144 -> 172.31.24.227 TCP 66 6633 → 50442 [ACK] Seq=1211 Ack=739 Win=853 Len=0 TSval=1250605 TSecr=394315877
118 0.301081211 172.31.24.227 -> 172.31.31.144 OpenFlow 189 Type: OFPT_PACKET_IN
119 0.301101764 172.31.24.227 -> 172.31.31.144 OpenFlow 189 Type: OFPT_PACKET_IN
120 0.301229725 172.31.24.227 -> 172.31.31.144 OpenFlow 189 Type: OFPT_PACKET_IN
121 0.301253917 172.31.24.227 -> 172.31.31.144 OpenFlow 189 Type: OFPT_PACKET_IN
122 0.301269128 172.31.24.227 -> 172.31.31.144 OpenFlow 189 Type: OFPT_PACKET_IN
123 0.301293694 172.31.31.144 -> 172.31.24.227 TCP 66 6633 → 50438 [ACK] Seq=727 Ack=616 Win=853 Len=0 TSval=1250605 TSecr=394315877
124 0.301299910 172.31.31.144 -> 172.31.24.227 TCP 66 6633 → 50438 [ACK] Seq=727 Ack=739 Win=853 Len=0 TSval=1250605 TSecr=394315877
125 0.301318438 172.31.24.227 -> 172.31.31.144 OpenFlow 189 Type: OFPT_PACKET_IN
126 0.301328379 172.31.24.227 -> 172.31.31.144 OpenFlow 189 Type: OFPT_PACKET_IN
127 0.301330891 172.31.24.227 -> 172.31.31.144 OpenFlow 189 Type: OFPT_PACKET_IN
128 0.301349274 172.31.24.227 -> 172.31.31.144 OpenFlow 189 Type: OFPT_PACKET_IN
129 0.301352599 172.31.24.227 -> 172.31.31.144 OpenFlow 189 Type: OFPT_PACKET_IN
130 0.301430821 172.31.24.227 -> 172.31.31.144 OpenFlow 189 Type: OFPT_PACKET_IN
131 0.301598385 172.31.24.227 -> 172.31.31.144 OpenFlow 189 Type: OFPT_PACKET_IN
132 0.301630515 172.31.31.144 -> 172.31.24.227 TCP 66 6633 → 50450 [ACK] Seq=1 Ack=124 Win=853 Len=0 TSval=1250605 TSecr=394315877
133 0.301636999 172.31.31.144 -> 172.31.24.227 TCP 66 6633 → 50440 [ACK] Seq=1211 Ack=616 Win=853 Len=0 TSval=1250605 TSecr=394315877
134 0.301639567 172.31.31.144 -> 172.31.24.227 TCP 66 6633 → 50434 [ACK] Seq=1211 Ack=862 Win=853 Len=0 TSval=1250605 TSecr=394315877
135 0.301642198 172.31.31.144 -> 172.31.24.227 TCP 66 6633 → 50446 [ACK] Seq=1 Ack=370 Win=853 Len=0 TSval=1250605 TSecr=394315877
136 0.301644535 172.31.31.144 -> 172.31.24.227 TCP 66 6633 → 50450 [ACK] Seq=1 Ack=247 Win=853 Len=0 TSval=1250605 TSecr=394315877
137 0.301646815 172.31.31.144 -> 172.31.24.227 TCP 66 6633 → 50440 [ACK] Seq=1211 Ack=739 Win=853 Len=0 TSval=1250605 TSecr=394315877
138 0.301715679 172.31.31.144 -> 172.31.24.227 TCP 66 6633 → 50444 [ACK] Seq=1 Ack=370 Win=853 Len=0 TSval=1250605 TSecr=394315877
139 0.301799864 172.31.31.144 -> 172.31.24.227 TCP 66 6633 → 50434 [ACK] Seq=1211 Ack=985 Win=853 Len=0 TSval=1250605 TSecr=394315877
140 0.301804304 172.31.31.144 -> 172.31.24.227 TCP 66 6633 → 50446 [ACK] Seq=1 Ack=493 Win=853 Len=0 TSval=1250605 TSecr=394315877
141 0.301852852 172.31.31.144 -> 172.31.24.227 TCP 66 6633 → 50444 [ACK] Seq=1 Ack=493 Win=853 Len=0 TSval=1250605 TSecr=394315877
142 0.399498407 172.31.31.144 -> 172.31.24.227 OpenFlow 187 Type: OFPT_PACKET_OUT
143 0.399528977 172.31.31.144 -> 172.31.24.227 OpenFlow 187 Type: OFPT_PACKET_OUT
144 0.399535215 172.31.31.144 -> 172.31.24.227 OpenFlow 187 Type: OFPT_PACKET_OUT
145 0.399558289 172.31.31.144 -> 172.31.24.227 OpenFlow 187 Type: OFPT_PACKET_OUT
146 0.399561931 172.31.31.144 -> 172.31.24.227 OpenFlow 187 Type: OFPT_PACKET_OUT
147 0.399601492 172.31.31.144 -> 172.31.24.227 OpenFlow 187 Type: OFPT_PACKET_OUT
148 0.399664036 172.31.31.144 -> 172.31.24.227 OpenFlow 187 Type: OFPT_PACKET_OUT
149 0.399728013 172.31.31.144 -> 172.31.24.227 OpenFlow 187 Type: OFPT_PACKET_OUT
150 0.399773011 172.31.31.144 -> 172.31.24.227 OpenFlow 187 Type: OFPT_PACKET_OUT
151 0.399822835 172.31.31.144 -> 172.31.24.227 OpenFlow 187 Type: OFPT_PACKET_OUT
152 0.399891710 172.31.31.144 -> 172.31.24.227 OpenFlow 187 Type: OFPT_PACKET_OUT
153 0.399973182 172.31.31.144 -> 172.31.24.227 OpenFlow 187 Type: OFPT_PACKET_OUT
154 0.399979334 172.31.31.144 -> 172.31.24.227 OpenFlow 187 Type: OFPT_PACKET_OUT
155 0.400039942 172.31.31.144 -> 172.31.24.227 OpenFlow 187 Type: OFPT_PACKET_OUT
156 0.400099120 172.31.31.144 -> 172.31.24.227 OpenFlow 187 Type: OFPT_PACKET_OUT
157 0.400149851 172.31.31.144 -> 172.31.24.227 OpenFlow 187 Type: OFPT_PACKET_OUT
158 0.400420513 172.31.24.227 -> 172.31.31.144 TCP 66 50446 → 6633 [ACK] Seq=493 Ack=1211 Win=213 Len=0 TSval=394315902 TSecr=1250630
159 0.400723248 172.31.24.227 -> 172.31.31.144 TCP 66 50444 → 6633 [ACK] Seq=493 Ack=727 Win=213 Len=0 TSval=394315902 TSecr=1250630
160 0.400819430 172.31.24.227 -> 172.31.31.144 OpenFlow 189 Type: OFPT_PACKET_IN
161 0.400840753 172.31.24.227 -> 172.31.31.144 OpenFlow 312 Type: OFPT_PACKET_IN
162 0.400870132 172.31.24.227 -> 172.31.31.144 OpenFlow 189 Type: OFPT_PACKET_IN
163 0.400918480 172.31.24.227 -> 172.31.31.144 OpenFlow 189 Type: OFPT_PACKET_IN
164 0.400937018 172.31.24.227 -> 172.31.31.144 OpenFlow 435 Type: OFPT_PACKET_IN
165 0.401053283 172.31.31.144 -> 172.31.24.227 TCP 66 6633 → 50448 [ACK] Seq=1 Ack=124 Win=853 Len=0 TSval=1250630 TSecr=394315902
166 0.401061736 172.31.31.144 -> 172.31.24.227 TCP 66 6633 → 50448 [ACK] Seq=1 Ack=370 Win=853 Len=0 TSval=1250630 TSecr=394315902
167 0.401064345 172.31.31.144 -> 172.31.24.227 TCP 66 6633 → 50448 [ACK] Seq=1 Ack=493 Win=853 Len=0 TSval=1250630 TSecr=394315902
168 0.401071902 172.31.24.227 -> 172.31.31.144 OpenFlow 189 Type: OFPT_PACKET_IN
169 0.401096709 172.31.24.227 -> 172.31.31.144 OpenFlow 189 Type: OFPT_PACKET_IN
170 0.401117911 172.31.24.227 -> 172.31.31.144 OpenFlow 189 Type: OFPT_PACKET_IN
171 0.401121565 172.31.24.227 -> 172.31.31.144 OpenFlow 189 Type: OFPT_PACKET_IN
172 0.401138470 172.31.31.144 -> 172.31.24.227 TCP 66 6633 → 50442 [ACK] Seq=1211 Ack=862 Win=853 Len=0 TSval=1250630 TSecr=394315902
173 0.401148650 172.31.24.227 -> 172.31.31.144 OpenFlow 189 Type: OFPT_PACKET_IN
174 0.401155058 172.31.24.227 -> 172.31.31.144 OpenFlow 189 Type: OFPT_PACKET_IN
175 0.401244506 172.31.24.227 -> 172.31.31.144 OpenFlow 189 Type: OFPT_PACKET_IN
176 0.401250667 172.31.24.227 -> 172.31.31.144 OpenFlow 189 Type: OFPT_PACKET_IN
177 0.401333404 172.31.31.144 -> 172.31.24.227 TCP 66 6633 → 50442 [ACK] Seq=1211 Ack=1231 Win=853 Len=0 TSval=1250630 TSecr=394315902
178 0.401339957 172.31.31.144 -> 172.31.24.227 TCP 66 6633 → 50452 [ACK] Seq=1 Ack=124 Win=853 Len=0 TSval=1250630 TSecr=394315902
179 0.401343639 172.31.31.144 -> 172.31.24.227 TCP 66 6633 → 50450 [ACK] Seq=1 Ack=370 Win=853 Len=0 TSval=1250630 TSecr=394315902
180 0.401400797 172.31.31.144 -> 172.31.24.227 TCP 66 6633 → 50452 [ACK] Seq=1 Ack=247 Win=853 Len=0 TSval=1250630 TSecr=394315902
181 0.401490806 172.31.31.144 -> 172.31.24.227 TCP 66 6633 → 50440 [ACK] Seq=1211 Ack=862 Win=853 Len=0 TSval=1250630 TSecr=394315902
182 0.401540159 172.31.31.144 -> 172.31.24.227 TCP 66 6633 → 50450 [ACK] Seq=1 Ack=493 Win=853 Len=0 TSval=1250630 TSecr=394315902
183 0.401590234 172.31.31.144 -> 172.31.24.227 TCP 66 6633 → 50440 [ACK] Seq=1211 Ack=985 Win=853 Len=0 TSval=1250630 TSecr=394315902
184 0.401840144 172.31.31.144 -> 172.31.24.227 TCP 66 6633 → 50436 [ACK] Seq=969 Ack=739 Win=853 Len=0 TSval=1250630 TSecr=394315902
185 0.499735740 172.31.31.144 -> 172.31.24.227 OpenFlow 187 Type: OFPT_PACKET_OUT
186 0.499769739 172.31.31.144 -> 172.31.24.227 OpenFlow 187 Type: OFPT_PACKET_OUT
187 0.499797300 172.31.31.144 -> 172.31.24.227 OpenFlow 187 Type: OFPT_PACKET_OUT
188 0.499800984 172.31.31.144 -> 172.31.24.227 OpenFlow 187 Type: OFPT_PACKET_OUT
189 0.499830856 172.31.31.144 -> 172.31.24.227 OpenFlow 187 Type: OFPT_PACKET_OUT
190 0.499896653 172.31.31.144 -> 172.31.24.227 OpenFlow 187 Type: OFPT_PACKET_OUT
191 0.499938029 172.31.31.144 -> 172.31.24.227 OpenFlow 187 Type: OFPT_PACKET_OUT
192 0.499993911 172.31.31.144 -> 172.31.24.227 OpenFlow 187 Type: OFPT_PACKET_OUT
193 0.500058118 172.31.31.144 -> 172.31.24.227 OpenFlow 187 Type: OFPT_PACKET_OUT
194 0.500108533 172.31.31.144 -> 172.31.24.227 OpenFlow 187 Type: OFPT_PACKET_OUT
195 0.500173791 172.31.31.144 -> 172.31.24.227 OpenFlow 187 Type: OFPT_PACKET_OUT
196 0.500214084 172.31.31.144 -> 172.31.24.227 OpenFlow 187 Type: OFPT_PACKET_OUT
197 0.500278214 172.31.31.144 -> 172.31.24.227 OpenFlow 187 Type: OFPT_PACKET_OUT
198 0.500311170 172.31.31.144 -> 172.31.24.227 OpenFlow 187 Type: OFPT_PACKET_OUT
199 0.500375460 172.31.31.144 -> 172.31.24.227 OpenFlow 187 Type: OFPT_PACKET_OUT
200 0.500441281 172.31.31.144 -> 172.31.24.227 OpenFlow 187 Type: OFPT_PACKET_OUT
201 0.500466219 172.31.31.144 -> 172.31.24.227 OpenFlow 187 Type: OFPT_PACKET_OUT
202 0.500517812 172.31.31.144 -> 172.31.24.227 OpenFlow 187 Type: OFPT_PACKET_OUT
203 0.500682363 172.31.24.227 -> 172.31.31.144 TCP 66 50448 → 6633 [ACK] Seq=493 Ack=969 Win=213 Len=0 TSval=394315927 TSecr=1250655
204 0.500924990 172.31.24.227 -> 172.31.31.144 OpenFlow 189 Type: OFPT_PACKET_IN
205 0.500948440 172.31.24.227 -> 172.31.31.144 OpenFlow 189 Type: OFPT_PACKET_IN
206 0.501151184 172.31.31.144 -> 172.31.24.227 TCP 66 6633 → 50456 [ACK] Seq=1 Ack=124 Win=853 Len=0 TSval=1250655 TSecr=394315927
207 0.501161753 172.31.31.144 -> 172.31.24.227 TCP 66 6633 → 50456 [ACK] Seq=1 Ack=247 Win=853 Len=0 TSval=1250655 TSecr=394315927
208 0.501456243 172.31.24.227 -> 172.31.31.144 TCP 66 50450 → 6633 [ACK] Seq=493 Ack=1211 Win=213 Len=0 TSval=394315927 TSecr=1250655
209 0.501533431 172.31.24.227 -> 172.31.31.144 OpenFlow 189 Type: OFPT_PACKET_IN
210 0.501557261 172.31.24.227 -> 172.31.31.144 OpenFlow 189 Type: OFPT_PACKET_IN
211 0.501589536 172.31.24.227 -> 172.31.31.144 OpenFlow 189 Type: OFPT_PACKET_IN
212 0.501617015 172.31.24.227 -> 172.31.31.144 OpenFlow 189 Type: OFPT_PACKET_IN
213 0.501632664 172.31.24.227 -> 172.31.31.144 OpenFlow 189 Type: OFPT_PACKET_IN
214 0.501650724 172.31.24.227 -> 172.31.31.144 OpenFlow 189 Type: OFPT_PACKET_IN
215 0.501676505 172.31.24.227 -> 172.31.31.144 OpenFlow 189 Type: OFPT_PACKET_IN
216 0.501679800 172.31.24.227 -> 172.31.31.144 OpenFlow 189 Type: OFPT_PACKET_IN
217 0.501758889 172.31.31.144 -> 172.31.24.227 TCP 66 6633 → 50440 [ACK] Seq=1211 Ack=1108 Win=853 Len=0 TSval=1250655 TSecr=394315927
218 0.501789483 172.31.24.227 -> 172.31.31.144 OpenFlow 189 Type: OFPT_PACKET_IN
219 0.501797121 172.31.24.227 -> 172.31.31.144 OpenFlow 435 Type: OFPT_PACKET_IN
220 0.501904313 172.31.24.227 -> 172.31.31.144 OpenFlow 189 Type: OFPT_PACKET_IN
221 0.501908823 172.31.24.227 -> 172.31.31.144 OpenFlow 189 Type: OFPT_PACKET_IN
222 0.501924101 172.31.31.144 -> 172.31.24.227 TCP 66 6633 → 50454 [ACK] Seq=1 Ack=124 Win=853 Len=0 TSval=1250655 TSecr=394315927
223 0.501934743 172.31.31.144 -> 172.31.24.227 TCP 66 6633 → 50454 [ACK] Seq=1 Ack=247 Win=853 Len=0 TSval=1250655 TSecr=394315927
224 0.501937643 172.31.31.144 -> 172.31.24.227 TCP 66 6633 → 50440 [ACK] Seq=1211 Ack=1231 Win=853 Len=0 TSval=1250655 TSecr=394315927
225 0.501940544 172.31.31.144 -> 172.31.24.227 TCP 66 6633 → 50466 [ACK] Seq=1 Ack=124 Win=853 Len=0 TSval=1250655 TSecr=394315927
226 0.501978872 172.31.24.227 -> 172.31.31.144 OpenFlow 189 Type: OFPT_PACKET_IN
227 0.501985515 172.31.24.227 -> 172.31.31.144 OpenFlow 189 Type: OFPT_PACKET_IN
228 0.502050309 172.31.31.144 -> 172.31.24.227 TCP 66 6633 → 50466 [ACK] Seq=1 Ack=247 Win=853 Len=0 TSval=1250656 TSecr=394315927
229 0.502152443 172.31.31.144 -> 172.31.24.227 TCP 66 6633 → 50458 [ACK] Seq=1 Ack=124 Win=853 Len=0 TSval=1250656 TSecr=394315928
230 0.502159694 172.31.31.144 -> 172.31.24.227 TCP 66 6633 → 50452 [ACK] Seq=1 Ack=370 Win=853 Len=0 TSval=1250656 TSecr=394315928
231 0.502175584 172.31.31.144 -> 172.31.24.227 TCP 66 6633 → 50446 [ACK] Seq=1211 Ack=985 Win=853 Len=0 TSval=1250656 TSecr=394315927
232 0.502269291 172.31.31.144 -> 172.31.24.227 TCP 66 6633 → 50458 [ACK] Seq=1 Ack=247 Win=853 Len=0 TSval=1250656 TSecr=394315928
233 0.502272942 172.31.31.144 -> 172.31.24.227 TCP 66 6633 → 50452 [ACK] Seq=1 Ack=493 Win=853 Len=0 TSval=1250656 TSecr=394315928
234 0.502523670 172.31.31.144 -> 172.31.24.227 TCP 66 6633 → 50444 [ACK] Seq=727 Ack=739 Win=853 Len=0 TSval=1250656 TSecr=394315927
235 0.600198744 172.31.31.144 -> 172.31.24.227 OpenFlow 187 Type: OFPT_PACKET_OUT
236 0.600232405 172.31.31.144 -> 172.31.24.227 OpenFlow 187 Type: OFPT_PACKET_OUT
237 0.600239330 172.31.31.144 -> 172.31.24.227 OpenFlow 187 Type: OFPT_PACKET_OUT
238 0.600242534 172.31.31.144 -> 172.31.24.227 OpenFlow 187 Type: OFPT_PACKET_OUT
239 0.600245106 172.31.31.144 -> 172.31.24.227 OpenFlow 187 Type: OFPT_PACKET_OUT
240 0.600247398 172.31.31.144 -> 172.31.24.227 OpenFlow 187 Type: OFPT_PACKET_OUT
241 0.600249542 172.31.31.144 -> 172.31.24.227 OpenFlow 187 Type: OFPT_PACKET_OUT
242 0.600276771 172.31.31.144 -> 172.31.24.227 OpenFlow 187 Type: OFPT_PACKET_OUT
243 0.600305912 172.31.31.144 -> 172.31.24.227 OpenFlow 187 Type: OFPT_PACKET_OUT
244 0.600353498 172.31.31.144 -> 172.31.24.227 OpenFlow 187 Type: OFPT_PACKET_OUT
245 0.600411043 172.31.31.144 -> 172.31.24.227 OpenFlow 187 Type: OFPT_PACKET_OUT
246 0.600459662 172.31.31.144 -> 172.31.24.227 OpenFlow 187 Type: OFPT_PACKET_OUT
247 0.600513422 172.31.31.144 -> 172.31.24.227 OpenFlow 187 Type: OFPT_PACKET_OUT
248 0.600577920 172.31.31.144 -> 172.31.24.227 OpenFlow 187 Type: OFPT_PACKET_OUT
249 0.600613921 172.31.31.144 -> 172.31.24.227 OpenFlow 187 Type: OFPT_PACKET_OUT
250 0.600667466 172.31.31.144 -> 172.31.24.227 OpenFlow 187 Type: OFPT_PACKET_OUT
251 0.600988557 172.31.24.227 -> 172.31.31.144 TCP 66 50452 → 6633 [ACK] Seq=493 Ack=969 Win=213 Len=0 TSval=394315952 TSecr=1250680
252 0.601087574 172.31.24.227 -> 172.31.31.144 OpenFlow 189 Type: OFPT_PACKET_IN
253 0.601110741 172.31.24.227 -> 172.31.31.144 OpenFlow 189 Type: OFPT_PACKET_IN
254 0.601149179 172.31.24.227 -> 172.31.31.144 OpenFlow 189 Type: OFPT_PACKET_IN
255 0.601173057 172.31.24.227 -> 172.31.31.144 OpenFlow 189 Type: OFPT_PACKET_IN
256 0.601239481 172.31.24.227 -> 172.31.31.144 OpenFlow 189 Type: OFPT_PACKET_IN
257 0.601247793 172.31.24.227 -> 172.31.31.144 OpenFlow 189 Type: OFPT_PACKET_IN
258 0.601311544 172.31.31.144 -> 172.31.24.227 TCP 66 6633 → 50450 [ACK] Seq=1211 Ack=616 Win=853 Len=0 TSval=1250680 TSecr=394315952
259 0.601396780 172.31.31.144 -> 172.31.24.227 TCP 66 6633 → 50460 [ACK] Seq=1 Ack=124 Win=853 Len=0 TSval=1250680 TSecr=394315952
260 0.601504000 172.31.31.144 -> 172.31.24.227 TCP 66 6633 → 50450 [ACK] Seq=1211 Ack=739 Win=853 Len=0 TSval=1250680 TSecr=394315952
261 0.601511158 172.31.31.144 -> 172.31.24.227 TCP 66 6633 → 50460 [ACK] Seq=1 Ack=247 Win=853 Len=0 TSval=1250680 TSecr=394315952
262 0.601576326 172.31.31.144 -> 172.31.24.227 TCP 66 6633 → 50454 [ACK] Seq=969 Ack=493 Win=853 Len=0 TSval=1250680 TSecr=394315952
263 0.601750787 172.31.24.227 -> 172.31.31.144 OpenFlow 189 Type: OFPT_PACKET_IN
264 0.601774296 172.31.24.227 -> 172.31.31.144 OpenFlow 189 Type: OFPT_PACKET_IN
265 0.601806566 172.31.24.227 -> 172.31.31.144 OpenFlow 189 Type: OFPT_PACKET_IN
266 0.601829477 172.31.24.227 -> 172.31.31.144 OpenFlow 189 Type: OFPT_PACKET_IN
267 0.601839327 172.31.24.227 -> 172.31.31.144 OpenFlow 189 Type: OFPT_PACKET_IN
268 0.601896718 172.31.24.227 -> 172.31.31.144 OpenFlow 189 Type: OFPT_PACKET_IN
269 0.601975968 172.31.31.144 -> 172.31.24.227 TCP 66 6633 → 50446 [ACK] Seq=1211 Ack=1108 Win=853 Len=0 TSval=1250680 TSecr=394315953
270 0.602061890 172.31.24.227 -> 172.31.31.144 OpenFlow 189 Type: OFPT_PACKET_IN
271 0.602080443 172.31.31.144 -> 172.31.24.227 TCP 66 6633 → 50462 [ACK] Seq=1 Ack=247 Win=853 Len=0 TSval=1250681 TSecr=394315953
272 0.602088772 172.31.24.227 -> 172.31.31.144 OpenFlow 189 Type: OFPT_PACKET_IN
273 0.602111139 172.31.24.227 -> 172.31.31.144 OpenFlow 189 Type: OFPT_PACKET_IN
274 0.602140515 172.31.24.227 -> 172.31.31.144 OpenFlow 189 Type: OFPT_PACKET_IN
275 0.602269516 172.31.31.144 -> 172.31.24.227 TCP 66 6633 → 50446 [ACK] Seq=1211 Ack=1231 Win=853 Len=0 TSval=1250681 TSecr=394315953
276 0.602276070 172.31.31.144 -> 172.31.24.227 TCP 66 6633 → 50456 [ACK] Seq=1 Ack=370 Win=853 Len=0 TSval=1250681 TSecr=394315953
277 0.602278932 172.31.31.144 -> 172.31.24.227 TCP 66 6633 → 50456 [ACK] Seq=1 Ack=493 Win=853 Len=0 TSval=1250681 TSecr=394315953
278 0.602374862 172.31.31.144 -> 172.31.24.227 TCP 66 6633 → 50452 [ACK] Seq=969 Ack=616 Win=853 Len=0 TSval=1250681 TSecr=394315953
279 0.602381022 172.31.31.144 -> 172.31.24.227 TCP 66 6633 → 50452 [ACK] Seq=969 Ack=739 Win=853 Len=0 TSval=1250681 TSecr=394315953
280 0.602383554 172.31.31.144 -> 172.31.24.227 TCP 66 6633 → 50448 [ACK] Seq=969 Ack=739 Win=853 Len=0 TSval=1250681 TSecr=394315953
281 0.647452938 172.31.24.227 -> 172.31.31.144 OpenFlow 146 Type: OFPT_PORT_STATUS
282 0.647552006 172.31.24.227 -> 172.31.31.144 OpenFlow 146 Type: OFPT_PORT_STATUS
283 0.647765532 172.31.31.144 -> 172.31.24.227 TCP 66 6633 → 50472 [ACK] Seq=1 Ack=81 Win=853 Len=0 TSval=1250692 TSecr=394315964
284 0.672285152 172.31.31.144 -> 172.31.24.227 OpenFlow 146 Type: OFPT_FLOW_MOD
285 0.672307766 172.31.31.144 -> 172.31.24.227 OpenFlow 154 Type: OFPT_BARRIER_REQUEST
286 0.672312676 172.31.31.144 -> 172.31.24.227 TCP 146 6633 → 50474 [PSH, ACK] Seq=1 Ack=1 Win=853 Len=80 TSval=1250698 TSecr=394315352
287 0.672331072 172.31.31.144 -> 172.31.24.227 TCP 154 6633 → 50474 [PSH, ACK] Seq=81 Ack=1 Win=853 Len=88 TSval=1250698 TSecr=394315352
288 0.672354258 172.31.31.144 -> 172.31.24.227 OpenFlow 146 Type: OFPT_FLOW_MOD
289 0.672362016 172.31.31.144 -> 172.31.24.227 OpenFlow 146 Type: OFPT_FLOW_MOD
290 0.672364632 172.31.31.144 -> 172.31.24.227 OpenFlow 74 Type: OFPT_BARRIER_REQUEST
291 0.672440178 172.31.31.144 -> 172.31.24.227 TCP 146 6633 → 50470 [PSH, ACK] Seq=1 Ack=1 Win=853 Len=80 TSval=1250698 TSecr=394315327
292 0.672446630 172.31.31.144 -> 172.31.24.227 TCP 146 6633 → 50470 [PSH, ACK] Seq=81 Ack=1 Win=853 Len=80 TSval=1250698 TSecr=394315327
293 0.672449627 172.31.31.144 -> 172.31.24.227 TCP 74 6633 → 50470 [PSH, ACK] Seq=161 Ack=1 Win=853 Len=8 TSval=1250698 TSecr=394315327
294 0.672542134 172.31.31.144 -> 172.31.24.227 OpenFlow 146 Type: OFPT_FLOW_MOD
295 0.672548875 172.31.31.144 -> 172.31.24.227 OpenFlow 146 Type: OFPT_FLOW_MOD
296 0.672551850 172.31.31.144 -> 172.31.24.227 OpenFlow 74 Type: OFPT_BARRIER_REQUEST
297 0.672637939 172.31.31.144 -> 172.31.24.227 OpenFlow 146 Type: OFPT_FLOW_MOD
298 0.672643537 172.31.31.144 -> 172.31.24.227 OpenFlow 154 Type: OFPT_BARRIER_REQUEST
299 0.672709876 172.31.24.227 -> 172.31.31.144 TCP 66 50462 → 6633 [ACK] Seq=327 Ack=169 Win=213 Len=0 TSval=394315970 TSecr=1250698
300 0.672726195 172.31.24.227 -> 172.31.31.144 OpenFlow 74 Type: OFPT_BARRIER_REPLY
301 0.672734726 172.31.31.144 -> 172.31.24.227 OpenFlow 146 Type: OFPT_FLOW_MOD
302 0.672739205 172.31.31.144 -> 172.31.24.227 OpenFlow 146 Type: OFPT_FLOW_MOD
303 0.672773504 172.31.24.227 -> 172.31.31.144 TCP 66 50448 → 6633 [ACK] Seq=739 Ack=1137 Win=213 Len=0 TSval=394315970 TSecr=1250698
304 0.672784836 172.31.24.227 -> 172.31.31.144 OpenFlow 74 Type: OFPT_BARRIER_REPLY
305 0.672823956 172.31.24.227 -> 172.31.31.144 TCP 66 50474 → 6633 [ACK] Seq=1 Ack=169 Win=213 Len=0 TSval=394315970 TSecr=1250698
306 0.672831271 172.31.24.227 -> 172.31.31.144 OpenFlow 74 Type: OFPT_BARRIER_REPLY
307 0.672856463 172.31.31.144 -> 172.31.24.227 OpenFlow 74 Type: OFPT_BARRIER_REQUEST
308 0.672861441 172.31.31.144 -> 172.31.24.227 OpenFlow 146 Type: OFPT_FLOW_MOD
309 0.672864175 172.31.31.144 -> 172.31.24.227 OpenFlow 146 Type: OFPT_FLOW_MOD
310 0.672866117 172.31.31.144 -> 172.31.24.227 OpenFlow 74 Type: OFPT_BARRIER_REQUEST
311 0.672884693 172.31.24.227 -> 172.31.31.144 OpenFlow 74 Type: OFPT_BARRIER_REPLY
312 0.672940236 172.31.24.227 -> 172.31.31.144 TCP 66 50470 → 6633 [ACK] Seq=1 Ack=169 Win=213 Len=0 TSval=394315970 TSecr=1250698
313 0.672947069 172.31.24.227 -> 172.31.31.144 OpenFlow 74 Type: OFPT_BARRIER_REPLY
314 0.673060860 172.31.31.144 -> 172.31.24.227 OpenFlow 146 Type: OFPT_FLOW_MOD
315 0.673068397 172.31.31.144 -> 172.31.24.227 OpenFlow 146 Type: OFPT_FLOW_MOD
316 0.673070814 172.31.31.144 -> 172.31.24.227 OpenFlow 74 Type: OFPT_BARRIER_REQUEST
317 0.673072877 172.31.31.144 -> 172.31.24.227 OpenFlow 146 Type: OFPT_FLOW_MOD
318 0.673084606 172.31.31.144 -> 172.31.24.227 OpenFlow 154 Type: OFPT_BARRIER_REQUEST
319 0.673110540 172.31.24.227 -> 172.31.31.144 OpenFlow 74 Type: OFPT_BARRIER_REPLY
320 0.673211472 172.31.24.227 -> 172.31.31.144 OpenFlow 146 Type: OFPT_FLOW_REMOVED
321 0.673231074 172.31.24.227 -> 172.31.31.144 OpenFlow 146 Type: OFPT_FLOW_REMOVED
322 0.673238545 172.31.31.144 -> 172.31.24.227 TCP 66 6633 → 50448 [ACK] Seq=1137 Ack=747 Win=853 Len=0 TSval=1250698 TSecr=394315970
323 0.673242080 172.31.31.144 -> 172.31.24.227 OpenFlow 146 Type: OFPT_FLOW_MOD
324 0.673246879 172.31.31.144 -> 172.31.24.227 OpenFlow 146 Type: OFPT_FLOW_MOD
325 0.673249696 172.31.31.144 -> 172.31.24.227 OpenFlow 74 Type: OFPT_BARRIER_REQUEST
326 0.673268429 172.31.24.227 -> 172.31.31.144 OpenFlow 146 Type: OFPT_FLOW_REMOVED
327 0.673272065 172.31.24.227 -> 172.31.31.144 OpenFlow 146 Type: OFPT_FLOW_REMOVED
328 0.673283101 172.31.24.227 -> 172.31.31.144 OpenFlow 146 Type: OFPT_FLOW_REMOVED
329 0.673305227 172.31.24.227 -> 172.31.31.144 OpenFlow 146 Type: OFPT_FLOW_REMOVED
330 0.673308541 172.31.24.227 -> 172.31.31.144 OpenFlow 146 Type: OFPT_FLOW_REMOVED
331 0.673409627 172.31.31.144 -> 172.31.24.227 TCP 66 6633 → 50470 [ACK] Seq=337 Ack=9 Win=853 Len=0 TSval=1250698 TSecr=394315970
332 0.673418002 172.31.24.227 -> 172.31.31.144 OpenFlow 146 Type: OFPT_FLOW_REMOVED
333 0.673423922 172.31.31.144 -> 172.31.24.227 TCP 66 6633 → 50472 [ACK] Seq=337 Ack=97 Win=853 Len=0 TSval=1250698 TSecr=394315970
334 0.673428350 172.31.24.227 -> 172.31.31.144 OpenFlow 306 Type: OFPT_FLOW_REMOVED
335 0.673433631 172.31.24.227 -> 172.31.31.144 OpenFlow 146 Type: OFPT_FLOW_REMOVED
336 0.673539305 172.31.31.144 -> 172.31.24.227 TCP 66 6633 → 50462 [ACK] Seq=337 Ack=415 Win=853 Len=0 TSval=1250698 TSecr=394315970
337 0.673544980 172.31.31.144 -> 172.31.24.227 TCP 66 6633 → 50474 [ACK] Seq=169 Ack=89 Win=853 Len=0 TSval=1250698 TSecr=394315970
338 0.673713292 172.31.31.144 -> 172.31.24.227 OpenFlow 170 Type: OFPT_FLOW_MOD
339 0.673718966 172.31.31.144 -> 172.31.24.227 TCP 66 6633 → 50470 [ACK] Seq=337 Ack=89 Win=853 Len=0 TSval=1250698 TSecr=394315970
340 0.673722341 172.31.31.144 -> 172.31.24.227 OpenFlow 178 Type: OFPT_BARRIER_REQUEST
341 0.673724664 172.31.31.144 -> 172.31.24.227 TCP 66 6633 → 50470 [ACK] Seq=337 Ack=169 Win=853 Len=0 TSval=1250698 TSecr=394315970
342 0.673927779 172.31.31.144 -> 172.31.24.227 OpenFlow 170 Type: OFPT_FLOW_MOD
343 0.673933638 172.31.31.144 -> 172.31.24.227 OpenFlow 178 Type: OFPT_BARRIER_REQUEST
344 0.673936073 172.31.31.144 -> 172.31.24.227 OpenFlow 170 Type: OFPT_FLOW_MOD
345 0.673939825 172.31.31.144 -> 172.31.24.227 OpenFlow 178 Type: OFPT_BARRIER_REQUEST
346 0.673941973 172.31.31.144 -> 172.31.24.227 TCP 66 6633 → 50448 [ACK] Seq=1137 Ack=907 Win=853 Len=0 TSval=1250698 TSecr=394315970
347 0.674106193 172.31.31.144 -> 172.31.24.227 OpenFlow 170 Type: OFPT_FLOW_MOD
348 0.674175389 172.31.31.144 -> 172.31.24.227 OpenFlow 170 Type: OFPT_FLOW_MOD
349 0.674254941 172.31.31.144 -> 172.31.24.227 OpenFlow 170 Type: OFPT_FLOW_MOD
350 0.674466553 172.31.31.144 -> 172.31.24.227 OpenFlow 170 Type: OFPT_FLOW_MOD
351 0.675851455 172.31.24.227 -> 172.31.31.144 TCP 66 50436 → 6633 [ACK] Seq=739 Ack=1137 Win=213 Len=0 TSval=394315971 TSecr=1250698
352 0.675867741 172.31.24.227 -> 172.31.31.144 OpenFlow 74 Type: OFPT_BARRIER_REPLY
353 0.675932430 172.31.24.227 -> 172.31.31.144 TCP 66 50454 → 6633 [ACK] Seq=493 Ack=1137 Win=213 Len=0 TSval=394315971 TSecr=1250698
354 0.675943119 172.31.24.227 -> 172.31.31.144 OpenFlow 74 Type: OFPT_BARRIER_REPLY
355 0.675991375 172.31.24.227 -> 172.31.31.144 TCP 66 50444 → 6633 [ACK] Seq=739 Ack=895 Win=213 Len=0 TSval=394315971 TSecr=1250698
356 0.676001385 172.31.24.227 -> 172.31.31.144 OpenFlow 74 Type: OFPT_BARRIER_REPLY
357 0.676044617 172.31.24.227 -> 172.31.31.144 OpenFlow 74 Type: OFPT_BARRIER_REPLY
358 0.676081969 172.31.31.144 -> 172.31.24.227 TCP 66 6633 → 50436 [ACK] Seq=1137 Ack=747 Win=853 Len=0 TSval=1250699 TSecr=394315971
359 0.676119583 172.31.24.227 -> 172.31.31.144 OpenFlow 74 Type: OFPT_BARRIER_REPLY
360 0.676152896 172.31.31.144 -> 172.31.24.227 TCP 66 6633 → 50454 [ACK] Seq=1137 Ack=501 Win=853 Len=0 TSval=1250699 TSecr=394315971
361 0.676182352 172.31.24.227 -> 172.31.31.144 OpenFlow 74 Type: OFPT_BARRIER_REPLY
362 0.676204283 172.31.31.144 -> 172.31.24.227 TCP 66 6633 → 50444 [ACK] Seq=895 Ack=747 Win=853 Len=0 TSval=1250699 TSecr=394315971
363 0.676243110 172.31.24.227 -> 172.31.31.144 OpenFlow 74 Type: OFPT_BARRIER_REPLY
364 0.676252849 172.31.31.144 -> 172.31.24.227 TCP 66 6633 → 50462 [ACK] Seq=337 Ack=503 Win=853 Len=0 TSval=1250699 TSecr=394315970
365 0.676284576 172.31.24.227 -> 172.31.31.144 OpenFlow 74 Type: OFPT_BARRIER_REPLY
366 0.676475038 172.31.31.144 -> 172.31.24.227 TCP 66 6633 → 50470 [ACK] Seq=761 Ack=185 Win=853 Len=0 TSval=1250699 TSecr=394315971
367 0.676484506 172.31.24.227 -> 172.31.31.144 OpenFlow 146 Type: OFPT_FLOW_REMOVED
368 0.676505507 172.31.24.227 -> 172.31.31.144 OpenFlow 146 Type: OFPT_FLOW_REMOVED
369 0.676516637 172.31.24.227 -> 172.31.31.144 OpenFlow 146 Type: OFPT_FLOW_REMOVED
370 0.676526227 172.31.24.227 -> 172.31.31.144 OpenFlow 146 Type: OFPT_FLOW_REMOVED
371 0.676539319 172.31.24.227 -> 172.31.31.144 OpenFlow 146 Type: OFPT_FLOW_REMOVED
372 0.676552242 172.31.24.227 -> 172.31.31.144 OpenFlow 146 Type: OFPT_FLOW_REMOVED
373 0.676615152 172.31.24.227 -> 172.31.31.144 OpenFlow 146 Type: OFPT_FLOW_REMOVED
374 0.676622091 172.31.24.227 -> 172.31.31.144 OpenFlow 146 Type: OFPT_FLOW_REMOVED
375 0.676624590 172.31.24.227 -> 172.31.31.144 OpenFlow 146 Type: OFPT_FLOW_REMOVED
376 0.676852504 172.31.31.144 -> 172.31.24.227 OpenFlow 170 Type: OFPT_FLOW_MOD
377 0.676858927 172.31.31.144 -> 172.31.24.227 TCP 66 6633 → 50436 [ACK] Seq=1137 Ack=827 Win=853 Len=0 TSval=1250699 TSecr=394315971
378 0.676863023 172.31.31.144 -> 172.31.24.227 OpenFlow 170 Type: OFPT_FLOW_MOD
379 0.676865587 172.31.31.144 -> 172.31.24.227 OpenFlow 74 Type: OFPT_BARRIER_REQUEST
380 0.676868539 172.31.31.144 -> 172.31.24.227 TCP 66 6633 → 50436 [ACK] Seq=1137 Ack=907 Win=853 Len=0 TSval=1250699 TSecr=394315971
381 0.676871538 172.31.31.144 -> 172.31.24.227 OpenFlow 170 Type: OFPT_FLOW_MOD
382 0.676879220 172.31.31.144 -> 172.31.24.227 OpenFlow 178 Type: OFPT_BARRIER_REQUEST
383 0.676881695 172.31.31.144 -> 172.31.24.227 OpenFlow 170 Type: OFPT_FLOW_MOD
384 0.676885045 172.31.31.144 -> 172.31.24.227 OpenFlow 178 Type: OFPT_BARRIER_REQUEST
385 0.676893249 172.31.24.227 -> 172.31.31.144 OpenFlow 146 Type: OFPT_FLOW_REMOVED
386 0.677047883 172.31.31.144 -> 172.31.24.227 OpenFlow 170 Type: OFPT_FLOW_MOD
387 0.677053292 172.31.31.144 -> 172.31.24.227 OpenFlow 178 Type: OFPT_BARRIER_REQUEST
388 0.677316263 172.31.31.144 -> 172.31.24.227 OpenFlow 170 Type: OFPT_FLOW_MOD
389 0.677325319 172.31.31.144 -> 172.31.24.227 OpenFlow 170 Type: OFPT_FLOW_MOD
390 0.677330825 172.31.31.144 -> 172.31.24.227 OpenFlow 282 Type: OFPT_FLOW_MOD
391 0.677334025 172.31.31.144 -> 172.31.24.227 OpenFlow 170 Type: OFPT_FLOW_MOD
392 0.677338284 172.31.31.144 -> 172.31.24.227 OpenFlow 178 Type: OFPT_BARRIER_REQUEST
393 0.677341337 172.31.31.144 -> 172.31.24.227 OpenFlow 170 Type: OFPT_FLOW_MOD
394 0.677344519 172.31.31.144 -> 172.31.24.227 TCP 66 6633 → 50462 [ACK] Seq=337 Ack=663 Win=853 Len=0 TSval=1250699 TSecr=394315971
395 0.677347833 172.31.31.144 -> 172.31.24.227 OpenFlow 170 Type: OFPT_FLOW_MOD
396 0.677350271 172.31.31.144 -> 172.31.24.227 OpenFlow 74 Type: OFPT_BARRIER_REQUEST
397 0.677352195 172.31.31.144 -> 172.31.24.227 OpenFlow 170 Type: OFPT_FLOW_MOD
398 0.677353959 172.31.31.144 -> 172.31.24.227 TCP 66 6633 → 50454 [ACK] Seq=1137 Ack=661 Win=853 Len=0 TSval=1250699 TSecr=394315971
399 0.677439382 172.31.31.144 -> 172.31.24.227 OpenFlow 170 Type: OFPT_FLOW_MOD
400 0.678360433 172.31.24.227 -> 172.31.31.144 TCP 66 50452 → 6633 [ACK] Seq=739 Ack=1185 Win=213 Len=0 TSval=394315972 TSecr=1250699
401 0.678375446 172.31.24.227 -> 172.31.31.144 OpenFlow 74 Type: OFPT_BARRIER_REPLY
402 0.678423581 172.31.24.227 -> 172.31.31.144 OpenFlow 74 Type: OFPT_BARRIER_REPLY
403 0.678492593 172.31.24.227 -> 172.31.31.144 TCP 66 50460 → 6633 [ACK] Seq=247 Ack=217 Win=213 Len=0 TSval=394315972 TSecr=1250699
404 0.678504157 172.31.24.227 -> 172.31.31.144 OpenFlow 74 Type: OFPT_BARRIER_REPLY
405 0.678557642 172.31.24.227 -> 172.31.31.144 TCP 66 50446 → 6633 [ACK] Seq=1231 Ack=1427 Win=213 Len=0 TSval=394315972 TSecr=1250699
406 0.678567933 172.31.24.227 -> 172.31.31.144 OpenFlow 74 Type: OFPT_BARRIER_REPLY
407 0.678591398 172.31.31.144 -> 172.31.24.227 TCP 66 6633 → 50452 [ACK] Seq=1185 Ack=747 Win=853 Len=0 TSval=1250700 TSecr=394315972
408 0.678621506 172.31.24.227 -> 172.31.31.144 OpenFlow 74 Type: OFPT_BARRIER_REPLY
409 0.678685067 172.31.24.227 -> 172.31.31.144 TCP 66 50448 → 6633 [ACK] Seq=907 Ack=1353 Win=213 Len=0 TSval=394315972 TSecr=1250699
410 0.678700609 172.31.31.144 -> 172.31.24.227 TCP 66 6633 → 50460 [ACK] Seq=217 Ack=255 Win=853 Len=0 TSval=1250700 TSecr=394315972
411 0.678708178 172.31.24.227 -> 172.31.31.144 OpenFlow 74 Type: OFPT_BARRIER_REPLY
412 0.678770131 172.31.24.227 -> 172.31.31.144 OpenFlow 74 Type: OFPT_BARRIER_REPLY
413 0.678807644 172.31.31.144 -> 172.31.24.227 TCP 66 6633 → 50446 [ACK] Seq=1427 Ack=1239 Win=853 Len=0 TSval=1250700 TSecr=394315972
414 0.699060933 172.31.31.144 -> 172.31.24.227 OpenFlow 187 Type: OFPT_PACKET_OUT
415 0.699072464 172.31.31.144 -> 172.31.24.227 OpenFlow 187 Type: OFPT_PACKET_OUT
416 0.699076510 172.31.31.144 -> 172.31.24.227 OpenFlow 187 Type: OFPT_PACKET_OUT
417 0.699079082 172.31.31.144 -> 172.31.24.227 OpenFlow 187 Type: OFPT_PACKET_OUT
418 0.699116367 172.31.31.144 -> 172.31.24.227 OpenFlow 187 Type: OFPT_PACKET_OUT
419 0.699179114 172.31.31.144 -> 172.31.24.227 OpenFlow 187 Type: OFPT_PACKET_OUT
420 0.699247932 172.31.31.144 -> 172.31.24.227 OpenFlow 187 Type: OFPT_PACKET_OUT
421 0.699255496 172.31.31.144 -> 172.31.24.227 OpenFlow 187 Type: OFPT_PACKET_OUT
422 0.699316947 172.31.31.144 -> 172.31.24.227 OpenFlow 187 Type: OFPT_PACKET_OUT
423 0.699417029 172.31.31.144 -> 172.31.24.227 OpenFlow 187 Type: OFPT_PACKET_OUT
424 0.699423928 172.31.31.144 -> 172.31.24.227 OpenFlow 187 Type: OFPT_PACKET_OUT
425 0.699458624 172.31.31.144 -> 172.31.24.227 OpenFlow 187 Type: OFPT_PACKET_OUT
426 0.699597798 172.31.24.227 -> 172.31.31.144 TCP 66 50456 → 6633 [ACK] Seq=493 Ack=727 Win=213 Len=0 TSval=394315977 TSecr=1250705
427 0.699715336 172.31.24.227 -> 172.31.31.144 OpenFlow 189 Type: OFPT_PACKET_IN
428 0.699734998 172.31.24.227 -> 172.31.31.144 OpenFlow 189 Type: OFPT_PACKET_IN
429 0.699775588 172.31.24.227 -> 172.31.31.144 OpenFlow 189 Type: OFPT_PACKET_IN
430 0.699790053 172.31.24.227 -> 172.31.31.144 OpenFlow 189 Type: OFPT_PACKET_IN
431 0.699830498 172.31.24.227 -> 172.31.31.144 OpenFlow 189 Type: OFPT_PACKET_IN
432 0.699844166 172.31.24.227 -> 172.31.31.144 OpenFlow 189 Type: OFPT_PACKET_IN
433 0.699953172 172.31.31.144 -> 172.31.24.227 TCP 66 6633 → 50454 [ACK] Seq=1137 Ack=907 Win=853 Len=0 TSval=1250705 TSecr=394315977
434 0.699960742 172.31.31.144 -> 172.31.24.227 TCP 66 6633 → 50448 [ACK] Seq=1353 Ack=1038 Win=853 Len=0 TSval=1250705 TSecr=394315972
435 0.700129726 172.31.24.227 -> 172.31.31.144 TCP 66 50458 → 6633 [ACK] Seq=247 Ack=727 Win=213 Len=0 TSval=394315977 TSecr=1250705
436 0.700292361 172.31.24.227 -> 172.31.31.144 OpenFlow 189 Type: OFPT_PACKET_IN
437 0.700312902 172.31.24.227 -> 172.31.31.144 OpenFlow 189 Type: OFPT_PACKET_IN
438 0.700366241 172.31.24.227 -> 172.31.31.144 OpenFlow 189 Type: OFPT_PACKET_IN
439 0.700401211 172.31.24.227 -> 172.31.31.144 OpenFlow 189 Type: OFPT_PACKET_IN
440 0.700424494 172.31.24.227 -> 172.31.31.144 OpenFlow 189 Type: OFPT_PACKET_IN
441 0.700514476 172.31.24.227 -> 172.31.31.144 OpenFlow 189 Type: OFPT_PACKET_IN
442 0.700544162 172.31.31.144 -> 172.31.24.227 TCP 66 6633 → 50468 [ACK] Seq=1 Ack=124 Win=853 Len=0 TSval=1250705 TSecr=394315977
443 0.700550716 172.31.31.144 -> 172.31.24.227 TCP 66 6633 → 50468 [ACK] Seq=1 Ack=247 Win=853 Len=0 TSval=1250705 TSecr=394315977
444 0.700711326 172.31.31.144 -> 172.31.24.227 TCP 66 6633 → 50460 [ACK] Seq=217 Ack=378 Win=853 Len=0 TSval=1250705 TSecr=394315977
445 0.700717704 172.31.31.144 -> 172.31.24.227 TCP 66 6633 → 50460 [ACK] Seq=217 Ack=501 Win=853 Len=0 TSval=1250705 TSecr=394315977
446 0.700783310 172.31.31.144 -> 172.31.24.227 TCP 66 6633 → 50450 [ACK] Seq=1211 Ack=985 Win=853 Len=0 TSval=1250705 TSecr=394315977
447 0.700897864 172.31.31.144 -> 172.31.24.227 TCP 66 6633 → 50464 [ACK] Seq=1 Ack=247 Win=853 Len=0 TSval=1250705 TSecr=394315977
448 0.714060864 172.31.31.144 -> 172.31.24.227 TCP 66 6633 → 50472 [ACK] Seq=657 Ack=425 Win=853 Len=0 TSval=1250709 TSecr=394315971
449 0.714068256 172.31.31.144 -> 172.31.24.227 TCP 66 6633 → 50474 [ACK] Seq=489 Ack=177 Win=853 Len=0 TSval=1250709 TSecr=394315971
450 0.718095094 172.31.31.144 -> 172.31.24.227 TCP 66 6633 → 50444 [ACK] Seq=1319 Ack=915 Win=853 Len=0 TSval=1250710 TSecr=394315972
451 0.718098909 172.31.31.144 -> 172.31.24.227 TCP 66 6633 → 50436 [ACK] Seq=1457 Ack=915 Win=853 Len=0 TSval=1250710 TSecr=394315972
452 0.718101307 172.31.31.144 -> 172.31.24.227 TCP 66 6633 → 50470 [ACK] Seq=1081 Ack=353 Win=853 Len=0 TSval=1250710 TSecr=394315972
453 0.738117600 172.31.31.144 -> 172.31.24.227 TCP 66 6633 → 50448 [ACK] Seq=1353 Ack=1161 Win=853 Len=0 TSval=1250715 TSecr=394315977
454 0.799856108 172.31.31.144 -> 172.31.24.227 OpenFlow 187 Type: OFPT_PACKET_OUT
455 0.799888153 172.31.31.144 -> 172.31.24.227 OpenFlow 187 Type: OFPT_PACKET_OUT
456 0.799910751 172.31.31.144 -> 172.31.24.227 OpenFlow 187 Type: OFPT_PACKET_OUT
457 0.799916361 172.31.31.144 -> 172.31.24.227 OpenFlow 187 Type: OFPT_PACKET_OUT
458 0.799999147 172.31.31.144 -> 172.31.24.227 OpenFlow 187 Type: OFPT_PACKET_OUT
459 0.800004280 172.31.31.144 -> 172.31.24.227 OpenFlow 187 Type: OFPT_PACKET_OUT
460 0.800049178 172.31.31.144 -> 172.31.24.227 OpenFlow 187 Type: OFPT_PACKET_OUT
461 0.800098867 172.31.31.144 -> 172.31.24.227 OpenFlow 187 Type: OFPT_PACKET_OUT
462 0.800171412 172.31.31.144 -> 172.31.24.227 OpenFlow 187 Type: OFPT_PACKET_OUT
463 0.800212747 172.31.31.144 -> 172.31.24.227 OpenFlow 187 Type: OFPT_PACKET_OUT
464 0.800268339 172.31.31.144 -> 172.31.24.227 OpenFlow 187 Type: OFPT_PACKET_OUT
465 0.800316455 172.31.31.144 -> 172.31.24.227 OpenFlow 187 Type: OFPT_PACKET_OUT
466 0.800391452 172.31.31.144 -> 172.31.24.227 OpenFlow 187 Type: OFPT_PACKET_OUT
467 0.800436747 172.31.31.144 -> 172.31.24.227 OpenFlow 187 Type: OFPT_PACKET_OUT
468 0.800478263 172.31.31.144 -> 172.31.24.227 OpenFlow 187 Type: OFPT_PACKET_OUT
469 0.800535074 172.31.31.144 -> 172.31.24.227 OpenFlow 187 Type: OFPT_PACKET_OUT
470 0.800594673 172.31.31.144 -> 172.31.24.227 OpenFlow 187 Type: OFPT_PACKET_OUT
471 0.800644860 172.31.31.144 -> 172.31.24.227 OpenFlow 187 Type: OFPT_PACKET_OUT
472 0.800837629 172.31.24.227 -> 172.31.31.144 TCP 66 50460 → 6633 [ACK] Seq=501 Ack=1427 Win=213 Len=0 TSval=394316002 TSecr=1250730
473 0.800950372 172.31.24.227 -> 172.31.31.144 OpenFlow 189 Type: OFPT_PACKET_IN
474 0.800971038 172.31.24.227 -> 172.31.31.144 OpenFlow 189 Type: OFPT_PACKET_IN
475 0.801159975 172.31.31.144 -> 172.31.24.227 TCP 66 6633 → 50462 [ACK] Seq=1305 Ack=909 Win=853 Len=0 TSval=1250730 TSecr=394316002
476 0.801410820 172.31.24.227 -> 172.31.31.144 OpenFlow 189 Type: OFPT_PACKET_IN
477 0.801430954 172.31.24.227 -> 172.31.31.144 OpenFlow 189 Type: OFPT_PACKET_IN
478 0.801449515 172.31.24.227 -> 172.31.31.144 OpenFlow 189 Type: OFPT_PACKET_IN
479 0.801472919 172.31.24.227 -> 172.31.31.144 OpenFlow 189 Type: OFPT_PACKET_IN
480 0.801509293 172.31.24.227 -> 172.31.31.144 OpenFlow 189 Type: OFPT_PACKET_IN
481 0.801512265 172.31.24.227 -> 172.31.31.144 OpenFlow 189 Type: OFPT_PACKET_IN
482 0.801530019 172.31.24.227 -> 172.31.31.144 OpenFlow 189 Type: OFPT_PACKET_IN
483 0.801536331 172.31.24.227 -> 172.31.31.144 OpenFlow 189 Type: OFPT_PACKET_IN
484 0.801636781 172.31.31.144 -> 172.31.24.227 TCP 66 6633 → 50474 [ACK] Seq=489 Ack=300 Win=853 Len=0 TSval=1250730 TSecr=394316002
485 0.801644414 172.31.31.144 -> 172.31.24.227 TCP 66 6633 → 50474 [ACK] Seq=489 Ack=423 Win=853 Len=0 TSval=1250730 TSecr=394316002
486 0.801664186 172.31.24.227 -> 172.31.31.144 OpenFlow 189 Type: OFPT_PACKET_IN
487 0.801671444 172.31.24.227 -> 172.31.31.144 OpenFlow 189 Type: OFPT_PACKET_IN
488 0.801716473 172.31.24.227 -> 172.31.31.144 OpenFlow 189 Type: OFPT_PACKET_IN
489 0.801763140 172.31.24.227 -> 172.31.31.144 OpenFlow 189 Type: OFPT_PACKET_IN
490 0.801780565 172.31.24.227 -> 172.31.31.144 OpenFlow 189 Type: OFPT_PACKET_IN
491 0.801792333 172.31.31.144 -> 172.31.24.227 TCP 66 6633 → 50472 [ACK] Seq=657 Ack=548 Win=853 Len=0 TSval=1250730 TSecr=394316002
492 0.801899393 172.31.24.227 -> 172.31.31.144 OpenFlow 189 Type: OFPT_PACKET_IN
493 0.802041519 172.31.24.227 -> 172.31.31.144 OpenFlow 189 Type: OFPT_PACKET_IN
494 0.802045529 172.31.24.227 -> 172.31.31.144 OpenFlow 189 Type: OFPT_PACKET_IN
495 0.802074757 172.31.31.144 -> 172.31.24.227 TCP 66 6633 → 50458 [ACK] Seq=727 Ack=370 Win=853 Len=0 TSval=1250730 TSecr=394316002
496 0.802079988 172.31.31.144 -> 172.31.24.227 TCP 66 6633 → 50472 [ACK] Seq=657 Ack=671 Win=853 Len=0 TSval=1250730 TSecr=394316002
497 0.802082998 172.31.31.144 -> 172.31.24.227 TCP 66 6633 → 50470 [ACK] Seq=1081 Ack=599 Win=853 Len=0 TSval=1250730 TSecr=394316002
498 0.802085677 172.31.31.144 -> 172.31.24.227 TCP 66 6633 → 50464 [ACK] Seq=1 Ack=493 Win=853 Len=0 TSval=1250731 TSecr=394316002
499 0.802088357 172.31.31.144 -> 172.31.24.227 TCP 66 6633 → 50458 [ACK] Seq=727 Ack=493 Win=853 Len=0 TSval=1250731 TSecr=394316002
500 0.802166320 172.31.31.144 -> 172.31.24.227 TCP 66 6633 → 50452 [ACK] Seq=1185 Ack=870 Win=853 Len=0 TSval=1250731 TSecr=394316002
501 0.802264123 172.31.31.144 -> 172.31.24.227 TCP 66 6633 → 50460 [ACK] Seq=1427 Ack=624 Win=853 Len=0 TSval=1250731 TSecr=394316003
502 0.802363055 172.31.31.144 -> 172.31.24.227 TCP 66 6633 → 50452 [ACK] Seq=1185 Ack=993 Win=853 Len=0 TSval=1250731 TSecr=394316003
503 0.802426467 172.31.31.144 -> 172.31.24.227 TCP 66 6633 → 50460 [ACK] Seq=1427 Ack=747 Win=853 Len=0 TSval=1250731 TSecr=394316003
504 0.802582475 172.31.31.144 -> 172.31.24.227 TCP 66 6633 → 50454 [ACK] Seq=1137 Ack=1153 Win=853 Len=0 TSval=1250731 TSecr=394316003
505 0.899042794 172.31.31.144 -> 172.31.24.227 OpenFlow 187 Type: OFPT_PACKET_OUT
506 0.899054501 172.31.31.144 -> 172.31.24.227 OpenFlow 187 Type: OFPT_PACKET_OUT
507 0.899058137 172.31.31.144 -> 172.31.24.227 OpenFlow 187 Type: OFPT_PACKET_OUT
508 0.899070379 172.31.31.144 -> 172.31.24.227 OpenFlow 187 Type: OFPT_PACKET_OUT
509 0.899098672 172.31.31.144 -> 172.31.24.227 OpenFlow 187 Type: OFPT_PACKET_OUT
510 0.899164404 172.31.31.144 -> 172.31.24.227 OpenFlow 187 Type: OFPT_PACKET_OUT
511 0.899523677 172.31.24.227 -> 172.31.31.144 TCP 66 50464 → 6633 [ACK] Seq=493 Ack=727 Win=213 Len=0 TSval=394316027 TSecr=1250755
512 0.899686776 172.31.24.227 -> 172.31.31.144 OpenFlow 189 Type: OFPT_PACKET_IN
513 0.899719222 172.31.24.227 -> 172.31.31.144 OpenFlow 189 Type: OFPT_PACKET_IN
514 0.899806186 172.31.24.227 -> 172.31.31.144 OpenFlow 189 Type: OFPT_PACKET_IN
515 0.899824905 172.31.24.227 -> 172.31.31.144 OpenFlow 189 Type: OFPT_PACKET_IN
516 0.899849652 172.31.24.227 -> 172.31.31.144 OpenFlow 189 Type: OFPT_PACKET_IN
517 0.899920571 172.31.31.144 -> 172.31.24.227 TCP 66 6633 → 50456 [ACK] Seq=727 Ack=616 Win=853 Len=0 TSval=1250755 TSecr=394316027
518 0.899930451 172.31.31.144 -> 172.31.24.227 TCP 66 6633 → 50456 [ACK] Seq=727 Ack=739 Win=853 Len=0 TSval=1250755 TSecr=394316027
519 0.899937492 172.31.24.227 -> 172.31.31.144 OpenFlow 189 Type: OFPT_PACKET_IN
520 0.900034109 172.31.31.144 -> 172.31.24.227 TCP 66 6633 → 50462 [ACK] Seq=1305 Ack=1155 Win=853 Len=0 TSval=1250755 TSecr=394316027
521 0.900133198 172.31.31.144 -> 172.31.24.227 TCP 66 6633 → 50476 [ACK] Seq=1 Ack=124 Win=853 Len=0 TSval=1250755 TSecr=394316027
522 0.900139170 172.31.31.144 -> 172.31.24.227 TCP 66 6633 → 50476 [ACK] Seq=1 Ack=247 Win=853 Len=0 TSval=1250755 TSecr=394316027
523 0.999543585 172.31.31.144 -> 172.31.24.227 OpenFlow 187 Type: OFPT_PACKET_OUT
524 0.999579073 172.31.31.144 -> 172.31.24.227 OpenFlow 187 Type: OFPT_PACKET_OUT
525 0.999598161 172.31.31.144 -> 172.31.24.227 OpenFlow 187 Type: OFPT_PACKET_OUT
526 0.999602173 172.31.31.144 -> 172.31.24.227 OpenFlow 187 Type: OFPT_PACKET_OUT
527 0.999701597 172.31.31.144 -> 172.31.24.227 OpenFlow 187 Type: OFPT_PACKET_OUT
528 0.999706483 172.31.31.144 -> 172.31.24.227 OpenFlow 187 Type: OFPT_PACKET_OUT
529 0.999758531 172.31.31.144 -> 172.31.24.227 OpenFlow 187 Type: OFPT_PACKET_OUT
530 0.999814852 172.31.31.144 -> 172.31.24.227 OpenFlow 187 Type: OFPT_PACKET_OUT
531 0.999882959 172.31.31.144 -> 172.31.24.227 OpenFlow 187 Type: OFPT_PACKET_OUT
532 0.999914929 172.31.31.144 -> 172.31.24.227 OpenFlow 187 Type: OFPT_PACKET_OUT
533 0.999975983 172.31.31.144 -> 172.31.24.227 OpenFlow 187 Type: OFPT_PACKET_OUT
534 1.000020219 172.31.31.144 -> 172.31.24.227 OpenFlow 187 Type: OFPT_PACKET_OUT
535 1.000073195 172.31.31.144 -> 172.31.24.227 OpenFlow 187 Type: OFPT_PACKET_OUT
536 1.000123410 172.31.31.144 -> 172.31.24.227 OpenFlow 187 Type: OFPT_PACKET_OUT
537 1.000300981 172.31.24.227 -> 172.31.31.144 TCP 66 50468 → 6633 [ACK] Seq=247 Ack=969 Win=213 Len=0 TSval=394316052 TSecr=1250780
538 1.000453892 172.31.24.227 -> 172.31.31.144 OpenFlow 189 Type: OFPT_PACKET_IN
539 1.000475088 172.31.24.227 -> 172.31.31.144 OpenFlow 189 Type: OFPT_PACKET_IN
540 1.000665445 172.31.31.144 -> 172.31.24.227 TCP 66 6633 → 50466 [ACK] Seq=727 Ack=370 Win=853 Len=0 TSval=1250780 TSecr=394316052
541 1.000674229 172.31.31.144 -> 172.31.24.227 TCP 66 6633 → 50466 [ACK] Seq=727 Ack=493 Win=853 Len=0 TSval=1250780 TSecr=394316052
542 1.000800220 172.31.24.227 -> 172.31.31.144 OpenFlow 189 Type: OFPT_PACKET_IN
543 1.000820146 172.31.24.227 -> 172.31.31.144 OpenFlow 189 Type: OFPT_PACKET_IN
544 1.000848777 172.31.24.227 -> 172.31.31.144 OpenFlow 189 Type: OFPT_PACKET_IN
545 1.000878002 172.31.24.227 -> 172.31.31.144 OpenFlow 189 Type: OFPT_PACKET_IN
546 1.000974154 172.31.24.227 -> 172.31.31.144 OpenFlow 189 Type: OFPT_PACKET_IN
547 1.001012987 172.31.24.227 -> 172.31.31.144 OpenFlow 189 Type: OFPT_PACKET_IN
548 1.001048606 172.31.31.144 -> 172.31.24.227 TCP 66 6633 → 50470 [ACK] Seq=1081 Ack=845 Win=853 Len=0 TSval=1250780 TSecr=394316052
549 1.001080314 172.31.24.227 -> 172.31.31.144 OpenFlow 189 Type: OFPT_PACKET_IN
550 1.001086769 172.31.24.227 -> 172.31.31.144 OpenFlow 189 Type: OFPT_PACKET_IN
551 1.001105826 172.31.31.144 -> 172.31.24.227 TCP 66 6633 → 50458 [ACK] Seq=727 Ack=616 Win=853 Len=0 TSval=1250780 TSecr=394316052
552 1.001110306 172.31.31.144 -> 172.31.24.227 TCP 66 6633 → 50458 [ACK] Seq=727 Ack=739 Win=853 Len=0 TSval=1250780 TSecr=394316052
553 1.001241793 172.31.31.144 -> 172.31.24.227 TCP 66 6633 → 50468 [ACK] Seq=969 Ack=370 Win=853 Len=0 TSval=1250780 TSecr=394316052
554 1.001248526 172.31.31.144 -> 172.31.24.227 TCP 66 6633 → 50450 [ACK] Seq=1211 Ack=1108 Win=853 Len=0 TSval=1250780 TSecr=394316052
555 1.001302413 172.31.31.144 -> 172.31.24.227 TCP 66 6633 → 50468 [ACK] Seq=969 Ack=493 Win=853 Len=0 TSval=1250780 TSecr=394316052
556 1.001306031 172.31.31.144 -> 172.31.24.227 TCP 66 6633 → 50450 [ACK] Seq=1211 Ack=1231 Win=853 Len=0 TSval=1250780 TSecr=394316052
557 1.099521472 172.31.31.144 -> 172.31.24.227 OpenFlow 187 Type: OFPT_PACKET_OUT
558 1.099550294 172.31.31.144 -> 172.31.24.227 OpenFlow 187 Type: OFPT_PACKET_OUT
559 1.099574550 172.31.31.144 -> 172.31.24.227 OpenFlow 187 Type: OFPT_PACKET_OUT
560 1.099578198 172.31.31.144 -> 172.31.24.227 OpenFlow 187 Type: OFPT_PACKET_OUT
561 1.099614527 172.31.31.144 -> 172.31.24.227 OpenFlow 187 Type: OFPT_PACKET_OUT
562 1.099664237 172.31.31.144 -> 172.31.24.227 OpenFlow 187 Type: OFPT_PACKET_OUT
563 1.099724978 172.31.31.144 -> 172.31.24.227 OpenFlow 187 Type: OFPT_PACKET_OUT
564 1.099770954 172.31.31.144 -> 172.31.24.227 OpenFlow 187 Type: OFPT_PACKET_OUT
565 1.100267440 172.31.24.227 -> 172.31.31.144 TCP 66 50470 → 6633 [ACK] Seq=845 Ack=2049 Win=213 Len=0 TSval=394316077 TSecr=1250805
566 1.100448669 172.31.24.227 -> 172.31.31.144 OpenFlow 189 Type: OFPT_PACKET_IN
567 1.100472238 172.31.24.227 -> 172.31.31.144 OpenFlow 189 Type: OFPT_PACKET_IN
568 1.100541468 172.31.24.227 -> 172.31.31.144 OpenFlow 189 Type: OFPT_PACKET_IN
569 1.100562150 172.31.24.227 -> 172.31.31.144 OpenFlow 189 Type: OFPT_PACKET_IN
570 1.100625162 172.31.24.227 -> 172.31.31.144 OpenFlow 189 Type: OFPT_PACKET_IN
571 1.100644222 172.31.31.144 -> 172.31.24.227 TCP 66 6633 → 50468 [ACK] Seq=969 Ack=616 Win=853 Len=0 TSval=1250805 TSecr=394316077
572 1.100657935 172.31.24.227 -> 172.31.31.144 OpenFlow 189 Type: OFPT_PACKET_IN
573 1.100695414 172.31.31.144 -> 172.31.24.227 TCP 66 6633 → 50468 [ACK] Seq=969 Ack=739 Win=853 Len=0 TSval=1250805 TSecr=394316077
574 1.100773147 172.31.31.144 -> 172.31.24.227 TCP 66 6633 → 50460 [ACK] Seq=1427 Ack=870 Win=853 Len=0 TSval=1250805 TSecr=394316077
575 1.100779669 172.31.31.144 -> 172.31.24.227 TCP 66 6633 → 50460 [ACK] Seq=1427 Ack=993 Win=853 Len=0 TSval=1250805 TSecr=394316077
576 1.100838200 172.31.31.144 -> 172.31.24.227 TCP 66 6633 → 50472 [ACK] Seq=657 Ack=794 Win=853 Len=0 TSval=1250805 TSecr=394316077
577 1.100881213 172.31.31.144 -> 172.31.24.227 TCP 66 6633 → 50472 [ACK] Seq=657 Ack=917 Win=853 Len=0 TSval=1250805 TSecr=394316077
578 1.199171434 172.31.31.144 -> 172.31.24.227 OpenFlow 187 Type: OFPT_PACKET_OUT
579 1.199197257 172.31.31.144 -> 172.31.24.227 OpenFlow 187 Type: OFPT_PACKET_OUT
580 1.199209686 172.31.31.144 -> 172.31.24.227 OpenFlow 187 Type: OFPT_PACKET_OUT
581 1.199235510 172.31.31.144 -> 172.31.24.227 OpenFlow 187 Type: OFPT_PACKET_OUT
582 1.199303429 172.31.31.144 -> 172.31.24.227 OpenFlow 187 Type: OFPT_PACKET_OUT
583 1.199350018 172.31.31.144 -> 172.31.24.227 OpenFlow 187 Type: OFPT_PACKET_OUT
584 1.199422008 172.31.31.144 -> 172.31.24.227 OpenFlow 187 Type: OFPT_PACKET_OUT
585 1.199458341 172.31.31.144 -> 172.31.24.227 OpenFlow 187 Type: OFPT_PACKET_OUT
586 1.199517824 172.31.31.144 -> 172.31.24.227 OpenFlow 187 Type: OFPT_PACKET_OUT
587 1.199570365 172.31.31.144 -> 172.31.24.227 OpenFlow 187 Type: OFPT_PACKET_OUT
588 1.199621245 172.31.31.144 -> 172.31.24.227 OpenFlow 187 Type: OFPT_PACKET_OUT
589 1.199687963 172.31.31.144 -> 172.31.24.227 OpenFlow 187 Type: OFPT_PACKET_OUT
590 1.199731038 172.31.31.144 -> 172.31.24.227 OpenFlow 187 Type: OFPT_PACKET_OUT
591 1.199783630 172.31.31.144 -> 172.31.24.227 OpenFlow 187 Type: OFPT_PACKET_OUT
592 1.199941920 172.31.24.227 -> 172.31.31.144 TCP 66 50474 → 6633 [ACK] Seq=423 Ack=1457 Win=213 Len=0 TSval=394316102 TSecr=1250830
593 1.200032015 172.31.24.227 -> 172.31.31.144 OpenFlow 189 Type: OFPT_PACKET_IN
594 1.200066240 172.31.24.227 -> 172.31.31.144 OpenFlow 189 Type: OFPT_PACKET_IN
595 1.200303663 172.31.31.144 -> 172.31.24.227 TCP 66 6633 → 50472 [ACK] Seq=1383 Ack=1040 Win=853 Len=0 TSval=1250830 TSecr=394316102
596 1.200312291 172.31.31.144 -> 172.31.24.227 TCP 66 6633 → 50472 [ACK] Seq=1383 Ack=1163 Win=853 Len=0 TSval=1250830 TSecr=394316102
597 1.200431185 172.31.24.227 -> 172.31.31.144 OpenFlow 189 Type: OFPT_PACKET_IN
598 1.200455318 172.31.24.227 -> 172.31.31.144 OpenFlow 189 Type: OFPT_PACKET_IN
599 1.200610012 172.31.24.227 -> 172.31.31.144 OpenFlow 189 Type: OFPT_PACKET_IN
600 1.200673148 172.31.24.227 -> 172.31.31.144 OpenFlow 189 Type: OFPT_PACKET_IN
601 1.200683674 172.31.31.144 -> 172.31.24.227 TCP 66 6633 → 50470 [ACK] Seq=2049 Ack=968 Win=853 Len=0 TSval=1250830 TSecr=394316102
602 1.200689219 172.31.31.144 -> 172.31.24.227 TCP 66 6633 → 50470 [ACK] Seq=2049 Ack=1091 Win=853 Len=0 TSval=1250830 TSecr=394316102
603 1.200713361 172.31.24.227 -> 172.31.31.144 OpenFlow 189 Type: OFPT_PACKET_IN
604 1.200719785 172.31.24.227 -> 172.31.31.144 OpenFlow 189 Type: OFPT_PACKET_IN
605 1.200729711 172.31.24.227 -> 172.31.31.144 OpenFlow 189 Type: OFPT_PACKET_IN
606 1.200747386 172.31.24.227 -> 172.31.31.144 OpenFlow 189 Type: OFPT_PACKET_IN
607 1.200813447 172.31.24.227 -> 172.31.31.144 OpenFlow 189 Type: OFPT_PACKET_IN
608 1.200858227 172.31.31.144 -> 172.31.24.227 TCP 66 6633 → 50460 [ACK] Seq=1427 Ack=1116 Win=853 Len=0 TSval=1250830 TSecr=394316102
609 1.200891164 172.31.24.227 -> 172.31.31.144 OpenFlow 189 Type: OFPT_PACKET_IN
610 1.200935787 172.31.31.144 -> 172.31.24.227 TCP 66 6633 → 50460 [ACK] Seq=1427 Ack=1239 Win=853 Len=0 TSval=1250830 TSecr=394316102
611 1.200989338 172.31.31.144 -> 172.31.24.227 TCP 66 6633 → 50476 [ACK] Seq=1 Ack=370 Win=853 Len=0 TSval=1250830 TSecr=394316102
612 1.201067120 172.31.31.144 -> 172.31.24.227 TCP 66 6633 → 50474 [ACK] Seq=1457 Ack=546 Win=853 Len=0 TSval=1250830 TSecr=394316102
613 1.201070903 172.31.31.144 -> 172.31.24.227 TCP 66 6633 → 50476 [ACK] Seq=1 Ack=493 Win=853 Len=0 TSval=1250830 TSecr=394316102
614 1.201122842 172.31.31.144 -> 172.31.24.227 TCP 66 6633 → 50474 [ACK] Seq=1457 Ack=669 Win=853 Len=0 TSval=1250830 TSecr=394316102
615 1.201262477 172.31.31.144 -> 172.31.24.227 TCP 66 6633 → 50462 [ACK] Seq=1305 Ack=1401 Win=853 Len=0 TSval=1250830 TSecr=394316102
616 1.299246528 172.31.31.144 -> 172.31.24.227 OpenFlow 187 Type: OFPT_PACKET_OUT
617 1.299291680 172.31.31.144 -> 172.31.24.227 OpenFlow 187 Type: OFPT_PACKET_OUT
618 1.299298539 172.31.31.144 -> 172.31.24.227 OpenFlow 187 Type: OFPT_PACKET_OUT
619 1.299323990 172.31.31.144 -> 172.31.24.227 OpenFlow 187 Type: OFPT_PACKET_OUT
620 1.299327843 172.31.31.144 -> 172.31.24.227 OpenFlow 187 Type: OFPT_PACKET_OUT
621 1.299349737 172.31.31.144 -> 172.31.24.227 OpenFlow 187 Type: OFPT_PACKET_OUT
622 1.299891296 172.31.24.227 -> 172.31.31.144 TCP 66 50476 → 6633 [ACK] Seq=493 Ack=727 Win=213 Len=0 TSval=394316127 TSecr=1250855
623 1.299981614 172.31.24.227 -> 172.31.31.144 OpenFlow 189 Type: OFPT_PACKET_IN
624 1.300005254 172.31.24.227 -> 172.31.31.144 OpenFlow 189 Type: OFPT_PACKET_IN
625 1.300047106 172.31.24.227 -> 172.31.31.144 OpenFlow 189 Type: OFPT_PACKET_IN
626 1.300066879 172.31.24.227 -> 172.31.31.144 OpenFlow 189 Type: OFPT_PACKET_IN
627 1.300215989 172.31.31.144 -> 172.31.24.227 TCP 66 6633 → 50474 [ACK] Seq=1457 Ack=792 Win=853 Len=0 TSval=1250855 TSecr=394316127
628 1.300225701 172.31.31.144 -> 172.31.24.227 TCP 66 6633 → 50474 [ACK] Seq=1457 Ack=915 Win=853 Len=0 TSval=1250855 TSecr=394316127
629 1.300401254 172.31.31.144 -> 172.31.24.227 TCP 66 6633 → 50464 [ACK] Seq=727 Ack=739 Win=853 Len=0 TSval=1250855 TSecr=394316127
630 1.496647597 172.31.31.144 -> 172.31.24.227 OpenFlow 122 Type: OFPT_MULTIPART_REQUEST, OFPMP_FLOW
631 1.496698341 172.31.31.144 -> 172.31.24.227 OpenFlow 90 Type: OFPT_MULTIPART_REQUEST, OFPMP_PORT_STATS
632 1.496703858 172.31.31.144 -> 172.31.24.227 OpenFlow 82 Type: OFPT_MULTIPART_REQUEST, OFPMP_TABLE
633 1.497148147 172.31.24.227 -> 172.31.31.144 OpenFlow 2010 Type: OFPT_MULTIPART_REPLY, OFPMP_FLOW
634 1.497272925 172.31.24.227 -> 172.31.31.144 OpenFlow 530 Type: OFPT_MULTIPART_REPLY, OFPMP_PORT_STATS
635 1.497382019 172.31.31.144 -> 172.31.24.227 TCP 66 6633 → 50430 [ACK] Seq=823 Ack=2437 Win=853 Len=0 TSval=1250904 TSecr=394316176
636 1.497459319 172.31.24.227 -> 172.31.31.144 OpenFlow 6178 Type: OFPT_MULTIPART_REPLY, OFPMP_TABLE
637 1.497476810 172.31.31.144 -> 172.31.24.227 TCP 66 6633 → 50430 [ACK] Seq=823 Ack=2901 Win=853 Len=0 TSval=1250904 TSecr=394316176
638 1.497714888 172.31.31.144 -> 172.31.24.227 TCP 66 6633 → 50430 [ACK] Seq=823 Ack=9013 Win=853 Len=0 TSval=1250904 TSecr=394316176
639 1.545798015 172.31.31.144 -> 172.31.24.227 OpenFlow 122 Type: OFPT_MULTIPART_REQUEST, OFPMP_FLOW
640 1.545835174 172.31.31.144 -> 172.31.24.227 OpenFlow 106 Type: OFPT_MULTIPART_REQUEST, OFPMP_TABLE
641 1.546192390 172.31.24.227 -> 172.31.31.144 OpenFlow 2426 Type: OFPT_MULTIPART_REPLY, OFPMP_FLOW
642 1.546334023 172.31.24.227 -> 172.31.31.144 OpenFlow 642 Type: OFPT_MULTIPART_REPLY, OFPMP_PORT_STATS
643 1.546469732 172.31.31.144 -> 172.31.24.227 TCP 66 6633 → 50432 [ACK] Seq=1065 Ack=3099 Win=853 Len=0 TSval=1250917 TSecr=394316189
644 1.546530687 172.31.24.227 -> 172.31.31.144 OpenFlow 6178 Type: OFPT_MULTIPART_REPLY, OFPMP_TABLE
645 1.546542521 172.31.31.144 -> 172.31.24.227 TCP 66 6633 → 50432 [ACK] Seq=1065 Ack=3675 Win=853 Len=0 TSval=1250917 TSecr=394316189
646 1.546781624 172.31.31.144 -> 172.31.24.227 TCP 66 6633 → 50432 [ACK] Seq=1065 Ack=9787 Win=853 Len=0 TSval=1250917 TSecr=394316189
647 1.590834190 172.31.31.144 -> 172.31.24.227 OpenFlow 82 Type: OFPT_MULTIPART_REQUEST, OFPMP_TABLE
648 1.590868293 172.31.31.144 -> 172.31.24.227 OpenFlow 146 Type: OFPT_MULTIPART_REQUEST, OFPMP_PORT_STATS
649 1.591262943 172.31.24.227 -> 172.31.31.144 OpenFlow 6178 Type: OFPT_MULTIPART_REPLY, OFPMP_TABLE
650 1.591369556 172.31.24.227 -> 172.31.31.144 OpenFlow 2634 Type: OFPT_MULTIPART_REPLY, OFPMP_FLOW
651 1.591506029 172.31.24.227 -> 172.31.31.144 OpenFlow 754 Type: OFPT_MULTIPART_REPLY, OFPMP_PORT_STATS
652 1.591618857 172.31.31.144 -> 172.31.24.227 TCP 66 6633 → 50434 [ACK] Seq=1307 Ack=7097 Win=853 Len=0 TSval=1250928 TSecr=394316200
653 1.591627628 172.31.31.144 -> 172.31.24.227 TCP 66 6633 → 50434 [ACK] Seq=1307 Ack=9665 Win=853 Len=0 TSval=1250928 TSecr=394316200
654 1.591823150 172.31.31.144 -> 172.31.24.227 TCP 66 6633 → 50434 [ACK] Seq=1307 Ack=10353 Win=853 Len=0 TSval=1250928 TSecr=394316200
655 1.643067662 172.31.31.144 -> 172.31.24.227 OpenFlow 82 Type: OFPT_MULTIPART_REQUEST, OFPMP_TABLE
656 1.643092942 172.31.31.144 -> 172.31.24.227 OpenFlow 146 Type: OFPT_MULTIPART_REQUEST, OFPMP_PORT_STATS
657 1.643415052 172.31.24.227 -> 172.31.31.144 OpenFlow 6178 Type: OFPT_MULTIPART_REPLY, OFPMP_TABLE
658 1.643509523 172.31.24.227 -> 172.31.31.144 OpenFlow 2218 Type: OFPT_MULTIPART_REPLY, OFPMP_FLOW
659 1.643621681 172.31.24.227 -> 172.31.31.144 OpenFlow 642 Type: OFPT_MULTIPART_REPLY, OFPMP_PORT_STATS
660 1.643688239 172.31.31.144 -> 172.31.24.227 TCP 66 6633 → 50436 [ACK] Seq=1553 Ack=7027 Win=853 Len=0 TSval=1250941 TSecr=394316213
661 1.643759596 172.31.31.144 -> 172.31.24.227 TCP 66 6633 → 50436 [ACK] Seq=1553 Ack=9179 Win=853 Len=0 TSval=1250941 TSecr=394316213
662 1.643848474 172.31.31.144 -> 172.31.24.227 TCP 66 6633 → 50436 [ACK] Seq=1553 Ack=9755 Win=853 Len=0 TSval=1250941 TSecr=394316213
663 1.690286937 172.31.31.144 -> 172.31.24.227 OpenFlow 82 Type: OFPT_MULTIPART_REQUEST, OFPMP_TABLE
664 1.690301622 172.31.31.144 -> 172.31.24.227 OpenFlow 146 Type: OFPT_MULTIPART_REQUEST, OFPMP_FLOW
665 1.690611257 172.31.24.227 -> 172.31.31.144 OpenFlow 6178 Type: OFPT_MULTIPART_REPLY, OFPMP_TABLE
666 1.690710330 172.31.24.227 -> 172.31.31.144 OpenFlow 530 Type: OFPT_MULTIPART_REPLY, OFPMP_PORT_STATS
667 1.690751826 172.31.24.227 -> 172.31.31.144 OpenFlow 554 Type: OFPT_MULTIPART_REPLY, OFPMP_FLOW
668 1.690893144 172.31.31.144 -> 172.31.24.227 TCP 66 6633 → 50438 [ACK] Seq=823 Ack=6851 Win=853 Len=0 TSval=1250953 TSecr=394316225
669 1.690900870 172.31.31.144 -> 172.31.24.227 TCP 66 6633 → 50438 [ACK] Seq=823 Ack=7315 Win=853 Len=0 TSval=1250953 TSecr=394316225
670 1.690948332 172.31.31.144 -> 172.31.24.227 TCP 66 6633 → 50438 [ACK] Seq=823 Ack=7803 Win=853 Len=0 TSval=1250953 TSecr=394316225
671 1.721363887 172.31.31.144 -> 172.31.24.227 OpenFlow 122 Type: OFPT_MULTIPART_REQUEST, OFPMP_FLOW
672 1.721375931 172.31.31.144 -> 172.31.24.227 OpenFlow 106 Type: OFPT_MULTIPART_REQUEST, OFPMP_PORT_STATS
673 1.721557391 172.31.24.227 -> 172.31.31.144 OpenFlow 2842 Type: OFPT_MULTIPART_REPLY, OFPMP_FLOW
674 1.721715836 172.31.24.227 -> 172.31.31.144 OpenFlow 6178 Type: OFPT_MULTIPART_REPLY, OFPMP_TABLE
675 1.721805015 172.31.31.144 -> 172.31.24.227 TCP 66 6633 → 50440 [ACK] Seq=1307 Ack=4007 Win=853 Len=0 TSval=1250960 TSecr=394316232
676 1.721853362 172.31.24.227 -> 172.31.31.144 OpenFlow 754 Type: OFPT_MULTIPART_REPLY, OFPMP_PORT_STATS
677 1.721986516 172.31.31.144 -> 172.31.24.227 TCP 66 6633 → 50440 [ACK] Seq=1307 Ack=10119 Win=853 Len=0 TSval=1250960 TSecr=394316232
678 1.722080157 172.31.31.144 -> 172.31.24.227 TCP 66 6633 → 50440 [ACK] Seq=1307 Ack=10807 Win=853 Len=0 TSval=1250961 TSecr=394316233
679 1.764484754 172.31.31.144 -> 172.31.24.227 OpenFlow 82 Type: OFPT_MULTIPART_REQUEST, OFPMP_TABLE
680 1.764497061 172.31.31.144 -> 172.31.24.227 OpenFlow 146 Type: OFPT_MULTIPART_REQUEST, OFPMP_PORT_STATS
681 1.764784995 172.31.24.227 -> 172.31.31.144 OpenFlow 6178 Type: OFPT_MULTIPART_REPLY, OFPMP_TABLE
682 1.764846747 172.31.24.227 -> 172.31.31.144 OpenFlow 1594 Type: OFPT_MULTIPART_REPLY, OFPMP_FLOW
683 1.764955975 172.31.24.227 -> 172.31.31.144 OpenFlow 754 Type: OFPT_MULTIPART_REPLY, OFPMP_PORT_STATS
684 1.765046219 172.31.31.144 -> 172.31.24.227 TCP 66 6633 → 50442 [ACK] Seq=1307 Ack=7343 Win=853 Len=0 TSval=1250971 TSecr=394316243
685 1.765053633 172.31.31.144 -> 172.31.24.227 TCP 66 6633 → 50442 [ACK] Seq=1307 Ack=8871 Win=853 Len=0 TSval=1250971 TSecr=394316243
686 1.765161961 172.31.31.144 -> 172.31.24.227 TCP 66 6633 → 50442 [ACK] Seq=1307 Ack=9559 Win=853 Len=0 TSval=1250971 TSecr=394316243
687 1.803614594 172.31.31.144 -> 172.31.24.227 OpenFlow 122 Type: OFPT_MULTIPART_REQUEST, OFPMP_FLOW
688 1.803626179 172.31.31.144 -> 172.31.24.227 OpenFlow 106 Type: OFPT_MULTIPART_REQUEST, OFPMP_TABLE
689 1.803795278 172.31.24.227 -> 172.31.31.144 OpenFlow 1178 Type: OFPT_MULTIPART_REPLY, OFPMP_FLOW
690 1.803897694 172.31.24.227 -> 172.31.31.144 OpenFlow 530 Type: OFPT_MULTIPART_REPLY, OFPMP_PORT_STATS
691 1.804055297 172.31.24.227 -> 172.31.31.144 OpenFlow 6178 Type: OFPT_MULTIPART_REPLY, OFPMP_TABLE
692 1.804137386 172.31.31.144 -> 172.31.24.227 TCP 66 6633 → 50444 [ACK] Seq=1415 Ack=2027 Win=853 Len=0 TSval=1250981 TSecr=394316253
693 1.804146792 172.31.31.144 -> 172.31.24.227 TCP 66 6633 → 50444 [ACK] Seq=1415 Ack=2491 Win=853 Len=0 TSval=1250981 TSecr=394316253
694 1.804389475 172.31.31.144 -> 172.31.24.227 TCP 66 6633 → 50444 [ACK] Seq=1415 Ack=8603 Win=853 Len=0 TSval=1250981 TSecr=394316253
695 1.853833410 172.31.31.144 -> 172.31.24.227 OpenFlow 122 Type: OFPT_MULTIPART_REQUEST, OFPMP_FLOW
696 1.853860017 172.31.31.144 -> 172.31.24.227 OpenFlow 106 Type: OFPT_MULTIPART_REQUEST, OFPMP_PORT_STATS
697 1.854072080 172.31.24.227 -> 172.31.31.144 OpenFlow 2010 Type: OFPT_MULTIPART_REPLY, OFPMP_FLOW
698 1.854226200 172.31.24.227 -> 172.31.31.144 OpenFlow 6178 Type: OFPT_MULTIPART_REPLY, OFPMP_TABLE
699 1.854303841 172.31.31.144 -> 172.31.24.227 TCP 66 6633 → 50446 [ACK] Seq=1523 Ack=3183 Win=853 Len=0 TSval=1250994 TSecr=394316266
700 1.854362327 172.31.24.227 -> 172.31.31.144 OpenFlow 754 Type: OFPT_MULTIPART_REPLY, OFPMP_PORT_STATS
701 1.854496021 172.31.31.144 -> 172.31.24.227 TCP 66 6633 → 50446 [ACK] Seq=1523 Ack=9295 Win=853 Len=0 TSval=1250994 TSecr=394316266
702 1.854556924 172.31.31.144 -> 172.31.24.227 TCP 66 6633 → 50446 [ACK] Seq=1523 Ack=9983 Win=853 Len=0 TSval=1250994 TSecr=394316266
703 1.906045051 172.31.31.144 -> 172.31.24.227 OpenFlow 90 Type: OFPT_MULTIPART_REQUEST, OFPMP_PORT_STATS
704 1.906056613 172.31.31.144 -> 172.31.24.227 OpenFlow 138 Type: OFPT_MULTIPART_REQUEST, OFPMP_FLOW
705 1.906313193 172.31.24.227 -> 172.31.31.144 OpenFlow 642 Type: OFPT_MULTIPART_REPLY, OFPMP_PORT_STATS
706 1.906463003 172.31.24.227 -> 172.31.31.144 OpenFlow 6178 Type: OFPT_MULTIPART_REPLY, OFPMP_TABLE
707 1.906527165 172.31.24.227 -> 172.31.31.144 OpenFlow 1802 Type: OFPT_MULTIPART_REPLY, OFPMP_FLOW
708 1.906551979 172.31.31.144 -> 172.31.24.227 TCP 66 6633 → 50448 [ACK] Seq=1449 Ack=1737 Win=853 Len=0 TSval=1251007 TSecr=394316279
709 1.906773479 172.31.31.144 -> 172.31.24.227 TCP 66 6633 → 50448 [ACK] Seq=1449 Ack=7849 Win=853 Len=0 TSval=1251007 TSecr=394316279
710 1.906779973 172.31.31.144 -> 172.31.24.227 TCP 66 6633 → 50448 [ACK] Seq=1449 Ack=9585 Win=853 Len=0 TSval=1251007 TSecr=394316279
711 1.958216296 172.31.31.144 -> 172.31.24.227 OpenFlow 122 Type: OFPT_MULTIPART_REQUEST, OFPMP_FLOW
712 1.958235486 172.31.31.144 -> 172.31.24.227 OpenFlow 106 Type: OFPT_MULTIPART_REQUEST, OFPMP_TABLE
713 1.958471271 172.31.24.227 -> 172.31.31.144 OpenFlow 2842 Type: OFPT_MULTIPART_REPLY, OFPMP_FLOW
714 1.958618671 172.31.24.227 -> 172.31.31.144 OpenFlow 754 Type: OFPT_MULTIPART_REPLY, OFPMP_PORT_STATS
715 1.958703826 172.31.31.144 -> 172.31.24.227 TCP 66 6633 → 50450 [ACK] Seq=1307 Ack=4007 Win=853 Len=0 TSval=1251020 TSecr=394316292
716 1.958789136 172.31.24.227 -> 172.31.31.144 OpenFlow 6178 Type: OFPT_MULTIPART_REPLY, OFPMP_TABLE
717 1.958818291 172.31.31.144 -> 172.31.24.227 TCP 66 6633 → 50450 [ACK] Seq=1307 Ack=4695 Win=853 Len=0 TSval=1251020 TSecr=394316292
718 1.959043805 172.31.31.144 -> 172.31.24.227 TCP 66 6633 → 50450 [ACK] Seq=1307 Ack=10807 Win=853 Len=0 TSval=1251020 TSecr=394316292
719 2.000385236 172.31.31.144 -> 172.31.24.227 OpenFlow 90 Type: OFPT_MULTIPART_REQUEST, OFPMP_PORT_STATS
720 2.000395039 172.31.31.144 -> 172.31.24.227 OpenFlow 138 Type: OFPT_MULTIPART_REQUEST, OFPMP_FLOW
721 2.000562429 172.31.24.227 -> 172.31.31.144 OpenFlow 642 Type: OFPT_MULTIPART_REPLY, OFPMP_PORT_STATS
722 2.000711186 172.31.24.227 -> 172.31.31.144 OpenFlow 6178 Type: OFPT_MULTIPART_REPLY, OFPMP_TABLE
723 2.000760403 172.31.24.227 -> 172.31.31.144 OpenFlow 970 Type: OFPT_MULTIPART_REPLY, OFPMP_FLOW
724 2.000791577 172.31.31.144 -> 172.31.24.227 TCP 66 6633 → 50452 [ACK] Seq=1281 Ack=1569 Win=853 Len=0 TSval=1251030 TSecr=394316302
725 2.000995389 172.31.31.144 -> 172.31.24.227 TCP 66 6633 → 50452 [ACK] Seq=1281 Ack=7681 Win=853 Len=0 TSval=1251030 TSecr=394316302
726 2.001002139 172.31.31.144 -> 172.31.24.227 TCP 66 6633 → 50452 [ACK] Seq=1281 Ack=8585 Win=853 Len=0 TSval=1251030 TSecr=394316302
727 2.049547564 172.31.31.144 -> 172.31.24.227 OpenFlow 122 Type: OFPT_MULTIPART_REQUEST, OFPMP_FLOW
728 2.049579948 172.31.31.144 -> 172.31.24.227 OpenFlow 106 Type: OFPT_MULTIPART_REQUEST, OFPMP_PORT_STATS
729 2.049914118 172.31.24.227 -> 172.31.31.144 OpenFlow 1386 Type: OFPT_MULTIPART_REPLY, OFPMP_FLOW
730 2.050099770 172.31.24.227 -> 172.31.31.144 OpenFlow 6178 Type: OFPT_MULTIPART_REPLY, OFPMP_TABLE
731 2.050196690 172.31.31.144 -> 172.31.24.227 TCP 66 6633 → 50454 [ACK] Seq=1233 Ack=2473 Win=853 Len=0 TSval=1251043 TSecr=394316315
732 2.050265475 172.31.24.227 -> 172.31.31.144 OpenFlow 642 Type: OFPT_MULTIPART_REPLY, OFPMP_PORT_STATS
733 2.050402742 172.31.31.144 -> 172.31.24.227 TCP 66 6633 → 50454 [ACK] Seq=1233 Ack=8585 Win=853 Len=0 TSval=1251043 TSecr=394316315
734 2.050453181 172.31.31.144 -> 172.31.24.227 TCP 66 6633 → 50454 [ACK] Seq=1233 Ack=9161 Win=853 Len=0 TSval=1251043 TSecr=394316315
735 2.110928503 172.31.31.144 -> 172.31.24.227 OpenFlow 90 Type: OFPT_MULTIPART_REQUEST, OFPMP_PORT_STATS
736 2.110969466 172.31.31.144 -> 172.31.24.227 OpenFlow 138 Type: OFPT_MULTIPART_REQUEST, OFPMP_FLOW
737 2.111236910 172.31.24.227 -> 172.31.31.144 OpenFlow 530 Type: OFPT_MULTIPART_REPLY, OFPMP_PORT_STATS
738 2.111410715 172.31.24.227 -> 172.31.31.144 OpenFlow 6178 Type: OFPT_MULTIPART_REPLY, OFPMP_TABLE
739 2.111473859 172.31.24.227 -> 172.31.31.144 OpenFlow 970 Type: OFPT_MULTIPART_REPLY, OFPMP_FLOW
740 2.111502133 172.31.31.144 -> 172.31.24.227 TCP 66 6633 → 50456 [ACK] Seq=823 Ack=1203 Win=853 Len=0 TSval=1251058 TSecr=394316330
741 2.111719743 172.31.31.144 -> 172.31.24.227 TCP 66 6633 → 50456 [ACK] Seq=823 Ack=7315 Win=853 Len=0 TSval=1251058 TSecr=394316330
742 2.111726544 172.31.31.144 -> 172.31.24.227 TCP 66 6633 → 50456 [ACK] Seq=823 Ack=8219 Win=853 Len=0 TSval=1251058 TSecr=394316330
743 2.164049276 172.31.31.144 -> 172.31.24.227 OpenFlow 122 Type: OFPT_MULTIPART_REQUEST, OFPMP_FLOW
744 2.164078638 172.31.31.144 -> 172.31.24.227 OpenFlow 106 Type: OFPT_MULTIPART_REQUEST, OFPMP_PORT_STATS
745 2.164472319 172.31.24.227 -> 172.31.31.144 OpenFlow 762 Type: OFPT_MULTIPART_REPLY, OFPMP_FLOW
746 2.164657986 172.31.24.227 -> 172.31.31.144 OpenFlow 6178 Type: OFPT_MULTIPART_REPLY, OFPMP_TABLE
747 2.164694000 172.31.31.144 -> 172.31.24.227 TCP 66 6633 → 50458 [ACK] Seq=823 Ack=1435 Win=853 Len=0 TSval=1251071 TSecr=394316343
748 2.164774191 172.31.24.227 -> 172.31.31.144 OpenFlow 530 Type: OFPT_MULTIPART_REPLY, OFPMP_PORT_STATS
749 2.164927712 172.31.31.144 -> 172.31.24.227 TCP 66 6633 → 50458 [ACK] Seq=823 Ack=7547 Win=853 Len=0 TSval=1251071 TSecr=394316343
750 2.164982428 172.31.31.144 -> 172.31.24.227 TCP 66 6633 → 50458 [ACK] Seq=823 Ack=8011 Win=853 Len=0 TSval=1251071 TSecr=394316343
751 2.222155443 172.31.31.144 -> 172.31.24.227 OpenFlow 122 Type: OFPT_MULTIPART_REQUEST, OFPMP_FLOW
752 2.222186341 172.31.31.144 -> 172.31.24.227 OpenFlow 106 Type: OFPT_MULTIPART_REQUEST, OFPMP_PORT_STATS
753 2.222471942 172.31.24.227 -> 172.31.31.144 OpenFlow 554 Type: OFPT_MULTIPART_REPLY, OFPMP_FLOW
754 2.222654297 172.31.24.227 -> 172.31.31.144 OpenFlow 6178 Type: OFPT_MULTIPART_REPLY, OFPMP_TABLE
755 2.222734532 172.31.31.144 -> 172.31.24.227 TCP 66 6633 → 50460 [ACK] Seq=1523 Ack=1727 Win=853 Len=0 TSval=1251086 TSecr=394316358
756 2.222808233 172.31.24.227 -> 172.31.31.144 OpenFlow 754 Type: OFPT_MULTIPART_REPLY, OFPMP_PORT_STATS
757 2.222929911 172.31.31.144 -> 172.31.24.227 TCP 66 6633 → 50460 [ACK] Seq=1523 Ack=7839 Win=853 Len=0 TSval=1251086 TSecr=394316358
758 2.223007000 172.31.31.144 -> 172.31.24.227 TCP 66 6633 → 50460 [ACK] Seq=1523 Ack=8527 Win=853 Len=0 TSval=1251086 TSecr=394316358
759 2.292359175 172.31.31.144 -> 172.31.24.227 OpenFlow 122 Type: OFPT_MULTIPART_REQUEST, OFPMP_FLOW
760 2.292391780 172.31.31.144 -> 172.31.24.227 OpenFlow 106 Type: OFPT_MULTIPART_REQUEST, OFPMP_TABLE
761 2.292736952 172.31.24.227 -> 172.31.31.144 OpenFlow 1386 Type: OFPT_MULTIPART_REPLY, OFPMP_FLOW
762 2.292896224 172.31.24.227 -> 172.31.31.144 OpenFlow 754 Type: OFPT_MULTIPART_REPLY, OFPMP_PORT_STATS
763 2.293066078 172.31.24.227 -> 172.31.31.144 OpenFlow 6178 Type: OFPT_MULTIPART_REPLY, OFPMP_TABLE
764 2.293104066 172.31.31.144 -> 172.31.24.227 TCP 66 6633 → 50462 [ACK] Seq=1401 Ack=3409 Win=853 Len=0 TSval=1251103 TSecr=394316375
765 2.330089159 172.31.31.144 -> 172.31.24.227 TCP 66 6633 → 50462 [ACK] Seq=1401 Ack=9521 Win=853 Len=0 TSval=1251113 TSecr=394316375
766 2.351464160 172.31.31.144 -> 172.31.24.227 OpenFlow 90 Type: OFPT_MULTIPART_REQUEST, OFPMP_PORT_STATS
767 2.351493177 172.31.31.144 -> 172.31.24.227 OpenFlow 138 Type: OFPT_MULTIPART_REQUEST, OFPMP_TABLE
768 2.351916163 172.31.24.227 -> 172.31.31.144 OpenFlow 530 Type: OFPT_MULTIPART_REPLY, OFPMP_PORT_STATS
769 2.351984416 172.31.24.227 -> 172.31.31.144 OpenFlow 970 Type: OFPT_MULTIPART_REPLY, OFPMP_FLOW
770 2.352203489 172.31.24.227 -> 172.31.31.144 OpenFlow 6178 Type: OFPT_MULTIPART_REPLY, OFPMP_TABLE
771 2.352219428 172.31.31.144 -> 172.31.24.227 TCP 66 6633 → 50464 [ACK] Seq=823 Ack=2107 Win=853 Len=0 TSval=1251118 TSecr=394316390
772 2.390180413 172.31.31.144 -> 172.31.24.227 TCP 66 6633 → 50464 [ACK] Seq=823 Ack=8219 Win=853 Len=0 TSval=1251128 TSecr=394316390
773 2.415710124 172.31.31.144 -> 172.31.24.227 OpenFlow 82 Type: OFPT_MULTIPART_REQUEST, OFPMP_TABLE
774 2.415736325 172.31.31.144 -> 172.31.24.227 OpenFlow 122 Type: OFPT_MULTIPART_REQUEST, OFPMP_FLOW
775 2.415746404 172.31.31.144 -> 172.31.24.227 OpenFlow 90 Type: OFPT_MULTIPART_REQUEST, OFPMP_PORT_STATS
776 2.416065402 172.31.24.227 -> 172.31.31.144 OpenFlow 6178 Type: OFPT_MULTIPART_REPLY, OFPMP_TABLE
777 2.416171549 172.31.24.227 -> 172.31.31.144 OpenFlow 3050 Type: OFPT_MULTIPART_REPLY, OFPMP_FLOW
778 2.416302019 172.31.24.227 -> 172.31.31.144 OpenFlow 530 Type: OFPT_MULTIPART_REPLY, OFPMP_PORT_STATS
779 2.416397736 172.31.31.144 -> 172.31.24.227 TCP 66 6633 → 50466 [ACK] Seq=823 Ack=6605 Win=853 Len=0 TSval=1251134 TSecr=394316406
780 2.416405858 172.31.31.144 -> 172.31.24.227 TCP 66 6633 → 50466 [ACK] Seq=823 Ack=9589 Win=853 Len=0 TSval=1251134 TSecr=394316406
781 2.416540267 172.31.31.144 -> 172.31.24.227 TCP 66 6633 → 50466 [ACK] Seq=823 Ack=10053 Win=853 Len=0 TSval=1251134 TSecr=394316406
