  1 0.000000000 172.31.31.144 -> 172.31.24.227 TCP 82 6633 → 59648 [PSH, ACK] Seq=1 Ack=1 Win=853 Len=16 TSval=2863200 TSecr=391766485
  2 0.000019732 172.31.31.144 -> 172.31.24.227 TCP 146 6633 → 59648 [PSH, ACK] Seq=17 Ack=1 Win=853 Len=80 TSval=2863200 TSecr=391766485
  3 0.000270446 172.31.24.227 -> 172.31.31.144 OpenFlow 6178 Type: OFPT_MULTIPART_REPLY, OFPMP_TABLE
  4 0.000370552 172.31.24.227 -> 172.31.31.144 OpenFlow 3018 Type: OFPT_MULTIPART_REPLY, OFPMP_FLOW
  5 0.000464253 172.31.24.227 -> 172.31.31.144 OpenFlow 754 Type: OFPT_MULTIPART_REPLY, OFPMP_PORT_STATS
  6 0.000611439 172.31.31.144 -> 172.31.24.227 TCP 66 6633 → 59648 [ACK] Seq=97 Ack=6113 Win=853 Len=0 TSval=2863201 TSecr=391767075
  7 0.000619980 172.31.31.144 -> 172.31.24.227 TCP 66 6633 → 59648 [ACK] Seq=97 Ack=9065 Win=853 Len=0 TSval=2863201 TSecr=391767075
  8 0.000702238 172.31.31.144 -> 172.31.24.227 TCP 66 6633 → 59648 [ACK] Seq=97 Ack=9753 Win=853 Len=0 TSval=2863201 TSecr=391767075
  9 0.032982789 137.158.125.247 -> 172.31.24.227 TCP 54 63468 → 22 [ACK] Seq=1 Ack=1 Win=32564 Len=0
 10 0.032991708 137.158.125.247 -> 172.31.24.227 TCP 66 63468 → 22 [ACK] Seq=1 Ack=4294967201 Win=32612 Len=0 SLE=4294967261 SRE=1
 11 0.033598976 137.158.125.247 -> 172.31.24.227 TCP 54 63468 → 22 [ACK] Seq=1 Ack=297 Win=32416 Len=0
 12 0.084159476 172.31.31.144 -> 172.31.24.227 TCP 82 6633 → 59650 [PSH, ACK] Seq=1 Ack=1 Win=853 Len=16 TSval=2863222 TSecr=391766460
 13 0.084170303 172.31.31.144 -> 172.31.24.227 TCP 146 6633 → 59650 [PSH, ACK] Seq=17 Ack=1 Win=853 Len=80 TSval=2863222 TSecr=391766460
 14 0.084509448 172.31.24.227 -> 172.31.31.144 OpenFlow 6178 Type: OFPT_MULTIPART_REPLY, OFPMP_TABLE
 15 0.084586799 172.31.24.227 -> 172.31.31.144 OpenFlow 1562 Type: OFPT_MULTIPART_REPLY, OFPMP_FLOW
 16 0.084708349 172.31.24.227 -> 172.31.31.144 OpenFlow 754 Type: OFPT_MULTIPART_REPLY, OFPMP_PORT_STATS
 17 0.084779322 172.31.31.144 -> 172.31.24.227 TCP 66 6633 → 59650 [ACK] Seq=97 Ack=6113 Win=853 Len=0 TSval=2863222 TSecr=391767096
 18 0.084843254 172.31.31.144 -> 172.31.24.227 TCP 66 6633 → 59650 [ACK] Seq=97 Ack=7609 Win=853 Len=0 TSval=2863222 TSecr=391767096
 19 0.084911478 172.31.31.144 -> 172.31.24.227 TCP 66 6633 → 59650 [ACK] Seq=97 Ack=8297 Win=853 Len=0 TSval=2863222 TSecr=391767096
 20 0.122328136 172.31.31.144 -> 172.31.24.227 TCP 122 6633 → 59652 [PSH, ACK] Seq=1 Ack=1 Win=853 Len=56 TSval=2863231 TSecr=391766461
 21 0.122344880 172.31.31.144 -> 172.31.24.227 TCP 90 6633 → 59652 [PSH, ACK] Seq=57 Ack=1 Win=853 Len=24 TSval=2863231 TSecr=391766461
 22 0.122542649 172.31.24.227 -> 172.31.31.144 OpenFlow 1562 Type: OFPT_MULTIPART_REPLY, OFPMP_FLOW
 23 0.122650521 172.31.24.227 -> 172.31.31.144 OpenFlow 530 Type: OFPT_MULTIPART_REPLY, OFPMP_PORT_STATS
 24 0.122847651 172.31.31.144 -> 172.31.24.227 TCP 66 6633 → 59652 [ACK] Seq=81 Ack=1497 Win=853 Len=0 TSval=2863231 TSecr=391767106
 25 0.122855509 172.31.31.144 -> 172.31.24.227 TCP 66 6633 → 59652 [ACK] Seq=81 Ack=1961 Win=853 Len=0 TSval=2863231 TSecr=391767106
 26 0.123310526 172.31.31.144 -> 172.31.24.227 OpenFlow 82 Type: OFPT_MULTIPART_REQUEST, OFPMP_TABLE
 27 0.123567048 172.31.24.227 -> 172.31.31.144 OpenFlow 6178 Type: OFPT_MULTIPART_REPLY, OFPMP_TABLE
 28 0.125285975 137.158.125.247 -> 172.31.24.227 TCP 54 63468 → 22 [ACK] Seq=1 Ack=393 Win=32368 Len=0
 29 0.160106217 172.31.31.144 -> 172.31.24.227 TCP 66 6633 → 59652 [ACK] Seq=97 Ack=8073 Win=853 Len=0 TSval=2863241 TSecr=391767106
 30 0.180555509 172.31.31.144 -> 172.31.24.227 TCP 90 6633 → 59654 [PSH, ACK] Seq=1 Ack=1 Win=853 Len=24 TSval=2863246 TSecr=391766486
 31 0.180565589 172.31.31.144 -> 172.31.24.227 TCP 138 6633 → 59654 [PSH, ACK] Seq=25 Ack=1 Win=853 Len=72 TSval=2863246 TSecr=391766486
 32 0.180762230 172.31.24.227 -> 172.31.31.144 OpenFlow 754 Type: OFPT_MULTIPART_REPLY, OFPMP_PORT_STATS
 33 0.180843801 172.31.24.227 -> 172.31.31.144 OpenFlow 1978 Type: OFPT_MULTIPART_REPLY, OFPMP_FLOW
 34 0.180986461 172.31.31.144 -> 172.31.24.227 TCP 66 6633 → 59654 [ACK] Seq=97 Ack=689 Win=853 Len=0 TSval=2863246 TSecr=391767120
 35 0.181004031 172.31.24.227 -> 172.31.31.144 OpenFlow 6178 Type: OFPT_MULTIPART_REPLY, OFPMP_TABLE
 36 0.181061068 172.31.31.144 -> 172.31.24.227 TCP 66 6633 → 59654 [ACK] Seq=97 Ack=2601 Win=853 Len=0 TSval=2863246 TSecr=391767121
 37 0.181280733 172.31.31.144 -> 172.31.24.227 TCP 66 6633 → 59654 [ACK] Seq=97 Ack=8713 Win=853 Len=0 TSval=2863246 TSecr=391767121
 38 0.232759860 172.31.31.144 -> 172.31.24.227 TCP 90 6633 → 59656 [PSH, ACK] Seq=1 Ack=1 Win=853 Len=24 TSval=2863259 TSecr=391766535
 39 0.232768649 172.31.31.144 -> 172.31.24.227 TCP 138 6633 → 59656 [PSH, ACK] Seq=25 Ack=1 Win=853 Len=72 TSval=2863259 TSecr=391766535
 40 0.232961183 172.31.24.227 -> 172.31.31.144 OpenFlow 642 Type: OFPT_MULTIPART_REPLY, OFPMP_PORT_STATS
 41 0.233026978 172.31.24.227 -> 172.31.31.144 OpenFlow 1978 Type: OFPT_MULTIPART_REPLY, OFPMP_FLOW
 42 0.233158651 172.31.24.227 -> 172.31.31.144 OpenFlow 6178 Type: OFPT_MULTIPART_REPLY, OFPMP_TABLE
 43 0.233169315 172.31.31.144 -> 172.31.24.227 TCP 66 6633 → 59656 [ACK] Seq=97 Ack=577 Win=853 Len=0 TSval=2863259 TSecr=391767134
 44 0.233240454 172.31.31.144 -> 172.31.24.227 TCP 66 6633 → 59656 [ACK] Seq=97 Ack=2489 Win=853 Len=0 TSval=2863259 TSecr=391767134
 45 0.233389115 172.31.31.144 -> 172.31.24.227 TCP 66 6633 → 59656 [ACK] Seq=97 Ack=8601 Win=853 Len=0 TSval=2863259 TSecr=391767134
 46 0.282913570 172.31.31.144 -> 172.31.24.227 TCP 90 6633 → 59658 [PSH, ACK] Seq=1 Ack=1 Win=853 Len=24 TSval=2863271 TSecr=391766635
 47 0.282927552 172.31.31.144 -> 172.31.24.227 TCP 138 6633 → 59658 [PSH, ACK] Seq=25 Ack=1 Win=853 Len=72 TSval=2863271 TSecr=391766635
 48 0.283138121 172.31.24.227 -> 172.31.31.144 OpenFlow 754 Type: OFPT_MULTIPART_REPLY, OFPMP_PORT_STATS
 49 0.283251222 172.31.24.227 -> 172.31.31.144 OpenFlow 3018 Type: OFPT_MULTIPART_REPLY, OFPMP_FLOW
 50 0.283349631 172.31.31.144 -> 172.31.24.227 TCP 66 6633 → 59658 [ACK] Seq=97 Ack=689 Win=853 Len=0 TSval=2863271 TSecr=391767146
 51 0.283413548 172.31.24.227 -> 172.31.31.144 OpenFlow 6178 Type: OFPT_MULTIPART_REPLY, OFPMP_TABLE
 52 0.283484758 172.31.31.144 -> 172.31.24.227 TCP 66 6633 → 59658 [ACK] Seq=97 Ack=3641 Win=853 Len=0 TSval=2863271 TSecr=391767146
 53 0.283667042 172.31.31.144 -> 172.31.24.227 TCP 66 6633 → 59658 [ACK] Seq=97 Ack=9753 Win=853 Len=0 TSval=2863271 TSecr=391767146
 54 0.335028797 172.31.31.144 -> 172.31.24.227 TCP 82 6633 → 59660 [PSH, ACK] Seq=1 Ack=1 Win=853 Len=16 TSval=2863284 TSecr=391766560
 55 0.335038802 172.31.31.144 -> 172.31.24.227 TCP 146 6633 → 59660 [PSH, ACK] Seq=17 Ack=1 Win=853 Len=80 TSval=2863284 TSecr=391766560
 56 0.335247777 172.31.24.227 -> 172.31.31.144 OpenFlow 6178 Type: OFPT_MULTIPART_REPLY, OFPMP_TABLE
 57 0.335348153 172.31.24.227 -> 172.31.31.144 OpenFlow 642 Type: OFPT_MULTIPART_REPLY, OFPMP_PORT_STATS
 58 0.335411523 172.31.24.227 -> 172.31.31.144 OpenFlow 1146 Type: OFPT_MULTIPART_REPLY, OFPMP_FLOW
 59 0.335490838 172.31.31.144 -> 172.31.24.227 TCP 66 6633 → 59660 [ACK] Seq=97 Ack=6113 Win=853 Len=0 TSval=2863284 TSecr=391767159
 60 0.335550431 172.31.31.144 -> 172.31.24.227 TCP 66 6633 → 59660 [ACK] Seq=97 Ack=6689 Win=853 Len=0 TSval=2863284 TSecr=391767159
 61 0.335652487 172.31.31.144 -> 172.31.24.227 TCP 66 6633 → 59660 [ACK] Seq=97 Ack=7769 Win=853 Len=0 TSval=2863284 TSecr=391767159
 62 0.338041252 172.31.31.144 -> 172.31.24.227 TCP 187 6633 → 59638 [PSH, ACK] Seq=1 Ack=1 Win=853 Len=121 TSval=2863285 TSecr=391767029
 63 0.338091143 172.31.31.144 -> 172.31.24.227 TCP 187 6633 → 59638 [PSH, ACK] Seq=122 Ack=1 Win=853 Len=121 TSval=2863285 TSecr=391767029
 64 0.338169085 172.31.31.144 -> 172.31.24.227 TCP 187 6633 → 59638 [PSH, ACK] Seq=243 Ack=1 Win=853 Len=121 TSval=2863285 TSecr=391767029
 65 0.338223051 172.31.31.144 -> 172.31.24.227 TCP 187 6633 → 59638 [PSH, ACK] Seq=364 Ack=1 Win=853 Len=121 TSval=2863285 TSecr=391767029
 66 0.338314680 172.31.31.144 -> 172.31.24.227 TCP 187 6633 → 59638 [PSH, ACK] Seq=485 Ack=1 Win=853 Len=121 TSval=2863285 TSecr=391767029
 67 0.338320633 172.31.31.144 -> 172.31.24.227 TCP 187 6633 → 59638 [PSH, ACK] Seq=606 Ack=1 Win=853 Len=121 TSval=2863285 TSecr=391767029
 68 0.338475492 172.31.31.144 -> 172.31.24.227 TCP 187 6633 → 59640 [PSH, ACK] Seq=1 Ack=1 Win=853 Len=121 TSval=2863285 TSecr=391767033
 69 0.338482482 172.31.31.144 -> 172.31.24.227 TCP 187 6633 → 59640 [PSH, ACK] Seq=122 Ack=1 Win=853 Len=121 TSval=2863285 TSecr=391767033
 70 0.338511483 172.31.24.227 -> 172.31.31.144 TCP 66 59638 → 6633 [ACK] Seq=1 Ack=727 Win=213 Len=0 TSval=391767160 TSecr=2863285
 71 0.338529350 172.31.31.144 -> 172.31.24.227 TCP 187 6633 → 59640 [PSH, ACK] Seq=243 Ack=1 Win=853 Len=121 TSval=2863285 TSecr=391767033
 72 0.338628608 172.31.31.144 -> 172.31.24.227 TCP 187 6633 → 59640 [PSH, ACK] Seq=364 Ack=1 Win=853 Len=121 TSval=2863285 TSecr=391767033
 73 0.338634959 172.31.31.144 -> 172.31.24.227 TCP 187 6633 → 59640 [PSH, ACK] Seq=485 Ack=1 Win=853 Len=121 TSval=2863285 TSecr=391767033
 74 0.338713494 172.31.31.144 -> 172.31.24.227 TCP 187 6633 → 59640 [PSH, ACK] Seq=606 Ack=1 Win=853 Len=121 TSval=2863285 TSecr=391767033
 75 0.338718877 172.31.31.144 -> 172.31.24.227 TCP 187 6633 → 59640 [PSH, ACK] Seq=727 Ack=1 Win=853 Len=121 TSval=2863285 TSecr=391767033
 76 0.338735252 172.31.24.227 -> 172.31.31.144 OpenFlow 189 Type: OFPT_PACKET_IN
 77 0.338777191 172.31.31.144 -> 172.31.24.227 TCP 187 6633 → 59640 [PSH, ACK] Seq=848 Ack=1 Win=853 Len=121 TSval=2863285 TSecr=391767033
 78 0.338784642 172.31.24.227 -> 172.31.31.144 OpenFlow 189 Type: OFPT_PACKET_IN
 79 0.338809749 172.31.24.227 -> 172.31.31.144 OpenFlow 189 Type: OFPT_PACKET_IN
 80 0.338850019 172.31.31.144 -> 172.31.24.227 TCP 187 6633 → 59642 [PSH, ACK] Seq=1 Ack=1 Win=853 Len=121 TSval=2863285 TSecr=391767043
 81 0.338858903 172.31.24.227 -> 172.31.31.144 OpenFlow 189 Type: OFPT_PACKET_IN
 82 0.338971729 172.31.31.144 -> 172.31.24.227 TCP 187 6633 → 59642 [PSH, ACK] Seq=122 Ack=1 Win=853 Len=121 TSval=2863285 TSecr=391767043
 83 0.338978360 172.31.31.144 -> 172.31.24.227 TCP 66 6633 → 59648 [ACK] Seq=97 Ack=9876 Win=853 Len=0 TSval=2863285 TSecr=391767160
 84 0.338994594 172.31.31.144 -> 172.31.24.227 TCP 187 6633 → 59642 [PSH, ACK] Seq=243 Ack=1 Win=853 Len=121 TSval=2863285 TSecr=391767043
 85 0.339107778 172.31.31.144 -> 172.31.24.227 TCP 66 6633 → 59648 [ACK] Seq=97 Ack=9999 Win=853 Len=0 TSval=2863285 TSecr=391767160
 86 0.339114593 172.31.31.144 -> 172.31.24.227 TCP 66 6633 → 59640 [ACK] Seq=969 Ack=124 Win=853 Len=0 TSval=2863285 TSecr=391767160
 87 0.339117330 172.31.31.144 -> 172.31.24.227 TCP 187 6633 → 59642 [PSH, ACK] Seq=364 Ack=1 Win=853 Len=121 TSval=2863285 TSecr=391767043
 88 0.339120465 172.31.31.144 -> 172.31.24.227 TCP 187 6633 → 59642 [PSH, ACK] Seq=485 Ack=1 Win=853 Len=121 TSval=2863285 TSecr=391767043
 89 0.339122417 172.31.31.144 -> 172.31.24.227 TCP 66 6633 → 59640 [ACK] Seq=969 Ack=247 Win=853 Len=0 TSval=2863285 TSecr=391767160
 90 0.339180904 172.31.31.144 -> 172.31.24.227 TCP 187 6633 → 59642 [PSH, ACK] Seq=606 Ack=1 Win=853 Len=121 TSval=2863285 TSecr=391767043
 91 0.339186523 172.31.31.144 -> 172.31.24.227 TCP 187 6633 → 59642 [PSH, ACK] Seq=727 Ack=1 Win=853 Len=121 TSval=2863285 TSecr=391767043
 92 0.339260723 172.31.31.144 -> 172.31.24.227 TCP 187 6633 → 59642 [PSH, ACK] Seq=848 Ack=1 Win=853 Len=121 TSval=2863285 TSecr=391767043
 93 0.339312126 172.31.31.144 -> 172.31.24.227 TCP 187 6633 → 59642 [PSH, ACK] Seq=969 Ack=1 Win=853 Len=121 TSval=2863285 TSecr=391767043
 94 0.339353004 172.31.31.144 -> 172.31.24.227 TCP 187 6633 → 59642 [PSH, ACK] Seq=1090 Ack=1 Win=853 Len=121 TSval=2863285 TSecr=391767043
 95 0.339373297 172.31.24.227 -> 172.31.31.144 OpenFlow 189 Type: OFPT_PACKET_IN
 96 0.339390401 172.31.24.227 -> 172.31.31.144 OpenFlow 189 Type: OFPT_PACKET_IN
 97 0.339460304 172.31.31.144 -> 172.31.24.227 TCP 187 6633 → 59644 [PSH, ACK] Seq=1 Ack=1 Win=853 Len=121 TSval=2863285 TSecr=391767052
 98 0.339488505 172.31.31.144 -> 172.31.24.227 TCP 187 6633 → 59644 [PSH, ACK] Seq=122 Ack=1 Win=853 Len=121 TSval=2863285 TSecr=391767052
 99 0.339602905 172.31.24.227 -> 172.31.31.144 TCP 66 59644 → 6633 [ACK] Seq=1 Ack=243 Win=213 Len=0 TSval=391767160 TSecr=2863285
100 0.339656021 172.31.31.144 -> 172.31.24.227 TCP 66 6633 → 59638 [ACK] Seq=727 Ack=124 Win=853 Len=0 TSval=2863285 TSecr=391767160
101 0.339666837 172.31.31.144 -> 172.31.24.227 TCP 187 6633 → 59644 [PSH, ACK] Seq=243 Ack=1 Win=853 Len=121 TSval=2863285 TSecr=391767052
102 0.339670487 172.31.31.144 -> 172.31.24.227 TCP 187 6633 → 59644 [PSH, ACK] Seq=364 Ack=1 Win=853 Len=121 TSval=2863285 TSecr=391767052
103 0.339672714 172.31.31.144 -> 172.31.24.227 TCP 66 6633 → 59638 [ACK] Seq=727 Ack=247 Win=853 Len=0 TSval=2863285 TSecr=391767160
104 0.339726648 172.31.31.144 -> 172.31.24.227 TCP 187 6633 → 59644 [PSH, ACK] Seq=485 Ack=1 Win=853 Len=121 TSval=2863285 TSecr=391767052
105 0.339732138 172.31.31.144 -> 172.31.24.227 TCP 187 6633 → 59644 [PSH, ACK] Seq=606 Ack=1 Win=853 Len=121 TSval=2863285 TSecr=391767052
106 0.339775985 172.31.31.144 -> 172.31.24.227 TCP 187 6633 → 59644 [PSH, ACK] Seq=727 Ack=1 Win=853 Len=121 TSval=2863285 TSecr=391767052
107 0.339830795 172.31.31.144 -> 172.31.24.227 TCP 187 6633 → 59644 [PSH, ACK] Seq=848 Ack=1 Win=853 Len=121 TSval=2863285 TSecr=391767160
108 0.340034292 172.31.24.227 -> 172.31.31.144 TCP 66 59644 → 6633 [ACK] Seq=1 Ack=969 Win=213 Len=0 TSval=391767160 TSecr=2863285
109 0.340121935 172.31.24.227 -> 172.31.31.144 OpenFlow 189 Type: OFPT_PACKET_IN
110 0.340142724 172.31.24.227 -> 172.31.31.144 OpenFlow 189 Type: OFPT_PACKET_IN
111 0.340158784 172.31.24.227 -> 172.31.31.144 OpenFlow 189 Type: OFPT_PACKET_IN
112 0.340228109 172.31.24.227 -> 172.31.31.144 OpenFlow 435 Type: OFPT_PACKET_IN
113 0.340300980 172.31.31.144 -> 172.31.24.227 TCP 66 6633 → 59648 [ACK] Seq=97 Ack=10122 Win=853 Len=0 TSval=2863286 TSecr=391767160
114 0.340413233 172.31.31.144 -> 172.31.24.227 TCP 66 6633 → 59648 [ACK] Seq=97 Ack=10245 Win=853 Len=0 TSval=2863286 TSecr=391767160
115 0.340419858 172.31.31.144 -> 172.31.24.227 TCP 66 6633 → 59642 [ACK] Seq=1211 Ack=124 Win=853 Len=0 TSval=2863286 TSecr=391767160
116 0.340422963 172.31.31.144 -> 172.31.24.227 TCP 66 6633 → 59642 [ACK] Seq=1211 Ack=493 Win=853 Len=0 TSval=2863286 TSecr=391767160
117 0.340711680 172.31.24.227 -> 172.31.31.144 OpenFlow 189 Type: OFPT_PACKET_IN
118 0.340732118 172.31.24.227 -> 172.31.31.144 OpenFlow 189 Type: OFPT_PACKET_IN
119 0.340748038 172.31.24.227 -> 172.31.31.144 OpenFlow 189 Type: OFPT_PACKET_IN
120 0.340785741 172.31.24.227 -> 172.31.31.144 OpenFlow 189 Type: OFPT_PACKET_IN
121 0.340846367 172.31.24.227 -> 172.31.31.144 OpenFlow 189 Type: OFPT_PACKET_IN
122 0.340864825 172.31.24.227 -> 172.31.31.144 OpenFlow 189 Type: OFPT_PACKET_IN
123 0.340880130 172.31.24.227 -> 172.31.31.144 OpenFlow 189 Type: OFPT_PACKET_IN
124 0.340926124 172.31.31.144 -> 172.31.24.227 TCP 66 6633 → 59652 [ACK] Seq=97 Ack=8196 Win=853 Len=0 TSval=2863286 TSecr=391767160
125 0.341019392 172.31.24.227 -> 172.31.31.144 OpenFlow 435 Type: OFPT_PACKET_IN
126 0.341039674 172.31.24.227 -> 172.31.31.144 OpenFlow 189 Type: OFPT_PACKET_IN
127 0.341049773 172.31.31.144 -> 172.31.24.227 TCP 66 6633 → 59652 [ACK] Seq=97 Ack=8319 Win=853 Len=0 TSval=2863286 TSecr=391767160
128 0.341054862 172.31.31.144 -> 172.31.24.227 TCP 66 6633 → 59640 [ACK] Seq=969 Ack=370 Win=853 Len=0 TSval=2863286 TSecr=391767160
129 0.341058014 172.31.31.144 -> 172.31.24.227 TCP 66 6633 → 59640 [ACK] Seq=969 Ack=493 Win=853 Len=0 TSval=2863286 TSecr=391767160
130 0.341095230 172.31.31.144 -> 172.31.24.227 TCP 66 6633 → 59650 [ACK] Seq=97 Ack=8420 Win=853 Len=0 TSval=2863286 TSecr=391767161
131 0.341105460 172.31.24.227 -> 172.31.31.144 OpenFlow 189 Type: OFPT_PACKET_IN
132 0.341169599 172.31.31.144 -> 172.31.24.227 TCP 66 6633 → 59650 [ACK] Seq=97 Ack=8543 Win=853 Len=0 TSval=2863286 TSecr=391767161
133 0.341270006 172.31.31.144 -> 172.31.24.227 TCP 66 6633 → 59646 [ACK] Seq=1 Ack=124 Win=853 Len=0 TSval=2863286 TSecr=391767161
134 0.341276138 172.31.31.144 -> 172.31.24.227 TCP 66 6633 → 59646 [ACK] Seq=1 Ack=493 Win=853 Len=0 TSval=2863286 TSecr=391767161
135 0.341336888 172.31.31.144 -> 172.31.24.227 TCP 66 6633 → 59644 [ACK] Seq=969 Ack=124 Win=853 Len=0 TSval=2863286 TSecr=391767161
136 0.341341074 172.31.31.144 -> 172.31.24.227 TCP 66 6633 → 59644 [ACK] Seq=969 Ack=247 Win=853 Len=0 TSval=2863286 TSecr=391767161
137 0.392172395 172.31.31.144 -> 172.31.24.227 TCP 82 6633 → 59662 [PSH, ACK] Seq=1 Ack=1 Win=853 Len=16 TSval=2863299 TSecr=391766585
138 0.392187520 172.31.31.144 -> 172.31.24.227 TCP 146 6633 → 59662 [PSH, ACK] Seq=17 Ack=1 Win=853 Len=80 TSval=2863299 TSecr=391766585
139 0.392465264 172.31.24.227 -> 172.31.31.144 OpenFlow 6178 Type: OFPT_MULTIPART_REPLY, OFPMP_TABLE
140 0.392576445 172.31.24.227 -> 172.31.31.144 OpenFlow 642 Type: OFPT_MULTIPART_REPLY, OFPMP_PORT_STATS
141 0.392640063 172.31.24.227 -> 172.31.31.144 OpenFlow 1770 Type: OFPT_MULTIPART_REPLY, OFPMP_FLOW
142 0.392713310 172.31.31.144 -> 172.31.24.227 TCP 66 6633 → 59662 [ACK] Seq=97 Ack=6113 Win=853 Len=0 TSval=2863299 TSecr=391767173
143 0.392785470 172.31.31.144 -> 172.31.24.227 TCP 66 6633 → 59662 [ACK] Seq=97 Ack=6689 Win=853 Len=0 TSval=2863299 TSecr=391767173
144 0.392846543 172.31.31.144 -> 172.31.24.227 TCP 66 6633 → 59662 [ACK] Seq=97 Ack=8393 Win=853 Len=0 TSval=2863299 TSecr=391767173
145 0.438232774 172.31.31.144 -> 172.31.24.227 OpenFlow 187 Type: OFPT_PACKET_OUT
146 0.438243298 172.31.31.144 -> 172.31.24.227 OpenFlow 187 Type: OFPT_PACKET_OUT
147 0.438246892 172.31.31.144 -> 172.31.24.227 OpenFlow 187 Type: OFPT_PACKET_OUT
148 0.438249446 172.31.31.144 -> 172.31.24.227 OpenFlow 187 Type: OFPT_PACKET_OUT
149 0.438272287 172.31.31.144 -> 172.31.24.227 OpenFlow 187 Type: OFPT_PACKET_OUT
150 0.438315719 172.31.31.144 -> 172.31.24.227 OpenFlow 187 Type: OFPT_PACKET_OUT
151 0.438383738 172.31.31.144 -> 172.31.24.227 OpenFlow 187 Type: OFPT_PACKET_OUT
152 0.438432943 172.31.31.144 -> 172.31.24.227 OpenFlow 187 Type: OFPT_PACKET_OUT
153 0.438489341 172.31.31.144 -> 172.31.24.227 OpenFlow 187 Type: OFPT_PACKET_OUT
154 0.438541660 172.31.31.144 -> 172.31.24.227 OpenFlow 187 Type: OFPT_PACKET_OUT
155 0.438595310 172.31.31.144 -> 172.31.24.227 OpenFlow 187 Type: OFPT_PACKET_OUT
156 0.438650801 172.31.31.144 -> 172.31.24.227 OpenFlow 187 Type: OFPT_PACKET_OUT
157 0.438705682 172.31.31.144 -> 172.31.24.227 OpenFlow 187 Type: OFPT_PACKET_OUT
158 0.438768037 172.31.31.144 -> 172.31.24.227 OpenFlow 187 Type: OFPT_PACKET_OUT
159 0.438814624 172.31.24.227 -> 172.31.31.144 TCP 66 59646 → 6633 [ACK] Seq=493 Ack=727 Win=213 Len=0 TSval=391767185 TSecr=2863310
160 0.438821370 172.31.31.144 -> 172.31.24.227 OpenFlow 187 Type: OFPT_PACKET_OUT
161 0.438897095 172.31.31.144 -> 172.31.24.227 OpenFlow 187 Type: OFPT_PACKET_OUT
162 0.439027475 172.31.24.227 -> 172.31.31.144 OpenFlow 189 Type: OFPT_PACKET_IN
163 0.439048836 172.31.24.227 -> 172.31.31.144 OpenFlow 189 Type: OFPT_PACKET_IN
164 0.439222762 172.31.31.144 -> 172.31.24.227 TCP 66 6633 → 59644 [ACK] Seq=969 Ack=370 Win=853 Len=0 TSval=2863310 TSecr=391767185
165 0.439271301 172.31.31.144 -> 172.31.24.227 TCP 66 6633 → 59644 [ACK] Seq=969 Ack=493 Win=853 Len=0 TSval=2863310 TSecr=391767185
166 0.439572844 172.31.24.227 -> 172.31.31.144 TCP 66 59648 → 6633 [ACK] Seq=10245 Ack=1307 Win=213 Len=0 TSval=391767185 TSecr=2863310
167 0.439648240 172.31.24.227 -> 172.31.31.144 OpenFlow 189 Type: OFPT_PACKET_IN
168 0.439668602 172.31.24.227 -> 172.31.31.144 OpenFlow 189 Type: OFPT_PACKET_IN
169 0.439702153 172.31.24.227 -> 172.31.31.144 OpenFlow 189 Type: OFPT_PACKET_IN
170 0.439727424 172.31.24.227 -> 172.31.31.144 OpenFlow 189 Type: OFPT_PACKET_IN
171 0.439738186 172.31.24.227 -> 172.31.31.144 OpenFlow 189 Type: OFPT_PACKET_IN
172 0.439780526 172.31.24.227 -> 172.31.31.144 OpenFlow 189 Type: OFPT_PACKET_IN
173 0.439787884 172.31.24.227 -> 172.31.31.144 OpenFlow 189 Type: OFPT_PACKET_IN
174 0.439822397 172.31.24.227 -> 172.31.31.144 OpenFlow 189 Type: OFPT_PACKET_IN
175 0.439825357 172.31.31.144 -> 172.31.24.227 TCP 66 6633 → 59642 [ACK] Seq=1211 Ack=616 Win=853 Len=0 TSval=2863310 TSecr=391767185
176 0.439854783 172.31.24.227 -> 172.31.31.144 OpenFlow 189 Type: OFPT_PACKET_IN
177 0.439952544 172.31.24.227 -> 172.31.31.144 OpenFlow 189 Type: OFPT_PACKET_IN
178 0.439956393 172.31.24.227 -> 172.31.31.144 OpenFlow 435 Type: OFPT_PACKET_IN
179 0.439982870 172.31.31.144 -> 172.31.24.227 TCP 66 6633 → 59642 [ACK] Seq=1211 Ack=739 Win=853 Len=0 TSval=2863310 TSecr=391767185
180 0.439988065 172.31.31.144 -> 172.31.24.227 TCP 66 6633 → 59654 [ACK] Seq=97 Ack=8836 Win=853 Len=0 TSval=2863310 TSecr=391767185
181 0.439990813 172.31.31.144 -> 172.31.24.227 TCP 66 6633 → 59654 [ACK] Seq=97 Ack=8959 Win=853 Len=0 TSval=2863310 TSecr=391767185
182 0.439993104 172.31.31.144 -> 172.31.24.227 TCP 66 6633 → 59640 [ACK] Seq=969 Ack=616 Win=853 Len=0 TSval=2863310 TSecr=391767185
183 0.440028852 172.31.24.227 -> 172.31.31.144 OpenFlow 189 Type: OFPT_PACKET_IN
184 0.440116178 172.31.31.144 -> 172.31.24.227 TCP 66 6633 → 59640 [ACK] Seq=969 Ack=739 Win=853 Len=0 TSval=2863311 TSecr=391767185
185 0.440121856 172.31.31.144 -> 172.31.24.227 TCP 66 6633 → 59638 [ACK] Seq=727 Ack=370 Win=853 Len=0 TSval=2863311 TSecr=391767185
186 0.440124537 172.31.31.144 -> 172.31.24.227 TCP 66 6633 → 59650 [ACK] Seq=97 Ack=8666 Win=853 Len=0 TSval=2863311 TSecr=391767185
187 0.440178943 172.31.31.144 -> 172.31.24.227 TCP 66 6633 → 59638 [ACK] Seq=727 Ack=493 Win=853 Len=0 TSval=2863311 TSecr=391767185
188 0.440241418 172.31.31.144 -> 172.31.24.227 TCP 66 6633 → 59658 [ACK] Seq=97 Ack=9876 Win=853 Len=0 TSval=2863311 TSecr=391767185
189 0.440307264 172.31.31.144 -> 172.31.24.227 TCP 66 6633 → 59650 [ACK] Seq=97 Ack=9035 Win=853 Len=0 TSval=2863311 TSecr=391767185
190 0.440310627 172.31.31.144 -> 172.31.24.227 TCP 66 6633 → 59658 [ACK] Seq=97 Ack=9999 Win=853 Len=0 TSval=2863311 TSecr=391767185
191 0.450447515 172.31.31.144 -> 172.31.24.227 TCP 90 6633 → 59664 [PSH, ACK] Seq=1 Ack=1 Win=853 Len=24 TSval=2863313 TSecr=391766585
192 0.450456516 172.31.31.144 -> 172.31.24.227 TCP 138 6633 → 59664 [PSH, ACK] Seq=25 Ack=1 Win=853 Len=72 TSval=2863313 TSecr=391766585
193 0.450583861 172.31.24.227 -> 172.31.31.144 OpenFlow 530 Type: OFPT_MULTIPART_REPLY, OFPMP_PORT_STATS
194 0.450635137 172.31.24.227 -> 172.31.31.144 OpenFlow 938 Type: OFPT_MULTIPART_REPLY, OFPMP_FLOW
195 0.450785758 172.31.31.144 -> 172.31.24.227 TCP 66 6633 → 59664 [ACK] Seq=97 Ack=465 Win=853 Len=0 TSval=2863313 TSecr=391767188
196 0.450824692 172.31.24.227 -> 172.31.31.144 OpenFlow 6178 Type: OFPT_MULTIPART_REPLY, OFPMP_TABLE
197 0.450850377 172.31.31.144 -> 172.31.24.227 TCP 66 6633 → 59664 [ACK] Seq=97 Ack=1337 Win=853 Len=0 TSval=2863313 TSecr=391767188
198 0.451084540 172.31.31.144 -> 172.31.24.227 TCP 66 6633 → 59664 [ACK] Seq=97 Ack=7449 Win=853 Len=0 TSval=2863313 TSecr=391767188
199 0.477873664 172.31.24.227 -> 137.158.125.247 SSH 98 Server: Encrypted packet (len=44)
200 0.514563834 172.31.31.144 -> 172.31.24.227 TCP 82 6633 → 59666 [PSH, ACK] Seq=1 Ack=1 Win=853 Len=16 TSval=2863329 TSecr=391766635
201 0.514575459 172.31.31.144 -> 172.31.24.227 TCP 146 6633 → 59666 [PSH, ACK] Seq=17 Ack=1 Win=853 Len=80 TSval=2863329 TSecr=391766635
202 0.514882447 172.31.24.227 -> 172.31.31.144 OpenFlow 6178 Type: OFPT_MULTIPART_REPLY, OFPMP_TABLE
203 0.514938682 172.31.24.227 -> 172.31.31.144 OpenFlow 1146 Type: OFPT_MULTIPART_REPLY, OFPMP_FLOW
204 0.515022686 172.31.24.227 -> 172.31.31.144 OpenFlow 530 Type: OFPT_MULTIPART_REPLY, OFPMP_PORT_STATS
205 0.515153477 172.31.31.144 -> 172.31.24.227 TCP 66 6633 → 59666 [ACK] Seq=97 Ack=6113 Win=853 Len=0 TSval=2863329 TSecr=391767204
206 0.515161181 172.31.31.144 -> 172.31.24.227 TCP 66 6633 → 59666 [ACK] Seq=97 Ack=7193 Win=853 Len=0 TSval=2863329 TSecr=391767204
207 0.515210906 172.31.31.144 -> 172.31.24.227 TCP 66 6633 → 59666 [ACK] Seq=97 Ack=7657 Win=853 Len=0 TSval=2863329 TSecr=391767204
208 0.538200060 172.31.31.144 -> 172.31.24.227 OpenFlow 187 Type: OFPT_PACKET_OUT
209 0.538211634 172.31.31.144 -> 172.31.24.227 OpenFlow 187 Type: OFPT_PACKET_OUT
210 0.538226859 172.31.31.144 -> 172.31.24.227 OpenFlow 187 Type: OFPT_PACKET_OUT
211 0.538280562 172.31.31.144 -> 172.31.24.227 OpenFlow 187 Type: OFPT_PACKET_OUT
212 0.538321878 172.31.31.144 -> 172.31.24.227 OpenFlow 187 Type: OFPT_PACKET_OUT
213 0.538375092 172.31.31.144 -> 172.31.24.227 OpenFlow 187 Type: OFPT_PACKET_OUT
214 0.538427945 172.31.31.144 -> 172.31.24.227 OpenFlow 187 Type: OFPT_PACKET_OUT
215 0.538490652 172.31.31.144 -> 172.31.24.227 OpenFlow 187 Type: OFPT_PACKET_OUT
216 0.538540169 172.31.31.144 -> 172.31.24.227 OpenFlow 187 Type: OFPT_PACKET_OUT
217 0.538593888 172.31.31.144 -> 172.31.24.227 OpenFlow 187 Type: OFPT_PACKET_OUT
218 0.538659287 172.31.31.144 -> 172.31.24.227 OpenFlow 187 Type: OFPT_PACKET_OUT
219 0.538702879 172.31.31.144 -> 172.31.24.227 OpenFlow 187 Type: OFPT_PACKET_OUT
220 0.538770658 172.31.31.144 -> 172.31.24.227 OpenFlow 187 Type: OFPT_PACKET_OUT
221 0.538821117 172.31.31.144 -> 172.31.24.227 OpenFlow 187 Type: OFPT_PACKET_OUT
222 0.538872287 172.31.31.144 -> 172.31.24.227 OpenFlow 187 Type: OFPT_PACKET_OUT
223 0.538931192 172.31.31.144 -> 172.31.24.227 OpenFlow 187 Type: OFPT_PACKET_OUT
224 0.539097147 172.31.24.227 -> 172.31.31.144 TCP 66 59650 → 6633 [ACK] Seq=9035 Ack=1307 Win=213 Len=0 TSval=391767210 TSecr=2863335
225 0.539174867 172.31.24.227 -> 172.31.31.144 OpenFlow 189 Type: OFPT_PACKET_IN
226 0.539195877 172.31.24.227 -> 172.31.31.144 OpenFlow 189 Type: OFPT_PACKET_IN
227 0.539310709 172.31.24.227 -> 172.31.31.144 OpenFlow 189 Type: OFPT_PACKET_IN
228 0.539330568 172.31.24.227 -> 172.31.31.144 OpenFlow 189 Type: OFPT_PACKET_IN
229 0.539346033 172.31.24.227 -> 172.31.31.144 OpenFlow 189 Type: OFPT_PACKET_IN
230 0.539380114 172.31.31.144 -> 172.31.24.227 TCP 66 6633 → 59646 [ACK] Seq=727 Ack=739 Win=853 Len=0 TSval=2863335 TSecr=391767210
231 0.539390270 172.31.24.227 -> 172.31.31.144 OpenFlow 189 Type: OFPT_PACKET_IN
232 0.539413241 172.31.24.227 -> 172.31.31.144 OpenFlow 189 Type: OFPT_PACKET_IN
233 0.539416500 172.31.24.227 -> 172.31.31.144 OpenFlow 189 Type: OFPT_PACKET_IN
234 0.539465928 172.31.24.227 -> 172.31.31.144 OpenFlow 189 Type: OFPT_PACKET_IN
235 0.539472961 172.31.24.227 -> 172.31.31.144 OpenFlow 189 Type: OFPT_PACKET_IN
236 0.539539012 172.31.31.144 -> 172.31.24.227 TCP 66 6633 → 59648 [ACK] Seq=1307 Ack=10368 Win=853 Len=0 TSval=2863335 TSecr=391767210
237 0.539621390 172.31.31.144 -> 172.31.24.227 TCP 66 6633 → 59642 [ACK] Seq=1211 Ack=862 Win=853 Len=0 TSval=2863335 TSecr=391767210
238 0.539628067 172.31.31.144 -> 172.31.24.227 TCP 66 6633 → 59654 [ACK] Seq=97 Ack=9082 Win=853 Len=0 TSval=2863335 TSecr=391767210
239 0.539699787 172.31.31.144 -> 172.31.24.227 TCP 66 6633 → 59648 [ACK] Seq=1307 Ack=10491 Win=853 Len=0 TSval=2863335 TSecr=391767210
240 0.539706056 172.31.31.144 -> 172.31.24.227 TCP 66 6633 → 59652 [ACK] Seq=823 Ack=8442 Win=853 Len=0 TSval=2863335 TSecr=391767210
241 0.539708868 172.31.31.144 -> 172.31.24.227 TCP 66 6633 → 59642 [ACK] Seq=1211 Ack=985 Win=853 Len=0 TSval=2863335 TSecr=391767210
242 0.539746738 172.31.31.144 -> 172.31.24.227 TCP 66 6633 → 59654 [ACK] Seq=97 Ack=9205 Win=853 Len=0 TSval=2863335 TSecr=391767210
243 0.539865743 172.31.31.144 -> 172.31.24.227 TCP 66 6633 → 59652 [ACK] Seq=823 Ack=8565 Win=853 Len=0 TSval=2863335 TSecr=391767210
244 0.539884406 172.31.24.227 -> 172.31.31.144 OpenFlow 189 Type: OFPT_PACKET_IN
245 0.539904130 172.31.24.227 -> 172.31.31.144 OpenFlow 189 Type: OFPT_PACKET_IN
246 0.539956400 172.31.24.227 -> 172.31.31.144 OpenFlow 189 Type: OFPT_PACKET_IN
247 0.539979599 172.31.24.227 -> 172.31.31.144 OpenFlow 189 Type: OFPT_PACKET_IN
248 0.540118009 172.31.24.227 -> 172.31.31.144 OpenFlow 189 Type: OFPT_PACKET_IN
249 0.540128974 172.31.31.144 -> 172.31.24.227 TCP 66 6633 → 59656 [ACK] Seq=97 Ack=8724 Win=853 Len=0 TSval=2863336 TSecr=391767210
250 0.540136909 172.31.31.144 -> 172.31.24.227 TCP 66 6633 → 59656 [ACK] Seq=97 Ack=8847 Win=853 Len=0 TSval=2863336 TSecr=391767210
251 0.540148782 172.31.24.227 -> 172.31.31.144 OpenFlow 189 Type: OFPT_PACKET_IN
252 0.540209668 172.31.31.144 -> 172.31.24.227 TCP 66 6633 → 59650 [ACK] Seq=1307 Ack=9281 Win=853 Len=0 TSval=2863336 TSecr=391767210
253 0.540312282 172.31.31.144 -> 172.31.24.227 TCP 66 6633 → 59644 [ACK] Seq=969 Ack=616 Win=853 Len=0 TSval=2863336 TSecr=391767210
254 0.540352291 172.31.31.144 -> 172.31.24.227 TCP 66 6633 → 59644 [ACK] Seq=969 Ack=739 Win=853 Len=0 TSval=2863336 TSecr=391767210
255 0.575714410 172.31.31.144 -> 172.31.24.227 TCP 90 6633 → 59668 [PSH, ACK] Seq=1 Ack=1 Win=853 Len=24 TSval=2863344 TSecr=391766685
256 0.575724759 172.31.31.144 -> 172.31.24.227 TCP 138 6633 → 59668 [PSH, ACK] Seq=25 Ack=1 Win=853 Len=72 TSval=2863344 TSecr=391766685
257 0.575962419 172.31.24.227 -> 172.31.31.144 OpenFlow 754 Type: OFPT_MULTIPART_REPLY, OFPMP_PORT_STATS
258 0.576138059 172.31.24.227 -> 172.31.31.144 OpenFlow 6178 Type: OFPT_MULTIPART_REPLY, OFPMP_TABLE
259 0.576205228 172.31.24.227 -> 172.31.31.144 OpenFlow 730 Type: OFPT_MULTIPART_REPLY, OFPMP_FLOW
260 0.576401390 172.31.31.144 -> 172.31.24.227 TCP 66 6633 → 59668 [ACK] Seq=97 Ack=6801 Win=853 Len=0 TSval=2863345 TSecr=391767219
261 0.616086873 172.31.31.144 -> 172.31.24.227 TCP 66 6633 → 59668 [ACK] Seq=97 Ack=7465 Win=853 Len=0 TSval=2863355 TSecr=391767219
262 0.638213338 172.31.31.144 -> 172.31.24.227 OpenFlow 187 Type: OFPT_PACKET_OUT
263 0.638242576 172.31.31.144 -> 172.31.24.227 OpenFlow 187 Type: OFPT_PACKET_OUT
264 0.638312247 172.31.31.144 -> 172.31.24.227 OpenFlow 187 Type: OFPT_PACKET_OUT
265 0.638354885 172.31.31.144 -> 172.31.24.227 OpenFlow 187 Type: OFPT_PACKET_OUT
266 0.638408332 172.31.31.144 -> 172.31.24.227 OpenFlow 187 Type: OFPT_PACKET_OUT
267 0.638475935 172.31.31.144 -> 172.31.24.227 OpenFlow 187 Type: OFPT_PACKET_OUT
268 0.638519235 172.31.31.144 -> 172.31.24.227 OpenFlow 187 Type: OFPT_PACKET_OUT
269 0.638594376 172.31.31.144 -> 172.31.24.227 OpenFlow 187 Type: OFPT_PACKET_OUT
270 0.638631771 172.31.31.144 -> 172.31.24.227 OpenFlow 187 Type: OFPT_PACKET_OUT
271 0.638690654 172.31.31.144 -> 172.31.24.227 OpenFlow 187 Type: OFPT_PACKET_OUT
272 0.638727841 172.31.31.144 -> 172.31.24.227 OpenFlow 187 Type: OFPT_PACKET_OUT
273 0.638783330 172.31.31.144 -> 172.31.24.227 OpenFlow 187 Type: OFPT_PACKET_OUT
274 0.638835506 172.31.31.144 -> 172.31.24.227 OpenFlow 187 Type: OFPT_PACKET_OUT
275 0.638881569 172.31.31.144 -> 172.31.24.227 OpenFlow 187 Type: OFPT_PACKET_OUT
276 0.638939194 172.31.31.144 -> 172.31.24.227 OpenFlow 187 Type: OFPT_PACKET_OUT
277 0.638991065 172.31.31.144 -> 172.31.24.227 OpenFlow 187 Type: OFPT_PACKET_OUT
278 0.639058719 172.31.31.144 -> 172.31.24.227 OpenFlow 187 Type: OFPT_PACKET_OUT
279 0.639098277 172.31.31.144 -> 172.31.24.227 OpenFlow 187 Type: OFPT_PACKET_OUT
280 0.639180473 172.31.24.227 -> 172.31.31.144 TCP 66 59654 → 6633 [ACK] Seq=9205 Ack=1307 Win=213 Len=0 TSval=391767235 TSecr=2863360
281 0.639275842 172.31.24.227 -> 172.31.31.144 OpenFlow 189 Type: OFPT_PACKET_IN
282 0.639296329 172.31.24.227 -> 172.31.31.144 OpenFlow 189 Type: OFPT_PACKET_IN
283 0.639467587 172.31.31.144 -> 172.31.24.227 TCP 66 6633 → 59656 [ACK] Seq=1065 Ack=8970 Win=853 Len=0 TSval=2863360 TSecr=391767235
284 0.639602582 172.31.31.144 -> 172.31.24.227 TCP 66 6633 → 59656 [ACK] Seq=1065 Ack=9093 Win=853 Len=0 TSval=2863360 TSecr=391767235
285 0.639759746 172.31.24.227 -> 172.31.31.144 OpenFlow 189 Type: OFPT_PACKET_IN
286 0.639819688 172.31.31.144 -> 172.31.24.227 TCP 122 6633 → 59670 [PSH, ACK] Seq=1 Ack=1 Win=853 Len=56 TSval=2863360 TSecr=391766686
287 0.639825977 172.31.31.144 -> 172.31.24.227 TCP 106 6633 → 59670 [PSH, ACK] Seq=57 Ack=1 Win=853 Len=40 TSval=2863360 TSecr=391766686
288 0.639832261 172.31.24.227 -> 172.31.31.144 OpenFlow 189 Type: OFPT_PACKET_IN
289 0.639896559 172.31.24.227 -> 172.31.31.144 OpenFlow 189 Type: OFPT_PACKET_IN
290 0.639915201 172.31.24.227 -> 172.31.31.144 OpenFlow 189 Type: OFPT_PACKET_IN
291 0.639930328 172.31.24.227 -> 172.31.31.144 OpenFlow 189 Type: OFPT_PACKET_IN
292 0.639951048 172.31.24.227 -> 172.31.31.144 OpenFlow 189 Type: OFPT_PACKET_IN
293 0.639971868 172.31.24.227 -> 172.31.31.144 OpenFlow 189 Type: OFPT_PACKET_IN
294 0.639995647 172.31.24.227 -> 172.31.31.144 OpenFlow 189 Type: OFPT_PACKET_IN
295 0.639998743 172.31.24.227 -> 172.31.31.144 OpenFlow 189 Type: OFPT_PACKET_IN
296 0.640018586 172.31.24.227 -> 172.31.31.144 OpenFlow 189 Type: OFPT_PACKET_IN
297 0.640025306 172.31.31.144 -> 172.31.24.227 TCP 66 6633 → 59650 [ACK] Seq=1307 Ack=9404 Win=853 Len=0 TSval=2863361 TSecr=391767235
298 0.640047036 172.31.24.227 -> 172.31.31.144 OpenFlow 189 Type: OFPT_PACKET_IN
299 0.640061143 172.31.24.227 -> 172.31.31.144 OpenFlow 189 Type: OFPT_PACKET_IN
300 0.640153841 172.31.24.227 -> 172.31.31.144 OpenFlow 2602 Type: OFPT_MULTIPART_REPLY, OFPMP_FLOW
301 0.640158480 172.31.24.227 -> 172.31.31.144 OpenFlow 189 Type: OFPT_PACKET_IN
302 0.640161070 172.31.24.227 -> 172.31.31.144 OpenFlow 189 Type: OFPT_PACKET_IN
303 0.640261738 172.31.31.144 -> 172.31.24.227 TCP 66 6633 → 59664 [ACK] Seq=97 Ack=7572 Win=853 Len=0 TSval=2863361 TSecr=391767235
304 0.640267999 172.31.31.144 -> 172.31.24.227 TCP 66 6633 → 59664 [ACK] Seq=97 Ack=7695 Win=853 Len=0 TSval=2863361 TSecr=391767235
305 0.640270773 172.31.31.144 -> 172.31.24.227 TCP 66 6633 → 59650 [ACK] Seq=1307 Ack=9527 Win=853 Len=0 TSval=2863361 TSecr=391767235
306 0.640273061 172.31.31.144 -> 172.31.24.227 TCP 66 6633 → 59660 [ACK] Seq=97 Ack=7892 Win=853 Len=0 TSval=2863361 TSecr=391767235
307 0.640275507 172.31.31.144 -> 172.31.24.227 TCP 66 6633 → 59658 [ACK] Seq=97 Ack=10122 Win=853 Len=0 TSval=2863361 TSecr=391767235
308 0.640281939 172.31.24.227 -> 172.31.31.144 OpenFlow 189 Type: OFPT_PACKET_IN
309 0.640288538 172.31.24.227 -> 172.31.31.144 OpenFlow 189 Type: OFPT_PACKET_IN
310 0.640398161 172.31.24.227 -> 172.31.31.144 OpenFlow 754 Type: OFPT_MULTIPART_REPLY, OFPMP_PORT_STATS
311 0.640467307 172.31.24.227 -> 172.31.31.144 OpenFlow 6178 Type: OFPT_MULTIPART_REPLY, OFPMP_TABLE
312 0.640516764 172.31.31.144 -> 172.31.24.227 TCP 66 6633 → 59648 [ACK] Seq=1307 Ack=10614 Win=853 Len=0 TSval=2863361 TSecr=391767235
313 0.640522099 172.31.31.144 -> 172.31.24.227 TCP 66 6633 → 59662 [ACK] Seq=97 Ack=8516 Win=853 Len=0 TSval=2863361 TSecr=391767235
314 0.640524585 172.31.31.144 -> 172.31.24.227 TCP 66 6633 → 59660 [ACK] Seq=97 Ack=8015 Win=853 Len=0 TSval=2863361 TSecr=391767235
315 0.640526867 172.31.31.144 -> 172.31.24.227 TCP 66 6633 → 59654 [ACK] Seq=1307 Ack=9328 Win=853 Len=0 TSval=2863361 TSecr=391767235
316 0.640528931 172.31.31.144 -> 172.31.24.227 TCP 66 6633 → 59652 [ACK] Seq=823 Ack=8688 Win=853 Len=0 TSval=2863361 TSecr=391767235
317 0.640531124 172.31.31.144 -> 172.31.24.227 TCP 66 6633 → 59658 [ACK] Seq=97 Ack=10245 Win=853 Len=0 TSval=2863361 TSecr=391767235
318 0.640823579 172.31.31.144 -> 172.31.24.227 TCP 66 6633 → 59670 [ACK] Seq=97 Ack=2537 Win=853 Len=0 TSval=2863361 TSecr=391767235
319 0.640830874 172.31.31.144 -> 172.31.24.227 TCP 66 6633 → 59648 [ACK] Seq=1307 Ack=10737 Win=853 Len=0 TSval=2863361 TSecr=391767235
320 0.640833749 172.31.31.144 -> 172.31.24.227 TCP 66 6633 → 59662 [ACK] Seq=97 Ack=8639 Win=853 Len=0 TSval=2863361 TSecr=391767235
321 0.640835968 172.31.31.144 -> 172.31.24.227 TCP 66 6633 → 59654 [ACK] Seq=1307 Ack=9451 Win=853 Len=0 TSval=2863361 TSecr=391767235
322 0.640838228 172.31.31.144 -> 172.31.24.227 TCP 66 6633 → 59652 [ACK] Seq=823 Ack=8811 Win=853 Len=0 TSval=2863361 TSecr=391767235
323 0.640840494 172.31.31.144 -> 172.31.24.227 TCP 66 6633 → 59670 [ACK] Seq=97 Ack=3225 Win=853 Len=0 TSval=2863361 TSecr=391767235
324 0.640963761 172.31.31.144 -> 172.31.24.227 TCP 66 6633 → 59670 [ACK] Seq=97 Ack=9337 Win=853 Len=0 TSval=2863361 TSecr=391767235
325 0.686013587 137.158.125.247 -> 172.31.24.227 TCP 54 63468 → 22 [ACK] Seq=1 Ack=437 Win=32346 Len=0
326 0.703170394 172.31.31.144 -> 172.31.24.227 TCP 122 6633 → 59672 [PSH, ACK] Seq=1 Ack=1 Win=853 Len=56 TSval=2863376 TSecr=391766685
327 0.703180236 172.31.31.144 -> 172.31.24.227 TCP 106 6633 → 59672 [PSH, ACK] Seq=57 Ack=1 Win=853 Len=40 TSval=2863376 TSecr=391766685
328 0.703455107 172.31.24.227 -> 172.31.31.144 OpenFlow 1354 Type: OFPT_MULTIPART_REPLY, OFPMP_FLOW
329 0.703575172 172.31.24.227 -> 172.31.31.144 OpenFlow 530 Type: OFPT_MULTIPART_REPLY, OFPMP_PORT_STATS
330 0.703695830 172.31.31.144 -> 172.31.24.227 TCP 66 6633 → 59672 [ACK] Seq=97 Ack=1289 Win=853 Len=0 TSval=2863376 TSecr=391767251
331 0.703749028 172.31.24.227 -> 172.31.31.144 OpenFlow 6178 Type: OFPT_MULTIPART_REPLY, OFPMP_TABLE
332 0.703786569 172.31.31.144 -> 172.31.24.227 TCP 66 6633 → 59672 [ACK] Seq=97 Ack=1753 Win=853 Len=0 TSval=2863376 TSecr=391767251
333 0.704004217 172.31.31.144 -> 172.31.24.227 TCP 66 6633 → 59672 [ACK] Seq=97 Ack=7865 Win=853 Len=0 TSval=2863377 TSecr=391767251
334 0.738464912 172.31.31.144 -> 172.31.24.227 OpenFlow 187 Type: OFPT_PACKET_OUT
335 0.738474077 172.31.31.144 -> 172.31.24.227 OpenFlow 187 Type: OFPT_PACKET_OUT
336 0.738477574 172.31.31.144 -> 172.31.24.227 OpenFlow 187 Type: OFPT_PACKET_OUT
337 0.738504436 172.31.31.144 -> 172.31.24.227 OpenFlow 187 Type: OFPT_PACKET_OUT
338 0.738550231 172.31.31.144 -> 172.31.24.227 OpenFlow 187 Type: OFPT_PACKET_OUT
339 0.738630976 172.31.31.144 -> 172.31.24.227 OpenFlow 187 Type: OFPT_PACKET_OUT
340 0.738684329 172.31.31.144 -> 172.31.24.227 OpenFlow 187 Type: OFPT_PACKET_OUT
341 0.738742016 172.31.31.144 -> 172.31.24.227 OpenFlow 187 Type: OFPT_PACKET_OUT
342 0.738780121 172.31.31.144 -> 172.31.24.227 OpenFlow 187 Type: OFPT_PACKET_OUT
343 0.738847232 172.31.31.144 -> 172.31.24.227 OpenFlow 187 Type: OFPT_PACKET_OUT
344 0.738878039 172.31.31.144 -> 172.31.24.227 OpenFlow 187 Type: OFPT_PACKET_OUT
345 0.738923071 172.31.31.144 -> 172.31.24.227 OpenFlow 187 Type: OFPT_PACKET_OUT
346 0.738982344 172.31.31.144 -> 172.31.24.227 OpenFlow 187 Type: OFPT_PACKET_OUT
347 0.739040611 172.31.31.144 -> 172.31.24.227 OpenFlow 187 Type: OFPT_PACKET_OUT
348 0.739097066 172.31.31.144 -> 172.31.24.227 OpenFlow 187 Type: OFPT_PACKET_OUT
349 0.739139104 172.31.31.144 -> 172.31.24.227 OpenFlow 187 Type: OFPT_PACKET_OUT
350 0.739194479 172.31.31.144 -> 172.31.24.227 OpenFlow 187 Type: OFPT_PACKET_OUT
351 0.739255982 172.31.31.144 -> 172.31.24.227 OpenFlow 187 Type: OFPT_PACKET_OUT
352 0.739298525 172.31.24.227 -> 172.31.31.144 TCP 66 59658 → 6633 [ACK] Seq=10245 Ack=1307 Win=213 Len=0 TSval=391767260 TSecr=2863385
353 0.739375725 172.31.24.227 -> 172.31.31.144 OpenFlow 189 Type: OFPT_PACKET_IN
354 0.739395481 172.31.24.227 -> 172.31.31.144 OpenFlow 189 Type: OFPT_PACKET_IN
355 0.739427630 172.31.24.227 -> 172.31.31.144 OpenFlow 189 Type: OFPT_PACKET_IN
356 0.739456671 172.31.24.227 -> 172.31.31.144 OpenFlow 189 Type: OFPT_PACKET_IN
357 0.739517972 172.31.24.227 -> 172.31.31.144 OpenFlow 189 Type: OFPT_PACKET_IN
358 0.739524169 172.31.24.227 -> 172.31.31.144 OpenFlow 189 Type: OFPT_PACKET_IN
359 0.739544600 172.31.24.227 -> 172.31.31.144 OpenFlow 189 Type: OFPT_PACKET_IN
360 0.739616978 172.31.31.144 -> 172.31.24.227 TCP 66 6633 → 59648 [ACK] Seq=1307 Ack=10860 Win=853 Len=0 TSval=2863385 TSecr=391767260
361 0.739629848 172.31.24.227 -> 172.31.31.144 OpenFlow 189 Type: OFPT_PACKET_IN
362 0.739690329 172.31.24.227 -> 172.31.31.144 OpenFlow 189 Type: OFPT_PACKET_IN
363 0.739714744 172.31.31.144 -> 172.31.24.227 TCP 66 6633 → 59674 [ACK] Seq=1 Ack=124 Win=853 Len=0 TSval=2863385 TSecr=391767260
364 0.739720779 172.31.31.144 -> 172.31.24.227 TCP 66 6633 → 59654 [ACK] Seq=1307 Ack=9574 Win=853 Len=0 TSval=2863385 TSecr=391767260
365 0.739762467 172.31.24.227 -> 172.31.31.144 OpenFlow 189 Type: OFPT_PACKET_IN
