  1 0.000000000 41.177.127.217 -> 172.31.24.227 TCP 54 58416 → 22 [ACK] Seq=1 Ack=1 Win=32698 Len=0
  2 0.002566542 41.177.127.217 -> 172.31.24.227 TCP 54 58416 → 22 [ACK] Seq=1 Ack=297 Win=32550 Len=0
  3 0.056996374 41.177.127.217 -> 172.31.24.227 TCP 54 58416 → 22 [ACK] Seq=1 Ack=333 Win=32532 Len=0
  4 0.075949161 41.177.127.217 -> 172.31.24.227 TCP 54 58416 → 22 [ACK] Seq=1 Ack=429 Win=32484 Len=0
  5 0.652778046 172.31.24.227 -> 41.177.127.217 SSH 90 Server: Encrypted packet (len=36)
  6 0.923600649 41.177.127.217 -> 172.31.24.227 TCP 54 58416 → 22 [ACK] Seq=1 Ack=465 Win=32466 Len=0
  7 1.156663340 172.31.24.227 -> 41.177.127.217 SSH 98 Server: Encrypted packet (len=44)
  8 1.387698875 221.194.44.195 -> 172.31.24.227 TCP 74 58423 → 22 [SYN] Seq=0 Win=29200 Len=0 MSS=1460 SACK_PERM=1 TSval=2676479 TSecr=0 WS=128
  9 1.387748394 172.31.24.227 -> 221.194.44.195 TCP 74 22 → 58423 [SYN, ACK] Seq=0 Ack=1 Win=26847 Len=0 MSS=8961 SACK_PERM=1 TSval=118980718 TSecr=2676479 WS=512
 10 1.418963687 41.177.127.217 -> 172.31.24.227 TCP 54 58416 → 22 [ACK] Seq=1 Ack=509 Win=32444 Len=0
 11 1.662327122 172.31.24.227 -> 41.177.127.217 SSH 98 Server: Encrypted packet (len=44)
 12 1.792047158 221.194.44.195 -> 172.31.24.227 TCP 66 58423 → 22 [ACK] Seq=1 Ack=1 Win=29312 Len=0 TSval=2676593 TSecr=118980718
 13 1.804840486 172.31.24.227 -> 221.194.44.195 SSH 107 Server: Protocol (SSH-2.0-OpenSSH_7.2p2 Ubuntu-4ubuntu2.1)
 14 1.899584971 41.177.127.217 -> 172.31.24.227 TCP 54 58416 → 22 [ACK] Seq=1 Ack=553 Win=32422 Len=0
 15 2.000296545 221.194.44.195 -> 172.31.24.227 SSH 81 Client: Protocol (SSH-2.0-PUTTY)
 16 2.000344122 172.31.24.227 -> 221.194.44.195 TCP 66 22 → 58423 [ACK] Seq=42 Ack=16 Win=27136 Len=0 TSval=118980871 TSecr=2676641
 17 2.166358488 172.31.24.227 -> 41.177.127.217 SSH 98 Server: Encrypted packet (len=44)
 18 2.222918984 221.194.44.195 -> 172.31.24.227 TCP 66 58423 → 22 [ACK] Seq=16 Ack=42 Win=29312 Len=0 TSval=2676697 TSecr=118980822
 19 2.222949852 172.31.24.227 -> 221.194.44.195 SSHv2 1042 Server: Key Exchange Init
 20 2.429669051 41.177.127.217 -> 172.31.24.227 TCP 54 58416 → 22 [ACK] Seq=1 Ack=597 Win=32400 Len=0
 21 2.520143890 172.31.31.144 -> 172.31.24.227 TCP 90 6633 → 39486 [PSH, ACK] Seq=1 Ack=1 Win=853 Len=24 TSval=420391 TSecr=118980304
 22 2.520175447 172.31.31.144 -> 172.31.24.227 TCP 90 6633 → 39490 [PSH, ACK] Seq=1 Ack=1 Win=853 Len=24 TSval=420391 TSecr=118980305
 23 2.520180769 172.31.31.144 -> 172.31.24.227 TCP 106 6633 → 39486 [PSH, ACK] Seq=25 Ack=1 Win=853 Len=40 TSval=420391 TSecr=118980304
 24 2.520186847 172.31.31.144 -> 172.31.24.227 TCP 90 6633 → 39492 [PSH, ACK] Seq=1 Ack=1 Win=853 Len=24 TSval=420391 TSecr=118980304
 25 2.520210699 172.31.31.144 -> 172.31.24.227 TCP 106 6633 → 39492 [PSH, ACK] Seq=25 Ack=1 Win=853 Len=40 TSval=420391 TSecr=118980304
 26 2.520214732 172.31.31.144 -> 172.31.24.227 TCP 90 6633 → 39458 [PSH, ACK] Seq=1 Ack=1 Win=853 Len=24 TSval=420391 TSecr=118980303
 27 2.520219586 172.31.31.144 -> 172.31.24.227 TCP 90 6633 → 39452 [PSH, ACK] Seq=1 Ack=1 Win=853 Len=24 TSval=420391 TSecr=118980303
 28 2.520228223 172.31.31.144 -> 172.31.24.227 TCP 90 6633 → 39476 [PSH, ACK] Seq=1 Ack=1 Win=853 Len=24 TSval=420391 TSecr=118980301
 29 2.520250609 172.31.31.144 -> 172.31.24.227 TCP 82 6633 → 39458 [PSH, ACK] Seq=25 Ack=1 Win=853 Len=16 TSval=420391 TSecr=118980303
 30 2.520277998 172.31.31.144 -> 172.31.24.227 TCP 106 6633 → 39476 [PSH, ACK] Seq=25 Ack=1 Win=853 Len=40 TSval=420391 TSecr=118980301
 31 2.520304249 172.31.31.144 -> 172.31.24.227 TCP 106 6633 → 39490 [PSH, ACK] Seq=25 Ack=1 Win=853 Len=40 TSval=420391 TSecr=118980305
 32 2.520321165 172.31.31.144 -> 172.31.24.227 TCP 90 6633 → 39458 [PSH, ACK] Seq=41 Ack=1 Win=853 Len=24 TSval=420391 TSecr=118980303
 33 2.520382344 172.31.31.144 -> 172.31.24.227 TCP 106 6633 → 39452 [PSH, ACK] Seq=25 Ack=1 Win=853 Len=40 TSval=420391 TSecr=118980303
 34 2.520563059 172.31.24.227 -> 172.31.31.144 OpenFlow 82 Type: OFPT_MULTIPART_REPLY, OFPMP_GROUP
 35 2.520590426 172.31.24.227 -> 172.31.31.144 OpenFlow 98 Type: OFPT_MULTIPART_REPLY, OFPMP_METER
 36 2.520619712 172.31.24.227 -> 172.31.31.144 OpenFlow 82 Type: OFPT_MULTIPART_REPLY, OFPMP_GROUP
 37 2.520641594 172.31.24.227 -> 172.31.31.144 OpenFlow 98 Type: OFPT_MULTIPART_REPLY, OFPMP_METER
 38 2.520695491 172.31.24.227 -> 172.31.31.144 OpenFlow 82 Type: OFPT_MULTIPART_REPLY, OFPMP_GROUP
 39 2.520725931 172.31.24.227 -> 172.31.31.144 OpenFlow 98 Type: OFPT_MULTIPART_REPLY, OFPMP_METER
 40 2.520761303 172.31.24.227 -> 172.31.31.144 OpenFlow 82 Type: OFPT_MULTIPART_REPLY, OFPMP_GROUP
 41 2.520780537 172.31.24.227 -> 172.31.31.144 OpenFlow 98 Type: OFPT_MULTIPART_REPLY, OFPMP_METER
 42 2.520794879 172.31.24.227 -> 172.31.31.144 OpenFlow 82 Type: OFPT_MULTIPART_REPLY, OFPMP_GROUP
 43 2.520802900 172.31.31.144 -> 172.31.24.227 TCP 66 6633 → 39452 [ACK] Seq=65 Ack=17 Win=853 Len=0 TSval=420391 TSecr=118981001
 44 2.520823960 172.31.24.227 -> 172.31.31.144 OpenFlow 82 Type: OFPT_MULTIPART_REPLY, OFPMP_GROUP
 45 2.520831286 172.31.24.227 -> 172.31.31.144 OpenFlow 98 Type: OFPT_MULTIPART_REPLY, OFPMP_METER
 46 2.520851542 172.31.31.144 -> 172.31.24.227 TCP 66 6633 → 39452 [ACK] Seq=65 Ack=49 Win=853 Len=0 TSval=420391 TSecr=118981001
 47 2.520855539 172.31.31.144 -> 172.31.24.227 TCP 66 6633 → 39458 [ACK] Seq=65 Ack=17 Win=853 Len=0 TSval=420391 TSecr=118981001
 48 2.520876743 172.31.24.227 -> 172.31.31.144 OpenFlow 98 Type: OFPT_MULTIPART_REPLY, OFPMP_METER
 49 2.520899124 172.31.31.144 -> 172.31.24.227 TCP 66 6633 → 39458 [ACK] Seq=65 Ack=49 Win=853 Len=0 TSval=420391 TSecr=118981001
 50 2.520954623 172.31.31.144 -> 172.31.24.227 TCP 66 6633 → 39486 [ACK] Seq=65 Ack=17 Win=853 Len=0 TSval=420391 TSecr=118981001
 51 2.520980864 172.31.31.144 -> 172.31.24.227 TCP 66 6633 → 39486 [ACK] Seq=65 Ack=49 Win=853 Len=0 TSval=420391 TSecr=118981001
 52 2.521000136 172.31.31.144 -> 172.31.24.227 TCP 66 6633 → 39476 [ACK] Seq=65 Ack=49 Win=853 Len=0 TSval=420391 TSecr=118981001
 53 2.521046404 172.31.31.144 -> 172.31.24.227 TCP 66 6633 → 39492 [ACK] Seq=65 Ack=17 Win=853 Len=0 TSval=420391 TSecr=118981001
 54 2.521066913 172.31.31.144 -> 172.31.24.227 TCP 66 6633 → 39490 [ACK] Seq=65 Ack=49 Win=853 Len=0 TSval=420391 TSecr=118981001
 55 2.521087102 172.31.31.144 -> 172.31.24.227 TCP 66 6633 → 39492 [ACK] Seq=65 Ack=49 Win=853 Len=0 TSval=420391 TSecr=118981001
 56 2.575617595 172.31.31.144 -> 172.31.24.227 OpenFlow 90 Type: OFPT_MULTIPART_REQUEST, OFPMP_PORT_STATS
 57 2.575978579 172.31.24.227 -> 172.31.31.144 OpenFlow 642 Type: OFPT_MULTIPART_REPLY, OFPMP_PORT_STATS
 58 2.576274270 172.31.31.144 -> 172.31.24.227 TCP 66 6633 → 39486 [ACK] Seq=89 Ack=625 Win=853 Len=0 TSval=420405 TSecr=118981015
 59 2.578783497 172.31.31.144 -> 172.31.24.227 OpenFlow 122 Type: OFPT_MULTIPART_REQUEST, OFPMP_FLOW
 60 2.578988485 172.31.24.227 -> 172.31.31.144 OpenFlow 2010 Type: OFPT_MULTIPART_REPLY, OFPMP_FLOW
 61 2.580017194 172.31.31.144 -> 172.31.24.227 OpenFlow 82 Type: OFPT_MULTIPART_REQUEST, OFPMP_TABLE
 62 2.580314549 172.31.24.227 -> 172.31.31.144 OpenFlow 6178 Type: OFPT_MULTIPART_REPLY, OFPMP_TABLE
 63 2.591211971 172.31.31.144 -> 172.31.24.227 OpenFlow 90 Type: OFPT_MULTIPART_REQUEST, OFPMP_PORT_STATS
 64 2.592720558 172.31.24.227 -> 172.31.31.144 OpenFlow 754 Type: OFPT_MULTIPART_REPLY, OFPMP_PORT_STATS
 65 2.594418692 172.31.31.144 -> 172.31.24.227 OpenFlow 122 Type: OFPT_MULTIPART_REQUEST, OFPMP_FLOW
 66 2.595554960 172.31.31.144 -> 172.31.24.227 OpenFlow 82 Type: OFPT_MULTIPART_REQUEST, OFPMP_TABLE
 67 2.598746540 172.31.31.144 -> 172.31.24.227 OpenFlow 90 Type: OFPT_MULTIPART_REQUEST, OFPMP_PORT_STATS
 68 2.598754233 172.31.31.144 -> 172.31.24.227 OpenFlow 122 Type: OFPT_MULTIPART_REQUEST, OFPMP_FLOW
 69 2.599985877 172.31.31.144 -> 172.31.24.227 OpenFlow 82 Type: OFPT_MULTIPART_REQUEST, OFPMP_TABLE
 70 2.604043496 172.31.31.144 -> 172.31.24.227 TCP 82 [TCP Retransmission] 6633 → 39490 [PSH, ACK] Seq=145 Ack=737 Win=853 Len=16 TSval=420412 TSecr=118981019
 71 2.604051514 172.31.24.227 -> 172.31.31.144 TCP 78 39490 → 6633 [ACK] Seq=737 Ack=161 Win=59 Len=0 TSval=118981022 TSecr=420409 SLE=145 SRE=161
 72 2.605164626 172.31.31.144 -> 172.31.24.227 OpenFlow 122 Type: OFPT_MULTIPART_REQUEST, OFPMP_FLOW
 73 2.605226852 172.31.31.144 -> 172.31.24.227 OpenFlow 106 Type: OFPT_MULTIPART_REQUEST, OFPMP_TABLE
 74 2.606802615 172.31.24.227 -> 172.31.31.144 OpenFlow 2634 Type: OFPT_MULTIPART_REPLY, OFPMP_FLOW
 75 2.606967338 172.31.24.227 -> 172.31.31.144 OpenFlow 1314 Type: OFPT_MULTIPART_REPLY, OFPMP_PORT_STATS
 76 2.607116316 172.31.31.144 -> 172.31.24.227 TCP 66 6633 → 39458 [ACK] Seq=161 Ack=2617 Win=853 Len=0 TSval=420412 TSecr=118981022
 77 2.607135641 172.31.24.227 -> 172.31.31.144 OpenFlow 6178 Type: OFPT_MULTIPART_REPLY, OFPMP_TABLE
 78 2.607190001 172.31.31.144 -> 172.31.24.227 TCP 66 6633 → 39458 [ACK] Seq=161 Ack=3865 Win=853 Len=0 TSval=420412 TSecr=118981022
 79 2.607227338 172.31.24.227 -> 172.31.31.144 OpenFlow 146 Type: OFPT_PORT_STATUS
 80 2.607284920 172.31.24.227 -> 172.31.31.144 OpenFlow 146 Type: OFPT_PORT_STATUS
 81 2.607384176 172.31.24.227 -> 172.31.31.144 OpenFlow 1178 Type: OFPT_MULTIPART_REPLY, OFPMP_FLOW
 82 2.607453908 172.31.31.144 -> 172.31.24.227 TCP 66 6633 → 39458 [ACK] Seq=161 Ack=9977 Win=853 Len=0 TSval=420412 TSecr=118981022
 83 2.607498842 172.31.31.144 -> 172.31.24.227 TCP 66 6633 → 39482 [ACK] Seq=1 Ack=81 Win=853 Len=0 TSval=420412 TSecr=118981022
 84 2.607554716 172.31.24.227 -> 172.31.31.144 OpenFlow 6178 Type: OFPT_MULTIPART_REPLY, OFPMP_TABLE
 85 2.607688454 172.31.24.227 -> 172.31.31.144 OpenFlow 754 Type: OFPT_MULTIPART_REPLY, OFPMP_PORT_STATS
 86 2.607737001 172.31.24.227 -> 172.31.31.144 OpenFlow 1178 Type: OFPT_MULTIPART_REPLY, OFPMP_FLOW
 87 2.607811409 172.31.31.144 -> 172.31.24.227 TCP 66 6633 → 39490 [ACK] Seq=161 Ack=7961 Win=853 Len=0 TSval=420412 TSecr=118981022
 88 2.607884707 172.31.24.227 -> 172.31.31.144 OpenFlow 6178 Type: OFPT_MULTIPART_REPLY, OFPMP_TABLE
 89 2.607949732 172.31.31.144 -> 172.31.24.227 TCP 66 6633 → 39492 [ACK] Seq=161 Ack=737 Win=853 Len=0 TSval=420412 TSecr=118981023
 90 2.607954561 172.31.31.144 -> 172.31.24.227 TCP 66 6633 → 39492 [ACK] Seq=161 Ack=1849 Win=853 Len=0 TSval=420413 TSecr=118981023
 91 2.608153411 172.31.31.144 -> 172.31.24.227 TCP 66 6633 → 39492 [ACK] Seq=161 Ack=7961 Win=853 Len=0 TSval=420413 TSecr=118981023
 92 2.608300028 172.31.31.144 -> 172.31.24.227 OpenFlow 122 Type: OFPT_MULTIPART_REQUEST, OFPMP_FLOW
 93 2.608392435 172.31.31.144 -> 172.31.24.227 OpenFlow 90 Type: OFPT_MULTIPART_REQUEST, OFPMP_PORT_STATS
 94 2.609526990 172.31.31.144 -> 172.31.24.227 OpenFlow 82 Type: OFPT_MULTIPART_REQUEST, OFPMP_TABLE
 95 2.611909337 172.31.24.227 -> 172.31.31.144 OpenFlow 2010 Type: OFPT_MULTIPART_REPLY, OFPMP_FLOW
 96 2.611981353 172.31.24.227 -> 172.31.31.144 OpenFlow 530 Type: OFPT_MULTIPART_REPLY, OFPMP_PORT_STATS
 97 2.612134840 172.31.24.227 -> 172.31.31.144 OpenFlow 6178 Type: OFPT_MULTIPART_REPLY, OFPMP_TABLE
 98 2.612295367 172.31.31.144 -> 172.31.24.227 TCP 66 6633 → 39476 [ACK] Seq=161 Ack=2457 Win=853 Len=0 TSval=420414 TSecr=118981024
 99 2.614760455 172.31.31.144 -> 172.31.24.227 OpenFlow 90 Type: OFPT_MULTIPART_REQUEST, OFPMP_PORT_STATS
100 2.614806149 172.31.31.144 -> 172.31.24.227 OpenFlow 122 Type: OFPT_MULTIPART_REQUEST, OFPMP_FLOW
101 2.614934211 172.31.24.227 -> 172.31.31.144 OpenFlow 866 Type: OFPT_MULTIPART_REPLY, OFPMP_PORT_STATS
102 2.615015765 172.31.24.227 -> 172.31.31.144 OpenFlow 3258 Type: OFPT_MULTIPART_REPLY, OFPMP_FLOW
103 2.615178095 172.31.31.144 -> 172.31.24.227 TCP 66 6633 → 39452 [ACK] Seq=145 Ack=849 Win=853 Len=0 TSval=420414 TSecr=118981024
104 2.615290245 172.31.31.144 -> 172.31.24.227 TCP 66 6633 → 39452 [ACK] Seq=145 Ack=4041 Win=853 Len=0 TSval=420414 TSecr=118981024
105 2.615949871 172.31.31.144 -> 172.31.24.227 OpenFlow 82 Type: OFPT_MULTIPART_REQUEST, OFPMP_TABLE
106 2.616150619 172.31.24.227 -> 172.31.31.144 OpenFlow 6178 Type: OFPT_MULTIPART_REPLY, OFPMP_TABLE
107 2.619129107 172.31.31.144 -> 172.31.24.227 TCP 90 6633 → 39480 [PSH, ACK] Seq=1 Ack=1 Win=853 Len=24 TSval=420415 TSecr=118980305
108 2.619164636 172.31.31.144 -> 172.31.24.227 TCP 138 6633 → 39480 [PSH, ACK] Seq=25 Ack=1 Win=853 Len=72 TSval=420415 TSecr=118980305
109 2.619313247 172.31.31.144 -> 172.31.24.227 TCP 90 6633 → 39480 [PSH, ACK] Seq=97 Ack=1 Win=853 Len=24 TSval=420415 TSecr=118980305
110 2.619333019 172.31.31.144 -> 172.31.24.227 TCP 106 6633 → 39480 [PSH, ACK] Seq=121 Ack=1 Win=853 Len=40 TSval=420415 TSecr=118980305
111 2.619361456 172.31.24.227 -> 172.31.31.144 OpenFlow 866 Type: OFPT_MULTIPART_REPLY, OFPMP_PORT_STATS
112 2.619429576 172.31.31.144 -> 172.31.24.227 TCP 90 6633 → 39464 [PSH, ACK] Seq=1 Ack=1 Win=853 Len=24 TSval=420415 TSecr=118980303
113 2.619434569 172.31.31.144 -> 172.31.24.227 TCP 106 6633 → 39464 [PSH, ACK] Seq=25 Ack=1 Win=853 Len=40 TSval=420415 TSecr=118980303
114 2.619438475 172.31.24.227 -> 172.31.31.144 OpenFlow 1386 Type: OFPT_MULTIPART_REPLY, OFPMP_FLOW
115 2.619455316 172.31.31.144 -> 172.31.24.227 OpenFlow 90 Type: OFPT_MULTIPART_REQUEST, OFPMP_GROUP
116 2.619481853 172.31.31.144 -> 172.31.24.227 TCP 90 6633 → 39446 [PSH, ACK] Seq=1 Ack=1 Win=853 Len=24 TSval=420415 TSecr=118980304
117 2.619495865 172.31.31.144 -> 172.31.24.227 TCP 90 6633 → 39462 [PSH, ACK] Seq=1 Ack=1 Win=853 Len=24 TSval=420415 TSecr=118980305
118 2.619515706 172.31.31.144 -> 172.31.24.227 TCP 90 6633 → 39484 [PSH, ACK] Seq=1 Ack=1 Win=853 Len=24 TSval=420415 TSecr=118980303
119 2.619520205 172.31.24.227 -> 172.31.31.144 TCP 66 39484 → 6633 [ACK] Seq=1 Ack=25 Win=310 Len=0 TSval=118981025 TSecr=420415
120 2.619538908 172.31.31.144 -> 172.31.24.227 OpenFlow 106 Type: OFPT_MULTIPART_REQUEST, OFPMP_METER
121 2.619564106 172.31.31.144 -> 172.31.24.227 TCP 106 6633 → 39446 [PSH, ACK] Seq=25 Ack=1 Win=853 Len=40 TSval=420415 TSecr=118980304
122 2.619582323 172.31.31.144 -> 172.31.24.227 TCP 90 6633 → 39478 [PSH, ACK] Seq=1 Ack=1 Win=853 Len=24 TSval=420415 TSecr=118980305
123 2.619600809 172.31.31.144 -> 172.31.24.227 TCP 90 6633 → 39450 [PSH, ACK] Seq=1 Ack=1 Win=853 Len=24 TSval=420415 TSecr=118980305
124 2.619622915 172.31.31.144 -> 172.31.24.227 TCP 106 6633 → 39462 [PSH, ACK] Seq=25 Ack=1 Win=853 Len=40 TSval=420415 TSecr=118980305
125 2.619640411 172.31.24.227 -> 172.31.31.144 OpenFlow 6178 Type: OFPT_MULTIPART_REPLY, OFPMP_TABLE
126 2.619648324 172.31.31.144 -> 172.31.24.227 TCP 106 6633 → 39484 [PSH, ACK] Seq=25 Ack=1 Win=853 Len=40 TSval=420415 TSecr=118980303
127 2.619651234 172.31.24.227 -> 172.31.31.144 TCP 66 39484 → 6633 [ACK] Seq=1 Ack=65 Win=310 Len=0 TSval=118981025 TSecr=420415
128 2.619682757 172.31.24.227 -> 172.31.31.144 OpenFlow 98 Type: OFPT_MULTIPART_REPLY, OFPMP_GROUP_DESC
129 2.619714735 172.31.24.227 -> 172.31.31.144 OpenFlow 82 Type: OFPT_MULTIPART_REPLY, OFPMP_GROUP
130 2.619730420 172.31.31.144 -> 172.31.24.227 TCP 90 6633 → 39454 [PSH, ACK] Seq=1 Ack=1 Win=853 Len=24 TSval=420415 TSecr=118980305
131 2.619734689 172.31.31.144 -> 172.31.24.227 TCP 106 6633 → 39478 [PSH, ACK] Seq=25 Ack=1 Win=853 Len=40 TSval=420415 TSecr=118980305
132 2.619736501 172.31.31.144 -> 172.31.24.227 OpenFlow 90 Type: OFPT_MULTIPART_REQUEST, OFPMP_GROUP
133 2.619748762 172.31.24.227 -> 172.31.31.144 OpenFlow 82 Type: OFPT_MULTIPART_REPLY, OFPMP_GROUP
134 2.619764781 172.31.24.227 -> 172.31.31.144 OpenFlow 82 Type: OFPT_MULTIPART_REPLY, OFPMP_METER
135 2.619766573 172.31.24.227 -> 172.31.31.144 OpenFlow 98 Type: OFPT_MULTIPART_REPLY, OFPMP_METER
136 2.619781194 172.31.31.144 -> 172.31.24.227 TCP 90 6633 → 39448 [PSH, ACK] Seq=1 Ack=1 Win=853 Len=24 TSval=420415 TSecr=118980305
137 2.619784823 172.31.31.144 -> 172.31.24.227 TCP 90 6633 → 39470 [PSH, ACK] Seq=1 Ack=1 Win=853 Len=24 TSval=420415 TSecr=118980303
138 2.619812940 172.31.24.227 -> 172.31.31.144 OpenFlow 98 Type: OFPT_MULTIPART_REPLY, OFPMP_METER
139 2.619863680 172.31.31.144 -> 172.31.24.227 TCP 90 6633 → 39468 [PSH, ACK] Seq=1 Ack=1 Win=853 Len=24 TSval=420415 TSecr=118980303
140 2.619868271 172.31.31.144 -> 172.31.24.227 TCP 90 6633 → 39456 [PSH, ACK] Seq=1 Ack=1 Win=853 Len=24 TSval=420415 TSecr=118980305
141 2.619870121 172.31.31.144 -> 172.31.24.227 TCP 82 6633 → 39470 [PSH, ACK] Seq=25 Ack=1 Win=853 Len=16 TSval=420415 TSecr=118980303
142 2.619871874 172.31.31.144 -> 172.31.24.227 TCP 66 6633 → 39480 [ACK] Seq=161 Ack=801 Win=853 Len=0 TSval=420415 TSecr=118981025
143 2.619886785 172.31.31.144 -> 172.31.24.227 TCP 106 6633 → 39450 [PSH, ACK] Seq=25 Ack=1 Win=853 Len=40 TSval=420415 TSecr=118980305
144 2.619888966 172.31.31.144 -> 172.31.24.227 TCP 106 6633 → 39454 [PSH, ACK] Seq=25 Ack=1 Win=853 Len=40 TSval=420415 TSecr=118980305
145 2.619915205 172.31.31.144 -> 172.31.24.227 TCP 90 6633 → 39488 [PSH, ACK] Seq=1 Ack=1 Win=853 Len=24 TSval=420415 TSecr=118980305
146 2.619925228 172.31.24.227 -> 172.31.31.144 OpenFlow 82 Type: OFPT_MULTIPART_REPLY, OFPMP_GROUP
147 2.619936637 172.31.31.144 -> 172.31.24.227 TCP 90 6633 → 39472 [PSH, ACK] Seq=1 Ack=1 Win=853 Len=24 TSval=420415 TSecr=118980305
148 2.619943631 172.31.24.227 -> 172.31.31.144 OpenFlow 82 Type: OFPT_MULTIPART_REPLY, OFPMP_GROUP_DESC
149 2.619963371 172.31.31.144 -> 172.31.24.227 TCP 66 6633 → 39480 [ACK] Seq=161 Ack=2121 Win=853 Len=0 TSval=420415 TSecr=118981025
150 2.619969095 172.31.24.227 -> 172.31.31.144 OpenFlow 82 Type: OFPT_MULTIPART_REPLY, OFPMP_METER
151 2.619980076 172.31.24.227 -> 172.31.31.144 OpenFlow 82 Type: OFPT_MULTIPART_REPLY, OFPMP_GROUP
152 2.619986560 172.31.31.144 -> 172.31.24.227 TCP 106 6633 → 39456 [PSH, ACK] Seq=25 Ack=1 Win=853 Len=40 TSval=420415 TSecr=118980305
153 2.619999292 172.31.24.227 -> 172.31.31.144 OpenFlow 82 Type: OFPT_MULTIPART_REPLY, OFPMP_GROUP
154 2.620022832 172.31.24.227 -> 172.31.31.144 OpenFlow 82 Type: OFPT_MULTIPART_REPLY, OFPMP_GROUP
155 2.620035790 172.31.31.144 -> 172.31.24.227 OpenFlow 106 Type: OFPT_MULTIPART_REQUEST, OFPMP_METER
156 2.620038400 172.31.31.144 -> 172.31.24.227 TCP 90 6633 → 39460 [PSH, ACK] Seq=1 Ack=1 Win=853 Len=24 TSval=420415 TSecr=118980303
157 2.620049207 172.31.24.227 -> 172.31.31.144 OpenFlow 82 Type: OFPT_MULTIPART_REPLY, OFPMP_GROUP
158 2.620053893 172.31.24.227 -> 172.31.31.144 OpenFlow 98 Type: OFPT_MULTIPART_REPLY, OFPMP_METER
159 2.620073765 172.31.24.227 -> 172.31.31.144 OpenFlow 82 Type: OFPT_MULTIPART_REPLY, OFPMP_GROUP
160 2.620075632 172.31.24.227 -> 172.31.31.144 OpenFlow 98 Type: OFPT_MULTIPART_REPLY, OFPMP_METER
161 2.620086945 172.31.31.144 -> 172.31.24.227 TCP 82 6633 → 39468 [PSH, ACK] Seq=25 Ack=1 Win=853 Len=16 TSval=420415 TSecr=118980303
162 2.620089699 172.31.31.144 -> 172.31.24.227 OpenFlow 106 Type: OFPT_MULTIPART_REQUEST, OFPMP_METER
163 2.620091250 172.31.31.144 -> 172.31.24.227 TCP 90 6633 → 39470 [PSH, ACK] Seq=41 Ack=1 Win=853 Len=24 TSval=420415 TSecr=118980303
164 2.620098853 172.31.24.227 -> 172.31.31.144 OpenFlow 82 Type: OFPT_MULTIPART_REPLY, OFPMP_GROUP
165 2.620103646 172.31.24.227 -> 172.31.31.144 OpenFlow 98 Type: OFPT_MULTIPART_REPLY, OFPMP_METER
166 2.620120566 172.31.24.227 -> 172.31.31.144 OpenFlow 82 Type: OFPT_MULTIPART_REPLY, OFPMP_GROUP
167 2.620140055 172.31.24.227 -> 172.31.31.144 OpenFlow 82 Type: OFPT_MULTIPART_REPLY, OFPMP_GROUP
168 2.620152381 172.31.24.227 -> 172.31.31.144 OpenFlow 82 Type: OFPT_MULTIPART_REPLY, OFPMP_GROUP
169 2.620167130 172.31.24.227 -> 172.31.31.144 OpenFlow 82 Type: OFPT_MULTIPART_REPLY, OFPMP_GROUP
170 2.620176370 172.31.24.227 -> 172.31.31.144 OpenFlow 82 Type: OFPT_MULTIPART_REPLY, OFPMP_GROUP
171 2.620182216 172.31.31.144 -> 172.31.24.227 TCP 90 6633 → 39466 [PSH, ACK] Seq=1 Ack=1 Win=853 Len=24 TSval=420415 TSecr=118980303
172 2.620185361 172.31.31.144 -> 172.31.24.227 OpenFlow 90 Type: OFPT_MULTIPART_REQUEST, OFPMP_METER
173 2.620186921 172.31.31.144 -> 172.31.24.227 TCP 82 6633 → 39488 [PSH, ACK] Seq=25 Ack=1 Win=853 Len=16 TSval=420415 TSecr=118980305
174 2.620188771 172.31.31.144 -> 172.31.24.227 OpenFlow 106 Type: OFPT_MULTIPART_REQUEST, OFPMP_METER
175 2.620210714 172.31.24.227 -> 172.31.31.144 OpenFlow 82 Type: OFPT_MULTIPART_REPLY, OFPMP_GROUP
176 2.620215758 172.31.24.227 -> 172.31.31.144 OpenFlow 98 Type: OFPT_MULTIPART_REPLY, OFPMP_METER
177 2.620250000 172.31.24.227 -> 172.31.31.144 OpenFlow 82 Type: OFPT_MULTIPART_REPLY, OFPMP_GROUP
178 2.620252333 172.31.24.227 -> 172.31.31.144 OpenFlow 98 Type: OFPT_MULTIPART_REPLY, OFPMP_METER
179 2.620254085 172.31.24.227 -> 172.31.31.144 OpenFlow 82 Type: OFPT_MULTIPART_REPLY, OFPMP_GROUP_DESC
180 2.620337703 172.31.24.227 -> 172.31.31.144 OpenFlow 82 Type: OFPT_MULTIPART_REPLY, OFPMP_GROUP_DESC
181 2.620340840 172.31.24.227 -> 172.31.31.144 OpenFlow 98 Type: OFPT_MULTIPART_REPLY, OFPMP_METER
182 2.620342960 172.31.24.227 -> 172.31.31.144 OpenFlow 98 Type: OFPT_MULTIPART_REPLY, OFPMP_METER
183 2.620354958 172.31.31.144 -> 172.31.24.227 OpenFlow 106 Type: OFPT_MULTIPART_REQUEST, OFPMP_METER
184 2.620358030 172.31.31.144 -> 172.31.24.227 OpenFlow 90 Type: OFPT_MULTIPART_REQUEST, OFPMP_METER
185 2.620359334 172.31.31.144 -> 172.31.24.227 TCP 106 6633 → 39466 [PSH, ACK] Seq=25 Ack=1 Win=853 Len=40 TSval=420415 TSecr=118980303
186 2.620361273 172.31.31.144 -> 172.31.24.227 TCP 66 6633 → 39480 [ACK] Seq=161 Ack=8233 Win=853 Len=0 TSval=420415 TSecr=118981025
187 2.620363923 172.31.31.144 -> 172.31.24.227 TCP 66 6633 → 39480 [ACK] Seq=161 Ack=8265 Win=853 Len=0 TSval=420415 TSecr=118981026
188 2.620365623 172.31.31.144 -> 172.31.24.227 OpenFlow 187 Type: OFPT_PACKET_OUT
189 2.620367403 172.31.31.144 -> 172.31.24.227 TCP 66 6633 → 39482 [ACK] Seq=65 Ack=129 Win=853 Len=0 TSval=420416 TSecr=118981026
190 2.620369587 172.31.31.144 -> 172.31.24.227 TCP 66 6633 → 39486 [ACK] Seq=161 Ack=8681 Win=853 Len=0 TSval=420416 TSecr=118981016
191 2.620372267 172.31.31.144 -> 172.31.24.227 TCP 66 6633 → 39484 [ACK] Seq=65 Ack=49 Win=853 Len=0 TSval=420416 TSecr=118981026
192 2.620407728 172.31.24.227 -> 172.31.31.144 OpenFlow 82 Type: OFPT_MULTIPART_REPLY, OFPMP_GROUP_DESC
193 2.620413825 172.31.24.227 -> 172.31.31.144 OpenFlow 98 Type: OFPT_MULTIPART_REPLY, OFPMP_METER
194 2.620415700 172.31.24.227 -> 172.31.31.144 OpenFlow 82 Type: OFPT_MULTIPART_REPLY, OFPMP_GROUP_DESC
195 2.620437678 172.31.24.227 -> 172.31.31.144 OpenFlow 82 Type: OFPT_MULTIPART_REPLY, OFPMP_GROUP
196 2.620453313 172.31.24.227 -> 172.31.31.144 OpenFlow 82 Type: OFPT_MULTIPART_REPLY, OFPMP_METER
197 2.620466245 172.31.24.227 -> 172.31.31.144 OpenFlow 82 Type: OFPT_MULTIPART_REPLY, OFPMP_GROUP_DESC
198 2.620468189 172.31.24.227 -> 172.31.31.144 OpenFlow 82 Type: OFPT_MULTIPART_REPLY, OFPMP_METER
199 2.620554518 172.31.31.144 -> 172.31.24.227 TCP 66 6633 → 39446 [ACK] Seq=65 Ack=17 Win=853 Len=0 TSval=420416 TSecr=118981026
200 2.620560242 172.31.31.144 -> 172.31.24.227 TCP 66 6633 → 39446 [ACK] Seq=65 Ack=33 Win=853 Len=0 TSval=420416 TSecr=118981026
201 2.620562062 172.31.31.144 -> 172.31.24.227 TCP 66 6633 → 39446 [ACK] Seq=65 Ack=49 Win=853 Len=0 TSval=420416 TSecr=118981026
202 2.620563954 172.31.31.144 -> 172.31.24.227 OpenFlow 187 Type: OFPT_PACKET_OUT
203 2.620566337 172.31.31.144 -> 172.31.24.227 TCP 66 6633 → 39448 [ACK] Seq=65 Ack=17 Win=853 Len=0 TSval=420416 TSecr=118981026
204 2.620568118 172.31.31.144 -> 172.31.24.227 TCP 66 6633 → 39456 [ACK] Seq=65 Ack=17 Win=853 Len=0 TSval=420416 TSecr=118981026
205 2.620570035 172.31.31.144 -> 172.31.24.227 OpenFlow 308 Type: OFPT_PACKET_OUT
206 2.620571848 172.31.31.144 -> 172.31.24.227 TCP 66 6633 → 39450 [ACK] Seq=65 Ack=49 Win=853 Len=0 TSval=420416 TSecr=118981026
207 2.620573988 172.31.31.144 -> 172.31.24.227 OpenFlow 187 Type: OFPT_PACKET_OUT
208 2.620577158 172.31.24.227 -> 172.31.31.144 TCP 66 39480 → 6633 [ACK] Seq=8281 Ack=766 Win=93 Len=0 TSval=118981026 TSecr=420415
209 2.620587377 172.31.24.227 -> 172.31.31.144 OpenFlow 82 Type: OFPT_MULTIPART_REPLY, OFPMP_METER
210 2.620678706 172.31.24.227 -> 172.31.31.144 OpenFlow 98 Type: OFPT_MULTIPART_REPLY, OFPMP_METER
211 2.620681724 172.31.24.227 -> 172.31.31.144 OpenFlow 82 Type: OFPT_MULTIPART_REPLY, OFPMP_METER
212 2.620737088 172.31.31.144 -> 172.31.24.227 TCP 66 6633 → 39460 [ACK] Seq=65 Ack=17 Win=853 Len=0 TSval=420416 TSecr=118981026
213 2.620742947 172.31.31.144 -> 172.31.24.227 TCP 66 6633 → 39454 [ACK] Seq=65 Ack=49 Win=853 Len=0 TSval=420416 TSecr=118981026
214 2.620745190 172.31.31.144 -> 172.31.24.227 TCP 66 6633 → 39456 [ACK] Seq=65 Ack=49 Win=853 Len=0 TSval=420416 TSecr=118981026
215 2.620746922 172.31.31.144 -> 172.31.24.227 TCP 66 6633 → 39462 [ACK] Seq=65 Ack=17 Win=853 Len=0 TSval=420416 TSecr=118981026
216 2.620748830 172.31.31.144 -> 172.31.24.227 TCP 66 6633 → 39464 [ACK] Seq=65 Ack=17 Win=853 Len=0 TSval=420416 TSecr=118981026
217 2.620751188 172.31.31.144 -> 172.31.24.227 OpenFlow 187 Type: OFPT_PACKET_OUT
218 2.620753317 172.31.31.144 -> 172.31.24.227 TCP 66 6633 → 39468 [ACK] Seq=65 Ack=17 Win=853 Len=0 TSval=420416 TSecr=118981026
219 2.620755103 172.31.31.144 -> 172.31.24.227 TCP 66 6633 → 39470 [ACK] Seq=65 Ack=17 Win=853 Len=0 TSval=420416 TSecr=118981026
220 2.620756629 172.31.31.144 -> 172.31.24.227 TCP 66 6633 → 39472 [ACK] Seq=65 Ack=17 Win=853 Len=0 TSval=420416 TSecr=118981026
221 2.620840681 172.31.31.144 -> 172.31.24.227 OpenFlow 187 Type: OFPT_PACKET_OUT
222 2.620845484 172.31.31.144 -> 172.31.24.227 TCP 66 6633 → 39462 [ACK] Seq=65 Ack=49 Win=853 Len=0 TSval=420416 TSecr=118981026
223 2.620848079 172.31.31.144 -> 172.31.24.227 OpenFlow 187 Type: OFPT_PACKET_OUT
224 2.620849687 172.31.31.144 -> 172.31.24.227 TCP 66 6633 → 39488 [ACK] Seq=65 Ack=17 Win=853 Len=0 TSval=420416 TSecr=118981026
225 2.620868062 172.31.31.144 -> 172.31.24.227 TCP 66 6633 → 39464 [ACK] Seq=65 Ack=49 Win=853 Len=0 TSval=420416 TSecr=118981026
226 2.620887502 172.31.31.144 -> 172.31.24.227 TCP 66 6633 → 39468 [ACK] Seq=65 Ack=33 Win=853 Len=0 TSval=420416 TSecr=118981026
227 2.620908341 172.31.31.144 -> 172.31.24.227 TCP 66 6633 → 39448 [ACK] Seq=65 Ack=33 Win=853 Len=0 TSval=420416 TSecr=118981026
228 2.620928561 172.31.31.144 -> 172.31.24.227 TCP 66 6633 → 39470 [ACK] Seq=65 Ack=49 Win=853 Len=0 TSval=420416 TSecr=118981026
229 2.620948686 172.31.31.144 -> 172.31.24.227 OpenFlow 187 Type: OFPT_PACKET_OUT
230 2.620968816 172.31.31.144 -> 172.31.24.227 TCP 66 6633 → 39460 [ACK] Seq=65 Ack=33 Win=853 Len=0 TSval=420416 TSecr=118981026
231 2.620988168 172.31.31.144 -> 172.31.24.227 TCP 66 6633 → 39474 [ACK] Seq=65 Ack=129 Win=853 Len=0 TSval=420416 TSecr=118981026
232 2.621009014 172.31.31.144 -> 172.31.24.227 TCP 66 6633 → 39488 [ACK] Seq=65 Ack=33 Win=853 Len=0 TSval=420416 TSecr=118981026
233 2.621028878 172.31.31.144 -> 172.31.24.227 OpenFlow 187 Type: OFPT_PACKET_OUT
234 2.621033822 172.31.24.227 -> 172.31.31.144 TCP 66 39480 → 6633 [ACK] Seq=8281 Ack=1371 Win=93 Len=0 TSval=118981026 TSecr=420416
235 2.621050948 172.31.31.144 -> 172.31.24.227 TCP 66 6633 → 39478 [ACK] Seq=65 Ack=49 Win=853 Len=0 TSval=420416 TSecr=118981026
236 2.621076087 172.31.31.144 -> 172.31.24.227 OpenFlow 187 Type: OFPT_PACKET_OUT
237 2.621090961 172.31.31.144 -> 172.31.24.227 TCP 66 6633 → 39468 [ACK] Seq=65 Ack=49 Win=853 Len=0 TSval=420416 TSecr=118981026
238 2.621111251 172.31.31.144 -> 172.31.24.227 TCP 66 6633 → 39472 [ACK] Seq=65 Ack=33 Win=853 Len=0 TSval=420416 TSecr=118981026
239 2.621136778 172.31.31.144 -> 172.31.24.227 TCP 66 6633 → 39448 [ACK] Seq=65 Ack=49 Win=853 Len=0 TSval=420416 TSecr=118981026
240 2.621150361 172.31.31.144 -> 172.31.24.227 TCP 66 6633 → 39460 [ACK] Seq=65 Ack=49 Win=853 Len=0 TSval=420416 TSecr=118981026
241 2.621170849 172.31.31.144 -> 172.31.24.227 OpenFlow 187 Type: OFPT_PACKET_OUT
242 2.621191113 172.31.31.144 -> 172.31.24.227 OpenFlow 187 Type: OFPT_PACKET_OUT
243 2.621210583 172.31.31.144 -> 172.31.24.227 TCP 66 6633 → 39472 [ACK] Seq=65 Ack=49 Win=853 Len=0 TSval=420416 TSecr=118981026
244 2.621239225 172.31.31.144 -> 172.31.24.227 OpenFlow 187 Type: OFPT_PACKET_OUT
245 2.621258882 172.31.31.144 -> 172.31.24.227 OpenFlow 187 Type: OFPT_PACKET_OUT
246 2.621295222 172.31.31.144 -> 172.31.24.227 TCP 66 6633 → 39466 [ACK] Seq=65 Ack=49 Win=853 Len=0 TSval=420416 TSecr=118981026
247 2.621300181 172.31.31.144 -> 172.31.24.227 OpenFlow 187 Type: OFPT_PACKET_OUT
248 2.621333265 172.31.31.144 -> 172.31.24.227 OpenFlow 187 Type: OFPT_PACKET_OUT
249 2.621338188 172.31.24.227 -> 172.31.31.144 TCP 66 39456 → 6633 [ACK] Seq=49 Ack=670 Win=78 Len=0 TSval=118981026 TSecr=420416
250 2.621346210 172.31.24.227 -> 172.31.31.144 TCP 66 39480 → 6633 [ACK] Seq=8281 Ack=1613 Win=93 Len=0 TSval=118981026 TSecr=420416
251 2.621352075 172.31.31.144 -> 172.31.24.227 OpenFlow 187 Type: OFPT_PACKET_OUT
252 2.621404026 172.31.31.144 -> 172.31.24.227 OpenFlow 187 Type: OFPT_PACKET_OUT
253 2.621408860 172.31.31.144 -> 172.31.24.227 OpenFlow 187 Type: OFPT_PACKET_OUT
254 2.621411903 172.31.31.144 -> 172.31.24.227 OpenFlow 187 Type: OFPT_PACKET_OUT
255 2.621435759 172.31.24.227 -> 172.31.31.144 OpenFlow 189 Type: OFPT_PACKET_IN
256 2.621455395 172.31.24.227 -> 172.31.31.144 OpenFlow 435 Type: OFPT_PACKET_IN
257 2.621481215 172.31.31.144 -> 172.31.24.227 OpenFlow 187 Type: OFPT_PACKET_OUT
258 2.621484703 172.31.24.227 -> 172.31.31.144 TCP 66 39456 → 6633 [ACK] Seq=49 Ack=1275 Win=78 Len=0 TSval=118981026 TSecr=420416
259 2.621490120 172.31.24.227 -> 172.31.31.144 OpenFlow 82 Type: OFPT_MULTIPART_REPLY, OFPMP_METER
260 2.621506237 172.31.24.227 -> 172.31.31.144 OpenFlow 189 Type: OFPT_PACKET_IN
261 2.621551912 172.31.31.144 -> 172.31.24.227 OpenFlow 187 Type: OFPT_PACKET_OUT
262 2.621558858 172.31.24.227 -> 172.31.31.144 OpenFlow 189 Type: OFPT_PACKET_IN
263 2.621611164 172.31.31.144 -> 172.31.24.227 OpenFlow 187 Type: OFPT_PACKET_OUT
264 2.621674217 172.31.31.144 -> 172.31.24.227 TCP 66 6633 → 39488 [ACK] Seq=65 Ack=49 Win=853 Len=0 TSval=420416 TSecr=118981026
265 2.621708765 172.31.31.144 -> 172.31.24.227 TCP 66 6633 → 39484 [ACK] Seq=65 Ack=541 Win=853 Len=0 TSval=420416 TSecr=118981026
266 2.621770463 172.31.31.144 -> 172.31.24.227 OpenFlow 187 Type: OFPT_PACKET_OUT
267 2.621795152 172.31.31.144 -> 172.31.24.227 TCP 66 6633 → 39492 [ACK] Seq=161 Ack=8207 Win=853 Len=0 TSval=420416 TSecr=118981026
268 2.621880993 172.31.31.144 -> 172.31.24.227 OpenFlow 187 Type: OFPT_PACKET_OUT
269 2.621981352 172.31.31.144 -> 172.31.24.227 OpenFlow 187 Type: OFPT_PACKET_OUT
270 2.622125295 172.31.24.227 -> 172.31.31.144 TCP 66 39456 → 6633 [ACK] Seq=49 Ack=1517 Win=78 Len=0 TSval=118981026 TSecr=420416
271 2.622190140 172.31.24.227 -> 172.31.31.144 OpenFlow 189 Type: OFPT_PACKET_IN
272 2.622213149 172.31.24.227 -> 172.31.31.144 OpenFlow 189 Type: OFPT_PACKET_IN
273 2.622228098 172.31.24.227 -> 172.31.31.144 OpenFlow 189 Type: OFPT_PACKET_IN
274 2.622257406 172.31.24.227 -> 172.31.31.144 OpenFlow 681 Type: OFPT_PACKET_IN
275 2.622364484 172.31.31.144 -> 172.31.24.227 TCP 66 6633 → 39458 [ACK] Seq=161 Ack=10100 Win=853 Len=0 TSval=420416 TSecr=118981026
276 2.622392543 172.31.31.144 -> 172.31.24.227 TCP 66 6633 → 39464 [ACK] Seq=65 Ack=172 Win=853 Len=0 TSval=420416 TSecr=118981026
277 2.622397275 172.31.24.227 -> 172.31.31.144 TCP 66 39486 → 6633 [ACK] Seq=8681 Ack=524 Win=96 Len=0 TSval=118981026 TSecr=420416
278 2.622449039 172.31.31.144 -> 172.31.24.227 TCP 66 6633 → 39464 [ACK] Seq=65 Ack=787 Win=853 Len=0 TSval=420416 TSecr=118981026
279 2.622527782 172.31.24.227 -> 172.31.31.144 OpenFlow 189 Type: OFPT_PACKET_IN
280 2.622549242 172.31.24.227 -> 172.31.31.144 OpenFlow 681 Type: OFPT_PACKET_IN
281 2.622564338 172.31.24.227 -> 172.31.31.144 OpenFlow 189 Type: OFPT_PACKET_IN
282 2.622575492 172.31.24.227 -> 172.31.31.144 OpenFlow 189 Type: OFPT_PACKET_IN
283 2.622618462 172.31.24.227 -> 172.31.31.144 OpenFlow 189 Type: OFPT_PACKET_IN
284 2.622623306 172.31.24.227 -> 172.31.31.144 OpenFlow 189 Type: OFPT_PACKET_IN
285 2.622639769 172.31.24.227 -> 172.31.31.144 OpenFlow 189 Type: OFPT_PACKET_IN
286 2.622685718 172.31.24.227 -> 172.31.31.144 OpenFlow 189 Type: OFPT_PACKET_IN
287 2.622733719 172.31.31.144 -> 172.31.24.227 TCP 66 6633 → 39446 [ACK] Seq=65 Ack=172 Win=853 Len=0 TSval=420416 TSecr=118981026
288 2.622738395 172.31.31.144 -> 172.31.24.227 TCP 66 6633 → 39446 [ACK] Seq=65 Ack=787 Win=853 Len=0 TSval=420416 TSecr=118981026
289 2.622753982 172.31.31.144 -> 172.31.24.227 TCP 66 6633 → 39448 [ACK] Seq=65 Ack=172 Win=853 Len=0 TSval=420416 TSecr=118981026
290 2.622803281 172.31.31.144 -> 172.31.24.227 TCP 66 6633 → 39448 [ACK] Seq=65 Ack=295 Win=853 Len=0 TSval=420416 TSecr=118981026
291 2.622844558 172.31.31.144 -> 172.31.24.227 TCP 66 6633 → 39472 [ACK] Seq=65 Ack=172 Win=853 Len=0 TSval=420416 TSecr=118981026
292 2.622846581 172.31.31.144 -> 172.31.24.227 TCP 66 6633 → 39472 [ACK] Seq=65 Ack=295 Win=853 Len=0 TSval=420416 TSecr=118981026
293 2.623824883 172.31.31.144 -> 172.31.24.227 TCP 66 6633 → 39450 [ACK] Seq=65 Ack=295 Win=853 Len=0 TSval=420416 TSecr=118981026
294 2.624004684 172.31.31.144 -> 172.31.24.227 TCP 66 6633 → 39458 [ACK] Seq=161 Ack=10223 Win=853 Len=0 TSval=420417 TSecr=118981026
295 2.624154593 172.31.31.144 -> 172.31.24.227 OpenFlow 187 Type: OFPT_PACKET_OUT
296 2.624401766 172.31.31.144 -> 172.31.24.227 OpenFlow 187 Type: OFPT_PACKET_OUT
297 2.624500936 172.31.31.144 -> 172.31.24.227 OpenFlow 187 Type: OFPT_PACKET_OUT
298 2.624591378 172.31.24.227 -> 172.31.31.144 TCP 66 39486 → 6633 [ACK] Seq=8681 Ack=887 Win=96 Len=0 TSval=118981027 TSecr=420417
299 2.624642467 172.31.31.144 -> 172.31.24.227 OpenFlow 187 Type: OFPT_PACKET_OUT
300 2.624745886 172.31.31.144 -> 172.31.24.227 OpenFlow 187 Type: OFPT_PACKET_OUT
301 2.624865719 172.31.24.227 -> 172.31.31.144 OpenFlow 189 Type: OFPT_PACKET_IN
302 2.624885400 172.31.24.227 -> 172.31.31.144 OpenFlow 312 Type: OFPT_PACKET_IN
303 2.624910863 172.31.31.144 -> 172.31.24.227 OpenFlow 187 Type: OFPT_PACKET_OUT
304 2.624916612 172.31.24.227 -> 172.31.31.144 TCP 66 39486 → 6633 [ACK] Seq=8681 Ack=1129 Win=96 Len=0 TSval=118981027 TSecr=420417
305 2.624957537 172.31.31.144 -> 172.31.24.227 OpenFlow 187 Type: OFPT_PACKET_OUT
306 2.625033011 172.31.31.144 -> 172.31.24.227 OpenFlow 187 Type: OFPT_PACKET_OUT
307 2.625095840 172.31.31.144 -> 172.31.24.227 TCP 66 6633 → 39478 [ACK] Seq=65 Ack=418 Win=853 Len=0 TSval=420417 TSecr=118981027
308 2.625212136 172.31.24.227 -> 172.31.31.144 TCP 66 39468 → 6633 [ACK] Seq=49 Ack=428 Win=84 Len=0 TSval=118981027 TSecr=420417
309 2.625278429 172.31.24.227 -> 172.31.31.144 OpenFlow 189 Type: OFPT_PACKET_IN
310 2.625311998 172.31.24.227 -> 172.31.31.144 OpenFlow 189 Type: OFPT_PACKET_IN
311 2.625331132 172.31.24.227 -> 172.31.31.144 OpenFlow 189 Type: OFPT_PACKET_IN
312 2.625340619 172.31.31.144 -> 172.31.24.227 OpenFlow 187 Type: OFPT_PACKET_OUT
313 2.625440170 172.31.31.144 -> 172.31.24.227 OpenFlow 187 Type: OFPT_PACKET_OUT
314 2.625458389 172.31.31.144 -> 172.31.24.227 TCP 66 6633 → 39470 [ACK] Seq=65 Ack=172 Win=853 Len=0 TSval=420417 TSecr=118981027
315 2.625487806 172.31.31.144 -> 172.31.24.227 TCP 66 6633 → 39470 [ACK] Seq=65 Ack=295 Win=853 Len=0 TSval=420417 TSecr=118981027
316 2.625502296 172.31.24.227 -> 172.31.31.144 OpenFlow 189 Type: OFPT_PACKET_IN
317 2.625511940 172.31.31.144 -> 172.31.24.227 OpenFlow 187 Type: OFPT_PACKET_OUT
318 2.625589440 172.31.31.144 -> 172.31.24.227 OpenFlow 187 Type: OFPT_PACKET_OUT
319 2.625633007 172.31.24.227 -> 172.31.31.144 TCP 66 39468 → 6633 [ACK] Seq=49 Ack=912 Win=84 Len=0 TSval=118981027 TSecr=420417
320 2.625687705 172.31.31.144 -> 172.31.24.227 TCP 66 6633 → 39464 [ACK] Seq=65 Ack=910 Win=853 Len=0 TSval=420417 TSecr=118981027
321 2.625705382 172.31.31.144 -> 172.31.24.227 OpenFlow 187 Type: OFPT_PACKET_OUT
322 2.625761097 172.31.31.144 -> 172.31.24.227 OpenFlow 187 Type: OFPT_PACKET_OUT
323 2.625844592 172.31.31.144 -> 172.31.24.227 OpenFlow 187 Type: OFPT_PACKET_OUT
324 2.625860194 172.31.24.227 -> 172.31.31.144 OpenFlow 189 Type: OFPT_PACKET_IN
325 2.625876104 172.31.24.227 -> 172.31.31.144 OpenFlow 189 Type: OFPT_PACKET_IN
326 2.625926837 172.31.31.144 -> 172.31.24.227 OpenFlow 187 Type: OFPT_PACKET_OUT
327 2.625995562 172.31.31.144 -> 172.31.24.227 OpenFlow 187 Type: OFPT_PACKET_OUT
328 2.626001084 172.31.24.227 -> 172.31.31.144 TCP 66 39468 → 6633 [ACK] Seq=49 Ack=1517 Win=84 Len=0 TSval=118981027 TSecr=420417
329 2.626046712 172.31.31.144 -> 172.31.24.227 TCP 66 6633 → 39462 [ACK] Seq=65 Ack=172 Win=853 Len=0 TSval=420417 TSecr=118981027
330 2.626078571 172.31.31.144 -> 172.31.24.227 TCP 66 6633 → 39464 [ACK] Seq=65 Ack=1033 Win=853 Len=0 TSval=420417 TSecr=118981027
331 2.626280371 172.31.31.144 -> 172.31.24.227 OpenFlow 187 Type: OFPT_PACKET_OUT
332 2.626322177 172.31.24.227 -> 172.31.31.144 OpenFlow 189 Type: OFPT_PACKET_IN
333 2.626343796 172.31.24.227 -> 172.31.31.144 OpenFlow 558 Type: OFPT_PACKET_IN
334 2.626380195 172.31.31.144 -> 172.31.24.227 OpenFlow 187 Type: OFPT_PACKET_OUT
335 2.626451567 172.31.24.227 -> 172.31.31.144 TCP 66 39468 → 6633 [ACK] Seq=49 Ack=1759 Win=84 Len=0 TSval=118981027 TSecr=420417
336 2.626506975 172.31.31.144 -> 172.31.24.227 TCP 66 6633 → 39462 [ACK] Seq=65 Ack=295 Win=853 Len=0 TSval=420417 TSecr=118981027
337 2.626528684 172.31.31.144 -> 172.31.24.227 OpenFlow 187 Type: OFPT_PACKET_OUT
338 2.626546543 172.31.31.144 -> 172.31.24.227 OpenFlow 187 Type: OFPT_PACKET_OUT
339 2.626565973 172.31.31.144 -> 172.31.24.227 TCP 66 6633 → 39462 [ACK] Seq=65 Ack=787 Win=853 Len=0 TSval=420417 TSecr=118981027
340 2.626592957 172.31.24.227 -> 172.31.31.144 OpenFlow 189 Type: OFPT_PACKET_IN
341 2.626611623 172.31.24.227 -> 172.31.31.144 OpenFlow 189 Type: OFPT_PACKET_IN
342 2.626636937 172.31.31.144 -> 172.31.24.227 OpenFlow 187 Type: OFPT_PACKET_OUT
343 2.626760788 172.31.31.144 -> 172.31.24.227 OpenFlow 187 Type: OFPT_PACKET_OUT
344 2.626836818 172.31.31.144 -> 172.31.24.227 OpenFlow 187 Type: OFPT_PACKET_OUT
345 2.626866805 172.31.31.144 -> 172.31.24.227 TCP 66 6633 → 39492 [ACK] Seq=161 Ack=8453 Win=853 Len=0 TSval=420417 TSecr=118981027
346 2.626949468 172.31.31.144 -> 172.31.24.227 OpenFlow 187 Type: OFPT_PACKET_OUT
347 2.626956547 172.31.24.227 -> 172.31.31.144 TCP 66 39466 → 6633 [ACK] Seq=49 Ack=670 Win=385 Len=0 TSval=118981027 TSecr=420417
348 2.627018045 172.31.31.144 -> 172.31.24.227 OpenFlow 187 Type: OFPT_PACKET_OUT
349 2.627056446 172.31.24.227 -> 172.31.31.144 TCP 66 39466 → 6633 [ACK] Seq=49 Ack=912 Win=385 Len=0 TSval=118981027 TSecr=420417
350 2.627100034 172.31.31.144 -> 172.31.24.227 OpenFlow 187 Type: OFPT_PACKET_OUT
351 2.627185258 172.31.31.144 -> 172.31.24.227 OpenFlow 187 Type: OFPT_PACKET_OUT
352 2.627192952 172.31.24.227 -> 172.31.31.144 OpenFlow 189 Type: OFPT_PACKET_IN
353 2.627214021 172.31.24.227 -> 172.31.31.144 OpenFlow 435 Type: OFPT_PACKET_IN
354 2.627233301 172.31.24.227 -> 172.31.31.144 OpenFlow 189 Type: OFPT_PACKET_IN
355 2.627270783 172.31.24.227 -> 172.31.31.144 OpenFlow 189 Type: OFPT_PACKET_IN
356 2.627298167 172.31.24.227 -> 172.31.31.144 OpenFlow 189 Type: OFPT_PACKET_IN
357 2.627318687 172.31.31.144 -> 172.31.24.227 OpenFlow 122 Type: OFPT_MULTIPART_REQUEST, OFPMP_FLOW
358 2.627324189 172.31.24.227 -> 172.31.31.144 OpenFlow 189 Type: OFPT_PACKET_IN
359 2.627344872 172.31.31.144 -> 172.31.24.227 OpenFlow 187 Type: OFPT_PACKET_OUT
360 2.627368220 172.31.31.144 -> 172.31.24.227 OpenFlow 90 Type: OFPT_MULTIPART_REQUEST, OFPMP_PORT_STATS
361 2.627379896 172.31.31.144 -> 172.31.24.227 TCP 66 6633 → 39470 [ACK] Seq=65 Ack=418 Win=853 Len=0 TSval=420417 TSecr=118981027
362 2.627399496 172.31.31.144 -> 172.31.24.227 TCP 66 6633 → 39470 [ACK] Seq=65 Ack=787 Win=853 Len=0 TSval=420417 TSecr=118981027
363 2.627465472 172.31.31.144 -> 172.31.24.227 OpenFlow 187 Type: OFPT_PACKET_OUT
364 2.627497853 172.31.31.144 -> 172.31.24.227 TCP 66 6633 → 39476 [ACK] Seq=161 Ack=8815 Win=853 Len=0 TSval=420417 TSecr=118981024
365 2.627517454 172.31.31.144 -> 172.31.24.227 TCP 66 6633 → 39492 [ACK] Seq=161 Ack=8699 Win=853 Len=0 TSval=420417 TSecr=118981027
