  1 0.000000000 172.31.31.144 -> 172.31.23.72 TCP 187 6633 → 45546 [PSH, ACK] Seq=1 Ack=1 Win=853 Len=121 TSval=1216837 TSecr=30037753
  2 0.000032983 172.31.31.144 -> 172.31.23.72 TCP 187 6633 → 45546 [PSH, ACK] Seq=122 Ack=1 Win=853 Len=121 TSval=1216837 TSecr=30037753
  3 0.000039943 172.31.31.144 -> 172.31.23.72 TCP 187 6633 → 45546 [PSH, ACK] Seq=243 Ack=1 Win=853 Len=121 TSval=1216837 TSecr=30037753
  4 0.000043772 172.31.31.144 -> 172.31.23.72 TCP 187 6633 → 45546 [PSH, ACK] Seq=364 Ack=1 Win=853 Len=121 TSval=1216837 TSecr=30037753
  5 0.000046882 172.31.31.144 -> 172.31.23.72 TCP 187 6633 → 45546 [PSH, ACK] Seq=485 Ack=1 Win=853 Len=121 TSval=1216837 TSecr=30037753
  6 0.000049662 172.31.31.144 -> 172.31.23.72 TCP 187 6633 → 45546 [PSH, ACK] Seq=606 Ack=1 Win=853 Len=121 TSval=1216837 TSecr=30037753
  7 0.000052355 172.31.31.144 -> 172.31.23.72 TCP 187 6633 → 45546 [PSH, ACK] Seq=727 Ack=1 Win=853 Len=121 TSval=1216837 TSecr=30037753
  8 0.000055348 172.31.31.144 -> 172.31.23.72 TCP 187 6633 → 45546 [PSH, ACK] Seq=848 Ack=1 Win=853 Len=121 TSval=1216837 TSecr=30037753
  9 0.000058104 172.31.31.144 -> 172.31.23.72 TCP 187 6633 → 45534 [PSH, ACK] Seq=1 Ack=1 Win=853 Len=121 TSval=1216837 TSecr=30037704
 10 0.000063183 172.31.31.144 -> 172.31.23.72 TCP 187 6633 → 45534 [PSH, ACK] Seq=122 Ack=1 Win=853 Len=121 TSval=1216837 TSecr=30037704
 11 0.000066614 172.31.31.144 -> 172.31.23.72 TCP 187 6633 → 45534 [PSH, ACK] Seq=243 Ack=1 Win=853 Len=121 TSval=1216837 TSecr=30037704
 12 0.000069120 172.31.31.144 -> 172.31.23.72 TCP 187 6633 → 45534 [PSH, ACK] Seq=364 Ack=1 Win=853 Len=121 TSval=1216837 TSecr=30037704
 13 0.000071693 172.31.31.144 -> 172.31.23.72 TCP 308 6633 → 45534 [PSH, ACK] Seq=485 Ack=1 Win=853 Len=242 TSval=1216837 TSecr=30037704
 14 0.000075284 172.31.31.144 -> 172.31.23.72 TCP 187 6633 → 45530 [PSH, ACK] Seq=1 Ack=1 Win=853 Len=121 TSval=1216837 TSecr=30037679
 15 0.000079775 172.31.31.144 -> 172.31.23.72 TCP 187 6633 → 45530 [PSH, ACK] Seq=122 Ack=1 Win=853 Len=121 TSval=1216837 TSecr=30037679
 16 0.000082721 172.31.31.144 -> 172.31.23.72 TCP 187 6633 → 45530 [PSH, ACK] Seq=243 Ack=1 Win=853 Len=121 TSval=1216837 TSecr=30037679
 17 0.000085321 172.31.31.144 -> 172.31.23.72 TCP 187 6633 → 45530 [PSH, ACK] Seq=364 Ack=1 Win=853 Len=121 TSval=1216837 TSecr=30037679
 18 0.000088287 172.31.31.144 -> 172.31.23.72 TCP 187 6633 → 45530 [PSH, ACK] Seq=485 Ack=1 Win=853 Len=121 TSval=1216837 TSecr=30037679
 19 0.000090890 172.31.31.144 -> 172.31.23.72 TCP 187 6633 → 45530 [PSH, ACK] Seq=606 Ack=1 Win=853 Len=121 TSval=1216837 TSecr=30037679
 20 0.000093559 172.31.31.144 -> 172.31.23.72 TCP 187 6633 → 45530 [PSH, ACK] Seq=727 Ack=1 Win=853 Len=121 TSval=1216837 TSecr=30037679
 21 0.000096339 172.31.31.144 -> 172.31.23.72 TCP 187 6633 → 45530 [PSH, ACK] Seq=848 Ack=1 Win=853 Len=121 TSval=1216837 TSecr=30037679
 22 0.000098841 172.31.31.144 -> 172.31.23.72 TCP 187 6633 → 45514 [PSH, ACK] Seq=1 Ack=1 Win=853 Len=121 TSval=1216837 TSecr=30037704
 23 0.000102708 172.31.31.144 -> 172.31.23.72 TCP 187 6633 → 45514 [PSH, ACK] Seq=122 Ack=1 Win=853 Len=121 TSval=1216837 TSecr=30037704
 24 0.000105281 172.31.31.144 -> 172.31.23.72 TCP 187 6633 → 45514 [PSH, ACK] Seq=243 Ack=1 Win=853 Len=121 TSval=1216837 TSecr=30037704
 25 0.000107843 172.31.31.144 -> 172.31.23.72 TCP 187 6633 → 45514 [PSH, ACK] Seq=364 Ack=1 Win=853 Len=121 TSval=1216837 TSecr=30037704
 26 0.000110299 172.31.31.144 -> 172.31.23.72 TCP 308 6633 → 45514 [PSH, ACK] Seq=485 Ack=1 Win=853 Len=242 TSval=1216837 TSecr=30037704
 27 0.000113162 172.31.31.144 -> 172.31.23.72 TCP 187 6633 → 45514 [PSH, ACK] Seq=727 Ack=1 Win=853 Len=121 TSval=1216837 TSecr=30037704
 28 0.000116035 172.31.31.144 -> 172.31.23.72 TCP 187 6633 → 45514 [PSH, ACK] Seq=848 Ack=1 Win=853 Len=121 TSval=1216837 TSecr=30037704
 29 0.000118805 172.31.31.144 -> 172.31.23.72 TCP 187 6633 → 45528 [PSH, ACK] Seq=1 Ack=1 Win=853 Len=121 TSval=1216837 TSecr=30037704
 30 0.000123221 172.31.31.144 -> 172.31.23.72 TCP 187 6633 → 45528 [PSH, ACK] Seq=122 Ack=1 Win=853 Len=121 TSval=1216837 TSecr=30037704
 31 0.000127638 172.31.31.144 -> 172.31.23.72 TCP 187 6633 → 45528 [PSH, ACK] Seq=243 Ack=1 Win=853 Len=121 TSval=1216837 TSecr=30037704
 32 0.000130458 172.31.31.144 -> 172.31.23.72 TCP 308 6633 → 45528 [PSH, ACK] Seq=364 Ack=1 Win=853 Len=242 TSval=1216837 TSecr=30037704
 33 0.000133412 172.31.31.144 -> 172.31.23.72 TCP 187 6633 → 45528 [PSH, ACK] Seq=606 Ack=1 Win=853 Len=121 TSval=1216837 TSecr=30037704
 34 0.000135905 172.31.31.144 -> 172.31.23.72 TCP 308 6633 → 45528 [PSH, ACK] Seq=727 Ack=1 Win=853 Len=242 TSval=1216837 TSecr=30037704
 35 0.000139229 172.31.31.144 -> 172.31.23.72 TCP 187 6633 → 45528 [PSH, ACK] Seq=969 Ack=1 Win=853 Len=121 TSval=1216837 TSecr=30037704
 36 0.000142216 172.31.31.144 -> 172.31.23.72 TCP 187 6633 → 45528 [PSH, ACK] Seq=1090 Ack=1 Win=853 Len=121 TSval=1216837 TSecr=30037704
 37 0.000144975 172.31.31.144 -> 172.31.23.72 TCP 187 6633 → 45518 [PSH, ACK] Seq=1 Ack=1 Win=853 Len=121 TSval=1216837 TSecr=30037704
 38 0.000149145 172.31.31.144 -> 172.31.23.72 TCP 187 6633 → 45518 [PSH, ACK] Seq=122 Ack=1 Win=853 Len=121 TSval=1216837 TSecr=30037704
 39 0.000151714 172.31.31.144 -> 172.31.23.72 TCP 308 6633 → 45518 [PSH, ACK] Seq=243 Ack=1 Win=853 Len=242 TSval=1216837 TSecr=30037704
 40 0.000154353 172.31.31.144 -> 172.31.23.72 TCP 308 6633 → 45518 [PSH, ACK] Seq=485 Ack=1 Win=853 Len=242 TSval=1216837 TSecr=30037704
 41 0.000168034 172.31.31.144 -> 172.31.23.72 TCP 187 6633 → 45518 [PSH, ACK] Seq=727 Ack=1 Win=853 Len=121 TSval=1216837 TSecr=30037704
 42 0.000169397 172.31.31.144 -> 172.31.23.72 TCP 308 6633 → 45518 [PSH, ACK] Seq=848 Ack=1 Win=853 Len=242 TSval=1216837 TSecr=30037704
 43 0.000170921 172.31.31.144 -> 172.31.23.72 TCP 187 6633 → 45518 [PSH, ACK] Seq=1090 Ack=1 Win=853 Len=121 TSval=1216837 TSecr=30037704
 44 0.000172550 172.31.31.144 -> 172.31.23.72 TCP 187 6633 → 45512 [PSH, ACK] Seq=1 Ack=1 Win=853 Len=121 TSval=1216837 TSecr=30037704
 45 0.000175384 172.31.31.144 -> 172.31.23.72 TCP 187 6633 → 45512 [PSH, ACK] Seq=122 Ack=1 Win=853 Len=121 TSval=1216837 TSecr=30037704
 46 0.000177211 172.31.31.144 -> 172.31.23.72 TCP 187 6633 → 45512 [PSH, ACK] Seq=243 Ack=1 Win=853 Len=121 TSval=1216837 TSecr=30037704
 47 0.000178555 172.31.31.144 -> 172.31.23.72 TCP 187 6633 → 45512 [PSH, ACK] Seq=364 Ack=1 Win=853 Len=121 TSval=1216837 TSecr=30037704
 48 0.000179817 172.31.31.144 -> 172.31.23.72 TCP 187 6633 → 45512 [PSH, ACK] Seq=485 Ack=1 Win=853 Len=121 TSval=1216837 TSecr=30037704
 49 0.000180993 172.31.31.144 -> 172.31.23.72 TCP 187 6633 → 45512 [PSH, ACK] Seq=606 Ack=1 Win=853 Len=121 TSval=1216837 TSecr=30037704
 50 0.000182281 172.31.31.144 -> 172.31.23.72 TCP 187 6633 → 45512 [PSH, ACK] Seq=727 Ack=1 Win=853 Len=121 TSval=1216837 TSecr=30037704
 51 0.000183487 172.31.31.144 -> 172.31.23.72 TCP 187 6633 → 45512 [PSH, ACK] Seq=848 Ack=1 Win=853 Len=121 TSval=1216837 TSecr=30037704
 52 0.000184792 172.31.31.144 -> 172.31.23.72 TCP 187 6633 → 45512 [PSH, ACK] Seq=969 Ack=1 Win=853 Len=121 TSval=1216837 TSecr=30037704
 53 0.000186301 172.31.31.144 -> 172.31.23.72 TCP 187 6633 → 45512 [PSH, ACK] Seq=1090 Ack=1 Win=853 Len=121 TSval=1216837 TSecr=30037704
 54 0.000187637 172.31.31.144 -> 172.31.23.72 TCP 187 6633 → 45538 [PSH, ACK] Seq=1 Ack=1 Win=853 Len=121 TSval=1216837 TSecr=30037704
 55 0.000190128 172.31.31.144 -> 172.31.23.72 TCP 187 6633 → 45538 [PSH, ACK] Seq=122 Ack=1 Win=853 Len=121 TSval=1216837 TSecr=30037704
 56 0.000191630 172.31.31.144 -> 172.31.23.72 TCP 187 6633 → 45538 [PSH, ACK] Seq=243 Ack=1 Win=853 Len=121 TSval=1216837 TSecr=30037704
 57 0.000193420 172.31.31.144 -> 172.31.23.72 TCP 187 6633 → 45538 [PSH, ACK] Seq=364 Ack=1 Win=853 Len=121 TSval=1216837 TSecr=30037704
 58 0.000195029 172.31.31.144 -> 172.31.23.72 TCP 308 6633 → 45538 [PSH, ACK] Seq=485 Ack=1 Win=853 Len=242 TSval=1216837 TSecr=30037704
 59 0.000500909 172.31.31.144 -> 172.31.23.72 TCP 187 6633 → 45538 [PSH, ACK] Seq=727 Ack=1 Win=853 Len=121 TSval=1216837 TSecr=30037704
 60 0.000507060 172.31.31.144 -> 172.31.23.72 TCP 308 6633 → 45538 [PSH, ACK] Seq=848 Ack=1 Win=853 Len=242 TSval=1216837 TSecr=30037704
 61 0.000508805 172.31.31.144 -> 172.31.23.72 TCP 187 6633 → 45538 [PSH, ACK] Seq=1090 Ack=1 Win=853 Len=121 TSval=1216838 TSecr=30037704
 62 0.000706830 172.31.23.72 -> 172.31.31.144 TCP 66 45546 → 6633 [ACK] Seq=1 Ack=969 Win=213 Len=0 TSval=30038429 TSecr=1216837
 63 0.000988198 172.31.23.72 -> 172.31.31.144 TCP 66 45534 → 6633 [ACK] Seq=1 Ack=727 Win=213 Len=0 TSval=30038429 TSecr=1216837
 64 0.001317748 172.31.23.72 -> 172.31.31.144 TCP 66 45530 → 6633 [ACK] Seq=1 Ack=969 Win=213 Len=0 TSval=30038429 TSecr=1216837
 65 0.001600809 172.31.23.72 -> 172.31.31.144 TCP 66 45514 → 6633 [ACK] Seq=1 Ack=969 Win=213 Len=0 TSval=30038429 TSecr=1216837
 66 0.001664642 172.31.23.72 -> 172.31.31.144 OpenFlow 189 Type: OFPT_PACKET_IN
 67 0.002068417 172.31.23.72 -> 172.31.31.144 OpenFlow 189 Type: OFPT_PACKET_IN
 68 0.002470879 172.31.23.72 -> 172.31.31.144 OpenFlow 189 Type: OFPT_PACKET_IN
 69 0.002621508 172.31.23.72 -> 172.31.31.144 OpenFlow 189 Type: OFPT_PACKET_IN
 70 0.002624988 172.31.23.72 -> 172.31.31.144 OpenFlow 189 Type: OFPT_PACKET_IN
 71 0.002735673 172.31.31.144 -> 172.31.23.72 TCP 66 6633 → 45528 [ACK] Seq=1211 Ack=124 Win=853 Len=0 TSval=1216838 TSecr=30038429
 72 0.002873985 172.31.23.72 -> 172.31.31.144 OpenFlow 189 Type: OFPT_PACKET_IN
 73 0.002891589 172.31.23.72 -> 172.31.31.144 OpenFlow 189 Type: OFPT_PACKET_IN
 74 0.003332304 172.31.23.72 -> 172.31.31.144 OpenFlow 189 Type: OFPT_PACKET_IN
 75 0.003354635 172.31.23.72 -> 172.31.31.144 OpenFlow 189 Type: OFPT_PACKET_IN
 76 0.003371903 172.31.23.72 -> 172.31.31.144 OpenFlow 189 Type: OFPT_PACKET_IN
 77 0.003392693 172.31.23.72 -> 172.31.31.144 OpenFlow 189 Type: OFPT_PACKET_IN
 78 0.003407226 172.31.23.72 -> 172.31.31.144 OpenFlow 189 Type: OFPT_PACKET_IN
 79 0.003424550 172.31.23.72 -> 172.31.31.144 OpenFlow 189 Type: OFPT_PACKET_IN
 80 0.003438444 172.31.23.72 -> 172.31.31.144 OpenFlow 189 Type: OFPT_PACKET_IN
 81 0.003464455 172.31.23.72 -> 172.31.31.144 OpenFlow 189 Type: OFPT_PACKET_IN
 82 0.003477650 172.31.23.72 -> 172.31.31.144 OpenFlow 189 Type: OFPT_PACKET_IN
 83 0.003491228 172.31.23.72 -> 172.31.31.144 OpenFlow 189 Type: OFPT_PACKET_IN
 84 0.003507642 172.31.23.72 -> 172.31.31.144 OpenFlow 189 Type: OFPT_PACKET_IN
 85 0.003521356 172.31.23.72 -> 172.31.31.144 OpenFlow 189 Type: OFPT_PACKET_IN
 86 0.003540954 172.31.23.72 -> 172.31.31.144 OpenFlow 189 Type: OFPT_PACKET_IN
 87 0.003557752 172.31.23.72 -> 172.31.31.144 OpenFlow 189 Type: OFPT_PACKET_IN
 88 0.003671851 172.31.23.72 -> 172.31.31.144 OpenFlow 189 Type: OFPT_PACKET_IN
 89 0.003688610 172.31.23.72 -> 172.31.31.144 OpenFlow 189 Type: OFPT_PACKET_IN
 90 0.003699718 172.31.23.72 -> 172.31.31.144 OpenFlow 189 Type: OFPT_PACKET_IN
 91 0.003939721 172.31.31.144 -> 172.31.23.72 TCP 66 6633 → 45518 [ACK] Seq=1211 Ack=124 Win=853 Len=0 TSval=1216838 TSecr=30038429
 92 0.003946729 172.31.31.144 -> 172.31.23.72 TCP 66 6633 → 45512 [ACK] Seq=1211 Ack=124 Win=853 Len=0 TSval=1216838 TSecr=30038429
 93 0.003949002 172.31.31.144 -> 172.31.23.72 TCP 66 6633 → 45528 [ACK] Seq=1211 Ack=247 Win=853 Len=0 TSval=1216838 TSecr=30038429
 94 0.003952423 172.31.23.72 -> 172.31.31.144 OpenFlow 189 Type: OFPT_PACKET_IN
 95 0.003958592 172.31.31.144 -> 172.31.23.72 TCP 66 6633 → 45518 [ACK] Seq=1211 Ack=247 Win=853 Len=0 TSval=1216838 TSecr=30038429
 96 0.004429307 172.31.23.72 -> 172.31.31.144 OpenFlow 189 Type: OFPT_PACKET_IN
 97 0.004432064 172.31.23.72 -> 172.31.31.144 OpenFlow 435 Type: OFPT_PACKET_IN
 98 0.004433922 172.31.23.72 -> 172.31.31.144 OpenFlow 435 Type: OFPT_PACKET_IN
 99 0.004435685 172.31.23.72 -> 172.31.31.144 OpenFlow 681 Type: OFPT_PACKET_IN
100 0.004437549 172.31.23.72 -> 172.31.31.144 OpenFlow 189 Type: OFPT_PACKET_IN
101 0.004439227 172.31.23.72 -> 172.31.31.144 OpenFlow 435 Type: OFPT_PACKET_IN
102 0.004440860 172.31.23.72 -> 172.31.31.144 OpenFlow 189 Type: OFPT_PACKET_IN
103 0.004442421 172.31.23.72 -> 172.31.31.144 OpenFlow 189 Type: OFPT_PACKET_IN
104 0.004443891 172.31.23.72 -> 172.31.31.144 OpenFlow 189 Type: OFPT_PACKET_IN
105 0.004445501 172.31.23.72 -> 172.31.31.144 OpenFlow 189 Type: OFPT_PACKET_IN
106 0.004900425 172.31.31.144 -> 172.31.23.72 TCP 66 6633 → 45512 [ACK] Seq=1211 Ack=247 Win=853 Len=0 TSval=1216839 TSecr=30038429
107 0.004904063 172.31.31.144 -> 172.31.23.72 TCP 66 6633 → 45538 [ACK] Seq=1211 Ack=124 Win=853 Len=0 TSval=1216839 TSecr=30038429
108 0.004905892 172.31.31.144 -> 172.31.23.72 TCP 66 6633 → 45544 [ACK] Seq=1 Ack=124 Win=853 Len=0 TSval=1216839 TSecr=30038430
109 0.004907800 172.31.31.144 -> 172.31.23.72 TCP 66 6633 → 45524 [ACK] Seq=1 Ack=124 Win=853 Len=0 TSval=1216839 TSecr=30038430
110 0.004909519 172.31.31.144 -> 172.31.23.72 TCP 66 6633 → 45522 [ACK] Seq=1 Ack=124 Win=853 Len=0 TSval=1216839 TSecr=30038430
111 0.004911403 172.31.31.144 -> 172.31.23.72 TCP 66 6633 → 45510 [ACK] Seq=1 Ack=124 Win=853 Len=0 TSval=1216839 TSecr=30038430
112 0.004913610 172.31.31.144 -> 172.31.23.72 TCP 66 6633 → 45540 [ACK] Seq=1 Ack=124 Win=853 Len=0 TSval=1216839 TSecr=30038430
113 0.004915563 172.31.31.144 -> 172.31.23.72 TCP 66 6633 → 45526 [ACK] Seq=1 Ack=124 Win=853 Len=0 TSval=1216839 TSecr=30038430
114 0.004917491 172.31.31.144 -> 172.31.23.72 TCP 66 6633 → 45550 [ACK] Seq=1 Ack=124 Win=853 Len=0 TSval=1216839 TSecr=30038430
115 0.004919348 172.31.31.144 -> 172.31.23.72 TCP 66 6633 → 45508 [ACK] Seq=1 Ack=124 Win=853 Len=0 TSval=1216839 TSecr=30038430
116 0.004921120 172.31.31.144 -> 172.31.23.72 TCP 66 6633 → 45542 [ACK] Seq=1 Ack=124 Win=853 Len=0 TSval=1216839 TSecr=30038430
117 0.004924283 172.31.23.72 -> 172.31.31.144 OpenFlow 189 Type: OFPT_PACKET_IN
118 0.004928443 172.31.31.144 -> 172.31.23.72 TCP 66 6633 → 45536 [ACK] Seq=1 Ack=124 Win=853 Len=0 TSval=1216839 TSecr=30038430
119 0.004931223 172.31.23.72 -> 172.31.31.144 OpenFlow 681 Type: OFPT_PACKET_IN
120 0.004932629 172.31.31.144 -> 172.31.23.72 TCP 66 6633 → 45548 [ACK] Seq=1 Ack=124 Win=853 Len=0 TSval=1216839 TSecr=30038430
121 0.004934777 172.31.23.72 -> 172.31.31.144 OpenFlow 435 Type: OFPT_PACKET_IN
122 0.004936075 172.31.31.144 -> 172.31.23.72 TCP 66 6633 → 45520 [ACK] Seq=1 Ack=124 Win=853 Len=0 TSval=1216839 TSecr=30038430
123 0.004938280 172.31.23.72 -> 172.31.31.144 OpenFlow 435 Type: OFPT_PACKET_IN
124 0.004939420 172.31.31.144 -> 172.31.23.72 TCP 66 6633 → 45516 [ACK] Seq=1 Ack=124 Win=853 Len=0 TSval=1216839 TSecr=30038430
125 0.004941846 172.31.23.72 -> 172.31.31.144 OpenFlow 435 Type: OFPT_PACKET_IN
126 0.004943168 172.31.31.144 -> 172.31.23.72 TCP 66 6633 → 45530 [ACK] Seq=969 Ack=124 Win=853 Len=0 TSval=1216839 TSecr=30038430
127 0.004945293 172.31.23.72 -> 172.31.31.144 OpenFlow 435 Type: OFPT_PACKET_IN
128 0.004954550 172.31.23.72 -> 172.31.31.144 OpenFlow 189 Type: OFPT_PACKET_IN
129 0.005431120 172.31.31.144 -> 172.31.23.72 TCP 66 6633 → 45514 [ACK] Seq=969 Ack=124 Win=853 Len=0 TSval=1216839 TSecr=30038430
130 0.005436401 172.31.31.144 -> 172.31.23.72 TCP 66 6633 → 45528 [ACK] Seq=1211 Ack=370 Win=853 Len=0 TSval=1216839 TSecr=30038430
131 0.005438363 172.31.31.144 -> 172.31.23.72 TCP 66 6633 → 45528 [ACK] Seq=1211 Ack=493 Win=853 Len=0 TSval=1216839 TSecr=30038430
132 0.005440293 172.31.31.144 -> 172.31.23.72 TCP 66 6633 → 45538 [ACK] Seq=1211 Ack=247 Win=853 Len=0 TSval=1216839 TSecr=30038430
133 0.005441922 172.31.31.144 -> 172.31.23.72 TCP 66 6633 → 45532 [ACK] Seq=1 Ack=493 Win=853 Len=0 TSval=1216839 TSecr=30038430
134 0.005444335 172.31.31.144 -> 172.31.23.72 TCP 66 6633 → 45544 [ACK] Seq=1 Ack=493 Win=853 Len=0 TSval=1216839 TSecr=30038430
135 0.005446172 172.31.31.144 -> 172.31.23.72 TCP 66 6633 → 45524 [ACK] Seq=1 Ack=739 Win=853 Len=0 TSval=1216839 TSecr=30038430
136 0.005447984 172.31.31.144 -> 172.31.23.72 TCP 66 6633 → 45522 [ACK] Seq=1 Ack=247 Win=853 Len=0 TSval=1216839 TSecr=30038430
137 0.005449660 172.31.31.144 -> 172.31.23.72 TCP 66 6633 → 45510 [ACK] Seq=1 Ack=493 Win=853 Len=0 TSval=1216839 TSecr=30038430
138 0.005451515 172.31.31.144 -> 172.31.23.72 TCP 66 6633 → 45540 [ACK] Seq=1 Ack=247 Win=853 Len=0 TSval=1216839 TSecr=30038430
139 0.005453104 172.31.31.144 -> 172.31.23.72 TCP 66 6633 → 45526 [ACK] Seq=1 Ack=247 Win=853 Len=0 TSval=1216839 TSecr=30038430
140 0.005776052 172.31.31.144 -> 172.31.23.72 TCP 66 6633 → 45550 [ACK] Seq=1 Ack=247 Win=853 Len=0 TSval=1216839 TSecr=30038430
141 0.005778080 172.31.31.144 -> 172.31.23.72 TCP 66 6633 → 45508 [ACK] Seq=1 Ack=247 Win=853 Len=0 TSval=1216839 TSecr=30038430
142 0.005779849 172.31.31.144 -> 172.31.23.72 TCP 66 6633 → 45542 [ACK] Seq=1 Ack=247 Win=853 Len=0 TSval=1216839 TSecr=30038430
143 0.005781625 172.31.31.144 -> 172.31.23.72 TCP 66 6633 → 45536 [ACK] Seq=1 Ack=739 Win=853 Len=0 TSval=1216839 TSecr=30038430
144 0.005783165 172.31.31.144 -> 172.31.23.72 TCP 66 6633 → 45548 [ACK] Seq=1 Ack=493 Win=853 Len=0 TSval=1216839 TSecr=30038430
145 0.005784771 172.31.31.144 -> 172.31.23.72 TCP 66 6633 → 45520 [ACK] Seq=1 Ack=493 Win=853 Len=0 TSval=1216839 TSecr=30038430
146 0.005786367 172.31.31.144 -> 172.31.23.72 TCP 66 6633 → 45516 [ACK] Seq=1 Ack=493 Win=853 Len=0 TSval=1216839 TSecr=30038430
147 0.005817113 172.31.31.144 -> 172.31.23.72 TCP 66 6633 → 45530 [ACK] Seq=969 Ack=493 Win=853 Len=0 TSval=1216839 TSecr=30038430
148 0.005856014 172.31.31.144 -> 172.31.23.72 TCP 66 6633 → 45514 [ACK] Seq=969 Ack=247 Win=853 Len=0 TSval=1216839 TSecr=30038430
149 0.096426556 172.31.31.144 -> 172.31.23.72 OpenFlow 187 Type: OFPT_PACKET_OUT
150 0.096450781 172.31.31.144 -> 172.31.23.72 OpenFlow 187 Type: OFPT_PACKET_OUT
151 0.096470348 172.31.31.144 -> 172.31.23.72 OpenFlow 187 Type: OFPT_PACKET_OUT
152 0.096486933 172.31.31.144 -> 172.31.23.72 OpenFlow 187 Type: OFPT_PACKET_OUT
153 0.096580478 172.31.31.144 -> 172.31.23.72 OpenFlow 187 Type: OFPT_PACKET_OUT
154 0.096583488 172.31.31.144 -> 172.31.23.72 OpenFlow 187 Type: OFPT_PACKET_OUT
155 0.096639142 172.31.31.144 -> 172.31.23.72 OpenFlow 187 Type: OFPT_PACKET_OUT
156 0.096687026 172.31.31.144 -> 172.31.23.72 OpenFlow 187 Type: OFPT_PACKET_OUT
157 0.096804576 172.31.31.144 -> 172.31.23.72 OpenFlow 187 Type: OFPT_PACKET_OUT
158 0.096810727 172.31.31.144 -> 172.31.23.72 OpenFlow 187 Type: OFPT_PACKET_OUT
159 0.096854621 172.31.31.144 -> 172.31.23.72 OpenFlow 187 Type: OFPT_PACKET_OUT
160 0.096901126 172.31.31.144 -> 172.31.23.72 OpenFlow 187 Type: OFPT_PACKET_OUT
161 0.096956949 172.31.31.144 -> 172.31.23.72 OpenFlow 187 Type: OFPT_PACKET_OUT
162 0.097022361 172.31.31.144 -> 172.31.23.72 OpenFlow 187 Type: OFPT_PACKET_OUT
163 0.097080477 172.31.31.144 -> 172.31.23.72 OpenFlow 187 Type: OFPT_PACKET_OUT
164 0.097115138 172.31.31.144 -> 172.31.23.72 OpenFlow 187 Type: OFPT_PACKET_OUT
165 0.097175600 172.31.31.144 -> 172.31.23.72 OpenFlow 187 Type: OFPT_PACKET_OUT
166 0.097182334 172.31.23.72 -> 172.31.31.144 TCP 66 45532 → 6633 [ACK] Seq=493 Ack=969 Win=213 Len=0 TSval=30038453 TSecr=1216862
167 0.097229787 172.31.31.144 -> 172.31.23.72 OpenFlow 187 Type: OFPT_PACKET_OUT
168 0.097377555 172.31.31.144 -> 172.31.23.72 OpenFlow 187 Type: OFPT_PACKET_OUT
169 0.097382293 172.31.31.144 -> 172.31.23.72 OpenFlow 187 Type: OFPT_PACKET_OUT
170 0.097384267 172.31.31.144 -> 172.31.23.72 OpenFlow 187 Type: OFPT_PACKET_OUT
171 0.097426987 172.31.23.72 -> 172.31.31.144 TCP 66 45544 → 6633 [ACK] Seq=493 Ack=727 Win=213 Len=0 TSval=30038453 TSecr=1216862
172 0.097436907 172.31.31.144 -> 172.31.23.72 OpenFlow 187 Type: OFPT_PACKET_OUT
173 0.097525131 172.31.31.144 -> 172.31.23.72 OpenFlow 187 Type: OFPT_PACKET_OUT
174 0.097638052 172.31.31.144 -> 172.31.23.72 OpenFlow 187 Type: OFPT_PACKET_OUT
175 0.097642808 172.31.31.144 -> 172.31.23.72 OpenFlow 187 Type: OFPT_PACKET_OUT
176 0.097704638 172.31.31.144 -> 172.31.23.72 OpenFlow 187 Type: OFPT_PACKET_OUT
177 0.097771080 172.31.31.144 -> 172.31.23.72 OpenFlow 187 Type: OFPT_PACKET_OUT
178 0.097831302 172.31.31.144 -> 172.31.23.72 OpenFlow 308 Type: OFPT_PACKET_OUT
179 0.097903604 172.31.31.144 -> 172.31.23.72 OpenFlow 187 Type: OFPT_PACKET_OUT
180 0.097941363 172.31.31.144 -> 172.31.23.72 OpenFlow 187 Type: OFPT_PACKET_OUT
181 0.097960658 172.31.23.72 -> 172.31.31.144 TCP 66 45524 → 6633 [ACK] Seq=739 Ack=1211 Win=213 Len=0 TSval=30038453 TSecr=1216862
182 0.097988795 172.31.31.144 -> 172.31.23.72 OpenFlow 187 Type: OFPT_PACKET_OUT
183 0.098135274 172.31.31.144 -> 172.31.23.72 OpenFlow 187 Type: OFPT_PACKET_OUT
184 0.098140053 172.31.31.144 -> 172.31.23.72 OpenFlow 187 Type: OFPT_PACKET_OUT
185 0.098142130 172.31.31.144 -> 172.31.23.72 OpenFlow 187 Type: OFPT_PACKET_OUT
186 0.098194847 172.31.31.144 -> 172.31.23.72 OpenFlow 187 Type: OFPT_PACKET_OUT
187 0.098243238 172.31.31.144 -> 172.31.23.72 OpenFlow 187 Type: OFPT_PACKET_OUT
188 0.098289551 172.31.23.72 -> 172.31.31.144 TCP 66 45522 → 6633 [ACK] Seq=247 Ack=727 Win=213 Len=0 TSval=30038453 TSecr=1216862
189 0.098320729 172.31.31.144 -> 172.31.23.72 OpenFlow 187 Type: OFPT_PACKET_OUT
190 0.098463823 172.31.31.144 -> 172.31.23.72 OpenFlow 187 Type: OFPT_PACKET_OUT
191 0.098469516 172.31.31.144 -> 172.31.23.72 OpenFlow 187 Type: OFPT_PACKET_OUT
192 0.098471687 172.31.31.144 -> 172.31.23.72 OpenFlow 187 Type: OFPT_PACKET_OUT
193 0.098535986 172.31.31.144 -> 172.31.23.72 OpenFlow 187 Type: OFPT_PACKET_OUT
194 0.098604479 172.31.31.144 -> 172.31.23.72 OpenFlow 187 Type: OFPT_PACKET_OUT
195 0.098643637 172.31.23.72 -> 172.31.31.144 TCP 66 45510 → 6633 [ACK] Seq=493 Ack=969 Win=213 Len=0 TSval=30038453 TSecr=1216862
196 0.098683204 172.31.31.144 -> 172.31.23.72 OpenFlow 187 Type: OFPT_PACKET_OUT
197 0.098736788 172.31.23.72 -> 172.31.31.144 OpenFlow 189 Type: OFPT_PACKET_IN
198 0.098774760 172.31.31.144 -> 172.31.23.72 OpenFlow 308 Type: OFPT_PACKET_OUT
199 0.098781556 172.31.23.72 -> 172.31.31.144 OpenFlow 189 Type: OFPT_PACKET_IN
200 0.099144595 172.31.31.144 -> 172.31.23.72 OpenFlow 187 Type: OFPT_PACKET_OUT
201 0.099149780 172.31.31.144 -> 172.31.23.72 OpenFlow 187 Type: OFPT_PACKET_OUT
202 0.099151760 172.31.31.144 -> 172.31.23.72 OpenFlow 187 Type: OFPT_PACKET_OUT
203 0.099154536 172.31.31.144 -> 172.31.23.72 OpenFlow 187 Type: OFPT_PACKET_OUT
204 0.099156586 172.31.31.144 -> 172.31.23.72 OpenFlow 187 Type: OFPT_PACKET_OUT
205 0.099157967 172.31.31.144 -> 172.31.23.72 TCP 66 6633 → 45540 [ACK] Seq=1211 Ack=370 Win=853 Len=0 TSval=1216862 TSecr=30038453
206 0.099161385 172.31.31.144 -> 172.31.23.72 OpenFlow 187 Type: OFPT_PACKET_OUT
207 0.099162950 172.31.31.144 -> 172.31.23.72 OpenFlow 187 Type: OFPT_PACKET_OUT
208 0.099180888 172.31.31.144 -> 172.31.23.72 OpenFlow 187 Type: OFPT_PACKET_OUT
209 0.099190826 172.31.23.72 -> 172.31.31.144 OpenFlow 189 Type: OFPT_PACKET_IN
210 0.099281660 172.31.31.144 -> 172.31.23.72 TCP 66 6633 → 45540 [ACK] Seq=1211 Ack=493 Win=853 Len=0 TSval=1216862 TSecr=30038453
211 0.099289794 172.31.31.144 -> 172.31.23.72 OpenFlow 187 Type: OFPT_PACKET_OUT
212 0.099294051 172.31.23.72 -> 172.31.31.144 OpenFlow 681 Type: OFPT_PACKET_IN
213 0.099391847 172.31.31.144 -> 172.31.23.72 OpenFlow 187 Type: OFPT_PACKET_OUT
214 0.099396588 172.31.31.144 -> 172.31.23.72 TCP 187 6633 → 45554 [PSH, ACK] Seq=1 Ack=1 Win=853 Len=121 TSval=1216862 TSecr=30037803
215 0.099399847 172.31.31.144 -> 172.31.23.72 TCP 187 6633 → 45554 [PSH, ACK] Seq=122 Ack=1 Win=853 Len=121 TSval=1216862 TSecr=30037803
216 0.099562046 172.31.31.144 -> 172.31.23.72 TCP 187 6633 → 45554 [PSH, ACK] Seq=243 Ack=1 Win=853 Len=121 TSval=1216862 TSecr=30037803
217 0.099566587 172.31.31.144 -> 172.31.23.72 TCP 66 6633 → 45526 [ACK] Seq=969 Ack=370 Win=853 Len=0 TSval=1216862 TSecr=30038454
218 0.099569751 172.31.31.144 -> 172.31.23.72 TCP 187 6633 → 45554 [PSH, ACK] Seq=364 Ack=1 Win=853 Len=121 TSval=1216862 TSecr=30037803
219 0.099571751 172.31.31.144 -> 172.31.23.72 TCP 187 6633 → 45554 [PSH, ACK] Seq=485 Ack=1 Win=853 Len=121 TSval=1216862 TSecr=30037803
220 0.099653866 172.31.31.144 -> 172.31.23.72 TCP 66 6633 → 45526 [ACK] Seq=969 Ack=985 Win=853 Len=0 TSval=1216862 TSecr=30038454
221 0.099702937 172.31.31.144 -> 172.31.23.72 TCP 187 6633 → 45554 [PSH, ACK] Seq=606 Ack=1 Win=853 Len=121 TSval=1216862 TSecr=30037803
222 0.099801465 172.31.23.72 -> 172.31.31.144 TCP 66 45554 → 6633 [ACK] Seq=1 Ack=727 Win=213 Len=0 TSval=30038454 TSecr=1216862
223 0.099879919 172.31.23.72 -> 172.31.31.144 OpenFlow 189 Type: OFPT_PACKET_IN
224 0.099904132 172.31.23.72 -> 172.31.31.144 OpenFlow 189 Type: OFPT_PACKET_IN
225 0.099909073 172.31.23.72 -> 172.31.31.144 OpenFlow 189 Type: OFPT_PACKET_IN
226 0.099923406 172.31.23.72 -> 172.31.31.144 OpenFlow 189 Type: OFPT_PACKET_IN
227 0.099942410 172.31.23.72 -> 172.31.31.144 OpenFlow 189 Type: OFPT_PACKET_IN
228 0.099967984 172.31.23.72 -> 172.31.31.144 OpenFlow 189 Type: OFPT_PACKET_IN
229 0.100069166 172.31.23.72 -> 172.31.31.144 OpenFlow 189 Type: OFPT_PACKET_IN
230 0.100072712 172.31.23.72 -> 172.31.31.144 OpenFlow 189 Type: OFPT_PACKET_IN
231 0.100074709 172.31.23.72 -> 172.31.31.144 OpenFlow 189 Type: OFPT_PACKET_IN
232 0.100091328 172.31.23.72 -> 172.31.31.144 OpenFlow 189 Type: OFPT_PACKET_IN
233 0.100105639 172.31.23.72 -> 172.31.31.144 OpenFlow 189 Type: OFPT_PACKET_IN
234 0.100120833 172.31.23.72 -> 172.31.31.144 OpenFlow 189 Type: OFPT_PACKET_IN
235 0.100133227 172.31.23.72 -> 172.31.31.144 OpenFlow 189 Type: OFPT_PACKET_IN
236 0.100147627 172.31.23.72 -> 172.31.31.144 OpenFlow 189 Type: OFPT_PACKET_IN
237 0.100161814 172.31.23.72 -> 172.31.31.144 OpenFlow 189 Type: OFPT_PACKET_IN
238 0.100172613 172.31.23.72 -> 172.31.31.144 OpenFlow 189 Type: OFPT_PACKET_IN
239 0.100183370 172.31.23.72 -> 172.31.31.144 OpenFlow 189 Type: OFPT_PACKET_IN
240 0.100196100 172.31.31.144 -> 172.31.23.72 TCP 66 6633 → 45552 [ACK] Seq=1 Ack=124 Win=853 Len=0 TSval=1216862 TSecr=30038454
241 0.100200908 172.31.31.144 -> 172.31.23.72 TCP 66 6633 → 45552 [ACK] Seq=1 Ack=247 Win=853 Len=0 TSval=1216862 TSecr=30038454
242 0.100202731 172.31.31.144 -> 172.31.23.72 TCP 66 6633 → 45550 [ACK] Seq=1 Ack=370 Win=853 Len=0 TSval=1216862 TSecr=30038454
243 0.100220260 172.31.23.72 -> 172.31.31.144 OpenFlow 189 Type: OFPT_PACKET_IN
244 0.100226247 172.31.23.72 -> 172.31.31.144 OpenFlow 435 Type: OFPT_PACKET_IN
245 0.100238283 172.31.23.72 -> 172.31.31.144 OpenFlow 189 Type: OFPT_PACKET_IN
246 0.100311546 172.31.23.72 -> 172.31.31.144 TCP 66 45540 → 6633 [ACK] Seq=493 Ack=1211 Win=213 Len=0 TSval=30038454 TSecr=1216862
247 0.100315213 172.31.23.72 -> 172.31.31.144 OpenFlow 435 Type: OFPT_PACKET_IN
248 0.100317170 172.31.23.72 -> 172.31.31.144 OpenFlow 189 Type: OFPT_PACKET_IN
249 0.100381942 172.31.23.72 -> 172.31.31.144 OpenFlow 189 Type: OFPT_PACKET_IN
250 0.100982122 172.31.23.72 -> 172.31.31.144 OpenFlow 435 Type: OFPT_PACKET_IN
251 0.100985355 172.31.23.72 -> 172.31.31.144 OpenFlow 435 Type: OFPT_PACKET_IN
252 0.100987011 172.31.23.72 -> 172.31.31.144 OpenFlow 189 Type: OFPT_PACKET_IN
253 0.100988551 172.31.23.72 -> 172.31.31.144 OpenFlow 435 Type: OFPT_PACKET_IN
254 0.100990180 172.31.23.72 -> 172.31.31.144 OpenFlow 435 Type: OFPT_PACKET_IN
255 0.100992045 172.31.23.72 -> 172.31.31.144 OpenFlow 189 Type: OFPT_PACKET_IN
256 0.100993550 172.31.23.72 -> 172.31.31.144 OpenFlow 189 Type: OFPT_PACKET_IN
257 0.100994888 172.31.23.72 -> 172.31.31.144 OpenFlow 435 Type: OFPT_PACKET_IN
258 0.101051330 172.31.31.144 -> 172.31.23.72 TCP 66 6633 → 45508 [ACK] Seq=1 Ack=370 Win=853 Len=0 TSval=1216863 TSecr=30038454
259 0.101056272 172.31.31.144 -> 172.31.23.72 TCP 66 6633 → 45542 [ACK] Seq=1 Ack=370 Win=853 Len=0 TSval=1216863 TSecr=30038454
260 0.101058332 172.31.31.144 -> 172.31.23.72 TCP 66 6633 → 45520 [ACK] Seq=1 Ack=616 Win=853 Len=0 TSval=1216863 TSecr=30038454
261 0.101060249 172.31.31.144 -> 172.31.23.72 TCP 66 6633 → 45546 [ACK] Seq=969 Ack=124 Win=853 Len=0 TSval=1216863 TSecr=30038454
262 0.101069562 172.31.31.144 -> 172.31.23.72 TCP 66 6633 → 45550 [ACK] Seq=1 Ack=493 Win=853 Len=0 TSval=1216863 TSecr=30038454
263 0.101071574 172.31.31.144 -> 172.31.23.72 TCP 66 6633 → 45508 [ACK] Seq=1 Ack=493 Win=853 Len=0 TSval=1216863 TSecr=30038454
264 0.101073156 172.31.31.144 -> 172.31.23.72 TCP 66 6633 → 45534 [ACK] Seq=727 Ack=124 Win=853 Len=0 TSval=1216863 TSecr=30038454
265 0.101074976 172.31.31.144 -> 172.31.23.72 TCP 66 6633 → 45530 [ACK] Seq=969 Ack=616 Win=853 Len=0 TSval=1216863 TSecr=30038454
266 0.101076695 172.31.31.144 -> 172.31.23.72 TCP 66 6633 → 45514 [ACK] Seq=969 Ack=370 Win=853 Len=0 TSval=1216863 TSecr=30038454
267 0.101078845 172.31.31.144 -> 172.31.23.72 TCP 66 6633 → 45528 [ACK] Seq=1211 Ack=616 Win=853 Len=0 TSval=1216863 TSecr=30038454
268 0.101080785 172.31.31.144 -> 172.31.23.72 TCP 66 6633 → 45518 [ACK] Seq=1211 Ack=370 Win=853 Len=0 TSval=1216863 TSecr=30038454
269 0.101082690 172.31.31.144 -> 172.31.23.72 TCP 66 6633 → 45512 [ACK] Seq=1211 Ack=370 Win=853 Len=0 TSval=1216863 TSecr=30038454
270 0.101510929 172.31.23.72 -> 172.31.31.144 OpenFlow 189 Type: OFPT_PACKET_IN
271 0.101515667 172.31.23.72 -> 172.31.31.144 OpenFlow 189 Type: OFPT_PACKET_IN
272 0.101517504 172.31.23.72 -> 172.31.31.144 OpenFlow 189 Type: OFPT_PACKET_IN
273 0.102081072 172.31.31.144 -> 172.31.23.72 TCP 66 6633 → 45538 [ACK] Seq=1211 Ack=370 Win=853 Len=0 TSval=1216863 TSecr=30038454
274 0.102085573 172.31.31.144 -> 172.31.23.72 TCP 66 6633 → 45542 [ACK] Seq=1 Ack=739 Win=853 Len=0 TSval=1216863 TSecr=30038454
275 0.102088733 172.31.31.144 -> 172.31.23.72 TCP 66 6633 → 45524 [ACK] Seq=1211 Ack=862 Win=853 Len=0 TSval=1216863 TSecr=30038454
276 0.102092021 172.31.31.144 -> 172.31.23.72 TCP 66 6633 → 45522 [ACK] Seq=727 Ack=370 Win=853 Len=0 TSval=1216863 TSecr=30038454
277 0.102095114 172.31.31.144 -> 172.31.23.72 TCP 66 6633 → 45520 [ACK] Seq=1 Ack=985 Win=853 Len=0 TSval=1216863 TSecr=30038454
278 0.102098436 172.31.31.144 -> 172.31.23.72 TCP 66 6633 → 45546 [ACK] Seq=969 Ack=247 Win=853 Len=0 TSval=1216863 TSecr=30038454
279 0.102101754 172.31.31.144 -> 172.31.23.72 TCP 66 6633 → 45552 [ACK] Seq=1 Ack=370 Win=853 Len=0 TSval=1216863 TSecr=30038454
280 0.102104901 172.31.31.144 -> 172.31.23.72 TCP 66 6633 → 45534 [ACK] Seq=727 Ack=493 Win=853 Len=0 TSval=1216863 TSecr=30038454
281 0.102107915 172.31.31.144 -> 172.31.23.72 TCP 66 6633 → 45530 [ACK] Seq=969 Ack=985 Win=853 Len=0 TSval=1216863 TSecr=30038454
282 0.102117273 172.31.31.144 -> 172.31.23.72 TCP 66 6633 → 45514 [ACK] Seq=969 Ack=493 Win=853 Len=0 TSval=1216863 TSecr=30038454
283 0.102120694 172.31.31.144 -> 172.31.23.72 TCP 66 6633 → 45528 [ACK] Seq=1211 Ack=985 Win=853 Len=0 TSval=1216863 TSecr=30038454
284 0.102123650 172.31.31.144 -> 172.31.23.72 TCP 66 6633 → 45518 [ACK] Seq=1211 Ack=739 Win=853 Len=0 TSval=1216863 TSecr=30038454
285 0.102199075 172.31.31.144 -> 172.31.23.72 TCP 66 6633 → 45512 [ACK] Seq=1211 Ack=493 Win=853 Len=0 TSval=1216863 TSecr=30038454
286 0.102202844 172.31.31.144 -> 172.31.23.72 TCP 66 6633 → 45538 [ACK] Seq=1211 Ack=493 Win=853 Len=0 TSval=1216863 TSecr=30038454
287 0.102205841 172.31.31.144 -> 172.31.23.72 TCP 66 6633 → 45532 [ACK] Seq=969 Ack=985 Win=853 Len=0 TSval=1216863 TSecr=30038454
288 0.102369973 172.31.31.144 -> 172.31.23.72 TCP 66 6633 → 45524 [ACK] Seq=1211 Ack=985 Win=853 Len=0 TSval=1216863 TSecr=30038454
289 0.102373819 172.31.31.144 -> 172.31.23.72 TCP 66 6633 → 45522 [ACK] Seq=727 Ack=493 Win=853 Len=0 TSval=1216863 TSecr=30038454
290 0.102377060 172.31.31.144 -> 172.31.23.72 TCP 66 6633 → 45552 [ACK] Seq=1 Ack=493 Win=853 Len=0 TSval=1216863 TSecr=30038454
291 0.139172093 172.31.23.72 -> 172.31.31.144 TCP 66 45526 → 6633 [ACK] Seq=985 Ack=969 Win=213 Len=0 TSval=30038464 TSecr=1216862
292 0.195998157 172.31.31.144 -> 172.31.23.72 OpenFlow 187 Type: OFPT_PACKET_OUT
293 0.196017927 172.31.31.144 -> 172.31.23.72 OpenFlow 187 Type: OFPT_PACKET_OUT
294 0.196036453 172.31.31.144 -> 172.31.23.72 OpenFlow 187 Type: OFPT_PACKET_OUT
295 0.196066440 172.31.31.144 -> 172.31.23.72 OpenFlow 187 Type: OFPT_PACKET_OUT
296 0.196119581 172.31.31.144 -> 172.31.23.72 OpenFlow 187 Type: OFPT_PACKET_OUT
297 0.196183180 172.31.31.144 -> 172.31.23.72 OpenFlow 187 Type: OFPT_PACKET_OUT
298 0.196241520 172.31.31.144 -> 172.31.23.72 OpenFlow 187 Type: OFPT_PACKET_OUT
299 0.196300339 172.31.31.144 -> 172.31.23.72 OpenFlow 187 Type: OFPT_PACKET_OUT
300 0.196364416 172.31.31.144 -> 172.31.23.72 OpenFlow 187 Type: OFPT_PACKET_OUT
301 0.196411668 172.31.31.144 -> 172.31.23.72 OpenFlow 187 Type: OFPT_PACKET_OUT
302 0.196456389 172.31.31.144 -> 172.31.23.72 OpenFlow 187 Type: OFPT_PACKET_OUT
303 0.196506645 172.31.31.144 -> 172.31.23.72 OpenFlow 187 Type: OFPT_PACKET_OUT
304 0.196557004 172.31.31.144 -> 172.31.23.72 OpenFlow 187 Type: OFPT_PACKET_OUT
305 0.196607698 172.31.31.144 -> 172.31.23.72 OpenFlow 187 Type: OFPT_PACKET_OUT
306 0.196661700 172.31.31.144 -> 172.31.23.72 OpenFlow 187 Type: OFPT_PACKET_OUT
307 0.196698899 172.31.23.72 -> 172.31.31.144 TCP 66 45552 → 6633 [ACK] Seq=493 Ack=969 Win=213 Len=0 TSval=30038478 TSecr=1216886
308 0.196730983 172.31.31.144 -> 172.31.23.72 OpenFlow 187 Type: OFPT_PACKET_OUT
309 0.196786294 172.31.23.72 -> 172.31.31.144 OpenFlow 189 Type: OFPT_PACKET_IN
310 0.196873260 172.31.31.144 -> 172.31.23.72 OpenFlow 187 Type: OFPT_PACKET_OUT
311 0.196878845 172.31.31.144 -> 172.31.23.72 OpenFlow 187 Type: OFPT_PACKET_OUT
312 0.196884634 172.31.23.72 -> 172.31.31.144 OpenFlow 189 Type: OFPT_PACKET_IN
313 0.197037420 172.31.31.144 -> 172.31.23.72 OpenFlow 187 Type: OFPT_PACKET_OUT
314 0.197042131 172.31.31.144 -> 172.31.23.72 OpenFlow 187 Type: OFPT_PACKET_OUT
315 0.197161900 172.31.31.144 -> 172.31.23.72 OpenFlow 187 Type: OFPT_PACKET_OUT
316 0.197166588 172.31.31.144 -> 172.31.23.72 OpenFlow 187 Type: OFPT_PACKET_OUT
317 0.197168691 172.31.31.144 -> 172.31.23.72 TCP 66 6633 → 45550 [ACK] Seq=969 Ack=616 Win=853 Len=0 TSval=1216887 TSecr=30038478
318 0.197172419 172.31.31.144 -> 172.31.23.72 OpenFlow 187 Type: OFPT_PACKET_OUT
319 0.197175079 172.31.31.144 -> 172.31.23.72 OpenFlow 187 Type: OFPT_PACKET_OUT
320 0.197309205 172.31.31.144 -> 172.31.23.72 OpenFlow 187 Type: OFPT_PACKET_OUT
321 0.197314099 172.31.31.144 -> 172.31.23.72 TCP 66 6633 → 45550 [ACK] Seq=969 Ack=739 Win=853 Len=0 TSval=1216887 TSecr=30038478
322 0.197317117 172.31.31.144 -> 172.31.23.72 OpenFlow 187 Type: OFPT_PACKET_OUT
323 0.197319059 172.31.31.144 -> 172.31.23.72 OpenFlow 187 Type: OFPT_PACKET_OUT
324 0.197366377 172.31.31.144 -> 172.31.23.72 OpenFlow 187 Type: OFPT_PACKET_OUT
325 0.197416484 172.31.31.144 -> 172.31.23.72 OpenFlow 187 Type: OFPT_PACKET_OUT
326 0.197429296 172.31.23.72 -> 172.31.31.144 TCP 66 45508 → 6633 [ACK] Seq=493 Ack=727 Win=213 Len=0 TSval=30038478 TSecr=1216887
327 0.197474682 172.31.31.144 -> 172.31.23.72 OpenFlow 187 Type: OFPT_PACKET_OUT
328 0.197506736 172.31.23.72 -> 172.31.31.144 OpenFlow 189 Type: OFPT_PACKET_IN
329 0.197576843 172.31.31.144 -> 172.31.23.72 OpenFlow 187 Type: OFPT_PACKET_OUT
330 0.197585767 172.31.23.72 -> 172.31.31.144 OpenFlow 189 Type: OFPT_PACKET_IN
331 0.197695339 172.31.31.144 -> 172.31.23.72 OpenFlow 187 Type: OFPT_PACKET_OUT
332 0.197700213 172.31.31.144 -> 172.31.23.72 OpenFlow 187 Type: OFPT_PACKET_OUT
333 0.197865907 172.31.31.144 -> 172.31.23.72 OpenFlow 187 Type: OFPT_PACKET_OUT
334 0.197870913 172.31.31.144 -> 172.31.23.72 OpenFlow 187 Type: OFPT_PACKET_OUT
335 0.197872661 172.31.31.144 -> 172.31.23.72 TCP 66 6633 → 45548 [ACK] Seq=969 Ack=616 Win=853 Len=0 TSval=1216887 TSecr=30038478
336 0.197875646 172.31.31.144 -> 172.31.23.72 OpenFlow 187 Type: OFPT_PACKET_OUT
337 0.197950609 172.31.31.144 -> 172.31.23.72 OpenFlow 187 Type: OFPT_PACKET_OUT
338 0.197957853 172.31.23.72 -> 172.31.31.144 TCP 66 45536 → 6633 [ACK] Seq=739 Ack=122 Win=213 Len=0 TSval=30038478 TSecr=1216887
339 0.197971655 172.31.31.144 -> 172.31.23.72 OpenFlow 187 Type: OFPT_PACKET_OUT
340 0.197974702 172.31.23.72 -> 172.31.31.144 TCP 66 45536 → 6633 [ACK] Seq=739 Ack=243 Win=213 Len=0 TSval=30038478 TSecr=1216887
341 0.197976038 172.31.31.144 -> 172.31.23.72 TCP 66 6633 → 45548 [ACK] Seq=969 Ack=739 Win=853 Len=0 TSval=1216887 TSecr=30038478
342 0.197978463 172.31.31.144 -> 172.31.23.72 OpenFlow 187 Type: OFPT_PACKET_OUT
343 0.197980437 172.31.23.72 -> 172.31.31.144 TCP 66 45536 → 6633 [ACK] Seq=739 Ack=364 Win=213 Len=0 TSval=30038478 TSecr=1216887
344 0.198012218 172.31.31.144 -> 172.31.23.72 OpenFlow 187 Type: OFPT_PACKET_OUT
345 0.198017453 172.31.23.72 -> 172.31.31.144 TCP 66 45536 → 6633 [ACK] Seq=739 Ack=485 Win=213 Len=0 TSval=30038478 TSecr=1216887
346 0.198141495 172.31.23.72 -> 172.31.31.144 TCP 66 45542 → 6633 [ACK] Seq=739 Ack=727 Win=213 Len=0 TSval=30038478 TSecr=1216887
347 0.198184879 172.31.31.144 -> 172.31.23.72 OpenFlow 187 Type: OFPT_PACKET_OUT
348 0.198190276 172.31.23.72 -> 172.31.31.144 TCP 66 45536 → 6633 [ACK] Seq=739 Ack=606 Win=213 Len=0 TSval=30038478 TSecr=1216887
349 0.198195488 172.31.31.144 -> 172.31.23.72 OpenFlow 187 Type: OFPT_PACKET_OUT
350 0.198197969 172.31.23.72 -> 172.31.31.144 TCP 66 45536 → 6633 [ACK] Seq=739 Ack=727 Win=213 Len=0 TSval=30038478 TSecr=1216887
351 0.198326069 172.31.31.144 -> 172.31.23.72 OpenFlow 187 Type: OFPT_PACKET_OUT
352 0.198331724 172.31.31.144 -> 172.31.23.72 OpenFlow 187 Type: OFPT_PACKET_OUT
353 0.198529199 172.31.31.144 -> 172.31.23.72 OpenFlow 187 Type: OFPT_PACKET_OUT
354 0.198534189 172.31.31.144 -> 172.31.23.72 OpenFlow 187 Type: OFPT_PACKET_OUT
355 0.198536208 172.31.31.144 -> 172.31.23.72 OpenFlow 187 Type: OFPT_PACKET_OUT
356 0.198537912 172.31.31.144 -> 172.31.23.72 OpenFlow 187 Type: OFPT_PACKET_OUT
357 0.198582435 172.31.31.144 -> 172.31.23.72 OpenFlow 187 Type: OFPT_PACKET_OUT
358 0.198626684 172.31.31.144 -> 172.31.23.72 OpenFlow 187 Type: OFPT_PACKET_OUT
359 0.198724631 172.31.31.144 -> 172.31.23.72 OpenFlow 187 Type: OFPT_PACKET_OUT
360 0.198729298 172.31.31.144 -> 172.31.23.72 OpenFlow 187 Type: OFPT_PACKET_OUT
361 0.198901823 172.31.31.144 -> 172.31.23.72 OpenFlow 187 Type: OFPT_PACKET_OUT
362 0.198907394 172.31.31.144 -> 172.31.23.72 OpenFlow 187 Type: OFPT_PACKET_OUT
363 0.198909673 172.31.31.144 -> 172.31.23.72 OpenFlow 187 Type: OFPT_PACKET_OUT
364 0.198944987 172.31.31.144 -> 172.31.23.72 OpenFlow 187 Type: OFPT_PACKET_OUT
365 0.198979934 172.31.23.72 -> 172.31.31.144 TCP 66 45520 → 6633 [ACK] Seq=985 Ack=1211 Win=213 Len=0 TSval=30038478 TSecr=1216887
366 0.198996428 172.31.31.144 -> 172.31.23.72 OpenFlow 187 Type: OFPT_PACKET_OUT
367 0.199056627 172.31.23.72 -> 172.31.31.144 OpenFlow 189 Type: OFPT_PACKET_IN
368 0.199076248 172.31.31.144 -> 172.31.23.72 OpenFlow 187 Type: OFPT_PACKET_OUT
369 0.199081368 172.31.23.72 -> 172.31.31.144 OpenFlow 189 Type: OFPT_PACKET_IN
370 0.199268311 172.31.31.144 -> 172.31.23.72 TCP 66 6633 → 45516 [ACK] Seq=727 Ack=616 Win=853 Len=0 TSval=1216887 TSecr=30038478
371 0.199393689 172.31.31.144 -> 172.31.23.72 TCP 66 6633 → 45516 [ACK] Seq=727 Ack=739 Win=853 Len=0 TSval=1216887 TSecr=30038478
372 0.199478585 172.31.23.72 -> 172.31.31.144 OpenFlow 189 Type: OFPT_PACKET_IN
373 0.199505950 172.31.23.72 -> 172.31.31.144 OpenFlow 435 Type: OFPT_PACKET_IN
374 0.199522136 172.31.23.72 -> 172.31.31.144 OpenFlow 189 Type: OFPT_PACKET_IN
375 0.199538524 172.31.23.72 -> 172.31.31.144 OpenFlow 189 Type: OFPT_PACKET_IN
376 0.199550688 172.31.23.72 -> 172.31.31.144 OpenFlow 189 Type: OFPT_PACKET_IN
377 0.199567129 172.31.23.72 -> 172.31.31.144 OpenFlow 189 Type: OFPT_PACKET_IN
378 0.199583058 172.31.23.72 -> 172.31.31.144 OpenFlow 189 Type: OFPT_PACKET_IN
379 0.199597372 172.31.23.72 -> 172.31.31.144 OpenFlow 189 Type: OFPT_PACKET_IN
380 0.199599482 172.31.23.72 -> 172.31.31.144 OpenFlow 189 Type: OFPT_PACKET_IN
381 0.199625380 172.31.23.72 -> 172.31.31.144 OpenFlow 189 Type: OFPT_PACKET_IN
382 0.199628081 172.31.23.72 -> 172.31.31.144 OpenFlow 189 Type: OFPT_PACKET_IN
383 0.199640682 172.31.23.72 -> 172.31.31.144 OpenFlow 189 Type: OFPT_PACKET_IN
384 0.199652891 172.31.23.72 -> 172.31.31.144 OpenFlow 189 Type: OFPT_PACKET_IN
