  1 0.000000000 172.31.31.144 -> 172.31.23.72 TCP 187 6633 → 45546 [PSH, ACK] Seq=1 Ack=1 Win=853 Len=121 TSval=1218387 TSecr=30039254
  2 0.000029800 172.31.31.144 -> 172.31.23.72 TCP 187 6633 → 45546 [PSH, ACK] Seq=122 Ack=1 Win=853 Len=121 TSval=1218387 TSecr=30039254
  3 0.000034003 172.31.31.144 -> 172.31.23.72 TCP 187 6633 → 45546 [PSH, ACK] Seq=243 Ack=1 Win=853 Len=121 TSval=1218387 TSecr=30039254
  4 0.000055165 172.31.31.144 -> 172.31.23.72 TCP 187 6633 → 45546 [PSH, ACK] Seq=364 Ack=1 Win=853 Len=121 TSval=1218387 TSecr=30039254
  5 0.000057943 172.31.31.144 -> 172.31.23.72 TCP 187 6633 → 45546 [PSH, ACK] Seq=485 Ack=1 Win=853 Len=121 TSval=1218387 TSecr=30039254
  6 0.000106696 172.31.31.144 -> 172.31.23.72 TCP 187 6633 → 45546 [PSH, ACK] Seq=606 Ack=1 Win=853 Len=121 TSval=1218387 TSecr=30039254
  7 0.000166306 172.31.31.144 -> 172.31.23.72 TCP 187 6633 → 45546 [PSH, ACK] Seq=727 Ack=1 Win=853 Len=121 TSval=1218387 TSecr=30039254
  8 0.000215077 172.31.31.144 -> 172.31.23.72 TCP 187 6633 → 45546 [PSH, ACK] Seq=848 Ack=1 Win=853 Len=121 TSval=1218387 TSecr=30039254
  9 0.000293595 172.31.31.144 -> 172.31.23.72 TCP 187 6633 → 45534 [PSH, ACK] Seq=1 Ack=1 Win=853 Len=121 TSval=1218387 TSecr=30039254
 10 0.000335400 172.31.31.144 -> 172.31.23.72 TCP 187 6633 → 45534 [PSH, ACK] Seq=122 Ack=1 Win=853 Len=121 TSval=1218387 TSecr=30039254
 11 0.000394532 172.31.31.144 -> 172.31.23.72 TCP 187 6633 → 45534 [PSH, ACK] Seq=243 Ack=1 Win=853 Len=121 TSval=1218387 TSecr=30039254
 12 0.000457618 172.31.31.144 -> 172.31.23.72 TCP 187 6633 → 45534 [PSH, ACK] Seq=364 Ack=1 Win=853 Len=121 TSval=1218387 TSecr=30039254
 13 0.000494512 172.31.31.144 -> 172.31.23.72 TCP 187 6633 → 45534 [PSH, ACK] Seq=485 Ack=1 Win=853 Len=121 TSval=1218387 TSecr=30039254
 14 0.000539968 172.31.31.144 -> 172.31.23.72 TCP 187 6633 → 45534 [PSH, ACK] Seq=606 Ack=1 Win=853 Len=121 TSval=1218387 TSecr=30039254
 15 0.000611927 172.31.31.144 -> 172.31.23.72 TCP 187 6633 → 45530 [PSH, ACK] Seq=1 Ack=1 Win=853 Len=121 TSval=1218387 TSecr=30039228
 16 0.000688028 172.31.23.72 -> 172.31.31.144 TCP 66 45546 → 6633 [ACK] Seq=1 Ack=969 Win=213 Len=0 TSval=30039978 TSecr=1218387
 17 0.000729319 172.31.31.144 -> 172.31.23.72 TCP 187 6633 → 45530 [PSH, ACK] Seq=122 Ack=1 Win=853 Len=121 TSval=1218387 TSecr=30039228
 18 0.000779169 172.31.31.144 -> 172.31.23.72 TCP 187 6633 → 45530 [PSH, ACK] Seq=243 Ack=1 Win=853 Len=121 TSval=1218387 TSecr=30039228
 19 0.000783570 172.31.31.144 -> 172.31.23.72 TCP 187 6633 → 45530 [PSH, ACK] Seq=364 Ack=1 Win=853 Len=121 TSval=1218387 TSecr=30039228
 20 0.000854267 172.31.31.144 -> 172.31.23.72 TCP 187 6633 → 45530 [PSH, ACK] Seq=485 Ack=1 Win=853 Len=121 TSval=1218387 TSecr=30039228
 21 0.000858968 172.31.31.144 -> 172.31.23.72 TCP 187 6633 → 45530 [PSH, ACK] Seq=606 Ack=1 Win=853 Len=121 TSval=1218387 TSecr=30039228
 22 0.000980509 172.31.31.144 -> 172.31.23.72 TCP 187 6633 → 45530 [PSH, ACK] Seq=727 Ack=1 Win=853 Len=121 TSval=1218387 TSecr=30039228
 23 0.000985342 172.31.31.144 -> 172.31.23.72 TCP 187 6633 → 45530 [PSH, ACK] Seq=848 Ack=1 Win=853 Len=121 TSval=1218387 TSecr=30039228
 24 0.001045910 172.31.23.72 -> 172.31.31.144 TCP 66 45534 → 6633 [ACK] Seq=1 Ack=727 Win=213 Len=0 TSval=30039978 TSecr=1218387
 25 0.001103760 172.31.31.144 -> 172.31.23.72 TCP 187 6633 → 45514 [PSH, ACK] Seq=1 Ack=1 Win=853 Len=121 TSval=1218387 TSecr=30039254
 26 0.001110159 172.31.31.144 -> 172.31.23.72 TCP 187 6633 → 45514 [PSH, ACK] Seq=122 Ack=1 Win=853 Len=121 TSval=1218387 TSecr=30039254
 27 0.001213192 172.31.31.144 -> 172.31.23.72 TCP 187 6633 → 45514 [PSH, ACK] Seq=243 Ack=1 Win=853 Len=121 TSval=1218387 TSecr=30039254
 28 0.001217987 172.31.31.144 -> 172.31.23.72 TCP 187 6633 → 45514 [PSH, ACK] Seq=364 Ack=1 Win=853 Len=121 TSval=1218387 TSecr=30039254
 29 0.001289938 172.31.31.144 -> 172.31.23.72 TCP 187 6633 → 45514 [PSH, ACK] Seq=485 Ack=1 Win=853 Len=121 TSval=1218387 TSecr=30039254
 30 0.001314888 172.31.31.144 -> 172.31.23.72 TCP 187 6633 → 45514 [PSH, ACK] Seq=606 Ack=1 Win=853 Len=121 TSval=1218387 TSecr=30039254
 31 0.001375294 172.31.31.144 -> 172.31.23.72 TCP 187 6633 → 45514 [PSH, ACK] Seq=727 Ack=1 Win=853 Len=121 TSval=1218387 TSecr=30039254
 32 0.001418770 172.31.31.144 -> 172.31.23.72 TCP 187 6633 → 45514 [PSH, ACK] Seq=848 Ack=1 Win=853 Len=121 TSval=1218387 TSecr=30039254
 33 0.001488238 172.31.23.72 -> 172.31.31.144 TCP 66 45530 → 6633 [ACK] Seq=1 Ack=969 Win=213 Len=0 TSval=30039978 TSecr=1218387
 34 0.001499332 172.31.31.144 -> 172.31.23.72 TCP 187 6633 → 45528 [PSH, ACK] Seq=1 Ack=1 Win=853 Len=121 TSval=1218387 TSecr=30039254
 35 0.001547901 172.31.31.144 -> 172.31.23.72 TCP 187 6633 → 45528 [PSH, ACK] Seq=122 Ack=1 Win=853 Len=121 TSval=1218387 TSecr=30039254
 36 0.001600345 172.31.31.144 -> 172.31.23.72 TCP 187 6633 → 45528 [PSH, ACK] Seq=243 Ack=1 Win=853 Len=121 TSval=1218387 TSecr=30039254
 37 0.001642984 172.31.31.144 -> 172.31.23.72 TCP 187 6633 → 45528 [PSH, ACK] Seq=364 Ack=1 Win=853 Len=121 TSval=1218387 TSecr=30039254
 38 0.001734281 172.31.31.144 -> 172.31.23.72 TCP 187 6633 → 45528 [PSH, ACK] Seq=485 Ack=1 Win=853 Len=121 TSval=1218387 TSecr=30039254
 39 0.001738700 172.31.31.144 -> 172.31.23.72 TCP 187 6633 → 45528 [PSH, ACK] Seq=606 Ack=1 Win=853 Len=121 TSval=1218387 TSecr=30039254
 40 0.001793173 172.31.31.144 -> 172.31.23.72 TCP 187 6633 → 45528 [PSH, ACK] Seq=727 Ack=1 Win=853 Len=121 TSval=1218387 TSecr=30039254
 41 0.001857803 172.31.31.144 -> 172.31.23.72 TCP 187 6633 → 45528 [PSH, ACK] Seq=848 Ack=1 Win=853 Len=121 TSval=1218387 TSecr=30039254
 42 0.001889839 172.31.23.72 -> 172.31.31.144 TCP 66 45514 → 6633 [ACK] Seq=1 Ack=969 Win=213 Len=0 TSval=30039978 TSecr=1218387
 43 0.001896254 172.31.31.144 -> 172.31.23.72 TCP 187 6633 → 45528 [PSH, ACK] Seq=969 Ack=1 Win=853 Len=121 TSval=1218387 TSecr=30039254
 44 0.001971526 172.31.31.144 -> 172.31.23.72 TCP 187 6633 → 45528 [PSH, ACK] Seq=1090 Ack=1 Win=853 Len=121 TSval=1218387 TSecr=30039254
 45 0.001990793 172.31.23.72 -> 172.31.31.144 OpenFlow 189 Type: OFPT_PACKET_IN
 46 0.002031627 172.31.31.144 -> 172.31.23.72 TCP 187 6633 → 45518 [PSH, ACK] Seq=1 Ack=1 Win=853 Len=121 TSval=1218387 TSecr=30039254
 47 0.002053894 172.31.23.72 -> 172.31.31.144 OpenFlow 189 Type: OFPT_PACKET_IN
 48 0.002080436 172.31.31.144 -> 172.31.23.72 TCP 187 6633 → 45518 [PSH, ACK] Seq=122 Ack=1 Win=853 Len=121 TSval=1218387 TSecr=30039254
 49 0.002127840 172.31.31.144 -> 172.31.23.72 TCP 187 6633 → 45518 [PSH, ACK] Seq=243 Ack=1 Win=853 Len=121 TSval=1218387 TSecr=30039254
 50 0.002277768 172.31.31.144 -> 172.31.23.72 TCP 187 6633 → 45518 [PSH, ACK] Seq=364 Ack=1 Win=853 Len=121 TSval=1218387 TSecr=30039254
 51 0.002282995 172.31.31.144 -> 172.31.23.72 TCP 66 6633 → 45528 [ACK] Seq=1211 Ack=124 Win=853 Len=0 TSval=1218387 TSecr=30039978
 52 0.002287116 172.31.31.144 -> 172.31.23.72 TCP 187 6633 → 45518 [PSH, ACK] Seq=485 Ack=1 Win=853 Len=121 TSval=1218387 TSecr=30039254
 53 0.002288702 172.31.31.144 -> 172.31.23.72 TCP 66 6633 → 45528 [ACK] Seq=1211 Ack=247 Win=853 Len=0 TSval=1218387 TSecr=30039978
 54 0.002291054 172.31.31.144 -> 172.31.23.72 TCP 187 6633 → 45518 [PSH, ACK] Seq=606 Ack=1 Win=853 Len=121 TSval=1218387 TSecr=30039254
 55 0.002337094 172.31.31.144 -> 172.31.23.72 TCP 187 6633 → 45518 [PSH, ACK] Seq=727 Ack=1 Win=853 Len=121 TSval=1218387 TSecr=30039254
 56 0.002384253 172.31.31.144 -> 172.31.23.72 TCP 187 6633 → 45518 [PSH, ACK] Seq=848 Ack=1 Win=853 Len=121 TSval=1218387 TSecr=30039254
 57 0.002436093 172.31.31.144 -> 172.31.23.72 TCP 187 6633 → 45518 [PSH, ACK] Seq=969 Ack=1 Win=853 Len=121 TSval=1218387 TSecr=30039254
 58 0.002489057 172.31.31.144 -> 172.31.23.72 TCP 187 6633 → 45518 [PSH, ACK] Seq=1090 Ack=1 Win=853 Len=121 TSval=1218387 TSecr=30039254
 59 0.002568480 172.31.31.144 -> 172.31.23.72 TCP 187 6633 → 45512 [PSH, ACK] Seq=1 Ack=1 Win=853 Len=121 TSval=1218387 TSecr=30039254
 60 0.002602263 172.31.31.144 -> 172.31.23.72 TCP 187 6633 → 45512 [PSH, ACK] Seq=122 Ack=1 Win=853 Len=121 TSval=1218387 TSecr=30039254
 61 0.002621132 172.31.23.72 -> 172.31.31.144 OpenFlow 189 Type: OFPT_PACKET_IN
 62 0.002663592 172.31.31.144 -> 172.31.23.72 TCP 187 6633 → 45512 [PSH, ACK] Seq=243 Ack=1 Win=853 Len=121 TSval=1218387 TSecr=30039254
 63 0.002670537 172.31.23.72 -> 172.31.31.144 OpenFlow 189 Type: OFPT_PACKET_IN
 64 0.002733924 172.31.31.144 -> 172.31.23.72 TCP 187 6633 → 45512 [PSH, ACK] Seq=364 Ack=1 Win=853 Len=121 TSval=1218387 TSecr=30039254
 65 0.002762076 172.31.31.144 -> 172.31.23.72 TCP 187 6633 → 45512 [PSH, ACK] Seq=485 Ack=1 Win=853 Len=121 TSval=1218387 TSecr=30039254
 66 0.002880250 172.31.31.144 -> 172.31.23.72 TCP 187 6633 → 45512 [PSH, ACK] Seq=606 Ack=1 Win=853 Len=121 TSval=1218387 TSecr=30039254
 67 0.002884914 172.31.31.144 -> 172.31.23.72 TCP 66 6633 → 45518 [ACK] Seq=1211 Ack=124 Win=853 Len=0 TSval=1218387 TSecr=30039979
 68 0.002887912 172.31.31.144 -> 172.31.23.72 TCP 66 6633 → 45518 [ACK] Seq=1211 Ack=247 Win=853 Len=0 TSval=1218387 TSecr=30039979
 69 0.002890115 172.31.31.144 -> 172.31.23.72 TCP 187 6633 → 45512 [PSH, ACK] Seq=727 Ack=1 Win=853 Len=121 TSval=1218387 TSecr=30039254
 70 0.002924354 172.31.31.144 -> 172.31.23.72 TCP 187 6633 → 45512 [PSH, ACK] Seq=848 Ack=1 Win=853 Len=121 TSval=1218387 TSecr=30039254
 71 0.002988975 172.31.31.144 -> 172.31.23.72 TCP 187 6633 → 45512 [PSH, ACK] Seq=969 Ack=1 Win=853 Len=121 TSval=1218387 TSecr=30039254
 72 0.003044640 172.31.31.144 -> 172.31.23.72 TCP 187 6633 → 45512 [PSH, ACK] Seq=1090 Ack=1 Win=853 Len=121 TSval=1218387 TSecr=30039254
 73 0.003104570 172.31.31.144 -> 172.31.23.72 TCP 187 6633 → 45538 [PSH, ACK] Seq=1 Ack=1 Win=853 Len=121 TSval=1218387 TSecr=30039254
 74 0.003158724 172.31.31.144 -> 172.31.23.72 TCP 187 6633 → 45538 [PSH, ACK] Seq=122 Ack=1 Win=853 Len=121 TSval=1218388 TSecr=30039254
 75 0.003208252 172.31.23.72 -> 172.31.31.144 OpenFlow 189 Type: OFPT_PACKET_IN
 76 0.003220208 172.31.31.144 -> 172.31.23.72 TCP 187 6633 → 45538 [PSH, ACK] Seq=243 Ack=1 Win=853 Len=121 TSval=1218388 TSecr=30039254
 77 0.003232414 172.31.23.72 -> 172.31.31.144 OpenFlow 189 Type: OFPT_PACKET_IN
 78 0.003284301 172.31.31.144 -> 172.31.23.72 TCP 187 6633 → 45538 [PSH, ACK] Seq=364 Ack=1 Win=853 Len=121 TSval=1218388 TSecr=30039254
 79 0.003340247 172.31.31.144 -> 172.31.23.72 TCP 187 6633 → 45538 [PSH, ACK] Seq=485 Ack=1 Win=853 Len=121 TSval=1218388 TSecr=30039254
 80 0.003446574 172.31.31.144 -> 172.31.23.72 TCP 187 6633 → 45538 [PSH, ACK] Seq=606 Ack=1 Win=853 Len=121 TSval=1218388 TSecr=30039254
 81 0.003451273 172.31.31.144 -> 172.31.23.72 TCP 66 6633 → 45512 [ACK] Seq=1211 Ack=124 Win=853 Len=0 TSval=1218388 TSecr=30039979
 82 0.003454652 172.31.31.144 -> 172.31.23.72 TCP 66 6633 → 45512 [ACK] Seq=1211 Ack=247 Win=853 Len=0 TSval=1218388 TSecr=30039979
 83 0.003456592 172.31.31.144 -> 172.31.23.72 TCP 187 6633 → 45538 [PSH, ACK] Seq=727 Ack=1 Win=853 Len=121 TSval=1218388 TSecr=30039254
 84 0.003496272 172.31.31.144 -> 172.31.23.72 TCP 187 6633 → 45538 [PSH, ACK] Seq=848 Ack=1 Win=853 Len=121 TSval=1218388 TSecr=30039254
 85 0.003539551 172.31.31.144 -> 172.31.23.72 TCP 187 6633 → 45538 [PSH, ACK] Seq=969 Ack=1 Win=853 Len=121 TSval=1218388 TSecr=30039254
 86 0.003588605 172.31.31.144 -> 172.31.23.72 TCP 187 6633 → 45538 [PSH, ACK] Seq=1090 Ack=1 Win=853 Len=121 TSval=1218388 TSecr=30039254
 87 0.003688942 172.31.23.72 -> 172.31.31.144 OpenFlow 189 Type: OFPT_PACKET_IN
 88 0.003714795 172.31.23.72 -> 172.31.31.144 OpenFlow 189 Type: OFPT_PACKET_IN
 89 0.003904894 172.31.31.144 -> 172.31.23.72 TCP 66 6633 → 45538 [ACK] Seq=1211 Ack=124 Win=853 Len=0 TSval=1218388 TSecr=30039979
 90 0.003910572 172.31.31.144 -> 172.31.23.72 TCP 66 6633 → 45538 [ACK] Seq=1211 Ack=247 Win=853 Len=0 TSval=1218388 TSecr=30039979
 91 0.004143072 172.31.23.72 -> 172.31.31.144 OpenFlow 189 Type: OFPT_PACKET_IN
 92 0.004166726 172.31.23.72 -> 172.31.31.144 OpenFlow 435 Type: OFPT_PACKET_IN
 93 0.004181551 172.31.23.72 -> 172.31.31.144 OpenFlow 189 Type: OFPT_PACKET_IN
 94 0.004199821 172.31.23.72 -> 172.31.31.144 OpenFlow 189 Type: OFPT_PACKET_IN
 95 0.004225354 172.31.23.72 -> 172.31.31.144 OpenFlow 189 Type: OFPT_PACKET_IN
 96 0.004227945 172.31.23.72 -> 172.31.31.144 OpenFlow 435 Type: OFPT_PACKET_IN
 97 0.004243239 172.31.23.72 -> 172.31.31.144 OpenFlow 189 Type: OFPT_PACKET_IN
 98 0.004251278 172.31.23.72 -> 172.31.31.144 OpenFlow 681 Type: OFPT_PACKET_IN
 99 0.004272948 172.31.23.72 -> 172.31.31.144 OpenFlow 189 Type: OFPT_PACKET_IN
100 0.004275882 172.31.23.72 -> 172.31.31.144 OpenFlow 189 Type: OFPT_PACKET_IN
101 0.004290975 172.31.23.72 -> 172.31.31.144 OpenFlow 189 Type: OFPT_PACKET_IN
102 0.004317253 172.31.23.72 -> 172.31.31.144 OpenFlow 189 Type: OFPT_PACKET_IN
103 0.004330985 172.31.23.72 -> 172.31.31.144 OpenFlow 189 Type: OFPT_PACKET_IN
104 0.004349883 172.31.23.72 -> 172.31.31.144 OpenFlow 189 Type: OFPT_PACKET_IN
105 0.004367461 172.31.23.72 -> 172.31.31.144 OpenFlow 189 Type: OFPT_PACKET_IN
106 0.004381092 172.31.23.72 -> 172.31.31.144 OpenFlow 189 Type: OFPT_PACKET_IN
107 0.004401950 172.31.23.72 -> 172.31.31.144 OpenFlow 189 Type: OFPT_PACKET_IN
108 0.004404569 172.31.23.72 -> 172.31.31.144 OpenFlow 435 Type: OFPT_PACKET_IN
109 0.004425277 172.31.23.72 -> 172.31.31.144 OpenFlow 189 Type: OFPT_PACKET_IN
110 0.004532756 172.31.23.72 -> 172.31.31.144 OpenFlow 189 Type: OFPT_PACKET_IN
111 0.004537032 172.31.23.72 -> 172.31.31.144 OpenFlow 189 Type: OFPT_PACKET_IN
112 0.004539016 172.31.23.72 -> 172.31.31.144 OpenFlow 189 Type: OFPT_PACKET_IN
113 0.004541446 172.31.23.72 -> 172.31.31.144 OpenFlow 189 Type: OFPT_PACKET_IN
114 0.004558180 172.31.23.72 -> 172.31.31.144 OpenFlow 189 Type: OFPT_PACKET_IN
115 0.004569306 172.31.23.72 -> 172.31.31.144 OpenFlow 189 Type: OFPT_PACKET_IN
116 0.004578389 172.31.31.144 -> 172.31.23.72 TCP 66 6633 → 45532 [ACK] Seq=1 Ack=493 Win=853 Len=0 TSval=1218388 TSecr=30039979
117 0.004583972 172.31.31.144 -> 172.31.23.72 TCP 66 6633 → 45544 [ACK] Seq=1 Ack=124 Win=853 Len=0 TSval=1218388 TSecr=30039979
118 0.004586475 172.31.31.144 -> 172.31.23.72 TCP 66 6633 → 45524 [ACK] Seq=1 Ack=124 Win=853 Len=0 TSval=1218388 TSecr=30039979
119 0.004588702 172.31.31.144 -> 172.31.23.72 TCP 66 6633 → 45522 [ACK] Seq=1 Ack=124 Win=853 Len=0 TSval=1218388 TSecr=30039979
120 0.004590740 172.31.31.144 -> 172.31.23.72 TCP 66 6633 → 45544 [ACK] Seq=1 Ack=493 Win=853 Len=0 TSval=1218388 TSecr=30039979
121 0.004834619 172.31.23.72 -> 172.31.31.144 OpenFlow 189 Type: OFPT_PACKET_IN
122 0.004840842 172.31.23.72 -> 172.31.31.144 OpenFlow 435 Type: OFPT_PACKET_IN
123 0.004842599 172.31.23.72 -> 172.31.31.144 OpenFlow 189 Type: OFPT_PACKET_IN
124 0.004844534 172.31.23.72 -> 172.31.31.144 OpenFlow 681 Type: OFPT_PACKET_IN
125 0.004846209 172.31.23.72 -> 172.31.31.144 OpenFlow 435 Type: OFPT_PACKET_IN
126 0.004847933 172.31.23.72 -> 172.31.31.144 OpenFlow 435 Type: OFPT_PACKET_IN
127 0.005185912 172.31.31.144 -> 172.31.23.72 TCP 66 6633 → 45524 [ACK] Seq=1 Ack=739 Win=853 Len=0 TSval=1218388 TSecr=30039979
128 0.005190114 172.31.31.144 -> 172.31.23.72 TCP 66 6633 → 45522 [ACK] Seq=1 Ack=247 Win=853 Len=0 TSval=1218388 TSecr=30039979
129 0.005192001 172.31.31.144 -> 172.31.23.72 TCP 66 6633 → 45508 [ACK] Seq=1 Ack=124 Win=853 Len=0 TSval=1218388 TSecr=30039979
130 0.005194567 172.31.31.144 -> 172.31.23.72 TCP 66 6633 → 45548 [ACK] Seq=1 Ack=124 Win=853 Len=0 TSval=1218388 TSecr=30039979
131 0.005196647 172.31.31.144 -> 172.31.23.72 TCP 66 6633 → 45542 [ACK] Seq=1 Ack=124 Win=853 Len=0 TSval=1218388 TSecr=30039979
132 0.005198721 172.31.31.144 -> 172.31.23.72 TCP 66 6633 → 45536 [ACK] Seq=1 Ack=124 Win=853 Len=0 TSval=1218388 TSecr=30039979
133 0.005200580 172.31.31.144 -> 172.31.23.72 TCP 66 6633 → 45520 [ACK] Seq=1 Ack=124 Win=853 Len=0 TSval=1218388 TSecr=30039979
134 0.005202555 172.31.31.144 -> 172.31.23.72 TCP 66 6633 → 45510 [ACK] Seq=1 Ack=493 Win=853 Len=0 TSval=1218388 TSecr=30039979
135 0.005205361 172.31.31.144 -> 172.31.23.72 TCP 66 6633 → 45516 [ACK] Seq=1 Ack=124 Win=853 Len=0 TSval=1218388 TSecr=30039979
136 0.005207358 172.31.31.144 -> 172.31.23.72 TCP 66 6633 → 45530 [ACK] Seq=969 Ack=124 Win=853 Len=0 TSval=1218388 TSecr=30039979
137 0.005210202 172.31.23.72 -> 172.31.31.144 OpenFlow 435 Type: OFPT_PACKET_IN
138 0.005214576 172.31.31.144 -> 172.31.23.72 TCP 66 6633 → 45540 [ACK] Seq=1 Ack=247 Win=853 Len=0 TSval=1218388 TSecr=30039979
139 0.005216965 172.31.31.144 -> 172.31.23.72 TCP 66 6633 → 45526 [ACK] Seq=1 Ack=247 Win=853 Len=0 TSval=1218388 TSecr=30039979
140 0.005224262 172.31.23.72 -> 172.31.31.144 OpenFlow 189 Type: OFPT_PACKET_IN
141 0.005226034 172.31.23.72 -> 172.31.31.144 OpenFlow 189 Type: OFPT_PACKET_IN
142 0.005353574 172.31.31.144 -> 172.31.23.72 TCP 66 6633 → 45550 [ACK] Seq=1 Ack=247 Win=853 Len=0 TSval=1218388 TSecr=30039979
143 0.005356245 172.31.31.144 -> 172.31.23.72 TCP 66 6633 → 45514 [ACK] Seq=969 Ack=124 Win=853 Len=0 TSval=1218388 TSecr=30039979
144 0.005358430 172.31.31.144 -> 172.31.23.72 TCP 66 6633 → 45528 [ACK] Seq=1211 Ack=370 Win=853 Len=0 TSval=1218388 TSecr=30039979
145 0.005572240 172.31.31.144 -> 172.31.23.72 TCP 66 6633 → 45542 [ACK] Seq=1 Ack=247 Win=853 Len=0 TSval=1218388 TSecr=30039979
146 0.005574557 172.31.31.144 -> 172.31.23.72 TCP 66 6633 → 45548 [ACK] Seq=1 Ack=493 Win=853 Len=0 TSval=1218388 TSecr=30039979
147 0.005576226 172.31.31.144 -> 172.31.23.72 TCP 66 6633 → 45520 [ACK] Seq=1 Ack=493 Win=853 Len=0 TSval=1218388 TSecr=30039979
148 0.005578066 172.31.31.144 -> 172.31.23.72 TCP 66 6633 → 45508 [ACK] Seq=1 Ack=247 Win=853 Len=0 TSval=1218388 TSecr=30039979
149 0.005579962 172.31.31.144 -> 172.31.23.72 TCP 66 6633 → 45536 [ACK] Seq=1 Ack=739 Win=853 Len=0 TSval=1218388 TSecr=30039979
150 0.005581677 172.31.31.144 -> 172.31.23.72 TCP 66 6633 → 45516 [ACK] Seq=1 Ack=493 Win=853 Len=0 TSval=1218388 TSecr=30039979
151 0.005583481 172.31.31.144 -> 172.31.23.72 TCP 66 6633 → 45530 [ACK] Seq=969 Ack=493 Win=853 Len=0 TSval=1218388 TSecr=30039979
152 0.005585164 172.31.31.144 -> 172.31.23.72 TCP 66 6633 → 45514 [ACK] Seq=969 Ack=247 Win=853 Len=0 TSval=1218388 TSecr=30039979
153 0.005684252 172.31.31.144 -> 172.31.23.72 TCP 66 6633 → 45528 [ACK] Seq=1211 Ack=493 Win=853 Len=0 TSval=1218388 TSecr=30039979
154 0.098914668 172.31.31.144 -> 172.31.23.72 OpenFlow 187 Type: OFPT_PACKET_OUT
155 0.098934076 172.31.31.144 -> 172.31.23.72 OpenFlow 187 Type: OFPT_PACKET_OUT
156 0.098938122 172.31.31.144 -> 172.31.23.72 OpenFlow 187 Type: OFPT_PACKET_OUT
157 0.098950777 172.31.31.144 -> 172.31.23.72 OpenFlow 187 Type: OFPT_PACKET_OUT
158 0.098991157 172.31.31.144 -> 172.31.23.72 OpenFlow 187 Type: OFPT_PACKET_OUT
159 0.099044769 172.31.31.144 -> 172.31.23.72 OpenFlow 187 Type: OFPT_PACKET_OUT
160 0.099095158 172.31.31.144 -> 172.31.23.72 OpenFlow 187 Type: OFPT_PACKET_OUT
161 0.099147082 172.31.31.144 -> 172.31.23.72 OpenFlow 187 Type: OFPT_PACKET_OUT
162 0.099232884 172.31.31.144 -> 172.31.23.72 OpenFlow 187 Type: OFPT_PACKET_OUT
163 0.099287012 172.31.31.144 -> 172.31.23.72 OpenFlow 187 Type: OFPT_PACKET_OUT
164 0.099332903 172.31.31.144 -> 172.31.23.72 OpenFlow 187 Type: OFPT_PACKET_OUT
165 0.099379634 172.31.31.144 -> 172.31.23.72 OpenFlow 187 Type: OFPT_PACKET_OUT
166 0.099435998 172.31.31.144 -> 172.31.23.72 OpenFlow 187 Type: OFPT_PACKET_OUT
167 0.099484555 172.31.31.144 -> 172.31.23.72 OpenFlow 187 Type: OFPT_PACKET_OUT
168 0.099556380 172.31.31.144 -> 172.31.23.72 OpenFlow 187 Type: OFPT_PACKET_OUT
169 0.099596396 172.31.31.144 -> 172.31.23.72 OpenFlow 187 Type: OFPT_PACKET_OUT
170 0.099618697 172.31.23.72 -> 172.31.31.144 TCP 66 45532 → 6633 [ACK] Seq=493 Ack=969 Win=213 Len=0 TSval=30040003 TSecr=1218411
171 0.099656431 172.31.31.144 -> 172.31.23.72 OpenFlow 187 Type: OFPT_PACKET_OUT
172 0.099703589 172.31.31.144 -> 172.31.23.72 OpenFlow 187 Type: OFPT_PACKET_OUT
173 0.099750802 172.31.31.144 -> 172.31.23.72 OpenFlow 187 Type: OFPT_PACKET_OUT
174 0.099795747 172.31.31.144 -> 172.31.23.72 OpenFlow 187 Type: OFPT_PACKET_OUT
175 0.099855727 172.31.31.144 -> 172.31.23.72 OpenFlow 187 Type: OFPT_PACKET_OUT
176 0.099912566 172.31.31.144 -> 172.31.23.72 OpenFlow 187 Type: OFPT_PACKET_OUT
177 0.099931922 172.31.23.72 -> 172.31.31.144 TCP 66 45544 → 6633 [ACK] Seq=493 Ack=727 Win=213 Len=0 TSval=30040003 TSecr=1218412
178 0.099968242 172.31.31.144 -> 172.31.23.72 OpenFlow 187 Type: OFPT_PACKET_OUT
179 0.100022468 172.31.31.144 -> 172.31.23.72 OpenFlow 187 Type: OFPT_PACKET_OUT
180 0.100074319 172.31.31.144 -> 172.31.23.72 OpenFlow 187 Type: OFPT_PACKET_OUT
181 0.100115948 172.31.31.144 -> 172.31.23.72 OpenFlow 187 Type: OFPT_PACKET_OUT
182 0.100167297 172.31.31.144 -> 172.31.23.72 OpenFlow 187 Type: OFPT_PACKET_OUT
183 0.100215683 172.31.31.144 -> 172.31.23.72 OpenFlow 187 Type: OFPT_PACKET_OUT
184 0.100271984 172.31.31.144 -> 172.31.23.72 OpenFlow 187 Type: OFPT_PACKET_OUT
185 0.100324391 172.31.31.144 -> 172.31.23.72 OpenFlow 187 Type: OFPT_PACKET_OUT
186 0.100392340 172.31.31.144 -> 172.31.23.72 OpenFlow 187 Type: OFPT_PACKET_OUT
187 0.100438462 172.31.31.144 -> 172.31.23.72 OpenFlow 187 Type: OFPT_PACKET_OUT
188 0.100490787 172.31.31.144 -> 172.31.23.72 OpenFlow 187 Type: OFPT_PACKET_OUT
189 0.100509326 172.31.23.72 -> 172.31.31.144 TCP 66 45524 → 6633 [ACK] Seq=739 Ack=1211 Win=213 Len=0 TSval=30040003 TSecr=1218412
190 0.100547890 172.31.31.144 -> 172.31.23.72 OpenFlow 187 Type: OFPT_PACKET_OUT
191 0.100595442 172.31.31.144 -> 172.31.23.72 OpenFlow 187 Type: OFPT_PACKET_OUT
192 0.100645253 172.31.31.144 -> 172.31.23.72 OpenFlow 187 Type: OFPT_PACKET_OUT
193 0.100696201 172.31.31.144 -> 172.31.23.72 OpenFlow 187 Type: OFPT_PACKET_OUT
194 0.100784002 172.31.31.144 -> 172.31.23.72 OpenFlow 187 Type: OFPT_PACKET_OUT
195 0.100820428 172.31.31.144 -> 172.31.23.72 OpenFlow 187 Type: OFPT_PACKET_OUT
196 0.100866309 172.31.23.72 -> 172.31.31.144 TCP 66 45522 → 6633 [ACK] Seq=247 Ack=727 Win=213 Len=0 TSval=30040003 TSecr=1218412
197 0.100879970 172.31.31.144 -> 172.31.23.72 OpenFlow 187 Type: OFPT_PACKET_OUT
198 0.100936440 172.31.31.144 -> 172.31.23.72 OpenFlow 187 Type: OFPT_PACKET_OUT
199 0.100981603 172.31.31.144 -> 172.31.23.72 OpenFlow 187 Type: OFPT_PACKET_OUT
200 0.101028964 172.31.31.144 -> 172.31.23.72 OpenFlow 187 Type: OFPT_PACKET_OUT
201 0.101083039 172.31.31.144 -> 172.31.23.72 OpenFlow 187 Type: OFPT_PACKET_OUT
202 0.101137684 172.31.31.144 -> 172.31.23.72 OpenFlow 187 Type: OFPT_PACKET_OUT
203 0.101187506 172.31.31.144 -> 172.31.23.72 OpenFlow 187 Type: OFPT_PACKET_OUT
204 0.101240916 172.31.31.144 -> 172.31.23.72 OpenFlow 187 Type: OFPT_PACKET_OUT
205 0.101268693 172.31.23.72 -> 172.31.31.144 TCP 66 45510 → 6633 [ACK] Seq=493 Ack=969 Win=213 Len=0 TSval=30040003 TSecr=1218412
206 0.101299389 172.31.31.144 -> 172.31.23.72 OpenFlow 187 Type: OFPT_PACKET_OUT
207 0.101351598 172.31.31.144 -> 172.31.23.72 OpenFlow 187 Type: OFPT_PACKET_OUT
208 0.101363801 172.31.23.72 -> 172.31.31.144 OpenFlow 189 Type: OFPT_PACKET_IN
209 0.101407738 172.31.31.144 -> 172.31.23.72 OpenFlow 187 Type: OFPT_PACKET_OUT
210 0.101414759 172.31.23.72 -> 172.31.31.144 OpenFlow 189 Type: OFPT_PACKET_IN
211 0.101454178 172.31.31.144 -> 172.31.23.72 OpenFlow 187 Type: OFPT_PACKET_OUT
212 0.101532374 172.31.31.144 -> 172.31.23.72 OpenFlow 187 Type: OFPT_PACKET_OUT
213 0.101600288 172.31.31.144 -> 172.31.23.72 OpenFlow 187 Type: OFPT_PACKET_OUT
214 0.101679532 172.31.31.144 -> 172.31.23.72 OpenFlow 187 Type: OFPT_PACKET_OUT
215 0.101684446 172.31.31.144 -> 172.31.23.72 OpenFlow 187 Type: OFPT_PACKET_OUT
216 0.101722508 172.31.31.144 -> 172.31.23.72 OpenFlow 187 Type: OFPT_PACKET_OUT
217 0.101750242 172.31.31.144 -> 172.31.23.72 TCP 66 6633 → 45540 [ACK] Seq=1211 Ack=493 Win=853 Len=0 TSval=1218412 TSecr=30040003
218 0.101791049 172.31.31.144 -> 172.31.23.72 TCP 187 6633 → 45554 [PSH, ACK] Seq=1 Ack=1 Win=853 Len=121 TSval=1218412 TSecr=30039254
219 0.101843293 172.31.31.144 -> 172.31.23.72 TCP 187 6633 → 45554 [PSH, ACK] Seq=122 Ack=1 Win=853 Len=121 TSval=1218412 TSecr=30039254
220 0.101891682 172.31.31.144 -> 172.31.23.72 TCP 187 6633 → 45554 [PSH, ACK] Seq=243 Ack=1 Win=853 Len=121 TSval=1218412 TSecr=30039254
221 0.101934339 172.31.31.144 -> 172.31.23.72 TCP 187 6633 → 45554 [PSH, ACK] Seq=364 Ack=1 Win=853 Len=121 TSval=1218412 TSecr=30039254
222 0.101971591 172.31.23.72 -> 172.31.31.144 OpenFlow 189 Type: OFPT_PACKET_IN
223 0.101992631 172.31.31.144 -> 172.31.23.72 TCP 187 6633 → 45554 [PSH, ACK] Seq=485 Ack=1 Win=853 Len=121 TSval=1218412 TSecr=30039254
224 0.101997982 172.31.23.72 -> 172.31.31.144 OpenFlow 435 Type: OFPT_PACKET_IN
225 0.102042769 172.31.31.144 -> 172.31.23.72 TCP 187 6633 → 45554 [PSH, ACK] Seq=606 Ack=1 Win=853 Len=121 TSval=1218412 TSecr=30039254
226 0.102052190 172.31.23.72 -> 172.31.31.144 OpenFlow 312 Type: OFPT_PACKET_IN
227 0.102410033 172.31.31.144 -> 172.31.23.72 TCP 66 6633 → 45526 [ACK] Seq=969 Ack=985 Win=853 Len=0 TSval=1218412 TSecr=30040003
228 0.102527116 172.31.23.72 -> 172.31.31.144 TCP 66 45554 → 6633 [ACK] Seq=1 Ack=727 Win=213 Len=0 TSval=30040004 TSecr=1218412
229 0.102598566 172.31.23.72 -> 172.31.31.144 OpenFlow 189 Type: OFPT_PACKET_IN
230 0.102623234 172.31.23.72 -> 172.31.31.144 OpenFlow 435 Type: OFPT_PACKET_IN
231 0.102635079 172.31.23.72 -> 172.31.31.144 OpenFlow 189 Type: OFPT_PACKET_IN
232 0.102649431 172.31.23.72 -> 172.31.31.144 OpenFlow 189 Type: OFPT_PACKET_IN
233 0.102671618 172.31.23.72 -> 172.31.31.144 OpenFlow 189 Type: OFPT_PACKET_IN
234 0.102692328 172.31.23.72 -> 172.31.31.144 OpenFlow 189 Type: OFPT_PACKET_IN
235 0.102694453 172.31.23.72 -> 172.31.31.144 OpenFlow 189 Type: OFPT_PACKET_IN
236 0.102774909 172.31.23.72 -> 172.31.31.144 OpenFlow 189 Type: OFPT_PACKET_IN
237 0.102781159 172.31.23.72 -> 172.31.31.144 OpenFlow 435 Type: OFPT_PACKET_IN
238 0.102782929 172.31.23.72 -> 172.31.31.144 OpenFlow 435 Type: OFPT_PACKET_IN
239 0.102805938 172.31.23.72 -> 172.31.31.144 OpenFlow 189 Type: OFPT_PACKET_IN
240 0.102823272 172.31.23.72 -> 172.31.31.144 OpenFlow 189 Type: OFPT_PACKET_IN
241 0.102839967 172.31.23.72 -> 172.31.31.144 OpenFlow 189 Type: OFPT_PACKET_IN
242 0.102856758 172.31.23.72 -> 172.31.31.144 OpenFlow 189 Type: OFPT_PACKET_IN
243 0.102869288 172.31.23.72 -> 172.31.31.144 OpenFlow 189 Type: OFPT_PACKET_IN
244 0.102884513 172.31.31.144 -> 172.31.23.72 TCP 66 6633 → 45552 [ACK] Seq=1 Ack=124 Win=853 Len=0 TSval=1218412 TSecr=30040004
245 0.102890569 172.31.31.144 -> 172.31.23.72 TCP 66 6633 → 45552 [ACK] Seq=1 Ack=493 Win=853 Len=0 TSval=1218412 TSecr=30040004
246 0.102892699 172.31.31.144 -> 172.31.23.72 TCP 66 6633 → 45508 [ACK] Seq=1 Ack=370 Win=853 Len=0 TSval=1218412 TSecr=30040004
247 0.102894804 172.31.31.144 -> 172.31.23.72 TCP 66 6633 → 45542 [ACK] Seq=1 Ack=370 Win=853 Len=0 TSval=1218412 TSecr=30040004
248 0.102907190 172.31.23.72 -> 172.31.31.144 OpenFlow 189 Type: OFPT_PACKET_IN
249 0.102927678 172.31.23.72 -> 172.31.31.144 OpenFlow 189 Type: OFPT_PACKET_IN
250 0.102940033 172.31.23.72 -> 172.31.31.144 OpenFlow 189 Type: OFPT_PACKET_IN
251 0.102955059 172.31.23.72 -> 172.31.31.144 OpenFlow 189 Type: OFPT_PACKET_IN
252 0.102973850 172.31.23.72 -> 172.31.31.144 OpenFlow 189 Type: OFPT_PACKET_IN
253 0.102985175 172.31.23.72 -> 172.31.31.144 OpenFlow 189 Type: OFPT_PACKET_IN
254 0.103248868 172.31.31.144 -> 172.31.23.72 TCP 66 6633 → 45520 [ACK] Seq=1 Ack=616 Win=853 Len=0 TSval=1218412 TSecr=30040004
255 0.103255202 172.31.31.144 -> 172.31.23.72 TCP 66 6633 → 45550 [ACK] Seq=1 Ack=493 Win=853 Len=0 TSval=1218412 TSecr=30040004
256 0.103257621 172.31.31.144 -> 172.31.23.72 TCP 66 6633 → 45508 [ACK] Seq=1 Ack=493 Win=853 Len=0 TSval=1218412 TSecr=30040004
257 0.103259632 172.31.31.144 -> 172.31.23.72 TCP 66 6633 → 45542 [ACK] Seq=1 Ack=739 Win=853 Len=0 TSval=1218412 TSecr=30040004
258 0.103261472 172.31.31.144 -> 172.31.23.72 TCP 66 6633 → 45520 [ACK] Seq=1 Ack=985 Win=853 Len=0 TSval=1218412 TSecr=30040004
259 0.103263050 172.31.31.144 -> 172.31.23.72 TCP 66 6633 → 45546 [ACK] Seq=969 Ack=124 Win=853 Len=0 TSval=1218413 TSecr=30040004
260 0.103266992 172.31.23.72 -> 172.31.31.144 OpenFlow 189 Type: OFPT_PACKET_IN
261 0.103272211 172.31.31.144 -> 172.31.23.72 TCP 66 6633 → 45534 [ACK] Seq=727 Ack=124 Win=853 Len=0 TSval=1218413 TSecr=30040004
262 0.103275324 172.31.23.72 -> 172.31.31.144 OpenFlow 435 Type: OFPT_PACKET_IN
263 0.103276771 172.31.31.144 -> 172.31.23.72 TCP 66 6633 → 45530 [ACK] Seq=969 Ack=616 Win=853 Len=0 TSval=1218413 TSecr=30040004
264 0.103279093 172.31.23.72 -> 172.31.31.144 OpenFlow 435 Type: OFPT_PACKET_IN
265 0.103284863 172.31.23.72 -> 172.31.31.144 OpenFlow 435 Type: OFPT_PACKET_IN
266 0.103286959 172.31.23.72 -> 172.31.31.144 OpenFlow 189 Type: OFPT_PACKET_IN
267 0.103288831 172.31.23.72 -> 172.31.31.144 OpenFlow 435 Type: OFPT_PACKET_IN
268 0.103471823 172.31.31.144 -> 172.31.23.72 TCP 66 6633 → 45514 [ACK] Seq=969 Ack=370 Win=853 Len=0 TSval=1218413 TSecr=30040004
269 0.103474345 172.31.31.144 -> 172.31.23.72 TCP 66 6633 → 45528 [ACK] Seq=1211 Ack=616 Win=853 Len=0 TSval=1218413 TSecr=30040004
270 0.103476188 172.31.31.144 -> 172.31.23.72 TCP 66 6633 → 45518 [ACK] Seq=1211 Ack=370 Win=853 Len=0 TSval=1218413 TSecr=30040004
271 0.103478037 172.31.31.144 -> 172.31.23.72 TCP 66 6633 → 45512 [ACK] Seq=1211 Ack=370 Win=853 Len=0 TSval=1218413 TSecr=30040004
272 0.103480733 172.31.23.72 -> 172.31.31.144 OpenFlow 189 Type: OFPT_PACKET_IN
273 0.103487947 172.31.23.72 -> 172.31.31.144 OpenFlow 189 Type: OFPT_PACKET_IN
274 0.103489734 172.31.23.72 -> 172.31.31.144 OpenFlow 435 Type: OFPT_PACKET_IN
275 0.103491292 172.31.23.72 -> 172.31.31.144 OpenFlow 189 Type: OFPT_PACKET_IN
276 0.103493039 172.31.23.72 -> 172.31.31.144 OpenFlow 189 Type: OFPT_PACKET_IN
277 0.103760843 172.31.31.144 -> 172.31.23.72 TCP 66 6633 → 45538 [ACK] Seq=1211 Ack=370 Win=853 Len=0 TSval=1218413 TSecr=30040004
278 0.103765296 172.31.31.144 -> 172.31.23.72 TCP 66 6633 → 45524 [ACK] Seq=1211 Ack=862 Win=853 Len=0 TSval=1218413 TSecr=30040004
279 0.103767166 172.31.31.144 -> 172.31.23.72 TCP 66 6633 → 45522 [ACK] Seq=727 Ack=370 Win=853 Len=0 TSval=1218413 TSecr=30040004
280 0.103768868 172.31.31.144 -> 172.31.23.72 TCP 66 6633 → 45546 [ACK] Seq=969 Ack=247 Win=853 Len=0 TSval=1218413 TSecr=30040004
281 0.103770837 172.31.31.144 -> 172.31.23.72 TCP 66 6633 → 45534 [ACK] Seq=727 Ack=493 Win=853 Len=0 TSval=1218413 TSecr=30040004
282 0.103772732 172.31.31.144 -> 172.31.23.72 TCP 66 6633 → 45530 [ACK] Seq=969 Ack=985 Win=853 Len=0 TSval=1218413 TSecr=30040004
283 0.103775078 172.31.31.144 -> 172.31.23.72 TCP 66 6633 → 45518 [ACK] Seq=1211 Ack=739 Win=853 Len=0 TSval=1218413 TSecr=30040004
284 0.103954880 172.31.31.144 -> 172.31.23.72 TCP 66 6633 → 45514 [ACK] Seq=969 Ack=493 Win=853 Len=0 TSval=1218413 TSecr=30040004
285 0.103957276 172.31.31.144 -> 172.31.23.72 TCP 66 6633 → 45528 [ACK] Seq=1211 Ack=985 Win=853 Len=0 TSval=1218413 TSecr=30040004
286 0.103959088 172.31.31.144 -> 172.31.23.72 TCP 66 6633 → 45512 [ACK] Seq=1211 Ack=493 Win=853 Len=0 TSval=1218413 TSecr=30040004
287 0.103960679 172.31.31.144 -> 172.31.23.72 TCP 66 6633 → 45538 [ACK] Seq=1211 Ack=493 Win=853 Len=0 TSval=1218413 TSecr=30040004
288 0.103997935 172.31.31.144 -> 172.31.23.72 TCP 66 6633 → 45532 [ACK] Seq=969 Ack=985 Win=853 Len=0 TSval=1218413 TSecr=30040004
289 0.104060565 172.31.31.144 -> 172.31.23.72 TCP 66 6633 → 45524 [ACK] Seq=1211 Ack=985 Win=853 Len=0 TSval=1218413 TSecr=30040004
290 0.104062723 172.31.31.144 -> 172.31.23.72 TCP 66 6633 → 45522 [ACK] Seq=727 Ack=493 Win=853 Len=0 TSval=1218413 TSecr=30040004
291 0.190028117 172.31.31.144 -> 172.31.23.72 OpenFlow 90 Type: OFPT_MULTIPART_REQUEST, OFPMP_PORT_STATS
292 0.190053172 172.31.31.144 -> 172.31.23.72 OpenFlow 138 Type: OFPT_MULTIPART_REQUEST, OFPMP_FLOW
293 0.190439100 172.31.23.72 -> 172.31.31.144 OpenFlow 530 Type: OFPT_MULTIPART_REPLY, OFPMP_PORT_STATS
294 0.190617620 172.31.23.72 -> 172.31.31.144 OpenFlow 6178 Type: OFPT_MULTIPART_REPLY, OFPMP_TABLE
295 0.190630764 172.31.31.144 -> 172.31.23.72 TCP 66 6633 → 45508 [ACK] Seq=97 Ack=957 Win=853 Len=0 TSval=1218434 TSecr=30040026
296 0.190702212 172.31.23.72 -> 172.31.31.144 OpenFlow 2010 Type: OFPT_MULTIPART_REPLY, OFPMP_FLOW
297 0.190866109 172.31.31.144 -> 172.31.23.72 TCP 66 6633 → 45508 [ACK] Seq=97 Ack=7069 Win=853 Len=0 TSval=1218434 TSecr=30040026
298 0.190938191 172.31.31.144 -> 172.31.23.72 TCP 66 6633 → 45508 [ACK] Seq=97 Ack=9013 Win=853 Len=0 TSval=1218434 TSecr=30040026
299 0.199271493 172.31.31.144 -> 172.31.23.72 OpenFlow 187 Type: OFPT_PACKET_OUT
300 0.199295833 172.31.31.144 -> 172.31.23.72 OpenFlow 187 Type: OFPT_PACKET_OUT
301 0.199366082 172.31.31.144 -> 172.31.23.72 OpenFlow 187 Type: OFPT_PACKET_OUT
302 0.199401379 172.31.31.144 -> 172.31.23.72 OpenFlow 187 Type: OFPT_PACKET_OUT
303 0.199455003 172.31.31.144 -> 172.31.23.72 OpenFlow 187 Type: OFPT_PACKET_OUT
304 0.199519314 172.31.31.144 -> 172.31.23.72 OpenFlow 187 Type: OFPT_PACKET_OUT
305 0.199569968 172.31.31.144 -> 172.31.23.72 OpenFlow 187 Type: OFPT_PACKET_OUT
306 0.199617069 172.31.31.144 -> 172.31.23.72 OpenFlow 187 Type: OFPT_PACKET_OUT
307 0.199691119 172.31.31.144 -> 172.31.23.72 OpenFlow 187 Type: OFPT_PACKET_OUT
308 0.199732613 172.31.31.144 -> 172.31.23.72 OpenFlow 187 Type: OFPT_PACKET_OUT
309 0.199781664 172.31.31.144 -> 172.31.23.72 OpenFlow 187 Type: OFPT_PACKET_OUT
310 0.199839371 172.31.31.144 -> 172.31.23.72 OpenFlow 187 Type: OFPT_PACKET_OUT
311 0.199857718 172.31.23.72 -> 172.31.31.144 TCP 66 45552 → 6633 [ACK] Seq=493 Ack=969 Win=213 Len=0 TSval=30040028 TSecr=1218437
312 0.199889793 172.31.31.144 -> 172.31.23.72 OpenFlow 187 Type: OFPT_PACKET_OUT
313 0.199938836 172.31.23.72 -> 172.31.31.144 OpenFlow 189 Type: OFPT_PACKET_IN
314 0.199985363 172.31.31.144 -> 172.31.23.72 OpenFlow 187 Type: OFPT_PACKET_OUT
315 0.199991688 172.31.23.72 -> 172.31.31.144 OpenFlow 189 Type: OFPT_PACKET_IN
316 0.200032980 172.31.31.144 -> 172.31.23.72 OpenFlow 187 Type: OFPT_PACKET_OUT
317 0.200056939 172.31.31.144 -> 172.31.23.72 OpenFlow 187 Type: OFPT_PACKET_OUT
318 0.200103452 172.31.31.144 -> 172.31.23.72 OpenFlow 187 Type: OFPT_PACKET_OUT
319 0.200155923 172.31.31.144 -> 172.31.23.72 OpenFlow 187 Type: OFPT_PACKET_OUT
320 0.200211741 172.31.31.144 -> 172.31.23.72 OpenFlow 187 Type: OFPT_PACKET_OUT
321 0.200264638 172.31.31.144 -> 172.31.23.72 OpenFlow 187 Type: OFPT_PACKET_OUT
322 0.200342472 172.31.31.144 -> 172.31.23.72 OpenFlow 187 Type: OFPT_PACKET_OUT
323 0.200346762 172.31.31.144 -> 172.31.23.72 TCP 66 6633 → 45550 [ACK] Seq=969 Ack=739 Win=853 Len=0 TSval=1218437 TSecr=30040028
324 0.200383109 172.31.31.144 -> 172.31.23.72 OpenFlow 187 Type: OFPT_PACKET_OUT
325 0.200392485 172.31.23.72 -> 172.31.31.144 TCP 66 45550 → 6633 [ACK] Seq=739 Ack=969 Win=213 Len=0 TSval=30040028 TSecr=1218437
326 0.200469349 172.31.31.144 -> 172.31.23.72 OpenFlow 187 Type: OFPT_PACKET_OUT
327 0.200522589 172.31.31.144 -> 172.31.23.72 OpenFlow 187 Type: OFPT_PACKET_OUT
328 0.200595695 172.31.31.144 -> 172.31.23.72 OpenFlow 187 Type: OFPT_PACKET_OUT
329 0.200642712 172.31.31.144 -> 172.31.23.72 OpenFlow 187 Type: OFPT_PACKET_OUT
330 0.200658209 172.31.23.72 -> 172.31.31.144 TCP 66 45508 → 6633 [ACK] Seq=9013 Ack=823 Win=213 Len=0 TSval=30040028 TSecr=1218437
331 0.200697450 172.31.31.144 -> 172.31.23.72 OpenFlow 187 Type: OFPT_PACKET_OUT
332 0.200701995 172.31.31.144 -> 172.31.23.72 OpenFlow 187 Type: OFPT_PACKET_OUT
333 0.200738395 172.31.23.72 -> 172.31.31.144 OpenFlow 189 Type: OFPT_PACKET_IN
334 0.200748920 172.31.31.144 -> 172.31.23.72 OpenFlow 187 Type: OFPT_PACKET_OUT
335 0.200763057 172.31.23.72 -> 172.31.31.144 OpenFlow 189 Type: OFPT_PACKET_IN
336 0.200806157 172.31.31.144 -> 172.31.23.72 OpenFlow 187 Type: OFPT_PACKET_OUT
337 0.200879326 172.31.31.144 -> 172.31.23.72 OpenFlow 187 Type: OFPT_PACKET_OUT
338 0.200939022 172.31.31.144 -> 172.31.23.72 OpenFlow 187 Type: OFPT_PACKET_OUT
339 0.200943846 172.31.31.144 -> 172.31.23.72 TCP 66 6633 → 45548 [ACK] Seq=969 Ack=616 Win=853 Len=0 TSval=1218437 TSecr=30040028
340 0.200978608 172.31.31.144 -> 172.31.23.72 OpenFlow 187 Type: OFPT_PACKET_OUT
341 0.201032503 172.31.31.144 -> 172.31.23.72 OpenFlow 187 Type: OFPT_PACKET_OUT
342 0.201100144 172.31.31.144 -> 172.31.23.72 OpenFlow 187 Type: OFPT_PACKET_OUT
343 0.201104598 172.31.31.144 -> 172.31.23.72 TCP 66 6633 → 45548 [ACK] Seq=969 Ack=739 Win=853 Len=0 TSval=1218437 TSecr=30040028
344 0.201131923 172.31.31.144 -> 172.31.23.72 OpenFlow 187 Type: OFPT_PACKET_OUT
345 0.201211128 172.31.31.144 -> 172.31.23.72 OpenFlow 187 Type: OFPT_PACKET_OUT
346 0.201255290 172.31.31.144 -> 172.31.23.72 OpenFlow 187 Type: OFPT_PACKET_OUT
347 0.201294862 172.31.31.144 -> 172.31.23.72 OpenFlow 187 Type: OFPT_PACKET_OUT
348 0.201348461 172.31.31.144 -> 172.31.23.72 OpenFlow 187 Type: OFPT_PACKET_OUT
349 0.201398073 172.31.31.144 -> 172.31.23.72 OpenFlow 187 Type: OFPT_PACKET_OUT
350 0.201406135 172.31.23.72 -> 172.31.31.144 TCP 66 45542 → 6633 [ACK] Seq=739 Ack=727 Win=213 Len=0 TSval=30040028 TSecr=1218437
351 0.201449607 172.31.31.144 -> 172.31.23.72 OpenFlow 187 Type: OFPT_PACKET_OUT
352 0.201543989 172.31.31.144 -> 172.31.23.72 OpenFlow 187 Type: OFPT_PACKET_OUT
353 0.201568543 172.31.31.144 -> 172.31.23.72 OpenFlow 187 Type: OFPT_PACKET_OUT
354 0.201625901 172.31.31.144 -> 172.31.23.72 OpenFlow 187 Type: OFPT_PACKET_OUT
355 0.201706166 172.31.31.144 -> 172.31.23.72 OpenFlow 187 Type: OFPT_PACKET_OUT
356 0.201740487 172.31.31.144 -> 172.31.23.72 OpenFlow 187 Type: OFPT_PACKET_OUT
357 0.201751543 172.31.23.72 -> 172.31.31.144 TCP 66 45536 → 6633 [ACK] Seq=739 Ack=727 Win=213 Len=0 TSval=30040028 TSecr=1218437
358 0.201805994 172.31.31.144 -> 172.31.23.72 OpenFlow 187 Type: OFPT_PACKET_OUT
359 0.201850930 172.31.31.144 -> 172.31.23.72 OpenFlow 187 Type: OFPT_PACKET_OUT
360 0.201915011 172.31.31.144 -> 172.31.23.72 OpenFlow 187 Type: OFPT_PACKET_OUT
361 0.201953726 172.31.31.144 -> 172.31.23.72 OpenFlow 187 Type: OFPT_PACKET_OUT
362 0.202008048 172.31.31.144 -> 172.31.23.72 OpenFlow 187 Type: OFPT_PACKET_OUT
363 0.202067339 172.31.31.144 -> 172.31.23.72 OpenFlow 187 Type: OFPT_PACKET_OUT
364 0.202073723 172.31.23.72 -> 172.31.31.144 TCP 66 45516 → 6633 [ACK] Seq=493 Ack=122 Win=213 Len=0 TSval=30040028 TSecr=1218437
365 0.202113690 172.31.31.144 -> 172.31.23.72 OpenFlow 187 Type: OFPT_PACKET_OUT
366 0.202119179 172.31.23.72 -> 172.31.31.144 TCP 66 45516 → 6633 [ACK] Seq=493 Ack=243 Win=213 Len=0 TSval=30040028 TSecr=1218437
367 0.202158039 172.31.31.144 -> 172.31.23.72 OpenFlow 187 Type: OFPT_PACKET_OUT
368 0.202165566 172.31.23.72 -> 172.31.31.144 TCP 66 45516 → 6633 [ACK] Seq=493 Ack=364 Win=213 Len=0 TSval=30040029 TSecr=1218437
369 0.202234933 172.31.31.144 -> 172.31.23.72 OpenFlow 187 Type: OFPT_PACKET_OUT
370 0.202242022 172.31.23.72 -> 172.31.31.144 TCP 66 45516 → 6633 [ACK] Seq=493 Ack=485 Win=213 Len=0 TSval=30040029 TSecr=1218437
371 0.202279830 172.31.31.144 -> 172.31.23.72 OpenFlow 187 Type: OFPT_PACKET_OUT
372 0.202284611 172.31.23.72 -> 172.31.31.144 TCP 66 45516 → 6633 [ACK] Seq=493 Ack=606 Win=213 Len=0 TSval=30040029 TSecr=1218437
373 0.202346326 172.31.31.144 -> 172.31.23.72 OpenFlow 187 Type: OFPT_PACKET_OUT
374 0.202352678 172.31.23.72 -> 172.31.31.144 TCP 66 45516 → 6633 [ACK] Seq=493 Ack=727 Win=213 Len=0 TSval=30040029 TSecr=1218437
375 0.202412840 172.31.23.72 -> 172.31.31.144 TCP 66 45520 → 6633 [ACK] Seq=985 Ack=1211 Win=213 Len=0 TSval=30040029 TSecr=1218437
376 0.202483280 172.31.23.72 -> 172.31.31.144 OpenFlow 189 Type: OFPT_PACKET_IN
377 0.202505379 172.31.23.72 -> 172.31.31.144 OpenFlow 189 Type: OFPT_PACKET_IN
378 0.202689119 172.31.31.144 -> 172.31.23.72 TCP 66 6633 → 45516 [ACK] Seq=727 Ack=616 Win=853 Len=0 TSval=1218437 TSecr=30040029
379 0.202695092 172.31.31.144 -> 172.31.23.72 TCP 66 6633 → 45516 [ACK] Seq=727 Ack=739 Win=853 Len=0 TSval=1218437 TSecr=30040029
380 0.202849454 172.31.23.72 -> 172.31.31.144 OpenFlow 189 Type: OFPT_PACKET_IN
