  1 0.000000000 137.158.125.247 -> 172.31.24.227 TCP 66 63468 → 22 [ACK] Seq=1 Ack=1 Win=32612 Len=0 SLE=261 SRE=297
  2 0.000027466 137.158.125.247 -> 172.31.24.227 TCP 54 63468 → 22 [ACK] Seq=1 Ack=297 Win=32464 Len=0
  3 0.086982572 137.158.125.247 -> 172.31.24.227 TCP 54 63468 → 22 [ACK] Seq=1 Ack=393 Win=32416 Len=0
  4 0.686509602 172.31.24.227 -> 137.158.125.247 SSH 98 Server: Encrypted packet (len=44)
  5 0.895821704 137.158.125.247 -> 172.31.24.227 TCP 54 63468 → 22 [ACK] Seq=1 Ack=437 Win=32394 Len=0
  6 1.192120593 172.31.24.227 -> 137.158.125.247 SSH 98 Server: Encrypted packet (len=44)
  7 1.199361068 172.31.31.144 -> 172.31.24.227 TCP 82 6633 → 53154 [PSH, ACK] Seq=1 Ack=1 Win=853 Len=16 TSval=1822650 TSecr=388715074
  8 1.199381612 172.31.31.144 -> 172.31.24.227 TCP 122 6633 → 53154 [PSH, ACK] Seq=17 Ack=1 Win=853 Len=56 TSval=1822650 TSecr=388715074
  9 1.199386145 172.31.31.144 -> 172.31.24.227 TCP 90 6633 → 53154 [PSH, ACK] Seq=73 Ack=1 Win=853 Len=24 TSval=1822650 TSecr=388715074
 10 1.199747970 172.31.24.227 -> 172.31.31.144 OpenFlow 6178 Type: OFPT_MULTIPART_REPLY, OFPMP_TABLE
 11 1.199837053 172.31.24.227 -> 172.31.31.144 OpenFlow 762 Type: OFPT_MULTIPART_REPLY, OFPMP_FLOW
 12 1.199954542 172.31.24.227 -> 172.31.31.144 OpenFlow 530 Type: OFPT_MULTIPART_REPLY, OFPMP_PORT_STATS
 13 1.200112019 172.31.31.144 -> 172.31.24.227 TCP 66 6633 → 53154 [ACK] Seq=97 Ack=6113 Win=853 Len=0 TSval=1822651 TSecr=388715506
 14 1.200120434 172.31.31.144 -> 172.31.24.227 TCP 66 6633 → 53154 [ACK] Seq=97 Ack=6809 Win=853 Len=0 TSval=1822651 TSecr=388715506
 15 1.200163818 172.31.31.144 -> 172.31.24.227 TCP 66 6633 → 53154 [ACK] Seq=97 Ack=7273 Win=853 Len=0 TSval=1822651 TSecr=388715506
 16 1.200517884 172.31.31.144 -> 172.31.24.227 TCP 82 6633 → 53158 [PSH, ACK] Seq=1 Ack=1 Win=853 Len=16 TSval=1822651 TSecr=388715073
 17 1.200527398 172.31.31.144 -> 172.31.24.227 TCP 146 6633 → 53158 [PSH, ACK] Seq=17 Ack=1 Win=853 Len=80 TSval=1822651 TSecr=388715073
 18 1.200728324 172.31.24.227 -> 172.31.31.144 OpenFlow 6178 Type: OFPT_MULTIPART_REPLY, OFPMP_TABLE
 19 1.200799761 172.31.24.227 -> 172.31.31.144 OpenFlow 2010 Type: OFPT_MULTIPART_REPLY, OFPMP_FLOW
 20 1.200896077 172.31.24.227 -> 172.31.31.144 OpenFlow 642 Type: OFPT_MULTIPART_REPLY, OFPMP_PORT_STATS
 21 1.201030120 172.31.31.144 -> 172.31.24.227 TCP 66 6633 → 53158 [ACK] Seq=97 Ack=6113 Win=853 Len=0 TSval=1822651 TSecr=388715506
 22 1.201036963 172.31.31.144 -> 172.31.24.227 TCP 66 6633 → 53158 [ACK] Seq=97 Ack=8057 Win=853 Len=0 TSval=1822651 TSecr=388715506
 23 1.201102453 172.31.31.144 -> 172.31.24.227 TCP 66 6633 → 53158 [ACK] Seq=97 Ack=8633 Win=853 Len=0 TSval=1822651 TSecr=388715506
 24 1.202761235 172.31.31.144 -> 172.31.24.227 TCP 122 6633 → 53156 [PSH, ACK] Seq=1 Ack=1 Win=853 Len=56 TSval=1822651 TSecr=388715075
 25 1.202769670 172.31.31.144 -> 172.31.24.227 TCP 90 6633 → 53170 [PSH, ACK] Seq=1 Ack=1 Win=853 Len=24 TSval=1822651 TSecr=388715049
 26 1.202772972 172.31.31.144 -> 172.31.24.227 TCP 90 6633 → 53156 [PSH, ACK] Seq=57 Ack=1 Win=853 Len=24 TSval=1822651 TSecr=388715075
 27 1.202872551 172.31.24.227 -> 172.31.31.144 OpenFlow 762 Type: OFPT_MULTIPART_REPLY, OFPMP_FLOW
 28 1.202983655 172.31.24.227 -> 172.31.31.144 OpenFlow 642 Type: OFPT_MULTIPART_REPLY, OFPMP_PORT_STATS
 29 1.203071330 172.31.31.144 -> 172.31.24.227 TCP 66 6633 → 53156 [ACK] Seq=81 Ack=697 Win=853 Len=0 TSval=1822651 TSecr=388715507
 30 1.203124003 172.31.24.227 -> 172.31.31.144 OpenFlow 530 Type: OFPT_MULTIPART_REPLY, OFPMP_PORT_STATS
 31 1.203205938 172.31.31.144 -> 172.31.24.227 TCP 66 6633 → 53156 [ACK] Seq=81 Ack=1273 Win=853 Len=0 TSval=1822651 TSecr=388715507
 32 1.203958499 172.31.31.144 -> 172.31.24.227 TCP 90 6633 → 53190 [PSH, ACK] Seq=1 Ack=1 Win=853 Len=24 TSval=1822651 TSecr=388715074
 33 1.203967835 172.31.31.144 -> 172.31.24.227 TCP 82 6633 → 53152 [PSH, ACK] Seq=1 Ack=1 Win=853 Len=16 TSval=1822651 TSecr=388715074
 34 1.203971051 172.31.31.144 -> 172.31.24.227 TCP 138 6633 → 53190 [PSH, ACK] Seq=25 Ack=1 Win=853 Len=72 TSval=1822651 TSecr=388715074
 35 1.203973990 172.31.31.144 -> 172.31.24.227 TCP 146 6633 → 53152 [PSH, ACK] Seq=17 Ack=1 Win=853 Len=80 TSval=1822651 TSecr=388715074
 36 1.203976365 172.31.31.144 -> 172.31.24.227 OpenFlow 82 Type: OFPT_MULTIPART_REQUEST, OFPMP_TABLE
 37 1.203979434 172.31.31.144 -> 172.31.24.227 OpenFlow 122 Type: OFPT_MULTIPART_REQUEST, OFPMP_FLOW
 38 1.203981620 172.31.31.144 -> 172.31.24.227 OpenFlow 82 Type: OFPT_MULTIPART_REQUEST, OFPMP_TABLE
 39 1.204161880 172.31.24.227 -> 172.31.31.144 OpenFlow 6178 Type: OFPT_MULTIPART_REPLY, OFPMP_TABLE
 40 1.204259553 172.31.24.227 -> 172.31.31.144 OpenFlow 642 Type: OFPT_MULTIPART_REPLY, OFPMP_PORT_STATS
 41 1.204357854 172.31.24.227 -> 172.31.31.144 OpenFlow 3258 Type: OFPT_MULTIPART_REPLY, OFPMP_FLOW
 42 1.204455575 172.31.31.144 -> 172.31.24.227 TCP 66 6633 → 53152 [ACK] Seq=97 Ack=6113 Win=853 Len=0 TSval=1822652 TSecr=388715507
 43 1.204461984 172.31.31.144 -> 172.31.24.227 TCP 66 6633 → 53152 [ACK] Seq=97 Ack=6689 Win=853 Len=0 TSval=1822652 TSecr=388715507
 44 1.204538944 172.31.24.227 -> 172.31.31.144 OpenFlow 6178 Type: OFPT_MULTIPART_REPLY, OFPMP_TABLE
 45 1.204578940 172.31.31.144 -> 172.31.24.227 TCP 66 6633 → 53152 [ACK] Seq=97 Ack=9881 Win=853 Len=0 TSval=1822652 TSecr=388715507
 46 1.204749338 172.31.24.227 -> 172.31.31.144 OpenFlow 6178 Type: OFPT_MULTIPART_REPLY, OFPMP_TABLE
 47 1.204828394 172.31.24.227 -> 172.31.31.144 OpenFlow 2842 Type: OFPT_MULTIPART_REPLY, OFPMP_FLOW
 48 1.204974965 172.31.24.227 -> 172.31.31.144 OpenFlow 642 Type: OFPT_MULTIPART_REPLY, OFPMP_PORT_STATS
 49 1.205042960 172.31.31.144 -> 172.31.24.227 TCP 66 6633 → 53170 [ACK] Seq=97 Ack=9353 Win=853 Len=0 TSval=1822652 TSecr=388715507
 50 1.205067233 172.31.24.227 -> 172.31.31.144 OpenFlow 2842 Type: OFPT_MULTIPART_REPLY, OFPMP_FLOW
 51 1.205208789 172.31.24.227 -> 172.31.31.144 OpenFlow 6178 Type: OFPT_MULTIPART_REPLY, OFPMP_TABLE
 52 1.205312224 172.31.31.144 -> 172.31.24.227 TCP 66 6633 → 53190 [ACK] Seq=97 Ack=3353 Win=853 Len=0 TSval=1822652 TSecr=388715507
 53 1.216083213 172.31.31.144 -> 172.31.24.227 TCP 82 6633 → 53164 [PSH, ACK] Seq=1 Ack=1 Win=853 Len=16 TSval=1822655 TSecr=388715075
 54 1.216092885 172.31.31.144 -> 172.31.24.227 TCP 146 6633 → 53164 [PSH, ACK] Seq=17 Ack=1 Win=853 Len=80 TSval=1822655 TSecr=388715075
 55 1.216324693 172.31.24.227 -> 172.31.31.144 OpenFlow 6178 Type: OFPT_MULTIPART_REPLY, OFPMP_TABLE
 56 1.216444283 172.31.24.227 -> 172.31.31.144 OpenFlow 754 Type: OFPT_MULTIPART_REPLY, OFPMP_PORT_STATS
 57 1.216526281 172.31.24.227 -> 172.31.31.144 OpenFlow 2842 Type: OFPT_MULTIPART_REPLY, OFPMP_FLOW
 58 1.216704753 172.31.31.144 -> 172.31.24.227 TCP 66 6633 → 53164 [ACK] Seq=97 Ack=6801 Win=853 Len=0 TSval=1822655 TSecr=388715510
 59 1.217214734 172.31.31.144 -> 172.31.24.227 TCP 122 6633 → 53162 [PSH, ACK] Seq=1 Ack=1 Win=853 Len=56 TSval=1822655 TSecr=388715075
 60 1.217221625 172.31.31.144 -> 172.31.24.227 TCP 106 6633 → 53162 [PSH, ACK] Seq=57 Ack=1 Win=853 Len=40 TSval=1822655 TSecr=388715075
 61 1.217365525 172.31.24.227 -> 172.31.31.144 OpenFlow 2842 Type: OFPT_MULTIPART_REPLY, OFPMP_FLOW
 62 1.217533730 172.31.24.227 -> 172.31.31.144 OpenFlow 6178 Type: OFPT_MULTIPART_REPLY, OFPMP_TABLE
 63 1.217616277 172.31.31.144 -> 172.31.24.227 TCP 66 6633 → 53162 [ACK] Seq=97 Ack=2777 Win=853 Len=0 TSval=1822655 TSecr=388715510
 64 1.217667327 172.31.24.227 -> 172.31.31.144 OpenFlow 754 Type: OFPT_MULTIPART_REPLY, OFPMP_PORT_STATS
 65 1.217797051 172.31.31.144 -> 172.31.24.227 TCP 66 6633 → 53162 [ACK] Seq=97 Ack=8889 Win=853 Len=0 TSval=1822655 TSecr=388715511
 66 1.217893096 172.31.31.144 -> 172.31.24.227 TCP 66 6633 → 53162 [ACK] Seq=97 Ack=9577 Win=853 Len=0 TSval=1822655 TSecr=388715511
 67 1.219352480 172.31.31.144 -> 172.31.24.227 TCP 90 6633 → 53166 [PSH, ACK] Seq=1 Ack=1 Win=853 Len=24 TSval=1822655 TSecr=388715074
 68 1.219359327 172.31.31.144 -> 172.31.24.227 TCP 138 6633 → 53166 [PSH, ACK] Seq=25 Ack=1 Win=853 Len=72 TSval=1822655 TSecr=388715074
 69 1.219549084 172.31.24.227 -> 172.31.31.144 OpenFlow 754 Type: OFPT_MULTIPART_REPLY, OFPMP_PORT_STATS
 70 1.219692051 172.31.24.227 -> 172.31.31.144 OpenFlow 6178 Type: OFPT_MULTIPART_REPLY, OFPMP_TABLE
 71 1.219733465 172.31.24.227 -> 172.31.31.144 OpenFlow 554 Type: OFPT_MULTIPART_REPLY, OFPMP_FLOW
 72 1.219962853 172.31.31.144 -> 172.31.24.227 TCP 66 6633 → 53166 [ACK] Seq=97 Ack=6801 Win=853 Len=0 TSval=1822655 TSecr=388715511
 73 1.232659081 172.31.31.144 -> 172.31.24.227 TCP 122 6633 → 53160 [PSH, ACK] Seq=1 Ack=1 Win=853 Len=56 TSval=1822659 TSecr=388715075
 74 1.232667933 172.31.31.144 -> 172.31.24.227 TCP 90 6633 → 53160 [PSH, ACK] Seq=57 Ack=1 Win=853 Len=24 TSval=1822659 TSecr=388715075
 75 1.232670738 172.31.31.144 -> 172.31.24.227 TCP 90 6633 → 53188 [PSH, ACK] Seq=1 Ack=1 Win=853 Len=24 TSval=1822659 TSecr=388715075
 76 1.232673658 172.31.31.144 -> 172.31.24.227 TCP 122 6633 → 53188 [PSH, ACK] Seq=25 Ack=1 Win=853 Len=56 TSval=1822659 TSecr=388715075
 77 1.232675658 172.31.31.144 -> 172.31.24.227 TCP 82 6633 → 53182 [PSH, ACK] Seq=1 Ack=1 Win=853 Len=16 TSval=1822659 TSecr=388715074
 78 1.232681574 172.31.24.227 -> 172.31.31.144 TCP 66 53182 → 6633 [ACK] Seq=1 Ack=17 Win=213 Len=0 TSval=388715514 TSecr=1822659
 79 1.232686378 172.31.31.144 -> 172.31.24.227 TCP 122 6633 → 53178 [PSH, ACK] Seq=1 Ack=1 Win=853 Len=56 TSval=1822659 TSecr=388715127
 80 1.232689820 172.31.31.144 -> 172.31.24.227 TCP 146 6633 → 53182 [PSH, ACK] Seq=17 Ack=1 Win=853 Len=80 TSval=1822659 TSecr=388715074
 81 1.232693322 172.31.24.227 -> 172.31.31.144 TCP 66 53182 → 6633 [ACK] Seq=1 Ack=97 Win=213 Len=0 TSval=388715514 TSecr=1822659
 82 1.232700026 172.31.31.144 -> 172.31.24.227 TCP 90 6633 → 53178 [PSH, ACK] Seq=57 Ack=1 Win=853 Len=24 TSval=1822659 TSecr=388715127
 83 1.232856704 172.31.24.227 -> 172.31.31.144 OpenFlow 2634 Type: OFPT_MULTIPART_REPLY, OFPMP_FLOW
 84 1.232965539 172.31.24.227 -> 172.31.31.144 OpenFlow 754 Type: OFPT_MULTIPART_REPLY, OFPMP_PORT_STATS
 85 1.233072631 172.31.24.227 -> 172.31.31.144 OpenFlow 1802 Type: OFPT_MULTIPART_REPLY, OFPMP_FLOW
 86 1.233195091 172.31.24.227 -> 172.31.31.144 OpenFlow 754 Type: OFPT_MULTIPART_REPLY, OFPMP_PORT_STATS
 87 1.233270387 172.31.31.144 -> 172.31.24.227 TCP 66 6633 → 53160 [ACK] Seq=81 Ack=3257 Win=853 Len=0 TSval=1822659 TSecr=388715514
 88 1.233362207 172.31.24.227 -> 172.31.31.144 OpenFlow 6178 Type: OFPT_MULTIPART_REPLY, OFPMP_TABLE
 89 1.233454350 172.31.24.227 -> 172.31.31.144 OpenFlow 530 Type: OFPT_MULTIPART_REPLY, OFPMP_PORT_STATS
 90 1.233474475 172.31.31.144 -> 172.31.24.227 TCP 66 6633 → 53178 [ACK] Seq=81 Ack=2425 Win=853 Len=0 TSval=1822659 TSecr=388715514
 91 1.233561635 172.31.24.227 -> 172.31.31.144 OpenFlow 2010 Type: OFPT_MULTIPART_REPLY, OFPMP_FLOW
 92 1.233653508 172.31.31.144 -> 172.31.24.227 TCP 66 6633 → 53182 [ACK] Seq=97 Ack=6113 Win=853 Len=0 TSval=1822659 TSecr=388715514
 93 1.233660274 172.31.31.144 -> 172.31.24.227 TCP 66 6633 → 53182 [ACK] Seq=97 Ack=6577 Win=853 Len=0 TSval=1822659 TSecr=388715514
 94 1.233691146 172.31.24.227 -> 172.31.31.144 OpenFlow 530 Type: OFPT_MULTIPART_REPLY, OFPMP_PORT_STATS
 95 1.233759981 172.31.24.227 -> 172.31.31.144 OpenFlow 2010 Type: OFPT_MULTIPART_REPLY, OFPMP_FLOW
 96 1.233773089 172.31.31.144 -> 172.31.24.227 TCP 66 6633 → 53182 [ACK] Seq=97 Ack=8521 Win=853 Len=0 TSval=1822659 TSecr=388715515
 97 1.233901016 172.31.31.144 -> 172.31.24.227 TCP 66 6633 → 53188 [ACK] Seq=81 Ack=465 Win=853 Len=0 TSval=1822659 TSecr=388715515
 98 1.233986082 172.31.31.144 -> 172.31.24.227 TCP 66 6633 → 53188 [ACK] Seq=81 Ack=2409 Win=853 Len=0 TSval=1822659 TSecr=388715515
 99 1.236366435 172.31.31.144 -> 172.31.24.227 TCP 90 6633 → 53174 [PSH, ACK] Seq=1 Ack=1 Win=853 Len=24 TSval=1822660 TSecr=388715073
100 1.236373199 172.31.31.144 -> 172.31.24.227 TCP 138 6633 → 53174 [PSH, ACK] Seq=25 Ack=1 Win=853 Len=72 TSval=1822660 TSecr=388715073
101 1.236558284 172.31.24.227 -> 172.31.31.144 OpenFlow 530 Type: OFPT_MULTIPART_REPLY, OFPMP_PORT_STATS
102 1.236710048 172.31.24.227 -> 172.31.31.144 OpenFlow 6178 Type: OFPT_MULTIPART_REPLY, OFPMP_TABLE
103 1.236763948 172.31.24.227 -> 172.31.31.144 OpenFlow 1178 Type: OFPT_MULTIPART_REPLY, OFPMP_FLOW
104 1.237058350 172.31.31.144 -> 172.31.24.227 TCP 66 6633 → 53174 [ACK] Seq=97 Ack=6577 Win=853 Len=0 TSval=1822660 TSecr=388715515
105 1.239480535 172.31.31.144 -> 172.31.24.227 OpenFlow 82 Type: OFPT_MULTIPART_REQUEST, OFPMP_TABLE
106 1.239487793 172.31.31.144 -> 172.31.24.227 OpenFlow 82 Type: OFPT_MULTIPART_REQUEST, OFPMP_TABLE
107 1.239490124 172.31.31.144 -> 172.31.24.227 OpenFlow 82 Type: OFPT_MULTIPART_REQUEST, OFPMP_TABLE
108 1.239694342 172.31.24.227 -> 172.31.31.144 OpenFlow 6178 Type: OFPT_MULTIPART_REPLY, OFPMP_TABLE
109 1.239891048 172.31.24.227 -> 172.31.31.144 OpenFlow 6178 Type: OFPT_MULTIPART_REPLY, OFPMP_TABLE
110 1.240065584 172.31.24.227 -> 172.31.31.144 OpenFlow 6178 Type: OFPT_MULTIPART_REPLY, OFPMP_TABLE
111 1.244118514 172.31.31.144 -> 172.31.24.227 TCP 66 6633 → 53156 [ACK] Seq=97 Ack=7385 Win=853 Len=0 TSval=1822662 TSecr=388715507
112 1.244127271 172.31.31.144 -> 172.31.24.227 TCP 66 6633 → 53190 [ACK] Seq=97 Ack=9465 Win=853 Len=0 TSval=1822662 TSecr=388715507
113 1.247615904 172.31.31.144 -> 172.31.24.227 TCP 122 6633 → 53198 [PSH, ACK] Seq=1 Ack=1 Win=853 Len=56 TSval=1822662 TSecr=388715073
114 1.247683507 172.31.31.144 -> 172.31.24.227 TCP 106 6633 → 53198 [PSH, ACK] Seq=57 Ack=1 Win=853 Len=40 TSval=1822662 TSecr=388715073
115 1.247832083 172.31.24.227 -> 172.31.31.144 OpenFlow 346 Type: OFPT_MULTIPART_REPLY, OFPMP_FLOW
116 1.247999669 172.31.24.227 -> 172.31.31.144 OpenFlow 6178 Type: OFPT_MULTIPART_REPLY, OFPMP_TABLE
117 1.248039171 172.31.31.144 -> 172.31.24.227 TCP 66 6633 → 53198 [ACK] Seq=97 Ack=281 Win=853 Len=0 TSval=1822663 TSecr=388715518
118 1.248100711 172.31.24.227 -> 172.31.31.144 OpenFlow 530 Type: OFPT_MULTIPART_REPLY, OFPMP_PORT_STATS
119 1.248276512 172.31.31.144 -> 172.31.24.227 TCP 66 6633 → 53198 [ACK] Seq=97 Ack=6393 Win=853 Len=0 TSval=1822663 TSecr=388715518
120 1.248361998 172.31.31.144 -> 172.31.24.227 TCP 66 6633 → 53198 [ACK] Seq=97 Ack=6857 Win=853 Len=0 TSval=1822663 TSecr=388715518
121 1.248757142 172.31.31.144 -> 172.31.24.227 TCP 90 6633 → 53180 [PSH, ACK] Seq=1 Ack=1 Win=853 Len=24 TSval=1822663 TSecr=388715074
122 1.248821910 172.31.31.144 -> 172.31.24.227 TCP 138 6633 → 53180 [PSH, ACK] Seq=25 Ack=1 Win=853 Len=72 TSval=1822663 TSecr=388715074
123 1.248951340 172.31.24.227 -> 172.31.31.144 OpenFlow 642 Type: OFPT_MULTIPART_REPLY, OFPMP_PORT_STATS
124 1.249016830 172.31.24.227 -> 172.31.31.144 OpenFlow 1802 Type: OFPT_MULTIPART_REPLY, OFPMP_FLOW
125 1.249158968 172.31.31.144 -> 172.31.24.227 TCP 66 6633 → 53180 [ACK] Seq=97 Ack=577 Win=853 Len=0 TSval=1822663 TSecr=388715518
126 1.249183328 172.31.24.227 -> 172.31.31.144 OpenFlow 6178 Type: OFPT_MULTIPART_REPLY, OFPMP_TABLE
127 1.249216611 172.31.31.144 -> 172.31.24.227 TCP 66 6633 → 53180 [ACK] Seq=97 Ack=2313 Win=853 Len=0 TSval=1822663 TSecr=388715518
128 1.249499939 172.31.31.144 -> 172.31.24.227 TCP 66 6633 → 53180 [ACK] Seq=97 Ack=8425 Win=853 Len=0 TSval=1822663 TSecr=388715518
129 1.250955958 172.31.31.144 -> 172.31.24.227 TCP 122 6633 → 53196 [PSH, ACK] Seq=1 Ack=1 Win=853 Len=56 TSval=1822663 TSecr=388715075
130 1.250963565 172.31.31.144 -> 172.31.24.227 TCP 106 6633 → 53196 [PSH, ACK] Seq=57 Ack=1 Win=853 Len=40 TSval=1822663 TSecr=388715075
131 1.251150743 172.31.24.227 -> 172.31.31.144 OpenFlow 1594 Type: OFPT_MULTIPART_REPLY, OFPMP_FLOW
132 1.251306051 172.31.24.227 -> 172.31.31.144 OpenFlow 6178 Type: OFPT_MULTIPART_REPLY, OFPMP_TABLE
133 1.251420262 172.31.31.144 -> 172.31.24.227 TCP 66 6633 → 53196 [ACK] Seq=97 Ack=1529 Win=853 Len=0 TSval=1822663 TSecr=388715519
134 1.251442185 172.31.24.227 -> 172.31.31.144 OpenFlow 754 Type: OFPT_MULTIPART_REPLY, OFPMP_PORT_STATS
135 1.251618279 172.31.31.144 -> 172.31.24.227 TCP 66 6633 → 53196 [ACK] Seq=97 Ack=7641 Win=853 Len=0 TSval=1822663 TSecr=388715519
136 1.251679299 172.31.31.144 -> 172.31.24.227 TCP 66 6633 → 53196 [ACK] Seq=97 Ack=8329 Win=853 Len=0 TSval=1822663 TSecr=388715519
137 1.252278807 172.31.31.144 -> 172.31.24.227 TCP 82 6633 → 53168 [PSH, ACK] Seq=1 Ack=1 Win=853 Len=16 TSval=1822664 TSecr=388715073
138 1.252336876 172.31.31.144 -> 172.31.24.227 TCP 146 6633 → 53168 [PSH, ACK] Seq=17 Ack=1 Win=853 Len=80 TSval=1822664 TSecr=388715073
139 1.252509996 172.31.24.227 -> 172.31.31.144 OpenFlow 6178 Type: OFPT_MULTIPART_REPLY, OFPMP_TABLE
140 1.252570172 172.31.24.227 -> 172.31.31.144 OpenFlow 1594 Type: OFPT_MULTIPART_REPLY, OFPMP_FLOW
141 1.252650394 172.31.24.227 -> 172.31.31.144 OpenFlow 642 Type: OFPT_MULTIPART_REPLY, OFPMP_PORT_STATS
142 1.252822744 172.31.31.144 -> 172.31.24.227 TCP 66 6633 → 53168 [ACK] Seq=97 Ack=6113 Win=853 Len=0 TSval=1822664 TSecr=388715519
143 1.252830277 172.31.31.144 -> 172.31.24.227 TCP 66 6633 → 53168 [ACK] Seq=97 Ack=7641 Win=853 Len=0 TSval=1822664 TSecr=388715519
144 1.252866750 172.31.31.144 -> 172.31.24.227 TCP 66 6633 → 53168 [ACK] Seq=97 Ack=8217 Win=853 Len=0 TSval=1822664 TSecr=388715519
145 1.253762921 172.31.31.144 -> 172.31.24.227 TCP 82 6633 → 53194 [PSH, ACK] Seq=1 Ack=1 Win=853 Len=16 TSval=1822664 TSecr=388715084
146 1.253774215 172.31.24.227 -> 172.31.31.144 TCP 66 53194 → 6633 [ACK] Seq=1 Ack=17 Win=213 Len=0 TSval=388715520 TSecr=1822664
147 1.253779759 172.31.31.144 -> 172.31.24.227 TCP 146 6633 → 53194 [PSH, ACK] Seq=17 Ack=1 Win=853 Len=80 TSval=1822664 TSecr=388715084
148 1.253783991 172.31.24.227 -> 172.31.31.144 TCP 66 53194 → 6633 [ACK] Seq=1 Ack=97 Win=213 Len=0 TSval=388715520 TSecr=1822664
149 1.254087853 172.31.24.227 -> 172.31.31.144 OpenFlow 6178 Type: OFPT_MULTIPART_REPLY, OFPMP_TABLE
150 1.254175950 172.31.24.227 -> 172.31.31.144 OpenFlow 530 Type: OFPT_MULTIPART_REPLY, OFPMP_PORT_STATS
151 1.254220478 172.31.24.227 -> 172.31.31.144 OpenFlow 970 Type: OFPT_MULTIPART_REPLY, OFPMP_FLOW
152 1.254341249 172.31.31.144 -> 172.31.24.227 TCP 66 6633 → 53194 [ACK] Seq=97 Ack=6113 Win=853 Len=0 TSval=1822664 TSecr=388715520
153 1.254376122 172.31.31.144 -> 172.31.24.227 TCP 66 6633 → 53194 [ACK] Seq=97 Ack=6577 Win=853 Len=0 TSval=1822664 TSecr=388715520
154 1.254420058 172.31.31.144 -> 172.31.24.227 TCP 66 6633 → 53194 [ACK] Seq=97 Ack=7481 Win=853 Len=0 TSval=1822664 TSecr=388715520
155 1.254878580 172.31.31.144 -> 172.31.24.227 TCP 82 6633 → 53186 [PSH, ACK] Seq=1 Ack=1 Win=853 Len=16 TSval=1822664 TSecr=388715074
156 1.254929194 172.31.31.144 -> 172.31.24.227 TCP 146 6633 → 53186 [PSH, ACK] Seq=17 Ack=1 Win=853 Len=80 TSval=1822664 TSecr=388715074
157 1.255156511 172.31.24.227 -> 172.31.31.144 OpenFlow 6178 Type: OFPT_MULTIPART_REPLY, OFPMP_TABLE
158 1.255219095 172.31.24.227 -> 172.31.31.144 OpenFlow 1802 Type: OFPT_MULTIPART_REPLY, OFPMP_FLOW
159 1.255300026 172.31.24.227 -> 172.31.31.144 OpenFlow 642 Type: OFPT_MULTIPART_REPLY, OFPMP_PORT_STATS
160 1.255466756 172.31.31.144 -> 172.31.24.227 TCP 66 6633 → 53186 [ACK] Seq=97 Ack=6113 Win=853 Len=0 TSval=1822664 TSecr=388715520
161 1.255473919 172.31.31.144 -> 172.31.24.227 TCP 66 6633 → 53186 [ACK] Seq=97 Ack=7849 Win=853 Len=0 TSval=1822664 TSecr=388715520
162 1.255501320 172.31.31.144 -> 172.31.24.227 TCP 66 6633 → 53186 [ACK] Seq=97 Ack=8425 Win=853 Len=0 TSval=1822664 TSecr=388715520
163 1.255765286 172.31.31.144 -> 172.31.24.227 TCP 122 6633 → 53192 [PSH, ACK] Seq=1 Ack=1 Win=853 Len=56 TSval=1822664 TSecr=388715124
164 1.255770885 172.31.31.144 -> 172.31.24.227 TCP 106 6633 → 53192 [PSH, ACK] Seq=57 Ack=1 Win=853 Len=40 TSval=1822664 TSecr=388715124
165 1.255940870 172.31.24.227 -> 172.31.31.144 OpenFlow 762 Type: OFPT_MULTIPART_REPLY, OFPMP_FLOW
166 1.256077522 172.31.31.144 -> 172.31.24.227 TCP 66 6633 → 53164 [ACK] Seq=97 Ack=9577 Win=853 Len=0 TSval=1822665 TSecr=388715510
167 1.256084630 172.31.31.144 -> 172.31.24.227 TCP 66 6633 → 53166 [ACK] Seq=97 Ack=7289 Win=853 Len=0 TSval=1822665 TSecr=388715511
168 1.256129037 172.31.24.227 -> 172.31.31.144 OpenFlow 6178 Type: OFPT_MULTIPART_REPLY, OFPMP_TABLE
169 1.256212343 172.31.24.227 -> 172.31.31.144 OpenFlow 530 Type: OFPT_MULTIPART_REPLY, OFPMP_PORT_STATS
170 1.256399475 172.31.31.144 -> 172.31.24.227 TCP 66 6633 → 53192 [ACK] Seq=97 Ack=6809 Win=853 Len=0 TSval=1822665 TSecr=388715520
171 1.257930287 172.31.31.144 -> 172.31.24.227 TCP 82 6633 → 53172 [PSH, ACK] Seq=1 Ack=1 Win=853 Len=16 TSval=1822665 TSecr=388715075
172 1.257938984 172.31.31.144 -> 172.31.24.227 TCP 146 6633 → 53172 [PSH, ACK] Seq=17 Ack=1 Win=853 Len=80 TSval=1822665 TSecr=388715075
173 1.258162046 172.31.24.227 -> 172.31.31.144 OpenFlow 6178 Type: OFPT_MULTIPART_REPLY, OFPMP_TABLE
174 1.258227359 172.31.24.227 -> 172.31.31.144 OpenFlow 2010 Type: OFPT_MULTIPART_REPLY, OFPMP_FLOW
175 1.258318890 172.31.24.227 -> 172.31.31.144 OpenFlow 754 Type: OFPT_MULTIPART_REPLY, OFPMP_PORT_STATS
176 1.258462684 172.31.31.144 -> 172.31.24.227 TCP 66 6633 → 53172 [ACK] Seq=97 Ack=8057 Win=853 Len=0 TSval=1822665 TSecr=388715521
177 1.259451065 172.31.31.144 -> 172.31.24.227 TCP 122 6633 → 53184 [PSH, ACK] Seq=1 Ack=1 Win=853 Len=56 TSval=1822665 TSecr=388715074
178 1.259506103 172.31.31.144 -> 172.31.24.227 TCP 90 6633 → 53184 [PSH, ACK] Seq=57 Ack=1 Win=853 Len=24 TSval=1822665 TSecr=388715074
179 1.259646502 172.31.24.227 -> 172.31.31.144 OpenFlow 3050 Type: OFPT_MULTIPART_REPLY, OFPMP_FLOW
180 1.259741862 172.31.24.227 -> 172.31.31.144 OpenFlow 642 Type: OFPT_MULTIPART_REPLY, OFPMP_PORT_STATS
181 1.259969993 172.31.31.144 -> 172.31.24.227 TCP 66 6633 → 53184 [ACK] Seq=81 Ack=3561 Win=853 Len=0 TSval=1822665 TSecr=388715521
182 1.261118692 172.31.31.144 -> 172.31.24.227 OpenFlow 82 Type: OFPT_MULTIPART_REQUEST, OFPMP_TABLE
183 1.261348349 172.31.24.227 -> 172.31.31.144 OpenFlow 6178 Type: OFPT_MULTIPART_REPLY, OFPMP_TABLE
184 1.266285783 172.31.31.144 -> 172.31.24.227 TCP 82 6633 → 53176 [PSH, ACK] Seq=1 Ack=1 Win=853 Len=16 TSval=1822667 TSecr=388715075
185 1.266294530 172.31.31.144 -> 172.31.24.227 TCP 146 6633 → 53176 [PSH, ACK] Seq=17 Ack=1 Win=853 Len=80 TSval=1822667 TSecr=388715075
186 1.266519987 172.31.24.227 -> 172.31.31.144 OpenFlow 6178 Type: OFPT_MULTIPART_REPLY, OFPMP_TABLE
187 1.266590743 172.31.24.227 -> 172.31.31.144 OpenFlow 2634 Type: OFPT_MULTIPART_REPLY, OFPMP_FLOW
188 1.266669432 172.31.24.227 -> 172.31.31.144 OpenFlow 642 Type: OFPT_MULTIPART_REPLY, OFPMP_PORT_STATS
189 1.266872361 172.31.31.144 -> 172.31.24.227 TCP 66 6633 → 53176 [ACK] Seq=97 Ack=6113 Win=853 Len=0 TSval=1822667 TSecr=388715523
190 1.266879384 172.31.31.144 -> 172.31.24.227 TCP 66 6633 → 53176 [ACK] Seq=97 Ack=8681 Win=853 Len=0 TSval=1822667 TSecr=388715523
191 1.266881964 172.31.31.144 -> 172.31.24.227 TCP 66 6633 → 53176 [ACK] Seq=97 Ack=9257 Win=853 Len=0 TSval=1822667 TSecr=388715523
192 1.276119444 172.31.31.144 -> 172.31.24.227 TCP 66 6633 → 53174 [ACK] Seq=97 Ack=7689 Win=853 Len=0 TSval=1822670 TSecr=388715515
193 1.276125883 172.31.31.144 -> 172.31.24.227 TCP 66 6633 → 53160 [ACK] Seq=97 Ack=9369 Win=853 Len=0 TSval=1822670 TSecr=388715516
194 1.280098903 172.31.31.144 -> 172.31.24.227 TCP 66 6633 → 53188 [ACK] Seq=97 Ack=8521 Win=853 Len=0 TSval=1822671 TSecr=388715516
195 1.280105248 172.31.31.144 -> 172.31.24.227 TCP 66 6633 → 53178 [ACK] Seq=97 Ack=8537 Win=853 Len=0 TSval=1822671 TSecr=388715516
196 1.296117970 172.31.31.144 -> 172.31.24.227 TCP 66 6633 → 53172 [ACK] Seq=97 Ack=8745 Win=853 Len=0 TSval=1822675 TSecr=388715521
197 1.296124437 172.31.31.144 -> 172.31.24.227 TCP 66 6633 → 53192 [ACK] Seq=97 Ack=7273 Win=853 Len=0 TSval=1822675 TSecr=388715520
198 1.300096735 172.31.31.144 -> 172.31.24.227 TCP 66 6633 → 53184 [ACK] Seq=97 Ack=9673 Win=853 Len=0 TSval=1822676 TSecr=388715521
199 1.402094514 137.158.125.247 -> 172.31.24.227 TCP 54 63468 → 22 [ACK] Seq=1 Ack=481 Win=32372 Len=0
200 1.699793248 172.31.24.227 -> 137.158.125.247 SSH 98 Server: Encrypted packet (len=44)
201 1.910901330 137.158.125.247 -> 172.31.24.227 TCP 54 63468 → 22 [ACK] Seq=1 Ack=525 Win=32350 Len=0
202 2.200085806 172.31.24.227 -> 137.158.125.247 SSH 98 Server: Encrypted packet (len=44)
203 2.409332666 137.158.125.247 -> 172.31.24.227 TCP 54 63468 → 22 [ACK] Seq=1 Ack=569 Win=32328 Len=0
204 2.465404939 172.31.31.144 -> 172.31.24.227 OpenFlow 187 Type: OFPT_PACKET_OUT
205 2.465416977 172.31.31.144 -> 172.31.24.227 OpenFlow 187 Type: OFPT_PACKET_OUT
206 2.465430465 172.31.31.144 -> 172.31.24.227 OpenFlow 187 Type: OFPT_PACKET_OUT
207 2.465496054 172.31.31.144 -> 172.31.24.227 OpenFlow 187 Type: OFPT_PACKET_OUT
208 2.465580892 172.31.31.144 -> 172.31.24.227 OpenFlow 187 Type: OFPT_PACKET_OUT
209 2.465652559 172.31.31.144 -> 172.31.24.227 OpenFlow 187 Type: OFPT_PACKET_OUT
210 2.465729257 172.31.31.144 -> 172.31.24.227 OpenFlow 187 Type: OFPT_PACKET_OUT
211 2.465822574 172.31.31.144 -> 172.31.24.227 OpenFlow 187 Type: OFPT_PACKET_OUT
212 2.465920996 172.31.24.227 -> 172.31.31.144 TCP 66 53158 → 6633 [ACK] Seq=8633 Ack=1065 Win=213 Len=0 TSval=388715823 TSecr=1822967
213 2.465933116 172.31.31.144 -> 172.31.24.227 OpenFlow 187 Type: OFPT_PACKET_OUT
214 2.465993919 172.31.31.144 -> 172.31.24.227 OpenFlow 187 Type: OFPT_PACKET_OUT
215 2.466049184 172.31.24.227 -> 172.31.31.144 OpenFlow 189 Type: OFPT_PACKET_IN
216 2.466089426 172.31.31.144 -> 172.31.24.227 OpenFlow 187 Type: OFPT_PACKET_OUT
217 2.466097390 172.31.24.227 -> 172.31.31.144 OpenFlow 189 Type: OFPT_PACKET_IN
218 2.466142380 172.31.24.227 -> 172.31.31.144 OpenFlow 189 Type: OFPT_PACKET_IN
219 2.466217668 172.31.31.144 -> 172.31.24.227 OpenFlow 187 Type: OFPT_PACKET_OUT
220 2.466223015 172.31.31.144 -> 172.31.24.227 OpenFlow 187 Type: OFPT_PACKET_OUT
221 2.466231802 172.31.24.227 -> 172.31.31.144 OpenFlow 189 Type: OFPT_PACKET_IN
222 2.466258469 172.31.24.227 -> 172.31.31.144 OpenFlow 189 Type: OFPT_PACKET_IN
223 2.466307568 172.31.31.144 -> 172.31.24.227 TCP 66 6633 → 53164 [ACK] Seq=97 Ack=9700 Win=853 Len=0 TSval=1822967 TSecr=388715823
224 2.466314465 172.31.31.144 -> 172.31.24.227 TCP 66 6633 → 53164 [ACK] Seq=97 Ack=9823 Win=853 Len=0 TSval=1822967 TSecr=388715823
225 2.466372749 172.31.24.227 -> 172.31.31.144 OpenFlow 189 Type: OFPT_PACKET_IN
226 2.466399330 172.31.31.144 -> 172.31.24.227 OpenFlow 187 Type: OFPT_PACKET_OUT
227 2.466487179 172.31.31.144 -> 172.31.24.227 OpenFlow 187 Type: OFPT_PACKET_OUT
228 2.466493650 172.31.31.144 -> 172.31.24.227 TCP 66 6633 → 53174 [ACK] Seq=97 Ack=7812 Win=853 Len=0 TSval=1822967 TSecr=388715823
229 2.466510075 172.31.31.144 -> 172.31.24.227 TCP 66 6633 → 53174 [ACK] Seq=97 Ack=7935 Win=853 Len=0 TSval=1822967 TSecr=388715823
230 2.466585687 172.31.31.144 -> 172.31.24.227 TCP 66 6633 → 53198 [ACK] Seq=97 Ack=6980 Win=853 Len=0 TSval=1822967 TSecr=388715823
231 2.466592376 172.31.31.144 -> 172.31.24.227 TCP 66 6633 → 53198 [ACK] Seq=97 Ack=7103 Win=853 Len=0 TSval=1822967 TSecr=388715823
232 2.466804590 172.31.24.227 -> 172.31.31.144 TCP 66 53156 → 6633 [ACK] Seq=7385 Ack=944 Win=213 Len=0 TSval=388715823 TSecr=1822967
233 2.466905532 172.31.24.227 -> 172.31.31.144 OpenFlow 189 Type: OFPT_PACKET_IN
234 2.466925860 172.31.24.227 -> 172.31.31.144 OpenFlow 189 Type: OFPT_PACKET_IN
235 2.466955891 172.31.24.227 -> 172.31.31.144 OpenFlow 189 Type: OFPT_PACKET_IN
236 2.466974615 172.31.24.227 -> 172.31.31.144 OpenFlow 189 Type: OFPT_PACKET_IN
237 2.466995017 172.31.24.227 -> 172.31.31.144 OpenFlow 189 Type: OFPT_PACKET_IN
238 2.467037308 172.31.24.227 -> 172.31.31.144 OpenFlow 189 Type: OFPT_PACKET_IN
239 2.467043333 172.31.24.227 -> 172.31.31.144 OpenFlow 189 Type: OFPT_PACKET_IN
240 2.467240807 172.31.31.144 -> 172.31.24.227 OpenFlow 187 Type: OFPT_PACKET_OUT
241 2.467248807 172.31.31.144 -> 172.31.24.227 TCP 66 6633 → 53160 [ACK] Seq=97 Ack=9492 Win=853 Len=0 TSval=1822967 TSecr=388715823
242 2.467252320 172.31.31.144 -> 172.31.24.227 TCP 66 6633 → 53160 [ACK] Seq=97 Ack=9615 Win=853 Len=0 TSval=1822967 TSecr=388715823
243 2.467254739 172.31.31.144 -> 172.31.24.227 OpenFlow 671 Type: OFPT_PACKET_OUT
244 2.467257722 172.31.31.144 -> 172.31.24.227 OpenFlow 187 Type: OFPT_PACKET_OUT
245 2.467260645 172.31.31.144 -> 172.31.24.227 TCP 66 6633 → 53166 [ACK] Seq=97 Ack=7412 Win=853 Len=0 TSval=1822967 TSecr=388715823
246 2.467262999 172.31.31.144 -> 172.31.24.227 TCP 66 6633 → 53168 [ACK] Seq=97 Ack=8340 Win=853 Len=0 TSval=1822967 TSecr=388715823
247 2.467307076 172.31.31.144 -> 172.31.24.227 TCP 66 6633 → 53172 [ACK] Seq=97 Ack=8868 Win=853 Len=0 TSval=1822967 TSecr=388715823
248 2.467312580 172.31.31.144 -> 172.31.24.227 OpenFlow 187 Type: OFPT_PACKET_OUT
249 2.467460643 172.31.31.144 -> 172.31.24.227 TCP 66 6633 → 53168 [ACK] Seq=97 Ack=8463 Win=853 Len=0 TSval=1822967 TSecr=388715823
250 2.467466820 172.31.31.144 -> 172.31.24.227 TCP 66 6633 → 53172 [ACK] Seq=97 Ack=8991 Win=853 Len=0 TSval=1822967 TSecr=388715823
251 2.467634407 172.31.24.227 -> 172.31.31.144 TCP 66 53154 → 6633 [ACK] Seq=7273 Ack=823 Win=213 Len=0 TSval=388715823 TSecr=1822967
252 2.467818238 172.31.24.227 -> 172.31.31.144 OpenFlow 189 Type: OFPT_PACKET_IN
253 2.467844560 172.31.24.227 -> 172.31.31.144 OpenFlow 189 Type: OFPT_PACKET_IN
254 2.467868421 172.31.24.227 -> 172.31.31.144 OpenFlow 189 Type: OFPT_PACKET_IN
255 2.467874496 172.31.24.227 -> 172.31.31.144 OpenFlow 189 Type: OFPT_PACKET_IN
256 2.467908764 172.31.24.227 -> 172.31.31.144 OpenFlow 189 Type: OFPT_PACKET_IN
257 2.467950379 172.31.24.227 -> 172.31.31.144 OpenFlow 189 Type: OFPT_PACKET_IN
258 2.467967217 172.31.24.227 -> 172.31.31.144 OpenFlow 189 Type: OFPT_PACKET_IN
259 2.468040516 172.31.24.227 -> 172.31.31.144 OpenFlow 189 Type: OFPT_PACKET_IN
260 2.468144632 172.31.31.144 -> 172.31.24.227 TCP 66 6633 → 53166 [ACK] Seq=97 Ack=7535 Win=853 Len=0 TSval=1822968 TSecr=388715823
261 2.468152977 172.31.31.144 -> 172.31.24.227 TCP 66 6633 → 53168 [ACK] Seq=97 Ack=8586 Win=853 Len=0 TSval=1822968 TSecr=388715823
262 2.468155504 172.31.31.144 -> 172.31.24.227 TCP 66 6633 → 53168 [ACK] Seq=97 Ack=8709 Win=853 Len=0 TSval=1822968 TSecr=388715823
263 2.468157569 172.31.31.144 -> 172.31.24.227 TCP 66 6633 → 53180 [ACK] Seq=97 Ack=8548 Win=853 Len=0 TSval=1822968 TSecr=388715823
264 2.468172950 172.31.31.144 -> 172.31.24.227 TCP 66 6633 → 53180 [ACK] Seq=97 Ack=8671 Win=853 Len=0 TSval=1822968 TSecr=388715823
265 2.468243051 172.31.31.144 -> 172.31.24.227 TCP 66 6633 → 53192 [ACK] Seq=97 Ack=7396 Win=853 Len=0 TSval=1822968 TSecr=388715823
266 2.468362050 172.31.31.144 -> 172.31.24.227 OpenFlow 187 Type: OFPT_PACKET_OUT
267 2.468366928 172.31.31.144 -> 172.31.24.227 TCP 66 6633 → 53192 [ACK] Seq=97 Ack=7519 Win=853 Len=0 TSval=1822968 TSecr=388715823
268 2.468369675 172.31.31.144 -> 172.31.24.227 OpenFlow 308 Type: OFPT_PACKET_OUT
269 2.468517363 172.31.24.227 -> 172.31.31.144 TCP 66 53152 → 6633 [ACK] Seq=9881 Ack=581 Win=213 Len=0 TSval=388715823 TSecr=1822967
270 2.468639595 172.31.24.227 -> 172.31.31.144 OpenFlow 189 Type: OFPT_PACKET_IN
271 2.468705250 172.31.24.227 -> 172.31.31.144 OpenFlow 189 Type: OFPT_PACKET_IN
272 2.468722819 172.31.24.227 -> 172.31.31.144 OpenFlow 189 Type: OFPT_PACKET_IN
273 2.468923980 172.31.31.144 -> 172.31.24.227 TCP 66 6633 → 53190 [ACK] Seq=97 Ack=9588 Win=853 Len=0 TSval=1822968 TSecr=388715823
274 2.468930592 172.31.31.144 -> 172.31.24.227 TCP 66 6633 → 53190 [ACK] Seq=97 Ack=9711 Win=853 Len=0 TSval=1822968 TSecr=388715823
275 2.468967684 172.31.31.144 -> 172.31.24.227 TCP 66 6633 → 53170 [ACK] Seq=97 Ack=9599 Win=853 Len=0 TSval=1822968 TSecr=388715823
276 2.469655034 172.31.31.144 -> 172.31.24.227 OpenFlow 187 Type: OFPT_PACKET_OUT
277 2.469660927 172.31.31.144 -> 172.31.24.227 OpenFlow 429 Type: OFPT_PACKET_OUT
278 2.469663911 172.31.31.144 -> 172.31.24.227 OpenFlow 187 Type: OFPT_PACKET_OUT
279 2.469787626 172.31.24.227 -> 172.31.31.144 TCP 66 53152 → 6633 [ACK] Seq=9881 Ack=1065 Win=213 Len=0 TSval=388715824 TSecr=1822968
280 2.469819539 172.31.31.144 -> 172.31.24.227 OpenFlow 187 Type: OFPT_PACKET_OUT
281 2.469941941 172.31.31.144 -> 172.31.24.227 OpenFlow 187 Type: OFPT_PACKET_OUT
282 2.470070027 172.31.31.144 -> 172.31.24.227 OpenFlow 187 Type: OFPT_PACKET_OUT
283 2.470076820 172.31.31.144 -> 172.31.24.227 OpenFlow 187 Type: OFPT_PACKET_OUT
284 2.470115167 172.31.24.227 -> 172.31.31.144 TCP 66 53170 → 6633 [ACK] Seq=9599 Ack=702 Win=213 Len=0 TSval=388715824 TSecr=1822968
285 2.470160366 172.31.31.144 -> 172.31.24.227 OpenFlow 187 Type: OFPT_PACKET_OUT
286 2.470272304 172.31.31.144 -> 172.31.24.227 OpenFlow 187 Type: OFPT_PACKET_OUT
287 2.470334099 172.31.31.144 -> 172.31.24.227 OpenFlow 187 Type: OFPT_PACKET_OUT
288 2.470414518 172.31.31.144 -> 172.31.24.227 OpenFlow 187 Type: OFPT_PACKET_OUT
289 2.470491216 172.31.31.144 -> 172.31.24.227 OpenFlow 187 Type: OFPT_PACKET_OUT
290 2.470552616 172.31.24.227 -> 172.31.31.144 TCP 66 53190 → 6633 [ACK] Seq=9711 Ack=581 Win=213 Len=0 TSval=388715824 TSecr=1822968
291 2.470572420 172.31.31.144 -> 172.31.24.227 OpenFlow 187 Type: OFPT_PACKET_OUT
292 2.470649049 172.31.31.144 -> 172.31.24.227 OpenFlow 187 Type: OFPT_PACKET_OUT
293 2.470668426 172.31.24.227 -> 172.31.31.144 OpenFlow 189 Type: OFPT_PACKET_IN
294 2.470698108 172.31.24.227 -> 172.31.31.144 OpenFlow 189 Type: OFPT_PACKET_IN
295 2.470745221 172.31.31.144 -> 172.31.24.227 OpenFlow 187 Type: OFPT_PACKET_OUT
296 2.470793713 172.31.31.144 -> 172.31.24.227 OpenFlow 187 Type: OFPT_PACKET_OUT
297 2.470809894 172.31.24.227 -> 172.31.31.144 OpenFlow 189 Type: OFPT_PACKET_IN
298 2.470826563 172.31.24.227 -> 172.31.31.144 OpenFlow 312 Type: OFPT_PACKET_IN
299 2.470855173 172.31.24.227 -> 172.31.31.144 OpenFlow 189 Type: OFPT_PACKET_IN
300 2.470871324 172.31.24.227 -> 172.31.31.144 OpenFlow 189 Type: OFPT_PACKET_IN
301 2.470957978 172.31.24.227 -> 172.31.31.144 OpenFlow 189 Type: OFPT_PACKET_IN
302 2.470990363 172.31.31.144 -> 172.31.24.227 TCP 66 6633 → 53194 [ACK] Seq=97 Ack=7604 Win=853 Len=0 TSval=1822968 TSecr=388715824
303 2.470996205 172.31.31.144 -> 172.31.24.227 TCP 66 6633 → 53194 [ACK] Seq=97 Ack=7727 Win=853 Len=0 TSval=1822968 TSecr=388715824
304 2.470998871 172.31.31.144 -> 172.31.24.227 OpenFlow 187 Type: OFPT_PACKET_OUT
305 2.471002072 172.31.31.144 -> 172.31.24.227 OpenFlow 187 Type: OFPT_PACKET_OUT
306 2.471004460 172.31.31.144 -> 172.31.24.227 TCP 66 6633 → 53152 [ACK] Seq=1065 Ack=10004 Win=853 Len=0 TSval=1822968 TSecr=388715824
307 2.471017185 172.31.24.227 -> 172.31.31.144 OpenFlow 189 Type: OFPT_PACKET_IN
308 2.471084738 172.31.31.144 -> 172.31.24.227 TCP 66 6633 → 53152 [ACK] Seq=1065 Ack=10250 Win=853 Len=0 TSval=1822968 TSecr=388715824
309 2.471094421 172.31.24.227 -> 172.31.31.144 OpenFlow 189 Type: OFPT_PACKET_IN
310 2.471121071 172.31.24.227 -> 172.31.31.144 TCP 66 53190 → 6633 [ACK] Seq=9711 Ack=1065 Win=213 Len=0 TSval=388715824 TSecr=1822968
311 2.471190115 172.31.31.144 -> 172.31.24.227 TCP 66 6633 → 53152 [ACK] Seq=1065 Ack=10373 Win=853 Len=0 TSval=1822968 TSecr=388715824
312 2.471198531 172.31.31.144 -> 172.31.24.227 TCP 66 6633 → 53160 [ACK] Seq=97 Ack=9738 Win=853 Len=0 TSval=1822968 TSecr=388715824
313 2.471289548 172.31.31.144 -> 172.31.24.227 TCP 66 6633 → 53186 [ACK] Seq=97 Ack=8548 Win=853 Len=0 TSval=1822968 TSecr=388715824
314 2.471295792 172.31.31.144 -> 172.31.24.227 TCP 66 6633 → 53160 [ACK] Seq=97 Ack=9861 Win=853 Len=0 TSval=1822968 TSecr=388715824
315 2.471298446 172.31.31.144 -> 172.31.24.227 TCP 66 6633 → 53186 [ACK] Seq=97 Ack=8671 Win=853 Len=0 TSval=1822968 TSecr=388715824
316 2.471426938 172.31.24.227 -> 172.31.31.144 TCP 66 53162 → 6633 [ACK] Seq=9577 Ack=339 Win=213 Len=0 TSval=388715824 TSecr=1822968
317 2.471510946 172.31.24.227 -> 172.31.31.144 OpenFlow 189 Type: OFPT_PACKET_IN
318 2.471530619 172.31.24.227 -> 172.31.31.144 OpenFlow 189 Type: OFPT_PACKET_IN
319 2.471646184 172.31.24.227 -> 172.31.31.144 OpenFlow 189 Type: OFPT_PACKET_IN
320 2.471663277 172.31.24.227 -> 172.31.31.144 OpenFlow 189 Type: OFPT_PACKET_IN
321 2.471765984 172.31.31.144 -> 172.31.24.227 TCP 66 6633 → 53166 [ACK] Seq=97 Ack=7658 Win=853 Len=0 TSval=1822968 TSecr=388715824
322 2.471772915 172.31.31.144 -> 172.31.24.227 TCP 66 6633 → 53166 [ACK] Seq=97 Ack=7781 Win=853 Len=0 TSval=1822968 TSecr=388715824
323 2.471837046 172.31.31.144 -> 172.31.24.227 TCP 66 6633 → 53196 [ACK] Seq=97 Ack=8452 Win=853 Len=0 TSval=1822968 TSecr=388715824
324 2.471885031 172.31.31.144 -> 172.31.24.227 TCP 66 6633 → 53196 [ACK] Seq=97 Ack=8575 Win=853 Len=0 TSval=1822968 TSecr=388715824
325 2.472299315 172.31.31.144 -> 172.31.24.227 OpenFlow 187 Type: OFPT_PACKET_OUT
326 2.472470590 172.31.31.144 -> 172.31.24.227 OpenFlow 187 Type: OFPT_PACKET_OUT
327 2.472517833 172.31.24.227 -> 172.31.31.144 OpenFlow 189 Type: OFPT_PACKET_IN
328 2.472556620 172.31.31.144 -> 172.31.24.227 OpenFlow 187 Type: OFPT_PACKET_OUT
329 2.472639471 172.31.31.144 -> 172.31.24.227 OpenFlow 187 Type: OFPT_PACKET_OUT
330 2.472788597 172.31.31.144 -> 172.31.24.227 TCP 66 6633 → 53188 [ACK] Seq=97 Ack=8644 Win=853 Len=0 TSval=1822969 TSecr=388715824
331 2.472802179 172.31.31.144 -> 172.31.24.227 OpenFlow 187 Type: OFPT_PACKET_OUT
332 2.472805276 172.31.31.144 -> 172.31.24.227 OpenFlow 187 Type: OFPT_PACKET_OUT
333 2.472930589 172.31.24.227 -> 172.31.31.144 TCP 66 53162 → 6633 [ACK] Seq=9577 Ack=1065 Win=213 Len=0 TSval=388715824 TSecr=1822969
334 2.473008823 172.31.31.144 -> 172.31.24.227 OpenFlow 187 Type: OFPT_PACKET_OUT
335 2.473031749 172.31.31.144 -> 172.31.24.227 OpenFlow 187 Type: OFPT_PACKET_OUT
336 2.473043945 172.31.24.227 -> 172.31.31.144 OpenFlow 189 Type: OFPT_PACKET_IN
337 2.473071493 172.31.24.227 -> 172.31.31.144 OpenFlow 189 Type: OFPT_PACKET_IN
338 2.473110987 172.31.24.227 -> 172.31.31.144 OpenFlow 189 Type: OFPT_PACKET_IN
339 2.473116873 172.31.24.227 -> 172.31.31.144 OpenFlow 189 Type: OFPT_PACKET_IN
340 2.473123773 172.31.24.227 -> 172.31.31.144 OpenFlow 189 Type: OFPT_PACKET_IN
341 2.473156560 172.31.31.144 -> 172.31.24.227 OpenFlow 187 Type: OFPT_PACKET_OUT
342 2.473160709 172.31.31.144 -> 172.31.24.227 OpenFlow 187 Type: OFPT_PACKET_OUT
343 2.473286443 172.31.31.144 -> 172.31.24.227 TCP 66 6633 → 53172 [ACK] Seq=97 Ack=9114 Win=853 Len=0 TSval=1822969 TSecr=388715824
344 2.473293129 172.31.31.144 -> 172.31.24.227 TCP 66 6633 → 53176 [ACK] Seq=97 Ack=9380 Win=853 Len=0 TSval=1822969 TSecr=388715824
345 2.473360821 172.31.24.227 -> 172.31.31.144 TCP 66 53160 → 6633 [ACK] Seq=9861 Ack=339 Win=213 Len=0 TSval=388715824 TSecr=1822969
346 2.473430717 172.31.31.144 -> 172.31.24.227 TCP 66 6633 → 53172 [ACK] Seq=97 Ack=9237 Win=853 Len=0 TSval=1822969 TSecr=388715824
347 2.473437382 172.31.31.144 -> 172.31.24.227 OpenFlow 187 Type: OFPT_PACKET_OUT
348 2.473439986 172.31.31.144 -> 172.31.24.227 TCP 66 6633 → 53176 [ACK] Seq=97 Ack=9503 Win=853 Len=0 TSval=1822969 TSecr=388715824
349 2.473442448 172.31.31.144 -> 172.31.24.227 OpenFlow 187 Type: OFPT_PACKET_OUT
350 2.473444669 172.31.31.144 -> 172.31.24.227 TCP 66 6633 → 53188 [ACK] Seq=97 Ack=8767 Win=853 Len=0 TSval=1822969 TSecr=388715824
351 2.473447091 172.31.31.144 -> 172.31.24.227 OpenFlow 187 Type: OFPT_PACKET_OUT
352 2.473542813 172.31.24.227 -> 172.31.31.144 TCP 66 53162 → 6633 [ACK] Seq=9577 Ack=1307 Win=213 Len=0 TSval=388715825 TSecr=1822969
353 2.473808443 172.31.31.144 -> 172.31.24.227 OpenFlow 187 Type: OFPT_PACKET_OUT
354 2.473819566 172.31.31.144 -> 172.31.24.227 OpenFlow 550 Type: OFPT_PACKET_OUT
355 2.473906758 172.31.24.227 -> 172.31.31.144 OpenFlow 189 Type: OFPT_PACKET_IN
356 2.473929197 172.31.24.227 -> 172.31.31.144 OpenFlow 189 Type: OFPT_PACKET_IN
357 2.473952381 172.31.24.227 -> 172.31.31.144 OpenFlow 189 Type: OFPT_PACKET_IN
358 2.473990303 172.31.24.227 -> 172.31.31.144 OpenFlow 189 Type: OFPT_PACKET_IN
359 2.474171978 172.31.31.144 -> 172.31.24.227 TCP 66 6633 → 53156 [ACK] Seq=1065 Ack=7508 Win=853 Len=0 TSval=1822969 TSecr=388715825
