  1 0.000000000 172.31.31.144 -> 172.31.23.72 TCP 187 6633 → 33632 [PSH, ACK] Seq=1 Ack=1 Win=853 Len=121 TSval=1296886 TSecr=26135964
  2 0.000019228 172.31.31.144 -> 172.31.23.72 TCP 187 6633 → 33632 [PSH, ACK] Seq=122 Ack=1 Win=853 Len=121 TSval=1296886 TSecr=26135964
  3 0.000024560 172.31.31.144 -> 172.31.23.72 TCP 187 6633 → 33632 [PSH, ACK] Seq=243 Ack=1 Win=853 Len=121 TSval=1296886 TSecr=26135964
  4 0.000061959 172.31.31.144 -> 172.31.23.72 TCP 187 6633 → 33632 [PSH, ACK] Seq=364 Ack=1 Win=853 Len=121 TSval=1296886 TSecr=26135964
  5 0.000128364 172.31.31.144 -> 172.31.23.72 TCP 187 6633 → 33632 [PSH, ACK] Seq=485 Ack=1 Win=853 Len=121 TSval=1296886 TSecr=26135964
  6 0.000221577 172.31.31.144 -> 172.31.23.72 TCP 187 6633 → 33632 [PSH, ACK] Seq=606 Ack=1 Win=853 Len=121 TSval=1296886 TSecr=26135964
  7 0.000278610 172.31.31.144 -> 172.31.23.72 TCP 187 6633 → 33632 [PSH, ACK] Seq=727 Ack=1 Win=853 Len=121 TSval=1296886 TSecr=26135964
  8 0.000281907 172.31.31.144 -> 172.31.23.72 TCP 187 6633 → 33632 [PSH, ACK] Seq=848 Ack=1 Win=853 Len=121 TSval=1296886 TSecr=26135964
  9 0.000342775 172.31.31.144 -> 172.31.23.72 TCP 187 6633 → 33662 [PSH, ACK] Seq=1 Ack=1 Win=853 Len=121 TSval=1296886 TSecr=26135964
 10 0.000399309 172.31.31.144 -> 172.31.23.72 TCP 187 6633 → 33662 [PSH, ACK] Seq=122 Ack=1 Win=853 Len=121 TSval=1296886 TSecr=26135964
 11 0.000433219 172.31.31.144 -> 172.31.23.72 TCP 187 6633 → 33662 [PSH, ACK] Seq=243 Ack=1 Win=853 Len=121 TSval=1296886 TSecr=26135964
 12 0.000488309 172.31.31.144 -> 172.31.23.72 TCP 187 6633 → 33662 [PSH, ACK] Seq=364 Ack=1 Win=853 Len=121 TSval=1296886 TSecr=26135964
 13 0.000541008 172.31.23.72 -> 172.31.31.144 TCP 66 33632 → 6633 [ACK] Seq=1 Ack=969 Win=213 Len=0 TSval=26135987 TSecr=1296886
 14 0.000548567 172.31.31.144 -> 172.31.23.72 TCP 187 6633 → 33662 [PSH, ACK] Seq=485 Ack=1 Win=853 Len=121 TSval=1296886 TSecr=26135964
 15 0.000619925 172.31.31.144 -> 172.31.23.72 TCP 187 6633 → 33662 [PSH, ACK] Seq=606 Ack=1 Win=853 Len=121 TSval=1296886 TSecr=26135964
 16 0.000647318 172.31.31.144 -> 172.31.23.72 TCP 187 6633 → 33662 [PSH, ACK] Seq=727 Ack=1 Win=853 Len=121 TSval=1296886 TSecr=26135964
 17 0.000723801 172.31.31.144 -> 172.31.23.72 TCP 187 6633 → 33662 [PSH, ACK] Seq=848 Ack=1 Win=853 Len=121 TSval=1296886 TSecr=26135964
 18 0.000778730 172.31.31.144 -> 172.31.23.72 TCP 187 6633 → 33662 [PSH, ACK] Seq=969 Ack=1 Win=853 Len=121 TSval=1296886 TSecr=26135964
 19 0.000844438 172.31.31.144 -> 172.31.23.72 TCP 187 6633 → 33662 [PSH, ACK] Seq=1090 Ack=1 Win=853 Len=121 TSval=1296886 TSecr=26135964
 20 0.000947259 172.31.31.144 -> 172.31.23.72 TCP 187 6633 → 33648 [PSH, ACK] Seq=1 Ack=1 Win=853 Len=121 TSval=1296886 TSecr=26135964
 21 0.000966136 172.31.31.144 -> 172.31.23.72 TCP 187 6633 → 33648 [PSH, ACK] Seq=122 Ack=1 Win=853 Len=121 TSval=1296886 TSecr=26135964
 22 0.001012112 172.31.31.144 -> 172.31.23.72 TCP 187 6633 → 33648 [PSH, ACK] Seq=243 Ack=1 Win=853 Len=121 TSval=1296886 TSecr=26135964
 23 0.001073524 172.31.31.144 -> 172.31.23.72 TCP 187 6633 → 33648 [PSH, ACK] Seq=364 Ack=1 Win=853 Len=121 TSval=1296886 TSecr=26135964
 24 0.001079443 172.31.23.72 -> 172.31.31.144 TCP 66 33662 → 6633 [ACK] Seq=1 Ack=1211 Win=213 Len=0 TSval=26135987 TSecr=1296886
 25 0.001152602 172.31.31.144 -> 172.31.23.72 TCP 187 6633 → 33648 [PSH, ACK] Seq=485 Ack=1 Win=853 Len=121 TSval=1296886 TSecr=26135964
 26 0.001179588 172.31.31.144 -> 172.31.23.72 TCP 187 6633 → 33648 [PSH, ACK] Seq=606 Ack=1 Win=853 Len=121 TSval=1296886 TSecr=26135964
 27 0.001237298 172.31.31.144 -> 172.31.23.72 TCP 187 6633 → 33648 [PSH, ACK] Seq=727 Ack=1 Win=853 Len=121 TSval=1296886 TSecr=26135964
 28 0.001287093 172.31.31.144 -> 172.31.23.72 TCP 187 6633 → 33648 [PSH, ACK] Seq=848 Ack=1 Win=853 Len=121 TSval=1296886 TSecr=26135964
 29 0.001378126 172.31.31.144 -> 172.31.23.72 TCP 187 6633 → 33676 [PSH, ACK] Seq=1 Ack=1 Win=853 Len=121 TSval=1296886 TSecr=26135677
 30 0.001416490 172.31.31.144 -> 172.31.23.72 TCP 187 6633 → 33676 [PSH, ACK] Seq=122 Ack=1 Win=853 Len=121 TSval=1296886 TSecr=26135677
 31 0.001471562 172.31.31.144 -> 172.31.23.72 TCP 187 6633 → 33676 [PSH, ACK] Seq=243 Ack=1 Win=853 Len=121 TSval=1296886 TSecr=26135677
 32 0.001516721 172.31.23.72 -> 172.31.31.144 TCP 66 33648 → 6633 [ACK] Seq=1 Ack=969 Win=213 Len=0 TSval=26135987 TSecr=1296886
 33 0.001526976 172.31.31.144 -> 172.31.23.72 TCP 187 6633 → 33676 [PSH, ACK] Seq=364 Ack=1 Win=853 Len=121 TSval=1296886 TSecr=26135677
 34 0.001594173 172.31.31.144 -> 172.31.23.72 TCP 187 6633 → 33676 [PSH, ACK] Seq=485 Ack=1 Win=853 Len=121 TSval=1296886 TSecr=26135677
 35 0.001632118 172.31.31.144 -> 172.31.23.72 TCP 187 6633 → 33676 [PSH, ACK] Seq=606 Ack=1 Win=853 Len=121 TSval=1296886 TSecr=26135677
 36 0.001730663 172.31.31.144 -> 172.31.23.72 TCP 187 6633 → 33674 [PSH, ACK] Seq=1 Ack=1 Win=853 Len=121 TSval=1296886 TSecr=26135675
 37 0.001755312 172.31.31.144 -> 172.31.23.72 TCP 187 6633 → 33674 [PSH, ACK] Seq=122 Ack=1 Win=853 Len=121 TSval=1296886 TSecr=26135675
 38 0.001776310 172.31.23.72 -> 172.31.31.144 TCP 66 33676 → 6633 [ACK] Seq=1 Ack=727 Win=213 Len=0 TSval=26135987 TSecr=1296886
 39 0.001820932 172.31.31.144 -> 172.31.23.72 TCP 187 6633 → 33674 [PSH, ACK] Seq=243 Ack=1 Win=853 Len=121 TSval=1296886 TSecr=26135675
 40 0.001859591 172.31.23.72 -> 172.31.31.144 OpenFlow 189 Type: OFPT_PACKET_IN
 41 0.001877248 172.31.31.144 -> 172.31.23.72 OpenFlow 187 Type: OFPT_PACKET_OUT
 42 0.001882481 172.31.23.72 -> 172.31.31.144 OpenFlow 189 Type: OFPT_PACKET_IN
 43 0.001901820 172.31.23.72 -> 172.31.31.144 OpenFlow 312 Type: OFPT_PACKET_IN
 44 0.001933050 172.31.31.144 -> 172.31.23.72 OpenFlow 187 Type: OFPT_PACKET_OUT
 45 0.001982162 172.31.31.144 -> 172.31.23.72 OpenFlow 187 Type: OFPT_PACKET_OUT
 46 0.002034748 172.31.31.144 -> 172.31.23.72 OpenFlow 187 Type: OFPT_PACKET_OUT
 47 0.002116717 172.31.31.144 -> 172.31.23.72 OpenFlow 187 Type: OFPT_PACKET_OUT
 48 0.002185842 172.31.23.72 -> 172.31.31.144 TCP 66 33674 → 6633 [ACK] Seq=493 Ack=969 Win=213 Len=0 TSval=26135987 TSecr=1296886
 49 0.002196987 172.31.31.144 -> 172.31.23.72 TCP 187 6633 → 33672 [PSH, ACK] Seq=1 Ack=1 Win=853 Len=121 TSval=1296886 TSecr=26135964
 50 0.002232013 172.31.31.144 -> 172.31.23.72 TCP 187 6633 → 33672 [PSH, ACK] Seq=122 Ack=1 Win=853 Len=121 TSval=1296886 TSecr=26135964
 51 0.002274340 172.31.23.72 -> 172.31.31.144 OpenFlow 189 Type: OFPT_PACKET_IN
 52 0.002296978 172.31.23.72 -> 172.31.31.144 OpenFlow 435 Type: OFPT_PACKET_IN
 53 0.002325551 172.31.31.144 -> 172.31.23.72 OpenFlow 187 Type: OFPT_PACKET_OUT
 54 0.002383655 172.31.31.144 -> 172.31.23.72 OpenFlow 187 Type: OFPT_PACKET_OUT
 55 0.002439894 172.31.31.144 -> 172.31.23.72 OpenFlow 187 Type: OFPT_PACKET_OUT
 56 0.002477064 172.31.31.144 -> 172.31.23.72 OpenFlow 187 Type: OFPT_PACKET_OUT
 57 0.002530915 172.31.31.144 -> 172.31.23.72 OpenFlow 187 Type: OFPT_PACKET_OUT
 58 0.002617118 172.31.23.72 -> 172.31.31.144 TCP 66 33672 → 6633 [ACK] Seq=493 Ack=848 Win=213 Len=0 TSval=26135987 TSecr=1296886
 59 0.002688219 172.31.23.72 -> 172.31.31.144 OpenFlow 189 Type: OFPT_PACKET_IN
 60 0.002711766 172.31.23.72 -> 172.31.31.144 OpenFlow 189 Type: OFPT_PACKET_IN
 61 0.002718228 172.31.23.72 -> 172.31.31.144 OpenFlow 189 Type: OFPT_PACKET_IN
 62 0.002733469 172.31.31.144 -> 172.31.23.72 OpenFlow 187 Type: OFPT_PACKET_OUT
 63 0.002741951 172.31.23.72 -> 172.31.31.144 OpenFlow 189 Type: OFPT_PACKET_IN
 64 0.002778891 172.31.23.72 -> 172.31.31.144 OpenFlow 189 Type: OFPT_PACKET_IN
 65 0.002783166 172.31.23.72 -> 172.31.31.144 OpenFlow 435 Type: OFPT_PACKET_IN
 66 0.002800161 172.31.31.144 -> 172.31.23.72 OpenFlow 187 Type: OFPT_PACKET_OUT
 67 0.002877755 172.31.23.72 -> 172.31.31.144 OpenFlow 189 Type: OFPT_PACKET_IN
 68 0.002897270 172.31.31.144 -> 172.31.23.72 OpenFlow 187 Type: OFPT_PACKET_OUT
 69 0.002902668 172.31.23.72 -> 172.31.31.144 OpenFlow 189 Type: OFPT_PACKET_IN
 70 0.002943472 172.31.31.144 -> 172.31.23.72 OpenFlow 187 Type: OFPT_PACKET_OUT
 71 0.002959732 172.31.31.144 -> 172.31.23.72 TCP 66 6633 → 33630 [ACK] Seq=485 Ack=124 Win=853 Len=0 TSval=1296887 TSecr=26135987
 72 0.002965616 172.31.23.72 -> 172.31.31.144 OpenFlow 189 Type: OFPT_PACKET_IN
 73 0.002981576 172.31.31.144 -> 172.31.23.72 TCP 66 6633 → 33630 [ACK] Seq=485 Ack=247 Win=853 Len=0 TSval=1296887 TSecr=26135987
 74 0.002986120 172.31.23.72 -> 172.31.31.144 OpenFlow 189 Type: OFPT_PACKET_IN
 75 0.003000012 172.31.23.72 -> 172.31.31.144 OpenFlow 189 Type: OFPT_PACKET_IN
 76 0.003012682 172.31.23.72 -> 172.31.31.144 OpenFlow 189 Type: OFPT_PACKET_IN
 77 0.003031651 172.31.23.72 -> 172.31.31.144 OpenFlow 189 Type: OFPT_PACKET_IN
 78 0.003049933 172.31.23.72 -> 172.31.31.144 OpenFlow 189 Type: OFPT_PACKET_IN
 79 0.003051897 172.31.23.72 -> 172.31.31.144 OpenFlow 189 Type: OFPT_PACKET_IN
 80 0.003064301 172.31.23.72 -> 172.31.31.144 OpenFlow 189 Type: OFPT_PACKET_IN
 81 0.003082253 172.31.31.144 -> 172.31.23.72 TCP 66 6633 → 33670 [ACK] Seq=1 Ack=124 Win=853 Len=0 TSval=1296887 TSecr=26135987
 82 0.003085953 172.31.31.144 -> 172.31.23.72 TCP 66 6633 → 33664 [ACK] Seq=1 Ack=124 Win=853 Len=0 TSval=1296887 TSecr=26135987
 83 0.003087863 172.31.31.144 -> 172.31.23.72 TCP 66 6633 → 33670 [ACK] Seq=1 Ack=247 Win=853 Len=0 TSval=1296887 TSecr=26135987
 84 0.003092005 172.31.23.72 -> 172.31.31.144 OpenFlow 189 Type: OFPT_PACKET_IN
 85 0.003097044 172.31.23.72 -> 172.31.31.144 OpenFlow 435 Type: OFPT_PACKET_IN
 86 0.003116887 172.31.23.72 -> 172.31.31.144 OpenFlow 189 Type: OFPT_PACKET_IN
 87 0.003118984 172.31.23.72 -> 172.31.31.144 OpenFlow 435 Type: OFPT_PACKET_IN
 88 0.003130116 172.31.23.72 -> 172.31.31.144 OpenFlow 189 Type: OFPT_PACKET_IN
 89 0.003131957 172.31.23.72 -> 172.31.31.144 OpenFlow 189 Type: OFPT_PACKET_IN
 90 0.003244708 172.31.31.144 -> 172.31.23.72 TCP 66 6633 → 33664 [ACK] Seq=1 Ack=493 Win=853 Len=0 TSval=1296887 TSecr=26135987
 91 0.003251141 172.31.31.144 -> 172.31.23.72 TCP 66 6633 → 33656 [ACK] Seq=1 Ack=124 Win=853 Len=0 TSval=1296887 TSecr=26135987
 92 0.003253367 172.31.31.144 -> 172.31.23.72 TCP 66 6633 → 33656 [ACK] Seq=1 Ack=247 Win=853 Len=0 TSval=1296887 TSecr=26135987
 93 0.003254889 172.31.31.144 -> 172.31.23.72 TCP 66 6633 → 33640 [ACK] Seq=1 Ack=124 Win=853 Len=0 TSval=1296887 TSecr=26135988
 94 0.003256811 172.31.31.144 -> 172.31.23.72 TCP 66 6633 → 33640 [ACK] Seq=1 Ack=247 Win=853 Len=0 TSval=1296887 TSecr=26135988
 95 0.003263290 172.31.23.72 -> 172.31.31.144 OpenFlow 189 Type: OFPT_PACKET_IN
 96 0.003270487 172.31.23.72 -> 172.31.31.144 OpenFlow 312 Type: OFPT_PACKET_IN
 97 0.003309537 172.31.23.72 -> 172.31.31.144 TCP 66 33630 → 6633 [ACK] Seq=247 Ack=485 Win=213 Len=0 TSval=26135988 TSecr=1296887
 98 0.003312512 172.31.23.72 -> 172.31.31.144 OpenFlow 189 Type: OFPT_PACKET_IN
 99 0.003387601 172.31.31.144 -> 172.31.23.72 TCP 66 6633 → 33634 [ACK] Seq=1 Ack=124 Win=853 Len=0 TSval=1296887 TSecr=26135988
100 0.003393428 172.31.31.144 -> 172.31.23.72 TCP 66 6633 → 33660 [ACK] Seq=1 Ack=124 Win=853 Len=0 TSval=1296887 TSecr=26135988
101 0.003395256 172.31.31.144 -> 172.31.23.72 OpenFlow 187 Type: OFPT_PACKET_OUT
102 0.003397055 172.31.31.144 -> 172.31.23.72 TCP 66 6633 → 33654 [ACK] Seq=1 Ack=124 Win=853 Len=0 TSval=1296887 TSecr=26135988
103 0.003398832 172.31.31.144 -> 172.31.23.72 TCP 66 6633 → 33646 [ACK] Seq=1 Ack=124 Win=853 Len=0 TSval=1296887 TSecr=26135988
104 0.003404651 172.31.23.72 -> 172.31.31.144 OpenFlow 189 Type: OFPT_PACKET_IN
105 0.003494440 172.31.31.144 -> 172.31.23.72 OpenFlow 187 Type: OFPT_PACKET_OUT
106 0.003502858 172.31.31.144 -> 172.31.23.72 OpenFlow 187 Type: OFPT_PACKET_OUT
107 0.003505468 172.31.31.144 -> 172.31.23.72 TCP 66 6633 → 33634 [ACK] Seq=1 Ack=247 Win=853 Len=0 TSval=1296887 TSecr=26135988
108 0.003507323 172.31.31.144 -> 172.31.23.72 OpenFlow 187 Type: OFPT_PACKET_OUT
109 0.003508874 172.31.31.144 -> 172.31.23.72 TCP 66 6633 → 33644 [ACK] Seq=1 Ack=124 Win=853 Len=0 TSval=1296887 TSecr=26135988
110 0.003528900 172.31.31.144 -> 172.31.23.72 TCP 66 6633 → 33660 [ACK] Seq=1 Ack=493 Win=853 Len=0 TSval=1296887 TSecr=26135988
111 0.003532065 172.31.31.144 -> 172.31.23.72 TCP 66 6633 → 33676 [ACK] Seq=727 Ack=124 Win=853 Len=0 TSval=1296887 TSecr=26135988
112 0.003538835 172.31.23.72 -> 172.31.31.144 OpenFlow 189 Type: OFPT_PACKET_IN
113 0.003561114 172.31.31.144 -> 172.31.23.72 OpenFlow 671 Type: OFPT_PACKET_OUT
114 0.003566649 172.31.23.72 -> 172.31.31.144 OpenFlow 189 Type: OFPT_PACKET_IN
115 0.003591351 172.31.31.144 -> 172.31.23.72 TCP 66 6633 → 33654 [ACK] Seq=1 Ack=493 Win=853 Len=0 TSval=1296887 TSecr=26135988
116 0.003594374 172.31.31.144 -> 172.31.23.72 TCP 66 6633 → 33646 [ACK] Seq=1 Ack=247 Win=853 Len=0 TSval=1296887 TSecr=26135988
117 0.003627703 172.31.31.144 -> 172.31.23.72 TCP 66 6633 → 33644 [ACK] Seq=1 Ack=247 Win=853 Len=0 TSval=1296887 TSecr=26135988
118 0.003701425 172.31.31.144 -> 172.31.23.72 TCP 66 6633 → 33676 [ACK] Seq=727 Ack=247 Win=853 Len=0 TSval=1296887 TSecr=26135988
119 0.003706992 172.31.31.144 -> 172.31.23.72 TCP 66 6633 → 33662 [ACK] Seq=1211 Ack=370 Win=853 Len=0 TSval=1296887 TSecr=26135988
120 0.003723751 172.31.31.144 -> 172.31.23.72 OpenFlow 187 Type: OFPT_PACKET_OUT
121 0.003754318 172.31.23.72 -> 172.31.31.144 TCP 66 33630 → 6633 [ACK] Seq=247 Ack=727 Win=213 Len=0 TSval=26135988 TSecr=1296887
122 0.003798489 172.31.31.144 -> 172.31.23.72 OpenFlow 187 Type: OFPT_PACKET_OUT
123 0.003834644 172.31.31.144 -> 172.31.23.72 TCP 66 6633 → 33632 [ACK] Seq=969 Ack=247 Win=853 Len=0 TSval=1296887 TSecr=26135988
124 0.004055708 172.31.23.72 -> 172.31.31.144 TCP 66 33670 → 6633 [ACK] Seq=247 Ack=969 Win=213 Len=0 TSval=26135988 TSecr=1296887
125 0.004113427 172.31.31.144 -> 172.31.23.72 OpenFlow 187 Type: OFPT_PACKET_OUT
126 0.004145516 172.31.31.144 -> 172.31.23.72 OpenFlow 187 Type: OFPT_PACKET_OUT
127 0.004191500 172.31.23.72 -> 172.31.31.144 TCP 66 33664 → 6633 [ACK] Seq=493 Ack=243 Win=213 Len=0 TSval=26135988 TSecr=1296887
128 0.004212992 172.31.31.144 -> 172.31.23.72 TCP 66 6633 → 33674 [ACK] Seq=969 Ack=739 Win=853 Len=0 TSval=1296887 TSecr=26135988
129 0.004246539 172.31.31.144 -> 172.31.23.72 OpenFlow 187 Type: OFPT_PACKET_OUT
130 0.004303714 172.31.31.144 -> 172.31.23.72 OpenFlow 187 Type: OFPT_PACKET_OUT
131 0.004318685 172.31.23.72 -> 172.31.31.144 TCP 66 33664 → 6633 [ACK] Seq=493 Ack=485 Win=213 Len=0 TSval=26135988 TSecr=1296887
132 0.004373407 172.31.31.144 -> 172.31.23.72 OpenFlow 187 Type: OFPT_PACKET_OUT
133 0.004402860 172.31.31.144 -> 172.31.23.72 OpenFlow 187 Type: OFPT_PACKET_OUT
134 0.004436834 172.31.23.72 -> 172.31.31.144 TCP 66 33664 → 6633 [ACK] Seq=493 Ack=727 Win=213 Len=0 TSval=26135988 TSecr=1296887
135 0.004491453 172.31.31.144 -> 172.31.23.72 TCP 187 6633 → 33658 [PSH, ACK] Seq=1 Ack=1 Win=853 Len=121 TSval=1296887 TSecr=26135964
136 0.004522813 172.31.31.144 -> 172.31.23.72 TCP 187 6633 → 33658 [PSH, ACK] Seq=122 Ack=1 Win=853 Len=121 TSval=1296887 TSecr=26135964
137 0.004572851 172.31.31.144 -> 172.31.23.72 TCP 187 6633 → 33658 [PSH, ACK] Seq=243 Ack=1 Win=853 Len=121 TSval=1296887 TSecr=26135964
138 0.004624460 172.31.31.144 -> 172.31.23.72 TCP 187 6633 → 33658 [PSH, ACK] Seq=364 Ack=1 Win=853 Len=121 TSval=1296887 TSecr=26135964
139 0.004676374 172.31.23.72 -> 172.31.31.144 TCP 66 33658 → 6633 [ACK] Seq=1 Ack=485 Win=213 Len=0 TSval=26135988 TSecr=1296887
140 0.004706159 172.31.31.144 -> 172.31.23.72 TCP 187 6633 → 33658 [PSH, ACK] Seq=485 Ack=1 Win=853 Len=121 TSval=1296887 TSecr=26135964
141 0.004760933 172.31.31.144 -> 172.31.23.72 TCP 187 6633 → 33658 [PSH, ACK] Seq=606 Ack=1 Win=853 Len=121 TSval=1296887 TSecr=26135964
142 0.004792415 172.31.23.72 -> 172.31.31.144 TCP 66 33658 → 6633 [ACK] Seq=1 Ack=727 Win=213 Len=0 TSval=26135988 TSecr=1296887
143 0.004848868 172.31.31.144 -> 172.31.23.72 TCP 187 6633 → 33642 [PSH, ACK] Seq=1 Ack=1 Win=853 Len=121 TSval=1296887 TSecr=26135964
144 0.004874493 172.31.31.144 -> 172.31.23.72 TCP 187 6633 → 33642 [PSH, ACK] Seq=122 Ack=1 Win=853 Len=121 TSval=1296887 TSecr=26135964
145 0.004927209 172.31.31.144 -> 172.31.23.72 TCP 187 6633 → 33642 [PSH, ACK] Seq=243 Ack=1 Win=853 Len=121 TSval=1296887 TSecr=26135964
146 0.004931886 172.31.23.72 -> 172.31.31.144 TCP 66 33642 → 6633 [ACK] Seq=1 Ack=243 Win=213 Len=0 TSval=26135988 TSecr=1296887
147 0.004975712 172.31.31.144 -> 172.31.23.72 TCP 187 6633 → 33642 [PSH, ACK] Seq=364 Ack=1 Win=853 Len=121 TSval=1296887 TSecr=26135964
148 0.005033744 172.31.31.144 -> 172.31.23.72 TCP 187 6633 → 33642 [PSH, ACK] Seq=485 Ack=1 Win=853 Len=121 TSval=1296887 TSecr=26135964
149 0.005088834 172.31.23.72 -> 172.31.31.144 TCP 66 33642 → 6633 [ACK] Seq=1 Ack=606 Win=213 Len=0 TSval=26135988 TSecr=1296887
150 0.005100396 172.31.31.144 -> 172.31.23.72 TCP 187 6633 → 33642 [PSH, ACK] Seq=606 Ack=1 Win=853 Len=121 TSval=1296887 TSecr=26135964
151 0.005170129 172.31.31.144 -> 172.31.23.72 TCP 187 6633 → 33642 [PSH, ACK] Seq=727 Ack=1 Win=853 Len=121 TSval=1296887 TSecr=26135988
152 0.005201526 172.31.23.72 -> 172.31.31.144 TCP 66 33642 → 6633 [ACK] Seq=1 Ack=848 Win=213 Len=0 TSval=26135988 TSecr=1296887
153 0.005215855 172.31.31.144 -> 172.31.23.72 TCP 187 6633 → 33642 [PSH, ACK] Seq=848 Ack=1 Win=853 Len=121 TSval=1296887 TSecr=26135988
154 0.005258666 172.31.31.144 -> 172.31.23.72 TCP 187 6633 → 33642 [PSH, ACK] Seq=969 Ack=1 Win=853 Len=121 TSval=1296887 TSecr=26135988
155 0.005313704 172.31.23.72 -> 172.31.31.144 TCP 66 33642 → 6633 [ACK] Seq=1 Ack=1090 Win=213 Len=0 TSval=26135988 TSecr=1296887
156 0.005324049 172.31.31.144 -> 172.31.23.72 TCP 187 6633 → 33642 [PSH, ACK] Seq=1090 Ack=1 Win=853 Len=121 TSval=1296887 TSecr=26135988
157 0.005395046 172.31.31.144 -> 172.31.23.72 TCP 187 6633 → 33638 [PSH, ACK] Seq=1 Ack=1 Win=853 Len=121 TSval=1296887 TSecr=26135964
158 0.005434751 172.31.31.144 -> 172.31.23.72 TCP 187 6633 → 33638 [PSH, ACK] Seq=122 Ack=1 Win=853 Len=121 TSval=1296887 TSecr=26135964
159 0.005451748 172.31.23.72 -> 172.31.31.144 OpenFlow 189 Type: OFPT_PACKET_IN
160 0.005472661 172.31.23.72 -> 172.31.31.144 OpenFlow 189 Type: OFPT_PACKET_IN
161 0.005506750 172.31.31.144 -> 172.31.23.72 OpenFlow 187 Type: OFPT_PACKET_OUT
162 0.005558996 172.31.31.144 -> 172.31.23.72 OpenFlow 187 Type: OFPT_PACKET_OUT
163 0.005596898 172.31.31.144 -> 172.31.23.72 OpenFlow 187 Type: OFPT_PACKET_OUT
164 0.005645731 172.31.31.144 -> 172.31.23.72 OpenFlow 187 Type: OFPT_PACKET_OUT
165 0.005688721 172.31.31.144 -> 172.31.23.72 TCP 66 6633 → 33638 [ACK] Seq=727 Ack=124 Win=853 Len=0 TSval=1296887 TSecr=26135988
166 0.005719800 172.31.31.144 -> 172.31.23.72 TCP 66 6633 → 33638 [ACK] Seq=727 Ack=247 Win=853 Len=0 TSval=1296887 TSecr=26135988
167 0.005765263 172.31.23.72 -> 172.31.31.144 TCP 66 33638 → 6633 [ACK] Seq=247 Ack=727 Win=213 Len=0 TSval=26135988 TSecr=1296887
168 0.005899494 172.31.23.72 -> 172.31.31.144 OpenFlow 189 Type: OFPT_PACKET_IN
169 0.005924713 172.31.23.72 -> 172.31.31.144 OpenFlow 435 Type: OFPT_PACKET_IN
170 0.005939422 172.31.23.72 -> 172.31.31.144 OpenFlow 189 Type: OFPT_PACKET_IN
171 0.005964596 172.31.23.72 -> 172.31.31.144 OpenFlow 189 Type: OFPT_PACKET_IN
172 0.005968656 172.31.23.72 -> 172.31.31.144 OpenFlow 189 Type: OFPT_PACKET_IN
173 0.005982000 172.31.23.72 -> 172.31.31.144 OpenFlow 189 Type: OFPT_PACKET_IN
174 0.005986797 172.31.23.72 -> 172.31.31.144 OpenFlow 189 Type: OFPT_PACKET_IN
175 0.005999026 172.31.23.72 -> 172.31.31.144 OpenFlow 189 Type: OFPT_PACKET_IN
176 0.006013341 172.31.23.72 -> 172.31.31.144 OpenFlow 189 Type: OFPT_PACKET_IN
177 0.006027641 172.31.23.72 -> 172.31.31.144 OpenFlow 189 Type: OFPT_PACKET_IN
178 0.006032807 172.31.23.72 -> 172.31.31.144 OpenFlow 189 Type: OFPT_PACKET_IN
179 0.006054826 172.31.23.72 -> 172.31.31.144 OpenFlow 189 Type: OFPT_PACKET_IN
180 0.006065637 172.31.23.72 -> 172.31.31.144 OpenFlow 189 Type: OFPT_PACKET_IN
181 0.006067589 172.31.23.72 -> 172.31.31.144 OpenFlow 435 Type: OFPT_PACKET_IN
182 0.006082035 172.31.23.72 -> 172.31.31.144 OpenFlow 189 Type: OFPT_PACKET_IN
183 0.006097751 172.31.23.72 -> 172.31.31.144 OpenFlow 189 Type: OFPT_PACKET_IN
184 0.006112053 172.31.23.72 -> 172.31.31.144 OpenFlow 189 Type: OFPT_PACKET_IN
185 0.006137478 172.31.23.72 -> 172.31.31.144 OpenFlow 189 Type: OFPT_PACKET_IN
186 0.006139570 172.31.23.72 -> 172.31.31.144 OpenFlow 435 Type: OFPT_PACKET_IN
187 0.006150696 172.31.31.144 -> 172.31.23.72 TCP 66 6633 → 33668 [ACK] Seq=1 Ack=124 Win=853 Len=0 TSval=1296887 TSecr=26135988
188 0.006155833 172.31.31.144 -> 172.31.23.72 TCP 66 6633 → 33668 [ACK] Seq=1 Ack=493 Win=853 Len=0 TSval=1296887 TSecr=26135988
189 0.006286026 172.31.23.72 -> 172.31.31.144 OpenFlow 435 Type: OFPT_PACKET_IN
190 0.006291754 172.31.23.72 -> 172.31.31.144 OpenFlow 189 Type: OFPT_PACKET_IN
191 0.006293418 172.31.23.72 -> 172.31.31.144 OpenFlow 189 Type: OFPT_PACKET_IN
192 0.006295240 172.31.23.72 -> 172.31.31.144 OpenFlow 312 Type: OFPT_PACKET_IN
193 0.006296961 172.31.23.72 -> 172.31.31.144 OpenFlow 189 Type: OFPT_PACKET_IN
194 0.006393108 172.31.31.144 -> 172.31.23.72 TCP 66 6633 → 33656 [ACK] Seq=1 Ack=370 Win=853 Len=0 TSval=1296887 TSecr=26135988
195 0.006396795 172.31.31.144 -> 172.31.23.72 TCP 66 6633 → 33636 [ACK] Seq=1 Ack=124 Win=853 Len=0 TSval=1296887 TSecr=26135988
196 0.006398578 172.31.31.144 -> 172.31.23.72 TCP 66 6633 → 33656 [ACK] Seq=1 Ack=493 Win=853 Len=0 TSval=1296887 TSecr=26135988
197 0.006400322 172.31.31.144 -> 172.31.23.72 TCP 66 6633 → 33650 [ACK] Seq=1 Ack=124 Win=853 Len=0 TSval=1296887 TSecr=26135988
198 0.006401999 172.31.31.144 -> 172.31.23.72 TCP 66 6633 → 33636 [ACK] Seq=1 Ack=247 Win=853 Len=0 TSval=1296887 TSecr=26135988
199 0.006403432 172.31.31.144 -> 172.31.23.72 TCP 66 6633 → 33640 [ACK] Seq=1 Ack=370 Win=853 Len=0 TSval=1296887 TSecr=26135988
200 0.006405054 172.31.31.144 -> 172.31.23.72 TCP 66 6633 → 33634 [ACK] Seq=1 Ack=370 Win=853 Len=0 TSval=1296887 TSecr=26135988
201 0.006406611 172.31.31.144 -> 172.31.23.72 TCP 66 6633 → 33650 [ACK] Seq=1 Ack=247 Win=853 Len=0 TSval=1296887 TSecr=26135988
202 0.006408194 172.31.31.144 -> 172.31.23.72 TCP 66 6633 → 33660 [ACK] Seq=1 Ack=616 Win=853 Len=0 TSval=1296887 TSecr=26135988
203 0.006413324 172.31.23.72 -> 172.31.31.144 OpenFlow 189 Type: OFPT_PACKET_IN
204 0.006417993 172.31.23.72 -> 172.31.31.144 OpenFlow 189 Type: OFPT_PACKET_IN
205 0.006562352 172.31.31.144 -> 172.31.23.72 TCP 66 6633 → 33646 [ACK] Seq=1 Ack=370 Win=853 Len=0 TSval=1296887 TSecr=26135988
206 0.006564663 172.31.31.144 -> 172.31.23.72 TCP 66 6633 → 33644 [ACK] Seq=1 Ack=370 Win=853 Len=0 TSval=1296887 TSecr=26135988
207 0.006566364 172.31.31.144 -> 172.31.23.72 TCP 66 6633 → 33640 [ACK] Seq=1 Ack=739 Win=853 Len=0 TSval=1296887 TSecr=26135988
208 0.006567876 172.31.31.144 -> 172.31.23.72 TCP 66 6633 → 33676 [ACK] Seq=727 Ack=370 Win=853 Len=0 TSval=1296887 TSecr=26135988
209 0.006607169 172.31.31.144 -> 172.31.23.72 TCP 66 6633 → 33634 [ACK] Seq=1 Ack=739 Win=853 Len=0 TSval=1296888 TSecr=26135988
210 0.006644568 172.31.31.144 -> 172.31.23.72 TCP 66 6633 → 33660 [ACK] Seq=1 Ack=985 Win=853 Len=0 TSval=1296888 TSecr=26135988
211 0.006677564 172.31.31.144 -> 172.31.23.72 TCP 66 6633 → 33646 [ACK] Seq=1 Ack=493 Win=853 Len=0 TSval=1296888 TSecr=26135988
212 0.006701637 172.31.31.144 -> 172.31.23.72 TCP 66 6633 → 33644 [ACK] Seq=1 Ack=493 Win=853 Len=0 TSval=1296888 TSecr=26135988
213 0.006768336 172.31.31.144 -> 172.31.23.72 TCP 66 6633 → 33676 [ACK] Seq=727 Ack=493 Win=853 Len=0 TSval=1296888 TSecr=26135988
214 0.006770035 172.31.31.144 -> 172.31.23.72 TCP 66 6633 → 33662 [ACK] Seq=1211 Ack=739 Win=853 Len=0 TSval=1296888 TSecr=26135988
215 0.006860522 172.31.31.144 -> 172.31.23.72 TCP 66 6633 → 33672 [ACK] Seq=969 Ack=739 Win=853 Len=0 TSval=1296888 TSecr=26135988
216 0.006883125 172.31.31.144 -> 172.31.23.72 TCP 66 6633 → 33642 [ACK] Seq=1211 Ack=247 Win=853 Len=0 TSval=1296888 TSecr=26135988
217 1.100132321 172.31.31.144 -> 172.31.23.72 OpenFlow 90 Type: OFPT_MULTIPART_REQUEST, OFPMP_GROUP
218 1.100156784 172.31.31.144 -> 172.31.23.72 OpenFlow 106 Type: OFPT_MULTIPART_REQUEST, OFPMP_METER
219 1.100474173 172.31.23.72 -> 172.31.31.144 OpenFlow 82 Type: OFPT_MULTIPART_REPLY, OFPMP_GROUP
220 1.100524555 172.31.23.72 -> 172.31.31.144 OpenFlow 98 Type: OFPT_MULTIPART_REPLY, OFPMP_METER
221 1.100834902 172.31.31.144 -> 172.31.23.72 TCP 66 6633 → 33630 [ACK] Seq=791 Ack=295 Win=853 Len=0 TSval=1297161 TSecr=26136262
222 1.199236511 172.31.31.144 -> 172.31.23.72 OpenFlow 90 Type: OFPT_MULTIPART_REQUEST, OFPMP_GROUP
223 1.199256781 172.31.23.72 -> 172.31.31.144 TCP 66 33634 → 6633 [ACK] Seq=739 Ack=25 Win=213 Len=0 TSval=26136287 TSecr=1297186
224 1.199274638 172.31.31.144 -> 172.31.23.72 OpenFlow 90 Type: OFPT_MULTIPART_REQUEST, OFPMP_GROUP
225 1.199282454 172.31.31.144 -> 172.31.23.72 OpenFlow 106 Type: OFPT_MULTIPART_REQUEST, OFPMP_METER
226 1.199286943 172.31.23.72 -> 172.31.31.144 TCP 66 33634 → 6633 [ACK] Seq=739 Ack=65 Win=213 Len=0 TSval=26136287 TSecr=1297186
227 1.199290982 172.31.31.144 -> 172.31.23.72 OpenFlow 90 Type: OFPT_MULTIPART_REQUEST, OFPMP_GROUP
228 1.199293786 172.31.31.144 -> 172.31.23.72 OpenFlow 106 Type: OFPT_MULTIPART_REQUEST, OFPMP_METER
229 1.199296034 172.31.31.144 -> 172.31.23.72 OpenFlow 106 Type: OFPT_MULTIPART_REQUEST, OFPMP_METER
230 1.199418130 172.31.23.72 -> 172.31.31.144 OpenFlow 82 Type: OFPT_MULTIPART_REPLY, OFPMP_GROUP
231 1.199442019 172.31.23.72 -> 172.31.31.144 OpenFlow 98 Type: OFPT_MULTIPART_REPLY, OFPMP_METER
232 1.199468107 172.31.23.72 -> 172.31.31.144 OpenFlow 82 Type: OFPT_MULTIPART_REPLY, OFPMP_GROUP
233 1.199486725 172.31.23.72 -> 172.31.31.144 OpenFlow 98 Type: OFPT_MULTIPART_REPLY, OFPMP_METER
234 1.199524527 172.31.23.72 -> 172.31.31.144 OpenFlow 82 Type: OFPT_MULTIPART_REPLY, OFPMP_GROUP
235 1.199542555 172.31.23.72 -> 172.31.31.144 OpenFlow 98 Type: OFPT_MULTIPART_REPLY, OFPMP_METER
236 1.199651237 172.31.31.144 -> 172.31.23.72 TCP 66 6633 → 33636 [ACK] Seq=65 Ack=263 Win=853 Len=0 TSval=1297186 TSecr=26136287
237 1.199657847 172.31.31.144 -> 172.31.23.72 TCP 66 6633 → 33634 [ACK] Seq=65 Ack=755 Win=853 Len=0 TSval=1297186 TSecr=26136287
238 1.199667045 172.31.31.144 -> 172.31.23.72 TCP 66 6633 → 33636 [ACK] Seq=65 Ack=295 Win=853 Len=0 TSval=1297186 TSecr=26136287
239 1.199824994 172.31.31.144 -> 172.31.23.72 TCP 66 6633 → 33634 [ACK] Seq=65 Ack=787 Win=853 Len=0 TSval=1297186 TSecr=26136287
240 1.199857588 172.31.31.144 -> 172.31.23.72 TCP 66 6633 → 33632 [ACK] Seq=1033 Ack=263 Win=853 Len=0 TSval=1297186 TSecr=26136287
241 1.199877231 172.31.31.144 -> 172.31.23.72 TCP 66 6633 → 33632 [ACK] Seq=1033 Ack=295 Win=853 Len=0 TSval=1297186 TSecr=26136287
242 1.299411383 172.31.31.144 -> 172.31.23.72 OpenFlow 90 Type: OFPT_MULTIPART_REQUEST, OFPMP_GROUP
243 1.299426563 172.31.31.144 -> 172.31.23.72 OpenFlow 90 Type: OFPT_MULTIPART_REQUEST, OFPMP_GROUP
244 1.299429966 172.31.31.144 -> 172.31.23.72 OpenFlow 106 Type: OFPT_MULTIPART_REQUEST, OFPMP_METER
245 1.299432752 172.31.31.144 -> 172.31.23.72 OpenFlow 106 Type: OFPT_MULTIPART_REQUEST, OFPMP_METER
246 1.299563684 172.31.23.72 -> 172.31.31.144 OpenFlow 82 Type: OFPT_MULTIPART_REPLY, OFPMP_GROUP
247 1.299591896 172.31.23.72 -> 172.31.31.144 OpenFlow 98 Type: OFPT_MULTIPART_REPLY, OFPMP_METER
248 1.299687910 172.31.23.72 -> 172.31.31.144 OpenFlow 82 Type: OFPT_MULTIPART_REPLY, OFPMP_GROUP
249 1.299711665 172.31.23.72 -> 172.31.31.144 OpenFlow 98 Type: OFPT_MULTIPART_REPLY, OFPMP_METER
250 1.299814144 172.31.31.144 -> 172.31.23.72 TCP 66 6633 → 33640 [ACK] Seq=65 Ack=755 Win=853 Len=0 TSval=1297211 TSecr=26136312
251 1.299820754 172.31.31.144 -> 172.31.23.72 TCP 66 6633 → 33640 [ACK] Seq=65 Ack=787 Win=853 Len=0 TSval=1297211 TSecr=26136312
252 1.299915120 172.31.31.144 -> 172.31.23.72 TCP 66 6633 → 33638 [ACK] Seq=791 Ack=263 Win=853 Len=0 TSval=1297211 TSecr=26136312
253 1.299934271 172.31.31.144 -> 172.31.23.72 TCP 66 6633 → 33638 [ACK] Seq=791 Ack=295 Win=853 Len=0 TSval=1297211 TSecr=26136312
254 1.399551130 172.31.31.144 -> 172.31.23.72 OpenFlow 90 Type: OFPT_MULTIPART_REQUEST, OFPMP_GROUP
255 1.399573740 172.31.31.144 -> 172.31.23.72 OpenFlow 106 Type: OFPT_MULTIPART_REQUEST, OFPMP_METER
256 1.399577293 172.31.31.144 -> 172.31.23.72 OpenFlow 90 Type: OFPT_MULTIPART_REQUEST, OFPMP_GROUP
257 1.399602231 172.31.31.144 -> 172.31.23.72 OpenFlow 106 Type: OFPT_MULTIPART_REQUEST, OFPMP_METER
258 1.399796828 172.31.23.72 -> 172.31.31.144 OpenFlow 82 Type: OFPT_MULTIPART_REPLY, OFPMP_GROUP
259 1.399830908 172.31.23.72 -> 172.31.31.144 OpenFlow 98 Type: OFPT_MULTIPART_REPLY, OFPMP_METER
260 1.399893999 172.31.23.72 -> 172.31.31.144 OpenFlow 82 Type: OFPT_MULTIPART_REPLY, OFPMP_GROUP
261 1.399938521 172.31.23.72 -> 172.31.31.144 OpenFlow 98 Type: OFPT_MULTIPART_REPLY, OFPMP_METER
262 1.400057987 172.31.31.144 -> 172.31.23.72 TCP 66 6633 → 33644 [ACK] Seq=65 Ack=509 Win=853 Len=0 TSval=1297236 TSecr=26136337
263 1.400092737 172.31.31.144 -> 172.31.23.72 TCP 66 6633 → 33644 [ACK] Seq=65 Ack=541 Win=853 Len=0 TSval=1297236 TSecr=26136337
264 1.400175145 172.31.31.144 -> 172.31.23.72 TCP 66 6633 → 33642 [ACK] Seq=1275 Ack=295 Win=853 Len=0 TSval=1297236 TSecr=26136337
265 1.499665762 172.31.31.144 -> 172.31.23.72 OpenFlow 90 Type: OFPT_MULTIPART_REQUEST, OFPMP_GROUP
266 1.499680452 172.31.31.144 -> 172.31.23.72 TCP 90 6633 → 33648 [PSH, ACK] Seq=969 Ack=1 Win=853 Len=24 TSval=1297261 TSecr=26135987
267 1.499688196 172.31.31.144 -> 172.31.23.72 OpenFlow 106 Type: OFPT_MULTIPART_REQUEST, OFPMP_METER
268 1.499691860 172.31.31.144 -> 172.31.23.72 TCP 106 6633 → 33648 [PSH, ACK] Seq=993 Ack=1 Win=853 Len=40 TSval=1297261 TSecr=26135987
269 1.499797401 172.31.23.72 -> 172.31.31.144 OpenFlow 82 Type: OFPT_MULTIPART_REPLY, OFPMP_GROUP
270 1.499823258 172.31.23.72 -> 172.31.31.144 OpenFlow 98 Type: OFPT_MULTIPART_REPLY, OFPMP_METER
271 1.499852602 172.31.23.72 -> 172.31.31.144 OpenFlow 82 Type: OFPT_MULTIPART_REPLY, OFPMP_GROUP
272 1.499880110 172.31.23.72 -> 172.31.31.144 OpenFlow 98 Type: OFPT_MULTIPART_REPLY, OFPMP_METER
273 1.500037531 172.31.31.144 -> 172.31.23.72 TCP 66 6633 → 33646 [ACK] Seq=65 Ack=509 Win=853 Len=0 TSval=1297261 TSecr=26136362
274 1.500056974 172.31.31.144 -> 172.31.23.72 TCP 66 6633 → 33646 [ACK] Seq=65 Ack=541 Win=853 Len=0 TSval=1297261 TSecr=26136362
275 1.500113372 172.31.31.144 -> 172.31.23.72 TCP 66 6633 → 33648 [ACK] Seq=1033 Ack=49 Win=853 Len=0 TSval=1297261 TSecr=26136362
276 1.599829118 172.31.31.144 -> 172.31.23.72 OpenFlow 90 Type: OFPT_MULTIPART_REQUEST, OFPMP_GROUP
277 1.599857206 172.31.31.144 -> 172.31.23.72 TCP 90 6633 → 33652 [PSH, ACK] Seq=1 Ack=1 Win=853 Len=24 TSval=1297286 TSecr=26135964
278 1.599879498 172.31.31.144 -> 172.31.23.72 OpenFlow 106 Type: OFPT_MULTIPART_REQUEST, OFPMP_METER
279 1.599883479 172.31.31.144 -> 172.31.23.72 TCP 106 6633 → 33652 [PSH, ACK] Seq=25 Ack=1 Win=853 Len=40 TSval=1297286 TSecr=26135964
280 1.600061230 172.31.23.72 -> 172.31.31.144 OpenFlow 82 Type: OFPT_MULTIPART_REPLY, OFPMP_GROUP
281 1.600091687 172.31.23.72 -> 172.31.31.144 OpenFlow 98 Type: OFPT_MULTIPART_REPLY, OFPMP_METER
282 1.600111314 172.31.23.72 -> 172.31.31.144 OpenFlow 82 Type: OFPT_MULTIPART_REPLY, OFPMP_GROUP
283 1.600152037 172.31.23.72 -> 172.31.31.144 OpenFlow 98 Type: OFPT_MULTIPART_REPLY, OFPMP_METER
284 1.600296158 172.31.31.144 -> 172.31.23.72 TCP 66 6633 → 33652 [ACK] Seq=65 Ack=17 Win=853 Len=0 TSval=1297286 TSecr=26136387
285 1.600311192 172.31.31.144 -> 172.31.23.72 TCP 66 6633 → 33652 [ACK] Seq=65 Ack=49 Win=853 Len=0 TSval=1297286 TSecr=26136387
286 1.600339103 172.31.31.144 -> 172.31.23.72 TCP 66 6633 → 33650 [ACK] Seq=65 Ack=263 Win=853 Len=0 TSval=1297286 TSecr=26136387
287 1.600358199 172.31.31.144 -> 172.31.23.72 TCP 66 6633 → 33650 [ACK] Seq=65 Ack=295 Win=853 Len=0 TSval=1297286 TSecr=26136387
288 1.700033881 172.31.31.144 -> 172.31.23.72 OpenFlow 90 Type: OFPT_MULTIPART_REQUEST, OFPMP_GROUP
289 1.700062639 172.31.31.144 -> 172.31.23.72 OpenFlow 90 Type: OFPT_MULTIPART_REQUEST, OFPMP_GROUP
290 1.700066220 172.31.31.144 -> 172.31.23.72 OpenFlow 106 Type: OFPT_MULTIPART_REQUEST, OFPMP_METER
291 1.700070603 172.31.31.144 -> 172.31.23.72 OpenFlow 106 Type: OFPT_MULTIPART_REQUEST, OFPMP_METER
292 1.700255803 172.31.23.72 -> 172.31.31.144 OpenFlow 82 Type: OFPT_MULTIPART_REPLY, OFPMP_GROUP
293 1.700292155 172.31.23.72 -> 172.31.31.144 OpenFlow 98 Type: OFPT_MULTIPART_REPLY, OFPMP_METER
294 1.700339582 172.31.23.72 -> 172.31.31.144 OpenFlow 82 Type: OFPT_MULTIPART_REPLY, OFPMP_GROUP
295 1.700361358 172.31.23.72 -> 172.31.31.144 OpenFlow 98 Type: OFPT_MULTIPART_REPLY, OFPMP_METER
296 1.700493722 172.31.31.144 -> 172.31.23.72 TCP 66 6633 → 33656 [ACK] Seq=65 Ack=509 Win=853 Len=0 TSval=1297311 TSecr=26136412
297 1.700509916 172.31.31.144 -> 172.31.23.72 TCP 66 6633 → 33656 [ACK] Seq=65 Ack=541 Win=853 Len=0 TSval=1297311 TSecr=26136412
298 1.700556972 172.31.31.144 -> 172.31.23.72 TCP 66 6633 → 33654 [ACK] Seq=65 Ack=509 Win=853 Len=0 TSval=1297311 TSecr=26136412
299 1.700579523 172.31.31.144 -> 172.31.23.72 TCP 66 6633 → 33654 [ACK] Seq=65 Ack=541 Win=853 Len=0 TSval=1297311 TSecr=26136412
300 1.800193499 172.31.31.144 -> 172.31.23.72 TCP 90 6633 → 33658 [PSH, ACK] Seq=727 Ack=1 Win=853 Len=24 TSval=1297336 TSecr=26135988
301 1.800220379 172.31.31.144 -> 172.31.23.72 OpenFlow 90 Type: OFPT_MULTIPART_REQUEST, OFPMP_GROUP
302 1.800224564 172.31.31.144 -> 172.31.23.72 OpenFlow 106 Type: OFPT_MULTIPART_REQUEST, OFPMP_METER
303 1.800244364 172.31.31.144 -> 172.31.23.72 TCP 106 6633 → 33658 [PSH, ACK] Seq=751 Ack=1 Win=853 Len=40 TSval=1297336 TSecr=26135988
304 1.800448739 172.31.23.72 -> 172.31.31.144 OpenFlow 82 Type: OFPT_MULTIPART_REPLY, OFPMP_GROUP
305 1.800488915 172.31.23.72 -> 172.31.31.144 OpenFlow 98 Type: OFPT_MULTIPART_REPLY, OFPMP_METER
306 1.800570324 172.31.23.72 -> 172.31.31.144 OpenFlow 82 Type: OFPT_MULTIPART_REPLY, OFPMP_GROUP
307 1.800590005 172.31.23.72 -> 172.31.31.144 OpenFlow 98 Type: OFPT_MULTIPART_REPLY, OFPMP_METER
308 1.800723180 172.31.31.144 -> 172.31.23.72 TCP 66 6633 → 33660 [ACK] Seq=65 Ack=1001 Win=853 Len=0 TSval=1297336 TSecr=26136437
309 1.800756274 172.31.31.144 -> 172.31.23.72 TCP 66 6633 → 33660 [ACK] Seq=65 Ack=1033 Win=853 Len=0 TSval=1297336 TSecr=26136437
310 1.800796413 172.31.31.144 -> 172.31.23.72 TCP 66 6633 → 33658 [ACK] Seq=791 Ack=17 Win=853 Len=0 TSval=1297336 TSecr=26136437
311 1.800822211 172.31.31.144 -> 172.31.23.72 TCP 66 6633 → 33658 [ACK] Seq=791 Ack=49 Win=853 Len=0 TSval=1297336 TSecr=26136437
312 1.899423375 172.31.31.144 -> 172.31.23.72 OpenFlow 90 Type: OFPT_MULTIPART_REQUEST, OFPMP_GROUP
313 1.899449512 172.31.31.144 -> 172.31.23.72 OpenFlow 90 Type: OFPT_MULTIPART_REQUEST, OFPMP_GROUP
314 1.899455005 172.31.31.144 -> 172.31.23.72 OpenFlow 106 Type: OFPT_MULTIPART_REQUEST, OFPMP_METER
315 1.899460434 172.31.31.144 -> 172.31.23.72 OpenFlow 106 Type: OFPT_MULTIPART_REQUEST, OFPMP_METER
316 1.899761537 172.31.23.72 -> 172.31.31.144 OpenFlow 82 Type: OFPT_MULTIPART_REPLY, OFPMP_GROUP
317 1.899841147 172.31.23.72 -> 172.31.31.144 OpenFlow 98 Type: OFPT_MULTIPART_REPLY, OFPMP_METER
318 1.899857944 172.31.23.72 -> 172.31.31.144 OpenFlow 82 Type: OFPT_MULTIPART_REPLY, OFPMP_GROUP
319 1.899888210 172.31.23.72 -> 172.31.31.144 OpenFlow 98 Type: OFPT_MULTIPART_REPLY, OFPMP_METER
320 1.900063466 172.31.31.144 -> 172.31.23.72 TCP 66 6633 → 33662 [ACK] Seq=1275 Ack=787 Win=853 Len=0 TSval=1297361 TSecr=26136462
321 1.900141713 172.31.31.144 -> 172.31.23.72 TCP 66 6633 → 33664 [ACK] Seq=791 Ack=541 Win=853 Len=0 TSval=1297361 TSecr=26136462
322 1.999441501 172.31.31.144 -> 172.31.23.72 OpenFlow 90 Type: OFPT_MULTIPART_REQUEST, OFPMP_GROUP
323 1.999455339 172.31.31.144 -> 172.31.23.72 TCP 90 6633 → 33666 [PSH, ACK] Seq=1 Ack=1 Win=853 Len=24 TSval=1297386 TSecr=26135963
324 1.999458559 172.31.31.144 -> 172.31.23.72 TCP 106 6633 → 33666 [PSH, ACK] Seq=25 Ack=1 Win=853 Len=40 TSval=1297386 TSecr=26135963
325 1.999461316 172.31.31.144 -> 172.31.23.72 OpenFlow 106 Type: OFPT_MULTIPART_REQUEST, OFPMP_METER
326 1.999537733 172.31.23.72 -> 172.31.31.144 OpenFlow 82 Type: OFPT_MULTIPART_REPLY, OFPMP_GROUP
327 1.999571921 172.31.23.72 -> 172.31.31.144 OpenFlow 98 Type: OFPT_MULTIPART_REPLY, OFPMP_METER
328 1.999618504 172.31.23.72 -> 172.31.31.144 OpenFlow 82 Type: OFPT_MULTIPART_REPLY, OFPMP_GROUP
329 1.999642332 172.31.23.72 -> 172.31.31.144 OpenFlow 98 Type: OFPT_MULTIPART_REPLY, OFPMP_METER
330 1.999790351 172.31.31.144 -> 172.31.23.72 TCP 66 6633 → 33668 [ACK] Seq=65 Ack=509 Win=853 Len=0 TSval=1297386 TSecr=26136487
331 1.999796237 172.31.31.144 -> 172.31.23.72 TCP 66 6633 → 33668 [ACK] Seq=65 Ack=541 Win=853 Len=0 TSval=1297386 TSecr=26136487
332 1.999830792 172.31.31.144 -> 172.31.23.72 TCP 66 6633 → 33666 [ACK] Seq=65 Ack=17 Win=853 Len=0 TSval=1297386 TSecr=26136487
333 1.999850962 172.31.31.144 -> 172.31.23.72 TCP 66 6633 → 33666 [ACK] Seq=65 Ack=49 Win=853 Len=0 TSval=1297386 TSecr=26136487
334 2.099580326 172.31.31.144 -> 172.31.23.72 OpenFlow 90 Type: OFPT_MULTIPART_REQUEST, OFPMP_GROUP
335 2.099611830 172.31.31.144 -> 172.31.23.72 OpenFlow 106 Type: OFPT_MULTIPART_REQUEST, OFPMP_METER
336 2.099861871 172.31.23.72 -> 172.31.31.144 OpenFlow 82 Type: OFPT_MULTIPART_REPLY, OFPMP_GROUP
337 2.099915576 172.31.23.72 -> 172.31.31.144 OpenFlow 98 Type: OFPT_MULTIPART_REPLY, OFPMP_METER
338 2.100176328 172.31.31.144 -> 172.31.23.72 TCP 66 6633 → 33670 [ACK] Seq=1033 Ack=295 Win=853 Len=0 TSval=1297411 TSecr=26136512
339 2.299840213 172.31.31.144 -> 172.31.23.72 OpenFlow 90 Type: OFPT_MULTIPART_REQUEST, OFPMP_GROUP
340 2.299863053 172.31.31.144 -> 172.31.23.72 OpenFlow 90 Type: OFPT_MULTIPART_REQUEST, OFPMP_GROUP
341 2.299866542 172.31.31.144 -> 172.31.23.72 OpenFlow 106 Type: OFPT_MULTIPART_REQUEST, OFPMP_METER
342 2.299870433 172.31.31.144 -> 172.31.23.72 OpenFlow 90 Type: OFPT_MULTIPART_REQUEST, OFPMP_GROUP
343 2.299873184 172.31.31.144 -> 172.31.23.72 OpenFlow 106 Type: OFPT_MULTIPART_REQUEST, OFPMP_METER
344 2.299877089 172.31.31.144 -> 172.31.23.72 OpenFlow 106 Type: OFPT_MULTIPART_REQUEST, OFPMP_METER
345 2.300131147 172.31.23.72 -> 172.31.31.144 OpenFlow 82 Type: OFPT_MULTIPART_REPLY, OFPMP_GROUP
346 2.300162407 172.31.23.72 -> 172.31.31.144 OpenFlow 82 Type: OFPT_MULTIPART_REPLY, OFPMP_GROUP
347 2.300180981 172.31.23.72 -> 172.31.31.144 OpenFlow 82 Type: OFPT_MULTIPART_REPLY, OFPMP_GROUP
348 2.300186759 172.31.23.72 -> 172.31.31.144 OpenFlow 98 Type: OFPT_MULTIPART_REPLY, OFPMP_METER
349 2.300233724 172.31.23.72 -> 172.31.31.144 OpenFlow 98 Type: OFPT_MULTIPART_REPLY, OFPMP_METER
350 2.300238376 172.31.23.72 -> 172.31.31.144 OpenFlow 98 Type: OFPT_MULTIPART_REPLY, OFPMP_METER
351 2.300389936 172.31.31.144 -> 172.31.23.72 TCP 66 6633 → 33676 [ACK] Seq=791 Ack=509 Win=853 Len=0 TSval=1297461 TSecr=26136562
352 2.300451771 172.31.31.144 -> 172.31.23.72 TCP 66 6633 → 33676 [ACK] Seq=791 Ack=541 Win=853 Len=0 TSval=1297461 TSecr=26136562
353 2.300494957 172.31.31.144 -> 172.31.23.72 TCP 66 6633 → 33674 [ACK] Seq=1033 Ack=787 Win=853 Len=0 TSval=1297461 TSecr=26136562
354 2.300519371 172.31.31.144 -> 172.31.23.72 TCP 66 6633 → 33672 [ACK] Seq=1033 Ack=787 Win=853 Len=0 TSval=1297461 TSecr=26136562
355 2.677921879 172.31.31.144 -> 172.31.23.72 OpenFlow 82 Type: OFPT_MULTIPART_REQUEST, OFPMP_TABLE
356 2.677965340 172.31.31.144 -> 172.31.23.72 OpenFlow 146 Type: OFPT_MULTIPART_REQUEST, OFPMP_PORT_STATS
357 2.678416000 172.31.23.72 -> 172.31.31.144 OpenFlow 6178 Type: OFPT_MULTIPART_REPLY, OFPMP_TABLE
358 2.678511956 172.31.23.72 -> 172.31.31.144 OpenFlow 2010 Type: OFPT_MULTIPART_REPLY, OFPMP_FLOW
359 2.678607494 172.31.23.72 -> 172.31.31.144 OpenFlow 530 Type: OFPT_MULTIPART_REPLY, OFPMP_PORT_STATS
360 2.678798118 172.31.31.144 -> 172.31.23.72 TCP 66 6633 → 33630 [ACK] Seq=887 Ack=8351 Win=853 Len=0 TSval=1297556 TSecr=26136656
361 2.718683588 172.31.31.144 -> 172.31.23.72 TCP 66 6633 → 33630 [ACK] Seq=887 Ack=8815 Win=853 Len=0 TSval=1297566 TSecr=26136656
