  1 0.000000000 137.158.125.247 -> 172.31.24.227 TCP 54 63468 → 22 [ACK] Seq=1 Ack=1 Win=32464 Len=0
  2 0.087860415 137.158.125.247 -> 172.31.24.227 TCP 54 63468 → 22 [ACK] Seq=1 Ack=97 Win=32416 Len=0
  3 0.437699319 172.31.24.227 -> 137.158.125.247 SSH 98 Server: Encrypted packet (len=44)
  4 0.647853254 137.158.125.247 -> 172.31.24.227 TCP 54 63468 → 22 [ACK] Seq=1 Ack=141 Win=32394 Len=0
  5 0.806549061 172.31.31.144 -> 172.31.24.227 TCP 187 6633 → 53158 [PSH, ACK] Seq=1 Ack=1 Win=853 Len=121 TSval=1827617 TSecr=388720073
  6 0.806588964 172.31.31.144 -> 172.31.24.227 TCP 187 6633 → 53158 [PSH, ACK] Seq=122 Ack=1 Win=853 Len=121 TSval=1827617 TSecr=388720073
  7 0.806594665 172.31.31.144 -> 172.31.24.227 TCP 187 6633 → 53158 [PSH, ACK] Seq=243 Ack=1 Win=853 Len=121 TSval=1827617 TSecr=388720073
  8 0.806598020 172.31.31.144 -> 172.31.24.227 TCP 187 6633 → 53158 [PSH, ACK] Seq=364 Ack=1 Win=853 Len=121 TSval=1827617 TSecr=388720073
  9 0.806623291 172.31.31.144 -> 172.31.24.227 TCP 187 6633 → 53158 [PSH, ACK] Seq=485 Ack=1 Win=853 Len=121 TSval=1827617 TSecr=388720073
 10 0.806628060 172.31.31.144 -> 172.31.24.227 TCP 187 6633 → 53158 [PSH, ACK] Seq=606 Ack=1 Win=853 Len=121 TSval=1827617 TSecr=388720073
 11 0.806683235 172.31.31.144 -> 172.31.24.227 TCP 187 6633 → 53158 [PSH, ACK] Seq=727 Ack=1 Win=853 Len=121 TSval=1827617 TSecr=388720073
 12 0.806736035 172.31.31.144 -> 172.31.24.227 TCP 187 6633 → 53158 [PSH, ACK] Seq=848 Ack=1 Win=853 Len=121 TSval=1827617 TSecr=388720073
 13 0.806833955 172.31.31.144 -> 172.31.24.227 TCP 187 6633 → 53156 [PSH, ACK] Seq=1 Ack=1 Win=853 Len=121 TSval=1827617 TSecr=388720073
 14 0.806841324 172.31.31.144 -> 172.31.24.227 TCP 187 6633 → 53156 [PSH, ACK] Seq=122 Ack=1 Win=853 Len=121 TSval=1827617 TSecr=388720073
 15 0.806903698 172.31.31.144 -> 172.31.24.227 TCP 187 6633 → 53156 [PSH, ACK] Seq=243 Ack=1 Win=853 Len=121 TSval=1827617 TSecr=388720073
 16 0.807055982 172.31.31.144 -> 172.31.24.227 TCP 187 6633 → 53156 [PSH, ACK] Seq=364 Ack=1 Win=853 Len=121 TSval=1827617 TSecr=388720073
 17 0.807062346 172.31.31.144 -> 172.31.24.227 TCP 187 6633 → 53156 [PSH, ACK] Seq=485 Ack=1 Win=853 Len=121 TSval=1827617 TSecr=388720073
 18 0.807080621 172.31.31.144 -> 172.31.24.227 TCP 187 6633 → 53156 [PSH, ACK] Seq=606 Ack=1 Win=853 Len=121 TSval=1827617 TSecr=388720073
 19 0.807120348 172.31.31.144 -> 172.31.24.227 TCP 187 6633 → 53156 [PSH, ACK] Seq=727 Ack=1 Win=853 Len=121 TSval=1827617 TSecr=388720073
 20 0.807184257 172.31.31.144 -> 172.31.24.227 TCP 187 6633 → 53156 [PSH, ACK] Seq=848 Ack=1 Win=853 Len=121 TSval=1827617 TSecr=388720073
 21 0.807258200 172.31.31.144 -> 172.31.24.227 TCP 187 6633 → 53154 [PSH, ACK] Seq=1 Ack=1 Win=853 Len=121 TSval=1827617 TSecr=388720073
 22 0.807291925 172.31.31.144 -> 172.31.24.227 TCP 187 6633 → 53154 [PSH, ACK] Seq=122 Ack=1 Win=853 Len=121 TSval=1827617 TSecr=388720073
 23 0.807347819 172.31.31.144 -> 172.31.24.227 TCP 187 6633 → 53154 [PSH, ACK] Seq=243 Ack=1 Win=853 Len=121 TSval=1827617 TSecr=388720073
 24 0.807399674 172.31.31.144 -> 172.31.24.227 TCP 187 6633 → 53154 [PSH, ACK] Seq=364 Ack=1 Win=853 Len=121 TSval=1827617 TSecr=388720073
 25 0.807519093 172.31.31.144 -> 172.31.24.227 TCP 187 6633 → 53154 [PSH, ACK] Seq=485 Ack=1 Win=853 Len=121 TSval=1827617 TSecr=388720073
 26 0.807531583 172.31.31.144 -> 172.31.24.227 TCP 187 6633 → 53154 [PSH, ACK] Seq=606 Ack=1 Win=853 Len=121 TSval=1827617 TSecr=388720073
 27 0.807604620 172.31.31.144 -> 172.31.24.227 TCP 187 6633 → 53152 [PSH, ACK] Seq=1 Ack=1 Win=853 Len=121 TSval=1827617 TSecr=388720073
 28 0.807612777 172.31.31.144 -> 172.31.24.227 TCP 187 6633 → 53152 [PSH, ACK] Seq=122 Ack=1 Win=853 Len=121 TSval=1827617 TSecr=388720073
 29 0.807677904 172.31.31.144 -> 172.31.24.227 TCP 187 6633 → 53152 [PSH, ACK] Seq=243 Ack=1 Win=853 Len=121 TSval=1827617 TSecr=388720073
 30 0.807705726 172.31.24.227 -> 172.31.31.144 TCP 66 53156 → 6633 [ACK] Seq=1 Ack=969 Win=213 Len=0 TSval=388720473 TSecr=1827617
 31 0.807723846 172.31.31.144 -> 172.31.24.227 TCP 187 6633 → 53152 [PSH, ACK] Seq=364 Ack=1 Win=853 Len=121 TSval=1827617 TSecr=388720073
 32 0.807781638 172.31.31.144 -> 172.31.24.227 TCP 187 6633 → 53152 [PSH, ACK] Seq=485 Ack=1 Win=853 Len=121 TSval=1827617 TSecr=388720073
 33 0.807837681 172.31.31.144 -> 172.31.24.227 TCP 187 6633 → 53152 [PSH, ACK] Seq=606 Ack=1 Win=853 Len=121 TSval=1827617 TSecr=388720073
 34 0.807892432 172.31.31.144 -> 172.31.24.227 TCP 187 6633 → 53152 [PSH, ACK] Seq=727 Ack=1 Win=853 Len=121 TSval=1827617 TSecr=388720073
 35 0.807926913 172.31.31.144 -> 172.31.24.227 TCP 187 6633 → 53152 [PSH, ACK] Seq=848 Ack=1 Win=853 Len=121 TSval=1827617 TSecr=388720073
 36 0.807994397 172.31.31.144 -> 172.31.24.227 TCP 187 6633 → 53170 [PSH, ACK] Seq=1 Ack=1 Win=853 Len=121 TSval=1827617 TSecr=388720073
 37 0.808036966 172.31.31.144 -> 172.31.24.227 TCP 187 6633 → 53170 [PSH, ACK] Seq=122 Ack=1 Win=853 Len=121 TSval=1827617 TSecr=388720073
 38 0.808161667 172.31.31.144 -> 172.31.24.227 TCP 187 6633 → 53170 [PSH, ACK] Seq=243 Ack=1 Win=853 Len=121 TSval=1827617 TSecr=388720073
 39 0.808167778 172.31.31.144 -> 172.31.24.227 TCP 187 6633 → 53170 [PSH, ACK] Seq=364 Ack=1 Win=853 Len=121 TSval=1827617 TSecr=388720073
 40 0.808193706 172.31.24.227 -> 172.31.31.144 TCP 66 53158 → 6633 [ACK] Seq=1 Ack=969 Win=213 Len=0 TSval=388720473 TSecr=1827617
 41 0.808292975 172.31.24.227 -> 172.31.31.144 OpenFlow 189 Type: OFPT_PACKET_IN
 42 0.808327078 172.31.31.144 -> 172.31.24.227 TCP 187 6633 → 53170 [PSH, ACK] Seq=485 Ack=1 Win=853 Len=121 TSval=1827617 TSecr=388720073
 43 0.808332547 172.31.31.144 -> 172.31.24.227 TCP 187 6633 → 53170 [PSH, ACK] Seq=606 Ack=1 Win=853 Len=121 TSval=1827617 TSecr=388720073
 44 0.808340563 172.31.24.227 -> 172.31.31.144 OpenFlow 189 Type: OFPT_PACKET_IN
 45 0.808364099 172.31.24.227 -> 172.31.31.144 OpenFlow 189 Type: OFPT_PACKET_IN
 46 0.808383390 172.31.24.227 -> 172.31.31.144 OpenFlow 189 Type: OFPT_PACKET_IN
 47 0.808566454 172.31.24.227 -> 172.31.31.144 OpenFlow 189 Type: OFPT_PACKET_IN
 48 0.808571227 172.31.24.227 -> 172.31.31.144 OpenFlow 189 Type: OFPT_PACKET_IN
 49 0.808573851 172.31.24.227 -> 172.31.31.144 OpenFlow 189 Type: OFPT_PACKET_IN
 50 0.808610852 172.31.24.227 -> 172.31.31.144 TCP 66 53170 → 6633 [ACK] Seq=1 Ack=727 Win=213 Len=0 TSval=388720473 TSecr=1827617
 51 0.808656153 172.31.31.144 -> 172.31.24.227 TCP 187 6633 → 53190 [PSH, ACK] Seq=1 Ack=1 Win=853 Len=121 TSval=1827617 TSecr=388720073
 52 0.808664321 172.31.31.144 -> 172.31.24.227 TCP 187 6633 → 53190 [PSH, ACK] Seq=122 Ack=1 Win=853 Len=121 TSval=1827617 TSecr=388720073
 53 0.808667273 172.31.31.144 -> 172.31.24.227 TCP 187 6633 → 53190 [PSH, ACK] Seq=243 Ack=1 Win=853 Len=121 TSval=1827617 TSecr=388720073
 54 0.808669812 172.31.31.144 -> 172.31.24.227 TCP 187 6633 → 53190 [PSH, ACK] Seq=364 Ack=1 Win=853 Len=121 TSval=1827617 TSecr=388720073
 55 0.808672228 172.31.31.144 -> 172.31.24.227 TCP 187 6633 → 53190 [PSH, ACK] Seq=485 Ack=1 Win=853 Len=121 TSval=1827617 TSecr=388720073
 56 0.808674429 172.31.31.144 -> 172.31.24.227 TCP 187 6633 → 53190 [PSH, ACK] Seq=606 Ack=1 Win=853 Len=121 TSval=1827617 TSecr=388720073
 57 0.808676466 172.31.31.144 -> 172.31.24.227 TCP 187 6633 → 53190 [PSH, ACK] Seq=727 Ack=1 Win=853 Len=121 TSval=1827617 TSecr=388720073
 58 0.808714024 172.31.24.227 -> 172.31.31.144 OpenFlow 189 Type: OFPT_PACKET_IN
 59 0.808737616 172.31.24.227 -> 172.31.31.144 OpenFlow 189 Type: OFPT_PACKET_IN
 60 0.808759162 172.31.24.227 -> 172.31.31.144 OpenFlow 189 Type: OFPT_PACKET_IN
 61 0.808879253 172.31.24.227 -> 172.31.31.144 OpenFlow 189 Type: OFPT_PACKET_IN
 62 0.808945712 172.31.31.144 -> 172.31.24.227 TCP 66 6633 → 53168 [ACK] Seq=1 Ack=124 Win=853 Len=0 TSval=1827617 TSecr=388720473
 63 0.808955568 172.31.31.144 -> 172.31.24.227 TCP 187 6633 → 53190 [PSH, ACK] Seq=848 Ack=1 Win=853 Len=121 TSval=1827617 TSecr=388720073
 64 0.808962172 172.31.24.227 -> 172.31.31.144 OpenFlow 189 Type: OFPT_PACKET_IN
 65 0.809010986 172.31.31.144 -> 172.31.24.227 TCP 66 6633 → 53168 [ACK] Seq=1 Ack=247 Win=853 Len=0 TSval=1827617 TSecr=388720473
 66 0.809210478 172.31.24.227 -> 172.31.31.144 TCP 66 53190 → 6633 [ACK] Seq=1 Ack=969 Win=213 Len=0 TSval=388720473 TSecr=1827617
 67 0.809311759 172.31.24.227 -> 172.31.31.144 OpenFlow 189 Type: OFPT_PACKET_IN
 68 0.809346866 172.31.24.227 -> 172.31.31.144 OpenFlow 189 Type: OFPT_PACKET_IN
 69 0.809459358 172.31.24.227 -> 172.31.31.144 OpenFlow 189 Type: OFPT_PACKET_IN
 70 0.809480341 172.31.24.227 -> 172.31.31.144 OpenFlow 312 Type: OFPT_PACKET_IN
 71 0.809534339 172.31.31.144 -> 172.31.24.227 TCP 66 6633 → 53198 [ACK] Seq=1 Ack=124 Win=853 Len=0 TSval=1827617 TSecr=388720473
 72 0.809548757 172.31.24.227 -> 172.31.31.144 OpenFlow 189 Type: OFPT_PACKET_IN
 73 0.809589245 172.31.31.144 -> 172.31.24.227 TCP 66 6633 → 53198 [ACK] Seq=1 Ack=247 Win=853 Len=0 TSval=1827618 TSecr=388720473
 74 0.809753329 172.31.31.144 -> 172.31.24.227 TCP 66 6633 → 53152 [ACK] Seq=969 Ack=124 Win=853 Len=0 TSval=1827618 TSecr=388720473
 75 0.809760449 172.31.31.144 -> 172.31.24.227 TCP 66 6633 → 53152 [ACK] Seq=969 Ack=370 Win=853 Len=0 TSval=1827618 TSecr=388720473
 76 0.809777638 172.31.31.144 -> 172.31.24.227 TCP 66 6633 → 53152 [ACK] Seq=969 Ack=493 Win=853 Len=0 TSval=1827618 TSecr=388720473
 77 0.809781609 172.31.31.144 -> 172.31.24.227 TCP 66 6633 → 53164 [ACK] Seq=1 Ack=247 Win=853 Len=0 TSval=1827618 TSecr=388720473
 78 0.809869923 172.31.31.144 -> 172.31.24.227 TCP 187 6633 → 53162 [PSH, ACK] Seq=1 Ack=1 Win=853 Len=121 TSval=1827618 TSecr=388720073
 79 0.809984689 172.31.31.144 -> 172.31.24.227 TCP 187 6633 → 53162 [PSH, ACK] Seq=122 Ack=1 Win=853 Len=121 TSval=1827618 TSecr=388720073
 80 0.810075135 172.31.31.144 -> 172.31.24.227 TCP 187 6633 → 53162 [PSH, ACK] Seq=243 Ack=1 Win=853 Len=121 TSval=1827618 TSecr=388720073
 81 0.810143505 172.31.31.144 -> 172.31.24.227 TCP 187 6633 → 53162 [PSH, ACK] Seq=364 Ack=1 Win=853 Len=121 TSval=1827618 TSecr=388720073
 82 0.810233270 172.31.31.144 -> 172.31.24.227 TCP 187 6633 → 53162 [PSH, ACK] Seq=485 Ack=1 Win=853 Len=121 TSval=1827618 TSecr=388720073
 83 0.810267287 172.31.24.227 -> 172.31.31.144 TCP 66 53154 → 6633 [ACK] Seq=1 Ack=727 Win=213 Len=0 TSval=388720473 TSecr=1827617
 84 0.810338142 172.31.31.144 -> 172.31.24.227 TCP 187 6633 → 53162 [PSH, ACK] Seq=606 Ack=1 Win=853 Len=121 TSval=1827618 TSecr=388720073
 85 0.810373176 172.31.24.227 -> 172.31.31.144 OpenFlow 189 Type: OFPT_PACKET_IN
 86 0.810392993 172.31.24.227 -> 172.31.31.144 OpenFlow 189 Type: OFPT_PACKET_IN
 87 0.810444382 172.31.31.144 -> 172.31.24.227 TCP 187 6633 → 53162 [PSH, ACK] Seq=727 Ack=1 Win=853 Len=121 TSval=1827618 TSecr=388720073
 88 0.810513631 172.31.31.144 -> 172.31.24.227 TCP 187 6633 → 53162 [PSH, ACK] Seq=848 Ack=1 Win=853 Len=121 TSval=1827618 TSecr=388720073
 89 0.810606165 172.31.31.144 -> 172.31.24.227 TCP 187 6633 → 53162 [PSH, ACK] Seq=969 Ack=1 Win=853 Len=121 TSval=1827618 TSecr=388720073
 90 0.810698461 172.31.31.144 -> 172.31.24.227 TCP 187 6633 → 53162 [PSH, ACK] Seq=1090 Ack=1 Win=853 Len=121 TSval=1827618 TSecr=388720073
 91 0.810920408 172.31.31.144 -> 172.31.24.227 TCP 66 6633 → 53160 [ACK] Seq=1 Ack=493 Win=853 Len=0 TSval=1827618 TSecr=388720473
 92 0.810943024 172.31.24.227 -> 172.31.31.144 TCP 66 53162 → 6633 [ACK] Seq=1 Ack=1211 Win=213 Len=0 TSval=388720473 TSecr=1827618
 93 0.811028516 172.31.24.227 -> 172.31.31.144 OpenFlow 189 Type: OFPT_PACKET_IN
 94 0.811064900 172.31.24.227 -> 172.31.31.144 OpenFlow 189 Type: OFPT_PACKET_IN
 95 0.811091406 172.31.24.227 -> 172.31.31.144 OpenFlow 189 Type: OFPT_PACKET_IN
 96 0.811112122 172.31.24.227 -> 172.31.31.144 OpenFlow 189 Type: OFPT_PACKET_IN
 97 0.811124509 172.31.24.227 -> 172.31.31.144 OpenFlow 189 Type: OFPT_PACKET_IN
 98 0.811141039 172.31.24.227 -> 172.31.31.144 OpenFlow 189 Type: OFPT_PACKET_IN
 99 0.811159599 172.31.31.144 -> 172.31.24.227 TCP 66 6633 → 53166 [ACK] Seq=1 Ack=247 Win=853 Len=0 TSval=1827618 TSecr=388720473
100 0.811179777 172.31.24.227 -> 172.31.31.144 OpenFlow 189 Type: OFPT_PACKET_IN
101 0.811209387 172.31.24.227 -> 172.31.31.144 OpenFlow 189 Type: OFPT_PACKET_IN
102 0.811212728 172.31.24.227 -> 172.31.31.144 OpenFlow 189 Type: OFPT_PACKET_IN
103 0.811215599 172.31.24.227 -> 172.31.31.144 OpenFlow 189 Type: OFPT_PACKET_IN
104 0.811244642 172.31.24.227 -> 172.31.31.144 OpenFlow 189 Type: OFPT_PACKET_IN
105 0.811263247 172.31.24.227 -> 172.31.31.144 OpenFlow 189 Type: OFPT_PACKET_IN
106 0.811280321 172.31.24.227 -> 172.31.31.144 OpenFlow 189 Type: OFPT_PACKET_IN
107 0.811298356 172.31.24.227 -> 172.31.31.144 OpenFlow 189 Type: OFPT_PACKET_IN
108 0.811315522 172.31.24.227 -> 172.31.31.144 OpenFlow 189 Type: OFPT_PACKET_IN
109 0.811333438 172.31.24.227 -> 172.31.31.144 OpenFlow 189 Type: OFPT_PACKET_IN
110 0.811451562 172.31.24.227 -> 172.31.31.144 OpenFlow 189 Type: OFPT_PACKET_IN
111 0.811459907 172.31.24.227 -> 172.31.31.144 OpenFlow 189 Type: OFPT_PACKET_IN
112 0.811462652 172.31.24.227 -> 172.31.31.144 OpenFlow 189 Type: OFPT_PACKET_IN
113 0.811689885 172.31.24.227 -> 172.31.31.144 OpenFlow 189 Type: OFPT_PACKET_IN
114 0.811693910 172.31.24.227 -> 172.31.31.144 OpenFlow 189 Type: OFPT_PACKET_IN
115 0.811696270 172.31.24.227 -> 172.31.31.144 OpenFlow 189 Type: OFPT_PACKET_IN
116 0.811698283 172.31.24.227 -> 172.31.31.144 OpenFlow 189 Type: OFPT_PACKET_IN
117 0.811796563 172.31.31.144 -> 172.31.24.227 TCP 66 6633 → 53174 [ACK] Seq=1 Ack=247 Win=853 Len=0 TSval=1827618 TSecr=388720473
118 0.811804242 172.31.31.144 -> 172.31.24.227 TCP 66 6633 → 53168 [ACK] Seq=1 Ack=370 Win=853 Len=0 TSval=1827618 TSecr=388720474
119 0.811807151 172.31.31.144 -> 172.31.24.227 TCP 66 6633 → 53168 [ACK] Seq=1 Ack=493 Win=853 Len=0 TSval=1827618 TSecr=388720474
120 0.811809723 172.31.31.144 -> 172.31.24.227 OpenFlow 187 Type: OFPT_PACKET_OUT
121 0.811814486 172.31.31.144 -> 172.31.24.227 OpenFlow 187 Type: OFPT_PACKET_OUT
122 0.811819246 172.31.24.227 -> 172.31.31.144 OpenFlow 189 Type: OFPT_PACKET_IN
123 0.811825189 172.31.31.144 -> 172.31.24.227 OpenFlow 187 Type: OFPT_PACKET_OUT
124 0.811828376 172.31.31.144 -> 172.31.24.227 OpenFlow 187 Type: OFPT_PACKET_OUT
125 0.811831278 172.31.31.144 -> 172.31.24.227 TCP 66 6633 → 53166 [ACK] Seq=1 Ack=493 Win=853 Len=0 TSval=1827618 TSecr=388720473
126 0.811834006 172.31.31.144 -> 172.31.24.227 TCP 66 6633 → 53176 [ACK] Seq=1 Ack=124 Win=853 Len=0 TSval=1827618 TSecr=388720474
127 0.811837102 172.31.31.144 -> 172.31.24.227 TCP 66 6633 → 53180 [ACK] Seq=1 Ack=124 Win=853 Len=0 TSval=1827618 TSecr=388720474
128 0.811839737 172.31.31.144 -> 172.31.24.227 TCP 66 6633 → 53172 [ACK] Seq=1 Ack=370 Win=853 Len=0 TSval=1827618 TSecr=388720473
129 0.811842585 172.31.31.144 -> 172.31.24.227 TCP 66 6633 → 53186 [ACK] Seq=1 Ack=124 Win=853 Len=0 TSval=1827618 TSecr=388720474
130 0.811855453 172.31.24.227 -> 172.31.31.144 OpenFlow 189 Type: OFPT_PACKET_IN
131 0.811858293 172.31.24.227 -> 172.31.31.144 OpenFlow 189 Type: OFPT_PACKET_IN
132 0.812099353 172.31.24.227 -> 172.31.31.144 TCP 66 53160 → 6633 [ACK] Seq=739 Ack=485 Win=213 Len=0 TSval=388720474 TSecr=1827618
133 0.812114919 172.31.31.144 -> 172.31.24.227 TCP 66 6633 → 53192 [ACK] Seq=1 Ack=124 Win=853 Len=0 TSval=1827618 TSecr=388720474
134 0.812121456 172.31.31.144 -> 172.31.24.227 TCP 66 6633 → 53194 [ACK] Seq=1 Ack=124 Win=853 Len=0 TSval=1827618 TSecr=388720474
135 0.812124487 172.31.31.144 -> 172.31.24.227 TCP 66 6633 → 53170 [ACK] Seq=727 Ack=247 Win=853 Len=0 TSval=1827618 TSecr=388720474
136 0.812127317 172.31.31.144 -> 172.31.24.227 TCP 66 6633 → 53176 [ACK] Seq=1 Ack=247 Win=853 Len=0 TSval=1827618 TSecr=388720474
137 0.812129729 172.31.31.144 -> 172.31.24.227 TCP 66 6633 → 53180 [ACK] Seq=1 Ack=247 Win=853 Len=0 TSval=1827618 TSecr=388720474
138 0.812131853 172.31.31.144 -> 172.31.24.227 TCP 66 6633 → 53186 [ACK] Seq=1 Ack=247 Win=853 Len=0 TSval=1827618 TSecr=388720474
139 0.812200561 172.31.24.227 -> 172.31.31.144 OpenFlow 189 Type: OFPT_PACKET_IN
140 0.812326260 172.31.31.144 -> 172.31.24.227 TCP 66 6633 → 53190 [ACK] Seq=969 Ack=247 Win=853 Len=0 TSval=1827618 TSecr=388720474
141 0.812333228 172.31.31.144 -> 172.31.24.227 TCP 66 6633 → 53192 [ACK] Seq=1 Ack=247 Win=853 Len=0 TSval=1827618 TSecr=388720474
142 0.812336118 172.31.31.144 -> 172.31.24.227 TCP 66 6633 → 53194 [ACK] Seq=1 Ack=247 Win=853 Len=0 TSval=1827618 TSecr=388720474
143 0.812342899 172.31.24.227 -> 172.31.31.144 OpenFlow 189 Type: OFPT_PACKET_IN
144 0.812439237 172.31.24.227 -> 172.31.31.144 OpenFlow 189 Type: OFPT_PACKET_IN
145 0.812459590 172.31.31.144 -> 172.31.24.227 TCP 66 6633 → 53188 [ACK] Seq=1 Ack=247 Win=853 Len=0 TSval=1827618 TSecr=388720474
146 0.812468588 172.31.24.227 -> 172.31.31.144 OpenFlow 189 Type: OFPT_PACKET_IN
147 0.812563318 172.31.31.144 -> 172.31.24.227 TCP 66 6633 → 53162 [ACK] Seq=1211 Ack=124 Win=853 Len=0 TSval=1827618 TSecr=388720474
148 0.812568473 172.31.31.144 -> 172.31.24.227 TCP 66 6633 → 53162 [ACK] Seq=1211 Ack=247 Win=853 Len=0 TSval=1827618 TSecr=388720474
149 0.812628248 172.31.31.144 -> 172.31.24.227 TCP 66 6633 → 53156 [ACK] Seq=969 Ack=124 Win=853 Len=0 TSval=1827618 TSecr=388720474
150 0.812755055 172.31.31.144 -> 172.31.24.227 TCP 66 6633 → 53156 [ACK] Seq=969 Ack=247 Win=853 Len=0 TSval=1827618 TSecr=388720474
151 0.813110539 172.31.31.144 -> 172.31.24.227 TCP 66 6633 → 53196 [ACK] Seq=1 Ack=247 Win=853 Len=0 TSval=1827618 TSecr=388720474
152 0.813214716 172.31.31.144 -> 172.31.24.227 OpenFlow 187 Type: OFPT_PACKET_OUT
153 0.813220905 172.31.31.144 -> 172.31.24.227 OpenFlow 308 Type: OFPT_PACKET_OUT
154 0.813398143 172.31.24.227 -> 172.31.31.144 TCP 66 53160 → 6633 [ACK] Seq=739 Ack=848 Win=213 Len=0 TSval=388720474 TSecr=1827618
155 0.813516433 172.31.24.227 -> 172.31.31.144 OpenFlow 189 Type: OFPT_PACKET_IN
156 0.813537766 172.31.24.227 -> 172.31.31.144 OpenFlow 189 Type: OFPT_PACKET_IN
157 0.813616902 172.31.24.227 -> 172.31.31.144 OpenFlow 189 Type: OFPT_PACKET_IN
158 0.813815271 172.31.31.144 -> 172.31.24.227 TCP 66 6633 → 53194 [ACK] Seq=1 Ack=370 Win=853 Len=0 TSval=1827619 TSecr=388720474
159 0.814393370 172.31.31.144 -> 172.31.24.227 OpenFlow 187 Type: OFPT_PACKET_OUT
160 0.814406313 172.31.31.144 -> 172.31.24.227 OpenFlow 308 Type: OFPT_PACKET_OUT
161 0.814410358 172.31.31.144 -> 172.31.24.227 OpenFlow 187 Type: OFPT_PACKET_OUT
162 0.814413431 172.31.31.144 -> 172.31.24.227 OpenFlow 550 Type: OFPT_PACKET_OUT
163 0.814416833 172.31.31.144 -> 172.31.24.227 OpenFlow 671 Type: OFPT_PACKET_OUT
164 0.814459194 172.31.31.144 -> 172.31.24.227 OpenFlow 187 Type: OFPT_PACKET_OUT
165 0.814463594 172.31.31.144 -> 172.31.24.227 TCP 66 6633 → 53172 [ACK] Seq=1 Ack=739 Win=853 Len=0 TSval=1827619 TSecr=388720474
166 0.814518030 172.31.31.144 -> 172.31.24.227 OpenFlow 187 Type: OFPT_PACKET_OUT
167 0.814611771 172.31.31.144 -> 172.31.24.227 OpenFlow 187 Type: OFPT_PACKET_OUT
168 0.814707046 172.31.31.144 -> 172.31.24.227 OpenFlow 187 Type: OFPT_PACKET_OUT
169 0.814725212 172.31.24.227 -> 172.31.31.144 TCP 66 53160 → 6633 [ACK] Seq=739 Ack=1211 Win=213 Len=0 TSval=388720474 TSecr=1827619
170 0.814797282 172.31.31.144 -> 172.31.24.227 OpenFlow 187 Type: OFPT_PACKET_OUT
171 0.814857041 172.31.31.144 -> 172.31.24.227 OpenFlow 187 Type: OFPT_PACKET_OUT
172 0.814952376 172.31.31.144 -> 172.31.24.227 OpenFlow 187 Type: OFPT_PACKET_OUT
173 0.814959121 172.31.31.144 -> 172.31.24.227 OpenFlow 187 Type: OFPT_PACKET_OUT
174 0.815063066 172.31.31.144 -> 172.31.24.227 OpenFlow 187 Type: OFPT_PACKET_OUT
175 0.815071133 172.31.31.144 -> 172.31.24.227 OpenFlow 187 Type: OFPT_PACKET_OUT
176 0.815121909 172.31.31.144 -> 172.31.24.227 OpenFlow 187 Type: OFPT_PACKET_OUT
177 0.815164694 172.31.31.144 -> 172.31.24.227 OpenFlow 187 Type: OFPT_PACKET_OUT
178 0.815218048 172.31.31.144 -> 172.31.24.227 OpenFlow 187 Type: OFPT_PACKET_OUT
179 0.815269307 172.31.31.144 -> 172.31.24.227 OpenFlow 187 Type: OFPT_PACKET_OUT
180 0.815321326 172.31.31.144 -> 172.31.24.227 OpenFlow 187 Type: OFPT_PACKET_OUT
181 0.815387801 172.31.31.144 -> 172.31.24.227 OpenFlow 187 Type: OFPT_PACKET_OUT
182 0.815411513 172.31.24.227 -> 172.31.31.144 TCP 66 53164 → 6633 [ACK] Seq=247 Ack=1211 Win=213 Len=0 TSval=388720475 TSecr=1827619
183 0.815445562 172.31.31.144 -> 172.31.24.227 TCP 187 6633 → 53178 [PSH, ACK] Seq=1 Ack=1 Win=853 Len=121 TSval=1827619 TSecr=388720193
184 0.815497832 172.31.31.144 -> 172.31.24.227 TCP 187 6633 → 53178 [PSH, ACK] Seq=122 Ack=1 Win=853 Len=121 TSval=1827619 TSecr=388720193
185 0.815555929 172.31.31.144 -> 172.31.24.227 TCP 187 6633 → 53178 [PSH, ACK] Seq=243 Ack=1 Win=853 Len=121 TSval=1827619 TSecr=388720193
186 0.815646982 172.31.31.144 -> 172.31.24.227 TCP 187 6633 → 53178 [PSH, ACK] Seq=364 Ack=1 Win=853 Len=121 TSval=1827619 TSecr=388720193
187 0.815653682 172.31.31.144 -> 172.31.24.227 TCP 187 6633 → 53178 [PSH, ACK] Seq=485 Ack=1 Win=853 Len=121 TSval=1827619 TSecr=388720193
188 0.815711589 172.31.31.144 -> 172.31.24.227 TCP 187 6633 → 53178 [PSH, ACK] Seq=606 Ack=1 Win=853 Len=121 TSval=1827619 TSecr=388720193
189 0.815767745 172.31.31.144 -> 172.31.24.227 TCP 187 6633 → 53178 [PSH, ACK] Seq=727 Ack=1 Win=853 Len=121 TSval=1827619 TSecr=388720193
190 0.815821140 172.31.31.144 -> 172.31.24.227 TCP 187 6633 → 53178 [PSH, ACK] Seq=848 Ack=1 Win=853 Len=121 TSval=1827619 TSecr=388720193
191 0.815874267 172.31.31.144 -> 172.31.24.227 TCP 187 6633 → 53178 [PSH, ACK] Seq=969 Ack=1 Win=853 Len=121 TSval=1827619 TSecr=388720193
192 0.815929214 172.31.31.144 -> 172.31.24.227 TCP 187 6633 → 53178 [PSH, ACK] Seq=1090 Ack=1 Win=853 Len=121 TSval=1827619 TSecr=388720193
193 0.816006534 172.31.31.144 -> 172.31.24.227 TCP 187 6633 → 53182 [PSH, ACK] Seq=1 Ack=1 Win=853 Len=121 TSval=1827619 TSecr=388720073
194 0.816055671 172.31.31.144 -> 172.31.24.227 TCP 187 6633 → 53182 [PSH, ACK] Seq=122 Ack=1 Win=853 Len=121 TSval=1827619 TSecr=388720073
195 0.816101227 172.31.31.144 -> 172.31.24.227 TCP 187 6633 → 53182 [PSH, ACK] Seq=243 Ack=1 Win=853 Len=121 TSval=1827619 TSecr=388720073
196 0.816147722 172.31.24.227 -> 172.31.31.144 TCP 66 53166 → 6633 [ACK] Seq=493 Ack=1211 Win=213 Len=0 TSval=388720475 TSecr=1827619
197 0.816187441 172.31.31.144 -> 172.31.24.227 TCP 187 6633 → 53182 [PSH, ACK] Seq=364 Ack=1 Win=853 Len=121 TSval=1827619 TSecr=388720073
198 0.816249718 172.31.24.227 -> 172.31.31.144 OpenFlow 189 Type: OFPT_PACKET_IN
199 0.816285044 172.31.24.227 -> 172.31.31.144 OpenFlow 189 Type: OFPT_PACKET_IN
200 0.816302354 172.31.24.227 -> 172.31.31.144 OpenFlow 189 Type: OFPT_PACKET_IN
201 0.816316233 172.31.31.144 -> 172.31.24.227 TCP 187 6633 → 53182 [PSH, ACK] Seq=485 Ack=1 Win=853 Len=121 TSval=1827619 TSecr=388720073
202 0.816321181 172.31.31.144 -> 172.31.24.227 TCP 187 6633 → 53182 [PSH, ACK] Seq=606 Ack=1 Win=853 Len=121 TSval=1827619 TSecr=388720073
203 0.816323913 172.31.31.144 -> 172.31.24.227 OpenFlow 187 Type: OFPT_PACKET_OUT
204 0.816417187 172.31.24.227 -> 172.31.31.144 OpenFlow 189 Type: OFPT_PACKET_IN
205 0.816425121 172.31.24.227 -> 172.31.31.144 OpenFlow 189 Type: OFPT_PACKET_IN
206 0.816519311 172.31.31.144 -> 172.31.24.227 OpenFlow 187 Type: OFPT_PACKET_OUT
207 0.816526037 172.31.31.144 -> 172.31.24.227 OpenFlow 187 Type: OFPT_PACKET_OUT
208 0.816528455 172.31.31.144 -> 172.31.24.227 OpenFlow 187 Type: OFPT_PACKET_OUT
209 0.816534618 172.31.24.227 -> 172.31.31.144 OpenFlow 189 Type: OFPT_PACKET_IN
210 0.816626488 172.31.31.144 -> 172.31.24.227 OpenFlow 187 Type: OFPT_PACKET_OUT
211 0.816632396 172.31.31.144 -> 172.31.24.227 OpenFlow 187 Type: OFPT_PACKET_OUT
212 0.816635137 172.31.31.144 -> 172.31.24.227 TCP 66 6633 → 53176 [ACK] Seq=1 Ack=370 Win=853 Len=0 TSval=1827619 TSecr=388720475
213 0.816770583 172.31.31.144 -> 172.31.24.227 TCP 66 6633 → 53170 [ACK] Seq=727 Ack=493 Win=853 Len=0 TSval=1827619 TSecr=388720475
214 0.816777990 172.31.31.144 -> 172.31.24.227 TCP 66 6633 → 53176 [ACK] Seq=1 Ack=493 Win=853 Len=0 TSval=1827619 TSecr=388720475
215 0.816893143 172.31.31.144 -> 172.31.24.227 TCP 66 6633 → 53178 [ACK] Seq=1211 Ack=247 Win=853 Len=0 TSval=1827619 TSecr=388720475
216 0.817145484 172.31.24.227 -> 172.31.31.144 TCP 66 53182 → 6633 [ACK] Seq=1 Ack=727 Win=213 Len=0 TSval=388720475 TSecr=1827619
217 0.817225358 172.31.24.227 -> 172.31.31.144 OpenFlow 189 Type: OFPT_PACKET_IN
218 0.817246585 172.31.24.227 -> 172.31.31.144 OpenFlow 312 Type: OFPT_PACKET_IN
219 0.817268757 172.31.24.227 -> 172.31.31.144 OpenFlow 189 Type: OFPT_PACKET_IN
220 0.817278521 172.31.24.227 -> 172.31.31.144 OpenFlow 189 Type: OFPT_PACKET_IN
221 0.817335595 172.31.24.227 -> 172.31.31.144 OpenFlow 435 Type: OFPT_PACKET_IN
222 0.817475231 172.31.31.144 -> 172.31.24.227 TCP 66 6633 → 53186 [ACK] Seq=1 Ack=370 Win=853 Len=0 TSval=1827619 TSecr=388720475
223 0.817522622 172.31.24.227 -> 172.31.31.144 TCP 66 53188 → 6633 [ACK] Seq=247 Ack=727 Win=213 Len=0 TSval=388720475 TSecr=1827619
224 0.817573510 172.31.31.144 -> 172.31.24.227 TCP 66 6633 → 53186 [ACK] Seq=1 Ack=739 Win=853 Len=0 TSval=1827619 TSecr=388720475
225 0.817579972 172.31.31.144 -> 172.31.24.227 TCP 66 6633 → 53184 [ACK] Seq=1 Ack=493 Win=853 Len=0 TSval=1827619 TSecr=388720475
226 0.817636185 172.31.24.227 -> 172.31.31.144 OpenFlow 189 Type: OFPT_PACKET_IN
227 0.817658540 172.31.24.227 -> 172.31.31.144 OpenFlow 189 Type: OFPT_PACKET_IN
228 0.817675231 172.31.24.227 -> 172.31.31.144 OpenFlow 189 Type: OFPT_PACKET_IN
229 0.817706420 172.31.24.227 -> 172.31.31.144 OpenFlow 189 Type: OFPT_PACKET_IN
230 0.817730183 172.31.24.227 -> 172.31.31.144 OpenFlow 189 Type: OFPT_PACKET_IN
231 0.817733193 172.31.24.227 -> 172.31.31.144 OpenFlow 435 Type: OFPT_PACKET_IN
232 0.817750628 172.31.24.227 -> 172.31.31.144 OpenFlow 189 Type: OFPT_PACKET_IN
233 0.817826983 172.31.24.227 -> 172.31.31.144 OpenFlow 312 Type: OFPT_PACKET_IN
234 0.817834398 172.31.24.227 -> 172.31.31.144 OpenFlow 189 Type: OFPT_PACKET_IN
235 0.817884940 172.31.24.227 -> 172.31.31.144 OpenFlow 189 Type: OFPT_PACKET_IN
236 0.817888648 172.31.24.227 -> 172.31.31.144 OpenFlow 189 Type: OFPT_PACKET_IN
237 0.817906734 172.31.24.227 -> 172.31.31.144 OpenFlow 189 Type: OFPT_PACKET_IN
238 0.817937067 172.31.24.227 -> 172.31.31.144 OpenFlow 189 Type: OFPT_PACKET_IN
239 0.817944696 172.31.31.144 -> 172.31.24.227 TCP 66 6633 → 53192 [ACK] Seq=1 Ack=370 Win=853 Len=0 TSval=1827620 TSecr=388720475
240 0.817949781 172.31.31.144 -> 172.31.24.227 TCP 66 6633 → 53190 [ACK] Seq=969 Ack=493 Win=853 Len=0 TSval=1827620 TSecr=388720475
241 0.817952698 172.31.31.144 -> 172.31.24.227 TCP 66 6633 → 53194 [ACK] Seq=1 Ack=493 Win=853 Len=0 TSval=1827620 TSecr=388720475
242 0.817989606 172.31.24.227 -> 172.31.31.144 OpenFlow 189 Type: OFPT_PACKET_IN
243 0.818006771 172.31.24.227 -> 172.31.31.144 OpenFlow 189 Type: OFPT_PACKET_IN
244 0.818155068 172.31.24.227 -> 172.31.31.144 OpenFlow 189 Type: OFPT_PACKET_IN
245 0.818162889 172.31.24.227 -> 172.31.31.144 OpenFlow 189 Type: OFPT_PACKET_IN
246 0.818289055 172.31.24.227 -> 172.31.31.144 OpenFlow 189 Type: OFPT_PACKET_IN
247 0.818292868 172.31.24.227 -> 172.31.31.144 OpenFlow 189 Type: OFPT_PACKET_IN
248 0.818295039 172.31.24.227 -> 172.31.31.144 OpenFlow 189 Type: OFPT_PACKET_IN
249 0.818342387 172.31.31.144 -> 172.31.24.227 TCP 66 6633 → 53192 [ACK] Seq=1 Ack=739 Win=853 Len=0 TSval=1827620 TSecr=388720475
250 0.818349105 172.31.31.144 -> 172.31.24.227 TCP 66 6633 → 53198 [ACK] Seq=1 Ack=370 Win=853 Len=0 TSval=1827620 TSecr=388720475
251 0.818352070 172.31.31.144 -> 172.31.24.227 TCP 66 6633 → 53194 [ACK] Seq=1 Ack=739 Win=853 Len=0 TSval=1827620 TSecr=388720475
252 0.818354359 172.31.31.144 -> 172.31.24.227 TCP 66 6633 → 53156 [ACK] Seq=969 Ack=370 Win=853 Len=0 TSval=1827620 TSecr=388720475
253 0.818366287 172.31.31.144 -> 172.31.24.227 TCP 66 6633 → 53198 [ACK] Seq=1 Ack=493 Win=853 Len=0 TSval=1827620 TSecr=388720475
254 0.818368587 172.31.31.144 -> 172.31.24.227 TCP 66 6633 → 53162 [ACK] Seq=1211 Ack=370 Win=853 Len=0 TSval=1827620 TSecr=388720475
255 0.818390006 172.31.24.227 -> 172.31.31.144 TCP 66 53174 → 6633 [ACK] Seq=247 Ack=727 Win=213 Len=0 TSval=388720475 TSecr=1827619
256 0.818471950 172.31.24.227 -> 172.31.31.144 OpenFlow 189 Type: OFPT_PACKET_IN
257 0.818497617 172.31.24.227 -> 172.31.31.144 OpenFlow 189 Type: OFPT_PACKET_IN
258 0.818557196 172.31.24.227 -> 172.31.31.144 OpenFlow 189 Type: OFPT_PACKET_IN
259 0.818568219 172.31.31.144 -> 172.31.24.227 TCP 66 6633 → 53196 [ACK] Seq=1 Ack=493 Win=853 Len=0 TSval=1827620 TSecr=388720475
260 0.818573330 172.31.31.144 -> 172.31.24.227 TCP 66 6633 → 53168 [ACK] Seq=1 Ack=616 Win=853 Len=0 TSval=1827620 TSecr=388720475
261 0.818576059 172.31.31.144 -> 172.31.24.227 TCP 66 6633 → 53156 [ACK] Seq=969 Ack=493 Win=853 Len=0 TSval=1827620 TSecr=388720475
262 0.818578594 172.31.31.144 -> 172.31.24.227 TCP 66 6633 → 53158 [ACK] Seq=969 Ack=124 Win=853 Len=0 TSval=1827620 TSecr=388720475
263 0.818646573 172.31.24.227 -> 172.31.31.144 OpenFlow 189 Type: OFPT_PACKET_IN
264 0.818654179 172.31.24.227 -> 172.31.31.144 OpenFlow 189 Type: OFPT_PACKET_IN
265 0.818714502 172.31.31.144 -> 172.31.24.227 TCP 66 6633 → 53162 [ACK] Seq=1211 Ack=493 Win=853 Len=0 TSval=1827620 TSecr=388720475
266 0.818721366 172.31.31.144 -> 172.31.24.227 TCP 66 6633 → 53168 [ACK] Seq=1 Ack=739 Win=853 Len=0 TSval=1827620 TSecr=388720475
267 0.818727741 172.31.24.227 -> 172.31.31.144 OpenFlow 189 Type: OFPT_PACKET_IN
268 0.818737064 172.31.24.227 -> 172.31.31.144 OpenFlow 189 Type: OFPT_PACKET_IN
269 0.818881107 172.31.31.144 -> 172.31.24.227 TCP 66 6633 → 53176 [ACK] Seq=1 Ack=616 Win=853 Len=0 TSval=1827620 TSecr=388720475
270 0.818887507 172.31.31.144 -> 172.31.24.227 TCP 66 6633 → 53158 [ACK] Seq=969 Ack=247 Win=853 Len=0 TSval=1827620 TSecr=388720475
271 0.818891968 172.31.24.227 -> 172.31.31.144 OpenFlow 189 Type: OFPT_PACKET_IN
272 0.818897838 172.31.31.144 -> 172.31.24.227 TCP 66 6633 → 53180 [ACK] Seq=1 Ack=370 Win=853 Len=0 TSval=1827620 TSecr=388720475
273 0.819000380 172.31.31.144 -> 172.31.24.227 TCP 66 6633 → 53176 [ACK] Seq=1 Ack=739 Win=853 Len=0 TSval=1827620 TSecr=388720475
274 0.819006506 172.31.31.144 -> 172.31.24.227 TCP 66 6633 → 53180 [ACK] Seq=1 Ack=493 Win=853 Len=0 TSval=1827620 TSecr=388720475
275 0.819097395 172.31.31.144 -> 172.31.24.227 TCP 66 6633 → 53196 [ACK] Seq=1 Ack=739 Win=853 Len=0 TSval=1827620 TSecr=388720475
276 0.819363600 172.31.31.144 -> 172.31.24.227 TCP 66 6633 → 53158 [ACK] Seq=969 Ack=370 Win=853 Len=0 TSval=1827620 TSecr=388720475
277 0.819429799 172.31.31.144 -> 172.31.24.227 TCP 66 6633 → 53158 [ACK] Seq=969 Ack=493 Win=853 Len=0 TSval=1827620 TSecr=388720475
278 0.819433563 172.31.31.144 -> 172.31.24.227 TCP 66 6633 → 53166 [ACK] Seq=1211 Ack=739 Win=853 Len=0 TSval=1827620 TSecr=388720475
279 0.907057417 172.31.31.144 -> 172.31.24.227 OpenFlow 187 Type: OFPT_PACKET_OUT
280 0.907078679 172.31.31.144 -> 172.31.24.227 OpenFlow 187 Type: OFPT_PACKET_OUT
281 0.907084202 172.31.31.144 -> 172.31.24.227 OpenFlow 187 Type: OFPT_PACKET_OUT
282 0.907094360 172.31.31.144 -> 172.31.24.227 OpenFlow 187 Type: OFPT_PACKET_OUT
283 0.907123799 172.31.31.144 -> 172.31.24.227 OpenFlow 187 Type: OFPT_PACKET_OUT
284 0.907179039 172.31.31.144 -> 172.31.24.227 OpenFlow 187 Type: OFPT_PACKET_OUT
285 0.907191333 172.31.24.227 -> 172.31.31.144 TCP 66 53198 → 6633 [ACK] Seq=493 Ack=727 Win=125 Len=0 TSval=388720498 TSecr=1827642
286 0.907310752 172.31.31.144 -> 172.31.24.227 OpenFlow 187 Type: OFPT_PACKET_OUT
287 0.907316359 172.31.31.144 -> 172.31.24.227 OpenFlow 187 Type: OFPT_PACKET_OUT
288 0.907356214 172.31.31.144 -> 172.31.24.227 OpenFlow 187 Type: OFPT_PACKET_OUT
289 0.907408628 172.31.31.144 -> 172.31.24.227 OpenFlow 187 Type: OFPT_PACKET_OUT
290 0.907456911 172.31.31.144 -> 172.31.24.227 OpenFlow 187 Type: OFPT_PACKET_OUT
291 0.907496933 172.31.31.144 -> 172.31.24.227 OpenFlow 187 Type: OFPT_PACKET_OUT
292 0.907553058 172.31.31.144 -> 172.31.24.227 OpenFlow 187 Type: OFPT_PACKET_OUT
293 0.907600540 172.31.31.144 -> 172.31.24.227 OpenFlow 187 Type: OFPT_PACKET_OUT
294 0.907671890 172.31.31.144 -> 172.31.24.227 OpenFlow 187 Type: OFPT_PACKET_OUT
295 0.907719917 172.31.31.144 -> 172.31.24.227 OpenFlow 187 Type: OFPT_PACKET_OUT
296 0.907774809 172.31.31.144 -> 172.31.24.227 OpenFlow 187 Type: OFPT_PACKET_OUT
297 0.907836352 172.31.31.144 -> 172.31.24.227 OpenFlow 187 Type: OFPT_PACKET_OUT
298 0.907879155 172.31.31.144 -> 172.31.24.227 OpenFlow 187 Type: OFPT_PACKET_OUT
299 0.907923104 172.31.24.227 -> 172.31.31.144 OpenFlow 189 Type: OFPT_PACKET_IN
300 0.907944788 172.31.31.144 -> 172.31.24.227 OpenFlow 187 Type: OFPT_PACKET_OUT
301 0.907959048 172.31.24.227 -> 172.31.31.144 OpenFlow 189 Type: OFPT_PACKET_IN
302 0.907989215 172.31.24.227 -> 172.31.31.144 OpenFlow 189 Type: OFPT_PACKET_IN
303 0.908035690 172.31.31.144 -> 172.31.24.227 OpenFlow 187 Type: OFPT_PACKET_OUT
304 0.908040467 172.31.31.144 -> 172.31.24.227 OpenFlow 187 Type: OFPT_PACKET_OUT
305 0.908106991 172.31.24.227 -> 172.31.31.144 OpenFlow 189 Type: OFPT_PACKET_IN
306 0.908172537 172.31.31.144 -> 172.31.24.227 OpenFlow 187 Type: OFPT_PACKET_OUT
307 0.908178850 172.31.31.144 -> 172.31.24.227 TCP 66 6633 → 53158 [ACK] Seq=969 Ack=616 Win=853 Len=0 TSval=1827642 TSecr=388720498
308 0.908183646 172.31.31.144 -> 172.31.24.227 OpenFlow 187 Type: OFPT_PACKET_OUT
309 0.908213285 172.31.31.144 -> 172.31.24.227 TCP 66 6633 → 53158 [ACK] Seq=969 Ack=739 Win=853 Len=0 TSval=1827642 TSecr=388720498
310 0.908490364 172.31.24.227 -> 172.31.31.144 TCP 66 53180 → 6633 [ACK] Seq=493 Ack=969 Win=213 Len=0 TSval=388720498 TSecr=1827642
311 0.908567957 172.31.31.144 -> 172.31.24.227 TCP 66 6633 → 53164 [ACK] Seq=1211 Ack=493 Win=853 Len=0 TSval=1827642 TSecr=388720498
312 0.908622241 172.31.24.227 -> 172.31.31.144 OpenFlow 189 Type: OFPT_PACKET_IN
313 0.908641902 172.31.24.227 -> 172.31.31.144 OpenFlow 189 Type: OFPT_PACKET_IN
314 0.908784557 172.31.31.144 -> 172.31.24.227 OpenFlow 187 Type: OFPT_PACKET_OUT
315 0.908898707 172.31.31.144 -> 172.31.24.227 OpenFlow 913 Type: OFPT_PACKET_OUT
316 0.908907348 172.31.24.227 -> 172.31.31.144 TCP 66 53168 → 6633 [ACK] Seq=739 Ack=969 Win=213 Len=0 TSval=388720498 TSecr=1827642
317 0.908913306 172.31.31.144 -> 172.31.24.227 TCP 66 6633 → 53196 [ACK] Seq=1211 Ack=985 Win=853 Len=0 TSval=1827642 TSecr=388720498
318 0.909195397 172.31.31.144 -> 172.31.24.227 OpenFlow 187 Type: OFPT_PACKET_OUT
319 0.909218401 172.31.24.227 -> 172.31.31.144 OpenFlow 189 Type: OFPT_PACKET_IN
320 0.909229386 172.31.31.144 -> 172.31.24.227 OpenFlow 187 Type: OFPT_PACKET_OUT
321 0.909253012 172.31.24.227 -> 172.31.31.144 OpenFlow 189 Type: OFPT_PACKET_IN
322 0.909339253 172.31.31.144 -> 172.31.24.227 OpenFlow 187 Type: OFPT_PACKET_OUT
323 0.909370149 172.31.24.227 -> 172.31.31.144 OpenFlow 189 Type: OFPT_PACKET_IN
324 0.909389930 172.31.31.144 -> 172.31.24.227 OpenFlow 187 Type: OFPT_PACKET_OUT
325 0.909397174 172.31.31.144 -> 172.31.24.227 OpenFlow 187 Type: OFPT_PACKET_OUT
326 0.909402322 172.31.24.227 -> 172.31.31.144 OpenFlow 189 Type: OFPT_PACKET_IN
327 0.909438233 172.31.24.227 -> 172.31.31.144 OpenFlow 189 Type: OFPT_PACKET_IN
328 0.909461239 172.31.24.227 -> 172.31.31.144 OpenFlow 189 Type: OFPT_PACKET_IN
329 0.909470572 172.31.31.144 -> 172.31.24.227 TCP 66 6633 → 53198 [ACK] Seq=727 Ack=616 Win=853 Len=0 TSval=1827642 TSecr=388720498
330 0.909494628 172.31.24.227 -> 172.31.31.144 OpenFlow 189 Type: OFPT_PACKET_IN
331 0.909501073 172.31.24.227 -> 172.31.31.144 OpenFlow 189 Type: OFPT_PACKET_IN
332 0.909596328 172.31.31.144 -> 172.31.24.227 TCP 66 6633 → 53154 [ACK] Seq=727 Ack=124 Win=853 Len=0 TSval=1827642 TSecr=388720498
333 0.909603347 172.31.31.144 -> 172.31.24.227 TCP 66 6633 → 53154 [ACK] Seq=727 Ack=247 Win=853 Len=0 TSval=1827642 TSecr=388720498
334 0.909609342 172.31.24.227 -> 172.31.31.144 OpenFlow 189 Type: OFPT_PACKET_IN
335 0.909620031 172.31.24.227 -> 172.31.31.144 OpenFlow 189 Type: OFPT_PACKET_IN
336 0.909679324 172.31.31.144 -> 172.31.24.227 TCP 66 6633 → 53162 [ACK] Seq=1211 Ack=616 Win=853 Len=0 TSval=1827643 TSecr=388720498
337 0.909685924 172.31.31.144 -> 172.31.24.227 TCP 66 6633 → 53198 [ACK] Seq=727 Ack=739 Win=853 Len=0 TSval=1827643 TSecr=388720498
338 0.909797222 172.31.31.144 -> 172.31.24.227 OpenFlow 187 Type: OFPT_PACKET_OUT
339 0.909803353 172.31.31.144 -> 172.31.24.227 OpenFlow 671 Type: OFPT_PACKET_OUT
340 0.909806391 172.31.31.144 -> 172.31.24.227 TCP 66 6633 → 53162 [ACK] Seq=1211 Ack=739 Win=853 Len=0 TSval=1827643 TSecr=388720498
341 0.909860661 172.31.31.144 -> 172.31.24.227 TCP 66 6633 → 53164 [ACK] Seq=1211 Ack=739 Win=853 Len=0 TSval=1827643 TSecr=388720498
342 0.909952983 172.31.31.144 -> 172.31.24.227 OpenFlow 187 Type: OFPT_PACKET_OUT
343 0.909958828 172.31.31.144 -> 172.31.24.227 OpenFlow 308 Type: OFPT_PACKET_OUT
344 0.910057319 172.31.24.227 -> 172.31.31.144 OpenFlow 189 Type: OFPT_PACKET_IN
345 0.910077708 172.31.24.227 -> 172.31.31.144 OpenFlow 312 Type: OFPT_PACKET_IN
346 0.910098454 172.31.24.227 -> 172.31.31.144 OpenFlow 189 Type: OFPT_PACKET_IN
347 0.910124072 172.31.24.227 -> 172.31.31.144 OpenFlow 189 Type: OFPT_PACKET_IN
348 0.910130829 172.31.24.227 -> 172.31.31.144 OpenFlow 189 Type: OFPT_PACKET_IN
349 0.910148546 172.31.24.227 -> 172.31.31.144 OpenFlow 189 Type: OFPT_PACKET_IN
350 0.910151936 172.31.24.227 -> 172.31.31.144 OpenFlow 435 Type: OFPT_PACKET_IN
351 0.910177311 172.31.24.227 -> 172.31.31.144 TCP 66 53186 → 6633 [ACK] Seq=739 Ack=969 Win=212 Len=0 TSval=388720498 TSecr=1827642
352 0.910183705 172.31.24.227 -> 172.31.31.144 OpenFlow 189 Type: OFPT_PACKET_IN
353 0.910250086 172.31.24.227 -> 172.31.31.144 OpenFlow 189 Type: OFPT_PACKET_IN
354 0.910569166 172.31.31.144 -> 172.31.24.227 TCP 66 6633 → 53178 [ACK] Seq=1211 Ack=493 Win=853 Len=0 TSval=1827643 TSecr=388720498
355 0.910665602 172.31.24.227 -> 172.31.31.144 OpenFlow 189 Type: OFPT_PACKET_IN
356 0.910677104 172.31.31.144 -> 172.31.24.227 OpenFlow 187 Type: OFPT_PACKET_OUT
357 0.910684048 172.31.31.144 -> 172.31.24.227 TCP 66 6633 → 53168 [ACK] Seq=969 Ack=985 Win=853 Len=0 TSval=1827643 TSecr=388720498
358 0.910687299 172.31.31.144 -> 172.31.24.227 OpenFlow 671 Type: OFPT_PACKET_OUT
359 0.910692228 172.31.24.227 -> 172.31.31.144 TCP 66 53192 → 6633 [ACK] Seq=739 Ack=727 Win=213 Len=0 TSval=388720498 TSecr=1827643
360 0.910709418 172.31.24.227 -> 172.31.31.144 OpenFlow 189 Type: OFPT_PACKET_IN
361 0.910893079 172.31.31.144 -> 172.31.24.227 OpenFlow 187 Type: OFPT_PACKET_OUT
362 0.910901239 172.31.31.144 -> 172.31.24.227 OpenFlow 550 Type: OFPT_PACKET_OUT
363 0.910903824 172.31.31.144 -> 172.31.24.227 OpenFlow 308 Type: OFPT_PACKET_OUT
364 0.910906156 172.31.31.144 -> 172.31.24.227 TCP 66 6633 → 53180 [ACK] Seq=969 Ack=739 Win=853 Len=0 TSval=1827643 TSecr=388720498
365 0.911135683 172.31.31.144 -> 172.31.24.227 OpenFlow 187 Type: OFPT_PACKET_OUT
366 0.911232721 172.31.31.144 -> 172.31.24.227 OpenFlow 187 Type: OFPT_PACKET_OUT
367 0.911323919 172.31.31.144 -> 172.31.24.227 OpenFlow 187 Type: OFPT_PACKET_OUT
368 0.911425414 172.31.31.144 -> 172.31.24.227 OpenFlow 187 Type: OFPT_PACKET_OUT
369 0.911471669 172.31.24.227 -> 172.31.31.144 TCP 66 53194 → 6633 [ACK] Seq=739 Ack=727 Win=213 Len=0 TSval=388720499 TSecr=1827643
370 0.911592724 172.31.31.144 -> 172.31.24.227 OpenFlow 187 Type: OFPT_PACKET_OUT
371 0.911598799 172.31.31.144 -> 172.31.24.227 TCP 66 6633 → 53190 [ACK] Seq=969 Ack=739 Win=853 Len=0 TSval=1827643 TSecr=388720498
372 0.911654076 172.31.24.227 -> 172.31.31.144 OpenFlow 189 Type: OFPT_PACKET_IN
373 0.911665079 172.31.31.144 -> 172.31.24.227 OpenFlow 187 Type: OFPT_PACKET_OUT
374 0.911671556 172.31.31.144 -> 172.31.24.227 OpenFlow 308 Type: OFPT_PACKET_OUT
375 0.911682858 172.31.24.227 -> 172.31.31.144 OpenFlow 189 Type: OFPT_PACKET_IN
376 0.911708156 172.31.24.227 -> 172.31.31.144 OpenFlow 189 Type: OFPT_PACKET_IN
377 0.911730051 172.31.24.227 -> 172.31.31.144 OpenFlow 435 Type: OFPT_PACKET_IN
378 0.911743657 172.31.24.227 -> 172.31.31.144 OpenFlow 189 Type: OFPT_PACKET_IN
