  1 0.000000000 172.31.31.144 -> 172.31.23.72 TCP 90 6633 → 45508 [PSH, ACK] Seq=1 Ack=1 Win=853 Len=24 TSval=1221962 TSecr=30043128
  2 0.000029977 172.31.31.144 -> 172.31.23.72 TCP 82 6633 → 45508 [PSH, ACK] Seq=25 Ack=1 Win=853 Len=16 TSval=1221962 TSecr=30043128
  3 0.000034643 172.31.31.144 -> 172.31.23.72 TCP 90 6633 → 45508 [PSH, ACK] Seq=41 Ack=1 Win=853 Len=24 TSval=1221962 TSecr=30043128
  4 0.000349998 172.31.23.72 -> 172.31.31.144 OpenFlow 82 Type: OFPT_MULTIPART_REPLY, OFPMP_GROUP
  5 0.000982788 172.31.23.72 -> 172.31.31.144 OpenFlow 98 Type: OFPT_MULTIPART_REPLY, OFPMP_METER
  6 0.002337892 172.31.31.144 -> 172.31.23.72 TCP 66 6633 → 45508 [ACK] Seq=65 Ack=17 Win=853 Len=0 TSval=1221962 TSecr=30043553
  7 0.004591382 172.31.31.144 -> 172.31.23.72 TCP 66 6633 → 45508 [ACK] Seq=65 Ack=49 Win=853 Len=0 TSval=1221963 TSecr=30043553
  8 0.099942453 172.31.31.144 -> 172.31.23.72 TCP 90 6633 → 45510 [PSH, ACK] Seq=1 Ack=1 Win=853 Len=24 TSval=1221987 TSecr=30043129
  9 0.099981321 172.31.31.144 -> 172.31.23.72 TCP 90 6633 → 45512 [PSH, ACK] Seq=1 Ack=1 Win=853 Len=24 TSval=1221987 TSecr=30043129
 10 0.099984679 172.31.31.144 -> 172.31.23.72 TCP 106 6633 → 45510 [PSH, ACK] Seq=25 Ack=1 Win=853 Len=40 TSval=1221987 TSecr=30043129
 11 0.099988234 172.31.31.144 -> 172.31.23.72 TCP 106 6633 → 45512 [PSH, ACK] Seq=25 Ack=1 Win=853 Len=40 TSval=1221987 TSecr=30043129
 12 0.100214352 172.31.23.72 -> 172.31.31.144 OpenFlow 82 Type: OFPT_MULTIPART_REPLY, OFPMP_GROUP
 13 0.100270755 172.31.23.72 -> 172.31.31.144 OpenFlow 82 Type: OFPT_MULTIPART_REPLY, OFPMP_GROUP
 14 0.102117123 172.31.23.72 -> 172.31.31.144 OpenFlow 98 Type: OFPT_MULTIPART_REPLY, OFPMP_METER
 15 0.102123059 172.31.23.72 -> 172.31.31.144 OpenFlow 98 Type: OFPT_MULTIPART_REPLY, OFPMP_METER
 16 0.103005898 172.31.31.144 -> 172.31.23.72 TCP 66 6633 → 45512 [ACK] Seq=65 Ack=17 Win=853 Len=0 TSval=1221987 TSecr=30043578
 17 0.104305407 172.31.31.144 -> 172.31.23.72 TCP 66 6633 → 45512 [ACK] Seq=65 Ack=49 Win=853 Len=0 TSval=1221988 TSecr=30043579
 18 0.104309495 172.31.31.144 -> 172.31.23.72 TCP 66 6633 → 45510 [ACK] Seq=65 Ack=49 Win=853 Len=0 TSval=1221988 TSecr=30043578
 19 0.199198341 172.31.31.144 -> 172.31.23.72 TCP 90 6633 → 45514 [PSH, ACK] Seq=1 Ack=1 Win=853 Len=24 TSval=1222012 TSecr=30043129
 20 0.199222082 172.31.31.144 -> 172.31.23.72 TCP 106 6633 → 45514 [PSH, ACK] Seq=25 Ack=1 Win=853 Len=40 TSval=1222012 TSecr=30043129
 21 0.199226278 172.31.31.144 -> 172.31.23.72 TCP 90 6633 → 45518 [PSH, ACK] Seq=1 Ack=1 Win=853 Len=24 TSval=1222012 TSecr=30043129
 22 0.199236062 172.31.23.72 -> 172.31.31.144 TCP 66 45518 → 6633 [ACK] Seq=1 Ack=25 Win=213 Len=0 TSval=30043603 TSecr=1222012
 23 0.199242218 172.31.31.144 -> 172.31.23.72 TCP 90 6633 → 45516 [PSH, ACK] Seq=1 Ack=1 Win=853 Len=24 TSval=1222012 TSecr=30043129
 24 0.199245338 172.31.31.144 -> 172.31.23.72 TCP 106 6633 → 45518 [PSH, ACK] Seq=25 Ack=1 Win=853 Len=40 TSval=1222012 TSecr=30043129
 25 0.199248239 172.31.23.72 -> 172.31.31.144 TCP 66 45518 → 6633 [ACK] Seq=1 Ack=65 Win=213 Len=0 TSval=30043603 TSecr=1222012
 26 0.199262861 172.31.31.144 -> 172.31.23.72 TCP 106 6633 → 45516 [PSH, ACK] Seq=25 Ack=1 Win=853 Len=40 TSval=1222012 TSecr=30043129
 27 0.199417740 172.31.23.72 -> 172.31.31.144 OpenFlow 82 Type: OFPT_MULTIPART_REPLY, OFPMP_GROUP
 28 0.199446200 172.31.23.72 -> 172.31.31.144 OpenFlow 82 Type: OFPT_MULTIPART_REPLY, OFPMP_GROUP
 29 0.199554564 172.31.23.72 -> 172.31.31.144 OpenFlow 82 Type: OFPT_MULTIPART_REPLY, OFPMP_GROUP
 30 0.201713338 172.31.23.72 -> 172.31.31.144 OpenFlow 98 Type: OFPT_MULTIPART_REPLY, OFPMP_METER
 31 0.201789241 172.31.23.72 -> 172.31.31.144 OpenFlow 98 Type: OFPT_MULTIPART_REPLY, OFPMP_METER
 32 0.201791117 172.31.23.72 -> 172.31.31.144 OpenFlow 98 Type: OFPT_MULTIPART_REPLY, OFPMP_METER
 33 0.208720335 172.31.31.144 -> 172.31.23.72 TCP 66 6633 → 45514 [ACK] Seq=65 Ack=17 Win=853 Len=0 TSval=1222012 TSecr=30043603
 34 0.208728391 172.31.31.144 -> 172.31.23.72 TCP 66 6633 → 45518 [ACK] Seq=65 Ack=17 Win=853 Len=0 TSval=1222012 TSecr=30043603
 35 0.208730577 172.31.31.144 -> 172.31.23.72 TCP 66 6633 → 45516 [ACK] Seq=65 Ack=17 Win=853 Len=0 TSval=1222012 TSecr=30043603
 36 0.208732341 172.31.31.144 -> 172.31.23.72 TCP 66 6633 → 45514 [ACK] Seq=65 Ack=49 Win=853 Len=0 TSval=1222012 TSecr=30043604
 37 0.208734297 172.31.31.144 -> 172.31.23.72 TCP 66 6633 → 45518 [ACK] Seq=65 Ack=49 Win=853 Len=0 TSval=1222012 TSecr=30043604
 38 0.208736140 172.31.31.144 -> 172.31.23.72 TCP 66 6633 → 45516 [ACK] Seq=65 Ack=49 Win=853 Len=0 TSval=1222012 TSecr=30043604
 39 0.298167249 172.31.31.144 -> 172.31.23.72 TCP 90 6633 → 45520 [PSH, ACK] Seq=1 Ack=1 Win=853 Len=24 TSval=1222036 TSecr=30043129
 40 0.298202390 172.31.31.144 -> 172.31.23.72 TCP 90 6633 → 45522 [PSH, ACK] Seq=1 Ack=1 Win=853 Len=24 TSval=1222036 TSecr=30043129
 41 0.298205441 172.31.31.144 -> 172.31.23.72 TCP 106 6633 → 45520 [PSH, ACK] Seq=25 Ack=1 Win=853 Len=40 TSval=1222036 TSecr=30043129
 42 0.298208540 172.31.31.144 -> 172.31.23.72 TCP 106 6633 → 45522 [PSH, ACK] Seq=25 Ack=1 Win=853 Len=40 TSval=1222036 TSecr=30043129
 43 0.298453527 172.31.23.72 -> 172.31.31.144 OpenFlow 82 Type: OFPT_MULTIPART_REPLY, OFPMP_GROUP
 44 0.298489644 172.31.23.72 -> 172.31.31.144 OpenFlow 98 Type: OFPT_MULTIPART_REPLY, OFPMP_METER
 45 0.298564309 172.31.23.72 -> 172.31.31.144 OpenFlow 82 Type: OFPT_MULTIPART_REPLY, OFPMP_GROUP
 46 0.298584929 172.31.23.72 -> 172.31.31.144 OpenFlow 98 Type: OFPT_MULTIPART_REPLY, OFPMP_METER
 47 0.298699652 172.31.31.144 -> 172.31.23.72 TCP 66 6633 → 45522 [ACK] Seq=65 Ack=17 Win=853 Len=0 TSval=1222037 TSecr=30043628
 48 0.298706649 172.31.31.144 -> 172.31.23.72 TCP 66 6633 → 45522 [ACK] Seq=65 Ack=49 Win=853 Len=0 TSval=1222037 TSecr=30043628
 49 0.298753157 172.31.31.144 -> 172.31.23.72 TCP 66 6633 → 45520 [ACK] Seq=65 Ack=17 Win=853 Len=0 TSval=1222037 TSecr=30043628
 50 0.298771447 172.31.31.144 -> 172.31.23.72 TCP 66 6633 → 45520 [ACK] Seq=65 Ack=49 Win=853 Len=0 TSval=1222037 TSecr=30043628
 51 0.399414017 172.31.31.144 -> 172.31.23.72 TCP 90 6633 → 45526 [PSH, ACK] Seq=1 Ack=1 Win=853 Len=24 TSval=1222061 TSecr=30043104
 52 0.399445416 172.31.31.144 -> 172.31.23.72 TCP 90 6633 → 45524 [PSH, ACK] Seq=1 Ack=1 Win=853 Len=24 TSval=1222061 TSecr=30043129
 53 0.399448425 172.31.31.144 -> 172.31.23.72 TCP 106 6633 → 45526 [PSH, ACK] Seq=25 Ack=1 Win=853 Len=40 TSval=1222061 TSecr=30043104
 54 0.399451399 172.31.31.144 -> 172.31.23.72 TCP 106 6633 → 45524 [PSH, ACK] Seq=25 Ack=1 Win=853 Len=40 TSval=1222061 TSecr=30043129
 55 0.399642594 172.31.23.72 -> 172.31.31.144 OpenFlow 82 Type: OFPT_MULTIPART_REPLY, OFPMP_GROUP
 56 0.399697390 172.31.23.72 -> 172.31.31.144 OpenFlow 82 Type: OFPT_MULTIPART_REPLY, OFPMP_GROUP
 57 0.400634143 172.31.23.72 -> 172.31.31.144 OpenFlow 98 Type: OFPT_MULTIPART_REPLY, OFPMP_METER
 58 0.400640453 172.31.23.72 -> 172.31.31.144 OpenFlow 98 Type: OFPT_MULTIPART_REPLY, OFPMP_METER
 59 0.401575585 172.31.31.144 -> 172.31.23.72 TCP 66 6633 → 45524 [ACK] Seq=65 Ack=17 Win=853 Len=0 TSval=1222062 TSecr=30043653
 60 0.401582599 172.31.31.144 -> 172.31.23.72 TCP 66 6633 → 45526 [ACK] Seq=65 Ack=17 Win=853 Len=0 TSval=1222062 TSecr=30043653
 61 0.401584691 172.31.31.144 -> 172.31.23.72 TCP 66 6633 → 45524 [ACK] Seq=65 Ack=49 Win=853 Len=0 TSval=1222062 TSecr=30043653
 62 0.401587345 172.31.31.144 -> 172.31.23.72 TCP 66 6633 → 45526 [ACK] Seq=65 Ack=49 Win=853 Len=0 TSval=1222062 TSecr=30043653
 63 0.500760419 172.31.31.144 -> 172.31.23.72 TCP 90 6633 → 45530 [PSH, ACK] Seq=1 Ack=1 Win=853 Len=24 TSval=1222086 TSecr=30043105
 64 0.500787893 172.31.31.144 -> 172.31.23.72 TCP 106 6633 → 45530 [PSH, ACK] Seq=25 Ack=1 Win=853 Len=40 TSval=1222086 TSecr=30043105
 65 0.500792055 172.31.31.144 -> 172.31.23.72 TCP 90 6633 → 45528 [PSH, ACK] Seq=1 Ack=1 Win=853 Len=24 TSval=1222086 TSecr=30043129
 66 0.500794941 172.31.31.144 -> 172.31.23.72 TCP 106 6633 → 45528 [PSH, ACK] Seq=25 Ack=1 Win=853 Len=40 TSval=1222086 TSecr=30043129
 67 0.500981985 172.31.23.72 -> 172.31.31.144 OpenFlow 82 Type: OFPT_MULTIPART_REPLY, OFPMP_GROUP
 68 0.501018821 172.31.23.72 -> 172.31.31.144 OpenFlow 82 Type: OFPT_MULTIPART_REPLY, OFPMP_GROUP
 69 0.502672393 172.31.23.72 -> 172.31.31.144 OpenFlow 98 Type: OFPT_MULTIPART_REPLY, OFPMP_METER
 70 0.502678128 172.31.23.72 -> 172.31.31.144 OpenFlow 98 Type: OFPT_MULTIPART_REPLY, OFPMP_METER
 71 0.504160827 172.31.31.144 -> 172.31.23.72 TCP 66 6633 → 45528 [ACK] Seq=65 Ack=17 Win=853 Len=0 TSval=1222088 TSecr=30043678
 72 0.504167711 172.31.31.144 -> 172.31.23.72 TCP 66 6633 → 45530 [ACK] Seq=65 Ack=17 Win=853 Len=0 TSval=1222088 TSecr=30043678
 73 0.504169714 172.31.31.144 -> 172.31.23.72 TCP 66 6633 → 45530 [ACK] Seq=65 Ack=49 Win=853 Len=0 TSval=1222088 TSecr=30043679
 74 0.504171765 172.31.31.144 -> 172.31.23.72 TCP 66 6633 → 45528 [ACK] Seq=65 Ack=49 Win=853 Len=0 TSval=1222088 TSecr=30043679
 75 0.598746805 172.31.31.144 -> 172.31.23.72 TCP 90 6633 → 45534 [PSH, ACK] Seq=1 Ack=1 Win=853 Len=24 TSval=1222112 TSecr=30043129
 76 0.598774775 172.31.31.144 -> 172.31.23.72 TCP 90 6633 → 45532 [PSH, ACK] Seq=1 Ack=1 Win=853 Len=24 TSval=1222112 TSecr=30043104
 77 0.598778043 172.31.31.144 -> 172.31.23.72 TCP 106 6633 → 45532 [PSH, ACK] Seq=25 Ack=1 Win=853 Len=40 TSval=1222112 TSecr=30043104
 78 0.598782316 172.31.31.144 -> 172.31.23.72 TCP 106 6633 → 45534 [PSH, ACK] Seq=25 Ack=1 Win=853 Len=40 TSval=1222112 TSecr=30043129
 79 0.598973849 172.31.23.72 -> 172.31.31.144 OpenFlow 82 Type: OFPT_MULTIPART_REPLY, OFPMP_GROUP
 80 0.599036749 172.31.23.72 -> 172.31.31.144 OpenFlow 98 Type: OFPT_MULTIPART_REPLY, OFPMP_METER
 81 0.599057116 172.31.23.72 -> 172.31.31.144 OpenFlow 82 Type: OFPT_MULTIPART_REPLY, OFPMP_GROUP
 82 0.599149101 172.31.23.72 -> 172.31.31.144 OpenFlow 98 Type: OFPT_MULTIPART_REPLY, OFPMP_METER
 83 0.599289017 172.31.31.144 -> 172.31.23.72 TCP 66 6633 → 45534 [ACK] Seq=65 Ack=17 Win=853 Len=0 TSval=1222112 TSecr=30043703
 84 0.599295845 172.31.31.144 -> 172.31.23.72 TCP 66 6633 → 45534 [ACK] Seq=65 Ack=49 Win=853 Len=0 TSval=1222112 TSecr=30043703
 85 0.599503258 172.31.31.144 -> 172.31.23.72 TCP 66 6633 → 45532 [ACK] Seq=65 Ack=49 Win=853 Len=0 TSval=1222112 TSecr=30043703
 86 0.698864909 172.31.31.144 -> 172.31.23.72 TCP 90 6633 → 45536 [PSH, ACK] Seq=1 Ack=1 Win=853 Len=24 TSval=1222137 TSecr=30043129
 87 0.698891494 172.31.31.144 -> 172.31.23.72 TCP 90 6633 → 45538 [PSH, ACK] Seq=1 Ack=1 Win=853 Len=24 TSval=1222137 TSecr=30043129
 88 0.698895380 172.31.31.144 -> 172.31.23.72 TCP 82 6633 → 45538 [PSH, ACK] Seq=25 Ack=1 Win=853 Len=16 TSval=1222137 TSecr=30043129
 89 0.698898810 172.31.31.144 -> 172.31.23.72 TCP 106 6633 → 45536 [PSH, ACK] Seq=25 Ack=1 Win=853 Len=40 TSval=1222137 TSecr=30043129
 90 0.698900440 172.31.31.144 -> 172.31.23.72 TCP 90 6633 → 45538 [PSH, ACK] Seq=41 Ack=1 Win=853 Len=24 TSval=1222137 TSecr=30043129
 91 0.699124925 172.31.23.72 -> 172.31.31.144 OpenFlow 82 Type: OFPT_MULTIPART_REPLY, OFPMP_GROUP
 92 0.699152149 172.31.23.72 -> 172.31.31.144 OpenFlow 98 Type: OFPT_MULTIPART_REPLY, OFPMP_METER
 93 0.699248302 172.31.23.72 -> 172.31.31.144 OpenFlow 82 Type: OFPT_MULTIPART_REPLY, OFPMP_GROUP
 94 0.699269050 172.31.23.72 -> 172.31.31.144 OpenFlow 98 Type: OFPT_MULTIPART_REPLY, OFPMP_METER
 95 0.699370399 172.31.31.144 -> 172.31.23.72 TCP 66 6633 → 45538 [ACK] Seq=65 Ack=49 Win=853 Len=0 TSval=1222137 TSecr=30043728
 96 0.699441578 172.31.31.144 -> 172.31.23.72 TCP 66 6633 → 45536 [ACK] Seq=65 Ack=17 Win=853 Len=0 TSval=1222137 TSecr=30043728
 97 0.699461520 172.31.31.144 -> 172.31.23.72 TCP 66 6633 → 45536 [ACK] Seq=65 Ack=49 Win=853 Len=0 TSval=1222137 TSecr=30043728
 98 0.798952420 172.31.31.144 -> 172.31.23.72 TCP 90 6633 → 45540 [PSH, ACK] Seq=1 Ack=1 Win=853 Len=24 TSval=1222162 TSecr=30043129
 99 0.798978617 172.31.31.144 -> 172.31.23.72 TCP 90 6633 → 45542 [PSH, ACK] Seq=1 Ack=1 Win=853 Len=24 TSval=1222162 TSecr=30043129
100 0.798981729 172.31.31.144 -> 172.31.23.72 TCP 82 6633 → 45542 [PSH, ACK] Seq=25 Ack=1 Win=853 Len=16 TSval=1222162 TSecr=30043129
101 0.798987395 172.31.31.144 -> 172.31.23.72 TCP 106 6633 → 45540 [PSH, ACK] Seq=25 Ack=1 Win=853 Len=40 TSval=1222162 TSecr=30043129
102 0.798989271 172.31.31.144 -> 172.31.23.72 TCP 90 6633 → 45542 [PSH, ACK] Seq=41 Ack=1 Win=853 Len=24 TSval=1222162 TSecr=30043129
103 0.799239247 172.31.23.72 -> 172.31.31.144 OpenFlow 82 Type: OFPT_MULTIPART_REPLY, OFPMP_GROUP
104 0.799268222 172.31.23.72 -> 172.31.31.144 OpenFlow 98 Type: OFPT_MULTIPART_REPLY, OFPMP_METER
105 0.799320651 172.31.23.72 -> 172.31.31.144 OpenFlow 82 Type: OFPT_MULTIPART_REPLY, OFPMP_GROUP
106 0.799340553 172.31.23.72 -> 172.31.31.144 OpenFlow 98 Type: OFPT_MULTIPART_REPLY, OFPMP_METER
107 0.799459305 172.31.31.144 -> 172.31.23.72 TCP 66 6633 → 45540 [ACK] Seq=65 Ack=49 Win=853 Len=0 TSval=1222162 TSecr=30043753
108 0.799515163 172.31.31.144 -> 172.31.23.72 TCP 66 6633 → 45542 [ACK] Seq=65 Ack=49 Win=853 Len=0 TSval=1222162 TSecr=30043753
109 0.889574955 172.31.31.144 -> 172.31.23.72 OpenFlow 122 Type: OFPT_MULTIPART_REQUEST, OFPMP_FLOW
110 0.889607649 172.31.31.144 -> 172.31.23.72 OpenFlow 106 Type: OFPT_MULTIPART_REQUEST, OFPMP_PORT_STATS
111 0.889836590 172.31.23.72 -> 172.31.31.144 OpenFlow 2010 Type: OFPT_MULTIPART_REPLY, OFPMP_FLOW
112 0.890016927 172.31.23.72 -> 172.31.31.144 OpenFlow 6178 Type: OFPT_MULTIPART_REPLY, OFPMP_TABLE
113 0.890097774 172.31.31.144 -> 172.31.23.72 TCP 66 6633 → 45508 [ACK] Seq=161 Ack=1993 Win=853 Len=0 TSval=1222184 TSecr=30043776
114 0.890144387 172.31.23.72 -> 172.31.31.144 OpenFlow 530 Type: OFPT_MULTIPART_REPLY, OFPMP_PORT_STATS
115 0.890283431 172.31.31.144 -> 172.31.23.72 TCP 66 6633 → 45508 [ACK] Seq=161 Ack=8105 Win=853 Len=0 TSval=1222184 TSecr=30043776
116 0.890330440 172.31.31.144 -> 172.31.23.72 TCP 66 6633 → 45508 [ACK] Seq=161 Ack=8569 Win=853 Len=0 TSval=1222184 TSecr=30043776
117 0.899064417 172.31.31.144 -> 172.31.23.72 TCP 90 6633 → 45544 [PSH, ACK] Seq=1 Ack=1 Win=853 Len=24 TSval=1222187 TSecr=30043104
118 0.899074851 172.31.31.144 -> 172.31.23.72 TCP 106 6633 → 45544 [PSH, ACK] Seq=25 Ack=1 Win=853 Len=40 TSval=1222187 TSecr=30043104
119 0.899179658 172.31.23.72 -> 172.31.31.144 OpenFlow 82 Type: OFPT_MULTIPART_REPLY, OFPMP_GROUP
120 0.899203402 172.31.23.72 -> 172.31.31.144 OpenFlow 98 Type: OFPT_MULTIPART_REPLY, OFPMP_METER
121 0.899380676 172.31.31.144 -> 172.31.23.72 TCP 66 6633 → 45544 [ACK] Seq=65 Ack=17 Win=853 Len=0 TSval=1222187 TSecr=30043778
122 0.899406547 172.31.31.144 -> 172.31.23.72 TCP 66 6633 → 45544 [ACK] Seq=65 Ack=49 Win=853 Len=0 TSval=1222187 TSecr=30043778
123 0.969714415 172.31.31.144 -> 172.31.23.72 OpenFlow 90 Type: OFPT_MULTIPART_REQUEST, OFPMP_PORT_STATS
124 0.969736971 172.31.31.144 -> 172.31.23.72 OpenFlow 138 Type: OFPT_MULTIPART_REQUEST, OFPMP_TABLE
125 0.970073173 172.31.23.72 -> 172.31.31.144 OpenFlow 642 Type: OFPT_MULTIPART_REPLY, OFPMP_PORT_STATS
126 0.970180530 172.31.23.72 -> 172.31.31.144 OpenFlow 2634 Type: OFPT_MULTIPART_REPLY, OFPMP_FLOW
127 0.970336445 172.31.23.72 -> 172.31.31.144 OpenFlow 6178 Type: OFPT_MULTIPART_REPLY, OFPMP_TABLE
128 0.970406775 172.31.31.144 -> 172.31.23.72 TCP 66 6633 → 45510 [ACK] Seq=161 Ack=3193 Win=853 Len=0 TSval=1222204 TSecr=30043796
129 0.975976636 172.31.31.144 -> 172.31.23.72 OpenFlow 122 Type: OFPT_MULTIPART_REQUEST, OFPMP_FLOW
130 0.975984873 172.31.31.144 -> 172.31.23.72 OpenFlow 106 Type: OFPT_MULTIPART_REQUEST, OFPMP_TABLE
131 0.976158535 172.31.23.72 -> 172.31.31.144 OpenFlow 2634 Type: OFPT_MULTIPART_REPLY, OFPMP_FLOW
132 0.976272516 172.31.23.72 -> 172.31.31.144 OpenFlow 754 Type: OFPT_MULTIPART_REPLY, OFPMP_PORT_STATS
133 0.976421303 172.31.23.72 -> 172.31.31.144 OpenFlow 6178 Type: OFPT_MULTIPART_REPLY, OFPMP_TABLE
134 0.976463029 172.31.31.144 -> 172.31.23.72 TCP 66 6633 → 45512 [ACK] Seq=161 Ack=2617 Win=853 Len=0 TSval=1222206 TSecr=30043797
135 0.976571431 172.31.31.144 -> 172.31.23.72 TCP 66 6633 → 45512 [ACK] Seq=161 Ack=3305 Win=853 Len=0 TSval=1222206 TSecr=30043797
136 0.976743993 172.31.31.144 -> 172.31.23.72 TCP 66 6633 → 45512 [ACK] Seq=161 Ack=9417 Win=853 Len=0 TSval=1222206 TSecr=30043797
137 0.998713036 172.31.31.144 -> 172.31.23.72 TCP 90 6633 → 45548 [PSH, ACK] Seq=1 Ack=1 Win=853 Len=24 TSval=1222211 TSecr=30043128
138 0.998726804 172.31.31.144 -> 172.31.23.72 TCP 90 6633 → 45546 [PSH, ACK] Seq=1 Ack=1 Win=853 Len=24 TSval=1222211 TSecr=30043129
139 0.998729820 172.31.31.144 -> 172.31.23.72 TCP 106 6633 → 45548 [PSH, ACK] Seq=25 Ack=1 Win=853 Len=40 TSval=1222211 TSecr=30043128
140 0.998733183 172.31.31.144 -> 172.31.23.72 TCP 106 6633 → 45546 [PSH, ACK] Seq=25 Ack=1 Win=853 Len=40 TSval=1222211 TSecr=30043129
141 0.998842632 172.31.23.72 -> 172.31.31.144 OpenFlow 82 Type: OFPT_MULTIPART_REPLY, OFPMP_GROUP
142 0.998966314 172.31.23.72 -> 172.31.31.144 OpenFlow 82 Type: OFPT_MULTIPART_REPLY, OFPMP_GROUP
143 1.000072035 172.31.23.72 -> 172.31.31.144 OpenFlow 98 Type: OFPT_MULTIPART_REPLY, OFPMP_METER
144 1.000078247 172.31.23.72 -> 172.31.31.144 OpenFlow 98 Type: OFPT_MULTIPART_REPLY, OFPMP_METER
145 1.002019598 172.31.31.144 -> 172.31.23.72 TCP 66 6633 → 45546 [ACK] Seq=65 Ack=17 Win=853 Len=0 TSval=1222212 TSecr=30043803
146 1.002028956 172.31.31.144 -> 172.31.23.72 TCP 66 6633 → 45548 [ACK] Seq=65 Ack=17 Win=853 Len=0 TSval=1222212 TSecr=30043803
147 1.003374167 172.31.31.144 -> 172.31.23.72 TCP 66 6633 → 45546 [ACK] Seq=65 Ack=49 Win=853 Len=0 TSval=1222212 TSecr=30043803
148 1.003378625 172.31.31.144 -> 172.31.23.72 TCP 66 6633 → 45548 [ACK] Seq=65 Ack=49 Win=853 Len=0 TSval=1222212 TSecr=30043803
149 1.010238939 172.31.31.144 -> 172.31.23.72 OpenFlow 82 Type: OFPT_MULTIPART_REQUEST, OFPMP_TABLE
150 1.010247501 172.31.31.144 -> 172.31.23.72 OpenFlow 146 Type: OFPT_MULTIPART_REQUEST, OFPMP_PORT_STATS
151 1.010552403 172.31.23.72 -> 172.31.31.144 OpenFlow 6178 Type: OFPT_MULTIPART_REPLY, OFPMP_TABLE
152 1.013403218 172.31.31.144 -> 172.31.23.72 TCP 66 6633 → 45510 [ACK] Seq=161 Ack=9305 Win=853 Len=0 TSval=1222215 TSecr=30043796
153 1.013526523 172.31.23.72 -> 172.31.31.144 OpenFlow 2586 Type: OFPT_MULTIPART_REPLY, OFPMP_PORT_STATS
154 1.014089144 172.31.31.144 -> 172.31.23.72 TCP 66 6633 → 45514 [ACK] Seq=161 Ack=6161 Win=853 Len=0 TSval=1222215 TSecr=30043806
155 1.015187188 172.31.31.144 -> 172.31.23.72 TCP 66 6633 → 45514 [ACK] Seq=161 Ack=8681 Win=853 Len=0 TSval=1222215 TSecr=30043807
156 1.053196455 172.31.31.144 -> 172.31.23.72 OpenFlow 82 Type: OFPT_MULTIPART_REQUEST, OFPMP_TABLE
157 1.053217997 172.31.31.144 -> 172.31.23.72 OpenFlow 146 Type: OFPT_MULTIPART_REQUEST, OFPMP_FLOW
158 1.053695441 172.31.23.72 -> 172.31.31.144 OpenFlow 6178 Type: OFPT_MULTIPART_REPLY, OFPMP_TABLE
159 1.056327455 172.31.23.72 -> 172.31.31.144 OpenFlow 1226 Type: OFPT_MULTIPART_REPLY, OFPMP_FLOW
160 1.056966919 172.31.31.144 -> 172.31.23.72 TCP 66 6633 → 45516 [ACK] Seq=161 Ack=6161 Win=853 Len=0 TSval=1222226 TSecr=30043817
161 1.058982805 172.31.31.144 -> 172.31.23.72 TCP 66 6633 → 45516 [ACK] Seq=161 Ack=7321 Win=853 Len=0 TSval=1222226 TSecr=30043817
162 1.093092359 172.31.31.144 -> 172.31.23.72 OpenFlow 122 Type: OFPT_MULTIPART_REQUEST, OFPMP_FLOW
163 1.093116921 172.31.31.144 -> 172.31.23.72 OpenFlow 106 Type: OFPT_MULTIPART_REQUEST, OFPMP_PORT_STATS
164 1.093406101 172.31.23.72 -> 172.31.31.144 OpenFlow 3050 Type: OFPT_MULTIPART_REPLY, OFPMP_FLOW
165 1.093598565 172.31.23.72 -> 172.31.31.144 OpenFlow 6178 Type: OFPT_MULTIPART_REPLY, OFPMP_TABLE
166 1.094089986 172.31.23.72 -> 172.31.31.144 OpenFlow 754 Type: OFPT_MULTIPART_REPLY, OFPMP_PORT_STATS
167 1.094888412 172.31.31.144 -> 172.31.23.72 TCP 66 6633 → 45518 [ACK] Seq=161 Ack=3033 Win=853 Len=0 TSval=1222235 TSecr=30043826
168 1.094896072 172.31.31.144 -> 172.31.23.72 TCP 66 6633 → 45518 [ACK] Seq=161 Ack=9145 Win=853 Len=0 TSval=1222235 TSecr=30043827
169 1.097100148 172.31.31.144 -> 172.31.23.72 TCP 66 6633 → 45518 [ACK] Seq=161 Ack=9833 Win=853 Len=0 TSval=1222236 TSecr=30043827
170 1.099387862 172.31.31.144 -> 172.31.23.72 TCP 90 6633 → 45550 [PSH, ACK] Seq=1 Ack=1 Win=853 Len=24 TSval=1222236 TSecr=30043129
171 1.099395939 172.31.31.144 -> 172.31.23.72 TCP 90 6633 → 45552 [PSH, ACK] Seq=1 Ack=1 Win=853 Len=24 TSval=1222236 TSecr=30043129
172 1.099398883 172.31.31.144 -> 172.31.23.72 TCP 106 6633 → 45550 [PSH, ACK] Seq=25 Ack=1 Win=853 Len=40 TSval=1222236 TSecr=30043129
173 1.099401209 172.31.31.144 -> 172.31.23.72 TCP 106 6633 → 45552 [PSH, ACK] Seq=25 Ack=1 Win=853 Len=40 TSval=1222236 TSecr=30043129
174 1.099402780 172.31.31.144 -> 172.31.23.72 TCP 90 6633 → 45554 [PSH, ACK] Seq=1 Ack=1 Win=853 Len=24 TSval=1222236 TSecr=30043129
175 1.099405330 172.31.31.144 -> 172.31.23.72 TCP 106 6633 → 45554 [PSH, ACK] Seq=25 Ack=1 Win=853 Len=40 TSval=1222236 TSecr=30043129
176 1.099528232 172.31.23.72 -> 172.31.31.144 OpenFlow 82 Type: OFPT_MULTIPART_REPLY, OFPMP_GROUP
177 1.099554639 172.31.23.72 -> 172.31.31.144 OpenFlow 82 Type: OFPT_MULTIPART_REPLY, OFPMP_GROUP
178 1.099570242 172.31.23.72 -> 172.31.31.144 OpenFlow 82 Type: OFPT_MULTIPART_REPLY, OFPMP_GROUP
179 1.101916237 172.31.23.72 -> 172.31.31.144 OpenFlow 98 Type: OFPT_MULTIPART_REPLY, OFPMP_METER
180 1.101922263 172.31.23.72 -> 172.31.31.144 OpenFlow 98 Type: OFPT_MULTIPART_REPLY, OFPMP_METER
181 1.101924441 172.31.23.72 -> 172.31.31.144 OpenFlow 98 Type: OFPT_MULTIPART_REPLY, OFPMP_METER
182 1.108764309 172.31.31.144 -> 172.31.23.72 TCP 66 6633 → 45552 [ACK] Seq=65 Ack=17 Win=853 Len=0 TSval=1222237 TSecr=30043828
183 1.108775972 172.31.31.144 -> 172.31.23.72 TCP 66 6633 → 45550 [ACK] Seq=65 Ack=17 Win=853 Len=0 TSval=1222237 TSecr=30043828
184 1.108778577 172.31.31.144 -> 172.31.23.72 TCP 66 6633 → 45554 [ACK] Seq=65 Ack=49 Win=853 Len=0 TSval=1222238 TSecr=30043828
185 1.108781426 172.31.31.144 -> 172.31.23.72 TCP 66 6633 → 45552 [ACK] Seq=65 Ack=49 Win=853 Len=0 TSval=1222238 TSecr=30043829
186 1.108783205 172.31.31.144 -> 172.31.23.72 TCP 66 6633 → 45550 [ACK] Seq=65 Ack=49 Win=853 Len=0 TSval=1222238 TSecr=30043829
187 1.135496504 172.31.31.144 -> 172.31.23.72 OpenFlow 82 Type: OFPT_MULTIPART_REQUEST, OFPMP_TABLE
188 1.135519486 172.31.31.144 -> 172.31.23.72 OpenFlow 146 Type: OFPT_MULTIPART_REQUEST, OFPMP_FLOW
189 1.136590539 172.31.23.72 -> 172.31.31.144 OpenFlow 6178 Type: OFPT_MULTIPART_REPLY, OFPMP_TABLE
190 1.136695370 172.31.23.72 -> 172.31.31.144 OpenFlow 754 Type: OFPT_MULTIPART_REPLY, OFPMP_PORT_STATS
191 1.136759863 172.31.23.72 -> 172.31.31.144 OpenFlow 1802 Type: OFPT_MULTIPART_REPLY, OFPMP_FLOW
192 1.136836094 172.31.31.144 -> 172.31.23.72 TCP 66 6633 → 45520 [ACK] Seq=161 Ack=6161 Win=853 Len=0 TSval=1222246 TSecr=30043837
193 1.136875585 172.31.31.144 -> 172.31.23.72 TCP 66 6633 → 45520 [ACK] Seq=161 Ack=6849 Win=853 Len=0 TSval=1222246 TSecr=30043837
194 1.136946149 172.31.31.144 -> 172.31.23.72 TCP 66 6633 → 45520 [ACK] Seq=161 Ack=8585 Win=853 Len=0 TSval=1222246 TSecr=30043837
195 1.141441734 172.31.23.72 -> 172.31.31.144 OpenFlow 146 Type: OFPT_PORT_STATUS
196 1.141591914 172.31.23.72 -> 172.31.31.144 OpenFlow 146 Type: OFPT_PORT_STATUS
197 1.141640060 172.31.31.144 -> 172.31.23.72 TCP 66 6633 → 45546 [ACK] Seq=65 Ack=129 Win=853 Len=0 TSval=1222247 TSecr=30043838
198 1.141818457 172.31.31.144 -> 172.31.23.72 TCP 66 6633 → 45544 [ACK] Seq=65 Ack=129 Win=853 Len=0 TSval=1222247 TSecr=30043839
199 1.164859102 172.31.31.144 -> 172.31.23.72 OpenFlow 146 Type: OFPT_FLOW_MOD
200 1.164882413 172.31.31.144 -> 172.31.23.72 OpenFlow 146 Type: OFPT_FLOW_MOD
201 1.164885644 172.31.31.144 -> 172.31.23.72 OpenFlow 154 Type: OFPT_BARRIER_REQUEST
202 1.164888646 172.31.31.144 -> 172.31.23.72 OpenFlow 322 Type: OFPT_BARRIER_REQUEST
203 1.165019025 172.31.31.144 -> 172.31.23.72 OpenFlow 146 Type: OFPT_FLOW_MOD
204 1.165023741 172.31.31.144 -> 172.31.23.72 OpenFlow 146 Type: OFPT_FLOW_MOD
205 1.165028971 172.31.31.144 -> 172.31.23.72 OpenFlow 146 Type: OFPT_FLOW_MOD
206 1.165031875 172.31.31.144 -> 172.31.23.72 OpenFlow 146 Type: OFPT_FLOW_MOD
207 1.165033605 172.31.31.144 -> 172.31.23.72 OpenFlow 154 Type: OFPT_BARRIER_REQUEST
208 1.165034914 172.31.31.144 -> 172.31.23.72 OpenFlow 74 Type: OFPT_BARRIER_REQUEST
209 1.165036632 172.31.31.144 -> 172.31.23.72 OpenFlow 146 Type: OFPT_FLOW_MOD
210 1.165037981 172.31.31.144 -> 172.31.23.72 OpenFlow 74 Type: OFPT_BARRIER_REQUEST
211 1.165039166 172.31.31.144 -> 172.31.23.72 OpenFlow 146 Type: OFPT_FLOW_MOD
212 1.165040624 172.31.31.144 -> 172.31.23.72 OpenFlow 154 Type: OFPT_BARRIER_REQUEST
213 1.165042243 172.31.31.144 -> 172.31.23.72 OpenFlow 146 Type: OFPT_FLOW_MOD
214 1.165044615 172.31.31.144 -> 172.31.23.72 OpenFlow 146 Type: OFPT_FLOW_MOD
215 1.165052107 172.31.31.144 -> 172.31.23.72 OpenFlow 154 Type: OFPT_BARRIER_REQUEST
216 1.165053482 172.31.31.144 -> 172.31.23.72 OpenFlow 146 Type: OFPT_FLOW_MOD
217 1.165124929 172.31.31.144 -> 172.31.23.72 OpenFlow 74 Type: OFPT_BARRIER_REQUEST
218 1.165127938 172.31.31.144 -> 172.31.23.72 OpenFlow 146 Type: OFPT_FLOW_MOD
219 1.165129590 172.31.31.144 -> 172.31.23.72 OpenFlow 146 Type: OFPT_FLOW_MOD
220 1.165132639 172.31.31.144 -> 172.31.23.72 OpenFlow 146 Type: OFPT_FLOW_MOD
221 1.165135106 172.31.31.144 -> 172.31.23.72 OpenFlow 154 Type: OFPT_BARRIER_REQUEST
222 1.165136829 172.31.31.144 -> 172.31.23.72 OpenFlow 146 Type: OFPT_FLOW_MOD
223 1.165142012 172.31.31.144 -> 172.31.23.72 OpenFlow 154 Type: OFPT_BARRIER_REQUEST
224 1.165143491 172.31.31.144 -> 172.31.23.72 OpenFlow 74 Type: OFPT_BARRIER_REQUEST
225 1.165164052 172.31.23.72 -> 172.31.31.144 OpenFlow 74 Type: OFPT_BARRIER_REPLY
226 1.165238763 172.31.31.144 -> 172.31.23.72 OpenFlow 146 Type: OFPT_FLOW_MOD
227 1.165242334 172.31.31.144 -> 172.31.23.72 OpenFlow 146 Type: OFPT_FLOW_MOD
228 1.165244486 172.31.31.144 -> 172.31.23.72 OpenFlow 146 Type: OFPT_FLOW_MOD
229 1.165247533 172.31.31.144 -> 172.31.23.72 OpenFlow 154 Type: OFPT_BARRIER_REQUEST
230 1.165249449 172.31.31.144 -> 172.31.23.72 OpenFlow 146 Type: OFPT_FLOW_MOD
231 1.165256275 172.31.23.72 -> 172.31.31.144 OpenFlow 82 Type: OFPT_BARRIER_REPLY
232 1.165282296 172.31.23.72 -> 172.31.31.144 TCP 66 45528 → 6633 [ACK] Seq=49 Ack=233 Win=213 Len=0 TSval=30043844 TSecr=1222253
233 1.165287675 172.31.23.72 -> 172.31.31.144 OpenFlow 74 Type: OFPT_BARRIER_REPLY
234 1.165314696 172.31.23.72 -> 172.31.31.144 TCP 66 45512 → 6633 [ACK] Seq=9417 Ack=329 Win=213 Len=0 TSval=30043844 TSecr=1222253
235 1.165318901 172.31.23.72 -> 172.31.31.144 OpenFlow 74 Type: OFPT_BARRIER_REPLY
236 1.165354849 172.31.23.72 -> 172.31.31.144 OpenFlow 74 Type: OFPT_BARRIER_REPLY
237 1.165458534 172.31.23.72 -> 172.31.31.144 TCP 66 45552 → 6633 [ACK] Seq=49 Ack=233 Win=213 Len=0 TSval=30043844 TSecr=1222253
238 1.165463845 172.31.23.72 -> 172.31.31.144 OpenFlow 74 Type: OFPT_BARRIER_REPLY
239 1.165529195 172.31.23.72 -> 172.31.31.144 TCP 66 45550 → 6633 [ACK] Seq=49 Ack=233 Win=213 Len=0 TSval=30043845 TSecr=1222253
240 1.165534209 172.31.23.72 -> 172.31.31.144 OpenFlow 74 Type: OFPT_BARRIER_REPLY
241 1.165562390 172.31.23.72 -> 172.31.31.144 OpenFlow 74 Type: OFPT_BARRIER_REPLY
242 1.165581117 172.31.31.144 -> 172.31.23.72 OpenFlow 154 Type: OFPT_BARRIER_REQUEST
243 1.165585204 172.31.31.144 -> 172.31.23.72 OpenFlow 146 Type: OFPT_FLOW_MOD
244 1.165588907 172.31.31.144 -> 172.31.23.72 OpenFlow 154 Type: OFPT_BARRIER_REQUEST
245 1.165590514 172.31.31.144 -> 172.31.23.72 OpenFlow 146 Type: OFPT_FLOW_MOD
246 1.165593636 172.31.31.144 -> 172.31.23.72 OpenFlow 146 Type: OFPT_FLOW_MOD
247 1.165604333 172.31.31.144 -> 172.31.23.72 OpenFlow 154 Type: OFPT_BARRIER_REQUEST
248 1.165605910 172.31.31.144 -> 172.31.23.72 OpenFlow 146 Type: OFPT_FLOW_MOD
249 1.165607549 172.31.31.144 -> 172.31.23.72 OpenFlow 154 Type: OFPT_BARRIER_REQUEST
250 1.165609140 172.31.31.144 -> 172.31.23.72 OpenFlow 146 Type: OFPT_FLOW_MOD
251 1.165610718 172.31.31.144 -> 172.31.23.72 OpenFlow 154 Type: OFPT_BARRIER_REQUEST
252 1.165612267 172.31.31.144 -> 172.31.23.72 OpenFlow 146 Type: OFPT_FLOW_MOD
253 1.165614652 172.31.31.144 -> 172.31.23.72 OpenFlow 74 Type: OFPT_BARRIER_REQUEST
254 1.165616476 172.31.31.144 -> 172.31.23.72 OpenFlow 146 Type: OFPT_FLOW_MOD
255 1.165618353 172.31.31.144 -> 172.31.23.72 OpenFlow 146 Type: OFPT_FLOW_MOD
256 1.165619451 172.31.31.144 -> 172.31.23.72 OpenFlow 154 Type: OFPT_BARRIER_REQUEST
257 1.165621004 172.31.31.144 -> 172.31.23.72 OpenFlow 146 Type: OFPT_FLOW_MOD
258 1.165622625 172.31.31.144 -> 172.31.23.72 OpenFlow 146 Type: OFPT_FLOW_MOD
259 1.165631402 172.31.31.144 -> 172.31.23.72 OpenFlow 146 Type: OFPT_FLOW_MOD
260 1.165632694 172.31.31.144 -> 172.31.23.72 OpenFlow 154 Type: OFPT_BARRIER_REQUEST
261 1.165633831 172.31.31.144 -> 172.31.23.72 OpenFlow 74 Type: OFPT_BARRIER_REQUEST
262 1.165634854 172.31.31.144 -> 172.31.23.72 OpenFlow 242 Type: OFPT_BARRIER_REQUEST
263 1.165635924 172.31.31.144 -> 172.31.23.72 OpenFlow 234 Type: OFPT_BARRIER_REQUEST
264 1.165637089 172.31.31.144 -> 172.31.23.72 OpenFlow 146 Type: OFPT_FLOW_MOD
265 1.165670017 172.31.23.72 -> 172.31.31.144 TCP 66 45548 → 6633 [ACK] Seq=57 Ack=737 Win=213 Len=0 TSval=30043845 TSecr=1222253
266 1.165702951 172.31.23.72 -> 172.31.31.144 TCP 66 45520 → 6633 [ACK] Seq=8585 Ack=329 Win=213 Len=0 TSval=30043845 TSecr=1222253
267 1.165707125 172.31.23.72 -> 172.31.31.144 OpenFlow 74 Type: OFPT_BARRIER_REPLY
268 1.165931890 172.31.23.72 -> 172.31.31.144 OpenFlow 146 Type: OFPT_FLOW_REMOVED
269 1.165940657 172.31.23.72 -> 172.31.31.144 OpenFlow 546 Type: OFPT_FLOW_REMOVED
270 1.166125203 172.31.23.72 -> 172.31.31.144 OpenFlow 226 Type: OFPT_FLOW_REMOVED
271 1.166127954 172.31.23.72 -> 172.31.31.144 OpenFlow 226 Type: OFPT_FLOW_REMOVED
272 1.166129653 172.31.23.72 -> 172.31.31.144 OpenFlow 642 Type: OFPT_FLOW_REMOVED
273 1.166131214 172.31.23.72 -> 172.31.31.144 OpenFlow 226 Type: OFPT_FLOW_REMOVED
274 1.166364766 172.31.31.144 -> 172.31.23.72 OpenFlow 146 Type: OFPT_FLOW_MOD
275 1.166369521 172.31.31.144 -> 172.31.23.72 OpenFlow 146 Type: OFPT_FLOW_MOD
276 1.166371259 172.31.31.144 -> 172.31.23.72 OpenFlow 146 Type: OFPT_FLOW_MOD
277 1.166374390 172.31.31.144 -> 172.31.23.72 OpenFlow 146 Type: OFPT_FLOW_MOD
278 1.166375956 172.31.31.144 -> 172.31.23.72 OpenFlow 74 Type: OFPT_BARRIER_REQUEST
279 1.166377599 172.31.31.144 -> 172.31.23.72 OpenFlow 146 Type: OFPT_FLOW_MOD
280 1.166379150 172.31.31.144 -> 172.31.23.72 OpenFlow 74 Type: OFPT_BARRIER_REQUEST
281 1.166380541 172.31.31.144 -> 172.31.23.72 OpenFlow 146 Type: OFPT_FLOW_MOD
282 1.166381838 172.31.31.144 -> 172.31.23.72 OpenFlow 154 Type: OFPT_BARRIER_REQUEST
283 1.166384437 172.31.23.72 -> 172.31.31.144 OpenFlow 226 Type: OFPT_FLOW_REMOVED
284 1.166390055 172.31.31.144 -> 172.31.23.72 OpenFlow 146 Type: OFPT_FLOW_MOD
285 1.166392284 172.31.31.144 -> 172.31.23.72 OpenFlow 146 Type: OFPT_FLOW_MOD
286 1.166394818 172.31.31.144 -> 172.31.23.72 OpenFlow 146 Type: OFPT_FLOW_MOD
287 1.166396707 172.31.31.144 -> 172.31.23.72 OpenFlow 154 Type: OFPT_BARRIER_REQUEST
288 1.166398562 172.31.31.144 -> 172.31.23.72 OpenFlow 146 Type: OFPT_FLOW_MOD
289 1.166400023 172.31.31.144 -> 172.31.23.72 OpenFlow 994 Type: OFPT_BARRIER_REQUEST
290 1.166401664 172.31.31.144 -> 172.31.23.72 OpenFlow 74 Type: OFPT_BARRIER_REQUEST
291 1.166402703 172.31.31.144 -> 172.31.23.72 OpenFlow 146 Type: OFPT_FLOW_MOD
292 1.166404224 172.31.31.144 -> 172.31.23.72 OpenFlow 146 Type: OFPT_FLOW_MOD
293 1.166406611 172.31.31.144 -> 172.31.23.72 OpenFlow 146 Type: OFPT_FLOW_MOD
294 1.166407967 172.31.31.144 -> 172.31.23.72 OpenFlow 154 Type: OFPT_BARRIER_REQUEST
295 1.166409375 172.31.31.144 -> 172.31.23.72 OpenFlow 146 Type: OFPT_FLOW_MOD
296 1.166412261 172.31.31.144 -> 172.31.23.72 OpenFlow 74 Type: OFPT_BARRIER_REQUEST
297 1.166413467 172.31.31.144 -> 172.31.23.72 OpenFlow 1082 Type: OFPT_BARRIER_REQUEST
298 1.166415376 172.31.31.144 -> 172.31.23.72 OpenFlow 154 Type: OFPT_BARRIER_REQUEST
299 1.166416745 172.31.31.144 -> 172.31.23.72 OpenFlow 826 Type: OFPT_BARRIER_REQUEST
300 1.166418202 172.31.31.144 -> 172.31.23.72 TCP 66 6633 → 45512 [ACK] Seq=497 Ack=9425 Win=853 Len=0 TSval=1222253 TSecr=30043844
301 1.166420195 172.31.31.144 -> 172.31.23.72 TCP 66 6633 → 45528 [ACK] Seq=1073 Ack=57 Win=853 Len=0 TSval=1222253 TSecr=30043844
302 1.166425416 172.31.31.144 -> 172.31.23.72 TCP 66 6633 → 45552 [ACK] Seq=401 Ack=57 Win=853 Len=0 TSval=1222253 TSecr=30043844
303 1.166426935 172.31.31.144 -> 172.31.23.72 TCP 66 6633 → 45550 [ACK] Seq=401 Ack=57 Win=853 Len=0 TSval=1222253 TSecr=30043845
304 1.166439848 172.31.23.72 -> 172.31.31.144 OpenFlow 730 Type: OFPT_FLOW_REMOVED
305 1.166442250 172.31.23.72 -> 172.31.31.144 OpenFlow 226 Type: OFPT_FLOW_REMOVED
306 1.166613600 172.31.31.144 -> 172.31.23.72 OpenFlow 234 Type: OFPT_BARRIER_REQUEST
307 1.166617229 172.31.31.144 -> 172.31.23.72 TCP 66 6633 → 45524 [ACK] Seq=233 Ack=129 Win=853 Len=0 TSval=1222254 TSecr=30043845
308 1.166830749 172.31.31.144 -> 172.31.23.72 TCP 66 6633 → 45546 [ACK] Seq=1745 Ack=633 Win=853 Len=0 TSval=1222254 TSecr=30043844
309 1.166834015 172.31.31.144 -> 172.31.23.72 OpenFlow 170 Type: OFPT_FLOW_MOD
310 1.166836322 172.31.31.144 -> 172.31.23.72 OpenFlow 170 Type: OFPT_FLOW_MOD
311 1.166838455 172.31.31.144 -> 172.31.23.72 OpenFlow 178 Type: OFPT_BARRIER_REQUEST
312 1.166840110 172.31.31.144 -> 172.31.23.72 OpenFlow 170 Type: OFPT_FLOW_MOD
313 1.166841699 172.31.31.144 -> 172.31.23.72 OpenFlow 178 Type: OFPT_BARRIER_REQUEST
314 1.166843323 172.31.31.144 -> 172.31.23.72 OpenFlow 170 Type: OFPT_FLOW_MOD
315 1.166850602 172.31.31.144 -> 172.31.23.72 OpenFlow 178 Type: OFPT_BARRIER_REQUEST
316 1.166852733 172.31.31.144 -> 172.31.23.72 TCP 66 6633 → 45552 [ACK] Seq=401 Ack=217 Win=853 Len=0 TSval=1222254 TSecr=30043845
317 1.166854391 172.31.31.144 -> 172.31.23.72 TCP 66 6633 → 45512 [ACK] Seq=497 Ack=9585 Win=853 Len=0 TSval=1222254 TSecr=30043845
318 1.166856033 172.31.31.144 -> 172.31.23.72 OpenFlow 170 Type: OFPT_FLOW_MOD
319 1.166857430 172.31.31.144 -> 172.31.23.72 OpenFlow 74 Type: OFPT_BARRIER_REQUEST
320 1.166858810 172.31.31.144 -> 172.31.23.72 OpenFlow 170 Type: OFPT_FLOW_MOD
321 1.166993681 172.31.31.144 -> 172.31.23.72 OpenFlow 170 Type: OFPT_FLOW_MOD
322 1.166996039 172.31.31.144 -> 172.31.23.72 TCP 66 6633 → 45550 [ACK] Seq=401 Ack=217 Win=853 Len=0 TSval=1222254 TSecr=30043845
323 1.166998340 172.31.31.144 -> 172.31.23.72 OpenFlow 178 Type: OFPT_BARRIER_REQUEST
324 1.167000045 172.31.31.144 -> 172.31.23.72 OpenFlow 170 Type: OFPT_FLOW_MOD
325 1.167002305 172.31.31.144 -> 172.31.23.72 OpenFlow 170 Type: OFPT_FLOW_MOD
326 1.167005005 172.31.31.144 -> 172.31.23.72 TCP 66 6633 → 45520 [ACK] Seq=497 Ack=8753 Win=853 Len=0 TSval=1222254 TSecr=30043845
327 1.167007082 172.31.31.144 -> 172.31.23.72 OpenFlow 282 Type: OFPT_BARRIER_REQUEST
328 1.167008690 172.31.31.144 -> 172.31.23.72 OpenFlow 170 Type: OFPT_FLOW_MOD
329 1.167010961 172.31.31.144 -> 172.31.23.72 OpenFlow 178 Type: OFPT_BARRIER_REQUEST
330 1.167012686 172.31.31.144 -> 172.31.23.72 OpenFlow 170 Type: OFPT_FLOW_MOD
331 1.167018531 172.31.31.144 -> 172.31.23.72 OpenFlow 74 Type: OFPT_BARRIER_REQUEST
332 1.167034369 172.31.31.144 -> 172.31.23.72 OpenFlow 170 Type: OFPT_FLOW_MOD
333 1.167051808 172.31.31.144 -> 172.31.23.72 OpenFlow 178 Type: OFPT_BARRIER_REQUEST
334 1.167202514 172.31.31.144 -> 172.31.23.72 OpenFlow 170 Type: OFPT_FLOW_MOD
335 1.167255141 172.31.31.144 -> 172.31.23.72 OpenFlow 170 Type: OFPT_FLOW_MOD
336 1.167315346 172.31.31.144 -> 172.31.23.72 OpenFlow 170 Type: OFPT_FLOW_MOD
337 1.167317491 172.31.31.144 -> 172.31.23.72 OpenFlow 74 Type: OFPT_BARRIER_REQUEST
338 1.167342715 172.31.31.144 -> 172.31.23.72 OpenFlow 170 Type: OFPT_FLOW_MOD
339 1.167394199 172.31.31.144 -> 172.31.23.72 OpenFlow 178 Type: OFPT_BARRIER_REQUEST
340 1.167396525 172.31.31.144 -> 172.31.23.72 OpenFlow 170 Type: OFPT_FLOW_MOD
341 1.167519014 172.31.31.144 -> 172.31.23.72 OpenFlow 170 Type: OFPT_FLOW_MOD
342 1.167522294 172.31.31.144 -> 172.31.23.72 OpenFlow 170 Type: OFPT_FLOW_MOD
343 1.167524549 172.31.31.144 -> 172.31.23.72 OpenFlow 170 Type: OFPT_FLOW_MOD
344 1.167526483 172.31.31.144 -> 172.31.23.72 OpenFlow 170 Type: OFPT_FLOW_MOD
345 1.167528066 172.31.31.144 -> 172.31.23.72 OpenFlow 178 Type: OFPT_BARRIER_REQUEST
346 1.167529498 172.31.31.144 -> 172.31.23.72 OpenFlow 74 Type: OFPT_BARRIER_REQUEST
347 1.167530684 172.31.31.144 -> 172.31.23.72 OpenFlow 178 Type: OFPT_BARRIER_REQUEST
348 1.167532511 172.31.31.144 -> 172.31.23.72 OpenFlow 178 Type: OFPT_BARRIER_REQUEST
349 1.168521908 172.31.23.72 -> 172.31.31.144 OpenFlow 74 Type: OFPT_BARRIER_REPLY
350 1.168570009 172.31.23.72 -> 172.31.31.144 OpenFlow 74 Type: OFPT_BARRIER_REPLY
351 1.168588367 172.31.23.72 -> 172.31.31.144 OpenFlow 74 Type: OFPT_BARRIER_REPLY
352 1.168614660 172.31.23.72 -> 172.31.31.144 OpenFlow 82 Type: OFPT_BARRIER_REPLY
353 1.168641926 172.31.23.72 -> 172.31.31.144 OpenFlow 82 Type: OFPT_BARRIER_REPLY
354 1.168669052 172.31.23.72 -> 172.31.31.144 OpenFlow 74 Type: OFPT_BARRIER_REPLY
355 1.168719772 172.31.23.72 -> 172.31.31.144 OpenFlow 74 Type: OFPT_BARRIER_REPLY
356 1.168741826 172.31.23.72 -> 172.31.31.144 OpenFlow 74 Type: OFPT_BARRIER_REPLY
357 1.168783732 172.31.31.144 -> 172.31.23.72 TCP 66 6633 → 45546 [ACK] Seq=2065 Ack=649 Win=853 Len=0 TSval=1222254 TSecr=30043845
358 1.168802198 172.31.23.72 -> 172.31.31.144 TCP 66 45514 → 6633 [ACK] Seq=8681 Ack=329 Win=213 Len=0 TSval=30043845 TSecr=1222253
359 1.168811451 172.31.23.72 -> 172.31.31.144 OpenFlow 74 Type: OFPT_BARRIER_REPLY
360 1.168826267 172.31.31.144 -> 172.31.23.72 TCP 66 6633 → 45546 [ACK] Seq=2065 Ack=689 Win=853 Len=0 TSval=1222254 TSecr=30043845
361 1.168846610 172.31.23.72 -> 172.31.31.144 OpenFlow 74 Type: OFPT_BARRIER_REPLY
362 1.168893492 172.31.31.144 -> 172.31.23.72 TCP 66 6633 → 45530 [ACK] Seq=497 Ack=57 Win=853 Len=0 TSval=1222254 TSecr=30043845
363 1.168913720 172.31.23.72 -> 172.31.31.144 OpenFlow 98 Type: OFPT_BARRIER_REPLY
364 1.168937754 172.31.23.72 -> 172.31.31.144 OpenFlow 74 Type: OFPT_BARRIER_REPLY
365 1.168988205 172.31.31.144 -> 172.31.23.72 TCP 66 6633 → 45530 [ACK] Seq=497 Ack=65 Win=853 Len=0 TSval=1222254 TSecr=30043845
366 1.168998234 172.31.23.72 -> 172.31.31.144 OpenFlow 82 Type: OFPT_BARRIER_REPLY
367 1.169017324 172.31.23.72 -> 172.31.31.144 OpenFlow 74 Type: OFPT_BARRIER_REPLY
368 1.169027091 172.31.31.144 -> 172.31.23.72 TCP 66 6633 → 45514 [ACK] Seq=329 Ack=8689 Win=853 Len=0 TSval=1222254 TSecr=30043845
369 1.169051850 172.31.23.72 -> 172.31.31.144 OpenFlow 74 Type: OFPT_BARRIER_REPLY
370 1.169090003 172.31.23.72 -> 172.31.31.144 OpenFlow 74 Type: OFPT_BARRIER_REPLY
371 1.169095136 172.31.31.144 -> 172.31.23.72 TCP 66 6633 → 45528 [ACK] Seq=1721 Ack=257 Win=853 Len=0 TSval=1222254 TSecr=30043845
372 1.169134141 172.31.23.72 -> 172.31.31.144 OpenFlow 90 Type: OFPT_BARRIER_REPLY
373 1.169149280 172.31.23.72 -> 172.31.31.144 TCP 66 45538 → 6633 [ACK] Seq=49 Ack=281 Win=213 Len=0 TSval=30043845 TSecr=1222254
374 1.169160572 172.31.23.72 -> 172.31.31.144 OpenFlow 74 Type: OFPT_BARRIER_REPLY
375 1.169185050 172.31.23.72 -> 172.31.31.144 TCP 66 45532 → 6633 [ACK] Seq=49 Ack=281 Win=213 Len=0 TSval=30043845 TSecr=1222254
376 1.169188894 172.31.23.72 -> 172.31.31.144 OpenFlow 74 Type: OFPT_BARRIER_REPLY
377 1.169198507 172.31.23.72 -> 172.31.31.144 TCP 66 45544 → 6633 [ACK] Seq=713 Ack=2497 Win=210 Len=0 TSval=30043845 TSecr=1222253
378 1.169207438 172.31.23.72 -> 172.31.31.144 OpenFlow 74 Type: OFPT_BARRIER_REPLY
379 1.169215963 172.31.31.144 -> 172.31.23.72 TCP 66 6633 → 45528 [ACK] Seq=1721 Ack=281 Win=853 Len=0 TSval=1222254 TSecr=30043845
380 1.169219841 172.31.31.144 -> 172.31.23.72 TCP 66 6633 → 45518 [ACK] Seq=1001 Ack=9841 Win=853 Len=0 TSval=1222254 TSecr=30043845
381 1.169326945 172.31.23.72 -> 172.31.31.144 OpenFlow 74 Type: OFPT_BARRIER_REPLY
382 1.169356592 172.31.23.72 -> 172.31.31.144 OpenFlow 74 Type: OFPT_BARRIER_REPLY
383 1.169387339 172.31.23.72 -> 172.31.31.144 TCP 66 45540 → 6633 [ACK] Seq=49 Ack=281 Win=213 Len=0 TSval=30043845 TSecr=1222254
