  1 0.000000000 172.31.31.144 -> 172.31.23.72 TCP 187 6633 → 45452 [PSH, ACK] Seq=1 Ack=1 Win=853 Len=121 TSval=818381 TSecr=19387850
  2 0.000035589 172.31.31.144 -> 172.31.23.72 TCP 187 6633 → 45452 [PSH, ACK] Seq=122 Ack=1 Win=853 Len=121 TSval=818381 TSecr=19387850
  3 0.000048309 172.31.31.144 -> 172.31.23.72 TCP 187 6633 → 45452 [PSH, ACK] Seq=243 Ack=1 Win=853 Len=121 TSval=818381 TSecr=19387850
  4 0.000068002 172.31.31.144 -> 172.31.23.72 TCP 187 6633 → 45452 [PSH, ACK] Seq=364 Ack=1 Win=853 Len=121 TSval=818381 TSecr=19387850
  5 0.000130740 172.31.31.144 -> 172.31.23.72 TCP 187 6633 → 45452 [PSH, ACK] Seq=485 Ack=1 Win=853 Len=121 TSval=818381 TSecr=19387850
  6 0.000193537 172.31.31.144 -> 172.31.23.72 TCP 187 6633 → 45452 [PSH, ACK] Seq=606 Ack=1 Win=853 Len=121 TSval=818381 TSecr=19387850
  7 0.000263093 172.31.31.144 -> 172.31.23.72 TCP 187 6633 → 45452 [PSH, ACK] Seq=727 Ack=1 Win=853 Len=121 TSval=818381 TSecr=19387850
  8 0.000321185 172.31.31.144 -> 172.31.23.72 TCP 187 6633 → 45452 [PSH, ACK] Seq=848 Ack=1 Win=853 Len=121 TSval=818381 TSecr=19387850
  9 0.000497575 172.31.31.144 -> 172.31.23.72 TCP 187 6633 → 45462 [PSH, ACK] Seq=1 Ack=1 Win=853 Len=121 TSval=818381 TSecr=19388001
 10 0.000504076 172.31.31.144 -> 172.31.23.72 TCP 187 6633 → 45462 [PSH, ACK] Seq=122 Ack=1 Win=853 Len=121 TSval=818381 TSecr=19388001
 11 0.000506117 172.31.31.144 -> 172.31.23.72 TCP 187 6633 → 45462 [PSH, ACK] Seq=243 Ack=1 Win=853 Len=121 TSval=818382 TSecr=19388001
 12 0.000556206 172.31.23.72 -> 172.31.31.144 TCP 66 45452 → 6633 [ACK] Seq=1 Ack=969 Win=213 Len=0 TSval=19388506 TSecr=818381
 13 0.000604741 172.31.31.144 -> 172.31.23.72 TCP 187 6633 → 45462 [PSH, ACK] Seq=364 Ack=1 Win=853 Len=121 TSval=818382 TSecr=19388001
 14 0.000678685 172.31.31.144 -> 172.31.23.72 TCP 187 6633 → 45462 [PSH, ACK] Seq=485 Ack=1 Win=853 Len=121 TSval=818382 TSecr=19388001
 15 0.000745985 172.31.31.144 -> 172.31.23.72 TCP 187 6633 → 45462 [PSH, ACK] Seq=606 Ack=1 Win=853 Len=121 TSval=818382 TSecr=19388001
 16 0.000807028 172.31.31.144 -> 172.31.23.72 TCP 187 6633 → 45436 [PSH, ACK] Seq=1 Ack=1 Win=853 Len=121 TSval=818382 TSecr=19387758
 17 0.000859797 172.31.31.144 -> 172.31.23.72 TCP 187 6633 → 45436 [PSH, ACK] Seq=122 Ack=1 Win=853 Len=121 TSval=818382 TSecr=19387758
 18 0.000907456 172.31.31.144 -> 172.31.23.72 TCP 187 6633 → 45436 [PSH, ACK] Seq=243 Ack=1 Win=853 Len=121 TSval=818382 TSecr=19387758
 19 0.000935322 172.31.23.72 -> 172.31.31.144 TCP 66 45462 → 6633 [ACK] Seq=1 Ack=727 Win=213 Len=0 TSval=19388506 TSecr=818381
 20 0.000966740 172.31.31.144 -> 172.31.23.72 TCP 187 6633 → 45436 [PSH, ACK] Seq=364 Ack=1 Win=853 Len=121 TSval=818382 TSecr=19387758
 21 0.001018432 172.31.31.144 -> 172.31.23.72 TCP 187 6633 → 45436 [PSH, ACK] Seq=485 Ack=1 Win=853 Len=121 TSval=818382 TSecr=19387758
 22 0.001082468 172.31.31.144 -> 172.31.23.72 TCP 187 6633 → 45436 [PSH, ACK] Seq=606 Ack=1 Win=853 Len=121 TSval=818382 TSecr=19387758
 23 0.001144922 172.31.31.144 -> 172.31.23.72 TCP 187 6633 → 45436 [PSH, ACK] Seq=727 Ack=1 Win=853 Len=121 TSval=818382 TSecr=19387758
 24 0.001182459 172.31.31.144 -> 172.31.23.72 TCP 187 6633 → 45436 [PSH, ACK] Seq=848 Ack=1 Win=853 Len=121 TSval=818382 TSecr=19387758
 25 0.001356887 172.31.23.72 -> 172.31.31.144 TCP 66 45436 → 6633 [ACK] Seq=1 Ack=969 Win=213 Len=0 TSval=19388506 TSecr=818382
 26 0.001439676 172.31.23.72 -> 172.31.31.144 OpenFlow 189 Type: OFPT_PACKET_IN
 27 0.001463544 172.31.23.72 -> 172.31.31.144 OpenFlow 189 Type: OFPT_PACKET_IN
 28 0.001489033 172.31.23.72 -> 172.31.31.144 OpenFlow 189 Type: OFPT_PACKET_IN
 29 0.001506463 172.31.23.72 -> 172.31.31.144 OpenFlow 189 Type: OFPT_PACKET_IN
 30 0.001515842 172.31.23.72 -> 172.31.31.144 OpenFlow 189 Type: OFPT_PACKET_IN
 31 0.001533942 172.31.23.72 -> 172.31.31.144 OpenFlow 189 Type: OFPT_PACKET_IN
 32 0.001552094 172.31.23.72 -> 172.31.31.144 OpenFlow 189 Type: OFPT_PACKET_IN
 33 0.001554402 172.31.23.72 -> 172.31.31.144 OpenFlow 435 Type: OFPT_PACKET_IN
 34 0.001584235 172.31.23.72 -> 172.31.31.144 OpenFlow 189 Type: OFPT_PACKET_IN
 35 0.001621547 172.31.31.144 -> 172.31.23.72 TCP 66 6633 → 45434 [ACK] Seq=1 Ack=124 Win=853 Len=0 TSval=818382 TSecr=19388506
 36 0.001628044 172.31.31.144 -> 172.31.23.72 TCP 66 6633 → 45434 [ACK] Seq=1 Ack=247 Win=853 Len=0 TSval=818382 TSecr=19388506
 37 0.001633784 172.31.23.72 -> 172.31.31.144 OpenFlow 189 Type: OFPT_PACKET_IN
 38 0.001639817 172.31.23.72 -> 172.31.31.144 OpenFlow 189 Type: OFPT_PACKET_IN
 39 0.001657103 172.31.23.72 -> 172.31.31.144 OpenFlow 189 Type: OFPT_PACKET_IN
 40 0.001659838 172.31.23.72 -> 172.31.31.144 OpenFlow 189 Type: OFPT_PACKET_IN
 41 0.001673987 172.31.23.72 -> 172.31.31.144 OpenFlow 189 Type: OFPT_PACKET_IN
 42 0.001763665 172.31.31.144 -> 172.31.23.72 TCP 66 6633 → 45444 [ACK] Seq=1 Ack=124 Win=853 Len=0 TSval=818382 TSecr=19388506
 43 0.001769333 172.31.31.144 -> 172.31.23.72 TCP 66 6633 → 45444 [ACK] Seq=1 Ack=247 Win=853 Len=0 TSval=818382 TSecr=19388506
 44 0.001771251 172.31.31.144 -> 172.31.23.72 TCP 66 6633 → 45438 [ACK] Seq=1 Ack=124 Win=853 Len=0 TSval=818382 TSecr=19388506
 45 0.001776289 172.31.23.72 -> 172.31.31.144 OpenFlow 189 Type: OFPT_PACKET_IN
 46 0.001782950 172.31.23.72 -> 172.31.31.144 OpenFlow 189 Type: OFPT_PACKET_IN
 47 0.001884011 172.31.23.72 -> 172.31.31.144 OpenFlow 189 Type: OFPT_PACKET_IN
 48 0.001886249 172.31.23.72 -> 172.31.31.144 OpenFlow 189 Type: OFPT_PACKET_IN
 49 0.001892578 172.31.31.144 -> 172.31.23.72 TCP 66 6633 → 45438 [ACK] Seq=1 Ack=493 Win=853 Len=0 TSval=818382 TSecr=19388506
 50 0.001896350 172.31.31.144 -> 172.31.23.72 TCP 66 6633 → 45450 [ACK] Seq=1 Ack=124 Win=853 Len=0 TSval=818382 TSecr=19388506
 51 0.001899239 172.31.31.144 -> 172.31.23.72 TCP 66 6633 → 45432 [ACK] Seq=1 Ack=124 Win=853 Len=0 TSval=818382 TSecr=19388506
 52 0.001989570 172.31.31.144 -> 172.31.23.72 TCP 66 6633 → 45454 [ACK] Seq=1 Ack=124 Win=853 Len=0 TSval=818382 TSecr=19388506
 53 0.001992138 172.31.31.144 -> 172.31.23.72 TCP 66 6633 → 45450 [ACK] Seq=1 Ack=247 Win=853 Len=0 TSval=818382 TSecr=19388506
 54 0.002018040 172.31.31.144 -> 172.31.23.72 TCP 66 6633 → 45432 [ACK] Seq=1 Ack=247 Win=853 Len=0 TSval=818382 TSecr=19388506
 55 0.002078949 172.31.31.144 -> 172.31.23.72 TCP 66 6633 → 45454 [ACK] Seq=1 Ack=247 Win=853 Len=0 TSval=818382 TSecr=19388506
 56 0.004960803 172.31.31.144 -> 172.31.23.72 TCP 66 6633 → 45442 [ACK] Seq=1 Ack=247 Win=853 Len=0 TSval=818383 TSecr=19388506
 57 0.005436144 172.31.31.144 -> 172.31.23.72 TCP 66 6633 → 45430 [ACK] Seq=1 Ack=247 Win=853 Len=0 TSval=818383 TSecr=19388506
 58 0.005439133 172.31.31.144 -> 172.31.23.72 TCP 66 6633 → 45448 [ACK] Seq=1 Ack=247 Win=853 Len=0 TSval=818383 TSecr=19388506
 59 0.111298841 172.31.31.144 -> 172.31.23.72 TCP 187 6633 → 45420 [PSH, ACK] Seq=1 Ack=1 Win=853 Len=121 TSval=818409 TSecr=19387806
 60 0.111323431 172.31.31.144 -> 172.31.23.72 TCP 187 6633 → 45420 [PSH, ACK] Seq=122 Ack=1 Win=853 Len=121 TSval=818409 TSecr=19387806
 61 0.111327123 172.31.31.144 -> 172.31.23.72 TCP 187 6633 → 45420 [PSH, ACK] Seq=243 Ack=1 Win=853 Len=121 TSval=818409 TSecr=19387806
 62 0.111343644 172.31.31.144 -> 172.31.23.72 TCP 187 6633 → 45420 [PSH, ACK] Seq=364 Ack=1 Win=853 Len=121 TSval=818409 TSecr=19387806
 63 0.111402664 172.31.31.144 -> 172.31.23.72 TCP 187 6633 → 45420 [PSH, ACK] Seq=485 Ack=1 Win=853 Len=121 TSval=818409 TSecr=19387806
 64 0.111476122 172.31.31.144 -> 172.31.23.72 TCP 187 6633 → 45420 [PSH, ACK] Seq=606 Ack=1 Win=853 Len=121 TSval=818409 TSecr=19387806
 65 0.111550421 172.31.31.144 -> 172.31.23.72 TCP 187 6633 → 45420 [PSH, ACK] Seq=727 Ack=1 Win=853 Len=121 TSval=818409 TSecr=19387806
 66 0.111610252 172.31.31.144 -> 172.31.23.72 TCP 187 6633 → 45420 [PSH, ACK] Seq=848 Ack=1 Win=853 Len=121 TSval=818409 TSecr=19387806
 67 0.111736972 172.31.31.144 -> 172.31.23.72 TCP 187 6633 → 45424 [PSH, ACK] Seq=1 Ack=1 Win=853 Len=121 TSval=818409 TSecr=19387806
 68 0.111755857 172.31.31.144 -> 172.31.23.72 TCP 187 6633 → 45424 [PSH, ACK] Seq=122 Ack=1 Win=853 Len=121 TSval=818409 TSecr=19387806
 69 0.111820193 172.31.31.144 -> 172.31.23.72 TCP 187 6633 → 45424 [PSH, ACK] Seq=243 Ack=1 Win=853 Len=121 TSval=818409 TSecr=19387806
 70 0.111873180 172.31.31.144 -> 172.31.23.72 TCP 187 6633 → 45424 [PSH, ACK] Seq=364 Ack=1 Win=853 Len=121 TSval=818409 TSecr=19387806
 71 0.111901110 172.31.23.72 -> 172.31.31.144 TCP 66 45420 → 6633 [ACK] Seq=1 Ack=969 Win=213 Len=0 TSval=19388534 TSecr=818409
 72 0.111944437 172.31.31.144 -> 172.31.23.72 TCP 187 6633 → 45424 [PSH, ACK] Seq=485 Ack=1 Win=853 Len=121 TSval=818409 TSecr=19387806
 73 0.112003905 172.31.31.144 -> 172.31.23.72 TCP 187 6633 → 45424 [PSH, ACK] Seq=606 Ack=1 Win=853 Len=121 TSval=818409 TSecr=19387806
 74 0.112062809 172.31.31.144 -> 172.31.23.72 TCP 187 6633 → 45424 [PSH, ACK] Seq=727 Ack=1 Win=853 Len=121 TSval=818409 TSecr=19387806
 75 0.112131079 172.31.31.144 -> 172.31.23.72 TCP 187 6633 → 45424 [PSH, ACK] Seq=848 Ack=1 Win=853 Len=121 TSval=818409 TSecr=19387806
 76 0.112190737 172.31.31.144 -> 172.31.23.72 TCP 187 6633 → 45424 [PSH, ACK] Seq=969 Ack=1 Win=853 Len=121 TSval=818409 TSecr=19387806
 77 0.112249199 172.31.31.144 -> 172.31.23.72 TCP 187 6633 → 45424 [PSH, ACK] Seq=1090 Ack=1 Win=853 Len=121 TSval=818409 TSecr=19387806
 78 0.112333110 172.31.31.144 -> 172.31.23.72 OpenFlow 187 Type: OFPT_PACKET_OUT
 79 0.112366170 172.31.31.144 -> 172.31.23.72 OpenFlow 187 Type: OFPT_PACKET_OUT
 80 0.112439943 172.31.31.144 -> 172.31.23.72 OpenFlow 187 Type: OFPT_PACKET_OUT
 81 0.112477718 172.31.23.72 -> 172.31.31.144 TCP 66 45424 → 6633 [ACK] Seq=1 Ack=1211 Win=213 Len=0 TSval=19388534 TSecr=818409
 82 0.112514266 172.31.31.144 -> 172.31.23.72 OpenFlow 187 Type: OFPT_PACKET_OUT
 83 0.112565564 172.31.23.72 -> 172.31.31.144 OpenFlow 189 Type: OFPT_PACKET_IN
 84 0.112576708 172.31.31.144 -> 172.31.23.72 OpenFlow 187 Type: OFPT_PACKET_OUT
 85 0.112592752 172.31.23.72 -> 172.31.31.144 OpenFlow 189 Type: OFPT_PACKET_IN
 86 0.112634543 172.31.23.72 -> 172.31.31.144 OpenFlow 189 Type: OFPT_PACKET_IN
 87 0.112656449 172.31.23.72 -> 172.31.31.144 OpenFlow 189 Type: OFPT_PACKET_IN
 88 0.112671754 172.31.23.72 -> 172.31.31.144 OpenFlow 189 Type: OFPT_PACKET_IN
 89 0.112686193 172.31.31.144 -> 172.31.23.72 OpenFlow 187 Type: OFPT_PACKET_OUT
 90 0.112714894 172.31.23.72 -> 172.31.31.144 OpenFlow 189 Type: OFPT_PACKET_IN
 91 0.112720689 172.31.23.72 -> 172.31.31.144 OpenFlow 189 Type: OFPT_PACKET_IN
 92 0.112737962 172.31.23.72 -> 172.31.31.144 OpenFlow 189 Type: OFPT_PACKET_IN
 93 0.112767982 172.31.23.72 -> 172.31.31.144 OpenFlow 189 Type: OFPT_PACKET_IN
 94 0.112770708 172.31.23.72 -> 172.31.31.144 OpenFlow 189 Type: OFPT_PACKET_IN
 95 0.112785016 172.31.23.72 -> 172.31.31.144 OpenFlow 189 Type: OFPT_PACKET_IN
 96 0.112830932 172.31.31.144 -> 172.31.23.72 OpenFlow 187 Type: OFPT_PACKET_OUT
 97 0.112835215 172.31.31.144 -> 172.31.23.72 TCP 66 6633 → 45418 [ACK] Seq=1 Ack=247 Win=853 Len=0 TSval=818410 TSecr=19388534
 98 0.112840685 172.31.31.144 -> 172.31.23.72 OpenFlow 187 Type: OFPT_PACKET_OUT
 99 0.112918717 172.31.23.72 -> 172.31.31.144 OpenFlow 189 Type: OFPT_PACKET_IN
100 0.112975293 172.31.23.72 -> 172.31.31.144 OpenFlow 189 Type: OFPT_PACKET_IN
101 0.112978279 172.31.23.72 -> 172.31.31.144 OpenFlow 189 Type: OFPT_PACKET_IN
102 0.113015085 172.31.31.144 -> 172.31.23.72 OpenFlow 187 Type: OFPT_PACKET_OUT
103 0.113021729 172.31.23.72 -> 172.31.31.144 OpenFlow 189 Type: OFPT_PACKET_IN
104 0.113032831 172.31.31.144 -> 172.31.23.72 OpenFlow 187 Type: OFPT_PACKET_OUT
105 0.113037120 172.31.23.72 -> 172.31.31.144 OpenFlow 189 Type: OFPT_PACKET_IN
106 0.113097413 172.31.31.144 -> 172.31.23.72 TCP 66 6633 → 45426 [ACK] Seq=1 Ack=124 Win=853 Len=0 TSval=818410 TSecr=19388534
107 0.113103966 172.31.31.144 -> 172.31.23.72 TCP 66 6633 → 45414 [ACK] Seq=1 Ack=124 Win=853 Len=0 TSval=818410 TSecr=19388534
108 0.113149830 172.31.31.144 -> 172.31.23.72 TCP 66 6633 → 45422 [ACK] Seq=1 Ack=124 Win=853 Len=0 TSval=818410 TSecr=19388534
109 0.113154951 172.31.31.144 -> 172.31.23.72 TCP 66 6633 → 45430 [ACK] Seq=1 Ack=493 Win=853 Len=0 TSval=818410 TSecr=19388534
110 0.113199539 172.31.31.144 -> 172.31.23.72 TCP 66 6633 → 45414 [ACK] Seq=1 Ack=247 Win=853 Len=0 TSval=818410 TSecr=19388534
111 0.113204268 172.31.31.144 -> 172.31.23.72 TCP 66 6633 → 45426 [ACK] Seq=1 Ack=247 Win=853 Len=0 TSval=818410 TSecr=19388534
112 0.113205947 172.31.31.144 -> 172.31.23.72 TCP 66 6633 → 45434 [ACK] Seq=1211 Ack=370 Win=853 Len=0 TSval=818410 TSecr=19388534
113 0.113227281 172.31.31.144 -> 172.31.23.72 TCP 66 6633 → 45422 [ACK] Seq=1 Ack=247 Win=853 Len=0 TSval=818410 TSecr=19388534
114 0.113282649 172.31.31.144 -> 172.31.23.72 TCP 66 6633 → 45416 [ACK] Seq=1 Ack=247 Win=853 Len=0 TSval=818410 TSecr=19388534
115 0.113368012 172.31.31.144 -> 172.31.23.72 OpenFlow 187 Type: OFPT_PACKET_OUT
116 0.113396260 172.31.31.144 -> 172.31.23.72 OpenFlow 550 Type: OFPT_PACKET_OUT
117 0.113439746 172.31.31.144 -> 172.31.23.72 TCP 66 6633 → 45428 [ACK] Seq=1 Ack=247 Win=853 Len=0 TSval=818410 TSecr=19388534
118 0.113452376 172.31.31.144 -> 172.31.23.72 OpenFlow 187 Type: OFPT_PACKET_OUT
119 0.113559968 172.31.23.72 -> 172.31.31.144 OpenFlow 189 Type: OFPT_PACKET_IN
120 0.113588776 172.31.31.144 -> 172.31.23.72 TCP 66 6633 → 45434 [ACK] Seq=1211 Ack=493 Win=853 Len=0 TSval=818410 TSecr=19388534
121 0.113596124 172.31.23.72 -> 172.31.31.144 OpenFlow 189 Type: OFPT_PACKET_IN
122 0.113741635 172.31.31.144 -> 172.31.23.72 TCP 66 6633 → 45424 [ACK] Seq=1211 Ack=124 Win=853 Len=0 TSval=818410 TSecr=19388534
123 0.113756925 172.31.31.144 -> 172.31.23.72 TCP 66 6633 → 45424 [ACK] Seq=1211 Ack=247 Win=853 Len=0 TSval=818410 TSecr=19388534
124 0.113814490 172.31.23.72 -> 172.31.31.144 TCP 66 45418 → 6633 [ACK] Seq=247 Ack=727 Win=213 Len=0 TSval=19388534 TSecr=818410
125 0.113865043 172.31.23.72 -> 172.31.31.144 OpenFlow 189 Type: OFPT_PACKET_IN
126 0.113900808 172.31.23.72 -> 172.31.31.144 OpenFlow 189 Type: OFPT_PACKET_IN
127 0.113910891 172.31.31.144 -> 172.31.23.72 OpenFlow 187 Type: OFPT_PACKET_OUT
128 0.113931353 172.31.23.72 -> 172.31.31.144 OpenFlow 189 Type: OFPT_PACKET_IN
129 0.113951213 172.31.23.72 -> 172.31.31.144 OpenFlow 189 Type: OFPT_PACKET_IN
130 0.113961456 172.31.23.72 -> 172.31.31.144 OpenFlow 189 Type: OFPT_PACKET_IN
131 0.113993582 172.31.23.72 -> 172.31.31.144 OpenFlow 189 Type: OFPT_PACKET_IN
132 0.114016079 172.31.31.144 -> 172.31.23.72 OpenFlow 187 Type: OFPT_PACKET_OUT
133 0.114030856 172.31.23.72 -> 172.31.31.144 OpenFlow 189 Type: OFPT_PACKET_IN
134 0.114039614 172.31.31.144 -> 172.31.23.72 TCP 66 6633 → 45450 [ACK] Seq=1 Ack=370 Win=853 Len=0 TSval=818410 TSecr=19388534
135 0.114043283 172.31.31.144 -> 172.31.23.72 TCP 66 6633 → 45450 [ACK] Seq=1 Ack=493 Win=853 Len=0 TSval=818410 TSecr=19388535
136 0.114053812 172.31.23.72 -> 172.31.31.144 OpenFlow 189 Type: OFPT_PACKET_IN
137 0.114107955 172.31.31.144 -> 172.31.23.72 OpenFlow 187 Type: OFPT_PACKET_OUT
138 0.114125191 172.31.31.144 -> 172.31.23.72 TCP 66 6633 → 45430 [ACK] Seq=1 Ack=739 Win=853 Len=0 TSval=818410 TSecr=19388535
139 0.114172301 172.31.31.144 -> 172.31.23.72 OpenFlow 187 Type: OFPT_PACKET_OUT
140 0.114188115 172.31.23.72 -> 172.31.31.144 OpenFlow 189 Type: OFPT_PACKET_IN
141 0.114207007 172.31.31.144 -> 172.31.23.72 TCP 66 6633 → 45442 [ACK] Seq=1 Ack=493 Win=853 Len=0 TSval=818410 TSecr=19388535
142 0.114212938 172.31.23.72 -> 172.31.31.144 OpenFlow 189 Type: OFPT_PACKET_IN
143 0.114223949 172.31.23.72 -> 172.31.31.144 OpenFlow 189 Type: OFPT_PACKET_IN
144 0.114259036 172.31.23.72 -> 172.31.31.144 OpenFlow 189 Type: OFPT_PACKET_IN
145 0.114287307 172.31.31.144 -> 172.31.23.72 OpenFlow 187 Type: OFPT_PACKET_OUT
146 0.114338008 172.31.31.144 -> 172.31.23.72 OpenFlow 187 Type: OFPT_PACKET_OUT
147 0.114363766 172.31.31.144 -> 172.31.23.72 TCP 66 6633 → 45416 [ACK] Seq=1 Ack=493 Win=853 Len=0 TSval=818410 TSecr=19388535
148 0.114421310 172.31.31.144 -> 172.31.23.72 TCP 66 6633 → 45436 [ACK] Seq=969 Ack=247 Win=853 Len=0 TSval=818410 TSecr=19388535
149 0.114426887 172.31.31.144 -> 172.31.23.72 TCP 66 6633 → 45420 [ACK] Seq=969 Ack=124 Win=853 Len=0 TSval=818410 TSecr=19388535
150 0.114428809 172.31.31.144 -> 172.31.23.72 TCP 66 6633 → 45420 [ACK] Seq=969 Ack=247 Win=853 Len=0 TSval=818410 TSecr=19388535
151 0.114430563 172.31.31.144 -> 172.31.23.72 OpenFlow 187 Type: OFPT_PACKET_OUT
152 0.114457180 172.31.31.144 -> 172.31.23.72 OpenFlow 187 Type: OFPT_PACKET_OUT
153 0.114476999 172.31.23.72 -> 172.31.31.144 TCP 66 45418 → 6633 [ACK] Seq=247 Ack=1211 Win=213 Len=0 TSval=19388535 TSecr=818410
154 0.114611782 172.31.31.144 -> 172.31.23.72 OpenFlow 187 Type: OFPT_PACKET_OUT
155 0.114715178 172.31.23.72 -> 172.31.31.144 TCP 66 45444 → 6633 [ACK] Seq=247 Ack=606 Win=213 Len=0 TSval=19388535 TSecr=818410
156 0.114794555 172.31.31.144 -> 172.31.23.72 OpenFlow 187 Type: OFPT_PACKET_OUT
157 0.114821133 172.31.23.72 -> 172.31.31.144 OpenFlow 189 Type: OFPT_PACKET_IN
158 0.114846116 172.31.23.72 -> 172.31.31.144 OpenFlow 189 Type: OFPT_PACKET_IN
159 0.114874250 172.31.31.144 -> 172.31.23.72 OpenFlow 187 Type: OFPT_PACKET_OUT
160 0.114891037 172.31.23.72 -> 172.31.31.144 OpenFlow 189 Type: OFPT_PACKET_IN
161 0.114907295 172.31.23.72 -> 172.31.31.144 OpenFlow 189 Type: OFPT_PACKET_IN
162 0.114915858 172.31.23.72 -> 172.31.31.144 OpenFlow 189 Type: OFPT_PACKET_IN
163 0.114930631 172.31.31.144 -> 172.31.23.72 OpenFlow 187 Type: OFPT_PACKET_OUT
164 0.114934706 172.31.23.72 -> 172.31.31.144 OpenFlow 189 Type: OFPT_PACKET_IN
165 0.114991670 172.31.31.144 -> 172.31.23.72 TCP 66 6633 → 45446 [ACK] Seq=1 Ack=124 Win=853 Len=0 TSval=818410 TSecr=19388535
166 0.114997224 172.31.31.144 -> 172.31.23.72 OpenFlow 187 Type: OFPT_PACKET_OUT
167 0.115001869 172.31.23.72 -> 172.31.31.144 OpenFlow 189 Type: OFPT_PACKET_IN
168 0.115007609 172.31.23.72 -> 172.31.31.144 OpenFlow 189 Type: OFPT_PACKET_IN
169 0.115018041 172.31.31.144 -> 172.31.23.72 TCP 66 6633 → 45446 [ACK] Seq=1 Ack=247 Win=853 Len=0 TSval=818410 TSecr=19388535
170 0.115073346 172.31.31.144 -> 172.31.23.72 OpenFlow 187 Type: OFPT_PACKET_OUT
171 0.115076722 172.31.31.144 -> 172.31.23.72 TCP 66 6633 → 45442 [ACK] Seq=1 Ack=739 Win=853 Len=0 TSval=818410 TSecr=19388535
172 0.115079376 172.31.31.144 -> 172.31.23.72 TCP 66 6633 → 45426 [ACK] Seq=1 Ack=370 Win=853 Len=0 TSval=818410 TSecr=19388535
173 0.115083966 172.31.23.72 -> 172.31.31.144 OpenFlow 189 Type: OFPT_PACKET_IN
174 0.115104143 172.31.31.144 -> 172.31.23.72 TCP 66 6633 → 45422 [ACK] Seq=1 Ack=370 Win=853 Len=0 TSval=818410 TSecr=19388535
175 0.115135851 172.31.31.144 -> 172.31.23.72 OpenFlow 187 Type: OFPT_PACKET_OUT
176 0.115140071 172.31.31.144 -> 172.31.23.72 TCP 66 6633 → 45426 [ACK] Seq=1 Ack=493 Win=853 Len=0 TSval=818410 TSecr=19388535
177 0.115167642 172.31.31.144 -> 172.31.23.72 TCP 66 6633 → 45422 [ACK] Seq=1 Ack=493 Win=853 Len=0 TSval=818410 TSecr=19388535
178 0.115171414 172.31.31.144 -> 172.31.23.72 OpenFlow 187 Type: OFPT_PACKET_OUT
179 0.115232014 172.31.31.144 -> 172.31.23.72 OpenFlow 187 Type: OFPT_PACKET_OUT
180 0.115346899 172.31.23.72 -> 172.31.31.144 TCP 66 45444 → 6633 [ACK] Seq=247 Ack=1211 Win=213 Len=0 TSval=19388535 TSecr=818410
181 0.115494784 172.31.31.144 -> 172.31.23.72 OpenFlow 187 Type: OFPT_PACKET_OUT
182 0.115551251 172.31.23.72 -> 172.31.31.144 TCP 66 45438 → 6633 [ACK] Seq=493 Ack=485 Win=213 Len=0 TSval=19388535 TSecr=818410
183 0.115652781 172.31.23.72 -> 172.31.31.144 OpenFlow 189 Type: OFPT_PACKET_IN
184 0.115675750 172.31.23.72 -> 172.31.31.144 OpenFlow 189 Type: OFPT_PACKET_IN
185 0.115688720 172.31.23.72 -> 172.31.31.144 OpenFlow 189 Type: OFPT_PACKET_IN
186 0.115738865 172.31.23.72 -> 172.31.31.144 OpenFlow 189 Type: OFPT_PACKET_IN
187 0.115765168 172.31.31.144 -> 172.31.23.72 OpenFlow 187 Type: OFPT_PACKET_OUT
188 0.115802754 172.31.31.144 -> 172.31.23.72 OpenFlow 187 Type: OFPT_PACKET_OUT
189 0.115816328 172.31.31.144 -> 172.31.23.72 TCP 66 6633 → 45456 [ACK] Seq=1 Ack=124 Win=853 Len=0 TSval=818410 TSecr=19388535
190 0.115831677 172.31.23.72 -> 172.31.31.144 OpenFlow 189 Type: OFPT_PACKET_IN
191 0.115839872 172.31.31.144 -> 172.31.23.72 TCP 66 6633 → 45456 [ACK] Seq=1 Ack=247 Win=853 Len=0 TSval=818410 TSecr=19388535
192 0.115858516 172.31.23.72 -> 172.31.31.144 OpenFlow 189 Type: OFPT_PACKET_IN
193 0.115867395 172.31.23.72 -> 172.31.31.144 OpenFlow 189 Type: OFPT_PACKET_IN
194 0.115885836 172.31.31.144 -> 172.31.23.72 TCP 66 6633 → 45454 [ACK] Seq=1 Ack=370 Win=853 Len=0 TSval=818410 TSecr=19388535
195 0.115889328 172.31.31.144 -> 172.31.23.72 OpenFlow 187 Type: OFPT_PACKET_OUT
196 0.115940228 172.31.23.72 -> 172.31.31.144 OpenFlow 312 Type: OFPT_PACKET_IN
197 0.115986826 172.31.31.144 -> 172.31.23.72 TCP 66 6633 → 45454 [ACK] Seq=1 Ack=493 Win=853 Len=0 TSval=818410 TSecr=19388535
198 0.115992230 172.31.31.144 -> 172.31.23.72 OpenFlow 187 Type: OFPT_PACKET_OUT
199 0.115994437 172.31.31.144 -> 172.31.23.72 TCP 66 6633 → 45462 [ACK] Seq=727 Ack=124 Win=853 Len=0 TSval=818410 TSecr=19388535
200 0.116043718 172.31.31.144 -> 172.31.23.72 TCP 66 6633 → 45462 [ACK] Seq=727 Ack=247 Win=853 Len=0 TSval=818410 TSecr=19388535
201 0.116057323 172.31.31.144 -> 172.31.23.72 OpenFlow 187 Type: OFPT_PACKET_OUT
202 0.116089675 172.31.31.144 -> 172.31.23.72 OpenFlow 187 Type: OFPT_PACKET_OUT
203 0.116102399 172.31.31.144 -> 172.31.23.72 TCP 66 6633 → 45436 [ACK] Seq=969 Ack=493 Win=853 Len=0 TSval=818410 TSecr=19388535
204 0.116126733 172.31.31.144 -> 172.31.23.72 OpenFlow 187 Type: OFPT_PACKET_OUT
205 0.116141518 172.31.23.72 -> 172.31.31.144 TCP 66 45438 → 6633 [ACK] Seq=493 Ack=969 Win=213 Len=0 TSval=19388535 TSecr=818410
206 0.116204971 172.31.31.144 -> 172.31.23.72 OpenFlow 187 Type: OFPT_PACKET_OUT
207 0.116323612 172.31.23.72 -> 172.31.31.144 TCP 66 45450 → 6633 [ACK] Seq=493 Ack=485 Win=213 Len=0 TSval=19388535 TSecr=818410
208 0.116371586 172.31.23.72 -> 172.31.31.144 OpenFlow 189 Type: OFPT_PACKET_IN
209 0.116386789 172.31.31.144 -> 172.31.23.72 OpenFlow 187 Type: OFPT_PACKET_OUT
210 0.116392432 172.31.23.72 -> 172.31.31.144 OpenFlow 189 Type: OFPT_PACKET_IN
211 0.116412756 172.31.23.72 -> 172.31.31.144 OpenFlow 189 Type: OFPT_PACKET_IN
212 0.116431139 172.31.23.72 -> 172.31.31.144 OpenFlow 189 Type: OFPT_PACKET_IN
213 0.116504465 172.31.31.144 -> 172.31.23.72 OpenFlow 187 Type: OFPT_PACKET_OUT
214 0.116521277 172.31.31.144 -> 172.31.23.72 TCP 66 6633 → 45446 [ACK] Seq=1 Ack=370 Win=853 Len=0 TSval=818411 TSecr=19388535
215 0.116528965 172.31.31.144 -> 172.31.23.72 TCP 66 6633 → 45432 [ACK] Seq=1 Ack=370 Win=853 Len=0 TSval=818411 TSecr=19388535
216 0.116540715 172.31.31.144 -> 172.31.23.72 TCP 66 6633 → 45446 [ACK] Seq=1 Ack=493 Win=853 Len=0 TSval=818411 TSecr=19388535
217 0.116572811 172.31.23.72 -> 172.31.31.144 OpenFlow 189 Type: OFPT_PACKET_IN
218 0.116587809 172.31.31.144 -> 172.31.23.72 TCP 66 6633 → 45432 [ACK] Seq=1 Ack=493 Win=853 Len=0 TSval=818411 TSecr=19388535
219 0.116591183 172.31.31.144 -> 172.31.23.72 OpenFlow 187 Type: OFPT_PACKET_OUT
220 0.116596594 172.31.23.72 -> 172.31.31.144 OpenFlow 189 Type: OFPT_PACKET_IN
221 0.116673147 172.31.31.144 -> 172.31.23.72 OpenFlow 187 Type: OFPT_PACKET_OUT
222 0.116713797 172.31.31.144 -> 172.31.23.72 TCP 66 6633 → 45452 [ACK] Seq=969 Ack=124 Win=853 Len=0 TSval=818411 TSecr=19388535
223 0.116730016 172.31.23.72 -> 172.31.31.144 TCP 66 45450 → 6633 [ACK] Seq=493 Ack=727 Win=213 Len=0 TSval=19388535 TSecr=818410
224 0.116738477 172.31.31.144 -> 172.31.23.72 TCP 66 6633 → 45452 [ACK] Seq=969 Ack=247 Win=853 Len=0 TSval=818411 TSecr=19388535
225 0.116741813 172.31.31.144 -> 172.31.23.72 OpenFlow 187 Type: OFPT_PACKET_OUT
226 0.116825549 172.31.31.144 -> 172.31.23.72 OpenFlow 187 Type: OFPT_PACKET_OUT
227 0.116889221 172.31.31.144 -> 172.31.23.72 OpenFlow 187 Type: OFPT_PACKET_OUT
228 0.116982076 172.31.31.144 -> 172.31.23.72 OpenFlow 187 Type: OFPT_PACKET_OUT
229 0.117044043 172.31.31.144 -> 172.31.23.72 OpenFlow 187 Type: OFPT_PACKET_OUT
230 0.117109368 172.31.23.72 -> 172.31.31.144 TCP 66 45430 → 6633 [ACK] Seq=739 Ack=848 Win=213 Len=0 TSval=19388535 TSecr=818411
231 0.117125376 172.31.31.144 -> 172.31.23.72 OpenFlow 187 Type: OFPT_PACKET_OUT
232 0.117195236 172.31.31.144 -> 172.31.23.72 OpenFlow 187 Type: OFPT_PACKET_OUT
233 0.117224972 172.31.23.72 -> 172.31.31.144 TCP 66 45430 → 6633 [ACK] Seq=739 Ack=1090 Win=213 Len=0 TSval=19388535 TSecr=818411
234 0.117277243 172.31.31.144 -> 172.31.23.72 OpenFlow 187 Type: OFPT_PACKET_OUT
235 0.117354431 172.31.31.144 -> 172.31.23.72 OpenFlow 187 Type: OFPT_PACKET_OUT
236 0.117377413 172.31.23.72 -> 172.31.31.144 OpenFlow 189 Type: OFPT_PACKET_IN
237 0.117396286 172.31.31.144 -> 172.31.23.72 OpenFlow 187 Type: OFPT_PACKET_OUT
238 0.117402162 172.31.23.72 -> 172.31.31.144 OpenFlow 189 Type: OFPT_PACKET_IN
239 0.117443796 172.31.31.144 -> 172.31.23.72 OpenFlow 187 Type: OFPT_PACKET_OUT
240 0.117452408 172.31.23.72 -> 172.31.31.144 OpenFlow 189 Type: OFPT_PACKET_IN
241 0.117472379 172.31.23.72 -> 172.31.31.144 OpenFlow 189 Type: OFPT_PACKET_IN
242 0.117524820 172.31.31.144 -> 172.31.23.72 TCP 66 6633 → 45432 [ACK] Seq=1 Ack=616 Win=853 Len=0 TSval=818411 TSecr=19388535
243 0.117543722 172.31.31.144 -> 172.31.23.72 OpenFlow 187 Type: OFPT_PACKET_OUT
244 0.117546377 172.31.31.144 -> 172.31.23.72 TCP 66 6633 → 45432 [ACK] Seq=1 Ack=739 Win=853 Len=0 TSval=818411 TSecr=19388535
245 0.117569952 172.31.31.144 -> 172.31.23.72 OpenFlow 187 Type: OFPT_PACKET_OUT
246 0.117584714 172.31.31.144 -> 172.31.23.72 TCP 66 6633 → 45426 [ACK] Seq=1 Ack=616 Win=853 Len=0 TSval=818411 TSecr=19388535
247 0.117599323 172.31.23.72 -> 172.31.31.144 OpenFlow 189 Type: OFPT_PACKET_IN
248 0.117618006 172.31.31.144 -> 172.31.23.72 TCP 66 6633 → 45426 [ACK] Seq=1 Ack=739 Win=853 Len=0 TSval=818411 TSecr=19388535
249 0.117628530 172.31.23.72 -> 172.31.31.144 OpenFlow 189 Type: OFPT_PACKET_IN
250 0.117646837 172.31.23.72 -> 172.31.31.144 OpenFlow 189 Type: OFPT_PACKET_IN
251 0.117669321 172.31.23.72 -> 172.31.31.144 OpenFlow 189 Type: OFPT_PACKET_IN
252 0.117674712 172.31.31.144 -> 172.31.23.72 OpenFlow 187 Type: OFPT_PACKET_OUT
253 0.117701380 172.31.23.72 -> 172.31.31.144 OpenFlow 435 Type: OFPT_PACKET_IN
254 0.117706557 172.31.23.72 -> 172.31.31.144 OpenFlow 189 Type: OFPT_PACKET_IN
255 0.117751914 172.31.31.144 -> 172.31.23.72 OpenFlow 187 Type: OFPT_PACKET_OUT
256 0.117805121 172.31.31.144 -> 172.31.23.72 TCP 66 6633 → 45436 [ACK] Seq=969 Ack=985 Win=853 Len=0 TSval=818411 TSecr=19388535
257 0.117810403 172.31.31.144 -> 172.31.23.72 OpenFlow 187 Type: OFPT_PACKET_OUT
258 0.117833102 172.31.31.144 -> 172.31.23.72 TCP 66 6633 → 45434 [ACK] Seq=1211 Ack=616 Win=853 Len=0 TSval=818411 TSecr=19388535
259 0.117866186 172.31.31.144 -> 172.31.23.72 TCP 66 6633 → 45424 [ACK] Seq=1211 Ack=370 Win=853 Len=0 TSval=818411 TSecr=19388535
260 0.117917884 172.31.31.144 -> 172.31.23.72 TCP 66 6633 → 45424 [ACK] Seq=1211 Ack=493 Win=853 Len=0 TSval=818411 TSecr=19388535
261 0.117922534 172.31.31.144 -> 172.31.23.72 OpenFlow 187 Type: OFPT_PACKET_OUT
262 0.117928906 172.31.31.144 -> 172.31.23.72 OpenFlow 187 Type: OFPT_PACKET_OUT
263 0.117952078 172.31.31.144 -> 172.31.23.72 OpenFlow 187 Type: OFPT_PACKET_OUT
264 0.118030400 172.31.31.144 -> 172.31.23.72 TCP 66 6633 → 45434 [ACK] Seq=1211 Ack=985 Win=853 Len=0 TSval=818411 TSecr=19388535
265 0.118071444 172.31.31.144 -> 172.31.23.72 OpenFlow 187 Type: OFPT_PACKET_OUT
266 0.118077427 172.31.23.72 -> 172.31.31.144 TCP 66 45428 → 6633 [ACK] Seq=247 Ack=727 Win=213 Len=0 TSval=19388536 TSecr=818411
267 0.118095991 172.31.31.144 -> 172.31.23.72 OpenFlow 187 Type: OFPT_PACKET_OUT
268 0.118183269 172.31.31.144 -> 172.31.23.72 OpenFlow 187 Type: OFPT_PACKET_OUT
269 0.118377243 172.31.23.72 -> 172.31.31.144 TCP 66 45416 → 6633 [ACK] Seq=493 Ack=969 Win=213 Len=0 TSval=19388536 TSecr=818411
270 0.118451355 172.31.23.72 -> 172.31.31.144 OpenFlow 189 Type: OFPT_PACKET_IN
271 0.118475391 172.31.23.72 -> 172.31.31.144 OpenFlow 189 Type: OFPT_PACKET_IN
272 0.118497873 172.31.23.72 -> 172.31.31.144 OpenFlow 189 Type: OFPT_PACKET_IN
273 0.118519371 172.31.23.72 -> 172.31.31.144 OpenFlow 189 Type: OFPT_PACKET_IN
274 0.118533939 172.31.23.72 -> 172.31.31.144 OpenFlow 189 Type: OFPT_PACKET_IN
275 0.118563791 172.31.23.72 -> 172.31.31.144 OpenFlow 189 Type: OFPT_PACKET_IN
276 0.118606839 172.31.31.144 -> 172.31.23.72 TCP 66 6633 → 45432 [ACK] Seq=1 Ack=862 Win=853 Len=0 TSval=818411 TSecr=19388536
277 0.118636609 172.31.31.144 -> 172.31.23.72 TCP 66 6633 → 45414 [ACK] Seq=1 Ack=370 Win=853 Len=0 TSval=818411 TSecr=19388536
278 0.118656354 172.31.31.144 -> 172.31.23.72 TCP 66 6633 → 45414 [ACK] Seq=1 Ack=493 Win=853 Len=0 TSval=818411 TSecr=19388536
279 0.118675796 172.31.23.72 -> 172.31.31.144 OpenFlow 189 Type: OFPT_PACKET_IN
280 0.118684106 172.31.31.144 -> 172.31.23.72 TCP 66 6633 → 45426 [ACK] Seq=1 Ack=862 Win=853 Len=0 TSval=818411 TSecr=19388536
281 0.118695216 172.31.23.72 -> 172.31.31.144 OpenFlow 189 Type: OFPT_PACKET_IN
282 0.118715599 172.31.23.72 -> 172.31.31.144 OpenFlow 189 Type: OFPT_PACKET_IN
283 0.118722436 172.31.31.144 -> 172.31.23.72 TCP 66 6633 → 45432 [ACK] Seq=1 Ack=985 Win=853 Len=0 TSval=818411 TSecr=19388536
284 0.118747142 172.31.23.72 -> 172.31.31.144 OpenFlow 189 Type: OFPT_PACKET_IN
285 0.118754118 172.31.31.144 -> 172.31.23.72 TCP 66 6633 → 45426 [ACK] Seq=1 Ack=985 Win=853 Len=0 TSval=818411 TSecr=19388536
286 0.118778604 172.31.23.72 -> 172.31.31.144 OpenFlow 189 Type: OFPT_PACKET_IN
287 0.118783341 172.31.23.72 -> 172.31.31.144 OpenFlow 189 Type: OFPT_PACKET_IN
288 0.118846586 172.31.31.144 -> 172.31.23.72 TCP 66 6633 → 45420 [ACK] Seq=969 Ack=370 Win=853 Len=0 TSval=818411 TSecr=19388536
289 0.118849676 172.31.31.144 -> 172.31.23.72 TCP 66 6633 → 45420 [ACK] Seq=969 Ack=493 Win=853 Len=0 TSval=818411 TSecr=19388536
290 0.118895590 172.31.31.144 -> 172.31.23.72 TCP 66 6633 → 45424 [ACK] Seq=1211 Ack=616 Win=853 Len=0 TSval=818411 TSecr=19388536
291 0.118990089 172.31.31.144 -> 172.31.23.72 TCP 66 6633 → 45424 [ACK] Seq=1211 Ack=739 Win=853 Len=0 TSval=818411 TSecr=19388536
292 0.119079051 172.31.31.144 -> 172.31.23.72 TCP 66 6633 → 45418 [ACK] Seq=1211 Ack=493 Win=853 Len=0 TSval=818411 TSecr=19388536
293 0.153909208 172.31.23.72 -> 172.31.31.144 TCP 66 45430 → 6633 [ACK] Seq=739 Ack=1211 Win=213 Len=0 TSval=19388545 TSecr=818411
294 0.200578990 172.31.31.144 -> 172.31.23.72 OpenFlow 187 Type: OFPT_PACKET_OUT
295 0.200626531 172.31.31.144 -> 172.31.23.72 OpenFlow 187 Type: OFPT_PACKET_OUT
296 0.200682418 172.31.31.144 -> 172.31.23.72 OpenFlow 187 Type: OFPT_PACKET_OUT
297 0.200749686 172.31.31.144 -> 172.31.23.72 OpenFlow 187 Type: OFPT_PACKET_OUT
298 0.200819279 172.31.31.144 -> 172.31.23.72 OpenFlow 187 Type: OFPT_PACKET_OUT
299 0.200872456 172.31.31.144 -> 172.31.23.72 OpenFlow 187 Type: OFPT_PACKET_OUT
300 0.200957227 172.31.31.144 -> 172.31.23.72 OpenFlow 187 Type: OFPT_PACKET_OUT
301 0.201011415 172.31.31.144 -> 172.31.23.72 OpenFlow 187 Type: OFPT_PACKET_OUT
302 0.201086302 172.31.31.144 -> 172.31.23.72 OpenFlow 187 Type: OFPT_PACKET_OUT
303 0.201119365 172.31.31.144 -> 172.31.23.72 OpenFlow 187 Type: OFPT_PACKET_OUT
304 0.201251436 172.31.31.144 -> 172.31.23.72 OpenFlow 187 Type: OFPT_PACKET_OUT
305 0.201267683 172.31.31.144 -> 172.31.23.72 OpenFlow 187 Type: OFPT_PACKET_OUT
306 0.201274123 172.31.23.72 -> 172.31.31.144 TCP 66 45446 → 6633 [ACK] Seq=493 Ack=1211 Win=213 Len=0 TSval=19388556 TSecr=818432
307 0.201340381 172.31.31.144 -> 172.31.23.72 OpenFlow 187 Type: OFPT_PACKET_OUT
308 0.201365812 172.31.31.144 -> 172.31.23.72 OpenFlow 187 Type: OFPT_PACKET_OUT
309 0.201417890 172.31.31.144 -> 172.31.23.72 OpenFlow 187 Type: OFPT_PACKET_OUT
310 0.201458539 172.31.31.144 -> 172.31.23.72 OpenFlow 187 Type: OFPT_PACKET_OUT
311 0.201523983 172.31.31.144 -> 172.31.23.72 OpenFlow 187 Type: OFPT_PACKET_OUT
312 0.201577526 172.31.31.144 -> 172.31.23.72 OpenFlow 187 Type: OFPT_PACKET_OUT
313 0.201667429 172.31.31.144 -> 172.31.23.72 TCP 187 6633 → 45460 [PSH, ACK] Seq=1 Ack=1 Win=853 Len=121 TSval=818432 TSecr=19388156
314 0.201723419 172.31.23.72 -> 172.31.31.144 TCP 66 45432 → 6633 [ACK] Seq=985 Ack=969 Win=213 Len=0 TSval=19388556 TSecr=818432
315 0.201735067 172.31.31.144 -> 172.31.23.72 TCP 187 6633 → 45460 [PSH, ACK] Seq=122 Ack=1 Win=853 Len=121 TSval=818432 TSecr=19388156
316 0.201785262 172.31.31.144 -> 172.31.23.72 TCP 187 6633 → 45460 [PSH, ACK] Seq=243 Ack=1 Win=853 Len=121 TSval=818432 TSecr=19388156
317 0.201835899 172.31.31.144 -> 172.31.23.72 TCP 187 6633 → 45460 [PSH, ACK] Seq=364 Ack=1 Win=853 Len=121 TSval=818432 TSecr=19388156
318 0.201909219 172.31.31.144 -> 172.31.23.72 TCP 187 6633 → 45460 [PSH, ACK] Seq=485 Ack=1 Win=853 Len=121 TSval=818432 TSecr=19388156
319 0.201948189 172.31.31.144 -> 172.31.23.72 TCP 187 6633 → 45460 [PSH, ACK] Seq=606 Ack=1 Win=853 Len=121 TSval=818432 TSecr=19388156
320 0.202024394 172.31.31.144 -> 172.31.23.72 TCP 187 6633 → 45458 [PSH, ACK] Seq=1 Ack=1 Win=853 Len=121 TSval=818432 TSecr=19387894
321 0.202050918 172.31.23.72 -> 172.31.31.144 TCP 66 45460 → 6633 [ACK] Seq=1 Ack=727 Win=213 Len=0 TSval=19388557 TSecr=818432
322 0.202064056 172.31.31.144 -> 172.31.23.72 TCP 187 6633 → 45458 [PSH, ACK] Seq=122 Ack=1 Win=853 Len=121 TSval=818432 TSecr=19387894
323 0.202135909 172.31.23.72 -> 172.31.31.144 OpenFlow 189 Type: OFPT_PACKET_IN
324 0.202142546 172.31.31.144 -> 172.31.23.72 OpenFlow 187 Type: OFPT_PACKET_OUT
325 0.202160419 172.31.23.72 -> 172.31.31.144 OpenFlow 312 Type: OFPT_PACKET_IN
326 0.202197952 172.31.31.144 -> 172.31.23.72 OpenFlow 187 Type: OFPT_PACKET_OUT
327 0.202203757 172.31.23.72 -> 172.31.31.144 OpenFlow 189 Type: OFPT_PACKET_IN
328 0.202241996 172.31.31.144 -> 172.31.23.72 OpenFlow 187 Type: OFPT_PACKET_OUT
329 0.202301975 172.31.31.144 -> 172.31.23.72 TCP 66 6633 → 45458 [ACK] Seq=606 Ack=124 Win=853 Len=0 TSval=818432 TSecr=19388557
330 0.202319093 172.31.31.144 -> 172.31.23.72 TCP 66 6633 → 45458 [ACK] Seq=606 Ack=370 Win=853 Len=0 TSval=818432 TSecr=19388557
331 0.202337178 172.31.31.144 -> 172.31.23.72 OpenFlow 187 Type: OFPT_PACKET_OUT
332 0.202355934 172.31.31.144 -> 172.31.23.72 OpenFlow 187 Type: OFPT_PACKET_OUT
333 0.202445048 172.31.23.72 -> 172.31.31.144 TCP 66 45458 → 6633 [ACK] Seq=493 Ack=848 Win=213 Len=0 TSval=19388557 TSecr=818432
334 0.202503442 172.31.31.144 -> 172.31.23.72 OpenFlow 187 Type: OFPT_PACKET_OUT
335 0.202521026 172.31.23.72 -> 172.31.31.144 OpenFlow 189 Type: OFPT_PACKET_IN
336 0.202541433 172.31.31.144 -> 172.31.23.72 OpenFlow 187 Type: OFPT_PACKET_OUT
337 0.202553901 172.31.23.72 -> 172.31.31.144 OpenFlow 189 Type: OFPT_PACKET_IN
338 0.202591784 172.31.23.72 -> 172.31.31.144 OpenFlow 312 Type: OFPT_PACKET_IN
339 0.202651713 172.31.31.144 -> 172.31.23.72 OpenFlow 187 Type: OFPT_PACKET_OUT
340 0.202673694 172.31.31.144 -> 172.31.23.72 TCP 66 6633 → 45456 [ACK] Seq=364 Ack=370 Win=853 Len=0 TSval=818432 TSecr=19388557
341 0.202699825 172.31.31.144 -> 172.31.23.72 OpenFlow 187 Type: OFPT_PACKET_OUT
342 0.202744934 172.31.23.72 -> 172.31.31.144 TCP 66 45456 → 6633 [ACK] Seq=739 Ack=485 Win=213 Len=0 TSval=19388557 TSecr=818432
343 0.202817685 172.31.23.72 -> 172.31.31.144 OpenFlow 189 Type: OFPT_PACKET_IN
344 0.202837594 172.31.23.72 -> 172.31.31.144 OpenFlow 189 Type: OFPT_PACKET_IN
345 0.202846105 172.31.23.72 -> 172.31.31.144 OpenFlow 189 Type: OFPT_PACKET_IN
346 0.202919851 172.31.23.72 -> 172.31.31.144 OpenFlow 435 Type: OFPT_PACKET_IN
347 0.202984514 172.31.23.72 -> 172.31.31.144 OpenFlow 189 Type: OFPT_PACKET_IN
348 0.203008914 172.31.31.144 -> 172.31.23.72 TCP 66 6633 → 45454 [ACK] Seq=1 Ack=616 Win=853 Len=0 TSval=818432 TSecr=19388557
349 0.203018711 172.31.23.72 -> 172.31.31.144 OpenFlow 189 Type: OFPT_PACKET_IN
350 0.203045890 172.31.23.72 -> 172.31.31.144 OpenFlow 189 Type: OFPT_PACKET_IN
351 0.203062056 172.31.23.72 -> 172.31.31.144 OpenFlow 189 Type: OFPT_PACKET_IN
352 0.203078382 172.31.31.144 -> 172.31.23.72 TCP 66 6633 → 45454 [ACK] Seq=1 Ack=739 Win=853 Len=0 TSval=818432 TSecr=19388557
353 0.203091201 172.31.23.72 -> 172.31.31.144 OpenFlow 189 Type: OFPT_PACKET_IN
354 0.203096917 172.31.23.72 -> 172.31.31.144 OpenFlow 189 Type: OFPT_PACKET_IN
355 0.203111032 172.31.23.72 -> 172.31.31.144 OpenFlow 189 Type: OFPT_PACKET_IN
356 0.203113480 172.31.23.72 -> 172.31.31.144 OpenFlow 435 Type: OFPT_PACKET_IN
357 0.203130475 172.31.23.72 -> 172.31.31.144 OpenFlow 189 Type: OFPT_PACKET_IN
358 0.203144171 172.31.23.72 -> 172.31.31.144 OpenFlow 189 Type: OFPT_PACKET_IN
359 0.203156274 172.31.23.72 -> 172.31.31.144 OpenFlow 189 Type: OFPT_PACKET_IN
360 0.203216778 172.31.31.144 -> 172.31.23.72 OpenFlow 187 Type: OFPT_PACKET_OUT
361 0.203222661 172.31.23.72 -> 172.31.31.144 TCP 66 45414 → 6633 [ACK] Seq=493 Ack=122 Win=213 Len=0 TSval=19388557 TSecr=818432
362 0.203228702 172.31.31.144 -> 172.31.23.72 OpenFlow 187 Type: OFPT_PACKET_OUT
363 0.203232215 172.31.31.144 -> 172.31.23.72 OpenFlow 187 Type: OFPT_PACKET_OUT
364 0.203235004 172.31.23.72 -> 172.31.31.144 TCP 66 45414 → 6633 [ACK] Seq=493 Ack=243 Win=213 Len=0 TSval=19388557 TSecr=818432
365 0.203236347 172.31.31.144 -> 172.31.23.72 TCP 66 6633 → 45462 [ACK] Seq=727 Ack=370 Win=853 Len=0 TSval=818432 TSecr=19388557
366 0.203238552 172.31.31.144 -> 172.31.23.72 OpenFlow 429 Type: OFPT_PACKET_OUT
367 0.203240367 172.31.31.144 -> 172.31.23.72 TCP 66 6633 → 45462 [ACK] Seq=727 Ack=493 Win=853 Len=0 TSval=818432 TSecr=19388557
368 0.203245382 172.31.23.72 -> 172.31.31.144 OpenFlow 189 Type: OFPT_PACKET_IN
369 0.203411234 172.31.23.72 -> 172.31.31.144 OpenFlow 189 Type: OFPT_PACKET_IN
370 0.203414496 172.31.23.72 -> 172.31.31.144 OpenFlow 189 Type: OFPT_PACKET_IN
371 0.203480402 172.31.31.144 -> 172.31.23.72 OpenFlow 187 Type: OFPT_PACKET_OUT
372 0.203486917 172.31.23.72 -> 172.31.31.144 TCP 66 45414 → 6633 [ACK] Seq=493 Ack=364 Win=213 Len=0 TSval=19388557 TSecr=818432
373 0.203493213 172.31.31.144 -> 172.31.23.72 TCP 66 6633 → 45444 [ACK] Seq=1211 Ack=370 Win=853 Len=0 TSval=818432 TSecr=19388557
374 0.203496510 172.31.31.144 -> 172.31.23.72 OpenFlow 187 Type: OFPT_PACKET_OUT
375 0.203499065 172.31.23.72 -> 172.31.31.144 TCP 66 45414 → 6633 [ACK] Seq=493 Ack=485 Win=213 Len=0 TSval=19388557 TSecr=818432
376 0.203500534 172.31.31.144 -> 172.31.23.72 TCP 66 6633 → 45438 [ACK] Seq=969 Ack=616 Win=853 Len=0 TSval=818432 TSecr=19388557
377 0.203502542 172.31.31.144 -> 172.31.23.72 OpenFlow 187 Type: OFPT_PACKET_OUT
378 0.203504673 172.31.23.72 -> 172.31.31.144 TCP 66 45414 → 6633 [ACK] Seq=493 Ack=606 Win=213 Len=0 TSval=19388557 TSecr=818432
379 0.203505994 172.31.31.144 -> 172.31.23.72 TCP 66 6633 → 45448 [ACK] Seq=1 Ack=739 Win=853 Len=0 TSval=818432 TSecr=19388557
380 0.203508429 172.31.31.144 -> 172.31.23.72 OpenFlow 187 Type: OFPT_PACKET_OUT
381 0.203510769 172.31.23.72 -> 172.31.31.144 TCP 66 45414 → 6633 [ACK] Seq=493 Ack=727 Win=213 Len=0 TSval=19388557 TSecr=818432
382 0.203516445 172.31.23.72 -> 172.31.31.144 OpenFlow 189 Type: OFPT_PACKET_IN
383 0.203582821 172.31.23.72 -> 172.31.31.144 TCP 66 45456 → 6633 [ACK] Seq=739 Ack=969 Win=213 Len=0 TSval=19388557 TSecr=818432
384 0.203636791 172.31.31.144 -> 172.31.23.72 TCP 66 6633 → 45446 [ACK] Seq=1211 Ack=616 Win=853 Len=0 TSval=818432 TSecr=19388557
385 0.203641953 172.31.31.144 -> 172.31.23.72 TCP 66 6633 → 45438 [ACK] Seq=969 Ack=985 Win=853 Len=0 TSval=818432 TSecr=19388557
386 0.203851842 172.31.31.144 -> 172.31.23.72 TCP 66 6633 → 45430 [ACK] Seq=1211 Ack=985 Win=853 Len=0 TSval=818432 TSecr=19388557
387 0.203857701 172.31.31.144 -> 172.31.23.72 TCP 66 6633 → 45444 [ACK] Seq=1211 Ack=493 Win=853 Len=0 TSval=818432 TSecr=19388557
388 0.203860099 172.31.31.144 -> 172.31.23.72 TCP 66 6633 → 45428 [ACK] Seq=727 Ack=493 Win=853 Len=0 TSval=818432 TSecr=19388557
389 0.203862196 172.31.31.144 -> 172.31.23.72 TCP 66 6633 → 45460 [ACK] Seq=727 Ack=247 Win=853 Len=0 TSval=818432 TSecr=19388557
