  1 0.000000000 172.31.31.144 -> 172.31.23.72 TCP 187 6633 → 33668 [PSH, ACK] Seq=1 Ack=1 Win=853 Len=121 TSval=1300711 TSecr=26139381
  2 0.000033671 172.31.31.144 -> 172.31.23.72 TCP 187 6633 → 33668 [PSH, ACK] Seq=122 Ack=1 Win=853 Len=121 TSval=1300711 TSecr=26139381
  3 0.000073852 172.31.31.144 -> 172.31.23.72 TCP 187 6633 → 33668 [PSH, ACK] Seq=243 Ack=1 Win=853 Len=121 TSval=1300711 TSecr=26139381
  4 0.000077056 172.31.31.144 -> 172.31.23.72 TCP 187 6633 → 33668 [PSH, ACK] Seq=364 Ack=1 Win=853 Len=121 TSval=1300711 TSecr=26139381
  5 0.000096078 172.31.31.144 -> 172.31.23.72 TCP 187 6633 → 33668 [PSH, ACK] Seq=485 Ack=1 Win=853 Len=121 TSval=1300711 TSecr=26139381
  6 0.000115351 172.31.31.144 -> 172.31.23.72 TCP 187 6633 → 33668 [PSH, ACK] Seq=606 Ack=1 Win=853 Len=121 TSval=1300711 TSecr=26139381
  7 0.000135938 172.31.31.144 -> 172.31.23.72 TCP 187 6633 → 33668 [PSH, ACK] Seq=727 Ack=1 Win=853 Len=121 TSval=1300711 TSecr=26139381
  8 0.000208488 172.31.31.144 -> 172.31.23.72 TCP 187 6633 → 33668 [PSH, ACK] Seq=848 Ack=1 Win=853 Len=121 TSval=1300711 TSecr=26139381
  9 0.000562201 172.31.23.72 -> 172.31.31.144 TCP 66 33668 → 6633 [ACK] Seq=1 Ack=969 Win=213 Len=0 TSval=26139812 TSecr=1300711
 10 0.000707571 172.31.23.72 -> 172.31.31.144 OpenFlow 189 Type: OFPT_PACKET_IN
 11 0.000741429 172.31.23.72 -> 172.31.31.144 OpenFlow 189 Type: OFPT_PACKET_IN
 12 0.000802691 172.31.23.72 -> 172.31.31.144 OpenFlow 189 Type: OFPT_PACKET_IN
 13 0.000827866 172.31.23.72 -> 172.31.31.144 OpenFlow 189 Type: OFPT_PACKET_IN
 14 0.000838060 172.31.23.72 -> 172.31.31.144 OpenFlow 189 Type: OFPT_PACKET_IN
 15 0.000870965 172.31.23.72 -> 172.31.31.144 OpenFlow 189 Type: OFPT_PACKET_IN
 16 0.000940367 172.31.31.144 -> 172.31.23.72 TCP 66 6633 → 33666 [ACK] Seq=1 Ack=124 Win=853 Len=0 TSval=1300711 TSecr=26139812
 17 0.000977991 172.31.31.144 -> 172.31.23.72 TCP 66 6633 → 33666 [ACK] Seq=1 Ack=247 Win=853 Len=0 TSval=1300711 TSecr=26139812
 18 0.001025454 172.31.31.144 -> 172.31.23.72 TCP 66 6633 → 33670 [ACK] Seq=1 Ack=124 Win=853 Len=0 TSval=1300711 TSecr=26139812
 19 0.001048535 172.31.31.144 -> 172.31.23.72 TCP 66 6633 → 33670 [ACK] Seq=1 Ack=247 Win=853 Len=0 TSval=1300711 TSecr=26139812
 20 0.001074346 172.31.31.144 -> 172.31.23.72 TCP 66 6633 → 33658 [ACK] Seq=1 Ack=124 Win=853 Len=0 TSval=1300711 TSecr=26139812
 21 0.001097673 172.31.31.144 -> 172.31.23.72 TCP 66 6633 → 33658 [ACK] Seq=1 Ack=247 Win=853 Len=0 TSval=1300711 TSecr=26139812
 22 0.099449240 172.31.31.144 -> 172.31.23.72 TCP 187 6633 → 33656 [PSH, ACK] Seq=1 Ack=1 Win=853 Len=121 TSval=1300736 TSecr=26139300
 23 0.099491218 172.31.31.144 -> 172.31.23.72 TCP 187 6633 → 33656 [PSH, ACK] Seq=122 Ack=1 Win=853 Len=121 TSval=1300736 TSecr=26139300
 24 0.099575709 172.31.31.144 -> 172.31.23.72 TCP 187 6633 → 33656 [PSH, ACK] Seq=243 Ack=1 Win=853 Len=121 TSval=1300736 TSecr=26139300
 25 0.099579867 172.31.31.144 -> 172.31.23.72 TCP 187 6633 → 33656 [PSH, ACK] Seq=364 Ack=1 Win=853 Len=121 TSval=1300736 TSecr=26139300
 26 0.099653402 172.31.31.144 -> 172.31.23.72 TCP 187 6633 → 33656 [PSH, ACK] Seq=485 Ack=1 Win=853 Len=121 TSval=1300736 TSecr=26139300
 27 0.099720066 172.31.31.144 -> 172.31.23.72 TCP 187 6633 → 33656 [PSH, ACK] Seq=606 Ack=1 Win=853 Len=121 TSval=1300736 TSecr=26139300
 28 0.099772075 172.31.31.144 -> 172.31.23.72 TCP 187 6633 → 33652 [PSH, ACK] Seq=1 Ack=1 Win=853 Len=121 TSval=1300736 TSecr=26139278
 29 0.099837434 172.31.31.144 -> 172.31.23.72 TCP 187 6633 → 33652 [PSH, ACK] Seq=122 Ack=1 Win=853 Len=121 TSval=1300736 TSecr=26139278
 30 0.099870926 172.31.31.144 -> 172.31.23.72 TCP 187 6633 → 33652 [PSH, ACK] Seq=243 Ack=1 Win=853 Len=121 TSval=1300736 TSecr=26139278
 31 0.099922714 172.31.31.144 -> 172.31.23.72 TCP 187 6633 → 33652 [PSH, ACK] Seq=364 Ack=1 Win=853 Len=121 TSval=1300736 TSecr=26139278
 32 0.099971542 172.31.31.144 -> 172.31.23.72 TCP 187 6633 → 33652 [PSH, ACK] Seq=485 Ack=1 Win=853 Len=121 TSval=1300736 TSecr=26139278
 33 0.100021355 172.31.31.144 -> 172.31.23.72 TCP 187 6633 → 33652 [PSH, ACK] Seq=606 Ack=1 Win=853 Len=121 TSval=1300736 TSecr=26139278
 34 0.100046483 172.31.23.72 -> 172.31.31.144 TCP 66 33656 → 6633 [ACK] Seq=1 Ack=727 Win=213 Len=0 TSval=26139837 TSecr=1300736
 35 0.100100766 172.31.31.144 -> 172.31.23.72 TCP 187 6633 → 33652 [PSH, ACK] Seq=727 Ack=1 Win=853 Len=121 TSval=1300736 TSecr=26139278
 36 0.100131790 172.31.31.144 -> 172.31.23.72 TCP 187 6633 → 33652 [PSH, ACK] Seq=848 Ack=1 Win=853 Len=121 TSval=1300736 TSecr=26139278
 37 0.100236827 172.31.31.144 -> 172.31.23.72 TCP 187 6633 → 33636 [PSH, ACK] Seq=1 Ack=1 Win=853 Len=121 TSval=1300736 TSecr=26139186
 38 0.100253985 172.31.31.144 -> 172.31.23.72 TCP 187 6633 → 33636 [PSH, ACK] Seq=122 Ack=1 Win=853 Len=121 TSval=1300736 TSecr=26139186
 39 0.100337628 172.31.31.144 -> 172.31.23.72 TCP 187 6633 → 33636 [PSH, ACK] Seq=243 Ack=1 Win=853 Len=121 TSval=1300736 TSecr=26139186
 40 0.100392761 172.31.31.144 -> 172.31.23.72 TCP 187 6633 → 33636 [PSH, ACK] Seq=364 Ack=1 Win=853 Len=121 TSval=1300736 TSecr=26139186
 41 0.100448260 172.31.31.144 -> 172.31.23.72 TCP 187 6633 → 33636 [PSH, ACK] Seq=485 Ack=1 Win=853 Len=121 TSval=1300736 TSecr=26139186
 42 0.100486069 172.31.23.72 -> 172.31.31.144 TCP 66 33652 → 6633 [ACK] Seq=1 Ack=969 Win=213 Len=0 TSval=26139837 TSecr=1300736
 43 0.100501988 172.31.31.144 -> 172.31.23.72 TCP 187 6633 → 33636 [PSH, ACK] Seq=606 Ack=1 Win=853 Len=121 TSval=1300736 TSecr=26139186
 44 0.100554477 172.31.31.144 -> 172.31.23.72 TCP 187 6633 → 33636 [PSH, ACK] Seq=727 Ack=1 Win=853 Len=121 TSval=1300736 TSecr=26139186
 45 0.100612734 172.31.31.144 -> 172.31.23.72 TCP 187 6633 → 33636 [PSH, ACK] Seq=848 Ack=1 Win=853 Len=121 TSval=1300736 TSecr=26139186
 46 0.100672791 172.31.31.144 -> 172.31.23.72 TCP 187 6633 → 33650 [PSH, ACK] Seq=1 Ack=1 Win=853 Len=121 TSval=1300736 TSecr=26139267
 47 0.100727039 172.31.31.144 -> 172.31.23.72 TCP 187 6633 → 33650 [PSH, ACK] Seq=122 Ack=1 Win=853 Len=121 TSval=1300736 TSecr=26139267
 48 0.100772987 172.31.31.144 -> 172.31.23.72 TCP 187 6633 → 33650 [PSH, ACK] Seq=243 Ack=1 Win=853 Len=121 TSval=1300736 TSecr=26139267
 49 0.100824614 172.31.31.144 -> 172.31.23.72 TCP 187 6633 → 33650 [PSH, ACK] Seq=364 Ack=1 Win=853 Len=121 TSval=1300736 TSecr=26139267
 50 0.100862995 172.31.23.72 -> 172.31.31.144 TCP 66 33636 → 6633 [ACK] Seq=1 Ack=969 Win=213 Len=0 TSval=26139837 TSecr=1300736
 51 0.100881929 172.31.31.144 -> 172.31.23.72 TCP 187 6633 → 33650 [PSH, ACK] Seq=485 Ack=1 Win=853 Len=121 TSval=1300736 TSecr=26139267
 52 0.100937071 172.31.31.144 -> 172.31.23.72 TCP 187 6633 → 33650 [PSH, ACK] Seq=606 Ack=1 Win=853 Len=121 TSval=1300736 TSecr=26139267
 53 0.100956086 172.31.23.72 -> 172.31.31.144 OpenFlow 189 Type: OFPT_PACKET_IN
 54 0.100976985 172.31.23.72 -> 172.31.31.144 OpenFlow 189 Type: OFPT_PACKET_IN
 55 0.101005455 172.31.31.144 -> 172.31.23.72 OpenFlow 187 Type: OFPT_PACKET_OUT
 56 0.101050979 172.31.31.144 -> 172.31.23.72 OpenFlow 187 Type: OFPT_PACKET_OUT
 57 0.101099502 172.31.31.144 -> 172.31.23.72 OpenFlow 187 Type: OFPT_PACKET_OUT
 58 0.101145302 172.31.31.144 -> 172.31.23.72 OpenFlow 187 Type: OFPT_PACKET_OUT
 59 0.101163608 172.31.31.144 -> 172.31.23.72 TCP 66 6633 → 33650 [ACK] Seq=1211 Ack=124 Win=853 Len=0 TSval=1300736 TSecr=26139837
 60 0.101230159 172.31.31.144 -> 172.31.23.72 TCP 66 6633 → 33650 [ACK] Seq=1211 Ack=247 Win=853 Len=0 TSval=1300736 TSecr=26139837
 61 0.101236286 172.31.31.144 -> 172.31.23.72 TCP 187 6633 → 33640 [PSH, ACK] Seq=1 Ack=1 Win=853 Len=121 TSval=1300736 TSecr=26139205
 62 0.101259668 172.31.31.144 -> 172.31.23.72 TCP 187 6633 → 33640 [PSH, ACK] Seq=122 Ack=1 Win=853 Len=121 TSval=1300736 TSecr=26139205
 63 0.101356363 172.31.31.144 -> 172.31.23.72 TCP 187 6633 → 33640 [PSH, ACK] Seq=243 Ack=1 Win=853 Len=121 TSval=1300736 TSecr=26139205
 64 0.101402655 172.31.31.144 -> 172.31.23.72 TCP 187 6633 → 33640 [PSH, ACK] Seq=364 Ack=1 Win=853 Len=121 TSval=1300736 TSecr=26139205
 65 0.101459961 172.31.31.144 -> 172.31.23.72 TCP 187 6633 → 33640 [PSH, ACK] Seq=485 Ack=1 Win=853 Len=121 TSval=1300736 TSecr=26139205
 66 0.101471753 172.31.23.72 -> 172.31.31.144 TCP 66 33650 → 6633 [ACK] Seq=247 Ack=1211 Win=213 Len=0 TSval=26139837 TSecr=1300736
 67 0.101517663 172.31.31.144 -> 172.31.23.72 TCP 187 6633 → 33640 [PSH, ACK] Seq=606 Ack=1 Win=853 Len=121 TSval=1300736 TSecr=26139205
 68 0.101552203 172.31.23.72 -> 172.31.31.144 OpenFlow 189 Type: OFPT_PACKET_IN
 69 0.101574132 172.31.23.72 -> 172.31.31.144 OpenFlow 189 Type: OFPT_PACKET_IN
 70 0.101596686 172.31.31.144 -> 172.31.23.72 OpenFlow 187 Type: OFPT_PACKET_OUT
 71 0.101644554 172.31.31.144 -> 172.31.23.72 OpenFlow 187 Type: OFPT_PACKET_OUT
 72 0.101711439 172.31.31.144 -> 172.31.23.72 OpenFlow 187 Type: OFPT_PACKET_OUT
 73 0.101738923 172.31.31.144 -> 172.31.23.72 OpenFlow 187 Type: OFPT_PACKET_OUT
 74 0.101797679 172.31.31.144 -> 172.31.23.72 TCP 66 6633 → 33640 [ACK] Seq=1211 Ack=124 Win=853 Len=0 TSval=1300736 TSecr=26139837
 75 0.101815146 172.31.31.144 -> 172.31.23.72 TCP 66 6633 → 33640 [ACK] Seq=1211 Ack=247 Win=853 Len=0 TSval=1300736 TSecr=26139837
 76 0.101845233 172.31.31.144 -> 172.31.23.72 TCP 187 6633 → 33634 [PSH, ACK] Seq=1 Ack=1 Win=853 Len=121 TSval=1300736 TSecr=26139175
 77 0.101863178 172.31.31.144 -> 172.31.23.72 TCP 187 6633 → 33634 [PSH, ACK] Seq=122 Ack=1 Win=853 Len=121 TSval=1300736 TSecr=26139175
 78 0.101914058 172.31.31.144 -> 172.31.23.72 TCP 187 6633 → 33634 [PSH, ACK] Seq=243 Ack=1 Win=853 Len=121 TSval=1300736 TSecr=26139175
 79 0.102007722 172.31.31.144 -> 172.31.23.72 TCP 187 6633 → 33634 [PSH, ACK] Seq=364 Ack=1 Win=853 Len=121 TSval=1300736 TSecr=26139175
 80 0.102060564 172.31.31.144 -> 172.31.23.72 TCP 187 6633 → 33634 [PSH, ACK] Seq=485 Ack=1 Win=853 Len=121 TSval=1300736 TSecr=26139175
 81 0.102067951 172.31.23.72 -> 172.31.31.144 TCP 66 33640 → 6633 [ACK] Seq=247 Ack=1211 Win=213 Len=0 TSval=26139837 TSecr=1300736
 82 0.102113010 172.31.31.144 -> 172.31.23.72 TCP 187 6633 → 33634 [PSH, ACK] Seq=606 Ack=1 Win=853 Len=121 TSval=1300736 TSecr=26139175
 83 0.102149131 172.31.23.72 -> 172.31.31.144 OpenFlow 189 Type: OFPT_PACKET_IN
 84 0.102170926 172.31.31.144 -> 172.31.23.72 OpenFlow 187 Type: OFPT_PACKET_OUT
 85 0.102176064 172.31.23.72 -> 172.31.31.144 OpenFlow 189 Type: OFPT_PACKET_IN
 86 0.102229906 172.31.31.144 -> 172.31.23.72 OpenFlow 187 Type: OFPT_PACKET_OUT
 87 0.102275724 172.31.31.144 -> 172.31.23.72 OpenFlow 187 Type: OFPT_PACKET_OUT
 88 0.102320650 172.31.31.144 -> 172.31.23.72 OpenFlow 187 Type: OFPT_PACKET_OUT
 89 0.102374085 172.31.31.144 -> 172.31.23.72 TCP 66 6633 → 33634 [ACK] Seq=1211 Ack=124 Win=853 Len=0 TSval=1300736 TSecr=26139837
 90 0.102391822 172.31.31.144 -> 172.31.23.72 TCP 66 6633 → 33634 [ACK] Seq=1211 Ack=247 Win=853 Len=0 TSval=1300736 TSecr=26139837
 91 0.102412577 172.31.31.144 -> 172.31.23.72 TCP 187 6633 → 33660 [PSH, ACK] Seq=1 Ack=1 Win=853 Len=121 TSval=1300736 TSecr=26139327
 92 0.102430660 172.31.31.144 -> 172.31.23.72 TCP 187 6633 → 33660 [PSH, ACK] Seq=122 Ack=1 Win=853 Len=121 TSval=1300736 TSecr=26139327
 93 0.102480373 172.31.31.144 -> 172.31.23.72 TCP 187 6633 → 33660 [PSH, ACK] Seq=243 Ack=1 Win=853 Len=121 TSval=1300736 TSecr=26139327
 94 0.102541834 172.31.31.144 -> 172.31.23.72 TCP 187 6633 → 33660 [PSH, ACK] Seq=364 Ack=1 Win=853 Len=121 TSval=1300736 TSecr=26139327
 95 0.102595991 172.31.31.144 -> 172.31.23.72 TCP 187 6633 → 33660 [PSH, ACK] Seq=485 Ack=1 Win=853 Len=121 TSval=1300737 TSecr=26139327
 96 0.102605825 172.31.23.72 -> 172.31.31.144 TCP 66 33634 → 6633 [ACK] Seq=247 Ack=1211 Win=213 Len=0 TSval=26139837 TSecr=1300736
 97 0.102670940 172.31.31.144 -> 172.31.23.72 TCP 187 6633 → 33660 [PSH, ACK] Seq=606 Ack=1 Win=853 Len=121 TSval=1300737 TSecr=26139327
 98 0.102682146 172.31.23.72 -> 172.31.31.144 OpenFlow 189 Type: OFPT_PACKET_IN
 99 0.102702242 172.31.23.72 -> 172.31.31.144 OpenFlow 189 Type: OFPT_PACKET_IN
100 0.102733748 172.31.31.144 -> 172.31.23.72 OpenFlow 187 Type: OFPT_PACKET_OUT
101 0.102789471 172.31.31.144 -> 172.31.23.72 OpenFlow 187 Type: OFPT_PACKET_OUT
102 0.102840738 172.31.31.144 -> 172.31.23.72 OpenFlow 187 Type: OFPT_PACKET_OUT
103 0.102892575 172.31.31.144 -> 172.31.23.72 TCP 66 6633 → 33660 [ACK] Seq=1090 Ack=124 Win=853 Len=0 TSval=1300737 TSecr=26139837
104 0.102904958 172.31.31.144 -> 172.31.23.72 TCP 66 6633 → 33660 [ACK] Seq=1090 Ack=247 Win=853 Len=0 TSval=1300737 TSecr=26139837
105 0.102925275 172.31.31.144 -> 172.31.23.72 OpenFlow 187 Type: OFPT_PACKET_OUT
106 0.102970291 172.31.31.144 -> 172.31.23.72 TCP 187 6633 → 33654 [PSH, ACK] Seq=1 Ack=1 Win=853 Len=121 TSval=1300737 TSecr=26139289
107 0.103016131 172.31.31.144 -> 172.31.23.72 TCP 187 6633 → 33654 [PSH, ACK] Seq=122 Ack=1 Win=853 Len=121 TSval=1300737 TSecr=26139289
108 0.103071470 172.31.31.144 -> 172.31.23.72 TCP 187 6633 → 33654 [PSH, ACK] Seq=243 Ack=1 Win=853 Len=121 TSval=1300737 TSecr=26139289
109 0.103124915 172.31.31.144 -> 172.31.23.72 TCP 187 6633 → 33654 [PSH, ACK] Seq=364 Ack=1 Win=853 Len=121 TSval=1300737 TSecr=26139289
110 0.103191310 172.31.31.144 -> 172.31.23.72 TCP 187 6633 → 33654 [PSH, ACK] Seq=485 Ack=1 Win=853 Len=121 TSval=1300737 TSecr=26139289
111 0.103227095 172.31.23.72 -> 172.31.31.144 TCP 66 33660 → 6633 [ACK] Seq=247 Ack=1211 Win=213 Len=0 TSval=26139838 TSecr=1300737
112 0.103237620 172.31.31.144 -> 172.31.23.72 TCP 187 6633 → 33654 [PSH, ACK] Seq=606 Ack=1 Win=853 Len=121 TSval=1300737 TSecr=26139289
113 0.103296689 172.31.31.144 -> 172.31.23.72 TCP 187 6633 → 33654 [PSH, ACK] Seq=727 Ack=1 Win=853 Len=121 TSval=1300737 TSecr=26139289
114 0.103313936 172.31.23.72 -> 172.31.31.144 OpenFlow 189 Type: OFPT_PACKET_IN
115 0.103333654 172.31.23.72 -> 172.31.31.144 OpenFlow 435 Type: OFPT_PACKET_IN
116 0.103357466 172.31.31.144 -> 172.31.23.72 OpenFlow 187 Type: OFPT_PACKET_OUT
117 0.103413932 172.31.31.144 -> 172.31.23.72 OpenFlow 187 Type: OFPT_PACKET_OUT
118 0.103464048 172.31.31.144 -> 172.31.23.72 OpenFlow 187 Type: OFPT_PACKET_OUT
119 0.103507022 172.31.31.144 -> 172.31.23.72 OpenFlow 187 Type: OFPT_PACKET_OUT
120 0.103526927 172.31.31.144 -> 172.31.23.72 TCP 66 6633 → 33654 [ACK] Seq=969 Ack=124 Win=853 Len=0 TSval=1300737 TSecr=26139838
121 0.103549915 172.31.31.144 -> 172.31.23.72 TCP 66 6633 → 33654 [ACK] Seq=969 Ack=493 Win=853 Len=0 TSval=1300737 TSecr=26139838
122 0.103565320 172.31.31.144 -> 172.31.23.72 OpenFlow 187 Type: OFPT_PACKET_OUT
123 0.103615120 172.31.31.144 -> 172.31.23.72 OpenFlow 187 Type: OFPT_PACKET_OUT
124 0.103672860 172.31.31.144 -> 172.31.23.72 OpenFlow 187 Type: OFPT_PACKET_OUT
125 0.103747664 172.31.31.144 -> 172.31.23.72 TCP 187 6633 → 33646 [PSH, ACK] Seq=1 Ack=1 Win=853 Len=121 TSval=1300737 TSecr=26139247
126 0.103795639 172.31.23.72 -> 172.31.31.144 OpenFlow 189 Type: OFPT_PACKET_IN
127 0.103812443 172.31.31.144 -> 172.31.23.72 TCP 187 6633 → 33646 [PSH, ACK] Seq=122 Ack=1 Win=853 Len=121 TSval=1300737 TSecr=26139247
128 0.103818200 172.31.23.72 -> 172.31.31.144 OpenFlow 189 Type: OFPT_PACKET_IN
129 0.103869496 172.31.31.144 -> 172.31.23.72 TCP 187 6633 → 33646 [PSH, ACK] Seq=243 Ack=1 Win=853 Len=121 TSval=1300737 TSecr=26139247
130 0.103934128 172.31.31.144 -> 172.31.23.72 TCP 187 6633 → 33646 [PSH, ACK] Seq=364 Ack=1 Win=853 Len=121 TSval=1300737 TSecr=26139247
131 0.103995364 172.31.31.144 -> 172.31.23.72 TCP 187 6633 → 33646 [PSH, ACK] Seq=485 Ack=1 Win=853 Len=121 TSval=1300737 TSecr=26139247
132 0.104024106 172.31.31.144 -> 172.31.23.72 TCP 66 6633 → 33666 [ACK] Seq=727 Ack=370 Win=853 Len=0 TSval=1300737 TSecr=26139838
133 0.104042881 172.31.31.144 -> 172.31.23.72 TCP 66 6633 → 33666 [ACK] Seq=727 Ack=493 Win=853 Len=0 TSval=1300737 TSecr=26139838
134 0.104071666 172.31.31.144 -> 172.31.23.72 TCP 187 6633 → 33646 [PSH, ACK] Seq=606 Ack=1 Win=853 Len=121 TSval=1300737 TSecr=26139247
135 0.104092211 172.31.23.72 -> 172.31.31.144 OpenFlow 189 Type: OFPT_PACKET_IN
136 0.104115152 172.31.31.144 -> 172.31.23.72 OpenFlow 187 Type: OFPT_PACKET_OUT
137 0.104118814 172.31.23.72 -> 172.31.31.144 OpenFlow 681 Type: OFPT_PACKET_IN
138 0.104178668 172.31.31.144 -> 172.31.23.72 OpenFlow 187 Type: OFPT_PACKET_OUT
139 0.104220122 172.31.31.144 -> 172.31.23.72 OpenFlow 187 Type: OFPT_PACKET_OUT
140 0.104285229 172.31.31.144 -> 172.31.23.72 OpenFlow 187 Type: OFPT_PACKET_OUT
141 0.104326283 172.31.31.144 -> 172.31.23.72 TCP 66 6633 → 33646 [ACK] Seq=1211 Ack=124 Win=853 Len=0 TSval=1300737 TSecr=26139838
142 0.104345211 172.31.31.144 -> 172.31.23.72 TCP 66 6633 → 33646 [ACK] Seq=1211 Ack=739 Win=853 Len=0 TSval=1300737 TSecr=26139838
143 0.104364295 172.31.31.144 -> 172.31.23.72 TCP 187 6633 → 33644 [PSH, ACK] Seq=1 Ack=1 Win=853 Len=121 TSval=1300737 TSecr=26139226
144 0.104415242 172.31.31.144 -> 172.31.23.72 TCP 187 6633 → 33644 [PSH, ACK] Seq=122 Ack=1 Win=853 Len=121 TSval=1300737 TSecr=26139226
145 0.104475226 172.31.31.144 -> 172.31.23.72 TCP 187 6633 → 33644 [PSH, ACK] Seq=243 Ack=1 Win=853 Len=121 TSval=1300737 TSecr=26139226
146 0.104527840 172.31.31.144 -> 172.31.23.72 TCP 187 6633 → 33644 [PSH, ACK] Seq=364 Ack=1 Win=853 Len=121 TSval=1300737 TSecr=26139226
147 0.104591200 172.31.31.144 -> 172.31.23.72 TCP 187 6633 → 33644 [PSH, ACK] Seq=485 Ack=1 Win=853 Len=121 TSval=1300737 TSecr=26139226
148 0.104625222 172.31.23.72 -> 172.31.31.144 TCP 66 33646 → 6633 [ACK] Seq=739 Ack=1211 Win=213 Len=0 TSval=26139838 TSecr=1300737
149 0.104639152 172.31.31.144 -> 172.31.23.72 TCP 187 6633 → 33644 [PSH, ACK] Seq=606 Ack=1 Win=853 Len=121 TSval=1300737 TSecr=26139226
150 0.104711713 172.31.23.72 -> 172.31.31.144 OpenFlow 189 Type: OFPT_PACKET_IN
151 0.104735141 172.31.23.72 -> 172.31.31.144 OpenFlow 189 Type: OFPT_PACKET_IN
152 0.104930310 172.31.31.144 -> 172.31.23.72 TCP 66 6633 → 33644 [ACK] Seq=727 Ack=124 Win=853 Len=0 TSval=1300737 TSecr=26139838
153 0.104960485 172.31.31.144 -> 172.31.23.72 TCP 66 6633 → 33644 [ACK] Seq=727 Ack=247 Win=853 Len=0 TSval=1300737 TSecr=26139838
154 0.105016590 172.31.23.72 -> 172.31.31.144 OpenFlow 189 Type: OFPT_PACKET_IN
155 0.105039270 172.31.23.72 -> 172.31.31.144 OpenFlow 435 Type: OFPT_PACKET_IN
156 0.105055785 172.31.23.72 -> 172.31.31.144 OpenFlow 189 Type: OFPT_PACKET_IN
157 0.105082905 172.31.23.72 -> 172.31.31.144 OpenFlow 435 Type: OFPT_PACKET_IN
158 0.105091709 172.31.23.72 -> 172.31.31.144 OpenFlow 189 Type: OFPT_PACKET_IN
159 0.105123290 172.31.23.72 -> 172.31.31.144 OpenFlow 927 Type: OFPT_PACKET_IN
160 0.105150101 172.31.23.72 -> 172.31.31.144 OpenFlow 189 Type: OFPT_PACKET_IN
161 0.105166874 172.31.23.72 -> 172.31.31.144 OpenFlow 189 Type: OFPT_PACKET_IN
162 0.105179403 172.31.23.72 -> 172.31.31.144 OpenFlow 189 Type: OFPT_PACKET_IN
163 0.105196737 172.31.23.72 -> 172.31.31.144 OpenFlow 189 Type: OFPT_PACKET_IN
164 0.105216921 172.31.23.72 -> 172.31.31.144 OpenFlow 189 Type: OFPT_PACKET_IN
165 0.105219109 172.31.23.72 -> 172.31.31.144 OpenFlow 189 Type: OFPT_PACKET_IN
166 0.105226277 172.31.31.144 -> 172.31.23.72 TCP 66 6633 → 33632 [ACK] Seq=1 Ack=124 Win=853 Len=0 TSval=1300737 TSecr=26139838
167 0.105250668 172.31.23.72 -> 172.31.31.144 OpenFlow 189 Type: OFPT_PACKET_IN
168 0.105255244 172.31.23.72 -> 172.31.31.144 OpenFlow 189 Type: OFPT_PACKET_IN
169 0.105260984 172.31.23.72 -> 172.31.31.144 OpenFlow 189 Type: OFPT_PACKET_IN
170 0.105281185 172.31.23.72 -> 172.31.31.144 OpenFlow 189 Type: OFPT_PACKET_IN
171 0.105291248 172.31.31.144 -> 172.31.23.72 TCP 66 6633 → 33632 [ACK] Seq=1 Ack=493 Win=853 Len=0 TSval=1300737 TSecr=26139838
172 0.105294322 172.31.31.144 -> 172.31.23.72 TCP 66 6633 → 33662 [ACK] Seq=1 Ack=124 Win=853 Len=0 TSval=1300737 TSecr=26139838
173 0.105297270 172.31.31.144 -> 172.31.23.72 TCP 66 6633 → 33662 [ACK] Seq=1 Ack=493 Win=853 Len=0 TSval=1300737 TSecr=26139838
174 0.105323302 172.31.23.72 -> 172.31.31.144 OpenFlow 189 Type: OFPT_PACKET_IN
175 0.105365809 172.31.23.72 -> 172.31.31.144 OpenFlow 435 Type: OFPT_PACKET_IN
176 0.105367982 172.31.23.72 -> 172.31.31.144 OpenFlow 927 Type: OFPT_PACKET_IN
177 0.105380864 172.31.31.144 -> 172.31.23.72 TCP 66 6633 → 33648 [ACK] Seq=1 Ack=124 Win=853 Len=0 TSval=1300737 TSecr=26139838
178 0.105384348 172.31.31.144 -> 172.31.23.72 TCP 66 6633 → 33648 [ACK] Seq=1 Ack=985 Win=853 Len=0 TSval=1300737 TSecr=26139838
179 0.105405762 172.31.23.72 -> 172.31.31.144 OpenFlow 435 Type: OFPT_PACKET_IN
180 0.105457960 172.31.31.144 -> 172.31.23.72 TCP 66 6633 → 33672 [ACK] Seq=1 Ack=124 Win=853 Len=0 TSval=1300737 TSecr=26139838
181 0.105462029 172.31.31.144 -> 172.31.23.72 TCP 66 6633 → 33672 [ACK] Seq=1 Ack=247 Win=853 Len=0 TSval=1300737 TSecr=26139838
182 0.105463660 172.31.31.144 -> 172.31.23.72 TCP 66 6633 → 33630 [ACK] Seq=1 Ack=124 Win=853 Len=0 TSval=1300737 TSecr=26139838
183 0.105480530 172.31.31.144 -> 172.31.23.72 TCP 66 6633 → 33670 [ACK] Seq=1 Ack=370 Win=853 Len=0 TSval=1300737 TSecr=26139838
184 0.105483413 172.31.31.144 -> 172.31.23.72 TCP 66 6633 → 33664 [ACK] Seq=1 Ack=124 Win=853 Len=0 TSval=1300737 TSecr=26139838
185 0.105499909 172.31.31.144 -> 172.31.23.72 TCP 66 6633 → 33630 [ACK] Seq=1 Ack=247 Win=853 Len=0 TSval=1300737 TSecr=26139838
186 0.105512359 172.31.23.72 -> 172.31.31.144 OpenFlow 189 Type: OFPT_PACKET_IN
187 0.105540231 172.31.31.144 -> 172.31.23.72 TCP 66 6633 → 33670 [ACK] Seq=1 Ack=493 Win=853 Len=0 TSval=1300737 TSecr=26139838
188 0.105548317 172.31.23.72 -> 172.31.31.144 OpenFlow 189 Type: OFPT_PACKET_IN
189 0.105559664 172.31.23.72 -> 172.31.31.144 OpenFlow 189 Type: OFPT_PACKET_IN
190 0.105572166 172.31.23.72 -> 172.31.31.144 OpenFlow 189 Type: OFPT_PACKET_IN
191 0.105583924 172.31.31.144 -> 172.31.23.72 TCP 66 6633 → 33664 [ACK] Seq=1 Ack=247 Win=853 Len=0 TSval=1300737 TSecr=26139838
192 0.105587086 172.31.31.144 -> 172.31.23.72 TCP 66 6633 → 33658 [ACK] Seq=1 Ack=370 Win=853 Len=0 TSval=1300737 TSecr=26139838
193 0.105604631 172.31.23.72 -> 172.31.31.144 OpenFlow 189 Type: OFPT_PACKET_IN
194 0.105612840 172.31.23.72 -> 172.31.31.144 OpenFlow 189 Type: OFPT_PACKET_IN
195 0.105630357 172.31.23.72 -> 172.31.31.144 OpenFlow 189 Type: OFPT_PACKET_IN
196 0.105647273 172.31.23.72 -> 172.31.31.144 OpenFlow 189 Type: OFPT_PACKET_IN
197 0.105649525 172.31.23.72 -> 172.31.31.144 OpenFlow 927 Type: OFPT_PACKET_IN
198 0.105673351 172.31.31.144 -> 172.31.23.72 TCP 66 6633 → 33658 [ACK] Seq=1 Ack=739 Win=853 Len=0 TSval=1300737 TSecr=26139838
199 0.105721371 172.31.23.72 -> 172.31.31.144 OpenFlow 435 Type: OFPT_PACKET_IN
200 0.105726265 172.31.23.72 -> 172.31.31.144 OpenFlow 681 Type: OFPT_PACKET_IN
201 0.105780829 172.31.31.144 -> 172.31.23.72 TCP 66 6633 → 33668 [ACK] Seq=969 Ack=124 Win=853 Len=0 TSval=1300737 TSecr=26139838
202 0.105787543 172.31.23.72 -> 172.31.31.144 OpenFlow 189 Type: OFPT_PACKET_IN
203 0.105829577 172.31.31.144 -> 172.31.23.72 TCP 66 6633 → 33668 [ACK] Seq=969 Ack=247 Win=853 Len=0 TSval=1300737 TSecr=26139838
204 0.105833460 172.31.31.144 -> 172.31.23.72 TCP 66 6633 → 33638 [ACK] Seq=1 Ack=493 Win=853 Len=0 TSval=1300737 TSecr=26139838
205 0.105876029 172.31.31.144 -> 172.31.23.72 TCP 66 6633 → 33656 [ACK] Seq=727 Ack=124 Win=853 Len=0 TSval=1300737 TSecr=26139838
206 0.105894541 172.31.31.144 -> 172.31.23.72 TCP 66 6633 → 33652 [ACK] Seq=969 Ack=124 Win=853 Len=0 TSval=1300737 TSecr=26139838
207 0.105912198 172.31.31.144 -> 172.31.23.72 TCP 66 6633 → 33642 [ACK] Seq=1 Ack=985 Win=853 Len=0 TSval=1300737 TSecr=26139838
208 0.105931339 172.31.31.144 -> 172.31.23.72 TCP 66 6633 → 33636 [ACK] Seq=969 Ack=124 Win=853 Len=0 TSval=1300737 TSecr=26139838
209 0.105949863 172.31.31.144 -> 172.31.23.72 TCP 66 6633 → 33656 [ACK] Seq=727 Ack=247 Win=853 Len=0 TSval=1300737 TSecr=26139838
210 0.105968303 172.31.31.144 -> 172.31.23.72 TCP 66 6633 → 33650 [ACK] Seq=1211 Ack=370 Win=853 Len=0 TSval=1300737 TSecr=26139838
211 0.105997216 172.31.31.144 -> 172.31.23.72 TCP 66 6633 → 33640 [ACK] Seq=1211 Ack=370 Win=853 Len=0 TSval=1300737 TSecr=26139838
212 0.106015513 172.31.31.144 -> 172.31.23.72 TCP 66 6633 → 33652 [ACK] Seq=969 Ack=985 Win=853 Len=0 TSval=1300737 TSecr=26139838
213 0.106044308 172.31.31.144 -> 172.31.23.72 TCP 66 6633 → 33636 [ACK] Seq=969 Ack=493 Win=853 Len=0 TSval=1300737 TSecr=26139838
214 0.106062268 172.31.31.144 -> 172.31.23.72 TCP 66 6633 → 33650 [ACK] Seq=1211 Ack=985 Win=853 Len=0 TSval=1300737 TSecr=26139838
215 0.106081285 172.31.31.144 -> 172.31.23.72 TCP 66 6633 → 33640 [ACK] Seq=1211 Ack=493 Win=853 Len=0 TSval=1300737 TSecr=26139838
216 0.143076833 172.31.23.72 -> 172.31.31.144 TCP 66 33654 → 6633 [ACK] Seq=493 Ack=969 Win=213 Len=0 TSval=26139848 TSecr=1300737
217 0.199984060 172.31.31.144 -> 172.31.23.72 OpenFlow 187 Type: OFPT_PACKET_OUT
218 0.200006275 172.31.31.144 -> 172.31.23.72 OpenFlow 187 Type: OFPT_PACKET_OUT
219 0.200030520 172.31.31.144 -> 172.31.23.72 OpenFlow 187 Type: OFPT_PACKET_OUT
220 0.200075204 172.31.31.144 -> 172.31.23.72 OpenFlow 187 Type: OFPT_PACKET_OUT
221 0.200122620 172.31.31.144 -> 172.31.23.72 OpenFlow 187 Type: OFPT_PACKET_OUT
222 0.200161534 172.31.31.144 -> 172.31.23.72 OpenFlow 187 Type: OFPT_PACKET_OUT
223 0.200209635 172.31.31.144 -> 172.31.23.72 OpenFlow 187 Type: OFPT_PACKET_OUT
224 0.200249597 172.31.31.144 -> 172.31.23.72 OpenFlow 187 Type: OFPT_PACKET_OUT
225 0.200332304 172.31.31.144 -> 172.31.23.72 OpenFlow 187 Type: OFPT_PACKET_OUT
226 0.200365113 172.31.31.144 -> 172.31.23.72 OpenFlow 187 Type: OFPT_PACKET_OUT
227 0.200402576 172.31.31.144 -> 172.31.23.72 OpenFlow 187 Type: OFPT_PACKET_OUT
228 0.200461697 172.31.31.144 -> 172.31.23.72 OpenFlow 187 Type: OFPT_PACKET_OUT
229 0.200539930 172.31.31.144 -> 172.31.23.72 OpenFlow 187 Type: OFPT_PACKET_OUT
230 0.200583458 172.31.31.144 -> 172.31.23.72 OpenFlow 187 Type: OFPT_PACKET_OUT
231 0.200628817 172.31.31.144 -> 172.31.23.72 OpenFlow 187 Type: OFPT_PACKET_OUT
232 0.200684975 172.31.31.144 -> 172.31.23.72 OpenFlow 187 Type: OFPT_PACKET_OUT
233 0.200709149 172.31.23.72 -> 172.31.31.144 TCP 66 33632 → 6633 [ACK] Seq=493 Ack=969 Win=213 Len=0 TSval=26139862 TSecr=1300761
234 0.200760680 172.31.31.144 -> 172.31.23.72 OpenFlow 187 Type: OFPT_PACKET_OUT
235 0.200789694 172.31.31.144 -> 172.31.23.72 OpenFlow 187 Type: OFPT_PACKET_OUT
236 0.200884789 172.31.31.144 -> 172.31.23.72 OpenFlow 187 Type: OFPT_PACKET_OUT
237 0.200933421 172.31.31.144 -> 172.31.23.72 OpenFlow 187 Type: OFPT_PACKET_OUT
238 0.200982568 172.31.31.144 -> 172.31.23.72 OpenFlow 187 Type: OFPT_PACKET_OUT
239 0.201048841 172.31.31.144 -> 172.31.23.72 OpenFlow 187 Type: OFPT_PACKET_OUT
240 0.201114581 172.31.31.144 -> 172.31.23.72 OpenFlow 187 Type: OFPT_PACKET_OUT
241 0.201165481 172.31.31.144 -> 172.31.23.72 OpenFlow 187 Type: OFPT_PACKET_OUT
242 0.201215254 172.31.31.144 -> 172.31.23.72 OpenFlow 187 Type: OFPT_PACKET_OUT
243 0.201245438 172.31.23.72 -> 172.31.31.144 TCP 66 33662 → 6633 [ACK] Seq=493 Ack=1211 Win=213 Len=0 TSval=26139862 TSecr=1300761
244 0.201291569 172.31.31.144 -> 172.31.23.72 OpenFlow 187 Type: OFPT_PACKET_OUT
245 0.201324746 172.31.31.144 -> 172.31.23.72 TCP 187 6633 → 33676 [PSH, ACK] Seq=1 Ack=1 Win=853 Len=121 TSval=1300761 TSecr=26139427
246 0.201365272 172.31.31.144 -> 172.31.23.72 TCP 187 6633 → 33676 [PSH, ACK] Seq=122 Ack=1 Win=853 Len=121 TSval=1300761 TSecr=26139427
247 0.201418072 172.31.31.144 -> 172.31.23.72 TCP 187 6633 → 33676 [PSH, ACK] Seq=243 Ack=1 Win=853 Len=121 TSval=1300761 TSecr=26139427
248 0.201475387 172.31.31.144 -> 172.31.23.72 TCP 187 6633 → 33676 [PSH, ACK] Seq=364 Ack=1 Win=853 Len=121 TSval=1300761 TSecr=26139427
249 0.201530767 172.31.31.144 -> 172.31.23.72 TCP 187 6633 → 33676 [PSH, ACK] Seq=485 Ack=1 Win=853 Len=121 TSval=1300761 TSecr=26139427
250 0.201584382 172.31.31.144 -> 172.31.23.72 TCP 187 6633 → 33676 [PSH, ACK] Seq=606 Ack=1 Win=853 Len=121 TSval=1300761 TSecr=26139427
251 0.201674778 172.31.23.72 -> 172.31.31.144 TCP 66 33648 → 6633 [ACK] Seq=985 Ack=969 Win=213 Len=0 TSval=26139862 TSecr=1300761
252 0.201693117 172.31.31.144 -> 172.31.23.72 TCP 187 6633 → 33674 [PSH, ACK] Seq=1 Ack=1 Win=853 Len=121 TSval=1300761 TSecr=26139422
253 0.201717885 172.31.31.144 -> 172.31.23.72 TCP 187 6633 → 33674 [PSH, ACK] Seq=122 Ack=1 Win=853 Len=121 TSval=1300761 TSecr=26139422
254 0.201758421 172.31.31.144 -> 172.31.23.72 TCP 187 6633 → 33674 [PSH, ACK] Seq=243 Ack=1 Win=853 Len=121 TSval=1300761 TSecr=26139422
255 0.201816457 172.31.31.144 -> 172.31.23.72 TCP 187 6633 → 33674 [PSH, ACK] Seq=364 Ack=1 Win=853 Len=121 TSval=1300761 TSecr=26139422
256 0.201873949 172.31.31.144 -> 172.31.23.72 TCP 187 6633 → 33674 [PSH, ACK] Seq=485 Ack=1 Win=853 Len=121 TSval=1300761 TSecr=26139422
257 0.201933606 172.31.31.144 -> 172.31.23.72 TCP 187 6633 → 33674 [PSH, ACK] Seq=606 Ack=1 Win=853 Len=121 TSval=1300761 TSecr=26139422
258 0.201942842 172.31.23.72 -> 172.31.31.144 TCP 66 33676 → 6633 [ACK] Seq=1 Ack=727 Win=213 Len=0 TSval=26139862 TSecr=1300761
259 0.201988392 172.31.31.144 -> 172.31.23.72 TCP 187 6633 → 33674 [PSH, ACK] Seq=727 Ack=1 Win=853 Len=121 TSval=1300761 TSecr=26139422
260 0.202026751 172.31.23.72 -> 172.31.31.144 OpenFlow 189 Type: OFPT_PACKET_IN
261 0.202045183 172.31.31.144 -> 172.31.23.72 OpenFlow 187 Type: OFPT_PACKET_OUT
262 0.202049914 172.31.23.72 -> 172.31.31.144 OpenFlow 312 Type: OFPT_PACKET_IN
263 0.202070929 172.31.23.72 -> 172.31.31.144 OpenFlow 189 Type: OFPT_PACKET_IN
264 0.202116015 172.31.31.144 -> 172.31.23.72 OpenFlow 187 Type: OFPT_PACKET_OUT
265 0.202164468 172.31.31.144 -> 172.31.23.72 OpenFlow 187 Type: OFPT_PACKET_OUT
266 0.202215085 172.31.31.144 -> 172.31.23.72 OpenFlow 187 Type: OFPT_PACKET_OUT
267 0.202233825 172.31.31.144 -> 172.31.23.72 TCP 66 6633 → 33674 [ACK] Seq=969 Ack=124 Win=853 Len=0 TSval=1300761 TSecr=26139862
268 0.202253368 172.31.31.144 -> 172.31.23.72 TCP 66 6633 → 33674 [ACK] Seq=969 Ack=370 Win=853 Len=0 TSval=1300761 TSecr=26139862
269 0.202272677 172.31.31.144 -> 172.31.23.72 OpenFlow 187 Type: OFPT_PACKET_OUT
270 0.202292343 172.31.31.144 -> 172.31.23.72 TCP 66 6633 → 33674 [ACK] Seq=969 Ack=493 Win=853 Len=0 TSval=1300761 TSecr=26139862
271 0.202319317 172.31.31.144 -> 172.31.23.72 OpenFlow 187 Type: OFPT_PACKET_OUT
272 0.202377941 172.31.31.144 -> 172.31.23.72 OpenFlow 187 Type: OFPT_PACKET_OUT
273 0.202434594 172.31.31.144 -> 172.31.23.72 OpenFlow 187 Type: OFPT_PACKET_OUT
274 0.202458509 172.31.23.72 -> 172.31.31.144 OpenFlow 189 Type: OFPT_PACKET_IN
275 0.202479498 172.31.23.72 -> 172.31.31.144 OpenFlow 435 Type: OFPT_PACKET_IN
276 0.202509542 172.31.31.144 -> 172.31.23.72 OpenFlow 187 Type: OFPT_PACKET_OUT
277 0.202566331 172.31.31.144 -> 172.31.23.72 OpenFlow 187 Type: OFPT_PACKET_OUT
278 0.202630087 172.31.31.144 -> 172.31.23.72 OpenFlow 187 Type: OFPT_PACKET_OUT
279 0.202692811 172.31.31.144 -> 172.31.23.72 OpenFlow 187 Type: OFPT_PACKET_OUT
280 0.202718306 172.31.31.144 -> 172.31.23.72 TCP 66 6633 → 33672 [ACK] Seq=969 Ack=370 Win=853 Len=0 TSval=1300762 TSecr=26139862
281 0.202730287 172.31.31.144 -> 172.31.23.72 OpenFlow 187 Type: OFPT_PACKET_OUT
282 0.202789480 172.31.31.144 -> 172.31.23.72 OpenFlow 187 Type: OFPT_PACKET_OUT
283 0.202846124 172.31.31.144 -> 172.31.23.72 OpenFlow 187 Type: OFPT_PACKET_OUT
284 0.202864570 172.31.31.144 -> 172.31.23.72 TCP 66 6633 → 33672 [ACK] Seq=969 Ack=739 Win=853 Len=0 TSval=1300762 TSecr=26139862
285 0.202921661 172.31.31.144 -> 172.31.23.72 OpenFlow 187 Type: OFPT_PACKET_OUT
286 0.202927686 172.31.23.72 -> 172.31.31.144 OpenFlow 189 Type: OFPT_PACKET_IN
287 0.202948058 172.31.23.72 -> 172.31.31.144 OpenFlow 189 Type: OFPT_PACKET_IN
288 0.202973070 172.31.31.144 -> 172.31.23.72 OpenFlow 187 Type: OFPT_PACKET_OUT
289 0.203046686 172.31.31.144 -> 172.31.23.72 OpenFlow 187 Type: OFPT_PACKET_OUT
290 0.203077954 172.31.31.144 -> 172.31.23.72 OpenFlow 187 Type: OFPT_PACKET_OUT
291 0.203126952 172.31.31.144 -> 172.31.23.72 OpenFlow 187 Type: OFPT_PACKET_OUT
292 0.203157255 172.31.31.144 -> 172.31.23.72 TCP 66 6633 → 33630 [ACK] Seq=727 Ack=370 Win=853 Len=0 TSval=1300762 TSecr=26139862
293 0.203183072 172.31.31.144 -> 172.31.23.72 OpenFlow 187 Type: OFPT_PACKET_OUT
294 0.203228490 172.31.23.72 -> 172.31.31.144 OpenFlow 189 Type: OFPT_PACKET_IN
295 0.203238557 172.31.31.144 -> 172.31.23.72 OpenFlow 187 Type: OFPT_PACKET_OUT
296 0.203254304 172.31.23.72 -> 172.31.31.144 OpenFlow 189 Type: OFPT_PACKET_IN
297 0.203301717 172.31.31.144 -> 172.31.23.72 OpenFlow 187 Type: OFPT_PACKET_OUT
298 0.203318896 172.31.31.144 -> 172.31.23.72 TCP 66 6633 → 33630 [ACK] Seq=727 Ack=493 Win=853 Len=0 TSval=1300762 TSecr=26139862
299 0.203366077 172.31.31.144 -> 172.31.23.72 OpenFlow 187 Type: OFPT_PACKET_OUT
300 0.203434025 172.31.31.144 -> 172.31.23.72 OpenFlow 187 Type: OFPT_PACKET_OUT
301 0.203472724 172.31.31.144 -> 172.31.23.72 TCP 66 6633 → 33670 [ACK] Seq=969 Ack=739 Win=853 Len=0 TSval=1300762 TSecr=26139863
302 0.203490668 172.31.31.144 -> 172.31.23.72 OpenFlow 187 Type: OFPT_PACKET_OUT
303 0.203547039 172.31.31.144 -> 172.31.23.72 OpenFlow 187 Type: OFPT_PACKET_OUT
304 0.203615885 172.31.31.144 -> 172.31.23.72 OpenFlow 187 Type: OFPT_PACKET_OUT
305 0.203626827 172.31.23.72 -> 172.31.31.144 OpenFlow 189 Type: OFPT_PACKET_IN
306 0.203646578 172.31.23.72 -> 172.31.31.144 OpenFlow 435 Type: OFPT_PACKET_IN
307 0.203675877 172.31.31.144 -> 172.31.23.72 OpenFlow 187 Type: OFPT_PACKET_OUT
308 0.203735119 172.31.31.144 -> 172.31.23.72 OpenFlow 187 Type: OFPT_PACKET_OUT
309 0.203772086 172.31.31.144 -> 172.31.23.72 OpenFlow 187 Type: OFPT_PACKET_OUT
310 0.203833651 172.31.31.144 -> 172.31.23.72 OpenFlow 187 Type: OFPT_PACKET_OUT
311 0.203859266 172.31.31.144 -> 172.31.23.72 TCP 66 6633 → 33664 [ACK] Seq=727 Ack=370 Win=853 Len=0 TSval=1300762 TSecr=26139863
312 0.203878794 172.31.31.144 -> 172.31.23.72 TCP 66 6633 → 33664 [ACK] Seq=727 Ack=739 Win=853 Len=0 TSval=1300762 TSecr=26139863
313 0.203905269 172.31.31.144 -> 172.31.23.72 OpenFlow 187 Type: OFPT_PACKET_OUT
314 0.203957021 172.31.31.144 -> 172.31.23.72 OpenFlow 187 Type: OFPT_PACKET_OUT
315 0.204004614 172.31.31.144 -> 172.31.23.72 OpenFlow 187 Type: OFPT_PACKET_OUT
316 0.204073614 172.31.31.144 -> 172.31.23.72 OpenFlow 187 Type: OFPT_PACKET_OUT
317 0.204115418 172.31.31.144 -> 172.31.23.72 OpenFlow 187 Type: OFPT_PACKET_OUT
318 0.204167348 172.31.31.144 -> 172.31.23.72 OpenFlow 187 Type: OFPT_PACKET_OUT
319 0.204225269 172.31.31.144 -> 172.31.23.72 OpenFlow 187 Type: OFPT_PACKET_OUT
320 0.204260635 172.31.23.72 -> 172.31.31.144 TCP 66 33658 → 6633 [ACK] Seq=739 Ack=727 Win=213 Len=0 TSval=26139863 TSecr=1300762
321 0.204276750 172.31.31.144 -> 172.31.23.72 OpenFlow 187 Type: OFPT_PACKET_OUT
322 0.204330492 172.31.31.144 -> 172.31.23.72 OpenFlow 187 Type: OFPT_PACKET_OUT
323 0.204395763 172.31.31.144 -> 172.31.23.72 OpenFlow 187 Type: OFPT_PACKET_OUT
324 0.204440178 172.31.31.144 -> 172.31.23.72 OpenFlow 187 Type: OFPT_PACKET_OUT
325 0.204490773 172.31.31.144 -> 172.31.23.72 OpenFlow 187 Type: OFPT_PACKET_OUT
326 0.204546612 172.31.31.144 -> 172.31.23.72 OpenFlow 187 Type: OFPT_PACKET_OUT
327 0.204621639 172.31.31.144 -> 172.31.23.72 OpenFlow 187 Type: OFPT_PACKET_OUT
328 0.204668654 172.31.31.144 -> 172.31.23.72 OpenFlow 187 Type: OFPT_PACKET_OUT
329 0.204726727 172.31.31.144 -> 172.31.23.72 OpenFlow 187 Type: OFPT_PACKET_OUT
330 0.204781337 172.31.31.144 -> 172.31.23.72 OpenFlow 187 Type: OFPT_PACKET_OUT
331 0.204786668 172.31.23.72 -> 172.31.31.144 TCP 66 33642 → 6633 [ACK] Seq=985 Ack=1211 Win=213 Len=0 TSval=26139863 TSecr=1300762
332 0.204831230 172.31.31.144 -> 172.31.23.72 OpenFlow 187 Type: OFPT_PACKET_OUT
333 0.204864464 172.31.23.72 -> 172.31.31.144 OpenFlow 189 Type: OFPT_PACKET_IN
334 0.204885896 172.31.23.72 -> 172.31.31.144 OpenFlow 189 Type: OFPT_PACKET_IN
335 0.204912670 172.31.31.144 -> 172.31.23.72 OpenFlow 187 Type: OFPT_PACKET_OUT
336 0.205207442 172.31.23.72 -> 172.31.31.144 OpenFlow 189 Type: OFPT_PACKET_IN
337 0.205218628 172.31.31.144 -> 172.31.23.72 TCP 66 6633 → 33638 [ACK] Seq=727 Ack=739 Win=853 Len=0 TSval=1300762 TSecr=26139863
338 0.205235083 172.31.23.72 -> 172.31.31.144 OpenFlow 312 Type: OFPT_PACKET_IN
339 0.205259196 172.31.23.72 -> 172.31.31.144 OpenFlow 189 Type: OFPT_PACKET_IN
340 0.205264012 172.31.23.72 -> 172.31.31.144 OpenFlow 189 Type: OFPT_PACKET_IN
341 0.205288566 172.31.23.72 -> 172.31.31.144 OpenFlow 189 Type: OFPT_PACKET_IN
342 0.205311457 172.31.23.72 -> 172.31.31.144 OpenFlow 189 Type: OFPT_PACKET_IN
343 0.205313714 172.31.23.72 -> 172.31.31.144 OpenFlow 435 Type: OFPT_PACKET_IN
344 0.205325431 172.31.23.72 -> 172.31.31.144 OpenFlow 189 Type: OFPT_PACKET_IN
345 0.205343348 172.31.23.72 -> 172.31.31.144 OpenFlow 189 Type: OFPT_PACKET_IN
346 0.205348288 172.31.23.72 -> 172.31.31.144 OpenFlow 189 Type: OFPT_PACKET_IN
347 0.205366926 172.31.23.72 -> 172.31.31.144 OpenFlow 189 Type: OFPT_PACKET_IN
348 0.205369123 172.31.23.72 -> 172.31.31.144 OpenFlow 189 Type: OFPT_PACKET_IN
349 0.205389728 172.31.23.72 -> 172.31.31.144 OpenFlow 189 Type: OFPT_PACKET_IN
350 0.205391853 172.31.23.72 -> 172.31.31.144 OpenFlow 681 Type: OFPT_PACKET_IN
351 0.205410907 172.31.23.72 -> 172.31.31.144 OpenFlow 189 Type: OFPT_PACKET_IN
352 0.205425720 172.31.23.72 -> 172.31.31.144 OpenFlow 189 Type: OFPT_PACKET_IN
353 0.205431260 172.31.23.72 -> 172.31.31.144 OpenFlow 681 Type: OFPT_PACKET_IN
354 0.205447012 172.31.23.72 -> 172.31.31.144 OpenFlow 189 Type: OFPT_PACKET_IN
355 0.205459625 172.31.23.72 -> 172.31.31.144 OpenFlow 189 Type: OFPT_PACKET_IN
356 0.205481294 172.31.23.72 -> 172.31.31.144 OpenFlow 189 Type: OFPT_PACKET_IN
357 0.205483537 172.31.23.72 -> 172.31.31.144 OpenFlow 927 Type: OFPT_PACKET_IN
358 0.205498999 172.31.23.72 -> 172.31.31.144 OpenFlow 189 Type: OFPT_PACKET_IN
359 0.205510925 172.31.23.72 -> 172.31.31.144 OpenFlow 189 Type: OFPT_PACKET_IN
360 0.205512900 172.31.23.72 -> 172.31.31.144 OpenFlow 435 Type: OFPT_PACKET_IN
361 0.205539246 172.31.23.72 -> 172.31.31.144 OpenFlow 189 Type: OFPT_PACKET_IN
362 0.205583833 172.31.31.144 -> 172.31.23.72 TCP 66 6633 → 33668 [ACK] Seq=969 Ack=370 Win=853 Len=0 TSval=1300762 TSecr=26139863
363 0.205588685 172.31.31.144 -> 172.31.23.72 TCP 66 6633 → 33668 [ACK] Seq=969 Ack=616 Win=853 Len=0 TSval=1300762 TSecr=26139863
364 0.205590781 172.31.31.144 -> 172.31.23.72 TCP 66 6633 → 33668 [ACK] Seq=969 Ack=739 Win=853 Len=0 TSval=1300762 TSecr=26139863
365 0.205592648 172.31.31.144 -> 172.31.23.72 TCP 66 6633 → 33656 [ACK] Seq=727 Ack=370 Win=853 Len=0 TSval=1300762 TSecr=26139863
366 0.205594456 172.31.31.144 -> 172.31.23.72 TCP 66 6633 → 33636 [ACK] Seq=969 Ack=616 Win=853 Len=0 TSval=1300762 TSecr=26139863
367 0.205596318 172.31.31.144 -> 172.31.23.72 TCP 66 6633 → 33650 [ACK] Seq=1211 Ack=1108 Win=853 Len=0 TSval=1300762 TSecr=26139863
368 0.205598174 172.31.31.144 -> 172.31.23.72 TCP 66 6633 → 33656 [ACK] Seq=727 Ack=739 Win=853 Len=0 TSval=1300762 TSecr=26139863
369 0.205603593 172.31.23.72 -> 172.31.31.144 OpenFlow 435 Type: OFPT_PACKET_IN
370 0.205609155 172.31.23.72 -> 172.31.31.144 OpenFlow 435 Type: OFPT_PACKET_IN
371 0.205719170 172.31.23.72 -> 172.31.31.144 OpenFlow 189 Type: OFPT_PACKET_IN
372 0.205721488 172.31.23.72 -> 172.31.31.144 OpenFlow 681 Type: OFPT_PACKET_IN
373 0.205723419 172.31.23.72 -> 172.31.31.144 OpenFlow 435 Type: OFPT_PACKET_IN
374 0.205725103 172.31.23.72 -> 172.31.31.144 OpenFlow 189 Type: OFPT_PACKET_IN
375 0.205805397 172.31.31.144 -> 172.31.23.72 TCP 66 6633 → 33640 [ACK] Seq=1211 Ack=616 Win=853 Len=0 TSval=1300762 TSecr=26139863
376 0.205808848 172.31.31.144 -> 172.31.23.72 TCP 66 6633 → 33634 [ACK] Seq=1211 Ack=370 Win=853 Len=0 TSval=1300762 TSecr=26139863
377 0.205810915 172.31.31.144 -> 172.31.23.72 TCP 66 6633 → 33636 [ACK] Seq=969 Ack=739 Win=853 Len=0 TSval=1300762 TSecr=26139863
378 0.205812813 172.31.31.144 -> 172.31.23.72 TCP 66 6633 → 33650 [ACK] Seq=1211 Ack=1231 Win=853 Len=0 TSval=1300762 TSecr=26139863
379 0.205814485 172.31.31.144 -> 172.31.23.72 TCP 66 6633 → 33654 [ACK] Seq=969 Ack=616 Win=853 Len=0 TSval=1300762 TSecr=26139863
