  1 0.000000000 172.31.31.144 -> 172.31.23.72 TCP 90 6633 → 45414 [PSH, ACK] Seq=1 Ack=1 Win=853 Len=24 TSval=819481 TSecr=19389332
  2 0.000027523 172.31.31.144 -> 172.31.23.72 TCP 82 6633 → 45414 [PSH, ACK] Seq=25 Ack=1 Win=853 Len=16 TSval=819481 TSecr=19389332
  3 0.000031561 172.31.31.144 -> 172.31.23.72 TCP 90 6633 → 45414 [PSH, ACK] Seq=41 Ack=1 Win=853 Len=24 TSval=819481 TSecr=19389332
  4 0.000344907 172.31.23.72 -> 172.31.31.144 OpenFlow 82 Type: OFPT_MULTIPART_REPLY, OFPMP_GROUP
  5 0.001551505 172.31.23.72 -> 172.31.31.144 OpenFlow 98 Type: OFPT_MULTIPART_REPLY, OFPMP_METER
  6 0.003298534 172.31.31.144 -> 172.31.23.72 TCP 66 6633 → 45414 [ACK] Seq=65 Ack=49 Win=853 Len=0 TSval=819482 TSecr=19389607
  7 0.098740257 172.31.31.144 -> 172.31.23.72 TCP 90 6633 → 45416 [PSH, ACK] Seq=1 Ack=1 Win=853 Len=24 TSval=819506 TSecr=19389332
  8 0.098769001 172.31.31.144 -> 172.31.23.72 TCP 90 6633 → 45418 [PSH, ACK] Seq=1 Ack=1 Win=853 Len=24 TSval=819506 TSecr=19389357
  9 0.098772303 172.31.31.144 -> 172.31.23.72 TCP 90 6633 → 45420 [PSH, ACK] Seq=1 Ack=1 Win=853 Len=24 TSval=819506 TSecr=19389357
 10 0.098775821 172.31.31.144 -> 172.31.23.72 TCP 106 6633 → 45420 [PSH, ACK] Seq=25 Ack=1 Win=853 Len=40 TSval=819506 TSecr=19389357
 11 0.098779353 172.31.31.144 -> 172.31.23.72 TCP 106 6633 → 45418 [PSH, ACK] Seq=25 Ack=1 Win=853 Len=40 TSval=819506 TSecr=19389357
 12 0.098781003 172.31.31.144 -> 172.31.23.72 TCP 106 6633 → 45416 [PSH, ACK] Seq=25 Ack=1 Win=853 Len=40 TSval=819506 TSecr=19389332
 13 0.098977265 172.31.23.72 -> 172.31.31.144 OpenFlow 82 Type: OFPT_MULTIPART_REPLY, OFPMP_GROUP
 14 0.099020213 172.31.23.72 -> 172.31.31.144 OpenFlow 82 Type: OFPT_MULTIPART_REPLY, OFPMP_GROUP
 15 0.099067672 172.31.23.72 -> 172.31.31.144 OpenFlow 82 Type: OFPT_MULTIPART_REPLY, OFPMP_GROUP
 16 0.101813813 172.31.23.72 -> 172.31.31.144 OpenFlow 98 Type: OFPT_MULTIPART_REPLY, OFPMP_METER
 17 0.101822982 172.31.23.72 -> 172.31.31.144 OpenFlow 98 Type: OFPT_MULTIPART_REPLY, OFPMP_METER
 18 0.101825318 172.31.23.72 -> 172.31.31.144 OpenFlow 98 Type: OFPT_MULTIPART_REPLY, OFPMP_METER
 19 0.104859575 172.31.31.144 -> 172.31.23.72 TCP 66 6633 → 45420 [ACK] Seq=65 Ack=17 Win=853 Len=0 TSval=819507 TSecr=19389631
 20 0.104870373 172.31.31.144 -> 172.31.23.72 TCP 66 6633 → 45420 [ACK] Seq=65 Ack=49 Win=853 Len=0 TSval=819507 TSecr=19389632
 21 0.104872769 172.31.31.144 -> 172.31.23.72 TCP 66 6633 → 45418 [ACK] Seq=65 Ack=49 Win=853 Len=0 TSval=819507 TSecr=19389631
 22 0.104875247 172.31.31.144 -> 172.31.23.72 TCP 66 6633 → 45416 [ACK] Seq=65 Ack=49 Win=853 Len=0 TSval=819507 TSecr=19389631
 23 0.200153333 172.31.31.144 -> 172.31.23.72 TCP 90 6633 → 45424 [PSH, ACK] Seq=1 Ack=1 Win=853 Len=24 TSval=819531 TSecr=19389357
 24 0.200174983 172.31.31.144 -> 172.31.23.72 TCP 90 6633 → 45422 [PSH, ACK] Seq=1 Ack=1 Win=853 Len=24 TSval=819531 TSecr=19389357
 25 0.200178506 172.31.31.144 -> 172.31.23.72 TCP 106 6633 → 45422 [PSH, ACK] Seq=25 Ack=1 Win=853 Len=40 TSval=819531 TSecr=19389357
 26 0.200181642 172.31.31.144 -> 172.31.23.72 TCP 106 6633 → 45424 [PSH, ACK] Seq=25 Ack=1 Win=853 Len=40 TSval=819531 TSecr=19389357
 27 0.200386675 172.31.23.72 -> 172.31.31.144 OpenFlow 82 Type: OFPT_MULTIPART_REPLY, OFPMP_GROUP
 28 0.200512311 172.31.23.72 -> 172.31.31.144 OpenFlow 82 Type: OFPT_MULTIPART_REPLY, OFPMP_GROUP
 29 0.201665540 172.31.23.72 -> 172.31.31.144 OpenFlow 98 Type: OFPT_MULTIPART_REPLY, OFPMP_METER
 30 0.201671483 172.31.23.72 -> 172.31.31.144 OpenFlow 98 Type: OFPT_MULTIPART_REPLY, OFPMP_METER
 31 0.203151772 172.31.31.144 -> 172.31.23.72 TCP 66 6633 → 45424 [ACK] Seq=65 Ack=17 Win=853 Len=0 TSval=819532 TSecr=19389657
 32 0.203160217 172.31.31.144 -> 172.31.23.72 TCP 66 6633 → 45422 [ACK] Seq=65 Ack=17 Win=853 Len=0 TSval=819532 TSecr=19389657
 33 0.203162390 172.31.31.144 -> 172.31.23.72 TCP 66 6633 → 45424 [ACK] Seq=65 Ack=49 Win=853 Len=0 TSval=819532 TSecr=19389657
 34 0.203164752 172.31.31.144 -> 172.31.23.72 TCP 66 6633 → 45422 [ACK] Seq=65 Ack=49 Win=853 Len=0 TSval=819532 TSecr=19389657
 35 0.214460421 172.31.23.72 -> 172.31.31.144 OpenFlow 146 Type: OFPT_PORT_STATUS
 36 0.214588883 172.31.23.72 -> 172.31.31.144 OpenFlow 146 Type: OFPT_PORT_STATUS
 37 0.241700258 172.31.31.144 -> 172.31.23.72 OpenFlow 146 Type: OFPT_FLOW_MOD
 38 0.241718520 172.31.31.144 -> 172.31.23.72 OpenFlow 154 Type: OFPT_BARRIER_REQUEST
 39 0.241722670 172.31.31.144 -> 172.31.23.72 OpenFlow 146 Type: OFPT_FLOW_MOD
 40 0.241725926 172.31.31.144 -> 172.31.23.72 OpenFlow 154 Type: OFPT_BARRIER_REQUEST
 41 0.241727833 172.31.31.144 -> 172.31.23.72 TCP 146 6633 → 45456 [PSH, ACK] Seq=1 Ack=1 Win=853 Len=80 TSval=819542 TSecr=19389332
 42 0.241731187 172.31.31.144 -> 172.31.23.72 TCP 146 6633 → 45458 [PSH, ACK] Seq=1 Ack=1 Win=853 Len=80 TSval=819542 TSecr=19389332
 43 0.241733667 172.31.31.144 -> 172.31.23.72 TCP 146 6633 → 45434 [PSH, ACK] Seq=1 Ack=1 Win=853 Len=80 TSval=819542 TSecr=19389333
 44 0.241736505 172.31.31.144 -> 172.31.23.72 TCP 154 6633 → 45458 [PSH, ACK] Seq=81 Ack=1 Win=853 Len=88 TSval=819542 TSecr=19389332
 45 0.241738371 172.31.31.144 -> 172.31.23.72 TCP 154 6633 → 45456 [PSH, ACK] Seq=81 Ack=1 Win=853 Len=88 TSval=819542 TSecr=19389332
 46 0.241740191 172.31.31.144 -> 172.31.23.72 OpenFlow 146 Type: OFPT_FLOW_MOD
 47 0.241741796 172.31.31.144 -> 172.31.23.72 OpenFlow 146 Type: OFPT_FLOW_MOD
 48 0.241742941 172.31.31.144 -> 172.31.23.72 OpenFlow 146 Type: OFPT_FLOW_MOD
 49 0.241744330 172.31.31.144 -> 172.31.23.72 TCP 154 6633 → 45434 [PSH, ACK] Seq=81 Ack=1 Win=853 Len=88 TSval=819542 TSecr=19389333
 50 0.241746189 172.31.31.144 -> 172.31.23.72 OpenFlow 154 Type: OFPT_BARRIER_REQUEST
 51 0.241747935 172.31.31.144 -> 172.31.23.72 OpenFlow 154 Type: OFPT_BARRIER_REQUEST
 52 0.241749493 172.31.31.144 -> 172.31.23.72 TCP 146 6633 → 45442 [PSH, ACK] Seq=1 Ack=1 Win=853 Len=80 TSval=819542 TSecr=19389333
 53 0.241751906 172.31.31.144 -> 172.31.23.72 TCP 322 6633 → 45442 [PSH, ACK] Seq=81 Ack=1 Win=853 Len=256 TSval=819542 TSecr=19389333
 54 0.241765041 172.31.31.144 -> 172.31.23.72 TCP 146 6633 → 45434 [PSH, ACK] Seq=169 Ack=1 Win=853 Len=80 TSval=819542 TSecr=19389333
 55 0.241766563 172.31.31.144 -> 172.31.23.72 OpenFlow 234 Type: OFPT_FLOW_MOD
 56 0.241768261 172.31.31.144 -> 172.31.23.72 TCP 154 6633 → 45434 [PSH, ACK] Seq=249 Ack=1 Win=853 Len=88 TSval=819542 TSecr=19389333
 57 0.241769891 172.31.31.144 -> 172.31.23.72 OpenFlow 146 Type: OFPT_FLOW_MOD
 58 0.241771680 172.31.31.144 -> 172.31.23.72 OpenFlow 74 Type: OFPT_BARRIER_REQUEST
 59 0.241773179 172.31.31.144 -> 172.31.23.72 OpenFlow 146 Type: OFPT_FLOW_MOD
 60 0.241779260 172.31.31.144 -> 172.31.23.72 OpenFlow 146 Type: OFPT_FLOW_MOD
 61 0.241782064 172.31.31.144 -> 172.31.23.72 OpenFlow 146 Type: OFPT_FLOW_MOD
 62 0.241783808 172.31.31.144 -> 172.31.23.72 OpenFlow 74 Type: OFPT_BARRIER_REQUEST
 63 0.241785324 172.31.31.144 -> 172.31.23.72 TCP 146 6633 → 45456 [PSH, ACK] Seq=169 Ack=1 Win=853 Len=80 TSval=819542 TSecr=19389332
 64 0.241786855 172.31.31.144 -> 172.31.23.72 OpenFlow 146 Type: OFPT_FLOW_MOD
 65 0.241789050 172.31.31.144 -> 172.31.23.72 OpenFlow 146 Type: OFPT_FLOW_MOD
 66 0.241790506 172.31.31.144 -> 172.31.23.72 OpenFlow 74 Type: OFPT_BARRIER_REQUEST
 67 0.241791752 172.31.31.144 -> 172.31.23.72 TCP 154 6633 → 45456 [PSH, ACK] Seq=249 Ack=1 Win=853 Len=88 TSval=819542 TSecr=19389332
 68 0.241793338 172.31.31.144 -> 172.31.23.72 OpenFlow 146 Type: OFPT_FLOW_MOD
 69 0.241794654 172.31.31.144 -> 172.31.23.72 OpenFlow 74 Type: OFPT_BARRIER_REQUEST
 70 0.241796067 172.31.31.144 -> 172.31.23.72 TCP 146 6633 → 45460 [PSH, ACK] Seq=1 Ack=1 Win=853 Len=80 TSval=819542 TSecr=19389333
 71 0.241925564 172.31.23.72 -> 172.31.31.144 OpenFlow 74 Type: OFPT_BARRIER_REPLY
 72 0.242006804 172.31.23.72 -> 172.31.31.144 OpenFlow 74 Type: OFPT_BARRIER_REPLY
 73 0.242036697 172.31.23.72 -> 172.31.31.144 TCP 66 45424 → 6633 [ACK] Seq=49 Ack=233 Win=213 Len=0 TSval=19389667 TSecr=819542
 74 0.242040690 172.31.23.72 -> 172.31.31.144 OpenFlow 74 Type: OFPT_BARRIER_REPLY
 75 0.242126465 172.31.23.72 -> 172.31.31.144 TCP 66 45416 → 6633 [ACK] Seq=49 Ack=233 Win=213 Len=0 TSval=19389667 TSecr=819542
 76 0.242132314 172.31.23.72 -> 172.31.31.144 OpenFlow 74 Type: OFPT_BARRIER_REPLY
 77 0.242182084 172.31.23.72 -> 172.31.31.144 TCP 66 45458 → 6633 [ACK] Seq=1 Ack=169 Win=213 Len=0 TSval=19389667 TSecr=819542
 78 0.242186617 172.31.23.72 -> 172.31.31.144 OpenFlow 74 Type: OFPT_BARRIER_REPLY
 79 0.242207758 172.31.23.72 -> 172.31.31.144 OpenFlow 74 Type: OFPT_BARRIER_REPLY
 80 0.242236036 172.31.23.72 -> 172.31.31.144 TCP 66 45414 → 6633 [ACK] Seq=49 Ack=233 Win=213 Len=0 TSval=19389667 TSecr=819542
 81 0.242240229 172.31.23.72 -> 172.31.31.144 OpenFlow 74 Type: OFPT_BARRIER_REPLY
 82 0.242261147 172.31.23.72 -> 172.31.31.144 OpenFlow 74 Type: OFPT_BARRIER_REPLY
 83 0.242299955 172.31.23.72 -> 172.31.31.144 OpenFlow 74 Type: OFPT_BARRIER_REPLY
 84 0.242482575 172.31.23.72 -> 172.31.31.144 OpenFlow 146 Type: OFPT_FLOW_REMOVED
 85 0.243089885 172.31.31.144 -> 172.31.23.72 OpenFlow 146 Type: OFPT_FLOW_MOD
 86 0.243095154 172.31.31.144 -> 172.31.23.72 OpenFlow 146 Type: OFPT_FLOW_MOD
 87 0.243097279 172.31.31.144 -> 172.31.23.72 OpenFlow 146 Type: OFPT_FLOW_MOD
 88 0.243098897 172.31.31.144 -> 172.31.23.72 OpenFlow 146 Type: OFPT_FLOW_MOD
 89 0.243100381 172.31.31.144 -> 172.31.23.72 OpenFlow 74 Type: OFPT_BARRIER_REQUEST
 90 0.243103311 172.31.31.144 -> 172.31.23.72 OpenFlow 146 Type: OFPT_FLOW_MOD
 91 0.243105316 172.31.31.144 -> 172.31.23.72 OpenFlow 154 Type: OFPT_BARRIER_REQUEST
 92 0.243106792 172.31.31.144 -> 172.31.23.72 OpenFlow 146 Type: OFPT_FLOW_MOD
 93 0.243108289 172.31.31.144 -> 172.31.23.72 OpenFlow 146 Type: OFPT_FLOW_MOD
 94 0.243109744 172.31.31.144 -> 172.31.23.72 OpenFlow 234 Type: OFPT_FLOW_MOD
 95 0.243111242 172.31.31.144 -> 172.31.23.72 OpenFlow 242 Type: OFPT_BARRIER_REQUEST
 96 0.243112901 172.31.31.144 -> 172.31.23.72 OpenFlow 146 Type: OFPT_FLOW_MOD
 97 0.243116289 172.31.23.72 -> 172.31.31.144 OpenFlow 226 Type: OFPT_FLOW_REMOVED
 98 0.243123441 172.31.31.144 -> 172.31.23.72 OpenFlow 74 Type: OFPT_BARRIER_REQUEST
 99 0.243132575 172.31.23.72 -> 172.31.31.144 OpenFlow 730 Type: OFPT_FLOW_REMOVED
100 0.243324879 172.31.23.72 -> 172.31.31.144 OpenFlow 394 Type: OFPT_FLOW_REMOVED
101 0.243327350 172.31.23.72 -> 172.31.31.144 OpenFlow 226 Type: OFPT_FLOW_REMOVED
102 0.243329048 172.31.23.72 -> 172.31.31.144 OpenFlow 226 Type: OFPT_FLOW_REMOVED
103 0.243330762 172.31.23.72 -> 172.31.31.144 OpenFlow 394 Type: OFPT_FLOW_REMOVED
104 0.243820718 172.31.23.72 -> 172.31.31.144 OpenFlow 226 Type: OFPT_FLOW_REMOVED
105 0.243826416 172.31.23.72 -> 172.31.31.144 OpenFlow 394 Type: OFPT_FLOW_REMOVED
106 0.243828268 172.31.23.72 -> 172.31.31.144 OpenFlow 394 Type: OFPT_FLOW_REMOVED
107 0.244718082 172.31.23.72 -> 172.31.31.144 OpenFlow 74 Type: OFPT_BARRIER_REPLY
108 0.244782793 172.31.23.72 -> 172.31.31.144 TCP 66 45460 → 6633 [ACK] Seq=81 Ack=169 Win=213 Len=0 TSval=19389668 TSecr=819542
109 0.244787240 172.31.23.72 -> 172.31.31.144 OpenFlow 74 Type: OFPT_BARRIER_REPLY
110 0.244805207 172.31.23.72 -> 172.31.31.144 OpenFlow 74 Type: OFPT_BARRIER_REPLY
111 0.244978039 172.31.23.72 -> 172.31.31.144 OpenFlow 146 Type: OFPT_FLOW_REMOVED
112 0.246575232 172.31.31.144 -> 172.31.23.72 TCP 66 6633 → 45442 [ACK] Seq=337 Ack=9 Win=853 Len=0 TSval=819543 TSecr=19389667
113 0.246582985 172.31.31.144 -> 172.31.23.72 OpenFlow 170 Type: OFPT_FLOW_MOD
114 0.246586710 172.31.31.144 -> 172.31.23.72 OpenFlow 178 Type: OFPT_BARRIER_REQUEST
115 0.246588618 172.31.31.144 -> 172.31.23.72 OpenFlow 74 Type: OFPT_BARRIER_REQUEST
116 0.246592865 172.31.23.72 -> 172.31.31.144 OpenFlow 146 Type: OFPT_FLOW_REMOVED
117 0.246599380 172.31.31.144 -> 172.31.23.72 TCP 66 6633 → 45434 [ACK] Seq=337 Ack=9 Win=853 Len=0 TSval=819543 TSecr=19389667
118 0.246601673 172.31.31.144 -> 172.31.23.72 TCP 66 6633 → 45424 [ACK] Seq=401 Ack=57 Win=853 Len=0 TSval=819543 TSecr=19389667
119 0.246604109 172.31.23.72 -> 172.31.31.144 OpenFlow 226 Type: OFPT_FLOW_REMOVED
120 0.246605604 172.31.31.144 -> 172.31.23.72 TCP 66 6633 → 45460 [ACK] Seq=169 Ack=81 Win=853 Len=0 TSval=819543 TSecr=19389667
121 0.246608113 172.31.23.72 -> 172.31.31.144 OpenFlow 146 Type: OFPT_FLOW_REMOVED
122 0.246609969 172.31.31.144 -> 172.31.23.72 TCP 170 6633 → 45444 [PSH, ACK] Seq=1 Ack=1 Win=853 Len=104 TSval=819543 TSecr=19389333
123 0.246614114 172.31.31.144 -> 172.31.23.72 OpenFlow 170 Type: OFPT_FLOW_MOD
124 0.246616573 172.31.23.72 -> 172.31.31.144 OpenFlow 570 Type: OFPT_FLOW_REMOVED
125 0.246618184 172.31.31.144 -> 172.31.23.72 TCP 178 6633 → 45444 [PSH, ACK] Seq=105 Ack=1 Win=853 Len=112 TSval=819543 TSecr=19389333
126 0.246620048 172.31.31.144 -> 172.31.23.72 TCP 66 6633 → 45424 [ACK] Seq=401 Ack=217 Win=853 Len=0 TSval=819543 TSecr=19389667
127 0.246622014 172.31.31.144 -> 172.31.23.72 OpenFlow 178 Type: OFPT_BARRIER_REQUEST
128 0.246623687 172.31.31.144 -> 172.31.23.72 OpenFlow 170 Type: OFPT_FLOW_MOD
129 0.246625965 172.31.31.144 -> 172.31.23.72 TCP 66 6633 → 45434 [ACK] Seq=337 Ack=337 Win=853 Len=0 TSval=819543 TSecr=19389667
130 0.246627949 172.31.31.144 -> 172.31.23.72 OpenFlow 178 Type: OFPT_BARRIER_REQUEST
131 0.246629432 172.31.31.144 -> 172.31.23.72 TCP 66 6633 → 45416 [ACK] Seq=233 Ack=217 Win=853 Len=0 TSval=819543 TSecr=19389667
132 0.246631500 172.31.31.144 -> 172.31.23.72 TCP 66 6633 → 45458 [ACK] Seq=337 Ack=169 Win=853 Len=0 TSval=819543 TSecr=19389667
133 0.246633722 172.31.23.72 -> 172.31.31.144 OpenFlow 226 Type: OFPT_FLOW_REMOVED
134 0.246635170 172.31.31.144 -> 172.31.23.72 TCP 66 6633 → 45456 [ACK] Seq=337 Ack=337 Win=853 Len=0 TSval=819543 TSecr=19389667
135 0.246637571 172.31.31.144 -> 172.31.23.72 OpenFlow 170 Type: OFPT_FLOW_MOD
136 0.246725111 172.31.23.72 -> 172.31.31.144 TCP 66 45452 → 6633 [ACK] Seq=913 Ack=1161 Win=213 Len=0 TSval=19389668 TSecr=819543
137 0.246779752 172.31.23.72 -> 172.31.31.144 TCP 66 45444 → 6633 [ACK] Seq=1 Ack=217 Win=213 Len=0 TSval=19389668 TSecr=819543
138 0.246782798 172.31.23.72 -> 172.31.31.144 OpenFlow 82 Type: OFPT_BARRIER_REPLY
139 0.246787852 172.31.23.72 -> 172.31.31.144 OpenFlow 74 Type: OFPT_BARRIER_REPLY
140 0.246869438 172.31.23.72 -> 172.31.31.144 TCP 66 45442 → 6633 [ACK] Seq=337 Ack=553 Win=213 Len=0 TSval=19389668 TSecr=819543
141 0.246873602 172.31.23.72 -> 172.31.31.144 OpenFlow 74 Type: OFPT_BARRIER_REPLY
142 0.247439366 172.31.23.72 -> 172.31.31.144 OpenFlow 74 Type: OFPT_BARRIER_REPLY
143 0.250210387 172.31.31.144 -> 172.31.23.72 TCP 66 6633 → 45414 [ACK] Seq=233 Ack=217 Win=853 Len=0 TSval=819544 TSecr=19389667
144 0.250218481 172.31.31.144 -> 172.31.23.72 TCP 66 6633 → 45460 [ACK] Seq=169 Ack=89 Win=853 Len=0 TSval=819544 TSecr=19389668
145 0.250221034 172.31.31.144 -> 172.31.23.72 TCP 66 6633 → 45424 [ACK] Seq=401 Ack=225 Win=853 Len=0 TSval=819544 TSecr=19389668
146 0.250223260 172.31.31.144 -> 172.31.23.72 OpenFlow 170 Type: OFPT_FLOW_MOD
147 0.250225231 172.31.31.144 -> 172.31.23.72 OpenFlow 178 Type: OFPT_BARRIER_REQUEST
148 0.250226835 172.31.31.144 -> 172.31.23.72 OpenFlow 170 Type: OFPT_FLOW_MOD
149 0.250229261 172.31.31.144 -> 172.31.23.72 OpenFlow 170 Type: OFPT_FLOW_MOD
150 0.250231305 172.31.31.144 -> 172.31.23.72 OpenFlow 178 Type: OFPT_BARRIER_REQUEST
151 0.250232808 172.31.31.144 -> 172.31.23.72 OpenFlow 178 Type: OFPT_BARRIER_REQUEST
152 0.250234154 172.31.31.144 -> 172.31.23.72 OpenFlow 170 Type: OFPT_FLOW_MOD
153 0.250236284 172.31.31.144 -> 172.31.23.72 OpenFlow 170 Type: OFPT_FLOW_MOD
154 0.250237778 172.31.31.144 -> 172.31.23.72 OpenFlow 170 Type: OFPT_FLOW_MOD
155 0.250239647 172.31.31.144 -> 172.31.23.72 TCP 66 6633 → 45424 [ACK] Seq=401 Ack=385 Win=853 Len=0 TSval=819544 TSecr=19389668
156 0.250241420 172.31.31.144 -> 172.31.23.72 TCP 66 6633 → 45460 [ACK] Seq=169 Ack=169 Win=853 Len=0 TSval=819544 TSecr=19389668
157 0.250243188 172.31.31.144 -> 172.31.23.72 OpenFlow 178 Type: OFPT_BARRIER_REQUEST
158 0.250244519 172.31.31.144 -> 172.31.23.72 OpenFlow 170 Type: OFPT_FLOW_MOD
159 0.250246056 172.31.31.144 -> 172.31.23.72 OpenFlow 74 Type: OFPT_BARRIER_REQUEST
160 0.250248327 172.31.31.144 -> 172.31.23.72 TCP 66 6633 → 45452 [ACK] Seq=1377 Ack=929 Win=853 Len=0 TSval=819544 TSecr=19389668
161 0.250250467 172.31.31.144 -> 172.31.23.72 TCP 66 6633 → 45444 [ACK] Seq=433 Ack=9 Win=853 Len=0 TSval=819544 TSecr=19389668
162 0.250252008 172.31.31.144 -> 172.31.23.72 OpenFlow 170 Type: OFPT_FLOW_MOD
163 0.250253648 172.31.31.144 -> 172.31.23.72 OpenFlow 178 Type: OFPT_BARRIER_REQUEST
164 0.250255211 172.31.31.144 -> 172.31.23.72 TCP 170 6633 → 45436 [PSH, ACK] Seq=1 Ack=1 Win=853 Len=104 TSval=819544 TSecr=19389307
165 0.250258827 172.31.31.144 -> 172.31.23.72 OpenFlow 170 Type: OFPT_FLOW_MOD
166 0.250260422 172.31.31.144 -> 172.31.23.72 OpenFlow 170 Type: OFPT_FLOW_MOD
167 0.250262329 172.31.31.144 -> 172.31.23.72 OpenFlow 170 Type: OFPT_FLOW_MOD
168 0.250263963 172.31.31.144 -> 172.31.23.72 OpenFlow 170 Type: OFPT_FLOW_MOD
169 0.250265657 172.31.31.144 -> 172.31.23.72 OpenFlow 178 Type: OFPT_BARRIER_REQUEST
170 0.250267170 172.31.31.144 -> 172.31.23.72 OpenFlow 170 Type: OFPT_FLOW_MOD
171 0.250268434 172.31.31.144 -> 172.31.23.72 OpenFlow 178 Type: OFPT_BARRIER_REQUEST
172 0.250269835 172.31.31.144 -> 172.31.23.72 OpenFlow 170 Type: OFPT_FLOW_MOD
173 0.250271658 172.31.31.144 -> 172.31.23.72 OpenFlow 170 Type: OFPT_FLOW_MOD
174 0.250273023 172.31.31.144 -> 172.31.23.72 TCP 170 6633 → 45436 [PSH, ACK] Seq=105 Ack=1 Win=853 Len=104 TSval=819544 TSecr=19389307
175 0.250274496 172.31.31.144 -> 172.31.23.72 OpenFlow 178 Type: OFPT_BARRIER_REQUEST
176 0.250275708 172.31.31.144 -> 172.31.23.72 OpenFlow 282 Type: OFPT_FLOW_MOD
177 0.250276984 172.31.31.144 -> 172.31.23.72 OpenFlow 290 Type: OFPT_BARRIER_REQUEST
178 0.250278359 172.31.31.144 -> 172.31.23.72 TCP 74 6633 → 45436 [PSH, ACK] Seq=209 Ack=1 Win=853 Len=8 TSval=819544 TSecr=19389307
179 0.250279573 172.31.31.144 -> 172.31.23.72 OpenFlow 170 Type: OFPT_FLOW_MOD
180 0.250281216 172.31.31.144 -> 172.31.23.72 OpenFlow 170 Type: OFPT_FLOW_MOD
181 0.250282640 172.31.31.144 -> 172.31.23.72 OpenFlow 170 Type: OFPT_FLOW_MOD
182 0.250283808 172.31.31.144 -> 172.31.23.72 OpenFlow 170 Type: OFPT_FLOW_MOD
183 0.250285116 172.31.31.144 -> 172.31.23.72 OpenFlow 178 Type: OFPT_BARRIER_REQUEST
184 0.250286536 172.31.31.144 -> 172.31.23.72 OpenFlow 170 Type: OFPT_FLOW_MOD
185 0.250288072 172.31.31.144 -> 172.31.23.72 OpenFlow 170 Type: OFPT_FLOW_MOD
186 0.250289754 172.31.31.144 -> 172.31.23.72 OpenFlow 170 Type: OFPT_FLOW_MOD
187 0.250291700 172.31.31.144 -> 172.31.23.72 OpenFlow 178 Type: OFPT_BARRIER_REQUEST
188 0.250292953 172.31.31.144 -> 172.31.23.72 OpenFlow 170 Type: OFPT_FLOW_MOD
189 0.250294210 172.31.31.144 -> 172.31.23.72 OpenFlow 74 Type: OFPT_BARRIER_REQUEST
190 0.250295726 172.31.31.144 -> 172.31.23.72 OpenFlow 74 Type: OFPT_BARRIER_REQUEST
191 0.250296987 172.31.31.144 -> 172.31.23.72 OpenFlow 178 Type: OFPT_BARRIER_REQUEST
192 0.250298375 172.31.31.144 -> 172.31.23.72 OpenFlow 178 Type: OFPT_BARRIER_REQUEST
193 0.250299994 172.31.31.144 -> 172.31.23.72 OpenFlow 178 Type: OFPT_BARRIER_REQUEST
194 0.250301180 172.31.31.144 -> 172.31.23.72 OpenFlow 170 Type: OFPT_FLOW_MOD
195 0.250302159 172.31.31.144 -> 172.31.23.72 OpenFlow 282 Type: OFPT_BARRIER_REQUEST
196 0.250303407 172.31.31.144 -> 172.31.23.72 OpenFlow 170 Type: OFPT_FLOW_MOD
197 0.250307970 172.31.31.144 -> 172.31.23.72 OpenFlow 74 Type: OFPT_BARRIER_REQUEST
198 0.250309560 172.31.31.144 -> 172.31.23.72 OpenFlow 170 Type: OFPT_FLOW_MOD
199 0.250310824 172.31.31.144 -> 172.31.23.72 OpenFlow 74 Type: OFPT_BARRIER_REQUEST
200 0.250422966 172.31.23.72 -> 172.31.31.144 OpenFlow 74 Type: OFPT_BARRIER_REPLY
201 0.250472714 172.31.23.72 -> 172.31.31.144 TCP 66 45436 → 6633 [ACK] Seq=1 Ack=217 Win=213 Len=0 TSval=19389669 TSecr=819544
202 0.250477929 172.31.23.72 -> 172.31.31.144 OpenFlow 74 Type: OFPT_BARRIER_REPLY
203 0.250503427 172.31.23.72 -> 172.31.31.144 OpenFlow 74 Type: OFPT_BARRIER_REPLY
204 0.250532559 172.31.23.72 -> 172.31.31.144 OpenFlow 74 Type: OFPT_BARRIER_REPLY
205 0.250564644 172.31.23.72 -> 172.31.31.144 OpenFlow 74 Type: OFPT_BARRIER_REPLY
206 0.250628065 172.31.23.72 -> 172.31.31.144 TCP 66 45416 → 6633 [ACK] Seq=217 Ack=449 Win=213 Len=0 TSval=19389669 TSecr=819544
207 0.250632049 172.31.23.72 -> 172.31.31.144 OpenFlow 74 Type: OFPT_BARRIER_REPLY
208 0.250658536 172.31.23.72 -> 172.31.31.144 TCP 66 45460 → 6633 [ACK] Seq=169 Ack=385 Win=213 Len=0 TSval=19389669 TSecr=819544
209 0.250662337 172.31.23.72 -> 172.31.31.144 OpenFlow 74 Type: OFPT_BARRIER_REPLY
210 0.250682412 172.31.23.72 -> 172.31.31.144 OpenFlow 74 Type: OFPT_BARRIER_REPLY
211 0.250712028 172.31.23.72 -> 172.31.31.144 OpenFlow 74 Type: OFPT_BARRIER_REPLY
212 0.250753142 172.31.23.72 -> 172.31.31.144 TCP 66 45414 → 6633 [ACK] Seq=217 Ack=449 Win=213 Len=0 TSval=19389669 TSecr=819544
213 0.250756851 172.31.23.72 -> 172.31.31.144 OpenFlow 74 Type: OFPT_BARRIER_REPLY
214 0.250781124 172.31.23.72 -> 172.31.31.144 OpenFlow 74 Type: OFPT_BARRIER_REPLY
215 0.250814606 172.31.23.72 -> 172.31.31.144 OpenFlow 74 Type: OFPT_BARRIER_REPLY
216 0.251810073 172.31.23.72 -> 172.31.31.144 OpenFlow 74 Type: OFPT_BARRIER_REPLY
217 0.251817541 172.31.23.72 -> 172.31.31.144 OpenFlow 74 Type: OFPT_BARRIER_REPLY
218 0.251819302 172.31.23.72 -> 172.31.31.144 OpenFlow 74 Type: OFPT_BARRIER_REPLY
219 0.251820814 172.31.23.72 -> 172.31.31.144 OpenFlow 90 Type: OFPT_BARRIER_REPLY
220 0.251964416 172.31.23.72 -> 172.31.31.144 OpenFlow 74 Type: OFPT_BARRIER_REPLY
221 0.251966444 172.31.23.72 -> 172.31.31.144 OpenFlow 74 Type: OFPT_BARRIER_REPLY
222 0.251968003 172.31.23.72 -> 172.31.31.144 OpenFlow 74 Type: OFPT_BARRIER_REPLY
223 0.252464556 172.31.23.72 -> 172.31.31.144 OpenFlow 82 Type: OFPT_BARRIER_REPLY
224 0.255200608 172.31.31.144 -> 172.31.23.72 TCP 66 6633 → 45436 [ACK] Seq=217 Ack=9 Win=853 Len=0 TSval=819545 TSecr=19389669
225 0.255208732 172.31.31.144 -> 172.31.23.72 TCP 66 6633 → 45454 [ACK] Seq=1593 Ack=937 Win=853 Len=0 TSval=819545 TSecr=19389668
226 0.255213520 172.31.31.144 -> 172.31.23.72 TCP 66 6633 → 45452 [ACK] Seq=1593 Ack=945 Win=853 Len=0 TSval=819545 TSecr=19389669
227 0.255215555 172.31.31.144 -> 172.31.23.72 TCP 66 6633 → 45434 [ACK] Seq=769 Ack=353 Win=853 Len=0 TSval=819545 TSecr=19389669
228 0.255217381 172.31.31.144 -> 172.31.23.72 TCP 66 6633 → 45424 [ACK] Seq=833 Ack=401 Win=853 Len=0 TSval=819545 TSecr=19389669
229 0.255219163 172.31.31.144 -> 172.31.23.72 TCP 66 6633 → 45444 [ACK] Seq=1081 Ack=41 Win=853 Len=0 TSval=819545 TSecr=19389669
230 0.255221176 172.31.31.144 -> 172.31.23.72 TCP 66 6633 → 45458 [ACK] Seq=769 Ack=353 Win=853 Len=0 TSval=819545 TSecr=19389669
231 0.255223035 172.31.31.144 -> 172.31.23.72 TCP 66 6633 → 45456 [ACK] Seq=769 Ack=353 Win=853 Len=0 TSval=819545 TSecr=19389669
232 0.256787558 172.31.31.144 -> 172.31.23.72 TCP 66 6633 → 45442 [ACK] Seq=1201 Ack=369 Win=853 Len=0 TSval=819546 TSecr=19389669
233 0.290929709 172.31.31.144 -> 172.31.23.72 TCP 66 6633 → 45454 [ACK] Seq=1593 Ack=945 Win=853 Len=0 TSval=819555 TSecr=19389669
234 0.290937724 172.31.31.144 -> 172.31.23.72 TCP 66 6633 → 45414 [ACK] Seq=449 Ack=225 Win=853 Len=0 TSval=819555 TSecr=19389669
235 0.290940381 172.31.31.144 -> 172.31.23.72 TCP 66 6633 → 45416 [ACK] Seq=449 Ack=225 Win=853 Len=0 TSval=819555 TSecr=19389669
236 0.290942568 172.31.31.144 -> 172.31.23.72 TCP 66 6633 → 45460 [ACK] Seq=385 Ack=177 Win=853 Len=0 TSval=819555 TSecr=19389669
237 0.299929230 172.31.31.144 -> 172.31.23.72 TCP 90 6633 → 45426 [PSH, ACK] Seq=1 Ack=1 Win=853 Len=24 TSval=819557 TSecr=19389357
238 0.299938379 172.31.31.144 -> 172.31.23.72 TCP 106 6633 → 45426 [PSH, ACK] Seq=25 Ack=1 Win=853 Len=40 TSval=819557 TSecr=19389357
239 0.300145517 172.31.23.72 -> 172.31.31.144 OpenFlow 82 Type: OFPT_MULTIPART_REPLY, OFPMP_GROUP
240 0.301458090 172.31.23.72 -> 172.31.31.144 OpenFlow 98 Type: OFPT_MULTIPART_REPLY, OFPMP_METER
241 0.302918098 172.31.31.144 -> 172.31.23.72 TCP 66 6633 → 45426 [ACK] Seq=65 Ack=17 Win=853 Len=0 TSval=819557 TSecr=19389682
242 0.302923960 172.31.31.144 -> 172.31.23.72 TCP 66 6633 → 45426 [ACK] Seq=65 Ack=49 Win=853 Len=0 TSval=819557 TSecr=19389682
243 0.399470590 172.31.31.144 -> 172.31.23.72 TCP 90 6633 → 45428 [PSH, ACK] Seq=1 Ack=1 Win=853 Len=24 TSval=819581 TSecr=19389357
244 0.399495603 172.31.31.144 -> 172.31.23.72 TCP 90 6633 → 45432 [PSH, ACK] Seq=1 Ack=1 Win=853 Len=24 TSval=819581 TSecr=19389331
245 0.399499296 172.31.31.144 -> 172.31.23.72 TCP 106 6633 → 45432 [PSH, ACK] Seq=25 Ack=1 Win=853 Len=40 TSval=819581 TSecr=19389331
246 0.399502659 172.31.31.144 -> 172.31.23.72 TCP 106 6633 → 45428 [PSH, ACK] Seq=25 Ack=1 Win=853 Len=40 TSval=819581 TSecr=19389357
247 0.399743531 172.31.23.72 -> 172.31.31.144 OpenFlow 82 Type: OFPT_MULTIPART_REPLY, OFPMP_GROUP
248 0.399786798 172.31.23.72 -> 172.31.31.144 OpenFlow 82 Type: OFPT_MULTIPART_REPLY, OFPMP_GROUP
249 0.401081917 172.31.31.144 -> 172.31.23.72 TCP 90 6633 → 45430 [PSH, ACK] Seq=1 Ack=1 Win=853 Len=24 TSval=819581 TSecr=19389357
250 0.401095115 172.31.23.72 -> 172.31.31.144 TCP 66 45430 → 6633 [ACK] Seq=1 Ack=25 Win=213 Len=0 TSval=19389707 TSecr=819581
251 0.401100470 172.31.31.144 -> 172.31.23.72 TCP 106 6633 → 45430 [PSH, ACK] Seq=25 Ack=1 Win=853 Len=40 TSval=819581 TSecr=19389357
252 0.401103573 172.31.23.72 -> 172.31.31.144 TCP 66 45430 → 6633 [ACK] Seq=1 Ack=65 Win=213 Len=0 TSval=19389707 TSecr=819581
253 0.401111183 172.31.23.72 -> 172.31.31.144 OpenFlow 98 Type: OFPT_MULTIPART_REPLY, OFPMP_METER
254 0.401114232 172.31.23.72 -> 172.31.31.144 OpenFlow 98 Type: OFPT_MULTIPART_REPLY, OFPMP_METER
255 0.401211627 172.31.23.72 -> 172.31.31.144 OpenFlow 82 Type: OFPT_MULTIPART_REPLY, OFPMP_GROUP
256 0.402827995 172.31.31.144 -> 172.31.23.72 TCP 66 6633 → 45432 [ACK] Seq=65 Ack=17 Win=853 Len=0 TSval=819582 TSecr=19389706
257 0.402836377 172.31.31.144 -> 172.31.23.72 TCP 66 6633 → 45428 [ACK] Seq=65 Ack=49 Win=853 Len=0 TSval=819582 TSecr=19389706
258 0.402838930 172.31.31.144 -> 172.31.23.72 TCP 66 6633 → 45432 [ACK] Seq=65 Ack=49 Win=853 Len=0 TSval=819582 TSecr=19389707
259 0.402845203 172.31.23.72 -> 172.31.31.144 OpenFlow 98 Type: OFPT_MULTIPART_REPLY, OFPMP_METER
260 0.404377798 172.31.31.144 -> 172.31.23.72 TCP 66 6633 → 45430 [ACK] Seq=65 Ack=49 Win=853 Len=0 TSval=819583 TSecr=19389707
261 0.499351734 172.31.31.144 -> 172.31.23.72 OpenFlow 90 Type: OFPT_MULTIPART_REQUEST, OFPMP_GROUP
262 0.499378701 172.31.31.144 -> 172.31.23.72 OpenFlow 90 Type: OFPT_MULTIPART_REQUEST, OFPMP_GROUP
263 0.499382525 172.31.31.144 -> 172.31.23.72 OpenFlow 106 Type: OFPT_MULTIPART_REQUEST, OFPMP_METER
264 0.499386140 172.31.31.144 -> 172.31.23.72 OpenFlow 106 Type: OFPT_MULTIPART_REQUEST, OFPMP_METER
265 0.499576654 172.31.23.72 -> 172.31.31.144 OpenFlow 82 Type: OFPT_MULTIPART_REPLY, OFPMP_GROUP
266 0.499614983 172.31.23.72 -> 172.31.31.144 OpenFlow 82 Type: OFPT_MULTIPART_REPLY, OFPMP_GROUP
267 0.499959803 172.31.23.72 -> 172.31.31.144 OpenFlow 98 Type: OFPT_MULTIPART_REPLY, OFPMP_METER
268 0.499965811 172.31.23.72 -> 172.31.31.144 OpenFlow 98 Type: OFPT_MULTIPART_REPLY, OFPMP_METER
269 0.500144458 172.31.31.144 -> 172.31.23.72 TCP 66 6633 → 45436 [ACK] Seq=281 Ack=25 Win=853 Len=0 TSval=819607 TSecr=19389731
270 0.500170854 172.31.31.144 -> 172.31.23.72 TCP 66 6633 → 45436 [ACK] Seq=281 Ack=57 Win=853 Len=0 TSval=819607 TSecr=19389731
271 0.500199131 172.31.31.144 -> 172.31.23.72 TCP 66 6633 → 45434 [ACK] Seq=833 Ack=401 Win=853 Len=0 TSval=819607 TSecr=19389731
272 0.598560835 172.31.31.144 -> 172.31.23.72 TCP 90 6633 → 45438 [PSH, ACK] Seq=1 Ack=1 Win=853 Len=24 TSval=819631 TSecr=19389332
273 0.598590389 172.31.31.144 -> 172.31.23.72 TCP 106 6633 → 45438 [PSH, ACK] Seq=25 Ack=1 Win=853 Len=40 TSval=819631 TSecr=19389332
274 0.598816526 172.31.23.72 -> 172.31.31.144 OpenFlow 82 Type: OFPT_MULTIPART_REPLY, OFPMP_GROUP
275 0.600146782 172.31.23.72 -> 172.31.31.144 OpenFlow 98 Type: OFPT_MULTIPART_REPLY, OFPMP_METER
276 0.601817464 172.31.31.144 -> 172.31.23.72 TCP 66 6633 → 45438 [ACK] Seq=65 Ack=17 Win=853 Len=0 TSval=819632 TSecr=19389756
277 0.601825344 172.31.31.144 -> 172.31.23.72 TCP 66 6633 → 45438 [ACK] Seq=65 Ack=49 Win=853 Len=0 TSval=819632 TSecr=19389757
278 0.698619142 172.31.31.144 -> 172.31.23.72 OpenFlow 90 Type: OFPT_MULTIPART_REQUEST, OFPMP_GROUP
279 0.698637534 172.31.31.144 -> 172.31.23.72 OpenFlow 90 Type: OFPT_MULTIPART_REQUEST, OFPMP_GROUP
280 0.698647510 172.31.31.144 -> 172.31.23.72 OpenFlow 106 Type: OFPT_MULTIPART_REQUEST, OFPMP_METER
281 0.698651700 172.31.31.144 -> 172.31.23.72 OpenFlow 106 Type: OFPT_MULTIPART_REQUEST, OFPMP_METER
282 0.698849974 172.31.23.72 -> 172.31.31.144 OpenFlow 82 Type: OFPT_MULTIPART_REPLY, OFPMP_GROUP
283 0.698881601 172.31.23.72 -> 172.31.31.144 OpenFlow 98 Type: OFPT_MULTIPART_REPLY, OFPMP_METER
284 0.698970916 172.31.23.72 -> 172.31.31.144 OpenFlow 82 Type: OFPT_MULTIPART_REPLY, OFPMP_GROUP
285 0.698994488 172.31.23.72 -> 172.31.31.144 OpenFlow 98 Type: OFPT_MULTIPART_REPLY, OFPMP_METER
286 0.699100838 172.31.31.144 -> 172.31.23.72 TCP 66 6633 → 45444 [ACK] Seq=1145 Ack=89 Win=853 Len=0 TSval=819657 TSecr=19389781
287 0.699277209 172.31.31.144 -> 172.31.23.72 TCP 66 6633 → 45442 [ACK] Seq=1265 Ack=417 Win=853 Len=0 TSval=819657 TSecr=19389781
288 0.999476590 172.31.31.144 -> 172.31.23.72 TCP 90 6633 → 45446 [PSH, ACK] Seq=1 Ack=1 Win=853 Len=24 TSval=819731 TSecr=19389333
289 0.999507271 172.31.31.144 -> 172.31.23.72 OpenFlow 90 Type: OFPT_MULTIPART_REQUEST, OFPMP_GROUP
290 0.999511193 172.31.31.144 -> 172.31.23.72 TCP 90 6633 → 45450 [PSH, ACK] Seq=1 Ack=1 Win=853 Len=24 TSval=819731 TSecr=19389307
291 0.999514368 172.31.31.144 -> 172.31.23.72 TCP 106 6633 → 45446 [PSH, ACK] Seq=25 Ack=1 Win=853 Len=40 TSval=819731 TSecr=19389333
292 0.999517958 172.31.31.144 -> 172.31.23.72 OpenFlow 106 Type: OFPT_MULTIPART_REQUEST, OFPMP_METER
293 0.999519815 172.31.31.144 -> 172.31.23.72 OpenFlow 90 Type: OFPT_MULTIPART_REQUEST, OFPMP_GROUP
294 0.999522699 172.31.31.144 -> 172.31.23.72 TCP 106 6633 → 45450 [PSH, ACK] Seq=25 Ack=1 Win=853 Len=40 TSval=819731 TSecr=19389307
295 0.999524338 172.31.31.144 -> 172.31.23.72 TCP 90 6633 → 45448 [PSH, ACK] Seq=1 Ack=1 Win=853 Len=24 TSval=819731 TSecr=19389332
296 0.999527703 172.31.31.144 -> 172.31.23.72 OpenFlow 106 Type: OFPT_MULTIPART_REQUEST, OFPMP_METER
297 0.999529474 172.31.31.144 -> 172.31.23.72 TCP 82 6633 → 45448 [PSH, ACK] Seq=25 Ack=1 Win=853 Len=16 TSval=819731 TSecr=19389332
298 0.999530894 172.31.31.144 -> 172.31.23.72 TCP 90 6633 → 45448 [PSH, ACK] Seq=41 Ack=1 Win=853 Len=24 TSval=819731 TSecr=19389332
299 0.999694707 172.31.23.72 -> 172.31.31.144 OpenFlow 82 Type: OFPT_MULTIPART_REPLY, OFPMP_GROUP
300 0.999788070 172.31.23.72 -> 172.31.31.144 OpenFlow 82 Type: OFPT_MULTIPART_REPLY, OFPMP_GROUP
301 0.999825283 172.31.23.72 -> 172.31.31.144 OpenFlow 82 Type: OFPT_MULTIPART_REPLY, OFPMP_GROUP
302 0.999872597 172.31.23.72 -> 172.31.31.144 OpenFlow 82 Type: OFPT_MULTIPART_REPLY, OFPMP_GROUP
303 0.999890949 172.31.23.72 -> 172.31.31.144 OpenFlow 82 Type: OFPT_MULTIPART_REPLY, OFPMP_GROUP
304 1.001065457 172.31.23.72 -> 172.31.31.144 OpenFlow 98 Type: OFPT_MULTIPART_REPLY, OFPMP_METER
305 1.001072597 172.31.23.72 -> 172.31.31.144 OpenFlow 98 Type: OFPT_MULTIPART_REPLY, OFPMP_METER
306 1.001074381 172.31.23.72 -> 172.31.31.144 OpenFlow 98 Type: OFPT_MULTIPART_REPLY, OFPMP_METER
307 1.001317121 172.31.23.72 -> 172.31.31.144 OpenFlow 98 Type: OFPT_MULTIPART_REPLY, OFPMP_METER
308 1.001321509 172.31.23.72 -> 172.31.31.144 OpenFlow 98 Type: OFPT_MULTIPART_REPLY, OFPMP_METER
309 1.002986506 172.31.31.144 -> 172.31.23.72 TCP 66 6633 → 45446 [ACK] Seq=65 Ack=17 Win=853 Len=0 TSval=819732 TSecr=19389856
310 1.002993742 172.31.31.144 -> 172.31.23.72 TCP 66 6633 → 45454 [ACK] Seq=1657 Ack=961 Win=853 Len=0 TSval=819732 TSecr=19389856
311 1.002995952 172.31.31.144 -> 172.31.23.72 TCP 66 6633 → 45452 [ACK] Seq=1657 Ack=993 Win=853 Len=0 TSval=819732 TSecr=19389856
312 1.002998383 172.31.31.144 -> 172.31.23.72 TCP 66 6633 → 45450 [ACK] Seq=65 Ack=49 Win=853 Len=0 TSval=819732 TSecr=19389856
313 1.003003882 172.31.31.144 -> 172.31.23.72 TCP 66 6633 → 45446 [ACK] Seq=65 Ack=49 Win=853 Len=0 TSval=819732 TSecr=19389857
314 1.003715044 172.31.31.144 -> 172.31.23.72 TCP 66 6633 → 45454 [ACK] Seq=1657 Ack=993 Win=853 Len=0 TSval=819733 TSecr=19389857
315 1.003718975 172.31.31.144 -> 172.31.23.72 TCP 66 6633 → 45448 [ACK] Seq=65 Ack=49 Win=853 Len=0 TSval=819733 TSecr=19389856
316 1.098399705 172.31.31.144 -> 172.31.23.72 OpenFlow 90 Type: OFPT_MULTIPART_REQUEST, OFPMP_GROUP
317 1.098426434 172.31.31.144 -> 172.31.23.72 OpenFlow 90 Type: OFPT_MULTIPART_REQUEST, OFPMP_GROUP
318 1.098446198 172.31.31.144 -> 172.31.23.72 OpenFlow 106 Type: OFPT_MULTIPART_REQUEST, OFPMP_METER
319 1.098458849 172.31.31.144 -> 172.31.23.72 OpenFlow 106 Type: OFPT_MULTIPART_REQUEST, OFPMP_METER
320 1.098492392 172.31.31.144 -> 172.31.23.72 OpenFlow 90 Type: OFPT_MULTIPART_REQUEST, OFPMP_GROUP
321 1.098522998 172.31.31.144 -> 172.31.23.72 OpenFlow 106 Type: OFPT_MULTIPART_REQUEST, OFPMP_METER
322 1.098755204 172.31.23.72 -> 172.31.31.144 OpenFlow 82 Type: OFPT_MULTIPART_REPLY, OFPMP_GROUP
323 1.098798011 172.31.23.72 -> 172.31.31.144 OpenFlow 98 Type: OFPT_MULTIPART_REPLY, OFPMP_METER
324 1.098804680 172.31.23.72 -> 172.31.31.144 OpenFlow 82 Type: OFPT_MULTIPART_REPLY, OFPMP_GROUP
325 1.098826298 172.31.23.72 -> 172.31.31.144 OpenFlow 82 Type: OFPT_MULTIPART_REPLY, OFPMP_GROUP
326 1.098870457 172.31.23.72 -> 172.31.31.144 OpenFlow 98 Type: OFPT_MULTIPART_REPLY, OFPMP_METER
327 1.098875095 172.31.23.72 -> 172.31.31.144 OpenFlow 98 Type: OFPT_MULTIPART_REPLY, OFPMP_METER
328 1.098948037 172.31.31.144 -> 172.31.23.72 TCP 66 6633 → 45460 [ACK] Seq=449 Ack=193 Win=853 Len=0 TSval=819757 TSecr=19389881
329 1.098976604 172.31.31.144 -> 172.31.23.72 TCP 66 6633 → 45460 [ACK] Seq=449 Ack=225 Win=853 Len=0 TSval=819757 TSecr=19389881
330 1.099055714 172.31.31.144 -> 172.31.23.72 TCP 66 6633 → 45458 [ACK] Seq=833 Ack=401 Win=853 Len=0 TSval=819757 TSecr=19389881
331 1.099083376 172.31.31.144 -> 172.31.23.72 TCP 66 6633 → 45456 [ACK] Seq=833 Ack=401 Win=853 Len=0 TSval=819757 TSecr=19389881
332 1.504747564 172.31.31.144 -> 172.31.23.72 TCP 90 6633 → 45462 [PSH, ACK] Seq=1 Ack=1 Win=853 Len=24 TSval=819858 TSecr=19389333
333 1.504777889 172.31.31.144 -> 172.31.23.72 TCP 82 6633 → 45462 [PSH, ACK] Seq=25 Ack=1 Win=853 Len=16 TSval=819858 TSecr=19389333
334 1.504782190 172.31.31.144 -> 172.31.23.72 TCP 90 6633 → 45462 [PSH, ACK] Seq=41 Ack=1 Win=853 Len=24 TSval=819858 TSecr=19389333
335 1.504972717 172.31.23.72 -> 172.31.31.144 OpenFlow 82 Type: OFPT_MULTIPART_REPLY, OFPMP_GROUP
336 1.506240451 172.31.23.72 -> 172.31.31.144 OpenFlow 98 Type: OFPT_MULTIPART_REPLY, OFPMP_METER
337 1.507969333 172.31.31.144 -> 172.31.23.72 TCP 66 6633 → 45462 [ACK] Seq=65 Ack=17 Win=853 Len=0 TSval=819858 TSecr=19389983
338 1.507977425 172.31.31.144 -> 172.31.23.72 TCP 66 6633 → 45462 [ACK] Seq=65 Ack=49 Win=853 Len=0 TSval=819858 TSecr=19389983
339 1.798825608 172.31.31.144 -> 172.31.23.72 OpenFlow 187 Type: OFPT_PACKET_OUT
340 1.798847853 172.31.31.144 -> 172.31.23.72 OpenFlow 187 Type: OFPT_PACKET_OUT
341 1.798851227 172.31.31.144 -> 172.31.23.72 OpenFlow 187 Type: OFPT_PACKET_OUT
342 1.798853220 172.31.31.144 -> 172.31.23.72 OpenFlow 187 Type: OFPT_PACKET_OUT
343 1.798854912 172.31.31.144 -> 172.31.23.72 OpenFlow 187 Type: OFPT_PACKET_OUT
344 1.798856593 172.31.31.144 -> 172.31.23.72 OpenFlow 187 Type: OFPT_PACKET_OUT
345 1.799169643 172.31.23.72 -> 172.31.31.144 TCP 66 45452 → 6633 [ACK] Seq=993 Ack=2383 Win=213 Len=0 TSval=19390056 TSecr=819931
346 1.799298356 172.31.23.72 -> 172.31.31.144 OpenFlow 189 Type: OFPT_PACKET_IN
347 1.799364922 172.31.23.72 -> 172.31.31.144 OpenFlow 189 Type: OFPT_PACKET_IN
348 1.800609387 172.31.31.144 -> 172.31.23.72 OpenFlow 187 Type: OFPT_PACKET_OUT
349 1.800618506 172.31.31.144 -> 172.31.23.72 OpenFlow 187 Type: OFPT_PACKET_OUT
350 1.800621073 172.31.31.144 -> 172.31.23.72 OpenFlow 187 Type: OFPT_PACKET_OUT
351 1.800623016 172.31.31.144 -> 172.31.23.72 OpenFlow 187 Type: OFPT_PACKET_OUT
352 1.800624533 172.31.31.144 -> 172.31.23.72 OpenFlow 187 Type: OFPT_PACKET_OUT
353 1.800625893 172.31.31.144 -> 172.31.23.72 OpenFlow 187 Type: OFPT_PACKET_OUT
354 1.800627467 172.31.31.144 -> 172.31.23.72 OpenFlow 187 Type: OFPT_PACKET_OUT
355 1.800630669 172.31.31.144 -> 172.31.23.72 OpenFlow 187 Type: OFPT_PACKET_OUT
356 1.800632426 172.31.31.144 -> 172.31.23.72 OpenFlow 187 Type: OFPT_PACKET_OUT
357 1.800634005 172.31.31.144 -> 172.31.23.72 OpenFlow 187 Type: OFPT_PACKET_OUT
358 1.800635367 172.31.31.144 -> 172.31.23.72 OpenFlow 187 Type: OFPT_PACKET_OUT
359 1.800636707 172.31.31.144 -> 172.31.23.72 OpenFlow 187 Type: OFPT_PACKET_OUT
360 1.800638277 172.31.31.144 -> 172.31.23.72 OpenFlow 187 Type: OFPT_PACKET_OUT
361 1.800640030 172.31.31.144 -> 172.31.23.72 OpenFlow 187 Type: OFPT_PACKET_OUT
362 1.800660924 172.31.23.72 -> 172.31.31.144 OpenFlow 189 Type: OFPT_PACKET_IN
363 1.800666386 172.31.23.72 -> 172.31.31.144 OpenFlow 189 Type: OFPT_PACKET_IN
364 1.800934279 172.31.23.72 -> 172.31.31.144 TCP 66 45462 → 6633 [ACK] Seq=49 Ack=791 Win=213 Len=0 TSval=19390057 TSecr=819932
365 1.801281995 172.31.23.72 -> 172.31.31.144 TCP 66 45436 → 6633 [ACK] Seq=57 Ack=1249 Win=213 Len=0 TSval=19390057 TSecr=819932
366 1.801344187 172.31.23.72 -> 172.31.31.144 OpenFlow 189 Type: OFPT_PACKET_IN
367 1.801367473 172.31.23.72 -> 172.31.31.144 OpenFlow 189 Type: OFPT_PACKET_IN
368 1.801381963 172.31.23.72 -> 172.31.31.144 OpenFlow 189 Type: OFPT_PACKET_IN
369 1.801403494 172.31.23.72 -> 172.31.31.144 OpenFlow 189 Type: OFPT_PACKET_IN
370 1.801428384 172.31.23.72 -> 172.31.31.144 OpenFlow 189 Type: OFPT_PACKET_IN
371 1.801461751 172.31.23.72 -> 172.31.31.144 OpenFlow 189 Type: OFPT_PACKET_IN
372 1.803761754 172.31.31.144 -> 172.31.23.72 TCP 66 6633 → 45450 [ACK] Seq=65 Ack=295 Win=853 Len=0 TSval=819932 TSecr=19390056
373 1.803769900 172.31.31.144 -> 172.31.23.72 TCP 66 6633 → 45442 [ACK] Seq=1265 Ack=663 Win=853 Len=0 TSval=819932 TSecr=19390056
374 1.803886635 172.31.23.72 -> 172.31.31.144 OpenFlow 189 Type: OFPT_PACKET_IN
375 1.803892652 172.31.23.72 -> 172.31.31.144 OpenFlow 189 Type: OFPT_PACKET_IN
376 1.803894461 172.31.23.72 -> 172.31.31.144 OpenFlow 435 Type: OFPT_PACKET_IN
377 1.804299804 172.31.23.72 -> 172.31.31.144 OpenFlow 189 Type: OFPT_PACKET_IN
378 1.804305398 172.31.23.72 -> 172.31.31.144 OpenFlow 189 Type: OFPT_PACKET_IN
379 1.804307045 172.31.23.72 -> 172.31.31.144 OpenFlow 189 Type: OFPT_PACKET_IN
380 1.807143111 172.31.31.144 -> 172.31.23.72 TCP 66 6633 → 45438 [ACK] Seq=65 Ack=172 Win=853 Len=0 TSval=819933 TSecr=19390057
381 1.807149786 172.31.31.144 -> 172.31.23.72 TCP 66 6633 → 45432 [ACK] Seq=65 Ack=172 Win=853 Len=0 TSval=819933 TSecr=19390057
382 1.807152258 172.31.31.144 -> 172.31.23.72 TCP 66 6633 → 45434 [ACK] Seq=833 Ack=647 Win=853 Len=0 TSval=819933 TSecr=19390057
383 1.807154752 172.31.31.144 -> 172.31.23.72 TCP 66 6633 → 45444 [ACK] Seq=1145 Ack=335 Win=853 Len=0 TSval=819933 TSecr=19390057
384 1.807156966 172.31.31.144 -> 172.31.23.72 TCP 66 6633 → 45438 [ACK] Seq=65 Ack=541 Win=853 Len=0 TSval=819933 TSecr=19390057
385 1.808737015 172.31.31.144 -> 172.31.23.72 TCP 66 6633 → 45432 [ACK] Seq=65 Ack=295 Win=853 Len=0 TSval=819934 TSecr=19390058
386 1.808741873 172.31.31.144 -> 172.31.23.72 TCP 66 6633 → 45430 [ACK] Seq=65 Ack=295 Win=853 Len=0 TSval=819934 TSecr=19390057
387 1.808744570 172.31.31.144 -> 172.31.23.72 TCP 66 6633 → 45448 [ACK] Seq=65 Ack=295 Win=853 Len=0 TSval=819934 TSecr=19390057
388 1.898219680 172.31.31.144 -> 172.31.23.72 OpenFlow 187 Type: OFPT_PACKET_OUT
389 1.898257677 172.31.31.144 -> 172.31.23.72 OpenFlow 187 Type: OFPT_PACKET_OUT
390 1.898261822 172.31.31.144 -> 172.31.23.72 OpenFlow 187 Type: OFPT_PACKET_OUT
391 1.898513108 172.31.31.144 -> 172.31.23.72 OpenFlow 187 Type: OFPT_PACKET_OUT
392 1.898519051 172.31.31.144 -> 172.31.23.72 OpenFlow 187 Type: OFPT_PACKET_OUT
393 1.898521199 172.31.31.144 -> 172.31.23.72 OpenFlow 187 Type: OFPT_PACKET_OUT
394 1.898522879 172.31.31.144 -> 172.31.23.72 OpenFlow 187 Type: OFPT_PACKET_OUT
395 1.898524532 172.31.31.144 -> 172.31.23.72 OpenFlow 187 Type: OFPT_PACKET_OUT
396 1.898605426 172.31.31.144 -> 172.31.23.72 OpenFlow 187 Type: OFPT_PACKET_OUT
397 1.898661195 172.31.31.144 -> 172.31.23.72 OpenFlow 187 Type: OFPT_PACKET_OUT
398 1.898723371 172.31.31.144 -> 172.31.23.72 OpenFlow 187 Type: OFPT_PACKET_OUT
399 1.898775058 172.31.31.144 -> 172.31.23.72 OpenFlow 187 Type: OFPT_PACKET_OUT
400 1.898861193 172.31.23.72 -> 172.31.31.144 TCP 66 45420 → 6633 [ACK] Seq=49 Ack=1033 Win=213 Len=0 TSval=19390081 TSecr=819956
401 1.898897522 172.31.31.144 -> 172.31.23.72 OpenFlow 187 Type: OFPT_PACKET_OUT
402 1.898940844 172.31.31.144 -> 172.31.23.72 OpenFlow 187 Type: OFPT_PACKET_OUT
403 1.899000320 172.31.31.144 -> 172.31.23.72 OpenFlow 187 Type: OFPT_PACKET_OUT
404 1.899055873 172.31.31.144 -> 172.31.23.72 OpenFlow 187 Type: OFPT_PACKET_OUT
405 1.899117756 172.31.31.144 -> 172.31.23.72 OpenFlow 187 Type: OFPT_PACKET_OUT
406 1.899173409 172.31.31.144 -> 172.31.23.72 OpenFlow 187 Type: OFPT_PACKET_OUT
407 1.899293625 172.31.31.144 -> 172.31.23.72 OpenFlow 187 Type: OFPT_PACKET_OUT
408 1.899309294 172.31.31.144 -> 172.31.23.72 OpenFlow 187 Type: OFPT_PACKET_OUT
409 1.899383794 172.31.31.144 -> 172.31.23.72 OpenFlow 187 Type: OFPT_PACKET_OUT
410 1.899417607 172.31.23.72 -> 172.31.31.144 TCP 66 45424 → 6633 [ACK] Seq=401 Ack=2043 Win=213 Len=0 TSval=19390081 TSecr=819956
411 1.899451832 172.31.31.144 -> 172.31.23.72 OpenFlow 187 Type: OFPT_PACKET_OUT
412 1.899509358 172.31.23.72 -> 172.31.31.144 OpenFlow 189 Type: OFPT_PACKET_IN
413 1.899522787 172.31.31.144 -> 172.31.23.72 OpenFlow 187 Type: OFPT_PACKET_OUT
414 1.899533925 172.31.23.72 -> 172.31.31.144 OpenFlow 189 Type: OFPT_PACKET_IN
415 1.899573642 172.31.23.72 -> 172.31.31.144 OpenFlow 189 Type: OFPT_PACKET_IN
416 1.899595117 172.31.23.72 -> 172.31.31.144 OpenFlow 189 Type: OFPT_PACKET_IN
417 1.899601837 172.31.23.72 -> 172.31.31.144 OpenFlow 189 Type: OFPT_PACKET_IN
418 1.899617867 172.31.23.72 -> 172.31.31.144 OpenFlow 189 Type: OFPT_PACKET_IN
419 1.899660871 172.31.23.72 -> 172.31.31.144 OpenFlow 189 Type: OFPT_PACKET_IN
420 1.899669547 172.31.23.72 -> 172.31.31.144 OpenFlow 189 Type: OFPT_PACKET_IN
421 1.899702034 172.31.23.72 -> 172.31.31.144 OpenFlow 189 Type: OFPT_PACKET_IN
422 1.899704393 172.31.23.72 -> 172.31.31.144 OpenFlow 189 Type: OFPT_PACKET_IN
423 1.899719888 172.31.23.72 -> 172.31.31.144 OpenFlow 189 Type: OFPT_PACKET_IN
424 1.899725784 172.31.31.144 -> 172.31.23.72 OpenFlow 187 Type: OFPT_PACKET_OUT
425 1.899729242 172.31.31.144 -> 172.31.23.72 OpenFlow 187 Type: OFPT_PACKET_OUT
426 1.899731254 172.31.31.144 -> 172.31.23.72 OpenFlow 187 Type: OFPT_PACKET_OUT
427 1.899809694 172.31.23.72 -> 172.31.31.144 OpenFlow 189 Type: OFPT_PACKET_IN
428 1.899816606 172.31.23.72 -> 172.31.31.144 OpenFlow 189 Type: OFPT_PACKET_IN
429 1.899869477 172.31.23.72 -> 172.31.31.144 OpenFlow 189 Type: OFPT_PACKET_IN
430 1.899872489 172.31.23.72 -> 172.31.31.144 OpenFlow 189 Type: OFPT_PACKET_IN
431 1.899913129 172.31.31.144 -> 172.31.23.72 TCP 66 6633 → 45418 [ACK] Seq=65 Ack=295 Win=853 Len=0 TSval=819957 TSecr=19390081
432 1.899921554 172.31.31.144 -> 172.31.23.72 OpenFlow 187 Type: OFPT_PACKET_OUT
433 1.899925736 172.31.23.72 -> 172.31.31.144 OpenFlow 189 Type: OFPT_PACKET_IN
434 1.899932001 172.31.31.144 -> 172.31.23.72 TCP 66 6633 → 45430 [ACK] Seq=65 Ack=541 Win=853 Len=0 TSval=819957 TSecr=19390081
435 1.899934620 172.31.31.144 -> 172.31.23.72 OpenFlow 187 Type: OFPT_PACKET_OUT
436 1.899936306 172.31.31.144 -> 172.31.23.72 TCP 66 6633 → 45416 [ACK] Seq=449 Ack=348 Win=853 Len=0 TSval=819957 TSecr=19390081
437 1.900045972 172.31.31.144 -> 172.31.23.72 TCP 66 6633 → 45414 [ACK] Seq=449 Ack=348 Win=853 Len=0 TSval=819957 TSecr=19390081
438 1.900052402 172.31.31.144 -> 172.31.23.72 TCP 66 6633 → 45426 [ACK] Seq=65 Ack=172 Win=853 Len=0 TSval=819957 TSecr=19390081
439 1.900054577 172.31.31.144 -> 172.31.23.72 TCP 66 6633 → 45416 [ACK] Seq=449 Ack=471 Win=853 Len=0 TSval=819957 TSecr=19390081
440 1.900112579 172.31.31.144 -> 172.31.23.72 TCP 66 6633 → 45414 [ACK] Seq=449 Ack=471 Win=853 Len=0 TSval=819957 TSecr=19390081
441 1.900117923 172.31.31.144 -> 172.31.23.72 TCP 66 6633 → 45426 [ACK] Seq=65 Ack=295 Win=853 Len=0 TSval=819957 TSecr=19390081
442 1.900119738 172.31.31.144 -> 172.31.23.72 TCP 66 6633 → 45422 [ACK] Seq=65 Ack=172 Win=853 Len=0 TSval=819957 TSecr=19390081
443 1.900132490 172.31.31.144 -> 172.31.23.72 TCP 66 6633 → 45428 [ACK] Seq=65 Ack=295 Win=853 Len=0 TSval=819957 TSecr=19390081
444 1.900174111 172.31.31.144 -> 172.31.23.72 TCP 66 6633 → 45422 [ACK] Seq=65 Ack=295 Win=853 Len=0 TSval=819957 TSecr=19390081
445 1.900397389 172.31.31.144 -> 172.31.23.72 TCP 66 6633 → 45434 [ACK] Seq=2043 Ack=893 Win=853 Len=0 TSval=819957 TSecr=19390081
446 1.900473730 172.31.23.72 -> 172.31.31.144 OpenFlow 189 Type: OFPT_PACKET_IN
447 1.900499709 172.31.23.72 -> 172.31.31.144 OpenFlow 189 Type: OFPT_PACKET_IN
448 1.900519775 172.31.23.72 -> 172.31.31.144 OpenFlow 189 Type: OFPT_PACKET_IN
449 1.900532609 172.31.23.72 -> 172.31.31.144 OpenFlow 189 Type: OFPT_PACKET_IN
450 1.900597038 172.31.23.72 -> 172.31.31.144 OpenFlow 189 Type: OFPT_PACKET_IN
451 1.900599736 172.31.23.72 -> 172.31.31.144 OpenFlow 189 Type: OFPT_PACKET_IN
452 1.900614966 172.31.31.144 -> 172.31.23.72 OpenFlow 187 Type: OFPT_PACKET_OUT
453 1.900618899 172.31.31.144 -> 172.31.23.72 OpenFlow 550 Type: OFPT_PACKET_OUT
454 1.900652843 172.31.23.72 -> 172.31.31.144 OpenFlow 189 Type: OFPT_PACKET_IN
455 1.900659222 172.31.23.72 -> 172.31.31.144 OpenFlow 189 Type: OFPT_PACKET_IN
456 1.900716522 172.31.31.144 -> 172.31.23.72 OpenFlow 187 Type: OFPT_PACKET_OUT
457 1.900720701 172.31.31.144 -> 172.31.23.72 OpenFlow 187 Type: OFPT_PACKET_OUT
458 1.900753483 172.31.23.72 -> 172.31.31.144 OpenFlow 189 Type: OFPT_PACKET_IN
459 1.900801194 172.31.31.144 -> 172.31.23.72 TCP 66 6633 → 45424 [ACK] Seq=2043 Ack=647 Win=853 Len=0 TSval=819957 TSecr=19390082
460 1.900806626 172.31.31.144 -> 172.31.23.72 OpenFlow 187 Type: OFPT_PACKET_OUT
461 1.900811460 172.31.23.72 -> 172.31.31.144 OpenFlow 189 Type: OFPT_PACKET_IN
462 1.900870401 172.31.31.144 -> 172.31.23.72 OpenFlow 187 Type: OFPT_PACKET_OUT
463 1.900891420 172.31.31.144 -> 172.31.23.72 OpenFlow 187 Type: OFPT_PACKET_OUT
464 1.900954981 172.31.31.144 -> 172.31.23.72 TCP 66 6633 → 45436 [ACK] Seq=1249 Ack=180 Win=853 Len=0 TSval=819957 TSecr=19390082
465 1.900971442 172.31.31.144 -> 172.31.23.72 TCP 66 6633 → 45436 [ACK] Seq=1249 Ack=303 Win=853 Len=0 TSval=819957 TSecr=19390082
466 1.901070231 172.31.31.144 -> 172.31.23.72 TCP 66 6633 → 45442 [ACK] Seq=1265 Ack=909 Win=853 Len=0 TSval=819957 TSecr=19390082
467 1.901076089 172.31.31.144 -> 172.31.23.72 TCP 66 6633 → 45430 [ACK] Seq=65 Ack=787 Win=853 Len=0 TSval=819957 TSecr=19390082
468 1.901086778 172.31.31.144 -> 172.31.23.72 OpenFlow 187 Type: OFPT_PACKET_OUT
469 1.901106595 172.31.31.144 -> 172.31.23.72 OpenFlow 187 Type: OFPT_PACKET_OUT
470 1.901158871 172.31.31.144 -> 172.31.23.72 TCP 66 6633 → 45450 [ACK] Seq=65 Ack=541 Win=853 Len=0 TSval=819957 TSecr=19390082
471 1.901202122 172.31.31.144 -> 172.31.23.72 OpenFlow 187 Type: OFPT_PACKET_OUT
472 1.901239058 172.31.23.72 -> 172.31.31.144 TCP 66 45418 → 6633 [ACK] Seq=295 Ack=1275 Win=213 Len=0 TSval=19390082 TSecr=819957
473 1.901257574 172.31.31.144 -> 172.31.23.72 OpenFlow 187 Type: OFPT_PACKET_OUT
474 1.901337188 172.31.31.144 -> 172.31.23.72 OpenFlow 187 Type: OFPT_PACKET_OUT
475 1.901394063 172.31.31.144 -> 172.31.23.72 OpenFlow 187 Type: OFPT_PACKET_OUT
476 1.901455719 172.31.31.144 -> 172.31.23.72 OpenFlow 187 Type: OFPT_PACKET_OUT
477 1.901517014 172.31.31.144 -> 172.31.23.72 OpenFlow 187 Type: OFPT_PACKET_OUT
478 1.901592901 172.31.31.144 -> 172.31.23.72 OpenFlow 187 Type: OFPT_PACKET_OUT
479 1.901634006 172.31.31.144 -> 172.31.23.72 OpenFlow 187 Type: OFPT_PACKET_OUT
480 1.901745464 172.31.31.144 -> 172.31.23.72 OpenFlow 187 Type: OFPT_PACKET_OUT
481 1.901768116 172.31.31.144 -> 172.31.23.72 OpenFlow 187 Type: OFPT_PACKET_OUT
482 1.901793926 172.31.23.72 -> 172.31.31.144 TCP 66 45444 → 6633 [ACK] Seq=335 Ack=2355 Win=213 Len=0 TSval=19390082 TSecr=819957
483 1.901856292 172.31.31.144 -> 172.31.23.72 OpenFlow 187 Type: OFPT_PACKET_OUT
484 1.901896614 172.31.31.144 -> 172.31.23.72 OpenFlow 187 Type: OFPT_PACKET_OUT
485 1.901946734 172.31.31.144 -> 172.31.23.72 OpenFlow 187 Type: OFPT_PACKET_OUT
486 1.902007337 172.31.31.144 -> 172.31.23.72 OpenFlow 187 Type: OFPT_PACKET_OUT
487 1.902075748 172.31.31.144 -> 172.31.23.72 OpenFlow 187 Type: OFPT_PACKET_OUT
488 1.902157151 172.31.31.144 -> 172.31.23.72 OpenFlow 187 Type: OFPT_PACKET_OUT
489 1.902210853 172.31.31.144 -> 172.31.23.72 OpenFlow 187 Type: OFPT_PACKET_OUT
490 1.902244864 172.31.23.72 -> 172.31.31.144 TCP 66 45438 → 6633 [ACK] Seq=541 Ack=1033 Win=213 Len=0 TSval=19390082 TSecr=819957
491 1.902280943 172.31.31.144 -> 172.31.23.72 OpenFlow 187 Type: OFPT_PACKET_OUT
492 1.902333144 172.31.31.144 -> 172.31.23.72 OpenFlow 187 Type: OFPT_PACKET_OUT
493 1.902403386 172.31.31.144 -> 172.31.23.72 OpenFlow 187 Type: OFPT_PACKET_OUT
494 1.902457123 172.31.23.72 -> 172.31.31.144 TCP 66 45450 → 6633 [ACK] Seq=541 Ack=549 Win=213 Len=0 TSval=19390082 TSecr=819957
495 1.902463948 172.31.31.144 -> 172.31.23.72 OpenFlow 187 Type: OFPT_PACKET_OUT
496 1.902516313 172.31.31.144 -> 172.31.23.72 OpenFlow 187 Type: OFPT_PACKET_OUT
497 1.902539811 172.31.23.72 -> 172.31.31.144 TCP 66 45450 → 6633 [ACK] Seq=541 Ack=791 Win=213 Len=0 TSval=19390082 TSecr=819957
498 1.902620159 172.31.23.72 -> 172.31.31.144 OpenFlow 189 Type: OFPT_PACKET_IN
499 1.902644608 172.31.31.144 -> 172.31.23.72 OpenFlow 187 Type: OFPT_PACKET_OUT
500 1.902651581 172.31.23.72 -> 172.31.31.144 OpenFlow 189 Type: OFPT_PACKET_IN
501 1.902658225 172.31.23.72 -> 172.31.31.144 OpenFlow 189 Type: OFPT_PACKET_IN
502 1.902676792 172.31.23.72 -> 172.31.31.144 OpenFlow 189 Type: OFPT_PACKET_IN
503 1.902684808 172.31.31.144 -> 172.31.23.72 OpenFlow 187 Type: OFPT_PACKET_OUT
504 1.902713061 172.31.23.72 -> 172.31.31.144 OpenFlow 189 Type: OFPT_PACKET_IN
505 1.902715667 172.31.23.72 -> 172.31.31.144 OpenFlow 435 Type: OFPT_PACKET_IN
506 1.902732541 172.31.23.72 -> 172.31.31.144 OpenFlow 189 Type: OFPT_PACKET_IN
507 1.902750601 172.31.31.144 -> 172.31.23.72 OpenFlow 187 Type: OFPT_PACKET_OUT
508 1.902753354 172.31.31.144 -> 172.31.23.72 OpenFlow 187 Type: OFPT_PACKET_OUT
509 1.902757534 172.31.23.72 -> 172.31.31.144 OpenFlow 189 Type: OFPT_PACKET_IN
510 1.902762426 172.31.23.72 -> 172.31.31.144 OpenFlow 189 Type: OFPT_PACKET_IN
511 1.902777298 172.31.23.72 -> 172.31.31.144 OpenFlow 189 Type: OFPT_PACKET_IN
512 1.902788528 172.31.23.72 -> 172.31.31.144 OpenFlow 189 Type: OFPT_PACKET_IN
513 1.902790963 172.31.23.72 -> 172.31.31.144 OpenFlow 189 Type: OFPT_PACKET_IN
514 1.902871139 172.31.23.72 -> 172.31.31.144 OpenFlow 189 Type: OFPT_PACKET_IN
515 1.902874472 172.31.23.72 -> 172.31.31.144 OpenFlow 189 Type: OFPT_PACKET_IN
516 1.902888703 172.31.31.144 -> 172.31.23.72 TCP 66 6633 → 45416 [ACK] Seq=449 Ack=594 Win=853 Len=0 TSval=819958 TSecr=19390082
517 1.902893532 172.31.31.144 -> 172.31.23.72 TCP 66 6633 → 45416 [ACK] Seq=449 Ack=717 Win=853 Len=0 TSval=819958 TSecr=19390082
518 1.902895536 172.31.31.144 -> 172.31.23.72 OpenFlow 187 Type: OFPT_PACKET_OUT
519 1.902897316 172.31.31.144 -> 172.31.23.72 TCP 66 6633 → 45446 [ACK] Seq=65 Ack=172 Win=853 Len=0 TSval=819958 TSecr=19390082
520 1.902911024 172.31.23.72 -> 172.31.31.144 OpenFlow 189 Type: OFPT_PACKET_IN
521 1.902918178 172.31.23.72 -> 172.31.31.144 OpenFlow 189 Type: OFPT_PACKET_IN
522 1.902931873 172.31.23.72 -> 172.31.31.144 OpenFlow 189 Type: OFPT_PACKET_IN
523 1.902947067 172.31.23.72 -> 172.31.31.144 OpenFlow 189 Type: OFPT_PACKET_IN
524 1.902959040 172.31.23.72 -> 172.31.31.144 OpenFlow 189 Type: OFPT_PACKET_IN
525 1.902961561 172.31.23.72 -> 172.31.31.144 OpenFlow 189 Type: OFPT_PACKET_IN
526 1.903136511 172.31.31.144 -> 172.31.23.72 TCP 66 6633 → 45432 [ACK] Seq=65 Ack=418 Win=853 Len=0 TSval=819958 TSecr=19390082
527 1.903143509 172.31.31.144 -> 172.31.23.72 OpenFlow 187 Type: OFPT_PACKET_OUT
528 1.903145973 172.31.31.144 -> 172.31.23.72 TCP 66 6633 → 45446 [ACK] Seq=65 Ack=541 Win=853 Len=0 TSval=819958 TSecr=19390082
529 1.903148130 172.31.31.144 -> 172.31.23.72 TCP 66 6633 → 45454 [ACK] Seq=1657 Ack=1116 Win=853 Len=0 TSval=819958 TSecr=19390082
530 1.903150197 172.31.31.144 -> 172.31.23.72 OpenFlow 187 Type: OFPT_PACKET_OUT
531 1.903151848 172.31.31.144 -> 172.31.23.72 OpenFlow 187 Type: OFPT_PACKET_OUT
532 1.903153267 172.31.31.144 -> 172.31.23.72 TCP 66 6633 → 45426 [ACK] Seq=65 Ack=418 Win=853 Len=0 TSval=819958 TSecr=19390082
533 1.903155035 172.31.31.144 -> 172.31.23.72 TCP 66 6633 → 45432 [ACK] Seq=65 Ack=541 Win=853 Len=0 TSval=819958 TSecr=19390082
534 1.903161934 172.31.23.72 -> 172.31.31.144 OpenFlow 189 Type: OFPT_PACKET_IN
535 1.903168315 172.31.23.72 -> 172.31.31.144 OpenFlow 189 Type: OFPT_PACKET_IN
536 1.903170720 172.31.23.72 -> 172.31.31.144 OpenFlow 189 Type: OFPT_PACKET_IN
537 1.903337070 172.31.23.72 -> 172.31.31.144 OpenFlow 435 Type: OFPT_PACKET_IN
538 1.903340044 172.31.23.72 -> 172.31.31.144 OpenFlow 189 Type: OFPT_PACKET_IN
539 1.903341762 172.31.23.72 -> 172.31.31.144 OpenFlow 189 Type: OFPT_PACKET_IN
540 1.903361503 172.31.23.72 -> 172.31.31.144 TCP 66 45430 → 6633 [ACK] Seq=787 Ack=1033 Win=213 Len=0 TSval=19390082 TSecr=819957
541 1.903386392 172.31.31.144 -> 172.31.23.72 TCP 66 6633 → 45456 [ACK] Seq=833 Ack=647 Win=853 Len=0 TSval=819958 TSecr=19390082
542 1.903391521 172.31.31.144 -> 172.31.23.72 OpenFlow 187 Type: OFPT_PACKET_OUT
543 1.903393530 172.31.31.144 -> 172.31.23.72 TCP 66 6633 → 45422 [ACK] Seq=65 Ack=418 Win=853 Len=0 TSval=819958 TSecr=19390082
544 1.903395704 172.31.31.144 -> 172.31.23.72 TCP 66 6633 → 45454 [ACK] Seq=1657 Ack=1239 Win=853 Len=0 TSval=819958 TSecr=19390082
545 1.903397557 172.31.31.144 -> 172.31.23.72 TCP 66 6633 → 45462 [ACK] Seq=791 Ack=172 Win=853 Len=0 TSval=819958 TSecr=19390082
546 1.903399454 172.31.31.144 -> 172.31.23.72 TCP 66 6633 → 45436 [ACK] Seq=1249 Ack=426 Win=853 Len=0 TSval=819958 TSecr=19390082
547 1.903401225 172.31.31.144 -> 172.31.23.72 TCP 66 6633 → 45420 [ACK] Seq=1033 Ack=172 Win=853 Len=0 TSval=819958 TSecr=19390082
548 1.903508736 172.31.23.72 -> 172.31.31.144 OpenFlow 189 Type: OFPT_PACKET_IN
549 1.903556081 172.31.23.72 -> 172.31.31.144 OpenFlow 189 Type: OFPT_PACKET_IN
550 1.903648862 172.31.23.72 -> 172.31.31.144 OpenFlow 189 Type: OFPT_PACKET_IN
551 1.903664950 172.31.23.72 -> 172.31.31.144 OpenFlow 189 Type: OFPT_PACKET_IN
552 1.903673450 172.31.31.144 -> 172.31.23.72 TCP 66 6633 → 45442 [ACK] Seq=1265 Ack=1155 Win=853 Len=0 TSval=819958 TSecr=19390082
553 1.903678200 172.31.31.144 -> 172.31.23.72 OpenFlow 187 Type: OFPT_PACKET_OUT
554 1.903680263 172.31.31.144 -> 172.31.23.72 TCP 66 6633 → 45426 [ACK] Seq=65 Ack=541 Win=853 Len=0 TSval=819958 TSecr=19390082
555 1.903682904 172.31.23.72 -> 172.31.31.144 OpenFlow 189 Type: OFPT_PACKET_IN
556 1.903688264 172.31.31.144 -> 172.31.23.72 TCP 66 6633 → 45422 [ACK] Seq=65 Ack=541 Win=853 Len=0 TSval=819958 TSecr=19390082
557 1.903690424 172.31.31.144 -> 172.31.23.72 OpenFlow 187 Type: OFPT_PACKET_OUT
558 1.903692285 172.31.31.144 -> 172.31.23.72 TCP 66 6633 → 45462 [ACK] Seq=791 Ack=295 Win=853 Len=0 TSval=819958 TSecr=19390082
559 1.903694000 172.31.31.144 -> 172.31.23.72 OpenFlow 187 Type: OFPT_PACKET_OUT
560 1.903695980 172.31.31.144 -> 172.31.23.72 TCP 66 6633 → 45436 [ACK] Seq=1249 Ack=795 Win=853 Len=0 TSval=819958 TSecr=19390082
561 1.903697949 172.31.31.144 -> 172.31.23.72 TCP 66 6633 → 45452 [ACK] Seq=2383 Ack=1239 Win=853 Len=0 TSval=819958 TSecr=19390082
562 1.903704286 172.31.23.72 -> 172.31.31.144 OpenFlow 189 Type: OFPT_PACKET_IN
563 1.903721735 172.31.23.72 -> 172.31.31.144 OpenFlow 189 Type: OFPT_PACKET_IN
564 1.903749863 172.31.23.72 -> 172.31.31.144 TCP 66 45430 → 6633 [ACK] Seq=787 Ack=1275 Win=213 Len=0 TSval=19390082 TSecr=819958
565 1.903810664 172.31.31.144 -> 172.31.23.72 TCP 66 6633 → 45420 [ACK] Seq=1033 Ack=295 Win=853 Len=0 TSval=819958 TSecr=19390082
566 1.903816488 172.31.31.144 -> 172.31.23.72 TCP 66 6633 → 45434 [ACK] Seq=2043 Ack=1139 Win=853 Len=0 TSval=819958 TSecr=19390082
567 1.903820217 172.31.23.72 -> 172.31.31.144 OpenFlow 189 Type: OFPT_PACKET_IN
568 1.903826118 172.31.31.144 -> 172.31.23.72 OpenFlow 187 Type: OFPT_PACKET_OUT
569 1.903918943 172.31.23.72 -> 172.31.31.144 OpenFlow 189 Type: OFPT_PACKET_IN
570 1.903953680 172.31.31.144 -> 172.31.23.72 TCP 66 6633 → 45432 [ACK] Seq=65 Ack=664 Win=853 Len=0 TSval=819958 TSecr=19390082
571 1.903959010 172.31.31.144 -> 172.31.23.72 TCP 66 6633 → 45426 [ACK] Seq=65 Ack=664 Win=853 Len=0 TSval=819958 TSecr=19390082
572 1.903961099 172.31.31.144 -> 172.31.23.72 OpenFlow 187 Type: OFPT_PACKET_OUT
573 1.903963229 172.31.31.144 -> 172.31.23.72 TCP 66 6633 → 45436 [ACK] Seq=1249 Ack=918 Win=853 Len=0 TSval=819958 TSecr=19390082
574 1.903965436 172.31.31.144 -> 172.31.23.72 OpenFlow 187 Type: OFPT_PACKET_OUT
575 1.903967002 172.31.31.144 -> 172.31.23.72 TCP 66 6633 → 45426 [ACK] Seq=65 Ack=787 Win=853 Len=0 TSval=819958 TSecr=19390082
576 1.904027531 172.31.31.144 -> 172.31.23.72 TCP 66 6633 → 45432 [ACK] Seq=65 Ack=787 Win=853 Len=0 TSval=819958 TSecr=19390082
577 1.904081583 172.31.23.72 -> 172.31.31.144 TCP 66 45428 → 6633 [ACK] Seq=295 Ack=670 Win=213 Len=0 TSval=19390082 TSecr=819958
578 1.904178984 172.31.23.72 -> 172.31.31.144 OpenFlow 189 Type: OFPT_PACKET_IN
579 1.904190075 172.31.31.144 -> 172.31.23.72 TCP 66 6633 → 45434 [ACK] Seq=2043 Ack=1385 Win=853 Len=0 TSval=819958 TSecr=19390082
580 1.904240193 172.31.23.72 -> 172.31.31.144 OpenFlow 189 Type: OFPT_PACKET_IN
581 1.904265053 172.31.31.144 -> 172.31.23.72 OpenFlow 187 Type: OFPT_PACKET_OUT
582 1.904271302 172.31.23.72 -> 172.31.31.144 OpenFlow 189 Type: OFPT_PACKET_IN
583 1.904346170 172.31.31.144 -> 172.31.23.72 TCP 66 6633 → 45432 [ACK] Seq=65 Ack=910 Win=853 Len=0 TSval=819958 TSecr=19390083
584 1.904351409 172.31.31.144 -> 172.31.23.72 TCP 66 6633 → 45424 [ACK] Seq=2043 Ack=893 Win=853 Len=0 TSval=819958 TSecr=19390082
585 1.904368422 172.31.31.144 -> 172.31.23.72 OpenFlow 187 Type: OFPT_PACKET_OUT
586 1.904379964 172.31.23.72 -> 172.31.31.144 OpenFlow 189 Type: OFPT_PACKET_IN
587 1.904398524 172.31.31.144 -> 172.31.23.72 TCP 66 6633 → 45426 [ACK] Seq=65 Ack=910 Win=853 Len=0 TSval=819958 TSecr=19390083
588 1.904407978 172.31.23.72 -> 172.31.31.144 OpenFlow 189 Type: OFPT_PACKET_IN
589 1.904439055 172.31.31.144 -> 172.31.23.72 OpenFlow 187 Type: OFPT_PACKET_OUT
590 1.904444665 172.31.23.72 -> 172.31.31.144 OpenFlow 189 Type: OFPT_PACKET_IN
591 1.904488752 172.31.31.144 -> 172.31.23.72 TCP 66 6633 → 45426 [ACK] Seq=65 Ack=1033 Win=853 Len=0 TSval=819958 TSecr=19390083
592 1.904540595 172.31.31.144 -> 172.31.23.72 TCP 66 6633 → 45436 [ACK] Seq=1249 Ack=1041 Win=853 Len=0 TSval=819958 TSecr=19390083
593 1.904555245 172.31.31.144 -> 172.31.23.72 OpenFlow 187 Type: OFPT_PACKET_OUT
594 1.904602453 172.31.31.144 -> 172.31.23.72 TCP 66 6633 → 45420 [ACK] Seq=1033 Ack=418 Win=853 Len=0 TSval=819958 TSecr=19390083
595 1.904618865 172.31.31.144 -> 172.31.23.72 TCP 66 6633 → 45420 [ACK] Seq=1033 Ack=541 Win=853 Len=0 TSval=819958 TSecr=19390083
596 1.904687078 172.31.23.72 -> 172.31.31.144 TCP 66 45416 → 6633 [ACK] Seq=717 Ack=812 Win=213 Len=0 TSval=19390083 TSecr=819958
597 1.904697377 172.31.31.144 -> 172.31.23.72 OpenFlow 187 Type: OFPT_PACKET_OUT
598 1.904775039 172.31.31.144 -> 172.31.23.72 OpenFlow 187 Type: OFPT_PACKET_OUT
599 1.904805895 172.31.23.72 -> 172.31.31.144 TCP 66 45416 → 6633 [ACK] Seq=717 Ack=1054 Win=213 Len=0 TSval=19390083 TSecr=819958
600 1.904851349 172.31.23.72 -> 172.31.31.144 OpenFlow 189 Type: OFPT_PACKET_IN
601 1.904891786 172.31.23.72 -> 172.31.31.144 OpenFlow 189 Type: OFPT_PACKET_IN
602 1.904918946 172.31.31.144 -> 172.31.23.72 OpenFlow 187 Type: OFPT_PACKET_OUT
603 1.904925188 172.31.23.72 -> 172.31.31.144 OpenFlow 189 Type: OFPT_PACKET_IN
604 1.904957170 172.31.31.144 -> 172.31.23.72 OpenFlow 187 Type: OFPT_PACKET_OUT
605 1.905014610 172.31.31.144 -> 172.31.23.72 OpenFlow 187 Type: OFPT_PACKET_OUT
606 1.905056169 172.31.31.144 -> 172.31.23.72 TCP 66 6633 → 45414 [ACK] Seq=449 Ack=594 Win=853 Len=0 TSval=819958 TSecr=19390083
607 1.905064601 172.31.23.72 -> 172.31.31.144 OpenFlow 189 Type: OFPT_PACKET_IN
608 1.905096778 172.31.31.144 -> 172.31.23.72 TCP 66 6633 → 45414 [ACK] Seq=449 Ack=717 Win=853 Len=0 TSval=819958 TSecr=19390083
609 1.905104221 172.31.23.72 -> 172.31.31.144 OpenFlow 189 Type: OFPT_PACKET_IN
610 1.905141400 172.31.31.144 -> 172.31.23.72 TCP 66 6633 → 45432 [ACK] Seq=65 Ack=1033 Win=853 Len=0 TSval=819958 TSecr=19390083
611 1.905203712 172.31.23.72 -> 172.31.31.144 TCP 66 45416 → 6633 [ACK] Seq=717 Ack=1417 Win=213 Len=0 TSval=19390083 TSecr=819958
612 1.905301168 172.31.31.144 -> 172.31.23.72 TCP 66 6633 → 45418 [ACK] Seq=1275 Ack=541 Win=853 Len=0 TSval=819958 TSecr=19390083
613 1.905410900 172.31.23.72 -> 172.31.31.144 OpenFlow 189 Type: OFPT_PACKET_IN
614 1.905443084 172.31.23.72 -> 172.31.31.144 OpenFlow 189 Type: OFPT_PACKET_IN
615 1.905654132 172.31.31.144 -> 172.31.23.72 TCP 66 6633 → 45424 [ACK] Seq=2043 Ack=1139 Win=853 Len=0 TSval=819958 TSecr=19390083
616 1.944138725 172.31.23.72 -> 172.31.31.144 TCP 66 45428 → 6633 [ACK] Seq=295 Ack=791 Win=213 Len=0 TSval=19390093 TSecr=819958
617 1.998440243 172.31.31.144 -> 172.31.23.72 OpenFlow 187 Type: OFPT_PACKET_OUT
618 1.998473366 172.31.31.144 -> 172.31.23.72 OpenFlow 187 Type: OFPT_PACKET_OUT
619 1.998511207 172.31.31.144 -> 172.31.23.72 OpenFlow 187 Type: OFPT_PACKET_OUT
620 1.998517258 172.31.31.144 -> 172.31.23.72 OpenFlow 187 Type: OFPT_PACKET_OUT
621 1.998570804 172.31.31.144 -> 172.31.23.72 OpenFlow 187 Type: OFPT_PACKET_OUT
622 1.998619023 172.31.31.144 -> 172.31.23.72 OpenFlow 187 Type: OFPT_PACKET_OUT
623 1.998694260 172.31.31.144 -> 172.31.23.72 OpenFlow 187 Type: OFPT_PACKET_OUT
624 1.998755057 172.31.31.144 -> 172.31.23.72 OpenFlow 187 Type: OFPT_PACKET_OUT
625 1.998824209 172.31.31.144 -> 172.31.23.72 OpenFlow 187 Type: OFPT_PACKET_OUT
626 1.998884642 172.31.31.144 -> 172.31.23.72 OpenFlow 187 Type: OFPT_PACKET_OUT
627 1.999022932 172.31.31.144 -> 172.31.23.72 OpenFlow 187 Type: OFPT_PACKET_OUT
628 1.999098048 172.31.31.144 -> 172.31.23.72 OpenFlow 308 Type: OFPT_PACKET_OUT
629 1.999116428 172.31.31.144 -> 172.31.23.72 OpenFlow 187 Type: OFPT_PACKET_OUT
630 1.999173802 172.31.31.144 -> 172.31.23.72 OpenFlow 187 Type: OFPT_PACKET_OUT
631 1.999242820 172.31.31.144 -> 172.31.23.72 OpenFlow 187 Type: OFPT_PACKET_OUT
632 1.999307992 172.31.31.144 -> 172.31.23.72 OpenFlow 187 Type: OFPT_PACKET_OUT
633 1.999387401 172.31.31.144 -> 172.31.23.72 OpenFlow 187 Type: OFPT_PACKET_OUT
634 1.999439736 172.31.23.72 -> 172.31.31.144 TCP 66 45446 → 6633 [ACK] Seq=541 Ack=1275 Win=213 Len=0 TSval=19390106 TSecr=819981
635 1.999529244 172.31.31.144 -> 172.31.23.72 OpenFlow 187 Type: OFPT_PACKET_OUT
636 1.999535236 172.31.31.144 -> 172.31.23.72 OpenFlow 187 Type: OFPT_PACKET_OUT
637 1.999578606 172.31.31.144 -> 172.31.23.72 OpenFlow 187 Type: OFPT_PACKET_OUT
638 1.999632481 172.31.31.144 -> 172.31.23.72 OpenFlow 187 Type: OFPT_PACKET_OUT
639 1.999702054 172.31.31.144 -> 172.31.23.72 OpenFlow 187 Type: OFPT_PACKET_OUT
640 1.999782708 172.31.31.144 -> 172.31.23.72 OpenFlow 187 Type: OFPT_PACKET_OUT
641 1.999849172 172.31.31.144 -> 172.31.23.72 OpenFlow 187 Type: OFPT_PACKET_OUT
642 1.999879527 172.31.23.72 -> 172.31.31.144 TCP 66 45432 → 6633 [ACK] Seq=1033 Ack=1033 Win=213 Len=0 TSval=19390106 TSecr=819982
643 1.999910741 172.31.31.144 -> 172.31.23.72 OpenFlow 187 Type: OFPT_PACKET_OUT
644 1.999961877 172.31.31.144 -> 172.31.23.72 OpenFlow 187 Type: OFPT_PACKET_OUT
645 2.000031191 172.31.31.144 -> 172.31.23.72 OpenFlow 187 Type: OFPT_PACKET_OUT
646 2.000086252 172.31.31.144 -> 172.31.23.72 OpenFlow 187 Type: OFPT_PACKET_OUT
647 2.000150914 172.31.31.144 -> 172.31.23.72 OpenFlow 187 Type: OFPT_PACKET_OUT
648 2.000176836 172.31.23.72 -> 172.31.31.144 TCP 66 45460 → 6633 [ACK] Seq=225 Ack=1175 Win=213 Len=0 TSval=19390107 TSecr=819982
649 2.000237617 172.31.31.144 -> 172.31.23.72 OpenFlow 187 Type: OFPT_PACKET_OUT
650 2.000266835 172.31.23.72 -> 172.31.31.144 OpenFlow 189 Type: OFPT_PACKET_IN
651 2.000276067 172.31.31.144 -> 172.31.23.72 OpenFlow 187 Type: OFPT_PACKET_OUT
652 2.000292627 172.31.23.72 -> 172.31.31.144 OpenFlow 312 Type: OFPT_PACKET_IN
653 2.000329898 172.31.23.72 -> 172.31.31.144 OpenFlow 189 Type: OFPT_PACKET_IN
654 2.000391751 172.31.31.144 -> 172.31.23.72 OpenFlow 187 Type: OFPT_PACKET_OUT
655 2.000398672 172.31.31.144 -> 172.31.23.72 OpenFlow 187 Type: OFPT_PACKET_OUT
656 2.000472027 172.31.31.144 -> 172.31.23.72 OpenFlow 187 Type: OFPT_PACKET_OUT
657 2.000528437 172.31.31.144 -> 172.31.23.72 OpenFlow 187 Type: OFPT_PACKET_OUT
658 2.000627950 172.31.31.144 -> 172.31.23.72 OpenFlow 187 Type: OFPT_PACKET_OUT
659 2.000644252 172.31.31.144 -> 172.31.23.72 TCP 66 6633 → 45458 [ACK] Seq=1801 Ack=893 Win=853 Len=0 TSval=819982 TSecr=19390107
660 2.000653046 172.31.23.72 -> 172.31.31.144 OpenFlow 189 Type: OFPT_PACKET_IN
661 2.000675748 172.31.23.72 -> 172.31.31.144 OpenFlow 435 Type: OFPT_PACKET_IN
662 2.000714438 172.31.31.144 -> 172.31.23.72 OpenFlow 187 Type: OFPT_PACKET_OUT
663 2.000771665 172.31.31.144 -> 172.31.23.72 OpenFlow 187 Type: OFPT_PACKET_OUT
664 2.000820861 172.31.31.144 -> 172.31.23.72 OpenFlow 187 Type: OFPT_PACKET_OUT
665 2.000917632 172.31.31.144 -> 172.31.23.72 OpenFlow 187 Type: OFPT_PACKET_OUT
666 2.000973153 172.31.31.144 -> 172.31.23.72 OpenFlow 187 Type: OFPT_PACKET_OUT
667 2.001036664 172.31.23.72 -> 172.31.31.144 TCP 66 45456 → 6633 [ACK] Seq=1139 Ack=1801 Win=213 Len=0 TSval=19390107 TSecr=819982
668 2.001048848 172.31.31.144 -> 172.31.23.72 OpenFlow 187 Type: OFPT_PACKET_OUT
669 2.001113337 172.31.31.144 -> 172.31.23.72 OpenFlow 187 Type: OFPT_PACKET_OUT
670 2.001194860 172.31.31.144 -> 172.31.23.72 OpenFlow 187 Type: OFPT_PACKET_OUT
671 2.001232438 172.31.31.144 -> 172.31.23.72 OpenFlow 187 Type: OFPT_PACKET_OUT
672 2.001289113 172.31.23.72 -> 172.31.31.144 TCP 66 45414 → 6633 [ACK] Seq=717 Ack=1175 Win=213 Len=0 TSval=19390107 TSecr=819982
673 2.001361574 172.31.31.144 -> 172.31.23.72 OpenFlow 187 Type: OFPT_PACKET_OUT
674 2.001367627 172.31.23.72 -> 172.31.31.144 OpenFlow 189 Type: OFPT_PACKET_IN
675 2.001377991 172.31.31.144 -> 172.31.23.72 OpenFlow 187 Type: OFPT_PACKET_OUT
676 2.001388519 172.31.23.72 -> 172.31.31.144 OpenFlow 189 Type: OFPT_PACKET_IN
677 2.001453743 172.31.31.144 -> 172.31.23.72 OpenFlow 187 Type: OFPT_PACKET_OUT
678 2.001482599 172.31.31.144 -> 172.31.23.72 OpenFlow 187 Type: OFPT_PACKET_OUT
679 2.001539154 172.31.31.144 -> 172.31.23.72 TCP 66 6633 → 45454 [ACK] Seq=2141 Ack=1362 Win=853 Len=0 TSval=819982 TSecr=19390107
680 2.001551192 172.31.23.72 -> 172.31.31.144 TCP 66 45454 → 6633 [ACK] Seq=1485 Ack=2141 Win=213 Len=0 TSval=19390107 TSecr=819982
681 2.001559862 172.31.31.144 -> 172.31.23.72 OpenFlow 187 Type: OFPT_PACKET_OUT
682 2.001646774 172.31.23.72 -> 172.31.31.144 OpenFlow 189 Type: OFPT_PACKET_IN
683 2.001673710 172.31.23.72 -> 172.31.31.144 OpenFlow 435 Type: OFPT_PACKET_IN
684 2.001763216 172.31.31.144 -> 172.31.23.72 OpenFlow 187 Type: OFPT_PACKET_OUT
685 2.001779175 172.31.31.144 -> 172.31.23.72 OpenFlow 187 Type: OFPT_PACKET_OUT
686 2.001806826 172.31.23.72 -> 172.31.31.144 OpenFlow 189 Type: OFPT_PACKET_IN
687 2.001822547 172.31.31.144 -> 172.31.23.72 OpenFlow 187 Type: OFPT_PACKET_OUT
688 2.001827850 172.31.23.72 -> 172.31.31.144 OpenFlow 189 Type: OFPT_PACKET_IN
689 2.001859887 172.31.23.72 -> 172.31.31.144 OpenFlow 189 Type: OFPT_PACKET_IN
690 2.001880751 172.31.23.72 -> 172.31.31.144 OpenFlow 189 Type: OFPT_PACKET_IN
691 2.001889062 172.31.23.72 -> 172.31.31.144 OpenFlow 189 Type: OFPT_PACKET_IN
692 2.001907919 172.31.23.72 -> 172.31.31.144 OpenFlow 189 Type: OFPT_PACKET_IN
693 2.001941517 172.31.23.72 -> 172.31.31.144 OpenFlow 189 Type: OFPT_PACKET_IN
694 2.001957599 172.31.23.72 -> 172.31.31.144 OpenFlow 189 Type: OFPT_PACKET_IN
695 2.001969775 172.31.23.72 -> 172.31.31.144 OpenFlow 189 Type: OFPT_PACKET_IN
696 2.001980977 172.31.23.72 -> 172.31.31.144 OpenFlow 189 Type: OFPT_PACKET_IN
697 2.001998131 172.31.23.72 -> 172.31.31.144 OpenFlow 189 Type: OFPT_PACKET_IN
698 2.002000227 172.31.23.72 -> 172.31.31.144 OpenFlow 558 Type: OFPT_PACKET_IN
699 2.002011699 172.31.23.72 -> 172.31.31.144 OpenFlow 189 Type: OFPT_PACKET_IN
700 2.002023303 172.31.23.72 -> 172.31.31.144 OpenFlow 189 Type: OFPT_PACKET_IN
701 2.002101500 172.31.31.144 -> 172.31.23.72 OpenFlow 187 Type: OFPT_PACKET_OUT
702 2.002119549 172.31.31.144 -> 172.31.23.72 TCP 66 6633 → 45462 [ACK] Seq=791 Ack=418 Win=853 Len=0 TSval=819982 TSecr=19390107
703 2.002122200 172.31.31.144 -> 172.31.23.72 TCP 66 6633 → 45462 [ACK] Seq=791 Ack=541 Win=853 Len=0 TSval=819982 TSecr=19390107
704 2.002124480 172.31.31.144 -> 172.31.23.72 OpenFlow 187 Type: OFPT_PACKET_OUT
705 2.002126868 172.31.31.144 -> 172.31.23.72 OpenFlow 187 Type: OFPT_PACKET_OUT
706 2.002133917 172.31.23.72 -> 172.31.31.144 OpenFlow 435 Type: OFPT_PACKET_IN
707 2.002140933 172.31.23.72 -> 172.31.31.144 OpenFlow 189 Type: OFPT_PACKET_IN
708 2.002235833 172.31.23.72 -> 172.31.31.144 TCP 66 45448 → 6633 [ACK] Seq=787 Ack=549 Win=213 Len=0 TSval=19390107 TSecr=819982
709 2.002239528 172.31.23.72 -> 172.31.31.144 OpenFlow 189 Type: OFPT_PACKET_IN
710 2.002241521 172.31.23.72 -> 172.31.31.144 OpenFlow 189 Type: OFPT_PACKET_IN
711 2.002243297 172.31.23.72 -> 172.31.31.144 OpenFlow 435 Type: OFPT_PACKET_IN
712 2.002244952 172.31.23.72 -> 172.31.31.144 OpenFlow 189 Type: OFPT_PACKET_IN
713 2.002366875 172.31.31.144 -> 172.31.23.72 OpenFlow 187 Type: OFPT_PACKET_OUT
714 2.002371340 172.31.31.144 -> 172.31.23.72 OpenFlow 308 Type: OFPT_PACKET_OUT
715 2.002373702 172.31.31.144 -> 172.31.23.72 TCP 66 6633 → 45438 [ACK] Seq=1033 Ack=664 Win=853 Len=0 TSval=819982 TSecr=19390107
716 2.002376750 172.31.31.144 -> 172.31.23.72 TCP 66 6633 → 45460 [ACK] Seq=1175 Ack=348 Win=853 Len=0 TSval=819982 TSecr=19390107
717 2.002383099 172.31.23.72 -> 172.31.31.144 OpenFlow 189 Type: OFPT_PACKET_IN
718 2.002389818 172.31.23.72 -> 172.31.31.144 OpenFlow 189 Type: OFPT_PACKET_IN
719 2.002464346 172.31.23.72 -> 172.31.31.144 OpenFlow 189 Type: OFPT_PACKET_IN
720 2.002498790 172.31.23.72 -> 172.31.31.144 OpenFlow 189 Type: OFPT_PACKET_IN
721 2.002554194 172.31.23.72 -> 172.31.31.144 TCP 66 45454 → 6633 [ACK] Seq=1485 Ack=2383 Win=213 Len=0 TSval=19390107 TSecr=819982
722 2.002556674 172.31.23.72 -> 172.31.31.144 OpenFlow 312 Type: OFPT_PACKET_IN
723 2.002587311 172.31.31.144 -> 172.31.23.72 OpenFlow 187 Type: OFPT_PACKET_OUT
724 2.002592084 172.31.31.144 -> 172.31.23.72 TCP 66 6633 → 45446 [ACK] Seq=1275 Ack=664 Win=853 Len=0 TSval=819982 TSecr=19390107
725 2.002594870 172.31.31.144 -> 172.31.23.72 TCP 66 6633 → 45444 [ACK] Seq=2355 Ack=950 Win=853 Len=0 TSval=819982 TSecr=19390107
726 2.002597229 172.31.31.144 -> 172.31.23.72 OpenFlow 187 Type: OFPT_PACKET_OUT
727 2.002598659 172.31.31.144 -> 172.31.23.72 TCP 66 6633 → 45456 [ACK] Seq=1801 Ack=1262 Win=853 Len=0 TSval=819982 TSecr=19390107
728 2.002600558 172.31.31.144 -> 172.31.23.72 TCP 66 6633 → 45424 [ACK] Seq=2043 Ack=1385 Win=853 Len=0 TSval=819982 TSecr=19390107
729 2.002679125 172.31.23.72 -> 172.31.31.144 OpenFlow 189 Type: OFPT_PACKET_IN
730 2.002764610 172.31.31.144 -> 172.31.23.72 TCP 66 6633 → 45438 [ACK] Seq=1033 Ack=1033 Win=853 Len=0 TSval=819982 TSecr=19390107
731 2.002770343 172.31.31.144 -> 172.31.23.72 TCP 66 6633 → 45416 [ACK] Seq=1417 Ack=963 Win=853 Len=0 TSval=819982 TSecr=19390107
732 2.002772859 172.31.31.144 -> 172.31.23.72 TCP 66 6633 → 45460 [ACK] Seq=1175 Ack=471 Win=853 Len=0 TSval=819982 TSecr=19390107
733 2.002840397 172.31.31.144 -> 172.31.23.72 TCP 66 6633 → 45462 [ACK] Seq=791 Ack=664 Win=853 Len=0 TSval=819983 TSecr=19390107
734 2.002894015 172.31.23.72 -> 172.31.31.144 TCP 66 45442 → 6633 [ACK] Seq=1155 Ack=1749 Win=213 Len=0 TSval=19390107 TSecr=819982
735 2.002925114 172.31.31.144 -> 172.31.23.72 TCP 66 6633 → 45462 [ACK] Seq=791 Ack=787 Win=853 Len=0 TSval=819983 TSecr=19390107
736 2.002957974 172.31.31.144 -> 172.31.23.72 TCP 66 6633 → 45428 [ACK] Seq=791 Ack=541 Win=853 Len=0 TSval=819983 TSecr=19390107
737 2.002962855 172.31.31.144 -> 172.31.23.72 OpenFlow 187 Type: OFPT_PACKET_OUT
738 2.002975420 172.31.31.144 -> 172.31.23.72 OpenFlow 187 Type: OFPT_PACKET_OUT
739 2.003008828 172.31.31.144 -> 172.31.23.72 TCP 66 6633 → 45430 [ACK] Seq=1275 Ack=1033 Win=853 Len=0 TSval=819983 TSecr=19390107
740 2.003041104 172.31.23.72 -> 172.31.31.144 TCP 66 45442 → 6633 [ACK] Seq=1155 Ack=1991 Win=213 Len=0 TSval=19390107 TSecr=819983
741 2.003152784 172.31.31.144 -> 172.31.23.72 TCP 66 6633 → 45446 [ACK] Seq=1275 Ack=1279 Win=853 Len=0 TSval=819983 TSecr=19390107
742 2.003193525 172.31.23.72 -> 172.31.31.144 OpenFlow 189 Type: OFPT_PACKET_IN
743 2.003205698 172.31.31.144 -> 172.31.23.72 TCP 66 6633 → 45458 [ACK] Seq=1801 Ack=1139 Win=853 Len=0 TSval=819983 TSecr=19390107
744 2.003215180 172.31.23.72 -> 172.31.31.144 OpenFlow 189 Type: OFPT_PACKET_IN
745 2.003248768 172.31.23.72 -> 172.31.31.144 OpenFlow 189 Type: OFPT_PACKET_IN
746 2.003271334 172.31.23.72 -> 172.31.31.144 OpenFlow 189 Type: OFPT_PACKET_IN
747 2.003279275 172.31.23.72 -> 172.31.31.144 OpenFlow 189 Type: OFPT_PACKET_IN
748 2.003318399 172.31.23.72 -> 172.31.31.144 OpenFlow 189 Type: OFPT_PACKET_IN
749 2.003323345 172.31.23.72 -> 172.31.31.144 OpenFlow 189 Type: OFPT_PACKET_IN
750 2.003368691 172.31.31.144 -> 172.31.23.72 TCP 66 6633 → 45452 [ACK] Seq=2383 Ack=1485 Win=853 Len=0 TSval=819983 TSecr=19390107
751 2.003404493 172.31.23.72 -> 172.31.31.144 OpenFlow 189 Type: OFPT_PACKET_IN
752 2.003518441 172.31.31.144 -> 172.31.23.72 TCP 66 6633 → 45460 [ACK] Seq=1175 Ack=594 Win=853 Len=0 TSval=819983 TSecr=19390107
753 2.003559000 172.31.31.144 -> 172.31.23.72 TCP 66 6633 → 45460 [ACK] Seq=1175 Ack=717 Win=853 Len=0 TSval=819983 TSecr=19390107
754 2.003702739 172.31.31.144 -> 172.31.23.72 TCP 66 6633 → 45434 [ACK] Seq=2043 Ack=1631 Win=853 Len=0 TSval=819983 TSecr=19390107
755 2.004132778 172.31.31.144 -> 172.31.23.72 TCP 66 6633 → 45444 [ACK] Seq=2355 Ack=1319 Win=853 Len=0 TSval=819983 TSecr=19390107
756 2.040132272 172.31.23.72 -> 172.31.31.144 TCP 66 45448 → 6633 [ACK] Seq=787 Ack=791 Win=213 Len=0 TSval=19390117 TSecr=819982
757 2.042816653 172.31.31.144 -> 172.31.23.72 TCP 66 6633 → 45456 [ACK] Seq=1801 Ack=1385 Win=853 Len=0 TSval=819993 TSecr=19390107
758 2.087007241 172.31.31.144 -> 172.31.23.72 OpenFlow 90 Type: OFPT_MULTIPART_REQUEST, OFPMP_PORT_STATS
759 2.087323257 172.31.23.72 -> 172.31.31.144 OpenFlow 530 Type: OFPT_MULTIPART_REPLY, OFPMP_PORT_STATS
760 2.087593501 172.31.31.144 -> 172.31.23.72 TCP 66 6633 → 45414 [ACK] Seq=1199 Ack=1181 Win=853 Len=0 TSval=820004 TSecr=19390128
761 2.088219561 172.31.31.144 -> 172.31.23.72 OpenFlow 122 Type: OFPT_MULTIPART_REQUEST, OFPMP_FLOW
762 2.088248899 172.31.31.144 -> 172.31.23.72 OpenFlow 82 Type: OFPT_MULTIPART_REQUEST, OFPMP_TABLE
763 2.088451110 172.31.23.72 -> 172.31.31.144 OpenFlow 2010 Type: OFPT_MULTIPART_REPLY, OFPMP_FLOW
764 2.088630760 172.31.23.72 -> 172.31.31.144 OpenFlow 6178 Type: OFPT_MULTIPART_REPLY, OFPMP_TABLE
765 2.088846274 172.31.31.144 -> 172.31.23.72 TCP 66 6633 → 45414 [ACK] Seq=1271 Ack=9237 Win=853 Len=0 TSval=820004 TSecr=19390129
766 2.098384776 172.31.31.144 -> 172.31.23.72 OpenFlow 187 Type: OFPT_PACKET_OUT
767 2.098395718 172.31.31.144 -> 172.31.23.72 OpenFlow 187 Type: OFPT_PACKET_OUT
768 2.098456449 172.31.31.144 -> 172.31.23.72 OpenFlow 187 Type: OFPT_PACKET_OUT
769 2.098530586 172.31.31.144 -> 172.31.23.72 OpenFlow 187 Type: OFPT_PACKET_OUT
770 2.098588756 172.31.31.144 -> 172.31.23.72 OpenFlow 187 Type: OFPT_PACKET_OUT
771 2.098644992 172.31.31.144 -> 172.31.23.72 OpenFlow 187 Type: OFPT_PACKET_OUT
772 2.098708348 172.31.31.144 -> 172.31.23.72 OpenFlow 187 Type: OFPT_PACKET_OUT
773 2.098825436 172.31.31.144 -> 172.31.23.72 OpenFlow 187 Type: OFPT_PACKET_OUT
774 2.098891143 172.31.31.144 -> 172.31.23.72 OpenFlow 187 Type: OFPT_PACKET_OUT
775 2.098955871 172.31.31.144 -> 172.31.23.72 OpenFlow 187 Type: OFPT_PACKET_OUT
776 2.099038472 172.31.23.72 -> 172.31.31.144 TCP 66 45426 → 6633 [ACK] Seq=1033 Ack=1275 Win=213 Len=0 TSval=19390131 TSecr=820006
777 2.099092761 172.31.31.144 -> 172.31.23.72 OpenFlow 187 Type: OFPT_PACKET_OUT
778 2.099103787 172.31.31.144 -> 172.31.23.72 OpenFlow 187 Type: OFPT_PACKET_OUT
779 2.099125769 172.31.23.72 -> 172.31.31.144 OpenFlow 189 Type: OFPT_PACKET_IN
780 2.099152173 172.31.23.72 -> 172.31.31.144 OpenFlow 189 Type: OFPT_PACKET_IN
781 2.099189857 172.31.31.144 -> 172.31.23.72 OpenFlow 187 Type: OFPT_PACKET_OUT
782 2.099223990 172.31.31.144 -> 172.31.23.72 OpenFlow 187 Type: OFPT_PACKET_OUT
783 2.099275258 172.31.31.144 -> 172.31.23.72 OpenFlow 187 Type: OFPT_PACKET_OUT
784 2.099329197 172.31.31.144 -> 172.31.23.72 OpenFlow 187 Type: OFPT_PACKET_OUT
785 2.099419182 172.31.23.72 -> 172.31.31.144 TCP 66 45422 → 6633 [ACK] Seq=787 Ack=791 Win=213 Len=0 TSval=19390131 TSecr=820007
786 2.099567185 172.31.23.72 -> 172.31.31.144 OpenFlow 189 Type: OFPT_PACKET_IN
787 2.099593748 172.31.23.72 -> 172.31.31.144 OpenFlow 189 Type: OFPT_PACKET_IN
788 2.099601649 172.31.23.72 -> 172.31.31.144 OpenFlow 189 Type: OFPT_PACKET_IN
789 2.099615409 172.31.23.72 -> 172.31.31.144 OpenFlow 189 Type: OFPT_PACKET_IN
790 2.099642358 172.31.23.72 -> 172.31.31.144 OpenFlow 189 Type: OFPT_PACKET_IN
791 2.099659179 172.31.23.72 -> 172.31.31.144 OpenFlow 189 Type: OFPT_PACKET_IN
792 2.099661435 172.31.23.72 -> 172.31.31.144 OpenFlow 189 Type: OFPT_PACKET_IN
793 2.099711215 172.31.23.72 -> 172.31.31.144 OpenFlow 189 Type: OFPT_PACKET_IN
794 2.099716751 172.31.23.72 -> 172.31.31.144 OpenFlow 435 Type: OFPT_PACKET_IN
795 2.099718530 172.31.23.72 -> 172.31.31.144 OpenFlow 189 Type: OFPT_PACKET_IN
796 2.099804085 172.31.31.144 -> 172.31.23.72 TCP 66 6633 → 45420 [ACK] Seq=1033 Ack=664 Win=853 Len=0 TSval=820007 TSecr=19390131
797 2.099810257 172.31.31.144 -> 172.31.23.72 TCP 66 6633 → 45420 [ACK] Seq=1033 Ack=787 Win=853 Len=0 TSval=820007 TSecr=19390131
798 2.099815146 172.31.23.72 -> 172.31.31.144 OpenFlow 189 Type: OFPT_PACKET_IN
799 2.099821087 172.31.23.72 -> 172.31.31.144 OpenFlow 189 Type: OFPT_PACKET_IN
800 2.099991545 172.31.31.144 -> 172.31.23.72 TCP 66 6633 → 45426 [ACK] Seq=1275 Ack=1156 Win=853 Len=0 TSval=820007 TSecr=19390131
801 2.100090028 172.31.31.144 -> 172.31.23.72 TCP 66 6633 → 45430 [ACK] Seq=1275 Ack=1279 Win=853 Len=0 TSval=820007 TSecr=19390131
802 2.100112308 172.31.31.144 -> 172.31.23.72 TCP 66 6633 → 45428 [ACK] Seq=791 Ack=787 Win=853 Len=0 TSval=820007 TSecr=19390131
803 2.100155265 172.31.31.144 -> 172.31.23.72 TCP 66 6633 → 45424 [ACK] Seq=2043 Ack=1631 Win=853 Len=0 TSval=820007 TSecr=19390131
804 2.100219134 172.31.31.144 -> 172.31.23.72 TCP 66 6633 → 45426 [ACK] Seq=1275 Ack=1279 Win=853 Len=0 TSval=820007 TSecr=19390131
805 2.100238143 172.31.31.144 -> 172.31.23.72 TCP 66 6633 → 45418 [ACK] Seq=1275 Ack=1033 Win=853 Len=0 TSval=820007 TSecr=19390131
806 2.137354120 172.31.31.144 -> 172.31.23.72 OpenFlow 82 Type: OFPT_MULTIPART_REQUEST, OFPMP_TABLE
807 2.137383176 172.31.31.144 -> 172.31.23.72 OpenFlow 146 Type: OFPT_MULTIPART_REQUEST, OFPMP_FLOW
808 2.137751902 172.31.23.72 -> 172.31.31.144 OpenFlow 6178 Type: OFPT_MULTIPART_REPLY, OFPMP_TABLE
809 2.137868163 172.31.23.72 -> 172.31.31.144 OpenFlow 642 Type: OFPT_MULTIPART_REPLY, OFPMP_PORT_STATS
810 2.137950010 172.31.23.72 -> 172.31.31.144 OpenFlow 2634 Type: OFPT_MULTIPART_REPLY, OFPMP_FLOW
811 2.138143335 172.31.31.144 -> 172.31.23.72 TCP 66 6633 → 45416 [ACK] Seq=1513 Ack=10219 Win=853 Len=0 TSval=820016 TSecr=19390141
812 2.170693723 172.31.31.144 -> 172.31.23.72 OpenFlow 82 Type: OFPT_MULTIPART_REQUEST, OFPMP_TABLE
813 2.170727508 172.31.31.144 -> 172.31.23.72 OpenFlow 146 Type: OFPT_MULTIPART_REQUEST, OFPMP_FLOW
814 2.170993191 172.31.23.72 -> 172.31.31.144 OpenFlow 6178 Type: OFPT_MULTIPART_REPLY, OFPMP_TABLE
815 2.171110369 172.31.23.72 -> 172.31.31.144 OpenFlow 754 Type: OFPT_MULTIPART_REPLY, OFPMP_PORT_STATS
816 2.171181549 172.31.23.72 -> 172.31.31.144 OpenFlow 2426 Type: OFPT_MULTIPART_REPLY, OFPMP_FLOW
817 2.171340742 172.31.31.144 -> 172.31.23.72 TCP 66 6633 → 45418 [ACK] Seq=1371 Ack=7833 Win=853 Len=0 TSval=820025 TSecr=19390149
818 2.196924092 172.31.31.144 -> 172.31.23.72 OpenFlow 90 Type: OFPT_MULTIPART_REQUEST, OFPMP_PORT_STATS
819 2.196959153 172.31.31.144 -> 172.31.23.72 OpenFlow 138 Type: OFPT_MULTIPART_REQUEST, OFPMP_TABLE
820 2.197124469 172.31.23.72 -> 172.31.31.144 OpenFlow 642 Type: OFPT_MULTIPART_REPLY, OFPMP_PORT_STATS
821 2.197196543 172.31.23.72 -> 172.31.31.144 OpenFlow 2010 Type: OFPT_MULTIPART_REPLY, OFPMP_FLOW
822 2.197358593 172.31.23.72 -> 172.31.31.144 OpenFlow 6178 Type: OFPT_MULTIPART_REPLY, OFPMP_TABLE
823 2.197440529 172.31.31.144 -> 172.31.23.72 TCP 66 6633 → 45420 [ACK] Seq=1129 Ack=3307 Win=853 Len=0 TSval=820031 TSecr=19390156
824 2.197610219 172.31.31.144 -> 172.31.23.72 TCP 66 6633 → 45420 [ACK] Seq=1129 Ack=9419 Win=853 Len=0 TSval=820031 TSecr=19390156
825 2.207646889 172.31.23.72 -> 172.31.0.2   DNS 102 Standard query 0xd08d A ip-172-31-23-72.eu-west-1.compute.internal
826 2.207658055 172.31.23.72 -> 172.31.0.2   DNS 102 Standard query 0x97e3 AAAA ip-172-31-23-72.eu-west-1.compute.internal
