  1 0.000000000 172.31.31.144 -> 172.31.23.72 TCP 90 6633 → 45508 [PSH, ACK] Seq=1 Ack=1 Win=853 Len=24 TSval=1223434 TSecr=30044680
  2 0.000029955 172.31.31.144 -> 172.31.23.72 TCP 138 6633 → 45508 [PSH, ACK] Seq=25 Ack=1 Win=853 Len=72 TSval=1223434 TSecr=30044680
  3 0.000400207 172.31.23.72 -> 172.31.31.144 OpenFlow 530 Type: OFPT_MULTIPART_REPLY, OFPMP_PORT_STATS
  4 0.000578968 172.31.23.72 -> 172.31.31.144 OpenFlow 6178 Type: OFPT_MULTIPART_REPLY, OFPMP_TABLE
  5 0.000954037 172.31.23.72 -> 172.31.31.144 OpenFlow 2010 Type: OFPT_MULTIPART_REPLY, OFPMP_FLOW
  6 0.002469981 172.31.31.144 -> 172.31.23.72 TCP 66 6633 → 45508 [ACK] Seq=97 Ack=6577 Win=853 Len=0 TSval=1223435 TSecr=30045026
  7 0.038282769 172.31.31.144 -> 172.31.23.72 TCP 66 6633 → 45508 [ACK] Seq=97 Ack=8521 Win=853 Len=0 TSval=1223445 TSecr=30045026
  8 0.077655350 172.31.31.144 -> 172.31.23.72 TCP 90 6633 → 45510 [PSH, ACK] Seq=1 Ack=1 Win=853 Len=24 TSval=1223454 TSecr=30044680
  9 0.078003973 172.31.23.72 -> 172.31.31.144 OpenFlow 642 Type: OFPT_MULTIPART_REPLY, OFPMP_PORT_STATS
 10 0.078482963 172.31.31.144 -> 172.31.23.72 OpenFlow 82 Type: OFPT_MULTIPART_REQUEST, OFPMP_TABLE
 11 0.078490768 172.31.31.144 -> 172.31.23.72 OpenFlow 122 Type: OFPT_MULTIPART_REQUEST, OFPMP_FLOW
 12 0.078757825 172.31.23.72 -> 172.31.31.144 OpenFlow 6178 Type: OFPT_MULTIPART_REPLY, OFPMP_TABLE
 13 0.081007959 172.31.23.72 -> 172.31.31.144 OpenFlow 2634 Type: OFPT_MULTIPART_REPLY, OFPMP_FLOW
 14 0.081370222 172.31.31.144 -> 172.31.23.72 TCP 66 6633 → 45510 [ACK] Seq=97 Ack=6689 Win=853 Len=0 TSval=1223455 TSecr=30045046
 15 0.084692419 172.31.31.144 -> 172.31.23.72 TCP 90 6633 → 45512 [PSH, ACK] Seq=1 Ack=1 Win=853 Len=24 TSval=1223456 TSecr=30044680
 16 0.084699209 172.31.31.144 -> 172.31.23.72 TCP 138 6633 → 45512 [PSH, ACK] Seq=25 Ack=1 Win=853 Len=72 TSval=1223456 TSecr=30044680
 17 0.084866412 172.31.23.72 -> 172.31.31.144 OpenFlow 754 Type: OFPT_MULTIPART_REPLY, OFPMP_PORT_STATS
 18 0.084947537 172.31.23.72 -> 172.31.31.144 OpenFlow 2842 Type: OFPT_MULTIPART_REPLY, OFPMP_FLOW
 19 0.085084941 172.31.23.72 -> 172.31.31.144 OpenFlow 6178 Type: OFPT_MULTIPART_REPLY, OFPMP_TABLE
 20 0.087018004 172.31.31.144 -> 172.31.23.72 TCP 66 6633 → 45512 [ACK] Seq=97 Ack=3465 Win=853 Len=0 TSval=1223457 TSecr=30045047
 21 0.117548467 172.31.31.144 -> 172.31.23.72 TCP 90 6633 → 45514 [PSH, ACK] Seq=1 Ack=1 Win=853 Len=24 TSval=1223464 TSecr=30044680
 22 0.117558472 172.31.31.144 -> 172.31.23.72 TCP 138 6633 → 45514 [PSH, ACK] Seq=25 Ack=1 Win=853 Len=72 TSval=1223464 TSecr=30044680
 23 0.117714691 172.31.23.72 -> 172.31.31.144 OpenFlow 642 Type: OFPT_MULTIPART_REPLY, OFPMP_PORT_STATS
 24 0.117783233 172.31.23.72 -> 172.31.31.144 OpenFlow 2010 Type: OFPT_MULTIPART_REPLY, OFPMP_FLOW
 25 0.117958309 172.31.23.72 -> 172.31.31.144 OpenFlow 6178 Type: OFPT_MULTIPART_REPLY, OFPMP_TABLE
 26 0.118030382 172.31.31.144 -> 172.31.23.72 TCP 66 6633 → 45514 [ACK] Seq=97 Ack=2521 Win=853 Len=0 TSval=1223464 TSecr=30045056
 27 0.118238962 172.31.31.144 -> 172.31.23.72 TCP 66 6633 → 45510 [ACK] Seq=97 Ack=9257 Win=853 Len=0 TSval=1223465 TSecr=30045046
 28 0.126581387 172.31.31.144 -> 172.31.23.72 TCP 66 6633 → 45512 [ACK] Seq=97 Ack=9577 Win=853 Len=0 TSval=1223467 TSecr=30045047
 29 0.157450545 172.31.31.144 -> 172.31.23.72 TCP 122 6633 → 45516 [PSH, ACK] Seq=1 Ack=1 Win=853 Len=56 TSval=1223474 TSecr=30044680
 30 0.157482726 172.31.31.144 -> 172.31.23.72 TCP 106 6633 → 45516 [PSH, ACK] Seq=57 Ack=1 Win=853 Len=40 TSval=1223474 TSecr=30044680
 31 0.157816480 172.31.23.72 -> 172.31.31.144 OpenFlow 554 Type: OFPT_MULTIPART_REPLY, OFPMP_FLOW
 32 0.157997984 172.31.31.144 -> 172.31.23.72 TCP 66 6633 → 45516 [ACK] Seq=97 Ack=489 Win=853 Len=0 TSval=1223474 TSecr=30045066
 33 0.158016484 172.31.23.72 -> 172.31.31.144 OpenFlow 6178 Type: OFPT_MULTIPART_REPLY, OFPMP_TABLE
 34 0.158111200 172.31.23.72 -> 172.31.31.144 OpenFlow 530 Type: OFPT_MULTIPART_REPLY, OFPMP_PORT_STATS
 35 0.158287310 172.31.31.144 -> 172.31.23.72 TCP 66 6633 → 45514 [ACK] Seq=97 Ack=8633 Win=853 Len=0 TSval=1223475 TSecr=30045056
 36 0.158294015 172.31.31.144 -> 172.31.23.72 TCP 66 6633 → 45516 [ACK] Seq=97 Ack=6601 Win=853 Len=0 TSval=1223475 TSecr=30045066
 37 0.158296349 172.31.31.144 -> 172.31.23.72 TCP 66 6633 → 45516 [ACK] Seq=97 Ack=7065 Win=853 Len=0 TSval=1223475 TSecr=30045066
 38 0.200824737 172.31.31.144 -> 172.31.23.72 TCP 82 6633 → 45518 [PSH, ACK] Seq=1 Ack=1 Win=853 Len=16 TSval=1223485 TSecr=30044680
 39 0.200851016 172.31.31.144 -> 172.31.23.72 TCP 146 6633 → 45518 [PSH, ACK] Seq=17 Ack=1 Win=853 Len=80 TSval=1223485 TSecr=30044680
 40 0.201240298 172.31.23.72 -> 172.31.31.144 OpenFlow 6178 Type: OFPT_MULTIPART_REPLY, OFPMP_TABLE
 41 0.201616807 172.31.23.72 -> 172.31.31.144 OpenFlow 3530 Type: OFPT_MULTIPART_REPLY, OFPMP_FLOW
 42 0.202613383 172.31.31.144 -> 172.31.23.72 TCP 66 6633 → 45518 [ACK] Seq=97 Ack=6113 Win=853 Len=0 TSval=1223485 TSecr=30045077
 43 0.204235976 172.31.31.144 -> 172.31.23.72 TCP 66 6633 → 45518 [ACK] Seq=97 Ack=9577 Win=853 Len=0 TSval=1223486 TSecr=30045077
 44 0.244685886 172.31.31.144 -> 172.31.23.72 TCP 122 6633 → 45520 [PSH, ACK] Seq=1 Ack=1 Win=853 Len=56 TSval=1223496 TSecr=30044680
 45 0.244706890 172.31.31.144 -> 172.31.23.72 TCP 106 6633 → 45520 [PSH, ACK] Seq=57 Ack=1 Win=853 Len=40 TSval=1223496 TSecr=30044680
 46 0.245037534 172.31.23.72 -> 172.31.31.144 OpenFlow 1802 Type: OFPT_MULTIPART_REPLY, OFPMP_FLOW
 47 0.245227423 172.31.23.72 -> 172.31.31.144 OpenFlow 6178 Type: OFPT_MULTIPART_REPLY, OFPMP_TABLE
 48 0.245796281 172.31.23.72 -> 172.31.31.144 OpenFlow 754 Type: OFPT_MULTIPART_REPLY, OFPMP_PORT_STATS
 49 0.247910540 172.31.31.144 -> 172.31.23.72 TCP 66 6633 → 45520 [ACK] Seq=97 Ack=7849 Win=853 Len=0 TSval=1223496 TSecr=30045087
 50 0.281106829 172.31.31.144 -> 172.31.23.72 TCP 90 6633 → 45522 [PSH, ACK] Seq=1 Ack=1 Win=853 Len=24 TSval=1223505 TSecr=30044681
 51 0.281126685 172.31.31.144 -> 172.31.23.72 TCP 138 6633 → 45522 [PSH, ACK] Seq=25 Ack=1 Win=853 Len=72 TSval=1223505 TSecr=30044681
 52 0.281424210 172.31.23.72 -> 172.31.31.144 OpenFlow 530 Type: OFPT_MULTIPART_REPLY, OFPMP_PORT_STATS
 53 0.281606776 172.31.31.144 -> 172.31.23.72 TCP 66 6633 → 45522 [ACK] Seq=97 Ack=465 Win=853 Len=0 TSval=1223505 TSecr=30045097
 54 0.281629617 172.31.23.72 -> 172.31.31.144 OpenFlow 6178 Type: OFPT_MULTIPART_REPLY, OFPMP_TABLE
 55 0.281681279 172.31.23.72 -> 172.31.31.144 OpenFlow 762 Type: OFPT_MULTIPART_REPLY, OFPMP_FLOW
 56 0.281886048 172.31.31.144 -> 172.31.23.72 TCP 66 6633 → 45522 [ACK] Seq=97 Ack=6577 Win=853 Len=0 TSval=1223505 TSecr=30045097
 57 0.281892474 172.31.31.144 -> 172.31.23.72 TCP 66 6633 → 45522 [ACK] Seq=97 Ack=7273 Win=853 Len=0 TSval=1223505 TSecr=30045097
 58 0.286286177 172.31.31.144 -> 172.31.23.72 TCP 66 6633 → 45520 [ACK] Seq=97 Ack=8537 Win=853 Len=0 TSval=1223507 TSecr=30045088
 59 0.328885140 172.31.31.144 -> 172.31.23.72 TCP 90 6633 → 45524 [PSH, ACK] Seq=1 Ack=1 Win=853 Len=24 TSval=1223516 TSecr=30044681
 60 0.328901194 172.31.31.144 -> 172.31.23.72 TCP 138 6633 → 45524 [PSH, ACK] Seq=25 Ack=1 Win=853 Len=72 TSval=1223516 TSecr=30044681
 61 0.329213657 172.31.23.72 -> 172.31.31.144 OpenFlow 754 Type: OFPT_MULTIPART_REPLY, OFPMP_PORT_STATS
 62 0.329278224 172.31.23.72 -> 172.31.31.144 OpenFlow 1802 Type: OFPT_MULTIPART_REPLY, OFPMP_FLOW
 63 0.329430972 172.31.23.72 -> 172.31.31.144 OpenFlow 6178 Type: OFPT_MULTIPART_REPLY, OFPMP_TABLE
 64 0.332337204 172.31.31.144 -> 172.31.23.72 TCP 66 6633 → 45524 [ACK] Seq=97 Ack=689 Win=853 Len=0 TSval=1223518 TSecr=30045109
 65 0.332344524 172.31.31.144 -> 172.31.23.72 TCP 66 6633 → 45524 [ACK] Seq=97 Ack=2425 Win=853 Len=0 TSval=1223518 TSecr=30045109
 66 0.332346547 172.31.31.144 -> 172.31.23.72 TCP 66 6633 → 45524 [ACK] Seq=97 Ack=8537 Win=853 Len=0 TSval=1223518 TSecr=30045109
 67 0.366669844 172.31.31.144 -> 172.31.23.72 TCP 90 6633 → 45526 [PSH, ACK] Seq=1 Ack=1 Win=853 Len=24 TSval=1223527 TSecr=30044655
 68 0.366681718 172.31.31.144 -> 172.31.23.72 TCP 138 6633 → 45526 [PSH, ACK] Seq=25 Ack=1 Win=853 Len=72 TSval=1223527 TSecr=30044655
 69 0.366913427 172.31.23.72 -> 172.31.31.144 OpenFlow 642 Type: OFPT_MULTIPART_REPLY, OFPMP_PORT_STATS
 70 0.367073155 172.31.23.72 -> 172.31.31.144 OpenFlow 6178 Type: OFPT_MULTIPART_REPLY, OFPMP_TABLE
 71 0.367618929 172.31.23.72 -> 172.31.31.144 OpenFlow 1178 Type: OFPT_MULTIPART_REPLY, OFPMP_FLOW
 72 0.367731406 172.31.31.144 -> 172.31.23.72 TCP 66 6633 → 45526 [ACK] Seq=97 Ack=577 Win=853 Len=0 TSval=1223527 TSecr=30045118
 73 0.367852212 172.31.31.144 -> 172.31.23.72 TCP 66 6633 → 45526 [ACK] Seq=97 Ack=6689 Win=853 Len=0 TSval=1223527 TSecr=30045118
 74 0.367887144 172.31.31.144 -> 172.31.23.72 TCP 66 6633 → 45526 [ACK] Seq=97 Ack=7801 Win=853 Len=0 TSval=1223527 TSecr=30045118
 75 0.428680835 172.31.31.144 -> 172.31.23.72 TCP 122 6633 → 45528 [PSH, ACK] Seq=1 Ack=1 Win=853 Len=56 TSval=1223542 TSecr=30044680
 76 0.428707359 172.31.31.144 -> 172.31.23.72 TCP 106 6633 → 45528 [PSH, ACK] Seq=57 Ack=1 Win=853 Len=40 TSval=1223542 TSecr=30044680
 77 0.429024065 172.31.23.72 -> 172.31.31.144 OpenFlow 3882 Type: OFPT_MULTIPART_REPLY, OFPMP_FLOW
 78 0.429221669 172.31.23.72 -> 172.31.31.144 OpenFlow 6178 Type: OFPT_MULTIPART_REPLY, OFPMP_TABLE
 79 0.429267874 172.31.31.144 -> 172.31.23.72 TCP 66 6633 → 45528 [ACK] Seq=97 Ack=3817 Win=853 Len=0 TSval=1223542 TSecr=30045133
 80 0.429356696 172.31.23.72 -> 172.31.31.144 OpenFlow 754 Type: OFPT_MULTIPART_REPLY, OFPMP_PORT_STATS
 81 0.429501789 172.31.31.144 -> 172.31.23.72 TCP 66 6633 → 45528 [ACK] Seq=97 Ack=9929 Win=853 Len=0 TSval=1223542 TSecr=30045134
 82 0.429582020 172.31.31.144 -> 172.31.23.72 TCP 66 6633 → 45528 [ACK] Seq=97 Ack=10617 Win=853 Len=0 TSval=1223542 TSecr=30045134
 83 0.465341653 172.31.31.144 -> 172.31.23.72 TCP 82 6633 → 45530 [PSH, ACK] Seq=1 Ack=1 Win=853 Len=16 TSval=1223551 TSecr=30044655
 84 0.465361004 172.31.31.144 -> 172.31.23.72 TCP 146 6633 → 45530 [PSH, ACK] Seq=17 Ack=1 Win=853 Len=80 TSval=1223551 TSecr=30044655
 85 0.465688258 172.31.23.72 -> 172.31.31.144 OpenFlow 6178 Type: OFPT_MULTIPART_REPLY, OFPMP_TABLE
 86 0.466077738 172.31.23.72 -> 172.31.31.144 OpenFlow 2794 Type: OFPT_MULTIPART_REPLY, OFPMP_PORT_STATS
 87 0.467256201 172.31.31.144 -> 172.31.23.72 TCP 66 6633 → 45530 [ACK] Seq=97 Ack=6113 Win=853 Len=0 TSval=1223552 TSecr=30045143
 88 0.468298898 172.31.31.144 -> 172.31.23.72 TCP 66 6633 → 45530 [ACK] Seq=97 Ack=8841 Win=853 Len=0 TSval=1223552 TSecr=30045143
 89 0.539934635 172.31.31.144 -> 172.31.23.72 TCP 90 6633 → 45532 [PSH, ACK] Seq=1 Ack=1 Win=853 Len=24 TSval=1223570 TSecr=30044655
 90 0.540171854 172.31.23.72 -> 172.31.31.144 OpenFlow 642 Type: OFPT_MULTIPART_REPLY, OFPMP_PORT_STATS
 91 0.540408388 172.31.31.144 -> 172.31.23.72 TCP 66 6633 → 45532 [ACK] Seq=25 Ack=577 Win=853 Len=0 TSval=1223570 TSecr=30045161
 92 0.541093881 172.31.31.144 -> 172.31.23.72 OpenFlow 82 Type: OFPT_MULTIPART_REQUEST, OFPMP_TABLE
 93 0.541098000 172.31.31.144 -> 172.31.23.72 OpenFlow 122 Type: OFPT_MULTIPART_REQUEST, OFPMP_FLOW
 94 0.541376800 172.31.23.72 -> 172.31.31.144 OpenFlow 6178 Type: OFPT_MULTIPART_REPLY, OFPMP_TABLE
 95 0.541453948 172.31.23.72 -> 172.31.31.144 OpenFlow 1594 Type: OFPT_MULTIPART_REPLY, OFPMP_FLOW
 96 0.541742052 172.31.31.144 -> 172.31.23.72 TCP 66 6633 → 45532 [ACK] Seq=97 Ack=8217 Win=853 Len=0 TSval=1223570 TSecr=30045162
 97 0.585230716 172.31.31.144 -> 172.31.23.72 TCP 90 6633 → 45534 [PSH, ACK] Seq=1 Ack=1 Win=853 Len=24 TSval=1223581 TSecr=30044680
 98 0.585244520 172.31.31.144 -> 172.31.23.72 TCP 122 6633 → 45534 [PSH, ACK] Seq=25 Ack=1 Win=853 Len=56 TSval=1223581 TSecr=30044680
 99 0.585425800 172.31.23.72 -> 172.31.31.144 OpenFlow 530 Type: OFPT_MULTIPART_REPLY, OFPMP_PORT_STATS
100 0.585474643 172.31.23.72 -> 172.31.31.144 OpenFlow 346 Type: OFPT_MULTIPART_REPLY, OFPMP_FLOW
101 0.585733369 172.31.31.144 -> 172.31.23.72 TCP 66 6633 → 45534 [ACK] Seq=81 Ack=465 Win=853 Len=0 TSval=1223581 TSecr=30045173
102 0.585739624 172.31.31.144 -> 172.31.23.72 TCP 66 6633 → 45534 [ACK] Seq=81 Ack=745 Win=853 Len=0 TSval=1223581 TSecr=30045173
103 0.586341691 172.31.31.144 -> 172.31.23.72 OpenFlow 82 Type: OFPT_MULTIPART_REQUEST, OFPMP_TABLE
104 0.586558544 172.31.23.72 -> 172.31.31.144 OpenFlow 6178 Type: OFPT_MULTIPART_REPLY, OFPMP_TABLE
105 0.626532060 172.31.31.144 -> 172.31.23.72 TCP 66 6633 → 45534 [ACK] Seq=97 Ack=6857 Win=853 Len=0 TSval=1223592 TSecr=30045173
106 0.636608600 172.31.31.144 -> 172.31.23.72 TCP 122 6633 → 45536 [PSH, ACK] Seq=1 Ack=1 Win=853 Len=56 TSval=1223594 TSecr=30044680
107 0.636625758 172.31.31.144 -> 172.31.23.72 TCP 106 6633 → 45536 [PSH, ACK] Seq=57 Ack=1 Win=853 Len=40 TSval=1223594 TSecr=30044680
108 0.636958657 172.31.23.72 -> 172.31.31.144 OpenFlow 1802 Type: OFPT_MULTIPART_REPLY, OFPMP_FLOW
109 0.637061188 172.31.23.72 -> 172.31.31.144 OpenFlow 530 Type: OFPT_MULTIPART_REPLY, OFPMP_PORT_STATS
110 0.637266767 172.31.23.72 -> 172.31.31.144 OpenFlow 6178 Type: OFPT_MULTIPART_REPLY, OFPMP_TABLE
111 0.637445104 172.31.31.144 -> 172.31.23.72 TCP 66 6633 → 45536 [ACK] Seq=97 Ack=2201 Win=853 Len=0 TSval=1223594 TSecr=30045185
112 0.674290128 172.31.31.144 -> 172.31.23.72 TCP 66 6633 → 45536 [ACK] Seq=97 Ack=8313 Win=853 Len=0 TSval=1223604 TSecr=30045186
113 0.683728472 172.31.31.144 -> 172.31.23.72 TCP 90 6633 → 45538 [PSH, ACK] Seq=1 Ack=1 Win=853 Len=24 TSval=1223606 TSecr=30044681
114 0.683736857 172.31.31.144 -> 172.31.23.72 TCP 138 6633 → 45538 [PSH, ACK] Seq=25 Ack=1 Win=853 Len=72 TSval=1223606 TSecr=30044681
115 0.683996549 172.31.23.72 -> 172.31.31.144 OpenFlow 754 Type: OFPT_MULTIPART_REPLY, OFPMP_PORT_STATS
116 0.684166347 172.31.23.72 -> 172.31.31.144 OpenFlow 6178 Type: OFPT_MULTIPART_REPLY, OFPMP_TABLE
117 0.684221653 172.31.31.144 -> 172.31.23.72 TCP 66 6633 → 45538 [ACK] Seq=97 Ack=689 Win=853 Len=0 TSval=1223606 TSecr=30045197
118 0.684243203 172.31.23.72 -> 172.31.31.144 OpenFlow 2010 Type: OFPT_MULTIPART_REPLY, OFPMP_FLOW
119 0.684504564 172.31.31.144 -> 172.31.23.72 TCP 66 6633 → 45538 [ACK] Seq=97 Ack=6801 Win=853 Len=0 TSval=1223606 TSecr=30045197
120 0.684510265 172.31.31.144 -> 172.31.23.72 TCP 66 6633 → 45538 [ACK] Seq=97 Ack=8745 Win=853 Len=0 TSval=1223606 TSecr=30045197
121 0.734362889 172.31.31.144 -> 172.31.23.72 TCP 90 6633 → 45540 [PSH, ACK] Seq=1 Ack=1 Win=853 Len=24 TSval=1223618 TSecr=30044681
122 0.734760421 172.31.23.72 -> 172.31.31.144 OpenFlow 754 Type: OFPT_MULTIPART_REPLY, OFPMP_PORT_STATS
123 0.734976874 172.31.31.144 -> 172.31.23.72 OpenFlow 122 Type: OFPT_MULTIPART_REQUEST, OFPMP_FLOW
124 0.734983742 172.31.31.144 -> 172.31.23.72 OpenFlow 82 Type: OFPT_MULTIPART_REQUEST, OFPMP_TABLE
125 0.735150608 172.31.23.72 -> 172.31.31.144 OpenFlow 1802 Type: OFPT_MULTIPART_REPLY, OFPMP_FLOW
126 0.735264593 172.31.31.144 -> 172.31.23.72 TCP 66 6633 → 45540 [ACK] Seq=97 Ack=689 Win=853 Len=0 TSval=1223619 TSecr=30045210
127 0.735335891 172.31.23.72 -> 172.31.31.144 OpenFlow 6178 Type: OFPT_MULTIPART_REPLY, OFPMP_TABLE
128 0.735578243 172.31.31.144 -> 172.31.23.72 TCP 66 6633 → 45540 [ACK] Seq=97 Ack=2425 Win=853 Len=0 TSval=1223619 TSecr=30045210
129 0.735726297 172.31.31.144 -> 172.31.23.72 TCP 66 6633 → 45540 [ACK] Seq=97 Ack=8537 Win=853 Len=0 TSval=1223619 TSecr=30045210
130 0.785154293 172.31.31.144 -> 172.31.23.72 TCP 122 6633 → 45542 [PSH, ACK] Seq=1 Ack=1 Win=853 Len=56 TSval=1223631 TSecr=30044680
131 0.785174652 172.31.31.144 -> 172.31.23.72 TCP 106 6633 → 45542 [PSH, ACK] Seq=57 Ack=1 Win=853 Len=40 TSval=1223631 TSecr=30044680
132 0.785373154 172.31.23.72 -> 172.31.31.144 OpenFlow 346 Type: OFPT_MULTIPART_REPLY, OFPMP_FLOW
133 0.785444787 172.31.23.72 -> 172.31.31.144 OpenFlow 530 Type: OFPT_MULTIPART_REPLY, OFPMP_PORT_STATS
134 0.785579701 172.31.31.144 -> 172.31.23.72 TCP 66 6633 → 45542 [ACK] Seq=97 Ack=281 Win=853 Len=0 TSval=1223631 TSecr=30045223
135 0.785602322 172.31.23.72 -> 172.31.31.144 OpenFlow 6178 Type: OFPT_MULTIPART_REPLY, OFPMP_TABLE
136 0.785656430 172.31.31.144 -> 172.31.23.72 TCP 66 6633 → 45542 [ACK] Seq=97 Ack=745 Win=853 Len=0 TSval=1223631 TSecr=30045223
137 0.785889457 172.31.31.144 -> 172.31.23.72 TCP 66 6633 → 45542 [ACK] Seq=97 Ack=6857 Win=853 Len=0 TSval=1223631 TSecr=30045223
138 0.847265949 172.31.31.144 -> 172.31.23.72 TCP 90 6633 → 45544 [PSH, ACK] Seq=1 Ack=1 Win=853 Len=24 TSval=1223647 TSecr=30044653
139 0.847300611 172.31.31.144 -> 172.31.23.72 TCP 138 6633 → 45544 [PSH, ACK] Seq=25 Ack=1 Win=853 Len=72 TSval=1223647 TSecr=30044653
140 0.847584842 172.31.23.72 -> 172.31.31.144 OpenFlow 530 Type: OFPT_MULTIPART_REPLY, OFPMP_PORT_STATS
141 0.847667625 172.31.23.72 -> 172.31.31.144 OpenFlow 2010 Type: OFPT_MULTIPART_REPLY, OFPMP_FLOW
142 0.847823730 172.31.31.144 -> 172.31.23.72 TCP 66 6633 → 45544 [ACK] Seq=97 Ack=465 Win=853 Len=0 TSval=1223647 TSecr=30045238
143 0.847855779 172.31.23.72 -> 172.31.31.144 OpenFlow 6178 Type: OFPT_MULTIPART_REPLY, OFPMP_TABLE
144 0.847928604 172.31.31.144 -> 172.31.23.72 TCP 66 6633 → 45544 [ACK] Seq=97 Ack=2409 Win=853 Len=0 TSval=1223647 TSecr=30045238
145 0.848132002 172.31.31.144 -> 172.31.23.72 TCP 66 6633 → 45544 [ACK] Seq=97 Ack=8521 Win=853 Len=0 TSval=1223647 TSecr=30045238
146 0.906564949 172.31.31.144 -> 172.31.23.72 TCP 122 6633 → 45546 [PSH, ACK] Seq=1 Ack=1 Win=853 Len=56 TSval=1223662 TSecr=30044680
147 0.906581608 172.31.31.144 -> 172.31.23.72 TCP 106 6633 → 45546 [PSH, ACK] Seq=57 Ack=1 Win=853 Len=40 TSval=1223662 TSecr=30044680
148 0.906771863 172.31.23.72 -> 172.31.31.144 OpenFlow 2218 Type: OFPT_MULTIPART_REPLY, OFPMP_FLOW
149 0.906876129 172.31.23.72 -> 172.31.31.144 OpenFlow 642 Type: OFPT_MULTIPART_REPLY, OFPMP_PORT_STATS
150 0.907036222 172.31.23.72 -> 172.31.31.144 OpenFlow 6178 Type: OFPT_MULTIPART_REPLY, OFPMP_TABLE
151 0.907093023 172.31.31.144 -> 172.31.23.72 TCP 66 6633 → 45546 [ACK] Seq=97 Ack=2729 Win=853 Len=0 TSval=1223662 TSecr=30045253
152 0.946335238 172.31.31.144 -> 172.31.23.72 TCP 66 6633 → 45546 [ACK] Seq=97 Ack=8841 Win=853 Len=0 TSval=1223672 TSecr=30045253
153 0.971697304 172.31.31.144 -> 172.31.23.72 TCP 90 6633 → 45548 [PSH, ACK] Seq=1 Ack=1 Win=853 Len=24 TSval=1223678 TSecr=30044680
154 0.971730150 172.31.31.144 -> 172.31.23.72 TCP 122 6633 → 45548 [PSH, ACK] Seq=25 Ack=1 Win=853 Len=56 TSval=1223678 TSecr=30044680
155 0.972118911 172.31.23.72 -> 172.31.31.144 OpenFlow 642 Type: OFPT_MULTIPART_REPLY, OFPMP_PORT_STATS
156 0.972214303 172.31.23.72 -> 172.31.31.144 OpenFlow 2426 Type: OFPT_MULTIPART_REPLY, OFPMP_FLOW
157 0.972460084 172.31.31.144 -> 172.31.23.72 TCP 66 6633 → 45548 [ACK] Seq=81 Ack=2937 Win=853 Len=0 TSval=1223678 TSecr=30045269
158 0.972784017 172.31.31.144 -> 172.31.23.72 OpenFlow 82 Type: OFPT_MULTIPART_REQUEST, OFPMP_TABLE
159 0.973072968 172.31.23.72 -> 172.31.31.144 OpenFlow 6178 Type: OFPT_MULTIPART_REPLY, OFPMP_TABLE
160 1.010303170 172.31.31.144 -> 172.31.23.72 TCP 66 6633 → 45548 [ACK] Seq=97 Ack=9049 Win=853 Len=0 TSval=1223688 TSecr=30045269
161 1.035019569 172.31.31.144 -> 172.31.23.72 TCP 82 6633 → 45550 [PSH, ACK] Seq=1 Ack=1 Win=853 Len=16 TSval=1223694 TSecr=30044680
162 1.035036968 172.31.31.144 -> 172.31.23.72 TCP 146 6633 → 45550 [PSH, ACK] Seq=17 Ack=1 Win=853 Len=80 TSval=1223694 TSecr=30044680
163 1.035412251 172.31.23.72 -> 172.31.31.144 OpenFlow 6178 Type: OFPT_MULTIPART_REPLY, OFPMP_TABLE
164 1.035491223 172.31.23.72 -> 172.31.31.144 OpenFlow 1802 Type: OFPT_MULTIPART_REPLY, OFPMP_FLOW
165 1.035596495 172.31.23.72 -> 172.31.31.144 OpenFlow 642 Type: OFPT_MULTIPART_REPLY, OFPMP_PORT_STATS
166 1.035729305 172.31.31.144 -> 172.31.23.72 TCP 66 6633 → 45550 [ACK] Seq=97 Ack=6113 Win=853 Len=0 TSval=1223694 TSecr=30045285
167 1.035736516 172.31.31.144 -> 172.31.23.72 TCP 66 6633 → 45550 [ACK] Seq=97 Ack=7849 Win=853 Len=0 TSval=1223694 TSecr=30045285
168 1.035796975 172.31.31.144 -> 172.31.23.72 TCP 66 6633 → 45550 [ACK] Seq=97 Ack=8425 Win=853 Len=0 TSval=1223694 TSecr=30045285
169 1.075137268 172.31.31.144 -> 172.31.23.72 TCP 122 6633 → 45552 [PSH, ACK] Seq=1 Ack=1 Win=853 Len=56 TSval=1223704 TSecr=30044680
170 1.075156961 172.31.31.144 -> 172.31.23.72 TCP 106 6633 → 45552 [PSH, ACK] Seq=57 Ack=1 Win=853 Len=40 TSval=1223704 TSecr=30044680
171 1.075481631 172.31.23.72 -> 172.31.31.144 OpenFlow 3466 Type: OFPT_MULTIPART_REPLY, OFPMP_FLOW
172 1.075591044 172.31.23.72 -> 172.31.31.144 OpenFlow 642 Type: OFPT_MULTIPART_REPLY, OFPMP_PORT_STATS
173 1.075759411 172.31.23.72 -> 172.31.31.144 OpenFlow 6178 Type: OFPT_MULTIPART_REPLY, OFPMP_TABLE
174 1.075831596 172.31.31.144 -> 172.31.23.72 TCP 66 6633 → 45552 [ACK] Seq=97 Ack=3977 Win=853 Len=0 TSval=1223704 TSecr=30045295
175 1.104227905 172.31.31.144 -> 172.31.23.72 TCP 82 6633 → 45554 [PSH, ACK] Seq=1 Ack=1 Win=853 Len=16 TSval=1223711 TSecr=30044681
176 1.104238504 172.31.31.144 -> 172.31.23.72 TCP 146 6633 → 45554 [PSH, ACK] Seq=17 Ack=1 Win=853 Len=80 TSval=1223711 TSecr=30044681
177 1.104513360 172.31.23.72 -> 172.31.31.144 OpenFlow 6178 Type: OFPT_MULTIPART_REPLY, OFPMP_TABLE
178 1.104597487 172.31.23.72 -> 172.31.31.144 OpenFlow 530 Type: OFPT_MULTIPART_REPLY, OFPMP_PORT_STATS
179 1.104663758 172.31.23.72 -> 172.31.31.144 OpenFlow 2010 Type: OFPT_MULTIPART_REPLY, OFPMP_FLOW
180 1.104890325 172.31.31.144 -> 172.31.23.72 TCP 66 6633 → 45554 [ACK] Seq=97 Ack=6113 Win=853 Len=0 TSval=1223711 TSecr=30045302
181 1.104897261 172.31.31.144 -> 172.31.23.72 TCP 66 6633 → 45554 [ACK] Seq=97 Ack=6577 Win=853 Len=0 TSval=1223711 TSecr=30045302
182 1.104899167 172.31.31.144 -> 172.31.23.72 TCP 66 6633 → 45554 [ACK] Seq=97 Ack=8521 Win=853 Len=0 TSval=1223711 TSecr=30045302
183 1.114316757 172.31.31.144 -> 172.31.23.72 TCP 66 6633 → 45552 [ACK] Seq=97 Ack=10089 Win=853 Len=0 TSval=1223714 TSecr=30045295
184 1.506304614 172.31.31.144 -> 172.31.23.72 OpenFlow 187 Type: OFPT_PACKET_OUT
185 1.506350841 172.31.31.144 -> 172.31.23.72 OpenFlow 187 Type: OFPT_PACKET_OUT
186 1.506422717 172.31.31.144 -> 172.31.23.72 OpenFlow 187 Type: OFPT_PACKET_OUT
187 1.506425855 172.31.31.144 -> 172.31.23.72 OpenFlow 187 Type: OFPT_PACKET_OUT
188 1.506764588 172.31.23.72 -> 172.31.31.144 TCP 66 45546 → 6633 [ACK] Seq=8841 Ack=581 Win=213 Len=0 TSval=30045403 TSecr=1223812
189 1.506904016 172.31.31.144 -> 172.31.23.72 OpenFlow 187 Type: OFPT_PACKET_OUT
190 1.506910028 172.31.31.144 -> 172.31.23.72 OpenFlow 187 Type: OFPT_PACKET_OUT
191 1.506912258 172.31.31.144 -> 172.31.23.72 OpenFlow 187 Type: OFPT_PACKET_OUT
192 1.506914212 172.31.31.144 -> 172.31.23.72 OpenFlow 187 Type: OFPT_PACKET_OUT
193 1.506915757 172.31.31.144 -> 172.31.23.72 OpenFlow 187 Type: OFPT_PACKET_OUT
194 1.506918641 172.31.31.144 -> 172.31.23.72 OpenFlow 187 Type: OFPT_PACKET_OUT
195 1.506920376 172.31.31.144 -> 172.31.23.72 OpenFlow 187 Type: OFPT_PACKET_OUT
196 1.506921706 172.31.31.144 -> 172.31.23.72 OpenFlow 187 Type: OFPT_PACKET_OUT
197 1.506957270 172.31.23.72 -> 172.31.31.144 OpenFlow 189 Type: OFPT_PACKET_IN
198 1.506970450 172.31.31.144 -> 172.31.23.72 OpenFlow 187 Type: OFPT_PACKET_OUT
199 1.506980272 172.31.23.72 -> 172.31.31.144 OpenFlow 189 Type: OFPT_PACKET_IN
200 1.507077461 172.31.31.144 -> 172.31.23.72 OpenFlow 187 Type: OFPT_PACKET_OUT
201 1.507081437 172.31.31.144 -> 172.31.23.72 OpenFlow 187 Type: OFPT_PACKET_OUT
202 1.507095614 172.31.23.72 -> 172.31.31.144 OpenFlow 189 Type: OFPT_PACKET_IN
203 1.507177931 172.31.31.144 -> 172.31.23.72 OpenFlow 187 Type: OFPT_PACKET_OUT
204 1.507182654 172.31.31.144 -> 172.31.23.72 OpenFlow 187 Type: OFPT_PACKET_OUT
205 1.507187791 172.31.23.72 -> 172.31.31.144 OpenFlow 189 Type: OFPT_PACKET_IN
206 1.507290260 172.31.31.144 -> 172.31.23.72 TCP 66 6633 → 45544 [ACK] Seq=97 Ack=8644 Win=853 Len=0 TSval=1223812 TSecr=30045403
207 1.507308836 172.31.31.144 -> 172.31.23.72 OpenFlow 187 Type: OFPT_PACKET_OUT
208 1.507311373 172.31.31.144 -> 172.31.23.72 OpenFlow 187 Type: OFPT_PACKET_OUT
209 1.507383356 172.31.23.72 -> 172.31.31.144 TCP 66 45546 → 6633 [ACK] Seq=8841 Ack=1065 Win=213 Len=0 TSval=30045403 TSecr=1223812
210 1.507442237 172.31.31.144 -> 172.31.23.72 TCP 66 6633 → 45544 [ACK] Seq=97 Ack=8767 Win=853 Len=0 TSval=1223812 TSecr=30045403
211 1.507448240 172.31.31.144 -> 172.31.23.72 OpenFlow 187 Type: OFPT_PACKET_OUT
212 1.507577848 172.31.31.144 -> 172.31.23.72 OpenFlow 187 Type: OFPT_PACKET_OUT
213 1.507582651 172.31.31.144 -> 172.31.23.72 TCP 66 6633 → 45548 [ACK] Seq=97 Ack=9172 Win=853 Len=0 TSval=1223812 TSecr=30045403
214 1.507586002 172.31.31.144 -> 172.31.23.72 OpenFlow 187 Type: OFPT_PACKET_OUT
215 1.507587826 172.31.31.144 -> 172.31.23.72 TCP 66 6633 → 45548 [ACK] Seq=97 Ack=9295 Win=853 Len=0 TSval=1223812 TSecr=30045403
216 1.507589638 172.31.31.144 -> 172.31.23.72 OpenFlow 187 Type: OFPT_PACKET_OUT
217 1.507613056 172.31.31.144 -> 172.31.23.72 OpenFlow 187 Type: OFPT_PACKET_OUT
218 1.507616729 172.31.31.144 -> 172.31.23.72 OpenFlow 187 Type: OFPT_PACKET_OUT
219 1.507668239 172.31.31.144 -> 172.31.23.72 OpenFlow 187 Type: OFPT_PACKET_OUT
220 1.507714485 172.31.31.144 -> 172.31.23.72 OpenFlow 187 Type: OFPT_PACKET_OUT
221 1.507751207 172.31.23.72 -> 172.31.31.144 TCP 66 45534 → 6633 [ACK] Seq=6857 Ack=823 Win=213 Len=0 TSval=30045403 TSecr=1223812
222 1.507762440 172.31.31.144 -> 172.31.23.72 OpenFlow 187 Type: OFPT_PACKET_OUT
223 1.507877955 172.31.31.144 -> 172.31.23.72 OpenFlow 187 Type: OFPT_PACKET_OUT
224 1.507884605 172.31.31.144 -> 172.31.23.72 OpenFlow 187 Type: OFPT_PACKET_OUT
225 1.507983701 172.31.31.144 -> 172.31.23.72 OpenFlow 187 Type: OFPT_PACKET_OUT
226 1.508086805 172.31.31.144 -> 172.31.23.72 OpenFlow 187 Type: OFPT_PACKET_OUT
227 1.508091475 172.31.31.144 -> 172.31.23.72 OpenFlow 187 Type: OFPT_PACKET_OUT
228 1.508093541 172.31.31.144 -> 172.31.23.72 OpenFlow 187 Type: OFPT_PACKET_OUT
229 1.508152425 172.31.31.144 -> 172.31.23.72 OpenFlow 187 Type: OFPT_PACKET_OUT
230 1.508167820 172.31.23.72 -> 172.31.31.144 TCP 66 45530 → 6633 [ACK] Seq=8841 Ack=1065 Win=213 Len=0 TSval=30045403 TSecr=1223812
231 1.508295228 172.31.31.144 -> 172.31.23.72 OpenFlow 187 Type: OFPT_PACKET_OUT
232 1.508300075 172.31.31.144 -> 172.31.23.72 OpenFlow 187 Type: OFPT_PACKET_OUT
233 1.508302040 172.31.31.144 -> 172.31.23.72 OpenFlow 187 Type: OFPT_PACKET_OUT
234 1.508408844 172.31.31.144 -> 172.31.23.72 OpenFlow 187 Type: OFPT_PACKET_OUT
235 1.508413434 172.31.31.144 -> 172.31.23.72 OpenFlow 187 Type: OFPT_PACKET_OUT
236 1.508468226 172.31.31.144 -> 172.31.23.72 OpenFlow 187 Type: OFPT_PACKET_OUT
237 1.508502444 172.31.23.72 -> 172.31.31.144 TCP 66 45514 → 6633 [ACK] Seq=8633 Ack=1065 Win=213 Len=0 TSval=30045403 TSecr=1223812
238 1.508516955 172.31.31.144 -> 172.31.23.72 OpenFlow 187 Type: OFPT_PACKET_OUT
239 1.508578898 172.31.23.72 -> 172.31.31.144 OpenFlow 189 Type: OFPT_PACKET_IN
240 1.508665506 172.31.31.144 -> 172.31.23.72 OpenFlow 187 Type: OFPT_PACKET_OUT
241 1.508670062 172.31.31.144 -> 172.31.23.72 OpenFlow 187 Type: OFPT_PACKET_OUT
242 1.508675183 172.31.23.72 -> 172.31.31.144 OpenFlow 189 Type: OFPT_PACKET_IN
243 1.508764028 172.31.31.144 -> 172.31.23.72 OpenFlow 187 Type: OFPT_PACKET_OUT
244 1.508771140 172.31.31.144 -> 172.31.23.72 OpenFlow 187 Type: OFPT_PACKET_OUT
245 1.508996884 172.31.31.144 -> 172.31.23.72 OpenFlow 187 Type: OFPT_PACKET_OUT
246 1.509001617 172.31.31.144 -> 172.31.23.72 TCP 66 6633 → 45528 [ACK] Seq=1307 Ack=10740 Win=853 Len=0 TSval=1223812 TSecr=30045403
247 1.509004741 172.31.31.144 -> 172.31.23.72 OpenFlow 187 Type: OFPT_PACKET_OUT
248 1.509006188 172.31.31.144 -> 172.31.23.72 OpenFlow 187 Type: OFPT_PACKET_OUT
249 1.509007993 172.31.31.144 -> 172.31.23.72 OpenFlow 187 Type: OFPT_PACKET_OUT
250 1.509009471 172.31.31.144 -> 172.31.23.72 TCP 66 6633 → 45528 [ACK] Seq=1307 Ack=10863 Win=853 Len=0 TSval=1223812 TSecr=30045403
251 1.509011455 172.31.31.144 -> 172.31.23.72 OpenFlow 187 Type: OFPT_PACKET_OUT
252 1.509048126 172.31.31.144 -> 172.31.23.72 OpenFlow 187 Type: OFPT_PACKET_OUT
253 1.509087504 172.31.23.72 -> 172.31.31.144 OpenFlow 189 Type: OFPT_PACKET_IN
254 1.509097756 172.31.31.144 -> 172.31.23.72 OpenFlow 187 Type: OFPT_PACKET_OUT
255 1.509147097 172.31.31.144 -> 172.31.23.72 OpenFlow 187 Type: OFPT_PACKET_OUT
256 1.509154323 172.31.23.72 -> 172.31.31.144 OpenFlow 189 Type: OFPT_PACKET_IN
257 1.509252451 172.31.31.144 -> 172.31.23.72 OpenFlow 187 Type: OFPT_PACKET_OUT
258 1.509257131 172.31.31.144 -> 172.31.23.72 OpenFlow 187 Type: OFPT_PACKET_OUT
259 1.509442898 172.31.31.144 -> 172.31.23.72 OpenFlow 187 Type: OFPT_PACKET_OUT
260 1.509447782 172.31.31.144 -> 172.31.23.72 TCP 66 6633 → 45518 [ACK] Seq=1307 Ack=9700 Win=853 Len=0 TSval=1223812 TSecr=30045403
261 1.509450758 172.31.31.144 -> 172.31.23.72 OpenFlow 187 Type: OFPT_PACKET_OUT
262 1.509452335 172.31.31.144 -> 172.31.23.72 OpenFlow 187 Type: OFPT_PACKET_OUT
263 1.509453993 172.31.31.144 -> 172.31.23.72 TCP 66 6633 → 45518 [ACK] Seq=1307 Ack=9823 Win=853 Len=0 TSval=1223812 TSecr=30045403
264 1.509492492 172.31.31.144 -> 172.31.23.72 OpenFlow 187 Type: OFPT_PACKET_OUT
265 1.509562652 172.31.31.144 -> 172.31.23.72 OpenFlow 187 Type: OFPT_PACKET_OUT
266 1.509614116 172.31.31.144 -> 172.31.23.72 OpenFlow 187 Type: OFPT_PACKET_OUT
267 1.509659336 172.31.31.144 -> 172.31.23.72 OpenFlow 187 Type: OFPT_PACKET_OUT
268 1.509692655 172.31.23.72 -> 172.31.31.144 OpenFlow 189 Type: OFPT_PACKET_IN
269 1.509712547 172.31.31.144 -> 172.31.23.72 OpenFlow 187 Type: OFPT_PACKET_OUT
270 1.509718330 172.31.23.72 -> 172.31.31.144 OpenFlow 189 Type: OFPT_PACKET_IN
271 1.509818088 172.31.31.144 -> 172.31.23.72 OpenFlow 187 Type: OFPT_PACKET_OUT
272 1.509822774 172.31.31.144 -> 172.31.23.72 OpenFlow 187 Type: OFPT_PACKET_OUT
273 1.510005273 172.31.31.144 -> 172.31.23.72 OpenFlow 187 Type: OFPT_PACKET_OUT
274 1.510010198 172.31.31.144 -> 172.31.23.72 TCP 66 6633 → 45512 [ACK] Seq=1307 Ack=9700 Win=853 Len=0 TSval=1223812 TSecr=30045404
275 1.510013128 172.31.31.144 -> 172.31.23.72 OpenFlow 187 Type: OFPT_PACKET_OUT
276 1.510014753 172.31.31.144 -> 172.31.23.72 OpenFlow 187 Type: OFPT_PACKET_OUT
277 1.510016242 172.31.31.144 -> 172.31.23.72 TCP 66 6633 → 45512 [ACK] Seq=1307 Ack=9823 Win=853 Len=0 TSval=1223812 TSecr=30045404
278 1.510109107 172.31.23.72 -> 172.31.31.144 OpenFlow 189 Type: OFPT_PACKET_IN
279 1.510131064 172.31.31.144 -> 172.31.23.72 OpenFlow 187 Type: OFPT_PACKET_OUT
280 1.510136479 172.31.23.72 -> 172.31.31.144 OpenFlow 189 Type: OFPT_PACKET_IN
281 1.510354038 172.31.31.144 -> 172.31.23.72 TCP 66 6633 → 45538 [ACK] Seq=1307 Ack=8868 Win=853 Len=0 TSval=1223813 TSecr=30045404
282 1.510359728 172.31.31.144 -> 172.31.23.72 TCP 66 6633 → 45538 [ACK] Seq=1307 Ack=8991 Win=853 Len=0 TSval=1223813 TSecr=30045404
283 1.510563647 172.31.23.72 -> 172.31.31.144 OpenFlow 189 Type: OFPT_PACKET_IN
284 1.510593192 172.31.23.72 -> 172.31.31.144 OpenFlow 435 Type: OFPT_PACKET_IN
285 1.510598287 172.31.23.72 -> 172.31.31.144 OpenFlow 189 Type: OFPT_PACKET_IN
286 1.510613129 172.31.23.72 -> 172.31.31.144 OpenFlow 189 Type: OFPT_PACKET_IN
287 1.510633560 172.31.23.72 -> 172.31.31.144 OpenFlow 189 Type: OFPT_PACKET_IN
288 1.510651528 172.31.23.72 -> 172.31.31.144 OpenFlow 189 Type: OFPT_PACKET_IN
289 1.510668090 172.31.23.72 -> 172.31.31.144 OpenFlow 189 Type: OFPT_PACKET_IN
290 1.510670555 172.31.23.72 -> 172.31.31.144 OpenFlow 189 Type: OFPT_PACKET_IN
291 1.510682951 172.31.23.72 -> 172.31.31.144 OpenFlow 189 Type: OFPT_PACKET_IN
292 1.510703554 172.31.23.72 -> 172.31.31.144 OpenFlow 189 Type: OFPT_PACKET_IN
293 1.510705931 172.31.23.72 -> 172.31.31.144 OpenFlow 681 Type: OFPT_PACKET_IN
294 1.510718325 172.31.23.72 -> 172.31.31.144 OpenFlow 189 Type: OFPT_PACKET_IN
295 1.510730518 172.31.23.72 -> 172.31.31.144 OpenFlow 189 Type: OFPT_PACKET_IN
296 1.510742784 172.31.23.72 -> 172.31.31.144 OpenFlow 189 Type: OFPT_PACKET_IN
297 1.510757972 172.31.23.72 -> 172.31.31.144 OpenFlow 189 Type: OFPT_PACKET_IN
298 1.510786100 172.31.23.72 -> 172.31.31.144 OpenFlow 189 Type: OFPT_PACKET_IN
299 1.510788586 172.31.23.72 -> 172.31.31.144 OpenFlow 189 Type: OFPT_PACKET_IN
300 1.510804129 172.31.23.72 -> 172.31.31.144 OpenFlow 189 Type: OFPT_PACKET_IN
301 1.510898499 172.31.23.72 -> 172.31.31.144 OpenFlow 189 Type: OFPT_PACKET_IN
302 1.510901791 172.31.23.72 -> 172.31.31.144 OpenFlow 435 Type: OFPT_PACKET_IN
303 1.510904175 172.31.23.72 -> 172.31.31.144 OpenFlow 189 Type: OFPT_PACKET_IN
304 1.510920688 172.31.23.72 -> 172.31.31.144 OpenFlow 189 Type: OFPT_PACKET_IN
305 1.510932849 172.31.23.72 -> 172.31.31.144 OpenFlow 189 Type: OFPT_PACKET_IN
306 1.511419006 172.31.31.144 -> 172.31.23.72 TCP 66 6633 → 45544 [ACK] Seq=97 Ack=8890 Win=853 Len=0 TSval=1223813 TSecr=30045404
307 1.511426204 172.31.31.144 -> 172.31.23.72 TCP 66 6633 → 45524 [ACK] Seq=97 Ack=8660 Win=853 Len=0 TSval=1223813 TSecr=30045404
308 1.511428431 172.31.31.144 -> 172.31.23.72 TCP 66 6633 → 45532 [ACK] Seq=97 Ack=8709 Win=853 Len=0 TSval=1223813 TSecr=30045404
309 1.511430798 172.31.31.144 -> 172.31.23.72 TCP 66 6633 → 45522 [ACK] Seq=97 Ack=7396 Win=853 Len=0 TSval=1223813 TSecr=30045404
310 1.511432823 172.31.31.144 -> 172.31.23.72 TCP 66 6633 → 45510 [ACK] Seq=97 Ack=9380 Win=853 Len=0 TSval=1223813 TSecr=30045404
311 1.511434925 172.31.31.144 -> 172.31.23.72 TCP 66 6633 → 45540 [ACK] Seq=97 Ack=8660 Win=853 Len=0 TSval=1223813 TSecr=30045404
312 1.511436761 172.31.31.144 -> 172.31.23.72 TCP 66 6633 → 45544 [ACK] Seq=97 Ack=9013 Win=853 Len=0 TSval=1223813 TSecr=30045404
313 1.511438346 172.31.31.144 -> 172.31.23.72 TCP 66 6633 → 45526 [ACK] Seq=97 Ack=7924 Win=853 Len=0 TSval=1223813 TSecr=30045404
314 1.511441958 172.31.23.72 -> 172.31.31.144 OpenFlow 189 Type: OFPT_PACKET_IN
315 1.511447157 172.31.31.144 -> 172.31.23.72 TCP 66 6633 → 45550 [ACK] Seq=97 Ack=8548 Win=853 Len=0 TSval=1223813 TSecr=30045404
316 1.511449914 172.31.23.72 -> 172.31.31.144 OpenFlow 189 Type: OFPT_PACKET_IN
317 1.511451289 172.31.31.144 -> 172.31.23.72 TCP 66 6633 → 45524 [ACK] Seq=97 Ack=9275 Win=853 Len=0 TSval=1223813 TSecr=30045404
318 1.511453097 172.31.31.144 -> 172.31.23.72 TCP 66 6633 → 45508 [ACK] Seq=97 Ack=8644 Win=853 Len=0 TSval=1223813 TSecr=30045404
319 1.511455499 172.31.23.72 -> 172.31.31.144 OpenFlow 189 Type: OFPT_PACKET_IN
320 1.511461659 172.31.23.72 -> 172.31.31.144 OpenFlow 681 Type: OFPT_PACKET_IN
321 1.511463651 172.31.23.72 -> 172.31.31.144 OpenFlow 189 Type: OFPT_PACKET_IN
322 1.511465576 172.31.23.72 -> 172.31.31.144 OpenFlow 189 Type: OFPT_PACKET_IN
323 1.511934646 172.31.23.72 -> 172.31.31.144 OpenFlow 435 Type: OFPT_PACKET_IN
324 1.511937973 172.31.23.72 -> 172.31.31.144 OpenFlow 435 Type: OFPT_PACKET_IN
325 1.511939807 172.31.23.72 -> 172.31.31.144 OpenFlow 435 Type: OFPT_PACKET_IN
326 1.511941456 172.31.23.72 -> 172.31.31.144 OpenFlow 189 Type: OFPT_PACKET_IN
327 1.511943150 172.31.23.72 -> 172.31.31.144 OpenFlow 189 Type: OFPT_PACKET_IN
328 1.512012672 172.31.31.144 -> 172.31.23.72 TCP 66 6633 → 45548 [ACK] Seq=97 Ack=9418 Win=853 Len=0 TSval=1223813 TSecr=30045404
329 1.512017194 172.31.31.144 -> 172.31.23.72 TCP 66 6633 → 45542 [ACK] Seq=97 Ack=6980 Win=853 Len=0 TSval=1223813 TSecr=30045404
330 1.512019601 172.31.31.144 -> 172.31.23.72 TCP 66 6633 → 45536 [ACK] Seq=97 Ack=8436 Win=853 Len=0 TSval=1223813 TSecr=30045404
331 1.512021438 172.31.31.144 -> 172.31.23.72 TCP 66 6633 → 45520 [ACK] Seq=97 Ack=8660 Win=853 Len=0 TSval=1223813 TSecr=30045404
332 1.512023548 172.31.31.144 -> 172.31.23.72 TCP 66 6633 → 45522 [ACK] Seq=97 Ack=7519 Win=853 Len=0 TSval=1223813 TSecr=30045404
333 1.512025704 172.31.31.144 -> 172.31.23.72 TCP 66 6633 → 45516 [ACK] Seq=97 Ack=7188 Win=853 Len=0 TSval=1223813 TSecr=30045404
334 1.512027474 172.31.31.144 -> 172.31.23.72 TCP 66 6633 → 45530 [ACK] Seq=1065 Ack=8964 Win=853 Len=0 TSval=1223813 TSecr=30045404
335 1.512029232 172.31.31.144 -> 172.31.23.72 TCP 66 6633 → 45510 [ACK] Seq=97 Ack=9749 Win=853 Len=0 TSval=1223813 TSecr=30045404
336 1.512693372 172.31.31.144 -> 172.31.23.72 TCP 66 6633 → 45540 [ACK] Seq=97 Ack=8783 Win=853 Len=0 TSval=1223813 TSecr=30045404
337 1.512699674 172.31.31.144 -> 172.31.23.72 TCP 66 6633 → 45514 [ACK] Seq=1065 Ack=8756 Win=853 Len=0 TSval=1223813 TSecr=30045404
338 1.512701937 172.31.31.144 -> 172.31.23.72 TCP 66 6633 → 45528 [ACK] Seq=1307 Ack=10986 Win=853 Len=0 TSval=1223813 TSecr=30045404
339 1.512703864 172.31.31.144 -> 172.31.23.72 TCP 66 6633 → 45526 [ACK] Seq=97 Ack=8047 Win=853 Len=0 TSval=1223813 TSecr=30045404
340 1.512705592 172.31.31.144 -> 172.31.23.72 TCP 66 6633 → 45550 [ACK] Seq=97 Ack=8671 Win=853 Len=0 TSval=1223813 TSecr=30045404
341 1.512707352 172.31.31.144 -> 172.31.23.72 TCP 66 6633 → 45508 [ACK] Seq=97 Ack=8767 Win=853 Len=0 TSval=1223813 TSecr=30045404
342 1.512708983 172.31.31.144 -> 172.31.23.72 TCP 66 6633 → 45536 [ACK] Seq=97 Ack=9051 Win=853 Len=0 TSval=1223813 TSecr=30045404
343 1.512710754 172.31.31.144 -> 172.31.23.72 TCP 66 6633 → 45548 [ACK] Seq=97 Ack=9541 Win=853 Len=0 TSval=1223813 TSecr=30045404
344 1.512712840 172.31.31.144 -> 172.31.23.72 TCP 66 6633 → 45542 [ACK] Seq=97 Ack=7103 Win=853 Len=0 TSval=1223813 TSecr=30045404
345 1.512714688 172.31.31.144 -> 172.31.23.72 TCP 66 6633 → 45520 [ACK] Seq=97 Ack=9029 Win=853 Len=0 TSval=1223813 TSecr=30045404
346 1.512716671 172.31.31.144 -> 172.31.23.72 TCP 66 6633 → 45516 [ACK] Seq=97 Ack=7557 Win=853 Len=0 TSval=1223813 TSecr=30045404
347 1.512718195 172.31.31.144 -> 172.31.23.72 TCP 66 6633 → 45530 [ACK] Seq=1065 Ack=9333 Win=853 Len=0 TSval=1223813 TSecr=30045404
348 1.512778250 172.31.31.144 -> 172.31.23.72 TCP 66 6633 → 45514 [ACK] Seq=1065 Ack=8879 Win=853 Len=0 TSval=1223813 TSecr=30045404
349 1.512780469 172.31.31.144 -> 172.31.23.72 TCP 66 6633 → 45528 [ACK] Seq=1307 Ack=11109 Win=853 Len=0 TSval=1223813 TSecr=30045404
350 1.609064531 172.31.31.144 -> 172.31.23.72 OpenFlow 187 Type: OFPT_PACKET_OUT
351 1.609091045 172.31.31.144 -> 172.31.23.72 OpenFlow 187 Type: OFPT_PACKET_OUT
352 1.609095734 172.31.31.144 -> 172.31.23.72 OpenFlow 187 Type: OFPT_PACKET_OUT
353 1.609097545 172.31.31.144 -> 172.31.23.72 OpenFlow 187 Type: OFPT_PACKET_OUT
354 1.609099194 172.31.31.144 -> 172.31.23.72 OpenFlow 187 Type: OFPT_PACKET_OUT
355 1.609100492 172.31.31.144 -> 172.31.23.72 OpenFlow 187 Type: OFPT_PACKET_OUT
356 1.609102079 172.31.31.144 -> 172.31.23.72 OpenFlow 187 Type: OFPT_PACKET_OUT
357 1.609104165 172.31.31.144 -> 172.31.23.72 OpenFlow 187 Type: OFPT_PACKET_OUT
358 1.609105624 172.31.31.144 -> 172.31.23.72 OpenFlow 187 Type: OFPT_PACKET_OUT
359 1.609108579 172.31.31.144 -> 172.31.23.72 OpenFlow 187 Type: OFPT_PACKET_OUT
360 1.609109922 172.31.31.144 -> 172.31.23.72 OpenFlow 187 Type: OFPT_PACKET_OUT
361 1.609111061 172.31.31.144 -> 172.31.23.72 OpenFlow 187 Type: OFPT_PACKET_OUT
362 1.609112337 172.31.31.144 -> 172.31.23.72 OpenFlow 187 Type: OFPT_PACKET_OUT
363 1.609113775 172.31.31.144 -> 172.31.23.72 OpenFlow 187 Type: OFPT_PACKET_OUT
364 1.609115438 172.31.31.144 -> 172.31.23.72 OpenFlow 187 Type: OFPT_PACKET_OUT
365 1.609118912 172.31.31.144 -> 172.31.23.72 OpenFlow 187 Type: OFPT_PACKET_OUT
366 1.609120529 172.31.31.144 -> 172.31.23.72 OpenFlow 187 Type: OFPT_PACKET_OUT
367 1.609121989 172.31.31.144 -> 172.31.23.72 OpenFlow 187 Type: OFPT_PACKET_OUT
368 1.609123242 172.31.31.144 -> 172.31.23.72 OpenFlow 187 Type: OFPT_PACKET_OUT
369 1.609124540 172.31.31.144 -> 172.31.23.72 OpenFlow 187 Type: OFPT_PACKET_OUT
370 1.609125959 172.31.31.144 -> 172.31.23.72 OpenFlow 187 Type: OFPT_PACKET_OUT
371 1.609127538 172.31.31.144 -> 172.31.23.72 OpenFlow 187 Type: OFPT_PACKET_OUT
372 1.609128888 172.31.31.144 -> 172.31.23.72 OpenFlow 187 Type: OFPT_PACKET_OUT
373 1.609130432 172.31.31.144 -> 172.31.23.72 OpenFlow 187 Type: OFPT_PACKET_OUT
374 1.609131705 172.31.31.144 -> 172.31.23.72 OpenFlow 187 Type: OFPT_PACKET_OUT
375 1.609134019 172.31.31.144 -> 172.31.23.72 OpenFlow 187 Type: OFPT_PACKET_OUT
376 1.609135628 172.31.31.144 -> 172.31.23.72 OpenFlow 187 Type: OFPT_PACKET_OUT
377 1.609137167 172.31.31.144 -> 172.31.23.72 OpenFlow 187 Type: OFPT_PACKET_OUT
