  1 0.000000000 172.31.23.72 -> 172.31.31.144 OpenFlow 146 Type: OFPT_PORT_STATUS
  2 0.000048983 172.31.23.72 -> 172.31.31.144 OpenFlow 146 Type: OFPT_PORT_STATUS
  3 0.025992862 172.31.31.144 -> 172.31.23.72 OpenFlow 146 Type: OFPT_FLOW_MOD
  4 0.026021494 172.31.31.144 -> 172.31.23.72 OpenFlow 146 Type: OFPT_FLOW_MOD
  5 0.026026374 172.31.31.144 -> 172.31.23.72 OpenFlow 146 Type: OFPT_FLOW_MOD
  6 0.026029817 172.31.31.144 -> 172.31.23.72 OpenFlow 74 Type: OFPT_BARRIER_REQUEST
  7 0.026031663 172.31.31.144 -> 172.31.23.72 OpenFlow 154 Type: OFPT_BARRIER_REQUEST
  8 0.026037008 172.31.31.144 -> 172.31.23.72 TCP 146 6633 → 48360 [PSH, ACK] Seq=1 Ack=1 Win=853 Len=80 TSval=3434325 TSecr=22003948
  9 0.026040552 172.31.31.144 -> 172.31.23.72 TCP 154 6633 → 48360 [PSH, ACK] Seq=81 Ack=1 Win=853 Len=88 TSval=3434325 TSecr=22003948
 10 0.026042384 172.31.31.144 -> 172.31.23.72 TCP 146 6633 → 48350 [PSH, ACK] Seq=1 Ack=1 Win=853 Len=80 TSval=3434325 TSecr=22003760
 11 0.026045735 172.31.31.144 -> 172.31.23.72 TCP 154 6633 → 48350 [PSH, ACK] Seq=81 Ack=1 Win=853 Len=88 TSval=3434325 TSecr=22003760
 12 0.026283420 172.31.23.72 -> 172.31.31.144 TCP 66 48350 → 6633 [ACK] Seq=1 Ack=169 Win=213 Len=0 TSval=22004451 TSecr=3434325
 13 0.026299271 172.31.23.72 -> 172.31.31.144 OpenFlow 74 Type: OFPT_BARRIER_REPLY
 14 0.026363047 172.31.23.72 -> 172.31.31.144 TCP 66 48364 → 6633 [ACK] Seq=81 Ack=169 Win=213 Len=0 TSval=22004451 TSecr=3434325
 15 0.026368516 172.31.23.72 -> 172.31.31.144 OpenFlow 74 Type: OFPT_BARRIER_REPLY
 16 0.026386494 172.31.23.72 -> 172.31.31.144 TCP 66 48362 → 6633 [ACK] Seq=81 Ack=169 Win=213 Len=0 TSval=22004451 TSecr=3434325
 17 0.026390298 172.31.23.72 -> 172.31.31.144 OpenFlow 74 Type: OFPT_BARRIER_REPLY
 18 0.026413665 172.31.23.72 -> 172.31.31.144 TCP 66 48360 → 6633 [ACK] Seq=1 Ack=169 Win=213 Len=0 TSval=22004451 TSecr=3434325
 19 0.026417533 172.31.23.72 -> 172.31.31.144 OpenFlow 74 Type: OFPT_BARRIER_REPLY
 20 0.026947334 172.31.31.144 -> 172.31.23.72 TCP 146 6633 → 48366 [PSH, ACK] Seq=1 Ack=1 Win=853 Len=80 TSval=3434325 TSecr=22003760
 21 0.026955299 172.31.31.144 -> 172.31.23.72 OpenFlow 146 Type: OFPT_FLOW_MOD
 22 0.026957728 172.31.31.144 -> 172.31.23.72 OpenFlow 154 Type: OFPT_BARRIER_REQUEST
 23 0.026960023 172.31.31.144 -> 172.31.23.72 TCP 146 6633 → 48366 [PSH, ACK] Seq=81 Ack=1 Win=853 Len=80 TSval=3434325 TSecr=22003760
 24 0.026961706 172.31.31.144 -> 172.31.23.72 TCP 74 6633 → 48366 [PSH, ACK] Seq=161 Ack=1 Win=853 Len=8 TSval=3434325 TSecr=22003760
 25 0.026962942 172.31.31.144 -> 172.31.23.72 TCP 146 6633 → 48342 [PSH, ACK] Seq=1 Ack=1 Win=853 Len=80 TSval=3434325 TSecr=22003758
 26 0.026965756 172.31.31.144 -> 172.31.23.72 OpenFlow 146 Type: OFPT_FLOW_MOD
 27 0.026967407 172.31.31.144 -> 172.31.23.72 TCP 146 6633 → 48322 [PSH, ACK] Seq=1 Ack=1 Win=853 Len=80 TSval=3434325 TSecr=22003759
 28 0.026970282 172.31.31.144 -> 172.31.23.72 TCP 146 6633 → 48322 [PSH, ACK] Seq=81 Ack=1 Win=853 Len=80 TSval=3434325 TSecr=22003759
 29 0.026971652 172.31.31.144 -> 172.31.23.72 TCP 146 6633 → 48342 [PSH, ACK] Seq=81 Ack=1 Win=853 Len=80 TSval=3434325 TSecr=22003758
 30 0.026973093 172.31.31.144 -> 172.31.23.72 TCP 74 6633 → 48322 [PSH, ACK] Seq=161 Ack=1 Win=853 Len=8 TSval=3434325 TSecr=22003759
 31 0.026974314 172.31.31.144 -> 172.31.23.72 TCP 74 6633 → 48342 [PSH, ACK] Seq=161 Ack=1 Win=853 Len=8 TSval=3434325 TSecr=22003758
 32 0.026975677 172.31.31.144 -> 172.31.23.72 OpenFlow 146 Type: OFPT_FLOW_MOD
 33 0.026977266 172.31.31.144 -> 172.31.23.72 OpenFlow 74 Type: OFPT_BARRIER_REQUEST
 34 0.026978430 172.31.31.144 -> 172.31.23.72 TCP 146 6633 → 48336 [PSH, ACK] Seq=1 Ack=1 Win=853 Len=80 TSval=3434325 TSecr=22003761
 35 0.026980789 172.31.31.144 -> 172.31.23.72 OpenFlow 146 Type: OFPT_FLOW_MOD
 36 0.026982104 172.31.31.144 -> 172.31.23.72 TCP 154 6633 → 48336 [PSH, ACK] Seq=81 Ack=1 Win=853 Len=88 TSval=3434325 TSecr=22003761
 37 0.026983776 172.31.31.144 -> 172.31.23.72 TCP 146 6633 → 48330 [PSH, ACK] Seq=1 Ack=1 Win=853 Len=80 TSval=3434325 TSecr=22003760
 38 0.026986362 172.31.31.144 -> 172.31.23.72 OpenFlow 146 Type: OFPT_FLOW_MOD
 39 0.026987849 172.31.31.144 -> 172.31.23.72 OpenFlow 74 Type: OFPT_BARRIER_REQUEST
 40 0.026989067 172.31.31.144 -> 172.31.23.72 TCP 146 6633 → 48330 [PSH, ACK] Seq=81 Ack=1 Win=853 Len=80 TSval=3434325 TSecr=22003760
 41 0.026990672 172.31.31.144 -> 172.31.23.72 OpenFlow 146 Type: OFPT_FLOW_MOD
 42 0.026992378 172.31.31.144 -> 172.31.23.72 OpenFlow 146 Type: OFPT_FLOW_MOD
 43 0.026994022 172.31.31.144 -> 172.31.23.72 TCP 146 6633 → 48340 [PSH, ACK] Seq=1 Ack=1 Win=853 Len=80 TSval=3434325 TSecr=22003760
 44 0.026996614 172.31.31.144 -> 172.31.23.72 OpenFlow 154 Type: OFPT_BARRIER_REQUEST
 45 0.027000666 172.31.23.72 -> 172.31.31.144 OpenFlow 226 Type: OFPT_FLOW_REMOVED
 46 0.027008631 172.31.31.144 -> 172.31.23.72 TCP 154 6633 → 48340 [PSH, ACK] Seq=81 Ack=1 Win=853 Len=88 TSval=3434325 TSecr=22003760
 47 0.027010605 172.31.31.144 -> 172.31.23.72 TCP 74 6633 → 48330 [PSH, ACK] Seq=161 Ack=1 Win=853 Len=8 TSval=3434325 TSecr=22003760
 48 0.027012204 172.31.31.144 -> 172.31.23.72 OpenFlow 146 Type: OFPT_FLOW_MOD
 49 0.027013871 172.31.31.144 -> 172.31.23.72 TCP 146 6633 → 48322 [PSH, ACK] Seq=169 Ack=1 Win=853 Len=80 TSval=3434325 TSecr=22003759
 50 0.027015620 172.31.31.144 -> 172.31.23.72 TCP 154 6633 → 48322 [PSH, ACK] Seq=249 Ack=1 Win=853 Len=88 TSval=3434325 TSecr=22003759
 51 0.027016902 172.31.31.144 -> 172.31.23.72 TCP 146 6633 → 48330 [PSH, ACK] Seq=169 Ack=1 Win=853 Len=80 TSval=3434325 TSecr=22003760
 52 0.027018403 172.31.31.144 -> 172.31.23.72 OpenFlow 146 Type: OFPT_FLOW_MOD
 53 0.027020365 172.31.23.72 -> 172.31.31.144 OpenFlow 226 Type: OFPT_FLOW_REMOVED
 54 0.027022226 172.31.31.144 -> 172.31.23.72 OpenFlow 146 Type: OFPT_FLOW_MOD
 55 0.027023920 172.31.23.72 -> 172.31.31.144 OpenFlow 226 Type: OFPT_FLOW_REMOVED
 56 0.027025313 172.31.31.144 -> 172.31.23.72 OpenFlow 146 Type: OFPT_FLOW_MOD
 57 0.027029931 172.31.31.144 -> 172.31.23.72 TCP 154 6633 → 48330 [PSH, ACK] Seq=249 Ack=1 Win=853 Len=88 TSval=3434325 TSecr=22003760
 58 0.027031515 172.31.31.144 -> 172.31.23.72 OpenFlow 154 Type: OFPT_BARRIER_REQUEST
 59 0.027033400 172.31.31.144 -> 172.31.23.72 OpenFlow 322 Type: OFPT_FLOW_MOD
 60 0.027163243 172.31.23.72 -> 172.31.31.144 OpenFlow 226 Type: OFPT_FLOW_REMOVED
 61 0.027229229 172.31.31.144 -> 172.31.23.72 OpenFlow 74 Type: OFPT_BARRIER_REQUEST
 62 0.027232120 172.31.31.144 -> 172.31.23.72 TCP 146 6633 → 48358 [PSH, ACK] Seq=1 Ack=1 Win=853 Len=80 TSval=3434325 TSecr=22003760
 63 0.027235294 172.31.31.144 -> 172.31.23.72 TCP 146 6633 → 48366 [PSH, ACK] Seq=169 Ack=1 Win=853 Len=80 TSval=3434325 TSecr=22003760
 64 0.027237222 172.31.31.144 -> 172.31.23.72 TCP 146 6633 → 48342 [PSH, ACK] Seq=169 Ack=1 Win=853 Len=80 TSval=3434325 TSecr=22003758
 65 0.027239171 172.31.31.144 -> 172.31.23.72 OpenFlow 146 Type: OFPT_FLOW_MOD
 66 0.027241481 172.31.31.144 -> 172.31.23.72 OpenFlow 146 Type: OFPT_FLOW_MOD
 67 0.027243538 172.31.31.144 -> 172.31.23.72 OpenFlow 146 Type: OFPT_FLOW_MOD
 68 0.027245432 172.31.31.144 -> 172.31.23.72 OpenFlow 74 Type: OFPT_BARRIER_REQUEST
 69 0.027247320 172.31.31.144 -> 172.31.23.72 TCP 154 6633 → 48366 [PSH, ACK] Seq=249 Ack=1 Win=853 Len=88 TSval=3434325 TSecr=22003760
 70 0.027248893 172.31.31.144 -> 172.31.23.72 TCP 154 6633 → 48358 [PSH, ACK] Seq=81 Ack=1 Win=853 Len=88 TSval=3434325 TSecr=22003760
 71 0.027250824 172.31.31.144 -> 172.31.23.72 TCP 146 6633 → 48348 [PSH, ACK] Seq=1 Ack=1 Win=853 Len=80 TSval=3434325 TSecr=22003760
 72 0.027253659 172.31.31.144 -> 172.31.23.72 TCP 146 6633 → 48320 [PSH, ACK] Seq=1 Ack=1 Win=853 Len=80 TSval=3434325 TSecr=22003759
 73 0.027255705 172.31.31.144 -> 172.31.23.72 OpenFlow 322 Type: OFPT_BARRIER_REQUEST
 74 0.027257865 172.31.31.144 -> 172.31.23.72 TCP 154 6633 → 48320 [PSH, ACK] Seq=81 Ack=1 Win=853 Len=88 TSval=3434325 TSecr=22003759
 75 0.027259869 172.31.31.144 -> 172.31.23.72 TCP 154 6633 → 48348 [PSH, ACK] Seq=81 Ack=1 Win=853 Len=88 TSval=3434325 TSecr=22003760
 76 0.027261528 172.31.31.144 -> 172.31.23.72 TCP 146 6633 → 48330 [PSH, ACK] Seq=337 Ack=1 Win=853 Len=80 TSval=3434325 TSecr=22003760
 77 0.027263201 172.31.31.144 -> 172.31.23.72 TCP 146 6633 → 48342 [PSH, ACK] Seq=249 Ack=1 Win=853 Len=80 TSval=3434325 TSecr=22003758
 78 0.027264374 172.31.31.144 -> 172.31.23.72 TCP 74 6633 → 48342 [PSH, ACK] Seq=329 Ack=1 Win=853 Len=8 TSval=3434325 TSecr=22003758
 79 0.027566187 172.31.31.144 -> 172.31.23.72 TCP 146 6633 → 48336 [PSH, ACK] Seq=169 Ack=1 Win=853 Len=80 TSval=3434325 TSecr=22003761
 80 0.027568929 172.31.31.144 -> 172.31.23.72 TCP 154 6633 → 48330 [PSH, ACK] Seq=417 Ack=1 Win=853 Len=88 TSval=3434325 TSecr=22003760
 81 0.027570453 172.31.31.144 -> 172.31.23.72 TCP 146 6633 → 48338 [PSH, ACK] Seq=1 Ack=1 Win=853 Len=80 TSval=3434325 TSecr=22003759
 82 0.027573482 172.31.31.144 -> 172.31.23.72 TCP 146 6633 → 48344 [PSH, ACK] Seq=1 Ack=1 Win=853 Len=80 TSval=3434325 TSecr=22003759
 83 0.027575922 172.31.31.144 -> 172.31.23.72 TCP 146 6633 → 48348 [PSH, ACK] Seq=169 Ack=1 Win=853 Len=80 TSval=3434325 TSecr=22003760
 84 0.027577684 172.31.31.144 -> 172.31.23.72 TCP 154 6633 → 48336 [PSH, ACK] Seq=249 Ack=1 Win=853 Len=88 TSval=3434325 TSecr=22003761
 85 0.027579603 172.31.31.144 -> 172.31.23.72 TCP 154 6633 → 48338 [PSH, ACK] Seq=81 Ack=1 Win=853 Len=88 TSval=3434325 TSecr=22003759
 86 0.027581402 172.31.31.144 -> 172.31.23.72 TCP 146 6633 → 48366 [PSH, ACK] Seq=337 Ack=1 Win=853 Len=80 TSval=3434325 TSecr=22003760
 87 0.027583171 172.31.31.144 -> 172.31.23.72 TCP 146 6633 → 48326 [PSH, ACK] Seq=1 Ack=1 Win=853 Len=80 TSval=3434325 TSecr=22003760
 88 0.027585453 172.31.31.144 -> 172.31.23.72 TCP 146 6633 → 48344 [PSH, ACK] Seq=81 Ack=1 Win=853 Len=80 TSval=3434325 TSecr=22003759
 89 0.027587052 172.31.31.144 -> 172.31.23.72 TCP 74 6633 → 48344 [PSH, ACK] Seq=161 Ack=1 Win=853 Len=8 TSval=3434325 TSecr=22003759
 90 0.027588572 172.31.31.144 -> 172.31.23.72 TCP 154 6633 → 48326 [PSH, ACK] Seq=81 Ack=1 Win=853 Len=88 TSval=3434325 TSecr=22003760
 91 0.027590310 172.31.31.144 -> 172.31.23.72 TCP 146 6633 → 48352 [PSH, ACK] Seq=1 Ack=1 Win=853 Len=80 TSval=3434325 TSecr=22003759
 92 0.027592729 172.31.31.144 -> 172.31.23.72 TCP 154 6633 → 48352 [PSH, ACK] Seq=81 Ack=1 Win=853 Len=88 TSval=3434325 TSecr=22003759
 93 0.027594536 172.31.31.144 -> 172.31.23.72 TCP 154 6633 → 48366 [PSH, ACK] Seq=417 Ack=1 Win=853 Len=88 TSval=3434325 TSecr=22003760
 94 0.027595805 172.31.31.144 -> 172.31.23.72 TCP 146 6633 → 48330 [PSH, ACK] Seq=505 Ack=1 Win=853 Len=80 TSval=3434325 TSecr=22003760
 95 0.027597217 172.31.31.144 -> 172.31.23.72 TCP 146 6633 → 48342 [PSH, ACK] Seq=337 Ack=1 Win=853 Len=80 TSval=3434325 TSecr=22003758
 96 0.027598693 172.31.31.144 -> 172.31.23.72 TCP 146 6633 → 48348 [PSH, ACK] Seq=249 Ack=1 Win=853 Len=80 TSval=3434325 TSecr=22003760
 97 0.027613201 172.31.31.144 -> 172.31.23.72 TCP 146 6633 → 48320 [PSH, ACK] Seq=169 Ack=1 Win=853 Len=80 TSval=3434325 TSecr=22003759
 98 0.027614967 172.31.31.144 -> 172.31.23.72 OpenFlow 146 Type: OFPT_FLOW_MOD
 99 0.027616661 172.31.31.144 -> 172.31.23.72 TCP 154 6633 → 48320 [PSH, ACK] Seq=249 Ack=1 Win=853 Len=88 TSval=3434325 TSecr=22003759
100 0.027617904 172.31.31.144 -> 172.31.23.72 TCP 74 6633 → 48348 [PSH, ACK] Seq=329 Ack=1 Win=853 Len=8 TSval=3434325 TSecr=22003760
101 0.027619213 172.31.31.144 -> 172.31.23.72 TCP 66 6633 → 48350 [ACK] Seq=921 Ack=9 Win=853 Len=0 TSval=3434325 TSecr=22004451
102 0.027629468 172.31.31.144 -> 172.31.23.72 TCP 154 6633 → 48342 [PSH, ACK] Seq=417 Ack=1 Win=853 Len=88 TSval=3434325 TSecr=22003758
103 0.027647853 172.31.31.144 -> 172.31.23.72 TCP 146 6633 → 48336 [PSH, ACK] Seq=337 Ack=1 Win=853 Len=80 TSval=3434325 TSecr=22003761
104 0.027667978 172.31.31.144 -> 172.31.23.72 TCP 146 6633 → 48334 [PSH, ACK] Seq=1 Ack=1 Win=853 Len=80 TSval=3434325 TSecr=22003760
105 0.027686807 172.31.31.144 -> 172.31.23.72 TCP 154 6633 → 48330 [PSH, ACK] Seq=585 Ack=1 Win=853 Len=88 TSval=3434325 TSecr=22003760
106 0.027705225 172.31.31.144 -> 172.31.23.72 TCP 154 6633 → 48334 [PSH, ACK] Seq=81 Ack=1 Win=853 Len=88 TSval=3434325 TSecr=22003760
107 0.027724611 172.31.31.144 -> 172.31.23.72 OpenFlow 322 Type: OFPT_BARRIER_REQUEST
108 0.027743600 172.31.31.144 -> 172.31.23.72 TCP 146 6633 → 48332 [PSH, ACK] Seq=1 Ack=1 Win=853 Len=80 TSval=3434325 TSecr=22003760
109 0.027762577 172.31.31.144 -> 172.31.23.72 TCP 154 6633 → 48336 [PSH, ACK] Seq=417 Ack=1 Win=853 Len=88 TSval=3434325 TSecr=22003761
110 0.027782850 172.31.31.144 -> 172.31.23.72 TCP 146 6633 → 48342 [PSH, ACK] Seq=505 Ack=1 Win=853 Len=80 TSval=3434325 TSecr=22003758
111 0.027801195 172.31.31.144 -> 172.31.23.72 OpenFlow 322 Type: OFPT_BARRIER_REQUEST
112 0.027820099 172.31.31.144 -> 172.31.23.72 OpenFlow 570 Type: OFPT_BARRIER_REQUEST
113 0.027838791 172.31.31.144 -> 172.31.23.72 TCP 154 6633 → 48332 [PSH, ACK] Seq=81 Ack=1 Win=853 Len=88 TSval=3434325 TSecr=22003760
114 0.027858081 172.31.31.144 -> 172.31.23.72 TCP 146 6633 → 48324 [PSH, ACK] Seq=1 Ack=1 Win=853 Len=80 TSval=3434325 TSecr=22003760
115 0.027876943 172.31.31.144 -> 172.31.23.72 TCP 146 6633 → 48336 [PSH, ACK] Seq=505 Ack=1 Win=853 Len=80 TSval=3434325 TSecr=22003761
116 0.027908080 172.31.31.144 -> 172.31.23.72 TCP 154 6633 → 48324 [PSH, ACK] Seq=81 Ack=1 Win=853 Len=88 TSval=3434325 TSecr=22003760
117 0.027925806 172.31.31.144 -> 172.31.23.72 OpenFlow 146 Type: OFPT_FLOW_MOD
118 0.027944660 172.31.31.144 -> 172.31.23.72 TCP 154 6633 → 48342 [PSH, ACK] Seq=585 Ack=1 Win=853 Len=88 TSval=3434325 TSecr=22003758
119 0.027962358 172.31.31.144 -> 172.31.23.72 OpenFlow 322 Type: OFPT_BARRIER_REQUEST
120 0.027981349 172.31.31.144 -> 172.31.23.72 TCP 154 6633 → 48336 [PSH, ACK] Seq=585 Ack=1 Win=853 Len=88 TSval=3434325 TSecr=22003761
121 0.028002028 172.31.31.144 -> 172.31.23.72 TCP 66 6633 → 48362 [ACK] Seq=1345 Ack=249 Win=853 Len=0 TSval=3434325 TSecr=22004451
122 0.028037569 172.31.31.144 -> 172.31.23.72 OpenFlow 170 Type: OFPT_FLOW_MOD
123 0.028057188 172.31.31.144 -> 172.31.23.72 TCP 170 6633 → 48352 [PSH, ACK] Seq=169 Ack=1 Win=853 Len=104 TSval=3434325 TSecr=22003759
124 0.028076728 172.31.31.144 -> 172.31.23.72 OpenFlow 170 Type: OFPT_FLOW_MOD
125 0.028096548 172.31.31.144 -> 172.31.23.72 OpenFlow 170 Type: OFPT_FLOW_MOD
126 0.028114280 172.31.31.144 -> 172.31.23.72 OpenFlow 74 Type: OFPT_BARRIER_REQUEST
127 0.028133374 172.31.31.144 -> 172.31.23.72 TCP 178 6633 → 48352 [PSH, ACK] Seq=273 Ack=1 Win=853 Len=112 TSval=3434325 TSecr=22003759
128 0.028152193 172.31.31.144 -> 172.31.23.72 OpenFlow 170 Type: OFPT_FLOW_MOD
129 0.028170670 172.31.31.144 -> 172.31.23.72 OpenFlow 74 Type: OFPT_BARRIER_REQUEST
130 0.028190058 172.31.31.144 -> 172.31.23.72 OpenFlow 170 Type: OFPT_FLOW_MOD
131 0.028210558 172.31.31.144 -> 172.31.23.72 OpenFlow 282 Type: OFPT_BARRIER_REQUEST
132 0.028228652 172.31.31.144 -> 172.31.23.72 OpenFlow 170 Type: OFPT_FLOW_MOD
133 0.029450492 172.31.23.72 -> 172.31.31.144 TCP 66 48358 → 6633 [ACK] Seq=1 Ack=169 Win=213 Len=0 TSval=22004452 TSecr=3434325
134 0.029462988 172.31.23.72 -> 172.31.31.144 OpenFlow 74 Type: OFPT_BARRIER_REPLY
135 0.029494198 172.31.23.72 -> 172.31.31.144 OpenFlow 74 Type: OFPT_BARRIER_REPLY
136 0.029541736 172.31.23.72 -> 172.31.31.144 TCP 66 48326 → 6633 [ACK] Seq=1 Ack=169 Win=213 Len=0 TSval=22004452 TSecr=3434325
137 0.029551395 172.31.23.72 -> 172.31.31.144 OpenFlow 90 Type: OFPT_BARRIER_REPLY
138 0.029556606 172.31.23.72 -> 172.31.31.144 OpenFlow 74 Type: OFPT_BARRIER_REPLY
139 0.029576391 172.31.23.72 -> 172.31.31.144 TCP 66 48340 → 6633 [ACK] Seq=1 Ack=169 Win=213 Len=0 TSval=22004452 TSecr=3434325
140 0.029584189 172.31.23.72 -> 172.31.31.144 OpenFlow 74 Type: OFPT_BARRIER_REPLY
141 0.029624174 172.31.23.72 -> 172.31.31.144 OpenFlow 74 Type: OFPT_BARRIER_REPLY
142 0.029680912 172.31.31.144 -> 172.31.23.72 TCP 66 6633 → 48358 [ACK] Seq=169 Ack=9 Win=853 Len=0 TSval=3434326 TSecr=22004452
143 0.029699415 172.31.23.72 -> 172.31.31.144 TCP 66 48324 → 6633 [ACK] Seq=1 Ack=169 Win=213 Len=0 TSval=22004452 TSecr=3434325
144 0.029708898 172.31.23.72 -> 172.31.31.144 OpenFlow 74 Type: OFPT_BARRIER_REPLY
145 0.029729996 172.31.23.72 -> 172.31.31.144 OpenFlow 74 Type: OFPT_BARRIER_REPLY
146 0.029776428 172.31.31.144 -> 172.31.23.72 TCP 66 6633 → 48342 [ACK] Seq=673 Ack=9 Win=853 Len=0 TSval=3434326 TSecr=22004452
147 0.029780613 172.31.31.144 -> 172.31.23.72 TCP 66 6633 → 48342 [ACK] Seq=673 Ack=33 Win=853 Len=0 TSval=3434326 TSecr=22004452
148 0.029784679 172.31.23.72 -> 172.31.31.144 OpenFlow 90 Type: OFPT_BARRIER_REPLY
149 0.029811289 172.31.23.72 -> 172.31.31.144 TCP 66 48344 → 6633 [ACK] Seq=1 Ack=169 Win=213 Len=0 TSval=22004452 TSecr=3434325
150 0.029816070 172.31.23.72 -> 172.31.31.144 OpenFlow 74 Type: OFPT_BARRIER_REPLY
151 0.029839349 172.31.23.72 -> 172.31.31.144 OpenFlow 74 Type: OFPT_BARRIER_REPLY
152 0.029841662 172.31.23.72 -> 172.31.31.144 OpenFlow 106 Type: OFPT_BARRIER_REPLY
153 0.029870712 172.31.31.144 -> 172.31.23.72 TCP 66 6633 → 48326 [ACK] Seq=169 Ack=9 Win=853 Len=0 TSval=3434326 TSecr=22004452
154 0.029895935 172.31.23.72 -> 172.31.31.144 TCP 66 48334 → 6633 [ACK] Seq=1 Ack=169 Win=213 Len=0 TSval=22004452 TSecr=3434325
155 0.029904401 172.31.23.72 -> 172.31.31.144 OpenFlow 74 Type: OFPT_BARRIER_REPLY
156 0.029924268 172.31.23.72 -> 172.31.31.144 OpenFlow 74 Type: OFPT_BARRIER_REPLY
157 0.029963807 172.31.23.72 -> 172.31.31.144 OpenFlow 74 Type: OFPT_BARRIER_REPLY
158 0.029966497 172.31.23.72 -> 172.31.31.144 OpenFlow 90 Type: OFPT_BARRIER_REPLY
159 0.030004004 172.31.23.72 -> 172.31.31.144 TCP 66 48338 → 6633 [ACK] Seq=1 Ack=169 Win=213 Len=0 TSval=22004452 TSecr=3434325
160 0.030008387 172.31.23.72 -> 172.31.31.144 OpenFlow 74 Type: OFPT_BARRIER_REPLY
161 0.030029972 172.31.31.144 -> 172.31.23.72 TCP 66 6633 → 48350 [ACK] Seq=1177 Ack=177 Win=853 Len=0 TSval=3434326 TSecr=22004451
162 0.030041032 172.31.23.72 -> 172.31.31.144 OpenFlow 74 Type: OFPT_BARRIER_REPLY
163 0.030082261 172.31.23.72 -> 172.31.31.144 OpenFlow 74 Type: OFPT_BARRIER_REPLY
164 0.030162687 172.31.23.72 -> 172.31.31.144 OpenFlow 74 Type: OFPT_BARRIER_REPLY
165 0.030165683 172.31.23.72 -> 172.31.31.144 OpenFlow 74 Type: OFPT_BARRIER_REPLY
166 0.030167497 172.31.23.72 -> 172.31.31.144 OpenFlow 74 Type: OFPT_BARRIER_REPLY
167 0.030244610 172.31.23.72 -> 172.31.31.144 OpenFlow 74 Type: OFPT_BARRIER_REPLY
168 0.030254556 172.31.31.144 -> 172.31.23.72 TCP 66 6633 → 48330 [ACK] Seq=673 Ack=33 Win=853 Len=0 TSval=3434326 TSecr=22004452
169 0.030258483 172.31.31.144 -> 172.31.23.72 TCP 66 6633 → 48344 [ACK] Seq=169 Ack=9 Win=853 Len=0 TSval=3434326 TSecr=22004452
170 0.030260369 172.31.31.144 -> 172.31.23.72 TCP 66 6633 → 48336 [ACK] Seq=673 Ack=9 Win=853 Len=0 TSval=3434326 TSecr=22004452
171 0.030262462 172.31.31.144 -> 172.31.23.72 TCP 66 6633 → 48334 [ACK] Seq=169 Ack=9 Win=853 Len=0 TSval=3434326 TSecr=22004452
172 0.030264285 172.31.31.144 -> 172.31.23.72 TCP 66 6633 → 48322 [ACK] Seq=337 Ack=9 Win=853 Len=0 TSval=3434326 TSecr=22004452
173 0.030299773 172.31.23.72 -> 172.31.31.144 OpenFlow 74 Type: OFPT_BARRIER_REPLY
174 0.030306955 172.31.23.72 -> 172.31.31.144 OpenFlow 82 Type: OFPT_BARRIER_REPLY
175 0.030308855 172.31.23.72 -> 172.31.31.144 OpenFlow 122 Type: OFPT_BARRIER_REPLY
176 0.030340412 172.31.23.72 -> 172.31.31.144 OpenFlow 74 Type: OFPT_BARRIER_REPLY
177 0.030342831 172.31.23.72 -> 172.31.31.144 OpenFlow 122 Type: OFPT_BARRIER_REPLY
178 0.030369805 172.31.23.72 -> 172.31.31.144 TCP 66 48332 → 6633 [ACK] Seq=1 Ack=169 Win=213 Len=0 TSval=22004452 TSecr=3434325
179 0.030377871 172.31.23.72 -> 172.31.31.144 OpenFlow 74 Type: OFPT_BARRIER_REPLY
180 0.030437168 172.31.31.144 -> 172.31.23.72 TCP 66 6633 → 48336 [ACK] Seq=673 Ack=33 Win=853 Len=0 TSval=3434326 TSecr=22004452
181 0.030442152 172.31.31.144 -> 172.31.23.72 TCP 66 6633 → 48366 [ACK] Seq=505 Ack=9 Win=853 Len=0 TSval=3434326 TSecr=22004452
182 0.030446967 172.31.23.72 -> 172.31.31.144 OpenFlow 74 Type: OFPT_BARRIER_REPLY
183 0.030565450 172.31.23.72 -> 172.31.31.144 OpenFlow 74 Type: OFPT_BARRIER_REPLY
184 0.030569678 172.31.23.72 -> 172.31.31.144 OpenFlow 146 Type: OFPT_FLOW_REMOVED
185 0.030578128 172.31.23.72 -> 172.31.31.144 OpenFlow 146 Type: OFPT_FLOW_REMOVED
186 0.030596547 172.31.23.72 -> 172.31.31.144 OpenFlow 146 Type: OFPT_FLOW_REMOVED
187 0.030605335 172.31.23.72 -> 172.31.31.144 OpenFlow 146 Type: OFPT_FLOW_REMOVED
188 0.030612654 172.31.23.72 -> 172.31.31.144 OpenFlow 146 Type: OFPT_FLOW_REMOVED
189 0.030632406 172.31.23.72 -> 172.31.31.144 OpenFlow 146 Type: OFPT_FLOW_REMOVED
190 0.030640376 172.31.23.72 -> 172.31.31.144 OpenFlow 146 Type: OFPT_FLOW_REMOVED
191 0.030655433 172.31.31.144 -> 172.31.23.72 TCP 66 6633 → 48322 [ACK] Seq=337 Ack=17 Win=853 Len=0 TSval=3434326 TSecr=22004452
192 0.030659352 172.31.31.144 -> 172.31.23.72 TCP 66 6633 → 48352 [ACK] Seq=385 Ack=17 Win=853 Len=0 TSval=3434326 TSecr=22004452
193 0.030661551 172.31.31.144 -> 172.31.23.72 TCP 66 6633 → 48366 [ACK] Seq=505 Ack=25 Win=853 Len=0 TSval=3434326 TSecr=22004452
194 0.030663355 172.31.31.144 -> 172.31.23.72 TCP 66 6633 → 48364 [ACK] Seq=1665 Ack=313 Win=853 Len=0 TSval=3434326 TSecr=22004452
195 0.030684300 172.31.23.72 -> 172.31.31.144 OpenFlow 146 Type: OFPT_FLOW_REMOVED
196 0.030696867 172.31.23.72 -> 172.31.31.144 OpenFlow 146 Type: OFPT_FLOW_REMOVED
197 0.030714790 172.31.23.72 -> 172.31.31.144 OpenFlow 146 Type: OFPT_FLOW_REMOVED
198 0.030721874 172.31.23.72 -> 172.31.31.144 OpenFlow 146 Type: OFPT_FLOW_REMOVED
199 0.030732402 172.31.23.72 -> 172.31.31.144 OpenFlow 146 Type: OFPT_FLOW_REMOVED
200 0.030734532 172.31.23.72 -> 172.31.31.144 OpenFlow 146 Type: OFPT_FLOW_REMOVED
201 0.030742322 172.31.23.72 -> 172.31.31.144 OpenFlow 146 Type: OFPT_FLOW_REMOVED
202 0.030749932 172.31.23.72 -> 172.31.31.144 OpenFlow 146 Type: OFPT_FLOW_REMOVED
203 0.030764629 172.31.23.72 -> 172.31.31.144 OpenFlow 146 Type: OFPT_FLOW_REMOVED
204 0.030766577 172.31.23.72 -> 172.31.31.144 OpenFlow 626 Type: OFPT_FLOW_REMOVED
205 0.030797654 172.31.23.72 -> 172.31.31.144 OpenFlow 146 Type: OFPT_FLOW_REMOVED
206 0.030799544 172.31.23.72 -> 172.31.31.144 OpenFlow 146 Type: OFPT_FLOW_REMOVED
207 0.030830854 172.31.23.72 -> 172.31.31.144 OpenFlow 146 Type: OFPT_FLOW_REMOVED
208 0.030832913 172.31.23.72 -> 172.31.31.144 OpenFlow 146 Type: OFPT_FLOW_REMOVED
209 0.030843916 172.31.23.72 -> 172.31.31.144 OpenFlow 146 Type: OFPT_FLOW_REMOVED
210 0.030845871 172.31.23.72 -> 172.31.31.144 OpenFlow 626 Type: OFPT_FLOW_REMOVED
211 0.030857173 172.31.23.72 -> 172.31.31.144 OpenFlow 146 Type: OFPT_FLOW_REMOVED
212 0.030936565 172.31.31.144 -> 172.31.23.72 TCP 66 6633 → 48362 [ACK] Seq=1561 Ack=313 Win=853 Len=0 TSval=3434326 TSecr=22004452
213 0.030941788 172.31.23.72 -> 172.31.31.144 OpenFlow 1106 Type: OFPT_FLOW_REMOVED
214 0.030943956 172.31.31.144 -> 172.31.23.72 OpenFlow 170 Type: OFPT_FLOW_MOD
215 0.030946033 172.31.31.144 -> 172.31.23.72 TCP 66 6633 → 48320 [ACK] Seq=337 Ack=17 Win=853 Len=0 TSval=3434326 TSecr=22004452
216 0.030948364 172.31.23.72 -> 172.31.31.144 OpenFlow 306 Type: OFPT_FLOW_REMOVED
217 0.030954397 172.31.31.144 -> 172.31.23.72 TCP 66 6633 → 48358 [ACK] Seq=169 Ack=89 Win=853 Len=0 TSval=3434326 TSecr=22004452
218 0.030956603 172.31.31.144 -> 172.31.23.72 OpenFlow 178 Type: OFPT_BARRIER_REQUEST
219 0.030958391 172.31.31.144 -> 172.31.23.72 TCP 66 6633 → 48348 [ACK] Seq=337 Ack=17 Win=853 Len=0 TSval=3434326 TSecr=22004452
220 0.030960664 172.31.23.72 -> 172.31.31.144 OpenFlow 306 Type: OFPT_FLOW_REMOVED
221 0.030965592 172.31.23.72 -> 172.31.31.144 OpenFlow 146 Type: OFPT_FLOW_REMOVED
222 0.030967795 172.31.23.72 -> 172.31.31.144 OpenFlow 946 Type: OFPT_FLOW_REMOVED
223 0.030969671 172.31.23.72 -> 172.31.31.144 OpenFlow 146 Type: OFPT_FLOW_REMOVED
224 0.031313754 172.31.23.72 -> 172.31.31.144 OpenFlow 626 Type: OFPT_FLOW_REMOVED
225 0.031315994 172.31.23.72 -> 172.31.31.144 OpenFlow 146 Type: OFPT_FLOW_REMOVED
226 0.031317657 172.31.23.72 -> 172.31.31.144 OpenFlow 306 Type: OFPT_FLOW_REMOVED
227 0.031319289 172.31.23.72 -> 172.31.31.144 OpenFlow 146 Type: OFPT_FLOW_REMOVED
228 0.031320980 172.31.23.72 -> 172.31.31.144 OpenFlow 146 Type: OFPT_FLOW_REMOVED
229 0.031322859 172.31.23.72 -> 172.31.31.144 OpenFlow 466 Type: OFPT_FLOW_REMOVED
230 0.031324377 172.31.23.72 -> 172.31.31.144 OpenFlow 1106 Type: OFPT_FLOW_REMOVED
231 0.031555097 172.31.31.144 -> 172.31.23.72 OpenFlow 170 Type: OFPT_FLOW_MOD
232 0.031559134 172.31.31.144 -> 172.31.23.72 TCP 66 6633 → 48326 [ACK] Seq=169 Ack=89 Win=853 Len=0 TSval=3434326 TSecr=22004452
233 0.031561188 172.31.31.144 -> 172.31.23.72 TCP 66 6633 → 48342 [ACK] Seq=673 Ack=113 Win=853 Len=0 TSval=3434326 TSecr=22004452
234 0.031563361 172.31.31.144 -> 172.31.23.72 OpenFlow 170 Type: OFPT_FLOW_MOD
235 0.031564991 172.31.31.144 -> 172.31.23.72 OpenFlow 178 Type: OFPT_BARRIER_REQUEST
236 0.031567374 172.31.31.144 -> 172.31.23.72 OpenFlow 170 Type: OFPT_FLOW_MOD
237 0.031568878 172.31.31.144 -> 172.31.23.72 OpenFlow 178 Type: OFPT_BARRIER_REQUEST
238 0.031570218 172.31.31.144 -> 172.31.23.72 TCP 170 6633 → 48346 [PSH, ACK] Seq=1 Ack=1 Win=853 Len=104 TSval=3434326 TSecr=22003760
239 0.031573801 172.31.31.144 -> 172.31.23.72 TCP 170 6633 → 48354 [PSH, ACK] Seq=1 Ack=1 Win=853 Len=104 TSval=3434326 TSecr=22003760
240 0.031576167 172.31.31.144 -> 172.31.23.72 TCP 178 6633 → 48354 [PSH, ACK] Seq=105 Ack=1 Win=853 Len=112 TSval=3434326 TSecr=22003760
241 0.031577866 172.31.31.144 -> 172.31.23.72 OpenFlow 170 Type: OFPT_FLOW_MOD
242 0.031579975 172.31.31.144 -> 172.31.23.72 TCP 66 6633 → 48324 [ACK] Seq=169 Ack=89 Win=853 Len=0 TSval=3434326 TSecr=22004452
243 0.031582562 172.31.31.144 -> 172.31.23.72 TCP 178 6633 → 48346 [PSH, ACK] Seq=105 Ack=1 Win=853 Len=112 TSval=3434326 TSecr=22003760
244 0.031584184 172.31.31.144 -> 172.31.23.72 OpenFlow 178 Type: OFPT_BARRIER_REQUEST
245 0.031585840 172.31.31.144 -> 172.31.23.72 OpenFlow 178 Type: OFPT_BARRIER_REQUEST
246 0.031587209 172.31.31.144 -> 172.31.23.72 OpenFlow 170 Type: OFPT_FLOW_MOD
247 0.031588632 172.31.31.144 -> 172.31.23.72 OpenFlow 170 Type: OFPT_FLOW_MOD
248 0.031589904 172.31.31.144 -> 172.31.23.72 TCP 66 6633 → 48344 [ACK] Seq=169 Ack=89 Win=853 Len=0 TSval=3434326 TSecr=22004452
249 0.031591683 172.31.31.144 -> 172.31.23.72 OpenFlow 170 Type: OFPT_FLOW_MOD
250 0.031593715 172.31.31.144 -> 172.31.23.72 OpenFlow 178 Type: OFPT_BARRIER_REQUEST
251 0.031595296 172.31.31.144 -> 172.31.23.72 OpenFlow 178 Type: OFPT_BARRIER_REQUEST
252 0.031596572 172.31.31.144 -> 172.31.23.72 TCP 66 6633 → 48334 [ACK] Seq=169 Ack=89 Win=853 Len=0 TSval=3434326 TSecr=22004452
253 0.031598717 172.31.31.144 -> 172.31.23.72 OpenFlow 170 Type: OFPT_FLOW_MOD
254 0.031600283 172.31.31.144 -> 172.31.23.72 OpenFlow 178 Type: OFPT_BARRIER_REQUEST
255 0.031601571 172.31.31.144 -> 172.31.23.72 OpenFlow 170 Type: OFPT_FLOW_MOD
256 0.031603119 172.31.31.144 -> 172.31.23.72 OpenFlow 178 Type: OFPT_BARRIER_REQUEST
257 0.031604603 172.31.31.144 -> 172.31.23.72 OpenFlow 170 Type: OFPT_FLOW_MOD
258 0.031605894 172.31.31.144 -> 172.31.23.72 OpenFlow 170 Type: OFPT_FLOW_MOD
259 0.031607364 172.31.31.144 -> 172.31.23.72 TCP 66 6633 → 48358 [ACK] Seq=169 Ack=169 Win=853 Len=0 TSval=3434326 TSecr=22004452
260 0.031609161 172.31.31.144 -> 172.31.23.72 OpenFlow 170 Type: OFPT_FLOW_MOD
261 0.031610605 172.31.31.144 -> 172.31.23.72 OpenFlow 170 Type: OFPT_FLOW_MOD
262 0.031623073 172.31.23.72 -> 172.31.31.144 OpenFlow 146 Type: OFPT_FLOW_REMOVED
263 0.031979447 172.31.31.144 -> 172.31.23.72 OpenFlow 170 Type: OFPT_FLOW_MOD
264 0.031983513 172.31.31.144 -> 172.31.23.72 OpenFlow 178 Type: OFPT_BARRIER_REQUEST
265 0.031985689 172.31.31.144 -> 172.31.23.72 OpenFlow 74 Type: OFPT_BARRIER_REQUEST
266 0.031987263 172.31.31.144 -> 172.31.23.72 OpenFlow 178 Type: OFPT_BARRIER_REQUEST
267 0.031988742 172.31.31.144 -> 172.31.23.72 OpenFlow 74 Type: OFPT_BARRIER_REQUEST
268 0.031989859 172.31.31.144 -> 172.31.23.72 OpenFlow 274 Type: OFPT_FLOW_MOD
269 0.031991699 172.31.31.144 -> 172.31.23.72 OpenFlow 170 Type: OFPT_FLOW_MOD
270 0.031993172 172.31.31.144 -> 172.31.23.72 OpenFlow 170 Type: OFPT_FLOW_MOD
271 0.031995427 172.31.31.144 -> 172.31.23.72 OpenFlow 178 Type: OFPT_BARRIER_REQUEST
272 0.031996875 172.31.31.144 -> 172.31.23.72 OpenFlow 170 Type: OFPT_FLOW_MOD
273 0.031998509 172.31.31.144 -> 172.31.23.72 OpenFlow 74 Type: OFPT_BARRIER_REQUEST
274 0.031999859 172.31.31.144 -> 172.31.23.72 OpenFlow 74 Type: OFPT_BARRIER_REQUEST
275 0.032001465 172.31.31.144 -> 172.31.23.72 OpenFlow 170 Type: OFPT_FLOW_MOD
276 0.032003701 172.31.31.144 -> 172.31.23.72 TCP 66 6633 → 48326 [ACK] Seq=169 Ack=169 Win=853 Len=0 TSval=3434326 TSecr=22004452
277 0.032006014 172.31.31.144 -> 172.31.23.72 OpenFlow 170 Type: OFPT_FLOW_MOD
278 0.032007603 172.31.31.144 -> 172.31.23.72 OpenFlow 170 Type: OFPT_FLOW_MOD
279 0.032009139 172.31.31.144 -> 172.31.23.72 OpenFlow 178 Type: OFPT_BARRIER_REQUEST
280 0.032010406 172.31.31.144 -> 172.31.23.72 OpenFlow 74 Type: OFPT_BARRIER_REQUEST
281 0.032012095 172.31.31.144 -> 172.31.23.72 OpenFlow 170 Type: OFPT_FLOW_MOD
282 0.032014236 172.31.31.144 -> 172.31.23.72 OpenFlow 170 Type: OFPT_FLOW_MOD
283 0.032015760 172.31.31.144 -> 172.31.23.72 OpenFlow 178 Type: OFPT_BARRIER_REQUEST
284 0.032017029 172.31.31.144 -> 172.31.23.72 OpenFlow 178 Type: OFPT_BARRIER_REQUEST
285 0.032018413 172.31.31.144 -> 172.31.23.72 OpenFlow 170 Type: OFPT_FLOW_MOD
286 0.032026913 172.31.31.144 -> 172.31.23.72 TCP 66 6633 → 48332 [ACK] Seq=169 Ack=89 Win=853 Len=0 TSval=3434326 TSecr=22004452
287 0.032028970 172.31.31.144 -> 172.31.23.72 OpenFlow 170 Type: OFPT_FLOW_MOD
288 0.032030433 172.31.31.144 -> 172.31.23.72 OpenFlow 170 Type: OFPT_FLOW_MOD
289 0.032031989 172.31.31.144 -> 172.31.23.72 OpenFlow 170 Type: OFPT_FLOW_MOD
290 0.032080987 172.31.31.144 -> 172.31.23.72 OpenFlow 170 Type: OFPT_FLOW_MOD
291 0.032107293 172.31.31.144 -> 172.31.23.72 OpenFlow 178 Type: OFPT_BARRIER_REQUEST
292 0.032153384 172.31.31.144 -> 172.31.23.72 OpenFlow 74 Type: OFPT_BARRIER_REQUEST
293 0.032155254 172.31.31.144 -> 172.31.23.72 OpenFlow 170 Type: OFPT_FLOW_MOD
294 0.032157882 172.31.31.144 -> 172.31.23.72 OpenFlow 170 Type: OFPT_FLOW_MOD
295 0.032182269 172.31.31.144 -> 172.31.23.72 OpenFlow 170 Type: OFPT_FLOW_MOD
296 0.032200184 172.31.31.144 -> 172.31.23.72 OpenFlow 170 Type: OFPT_FLOW_MOD
297 0.032219149 172.31.31.144 -> 172.31.23.72 OpenFlow 170 Type: OFPT_FLOW_MOD
298 0.032238682 172.31.31.144 -> 172.31.23.72 OpenFlow 74 Type: OFPT_BARRIER_REQUEST
299 0.032256908 172.31.31.144 -> 172.31.23.72 OpenFlow 282 Type: OFPT_FLOW_MOD
300 0.032275392 172.31.31.144 -> 172.31.23.72 OpenFlow 170 Type: OFPT_FLOW_MOD
301 0.032294235 172.31.31.144 -> 172.31.23.72 TCP 66 6633 → 48362 [ACK] Seq=1561 Ack=1433 Win=853 Len=0 TSval=3434326 TSecr=22004452
302 0.032312635 172.31.31.144 -> 172.31.23.72 OpenFlow 178 Type: OFPT_BARRIER_REQUEST
303 0.032331610 172.31.31.144 -> 172.31.23.72 OpenFlow 74 Type: OFPT_BARRIER_REQUEST
304 0.032350323 172.31.31.144 -> 172.31.23.72 OpenFlow 170 Type: OFPT_FLOW_MOD
305 0.032369607 172.31.31.144 -> 172.31.23.72 OpenFlow 170 Type: OFPT_FLOW_MOD
306 0.032398025 172.31.31.144 -> 172.31.23.72 TCP 66 6633 → 48320 [ACK] Seq=553 Ack=337 Win=853 Len=0 TSval=3434326 TSecr=22004452
307 0.032429995 172.31.31.144 -> 172.31.23.72 OpenFlow 170 Type: OFPT_FLOW_MOD
308 0.032447839 172.31.31.144 -> 172.31.23.72 TCP 170 6633 → 48346 [PSH, ACK] Seq=217 Ack=1 Win=853 Len=104 TSval=3434326 TSecr=22003760
309 0.032467055 172.31.31.144 -> 172.31.23.72 OpenFlow 170 Type: OFPT_FLOW_MOD
310 0.032486110 172.31.31.144 -> 172.31.23.72 TCP 170 6633 → 48346 [PSH, ACK] Seq=321 Ack=1 Win=853 Len=104 TSval=3434326 TSecr=22003760
311 0.032504981 172.31.31.144 -> 172.31.23.72 OpenFlow 170 Type: OFPT_FLOW_MOD
312 0.032523560 172.31.31.144 -> 172.31.23.72 OpenFlow 74 Type: OFPT_BARRIER_REQUEST
313 0.032541653 172.31.31.144 -> 172.31.23.72 OpenFlow 170 Type: OFPT_FLOW_MOD
314 0.032560779 172.31.31.144 -> 172.31.23.72 OpenFlow 74 Type: OFPT_BARRIER_REQUEST
315 0.032579899 172.31.31.144 -> 172.31.23.72 OpenFlow 170 Type: OFPT_FLOW_MOD
316 0.032599952 172.31.31.144 -> 172.31.23.72 OpenFlow 170 Type: OFPT_FLOW_MOD
317 0.032617751 172.31.31.144 -> 172.31.23.72 TCP 170 6633 → 48354 [PSH, ACK] Seq=217 Ack=1 Win=853 Len=104 TSval=3434326 TSecr=22003760
318 0.032636964 172.31.31.144 -> 172.31.23.72 TCP 74 6633 → 48346 [PSH, ACK] Seq=425 Ack=1 Win=853 Len=8 TSval=3434326 TSecr=22003760
319 0.032656032 172.31.31.144 -> 172.31.23.72 OpenFlow 178 Type: OFPT_BARRIER_REQUEST
320 0.032674174 172.31.31.144 -> 172.31.23.72 OpenFlow 170 Type: OFPT_FLOW_MOD
321 0.032704482 172.31.31.144 -> 172.31.23.72 TCP 178 6633 → 48354 [PSH, ACK] Seq=321 Ack=1 Win=853 Len=112 TSval=3434326 TSecr=22003760
322 0.032723988 172.31.31.144 -> 172.31.23.72 OpenFlow 170 Type: OFPT_FLOW_MOD
323 0.032742318 172.31.31.144 -> 172.31.23.72 OpenFlow 178 Type: OFPT_FLOW_MOD
324 0.032771985 172.31.31.144 -> 172.31.23.72 OpenFlow 170 Type: OFPT_FLOW_MOD
325 0.032790509 172.31.31.144 -> 172.31.23.72 OpenFlow 170 Type: OFPT_FLOW_MOD
326 0.032810770 172.31.31.144 -> 172.31.23.72 OpenFlow 170 Type: OFPT_FLOW_MOD
327 0.032830548 172.31.31.144 -> 172.31.23.72 OpenFlow 170 Type: OFPT_FLOW_MOD
328 0.032848605 172.31.31.144 -> 172.31.23.72 OpenFlow 170 Type: OFPT_FLOW_MOD
329 0.032866819 172.31.31.144 -> 172.31.23.72 OpenFlow 74 Type: OFPT_BARRIER_REQUEST
330 0.032886886 172.31.31.144 -> 172.31.23.72 OpenFlow 170 Type: OFPT_FLOW_MOD
331 0.032905405 172.31.31.144 -> 172.31.23.72 OpenFlow 170 Type: OFPT_FLOW_MOD
332 0.032924846 172.31.31.144 -> 172.31.23.72 OpenFlow 178 Type: OFPT_BARRIER_REQUEST
333 0.032937398 172.31.23.72 -> 172.31.31.144 OpenFlow 74 Type: OFPT_BARRIER_REPLY
334 0.032946792 172.31.31.144 -> 172.31.23.72 OpenFlow 178 Type: OFPT_BARRIER_REQUEST
335 0.032959887 172.31.31.144 -> 172.31.23.72 OpenFlow 170 Type: OFPT_FLOW_MOD
336 0.032979481 172.31.23.72 -> 172.31.31.144 OpenFlow 74 Type: OFPT_BARRIER_REPLY
337 0.033005934 172.31.31.144 -> 172.31.23.72 OpenFlow 170 Type: OFPT_FLOW_MOD
338 0.033009624 172.31.31.144 -> 172.31.23.72 OpenFlow 170 Type: OFPT_FLOW_MOD
339 0.033024726 172.31.23.72 -> 172.31.31.144 OpenFlow 74 Type: OFPT_BARRIER_REPLY
340 0.033042877 172.31.31.144 -> 172.31.23.72 OpenFlow 74 Type: OFPT_BARRIER_REQUEST
341 0.033046109 172.31.31.144 -> 172.31.23.72 TCP 170 6633 → 48354 [PSH, ACK] Seq=433 Ack=1 Win=853 Len=104 TSval=3434326 TSecr=22003760
342 0.033056151 172.31.23.72 -> 172.31.31.144 OpenFlow 74 Type: OFPT_BARRIER_REPLY
343 0.033081701 172.31.31.144 -> 172.31.23.72 OpenFlow 394 Type: OFPT_BARRIER_REQUEST
344 0.033085285 172.31.31.144 -> 172.31.23.72 OpenFlow 74 Type: OFPT_BARRIER_REQUEST
345 0.033103254 172.31.23.72 -> 172.31.31.144 OpenFlow 74 Type: OFPT_BARRIER_REPLY
346 0.033126471 172.31.31.144 -> 172.31.23.72 OpenFlow 170 Type: OFPT_FLOW_MOD
347 0.033131141 172.31.31.144 -> 172.31.23.72 OpenFlow 170 Type: OFPT_FLOW_MOD
348 0.033133226 172.31.31.144 -> 172.31.23.72 TCP 178 6633 → 48354 [PSH, ACK] Seq=537 Ack=1 Win=853 Len=112 TSval=3434327 TSecr=22003760
349 0.033156682 172.31.31.144 -> 172.31.23.72 OpenFlow 610 Type: OFPT_BARRIER_REQUEST
350 0.033160110 172.31.31.144 -> 172.31.23.72 OpenFlow 170 Type: OFPT_FLOW_MOD
351 0.033175366 172.31.31.144 -> 172.31.23.72 OpenFlow 170 Type: OFPT_FLOW_MOD
352 0.033182540 172.31.23.72 -> 172.31.31.144 OpenFlow 74 Type: OFPT_BARRIER_REPLY
353 0.033199461 172.31.31.144 -> 172.31.23.72 OpenFlow 178 Type: OFPT_BARRIER_REQUEST
354 0.033222738 172.31.23.72 -> 172.31.31.144 TCP 66 48340 → 6633 [ACK] Seq=169 Ack=385 Win=213 Len=0 TSval=22004453 TSecr=3434326
355 0.033233658 172.31.31.144 -> 172.31.23.72 OpenFlow 170 Type: OFPT_FLOW_MOD
356 0.033238624 172.31.23.72 -> 172.31.31.144 OpenFlow 74 Type: OFPT_BARRIER_REPLY
357 0.033243910 172.31.31.144 -> 172.31.23.72 OpenFlow 170 Type: OFPT_FLOW_MOD
358 0.033269170 172.31.23.72 -> 172.31.31.144 OpenFlow 74 Type: OFPT_BARRIER_REPLY
359 0.033320338 172.31.31.144 -> 172.31.23.72 OpenFlow 170 Type: OFPT_FLOW_MOD
360 0.033324428 172.31.31.144 -> 172.31.23.72 OpenFlow 170 Type: OFPT_FLOW_MOD
361 0.033326683 172.31.31.144 -> 172.31.23.72 OpenFlow 170 Type: OFPT_FLOW_MOD
362 0.033331343 172.31.23.72 -> 172.31.31.144 OpenFlow 90 Type: OFPT_BARRIER_REPLY
363 0.033349440 172.31.23.72 -> 172.31.31.144 TCP 66 48324 → 6633 [ACK] Seq=169 Ack=385 Win=213 Len=0 TSval=22004453 TSecr=3434326
364 0.033354930 172.31.31.144 -> 172.31.23.72 OpenFlow 170 Type: OFPT_FLOW_MOD
365 0.033358329 172.31.31.144 -> 172.31.23.72 TCP 66 6633 → 48348 [ACK] Seq=337 Ack=337 Win=853 Len=0 TSval=3434327 TSecr=22004452
366 0.033364505 172.31.23.72 -> 172.31.31.144 OpenFlow 74 Type: OFPT_BARRIER_REPLY
367 0.033391986 172.31.23.72 -> 172.31.31.144 TCP 66 48350 → 6633 [ACK] Seq=1177 Ack=1393 Win=213 Len=0 TSval=22004453 TSecr=3434326
368 0.033396775 172.31.23.72 -> 172.31.31.144 OpenFlow 74 Type: OFPT_BARRIER_REPLY
369 0.033444694 172.31.23.72 -> 172.31.31.144 OpenFlow 74 Type: OFPT_BARRIER_REPLY
370 0.033450083 172.31.31.144 -> 172.31.23.72 OpenFlow 170 Type: OFPT_FLOW_MOD
371 0.033452772 172.31.31.144 -> 172.31.23.72 OpenFlow 170 Type: OFPT_FLOW_MOD
372 0.033454291 172.31.31.144 -> 172.31.23.72 OpenFlow 170 Type: OFPT_FLOW_MOD
373 0.033456051 172.31.31.144 -> 172.31.23.72 OpenFlow 170 Type: OFPT_FLOW_MOD
374 0.033517656 172.31.23.72 -> 172.31.31.144 OpenFlow 74 Type: OFPT_BARRIER_REPLY
375 0.033545687 172.31.31.144 -> 172.31.23.72 OpenFlow 170 Type: OFPT_FLOW_MOD
376 0.033549066 172.31.31.144 -> 172.31.23.72 OpenFlow 170 Type: OFPT_FLOW_MOD
377 0.033551754 172.31.31.144 -> 172.31.23.72 OpenFlow 170 Type: OFPT_FLOW_MOD
378 0.033553195 172.31.31.144 -> 172.31.23.72 OpenFlow 170 Type: OFPT_FLOW_MOD
379 0.033554745 172.31.31.144 -> 172.31.23.72 OpenFlow 274 Type: OFPT_FLOW_MOD
380 0.033556162 172.31.31.144 -> 172.31.23.72 OpenFlow 170 Type: OFPT_FLOW_MOD
381 0.033581580 172.31.23.72 -> 172.31.31.144 OpenFlow 82 Type: OFPT_BARRIER_REPLY
382 0.033587279 172.31.23.72 -> 172.31.31.144 OpenFlow 82 Type: OFPT_BARRIER_REPLY
383 0.033602989 172.31.23.72 -> 172.31.31.144 OpenFlow 74 Type: OFPT_BARRIER_REPLY
384 0.033617225 172.31.31.144 -> 172.31.23.72 OpenFlow 170 Type: OFPT_FLOW_MOD
385 0.033620149 172.31.31.144 -> 172.31.23.72 OpenFlow 170 Type: OFPT_FLOW_MOD
386 0.033621515 172.31.31.144 -> 172.31.23.72 OpenFlow 170 Type: OFPT_FLOW_MOD
387 0.033624181 172.31.31.144 -> 172.31.23.72 OpenFlow 170 Type: OFPT_FLOW_MOD
388 0.033664183 172.31.23.72 -> 172.31.31.144 OpenFlow 74 Type: OFPT_BARRIER_REPLY
389 0.033715685 172.31.23.72 -> 172.31.31.144 OpenFlow 74 Type: OFPT_BARRIER_REPLY
390 0.033718249 172.31.23.72 -> 172.31.31.144 OpenFlow 74 Type: OFPT_BARRIER_REPLY
391 0.033724861 172.31.31.144 -> 172.31.23.72 TCP 66 6633 → 48346 [ACK] Seq=433 Ack=9 Win=853 Len=0 TSval=3434327 TSecr=22004452
392 0.033727985 172.31.31.144 -> 172.31.23.72 TCP 66 6633 → 48346 [ACK] Seq=433 Ack=17 Win=853 Len=0 TSval=3434327 TSecr=22004452
393 0.033729996 172.31.31.144 -> 172.31.23.72 OpenFlow 170 Type: OFPT_FLOW_MOD
394 0.033732082 172.31.31.144 -> 172.31.23.72 TCP 66 6633 → 48342 [ACK] Seq=1209 Ack=689 Win=853 Len=0 TSval=3434327 TSecr=22004452
395 0.033734079 172.31.31.144 -> 172.31.23.72 TCP 66 6633 → 48326 [ACK] Seq=705 Ack=185 Win=853 Len=0 TSval=3434327 TSecr=22004452
396 0.033736015 172.31.31.144 -> 172.31.23.72 TCP 66 6633 → 48340 [ACK] Seq=385 Ack=177 Win=853 Len=0 TSval=3434327 TSecr=22004452
397 0.033767521 172.31.23.72 -> 172.31.31.144 OpenFlow 74 Type: OFPT_BARRIER_REPLY
398 0.033780906 172.31.23.72 -> 172.31.31.144 OpenFlow 74 Type: OFPT_BARRIER_REPLY
399 0.033826073 172.31.23.72 -> 172.31.31.144 OpenFlow 74 Type: OFPT_BARRIER_REPLY
400 0.033833129 172.31.31.144 -> 172.31.23.72 TCP 66 6633 → 48330 [ACK] Seq=2161 Ack=705 Win=853 Len=0 TSval=3434327 TSecr=22004453
401 0.033847474 172.31.31.144 -> 172.31.23.72 TCP 66 6633 → 48324 [ACK] Seq=385 Ack=177 Win=853 Len=0 TSval=3434327 TSecr=22004452
