  1 0.000000000 172.31.31.144 -> 172.31.23.72 TCP 90 6633 → 45434 [PSH, ACK] Seq=1 Ack=1 Win=853 Len=24 TSval=821365 TSecr=19390882
  2 0.000042198 172.31.31.144 -> 172.31.23.72 TCP 122 6633 → 45434 [PSH, ACK] Seq=25 Ack=1 Win=853 Len=56 TSval=821365 TSecr=19390882
  3 0.000412553 172.31.23.72 -> 172.31.31.144 OpenFlow 754 Type: OFPT_MULTIPART_REPLY, OFPMP_PORT_STATS
  4 0.000526703 172.31.23.72 -> 172.31.31.144 OpenFlow 3466 Type: OFPT_MULTIPART_REPLY, OFPMP_FLOW
  5 0.000647374 172.31.31.144 -> 172.31.23.72 TCP 66 6633 → 45434 [ACK] Seq=81 Ack=689 Win=853 Len=0 TSval=821366 TSecr=19391490
  6 0.000744161 172.31.31.144 -> 172.31.23.72 TCP 66 6633 → 45434 [ACK] Seq=81 Ack=4089 Win=853 Len=0 TSval=821366 TSecr=19391490
  7 0.001159098 172.31.31.144 -> 172.31.23.72 OpenFlow 82 Type: OFPT_MULTIPART_REQUEST, OFPMP_TABLE
  8 0.001384957 172.31.23.72 -> 172.31.31.144 OpenFlow 6178 Type: OFPT_MULTIPART_REPLY, OFPMP_TABLE
  9 0.038392572 172.31.31.144 -> 172.31.23.72 TCP 90 6633 → 45436 [PSH, ACK] Seq=1 Ack=1 Win=853 Len=24 TSval=821375 TSecr=19390858
 10 0.038426776 172.31.31.144 -> 172.31.23.72 TCP 82 6633 → 45436 [PSH, ACK] Seq=25 Ack=1 Win=853 Len=16 TSval=821375 TSecr=19390858
 11 0.038430828 172.31.31.144 -> 172.31.23.72 TCP 122 6633 → 45436 [PSH, ACK] Seq=41 Ack=1 Win=853 Len=56 TSval=821375 TSecr=19390858
 12 0.038688702 172.31.23.72 -> 172.31.31.144 OpenFlow 642 Type: OFPT_MULTIPART_REPLY, OFPMP_PORT_STATS
 13 0.038876380 172.31.23.72 -> 172.31.31.144 OpenFlow 6178 Type: OFPT_MULTIPART_REPLY, OFPMP_TABLE
 14 0.038938959 172.31.31.144 -> 172.31.23.72 TCP 66 6633 → 45436 [ACK] Seq=97 Ack=577 Win=853 Len=0 TSval=821375 TSecr=19391500
 15 0.038957819 172.31.23.72 -> 172.31.31.144 OpenFlow 1802 Type: OFPT_MULTIPART_REPLY, OFPMP_FLOW
 16 0.039075709 172.31.31.144 -> 172.31.23.72 TCP 66 6633 → 45436 [ACK] Seq=97 Ack=6689 Win=853 Len=0 TSval=821375 TSecr=19391500
 17 0.039141821 172.31.31.144 -> 172.31.23.72 TCP 66 6633 → 45436 [ACK] Seq=97 Ack=8425 Win=853 Len=0 TSval=821375 TSecr=19391500
 18 0.040205318 172.31.31.144 -> 172.31.23.72 TCP 66 6633 → 45434 [ACK] Seq=97 Ack=10201 Win=853 Len=0 TSval=821376 TSecr=19391490
 19 0.072543255 172.31.31.144 -> 172.31.23.72 TCP 90 6633 → 45438 [PSH, ACK] Seq=1 Ack=1 Win=853 Len=24 TSval=821384 TSecr=19390882
 20 0.072567546 172.31.31.144 -> 172.31.23.72 TCP 122 6633 → 45438 [PSH, ACK] Seq=25 Ack=1 Win=853 Len=56 TSval=821384 TSecr=19390882
 21 0.072868818 172.31.23.72 -> 172.31.31.144 OpenFlow 642 Type: OFPT_MULTIPART_REPLY, OFPMP_PORT_STATS
 22 0.073487832 172.31.23.72 -> 172.31.31.144 OpenFlow 1386 Type: OFPT_MULTIPART_REPLY, OFPMP_FLOW
 23 0.073632438 172.31.31.144 -> 172.31.23.72 TCP 66 6633 → 45438 [ACK] Seq=81 Ack=577 Win=853 Len=0 TSval=821384 TSecr=19391508
 24 0.073663836 172.31.31.144 -> 172.31.23.72 OpenFlow 82 Type: OFPT_MULTIPART_REQUEST, OFPMP_TABLE
 25 0.073913972 172.31.23.72 -> 172.31.31.144 OpenFlow 6178 Type: OFPT_MULTIPART_REPLY, OFPMP_TABLE
 26 0.074177098 172.31.31.144 -> 172.31.23.72 TCP 66 6633 → 45438 [ACK] Seq=97 Ack=8009 Win=853 Len=0 TSval=821384 TSecr=19391508
 27 0.171137365 172.31.31.144 -> 172.31.23.72 TCP 90 6633 → 45442 [PSH, ACK] Seq=1 Ack=1 Win=853 Len=24 TSval=821408 TSecr=19390882
 28 0.171180552 172.31.31.144 -> 172.31.23.72 TCP 138 6633 → 45442 [PSH, ACK] Seq=25 Ack=1 Win=853 Len=72 TSval=821408 TSecr=19390882
 29 0.171554231 172.31.23.72 -> 172.31.31.144 OpenFlow 530 Type: OFPT_MULTIPART_REPLY, OFPMP_PORT_STATS
 30 0.171661593 172.31.23.72 -> 172.31.31.144 OpenFlow 2842 Type: OFPT_MULTIPART_REPLY, OFPMP_FLOW
 31 0.171835157 172.31.23.72 -> 172.31.31.144 OpenFlow 6178 Type: OFPT_MULTIPART_REPLY, OFPMP_TABLE
 32 0.171864083 172.31.31.144 -> 172.31.23.72 TCP 66 6633 → 45442 [ACK] Seq=97 Ack=3241 Win=853 Len=0 TSval=821408 TSecr=19391533
 33 0.208279134 172.31.31.144 -> 172.31.23.72 TCP 66 6633 → 45442 [ACK] Seq=97 Ack=9353 Win=853 Len=0 TSval=821418 TSecr=19391533
 34 0.232306927 172.31.31.144 -> 172.31.23.72 TCP 82 6633 → 45444 [PSH, ACK] Seq=1 Ack=1 Win=853 Len=16 TSval=821424 TSecr=19390882
 35 0.232346255 172.31.23.72 -> 172.31.31.144 TCP 66 45444 → 6633 [ACK] Seq=1 Ack=17 Win=213 Len=0 TSval=19391548 TSecr=821424
 36 0.232370442 172.31.31.144 -> 172.31.23.72 TCP 146 6633 → 45444 [PSH, ACK] Seq=17 Ack=1 Win=853 Len=80 TSval=821424 TSecr=19390882
 37 0.232380226 172.31.23.72 -> 172.31.31.144 TCP 66 45444 → 6633 [ACK] Seq=1 Ack=97 Win=213 Len=0 TSval=19391548 TSecr=821424
 38 0.232759375 172.31.23.72 -> 172.31.31.144 OpenFlow 6178 Type: OFPT_MULTIPART_REPLY, OFPMP_TABLE
 39 0.232865271 172.31.23.72 -> 172.31.31.144 OpenFlow 3674 Type: OFPT_MULTIPART_REPLY, OFPMP_FLOW
 40 0.232985280 172.31.23.72 -> 172.31.31.144 OpenFlow 754 Type: OFPT_MULTIPART_REPLY, OFPMP_PORT_STATS
 41 0.233084565 172.31.31.144 -> 172.31.23.72 TCP 66 6633 → 45444 [ACK] Seq=97 Ack=6113 Win=853 Len=0 TSval=821424 TSecr=19391548
 42 0.233145490 172.31.31.144 -> 172.31.23.72 TCP 66 6633 → 45444 [ACK] Seq=97 Ack=9721 Win=853 Len=0 TSval=821424 TSecr=19391548
 43 0.233282715 172.31.31.144 -> 172.31.23.72 TCP 66 6633 → 45444 [ACK] Seq=97 Ack=10409 Win=853 Len=0 TSval=821424 TSecr=19391548
 44 0.270504420 172.31.31.144 -> 172.31.23.72 TCP 82 6633 → 45446 [PSH, ACK] Seq=1 Ack=1 Win=853 Len=16 TSval=821433 TSecr=19390882
 45 0.270548096 172.31.31.144 -> 172.31.23.72 TCP 146 6633 → 45446 [PSH, ACK] Seq=17 Ack=1 Win=853 Len=80 TSval=821433 TSecr=19390882
 46 0.270958088 172.31.23.72 -> 172.31.31.144 OpenFlow 6178 Type: OFPT_MULTIPART_REPLY, OFPMP_TABLE
 47 0.271087580 172.31.23.72 -> 172.31.31.144 OpenFlow 754 Type: OFPT_MULTIPART_REPLY, OFPMP_PORT_STATS
 48 0.271158927 172.31.23.72 -> 172.31.31.144 OpenFlow 2010 Type: OFPT_MULTIPART_REPLY, OFPMP_FLOW
 49 0.271257278 172.31.31.144 -> 172.31.23.72 TCP 66 6633 → 45446 [ACK] Seq=97 Ack=6113 Win=853 Len=0 TSval=821433 TSecr=19391558
 50 0.271297184 172.31.31.144 -> 172.31.23.72 TCP 66 6633 → 45446 [ACK] Seq=97 Ack=6801 Win=853 Len=0 TSval=821433 TSecr=19391558
 51 0.271353849 172.31.31.144 -> 172.31.23.72 TCP 66 6633 → 45446 [ACK] Seq=97 Ack=8745 Win=853 Len=0 TSval=821433 TSecr=19391558
 52 0.322726418 172.31.31.144 -> 172.31.23.72 TCP 122 6633 → 45448 [PSH, ACK] Seq=1 Ack=1 Win=853 Len=56 TSval=821446 TSecr=19390882
 53 0.322757599 172.31.31.144 -> 172.31.23.72 TCP 106 6633 → 45448 [PSH, ACK] Seq=57 Ack=1 Win=853 Len=40 TSval=821446 TSecr=19390882
 54 0.323090025 172.31.23.72 -> 172.31.31.144 OpenFlow 554 Type: OFPT_MULTIPART_REPLY, OFPMP_FLOW
 55 0.323190694 172.31.23.72 -> 172.31.31.144 OpenFlow 530 Type: OFPT_MULTIPART_REPLY, OFPMP_PORT_STATS
 56 0.323375698 172.31.23.72 -> 172.31.31.144 OpenFlow 6178 Type: OFPT_MULTIPART_REPLY, OFPMP_TABLE
 57 0.323466810 172.31.31.144 -> 172.31.23.72 TCP 66 6633 → 45448 [ACK] Seq=97 Ack=953 Win=853 Len=0 TSval=821446 TSecr=19391571
 58 0.360211476 172.31.31.144 -> 172.31.23.72 TCP 66 6633 → 45448 [ACK] Seq=97 Ack=7065 Win=853 Len=0 TSval=821456 TSecr=19391571
 59 0.378900688 172.31.31.144 -> 172.31.23.72 TCP 82 6633 → 45450 [PSH, ACK] Seq=1 Ack=1 Win=853 Len=16 TSval=821460 TSecr=19390867
 60 0.378943849 172.31.23.72 -> 172.31.31.144 TCP 66 45450 → 6633 [ACK] Seq=1 Ack=17 Win=213 Len=0 TSval=19391585 TSecr=821460
 61 0.378969104 172.31.31.144 -> 172.31.23.72 TCP 146 6633 → 45450 [PSH, ACK] Seq=17 Ack=1 Win=853 Len=80 TSval=821460 TSecr=19390867
 62 0.378975939 172.31.23.72 -> 172.31.31.144 TCP 66 45450 → 6633 [ACK] Seq=1 Ack=97 Win=213 Len=0 TSval=19391585 TSecr=821460
 63 0.379371101 172.31.23.72 -> 172.31.31.144 OpenFlow 6178 Type: OFPT_MULTIPART_REPLY, OFPMP_TABLE
 64 0.379453041 172.31.23.72 -> 172.31.31.144 OpenFlow 2010 Type: OFPT_MULTIPART_REPLY, OFPMP_FLOW
 65 0.379547968 172.31.23.72 -> 172.31.31.144 OpenFlow 530 Type: OFPT_MULTIPART_REPLY, OFPMP_PORT_STATS
 66 0.379637134 172.31.31.144 -> 172.31.23.72 TCP 66 6633 → 45450 [ACK] Seq=97 Ack=8057 Win=853 Len=0 TSval=821460 TSecr=19391585
 67 0.416206562 172.31.31.144 -> 172.31.23.72 TCP 66 6633 → 45450 [ACK] Seq=97 Ack=8521 Win=853 Len=0 TSval=821470 TSecr=19391585
 68 0.439267684 172.31.31.144 -> 172.31.23.72 TCP 82 6633 → 45452 [PSH, ACK] Seq=1 Ack=1 Win=853 Len=16 TSval=821475 TSecr=19390882
 69 0.439294847 172.31.31.144 -> 172.31.23.72 TCP 146 6633 → 45452 [PSH, ACK] Seq=17 Ack=1 Win=853 Len=80 TSval=821475 TSecr=19390882
 70 0.439671818 172.31.23.72 -> 172.31.31.144 OpenFlow 6178 Type: OFPT_MULTIPART_REPLY, OFPMP_TABLE
 71 0.439796169 172.31.23.72 -> 172.31.31.144 OpenFlow 642 Type: OFPT_MULTIPART_REPLY, OFPMP_PORT_STATS
 72 0.439870182 172.31.23.72 -> 172.31.31.144 OpenFlow 2010 Type: OFPT_MULTIPART_REPLY, OFPMP_FLOW
 73 0.439989800 172.31.31.144 -> 172.31.23.72 TCP 66 6633 → 45452 [ACK] Seq=97 Ack=6113 Win=853 Len=0 TSval=821475 TSecr=19391600
 74 0.440021330 172.31.31.144 -> 172.31.23.72 TCP 66 6633 → 45452 [ACK] Seq=97 Ack=6689 Win=853 Len=0 TSval=821475 TSecr=19391600
 75 0.440096249 172.31.31.144 -> 172.31.23.72 TCP 66 6633 → 45452 [ACK] Seq=97 Ack=8633 Win=853 Len=0 TSval=821475 TSecr=19391600
 76 0.463902954 172.31.31.144 -> 172.31.23.72 OpenFlow 187 Type: OFPT_PACKET_OUT
 77 0.463925951 172.31.31.144 -> 172.31.23.72 OpenFlow 187 Type: OFPT_PACKET_OUT
 78 0.463942302 172.31.31.144 -> 172.31.23.72 OpenFlow 187 Type: OFPT_PACKET_OUT
 79 0.463975368 172.31.31.144 -> 172.31.23.72 OpenFlow 187 Type: OFPT_PACKET_OUT
 80 0.464036442 172.31.31.144 -> 172.31.23.72 OpenFlow 187 Type: OFPT_PACKET_OUT
 81 0.464088367 172.31.31.144 -> 172.31.23.72 OpenFlow 187 Type: OFPT_PACKET_OUT
 82 0.464154749 172.31.31.144 -> 172.31.23.72 OpenFlow 187 Type: OFPT_PACKET_OUT
 83 0.464256712 172.31.31.144 -> 172.31.23.72 OpenFlow 187 Type: OFPT_PACKET_OUT
 84 0.464441957 172.31.31.144 -> 172.31.23.72 TCP 187 6633 → 45462 [PSH, ACK] Seq=1 Ack=1 Win=853 Len=121 TSval=821482 TSecr=19390882
 85 0.464450061 172.31.31.144 -> 172.31.23.72 TCP 187 6633 → 45462 [PSH, ACK] Seq=122 Ack=1 Win=853 Len=121 TSval=821482 TSecr=19390882
 86 0.464452164 172.31.31.144 -> 172.31.23.72 TCP 187 6633 → 45462 [PSH, ACK] Seq=243 Ack=1 Win=853 Len=121 TSval=821482 TSecr=19390882
 87 0.464459479 172.31.23.72 -> 172.31.31.144 TCP 66 45452 → 6633 [ACK] Seq=8633 Ack=1065 Win=213 Len=0 TSval=19391606 TSecr=821481
 88 0.464506773 172.31.31.144 -> 172.31.23.72 TCP 187 6633 → 45462 [PSH, ACK] Seq=364 Ack=1 Win=853 Len=121 TSval=821482 TSecr=19390882
 89 0.464553942 172.31.31.144 -> 172.31.23.72 TCP 187 6633 → 45462 [PSH, ACK] Seq=485 Ack=1 Win=853 Len=121 TSval=821482 TSecr=19390882
 90 0.464613938 172.31.31.144 -> 172.31.23.72 TCP 187 6633 → 45462 [PSH, ACK] Seq=606 Ack=1 Win=853 Len=121 TSval=821482 TSecr=19390882
 91 0.464775935 172.31.31.144 -> 172.31.23.72 OpenFlow 187 Type: OFPT_PACKET_OUT
 92 0.464801554 172.31.23.72 -> 172.31.31.144 TCP 66 45462 → 6633 [ACK] Seq=1 Ack=727 Win=213 Len=0 TSval=19391606 TSecr=821482
 93 0.464812615 172.31.31.144 -> 172.31.23.72 OpenFlow 187 Type: OFPT_PACKET_OUT
 94 0.464873969 172.31.31.144 -> 172.31.23.72 OpenFlow 187 Type: OFPT_PACKET_OUT
 95 0.464931009 172.31.31.144 -> 172.31.23.72 OpenFlow 187 Type: OFPT_PACKET_OUT
 96 0.464989007 172.31.31.144 -> 172.31.23.72 OpenFlow 187 Type: OFPT_PACKET_OUT
 97 0.465054010 172.31.31.144 -> 172.31.23.72 OpenFlow 187 Type: OFPT_PACKET_OUT
 98 0.465110780 172.31.31.144 -> 172.31.23.72 OpenFlow 187 Type: OFPT_PACKET_OUT
 99 0.465153430 172.31.31.144 -> 172.31.23.72 OpenFlow 187 Type: OFPT_PACKET_OUT
100 0.465253576 172.31.23.72 -> 172.31.31.144 TCP 66 45436 → 6633 [ACK] Seq=8425 Ack=1065 Win=213 Len=0 TSval=19391606 TSecr=821482
101 0.465336611 172.31.23.72 -> 172.31.31.144 OpenFlow 189 Type: OFPT_PACKET_IN
102 0.465363471 172.31.23.72 -> 172.31.31.144 OpenFlow 189 Type: OFPT_PACKET_IN
103 0.465382550 172.31.23.72 -> 172.31.31.144 OpenFlow 189 Type: OFPT_PACKET_IN
104 0.465409449 172.31.23.72 -> 172.31.31.144 OpenFlow 189 Type: OFPT_PACKET_IN
105 0.465431782 172.31.23.72 -> 172.31.31.144 OpenFlow 189 Type: OFPT_PACKET_IN
106 0.465434202 172.31.23.72 -> 172.31.31.144 OpenFlow 189 Type: OFPT_PACKET_IN
107 0.465448857 172.31.23.72 -> 172.31.31.144 OpenFlow 189 Type: OFPT_PACKET_IN
108 0.465453810 172.31.23.72 -> 172.31.31.144 OpenFlow 435 Type: OFPT_PACKET_IN
109 0.465483612 172.31.23.72 -> 172.31.31.144 OpenFlow 189 Type: OFPT_PACKET_IN
110 0.465486195 172.31.23.72 -> 172.31.31.144 OpenFlow 189 Type: OFPT_PACKET_IN
111 0.465544831 172.31.23.72 -> 172.31.31.144 OpenFlow 189 Type: OFPT_PACKET_IN
112 0.465551217 172.31.23.72 -> 172.31.31.144 OpenFlow 189 Type: OFPT_PACKET_IN
113 0.465553591 172.31.23.72 -> 172.31.31.144 OpenFlow 189 Type: OFPT_PACKET_IN
114 0.465569126 172.31.23.72 -> 172.31.31.144 OpenFlow 189 Type: OFPT_PACKET_IN
115 0.465583554 172.31.23.72 -> 172.31.31.144 OpenFlow 189 Type: OFPT_PACKET_IN
116 0.465600355 172.31.31.144 -> 172.31.23.72 TCP 66 6633 → 45434 [ACK] Seq=97 Ack=10324 Win=853 Len=0 TSval=821482 TSecr=19391606
117 0.465606767 172.31.31.144 -> 172.31.23.72 TCP 66 6633 → 45434 [ACK] Seq=97 Ack=10447 Win=853 Len=0 TSval=821482 TSecr=19391606
118 0.465650271 172.31.23.72 -> 172.31.31.144 OpenFlow 189 Type: OFPT_PACKET_IN
119 0.465687920 172.31.23.72 -> 172.31.31.144 OpenFlow 189 Type: OFPT_PACKET_IN
120 0.465689930 172.31.23.72 -> 172.31.31.144 OpenFlow 189 Type: OFPT_PACKET_IN
121 0.465734674 172.31.31.144 -> 172.31.23.72 TCP 66 6633 → 45444 [ACK] Seq=97 Ack=10532 Win=853 Len=0 TSval=821482 TSecr=19391606
122 0.465739633 172.31.31.144 -> 172.31.23.72 TCP 66 6633 → 45450 [ACK] Seq=97 Ack=8644 Win=853 Len=0 TSval=821482 TSecr=19391606
123 0.465753548 172.31.31.144 -> 172.31.23.72 TCP 66 6633 → 45444 [ACK] Seq=97 Ack=10655 Win=853 Len=0 TSval=821482 TSecr=19391606
124 0.465755497 172.31.31.144 -> 172.31.23.72 TCP 66 6633 → 45438 [ACK] Seq=97 Ack=8501 Win=853 Len=0 TSval=821482 TSecr=19391606
125 0.465757976 172.31.31.144 -> 172.31.23.72 TCP 66 6633 → 45432 [ACK] Seq=1 Ack=124 Win=853 Len=0 TSval=821482 TSecr=19391606
126 0.465814975 172.31.31.144 -> 172.31.23.72 TCP 66 6633 → 45450 [ACK] Seq=97 Ack=8767 Win=853 Len=0 TSval=821482 TSecr=19391606
127 0.465817197 172.31.31.144 -> 172.31.23.72 TCP 66 6633 → 45432 [ACK] Seq=1 Ack=247 Win=853 Len=0 TSval=821482 TSecr=19391607
128 0.465818793 172.31.31.144 -> 172.31.23.72 TCP 66 6633 → 45448 [ACK] Seq=97 Ack=7188 Win=853 Len=0 TSval=821482 TSecr=19391607
129 0.465842416 172.31.31.144 -> 172.31.23.72 TCP 66 6633 → 45442 [ACK] Seq=97 Ack=9476 Win=853 Len=0 TSval=821482 TSecr=19391607
130 0.465890149 172.31.31.144 -> 172.31.23.72 TCP 66 6633 → 45448 [ACK] Seq=97 Ack=7311 Win=853 Len=0 TSval=821482 TSecr=19391607
131 0.465918091 172.31.31.144 -> 172.31.23.72 TCP 66 6633 → 45442 [ACK] Seq=97 Ack=9599 Win=853 Len=0 TSval=821482 TSecr=19391607
132 0.466055450 172.31.31.144 -> 172.31.23.72 TCP 66 6633 → 45430 [ACK] Seq=1 Ack=247 Win=853 Len=0 TSval=821482 TSecr=19391606
133 0.466107286 172.31.31.144 -> 172.31.23.72 TCP 66 6633 → 45454 [ACK] Seq=1 Ack=247 Win=853 Len=0 TSval=821482 TSecr=19391607
134 0.498373705 172.31.31.144 -> 172.31.23.72 OpenFlow 82 Type: OFPT_MULTIPART_REQUEST, OFPMP_TABLE
135 0.498396786 172.31.31.144 -> 172.31.23.72 OpenFlow 146 Type: OFPT_MULTIPART_REQUEST, OFPMP_PORT_STATS
136 0.498819759 172.31.23.72 -> 172.31.31.144 OpenFlow 6178 Type: OFPT_MULTIPART_REPLY, OFPMP_TABLE
137 0.498897158 172.31.23.72 -> 172.31.31.144 OpenFlow 2010 Type: OFPT_MULTIPART_REPLY, OFPMP_FLOW
138 0.499013171 172.31.23.72 -> 172.31.31.144 OpenFlow 642 Type: OFPT_MULTIPART_REPLY, OFPMP_PORT_STATS
139 0.499099338 172.31.31.144 -> 172.31.23.72 TCP 66 6633 → 45454 [ACK] Seq=97 Ack=8303 Win=853 Len=0 TSval=821490 TSecr=19391615
140 0.536210067 172.31.31.144 -> 172.31.23.72 TCP 66 6633 → 45454 [ACK] Seq=97 Ack=8879 Win=853 Len=0 TSval=821500 TSecr=19391615
141 0.563482750 172.31.31.144 -> 172.31.23.72 TCP 187 6633 → 45420 [PSH, ACK] Seq=1 Ack=1 Win=853 Len=121 TSval=821506 TSecr=19391406
142 0.563529575 172.31.31.144 -> 172.31.23.72 TCP 187 6633 → 45420 [PSH, ACK] Seq=122 Ack=1 Win=853 Len=121 TSval=821506 TSecr=19391406
143 0.563566095 172.31.31.144 -> 172.31.23.72 TCP 187 6633 → 45420 [PSH, ACK] Seq=243 Ack=1 Win=853 Len=121 TSval=821506 TSecr=19391406
144 0.563594048 172.31.31.144 -> 172.31.23.72 TCP 90 6633 → 45456 [PSH, ACK] Seq=1 Ack=1 Win=853 Len=24 TSval=821506 TSecr=19391181
145 0.563619456 172.31.31.144 -> 172.31.23.72 TCP 187 6633 → 45420 [PSH, ACK] Seq=364 Ack=1 Win=853 Len=121 TSval=821506 TSecr=19391406
146 0.563644586 172.31.31.144 -> 172.31.23.72 TCP 138 6633 → 45456 [PSH, ACK] Seq=25 Ack=1 Win=853 Len=72 TSval=821506 TSecr=19391181
147 0.563744187 172.31.31.144 -> 172.31.23.72 TCP 187 6633 → 45420 [PSH, ACK] Seq=485 Ack=1 Win=853 Len=121 TSval=821506 TSecr=19391406
148 0.563843923 172.31.31.144 -> 172.31.23.72 TCP 187 6633 → 45420 [PSH, ACK] Seq=606 Ack=1 Win=853 Len=121 TSval=821506 TSecr=19391406
149 0.563871413 172.31.31.144 -> 172.31.23.72 TCP 187 6633 → 45420 [PSH, ACK] Seq=727 Ack=1 Win=853 Len=121 TSval=821506 TSecr=19391406
150 0.563914048 172.31.31.144 -> 172.31.23.72 TCP 187 6633 → 45420 [PSH, ACK] Seq=848 Ack=1 Win=853 Len=121 TSval=821506 TSecr=19391406
151 0.563989712 172.31.31.144 -> 172.31.23.72 TCP 187 6633 → 45424 [PSH, ACK] Seq=1 Ack=1 Win=853 Len=121 TSval=821506 TSecr=19391426
152 0.564052617 172.31.31.144 -> 172.31.23.72 TCP 187 6633 → 45424 [PSH, ACK] Seq=122 Ack=1 Win=853 Len=121 TSval=821506 TSecr=19391426
153 0.564125917 172.31.31.144 -> 172.31.23.72 TCP 187 6633 → 45424 [PSH, ACK] Seq=243 Ack=1 Win=853 Len=121 TSval=821507 TSecr=19391426
154 0.564168445 172.31.23.72 -> 172.31.31.144 TCP 66 45420 → 6633 [ACK] Seq=1 Ack=969 Win=213 Len=0 TSval=19391631 TSecr=821506
155 0.564211950 172.31.31.144 -> 172.31.23.72 TCP 187 6633 → 45424 [PSH, ACK] Seq=364 Ack=1 Win=853 Len=121 TSval=821507 TSecr=19391426
156 0.564265305 172.31.31.144 -> 172.31.23.72 TCP 187 6633 → 45424 [PSH, ACK] Seq=485 Ack=1 Win=853 Len=121 TSval=821507 TSecr=19391426
157 0.564348024 172.31.31.144 -> 172.31.23.72 TCP 187 6633 → 45424 [PSH, ACK] Seq=606 Ack=1 Win=853 Len=121 TSval=821507 TSecr=19391426
158 0.564412119 172.31.31.144 -> 172.31.23.72 TCP 187 6633 → 45424 [PSH, ACK] Seq=727 Ack=1 Win=853 Len=121 TSval=821507 TSecr=19391426
159 0.564505997 172.31.31.144 -> 172.31.23.72 TCP 187 6633 → 45424 [PSH, ACK] Seq=848 Ack=1 Win=853 Len=121 TSval=821507 TSecr=19391426
160 0.564535659 172.31.31.144 -> 172.31.23.72 TCP 187 6633 → 45424 [PSH, ACK] Seq=969 Ack=1 Win=853 Len=121 TSval=821507 TSecr=19391426
161 0.564598967 172.31.31.144 -> 172.31.23.72 TCP 187 6633 → 45424 [PSH, ACK] Seq=1090 Ack=1 Win=853 Len=121 TSval=821507 TSecr=19391426
162 0.564680600 172.31.31.144 -> 172.31.23.72 OpenFlow 187 Type: OFPT_PACKET_OUT
163 0.564704056 172.31.31.144 -> 172.31.23.72 OpenFlow 187 Type: OFPT_PACKET_OUT
164 0.564728889 172.31.23.72 -> 172.31.31.144 TCP 66 45424 → 6633 [ACK] Seq=1 Ack=1211 Win=213 Len=0 TSval=19391631 TSecr=821506
165 0.564760043 172.31.31.144 -> 172.31.23.72 OpenFlow 187 Type: OFPT_PACKET_OUT
166 0.564818840 172.31.23.72 -> 172.31.31.144 OpenFlow 189 Type: OFPT_PACKET_IN
167 0.564825751 172.31.31.144 -> 172.31.23.72 OpenFlow 187 Type: OFPT_PACKET_OUT
168 0.564841161 172.31.23.72 -> 172.31.31.144 OpenFlow 189 Type: OFPT_PACKET_IN
169 0.564869825 172.31.31.144 -> 172.31.23.72 OpenFlow 187 Type: OFPT_PACKET_OUT
170 0.564890204 172.31.23.72 -> 172.31.31.144 OpenFlow 189 Type: OFPT_PACKET_IN
171 0.564909963 172.31.23.72 -> 172.31.31.144 OpenFlow 189 Type: OFPT_PACKET_IN
172 0.564918615 172.31.23.72 -> 172.31.31.144 OpenFlow 189 Type: OFPT_PACKET_IN
173 0.564935633 172.31.23.72 -> 172.31.31.144 OpenFlow 189 Type: OFPT_PACKET_IN
174 0.564941027 172.31.23.72 -> 172.31.31.144 OpenFlow 189 Type: OFPT_PACKET_IN
175 0.564984063 172.31.31.144 -> 172.31.23.72 OpenFlow 187 Type: OFPT_PACKET_OUT
176 0.564987705 172.31.31.144 -> 172.31.23.72 TCP 66 6633 → 45418 [ACK] Seq=1 Ack=124 Win=853 Len=0 TSval=821507 TSecr=19391631
177 0.565008801 172.31.23.72 -> 172.31.31.144 OpenFlow 189 Type: OFPT_PACKET_IN
178 0.565031929 172.31.31.144 -> 172.31.23.72 TCP 66 6633 → 45418 [ACK] Seq=1 Ack=247 Win=853 Len=0 TSval=821507 TSecr=19391631
179 0.565056965 172.31.31.144 -> 172.31.23.72 OpenFlow 187 Type: OFPT_PACKET_OUT
180 0.565059699 172.31.31.144 -> 172.31.23.72 TCP 66 6633 → 45428 [ACK] Seq=1 Ack=124 Win=853 Len=0 TSval=821507 TSecr=19391631
181 0.565087949 172.31.31.144 -> 172.31.23.72 OpenFlow 187 Type: OFPT_PACKET_OUT
182 0.565114157 172.31.31.144 -> 172.31.23.72 TCP 66 6633 → 45416 [ACK] Seq=1 Ack=124 Win=853 Len=0 TSval=821507 TSecr=19391631
183 0.565136799 172.31.23.72 -> 172.31.31.144 OpenFlow 642 Type: OFPT_MULTIPART_REPLY, OFPMP_PORT_STATS
184 0.565144835 172.31.31.144 -> 172.31.23.72 TCP 66 6633 → 45430 [ACK] Seq=1 Ack=493 Win=853 Len=0 TSval=821507 TSecr=19391631
185 0.565183345 172.31.31.144 -> 172.31.23.72 OpenFlow 187 Type: OFPT_PACKET_OUT
186 0.565195045 172.31.31.144 -> 172.31.23.72 TCP 66 6633 → 45428 [ACK] Seq=1 Ack=247 Win=853 Len=0 TSval=821507 TSecr=19391631
187 0.565229368 172.31.31.144 -> 172.31.23.72 TCP 66 6633 → 45416 [ACK] Seq=1 Ack=247 Win=853 Len=0 TSval=821507 TSecr=19391631
188 0.565256559 172.31.31.144 -> 172.31.23.72 OpenFlow 187 Type: OFPT_PACKET_OUT
189 0.565351663 172.31.23.72 -> 172.31.31.144 OpenFlow 6178 Type: OFPT_MULTIPART_REPLY, OFPMP_TABLE
190 0.565420553 172.31.23.72 -> 172.31.31.144 OpenFlow 1802 Type: OFPT_MULTIPART_REPLY, OFPMP_FLOW
191 0.565445677 172.31.23.72 -> 172.31.31.144 OpenFlow 189 Type: OFPT_PACKET_IN
192 0.565470503 172.31.23.72 -> 172.31.31.144 OpenFlow 189 Type: OFPT_PACKET_IN
193 0.565517248 172.31.23.72 -> 172.31.31.144 OpenFlow 189 Type: OFPT_PACKET_IN
194 0.565535875 172.31.23.72 -> 172.31.31.144 OpenFlow 189 Type: OFPT_PACKET_IN
195 0.565590413 172.31.31.144 -> 172.31.23.72 TCP 66 6633 → 45456 [ACK] Seq=97 Ack=8425 Win=853 Len=0 TSval=821507 TSecr=19391631
196 0.565599329 172.31.23.72 -> 172.31.31.144 OpenFlow 189 Type: OFPT_PACKET_IN
197 0.565604919 172.31.23.72 -> 172.31.31.144 OpenFlow 189 Type: OFPT_PACKET_IN
198 0.565676530 172.31.31.144 -> 172.31.23.72 OpenFlow 187 Type: OFPT_PACKET_OUT
199 0.565681356 172.31.31.144 -> 172.31.23.72 OpenFlow 187 Type: OFPT_PACKET_OUT
200 0.565683923 172.31.31.144 -> 172.31.23.72 OpenFlow 187 Type: OFPT_PACKET_OUT
201 0.565704169 172.31.23.72 -> 172.31.31.144 OpenFlow 189 Type: OFPT_PACKET_IN
202 0.565733268 172.31.31.144 -> 172.31.23.72 OpenFlow 187 Type: OFPT_PACKET_OUT
203 0.565737299 172.31.31.144 -> 172.31.23.72 TCP 66 6633 → 45426 [ACK] Seq=1 Ack=124 Win=853 Len=0 TSval=821507 TSecr=19391632
204 0.565742536 172.31.23.72 -> 172.31.31.144 OpenFlow 189 Type: OFPT_PACKET_IN
205 0.565756909 172.31.31.144 -> 172.31.23.72 TCP 66 6633 → 45422 [ACK] Seq=1 Ack=124 Win=853 Len=0 TSval=821507 TSecr=19391632
206 0.565780857 172.31.31.144 -> 172.31.23.72 OpenFlow 187 Type: OFPT_PACKET_OUT
207 0.565812998 172.31.31.144 -> 172.31.23.72 TCP 66 6633 → 45426 [ACK] Seq=1 Ack=247 Win=853 Len=0 TSval=821507 TSecr=19391632
208 0.565835357 172.31.31.144 -> 172.31.23.72 TCP 66 6633 → 45422 [ACK] Seq=1 Ack=247 Win=853 Len=0 TSval=821507 TSecr=19391632
209 0.565866212 172.31.31.144 -> 172.31.23.72 OpenFlow 187 Type: OFPT_PACKET_OUT
210 0.565938524 172.31.31.144 -> 172.31.23.72 TCP 66 6633 → 45434 [ACK] Seq=1307 Ack=10693 Win=853 Len=0 TSval=821507 TSecr=19391632
211 0.565961429 172.31.31.144 -> 172.31.23.72 TCP 66 6633 → 45414 [ACK] Seq=1 Ack=247 Win=853 Len=0 TSval=821507 TSecr=19391631
212 0.565990621 172.31.31.144 -> 172.31.23.72 OpenFlow 187 Type: OFPT_PACKET_OUT
213 0.566021052 172.31.31.144 -> 172.31.23.72 OpenFlow 187 Type: OFPT_PACKET_OUT
214 0.566239083 172.31.31.144 -> 172.31.23.72 OpenFlow 187 Type: OFPT_PACKET_OUT
215 0.566299346 172.31.31.144 -> 172.31.23.72 OpenFlow 187 Type: OFPT_PACKET_OUT
216 0.566310078 172.31.23.72 -> 172.31.31.144 OpenFlow 189 Type: OFPT_PACKET_IN
217 0.566336952 172.31.23.72 -> 172.31.31.144 OpenFlow 189 Type: OFPT_PACKET_IN
218 0.566386214 172.31.31.144 -> 172.31.23.72 OpenFlow 187 Type: OFPT_PACKET_OUT
219 0.566475016 172.31.31.144 -> 172.31.23.72 OpenFlow 187 Type: OFPT_PACKET_OUT
220 0.566494833 172.31.31.144 -> 172.31.23.72 TCP 66 6633 → 45424 [ACK] Seq=1211 Ack=124 Win=853 Len=0 TSval=821507 TSecr=19391632
221 0.566522261 172.31.31.144 -> 172.31.23.72 TCP 66 6633 → 45424 [ACK] Seq=1211 Ack=247 Win=853 Len=0 TSval=821507 TSecr=19391632
222 0.566580159 172.31.31.144 -> 172.31.23.72 OpenFlow 187 Type: OFPT_PACKET_OUT
223 0.566635859 172.31.31.144 -> 172.31.23.72 OpenFlow 187 Type: OFPT_PACKET_OUT
224 0.566701440 172.31.31.144 -> 172.31.23.72 OpenFlow 187 Type: OFPT_PACKET_OUT
225 0.566750773 172.31.23.72 -> 172.31.31.144 TCP 66 45418 → 6633 [ACK] Seq=247 Ack=1211 Win=213 Len=0 TSval=19391632 TSecr=821507
226 0.566773752 172.31.31.144 -> 172.31.23.72 OpenFlow 187 Type: OFPT_PACKET_OUT
227 0.566860701 172.31.31.144 -> 172.31.23.72 OpenFlow 187 Type: OFPT_PACKET_OUT
228 0.566978190 172.31.31.144 -> 172.31.23.72 OpenFlow 187 Type: OFPT_PACKET_OUT
229 0.567003395 172.31.31.144 -> 172.31.23.72 OpenFlow 187 Type: OFPT_PACKET_OUT
230 0.567178714 172.31.23.72 -> 172.31.31.144 TCP 66 45444 → 6633 [ACK] Seq=10655 Ack=1186 Win=213 Len=0 TSval=19391632 TSecr=821507
231 0.567250346 172.31.23.72 -> 172.31.31.144 OpenFlow 189 Type: OFPT_PACKET_IN
232 0.567265156 172.31.23.72 -> 172.31.31.144 OpenFlow 189 Type: OFPT_PACKET_IN
233 0.567281019 172.31.23.72 -> 172.31.31.144 OpenFlow 189 Type: OFPT_PACKET_IN
234 0.567293288 172.31.23.72 -> 172.31.31.144 OpenFlow 189 Type: OFPT_PACKET_IN
235 0.567317449 172.31.23.72 -> 172.31.31.144 OpenFlow 189 Type: OFPT_PACKET_IN
236 0.567331805 172.31.23.72 -> 172.31.31.144 OpenFlow 189 Type: OFPT_PACKET_IN
237 0.567347484 172.31.23.72 -> 172.31.31.144 OpenFlow 189 Type: OFPT_PACKET_IN
238 0.567362383 172.31.23.72 -> 172.31.31.144 OpenFlow 189 Type: OFPT_PACKET_IN
239 0.567374062 172.31.23.72 -> 172.31.31.144 OpenFlow 189 Type: OFPT_PACKET_IN
240 0.567467306 172.31.23.72 -> 172.31.31.144 OpenFlow 189 Type: OFPT_PACKET_IN
241 0.567484350 172.31.23.72 -> 172.31.31.144 OpenFlow 189 Type: OFPT_PACKET_IN
242 0.568102129 172.31.31.144 -> 172.31.23.72 OpenFlow 187 Type: OFPT_PACKET_OUT
243 0.568109648 172.31.31.144 -> 172.31.23.72 OpenFlow 187 Type: OFPT_PACKET_OUT
244 0.568112232 172.31.31.144 -> 172.31.23.72 OpenFlow 187 Type: OFPT_PACKET_OUT
245 0.568114938 172.31.31.144 -> 172.31.23.72 OpenFlow 187 Type: OFPT_PACKET_OUT
246 0.568116734 172.31.31.144 -> 172.31.23.72 OpenFlow 187 Type: OFPT_PACKET_OUT
247 0.568118235 172.31.31.144 -> 172.31.23.72 OpenFlow 187 Type: OFPT_PACKET_OUT
248 0.568119863 172.31.31.144 -> 172.31.23.72 OpenFlow 187 Type: OFPT_PACKET_OUT
249 0.568121602 172.31.31.144 -> 172.31.23.72 OpenFlow 187 Type: OFPT_PACKET_OUT
250 0.568123323 172.31.31.144 -> 172.31.23.72 OpenFlow 187 Type: OFPT_PACKET_OUT
251 0.568124851 172.31.31.144 -> 172.31.23.72 OpenFlow 187 Type: OFPT_PACKET_OUT
252 0.568126510 172.31.31.144 -> 172.31.23.72 OpenFlow 187 Type: OFPT_PACKET_OUT
253 0.568127914 172.31.31.144 -> 172.31.23.72 OpenFlow 187 Type: OFPT_PACKET_OUT
254 0.568131758 172.31.23.72 -> 172.31.31.144 OpenFlow 189 Type: OFPT_PACKET_IN
255 0.568137811 172.31.31.144 -> 172.31.23.72 OpenFlow 187 Type: OFPT_PACKET_OUT
256 0.568139865 172.31.31.144 -> 172.31.23.72 OpenFlow 187 Type: OFPT_PACKET_OUT
257 0.568142023 172.31.31.144 -> 172.31.23.72 OpenFlow 187 Type: OFPT_PACKET_OUT
258 0.568256460 172.31.23.72 -> 172.31.31.144 OpenFlow 189 Type: OFPT_PACKET_IN
259 0.568259829 172.31.23.72 -> 172.31.31.144 OpenFlow 189 Type: OFPT_PACKET_IN
260 0.568261469 172.31.23.72 -> 172.31.31.144 OpenFlow 189 Type: OFPT_PACKET_IN
261 0.568263063 172.31.23.72 -> 172.31.31.144 OpenFlow 189 Type: OFPT_PACKET_IN
262 0.568264745 172.31.23.72 -> 172.31.31.144 OpenFlow 435 Type: OFPT_PACKET_IN
263 0.568363738 172.31.31.144 -> 172.31.23.72 OpenFlow 187 Type: OFPT_PACKET_OUT
264 0.568370206 172.31.31.144 -> 172.31.23.72 OpenFlow 187 Type: OFPT_PACKET_OUT
265 0.568372671 172.31.31.144 -> 172.31.23.72 OpenFlow 187 Type: OFPT_PACKET_OUT
266 0.568374180 172.31.31.144 -> 172.31.23.72 OpenFlow 187 Type: OFPT_PACKET_OUT
267 0.568375830 172.31.31.144 -> 172.31.23.72 TCP 66 6633 → 45416 [ACK] Seq=1 Ack=370 Win=853 Len=0 TSval=821508 TSecr=19391632
268 0.568378650 172.31.31.144 -> 172.31.23.72 OpenFlow 187 Type: OFPT_PACKET_OUT
269 0.568380905 172.31.31.144 -> 172.31.23.72 TCP 66 6633 → 45446 [ACK] Seq=97 Ack=8868 Win=853 Len=0 TSval=821508 TSecr=19391632
270 0.568387606 172.31.23.72 -> 172.31.31.144 OpenFlow 189 Type: OFPT_PACKET_IN
271 0.568395031 172.31.23.72 -> 172.31.31.144 OpenFlow 189 Type: OFPT_PACKET_IN
272 0.568396935 172.31.23.72 -> 172.31.31.144 OpenFlow 435 Type: OFPT_PACKET_IN
273 0.568398684 172.31.23.72 -> 172.31.31.144 OpenFlow 189 Type: OFPT_PACKET_IN
274 0.568495677 172.31.31.144 -> 172.31.23.72 TCP 66 6633 → 45450 [ACK] Seq=823 Ack=8890 Win=853 Len=0 TSval=821508 TSecr=19391632
275 0.568501131 172.31.31.144 -> 172.31.23.72 TCP 66 6633 → 45454 [ACK] Seq=97 Ack=9002 Win=853 Len=0 TSval=821508 TSecr=19391632
276 0.568503339 172.31.31.144 -> 172.31.23.72 TCP 66 6633 → 45442 [ACK] Seq=97 Ack=9722 Win=853 Len=0 TSval=821508 TSecr=19391632
277 0.568505165 172.31.31.144 -> 172.31.23.72 TCP 66 6633 → 45426 [ACK] Seq=1 Ack=370 Win=853 Len=0 TSval=821508 TSecr=19391632
278 0.568588960 172.31.31.144 -> 172.31.23.72 TCP 66 6633 → 45422 [ACK] Seq=1 Ack=370 Win=853 Len=0 TSval=821508 TSecr=19391632
279 0.568621757 172.31.31.144 -> 172.31.23.72 TCP 66 6633 → 45436 [ACK] Seq=1065 Ack=8548 Win=853 Len=0 TSval=821508 TSecr=19391632
280 0.568626037 172.31.31.144 -> 172.31.23.72 TCP 66 6633 → 45420 [ACK] Seq=969 Ack=124 Win=853 Len=0 TSval=821508 TSecr=19391632
281 0.568675418 172.31.31.144 -> 172.31.23.72 TCP 66 6633 → 45416 [ACK] Seq=1 Ack=493 Win=853 Len=0 TSval=821508 TSecr=19391632
282 0.568680573 172.31.31.144 -> 172.31.23.72 TCP 66 6633 → 45446 [ACK] Seq=97 Ack=8991 Win=853 Len=0 TSval=821508 TSecr=19391632
283 0.568709902 172.31.31.144 -> 172.31.23.72 TCP 66 6633 → 45454 [ACK] Seq=97 Ack=9125 Win=853 Len=0 TSval=821508 TSecr=19391632
284 0.568725898 172.31.31.144 -> 172.31.23.72 OpenFlow 187 Type: OFPT_PACKET_OUT
285 0.568754282 172.31.31.144 -> 172.31.23.72 TCP 66 6633 → 45442 [ACK] Seq=97 Ack=10091 Win=853 Len=0 TSval=821508 TSecr=19391632
286 0.568763349 172.31.23.72 -> 172.31.31.144 TCP 66 45438 → 6633 [ACK] Seq=8501 Ack=1065 Win=213 Len=0 TSval=19391632 TSecr=821507
287 0.568776103 172.31.31.144 -> 172.31.23.72 TCP 66 6633 → 45426 [ACK] Seq=1 Ack=493 Win=853 Len=0 TSval=821508 TSecr=19391632
288 0.568809818 172.31.31.144 -> 172.31.23.72 TCP 66 6633 → 45422 [ACK] Seq=1 Ack=493 Win=853 Len=0 TSval=821508 TSecr=19391632
289 0.568837753 172.31.31.144 -> 172.31.23.72 TCP 66 6633 → 45436 [ACK] Seq=1065 Ack=8917 Win=853 Len=0 TSval=821508 TSecr=19391632
290 0.568863770 172.31.31.144 -> 172.31.23.72 TCP 66 6633 → 45420 [ACK] Seq=969 Ack=247 Win=853 Len=0 TSval=821508 TSecr=19391632
291 0.568891010 172.31.31.144 -> 172.31.23.72 TCP 66 6633 → 45450 [ACK] Seq=823 Ack=9013 Win=853 Len=0 TSval=821508 TSecr=19391632
292 0.569012255 172.31.23.72 -> 172.31.31.144 TCP 66 45450 → 6633 [ACK] Seq=9013 Ack=823 Win=213 Len=0 TSval=19391632 TSecr=821507
293 0.569265777 172.31.23.72 -> 172.31.31.144 TCP 66 45430 → 6633 [ACK] Seq=739 Ack=727 Win=213 Len=0 TSval=19391632 TSecr=821507
294 0.569347941 172.31.31.144 -> 172.31.23.72 OpenFlow 187 Type: OFPT_PACKET_OUT
295 0.569354301 172.31.23.72 -> 172.31.31.144 OpenFlow 189 Type: OFPT_PACKET_IN
296 0.569375758 172.31.23.72 -> 172.31.31.144 OpenFlow 189 Type: OFPT_PACKET_IN
297 0.569399499 172.31.23.72 -> 172.31.31.144 OpenFlow 189 Type: OFPT_PACKET_IN
298 0.569404763 172.31.31.144 -> 172.31.23.72 OpenFlow 187 Type: OFPT_PACKET_OUT
299 0.569435977 172.31.23.72 -> 172.31.31.144 OpenFlow 189 Type: OFPT_PACKET_IN
300 0.569444499 172.31.31.144 -> 172.31.23.72 OpenFlow 429 Type: OFPT_PACKET_OUT
301 0.569522615 172.31.31.144 -> 172.31.23.72 OpenFlow 187 Type: OFPT_PACKET_OUT
302 0.569561593 172.31.23.72 -> 172.31.31.144 OpenFlow 189 Type: OFPT_PACKET_IN
303 0.569580362 172.31.23.72 -> 172.31.31.144 OpenFlow 189 Type: OFPT_PACKET_IN
304 0.569591722 172.31.23.72 -> 172.31.31.144 OpenFlow 189 Type: OFPT_PACKET_IN
305 0.569606618 172.31.23.72 -> 172.31.31.144 OpenFlow 189 Type: OFPT_PACKET_IN
306 0.569621348 172.31.23.72 -> 172.31.31.144 OpenFlow 189 Type: OFPT_PACKET_IN
307 0.569629369 172.31.31.144 -> 172.31.23.72 OpenFlow 187 Type: OFPT_PACKET_OUT
308 0.569706127 172.31.31.144 -> 172.31.23.72 OpenFlow 187 Type: OFPT_PACKET_OUT
309 0.569774340 172.31.31.144 -> 172.31.23.72 OpenFlow 187 Type: OFPT_PACKET_OUT
310 0.569831044 172.31.23.72 -> 172.31.31.144 TCP 66 45430 → 6633 [ACK] Seq=739 Ack=1211 Win=213 Len=0 TSval=19391633 TSecr=821508
311 0.569865433 172.31.31.144 -> 172.31.23.72 OpenFlow 187 Type: OFPT_PACKET_OUT
312 0.570078326 172.31.23.72 -> 172.31.31.144 OpenFlow 189 Type: OFPT_PACKET_IN
313 0.570085417 172.31.23.72 -> 172.31.31.144 OpenFlow 435 Type: OFPT_PACKET_IN
314 0.570087341 172.31.23.72 -> 172.31.31.144 OpenFlow 189 Type: OFPT_PACKET_IN
315 0.570088924 172.31.23.72 -> 172.31.31.144 OpenFlow 189 Type: OFPT_PACKET_IN
316 0.570090586 172.31.23.72 -> 172.31.31.144 OpenFlow 189 Type: OFPT_PACKET_IN
317 0.570092360 172.31.23.72 -> 172.31.31.144 OpenFlow 189 Type: OFPT_PACKET_IN
318 0.570125624 172.31.23.72 -> 172.31.31.144 TCP 66 45428 → 6633 [ACK] Seq=247 Ack=727 Win=213 Len=0 TSval=19391633 TSecr=821508
319 0.570128734 172.31.23.72 -> 172.31.31.144 OpenFlow 189 Type: OFPT_PACKET_IN
320 0.570130619 172.31.23.72 -> 172.31.31.144 OpenFlow 189 Type: OFPT_PACKET_IN
321 0.570208747 172.31.31.144 -> 172.31.23.72 OpenFlow 187 Type: OFPT_PACKET_OUT
322 0.570214540 172.31.31.144 -> 172.31.23.72 OpenFlow 187 Type: OFPT_PACKET_OUT
323 0.570216946 172.31.31.144 -> 172.31.23.72 OpenFlow 187 Type: OFPT_PACKET_OUT
324 0.570218479 172.31.31.144 -> 172.31.23.72 TCP 66 6633 → 45446 [ACK] Seq=97 Ack=9114 Win=853 Len=0 TSval=821508 TSecr=19391632
325 0.570221474 172.31.31.144 -> 172.31.23.72 TCP 66 6633 → 45432 [ACK] Seq=1 Ack=370 Win=853 Len=0 TSval=821508 TSecr=19391632
326 0.570225041 172.31.23.72 -> 172.31.31.144 OpenFlow 312 Type: OFPT_PACKET_IN
327 0.570230977 172.31.31.144 -> 172.31.23.72 OpenFlow 187 Type: OFPT_PACKET_OUT
328 0.570232973 172.31.31.144 -> 172.31.23.72 TCP 66 6633 → 45426 [ACK] Seq=1 Ack=616 Win=853 Len=0 TSval=821508 TSecr=19391632
329 0.570234937 172.31.31.144 -> 172.31.23.72 TCP 66 6633 → 45462 [ACK] Seq=727 Ack=124 Win=853 Len=0 TSval=821508 TSecr=19391633
330 0.570237032 172.31.31.144 -> 172.31.23.72 OpenFlow 187 Type: OFPT_PACKET_OUT
331 0.570320388 172.31.23.72 -> 172.31.31.144 OpenFlow 312 Type: OFPT_PACKET_IN
332 0.570384584 172.31.23.72 -> 172.31.31.144 OpenFlow 189 Type: OFPT_PACKET_IN
333 0.570397794 172.31.23.72 -> 172.31.31.144 OpenFlow 189 Type: OFPT_PACKET_IN
334 0.570408646 172.31.23.72 -> 172.31.31.144 OpenFlow 189 Type: OFPT_PACKET_IN
335 0.570433605 172.31.31.144 -> 172.31.23.72 TCP 66 6633 → 45456 [ACK] Seq=97 Ack=8671 Win=853 Len=0 TSval=821508 TSecr=19391632
336 0.570438328 172.31.31.144 -> 172.31.23.72 TCP 66 6633 → 45436 [ACK] Seq=1065 Ack=9040 Win=853 Len=0 TSval=821508 TSecr=19391633
337 0.570440997 172.31.23.72 -> 172.31.31.144 OpenFlow 189 Type: OFPT_PACKET_IN
338 0.570446815 172.31.31.144 -> 172.31.23.72 TCP 66 6633 → 45424 [ACK] Seq=1211 Ack=370 Win=853 Len=0 TSval=821508 TSecr=19391633
339 0.570448877 172.31.31.144 -> 172.31.23.72 TCP 66 6633 → 45434 [ACK] Seq=1307 Ack=10816 Win=853 Len=0 TSval=821508 TSecr=19391633
340 0.570451004 172.31.23.72 -> 172.31.31.144 OpenFlow 189 Type: OFPT_PACKET_IN
341 0.570452808 172.31.31.144 -> 172.31.23.72 OpenFlow 187 Type: OFPT_PACKET_OUT
342 0.570455171 172.31.31.144 -> 172.31.23.72 TCP 66 6633 → 45446 [ACK] Seq=97 Ack=9237 Win=853 Len=0 TSval=821508 TSecr=19391633
343 0.570457029 172.31.31.144 -> 172.31.23.72 TCP 66 6633 → 45432 [ACK] Seq=1 Ack=739 Win=853 Len=0 TSval=821508 TSecr=19391633
344 0.570459144 172.31.31.144 -> 172.31.23.72 OpenFlow 187 Type: OFPT_PACKET_OUT
345 0.570460710 172.31.31.144 -> 172.31.23.72 TCP 66 6633 → 45426 [ACK] Seq=1 Ack=739 Win=853 Len=0 TSval=821508 TSecr=19391633
346 0.570462496 172.31.31.144 -> 172.31.23.72 TCP 66 6633 → 45462 [ACK] Seq=727 Ack=247 Win=853 Len=0 TSval=821508 TSecr=19391633
347 0.570537800 172.31.23.72 -> 172.31.31.144 OpenFlow 189 Type: OFPT_PACKET_IN
348 0.570579561 172.31.31.144 -> 172.31.23.72 TCP 66 6633 → 45436 [ACK] Seq=1065 Ack=9163 Win=853 Len=0 TSval=821508 TSecr=19391633
349 0.570585353 172.31.31.144 -> 172.31.23.72 OpenFlow 187 Type: OFPT_PACKET_OUT
350 0.570587282 172.31.31.144 -> 172.31.23.72 TCP 66 6633 → 45424 [ACK] Seq=1211 Ack=493 Win=853 Len=0 TSval=821508 TSecr=19391633
351 0.570645848 172.31.31.144 -> 172.31.23.72 TCP 66 6633 → 45432 [ACK] Seq=1 Ack=985 Win=853 Len=0 TSval=821508 TSecr=19391633
352 0.570650961 172.31.31.144 -> 172.31.23.72 TCP 66 6633 → 45426 [ACK] Seq=1 Ack=985 Win=853 Len=0 TSval=821508 TSecr=19391633
353 0.570652704 172.31.31.144 -> 172.31.23.72 TCP 66 6633 → 45436 [ACK] Seq=1065 Ack=9286 Win=853 Len=0 TSval=821508 TSecr=19391633
354 0.570673431 172.31.31.144 -> 172.31.23.72 TCP 66 6633 → 45420 [ACK] Seq=969 Ack=370 Win=853 Len=0 TSval=821508 TSecr=19391633
355 0.570698971 172.31.31.144 -> 172.31.23.72 TCP 66 6633 → 45452 [ACK] Seq=1065 Ack=8879 Win=853 Len=0 TSval=821508 TSecr=19391633
356 0.570726555 172.31.31.144 -> 172.31.23.72 TCP 66 6633 → 45436 [ACK] Seq=1065 Ack=9409 Win=853 Len=0 TSval=821508 TSecr=19391633
357 0.570752502 172.31.31.144 -> 172.31.23.72 TCP 66 6633 → 45420 [ACK] Seq=969 Ack=493 Win=853 Len=0 TSval=821508 TSecr=19391633
358 0.570823258 172.31.31.144 -> 172.31.23.72 TCP 66 6633 → 45434 [ACK] Seq=1307 Ack=11185 Win=853 Len=0 TSval=821508 TSecr=19391633
359 0.570843213 172.31.23.72 -> 172.31.31.144 TCP 66 45416 → 6633 [ACK] Seq=493 Ack=969 Win=213 Len=0 TSval=19391633 TSecr=821508
360 0.570930868 172.31.23.72 -> 172.31.31.144 OpenFlow 189 Type: OFPT_PACKET_IN
361 0.570951161 172.31.23.72 -> 172.31.31.144 OpenFlow 189 Type: OFPT_PACKET_IN
362 0.571071642 172.31.23.72 -> 172.31.31.144 OpenFlow 189 Type: OFPT_PACKET_IN
363 0.571096074 172.31.23.72 -> 172.31.31.144 OpenFlow 189 Type: OFPT_PACKET_IN
364 0.571104956 172.31.31.144 -> 172.31.23.72 TCP 66 6633 → 45414 [ACK] Seq=1 Ack=493 Win=853 Len=0 TSval=821508 TSecr=19391633
365 0.571129261 172.31.23.72 -> 172.31.31.144 OpenFlow 189 Type: OFPT_PACKET_IN
366 0.571134140 172.31.23.72 -> 172.31.31.144 OpenFlow 189 Type: OFPT_PACKET_IN
367 0.571237600 172.31.31.144 -> 172.31.23.72 TCP 66 6633 → 45424 [ACK] Seq=1211 Ack=616 Win=853 Len=0 TSval=821508 TSecr=19391633
368 0.571275093 172.31.31.144 -> 172.31.23.72 TCP 66 6633 → 45424 [ACK] Seq=1211 Ack=739 Win=853 Len=0 TSval=821508 TSecr=19391633
369 0.571298296 172.31.31.144 -> 172.31.23.72 TCP 66 6633 → 45418 [ACK] Seq=1211 Ack=493 Win=853 Len=0 TSval=821508 TSecr=19391633
370 0.605538456 172.31.23.72 -> 172.31.31.144 TCP 66 45444 → 6633 [ACK] Seq=10655 Ack=1307 Win=213 Len=0 TSval=19391642 TSecr=821507
371 0.613847730 172.31.31.144 -> 172.31.23.72 TCP 90 6633 → 45458 [PSH, ACK] Seq=1 Ack=1 Win=853 Len=24 TSval=821519 TSecr=19390892
372 0.613870451 172.31.23.72 -> 172.31.31.144 TCP 66 45458 → 6633 [ACK] Seq=1 Ack=25 Win=213 Len=0 TSval=19391644 TSecr=821519
373 0.613885852 172.31.31.144 -> 172.31.23.72 TCP 138 6633 → 45458 [PSH, ACK] Seq=25 Ack=1 Win=853 Len=72 TSval=821519 TSecr=19390892
374 0.613894267 172.31.23.72 -> 172.31.31.144 TCP 66 45458 → 6633 [ACK] Seq=1 Ack=97 Win=213 Len=0 TSval=19391644 TSecr=821519
375 0.614237287 172.31.23.72 -> 172.31.31.144 OpenFlow 642 Type: OFPT_MULTIPART_REPLY, OFPMP_PORT_STATS
376 0.614350125 172.31.23.72 -> 172.31.31.144 OpenFlow 3258 Type: OFPT_MULTIPART_REPLY, OFPMP_FLOW
377 0.614519201 172.31.23.72 -> 172.31.31.144 OpenFlow 6178 Type: OFPT_MULTIPART_REPLY, OFPMP_TABLE
378 0.614584189 172.31.31.144 -> 172.31.23.72 TCP 66 6633 → 45458 [ACK] Seq=97 Ack=3769 Win=853 Len=0 TSval=821519 TSecr=19391644
379 0.640026293 172.31.31.144 -> 172.31.23.72 TCP 90 6633 → 45460 [PSH, ACK] Seq=1 Ack=1 Win=853 Len=24 TSval=821525 TSecr=19390882
380 0.640050067 172.31.31.144 -> 172.31.23.72 TCP 138 6633 → 45460 [PSH, ACK] Seq=25 Ack=1 Win=853 Len=72 TSval=821525 TSecr=19390882
381 0.640370125 172.31.23.72 -> 172.31.31.144 OpenFlow 530 Type: OFPT_MULTIPART_REPLY, OFPMP_PORT_STATS
382 0.640455151 172.31.23.72 -> 172.31.31.144 OpenFlow 2010 Type: OFPT_MULTIPART_REPLY, OFPMP_FLOW
383 0.640607115 172.31.31.144 -> 172.31.23.72 TCP 66 6633 → 45460 [ACK] Seq=97 Ack=465 Win=853 Len=0 TSval=821526 TSecr=19391650
384 0.640641420 172.31.23.72 -> 172.31.31.144 OpenFlow 6178 Type: OFPT_MULTIPART_REPLY, OFPMP_TABLE
385 0.640651259 172.31.31.144 -> 172.31.23.72 TCP 66 6633 → 45460 [ACK] Seq=97 Ack=2409 Win=853 Len=0 TSval=821526 TSecr=19391650
386 0.640858583 172.31.31.144 -> 172.31.23.72 TCP 66 6633 → 45460 [ACK] Seq=97 Ack=8521 Win=853 Len=0 TSval=821526 TSecr=19391650
387 0.652194432 172.31.31.144 -> 172.31.23.72 TCP 66 6633 → 45458 [ACK] Seq=97 Ack=9881 Win=853 Len=0 TSval=821529 TSecr=19391644
388 0.663838016 172.31.31.144 -> 172.31.23.72 OpenFlow 187 Type: OFPT_PACKET_OUT
389 0.663856694 172.31.31.144 -> 172.31.23.72 OpenFlow 187 Type: OFPT_PACKET_OUT
390 0.663874409 172.31.31.144 -> 172.31.23.72 OpenFlow 187 Type: OFPT_PACKET_OUT
391 0.663944330 172.31.31.144 -> 172.31.23.72 OpenFlow 187 Type: OFPT_PACKET_OUT
392 0.664016010 172.31.31.144 -> 172.31.23.72 OpenFlow 187 Type: OFPT_PACKET_OUT
393 0.664069402 172.31.31.144 -> 172.31.23.72 OpenFlow 187 Type: OFPT_PACKET_OUT
394 0.664216241 172.31.31.144 -> 172.31.23.72 OpenFlow 187 Type: OFPT_PACKET_OUT
395 0.664270113 172.31.31.144 -> 172.31.23.72 OpenFlow 187 Type: OFPT_PACKET_OUT
396 0.664311509 172.31.31.144 -> 172.31.23.72 OpenFlow 187 Type: OFPT_PACKET_OUT
397 0.664355998 172.31.31.144 -> 172.31.23.72 OpenFlow 187 Type: OFPT_PACKET_OUT
398 0.664475338 172.31.31.144 -> 172.31.23.72 OpenFlow 187 Type: OFPT_PACKET_OUT
399 0.664527569 172.31.31.144 -> 172.31.23.72 OpenFlow 187 Type: OFPT_PACKET_OUT
400 0.664560259 172.31.31.144 -> 172.31.23.72 OpenFlow 187 Type: OFPT_PACKET_OUT
401 0.664591548 172.31.31.144 -> 172.31.23.72 OpenFlow 187 Type: OFPT_PACKET_OUT
402 0.664623027 172.31.23.72 -> 172.31.31.144 TCP 66 45446 → 6633 [ACK] Seq=9237 Ack=1307 Win=213 Len=0 TSval=19391656 TSecr=821531
403 0.664670494 172.31.31.144 -> 172.31.23.72 OpenFlow 187 Type: OFPT_PACKET_OUT
404 0.664718811 172.31.31.144 -> 172.31.23.72 OpenFlow 187 Type: OFPT_PACKET_OUT
405 0.664806228 172.31.31.144 -> 172.31.23.72 OpenFlow 187 Type: OFPT_PACKET_OUT
406 0.664857111 172.31.31.144 -> 172.31.23.72 OpenFlow 187 Type: OFPT_PACKET_OUT
407 0.665008076 172.31.31.144 -> 172.31.23.72 OpenFlow 187 Type: OFPT_PACKET_OUT
408 0.665013224 172.31.31.144 -> 172.31.23.72 OpenFlow 187 Type: OFPT_PACKET_OUT
409 0.665027864 172.31.23.72 -> 172.31.31.144 TCP 66 45432 → 6633 [ACK] Seq=985 Ack=969 Win=213 Len=0 TSval=19391656 TSecr=821532
410 0.665072211 172.31.31.144 -> 172.31.23.72 OpenFlow 187 Type: OFPT_PACKET_OUT
411 0.665098461 172.31.31.144 -> 172.31.23.72 OpenFlow 187 Type: OFPT_PACKET_OUT
412 0.665170522 172.31.31.144 -> 172.31.23.72 OpenFlow 187 Type: OFPT_PACKET_OUT
413 0.665220252 172.31.31.144 -> 172.31.23.72 OpenFlow 187 Type: OFPT_PACKET_OUT
414 0.665287510 172.31.23.72 -> 172.31.31.144 TCP 66 45460 → 6633 [ACK] Seq=8521 Ack=823 Win=213 Len=0 TSval=19391656 TSecr=821532
415 0.665354067 172.31.31.144 -> 172.31.23.72 OpenFlow 187 Type: OFPT_PACKET_OUT
416 0.665373421 172.31.23.72 -> 172.31.31.144 OpenFlow 189 Type: OFPT_PACKET_IN
417 0.665385905 172.31.31.144 -> 172.31.23.72 OpenFlow 187 Type: OFPT_PACKET_OUT
418 0.665393959 172.31.23.72 -> 172.31.31.144 OpenFlow 189 Type: OFPT_PACKET_IN
419 0.665422693 172.31.31.144 -> 172.31.23.72 OpenFlow 187 Type: OFPT_PACKET_OUT
420 0.665428601 172.31.23.72 -> 172.31.31.144 OpenFlow 312 Type: OFPT_PACKET_IN
421 0.665510964 172.31.31.144 -> 172.31.23.72 OpenFlow 187 Type: OFPT_PACKET_OUT
422 0.665549664 172.31.31.144 -> 172.31.23.72 TCP 66 6633 → 45458 [ACK] Seq=581 Ack=10004 Win=853 Len=0 TSval=821532 TSecr=19391656
423 0.665582019 172.31.31.144 -> 172.31.23.72 OpenFlow 187 Type: OFPT_PACKET_OUT
424 0.665671027 172.31.23.72 -> 172.31.31.144 TCP 66 45458 → 6633 [ACK] Seq=10373 Ack=702 Win=213 Len=0 TSval=19391657 TSecr=821532
425 0.665710649 172.31.23.72 -> 172.31.31.144 OpenFlow 189 Type: OFPT_PACKET_IN
426 0.665733990 172.31.23.72 -> 172.31.31.144 OpenFlow 435 Type: OFPT_PACKET_IN
427 0.665760198 172.31.23.72 -> 172.31.31.144 OpenFlow 189 Type: OFPT_PACKET_IN
428 0.665780202 172.31.23.72 -> 172.31.31.144 OpenFlow 435 Type: OFPT_PACKET_IN
429 0.665835221 172.31.31.144 -> 172.31.23.72 OpenFlow 187 Type: OFPT_PACKET_OUT
430 0.665862049 172.31.31.144 -> 172.31.23.72 OpenFlow 187 Type: OFPT_PACKET_OUT
431 0.665890147 172.31.31.144 -> 172.31.23.72 OpenFlow 308 Type: OFPT_PACKET_OUT
432 0.665919376 172.31.23.72 -> 172.31.31.144 OpenFlow 189 Type: OFPT_PACKET_IN
433 0.665958053 172.31.23.72 -> 172.31.31.144 OpenFlow 189 Type: OFPT_PACKET_IN
434 0.665967194 172.31.23.72 -> 172.31.31.144 OpenFlow 189 Type: OFPT_PACKET_IN
435 0.665982793 172.31.23.72 -> 172.31.31.144 OpenFlow 189 Type: OFPT_PACKET_IN
436 0.665990525 172.31.31.144 -> 172.31.23.72 OpenFlow 187 Type: OFPT_PACKET_OUT
437 0.665995024 172.31.31.144 -> 172.31.23.72 OpenFlow 187 Type: OFPT_PACKET_OUT
438 0.666016593 172.31.23.72 -> 172.31.31.144 OpenFlow 189 Type: OFPT_PACKET_IN
439 0.666025351 172.31.23.72 -> 172.31.31.144 OpenFlow 189 Type: OFPT_PACKET_IN
440 0.666039602 172.31.23.72 -> 172.31.31.144 OpenFlow 189 Type: OFPT_PACKET_IN
441 0.666063161 172.31.23.72 -> 172.31.31.144 OpenFlow 189 Type: OFPT_PACKET_IN
442 0.666065297 172.31.23.72 -> 172.31.31.144 OpenFlow 435 Type: OFPT_PACKET_IN
443 0.666095088 172.31.31.144 -> 172.31.23.72 TCP 66 6633 → 45448 [ACK] Seq=97 Ack=7434 Win=853 Len=0 TSval=821532 TSecr=19391657
444 0.666100436 172.31.31.144 -> 172.31.23.72 TCP 66 6633 → 45448 [ACK] Seq=97 Ack=7803 Win=853 Len=0 TSval=821532 TSecr=19391657
445 0.666102607 172.31.31.144 -> 172.31.23.72 TCP 66 6633 → 45462 [ACK] Seq=727 Ack=370 Win=853 Len=0 TSval=821532 TSecr=19391657
446 0.666167668 172.31.23.72 -> 172.31.31.144 OpenFlow 189 Type: OFPT_PACKET_IN
447 0.666174970 172.31.23.72 -> 172.31.31.144 OpenFlow 189 Type: OFPT_PACKET_IN
448 0.666183352 172.31.23.72 -> 172.31.31.144 TCP 66 45458 → 6633 [ACK] Seq=10373 Ack=1065 Win=213 Len=0 TSval=19391657 TSecr=821532
449 0.666185503 172.31.23.72 -> 172.31.31.144 OpenFlow 189 Type: OFPT_PACKET_IN
450 0.666226605 172.31.31.144 -> 172.31.23.72 TCP 66 6633 → 45462 [ACK] Seq=727 Ack=493 Win=853 Len=0 TSval=821532 TSecr=19391657
451 0.666232208 172.31.31.144 -> 172.31.23.72 TCP 66 6633 → 45444 [ACK] Seq=1307 Ack=10778 Win=853 Len=0 TSval=821532 TSecr=19391657
452 0.666358777 172.31.23.72 -> 172.31.31.144 TCP 66 45456 → 6633 [ACK] Seq=9163 Ack=460 Win=213 Len=0 TSval=19391657 TSecr=821532
453 0.666432883 172.31.23.72 -> 172.31.31.144 OpenFlow 189 Type: OFPT_PACKET_IN
454 0.666455578 172.31.23.72 -> 172.31.31.144 OpenFlow 189 Type: OFPT_PACKET_IN
455 0.666500104 172.31.31.144 -> 172.31.23.72 TCP 66 6633 → 45444 [ACK] Seq=1307 Ack=10901 Win=853 Len=0 TSval=821532 TSecr=19391657
456 0.666568026 172.31.31.144 -> 172.31.23.72 TCP 66 6633 → 45430 [ACK] Seq=1211 Ack=985 Win=853 Len=0 TSval=821532 TSecr=19391657
457 0.666595009 172.31.31.144 -> 172.31.23.72 TCP 66 6633 → 45428 [ACK] Seq=727 Ack=493 Win=853 Len=0 TSval=821532 TSecr=19391657
458 0.666623202 172.31.31.144 -> 172.31.23.72 TCP 66 6633 → 45454 [ACK] Seq=97 Ack=9248 Win=853 Len=0 TSval=821532 TSecr=19391657
459 0.666637908 172.31.23.72 -> 172.31.31.144 OpenFlow 189 Type: OFPT_PACKET_IN
460 0.666654384 172.31.31.144 -> 172.31.23.72 TCP 66 6633 → 45454 [ACK] Seq=97 Ack=9371 Win=853 Len=0 TSval=821532 TSecr=19391657
461 0.666659127 172.31.23.72 -> 172.31.31.144 OpenFlow 189 Type: OFPT_PACKET_IN
462 0.666679266 172.31.31.144 -> 172.31.23.72 TCP 66 6633 → 45438 [ACK] Seq=1065 Ack=8993 Win=853 Len=0 TSval=821532 TSecr=19391657
463 0.666691521 172.31.23.72 -> 172.31.31.144 OpenFlow 189 Type: OFPT_PACKET_IN
464 0.666703778 172.31.31.144 -> 172.31.23.72 OpenFlow 187 Type: OFPT_PACKET_OUT
465 0.666726894 172.31.31.144 -> 172.31.23.72 OpenFlow 550 Type: OFPT_PACKET_OUT
466 0.666798350 172.31.31.144 -> 172.31.23.72 TCP 66 6633 → 45460 [ACK] Seq=823 Ack=8767 Win=853 Len=0 TSval=821532 TSecr=19391657
467 0.666824396 172.31.31.144 -> 172.31.23.72 OpenFlow 187 Type: OFPT_PACKET_OUT
468 0.666852022 172.31.31.144 -> 172.31.23.72 TCP 66 6633 → 45446 [ACK] Seq=1307 Ack=9483 Win=853 Len=0 TSval=821532 TSecr=19391657
469 0.666923027 172.31.31.144 -> 172.31.23.72 OpenFlow 187 Type: OFPT_PACKET_OUT
470 0.666947679 172.31.23.72 -> 172.31.31.144 TCP 66 45456 → 6633 [ACK] Seq=9163 Ack=1065 Win=213 Len=0 TSval=19391657 TSecr=821532
471 0.666979896 172.31.31.144 -> 172.31.23.72 OpenFlow 187 Type: OFPT_PACKET_OUT
472 0.667103978 172.31.23.72 -> 172.31.31.144 TCP 66 45414 → 6633 [ACK] Seq=493 Ack=364 Win=213 Len=0 TSval=19391657 TSecr=821532
473 0.667115184 172.31.31.144 -> 172.31.23.72 OpenFlow 187 Type: OFPT_PACKET_OUT
474 0.667179928 172.31.31.144 -> 172.31.23.72 OpenFlow 187 Type: OFPT_PACKET_OUT
475 0.667267596 172.31.31.144 -> 172.31.23.72 OpenFlow 187 Type: OFPT_PACKET_OUT
476 0.667291883 172.31.23.72 -> 172.31.31.144 OpenFlow 189 Type: OFPT_PACKET_IN
477 0.667325513 172.31.23.72 -> 172.31.31.144 OpenFlow 189 Type: OFPT_PACKET_IN
478 0.667341302 172.31.23.72 -> 172.31.31.144 OpenFlow 189 Type: OFPT_PACKET_IN
479 0.667344201 172.31.23.72 -> 172.31.31.144 OpenFlow 189 Type: OFPT_PACKET_IN
480 0.667363200 172.31.23.72 -> 172.31.31.144 OpenFlow 189 Type: OFPT_PACKET_IN
481 0.667368172 172.31.23.72 -> 172.31.31.144 OpenFlow 189 Type: OFPT_PACKET_IN
482 0.667435076 172.31.31.144 -> 172.31.23.72 OpenFlow 187 Type: OFPT_PACKET_OUT
483 0.667443172 172.31.23.72 -> 172.31.31.144 OpenFlow 189 Type: OFPT_PACKET_IN
484 0.667461980 172.31.23.72 -> 172.31.31.144 TCP 66 45414 → 6633 [ACK] Seq=493 Ack=727 Win=213 Len=0 TSval=19391657 TSecr=821532
485 0.667493444 172.31.31.144 -> 172.31.23.72 OpenFlow 187 Type: OFPT_PACKET_OUT
486 0.667582304 172.31.23.72 -> 172.31.31.144 TCP 66 45454 → 6633 [ACK] Seq=9371 Ack=339 Win=213 Len=0 TSval=19391657 TSecr=821532
487 0.667612398 172.31.31.144 -> 172.31.23.72 TCP 66 6633 → 45444 [ACK] Seq=1307 Ack=11024 Win=853 Len=0 TSval=821532 TSecr=19391657
488 0.667617584 172.31.31.144 -> 172.31.23.72 TCP 66 6633 → 45446 [ACK] Seq=1307 Ack=9606 Win=853 Len=0 TSval=821532 TSecr=19391657
489 0.667619651 172.31.31.144 -> 172.31.23.72 TCP 66 6633 → 45444 [ACK] Seq=1307 Ack=11147 Win=853 Len=0 TSval=821532 TSecr=19391657
490 0.667621548 172.31.31.144 -> 172.31.23.72 OpenFlow 187 Type: OFPT_PACKET_OUT
491 0.667642085 172.31.31.144 -> 172.31.23.72 TCP 66 6633 → 45458 [ACK] Seq=1065 Ack=10619 Win=853 Len=0 TSval=821532 TSecr=19391657
492 0.667660078 172.31.31.144 -> 172.31.23.72 OpenFlow 187 Type: OFPT_PACKET_OUT
493 0.667699139 172.31.31.144 -> 172.31.23.72 OpenFlow 187 Type: OFPT_PACKET_OUT
494 0.667762344 172.31.23.72 -> 172.31.31.144 TCP 66 45454 → 6633 [ACK] Seq=9371 Ack=702 Win=213 Len=0 TSval=19391657 TSecr=821532
495 0.667830205 172.31.31.144 -> 172.31.23.72 OpenFlow 187 Type: OFPT_PACKET_OUT
496 0.667834976 172.31.31.144 -> 172.31.23.72 TCP 66 6633 → 45446 [ACK] Seq=1307 Ack=9729 Win=853 Len=0 TSval=821532 TSecr=19391657
497 0.667837755 172.31.31.144 -> 172.31.23.72 TCP 66 6633 → 45416 [ACK] Seq=969 Ack=739 Win=853 Len=0 TSval=821532 TSecr=19391657
498 0.667885970 172.31.31.144 -> 172.31.23.72 OpenFlow 187 Type: OFPT_PACKET_OUT
499 0.667907455 172.31.23.72 -> 172.31.31.144 OpenFlow 189 Type: OFPT_PACKET_IN
500 0.667916870 172.31.31.144 -> 172.31.23.72 OpenFlow 187 Type: OFPT_PACKET_OUT
501 0.667927828 172.31.23.72 -> 172.31.31.144 OpenFlow 189 Type: OFPT_PACKET_IN
502 0.667962812 172.31.23.72 -> 172.31.31.144 OpenFlow 189 Type: OFPT_PACKET_IN
503 0.667985337 172.31.23.72 -> 172.31.31.144 OpenFlow 189 Type: OFPT_PACKET_IN
504 0.668031829 172.31.23.72 -> 172.31.31.144 OpenFlow 189 Type: OFPT_PACKET_IN
505 0.668052935 172.31.31.144 -> 172.31.23.72 OpenFlow 187 Type: OFPT_PACKET_OUT
506 0.668083974 172.31.23.72 -> 172.31.31.144 OpenFlow 189 Type: OFPT_PACKET_IN
507 0.668129308 172.31.31.144 -> 172.31.23.72 TCP 66 6633 → 45452 [ACK] Seq=1065 Ack=9125 Win=853 Len=0 TSval=821533 TSecr=19391657
508 0.668157280 172.31.31.144 -> 172.31.23.72 OpenFlow 187 Type: OFPT_PACKET_OUT
509 0.668163655 172.31.23.72 -> 172.31.31.144 TCP 66 45454 → 6633 [ACK] Seq=9371 Ack=1065 Win=213 Len=0 TSval=19391657 TSecr=821532
510 0.668172209 172.31.31.144 -> 172.31.23.72 TCP 66 6633 → 45424 [ACK] Seq=1211 Ack=862 Win=853 Len=0 TSval=821533 TSecr=19391657
511 0.668205369 172.31.31.144 -> 172.31.23.72 OpenFlow 187 Type: OFPT_PACKET_OUT
512 0.668225215 172.31.31.144 -> 172.31.23.72 TCP 66 6633 → 45424 [ACK] Seq=1211 Ack=985 Win=853 Len=0 TSval=821533 TSecr=19391657
513 0.668285161 172.31.31.144 -> 172.31.23.72 OpenFlow 187 Type: OFPT_PACKET_OUT
514 0.668373012 172.31.31.144 -> 172.31.23.72 OpenFlow 187 Type: OFPT_PACKET_OUT
515 0.668432938 172.31.31.144 -> 172.31.23.72 OpenFlow 187 Type: OFPT_PACKET_OUT
516 0.668480040 172.31.31.144 -> 172.31.23.72 TCP 66 6633 → 45456 [ACK] Seq=1065 Ack=9409 Win=853 Len=0 TSval=821533 TSecr=19391657
517 0.668512843 172.31.23.72 -> 172.31.31.144 TCP 66 45448 → 6633 [ACK] Seq=7803 Ack=823 Win=213 Len=0 TSval=19391657 TSecr=821532
518 0.668566081 172.31.31.144 -> 172.31.23.72 OpenFlow 187 Type: OFPT_PACKET_OUT
519 0.668594226 172.31.31.144 -> 172.31.23.72 OpenFlow 187 Type: OFPT_PACKET_OUT
520 0.668636249 172.31.31.144 -> 172.31.23.72 OpenFlow 187 Type: OFPT_PACKET_OUT
521 0.668693339 172.31.23.72 -> 172.31.31.144 TCP 66 45442 → 6633 [ACK] Seq=10091 Ack=460 Win=213 Len=0 TSval=19391657 TSecr=821533
522 0.668704255 172.31.31.144 -> 172.31.23.72 OpenFlow 187 Type: OFPT_PACKET_OUT
523 0.668762203 172.31.31.144 -> 172.31.23.72 OpenFlow 187 Type: OFPT_PACKET_OUT
524 0.668808706 172.31.23.72 -> 172.31.31.144 TCP 66 45442 → 6633 [ACK] Seq=10091 Ack=702 Win=213 Len=0 TSval=19391657 TSecr=821533
525 0.668820279 172.31.31.144 -> 172.31.23.72 OpenFlow 187 Type: OFPT_PACKET_OUT
526 0.668988194 172.31.23.72 -> 172.31.31.144 OpenFlow 189 Type: OFPT_PACKET_IN
527 0.669011892 172.31.23.72 -> 172.31.31.144 OpenFlow 189 Type: OFPT_PACKET_IN
528 0.669021792 172.31.23.72 -> 172.31.31.144 OpenFlow 189 Type: OFPT_PACKET_IN
529 0.669041446 172.31.23.72 -> 172.31.31.144 OpenFlow 189 Type: OFPT_PACKET_IN
530 0.669064564 172.31.23.72 -> 172.31.31.144 OpenFlow 189 Type: OFPT_PACKET_IN
531 0.669066526 172.31.23.72 -> 172.31.31.144 OpenFlow 189 Type: OFPT_PACKET_IN
532 0.669097846 172.31.23.72 -> 172.31.31.144 OpenFlow 189 Type: OFPT_PACKET_IN
533 0.669102521 172.31.23.72 -> 172.31.31.144 OpenFlow 435 Type: OFPT_PACKET_IN
534 0.669113111 172.31.23.72 -> 172.31.31.144 OpenFlow 189 Type: OFPT_PACKET_IN
535 0.669128283 172.31.23.72 -> 172.31.31.144 OpenFlow 189 Type: OFPT_PACKET_IN
536 0.669205425 172.31.23.72 -> 172.31.31.144 OpenFlow 189 Type: OFPT_PACKET_IN
537 0.669278994 172.31.31.144 -> 172.31.23.72 TCP 66 6633 → 45452 [ACK] Seq=1065 Ack=9371 Win=853 Len=0 TSval=821533 TSecr=19391657
538 0.669284467 172.31.31.144 -> 172.31.23.72 TCP 66 6633 → 45462 [ACK] Seq=727 Ack=616 Win=853 Len=0 TSval=821533 TSecr=19391657
539 0.669286444 172.31.31.144 -> 172.31.23.72 TCP 66 6633 → 45444 [ACK] Seq=1307 Ack=11270 Win=853 Len=0 TSval=821533 TSecr=19391657
540 0.669288194 172.31.31.144 -> 172.31.23.72 TCP 66 6633 → 45462 [ACK] Seq=727 Ack=739 Win=853 Len=0 TSval=821533 TSecr=19391657
541 0.669289857 172.31.31.144 -> 172.31.23.72 TCP 66 6633 → 45434 [ACK] Seq=1307 Ack=11308 Win=853 Len=0 TSval=821533 TSecr=19391657
542 0.669294811 172.31.23.72 -> 172.31.31.144 OpenFlow 189 Type: OFPT_PACKET_IN
543 0.669302646 172.31.31.144 -> 172.31.23.72 TCP 66 6633 → 45434 [ACK] Seq=1307 Ack=11431 Win=853 Len=0 TSval=821533 TSecr=19391657
544 0.669404204 172.31.31.144 -> 172.31.23.72 TCP 66 6633 → 45446 [ACK] Seq=1307 Ack=9852 Win=853 Len=0 TSval=821533 TSecr=19391657
545 0.669443971 172.31.31.144 -> 172.31.23.72 TCP 66 6633 → 45444 [ACK] Seq=1307 Ack=11639 Win=853 Len=0 TSval=821533 TSecr=19391657
546 0.669667841 172.31.31.144 -> 172.31.23.72 TCP 66 6633 → 45446 [ACK] Seq=1307 Ack=9975 Win=853 Len=0 TSval=821533 TSecr=19391657
547 0.669693608 172.31.31.144 -> 172.31.23.72 TCP 66 6633 → 45460 [ACK] Seq=823 Ack=9013 Win=853 Len=0 TSval=821533 TSecr=19391657
548 0.705534935 172.31.23.72 -> 172.31.31.144 TCP 66 45442 → 6633 [ACK] Seq=10091 Ack=823 Win=213 Len=0 TSval=19391667 TSecr=821533
549 0.743998929 172.31.23.72 -> 172.31.31.144 OpenFlow 146 Type: OFPT_PORT_STATUS
550 0.744054257 172.31.23.72 -> 172.31.31.144 OpenFlow 146 Type: OFPT_PORT_STATUS
551 0.764245371 172.31.31.144 -> 172.31.23.72 OpenFlow 187 Type: OFPT_PACKET_OUT
552 0.764290419 172.31.31.144 -> 172.31.23.72 OpenFlow 187 Type: OFPT_PACKET_OUT
553 0.764365973 172.31.31.144 -> 172.31.23.72 OpenFlow 187 Type: OFPT_PACKET_OUT
554 0.764429247 172.31.31.144 -> 172.31.23.72 OpenFlow 187 Type: OFPT_PACKET_OUT
555 0.764486893 172.31.31.144 -> 172.31.23.72 OpenFlow 187 Type: OFPT_PACKET_OUT
556 0.764535654 172.31.31.144 -> 172.31.23.72 OpenFlow 187 Type: OFPT_PACKET_OUT
557 0.764606495 172.31.31.144 -> 172.31.23.72 OpenFlow 187 Type: OFPT_PACKET_OUT
558 0.764664133 172.31.31.144 -> 172.31.23.72 OpenFlow 187 Type: OFPT_PACKET_OUT
559 0.764754793 172.31.31.144 -> 172.31.23.72 OpenFlow 187 Type: OFPT_PACKET_OUT
560 0.764802024 172.31.31.144 -> 172.31.23.72 OpenFlow 187 Type: OFPT_PACKET_OUT
561 0.764882383 172.31.31.144 -> 172.31.23.72 OpenFlow 187 Type: OFPT_PACKET_OUT
562 0.764923628 172.31.31.144 -> 172.31.23.72 OpenFlow 187 Type: OFPT_PACKET_OUT
563 0.764990557 172.31.31.144 -> 172.31.23.72 OpenFlow 187 Type: OFPT_PACKET_OUT
564 0.765038606 172.31.31.144 -> 172.31.23.72 OpenFlow 187 Type: OFPT_PACKET_OUT
565 0.765102093 172.31.31.144 -> 172.31.23.72 OpenFlow 187 Type: OFPT_PACKET_OUT
566 0.765125585 172.31.23.72 -> 172.31.31.144 TCP 66 45426 → 6633 [ACK] Seq=985 Ack=1211 Win=213 Len=0 TSval=19391681 TSecr=821557
567 0.765158527 172.31.31.144 -> 172.31.23.72 OpenFlow 187 Type: OFPT_PACKET_OUT
568 0.765212330 172.31.23.72 -> 172.31.31.144 OpenFlow 189 Type: OFPT_PACKET_IN
569 0.765239069 172.31.23.72 -> 172.31.31.144 OpenFlow 189 Type: OFPT_PACKET_IN
570 0.765404850 172.31.31.144 -> 172.31.23.72 TCP 66 6633 → 45422 [ACK] Seq=727 Ack=616 Win=853 Len=0 TSval=821557 TSecr=19391681
571 0.765618683 172.31.23.72 -> 172.31.31.144 OpenFlow 189 Type: OFPT_PACKET_IN
572 0.765645874 172.31.23.72 -> 172.31.31.144 OpenFlow 189 Type: OFPT_PACKET_IN
573 0.765655535 172.31.23.72 -> 172.31.31.144 OpenFlow 189 Type: OFPT_PACKET_IN
574 0.765670846 172.31.23.72 -> 172.31.31.144 OpenFlow 189 Type: OFPT_PACKET_IN
575 0.765679681 172.31.31.144 -> 172.31.23.72 TCP 66 6633 → 45422 [ACK] Seq=727 Ack=739 Win=853 Len=0 TSval=821557 TSecr=19391681
576 0.765714871 172.31.23.72 -> 172.31.31.144 OpenFlow 189 Type: OFPT_PACKET_IN
577 0.765721566 172.31.23.72 -> 172.31.31.144 OpenFlow 189 Type: OFPT_PACKET_IN
578 0.765735429 172.31.23.72 -> 172.31.31.144 OpenFlow 189 Type: OFPT_PACKET_IN
579 0.765795172 172.31.31.144 -> 172.31.23.72 TCP 66 6633 → 45420 [ACK] Seq=969 Ack=616 Win=853 Len=0 TSval=821557 TSecr=19391682
580 0.765801849 172.31.23.72 -> 172.31.31.144 OpenFlow 435 Type: OFPT_PACKET_IN
581 0.765809193 172.31.23.72 -> 172.31.31.144 OpenFlow 189 Type: OFPT_PACKET_IN
582 0.765895203 172.31.31.144 -> 172.31.23.72 TCP 66 6633 → 45420 [ACK] Seq=969 Ack=739 Win=853 Len=0 TSval=821557 TSecr=19391682
583 0.765902900 172.31.23.72 -> 172.31.31.144 OpenFlow 189 Type: OFPT_PACKET_IN
584 0.765908014 172.31.23.72 -> 172.31.31.144 OpenFlow 189 Type: OFPT_PACKET_IN
585 0.765955296 172.31.31.144 -> 172.31.23.72 TCP 66 6633 → 45424 [ACK] Seq=1211 Ack=1108 Win=853 Len=0 TSval=821557 TSecr=19391682
586 0.765960189 172.31.23.72 -> 172.31.31.144 OpenFlow 189 Type: OFPT_PACKET_IN
587 0.766082417 172.31.31.144 -> 172.31.23.72 TCP 66 6633 → 45424 [ACK] Seq=1211 Ack=1231 Win=853 Len=0 TSval=821557 TSecr=19391682
588 0.766132010 172.31.31.144 -> 172.31.23.72 TCP 66 6633 → 45426 [ACK] Seq=1211 Ack=1108 Win=853 Len=0 TSval=821557 TSecr=19391682
589 0.766286326 172.31.31.144 -> 172.31.23.72 TCP 66 6633 → 45430 [ACK] Seq=1211 Ack=1231 Win=853 Len=0 TSval=821557 TSecr=19391682
590 0.766362517 172.31.31.144 -> 172.31.23.72 TCP 66 6633 → 45428 [ACK] Seq=727 Ack=739 Win=853 Len=0 TSval=821557 TSecr=19391682
591 0.766390299 172.31.31.144 -> 172.31.23.72 TCP 66 6633 → 45426 [ACK] Seq=1211 Ack=1231 Win=853 Len=0 TSval=821557 TSecr=19391682
592 0.766446593 172.31.31.144 -> 172.31.23.72 TCP 66 6633 → 45418 [ACK] Seq=1211 Ack=985 Win=853 Len=0 TSval=821557 TSecr=19391682
593 0.767774627 172.31.31.144 -> 172.31.23.72 OpenFlow 146 Type: OFPT_FLOW_MOD
594 0.767796793 172.31.31.144 -> 172.31.23.72 OpenFlow 154 Type: OFPT_BARRIER_REQUEST
595 0.767827044 172.31.31.144 -> 172.31.23.72 OpenFlow 146 Type: OFPT_FLOW_MOD
596 0.767833932 172.31.23.72 -> 172.31.31.144 TCP 66 45442 → 6633 [ACK] Seq=10091 Ack=903 Win=213 Len=0 TSval=19391682 TSecr=821557
597 0.767866553 172.31.31.144 -> 172.31.23.72 OpenFlow 154 Type: OFPT_BARRIER_REQUEST
598 0.767872515 172.31.23.72 -> 172.31.31.144 TCP 66 45442 → 6633 [ACK] Seq=10091 Ack=991 Win=213 Len=0 TSval=19391682 TSecr=821557
599 0.767975207 172.31.31.144 -> 172.31.23.72 OpenFlow 146 Type: OFPT_FLOW_MOD
600 0.767979739 172.31.23.72 -> 172.31.31.144 TCP 66 45456 → 6633 [ACK] Seq=9489 Ack=1233 Win=213 Len=0 TSval=19391682 TSecr=821557
601 0.767989715 172.31.23.72 -> 172.31.31.144 OpenFlow 74 Type: OFPT_BARRIER_REPLY
602 0.767994396 172.31.31.144 -> 172.31.23.72 OpenFlow 146 Type: OFPT_FLOW_MOD
603 0.767997027 172.31.23.72 -> 172.31.31.144 TCP 66 45442 → 6633 [ACK] Seq=10091 Ack=1071 Win=213 Len=0 TSval=19391682 TSecr=821557
604 0.768049889 172.31.23.72 -> 172.31.31.144 OpenFlow 74 Type: OFPT_BARRIER_REPLY
605 0.768081128 172.31.31.144 -> 172.31.23.72 OpenFlow 146 Type: OFPT_FLOW_MOD
606 0.768084335 172.31.31.144 -> 172.31.23.72 OpenFlow 146 Type: OFPT_FLOW_MOD
607 0.768161503 172.31.31.144 -> 172.31.23.72 OpenFlow 74 Type: OFPT_BARRIER_REQUEST
608 0.768165527 172.31.31.144 -> 172.31.23.72 OpenFlow 146 Type: OFPT_FLOW_MOD
609 0.768169302 172.31.31.144 -> 172.31.23.72 OpenFlow 74 Type: OFPT_BARRIER_REQUEST
610 0.768188617 172.31.31.144 -> 172.31.23.72 OpenFlow 146 Type: OFPT_FLOW_MOD
611 0.768215509 172.31.31.144 -> 172.31.23.72 OpenFlow 322 Type: OFPT_BARRIER_REQUEST
612 0.768238535 172.31.23.72 -> 172.31.31.144 OpenFlow 146 Type: OFPT_FLOW_REMOVED
613 0.768247913 172.31.31.144 -> 172.31.23.72 OpenFlow 146 Type: OFPT_FLOW_MOD
614 0.768252588 172.31.23.72 -> 172.31.31.144 TCP 66 45444 → 6633 [ACK] Seq=11639 Ack=1387 Win=213 Len=0 TSval=19391682 TSecr=821557
615 0.768266063 172.31.23.72 -> 172.31.31.144 OpenFlow 146 Type: OFPT_FLOW_REMOVED
616 0.768271634 172.31.23.72 -> 172.31.31.144 OpenFlow 226 Type: OFPT_FLOW_REMOVED
617 0.768345952 172.31.31.144 -> 172.31.23.72 OpenFlow 322 Type: OFPT_BARRIER_REQUEST
618 0.768350647 172.31.31.144 -> 172.31.23.72 OpenFlow 234 Type: OFPT_FLOW_MOD
619 0.768353919 172.31.23.72 -> 172.31.31.144 TCP 66 45444 → 6633 [ACK] Seq=11639 Ack=1555 Win=213 Len=0 TSval=19391682 TSecr=821557
620 0.768359063 172.31.31.144 -> 172.31.23.72 OpenFlow 146 Type: OFPT_FLOW_MOD
621 0.768361165 172.31.23.72 -> 172.31.31.144 TCP 66 45444 → 6633 [ACK] Seq=11639 Ack=1635 Win=213 Len=0 TSval=19391682 TSecr=821558
622 0.768364932 172.31.23.72 -> 172.31.31.144 OpenFlow 226 Type: OFPT_FLOW_REMOVED
623 0.768442126 172.31.31.144 -> 172.31.23.72 OpenFlow 146 Type: OFPT_FLOW_MOD
624 0.768446212 172.31.31.144 -> 172.31.23.72 OpenFlow 154 Type: OFPT_BARRIER_REQUEST
625 0.768447976 172.31.31.144 -> 172.31.23.72 OpenFlow 74 Type: OFPT_BARRIER_REQUEST
626 0.768450733 172.31.23.72 -> 172.31.31.144 TCP 66 45444 → 6633 [ACK] Seq=11639 Ack=1643 Win=213 Len=0 TSval=19391682 TSecr=821558
627 0.768548512 172.31.31.144 -> 172.31.23.72 OpenFlow 146 Type: OFPT_FLOW_MOD
628 0.768552068 172.31.31.144 -> 172.31.23.72 OpenFlow 146 Type: OFPT_FLOW_MOD
629 0.768554209 172.31.31.144 -> 172.31.23.72 OpenFlow 74 Type: OFPT_BARRIER_REQUEST
630 0.768555459 172.31.31.144 -> 172.31.23.72 TCP 66 6633 → 45442 [ACK] Seq=1159 Ack=10099 Win=853 Len=0 TSval=821558 TSecr=19391682
631 0.768587650 172.31.31.144 -> 172.31.23.72 OpenFlow 146 Type: OFPT_FLOW_MOD
632 0.768589908 172.31.31.144 -> 172.31.23.72 OpenFlow 154 Type: OFPT_BARRIER_REQUEST
633 0.768611031 172.31.31.144 -> 172.31.23.72 OpenFlow 146 Type: OFPT_FLOW_MOD
634 0.768639326 172.31.31.144 -> 172.31.23.72 OpenFlow 154 Type: OFPT_BARRIER_REQUEST
635 0.768667073 172.31.31.144 -> 172.31.23.72 OpenFlow 146 Type: OFPT_FLOW_MOD
636 0.768693419 172.31.31.144 -> 172.31.23.72 OpenFlow 154 Type: OFPT_BARRIER_REQUEST
637 0.768728155 172.31.31.144 -> 172.31.23.72 OpenFlow 146 Type: OFPT_FLOW_MOD
638 0.768760946 172.31.31.144 -> 172.31.23.72 OpenFlow 146 Type: OFPT_FLOW_MOD
639 0.768793130 172.31.31.144 -> 172.31.23.72 OpenFlow 314 Type: OFPT_BARRIER_REQUEST
640 0.768824219 172.31.31.144 -> 172.31.23.72 OpenFlow 154 Type: OFPT_BARRIER_REQUEST
641 0.768849791 172.31.31.144 -> 172.31.23.72 OpenFlow 74 Type: OFPT_BARRIER_REQUEST
642 0.768880405 172.31.31.144 -> 172.31.23.72 OpenFlow 146 Type: OFPT_FLOW_MOD
643 0.768909401 172.31.31.144 -> 172.31.23.72 OpenFlow 146 Type: OFPT_FLOW_MOD
644 0.768937614 172.31.31.144 -> 172.31.23.72 OpenFlow 146 Type: OFPT_FLOW_MOD
645 0.768962682 172.31.31.144 -> 172.31.23.72 OpenFlow 154 Type: OFPT_BARRIER_REQUEST
646 0.768991875 172.31.31.144 -> 172.31.23.72 OpenFlow 74 Type: OFPT_BARRIER_REQUEST
647 0.769018908 172.31.31.144 -> 172.31.23.72 OpenFlow 146 Type: OFPT_FLOW_MOD
648 0.769051320 172.31.31.144 -> 172.31.23.72 OpenFlow 146 Type: OFPT_FLOW_MOD
649 0.769086606 172.31.31.144 -> 172.31.23.72 OpenFlow 146 Type: OFPT_FLOW_MOD
650 0.769089952 172.31.23.72 -> 172.31.31.144 TCP 66 45444 → 6633 [ACK] Seq=11639 Ack=1723 Win=213 Len=0 TSval=19391682 TSecr=821558
651 0.769111416 172.31.31.144 -> 172.31.23.72 OpenFlow 154 Type: OFPT_BARRIER_REQUEST
652 0.769155746 172.31.31.144 -> 172.31.23.72 OpenFlow 154 Type: OFPT_BARRIER_REQUEST
653 0.769159330 172.31.23.72 -> 172.31.31.144 TCP 66 45444 → 6633 [ACK] Seq=11639 Ack=1811 Win=213 Len=0 TSval=19391682 TSecr=821558
654 0.769164589 172.31.31.144 -> 172.31.23.72 OpenFlow 146 Type: OFPT_FLOW_MOD
655 0.769221353 172.31.31.144 -> 172.31.23.72 OpenFlow 146 Type: OFPT_FLOW_MOD
656 0.769224600 172.31.31.144 -> 172.31.23.72 OpenFlow 146 Type: OFPT_FLOW_MOD
657 0.769261121 172.31.31.144 -> 172.31.23.72 OpenFlow 154 Type: OFPT_BARRIER_REQUEST
658 0.769305269 172.31.31.144 -> 172.31.23.72 OpenFlow 74 Type: OFPT_BARRIER_REQUEST
659 0.769325361 172.31.31.144 -> 172.31.23.72 OpenFlow 154 Type: OFPT_BARRIER_REQUEST
660 0.769360938 172.31.31.144 -> 172.31.23.72 OpenFlow 146 Type: OFPT_FLOW_MOD
661 0.769389182 172.31.31.144 -> 172.31.23.72 OpenFlow 146 Type: OFPT_FLOW_MOD
662 0.769429243 172.31.31.144 -> 172.31.23.72 OpenFlow 146 Type: OFPT_FLOW_MOD
663 0.769432599 172.31.23.72 -> 172.31.31.144 TCP 66 45444 → 6633 [ACK] Seq=11639 Ack=1891 Win=213 Len=0 TSval=19391682 TSecr=821558
664 0.769456299 172.31.31.144 -> 172.31.23.72 OpenFlow 154 Type: OFPT_BARRIER_REQUEST
665 0.769513002 172.31.31.144 -> 172.31.23.72 OpenFlow 154 Type: OFPT_BARRIER_REQUEST
666 0.769517292 172.31.23.72 -> 172.31.31.144 TCP 66 45444 → 6633 [ACK] Seq=11639 Ack=1979 Win=213 Len=0 TSval=19391683 TSecr=821558
667 0.769521491 172.31.31.144 -> 172.31.23.72 OpenFlow 154 Type: OFPT_BARRIER_REQUEST
668 0.769537270 172.31.31.144 -> 172.31.23.72 OpenFlow 146 Type: OFPT_FLOW_MOD
669 0.769575870 172.31.31.144 -> 172.31.23.72 TCP 66 6633 → 45442 [ACK] Seq=1327 Ack=10339 Win=853 Len=0 TSval=821558 TSecr=19391682
670 0.769599454 172.31.31.144 -> 172.31.23.72 OpenFlow 146 Type: OFPT_FLOW_MOD
671 0.769629717 172.31.31.144 -> 172.31.23.72 OpenFlow 234 Type: OFPT_FLOW_MOD
672 0.769674413 172.31.31.144 -> 172.31.23.72 OpenFlow 146 Type: OFPT_FLOW_MOD
673 0.769704567 172.31.31.144 -> 172.31.23.72 OpenFlow 146 Type: OFPT_FLOW_MOD
674 0.769744260 172.31.31.144 -> 172.31.23.72 OpenFlow 146 Type: OFPT_FLOW_MOD
675 0.769781991 172.31.31.144 -> 172.31.23.72 OpenFlow 146 Type: OFPT_FLOW_MOD
676 0.769819833 172.31.31.144 -> 172.31.23.72 OpenFlow 146 Type: OFPT_FLOW_MOD
677 0.769850050 172.31.31.144 -> 172.31.23.72 OpenFlow 146 Type: OFPT_FLOW_MOD
678 0.769886235 172.31.31.144 -> 172.31.23.72 OpenFlow 154 Type: OFPT_BARRIER_REQUEST
679 0.769928889 172.31.31.144 -> 172.31.23.72 OpenFlow 154 Type: OFPT_BARRIER_REQUEST
680 0.769956378 172.31.31.144 -> 172.31.23.72 OpenFlow 146 Type: OFPT_FLOW_MOD
681 0.769983739 172.31.31.144 -> 172.31.23.72 OpenFlow 146 Type: OFPT_FLOW_MOD
682 0.770025981 172.31.31.144 -> 172.31.23.72 OpenFlow 74 Type: OFPT_BARRIER_REQUEST
683 0.770045466 172.31.31.144 -> 172.31.23.72 OpenFlow 146 Type: OFPT_FLOW_MOD
684 0.770078667 172.31.31.144 -> 172.31.23.72 OpenFlow 154 Type: OFPT_BARRIER_REQUEST
685 0.770104660 172.31.31.144 -> 172.31.23.72 OpenFlow 154 Type: OFPT_BARRIER_REQUEST
686 0.770129780 172.31.31.144 -> 172.31.23.72 OpenFlow 146 Type: OFPT_FLOW_MOD
687 0.770158474 172.31.31.144 -> 172.31.23.72 OpenFlow 74 Type: OFPT_BARRIER_REQUEST
688 0.770193139 172.31.31.144 -> 172.31.23.72 OpenFlow 74 Type: OFPT_BARRIER_REQUEST
689 0.770219481 172.31.31.144 -> 172.31.23.72 OpenFlow 146 Type: OFPT_FLOW_MOD
690 0.770247730 172.31.31.144 -> 172.31.23.72 OpenFlow 146 Type: OFPT_FLOW_MOD
691 0.770275317 172.31.31.144 -> 172.31.23.72 OpenFlow 146 Type: OFPT_FLOW_MOD
692 0.770316790 172.31.31.144 -> 172.31.23.72 OpenFlow 74 Type: OFPT_BARRIER_REQUEST
693 0.770330122 172.31.31.144 -> 172.31.23.72 OpenFlow 146 Type: OFPT_FLOW_MOD
694 0.770357680 172.31.31.144 -> 172.31.23.72 OpenFlow 146 Type: OFPT_FLOW_MOD
695 0.770385379 172.31.31.144 -> 172.31.23.72 OpenFlow 146 Type: OFPT_FLOW_MOD
696 0.770414717 172.31.31.144 -> 172.31.23.72 OpenFlow 162 Type: OFPT_BARRIER_REQUEST
697 0.770459290 172.31.31.144 -> 172.31.23.72 OpenFlow 146 Type: OFPT_FLOW_MOD
698 0.770480079 172.31.31.144 -> 172.31.23.72 OpenFlow 154 Type: OFPT_BARRIER_REQUEST
699 0.770506710 172.31.31.144 -> 172.31.23.72 OpenFlow 74 Type: OFPT_BARRIER_REQUEST
700 0.770533243 172.31.31.144 -> 172.31.23.72 OpenFlow 146 Type: OFPT_FLOW_MOD
701 0.770561416 172.31.31.144 -> 172.31.23.72 OpenFlow 146 Type: OFPT_FLOW_MOD
702 0.770591377 172.31.31.144 -> 172.31.23.72 OpenFlow 242 Type: OFPT_BARRIER_REQUEST
703 0.770622049 172.31.31.144 -> 172.31.23.72 OpenFlow 146 Type: OFPT_FLOW_MOD
704 0.770650547 172.31.31.144 -> 172.31.23.72 OpenFlow 410 Type: OFPT_BARRIER_REQUEST
705 0.771057091 172.31.23.72 -> 172.31.31.144 OpenFlow 74 Type: OFPT_BARRIER_REPLY
706 0.771093768 172.31.23.72 -> 172.31.31.144 OpenFlow 74 Type: OFPT_BARRIER_REPLY
707 0.771116302 172.31.23.72 -> 172.31.31.144 OpenFlow 74 Type: OFPT_BARRIER_REPLY
708 0.771156084 172.31.23.72 -> 172.31.31.144 OpenFlow 82 Type: OFPT_BARRIER_REPLY
709 0.771165540 172.31.23.72 -> 172.31.31.144 OpenFlow 74 Type: OFPT_BARRIER_REPLY
710 0.771213977 172.31.23.72 -> 172.31.31.144 OpenFlow 74 Type: OFPT_BARRIER_REPLY
711 0.771261975 172.31.23.72 -> 172.31.31.144 OpenFlow 74 Type: OFPT_BARRIER_REPLY
712 0.771266948 172.31.23.72 -> 172.31.31.144 OpenFlow 82 Type: OFPT_BARRIER_REPLY
713 0.771269283 172.31.23.72 -> 172.31.31.144 TCP 66 45418 → 6633 [ACK] Seq=985 Ack=1379 Win=213 Len=0 TSval=19391683 TSecr=821558
714 0.771273352 172.31.23.72 -> 172.31.31.144 OpenFlow 74 Type: OFPT_BARRIER_REPLY
715 0.771296351 172.31.23.72 -> 172.31.31.144 OpenFlow 74 Type: OFPT_BARRIER_REPLY
716 0.771299081 172.31.31.144 -> 172.31.23.72 TCP 66 6633 → 45452 [ACK] Seq=1401 Ack=9387 Win=853 Len=0 TSval=821558 TSecr=19391683
717 0.771381806 172.31.23.72 -> 172.31.31.144 TCP 66 45450 → 6633 [ACK] Seq=9013 Ack=991 Win=213 Len=0 TSval=19391683 TSecr=821558
718 0.771389809 172.31.23.72 -> 172.31.31.144 OpenFlow 74 Type: OFPT_BARRIER_REPLY
719 0.771407929 172.31.23.72 -> 172.31.31.144 OpenFlow 74 Type: OFPT_BARRIER_REPLY
720 0.771445345 172.31.23.72 -> 172.31.31.144 OpenFlow 74 Type: OFPT_BARRIER_REPLY
721 0.771451467 172.31.23.72 -> 172.31.31.144 OpenFlow 114 Type: OFPT_BARRIER_REPLY
722 0.771490275 172.31.23.72 -> 172.31.31.144 OpenFlow 74 Type: OFPT_BARRIER_REPLY
723 0.771492484 172.31.23.72 -> 172.31.31.144 OpenFlow 82 Type: OFPT_BARRIER_REPLY
724 0.771512289 172.31.31.144 -> 172.31.23.72 TCP 66 6633 → 45436 [ACK] Seq=1569 Ack=9433 Win=853 Len=0 TSval=821558 TSecr=19391683
725 0.771516595 172.31.31.144 -> 172.31.23.72 TCP 66 6633 → 45434 [ACK] Seq=1643 Ack=11439 Win=853 Len=0 TSval=821558 TSecr=19391683
726 0.771518721 172.31.31.144 -> 172.31.23.72 TCP 66 6633 → 45434 [ACK] Seq=1643 Ack=11447 Win=853 Len=0 TSval=821558 TSecr=19391683
727 0.771536356 172.31.23.72 -> 172.31.31.144 OpenFlow 74 Type: OFPT_BARRIER_REPLY
728 0.771542101 172.31.23.72 -> 172.31.31.144 OpenFlow 74 Type: OFPT_BARRIER_REPLY
729 0.771591925 172.31.31.144 -> 172.31.23.72 TCP 66 6633 → 45424 [ACK] Seq=1715 Ack=1255 Win=853 Len=0 TSval=821558 TSecr=19391683
730 0.771595399 172.31.31.144 -> 172.31.23.72 TCP 66 6633 → 45444 [ACK] Seq=2483 Ack=11647 Win=853 Len=0 TSval=821558 TSecr=19391683
731 0.771599775 172.31.23.72 -> 172.31.31.144 OpenFlow 74 Type: OFPT_BARRIER_REPLY
732 0.771604851 172.31.23.72 -> 172.31.31.144 OpenFlow 106 Type: OFPT_BARRIER_REPLY
733 0.771626890 172.31.23.72 -> 172.31.31.144 OpenFlow 74 Type: OFPT_BARRIER_REPLY
734 0.771632412 172.31.31.144 -> 172.31.23.72 TCP 66 6633 → 45450 [ACK] Seq=991 Ack=9021 Win=853 Len=0 TSval=821558 TSecr=19391683
735 0.771656315 172.31.23.72 -> 172.31.31.144 OpenFlow 74 Type: OFPT_BARRIER_REPLY
736 0.771693719 172.31.23.72 -> 172.31.31.144 OpenFlow 106 Type: OFPT_BARRIER_REPLY
737 0.771723027 172.31.31.144 -> 172.31.23.72 TCP 66 6633 → 45444 [ACK] Seq=2483 Ack=11695 Win=853 Len=0 TSval=821558 TSecr=19391683
738 0.771731554 172.31.23.72 -> 172.31.31.144 TCP 66 45414 → 6633 [ACK] Seq=493 Ack=895 Win=213 Len=0 TSval=19391683 TSecr=821558
739 0.771739016 172.31.23.72 -> 172.31.31.144 OpenFlow 74 Type: OFPT_BARRIER_REPLY
740 0.771749035 172.31.31.144 -> 172.31.23.72 TCP 66 6633 → 45430 [ACK] Seq=1715 Ack=1255 Win=853 Len=0 TSval=821558 TSecr=19391683
741 0.771777652 172.31.23.72 -> 172.31.31.144 OpenFlow 74 Type: OFPT_BARRIER_REPLY
742 0.771797249 172.31.31.144 -> 172.31.23.72 TCP 66 6633 → 45416 [ACK] Seq=1305 Ack=755 Win=853 Len=0 TSval=821558 TSecr=19391683
743 0.771800499 172.31.31.144 -> 172.31.23.72 TCP 66 6633 → 45460 [ACK] Seq=1159 Ack=9029 Win=853 Len=0 TSval=821558 TSecr=19391683
744 0.771805047 172.31.23.72 -> 172.31.31.144 OpenFlow 74 Type: OFPT_BARRIER_REPLY
745 0.771827298 172.31.23.72 -> 172.31.31.144 OpenFlow 74 Type: OFPT_BARRIER_REPLY
746 0.771853441 172.31.23.72 -> 172.31.31.144 TCP 66 45426 → 6633 [ACK] Seq=1231 Ack=1379 Win=213 Len=0 TSval=19391683 TSecr=821558
747 0.771862326 172.31.31.144 -> 172.31.23.72 TCP 66 6633 → 45458 [ACK] Seq=2241 Ack=10755 Win=853 Len=0 TSval=821558 TSecr=19391683
748 0.771868096 172.31.23.72 -> 172.31.31.144 OpenFlow 74 Type: OFPT_BARRIER_REPLY
749 0.771876277 172.31.31.144 -> 172.31.23.72 TCP 66 6633 → 45456 [ACK] Seq=2241 Ack=9785 Win=853 Len=0 TSval=821558 TSecr=19391683
750 0.771972418 172.31.31.144 -> 172.31.23.72 TCP 66 6633 → 45442 [ACK] Seq=1495 Ack=10363 Win=853 Len=0 TSval=821558 TSecr=19391683
751 0.772050135 172.31.23.72 -> 172.31.31.144 OpenFlow 146 Type: OFPT_FLOW_REMOVED
752 0.772068213 172.31.23.72 -> 172.31.31.144 OpenFlow 146 Type: OFPT_FLOW_REMOVED
753 0.772077035 172.31.23.72 -> 172.31.31.144 OpenFlow 306 Type: OFPT_FLOW_REMOVED
754 0.772092507 172.31.23.72 -> 172.31.31.144 OpenFlow 146 Type: OFPT_FLOW_REMOVED
755 0.772103576 172.31.23.72 -> 172.31.31.144 OpenFlow 146 Type: OFPT_FLOW_REMOVED
756 0.772108107 172.31.23.72 -> 172.31.31.144 OpenFlow 466 Type: OFPT_FLOW_REMOVED
757 0.772124888 172.31.23.72 -> 172.31.31.144 OpenFlow 146 Type: OFPT_FLOW_REMOVED
758 0.772132025 172.31.23.72 -> 172.31.31.144 OpenFlow 146 Type: OFPT_FLOW_REMOVED
759 0.772161614 172.31.23.72 -> 172.31.31.144 OpenFlow 146 Type: OFPT_FLOW_REMOVED
760 0.772163485 172.31.23.72 -> 172.31.31.144 OpenFlow 306 Type: OFPT_FLOW_REMOVED
761 0.772169326 172.31.31.144 -> 172.31.23.72 OpenFlow 170 Type: OFPT_FLOW_MOD
762 0.772172604 172.31.31.144 -> 172.31.23.72 OpenFlow 178 Type: OFPT_BARRIER_REQUEST
763 0.772174471 172.31.31.144 -> 172.31.23.72 OpenFlow 170 Type: OFPT_FLOW_MOD
764 0.772184842 172.31.23.72 -> 172.31.31.144 OpenFlow 146 Type: OFPT_FLOW_REMOVED
765 0.772190347 172.31.23.72 -> 172.31.31.144 OpenFlow 466 Type: OFPT_FLOW_REMOVED
766 0.772206196 172.31.23.72 -> 172.31.31.144 OpenFlow 146 Type: OFPT_FLOW_REMOVED
767 0.772217604 172.31.23.72 -> 172.31.31.144 OpenFlow 146 Type: OFPT_FLOW_REMOVED
768 0.772228064 172.31.23.72 -> 172.31.31.144 OpenFlow 146 Type: OFPT_FLOW_REMOVED
769 0.772230282 172.31.23.72 -> 172.31.31.144 OpenFlow 146 Type: OFPT_FLOW_REMOVED
770 0.772261178 172.31.23.72 -> 172.31.31.144 OpenFlow 146 Type: OFPT_FLOW_REMOVED
771 0.772263574 172.31.23.72 -> 172.31.31.144 OpenFlow 1106 Type: OFPT_FLOW_REMOVED
772 0.772290036 172.31.23.72 -> 172.31.31.144 OpenFlow 146 Type: OFPT_FLOW_REMOVED
773 0.772292034 172.31.23.72 -> 172.31.31.144 OpenFlow 146 Type: OFPT_FLOW_REMOVED
774 0.772300059 172.31.23.72 -> 172.31.31.144 OpenFlow 146 Type: OFPT_FLOW_REMOVED
775 0.772312838 172.31.23.72 -> 172.31.31.144 OpenFlow 146 Type: OFPT_FLOW_REMOVED
776 0.772318928 172.31.31.144 -> 172.31.23.72 OpenFlow 170 Type: OFPT_FLOW_MOD
777 0.772323049 172.31.31.144 -> 172.31.23.72 OpenFlow 170 Type: OFPT_FLOW_MOD
778 0.772324900 172.31.31.144 -> 172.31.23.72 OpenFlow 74 Type: OFPT_BARRIER_REQUEST
779 0.772330183 172.31.31.144 -> 172.31.23.72 OpenFlow 170 Type: OFPT_FLOW_MOD
780 0.772332875 172.31.31.144 -> 172.31.23.72 OpenFlow 170 Type: OFPT_FLOW_MOD
781 0.772455451 172.31.23.72 -> 172.31.31.144 OpenFlow 466 Type: OFPT_FLOW_REMOVED
782 0.772461698 172.31.23.72 -> 172.31.31.144 OpenFlow 306 Type: OFPT_FLOW_REMOVED
783 0.772463490 172.31.23.72 -> 172.31.31.144 OpenFlow 306 Type: OFPT_FLOW_REMOVED
784 0.772465241 172.31.23.72 -> 172.31.31.144 OpenFlow 1106 Type: OFPT_FLOW_REMOVED
785 0.772466922 172.31.23.72 -> 172.31.31.144 OpenFlow 866 Type: OFPT_FLOW_REMOVED
786 0.772588723 172.31.31.144 -> 172.31.23.72 OpenFlow 178 Type: OFPT_BARRIER_REQUEST
787 0.772592668 172.31.31.144 -> 172.31.23.72 OpenFlow 74 Type: OFPT_BARRIER_REQUEST
788 0.772594678 172.31.31.144 -> 172.31.23.72 TCP 66 6633 → 45436 [ACK] Seq=1569 Ack=9513 Win=853 Len=0 TSval=821559 TSecr=19391683
789 0.772597002 172.31.31.144 -> 172.31.23.72 OpenFlow 170 Type: OFPT_FLOW_MOD
790 0.772600042 172.31.31.144 -> 172.31.23.72 TCP 66 6633 → 45434 [ACK] Seq=1643 Ack=11527 Win=853 Len=0 TSval=821559 TSecr=19391683
791 0.772601992 172.31.31.144 -> 172.31.23.72 OpenFlow 282 Type: OFPT_BARRIER_REQUEST
792 0.772604492 172.31.31.144 -> 172.31.23.72 OpenFlow 170 Type: OFPT_FLOW_MOD
793 0.772606181 172.31.31.144 -> 172.31.23.72 OpenFlow 170 Type: OFPT_FLOW_MOD
794 0.772608211 172.31.31.144 -> 172.31.23.72 TCP 66 6633 → 45436 [ACK] Seq=1569 Ack=9913 Win=853 Len=0 TSval=821559 TSecr=19391683
795 0.772610289 172.31.31.144 -> 172.31.23.72 OpenFlow 170 Type: OFPT_FLOW_MOD
796 0.772617453 172.31.23.72 -> 172.31.31.144 OpenFlow 146 Type: OFPT_FLOW_REMOVED
797 0.772623193 172.31.23.72 -> 172.31.31.144 OpenFlow 386 Type: OFPT_FLOW_REMOVED
798 0.772624879 172.31.23.72 -> 172.31.31.144 OpenFlow 146 Type: OFPT_FLOW_REMOVED
799 0.772702000 172.31.31.144 -> 172.31.23.72 OpenFlow 170 Type: OFPT_FLOW_MOD
800 0.772704342 172.31.31.144 -> 172.31.23.72 TCP 66 6633 → 45418 [ACK] Seq=1379 Ack=1073 Win=853 Len=0 TSval=821559 TSecr=19391683
801 0.772706904 172.31.31.144 -> 172.31.23.72 OpenFlow 178 Type: OFPT_BARRIER_REQUEST
802 0.772708679 172.31.31.144 -> 172.31.23.72 OpenFlow 170 Type: OFPT_FLOW_MOD
803 0.772710386 172.31.31.144 -> 172.31.23.72 OpenFlow 178 Type: OFPT_BARRIER_REQUEST
804 0.772771100 172.31.31.144 -> 172.31.23.72 OpenFlow 74 Type: OFPT_BARRIER_REQUEST
805 0.772773375 172.31.31.144 -> 172.31.23.72 OpenFlow 178 Type: OFPT_BARRIER_REQUEST
806 0.772774885 172.31.31.144 -> 172.31.23.72 TCP 66 6633 → 45450 [ACK] Seq=991 Ack=9101 Win=853 Len=0 TSval=821559 TSecr=19391683
807 0.772811939 172.31.31.144 -> 172.31.23.72 OpenFlow 170 Type: OFPT_FLOW_MOD
808 0.772824158 172.31.31.144 -> 172.31.23.72 OpenFlow 170 Type: OFPT_FLOW_MOD
809 0.772854497 172.31.31.144 -> 172.31.23.72 OpenFlow 170 Type: OFPT_FLOW_MOD
810 0.772884168 172.31.31.144 -> 172.31.23.72 OpenFlow 170 Type: OFPT_FLOW_MOD
811 0.772911256 172.31.31.144 -> 172.31.23.72 OpenFlow 178 Type: OFPT_FLOW_MOD
812 0.772937683 172.31.31.144 -> 172.31.23.72 OpenFlow 178 Type: OFPT_BARRIER_REQUEST
813 0.772980769 172.31.31.144 -> 172.31.23.72 OpenFlow 170 Type: OFPT_FLOW_MOD
814 0.772984292 172.31.31.144 -> 172.31.23.72 OpenFlow 170 Type: OFPT_FLOW_MOD
815 0.773014749 172.31.31.144 -> 172.31.23.72 OpenFlow 170 Type: OFPT_FLOW_MOD
816 0.773018274 172.31.31.144 -> 172.31.23.72 OpenFlow 178 Type: OFPT_BARRIER_REQUEST
817 0.773019989 172.31.31.144 -> 172.31.23.72 OpenFlow 178 Type: OFPT_BARRIER_REQUEST
818 0.773050789 172.31.31.144 -> 172.31.23.72 OpenFlow 170 Type: OFPT_FLOW_MOD
819 0.773078605 172.31.31.144 -> 172.31.23.72 OpenFlow 290 Type: OFPT_BARRIER_REQUEST
820 0.773105266 172.31.31.144 -> 172.31.23.72 OpenFlow 178 Type: OFPT_BARRIER_REQUEST
821 0.773136992 172.31.31.144 -> 172.31.23.72 TCP 66 6633 → 45414 [ACK] Seq=895 Ack=581 Win=853 Len=0 TSval=821559 TSecr=19391683
822 0.773163926 172.31.31.144 -> 172.31.23.72 TCP 66 6633 → 45426 [ACK] Seq=1379 Ack=1319 Win=853 Len=0 TSval=821559 TSecr=19391683
823 0.773192278 172.31.31.144 -> 172.31.23.72 OpenFlow 170 Type: OFPT_FLOW_MOD
824 0.773223227 172.31.31.144 -> 172.31.23.72 OpenFlow 170 Type: OFPT_FLOW_MOD
825 0.773247901 172.31.31.144 -> 172.31.23.72 OpenFlow 170 Type: OFPT_FLOW_MOD
826 0.773277291 172.31.31.144 -> 172.31.23.72 OpenFlow 170 Type: OFPT_FLOW_MOD
827 0.773302773 172.31.31.144 -> 172.31.23.72 OpenFlow 170 Type: OFPT_FLOW_MOD
828 0.773335149 172.31.31.144 -> 172.31.23.72 TCP 66 6633 → 45460 [ACK] Seq=1591 Ack=9349 Win=853 Len=0 TSval=821559 TSecr=19391683
829 0.773362585 172.31.31.144 -> 172.31.23.72 OpenFlow 170 Type: OFPT_FLOW_MOD
830 0.773390550 172.31.31.144 -> 172.31.23.72 OpenFlow 298 Type: OFPT_BARRIER_REQUEST
831 0.773478072 172.31.31.144 -> 172.31.23.72 OpenFlow 170 Type: OFPT_FLOW_MOD
832 0.773480361 172.31.31.144 -> 172.31.23.72 OpenFlow 170 Type: OFPT_FLOW_MOD
833 0.773482005 172.31.31.144 -> 172.31.23.72 OpenFlow 170 Type: OFPT_FLOW_MOD
834 0.773507406 172.31.31.144 -> 172.31.23.72 OpenFlow 170 Type: OFPT_FLOW_MOD
835 0.773533613 172.31.31.144 -> 172.31.23.72 TCP 66 6633 → 45442 [ACK] Seq=1711 Ack=10763 Win=853 Len=0 TSval=821559 TSecr=19391683
836 0.773563572 172.31.31.144 -> 172.31.23.72 OpenFlow 170 Type: OFPT_FLOW_MOD
837 0.773590199 172.31.31.144 -> 172.31.23.72 OpenFlow 74 Type: OFPT_BARRIER_REQUEST
838 0.773617919 172.31.31.144 -> 172.31.23.72 OpenFlow 170 Type: OFPT_FLOW_MOD
839 0.773657652 172.31.31.144 -> 172.31.23.72 OpenFlow 178 Type: OFPT_FLOW_MOD
840 0.773671891 172.31.31.144 -> 172.31.23.72 OpenFlow 1042 Type: OFPT_BARRIER_REQUEST
841 0.773700512 172.31.31.144 -> 172.31.23.72 OpenFlow 170 Type: OFPT_FLOW_MOD
842 0.773739166 172.31.31.144 -> 172.31.23.72 OpenFlow 170 Type: OFPT_FLOW_MOD
843 0.773753651 172.31.31.144 -> 172.31.23.72 OpenFlow 170 Type: OFPT_FLOW_MOD
844 0.773797259 172.31.31.144 -> 172.31.23.72 OpenFlow 274 Type: OFPT_FLOW_MOD
845 0.773811047 172.31.31.144 -> 172.31.23.72 OpenFlow 170 Type: OFPT_FLOW_MOD
846 0.773839630 172.31.31.144 -> 172.31.23.72 OpenFlow 74 Type: OFPT_BARRIER_REQUEST
847 0.773866771 172.31.31.144 -> 172.31.23.72 OpenFlow 74 Type: OFPT_BARRIER_REQUEST
848 0.773893118 172.31.31.144 -> 172.31.23.72 OpenFlow 394 Type: OFPT_BARRIER_REQUEST
849 0.773922140 172.31.31.144 -> 172.31.23.72 OpenFlow 170 Type: OFPT_FLOW_MOD
850 0.773949180 172.31.31.144 -> 172.31.23.72 OpenFlow 178 Type: OFPT_BARRIER_REQUEST
851 0.773995594 172.31.31.144 -> 172.31.23.72 OpenFlow 170 Type: OFPT_FLOW_MOD
852 0.774039078 172.31.31.144 -> 172.31.23.72 OpenFlow 170 Type: OFPT_FLOW_MOD
853 0.774049319 172.31.31.144 -> 172.31.23.72 OpenFlow 170 Type: OFPT_FLOW_MOD
854 0.774080929 172.31.31.144 -> 172.31.23.72 OpenFlow 170 Type: OFPT_FLOW_MOD
855 0.774107949 172.31.31.144 -> 172.31.23.72 OpenFlow 274 Type: OFPT_FLOW_MOD
856 0.774136643 172.31.31.144 -> 172.31.23.72 OpenFlow 178 Type: OFPT_BARRIER_REQUEST
857 0.774166603 172.31.31.144 -> 172.31.23.72 OpenFlow 394 Type: OFPT_BARRIER_REQUEST
858 0.774189538 172.31.31.144 -> 172.31.23.72 OpenFlow 170 Type: OFPT_FLOW_MOD
859 0.774217892 172.31.31.144 -> 172.31.23.72 OpenFlow 186 Type: OFPT_BARRIER_REQUEST
860 0.774245251 172.31.31.144 -> 172.31.23.72 OpenFlow 178 Type: OFPT_BARRIER_REQUEST
861 0.774274529 172.31.31.144 -> 172.31.23.72 OpenFlow 170 Type: OFPT_FLOW_MOD
862 0.774302142 172.31.31.144 -> 172.31.23.72 OpenFlow 170 Type: OFPT_FLOW_MOD
863 0.774331178 172.31.31.144 -> 172.31.23.72 OpenFlow 170 Type: OFPT_FLOW_MOD
864 0.774358486 172.31.31.144 -> 172.31.23.72 OpenFlow 610 Type: OFPT_BARRIER_REQUEST
865 0.774372596 172.31.23.72 -> 172.31.31.144 OpenFlow 74 Type: OFPT_BARRIER_REPLY
866 0.774387561 172.31.31.144 -> 172.31.23.72 OpenFlow 282 Type: OFPT_FLOW_MOD
867 0.774413085 172.31.23.72 -> 172.31.31.144 OpenFlow 74 Type: OFPT_BARRIER_REPLY
868 0.774421011 172.31.31.144 -> 172.31.23.72 OpenFlow 394 Type: OFPT_BARRIER_REQUEST
869 0.774436171 172.31.31.144 -> 172.31.23.72 OpenFlow 170 Type: OFPT_FLOW_MOD
870 0.774453465 172.31.23.72 -> 172.31.31.144 OpenFlow 74 Type: OFPT_BARRIER_REPLY
871 0.774474391 172.31.31.144 -> 172.31.23.72 OpenFlow 170 Type: OFPT_FLOW_MOD
872 0.774497847 172.31.31.144 -> 172.31.23.72 OpenFlow 170 Type: OFPT_FLOW_MOD
873 0.774506493 172.31.23.72 -> 172.31.31.144 TCP 66 45462 → 6633 [ACK] Seq=739 Ack=943 Win=213 Len=0 TSval=19391684 TSecr=821559
874 0.774515421 172.31.23.72 -> 172.31.31.144 OpenFlow 74 Type: OFPT_BARRIER_REPLY
875 0.774537929 172.31.31.144 -> 172.31.23.72 OpenFlow 170 Type: OFPT_FLOW_MOD
876 0.774555659 172.31.23.72 -> 172.31.31.144 TCP 66 45436 → 6633 [ACK] Seq=9913 Ack=1785 Win=213 Len=0 TSval=19391684 TSecr=821559
877 0.774568021 172.31.23.72 -> 172.31.31.144 OpenFlow 74 Type: OFPT_BARRIER_REPLY
878 0.774585432 172.31.31.144 -> 172.31.23.72 OpenFlow 170 Type: OFPT_FLOW_MOD
879 0.774588700 172.31.31.144 -> 172.31.23.72 OpenFlow 170 Type: OFPT_FLOW_MOD
880 0.774610503 172.31.23.72 -> 172.31.31.144 OpenFlow 74 Type: OFPT_BARRIER_REPLY
881 0.774641580 172.31.31.144 -> 172.31.23.72 OpenFlow 74 Type: OFPT_BARRIER_REQUEST
882 0.774649566 172.31.23.72 -> 172.31.31.144 OpenFlow 74 Type: OFPT_BARRIER_REPLY
883 0.774673649 172.31.23.72 -> 172.31.31.144 OpenFlow 74 Type: OFPT_BARRIER_REPLY
884 0.774719852 172.31.31.144 -> 172.31.23.72 OpenFlow 170 Type: OFPT_FLOW_MOD
885 0.774722840 172.31.31.144 -> 172.31.23.72 OpenFlow 170 Type: OFPT_FLOW_MOD
886 0.774724495 172.31.31.144 -> 172.31.23.72 TCP 66 6633 → 45462 [ACK] Seq=943 Ack=747 Win=853 Len=0 TSval=821559 TSecr=19391684
887 0.774735320 172.31.31.144 -> 172.31.23.72 OpenFlow 170 Type: OFPT_FLOW_MOD
888 0.774760009 172.31.23.72 -> 172.31.31.144 TCP 66 45418 → 6633 [ACK] Seq=1153 Ack=1595 Win=213 Len=0 TSval=19391684 TSecr=821559
889 0.774768684 172.31.23.72 -> 172.31.31.144 OpenFlow 74 Type: OFPT_BARRIER_REPLY
890 0.774790693 172.31.23.72 -> 172.31.31.144 OpenFlow 74 Type: OFPT_BARRIER_REPLY
891 0.774793063 172.31.23.72 -> 172.31.31.144 OpenFlow 82 Type: OFPT_BARRIER_REPLY
892 0.774808715 172.31.31.144 -> 172.31.23.72 OpenFlow 170 Type: OFPT_FLOW_MOD
893 0.774811761 172.31.31.144 -> 172.31.23.72 OpenFlow 170 Type: OFPT_FLOW_MOD
894 0.774813751 172.31.31.144 -> 172.31.23.72 OpenFlow 170 Type: OFPT_FLOW_MOD
895 0.774852413 172.31.23.72 -> 172.31.31.144 OpenFlow 82 Type: OFPT_BARRIER_REPLY
896 0.774867108 172.31.23.72 -> 172.31.31.144 TCP 66 45438 → 6633 [ACK] Seq=8993 Ack=1281 Win=213 Len=0 TSval=19391684 TSecr=821559
897 0.774871473 172.31.23.72 -> 172.31.31.144 OpenFlow 74 Type: OFPT_BARRIER_REPLY
898 0.774893798 172.31.23.72 -> 172.31.31.144 OpenFlow 74 Type: OFPT_BARRIER_REPLY
899 0.774908275 172.31.31.144 -> 172.31.23.72 OpenFlow 170 Type: OFPT_FLOW_MOD
900 0.774911475 172.31.31.144 -> 172.31.23.72 OpenFlow 170 Type: OFPT_FLOW_MOD
901 0.774913088 172.31.31.144 -> 172.31.23.72 OpenFlow 170 Type: OFPT_FLOW_MOD
902 0.774933423 172.31.23.72 -> 172.31.31.144 TCP 66 45430 → 6633 [ACK] Seq=1735 Ack=1931 Win=213 Len=0 TSval=19391684 TSecr=821559
903 0.774942303 172.31.23.72 -> 172.31.31.144 OpenFlow 74 Type: OFPT_BARRIER_REPLY
904 0.774972094 172.31.23.72 -> 172.31.31.144 OpenFlow 74 Type: OFPT_BARRIER_REPLY
905 0.774998004 172.31.31.144 -> 172.31.23.72 OpenFlow 170 Type: OFPT_FLOW_MOD
906 0.775001169 172.31.31.144 -> 172.31.23.72 OpenFlow 170 Type: OFPT_FLOW_MOD
907 0.775004204 172.31.31.144 -> 172.31.23.72 OpenFlow 274 Type: OFPT_FLOW_MOD
908 0.775006274 172.31.31.144 -> 172.31.23.72 OpenFlow 178 Type: OFPT_BARRIER_REQUEST
909 0.775051327 172.31.23.72 -> 172.31.31.144 OpenFlow 74 Type: OFPT_BARRIER_REPLY
910 0.775060339 172.31.23.72 -> 172.31.31.144 OpenFlow 74 Type: OFPT_BARRIER_REPLY
911 0.775091493 172.31.31.144 -> 172.31.23.72 OpenFlow 170 Type: OFPT_FLOW_MOD
912 0.775094460 172.31.31.144 -> 172.31.23.72 TCP 66 6633 → 45452 [ACK] Seq=2153 Ack=9723 Win=853 Len=0 TSval=821559 TSecr=19391684
913 0.775097224 172.31.31.144 -> 172.31.23.72 TCP 66 6633 → 45434 [ACK] Seq=2179 Ack=11783 Win=853 Len=0 TSval=821559 TSecr=19391684
914 0.775119731 172.31.23.72 -> 172.31.31.144 OpenFlow 82 Type: OFPT_BARRIER_REPLY
915 0.775143576 172.31.31.144 -> 172.31.23.72 TCP 66 6633 → 45424 [ACK] Seq=2883 Ack=1759 Win=853 Len=0 TSval=821559 TSecr=19391684
916 0.775155884 172.31.31.144 -> 172.31.23.72 TCP 66 6633 → 45444 [ACK] Seq=3131 Ack=12839 Win=853 Len=0 TSval=821559 TSecr=19391684
917 0.775159503 172.31.23.72 -> 172.31.31.144 OpenFlow 74 Type: OFPT_BARRIER_REPLY
918 0.775179407 172.31.23.72 -> 172.31.31.144 OpenFlow 74 Type: OFPT_BARRIER_REPLY
919 0.775201266 172.31.23.72 -> 172.31.31.144 OpenFlow 74 Type: OFPT_BARRIER_REPLY
920 0.775230449 172.31.23.72 -> 172.31.31.144 OpenFlow 74 Type: OFPT_BARRIER_REPLY
921 0.775255027 172.31.23.72 -> 172.31.31.144 OpenFlow 74 Type: OFPT_BARRIER_REPLY
922 0.775279376 172.31.31.144 -> 172.31.23.72 TCP 66 6633 → 45416 [ACK] Seq=2153 Ack=1091 Win=853 Len=0 TSval=821559 TSecr=19391684
923 0.775294396 172.31.23.72 -> 172.31.31.144 OpenFlow 74 Type: OFPT_BARRIER_REPLY
924 0.775314800 172.31.31.144 -> 172.31.23.72 TCP 66 6633 → 45446 [ACK] Seq=2603 Ack=9983 Win=853 Len=0 TSval=821559 TSecr=19391684
925 0.775321617 172.31.23.72 -> 172.31.31.144 OpenFlow 74 Type: OFPT_BARRIER_REPLY
926 0.775340226 172.31.31.144 -> 172.31.23.72 TCP 66 6633 → 45446 [ACK] Seq=2603 Ack=9999 Win=853 Len=0 TSval=821559 TSecr=19391684
927 0.775363269 172.31.31.144 -> 172.31.23.72 TCP 66 6633 → 45446 [ACK] Seq=2603 Ack=10023 Win=853 Len=0 TSval=821559 TSecr=19391684
928 0.775421894 172.31.31.144 -> 172.31.23.72 TCP 66 6633 → 45432 [ACK] Seq=1401 Ack=993 Win=853 Len=0 TSval=821559 TSecr=19391684
929 0.775452235 172.31.31.144 -> 172.31.23.72 TCP 66 6633 → 45432 [ACK] Seq=1401 Ack=1001 Win=853 Len=0 TSval=821559 TSecr=19391684
930 0.775494738 172.31.31.144 -> 172.31.23.72 TCP 66 6633 → 45460 [ACK] Seq=1903 Ack=9365 Win=853 Len=0 TSval=821559 TSecr=19391684
931 0.775957932 172.31.23.72 -> 172.31.31.144 TCP 66 45458 → 6633 [ACK] Seq=11875 Ack=4161 Win=210 Len=0 TSval=19391684 TSecr=821559
932 0.775985661 172.31.23.72 -> 172.31.31.144 OpenFlow 74 Type: OFPT_BARRIER_REPLY
933 0.776019253 172.31.23.72 -> 172.31.31.144 OpenFlow 82 Type: OFPT_BARRIER_REPLY
934 0.776057830 172.31.23.72 -> 172.31.31.144 OpenFlow 74 Type: OFPT_BARRIER_REPLY
935 0.776078704 172.31.23.72 -> 172.31.31.144 OpenFlow 74 Type: OFPT_BARRIER_REPLY
936 0.776100543 172.31.23.72 -> 172.31.31.144 OpenFlow 74 Type: OFPT_BARRIER_REPLY
937 0.776166453 172.31.23.72 -> 172.31.31.144 OpenFlow 74 Type: OFPT_BARRIER_REPLY
938 0.776189083 172.31.23.72 -> 172.31.31.144 OpenFlow 74 Type: OFPT_BARRIER_REPLY
939 0.776206368 172.31.23.72 -> 172.31.31.144 OpenFlow 74 Type: OFPT_BARRIER_REPLY
940 0.776250571 172.31.23.72 -> 172.31.31.144 OpenFlow 74 Type: OFPT_BARRIER_REPLY
941 0.776282188 172.31.31.144 -> 172.31.23.72 TCP 66 6633 → 45458 [ACK] Seq=4161 Ack=11915 Win=853 Len=0 TSval=821560 TSecr=19391684
942 0.776290374 172.31.23.72 -> 172.31.31.144 OpenFlow 82 Type: OFPT_BARRIER_REPLY
943 0.776317166 172.31.23.72 -> 172.31.31.144 TCP 66 45448 → 6633 [ACK] Seq=7803 Ack=1039 Win=213 Len=0 TSval=19391684 TSecr=821559
944 0.776325161 172.31.23.72 -> 172.31.31.144 OpenFlow 74 Type: OFPT_BARRIER_REPLY
945 0.776359613 172.31.23.72 -> 172.31.31.144 TCP 66 45442 → 6633 [ACK] Seq=10763 Ack=1711 Win=213 Len=0 TSval=19391684 TSecr=821559
946 0.776370639 172.31.23.72 -> 172.31.31.144 OpenFlow 74 Type: OFPT_BARRIER_REPLY
947 0.776404959 172.31.23.72 -> 172.31.31.144 OpenFlow 74 Type: OFPT_BARRIER_REPLY
948 0.776437967 172.31.31.144 -> 172.31.23.72 TCP 66 6633 → 45454 [ACK] Seq=1713 Ack=9395 Win=853 Len=0 TSval=821560 TSecr=19391684
949 0.776460508 172.31.31.144 -> 172.31.23.72 TCP 66 6633 → 45456 [ACK] Seq=2673 Ack=10681 Win=853 Len=0 TSval=821560 TSecr=19391684
950 0.778087239 172.31.23.72 -> 172.31.31.144 OpenFlow 74 Type: OFPT_BARRIER_REPLY
951 0.778275446 172.31.31.144 -> 172.31.23.72 TCP 66 6633 → 45430 [ACK] Seq=2251 Ack=1751 Win=853 Len=0 TSval=821560 TSecr=19391684
952 0.812195633 172.31.31.144 -> 172.31.23.72 TCP 66 6633 → 45452 [ACK] Seq=2153 Ack=9731 Win=853 Len=0 TSval=821569 TSecr=19391684
953 0.812207343 172.31.31.144 -> 172.31.23.72 TCP 66 6633 → 45438 [ACK] Seq=1281 Ack=9001 Win=853 Len=0 TSval=821569 TSecr=19391684
954 0.812239562 172.31.31.144 -> 172.31.23.72 TCP 66 6633 → 45418 [ACK] Seq=1595 Ack=1161 Win=853 Len=0 TSval=821569 TSecr=19391684
955 0.812278138 172.31.31.144 -> 172.31.23.72 TCP 66 6633 → 45450 [ACK] Seq=1311 Ack=9189 Win=853 Len=0 TSval=821569 TSecr=19391684
956 0.812310306 172.31.31.144 -> 172.31.23.72 TCP 66 6633 → 45436 [ACK] Seq=1785 Ack=9921 Win=853 Len=0 TSval=821569 TSecr=19391684
957 0.813503705 172.31.23.72 -> 172.31.31.144 TCP 66 45434 → 6633 [ACK] Seq=11783 Ack=2179 Win=213 Len=0 TSval=19391694 TSecr=821559
958 0.816186628 172.31.31.144 -> 172.31.23.72 TCP 66 6633 → 45414 [ACK] Seq=1319 Ack=669 Win=853 Len=0 TSval=821570 TSecr=19391684
959 0.816207627 172.31.31.144 -> 172.31.23.72 TCP 66 6633 → 45426 [ACK] Seq=1803 Ack=1407 Win=853 Len=0 TSval=821570 TSecr=19391684
960 0.816239100 172.31.31.144 -> 172.31.23.72 TCP 66 6633 → 45458 [ACK] Seq=4161 Ack=11923 Win=853 Len=0 TSval=821570 TSecr=19391684
961 0.816267405 172.31.31.144 -> 172.31.23.72 TCP 66 6633 → 45448 [ACK] Seq=1039 Ack=7811 Win=853 Len=0 TSval=821570 TSecr=19391684
962 0.816298139 172.31.31.144 -> 172.31.23.72 TCP 66 6633 → 45442 [ACK] Seq=1711 Ack=10771 Win=853 Len=0 TSval=821570 TSecr=19391684
963 1.042676926 172.31.31.144 -> 172.31.23.72 OpenFlow 122 Type: OFPT_MULTIPART_REQUEST, OFPMP_FLOW
964 1.042707579 172.31.31.144 -> 172.31.23.72 OpenFlow 106 Type: OFPT_MULTIPART_REQUEST, OFPMP_PORT_STATS
965 1.042963836 172.31.23.72 -> 172.31.31.144 OpenFlow 554 Type: OFPT_MULTIPART_REPLY, OFPMP_FLOW
966 1.043151199 172.31.23.72 -> 172.31.31.144 OpenFlow 6178 Type: OFPT_MULTIPART_REPLY, OFPMP_TABLE
967 1.043237765 172.31.31.144 -> 172.31.23.72 TCP 66 6633 → 45462 [ACK] Seq=1039 Ack=1235 Win=853 Len=0 TSval=821626 TSecr=19391751
968 1.043272009 172.31.23.72 -> 172.31.31.144 OpenFlow 530 Type: OFPT_MULTIPART_REPLY, OFPMP_PORT_STATS
969 1.043354120 172.31.31.144 -> 172.31.23.72 TCP 66 6633 → 45462 [ACK] Seq=1039 Ack=7347 Win=853 Len=0 TSval=821626 TSecr=19391751
970 1.043555906 172.31.31.144 -> 172.31.23.72 TCP 66 6633 → 45462 [ACK] Seq=1039 Ack=7811 Win=853 Len=0 TSval=821626 TSecr=19391751
971 2.564314558 172.31.31.144 -> 172.31.23.72 OpenFlow 90 Type: OFPT_MULTIPART_REQUEST, OFPMP_GROUP
972 2.564343492 172.31.31.144 -> 172.31.23.72 OpenFlow 106 Type: OFPT_MULTIPART_REQUEST, OFPMP_METER
973 2.564620052 172.31.23.72 -> 172.31.31.144 OpenFlow 82 Type: OFPT_MULTIPART_REPLY, OFPMP_GROUP
974 2.564654301 172.31.23.72 -> 172.31.31.144 OpenFlow 98 Type: OFPT_MULTIPART_REPLY, OFPMP_METER
975 2.564880386 172.31.31.144 -> 172.31.23.72 TCP 66 6633 → 45414 [ACK] Seq=1383 Ack=685 Win=853 Len=0 TSval=822007 TSecr=19392131
976 2.564907689 172.31.31.144 -> 172.31.23.72 TCP 66 6633 → 45414 [ACK] Seq=1383 Ack=717 Win=853 Len=0 TSval=822007 TSecr=19392131
977 2.663481612 172.31.31.144 -> 172.31.23.72 OpenFlow 90 Type: OFPT_MULTIPART_REQUEST, OFPMP_GROUP
978 2.663520059 172.31.31.144 -> 172.31.23.72 OpenFlow 90 Type: OFPT_MULTIPART_REQUEST, OFPMP_GROUP
979 2.663540234 172.31.31.144 -> 172.31.23.72 OpenFlow 90 Type: OFPT_MULTIPART_REQUEST, OFPMP_GROUP
980 2.663543755 172.31.31.144 -> 172.31.23.72 OpenFlow 106 Type: OFPT_MULTIPART_REQUEST, OFPMP_METER
981 2.663574279 172.31.31.144 -> 172.31.23.72 OpenFlow 106 Type: OFPT_MULTIPART_REQUEST, OFPMP_METER
982 2.663604591 172.31.31.144 -> 172.31.23.72 OpenFlow 106 Type: OFPT_MULTIPART_REQUEST, OFPMP_METER
983 2.663746189 172.31.23.72 -> 172.31.31.144 OpenFlow 82 Type: OFPT_MULTIPART_REPLY, OFPMP_GROUP
984 2.663780833 172.31.23.72 -> 172.31.31.144 OpenFlow 82 Type: OFPT_MULTIPART_REPLY, OFPMP_GROUP_DESC
985 2.663820290 172.31.23.72 -> 172.31.31.144 OpenFlow 82 Type: OFPT_MULTIPART_REPLY, OFPMP_METER
986 2.663832689 172.31.23.72 -> 172.31.31.144 OpenFlow 82 Type: OFPT_MULTIPART_REPLY, OFPMP_GROUP
987 2.663865009 172.31.23.72 -> 172.31.31.144 OpenFlow 98 Type: OFPT_MULTIPART_REPLY, OFPMP_METER
988 2.663892309 172.31.23.72 -> 172.31.31.144 OpenFlow 82 Type: OFPT_MULTIPART_REPLY, OFPMP_GROUP
989 2.663907770 172.31.23.72 -> 172.31.31.144 OpenFlow 98 Type: OFPT_MULTIPART_REPLY, OFPMP_METER
990 2.663986499 172.31.31.144 -> 172.31.23.72 TCP 66 6633 → 45420 [ACK] Seq=1033 Ack=755 Win=853 Len=0 TSval=822031 TSecr=19392156
991 2.664005344 172.31.31.144 -> 172.31.23.72 TCP 66 6633 → 45420 [ACK] Seq=1033 Ack=771 Win=853 Len=0 TSval=822031 TSecr=19392156
992 2.664036003 172.31.31.144 -> 172.31.23.72 TCP 66 6633 → 45420 [ACK] Seq=1033 Ack=787 Win=853 Len=0 TSval=822031 TSecr=19392156
993 2.664050525 172.31.31.144 -> 172.31.23.72 TCP 66 6633 → 45418 [ACK] Seq=1659 Ack=1177 Win=853 Len=0 TSval=822031 TSecr=19392156
994 2.664069096 172.31.31.144 -> 172.31.23.72 TCP 66 6633 → 45418 [ACK] Seq=1659 Ack=1209 Win=853 Len=0 TSval=822031 TSecr=19392156
995 2.664087986 172.31.31.144 -> 172.31.23.72 TCP 66 6633 → 45416 [ACK] Seq=2217 Ack=1139 Win=853 Len=0 TSval=822032 TSecr=19392156
