  1 0.000000000 172.31.31.144 -> 172.31.23.72 TCP 90 6633 → 33650 [PSH, ACK] Seq=1 Ack=1 Win=853 Len=24 TSval=1303916 TSecr=26142964
  2 0.000015869 172.31.31.144 -> 172.31.23.72 TCP 138 6633 → 33650 [PSH, ACK] Seq=25 Ack=1 Win=853 Len=72 TSval=1303916 TSecr=26142964
  3 0.003854583 172.31.23.72 -> 172.31.31.144 OpenFlow 754 Type: OFPT_MULTIPART_REPLY, OFPMP_PORT_STATS
  4 0.004024566 172.31.23.72 -> 172.31.31.144 OpenFlow 6178 Type: OFPT_MULTIPART_REPLY, OFPMP_TABLE
  5 0.004112129 172.31.23.72 -> 172.31.31.144 OpenFlow 3674 Type: OFPT_MULTIPART_REPLY, OFPMP_FLOW
  6 0.004354601 172.31.31.144 -> 172.31.23.72 TCP 66 6633 → 33650 [ACK] Seq=97 Ack=6801 Win=853 Len=0 TSval=1303917 TSecr=26143018
  7 0.043001029 172.31.31.144 -> 172.31.23.72 TCP 66 6633 → 33650 [ACK] Seq=97 Ack=10409 Win=853 Len=0 TSval=1303927 TSecr=26143018
  8 0.043024978 172.31.31.144 -> 172.31.23.72 TCP 122 6633 → 33652 [PSH, ACK] Seq=1 Ack=1 Win=853 Len=56 TSval=1303927 TSecr=26142938
  9 0.043041957 172.31.31.144 -> 172.31.23.72 TCP 106 6633 → 33652 [PSH, ACK] Seq=57 Ack=1 Win=853 Len=40 TSval=1303927 TSecr=26142938
 10 0.043275638 172.31.23.72 -> 172.31.31.144 OpenFlow 2010 Type: OFPT_MULTIPART_REPLY, OFPMP_FLOW
 11 0.043490991 172.31.23.72 -> 172.31.31.144 OpenFlow 6178 Type: OFPT_MULTIPART_REPLY, OFPMP_TABLE
 12 0.043571590 172.31.31.144 -> 172.31.23.72 TCP 66 6633 → 33652 [ACK] Seq=97 Ack=1945 Win=853 Len=0 TSval=1303927 TSecr=26143027
 13 0.043611084 172.31.23.72 -> 172.31.31.144 OpenFlow 642 Type: OFPT_MULTIPART_REPLY, OFPMP_PORT_STATS
 14 0.043770622 172.31.31.144 -> 172.31.23.72 TCP 66 6633 → 33652 [ACK] Seq=97 Ack=8057 Win=853 Len=0 TSval=1303927 TSecr=26143028
 15 0.043857581 172.31.31.144 -> 172.31.23.72 TCP 66 6633 → 33652 [ACK] Seq=97 Ack=8633 Win=853 Len=0 TSval=1303927 TSecr=26143028
 16 0.088261673 172.31.31.144 -> 172.31.23.72 TCP 122 6633 → 33654 [PSH, ACK] Seq=1 Ack=1 Win=853 Len=56 TSval=1303938 TSecr=26142963
 17 0.088286918 172.31.31.144 -> 172.31.23.72 TCP 106 6633 → 33654 [PSH, ACK] Seq=57 Ack=1 Win=853 Len=40 TSval=1303938 TSecr=26142963
 18 0.088514326 172.31.23.72 -> 172.31.31.144 OpenFlow 1178 Type: OFPT_MULTIPART_REPLY, OFPMP_FLOW
 19 0.088707486 172.31.23.72 -> 172.31.31.144 OpenFlow 6178 Type: OFPT_MULTIPART_REPLY, OFPMP_TABLE
 20 0.088805319 172.31.23.72 -> 172.31.31.144 OpenFlow 642 Type: OFPT_MULTIPART_REPLY, OFPMP_PORT_STATS
 21 0.088992717 172.31.31.144 -> 172.31.23.72 TCP 66 6633 → 33654 [ACK] Seq=97 Ack=7225 Win=853 Len=0 TSval=1303938 TSecr=26143039
 22 0.126926757 172.31.31.144 -> 172.31.23.72 TCP 66 6633 → 33654 [ACK] Seq=97 Ack=7801 Win=853 Len=0 TSval=1303948 TSecr=26143039
 23 0.131448997 172.31.31.144 -> 172.31.23.72 TCP 90 6633 → 33656 [PSH, ACK] Seq=1 Ack=1 Win=853 Len=24 TSval=1303949 TSecr=26142964
 24 0.131457577 172.31.31.144 -> 172.31.23.72 TCP 138 6633 → 33656 [PSH, ACK] Seq=25 Ack=1 Win=853 Len=72 TSval=1303949 TSecr=26142964
 25 0.131632276 172.31.23.72 -> 172.31.31.144 OpenFlow 530 Type: OFPT_MULTIPART_REPLY, OFPMP_PORT_STATS
 26 0.131687776 172.31.23.72 -> 172.31.31.144 OpenFlow 346 Type: OFPT_MULTIPART_REPLY, OFPMP_FLOW
 27 0.131859220 172.31.23.72 -> 172.31.31.144 OpenFlow 6178 Type: OFPT_MULTIPART_REPLY, OFPMP_TABLE
 28 0.131913005 172.31.31.144 -> 172.31.23.72 TCP 66 6633 → 33656 [ACK] Seq=97 Ack=465 Win=853 Len=0 TSval=1303949 TSecr=26143050
 29 0.131948531 172.31.31.144 -> 172.31.23.72 TCP 66 6633 → 33656 [ACK] Seq=97 Ack=745 Win=853 Len=0 TSval=1303949 TSecr=26143050
 30 0.132160781 172.31.31.144 -> 172.31.23.72 TCP 66 6633 → 33656 [ACK] Seq=97 Ack=6857 Win=853 Len=0 TSval=1303949 TSecr=26143050
 31 0.186612270 172.31.31.144 -> 172.31.23.72 TCP 82 6633 → 33658 [PSH, ACK] Seq=1 Ack=1 Win=853 Len=16 TSval=1303962 TSecr=26142964
 32 0.186637153 172.31.31.144 -> 172.31.23.72 TCP 146 6633 → 33658 [PSH, ACK] Seq=17 Ack=1 Win=853 Len=80 TSval=1303962 TSecr=26142964
 33 0.187042809 172.31.23.72 -> 172.31.31.144 OpenFlow 6178 Type: OFPT_MULTIPART_REPLY, OFPMP_TABLE
 34 0.187137483 172.31.23.72 -> 172.31.31.144 OpenFlow 2842 Type: OFPT_MULTIPART_REPLY, OFPMP_FLOW
 35 0.187225860 172.31.23.72 -> 172.31.31.144 OpenFlow 530 Type: OFPT_MULTIPART_REPLY, OFPMP_PORT_STATS
 36 0.187395727 172.31.31.144 -> 172.31.23.72 TCP 66 6633 → 33658 [ACK] Seq=97 Ack=6113 Win=853 Len=0 TSval=1303963 TSecr=26143063
 37 0.187414504 172.31.31.144 -> 172.31.23.72 TCP 66 6633 → 33658 [ACK] Seq=97 Ack=8889 Win=853 Len=0 TSval=1303963 TSecr=26143063
 38 0.187476992 172.31.31.144 -> 172.31.23.72 TCP 66 6633 → 33658 [ACK] Seq=97 Ack=9353 Win=851 Len=0 TSval=1303963 TSecr=26143063
 39 0.238786101 172.31.31.144 -> 172.31.23.72 TCP 82 6633 → 33660 [PSH, ACK] Seq=1 Ack=1 Win=853 Len=16 TSval=1303975 TSecr=26142964
 40 0.238813245 172.31.23.72 -> 172.31.31.144 TCP 66 33660 → 6633 [ACK] Seq=1 Ack=17 Win=213 Len=0 TSval=26143076 TSecr=1303975
 41 0.238819836 172.31.31.144 -> 172.31.23.72 TCP 146 6633 → 33660 [PSH, ACK] Seq=17 Ack=1 Win=853 Len=80 TSval=1303975 TSecr=26142964
 42 0.238823917 172.31.23.72 -> 172.31.31.144 TCP 66 33660 → 6633 [ACK] Seq=1 Ack=97 Win=213 Len=0 TSval=26143076 TSecr=1303975
 43 0.239175080 172.31.23.72 -> 172.31.31.144 OpenFlow 6178 Type: OFPT_MULTIPART_REPLY, OFPMP_TABLE
 44 0.239281448 172.31.23.72 -> 172.31.31.144 OpenFlow 3674 Type: OFPT_MULTIPART_REPLY, OFPMP_FLOW
 45 0.239429309 172.31.23.72 -> 172.31.31.144 OpenFlow 754 Type: OFPT_MULTIPART_REPLY, OFPMP_PORT_STATS
 46 0.239543319 172.31.31.144 -> 172.31.23.72 TCP 66 6633 → 33660 [ACK] Seq=97 Ack=9721 Win=853 Len=0 TSval=1303976 TSecr=26143076
 47 0.278984713 172.31.31.144 -> 172.31.23.72 TCP 66 6633 → 33660 [ACK] Seq=97 Ack=10409 Win=853 Len=0 TSval=1303986 TSecr=26143077
 48 0.288932119 172.31.31.144 -> 172.31.23.72 TCP 90 6633 → 33662 [PSH, ACK] Seq=1 Ack=1 Win=853 Len=24 TSval=1303988 TSecr=26142964
 49 0.288950805 172.31.31.144 -> 172.31.23.72 TCP 138 6633 → 33662 [PSH, ACK] Seq=25 Ack=1 Win=853 Len=72 TSval=1303988 TSecr=26142964
 50 0.289196444 172.31.23.72 -> 172.31.31.144 OpenFlow 754 Type: OFPT_MULTIPART_REPLY, OFPMP_PORT_STATS
 51 0.289281880 172.31.23.72 -> 172.31.31.144 OpenFlow 2010 Type: OFPT_MULTIPART_REPLY, OFPMP_FLOW
 52 0.289446976 172.31.23.72 -> 172.31.31.144 OpenFlow 6178 Type: OFPT_MULTIPART_REPLY, OFPMP_TABLE
 53 0.289545123 172.31.31.144 -> 172.31.23.72 TCP 66 6633 → 33662 [ACK] Seq=97 Ack=689 Win=853 Len=0 TSval=1303988 TSecr=26143089
 54 0.289572206 172.31.31.144 -> 172.31.23.72 TCP 66 6633 → 33662 [ACK] Seq=97 Ack=2633 Win=853 Len=0 TSval=1303988 TSecr=26143089
 55 0.289761230 172.31.31.144 -> 172.31.23.72 TCP 66 6633 → 33662 [ACK] Seq=97 Ack=8745 Win=853 Len=0 TSval=1303988 TSecr=26143089
 56 0.344126561 172.31.31.144 -> 172.31.23.72 TCP 90 6633 → 33664 [PSH, ACK] Seq=1 Ack=1 Win=853 Len=24 TSval=1304002 TSecr=26142964
 57 0.344151027 172.31.31.144 -> 172.31.23.72 TCP 138 6633 → 33664 [PSH, ACK] Seq=25 Ack=1 Win=853 Len=72 TSval=1304002 TSecr=26142964
 58 0.344499900 172.31.23.72 -> 172.31.31.144 OpenFlow 530 Type: OFPT_MULTIPART_REPLY, OFPMP_PORT_STATS
 59 0.344559548 172.31.23.72 -> 172.31.31.144 OpenFlow 554 Type: OFPT_MULTIPART_REPLY, OFPMP_FLOW
 60 0.344729701 172.31.23.72 -> 172.31.31.144 OpenFlow 6178 Type: OFPT_MULTIPART_REPLY, OFPMP_TABLE
 61 0.344838100 172.31.31.144 -> 172.31.23.72 TCP 66 6633 → 33664 [ACK] Seq=97 Ack=953 Win=853 Len=0 TSval=1304002 TSecr=26143103
 62 0.387024855 172.31.31.144 -> 172.31.23.72 TCP 66 6633 → 33664 [ACK] Seq=97 Ack=7065 Win=853 Len=0 TSval=1304013 TSecr=26143103
 63 0.401302408 172.31.31.144 -> 172.31.23.72 TCP 122 6633 → 33666 [PSH, ACK] Seq=1 Ack=1 Win=853 Len=56 TSval=1304016 TSecr=26142938
 64 0.401328453 172.31.31.144 -> 172.31.23.72 TCP 106 6633 → 33666 [PSH, ACK] Seq=57 Ack=1 Win=853 Len=40 TSval=1304016 TSecr=26142938
 65 0.401635051 172.31.23.72 -> 172.31.31.144 OpenFlow 2010 Type: OFPT_MULTIPART_REPLY, OFPMP_FLOW
 66 0.401808054 172.31.23.72 -> 172.31.31.144 OpenFlow 6178 Type: OFPT_MULTIPART_REPLY, OFPMP_TABLE
 67 0.401901620 172.31.23.72 -> 172.31.31.144 OpenFlow 530 Type: OFPT_MULTIPART_REPLY, OFPMP_PORT_STATS
 68 0.402106928 172.31.31.144 -> 172.31.23.72 TCP 66 6633 → 33666 [ACK] Seq=97 Ack=8057 Win=853 Len=0 TSval=1304016 TSecr=26143117
 69 0.438922252 172.31.31.144 -> 172.31.23.72 TCP 66 6633 → 33666 [ACK] Seq=97 Ack=8521 Win=853 Len=0 TSval=1304026 TSecr=26143117
 70 0.455411093 172.31.31.144 -> 172.31.23.72 TCP 90 6633 → 33668 [PSH, ACK] Seq=1 Ack=1 Win=853 Len=24 TSval=1304030 TSecr=26142964
 71 0.455426296 172.31.31.144 -> 172.31.23.72 TCP 138 6633 → 33668 [PSH, ACK] Seq=25 Ack=1 Win=853 Len=72 TSval=1304030 TSecr=26142964
 72 0.455585175 172.31.23.72 -> 172.31.31.144 OpenFlow 642 Type: OFPT_MULTIPART_REPLY, OFPMP_PORT_STATS
 73 0.455664829 172.31.23.72 -> 172.31.31.144 OpenFlow 2010 Type: OFPT_MULTIPART_REPLY, OFPMP_FLOW
 74 0.455822765 172.31.23.72 -> 172.31.31.144 OpenFlow 6178 Type: OFPT_MULTIPART_REPLY, OFPMP_TABLE
 75 0.455889527 172.31.31.144 -> 172.31.23.72 TCP 66 6633 → 33668 [ACK] Seq=97 Ack=577 Win=853 Len=0 TSval=1304030 TSecr=26143131
 76 0.455894896 172.31.31.144 -> 172.31.23.72 TCP 66 6633 → 33668 [ACK] Seq=97 Ack=2521 Win=853 Len=0 TSval=1304030 TSecr=26143131
 77 0.456114388 172.31.31.144 -> 172.31.23.72 TCP 66 6633 → 33668 [ACK] Seq=97 Ack=8633 Win=853 Len=0 TSval=1304030 TSecr=26143131
 78 0.556612155 172.31.31.144 -> 172.31.23.72 TCP 90 6633 → 33670 [PSH, ACK] Seq=1 Ack=1 Win=853 Len=24 TSval=1304055 TSecr=26142964
 79 0.556638906 172.31.31.144 -> 172.31.23.72 TCP 138 6633 → 33670 [PSH, ACK] Seq=25 Ack=1 Win=853 Len=72 TSval=1304055 TSecr=26142964
 80 0.557009465 172.31.23.72 -> 172.31.31.144 OpenFlow 642 Type: OFPT_MULTIPART_REPLY, OFPMP_PORT_STATS
 81 0.557191772 172.31.23.72 -> 172.31.31.144 OpenFlow 6178 Type: OFPT_MULTIPART_REPLY, OFPMP_TABLE
 82 0.557270042 172.31.23.72 -> 172.31.31.144 OpenFlow 2010 Type: OFPT_MULTIPART_REPLY, OFPMP_FLOW
 83 0.557548278 172.31.31.144 -> 172.31.23.72 TCP 66 6633 → 33670 [ACK] Seq=97 Ack=8633 Win=853 Len=0 TSval=1304055 TSecr=26143156
 84 0.611849007 172.31.31.144 -> 172.31.23.72 TCP 82 6633 → 33672 [PSH, ACK] Seq=1 Ack=1 Win=853 Len=16 TSval=1304069 TSecr=26142964
 85 0.611875824 172.31.31.144 -> 172.31.23.72 TCP 146 6633 → 33672 [PSH, ACK] Seq=17 Ack=1 Win=853 Len=80 TSval=1304069 TSecr=26142964
 86 0.612303706 172.31.23.72 -> 172.31.31.144 OpenFlow 6178 Type: OFPT_MULTIPART_REPLY, OFPMP_TABLE
 87 0.612377807 172.31.23.72 -> 172.31.31.144 OpenFlow 1594 Type: OFPT_MULTIPART_REPLY, OFPMP_FLOW
 88 0.612480591 172.31.23.72 -> 172.31.31.144 OpenFlow 642 Type: OFPT_MULTIPART_REPLY, OFPMP_PORT_STATS
 89 0.612678655 172.31.31.144 -> 172.31.23.72 TCP 66 6633 → 33672 [ACK] Seq=97 Ack=7641 Win=853 Len=0 TSval=1304069 TSecr=26143170
 90 0.621943119 172.31.31.144 -> 172.31.23.72 TCP 122 6633 → 33674 [PSH, ACK] Seq=1 Ack=1 Win=853 Len=56 TSval=1304071 TSecr=26142963
 91 0.621955774 172.31.31.144 -> 172.31.23.72 TCP 106 6633 → 33674 [PSH, ACK] Seq=57 Ack=1 Win=853 Len=40 TSval=1304071 TSecr=26142963
 92 0.622158757 172.31.23.72 -> 172.31.31.144 OpenFlow 3258 Type: OFPT_MULTIPART_REPLY, OFPMP_FLOW
 93 0.622320093 172.31.23.72 -> 172.31.31.144 OpenFlow 6178 Type: OFPT_MULTIPART_REPLY, OFPMP_TABLE
 94 0.622411833 172.31.23.72 -> 172.31.31.144 OpenFlow 642 Type: OFPT_MULTIPART_REPLY, OFPMP_PORT_STATS
 95 0.622639705 172.31.31.144 -> 172.31.23.72 TCP 66 6633 → 33674 [ACK] Seq=97 Ack=9305 Win=853 Len=0 TSval=1304071 TSecr=26143172
 96 0.639063071 172.31.31.144 -> 172.31.23.72 TCP 122 6633 → 33676 [PSH, ACK] Seq=1 Ack=1 Win=853 Len=56 TSval=1304076 TSecr=26142964
 97 0.639083208 172.31.31.144 -> 172.31.23.72 TCP 106 6633 → 33676 [PSH, ACK] Seq=57 Ack=1 Win=853 Len=40 TSval=1304076 TSecr=26142964
 98 0.639262593 172.31.23.72 -> 172.31.31.144 OpenFlow 2010 Type: OFPT_MULTIPART_REPLY, OFPMP_FLOW
 99 0.639345642 172.31.23.72 -> 172.31.31.144 OpenFlow 530 Type: OFPT_MULTIPART_REPLY, OFPMP_PORT_STATS
100 0.639513144 172.31.23.72 -> 172.31.31.144 OpenFlow 6178 Type: OFPT_MULTIPART_REPLY, OFPMP_TABLE
101 0.639541996 172.31.31.144 -> 172.31.23.72 TCP 66 6633 → 33676 [ACK] Seq=97 Ack=1945 Win=853 Len=0 TSval=1304076 TSecr=26143176
102 0.639594331 172.31.31.144 -> 172.31.23.72 TCP 66 6633 → 33676 [ACK] Seq=97 Ack=2409 Win=853 Len=0 TSval=1304076 TSecr=26143176
103 0.639839268 172.31.31.144 -> 172.31.23.72 TCP 66 6633 → 33676 [ACK] Seq=97 Ack=8521 Win=853 Len=0 TSval=1304076 TSecr=26143177
104 0.650935080 172.31.31.144 -> 172.31.23.72 TCP 66 6633 → 33672 [ACK] Seq=97 Ack=8217 Win=853 Len=0 TSval=1304079 TSecr=26143170
105 0.658903968 172.31.31.144 -> 172.31.23.72 TCP 66 6633 → 33674 [ACK] Seq=97 Ack=9881 Win=853 Len=0 TSval=1304081 TSecr=26143172
106 2.679577063 172.31.31.144 -> 172.31.23.72 OpenFlow 187 Type: OFPT_PACKET_OUT
107 2.679602428 172.31.31.144 -> 172.31.23.72 OpenFlow 187 Type: OFPT_PACKET_OUT
108 2.679620073 172.31.31.144 -> 172.31.23.72 OpenFlow 187 Type: OFPT_PACKET_OUT
109 2.679650238 172.31.31.144 -> 172.31.23.72 OpenFlow 187 Type: OFPT_PACKET_OUT
110 2.679710149 172.31.31.144 -> 172.31.23.72 OpenFlow 187 Type: OFPT_PACKET_OUT
111 2.679768791 172.31.31.144 -> 172.31.23.72 OpenFlow 187 Type: OFPT_PACKET_OUT
112 2.679825099 172.31.31.144 -> 172.31.23.72 OpenFlow 187 Type: OFPT_PACKET_OUT
113 2.679876061 172.31.31.144 -> 172.31.23.72 OpenFlow 187 Type: OFPT_PACKET_OUT
114 2.680124106 172.31.23.72 -> 172.31.31.144 TCP 66 33668 → 6633 [ACK] Seq=8633 Ack=1065 Win=213 Len=0 TSval=26143687 TSecr=1304586
115 2.680259779 172.31.23.72 -> 172.31.31.144 OpenFlow 189 Type: OFPT_PACKET_IN
116 2.680285334 172.31.23.72 -> 172.31.31.144 OpenFlow 189 Type: OFPT_PACKET_IN
117 2.680348651 172.31.23.72 -> 172.31.31.144 OpenFlow 189 Type: OFPT_PACKET_IN
118 2.680369328 172.31.23.72 -> 172.31.31.144 OpenFlow 189 Type: OFPT_PACKET_IN
119 2.680383318 172.31.23.72 -> 172.31.31.144 OpenFlow 189 Type: OFPT_PACKET_IN
120 2.680413227 172.31.23.72 -> 172.31.31.144 OpenFlow 189 Type: OFPT_PACKET_IN
121 2.680492008 172.31.31.144 -> 172.31.23.72 TCP 66 6633 → 33666 [ACK] Seq=97 Ack=8644 Win=853 Len=0 TSval=1304586 TSecr=26143687
122 2.680512514 172.31.31.144 -> 172.31.23.72 TCP 66 6633 → 33666 [ACK] Seq=97 Ack=8767 Win=853 Len=0 TSval=1304586 TSecr=26143687
123 2.680576713 172.31.31.144 -> 172.31.23.72 TCP 66 6633 → 33670 [ACK] Seq=97 Ack=8879 Win=853 Len=0 TSval=1304586 TSecr=26143687
124 2.680604448 172.31.31.144 -> 172.31.23.72 TCP 66 6633 → 33658 [ACK] Seq=97 Ack=9476 Win=853 Len=0 TSval=1304586 TSecr=26143687
125 2.680623383 172.31.31.144 -> 172.31.23.72 TCP 66 6633 → 33658 [ACK] Seq=97 Ack=9599 Win=853 Len=0 TSval=1304586 TSecr=26143687
126 2.769882606 172.31.23.72 -> 172.31.31.144 OpenFlow 146 Type: OFPT_PORT_STATUS
127 2.769936642 172.31.23.72 -> 172.31.31.144 OpenFlow 146 Type: OFPT_PORT_STATUS
128 2.770159685 172.31.31.144 -> 172.31.23.72 TCP 66 6633 → 33674 [ACK] Seq=97 Ack=9961 Win=853 Len=0 TSval=1304608 TSecr=26143709
129 2.770175091 172.31.31.144 -> 172.31.23.72 TCP 66 6633 → 33672 [ACK] Seq=97 Ack=8297 Win=853 Len=0 TSval=1304608 TSecr=26143709
130 2.780107456 172.31.31.144 -> 172.31.23.72 OpenFlow 187 Type: OFPT_PACKET_OUT
131 2.780123021 172.31.31.144 -> 172.31.23.72 OpenFlow 187 Type: OFPT_PACKET_OUT
132 2.780175297 172.31.31.144 -> 172.31.23.72 OpenFlow 187 Type: OFPT_PACKET_OUT
133 2.780230323 172.31.31.144 -> 172.31.23.72 OpenFlow 187 Type: OFPT_PACKET_OUT
134 2.780270672 172.31.31.144 -> 172.31.23.72 OpenFlow 187 Type: OFPT_PACKET_OUT
135 2.780342232 172.31.31.144 -> 172.31.23.72 OpenFlow 187 Type: OFPT_PACKET_OUT
136 2.780403483 172.31.31.144 -> 172.31.23.72 OpenFlow 187 Type: OFPT_PACKET_OUT
137 2.780487168 172.31.31.144 -> 172.31.23.72 OpenFlow 187 Type: OFPT_PACKET_OUT
138 2.780527851 172.31.31.144 -> 172.31.23.72 OpenFlow 187 Type: OFPT_PACKET_OUT
139 2.780536058 172.31.23.72 -> 172.31.31.144 TCP 66 33656 → 6633 [ACK] Seq=6857 Ack=823 Win=213 Len=0 TSval=26143712 TSecr=1304611
140 2.780589621 172.31.31.144 -> 172.31.23.72 OpenFlow 187 Type: OFPT_PACKET_OUT
141 2.780622809 172.31.31.144 -> 172.31.23.72 OpenFlow 187 Type: OFPT_PACKET_OUT
142 2.780703033 172.31.31.144 -> 172.31.23.72 OpenFlow 187 Type: OFPT_PACKET_OUT
143 2.780743054 172.31.31.144 -> 172.31.23.72 OpenFlow 187 Type: OFPT_PACKET_OUT
144 2.780803717 172.31.31.144 -> 172.31.23.72 OpenFlow 187 Type: OFPT_PACKET_OUT
145 2.780879857 172.31.31.144 -> 172.31.23.72 TCP 187 6633 → 33636 [PSH, ACK] Seq=1 Ack=1 Win=853 Len=121 TSval=1304611 TSecr=26142964
146 2.780926082 172.31.31.144 -> 172.31.23.72 TCP 187 6633 → 33636 [PSH, ACK] Seq=122 Ack=1 Win=853 Len=121 TSval=1304611 TSecr=26142964
147 2.780969264 172.31.23.72 -> 172.31.31.144 TCP 66 33652 → 6633 [ACK] Seq=8633 Ack=1065 Win=213 Len=0 TSval=26143712 TSecr=1304611
148 2.780981299 172.31.31.144 -> 172.31.23.72 TCP 187 6633 → 33636 [PSH, ACK] Seq=243 Ack=1 Win=853 Len=121 TSval=1304611 TSecr=26142964
149 2.781050381 172.31.31.144 -> 172.31.23.72 TCP 187 6633 → 33636 [PSH, ACK] Seq=364 Ack=1 Win=853 Len=121 TSval=1304611 TSecr=26142964
150 2.781097598 172.31.31.144 -> 172.31.23.72 TCP 187 6633 → 33636 [PSH, ACK] Seq=485 Ack=1 Win=853 Len=121 TSval=1304611 TSecr=26142964
151 2.781152806 172.31.31.144 -> 172.31.23.72 TCP 187 6633 → 33636 [PSH, ACK] Seq=606 Ack=1 Win=853 Len=121 TSval=1304611 TSecr=26142964
152 2.781221076 172.31.23.72 -> 172.31.31.144 TCP 66 33636 → 6633 [ACK] Seq=1 Ack=727 Win=213 Len=0 TSval=26143712 TSecr=1304611
153 2.781231657 172.31.31.144 -> 172.31.23.72 TCP 187 6633 → 33636 [PSH, ACK] Seq=727 Ack=1 Win=853 Len=121 TSval=1304611 TSecr=26142964
154 2.781269791 172.31.31.144 -> 172.31.23.72 TCP 187 6633 → 33636 [PSH, ACK] Seq=848 Ack=1 Win=853 Len=121 TSval=1304611 TSecr=26142964
155 2.781334624 172.31.23.72 -> 172.31.31.144 TCP 66 33636 → 6633 [ACK] Seq=1 Ack=969 Win=213 Len=0 TSval=26143712 TSecr=1304611
156 2.781344441 172.31.31.144 -> 172.31.23.72 OpenFlow 187 Type: OFPT_PACKET_OUT
157 2.781402702 172.31.31.144 -> 172.31.23.72 OpenFlow 187 Type: OFPT_PACKET_OUT
158 2.781424815 172.31.23.72 -> 172.31.31.144 OpenFlow 189 Type: OFPT_PACKET_IN
159 2.781445905 172.31.23.72 -> 172.31.31.144 OpenFlow 189 Type: OFPT_PACKET_IN
160 2.781470794 172.31.31.144 -> 172.31.23.72 OpenFlow 187 Type: OFPT_PACKET_OUT
161 2.781494192 172.31.31.144 -> 172.31.23.72 OpenFlow 187 Type: OFPT_PACKET_OUT
162 2.781555522 172.31.31.144 -> 172.31.23.72 OpenFlow 187 Type: OFPT_PACKET_OUT
163 2.781629706 172.31.31.144 -> 172.31.23.72 OpenFlow 187 Type: OFPT_PACKET_OUT
164 2.781666931 172.31.31.144 -> 172.31.23.72 TCP 66 6633 → 33650 [ACK] Seq=823 Ack=10532 Win=853 Len=0 TSval=1304611 TSecr=26143712
165 2.781692311 172.31.31.144 -> 172.31.23.72 TCP 66 6633 → 33650 [ACK] Seq=823 Ack=10655 Win=853 Len=0 TSval=1304611 TSecr=26143712
166 2.781706230 172.31.31.144 -> 172.31.23.72 OpenFlow 187 Type: OFPT_PACKET_OUT
167 2.781770951 172.31.23.72 -> 172.31.31.144 TCP 66 33650 → 6633 [ACK] Seq=10655 Ack=944 Win=213 Len=0 TSval=26143712 TSecr=1304611
168 2.781841052 172.31.23.72 -> 172.31.31.144 OpenFlow 189 Type: OFPT_PACKET_IN
169 2.781864751 172.31.23.72 -> 172.31.31.144 OpenFlow 189 Type: OFPT_PACKET_IN
170 2.781872349 172.31.23.72 -> 172.31.31.144 OpenFlow 189 Type: OFPT_PACKET_IN
171 2.781886486 172.31.23.72 -> 172.31.31.144 OpenFlow 189 Type: OFPT_PACKET_IN
172 2.781904584 172.31.23.72 -> 172.31.31.144 OpenFlow 189 Type: OFPT_PACKET_IN
173 2.781906806 172.31.23.72 -> 172.31.31.144 OpenFlow 189 Type: OFPT_PACKET_IN
174 2.781927168 172.31.23.72 -> 172.31.31.144 OpenFlow 189 Type: OFPT_PACKET_IN
175 2.781932378 172.31.23.72 -> 172.31.31.144 OpenFlow 189 Type: OFPT_PACKET_IN
176 2.781950285 172.31.23.72 -> 172.31.31.144 OpenFlow 189 Type: OFPT_PACKET_IN
177 2.781952644 172.31.23.72 -> 172.31.31.144 OpenFlow 435 Type: OFPT_PACKET_IN
178 2.781972654 172.31.23.72 -> 172.31.31.144 OpenFlow 189 Type: OFPT_PACKET_IN
179 2.781993472 172.31.31.144 -> 172.31.23.72 OpenFlow 187 Type: OFPT_PACKET_OUT
180 2.782017539 172.31.23.72 -> 172.31.31.144 OpenFlow 189 Type: OFPT_PACKET_IN
181 2.782023556 172.31.23.72 -> 172.31.31.144 OpenFlow 435 Type: OFPT_PACKET_IN
182 2.782038561 172.31.23.72 -> 172.31.31.144 OpenFlow 189 Type: OFPT_PACKET_IN
183 2.782040774 172.31.23.72 -> 172.31.31.144 OpenFlow 189 Type: OFPT_PACKET_IN
184 2.782055128 172.31.23.72 -> 172.31.31.144 OpenFlow 189 Type: OFPT_PACKET_IN
185 2.782109346 172.31.31.144 -> 172.31.23.72 OpenFlow 187 Type: OFPT_PACKET_OUT
186 2.782113726 172.31.31.144 -> 172.31.23.72 OpenFlow 308 Type: OFPT_PACKET_OUT
187 2.782115794 172.31.31.144 -> 172.31.23.72 TCP 66 6633 → 33640 [ACK] Seq=122 Ack=124 Win=853 Len=0 TSval=1304611 TSecr=26143712
188 2.782122037 172.31.23.72 -> 172.31.31.144 OpenFlow 189 Type: OFPT_PACKET_IN
189 2.782127883 172.31.23.72 -> 172.31.31.144 OpenFlow 189 Type: OFPT_PACKET_IN
190 2.782173353 172.31.23.72 -> 172.31.31.144 OpenFlow 189 Type: OFPT_PACKET_IN
191 2.782220897 172.31.31.144 -> 172.31.23.72 TCP 66 6633 → 33640 [ACK] Seq=122 Ack=247 Win=853 Len=0 TSval=1304611 TSecr=26143712
192 2.782226308 172.31.31.144 -> 172.31.23.72 OpenFlow 187 Type: OFPT_PACKET_OUT
193 2.782228272 172.31.31.144 -> 172.31.23.72 TCP 66 6633 → 33660 [ACK] Seq=97 Ack=10532 Win=853 Len=0 TSval=1304611 TSecr=26143712
194 2.782231237 172.31.31.144 -> 172.31.23.72 TCP 66 6633 → 33654 [ACK] Seq=97 Ack=7924 Win=853 Len=0 TSval=1304611 TSecr=26143712
195 2.782236711 172.31.23.72 -> 172.31.31.144 OpenFlow 189 Type: OFPT_PACKET_IN
196 2.782287338 172.31.31.144 -> 172.31.23.72 TCP 66 6633 → 33646 [ACK] Seq=1 Ack=124 Win=853 Len=0 TSval=1304611 TSecr=26143712
197 2.782292610 172.31.31.144 -> 172.31.23.72 TCP 66 6633 → 33660 [ACK] Seq=97 Ack=10655 Win=853 Len=0 TSval=1304611 TSecr=26143712
198 2.782297449 172.31.23.72 -> 172.31.31.144 OpenFlow 189 Type: OFPT_PACKET_IN
199 2.782312657 172.31.31.144 -> 172.31.23.72 TCP 66 6633 → 33654 [ACK] Seq=97 Ack=8293 Win=853 Len=0 TSval=1304611 TSecr=26143712
200 2.782335580 172.31.31.144 -> 172.31.23.72 TCP 66 6633 → 33648 [ACK] Seq=1 Ack=124 Win=853 Len=0 TSval=1304611 TSecr=26143712
201 2.782347888 172.31.31.144 -> 172.31.23.72 TCP 66 6633 → 33664 [ACK] Seq=97 Ack=7188 Win=853 Len=0 TSval=1304611 TSecr=26143712
202 2.782367476 172.31.31.144 -> 172.31.23.72 TCP 66 6633 → 33646 [ACK] Seq=1 Ack=493 Win=853 Len=0 TSval=1304611 TSecr=26143712
203 2.782386393 172.31.31.144 -> 172.31.23.72 OpenFlow 187 Type: OFPT_PACKET_OUT
204 2.782392133 172.31.23.72 -> 172.31.31.144 TCP 66 33650 → 6633 [ACK] Seq=10655 Ack=1307 Win=213 Len=0 TSval=26143712 TSecr=1304611
205 2.782435662 172.31.31.144 -> 172.31.23.72 TCP 66 6633 → 33634 [ACK] Seq=1 Ack=247 Win=853 Len=0 TSval=1304611 TSecr=26143712
206 2.782441565 172.31.31.144 -> 172.31.23.72 TCP 66 6633 → 33658 [ACK] Seq=97 Ack=9722 Win=853 Len=0 TSval=1304611 TSecr=26143712
207 2.782465069 172.31.31.144 -> 172.31.23.72 TCP 66 6633 → 33638 [ACK] Seq=1 Ack=124 Win=853 Len=0 TSval=1304611 TSecr=26143712
208 2.782483319 172.31.31.144 -> 172.31.23.72 TCP 66 6633 → 33648 [ACK] Seq=1 Ack=247 Win=853 Len=0 TSval=1304611 TSecr=26143712
209 2.782509352 172.31.31.144 -> 172.31.23.72 OpenFlow 308 Type: OFPT_PACKET_OUT
210 2.782521948 172.31.31.144 -> 172.31.23.72 TCP 66 6633 → 33664 [ACK] Seq=97 Ack=7311 Win=853 Len=0 TSval=1304611 TSecr=26143712
211 2.782541574 172.31.31.144 -> 172.31.23.72 TCP 66 6633 → 33652 [ACK] Seq=1065 Ack=8756 Win=853 Len=0 TSval=1304611 TSecr=26143712
212 2.782561513 172.31.31.144 -> 172.31.23.72 TCP 66 6633 → 33638 [ACK] Seq=1 Ack=247 Win=853 Len=0 TSval=1304611 TSecr=26143712
213 2.782585627 172.31.31.144 -> 172.31.23.72 TCP 66 6633 → 33652 [ACK] Seq=1065 Ack=8879 Win=853 Len=0 TSval=1304611 TSecr=26143712
214 2.782600698 172.31.31.144 -> 172.31.23.72 OpenFlow 187 Type: OFPT_PACKET_OUT
215 2.782683061 172.31.31.144 -> 172.31.23.72 TCP 66 6633 → 33644 [ACK] Seq=1 Ack=247 Win=853 Len=0 TSval=1304611 TSecr=26143712
216 2.782737952 172.31.31.144 -> 172.31.23.72 OpenFlow 187 Type: OFPT_PACKET_OUT
217 2.782810333 172.31.23.72 -> 172.31.31.144 TCP 66 33640 → 6633 [ACK] Seq=247 Ack=848 Win=213 Len=0 TSval=26143712 TSecr=1304611
218 2.782891398 172.31.23.72 -> 172.31.31.144 OpenFlow 189 Type: OFPT_PACKET_IN
219 2.782912506 172.31.23.72 -> 172.31.31.144 OpenFlow 189 Type: OFPT_PACKET_IN
220 2.782919327 172.31.23.72 -> 172.31.31.144 OpenFlow 189 Type: OFPT_PACKET_IN
221 2.782934189 172.31.31.144 -> 172.31.23.72 OpenFlow 187 Type: OFPT_PACKET_OUT
222 2.782943556 172.31.23.72 -> 172.31.31.144 OpenFlow 189 Type: OFPT_PACKET_IN
223 2.782979766 172.31.23.72 -> 172.31.31.144 OpenFlow 189 Type: OFPT_PACKET_IN
224 2.782989837 172.31.23.72 -> 172.31.31.144 OpenFlow 189 Type: OFPT_PACKET_IN
225 2.783008932 172.31.23.72 -> 172.31.31.144 OpenFlow 189 Type: OFPT_PACKET_IN
226 2.783022838 172.31.23.72 -> 172.31.31.144 OpenFlow 189 Type: OFPT_PACKET_IN
227 2.783024989 172.31.23.72 -> 172.31.31.144 OpenFlow 189 Type: OFPT_PACKET_IN
228 2.783065370 172.31.23.72 -> 172.31.31.144 OpenFlow 189 Type: OFPT_PACKET_IN
229 2.783126146 172.31.31.144 -> 172.31.23.72 OpenFlow 187 Type: OFPT_PACKET_OUT
230 2.783140002 172.31.31.144 -> 172.31.23.72 TCP 66 6633 → 33666 [ACK] Seq=97 Ack=8890 Win=853 Len=0 TSval=1304612 TSecr=26143712
231 2.783168773 172.31.31.144 -> 172.31.23.72 TCP 66 6633 → 33666 [ACK] Seq=97 Ack=9013 Win=853 Len=0 TSval=1304612 TSecr=26143712
232 2.783188457 172.31.31.144 -> 172.31.23.72 TCP 66 6633 → 33646 [ACK] Seq=1 Ack=616 Win=853 Len=0 TSval=1304612 TSecr=26143712
233 2.783206661 172.31.31.144 -> 172.31.23.72 TCP 66 6633 → 33632 [ACK] Seq=1 Ack=124 Win=853 Len=0 TSval=1304612 TSecr=26143712
234 2.783225224 172.31.31.144 -> 172.31.23.72 TCP 66 6633 → 33632 [ACK] Seq=1 Ack=247 Win=853 Len=0 TSval=1304612 TSecr=26143712
235 2.783247430 172.31.31.144 -> 172.31.23.72 TCP 66 6633 → 33630 [ACK] Seq=1 Ack=124 Win=853 Len=0 TSval=1304612 TSecr=26143712
236 2.783253403 172.31.23.72 -> 172.31.31.144 TCP 66 33640 → 6633 [ACK] Seq=247 Ack=1090 Win=213 Len=0 TSval=26143712 TSecr=1304612
237 2.783269494 172.31.31.144 -> 172.31.23.72 TCP 66 6633 → 33658 [ACK] Seq=97 Ack=9845 Win=853 Len=0 TSval=1304612 TSecr=26143712
238 2.783293715 172.31.31.144 -> 172.31.23.72 TCP 66 6633 → 33630 [ACK] Seq=1 Ack=247 Win=853 Len=0 TSval=1304612 TSecr=26143712
239 2.783366640 172.31.31.144 -> 172.31.23.72 OpenFlow 187 Type: OFPT_PACKET_OUT
240 2.783379582 172.31.23.72 -> 172.31.31.144 OpenFlow 189 Type: OFPT_PACKET_IN
241 2.783448466 172.31.31.144 -> 172.31.23.72 OpenFlow 187 Type: OFPT_PACKET_OUT
242 2.783490460 172.31.31.144 -> 172.31.23.72 TCP 66 6633 → 33642 [ACK] Seq=1 Ack=247 Win=853 Len=0 TSval=1304612 TSecr=26143712
243 2.783509695 172.31.31.144 -> 172.31.23.72 OpenFlow 187 Type: OFPT_PACKET_OUT
244 2.783555830 172.31.23.72 -> 172.31.31.144 OpenFlow 189 Type: OFPT_PACKET_IN
245 2.783602281 172.31.31.144 -> 172.31.23.72 OpenFlow 187 Type: OFPT_PACKET_OUT
246 2.783606668 172.31.31.144 -> 172.31.23.72 TCP 66 6633 → 33646 [ACK] Seq=1 Ack=739 Win=853 Len=0 TSval=1304612 TSecr=26143713
247 2.783653376 172.31.31.144 -> 172.31.23.72 OpenFlow 187 Type: OFPT_PACKET_OUT
248 2.783715459 172.31.31.144 -> 172.31.23.72 OpenFlow 187 Type: OFPT_PACKET_OUT
249 2.783780236 172.31.31.144 -> 172.31.23.72 OpenFlow 187 Type: OFPT_PACKET_OUT
250 2.783862865 172.31.31.144 -> 172.31.23.72 OpenFlow 187 Type: OFPT_PACKET_OUT
251 2.783884454 172.31.23.72 -> 172.31.31.144 TCP 66 33634 → 6633 [ACK] Seq=247 Ack=848 Win=213 Len=0 TSval=26143713 TSecr=1304612
252 2.783926877 172.31.31.144 -> 172.31.23.72 OpenFlow 187 Type: OFPT_PACKET_OUT
253 2.783981329 172.31.31.144 -> 172.31.23.72 OpenFlow 187 Type: OFPT_PACKET_OUT
254 2.783997541 172.31.23.72 -> 172.31.31.144 TCP 66 33634 → 6633 [ACK] Seq=247 Ack=1090 Win=213 Len=0 TSval=26143713 TSecr=1304612
255 2.784041864 172.31.31.144 -> 172.31.23.72 OpenFlow 187 Type: OFPT_PACKET_OUT
256 2.784121789 172.31.31.144 -> 172.31.23.72 OpenFlow 187 Type: OFPT_PACKET_OUT
257 2.784143836 172.31.23.72 -> 172.31.31.144 OpenFlow 189 Type: OFPT_PACKET_IN
258 2.784162912 172.31.23.72 -> 172.31.31.144 OpenFlow 189 Type: OFPT_PACKET_IN
259 2.784187285 172.31.31.144 -> 172.31.23.72 OpenFlow 187 Type: OFPT_PACKET_OUT
260 2.784217545 172.31.23.72 -> 172.31.31.144 OpenFlow 189 Type: OFPT_PACKET_IN
261 2.784235191 172.31.23.72 -> 172.31.31.144 OpenFlow 189 Type: OFPT_PACKET_IN
262 2.784239559 172.31.23.72 -> 172.31.31.144 OpenFlow 189 Type: OFPT_PACKET_IN
263 2.784258849 172.31.31.144 -> 172.31.23.72 OpenFlow 187 Type: OFPT_PACKET_OUT
264 2.784283516 172.31.23.72 -> 172.31.31.144 OpenFlow 189 Type: OFPT_PACKET_IN
265 2.784305696 172.31.31.144 -> 172.31.23.72 OpenFlow 187 Type: OFPT_PACKET_OUT
266 2.784349340 172.31.31.144 -> 172.31.23.72 TCP 66 6633 → 33632 [ACK] Seq=1 Ack=370 Win=853 Len=0 TSval=1304612 TSecr=26143713
267 2.784366755 172.31.31.144 -> 172.31.23.72 TCP 66 6633 → 33632 [ACK] Seq=1 Ack=493 Win=853 Len=0 TSval=1304612 TSecr=26143713
268 2.784372589 172.31.23.72 -> 172.31.31.144 OpenFlow 189 Type: OFPT_PACKET_IN
269 2.784391796 172.31.23.72 -> 172.31.31.144 OpenFlow 189 Type: OFPT_PACKET_IN
270 2.784398584 172.31.23.72 -> 172.31.31.144 OpenFlow 189 Type: OFPT_PACKET_IN
271 2.784413917 172.31.31.144 -> 172.31.23.72 OpenFlow 187 Type: OFPT_PACKET_OUT
272 2.784470003 172.31.31.144 -> 172.31.23.72 TCP 66 6633 → 33638 [ACK] Seq=1 Ack=370 Win=853 Len=0 TSval=1304612 TSecr=26143713
273 2.784487420 172.31.31.144 -> 172.31.23.72 TCP 66 6633 → 33638 [ACK] Seq=1 Ack=493 Win=853 Len=0 TSval=1304612 TSecr=26143713
274 2.784506593 172.31.31.144 -> 172.31.23.72 OpenFlow 187 Type: OFPT_PACKET_OUT
275 2.784612236 172.31.31.144 -> 172.31.23.72 OpenFlow 187 Type: OFPT_PACKET_OUT
276 2.784631322 172.31.31.144 -> 172.31.23.72 TCP 66 6633 → 33642 [ACK] Seq=1 Ack=493 Win=853 Len=0 TSval=1304612 TSecr=26143713
277 2.784650140 172.31.31.144 -> 172.31.23.72 TCP 66 6633 → 33636 [ACK] Seq=969 Ack=247 Win=853 Len=0 TSval=1304612 TSecr=26143713
278 2.784677134 172.31.31.144 -> 172.31.23.72 TCP 66 6633 → 33650 [ACK] Seq=1307 Ack=10901 Win=853 Len=0 TSval=1304612 TSecr=26143713
279 2.784689704 172.31.31.144 -> 172.31.23.72 OpenFlow 187 Type: OFPT_PACKET_OUT
280 2.784788675 172.31.31.144 -> 172.31.23.72 OpenFlow 187 Type: OFPT_PACKET_OUT
281 2.784825727 172.31.31.144 -> 172.31.23.72 OpenFlow 187 Type: OFPT_PACKET_OUT
282 2.784893399 172.31.23.72 -> 172.31.31.144 TCP 66 33660 → 6633 [ACK] Seq=10655 Ack=1307 Win=213 Len=0 TSval=26143713 TSecr=1304612
283 2.784906992 172.31.31.144 -> 172.31.23.72 OpenFlow 187 Type: OFPT_PACKET_OUT
284 2.784945203 172.31.31.144 -> 172.31.23.72 OpenFlow 187 Type: OFPT_PACKET_OUT
285 2.785014032 172.31.31.144 -> 172.31.23.72 OpenFlow 187 Type: OFPT_PACKET_OUT
286 2.785054893 172.31.31.144 -> 172.31.23.72 OpenFlow 187 Type: OFPT_PACKET_OUT
287 2.785112143 172.31.31.144 -> 172.31.23.72 OpenFlow 187 Type: OFPT_PACKET_OUT
288 2.785176347 172.31.23.72 -> 172.31.31.144 TCP 66 33654 → 6633 [ACK] Seq=8293 Ack=702 Win=213 Len=0 TSval=26143713 TSecr=1304612
289 2.785186972 172.31.31.144 -> 172.31.23.72 OpenFlow 187 Type: OFPT_PACKET_OUT
290 2.785243964 172.31.31.144 -> 172.31.23.72 OpenFlow 187 Type: OFPT_PACKET_OUT
291 2.785291119 172.31.23.72 -> 172.31.31.144 TCP 66 33654 → 6633 [ACK] Seq=8293 Ack=944 Win=213 Len=0 TSval=26143713 TSecr=1304612
292 2.785301740 172.31.31.144 -> 172.31.23.72 OpenFlow 187 Type: OFPT_PACKET_OUT
293 2.785370776 172.31.31.144 -> 172.31.23.72 OpenFlow 187 Type: OFPT_PACKET_OUT
294 2.785436406 172.31.31.144 -> 172.31.23.72 OpenFlow 187 Type: OFPT_PACKET_OUT
295 2.785468207 172.31.23.72 -> 172.31.31.144 TCP 66 33666 → 6633 [ACK] Seq=9013 Ack=339 Win=213 Len=0 TSval=26143713 TSecr=1304612
296 2.785509888 172.31.31.144 -> 172.31.23.72 OpenFlow 187 Type: OFPT_PACKET_OUT
297 2.785564577 172.31.31.144 -> 172.31.23.72 OpenFlow 187 Type: OFPT_PACKET_OUT
298 2.785578956 172.31.23.72 -> 172.31.31.144 OpenFlow 189 Type: OFPT_PACKET_IN
299 2.785603371 172.31.23.72 -> 172.31.31.144 OpenFlow 435 Type: OFPT_PACKET_IN
300 2.785609299 172.31.23.72 -> 172.31.31.144 OpenFlow 189 Type: OFPT_PACKET_IN
301 2.785628563 172.31.23.72 -> 172.31.31.144 OpenFlow 189 Type: OFPT_PACKET_IN
302 2.785637031 172.31.31.144 -> 172.31.23.72 OpenFlow 187 Type: OFPT_PACKET_OUT
303 2.785654626 172.31.23.72 -> 172.31.31.144 OpenFlow 189 Type: OFPT_PACKET_IN
304 2.785663456 172.31.23.72 -> 172.31.31.144 OpenFlow 189 Type: OFPT_PACKET_IN
305 2.785680643 172.31.23.72 -> 172.31.31.144 OpenFlow 189 Type: OFPT_PACKET_IN
306 2.785682848 172.31.23.72 -> 172.31.31.144 OpenFlow 189 Type: OFPT_PACKET_IN
307 2.785703513 172.31.31.144 -> 172.31.23.72 OpenFlow 187 Type: OFPT_PACKET_OUT
308 2.785750404 172.31.23.72 -> 172.31.31.144 OpenFlow 189 Type: OFPT_PACKET_IN
309 2.785756060 172.31.23.72 -> 172.31.31.144 OpenFlow 189 Type: OFPT_PACKET_IN
310 2.785784937 172.31.23.72 -> 172.31.31.144 OpenFlow 189 Type: OFPT_PACKET_IN
311 2.785791308 172.31.31.144 -> 172.31.23.72 OpenFlow 187 Type: OFPT_PACKET_OUT
312 2.785815116 172.31.23.72 -> 172.31.31.144 OpenFlow 189 Type: OFPT_PACKET_IN
313 2.785831258 172.31.23.72 -> 172.31.31.144 OpenFlow 189 Type: OFPT_PACKET_IN
314 2.785833499 172.31.23.72 -> 172.31.31.144 OpenFlow 189 Type: OFPT_PACKET_IN
315 2.785857556 172.31.31.144 -> 172.31.23.72 TCP 66 6633 → 33662 [ACK] Seq=97 Ack=8868 Win=853 Len=0 TSval=1304612 TSecr=26143713
316 2.785862469 172.31.31.144 -> 172.31.23.72 TCP 66 6633 → 33662 [ACK] Seq=97 Ack=9237 Win=853 Len=0 TSval=1304612 TSecr=26143713
317 2.785883611 172.31.23.72 -> 172.31.31.144 OpenFlow 189 Type: OFPT_PACKET_IN
318 2.785888312 172.31.23.72 -> 172.31.31.144 OpenFlow 435 Type: OFPT_PACKET_IN
319 2.785930245 172.31.31.144 -> 172.31.23.72 OpenFlow 187 Type: OFPT_PACKET_OUT
320 2.785934878 172.31.31.144 -> 172.31.23.72 TCP 66 6633 → 33648 [ACK] Seq=1 Ack=370 Win=853 Len=0 TSval=1304612 TSecr=26143713
321 2.785937587 172.31.31.144 -> 172.31.23.72 TCP 66 6633 → 33672 [ACK] Seq=97 Ack=8420 Win=853 Len=0 TSval=1304612 TSecr=26143713
322 2.785939243 172.31.31.144 -> 172.31.23.72 TCP 66 6633 → 33648 [ACK] Seq=1 Ack=493 Win=853 Len=0 TSval=1304612 TSecr=26143713
323 2.785975554 172.31.31.144 -> 172.31.23.72 TCP 66 6633 → 33658 [ACK] Seq=97 Ack=9968 Win=853 Len=0 TSval=1304612 TSecr=26143713
324 2.785979463 172.31.31.144 -> 172.31.23.72 TCP 66 6633 → 33672 [ACK] Seq=97 Ack=8543 Win=853 Len=0 TSval=1304612 TSecr=26143713
325 2.785997031 172.31.23.72 -> 172.31.31.144 TCP 66 33666 → 6633 [ACK] Seq=9013 Ack=823 Win=213 Len=0 TSval=26143713 TSecr=1304612
326 2.786005461 172.31.31.144 -> 172.31.23.72 OpenFlow 187 Type: OFPT_PACKET_OUT
327 2.786042859 172.31.31.144 -> 172.31.23.72 TCP 66 6633 → 33658 [ACK] Seq=97 Ack=10091 Win=853 Len=0 TSval=1304612 TSecr=26143713
328 2.786047068 172.31.31.144 -> 172.31.23.72 TCP 66 6633 → 33668 [ACK] Seq=1065 Ack=8756 Win=853 Len=0 TSval=1304612 TSecr=26143713
329 2.786162451 172.31.23.72 -> 172.31.31.144 TCP 66 33646 → 6633 [ACK] Seq=739 Ack=364 Win=213 Len=0 TSval=26143713 TSecr=1304612
330 2.786192706 172.31.31.144 -> 172.31.23.72 TCP 66 6633 → 33670 [ACK] Seq=97 Ack=9125 Win=853 Len=0 TSval=1304612 TSecr=26143713
331 2.786253512 172.31.23.72 -> 172.31.31.144 OpenFlow 189 Type: OFPT_PACKET_IN
332 2.786278014 172.31.23.72 -> 172.31.31.144 OpenFlow 189 Type: OFPT_PACKET_IN
333 2.786304299 172.31.31.144 -> 172.31.23.72 TCP 66 6633 → 33656 [ACK] Seq=823 Ack=6980 Win=853 Len=0 TSval=1304612 TSecr=26143713
334 2.786308644 172.31.31.144 -> 172.31.23.72 TCP 66 6633 → 33652 [ACK] Seq=1065 Ack=9002 Win=853 Len=0 TSval=1304612 TSecr=26143713
335 2.786327260 172.31.31.144 -> 172.31.23.72 TCP 66 6633 → 33668 [ACK] Seq=1065 Ack=8879 Win=853 Len=0 TSval=1304612 TSecr=26143713
336 2.786349098 172.31.31.144 -> 172.31.23.72 TCP 66 6633 → 33656 [ACK] Seq=823 Ack=7103 Win=853 Len=0 TSval=1304612 TSecr=26143713
337 2.786367916 172.31.31.144 -> 172.31.23.72 TCP 66 6633 → 33652 [ACK] Seq=1065 Ack=9371 Win=853 Len=0 TSval=1304612 TSecr=26143713
338 2.786386920 172.31.31.144 -> 172.31.23.72 OpenFlow 187 Type: OFPT_PACKET_OUT
339 2.786405852 172.31.31.144 -> 172.31.23.72 OpenFlow 187 Type: OFPT_PACKET_OUT
340 2.786443235 172.31.23.72 -> 172.31.31.144 OpenFlow 189 Type: OFPT_PACKET_IN
341 2.786459874 172.31.23.72 -> 172.31.31.144 OpenFlow 189 Type: OFPT_PACKET_IN
342 2.786467430 172.31.23.72 -> 172.31.31.144 OpenFlow 189 Type: OFPT_PACKET_IN
343 2.786535354 172.31.31.144 -> 172.31.23.72 OpenFlow 187 Type: OFPT_PACKET_OUT
344 2.786550163 172.31.31.144 -> 172.31.23.72 TCP 66 6633 → 33648 [ACK] Seq=1 Ack=616 Win=853 Len=0 TSval=1304612 TSecr=26143713
345 2.786567382 172.31.31.144 -> 172.31.23.72 TCP 66 6633 → 33648 [ACK] Seq=1 Ack=739 Win=853 Len=0 TSval=1304612 TSecr=26143713
346 2.786587803 172.31.31.144 -> 172.31.23.72 OpenFlow 187 Type: OFPT_PACKET_OUT
347 2.786672913 172.31.23.72 -> 172.31.31.144 TCP 66 33646 → 6633 [ACK] Seq=739 Ack=848 Win=213 Len=0 TSval=26143713 TSecr=1304612
348 2.786720779 172.31.31.144 -> 172.31.23.72 OpenFlow 187 Type: OFPT_PACKET_OUT
349 2.786835318 172.31.31.144 -> 172.31.23.72 OpenFlow 187 Type: OFPT_PACKET_OUT
350 2.786843508 172.31.23.72 -> 172.31.31.144 OpenFlow 189 Type: OFPT_PACKET_IN
351 2.786852434 172.31.31.144 -> 172.31.23.72 TCP 66 6633 → 33650 [ACK] Seq=1307 Ack=11147 Win=853 Len=0 TSval=1304613 TSecr=26143713
352 2.786862943 172.31.23.72 -> 172.31.31.144 OpenFlow 189 Type: OFPT_PACKET_IN
353 2.786939172 172.31.31.144 -> 172.31.23.72 OpenFlow 187 Type: OFPT_PACKET_OUT
354 2.786956572 172.31.31.144 -> 172.31.23.72 OpenFlow 187 Type: OFPT_PACKET_OUT
355 2.786975263 172.31.23.72 -> 172.31.31.144 OpenFlow 189 Type: OFPT_PACKET_IN
356 2.786991451 172.31.23.72 -> 172.31.31.144 OpenFlow 189 Type: OFPT_PACKET_IN
357 2.786999106 172.31.23.72 -> 172.31.31.144 OpenFlow 189 Type: OFPT_PACKET_IN
358 2.787064252 172.31.31.144 -> 172.31.23.72 OpenFlow 187 Type: OFPT_PACKET_OUT
359 2.787069233 172.31.31.144 -> 172.31.23.72 OpenFlow 187 Type: OFPT_PACKET_OUT
360 2.787079107 172.31.31.144 -> 172.31.23.72 TCP 66 6633 → 33642 [ACK] Seq=1 Ack=739 Win=853 Len=0 TSval=1304613 TSecr=26143713
361 2.787105088 172.31.23.72 -> 172.31.31.144 TCP 66 33646 → 6633 [ACK] Seq=739 Ack=1211 Win=213 Len=0 TSval=26143713 TSecr=1304612
362 2.787165944 172.31.31.144 -> 172.31.23.72 OpenFlow 187 Type: OFPT_PACKET_OUT
363 2.787297868 172.31.31.144 -> 172.31.23.72 OpenFlow 187 Type: OFPT_PACKET_OUT
364 2.787314764 172.31.31.144 -> 172.31.23.72 TCP 66 6633 → 33640 [ACK] Seq=1211 Ack=493 Win=853 Len=0 TSval=1304613 TSecr=26143713
365 2.787338989 172.31.31.144 -> 172.31.23.72 TCP 66 6633 → 33650 [ACK] Seq=1307 Ack=11393 Win=853 Len=0 TSval=1304613 TSecr=26143713
366 2.787364618 172.31.31.144 -> 172.31.23.72 OpenFlow 187 Type: OFPT_PACKET_OUT
367 2.787441100 172.31.23.72 -> 172.31.31.144 TCP 66 33644 → 6633 [ACK] Seq=247 Ack=727 Win=213 Len=0 TSval=26143714 TSecr=1304613
368 2.787517756 172.31.23.72 -> 172.31.31.144 OpenFlow 189 Type: OFPT_PACKET_IN
369 2.787539277 172.31.23.72 -> 172.31.31.144 OpenFlow 189 Type: OFPT_PACKET_IN
370 2.787575563 172.31.23.72 -> 172.31.31.144 OpenFlow 189 Type: OFPT_PACKET_IN
371 2.787597865 172.31.23.72 -> 172.31.31.144 OpenFlow 189 Type: OFPT_PACKET_IN
372 2.787679327 172.31.23.72 -> 172.31.31.144 OpenFlow 189 Type: OFPT_PACKET_IN
373 2.787696305 172.31.23.72 -> 172.31.31.144 OpenFlow 189 Type: OFPT_PACKET_IN
374 2.787704401 172.31.23.72 -> 172.31.31.144 OpenFlow 189 Type: OFPT_PACKET_IN
375 2.787744925 172.31.23.72 -> 172.31.31.144 OpenFlow 189 Type: OFPT_PACKET_IN
376 2.787788421 172.31.31.144 -> 172.31.23.72 TCP 66 6633 → 33648 [ACK] Seq=1 Ack=862 Win=853 Len=0 TSval=1304613 TSecr=26143714
377 2.787834529 172.31.31.144 -> 172.31.23.72 TCP 66 6633 → 33642 [ACK] Seq=1 Ack=985 Win=853 Len=0 TSval=1304613 TSecr=26143714
378 2.787908601 172.31.31.144 -> 172.31.23.72 TCP 66 6633 → 33648 [ACK] Seq=1 Ack=985 Win=853 Len=0 TSval=1304613 TSecr=26143714
379 2.787926198 172.31.31.144 -> 172.31.23.72 TCP 66 6633 → 33652 [ACK] Seq=1065 Ack=9494 Win=853 Len=0 TSval=1304613 TSecr=26143714
380 2.787954388 172.31.31.144 -> 172.31.23.72 TCP 66 6633 → 33652 [ACK] Seq=1065 Ack=9617 Win=853 Len=0 TSval=1304613 TSecr=26143714
381 2.788113560 172.31.31.144 -> 172.31.23.72 TCP 66 6633 → 33636 [ACK] Seq=969 Ack=493 Win=853 Len=0 TSval=1304613 TSecr=26143714
382 2.793136306 172.31.31.144 -> 172.31.23.72 OpenFlow 146 Type: OFPT_FLOW_MOD
