  1 0.000000000 172.31.31.144 -> 172.31.24.227 TCP 90 6633 → 50430 [PSH, ACK] Seq=1 Ack=1 Win=853 Len=24 TSval=1256580 TSecr=394321302
  2 0.000034518 172.31.31.144 -> 172.31.24.227 TCP 106 6633 → 50430 [PSH, ACK] Seq=25 Ack=1 Win=853 Len=40 TSval=1256580 TSecr=394321302
  3 0.000433843 172.31.24.227 -> 172.31.31.144 OpenFlow 82 Type: OFPT_MULTIPART_REPLY, OFPMP_GROUP
  4 0.000484129 172.31.24.227 -> 172.31.31.144 OpenFlow 98 Type: OFPT_MULTIPART_REPLY, OFPMP_METER
  5 0.000696835 172.31.31.144 -> 172.31.24.227 TCP 66 6633 → 50430 [ACK] Seq=65 Ack=17 Win=853 Len=0 TSval=1256580 TSecr=394321852
  6 0.000709587 172.31.31.144 -> 172.31.24.227 TCP 66 6633 → 50430 [ACK] Seq=65 Ack=49 Win=853 Len=0 TSval=1256580 TSecr=394321852
  7 0.101463689 172.31.31.144 -> 172.31.24.227 TCP 90 6633 → 50432 [PSH, ACK] Seq=1 Ack=1 Win=853 Len=24 TSval=1256605 TSecr=394321302
  8 0.101491093 172.31.31.144 -> 172.31.24.227 TCP 82 6633 → 50432 [PSH, ACK] Seq=25 Ack=1 Win=853 Len=16 TSval=1256605 TSecr=394321302
  9 0.101508650 172.31.31.144 -> 172.31.24.227 TCP 90 6633 → 50432 [PSH, ACK] Seq=41 Ack=1 Win=853 Len=24 TSval=1256605 TSecr=394321302
 10 0.101511245 172.31.31.144 -> 172.31.24.227 TCP 90 6633 → 50434 [PSH, ACK] Seq=1 Ack=1 Win=853 Len=24 TSval=1256605 TSecr=394321303
 11 0.101514915 172.31.31.144 -> 172.31.24.227 TCP 106 6633 → 50434 [PSH, ACK] Seq=25 Ack=1 Win=853 Len=40 TSval=1256605 TSecr=394321303
 12 0.101731720 172.31.24.227 -> 172.31.31.144 OpenFlow 82 Type: OFPT_MULTIPART_REPLY, OFPMP_GROUP
 13 0.101806432 172.31.24.227 -> 172.31.31.144 OpenFlow 98 Type: OFPT_MULTIPART_REPLY, OFPMP_METER
 14 0.101830025 172.31.24.227 -> 172.31.31.144 OpenFlow 82 Type: OFPT_MULTIPART_REPLY, OFPMP_GROUP
 15 0.101866540 172.31.24.227 -> 172.31.31.144 OpenFlow 98 Type: OFPT_MULTIPART_REPLY, OFPMP_METER
 16 0.102075584 172.31.31.144 -> 172.31.24.227 TCP 66 6633 → 50434 [ACK] Seq=65 Ack=17 Win=853 Len=0 TSval=1256605 TSecr=394321877
 17 0.102092793 172.31.31.144 -> 172.31.24.227 TCP 66 6633 → 50434 [ACK] Seq=65 Ack=49 Win=853 Len=0 TSval=1256605 TSecr=394321877
 18 0.102096596 172.31.31.144 -> 172.31.24.227 TCP 66 6633 → 50432 [ACK] Seq=65 Ack=17 Win=853 Len=0 TSval=1256605 TSecr=394321877
 19 0.102099256 172.31.31.144 -> 172.31.24.227 TCP 66 6633 → 50432 [ACK] Seq=65 Ack=49 Win=853 Len=0 TSval=1256605 TSecr=394321877
 20 0.199601469 172.31.31.144 -> 172.31.24.227 TCP 90 6633 → 50436 [PSH, ACK] Seq=1 Ack=1 Win=853 Len=24 TSval=1256630 TSecr=394321328
 21 0.199629973 172.31.31.144 -> 172.31.24.227 TCP 82 6633 → 50436 [PSH, ACK] Seq=25 Ack=1 Win=853 Len=16 TSval=1256630 TSecr=394321328
 22 0.199634580 172.31.31.144 -> 172.31.24.227 TCP 90 6633 → 50436 [PSH, ACK] Seq=41 Ack=1 Win=853 Len=24 TSval=1256630 TSecr=394321328
 23 0.199636913 172.31.31.144 -> 172.31.24.227 TCP 90 6633 → 50438 [PSH, ACK] Seq=1 Ack=1 Win=853 Len=24 TSval=1256630 TSecr=394321302
 24 0.199641156 172.31.31.144 -> 172.31.24.227 TCP 106 6633 → 50438 [PSH, ACK] Seq=25 Ack=1 Win=853 Len=40 TSval=1256630 TSecr=394321302
 25 0.199822796 172.31.24.227 -> 172.31.31.144 OpenFlow 82 Type: OFPT_MULTIPART_REPLY, OFPMP_GROUP
 26 0.199847137 172.31.24.227 -> 172.31.31.144 OpenFlow 82 Type: OFPT_MULTIPART_REPLY, OFPMP_GROUP_DESC
 27 0.199879216 172.31.24.227 -> 172.31.31.144 OpenFlow 82 Type: OFPT_MULTIPART_REPLY, OFPMP_METER
 28 0.200000151 172.31.24.227 -> 172.31.31.144 OpenFlow 82 Type: OFPT_MULTIPART_REPLY, OFPMP_GROUP
 29 0.200083221 172.31.31.144 -> 172.31.24.227 TCP 66 6633 → 50436 [ACK] Seq=65 Ack=17 Win=853 Len=0 TSval=1256630 TSecr=394321902
 30 0.200092036 172.31.31.144 -> 172.31.24.227 TCP 66 6633 → 50436 [ACK] Seq=65 Ack=33 Win=853 Len=0 TSval=1256630 TSecr=394321902
 31 0.200094735 172.31.31.144 -> 172.31.24.227 TCP 66 6633 → 50436 [ACK] Seq=65 Ack=49 Win=853 Len=0 TSval=1256630 TSecr=394321902
 32 0.200102068 172.31.24.227 -> 172.31.31.144 OpenFlow 98 Type: OFPT_MULTIPART_REPLY, OFPMP_METER
 33 0.200266234 172.31.31.144 -> 172.31.24.227 TCP 66 6633 → 50438 [ACK] Seq=65 Ack=17 Win=853 Len=0 TSval=1256630 TSecr=394321902
 34 0.200297780 172.31.31.144 -> 172.31.24.227 TCP 66 6633 → 50438 [ACK] Seq=65 Ack=49 Win=853 Len=0 TSval=1256630 TSecr=394321902
 35 0.299828176 172.31.31.144 -> 172.31.24.227 TCP 90 6633 → 50440 [PSH, ACK] Seq=1 Ack=1 Win=853 Len=24 TSval=1256655 TSecr=394321352
 36 0.299863276 172.31.31.144 -> 172.31.24.227 TCP 82 6633 → 50440 [PSH, ACK] Seq=25 Ack=1 Win=853 Len=16 TSval=1256655 TSecr=394321352
 37 0.299868708 172.31.31.144 -> 172.31.24.227 TCP 90 6633 → 50440 [PSH, ACK] Seq=41 Ack=1 Win=853 Len=24 TSval=1256655 TSecr=394321352
 38 0.299871212 172.31.31.144 -> 172.31.24.227 TCP 90 6633 → 50442 [PSH, ACK] Seq=1 Ack=1 Win=853 Len=24 TSval=1256655 TSecr=394321328
 39 0.299874941 172.31.31.144 -> 172.31.24.227 TCP 106 6633 → 50442 [PSH, ACK] Seq=25 Ack=1 Win=853 Len=40 TSval=1256655 TSecr=394321328
 40 0.300115915 172.31.24.227 -> 172.31.31.144 OpenFlow 82 Type: OFPT_MULTIPART_REPLY, OFPMP_GROUP
 41 0.300194033 172.31.24.227 -> 172.31.31.144 OpenFlow 98 Type: OFPT_MULTIPART_REPLY, OFPMP_METER
 42 0.300278886 172.31.24.227 -> 172.31.31.144 OpenFlow 82 Type: OFPT_MULTIPART_REPLY, OFPMP_GROUP
 43 0.300312142 172.31.24.227 -> 172.31.31.144 OpenFlow 98 Type: OFPT_MULTIPART_REPLY, OFPMP_METER
 44 0.300429824 172.31.31.144 -> 172.31.24.227 TCP 66 6633 → 50440 [ACK] Seq=65 Ack=17 Win=853 Len=0 TSval=1256655 TSecr=394321927
 45 0.300439007 172.31.31.144 -> 172.31.24.227 TCP 66 6633 → 50440 [ACK] Seq=65 Ack=49 Win=853 Len=0 TSval=1256655 TSecr=394321927
 46 0.300489217 172.31.31.144 -> 172.31.24.227 TCP 66 6633 → 50442 [ACK] Seq=65 Ack=17 Win=853 Len=0 TSval=1256655 TSecr=394321927
 47 0.300523008 172.31.31.144 -> 172.31.24.227 TCP 66 6633 → 50442 [ACK] Seq=65 Ack=49 Win=853 Len=0 TSval=1256655 TSecr=394321927
 48 0.400014284 172.31.31.144 -> 172.31.24.227 TCP 90 6633 → 50446 [PSH, ACK] Seq=1 Ack=1 Win=853 Len=24 TSval=1256680 TSecr=394321377
 49 0.400049509 172.31.31.144 -> 172.31.24.227 TCP 90 6633 → 50444 [PSH, ACK] Seq=1 Ack=1 Win=853 Len=24 TSval=1256680 TSecr=394321352
 50 0.400054124 172.31.31.144 -> 172.31.24.227 TCP 106 6633 → 50446 [PSH, ACK] Seq=25 Ack=1 Win=853 Len=40 TSval=1256680 TSecr=394321377
 51 0.400058394 172.31.31.144 -> 172.31.24.227 TCP 106 6633 → 50444 [PSH, ACK] Seq=25 Ack=1 Win=853 Len=40 TSval=1256680 TSecr=394321352
 52 0.400318854 172.31.24.227 -> 172.31.31.144 OpenFlow 82 Type: OFPT_MULTIPART_REPLY, OFPMP_GROUP
 53 0.400347970 172.31.24.227 -> 172.31.31.144 OpenFlow 98 Type: OFPT_MULTIPART_REPLY, OFPMP_METER
 54 0.400369123 172.31.24.227 -> 172.31.31.144 OpenFlow 82 Type: OFPT_MULTIPART_REPLY, OFPMP_GROUP
 55 0.400416090 172.31.24.227 -> 172.31.31.144 OpenFlow 98 Type: OFPT_MULTIPART_REPLY, OFPMP_METER
 56 0.400600433 172.31.31.144 -> 172.31.24.227 TCP 66 6633 → 50446 [ACK] Seq=65 Ack=17 Win=853 Len=0 TSval=1256680 TSecr=394321952
 57 0.400609292 172.31.31.144 -> 172.31.24.227 TCP 66 6633 → 50446 [ACK] Seq=65 Ack=49 Win=853 Len=0 TSval=1256680 TSecr=394321952
 58 0.400612129 172.31.31.144 -> 172.31.24.227 TCP 66 6633 → 50444 [ACK] Seq=65 Ack=17 Win=853 Len=0 TSval=1256680 TSecr=394321952
 59 0.400614852 172.31.31.144 -> 172.31.24.227 TCP 66 6633 → 50444 [ACK] Seq=65 Ack=49 Win=853 Len=0 TSval=1256680 TSecr=394321952
 60 0.500086614 172.31.31.144 -> 172.31.24.227 TCP 90 6633 → 50448 [PSH, ACK] Seq=1 Ack=1 Win=853 Len=24 TSval=1256705 TSecr=394321402
 61 0.500109182 172.31.31.144 -> 172.31.24.227 TCP 90 6633 → 50450 [PSH, ACK] Seq=1 Ack=1 Win=853 Len=24 TSval=1256705 TSecr=394321477
 62 0.500112927 172.31.31.144 -> 172.31.24.227 TCP 106 6633 → 50448 [PSH, ACK] Seq=25 Ack=1 Win=853 Len=40 TSval=1256705 TSecr=394321402
 63 0.500116645 172.31.31.144 -> 172.31.24.227 TCP 82 6633 → 50450 [PSH, ACK] Seq=25 Ack=1 Win=853 Len=16 TSval=1256705 TSecr=394321477
 64 0.500118957 172.31.31.144 -> 172.31.24.227 TCP 90 6633 → 50450 [PSH, ACK] Seq=41 Ack=1 Win=853 Len=24 TSval=1256705 TSecr=394321477
 65 0.500210730 172.31.24.227 -> 172.31.31.144 OpenFlow 82 Type: OFPT_MULTIPART_REPLY, OFPMP_GROUP
 66 0.500257166 172.31.24.227 -> 172.31.31.144 OpenFlow 98 Type: OFPT_MULTIPART_REPLY, OFPMP_METER
 67 0.500318878 172.31.24.227 -> 172.31.31.144 OpenFlow 82 Type: OFPT_MULTIPART_REPLY, OFPMP_GROUP
 68 0.500336403 172.31.24.227 -> 172.31.31.144 OpenFlow 82 Type: OFPT_MULTIPART_REPLY, OFPMP_GROUP_DESC
 69 0.500368978 172.31.24.227 -> 172.31.31.144 OpenFlow 82 Type: OFPT_MULTIPART_REPLY, OFPMP_METER
 70 0.500456452 172.31.31.144 -> 172.31.24.227 TCP 66 6633 → 50450 [ACK] Seq=65 Ack=17 Win=853 Len=0 TSval=1256705 TSecr=394321977
 71 0.500464685 172.31.31.144 -> 172.31.24.227 TCP 66 6633 → 50450 [ACK] Seq=65 Ack=49 Win=853 Len=0 TSval=1256705 TSecr=394321977
 72 0.500639386 172.31.31.144 -> 172.31.24.227 TCP 66 6633 → 50448 [ACK] Seq=65 Ack=17 Win=853 Len=0 TSval=1256705 TSecr=394321977
 73 0.500644253 172.31.31.144 -> 172.31.24.227 TCP 66 6633 → 50448 [ACK] Seq=65 Ack=33 Win=853 Len=0 TSval=1256705 TSecr=394321977
 74 0.500646920 172.31.31.144 -> 172.31.24.227 TCP 66 6633 → 50448 [ACK] Seq=65 Ack=49 Win=853 Len=0 TSval=1256705 TSecr=394321977
 75 0.600248642 172.31.31.144 -> 172.31.24.227 TCP 90 6633 → 50452 [PSH, ACK] Seq=1 Ack=1 Win=853 Len=24 TSval=1256730 TSecr=394321427
 76 0.600274184 172.31.31.144 -> 172.31.24.227 TCP 106 6633 → 50452 [PSH, ACK] Seq=25 Ack=1 Win=853 Len=40 TSval=1256730 TSecr=394321427
 77 0.600434889 172.31.24.227 -> 172.31.31.144 OpenFlow 82 Type: OFPT_MULTIPART_REPLY, OFPMP_GROUP
 78 0.600538373 172.31.31.144 -> 172.31.24.227 TCP 90 6633 → 50454 [PSH, ACK] Seq=1 Ack=1 Win=853 Len=24 TSval=1256730 TSecr=394321427
 79 0.600548021 172.31.24.227 -> 172.31.31.144 TCP 66 50454 → 6633 [ACK] Seq=1 Ack=25 Win=213 Len=0 TSval=394322002 TSecr=1256730
 80 0.600553232 172.31.31.144 -> 172.31.24.227 OpenFlow 187 Type: OFPT_PACKET_OUT
 81 0.600556838 172.31.31.144 -> 172.31.24.227 TCP 106 6633 → 50454 [PSH, ACK] Seq=25 Ack=1 Win=853 Len=40 TSval=1256730 TSecr=394321427
 82 0.600561097 172.31.24.227 -> 172.31.31.144 TCP 66 50454 → 6633 [ACK] Seq=1 Ack=65 Win=213 Len=0 TSval=394322002 TSecr=1256730
 83 0.600567934 172.31.31.144 -> 172.31.24.227 OpenFlow 308 Type: OFPT_PACKET_OUT
 84 0.600571186 172.31.31.144 -> 172.31.24.227 OpenFlow 429 Type: OFPT_PACKET_OUT
 85 0.600578301 172.31.24.227 -> 172.31.31.144 OpenFlow 98 Type: OFPT_MULTIPART_REPLY, OFPMP_METER
 86 0.600717499 172.31.31.144 -> 172.31.24.227 TCP 66 6633 → 50452 [ACK] Seq=65 Ack=17 Win=853 Len=0 TSval=1256730 TSecr=394322002
 87 0.600788344 172.31.31.144 -> 172.31.24.227 TCP 66 6633 → 50452 [ACK] Seq=65 Ack=49 Win=853 Len=0 TSval=1256730 TSecr=394322002
 88 0.600882204 172.31.24.227 -> 172.31.31.144 TCP 66 50430 → 6633 [ACK] Seq=49 Ack=791 Win=213 Len=0 TSval=394322002 TSecr=1256730
 89 0.601073929 172.31.24.227 -> 172.31.31.144 OpenFlow 189 Type: OFPT_PACKET_IN
 90 0.601093799 172.31.24.227 -> 172.31.31.144 OpenFlow 189 Type: OFPT_PACKET_IN
 91 0.601128272 172.31.24.227 -> 172.31.31.144 OpenFlow 82 Type: OFPT_MULTIPART_REPLY, OFPMP_GROUP
 92 0.601151258 172.31.24.227 -> 172.31.31.144 OpenFlow 98 Type: OFPT_MULTIPART_REPLY, OFPMP_METER
 93 0.601183460 172.31.24.227 -> 172.31.31.144 OpenFlow 189 Type: OFPT_PACKET_IN
 94 0.601204909 172.31.24.227 -> 172.31.31.144 OpenFlow 189 Type: OFPT_PACKET_IN
 95 0.601333636 172.31.31.144 -> 172.31.24.227 TCP 66 6633 → 50440 [ACK] Seq=65 Ack=172 Win=853 Len=0 TSval=1256730 TSecr=394322002
 96 0.601341158 172.31.31.144 -> 172.31.24.227 TCP 66 6633 → 50440 [ACK] Seq=65 Ack=295 Win=853 Len=0 TSval=1256730 TSecr=394322002
 97 0.601343699 172.31.31.144 -> 172.31.24.227 TCP 66 6633 → 50454 [ACK] Seq=65 Ack=17 Win=853 Len=0 TSval=1256730 TSecr=394322002
 98 0.601346734 172.31.31.144 -> 172.31.24.227 TCP 66 6633 → 50454 [ACK] Seq=65 Ack=49 Win=853 Len=0 TSval=1256730 TSecr=394322002
 99 0.601398249 172.31.31.144 -> 172.31.24.227 TCP 66 6633 → 50432 [ACK] Seq=65 Ack=172 Win=853 Len=0 TSval=1256730 TSecr=394322002
100 0.601465492 172.31.31.144 -> 172.31.24.227 TCP 66 6633 → 50432 [ACK] Seq=65 Ack=295 Win=853 Len=0 TSval=1256730 TSecr=394322002
101 0.679031086 172.31.24.227 -> 172.31.31.144 OpenFlow 146 Type: OFPT_PORT_STATUS
102 0.679101358 172.31.24.227 -> 172.31.31.144 OpenFlow 146 Type: OFPT_PORT_STATUS
103 0.679276164 172.31.31.144 -> 172.31.24.227 TCP 66 6633 → 50474 [ACK] Seq=1 Ack=81 Win=853 Len=0 TSval=1256750 TSecr=394322022
104 0.699671830 172.31.31.144 -> 172.31.24.227 TCP 90 6633 → 50456 [PSH, ACK] Seq=1 Ack=1 Win=853 Len=24 TSval=1256755 TSecr=394321452
105 0.699684217 172.31.31.144 -> 172.31.24.227 TCP 106 6633 → 50456 [PSH, ACK] Seq=25 Ack=1 Win=853 Len=40 TSval=1256755 TSecr=394321452
106 0.699763498 172.31.31.144 -> 172.31.24.227 OpenFlow 187 Type: OFPT_PACKET_OUT
107 0.699804147 172.31.24.227 -> 172.31.31.144 OpenFlow 82 Type: OFPT_MULTIPART_REPLY, OFPMP_GROUP
108 0.699811332 172.31.31.144 -> 172.31.24.227 OpenFlow 187 Type: OFPT_PACKET_OUT
109 0.699830698 172.31.24.227 -> 172.31.31.144 OpenFlow 82 Type: OFPT_MULTIPART_REPLY, OFPMP_GROUP_DESC
110 0.699876895 172.31.31.144 -> 172.31.24.227 OpenFlow 187 Type: OFPT_PACKET_OUT
111 0.699887746 172.31.24.227 -> 172.31.31.144 OpenFlow 82 Type: OFPT_MULTIPART_REPLY, OFPMP_METER
112 0.699928961 172.31.31.144 -> 172.31.24.227 OpenFlow 187 Type: OFPT_PACKET_OUT
113 0.699998979 172.31.31.144 -> 172.31.24.227 OpenFlow 187 Type: OFPT_PACKET_OUT
114 0.700004929 172.31.31.144 -> 172.31.24.227 TCP 66 6633 → 50456 [ACK] Seq=65 Ack=17 Win=853 Len=0 TSval=1256755 TSecr=394322027
115 0.700097781 172.31.31.144 -> 172.31.24.227 TCP 66 6633 → 50456 [ACK] Seq=65 Ack=33 Win=853 Len=0 TSval=1256755 TSecr=394322027
116 0.700105027 172.31.31.144 -> 172.31.24.227 OpenFlow 187 Type: OFPT_PACKET_OUT
117 0.700108058 172.31.31.144 -> 172.31.24.227 TCP 66 6633 → 50456 [ACK] Seq=65 Ack=49 Win=853 Len=0 TSval=1256755 TSecr=394322027
118 0.700175313 172.31.31.144 -> 172.31.24.227 OpenFlow 187 Type: OFPT_PACKET_OUT
119 0.700221554 172.31.31.144 -> 172.31.24.227 OpenFlow 187 Type: OFPT_PACKET_OUT
120 0.700327675 172.31.24.227 -> 172.31.31.144 TCP 66 50432 → 6633 [ACK] Seq=295 Ack=1033 Win=213 Len=0 TSval=394322027 TSecr=1256755
121 0.700435315 172.31.24.227 -> 172.31.31.144 OpenFlow 189 Type: OFPT_PACKET_IN
122 0.700457345 172.31.24.227 -> 172.31.31.144 OpenFlow 189 Type: OFPT_PACKET_IN
123 0.700612192 172.31.31.144 -> 172.31.24.227 TCP 90 6633 → 50458 [PSH, ACK] Seq=1 Ack=1 Win=853 Len=24 TSval=1256755 TSecr=394321477
124 0.700620823 172.31.31.144 -> 172.31.24.227 TCP 82 6633 → 50458 [PSH, ACK] Seq=25 Ack=1 Win=853 Len=16 TSval=1256755 TSecr=394321477
125 0.700623548 172.31.31.144 -> 172.31.24.227 TCP 90 6633 → 50458 [PSH, ACK] Seq=41 Ack=1 Win=853 Len=24 TSval=1256755 TSecr=394321477
126 0.700625878 172.31.31.144 -> 172.31.24.227 OpenFlow 187 Type: OFPT_PACKET_OUT
127 0.700629187 172.31.31.144 -> 172.31.24.227 OpenFlow 1155 Type: OFPT_PACKET_OUT
128 0.700661469 172.31.31.144 -> 172.31.24.227 TCP 66 6633 → 50430 [ACK] Seq=791 Ack=172 Win=853 Len=0 TSval=1256755 TSecr=394322027
129 0.700672268 172.31.24.227 -> 172.31.31.144 OpenFlow 189 Type: OFPT_PACKET_IN
130 0.700692334 172.31.24.227 -> 172.31.31.144 OpenFlow 189 Type: OFPT_PACKET_IN
131 0.700709001 172.31.24.227 -> 172.31.31.144 OpenFlow 189 Type: OFPT_PACKET_IN
132 0.700753296 172.31.24.227 -> 172.31.31.144 OpenFlow 189 Type: OFPT_PACKET_IN
133 0.700799666 172.31.31.144 -> 172.31.24.227 TCP 66 6633 → 50430 [ACK] Seq=791 Ack=295 Win=853 Len=0 TSval=1256755 TSecr=394322027
134 0.700860878 172.31.31.144 -> 172.31.24.227 TCP 66 6633 → 50440 [ACK] Seq=65 Ack=418 Win=853 Len=0 TSval=1256755 TSecr=394322027
135 0.700946270 172.31.31.144 -> 172.31.24.227 TCP 66 6633 → 50440 [ACK] Seq=65 Ack=541 Win=853 Len=0 TSval=1256755 TSecr=394322027
136 0.700953062 172.31.31.144 -> 172.31.24.227 TCP 66 6633 → 50434 [ACK] Seq=1275 Ack=172 Win=853 Len=0 TSval=1256755 TSecr=394322027
137 0.701001715 172.31.31.144 -> 172.31.24.227 TCP 66 6633 → 50434 [ACK] Seq=1275 Ack=295 Win=853 Len=0 TSval=1256755 TSecr=394322027
138 0.701271555 172.31.24.227 -> 172.31.31.144 OpenFlow 189 Type: OFPT_PACKET_IN
139 0.701291804 172.31.24.227 -> 172.31.31.144 OpenFlow 189 Type: OFPT_PACKET_IN
140 0.701348748 172.31.24.227 -> 172.31.31.144 OpenFlow 82 Type: OFPT_MULTIPART_REPLY, OFPMP_GROUP
141 0.701366976 172.31.24.227 -> 172.31.31.144 OpenFlow 82 Type: OFPT_MULTIPART_REPLY, OFPMP_GROUP_DESC
142 0.701385819 172.31.24.227 -> 172.31.31.144 OpenFlow 189 Type: OFPT_PACKET_IN
143 0.701403175 172.31.24.227 -> 172.31.31.144 OpenFlow 189 Type: OFPT_PACKET_IN
144 0.701409620 172.31.24.227 -> 172.31.31.144 OpenFlow 82 Type: OFPT_MULTIPART_REPLY, OFPMP_METER
145 0.701453867 172.31.24.227 -> 172.31.31.144 OpenFlow 189 Type: OFPT_PACKET_IN
146 0.701460743 172.31.24.227 -> 172.31.31.144 OpenFlow 189 Type: OFPT_PACKET_IN
147 0.701530023 172.31.24.227 -> 172.31.31.144 OpenFlow 189 Type: OFPT_PACKET_IN
148 0.701642576 172.31.31.144 -> 172.31.24.227 TCP 66 6633 → 50458 [ACK] Seq=65 Ack=17 Win=853 Len=0 TSval=1256755 TSecr=394322027
149 0.701649261 172.31.31.144 -> 172.31.24.227 TCP 66 6633 → 50458 [ACK] Seq=65 Ack=33 Win=853 Len=0 TSval=1256755 TSecr=394322027
150 0.701651758 172.31.31.144 -> 172.31.24.227 TCP 66 6633 → 50442 [ACK] Seq=65 Ack=172 Win=853 Len=0 TSval=1256755 TSecr=394322027
151 0.701655168 172.31.31.144 -> 172.31.24.227 TCP 66 6633 → 50438 [ACK] Seq=65 Ack=172 Win=853 Len=0 TSval=1256755 TSecr=394322027
152 0.701662094 172.31.24.227 -> 172.31.31.144 OpenFlow 189 Type: OFPT_PACKET_IN
153 0.701709671 172.31.31.144 -> 172.31.24.227 TCP 66 6633 → 50458 [ACK] Seq=65 Ack=49 Win=853 Len=0 TSval=1256755 TSecr=394322027
154 0.701714960 172.31.31.144 -> 172.31.24.227 TCP 66 6633 → 50438 [ACK] Seq=65 Ack=295 Win=853 Len=0 TSval=1256755 TSecr=394322027
155 0.701717607 172.31.31.144 -> 172.31.24.227 TCP 66 6633 → 50442 [ACK] Seq=65 Ack=295 Win=853 Len=0 TSval=1256755 TSecr=394322027
156 0.701814615 172.31.31.144 -> 172.31.24.227 TCP 66 6633 → 50436 [ACK] Seq=65 Ack=172 Win=853 Len=0 TSval=1256755 TSecr=394322027
157 0.701873925 172.31.31.144 -> 172.31.24.227 TCP 66 6633 → 50436 [ACK] Seq=65 Ack=295 Win=853 Len=0 TSval=1256755 TSecr=394322027
158 0.704615383 172.31.31.144 -> 172.31.24.227 OpenFlow 146 Type: OFPT_FLOW_MOD
159 0.704625209 172.31.31.144 -> 172.31.24.227 OpenFlow 146 Type: OFPT_FLOW_MOD
160 0.704629545 172.31.31.144 -> 172.31.24.227 OpenFlow 154 Type: OFPT_BARRIER_REQUEST
161 0.704632451 172.31.31.144 -> 172.31.24.227 OpenFlow 154 Type: OFPT_BARRIER_REQUEST
162 0.704767069 172.31.24.227 -> 172.31.31.144 TCP 66 50448 → 6633 [ACK] Seq=49 Ack=233 Win=213 Len=0 TSval=394322028 TSecr=1256756
163 0.704784925 172.31.31.144 -> 172.31.24.227 TCP 66 6633 → 50432 [ACK] Seq=1033 Ack=541 Win=853 Len=0 TSval=1256756 TSecr=394322027
164 0.704791972 172.31.24.227 -> 172.31.31.144 OpenFlow 74 Type: OFPT_BARRIER_REPLY
165 0.704835504 172.31.24.227 -> 172.31.31.144 TCP 66 50472 → 6633 [ACK] Seq=81 Ack=169 Win=213 Len=0 TSval=394322028 TSecr=1256756
166 0.704845436 172.31.24.227 -> 172.31.31.144 OpenFlow 74 Type: OFPT_BARRIER_REPLY
167 0.704995983 172.31.31.144 -> 172.31.24.227 OpenFlow 146 Type: OFPT_FLOW_MOD
168 0.705001832 172.31.31.144 -> 172.31.24.227 TCP 66 6633 → 50448 [ACK] Seq=233 Ack=57 Win=853 Len=0 TSval=1256756 TSecr=394322028
169 0.705003978 172.31.31.144 -> 172.31.24.227 OpenFlow 154 Type: OFPT_BARRIER_REQUEST
170 0.705010997 172.31.24.227 -> 172.31.31.144 OpenFlow 146 Type: OFPT_FLOW_REMOVED
171 0.705029753 172.31.24.227 -> 172.31.31.144 OpenFlow 146 Type: OFPT_FLOW_REMOVED
172 0.705039629 172.31.24.227 -> 172.31.31.144 OpenFlow 146 Type: OFPT_FLOW_REMOVED
173 0.705084441 172.31.24.227 -> 172.31.31.144 OpenFlow 146 Type: OFPT_FLOW_REMOVED
174 0.705211765 172.31.31.144 -> 172.31.24.227 TCP 66 6633 → 50448 [ACK] Seq=233 Ack=137 Win=853 Len=0 TSval=1256756 TSecr=394322028
175 0.705217470 172.31.31.144 -> 172.31.24.227 TCP 66 6633 → 50448 [ACK] Seq=233 Ack=217 Win=853 Len=0 TSval=1256756 TSecr=394322028
176 0.707198124 172.31.24.227 -> 172.31.31.144 OpenFlow 74 Type: OFPT_BARRIER_REPLY
177 0.707571445 172.31.31.144 -> 172.31.24.227 OpenFlow 146 Type: OFPT_FLOW_MOD
178 0.707580860 172.31.31.144 -> 172.31.24.227 OpenFlow 154 Type: OFPT_BARRIER_REQUEST
179 0.707584005 172.31.31.144 -> 172.31.24.227 OpenFlow 146 Type: OFPT_FLOW_MOD
180 0.707586624 172.31.31.144 -> 172.31.24.227 OpenFlow 154 Type: OFPT_BARRIER_REQUEST
181 0.707589071 172.31.31.144 -> 172.31.24.227 TCP 146 6633 → 50476 [PSH, ACK] Seq=1 Ack=1 Win=853 Len=80 TSval=1256757 TSecr=394321552
182 0.707592055 172.31.31.144 -> 172.31.24.227 TCP 146 6633 → 50476 [PSH, ACK] Seq=81 Ack=1 Win=853 Len=80 TSval=1256757 TSecr=394321552
183 0.707594107 172.31.31.144 -> 172.31.24.227 TCP 234 6633 → 50476 [PSH, ACK] Seq=161 Ack=1 Win=853 Len=168 TSval=1256757 TSecr=394321552
184 0.707596667 172.31.31.144 -> 172.31.24.227 TCP 242 6633 → 50476 [PSH, ACK] Seq=329 Ack=1 Win=853 Len=176 TSval=1256757 TSecr=394321552
185 0.707598671 172.31.31.144 -> 172.31.24.227 TCP 146 6633 → 50468 [PSH, ACK] Seq=1 Ack=1 Win=853 Len=80 TSval=1256757 TSecr=394321502
186 0.707604372 172.31.31.144 -> 172.31.24.227 TCP 154 6633 → 50468 [PSH, ACK] Seq=81 Ack=1 Win=853 Len=88 TSval=1256757 TSecr=394321502
187 0.707606282 172.31.31.144 -> 172.31.24.227 TCP 146 6633 → 50460 [PSH, ACK] Seq=1 Ack=1 Win=853 Len=80 TSval=1256757 TSecr=394321528
188 0.707608853 172.31.31.144 -> 172.31.24.227 TCP 154 6633 → 50460 [PSH, ACK] Seq=81 Ack=1 Win=853 Len=88 TSval=1256757 TSecr=394321528
189 0.707610933 172.31.31.144 -> 172.31.24.227 TCP 570 6633 → 50460 [PSH, ACK] Seq=169 Ack=1 Win=853 Len=504 TSval=1256757 TSecr=394321528
190 0.707613147 172.31.31.144 -> 172.31.24.227 TCP 570 6633 → 50460 [PSH, ACK] Seq=673 Ack=1 Win=853 Len=504 TSval=1256757 TSecr=394321528
191 0.707615234 172.31.31.144 -> 172.31.24.227 TCP 146 6633 → 50462 [PSH, ACK] Seq=1 Ack=1 Win=853 Len=80 TSval=1256757 TSecr=394321528
192 0.707617868 172.31.31.144 -> 172.31.24.227 OpenFlow 146 Type: OFPT_FLOW_MOD
193 0.707620238 172.31.31.144 -> 172.31.24.227 TCP 154 6633 → 50462 [PSH, ACK] Seq=81 Ack=1 Win=853 Len=88 TSval=1256757 TSecr=394321528
194 0.707622106 172.31.31.144 -> 172.31.24.227 OpenFlow 154 Type: OFPT_BARRIER_REQUEST
195 0.707623960 172.31.31.144 -> 172.31.24.227 OpenFlow 146 Type: OFPT_FLOW_MOD
196 0.707625888 172.31.31.144 -> 172.31.24.227 OpenFlow 146 Type: OFPT_FLOW_MOD
197 0.707628151 172.31.31.144 -> 172.31.24.227 OpenFlow 146 Type: OFPT_FLOW_MOD
198 0.707630731 172.31.31.144 -> 172.31.24.227 OpenFlow 154 Type: OFPT_BARRIER_REQUEST
199 0.707632910 172.31.31.144 -> 172.31.24.227 TCP 146 6633 → 50470 [PSH, ACK] Seq=1 Ack=1 Win=853 Len=80 TSval=1256757 TSecr=394321528
200 0.707635824 172.31.31.144 -> 172.31.24.227 OpenFlow 314 Type: OFPT_FLOW_MOD
201 0.707638126 172.31.31.144 -> 172.31.24.227 OpenFlow 146 Type: OFPT_FLOW_MOD
202 0.707639710 172.31.31.144 -> 172.31.24.227 OpenFlow 74 Type: OFPT_BARRIER_REQUEST
203 0.707641473 172.31.31.144 -> 172.31.24.227 TCP 154 6633 → 50470 [PSH, ACK] Seq=81 Ack=1 Win=853 Len=88 TSval=1256757 TSecr=394321528
204 0.707643257 172.31.31.144 -> 172.31.24.227 OpenFlow 146 Type: OFPT_FLOW_MOD
205 0.707645337 172.31.31.144 -> 172.31.24.227 OpenFlow 410 Type: OFPT_BARRIER_REQUEST
206 0.707647143 172.31.31.144 -> 172.31.24.227 OpenFlow 146 Type: OFPT_FLOW_MOD
207 0.707648908 172.31.31.144 -> 172.31.24.227 OpenFlow 482 Type: OFPT_FLOW_MOD
208 0.707650835 172.31.31.144 -> 172.31.24.227 OpenFlow 154 Type: OFPT_BARRIER_REQUEST
209 0.707652341 172.31.31.144 -> 172.31.24.227 OpenFlow 914 Type: OFPT_BARRIER_REQUEST
210 0.707654160 172.31.31.144 -> 172.31.24.227 OpenFlow 146 Type: OFPT_FLOW_MOD
211 0.707656445 172.31.31.144 -> 172.31.24.227 OpenFlow 314 Type: OFPT_FLOW_MOD
212 0.707658632 172.31.31.144 -> 172.31.24.227 OpenFlow 402 Type: OFPT_BARRIER_REQUEST
213 0.707660531 172.31.31.144 -> 172.31.24.227 OpenFlow 242 Type: OFPT_BARRIER_REQUEST
214 0.707662129 172.31.31.144 -> 172.31.24.227 OpenFlow 146 Type: OFPT_FLOW_MOD
215 0.707663912 172.31.31.144 -> 172.31.24.227 OpenFlow 322 Type: OFPT_BARRIER_REQUEST
216 0.707665740 172.31.31.144 -> 172.31.24.227 OpenFlow 146 Type: OFPT_FLOW_MOD
217 0.707667970 172.31.31.144 -> 172.31.24.227 OpenFlow 146 Type: OFPT_FLOW_MOD
218 0.707673317 172.31.24.227 -> 172.31.31.144 OpenFlow 226 Type: OFPT_FLOW_REMOVED
219 0.707680006 172.31.31.144 -> 172.31.24.227 OpenFlow 322 Type: OFPT_BARRIER_REQUEST
220 0.707682829 172.31.31.144 -> 172.31.24.227 OpenFlow 482 Type: OFPT_FLOW_MOD
221 0.707685234 172.31.31.144 -> 172.31.24.227 OpenFlow 146 Type: OFPT_FLOW_MOD
222 0.707690408 172.31.31.144 -> 172.31.24.227 OpenFlow 578 Type: OFPT_BARRIER_REQUEST
223 0.707693533 172.31.31.144 -> 172.31.24.227 OpenFlow 322 Type: OFPT_BARRIER_REQUEST
224 0.707695876 172.31.31.144 -> 172.31.24.227 OpenFlow 146 Type: OFPT_FLOW_MOD
225 0.707698006 172.31.31.144 -> 172.31.24.227 OpenFlow 322 Type: OFPT_BARRIER_REQUEST
226 0.707699892 172.31.31.144 -> 172.31.24.227 OpenFlow 234 Type: OFPT_BARRIER_REQUEST
227 0.707888667 172.31.31.144 -> 172.31.24.227 TCP 66 6633 → 50472 [ACK] Seq=1345 Ack=417 Win=853 Len=0 TSval=1256757 TSecr=394322029
228 0.708914310 172.31.24.227 -> 172.31.31.144 TCP 66 50468 → 6633 [ACK] Seq=1 Ack=169 Win=213 Len=0 TSval=394322029 TSecr=1256757
229 0.708927536 172.31.24.227 -> 172.31.31.144 OpenFlow 74 Type: OFPT_BARRIER_REPLY
230 0.708974205 172.31.24.227 -> 172.31.31.144 OpenFlow 74 Type: OFPT_BARRIER_REPLY
231 0.708998141 172.31.24.227 -> 172.31.31.144 OpenFlow 74 Type: OFPT_BARRIER_REPLY
232 0.709020494 172.31.24.227 -> 172.31.31.144 OpenFlow 74 Type: OFPT_BARRIER_REPLY
233 0.709051713 172.31.24.227 -> 172.31.31.144 TCP 66 50436 → 6633 [ACK] Seq=295 Ack=233 Win=213 Len=0 TSval=394322029 TSecr=1256757
234 0.709060502 172.31.24.227 -> 172.31.31.144 OpenFlow 74 Type: OFPT_BARRIER_REPLY
235 0.709086100 172.31.24.227 -> 172.31.31.144 OpenFlow 74 Type: OFPT_BARRIER_REPLY
236 0.709140333 172.31.31.144 -> 172.31.24.227 TCP 66 6633 → 50468 [ACK] Seq=169 Ack=9 Win=853 Len=0 TSval=1256757 TSecr=394322029
237 0.709173218 172.31.24.227 -> 172.31.31.144 OpenFlow 74 Type: OFPT_BARRIER_REPLY
238 0.709183558 172.31.24.227 -> 172.31.31.144 OpenFlow 82 Type: OFPT_BARRIER_REPLY
239 0.709205712 172.31.31.144 -> 172.31.24.227 TCP 66 6633 → 50452 [ACK] Seq=569 Ack=57 Win=853 Len=0 TSval=1256757 TSecr=394322029
240 0.709210685 172.31.31.144 -> 172.31.24.227 TCP 66 6633 → 50452 [ACK] Seq=569 Ack=65 Win=853 Len=0 TSval=1256757 TSecr=394322029
241 0.709234675 172.31.24.227 -> 172.31.31.144 OpenFlow 82 Type: OFPT_BARRIER_REPLY
242 0.709262111 172.31.24.227 -> 172.31.31.144 OpenFlow 74 Type: OFPT_BARRIER_REPLY
243 0.709276278 172.31.31.144 -> 172.31.24.227 TCP 66 6633 → 50452 [ACK] Seq=569 Ack=73 Win=853 Len=0 TSval=1256757 TSecr=394322029
244 0.709304499 172.31.24.227 -> 172.31.31.144 OpenFlow 74 Type: OFPT_BARRIER_REPLY
245 0.709328699 172.31.24.227 -> 172.31.31.144 OpenFlow 74 Type: OFPT_BARRIER_REPLY
246 0.709345843 172.31.31.144 -> 172.31.24.227 TCP 66 6633 → 50450 [ACK] Seq=569 Ack=57 Win=853 Len=0 TSval=1256757 TSecr=394322029
247 0.709395265 172.31.24.227 -> 172.31.31.144 OpenFlow 98 Type: OFPT_BARRIER_REPLY
248 0.709438153 172.31.31.144 -> 172.31.24.227 TCP 66 6633 → 50450 [ACK] Seq=569 Ack=73 Win=853 Len=0 TSval=1256757 TSecr=394322029
249 0.709445583 172.31.31.144 -> 172.31.24.227 TCP 66 6633 → 50440 [ACK] Seq=569 Ack=565 Win=853 Len=0 TSval=1256757 TSecr=394322029
250 0.709451372 172.31.24.227 -> 172.31.31.144 OpenFlow 82 Type: OFPT_BARRIER_REPLY
251 0.709459859 172.31.24.227 -> 172.31.31.144 TCP 66 50454 → 6633 [ACK] Seq=49 Ack=233 Win=213 Len=0 TSval=394322029 TSecr=1256757
252 0.709465485 172.31.24.227 -> 172.31.31.144 OpenFlow 74 Type: OFPT_BARRIER_REPLY
253 0.709515305 172.31.24.227 -> 172.31.31.144 OpenFlow 74 Type: OFPT_BARRIER_REPLY
254 0.709552307 172.31.24.227 -> 172.31.31.144 TCP 66 50444 → 6633 [ACK] Seq=49 Ack=233 Win=213 Len=0 TSval=394322029 TSecr=1256757
255 0.709558038 172.31.24.227 -> 172.31.31.144 OpenFlow 74 Type: OFPT_BARRIER_REPLY
256 0.709568598 172.31.31.144 -> 172.31.24.227 TCP 66 6633 → 50460 [ACK] Seq=1177 Ack=9 Win=853 Len=0 TSval=1256757 TSecr=394322029
257 0.709573317 172.31.31.144 -> 172.31.24.227 TCP 66 6633 → 50434 [ACK] Seq=1611 Ack=311 Win=853 Len=0 TSval=1256757 TSecr=394322029
258 0.709599456 172.31.24.227 -> 172.31.31.144 OpenFlow 74 Type: OFPT_BARRIER_REPLY
259 0.709639329 172.31.24.227 -> 172.31.31.144 TCP 66 50462 → 6633 [ACK] Seq=1 Ack=169 Win=213 Len=0 TSval=394322029 TSecr=1256757
260 0.709642961 172.31.24.227 -> 172.31.31.144 OpenFlow 74 Type: OFPT_BARRIER_REPLY
261 0.709648429 172.31.24.227 -> 172.31.31.144 OpenFlow 74 Type: OFPT_BARRIER_REPLY
262 0.709677582 172.31.24.227 -> 172.31.31.144 OpenFlow 74 Type: OFPT_BARRIER_REPLY
263 0.709711093 172.31.31.144 -> 172.31.24.227 TCP 66 6633 → 50460 [ACK] Seq=1177 Ack=41 Win=853 Len=0 TSval=1256757 TSecr=394322029
264 0.709716332 172.31.31.144 -> 172.31.24.227 TCP 66 6633 → 50460 [ACK] Seq=1177 Ack=57 Win=853 Len=0 TSval=1256757 TSecr=394322029
265 0.709741526 172.31.24.227 -> 172.31.31.144 OpenFlow 74 Type: OFPT_BARRIER_REPLY
266 0.709748917 172.31.24.227 -> 172.31.31.144 OpenFlow 74 Type: OFPT_BARRIER_REPLY
267 0.709855802 172.31.24.227 -> 172.31.31.144 OpenFlow 74 Type: OFPT_BARRIER_REPLY
268 0.709901350 172.31.31.144 -> 172.31.24.227 TCP 66 6633 → 50454 [ACK] Seq=233 Ack=57 Win=853 Len=0 TSval=1256757 TSecr=394322029
269 0.709906504 172.31.31.144 -> 172.31.24.227 TCP 66 6633 → 50446 [ACK] Seq=401 Ack=57 Win=853 Len=0 TSval=1256757 TSecr=394322029
270 0.709908986 172.31.31.144 -> 172.31.24.227 TCP 66 6633 → 50444 [ACK] Seq=233 Ack=57 Win=853 Len=0 TSval=1256757 TSecr=394322029
271 0.709914304 172.31.24.227 -> 172.31.31.144 OpenFlow 82 Type: OFPT_BARRIER_REPLY
272 0.709920653 172.31.24.227 -> 172.31.31.144 OpenFlow 122 Type: OFPT_BARRIER_REPLY
273 0.709962433 172.31.24.227 -> 172.31.31.144 TCP 66 50430 → 6633 [ACK] Seq=295 Ack=959 Win=213 Len=0 TSval=394322029 TSecr=1256757
274 0.709968292 172.31.24.227 -> 172.31.31.144 OpenFlow 74 Type: OFPT_BARRIER_REPLY
275 0.709989930 172.31.24.227 -> 172.31.31.144 TCP 66 50470 → 6633 [ACK] Seq=1 Ack=169 Win=213 Len=0 TSval=394322029 TSecr=1256757
276 0.709995313 172.31.24.227 -> 172.31.31.144 OpenFlow 74 Type: OFPT_BARRIER_REPLY
277 0.710021744 172.31.24.227 -> 172.31.31.144 OpenFlow 74 Type: OFPT_BARRIER_REPLY
278 0.710024645 172.31.24.227 -> 172.31.31.144 OpenFlow 106 Type: OFPT_BARRIER_REPLY
279 0.710040436 172.31.31.144 -> 172.31.24.227 TCP 66 6633 → 50446 [ACK] Seq=401 Ack=65 Win=853 Len=0 TSval=1256757 TSecr=394322029
280 0.710045236 172.31.31.144 -> 172.31.24.227 TCP 66 6633 → 50462 [ACK] Seq=169 Ack=9 Win=853 Len=0 TSval=1256757 TSecr=394322029
281 0.710047659 172.31.31.144 -> 172.31.24.227 TCP 66 6633 → 50476 [ACK] Seq=505 Ack=9 Win=853 Len=0 TSval=1256757 TSecr=394322029
282 0.710088290 172.31.24.227 -> 172.31.31.144 OpenFlow 74 Type: OFPT_BARRIER_REPLY
283 0.710242988 172.31.24.227 -> 172.31.31.144 OpenFlow 82 Type: OFPT_BARRIER_REPLY
284 0.710265484 172.31.31.144 -> 172.31.24.227 TCP 66 6633 → 50432 [ACK] Seq=1369 Ack=557 Win=853 Len=0 TSval=1256757 TSecr=394322029
285 0.710271636 172.31.31.144 -> 172.31.24.227 TCP 66 6633 → 50476 [ACK] Seq=505 Ack=25 Win=853 Len=0 TSval=1256757 TSecr=394322029
286 0.710293983 172.31.24.227 -> 172.31.31.144 OpenFlow 74 Type: OFPT_BARRIER_REPLY
287 0.710352801 172.31.24.227 -> 172.31.31.144 OpenFlow 146 Type: OFPT_FLOW_REMOVED
288 0.710371506 172.31.24.227 -> 172.31.31.144 OpenFlow 146 Type: OFPT_FLOW_REMOVED
289 0.710376936 172.31.24.227 -> 172.31.31.144 OpenFlow 146 Type: OFPT_FLOW_REMOVED
290 0.710395566 172.31.24.227 -> 172.31.31.144 OpenFlow 146 Type: OFPT_FLOW_REMOVED
291 0.710404634 172.31.24.227 -> 172.31.31.144 OpenFlow 146 Type: OFPT_FLOW_REMOVED
292 0.710427908 172.31.24.227 -> 172.31.31.144 OpenFlow 146 Type: OFPT_FLOW_REMOVED
293 0.710447095 172.31.24.227 -> 172.31.31.144 OpenFlow 146 Type: OFPT_FLOW_REMOVED
294 0.710460181 172.31.24.227 -> 172.31.31.144 OpenFlow 146 Type: OFPT_FLOW_REMOVED
295 0.710493873 172.31.24.227 -> 172.31.31.144 OpenFlow 146 Type: OFPT_FLOW_REMOVED
296 0.710502783 172.31.24.227 -> 172.31.31.144 OpenFlow 146 Type: OFPT_FLOW_REMOVED
297 0.710516546 172.31.24.227 -> 172.31.31.144 OpenFlow 146 Type: OFPT_FLOW_REMOVED
298 0.710526632 172.31.24.227 -> 172.31.31.144 OpenFlow 146 Type: OFPT_FLOW_REMOVED
299 0.710540304 172.31.24.227 -> 172.31.31.144 OpenFlow 146 Type: OFPT_FLOW_REMOVED
300 0.710549089 172.31.24.227 -> 172.31.31.144 OpenFlow 146 Type: OFPT_FLOW_REMOVED
301 0.710566443 172.31.24.227 -> 172.31.31.144 OpenFlow 146 Type: OFPT_FLOW_REMOVED
302 0.710604410 172.31.24.227 -> 172.31.31.144 OpenFlow 146 Type: OFPT_FLOW_REMOVED
303 0.710635096 172.31.24.227 -> 172.31.31.144 OpenFlow 146 Type: OFPT_FLOW_REMOVED
304 0.710644255 172.31.24.227 -> 172.31.31.144 OpenFlow 146 Type: OFPT_FLOW_REMOVED
305 0.710657381 172.31.24.227 -> 172.31.31.144 OpenFlow 146 Type: OFPT_FLOW_REMOVED
306 0.710675611 172.31.24.227 -> 172.31.31.144 OpenFlow 146 Type: OFPT_FLOW_REMOVED
307 0.710872078 172.31.31.144 -> 172.31.24.227 OpenFlow 170 Type: OFPT_FLOW_MOD
308 0.710877846 172.31.31.144 -> 172.31.24.227 OpenFlow 170 Type: OFPT_FLOW_MOD
309 0.710880142 172.31.31.144 -> 172.31.24.227 OpenFlow 170 Type: OFPT_FLOW_MOD
310 0.710885120 172.31.24.227 -> 172.31.31.144 OpenFlow 146 Type: OFPT_FLOW_REMOVED
311 0.710890916 172.31.31.144 -> 172.31.24.227 OpenFlow 178 Type: OFPT_BARRIER_REQUEST
312 0.710893735 172.31.31.144 -> 172.31.24.227 OpenFlow 178 Type: OFPT_BARRIER_REQUEST
313 0.710895777 172.31.31.144 -> 172.31.24.227 OpenFlow 170 Type: OFPT_FLOW_MOD
314 0.710897538 172.31.31.144 -> 172.31.24.227 OpenFlow 74 Type: OFPT_BARRIER_REQUEST
315 0.710900948 172.31.24.227 -> 172.31.31.144 OpenFlow 146 Type: OFPT_FLOW_REMOVED
316 0.710902688 172.31.31.144 -> 172.31.24.227 OpenFlow 170 Type: OFPT_FLOW_MOD
317 0.710906265 172.31.24.227 -> 172.31.31.144 OpenFlow 1266 Type: OFPT_FLOW_REMOVED
318 0.710907992 172.31.31.144 -> 172.31.24.227 TCP 66 6633 → 50468 [ACK] Seq=169 Ack=89 Win=853 Len=0 TSval=1256758 TSecr=394322030
319 0.710912360 172.31.31.144 -> 172.31.24.227 OpenFlow 170 Type: OFPT_FLOW_MOD
320 0.710914526 172.31.31.144 -> 172.31.24.227 TCP 66 6633 → 50458 [ACK] Seq=569 Ack=73 Win=853 Len=0 TSval=1256758 TSecr=394322029
321 0.710917848 172.31.24.227 -> 172.31.31.144 OpenFlow 466 Type: OFPT_FLOW_REMOVED
322 0.710919587 172.31.31.144 -> 172.31.24.227 OpenFlow 178 Type: OFPT_BARRIER_REQUEST
323 0.710921806 172.31.31.144 -> 172.31.24.227 TCP 66 6633 → 50442 [ACK] Seq=401 Ack=311 Win=853 Len=0 TSval=1256758 TSecr=394322029
324 0.710924916 172.31.24.227 -> 172.31.31.144 OpenFlow 306 Type: OFPT_FLOW_REMOVED
325 0.710926756 172.31.31.144 -> 172.31.24.227 TCP 66 6633 → 50468 [ACK] Seq=169 Ack=169 Win=853 Len=0 TSval=1256758 TSecr=394322030
326 0.710929186 172.31.31.144 -> 172.31.24.227 OpenFlow 170 Type: OFPT_FLOW_MOD
327 0.710931243 172.31.31.144 -> 172.31.24.227 OpenFlow 74 Type: OFPT_BARRIER_REQUEST
328 0.710934130 172.31.24.227 -> 172.31.31.144 OpenFlow 146 Type: OFPT_FLOW_REMOVED
329 0.710935865 172.31.31.144 -> 172.31.24.227 OpenFlow 170 Type: OFPT_FLOW_MOD
330 0.710937938 172.31.31.144 -> 172.31.24.227 OpenFlow 178 Type: OFPT_BARRIER_REQUEST
331 0.710939681 172.31.31.144 -> 172.31.24.227 TCP 66 6633 → 50472 [ACK] Seq=1345 Ack=465 Win=853 Len=0 TSval=1256758 TSecr=394322029
332 0.710943051 172.31.24.227 -> 172.31.31.144 OpenFlow 946 Type: OFPT_FLOW_REMOVED
333 0.710944958 172.31.31.144 -> 172.31.24.227 OpenFlow 170 Type: OFPT_FLOW_MOD
334 0.710946961 172.31.31.144 -> 172.31.24.227 OpenFlow 170 Type: OFPT_FLOW_MOD
335 0.710949389 172.31.31.144 -> 172.31.24.227 OpenFlow 74 Type: OFPT_BARRIER_REQUEST
336 0.710959489 172.31.24.227 -> 172.31.31.144 OpenFlow 466 Type: OFPT_FLOW_REMOVED
337 0.710961953 172.31.24.227 -> 172.31.31.144 OpenFlow 466 Type: OFPT_FLOW_REMOVED
338 0.711327075 172.31.24.227 -> 172.31.31.144 OpenFlow 466 Type: OFPT_FLOW_REMOVED
339 0.711330843 172.31.24.227 -> 172.31.31.144 OpenFlow 306 Type: OFPT_FLOW_REMOVED
340 0.711332943 172.31.24.227 -> 172.31.31.144 OpenFlow 1106 Type: OFPT_FLOW_REMOVED
341 0.711335231 172.31.24.227 -> 172.31.31.144 OpenFlow 306 Type: OFPT_FLOW_REMOVED
342 0.711337497 172.31.24.227 -> 172.31.31.144 OpenFlow 146 Type: OFPT_FLOW_REMOVED
343 0.711339350 172.31.24.227 -> 172.31.31.144 OpenFlow 306 Type: OFPT_FLOW_REMOVED
344 0.711341142 172.31.24.227 -> 172.31.31.144 OpenFlow 466 Type: OFPT_FLOW_REMOVED
345 0.711343047 172.31.24.227 -> 172.31.31.144 OpenFlow 146 Type: OFPT_FLOW_REMOVED
346 0.711344959 172.31.24.227 -> 172.31.31.144 OpenFlow 146 Type: OFPT_FLOW_REMOVED
347 0.711545180 172.31.31.144 -> 172.31.24.227 OpenFlow 170 Type: OFPT_FLOW_MOD
348 0.711551490 172.31.31.144 -> 172.31.24.227 OpenFlow 170 Type: OFPT_FLOW_MOD
349 0.711553668 172.31.31.144 -> 172.31.24.227 OpenFlow 74 Type: OFPT_BARRIER_REQUEST
350 0.711556242 172.31.31.144 -> 172.31.24.227 TCP 170 6633 → 50464 [PSH, ACK] Seq=1 Ack=1 Win=853 Len=104 TSval=1256758 TSecr=394321552
351 0.711560144 172.31.31.144 -> 172.31.24.227 TCP 178 6633 → 50464 [PSH, ACK] Seq=105 Ack=1 Win=853 Len=112 TSval=1256758 TSecr=394321552
352 0.711562256 172.31.31.144 -> 172.31.24.227 TCP 66 6633 → 50450 [ACK] Seq=569 Ack=153 Win=853 Len=0 TSval=1256758 TSecr=394322030
353 0.711564902 172.31.31.144 -> 172.31.24.227 TCP 66 6633 → 50460 [ACK] Seq=1177 Ack=137 Win=853 Len=0 TSval=1256758 TSecr=394322030
354 0.711567167 172.31.31.144 -> 172.31.24.227 TCP 66 6633 → 50446 [ACK] Seq=401 Ack=145 Win=853 Len=0 TSval=1256758 TSecr=394322030
355 0.711569298 172.31.31.144 -> 172.31.24.227 TCP 66 6633 → 50476 [ACK] Seq=505 Ack=105 Win=853 Len=0 TSval=1256758 TSecr=394322030
356 0.711571489 172.31.31.144 -> 172.31.24.227 OpenFlow 170 Type: OFPT_FLOW_MOD
357 0.711574259 172.31.31.144 -> 172.31.24.227 OpenFlow 178 Type: OFPT_BARRIER_REQUEST
358 0.711576093 172.31.31.144 -> 172.31.24.227 TCP 66 6633 → 50430 [ACK] Seq=959 Ack=383 Win=853 Len=0 TSval=1256758 TSecr=394322029
359 0.711578779 172.31.31.144 -> 172.31.24.227 OpenFlow 170 Type: OFPT_FLOW_MOD
360 0.712761010 172.31.31.144 -> 172.31.24.227 OpenFlow 170 Type: OFPT_FLOW_MOD
361 0.712767391 172.31.31.144 -> 172.31.24.227 OpenFlow 74 Type: OFPT_BARRIER_REQUEST
362 0.712770600 172.31.31.144 -> 172.31.24.227 TCP 66 6633 → 50450 [ACK] Seq=569 Ack=553 Win=853 Len=0 TSval=1256758 TSecr=394322030
363 0.712773816 172.31.31.144 -> 172.31.24.227 TCP 66 6633 → 50460 [ACK] Seq=1177 Ack=1177 Win=853 Len=0 TSval=1256758 TSecr=394322030
364 0.712776008 172.31.31.144 -> 172.31.24.227 TCP 66 6633 → 50446 [ACK] Seq=401 Ack=385 Win=853 Len=0 TSval=1256758 TSecr=394322030
365 0.712778239 172.31.31.144 -> 172.31.24.227 OpenFlow 170 Type: OFPT_FLOW_MOD
366 0.712781158 172.31.31.144 -> 172.31.24.227 OpenFlow 282 Type: OFPT_BARRIER_REQUEST
367 0.712783406 172.31.31.144 -> 172.31.24.227 OpenFlow 170 Type: OFPT_FLOW_MOD
368 0.712785831 172.31.31.144 -> 172.31.24.227 TCP 66 6633 → 50476 [ACK] Seq=505 Ack=505 Win=853 Len=0 TSval=1256758 TSecr=394322030
369 0.712788230 172.31.31.144 -> 172.31.24.227 OpenFlow 170 Type: OFPT_FLOW_MOD
370 0.712790342 172.31.31.144 -> 172.31.24.227 OpenFlow 170 Type: OFPT_FLOW_MOD
371 0.712792283 172.31.31.144 -> 172.31.24.227 OpenFlow 170 Type: OFPT_FLOW_MOD
372 0.712794182 172.31.31.144 -> 172.31.24.227 OpenFlow 74 Type: OFPT_BARRIER_REQUEST
373 0.712795892 172.31.31.144 -> 172.31.24.227 OpenFlow 170 Type: OFPT_FLOW_MOD
374 0.712797490 172.31.31.144 -> 172.31.24.227 OpenFlow 74 Type: OFPT_BARRIER_REQUEST
375 0.712811973 172.31.31.144 -> 172.31.24.227 OpenFlow 170 Type: OFPT_FLOW_MOD
376 0.712814191 172.31.31.144 -> 172.31.24.227 OpenFlow 178 Type: OFPT_BARRIER_REQUEST
377 0.712816071 172.31.31.144 -> 172.31.24.227 TCP 66 6633 → 50470 [ACK] Seq=385 Ack=169 Win=853 Len=0 TSval=1256758 TSecr=394322030
378 0.712818559 172.31.31.144 -> 172.31.24.227 OpenFlow 170 Type: OFPT_FLOW_MOD
379 0.712820626 172.31.31.144 -> 172.31.24.227 OpenFlow 178 Type: OFPT_BARRIER_REQUEST
380 0.712822594 172.31.31.144 -> 172.31.24.227 OpenFlow 170 Type: OFPT_FLOW_MOD
381 0.712825219 172.31.31.144 -> 172.31.24.227 OpenFlow 170 Type: OFPT_FLOW_MOD
