  1 0.000000000 137.158.125.247 -> 172.31.24.227 TCP 54 63468 → 22 [ACK] Seq=1 Ack=1 Win=32464 Len=0
  2 0.087248166 137.158.125.247 -> 172.31.24.227 TCP 54 63468 → 22 [ACK] Seq=1 Ack=97 Win=32416 Len=0
  3 0.244450254 172.31.31.144 -> 172.31.24.227 TCP 122 6633 → 53154 [PSH, ACK] Seq=1 Ack=1 Win=853 Len=56 TSval=1840150 TSecr=388732905
  4 0.244475682 172.31.31.144 -> 172.31.24.227 TCP 106 6633 → 53154 [PSH, ACK] Seq=57 Ack=1 Win=853 Len=40 TSval=1840150 TSecr=388732905
  5 0.244793756 172.31.24.227 -> 172.31.31.144 OpenFlow 762 Type: OFPT_MULTIPART_REPLY, OFPMP_FLOW
  6 0.244984815 172.31.24.227 -> 172.31.31.144 OpenFlow 6178 Type: OFPT_MULTIPART_REPLY, OFPMP_TABLE
  7 0.245104146 172.31.24.227 -> 172.31.31.144 OpenFlow 530 Type: OFPT_MULTIPART_REPLY, OFPMP_PORT_STATS
  8 0.245162481 172.31.31.144 -> 172.31.24.227 TCP 66 6633 → 53154 [ACK] Seq=97 Ack=697 Win=853 Len=0 TSval=1840150 TSecr=388733006
  9 0.245306559 172.31.31.144 -> 172.31.24.227 TCP 66 6633 → 53154 [ACK] Seq=97 Ack=6809 Win=853 Len=0 TSval=1840150 TSecr=388733006
 10 0.245381172 172.31.31.144 -> 172.31.24.227 TCP 66 6633 → 53154 [ACK] Seq=97 Ack=7273 Win=853 Len=0 TSval=1840151 TSecr=388733006
 11 0.245763149 172.31.31.144 -> 172.31.24.227 TCP 122 6633 → 53158 [PSH, ACK] Seq=1 Ack=1 Win=853 Len=56 TSval=1840151 TSecr=388732905
 12 0.245771845 172.31.31.144 -> 172.31.24.227 TCP 106 6633 → 53158 [PSH, ACK] Seq=57 Ack=1 Win=853 Len=40 TSval=1840151 TSecr=388732905
 13 0.245891400 172.31.24.227 -> 172.31.31.144 OpenFlow 2010 Type: OFPT_MULTIPART_REPLY, OFPMP_FLOW
 14 0.245992723 172.31.24.227 -> 172.31.31.144 OpenFlow 642 Type: OFPT_MULTIPART_REPLY, OFPMP_PORT_STATS
 15 0.246126832 172.31.31.144 -> 172.31.24.227 TCP 66 6633 → 53158 [ACK] Seq=97 Ack=1945 Win=853 Len=0 TSval=1840151 TSecr=388733006
 16 0.246154727 172.31.24.227 -> 172.31.31.144 OpenFlow 6178 Type: OFPT_MULTIPART_REPLY, OFPMP_TABLE
 17 0.246206886 172.31.31.144 -> 172.31.24.227 TCP 66 6633 → 53158 [ACK] Seq=97 Ack=2521 Win=853 Len=0 TSval=1840151 TSecr=388733006
 18 0.246447884 172.31.31.144 -> 172.31.24.227 TCP 66 6633 → 53158 [ACK] Seq=97 Ack=8633 Win=853 Len=0 TSval=1840151 TSecr=388733006
 19 0.249060524 172.31.31.144 -> 172.31.24.227 TCP 90 6633 → 53156 [PSH, ACK] Seq=1 Ack=1 Win=853 Len=24 TSval=1840151 TSecr=388732905
 20 0.249069609 172.31.31.144 -> 172.31.24.227 TCP 138 6633 → 53156 [PSH, ACK] Seq=25 Ack=1 Win=853 Len=72 TSval=1840151 TSecr=388732905
 21 0.249072801 172.31.31.144 -> 172.31.24.227 TCP 90 6633 → 53170 [PSH, ACK] Seq=1 Ack=1 Win=853 Len=24 TSval=1840151 TSecr=388732878
 22 0.249075933 172.31.31.144 -> 172.31.24.227 TCP 82 6633 → 53152 [PSH, ACK] Seq=1 Ack=1 Win=853 Len=16 TSval=1840151 TSecr=388732905
 23 0.249078980 172.31.31.144 -> 172.31.24.227 TCP 138 6633 → 53170 [PSH, ACK] Seq=25 Ack=1 Win=853 Len=72 TSval=1840151 TSecr=388732878
 24 0.249081443 172.31.31.144 -> 172.31.24.227 TCP 146 6633 → 53152 [PSH, ACK] Seq=17 Ack=1 Win=853 Len=80 TSval=1840151 TSecr=388732905
 25 0.249083680 172.31.31.144 -> 172.31.24.227 TCP 82 6633 → 53190 [PSH, ACK] Seq=1 Ack=1 Win=853 Len=16 TSval=1840151 TSecr=388732904
 26 0.249086756 172.31.31.144 -> 172.31.24.227 TCP 146 6633 → 53190 [PSH, ACK] Seq=17 Ack=1 Win=853 Len=80 TSval=1840151 TSecr=388732904
 27 0.249296595 172.31.24.227 -> 172.31.31.144 OpenFlow 6178 Type: OFPT_MULTIPART_REPLY, OFPMP_TABLE
 28 0.249365448 172.31.24.227 -> 172.31.31.144 OpenFlow 2010 Type: OFPT_MULTIPART_REPLY, OFPMP_FLOW
 29 0.249464581 172.31.24.227 -> 172.31.31.144 OpenFlow 642 Type: OFPT_MULTIPART_REPLY, OFPMP_PORT_STATS
 30 0.249568661 172.31.31.144 -> 172.31.24.227 TCP 66 6633 → 53152 [ACK] Seq=97 Ack=6113 Win=853 Len=0 TSval=1840152 TSecr=388733007
 31 0.249589238 172.31.24.227 -> 172.31.31.144 OpenFlow 642 Type: OFPT_MULTIPART_REPLY, OFPMP_PORT_STATS
 32 0.249660565 172.31.24.227 -> 172.31.31.144 OpenFlow 2010 Type: OFPT_MULTIPART_REPLY, OFPMP_FLOW
 33 0.249735185 172.31.31.144 -> 172.31.24.227 TCP 66 6633 → 53152 [ACK] Seq=97 Ack=8057 Win=853 Len=0 TSval=1840152 TSecr=388733007
 34 0.249740909 172.31.31.144 -> 172.31.24.227 TCP 66 6633 → 53152 [ACK] Seq=97 Ack=8633 Win=853 Len=0 TSval=1840152 TSecr=388733007
 35 0.249814599 172.31.24.227 -> 172.31.31.144 OpenFlow 6178 Type: OFPT_MULTIPART_REPLY, OFPMP_TABLE
 36 0.249864508 172.31.31.144 -> 172.31.24.227 TCP 66 6633 → 53156 [ACK] Seq=97 Ack=577 Win=853 Len=0 TSval=1840152 TSecr=388733007
 37 0.249922303 172.31.31.144 -> 172.31.24.227 TCP 66 6633 → 53156 [ACK] Seq=97 Ack=2521 Win=853 Len=0 TSval=1840152 TSecr=388733007
 38 0.249963842 172.31.24.227 -> 172.31.31.144 OpenFlow 530 Type: OFPT_MULTIPART_REPLY, OFPMP_PORT_STATS
 39 0.250046592 172.31.24.227 -> 172.31.31.144 OpenFlow 2010 Type: OFPT_MULTIPART_REPLY, OFPMP_FLOW
 40 0.250117049 172.31.31.144 -> 172.31.24.227 TCP 66 6633 → 53156 [ACK] Seq=97 Ack=8633 Win=853 Len=0 TSval=1840152 TSecr=388733007
 41 0.250196799 172.31.24.227 -> 172.31.31.144 OpenFlow 6178 Type: OFPT_MULTIPART_REPLY, OFPMP_TABLE
 42 0.250394943 172.31.24.227 -> 172.31.31.144 OpenFlow 6178 Type: OFPT_MULTIPART_REPLY, OFPMP_TABLE
 43 0.250446296 172.31.31.144 -> 172.31.24.227 TCP 66 6633 → 53170 [ACK] Seq=97 Ack=8521 Win=853 Len=0 TSval=1840152 TSecr=388733007
 44 0.250491076 172.31.24.227 -> 172.31.31.144 OpenFlow 2010 Type: OFPT_MULTIPART_REPLY, OFPMP_FLOW
 45 0.250607772 172.31.24.227 -> 172.31.31.144 OpenFlow 642 Type: OFPT_MULTIPART_REPLY, OFPMP_PORT_STATS
 46 0.250704660 172.31.31.144 -> 172.31.24.227 TCP 66 6633 → 53190 [ACK] Seq=97 Ack=6113 Win=853 Len=0 TSval=1840152 TSecr=388733007
 47 0.250711761 172.31.31.144 -> 172.31.24.227 TCP 66 6633 → 53190 [ACK] Seq=97 Ack=8057 Win=853 Len=0 TSval=1840152 TSecr=388733007
 48 0.250843152 172.31.31.144 -> 172.31.24.227 TCP 66 6633 → 53190 [ACK] Seq=97 Ack=8633 Win=853 Len=0 TSval=1840152 TSecr=388733007
 49 0.261084957 172.31.31.144 -> 172.31.24.227 TCP 122 6633 → 53164 [PSH, ACK] Seq=1 Ack=1 Win=853 Len=56 TSval=1840154 TSecr=388732905
 50 0.261092971 172.31.31.144 -> 172.31.24.227 TCP 106 6633 → 53164 [PSH, ACK] Seq=57 Ack=1 Win=853 Len=40 TSval=1840154 TSecr=388732905
 51 0.261245551 172.31.24.227 -> 172.31.31.144 OpenFlow 2634 Type: OFPT_MULTIPART_REPLY, OFPMP_FLOW
 52 0.261390201 172.31.24.227 -> 172.31.31.144 OpenFlow 6178 Type: OFPT_MULTIPART_REPLY, OFPMP_TABLE
 53 0.261503998 172.31.24.227 -> 172.31.31.144 OpenFlow 754 Type: OFPT_MULTIPART_REPLY, OFPMP_PORT_STATS
 54 0.261658238 172.31.31.144 -> 172.31.24.227 TCP 66 6633 → 53164 [ACK] Seq=97 Ack=8681 Win=853 Len=0 TSval=1840155 TSecr=388733010
 55 0.262230522 172.31.31.144 -> 172.31.24.227 TCP 82 6633 → 53162 [PSH, ACK] Seq=1 Ack=1 Win=853 Len=16 TSval=1840155 TSecr=388732905
 56 0.262237328 172.31.31.144 -> 172.31.24.227 TCP 146 6633 → 53162 [PSH, ACK] Seq=17 Ack=1 Win=853 Len=80 TSval=1840155 TSecr=388732905
 57 0.262437528 172.31.24.227 -> 172.31.31.144 OpenFlow 6178 Type: OFPT_MULTIPART_REPLY, OFPMP_TABLE
 58 0.262554086 172.31.24.227 -> 172.31.31.144 OpenFlow 754 Type: OFPT_MULTIPART_REPLY, OFPMP_PORT_STATS
 59 0.262632774 172.31.24.227 -> 172.31.31.144 OpenFlow 2842 Type: OFPT_MULTIPART_REPLY, OFPMP_FLOW
 60 0.262707701 172.31.31.144 -> 172.31.24.227 TCP 66 6633 → 53162 [ACK] Seq=97 Ack=6113 Win=853 Len=0 TSval=1840155 TSecr=388733010
 61 0.262766078 172.31.31.144 -> 172.31.24.227 TCP 66 6633 → 53162 [ACK] Seq=97 Ack=6801 Win=853 Len=0 TSval=1840155 TSecr=388733010
 62 0.262863099 172.31.31.144 -> 172.31.24.227 TCP 66 6633 → 53162 [ACK] Seq=97 Ack=9577 Win=853 Len=0 TSval=1840155 TSecr=388733010
 63 0.264619703 172.31.31.144 -> 172.31.24.227 TCP 90 6633 → 53166 [PSH, ACK] Seq=1 Ack=1 Win=853 Len=24 TSval=1840155 TSecr=388732905
 64 0.264628580 172.31.31.144 -> 172.31.24.227 TCP 138 6633 → 53166 [PSH, ACK] Seq=25 Ack=1 Win=853 Len=72 TSval=1840155 TSecr=388732905
 65 0.264821725 172.31.24.227 -> 172.31.31.144 OpenFlow 754 Type: OFPT_MULTIPART_REPLY, OFPMP_PORT_STATS
 66 0.264976547 172.31.24.227 -> 172.31.31.144 OpenFlow 6178 Type: OFPT_MULTIPART_REPLY, OFPMP_TABLE
 67 0.265022043 172.31.31.144 -> 172.31.24.227 TCP 66 6633 → 53166 [ACK] Seq=97 Ack=689 Win=853 Len=0 TSval=1840155 TSecr=388733011
 68 0.265070971 172.31.24.227 -> 172.31.31.144 OpenFlow 3050 Type: OFPT_MULTIPART_REPLY, OFPMP_FLOW
 69 0.265313152 172.31.31.144 -> 172.31.24.227 TCP 66 6633 → 53166 [ACK] Seq=97 Ack=6801 Win=853 Len=0 TSval=1840155 TSecr=388733011
 70 0.265320040 172.31.31.144 -> 172.31.24.227 TCP 66 6633 → 53166 [ACK] Seq=97 Ack=9785 Win=853 Len=0 TSval=1840156 TSecr=388733011
 71 0.277837360 172.31.31.144 -> 172.31.24.227 TCP 122 6633 → 53160 [PSH, ACK] Seq=1 Ack=1 Win=853 Len=56 TSval=1840159 TSecr=388732905
 72 0.277846302 172.31.31.144 -> 172.31.24.227 TCP 90 6633 → 53160 [PSH, ACK] Seq=57 Ack=1 Win=853 Len=24 TSval=1840159 TSecr=388732905
 73 0.278004830 172.31.24.227 -> 172.31.31.144 OpenFlow 3466 Type: OFPT_MULTIPART_REPLY, OFPMP_FLOW
 74 0.278110544 172.31.24.227 -> 172.31.31.144 OpenFlow 754 Type: OFPT_MULTIPART_REPLY, OFPMP_PORT_STATS
 75 0.278349634 172.31.31.144 -> 172.31.24.227 TCP 66 6633 → 53160 [ACK] Seq=81 Ack=4089 Win=853 Len=0 TSval=1840159 TSecr=388733014
 76 0.279007617 172.31.31.144 -> 172.31.24.227 TCP 90 6633 → 53188 [PSH, ACK] Seq=1 Ack=1 Win=853 Len=24 TSval=1840159 TSecr=388732904
 77 0.279014411 172.31.31.144 -> 172.31.24.227 TCP 90 6633 → 53182 [PSH, ACK] Seq=1 Ack=1 Win=853 Len=24 TSval=1840159 TSecr=388732905
 78 0.279017110 172.31.31.144 -> 172.31.24.227 TCP 122 6633 → 53188 [PSH, ACK] Seq=25 Ack=1 Win=853 Len=56 TSval=1840159 TSecr=388732904
 79 0.279019627 172.31.31.144 -> 172.31.24.227 TCP 138 6633 → 53182 [PSH, ACK] Seq=25 Ack=1 Win=853 Len=72 TSval=1840159 TSecr=388732905
 80 0.279021754 172.31.31.144 -> 172.31.24.227 TCP 122 6633 → 53178 [PSH, ACK] Seq=1 Ack=1 Win=853 Len=56 TSval=1840159 TSecr=388732905
 81 0.279024147 172.31.31.144 -> 172.31.24.227 TCP 90 6633 → 53178 [PSH, ACK] Seq=57 Ack=1 Win=853 Len=24 TSval=1840159 TSecr=388732905
 82 0.279206871 172.31.24.227 -> 172.31.31.144 OpenFlow 2842 Type: OFPT_MULTIPART_REPLY, OFPMP_FLOW
 83 0.279328873 172.31.24.227 -> 172.31.31.144 OpenFlow 754 Type: OFPT_MULTIPART_REPLY, OFPMP_PORT_STATS
 84 0.279450117 172.31.24.227 -> 172.31.31.144 OpenFlow 530 Type: OFPT_MULTIPART_REPLY, OFPMP_PORT_STATS
 85 0.279595707 172.31.24.227 -> 172.31.31.144 OpenFlow 6178 Type: OFPT_MULTIPART_REPLY, OFPMP_TABLE
 86 0.279614166 172.31.31.144 -> 172.31.24.227 TCP 66 6633 → 53178 [ACK] Seq=81 Ack=3465 Win=853 Len=0 TSval=1840159 TSecr=388733015
 87 0.279685303 172.31.31.144 -> 172.31.24.227 TCP 66 6633 → 53182 [ACK] Seq=97 Ack=465 Win=853 Len=0 TSval=1840159 TSecr=388733015
 88 0.279696467 172.31.24.227 -> 172.31.31.144 OpenFlow 2010 Type: OFPT_MULTIPART_REPLY, OFPMP_FLOW
 89 0.279818500 172.31.24.227 -> 172.31.31.144 OpenFlow 530 Type: OFPT_MULTIPART_REPLY, OFPMP_PORT_STATS
 90 0.279850940 172.31.31.144 -> 172.31.24.227 TCP 66 6633 → 53182 [ACK] Seq=97 Ack=6577 Win=853 Len=0 TSval=1840159 TSecr=388733015
 91 0.279892834 172.31.24.227 -> 172.31.31.144 OpenFlow 2010 Type: OFPT_MULTIPART_REPLY, OFPMP_FLOW
 92 0.279905332 172.31.31.144 -> 172.31.24.227 TCP 66 6633 → 53182 [ACK] Seq=97 Ack=8521 Win=853 Len=0 TSval=1840159 TSecr=388733015
 93 0.280038315 172.31.31.144 -> 172.31.24.227 TCP 82 6633 → 53174 [PSH, ACK] Seq=1 Ack=1 Win=853 Len=16 TSval=1840159 TSecr=388732905
 94 0.280107306 172.31.31.144 -> 172.31.24.227 TCP 146 6633 → 53174 [PSH, ACK] Seq=17 Ack=1 Win=853 Len=80 TSval=1840159 TSecr=388732905
 95 0.280113014 172.31.31.144 -> 172.31.24.227 TCP 66 6633 → 53188 [ACK] Seq=81 Ack=2409 Win=853 Len=0 TSval=1840159 TSecr=388733015
 96 0.280305047 172.31.24.227 -> 172.31.31.144 OpenFlow 6178 Type: OFPT_MULTIPART_REPLY, OFPMP_TABLE
 97 0.280382335 172.31.24.227 -> 172.31.31.144 OpenFlow 530 Type: OFPT_MULTIPART_REPLY, OFPMP_PORT_STATS
 98 0.280448188 172.31.24.227 -> 172.31.31.144 OpenFlow 1386 Type: OFPT_MULTIPART_REPLY, OFPMP_FLOW
 99 0.280571318 172.31.31.144 -> 172.31.24.227 TCP 66 6633 → 53174 [ACK] Seq=97 Ack=6577 Win=853 Len=0 TSval=1840159 TSecr=388733015
100 0.284243061 172.31.31.144 -> 172.31.24.227 OpenFlow 82 Type: OFPT_MULTIPART_REQUEST, OFPMP_TABLE
101 0.284251199 172.31.31.144 -> 172.31.24.227 OpenFlow 82 Type: OFPT_MULTIPART_REQUEST, OFPMP_TABLE
102 0.284253655 172.31.31.144 -> 172.31.24.227 OpenFlow 82 Type: OFPT_MULTIPART_REQUEST, OFPMP_TABLE
103 0.284450092 172.31.24.227 -> 172.31.31.144 OpenFlow 6178 Type: OFPT_MULTIPART_REPLY, OFPMP_TABLE
104 0.284664869 172.31.24.227 -> 172.31.31.144 OpenFlow 6178 Type: OFPT_MULTIPART_REPLY, OFPMP_TABLE
105 0.284827611 172.31.24.227 -> 172.31.31.144 OpenFlow 6178 Type: OFPT_MULTIPART_REPLY, OFPMP_TABLE
106 0.292478632 172.31.31.144 -> 172.31.24.227 TCP 122 6633 → 53198 [PSH, ACK] Seq=1 Ack=1 Win=853 Len=56 TSval=1840162 TSecr=388732905
107 0.292487127 172.31.31.144 -> 172.31.24.227 TCP 106 6633 → 53198 [PSH, ACK] Seq=57 Ack=1 Win=853 Len=40 TSval=1840162 TSecr=388732905
108 0.292672932 172.31.24.227 -> 172.31.31.144 OpenFlow 346 Type: OFPT_MULTIPART_REPLY, OFPMP_FLOW
109 0.292813682 172.31.24.227 -> 172.31.31.144 OpenFlow 6178 Type: OFPT_MULTIPART_REPLY, OFPMP_TABLE
110 0.292889427 172.31.31.144 -> 172.31.24.227 TCP 66 6633 → 53198 [ACK] Seq=97 Ack=281 Win=853 Len=0 TSval=1840162 TSecr=388733018
111 0.292909115 172.31.24.227 -> 172.31.31.144 OpenFlow 530 Type: OFPT_MULTIPART_REPLY, OFPMP_PORT_STATS
112 0.293111242 172.31.31.144 -> 172.31.24.227 TCP 66 6633 → 53198 [ACK] Seq=97 Ack=6393 Win=853 Len=0 TSval=1840162 TSecr=388733018
113 0.293118136 172.31.31.144 -> 172.31.24.227 TCP 66 6633 → 53198 [ACK] Seq=97 Ack=6857 Win=853 Len=0 TSval=1840162 TSecr=388733018
114 0.294617461 172.31.31.144 -> 172.31.24.227 TCP 82 6633 → 53180 [PSH, ACK] Seq=1 Ack=1 Win=853 Len=16 TSval=1840163 TSecr=388732904
115 0.294623108 172.31.31.144 -> 172.31.24.227 TCP 146 6633 → 53180 [PSH, ACK] Seq=17 Ack=1 Win=853 Len=80 TSval=1840163 TSecr=388732904
116 0.294895545 172.31.24.227 -> 172.31.31.144 OpenFlow 6178 Type: OFPT_MULTIPART_REPLY, OFPMP_TABLE
117 0.294990811 172.31.24.227 -> 172.31.31.144 OpenFlow 642 Type: OFPT_MULTIPART_REPLY, OFPMP_PORT_STATS
118 0.295060121 172.31.24.227 -> 172.31.31.144 OpenFlow 1594 Type: OFPT_MULTIPART_REPLY, OFPMP_FLOW
119 0.295159029 172.31.31.144 -> 172.31.24.227 TCP 66 6633 → 53180 [ACK] Seq=97 Ack=6113 Win=853 Len=0 TSval=1840163 TSecr=388733019
120 0.295220723 172.31.31.144 -> 172.31.24.227 TCP 66 6633 → 53180 [ACK] Seq=97 Ack=6689 Win=853 Len=0 TSval=1840163 TSecr=388733019
121 0.295287898 172.31.31.144 -> 172.31.24.227 TCP 66 6633 → 53180 [ACK] Seq=97 Ack=8217 Win=853 Len=0 TSval=1840163 TSecr=388733019
122 0.296748996 172.31.31.144 -> 172.31.24.227 TCP 122 6633 → 53196 [PSH, ACK] Seq=1 Ack=1 Win=853 Len=56 TSval=1840163 TSecr=388732905
123 0.296775216 172.31.31.144 -> 172.31.24.227 TCP 106 6633 → 53196 [PSH, ACK] Seq=57 Ack=1 Win=853 Len=40 TSval=1840163 TSecr=388732905
124 0.296984202 172.31.24.227 -> 172.31.31.144 OpenFlow 1802 Type: OFPT_MULTIPART_REPLY, OFPMP_FLOW
125 0.297088216 172.31.24.227 -> 172.31.31.144 OpenFlow 754 Type: OFPT_MULTIPART_REPLY, OFPMP_PORT_STATS
126 0.297208018 172.31.31.144 -> 172.31.24.227 TCP 66 6633 → 53196 [ACK] Seq=97 Ack=1737 Win=853 Len=0 TSval=1840163 TSecr=388733019
127 0.297245886 172.31.24.227 -> 172.31.31.144 OpenFlow 6178 Type: OFPT_MULTIPART_REPLY, OFPMP_TABLE
128 0.297306550 172.31.31.144 -> 172.31.24.227 TCP 66 6633 → 53196 [ACK] Seq=97 Ack=2425 Win=853 Len=0 TSval=1840163 TSecr=388733019
129 0.297501231 172.31.31.144 -> 172.31.24.227 TCP 66 6633 → 53196 [ACK] Seq=97 Ack=8537 Win=853 Len=0 TSval=1840164 TSecr=388733019
130 0.298530586 172.31.31.144 -> 172.31.24.227 TCP 90 6633 → 53168 [PSH, ACK] Seq=1 Ack=1 Win=853 Len=24 TSval=1840164 TSecr=388732905
131 0.298536842 172.31.31.144 -> 172.31.24.227 TCP 138 6633 → 53168 [PSH, ACK] Seq=25 Ack=1 Win=853 Len=72 TSval=1840164 TSecr=388732905
132 0.298539670 172.31.31.144 -> 172.31.24.227 TCP 122 6633 → 53194 [PSH, ACK] Seq=1 Ack=1 Win=853 Len=56 TSval=1840164 TSecr=388732901
133 0.298544885 172.31.24.227 -> 172.31.31.144 TCP 66 53194 → 6633 [ACK] Seq=1 Ack=57 Win=213 Len=0 TSval=388733019 TSecr=1840164
134 0.298550204 172.31.31.144 -> 172.31.24.227 TCP 106 6633 → 53194 [PSH, ACK] Seq=57 Ack=1 Win=853 Len=40 TSval=1840164 TSecr=388732901
135 0.298554179 172.31.24.227 -> 172.31.31.144 TCP 66 53194 → 6633 [ACK] Seq=1 Ack=97 Win=213 Len=0 TSval=388733019 TSecr=1840164
136 0.298745985 172.31.24.227 -> 172.31.31.144 OpenFlow 642 Type: OFPT_MULTIPART_REPLY, OFPMP_PORT_STATS
137 0.298893692 172.31.24.227 -> 172.31.31.144 OpenFlow 6178 Type: OFPT_MULTIPART_REPLY, OFPMP_TABLE
138 0.298953247 172.31.24.227 -> 172.31.31.144 OpenFlow 1594 Type: OFPT_MULTIPART_REPLY, OFPMP_FLOW
139 0.298974254 172.31.31.144 -> 172.31.24.227 TCP 66 6633 → 53168 [ACK] Seq=97 Ack=577 Win=853 Len=0 TSval=1840164 TSecr=388733020
140 0.299106967 172.31.24.227 -> 172.31.31.144 OpenFlow 2426 Type: OFPT_MULTIPART_REPLY, OFPMP_FLOW
141 0.299171837 172.31.31.144 -> 172.31.24.227 TCP 66 6633 → 53168 [ACK] Seq=97 Ack=6689 Win=853 Len=0 TSval=1840164 TSecr=388733020
142 0.299177999 172.31.31.144 -> 172.31.24.227 TCP 66 6633 → 53168 [ACK] Seq=97 Ack=8217 Win=853 Len=0 TSval=1840164 TSecr=388733020
143 0.299202137 172.31.24.227 -> 172.31.31.144 OpenFlow 530 Type: OFPT_MULTIPART_REPLY, OFPMP_PORT_STATS
144 0.299361604 172.31.31.144 -> 172.31.24.227 TCP 66 6633 → 53194 [ACK] Seq=97 Ack=2361 Win=853 Len=0 TSval=1840164 TSecr=388733020
145 0.299382010 172.31.24.227 -> 172.31.31.144 OpenFlow 6178 Type: OFPT_MULTIPART_REPLY, OFPMP_TABLE
146 0.299423080 172.31.31.144 -> 172.31.24.227 TCP 66 6633 → 53194 [ACK] Seq=97 Ack=2825 Win=853 Len=0 TSval=1840164 TSecr=388733020
147 0.299668722 172.31.31.144 -> 172.31.24.227 TCP 66 6633 → 53194 [ACK] Seq=97 Ack=8937 Win=853 Len=0 TSval=1840164 TSecr=388733020
148 0.301333018 172.31.31.144 -> 172.31.24.227 TCP 66 6633 → 53164 [ACK] Seq=97 Ack=9369 Win=853 Len=0 TSval=1840165 TSecr=388733010
149 0.311998487 172.31.31.144 -> 172.31.24.227 TCP 122 6633 → 53192 [PSH, ACK] Seq=1 Ack=1 Win=853 Len=56 TSval=1840167 TSecr=388732898
150 0.312006113 172.31.31.144 -> 172.31.24.227 TCP 122 6633 → 53184 [PSH, ACK] Seq=1 Ack=1 Win=853 Len=56 TSval=1840167 TSecr=388732905
151 0.312009033 172.31.31.144 -> 172.31.24.227 TCP 106 6633 → 53184 [PSH, ACK] Seq=57 Ack=1 Win=853 Len=40 TSval=1840167 TSecr=388732905
152 0.312011470 172.31.31.144 -> 172.31.24.227 TCP 82 6633 → 53172 [PSH, ACK] Seq=1 Ack=1 Win=853 Len=16 TSval=1840167 TSecr=388732905
153 0.312014093 172.31.31.144 -> 172.31.24.227 TCP 82 6633 → 53176 [PSH, ACK] Seq=1 Ack=1 Win=853 Len=16 TSval=1840167 TSecr=388732901
154 0.312018810 172.31.24.227 -> 172.31.31.144 TCP 66 53176 → 6633 [ACK] Seq=1 Ack=17 Win=213 Len=0 TSval=388733023 TSecr=1840167
155 0.312023888 172.31.31.144 -> 172.31.24.227 TCP 146 6633 → 53172 [PSH, ACK] Seq=17 Ack=1 Win=853 Len=80 TSval=1840167 TSecr=388732905
156 0.312026629 172.31.31.144 -> 172.31.24.227 TCP 106 6633 → 53192 [PSH, ACK] Seq=57 Ack=1 Win=853 Len=40 TSval=1840167 TSecr=388732898
157 0.312029046 172.31.31.144 -> 172.31.24.227 TCP 146 6633 → 53176 [PSH, ACK] Seq=17 Ack=1 Win=853 Len=80 TSval=1840167 TSecr=388732901
158 0.312035549 172.31.24.227 -> 172.31.31.144 TCP 66 53176 → 6633 [ACK] Seq=1 Ack=97 Win=213 Len=0 TSval=388733023 TSecr=1840167
159 0.312121985 172.31.31.144 -> 172.31.24.227 TCP 82 6633 → 53186 [PSH, ACK] Seq=1 Ack=1 Win=853 Len=16 TSval=1840167 TSecr=388732904
160 0.312130647 172.31.31.144 -> 172.31.24.227 TCP 146 6633 → 53186 [PSH, ACK] Seq=17 Ack=1 Win=853 Len=80 TSval=1840167 TSecr=388732904
161 0.312317794 172.31.24.227 -> 172.31.31.144 OpenFlow 6178 Type: OFPT_MULTIPART_REPLY, OFPMP_TABLE
162 0.312438605 172.31.24.227 -> 172.31.31.144 OpenFlow 754 Type: OFPT_MULTIPART_REPLY, OFPMP_PORT_STATS
163 0.312503416 172.31.24.227 -> 172.31.31.144 OpenFlow 2010 Type: OFPT_MULTIPART_REPLY, OFPMP_FLOW
164 0.312658912 172.31.31.144 -> 172.31.24.227 TCP 66 6633 → 53172 [ACK] Seq=97 Ack=6801 Win=853 Len=0 TSval=1840167 TSecr=388733023
165 0.312689543 172.31.24.227 -> 172.31.31.144 OpenFlow 6178 Type: OFPT_MULTIPART_REPLY, OFPMP_TABLE
166 0.312794758 172.31.24.227 -> 172.31.31.144 OpenFlow 642 Type: OFPT_MULTIPART_REPLY, OFPMP_PORT_STATS
167 0.312860985 172.31.24.227 -> 172.31.31.144 OpenFlow 2426 Type: OFPT_MULTIPART_REPLY, OFPMP_FLOW
168 0.312971379 172.31.24.227 -> 172.31.31.144 OpenFlow 2842 Type: OFPT_MULTIPART_REPLY, OFPMP_FLOW
169 0.313014909 172.31.31.144 -> 172.31.24.227 TCP 66 6633 → 53176 [ACK] Seq=97 Ack=6113 Win=853 Len=0 TSval=1840167 TSecr=388733023
170 0.313020685 172.31.31.144 -> 172.31.24.227 TCP 66 6633 → 53176 [ACK] Seq=97 Ack=6689 Win=853 Len=0 TSval=1840167 TSecr=388733023
171 0.313062566 172.31.31.144 -> 172.31.24.227 TCP 66 6633 → 53176 [ACK] Seq=97 Ack=9049 Win=853 Len=0 TSval=1840167 TSecr=388733023
172 0.313085001 172.31.24.227 -> 172.31.31.144 OpenFlow 642 Type: OFPT_MULTIPART_REPLY, OFPMP_PORT_STATS
173 0.313218130 172.31.24.227 -> 172.31.31.144 OpenFlow 6178 Type: OFPT_MULTIPART_REPLY, OFPMP_TABLE
174 0.313364274 172.31.24.227 -> 172.31.31.144 OpenFlow 6178 Type: OFPT_MULTIPART_REPLY, OFPMP_TABLE
175 0.313401006 172.31.24.227 -> 172.31.31.144 OpenFlow 346 Type: OFPT_MULTIPART_REPLY, OFPMP_FLOW
176 0.313469719 172.31.31.144 -> 172.31.24.227 TCP 66 6633 → 53184 [ACK] Seq=97 Ack=9465 Win=853 Len=0 TSval=1840168 TSecr=388733023
177 0.313499157 172.31.24.227 -> 172.31.31.144 OpenFlow 642 Type: OFPT_MULTIPART_REPLY, OFPMP_PORT_STATS
178 0.313564032 172.31.24.227 -> 172.31.31.144 OpenFlow 970 Type: OFPT_MULTIPART_REPLY, OFPMP_FLOW
179 0.313636387 172.31.24.227 -> 172.31.31.144 OpenFlow 530 Type: OFPT_MULTIPART_REPLY, OFPMP_PORT_STATS
180 0.313654963 172.31.31.144 -> 172.31.24.227 TCP 66 6633 → 53186 [ACK] Seq=97 Ack=6393 Win=853 Len=0 TSval=1840168 TSecr=388733023
181 0.313756130 172.31.31.144 -> 172.31.24.227 TCP 66 6633 → 53192 [ACK] Seq=97 Ack=905 Win=853 Len=0 TSval=1840168 TSecr=388733023
182 0.313788016 172.31.24.227 -> 172.31.31.144 OpenFlow 6178 Type: OFPT_MULTIPART_REPLY, OFPMP_TABLE
183 0.313822826 172.31.31.144 -> 172.31.24.227 TCP 66 6633 → 53192 [ACK] Seq=97 Ack=1369 Win=853 Len=0 TSval=1840168 TSecr=388733023
184 0.314037771 172.31.31.144 -> 172.31.24.227 TCP 66 6633 → 53192 [ACK] Seq=97 Ack=7481 Win=853 Len=0 TSval=1840168 TSecr=388733023
185 0.317347827 172.31.31.144 -> 172.31.24.227 TCP 66 6633 → 53174 [ACK] Seq=97 Ack=7897 Win=853 Len=0 TSval=1840169 TSecr=388733015
186 0.321359416 172.31.31.144 -> 172.31.24.227 TCP 66 6633 → 53188 [ACK] Seq=97 Ack=8521 Win=853 Len=0 TSval=1840170 TSecr=388733016
187 0.321364901 172.31.31.144 -> 172.31.24.227 TCP 66 6633 → 53178 [ACK] Seq=97 Ack=9577 Win=853 Len=0 TSval=1840170 TSecr=388733016
188 0.321367422 172.31.31.144 -> 172.31.24.227 TCP 66 6633 → 53160 [ACK] Seq=97 Ack=10201 Win=853 Len=0 TSval=1840170 TSecr=388733016
189 0.349440738 172.31.31.144 -> 172.31.24.227 TCP 66 6633 → 53172 [ACK] Seq=97 Ack=8745 Win=853 Len=0 TSval=1840177 TSecr=388733023
190 0.353409394 172.31.31.144 -> 172.31.24.227 TCP 66 6633 → 53186 [ACK] Seq=97 Ack=6969 Win=853 Len=0 TSval=1840178 TSecr=388733023
191 0.437293781 172.31.24.227 -> 137.158.125.247 SSH 98 Server: Encrypted packet (len=44)
192 0.647441430 137.158.125.247 -> 172.31.24.227 TCP 54 63468 → 22 [ACK] Seq=1 Ack=141 Win=32394 Len=0
193 0.944666121 172.31.24.227 -> 137.158.125.247 SSH 98 Server: Encrypted packet (len=44)
194 1.152831947 137.158.125.247 -> 172.31.24.227 TCP 54 63468 → 22 [ACK] Seq=1 Ack=185 Win=32372 Len=0
195 1.445304260 172.31.24.227 -> 137.158.125.247 SSH 98 Server: Encrypted packet (len=44)
196 1.653852309 137.158.125.247 -> 172.31.24.227 TCP 54 63468 → 22 [ACK] Seq=1 Ack=229 Win=32350 Len=0
197 1.949228066 172.31.24.227 -> 137.158.125.247 SSH 98 Server: Encrypted packet (len=44)
198 2.158429461 137.158.125.247 -> 172.31.24.227 TCP 54 63468 → 22 [ACK] Seq=1 Ack=273 Win=32328 Len=0
199 2.453236504 172.31.24.227 -> 137.158.125.247 SSH 98 Server: Encrypted packet (len=44)
200 2.662261302 137.158.125.247 -> 172.31.24.227 TCP 54 63468 → 22 [ACK] Seq=1 Ack=317 Win=32306 Len=0
201 2.810009774 172.31.31.144 -> 172.31.24.227 OpenFlow 187 Type: OFPT_PACKET_OUT
202 2.810038994 172.31.31.144 -> 172.31.24.227 OpenFlow 187 Type: OFPT_PACKET_OUT
203 2.810044106 172.31.31.144 -> 172.31.24.227 OpenFlow 187 Type: OFPT_PACKET_OUT
204 2.810065972 172.31.31.144 -> 172.31.24.227 OpenFlow 187 Type: OFPT_PACKET_OUT
205 2.810128817 172.31.31.144 -> 172.31.24.227 OpenFlow 187 Type: OFPT_PACKET_OUT
206 2.810193167 172.31.31.144 -> 172.31.24.227 OpenFlow 187 Type: OFPT_PACKET_OUT
207 2.810269528 172.31.31.144 -> 172.31.24.227 OpenFlow 187 Type: OFPT_PACKET_OUT
208 2.810367229 172.31.31.144 -> 172.31.24.227 OpenFlow 187 Type: OFPT_PACKET_OUT
209 2.810372580 172.31.31.144 -> 172.31.24.227 OpenFlow 187 Type: OFPT_PACKET_OUT
210 2.810431625 172.31.31.144 -> 172.31.24.227 OpenFlow 187 Type: OFPT_PACKET_OUT
211 2.810499130 172.31.31.144 -> 172.31.24.227 OpenFlow 187 Type: OFPT_PACKET_OUT
212 2.810556028 172.31.31.144 -> 172.31.24.227 OpenFlow 187 Type: OFPT_PACKET_OUT
213 2.810599374 172.31.31.144 -> 172.31.24.227 OpenFlow 187 Type: OFPT_PACKET_OUT
214 2.810654972 172.31.31.144 -> 172.31.24.227 OpenFlow 187 Type: OFPT_PACKET_OUT
215 2.810726609 172.31.31.144 -> 172.31.24.227 OpenFlow 187 Type: OFPT_PACKET_OUT
216 2.810793786 172.31.31.144 -> 172.31.24.227 OpenFlow 187 Type: OFPT_PACKET_OUT
217 2.810858677 172.31.24.227 -> 172.31.31.144 TCP 66 53158 → 6633 [ACK] Seq=8633 Ack=1065 Win=213 Len=0 TSval=388733648 TSecr=1840792
218 2.810972108 172.31.24.227 -> 172.31.31.144 OpenFlow 189 Type: OFPT_PACKET_IN
219 2.810995459 172.31.24.227 -> 172.31.31.144 OpenFlow 189 Type: OFPT_PACKET_IN
220 2.811054848 172.31.24.227 -> 172.31.31.144 OpenFlow 189 Type: OFPT_PACKET_IN
221 2.811075708 172.31.24.227 -> 172.31.31.144 OpenFlow 189 Type: OFPT_PACKET_IN
222 2.811178429 172.31.24.227 -> 172.31.31.144 OpenFlow 189 Type: OFPT_PACKET_IN
223 2.811187585 172.31.31.144 -> 172.31.24.227 TCP 66 6633 → 53164 [ACK] Seq=97 Ack=9492 Win=853 Len=0 TSval=1840792 TSecr=388733648
224 2.811264590 172.31.24.227 -> 172.31.31.144 OpenFlow 189 Type: OFPT_PACKET_IN
225 2.811323585 172.31.31.144 -> 172.31.24.227 TCP 66 6633 → 53164 [ACK] Seq=97 Ack=9615 Win=853 Len=0 TSval=1840792 TSecr=388733648
226 2.811329920 172.31.31.144 -> 172.31.24.227 TCP 66 6633 → 53174 [ACK] Seq=97 Ack=8020 Win=853 Len=0 TSval=1840792 TSecr=388733648
227 2.811333272 172.31.31.144 -> 172.31.24.227 OpenFlow 187 Type: OFPT_PACKET_OUT
228 2.811352721 172.31.31.144 -> 172.31.24.227 TCP 66 6633 → 53174 [ACK] Seq=97 Ack=8143 Win=853 Len=0 TSval=1840792 TSecr=388733648
229 2.811357131 172.31.31.144 -> 172.31.24.227 OpenFlow 187 Type: OFPT_PACKET_OUT
230 2.811440634 172.31.31.144 -> 172.31.24.227 OpenFlow 187 Type: OFPT_PACKET_OUT
231 2.811446692 172.31.31.144 -> 172.31.24.227 TCP 66 6633 → 53198 [ACK] Seq=97 Ack=6980 Win=853 Len=0 TSval=1840792 TSecr=388733648
232 2.811505049 172.31.31.144 -> 172.31.24.227 OpenFlow 187 Type: OFPT_PACKET_OUT
233 2.811510909 172.31.31.144 -> 172.31.24.227 TCP 66 6633 → 53198 [ACK] Seq=97 Ack=7103 Win=853 Len=0 TSval=1840792 TSecr=388733648
234 2.811616314 172.31.24.227 -> 172.31.31.144 TCP 66 53154 → 6633 [ACK] Seq=7273 Ack=581 Win=213 Len=0 TSval=388733648 TSecr=1840792
235 2.811664615 172.31.31.144 -> 172.31.24.227 OpenFlow 187 Type: OFPT_PACKET_OUT
236 2.812080509 172.31.24.227 -> 172.31.31.144 TCP 66 53156 → 6633 [ACK] Seq=8633 Ack=1065 Win=213 Len=0 TSval=388733648 TSecr=1840792
237 2.812114631 172.31.31.144 -> 172.31.24.227 OpenFlow 187 Type: OFPT_PACKET_OUT
238 2.812159572 172.31.31.144 -> 172.31.24.227 OpenFlow 187 Type: OFPT_PACKET_OUT
239 2.812205452 172.31.24.227 -> 172.31.31.144 OpenFlow 189 Type: OFPT_PACKET_IN
240 2.812232388 172.31.31.144 -> 172.31.24.227 OpenFlow 187 Type: OFPT_PACKET_OUT
241 2.812239842 172.31.24.227 -> 172.31.31.144 OpenFlow 189 Type: OFPT_PACKET_IN
242 2.812267027 172.31.24.227 -> 172.31.31.144 OpenFlow 189 Type: OFPT_PACKET_IN
243 2.812283779 172.31.31.144 -> 172.31.24.227 OpenFlow 187 Type: OFPT_PACKET_OUT
244 2.812296874 172.31.24.227 -> 172.31.31.144 OpenFlow 189 Type: OFPT_PACKET_IN
245 2.812328651 172.31.24.227 -> 172.31.31.144 OpenFlow 189 Type: OFPT_PACKET_IN
246 2.812375165 172.31.24.227 -> 172.31.31.144 OpenFlow 189 Type: OFPT_PACKET_IN
247 2.812378714 172.31.24.227 -> 172.31.31.144 OpenFlow 189 Type: OFPT_PACKET_IN
248 2.812458321 172.31.31.144 -> 172.31.24.227 OpenFlow 187 Type: OFPT_PACKET_OUT
249 2.812463998 172.31.31.144 -> 172.31.24.227 OpenFlow 187 Type: OFPT_PACKET_OUT
250 2.812466555 172.31.31.144 -> 172.31.24.227 TCP 66 6633 → 53160 [ACK] Seq=97 Ack=10324 Win=853 Len=0 TSval=1840792 TSecr=388733648
251 2.812566723 172.31.24.227 -> 172.31.31.144 OpenFlow 435 Type: OFPT_PACKET_IN
252 2.812574444 172.31.24.227 -> 172.31.31.144 OpenFlow 189 Type: OFPT_PACKET_IN
253 2.812577015 172.31.24.227 -> 172.31.31.144 OpenFlow 189 Type: OFPT_PACKET_IN
254 2.812618487 172.31.31.144 -> 172.31.24.227 TCP 66 6633 → 53160 [ACK] Seq=97 Ack=10447 Win=853 Len=0 TSval=1840792 TSecr=388733648
255 2.812625046 172.31.31.144 -> 172.31.24.227 OpenFlow 187 Type: OFPT_PACKET_OUT
256 2.812627882 172.31.31.144 -> 172.31.24.227 TCP 66 6633 → 53166 [ACK] Seq=97 Ack=9908 Win=853 Len=0 TSval=1840792 TSecr=388733648
257 2.812770897 172.31.24.227 -> 172.31.31.144 TCP 66 53190 → 6633 [ACK] Seq=8633 Ack=944 Win=213 Len=0 TSval=388733648 TSecr=1840792
258 2.812823903 172.31.31.144 -> 172.31.24.227 TCP 66 6633 → 53168 [ACK] Seq=97 Ack=8340 Win=853 Len=0 TSval=1840792 TSecr=388733648
259 2.812830237 172.31.31.144 -> 172.31.24.227 OpenFlow 187 Type: OFPT_PACKET_OUT
260 2.812832748 172.31.31.144 -> 172.31.24.227 TCP 66 6633 → 53172 [ACK] Seq=97 Ack=8868 Win=853 Len=0 TSval=1840792 TSecr=388733648
261 2.812835093 172.31.31.144 -> 172.31.24.227 TCP 66 6633 → 53180 [ACK] Seq=97 Ack=8340 Win=853 Len=0 TSval=1840792 TSecr=388733648
262 2.812837253 172.31.31.144 -> 172.31.24.227 TCP 66 6633 → 53166 [ACK] Seq=97 Ack=10031 Win=853 Len=0 TSval=1840792 TSecr=388733648
263 2.812839344 172.31.31.144 -> 172.31.24.227 TCP 66 6633 → 53168 [ACK] Seq=97 Ack=8709 Win=853 Len=0 TSval=1840792 TSecr=388733648
264 2.812915031 172.31.24.227 -> 172.31.31.144 OpenFlow 189 Type: OFPT_PACKET_IN
265 2.812951680 172.31.31.144 -> 172.31.24.227 TCP 66 6633 → 53172 [ACK] Seq=97 Ack=8991 Win=853 Len=0 TSval=1840792 TSecr=388733648
266 2.812975617 172.31.31.144 -> 172.31.24.227 TCP 66 6633 → 53180 [ACK] Seq=97 Ack=8463 Win=853 Len=0 TSval=1840792 TSecr=388733648
267 2.813041692 172.31.24.227 -> 172.31.31.144 OpenFlow 189 Type: OFPT_PACKET_IN
268 2.813061243 172.31.24.227 -> 172.31.31.144 OpenFlow 189 Type: OFPT_PACKET_IN
269 2.813109164 172.31.24.227 -> 172.31.31.144 OpenFlow 189 Type: OFPT_PACKET_IN
270 2.813135381 172.31.31.144 -> 172.31.24.227 TCP 66 6633 → 53192 [ACK] Seq=97 Ack=7604 Win=853 Len=0 TSval=1840792 TSecr=388733648
271 2.813146174 172.31.24.227 -> 172.31.31.144 OpenFlow 189 Type: OFPT_PACKET_IN
272 2.813193847 172.31.24.227 -> 172.31.31.144 OpenFlow 189 Type: OFPT_PACKET_IN
273 2.813371995 172.31.31.144 -> 172.31.24.227 OpenFlow 187 Type: OFPT_PACKET_OUT
274 2.813380427 172.31.31.144 -> 172.31.24.227 OpenFlow 429 Type: OFPT_PACKET_OUT
275 2.813383846 172.31.31.144 -> 172.31.24.227 OpenFlow 187 Type: OFPT_PACKET_OUT
276 2.813386638 172.31.31.144 -> 172.31.24.227 OpenFlow 550 Type: OFPT_PACKET_OUT
277 2.813391954 172.31.31.144 -> 172.31.24.227 OpenFlow 308 Type: OFPT_PACKET_OUT
278 2.813394053 172.31.31.144 -> 172.31.24.227 TCP 66 6633 → 53152 [ACK] Seq=97 Ack=8756 Win=853 Len=0 TSval=1840792 TSecr=388733648
279 2.813397199 172.31.31.144 -> 172.31.24.227 OpenFlow 187 Type: OFPT_PACKET_OUT
280 2.813399307 172.31.31.144 -> 172.31.24.227 TCP 66 6633 → 53152 [ACK] Seq=97 Ack=8879 Win=853 Len=0 TSval=1840792 TSecr=388733648
281 2.813401476 172.31.31.144 -> 172.31.24.227 OpenFlow 187 Type: OFPT_PACKET_OUT
282 2.813403595 172.31.31.144 -> 172.31.24.227 OpenFlow 913 Type: OFPT_PACKET_OUT
283 2.813405727 172.31.31.144 -> 172.31.24.227 TCP 66 6633 → 53166 [ACK] Seq=97 Ack=10154 Win=853 Len=0 TSval=1840793 TSecr=388733648
284 2.813419118 172.31.24.227 -> 172.31.31.144 OpenFlow 189 Type: OFPT_PACKET_IN
285 2.813424517 172.31.31.144 -> 172.31.24.227 OpenFlow 187 Type: OFPT_PACKET_OUT
286 2.813560330 172.31.31.144 -> 172.31.24.227 TCP 66 6633 → 53166 [ACK] Seq=97 Ack=10277 Win=853 Len=0 TSval=1840793 TSecr=388733648
287 2.813566872 172.31.31.144 -> 172.31.24.227 TCP 66 6633 → 53186 [ACK] Seq=97 Ack=7092 Win=853 Len=0 TSval=1840793 TSecr=388733648
288 2.813607061 172.31.31.144 -> 172.31.24.227 TCP 66 6633 → 53186 [ACK] Seq=97 Ack=7215 Win=853 Len=0 TSval=1840793 TSecr=388733648
289 2.813768081 172.31.24.227 -> 172.31.31.144 TCP 66 53152 → 6633 [ACK] Seq=8879 Ack=1065 Win=213 Len=0 TSval=388733648 TSecr=1840792
290 2.813839229 172.31.24.227 -> 172.31.31.144 TCP 66 53154 → 6633 [ACK] Seq=7273 Ack=823 Win=213 Len=0 TSval=388733648 TSecr=1840792
291 2.814147843 172.31.24.227 -> 172.31.31.144 TCP 66 53162 → 6633 [ACK] Seq=9577 Ack=823 Win=213 Len=0 TSval=388733648 TSecr=1840792
292 2.814234838 172.31.24.227 -> 172.31.31.144 OpenFlow 189 Type: OFPT_PACKET_IN
293 2.814255860 172.31.24.227 -> 172.31.31.144 OpenFlow 189 Type: OFPT_PACKET_IN
294 2.814374699 172.31.31.144 -> 172.31.24.227 OpenFlow 187 Type: OFPT_PACKET_OUT
295 2.814435287 172.31.31.144 -> 172.31.24.227 OpenFlow 187 Type: OFPT_PACKET_OUT
296 2.814530345 172.31.24.227 -> 172.31.31.144 OpenFlow 189 Type: OFPT_PACKET_IN
297 2.814576386 172.31.24.227 -> 172.31.31.144 OpenFlow 189 Type: OFPT_PACKET_IN
298 2.814591841 172.31.24.227 -> 172.31.31.144 OpenFlow 189 Type: OFPT_PACKET_IN
299 2.814603268 172.31.31.144 -> 172.31.24.227 OpenFlow 187 Type: OFPT_PACKET_OUT
300 2.814607778 172.31.31.144 -> 172.31.24.227 OpenFlow 187 Type: OFPT_PACKET_OUT
301 2.814610182 172.31.31.144 -> 172.31.24.227 TCP 66 6633 → 53170 [ACK] Seq=823 Ack=8767 Win=853 Len=0 TSval=1840793 TSecr=388733648
302 2.814626137 172.31.24.227 -> 172.31.31.144 OpenFlow 189 Type: OFPT_PACKET_IN
303 2.814636159 172.31.24.227 -> 172.31.31.144 OpenFlow 189 Type: OFPT_PACKET_IN
304 2.814638541 172.31.24.227 -> 172.31.31.144 OpenFlow 189 Type: OFPT_PACKET_IN
305 2.814653976 172.31.24.227 -> 172.31.31.144 OpenFlow 189 Type: OFPT_PACKET_IN
306 2.814656954 172.31.24.227 -> 172.31.31.144 OpenFlow 189 Type: OFPT_PACKET_IN
307 2.814674002 172.31.24.227 -> 172.31.31.144 OpenFlow 189 Type: OFPT_PACKET_IN
308 2.814780200 172.31.24.227 -> 172.31.31.144 OpenFlow 189 Type: OFPT_PACKET_IN
309 2.814820142 172.31.24.227 -> 172.31.31.144 OpenFlow 189 Type: OFPT_PACKET_IN
310 2.814925230 172.31.24.227 -> 172.31.31.144 OpenFlow 189 Type: OFPT_PACKET_IN
311 2.814929029 172.31.24.227 -> 172.31.31.144 OpenFlow 189 Type: OFPT_PACKET_IN
312 2.814970286 172.31.31.144 -> 172.31.24.227 OpenFlow 187 Type: OFPT_PACKET_OUT
313 2.814977821 172.31.24.227 -> 172.31.31.144 OpenFlow 189 Type: OFPT_PACKET_IN
314 2.814983780 172.31.31.144 -> 172.31.24.227 TCP 66 6633 → 53188 [ACK] Seq=97 Ack=8644 Win=853 Len=0 TSval=1840793 TSecr=388733648
315 2.814987365 172.31.31.144 -> 172.31.24.227 TCP 66 6633 → 53176 [ACK] Seq=97 Ack=9172 Win=853 Len=0 TSval=1840793 TSecr=388733648
316 2.814990120 172.31.31.144 -> 172.31.24.227 TCP 66 6633 → 53190 [ACK] Seq=1065 Ack=8756 Win=853 Len=0 TSval=1840793 TSecr=388733648
317 2.814992256 172.31.31.144 -> 172.31.24.227 TCP 66 6633 → 53192 [ACK] Seq=97 Ack=7727 Win=853 Len=0 TSval=1840793 TSecr=388733648
318 2.814994746 172.31.31.144 -> 172.31.24.227 TCP 66 6633 → 53176 [ACK] Seq=97 Ack=9295 Win=853 Len=0 TSval=1840793 TSecr=388733648
319 2.815001129 172.31.24.227 -> 172.31.31.144 OpenFlow 189 Type: OFPT_PACKET_IN
320 2.815055449 172.31.24.227 -> 172.31.31.144 TCP 66 53162 → 6633 [ACK] Seq=9577 Ack=1307 Win=213 Len=0 TSval=388733649 TSecr=1840793
321 2.815138845 172.31.31.144 -> 172.31.24.227 TCP 66 6633 → 53188 [ACK] Seq=97 Ack=8767 Win=853 Len=0 TSval=1840793 TSecr=388733648
322 2.815145316 172.31.31.144 -> 172.31.24.227 TCP 66 6633 → 53194 [ACK] Seq=97 Ack=9060 Win=853 Len=0 TSval=1840793 TSecr=388733648
323 2.815148079 172.31.31.144 -> 172.31.24.227 TCP 66 6633 → 53190 [ACK] Seq=1065 Ack=8879 Win=853 Len=0 TSval=1840793 TSecr=388733648
324 2.815150323 172.31.31.144 -> 172.31.24.227 TCP 66 6633 → 53196 [ACK] Seq=97 Ack=8660 Win=853 Len=0 TSval=1840793 TSecr=388733648
325 2.815157998 172.31.24.227 -> 172.31.31.144 OpenFlow 189 Type: OFPT_PACKET_IN
326 2.815234013 172.31.31.144 -> 172.31.24.227 TCP 66 6633 → 53194 [ACK] Seq=97 Ack=9183 Win=853 Len=0 TSval=1840793 TSecr=388733649
327 2.815244451 172.31.24.227 -> 172.31.31.144 OpenFlow 189 Type: OFPT_PACKET_IN
328 2.815326762 172.31.31.144 -> 172.31.24.227 TCP 66 6633 → 53196 [ACK] Seq=97 Ack=8783 Win=853 Len=0 TSval=1840793 TSecr=388733649
329 2.815385634 172.31.24.227 -> 172.31.31.144 OpenFlow 189 Type: OFPT_PACKET_IN
330 2.815406668 172.31.24.227 -> 172.31.31.144 OpenFlow 189 Type: OFPT_PACKET_IN
331 2.815442332 172.31.31.144 -> 172.31.24.227 TCP 66 6633 → 53172 [ACK] Seq=97 Ack=9114 Win=853 Len=0 TSval=1840793 TSecr=388733649
332 2.815482048 172.31.31.144 -> 172.31.24.227 TCP 66 6633 → 53172 [ACK] Seq=97 Ack=9237 Win=853 Len=0 TSval=1840793 TSecr=388733649
333 2.815708101 172.31.24.227 -> 172.31.31.144 OpenFlow 189 Type: OFPT_PACKET_IN
334 2.815798112 172.31.31.144 -> 172.31.24.227 TCP 66 6633 → 53152 [ACK] Seq=1065 Ack=9125 Win=853 Len=0 TSval=1840793 TSecr=388733649
335 2.815891410 172.31.31.144 -> 172.31.24.227 TCP 66 6633 → 53156 [ACK] Seq=1065 Ack=8756 Win=853 Len=0 TSval=1840793 TSecr=388733649
336 2.816012359 172.31.31.144 -> 172.31.24.227 TCP 66 6633 → 53160 [ACK] Seq=218 Ack=10939 Win=853 Len=0 TSval=1840793 TSecr=388733649
337 2.816331741 172.31.31.144 -> 172.31.24.227 OpenFlow 187 Type: OFPT_PACKET_OUT
338 2.816389073 172.31.31.144 -> 172.31.24.227 OpenFlow 187 Type: OFPT_PACKET_OUT
339 2.816452028 172.31.31.144 -> 172.31.24.227 OpenFlow 187 Type: OFPT_PACKET_OUT
340 2.816506544 172.31.31.144 -> 172.31.24.227 OpenFlow 187 Type: OFPT_PACKET_OUT
341 2.816562049 172.31.31.144 -> 172.31.24.227 OpenFlow 187 Type: OFPT_PACKET_OUT
342 2.816622563 172.31.31.144 -> 172.31.24.227 OpenFlow 187 Type: OFPT_PACKET_OUT
343 2.816680287 172.31.31.144 -> 172.31.24.227 OpenFlow 187 Type: OFPT_PACKET_OUT
344 2.816739295 172.31.31.144 -> 172.31.24.227 OpenFlow 187 Type: OFPT_PACKET_OUT
345 2.816798332 172.31.31.144 -> 172.31.24.227 OpenFlow 187 Type: OFPT_PACKET_OUT
346 2.816857034 172.31.31.144 -> 172.31.24.227 OpenFlow 187 Type: OFPT_PACKET_OUT
347 2.816895387 172.31.24.227 -> 172.31.31.144 TCP 66 53160 → 6633 [ACK] Seq=10939 Ack=1307 Win=213 Len=0 TSval=388733649 TSecr=1840793
348 2.816930680 172.31.31.144 -> 172.31.24.227 OpenFlow 187 Type: OFPT_PACKET_OUT
349 2.816981228 172.31.31.144 -> 172.31.24.227 OpenFlow 187 Type: OFPT_PACKET_OUT
350 2.817009046 172.31.24.227 -> 172.31.31.144 OpenFlow 189 Type: OFPT_PACKET_IN
351 2.817056563 172.31.31.144 -> 172.31.24.227 OpenFlow 187 Type: OFPT_PACKET_OUT
352 2.817068440 172.31.24.227 -> 172.31.31.144 OpenFlow 189 Type: OFPT_PACKET_IN
353 2.817100411 172.31.31.144 -> 172.31.24.227 OpenFlow 187 Type: OFPT_PACKET_OUT
354 2.817151909 172.31.31.144 -> 172.31.24.227 OpenFlow 187 Type: OFPT_PACKET_OUT
355 2.817273654 172.31.31.144 -> 172.31.24.227 TCP 66 6633 → 53162 [ACK] Seq=1307 Ack=9700 Win=853 Len=0 TSval=1840793 TSecr=388733649
356 2.817280228 172.31.31.144 -> 172.31.24.227 OpenFlow 187 Type: OFPT_PACKET_OUT
357 2.817283039 172.31.31.144 -> 172.31.24.227 TCP 66 6633 → 53162 [ACK] Seq=1307 Ack=9823 Win=853 Len=0 TSval=1840793 TSecr=388733649
358 2.817347875 172.31.24.227 -> 172.31.31.144 TCP 66 53164 → 6633 [ACK] Seq=9615 Ack=944 Win=213 Len=0 TSval=388733649 TSecr=1840793
359 2.817430814 172.31.24.227 -> 172.31.31.144 OpenFlow 189 Type: OFPT_PACKET_IN
360 2.817443620 172.31.31.144 -> 172.31.24.227 OpenFlow 187 Type: OFPT_PACKET_OUT
361 2.817447868 172.31.31.144 -> 172.31.24.227 OpenFlow 187 Type: OFPT_PACKET_OUT
362 2.817458390 172.31.24.227 -> 172.31.31.144 OpenFlow 189 Type: OFPT_PACKET_IN
363 2.817480234 172.31.24.227 -> 172.31.31.144 OpenFlow 189 Type: OFPT_PACKET_IN
