  1 0.000000000 172.31.31.144 -> 172.31.23.72 TCP 187 6633 → 51126 [PSH, ACK] Seq=1 Ack=1 Win=853 Len=121 TSval=5422707 TSecr=23992278
  2 0.000040482 172.31.31.144 -> 172.31.23.72 TCP 187 6633 → 51126 [PSH, ACK] Seq=122 Ack=1 Win=853 Len=121 TSval=5422707 TSecr=23992278
  3 0.000104721 172.31.31.144 -> 172.31.23.72 TCP 187 6633 → 51126 [PSH, ACK] Seq=243 Ack=1 Win=853 Len=121 TSval=5422707 TSecr=23992278
  4 0.000184133 172.31.31.144 -> 172.31.23.72 TCP 187 6633 → 51126 [PSH, ACK] Seq=364 Ack=1 Win=853 Len=121 TSval=5422707 TSecr=23992278
  5 0.000253718 172.31.31.144 -> 172.31.23.72 TCP 187 6633 → 51126 [PSH, ACK] Seq=485 Ack=1 Win=853 Len=121 TSval=5422707 TSecr=23992278
  6 0.000323878 172.31.31.144 -> 172.31.23.72 TCP 187 6633 → 51126 [PSH, ACK] Seq=606 Ack=1 Win=853 Len=121 TSval=5422707 TSecr=23992278
  7 0.000511429 172.31.31.144 -> 172.31.23.72 TCP 187 6633 → 51128 [PSH, ACK] Seq=1 Ack=1 Win=853 Len=121 TSval=5422707 TSecr=23992287
  8 0.000538917 172.31.31.144 -> 172.31.23.72 TCP 187 6633 → 51128 [PSH, ACK] Seq=122 Ack=1 Win=853 Len=121 TSval=5422707 TSecr=23992287
  9 0.000629219 172.31.31.144 -> 172.31.23.72 TCP 187 6633 → 51128 [PSH, ACK] Seq=243 Ack=1 Win=853 Len=121 TSval=5422707 TSecr=23992287
 10 0.000657188 172.31.31.144 -> 172.31.23.72 TCP 187 6633 → 51128 [PSH, ACK] Seq=364 Ack=1 Win=853 Len=121 TSval=5422707 TSecr=23992287
 11 0.000716017 172.31.23.72 -> 172.31.31.144 TCP 66 51126 → 6633 [ACK] Seq=1 Ack=727 Win=387 Len=0 TSval=23992832 TSecr=5422707
 12 0.000786151 172.31.31.144 -> 172.31.23.72 TCP 187 6633 → 51128 [PSH, ACK] Seq=485 Ack=1 Win=853 Len=121 TSval=5422707 TSecr=23992287
 13 0.000825829 172.31.31.144 -> 172.31.23.72 TCP 187 6633 → 51128 [PSH, ACK] Seq=606 Ack=1 Win=853 Len=121 TSval=5422707 TSecr=23992287
 14 0.000885262 172.31.31.144 -> 172.31.23.72 TCP 187 6633 → 51128 [PSH, ACK] Seq=727 Ack=1 Win=853 Len=121 TSval=5422707 TSecr=23992287
 15 0.000968441 172.31.23.72 -> 172.31.31.144 OpenFlow 189 Type: OFPT_PACKET_IN
 16 0.001003723 172.31.23.72 -> 172.31.31.144 OpenFlow 189 Type: OFPT_PACKET_IN
 17 0.001044183 172.31.31.144 -> 172.31.23.72 TCP 187 6633 → 51128 [PSH, ACK] Seq=848 Ack=1 Win=853 Len=121 TSval=5422707 TSecr=23992287
 18 0.001048608 172.31.23.72 -> 172.31.31.144 OpenFlow 189 Type: OFPT_PACKET_IN
 19 0.001079142 172.31.23.72 -> 172.31.31.144 OpenFlow 189 Type: OFPT_PACKET_IN
 20 0.001161134 172.31.31.144 -> 172.31.23.72 TCP 187 6633 → 51130 [PSH, ACK] Seq=1 Ack=1 Win=853 Len=121 TSval=5422707 TSecr=23992296
 21 0.001183000 172.31.31.144 -> 172.31.23.72 TCP 187 6633 → 51130 [PSH, ACK] Seq=122 Ack=1 Win=853 Len=121 TSval=5422707 TSecr=23992296
 22 0.001230361 172.31.31.144 -> 172.31.23.72 TCP 187 6633 → 51130 [PSH, ACK] Seq=243 Ack=1 Win=853 Len=121 TSval=5422707 TSecr=23992296
 23 0.001264936 172.31.31.144 -> 172.31.23.72 TCP 66 6633 → 51136 [ACK] Seq=1 Ack=247 Win=853 Len=0 TSval=5422707 TSecr=23992832
 24 0.001307980 172.31.31.144 -> 172.31.23.72 TCP 66 6633 → 51128 [ACK] Seq=969 Ack=124 Win=853 Len=0 TSval=5422707 TSecr=23992832
 25 0.001341449 172.31.31.144 -> 172.31.23.72 TCP 66 6633 → 51128 [ACK] Seq=969 Ack=247 Win=853 Len=0 TSval=5422707 TSecr=23992832
 26 0.001370659 172.31.31.144 -> 172.31.23.72 TCP 187 6633 → 51130 [PSH, ACK] Seq=364 Ack=1 Win=853 Len=121 TSval=5422707 TSecr=23992296
 27 0.001401085 172.31.31.144 -> 172.31.23.72 TCP 187 6633 → 51130 [PSH, ACK] Seq=485 Ack=1 Win=853 Len=121 TSval=5422707 TSecr=23992296
 28 0.001471750 172.31.31.144 -> 172.31.23.72 TCP 187 6633 → 51130 [PSH, ACK] Seq=606 Ack=1 Win=853 Len=121 TSval=5422707 TSecr=23992296
 29 0.001538261 172.31.23.72 -> 172.31.31.144 OpenFlow 189 Type: OFPT_PACKET_IN
 30 0.001564071 172.31.23.72 -> 172.31.31.144 OpenFlow 189 Type: OFPT_PACKET_IN
 31 0.001641555 172.31.31.144 -> 172.31.23.72 TCP 187 6633 → 51130 [PSH, ACK] Seq=727 Ack=1 Win=853 Len=121 TSval=5422707 TSecr=23992296
 32 0.001691340 172.31.31.144 -> 172.31.23.72 TCP 187 6633 → 51130 [PSH, ACK] Seq=848 Ack=1 Win=853 Len=121 TSval=5422707 TSecr=23992296
 33 0.001715351 172.31.23.72 -> 172.31.31.144 OpenFlow 189 Type: OFPT_PACKET_IN
 34 0.001723916 172.31.31.144 -> 172.31.23.72 TCP 66 6633 → 51126 [ACK] Seq=727 Ack=124 Win=853 Len=0 TSval=5422707 TSecr=23992833
 35 0.001740943 172.31.23.72 -> 172.31.31.144 OpenFlow 189 Type: OFPT_PACKET_IN
 36 0.001762802 172.31.23.72 -> 172.31.31.144 OpenFlow 189 Type: OFPT_PACKET_IN
 37 0.001798205 172.31.31.144 -> 172.31.23.72 TCP 66 6633 → 51126 [ACK] Seq=727 Ack=247 Win=853 Len=0 TSval=5422707 TSecr=23992833
 38 0.001803636 172.31.31.144 -> 172.31.23.72 OpenFlow 187 Type: OFPT_PACKET_OUT
 39 0.001807707 172.31.23.72 -> 172.31.31.144 OpenFlow 189 Type: OFPT_PACKET_IN
 40 0.001885368 172.31.31.144 -> 172.31.23.72 OpenFlow 187 Type: OFPT_PACKET_OUT
 41 0.002196586 172.31.23.72 -> 172.31.31.144 OpenFlow 189 Type: OFPT_PACKET_IN
 42 0.002223785 172.31.23.72 -> 172.31.31.144 OpenFlow 189 Type: OFPT_PACKET_IN
 43 0.002271878 172.31.23.72 -> 172.31.31.144 OpenFlow 189 Type: OFPT_PACKET_IN
 44 0.002293822 172.31.23.72 -> 172.31.31.144 OpenFlow 189 Type: OFPT_PACKET_IN
 45 0.002342530 172.31.23.72 -> 172.31.31.144 OpenFlow 189 Type: OFPT_PACKET_IN
 46 0.002348198 172.31.23.72 -> 172.31.31.144 OpenFlow 189 Type: OFPT_PACKET_IN
 47 0.002408194 172.31.23.72 -> 172.31.31.144 OpenFlow 189 Type: OFPT_PACKET_IN
 48 0.002433090 172.31.31.144 -> 172.31.23.72 TCP 66 6633 → 51128 [ACK] Seq=969 Ack=370 Win=853 Len=0 TSval=5422707 TSecr=23992833
 49 0.002440895 172.31.23.72 -> 172.31.31.144 OpenFlow 189 Type: OFPT_PACKET_IN
 50 0.002466693 172.31.31.144 -> 172.31.23.72 TCP 66 6633 → 51128 [ACK] Seq=969 Ack=493 Win=853 Len=0 TSval=5422707 TSecr=23992833
 51 0.002497790 172.31.31.144 -> 172.31.23.72 TCP 66 6633 → 51138 [ACK] Seq=1 Ack=124 Win=853 Len=0 TSval=5422707 TSecr=23992833
 52 0.002521555 172.31.31.144 -> 172.31.23.72 TCP 66 6633 → 51134 [ACK] Seq=1 Ack=124 Win=853 Len=0 TSval=5422707 TSecr=23992833
 53 0.002551605 172.31.31.144 -> 172.31.23.72 TCP 66 6633 → 51138 [ACK] Seq=1 Ack=247 Win=853 Len=0 TSval=5422707 TSecr=23992833
 54 0.002597052 172.31.31.144 -> 172.31.23.72 TCP 66 6633 → 51134 [ACK] Seq=1 Ack=247 Win=853 Len=0 TSval=5422707 TSecr=23992833
 55 0.002614999 172.31.31.144 -> 172.31.23.72 TCP 66 6633 → 51132 [ACK] Seq=1 Ack=124 Win=853 Len=0 TSval=5422707 TSecr=23992833
 56 0.002649211 172.31.31.144 -> 172.31.23.72 TCP 66 6633 → 51132 [ACK] Seq=1 Ack=247 Win=853 Len=0 TSval=5422707 TSecr=23992833
 57 0.003619727 172.31.31.144 -> 172.31.23.72 TCP 66 6633 → 51130 [ACK] Seq=1211 Ack=247 Win=853 Len=0 TSval=5422707 TSecr=23992833
 58 0.003672410 172.31.31.144 -> 172.31.23.72 TCP 66 6633 → 51136 [ACK] Seq=1 Ack=493 Win=853 Len=0 TSval=5422707 TSecr=23992833
 59 0.041302311 172.31.23.72 -> 172.31.31.144 TCP 66 51130 → 6633 [ACK] Seq=247 Ack=1211 Win=213 Len=0 TSval=23992843 TSecr=5422707
 60 0.399802574 172.31.31.144 -> 172.31.23.72 OpenFlow 187 Type: OFPT_PACKET_OUT
 61 0.399851204 172.31.31.144 -> 172.31.23.72 OpenFlow 187 Type: OFPT_PACKET_OUT
 62 0.399939924 172.31.31.144 -> 172.31.23.72 OpenFlow 187 Type: OFPT_PACKET_OUT
 63 0.400013894 172.31.31.144 -> 172.31.23.72 OpenFlow 187 Type: OFPT_PACKET_OUT
 64 0.400098714 172.31.31.144 -> 172.31.23.72 OpenFlow 187 Type: OFPT_PACKET_OUT
 65 0.400166269 172.31.31.144 -> 172.31.23.72 OpenFlow 187 Type: OFPT_PACKET_OUT
 66 0.400241373 172.31.31.144 -> 172.31.23.72 OpenFlow 187 Type: OFPT_PACKET_OUT
 67 0.400304410 172.31.31.144 -> 172.31.23.72 OpenFlow 187 Type: OFPT_PACKET_OUT
 68 0.400399149 172.31.23.72 -> 172.31.31.144 TCP 66 51132 → 6633 [ACK] Seq=247 Ack=969 Win=213 Len=0 TSval=23992932 TSecr=5422807
 69 0.400480892 172.31.31.144 -> 172.31.23.72 OpenFlow 187 Type: OFPT_PACKET_OUT
 70 0.400487336 172.31.31.144 -> 172.31.23.72 OpenFlow 187 Type: OFPT_PACKET_OUT
 71 0.400528177 172.31.23.72 -> 172.31.31.144 OpenFlow 189 Type: OFPT_PACKET_IN
 72 0.400552027 172.31.23.72 -> 172.31.31.144 OpenFlow 189 Type: OFPT_PACKET_IN
 73 0.400587001 172.31.31.144 -> 172.31.23.72 OpenFlow 187 Type: OFPT_PACKET_OUT
 74 0.400603729 172.31.23.72 -> 172.31.31.144 OpenFlow 189 Type: OFPT_PACKET_IN
 75 0.400620938 172.31.23.72 -> 172.31.31.144 OpenFlow 189 Type: OFPT_PACKET_IN
 76 0.400654717 172.31.31.144 -> 172.31.23.72 OpenFlow 187 Type: OFPT_PACKET_OUT
 77 0.400705663 172.31.23.72 -> 172.31.31.144 OpenFlow 189 Type: OFPT_PACKET_IN
 78 0.400712996 172.31.31.144 -> 172.31.23.72 OpenFlow 187 Type: OFPT_PACKET_OUT
 79 0.400728192 172.31.23.72 -> 172.31.31.144 OpenFlow 189 Type: OFPT_PACKET_IN
 80 0.400765887 172.31.31.144 -> 172.31.23.72 TCP 66 6633 → 51140 [ACK] Seq=1 Ack=124 Win=853 Len=0 TSval=5422807 TSecr=23992932
 81 0.400808856 172.31.31.144 -> 172.31.23.72 OpenFlow 187 Type: OFPT_PACKET_OUT
 82 0.400813766 172.31.31.144 -> 172.31.23.72 TCP 66 6633 → 51140 [ACK] Seq=1 Ack=247 Win=853 Len=0 TSval=5422807 TSecr=23992932
 83 0.400853339 172.31.31.144 -> 172.31.23.72 TCP 66 6633 → 51130 [ACK] Seq=1211 Ack=493 Win=853 Len=0 TSval=5422807 TSecr=23992932
 84 0.400870045 172.31.31.144 -> 172.31.23.72 TCP 66 6633 → 51134 [ACK] Seq=727 Ack=370 Win=853 Len=0 TSval=5422807 TSecr=23992932
 85 0.400906662 172.31.31.144 -> 172.31.23.72 TCP 66 6633 → 51134 [ACK] Seq=727 Ack=493 Win=853 Len=0 TSval=5422807 TSecr=23992932
 86 0.400931788 172.31.31.144 -> 172.31.23.72 OpenFlow 187 Type: OFPT_PACKET_OUT
 87 0.400973352 172.31.31.144 -> 172.31.23.72 OpenFlow 187 Type: OFPT_PACKET_OUT
 88 0.401024521 172.31.31.144 -> 172.31.23.72 OpenFlow 187 Type: OFPT_PACKET_OUT
 89 0.401219223 172.31.23.72 -> 172.31.31.144 OpenFlow 189 Type: OFPT_PACKET_IN
 90 0.401246158 172.31.23.72 -> 172.31.31.144 OpenFlow 189 Type: OFPT_PACKET_IN
 91 0.401314939 172.31.31.144 -> 172.31.23.72 OpenFlow 187 Type: OFPT_PACKET_OUT
 92 0.401393689 172.31.31.144 -> 172.31.23.72 TCP 66 6633 → 51132 [ACK] Seq=969 Ack=370 Win=853 Len=0 TSval=5422807 TSecr=23992932
 93 0.401424814 172.31.31.144 -> 172.31.23.72 TCP 66 6633 → 51132 [ACK] Seq=969 Ack=493 Win=853 Len=0 TSval=5422807 TSecr=23992932
 94 0.401446503 172.31.31.144 -> 172.31.23.72 OpenFlow 187 Type: OFPT_PACKET_OUT
 95 0.401512993 172.31.23.72 -> 172.31.31.144 TCP 66 51136 → 6633 [ACK] Seq=493 Ack=606 Win=213 Len=0 TSval=23992933 TSecr=5422807
 96 0.401543914 172.31.31.144 -> 172.31.23.72 OpenFlow 187 Type: OFPT_PACKET_OUT
 97 0.401620391 172.31.31.144 -> 172.31.23.72 OpenFlow 187 Type: OFPT_PACKET_OUT
 98 0.401639046 172.31.23.72 -> 172.31.31.144 OpenFlow 189 Type: OFPT_PACKET_IN
 99 0.401684301 172.31.23.72 -> 172.31.31.144 OpenFlow 189 Type: OFPT_PACKET_IN
100 0.401711285 172.31.23.72 -> 172.31.31.144 OpenFlow 189 Type: OFPT_PACKET_IN
101 0.401716868 172.31.31.144 -> 172.31.23.72 OpenFlow 187 Type: OFPT_PACKET_OUT
102 0.401753225 172.31.23.72 -> 172.31.31.144 OpenFlow 189 Type: OFPT_PACKET_IN
103 0.401781992 172.31.23.72 -> 172.31.31.144 OpenFlow 189 Type: OFPT_PACKET_IN
104 0.401826893 172.31.31.144 -> 172.31.23.72 OpenFlow 187 Type: OFPT_PACKET_OUT
105 0.401833530 172.31.23.72 -> 172.31.31.144 OpenFlow 189 Type: OFPT_PACKET_IN
106 0.401839683 172.31.23.72 -> 172.31.31.144 OpenFlow 189 Type: OFPT_PACKET_IN
107 0.401891691 172.31.31.144 -> 172.31.23.72 TCP 66 6633 → 51130 [ACK] Seq=1211 Ack=739 Win=853 Len=0 TSval=5422807 TSecr=23992933
108 0.401898846 172.31.23.72 -> 172.31.31.144 OpenFlow 435 Type: OFPT_PACKET_IN
109 0.401962128 172.31.31.144 -> 172.31.23.72 OpenFlow 187 Type: OFPT_PACKET_OUT
110 0.401966263 172.31.31.144 -> 172.31.23.72 TCP 66 6633 → 51128 [ACK] Seq=969 Ack=616 Win=853 Len=0 TSval=5422807 TSecr=23992933
111 0.401995750 172.31.31.144 -> 172.31.23.72 TCP 66 6633 → 51126 [ACK] Seq=727 Ack=370 Win=853 Len=0 TSval=5422807 TSecr=23992933
112 0.401999856 172.31.31.144 -> 172.31.23.72 TCP 66 6633 → 51138 [ACK] Seq=1 Ack=370 Win=853 Len=0 TSval=5422807 TSecr=23992933
113 0.402018098 172.31.31.144 -> 172.31.23.72 OpenFlow 187 Type: OFPT_PACKET_OUT
114 0.402038860 172.31.31.144 -> 172.31.23.72 TCP 66 6633 → 51128 [ACK] Seq=969 Ack=739 Win=853 Len=0 TSval=5422807 TSecr=23992933
115 0.402056303 172.31.31.144 -> 172.31.23.72 TCP 66 6633 → 51126 [ACK] Seq=727 Ack=493 Win=853 Len=0 TSval=5422807 TSecr=23992933
116 0.402137200 172.31.23.72 -> 172.31.31.144 TCP 66 51136 → 6633 [ACK] Seq=493 Ack=1211 Win=213 Len=0 TSval=23992933 TSecr=5422807
117 0.402229742 172.31.23.72 -> 172.31.31.144 OpenFlow 189 Type: OFPT_PACKET_IN
118 0.402254825 172.31.23.72 -> 172.31.31.144 OpenFlow 189 Type: OFPT_PACKET_IN
119 0.402406861 172.31.31.144 -> 172.31.23.72 TCP 66 6633 → 51142 [ACK] Seq=1 Ack=124 Win=853 Len=0 TSval=5422807 TSecr=23992933
120 0.402447678 172.31.31.144 -> 172.31.23.72 TCP 66 6633 → 51142 [ACK] Seq=1 Ack=247 Win=853 Len=0 TSval=5422807 TSecr=23992933
121 0.402479392 172.31.23.72 -> 172.31.31.144 OpenFlow 189 Type: OFPT_PACKET_IN
122 0.402500167 172.31.23.72 -> 172.31.31.144 OpenFlow 189 Type: OFPT_PACKET_IN
123 0.402507083 172.31.23.72 -> 172.31.31.144 OpenFlow 189 Type: OFPT_PACKET_IN
124 0.402603614 172.31.31.144 -> 172.31.23.72 OpenFlow 187 Type: OFPT_PACKET_OUT
125 0.402619436 172.31.31.144 -> 172.31.23.72 OpenFlow 308 Type: OFPT_PACKET_OUT
126 0.402642815 172.31.31.144 -> 172.31.23.72 TCP 66 6633 → 51146 [ACK] Seq=1 Ack=124 Win=853 Len=0 TSval=5422807 TSecr=23992933
127 0.402660717 172.31.31.144 -> 172.31.23.72 TCP 66 6633 → 51146 [ACK] Seq=1 Ack=247 Win=853 Len=0 TSval=5422807 TSecr=23992933
128 0.402879991 172.31.23.72 -> 172.31.31.144 TCP 66 51138 → 6633 [ACK] Seq=739 Ack=485 Win=213 Len=0 TSval=23992933 TSecr=5422807
129 0.403035288 172.31.23.72 -> 172.31.31.144 OpenFlow 189 Type: OFPT_PACKET_IN
130 0.403076902 172.31.23.72 -> 172.31.31.144 OpenFlow 189 Type: OFPT_PACKET_IN
131 0.403091352 172.31.23.72 -> 172.31.31.144 OpenFlow 189 Type: OFPT_PACKET_IN
132 0.403189620 172.31.31.144 -> 172.31.23.72 OpenFlow 187 Type: OFPT_PACKET_OUT
133 0.403205899 172.31.31.144 -> 172.31.23.72 OpenFlow 308 Type: OFPT_PACKET_OUT
134 0.403225183 172.31.31.144 -> 172.31.23.72 TCP 66 6633 → 51136 [ACK] Seq=1211 Ack=739 Win=853 Len=0 TSval=5422807 TSecr=23992933
135 0.403244236 172.31.31.144 -> 172.31.23.72 TCP 66 6633 → 51140 [ACK] Seq=1 Ack=370 Win=853 Len=0 TSval=5422807 TSecr=23992933
136 0.403262639 172.31.31.144 -> 172.31.23.72 TCP 66 6633 → 51140 [ACK] Seq=1 Ack=493 Win=853 Len=0 TSval=5422807 TSecr=23992933
137 0.403281723 172.31.31.144 -> 172.31.23.72 OpenFlow 187 Type: OFPT_PACKET_OUT
138 0.403371929 172.31.31.144 -> 172.31.23.72 OpenFlow 187 Type: OFPT_PACKET_OUT
139 0.403445803 172.31.31.144 -> 172.31.23.72 OpenFlow 187 Type: OFPT_PACKET_OUT
140 0.403594218 172.31.23.72 -> 172.31.31.144 TCP 66 51138 → 6633 [ACK] Seq=739 Ack=1211 Win=213 Len=0 TSval=23992933 TSecr=5422807
141 0.403661782 172.31.23.72 -> 172.31.31.144 OpenFlow 189 Type: OFPT_PACKET_IN
142 0.403684837 172.31.23.72 -> 172.31.31.144 OpenFlow 189 Type: OFPT_PACKET_IN
143 0.403745655 172.31.31.144 -> 172.31.23.72 OpenFlow 187 Type: OFPT_PACKET_OUT
144 0.403794443 172.31.31.144 -> 172.31.23.72 OpenFlow 187 Type: OFPT_PACKET_OUT
145 0.403806031 172.31.23.72 -> 172.31.31.144 OpenFlow 189 Type: OFPT_PACKET_IN
146 0.403813996 172.31.31.144 -> 172.31.23.72 TCP 66 6633 → 51134 [ACK] Seq=727 Ack=616 Win=853 Len=0 TSval=5422808 TSecr=23992933
147 0.403827062 172.31.23.72 -> 172.31.31.144 OpenFlow 189 Type: OFPT_PACKET_IN
148 0.403856657 172.31.23.72 -> 172.31.31.144 OpenFlow 189 Type: OFPT_PACKET_IN
149 0.403862313 172.31.31.144 -> 172.31.23.72 TCP 66 6633 → 51134 [ACK] Seq=727 Ack=739 Win=853 Len=0 TSval=5422808 TSecr=23992933
150 0.403865346 172.31.31.144 -> 172.31.23.72 OpenFlow 308 Type: OFPT_PACKET_OUT
151 0.403906324 172.31.23.72 -> 172.31.31.144 OpenFlow 189 Type: OFPT_PACKET_IN
152 0.403936336 172.31.31.144 -> 172.31.23.72 OpenFlow 187 Type: OFPT_PACKET_OUT
153 0.404031203 172.31.31.144 -> 172.31.23.72 TCP 66 6633 → 51142 [ACK] Seq=1 Ack=370 Win=853 Len=0 TSval=5422808 TSecr=23992933
154 0.404045029 172.31.31.144 -> 172.31.23.72 OpenFlow 187 Type: OFPT_PACKET_OUT
155 0.404063813 172.31.31.144 -> 172.31.23.72 TCP 66 6633 → 51130 [ACK] Seq=1211 Ack=985 Win=853 Len=0 TSval=5422808 TSecr=23992933
156 0.404083450 172.31.31.144 -> 172.31.23.72 TCP 66 6633 → 51142 [ACK] Seq=1 Ack=493 Win=853 Len=0 TSval=5422808 TSecr=23992933
157 0.404111213 172.31.31.144 -> 172.31.23.72 OpenFlow 187 Type: OFPT_PACKET_OUT
158 0.404180236 172.31.23.72 -> 172.31.31.144 TCP 66 51140 → 6633 [ACK] Seq=493 Ack=727 Win=213 Len=0 TSval=23992933 TSecr=5422807
159 0.404265595 172.31.23.72 -> 172.31.31.144 OpenFlow 189 Type: OFPT_PACKET_IN
160 0.404288765 172.31.23.72 -> 172.31.31.144 OpenFlow 189 Type: OFPT_PACKET_IN
161 0.404326739 172.31.23.72 -> 172.31.31.144 OpenFlow 189 Type: OFPT_PACKET_IN
162 0.404350234 172.31.23.72 -> 172.31.31.144 OpenFlow 189 Type: OFPT_PACKET_IN
163 0.404431294 172.31.23.72 -> 172.31.31.144 OpenFlow 189 Type: OFPT_PACKET_IN
164 0.404440786 172.31.31.144 -> 172.31.23.72 TCP 66 6633 → 51144 [ACK] Seq=1 Ack=124 Win=853 Len=0 TSval=5422808 TSecr=23992933
165 0.404465192 172.31.31.144 -> 172.31.23.72 TCP 66 6633 → 51144 [ACK] Seq=1 Ack=247 Win=853 Len=0 TSval=5422808 TSecr=23992933
166 0.404472659 172.31.23.72 -> 172.31.31.144 OpenFlow 189 Type: OFPT_PACKET_IN
167 0.404546460 172.31.31.144 -> 172.31.23.72 TCP 66 6633 → 51138 [ACK] Seq=1211 Ack=985 Win=853 Len=0 TSval=5422808 TSecr=23992933
168 0.404609887 172.31.31.144 -> 172.31.23.72 TCP 66 6633 → 51132 [ACK] Seq=969 Ack=616 Win=853 Len=0 TSval=5422808 TSecr=23992933
169 0.404626360 172.31.31.144 -> 172.31.23.72 TCP 66 6633 → 51132 [ACK] Seq=969 Ack=739 Win=853 Len=0 TSval=5422808 TSecr=23992933
170 0.404631361 172.31.23.72 -> 172.31.31.144 OpenFlow 189 Type: OFPT_PACKET_IN
171 0.404652373 172.31.31.144 -> 172.31.23.72 OpenFlow 187 Type: OFPT_PACKET_OUT
172 0.404689781 172.31.31.144 -> 172.31.23.72 OpenFlow 308 Type: OFPT_PACKET_OUT
173 0.404748293 172.31.31.144 -> 172.31.23.72 OpenFlow 187 Type: OFPT_PACKET_OUT
174 0.404822606 172.31.31.144 -> 172.31.23.72 TCP 66 6633 → 51144 [ACK] Seq=1 Ack=370 Win=853 Len=0 TSval=5422808 TSecr=23992933
175 0.404840711 172.31.31.144 -> 172.31.23.72 OpenFlow 187 Type: OFPT_PACKET_OUT
176 0.405037421 172.31.23.72 -> 172.31.31.144 TCP 66 51142 → 6633 [ACK] Seq=493 Ack=727 Win=213 Len=0 TSval=23992933 TSecr=5422808
177 0.405106044 172.31.31.144 -> 172.31.23.72 OpenFlow 187 Type: OFPT_PACKET_OUT
178 0.405130493 172.31.23.72 -> 172.31.31.144 OpenFlow 189 Type: OFPT_PACKET_IN
179 0.405163767 172.31.31.144 -> 172.31.23.72 OpenFlow 187 Type: OFPT_PACKET_OUT
180 0.405196117 172.31.23.72 -> 172.31.31.144 OpenFlow 189 Type: OFPT_PACKET_IN
181 0.405229016 172.31.23.72 -> 172.31.31.144 OpenFlow 189 Type: OFPT_PACKET_IN
182 0.405264709 172.31.31.144 -> 172.31.23.72 OpenFlow 187 Type: OFPT_PACKET_OUT
183 0.405309688 172.31.31.144 -> 172.31.23.72 TCP 66 6633 → 51144 [ACK] Seq=1 Ack=493 Win=853 Len=0 TSval=5422808 TSecr=23992933
184 0.405326996 172.31.31.144 -> 172.31.23.72 OpenFlow 187 Type: OFPT_PACKET_OUT
185 0.405350338 172.31.23.72 -> 172.31.31.144 OpenFlow 189 Type: OFPT_PACKET_IN
186 0.405371285 172.31.23.72 -> 172.31.31.144 OpenFlow 189 Type: OFPT_PACKET_IN
187 0.405405892 172.31.31.144 -> 172.31.23.72 TCP 66 6633 → 51138 [ACK] Seq=1211 Ack=1231 Win=853 Len=0 TSval=5422808 TSecr=23992933
188 0.405551491 172.31.23.72 -> 172.31.31.144 TCP 66 51142 → 6633 [ACK] Seq=493 Ack=1211 Win=213 Len=0 TSval=23992934 TSecr=5422808
189 0.405611491 172.31.31.144 -> 172.31.23.72 TCP 66 6633 → 51136 [ACK] Seq=1211 Ack=985 Win=853 Len=0 TSval=5422808 TSecr=23992934
190 0.405680731 172.31.31.144 -> 172.31.23.72 OpenFlow 187 Type: OFPT_PACKET_OUT
191 0.405706551 172.31.31.144 -> 172.31.23.72 OpenFlow 550 Type: OFPT_PACKET_OUT
192 0.405770638 172.31.23.72 -> 172.31.31.144 OpenFlow 189 Type: OFPT_PACKET_IN
193 0.405792857 172.31.23.72 -> 172.31.31.144 OpenFlow 189 Type: OFPT_PACKET_IN
194 0.405807260 172.31.23.72 -> 172.31.31.144 OpenFlow 189 Type: OFPT_PACKET_IN
195 0.405838045 172.31.31.144 -> 172.31.23.72 OpenFlow 187 Type: OFPT_PACKET_OUT
196 0.405950612 172.31.23.72 -> 172.31.31.144 OpenFlow 189 Type: OFPT_PACKET_IN
197 0.405987490 172.31.31.144 -> 172.31.23.72 OpenFlow 187 Type: OFPT_PACKET_OUT
198 0.405992232 172.31.31.144 -> 172.31.23.72 TCP 66 6633 → 51148 [ACK] Seq=1 Ack=124 Win=853 Len=0 TSval=5422808 TSecr=23992934
199 0.405996343 172.31.31.144 -> 172.31.23.72 OpenFlow 187 Type: OFPT_PACKET_OUT
200 0.406036870 172.31.31.144 -> 172.31.23.72 TCP 66 6633 → 51148 [ACK] Seq=1 Ack=247 Win=853 Len=0 TSval=5422808 TSecr=23992934
201 0.406053368 172.31.31.144 -> 172.31.23.72 OpenFlow 187 Type: OFPT_PACKET_OUT
202 0.406214467 172.31.23.72 -> 172.31.31.144 TCP 66 51144 → 6633 [ACK] Seq=493 Ack=969 Win=213 Len=0 TSval=23992934 TSecr=5422808
203 0.406341764 172.31.31.144 -> 172.31.23.72 OpenFlow 187 Type: OFPT_PACKET_OUT
204 0.406374755 172.31.31.144 -> 172.31.23.72 OpenFlow 187 Type: OFPT_PACKET_OUT
205 0.406394915 172.31.31.144 -> 172.31.23.72 OpenFlow 187 Type: OFPT_PACKET_OUT
206 0.406411689 172.31.23.72 -> 172.31.31.144 OpenFlow 189 Type: OFPT_PACKET_IN
207 0.406433763 172.31.23.72 -> 172.31.31.144 OpenFlow 189 Type: OFPT_PACKET_IN
208 0.406587748 172.31.23.72 -> 172.31.31.144 TCP 66 51146 → 6633 [ACK] Seq=493 Ack=485 Win=213 Len=0 TSval=23992934 TSecr=5422808
209 0.406598168 172.31.31.144 -> 172.31.23.72 TCP 66 6633 → 51152 [ACK] Seq=1 Ack=124 Win=853 Len=0 TSval=5422808 TSecr=23992934
210 0.406608500 172.31.31.144 -> 172.31.23.72 TCP 66 6633 → 51152 [ACK] Seq=1 Ack=247 Win=853 Len=0 TSval=5422808 TSecr=23992934
211 0.406673054 172.31.23.72 -> 172.31.31.144 OpenFlow 189 Type: OFPT_PACKET_IN
212 0.406699483 172.31.31.144 -> 172.31.23.72 OpenFlow 187 Type: OFPT_PACKET_OUT
213 0.406705458 172.31.23.72 -> 172.31.31.144 OpenFlow 189 Type: OFPT_PACKET_IN
214 0.406723914 172.31.23.72 -> 172.31.31.144 OpenFlow 189 Type: OFPT_PACKET_IN
215 0.406737387 172.31.31.144 -> 172.31.23.72 OpenFlow 187 Type: OFPT_PACKET_OUT
216 0.406749067 172.31.23.72 -> 172.31.31.144 OpenFlow 189 Type: OFPT_PACKET_IN
217 0.406765296 172.31.23.72 -> 172.31.31.144 OpenFlow 189 Type: OFPT_PACKET_IN
218 0.406807934 172.31.31.144 -> 172.31.23.72 OpenFlow 187 Type: OFPT_PACKET_OUT
219 0.406810916 172.31.31.144 -> 172.31.23.72 OpenFlow 187 Type: OFPT_PACKET_OUT
220 0.406814235 172.31.23.72 -> 172.31.31.144 OpenFlow 189 Type: OFPT_PACKET_IN
221 0.406819818 172.31.23.72 -> 172.31.31.144 OpenFlow 189 Type: OFPT_PACKET_IN
222 0.406875893 172.31.31.144 -> 172.31.23.72 OpenFlow 187 Type: OFPT_PACKET_OUT
223 0.406881894 172.31.23.72 -> 172.31.31.144 OpenFlow 189 Type: OFPT_PACKET_IN
224 0.406930231 172.31.23.72 -> 172.31.31.144 OpenFlow 189 Type: OFPT_PACKET_IN
225 0.406943524 172.31.31.144 -> 172.31.23.72 OpenFlow 187 Type: OFPT_PACKET_OUT
226 0.406946976 172.31.31.144 -> 172.31.23.72 TCP 66 6633 → 51150 [ACK] Seq=1 Ack=124 Win=853 Len=0 TSval=5422808 TSecr=23992934
227 0.406996494 172.31.23.72 -> 172.31.31.144 OpenFlow 189 Type: OFPT_PACKET_IN
228 0.407033738 172.31.31.144 -> 172.31.23.72 TCP 66 6633 → 51136 [ACK] Seq=1211 Ack=1231 Win=853 Len=0 TSval=5422808 TSecr=23992934
229 0.407039098 172.31.31.144 -> 172.31.23.72 TCP 66 6633 → 51150 [ACK] Seq=1 Ack=247 Win=853 Len=0 TSval=5422808 TSecr=23992934
230 0.407041087 172.31.31.144 -> 172.31.23.72 OpenFlow 187 Type: OFPT_PACKET_OUT
231 0.407074526 172.31.31.144 -> 172.31.23.72 TCP 66 6633 → 51142 [ACK] Seq=1211 Ack=739 Win=853 Len=0 TSval=5422808 TSecr=23992934
232 0.407212624 172.31.31.144 -> 172.31.23.72 OpenFlow 187 Type: OFPT_PACKET_OUT
233 0.407240208 172.31.23.72 -> 172.31.31.144 TCP 66 51146 → 6633 [ACK] Seq=493 Ack=1211 Win=213 Len=0 TSval=23992934 TSecr=5422808
234 0.407323069 172.31.23.72 -> 172.31.31.144 OpenFlow 189 Type: OFPT_PACKET_IN
235 0.407350022 172.31.23.72 -> 172.31.31.144 OpenFlow 189 Type: OFPT_PACKET_IN
236 0.407394640 172.31.23.72 -> 172.31.31.144 OpenFlow 189 Type: OFPT_PACKET_IN
237 0.407399519 172.31.23.72 -> 172.31.31.144 OpenFlow 189 Type: OFPT_PACKET_IN
238 0.407415613 172.31.23.72 -> 172.31.31.144 OpenFlow 189 Type: OFPT_PACKET_IN
239 0.407427187 172.31.31.144 -> 172.31.23.72 TCP 66 6633 → 51140 [ACK] Seq=727 Ack=739 Win=853 Len=0 TSval=5422808 TSecr=23992934
240 0.407510831 172.31.23.72 -> 172.31.31.144 OpenFlow 189 Type: OFPT_PACKET_IN
241 0.407602122 172.31.23.72 -> 172.31.31.144 TCP 66 51148 → 6633 [ACK] Seq=493 Ack=243 Win=213 Len=0 TSval=23992934 TSecr=5422808
242 0.407608269 172.31.31.144 -> 172.31.23.72 TCP 66 6633 → 51162 [ACK] Seq=1 Ack=247 Win=853 Len=0 TSval=5422808 TSecr=23992934
243 0.407683244 172.31.23.72 -> 172.31.31.144 OpenFlow 189 Type: OFPT_PACKET_IN
244 0.407709601 172.31.23.72 -> 172.31.31.144 OpenFlow 189 Type: OFPT_PACKET_IN
245 0.407746094 172.31.31.144 -> 172.31.23.72 TCP 66 6633 → 51154 [ACK] Seq=1 Ack=247 Win=853 Len=0 TSval=5422808 TSecr=23992934
246 0.407830961 172.31.31.144 -> 172.31.23.72 OpenFlow 187 Type: OFPT_PACKET_OUT
247 0.407849938 172.31.31.144 -> 172.31.23.72 OpenFlow 429 Type: OFPT_PACKET_OUT
248 0.407870780 172.31.31.144 -> 172.31.23.72 TCP 66 6633 → 51142 [ACK] Seq=1211 Ack=985 Win=853 Len=0 TSval=5422809 TSecr=23992934
249 0.407908281 172.31.31.144 -> 172.31.23.72 TCP 66 6633 → 51146 [ACK] Seq=1211 Ack=739 Win=853 Len=0 TSval=5422809 TSecr=23992934
250 0.407935131 172.31.31.144 -> 172.31.23.72 OpenFlow 187 Type: OFPT_PACKET_OUT
251 0.408036045 172.31.31.144 -> 172.31.23.72 OpenFlow 187 Type: OFPT_PACKET_OUT
252 0.408142615 172.31.23.72 -> 172.31.31.144 TCP 66 51148 → 6633 [ACK] Seq=493 Ack=969 Win=213 Len=0 TSval=23992934 TSecr=5422809
253 0.408214246 172.31.31.144 -> 172.31.23.72 OpenFlow 187 Type: OFPT_PACKET_OUT
254 0.408238842 172.31.23.72 -> 172.31.31.144 OpenFlow 189 Type: OFPT_PACKET_IN
255 0.408255990 172.31.23.72 -> 172.31.31.144 OpenFlow 189 Type: OFPT_PACKET_IN
256 0.408261501 172.31.31.144 -> 172.31.23.72 OpenFlow 187 Type: OFPT_PACKET_OUT
257 0.408304797 172.31.23.72 -> 172.31.31.144 OpenFlow 189 Type: OFPT_PACKET_IN
258 0.408310904 172.31.23.72 -> 172.31.31.144 OpenFlow 189 Type: OFPT_PACKET_IN
259 0.408397314 172.31.31.144 -> 172.31.23.72 OpenFlow 187 Type: OFPT_PACKET_OUT
260 0.408411969 172.31.23.72 -> 172.31.31.144 OpenFlow 189 Type: OFPT_PACKET_IN
261 0.408420494 172.31.31.144 -> 172.31.23.72 OpenFlow 187 Type: OFPT_PACKET_OUT
262 0.408431158 172.31.31.144 -> 172.31.23.72 TCP 66 6633 → 51156 [ACK] Seq=1 Ack=124 Win=853 Len=0 TSval=5422809 TSecr=23992934
263 0.408438389 172.31.23.72 -> 172.31.31.144 OpenFlow 189 Type: OFPT_PACKET_IN
264 0.408490550 172.31.31.144 -> 172.31.23.72 TCP 66 6633 → 51156 [ACK] Seq=1 Ack=247 Win=853 Len=0 TSval=5422809 TSecr=23992934
265 0.408547319 172.31.31.144 -> 172.31.23.72 OpenFlow 187 Type: OFPT_PACKET_OUT
266 0.408578343 172.31.31.144 -> 172.31.23.72 OpenFlow 187 Type: OFPT_PACKET_OUT
267 0.408617255 172.31.23.72 -> 172.31.31.144 OpenFlow 189 Type: OFPT_PACKET_IN
268 0.408640001 172.31.23.72 -> 172.31.31.144 OpenFlow 189 Type: OFPT_PACKET_IN
269 0.408674049 172.31.31.144 -> 172.31.23.72 TCP 66 6633 → 51142 [ACK] Seq=1211 Ack=1231 Win=853 Len=0 TSval=5422809 TSecr=23992934
270 0.408807650 172.31.23.72 -> 172.31.31.144 TCP 66 51150 → 6633 [ACK] Seq=493 Ack=727 Win=213 Len=0 TSval=23992934 TSecr=5422809
271 0.408870841 172.31.31.144 -> 172.31.23.72 OpenFlow 187 Type: OFPT_PACKET_OUT
272 0.408875419 172.31.31.144 -> 172.31.23.72 TCP 66 6633 → 51148 [ACK] Seq=969 Ack=739 Win=853 Len=0 TSval=5422809 TSecr=23992934
273 0.408907670 172.31.23.72 -> 172.31.31.144 OpenFlow 189 Type: OFPT_PACKET_IN
274 0.408931095 172.31.23.72 -> 172.31.31.144 OpenFlow 189 Type: OFPT_PACKET_IN
275 0.408966412 172.31.31.144 -> 172.31.23.72 OpenFlow 187 Type: OFPT_PACKET_OUT
276 0.409054881 172.31.23.72 -> 172.31.31.144 OpenFlow 189 Type: OFPT_PACKET_IN
277 0.409074255 172.31.31.144 -> 172.31.23.72 OpenFlow 187 Type: OFPT_PACKET_OUT
278 0.409079175 172.31.23.72 -> 172.31.31.144 OpenFlow 189 Type: OFPT_PACKET_IN
279 0.409158055 172.31.31.144 -> 172.31.23.72 OpenFlow 187 Type: OFPT_PACKET_OUT
280 0.409176817 172.31.31.144 -> 172.31.23.72 TCP 66 6633 → 51144 [ACK] Seq=969 Ack=739 Win=853 Len=0 TSval=5422809 TSecr=23992934
281 0.409207570 172.31.31.144 -> 172.31.23.72 OpenFlow 187 Type: OFPT_PACKET_OUT
282 0.409248330 172.31.31.144 -> 172.31.23.72 OpenFlow 187 Type: OFPT_PACKET_OUT
283 0.409262827 172.31.31.144 -> 172.31.23.72 OpenFlow 187 Type: OFPT_PACKET_OUT
284 0.409347463 172.31.23.72 -> 172.31.31.144 TCP 66 51152 → 6633 [ACK] Seq=493 Ack=606 Win=213 Len=0 TSval=23992935 TSecr=5422809
285 0.409460654 172.31.23.72 -> 172.31.31.144 OpenFlow 189 Type: OFPT_PACKET_IN
286 0.409497949 172.31.23.72 -> 172.31.31.144 OpenFlow 189 Type: OFPT_PACKET_IN
287 0.409535175 172.31.31.144 -> 172.31.23.72 OpenFlow 187 Type: OFPT_PACKET_OUT
288 0.409616083 172.31.23.72 -> 172.31.31.144 OpenFlow 189 Type: OFPT_PACKET_IN
289 0.409637273 172.31.23.72 -> 172.31.31.144 OpenFlow 189 Type: OFPT_PACKET_IN
290 0.409643218 172.31.23.72 -> 172.31.31.144 OpenFlow 189 Type: OFPT_PACKET_IN
291 0.409657555 172.31.31.144 -> 172.31.23.72 TCP 66 6633 → 51150 [ACK] Seq=969 Ack=739 Win=853 Len=0 TSval=5422809 TSecr=23992935
292 0.409680121 172.31.23.72 -> 172.31.31.144 OpenFlow 189 Type: OFPT_PACKET_IN
293 0.409694425 172.31.23.72 -> 172.31.31.144 OpenFlow 189 Type: OFPT_PACKET_IN
294 0.409786198 172.31.31.144 -> 172.31.23.72 TCP 66 6633 → 51158 [ACK] Seq=1 Ack=124 Win=853 Len=0 TSval=5422809 TSecr=23992935
295 0.409811291 172.31.31.144 -> 172.31.23.72 TCP 66 6633 → 51158 [ACK] Seq=1 Ack=247 Win=853 Len=0 TSval=5422809 TSecr=23992935
296 0.409864515 172.31.31.144 -> 172.31.23.72 TCP 66 6633 → 51144 [ACK] Seq=969 Ack=985 Win=853 Len=0 TSval=5422809 TSecr=23992935
297 0.409888816 172.31.31.144 -> 172.31.23.72 TCP 66 6633 → 51160 [ACK] Seq=1 Ack=124 Win=853 Len=0 TSval=5422809 TSecr=23992935
298 0.409955337 172.31.23.72 -> 172.31.31.144 OpenFlow 189 Type: OFPT_PACKET_IN
299 0.410121175 172.31.31.144 -> 172.31.23.72 TCP 66 6633 → 51160 [ACK] Seq=1 Ack=247 Win=853 Len=0 TSval=5422809 TSecr=23992935
300 0.449289097 172.31.23.72 -> 172.31.31.144 TCP 66 51152 → 6633 [ACK] Seq=493 Ack=727 Win=213 Len=0 TSval=23992945 TSecr=5422809
301 0.600041867 172.31.31.144 -> 172.31.23.72 OpenFlow 187 Type: OFPT_PACKET_OUT
302 0.600067646 172.31.31.144 -> 172.31.23.72 OpenFlow 187 Type: OFPT_PACKET_OUT
303 0.600106570 172.31.31.144 -> 172.31.23.72 OpenFlow 187 Type: OFPT_PACKET_OUT
304 0.600167499 172.31.31.144 -> 172.31.23.72 OpenFlow 187 Type: OFPT_PACKET_OUT
305 0.600245633 172.31.31.144 -> 172.31.23.72 OpenFlow 187 Type: OFPT_PACKET_OUT
306 0.600317045 172.31.31.144 -> 172.31.23.72 OpenFlow 187 Type: OFPT_PACKET_OUT
307 0.600469054 172.31.31.144 -> 172.31.23.72 OpenFlow 187 Type: OFPT_PACKET_OUT
308 0.600512750 172.31.31.144 -> 172.31.23.72 OpenFlow 187 Type: OFPT_PACKET_OUT
309 0.600531271 172.31.31.144 -> 172.31.23.72 OpenFlow 187 Type: OFPT_PACKET_OUT
310 0.600613730 172.31.31.144 -> 172.31.23.72 OpenFlow 187 Type: OFPT_PACKET_OUT
311 0.600678411 172.31.31.144 -> 172.31.23.72 OpenFlow 187 Type: OFPT_PACKET_OUT
312 0.600744491 172.31.31.144 -> 172.31.23.72 OpenFlow 187 Type: OFPT_PACKET_OUT
313 0.600812456 172.31.31.144 -> 172.31.23.72 OpenFlow 187 Type: OFPT_PACKET_OUT
314 0.600829072 172.31.23.72 -> 172.31.31.144 TCP 66 51154 → 6633 [ACK] Seq=247 Ack=727 Win=213 Len=0 TSval=23992982 TSecr=5422857
315 0.600873033 172.31.31.144 -> 172.31.23.72 OpenFlow 187 Type: OFPT_PACKET_OUT
316 0.600947722 172.31.31.144 -> 172.31.23.72 OpenFlow 187 Type: OFPT_PACKET_OUT
317 0.601018226 172.31.23.72 -> 172.31.31.144 OpenFlow 189 Type: OFPT_PACKET_IN
318 0.601037820 172.31.31.144 -> 172.31.23.72 OpenFlow 187 Type: OFPT_PACKET_OUT
319 0.601046984 172.31.23.72 -> 172.31.31.144 OpenFlow 189 Type: OFPT_PACKET_IN
320 0.601074778 172.31.23.72 -> 172.31.31.144 OpenFlow 189 Type: OFPT_PACKET_IN
321 0.601104958 172.31.23.72 -> 172.31.31.144 OpenFlow 189 Type: OFPT_PACKET_IN
322 0.601150081 172.31.23.72 -> 172.31.31.144 OpenFlow 189 Type: OFPT_PACKET_IN
323 0.601156253 172.31.23.72 -> 172.31.31.144 OpenFlow 189 Type: OFPT_PACKET_IN
324 0.601266819 172.31.31.144 -> 172.31.23.72 TCP 66 6633 → 51164 [ACK] Seq=1 Ack=124 Win=853 Len=0 TSval=5422857 TSecr=23992982
325 0.601273833 172.31.31.144 -> 172.31.23.72 TCP 66 6633 → 51164 [ACK] Seq=1 Ack=247 Win=853 Len=0 TSval=5422857 TSecr=23992982
326 0.601337355 172.31.31.144 -> 172.31.23.72 TCP 66 6633 → 51146 [ACK] Seq=1211 Ack=985 Win=853 Len=0 TSval=5422857 TSecr=23992982
327 0.601365560 172.31.31.144 -> 172.31.23.72 TCP 66 6633 → 51156 [ACK] Seq=1211 Ack=370 Win=853 Len=0 TSval=5422857 TSecr=23992982
328 0.601388596 172.31.31.144 -> 172.31.23.72 TCP 66 6633 → 51156 [ACK] Seq=1211 Ack=493 Win=853 Len=0 TSval=5422857 TSecr=23992982
329 0.601651759 172.31.23.72 -> 172.31.31.144 OpenFlow 189 Type: OFPT_PACKET_IN
330 0.601690943 172.31.23.72 -> 172.31.31.144 OpenFlow 189 Type: OFPT_PACKET_IN
331 0.601700405 172.31.23.72 -> 172.31.31.144 OpenFlow 189 Type: OFPT_PACKET_IN
332 0.601722558 172.31.23.72 -> 172.31.31.144 OpenFlow 189 Type: OFPT_PACKET_IN
333 0.601740457 172.31.23.72 -> 172.31.31.144 OpenFlow 189 Type: OFPT_PACKET_IN
334 0.601745752 172.31.23.72 -> 172.31.31.144 OpenFlow 189 Type: OFPT_PACKET_IN
335 0.601847041 172.31.23.72 -> 172.31.31.144 OpenFlow 189 Type: OFPT_PACKET_IN
336 0.601853401 172.31.23.72 -> 172.31.31.144 OpenFlow 189 Type: OFPT_PACKET_IN
337 0.601855035 172.31.23.72 -> 172.31.31.144 OpenFlow 189 Type: OFPT_PACKET_IN
338 0.601924420 172.31.31.144 -> 172.31.23.72 TCP 66 6633 → 51158 [ACK] Seq=1 Ack=370 Win=853 Len=0 TSval=5422857 TSecr=23992983
339 0.601929657 172.31.31.144 -> 172.31.23.72 TCP 66 6633 → 51168 [ACK] Seq=1 Ack=124 Win=853 Len=0 TSval=5422857 TSecr=23992983
340 0.601931792 172.31.31.144 -> 172.31.23.72 TCP 66 6633 → 51158 [ACK] Seq=1 Ack=493 Win=853 Len=0 TSval=5422857 TSecr=23992983
341 0.602025865 172.31.23.72 -> 172.31.31.144 OpenFlow 189 Type: OFPT_PACKET_IN
342 0.602138072 172.31.31.144 -> 172.31.23.72 TCP 66 6633 → 51166 [ACK] Seq=1 Ack=124 Win=853 Len=0 TSval=5422857 TSecr=23992983
343 0.602144452 172.31.31.144 -> 172.31.23.72 TCP 66 6633 → 51168 [ACK] Seq=1 Ack=247 Win=853 Len=0 TSval=5422857 TSecr=23992983
344 0.602146473 172.31.31.144 -> 172.31.23.72 TCP 66 6633 → 51166 [ACK] Seq=1 Ack=247 Win=853 Len=0 TSval=5422857 TSecr=23992983
345 0.602254306 172.31.31.144 -> 172.31.23.72 TCP 66 6633 → 51148 [ACK] Seq=969 Ack=985 Win=853 Len=0 TSval=5422857 TSecr=23992983
346 0.602477592 172.31.31.144 -> 172.31.23.72 TCP 66 6633 → 51154 [ACK] Seq=727 Ack=493 Win=853 Len=0 TSval=5422857 TSecr=23992983
347 0.799687301 172.31.31.144 -> 172.31.23.72 OpenFlow 187 Type: OFPT_PACKET_OUT
348 0.799731200 172.31.31.144 -> 172.31.23.72 OpenFlow 187 Type: OFPT_PACKET_OUT
349 0.799790996 172.31.31.144 -> 172.31.23.72 OpenFlow 187 Type: OFPT_PACKET_OUT
350 0.799888210 172.31.31.144 -> 172.31.23.72 OpenFlow 187 Type: OFPT_PACKET_OUT
351 0.799975114 172.31.31.144 -> 172.31.23.72 OpenFlow 187 Type: OFPT_PACKET_OUT
352 0.800053311 172.31.31.144 -> 172.31.23.72 OpenFlow 187 Type: OFPT_PACKET_OUT
353 0.800132623 172.31.31.144 -> 172.31.23.72 OpenFlow 187 Type: OFPT_PACKET_OUT
354 0.800194968 172.31.31.144 -> 172.31.23.72 OpenFlow 187 Type: OFPT_PACKET_OUT
355 0.800262596 172.31.31.144 -> 172.31.23.72 OpenFlow 187 Type: OFPT_PACKET_OUT
356 0.800329571 172.31.31.144 -> 172.31.23.72 OpenFlow 187 Type: OFPT_PACKET_OUT
357 0.800488596 172.31.31.144 -> 172.31.23.72 OpenFlow 187 Type: OFPT_PACKET_OUT
358 0.800510452 172.31.23.72 -> 172.31.31.144 TCP 66 51158 → 6633 [ACK] Seq=493 Ack=1211 Win=213 Len=0 TSval=23993032 TSecr=5422906
359 0.800589094 172.31.31.144 -> 172.31.23.72 OpenFlow 187 Type: OFPT_PACKET_OUT
360 0.800594329 172.31.31.144 -> 172.31.23.72 OpenFlow 187 Type: OFPT_PACKET_OUT
361 0.800613726 172.31.23.72 -> 172.31.31.144 OpenFlow 189 Type: OFPT_PACKET_IN
362 0.800638788 172.31.23.72 -> 172.31.31.144 OpenFlow 189 Type: OFPT_PACKET_IN
363 0.800646388 172.31.23.72 -> 172.31.31.144 OpenFlow 189 Type: OFPT_PACKET_IN
364 0.800673307 172.31.31.144 -> 172.31.23.72 OpenFlow 187 Type: OFPT_PACKET_OUT
365 0.800683575 172.31.23.72 -> 172.31.31.144 OpenFlow 189 Type: OFPT_PACKET_IN
366 0.800752001 172.31.23.72 -> 172.31.31.144 OpenFlow 189 Type: OFPT_PACKET_IN
367 0.800796188 172.31.31.144 -> 172.31.23.72 OpenFlow 187 Type: OFPT_PACKET_OUT
368 0.800803142 172.31.23.72 -> 172.31.31.144 OpenFlow 189 Type: OFPT_PACKET_IN
369 0.800846751 172.31.31.144 -> 172.31.23.72 TCP 66 6633 → 51170 [ACK] Seq=1 Ack=124 Win=853 Len=0 TSval=5422907 TSecr=23993032
370 0.800852743 172.31.31.144 -> 172.31.23.72 OpenFlow 187 Type: OFPT_PACKET_OUT
371 0.800868696 172.31.31.144 -> 172.31.23.72 TCP 66 6633 → 51170 [ACK] Seq=1 Ack=247 Win=853 Len=0 TSval=5422907 TSecr=23993032
372 0.800900346 172.31.31.144 -> 172.31.23.72 TCP 66 6633 → 51168 [ACK] Seq=1 Ack=370 Win=853 Len=0 TSval=5422907 TSecr=23993032
373 0.800905014 172.31.31.144 -> 172.31.23.72 TCP 66 6633 → 51160 [ACK] Seq=727 Ack=370 Win=853 Len=0 TSval=5422907 TSecr=23993032
374 0.800949828 172.31.31.144 -> 172.31.23.72 TCP 66 6633 → 51168 [ACK] Seq=1 Ack=493 Win=853 Len=0 TSval=5422907 TSecr=23993032
375 0.800964817 172.31.31.144 -> 172.31.23.72 OpenFlow 187 Type: OFPT_PACKET_OUT
376 0.800988911 172.31.31.144 -> 172.31.23.72 TCP 66 6633 → 51160 [ACK] Seq=727 Ack=493 Win=853 Len=0 TSval=5422907 TSecr=23993032
377 0.801003574 172.31.31.144 -> 172.31.23.72 OpenFlow 187 Type: OFPT_PACKET_OUT
378 0.801023411 172.31.31.144 -> 172.31.23.72 OpenFlow 187 Type: OFPT_PACKET_OUT
379 0.801118177 172.31.31.144 -> 172.31.23.72 OpenFlow 187 Type: OFPT_PACKET_OUT
380 0.801198063 172.31.23.72 -> 172.31.31.144 OpenFlow 189 Type: OFPT_PACKET_IN
381 0.801224523 172.31.31.144 -> 172.31.23.72 OpenFlow 187 Type: OFPT_PACKET_OUT
382 0.801230725 172.31.23.72 -> 172.31.31.144 OpenFlow 189 Type: OFPT_PACKET_IN
383 0.801284731 172.31.23.72 -> 172.31.31.144 OpenFlow 189 Type: OFPT_PACKET_IN
384 0.801302094 172.31.23.72 -> 172.31.31.144 OpenFlow 189 Type: OFPT_PACKET_IN
385 0.801309826 172.31.23.72 -> 172.31.31.144 OpenFlow 189 Type: OFPT_PACKET_IN
386 0.801334247 172.31.31.144 -> 172.31.23.72 OpenFlow 187 Type: OFPT_PACKET_OUT
387 0.801358872 172.31.23.72 -> 172.31.31.144 OpenFlow 189 Type: OFPT_PACKET_IN
388 0.801380308 172.31.31.144 -> 172.31.23.72 TCP 66 6633 → 51152 [ACK] Seq=727 Ack=739 Win=853 Len=0 TSval=5422907 TSecr=23993032
389 0.801411535 172.31.31.144 -> 172.31.23.72 OpenFlow 187 Type: OFPT_PACKET_OUT
390 0.801506690 172.31.31.144 -> 172.31.23.72 OpenFlow 187 Type: OFPT_PACKET_OUT
391 0.801512802 172.31.31.144 -> 172.31.23.72 TCP 66 6633 → 51156 [ACK] Seq=1211 Ack=739 Win=853 Len=0 TSval=5422907 TSecr=23993033
392 0.801553687 172.31.23.72 -> 172.31.31.144 TCP 66 51162 → 6633 [ACK] Seq=247 Ack=727 Win=213 Len=0 TSval=23993033 TSecr=5422907
393 0.801559767 172.31.31.144 -> 172.31.23.72 TCP 66 6633 → 51150 [ACK] Seq=969 Ack=985 Win=853 Len=0 TSval=5422907 TSecr=23993033
394 0.801575681 172.31.31.144 -> 172.31.23.72 OpenFlow 187 Type: OFPT_PACKET_OUT
395 0.801652473 172.31.31.144 -> 172.31.23.72 OpenFlow 187 Type: OFPT_PACKET_OUT
396 0.801658595 172.31.23.72 -> 172.31.31.144 OpenFlow 189 Type: OFPT_PACKET_IN
397 0.801680315 172.31.23.72 -> 172.31.31.144 OpenFlow 189 Type: OFPT_PACKET_IN
398 0.801695187 172.31.23.72 -> 172.31.31.144 OpenFlow 189 Type: OFPT_PACKET_IN
399 0.801733884 172.31.23.72 -> 172.31.31.144 OpenFlow 189 Type: OFPT_PACKET_IN
400 0.801817324 172.31.23.72 -> 172.31.31.144 OpenFlow 189 Type: OFPT_PACKET_IN
401 0.801840710 172.31.23.72 -> 172.31.31.144 OpenFlow 189 Type: OFPT_PACKET_IN
402 0.801869387 172.31.31.144 -> 172.31.23.72 TCP 66 6633 → 51158 [ACK] Seq=1211 Ack=739 Win=853 Len=0 TSval=5422907 TSecr=23993033
403 0.801877014 172.31.31.144 -> 172.31.23.72 TCP 66 6633 → 51172 [ACK] Seq=1 Ack=124 Win=853 Len=0 TSval=5422907 TSecr=23993033
404 0.801917428 172.31.31.144 -> 172.31.23.72 TCP 66 6633 → 51172 [ACK] Seq=1 Ack=247 Win=853 Len=0 TSval=5422907 TSecr=23993033
405 0.801954464 172.31.31.144 -> 172.31.23.72 OpenFlow 187 Type: OFPT_PACKET_OUT
406 0.801979979 172.31.31.144 -> 172.31.23.72 TCP 66 6633 → 51164 [ACK] Seq=606 Ack=370 Win=853 Len=0 TSval=5422907 TSecr=23993033
407 0.801998738 172.31.31.144 -> 172.31.23.72 OpenFlow 187 Type: OFPT_PACKET_OUT
