  1 0.000000000 172.31.31.144 -> 172.31.24.227 TCP 187 6633 → 50440 [PSH, ACK] Seq=1 Ack=1 Win=853 Len=121 TSval=1257580 TSecr=394322802
  2 0.000022551 172.31.31.144 -> 172.31.24.227 TCP 187 6633 → 50440 [PSH, ACK] Seq=122 Ack=1 Win=853 Len=121 TSval=1257580 TSecr=394322802
  3 0.000028242 172.31.31.144 -> 172.31.24.227 TCP 187 6633 → 50440 [PSH, ACK] Seq=243 Ack=1 Win=853 Len=121 TSval=1257580 TSecr=394322802
  4 0.000044125 172.31.31.144 -> 172.31.24.227 TCP 187 6633 → 50440 [PSH, ACK] Seq=364 Ack=1 Win=853 Len=121 TSval=1257580 TSecr=394322802
  5 0.000076535 172.31.31.144 -> 172.31.24.227 TCP 187 6633 → 50440 [PSH, ACK] Seq=485 Ack=1 Win=853 Len=121 TSval=1257580 TSecr=394322802
  6 0.000108076 172.31.31.144 -> 172.31.24.227 TCP 187 6633 → 50440 [PSH, ACK] Seq=606 Ack=1 Win=853 Len=121 TSval=1257580 TSecr=394322802
  7 0.000158265 172.31.31.144 -> 172.31.24.227 TCP 187 6633 → 50440 [PSH, ACK] Seq=727 Ack=1 Win=853 Len=121 TSval=1257580 TSecr=394322802
  8 0.000206439 172.31.31.144 -> 172.31.24.227 TCP 187 6633 → 50440 [PSH, ACK] Seq=848 Ack=1 Win=853 Len=121 TSval=1257580 TSecr=394322802
  9 0.000261109 172.31.31.144 -> 172.31.24.227 TCP 187 6633 → 50440 [PSH, ACK] Seq=969 Ack=1 Win=853 Len=121 TSval=1257580 TSecr=394322802
 10 0.000312307 172.31.31.144 -> 172.31.24.227 TCP 187 6633 → 50440 [PSH, ACK] Seq=1090 Ack=1 Win=853 Len=121 TSval=1257580 TSecr=394322802
 11 0.000359707 172.31.31.144 -> 172.31.24.227 TCP 187 6633 → 50442 [PSH, ACK] Seq=1 Ack=1 Win=853 Len=121 TSval=1257580 TSecr=394322827
 12 0.000401979 172.31.31.144 -> 172.31.24.227 TCP 187 6633 → 50442 [PSH, ACK] Seq=122 Ack=1 Win=853 Len=121 TSval=1257580 TSecr=394322827
 13 0.000446429 172.31.31.144 -> 172.31.24.227 TCP 187 6633 → 50442 [PSH, ACK] Seq=243 Ack=1 Win=853 Len=121 TSval=1257580 TSecr=394322827
 14 0.000491855 172.31.31.144 -> 172.31.24.227 TCP 187 6633 → 50442 [PSH, ACK] Seq=364 Ack=1 Win=853 Len=121 TSval=1257580 TSecr=394322827
 15 0.000551445 172.31.31.144 -> 172.31.24.227 TCP 187 6633 → 50442 [PSH, ACK] Seq=485 Ack=1 Win=853 Len=121 TSval=1257580 TSecr=394322827
 16 0.000597311 172.31.31.144 -> 172.31.24.227 TCP 187 6633 → 50442 [PSH, ACK] Seq=606 Ack=1 Win=853 Len=121 TSval=1257580 TSecr=394322827
 17 0.000641366 172.31.31.144 -> 172.31.24.227 TCP 187 6633 → 50442 [PSH, ACK] Seq=727 Ack=1 Win=853 Len=121 TSval=1257580 TSecr=394322827
 18 0.000689516 172.31.31.144 -> 172.31.24.227 TCP 187 6633 → 50442 [PSH, ACK] Seq=848 Ack=1 Win=853 Len=121 TSval=1257580 TSecr=394322827
 19 0.000734816 172.31.31.144 -> 172.31.24.227 TCP 187 6633 → 50442 [PSH, ACK] Seq=969 Ack=1 Win=853 Len=121 TSval=1257580 TSecr=394322827
 20 0.000783710 172.31.31.144 -> 172.31.24.227 TCP 187 6633 → 50442 [PSH, ACK] Seq=1090 Ack=1 Win=853 Len=121 TSval=1257580 TSecr=394322827
 21 0.000870040 172.31.24.227 -> 172.31.31.144 TCP 66 50440 → 6633 [ACK] Seq=1 Ack=1211 Win=213 Len=0 TSval=394322852 TSecr=1257580
 22 0.000986947 172.31.24.227 -> 172.31.31.144 OpenFlow 189 Type: OFPT_PACKET_IN
 23 0.001008117 172.31.24.227 -> 172.31.31.144 OpenFlow 189 Type: OFPT_PACKET_IN
 24 0.001030126 172.31.24.227 -> 172.31.31.144 OpenFlow 189 Type: OFPT_PACKET_IN
 25 0.001065701 172.31.24.227 -> 172.31.31.144 OpenFlow 189 Type: OFPT_PACKET_IN
 26 0.001089079 172.31.24.227 -> 172.31.31.144 OpenFlow 189 Type: OFPT_PACKET_IN
 27 0.001122611 172.31.24.227 -> 172.31.31.144 OpenFlow 189 Type: OFPT_PACKET_IN
 28 0.001137922 172.31.24.227 -> 172.31.31.144 OpenFlow 189 Type: OFPT_PACKET_IN
 29 0.001237775 172.31.24.227 -> 172.31.31.144 OpenFlow 189 Type: OFPT_PACKET_IN
 30 0.001280429 172.31.31.144 -> 172.31.24.227 TCP 66 6633 → 50446 [ACK] Seq=1 Ack=124 Win=853 Len=0 TSval=1257580 TSecr=394322852
 31 0.001290063 172.31.31.144 -> 172.31.24.227 TCP 66 6633 → 50446 [ACK] Seq=1 Ack=247 Win=853 Len=0 TSval=1257580 TSecr=394322852
 32 0.001292901 172.31.31.144 -> 172.31.24.227 TCP 66 6633 → 50430 [ACK] Seq=1 Ack=124 Win=853 Len=0 TSval=1257580 TSecr=394322852
 33 0.001357250 172.31.31.144 -> 172.31.24.227 TCP 66 6633 → 50430 [ACK] Seq=1 Ack=247 Win=853 Len=0 TSval=1257580 TSecr=394322852
 34 0.001672420 172.31.24.227 -> 172.31.31.144 OpenFlow 189 Type: OFPT_PACKET_IN
 35 0.001690983 172.31.24.227 -> 172.31.31.144 OpenFlow 189 Type: OFPT_PACKET_IN
 36 0.001760378 172.31.31.144 -> 172.31.24.227 TCP 66 6633 → 50442 [ACK] Seq=1211 Ack=247 Win=853 Len=0 TSval=1257580 TSecr=394322852
 37 0.001808895 172.31.24.227 -> 172.31.31.144 OpenFlow 189 Type: OFPT_PACKET_IN
 38 0.001826335 172.31.24.227 -> 172.31.31.144 OpenFlow 189 Type: OFPT_PACKET_IN
 39 0.001840070 172.31.24.227 -> 172.31.31.144 OpenFlow 189 Type: OFPT_PACKET_IN
 40 0.001855239 172.31.24.227 -> 172.31.31.144 OpenFlow 189 Type: OFPT_PACKET_IN
 41 0.001903147 172.31.24.227 -> 172.31.31.144 OpenFlow 189 Type: OFPT_PACKET_IN
 42 0.001906216 172.31.24.227 -> 172.31.31.144 OpenFlow 189 Type: OFPT_PACKET_IN
 43 0.001923187 172.31.24.227 -> 172.31.31.144 OpenFlow 189 Type: OFPT_PACKET_IN
 44 0.001929314 172.31.24.227 -> 172.31.31.144 OpenFlow 189 Type: OFPT_PACKET_IN
 45 0.002053992 172.31.31.144 -> 172.31.24.227 TCP 66 6633 → 50450 [ACK] Seq=1 Ack=124 Win=853 Len=0 TSval=1257580 TSecr=394322852
 46 0.002060982 172.31.31.144 -> 172.31.24.227 TCP 66 6633 → 50450 [ACK] Seq=1 Ack=247 Win=853 Len=0 TSval=1257580 TSecr=394322852
 47 0.002066771 172.31.24.227 -> 172.31.31.144 OpenFlow 189 Type: OFPT_PACKET_IN
 48 0.002086123 172.31.24.227 -> 172.31.31.144 OpenFlow 189 Type: OFPT_PACKET_IN
 49 0.002212329 172.31.31.144 -> 172.31.24.227 TCP 66 6633 → 50434 [ACK] Seq=1 Ack=124 Win=853 Len=0 TSval=1257580 TSecr=394322852
 50 0.002216366 172.31.31.144 -> 172.31.24.227 TCP 66 6633 → 50446 [ACK] Seq=1 Ack=370 Win=853 Len=0 TSval=1257580 TSecr=394322852
 51 0.002358882 172.31.31.144 -> 172.31.24.227 TCP 66 6633 → 50444 [ACK] Seq=1 Ack=124 Win=853 Len=0 TSval=1257580 TSecr=394322852
 52 0.002363866 172.31.31.144 -> 172.31.24.227 TCP 66 6633 → 50434 [ACK] Seq=1 Ack=247 Win=853 Len=0 TSval=1257580 TSecr=394322852
 53 0.002475269 172.31.31.144 -> 172.31.24.227 TCP 66 6633 → 50446 [ACK] Seq=1 Ack=493 Win=853 Len=0 TSval=1257580 TSecr=394322852
 54 0.002478853 172.31.31.144 -> 172.31.24.227 TCP 66 6633 → 50444 [ACK] Seq=1 Ack=247 Win=853 Len=0 TSval=1257580 TSecr=394322852
 55 0.002775163 172.31.31.144 -> 172.31.24.227 TCP 66 6633 → 50440 [ACK] Seq=1211 Ack=247 Win=853 Len=0 TSval=1257581 TSecr=394322852
 56 0.002976877 172.31.31.144 -> 172.31.24.227 TCP 66 6633 → 50432 [ACK] Seq=1 Ack=247 Win=853 Len=0 TSval=1257581 TSecr=394322852
 57 0.003329292 172.31.31.144 -> 172.31.24.227 TCP 66 6633 → 50438 [ACK] Seq=1 Ack=247 Win=853 Len=0 TSval=1257581 TSecr=394322852
 58 0.100246634 172.31.31.144 -> 172.31.24.227 OpenFlow 187 Type: OFPT_PACKET_OUT
 59 0.100256037 172.31.31.144 -> 172.31.24.227 OpenFlow 187 Type: OFPT_PACKET_OUT
 60 0.100259453 172.31.31.144 -> 172.31.24.227 OpenFlow 187 Type: OFPT_PACKET_OUT
 61 0.100261806 172.31.31.144 -> 172.31.24.227 OpenFlow 187 Type: OFPT_PACKET_OUT
 62 0.100288671 172.31.31.144 -> 172.31.24.227 OpenFlow 187 Type: OFPT_PACKET_OUT
 63 0.100292631 172.31.31.144 -> 172.31.24.227 OpenFlow 187 Type: OFPT_PACKET_OUT
 64 0.100389006 172.31.31.144 -> 172.31.24.227 OpenFlow 187 Type: OFPT_PACKET_OUT
 65 0.100394495 172.31.31.144 -> 172.31.24.227 OpenFlow 187 Type: OFPT_PACKET_OUT
 66 0.100442693 172.31.31.144 -> 172.31.24.227 OpenFlow 187 Type: OFPT_PACKET_OUT
 67 0.100488146 172.31.31.144 -> 172.31.24.227 OpenFlow 187 Type: OFPT_PACKET_OUT
 68 0.100537454 172.31.31.144 -> 172.31.24.227 OpenFlow 187 Type: OFPT_PACKET_OUT
 69 0.100583535 172.31.31.144 -> 172.31.24.227 OpenFlow 187 Type: OFPT_PACKET_OUT
 70 0.100634517 172.31.31.144 -> 172.31.24.227 OpenFlow 187 Type: OFPT_PACKET_OUT
 71 0.100678240 172.31.31.144 -> 172.31.24.227 OpenFlow 187 Type: OFPT_PACKET_OUT
 72 0.100737452 172.31.31.144 -> 172.31.24.227 OpenFlow 187 Type: OFPT_PACKET_OUT
 73 0.100783824 172.31.31.144 -> 172.31.24.227 OpenFlow 187 Type: OFPT_PACKET_OUT
 74 0.100925437 172.31.24.227 -> 172.31.31.144 TCP 66 50446 → 6633 [ACK] Seq=493 Ack=1211 Win=213 Len=0 TSval=394322877 TSecr=1257605
 75 0.101205417 172.31.24.227 -> 172.31.31.144 TCP 66 50444 → 6633 [ACK] Seq=247 Ack=727 Win=213 Len=0 TSval=394322877 TSecr=1257605
 76 0.101288267 172.31.24.227 -> 172.31.31.144 OpenFlow 189 Type: OFPT_PACKET_IN
 77 0.101306847 172.31.24.227 -> 172.31.31.144 OpenFlow 312 Type: OFPT_PACKET_IN
 78 0.101335231 172.31.24.227 -> 172.31.31.144 OpenFlow 189 Type: OFPT_PACKET_IN
 79 0.101383382 172.31.24.227 -> 172.31.31.144 OpenFlow 189 Type: OFPT_PACKET_IN
 80 0.101400197 172.31.24.227 -> 172.31.31.144 OpenFlow 435 Type: OFPT_PACKET_IN
 81 0.101505787 172.31.24.227 -> 172.31.31.144 OpenFlow 189 Type: OFPT_PACKET_IN
 82 0.101522265 172.31.31.144 -> 172.31.24.227 TCP 66 6633 → 50448 [ACK] Seq=1 Ack=124 Win=853 Len=0 TSval=1257605 TSecr=394322877
 83 0.101527567 172.31.31.144 -> 172.31.24.227 TCP 66 6633 → 50448 [ACK] Seq=1 Ack=370 Win=853 Len=0 TSval=1257605 TSecr=394322877
 84 0.101529862 172.31.31.144 -> 172.31.24.227 TCP 66 6633 → 50448 [ACK] Seq=1 Ack=493 Win=853 Len=0 TSval=1257605 TSecr=394322877
 85 0.101534879 172.31.24.227 -> 172.31.31.144 OpenFlow 189 Type: OFPT_PACKET_IN
 86 0.101555780 172.31.24.227 -> 172.31.31.144 OpenFlow 189 Type: OFPT_PACKET_IN
 87 0.101575601 172.31.24.227 -> 172.31.31.144 OpenFlow 189 Type: OFPT_PACKET_IN
 88 0.101583682 172.31.24.227 -> 172.31.31.144 OpenFlow 189 Type: OFPT_PACKET_IN
 89 0.101598466 172.31.24.227 -> 172.31.31.144 OpenFlow 189 Type: OFPT_PACKET_IN
 90 0.101651370 172.31.24.227 -> 172.31.31.144 OpenFlow 189 Type: OFPT_PACKET_IN
 91 0.101656853 172.31.24.227 -> 172.31.31.144 OpenFlow 189 Type: OFPT_PACKET_IN
 92 0.101709719 172.31.31.144 -> 172.31.24.227 TCP 66 6633 → 50452 [ACK] Seq=1 Ack=124 Win=853 Len=0 TSval=1257605 TSecr=394322877
 93 0.101715100 172.31.31.144 -> 172.31.24.227 TCP 66 6633 → 50452 [ACK] Seq=1 Ack=247 Win=853 Len=0 TSval=1257605 TSecr=394322877
 94 0.101779088 172.31.31.144 -> 172.31.24.227 TCP 66 6633 → 50450 [ACK] Seq=1 Ack=370 Win=853 Len=0 TSval=1257605 TSecr=394322877
 95 0.101906291 172.31.31.144 -> 172.31.24.227 TCP 66 6633 → 50450 [ACK] Seq=1 Ack=493 Win=853 Len=0 TSval=1257605 TSecr=394322877
 96 0.102128215 172.31.31.144 -> 172.31.24.227 TCP 66 6633 → 50440 [ACK] Seq=1211 Ack=493 Win=853 Len=0 TSval=1257605 TSecr=394322877
 97 0.102331767 172.31.31.144 -> 172.31.24.227 TCP 66 6633 → 50442 [ACK] Seq=1211 Ack=739 Win=853 Len=0 TSval=1257605 TSecr=394322877
 98 0.102917684 172.31.31.144 -> 172.31.24.227 TCP 66 6633 → 50436 [ACK] Seq=1 Ack=247 Win=853 Len=0 TSval=1257606 TSecr=394322877
 99 0.201030084 172.31.31.144 -> 172.31.24.227 OpenFlow 187 Type: OFPT_PACKET_OUT
100 0.201049163 172.31.31.144 -> 172.31.24.227 OpenFlow 187 Type: OFPT_PACKET_OUT
101 0.201053427 172.31.31.144 -> 172.31.24.227 OpenFlow 429 Type: OFPT_PACKET_OUT
102 0.201056431 172.31.31.144 -> 172.31.24.227 OpenFlow 429 Type: OFPT_PACKET_OUT
103 0.201058752 172.31.31.144 -> 172.31.24.227 OpenFlow 187 Type: OFPT_PACKET_OUT
104 0.201061064 172.31.31.144 -> 172.31.24.227 OpenFlow 429 Type: OFPT_PACKET_OUT
105 0.201063008 172.31.31.144 -> 172.31.24.227 OpenFlow 792 Type: OFPT_PACKET_OUT
106 0.201618961 172.31.24.227 -> 172.31.31.144 TCP 66 50450 → 6633 [ACK] Seq=493 Ack=1211 Win=213 Len=0 TSval=394322902 TSecr=1257630
107 0.201711155 172.31.24.227 -> 172.31.31.144 OpenFlow 189 Type: OFPT_PACKET_IN
108 0.201730295 172.31.24.227 -> 172.31.31.144 OpenFlow 189 Type: OFPT_PACKET_IN
109 0.201766006 172.31.24.227 -> 172.31.31.144 OpenFlow 189 Type: OFPT_PACKET_IN
110 0.201786766 172.31.24.227 -> 172.31.31.144 OpenFlow 189 Type: OFPT_PACKET_IN
111 0.201795731 172.31.24.227 -> 172.31.31.144 OpenFlow 189 Type: OFPT_PACKET_IN
112 0.201835884 172.31.24.227 -> 172.31.31.144 OpenFlow 189 Type: OFPT_PACKET_IN
113 0.202003004 172.31.31.144 -> 172.31.24.227 TCP 66 6633 → 50440 [ACK] Seq=1211 Ack=739 Win=853 Len=0 TSval=1257630 TSecr=394322902
114 0.202010588 172.31.31.144 -> 172.31.24.227 TCP 66 6633 → 50466 [ACK] Seq=1 Ack=124 Win=853 Len=0 TSval=1257630 TSecr=394322902
115 0.202013688 172.31.31.144 -> 172.31.24.227 TCP 66 6633 → 50466 [ACK] Seq=1 Ack=247 Win=853 Len=0 TSval=1257630 TSecr=394322902
116 0.202209316 172.31.24.227 -> 172.31.31.144 TCP 66 50448 → 6633 [ACK] Seq=493 Ack=969 Win=213 Len=0 TSval=394322902 TSecr=1257630
117 0.202334264 172.31.24.227 -> 172.31.31.144 OpenFlow 189 Type: OFPT_PACKET_IN
118 0.202353630 172.31.24.227 -> 172.31.31.144 OpenFlow 189 Type: OFPT_PACKET_IN
119 0.202457645 172.31.24.227 -> 172.31.31.144 OpenFlow 189 Type: OFPT_PACKET_IN
120 0.202477019 172.31.24.227 -> 172.31.31.144 OpenFlow 189 Type: OFPT_PACKET_IN
121 0.202498229 172.31.24.227 -> 172.31.31.144 OpenFlow 189 Type: OFPT_PACKET_IN
122 0.202535483 172.31.24.227 -> 172.31.31.144 OpenFlow 189 Type: OFPT_PACKET_IN
123 0.202555430 172.31.24.227 -> 172.31.31.144 OpenFlow 189 Type: OFPT_PACKET_IN
124 0.202583902 172.31.31.144 -> 172.31.24.227 TCP 66 6633 → 50446 [ACK] Seq=1211 Ack=739 Win=853 Len=0 TSval=1257630 TSecr=394322902
125 0.202590847 172.31.24.227 -> 172.31.31.144 OpenFlow 189 Type: OFPT_PACKET_IN
126 0.202596156 172.31.31.144 -> 172.31.24.227 TCP 66 6633 → 50458 [ACK] Seq=1 Ack=124 Win=853 Len=0 TSval=1257630 TSecr=394322903
127 0.202599111 172.31.31.144 -> 172.31.24.227 TCP 66 6633 → 50458 [ACK] Seq=1 Ack=247 Win=853 Len=0 TSval=1257630 TSecr=394322903
128 0.202611593 172.31.24.227 -> 172.31.31.144 OpenFlow 189 Type: OFPT_PACKET_IN
129 0.202614447 172.31.24.227 -> 172.31.31.144 OpenFlow 189 Type: OFPT_PACKET_IN
130 0.202697422 172.31.31.144 -> 172.31.24.227 TCP 66 6633 → 50456 [ACK] Seq=1 Ack=124 Win=853 Len=0 TSval=1257631 TSecr=394322903
131 0.202705751 172.31.24.227 -> 172.31.31.144 OpenFlow 189 Type: OFPT_PACKET_IN
132 0.202789383 172.31.24.227 -> 172.31.31.144 OpenFlow 189 Type: OFPT_PACKET_IN
133 0.202831671 172.31.31.144 -> 172.31.24.227 TCP 66 6633 → 50456 [ACK] Seq=1 Ack=247 Win=853 Len=0 TSval=1257631 TSecr=394322903
134 0.202836171 172.31.31.144 -> 172.31.24.227 TCP 66 6633 → 50452 [ACK] Seq=1 Ack=370 Win=853 Len=0 TSval=1257631 TSecr=394322903
135 0.202838993 172.31.31.144 -> 172.31.24.227 TCP 66 6633 → 50454 [ACK] Seq=1 Ack=124 Win=853 Len=0 TSval=1257631 TSecr=394322903
136 0.202948537 172.31.31.144 -> 172.31.24.227 TCP 66 6633 → 50452 [ACK] Seq=1 Ack=493 Win=853 Len=0 TSval=1257631 TSecr=394322903
137 0.203010843 172.31.31.144 -> 172.31.24.227 TCP 66 6633 → 50446 [ACK] Seq=1211 Ack=985 Win=853 Len=0 TSval=1257631 TSecr=394322903
138 0.203014302 172.31.31.144 -> 172.31.24.227 TCP 66 6633 → 50454 [ACK] Seq=1 Ack=247 Win=853 Len=0 TSval=1257631 TSecr=394322903
139 0.203352176 172.31.31.144 -> 172.31.24.227 TCP 66 6633 → 50444 [ACK] Seq=727 Ack=493 Win=853 Len=0 TSval=1257631 TSecr=394322903
140 0.300937285 172.31.31.144 -> 172.31.24.227 OpenFlow 187 Type: OFPT_PACKET_OUT
141 0.300955140 172.31.31.144 -> 172.31.24.227 OpenFlow 187 Type: OFPT_PACKET_OUT
142 0.300959903 172.31.31.144 -> 172.31.24.227 OpenFlow 429 Type: OFPT_PACKET_OUT
143 0.300962923 172.31.31.144 -> 172.31.24.227 OpenFlow 429 Type: OFPT_PACKET_OUT
144 0.300965338 172.31.31.144 -> 172.31.24.227 OpenFlow 187 Type: OFPT_PACKET_OUT
145 0.300967628 172.31.31.144 -> 172.31.24.227 OpenFlow 550 Type: OFPT_PACKET_OUT
146 0.300969633 172.31.31.144 -> 172.31.24.227 OpenFlow 429 Type: OFPT_PACKET_OUT
147 0.301450424 172.31.24.227 -> 172.31.31.144 TCP 66 50452 → 6633 [ACK] Seq=493 Ack=969 Win=213 Len=0 TSval=394322927 TSecr=1257655
148 0.301554089 172.31.24.227 -> 172.31.31.144 OpenFlow 189 Type: OFPT_PACKET_IN
149 0.301575205 172.31.24.227 -> 172.31.31.144 OpenFlow 189 Type: OFPT_PACKET_IN
150 0.301610013 172.31.24.227 -> 172.31.31.144 OpenFlow 189 Type: OFPT_PACKET_IN
151 0.301635089 172.31.24.227 -> 172.31.31.144 OpenFlow 189 Type: OFPT_PACKET_IN
152 0.301644091 172.31.24.227 -> 172.31.31.144 OpenFlow 189 Type: OFPT_PACKET_IN
153 0.301689013 172.31.24.227 -> 172.31.31.144 OpenFlow 189 Type: OFPT_PACKET_IN
154 0.301758912 172.31.31.144 -> 172.31.24.227 TCP 66 6633 → 50450 [ACK] Seq=1211 Ack=616 Win=853 Len=0 TSval=1257655 TSecr=394322927
155 0.301883602 172.31.31.144 -> 172.31.24.227 TCP 66 6633 → 50460 [ACK] Seq=1 Ack=124 Win=853 Len=0 TSval=1257655 TSecr=394322927
156 0.301891203 172.31.31.144 -> 172.31.24.227 TCP 66 6633 → 50460 [ACK] Seq=1 Ack=247 Win=853 Len=0 TSval=1257655 TSecr=394322927
157 0.301894266 172.31.31.144 -> 172.31.24.227 TCP 66 6633 → 50450 [ACK] Seq=1211 Ack=739 Win=853 Len=0 TSval=1257655 TSecr=394322927
158 0.301896852 172.31.31.144 -> 172.31.24.227 TCP 66 6633 → 50454 [ACK] Seq=969 Ack=370 Win=853 Len=0 TSval=1257655 TSecr=394322927
159 0.301899413 172.31.31.144 -> 172.31.24.227 TCP 66 6633 → 50454 [ACK] Seq=969 Ack=493 Win=853 Len=0 TSval=1257655 TSecr=394322927
160 0.302143088 172.31.24.227 -> 172.31.31.144 OpenFlow 189 Type: OFPT_PACKET_IN
161 0.302176144 172.31.24.227 -> 172.31.31.144 OpenFlow 189 Type: OFPT_PACKET_IN
162 0.302194442 172.31.24.227 -> 172.31.31.144 OpenFlow 189 Type: OFPT_PACKET_IN
163 0.302211604 172.31.24.227 -> 172.31.31.144 OpenFlow 189 Type: OFPT_PACKET_IN
164 0.302269580 172.31.24.227 -> 172.31.31.144 OpenFlow 189 Type: OFPT_PACKET_IN
165 0.302275835 172.31.24.227 -> 172.31.31.144 OpenFlow 189 Type: OFPT_PACKET_IN
166 0.302400708 172.31.24.227 -> 172.31.31.144 OpenFlow 189 Type: OFPT_PACKET_IN
167 0.302424481 172.31.24.227 -> 172.31.31.144 OpenFlow 189 Type: OFPT_PACKET_IN
168 0.302474631 172.31.31.144 -> 172.31.24.227 TCP 66 6633 → 50462 [ACK] Seq=1 Ack=124 Win=853 Len=0 TSval=1257655 TSecr=394322927
169 0.302480955 172.31.31.144 -> 172.31.24.227 TCP 66 6633 → 50448 [ACK] Seq=969 Ack=616 Win=853 Len=0 TSval=1257655 TSecr=394322927
170 0.302483782 172.31.31.144 -> 172.31.24.227 TCP 66 6633 → 50462 [ACK] Seq=1 Ack=247 Win=853 Len=0 TSval=1257655 TSecr=394322927
171 0.302504220 172.31.24.227 -> 172.31.31.144 OpenFlow 189 Type: OFPT_PACKET_IN
172 0.302510682 172.31.24.227 -> 172.31.31.144 OpenFlow 189 Type: OFPT_PACKET_IN
173 0.302649041 172.31.31.144 -> 172.31.24.227 TCP 66 6633 → 50456 [ACK] Seq=1 Ack=370 Win=853 Len=0 TSval=1257656 TSecr=394322928
174 0.302696441 172.31.31.144 -> 172.31.24.227 TCP 66 6633 → 50456 [ACK] Seq=1 Ack=493 Win=853 Len=0 TSval=1257656 TSecr=394322928
175 0.302863728 172.31.31.144 -> 172.31.24.227 TCP 66 6633 → 50446 [ACK] Seq=1211 Ack=1231 Win=853 Len=0 TSval=1257656 TSecr=394322927
176 0.303054686 172.31.31.144 -> 172.31.24.227 TCP 66 6633 → 50448 [ACK] Seq=969 Ack=739 Win=853 Len=0 TSval=1257656 TSecr=394322927
177 0.303414511 172.31.31.144 -> 172.31.24.227 TCP 66 6633 → 50452 [ACK] Seq=969 Ack=739 Win=853 Len=0 TSval=1257656 TSecr=394322928
178 0.400129568 172.31.31.144 -> 172.31.24.227 OpenFlow 187 Type: OFPT_PACKET_OUT
179 0.400205939 172.31.31.144 -> 172.31.24.227 OpenFlow 187 Type: OFPT_PACKET_OUT
180 0.400337548 172.31.31.144 -> 172.31.24.227 OpenFlow 187 Type: OFPT_PACKET_OUT
181 0.400385304 172.31.31.144 -> 172.31.24.227 OpenFlow 187 Type: OFPT_PACKET_OUT
182 0.400465232 172.31.31.144 -> 172.31.24.227 OpenFlow 187 Type: OFPT_PACKET_OUT
183 0.400500751 172.31.31.144 -> 172.31.24.227 OpenFlow 187 Type: OFPT_PACKET_OUT
184 0.400571334 172.31.31.144 -> 172.31.24.227 OpenFlow 187 Type: OFPT_PACKET_OUT
185 0.400631479 172.31.31.144 -> 172.31.24.227 OpenFlow 187 Type: OFPT_PACKET_OUT
186 0.400693987 172.31.31.144 -> 172.31.24.227 OpenFlow 187 Type: OFPT_PACKET_OUT
187 0.400711120 172.31.31.144 -> 172.31.24.227 OpenFlow 187 Type: OFPT_PACKET_OUT
188 0.400785314 172.31.31.144 -> 172.31.24.227 OpenFlow 187 Type: OFPT_PACKET_OUT
189 0.400831043 172.31.31.144 -> 172.31.24.227 OpenFlow 187 Type: OFPT_PACKET_OUT
190 0.400899848 172.31.24.227 -> 172.31.31.144 TCP 66 50456 → 6633 [ACK] Seq=493 Ack=727 Win=213 Len=0 TSval=394322952 TSecr=1257680
191 0.401038881 172.31.24.227 -> 172.31.31.144 OpenFlow 189 Type: OFPT_PACKET_IN
192 0.401060389 172.31.24.227 -> 172.31.31.144 OpenFlow 189 Type: OFPT_PACKET_IN
193 0.401114233 172.31.24.227 -> 172.31.31.144 OpenFlow 189 Type: OFPT_PACKET_IN
194 0.401132280 172.31.24.227 -> 172.31.31.144 OpenFlow 189 Type: OFPT_PACKET_IN
195 0.401181565 172.31.24.227 -> 172.31.31.144 OpenFlow 189 Type: OFPT_PACKET_IN
196 0.401230892 172.31.31.144 -> 172.31.24.227 TCP 66 6633 → 50454 [ACK] Seq=969 Ack=616 Win=853 Len=0 TSval=1257680 TSecr=394322952
197 0.401242182 172.31.24.227 -> 172.31.31.144 OpenFlow 189 Type: OFPT_PACKET_IN
198 0.401328713 172.31.31.144 -> 172.31.24.227 TCP 66 6633 → 50448 [ACK] Seq=969 Ack=862 Win=853 Len=0 TSval=1257680 TSecr=394322952
199 0.401336244 172.31.31.144 -> 172.31.24.227 TCP 66 6633 → 50448 [ACK] Seq=969 Ack=985 Win=853 Len=0 TSval=1257680 TSecr=394322952
200 0.401425652 172.31.31.144 -> 172.31.24.227 TCP 66 6633 → 50464 [ACK] Seq=1 Ack=124 Win=853 Len=0 TSval=1257680 TSecr=394322952
201 0.401432172 172.31.31.144 -> 172.31.24.227 TCP 66 6633 → 50454 [ACK] Seq=969 Ack=739 Win=853 Len=0 TSval=1257680 TSecr=394322952
202 0.401435181 172.31.31.144 -> 172.31.24.227 TCP 66 6633 → 50464 [ACK] Seq=1 Ack=247 Win=853 Len=0 TSval=1257680 TSecr=394322952
203 0.401517941 172.31.24.227 -> 172.31.31.144 TCP 66 50458 → 6633 [ACK] Seq=247 Ack=727 Win=213 Len=0 TSval=394322952 TSecr=1257680
204 0.401677932 172.31.24.227 -> 172.31.31.144 OpenFlow 189 Type: OFPT_PACKET_IN
205 0.401698249 172.31.24.227 -> 172.31.31.144 OpenFlow 189 Type: OFPT_PACKET_IN
206 0.401733297 172.31.24.227 -> 172.31.31.144 OpenFlow 189 Type: OFPT_PACKET_IN
207 0.401755290 172.31.24.227 -> 172.31.31.144 OpenFlow 189 Type: OFPT_PACKET_IN
208 0.401775015 172.31.24.227 -> 172.31.31.144 OpenFlow 189 Type: OFPT_PACKET_IN
209 0.401811161 172.31.24.227 -> 172.31.31.144 OpenFlow 189 Type: OFPT_PACKET_IN
210 0.401872967 172.31.31.144 -> 172.31.24.227 TCP 66 6633 → 50468 [ACK] Seq=1 Ack=124 Win=853 Len=0 TSval=1257680 TSecr=394322952
211 0.401881509 172.31.31.144 -> 172.31.24.227 TCP 66 6633 → 50468 [ACK] Seq=1 Ack=247 Win=853 Len=0 TSval=1257680 TSecr=394322952
212 0.401977382 172.31.31.144 -> 172.31.24.227 TCP 66 6633 → 50450 [ACK] Seq=1211 Ack=862 Win=853 Len=0 TSval=1257680 TSecr=394322952
213 0.401984128 172.31.31.144 -> 172.31.24.227 TCP 66 6633 → 50450 [ACK] Seq=1211 Ack=985 Win=853 Len=0 TSval=1257680 TSecr=394322952
214 0.401986894 172.31.31.144 -> 172.31.24.227 TCP 66 6633 → 50460 [ACK] Seq=1 Ack=370 Win=853 Len=0 TSval=1257680 TSecr=394322952
215 0.402043615 172.31.31.144 -> 172.31.24.227 TCP 66 6633 → 50460 [ACK] Seq=1 Ack=493 Win=853 Len=0 TSval=1257680 TSecr=394322952
216 0.500200953 172.31.31.144 -> 172.31.24.227 OpenFlow 187 Type: OFPT_PACKET_OUT
217 0.500254012 172.31.31.144 -> 172.31.24.227 OpenFlow 187 Type: OFPT_PACKET_OUT
218 0.500359090 172.31.31.144 -> 172.31.24.227 OpenFlow 187 Type: OFPT_PACKET_OUT
219 0.500365022 172.31.31.144 -> 172.31.24.227 OpenFlow 187 Type: OFPT_PACKET_OUT
220 0.500437179 172.31.31.144 -> 172.31.24.227 OpenFlow 187 Type: OFPT_PACKET_OUT
221 0.500442076 172.31.31.144 -> 172.31.24.227 OpenFlow 187 Type: OFPT_PACKET_OUT
222 0.500606847 172.31.31.144 -> 172.31.24.227 OpenFlow 187 Type: OFPT_PACKET_OUT
223 0.500613942 172.31.31.144 -> 172.31.24.227 OpenFlow 187 Type: OFPT_PACKET_OUT
224 0.500616447 172.31.31.144 -> 172.31.24.227 OpenFlow 187 Type: OFPT_PACKET_OUT
225 0.500734210 172.31.31.144 -> 172.31.24.227 OpenFlow 187 Type: OFPT_PACKET_OUT
226 0.500740497 172.31.31.144 -> 172.31.24.227 OpenFlow 187 Type: OFPT_PACKET_OUT
227 0.500777883 172.31.31.144 -> 172.31.24.227 OpenFlow 187 Type: OFPT_PACKET_OUT
228 0.500903851 172.31.31.144 -> 172.31.24.227 OpenFlow 187 Type: OFPT_PACKET_OUT
229 0.500910547 172.31.31.144 -> 172.31.24.227 OpenFlow 187 Type: OFPT_PACKET_OUT
230 0.500941190 172.31.31.144 -> 172.31.24.227 OpenFlow 187 Type: OFPT_PACKET_OUT
231 0.501004024 172.31.31.144 -> 172.31.24.227 OpenFlow 187 Type: OFPT_PACKET_OUT
232 0.501055605 172.31.31.144 -> 172.31.24.227 OpenFlow 187 Type: OFPT_PACKET_OUT
233 0.501074627 172.31.24.227 -> 172.31.31.144 TCP 66 50460 → 6633 [ACK] Seq=493 Ack=1211 Win=213 Len=0 TSval=394322977 TSecr=1257705
234 0.501115580 172.31.31.144 -> 172.31.24.227 OpenFlow 187 Type: OFPT_PACKET_OUT
235 0.501188063 172.31.31.144 -> 172.31.24.227 OpenFlow 187 Type: OFPT_PACKET_OUT
236 0.501194708 172.31.31.144 -> 172.31.24.227 OpenFlow 187 Type: OFPT_PACKET_OUT
237 0.501226805 172.31.24.227 -> 172.31.31.144 OpenFlow 189 Type: OFPT_PACKET_IN
238 0.501248291 172.31.24.227 -> 172.31.31.144 OpenFlow 189 Type: OFPT_PACKET_IN
239 0.501749739 172.31.31.144 -> 172.31.24.227 TCP 66 6633 → 50462 [ACK] Seq=1211 Ack=370 Win=853 Len=0 TSval=1257705 TSecr=394322977
240 0.501758895 172.31.31.144 -> 172.31.24.227 TCP 66 6633 → 50462 [ACK] Seq=1211 Ack=493 Win=853 Len=0 TSval=1257705 TSecr=394322977
241 0.501814359 172.31.24.227 -> 172.31.31.144 OpenFlow 189 Type: OFPT_PACKET_IN
242 0.501840989 172.31.24.227 -> 172.31.31.144 OpenFlow 189 Type: OFPT_PACKET_IN
243 0.501869410 172.31.24.227 -> 172.31.31.144 OpenFlow 189 Type: OFPT_PACKET_IN
244 0.501877074 172.31.24.227 -> 172.31.31.144 OpenFlow 189 Type: OFPT_PACKET_IN
245 0.501897331 172.31.24.227 -> 172.31.31.144 OpenFlow 189 Type: OFPT_PACKET_IN
246 0.501901572 172.31.24.227 -> 172.31.31.144 OpenFlow 435 Type: OFPT_PACKET_IN
247 0.501920873 172.31.24.227 -> 172.31.31.144 OpenFlow 189 Type: OFPT_PACKET_IN
248 0.502001114 172.31.24.227 -> 172.31.31.144 OpenFlow 189 Type: OFPT_PACKET_IN
249 0.502008226 172.31.24.227 -> 172.31.31.144 OpenFlow 189 Type: OFPT_PACKET_IN
250 0.502080966 172.31.24.227 -> 172.31.31.144 OpenFlow 189 Type: OFPT_PACKET_IN
251 0.502085563 172.31.24.227 -> 172.31.31.144 OpenFlow 189 Type: OFPT_PACKET_IN
252 0.502124781 172.31.24.227 -> 172.31.31.144 OpenFlow 189 Type: OFPT_PACKET_IN
253 0.502142728 172.31.24.227 -> 172.31.31.144 OpenFlow 189 Type: OFPT_PACKET_IN
254 0.502330863 172.31.31.144 -> 172.31.24.227 TCP 66 6633 → 50474 [ACK] Seq=1 Ack=124 Win=853 Len=0 TSval=1257705 TSecr=394322977
255 0.502339401 172.31.31.144 -> 172.31.24.227 TCP 66 6633 → 50472 [ACK] Seq=1 Ack=124 Win=853 Len=0 TSval=1257705 TSecr=394322977
256 0.502342313 172.31.31.144 -> 172.31.24.227 TCP 66 6633 → 50470 [ACK] Seq=1 Ack=124 Win=853 Len=0 TSval=1257705 TSecr=394322977
257 0.502344996 172.31.31.144 -> 172.31.24.227 TCP 66 6633 → 50474 [ACK] Seq=1 Ack=247 Win=853 Len=0 TSval=1257705 TSecr=394322977
258 0.502347522 172.31.31.144 -> 172.31.24.227 TCP 66 6633 → 50464 [ACK] Seq=1 Ack=370 Win=853 Len=0 TSval=1257705 TSecr=394322977
259 0.502349922 172.31.31.144 -> 172.31.24.227 TCP 66 6633 → 50472 [ACK] Seq=1 Ack=493 Win=853 Len=0 TSval=1257705 TSecr=394322977
260 0.502352237 172.31.31.144 -> 172.31.24.227 TCP 66 6633 → 50458 [ACK] Seq=727 Ack=370 Win=853 Len=0 TSval=1257705 TSecr=394322977
261 0.502481293 172.31.24.227 -> 172.31.31.144 OpenFlow 189 Type: OFPT_PACKET_IN
262 0.502687763 172.31.24.227 -> 172.31.31.144 OpenFlow 189 Type: OFPT_PACKET_IN
263 0.502690660 172.31.24.227 -> 172.31.31.144 OpenFlow 189 Type: OFPT_PACKET_IN
264 0.502812623 172.31.31.144 -> 172.31.24.227 TCP 66 6633 → 50470 [ACK] Seq=1 Ack=247 Win=853 Len=0 TSval=1257705 TSecr=394322977
265 0.502816886 172.31.31.144 -> 172.31.24.227 TCP 66 6633 → 50464 [ACK] Seq=1 Ack=493 Win=853 Len=0 TSval=1257705 TSecr=394322977
266 0.502820331 172.31.31.144 -> 172.31.24.227 TCP 66 6633 → 50458 [ACK] Seq=727 Ack=493 Win=853 Len=0 TSval=1257706 TSecr=394322977
267 0.502822870 172.31.31.144 -> 172.31.24.227 TCP 66 6633 → 50452 [ACK] Seq=969 Ack=862 Win=853 Len=0 TSval=1257706 TSecr=394322977
268 0.502941478 172.31.31.144 -> 172.31.24.227 TCP 66 6633 → 50460 [ACK] Seq=1211 Ack=616 Win=853 Len=0 TSval=1257706 TSecr=394322977
269 0.502945391 172.31.31.144 -> 172.31.24.227 TCP 66 6633 → 50454 [ACK] Seq=969 Ack=862 Win=853 Len=0 TSval=1257706 TSecr=394322977
270 0.503050222 172.31.31.144 -> 172.31.24.227 TCP 66 6633 → 50452 [ACK] Seq=969 Ack=985 Win=853 Len=0 TSval=1257706 TSecr=394322978
271 0.503153749 172.31.31.144 -> 172.31.24.227 TCP 66 6633 → 50454 [ACK] Seq=969 Ack=985 Win=853 Len=0 TSval=1257706 TSecr=394322978
272 0.503157183 172.31.31.144 -> 172.31.24.227 TCP 66 6633 → 50460 [ACK] Seq=1211 Ack=739 Win=853 Len=0 TSval=1257706 TSecr=394322978
273 0.600576811 172.31.31.144 -> 172.31.24.227 OpenFlow 187 Type: OFPT_PACKET_OUT
274 0.600680340 172.31.31.144 -> 172.31.24.227 OpenFlow 187 Type: OFPT_PACKET_OUT
275 0.600688559 172.31.31.144 -> 172.31.24.227 OpenFlow 187 Type: OFPT_PACKET_OUT
276 0.600790463 172.31.31.144 -> 172.31.24.227 OpenFlow 187 Type: OFPT_PACKET_OUT
277 0.600795582 172.31.31.144 -> 172.31.24.227 OpenFlow 187 Type: OFPT_PACKET_OUT
278 0.600866082 172.31.31.144 -> 172.31.24.227 OpenFlow 187 Type: OFPT_PACKET_OUT
279 0.601214562 172.31.24.227 -> 172.31.31.144 TCP 66 50464 → 6633 [ACK] Seq=493 Ack=727 Win=213 Len=0 TSval=394323002 TSecr=1257730
280 0.601402200 172.31.24.227 -> 172.31.31.144 OpenFlow 189 Type: OFPT_PACKET_IN
281 0.601423724 172.31.24.227 -> 172.31.31.144 OpenFlow 189 Type: OFPT_PACKET_IN
282 0.601510250 172.31.24.227 -> 172.31.31.144 OpenFlow 189 Type: OFPT_PACKET_IN
283 0.601527945 172.31.24.227 -> 172.31.31.144 OpenFlow 189 Type: OFPT_PACKET_IN
284 0.601549484 172.31.24.227 -> 172.31.31.144 OpenFlow 189 Type: OFPT_PACKET_IN
285 0.601624615 172.31.31.144 -> 172.31.24.227 TCP 66 6633 → 50456 [ACK] Seq=727 Ack=616 Win=853 Len=0 TSval=1257730 TSecr=394323002
286 0.601633474 172.31.31.144 -> 172.31.24.227 TCP 66 6633 → 50456 [ACK] Seq=727 Ack=739 Win=853 Len=0 TSval=1257730 TSecr=394323002
287 0.601639727 172.31.24.227 -> 172.31.31.144 OpenFlow 189 Type: OFPT_PACKET_IN
288 0.601766076 172.31.31.144 -> 172.31.24.227 TCP 66 6633 → 50462 [ACK] Seq=1211 Ack=739 Win=853 Len=0 TSval=1257730 TSecr=394323002
289 0.601838060 172.31.31.144 -> 172.31.24.227 TCP 66 6633 → 50476 [ACK] Seq=1 Ack=124 Win=853 Len=0 TSval=1257730 TSecr=394323002
290 0.601849873 172.31.31.144 -> 172.31.24.227 TCP 66 6633 → 50476 [ACK] Seq=1 Ack=247 Win=853 Len=0 TSval=1257730 TSecr=394323002
291 0.700329572 172.31.31.144 -> 172.31.24.227 OpenFlow 187 Type: OFPT_PACKET_OUT
292 0.700352178 172.31.31.144 -> 172.31.24.227 OpenFlow 187 Type: OFPT_PACKET_OUT
293 0.700356108 172.31.31.144 -> 172.31.24.227 OpenFlow 187 Type: OFPT_PACKET_OUT
294 0.700358872 172.31.31.144 -> 172.31.24.227 OpenFlow 187 Type: OFPT_PACKET_OUT
295 0.700375319 172.31.31.144 -> 172.31.24.227 OpenFlow 187 Type: OFPT_PACKET_OUT
296 0.700378562 172.31.31.144 -> 172.31.24.227 OpenFlow 187 Type: OFPT_PACKET_OUT
297 0.700566097 172.31.31.144 -> 172.31.24.227 OpenFlow 187 Type: OFPT_PACKET_OUT
298 0.700621210 172.31.31.144 -> 172.31.24.227 OpenFlow 187 Type: OFPT_PACKET_OUT
299 0.700671424 172.31.31.144 -> 172.31.24.227 OpenFlow 187 Type: OFPT_PACKET_OUT
300 0.700710342 172.31.31.144 -> 172.31.24.227 OpenFlow 187 Type: OFPT_PACKET_OUT
301 0.700757149 172.31.31.144 -> 172.31.24.227 OpenFlow 187 Type: OFPT_PACKET_OUT
302 0.700815247 172.31.31.144 -> 172.31.24.227 OpenFlow 187 Type: OFPT_PACKET_OUT
303 0.700843603 172.31.24.227 -> 172.31.31.144 TCP 66 50466 → 6633 [ACK] Seq=247 Ack=727 Win=213 Len=0 TSval=394323027 TSecr=1257755
304 0.700866494 172.31.31.144 -> 172.31.24.227 OpenFlow 187 Type: OFPT_PACKET_OUT
305 0.700942748 172.31.31.144 -> 172.31.24.227 OpenFlow 187 Type: OFPT_PACKET_OUT
306 0.701085410 172.31.24.227 -> 172.31.31.144 OpenFlow 189 Type: OFPT_PACKET_IN
307 0.701104318 172.31.24.227 -> 172.31.31.144 OpenFlow 189 Type: OFPT_PACKET_IN
308 0.701368377 172.31.31.144 -> 172.31.24.227 TCP 66 6633 → 50468 [ACK] Seq=969 Ack=370 Win=853 Len=0 TSval=1257755 TSecr=394323027
309 0.701376427 172.31.31.144 -> 172.31.24.227 TCP 66 6633 → 50468 [ACK] Seq=969 Ack=493 Win=853 Len=0 TSval=1257755 TSecr=394323027
310 0.701493989 172.31.24.227 -> 172.31.31.144 OpenFlow 189 Type: OFPT_PACKET_IN
311 0.701513452 172.31.24.227 -> 172.31.31.144 OpenFlow 189 Type: OFPT_PACKET_IN
312 0.701552172 172.31.24.227 -> 172.31.31.144 OpenFlow 189 Type: OFPT_PACKET_IN
313 0.701572906 172.31.24.227 -> 172.31.31.144 OpenFlow 189 Type: OFPT_PACKET_IN
314 0.701630367 172.31.24.227 -> 172.31.31.144 OpenFlow 189 Type: OFPT_PACKET_IN
315 0.701659745 172.31.24.227 -> 172.31.31.144 OpenFlow 189 Type: OFPT_PACKET_IN
316 0.701681701 172.31.24.227 -> 172.31.31.144 OpenFlow 189 Type: OFPT_PACKET_IN
317 0.701765715 172.31.31.144 -> 172.31.24.227 TCP 66 6633 → 50450 [ACK] Seq=1211 Ack=1108 Win=853 Len=0 TSval=1257755 TSecr=394323027
318 0.701772619 172.31.31.144 -> 172.31.24.227 TCP 66 6633 → 50450 [ACK] Seq=1211 Ack=1231 Win=853 Len=0 TSval=1257755 TSecr=394323027
319 0.701775257 172.31.31.144 -> 172.31.24.227 TCP 66 6633 → 50466 [ACK] Seq=727 Ack=370 Win=853 Len=0 TSval=1257755 TSecr=394323027
320 0.701777710 172.31.31.144 -> 172.31.24.227 TCP 66 6633 → 50466 [ACK] Seq=727 Ack=493 Win=853 Len=0 TSval=1257755 TSecr=394323027
321 0.701794568 172.31.24.227 -> 172.31.31.144 OpenFlow 189 Type: OFPT_PACKET_IN
322 0.701834370 172.31.31.144 -> 172.31.24.227 TCP 66 6633 → 50470 [ACK] Seq=1 Ack=370 Win=853 Len=0 TSval=1257755 TSecr=394323027
323 0.701967326 172.31.31.144 -> 172.31.24.227 TCP 66 6633 → 50470 [ACK] Seq=1 Ack=493 Win=853 Len=0 TSval=1257755 TSecr=394323027
324 0.701970949 172.31.31.144 -> 172.31.24.227 TCP 66 6633 → 50458 [ACK] Seq=727 Ack=616 Win=853 Len=0 TSval=1257755 TSecr=394323027
325 0.701991621 172.31.31.144 -> 172.31.24.227 TCP 66 6633 → 50458 [ACK] Seq=727 Ack=739 Win=853 Len=0 TSval=1257755 TSecr=394323027
326 0.718984256 172.31.24.227 -> 172.31.31.144 OpenFlow 146 Type: OFPT_PORT_STATUS
327 0.719037771 172.31.24.227 -> 172.31.31.144 OpenFlow 146 Type: OFPT_PORT_STATUS
328 0.719185325 172.31.31.144 -> 172.31.24.227 TCP 66 6633 → 50476 [ACK] Seq=1 Ack=327 Win=853 Len=0 TSval=1257760 TSecr=394323032
329 0.719223827 172.31.31.144 -> 172.31.24.227 TCP 66 6633 → 50474 [ACK] Seq=1 Ack=327 Win=853 Len=0 TSval=1257760 TSecr=394323032
330 0.742665397 172.31.31.144 -> 172.31.24.227 OpenFlow 146 Type: OFPT_FLOW_MOD
331 0.742677198 172.31.31.144 -> 172.31.24.227 OpenFlow 154 Type: OFPT_BARRIER_REQUEST
332 0.742681804 172.31.31.144 -> 172.31.24.227 OpenFlow 146 Type: OFPT_FLOW_MOD
333 0.742685654 172.31.31.144 -> 172.31.24.227 OpenFlow 154 Type: OFPT_BARRIER_REQUEST
334 0.742688194 172.31.31.144 -> 172.31.24.227 OpenFlow 146 Type: OFPT_FLOW_MOD
335 0.742691011 172.31.31.144 -> 172.31.24.227 OpenFlow 154 Type: OFPT_BARRIER_REQUEST
336 0.742693198 172.31.31.144 -> 172.31.24.227 OpenFlow 146 Type: OFPT_FLOW_MOD
337 0.742695618 172.31.31.144 -> 172.31.24.227 OpenFlow 146 Type: OFPT_FLOW_MOD
338 0.742698000 172.31.31.144 -> 172.31.24.227 OpenFlow 146 Type: OFPT_FLOW_MOD
339 0.742704239 172.31.31.144 -> 172.31.24.227 OpenFlow 154 Type: OFPT_BARRIER_REQUEST
340 0.742706240 172.31.31.144 -> 172.31.24.227 OpenFlow 74 Type: OFPT_BARRIER_REQUEST
341 0.742769969 172.31.31.144 -> 172.31.24.227 OpenFlow 146 Type: OFPT_FLOW_MOD
342 0.742790335 172.31.31.144 -> 172.31.24.227 OpenFlow 146 Type: OFPT_FLOW_MOD
343 0.742795733 172.31.31.144 -> 172.31.24.227 OpenFlow 74 Type: OFPT_BARRIER_REQUEST
344 0.742896886 172.31.31.144 -> 172.31.24.227 OpenFlow 146 Type: OFPT_FLOW_MOD
345 0.742902806 172.31.31.144 -> 172.31.24.227 OpenFlow 146 Type: OFPT_FLOW_MOD
346 0.742905089 172.31.31.144 -> 172.31.24.227 OpenFlow 74 Type: OFPT_BARRIER_REQUEST
347 0.742920716 172.31.24.227 -> 172.31.31.144 TCP 66 50454 → 6633 [ACK] Seq=985 Ack=1137 Win=213 Len=0 TSval=394323038 TSecr=1257765
348 0.742934122 172.31.24.227 -> 172.31.31.144 OpenFlow 74 Type: OFPT_BARRIER_REPLY
349 0.742985841 172.31.24.227 -> 172.31.31.144 TCP 66 50462 → 6633 [ACK] Seq=739 Ack=1379 Win=213 Len=0 TSval=394323038 TSecr=1257765
350 0.742992187 172.31.24.227 -> 172.31.31.144 OpenFlow 74 Type: OFPT_BARRIER_REPLY
351 0.743002078 172.31.31.144 -> 172.31.24.227 OpenFlow 146 Type: OFPT_FLOW_MOD
352 0.743006763 172.31.31.144 -> 172.31.24.227 OpenFlow 146 Type: OFPT_FLOW_MOD
353 0.743009390 172.31.31.144 -> 172.31.24.227 OpenFlow 74 Type: OFPT_BARRIER_REQUEST
354 0.743035586 172.31.24.227 -> 172.31.31.144 TCP 66 50448 → 6633 [ACK] Seq=985 Ack=1137 Win=213 Len=0 TSval=394323038 TSecr=1257765
355 0.743047033 172.31.24.227 -> 172.31.31.144 OpenFlow 74 Type: OFPT_BARRIER_REPLY
356 0.743088724 172.31.24.227 -> 172.31.31.144 OpenFlow 74 Type: OFPT_BARRIER_REPLY
357 0.743155376 172.31.24.227 -> 172.31.31.144 TCP 66 50470 → 6633 [ACK] Seq=493 Ack=169 Win=213 Len=0 TSval=394323038 TSecr=1257766
358 0.743161656 172.31.24.227 -> 172.31.31.144 OpenFlow 74 Type: OFPT_BARRIER_REPLY
359 0.743207261 172.31.31.144 -> 172.31.24.227 OpenFlow 146 Type: OFPT_FLOW_MOD
360 0.743212280 172.31.31.144 -> 172.31.24.227 OpenFlow 146 Type: OFPT_FLOW_MOD
361 0.743214606 172.31.31.144 -> 172.31.24.227 OpenFlow 74 Type: OFPT_BARRIER_REQUEST
362 0.743318231 172.31.24.227 -> 172.31.31.144 OpenFlow 82 Type: OFPT_BARRIER_REPLY
363 0.743340761 172.31.24.227 -> 172.31.31.144 OpenFlow 146 Type: OFPT_FLOW_REMOVED
364 0.743352682 172.31.24.227 -> 172.31.31.144 OpenFlow 146 Type: OFPT_FLOW_REMOVED
365 0.743370217 172.31.24.227 -> 172.31.31.144 OpenFlow 146 Type: OFPT_FLOW_REMOVED
366 0.743701783 172.31.31.144 -> 172.31.24.227 TCP 66 6633 → 50454 [ACK] Seq=1137 Ack=993 Win=853 Len=0 TSval=1257766 TSecr=394323038
367 0.743711112 172.31.24.227 -> 172.31.31.144 OpenFlow 146 Type: OFPT_FLOW_REMOVED
368 0.743717534 172.31.31.144 -> 172.31.24.227 OpenFlow 146 Type: OFPT_FLOW_MOD
369 0.743722504 172.31.31.144 -> 172.31.24.227 OpenFlow 146 Type: OFPT_FLOW_MOD
370 0.743724973 172.31.31.144 -> 172.31.24.227 OpenFlow 74 Type: OFPT_BARRIER_REQUEST
371 0.743726944 172.31.31.144 -> 172.31.24.227 TCP 66 6633 → 50462 [ACK] Seq=1547 Ack=747 Win=853 Len=0 TSval=1257766 TSecr=394323038
372 0.743730566 172.31.24.227 -> 172.31.31.144 OpenFlow 146 Type: OFPT_FLOW_REMOVED
373 0.743732754 172.31.31.144 -> 172.31.24.227 OpenFlow 146 Type: OFPT_FLOW_MOD
374 0.743735892 172.31.31.144 -> 172.31.24.227 OpenFlow 154 Type: OFPT_BARRIER_REQUEST
375 0.743737993 172.31.31.144 -> 172.31.24.227 TCP 66 6633 → 50448 [ACK] Seq=1137 Ack=993 Win=853 Len=0 TSval=1257766 TSecr=394323038
376 0.743741273 172.31.24.227 -> 172.31.31.144 OpenFlow 146 Type: OFPT_FLOW_REMOVED
377 0.743743159 172.31.31.144 -> 172.31.24.227 OpenFlow 146 Type: OFPT_FLOW_MOD
378 0.743745335 172.31.31.144 -> 172.31.24.227 OpenFlow 146 Type: OFPT_FLOW_MOD
379 0.743748169 172.31.31.144 -> 172.31.24.227 OpenFlow 154 Type: OFPT_BARRIER_REQUEST
380 0.743750352 172.31.31.144 -> 172.31.24.227 OpenFlow 154 Type: OFPT_BARRIER_REQUEST
381 0.743752217 172.31.31.144 -> 172.31.24.227 OpenFlow 146 Type: OFPT_FLOW_MOD
382 0.743754899 172.31.31.144 -> 172.31.24.227 OpenFlow 146 Type: OFPT_FLOW_MOD
383 0.743757830 172.31.31.144 -> 172.31.24.227 OpenFlow 154 Type: OFPT_BARRIER_REQUEST
384 0.743759912 172.31.31.144 -> 172.31.24.227 OpenFlow 146 Type: OFPT_FLOW_MOD
385 0.743762477 172.31.31.144 -> 172.31.24.227 OpenFlow 322 Type: OFPT_BARRIER_REQUEST
386 0.743764939 172.31.31.144 -> 172.31.24.227 OpenFlow 154 Type: OFPT_BARRIER_REQUEST
387 0.743766949 172.31.31.144 -> 172.31.24.227 TCP 66 6633 → 50470 [ACK] Seq=169 Ack=501 Win=853 Len=0 TSval=1257766 TSecr=394323038
388 0.743770541 172.31.24.227 -> 172.31.31.144 OpenFlow 226 Type: OFPT_FLOW_REMOVED
389 0.743773046 172.31.31.144 -> 172.31.24.227 OpenFlow 146 Type: OFPT_FLOW_MOD
390 0.743775366 172.31.31.144 -> 172.31.24.227 OpenFlow 154 Type: OFPT_BARRIER_REQUEST
391 0.743785855 172.31.24.227 -> 172.31.31.144 OpenFlow 546 Type: OFPT_FLOW_REMOVED
392 0.743917979 172.31.31.144 -> 172.31.24.227 OpenFlow 146 Type: OFPT_FLOW_MOD
393 0.743923625 172.31.31.144 -> 172.31.24.227 OpenFlow 490 Type: OFPT_BARRIER_REQUEST
394 0.743926711 172.31.31.144 -> 172.31.24.227 OpenFlow 234 Type: OFPT_BARRIER_REQUEST
395 0.743929046 172.31.31.144 -> 172.31.24.227 TCP 66 6633 → 50474 [ACK] Seq=673 Ack=351 Win=853 Len=0 TSval=1257766 TSecr=394323038
396 0.743932219 172.31.31.144 -> 172.31.24.227 TCP 66 6633 → 50454 [ACK] Seq=1137 Ack=1073 Win=853 Len=0 TSval=1257766 TSecr=394323038
397 0.744136204 172.31.31.144 -> 172.31.24.227 TCP 66 6633 → 50448 [ACK] Seq=1137 Ack=1073 Win=853 Len=0 TSval=1257766 TSecr=394323038
398 0.744142392 172.31.31.144 -> 172.31.24.227 TCP 66 6633 → 50454 [ACK] Seq=1137 Ack=1153 Win=853 Len=0 TSval=1257766 TSecr=394323038
399 0.744145067 172.31.31.144 -> 172.31.24.227 TCP 66 6633 → 50462 [ACK] Seq=1715 Ack=907 Win=853 Len=0 TSval=1257766 TSecr=394323038
400 0.744147677 172.31.31.144 -> 172.31.24.227 TCP 66 6633 → 50448 [ACK] Seq=1137 Ack=1153 Win=853 Len=0 TSval=1257766 TSecr=394323038
401 0.744202564 172.31.31.144 -> 172.31.24.227 TCP 66 6633 → 50470 [ACK] Seq=169 Ack=661 Win=853 Len=0 TSval=1257766 TSecr=394323038
402 0.745578435 172.31.24.227 -> 172.31.31.144 TCP 66 50452 → 6633 [ACK] Seq=985 Ack=1137 Win=213 Len=0 TSval=394323038 TSecr=1257766
403 0.745592823 172.31.24.227 -> 172.31.31.144 OpenFlow 74 Type: OFPT_BARRIER_REPLY
404 0.745620631 172.31.24.227 -> 172.31.31.144 TCP 66 50436 → 6633 [ACK] Seq=247 Ack=169 Win=213 Len=0 TSval=394323038 TSecr=1257766
405 0.745636604 172.31.24.227 -> 172.31.31.144 OpenFlow 74 Type: OFPT_BARRIER_REPLY
406 0.745663045 172.31.24.227 -> 172.31.31.144 TCP 66 50450 → 6633 [ACK] Seq=1231 Ack=1379 Win=213 Len=0 TSval=394323038 TSecr=1257766
407 0.745673728 172.31.24.227 -> 172.31.31.144 OpenFlow 74 Type: OFPT_BARRIER_REPLY
408 0.745698752 172.31.24.227 -> 172.31.31.144 TCP 66 50440 → 6633 [ACK] Seq=739 Ack=1379 Win=213 Len=0 TSval=394323038 TSecr=1257766
409 0.745705151 172.31.24.227 -> 172.31.31.144 OpenFlow 74 Type: OFPT_BARRIER_REPLY
410 0.745736165 172.31.24.227 -> 172.31.31.144 OpenFlow 74 Type: OFPT_BARRIER_REPLY
411 0.745793580 172.31.24.227 -> 172.31.31.144 TCP 66 50444 → 6633 [ACK] Seq=493 Ack=895 Win=213 Len=0 TSval=394323038 TSecr=1257766
412 0.745800331 172.31.24.227 -> 172.31.31.144 OpenFlow 74 Type: OFPT_BARRIER_REPLY
413 0.745850915 172.31.24.227 -> 172.31.31.144 OpenFlow 74 Type: OFPT_BARRIER_REPLY
414 0.745863888 172.31.31.144 -> 172.31.24.227 TCP 66 6633 → 50452 [ACK] Seq=1137 Ack=993 Win=853 Len=0 TSval=1257766 TSecr=394323038
415 0.745870014 172.31.31.144 -> 172.31.24.227 TCP 66 6633 → 50436 [ACK] Seq=169 Ack=255 Win=853 Len=0 TSval=1257766 TSecr=394323038
416 0.745916097 172.31.24.227 -> 172.31.31.144 OpenFlow 74 Type: OFPT_BARRIER_REPLY
417 0.745924366 172.31.24.227 -> 172.31.31.144 OpenFlow 74 Type: OFPT_BARRIER_REPLY
418 0.745982413 172.31.24.227 -> 172.31.31.144 OpenFlow 74 Type: OFPT_BARRIER_REPLY
419 0.745985843 172.31.24.227 -> 172.31.31.144 OpenFlow 74 Type: OFPT_BARRIER_REPLY
420 0.746014603 172.31.24.227 -> 172.31.31.144 TCP 66 50430 → 6633 [ACK] Seq=247 Ack=169 Win=213 Len=0 TSval=394323038 TSecr=1257766
421 0.746020379 172.31.24.227 -> 172.31.31.144 OpenFlow 74 Type: OFPT_BARRIER_REPLY
422 0.746029288 172.31.31.144 -> 172.31.24.227 TCP 66 6633 → 50450 [ACK] Seq=1379 Ack=1239 Win=853 Len=0 TSval=1257766 TSecr=394323038
423 0.746034087 172.31.31.144 -> 172.31.24.227 TCP 66 6633 → 50440 [ACK] Seq=1379 Ack=747 Win=853 Len=0 TSval=1257766 TSecr=394323038
424 0.746037011 172.31.31.144 -> 172.31.24.227 TCP 66 6633 → 50460 [ACK] Seq=1547 Ack=747 Win=853 Len=0 TSval=1257766 TSecr=394323038
425 0.746128381 172.31.24.227 -> 172.31.31.144 OpenFlow 90 Type: OFPT_BARRIER_REPLY
426 0.746198452 172.31.31.144 -> 172.31.24.227 TCP 66 6633 → 50444 [ACK] Seq=895 Ack=501 Win=853 Len=0 TSval=1257766 TSecr=394323038
427 0.746228102 172.31.24.227 -> 172.31.31.144 OpenFlow 146 Type: OFPT_FLOW_REMOVED
428 0.746244040 172.31.24.227 -> 172.31.31.144 OpenFlow 146 Type: OFPT_FLOW_REMOVED
429 0.746252160 172.31.31.144 -> 172.31.24.227 TCP 66 6633 → 50460 [ACK] Seq=1547 Ack=755 Win=853 Len=0 TSval=1257766 TSecr=394323038
430 0.746264391 172.31.24.227 -> 172.31.31.144 OpenFlow 146 Type: OFPT_FLOW_REMOVED
431 0.746270545 172.31.24.227 -> 172.31.31.144 OpenFlow 146 Type: OFPT_FLOW_REMOVED
432 0.746281415 172.31.24.227 -> 172.31.31.144 OpenFlow 146 Type: OFPT_FLOW_REMOVED
433 0.746291089 172.31.24.227 -> 172.31.31.144 OpenFlow 146 Type: OFPT_FLOW_REMOVED
434 0.746326795 172.31.24.227 -> 172.31.31.144 OpenFlow 146 Type: OFPT_FLOW_REMOVED
435 0.746337856 172.31.24.227 -> 172.31.31.144 OpenFlow 146 Type: OFPT_FLOW_REMOVED
436 0.746340698 172.31.24.227 -> 172.31.31.144 OpenFlow 146 Type: OFPT_FLOW_REMOVED
437 0.746358221 172.31.24.227 -> 172.31.31.144 OpenFlow 146 Type: OFPT_FLOW_REMOVED
438 0.746381568 172.31.24.227 -> 172.31.31.144 OpenFlow 146 Type: OFPT_FLOW_REMOVED
439 0.746391877 172.31.24.227 -> 172.31.31.144 OpenFlow 146 Type: OFPT_FLOW_REMOVED
440 0.746411587 172.31.31.144 -> 172.31.24.227 TCP 66 6633 → 50474 [ACK] Seq=673 Ack=839 Win=853 Len=0 TSval=1257766 TSecr=394323038
441 0.746418851 172.31.24.227 -> 172.31.31.144 OpenFlow 146 Type: OFPT_FLOW_REMOVED
442 0.746424935 172.31.31.144 -> 172.31.24.227 TCP 66 6633 → 50462 [ACK] Seq=1715 Ack=923 Win=853 Len=0 TSval=1257766 TSecr=394323038
443 0.746429194 172.31.24.227 -> 172.31.31.144 OpenFlow 306 Type: OFPT_FLOW_REMOVED
444 0.746430962 172.31.31.144 -> 172.31.24.227 TCP 66 6633 → 50430 [ACK] Seq=169 Ack=255 Win=853 Len=0 TSval=1257766 TSecr=394323038
445 0.746434198 172.31.24.227 -> 172.31.31.144 OpenFlow 146 Type: OFPT_FLOW_REMOVED
446 0.746435904 172.31.31.144 -> 172.31.24.227 TCP 66 6633 → 50476 [ACK] Seq=673 Ack=359 Win=853 Len=0 TSval=1257766 TSecr=394323038
447 0.746439362 172.31.24.227 -> 172.31.31.144 OpenFlow 626 Type: OFPT_FLOW_REMOVED
448 0.746444085 172.31.24.227 -> 172.31.31.144 OpenFlow 146 Type: OFPT_FLOW_REMOVED
449 0.746849027 172.31.24.227 -> 172.31.31.144 OpenFlow 146 Type: OFPT_FLOW_REMOVED
450 0.746852731 172.31.24.227 -> 172.31.31.144 OpenFlow 306 Type: OFPT_FLOW_REMOVED
451 0.746855132 172.31.24.227 -> 172.31.31.144 OpenFlow 146 Type: OFPT_FLOW_REMOVED
452 0.746973286 172.31.31.144 -> 172.31.24.227 TCP 66 6633 → 50452 [ACK] Seq=1137 Ack=1073 Win=853 Len=0 TSval=1257766 TSecr=394323038
453 0.746979307 172.31.31.144 -> 172.31.24.227 OpenFlow 170 Type: OFPT_FLOW_MOD
454 0.746981976 172.31.31.144 -> 172.31.24.227 OpenFlow 170 Type: OFPT_FLOW_MOD
455 0.746984245 172.31.31.144 -> 172.31.24.227 TCP 66 6633 → 50436 [ACK] Seq=169 Ack=335 Win=853 Len=0 TSval=1257766 TSecr=394323038
456 0.746986694 172.31.31.144 -> 172.31.24.227 OpenFlow 74 Type: OFPT_BARRIER_REQUEST
457 0.746989850 172.31.31.144 -> 172.31.24.227 OpenFlow 170 Type: OFPT_FLOW_MOD
458 0.746992442 172.31.31.144 -> 172.31.24.227 TCP 66 6633 → 50450 [ACK] Seq=1379 Ack=1319 Win=853 Len=0 TSval=1257766 TSecr=394323038
459 0.746995033 172.31.31.144 -> 172.31.24.227 OpenFlow 178 Type: OFPT_BARRIER_REQUEST
460 0.746997131 172.31.31.144 -> 172.31.24.227 OpenFlow 170 Type: OFPT_FLOW_MOD
461 0.746998964 172.31.31.144 -> 172.31.24.227 TCP 66 6633 → 50452 [ACK] Seq=1137 Ack=1153 Win=853 Len=0 TSval=1257767 TSecr=394323038
462 0.747001096 172.31.31.144 -> 172.31.24.227 TCP 66 6633 → 50440 [ACK] Seq=1379 Ack=827 Win=853 Len=0 TSval=1257767 TSecr=394323038
463 0.747003573 172.31.31.144 -> 172.31.24.227 OpenFlow 170 Type: OFPT_FLOW_MOD
464 0.747005593 172.31.31.144 -> 172.31.24.227 OpenFlow 74 Type: OFPT_BARRIER_REQUEST
465 0.747007508 172.31.31.144 -> 172.31.24.227 TCP 66 6633 → 50460 [ACK] Seq=1547 Ack=835 Win=853 Len=0 TSval=1257767 TSecr=394323038
466 0.747010099 172.31.31.144 -> 172.31.24.227 OpenFlow 170 Type: OFPT_FLOW_MOD
467 0.747012169 172.31.31.144 -> 172.31.24.227 OpenFlow 170 Type: OFPT_FLOW_MOD
468 0.747014026 172.31.31.144 -> 172.31.24.227 OpenFlow 74 Type: OFPT_BARRIER_REQUEST
469 0.747328714 172.31.31.144 -> 172.31.24.227 TCP 66 6633 → 50430 [ACK] Seq=169 Ack=335 Win=853 Len=0 TSval=1257767 TSecr=394323039
470 0.747334208 172.31.31.144 -> 172.31.24.227 TCP 66 6633 → 50474 [ACK] Seq=673 Ack=999 Win=853 Len=0 TSval=1257767 TSecr=394323039
471 0.747337554 172.31.31.144 -> 172.31.24.227 TCP 66 6633 → 50430 [ACK] Seq=169 Ack=415 Win=853 Len=0 TSval=1257767 TSecr=394323039
472 0.747339903 172.31.31.144 -> 172.31.24.227 TCP 66 6633 → 50450 [ACK] Seq=1379 Ack=1399 Win=853 Len=0 TSval=1257767 TSecr=394323039
473 0.747342356 172.31.31.144 -> 172.31.24.227 TCP 66 6633 → 50476 [ACK] Seq=889 Ack=999 Win=853 Len=0 TSval=1257767 TSecr=394323039
474 0.747345052 172.31.31.144 -> 172.31.24.227 OpenFlow 170 Type: OFPT_FLOW_MOD
475 0.747347716 172.31.31.144 -> 172.31.24.227 TCP 66 6633 → 50440 [ACK] Seq=1379 Ack=907 Win=853 Len=0 TSval=1257767 TSecr=394323039
476 0.747350050 172.31.31.144 -> 172.31.24.227 TCP 66 6633 → 50460 [ACK] Seq=1547 Ack=1075 Win=853 Len=0 TSval=1257767 TSecr=394323039
477 0.747378540 172.31.31.144 -> 172.31.24.227 TCP 66 6633 → 50444 [ACK] Seq=1111 Ack=661 Win=853 Len=0 TSval=1257767 TSecr=394323039
478 0.747512237 172.31.31.144 -> 172.31.24.227 OpenFlow 170 Type: OFPT_FLOW_MOD
479 0.747577706 172.31.31.144 -> 172.31.24.227 OpenFlow 170 Type: OFPT_FLOW_MOD
480 0.747713700 172.31.31.144 -> 172.31.24.227 OpenFlow 170 Type: OFPT_FLOW_MOD
481 0.748002019 172.31.31.144 -> 172.31.24.227 OpenFlow 170 Type: OFPT_FLOW_MOD
482 0.748082334 172.31.24.227 -> 172.31.31.144 OpenFlow 74 Type: OFPT_BARRIER_REPLY
483 0.748167589 172.31.24.227 -> 172.31.31.144 OpenFlow 74 Type: OFPT_BARRIER_REPLY
484 0.748195181 172.31.31.144 -> 172.31.24.227 OpenFlow 170 Type: OFPT_FLOW_MOD
485 0.748202157 172.31.31.144 -> 172.31.24.227 OpenFlow 170 Type: OFPT_FLOW_MOD
486 0.748205757 172.31.31.144 -> 172.31.24.227 OpenFlow 178 Type: OFPT_BARRIER_REQUEST
487 0.748208934 172.31.31.144 -> 172.31.24.227 OpenFlow 170 Type: OFPT_FLOW_MOD
488 0.748211168 172.31.31.144 -> 172.31.24.227 OpenFlow 74 Type: OFPT_BARRIER_REQUEST
489 0.748213202 172.31.31.144 -> 172.31.24.227 TCP 66 6633 → 50462 [ACK] Seq=1715 Ack=1243 Win=853 Len=0 TSval=1257767 TSecr=394323039
490 0.748261542 172.31.24.227 -> 172.31.31.144 TCP 66 50448 → 6633 [ACK] Seq=1153 Ack=1353 Win=213 Len=0 TSval=394323039 TSecr=1257766
491 0.748287116 172.31.24.227 -> 172.31.31.144 OpenFlow 74 Type: OFPT_BARRIER_REPLY
492 0.748319289 172.31.24.227 -> 172.31.31.144 OpenFlow 74 Type: OFPT_BARRIER_REPLY
493 0.748377026 172.31.24.227 -> 172.31.31.144 TCP 66 50464 → 6633 [ACK] Seq=493 Ack=943 Win=213 Len=0 TSval=394323039 TSecr=1257767
494 0.748383776 172.31.24.227 -> 172.31.31.144 OpenFlow 74 Type: OFPT_BARRIER_REPLY
495 0.748480194 172.31.31.144 -> 172.31.24.227 OpenFlow 170 Type: OFPT_FLOW_MOD
496 0.748487587 172.31.31.144 -> 172.31.24.227 OpenFlow 170 Type: OFPT_FLOW_MOD
497 0.748490296 172.31.31.144 -> 172.31.24.227 OpenFlow 74 Type: OFPT_BARRIER_REQUEST
498 0.748492197 172.31.31.144 -> 172.31.24.227 OpenFlow 170 Type: OFPT_FLOW_MOD
499 0.748494487 172.31.31.144 -> 172.31.24.227 OpenFlow 170 Type: OFPT_FLOW_MOD
500 0.748496286 172.31.31.144 -> 172.31.24.227 OpenFlow 74 Type: OFPT_BARRIER_REQUEST
501 0.748498037 172.31.31.144 -> 172.31.24.227 OpenFlow 170 Type: OFPT_FLOW_MOD
502 0.748500143 172.31.31.144 -> 172.31.24.227 OpenFlow 170 Type: OFPT_FLOW_MOD
503 0.748501988 172.31.31.144 -> 172.31.24.227 OpenFlow 74 Type: OFPT_BARRIER_REQUEST
504 0.748622874 172.31.31.144 -> 172.31.24.227 OpenFlow 170 Type: OFPT_FLOW_MOD
505 0.748629038 172.31.31.144 -> 172.31.24.227 OpenFlow 170 Type: OFPT_FLOW_MOD
506 0.748631241 172.31.31.144 -> 172.31.24.227 OpenFlow 74 Type: OFPT_BARRIER_REQUEST
507 0.748694086 172.31.31.144 -> 172.31.24.227 OpenFlow 170 Type: OFPT_FLOW_MOD
508 0.748703608 172.31.31.144 -> 172.31.24.227 OpenFlow 170 Type: OFPT_FLOW_MOD
509 0.748852506 172.31.31.144 -> 172.31.24.227 OpenFlow 74 Type: OFPT_BARRIER_REQUEST
510 0.748857200 172.31.31.144 -> 172.31.24.227 OpenFlow 170 Type: OFPT_FLOW_MOD
511 0.748859686 172.31.31.144 -> 172.31.24.227 TCP 66 6633 → 50464 [ACK] Seq=1263 Ack=501 Win=853 Len=0 TSval=1257767 TSecr=394323039
512 0.748862729 172.31.31.144 -> 172.31.24.227 OpenFlow 178 Type: OFPT_BARRIER_REQUEST
513 0.748865090 172.31.31.144 -> 172.31.24.227 OpenFlow 170 Type: OFPT_FLOW_MOD
514 0.748868234 172.31.31.144 -> 172.31.24.227 OpenFlow 170 Type: OFPT_FLOW_MOD
515 0.748870254 172.31.31.144 -> 172.31.24.227 OpenFlow 74 Type: OFPT_BARRIER_REQUEST
516 0.748941821 172.31.31.144 -> 172.31.24.227 OpenFlow 170 Type: OFPT_FLOW_MOD
517 0.748946442 172.31.31.144 -> 172.31.24.227 OpenFlow 178 Type: OFPT_BARRIER_REQUEST
518 0.749013517 172.31.31.144 -> 172.31.24.227 OpenFlow 170 Type: OFPT_FLOW_MOD
519 0.749017962 172.31.31.144 -> 172.31.24.227 OpenFlow 178 Type: OFPT_BARRIER_REQUEST
520 0.749091181 172.31.31.144 -> 172.31.24.227 OpenFlow 170 Type: OFPT_FLOW_MOD
521 0.749097245 172.31.31.144 -> 172.31.24.227 OpenFlow 178 Type: OFPT_BARRIER_REQUEST
522 0.749184441 172.31.31.144 -> 172.31.24.227 OpenFlow 170 Type: OFPT_FLOW_MOD
523 0.749189108 172.31.31.144 -> 172.31.24.227 OpenFlow 170 Type: OFPT_FLOW_MOD
524 0.749191352 172.31.31.144 -> 172.31.24.227 OpenFlow 74 Type: OFPT_BARRIER_REQUEST
525 0.749625437 172.31.31.144 -> 172.31.24.227 OpenFlow 170 Type: OFPT_FLOW_MOD
526 0.749630037 172.31.31.144 -> 172.31.24.227 OpenFlow 170 Type: OFPT_FLOW_MOD
527 0.749632724 172.31.31.144 -> 172.31.24.227 OpenFlow 170 Type: OFPT_FLOW_MOD
528 0.749635404 172.31.31.144 -> 172.31.24.227 OpenFlow 170 Type: OFPT_FLOW_MOD
529 0.749637787 172.31.31.144 -> 172.31.24.227 OpenFlow 178 Type: OFPT_BARRIER_REQUEST
530 0.749639809 172.31.31.144 -> 172.31.24.227 OpenFlow 170 Type: OFPT_FLOW_MOD
531 0.749641854 172.31.31.144 -> 172.31.24.227 OpenFlow 178 Type: OFPT_BARRIER_REQUEST
532 0.749644032 172.31.31.144 -> 172.31.24.227 OpenFlow 170 Type: OFPT_FLOW_MOD
533 0.749646862 172.31.31.144 -> 172.31.24.227 OpenFlow 610 Type: OFPT_BARRIER_REQUEST
534 0.750688858 172.31.24.227 -> 172.31.31.144 OpenFlow 74 Type: OFPT_BARRIER_REPLY
535 0.750731638 172.31.24.227 -> 172.31.31.144 OpenFlow 74 Type: OFPT_BARRIER_REPLY
536 0.750791994 172.31.24.227 -> 172.31.31.144 OpenFlow 74 Type: OFPT_BARRIER_REPLY
537 0.750856837 172.31.24.227 -> 172.31.31.144 TCP 66 50446 → 6633 [ACK] Seq=1231 Ack=1427 Win=213 Len=0 TSval=394323040 TSecr=1257767
538 0.750872032 172.31.24.227 -> 172.31.31.144 OpenFlow 74 Type: OFPT_BARRIER_REPLY
539 0.750877205 172.31.31.144 -> 172.31.24.227 TCP 66 6633 → 50456 [ACK] Seq=1159 Ack=747 Win=853 Len=0 TSval=1257768 TSecr=394323040
540 0.750920956 172.31.31.144 -> 172.31.24.227 TCP 66 6633 → 50456 [ACK] Seq=1159 Ack=755 Win=853 Len=0 TSval=1257768 TSecr=394323040
541 0.750941448 172.31.24.227 -> 172.31.31.144 OpenFlow 74 Type: OFPT_BARRIER_REPLY
542 0.750970367 172.31.24.227 -> 172.31.31.144 OpenFlow 74 Type: OFPT_BARRIER_REPLY
543 0.751006470 172.31.24.227 -> 172.31.31.144 TCP 66 50448 → 6633 [ACK] Seq=1161 Ack=1569 Win=213 Len=0 TSval=394323040 TSecr=1257767
544 0.751016168 172.31.24.227 -> 172.31.31.144 OpenFlow 74 Type: OFPT_BARRIER_REPLY
545 0.751057316 172.31.24.227 -> 172.31.31.144 OpenFlow 74 Type: OFPT_BARRIER_REPLY
546 0.751096929 172.31.31.144 -> 172.31.24.227 TCP 66 6633 → 50446 [ACK] Seq=1427 Ack=1239 Win=853 Len=0 TSval=1257768 TSecr=394323040
547 0.751110312 172.31.24.227 -> 172.31.31.144 OpenFlow 74 Type: OFPT_BARRIER_REPLY
548 0.751128558 172.31.24.227 -> 172.31.31.144 OpenFlow 74 Type: OFPT_BARRIER_REPLY
549 0.751157582 172.31.24.227 -> 172.31.31.144 TCP 66 50474 → 6633 [ACK] Seq=999 Ack=889 Win=213 Len=0 TSval=394323040 TSecr=1257767
550 0.751163760 172.31.24.227 -> 172.31.31.144 OpenFlow 74 Type: OFPT_BARRIER_REPLY
551 0.751173065 172.31.31.144 -> 172.31.24.227 TCP 66 6633 → 50462 [ACK] Seq=2147 Ack=1259 Win=853 Len=0 TSval=1257768 TSecr=394323040
552 0.751211845 172.31.24.227 -> 172.31.31.144 TCP 66 50472 → 6633 [ACK] Seq=493 Ack=217 Win=213 Len=0 TSval=394323040 TSecr=1257767
553 0.751222296 172.31.24.227 -> 172.31.31.144 OpenFlow 74 Type: OFPT_BARRIER_REPLY
554 0.751253310 172.31.24.227 -> 172.31.31.144 OpenFlow 74 Type: OFPT_BARRIER_REPLY
555 0.751303623 172.31.24.227 -> 172.31.31.144 TCP 66 50470 → 6633 [ACK] Seq=661 Ack=385 Win=213 Len=0 TSval=394323040 TSecr=1257767
556 0.751328392 172.31.24.227 -> 172.31.31.144 OpenFlow 74 Type: OFPT_BARRIER_REPLY
557 0.751364396 172.31.24.227 -> 172.31.31.144 OpenFlow 74 Type: OFPT_BARRIER_REPLY
558 0.751370880 172.31.31.144 -> 172.31.24.227 TCP 66 6633 → 50476 [ACK] Seq=1641 Ack=1023 Win=853 Len=0 TSval=1257768 TSecr=394323040
559 0.751442172 172.31.31.144 -> 172.31.24.227 TCP 66 6633 → 50472 [ACK] Seq=217 Ack=501 Win=853 Len=0 TSval=1257768 TSecr=394323040
560 0.751454032 172.31.24.227 -> 172.31.31.144 OpenFlow 82 Type: OFPT_BARRIER_REPLY
561 0.751649281 172.31.31.144 -> 172.31.24.227 TCP 66 6633 → 50464 [ACK] Seq=1591 Ack=525 Win=853 Len=0 TSval=1257768 TSecr=394323040
562 0.786741371 172.31.31.144 -> 172.31.24.227 TCP 66 6633 → 50444 [ACK] Seq=1319 Ack=669 Win=853 Len=0 TSval=1257777 TSecr=394323039
563 0.786764136 172.31.31.144 -> 172.31.24.227 TCP 66 6633 → 50436 [ACK] Seq=593 Ack=423 Win=853 Len=0 TSval=1257777 TSecr=394323039
564 0.790798396 172.31.31.144 -> 172.31.24.227 TCP 66 6633 → 50430 [ACK] Seq=593 Ack=423 Win=853 Len=0 TSval=1257778 TSecr=394323040
565 0.790805650 172.31.31.144 -> 172.31.24.227 TCP 66 6633 → 50476 [ACK] Seq=1641 Ack=1031 Win=853 Len=0 TSval=1257778 TSecr=394323040
566 0.790808770 172.31.31.144 -> 172.31.24.227 TCP 66 6633 → 50470 [ACK] Seq=385 Ack=669 Win=853 Len=0 TSval=1257778 TSecr=394323040
567 0.790812201 172.31.31.144 -> 172.31.24.227 TCP 66 6633 → 50448 [ACK] Seq=1569 Ack=1169 Win=853 Len=0 TSval=1257778 TSecr=394323040
568 0.790815177 172.31.31.144 -> 172.31.24.227 TCP 66 6633 → 50474 [ACK] Seq=889 Ack=1007 Win=853 Len=0 TSval=1257778 TSecr=394323040
569 0.790818096 172.31.31.144 -> 172.31.24.227 TCP 66 6633 → 50440 [ACK] Seq=1699 Ack=915 Win=853 Len=0 TSval=1257778 TSecr=394323040
570 0.800184295 172.31.31.144 -> 172.31.24.227 OpenFlow 187 Type: OFPT_PACKET_OUT
571 0.800195403 172.31.31.144 -> 172.31.24.227 OpenFlow 187 Type: OFPT_PACKET_OUT
572 0.800198795 172.31.31.144 -> 172.31.24.227 OpenFlow 187 Type: OFPT_PACKET_OUT
573 0.800222109 172.31.31.144 -> 172.31.24.227 OpenFlow 187 Type: OFPT_PACKET_OUT
574 0.800302561 172.31.31.144 -> 172.31.24.227 OpenFlow 187 Type: OFPT_PACKET_OUT
575 0.800321050 172.31.31.144 -> 172.31.24.227 OpenFlow 187 Type: OFPT_PACKET_OUT
576 0.800362228 172.31.31.144 -> 172.31.24.227 OpenFlow 187 Type: OFPT_PACKET_OUT
577 0.800430200 172.31.31.144 -> 172.31.24.227 OpenFlow 187 Type: OFPT_PACKET_OUT
578 0.800899021 172.31.24.227 -> 172.31.31.144 TCP 66 50470 → 6633 [ACK] Seq=669 Ack=1353 Win=213 Len=0 TSval=394323052 TSecr=1257780
579 0.801109114 172.31.24.227 -> 172.31.31.144 OpenFlow 189 Type: OFPT_PACKET_IN
580 0.801130312 172.31.24.227 -> 172.31.31.144 OpenFlow 189 Type: OFPT_PACKET_IN
581 0.801179474 172.31.24.227 -> 172.31.31.144 OpenFlow 189 Type: OFPT_PACKET_IN
582 0.801195176 172.31.24.227 -> 172.31.31.144 OpenFlow 189 Type: OFPT_PACKET_IN
583 0.801253502 172.31.24.227 -> 172.31.31.144 OpenFlow 189 Type: OFPT_PACKET_IN
584 0.801312147 172.31.24.227 -> 172.31.31.144 OpenFlow 189 Type: OFPT_PACKET_IN
585 0.801381449 172.31.31.144 -> 172.31.24.227 TCP 66 6633 → 50468 [ACK] Seq=969 Ack=616 Win=853 Len=0 TSval=1257780 TSecr=394323052
586 0.801389911 172.31.31.144 -> 172.31.24.227 TCP 66 6633 → 50468 [ACK] Seq=969 Ack=739 Win=853 Len=0 TSval=1257780 TSecr=394323052
587 0.801392571 172.31.31.144 -> 172.31.24.227 TCP 66 6633 → 50460 [ACK] Seq=1547 Ack=1198 Win=853 Len=0 TSval=1257780 TSecr=394323052
588 0.801405284 172.31.31.144 -> 172.31.24.227 TCP 66 6633 → 50460 [ACK] Seq=1547 Ack=1321 Win=853 Len=0 TSval=1257780 TSecr=394323052
589 0.801473138 172.31.31.144 -> 172.31.24.227 TCP 66 6633 → 50472 [ACK] Seq=217 Ack=624 Win=853 Len=0 TSval=1257780 TSecr=394323052
590 0.801537163 172.31.31.144 -> 172.31.24.227 TCP 66 6633 → 50472 [ACK] Seq=217 Ack=747 Win=853 Len=0 TSval=1257780 TSecr=394323052
591 0.899847184 172.31.31.144 -> 172.31.24.227 OpenFlow 187 Type: OFPT_PACKET_OUT
592 0.899867079 172.31.31.144 -> 172.31.24.227 OpenFlow 187 Type: OFPT_PACKET_OUT
593 0.899872183 172.31.31.144 -> 172.31.24.227 OpenFlow 187 Type: OFPT_PACKET_OUT
594 0.899875060 172.31.31.144 -> 172.31.24.227 OpenFlow 187 Type: OFPT_PACKET_OUT
595 0.899889894 172.31.31.144 -> 172.31.24.227 OpenFlow 187 Type: OFPT_PACKET_OUT
596 0.899906290 172.31.31.144 -> 172.31.24.227 OpenFlow 187 Type: OFPT_PACKET_OUT
597 0.899954303 172.31.31.144 -> 172.31.24.227 OpenFlow 187 Type: OFPT_PACKET_OUT
598 0.900000426 172.31.31.144 -> 172.31.24.227 OpenFlow 187 Type: OFPT_PACKET_OUT
599 0.900059411 172.31.31.144 -> 172.31.24.227 OpenFlow 187 Type: OFPT_PACKET_OUT
600 0.900100053 172.31.31.144 -> 172.31.24.227 OpenFlow 187 Type: OFPT_PACKET_OUT
601 0.900148207 172.31.31.144 -> 172.31.24.227 OpenFlow 187 Type: OFPT_PACKET_OUT
602 0.900195384 172.31.31.144 -> 172.31.24.227 OpenFlow 187 Type: OFPT_PACKET_OUT
603 0.900240918 172.31.31.144 -> 172.31.24.227 OpenFlow 187 Type: OFPT_PACKET_OUT
604 0.900305676 172.31.31.144 -> 172.31.24.227 OpenFlow 187 Type: OFPT_PACKET_OUT
605 0.900422222 172.31.24.227 -> 172.31.31.144 TCP 66 50474 → 6633 [ACK] Seq=1007 Ack=1615 Win=213 Len=0 TSval=394323077 TSecr=1257805
606 0.900505506 172.31.24.227 -> 172.31.31.144 OpenFlow 189 Type: OFPT_PACKET_IN
607 0.900528123 172.31.24.227 -> 172.31.31.144 OpenFlow 189 Type: OFPT_PACKET_IN
608 0.900718092 172.31.31.144 -> 172.31.24.227 TCP 66 6633 → 50472 [ACK] Seq=1185 Ack=870 Win=853 Len=0 TSval=1257805 TSecr=394323077
609 0.900846839 172.31.31.144 -> 172.31.24.227 TCP 66 6633 → 50472 [ACK] Seq=1185 Ack=993 Win=853 Len=0 TSval=1257805 TSecr=394323077
610 0.900982800 172.31.24.227 -> 172.31.31.144 OpenFlow 189 Type: OFPT_PACKET_IN
611 0.901003102 172.31.24.227 -> 172.31.31.144 OpenFlow 189 Type: OFPT_PACKET_IN
612 0.901151815 172.31.24.227 -> 172.31.31.144 OpenFlow 189 Type: OFPT_PACKET_IN
613 0.901194372 172.31.31.144 -> 172.31.24.227 TCP 66 6633 → 50470 [ACK] Seq=1353 Ack=792 Win=853 Len=0 TSval=1257805 TSecr=394323077
614 0.901204062 172.31.24.227 -> 172.31.31.144 OpenFlow 189 Type: OFPT_PACKET_IN
615 0.901223528 172.31.24.227 -> 172.31.31.144 OpenFlow 189 Type: OFPT_PACKET_IN
616 0.901250593 172.31.24.227 -> 172.31.31.144 OpenFlow 435 Type: OFPT_PACKET_IN
617 0.901268412 172.31.24.227 -> 172.31.31.144 OpenFlow 189 Type: OFPT_PACKET_IN
618 0.901292768 172.31.31.144 -> 172.31.24.227 TCP 66 6633 → 50470 [ACK] Seq=1353 Ack=915 Win=853 Len=0 TSval=1257805 TSecr=394323077
619 0.901322147 172.31.24.227 -> 172.31.31.144 OpenFlow 189 Type: OFPT_PACKET_IN
620 0.901380705 172.31.31.144 -> 172.31.24.227 TCP 66 6633 → 50460 [ACK] Seq=1547 Ack=1444 Win=853 Len=0 TSval=1257805 TSecr=394323077
621 0.901389433 172.31.31.144 -> 172.31.24.227 TCP 66 6633 → 50460 [ACK] Seq=1547 Ack=1567 Win=853 Len=0 TSval=1257805 TSecr=394323077
622 0.901566406 172.31.31.144 -> 172.31.24.227 TCP 66 6633 → 50462 [ACK] Seq=2147 Ack=1751 Win=853 Len=0 TSval=1257805 TSecr=394323077
623 0.901710840 172.31.31.144 -> 172.31.24.227 TCP 66 6633 → 50474 [ACK] Seq=1615 Ack=1253 Win=853 Len=0 TSval=1257805 TSecr=394323077
624 0.999663125 172.31.31.144 -> 172.31.24.227 OpenFlow 187 Type: OFPT_PACKET_OUT
625 0.999686446 172.31.31.144 -> 172.31.24.227 OpenFlow 187 Type: OFPT_PACKET_OUT
626 0.999690757 172.31.31.144 -> 172.31.24.227 OpenFlow 187 Type: OFPT_PACKET_OUT
627 0.999705410 172.31.31.144 -> 172.31.24.227 OpenFlow 187 Type: OFPT_PACKET_OUT
628 1.000119234 172.31.24.227 -> 172.31.31.144 TCP 66 50476 → 6633 [ACK] Seq=1031 Ack=2125 Win=213 Len=0 TSval=394323102 TSecr=1257830
629 1.000246050 172.31.24.227 -> 172.31.31.144 OpenFlow 189 Type: OFPT_PACKET_IN
630 1.000270020 172.31.24.227 -> 172.31.31.144 OpenFlow 189 Type: OFPT_PACKET_IN
631 1.000472977 172.31.31.144 -> 172.31.24.227 TCP 66 6633 → 50464 [ACK] Seq=1591 Ack=771 Win=853 Len=0 TSval=1257830 TSecr=394323102
