00:00:00.000000 IP 10.0.0.1 > 10.0.0.2: ICMP echo request, id 4518, seq 5, length 64
00:00:00.012882 IP 10.0.0.1 > 10.0.0.2: ICMP echo request, id 4518, seq 6, length 64
00:00:00.023191 IP 10.0.0.1 > 10.0.0.2: ICMP echo request, id 4518, seq 7, length 64
00:00:00.038420 IP 10.0.0.1 > 10.0.0.2: ICMP echo request, id 4518, seq 8, length 64
00:00:00.050604 IP 10.0.0.1 > 10.0.0.2: ICMP echo request, id 4518, seq 9, length 64
00:00:00.065277 IP 10.0.0.1 > 10.0.0.2: ICMP echo request, id 4518, seq 10, length 64
00:00:00.076021 IP 10.0.0.1 > 10.0.0.2: ICMP echo request, id 4518, seq 11, length 64
00:00:00.086784 IP 10.0.0.1 > 10.0.0.2: ICMP echo request, id 4518, seq 12, length 64
00:00:00.098532 IP 10.0.0.1 > 10.0.0.2: ICMP echo request, id 4518, seq 13, length 64
00:00:00.112238 IP 10.0.0.1 > 10.0.0.2: ICMP echo request, id 4518, seq 14, length 64
00:00:00.123917 IP 10.0.0.1 > 10.0.0.2: ICMP echo request, id 4518, seq 15, length 64
00:00:00.134690 IP 10.0.0.1 > 10.0.0.2: ICMP echo request, id 4518, seq 16, length 64
00:00:00.146448 IP 10.0.0.1 > 10.0.0.2: ICMP echo request, id 4518, seq 17, length 64
00:00:00.161571 IP 10.0.0.1 > 10.0.0.2: ICMP echo request, id 4518, seq 18, length 64
00:00:00.172307 IP 10.0.0.1 > 10.0.0.2: ICMP echo request, id 4518, seq 19, length 64
00:00:00.183059 IP 10.0.0.1 > 10.0.0.2: ICMP echo request, id 4518, seq 20, length 64
00:00:00.199212 IP 10.0.0.1 > 10.0.0.2: ICMP echo request, id 4518, seq 21, length 64
00:00:00.210439 IP 10.0.0.1 > 10.0.0.2: ICMP echo request, id 4518, seq 22, length 64
00:00:00.224138 IP 10.0.0.1 > 10.0.0.2: ICMP echo request, id 4518, seq 23, length 64
00:00:00.235916 IP 10.0.0.1 > 10.0.0.2: ICMP echo request, id 4518, seq 24, length 64
00:00:00.246668 IP 10.0.0.1 > 10.0.0.2: ICMP echo request, id 4518, seq 25, length 64
00:00:00.262812 IP 10.0.0.1 > 10.0.0.2: ICMP echo request, id 4518, seq 26, length 64
00:00:00.274517 IP 10.0.0.1 > 10.0.0.2: ICMP echo request, id 4518, seq 27, length 64
00:00:00.286690 IP 10.0.0.1 > 10.0.0.2: ICMP echo request, id 4518, seq 28, length 64
00:00:00.298474 IP 10.0.0.1 > 10.0.0.2: ICMP echo request, id 4518, seq 29, length 64
00:00:00.311166 IP 10.0.0.1 > 10.0.0.2: ICMP echo request, id 4518, seq 30, length 64
00:00:00.322393 IP 10.0.0.1 > 10.0.0.2: ICMP echo request, id 4518, seq 31, length 64
00:00:00.334600 IP 10.0.0.1 > 10.0.0.2: ICMP echo request, id 4518, seq 32, length 64
00:00:00.348314 IP 10.0.0.1 > 10.0.0.2: ICMP echo request, id 4518, seq 33, length 64
00:00:00.359031 IP 10.0.0.1 > 10.0.0.2: ICMP echo request, id 4518, seq 34, length 64
00:00:00.374678 IP 10.0.0.1 > 10.0.0.2: ICMP echo request, id 4518, seq 35, length 64
00:00:00.386400 IP 10.0.0.1 > 10.0.0.2: ICMP echo request, id 4518, seq 36, length 64
00:00:00.398656 IP 10.0.0.1 > 10.0.0.2: ICMP echo request, id 4518, seq 37, length 64
00:00:00.412322 IP 10.0.0.1 > 10.0.0.2: ICMP echo request, id 4518, seq 38, length 64
00:00:00.423246 IP 10.0.0.1 > 10.0.0.2: ICMP echo request, id 4518, seq 39, length 64
00:00:00.439199 IP 10.0.0.1 > 10.0.0.2: ICMP echo request, id 4518, seq 40, length 64
00:00:00.450465 IP 10.0.0.1 > 10.0.0.2: ICMP echo request, id 4518, seq 41, length 64
00:00:00.462699 IP 10.0.0.1 > 10.0.0.2: ICMP echo request, id 4518, seq 42, length 64
00:00:00.474390 IP 10.0.0.1 > 10.0.0.2: ICMP echo request, id 4518, seq 43, length 64
00:00:00.486625 IP 10.0.0.1 > 10.0.0.2: ICMP echo request, id 4518, seq 44, length 64
00:00:00.501790 IP 10.0.0.1 > 10.0.0.2: ICMP echo request, id 4518, seq 45, length 64
00:00:00.513505 IP 10.0.0.1 > 10.0.0.2: ICMP echo request, id 4518, seq 46, length 64
00:00:00.524324 IP 10.0.0.1 > 10.0.0.2: ICMP echo request, id 4518, seq 47, length 64
00:00:00.535019 IP 10.0.0.1 > 10.0.0.2: ICMP echo request, id 4518, seq 48, length 64
00:00:00.547230 IP 10.0.0.1 > 10.0.0.2: ICMP echo request, id 4518, seq 49, length 64
00:00:00.560047 IP 10.0.0.1 > 10.0.0.2: ICMP echo request, id 4518, seq 50, length 64
00:00:00.571220 IP 10.0.0.1 > 10.0.0.2: ICMP echo request, id 4518, seq 51, length 64
00:00:00.582425 IP 10.0.0.1 > 10.0.0.2: ICMP echo request, id 4518, seq 52, length 64
00:00:00.596198 IP 10.0.0.1 > 10.0.0.2: ICMP echo request, id 4518, seq 53, length 64
00:00:00.607384 IP 10.0.0.1 > 10.0.0.2: ICMP echo request, id 4518, seq 54, length 64
00:00:00.618633 IP 10.0.0.1 > 10.0.0.2: ICMP echo request, id 4518, seq 55, length 64
00:00:00.630815 IP 10.0.0.1 > 10.0.0.2: ICMP echo request, id 4518, seq 56, length 64
00:00:00.642572 IP 10.0.0.1 > 10.0.0.2: ICMP echo request, id 4518, seq 57, length 64
00:00:00.655015 IP 10.0.0.1 > 10.0.0.2: ICMP echo request, id 4518, seq 58, length 64
00:00:00.669011 IP 10.0.0.1 > 10.0.0.2: ICMP echo request, id 4518, seq 59, length 64
00:00:00.679766 IP 10.0.0.1 > 10.0.0.2: ICMP echo request, id 4518, seq 60, length 64
00:00:00.690499 IP 10.0.0.1 > 10.0.0.2: ICMP echo request, id 4518, seq 61, length 64
00:00:00.703170 IP 10.0.0.1 > 10.0.0.2: ICMP echo request, id 4518, seq 62, length 64
00:00:00.719316 IP 10.0.0.1 > 10.0.0.2: ICMP echo request, id 4518, seq 63, length 64
00:00:00.733988 IP 10.0.0.1 > 10.0.0.2: ICMP echo request, id 4518, seq 64, length 64
00:00:00.743996 IP 10.0.0.1 > 10.0.0.2: ICMP echo request, id 4518, seq 65, length 64
00:00:00.756979 IP 10.0.0.1 > 10.0.0.2: ICMP echo request, id 4518, seq 66, length 64
00:00:00.768661 IP 10.0.0.1 > 10.0.0.2: ICMP echo request, id 4518, seq 67, length 64
00:00:00.778910 IP 10.0.0.1 > 10.0.0.2: ICMP echo request, id 4518, seq 68, length 64
00:00:00.791647 IP 10.0.0.1 > 10.0.0.2: ICMP echo request, id 4518, seq 69, length 64
00:00:00.802881 IP 10.0.0.1 > 10.0.0.2: ICMP echo request, id 4518, seq 70, length 64
00:00:00.814659 IP 10.0.0.1 > 10.0.0.2: ICMP echo request, id 4518, seq 71, length 64
00:00:00.827820 IP 10.0.0.1 > 10.0.0.2: ICMP echo request, id 4518, seq 72, length 64
00:00:00.838592 IP 10.0.0.1 > 10.0.0.2: ICMP echo request, id 4518, seq 73, length 64
00:00:00.850927 IP 10.0.0.1 > 10.0.0.2: ICMP echo request, id 4518, seq 74, length 64
00:00:00.862495 IP 10.0.0.1 > 10.0.0.2: ICMP echo request, id 4518, seq 75, length 64
00:00:00.875359 IP 10.0.0.1 > 10.0.0.2: ICMP echo request, id 4518, seq 76, length 64
00:00:00.891426 IP 10.0.0.1 > 10.0.0.2: ICMP echo request, id 4518, seq 77, length 64
00:00:00.907460 IP 10.0.0.1 > 10.0.0.2: ICMP echo request, id 4518, seq 78, length 64
00:00:00.918713 IP 10.0.0.1 > 10.0.0.2: ICMP echo request, id 4518, seq 79, length 64
00:00:00.931421 IP 10.0.0.1 > 10.0.0.2: ICMP echo request, id 4518, seq 80, length 64
00:00:00.943210 IP 10.0.0.1 > 10.0.0.2: ICMP echo request, id 4518, seq 81, length 64
00:00:00.955879 IP 10.0.0.1 > 10.0.0.2: ICMP echo request, id 4518, seq 82, length 64
00:00:00.966656 IP 10.0.0.1 > 10.0.0.2: ICMP echo request, id 4518, seq 83, length 64
00:00:00.978885 IP 10.0.0.1 > 10.0.0.2: ICMP echo request, id 4518, seq 84, length 64
00:00:00.991099 IP 10.0.0.1 > 10.0.0.2: ICMP echo request, id 4518, seq 85, length 64
00:00:01.002418 IP 10.0.0.1 > 10.0.0.2: ICMP echo request, id 4518, seq 86, length 64
00:00:01.018464 IP 10.0.0.1 > 10.0.0.2: ICMP echo request, id 4518, seq 87, length 64
00:00:01.035567 IP 10.0.0.1 > 10.0.0.2: ICMP echo request, id 4518, seq 88, length 64
00:00:01.049252 IP 10.0.0.1 > 10.0.0.2: ICMP echo request, id 4518, seq 89, length 64
00:00:01.062495 IP 10.0.0.1 > 10.0.0.2: ICMP echo request, id 4518, seq 90, length 64
00:00:01.075695 IP 10.0.0.1 > 10.0.0.2: ICMP echo request, id 4518, seq 91, length 64
00:00:01.086405 IP 10.0.0.1 > 10.0.0.2: ICMP echo request, id 4518, seq 92, length 64
00:00:01.098589 IP 10.0.0.1 > 10.0.0.2: ICMP echo request, id 4518, seq 93, length 64
00:00:01.114744 IP 10.0.0.1 > 10.0.0.2: ICMP echo request, id 4518, seq 94, length 64
00:00:01.126990 IP 10.0.0.1 > 10.0.0.2: ICMP echo request, id 4518, seq 95, length 64
00:00:01.140657 IP 10.0.0.1 > 10.0.0.2: ICMP echo request, id 4518, seq 96, length 64
00:00:01.150646 IP 10.0.0.1 > 10.0.0.2: ICMP echo request, id 4518, seq 97, length 64
00:00:01.165099 IP 10.0.0.1 > 10.0.0.2: ICMP echo request, id 4518, seq 98, length 64
00:00:01.175089 IP 10.0.0.1 > 10.0.0.2: ICMP echo request, id 4518, seq 99, length 64
00:00:01.188583 IP 10.0.0.1 > 10.0.0.2: ICMP echo request, id 4518, seq 100, length 64
00:00:01.199336 IP 10.0.0.1 > 10.0.0.2: ICMP echo request, id 4518, seq 101, length 64
00:00:01.211035 IP 10.0.0.1 > 10.0.0.2: ICMP echo request, id 4518, seq 102, length 64
00:00:01.224199 IP 10.0.0.1 > 10.0.0.2: ICMP echo request, id 4518, seq 103, length 64
00:00:01.236466 IP 10.0.0.1 > 10.0.0.2: ICMP echo request, id 4518, seq 104, length 64
00:00:01.247255 IP 10.0.0.1 > 10.0.0.2: ICMP echo request, id 4518, seq 105, length 64
00:00:01.262876 IP 10.0.0.1 > 10.0.0.2: ICMP echo request, id 4518, seq 106, length 64
00:00:01.276056 IP 10.0.0.1 > 10.0.0.2: ICMP echo request, id 4518, seq 107, length 64
00:00:01.288747 IP 10.0.0.1 > 10.0.0.2: ICMP echo request, id 4518, seq 108, length 64
00:00:01.299033 IP 10.0.0.1 > 10.0.0.2: ICMP echo request, id 4518, seq 109, length 64
00:00:01.312247 IP 10.0.0.1 > 10.0.0.2: ICMP echo request, id 4518, seq 110, length 64
00:00:01.322481 IP 10.0.0.1 > 10.0.0.2: ICMP echo request, id 4518, seq 111, length 64
00:00:01.335024 IP 10.0.0.1 > 10.0.0.2: ICMP echo request, id 4518, seq 112, length 64
00:00:01.346426 IP 10.0.0.1 > 10.0.0.2: ICMP echo request, id 4518, seq 113, length 64
00:00:01.362079 IP 10.0.0.1 > 10.0.0.2: ICMP echo request, id 4518, seq 114, length 64
00:00:01.372077 IP 10.0.0.1 > 10.0.0.2: ICMP echo request, id 4518, seq 115, length 64
00:00:01.383092 IP 10.0.0.1 > 10.0.0.2: ICMP echo request, id 4518, seq 116, length 64
00:00:01.399223 IP 10.0.0.1 > 10.0.0.2: ICMP echo request, id 4518, seq 117, length 64
00:00:01.411432 IP 10.0.0.1 > 10.0.0.2: ICMP echo request, id 4518, seq 118, length 64
00:00:01.425656 IP 10.0.0.1 > 10.0.0.2: ICMP echo request, id 4518, seq 119, length 64
00:00:01.436391 IP 10.0.0.1 > 10.0.0.2: ICMP echo request, id 4518, seq 120, length 64
00:00:01.446623 IP 10.0.0.1 > 10.0.0.2: ICMP echo request, id 4518, seq 121, length 64
00:00:01.462785 IP 10.0.0.1 > 10.0.0.2: ICMP echo request, id 4518, seq 122, length 64
00:00:01.474511 IP 10.0.0.1 > 10.0.0.2: ICMP echo request, id 4518, seq 123, length 64
00:00:01.489687 IP 10.0.0.1 > 10.0.0.2: ICMP echo request, id 4518, seq 124, length 64
00:00:01.499906 IP 10.0.0.1 > 10.0.0.2: ICMP echo request, id 4518, seq 125, length 64
00:00:01.510658 IP 10.0.0.1 > 10.0.0.2: ICMP echo request, id 4518, seq 126, length 64
00:00:01.524866 IP 10.0.0.1 > 10.0.0.2: ICMP echo request, id 4518, seq 127, length 64
00:00:01.537579 IP 10.0.0.1 > 10.0.0.2: ICMP echo request, id 4518, seq 128, length 64
00:00:01.547574 IP 10.0.0.1 > 10.0.0.2: ICMP echo request, id 4518, seq 129, length 64
00:00:01.558575 IP 10.0.0.1 > 10.0.0.2: ICMP echo request, id 4518, seq 130, length 64
00:00:01.574237 IP 10.0.0.1 > 10.0.0.2: ICMP echo request, id 4518, seq 131, length 64
00:00:01.584225 IP 10.0.0.1 > 10.0.0.2: ICMP echo request, id 4518, seq 132, length 64
00:00:01.595240 IP 10.0.0.1 > 10.0.0.2: ICMP echo request, id 4518, seq 133, length 64
00:00:01.607477 IP 10.0.0.1 > 10.0.0.2: ICMP echo request, id 4518, seq 134, length 64
00:00:01.618821 IP 10.0.0.1 > 10.0.0.2: ICMP echo request, id 4518, seq 135, length 64
00:00:01.630425 IP 10.0.0.1 > 10.0.0.2: ICMP echo request, id 4518, seq 136, length 64
00:00:01.643127 IP 10.0.0.1 > 10.0.0.2: ICMP echo request, id 4518, seq 137, length 64
00:00:01.654388 IP 10.0.0.1 > 10.0.0.2: ICMP echo request, id 4518, seq 138, length 64
00:00:01.666632 IP 10.0.0.1 > 10.0.0.2: ICMP echo request, id 4518, seq 139, length 64
00:00:01.680000 IP 10.0.0.1 > 10.0.0.2: ICMP echo request, id 4518, seq 140, length 64
00:00:01.690545 IP 10.0.0.1 > 10.0.0.2: ICMP echo request, id 4518, seq 141, length 64
00:00:01.702388 IP 10.0.0.1 > 10.0.0.2: ICMP echo request, id 4518, seq 142, length 64
00:00:01.714509 IP 10.0.0.1 > 10.0.0.2: ICMP echo request, id 4518, seq 143, length 64
00:00:01.726388 IP 10.0.0.1 > 10.0.0.2: ICMP echo request, id 4518, seq 144, length 64
00:00:01.738986 IP 10.0.0.1 > 10.0.0.2: ICMP echo request, id 4518, seq 145, length 64
00:00:01.750755 IP 10.0.0.1 > 10.0.0.2: ICMP echo request, id 4518, seq 146, length 64
00:00:01.762942 IP 10.0.0.1 > 10.0.0.2: ICMP echo request, id 4518, seq 147, length 64
00:00:01.774643 IP 10.0.0.1 > 10.0.0.2: ICMP echo request, id 4518, seq 148, length 64
00:00:01.786825 IP 10.0.0.1 > 10.0.0.2: ICMP echo request, id 4518, seq 149, length 64
00:00:01.798594 IP 10.0.0.1 > 10.0.0.2: ICMP echo request, id 4518, seq 150, length 64
00:00:01.810802 IP 10.0.0.1 > 10.0.0.2: ICMP echo request, id 4518, seq 151, length 64
00:00:01.822761 IP 10.0.0.1 > 10.0.0.2: ICMP echo request, id 4518, seq 152, length 64
00:00:01.837662 IP 10.0.0.1 > 10.0.0.2: ICMP echo request, id 4518, seq 153, length 64
00:00:01.847653 IP 10.0.0.1 > 10.0.0.2: ICMP echo request, id 4518, seq 154, length 64
00:00:01.858737 IP 10.0.0.1 > 10.0.0.2: ICMP echo request, id 4518, seq 155, length 64
00:00:01.870439 IP 10.0.0.1 > 10.0.0.2: ICMP echo request, id 4518, seq 156, length 64
00:00:01.883667 IP 10.0.0.1 > 10.0.0.2: ICMP echo request, id 4518, seq 157, length 64
00:00:01.894375 IP 10.0.0.1 > 10.0.0.2: ICMP echo request, id 4518, seq 158, length 64
00:00:01.906640 IP 10.0.0.1 > 10.0.0.2: ICMP echo request, id 4518, seq 159, length 64
00:00:01.918400 IP 10.0.0.1 > 10.0.0.2: ICMP echo request, id 4518, seq 160, length 64
00:00:01.932505 IP 10.0.0.1 > 10.0.0.2: ICMP echo request, id 4518, seq 161, length 64
00:00:01.944252 IP 10.0.0.1 > 10.0.0.2: ICMP echo request, id 4518, seq 162, length 64
00:00:01.955987 IP 10.0.0.1 > 10.0.0.2: ICMP echo request, id 4518, seq 163, length 64
00:00:01.984113 IP 10.0.0.1 > 10.0.0.2: ICMP echo request, id 4518, seq 165, length 64
00:00:01.989415 IP 10.0.0.1 > 10.0.0.2: ICMP echo request, id 4518, seq 166, length 64
00:00:02.001079 IP 10.0.0.1 > 10.0.0.2: ICMP echo request, id 4518, seq 167, length 64
00:00:02.013749 IP 10.0.0.1 > 10.0.0.2: ICMP echo request, id 4518, seq 168, length 64
00:00:02.023686 IP 10.0.0.1 > 10.0.0.2: ICMP echo request, id 4518, seq 169, length 64
00:00:02.034663 IP 10.0.0.1 > 10.0.0.2: ICMP echo request, id 4518, seq 170, length 64
00:00:02.047868 IP 10.0.0.1 > 10.0.0.2: ICMP echo request, id 4518, seq 171, length 64
00:00:02.059620 IP 10.0.0.1 > 10.0.0.2: ICMP echo request, id 4518, seq 172, length 64
00:00:02.070371 IP 10.0.0.1 > 10.0.0.2: ICMP echo request, id 4518, seq 173, length 64
00:00:02.082587 IP 10.0.0.1 > 10.0.0.2: ICMP echo request, id 4518, seq 174, length 64
00:00:02.094808 IP 10.0.0.1 > 10.0.0.2: ICMP echo request, id 4518, seq 175, length 64
00:00:02.107048 IP 10.0.0.1 > 10.0.0.2: ICMP echo request, id 4518, seq 176, length 64
00:00:02.118750 IP 10.0.0.1 > 10.0.0.2: ICMP echo request, id 4518, seq 177, length 64
00:00:02.130534 IP 10.0.0.1 > 10.0.0.2: ICMP echo request, id 4518, seq 178, length 64
00:00:02.143211 IP 10.0.0.1 > 10.0.0.2: ICMP echo request, id 4518, seq 179, length 64
00:00:02.155415 IP 10.0.0.1 > 10.0.0.2: ICMP echo request, id 4518, seq 180, length 64
00:00:02.167645 IP 10.0.0.1 > 10.0.0.2: ICMP echo request, id 4518, seq 181, length 64
00:00:02.178406 IP 10.0.0.1 > 10.0.0.2: ICMP echo request, id 4518, seq 182, length 64
00:00:02.191596 IP 10.0.0.1 > 10.0.0.2: ICMP echo request, id 4518, seq 183, length 64
00:00:02.207315 IP 10.0.0.1 > 10.0.0.2: ICMP echo request, id 4518, seq 184, length 64
00:00:02.219952 IP 10.0.0.1 > 10.0.0.2: ICMP echo request, id 4518, seq 185, length 64
00:00:02.232186 IP 10.0.0.1 > 10.0.0.2: ICMP echo request, id 4518, seq 186, length 64
00:00:02.242931 IP 10.0.0.1 > 10.0.0.2: ICMP echo request, id 4518, seq 187, length 64
00:00:02.259558 IP 10.0.0.1 > 10.0.0.2: ICMP echo request, id 4518, seq 188, length 64
00:00:02.270438 IP 10.0.0.1 > 10.0.0.2: ICMP echo request, id 4518, seq 189, length 64
00:00:02.285472 IP 10.0.0.1 > 10.0.0.2: ICMP echo request, id 4518, seq 190, length 64
00:00:02.297638 IP 10.0.0.1 > 10.0.0.2: ICMP echo request, id 4518, seq 191, length 64
00:00:02.307642 IP 10.0.0.1 > 10.0.0.2: ICMP echo request, id 4518, seq 192, length 64
00:00:02.318688 IP 10.0.0.1 > 10.0.0.2: ICMP echo request, id 4518, seq 193, length 64
00:00:02.331412 IP 10.0.0.1 > 10.0.0.2: ICMP echo request, id 4518, seq 194, length 64
00:00:02.343120 IP 10.0.0.1 > 10.0.0.2: ICMP echo request, id 4518, seq 195, length 64
00:00:02.355864 IP 10.0.0.1 > 10.0.0.2: ICMP echo request, id 4518, seq 196, length 64
00:00:02.366542 IP 10.0.0.1 > 10.0.0.2: ICMP echo request, id 4518, seq 197, length 64
00:00:02.379820 IP 10.0.0.1 > 10.0.0.2: ICMP echo request, id 4518, seq 198, length 64
00:00:02.393528 IP 10.0.0.1 > 10.0.0.2: ICMP echo request, id 4518, seq 199, length 64
00:00:02.403525 IP 10.0.0.1 > 10.0.0.2: ICMP echo request, id 4518, seq 200, length 64
00:00:02.414450 IP 10.0.0.1 > 10.0.0.2: ICMP echo request, id 4518, seq 201, length 64
00:00:02.427696 IP 10.0.0.1 > 10.0.0.2: ICMP echo request, id 4518, seq 202, length 64
00:00:02.438436 IP 10.0.0.1 > 10.0.0.2: ICMP echo request, id 4518, seq 203, length 64
00:00:02.450669 IP 10.0.0.1 > 10.0.0.2: ICMP echo request, id 4518, seq 204, length 64
00:00:02.463875 IP 10.0.0.1 > 10.0.0.2: ICMP echo request, id 4518, seq 205, length 64
00:00:02.474620 IP 10.0.0.1 > 10.0.0.2: ICMP echo request, id 4518, seq 206, length 64
00:00:02.487340 IP 10.0.0.1 > 10.0.0.2: ICMP echo request, id 4518, seq 207, length 64
00:00:02.498593 IP 10.0.0.1 > 10.0.0.2: ICMP echo request, id 4518, seq 208, length 64
00:00:02.514216 IP 10.0.0.1 > 10.0.0.2: ICMP echo request, id 4518, seq 209, length 64
00:00:02.524993 IP 10.0.0.1 > 10.0.0.2: ICMP echo request, id 4518, seq 210, length 64
00:00:02.535708 IP 10.0.0.1 > 10.0.0.2: ICMP echo request, id 4518, seq 211, length 64
00:00:02.546466 IP 10.0.0.1 > 10.0.0.2: ICMP echo request, id 4518, seq 212, length 64
00:00:02.558713 IP 10.0.0.1 > 10.0.0.2: ICMP echo request, id 4518, seq 213, length 64
00:00:02.570430 IP 10.0.0.1 > 10.0.0.2: ICMP echo request, id 4518, seq 214, length 64
00:00:02.582609 IP 10.0.0.1 > 10.0.0.2: ICMP echo request, id 4518, seq 215, length 64
00:00:02.594834 IP 10.0.0.1 > 10.0.0.2: ICMP echo request, id 4518, seq 216, length 64
00:00:02.608552 IP 10.0.0.1 > 10.0.0.2: ICMP echo request, id 4518, seq 217, length 64
00:00:02.618847 IP 10.0.0.1 > 10.0.0.2: ICMP echo request, id 4518, seq 218, length 64
00:00:02.631503 IP 10.0.0.1 > 10.0.0.2: ICMP echo request, id 4518, seq 219, length 64
00:00:02.642772 IP 10.0.0.1 > 10.0.0.2: ICMP echo request, id 4518, seq 220, length 64
00:00:02.657409 IP 10.0.0.1 > 10.0.0.2: ICMP echo request, id 4518, seq 221, length 64
00:00:02.668218 IP 10.0.0.1 > 10.0.0.2: ICMP echo request, id 4518, seq 222, length 64
00:00:02.678925 IP 10.0.0.1 > 10.0.0.2: ICMP echo request, id 4518, seq 223, length 64
00:00:02.690639 IP 10.0.0.1 > 10.0.0.2: ICMP echo request, id 4518, seq 224, length 64
00:00:02.702405 IP 10.0.0.1 > 10.0.0.2: ICMP echo request, id 4518, seq 225, length 64
00:00:02.716535 IP 10.0.0.1 > 10.0.0.2: ICMP echo request, id 4518, seq 226, length 64
00:00:02.727318 IP 10.0.0.1 > 10.0.0.2: ICMP echo request, id 4518, seq 227, length 64
00:00:02.738561 IP 10.0.0.1 > 10.0.0.2: ICMP echo request, id 4518, seq 228, length 64
00:00:02.753245 IP 10.0.0.1 > 10.0.0.2: ICMP echo request, id 4518, seq 229, length 64
00:00:02.764454 IP 10.0.0.1 > 10.0.0.2: ICMP echo request, id 4518, seq 230, length 64
00:00:02.775216 IP 10.0.0.1 > 10.0.0.2: ICMP echo request, id 4518, seq 231, length 64
00:00:02.790398 IP 10.0.0.1 > 10.0.0.2: ICMP echo request, id 4518, seq 232, length 64
00:00:02.803091 IP 10.0.0.1 > 10.0.0.2: ICMP echo request, id 4518, seq 233, length 64
00:00:02.815307 IP 10.0.0.1 > 10.0.0.2: ICMP echo request, id 4518, seq 234, length 64
00:00:02.827017 IP 10.0.0.1 > 10.0.0.2: ICMP echo request, id 4518, seq 235, length 64
