00:00:00.000000 IP 10.0.0.1 > 10.0.0.2: ICMP echo request, id 5730, seq 7, length 64
00:00:00.012573 IP 10.0.0.1 > 10.0.0.2: ICMP echo request, id 5730, seq 8, length 64
00:00:00.024412 IP 10.0.0.1 > 10.0.0.2: ICMP echo request, id 5730, seq 9, length 64
00:00:00.036067 IP 10.0.0.1 > 10.0.0.2: ICMP echo request, id 5730, seq 10, length 64
00:00:00.048252 IP 10.0.0.1 > 10.0.0.2: ICMP echo request, id 5730, seq 11, length 64
00:00:00.059980 IP 10.0.0.1 > 10.0.0.2: ICMP echo request, id 5730, seq 12, length 64
00:00:00.072235 IP 10.0.0.1 > 10.0.0.2: ICMP echo request, id 5730, seq 13, length 64
00:00:00.088294 IP 10.0.0.1 > 10.0.0.2: ICMP echo request, id 5730, seq 14, length 64
00:00:00.100071 IP 10.0.0.1 > 10.0.0.2: ICMP echo request, id 5730, seq 15, length 64
00:00:00.112363 IP 10.0.0.1 > 10.0.0.2: ICMP echo request, id 5730, seq 16, length 64
00:00:00.124003 IP 10.0.0.1 > 10.0.0.2: ICMP echo request, id 5730, seq 17, length 64
00:00:00.137266 IP 10.0.0.1 > 10.0.0.2: ICMP echo request, id 5730, seq 18, length 64
00:00:00.150449 IP 10.0.0.1 > 10.0.0.2: ICMP echo request, id 5730, seq 19, length 64
00:00:00.160447 IP 10.0.0.1 > 10.0.0.2: ICMP echo request, id 5730, seq 20, length 64
00:00:00.174877 IP 10.0.0.1 > 10.0.0.2: ICMP echo request, id 5730, seq 21, length 64
00:00:00.185649 IP 10.0.0.1 > 10.0.0.2: ICMP echo request, id 5730, seq 22, length 64
00:00:00.201282 IP 10.0.0.1 > 10.0.0.2: ICMP echo request, id 5730, seq 23, length 64
00:00:00.212056 IP 10.0.0.1 > 10.0.0.2: ICMP echo request, id 5730, seq 24, length 64
00:00:00.224868 IP 10.0.0.1 > 10.0.0.2: ICMP echo request, id 5730, seq 25, length 64
00:00:00.238923 IP 10.0.0.1 > 10.0.0.2: ICMP echo request, id 5730, seq 26, length 64
00:00:00.249704 IP 10.0.0.1 > 10.0.0.2: ICMP echo request, id 5730, seq 27, length 64
00:00:00.260023 IP 10.0.0.1 > 10.0.0.2: ICMP echo request, id 5730, seq 28, length 64
00:00:00.274111 IP 10.0.0.1 > 10.0.0.2: ICMP echo request, id 5730, seq 29, length 64
00:00:00.288326 IP 10.0.0.1 > 10.0.0.2: ICMP echo request, id 5730, seq 30, length 64
00:00:00.301553 IP 10.0.0.1 > 10.0.0.2: ICMP echo request, id 5730, seq 31, length 64
00:00:00.312723 IP 10.0.0.1 > 10.0.0.2: ICMP echo request, id 5730, seq 32, length 64
00:00:00.326436 IP 10.0.0.1 > 10.0.0.2: ICMP echo request, id 5730, seq 33, length 64
00:00:00.338692 IP 10.0.0.1 > 10.0.0.2: ICMP echo request, id 5730, seq 34, length 64
00:00:00.349397 IP 10.0.0.1 > 10.0.0.2: ICMP echo request, id 5730, seq 35, length 64
00:00:00.360741 IP 10.0.0.1 > 10.0.0.2: ICMP echo request, id 5730, seq 36, length 64
00:00:00.374851 IP 10.0.0.1 > 10.0.0.2: ICMP echo request, id 5730, seq 37, length 64
00:00:00.384864 IP 10.0.0.1 > 10.0.0.2: ICMP echo request, id 5730, seq 38, length 64
00:00:00.396368 IP 10.0.0.1 > 10.0.0.2: ICMP echo request, id 5730, seq 39, length 64
00:00:00.411102 IP 10.0.0.1 > 10.0.0.2: ICMP echo request, id 5730, seq 40, length 64
00:00:00.421088 IP 10.0.0.1 > 10.0.0.2: ICMP echo request, id 5730, seq 41, length 64
00:00:00.432052 IP 10.0.0.1 > 10.0.0.2: ICMP echo request, id 5730, seq 42, length 64
00:00:00.449149 IP 10.0.0.1 > 10.0.0.2: ICMP echo request, id 5730, seq 43, length 64
00:00:00.460411 IP 10.0.0.1 > 10.0.0.2: ICMP echo request, id 5730, seq 44, length 64
00:00:00.472077 IP 10.0.0.1 > 10.0.0.2: ICMP echo request, id 5730, seq 45, length 64
00:00:00.485808 IP 10.0.0.1 > 10.0.0.2: ICMP echo request, id 5730, seq 46, length 64
00:00:00.496563 IP 10.0.0.1 > 10.0.0.2: ICMP echo request, id 5730, seq 47, length 64
00:00:00.511234 IP 10.0.0.1 > 10.0.0.2: ICMP echo request, id 5730, seq 48, length 64
00:00:00.523477 IP 10.0.0.1 > 10.0.0.2: ICMP echo request, id 5730, seq 49, length 64
00:00:00.533474 IP 10.0.0.1 > 10.0.0.2: ICMP echo request, id 5730, seq 50, length 64
00:00:00.544977 IP 10.0.0.1 > 10.0.0.2: ICMP echo request, id 5730, seq 51, length 64
00:00:00.557684 IP 10.0.0.1 > 10.0.0.2: ICMP echo request, id 5730, seq 52, length 64
00:00:00.568024 IP 10.0.0.1 > 10.0.0.2: ICMP echo request, id 5730, seq 53, length 64
00:00:00.580645 IP 10.0.0.1 > 10.0.0.2: ICMP echo request, id 5730, seq 54, length 64
00:00:00.592370 IP 10.0.0.1 > 10.0.0.2: ICMP echo request, id 5730, seq 55, length 64
00:00:00.604099 IP 10.0.0.1 > 10.0.0.2: ICMP echo request, id 5730, seq 56, length 64
00:00:00.616875 IP 10.0.0.1 > 10.0.0.2: ICMP echo request, id 5730, seq 57, length 64
00:00:00.628075 IP 10.0.0.1 > 10.0.0.2: ICMP echo request, id 5730, seq 58, length 64
00:00:00.640234 IP 10.0.0.1 > 10.0.0.2: ICMP echo request, id 5730, seq 59, length 64
00:00:00.652954 IP 10.0.0.1 > 10.0.0.2: ICMP echo request, id 5730, seq 60, length 64
00:00:00.664257 IP 10.0.0.1 > 10.0.0.2: ICMP echo request, id 5730, seq 61, length 64
00:00:00.677958 IP 10.0.0.1 > 10.0.0.2: ICMP echo request, id 5730, seq 62, length 64
00:00:00.688184 IP 10.0.0.1 > 10.0.0.2: ICMP echo request, id 5730, seq 63, length 64
00:00:00.700019 IP 10.0.0.1 > 10.0.0.2: ICMP echo request, id 5730, seq 64, length 64
00:00:00.712101 IP 10.0.0.1 > 10.0.0.2: ICMP echo request, id 5730, seq 65, length 64
00:00:00.724342 IP 10.0.0.1 > 10.0.0.2: ICMP echo request, id 5730, seq 66, length 64
00:00:00.736048 IP 10.0.0.1 > 10.0.0.2: ICMP echo request, id 5730, seq 67, length 64
00:00:00.748303 IP 10.0.0.1 > 10.0.0.2: ICMP echo request, id 5730, seq 68, length 64
00:00:00.760000 IP 10.0.0.1 > 10.0.0.2: ICMP echo request, id 5730, seq 69, length 64
00:00:00.772249 IP 10.0.0.1 > 10.0.0.2: ICMP echo request, id 5730, seq 70, length 64
00:00:00.785441 IP 10.0.0.1 > 10.0.0.2: ICMP echo request, id 5730, seq 71, length 64
00:00:00.796170 IP 10.0.0.1 > 10.0.0.2: ICMP echo request, id 5730, seq 72, length 64
00:00:00.808007 IP 10.0.0.1 > 10.0.0.2: ICMP echo request, id 5730, seq 73, length 64
00:00:00.820141 IP 10.0.0.1 > 10.0.0.2: ICMP echo request, id 5730, seq 74, length 64
00:00:00.832050 IP 10.0.0.1 > 10.0.0.2: ICMP echo request, id 5730, seq 75, length 64
00:00:00.844055 IP 10.0.0.1 > 10.0.0.2: ICMP echo request, id 5730, seq 76, length 64
00:00:00.858557 IP 10.0.0.1 > 10.0.0.2: ICMP echo request, id 5730, seq 77, length 64
