00:00:00.000000 IP 10.0.0.1 > 10.0.0.2: ICMP echo request, id 28169, seq 6, length 64
00:00:00.012083 IP 10.0.0.1 > 10.0.0.2: ICMP echo request, id 28169, seq 7, length 64
00:00:00.024331 IP 10.0.0.1 > 10.0.0.2: ICMP echo request, id 28169, seq 8, length 64
00:00:00.037077 IP 10.0.0.1 > 10.0.0.2: ICMP echo request, id 28169, seq 9, length 64
00:00:00.050212 IP 10.0.0.1 > 10.0.0.2: ICMP echo request, id 28169, seq 10, length 64
00:00:00.060486 IP 10.0.0.1 > 10.0.0.2: ICMP echo request, id 28169, seq 11, length 64
00:00:00.072210 IP 10.0.0.1 > 10.0.0.2: ICMP echo request, id 28169, seq 12, length 64
00:00:00.084454 IP 10.0.0.1 > 10.0.0.2: ICMP echo request, id 28169, seq 13, length 64
00:00:00.099091 IP 10.0.0.1 > 10.0.0.2: ICMP echo request, id 28169, seq 14, length 64
00:00:00.109078 IP 10.0.0.1 > 10.0.0.2: ICMP echo request, id 28169, seq 15, length 64
00:00:00.121550 IP 10.0.0.1 > 10.0.0.2: ICMP echo request, id 28169, seq 16, length 64
00:00:00.132317 IP 10.0.0.1 > 10.0.0.2: ICMP echo request, id 28169, seq 17, length 64
00:00:00.147982 IP 10.0.0.1 > 10.0.0.2: ICMP echo request, id 28169, seq 18, length 64
00:00:00.157981 IP 10.0.0.1 > 10.0.0.2: ICMP echo request, id 28169, seq 19, length 64
00:00:00.169440 IP 10.0.0.1 > 10.0.0.2: ICMP echo request, id 28169, seq 20, length 64
00:00:00.180234 IP 10.0.0.1 > 10.0.0.2: ICMP echo request, id 28169, seq 21, length 64
00:00:00.196382 IP 10.0.0.1 > 10.0.0.2: ICMP echo request, id 28169, seq 22, length 64
00:00:00.210046 IP 10.0.0.1 > 10.0.0.2: ICMP echo request, id 28169, seq 23, length 64
00:00:00.220346 IP 10.0.0.1 > 10.0.0.2: ICMP echo request, id 28169, seq 24, length 64
00:00:00.232543 IP 10.0.0.1 > 10.0.0.2: ICMP echo request, id 28169, seq 25, length 64
00:00:00.244236 IP 10.0.0.1 > 10.0.0.2: ICMP echo request, id 28169, seq 26, length 64
00:00:00.255977 IP 10.0.0.1 > 10.0.0.2: ICMP echo request, id 28169, seq 27, length 64
00:00:00.270146 IP 10.0.0.1 > 10.0.0.2: ICMP echo request, id 28169, seq 28, length 64
00:00:00.280154 IP 10.0.0.1 > 10.0.0.2: ICMP echo request, id 28169, seq 29, length 64
00:00:00.292177 IP 10.0.0.1 > 10.0.0.2: ICMP echo request, id 28169, seq 30, length 64
00:00:00.303985 IP 10.0.0.1 > 10.0.0.2: ICMP echo request, id 28169, seq 31, length 64
00:00:00.316136 IP 10.0.0.1 > 10.0.0.2: ICMP echo request, id 28169, seq 32, length 64
00:00:00.328333 IP 10.0.0.1 > 10.0.0.2: ICMP echo request, id 28169, seq 33, length 64
00:00:00.340100 IP 10.0.0.1 > 10.0.0.2: ICMP echo request, id 28169, seq 34, length 64
00:00:00.352269 IP 10.0.0.1 > 10.0.0.2: ICMP echo request, id 28169, seq 35, length 64
00:00:00.364012 IP 10.0.0.1 > 10.0.0.2: ICMP echo request, id 28169, seq 36, length 64
00:00:00.376234 IP 10.0.0.1 > 10.0.0.2: ICMP echo request, id 28169, seq 37, length 64
00:00:00.388025 IP 10.0.0.1 > 10.0.0.2: ICMP echo request, id 28169, seq 38, length 64
00:00:00.400170 IP 10.0.0.1 > 10.0.0.2: ICMP echo request, id 28169, seq 39, length 64
00:00:00.411977 IP 10.0.0.1 > 10.0.0.2: ICMP echo request, id 28169, seq 40, length 64
00:00:00.424628 IP 10.0.0.1 > 10.0.0.2: ICMP echo request, id 28169, seq 41, length 64
00:00:00.436382 IP 10.0.0.1 > 10.0.0.2: ICMP echo request, id 28169, seq 42, length 64
00:00:00.448102 IP 10.0.0.1 > 10.0.0.2: ICMP echo request, id 28169, seq 43, length 64
00:00:00.460311 IP 10.0.0.1 > 10.0.0.2: ICMP echo request, id 28169, seq 44, length 64
00:00:00.472040 IP 10.0.0.1 > 10.0.0.2: ICMP echo request, id 28169, seq 45, length 64
00:00:00.484284 IP 10.0.0.1 > 10.0.0.2: ICMP echo request, id 28169, seq 46, length 64
00:00:00.496571 IP 10.0.0.1 > 10.0.0.2: ICMP echo request, id 28169, seq 47, length 64
00:00:00.512128 IP 10.0.0.1 > 10.0.0.2: ICMP echo request, id 28169, seq 48, length 64
00:00:00.524507 IP 10.0.0.1 > 10.0.0.2: ICMP echo request, id 28169, seq 49, length 64
00:00:00.536072 IP 10.0.0.1 > 10.0.0.2: ICMP echo request, id 28169, seq 50, length 64
00:00:00.548775 IP 10.0.0.1 > 10.0.0.2: ICMP echo request, id 28169, seq 51, length 64
00:00:00.560162 IP 10.0.0.1 > 10.0.0.2: ICMP echo request, id 28169, seq 52, length 64
00:00:00.572262 IP 10.0.0.1 > 10.0.0.2: ICMP echo request, id 28169, seq 53, length 64
00:00:00.584012 IP 10.0.0.1 > 10.0.0.2: ICMP echo request, id 28169, seq 54, length 64
00:00:00.597272 IP 10.0.0.1 > 10.0.0.2: ICMP echo request, id 28169, seq 55, length 64
00:00:00.608939 IP 10.0.0.1 > 10.0.0.2: ICMP echo request, id 28169, seq 56, length 64
00:00:00.620153 IP 10.0.0.1 > 10.0.0.2: ICMP echo request, id 28169, seq 57, length 64
00:00:00.632008 IP 10.0.0.1 > 10.0.0.2: ICMP echo request, id 28169, seq 58, length 64
00:00:00.645272 IP 10.0.0.1 > 10.0.0.2: ICMP echo request, id 28169, seq 59, length 64
00:00:00.656347 IP 10.0.0.1 > 10.0.0.2: ICMP echo request, id 28169, seq 60, length 64
00:00:00.668166 IP 10.0.0.1 > 10.0.0.2: ICMP echo request, id 28169, seq 61, length 64
00:00:00.680801 IP 10.0.0.1 > 10.0.0.2: ICMP echo request, id 28169, seq 62, length 64
00:00:00.693998 IP 10.0.0.1 > 10.0.0.2: ICMP echo request, id 28169, seq 63, length 64
00:00:00.704218 IP 10.0.0.1 > 10.0.0.2: ICMP echo request, id 28169, seq 64, length 64
00:00:00.716606 IP 10.0.0.1 > 10.0.0.2: ICMP echo request, id 28169, seq 65, length 64
00:00:00.728152 IP 10.0.0.1 > 10.0.0.2: ICMP echo request, id 28169, seq 66, length 64
00:00:00.740426 IP 10.0.0.1 > 10.0.0.2: ICMP echo request, id 28169, seq 67, length 64
00:00:00.754098 IP 10.0.0.1 > 10.0.0.2: ICMP echo request, id 28169, seq 68, length 64
00:00:00.764103 IP 10.0.0.1 > 10.0.0.2: ICMP echo request, id 28169, seq 69, length 64
00:00:00.777210 IP 10.0.0.1 > 10.0.0.2: ICMP echo request, id 28169, seq 70, length 64
00:00:00.788316 IP 10.0.0.1 > 10.0.0.2: ICMP echo request, id 28169, seq 71, length 64
00:00:00.800019 IP 10.0.0.1 > 10.0.0.2: ICMP echo request, id 28169, seq 72, length 64
00:00:00.812257 IP 10.0.0.1 > 10.0.0.2: ICMP echo request, id 28169, seq 73, length 64
00:00:00.825485 IP 10.0.0.1 > 10.0.0.2: ICMP echo request, id 28169, seq 74, length 64
00:00:00.836193 IP 10.0.0.1 > 10.0.0.2: ICMP echo request, id 28169, seq 75, length 64
00:00:00.848008 IP 10.0.0.1 > 10.0.0.2: ICMP echo request, id 28169, seq 76, length 64
00:00:00.860184 IP 10.0.0.1 > 10.0.0.2: ICMP echo request, id 28169, seq 77, length 64
00:00:00.872438 IP 10.0.0.1 > 10.0.0.2: ICMP echo request, id 28169, seq 78, length 64
00:00:00.884118 IP 10.0.0.1 > 10.0.0.2: ICMP echo request, id 28169, seq 79, length 64
00:00:00.896838 IP 10.0.0.1 > 10.0.0.2: ICMP echo request, id 28169, seq 80, length 64
00:00:00.909054 IP 10.0.0.1 > 10.0.0.2: ICMP echo request, id 28169, seq 81, length 64
00:00:00.923749 IP 10.0.0.1 > 10.0.0.2: ICMP echo request, id 28169, seq 82, length 64
00:00:00.933742 IP 10.0.0.1 > 10.0.0.2: ICMP echo request, id 28169, seq 83, length 64
00:00:00.946707 IP 10.0.0.1 > 10.0.0.2: ICMP echo request, id 28169, seq 84, length 64
00:00:00.956702 IP 10.0.0.1 > 10.0.0.2: ICMP echo request, id 28169, seq 85, length 64
00:00:00.968014 IP 10.0.0.1 > 10.0.0.2: ICMP echo request, id 28169, seq 86, length 64
00:00:00.980004 IP 10.0.0.1 > 10.0.0.2: ICMP echo request, id 28169, seq 87, length 64
00:00:00.994180 IP 10.0.0.1 > 10.0.0.2: ICMP echo request, id 28169, seq 88, length 64
00:00:01.004171 IP 10.0.0.1 > 10.0.0.2: ICMP echo request, id 28169, seq 89, length 64
00:00:01.016596 IP 10.0.0.1 > 10.0.0.2: ICMP echo request, id 28169, seq 90, length 64
00:00:01.027994 IP 10.0.0.1 > 10.0.0.2: ICMP echo request, id 28169, seq 91, length 64
00:00:01.040541 IP 10.0.0.1 > 10.0.0.2: ICMP echo request, id 28169, seq 92, length 64
00:00:01.052287 IP 10.0.0.1 > 10.0.0.2: ICMP echo request, id 28169, seq 93, length 64
00:00:01.064009 IP 10.0.0.1 > 10.0.0.2: ICMP echo request, id 28169, seq 94, length 64
00:00:01.076280 IP 10.0.0.1 > 10.0.0.2: ICMP echo request, id 28169, seq 95, length 64
00:00:01.087980 IP 10.0.0.1 > 10.0.0.2: ICMP echo request, id 28169, seq 96, length 64
00:00:01.101663 IP 10.0.0.1 > 10.0.0.2: ICMP echo request, id 28169, seq 97, length 64
00:00:01.111984 IP 10.0.0.1 > 10.0.0.2: ICMP echo request, id 28169, seq 98, length 64
00:00:01.124107 IP 10.0.0.1 > 10.0.0.2: ICMP echo request, id 28169, seq 99, length 64
00:00:01.136325 IP 10.0.0.1 > 10.0.0.2: ICMP echo request, id 28169, seq 100, length 64
00:00:01.148562 IP 10.0.0.1 > 10.0.0.2: ICMP echo request, id 28169, seq 101, length 64
00:00:01.160276 IP 10.0.0.1 > 10.0.0.2: ICMP echo request, id 28169, seq 102, length 64
00:00:01.172021 IP 10.0.0.1 > 10.0.0.2: ICMP echo request, id 28169, seq 103, length 64
00:00:01.184297 IP 10.0.0.1 > 10.0.0.2: ICMP echo request, id 28169, seq 104, length 64
00:00:01.197509 IP 10.0.0.1 > 10.0.0.2: ICMP echo request, id 28169, seq 105, length 64
00:00:01.208225 IP 10.0.0.1 > 10.0.0.2: ICMP echo request, id 28169, seq 106, length 64
00:00:01.220925 IP 10.0.0.1 > 10.0.0.2: ICMP echo request, id 28169, seq 107, length 64
00:00:01.232146 IP 10.0.0.1 > 10.0.0.2: ICMP echo request, id 28169, seq 108, length 64
00:00:01.244386 IP 10.0.0.1 > 10.0.0.2: ICMP echo request, id 28169, seq 109, length 64
00:00:01.256095 IP 10.0.0.1 > 10.0.0.2: ICMP echo request, id 28169, seq 110, length 64
00:00:01.268328 IP 10.0.0.1 > 10.0.0.2: ICMP echo request, id 28169, seq 111, length 64
00:00:01.280028 IP 10.0.0.1 > 10.0.0.2: ICMP echo request, id 28169, seq 112, length 64
00:00:01.295200 IP 10.0.0.1 > 10.0.0.2: ICMP echo request, id 28169, seq 113, length 64
00:00:01.305192 IP 10.0.0.1 > 10.0.0.2: ICMP echo request, id 28169, seq 114, length 64
00:00:01.316242 IP 10.0.0.1 > 10.0.0.2: ICMP echo request, id 28169, seq 115, length 64
00:00:01.328446 IP 10.0.0.1 > 10.0.0.2: ICMP echo request, id 28169, seq 116, length 64
00:00:01.340186 IP 10.0.0.1 > 10.0.0.2: ICMP echo request, id 28169, seq 117, length 64
00:00:01.352389 IP 10.0.0.1 > 10.0.0.2: ICMP echo request, id 28169, seq 118, length 64
00:00:01.364157 IP 10.0.0.1 > 10.0.0.2: ICMP echo request, id 28169, seq 119, length 64
00:00:01.377390 IP 10.0.0.1 > 10.0.0.2: ICMP echo request, id 28169, seq 120, length 64
00:00:01.388075 IP 10.0.0.1 > 10.0.0.2: ICMP echo request, id 28169, seq 121, length 64
00:00:01.400309 IP 10.0.0.1 > 10.0.0.2: ICMP echo request, id 28169, seq 122, length 64
00:00:01.412043 IP 10.0.0.1 > 10.0.0.2: ICMP echo request, id 28169, seq 123, length 64
00:00:01.424247 IP 10.0.0.1 > 10.0.0.2: ICMP echo request, id 28169, seq 124, length 64
00:00:01.436002 IP 10.0.0.1 > 10.0.0.2: ICMP echo request, id 28169, seq 125, length 64
00:00:01.449183 IP 10.0.0.1 > 10.0.0.2: ICMP echo request, id 28169, seq 126, length 64
00:00:01.459994 IP 10.0.0.1 > 10.0.0.2: ICMP echo request, id 28169, seq 127, length 64
00:00:01.472742 IP 10.0.0.1 > 10.0.0.2: ICMP echo request, id 28169, seq 128, length 64
00:00:01.484372 IP 10.0.0.1 > 10.0.0.2: ICMP echo request, id 28169, seq 129, length 64
00:00:01.496110 IP 10.0.0.1 > 10.0.0.2: ICMP echo request, id 28169, seq 130, length 64
00:00:01.508323 IP 10.0.0.1 > 10.0.0.2: ICMP echo request, id 28169, seq 131, length 64
00:00:01.520066 IP 10.0.0.1 > 10.0.0.2: ICMP echo request, id 28169, seq 132, length 64
00:00:01.532265 IP 10.0.0.1 > 10.0.0.2: ICMP echo request, id 28169, seq 133, length 64
00:00:01.544491 IP 10.0.0.1 > 10.0.0.2: ICMP echo request, id 28169, seq 134, length 64
00:00:01.556365 IP 10.0.0.1 > 10.0.0.2: ICMP echo request, id 28169, seq 135, length 64
00:00:01.568974 IP 10.0.0.1 > 10.0.0.2: ICMP echo request, id 28169, seq 136, length 64
00:00:01.580172 IP 10.0.0.1 > 10.0.0.2: ICMP echo request, id 28169, seq 137, length 64
00:00:01.591981 IP 10.0.0.1 > 10.0.0.2: ICMP echo request, id 28169, seq 138, length 64
00:00:01.604138 IP 10.0.0.1 > 10.0.0.2: ICMP echo request, id 28169, seq 139, length 64
00:00:01.616337 IP 10.0.0.1 > 10.0.0.2: ICMP echo request, id 28169, seq 140, length 64
00:00:01.628087 IP 10.0.0.1 > 10.0.0.2: ICMP echo request, id 28169, seq 141, length 64
00:00:01.640337 IP 10.0.0.1 > 10.0.0.2: ICMP echo request, id 28169, seq 142, length 64
00:00:01.653033 IP 10.0.0.1 > 10.0.0.2: ICMP echo request, id 28169, seq 143, length 64
00:00:01.664250 IP 10.0.0.1 > 10.0.0.2: ICMP echo request, id 28169, seq 144, length 64
00:00:01.676016 IP 10.0.0.1 > 10.0.0.2: ICMP echo request, id 28169, seq 145, length 64
00:00:01.688198 IP 10.0.0.1 > 10.0.0.2: ICMP echo request, id 28169, seq 146, length 64
00:00:01.700444 IP 10.0.0.1 > 10.0.0.2: ICMP echo request, id 28169, seq 147, length 64
00:00:01.712177 IP 10.0.0.1 > 10.0.0.2: ICMP echo request, id 28169, seq 148, length 64
00:00:01.723989 IP 10.0.0.1 > 10.0.0.2: ICMP echo request, id 28169, seq 149, length 64
00:00:01.736090 IP 10.0.0.1 > 10.0.0.2: ICMP echo request, id 28169, seq 150, length 64
00:00:01.747985 IP 10.0.0.1 > 10.0.0.2: ICMP echo request, id 28169, seq 151, length 64
00:00:01.760095 IP 10.0.0.1 > 10.0.0.2: ICMP echo request, id 28169, seq 152, length 64
00:00:01.776166 IP 10.0.0.1 > 10.0.0.2: ICMP echo request, id 28169, seq 153, length 64
00:00:01.787990 IP 10.0.0.1 > 10.0.0.2: ICMP echo request, id 28169, seq 154, length 64
00:00:01.800171 IP 10.0.0.1 > 10.0.0.2: ICMP echo request, id 28169, seq 155, length 64
00:00:01.811982 IP 10.0.0.1 > 10.0.0.2: ICMP echo request, id 28169, seq 156, length 64
00:00:01.825541 IP 10.0.0.1 > 10.0.0.2: ICMP echo request, id 28169, seq 157, length 64
00:00:01.836295 IP 10.0.0.1 > 10.0.0.2: ICMP echo request, id 28169, seq 158, length 64
00:00:01.849514 IP 10.0.0.1 > 10.0.0.2: ICMP echo request, id 28169, seq 159, length 64
00:00:01.860258 IP 10.0.0.1 > 10.0.0.2: ICMP echo request, id 28169, seq 160, length 64
00:00:01.871999 IP 10.0.0.1 > 10.0.0.2: ICMP echo request, id 28169, seq 161, length 64
00:00:01.884215 IP 10.0.0.1 > 10.0.0.2: ICMP echo request, id 28169, seq 162, length 64
00:00:01.896006 IP 10.0.0.1 > 10.0.0.2: ICMP echo request, id 28169, seq 163, length 64
00:00:01.908163 IP 10.0.0.1 > 10.0.0.2: ICMP echo request, id 28169, seq 164, length 64
00:00:01.919986 IP 10.0.0.1 > 10.0.0.2: ICMP echo request, id 28169, seq 165, length 64
00:00:01.932139 IP 10.0.0.1 > 10.0.0.2: ICMP echo request, id 28169, seq 166, length 64
00:00:01.971664 IP 10.0.0.1 > 10.0.0.2: ICMP echo request, id 28169, seq 169, length 64
00:00:01.978764 IP 10.0.0.1 > 10.0.0.2: ICMP echo request, id 28169, seq 170, length 64
00:00:01.988284 IP 10.0.0.1 > 10.0.0.2: ICMP echo request, id 28169, seq 171, length 64
00:00:02.000062 IP 10.0.0.1 > 10.0.0.2: ICMP echo request, id 28169, seq 172, length 64
00:00:02.012306 IP 10.0.0.1 > 10.0.0.2: ICMP echo request, id 28169, seq 173, length 64
00:00:02.024017 IP 10.0.0.1 > 10.0.0.2: ICMP echo request, id 28169, seq 174, length 64
00:00:02.036221 IP 10.0.0.1 > 10.0.0.2: ICMP echo request, id 28169, seq 175, length 64
00:00:02.048024 IP 10.0.0.1 > 10.0.0.2: ICMP echo request, id 28169, seq 176, length 64
00:00:02.060189 IP 10.0.0.1 > 10.0.0.2: ICMP echo request, id 28169, seq 177, length 64
00:00:02.072908 IP 10.0.0.1 > 10.0.0.2: ICMP echo request, id 28169, seq 178, length 64
00:00:02.084132 IP 10.0.0.1 > 10.0.0.2: ICMP echo request, id 28169, seq 179, length 64
00:00:02.096356 IP 10.0.0.1 > 10.0.0.2: ICMP echo request, id 28169, seq 180, length 64
00:00:02.108092 IP 10.0.0.1 > 10.0.0.2: ICMP echo request, id 28169, seq 181, length 64
00:00:02.120332 IP 10.0.0.1 > 10.0.0.2: ICMP echo request, id 28169, seq 182, length 64
00:00:02.132048 IP 10.0.0.1 > 10.0.0.2: ICMP echo request, id 28169, seq 183, length 64
00:00:02.144300 IP 10.0.0.1 > 10.0.0.2: ICMP echo request, id 28169, seq 184, length 64
00:00:02.156005 IP 10.0.0.1 > 10.0.0.2: ICMP echo request, id 28169, seq 185, length 64
00:00:02.168237 IP 10.0.0.1 > 10.0.0.2: ICMP echo request, id 28169, seq 186, length 64
00:00:02.180017 IP 10.0.0.1 > 10.0.0.2: ICMP echo request, id 28169, seq 187, length 64
00:00:02.193673 IP 10.0.0.1 > 10.0.0.2: ICMP echo request, id 28169, seq 188, length 64
00:00:02.204394 IP 10.0.0.1 > 10.0.0.2: ICMP echo request, id 28169, seq 189, length 64
00:00:02.216137 IP 10.0.0.1 > 10.0.0.2: ICMP echo request, id 28169, seq 190, length 64
00:00:02.228417 IP 10.0.0.1 > 10.0.0.2: ICMP echo request, id 28169, seq 191, length 64
00:00:02.240116 IP 10.0.0.1 > 10.0.0.2: ICMP echo request, id 28169, seq 192, length 64
00:00:02.252340 IP 10.0.0.1 > 10.0.0.2: ICMP echo request, id 28169, seq 193, length 64
00:00:02.264054 IP 10.0.0.1 > 10.0.0.2: ICMP echo request, id 28169, seq 194, length 64
00:00:02.276004 IP 10.0.0.1 > 10.0.0.2: ICMP echo request, id 28169, seq 195, length 64
00:00:02.288025 IP 10.0.0.1 > 10.0.0.2: ICMP echo request, id 28169, seq 196, length 64
00:00:02.300229 IP 10.0.0.1 > 10.0.0.2: ICMP echo request, id 28169, seq 197, length 64
00:00:02.312435 IP 10.0.0.1 > 10.0.0.2: ICMP echo request, id 28169, seq 198, length 64
00:00:02.327108 IP 10.0.0.1 > 10.0.0.2: ICMP echo request, id 28169, seq 199, length 64
00:00:02.337108 IP 10.0.0.1 > 10.0.0.2: ICMP echo request, id 28169, seq 200, length 64
00:00:02.348114 IP 10.0.0.1 > 10.0.0.2: ICMP echo request, id 28169, seq 201, length 64
00:00:02.360322 IP 10.0.0.1 > 10.0.0.2: ICMP echo request, id 28169, seq 202, length 64
00:00:02.372075 IP 10.0.0.1 > 10.0.0.2: ICMP echo request, id 28169, seq 203, length 64
00:00:02.384287 IP 10.0.0.1 > 10.0.0.2: ICMP echo request, id 28169, seq 204, length 64
00:00:02.397531 IP 10.0.0.1 > 10.0.0.2: ICMP echo request, id 28169, seq 205, length 64
00:00:02.408004 IP 10.0.0.1 > 10.0.0.2: ICMP echo request, id 28169, seq 206, length 64
00:00:02.420951 IP 10.0.0.1 > 10.0.0.2: ICMP echo request, id 28169, seq 207, length 64
00:00:02.432162 IP 10.0.0.1 > 10.0.0.2: ICMP echo request, id 28169, seq 208, length 64
00:00:02.446353 IP 10.0.0.1 > 10.0.0.2: ICMP echo request, id 28169, seq 209, length 64
00:00:02.456351 IP 10.0.0.1 > 10.0.0.2: ICMP echo request, id 28169, seq 210, length 64
00:00:02.468827 IP 10.0.0.1 > 10.0.0.2: ICMP echo request, id 28169, seq 211, length 64
00:00:02.480076 IP 10.0.0.1 > 10.0.0.2: ICMP echo request, id 28169, seq 212, length 64
00:00:02.493327 IP 10.0.0.1 > 10.0.0.2: ICMP echo request, id 28169, seq 213, length 64
00:00:02.504030 IP 10.0.0.1 > 10.0.0.2: ICMP echo request, id 28169, seq 214, length 64
00:00:02.516255 IP 10.0.0.1 > 10.0.0.2: ICMP echo request, id 28169, seq 215, length 64
00:00:02.528476 IP 10.0.0.1 > 10.0.0.2: ICMP echo request, id 28169, seq 216, length 64
00:00:02.540237 IP 10.0.0.1 > 10.0.0.2: ICMP echo request, id 28169, seq 217, length 64
00:00:02.552014 IP 10.0.0.1 > 10.0.0.2: ICMP echo request, id 28169, seq 218, length 64
00:00:02.564145 IP 10.0.0.1 > 10.0.0.2: ICMP echo request, id 28169, seq 219, length 64
00:00:02.576404 IP 10.0.0.1 > 10.0.0.2: ICMP echo request, id 28169, seq 220, length 64
00:00:02.588123 IP 10.0.0.1 > 10.0.0.2: ICMP echo request, id 28169, seq 221, length 64
00:00:02.600004 IP 10.0.0.1 > 10.0.0.2: ICMP echo request, id 28169, seq 222, length 64
00:00:02.612058 IP 10.0.0.1 > 10.0.0.2: ICMP echo request, id 28169, seq 223, length 64
00:00:02.624299 IP 10.0.0.1 > 10.0.0.2: ICMP echo request, id 28169, seq 224, length 64
00:00:02.636024 IP 10.0.0.1 > 10.0.0.2: ICMP echo request, id 28169, seq 225, length 64
00:00:02.648210 IP 10.0.0.1 > 10.0.0.2: ICMP echo request, id 28169, seq 226, length 64
00:00:02.660431 IP 10.0.0.1 > 10.0.0.2: ICMP echo request, id 28169, seq 227, length 64
00:00:02.672194 IP 10.0.0.1 > 10.0.0.2: ICMP echo request, id 28169, seq 228, length 64
00:00:02.684428 IP 10.0.0.1 > 10.0.0.2: ICMP echo request, id 28169, seq 229, length 64
00:00:02.696132 IP 10.0.0.1 > 10.0.0.2: ICMP echo request, id 28169, seq 230, length 64
00:00:02.708356 IP 10.0.0.1 > 10.0.0.2: ICMP echo request, id 28169, seq 231, length 64
00:00:02.723552 IP 10.0.0.1 > 10.0.0.2: ICMP echo request, id 28169, seq 232, length 64
00:00:02.733552 IP 10.0.0.1 > 10.0.0.2: ICMP echo request, id 28169, seq 233, length 64
00:00:02.745002 IP 10.0.0.1 > 10.0.0.2: ICMP echo request, id 28169, seq 234, length 64
00:00:02.756266 IP 10.0.0.1 > 10.0.0.2: ICMP echo request, id 28169, seq 235, length 64
00:00:02.770469 IP 10.0.0.1 > 10.0.0.2: ICMP echo request, id 28169, seq 236, length 64
00:00:02.780460 IP 10.0.0.1 > 10.0.0.2: ICMP echo request, id 28169, seq 237, length 64
