00:00:00.000000 IP 10.0.0.1 > 10.0.0.2: ICMP echo request, id 32511, seq 6, length 64
00:00:00.011267 IP 10.0.0.1 > 10.0.0.2: ICMP echo request, id 32511, seq 7, length 64
00:00:00.023072 IP 10.0.0.1 > 10.0.0.2: ICMP echo request, id 32511, seq 8, length 64
00:00:00.035244 IP 10.0.0.1 > 10.0.0.2: ICMP echo request, id 32511, seq 9, length 64
00:00:00.047022 IP 10.0.0.1 > 10.0.0.2: ICMP echo request, id 32511, seq 10, length 64
00:00:00.059885 IP 10.0.0.1 > 10.0.0.2: ICMP echo request, id 32511, seq 11, length 64
00:00:00.070929 IP 10.0.0.1 > 10.0.0.2: ICMP echo request, id 32511, seq 12, length 64
00:00:00.084219 IP 10.0.0.1 > 10.0.0.2: ICMP echo request, id 32511, seq 13, length 64
00:00:00.094890 IP 10.0.0.1 > 10.0.0.2: ICMP echo request, id 32511, seq 14, length 64
00:00:00.110977 IP 10.0.0.1 > 10.0.0.2: ICMP echo request, id 32511, seq 15, length 64
00:00:00.124191 IP 10.0.0.1 > 10.0.0.2: ICMP echo request, id 32511, seq 16, length 64
00:00:00.135434 IP 10.0.0.1 > 10.0.0.2: ICMP echo request, id 32511, seq 17, length 64
00:00:00.147155 IP 10.0.0.1 > 10.0.0.2: ICMP echo request, id 32511, seq 18, length 64
00:00:00.160915 IP 10.0.0.1 > 10.0.0.2: ICMP echo request, id 32511, seq 19, length 64
00:00:00.171630 IP 10.0.0.1 > 10.0.0.2: ICMP echo request, id 32511, seq 20, length 64
00:00:00.183368 IP 10.0.0.1 > 10.0.0.2: ICMP echo request, id 32511, seq 21, length 64
00:00:00.195100 IP 10.0.0.1 > 10.0.0.2: ICMP echo request, id 32511, seq 22, length 64
00:00:00.207324 IP 10.0.0.1 > 10.0.0.2: ICMP echo request, id 32511, seq 23, length 64
00:00:00.219577 IP 10.0.0.1 > 10.0.0.2: ICMP echo request, id 32511, seq 24, length 64
00:00:00.233597 IP 10.0.0.1 > 10.0.0.2: ICMP echo request, id 32511, seq 25, length 64
00:00:00.244416 IP 10.0.0.1 > 10.0.0.2: ICMP echo request, id 32511, seq 26, length 64
00:00:00.255243 IP 10.0.0.1 > 10.0.0.2: ICMP echo request, id 32511, seq 27, length 64
00:00:00.266917 IP 10.0.0.1 > 10.0.0.2: ICMP echo request, id 32511, seq 28, length 64
00:00:00.279215 IP 10.0.0.1 > 10.0.0.2: ICMP echo request, id 32511, seq 29, length 64
00:00:00.290918 IP 10.0.0.1 > 10.0.0.2: ICMP echo request, id 32511, seq 30, length 64
00:00:00.303755 IP 10.0.0.1 > 10.0.0.2: ICMP echo request, id 32511, seq 31, length 64
00:00:00.314852 IP 10.0.0.1 > 10.0.0.2: ICMP echo request, id 32511, seq 32, length 64
00:00:00.327062 IP 10.0.0.1 > 10.0.0.2: ICMP echo request, id 32511, seq 33, length 64
00:00:00.339346 IP 10.0.0.1 > 10.0.0.2: ICMP echo request, id 32511, seq 34, length 64
00:00:00.351005 IP 10.0.0.1 > 10.0.0.2: ICMP echo request, id 32511, seq 35, length 64
00:00:00.362786 IP 10.0.0.1 > 10.0.0.2: ICMP echo request, id 32511, seq 36, length 64
00:00:00.374887 IP 10.0.0.1 > 10.0.0.2: ICMP echo request, id 32511, seq 37, length 64
00:00:00.387238 IP 10.0.0.1 > 10.0.0.2: ICMP echo request, id 32511, seq 38, length 64
00:00:00.398950 IP 10.0.0.1 > 10.0.0.2: ICMP echo request, id 32511, seq 39, length 64
00:00:00.411069 IP 10.0.0.1 > 10.0.0.2: ICMP echo request, id 32511, seq 40, length 64
00:00:00.422886 IP 10.0.0.1 > 10.0.0.2: ICMP echo request, id 32511, seq 41, length 64
00:00:00.435116 IP 10.0.0.1 > 10.0.0.2: ICMP echo request, id 32511, seq 42, length 64
00:00:00.450776 IP 10.0.0.1 > 10.0.0.2: ICMP echo request, id 32511, seq 43, length 64
00:00:00.462974 IP 10.0.0.1 > 10.0.0.2: ICMP echo request, id 32511, seq 44, length 64
00:00:00.475698 IP 10.0.0.1 > 10.0.0.2: ICMP echo request, id 32511, seq 45, length 64
00:00:00.486923 IP 10.0.0.1 > 10.0.0.2: ICMP echo request, id 32511, seq 46, length 64
00:00:00.499382 IP 10.0.0.1 > 10.0.0.2: ICMP echo request, id 32511, seq 47, length 64
00:00:00.511460 IP 10.0.0.1 > 10.0.0.2: ICMP echo request, id 32511, seq 48, length 64
00:00:00.522764 IP 10.0.0.1 > 10.0.0.2: ICMP echo request, id 32511, seq 49, length 64
00:00:00.534881 IP 10.0.0.1 > 10.0.0.2: ICMP echo request, id 32511, seq 50, length 64
00:00:00.547024 IP 10.0.0.1 > 10.0.0.2: ICMP echo request, id 32511, seq 51, length 64
00:00:00.559308 IP 10.0.0.1 > 10.0.0.2: ICMP echo request, id 32511, seq 52, length 64
00:00:00.571528 IP 10.0.0.1 > 10.0.0.2: ICMP echo request, id 32511, seq 53, length 64
00:00:00.586232 IP 10.0.0.1 > 10.0.0.2: ICMP echo request, id 32511, seq 54, length 64
00:00:00.596221 IP 10.0.0.1 > 10.0.0.2: ICMP echo request, id 32511, seq 55, length 64
00:00:00.607773 IP 10.0.0.1 > 10.0.0.2: ICMP echo request, id 32511, seq 56, length 64
00:00:00.618948 IP 10.0.0.1 > 10.0.0.2: ICMP echo request, id 32511, seq 57, length 64
00:00:00.631126 IP 10.0.0.1 > 10.0.0.2: ICMP echo request, id 32511, seq 58, length 64
00:00:00.643336 IP 10.0.0.1 > 10.0.0.2: ICMP echo request, id 32511, seq 59, length 64
00:00:00.658508 IP 10.0.0.1 > 10.0.0.2: ICMP echo request, id 32511, seq 60, length 64
00:00:00.671805 IP 10.0.0.1 > 10.0.0.2: ICMP echo request, id 32511, seq 61, length 64
00:00:00.685835 IP 10.0.0.1 > 10.0.0.2: ICMP echo request, id 32511, seq 62, length 64
00:00:00.695826 IP 10.0.0.1 > 10.0.0.2: ICMP echo request, id 32511, seq 63, length 64
00:00:00.706849 IP 10.0.0.1 > 10.0.0.2: ICMP echo request, id 32511, seq 64, length 64
00:00:00.719567 IP 10.0.0.1 > 10.0.0.2: ICMP echo request, id 32511, seq 65, length 64
00:00:00.733282 IP 10.0.0.1 > 10.0.0.2: ICMP echo request, id 32511, seq 66, length 64
00:00:00.746475 IP 10.0.0.1 > 10.0.0.2: ICMP echo request, id 32511, seq 67, length 64
00:00:00.756694 IP 10.0.0.1 > 10.0.0.2: ICMP echo request, id 32511, seq 68, length 64
00:00:00.766986 IP 10.0.0.1 > 10.0.0.2: ICMP echo request, id 32511, seq 69, length 64
00:00:00.783102 IP 10.0.0.1 > 10.0.0.2: ICMP echo request, id 32511, seq 70, length 64
00:00:00.795804 IP 10.0.0.1 > 10.0.0.2: ICMP echo request, id 32511, seq 71, length 64
00:00:00.809037 IP 10.0.0.1 > 10.0.0.2: ICMP echo request, id 32511, seq 72, length 64
00:00:00.819811 IP 10.0.0.1 > 10.0.0.2: ICMP echo request, id 32511, seq 73, length 64
00:00:00.831971 IP 10.0.0.1 > 10.0.0.2: ICMP echo request, id 32511, seq 74, length 64
00:00:00.846246 IP 10.0.0.1 > 10.0.0.2: ICMP echo request, id 32511, seq 75, length 64
00:00:00.856931 IP 10.0.0.1 > 10.0.0.2: ICMP echo request, id 32511, seq 76, length 64
00:00:00.866932 IP 10.0.0.1 > 10.0.0.2: ICMP echo request, id 32511, seq 77, length 64
00:00:00.879404 IP 10.0.0.1 > 10.0.0.2: ICMP echo request, id 32511, seq 78, length 64
00:00:00.894066 IP 10.0.0.1 > 10.0.0.2: ICMP echo request, id 32511, seq 79, length 64
00:00:00.904064 IP 10.0.0.1 > 10.0.0.2: ICMP echo request, id 32511, seq 80, length 64
00:00:00.915092 IP 10.0.0.1 > 10.0.0.2: ICMP echo request, id 32511, seq 81, length 64
00:00:00.928306 IP 10.0.0.1 > 10.0.0.2: ICMP echo request, id 32511, seq 82, length 64
00:00:00.941484 IP 10.0.0.1 > 10.0.0.2: ICMP echo request, id 32511, seq 83, length 64
00:00:00.951746 IP 10.0.0.1 > 10.0.0.2: ICMP echo request, id 32511, seq 84, length 64
00:00:00.966888 IP 10.0.0.1 > 10.0.0.2: ICMP echo request, id 32511, seq 85, length 64
00:00:00.984003 IP 10.0.0.1 > 10.0.0.2: ICMP echo request, id 32511, seq 86, length 64
00:00:00.994786 IP 10.0.0.1 > 10.0.0.2: ICMP echo request, id 32511, seq 87, length 64
00:00:01.007007 IP 10.0.0.1 > 10.0.0.2: ICMP echo request, id 32511, seq 88, length 64
00:00:01.020641 IP 10.0.0.1 > 10.0.0.2: ICMP echo request, id 32511, seq 89, length 64
00:00:01.031386 IP 10.0.0.1 > 10.0.0.2: ICMP echo request, id 32511, seq 90, length 64
00:00:01.043643 IP 10.0.0.1 > 10.0.0.2: ICMP echo request, id 32511, seq 91, length 64
00:00:01.055377 IP 10.0.0.1 > 10.0.0.2: ICMP echo request, id 32511, seq 92, length 64
00:00:01.069098 IP 10.0.0.1 > 10.0.0.2: ICMP echo request, id 32511, seq 93, length 64
00:00:01.079833 IP 10.0.0.1 > 10.0.0.2: ICMP echo request, id 32511, seq 94, length 64
00:00:01.092060 IP 10.0.0.1 > 10.0.0.2: ICMP echo request, id 32511, seq 95, length 64
00:00:01.104221 IP 10.0.0.1 > 10.0.0.2: ICMP echo request, id 32511, seq 96, length 64
00:00:01.115043 IP 10.0.0.1 > 10.0.0.2: ICMP echo request, id 32511, seq 97, length 64
00:00:01.127101 IP 10.0.0.1 > 10.0.0.2: ICMP echo request, id 32511, seq 98, length 64
00:00:01.139000 IP 10.0.0.1 > 10.0.0.2: ICMP echo request, id 32511, seq 99, length 64
00:00:01.150897 IP 10.0.0.1 > 10.0.0.2: ICMP echo request, id 32511, seq 100, length 64
00:00:01.163476 IP 10.0.0.1 > 10.0.0.2: ICMP echo request, id 32511, seq 101, length 64
00:00:01.175143 IP 10.0.0.1 > 10.0.0.2: ICMP echo request, id 32511, seq 102, length 64
00:00:01.188336 IP 10.0.0.1 > 10.0.0.2: ICMP echo request, id 32511, seq 103, length 64
00:00:01.201062 IP 10.0.0.1 > 10.0.0.2: ICMP echo request, id 32511, seq 104, length 64
00:00:01.214865 IP 10.0.0.1 > 10.0.0.2: ICMP echo request, id 32511, seq 105, length 64
00:00:01.226934 IP 10.0.0.1 > 10.0.0.2: ICMP echo request, id 32511, seq 106, length 64
00:00:01.238781 IP 10.0.0.1 > 10.0.0.2: ICMP echo request, id 32511, seq 107, length 64
00:00:01.252879 IP 10.0.0.1 > 10.0.0.2: ICMP echo request, id 32511, seq 108, length 64
00:00:01.263088 IP 10.0.0.1 > 10.0.0.2: ICMP echo request, id 32511, seq 109, length 64
00:00:01.275828 IP 10.0.0.1 > 10.0.0.2: ICMP echo request, id 32511, seq 110, length 64
00:00:01.287078 IP 10.0.0.1 > 10.0.0.2: ICMP echo request, id 32511, seq 111, length 64
00:00:01.299198 IP 10.0.0.1 > 10.0.0.2: ICMP echo request, id 32511, seq 112, length 64
00:00:01.311108 IP 10.0.0.1 > 10.0.0.2: ICMP echo request, id 32511, seq 113, length 64
00:00:01.322869 IP 10.0.0.1 > 10.0.0.2: ICMP echo request, id 32511, seq 114, length 64
00:00:01.338440 IP 10.0.0.1 > 10.0.0.2: ICMP echo request, id 32511, seq 115, length 64
00:00:01.348435 IP 10.0.0.1 > 10.0.0.2: ICMP echo request, id 32511, seq 116, length 64
00:00:01.359436 IP 10.0.0.1 > 10.0.0.2: ICMP echo request, id 32511, seq 117, length 64
00:00:01.371624 IP 10.0.0.1 > 10.0.0.2: ICMP echo request, id 32511, seq 118, length 64
00:00:01.384850 IP 10.0.0.1 > 10.0.0.2: ICMP echo request, id 32511, seq 119, length 64
00:00:01.394855 IP 10.0.0.1 > 10.0.0.2: ICMP echo request, id 32511, seq 120, length 64
00:00:01.406853 IP 10.0.0.1 > 10.0.0.2: ICMP echo request, id 32511, seq 121, length 64
00:00:01.418722 IP 10.0.0.1 > 10.0.0.2: ICMP echo request, id 32511, seq 122, length 64
00:00:01.430756 IP 10.0.0.1 > 10.0.0.2: ICMP echo request, id 32511, seq 123, length 64
00:00:01.445901 IP 10.0.0.1 > 10.0.0.2: ICMP echo request, id 32511, seq 124, length 64
00:00:01.455895 IP 10.0.0.1 > 10.0.0.2: ICMP echo request, id 32511, seq 125, length 64
00:00:01.466946 IP 10.0.0.1 > 10.0.0.2: ICMP echo request, id 32511, seq 126, length 64
00:00:01.479166 IP 10.0.0.1 > 10.0.0.2: ICMP echo request, id 32511, seq 127, length 64
00:00:01.491899 IP 10.0.0.1 > 10.0.0.2: ICMP echo request, id 32511, seq 128, length 64
00:00:01.503128 IP 10.0.0.1 > 10.0.0.2: ICMP echo request, id 32511, seq 129, length 64
00:00:01.516351 IP 10.0.0.1 > 10.0.0.2: ICMP echo request, id 32511, seq 130, length 64
00:00:01.527854 IP 10.0.0.1 > 10.0.0.2: ICMP echo request, id 32511, seq 131, length 64
00:00:01.538792 IP 10.0.0.1 > 10.0.0.2: ICMP echo request, id 32511, seq 132, length 64
00:00:01.552481 IP 10.0.0.1 > 10.0.0.2: ICMP echo request, id 32511, seq 133, length 64
00:00:01.563231 IP 10.0.0.1 > 10.0.0.2: ICMP echo request, id 32511, seq 134, length 64
00:00:01.574981 IP 10.0.0.1 > 10.0.0.2: ICMP echo request, id 32511, seq 135, length 64
00:00:01.587169 IP 10.0.0.1 > 10.0.0.2: ICMP echo request, id 32511, seq 136, length 64
00:00:01.598921 IP 10.0.0.1 > 10.0.0.2: ICMP echo request, id 32511, seq 137, length 64
00:00:01.611137 IP 10.0.0.1 > 10.0.0.2: ICMP echo request, id 32511, seq 138, length 64
00:00:01.623846 IP 10.0.0.1 > 10.0.0.2: ICMP echo request, id 32511, seq 139, length 64
00:00:01.635107 IP 10.0.0.1 > 10.0.0.2: ICMP echo request, id 32511, seq 140, length 64
00:00:01.646843 IP 10.0.0.1 > 10.0.0.2: ICMP echo request, id 32511, seq 141, length 64
00:00:01.660057 IP 10.0.0.1 > 10.0.0.2: ICMP echo request, id 32511, seq 142, length 64
00:00:01.671296 IP 10.0.0.1 > 10.0.0.2: ICMP echo request, id 32511, seq 143, length 64
00:00:01.683978 IP 10.0.0.1 > 10.0.0.2: ICMP echo request, id 32511, seq 144, length 64
00:00:01.696181 IP 10.0.0.1 > 10.0.0.2: ICMP echo request, id 32511, seq 145, length 64
00:00:01.710359 IP 10.0.0.1 > 10.0.0.2: ICMP echo request, id 32511, seq 146, length 64
00:00:01.720356 IP 10.0.0.1 > 10.0.0.2: ICMP echo request, id 32511, seq 147, length 64
00:00:01.731394 IP 10.0.0.1 > 10.0.0.2: ICMP echo request, id 32511, seq 148, length 64
00:00:01.746072 IP 10.0.0.1 > 10.0.0.2: ICMP echo request, id 32511, seq 149, length 64
00:00:01.758318 IP 10.0.0.1 > 10.0.0.2: ICMP echo request, id 32511, seq 150, length 64
00:00:01.767645 IP 10.0.0.1 > 10.0.0.2: ICMP echo request, id 32511, seq 151, length 64
00:00:01.779303 IP 10.0.0.1 > 10.0.0.2: ICMP echo request, id 32511, seq 152, length 64
00:00:01.794955 IP 10.0.0.1 > 10.0.0.2: ICMP echo request, id 32511, seq 153, length 64
00:00:01.809161 IP 10.0.0.1 > 10.0.0.2: ICMP echo request, id 32511, seq 154, length 64
00:00:01.819155 IP 10.0.0.1 > 10.0.0.2: ICMP echo request, id 32511, seq 155, length 64
00:00:01.831623 IP 10.0.0.1 > 10.0.0.2: ICMP echo request, id 32511, seq 156, length 64
00:00:01.845804 IP 10.0.0.1 > 10.0.0.2: ICMP echo request, id 32511, seq 157, length 64
00:00:01.857996 IP 10.0.0.1 > 10.0.0.2: ICMP echo request, id 32511, seq 158, length 64
00:00:01.867996 IP 10.0.0.1 > 10.0.0.2: ICMP echo request, id 32511, seq 159, length 64
00:00:01.883899 IP 10.0.0.1 > 10.0.0.2: ICMP echo request, id 32511, seq 160, length 64
00:00:01.900043 IP 10.0.0.1 > 10.0.0.2: ICMP echo request, id 32511, seq 161, length 64
00:00:01.910768 IP 10.0.0.1 > 10.0.0.2: ICMP echo request, id 32511, seq 162, length 64
00:00:01.923972 IP 10.0.0.1 > 10.0.0.2: ICMP echo request, id 32511, seq 163, length 64
00:00:01.964042 IP 10.0.0.1 > 10.0.0.2: ICMP echo request, id 32511, seq 166, length 64
00:00:01.972469 IP 10.0.0.1 > 10.0.0.2: ICMP echo request, id 32511, seq 167, length 64
00:00:01.981559 IP 10.0.0.1 > 10.0.0.2: ICMP echo request, id 32511, seq 168, length 64
00:00:01.991439 IP 10.0.0.1 > 10.0.0.2: ICMP echo request, id 32511, seq 169, length 64
00:00:02.005138 IP 10.0.0.1 > 10.0.0.2: ICMP echo request, id 32511, seq 170, length 64
00:00:02.015136 IP 10.0.0.1 > 10.0.0.2: ICMP echo request, id 32511, seq 171, length 64
00:00:02.028143 IP 10.0.0.1 > 10.0.0.2: ICMP echo request, id 32511, seq 172, length 64
00:00:02.038734 IP 10.0.0.1 > 10.0.0.2: ICMP echo request, id 32511, seq 173, length 64
00:00:02.051638 IP 10.0.0.1 > 10.0.0.2: ICMP echo request, id 32511, seq 174, length 64
00:00:02.062833 IP 10.0.0.1 > 10.0.0.2: ICMP echo request, id 32511, seq 175, length 64
00:00:02.075066 IP 10.0.0.1 > 10.0.0.2: ICMP echo request, id 32511, seq 176, length 64
00:00:02.088736 IP 10.0.0.1 > 10.0.0.2: ICMP echo request, id 32511, seq 177, length 64
00:00:02.098971 IP 10.0.0.1 > 10.0.0.2: ICMP echo request, id 32511, seq 178, length 64
00:00:02.111243 IP 10.0.0.1 > 10.0.0.2: ICMP echo request, id 32511, seq 179, length 64
00:00:02.122920 IP 10.0.0.1 > 10.0.0.2: ICMP echo request, id 32511, seq 180, length 64
00:00:02.134743 IP 10.0.0.1 > 10.0.0.2: ICMP echo request, id 32511, seq 181, length 64
00:00:02.146942 IP 10.0.0.1 > 10.0.0.2: ICMP echo request, id 32511, seq 182, length 64
00:00:02.159126 IP 10.0.0.1 > 10.0.0.2: ICMP echo request, id 32511, seq 183, length 64
00:00:02.171046 IP 10.0.0.1 > 10.0.0.2: ICMP echo request, id 32511, seq 184, length 64
00:00:02.184084 IP 10.0.0.1 > 10.0.0.2: ICMP echo request, id 32511, seq 185, length 64
00:00:02.194772 IP 10.0.0.1 > 10.0.0.2: ICMP echo request, id 32511, seq 186, length 64
00:00:02.207984 IP 10.0.0.1 > 10.0.0.2: ICMP echo request, id 32511, seq 187, length 64
00:00:02.218757 IP 10.0.0.1 > 10.0.0.2: ICMP echo request, id 32511, seq 188, length 64
00:00:02.230971 IP 10.0.0.1 > 10.0.0.2: ICMP echo request, id 32511, seq 189, length 64
00:00:02.242720 IP 10.0.0.1 > 10.0.0.2: ICMP echo request, id 32511, seq 190, length 64
00:00:02.257362 IP 10.0.0.1 > 10.0.0.2: ICMP echo request, id 32511, seq 191, length 64
00:00:02.267361 IP 10.0.0.1 > 10.0.0.2: ICMP echo request, id 32511, seq 192, length 64
00:00:02.278898 IP 10.0.0.1 > 10.0.0.2: ICMP echo request, id 32511, seq 193, length 64
00:00:02.293060 IP 10.0.0.1 > 10.0.0.2: ICMP echo request, id 32511, seq 194, length 64
00:00:02.303827 IP 10.0.0.1 > 10.0.0.2: ICMP echo request, id 32511, seq 195, length 64
00:00:02.315067 IP 10.0.0.1 > 10.0.0.2: ICMP echo request, id 32511, seq 196, length 64
00:00:02.326810 IP 10.0.0.1 > 10.0.0.2: ICMP echo request, id 32511, seq 197, length 64
00:00:02.341936 IP 10.0.0.1 > 10.0.0.2: ICMP echo request, id 32511, seq 198, length 64
00:00:02.351931 IP 10.0.0.1 > 10.0.0.2: ICMP echo request, id 32511, seq 199, length 64
00:00:02.363435 IP 10.0.0.1 > 10.0.0.2: ICMP echo request, id 32511, seq 200, length 64
00:00:02.375206 IP 10.0.0.1 > 10.0.0.2: ICMP echo request, id 32511, seq 201, length 64
00:00:02.386872 IP 10.0.0.1 > 10.0.0.2: ICMP echo request, id 32511, seq 202, length 64
00:00:02.399141 IP 10.0.0.1 > 10.0.0.2: ICMP echo request, id 32511, seq 203, length 64
00:00:02.411865 IP 10.0.0.1 > 10.0.0.2: ICMP echo request, id 32511, seq 204, length 64
00:00:02.423294 IP 10.0.0.1 > 10.0.0.2: ICMP echo request, id 32511, seq 205, length 64
00:00:02.435806 IP 10.0.0.1 > 10.0.0.2: ICMP echo request, id 32511, seq 206, length 64
00:00:02.446826 IP 10.0.0.1 > 10.0.0.2: ICMP echo request, id 32511, seq 207, length 64
00:00:02.459253 IP 10.0.0.1 > 10.0.0.2: ICMP echo request, id 32511, seq 208, length 64
00:00:02.472475 IP 10.0.0.1 > 10.0.0.2: ICMP echo request, id 32511, seq 209, length 64
00:00:02.483696 IP 10.0.0.1 > 10.0.0.2: ICMP echo request, id 32511, seq 210, length 64
00:00:02.494932 IP 10.0.0.1 > 10.0.0.2: ICMP echo request, id 32511, seq 211, length 64
00:00:02.507617 IP 10.0.0.1 > 10.0.0.2: ICMP echo request, id 32511, seq 212, length 64
00:00:02.520866 IP 10.0.0.1 > 10.0.0.2: ICMP echo request, id 32511, seq 213, length 64
00:00:02.531090 IP 10.0.0.1 > 10.0.0.2: ICMP echo request, id 32511, seq 214, length 64
00:00:02.543547 IP 10.0.0.1 > 10.0.0.2: ICMP echo request, id 32511, seq 215, length 64
00:00:02.556258 IP 10.0.0.1 > 10.0.0.2: ICMP echo request, id 32511, seq 216, length 64
00:00:02.568261 IP 10.0.0.1 > 10.0.0.2: ICMP echo request, id 32511, seq 217, length 64
00:00:02.579486 IP 10.0.0.1 > 10.0.0.2: ICMP echo request, id 32511, seq 218, length 64
00:00:02.592222 IP 10.0.0.1 > 10.0.0.2: ICMP echo request, id 32511, seq 219, length 64
00:00:02.603174 IP 10.0.0.1 > 10.0.0.2: ICMP echo request, id 32511, seq 220, length 64
00:00:02.615169 IP 10.0.0.1 > 10.0.0.2: ICMP echo request, id 32511, seq 221, length 64
00:00:02.626850 IP 10.0.0.1 > 10.0.0.2: ICMP echo request, id 32511, seq 222, length 64
00:00:02.640583 IP 10.0.0.1 > 10.0.0.2: ICMP echo request, id 32511, seq 223, length 64
00:00:02.650810 IP 10.0.0.1 > 10.0.0.2: ICMP echo request, id 32511, seq 224, length 64
00:00:02.665935 IP 10.0.0.1 > 10.0.0.2: ICMP echo request, id 32511, seq 225, length 64
00:00:02.675914 IP 10.0.0.1 > 10.0.0.2: ICMP echo request, id 32511, seq 226, length 64
00:00:02.687124 IP 10.0.0.1 > 10.0.0.2: ICMP echo request, id 32511, seq 227, length 64
00:00:02.699736 IP 10.0.0.1 > 10.0.0.2: ICMP echo request, id 32511, seq 228, length 64
00:00:02.711431 IP 10.0.0.1 > 10.0.0.2: ICMP echo request, id 32511, seq 229, length 64
00:00:02.722747 IP 10.0.0.1 > 10.0.0.2: ICMP echo request, id 32511, seq 230, length 64
00:00:02.735394 IP 10.0.0.1 > 10.0.0.2: ICMP echo request, id 32511, seq 231, length 64
00:00:02.748607 IP 10.0.0.1 > 10.0.0.2: ICMP echo request, id 32511, seq 232, length 64
00:00:02.763262 IP 10.0.0.1 > 10.0.0.2: ICMP echo request, id 32511, seq 233, length 64
00:00:02.774999 IP 10.0.0.1 > 10.0.0.2: ICMP echo request, id 32511, seq 234, length 64
00:00:02.789151 IP 10.0.0.1 > 10.0.0.2: ICMP echo request, id 32511, seq 235, length 64
00:00:02.799487 IP 10.0.0.1 > 10.0.0.2: ICMP echo request, id 32511, seq 236, length 64
00:00:02.811666 IP 10.0.0.1 > 10.0.0.2: ICMP echo request, id 32511, seq 237, length 64
00:00:02.822898 IP 10.0.0.1 > 10.0.0.2: ICMP echo request, id 32511, seq 238, length 64
