00:00:00.000000 IP 10.0.0.1 > 10.0.0.2: ICMP echo request, id 31017, seq 6, length 64
00:00:00.011667 IP 10.0.0.1 > 10.0.0.2: ICMP echo request, id 31017, seq 7, length 64
00:00:00.023570 IP 10.0.0.1 > 10.0.0.2: ICMP echo request, id 31017, seq 8, length 64
00:00:00.042006 IP 10.0.0.1 > 10.0.0.2: ICMP echo request, id 31017, seq 9, length 64
00:00:00.052000 IP 10.0.0.1 > 10.0.0.2: ICMP echo request, id 31017, seq 10, length 64
00:00:00.063135 IP 10.0.0.1 > 10.0.0.2: ICMP echo request, id 31017, seq 11, length 64
00:00:00.077663 IP 10.0.0.1 > 10.0.0.2: ICMP echo request, id 31017, seq 12, length 64
00:00:00.089423 IP 10.0.0.1 > 10.0.0.2: ICMP echo request, id 31017, seq 13, length 64
00:00:00.100174 IP 10.0.0.1 > 10.0.0.2: ICMP echo request, id 31017, seq 14, length 64
00:00:00.111864 IP 10.0.0.1 > 10.0.0.2: ICMP echo request, id 31017, seq 15, length 64
00:00:00.123150 IP 10.0.0.1 > 10.0.0.2: ICMP echo request, id 31017, seq 16, length 64
00:00:00.137339 IP 10.0.0.1 > 10.0.0.2: ICMP echo request, id 31017, seq 17, length 64
00:00:00.147339 IP 10.0.0.1 > 10.0.0.2: ICMP echo request, id 31017, seq 18, length 64
00:00:00.158902 IP 10.0.0.1 > 10.0.0.2: ICMP echo request, id 31017, seq 19, length 64
00:00:00.171090 IP 10.0.0.1 > 10.0.0.2: ICMP echo request, id 31017, seq 20, length 64
00:00:00.185220 IP 10.0.0.1 > 10.0.0.2: ICMP echo request, id 31017, seq 21, length 64
00:00:00.195692 IP 10.0.0.1 > 10.0.0.2: ICMP echo request, id 31017, seq 22, length 64
00:00:00.211636 IP 10.0.0.1 > 10.0.0.2: ICMP echo request, id 31017, seq 23, length 64
00:00:00.227756 IP 10.0.0.1 > 10.0.0.2: ICMP echo request, id 31017, seq 24, length 64
00:00:00.238984 IP 10.0.0.1 > 10.0.0.2: ICMP echo request, id 31017, seq 25, length 64
00:00:00.250953 IP 10.0.0.1 > 10.0.0.2: ICMP echo request, id 31017, seq 26, length 64
00:00:00.262951 IP 10.0.0.1 > 10.0.0.2: ICMP echo request, id 31017, seq 27, length 64
00:00:00.275208 IP 10.0.0.1 > 10.0.0.2: ICMP echo request, id 31017, seq 28, length 64
00:00:00.291310 IP 10.0.0.1 > 10.0.0.2: ICMP echo request, id 31017, seq 29, length 64
00:00:00.304000 IP 10.0.0.1 > 10.0.0.2: ICMP echo request, id 31017, seq 30, length 64
00:00:00.315751 IP 10.0.0.1 > 10.0.0.2: ICMP echo request, id 31017, seq 31, length 64
00:00:00.328457 IP 10.0.0.1 > 10.0.0.2: ICMP echo request, id 31017, seq 32, length 64
00:00:00.339213 IP 10.0.0.1 > 10.0.0.2: ICMP echo request, id 31017, seq 33, length 64
00:00:00.351624 IP 10.0.0.1 > 10.0.0.2: ICMP echo request, id 31017, seq 34, length 64
00:00:00.363113 IP 10.0.0.1 > 10.0.0.2: ICMP echo request, id 31017, seq 35, length 64
00:00:00.374883 IP 10.0.0.1 > 10.0.0.2: ICMP echo request, id 31017, seq 36, length 64
00:00:00.389547 IP 10.0.0.1 > 10.0.0.2: ICMP echo request, id 31017, seq 37, length 64
00:00:00.399534 IP 10.0.0.1 > 10.0.0.2: ICMP echo request, id 31017, seq 38, length 64
00:00:00.412022 IP 10.0.0.1 > 10.0.0.2: ICMP echo request, id 31017, seq 39, length 64
00:00:00.423342 IP 10.0.0.1 > 10.0.0.2: ICMP echo request, id 31017, seq 40, length 64
00:00:00.436969 IP 10.0.0.1 > 10.0.0.2: ICMP echo request, id 31017, seq 41, length 64
00:00:00.446961 IP 10.0.0.1 > 10.0.0.2: ICMP echo request, id 31017, seq 42, length 64
00:00:00.459556 IP 10.0.0.1 > 10.0.0.2: ICMP echo request, id 31017, seq 43, length 64
00:00:00.470857 IP 10.0.0.1 > 10.0.0.2: ICMP echo request, id 31017, seq 44, length 64
00:00:00.483408 IP 10.0.0.1 > 10.0.0.2: ICMP echo request, id 31017, seq 45, length 64
00:00:00.495096 IP 10.0.0.1 > 10.0.0.2: ICMP echo request, id 31017, seq 46, length 64
00:00:00.507337 IP 10.0.0.1 > 10.0.0.2: ICMP echo request, id 31017, seq 47, length 64
00:00:00.518845 IP 10.0.0.1 > 10.0.0.2: ICMP echo request, id 31017, seq 48, length 64
00:00:00.532286 IP 10.0.0.1 > 10.0.0.2: ICMP echo request, id 31017, seq 49, length 64
00:00:00.543018 IP 10.0.0.1 > 10.0.0.2: ICMP echo request, id 31017, seq 50, length 64
00:00:00.554858 IP 10.0.0.1 > 10.0.0.2: ICMP echo request, id 31017, seq 51, length 64
00:00:00.566982 IP 10.0.0.1 > 10.0.0.2: ICMP echo request, id 31017, seq 52, length 64
00:00:00.579301 IP 10.0.0.1 > 10.0.0.2: ICMP echo request, id 31017, seq 53, length 64
00:00:00.590937 IP 10.0.0.1 > 10.0.0.2: ICMP echo request, id 31017, seq 54, length 64
00:00:00.603213 IP 10.0.0.1 > 10.0.0.2: ICMP echo request, id 31017, seq 55, length 64
00:00:00.614875 IP 10.0.0.1 > 10.0.0.2: ICMP echo request, id 31017, seq 56, length 64
00:00:00.627084 IP 10.0.0.1 > 10.0.0.2: ICMP echo request, id 31017, seq 57, length 64
00:00:00.639329 IP 10.0.0.1 > 10.0.0.2: ICMP echo request, id 31017, seq 58, length 64
00:00:00.651043 IP 10.0.0.1 > 10.0.0.2: ICMP echo request, id 31017, seq 59, length 64
00:00:00.662862 IP 10.0.0.1 > 10.0.0.2: ICMP echo request, id 31017, seq 60, length 64
00:00:00.674976 IP 10.0.0.1 > 10.0.0.2: ICMP echo request, id 31017, seq 61, length 64
00:00:00.687231 IP 10.0.0.1 > 10.0.0.2: ICMP echo request, id 31017, seq 62, length 64
00:00:00.698945 IP 10.0.0.1 > 10.0.0.2: ICMP echo request, id 31017, seq 63, length 64
00:00:00.713200 IP 10.0.0.1 > 10.0.0.2: ICMP echo request, id 31017, seq 64, length 64
00:00:00.723202 IP 10.0.0.1 > 10.0.0.2: ICMP echo request, id 31017, seq 65, length 64
00:00:00.735147 IP 10.0.0.1 > 10.0.0.2: ICMP echo request, id 31017, seq 66, length 64
00:00:00.747348 IP 10.0.0.1 > 10.0.0.2: ICMP echo request, id 31017, seq 67, length 64
00:00:00.759076 IP 10.0.0.1 > 10.0.0.2: ICMP echo request, id 31017, seq 68, length 64
00:00:00.771288 IP 10.0.0.1 > 10.0.0.2: ICMP echo request, id 31017, seq 69, length 64
00:00:00.785977 IP 10.0.0.1 > 10.0.0.2: ICMP echo request, id 31017, seq 70, length 64
00:00:00.795966 IP 10.0.0.1 > 10.0.0.2: ICMP echo request, id 31017, seq 71, length 64
00:00:00.806975 IP 10.0.0.1 > 10.0.0.2: ICMP echo request, id 31017, seq 72, length 64
00:00:00.820671 IP 10.0.0.1 > 10.0.0.2: ICMP echo request, id 31017, seq 73, length 64
00:00:00.830920 IP 10.0.0.1 > 10.0.0.2: ICMP echo request, id 31017, seq 74, length 64
00:00:00.843168 IP 10.0.0.1 > 10.0.0.2: ICMP echo request, id 31017, seq 75, length 64
00:00:00.854894 IP 10.0.0.1 > 10.0.0.2: ICMP echo request, id 31017, seq 76, length 64
00:00:00.867076 IP 10.0.0.1 > 10.0.0.2: ICMP echo request, id 31017, seq 77, length 64
00:00:00.878858 IP 10.0.0.1 > 10.0.0.2: ICMP echo request, id 31017, seq 78, length 64
00:00:00.891045 IP 10.0.0.1 > 10.0.0.2: ICMP echo request, id 31017, seq 79, length 64
00:00:00.902845 IP 10.0.0.1 > 10.0.0.2: ICMP echo request, id 31017, seq 80, length 64
00:00:00.915017 IP 10.0.0.1 > 10.0.0.2: ICMP echo request, id 31017, seq 81, length 64
00:00:00.928218 IP 10.0.0.1 > 10.0.0.2: ICMP echo request, id 31017, seq 82, length 64
00:00:00.939938 IP 10.0.0.1 > 10.0.0.2: ICMP echo request, id 31017, seq 83, length 64
00:00:00.951172 IP 10.0.0.1 > 10.0.0.2: ICMP echo request, id 31017, seq 84, length 64
00:00:00.962919 IP 10.0.0.1 > 10.0.0.2: ICMP echo request, id 31017, seq 85, length 64
00:00:00.975144 IP 10.0.0.1 > 10.0.0.2: ICMP echo request, id 31017, seq 86, length 64
00:00:00.986881 IP 10.0.0.1 > 10.0.0.2: ICMP echo request, id 31017, seq 87, length 64
00:00:01.000551 IP 10.0.0.1 > 10.0.0.2: ICMP echo request, id 31017, seq 88, length 64
00:00:01.011301 IP 10.0.0.1 > 10.0.0.2: ICMP echo request, id 31017, seq 89, length 64
00:00:01.023013 IP 10.0.0.1 > 10.0.0.2: ICMP echo request, id 31017, seq 90, length 64
00:00:01.037694 IP 10.0.0.1 > 10.0.0.2: ICMP echo request, id 31017, seq 91, length 64
00:00:01.047682 IP 10.0.0.1 > 10.0.0.2: ICMP echo request, id 31017, seq 92, length 64
00:00:01.058941 IP 10.0.0.1 > 10.0.0.2: ICMP echo request, id 31017, seq 93, length 64
00:00:01.070937 IP 10.0.0.1 > 10.0.0.2: ICMP echo request, id 31017, seq 94, length 64
00:00:01.085659 IP 10.0.0.1 > 10.0.0.2: ICMP echo request, id 31017, seq 95, length 64
00:00:01.095655 IP 10.0.0.1 > 10.0.0.2: ICMP echo request, id 31017, seq 96, length 64
00:00:01.107643 IP 10.0.0.1 > 10.0.0.2: ICMP echo request, id 31017, seq 97, length 64
00:00:01.119412 IP 10.0.0.1 > 10.0.0.2: ICMP echo request, id 31017, seq 98, length 64
00:00:01.132117 IP 10.0.0.1 > 10.0.0.2: ICMP echo request, id 31017, seq 99, length 64
00:00:01.142848 IP 10.0.0.1 > 10.0.0.2: ICMP echo request, id 31017, seq 100, length 64
00:00:01.158967 IP 10.0.0.1 > 10.0.0.2: ICMP echo request, id 31017, seq 101, length 64
00:00:01.171347 IP 10.0.0.1 > 10.0.0.2: ICMP echo request, id 31017, seq 102, length 64
00:00:01.182926 IP 10.0.0.1 > 10.0.0.2: ICMP echo request, id 31017, seq 103, length 64
00:00:01.195611 IP 10.0.0.1 > 10.0.0.2: ICMP echo request, id 31017, seq 104, length 64
00:00:01.207878 IP 10.0.0.1 > 10.0.0.2: ICMP echo request, id 31017, seq 105, length 64
00:00:01.219164 IP 10.0.0.1 > 10.0.0.2: ICMP echo request, id 31017, seq 106, length 64
00:00:01.232277 IP 10.0.0.1 > 10.0.0.2: ICMP echo request, id 31017, seq 107, length 64
00:00:01.243022 IP 10.0.0.1 > 10.0.0.2: ICMP echo request, id 31017, seq 108, length 64
00:00:01.257225 IP 10.0.0.1 > 10.0.0.2: ICMP echo request, id 31017, seq 109, length 64
00:00:01.267225 IP 10.0.0.1 > 10.0.0.2: ICMP echo request, id 31017, seq 110, length 64
00:00:01.279224 IP 10.0.0.1 > 10.0.0.2: ICMP echo request, id 31017, seq 111, length 64
00:00:01.290943 IP 10.0.0.1 > 10.0.0.2: ICMP echo request, id 31017, seq 112, length 64
00:00:01.303173 IP 10.0.0.1 > 10.0.0.2: ICMP echo request, id 31017, seq 113, length 64
00:00:01.314889 IP 10.0.0.1 > 10.0.0.2: ICMP echo request, id 31017, seq 114, length 64
00:00:01.327206 IP 10.0.0.1 > 10.0.0.2: ICMP echo request, id 31017, seq 115, length 64
00:00:01.339334 IP 10.0.0.1 > 10.0.0.2: ICMP echo request, id 31017, seq 116, length 64
00:00:01.351098 IP 10.0.0.1 > 10.0.0.2: ICMP echo request, id 31017, seq 117, length 64
00:00:01.362868 IP 10.0.0.1 > 10.0.0.2: ICMP echo request, id 31017, seq 118, length 64
00:00:01.375004 IP 10.0.0.1 > 10.0.0.2: ICMP echo request, id 31017, seq 119, length 64
00:00:01.386868 IP 10.0.0.1 > 10.0.0.2: ICMP echo request, id 31017, seq 120, length 64
00:00:01.400430 IP 10.0.0.1 > 10.0.0.2: ICMP echo request, id 31017, seq 121, length 64
00:00:01.411191 IP 10.0.0.1 > 10.0.0.2: ICMP echo request, id 31017, seq 122, length 64
00:00:01.423471 IP 10.0.0.1 > 10.0.0.2: ICMP echo request, id 31017, seq 123, length 64
00:00:01.438103 IP 10.0.0.1 > 10.0.0.2: ICMP echo request, id 31017, seq 124, length 64
00:00:01.448100 IP 10.0.0.1 > 10.0.0.2: ICMP echo request, id 31017, seq 125, length 64
00:00:01.459607 IP 10.0.0.1 > 10.0.0.2: ICMP echo request, id 31017, seq 126, length 64
00:00:01.474732 IP 10.0.0.1 > 10.0.0.2: ICMP echo request, id 31017, seq 127, length 64
00:00:01.484726 IP 10.0.0.1 > 10.0.0.2: ICMP echo request, id 31017, seq 128, length 64
00:00:01.495272 IP 10.0.0.1 > 10.0.0.2: ICMP echo request, id 31017, seq 129, length 64
00:00:01.508449 IP 10.0.0.1 > 10.0.0.2: ICMP echo request, id 31017, seq 130, length 64
00:00:01.519223 IP 10.0.0.1 > 10.0.0.2: ICMP echo request, id 31017, seq 131, length 64
00:00:01.532960 IP 10.0.0.1 > 10.0.0.2: ICMP echo request, id 31017, seq 132, length 64
00:00:01.542938 IP 10.0.0.1 > 10.0.0.2: ICMP echo request, id 31017, seq 133, length 64
00:00:01.557820 IP 10.0.0.1 > 10.0.0.2: ICMP echo request, id 31017, seq 134, length 64
00:00:01.567805 IP 10.0.0.1 > 10.0.0.2: ICMP echo request, id 31017, seq 135, length 64
00:00:01.579399 IP 10.0.0.1 > 10.0.0.2: ICMP echo request, id 31017, seq 136, length 64
00:00:01.591068 IP 10.0.0.1 > 10.0.0.2: ICMP echo request, id 31017, seq 137, length 64
00:00:01.606688 IP 10.0.0.1 > 10.0.0.2: ICMP echo request, id 31017, seq 138, length 64
00:00:01.616684 IP 10.0.0.1 > 10.0.0.2: ICMP echo request, id 31017, seq 139, length 64
00:00:01.626859 IP 10.0.0.1 > 10.0.0.2: ICMP echo request, id 31017, seq 140, length 64
00:00:01.638940 IP 10.0.0.1 > 10.0.0.2: ICMP echo request, id 31017, seq 141, length 64
00:00:01.652125 IP 10.0.0.1 > 10.0.0.2: ICMP echo request, id 31017, seq 142, length 64
00:00:01.663881 IP 10.0.0.1 > 10.0.0.2: ICMP echo request, id 31017, seq 143, length 64
00:00:01.675100 IP 10.0.0.1 > 10.0.0.2: ICMP echo request, id 31017, seq 144, length 64
00:00:01.687349 IP 10.0.0.1 > 10.0.0.2: ICMP echo request, id 31017, seq 145, length 64
00:00:01.699058 IP 10.0.0.1 > 10.0.0.2: ICMP echo request, id 31017, seq 146, length 64
00:00:01.712285 IP 10.0.0.1 > 10.0.0.2: ICMP echo request, id 31017, seq 147, length 64
00:00:01.723034 IP 10.0.0.1 > 10.0.0.2: ICMP echo request, id 31017, seq 148, length 64
00:00:01.734849 IP 10.0.0.1 > 10.0.0.2: ICMP echo request, id 31017, seq 149, length 64
00:00:01.747450 IP 10.0.0.1 > 10.0.0.2: ICMP echo request, id 31017, seq 150, length 64
00:00:01.758874 IP 10.0.0.1 > 10.0.0.2: ICMP echo request, id 31017, seq 151, length 64
00:00:01.770938 IP 10.0.0.1 > 10.0.0.2: ICMP echo request, id 31017, seq 152, length 64
00:00:01.785593 IP 10.0.0.1 > 10.0.0.2: ICMP echo request, id 31017, seq 153, length 64
00:00:01.795589 IP 10.0.0.1 > 10.0.0.2: ICMP echo request, id 31017, seq 154, length 64
00:00:01.808085 IP 10.0.0.1 > 10.0.0.2: ICMP echo request, id 31017, seq 155, length 64
00:00:01.818870 IP 10.0.0.1 > 10.0.0.2: ICMP echo request, id 31017, seq 156, length 64
00:00:01.831526 IP 10.0.0.1 > 10.0.0.2: ICMP echo request, id 31017, seq 157, length 64
00:00:01.843272 IP 10.0.0.1 > 10.0.0.2: ICMP echo request, id 31017, seq 158, length 64
00:00:01.855987 IP 10.0.0.1 > 10.0.0.2: ICMP echo request, id 31017, seq 159, length 64
00:00:01.866870 IP 10.0.0.1 > 10.0.0.2: ICMP echo request, id 31017, seq 160, length 64
00:00:01.880406 IP 10.0.0.1 > 10.0.0.2: ICMP echo request, id 31017, seq 161, length 64
00:00:01.891177 IP 10.0.0.1 > 10.0.0.2: ICMP echo request, id 31017, seq 162, length 64
00:00:01.902893 IP 10.0.0.1 > 10.0.0.2: ICMP echo request, id 31017, seq 163, length 64
00:00:01.915141 IP 10.0.0.1 > 10.0.0.2: ICMP echo request, id 31017, seq 164, length 64
00:00:01.926893 IP 10.0.0.1 > 10.0.0.2: ICMP echo request, id 31017, seq 165, length 64
00:00:01.939057 IP 10.0.0.1 > 10.0.0.2: ICMP echo request, id 31017, seq 166, length 64
00:00:01.967862 IP 10.0.0.1 > 10.0.0.2: ICMP echo request, id 31017, seq 168, length 64
00:00:01.975835 IP 10.0.0.1 > 10.0.0.2: ICMP echo request, id 31017, seq 169, length 64
00:00:01.985244 IP 10.0.0.1 > 10.0.0.2: ICMP echo request, id 31017, seq 170, length 64
00:00:01.995321 IP 10.0.0.1 > 10.0.0.2: ICMP echo request, id 31017, seq 171, length 64
00:00:02.008497 IP 10.0.0.1 > 10.0.0.2: ICMP echo request, id 31017, seq 172, length 64
00:00:02.018843 IP 10.0.0.1 > 10.0.0.2: ICMP echo request, id 31017, seq 173, length 64
00:00:02.031953 IP 10.0.0.1 > 10.0.0.2: ICMP echo request, id 31017, seq 174, length 64
00:00:02.043746 IP 10.0.0.1 > 10.0.0.2: ICMP echo request, id 31017, seq 175, length 64
00:00:02.055920 IP 10.0.0.1 > 10.0.0.2: ICMP echo request, id 31017, seq 176, length 64
00:00:02.067150 IP 10.0.0.1 > 10.0.0.2: ICMP echo request, id 31017, seq 177, length 64
00:00:02.079340 IP 10.0.0.1 > 10.0.0.2: ICMP echo request, id 31017, seq 178, length 64
00:00:02.097003 IP 10.0.0.1 > 10.0.0.2: ICMP echo request, id 31017, seq 179, length 64
00:00:02.107001 IP 10.0.0.1 > 10.0.0.2: ICMP echo request, id 31017, seq 180, length 64
00:00:02.120981 IP 10.0.0.1 > 10.0.0.2: ICMP echo request, id 31017, seq 181, length 64
00:00:02.131172 IP 10.0.0.1 > 10.0.0.2: ICMP echo request, id 31017, seq 182, length 64
00:00:02.142907 IP 10.0.0.1 > 10.0.0.2: ICMP echo request, id 31017, seq 183, length 64
00:00:02.156615 IP 10.0.0.1 > 10.0.0.2: ICMP echo request, id 31017, seq 184, length 64
00:00:02.166859 IP 10.0.0.1 > 10.0.0.2: ICMP echo request, id 31017, seq 185, length 64
00:00:02.179066 IP 10.0.0.1 > 10.0.0.2: ICMP echo request, id 31017, seq 186, length 64
00:00:02.190859 IP 10.0.0.1 > 10.0.0.2: ICMP echo request, id 31017, seq 187, length 64
00:00:02.203062 IP 10.0.0.1 > 10.0.0.2: ICMP echo request, id 31017, seq 188, length 64
00:00:02.215247 IP 10.0.0.1 > 10.0.0.2: ICMP echo request, id 31017, seq 189, length 64
00:00:02.226976 IP 10.0.0.1 > 10.0.0.2: ICMP echo request, id 31017, seq 190, length 64
00:00:02.238842 IP 10.0.0.1 > 10.0.0.2: ICMP echo request, id 31017, seq 191, length 64
00:00:02.250937 IP 10.0.0.1 > 10.0.0.2: ICMP echo request, id 31017, seq 192, length 64
00:00:02.263148 IP 10.0.0.1 > 10.0.0.2: ICMP echo request, id 31017, seq 193, length 64
00:00:02.274866 IP 10.0.0.1 > 10.0.0.2: ICMP echo request, id 31017, seq 194, length 64
00:00:02.288564 IP 10.0.0.1 > 10.0.0.2: ICMP echo request, id 31017, seq 195, length 64
00:00:02.298877 IP 10.0.0.1 > 10.0.0.2: ICMP echo request, id 31017, seq 196, length 64
00:00:02.311047 IP 10.0.0.1 > 10.0.0.2: ICMP echo request, id 31017, seq 197, length 64
00:00:02.322837 IP 10.0.0.1 > 10.0.0.2: ICMP echo request, id 31017, seq 198, length 64
00:00:02.335009 IP 10.0.0.1 > 10.0.0.2: ICMP echo request, id 31017, seq 199, length 64
00:00:02.346873 IP 10.0.0.1 > 10.0.0.2: ICMP echo request, id 31017, seq 200, length 64
00:00:02.358948 IP 10.0.0.1 > 10.0.0.2: ICMP echo request, id 31017, seq 201, length 64
00:00:02.371185 IP 10.0.0.1 > 10.0.0.2: ICMP echo request, id 31017, seq 202, length 64
00:00:02.385369 IP 10.0.0.1 > 10.0.0.2: ICMP echo request, id 31017, seq 203, length 64
00:00:02.395379 IP 10.0.0.1 > 10.0.0.2: ICMP echo request, id 31017, seq 204, length 64
00:00:02.406857 IP 10.0.0.1 > 10.0.0.2: ICMP echo request, id 31017, seq 205, length 64
00:00:02.419065 IP 10.0.0.1 > 10.0.0.2: ICMP echo request, id 31017, seq 206, length 64
00:00:02.431293 IP 10.0.0.1 > 10.0.0.2: ICMP echo request, id 31017, seq 207, length 64
00:00:02.443064 IP 10.0.0.1 > 10.0.0.2: ICMP echo request, id 31017, seq 208, length 64
00:00:02.455776 IP 10.0.0.1 > 10.0.0.2: ICMP echo request, id 31017, seq 209, length 64
00:00:02.466974 IP 10.0.0.1 > 10.0.0.2: ICMP echo request, id 31017, seq 210, length 64
00:00:02.479231 IP 10.0.0.1 > 10.0.0.2: ICMP echo request, id 31017, seq 211, length 64
00:00:02.490945 IP 10.0.0.1 > 10.0.0.2: ICMP echo request, id 31017, seq 212, length 64
00:00:02.503184 IP 10.0.0.1 > 10.0.0.2: ICMP echo request, id 31017, seq 213, length 64
00:00:02.516349 IP 10.0.0.1 > 10.0.0.2: ICMP echo request, id 31017, seq 214, length 64
00:00:02.527097 IP 10.0.0.1 > 10.0.0.2: ICMP echo request, id 31017, seq 215, length 64
00:00:02.539377 IP 10.0.0.1 > 10.0.0.2: ICMP echo request, id 31017, seq 216, length 64
00:00:02.551083 IP 10.0.0.1 > 10.0.0.2: ICMP echo request, id 31017, seq 217, length 64
00:00:02.563280 IP 10.0.0.1 > 10.0.0.2: ICMP echo request, id 31017, seq 218, length 64
00:00:02.575061 IP 10.0.0.1 > 10.0.0.2: ICMP echo request, id 31017, seq 219, length 64
00:00:02.587243 IP 10.0.0.1 > 10.0.0.2: ICMP echo request, id 31017, seq 220, length 64
00:00:02.598979 IP 10.0.0.1 > 10.0.0.2: ICMP echo request, id 31017, seq 221, length 64
00:00:02.613138 IP 10.0.0.1 > 10.0.0.2: ICMP echo request, id 31017, seq 222, length 64
00:00:02.623134 IP 10.0.0.1 > 10.0.0.2: ICMP echo request, id 31017, seq 223, length 64
00:00:02.635118 IP 10.0.0.1 > 10.0.0.2: ICMP echo request, id 31017, seq 224, length 64
00:00:02.646873 IP 10.0.0.1 > 10.0.0.2: ICMP echo request, id 31017, seq 225, length 64
00:00:02.660588 IP 10.0.0.1 > 10.0.0.2: ICMP echo request, id 31017, seq 226, length 64
00:00:02.670862 IP 10.0.0.1 > 10.0.0.2: ICMP echo request, id 31017, seq 227, length 64
00:00:02.683032 IP 10.0.0.1 > 10.0.0.2: ICMP echo request, id 31017, seq 228, length 64
00:00:02.694898 IP 10.0.0.1 > 10.0.0.2: ICMP echo request, id 31017, seq 229, length 64
00:00:02.707546 IP 10.0.0.1 > 10.0.0.2: ICMP echo request, id 31017, seq 230, length 64
00:00:02.718897 IP 10.0.0.1 > 10.0.0.2: ICMP echo request, id 31017, seq 231, length 64
00:00:02.731497 IP 10.0.0.1 > 10.0.0.2: ICMP echo request, id 31017, seq 232, length 64
00:00:02.743203 IP 10.0.0.1 > 10.0.0.2: ICMP echo request, id 31017, seq 233, length 64
00:00:02.754929 IP 10.0.0.1 > 10.0.0.2: ICMP echo request, id 31017, seq 234, length 64
00:00:02.767456 IP 10.0.0.1 > 10.0.0.2: ICMP echo request, id 31017, seq 235, length 64
00:00:02.779005 IP 10.0.0.1 > 10.0.0.2: ICMP echo request, id 31017, seq 236, length 64
00:00:02.791179 IP 10.0.0.1 > 10.0.0.2: ICMP echo request, id 31017, seq 237, length 64
