00:00:00.000000 IP 10.0.0.1 > 10.0.0.2: ICMP echo request, id 10597, seq 5, length 64
00:00:00.016460 IP 10.0.0.1 > 10.0.0.2: ICMP echo request, id 10597, seq 6, length 64
00:00:00.028239 IP 10.0.0.1 > 10.0.0.2: ICMP echo request, id 10597, seq 7, length 64
00:00:00.040977 IP 10.0.0.1 > 10.0.0.2: ICMP echo request, id 10597, seq 8, length 64
00:00:00.055079 IP 10.0.0.1 > 10.0.0.2: ICMP echo request, id 10597, seq 9, length 64
00:00:00.065824 IP 10.0.0.1 > 10.0.0.2: ICMP echo request, id 10597, seq 10, length 64
00:00:00.076092 IP 10.0.0.1 > 10.0.0.2: ICMP echo request, id 10597, seq 11, length 64
00:00:00.088344 IP 10.0.0.1 > 10.0.0.2: ICMP echo request, id 10597, seq 12, length 64
00:00:00.101512 IP 10.0.0.1 > 10.0.0.2: ICMP echo request, id 10597, seq 13, length 64
00:00:00.112296 IP 10.0.0.1 > 10.0.0.2: ICMP echo request, id 10597, seq 14, length 64
00:00:00.123982 IP 10.0.0.1 > 10.0.0.2: ICMP echo request, id 10597, seq 15, length 64
00:00:00.138190 IP 10.0.0.1 > 10.0.0.2: ICMP echo request, id 10597, seq 16, length 64
00:00:00.148183 IP 10.0.0.1 > 10.0.0.2: ICMP echo request, id 10597, seq 17, length 64
00:00:00.161096 IP 10.0.0.1 > 10.0.0.2: ICMP echo request, id 10597, seq 18, length 64
00:00:00.172397 IP 10.0.0.1 > 10.0.0.2: ICMP echo request, id 10597, seq 19, length 64
00:00:00.185087 IP 10.0.0.1 > 10.0.0.2: ICMP echo request, id 10597, seq 20, length 64
00:00:00.195841 IP 10.0.0.1 > 10.0.0.2: ICMP echo request, id 10597, seq 21, length 64
00:00:00.208068 IP 10.0.0.1 > 10.0.0.2: ICMP echo request, id 10597, seq 22, length 64
00:00:00.221278 IP 10.0.0.1 > 10.0.0.2: ICMP echo request, id 10597, seq 23, length 64
00:00:00.232013 IP 10.0.0.1 > 10.0.0.2: ICMP echo request, id 10597, seq 24, length 64
00:00:00.244831 IP 10.0.0.1 > 10.0.0.2: ICMP echo request, id 10597, seq 25, length 64
00:00:00.261348 IP 10.0.0.1 > 10.0.0.2: ICMP echo request, id 10597, seq 26, length 64
00:00:00.271813 IP 10.0.0.1 > 10.0.0.2: ICMP echo request, id 10597, seq 27, length 64
00:00:00.284329 IP 10.0.0.1 > 10.0.0.2: ICMP echo request, id 10597, seq 28, length 64
00:00:00.296044 IP 10.0.0.1 > 10.0.0.2: ICMP echo request, id 10597, seq 29, length 64
00:00:00.308267 IP 10.0.0.1 > 10.0.0.2: ICMP echo request, id 10597, seq 30, length 64
00:00:00.319998 IP 10.0.0.1 > 10.0.0.2: ICMP echo request, id 10597, seq 31, length 64
00:00:00.331829 IP 10.0.0.1 > 10.0.0.2: ICMP echo request, id 10597, seq 32, length 64
00:00:00.344789 IP 10.0.0.1 > 10.0.0.2: ICMP echo request, id 10597, seq 33, length 64
00:00:00.356189 IP 10.0.0.1 > 10.0.0.2: ICMP echo request, id 10597, seq 34, length 64
00:00:00.369364 IP 10.0.0.1 > 10.0.0.2: ICMP echo request, id 10597, seq 35, length 64
00:00:00.380130 IP 10.0.0.1 > 10.0.0.2: ICMP echo request, id 10597, seq 36, length 64
00:00:00.391859 IP 10.0.0.1 > 10.0.0.2: ICMP echo request, id 10597, seq 37, length 64
00:00:00.404609 IP 10.0.0.1 > 10.0.0.2: ICMP echo request, id 10597, seq 38, length 64
00:00:00.421788 IP 10.0.0.1 > 10.0.0.2: ICMP echo request, id 10597, seq 39, length 64
00:00:00.433908 IP 10.0.0.1 > 10.0.0.2: ICMP echo request, id 10597, seq 40, length 64
00:00:00.443908 IP 10.0.0.1 > 10.0.0.2: ICMP echo request, id 10597, seq 41, length 64
00:00:00.455901 IP 10.0.0.1 > 10.0.0.2: ICMP echo request, id 10597, seq 42, length 64
00:00:00.468650 IP 10.0.0.1 > 10.0.0.2: ICMP echo request, id 10597, seq 43, length 64
00:00:00.480345 IP 10.0.0.1 > 10.0.0.2: ICMP echo request, id 10597, seq 44, length 64
00:00:00.493528 IP 10.0.0.1 > 10.0.0.2: ICMP echo request, id 10597, seq 45, length 64
00:00:00.504299 IP 10.0.0.1 > 10.0.0.2: ICMP echo request, id 10597, seq 46, length 64
00:00:00.522456 IP 10.0.0.1 > 10.0.0.2: ICMP echo request, id 10597, seq 47, length 64
00:00:00.532454 IP 10.0.0.1 > 10.0.0.2: ICMP echo request, id 10597, seq 48, length 64
00:00:00.545873 IP 10.0.0.1 > 10.0.0.2: ICMP echo request, id 10597, seq 49, length 64
00:00:00.556110 IP 10.0.0.1 > 10.0.0.2: ICMP echo request, id 10597, seq 50, length 64
00:00:00.567830 IP 10.0.0.1 > 10.0.0.2: ICMP echo request, id 10597, seq 51, length 64
00:00:00.580053 IP 10.0.0.1 > 10.0.0.2: ICMP echo request, id 10597, seq 52, length 64
00:00:00.593745 IP 10.0.0.1 > 10.0.0.2: ICMP echo request, id 10597, seq 53, length 64
00:00:00.604001 IP 10.0.0.1 > 10.0.0.2: ICMP echo request, id 10597, seq 54, length 64
00:00:00.615840 IP 10.0.0.1 > 10.0.0.2: ICMP echo request, id 10597, seq 55, length 64
00:00:00.627982 IP 10.0.0.1 > 10.0.0.2: ICMP echo request, id 10597, seq 56, length 64
00:00:00.640179 IP 10.0.0.1 > 10.0.0.2: ICMP echo request, id 10597, seq 57, length 64
00:00:00.655852 IP 10.0.0.1 > 10.0.0.2: ICMP echo request, id 10597, seq 58, length 64
00:00:00.668032 IP 10.0.0.1 > 10.0.0.2: ICMP echo request, id 10597, seq 59, length 64
00:00:00.679848 IP 10.0.0.1 > 10.0.0.2: ICMP echo request, id 10597, seq 60, length 64
00:00:00.691996 IP 10.0.0.1 > 10.0.0.2: ICMP echo request, id 10597, seq 61, length 64
00:00:00.703836 IP 10.0.0.1 > 10.0.0.2: ICMP echo request, id 10597, seq 62, length 64
00:00:00.715938 IP 10.0.0.1 > 10.0.0.2: ICMP echo request, id 10597, seq 63, length 64
00:00:00.727838 IP 10.0.0.1 > 10.0.0.2: ICMP echo request, id 10597, seq 64, length 64
00:00:00.741352 IP 10.0.0.1 > 10.0.0.2: ICMP echo request, id 10597, seq 65, length 64
00:00:00.752105 IP 10.0.0.1 > 10.0.0.2: ICMP echo request, id 10597, seq 66, length 64
00:00:00.763853 IP 10.0.0.1 > 10.0.0.2: ICMP echo request, id 10597, seq 67, length 64
00:00:00.775825 IP 10.0.0.1 > 10.0.0.2: ICMP echo request, id 10597, seq 68, length 64
00:00:00.790731 IP 10.0.0.1 > 10.0.0.2: ICMP echo request, id 10597, seq 69, length 64
00:00:00.800732 IP 10.0.0.1 > 10.0.0.2: ICMP echo request, id 10597, seq 70, length 64
00:00:00.814266 IP 10.0.0.1 > 10.0.0.2: ICMP echo request, id 10597, seq 71, length 64
00:00:00.827985 IP 10.0.0.1 > 10.0.0.2: ICMP echo request, id 10597, seq 72, length 64
00:00:00.840601 IP 10.0.0.1 > 10.0.0.2: ICMP echo request, id 10597, seq 73, length 64
00:00:00.851835 IP 10.0.0.1 > 10.0.0.2: ICMP echo request, id 10597, seq 74, length 64
00:00:00.864054 IP 10.0.0.1 > 10.0.0.2: ICMP echo request, id 10597, seq 75, length 64
