00:00:00.000000 IP 10.0.0.1 > 10.0.0.2: ICMP echo request, id 30681, seq 6, length 64
00:00:00.012283 IP 10.0.0.1 > 10.0.0.2: ICMP echo request, id 30681, seq 7, length 64
00:00:00.023913 IP 10.0.0.1 > 10.0.0.2: ICMP echo request, id 30681, seq 8, length 64
00:00:00.036624 IP 10.0.0.1 > 10.0.0.2: ICMP echo request, id 30681, seq 9, length 64
00:00:00.048094 IP 10.0.0.1 > 10.0.0.2: ICMP echo request, id 30681, seq 10, length 64
00:00:00.060125 IP 10.0.0.1 > 10.0.0.2: ICMP echo request, id 30681, seq 11, length 64
00:00:00.071992 IP 10.0.0.1 > 10.0.0.2: ICMP echo request, id 30681, seq 12, length 64
00:00:00.085061 IP 10.0.0.1 > 10.0.0.2: ICMP echo request, id 30681, seq 13, length 64
00:00:00.096764 IP 10.0.0.1 > 10.0.0.2: ICMP echo request, id 30681, seq 14, length 64
00:00:00.112922 IP 10.0.0.1 > 10.0.0.2: ICMP echo request, id 30681, seq 15, length 64
00:00:00.124143 IP 10.0.0.1 > 10.0.0.2: ICMP echo request, id 30681, seq 16, length 64
00:00:00.135874 IP 10.0.0.1 > 10.0.0.2: ICMP echo request, id 30681, seq 17, length 64
00:00:00.148085 IP 10.0.0.1 > 10.0.0.2: ICMP echo request, id 30681, seq 18, length 64
00:00:00.160286 IP 10.0.0.1 > 10.0.0.2: ICMP echo request, id 30681, seq 19, length 64
00:00:00.172977 IP 10.0.0.1 > 10.0.0.2: ICMP echo request, id 30681, seq 20, length 64
00:00:00.186228 IP 10.0.0.1 > 10.0.0.2: ICMP echo request, id 30681, seq 21, length 64
00:00:00.196971 IP 10.0.0.1 > 10.0.0.2: ICMP echo request, id 30681, seq 22, length 64
00:00:00.212648 IP 10.0.0.1 > 10.0.0.2: ICMP echo request, id 30681, seq 23, length 64
00:00:00.228746 IP 10.0.0.1 > 10.0.0.2: ICMP echo request, id 30681, seq 24, length 64
00:00:00.239992 IP 10.0.0.1 > 10.0.0.2: ICMP echo request, id 30681, seq 25, length 64
00:00:00.252165 IP 10.0.0.1 > 10.0.0.2: ICMP echo request, id 30681, seq 26, length 64
00:00:00.264905 IP 10.0.0.1 > 10.0.0.2: ICMP echo request, id 30681, seq 27, length 64
00:00:00.276129 IP 10.0.0.1 > 10.0.0.2: ICMP echo request, id 30681, seq 28, length 64
00:00:00.289856 IP 10.0.0.1 > 10.0.0.2: ICMP echo request, id 30681, seq 29, length 64
00:00:00.300110 IP 10.0.0.1 > 10.0.0.2: ICMP echo request, id 30681, seq 30, length 64
00:00:00.311863 IP 10.0.0.1 > 10.0.0.2: ICMP echo request, id 30681, seq 31, length 64
00:00:00.324054 IP 10.0.0.1 > 10.0.0.2: ICMP echo request, id 30681, seq 32, length 64
00:00:00.339697 IP 10.0.0.1 > 10.0.0.2: ICMP echo request, id 30681, seq 33, length 64
00:00:00.349700 IP 10.0.0.1 > 10.0.0.2: ICMP echo request, id 30681, seq 34, length 64
00:00:00.360029 IP 10.0.0.1 > 10.0.0.2: ICMP echo request, id 30681, seq 35, length 64
00:00:00.373424 IP 10.0.0.1 > 10.0.0.2: ICMP echo request, id 30681, seq 36, length 64
00:00:00.387604 IP 10.0.0.1 > 10.0.0.2: ICMP echo request, id 30681, seq 37, length 64
00:00:00.397600 IP 10.0.0.1 > 10.0.0.2: ICMP echo request, id 30681, seq 38, length 64
00:00:00.408668 IP 10.0.0.1 > 10.0.0.2: ICMP echo request, id 30681, seq 39, length 64
00:00:00.423285 IP 10.0.0.1 > 10.0.0.2: ICMP echo request, id 30681, seq 40, length 64
00:00:00.435504 IP 10.0.0.1 > 10.0.0.2: ICMP echo request, id 30681, seq 41, length 64
00:00:00.445505 IP 10.0.0.1 > 10.0.0.2: ICMP echo request, id 30681, seq 42, length 64
00:00:00.456062 IP 10.0.0.1 > 10.0.0.2: ICMP echo request, id 30681, seq 43, length 64
00:00:00.468296 IP 10.0.0.1 > 10.0.0.2: ICMP echo request, id 30681, seq 44, length 64
00:00:00.480450 IP 10.0.0.1 > 10.0.0.2: ICMP echo request, id 30681, seq 45, length 64
00:00:00.492662 IP 10.0.0.1 > 10.0.0.2: ICMP echo request, id 30681, seq 46, length 64
00:00:00.506419 IP 10.0.0.1 > 10.0.0.2: ICMP echo request, id 30681, seq 47, length 64
00:00:00.516411 IP 10.0.0.1 > 10.0.0.2: ICMP echo request, id 30681, seq 48, length 64
00:00:00.530345 IP 10.0.0.1 > 10.0.0.2: ICMP echo request, id 30681, seq 49, length 64
00:00:00.540633 IP 10.0.0.1 > 10.0.0.2: ICMP echo request, id 30681, seq 50, length 64
00:00:00.551861 IP 10.0.0.1 > 10.0.0.2: ICMP echo request, id 30681, seq 51, length 64
00:00:00.564549 IP 10.0.0.1 > 10.0.0.2: ICMP echo request, id 30681, seq 52, length 64
00:00:00.576000 IP 10.0.0.1 > 10.0.0.2: ICMP echo request, id 30681, seq 53, length 64
00:00:00.588034 IP 10.0.0.1 > 10.0.0.2: ICMP echo request, id 30681, seq 54, length 64
00:00:00.604159 IP 10.0.0.1 > 10.0.0.2: ICMP echo request, id 30681, seq 55, length 64
00:00:00.615943 IP 10.0.0.1 > 10.0.0.2: ICMP echo request, id 30681, seq 56, length 64
00:00:00.632040 IP 10.0.0.1 > 10.0.0.2: ICMP echo request, id 30681, seq 57, length 64
00:00:00.644253 IP 10.0.0.1 > 10.0.0.2: ICMP echo request, id 30681, seq 58, length 64
00:00:00.658890 IP 10.0.0.1 > 10.0.0.2: ICMP echo request, id 30681, seq 59, length 64
00:00:00.668879 IP 10.0.0.1 > 10.0.0.2: ICMP echo request, id 30681, seq 60, length 64
00:00:00.679938 IP 10.0.0.1 > 10.0.0.2: ICMP echo request, id 30681, seq 61, length 64
00:00:00.692138 IP 10.0.0.1 > 10.0.0.2: ICMP echo request, id 30681, seq 62, length 64
00:00:00.704355 IP 10.0.0.1 > 10.0.0.2: ICMP echo request, id 30681, seq 63, length 64
00:00:00.716072 IP 10.0.0.1 > 10.0.0.2: ICMP echo request, id 30681, seq 64, length 64
00:00:00.731765 IP 10.0.0.1 > 10.0.0.2: ICMP echo request, id 30681, seq 65, length 64
00:00:00.741761 IP 10.0.0.1 > 10.0.0.2: ICMP echo request, id 30681, seq 66, length 64
00:00:00.752889 IP 10.0.0.1 > 10.0.0.2: ICMP echo request, id 30681, seq 67, length 64
00:00:00.764524 IP 10.0.0.1 > 10.0.0.2: ICMP echo request, id 30681, seq 68, length 64
00:00:00.779153 IP 10.0.0.1 > 10.0.0.2: ICMP echo request, id 30681, seq 69, length 64
00:00:00.789139 IP 10.0.0.1 > 10.0.0.2: ICMP echo request, id 30681, seq 70, length 64
00:00:00.799866 IP 10.0.0.1 > 10.0.0.2: ICMP echo request, id 30681, seq 71, length 64
00:00:00.812394 IP 10.0.0.1 > 10.0.0.2: ICMP echo request, id 30681, seq 72, length 64
00:00:00.824117 IP 10.0.0.1 > 10.0.0.2: ICMP echo request, id 30681, seq 73, length 64
00:00:00.835848 IP 10.0.0.1 > 10.0.0.2: ICMP echo request, id 30681, seq 74, length 64
