00:00:00.000000 IP 10.0.0.1 > 10.0.0.2: ICMP echo request, id 7259, seq 5, length 64
00:00:00.012262 IP 10.0.0.1 > 10.0.0.2: ICMP echo request, id 7259, seq 6, length 64
00:00:00.024194 IP 10.0.0.1 > 10.0.0.2: ICMP echo request, id 7259, seq 7, length 64
00:00:00.037661 IP 10.0.0.1 > 10.0.0.2: ICMP echo request, id 7259, seq 8, length 64
00:00:00.048383 IP 10.0.0.1 > 10.0.0.2: ICMP echo request, id 7259, seq 9, length 64
00:00:00.064031 IP 10.0.0.1 > 10.0.0.2: ICMP echo request, id 7259, seq 10, length 64
00:00:00.076271 IP 10.0.0.1 > 10.0.0.2: ICMP echo request, id 7259, seq 11, length 64
00:00:00.087982 IP 10.0.0.1 > 10.0.0.2: ICMP echo request, id 7259, seq 12, length 64
00:00:00.100225 IP 10.0.0.1 > 10.0.0.2: ICMP echo request, id 7259, seq 13, length 64
00:00:00.112422 IP 10.0.0.1 > 10.0.0.2: ICMP echo request, id 7259, seq 14, length 64
00:00:00.127597 IP 10.0.0.1 > 10.0.0.2: ICMP echo request, id 7259, seq 15, length 64
00:00:00.137578 IP 10.0.0.1 > 10.0.0.2: ICMP echo request, id 7259, seq 16, length 64
00:00:00.149045 IP 10.0.0.1 > 10.0.0.2: ICMP echo request, id 7259, seq 17, length 64
00:00:00.160788 IP 10.0.0.1 > 10.0.0.2: ICMP echo request, id 7259, seq 18, length 64
00:00:00.173571 IP 10.0.0.1 > 10.0.0.2: ICMP echo request, id 7259, seq 19, length 64
00:00:00.184749 IP 10.0.0.1 > 10.0.0.2: ICMP echo request, id 7259, seq 20, length 64
00:00:00.196482 IP 10.0.0.1 > 10.0.0.2: ICMP echo request, id 7259, seq 21, length 64
00:00:00.211150 IP 10.0.0.1 > 10.0.0.2: ICMP echo request, id 7259, seq 22, length 64
00:00:00.221152 IP 10.0.0.1 > 10.0.0.2: ICMP echo request, id 7259, seq 23, length 64
00:00:00.233612 IP 10.0.0.1 > 10.0.0.2: ICMP echo request, id 7259, seq 24, length 64
00:00:00.244357 IP 10.0.0.1 > 10.0.0.2: ICMP echo request, id 7259, seq 25, length 64
00:00:00.259063 IP 10.0.0.1 > 10.0.0.2: ICMP echo request, id 7259, seq 26, length 64
00:00:00.269840 IP 10.0.0.1 > 10.0.0.2: ICMP echo request, id 7259, seq 27, length 64
00:00:00.280579 IP 10.0.0.1 > 10.0.0.2: ICMP echo request, id 7259, seq 28, length 64
00:00:00.292755 IP 10.0.0.1 > 10.0.0.2: ICMP echo request, id 7259, seq 29, length 64
00:00:00.304507 IP 10.0.0.1 > 10.0.0.2: ICMP echo request, id 7259, seq 30, length 64
00:00:00.317718 IP 10.0.0.1 > 10.0.0.2: ICMP echo request, id 7259, seq 31, length 64
00:00:00.332872 IP 10.0.0.1 > 10.0.0.2: ICMP echo request, id 7259, seq 32, length 64
00:00:00.346536 IP 10.0.0.1 > 10.0.0.2: ICMP echo request, id 7259, seq 33, length 64
00:00:00.356543 IP 10.0.0.1 > 10.0.0.2: ICMP echo request, id 7259, seq 34, length 64
00:00:00.370080 IP 10.0.0.1 > 10.0.0.2: ICMP echo request, id 7259, seq 35, length 64
00:00:00.380793 IP 10.0.0.1 > 10.0.0.2: ICMP echo request, id 7259, seq 36, length 64
00:00:00.392024 IP 10.0.0.1 > 10.0.0.2: ICMP echo request, id 7259, seq 37, length 64
00:00:00.407699 IP 10.0.0.1 > 10.0.0.2: ICMP echo request, id 7259, seq 38, length 64
00:00:00.417699 IP 10.0.0.1 > 10.0.0.2: ICMP echo request, id 7259, seq 39, length 64
00:00:00.430587 IP 10.0.0.1 > 10.0.0.2: ICMP echo request, id 7259, seq 40, length 64
00:00:00.440587 IP 10.0.0.1 > 10.0.0.2: ICMP echo request, id 7259, seq 41, length 64
00:00:00.452179 IP 10.0.0.1 > 10.0.0.2: ICMP echo request, id 7259, seq 42, length 64
00:00:00.464059 IP 10.0.0.1 > 10.0.0.2: ICMP echo request, id 7259, seq 43, length 64
00:00:00.480478 IP 10.0.0.1 > 10.0.0.2: ICMP echo request, id 7259, seq 44, length 64
00:00:00.496178 IP 10.0.0.1 > 10.0.0.2: ICMP echo request, id 7259, seq 45, length 64
00:00:00.508392 IP 10.0.0.1 > 10.0.0.2: ICMP echo request, id 7259, seq 46, length 64
00:00:00.523393 IP 10.0.0.1 > 10.0.0.2: ICMP echo request, id 7259, seq 47, length 64
00:00:00.533819 IP 10.0.0.1 > 10.0.0.2: ICMP echo request, id 7259, seq 48, length 64
00:00:00.546483 IP 10.0.0.1 > 10.0.0.2: ICMP echo request, id 7259, seq 49, length 64
00:00:00.556499 IP 10.0.0.1 > 10.0.0.2: ICMP echo request, id 7259, seq 50, length 64
00:00:00.568589 IP 10.0.0.1 > 10.0.0.2: ICMP echo request, id 7259, seq 51, length 64
00:00:00.580182 IP 10.0.0.1 > 10.0.0.2: ICMP echo request, id 7259, seq 52, length 64
00:00:00.596869 IP 10.0.0.1 > 10.0.0.2: ICMP echo request, id 7259, seq 53, length 64
00:00:00.611617 IP 10.0.0.1 > 10.0.0.2: ICMP echo request, id 7259, seq 54, length 64
00:00:00.621596 IP 10.0.0.1 > 10.0.0.2: ICMP echo request, id 7259, seq 55, length 64
00:00:00.633506 IP 10.0.0.1 > 10.0.0.2: ICMP echo request, id 7259, seq 56, length 64
00:00:00.644243 IP 10.0.0.1 > 10.0.0.2: ICMP echo request, id 7259, seq 57, length 64
00:00:00.656501 IP 10.0.0.1 > 10.0.0.2: ICMP echo request, id 7259, seq 58, length 64
00:00:00.671224 IP 10.0.0.1 > 10.0.0.2: ICMP echo request, id 7259, seq 59, length 64
00:00:00.681916 IP 10.0.0.1 > 10.0.0.2: ICMP echo request, id 7259, seq 60, length 64
00:00:00.692625 IP 10.0.0.1 > 10.0.0.2: ICMP echo request, id 7259, seq 61, length 64
00:00:00.705404 IP 10.0.0.1 > 10.0.0.2: ICMP echo request, id 7259, seq 62, length 64
00:00:00.719524 IP 10.0.0.1 > 10.0.0.2: ICMP echo request, id 7259, seq 63, length 64
00:00:00.729523 IP 10.0.0.1 > 10.0.0.2: ICMP echo request, id 7259, seq 64, length 64
00:00:00.741005 IP 10.0.0.1 > 10.0.0.2: ICMP echo request, id 7259, seq 65, length 64
00:00:00.754255 IP 10.0.0.1 > 10.0.0.2: ICMP echo request, id 7259, seq 66, length 64
00:00:00.764234 IP 10.0.0.1 > 10.0.0.2: ICMP echo request, id 7259, seq 67, length 64
00:00:00.778685 IP 10.0.0.1 > 10.0.0.2: ICMP echo request, id 7259, seq 68, length 64
00:00:00.788670 IP 10.0.0.1 > 10.0.0.2: ICMP echo request, id 7259, seq 69, length 64
00:00:00.800192 IP 10.0.0.1 > 10.0.0.2: ICMP echo request, id 7259, seq 70, length 64
00:00:00.812443 IP 10.0.0.1 > 10.0.0.2: ICMP echo request, id 7259, seq 71, length 64
00:00:00.824745 IP 10.0.0.1 > 10.0.0.2: ICMP echo request, id 7259, seq 72, length 64
00:00:00.836327 IP 10.0.0.1 > 10.0.0.2: ICMP echo request, id 7259, seq 73, length 64
00:00:00.848071 IP 10.0.0.1 > 10.0.0.2: ICMP echo request, id 7259, seq 74, length 64
00:00:00.861791 IP 10.0.0.1 > 10.0.0.2: ICMP echo request, id 7259, seq 75, length 64
00:00:00.873537 IP 10.0.0.1 > 10.0.0.2: ICMP echo request, id 7259, seq 76, length 64
00:00:00.884235 IP 10.0.0.1 > 10.0.0.2: ICMP echo request, id 7259, seq 77, length 64
00:00:00.895979 IP 10.0.0.1 > 10.0.0.2: ICMP echo request, id 7259, seq 78, length 64
00:00:00.910159 IP 10.0.0.1 > 10.0.0.2: ICMP echo request, id 7259, seq 79, length 64
00:00:00.920920 IP 10.0.0.1 > 10.0.0.2: ICMP echo request, id 7259, seq 80, length 64
00:00:00.932137 IP 10.0.0.1 > 10.0.0.2: ICMP echo request, id 7259, seq 81, length 64
00:00:00.946368 IP 10.0.0.1 > 10.0.0.2: ICMP echo request, id 7259, seq 82, length 64
00:00:00.958600 IP 10.0.0.1 > 10.0.0.2: ICMP echo request, id 7259, seq 83, length 64
00:00:00.968838 IP 10.0.0.1 > 10.0.0.2: ICMP echo request, id 7259, seq 84, length 64
00:00:00.981564 IP 10.0.0.1 > 10.0.0.2: ICMP echo request, id 7259, seq 85, length 64
00:00:00.995264 IP 10.0.0.1 > 10.0.0.2: ICMP echo request, id 7259, seq 86, length 64
00:00:01.005985 IP 10.0.0.1 > 10.0.0.2: ICMP echo request, id 7259, seq 87, length 64
00:00:01.016759 IP 10.0.0.1 > 10.0.0.2: ICMP echo request, id 7259, seq 88, length 64
00:00:01.028035 IP 10.0.0.1 > 10.0.0.2: ICMP echo request, id 7259, seq 89, length 64
00:00:01.040200 IP 10.0.0.1 > 10.0.0.2: ICMP echo request, id 7259, seq 90, length 64
00:00:01.053873 IP 10.0.0.1 > 10.0.0.2: ICMP echo request, id 7259, seq 91, length 64
00:00:01.064723 IP 10.0.0.1 > 10.0.0.2: ICMP echo request, id 7259, seq 92, length 64
00:00:01.076894 IP 10.0.0.1 > 10.0.0.2: ICMP echo request, id 7259, seq 93, length 64
00:00:01.088097 IP 10.0.0.1 > 10.0.0.2: ICMP echo request, id 7259, seq 94, length 64
00:00:01.100353 IP 10.0.0.1 > 10.0.0.2: ICMP echo request, id 7259, seq 95, length 64
00:00:01.112646 IP 10.0.0.1 > 10.0.0.2: ICMP echo request, id 7259, seq 96, length 64
00:00:01.125264 IP 10.0.0.1 > 10.0.0.2: ICMP echo request, id 7259, seq 97, length 64
00:00:01.136469 IP 10.0.0.1 > 10.0.0.2: ICMP echo request, id 7259, seq 98, length 64
00:00:01.148237 IP 10.0.0.1 > 10.0.0.2: ICMP echo request, id 7259, seq 99, length 64
00:00:01.161572 IP 10.0.0.1 > 10.0.0.2: ICMP echo request, id 7259, seq 100, length 64
00:00:01.173126 IP 10.0.0.1 > 10.0.0.2: ICMP echo request, id 7259, seq 101, length 64
00:00:01.184392 IP 10.0.0.1 > 10.0.0.2: ICMP echo request, id 7259, seq 102, length 64
00:00:01.196140 IP 10.0.0.1 > 10.0.0.2: ICMP echo request, id 7259, seq 103, length 64
00:00:01.209344 IP 10.0.0.1 > 10.0.0.2: ICMP echo request, id 7259, seq 104, length 64
00:00:01.220067 IP 10.0.0.1 > 10.0.0.2: ICMP echo request, id 7259, seq 105, length 64
00:00:01.233333 IP 10.0.0.1 > 10.0.0.2: ICMP echo request, id 7259, seq 106, length 64
00:00:01.245999 IP 10.0.0.1 > 10.0.0.2: ICMP echo request, id 7259, seq 107, length 64
00:00:01.257256 IP 10.0.0.1 > 10.0.0.2: ICMP echo request, id 7259, seq 108, length 64
00:00:01.270952 IP 10.0.0.1 > 10.0.0.2: ICMP echo request, id 7259, seq 109, length 64
00:00:01.282227 IP 10.0.0.1 > 10.0.0.2: ICMP echo request, id 7259, seq 110, length 64
00:00:01.292220 IP 10.0.0.1 > 10.0.0.2: ICMP echo request, id 7259, seq 111, length 64
00:00:01.304210 IP 10.0.0.1 > 10.0.0.2: ICMP echo request, id 7259, seq 112, length 64
00:00:01.320335 IP 10.0.0.1 > 10.0.0.2: ICMP echo request, id 7259, seq 113, length 64
00:00:01.335967 IP 10.0.0.1 > 10.0.0.2: ICMP echo request, id 7259, seq 114, length 64
00:00:01.350642 IP 10.0.0.1 > 10.0.0.2: ICMP echo request, id 7259, seq 115, length 64
00:00:01.360646 IP 10.0.0.1 > 10.0.0.2: ICMP echo request, id 7259, seq 116, length 64
00:00:01.373128 IP 10.0.0.1 > 10.0.0.2: ICMP echo request, id 7259, seq 117, length 64
00:00:01.384341 IP 10.0.0.1 > 10.0.0.2: ICMP echo request, id 7259, seq 118, length 64
00:00:01.396526 IP 10.0.0.1 > 10.0.0.2: ICMP echo request, id 7259, seq 119, length 64
00:00:01.409322 IP 10.0.0.1 > 10.0.0.2: ICMP echo request, id 7259, seq 120, length 64
00:00:01.421021 IP 10.0.0.1 > 10.0.0.2: ICMP echo request, id 7259, seq 121, length 64
00:00:01.437145 IP 10.0.0.1 > 10.0.0.2: ICMP echo request, id 7259, seq 122, length 64
00:00:01.448399 IP 10.0.0.1 > 10.0.0.2: ICMP echo request, id 7259, seq 123, length 64
00:00:01.460594 IP 10.0.0.1 > 10.0.0.2: ICMP echo request, id 7259, seq 124, length 64
00:00:01.472296 IP 10.0.0.1 > 10.0.0.2: ICMP echo request, id 7259, seq 125, length 64
00:00:01.484070 IP 10.0.0.1 > 10.0.0.2: ICMP echo request, id 7259, seq 126, length 64
00:00:01.496281 IP 10.0.0.1 > 10.0.0.2: ICMP echo request, id 7259, seq 127, length 64
00:00:01.510972 IP 10.0.0.1 > 10.0.0.2: ICMP echo request, id 7259, seq 128, length 64
00:00:01.520967 IP 10.0.0.1 > 10.0.0.2: ICMP echo request, id 7259, seq 129, length 64
00:00:01.532419 IP 10.0.0.1 > 10.0.0.2: ICMP echo request, id 7259, seq 130, length 64
00:00:01.544176 IP 10.0.0.1 > 10.0.0.2: ICMP echo request, id 7259, seq 131, length 64
00:00:01.557532 IP 10.0.0.1 > 10.0.0.2: ICMP echo request, id 7259, seq 132, length 64
00:00:01.569653 IP 10.0.0.1 > 10.0.0.2: ICMP echo request, id 7259, seq 133, length 64
00:00:01.585343 IP 10.0.0.1 > 10.0.0.2: ICMP echo request, id 7259, seq 134, length 64
00:00:01.596185 IP 10.0.0.1 > 10.0.0.2: ICMP echo request, id 7259, seq 135, length 64
00:00:01.608753 IP 10.0.0.1 > 10.0.0.2: ICMP echo request, id 7259, seq 136, length 64
00:00:01.621475 IP 10.0.0.1 > 10.0.0.2: ICMP echo request, id 7259, seq 137, length 64
00:00:01.633673 IP 10.0.0.1 > 10.0.0.2: ICMP echo request, id 7259, seq 138, length 64
00:00:01.646854 IP 10.0.0.1 > 10.0.0.2: ICMP echo request, id 7259, seq 139, length 64
00:00:01.658176 IP 10.0.0.1 > 10.0.0.2: ICMP echo request, id 7259, seq 140, length 64
00:00:01.669792 IP 10.0.0.1 > 10.0.0.2: ICMP echo request, id 7259, seq 141, length 64
00:00:01.680976 IP 10.0.0.1 > 10.0.0.2: ICMP echo request, id 7259, seq 142, length 64
00:00:01.692263 IP 10.0.0.1 > 10.0.0.2: ICMP echo request, id 7259, seq 143, length 64
00:00:01.707443 IP 10.0.0.1 > 10.0.0.2: ICMP echo request, id 7259, seq 144, length 64
00:00:01.718119 IP 10.0.0.1 > 10.0.0.2: ICMP echo request, id 7259, seq 145, length 64
00:00:01.728893 IP 10.0.0.1 > 10.0.0.2: ICMP echo request, id 7259, seq 146, length 64
00:00:01.741687 IP 10.0.0.1 > 10.0.0.2: ICMP echo request, id 7259, seq 147, length 64
00:00:01.754321 IP 10.0.0.1 > 10.0.0.2: ICMP echo request, id 7259, seq 148, length 64
00:00:01.765114 IP 10.0.0.1 > 10.0.0.2: ICMP echo request, id 7259, seq 149, length 64
00:00:01.779259 IP 10.0.0.1 > 10.0.0.2: ICMP echo request, id 7259, seq 150, length 64
00:00:01.789543 IP 10.0.0.1 > 10.0.0.2: ICMP echo request, id 7259, seq 151, length 64
00:00:01.800329 IP 10.0.0.1 > 10.0.0.2: ICMP echo request, id 7259, seq 152, length 64
00:00:01.812955 IP 10.0.0.1 > 10.0.0.2: ICMP echo request, id 7259, seq 153, length 64
00:00:01.827649 IP 10.0.0.1 > 10.0.0.2: ICMP echo request, id 7259, seq 154, length 64
00:00:01.837645 IP 10.0.0.1 > 10.0.0.2: ICMP echo request, id 7259, seq 155, length 64
00:00:01.849169 IP 10.0.0.1 > 10.0.0.2: ICMP echo request, id 7259, seq 156, length 64
00:00:01.860896 IP 10.0.0.1 > 10.0.0.2: ICMP echo request, id 7259, seq 157, length 64
00:00:01.876528 IP 10.0.0.1 > 10.0.0.2: ICMP echo request, id 7259, seq 158, length 64
00:00:01.888307 IP 10.0.0.1 > 10.0.0.2: ICMP echo request, id 7259, seq 159, length 64
00:00:01.900991 IP 10.0.0.1 > 10.0.0.2: ICMP echo request, id 7259, seq 160, length 64
00:00:01.912249 IP 10.0.0.1 > 10.0.0.2: ICMP echo request, id 7259, seq 161, length 64
00:00:01.925405 IP 10.0.0.1 > 10.0.0.2: ICMP echo request, id 7259, seq 162, length 64
00:00:01.936646 IP 10.0.0.1 > 10.0.0.2: ICMP echo request, id 7259, seq 163, length 64
00:00:01.950370 IP 10.0.0.1 > 10.0.0.2: ICMP echo request, id 7259, seq 164, length 64
00:00:01.975053 IP 10.0.0.1 > 10.0.0.2: ICMP echo request, id 7259, seq 166, length 64
00:00:01.982974 IP 10.0.0.1 > 10.0.0.2: ICMP echo request, id 7259, seq 167, length 64
00:00:01.992798 IP 10.0.0.1 > 10.0.0.2: ICMP echo request, id 7259, seq 168, length 64
00:00:02.005101 IP 10.0.0.1 > 10.0.0.2: ICMP echo request, id 7259, seq 169, length 64
00:00:02.016332 IP 10.0.0.1 > 10.0.0.2: ICMP echo request, id 7259, seq 170, length 64
00:00:02.029539 IP 10.0.0.1 > 10.0.0.2: ICMP echo request, id 7259, seq 171, length 64
00:00:02.041749 IP 10.0.0.1 > 10.0.0.2: ICMP echo request, id 7259, seq 172, length 64
00:00:02.052515 IP 10.0.0.1 > 10.0.0.2: ICMP echo request, id 7259, seq 173, length 64
00:00:02.066245 IP 10.0.0.1 > 10.0.0.2: ICMP echo request, id 7259, seq 174, length 64
00:00:02.079423 IP 10.0.0.1 > 10.0.0.2: ICMP echo request, id 7259, seq 175, length 64
00:00:02.089406 IP 10.0.0.1 > 10.0.0.2: ICMP echo request, id 7259, seq 176, length 64
00:00:02.100923 IP 10.0.0.1 > 10.0.0.2: ICMP echo request, id 7259, seq 177, length 64
00:00:02.112228 IP 10.0.0.1 > 10.0.0.2: ICMP echo request, id 7259, seq 178, length 64
00:00:02.126345 IP 10.0.0.1 > 10.0.0.2: ICMP echo request, id 7259, seq 179, length 64
00:00:02.137077 IP 10.0.0.1 > 10.0.0.2: ICMP echo request, id 7259, seq 180, length 64
00:00:02.152734 IP 10.0.0.1 > 10.0.0.2: ICMP echo request, id 7259, seq 181, length 64
00:00:02.165970 IP 10.0.0.1 > 10.0.0.2: ICMP echo request, id 7259, seq 182, length 64
00:00:02.176696 IP 10.0.0.1 > 10.0.0.2: ICMP echo request, id 7259, seq 183, length 64
00:00:02.189553 IP 10.0.0.1 > 10.0.0.2: ICMP echo request, id 7259, seq 184, length 64
00:00:02.202083 IP 10.0.0.1 > 10.0.0.2: ICMP echo request, id 7259, seq 185, length 64
00:00:02.212350 IP 10.0.0.1 > 10.0.0.2: ICMP echo request, id 7259, seq 186, length 64
00:00:02.224039 IP 10.0.0.1 > 10.0.0.2: ICMP echo request, id 7259, seq 187, length 64
00:00:02.237276 IP 10.0.0.1 > 10.0.0.2: ICMP echo request, id 7259, seq 188, length 64
00:00:02.248537 IP 10.0.0.1 > 10.0.0.2: ICMP echo request, id 7259, seq 189, length 64
00:00:02.261213 IP 10.0.0.1 > 10.0.0.2: ICMP echo request, id 7259, seq 190, length 64
00:00:02.277354 IP 10.0.0.1 > 10.0.0.2: ICMP echo request, id 7259, seq 191, length 64
00:00:02.288210 IP 10.0.0.1 > 10.0.0.2: ICMP echo request, id 7259, seq 192, length 64
00:00:02.301774 IP 10.0.0.1 > 10.0.0.2: ICMP echo request, id 7259, seq 193, length 64
00:00:02.312584 IP 10.0.0.1 > 10.0.0.2: ICMP echo request, id 7259, seq 194, length 64
00:00:02.324302 IP 10.0.0.1 > 10.0.0.2: ICMP echo request, id 7259, seq 195, length 64
00:00:02.338055 IP 10.0.0.1 > 10.0.0.2: ICMP echo request, id 7259, seq 196, length 64
00:00:02.348716 IP 10.0.0.1 > 10.0.0.2: ICMP echo request, id 7259, seq 197, length 64
00:00:02.359962 IP 10.0.0.1 > 10.0.0.2: ICMP echo request, id 7259, seq 198, length 64
00:00:02.375159 IP 10.0.0.1 > 10.0.0.2: ICMP echo request, id 7259, seq 199, length 64
00:00:02.385547 IP 10.0.0.1 > 10.0.0.2: ICMP echo request, id 7259, seq 200, length 64
00:00:02.398646 IP 10.0.0.1 > 10.0.0.2: ICMP echo request, id 7259, seq 201, length 64
00:00:02.411786 IP 10.0.0.1 > 10.0.0.2: ICMP echo request, id 7259, seq 202, length 64
00:00:02.421792 IP 10.0.0.1 > 10.0.0.2: ICMP echo request, id 7259, seq 203, length 64
00:00:02.432813 IP 10.0.0.1 > 10.0.0.2: ICMP echo request, id 7259, seq 204, length 64
00:00:02.447459 IP 10.0.0.1 > 10.0.0.2: ICMP echo request, id 7259, seq 205, length 64
00:00:02.457456 IP 10.0.0.1 > 10.0.0.2: ICMP echo request, id 7259, seq 206, length 64
00:00:02.467995 IP 10.0.0.1 > 10.0.0.2: ICMP echo request, id 7259, seq 207, length 64
00:00:02.481192 IP 10.0.0.1 > 10.0.0.2: ICMP echo request, id 7259, seq 208, length 64
00:00:02.495857 IP 10.0.0.1 > 10.0.0.2: ICMP echo request, id 7259, seq 209, length 64
00:00:02.506117 IP 10.0.0.1 > 10.0.0.2: ICMP echo request, id 7259, seq 210, length 64
00:00:02.516460 IP 10.0.0.1 > 10.0.0.2: ICMP echo request, id 7259, seq 211, length 64
00:00:02.532955 IP 10.0.0.1 > 10.0.0.2: ICMP echo request, id 7259, seq 212, length 64
00:00:02.544211 IP 10.0.0.1 > 10.0.0.2: ICMP echo request, id 7259, seq 213, length 64
00:00:02.561389 IP 10.0.0.1 > 10.0.0.2: ICMP echo request, id 7259, seq 214, length 64
00:00:02.572099 IP 10.0.0.1 > 10.0.0.2: ICMP echo request, id 7259, seq 215, length 64
00:00:02.584303 IP 10.0.0.1 > 10.0.0.2: ICMP echo request, id 7259, seq 216, length 64
00:00:02.597496 IP 10.0.0.1 > 10.0.0.2: ICMP echo request, id 7259, seq 217, length 64
00:00:02.611684 IP 10.0.0.1 > 10.0.0.2: ICMP echo request, id 7259, seq 218, length 64
00:00:02.621690 IP 10.0.0.1 > 10.0.0.2: ICMP echo request, id 7259, seq 219, length 64
00:00:02.632738 IP 10.0.0.1 > 10.0.0.2: ICMP echo request, id 7259, seq 220, length 64
00:00:02.647393 IP 10.0.0.1 > 10.0.0.2: ICMP echo request, id 7259, seq 221, length 64
00:00:02.659184 IP 10.0.0.1 > 10.0.0.2: ICMP echo request, id 7259, seq 222, length 64
00:00:02.669881 IP 10.0.0.1 > 10.0.0.2: ICMP echo request, id 7259, seq 223, length 64
00:00:02.680654 IP 10.0.0.1 > 10.0.0.2: ICMP echo request, id 7259, seq 224, length 64
00:00:02.696313 IP 10.0.0.1 > 10.0.0.2: ICMP echo request, id 7259, seq 225, length 64
00:00:02.711580 IP 10.0.0.1 > 10.0.0.2: ICMP echo request, id 7259, seq 226, length 64
00:00:02.721575 IP 10.0.0.1 > 10.0.0.2: ICMP echo request, id 7259, seq 227, length 64
00:00:02.732450 IP 10.0.0.1 > 10.0.0.2: ICMP echo request, id 7259, seq 228, length 64
00:00:02.744658 IP 10.0.0.1 > 10.0.0.2: ICMP echo request, id 7259, seq 229, length 64
00:00:02.756331 IP 10.0.0.1 > 10.0.0.2: ICMP echo request, id 7259, seq 230, length 64
00:00:02.770102 IP 10.0.0.1 > 10.0.0.2: ICMP echo request, id 7259, seq 231, length 64
00:00:02.780377 IP 10.0.0.1 > 10.0.0.2: ICMP echo request, id 7259, seq 232, length 64
00:00:02.793063 IP 10.0.0.1 > 10.0.0.2: ICMP echo request, id 7259, seq 233, length 64
00:00:02.808738 IP 10.0.0.1 > 10.0.0.2: ICMP echo request, id 7259, seq 234, length 64
00:00:02.820452 IP 10.0.0.1 > 10.0.0.2: ICMP echo request, id 7259, seq 235, length 64
00:00:02.835647 IP 10.0.0.1 > 10.0.0.2: ICMP echo request, id 7259, seq 236, length 64
