00:00:00.000000 IP 10.0.0.1 > 10.0.0.2: ICMP echo request, id 4393, seq 5, length 64
00:00:00.012238 IP 10.0.0.1 > 10.0.0.2: ICMP echo request, id 4393, seq 6, length 64
00:00:00.023931 IP 10.0.0.1 > 10.0.0.2: ICMP echo request, id 4393, seq 7, length 64
00:00:00.037156 IP 10.0.0.1 > 10.0.0.2: ICMP echo request, id 4393, seq 8, length 64
00:00:00.047882 IP 10.0.0.1 > 10.0.0.2: ICMP echo request, id 4393, seq 9, length 64
00:00:00.059635 IP 10.0.0.1 > 10.0.0.2: ICMP echo request, id 4393, seq 10, length 64
00:00:00.071550 IP 10.0.0.1 > 10.0.0.2: ICMP echo request, id 4393, seq 11, length 64
00:00:00.084087 IP 10.0.0.1 > 10.0.0.2: ICMP echo request, id 4393, seq 12, length 64
00:00:00.098011 IP 10.0.0.1 > 10.0.0.2: ICMP echo request, id 4393, seq 13, length 64
00:00:00.107992 IP 10.0.0.1 > 10.0.0.2: ICMP echo request, id 4393, seq 14, length 64
00:00:00.119757 IP 10.0.0.1 > 10.0.0.2: ICMP echo request, id 4393, seq 15, length 64
00:00:00.131560 IP 10.0.0.1 > 10.0.0.2: ICMP echo request, id 4393, seq 16, length 64
00:00:00.143719 IP 10.0.0.1 > 10.0.0.2: ICMP echo request, id 4393, seq 17, length 64
00:00:00.158866 IP 10.0.0.1 > 10.0.0.2: ICMP echo request, id 4393, seq 18, length 64
00:00:00.168860 IP 10.0.0.1 > 10.0.0.2: ICMP echo request, id 4393, seq 19, length 64
00:00:00.180864 IP 10.0.0.1 > 10.0.0.2: ICMP echo request, id 4393, seq 20, length 64
00:00:00.191614 IP 10.0.0.1 > 10.0.0.2: ICMP echo request, id 4393, seq 21, length 64
00:00:00.203817 IP 10.0.0.1 > 10.0.0.2: ICMP echo request, id 4393, seq 22, length 64
00:00:00.215559 IP 10.0.0.1 > 10.0.0.2: ICMP echo request, id 4393, seq 23, length 64
00:00:00.228257 IP 10.0.0.1 > 10.0.0.2: ICMP echo request, id 4393, seq 24, length 64
00:00:00.239983 IP 10.0.0.1 > 10.0.0.2: ICMP echo request, id 4393, seq 25, length 64
00:00:00.251742 IP 10.0.0.1 > 10.0.0.2: ICMP echo request, id 4393, seq 26, length 64
00:00:00.265946 IP 10.0.0.1 > 10.0.0.2: ICMP echo request, id 4393, seq 27, length 64
00:00:00.275936 IP 10.0.0.1 > 10.0.0.2: ICMP echo request, id 4393, seq 28, length 64
00:00:00.288920 IP 10.0.0.1 > 10.0.0.2: ICMP echo request, id 4393, seq 29, length 64
00:00:00.300107 IP 10.0.0.1 > 10.0.0.2: ICMP echo request, id 4393, seq 30, length 64
00:00:00.315271 IP 10.0.0.1 > 10.0.0.2: ICMP echo request, id 4393, seq 31, length 64
00:00:00.325268 IP 10.0.0.1 > 10.0.0.2: ICMP echo request, id 4393, seq 32, length 64
00:00:00.335820 IP 10.0.0.1 > 10.0.0.2: ICMP echo request, id 4393, seq 33, length 64
00:00:00.347595 IP 10.0.0.1 > 10.0.0.2: ICMP echo request, id 4393, seq 34, length 64
00:00:00.360742 IP 10.0.0.1 > 10.0.0.2: ICMP echo request, id 4393, seq 35, length 64
00:00:00.371564 IP 10.0.0.1 > 10.0.0.2: ICMP echo request, id 4393, seq 36, length 64
00:00:00.383710 IP 10.0.0.1 > 10.0.0.2: ICMP echo request, id 4393, seq 37, length 64
00:00:00.395567 IP 10.0.0.1 > 10.0.0.2: ICMP echo request, id 4393, seq 38, length 64
00:00:00.408171 IP 10.0.0.1 > 10.0.0.2: ICMP echo request, id 4393, seq 39, length 64
00:00:00.419909 IP 10.0.0.1 > 10.0.0.2: ICMP echo request, id 4393, seq 40, length 64
00:00:00.431652 IP 10.0.0.1 > 10.0.0.2: ICMP echo request, id 4393, seq 41, length 64
00:00:00.443863 IP 10.0.0.1 > 10.0.0.2: ICMP echo request, id 4393, seq 42, length 64
00:00:00.456569 IP 10.0.0.1 > 10.0.0.2: ICMP echo request, id 4393, seq 43, length 64
00:00:00.467802 IP 10.0.0.1 > 10.0.0.2: ICMP echo request, id 4393, seq 44, length 64
00:00:00.483990 IP 10.0.0.1 > 10.0.0.2: ICMP echo request, id 4393, seq 45, length 64
00:00:00.495651 IP 10.0.0.1 > 10.0.0.2: ICMP echo request, id 4393, seq 46, length 64
00:00:00.507885 IP 10.0.0.1 > 10.0.0.2: ICMP echo request, id 4393, seq 47, length 64
00:00:00.519604 IP 10.0.0.1 > 10.0.0.2: ICMP echo request, id 4393, seq 48, length 64
00:00:00.533308 IP 10.0.0.1 > 10.0.0.2: ICMP echo request, id 4393, seq 49, length 64
00:00:00.543630 IP 10.0.0.1 > 10.0.0.2: ICMP echo request, id 4393, seq 50, length 64
00:00:00.555791 IP 10.0.0.1 > 10.0.0.2: ICMP echo request, id 4393, seq 51, length 64
00:00:00.568233 IP 10.0.0.1 > 10.0.0.2: ICMP echo request, id 4393, seq 52, length 64
00:00:00.579715 IP 10.0.0.1 > 10.0.0.2: ICMP echo request, id 4393, seq 53, length 64
00:00:00.591969 IP 10.0.0.1 > 10.0.0.2: ICMP echo request, id 4393, seq 54, length 64
00:00:00.603701 IP 10.0.0.1 > 10.0.0.2: ICMP echo request, id 4393, seq 55, length 64
00:00:00.615889 IP 10.0.0.1 > 10.0.0.2: ICMP echo request, id 4393, seq 56, length 64
00:00:00.627642 IP 10.0.0.1 > 10.0.0.2: ICMP echo request, id 4393, seq 57, length 64
00:00:00.640528 IP 10.0.0.1 > 10.0.0.2: ICMP echo request, id 4393, seq 58, length 64
00:00:00.652084 IP 10.0.0.1 > 10.0.0.2: ICMP echo request, id 4393, seq 59, length 64
00:00:00.663807 IP 10.0.0.1 > 10.0.0.2: ICMP echo request, id 4393, seq 60, length 64
00:00:00.676041 IP 10.0.0.1 > 10.0.0.2: ICMP echo request, id 4393, seq 61, length 64
00:00:00.687568 IP 10.0.0.1 > 10.0.0.2: ICMP echo request, id 4393, seq 62, length 64
00:00:00.699569 IP 10.0.0.1 > 10.0.0.2: ICMP echo request, id 4393, seq 63, length 64
00:00:00.713734 IP 10.0.0.1 > 10.0.0.2: ICMP echo request, id 4393, seq 64, length 64
00:00:00.723736 IP 10.0.0.1 > 10.0.0.2: ICMP echo request, id 4393, seq 65, length 64
00:00:00.735686 IP 10.0.0.1 > 10.0.0.2: ICMP echo request, id 4393, seq 66, length 64
00:00:00.747877 IP 10.0.0.1 > 10.0.0.2: ICMP echo request, id 4393, seq 67, length 64
00:00:00.759711 IP 10.0.0.1 > 10.0.0.2: ICMP echo request, id 4393, seq 68, length 64
00:00:00.772295 IP 10.0.0.1 > 10.0.0.2: ICMP echo request, id 4393, seq 69, length 64
00:00:00.783570 IP 10.0.0.1 > 10.0.0.2: ICMP echo request, id 4393, seq 70, length 64
00:00:00.795567 IP 10.0.0.1 > 10.0.0.2: ICMP echo request, id 4393, seq 71, length 64
00:00:00.807958 IP 10.0.0.1 > 10.0.0.2: ICMP echo request, id 4393, seq 72, length 64
00:00:00.819783 IP 10.0.0.1 > 10.0.0.2: ICMP echo request, id 4393, seq 73, length 64
00:00:00.834904 IP 10.0.0.1 > 10.0.0.2: ICMP echo request, id 4393, seq 74, length 64
00:00:00.844898 IP 10.0.0.1 > 10.0.0.2: ICMP echo request, id 4393, seq 75, length 64
00:00:00.855569 IP 10.0.0.1 > 10.0.0.2: ICMP echo request, id 4393, seq 76, length 64
00:00:00.867600 IP 10.0.0.1 > 10.0.0.2: ICMP echo request, id 4393, seq 77, length 64
00:00:00.880340 IP 10.0.0.1 > 10.0.0.2: ICMP echo request, id 4393, seq 78, length 64
00:00:00.891684 IP 10.0.0.1 > 10.0.0.2: ICMP echo request, id 4393, seq 79, length 64
00:00:00.903809 IP 10.0.0.1 > 10.0.0.2: ICMP echo request, id 4393, seq 80, length 64
00:00:00.915589 IP 10.0.0.1 > 10.0.0.2: ICMP echo request, id 4393, seq 81, length 64
00:00:00.927770 IP 10.0.0.1 > 10.0.0.2: ICMP echo request, id 4393, seq 82, length 64
00:00:00.939584 IP 10.0.0.1 > 10.0.0.2: ICMP echo request, id 4393, seq 83, length 64
00:00:00.953236 IP 10.0.0.1 > 10.0.0.2: ICMP echo request, id 4393, seq 84, length 64
00:00:00.963978 IP 10.0.0.1 > 10.0.0.2: ICMP echo request, id 4393, seq 85, length 64
00:00:00.976184 IP 10.0.0.1 > 10.0.0.2: ICMP echo request, id 4393, seq 86, length 64
00:00:00.987550 IP 10.0.0.1 > 10.0.0.2: ICMP echo request, id 4393, seq 87, length 64
00:00:00.999658 IP 10.0.0.1 > 10.0.0.2: ICMP echo request, id 4393, seq 88, length 64
00:00:01.015766 IP 10.0.0.1 > 10.0.0.2: ICMP echo request, id 4393, seq 89, length 64
00:00:01.028026 IP 10.0.0.1 > 10.0.0.2: ICMP echo request, id 4393, seq 90, length 64
00:00:01.039712 IP 10.0.0.1 > 10.0.0.2: ICMP echo request, id 4393, seq 91, length 64
00:00:01.051957 IP 10.0.0.1 > 10.0.0.2: ICMP echo request, id 4393, seq 92, length 64
00:00:01.063647 IP 10.0.0.1 > 10.0.0.2: ICMP echo request, id 4393, seq 93, length 64
00:00:01.075587 IP 10.0.0.1 > 10.0.0.2: ICMP echo request, id 4393, seq 94, length 64
00:00:01.088091 IP 10.0.0.1 > 10.0.0.2: ICMP echo request, id 4393, seq 95, length 64
00:00:01.099821 IP 10.0.0.1 > 10.0.0.2: ICMP echo request, id 4393, seq 96, length 64
00:00:01.111576 IP 10.0.0.1 > 10.0.0.2: ICMP echo request, id 4393, seq 97, length 64
00:00:01.124286 IP 10.0.0.1 > 10.0.0.2: ICMP echo request, id 4393, seq 98, length 64
00:00:01.135991 IP 10.0.0.1 > 10.0.0.2: ICMP echo request, id 4393, seq 99, length 64
00:00:01.147739 IP 10.0.0.1 > 10.0.0.2: ICMP echo request, id 4393, seq 100, length 64
00:00:01.159966 IP 10.0.0.1 > 10.0.0.2: ICMP echo request, id 4393, seq 101, length 64
00:00:01.172161 IP 10.0.0.1 > 10.0.0.2: ICMP echo request, id 4393, seq 102, length 64
00:00:01.183900 IP 10.0.0.1 > 10.0.0.2: ICMP echo request, id 4393, seq 103, length 64
00:00:01.196789 IP 10.0.0.1 > 10.0.0.2: ICMP echo request, id 4393, seq 104, length 64
00:00:01.208397 IP 10.0.0.1 > 10.0.0.2: ICMP echo request, id 4393, seq 105, length 64
00:00:01.219615 IP 10.0.0.1 > 10.0.0.2: ICMP echo request, id 4393, seq 106, length 64
00:00:01.231583 IP 10.0.0.1 > 10.0.0.2: ICMP echo request, id 4393, seq 107, length 64
00:00:01.243594 IP 10.0.0.1 > 10.0.0.2: ICMP echo request, id 4393, seq 108, length 64
00:00:01.263655 IP 10.0.0.1 > 10.0.0.2: ICMP echo request, id 4393, seq 109, length 64
00:00:01.275833 IP 10.0.0.1 > 10.0.0.2: ICMP echo request, id 4393, seq 110, length 64
00:00:01.288029 IP 10.0.0.1 > 10.0.0.2: ICMP echo request, id 4393, seq 111, length 64
00:00:01.299800 IP 10.0.0.1 > 10.0.0.2: ICMP echo request, id 4393, seq 112, length 64
00:00:01.311989 IP 10.0.0.1 > 10.0.0.2: ICMP echo request, id 4393, seq 113, length 64
00:00:01.326193 IP 10.0.0.1 > 10.0.0.2: ICMP echo request, id 4393, seq 114, length 64
00:00:01.336194 IP 10.0.0.1 > 10.0.0.2: ICMP echo request, id 4393, seq 115, length 64
00:00:01.347625 IP 10.0.0.1 > 10.0.0.2: ICMP echo request, id 4393, seq 116, length 64
00:00:01.359862 IP 10.0.0.1 > 10.0.0.2: ICMP echo request, id 4393, seq 117, length 64
00:00:01.372555 IP 10.0.0.1 > 10.0.0.2: ICMP echo request, id 4393, seq 118, length 64
00:00:01.385741 IP 10.0.0.1 > 10.0.0.2: ICMP echo request, id 4393, seq 119, length 64
00:00:01.395738 IP 10.0.0.1 > 10.0.0.2: ICMP echo request, id 4393, seq 120, length 64
00:00:01.407734 IP 10.0.0.1 > 10.0.0.2: ICMP echo request, id 4393, seq 121, length 64
00:00:01.419572 IP 10.0.0.1 > 10.0.0.2: ICMP echo request, id 4393, seq 122, length 64
00:00:01.431689 IP 10.0.0.1 > 10.0.0.2: ICMP echo request, id 4393, seq 123, length 64
00:00:01.443528 IP 10.0.0.1 > 10.0.0.2: ICMP echo request, id 4393, seq 124, length 64
00:00:01.455650 IP 10.0.0.1 > 10.0.0.2: ICMP echo request, id 4393, seq 125, length 64
00:00:01.467889 IP 10.0.0.1 > 10.0.0.2: ICMP echo request, id 4393, seq 126, length 64
00:00:01.481071 IP 10.0.0.1 > 10.0.0.2: ICMP echo request, id 4393, seq 127, length 64
00:00:01.492082 IP 10.0.0.1 > 10.0.0.2: ICMP echo request, id 4393, seq 128, length 64
00:00:01.503559 IP 10.0.0.1 > 10.0.0.2: ICMP echo request, id 4393, seq 129, length 64
00:00:01.515794 IP 10.0.0.1 > 10.0.0.2: ICMP echo request, id 4393, seq 130, length 64
00:00:01.528484 IP 10.0.0.1 > 10.0.0.2: ICMP echo request, id 4393, seq 131, length 64
00:00:01.539729 IP 10.0.0.1 > 10.0.0.2: ICMP echo request, id 4393, seq 132, length 64
00:00:01.551544 IP 10.0.0.1 > 10.0.0.2: ICMP echo request, id 4393, seq 133, length 64
00:00:01.564167 IP 10.0.0.1 > 10.0.0.2: ICMP echo request, id 4393, seq 134, length 64
00:00:01.576588 IP 10.0.0.1 > 10.0.0.2: ICMP echo request, id 4393, seq 135, length 64
00:00:01.587651 IP 10.0.0.1 > 10.0.0.2: ICMP echo request, id 4393, seq 136, length 64
00:00:01.601807 IP 10.0.0.1 > 10.0.0.2: ICMP echo request, id 4393, seq 137, length 64
00:00:01.613551 IP 10.0.0.1 > 10.0.0.2: ICMP echo request, id 4393, seq 138, length 64
00:00:01.623788 IP 10.0.0.1 > 10.0.0.2: ICMP echo request, id 4393, seq 139, length 64
00:00:01.635569 IP 10.0.0.1 > 10.0.0.2: ICMP echo request, id 4393, seq 140, length 64
00:00:01.648275 IP 10.0.0.1 > 10.0.0.2: ICMP echo request, id 4393, seq 141, length 64
00:00:01.660969 IP 10.0.0.1 > 10.0.0.2: ICMP echo request, id 4393, seq 142, length 64
00:00:01.671700 IP 10.0.0.1 > 10.0.0.2: ICMP echo request, id 4393, seq 143, length 64
00:00:01.687345 IP 10.0.0.1 > 10.0.0.2: ICMP echo request, id 4393, seq 144, length 64
00:00:01.697343 IP 10.0.0.1 > 10.0.0.2: ICMP echo request, id 4393, seq 145, length 64
00:00:01.707893 IP 10.0.0.1 > 10.0.0.2: ICMP echo request, id 4393, seq 146, length 64
00:00:01.720100 IP 10.0.0.1 > 10.0.0.2: ICMP echo request, id 4393, seq 147, length 64
00:00:01.732795 IP 10.0.0.1 > 10.0.0.2: ICMP echo request, id 4393, seq 148, length 64
00:00:01.743546 IP 10.0.0.1 > 10.0.0.2: ICMP echo request, id 4393, seq 149, length 64
00:00:01.757746 IP 10.0.0.1 > 10.0.0.2: ICMP echo request, id 4393, seq 150, length 64
00:00:01.767733 IP 10.0.0.1 > 10.0.0.2: ICMP echo request, id 4393, seq 151, length 64
00:00:01.780218 IP 10.0.0.1 > 10.0.0.2: ICMP echo request, id 4393, seq 152, length 64
00:00:01.791934 IP 10.0.0.1 > 10.0.0.2: ICMP echo request, id 4393, seq 153, length 64
00:00:01.803749 IP 10.0.0.1 > 10.0.0.2: ICMP echo request, id 4393, seq 154, length 64
00:00:01.815888 IP 10.0.0.1 > 10.0.0.2: ICMP echo request, id 4393, seq 155, length 64
00:00:01.827621 IP 10.0.0.1 > 10.0.0.2: ICMP echo request, id 4393, seq 156, length 64
00:00:01.839845 IP 10.0.0.1 > 10.0.0.2: ICMP echo request, id 4393, seq 157, length 64
00:00:01.851596 IP 10.0.0.1 > 10.0.0.2: ICMP echo request, id 4393, seq 158, length 64
00:00:01.863794 IP 10.0.0.1 > 10.0.0.2: ICMP echo request, id 4393, seq 159, length 64
00:00:01.876034 IP 10.0.0.1 > 10.0.0.2: ICMP echo request, id 4393, seq 160, length 64
00:00:01.887816 IP 10.0.0.1 > 10.0.0.2: ICMP echo request, id 4393, seq 161, length 64
00:00:01.900066 IP 10.0.0.1 > 10.0.0.2: ICMP echo request, id 4393, seq 162, length 64
00:00:01.911903 IP 10.0.0.1 > 10.0.0.2: ICMP echo request, id 4393, seq 163, length 64
00:00:01.924034 IP 10.0.0.1 > 10.0.0.2: ICMP echo request, id 4393, seq 164, length 64
00:00:01.937215 IP 10.0.0.1 > 10.0.0.2: ICMP echo request, id 4393, seq 165, length 64
00:00:01.947589 IP 10.0.0.1 > 10.0.0.2: ICMP echo request, id 4393, seq 166, length 64
00:00:02.572292 IP 10.0.0.1 > 10.0.0.2: ICMP echo request, id 4393, seq 211, length 64
00:00:02.580278 IP 10.0.0.1 > 10.0.0.2: ICMP echo request, id 4393, seq 212, length 64
00:00:02.591642 IP 10.0.0.1 > 10.0.0.2: ICMP echo request, id 4393, seq 213, length 64
00:00:02.603867 IP 10.0.0.1 > 10.0.0.2: ICMP echo request, id 4393, seq 214, length 64
00:00:02.616074 IP 10.0.0.1 > 10.0.0.2: ICMP echo request, id 4393, seq 215, length 64
00:00:02.627823 IP 10.0.0.1 > 10.0.0.2: ICMP echo request, id 4393, seq 216, length 64
00:00:02.639562 IP 10.0.0.1 > 10.0.0.2: ICMP echo request, id 4393, seq 217, length 64
00:00:02.651758 IP 10.0.0.1 > 10.0.0.2: ICMP echo request, id 4393, seq 218, length 64
00:00:02.663545 IP 10.0.0.1 > 10.0.0.2: ICMP echo request, id 4393, seq 219, length 64
00:00:02.675727 IP 10.0.0.1 > 10.0.0.2: ICMP echo request, id 4393, seq 220, length 64
00:00:02.687636 IP 10.0.0.1 > 10.0.0.2: ICMP echo request, id 4393, seq 221, length 64
00:00:02.699682 IP 10.0.0.1 > 10.0.0.2: ICMP echo request, id 4393, seq 222, length 64
00:00:02.711894 IP 10.0.0.1 > 10.0.0.2: ICMP echo request, id 4393, seq 223, length 64
00:00:02.723622 IP 10.0.0.1 > 10.0.0.2: ICMP echo request, id 4393, seq 224, length 64
00:00:02.736801 IP 10.0.0.1 > 10.0.0.2: ICMP echo request, id 4393, seq 225, length 64
00:00:02.747560 IP 10.0.0.1 > 10.0.0.2: ICMP echo request, id 4393, seq 226, length 64
00:00:02.759782 IP 10.0.0.1 > 10.0.0.2: ICMP echo request, id 4393, seq 227, length 64
00:00:02.772500 IP 10.0.0.1 > 10.0.0.2: ICMP echo request, id 4393, seq 228, length 64
00:00:02.784243 IP 10.0.0.1 > 10.0.0.2: ICMP echo request, id 4393, seq 229, length 64
00:00:02.795536 IP 10.0.0.1 > 10.0.0.2: ICMP echo request, id 4393, seq 230, length 64
00:00:02.807682 IP 10.0.0.1 > 10.0.0.2: ICMP echo request, id 4393, seq 231, length 64
00:00:02.819556 IP 10.0.0.1 > 10.0.0.2: ICMP echo request, id 4393, seq 232, length 64
00:00:02.831650 IP 10.0.0.1 > 10.0.0.2: ICMP echo request, id 4393, seq 233, length 64
00:00:02.843864 IP 10.0.0.1 > 10.0.0.2: ICMP echo request, id 4393, seq 234, length 64
00:00:02.856574 IP 10.0.0.1 > 10.0.0.2: ICMP echo request, id 4393, seq 235, length 64
00:00:02.867834 IP 10.0.0.1 > 10.0.0.2: ICMP echo request, id 4393, seq 236, length 64
00:00:02.880068 IP 10.0.0.1 > 10.0.0.2: ICMP echo request, id 4393, seq 237, length 64
00:00:02.893564 IP 10.0.0.1 > 10.0.0.2: ICMP echo request, id 4393, seq 238, length 64
00:00:02.903563 IP 10.0.0.1 > 10.0.0.2: ICMP echo request, id 4393, seq 239, length 64
00:00:02.916696 IP 10.0.0.1 > 10.0.0.2: ICMP echo request, id 4393, seq 240, length 64
00:00:02.927549 IP 10.0.0.1 > 10.0.0.2: ICMP echo request, id 4393, seq 241, length 64
00:00:02.939680 IP 10.0.0.1 > 10.0.0.2: ICMP echo request, id 4393, seq 242, length 64
00:00:02.954345 IP 10.0.0.1 > 10.0.0.2: ICMP echo request, id 4393, seq 243, length 64
00:00:02.964342 IP 10.0.0.1 > 10.0.0.2: ICMP echo request, id 4393, seq 244, length 64
