00:00:00.000000 IP 10.0.0.1 > 10.0.0.9: ICMP echo request, id 12754, seq 5, length 64
00:00:00.013093 IP 10.0.0.1 > 10.0.0.9: ICMP echo request, id 12754, seq 6, length 64
00:00:00.023802 IP 10.0.0.1 > 10.0.0.9: ICMP echo request, id 12754, seq 7, length 64
00:00:00.036038 IP 10.0.0.1 > 10.0.0.9: ICMP echo request, id 12754, seq 8, length 64
00:00:00.047911 IP 10.0.0.1 > 10.0.0.9: ICMP echo request, id 12754, seq 9, length 64
00:00:00.060517 IP 10.0.0.1 > 10.0.0.9: ICMP echo request, id 12754, seq 10, length 64
00:00:00.071762 IP 10.0.0.1 > 10.0.0.9: ICMP echo request, id 12754, seq 11, length 64
00:00:00.083977 IP 10.0.0.1 > 10.0.0.9: ICMP echo request, id 12754, seq 12, length 64
00:00:00.097184 IP 10.0.0.1 > 10.0.0.9: ICMP echo request, id 12754, seq 13, length 64
00:00:00.108981 IP 10.0.0.1 > 10.0.0.9: ICMP echo request, id 12754, seq 14, length 64
00:00:00.120581 IP 10.0.0.1 > 10.0.0.9: ICMP echo request, id 12754, seq 15, length 64
00:00:00.132007 IP 10.0.0.1 > 10.0.0.9: ICMP echo request, id 12754, seq 16, length 64
00:00:00.144714 IP 10.0.0.1 > 10.0.0.9: ICMP echo request, id 12754, seq 17, length 64
00:00:00.155873 IP 10.0.0.1 > 10.0.0.9: ICMP echo request, id 12754, seq 18, length 64
00:00:00.171486 IP 10.0.0.1 > 10.0.0.9: ICMP echo request, id 12754, seq 19, length 64
00:00:00.181479 IP 10.0.0.1 > 10.0.0.9: ICMP echo request, id 12754, seq 20, length 64
00:00:00.192581 IP 10.0.0.1 > 10.0.0.9: ICMP echo request, id 12754, seq 21, length 64
00:00:00.205741 IP 10.0.0.1 > 10.0.0.9: ICMP echo request, id 12754, seq 22, length 64
00:00:00.217000 IP 10.0.0.1 > 10.0.0.9: ICMP echo request, id 12754, seq 23, length 64
00:00:00.229528 IP 10.0.0.1 > 10.0.0.9: ICMP echo request, id 12754, seq 24, length 64
00:00:00.241966 IP 10.0.0.1 > 10.0.0.9: ICMP echo request, id 12754, seq 25, length 64
00:00:00.251939 IP 10.0.0.1 > 10.0.0.9: ICMP echo request, id 12754, seq 26, length 64
00:00:00.266394 IP 10.0.0.1 > 10.0.0.9: ICMP echo request, id 12754, seq 27, length 64
00:00:00.277143 IP 10.0.0.1 > 10.0.0.9: ICMP echo request, id 12754, seq 28, length 64
00:00:00.288419 IP 10.0.0.1 > 10.0.0.9: ICMP echo request, id 12754, seq 29, length 64
00:00:00.304546 IP 10.0.0.1 > 10.0.0.9: ICMP echo request, id 12754, seq 30, length 64
00:00:00.317763 IP 10.0.0.1 > 10.0.0.9: ICMP echo request, id 12754, seq 31, length 64
00:00:00.330464 IP 10.0.0.1 > 10.0.0.9: ICMP echo request, id 12754, seq 32, length 64
00:00:00.340471 IP 10.0.0.1 > 10.0.0.9: ICMP echo request, id 12754, seq 33, length 64
00:00:00.353935 IP 10.0.0.1 > 10.0.0.9: ICMP echo request, id 12754, seq 34, length 64
00:00:00.364202 IP 10.0.0.1 > 10.0.0.9: ICMP echo request, id 12754, seq 35, length 64
00:00:00.376425 IP 10.0.0.1 > 10.0.0.9: ICMP echo request, id 12754, seq 36, length 64
00:00:00.390185 IP 10.0.0.1 > 10.0.0.9: ICMP echo request, id 12754, seq 37, length 64
00:00:00.400902 IP 10.0.0.1 > 10.0.0.9: ICMP echo request, id 12754, seq 38, length 64
00:00:00.417048 IP 10.0.0.1 > 10.0.0.9: ICMP echo request, id 12754, seq 39, length 64
00:00:00.427801 IP 10.0.0.1 > 10.0.0.9: ICMP echo request, id 12754, seq 40, length 64
00:00:00.441995 IP 10.0.0.1 > 10.0.0.9: ICMP echo request, id 12754, seq 41, length 64
00:00:00.454709 IP 10.0.0.1 > 10.0.0.9: ICMP echo request, id 12754, seq 42, length 64
00:00:00.464698 IP 10.0.0.1 > 10.0.0.9: ICMP echo request, id 12754, seq 43, length 64
00:00:00.479706 IP 10.0.0.1 > 10.0.0.9: ICMP echo request, id 12754, seq 44, length 64
00:00:00.491377 IP 10.0.0.1 > 10.0.0.9: ICMP echo request, id 12754, seq 45, length 64
00:00:00.502102 IP 10.0.0.1 > 10.0.0.9: ICMP echo request, id 12754, seq 46, length 64
00:00:00.512870 IP 10.0.0.1 > 10.0.0.9: ICMP echo request, id 12754, seq 47, length 64
00:00:00.528996 IP 10.0.0.1 > 10.0.0.9: ICMP echo request, id 12754, seq 48, length 64
00:00:00.539805 IP 10.0.0.1 > 10.0.0.9: ICMP echo request, id 12754, seq 49, length 64
00:00:00.552014 IP 10.0.0.1 > 10.0.0.9: ICMP echo request, id 12754, seq 50, length 64
00:00:00.563775 IP 10.0.0.1 > 10.0.0.9: ICMP echo request, id 12754, seq 51, length 64
00:00:00.577556 IP 10.0.0.1 > 10.0.0.9: ICMP echo request, id 12754, seq 52, length 64
00:00:00.588215 IP 10.0.0.1 > 10.0.0.9: ICMP echo request, id 12754, seq 53, length 64
00:00:00.601413 IP 10.0.0.1 > 10.0.0.9: ICMP echo request, id 12754, seq 54, length 64
00:00:00.613262 IP 10.0.0.1 > 10.0.0.9: ICMP echo request, id 12754, seq 55, length 64
00:00:00.623892 IP 10.0.0.1 > 10.0.0.9: ICMP echo request, id 12754, seq 56, length 64
00:00:00.635986 IP 10.0.0.1 > 10.0.0.9: ICMP echo request, id 12754, seq 57, length 64
00:00:00.647800 IP 10.0.0.1 > 10.0.0.9: ICMP echo request, id 12754, seq 58, length 64
00:00:00.660155 IP 10.0.0.1 > 10.0.0.9: ICMP echo request, id 12754, seq 59, length 64
00:00:00.673525 IP 10.0.0.1 > 10.0.0.9: ICMP echo request, id 12754, seq 60, length 64
00:00:00.684557 IP 10.0.0.1 > 10.0.0.9: ICMP echo request, id 12754, seq 61, length 64
00:00:00.697299 IP 10.0.0.1 > 10.0.0.9: ICMP echo request, id 12754, seq 62, length 64
00:00:00.709010 IP 10.0.0.1 > 10.0.0.9: ICMP echo request, id 12754, seq 63, length 64
00:00:00.719763 IP 10.0.0.1 > 10.0.0.9: ICMP echo request, id 12754, seq 64, length 64
00:00:00.732012 IP 10.0.0.1 > 10.0.0.9: ICMP echo request, id 12754, seq 65, length 64
00:00:00.744214 IP 10.0.0.1 > 10.0.0.9: ICMP echo request, id 12754, seq 66, length 64
00:00:00.757922 IP 10.0.0.1 > 10.0.0.9: ICMP echo request, id 12754, seq 67, length 64
00:00:00.768201 IP 10.0.0.1 > 10.0.0.9: ICMP echo request, id 12754, seq 68, length 64
00:00:00.780461 IP 10.0.0.1 > 10.0.0.9: ICMP echo request, id 12754, seq 69, length 64
00:00:00.792228 IP 10.0.0.1 > 10.0.0.9: ICMP echo request, id 12754, seq 70, length 64
00:00:00.805386 IP 10.0.0.1 > 10.0.0.9: ICMP echo request, id 12754, seq 71, length 64
00:00:00.817602 IP 10.0.0.1 > 10.0.0.9: ICMP echo request, id 12754, seq 72, length 64
00:00:00.828367 IP 10.0.0.1 > 10.0.0.9: ICMP echo request, id 12754, seq 73, length 64
00:00:00.840048 IP 10.0.0.1 > 10.0.0.9: ICMP echo request, id 12754, seq 74, length 64
00:00:00.851819 IP 10.0.0.1 > 10.0.0.9: ICMP echo request, id 12754, seq 75, length 64
00:00:00.865497 IP 10.0.0.1 > 10.0.0.9: ICMP echo request, id 12754, seq 76, length 64
