00:00:00.000000 IP 10.0.0.1 > 10.0.0.9: ICMP echo request, id 3452, seq 6, length 64
00:00:00.012195 IP 10.0.0.1 > 10.0.0.9: ICMP echo request, id 3452, seq 7, length 64
00:00:00.023932 IP 10.0.0.1 > 10.0.0.9: ICMP echo request, id 3452, seq 8, length 64
00:00:00.036156 IP 10.0.0.1 > 10.0.0.9: ICMP echo request, id 3452, seq 9, length 64
00:00:00.047849 IP 10.0.0.1 > 10.0.0.9: ICMP echo request, id 3452, seq 10, length 64
00:00:00.060089 IP 10.0.0.1 > 10.0.0.9: ICMP echo request, id 3452, seq 11, length 64
00:00:00.072319 IP 10.0.0.1 > 10.0.0.9: ICMP echo request, id 3452, seq 12, length 64
00:00:00.084086 IP 10.0.0.1 > 10.0.0.9: ICMP echo request, id 3452, seq 13, length 64
00:00:00.097255 IP 10.0.0.1 > 10.0.0.9: ICMP echo request, id 3452, seq 14, length 64
00:00:00.109509 IP 10.0.0.1 > 10.0.0.9: ICMP echo request, id 3452, seq 15, length 64
00:00:00.121235 IP 10.0.0.1 > 10.0.0.9: ICMP echo request, id 3452, seq 16, length 64
00:00:00.131874 IP 10.0.0.1 > 10.0.0.9: ICMP echo request, id 3452, seq 17, length 64
00:00:00.143797 IP 10.0.0.1 > 10.0.0.9: ICMP echo request, id 3452, seq 18, length 64
00:00:00.155860 IP 10.0.0.1 > 10.0.0.9: ICMP echo request, id 3452, seq 19, length 64
00:00:00.168144 IP 10.0.0.1 > 10.0.0.9: ICMP echo request, id 3452, seq 20, length 64
00:00:00.179900 IP 10.0.0.1 > 10.0.0.9: ICMP echo request, id 3452, seq 21, length 64
00:00:00.192073 IP 10.0.0.1 > 10.0.0.9: ICMP echo request, id 3452, seq 22, length 64
00:00:00.203819 IP 10.0.0.1 > 10.0.0.9: ICMP echo request, id 3452, seq 23, length 64
00:00:00.216091 IP 10.0.0.1 > 10.0.0.9: ICMP echo request, id 3452, seq 24, length 64
00:00:00.228294 IP 10.0.0.1 > 10.0.0.9: ICMP echo request, id 3452, seq 25, length 64
00:00:00.239962 IP 10.0.0.1 > 10.0.0.9: ICMP echo request, id 3452, seq 26, length 64
00:00:00.251797 IP 10.0.0.1 > 10.0.0.9: ICMP echo request, id 3452, seq 27, length 64
00:00:00.266885 IP 10.0.0.1 > 10.0.0.9: ICMP echo request, id 3452, seq 28, length 64
00:00:00.276884 IP 10.0.0.1 > 10.0.0.9: ICMP echo request, id 3452, seq 29, length 64
00:00:00.288871 IP 10.0.0.1 > 10.0.0.9: ICMP echo request, id 3452, seq 30, length 64
00:00:00.301063 IP 10.0.0.1 > 10.0.0.9: ICMP echo request, id 3452, seq 31, length 64
00:00:00.311846 IP 10.0.0.1 > 10.0.0.9: ICMP echo request, id 3452, seq 32, length 64
00:00:00.326555 IP 10.0.0.1 > 10.0.0.9: ICMP echo request, id 3452, seq 33, length 64
00:00:00.336511 IP 10.0.0.1 > 10.0.0.9: ICMP echo request, id 3452, seq 34, length 64
00:00:00.348453 IP 10.0.0.1 > 10.0.0.9: ICMP echo request, id 3452, seq 35, length 64
00:00:00.359827 IP 10.0.0.1 > 10.0.0.9: ICMP echo request, id 3452, seq 36, length 64
00:00:00.374445 IP 10.0.0.1 > 10.0.0.9: ICMP echo request, id 3452, seq 37, length 64
00:00:00.384414 IP 10.0.0.1 > 10.0.0.9: ICMP echo request, id 3452, seq 38, length 64
00:00:00.395932 IP 10.0.0.1 > 10.0.0.9: ICMP echo request, id 3452, seq 39, length 64
00:00:00.408138 IP 10.0.0.1 > 10.0.0.9: ICMP echo request, id 3452, seq 40, length 64
00:00:00.419835 IP 10.0.0.1 > 10.0.0.9: ICMP echo request, id 3452, seq 41, length 64
00:00:00.432112 IP 10.0.0.1 > 10.0.0.9: ICMP echo request, id 3452, seq 42, length 64
00:00:00.445406 IP 10.0.0.1 > 10.0.0.9: ICMP echo request, id 3452, seq 43, length 64
00:00:00.456093 IP 10.0.0.1 > 10.0.0.9: ICMP echo request, id 3452, seq 44, length 64
00:00:00.467832 IP 10.0.0.1 > 10.0.0.9: ICMP echo request, id 3452, seq 45, length 64
00:00:00.480009 IP 10.0.0.1 > 10.0.0.9: ICMP echo request, id 3452, seq 46, length 64
00:00:00.491860 IP 10.0.0.1 > 10.0.0.9: ICMP echo request, id 3452, seq 47, length 64
00:00:00.503929 IP 10.0.0.1 > 10.0.0.9: ICMP echo request, id 3452, seq 48, length 64
00:00:00.516217 IP 10.0.0.1 > 10.0.0.9: ICMP echo request, id 3452, seq 49, length 64
00:00:00.527987 IP 10.0.0.1 > 10.0.0.9: ICMP echo request, id 3452, seq 50, length 64
00:00:00.539889 IP 10.0.0.1 > 10.0.0.9: ICMP echo request, id 3452, seq 51, length 64
00:00:00.551919 IP 10.0.0.1 > 10.0.0.9: ICMP echo request, id 3452, seq 52, length 64
00:00:00.564154 IP 10.0.0.1 > 10.0.0.9: ICMP echo request, id 3452, seq 53, length 64
00:00:00.575859 IP 10.0.0.1 > 10.0.0.9: ICMP echo request, id 3452, seq 54, length 64
00:00:00.588089 IP 10.0.0.1 > 10.0.0.9: ICMP echo request, id 3452, seq 55, length 64
00:00:00.600316 IP 10.0.0.1 > 10.0.0.9: ICMP echo request, id 3452, seq 56, length 64
00:00:00.611977 IP 10.0.0.1 > 10.0.0.9: ICMP echo request, id 3452, seq 57, length 64
00:00:00.626658 IP 10.0.0.1 > 10.0.0.9: ICMP echo request, id 3452, seq 58, length 64
00:00:00.636644 IP 10.0.0.1 > 10.0.0.9: ICMP echo request, id 3452, seq 59, length 64
00:00:00.648148 IP 10.0.0.1 > 10.0.0.9: ICMP echo request, id 3452, seq 60, length 64
00:00:00.659872 IP 10.0.0.1 > 10.0.0.9: ICMP echo request, id 3452, seq 61, length 64
00:00:00.672113 IP 10.0.0.1 > 10.0.0.9: ICMP echo request, id 3452, seq 62, length 64
00:00:00.683806 IP 10.0.0.1 > 10.0.0.9: ICMP echo request, id 3452, seq 63, length 64
00:00:00.697028 IP 10.0.0.1 > 10.0.0.9: ICMP echo request, id 3452, seq 64, length 64
00:00:00.707837 IP 10.0.0.1 > 10.0.0.9: ICMP echo request, id 3452, seq 65, length 64
00:00:00.720991 IP 10.0.0.1 > 10.0.0.9: ICMP echo request, id 3452, seq 66, length 64
00:00:00.731851 IP 10.0.0.1 > 10.0.0.9: ICMP echo request, id 3452, seq 67, length 64
00:00:00.743870 IP 10.0.0.1 > 10.0.0.9: ICMP echo request, id 3452, seq 68, length 64
00:00:00.755823 IP 10.0.0.1 > 10.0.0.9: ICMP echo request, id 3452, seq 69, length 64
00:00:00.767918 IP 10.0.0.1 > 10.0.0.9: ICMP echo request, id 3452, seq 70, length 64
00:00:00.780168 IP 10.0.0.1 > 10.0.0.9: ICMP echo request, id 3452, seq 71, length 64
00:00:00.792412 IP 10.0.0.1 > 10.0.0.9: ICMP echo request, id 3452, seq 72, length 64
00:00:00.804057 IP 10.0.0.1 > 10.0.0.9: ICMP echo request, id 3452, seq 73, length 64
00:00:00.816303 IP 10.0.0.1 > 10.0.0.9: ICMP echo request, id 3452, seq 74, length 64
00:00:00.831925 IP 10.0.0.1 > 10.0.0.9: ICMP echo request, id 3452, seq 75, length 64
00:00:00.843820 IP 10.0.0.1 > 10.0.0.9: ICMP echo request, id 3452, seq 76, length 64
