00:00:00.000000 IP 10.0.0.1 > 10.0.0.9: ICMP echo request, id 1167, seq 5, length 64
00:00:00.012143 IP 10.0.0.1 > 10.0.0.9: ICMP echo request, id 1167, seq 6, length 64
00:00:00.024833 IP 10.0.0.1 > 10.0.0.9: ICMP echo request, id 1167, seq 7, length 64
00:00:00.035741 IP 10.0.0.1 > 10.0.0.9: ICMP echo request, id 1167, seq 8, length 64
00:00:00.050844 IP 10.0.0.1 > 10.0.0.9: ICMP echo request, id 1167, seq 9, length 64
00:00:00.060827 IP 10.0.0.1 > 10.0.0.9: ICMP echo request, id 1167, seq 10, length 64
00:00:00.073237 IP 10.0.0.1 > 10.0.0.9: ICMP echo request, id 1167, seq 11, length 64
00:00:00.083550 IP 10.0.0.1 > 10.0.0.9: ICMP echo request, id 1167, seq 12, length 64
00:00:00.099318 IP 10.0.0.1 > 10.0.0.9: ICMP echo request, id 1167, seq 13, length 64
00:00:00.110464 IP 10.0.0.1 > 10.0.0.9: ICMP echo request, id 1167, seq 14, length 64
00:00:00.121131 IP 10.0.0.1 > 10.0.0.9: ICMP echo request, id 1167, seq 15, length 64
00:00:00.131926 IP 10.0.0.1 > 10.0.0.9: ICMP echo request, id 1167, seq 16, length 64
00:00:00.146665 IP 10.0.0.1 > 10.0.0.9: ICMP echo request, id 1167, seq 17, length 64
00:00:00.156645 IP 10.0.0.1 > 10.0.0.9: ICMP echo request, id 1167, seq 18, length 64
00:00:00.167654 IP 10.0.0.1 > 10.0.0.9: ICMP echo request, id 1167, seq 19, length 64
00:00:00.180879 IP 10.0.0.1 > 10.0.0.9: ICMP echo request, id 1167, seq 20, length 64
00:00:00.191586 IP 10.0.0.1 > 10.0.0.9: ICMP echo request, id 1167, seq 21, length 64
00:00:00.208198 IP 10.0.0.1 > 10.0.0.9: ICMP echo request, id 1167, seq 22, length 64
00:00:00.224332 IP 10.0.0.1 > 10.0.0.9: ICMP echo request, id 1167, seq 23, length 64
00:00:00.235555 IP 10.0.0.1 > 10.0.0.9: ICMP echo request, id 1167, seq 24, length 64
00:00:00.247776 IP 10.0.0.1 > 10.0.0.9: ICMP echo request, id 1167, seq 25, length 64
00:00:00.259572 IP 10.0.0.1 > 10.0.0.9: ICMP echo request, id 1167, seq 26, length 64
00:00:00.276140 IP 10.0.0.1 > 10.0.0.9: ICMP echo request, id 1167, seq 27, length 64
00:00:00.288322 IP 10.0.0.1 > 10.0.0.9: ICMP echo request, id 1167, seq 28, length 64
00:00:00.301060 IP 10.0.0.1 > 10.0.0.9: ICMP echo request, id 1167, seq 29, length 64
00:00:00.313794 IP 10.0.0.1 > 10.0.0.9: ICMP echo request, id 1167, seq 30, length 64
00:00:00.324518 IP 10.0.0.1 > 10.0.0.9: ICMP echo request, id 1167, seq 31, length 64
00:00:00.335553 IP 10.0.0.1 > 10.0.0.9: ICMP echo request, id 1167, seq 32, length 64
00:00:00.347524 IP 10.0.0.1 > 10.0.0.9: ICMP echo request, id 1167, seq 33, length 64
00:00:00.359723 IP 10.0.0.1 > 10.0.0.9: ICMP echo request, id 1167, seq 34, length 64
00:00:00.371943 IP 10.0.0.1 > 10.0.0.9: ICMP echo request, id 1167, seq 35, length 64
00:00:00.383690 IP 10.0.0.1 > 10.0.0.9: ICMP echo request, id 1167, seq 36, length 64
00:00:00.398366 IP 10.0.0.1 > 10.0.0.9: ICMP echo request, id 1167, seq 37, length 64
00:00:00.409557 IP 10.0.0.1 > 10.0.0.9: ICMP echo request, id 1167, seq 38, length 64
00:00:00.424778 IP 10.0.0.1 > 10.0.0.9: ICMP echo request, id 1167, seq 39, length 64
00:00:00.440416 IP 10.0.0.1 > 10.0.0.9: ICMP echo request, id 1167, seq 40, length 64
00:00:00.451595 IP 10.0.0.1 > 10.0.0.9: ICMP echo request, id 1167, seq 41, length 64
00:00:00.463848 IP 10.0.0.1 > 10.0.0.9: ICMP echo request, id 1167, seq 42, length 64
00:00:00.475598 IP 10.0.0.1 > 10.0.0.9: ICMP echo request, id 1167, seq 43, length 64
00:00:00.492735 IP 10.0.0.1 > 10.0.0.9: ICMP echo request, id 1167, seq 44, length 64
00:00:00.503512 IP 10.0.0.1 > 10.0.0.9: ICMP echo request, id 1167, seq 45, length 64
00:00:00.519594 IP 10.0.0.1 > 10.0.0.9: ICMP echo request, id 1167, seq 46, length 64
00:00:00.531826 IP 10.0.0.1 > 10.0.0.9: ICMP echo request, id 1167, seq 47, length 64
00:00:00.543967 IP 10.0.0.1 > 10.0.0.9: ICMP echo request, id 1167, seq 48, length 64
00:00:00.555765 IP 10.0.0.1 > 10.0.0.9: ICMP echo request, id 1167, seq 49, length 64
00:00:00.567538 IP 10.0.0.1 > 10.0.0.9: ICMP echo request, id 1167, seq 50, length 64
00:00:00.579701 IP 10.0.0.1 > 10.0.0.9: ICMP echo request, id 1167, seq 51, length 64
00:00:00.591920 IP 10.0.0.1 > 10.0.0.9: ICMP echo request, id 1167, seq 52, length 64
00:00:00.604642 IP 10.0.0.1 > 10.0.0.9: ICMP echo request, id 1167, seq 53, length 64
00:00:00.615858 IP 10.0.0.1 > 10.0.0.9: ICMP echo request, id 1167, seq 54, length 64
00:00:00.631114 IP 10.0.0.1 > 10.0.0.9: ICMP echo request, id 1167, seq 55, length 64
00:00:00.641093 IP 10.0.0.1 > 10.0.0.9: ICMP echo request, id 1167, seq 56, length 64
00:00:00.651600 IP 10.0.0.1 > 10.0.0.9: ICMP echo request, id 1167, seq 57, length 64
00:00:00.668173 IP 10.0.0.1 > 10.0.0.9: ICMP echo request, id 1167, seq 58, length 64
00:00:00.679905 IP 10.0.0.1 > 10.0.0.9: ICMP echo request, id 1167, seq 59, length 64
00:00:00.691670 IP 10.0.0.1 > 10.0.0.9: ICMP echo request, id 1167, seq 60, length 64
00:00:00.704314 IP 10.0.0.1 > 10.0.0.9: ICMP echo request, id 1167, seq 61, length 64
00:00:00.716550 IP 10.0.0.1 > 10.0.0.9: ICMP echo request, id 1167, seq 62, length 64
00:00:00.728309 IP 10.0.0.1 > 10.0.0.9: ICMP echo request, id 1167, seq 63, length 64
00:00:00.743466 IP 10.0.0.1 > 10.0.0.9: ICMP echo request, id 1167, seq 64, length 64
00:00:00.758139 IP 10.0.0.1 > 10.0.0.9: ICMP echo request, id 1167, seq 65, length 64
00:00:00.768132 IP 10.0.0.1 > 10.0.0.9: ICMP echo request, id 1167, seq 66, length 64
00:00:00.779615 IP 10.0.0.1 > 10.0.0.9: ICMP echo request, id 1167, seq 67, length 64
00:00:00.796274 IP 10.0.0.1 > 10.0.0.9: ICMP echo request, id 1167, seq 68, length 64
00:00:00.807503 IP 10.0.0.1 > 10.0.0.9: ICMP echo request, id 1167, seq 69, length 64
00:00:00.822695 IP 10.0.0.1 > 10.0.0.9: ICMP echo request, id 1167, seq 70, length 64
00:00:00.832680 IP 10.0.0.1 > 10.0.0.9: ICMP echo request, id 1167, seq 71, length 64
00:00:00.843658 IP 10.0.0.1 > 10.0.0.9: ICMP echo request, id 1167, seq 72, length 64
00:00:00.855888 IP 10.0.0.1 > 10.0.0.9: ICMP echo request, id 1167, seq 73, length 64
00:00:00.867626 IP 10.0.0.1 > 10.0.0.9: ICMP echo request, id 1167, seq 74, length 64
00:00:00.881295 IP 10.0.0.1 > 10.0.0.9: ICMP echo request, id 1167, seq 75, length 64
