00:00:00.000000 IP 10.0.0.1 > 10.0.0.9: ICMP echo request, id 2205, seq 6, length 64
00:00:00.013419 IP 10.0.0.1 > 10.0.0.9: ICMP echo request, id 2205, seq 7, length 64
00:00:00.023420 IP 10.0.0.1 > 10.0.0.9: ICMP echo request, id 2205, seq 8, length 64
00:00:00.034910 IP 10.0.0.1 > 10.0.0.9: ICMP echo request, id 2205, seq 9, length 64
00:00:00.047632 IP 10.0.0.1 > 10.0.0.9: ICMP echo request, id 2205, seq 10, length 64
00:00:00.058418 IP 10.0.0.1 > 10.0.0.9: ICMP echo request, id 2205, seq 11, length 64
00:00:00.070616 IP 10.0.0.1 > 10.0.0.9: ICMP echo request, id 2205, seq 12, length 64
00:00:00.082348 IP 10.0.0.1 > 10.0.0.9: ICMP echo request, id 2205, seq 13, length 64
00:00:00.095539 IP 10.0.0.1 > 10.0.0.9: ICMP echo request, id 2205, seq 14, length 64
00:00:00.106342 IP 10.0.0.1 > 10.0.0.9: ICMP echo request, id 2205, seq 15, length 64
00:00:00.118540 IP 10.0.0.1 > 10.0.0.9: ICMP echo request, id 2205, seq 16, length 64
00:00:00.130787 IP 10.0.0.1 > 10.0.0.9: ICMP echo request, id 2205, seq 17, length 64
00:00:00.142951 IP 10.0.0.1 > 10.0.0.9: ICMP echo request, id 2205, seq 18, length 64
00:00:00.158140 IP 10.0.0.1 > 10.0.0.9: ICMP echo request, id 2205, seq 19, length 64
00:00:00.168133 IP 10.0.0.1 > 10.0.0.9: ICMP echo request, id 2205, seq 20, length 64
00:00:00.178345 IP 10.0.0.1 > 10.0.0.9: ICMP echo request, id 2205, seq 21, length 64
00:00:00.190830 IP 10.0.0.1 > 10.0.0.9: ICMP echo request, id 2205, seq 22, length 64
00:00:00.203071 IP 10.0.0.1 > 10.0.0.9: ICMP echo request, id 2205, seq 23, length 64
00:00:00.215882 IP 10.0.0.1 > 10.0.0.9: ICMP echo request, id 2205, seq 24, length 64
00:00:00.227984 IP 10.0.0.1 > 10.0.0.9: ICMP echo request, id 2205, seq 25, length 64
00:00:00.239740 IP 10.0.0.1 > 10.0.0.9: ICMP echo request, id 2205, seq 26, length 64
00:00:00.250500 IP 10.0.0.1 > 10.0.0.9: ICMP echo request, id 2205, seq 27, length 64
00:00:00.264211 IP 10.0.0.1 > 10.0.0.9: ICMP echo request, id 2205, seq 28, length 64
00:00:00.274962 IP 10.0.0.1 > 10.0.0.9: ICMP echo request, id 2205, seq 29, length 64
00:00:00.286445 IP 10.0.0.1 > 10.0.0.9: ICMP echo request, id 2205, seq 30, length 64
00:00:00.299454 IP 10.0.0.1 > 10.0.0.9: ICMP echo request, id 2205, seq 31, length 64
00:00:00.311196 IP 10.0.0.1 > 10.0.0.9: ICMP echo request, id 2205, seq 32, length 64
00:00:00.327300 IP 10.0.0.1 > 10.0.0.9: ICMP echo request, id 2205, seq 33, length 64
00:00:00.338485 IP 10.0.0.1 > 10.0.0.9: ICMP echo request, id 2205, seq 34, length 64
00:00:00.352688 IP 10.0.0.1 > 10.0.0.9: ICMP echo request, id 2205, seq 35, length 64
00:00:00.364441 IP 10.0.0.1 > 10.0.0.9: ICMP echo request, id 2205, seq 36, length 64
00:00:00.375163 IP 10.0.0.1 > 10.0.0.9: ICMP echo request, id 2205, seq 37, length 64
00:00:00.386335 IP 10.0.0.1 > 10.0.0.9: ICMP echo request, id 2205, seq 38, length 64
00:00:00.398395 IP 10.0.0.1 > 10.0.0.9: ICMP echo request, id 2205, seq 39, length 64
00:00:00.410362 IP 10.0.0.1 > 10.0.0.9: ICMP echo request, id 2205, seq 40, length 64
00:00:00.423065 IP 10.0.0.1 > 10.0.0.9: ICMP echo request, id 2205, seq 41, length 64
00:00:00.437249 IP 10.0.0.1 > 10.0.0.9: ICMP echo request, id 2205, seq 42, length 64
00:00:00.448025 IP 10.0.0.1 > 10.0.0.9: ICMP echo request, id 2205, seq 43, length 64
00:00:00.458780 IP 10.0.0.1 > 10.0.0.9: ICMP echo request, id 2205, seq 44, length 64
00:00:00.470462 IP 10.0.0.1 > 10.0.0.9: ICMP echo request, id 2205, seq 45, length 64
00:00:00.483710 IP 10.0.0.1 > 10.0.0.9: ICMP echo request, id 2205, seq 46, length 64
00:00:00.494386 IP 10.0.0.1 > 10.0.0.9: ICMP echo request, id 2205, seq 47, length 64
00:00:00.511087 IP 10.0.0.1 > 10.0.0.9: ICMP echo request, id 2205, seq 48, length 64
00:00:00.524264 IP 10.0.0.1 > 10.0.0.9: ICMP echo request, id 2205, seq 49, length 64
00:00:00.537958 IP 10.0.0.1 > 10.0.0.9: ICMP echo request, id 2205, seq 50, length 64
00:00:00.548716 IP 10.0.0.1 > 10.0.0.9: ICMP echo request, id 2205, seq 51, length 64
00:00:00.558962 IP 10.0.0.1 > 10.0.0.9: ICMP echo request, id 2205, seq 52, length 64
00:00:00.573111 IP 10.0.0.1 > 10.0.0.9: ICMP echo request, id 2205, seq 53, length 64
00:00:00.583106 IP 10.0.0.1 > 10.0.0.9: ICMP echo request, id 2205, seq 54, length 64
00:00:00.594723 IP 10.0.0.1 > 10.0.0.9: ICMP echo request, id 2205, seq 55, length 64
00:00:00.606854 IP 10.0.0.1 > 10.0.0.9: ICMP echo request, id 2205, seq 56, length 64
00:00:00.620061 IP 10.0.0.1 > 10.0.0.9: ICMP echo request, id 2205, seq 57, length 64
00:00:00.632798 IP 10.0.0.1 > 10.0.0.9: ICMP echo request, id 2205, seq 58, length 64
00:00:00.642795 IP 10.0.0.1 > 10.0.0.9: ICMP echo request, id 2205, seq 59, length 64
00:00:00.654342 IP 10.0.0.1 > 10.0.0.9: ICMP echo request, id 2205, seq 60, length 64
00:00:00.667478 IP 10.0.0.1 > 10.0.0.9: ICMP echo request, id 2205, seq 61, length 64
00:00:00.678733 IP 10.0.0.1 > 10.0.0.9: ICMP echo request, id 2205, seq 62, length 64
00:00:00.690442 IP 10.0.0.1 > 10.0.0.9: ICMP echo request, id 2205, seq 63, length 64
00:00:00.702680 IP 10.0.0.1 > 10.0.0.9: ICMP echo request, id 2205, seq 64, length 64
00:00:00.715463 IP 10.0.0.1 > 10.0.0.9: ICMP echo request, id 2205, seq 65, length 64
00:00:00.727599 IP 10.0.0.1 > 10.0.0.9: ICMP echo request, id 2205, seq 66, length 64
00:00:00.739316 IP 10.0.0.1 > 10.0.0.9: ICMP echo request, id 2205, seq 67, length 64
00:00:00.753010 IP 10.0.0.1 > 10.0.0.9: ICMP echo request, id 2205, seq 68, length 64
00:00:00.764267 IP 10.0.0.1 > 10.0.0.9: ICMP echo request, id 2205, seq 69, length 64
00:00:00.776544 IP 10.0.0.1 > 10.0.0.9: ICMP echo request, id 2205, seq 70, length 64
00:00:00.787237 IP 10.0.0.1 > 10.0.0.9: ICMP echo request, id 2205, seq 71, length 64
00:00:00.800928 IP 10.0.0.1 > 10.0.0.9: ICMP echo request, id 2205, seq 72, length 64
00:00:00.813641 IP 10.0.0.1 > 10.0.0.9: ICMP echo request, id 2205, seq 73, length 64
00:00:00.824402 IP 10.0.0.1 > 10.0.0.9: ICMP echo request, id 2205, seq 74, length 64
00:00:00.834650 IP 10.0.0.1 > 10.0.0.9: ICMP echo request, id 2205, seq 75, length 64
00:00:00.846850 IP 10.0.0.1 > 10.0.0.9: ICMP echo request, id 2205, seq 76, length 64
00:00:00.859102 IP 10.0.0.1 > 10.0.0.9: ICMP echo request, id 2205, seq 77, length 64
00:00:00.871282 IP 10.0.0.1 > 10.0.0.9: ICMP echo request, id 2205, seq 78, length 64
00:00:00.882588 IP 10.0.0.1 > 10.0.0.9: ICMP echo request, id 2205, seq 79, length 64
00:00:00.896204 IP 10.0.0.1 > 10.0.0.9: ICMP echo request, id 2205, seq 80, length 64
00:00:00.907953 IP 10.0.0.1 > 10.0.0.9: ICMP echo request, id 2205, seq 81, length 64
00:00:00.918759 IP 10.0.0.1 > 10.0.0.9: ICMP echo request, id 2205, seq 82, length 64
00:00:00.930426 IP 10.0.0.1 > 10.0.0.9: ICMP echo request, id 2205, seq 83, length 64
00:00:00.942343 IP 10.0.0.1 > 10.0.0.9: ICMP echo request, id 2205, seq 84, length 64
00:00:00.954414 IP 10.0.0.1 > 10.0.0.9: ICMP echo request, id 2205, seq 85, length 64
00:00:00.971488 IP 10.0.0.1 > 10.0.0.9: ICMP echo request, id 2205, seq 86, length 64
00:00:00.987134 IP 10.0.0.1 > 10.0.0.9: ICMP echo request, id 2205, seq 87, length 64
00:00:00.999873 IP 10.0.0.1 > 10.0.0.9: ICMP echo request, id 2205, seq 88, length 64
00:00:01.013562 IP 10.0.0.1 > 10.0.0.9: ICMP echo request, id 2205, seq 89, length 64
00:00:01.024273 IP 10.0.0.1 > 10.0.0.9: ICMP echo request, id 2205, seq 90, length 64
00:00:01.038994 IP 10.0.0.1 > 10.0.0.9: ICMP echo request, id 2205, seq 91, length 64
00:00:01.050664 IP 10.0.0.1 > 10.0.0.9: ICMP echo request, id 2205, seq 92, length 64
00:00:01.062897 IP 10.0.0.1 > 10.0.0.9: ICMP echo request, id 2205, seq 93, length 64
00:00:01.076859 IP 10.0.0.1 > 10.0.0.9: ICMP echo request, id 2205, seq 94, length 64
00:00:01.087312 IP 10.0.0.1 > 10.0.0.9: ICMP echo request, id 2205, seq 95, length 64
00:00:01.100512 IP 10.0.0.1 > 10.0.0.9: ICMP echo request, id 2205, seq 96, length 64
00:00:01.111760 IP 10.0.0.1 > 10.0.0.9: ICMP echo request, id 2205, seq 97, length 64
00:00:01.124455 IP 10.0.0.1 > 10.0.0.9: ICMP echo request, id 2205, seq 98, length 64
00:00:01.134716 IP 10.0.0.1 > 10.0.0.9: ICMP echo request, id 2205, seq 99, length 64
00:00:01.146432 IP 10.0.0.1 > 10.0.0.9: ICMP echo request, id 2205, seq 100, length 64
00:00:01.160609 IP 10.0.0.1 > 10.0.0.9: ICMP echo request, id 2205, seq 101, length 64
00:00:01.170607 IP 10.0.0.1 > 10.0.0.9: ICMP echo request, id 2205, seq 102, length 64
00:00:01.187495 IP 10.0.0.1 > 10.0.0.9: ICMP echo request, id 2205, seq 103, length 64
00:00:01.199732 IP 10.0.0.1 > 10.0.0.9: ICMP echo request, id 2205, seq 104, length 64
00:00:01.210527 IP 10.0.0.1 > 10.0.0.9: ICMP echo request, id 2205, seq 105, length 64
00:00:01.223724 IP 10.0.0.1 > 10.0.0.9: ICMP echo request, id 2205, seq 106, length 64
00:00:01.238978 IP 10.0.0.1 > 10.0.0.9: ICMP echo request, id 2205, seq 107, length 64
00:00:01.253057 IP 10.0.0.1 > 10.0.0.9: ICMP echo request, id 2205, seq 108, length 64
00:00:01.263037 IP 10.0.0.1 > 10.0.0.9: ICMP echo request, id 2205, seq 109, length 64
00:00:01.276535 IP 10.0.0.1 > 10.0.0.9: ICMP echo request, id 2205, seq 110, length 64
00:00:01.286823 IP 10.0.0.1 > 10.0.0.9: ICMP echo request, id 2205, seq 111, length 64
00:00:01.302425 IP 10.0.0.1 > 10.0.0.9: ICMP echo request, id 2205, seq 112, length 64
00:00:01.314637 IP 10.0.0.1 > 10.0.0.9: ICMP echo request, id 2205, seq 113, length 64
00:00:01.326330 IP 10.0.0.1 > 10.0.0.9: ICMP echo request, id 2205, seq 114, length 64
00:00:01.340033 IP 10.0.0.1 > 10.0.0.9: ICMP echo request, id 2205, seq 115, length 64
00:00:01.350778 IP 10.0.0.1 > 10.0.0.9: ICMP echo request, id 2205, seq 116, length 64
00:00:01.362512 IP 10.0.0.1 > 10.0.0.9: ICMP echo request, id 2205, seq 117, length 64
00:00:01.376176 IP 10.0.0.1 > 10.0.0.9: ICMP echo request, id 2205, seq 118, length 64
00:00:01.388456 IP 10.0.0.1 > 10.0.0.9: ICMP echo request, id 2205, seq 119, length 64
00:00:01.399202 IP 10.0.0.1 > 10.0.0.9: ICMP echo request, id 2205, seq 120, length 64
00:00:01.414833 IP 10.0.0.1 > 10.0.0.9: ICMP echo request, id 2205, seq 121, length 64
00:00:01.427580 IP 10.0.0.1 > 10.0.0.9: ICMP echo request, id 2205, seq 122, length 64
00:00:01.438762 IP 10.0.0.1 > 10.0.0.9: ICMP echo request, id 2205, seq 123, length 64
00:00:01.451017 IP 10.0.0.1 > 10.0.0.9: ICMP echo request, id 2205, seq 124, length 64
00:00:01.462796 IP 10.0.0.1 > 10.0.0.9: ICMP echo request, id 2205, seq 125, length 64
00:00:01.477410 IP 10.0.0.1 > 10.0.0.9: ICMP echo request, id 2205, seq 126, length 64
00:00:01.488184 IP 10.0.0.1 > 10.0.0.9: ICMP echo request, id 2205, seq 127, length 64
00:00:01.498442 IP 10.0.0.1 > 10.0.0.9: ICMP echo request, id 2205, seq 128, length 64
00:00:01.510653 IP 10.0.0.1 > 10.0.0.9: ICMP echo request, id 2205, seq 129, length 64
00:00:01.522435 IP 10.0.0.1 > 10.0.0.9: ICMP echo request, id 2205, seq 130, length 64
00:00:01.534602 IP 10.0.0.1 > 10.0.0.9: ICMP echo request, id 2205, seq 131, length 64
00:00:01.546318 IP 10.0.0.1 > 10.0.0.9: ICMP echo request, id 2205, seq 132, length 64
00:00:01.558669 IP 10.0.0.1 > 10.0.0.9: ICMP echo request, id 2205, seq 133, length 64
00:00:01.570324 IP 10.0.0.1 > 10.0.0.9: ICMP echo request, id 2205, seq 134, length 64
00:00:01.582567 IP 10.0.0.1 > 10.0.0.9: ICMP echo request, id 2205, seq 135, length 64
00:00:01.599633 IP 10.0.0.1 > 10.0.0.9: ICMP echo request, id 2205, seq 136, length 64
00:00:01.610347 IP 10.0.0.1 > 10.0.0.9: ICMP echo request, id 2205, seq 137, length 64
00:00:01.622604 IP 10.0.0.1 > 10.0.0.9: ICMP echo request, id 2205, seq 138, length 64
00:00:01.636751 IP 10.0.0.1 > 10.0.0.9: ICMP echo request, id 2205, seq 139, length 64
00:00:01.647123 IP 10.0.0.1 > 10.0.0.9: ICMP echo request, id 2205, seq 140, length 64
00:00:01.658310 IP 10.0.0.1 > 10.0.0.9: ICMP echo request, id 2205, seq 141, length 64
00:00:01.671925 IP 10.0.0.1 > 10.0.0.9: ICMP echo request, id 2205, seq 142, length 64
00:00:01.682755 IP 10.0.0.1 > 10.0.0.9: ICMP echo request, id 2205, seq 143, length 64
00:00:01.698391 IP 10.0.0.1 > 10.0.0.9: ICMP echo request, id 2205, seq 144, length 64
00:00:01.711087 IP 10.0.0.1 > 10.0.0.9: ICMP echo request, id 2205, seq 145, length 64
00:00:01.725302 IP 10.0.0.1 > 10.0.0.9: ICMP echo request, id 2205, seq 146, length 64
00:00:01.735299 IP 10.0.0.1 > 10.0.0.9: ICMP echo request, id 2205, seq 147, length 64
00:00:01.746790 IP 10.0.0.1 > 10.0.0.9: ICMP echo request, id 2205, seq 148, length 64
00:00:01.759011 IP 10.0.0.1 > 10.0.0.9: ICMP echo request, id 2205, seq 149, length 64
00:00:01.772225 IP 10.0.0.1 > 10.0.0.9: ICMP echo request, id 2205, seq 150, length 64
00:00:01.782512 IP 10.0.0.1 > 10.0.0.9: ICMP echo request, id 2205, seq 151, length 64
00:00:01.794366 IP 10.0.0.1 > 10.0.0.9: ICMP echo request, id 2205, seq 152, length 64
00:00:01.806961 IP 10.0.0.1 > 10.0.0.9: ICMP echo request, id 2205, seq 153, length 64
00:00:01.818674 IP 10.0.0.1 > 10.0.0.9: ICMP echo request, id 2205, seq 154, length 64
00:00:01.830374 IP 10.0.0.1 > 10.0.0.9: ICMP echo request, id 2205, seq 155, length 64
00:00:01.842691 IP 10.0.0.1 > 10.0.0.9: ICMP echo request, id 2205, seq 156, length 64
00:00:01.855723 IP 10.0.0.1 > 10.0.0.9: ICMP echo request, id 2205, seq 157, length 64
00:00:01.866505 IP 10.0.0.1 > 10.0.0.9: ICMP echo request, id 2205, seq 158, length 64
00:00:01.878343 IP 10.0.0.1 > 10.0.0.9: ICMP echo request, id 2205, seq 159, length 64
00:00:01.890471 IP 10.0.0.1 > 10.0.0.9: ICMP echo request, id 2205, seq 160, length 64
00:00:01.902695 IP 10.0.0.1 > 10.0.0.9: ICMP echo request, id 2205, seq 161, length 64
00:00:01.914420 IP 10.0.0.1 > 10.0.0.9: ICMP echo request, id 2205, seq 162, length 64
00:00:01.926669 IP 10.0.0.1 > 10.0.0.9: ICMP echo request, id 2205, seq 163, length 64
00:00:02.278499 IP 10.0.0.1 > 10.0.0.9: ICMP echo request, id 2205, seq 191, length 64
00:00:02.280015 IP 10.0.0.1 > 10.0.0.9: ICMP echo request, id 2205, seq 192, length 64
00:00:02.290142 IP 10.0.0.1 > 10.0.0.9: ICMP echo request, id 2205, seq 193, length 64
00:00:02.300405 IP 10.0.0.1 > 10.0.0.9: ICMP echo request, id 2205, seq 194, length 64
00:00:02.309141 IP 10.0.0.1 > 10.0.0.9: ICMP echo request, id 2205, seq 195, length 64
00:00:02.319141 IP 10.0.0.1 > 10.0.0.9: ICMP echo request, id 2205, seq 196, length 64
00:00:02.330836 IP 10.0.0.1 > 10.0.0.9: ICMP echo request, id 2205, seq 197, length 64
00:00:02.343573 IP 10.0.0.1 > 10.0.0.9: ICMP echo request, id 2205, seq 198, length 64
00:00:02.354802 IP 10.0.0.1 > 10.0.0.9: ICMP echo request, id 2205, seq 199, length 64
00:00:02.366867 IP 10.0.0.1 > 10.0.0.9: ICMP echo request, id 2205, seq 200, length 64
00:00:02.378321 IP 10.0.0.1 > 10.0.0.9: ICMP echo request, id 2205, seq 201, length 64
00:00:02.390476 IP 10.0.0.1 > 10.0.0.9: ICMP echo request, id 2205, seq 202, length 64
00:00:02.402699 IP 10.0.0.1 > 10.0.0.9: ICMP echo request, id 2205, seq 203, length 64
00:00:02.415007 IP 10.0.0.1 > 10.0.0.9: ICMP echo request, id 2205, seq 204, length 64
00:00:02.428168 IP 10.0.0.1 > 10.0.0.9: ICMP echo request, id 2205, seq 205, length 64
00:00:02.438912 IP 10.0.0.1 > 10.0.0.9: ICMP echo request, id 2205, seq 206, length 64
00:00:02.450346 IP 10.0.0.1 > 10.0.0.9: ICMP echo request, id 2205, seq 207, length 64
00:00:02.462900 IP 10.0.0.1 > 10.0.0.9: ICMP echo request, id 2205, seq 208, length 64
00:00:02.478517 IP 10.0.0.1 > 10.0.0.9: ICMP echo request, id 2205, seq 209, length 64
00:00:02.490759 IP 10.0.0.1 > 10.0.0.9: ICMP echo request, id 2205, seq 210, length 64
00:00:02.502436 IP 10.0.0.1 > 10.0.0.9: ICMP echo request, id 2205, seq 211, length 64
00:00:02.514692 IP 10.0.0.1 > 10.0.0.9: ICMP echo request, id 2205, seq 212, length 64
00:00:02.526884 IP 10.0.0.1 > 10.0.0.9: ICMP echo request, id 2205, seq 213, length 64
00:00:02.539115 IP 10.0.0.1 > 10.0.0.9: ICMP echo request, id 2205, seq 214, length 64
00:00:02.550424 IP 10.0.0.1 > 10.0.0.9: ICMP echo request, id 2205, seq 215, length 64
00:00:02.562562 IP 10.0.0.1 > 10.0.0.9: ICMP echo request, id 2205, seq 216, length 64
00:00:02.577236 IP 10.0.0.1 > 10.0.0.9: ICMP echo request, id 2205, seq 217, length 64
00:00:02.587245 IP 10.0.0.1 > 10.0.0.9: ICMP echo request, id 2205, seq 218, length 64
00:00:02.598329 IP 10.0.0.1 > 10.0.0.9: ICMP echo request, id 2205, seq 219, length 64
00:00:02.610486 IP 10.0.0.1 > 10.0.0.9: ICMP echo request, id 2205, seq 220, length 64
00:00:02.623178 IP 10.0.0.1 > 10.0.0.9: ICMP echo request, id 2205, seq 221, length 64
00:00:02.637324 IP 10.0.0.1 > 10.0.0.9: ICMP echo request, id 2205, seq 222, length 64
00:00:02.647328 IP 10.0.0.1 > 10.0.0.9: ICMP echo request, id 2205, seq 223, length 64
00:00:02.658348 IP 10.0.0.1 > 10.0.0.9: ICMP echo request, id 2205, seq 224, length 64
00:00:02.674060 IP 10.0.0.1 > 10.0.0.9: ICMP echo request, id 2205, seq 225, length 64
00:00:02.684061 IP 10.0.0.1 > 10.0.0.9: ICMP echo request, id 2205, seq 226, length 64
00:00:02.695982 IP 10.0.0.1 > 10.0.0.9: ICMP echo request, id 2205, seq 227, length 64
00:00:02.707749 IP 10.0.0.1 > 10.0.0.9: ICMP echo request, id 2205, seq 228, length 64
00:00:02.722882 IP 10.0.0.1 > 10.0.0.9: ICMP echo request, id 2205, seq 229, length 64
00:00:02.734626 IP 10.0.0.1 > 10.0.0.9: ICMP echo request, id 2205, seq 230, length 64
00:00:02.746855 IP 10.0.0.1 > 10.0.0.9: ICMP echo request, id 2205, seq 231, length 64
00:00:02.760050 IP 10.0.0.1 > 10.0.0.9: ICMP echo request, id 2205, seq 232, length 64
00:00:02.770315 IP 10.0.0.1 > 10.0.0.9: ICMP echo request, id 2205, seq 233, length 64
00:00:02.782586 IP 10.0.0.1 > 10.0.0.9: ICMP echo request, id 2205, seq 234, length 64
00:00:02.794324 IP 10.0.0.1 > 10.0.0.9: ICMP echo request, id 2205, seq 235, length 64
00:00:02.806491 IP 10.0.0.1 > 10.0.0.9: ICMP echo request, id 2205, seq 236, length 64
00:00:02.818710 IP 10.0.0.1 > 10.0.0.9: ICMP echo request, id 2205, seq 237, length 64
00:00:02.830423 IP 10.0.0.1 > 10.0.0.9: ICMP echo request, id 2205, seq 238, length 64
00:00:02.842630 IP 10.0.0.1 > 10.0.0.9: ICMP echo request, id 2205, seq 239, length 64
00:00:02.854860 IP 10.0.0.1 > 10.0.0.9: ICMP echo request, id 2205, seq 240, length 64
00:00:02.866600 IP 10.0.0.1 > 10.0.0.9: ICMP echo request, id 2205, seq 241, length 64
00:00:02.878448 IP 10.0.0.1 > 10.0.0.9: ICMP echo request, id 2205, seq 242, length 64
00:00:02.890573 IP 10.0.0.1 > 10.0.0.9: ICMP echo request, id 2205, seq 243, length 64
00:00:02.902794 IP 10.0.0.1 > 10.0.0.9: ICMP echo request, id 2205, seq 244, length 64
00:00:02.914494 IP 10.0.0.1 > 10.0.0.9: ICMP echo request, id 2205, seq 245, length 64
00:00:02.926322 IP 10.0.0.1 > 10.0.0.9: ICMP echo request, id 2205, seq 246, length 64
