00:00:00.000000 IP 10.0.0.1 > 10.0.0.9: ICMP echo request, id 7155, seq 5, length 64
00:00:00.012783 IP 10.0.0.1 > 10.0.0.9: ICMP echo request, id 7155, seq 6, length 64
00:00:00.024501 IP 10.0.0.1 > 10.0.0.9: ICMP echo request, id 7155, seq 7, length 64
00:00:00.036236 IP 10.0.0.1 > 10.0.0.9: ICMP echo request, id 7155, seq 8, length 64
00:00:00.051935 IP 10.0.0.1 > 10.0.0.9: ICMP echo request, id 7155, seq 9, length 64
00:00:00.067995 IP 10.0.0.1 > 10.0.0.9: ICMP echo request, id 7155, seq 10, length 64
00:00:00.084134 IP 10.0.0.1 > 10.0.0.9: ICMP echo request, id 7155, seq 11, length 64
00:00:00.096382 IP 10.0.0.1 > 10.0.0.9: ICMP echo request, id 7155, seq 12, length 64
00:00:00.111032 IP 10.0.0.1 > 10.0.0.9: ICMP echo request, id 7155, seq 13, length 64
00:00:00.121712 IP 10.0.0.1 > 10.0.0.9: ICMP echo request, id 7155, seq 14, length 64
00:00:00.132013 IP 10.0.0.1 > 10.0.0.9: ICMP echo request, id 7155, seq 15, length 64
00:00:00.145235 IP 10.0.0.1 > 10.0.0.9: ICMP echo request, id 7155, seq 16, length 64
00:00:00.156457 IP 10.0.0.1 > 10.0.0.9: ICMP echo request, id 7155, seq 17, length 64
00:00:00.169143 IP 10.0.0.1 > 10.0.0.9: ICMP echo request, id 7155, seq 18, length 64
00:00:00.180889 IP 10.0.0.1 > 10.0.0.9: ICMP echo request, id 7155, seq 19, length 64
00:00:00.194166 IP 10.0.0.1 > 10.0.0.9: ICMP echo request, id 7155, seq 20, length 64
00:00:00.204862 IP 10.0.0.1 > 10.0.0.9: ICMP echo request, id 7155, seq 21, length 64
00:00:00.216549 IP 10.0.0.1 > 10.0.0.9: ICMP echo request, id 7155, seq 22, length 64
00:00:00.231296 IP 10.0.0.1 > 10.0.0.9: ICMP echo request, id 7155, seq 23, length 64
00:00:00.241292 IP 10.0.0.1 > 10.0.0.9: ICMP echo request, id 7155, seq 24, length 64
00:00:00.252242 IP 10.0.0.1 > 10.0.0.9: ICMP echo request, id 7155, seq 25, length 64
00:00:00.263988 IP 10.0.0.1 > 10.0.0.9: ICMP echo request, id 7155, seq 26, length 64
00:00:00.276361 IP 10.0.0.1 > 10.0.0.9: ICMP echo request, id 7155, seq 27, length 64
00:00:00.290872 IP 10.0.0.1 > 10.0.0.9: ICMP echo request, id 7155, seq 28, length 64
00:00:00.301165 IP 10.0.0.1 > 10.0.0.9: ICMP echo request, id 7155, seq 29, length 64
00:00:00.311947 IP 10.0.0.1 > 10.0.0.9: ICMP echo request, id 7155, seq 30, length 64
00:00:00.325588 IP 10.0.0.1 > 10.0.0.9: ICMP echo request, id 7155, seq 31, length 64
00:00:00.336848 IP 10.0.0.1 > 10.0.0.9: ICMP echo request, id 7155, seq 32, length 64
00:00:00.349568 IP 10.0.0.1 > 10.0.0.9: ICMP echo request, id 7155, seq 33, length 64
00:00:00.360446 IP 10.0.0.1 > 10.0.0.9: ICMP echo request, id 7155, seq 34, length 64
00:00:00.372041 IP 10.0.0.1 > 10.0.0.9: ICMP echo request, id 7155, seq 35, length 64
00:00:00.384754 IP 10.0.0.1 > 10.0.0.9: ICMP echo request, id 7155, seq 36, length 64
00:00:00.395993 IP 10.0.0.1 > 10.0.0.9: ICMP echo request, id 7155, seq 37, length 64
00:00:00.410202 IP 10.0.0.1 > 10.0.0.9: ICMP echo request, id 7155, seq 38, length 64
00:00:00.421401 IP 10.0.0.1 > 10.0.0.9: ICMP echo request, id 7155, seq 39, length 64
00:00:00.432146 IP 10.0.0.1 > 10.0.0.9: ICMP echo request, id 7155, seq 40, length 64
00:00:00.447834 IP 10.0.0.1 > 10.0.0.9: ICMP echo request, id 7155, seq 41, length 64
00:00:00.457820 IP 10.0.0.1 > 10.0.0.9: ICMP echo request, id 7155, seq 42, length 64
00:00:00.468439 IP 10.0.0.1 > 10.0.0.9: ICMP echo request, id 7155, seq 43, length 64
00:00:00.480506 IP 10.0.0.1 > 10.0.0.9: ICMP echo request, id 7155, seq 44, length 64
00:00:00.494718 IP 10.0.0.1 > 10.0.0.9: ICMP echo request, id 7155, seq 45, length 64
00:00:00.505493 IP 10.0.0.1 > 10.0.0.9: ICMP echo request, id 7155, seq 46, length 64
00:00:00.516205 IP 10.0.0.1 > 10.0.0.9: ICMP echo request, id 7155, seq 47, length 64
00:00:00.531875 IP 10.0.0.1 > 10.0.0.9: ICMP echo request, id 7155, seq 48, length 64
00:00:00.541873 IP 10.0.0.1 > 10.0.0.9: ICMP echo request, id 7155, seq 49, length 64
00:00:00.552853 IP 10.0.0.1 > 10.0.0.9: ICMP echo request, id 7155, seq 50, length 64
00:00:00.565622 IP 10.0.0.1 > 10.0.0.9: ICMP echo request, id 7155, seq 51, length 64
00:00:00.576340 IP 10.0.0.1 > 10.0.0.9: ICMP echo request, id 7155, seq 52, length 64
00:00:00.587993 IP 10.0.0.1 > 10.0.0.9: ICMP echo request, id 7155, seq 53, length 64
00:00:00.600814 IP 10.0.0.1 > 10.0.0.9: ICMP echo request, id 7155, seq 54, length 64
00:00:00.612024 IP 10.0.0.1 > 10.0.0.9: ICMP echo request, id 7155, seq 55, length 64
00:00:00.625255 IP 10.0.0.1 > 10.0.0.9: ICMP echo request, id 7155, seq 56, length 64
00:00:00.636454 IP 10.0.0.1 > 10.0.0.9: ICMP echo request, id 7155, seq 57, length 64
00:00:00.650729 IP 10.0.0.1 > 10.0.0.9: ICMP echo request, id 7155, seq 58, length 64
00:00:00.660708 IP 10.0.0.1 > 10.0.0.9: ICMP echo request, id 7155, seq 59, length 64
00:00:00.672638 IP 10.0.0.1 > 10.0.0.9: ICMP echo request, id 7155, seq 60, length 64
00:00:00.687317 IP 10.0.0.1 > 10.0.0.9: ICMP echo request, id 7155, seq 61, length 64
00:00:00.699537 IP 10.0.0.1 > 10.0.0.9: ICMP echo request, id 7155, seq 62, length 64
00:00:00.710259 IP 10.0.0.1 > 10.0.0.9: ICMP echo request, id 7155, seq 63, length 64
00:00:00.721069 IP 10.0.0.1 > 10.0.0.9: ICMP echo request, id 7155, seq 64, length 64
00:00:00.733252 IP 10.0.0.1 > 10.0.0.9: ICMP echo request, id 7155, seq 65, length 64
00:00:00.747480 IP 10.0.0.1 > 10.0.0.9: ICMP echo request, id 7155, seq 66, length 64
00:00:00.757462 IP 10.0.0.1 > 10.0.0.9: ICMP echo request, id 7155, seq 67, length 64
00:00:00.768441 IP 10.0.0.1 > 10.0.0.9: ICMP echo request, id 7155, seq 68, length 64
00:00:00.780169 IP 10.0.0.1 > 10.0.0.9: ICMP echo request, id 7155, seq 69, length 64
00:00:00.791964 IP 10.0.0.1 > 10.0.0.9: ICMP echo request, id 7155, seq 70, length 64
00:00:00.805097 IP 10.0.0.1 > 10.0.0.9: ICMP echo request, id 7155, seq 71, length 64
00:00:00.816349 IP 10.0.0.1 > 10.0.0.9: ICMP echo request, id 7155, seq 72, length 64
00:00:00.828150 IP 10.0.0.1 > 10.0.0.9: ICMP echo request, id 7155, seq 73, length 64
00:00:00.841256 IP 10.0.0.1 > 10.0.0.9: ICMP echo request, id 7155, seq 74, length 64
00:00:00.852996 IP 10.0.0.1 > 10.0.0.9: ICMP echo request, id 7155, seq 75, length 64
