00:00:00.000000 IP 10.0.0.1 > 10.0.0.9: ICMP echo request, id 6104, seq 8, length 64
00:00:00.009990 IP 10.0.0.1 > 10.0.0.9: ICMP echo request, id 6104, seq 9, length 64
00:00:00.021571 IP 10.0.0.1 > 10.0.0.9: ICMP echo request, id 6104, seq 10, length 64
00:00:00.032737 IP 10.0.0.1 > 10.0.0.9: ICMP echo request, id 6104, seq 11, length 64
00:00:00.046435 IP 10.0.0.1 > 10.0.0.9: ICMP echo request, id 6104, seq 12, length 64
00:00:00.057190 IP 10.0.0.1 > 10.0.0.9: ICMP echo request, id 6104, seq 13, length 64
00:00:00.068943 IP 10.0.0.1 > 10.0.0.9: ICMP echo request, id 6104, seq 14, length 64
00:00:00.081164 IP 10.0.0.1 > 10.0.0.9: ICMP echo request, id 6104, seq 15, length 64
00:00:00.093849 IP 10.0.0.1 > 10.0.0.9: ICMP echo request, id 6104, seq 16, length 64
00:00:00.105128 IP 10.0.0.1 > 10.0.0.9: ICMP echo request, id 6104, seq 17, length 64
00:00:00.119287 IP 10.0.0.1 > 10.0.0.9: ICMP echo request, id 6104, seq 18, length 64
00:00:00.129288 IP 10.0.0.1 > 10.0.0.9: ICMP echo request, id 6104, seq 19, length 64
00:00:00.143287 IP 10.0.0.1 > 10.0.0.9: ICMP echo request, id 6104, seq 20, length 64
00:00:00.153284 IP 10.0.0.1 > 10.0.0.9: ICMP echo request, id 6104, seq 21, length 64
00:00:00.169273 IP 10.0.0.1 > 10.0.0.9: ICMP echo request, id 6104, seq 22, length 64
00:00:00.181481 IP 10.0.0.1 > 10.0.0.9: ICMP echo request, id 6104, seq 23, length 64
00:00:00.198781 IP 10.0.0.1 > 10.0.0.9: ICMP echo request, id 6104, seq 24, length 64
00:00:00.209366 IP 10.0.0.1 > 10.0.0.9: ICMP echo request, id 6104, seq 25, length 64
00:00:00.220973 IP 10.0.0.1 > 10.0.0.9: ICMP echo request, id 6104, seq 26, length 64
00:00:00.233779 IP 10.0.0.1 > 10.0.0.9: ICMP echo request, id 6104, seq 27, length 64
00:00:00.246363 IP 10.0.0.1 > 10.0.0.9: ICMP echo request, id 6104, seq 28, length 64
00:00:00.259678 IP 10.0.0.1 > 10.0.0.9: ICMP echo request, id 6104, seq 29, length 64
00:00:00.269709 IP 10.0.0.1 > 10.0.0.9: ICMP echo request, id 6104, seq 30, length 64
00:00:00.281096 IP 10.0.0.1 > 10.0.0.9: ICMP echo request, id 6104, seq 31, length 64
00:00:00.294259 IP 10.0.0.1 > 10.0.0.9: ICMP echo request, id 6104, seq 32, length 64
00:00:00.304723 IP 10.0.0.1 > 10.0.0.9: ICMP echo request, id 6104, seq 33, length 64
00:00:00.317216 IP 10.0.0.1 > 10.0.0.9: ICMP echo request, id 6104, seq 34, length 64
00:00:00.333020 IP 10.0.0.1 > 10.0.0.9: ICMP echo request, id 6104, seq 35, length 64
00:00:00.345830 IP 10.0.0.1 > 10.0.0.9: ICMP echo request, id 6104, seq 36, length 64
00:00:00.357853 IP 10.0.0.1 > 10.0.0.9: ICMP echo request, id 6104, seq 37, length 64
00:00:00.369071 IP 10.0.0.1 > 10.0.0.9: ICMP echo request, id 6104, seq 38, length 64
00:00:00.381028 IP 10.0.0.1 > 10.0.0.9: ICMP echo request, id 6104, seq 39, length 64
00:00:00.393519 IP 10.0.0.1 > 10.0.0.9: ICMP echo request, id 6104, seq 40, length 64
00:00:00.405759 IP 10.0.0.1 > 10.0.0.9: ICMP echo request, id 6104, seq 41, length 64
00:00:00.416965 IP 10.0.0.1 > 10.0.0.9: ICMP echo request, id 6104, seq 42, length 64
00:00:00.428991 IP 10.0.0.1 > 10.0.0.9: ICMP echo request, id 6104, seq 43, length 64
00:00:00.442426 IP 10.0.0.1 > 10.0.0.9: ICMP echo request, id 6104, seq 44, length 64
00:00:00.453144 IP 10.0.0.1 > 10.0.0.9: ICMP echo request, id 6104, seq 45, length 64
00:00:00.464888 IP 10.0.0.1 > 10.0.0.9: ICMP echo request, id 6104, seq 46, length 64
00:00:00.477076 IP 10.0.0.1 > 10.0.0.9: ICMP echo request, id 6104, seq 47, length 64
00:00:00.488816 IP 10.0.0.1 > 10.0.0.9: ICMP echo request, id 6104, seq 48, length 64
00:00:00.501069 IP 10.0.0.1 > 10.0.0.9: ICMP echo request, id 6104, seq 49, length 64
00:00:00.512789 IP 10.0.0.1 > 10.0.0.9: ICMP echo request, id 6104, seq 50, length 64
00:00:00.525003 IP 10.0.0.1 > 10.0.0.9: ICMP echo request, id 6104, seq 51, length 64
00:00:00.536713 IP 10.0.0.1 > 10.0.0.9: ICMP echo request, id 6104, seq 52, length 64
00:00:00.552413 IP 10.0.0.1 > 10.0.0.9: ICMP echo request, id 6104, seq 53, length 64
00:00:00.562409 IP 10.0.0.1 > 10.0.0.9: ICMP echo request, id 6104, seq 54, length 64
00:00:00.572918 IP 10.0.0.1 > 10.0.0.9: ICMP echo request, id 6104, seq 55, length 64
00:00:00.589074 IP 10.0.0.1 > 10.0.0.9: ICMP echo request, id 6104, seq 56, length 64
00:00:00.601279 IP 10.0.0.1 > 10.0.0.9: ICMP echo request, id 6104, seq 57, length 64
00:00:00.612984 IP 10.0.0.1 > 10.0.0.9: ICMP echo request, id 6104, seq 58, length 64
00:00:00.625202 IP 10.0.0.1 > 10.0.0.9: ICMP echo request, id 6104, seq 59, length 64
00:00:00.637458 IP 10.0.0.1 > 10.0.0.9: ICMP echo request, id 6104, seq 60, length 64
00:00:00.652610 IP 10.0.0.1 > 10.0.0.9: ICMP echo request, id 6104, seq 61, length 64
00:00:00.662604 IP 10.0.0.1 > 10.0.0.9: ICMP echo request, id 6104, seq 62, length 64
00:00:00.674090 IP 10.0.0.1 > 10.0.0.9: ICMP echo request, id 6104, seq 63, length 64
00:00:00.689314 IP 10.0.0.1 > 10.0.0.9: ICMP echo request, id 6104, seq 64, length 64
00:00:00.700974 IP 10.0.0.1 > 10.0.0.9: ICMP echo request, id 6104, seq 65, length 64
00:00:00.713508 IP 10.0.0.1 > 10.0.0.9: ICMP echo request, id 6104, seq 66, length 64
00:00:00.730866 IP 10.0.0.1 > 10.0.0.9: ICMP echo request, id 6104, seq 67, length 64
00:00:00.741071 IP 10.0.0.1 > 10.0.0.9: ICMP echo request, id 6104, seq 68, length 64
00:00:00.752778 IP 10.0.0.1 > 10.0.0.9: ICMP echo request, id 6104, seq 69, length 64
00:00:00.765060 IP 10.0.0.1 > 10.0.0.9: ICMP echo request, id 6104, seq 70, length 64
00:00:00.776778 IP 10.0.0.1 > 10.0.0.9: ICMP echo request, id 6104, seq 71, length 64
00:00:00.788948 IP 10.0.0.1 > 10.0.0.9: ICMP echo request, id 6104, seq 72, length 64
00:00:00.801725 IP 10.0.0.1 > 10.0.0.9: ICMP echo request, id 6104, seq 73, length 64
00:00:00.814928 IP 10.0.0.1 > 10.0.0.9: ICMP echo request, id 6104, seq 74, length 64
00:00:00.827126 IP 10.0.0.1 > 10.0.0.9: ICMP echo request, id 6104, seq 75, length 64
00:00:00.837121 IP 10.0.0.1 > 10.0.0.9: ICMP echo request, id 6104, seq 76, length 64
00:00:00.849582 IP 10.0.0.1 > 10.0.0.9: ICMP echo request, id 6104, seq 77, length 64
00:00:00.860826 IP 10.0.0.1 > 10.0.0.9: ICMP echo request, id 6104, seq 78, length 64
00:00:00.873037 IP 10.0.0.1 > 10.0.0.9: ICMP echo request, id 6104, seq 79, length 64
00:00:00.884796 IP 10.0.0.1 > 10.0.0.9: ICMP echo request, id 6104, seq 80, length 64
00:00:00.901900 IP 10.0.0.1 > 10.0.0.9: ICMP echo request, id 6104, seq 81, length 64
00:00:00.913082 IP 10.0.0.1 > 10.0.0.9: ICMP echo request, id 6104, seq 82, length 64
00:00:00.926360 IP 10.0.0.1 > 10.0.0.9: ICMP echo request, id 6104, seq 83, length 64
00:00:00.937060 IP 10.0.0.1 > 10.0.0.9: ICMP echo request, id 6104, seq 84, length 64
00:00:00.948816 IP 10.0.0.1 > 10.0.0.9: ICMP echo request, id 6104, seq 85, length 64
00:00:00.962523 IP 10.0.0.1 > 10.0.0.9: ICMP echo request, id 6104, seq 86, length 64
00:00:00.974767 IP 10.0.0.1 > 10.0.0.9: ICMP echo request, id 6104, seq 87, length 64
00:00:00.984999 IP 10.0.0.1 > 10.0.0.9: ICMP echo request, id 6104, seq 88, length 64
00:00:00.998196 IP 10.0.0.1 > 10.0.0.9: ICMP echo request, id 6104, seq 89, length 64
00:00:01.008920 IP 10.0.0.1 > 10.0.0.9: ICMP echo request, id 6104, seq 90, length 64
00:00:01.021176 IP 10.0.0.1 > 10.0.0.9: ICMP echo request, id 6104, seq 91, length 64
00:00:01.033835 IP 10.0.0.1 > 10.0.0.9: ICMP echo request, id 6104, seq 92, length 64
00:00:01.045593 IP 10.0.0.1 > 10.0.0.9: ICMP echo request, id 6104, seq 93, length 64
00:00:01.058800 IP 10.0.0.1 > 10.0.0.9: ICMP echo request, id 6104, seq 94, length 64
00:00:01.069629 IP 10.0.0.1 > 10.0.0.9: ICMP echo request, id 6104, seq 95, length 64
00:00:01.081285 IP 10.0.0.1 > 10.0.0.9: ICMP echo request, id 6104, seq 96, length 64
00:00:01.093509 IP 10.0.0.1 > 10.0.0.9: ICMP echo request, id 6104, seq 97, length 64
00:00:01.108176 IP 10.0.0.1 > 10.0.0.9: ICMP echo request, id 6104, seq 98, length 64
00:00:01.118940 IP 10.0.0.1 > 10.0.0.9: ICMP echo request, id 6104, seq 99, length 64
00:00:01.129652 IP 10.0.0.1 > 10.0.0.9: ICMP echo request, id 6104, seq 100, length 64
00:00:01.143866 IP 10.0.0.1 > 10.0.0.9: ICMP echo request, id 6104, seq 101, length 64
00:00:01.155626 IP 10.0.0.1 > 10.0.0.9: ICMP echo request, id 6104, seq 102, length 64
00:00:01.165616 IP 10.0.0.1 > 10.0.0.9: ICMP echo request, id 6104, seq 103, length 64
00:00:01.177089 IP 10.0.0.1 > 10.0.0.9: ICMP echo request, id 6104, seq 104, length 64
00:00:01.188830 IP 10.0.0.1 > 10.0.0.9: ICMP echo request, id 6104, seq 105, length 64
00:00:01.202526 IP 10.0.0.1 > 10.0.0.9: ICMP echo request, id 6104, seq 106, length 64
00:00:01.214743 IP 10.0.0.1 > 10.0.0.9: ICMP echo request, id 6104, seq 107, length 64
00:00:01.225491 IP 10.0.0.1 > 10.0.0.9: ICMP echo request, id 6104, seq 108, length 64
00:00:01.236704 IP 10.0.0.1 > 10.0.0.9: ICMP echo request, id 6104, seq 109, length 64
00:00:01.250908 IP 10.0.0.1 > 10.0.0.9: ICMP echo request, id 6104, seq 110, length 64
00:00:01.260906 IP 10.0.0.1 > 10.0.0.9: ICMP echo request, id 6104, seq 111, length 64
00:00:01.272917 IP 10.0.0.1 > 10.0.0.9: ICMP echo request, id 6104, seq 112, length 64
00:00:01.285622 IP 10.0.0.1 > 10.0.0.9: ICMP echo request, id 6104, seq 113, length 64
00:00:01.296856 IP 10.0.0.1 > 10.0.0.9: ICMP echo request, id 6104, seq 114, length 64
00:00:01.309536 IP 10.0.0.1 > 10.0.0.9: ICMP echo request, id 6104, seq 115, length 64
00:00:01.320780 IP 10.0.0.1 > 10.0.0.9: ICMP echo request, id 6104, seq 116, length 64
00:00:01.334457 IP 10.0.0.1 > 10.0.0.9: ICMP echo request, id 6104, seq 117, length 64
00:00:01.344791 IP 10.0.0.1 > 10.0.0.9: ICMP echo request, id 6104, seq 118, length 64
00:00:01.357471 IP 10.0.0.1 > 10.0.0.9: ICMP echo request, id 6104, seq 119, length 64
00:00:01.368794 IP 10.0.0.1 > 10.0.0.9: ICMP echo request, id 6104, seq 120, length 64
00:00:01.383910 IP 10.0.0.1 > 10.0.0.9: ICMP echo request, id 6104, seq 121, length 64
00:00:01.393905 IP 10.0.0.1 > 10.0.0.9: ICMP echo request, id 6104, seq 122, length 64
00:00:01.405456 IP 10.0.0.1 > 10.0.0.9: ICMP echo request, id 6104, seq 123, length 64
00:00:01.419186 IP 10.0.0.1 > 10.0.0.9: ICMP echo request, id 6104, seq 124, length 64
00:00:01.431280 IP 10.0.0.1 > 10.0.0.9: ICMP echo request, id 6104, seq 125, length 64
00:00:01.443263 IP 10.0.0.1 > 10.0.0.9: ICMP echo request, id 6104, seq 126, length 64
00:00:01.453272 IP 10.0.0.1 > 10.0.0.9: ICMP echo request, id 6104, seq 127, length 64
00:00:01.464954 IP 10.0.0.1 > 10.0.0.9: ICMP echo request, id 6104, seq 128, length 64
00:00:01.478148 IP 10.0.0.1 > 10.0.0.9: ICMP echo request, id 6104, seq 129, length 64
00:00:01.490385 IP 10.0.0.1 > 10.0.0.9: ICMP echo request, id 6104, seq 130, length 64
00:00:01.500733 IP 10.0.0.1 > 10.0.0.9: ICMP echo request, id 6104, seq 131, length 64
00:00:01.512870 IP 10.0.0.1 > 10.0.0.9: ICMP echo request, id 6104, seq 132, length 64
00:00:01.526074 IP 10.0.0.1 > 10.0.0.9: ICMP echo request, id 6104, seq 133, length 64
00:00:01.540771 IP 10.0.0.1 > 10.0.0.9: ICMP echo request, id 6104, seq 134, length 64
00:00:01.552954 IP 10.0.0.1 > 10.0.0.9: ICMP echo request, id 6104, seq 135, length 64
00:00:01.564717 IP 10.0.0.1 > 10.0.0.9: ICMP echo request, id 6104, seq 136, length 64
00:00:01.579370 IP 10.0.0.1 > 10.0.0.9: ICMP echo request, id 6104, seq 137, length 64
00:00:01.589631 IP 10.0.0.1 > 10.0.0.9: ICMP echo request, id 6104, seq 138, length 64
00:00:01.605752 IP 10.0.0.1 > 10.0.0.9: ICMP echo request, id 6104, seq 139, length 64
00:00:01.617011 IP 10.0.0.1 > 10.0.0.9: ICMP echo request, id 6104, seq 140, length 64
00:00:01.628761 IP 10.0.0.1 > 10.0.0.9: ICMP echo request, id 6104, seq 141, length 64
00:00:01.643398 IP 10.0.0.1 > 10.0.0.9: ICMP echo request, id 6104, seq 142, length 64
00:00:01.653396 IP 10.0.0.1 > 10.0.0.9: ICMP echo request, id 6104, seq 143, length 64
00:00:01.667831 IP 10.0.0.1 > 10.0.0.9: ICMP echo request, id 6104, seq 144, length 64
00:00:01.677836 IP 10.0.0.1 > 10.0.0.9: ICMP echo request, id 6104, seq 145, length 64
00:00:01.690810 IP 10.0.0.1 > 10.0.0.9: ICMP echo request, id 6104, seq 146, length 64
00:00:01.701583 IP 10.0.0.1 > 10.0.0.9: ICMP echo request, id 6104, seq 147, length 64
00:00:01.712805 IP 10.0.0.1 > 10.0.0.9: ICMP echo request, id 6104, seq 148, length 64
00:00:01.725013 IP 10.0.0.1 > 10.0.0.9: ICMP echo request, id 6104, seq 149, length 64
00:00:01.737221 IP 10.0.0.1 > 10.0.0.9: ICMP echo request, id 6104, seq 150, length 64
00:00:01.749934 IP 10.0.0.1 > 10.0.0.9: ICMP echo request, id 6104, seq 151, length 64
00:00:01.761228 IP 10.0.0.1 > 10.0.0.9: ICMP echo request, id 6104, seq 152, length 64
00:00:01.774907 IP 10.0.0.1 > 10.0.0.9: ICMP echo request, id 6104, seq 153, length 64
00:00:01.785164 IP 10.0.0.1 > 10.0.0.9: ICMP echo request, id 6104, seq 154, length 64
00:00:01.796933 IP 10.0.0.1 > 10.0.0.9: ICMP echo request, id 6104, seq 155, length 64
00:00:01.809600 IP 10.0.0.1 > 10.0.0.9: ICMP echo request, id 6104, seq 156, length 64
00:00:01.822290 IP 10.0.0.1 > 10.0.0.9: ICMP echo request, id 6104, seq 157, length 64
00:00:01.832700 IP 10.0.0.1 > 10.0.0.9: ICMP echo request, id 6104, seq 158, length 64
00:00:01.845278 IP 10.0.0.1 > 10.0.0.9: ICMP echo request, id 6104, seq 159, length 64
00:00:01.856989 IP 10.0.0.1 > 10.0.0.9: ICMP echo request, id 6104, seq 160, length 64
00:00:01.868772 IP 10.0.0.1 > 10.0.0.9: ICMP echo request, id 6104, seq 161, length 64
00:00:01.881951 IP 10.0.0.1 > 10.0.0.9: ICMP echo request, id 6104, seq 162, length 64
00:00:01.896642 IP 10.0.0.1 > 10.0.0.9: ICMP echo request, id 6104, seq 163, length 64
00:00:01.907386 IP 10.0.0.1 > 10.0.0.9: ICMP echo request, id 6104, seq 164, length 64
00:00:01.917378 IP 10.0.0.1 > 10.0.0.9: ICMP echo request, id 6104, seq 165, length 64
00:00:01.955236 IP 10.0.0.1 > 10.0.0.9: ICMP echo request, id 6104, seq 167, length 64
00:00:01.957003 IP 10.0.0.1 > 10.0.0.9: ICMP echo request, id 6104, seq 168, length 64
00:00:01.965418 IP 10.0.0.1 > 10.0.0.9: ICMP echo request, id 6104, seq 169, length 64
00:00:01.975181 IP 10.0.0.1 > 10.0.0.9: ICMP echo request, id 6104, seq 170, length 64
00:00:01.984073 IP 10.0.0.1 > 10.0.0.9: ICMP echo request, id 6104, seq 171, length 64
00:00:01.994076 IP 10.0.0.1 > 10.0.0.9: ICMP echo request, id 6104, seq 172, length 64
00:00:02.006596 IP 10.0.0.1 > 10.0.0.9: ICMP echo request, id 6104, seq 173, length 64
00:00:02.016907 IP 10.0.0.1 > 10.0.0.9: ICMP echo request, id 6104, seq 174, length 64
00:00:02.029593 IP 10.0.0.1 > 10.0.0.9: ICMP echo request, id 6104, seq 175, length 64
00:00:02.043776 IP 10.0.0.1 > 10.0.0.9: ICMP echo request, id 6104, seq 176, length 64
00:00:02.053761 IP 10.0.0.1 > 10.0.0.9: ICMP echo request, id 6104, seq 177, length 64
00:00:02.065200 IP 10.0.0.1 > 10.0.0.9: ICMP echo request, id 6104, seq 178, length 64
00:00:02.076732 IP 10.0.0.1 > 10.0.0.9: ICMP echo request, id 6104, seq 179, length 64
00:00:02.089139 IP 10.0.0.1 > 10.0.0.9: ICMP echo request, id 6104, seq 180, length 64
00:00:02.101365 IP 10.0.0.1 > 10.0.0.9: ICMP echo request, id 6104, seq 181, length 64
00:00:02.113113 IP 10.0.0.1 > 10.0.0.9: ICMP echo request, id 6104, seq 182, length 64
00:00:02.125967 IP 10.0.0.1 > 10.0.0.9: ICMP echo request, id 6104, seq 183, length 64
00:00:02.137259 IP 10.0.0.1 > 10.0.0.9: ICMP echo request, id 6104, seq 184, length 64
00:00:02.149782 IP 10.0.0.1 > 10.0.0.9: ICMP echo request, id 6104, seq 185, length 64
00:00:02.161090 IP 10.0.0.1 > 10.0.0.9: ICMP echo request, id 6104, seq 186, length 64
00:00:02.172736 IP 10.0.0.1 > 10.0.0.9: ICMP echo request, id 6104, seq 187, length 64
00:00:02.187075 IP 10.0.0.1 > 10.0.0.9: ICMP echo request, id 6104, seq 188, length 64
00:00:02.197062 IP 10.0.0.1 > 10.0.0.9: ICMP echo request, id 6104, seq 189, length 64
00:00:02.209398 IP 10.0.0.1 > 10.0.0.9: ICMP echo request, id 6104, seq 190, length 64
00:00:02.224757 IP 10.0.0.1 > 10.0.0.9: ICMP echo request, id 6104, seq 191, length 64
00:00:02.234760 IP 10.0.0.1 > 10.0.0.9: ICMP echo request, id 6104, seq 192, length 64
00:00:02.250473 IP 10.0.0.1 > 10.0.0.9: ICMP echo request, id 6104, seq 193, length 64
00:00:02.260722 IP 10.0.0.1 > 10.0.0.9: ICMP echo request, id 6104, seq 194, length 64
00:00:02.274536 IP 10.0.0.1 > 10.0.0.9: ICMP echo request, id 6104, seq 195, length 64
00:00:02.284710 IP 10.0.0.1 > 10.0.0.9: ICMP echo request, id 6104, seq 196, length 64
00:00:02.297389 IP 10.0.0.1 > 10.0.0.9: ICMP echo request, id 6104, seq 197, length 64
00:00:02.309643 IP 10.0.0.1 > 10.0.0.9: ICMP echo request, id 6104, seq 198, length 64
00:00:02.324332 IP 10.0.0.1 > 10.0.0.9: ICMP echo request, id 6104, seq 199, length 64
00:00:02.334322 IP 10.0.0.1 > 10.0.0.9: ICMP echo request, id 6104, seq 200, length 64
00:00:02.345782 IP 10.0.0.1 > 10.0.0.9: ICMP echo request, id 6104, seq 201, length 64
00:00:02.356908 IP 10.0.0.1 > 10.0.0.9: ICMP echo request, id 6104, seq 202, length 64
00:00:02.368846 IP 10.0.0.1 > 10.0.0.9: ICMP echo request, id 6104, seq 203, length 64
00:00:02.381019 IP 10.0.0.1 > 10.0.0.9: ICMP echo request, id 6104, seq 204, length 64
00:00:02.392700 IP 10.0.0.1 > 10.0.0.9: ICMP echo request, id 6104, seq 205, length 64
00:00:02.404936 IP 10.0.0.1 > 10.0.0.9: ICMP echo request, id 6104, seq 206, length 64
00:00:02.417208 IP 10.0.0.1 > 10.0.0.9: ICMP echo request, id 6104, seq 207, length 64
00:00:02.429395 IP 10.0.0.1 > 10.0.0.9: ICMP echo request, id 6104, seq 208, length 64
00:00:02.441585 IP 10.0.0.1 > 10.0.0.9: ICMP echo request, id 6104, seq 209, length 64
00:00:02.455332 IP 10.0.0.1 > 10.0.0.9: ICMP echo request, id 6104, seq 210, length 64
00:00:02.465343 IP 10.0.0.1 > 10.0.0.9: ICMP echo request, id 6104, seq 211, length 64
00:00:02.477789 IP 10.0.0.1 > 10.0.0.9: ICMP echo request, id 6104, seq 212, length 64
00:00:02.489055 IP 10.0.0.1 > 10.0.0.9: ICMP echo request, id 6104, seq 213, length 64
00:00:02.500812 IP 10.0.0.1 > 10.0.0.9: ICMP echo request, id 6104, seq 214, length 64
00:00:02.515469 IP 10.0.0.1 > 10.0.0.9: ICMP echo request, id 6104, seq 215, length 64
00:00:02.525751 IP 10.0.0.1 > 10.0.0.9: ICMP echo request, id 6104, seq 216, length 64
00:00:02.536975 IP 10.0.0.1 > 10.0.0.9: ICMP echo request, id 6104, seq 217, length 64
00:00:02.549700 IP 10.0.0.1 > 10.0.0.9: ICMP echo request, id 6104, seq 218, length 64
00:00:02.562871 IP 10.0.0.1 > 10.0.0.9: ICMP echo request, id 6104, seq 219, length 64
00:00:02.574099 IP 10.0.0.1 > 10.0.0.9: ICMP echo request, id 6104, seq 220, length 64
00:00:02.585317 IP 10.0.0.1 > 10.0.0.9: ICMP echo request, id 6104, seq 221, length 64
00:00:02.597560 IP 10.0.0.1 > 10.0.0.9: ICMP echo request, id 6104, seq 222, length 64
00:00:02.608838 IP 10.0.0.1 > 10.0.0.9: ICMP echo request, id 6104, seq 223, length 64
00:00:02.620971 IP 10.0.0.1 > 10.0.0.9: ICMP echo request, id 6104, seq 224, length 64
00:00:02.633251 IP 10.0.0.1 > 10.0.0.9: ICMP echo request, id 6104, seq 225, length 64
00:00:02.647448 IP 10.0.0.1 > 10.0.0.9: ICMP echo request, id 6104, seq 226, length 64
00:00:02.657443 IP 10.0.0.1 > 10.0.0.9: ICMP echo request, id 6104, seq 227, length 64
00:00:02.668925 IP 10.0.0.1 > 10.0.0.9: ICMP echo request, id 6104, seq 228, length 64
00:00:02.683590 IP 10.0.0.1 > 10.0.0.9: ICMP echo request, id 6104, seq 229, length 64
00:00:02.695901 IP 10.0.0.1 > 10.0.0.9: ICMP echo request, id 6104, seq 230, length 64
00:00:02.706117 IP 10.0.0.1 > 10.0.0.9: ICMP echo request, id 6104, seq 231, length 64
00:00:02.716834 IP 10.0.0.1 > 10.0.0.9: ICMP echo request, id 6104, seq 232, length 64
00:00:02.729560 IP 10.0.0.1 > 10.0.0.9: ICMP echo request, id 6104, seq 233, length 64
00:00:02.742233 IP 10.0.0.1 > 10.0.0.9: ICMP echo request, id 6104, seq 234, length 64
00:00:02.753003 IP 10.0.0.1 > 10.0.0.9: ICMP echo request, id 6104, seq 235, length 64
00:00:02.765223 IP 10.0.0.1 > 10.0.0.9: ICMP echo request, id 6104, seq 236, length 64
00:00:02.779932 IP 10.0.0.1 > 10.0.0.9: ICMP echo request, id 6104, seq 237, length 64
00:00:02.791122 IP 10.0.0.1 > 10.0.0.9: ICMP echo request, id 6104, seq 238, length 64
00:00:02.801412 IP 10.0.0.1 > 10.0.0.9: ICMP echo request, id 6104, seq 239, length 64
00:00:02.817592 IP 10.0.0.1 > 10.0.0.9: ICMP echo request, id 6104, seq 240, length 64
